    1 0.000000000  10.6.15.144 → 192.168.1.16 SSH 342 Server: Encrypted packet (len=276)
    2 0.000025687 192.168.1.16 → 10.6.15.144  TCP 66 59298 → 22 [ACK] Seq=1 Ack=277 Win=1494 Len=0 TSval=3065704 TSecr=3661802
    3 0.000407213  10.6.15.144 → 192.168.1.16 SSH 102 Server: Encrypted packet (len=36)
    4 0.000414752 192.168.1.16 → 10.6.15.144  TCP 66 59298 → 22 [ACK] Seq=1 Ack=313 Win=1494 Len=0 TSval=3065704 TSecr=3661802
    5 0.000808805  10.6.15.144 → 192.168.1.16 SSH 102 Server: Encrypted packet (len=36)
    6 0.000820405 192.168.1.16 → 10.6.15.144  TCP 66 59298 → 22 [ACK] Seq=1 Ack=349 Win=1494 Len=0 TSval=3065704 TSecr=3661968
    7 0.002456826 192.168.1.16 → 10.6.15.144  SSH 138 Client: Encrypted packet (len=72)
    8 0.002709319 192.168.1.16 → 10.6.15.144  SSH 354 Client: Encrypted packet (len=288)
    9 0.003166873 192.168.1.16 → 10.6.15.144  SSH 138 Client: Encrypted packet (len=72)
   10 0.009957572  10.6.15.144 → 192.168.1.16 SSH 138 Server: Encrypted packet (len=72)
   11 0.013043147  10.6.15.144 → 192.168.1.16 TCP 66 22 → 59298 [ACK] Seq=421 Ack=73 Win=1452 Len=0 TSval=3662023 TSecr=3065705
   12 0.013063866 192.168.1.16 → 10.6.15.144  SSH 146 Client: Encrypted packet (len=80)
   13 0.013742154  10.6.15.144 → 192.168.1.16 SSH 102 Server: Encrypted packet (len=36)
   14 0.014963284  10.6.15.144 → 192.168.1.16 TCP 66 22 → 59298 [ACK] Seq=457 Ack=433 Win=1452 Len=0 TSval=3662023 TSecr=3065705
   15 0.015405230  10.6.15.144 → 192.168.1.16 SSH 210 Server: Encrypted packet (len=144)
   16 0.015471671 192.168.1.16 → 10.6.15.144  TCP 66 59298 → 22 [ACK] Seq=513 Ack=601 Win=1494 Len=0 TSval=3065708 TSecr=3662023
   17 0.023015067  10.6.15.144 → 192.168.1.16 SSH 102 Server: Encrypted packet (len=36)
   18 0.065507137 192.168.1.16 → 10.6.15.144  TCP 66 59298 → 22 [ACK] Seq=513 Ack=637 Win=1494 Len=0 TSval=3065721 TSecr=3662026
   19 0.998467660  10.6.15.144 → 192.168.1.16 SSH 102 Server: Encrypted packet (len=36)
   20 0.998494685 192.168.1.16 → 10.6.15.144  TCP 66 59298 → 22 [ACK] Seq=513 Ack=673 Win=1494 Len=0 TSval=3065954 TSecr=3662130
   21 0.998801368  10.6.15.144 → 192.168.1.16 SSH 102 Server: Encrypted packet (len=36)
   22 0.998807765 192.168.1.16 → 10.6.15.144  TCP 66 59298 → 22 [ACK] Seq=513 Ack=709 Win=1494 Len=0 TSval=3065954 TSecr=3662132
   23 0.998837745 192.168.1.16 → 10.6.15.144  SSH 174 Client: Encrypted packet (len=108)
   24 0.999158393 192.168.1.16 → 10.6.15.144  SSH 158 Client: Encrypted packet (len=92)
   25 1.008798669  10.6.15.144 → 192.168.1.16 TCP 66 22 → 59298 [ACK] Seq=709 Ack=713 Win=1452 Len=0 TSval=3662272 TSecr=3065954
   26 2.015670975  10.6.15.144 → 192.168.1.16 SSH 1514 Server: Encrypted packet (len=1448)
   27 2.016100714  10.6.15.144 → 192.168.1.16 SSH 742 Server: Encrypted packet (len=676)
   28 2.016117941 192.168.1.16 → 10.6.15.144  TCP 66 59298 → 22 [ACK] Seq=713 Ack=2833 Win=1494 Len=0 TSval=3066208 TSecr=3662378
   29 2.016505807  10.6.15.144 → 192.168.1.16 SSH 270 Server: Encrypted packet (len=204)
   30 2.026519746  10.6.15.144 → 192.168.1.16 SSH 1178 Server: Encrypted packet (len=1112)
   31 2.026587842 192.168.1.16 → 10.6.15.144  TCP 66 59298 → 22 [ACK] Seq=713 Ack=4149 Win=1494 Len=0 TSval=3066211 TSecr=3662381
   32 2.027452465 192.168.1.16 → 10.6.15.144  SSH 182 Client: Encrypted packet (len=116)
   33 2.028998837 192.168.1.16 → 10.6.15.144  SSH 214 Client: Encrypted packet (len=148)
   34 2.031352983 192.168.1.16 → 10.6.15.144  SSH 230 Client: Encrypted packet (len=164)
   35 2.037921194  10.6.15.144 → 192.168.1.16 TCP 66 22 → 59298 [ACK] Seq=4149 Ack=977 Win=1452 Len=0 TSval=3662530 TSecr=3066211
   36 2.037942880 192.168.1.16 → 10.6.15.144  SSH 598 Client: Encrypted packet (len=532)
   37 2.047205477  10.6.15.144 → 192.168.1.16 TCP 66 22 → 59298 [ACK] Seq=4149 Ack=1673 Win=1452 Len=0 TSval=3662532 TSecr=3066212
   38 2.408182114 192.168.1.16 → 10.6.15.144  SSH 182 Client: Encrypted packet (len=116)
   39 2.429854123 192.168.1.16 → 10.6.15.144  SSH 102 Client: Encrypted packet (len=36)
   40 2.440234761  10.6.15.144 → 192.168.1.16 TCP 66 22 → 59298 [ACK] Seq=4149 Ack=1825 Win=1452 Len=0 TSval=3662630 TSecr=3066306
   41 2.457266407  10.6.15.144 → 192.168.1.16 SSH 342 Server: Encrypted packet (len=276)
   42 2.461052202  10.6.15.144 → 192.168.1.16 SSH 166 Server: Encrypted packet (len=100)
   43 2.461085426  10.6.15.144 → 192.168.1.16 SSH 318 Server: Encrypted packet (len=252)
   44 2.461137131 192.168.1.16 → 10.6.15.144  TCP 66 59298 → 22 [ACK] Seq=1825 Ack=4777 Win=1494 Len=0 TSval=3066319 TSecr=3662635
   45 2.461421570 192.168.1.16 → 10.6.15.144  SSH 134 Client: Encrypted packet (len=68)
   46 2.471619993  10.6.15.144 → 192.168.1.16 SSH 1514 Server: Encrypted packet (len=1448)
   47 2.471636538  10.6.15.144 → 192.168.1.16 SSH 110 Server: Encrypted packet (len=44)
   48 2.471644281 192.168.1.16 → 10.6.15.144  TCP 66 59298 → 22 [ACK] Seq=1893 Ack=6269 Win=1494 Len=0 TSval=3066322 TSecr=3662638
   49 2.471788764  10.6.15.144 → 192.168.1.16 SSH 1446 Server: Encrypted packet (len=1380)
   50 2.494335531 192.168.1.16 → 10.6.15.144  SSH 138 Client: Encrypted packet (len=72)
   51 2.494585377 192.168.1.16 → 10.6.15.144  SSH 138 Client: Encrypted packet (len=72)
   52 2.496574151 192.168.1.16 → 10.6.15.144  SSH 118 Client: Encrypted packet (len=52)
   53 2.496812884 192.168.1.16 → 10.6.15.144  SSH 110 Client: Encrypted packet (len=44)
   54 2.504332307  10.6.15.144 → 192.168.1.16 TCP 66 22 → 59298 [ACK] Seq=7649 Ack=2037 Win=1452 Len=0 TSval=3662646 TSecr=3066328
   55 2.504356720 192.168.1.16 → 10.6.15.144  SSH 102 Client: Encrypted packet (len=36)
   56 2.504373632  10.6.15.144 → 192.168.1.16 SSH 102 Server: Encrypted packet (len=36)
   57 2.504824482  10.6.15.144 → 192.168.1.16 SSH 102 Server: Encrypted packet (len=36)
   58 2.504864879 192.168.1.16 → 10.6.15.144  TCP 66 59298 → 22 [ACK] Seq=2169 Ack=7721 Win=1494 Len=0 TSval=3066330 TSecr=3662646
   59 2.507528513  10.6.15.144 → 192.168.1.16 TCP 66 22 → 59298 [ACK] Seq=7721 Ack=2133 Win=1452 Len=0 TSval=3662647 TSecr=3066328
   60 2.552843892  10.6.15.144 → 192.168.1.16 TCP 66 22 → 59298 [ACK] Seq=7721 Ack=2169 Win=1452 Len=0 TSval=3662659 TSecr=3066330
   61 2.693234604 192.168.1.16 → 192.168.1.1  DNS 81 Standard query 0x8624 A 1.ubuntu.pool.ntp.org
   62 2.695133795  10.6.15.144 → 192.168.1.16 SSH 1514 Server: Encrypted packet (len=1448)
   63 2.695255411  10.6.15.144 → 192.168.1.16 SSH 1514 Server: Encrypted packet (len=1448)
   64 2.695261672 192.168.1.16 → 10.6.15.144  TCP 66 59298 → 22 [ACK] Seq=2169 Ack=10617 Win=1494 Len=0 TSval=3066378 TSecr=3662686
   65 2.695446826  10.6.15.144 → 192.168.1.16 SSH 1514 Server: Encrypted packet (len=1448)
   66 2.695478129 192.168.1.16 → 10.6.15.144  SSH 174 Client: Encrypted packet (len=108)
   67 2.702104570  192.168.1.1 → 192.168.1.16 DNS 145 Standard query response 0x8624 A 1.ubuntu.pool.ntp.org A 123.108.200.124 A 139.59.21.22 A 139.59.50.38 A 13.126.37.14
   68 2.702555764 192.168.1.16 → 123.108.200.124 NTP 90 NTP Version 4, client
   69 2.703261520  10.6.15.144 → 192.168.1.16 SSH 1514 Server: Encrypted packet (len=1448)
   70 2.703281725  10.6.15.144 → 192.168.1.16 SSH 102 Server: Encrypted packet (len=36)
   71 2.703295772 192.168.1.16 → 10.6.15.144  TCP 66 59298 → 22 [ACK] Seq=2277 Ack=13549 Win=1494 Len=0 TSval=3066380 TSecr=3662696
   72 2.703830461  10.6.15.144 → 192.168.1.16 TCP 66 22 → 59298 [ACK] Seq=13549 Ack=2277 Win=1452 Len=0 TSval=3662696 TSecr=3066378
   73 2.707474395 192.168.1.16 → 10.6.15.144  SSH 134 Client: Encrypted packet (len=68)
   74 2.710062508 192.168.1.16 → 10.6.15.144  SSH 318 Client: Encrypted packet (len=252)
   75 2.712638825 10.119.73.122 → 192.168.1.16 ICMP 110 Destination unreachable (Communication administratively filtered)
   76 2.715442055  10.6.15.144 → 192.168.1.16 TCP 66 22 → 59298 [ACK] Seq=13549 Ack=2345 Win=1452 Len=0 TSval=3662699 TSecr=3066381
   77 2.718522023  10.6.15.144 → 192.168.1.16 SSH 1514 Server: Encrypted packet (len=1448)
   78 2.718704988  10.6.15.144 → 192.168.1.16 SSH 1514 Server: Encrypted packet (len=1448)
   79 2.718717783 192.168.1.16 → 10.6.15.144  TCP 66 59298 → 22 [ACK] Seq=2597 Ack=16445 Win=1494 Len=0 TSval=3066384 TSecr=3662699
   80 2.719099351  10.6.15.144 → 192.168.1.16 SSH 110 Server: Encrypted packet (len=44)
   81 2.738817479  10.6.15.144 → 192.168.1.16 SSH 1514 Server: Encrypted packet (len=1448)
   82 2.738836933 192.168.1.16 → 10.6.15.144  TCP 66 59298 → 22 [ACK] Seq=2597 Ack=17937 Win=1494 Len=0 TSval=3066389 TSecr=3662699
   83 2.738923758  10.6.15.144 → 192.168.1.16 SSH 1142 Server: Encrypted packet (len=1076)
   84 2.740063797 192.168.1.16 → 10.6.15.144  SSH 334 Client: Encrypted packet (len=268)
   85 2.742130340 192.168.1.16 → 10.6.15.144  SSH 198 Client: Encrypted packet (len=132)
   86 2.742335941 192.168.1.16 → 10.6.15.144  SSH 506 Client: Encrypted packet (len=440)
   87 2.746633560  10.6.15.144 → 192.168.1.16 SSH 254 Server: Encrypted packet (len=188)
   88 2.747011788 192.168.1.16 → 10.6.15.144  SSH 430 Client: Encrypted packet (len=364)
   89 2.749216259  10.6.15.144 → 192.168.1.16 TCP 66 22 → 59298 [ACK] Seq=19201 Ack=2997 Win=1452 Len=0 TSval=3662708 TSecr=3066389
   90 2.754060456  10.6.15.144 → 192.168.1.16 TCP 66 22 → 59298 [ACK] Seq=19201 Ack=3801 Win=1452 Len=0 TSval=3662709 TSecr=3066390
   91 2.779001724  10.6.15.144 → 192.168.1.16 SSH 230 Server: Encrypted packet (len=164)
   92 2.779296549 192.168.1.16 → 10.6.15.144  SSH 142 Client: Encrypted packet (len=76)
   93 2.784007535  10.6.15.144 → 192.168.1.16 SSH 486 Server: Encrypted packet (len=420)
   94 2.784025413  10.6.15.144 → 192.168.1.16 SSH 126 Server: Encrypted packet (len=60)
   95 2.784064323 192.168.1.16 → 10.6.15.144  TCP 66 59298 → 22 [ACK] Seq=3877 Ack=19845 Win=1494 Len=0 TSval=3066400 TSecr=3662716
   96 2.784330122 192.168.1.16 → 10.6.15.144  SSH 126 Client: Encrypted packet (len=60)
   97 2.791452099  10.6.15.144 → 192.168.1.16 SSH 446 Server: Encrypted packet (len=380)
   98 2.793097605  10.6.15.144 → 192.168.1.16 SSH 1514 Server: Encrypted packet (len=1448)
   99 2.793109336 192.168.1.16 → 10.6.15.144  TCP 66 59298 → 22 [ACK] Seq=3937 Ack=21673 Win=1494 Len=0 TSval=3066402 TSecr=3662718
  100 2.793147964  10.6.15.144 → 192.168.1.16 SSH 670 Server: Encrypted packet (len=604)
  101 2.793987389 192.168.1.16 → 10.6.15.144  SSH 118 Client: Encrypted packet (len=52)
  102 2.794558908 192.168.1.16 → 10.6.15.144  SSH 134 Client: Encrypted packet (len=68)
  103 2.801965828  10.6.15.144 → 192.168.1.16 TCP 66 22 → 59298 [ACK] Seq=22277 Ack=3989 Win=1452 Len=0 TSval=3662721 TSecr=3066400
  104 2.805214271  10.6.15.144 → 192.168.1.16 SSH 110 Server: Encrypted packet (len=44)
  105 2.805567875 192.168.1.16 → 10.6.15.144  SSH 422 Client: Encrypted packet (len=356)
  106 2.811275242  10.6.15.144 → 192.168.1.16 SSH 182 Server: Encrypted packet (len=116)
  107 2.815959568  10.6.15.144 → 192.168.1.16 SSH 222 Server: Encrypted packet (len=156)
  108 2.816015700 192.168.1.16 → 10.6.15.144  TCP 66 59298 → 22 [ACK] Seq=4413 Ack=22593 Win=1494 Len=0 TSval=3066408 TSecr=3662723
  109 2.816223125 192.168.1.16 → 10.6.15.144  SSH 134 Client: Encrypted packet (len=68)
  110 2.829273345  10.6.15.144 → 192.168.1.16 SSH 166 Server: Encrypted packet (len=100)
  111 2.835124286 192.168.1.16 → 10.6.15.144  SSH 110 Client: Encrypted packet (len=44)
  112 2.857205891  10.6.15.144 → 192.168.1.16 SSH 138 Server: Encrypted packet (len=72)
  113 2.857435706 192.168.1.16 → 10.6.15.144  SSH 102 Client: Encrypted packet (len=36)
  114 2.880665562  10.6.15.144 → 192.168.1.16 SSH 1514 Server: Encrypted packet (len=1448)
  115 2.880691242  10.6.15.144 → 192.168.1.16 SSH 110 Server: Encrypted packet (len=44)
  116 2.880701849 192.168.1.16 → 10.6.15.144  TCP 66 59298 → 22 [ACK] Seq=4561 Ack=24257 Win=1494 Len=0 TSval=3066424 TSecr=3662740
  117 2.880871248  10.6.15.144 → 192.168.1.16 SSH 1514 Server: Encrypted packet (len=1448)
  118 2.891118538  10.6.15.144 → 192.168.1.16 SSH 110 Server: Encrypted packet (len=44)
  119 2.891137683 192.168.1.16 → 10.6.15.144  TCP 66 59298 → 22 [ACK] Seq=4561 Ack=25749 Win=1494 Len=0 TSval=3066427 TSecr=3662740
  120 2.902869040  10.6.15.144 → 192.168.1.16 SSH 110 Server: Encrypted packet (len=44)
  121 2.903176367 192.168.1.16 → 10.6.15.144  SSH 166 Client: Encrypted packet (len=100)
  122 2.913594649  10.6.15.144 → 192.168.1.16 SSH 1514 Server: Encrypted packet (len=1448)
  123 2.913615818  10.6.15.144 → 192.168.1.16 SSH 110 Server: Encrypted packet (len=44)
  124 2.913623822 192.168.1.16 → 10.6.15.144  TCP 66 59298 → 22 [ACK] Seq=4661 Ack=27285 Win=1494 Len=0 TSval=3066433 TSecr=3662749
  125 2.913956308  10.6.15.144 → 192.168.1.16 SSH 1514 Server: Encrypted packet (len=1448)
  126 2.920189464  10.6.15.144 → 192.168.1.16 SSH 110 Server: Encrypted packet (len=44)
  127 2.920206295 192.168.1.16 → 10.6.15.144  TCP 66 59298 → 22 [ACK] Seq=4661 Ack=28777 Win=1494 Len=0 TSval=3066434 TSecr=3662749
  128 2.934224448  10.6.15.144 → 192.168.1.16 SSH 990 Server: Encrypted packet (len=924)
  129 2.934419662  10.6.15.144 → 192.168.1.16 SSH 1510 Server: Encrypted packet (len=1444)
  130 2.934426829 192.168.1.16 → 10.6.15.144  TCP 66 59298 → 22 [ACK] Seq=4661 Ack=31145 Win=1494 Len=0 TSval=3066438 TSecr=3662754
  131 2.934761533  10.6.15.144 → 192.168.1.16 SSH 1510 Server: Encrypted packet (len=1444)
  132 2.944643152  10.6.15.144 → 192.168.1.16 SSH 1514 Server: Encrypted packet (len=1448)
  133 2.944663089 192.168.1.16 → 10.6.15.144  TCP 66 59298 → 22 [ACK] Seq=4661 Ack=34037 Win=1494 Len=0 TSval=3066440 TSecr=3662754
  134 2.944822408  10.6.15.144 → 192.168.1.16 SSH 1514 Server: Encrypted packet (len=1448)
  135 2.954688621  10.6.15.144 → 192.168.1.16 SSH 1514 Server: Encrypted packet (len=1448)
  136 2.954705859 192.168.1.16 → 10.6.15.144  TCP 66 59298 → 22 [ACK] Seq=4661 Ack=36933 Win=1494 Len=0 TSval=3066443 TSecr=3662756
  137 2.955219818  10.6.15.144 → 192.168.1.16 SSH 1514 Server: Encrypted packet (len=1448)
  138 2.965438945  10.6.15.144 → 192.168.1.16 SSH 1514 Server: Encrypted packet (len=1448)
  139 2.965455608 192.168.1.16 → 10.6.15.144  TCP 66 59298 → 22 [ACK] Seq=4661 Ack=39829 Win=1494 Len=0 TSval=3066445 TSecr=3662759
  140 2.968983140  10.6.15.144 → 192.168.1.16 SSH 1514 Server: Encrypted packet (len=1448)
  141 2.970195378 192.168.1.16 → 10.6.15.144  SSH 150 Client: Encrypted packet (len=84)
  142 2.978306459  10.6.15.144 → 192.168.1.16 SSH 1514 Server: Encrypted packet (len=1448)
  143 2.978321938  10.6.15.144 → 192.168.1.16 SSH 286 Server: Encrypted packet (len=220)
  144 2.978330515 192.168.1.16 → 10.6.15.144  TCP 66 59298 → 22 [ACK] Seq=4745 Ack=42945 Win=1494 Len=0 TSval=3066449 TSecr=3662764
  145 3.012559371  10.6.15.144 → 192.168.1.16 SSH 1514 Server: Encrypted packet (len=1448)
  146 3.012729847  10.6.15.144 → 192.168.1.16 SSH 1514 Server: Encrypted packet (len=1448)
  147 3.012741475 192.168.1.16 → 10.6.15.144  TCP 66 59298 → 22 [ACK] Seq=4745 Ack=45841 Win=1494 Len=0 TSval=3066457 TSecr=3662773
  148 3.012862587  10.6.15.144 → 192.168.1.16 SSH 110 Server: Encrypted packet (len=44)
  149 3.017057966 192.168.1.16 → 10.6.15.144  SSH 310 Client: Encrypted packet (len=244)
  150 3.018997503 192.168.1.16 → 10.6.15.144  SSH 294 Client: Encrypted packet (len=228)
  151 3.029051165  10.6.15.144 → 192.168.1.16 TCP 66 22 → 59298 [ACK] Seq=45885 Ack=5217 Win=1452 Len=0 TSval=3662777 TSecr=3066458
  152 3.050659333  10.6.15.144 → 192.168.1.16 SSH 134 Server: Encrypted packet (len=68)
  153 3.051426075  10.6.15.144 → 192.168.1.16 SSH 1022 Server: Encrypted packet (len=956)
  154 3.051455437 192.168.1.16 → 10.6.15.144  TCP 66 59298 → 22 [ACK] Seq=5217 Ack=46909 Win=1494 Len=0 TSval=3066467 TSecr=3662783
  155 3.053237058  10.6.15.144 → 192.168.1.16 SSH 134 Server: Encrypted packet (len=68)
  156 3.064323422  10.6.15.144 → 192.168.1.16 SSH 1514 Server: Encrypted packet (len=1448)
  157 3.064340475 192.168.1.16 → 10.6.15.144  TCP 66 59298 → 22 [ACK] Seq=5217 Ack=48425 Win=1494 Len=0 TSval=3066470 TSecr=3662783
  158 3.064503250  10.6.15.144 → 192.168.1.16 SSH 1514 Server: Encrypted packet (len=1448)
  159 3.073490781  10.6.15.144 → 192.168.1.16 SSH 1514 Server: Encrypted packet (len=1448)
  160 3.073513485 192.168.1.16 → 10.6.15.144  TCP 66 59298 → 22 [ACK] Seq=5217 Ack=51321 Win=1494 Len=0 TSval=3066473 TSecr=3662786
  161 3.073660393  10.6.15.144 → 192.168.1.16 SSH 1514 Server: Encrypted packet (len=1448)
  162 3.082435147  10.6.15.144 → 192.168.1.16 SSH 1514 Server: Encrypted packet (len=1448)
  163 3.082454094 192.168.1.16 → 10.6.15.144  TCP 66 59298 → 22 [ACK] Seq=5217 Ack=54217 Win=1494 Len=0 TSval=3066475 TSecr=3662789
  164 3.082616264  10.6.15.144 → 192.168.1.16 SSH 1514 Server: Encrypted packet (len=1448)
  165 3.094062904  10.6.15.144 → 192.168.1.16 SSH 1514 Server: Encrypted packet (len=1448)
  166 3.094086220 192.168.1.16 → 10.6.15.144  TCP 66 59298 → 22 [ACK] Seq=5217 Ack=57113 Win=1494 Len=0 TSval=3066478 TSecr=3662791
  167 3.094232563  10.6.15.144 → 192.168.1.16 SSH 1514 Server: Encrypted packet (len=1448)
  168 3.097129964  10.6.15.144 → 192.168.1.16 SSH 1514 Server: Encrypted packet (len=1448)
  169 3.097144892 192.168.1.16 → 10.6.15.144  TCP 66 59298 → 22 [ACK] Seq=5217 Ack=60009 Win=1494 Len=0 TSval=3066478 TSecr=3662793
  170 3.104123395  10.6.15.144 → 192.168.1.16 SSH 1514 Server: Encrypted packet (len=1448)
  171 3.106875500  10.6.15.144 → 192.168.1.16 SSH 1514 Server: Encrypted packet (len=1448)
  172 3.106890639 192.168.1.16 → 10.6.15.144  TCP 66 59298 → 22 [ACK] Seq=5217 Ack=62905 Win=1494 Len=0 TSval=3066481 TSecr=3662796
  173 3.107059423  10.6.15.144 → 192.168.1.16 SSH 1514 Server: Encrypted packet (len=1448)
  174 3.116884810  10.6.15.144 → 192.168.1.16 SSH 1514 Server: Encrypted packet (len=1448)
  175 3.116901141 192.168.1.16 → 10.6.15.144  TCP 66 59298 → 22 [ACK] Seq=5217 Ack=65801 Win=1494 Len=0 TSval=3066483 TSecr=3662797
  176 3.117066341  10.6.15.144 → 192.168.1.16 SSH 1514 Server: Encrypted packet (len=1448)
  177 3.127718364  10.6.15.144 → 192.168.1.16 SSH 1514 Server: Encrypted packet (len=1448)
  178 3.127733938 192.168.1.16 → 10.6.15.144  TCP 66 59298 → 22 [ACK] Seq=5217 Ack=68697 Win=1494 Len=0 TSval=3066486 TSecr=3662799
  179 3.127918219  10.6.15.144 → 192.168.1.16 SSH 1514 Server: Encrypted packet (len=1448)
  180 3.132920416  10.6.15.144 → 192.168.1.16 SSH 1514 Server: Encrypted packet (len=1448)
  181 3.132938224 192.168.1.16 → 10.6.15.144  TCP 66 59298 → 22 [ACK] Seq=5217 Ack=71593 Win=1494 Len=0 TSval=3066487 TSecr=3662802
  182 3.172383198  10.6.15.144 → 192.168.1.16 SSH 1514 Server: Encrypted packet (len=1448)
  183 3.175259569  10.6.15.144 → 192.168.1.16 SSH 1514 Server: Encrypted packet (len=1448)
  184 3.175268863 192.168.1.16 → 10.6.15.144  TCP 66 59298 → 22 [ACK] Seq=5217 Ack=74489 Win=1494 Len=0 TSval=3066498 TSecr=3662814
  185 3.175447344  10.6.15.144 → 192.168.1.16 SSH 1514 Server: Encrypted packet (len=1448)
  186 3.175632182  10.6.15.144 → 192.168.1.16 SSH 1514 Server: Encrypted packet (len=1448)
  187 3.175636711 192.168.1.16 → 10.6.15.144  TCP 66 59298 → 22 [ACK] Seq=5217 Ack=77385 Win=1494 Len=0 TSval=3066498 TSecr=3662814
  188 3.175978668  10.6.15.144 → 192.168.1.16 SSH 1514 Server: Encrypted packet (len=1448)
  189 3.176055688 192.168.1.16 → 10.6.15.144  SSH 102 Client: Encrypted packet (len=36)
  190 3.184465367 192.168.1.16 → 10.6.15.144  SSH 102 Client: Encrypted packet (len=36)
  191 3.191008539  10.6.15.144 → 192.168.1.16 SSH 1514 Server: Encrypted packet (len=1448)
  192 3.191191391  10.6.15.144 → 192.168.1.16 SSH 1514 Server: Encrypted packet (len=1448)
  193 3.191201102 192.168.1.16 → 10.6.15.144  TCP 66 59298 → 22 [ACK] Seq=5289 Ack=81729 Win=1494 Len=0 TSval=3066502 TSecr=3662816
  194 3.191385287  10.6.15.144 → 192.168.1.16 SSH 1514 Server: Encrypted packet (len=1448)
  195 3.191576429  10.6.15.144 → 192.168.1.16 SSH 1514 Server: Encrypted packet (len=1448)
  196 3.191582214 192.168.1.16 → 10.6.15.144  TCP 66 59298 → 22 [ACK] Seq=5289 Ack=84625 Win=1494 Len=0 TSval=3066502 TSecr=3662816
  197 3.208285173  10.6.15.144 → 192.168.1.16 SSH 1514 Server: Encrypted packet (len=1448)
  198 3.227201720  10.6.15.144 → 192.168.1.16 SSH 1514 Server: Encrypted packet (len=1448)
  199 3.227218291 192.168.1.16 → 10.6.15.144  TCP 66 59298 → 22 [ACK] Seq=5289 Ack=87521 Win=1494 Len=0 TSval=3066511 TSecr=3662821
  200 3.227515965  10.6.15.144 → 192.168.1.16 SSH 1514 Server: [TCP Previous segment not captured] , Encrypted packet (len=1448)
  201 3.227525510 192.168.1.16 → 10.6.15.144  TCP 78 [TCP Dup ACK 199#1] 59298 → 22 [ACK] Seq=5289 Ack=87521 Win=1494 Len=0 TSval=3066511 TSecr=3662821 SLE=88969 SRE=90417
  202 3.240795859  10.6.15.144 → 192.168.1.16 SSH 1514 Server: Encrypted packet (len=1448)
  203 3.240817348 192.168.1.16 → 10.6.15.144  TCP 78 [TCP Dup ACK 199#2] 59298 → 22 [ACK] Seq=5289 Ack=87521 Win=1494 Len=0 TSval=3066514 TSecr=3662821 SLE=88969 SRE=91865
  204 3.241709110  10.6.15.144 → 192.168.1.16 SSH 1514 Server: Encrypted packet (len=1448)
  205 3.241717343 192.168.1.16 → 10.6.15.144  TCP 78 [TCP Dup ACK 199#3] 59298 → 22 [ACK] Seq=5289 Ack=87521 Win=1494 Len=0 TSval=3066515 TSecr=3662821 SLE=88969 SRE=93313
  206 3.241722856  10.6.15.144 → 192.168.1.16 SSH 1514 Server: Encrypted packet (len=1448)
  207 3.241725631 192.168.1.16 → 10.6.15.144  TCP 78 [TCP Dup ACK 199#4] 59298 → 22 [ACK] Seq=5289 Ack=87521 Win=1494 Len=0 TSval=3066515 TSecr=3662821 SLE=88969 SRE=94761
  208 3.241891110  10.6.15.144 → 192.168.1.16 SSH 1514 Server: Encrypted packet (len=1448)
  209 3.241899586 192.168.1.16 → 10.6.15.144  TCP 78 [TCP Dup ACK 199#5] 59298 → 22 [ACK] Seq=5289 Ack=87521 Win=1494 Len=0 TSval=3066515 TSecr=3662821 SLE=88969 SRE=96209
  210 3.251852158  10.6.15.144 → 192.168.1.16 SSH 1514 Server: Encrypted packet (len=1448)
  211 3.251871056 192.168.1.16 → 10.6.15.144  TCP 78 [TCP Dup ACK 199#6] 59298 → 22 [ACK] Seq=5289 Ack=87521 Win=1494 Len=0 TSval=3066517 TSecr=3662821 SLE=88969 SRE=97657
  212 3.252036988  10.6.15.144 → 192.168.1.16 SSH 1514 Server: [TCP Fast Retransmission] , Encrypted packet (len=1448)
  213 3.252050250 192.168.1.16 → 10.6.15.144  TCP 66 59298 → 22 [ACK] Seq=5289 Ack=97657 Win=1432 Len=0 TSval=3066517 TSecr=3662833
  214 3.252216416  10.6.15.144 → 192.168.1.16 SSH 1514 Server: Encrypted packet (len=1448)
  215 3.252228264 192.168.1.16 → 10.6.15.144  TCP 66 59298 → 22 [ACK] Seq=5289 Ack=99105 Win=1494 Len=0 TSval=3066517 TSecr=3662833
  216 3.261498458  10.6.15.144 → 192.168.1.16 SSH 1514 Server: Encrypted packet (len=1448)
  217 3.261515746 192.168.1.16 → 10.6.15.144  TCP 66 59298 → 22 [ACK] Seq=5289 Ack=100553 Win=1494 Len=0 TSval=3066520 TSecr=3662836
  218 3.261645173  10.6.15.144 → 192.168.1.16 SSH 1514 Server: Encrypted packet (len=1448)
  219 3.261650872 192.168.1.16 → 10.6.15.144  TCP 66 59298 → 22 [ACK] Seq=5289 Ack=102001 Win=1494 Len=0 TSval=3066520 TSecr=3662836
  220 3.261862860  10.6.15.144 → 192.168.1.16 SSH 1514 Server: Encrypted packet (len=1448)
  221 3.261869249 192.168.1.16 → 10.6.15.144  TCP 66 59298 → 22 [ACK] Seq=5289 Ack=103449 Win=1494 Len=0 TSval=3066520 TSecr=3662836
  222 3.262057454  10.6.15.144 → 192.168.1.16 SSH 1514 Server: Encrypted packet (len=1448)
  223 3.262061859 192.168.1.16 → 10.6.15.144  TCP 66 59298 → 22 [ACK] Seq=5289 Ack=104897 Win=1494 Len=0 TSval=3066520 TSecr=3662836
  224 3.271394466  10.6.15.144 → 192.168.1.16 SSH 1514 Server: Encrypted packet (len=1448)
  225 3.271411735 192.168.1.16 → 10.6.15.144  TCP 66 59298 → 22 [ACK] Seq=5289 Ack=106345 Win=1494 Len=0 TSval=3066522 TSecr=3662838
  226 3.271564131  10.6.15.144 → 192.168.1.16 SSH 1514 Server: Encrypted packet (len=1448)
  227 3.271573128 192.168.1.16 → 10.6.15.144  TCP 66 59298 → 22 [ACK] Seq=5289 Ack=107793 Win=1494 Len=0 TSval=3066522 TSecr=3662838
  228 3.271764832  10.6.15.144 → 192.168.1.16 SSH 1514 Server: Encrypted packet (len=1448)
  229 3.271771625 192.168.1.16 → 10.6.15.144  TCP 66 59298 → 22 [ACK] Seq=5289 Ack=109241 Win=1494 Len=0 TSval=3066522 TSecr=3662838
  230 3.272424692  10.6.15.144 → 192.168.1.16 SSH 1514 Server: Encrypted packet (len=1448)
  231 3.272431936 192.168.1.16 → 10.6.15.144  TCP 66 59298 → 22 [ACK] Seq=5289 Ack=110689 Win=1494 Len=0 TSval=3066522 TSecr=3662838
  232 3.283142674  10.6.15.144 → 192.168.1.16 SSH 1514 Server: Encrypted packet (len=1448)
  233 3.283160122 192.168.1.16 → 10.6.15.144  TCP 66 59298 → 22 [ACK] Seq=5289 Ack=112137 Win=1494 Len=0 TSval=3066525 TSecr=3662841
  234 3.283312382  10.6.15.144 → 192.168.1.16 SSH 1514 Server: Encrypted packet (len=1448)
  235 3.283319265 192.168.1.16 → 10.6.15.144  TCP 66 59298 → 22 [ACK] Seq=5289 Ack=113585 Win=1494 Len=0 TSval=3066525 TSecr=3662841
  236 3.283511920  10.6.15.144 → 192.168.1.16 SSH 1514 Server: Encrypted packet (len=1448)
  237 3.283516507 192.168.1.16 → 10.6.15.144  TCP 66 59298 → 22 [ACK] Seq=5289 Ack=115033 Win=1494 Len=0 TSval=3066525 TSecr=3662841
  238 3.283855025  10.6.15.144 → 192.168.1.16 SSH 1514 Server: Encrypted packet (len=1448)
  239 3.283860327 192.168.1.16 → 10.6.15.144  TCP 66 59298 → 22 [ACK] Seq=5289 Ack=116481 Win=1494 Len=0 TSval=3066525 TSecr=3662841
  240 3.295762620  10.6.15.144 → 192.168.1.16 SSH 1514 Server: Encrypted packet (len=1448)
  241 3.295779716 192.168.1.16 → 10.6.15.144  TCP 66 59298 → 22 [ACK] Seq=5289 Ack=117929 Win=1494 Len=0 TSval=3066528 TSecr=3662843
  242 3.295919150  10.6.15.144 → 192.168.1.16 SSH 1514 Server: Encrypted packet (len=1448)
  243 3.296126093  10.6.15.144 → 192.168.1.16 SSH 1514 Server: Encrypted packet (len=1448)
  244 3.296131668 192.168.1.16 → 10.6.15.144  TCP 66 59298 → 22 [ACK] Seq=5289 Ack=120825 Win=1494 Len=0 TSval=3066528 TSecr=3662843
  245 3.296321497  10.6.15.144 → 192.168.1.16 SSH 1514 Server: Encrypted packet (len=1448)
  246 3.306555921  10.6.15.144 → 192.168.1.16 SSH 1514 Server: Encrypted packet (len=1448)
  247 3.306574485 192.168.1.16 → 10.6.15.144  TCP 66 59298 → 22 [ACK] Seq=5289 Ack=123721 Win=1494 Len=0 TSval=3066531 TSecr=3662843
  248 3.306712070  10.6.15.144 → 192.168.1.16 SSH 1514 Server: Encrypted packet (len=1448)
  249 3.306907154  10.6.15.144 → 192.168.1.16 SSH 1514 Server: Encrypted packet (len=1448)
  250 3.306915069 192.168.1.16 → 10.6.15.144  TCP 66 59298 → 22 [ACK] Seq=5289 Ack=126617 Win=1494 Len=0 TSval=3066531 TSecr=3662847
  251 3.307250977  10.6.15.144 → 192.168.1.16 SSH 1514 Server: Encrypted packet (len=1448)
  252 3.316507453  10.6.15.144 → 192.168.1.16 SSH 1514 Server: Encrypted packet (len=1448)
  253 3.316526166 192.168.1.16 → 10.6.15.144  TCP 66 59298 → 22 [ACK] Seq=5289 Ack=129513 Win=1494 Len=0 TSval=3066533 TSecr=3662847
  254 3.316678112  10.6.15.144 → 192.168.1.16 SSH 1514 Server: Encrypted packet (len=1448)
  255 3.317038120  10.6.15.144 → 192.168.1.16 SSH 1514 Server: Encrypted packet (len=1448)
  256 3.317043308 192.168.1.16 → 10.6.15.144  TCP 66 59298 → 22 [ACK] Seq=5289 Ack=132409 Win=1494 Len=0 TSval=3066533 TSecr=3662849
  257 3.317223956  10.6.15.144 → 192.168.1.16 SSH 1514 Server: Encrypted packet (len=1448)
  258 3.326785461  10.6.15.144 → 192.168.1.16 SSH 1514 Server: Encrypted packet (len=1448)
  259 3.326803585 192.168.1.16 → 10.6.15.144  TCP 66 59298 → 22 [ACK] Seq=5289 Ack=135305 Win=1494 Len=0 TSval=3066536 TSecr=3662849
  260 3.326943359  10.6.15.144 → 192.168.1.16 SSH 1514 Server: Encrypted packet (len=1448)
  261 3.327158642  10.6.15.144 → 192.168.1.16 SSH 1514 Server: Encrypted packet (len=1448)
  262 3.327163402 192.168.1.16 → 10.6.15.144  TCP 66 59298 → 22 [ACK] Seq=5289 Ack=138201 Win=1494 Len=0 TSval=3066536 TSecr=3662852
  263 3.327491130  10.6.15.144 → 192.168.1.16 SSH 1514 Server: Encrypted packet (len=1448)
  264 3.336732357  10.6.15.144 → 192.168.1.16 SSH 1514 Server: Encrypted packet (len=1448)
  265 3.336750811 192.168.1.16 → 10.6.15.144  TCP 66 59298 → 22 [ACK] Seq=5289 Ack=141097 Win=1494 Len=0 TSval=3066538 TSecr=3662852
  266 3.336855510  10.6.15.144 → 192.168.1.16 SSH 1514 Server: Encrypted packet (len=1448)
  267 3.337052434  10.6.15.144 → 192.168.1.16 SSH 1514 Server: Encrypted packet (len=1448)
  268 3.337061500 192.168.1.16 → 10.6.15.144  TCP 66 59298 → 22 [ACK] Seq=5289 Ack=143993 Win=1494 Len=0 TSval=3066538 TSecr=3662854
  269 3.337426665  10.6.15.144 → 192.168.1.16 SSH 1514 Server: Encrypted packet (len=1448)
  270 3.347829672  10.6.15.144 → 192.168.1.16 SSH 1514 Server: Encrypted packet (len=1448)
  271 3.347846717 192.168.1.16 → 10.6.15.144  TCP 66 59298 → 22 [ACK] Seq=5289 Ack=146889 Win=1494 Len=0 TSval=3066541 TSecr=3662854
  272 3.348011770  10.6.15.144 → 192.168.1.16 SSH 1514 Server: Encrypted packet (len=1448)
  273 3.348216806  10.6.15.144 → 192.168.1.16 SSH 1514 Server: Encrypted packet (len=1448)
  274 3.348223537 192.168.1.16 → 10.6.15.144  TCP 66 59298 → 22 [ACK] Seq=5289 Ack=149785 Win=1494 Len=0 TSval=3066541 TSecr=3662857
  275 3.348564774  10.6.15.144 → 192.168.1.16 SSH 1514 Server: Encrypted packet (len=1448)
  276 3.356939002  10.6.15.144 → 192.168.1.16 SSH 1514 Server: Encrypted packet (len=1448)
  277 3.356959921 192.168.1.16 → 10.6.15.144  TCP 66 59298 → 22 [ACK] Seq=5289 Ack=152681 Win=1494 Len=0 TSval=3066543 TSecr=3662857
  278 3.357119804  10.6.15.144 → 192.168.1.16 SSH 1514 Server: Encrypted packet (len=1448)
  279 3.357466400  10.6.15.144 → 192.168.1.16 SSH 1514 Server: Encrypted packet (len=1448)
  280 3.357470328 192.168.1.16 → 10.6.15.144  TCP 66 59298 → 22 [ACK] Seq=5289 Ack=155577 Win=1494 Len=0 TSval=3066543 TSecr=3662860
  281 3.357664114  10.6.15.144 → 192.168.1.16 SSH 1514 Server: Encrypted packet (len=1448)
  282 3.368448634  10.6.15.144 → 192.168.1.16 SSH 1514 Server: Encrypted packet (len=1448)
  283 3.368465213 192.168.1.16 → 10.6.15.144  TCP 66 59298 → 22 [ACK] Seq=5289 Ack=158473 Win=1494 Len=0 TSval=3066546 TSecr=3662860
  284 3.368762735  10.6.15.144 → 192.168.1.16 SSH 1514 Server: Encrypted packet (len=1448)
  285 3.368953751  10.6.15.144 → 192.168.1.16 SSH 1514 Server: Encrypted packet (len=1448)
  286 3.368959374 192.168.1.16 → 10.6.15.144  TCP 66 59298 → 22 [ACK] Seq=5289 Ack=161369 Win=1494 Len=0 TSval=3066546 TSecr=3662862
  287 3.369148804  10.6.15.144 → 192.168.1.16 SSH 1514 Server: Encrypted packet (len=1448)
  288 3.379655547  10.6.15.144 → 192.168.1.16 SSH 1514 Server: Encrypted packet (len=1448)
  289 3.379678653 192.168.1.16 → 10.6.15.144  TCP 66 59298 → 22 [ACK] Seq=5289 Ack=164265 Win=1494 Len=0 TSval=3066549 TSecr=3662862
  290 3.379966104  10.6.15.144 → 192.168.1.16 SSH 1514 Server: Encrypted packet (len=1448)
  291 3.380159873  10.6.15.144 → 192.168.1.16 SSH 1514 Server: Encrypted packet (len=1448)
  292 3.380168156 192.168.1.16 → 10.6.15.144  TCP 66 59298 → 22 [ACK] Seq=5289 Ack=167161 Win=1494 Len=0 TSval=3066549 TSecr=3662865
  293 3.380349051  10.6.15.144 → 192.168.1.16 SSH 1514 Server: Encrypted packet (len=1448)
  294 3.392458460  10.6.15.144 → 192.168.1.16 SSH 1514 Server: [TCP Previous segment not captured] , Encrypted packet (len=1448)
  295 3.392477204 192.168.1.16 → 10.6.15.144  TCP 78 59298 → 22 [ACK] Seq=5289 Ack=168609 Win=1494 Len=0 TSval=3066552 TSecr=3662865 SLE=170057 SRE=171505
  296 3.392647391  10.6.15.144 → 192.168.1.16 SSH 1514 Server: Encrypted packet (len=1448)
  297 3.392658169 192.168.1.16 → 10.6.15.144  TCP 78 [TCP Dup ACK 295#1] 59298 → 22 [ACK] Seq=5289 Ack=168609 Win=1494 Len=0 TSval=3066552 TSecr=3662865 SLE=170057 SRE=172953
  298 3.392832519  10.6.15.144 → 192.168.1.16 SSH 1514 Server: Encrypted packet (len=1448)
  299 3.392836799 192.168.1.16 → 10.6.15.144  TCP 78 [TCP Dup ACK 295#2] 59298 → 22 [ACK] Seq=5289 Ack=168609 Win=1494 Len=0 TSval=3066552 TSecr=3662865 SLE=170057 SRE=174401
  300 3.403695128  10.6.15.144 → 192.168.1.16 SSH 1514 Server: Encrypted packet (len=1448)
  301 3.403714985 192.168.1.16 → 10.6.15.144  TCP 78 [TCP Dup ACK 295#3] 59298 → 22 [ACK] Seq=5289 Ack=168609 Win=1494 Len=0 TSval=3066555 TSecr=3662865 SLE=170057 SRE=175849
  302 3.403875600  10.6.15.144 → 192.168.1.16 SSH 1514 Server: Encrypted packet (len=1448)
  303 3.403883550 192.168.1.16 → 10.6.15.144  TCP 78 [TCP Dup ACK 295#4] 59298 → 22 [ACK] Seq=5289 Ack=168609 Win=1494 Len=0 TSval=3066555 TSecr=3662865 SLE=170057 SRE=177297
  304 3.404064685  10.6.15.144 → 192.168.1.16 SSH 1514 Server: Encrypted packet (len=1448)
  305 3.404069509 192.168.1.16 → 10.6.15.144  TCP 78 [TCP Dup ACK 295#5] 59298 → 22 [ACK] Seq=5289 Ack=168609 Win=1494 Len=0 TSval=3066555 TSecr=3662865 SLE=170057 SRE=178745
  306 3.405026889  10.6.15.144 → 192.168.1.16 SSH 1514 Server: Encrypted packet (len=1448)
  307 3.405036014 192.168.1.16 → 10.6.15.144  TCP 78 [TCP Dup ACK 295#6] 59298 → 22 [ACK] Seq=5289 Ack=168609 Win=1494 Len=0 TSval=3066555 TSecr=3662865 SLE=170057 SRE=180193
  308 3.405212485  10.6.15.144 → 192.168.1.16 SSH 1514 Server: [TCP Fast Retransmission] , Encrypted packet (len=1448)
  309 3.405219613 192.168.1.16 → 10.6.15.144  TCP 66 59298 → 22 [ACK] Seq=5289 Ack=180193 Win=1432 Len=0 TSval=3066555 TSecr=3662871
  310 3.406241937 192.168.1.16 → 10.6.15.144  SSH 174 Client: Encrypted packet (len=108)
  311 3.407025364 192.168.1.16 → 10.6.15.144  SSH 206 Client: Encrypted packet (len=140)
  312 3.408350032 192.168.1.16 → 10.6.15.144  SSH 222 Client: Encrypted packet (len=156)
  313 3.408836418 192.168.1.16 → 10.6.15.144  SSH 682 Client: Encrypted packet (len=616)
  314 3.414599876  10.6.15.144 → 192.168.1.16 SSH 1514 Server: Encrypted packet (len=1448)
  315 3.414910672  10.6.15.144 → 192.168.1.16 SSH 1514 Server: Encrypted packet (len=1448)
  316 3.414922576 192.168.1.16 → 10.6.15.144  TCP 66 59298 → 22 [ACK] Seq=6309 Ack=183089 Win=1494 Len=0 TSval=3066558 TSecr=3662874
  317 3.416266018  10.6.15.144 → 192.168.1.16 SSH 1514 Server: Encrypted packet (len=1448)
  318 3.416447799  10.6.15.144 → 192.168.1.16 SSH 1514 Server: Encrypted packet (len=1448)
  319 3.416456740 192.168.1.16 → 10.6.15.144  TCP 66 59298 → 22 [ACK] Seq=6309 Ack=185985 Win=1494 Len=0 TSval=3066558 TSecr=3662874
  320 3.416582011  10.6.15.144 → 192.168.1.16 TCP 78 [TCP Dup ACK 197#1] 22 → 59298 [ACK] Seq=185985 Ack=5253 Win=1452 Len=0 TSval=3662874 TSecr=3066498 SLE=5289 SRE=5397
  321 3.416595346  10.6.15.144 → 192.168.1.16 TCP 78 [TCP Dup ACK 197#2] 22 → 59298 [ACK] Seq=185985 Ack=5253 Win=1452 Len=0 TSval=3662874 TSecr=3066498 SLE=5289 SRE=5537
  322 3.418471676  10.6.15.144 → 192.168.1.16 TCP 78 [TCP Dup ACK 197#3] 22 → 59298 [ACK] Seq=185985 Ack=5253 Win=1452 Len=0 TSval=3662875 TSecr=3066498 SLE=5289 SRE=5693
  323 3.418490450 192.168.1.16 → 10.6.15.144  SSH 102 Client: [TCP Fast Retransmission] , Encrypted packet (len=36)
  324 3.418997349  10.6.15.144 → 192.168.1.16 TCP 78 [TCP Dup ACK 197#4] 22 → 59298 [ACK] Seq=185985 Ack=5253 Win=1452 Len=0 TSval=3662875 TSecr=3066498 SLE=5289 SRE=6309
  325 3.426862289  10.6.15.144 → 192.168.1.16 SSH 1514 Server: Encrypted packet (len=1436)
  326 3.427047827  10.6.15.144 → 192.168.1.16 SSH 1514 Server: Encrypted packet (len=1436)
  327 3.427060510 192.168.1.16 → 10.6.15.144  TCP 66 59298 → 22 [ACK] Seq=6309 Ack=188857 Win=1494 Len=0 TSval=3066561 TSecr=3662877
  328 3.427174272  10.6.15.144 → 192.168.1.16 SSH 102 Server: Encrypted packet (len=24)
  329 3.427407404  10.6.15.144 → 192.168.1.16 SSH 1514 Server: Encrypted packet (len=1436)
  330 3.427418190 192.168.1.16 → 10.6.15.144  TCP 66 59298 → 22 [ACK] Seq=6309 Ack=190317 Win=1494 Len=0 TSval=3066561 TSecr=3662877
  331 3.427594944  10.6.15.144 → 192.168.1.16 SSH 1514 Server: Encrypted packet (len=1436)
  332 3.427602979  10.6.15.144 → 192.168.1.16 TCP 66 22 → 59298 [ACK] Seq=191753 Ack=6309 Win=1444 Len=0 TSval=3662877 TSecr=3066559
  333 3.436857807  10.6.15.144 → 192.168.1.16 SSH 90 Server: Encrypted packet (len=24)
  334 3.436879650 192.168.1.16 → 10.6.15.144  TCP 66 59298 → 22 [ACK] Seq=6309 Ack=191777 Win=1494 Len=0 TSval=3066563 TSecr=3662877
  335 3.437081320  10.6.15.144 → 192.168.1.16 SSH 1514 Server: Encrypted packet (len=1448)
  336 3.437421210  10.6.15.144 → 192.168.1.16 SSH 1514 Server: Encrypted packet (len=1448)
  337 3.437426862 192.168.1.16 → 10.6.15.144  TCP 66 59298 → 22 [ACK] Seq=6309 Ack=194673 Win=1539 Len=0 TSval=3066563 TSecr=3662879
  338 3.437618998  10.6.15.144 → 192.168.1.16 SSH 1514 Server: Encrypted packet (len=1448)
  339 3.437805744  10.6.15.144 → 192.168.1.16 SSH 1490 Server: Encrypted packet (len=1424)
  340 3.437818123 192.168.1.16 → 10.6.15.144  TCP 66 59298 → 22 [ACK] Seq=6309 Ack=197545 Win=1584 Len=0 TSval=3066564 TSecr=3662879
  341 3.447885051  10.6.15.144 → 192.168.1.16 SSH 1514 Server: Encrypted packet (len=1448)
  342 3.448091973  10.6.15.144 → 192.168.1.16 SSH 1514 Server: Encrypted packet (len=1448)
  343 3.448102958 192.168.1.16 → 10.6.15.144  TCP 66 59298 → 22 [ACK] Seq=6309 Ack=200441 Win=1629 Len=0 TSval=3066566 TSecr=3662882
  344 3.448279914  10.6.15.144 → 192.168.1.16 SSH 1514 Server: Encrypted packet (len=1448)
  345 3.448591957  10.6.15.144 → 192.168.1.16 SSH 230 Server: Encrypted packet (len=164)
  346 3.448596830 192.168.1.16 → 10.6.15.144  TCP 66 59298 → 22 [ACK] Seq=6309 Ack=202053 Win=1652 Len=0 TSval=3066566 TSecr=3662882
  347 3.462278623  10.6.15.144 → 192.168.1.16 SSH 1514 Server: Encrypted packet (len=1448)
  348 3.462484566  10.6.15.144 → 192.168.1.16 SSH 1514 Server: Encrypted packet (len=1448)
  349 3.462496577 192.168.1.16 → 10.6.15.144  TCP 66 59298 → 22 [ACK] Seq=6309 Ack=204949 Win=1697 Len=0 TSval=3066570 TSecr=3662885
  350 3.482048452  10.6.15.144 → 192.168.1.16 SSH 1514 Server: [TCP Previous segment not captured] , Encrypted packet (len=1448)
  351 3.482067721 192.168.1.16 → 10.6.15.144  TCP 78 [TCP Window Update] 59298 → 22 [ACK] Seq=6309 Ack=204949 Win=1720 Len=0 TSval=3066575 TSecr=3662885 SLE=204993 SRE=206441
  352 3.482082066  10.6.15.144 → 192.168.1.16 SSH 110 Server: Encrypted packet (len=44)
  353 3.482087838 192.168.1.16 → 10.6.15.144  TCP 78 [TCP Dup ACK 349#1] 59298 → 22 [ACK] Seq=6309 Ack=204949 Win=1720 Len=0 TSval=3066575 TSecr=3662885 SLE=204993 SRE=206485
  354 3.482406333  10.6.15.144 → 192.168.1.16 SSH 1514 Server: Encrypted packet (len=1448)
  355 3.482426659 192.168.1.16 → 10.6.15.144  TCP 78 [TCP Window Update] 59298 → 22 [ACK] Seq=6309 Ack=204949 Win=1743 Len=0 TSval=3066575 TSecr=3662885 SLE=204993 SRE=207933
  356 3.482441078  10.6.15.144 → 192.168.1.16 SSH 110 Server: Encrypted packet (len=44)
  357 3.482445231 192.168.1.16 → 10.6.15.144  TCP 78 [TCP Dup ACK 349#2] 59298 → 22 [ACK] Seq=6309 Ack=204949 Win=1743 Len=0 TSval=3066575 TSecr=3662885 SLE=204993 SRE=207977
  358 3.491630669  10.6.15.144 → 192.168.1.16 SSH 110 Server: [TCP Fast Retransmission] , Encrypted packet (len=44)
  359 3.491657338 192.168.1.16 → 10.6.15.144  TCP 66 59298 → 22 [ACK] Seq=6309 Ack=207977 Win=1743 Len=0 TSval=3066577 TSecr=3662893
  360 3.502848715  10.6.15.144 → 192.168.1.16 SSH 1514 Server: Encrypted packet (len=1448)
  361 3.502866369 192.168.1.16 → 10.6.15.144  TCP 66 59298 → 22 [ACK] Seq=6309 Ack=209425 Win=1765 Len=0 TSval=3066580 TSecr=3662896
  362 3.503020886  10.6.15.144 → 192.168.1.16 SSH 1514 Server: Encrypted packet (len=1448)
  363 3.503025123 192.168.1.16 → 10.6.15.144  TCP 66 59298 → 22 [ACK] Seq=6309 Ack=210873 Win=1788 Len=0 TSval=3066580 TSecr=3662896
  364 3.503158672  10.6.15.144 → 192.168.1.16 SSH 110 Server: Encrypted packet (len=44)
  365 3.503162393 192.168.1.16 → 10.6.15.144  TCP 66 59298 → 22 [ACK] Seq=6309 Ack=210917 Win=1788 Len=0 TSval=3066580 TSecr=3662896
  366 3.521089580  10.6.15.144 → 192.168.1.16 SSH 1514 Server: Encrypted packet (len=1448)
  367 3.521110880 192.168.1.16 → 10.6.15.144  TCP 66 59298 → 22 [ACK] Seq=6309 Ack=212365 Win=1810 Len=0 TSval=3066584 TSecr=3662900
  368 3.521123394  10.6.15.144 → 192.168.1.16 SSH 110 Server: Encrypted packet (len=44)
  369 3.521127554 192.168.1.16 → 10.6.15.144  TCP 66 59298 → 22 [ACK] Seq=6309 Ack=212409 Win=1810 Len=0 TSval=3066584 TSecr=3662900
  370 3.521848663  10.6.15.144 → 192.168.1.16 SSH 1514 Server: Encrypted packet (len=1448)
