    1 0.000000000 192.168.1.16 → 123.108.200.124 NTP 90 NTP Version 4, client
    2 0.001866716  10.6.15.144 → 192.168.1.16 SSH 102 Server: Encrypted packet (len=36)
    3 0.001885767 192.168.1.16 → 10.6.15.144  TCP 66 59298 → 22 [ACK] Seq=1 Ack=37 Win=3666 Len=0 TSval=3081127 TSecr=3677221
    4 0.002214120 192.168.1.16 → 10.6.15.144  SSH 126 Client: Encrypted packet (len=60)
    5 0.002916551  10.6.15.144 → 192.168.1.16 SSH 102 Server: [TCP Spurious Retransmission] , Encrypted packet (len=36)
    6 0.002924628 192.168.1.16 → 10.6.15.144  TCP 78 [TCP Dup ACK 3#1] 59298 → 22 [ACK] Seq=61 Ack=37 Win=3666 Len=0 TSval=3081128 TSecr=3677377 SLE=1 SRE=37
    7 0.010791061  10.6.15.144 → 192.168.1.16 TCP 66 22 → 59298 [ACK] Seq=37 Ack=61 Win=1452 Len=0 TSval=3677446 TSecr=3081128
    8 1.000041770 192.168.1.16 → 91.189.94.4  NTP 90 NTP Version 4, client
    9 1.002712833  10.6.15.144 → 192.168.1.16 SSH 366 Server: Encrypted packet (len=300)
   10 1.002731480 192.168.1.16 → 10.6.15.144  TCP 66 59298 → 22 [ACK] Seq=61 Ack=337 Win=3666 Len=0 TSval=3081378 TSecr=3677562
   11 1.002739775  10.6.15.144 → 192.168.1.16 SSH 102 Server: Encrypted packet (len=36)
   12 1.002742652 192.168.1.16 → 10.6.15.144  TCP 66 59298 → 22 [ACK] Seq=61 Ack=373 Win=3666 Len=0 TSval=3081378 TSecr=3677564
   13 1.004883223 192.168.1.16 → 10.6.15.144  SSH 102 Client: Encrypted packet (len=36)
   14 1.005088710 192.168.1.16 → 10.6.15.144  SSH 354 Client: Encrypted packet (len=288)
   15 1.005352132 192.168.1.16 → 10.6.15.144  SSH 138 Client: Encrypted packet (len=72)
   16 1.006376084 192.168.1.16 → 10.6.15.144  SSH 138 Client: Encrypted packet (len=72)
   17 1.006671265 192.168.1.16 → 10.6.15.144  SSH 102 Client: Encrypted packet (len=36)
   18 1.006851718 192.168.1.16 → 10.6.15.144  SSH 102 Client: Encrypted packet (len=36)
   19 1.013103535  10.6.15.144 → 192.168.1.16 TCP 66 22 → 59298 [ACK] Seq=373 Ack=97 Win=1452 Len=0 TSval=3677697 TSecr=3081378
   20 1.013119403 192.168.1.16 → 10.6.15.144  SSH 414 Client: Encrypted packet (len=348)
   21 1.013133405  10.6.15.144 → 192.168.1.16 TCP 66 22 → 59298 [ACK] Seq=373 Ack=385 Win=1452 Len=0 TSval=3677697 TSecr=3081378
   22 1.013137991  10.6.15.144 → 192.168.1.16 TCP 66 22 → 59298 [ACK] Seq=373 Ack=457 Win=1452 Len=0 TSval=3677697 TSecr=3081378
   23 1.013872367  10.6.15.144 → 192.168.1.16 SSH 174 Server: Encrypted packet (len=108)
   24 1.013881460  10.6.15.144 → 192.168.1.16 SSH 102 Server: Encrypted packet (len=36)
   25 1.013914198 192.168.1.16 → 10.6.15.144  TCP 66 59298 → 22 [ACK] Seq=949 Ack=517 Win=3666 Len=0 TSval=3081380 TSecr=3677697
   26 1.014617036  10.6.15.144 → 192.168.1.16 TCP 66 22 → 59298 [ACK] Seq=517 Ack=601 Win=1452 Len=0 TSval=3677697 TSecr=3081379
   27 1.014626897  10.6.15.144 → 192.168.1.16 SSH 102 Server: Encrypted packet (len=36)
   28 1.045375859  10.6.15.144 → 192.168.1.16 SSH 166 Server: Encrypted packet (len=100)
   29 1.045397886  10.6.15.144 → 192.168.1.16 SSH 138 Server: Encrypted packet (len=72)
   30 1.045450265 192.168.1.16 → 10.6.15.144  TCP 66 59298 → 22 [ACK] Seq=949 Ack=725 Win=3666 Len=0 TSval=3081388 TSecr=3677697
   31 1.045600145 192.168.1.16 → 10.6.15.144  SSH 102 Client: Encrypted packet (len=36)
   32 1.054800073  10.6.15.144 → 192.168.1.16 SSH 102 Server: Encrypted packet (len=36)
   33 1.055143171 192.168.1.16 → 10.6.15.144  SSH 158 Client: Encrypted packet (len=92)
   34 1.057720928  10.6.15.144 → 192.168.1.16 SSH 174 Server: Encrypted packet (len=108)
   35 1.058160844 192.168.1.16 → 10.6.15.144  SSH 374 Client: Encrypted packet (len=308)
   36 1.058487980 192.168.1.16 → 10.6.15.144  SSH 242 Client: Encrypted packet (len=176)
   37 1.059214085  10.6.15.144 → 192.168.1.16 SSH 102 Server: Encrypted packet (len=36)
   38 1.059557250 192.168.1.16 → 10.6.15.144  SSH 150 Client: Encrypted packet (len=84)
   39 1.067505009  10.6.15.144 → 192.168.1.16 TCP 66 22 → 59298 [ACK] Seq=905 Ack=1385 Win=1452 Len=0 TSval=3677710 TSecr=3081391
   40 1.068778476  10.6.15.144 → 192.168.1.16 TCP 66 22 → 59298 [ACK] Seq=905 Ack=1645 Win=1452 Len=0 TSval=3677711 TSecr=3081392
   41 1.103469019  10.6.15.144 → 192.168.1.16 SSH 182 Server: Encrypted packet (len=116)
   42 1.103558919  10.6.15.144 → 192.168.1.16 SSH 230 Server: Encrypted packet (len=164)
   43 1.103605330 192.168.1.16 → 10.6.15.144  TCP 66 59298 → 22 [ACK] Seq=1645 Ack=1185 Win=3666 Len=0 TSval=3081403 TSecr=3677719
   44 1.103783898 192.168.1.16 → 10.6.15.144  SSH 134 Client: Encrypted packet (len=68)
   45 1.104394843 192.168.1.16 → 10.6.15.144  SSH 134 Client: Encrypted packet (len=68)
   46 1.106361797  10.6.15.144 → 192.168.1.16 SSH 174 Server: Encrypted packet (len=108)
   47 1.106670452 192.168.1.16 → 10.6.15.144  SSH 134 Client: Encrypted packet (len=68)
   48 1.113257491  10.6.15.144 → 192.168.1.16 SSH 1514 Server: Encrypted packet (len=1448)
   49 1.113328985  10.6.15.144 → 192.168.1.16 SSH 1034 Server: Encrypted packet (len=968)
   50 1.113336163 192.168.1.16 → 10.6.15.144  TCP 66 59298 → 22 [ACK] Seq=1849 Ack=3709 Win=3666 Len=0 TSval=3081405 TSecr=3677722
   51 1.113467918  10.6.15.144 → 192.168.1.16 TCP 66 22 → 59298 [ACK] Seq=3709 Ack=1781 Win=1452 Len=0 TSval=3677722 TSecr=3081403
   52 1.113608828 192.168.1.16 → 10.6.15.144  SSH 134 Client: Encrypted packet (len=68)
   53 1.114496946 192.168.1.16 → 10.6.15.144  SSH 206 Client: Encrypted packet (len=140)
   54 1.121132072  10.6.15.144 → 192.168.1.16 TCP 66 22 → 59298 [ACK] Seq=3709 Ack=1917 Win=1452 Len=0 TSval=3677724 TSecr=3081404
   55 1.153797055  10.6.15.144 → 192.168.1.16 SSH 102 Server: Encrypted packet (len=36)
   56 1.154193106 192.168.1.16 → 10.6.15.144  SSH 374 Client: Encrypted packet (len=308)
   57 1.166768903  10.6.15.144 → 192.168.1.16 SSH 342 Server: Encrypted packet (len=276)
   58 1.210056974 192.168.1.16 → 10.6.15.144  TCP 66 59298 → 22 [ACK] Seq=2365 Ack=4021 Win=3666 Len=0 TSval=3081430 TSecr=3677735
   59 1.246780562  10.6.15.144 → 192.168.1.16 SSH 126 Server: Encrypted packet (len=60)
   60 1.246851647 192.168.1.16 → 10.6.15.144  TCP 66 59298 → 22 [ACK] Seq=2365 Ack=4081 Win=3666 Len=0 TSval=3081439 TSecr=3677755
   61 1.316781747  10.6.15.144 → 192.168.1.16 SSH 1514 Server: Encrypted packet (len=1448)
   62 1.316799694  10.6.15.144 → 192.168.1.16 SSH 414 Server: Encrypted packet (len=348)
   63 1.316807544 192.168.1.16 → 10.6.15.144  TCP 66 59298 → 22 [ACK] Seq=2365 Ack=5877 Win=3666 Len=0 TSval=3081456 TSecr=3677773
   64 1.317087306  10.6.15.144 → 192.168.1.16 SSH 1118 Server: Encrypted packet (len=1052)
   65 1.317116539 192.168.1.16 → 10.6.15.144  TCP 66 59298 → 22 [ACK] Seq=2365 Ack=6929 Win=3666 Len=0 TSval=3081456 TSecr=3677773
   66 1.318080441 192.168.1.16 → 10.6.15.144  SSH 206 Client: Encrypted packet (len=140)
   67 1.366751351  10.6.15.144 → 192.168.1.16 TCP 66 22 → 59298 [ACK] Seq=6929 Ack=2505 Win=1452 Len=0 TSval=3677785 TSecr=3081457
   68 1.441033025  10.6.15.144 → 192.168.1.16 SSH 150 Server: Encrypted packet (len=84)
   69 1.442694926  10.6.15.144 → 192.168.1.16 SSH 1514 Server: Encrypted packet (len=1448)
   70 1.442703732 192.168.1.16 → 10.6.15.144  TCP 66 59298 → 22 [ACK] Seq=2505 Ack=8461 Win=3666 Len=0 TSval=3081488 TSecr=3677803
   71 1.442849019  10.6.15.144 → 192.168.1.16 SSH 1446 Server: Encrypted packet (len=1380)
   72 1.452905742  10.6.15.144 → 192.168.1.16 SSH 1514 Server: Encrypted packet (len=1448)
   73 1.452926141 192.168.1.16 → 10.6.15.144  TCP 66 59298 → 22 [ACK] Seq=2505 Ack=11289 Win=3666 Len=0 TSval=3081490 TSecr=3677804
   74 1.453086232  10.6.15.144 → 192.168.1.16 SSH 1514 Server: Encrypted packet (len=1448)
   75 1.462251144  10.6.15.144 → 192.168.1.16 SSH 1514 Server: Encrypted packet (len=1448)
   76 1.462273963 192.168.1.16 → 10.6.15.144  TCP 66 59298 → 22 [ACK] Seq=2505 Ack=14185 Win=3666 Len=0 TSval=3081493 TSecr=3677806
   77 1.462421642  10.6.15.144 → 192.168.1.16 SSH 1446 Server: Encrypted packet (len=1380)
   78 1.470953631  10.6.15.144 → 192.168.1.16 SSH 1514 Server: Encrypted packet (len=1448)
   79 1.470972891 192.168.1.16 → 10.6.15.144  TCP 66 59298 → 22 [ACK] Seq=2505 Ack=17013 Win=3666 Len=0 TSval=3081495 TSecr=3677809
   80 1.471137640  10.6.15.144 → 192.168.1.16 SSH 1514 Server: Encrypted packet (len=1448)
   81 1.479876729  10.6.15.144 → 192.168.1.16 SSH 110 Server: Encrypted packet (len=44)
   82 1.479891801 192.168.1.16 → 10.6.15.144  TCP 66 59298 → 22 [ACK] Seq=2505 Ack=18505 Win=3666 Len=0 TSval=3081497 TSecr=3677811
   83 1.481958980  10.6.15.144 → 192.168.1.16 SSH 1514 Server: Encrypted packet (len=1448)
   84 1.489582480  10.6.15.144 → 192.168.1.16 SSH 1514 Server: Encrypted packet (len=1448)
   85 1.489605329 192.168.1.16 → 10.6.15.144  TCP 66 59298 → 22 [ACK] Seq=2505 Ack=21401 Win=3666 Len=0 TSval=3081499 TSecr=3677814
   86 1.489625721  10.6.15.144 → 192.168.1.16 SSH 378 Server: Encrypted packet (len=312)
   87 1.500338028  10.6.15.144 → 192.168.1.16 SSH 1514 Server: Encrypted packet (len=1448)
   88 1.500353330 192.168.1.16 → 10.6.15.144  TCP 66 59298 → 22 [ACK] Seq=2505 Ack=23161 Win=3666 Len=0 TSval=3081502 TSecr=3677816
   89 1.503115082  10.6.15.144 → 192.168.1.16 SSH 1514 Server: Encrypted packet (len=1448)
   90 1.512296612  10.6.15.144 → 192.168.1.16 SSH 110 Server: Encrypted packet (len=44)
   91 1.512314090 192.168.1.16 → 10.6.15.144  TCP 66 59298 → 22 [ACK] Seq=2505 Ack=24653 Win=3666 Len=0 TSval=3081505 TSecr=3677818
   92 1.514948129  10.6.15.144 → 192.168.1.16 SSH 1514 Server: Encrypted packet (len=1448)
   93 1.522796042  10.6.15.144 → 192.168.1.16 SSH 1514 Server: Encrypted packet (len=1448)
   94 1.522819287 192.168.1.16 → 10.6.15.144  TCP 66 59298 → 22 [ACK] Seq=2505 Ack=27549 Win=3666 Len=0 TSval=3081508 TSecr=3677822
   95 1.522846053  10.6.15.144 → 192.168.1.16 SSH 110 Server: Encrypted packet (len=44)
   96 1.529811440  10.6.15.144 → 192.168.1.16 SSH 1514 Server: Encrypted packet (len=1448)
   97 1.529828523 192.168.1.16 → 10.6.15.144  TCP 66 59298 → 22 [ACK] Seq=2505 Ack=29041 Win=3666 Len=0 TSval=3081509 TSecr=3677824
   98 1.531397103  10.6.15.144 → 192.168.1.16 SSH 1514 Server: Encrypted packet (len=1448)
   99 1.531414810  10.6.15.144 → 192.168.1.16 SSH 110 Server: Encrypted packet (len=44)
  100 1.531425259 192.168.1.16 → 10.6.15.144  TCP 66 59298 → 22 [ACK] Seq=2505 Ack=30533 Win=3666 Len=0 TSval=3081510 TSecr=3677826
  101 1.546455483  10.6.15.144 → 192.168.1.16 SSH 1514 Server: Encrypted packet (len=1448)
  102 1.546628521  10.6.15.144 → 192.168.1.16 SSH 1514 Server: Encrypted packet (len=1448)
  103 1.546639984 192.168.1.16 → 10.6.15.144  TCP 66 59298 → 22 [ACK] Seq=2505 Ack=33429 Win=3666 Len=0 TSval=3081514 TSecr=3677830
  104 1.546766737  10.6.15.144 → 192.168.1.16 SSH 110 Server: Encrypted packet (len=44)
  105 1.546881572 192.168.1.16 → 10.6.15.144  SSH 102 Client: Encrypted packet (len=36)
  106 1.563772844  10.6.15.144 → 192.168.1.16 SSH 1514 Server: Encrypted packet (len=1448)
  107 1.563797749  10.6.15.144 → 192.168.1.16 SSH 110 Server: [TCP Previous segment not captured] , Encrypted packet (len=44)
  108 1.563807098 192.168.1.16 → 10.6.15.144  TCP 78 59298 → 22 [ACK] Seq=2541 Ack=34921 Win=3666 Len=0 TSval=3081518 TSecr=3677834 SLE=36369 SRE=36413
  109 1.580372060  10.6.15.144 → 192.168.1.16 SSH 1514 Server: Encrypted packet (len=1448)
  110 1.580390571 192.168.1.16 → 10.6.15.144  TCP 78 [TCP Dup ACK 108#1] 59298 → 22 [ACK] Seq=2541 Ack=34921 Win=3666 Len=0 TSval=3081522 TSecr=3677834 SLE=36369 SRE=37861
  111 1.580560714  10.6.15.144 → 192.168.1.16 SSH 1514 Server: Encrypted packet (len=1448)
  112 1.580570708 192.168.1.16 → 10.6.15.144  TCP 78 [TCP Dup ACK 108#2] 59298 → 22 [ACK] Seq=2541 Ack=34921 Win=3666 Len=0 TSval=3081522 TSecr=3677834 SLE=36369 SRE=39309
  113 1.580837575  10.6.15.144 → 192.168.1.16 SSH 110 Server: Encrypted packet (len=44)
  114 1.580846742 192.168.1.16 → 10.6.15.144  TCP 78 [TCP Dup ACK 108#3] 59298 → 22 [ACK] Seq=2541 Ack=34921 Win=3666 Len=0 TSval=3081522 TSecr=3677834 SLE=36369 SRE=39353
  115 1.590923925  10.6.15.144 → 192.168.1.16 SSH 206 Server: Encrypted packet (len=140)
  116 1.590941565 192.168.1.16 → 10.6.15.144  TCP 78 [TCP Dup ACK 108#4] 59298 → 22 [ACK] Seq=2541 Ack=34921 Win=3666 Len=0 TSval=3081525 TSecr=3677834 SLE=36369 SRE=39493
  117 1.591290680  10.6.15.144 → 192.168.1.16 SSH 1514 Server: [TCP Fast Retransmission] , Encrypted packet (len=1448)
  118 1.591301962 192.168.1.16 → 10.6.15.144  TCP 66 59298 → 22 [ACK] Seq=2541 Ack=39493 Win=3666 Len=0 TSval=3081525 TSecr=3677841
  119 1.591602874 192.168.1.16 → 10.6.15.144  SSH 102 Client: Encrypted packet (len=36)
  120 1.602421835  10.6.15.144 → 192.168.1.16 SSH 1514 Server: Encrypted packet (len=1448)
  121 1.602609001  10.6.15.144 → 192.168.1.16 SSH 1514 Server: Encrypted packet (len=1448)
  122 1.602621590 192.168.1.16 → 10.6.15.144  TCP 66 59298 → 22 [ACK] Seq=2577 Ack=42389 Win=3666 Len=0 TSval=3081528 TSecr=3677843
  123 1.614932008  10.6.15.144 → 192.168.1.16 SSH 1514 Server: Encrypted packet (len=1448)
  124 1.615108258  10.6.15.144 → 192.168.1.16 SSH 1514 Server: Encrypted packet (len=1448)
  125 1.615118364 192.168.1.16 → 10.6.15.144  TCP 66 59298 → 22 [ACK] Seq=2577 Ack=45285 Win=3666 Len=0 TSval=3081531 TSecr=3677847
  126 1.615257457  10.6.15.144 → 192.168.1.16 SSH 154 Server: Encrypted packet (len=88)
  127 1.627700656  10.6.15.144 → 192.168.1.16 SSH 1514 Server: Encrypted packet (len=1448)
  128 1.627717081 192.168.1.16 → 10.6.15.144  TCP 66 59298 → 22 [ACK] Seq=2577 Ack=46821 Win=3666 Len=0 TSval=3081534 TSecr=3677847
  129 1.627884907  10.6.15.144 → 192.168.1.16 SSH 1514 Server: Encrypted packet (len=1448)
  130 1.638134648  10.6.15.144 → 192.168.1.16 SSH 110 Server: Encrypted packet (len=44)
  131 1.638154625 192.168.1.16 → 10.6.15.144  TCP 66 59298 → 22 [ACK] Seq=2577 Ack=48313 Win=3666 Len=0 TSval=3081537 TSecr=3677850
  132 1.640287483 192.168.1.16 → 10.6.15.144  SSH 102 Client: Encrypted packet (len=36)
  133 1.642288587 192.168.1.16 → 10.6.15.144  SSH 294 Client: Encrypted packet (len=228)
  134 1.643651530  10.6.15.144 → 192.168.1.16 SSH 1514 Server: Encrypted packet (len=1448)
  135 1.647764211  10.6.15.144 → 192.168.1.16 SSH 1514 Server: Encrypted packet (len=1448)
  136 1.647779101 192.168.1.16 → 10.6.15.144  TCP 66 59298 → 22 [ACK] Seq=2841 Ack=51209 Win=3666 Len=0 TSval=3081539 TSecr=3677854
  137 1.647795808  10.6.15.144 → 192.168.1.16 SSH 110 Server: Encrypted packet (len=44)
  138 1.651282016  10.6.15.144 → 192.168.1.16 TCP 66 22 → 59298 [ACK] Seq=51253 Ack=2841 Win=1452 Len=0 TSval=3677856 TSecr=3081537
  139 1.658462051  10.6.15.144 → 192.168.1.16 SSH 1514 Server: Encrypted packet (len=1448)
  140 1.658485868 192.168.1.16 → 10.6.15.144  TCP 66 59298 → 22 [ACK] Seq=2841 Ack=52701 Win=3666 Len=0 TSval=3081542 TSecr=3677855
  141 1.658640584  10.6.15.144 → 192.168.1.16 SSH 1514 Server: Encrypted packet (len=1448)
  142 1.665495689  10.6.15.144 → 192.168.1.16 SSH 110 Server: Encrypted packet (len=44)
  143 1.665511773 192.168.1.16 → 10.6.15.144  TCP 66 59298 → 22 [ACK] Seq=2841 Ack=54193 Win=3666 Len=0 TSval=3081543 TSecr=3677858
  144 1.671797084  10.6.15.144 → 192.168.1.16 SSH 1514 Server: Encrypted packet (len=1448)
  145 1.671966046  10.6.15.144 → 192.168.1.16 SSH 1514 Server: Encrypted packet (len=1448)
  146 1.671975792 192.168.1.16 → 10.6.15.144  TCP 66 59298 → 22 [ACK] Seq=2841 Ack=57089 Win=3666 Len=0 TSval=3081545 TSecr=3677862
  147 1.672100253  10.6.15.144 → 192.168.1.16 SSH 110 Server: Encrypted packet (len=44)
  148 1.677704814  10.6.15.144 → 192.168.1.16 SSH 234 Server: Encrypted packet (len=168)
  149 1.677779786 192.168.1.16 → 10.6.15.144  TCP 66 59298 → 22 [ACK] Seq=2841 Ack=57301 Win=3666 Len=0 TSval=3081546 TSecr=3677862
  150 1.678409761 192.168.1.16 → 10.6.15.144  SSH 158 Client: Encrypted packet (len=92)
  151 1.688661062  10.6.15.144 → 192.168.1.16 SSH 1514 Server: Encrypted packet (len=1448)
  152 1.688854988  10.6.15.144 → 192.168.1.16 SSH 1514 Server: Encrypted packet (len=1448)
  153 1.688864129 192.168.1.16 → 10.6.15.144  TCP 66 59298 → 22 [ACK] Seq=2933 Ack=60197 Win=3666 Len=0 TSval=3081549 TSecr=3677866
  154 1.688988121  10.6.15.144 → 192.168.1.16 SSH 110 Server: Encrypted packet (len=44)
  155 1.702728344  10.6.15.144 → 192.168.1.16 SSH 1514 Server: Encrypted packet (len=1448)
  156 1.702742579 192.168.1.16 → 10.6.15.144  TCP 66 59298 → 22 [ACK] Seq=2933 Ack=61689 Win=3666 Len=0 TSval=3081553 TSecr=3677866
  157 1.702757668  10.6.15.144 → 192.168.1.16 SSH 110 Server: Encrypted packet (len=44)
  158 1.710123210  10.6.15.144 → 192.168.1.16 SSH 1514 Server: Encrypted packet (len=1448)
  159 1.710142106 192.168.1.16 → 10.6.15.144  TCP 66 59298 → 22 [ACK] Seq=2933 Ack=63181 Win=3666 Len=0 TSval=3081555 TSecr=3677870
  160 1.710160506  10.6.15.144 → 192.168.1.16 SSH 110 Server: Encrypted packet (len=44)
  161 1.717632625  10.6.15.144 → 192.168.1.16 SSH 254 Server: Encrypted packet (len=188)
  162 1.717682472 192.168.1.16 → 10.6.15.144  TCP 66 59298 → 22 [ACK] Seq=2933 Ack=63413 Win=3666 Len=0 TSval=3081556 TSecr=3677871
  163 1.717866693 192.168.1.16 → 10.6.15.144  SSH 134 Client: Encrypted packet (len=68)
  164 1.720900268  10.6.15.144 → 192.168.1.16 SSH 1514 Server: Encrypted packet (len=1448)
  165 1.725516897  10.6.15.144 → 192.168.1.16 SSH 1514 Server: Encrypted packet (len=1448)
  166 1.725537663 192.168.1.16 → 10.6.15.144  TCP 66 59298 → 22 [ACK] Seq=3001 Ack=66309 Win=3666 Len=0 TSval=3081558 TSecr=3677874
  167 1.725558393  10.6.15.144 → 192.168.1.16 SSH 110 Server: Encrypted packet (len=44)
  168 1.738280769  10.6.15.144 → 192.168.1.16 SSH 1514 Server: Encrypted packet (len=1448)
  169 1.738301154 192.168.1.16 → 10.6.15.144  TCP 66 59298 → 22 [ACK] Seq=3001 Ack=67801 Win=3666 Len=0 TSval=3081562 TSecr=3677875
  170 1.738464600  10.6.15.144 → 192.168.1.16 SSH 1514 Server: Encrypted packet (len=1448)
  171 1.747065575  10.6.15.144 → 192.168.1.16 SSH 110 Server: Encrypted packet (len=44)
  172 1.747085914 192.168.1.16 → 10.6.15.144  TCP 66 59298 → 22 [ACK] Seq=3001 Ack=69293 Win=3666 Len=0 TSval=3081564 TSecr=3677878
  173 1.758959241  10.6.15.144 → 192.168.1.16 SSH 1514 Server: Encrypted packet (len=1448)
  174 1.759147475  10.6.15.144 → 192.168.1.16 SSH 1514 Server: Encrypted packet (len=1448)
  175 1.759160158 192.168.1.16 → 10.6.15.144  TCP 66 59298 → 22 [ACK] Seq=3001 Ack=72189 Win=3666 Len=0 TSval=3081567 TSecr=3677882
  176 1.759179269  10.6.15.144 → 192.168.1.16 SSH 110 Server: Encrypted packet (len=44)
  177 1.769026536  10.6.15.144 → 192.168.1.16 SSH 182 Server: Encrypted packet (len=116)
  178 1.769112804 192.168.1.16 → 10.6.15.144  TCP 66 59298 → 22 [ACK] Seq=3001 Ack=72349 Win=3666 Len=0 TSval=3081569 TSecr=3677882
  179 1.779236875  10.6.15.144 → 192.168.1.16 SSH 1514 Server: [TCP Previous segment not captured] , Encrypted packet (len=1448)
  180 1.779258111 192.168.1.16 → 10.6.15.144  TCP 78 [TCP Dup ACK 178#1] 59298 → 22 [ACK] Seq=3001 Ack=72349 Win=3666 Len=0 TSval=3081572 TSecr=3677882 SLE=73797 SRE=75245
  181 1.779275231  10.6.15.144 → 192.168.1.16 SSH 110 Server: Encrypted packet (len=44)
  182 1.779281233 192.168.1.16 → 10.6.15.144  TCP 78 [TCP Dup ACK 178#2] 59298 → 22 [ACK] Seq=3001 Ack=72349 Win=3666 Len=0 TSval=3081572 TSecr=3677882 SLE=73797 SRE=75289
  183 1.858028913  10.6.15.144 → 192.168.1.16 SSH 1514 Server: Encrypted packet (len=1448)
  184 1.858054662 192.168.1.16 → 10.6.15.144  TCP 78 [TCP Dup ACK 178#3] 59298 → 22 [ACK] Seq=3001 Ack=72349 Win=3666 Len=0 TSval=3081592 TSecr=3677882 SLE=73797 SRE=76737
  185 1.858073094  10.6.15.144 → 192.168.1.16 SSH 110 Server: Encrypted packet (len=44)
  186 1.858078920 192.168.1.16 → 10.6.15.144  TCP 78 [TCP Dup ACK 178#4] 59298 → 22 [ACK] Seq=3001 Ack=72349 Win=3666 Len=0 TSval=3081592 TSecr=3677882 SLE=73797 SRE=76781
  187 1.868745936  10.6.15.144 → 192.168.1.16 SSH 1514 Server: [TCP Fast Retransmission] , Encrypted packet (len=1448)
  188 1.868768359 192.168.1.16 → 10.6.15.144  TCP 66 59298 → 22 [ACK] Seq=3001 Ack=76781 Win=3666 Len=0 TSval=3081594 TSecr=3677910
  189 1.868908519  10.6.15.144 → 192.168.1.16 SSH 1514 Server: Encrypted packet (len=1448)
  190 1.868916851 192.168.1.16 → 10.6.15.144  TCP 66 59298 → 22 [ACK] Seq=3001 Ack=78229 Win=3666 Len=0 TSval=3081594 TSecr=3677910
  191 1.878700024  10.6.15.144 → 192.168.1.16 SSH 1514 Server: Encrypted packet (len=1448)
  192 1.878720815 192.168.1.16 → 10.6.15.144  TCP 66 59298 → 22 [ACK] Seq=3001 Ack=79677 Win=3666 Len=0 TSval=3081597 TSecr=3677913
  193 1.878880295  10.6.15.144 → 192.168.1.16 SSH 1514 Server: Encrypted packet (len=1448)
  194 1.878887265 192.168.1.16 → 10.6.15.144  TCP 66 59298 → 22 [ACK] Seq=3001 Ack=81125 Win=3666 Len=0 TSval=3081597 TSecr=3677913
  195 1.879074378  10.6.15.144 → 192.168.1.16 SSH 1514 Server: Encrypted packet (len=1448)
  196 1.879081742 192.168.1.16 → 10.6.15.144  TCP 66 59298 → 22 [ACK] Seq=3001 Ack=82573 Win=3666 Len=0 TSval=3081597 TSecr=3677913
  197 1.888810368  10.6.15.144 → 192.168.1.16 SSH 1514 Server: Encrypted packet (len=1448)
  198 1.888830482 192.168.1.16 → 10.6.15.144  TCP 66 59298 → 22 [ACK] Seq=3001 Ack=84021 Win=3666 Len=0 TSval=3081599 TSecr=3677915
  199 1.888992100  10.6.15.144 → 192.168.1.16 SSH 1514 Server: Encrypted packet (len=1448)
  200 1.888999891 192.168.1.16 → 10.6.15.144  TCP 66 59298 → 22 [ACK] Seq=3001 Ack=85469 Win=3666 Len=0 TSval=3081599 TSecr=3677915
  201 1.889338112  10.6.15.144 → 192.168.1.16 SSH 1514 Server: Encrypted packet (len=1448)
  202 1.889348721 192.168.1.16 → 10.6.15.144  TCP 66 59298 → 22 [ACK] Seq=3001 Ack=86917 Win=3666 Len=0 TSval=3081599 TSecr=3677915
  203 1.899531481  10.6.15.144 → 192.168.1.16 SSH 1514 Server: Encrypted packet (len=1448)
  204 1.899546673 192.168.1.16 → 10.6.15.144  TCP 66 59298 → 22 [ACK] Seq=3001 Ack=88365 Win=3666 Len=0 TSval=3081602 TSecr=3677918
  205 1.899712502  10.6.15.144 → 192.168.1.16 SSH 1514 Server: Encrypted packet (len=1448)
  206 1.899717248 192.168.1.16 → 10.6.15.144  TCP 66 59298 → 22 [ACK] Seq=3001 Ack=89813 Win=3666 Len=0 TSval=3081602 TSecr=3677918
  207 1.900055363  10.6.15.144 → 192.168.1.16 SSH 1514 Server: Encrypted packet (len=1448)
  208 1.900062709 192.168.1.16 → 10.6.15.144  TCP 66 59298 → 22 [ACK] Seq=3001 Ack=91261 Win=3666 Len=0 TSval=3081602 TSecr=3677918
  209 1.900214095 192.168.1.16 → 10.6.15.144  SSH 102 Client: Encrypted packet (len=36)
  210 1.909520268  10.6.15.144 → 192.168.1.16 SSH 1514 Server: Encrypted packet (len=1448)
  211 1.909695054  10.6.15.144 → 192.168.1.16 SSH 1514 Server: Encrypted packet (len=1448)
  212 1.909702764 192.168.1.16 → 10.6.15.144  TCP 66 59298 → 22 [ACK] Seq=3037 Ack=94157 Win=3666 Len=0 TSval=3081604 TSecr=3677921
  213 1.909887874  10.6.15.144 → 192.168.1.16 SSH 1514 Server: Encrypted packet (len=1448)
  214 1.921835010  10.6.15.144 → 192.168.1.16 SSH 1514 Server: Encrypted packet (len=1448)
  215 1.921860476 192.168.1.16 → 10.6.15.144  TCP 66 59298 → 22 [ACK] Seq=3037 Ack=97053 Win=3666 Len=0 TSval=3081607 TSecr=3677921
  216 1.922886537  10.6.15.144 → 192.168.1.16 SSH 1514 Server: Encrypted packet (len=1448)
  217 1.923069453  10.6.15.144 → 192.168.1.16 SSH 1514 Server: Encrypted packet (len=1448)
  218 1.923077557 192.168.1.16 → 10.6.15.144  TCP 66 59298 → 22 [ACK] Seq=3037 Ack=99949 Win=3666 Len=0 TSval=3081608 TSecr=3677924
  219 1.932301424  10.6.15.144 → 192.168.1.16 SSH 1514 Server: Encrypted packet (len=1448)
  220 1.932485620  10.6.15.144 → 192.168.1.16 SSH 1514 Server: Encrypted packet (len=1448)
  221 1.932499753 192.168.1.16 → 10.6.15.144  TCP 66 59298 → 22 [ACK] Seq=3037 Ack=102845 Win=3666 Len=0 TSval=3081610 TSecr=3677926
  222 1.933156788  10.6.15.144 → 192.168.1.16 SSH 1514 Server: Encrypted packet (len=1448)
  223 1.933332471  10.6.15.144 → 192.168.1.16 SSH 1430 Server: Encrypted packet (len=1364)
  224 1.933342930 192.168.1.16 → 10.6.15.144  TCP 66 59298 → 22 [ACK] Seq=3037 Ack=105657 Win=3666 Len=0 TSval=3081610 TSecr=3677926
  225 1.946347551  10.6.15.144 → 192.168.1.16 SSH 1514 Server: Encrypted packet (len=1448)
  226 1.946662122  10.6.15.144 → 192.168.1.16 SSH 1514 Server: Encrypted packet (len=1448)
  227 1.946675453 192.168.1.16 → 10.6.15.144  TCP 66 59298 → 22 [ACK] Seq=3037 Ack=108553 Win=3666 Len=0 TSval=3081614 TSecr=3677930
  228 1.946696161  10.6.15.144 → 192.168.1.16 SSH 110 Server: Encrypted packet (len=44)
  229 1.964311670  10.6.15.144 → 192.168.1.16 SSH 1514 Server: Encrypted packet (len=1448)
  230 1.964327970 192.168.1.16 → 10.6.15.144  TCP 66 59298 → 22 [ACK] Seq=3037 Ack=110045 Win=3666 Len=0 TSval=3081618 TSecr=3677930
  231 1.964354079  10.6.15.144 → 192.168.1.16 SSH 110 Server: Encrypted packet (len=44)
  232 1.974517637  10.6.15.144 → 192.168.1.16 SSH 110 Server: [TCP Previous segment not captured] , Encrypted packet (len=44)
  233 1.974534994 192.168.1.16 → 10.6.15.144  TCP 78 59298 → 22 [ACK] Seq=3037 Ack=110089 Win=3666 Len=0 TSval=3081621 TSecr=3677934 SLE=111537 SRE=111581
  234 1.979096754  10.6.15.144 → 192.168.1.16 SSH 1514 Server: Encrypted packet (len=1448)
  235 1.979115570 192.168.1.16 → 10.6.15.144  TCP 78 [TCP Dup ACK 233#1] 59298 → 22 [ACK] Seq=3037 Ack=110089 Win=3666 Len=0 TSval=3081622 TSecr=3677934 SLE=111537 SRE=113029
  236 1.984199101  10.6.15.144 → 192.168.1.16 SSH 1514 Server: Encrypted packet (len=1448)
  237 1.984216321 192.168.1.16 → 10.6.15.144  TCP 78 [TCP Dup ACK 233#2] 59298 → 22 [ACK] Seq=3037 Ack=110089 Win=3666 Len=0 TSval=3081623 TSecr=3677934 SLE=111537 SRE=114477
  238 1.984228975  10.6.15.144 → 192.168.1.16 SSH 110 Server: Encrypted packet (len=44)
  239 1.984232864 192.168.1.16 → 10.6.15.144  TCP 78 [TCP Dup ACK 233#3] 59298 → 22 [ACK] Seq=3037 Ack=110089 Win=3666 Len=0 TSval=3081623 TSecr=3677934 SLE=111537 SRE=114521
  240 1.993385706  10.6.15.144 → 192.168.1.16 SSH 1514 Server: [TCP Fast Retransmission] , Encrypted packet (len=1448)
  241 1.993416808 192.168.1.16 → 10.6.15.144  TCP 66 59298 → 22 [ACK] Seq=3037 Ack=114521 Win=3666 Len=0 TSval=3081625 TSecr=3677942
  242 1.993700965  10.6.15.144 → 192.168.1.16 SSH 1514 Server: Encrypted packet (len=1448)
  243 1.993712373 192.168.1.16 → 10.6.15.144  TCP 66 59298 → 22 [ACK] Seq=3037 Ack=115969 Win=3666 Len=0 TSval=3081625 TSecr=3677942
  244 2.002315064  10.6.15.144 → 192.168.1.16 SSH 1514 Server: Encrypted packet (len=1448)
  245 2.002335919 192.168.1.16 → 10.6.15.144  TCP 66 59298 → 22 [ACK] Seq=3037 Ack=117417 Win=3666 Len=0 TSval=3081628 TSecr=3677944
  246 2.002360320  10.6.15.144 → 192.168.1.16 SSH 110 Server: Encrypted packet (len=44)
  247 2.002367181 192.168.1.16 → 10.6.15.144  TCP 66 59298 → 22 [ACK] Seq=3037 Ack=117461 Win=3666 Len=0 TSval=3081628 TSecr=3677944
  248 2.010887184  10.6.15.144 → 192.168.1.16 SSH 1514 Server: Encrypted packet (len=1448)
  249 2.010909712 192.168.1.16 → 10.6.15.144  TCP 66 59298 → 22 [ACK] Seq=3037 Ack=118909 Win=3666 Len=0 TSval=3081630 TSecr=3677946
  250 2.015411538  10.6.15.144 → 192.168.1.16 SSH 1514 Server: Encrypted packet (len=1448)
  251 2.015432201 192.168.1.16 → 10.6.15.144  TCP 66 59298 → 22 [ACK] Seq=3037 Ack=120357 Win=3666 Len=0 TSval=3081631 TSecr=3677946
  252 2.015455043  10.6.15.144 → 192.168.1.16 SSH 110 Server: Encrypted packet (len=44)
  253 2.015463292 192.168.1.16 → 10.6.15.144  TCP 66 59298 → 22 [ACK] Seq=3037 Ack=120401 Win=3666 Len=0 TSval=3081631 TSecr=3677946
  254 2.026120864  10.6.15.144 → 192.168.1.16 SSH 1514 Server: Encrypted packet (len=1448)
  255 2.026136145 192.168.1.16 → 10.6.15.144  TCP 66 59298 → 22 [ACK] Seq=3037 Ack=121849 Win=3666 Len=0 TSval=3081634 TSecr=3677950
  256 2.026303249  10.6.15.144 → 192.168.1.16 SSH 1514 Server: Encrypted packet (len=1448)
  257 2.026308075 192.168.1.16 → 10.6.15.144  TCP 66 59298 → 22 [ACK] Seq=3037 Ack=123297 Win=3666 Len=0 TSval=3081634 TSecr=3677950
  258 2.026436619  10.6.15.144 → 192.168.1.16 SSH 110 Server: Encrypted packet (len=44)
  259 2.026440757 192.168.1.16 → 10.6.15.144  TCP 66 59298 → 22 [ACK] Seq=3037 Ack=123341 Win=3666 Len=0 TSval=3081634 TSecr=3677950
  260 2.041161539  10.6.15.144 → 192.168.1.16 SSH 1514 Server: Encrypted packet (len=1448)
  261 2.041179429 192.168.1.16 → 10.6.15.144  TCP 66 59298 → 22 [ACK] Seq=3037 Ack=124789 Win=3666 Len=0 TSval=3081637 TSecr=3677954
  262 2.041199425  10.6.15.144 → 192.168.1.16 SSH 110 Server: Encrypted packet (len=44)
  263 2.041203941 192.168.1.16 → 10.6.15.144  TCP 66 59298 → 22 [ACK] Seq=3037 Ack=124833 Win=3666 Len=0 TSval=3081637 TSecr=3677954
  264 2.041515168  10.6.15.144 → 192.168.1.16 SSH 1514 Server: Encrypted packet (len=1448)
  265 2.041524869 192.168.1.16 → 10.6.15.144  TCP 66 59298 → 22 [ACK] Seq=3037 Ack=126281 Win=3666 Len=0 TSval=3081637 TSecr=3677954
  266 2.048467819  10.6.15.144 → 192.168.1.16 SSH 110 Server: Encrypted packet (len=44)
  267 2.048488024 192.168.1.16 → 10.6.15.144  TCP 66 59298 → 22 [ACK] Seq=3037 Ack=126325 Win=3666 Len=0 TSval=3081639 TSecr=3677956
  268 2.056209242  10.6.15.144 → 192.168.1.16 SSH 1514 Server: Encrypted packet (len=1448)
  269 2.056234140 192.168.1.16 → 10.6.15.144  TCP 66 59298 → 22 [ACK] Seq=3037 Ack=127773 Win=3666 Len=0 TSval=3081641 TSecr=3677958
  270 2.056387649  10.6.15.144 → 192.168.1.16 SSH 1514 Server: Encrypted packet (len=1448)
  271 2.056403015  10.6.15.144 → 192.168.1.16 SSH 110 Server: Encrypted packet (len=44)
  272 2.056409384 192.168.1.16 → 10.6.15.144  TCP 66 59298 → 22 [ACK] Seq=3037 Ack=129265 Win=3666 Len=0 TSval=3081641 TSecr=3677958
  273 2.072687675  10.6.15.144 → 192.168.1.16 SSH 1514 Server: Encrypted packet (len=1448)
  274 2.072717418  10.6.15.144 → 192.168.1.16 SSH 110 Server: Encrypted packet (len=44)
  275 2.072730147 192.168.1.16 → 10.6.15.144  TCP 66 59298 → 22 [ACK] Seq=3037 Ack=130757 Win=3666 Len=0 TSval=3081645 TSecr=3677962
  276 2.073042205  10.6.15.144 → 192.168.1.16 SSH 1514 Server: Encrypted packet (len=1448)
  277 2.073056215  10.6.15.144 → 192.168.1.16 SSH 110 Server: Encrypted packet (len=44)
  278 2.073063209 192.168.1.16 → 10.6.15.144  TCP 66 59298 → 22 [ACK] Seq=3037 Ack=132249 Win=3666 Len=0 TSval=3081645 TSecr=3677962
  279 2.088585428  10.6.15.144 → 192.168.1.16 SSH 1514 Server: Encrypted packet (len=1448)
  280 2.088899068  10.6.15.144 → 192.168.1.16 SSH 1514 Server: Encrypted packet (len=1448)
  281 2.088911706 192.168.1.16 → 10.6.15.144  TCP 66 59298 → 22 [ACK] Seq=3037 Ack=135145 Win=3666 Len=0 TSval=3081649 TSecr=3677966
  282 2.088931600  10.6.15.144 → 192.168.1.16 SSH 110 Server: Encrypted packet (len=44)
  283 2.088975498 192.168.1.16 → 10.6.15.144  TCP 66 59298 → 22 [ACK] Seq=3037 Ack=135189 Win=3666 Len=0 TSval=3081649 TSecr=3677966
  284 2.107585370  10.6.15.144 → 192.168.1.16 SSH 1514 Server: Encrypted packet (len=1448)
  285 2.107769488  10.6.15.144 → 192.168.1.16 SSH 1514 Server: Encrypted packet (len=1448)
  286 2.107777942 192.168.1.16 → 10.6.15.144  TCP 66 59298 → 22 [ACK] Seq=3037 Ack=138085 Win=3666 Len=0 TSval=3081654 TSecr=3677970
  287 2.107792537  10.6.15.144 → 192.168.1.16 SSH 110 Server: Encrypted packet (len=44)
  288 2.107819599 192.168.1.16 → 10.6.15.144  TCP 66 59298 → 22 [ACK] Seq=3037 Ack=138129 Win=3666 Len=0 TSval=3081654 TSecr=3677970
  289 2.122613006  10.6.15.144 → 192.168.1.16 SSH 1514 Server: Encrypted packet (len=1448)
  290 2.122635769  10.6.15.144 → 192.168.1.16 SSH 110 Server: Encrypted packet (len=44)
  291 2.122649098 192.168.1.16 → 10.6.15.144  TCP 66 59298 → 22 [ACK] Seq=3037 Ack=139621 Win=3666 Len=0 TSval=3081658 TSecr=3677974
  292 2.122814297  10.6.15.144 → 192.168.1.16 SSH 1514 Server: Encrypted packet (len=1448)
  293 2.122823101  10.6.15.144 → 192.168.1.16 SSH 110 Server: Encrypted packet (len=44)
  294 2.122827362 192.168.1.16 → 10.6.15.144  TCP 66 59298 → 22 [ACK] Seq=3037 Ack=141113 Win=3666 Len=0 TSval=3081658 TSecr=3677974
  295 2.138700348  10.6.15.144 → 192.168.1.16 SSH 1514 Server: Encrypted packet (len=1448)
  296 2.138882585  10.6.15.144 → 192.168.1.16 SSH 1514 Server: Encrypted packet (len=1448)
  297 2.138895564 192.168.1.16 → 10.6.15.144  TCP 66 59298 → 22 [ACK] Seq=3037 Ack=144009 Win=3666 Len=0 TSval=3081662 TSecr=3677978
  298 2.139015774  10.6.15.144 → 192.168.1.16 SSH 110 Server: Encrypted packet (len=44)
  299 2.139047455 192.168.1.16 → 10.6.15.144  TCP 66 59298 → 22 [ACK] Seq=3037 Ack=144053 Win=3666 Len=0 TSval=3081662 TSecr=3677978
  300 2.153839863  10.6.15.144 → 192.168.1.16 SSH 1514 Server: Encrypted packet (len=1448)
  301 2.153864385  10.6.15.144 → 192.168.1.16 SSH 110 Server: Encrypted packet (len=44)
  302 2.153876869 192.168.1.16 → 10.6.15.144  TCP 66 59298 → 22 [ACK] Seq=3037 Ack=145545 Win=3666 Len=0 TSval=3081665 TSecr=3677982
  303 2.154086835 192.168.1.16 → 10.6.15.144  SSH 102 Client: Encrypted packet (len=36)
  304 2.154596367  10.6.15.144 → 192.168.1.16 SSH 1514 Server: Encrypted packet (len=1448)
  305 2.154614129  10.6.15.144 → 192.168.1.16 SSH 110 Server: Encrypted packet (len=44)
  306 2.154621358 192.168.1.16 → 10.6.15.144  TCP 66 59298 → 22 [ACK] Seq=3073 Ack=147037 Win=3666 Len=0 TSval=3081666 TSecr=3677982
  307 2.170056024  10.6.15.144 → 192.168.1.16 SSH 1514 Server: Encrypted packet (len=1448)
  308 2.170241438  10.6.15.144 → 192.168.1.16 SSH 1514 Server: Encrypted packet (len=1448)
  309 2.170250780 192.168.1.16 → 10.6.15.144  TCP 66 59298 → 22 [ACK] Seq=3073 Ack=149933 Win=3666 Len=0 TSval=3081670 TSecr=3677986
  310 2.170264721  10.6.15.144 → 192.168.1.16 SSH 110 Server: Encrypted packet (len=44)
  311 2.184596333  10.6.15.144 → 192.168.1.16 SSH 1514 Server: Encrypted packet (len=1448)
  312 2.184612446 192.168.1.16 → 10.6.15.144  TCP 66 59298 → 22 [ACK] Seq=3073 Ack=151425 Win=3666 Len=0 TSval=3081673 TSecr=3677986
  313 2.184628735  10.6.15.144 → 192.168.1.16 SSH 110 Server: Encrypted packet (len=44)
  314 2.192075294  10.6.15.144 → 192.168.1.16 SSH 1514 Server: Encrypted packet (len=1448)
  315 2.192093986 192.168.1.16 → 10.6.15.144  TCP 66 59298 → 22 [ACK] Seq=3073 Ack=152917 Win=3666 Len=0 TSval=3081675 TSecr=3677990
  316 2.192113878  10.6.15.144 → 192.168.1.16 SSH 110 Server: Encrypted packet (len=44)
  317 2.201719520  10.6.15.144 → 192.168.1.16 SSH 1514 Server: Encrypted packet (len=1448)
  318 2.201736635 192.168.1.16 → 10.6.15.144  TCP 66 59298 → 22 [ACK] Seq=3073 Ack=154409 Win=3666 Len=0 TSval=3081677 TSecr=3677992
  319 2.201752119  10.6.15.144 → 192.168.1.16 SSH 390 Server: Encrypted packet (len=324)
  320 2.242004500 192.168.1.16 → 10.6.15.144  TCP 66 59298 → 22 [ACK] Seq=3073 Ack=154733 Win=3666 Len=0 TSval=3081688 TSecr=3677994
  321 2.328128033  10.6.15.144 → 192.168.1.16 SSH 138 Server: Encrypted packet (len=72)
  322 2.328207033 192.168.1.16 → 10.6.15.144  TCP 66 59298 → 22 [ACK] Seq=3073 Ack=154805 Win=3666 Len=0 TSval=3081709 TSecr=3678025
  323 2.328417844 192.168.1.16 → 10.6.15.144  SSH 102 Client: Encrypted packet (len=36)
  324 2.375377921  10.6.15.144 → 192.168.1.16 TCP 66 22 → 59298 [ACK] Seq=154805 Ack=3109 Win=1452 Len=0 TSval=3678038 TSecr=3081709
  325 2.425196026 192.168.1.16 → 10.6.15.144  SSH 1030 Client: Encrypted packet (len=964)
  326 2.435601154  10.6.15.144 → 192.168.1.16 TCP 66 22 → 59298 [ACK] Seq=154805 Ack=4073 Win=1452 Len=0 TSval=3678052 TSecr=3081733
  327 2.441139970 192.168.1.16 → 10.6.15.144  SSH 694 Client: Encrypted packet (len=628)
  328 2.451280217  10.6.15.144 → 192.168.1.16 TCP 66 22 → 59298 [ACK] Seq=154805 Ack=4701 Win=1452 Len=0 TSval=3678056 TSecr=3081737
  329 2.488165060  10.6.15.144 → 192.168.1.16 SSH 390 Server: Encrypted packet (len=324)
  330 2.516917823 192.168.1.16 → 10.6.15.144  SSH 430 Client: Encrypted packet (len=364)
  331 2.530656235 192.168.1.16 → 10.6.15.144  SSH 990 Client: Encrypted packet (len=924)
  332 2.535685557  10.6.15.144 → 192.168.1.16 SSH 270 Server: Encrypted packet (len=204)
  333 2.535708425  10.6.15.144 → 192.168.1.16 SSH 142 Server: Encrypted packet (len=76)
  334 2.535782037 192.168.1.16 → 10.6.15.144  TCP 66 59298 → 22 [ACK] Seq=5989 Ack=155409 Win=3666 Len=0 TSval=3081761 TSecr=3678077
  335 2.536709860 192.168.1.16 → 10.6.15.144  SSH 134 Client: Encrypted packet (len=68)
  336 2.573444656  10.6.15.144 → 192.168.1.16 SSH 142 Server: [TCP Spurious Retransmission] , Encrypted packet (len=76)
  337 2.573473026 192.168.1.16 → 10.6.15.144  TCP 78 [TCP Dup ACK 334#1] 59298 → 22 [ACK] Seq=6057 Ack=155409 Win=3666 Len=0 TSval=3081770 TSecr=3678087 SLE=155333 SRE=155409
  338 2.578312962  10.6.15.144 → 192.168.1.16 SSH 454 Server: Encrypted packet (len=388)
  339 2.578332594 192.168.1.16 → 10.6.15.144  TCP 66 59298 → 22 [ACK] Seq=6057 Ack=155797 Win=3666 Len=0 TSval=3081772 TSecr=3678088
  340 2.578349599  10.6.15.144 → 192.168.1.16 SSH 102 Server: Encrypted packet (len=36)
  341 2.578356727 192.168.1.16 → 10.6.15.144  TCP 66 59298 → 22 [ACK] Seq=6057 Ack=155833 Win=3666 Len=0 TSval=3081772 TSecr=3678088
  342 2.581479252 192.168.1.16 → 10.6.15.144  SSH 138 Client: Encrypted packet (len=72)
  343 2.589375309 192.168.1.16 → 10.6.15.144  SSH 262 Client: Encrypted packet (len=196)
  344 2.632880750  10.6.15.144 → 192.168.1.16 TCP 78 [TCP Dup ACK 336#1] 22 → 59298 [ACK] Seq=155833 Ack=5989 Win=1452 Len=0 TSval=3678102 TSecr=3081760 SLE=6057 SRE=6129
  345 2.632898552  10.6.15.144 → 192.168.1.16 TCP 78 [TCP Dup ACK 336#2] 22 → 59298 [ACK] Seq=155833 Ack=5989 Win=1452 Len=0 TSval=3678102 TSecr=3081760 SLE=6057 SRE=6325
  346 2.687043181  10.6.15.144 → 192.168.1.16 SSH 154 Server: Encrypted packet (len=76)
  347 2.687069088  10.6.15.144 → 192.168.1.16 SSH 250 Server: Encrypted packet (len=172)
  348 2.687137561 192.168.1.16 → 10.6.15.144  TCP 66 59298 → 22 [ACK] Seq=6325 Ack=156081 Win=3666 Len=0 TSval=3081799 TSecr=3678115
  349 2.762000856 192.168.1.16 → 10.6.15.144  TCP 134 [TCP Retransmission] 59298 → 22 [PSH, ACK] Seq=5989 Ack=156081 Win=3666 Len=68 TSval=3081818 TSecr=3678115
  350 2.771589503  10.6.15.144 → 192.168.1.16 TCP 66 22 → 59298 [ACK] Seq=156081 Ack=6325 Win=1450 Len=0 TSval=3678136 TSecr=3081818
  351 2.771607815  10.6.15.144 → 192.168.1.16 SSH 102 Server: Encrypted packet (len=36)
  352 2.795889421  10.6.15.144 → 192.168.1.16 SSH 142 Server: Encrypted packet (len=76)
  353 2.795957703 192.168.1.16 → 10.6.15.144  TCP 66 59298 → 22 [ACK] Seq=6325 Ack=156193 Win=3666 Len=0 TSval=3081826 TSecr=3678136
  354 2.796594694  10.6.15.144 → 192.168.1.16 SSH 278 Server: Encrypted packet (len=212)
  355 2.825443433 192.168.1.16 → 10.6.15.144  SSH 102 Client: Encrypted packet (len=36)
  356 2.826549377 192.168.1.16 → 10.6.15.144  SSH 102 Client: Encrypted packet (len=36)
  357 2.836155800  10.6.15.144 → 192.168.1.16 TCP 66 22 → 59298 [ACK] Seq=156405 Ack=6397 Win=1452 Len=0 TSval=3678152 TSecr=3081833
  358 2.836173157 192.168.1.16 → 10.6.15.144  SSH 1514 Client: Encrypted packet (len=1448)
  359 2.836185284 192.168.1.16 → 10.6.15.144  SSH 1030 Client: Encrypted packet (len=964)
  360 2.846837172  10.6.15.144 → 192.168.1.16 TCP 66 22 → 59298 [ACK] Seq=156405 Ack=8809 Win=1452 Len=0 TSval=3678155 TSecr=3081836
  361 2.874539411  10.6.15.144 → 192.168.1.16 SSH 134 Server: Encrypted packet (len=68)
  362 2.874557623  10.6.15.144 → 192.168.1.16 SSH 138 Server: Encrypted packet (len=72)
  363 2.874614173 192.168.1.16 → 10.6.15.144  TCP 66 59298 → 22 [ACK] Seq=8809 Ack=156545 Win=3666 Len=0 TSval=3081846 TSecr=3678162
  364 2.874826897 192.168.1.16 → 10.6.15.144  SSH 102 Client: Encrypted packet (len=36)
  365 2.875328133  10.6.15.144 → 192.168.1.16 SSH 110 Server: Encrypted packet (len=44)
  366 2.875619574 192.168.1.16 → 10.6.15.144  SSH 150 Client: Encrypted packet (len=84)
  367 2.885637536  10.6.15.144 → 192.168.1.16 TCP 66 22 → 59298 [ACK] Seq=156589 Ack=8929 Win=1452 Len=0 TSval=3678165 TSecr=3081846
  368 2.913487635  10.6.15.144 → 192.168.1.16 SSH 254 Server: Encrypted packet (len=188)
  369 2.913754770 192.168.1.16 → 10.6.15.144  SSH 134 Client: Encrypted packet (len=68)
  370 2.914466368  10.6.15.144 → 192.168.1.16 SSH 1514 Server: Encrypted packet (len=1448)
  371 2.914660684  10.6.15.144 → 192.168.1.16 SSH 1334 Server: Encrypted packet (len=1268)
  372 2.914668051 192.168.1.16 → 10.6.15.144  TCP 66 59298 → 22 [ACK] Seq=8997 Ack=159493 Win=3666 Len=0 TSval=3081856 TSecr=3678172
  373 2.923819110 192.168.1.16 → 10.6.15.144  SSH 574 Client: Encrypted packet (len=508)
  374 2.925071472 192.168.1.16 → 10.6.15.144  SSH 606 Client: Encrypted packet (len=540)
  375 2.933343406  10.6.15.144 → 192.168.1.16 TCP 66 22 → 59298 [ACK] Seq=159493 Ack=9505 Win=1452 Len=0 TSval=3678177 TSecr=3081855
  376 2.973119057  10.6.15.144 → 192.168.1.16 TCP 66 22 → 59298 [ACK] Seq=159493 Ack=10045 Win=1452 Len=0 TSval=3678187 TSecr=3081858
  377 2.974246568  10.6.15.144 → 192.168.1.16 SSH 150 Server: Encrypted packet (len=84)
  378 2.989865174 192.168.1.16 → 10.6.15.144  SSH 1514 Client: Encrypted packet (len=1448)
  379 2.990393984 192.168.1.16 → 10.6.15.144  SSH 246 Client: Encrypted packet (len=180)
  380 3.008866934  10.6.15.144 → 192.168.1.16 TCP 66 22 → 59298 [ACK] Seq=159577 Ack=11673 Win=1452 Len=0 TSval=3678196 TSecr=3081874
  381 3.071957710  10.6.15.144 → 192.168.1.16 SSH 110 Server: Encrypted packet (len=44)
  382 3.072302915 192.168.1.16 → 10.6.15.144  SSH 158 Client: Encrypted packet (len=92)
  383 3.080922959  10.6.15.144 → 192.168.1.16 TCP 66 22 → 59298 [ACK] Seq=159621 Ack=11765 Win=1452 Len=0 TSval=3678214 TSecr=3081895
  384 3.091340144 192.168.1.16 → 10.6.15.144  SSH 1086 Client: Encrypted packet (len=1020)
  385 3.099137590  10.6.15.144 → 192.168.1.16 TCP 66 22 → 59298 [ACK] Seq=159621 Ack=12785 Win=1452 Len=0 TSval=3678219 TSecr=3081900
  386 3.127672206  10.6.15.144 → 192.168.1.16 SSH 310 Server: Encrypted packet (len=244)
  387 3.148006377  10.6.15.144 → 192.168.1.16 SSH 102 Server: Encrypted packet (len=36)
  388 3.148069115 192.168.1.16 → 10.6.15.144  TCP 66 59298 → 22 [ACK] Seq=12785 Ack=159901 Win=3666 Len=0 TSval=3081914 TSecr=3678226
  389 3.148341484 192.168.1.16 → 10.6.15.144  SSH 150 Client: Encrypted packet (len=84)
  390 3.150802124  10.6.15.144 → 192.168.1.16 SSH 326 Server: Encrypted packet (len=260)
  391 3.194001764 192.168.1.16 → 10.6.15.144  TCP 66 59298 → 22 [ACK] Seq=12869 Ack=160161 Win=3666 Len=0 TSval=3081926 TSecr=3678231
  392 3.195762863  10.6.15.144 → 192.168.1.16 TCP 66 22 → 59298 [ACK] Seq=160161 Ack=12869 Win=1452 Len=0 TSval=3678243 TSecr=3081914
  393 3.249831306  10.6.15.144 → 192.168.1.16 SSH 662 Server: Encrypted packet (len=596)
  394 3.249899845 192.168.1.16 → 10.6.15.144  TCP 66 59298 → 22 [ACK] Seq=12869 Ack=160757 Win=3666 Len=0 TSval=3081939 TSecr=3678256
  395 3.260026740  10.6.15.144 → 192.168.1.16 SSH 230 Server: Encrypted packet (len=164)
  396 3.260091771 192.168.1.16 → 10.6.15.144  TCP 66 59298 → 22 [ACK] Seq=12869 Ack=160921 Win=3666 Len=0 TSval=3081942 TSecr=3678259
  397 3.303946142  10.6.15.144 → 192.168.1.16 SSH 238 Server: Encrypted packet (len=172)
  398 3.304028621 192.168.1.16 → 10.6.15.144  TCP 66 59298 → 22 [ACK] Seq=12869 Ack=161093 Win=3666 Len=0 TSval=3081953 TSecr=3678269
  399 3.304283975 192.168.1.16 → 10.6.15.144  SSH 134 Client: Encrypted packet (len=68)
  400 3.315088348  10.6.15.144 → 192.168.1.16 TCP 66 22 → 59298 [ACK] Seq=161093 Ack=12937 Win=1452 Len=0 TSval=3678272 TSecr=3081953
  401 4.324526586  10.6.15.144 → 192.168.1.16 SSH 182 Server: Encrypted packet (len=116)
  402 4.324550484  10.6.15.144 → 192.168.1.16 TCP 182 [TCP Retransmission] 22 → 59298 [PSH, ACK] Seq=161093 Ack=12937 Win=1452 Len=116 TSval=3678369 TSecr=3081953
  403 4.324560254 192.168.1.16 → 10.6.15.144  TCP 78 59298 → 22 [ACK] Seq=12937 Ack=161209 Win=3666 Len=0 TSval=3082208 TSecr=3678369 SLE=161093 SRE=161209
  404 4.324574641  10.6.15.144 → 192.168.1.16 SSH 182 Server: [TCP Spurious Retransmission] , Encrypted packet (len=116)
  405 4.324578474 192.168.1.16 → 10.6.15.144  TCP 78 [TCP Dup ACK 403#1] 59298 → 22 [ACK] Seq=12937 Ack=161209 Win=3666 Len=0 TSval=3082208 TSecr=3678425 SLE=161093 SRE=161209
  406 4.324878697 192.168.1.16 → 10.6.15.144  SSH 134 Client: Encrypted packet (len=68)
  407 4.334387824  10.6.15.144 → 192.168.1.16 TCP 66 22 → 59298 [ACK] Seq=161209 Ack=13005 Win=1452 Len=0 TSval=3678527 TSecr=3082208
  408 4.369750460 10.22.18.209 → 224.0.0.252  LLMNR 64 Standard query 0xcdd2 A wpad
  409 4.468675105 10.22.18.209 → 224.0.0.252  LLMNR 64 Standard query 0xcdd2 A wpad
  410 8.000109554 192.168.1.16 → 139.59.21.22 NTP 90 NTP Version 4, client
  411 9.374736743  10.22.17.29 → 224.0.0.252  LLMNR 64 Standard query 0xb98d A wpad
  412 10.309901118  10.22.17.29 → 224.0.0.252  LLMNR 64 Standard query 0xb98d A wpad
  413 11.302090145  10.6.15.144 → 192.168.1.16 SSH 174 Server: Encrypted packet (len=108)
  414 11.302109533  10.6.15.144 → 192.168.1.16 SSH 102 Server: Encrypted packet (len=36)
  415 11.302114264  10.6.15.144 → 192.168.1.16 TCP 102 [TCP Retransmission] 22 → 59298 [PSH, ACK] Seq=161317 Ack=13005 Win=1452 Len=36 TSval=3680187 TSecr=3082208
  416 11.302122305 192.168.1.16 → 10.6.15.144  TCP 78 59298 → 22 [ACK] Seq=13005 Ack=161353 Win=3666 Len=0 TSval=3083953 TSecr=3680137 SLE=161317 SRE=161353
  417 11.302407971 192.168.1.16 → 10.6.15.144  SSH 138 Client: Encrypted packet (len=72)
  418 11.313843084  10.6.15.144 → 192.168.1.16 TCP 66 22 → 59298 [ACK] Seq=161353 Ack=13077 Win=1452 Len=0 TSval=3680271 TSecr=3083953
  419 11.313860639  10.6.15.144 → 192.168.1.16 SSH 102 Server: Encrypted packet (len=36)
  420 11.354054798 192.168.1.16 → 10.6.15.144  TCP 66 59298 → 22 [ACK] Seq=13077 Ack=161389 Win=3666 Len=0 TSval=3083966 TSecr=3680271
  421 12.324084337  10.6.15.144 → 192.168.1.16 SSH 134 Server: Encrypted packet (len=68)
  422 12.324110594 192.168.1.16 → 10.6.15.144  TCP 66 59298 → 22 [ACK] Seq=13077 Ack=161457 Win=3666 Len=0 TSval=3084208 TSecr=3680470
  423 12.324128193  10.6.15.144 → 192.168.1.16 SSH 102 Server: Encrypted packet (len=36)
  424 12.324133439 192.168.1.16 → 10.6.15.144  TCP 66 59298 → 22 [ACK] Seq=13077 Ack=161493 Win=3666 Len=0 TSval=3084208 TSecr=3680470
  425 12.329307462  10.6.15.144 → 192.168.1.16 SSH 162 Server: Encrypted packet (len=96)
  426 12.329325519 192.168.1.16 → 10.6.15.144  TCP 66 59298 → 22 [ACK] Seq=13077 Ack=161589 Win=3666 Len=0 TSval=3084209 TSecr=3680527
  427 12.451143345 192.168.1.16 → 10.6.15.144  SSH 1514 Client: Encrypted packet (len=1448)
  428 12.452487282 192.168.1.16 → 10.6.15.144  SSH 334 Client: Encrypted packet (len=268)
  429 12.463025169  10.6.15.144 → 192.168.1.16 TCP 66 22 → 59298 [ACK] Seq=161589 Ack=14793 Win=1452 Len=0 TSval=3680559 TSecr=3084240
  430 12.466032605  10.6.15.144 → 192.168.1.16 SSH 142 Server: Encrypted packet (len=76)
  431 12.466050517 192.168.1.16 → 10.6.15.144  TCP 66 59298 → 22 [ACK] Seq=14793 Ack=161665 Win=3666 Len=0 TSval=3084244 TSecr=3680560
  432 13.317594587  10.6.15.144 → 192.168.1.16 SSH 1374 Server: Encrypted packet (len=1308)
  433 13.317641476 192.168.1.16 → 10.6.15.144  TCP 66 59298 → 22 [ACK] Seq=14793 Ack=162973 Win=3666 Len=0 TSval=3084456 TSecr=3680590
  434 13.317670620 10.22.18.209 → 224.0.0.252  LLMNR 64 Standard query 0xa814 A wpad
  435 13.317700409 10.22.18.209 → 224.0.0.252  LLMNR 64 Standard query 0xa814 A wpad
  436 13.317851976  10.6.15.144 → 192.168.1.16 SSH 1374 Server: [TCP Spurious Retransmission] , Encrypted packet (len=1308)
  437 13.317866502 192.168.1.16 → 10.6.15.144  TCP 78 [TCP Dup ACK 433#1] 59298 → 22 [ACK] Seq=14793 Ack=162973 Win=3666 Len=0 TSval=3084456 TSecr=3680688 SLE=161665 SRE=162973
  438 13.319786730 192.168.1.16 → 10.6.15.144  SSH 134 Client: Encrypted packet (len=68)
  439 13.364847775  10.6.15.144 → 192.168.1.16 TCP 66 22 → 59298 [ACK] Seq=162973 Ack=14861 Win=1452 Len=0 TSval=3680786 TSecr=3084457
  440 14.358963848  10.22.17.29 → 224.0.0.252  LLMNR 64 Standard query 0x3a6b A wpad
  441 17.000154193 192.168.1.16 → 13.126.37.14 NTP 90 NTP Version 4, client
  442 17.324519073  10.22.17.29 → 224.0.0.252  LLMNR 64 Standard query 0x3a6b A wpad
  443 21.318250443 10.22.18.209 → 224.0.0.252  LLMNR 64 Standard query 0x8491 A wpad
  444 21.318278737 10.22.18.209 → 224.0.0.252  LLMNR 64 Standard query 0x8491 A wpad
  445 23.300854858  10.6.15.144 → 192.168.1.16 SSH 126 Server: Encrypted packet (len=60)
  446 23.300883165  10.6.15.144 → 192.168.1.16 SSH 102 Server: Encrypted packet (len=36)
  447 23.300953127 192.168.1.16 → 10.6.15.144  TCP 66 59298 → 22 [ACK] Seq=14861 Ack=163069 Win=3666 Len=0 TSval=3086952 TSecr=3683172
  448 25.316134788 10.22.18.220 → 224.0.0.252  LLMNR 64 Standard query 0x4e9c A wpad
  449 25.316177876 10.22.18.220 → 224.0.0.252  LLMNR 64 Standard query 0x0840 AAAA wpad
  450 26.310855182 10.22.18.220 → 224.0.0.252  LLMNR 64 Standard query 0x4e9c A wpad
  451 26.310903762 10.22.18.220 → 224.0.0.252  LLMNR 64 Standard query 0x0840 AAAA wpad
  452 28.323953178 10.22.18.209 → 224.0.0.252  LLMNR 64 Standard query 0x5cfc A wpad
  453 28.323998564 10.22.18.209 → 224.0.0.252  LLMNR 64 Standard query 0x5cfc A wpad
