    1 0.000000000  10.6.15.144 → 192.168.1.16 SSH 110 Server: Encrypted packet (len=44)
    2 0.000017084  10.22.18.36 → 224.0.0.252  LLMNR 64 Standard query 0xe4b3 ANY abhi
    3 0.000028664  10.6.15.144 → 192.168.1.16 TCP 110 [TCP Retransmission] 22 → 59298 [PSH, ACK] Seq=1 Ack=1 Win=1452 Len=44 TSval=3692870 TSecr=3096369
    4 0.000038242 192.168.1.16 → 10.6.15.144  TCP 78 59298 → 22 [ACK] Seq=1 Ack=45 Win=3666 Len=0 TSval=3096704 TSecr=3692870 SLE=1 SRE=45
    5 0.000049105  10.22.18.36 → 224.0.0.252  LLMNR 64 Standard query 0xe4b3 ANY abhi
    6 0.000375847 192.168.1.16 → 10.6.15.144  SSH 126 Client: Encrypted packet (len=60)
    7 0.008617890  10.6.15.144 → 192.168.1.16 TCP 66 22 → 59298 [ACK] Seq=45 Ack=61 Win=1452 Len=0 TSval=3693023 TSecr=3096704
    8 0.993651569  10.6.15.144 → 192.168.1.16 SSH 366 Server: Encrypted packet (len=300)
    9 0.993666561  10.6.15.144 → 192.168.1.16 SSH 102 Server: Encrypted packet (len=36)
   10 0.993671552  10.22.18.36 → 224.0.0.252  LLMNR 64 Standard query 0x4e48 ANY abhi
   11 0.993737407 192.168.1.16 → 10.6.15.144  TCP 66 59298 → 22 [ACK] Seq=61 Ack=381 Win=3666 Len=0 TSval=3096953 TSecr=3693132
   12 0.995618298 192.168.1.16 → 10.6.15.144  SSH 102 Client: Encrypted packet (len=36)
   13 0.996953840 192.168.1.16 → 10.6.15.144  SSH 766 Client: Encrypted packet (len=700)
   14 0.999331174 192.168.1.16 → 10.6.15.144  SSH 254 Client: Encrypted packet (len=188)
   15 1.034999310  10.6.15.144 → 192.168.1.16 TCP 78 [TCP Dup ACK 7#1] 22 → 59298 [ACK] Seq=381 Ack=61 Win=1452 Len=0 TSval=3693280 TSecr=3096953 SLE=97 SRE=797
   16 1.035018781  10.6.15.144 → 192.168.1.16 TCP 78 [TCP Dup ACK 7#2] 22 → 59298 [ACK] Seq=381 Ack=61 Win=1452 Len=0 TSval=3693280 TSecr=3096953 SLE=97 SRE=985
   17 1.041647418  10.22.18.36 → 224.0.0.252  LLMNR 64 Standard query 0x4e48 ANY abhi
   18 1.217591474 192.168.1.16 → 10.6.15.144  TCP 102 [TCP Retransmission] 59298 → 22 [PSH, ACK] Seq=61 Ack=381 Win=3666 Len=36 TSval=3097009 TSecr=3693280
   19 1.227247575  10.6.15.144 → 192.168.1.16 TCP 66 22 → 59298 [ACK] Seq=381 Ack=985 Win=1451 Len=0 TSval=3693328 TSecr=3097009
   20 2.691528856 192.168.1.16 → 91.189.91.157 NTP 90 NTP Version 4, client
   21 2.698513282  10.6.15.144 → 192.168.1.16 SSH 426 Server: Encrypted packet (len=360)
   22 2.698533829  10.6.15.144 → 192.168.1.16 SSH 454 Server: Encrypted packet (len=388)
   23 2.698594168 192.168.1.16 → 10.6.15.144  TCP 66 59298 → 22 [ACK] Seq=985 Ack=1129 Win=3666 Len=0 TSval=3097379 TSecr=3693383
   24 2.698747061  10.6.15.144 → 192.168.1.16 SSH 1514 Server: Encrypted packet (len=1448)
   25 2.699537849 192.168.1.16 → 10.6.15.144  SSH 246 Client: Encrypted packet (len=180)
   26 2.699817871 192.168.1.16 → 10.6.15.144  SSH 642 Client: Encrypted packet (len=576)
   27 2.707756459  10.6.15.144 → 192.168.1.16 SSH 1514 Server: Encrypted packet (len=1448)
   28 2.707909169  10.6.15.144 → 192.168.1.16 SSH 1514 Server: Encrypted packet (len=1448)
   29 2.707919638 192.168.1.16 → 10.6.15.144  TCP 66 59298 → 22 [ACK] Seq=1741 Ack=5473 Win=3666 Len=0 TSval=3097381 TSecr=3693698
   30 2.708550796  10.6.15.144 → 192.168.1.16 SSH 1514 Server: Encrypted packet (len=1448)
   31 2.708561658 192.168.1.16 → 10.6.15.144  SSH 158 Client: Encrypted packet (len=92)
   32 2.717459495  10.6.15.144 → 192.168.1.16 SSH 1514 Server: Encrypted packet (len=1448)
   33 2.717638325  10.6.15.144 → 192.168.1.16 SSH 1514 Server: Encrypted packet (len=1448)
   34 2.717648751 192.168.1.16 → 10.6.15.144  TCP 66 59298 → 22 [ACK] Seq=1833 Ack=9817 Win=3666 Len=0 TSval=3097384 TSecr=3693700
   35 2.718276971  10.6.15.144 → 192.168.1.16 SSH 1514 Server: Encrypted packet (len=1448)
   36 2.730195466  10.6.15.144 → 192.168.1.16 SSH 1514 Server: Encrypted packet (len=1448)
   37 2.730213853 192.168.1.16 → 10.6.15.144  TCP 66 59298 → 22 [ACK] Seq=1833 Ack=12713 Win=3666 Len=0 TSval=3097387 TSecr=3693700
   38 2.730375497  10.6.15.144 → 192.168.1.16 SSH 1514 Server: Encrypted packet (len=1448)
   39 2.742850042  10.6.15.144 → 192.168.1.16 SSH 1514 Server: Encrypted packet (len=1448)
   40 2.742870834 192.168.1.16 → 10.6.15.144  TCP 66 59298 → 22 [ACK] Seq=1833 Ack=15609 Win=3666 Len=0 TSval=3097390 TSecr=3693703
   41 2.743035696  10.6.15.144 → 192.168.1.16 SSH 1514 Server: Encrypted packet (len=1448)
   42 2.753812821  10.6.15.144 → 192.168.1.16 SSH 1514 Server: [TCP Previous segment not captured] , Encrypted packet (len=1448)
   43 2.753836429 192.168.1.16 → 10.6.15.144  TCP 78 59298 → 22 [ACK] Seq=1833 Ack=17057 Win=3666 Len=0 TSval=3097393 TSecr=3693706 SLE=18505 SRE=19953
   44 2.905324371 192.168.1.16 → 10.6.15.144  SSH 114 Client: Encrypted packet (len=36)
   45 2.909099941 192.168.1.16 → 10.6.15.144  SSH 306 Client: Encrypted packet (len=228)
   46 2.914969431  10.6.15.144 → 192.168.1.16 TCP 66 [TCP Previous segment not captured] 22 → 59298 [ACK] Seq=22849 Ack=2097 Win=1452 Len=0 TSval=3693750 TSecr=3097430
   47 4.691536035 192.168.1.16 → 139.59.50.38 NTP 90 NTP Version 4, client
   48 4.695379110  10.6.15.144 → 192.168.1.16 TCP 1514 [TCP Retransmission] 22 → 59298 [ACK] Seq=17057 Ack=2097 Win=1452 Len=1448 TSval=3694172 TSecr=3097430
   49 4.695409956 192.168.1.16 → 10.6.15.144  TCP 66 59298 → 22 [ACK] Seq=2097 Ack=19953 Win=3666 Len=0 TSval=3097878 TSecr=3694172
   50 4.695558970 10.119.73.122 → 192.168.1.16 ICMP 110 Destination unreachable (Communication administratively filtered)
   51 4.697842920  10.6.15.144 → 192.168.1.16 SSH 1514 Server: Encrypted packet (len=1448)
   52 4.697862361 192.168.1.16 → 10.6.15.144  TCP 78 [TCP Dup ACK 49#1] 59298 → 22 [ACK] Seq=2097 Ack=19953 Win=3666 Len=0 TSval=3097879 TSecr=3694172 SLE=22849 SRE=24297
   53 4.698032185  10.6.15.144 → 192.168.1.16 SSH 1514 Server: Encrypted packet (len=1448)
   54 4.698053498 192.168.1.16 → 10.6.15.144  TCP 78 [TCP Dup ACK 49#2] 59298 → 22 [ACK] Seq=2097 Ack=19953 Win=3666 Len=0 TSval=3097879 TSecr=3694172 SLE=22849 SRE=25745
   55 4.698223138  10.6.15.144 → 192.168.1.16 SSH 1514 Server: Encrypted packet (len=1448)
   56 4.698243148 192.168.1.16 → 10.6.15.144  TCP 78 [TCP Dup ACK 49#3] 59298 → 22 [ACK] Seq=2097 Ack=19953 Win=3666 Len=0 TSval=3097879 TSecr=3694172 SLE=22849 SRE=27193
   57 4.701018776  10.6.15.144 → 192.168.1.16 SSH 1514 Server: [TCP Fast Retransmission] , Encrypted packet (len=1448)
   58 4.701045029 192.168.1.16 → 10.6.15.144  TCP 78 59298 → 22 [ACK] Seq=2097 Ack=21401 Win=3666 Len=0 TSval=3097879 TSecr=3694198 SLE=22849 SRE=27193
   59 4.701141562  10.6.15.144 → 192.168.1.16 TCP 1514 [TCP Out-Of-Order] 22 → 59298 [ACK] Seq=21401 Ack=2097 Win=1452 Len=1448 TSval=3694198 TSecr=3097879
   60 4.701149502 192.168.1.16 → 10.6.15.144  TCP 66 59298 → 22 [ACK] Seq=2097 Ack=27193 Win=3666 Len=0 TSval=3097879 TSecr=3694198
   61 4.701485757  10.6.15.144 → 192.168.1.16 SSH 1514 Server: Encrypted packet (len=1448)
   62 4.701491147 192.168.1.16 → 10.6.15.144  TCP 66 59298 → 22 [ACK] Seq=2097 Ack=28641 Win=3666 Len=0 TSval=3097879 TSecr=3694198
   63 4.704305046  10.6.15.144 → 192.168.1.16 SSH 1514 Server: Encrypted packet (len=1448)
   64 4.704315558 192.168.1.16 → 10.6.15.144  TCP 66 59298 → 22 [ACK] Seq=2097 Ack=30089 Win=3666 Len=0 TSval=3097880 TSecr=3694199
   65 4.704493893  10.6.15.144 → 192.168.1.16 SSH 1514 Server: Encrypted packet (len=1448)
   66 4.704501043 192.168.1.16 → 10.6.15.144  TCP 66 59298 → 22 [ACK] Seq=2097 Ack=31537 Win=3666 Len=0 TSval=3097880 TSecr=3694199
   67 4.704683808  10.6.15.144 → 192.168.1.16 SSH 1514 Server: Encrypted packet (len=1448)
   68 4.704691106 192.168.1.16 → 10.6.15.144  TCP 66 59298 → 22 [ACK] Seq=2097 Ack=32985 Win=3666 Len=0 TSval=3097880 TSecr=3694199
   69 4.706742930  10.6.15.144 → 192.168.1.16 SSH 1514 Server: Encrypted packet (len=1448)
   70 4.706762627 192.168.1.16 → 10.6.15.144  TCP 66 59298 → 22 [ACK] Seq=2097 Ack=34433 Win=3666 Len=0 TSval=3097881 TSecr=3694199
   71 4.706926448  10.6.15.144 → 192.168.1.16 SSH 1514 Server: Encrypted packet (len=1448)
   72 4.706932307 192.168.1.16 → 10.6.15.144  TCP 66 59298 → 22 [ACK] Seq=2097 Ack=35881 Win=3666 Len=0 TSval=3097881 TSecr=3694199
   73 4.707117520  10.6.15.144 → 192.168.1.16 SSH 1514 Server: Encrypted packet (len=1448)
   74 4.707125176 192.168.1.16 → 10.6.15.144  TCP 66 59298 → 22 [ACK] Seq=2097 Ack=37329 Win=3666 Len=0 TSval=3097881 TSecr=3694199
   75 4.709969623  10.6.15.144 → 192.168.1.16 SSH 1514 Server: Encrypted packet (len=1448)
   76 4.709990520 192.168.1.16 → 10.6.15.144  TCP 66 59298 → 22 [ACK] Seq=2097 Ack=38777 Win=3666 Len=0 TSval=3097882 TSecr=3694200
   77 4.710151201  10.6.15.144 → 192.168.1.16 SSH 1514 Server: Encrypted packet (len=1448)
   78 4.710158178 192.168.1.16 → 10.6.15.144  TCP 66 59298 → 22 [ACK] Seq=2097 Ack=40225 Win=3666 Len=0 TSval=3097882 TSecr=3694200
   79 4.710495273  10.6.15.144 → 192.168.1.16 SSH 1514 Server: Encrypted packet (len=1448)
   80 4.710503226 192.168.1.16 → 10.6.15.144  TCP 66 59298 → 22 [ACK] Seq=2097 Ack=41673 Win=3666 Len=0 TSval=3097882 TSecr=3694200
   81 4.712534977  10.6.15.144 → 192.168.1.16 SSH 1514 Server: Encrypted packet (len=1448)
   82 4.712554675 192.168.1.16 → 10.6.15.144  TCP 66 59298 → 22 [ACK] Seq=2097 Ack=43121 Win=3666 Len=0 TSval=3097882 TSecr=3694201
   83 4.712717664  10.6.15.144 → 192.168.1.16 SSH 1514 Server: Encrypted packet (len=1448)
   84 4.712723731 192.168.1.16 → 10.6.15.144  TCP 66 59298 → 22 [ACK] Seq=2097 Ack=44569 Win=3666 Len=0 TSval=3097882 TSecr=3694201
   85 4.713066204  10.6.15.144 → 192.168.1.16 SSH 1514 Server: Encrypted packet (len=1448)
   86 4.713077444 192.168.1.16 → 10.6.15.144  TCP 66 59298 → 22 [ACK] Seq=2097 Ack=46017 Win=3666 Len=0 TSval=3097882 TSecr=3694201
   87 4.713253247  10.6.15.144 → 192.168.1.16 SSH 1514 Server: Encrypted packet (len=1448)
   88 4.716023691  10.6.15.144 → 192.168.1.16 SSH 1514 Server: Encrypted packet (len=1448)
   89 4.716044539 192.168.1.16 → 10.6.15.144  TCP 66 59298 → 22 [ACK] Seq=2097 Ack=48913 Win=3666 Len=0 TSval=3097883 TSecr=3694201
   90 4.716205820  10.6.15.144 → 192.168.1.16 SSH 1514 Server: Encrypted packet (len=1448)
   91 4.719794710  10.6.15.144 → 192.168.1.16 SSH 1514 Server: Encrypted packet (len=1448)
   92 4.719815616 192.168.1.16 → 10.6.15.144  TCP 66 59298 → 22 [ACK] Seq=2097 Ack=51809 Win=3666 Len=0 TSval=3097884 TSecr=3694201
   93 4.719976970  10.6.15.144 → 192.168.1.16 SSH 1514 Server: Encrypted packet (len=1448)
   94 4.723513153  10.6.15.144 → 192.168.1.16 SSH 1514 Server: Encrypted packet (len=1448)
   95 4.723533943 192.168.1.16 → 10.6.15.144  TCP 66 59298 → 22 [ACK] Seq=2097 Ack=54705 Win=3666 Len=0 TSval=3097885 TSecr=3694202
   96 4.723693951  10.6.15.144 → 192.168.1.16 SSH 1514 Server: Encrypted packet (len=1448)
   97 4.727281957  10.6.15.144 → 192.168.1.16 SSH 1514 Server: Encrypted packet (len=1448)
   98 4.727294230 192.168.1.16 → 10.6.15.144  TCP 66 59298 → 22 [ACK] Seq=2097 Ack=57601 Win=3666 Len=0 TSval=3097886 TSecr=3694203
   99 4.727473889  10.6.15.144 → 192.168.1.16 SSH 1514 Server: Encrypted packet (len=1448)
  100 4.733136478  10.6.15.144 → 192.168.1.16 SSH 1514 Server: Encrypted packet (len=1448)
  101 4.733154555 192.168.1.16 → 10.6.15.144  TCP 66 59298 → 22 [ACK] Seq=2097 Ack=60497 Win=3666 Len=0 TSval=3097887 TSecr=3694204
  102 4.733261798  10.6.15.144 → 192.168.1.16 SSH 1514 Server: Encrypted packet (len=1448)
  103 4.733344981 192.168.1.16 → 10.6.15.144  SSH 102 Client: Encrypted packet (len=36)
  104 4.737849391  10.6.15.144 → 192.168.1.16 SSH 1514 Server: Encrypted packet (len=1448)
  105 4.737972820  10.6.15.144 → 192.168.1.16 SSH 1514 Server: Encrypted packet (len=1448)
  106 4.737981581 192.168.1.16 → 10.6.15.144  TCP 66 59298 → 22 [ACK] Seq=2133 Ack=64841 Win=3666 Len=0 TSval=3097889 TSecr=3694206
  107 4.738196937  10.6.15.144 → 192.168.1.16 SSH 1514 Server: Encrypted packet (len=1448)
  108 4.738392112  10.6.15.144 → 192.168.1.16 SSH 1514 Server: Encrypted packet (len=1448)
  109 4.738400558 192.168.1.16 → 10.6.15.144  TCP 66 59298 → 22 [ACK] Seq=2133 Ack=67737 Win=3666 Len=0 TSval=3097889 TSecr=3694206
  110 4.742706107  10.6.15.144 → 192.168.1.16 SSH 1514 Server: Encrypted packet (len=1448)
  111 4.742828523  10.6.15.144 → 192.168.1.16 SSH 1514 Server: Encrypted packet (len=1448)
  112 4.742837376 192.168.1.16 → 10.6.15.144  TCP 66 59298 → 22 [ACK] Seq=2133 Ack=70633 Win=3666 Len=0 TSval=3097890 TSecr=3694208
  113 4.743049290  10.6.15.144 → 192.168.1.16 SSH 1514 Server: Encrypted packet (len=1448)
  114 4.743396586  10.6.15.144 → 192.168.1.16 SSH 1514 Server: Encrypted packet (len=1448)
  115 4.743403388 192.168.1.16 → 10.6.15.144  TCP 66 59298 → 22 [ACK] Seq=2133 Ack=73529 Win=3666 Len=0 TSval=3097890 TSecr=3694208
  116 4.747837325  10.6.15.144 → 192.168.1.16 SSH 1514 Server: Encrypted packet (len=1448)
  117 4.748012236  10.6.15.144 → 192.168.1.16 SSH 1514 Server: Encrypted packet (len=1448)
  118 4.748019342 192.168.1.16 → 10.6.15.144  TCP 66 59298 → 22 [ACK] Seq=2133 Ack=76425 Win=3666 Len=0 TSval=3097891 TSecr=3694209
  119 4.748207075  10.6.15.144 → 192.168.1.16 SSH 1514 Server: Encrypted packet (len=1448)
  120 4.748551252  10.6.15.144 → 192.168.1.16 SSH 1514 Server: Encrypted packet (len=1448)
  121 4.748559457 192.168.1.16 → 10.6.15.144  TCP 66 59298 → 22 [ACK] Seq=2133 Ack=79321 Win=3666 Len=0 TSval=3097891 TSecr=3694209
  122 4.753593012  10.6.15.144 → 192.168.1.16 SSH 1514 Server: Encrypted packet (len=1448)
  123 4.753774362  10.6.15.144 → 192.168.1.16 SSH 1514 Server: Encrypted packet (len=1448)
  124 4.753782336 192.168.1.16 → 10.6.15.144  TCP 66 59298 → 22 [ACK] Seq=2133 Ack=82217 Win=3666 Len=0 TSval=3097893 TSecr=3694210
  125 4.753965914  10.6.15.144 → 192.168.1.16 SSH 1514 Server: Encrypted packet (len=1448)
  126 4.754310891  10.6.15.144 → 192.168.1.16 SSH 1514 Server: Encrypted packet (len=1448)
  127 4.754321796 192.168.1.16 → 10.6.15.144  TCP 66 59298 → 22 [ACK] Seq=2133 Ack=85113 Win=3666 Len=0 TSval=3097893 TSecr=3694210
  128 4.760440834  10.6.15.144 → 192.168.1.16 SSH 1514 Server: Encrypted packet (len=1448)
  129 4.760624065  10.6.15.144 → 192.168.1.16 SSH 1514 Server: Encrypted packet (len=1448)
  130 4.760638432 192.168.1.16 → 10.6.15.144  TCP 66 59298 → 22 [ACK] Seq=2133 Ack=88009 Win=3666 Len=0 TSval=3097894 TSecr=3694212
  131 4.760815429  10.6.15.144 → 192.168.1.16 SSH 1514 Server: Encrypted packet (len=1448)
  132 4.761160549  10.6.15.144 → 192.168.1.16 SSH 1514 Server: Encrypted packet (len=1448)
  133 4.761172412 192.168.1.16 → 10.6.15.144  TCP 66 59298 → 22 [ACK] Seq=2133 Ack=90905 Win=3666 Len=0 TSval=3097894 TSecr=3694212
  134 4.767703698  10.6.15.144 → 192.168.1.16 SSH 1514 Server: Encrypted packet (len=1448)
  135 4.767887925  10.6.15.144 → 192.168.1.16 SSH 1514 Server: Encrypted packet (len=1448)
  136 4.767902356 192.168.1.16 → 10.6.15.144  TCP 66 59298 → 22 [ACK] Seq=2133 Ack=93801 Win=3666 Len=0 TSval=3097896 TSecr=3694213
  137 4.768233048  10.6.15.144 → 192.168.1.16 SSH 1514 Server: Encrypted packet (len=1448)
  138 4.768422677  10.6.15.144 → 192.168.1.16 SSH 1514 Server: Encrypted packet (len=1448)
  139 4.768432557 192.168.1.16 → 10.6.15.144  TCP 66 59298 → 22 [ACK] Seq=2133 Ack=96697 Win=3666 Len=0 TSval=3097896 TSecr=3694213
  140 4.775032613  10.6.15.144 → 192.168.1.16 SSH 1514 Server: Encrypted packet (len=1448)
  141 4.775215891  10.6.15.144 → 192.168.1.16 SSH 1514 Server: Encrypted packet (len=1448)
  142 4.775231075 192.168.1.16 → 10.6.15.144  TCP 66 59298 → 22 [ACK] Seq=2133 Ack=99593 Win=3666 Len=0 TSval=3097898 TSecr=3694215
  143 4.775560345  10.6.15.144 → 192.168.1.16 SSH 1514 Server: Encrypted packet (len=1448)
  144 4.775752064  10.6.15.144 → 192.168.1.16 SSH 1514 Server: Encrypted packet (len=1448)
  145 4.775763202 192.168.1.16 → 10.6.15.144  TCP 66 59298 → 22 [ACK] Seq=2133 Ack=102489 Win=3666 Len=0 TSval=3097898 TSecr=3694215
  146 4.775943670  10.6.15.144 → 192.168.1.16 SSH 1514 Server: Encrypted packet (len=1448)
  147 4.776135616  10.6.15.144 → 192.168.1.16 SSH 1514 Server: Encrypted packet (len=1448)
  148 4.776145230 192.168.1.16 → 10.6.15.144  TCP 66 59298 → 22 [ACK] Seq=2133 Ack=105385 Win=3666 Len=0 TSval=3097898 TSecr=3694215
  149 4.783834061  10.6.15.144 → 192.168.1.16 SSH 1514 Server: Encrypted packet (len=1448)
  150 4.784016138  10.6.15.144 → 192.168.1.16 SSH 1514 Server: Encrypted packet (len=1448)
  151 4.784030332 192.168.1.16 → 10.6.15.144  TCP 66 59298 → 22 [ACK] Seq=2133 Ack=108281 Win=3666 Len=0 TSval=3097900 TSecr=3694217
  152 4.784206507  10.6.15.144 → 192.168.1.16 SSH 1514 Server: Encrypted packet (len=1448)
  153 4.784553631  10.6.15.144 → 192.168.1.16 SSH 1514 Server: Encrypted packet (len=1448)
  154 4.784565718 192.168.1.16 → 10.6.15.144  TCP 66 59298 → 22 [ACK] Seq=2133 Ack=111177 Win=3666 Len=0 TSval=3097900 TSecr=3694217
  155 4.784743971  10.6.15.144 → 192.168.1.16 SSH 1514 Server: Encrypted packet (len=1448)
  156 4.784935429  10.6.15.144 → 192.168.1.16 SSH 1514 Server: Encrypted packet (len=1448)
  157 4.784946215 192.168.1.16 → 10.6.15.144  TCP 66 59298 → 22 [ACK] Seq=2133 Ack=114073 Win=3666 Len=0 TSval=3097900 TSecr=3694217
  158 4.794266277  10.6.15.144 → 192.168.1.16 SSH 1514 Server: Encrypted packet (len=1448)
  159 4.794447906  10.6.15.144 → 192.168.1.16 SSH 1514 Server: Encrypted packet (len=1448)
  160 4.794461831 192.168.1.16 → 10.6.15.144  TCP 66 59298 → 22 [ACK] Seq=2133 Ack=116969 Win=3666 Len=0 TSval=3097903 TSecr=3694219
  161 4.796643732  10.6.15.144 → 192.168.1.16 SSH 1514 Server: Encrypted packet (len=1448)
  162 4.796828785  10.6.15.144 → 192.168.1.16 SSH 1514 Server: Encrypted packet (len=1448)
  163 4.796842040 192.168.1.16 → 10.6.15.144  TCP 66 59298 → 22 [ACK] Seq=2133 Ack=119865 Win=3666 Len=0 TSval=3097903 TSecr=3694219
  164 4.797019537  10.6.15.144 → 192.168.1.16 SSH 1514 Server: Encrypted packet (len=1448)
  165 4.797210791  10.6.15.144 → 192.168.1.16 SSH 1514 Server: Encrypted packet (len=1448)
  166 4.797221916 192.168.1.16 → 10.6.15.144  TCP 66 59298 → 22 [ACK] Seq=2133 Ack=122761 Win=3666 Len=0 TSval=3097903 TSecr=3694219
  167 4.804087515  10.6.15.144 → 192.168.1.16 SSH 1514 Server: Encrypted packet (len=1448)
  168 4.804274614  10.6.15.144 → 192.168.1.16 SSH 1514 Server: Encrypted packet (len=1448)
  169 4.804289427 192.168.1.16 → 10.6.15.144  TCP 66 59298 → 22 [ACK] Seq=2133 Ack=125657 Win=3666 Len=0 TSval=3097905 TSecr=3694222
  170 4.806642715  10.6.15.144 → 192.168.1.16 SSH 1514 Server: Encrypted packet (len=1448)
  171 4.806825141  10.6.15.144 → 192.168.1.16 SSH 1514 Server: Encrypted packet (len=1448)
  172 4.806838805 192.168.1.16 → 10.6.15.144  TCP 66 59298 → 22 [ACK] Seq=2133 Ack=128553 Win=3666 Len=0 TSval=3097906 TSecr=3694222
  173 4.807172786  10.6.15.144 → 192.168.1.16 SSH 1514 Server: Encrypted packet (len=1448)
  174 4.807363556  10.6.15.144 → 192.168.1.16 SSH 1514 Server: Encrypted packet (len=1448)
  175 4.807373906 192.168.1.16 → 10.6.15.144  TCP 66 59298 → 22 [ACK] Seq=2133 Ack=131449 Win=3666 Len=0 TSval=3097906 TSecr=3694222
  176 4.810996327  10.6.15.144 → 192.168.1.16 SSH 1514 Server: Encrypted packet (len=1448)
  177 4.811183455  10.6.15.144 → 192.168.1.16 SSH 1514 Server: Encrypted packet (len=1448)
  178 4.811195001 192.168.1.16 → 10.6.15.144  TCP 66 59298 → 22 [ACK] Seq=2133 Ack=134345 Win=3666 Len=0 TSval=3097907 TSecr=3694224
  179 4.813719050  10.6.15.144 → 192.168.1.16 SSH 1514 Server: Encrypted packet (len=1448)
  180 4.813902584  10.6.15.144 → 192.168.1.16 SSH 1514 Server: Encrypted packet (len=1448)
  181 4.813914033 192.168.1.16 → 10.6.15.144  TCP 66 59298 → 22 [ACK] Seq=2133 Ack=137241 Win=3666 Len=0 TSval=3097908 TSecr=3694225
  182 4.814095147  10.6.15.144 → 192.168.1.16 SSH 1514 Server: Encrypted packet (len=1448)
  183 4.814441857  10.6.15.144 → 192.168.1.16 SSH 1514 Server: Encrypted packet (len=1448)
  184 4.814454665 192.168.1.16 → 10.6.15.144  TCP 66 59298 → 22 [ACK] Seq=2133 Ack=140137 Win=3666 Len=0 TSval=3097908 TSecr=3694225
  185 4.815359699 192.168.1.16 → 10.6.15.144  SSH 134 Client: Encrypted packet (len=68)
  186 4.816560738  10.6.15.144 → 192.168.1.16 SSH 1514 Server: Encrypted packet (len=1448)
  187 4.816878602  10.6.15.144 → 192.168.1.16 SSH 1514 Server: Encrypted packet (len=1448)
  188 4.816886228 192.168.1.16 → 10.6.15.144  TCP 66 59298 → 22 [ACK] Seq=2201 Ack=143033 Win=3666 Len=0 TSval=3097908 TSecr=3694226
  189 4.817140250 192.168.1.16 → 10.6.15.144  SSH 134 Client: Encrypted packet (len=68)
  190 4.818614742 192.168.1.16 → 10.6.15.144  SSH 206 Client: Encrypted packet (len=140)
  191 4.820025570 192.168.1.16 → 10.6.15.144  SSH 206 Client: Encrypted packet (len=140)
  192 4.821718357  10.6.15.144 → 192.168.1.16 SSH 1514 Server: Encrypted packet (len=1448)
  193 4.821898545  10.6.15.144 → 192.168.1.16 SSH 1514 Server: Encrypted packet (len=1448)
  194 4.821905090 192.168.1.16 → 10.6.15.144  TCP 66 59298 → 22 [ACK] Seq=2549 Ack=145929 Win=3666 Len=0 TSval=3097910 TSecr=3694227
  195 4.822089282  10.6.15.144 → 192.168.1.16 SSH 1514 Server: Encrypted packet (len=1448)
  196 4.822437094  10.6.15.144 → 192.168.1.16 SSH 1514 Server: Encrypted packet (len=1448)
  197 4.822445322 192.168.1.16 → 10.6.15.144  TCP 66 59298 → 22 [ACK] Seq=2549 Ack=148825 Win=3666 Len=0 TSval=3097910 TSecr=3694227
  198 4.822629219  10.6.15.144 → 192.168.1.16 SSH 1514 Server: Encrypted packet (len=1448)
  199 4.822642737 192.168.1.16 → 10.6.15.144  SSH 342 Client: Encrypted packet (len=276)
  200 4.822818799  10.6.15.144 → 192.168.1.16 SSH 1514 Server: Encrypted packet (len=1448)
  201 4.824255875  10.6.15.144 → 192.168.1.16 TCP 66 22 → 59298 [ACK] Seq=151721 Ack=2409 Win=1452 Len=0 TSval=3694228 TSecr=3097908
  202 4.828576505 192.168.1.16 → 10.6.15.144  SSH 158 Client: Encrypted packet (len=92)
  203 4.830198135  10.6.15.144 → 192.168.1.16 SSH 1514 Server: Encrypted packet (len=1448)
  204 4.830237823  10.6.15.144 → 192.168.1.16 SSH 586 Server: Encrypted packet (len=520)
  205 4.830249218 192.168.1.16 → 10.6.15.144  TCP 66 59298 → 22 [ACK] Seq=2917 Ack=153689 Win=3666 Len=0 TSval=3097912 TSecr=3694229
  206 4.836326157  10.6.15.144 → 192.168.1.16 TCP 66 22 → 59298 [ACK] Seq=153689 Ack=2917 Win=1452 Len=0 TSval=3694230 TSecr=3097910
  207 4.847666385  10.6.15.144 → 192.168.1.16 SSH 182 Server: Encrypted packet (len=116)
  208 4.867186833  10.6.15.144 → 192.168.1.16 SSH 342 Server: Encrypted packet (len=276)
  209 4.867267680 192.168.1.16 → 10.6.15.144  TCP 66 59298 → 22 [ACK] Seq=2917 Ack=154081 Win=3666 Len=0 TSval=3097921 TSecr=3694233
  210 4.867337416  10.6.15.144 → 192.168.1.16 SSH 222 Server: Encrypted packet (len=156)
  211 4.867868305  10.6.15.144 → 192.168.1.16 SSH 318 Server: Encrypted packet (len=252)
  212 4.867927081 192.168.1.16 → 10.6.15.144  TCP 66 59298 → 22 [ACK] Seq=2917 Ack=154489 Win=3666 Len=0 TSval=3097921 TSecr=3694237
  213 4.868052214 192.168.1.16 → 10.6.15.144  SSH 134 Client: Encrypted packet (len=68)
  214 4.875755882  10.6.15.144 → 192.168.1.16 SSH 358 Server: Encrypted packet (len=292)
  215 4.899407102  10.6.15.144 → 192.168.1.16 SSH 174 Server: Encrypted packet (len=108)
  216 4.899488020 192.168.1.16 → 10.6.15.144  TCP 66 59298 → 22 [ACK] Seq=2985 Ack=154889 Win=3666 Len=0 TSval=3097929 TSecr=3694240
  217 5.359713988 192.168.1.16 → 10.6.15.144  SSH 1030 Client: Encrypted packet (len=964)
  218 5.374195739 192.168.1.16 → 10.6.15.144  SSH 694 Client: Encrypted packet (len=628)
  219 5.384355141  10.6.15.144 → 192.168.1.16 TCP 66 22 → 59298 [ACK] Seq=154889 Ack=4577 Win=1452 Len=0 TSval=3694367 TSecr=3098044
  220 5.413264102  10.6.15.144 → 192.168.1.16 SSH 390 Server: Encrypted packet (len=324)
  221 5.453538086 192.168.1.16 → 10.6.15.144  TCP 66 59298 → 22 [ACK] Seq=4577 Ack=155213 Win=3666 Len=0 TSval=3098068 TSecr=3694374
  222 5.459561921 192.168.1.16 → 10.6.15.144  SSH 430 Client: Encrypted packet (len=364)
  223 5.477540564  10.6.15.144 → 192.168.1.16 SSH 270 Server: Encrypted packet (len=204)
  224 5.477569541 192.168.1.16 → 10.6.15.144  TCP 66 59298 → 22 [ACK] Seq=4941 Ack=155417 Win=3666 Len=0 TSval=3098074 TSecr=3694390
  225 5.477585880  10.6.15.144 → 192.168.1.16 SSH 142 Server: Encrypted packet (len=76)
  226 5.477591995 192.168.1.16 → 10.6.15.144  TCP 66 59298 → 22 [ACK] Seq=4941 Ack=155493 Win=3666 Len=0 TSval=3098074 TSecr=3694390
  227 5.478908406 192.168.1.16 → 10.6.15.144  SSH 134 Client: Encrypted packet (len=68)
  228 5.483189210 192.168.1.16 → 10.6.15.144  SSH 990 Client: Encrypted packet (len=924)
  229 5.491814883  10.6.15.144 → 192.168.1.16 TCP 66 22 → 59298 [ACK] Seq=155493 Ack=5933 Win=1452 Len=0 TSval=3694394 TSecr=3098074
  230 5.527018121  10.6.15.144 → 192.168.1.16 SSH 454 Server: Encrypted packet (len=388)
  231 5.527037044  10.6.15.144 → 192.168.1.16 SSH 102 Server: Encrypted packet (len=36)
  232 5.527083088 192.168.1.16 → 10.6.15.144  TCP 66 59298 → 22 [ACK] Seq=5933 Ack=155917 Win=3666 Len=0 TSval=3098086 TSecr=3694403
  233 5.528492078 192.168.1.16 → 10.6.15.144  SSH 138 Client: Encrypted packet (len=72)
  234 5.539229928  10.6.15.144 → 192.168.1.16 SSH 102 Server: Encrypted packet (len=36)
  235 5.557924229 192.168.1.16 → 10.6.15.144  SSH 262 Client: Encrypted packet (len=196)
  236 5.589416953  10.6.15.144 → 192.168.1.16 SSH 134 Server: Encrypted packet (len=68)
  237 5.589448319  10.6.15.144 → 192.168.1.16 SSH 278 Server: Encrypted packet (len=212)
  238 5.589487104 192.168.1.16 → 10.6.15.144  TCP 66 59298 → 22 [ACK] Seq=6201 Ack=156233 Win=3666 Len=0 TSval=3098101 TSecr=3694419
  239 5.619083699  10.6.15.144 → 192.168.1.16 SSH 150 Server: Encrypted packet (len=84)
  240 5.619246214  10.6.15.144 → 192.168.1.16 SSH 238 Server: Encrypted packet (len=172)
  241 5.619369168 192.168.1.16 → 10.6.15.144  TCP 66 59298 → 22 [ACK] Seq=6201 Ack=156489 Win=3666 Len=0 TSval=3098109 TSecr=3694426
  242 5.741587450 192.168.1.16 → 10.6.15.144  SSH 110 Client: Encrypted packet (len=44)
  243 5.742359736 192.168.1.16 → 10.6.15.144  SSH 1514 Client: Encrypted packet (len=1448)
  244 5.742538062 192.168.1.16 → 10.6.15.144  SSH 934 Client: Encrypted packet (len=868)
  245 5.749156047  10.6.15.144 → 192.168.1.16 TCP 66 22 → 59298 [ACK] Seq=156489 Ack=7693 Win=1452 Len=0 TSval=3694459 TSecr=3098137
  246 5.785860056  10.6.15.144 → 192.168.1.16 TCP 66 22 → 59298 [ACK] Seq=156489 Ack=8561 Win=1452 Len=0 TSval=3694469 TSecr=3098140
  247 5.835816377 192.168.1.16 → 10.6.15.144  SSH 574 Client: Encrypted packet (len=508)
  248 5.841665010  10.6.15.144 → 192.168.1.16 TCP 66 22 → 59298 [ACK] Seq=156489 Ack=9069 Win=1452 Len=0 TSval=3694482 TSecr=3098163
  249 5.857793106 192.168.1.16 → 10.6.15.144  SSH 1514 Client: Encrypted packet (len=1448)
  250 5.858347415 192.168.1.16 → 10.6.15.144  SSH 246 Client: Encrypted packet (len=180)
  251 5.858631957  10.6.15.144 → 192.168.1.16 SSH 1514 Server: Encrypted packet (len=1448)
  252 5.858813233  10.6.15.144 → 192.168.1.16 SSH 1326 Server: Encrypted packet (len=1260)
  253 5.858820102 192.168.1.16 → 10.6.15.144  TCP 66 59298 → 22 [ACK] Seq=10697 Ack=159197 Win=3666 Len=0 TSval=3098169 TSecr=3694486
  254 5.865219953  10.6.15.144 → 192.168.1.16 TCP 66 22 → 59298 [ACK] Seq=159197 Ack=10697 Win=1452 Len=0 TSval=3694488 TSecr=3098169
  255 5.866483471 192.168.1.16 → 10.6.15.144  SSH 606 Client: Encrypted packet (len=540)
  256 5.891340960 10.22.18.209 → 224.0.0.252  LLMNR 64 Standard query 0x181b A wpad
  257 5.891366811  10.6.15.144 → 192.168.1.16 SSH 150 Server: Encrypted packet (len=84)
  258 5.933539105 192.168.1.16 → 10.6.15.144  TCP 66 59298 → 22 [ACK] Seq=11237 Ack=159281 Win=3666 Len=0 TSval=3098188 TSecr=3694493
  259 5.987908091 10.22.18.209 → 224.0.0.252  LLMNR 64 Standard query 0x181b A wpad
  260 6.030344234  10.6.15.144 → 192.168.1.16 SSH 110 Server: Encrypted packet (len=44)
  261 6.030365118 192.168.1.16 → 10.6.15.144  TCP 66 59298 → 22 [ACK] Seq=11237 Ack=159325 Win=3666 Len=0 TSval=3098212 TSecr=3694529
  262 6.030664672 192.168.1.16 → 10.6.15.144  SSH 158 Client: Encrypted packet (len=92)
  263 6.059406394 192.168.1.16 → 10.6.15.144  SSH 1086 Client: Encrypted packet (len=1020)
  264 6.069111094  10.6.15.144 → 192.168.1.16 SSH 326 Server: Encrypted packet (len=260)
  265 6.096038119  10.6.15.144 → 192.168.1.16 SSH 310 Server: Encrypted packet (len=244)
  266 6.096145955 192.168.1.16 → 10.6.15.144  TCP 66 59298 → 22 [ACK] Seq=12349 Ack=159829 Win=3666 Len=0 TSval=3098228 TSecr=3694538
  267 6.122100945  10.6.15.144 → 192.168.1.16 SSH 230 Server: Encrypted packet (len=164)
  268 6.165548398 192.168.1.16 → 10.6.15.144  TCP 66 59298 → 22 [ACK] Seq=12349 Ack=159993 Win=3666 Len=0 TSval=3098246 TSecr=3694551
  269 6.212600370  10.6.15.144 → 192.168.1.16 SSH 662 Server: Encrypted packet (len=596)
  270 6.212619501 192.168.1.16 → 10.6.15.144  TCP 66 59298 → 22 [ACK] Seq=12349 Ack=160589 Win=3666 Len=0 TSval=3098257 TSecr=3694574
  271 7.999609527  10.6.15.144 → 192.168.1.16 SSH 246 Server: Encrypted packet (len=180)
  272 7.999635320 192.168.1.16 → 10.6.15.144  TCP 66 59298 → 22 [ACK] Seq=12349 Ack=160769 Win=3666 Len=0 TSval=3098704 TSecr=3694679
  273 7.999653026  10.6.15.144 → 192.168.1.16 SSH 246 Server: [TCP Spurious Retransmission] , Encrypted packet (len=180)
  274 7.999657525 192.168.1.16 → 10.6.15.144  TCP 78 [TCP Dup ACK 272#1] 59298 → 22 [ACK] Seq=12349 Ack=160769 Win=3666 Len=0 TSval=3098704 TSecr=3694735 SLE=160589 SRE=160769
  275 7.999662790  10.6.15.144 → 192.168.1.16 SSH 246 Server: [TCP Spurious Retransmission] , Encrypted packet (len=180)
  276 7.999664640 192.168.1.16 → 10.6.15.144  TCP 78 [TCP Dup ACK 272#2] 59298 → 22 [ACK] Seq=12349 Ack=160769 Win=3666 Len=0 TSval=3098704 TSecr=3694791 SLE=160589 SRE=160769
  277 7.999779483  10.22.17.29 → 224.0.0.252  LLMNR 64 Standard query 0x0918 A wpad
  278 7.999816715  10.6.15.144 → 192.168.1.16 SSH 246 Server: [TCP Spurious Retransmission] , Encrypted packet (len=180)
  279 7.999823943 192.168.1.16 → 10.6.15.144  TCP 78 [TCP Dup ACK 272#3] 59298 → 22 [ACK] Seq=12349 Ack=160769 Win=3666 Len=0 TSval=3098704 TSecr=3694903 SLE=160589 SRE=160769
  280 7.999832758  10.22.17.29 → 224.0.0.252  LLMNR 64 Standard query 0x0918 A wpad
  281 7.999960641 192.168.1.16 → 10.6.15.144  SSH 134 Client: Encrypted packet (len=68)
  282 8.055297887  10.6.15.144 → 192.168.1.16 TCP 66 22 → 59298 [ACK] Seq=160769 Ack=12417 Win=1452 Len=0 TSval=3695036 TSecr=3098704
  283 11.691653463 192.168.1.16 → 139.59.50.38 NTP 90 NTP Version 4, client
  284 12.221587162 192.168.1.16 → 54.76.71.168 TCP 66 42414 → 8282 [ACK] Seq=1 Ack=1 Win=296 Len=0 TSval=3099760 TSecr=607200361
  285 12.991550293 54.76.71.168 → 192.168.1.16 TCP 66 [TCP ACKed unseen segment] 8282 → 42414 [ACK] Seq=1 Ack=2 Win=121 Len=0 TSval=607211737 TSecr=3076726
  286 13.720271215 192.168.1.16 → 10.6.15.144  SSH 1514 Client: Encrypted packet (len=1448)
  287 13.721631596 192.168.1.16 → 10.6.15.144  SSH 326 Client: Encrypted packet (len=260)
  288 13.730207738  10.6.15.144 → 192.168.1.16 TCP 66 22 → 59298 [ACK] Seq=160769 Ack=13865 Win=1452 Len=0 TSval=3696454 TSecr=3100134
  289 13.730227902  10.6.15.144 → 192.168.1.16 TCP 66 22 → 59298 [ACK] Seq=160769 Ack=14125 Win=1450 Len=0 TSval=3696454 TSecr=3100135
  290 13.733081055  10.6.15.144 → 192.168.1.16 SSH 142 Server: Encrypted packet (len=76)
  291 13.756884080 10.22.18.209 → 224.0.0.252  LLMNR 64 Standard query 0x9f4d A wpad
  292 13.773596524 192.168.1.16 → 10.6.15.144  TCP 66 59298 → 22 [ACK] Seq=14125 Ack=160845 Win=3666 Len=0 TSval=3100148 TSecr=3696455
  293 13.852029495  10.6.15.144 → 192.168.1.16 SSH 830 Server: Encrypted packet (len=764)
  294 13.852056590 192.168.1.16 → 10.6.15.144  TCP 66 59298 → 22 [ACK] Seq=14125 Ack=161609 Win=3666 Len=0 TSval=3100167 TSecr=3696485
  295 13.852401260  10.6.15.144 → 192.168.1.16 SSH 526 Server: Encrypted packet (len=460)
  296 13.852409093 192.168.1.16 → 10.6.15.144  TCP 66 59298 → 22 [ACK] Seq=14125 Ack=162069 Win=3666 Len=0 TSval=3100167 TSecr=3696485
  297 13.853100702 192.168.1.16 → 10.6.15.144  SSH 134 Client: Encrypted packet (len=68)
  298 13.856563183 10.22.18.209 → 224.0.0.252  LLMNR 64 Standard query 0x9f4d A wpad
  299 13.897848666  10.6.15.144 → 192.168.1.16 TCP 66 22 → 59298 [ACK] Seq=162069 Ack=14193 Win=1452 Len=0 TSval=3696496 TSecr=3100167
  300 16.000007989  10.6.15.144 → 192.168.1.16 SSH 126 Server: Encrypted packet (len=60)
  301 16.000035020  10.6.15.144 → 192.168.1.16 SSH 102 Server: Encrypted packet (len=36)
  302 16.000041743  10.6.15.144 → 192.168.1.16 SSH 126 Server: Encrypted packet (len=60)
  303 16.000046871  10.6.15.144 → 192.168.1.16 SSH 102 Server: Encrypted packet (len=36)
  304 16.000108546 192.168.1.16 → 10.6.15.144  TCP 66 59298 → 22 [ACK] Seq=14193 Ack=162261 Win=3666 Len=0 TSval=3100704 TSecr=3696973
  305 20.018372574   10.22.18.8 → 224.0.0.252  LLMNR 75 Standard query 0x181c ANY DESKTOP-0VASQII
  306 20.691596673 192.168.1.16 → 139.59.50.38 NTP 90 NTP Version 4, client
  307 20.693625652   10.22.18.8 → 224.0.0.252  LLMNR 75 Standard query 0xd31b ANY DESKTOP-0VASQII
  308 22.015928249   10.22.18.8 → 224.0.0.252  LLMNR 75 Standard query 0xd31b ANY DESKTOP-0VASQII
  309 22.015954512   10.22.18.8 → 224.0.0.252  LLMNR 75 Standard query 0x756e ANY DESKTOP-0VASQII
  310 22.015960350 10.22.18.209 → 224.0.0.252  LLMNR 64 Standard query 0xb432 A wpad
  311 22.016367293 10.22.18.209 → 224.0.0.252  LLMNR 64 Standard query 0xb432 A wpad
  312 22.016393442   10.22.18.8 → 224.0.0.252  LLMNR 75 Standard query 0x756e ANY DESKTOP-0VASQII
  313 26.192294885 192.168.1.16 → 54.76.71.168 TCP 128 [TCP Previous segment not captured] 42414 → 8282 [PSH, ACK] Seq=2 Ack=1 Win=296 Len=62 TSval=3103252 TSecr=607211737
  314 27.453552238 192.168.1.16 → 54.76.71.168 TCP 128 [TCP Retransmission] 42414 → 8282 [PSH, ACK] Seq=2 Ack=1 Win=296 Len=62 TSval=3103568 TSecr=607211737
  315 27.455297165 54.76.71.168 → 192.168.1.16 TCP 66 [TCP ACKed unseen segment] 8282 → 42414 [ACK] Seq=1 Ack=64 Win=121 Len=0 TSval=607215229 TSecr=3103252
  316 27.455318000  10.6.15.144 → 192.168.1.16 SSH 126 Server: Encrypted packet (len=60)
  317 27.455345924  10.6.15.144 → 192.168.1.16 SSH 102 Server: Encrypted packet (len=36)
  318 27.455413122 192.168.1.16 → 10.6.15.144  TCP 66 59298 → 22 [ACK] Seq=14193 Ack=162357 Win=3666 Len=0 TSval=3103568 TSecr=3699680
  319 27.455774060  10.6.15.144 → 192.168.1.16 SSH 102 Server: [TCP Spurious Retransmission] , Encrypted packet (len=36)
  320 27.455793404 192.168.1.16 → 10.6.15.144  TCP 78 [TCP Dup ACK 318#1] 59298 → 22 [ACK] Seq=14193 Ack=162357 Win=3666 Len=0 TSval=3103568 TSecr=3699752 SLE=162321 SRE=162357
  321 27.999630376 54.76.71.168 → 192.168.1.16 TCP 78 [TCP Dup ACK 315#1] 8282 → 42414 [ACK] Seq=1 Ack=64 Win=121 Len=0 TSval=607215545 TSecr=3103568 SLE=2 SRE=64
