    1 0.000000000 192.168.1.16 → 10.6.15.144  SSH 270 Client: Encrypted packet (len=204)
    2 0.013381376  10.6.15.144 → 192.168.1.16 TCP 66 [TCP ACKed unseen segment] 22 → 59298 [ACK] Seq=1 Ack=273 Win=1451 Len=0 TSval=6521098 TSecr=5924716
    3 0.013402484 192.168.1.16 → 10.6.15.144  SSH 134 Client: [TCP Previous segment not captured] , Encrypted packet (len=68)
    4 0.023027571  10.6.15.144 → 192.168.1.16 SSH 102 Server: [TCP ACKed unseen segment] , Encrypted packet (len=36)
    5 0.023055113 192.168.1.16 → 10.6.15.144  TCP 66 59298 → 22 [ACK] Seq=341 Ack=37 Win=6155 Len=0 TSval=5924724 TSecr=6521099
    6 0.023071008  10.6.15.144 → 192.168.1.16 SSH 138 Server: Encrypted packet (len=72)
    7 0.023076488 192.168.1.16 → 10.6.15.144  TCP 66 59298 → 22 [ACK] Seq=341 Ack=109 Win=6155 Len=0 TSval=5924724 TSecr=6521099
    8 0.023293064 192.168.1.16 → 10.6.15.144  SSH 102 Client: Encrypted packet (len=36)
    9 0.061510864  10.6.15.144 → 192.168.1.16 TCP 66 22 → 59298 [ACK] Seq=109 Ack=341 Win=1452 Len=0 TSval=6521111 TSecr=5924722
   10 0.061532014 192.168.1.16 → 10.6.15.144  SSH 678 Client: Encrypted packet (len=612)
   11 0.074187092  10.6.15.144 → 192.168.1.16 SSH 182 Server: Encrypted packet (len=116)
   12 0.115907442 192.168.1.16 → 10.6.15.144  TCP 66 59298 → 22 [ACK] Seq=989 Ack=225 Win=6155 Len=0 TSval=5924748 TSecr=6521111
   13 0.135952196 192.168.1.16 → 10.6.15.144  SSH 134 Client: Encrypted packet (len=68)
   14 0.375913106 192.168.1.16 → 10.6.15.144  TCP 782 [TCP Retransmission] 59298 → 22 [PSH, ACK] Seq=341 Ack=225 Win=6155 Len=716 TSval=5924813 TSecr=6521111
   15 0.386434856  10.6.15.144 → 192.168.1.16 TCP 78 [TCP Dup ACK 9#1] 22 → 59298 [ACK] Seq=225 Ack=341 Win=1452 Len=0 TSval=6521168 TSecr=5924722 SLE=989 SRE=1057
   16 0.394749470  10.6.15.144 → 192.168.1.16 TCP 78 22 → 59298 [ACK] Seq=225 Ack=1057 Win=1452 Len=0 TSval=6521194 TSecr=5924813 SLE=989 SRE=1057
   17 1.925947730  10.6.15.144 → 192.168.1.16 SSH 414 Server: Encrypted packet (len=348)
   18 1.925974730 192.168.1.16 → 10.6.15.144  TCP 66 59298 → 22 [ACK] Seq=1057 Ack=573 Win=6155 Len=0 TSval=5925200 TSecr=6521287
   19 1.925991539  10.6.15.144 → 192.168.1.16 SSH 414 Server: [TCP Spurious Retransmission] , Encrypted packet (len=348)
   20 1.925997279 192.168.1.16 → 10.6.15.144  TCP 78 [TCP Dup ACK 18#1] 59298 → 22 [ACK] Seq=1057 Ack=573 Win=6155 Len=0 TSval=5925200 TSecr=6521398 SLE=225 SRE=573
   21 1.931873123 192.168.1.16 → 10.6.15.144  SSH 918 Client: Encrypted packet (len=852)
   22 2.167948735 192.168.1.16 → 10.6.15.144  TCP 918 [TCP Retransmission] 59298 → 22 [PSH, ACK] Seq=1057 Ack=573 Win=6155 Len=852 TSval=5925261 TSecr=6521398
   23 2.272766940  10.6.15.144 → 192.168.1.16 TCP 66 22 → 59298 [ACK] Seq=573 Ack=1909 Win=1452 Len=0 TSval=6521663 TSecr=5925261
   24 3.633899116 192.168.1.16 → 52.66.5.185  NTP 90 NTP Version 4, client
   25 3.637447968  10.6.15.144 → 192.168.1.16 SSH 622 Server: Encrypted packet (len=556)
   26 3.642342054 192.168.1.16 → 10.6.15.144  SSH 222 Client: Encrypted packet (len=156)
   27 3.643043090 192.168.1.16 → 10.6.15.144  SSH 750 Client: Encrypted packet (len=684)
   28 3.654522821  10.6.15.144 → 192.168.1.16 TCP 66 22 → 59298 [ACK] Seq=1129 Ack=2065 Win=1452 Len=0 TSval=6522008 TSecr=5925629
   29 3.654540914  10.6.15.144 → 192.168.1.16 TCP 66 22 → 59298 [ACK] Seq=1129 Ack=2749 Win=1452 Len=0 TSval=6522008 TSecr=5925629
   30 3.699651086  10.6.15.144 → 192.168.1.16 SSH 174 Server: Encrypted packet (len=108)
   31 3.699974891 192.168.1.16 → 10.6.15.144  SSH 126 Client: Encrypted packet (len=60)
   32 3.707573395  10.6.15.144 → 192.168.1.16 TCP 66 22 → 59298 [ACK] Seq=1237 Ack=2809 Win=1452 Len=0 TSval=6522022 TSecr=5925644
   33 4.936614461  10.6.15.144 → 192.168.1.16 SSH 534 Server: Encrypted packet (len=468)
   34 4.936638420  10.6.15.144 → 192.168.1.16 TCP 534 [TCP Retransmission] 22 → 59298 [PSH, ACK] Seq=1237 Ack=2809 Win=1452 Len=468 TSval=6522307 TSecr=5925644
   35 4.936648886 192.168.1.16 → 10.6.15.144  TCP 78 59298 → 22 [ACK] Seq=2809 Ack=1705 Win=6155 Len=0 TSval=5925953 TSecr=6522307 SLE=1237 SRE=1705
   36 4.937487922 192.168.1.16 → 10.6.15.144  SSH 134 Client: Encrypted packet (len=68)
   37 4.946747759  10.6.15.144 → 192.168.1.16 TCP 66 22 → 59298 [ACK] Seq=1705 Ack=2877 Win=1452 Len=0 TSval=6522332 TSecr=5925953
   38 5.294889339 192.168.1.16 → 10.6.15.144  SSH 622 Client: Encrypted packet (len=556)
   39 5.310362254  10.6.15.144 → 192.168.1.16 TCP 66 22 → 59298 [ACK] Seq=1705 Ack=3433 Win=1452 Len=0 TSval=6522423 TSecr=5926042
   40 5.595782396 192.168.1.16 → 10.6.15.144  SSH 462 Client: Encrypted packet (len=396)
   41 5.597417147 192.168.1.16 → 10.6.15.144  SSH 134 Client: Encrypted packet (len=68)
   42 5.597558707  10.6.15.144 → 192.168.1.16 SSH 390 Server: Encrypted packet (len=324)
   43 5.601263176 10.22.19.172 → 224.0.0.252  LLMNR 64 Standard query 0x99e4 A wpad
   44 5.601364003 192.168.1.16 → 224.0.0.252  LLMNR 61 Standard query 0xd871 A x
   45 5.606550753  10.6.15.144 → 192.168.1.16 TCP 66 22 → 59298 [ACK] Seq=2029 Ack=3829 Win=1452 Len=0 TSval=6522497 TSecr=5926117
   46 5.609404008  10.6.15.144 → 192.168.1.16 TCP 66 22 → 59298 [ACK] Seq=2029 Ack=3897 Win=1452 Len=0 TSval=6522497 TSecr=5926118
   47 5.612441832 192.168.1.16 → 10.6.15.144  SSH 278 Client: Encrypted packet (len=212)
   48 5.622617012  10.6.15.144 → 192.168.1.16 TCP 66 22 → 59298 [ACK] Seq=2029 Ack=4109 Win=1452 Len=0 TSval=6522501 TSecr=5926122
   49 5.672448172  10.6.15.144 → 192.168.1.16 SSH 150 Server: Encrypted packet (len=84)
   50 5.693867004 192.168.1.16 → 10.6.15.144  SSH 414 Client: Encrypted packet (len=348)
   51 5.694703128 192.168.1.16 → 10.6.15.144  SSH 134 Client: Encrypted packet (len=68)
   52 5.706550600  10.6.15.144 → 192.168.1.16 TCP 66 22 → 59298 [ACK] Seq=2113 Ack=4457 Win=1452 Len=0 TSval=6522521 TSecr=5926142
   53 5.706567241  10.6.15.144 → 192.168.1.16 TCP 66 22 → 59298 [ACK] Seq=2113 Ack=4525 Win=1452 Len=0 TSval=6522521 TSecr=5926142
   54 5.729047164 192.168.1.16 → 10.6.15.144  SSH 486 Client: Encrypted packet (len=420)
   55 5.729933032 192.168.1.16 → 10.6.15.144  SSH 134 Client: Encrypted packet (len=68)
   56 5.730528957 192.168.1.16 → 10.6.15.144  SSH 462 Client: Encrypted packet (len=396)
   57 5.738138738  10.6.15.144 → 192.168.1.16 TCP 66 22 → 59298 [ACK] Seq=2113 Ack=4945 Win=1452 Len=0 TSval=6522530 TSecr=5926151
   58 5.738581166  10.6.15.144 → 192.168.1.16 TCP 66 22 → 59298 [ACK] Seq=2113 Ack=5013 Win=1452 Len=0 TSval=6522530 TSecr=5926151
   59 5.740056428  10.6.15.144 → 192.168.1.16 TCP 66 22 → 59298 [ACK] Seq=2113 Ack=5409 Win=1452 Len=0 TSval=6522530 TSecr=5926151
   60 5.745393307 192.168.1.16 → 10.6.15.144  SSH 182 Client: Encrypted packet (len=116)
   61 5.745579474 192.168.1.16 → 10.6.15.144  SSH 134 Client: Encrypted packet (len=68)
   62 5.745881453 192.168.1.16 → 10.6.15.144  SSH 510 Client: Encrypted packet (len=444)
   63 5.746112956 192.168.1.16 → 10.6.15.144  SSH 142 Client: Encrypted packet (len=76)
   64 5.754349261  10.6.15.144 → 192.168.1.16 TCP 66 22 → 59298 [ACK] Seq=2113 Ack=5593 Win=1452 Len=0 TSval=6522534 TSecr=5926155
   65 5.754374751 192.168.1.16 → 10.6.15.144  SSH 1514 Client: Encrypted packet (len=1448)
   66 5.754388524 192.168.1.16 → 10.6.15.144  SSH 638 Client: Encrypted packet (len=572)
   67 5.754493685  10.6.15.144 → 192.168.1.16 TCP 66 22 → 59298 [ACK] Seq=2113 Ack=6037 Win=1452 Len=0 TSval=6522534 TSecr=5926155
   68 5.754498936  10.6.15.144 → 192.168.1.16 TCP 66 22 → 59298 [ACK] Seq=2113 Ack=6113 Win=1452 Len=0 TSval=6522534 TSecr=5926155
   69 5.765114441  10.6.15.144 → 192.168.1.16 TCP 66 22 → 59298 [ACK] Seq=2113 Ack=8133 Win=1452 Len=0 TSval=6522536 TSecr=5926157
   70 5.776276946 192.168.1.16 → 10.6.15.144  SSH 134 Client: Encrypted packet (len=68)
   71 5.779196199 192.168.1.16 → 10.6.15.144  SSH 262 Client: Encrypted packet (len=196)
   72 5.779746093 192.168.1.16 → 10.6.15.144  SSH 330 Client: Encrypted packet (len=264)
   73 5.780003840 192.168.1.16 → 10.6.15.144  SSH 198 Client: Encrypted packet (len=132)
   74 5.785977789  10.6.15.144 → 192.168.1.16 TCP 66 22 → 59298 [ACK] Seq=2113 Ack=8201 Win=1452 Len=0 TSval=6522541 TSecr=5926163
   75 5.786650688  10.6.15.144 → 192.168.1.16 SSH 118 Server: Encrypted packet (len=52)
   76 5.789436695  10.6.15.144 → 192.168.1.16 TCP 66 22 → 59298 [ACK] Seq=2165 Ack=8661 Win=1452 Len=0 TSval=6522542 TSecr=5926163
   77 5.802298135  10.6.15.144 → 192.168.1.16 SSH 286 Server: Encrypted packet (len=220)
   78 5.802355202 192.168.1.16 → 10.6.15.144  TCP 66 59298 → 22 [ACK] Seq=8793 Ack=2385 Win=6155 Len=0 TSval=5926169 TSecr=6522542
   79 5.844101105  10.6.15.144 → 192.168.1.16 SSH 142 Server: Encrypted packet (len=76)
   80 5.865780981  10.6.15.144 → 192.168.1.16 SSH 1514 Server: Encrypted packet (len=1448)
   81 5.865801124 192.168.1.16 → 10.6.15.144  TCP 66 59298 → 22 [ACK] Seq=8793 Ack=3909 Win=6155 Len=0 TSval=5926185 TSecr=6522556
   82 5.865960719  10.6.15.144 → 192.168.1.16 SSH 1514 Server: Encrypted packet (len=1448)
   83 5.876717952  10.6.15.144 → 192.168.1.16 SSH 1514 Server: Encrypted packet (len=1448)
   84 5.876735626 192.168.1.16 → 10.6.15.144  TCP 66 59298 → 22 [ACK] Seq=8793 Ack=6805 Win=6155 Len=0 TSval=5926188 TSecr=6522561
   85 5.876838187  10.6.15.144 → 192.168.1.16 SSH 1514 Server: Encrypted packet (len=1448)
   86 5.882215809 192.168.1.16 → 224.0.0.252  LLMNR 61 Standard query 0xd871 A x
   87 5.887013123  10.6.15.144 → 192.168.1.16 SSH 90 Server: Encrypted packet (len=24)
   88 5.887033534 192.168.1.16 → 10.6.15.144  TCP 66 59298 → 22 [ACK] Seq=8793 Ack=8277 Win=6155 Len=0 TSval=5926190 TSecr=6522564
   89 5.890547212  10.6.15.144 → 192.168.1.16 SSH 422 Server: Encrypted packet (len=356)
   90 5.895423223 10.22.19.172 → 224.0.0.252  LLMNR 64 Standard query 0x99e4 A wpad
   91 5.897039709  10.6.15.144 → 192.168.1.16 SSH 198 Server: Encrypted packet (len=132)
   92 5.897117478 192.168.1.16 → 10.6.15.144  TCP 66 59298 → 22 [ACK] Seq=8793 Ack=8765 Win=6155 Len=0 TSval=5926193 TSecr=6522568
   93 5.918820522  10.6.15.144 → 192.168.1.16 SSH 142 Server: Encrypted packet (len=76)
   94 5.950715530 192.168.1.16 → 10.6.15.144  SSH 1078 Client: Encrypted packet (len=1012)
   95 5.951385906 192.168.1.16 → 10.6.15.144  SSH 1110 Client: Encrypted packet (len=1044)
   96 5.951737501 192.168.1.16 → 10.6.15.144  SSH 102 Client: Encrypted packet (len=36)
   97 5.959351188  10.6.15.144 → 192.168.1.16 TCP 66 22 → 59298 [ACK] Seq=8841 Ack=10849 Win=1452 Len=0 TSval=6522585 TSecr=5926206
   98 5.989048066  10.6.15.144 → 192.168.1.16 SSH 710 Server: Encrypted packet (len=644)
   99 6.019445112  10.6.15.144 → 192.168.1.16 SSH 326 Server: Encrypted packet (len=260)
  100 6.019503018 192.168.1.16 → 10.6.15.144  TCP 66 59298 → 22 [ACK] Seq=10885 Ack=9745 Win=6155 Len=0 TSval=5926223 TSecr=6522593
  101 6.020449007  10.6.15.144 → 192.168.1.16 SSH 142 Server: Encrypted packet (len=76)
  102 6.033953886  10.6.15.144 → 192.168.1.16 SSH 102 Server: Encrypted packet (len=36)
  103 6.034016939 192.168.1.16 → 10.6.15.144  TCP 66 59298 → 22 [ACK] Seq=10885 Ack=9857 Win=6155 Len=0 TSval=5926227 TSecr=6522601
  104 6.034303152 192.168.1.16 → 10.6.15.144  SSH 166 Client: Encrypted packet (len=100)
  105 6.082166381  10.6.15.144 → 192.168.1.16 TCP 66 22 → 59298 [ACK] Seq=9857 Ack=10985 Win=1452 Len=0 TSval=6522616 TSecr=5926227
  106 6.132238537 192.168.1.16 → 224.0.0.252  LLMNR 61 Standard query 0xd871 A x
  107 6.134342602  10.6.15.144 → 192.168.1.16 SSH 1514 Server: Encrypted packet (len=1448)
  108 6.134503800  10.6.15.144 → 192.168.1.16 SSH 1514 Server: Encrypted packet (len=1448)
  109 6.134508537 192.168.1.16 → 10.6.15.144  TCP 66 59298 → 22 [ACK] Seq=10985 Ack=12753 Win=6155 Len=0 TSval=5926252 TSecr=6522628
  110 6.134703213  10.6.15.144 → 192.168.1.16 SSH 490 Server: Encrypted packet (len=424)
  111 6.137843929 192.168.1.16 → 10.6.15.144  SSH 1078 Client: Encrypted packet (len=1012)
  112 6.148308413  10.6.15.144 → 192.168.1.16 TCP 66 22 → 59298 [ACK] Seq=13177 Ack=11997 Win=1452 Len=0 TSval=6522632 TSecr=5926253
  113 6.156164165  10.6.15.144 → 192.168.1.16 SSH 150 Server: Encrypted packet (len=84)
  114 6.168964733  10.6.15.144 → 192.168.1.16 SSH 494 Server: Encrypted packet (len=428)
  115 6.169036788 192.168.1.16 → 10.6.15.144  TCP 66 59298 → 22 [ACK] Seq=11997 Ack=13689 Win=6155 Len=0 TSval=5926261 TSecr=6522634
  116 6.171411216  10.6.15.144 → 192.168.1.16 SSH 222 Server: Encrypted packet (len=156)
  117 6.171702976 192.168.1.16 → 10.6.15.144  SSH 134 Client: Encrypted packet (len=68)
  118 6.191299725  10.6.15.144 → 192.168.1.16 SSH 1514 Server: Encrypted packet (len=1448)
  119 6.191466159  10.6.15.144 → 192.168.1.16 SSH 1514 Server: Encrypted packet (len=1448)
  120 6.191476701 192.168.1.16 → 10.6.15.144  TCP 66 59298 → 22 [ACK] Seq=12065 Ack=16741 Win=6155 Len=0 TSval=5926266 TSecr=6522643
  121 6.191781892  10.6.15.144 → 192.168.1.16 SSH 1334 Server: Encrypted packet (len=1268)
  122 6.202163501  10.6.15.144 → 192.168.1.16 SSH 1514 Server: Encrypted packet (len=1448)
  123 6.202181695 192.168.1.16 → 10.6.15.144  TCP 66 59298 → 22 [ACK] Seq=12065 Ack=19457 Win=6155 Len=0 TSval=5926269 TSecr=6522643
  124 6.202197734  10.6.15.144 → 192.168.1.16 SSH 466 Server: Encrypted packet (len=400)
  125 6.217782516  10.6.15.144 → 192.168.1.16 SSH 774 Server: Encrypted packet (len=708)
  126 6.217853527 192.168.1.16 → 10.6.15.144  TCP 66 59298 → 22 [ACK] Seq=12065 Ack=20565 Win=6155 Len=0 TSval=5926273 TSecr=6522645
  127 6.225867461 192.168.1.16 → 10.6.15.144  SSH 190 Client: Encrypted packet (len=124)
  128 6.227351274 192.168.1.16 → 10.6.15.144  SSH 134 Client: Encrypted packet (len=68)
  129 6.256268483 192.168.1.16 → 10.6.15.144  SSH 110 Client: Encrypted packet (len=44)
  130 6.260968509  10.6.15.144 → 192.168.1.16 SSH 1486 Server: Encrypted packet (len=1420)
  131 6.267115807  10.6.15.144 → 192.168.1.16 TCP 66 22 → 59298 [ACK] Seq=21985 Ack=12257 Win=1452 Len=0 TSval=6522661 TSecr=5926275
  132 6.289053780 192.168.1.16 → 10.6.15.144  SSH 206 Client: Encrypted packet (len=140)
  133 6.289251178 192.168.1.16 → 10.6.15.144  SSH 354 Client: Encrypted packet (len=288)
  134 6.295294355  10.6.15.144 → 192.168.1.16 SSH 1334 Server: Encrypted packet (len=1268)
  135 6.299234023  10.6.15.144 → 192.168.1.16 TCP 66 22 → 59298 [ACK] Seq=23253 Ack=12729 Win=1452 Len=0 TSval=6522670 TSecr=5926291
  136 6.314370029  10.6.15.144 → 192.168.1.16 SSH 150 Server: Encrypted packet (len=84)
  137 6.314443789 192.168.1.16 → 10.6.15.144  TCP 66 59298 → 22 [ACK] Seq=12729 Ack=23337 Win=6155 Len=0 TSval=5926297 TSecr=6522668
  138 6.317373621  10.6.15.144 → 192.168.1.16 SSH 1514 Server: Encrypted packet (len=1448)
  139 6.327151690  10.6.15.144 → 192.168.1.16 SSH 1514 Server: Encrypted packet (len=1448)
  140 6.327169623 192.168.1.16 → 10.6.15.144  TCP 66 59298 → 22 [ACK] Seq=12729 Ack=26233 Win=6155 Len=0 TSval=5926300 TSecr=6522674
  141 6.327307780  10.6.15.144 → 192.168.1.16 SSH 1514 Server: Encrypted packet (len=1448)
  142 6.337578095  10.6.15.144 → 192.168.1.16 SSH 1270 Server: Encrypted packet (len=1204)
  143 6.337595200 192.168.1.16 → 10.6.15.144  TCP 66 59298 → 22 [ACK] Seq=12729 Ack=28885 Win=6155 Len=0 TSval=5926303 TSecr=6522677
  144 6.337982564 192.168.1.16 → 10.6.15.144  SSH 374 Client: Encrypted packet (len=308)
  145 6.346560083  10.6.15.144 → 192.168.1.16 SSH 102 Server: Encrypted packet (len=36)
  146 6.346888066 192.168.1.16 → 10.6.15.144  SSH 158 Client: Encrypted packet (len=92)
  147 6.351146914  10.6.15.144 → 192.168.1.16 SSH 1514 Server: Encrypted packet (len=1448)
  148 6.351223767  10.6.15.144 → 192.168.1.16 SSH 926 Server: Encrypted packet (len=860)
  149 6.351229410 192.168.1.16 → 10.6.15.144  TCP 66 59298 → 22 [ACK] Seq=13129 Ack=31229 Win=6155 Len=0 TSval=5926306 TSecr=6522683
  150 6.356672230  10.6.15.144 → 192.168.1.16 SSH 1514 Server: Encrypted packet (len=1448)
  151 6.362723072  10.6.15.144 → 192.168.1.16 SSH 1514 Server: Encrypted packet (len=1448)
  152 6.362740775 192.168.1.16 → 10.6.15.144  TCP 66 59298 → 22 [ACK] Seq=13129 Ack=34125 Win=6155 Len=0 TSval=5926309 TSecr=6522684
  153 6.362896566  10.6.15.144 → 192.168.1.16 SSH 1514 Server: Encrypted packet (len=1448)
  154 6.373017977  10.6.15.144 → 192.168.1.16 SSH 1514 Server: Encrypted packet (len=1448)
  155 6.373034134 192.168.1.16 → 10.6.15.144  TCP 66 59298 → 22 [ACK] Seq=13129 Ack=37021 Win=6155 Len=0 TSval=5926312 TSecr=6522685
  156 6.373216526  10.6.15.144 → 192.168.1.16 SSH 1514 Server: Encrypted packet (len=1448)
  157 6.383511194  10.6.15.144 → 192.168.1.16 SSH 1514 Server: Encrypted packet (len=1448)
  158 6.383530782 192.168.1.16 → 10.6.15.144  TCP 66 59298 → 22 [ACK] Seq=13129 Ack=39917 Win=6155 Len=0 TSval=5926314 TSecr=6522688
  159 6.383691888  10.6.15.144 → 192.168.1.16 SSH 1514 Server: Encrypted packet (len=1448)
  160 6.394432513  10.6.15.144 → 192.168.1.16 SSH 1514 Server: Encrypted packet (len=1448)
  161 6.394449476 192.168.1.16 → 10.6.15.144  TCP 66 59298 → 22 [ACK] Seq=13129 Ack=42813 Win=6155 Len=0 TSval=5926317 TSecr=6522691
  162 6.394604980  10.6.15.144 → 192.168.1.16 SSH 1514 Server: Encrypted packet (len=1448)
  163 6.407100889  10.6.15.144 → 192.168.1.16 SSH 1514 Server: Encrypted packet (len=1448)
  164 6.407118705 192.168.1.16 → 10.6.15.144  TCP 66 59298 → 22 [ACK] Seq=13129 Ack=45709 Win=6155 Len=0 TSval=5926320 TSecr=6522693
  165 6.407279146  10.6.15.144 → 192.168.1.16 SSH 1514 Server: Encrypted packet (len=1448)
  166 6.407473736  10.6.15.144 → 192.168.1.16 SSH 1514 Server: Encrypted packet (len=1448)
  167 6.407480334 192.168.1.16 → 10.6.15.144  TCP 66 59298 → 22 [ACK] Seq=13129 Ack=48605 Win=6155 Len=0 TSval=5926320 TSecr=6522696
  168 6.419577658  10.6.15.144 → 192.168.1.16 SSH 1514 Server: Encrypted packet (len=1448)
  169 6.419737546  10.6.15.144 → 192.168.1.16 SSH 1514 Server: Encrypted packet (len=1448)
  170 6.419747922 192.168.1.16 → 10.6.15.144  TCP 66 59298 → 22 [ACK] Seq=13129 Ack=51501 Win=6155 Len=0 TSval=5926323 TSecr=6522699
  171 6.419919730  10.6.15.144 → 192.168.1.16 SSH 1514 Server: Encrypted packet (len=1448)
  172 6.420092243  10.6.15.144 → 192.168.1.16 SSH 1514 Server: Encrypted packet (len=1448)
  173 6.420098206 192.168.1.16 → 10.6.15.144  TCP 66 59298 → 22 [ACK] Seq=13129 Ack=54397 Win=6155 Len=0 TSval=5926324 TSecr=6522699
  174 6.430741233  10.6.15.144 → 192.168.1.16 SSH 1514 Server: Encrypted packet (len=1448)
  175 6.430945594  10.6.15.144 → 192.168.1.16 SSH 1514 Server: [TCP Previous segment not captured] , Encrypted packet (len=1448)
  176 6.430956507 192.168.1.16 → 10.6.15.144  TCP 78 59298 → 22 [ACK] Seq=13129 Ack=55845 Win=6155 Len=0 TSval=5926326 TSecr=6522702 SLE=57293 SRE=58741
  177 6.431289678  10.6.15.144 → 192.168.1.16 SSH 1514 Server: Encrypted packet (len=1448)
  178 6.431294323 192.168.1.16 → 10.6.15.144  TCP 78 [TCP Dup ACK 176#1] 59298 → 22 [ACK] Seq=13129 Ack=55845 Win=6155 Len=0 TSval=5926326 TSecr=6522702 SLE=57293 SRE=60189
  179 6.442028798  10.6.15.144 → 192.168.1.16 SSH 1514 Server: Encrypted packet (len=1448)
  180 6.442049575 192.168.1.16 → 10.6.15.144  TCP 78 [TCP Dup ACK 176#2] 59298 → 22 [ACK] Seq=13129 Ack=55845 Win=6155 Len=0 TSval=5926329 TSecr=6522702 SLE=57293 SRE=61637
  181 6.442221466  10.6.15.144 → 192.168.1.16 SSH 1514 Server: Encrypted packet (len=1448)
  182 6.442243384 192.168.1.16 → 10.6.15.144  TCP 78 [TCP Dup ACK 176#3] 59298 → 22 [ACK] Seq=13129 Ack=55845 Win=6155 Len=0 TSval=5926329 TSecr=6522702 SLE=57293 SRE=63085
  183 6.452941131  10.6.15.144 → 192.168.1.16 SSH 1514 Server: [TCP Fast Retransmission] , Encrypted packet (len=1448)
  184 6.452968898 192.168.1.16 → 10.6.15.144  TCP 66 59298 → 22 [ACK] Seq=13129 Ack=63085 Win=6155 Len=0 TSval=5926332 TSecr=6522708
  185 6.463568367  10.6.15.144 → 192.168.1.16 SSH 1514 Server: [TCP Previous segment not captured] , Encrypted packet (len=1448)
  186 6.463589592 192.168.1.16 → 10.6.15.144  TCP 78 [TCP Dup ACK 184#1] 59298 → 22 [ACK] Seq=13129 Ack=63085 Win=6155 Len=0 TSval=5926334 TSecr=6522708 SLE=64533 SRE=65981
  187 6.473936899  10.6.15.144 → 192.168.1.16 TCP 1514 [TCP Retransmission] 22 → 59298 [ACK] Seq=63085 Ack=13129 Win=1452 Len=1448 TSval=6522713 TSecr=5926334
  188 6.473963299 192.168.1.16 → 10.6.15.144  TCP 66 59298 → 22 [ACK] Seq=13129 Ack=65981 Win=6155 Len=0 TSval=5926337 TSecr=6522713
  189 6.474100421  10.6.15.144 → 192.168.1.16 SSH 1514 Server: Encrypted packet (len=1448)
  190 6.474109553 192.168.1.16 → 10.6.15.144  TCP 66 59298 → 22 [ACK] Seq=13129 Ack=67429 Win=6155 Len=0 TSval=5926337 TSecr=6522713
  191 6.483600353  10.6.15.144 → 192.168.1.16 SSH 1514 Server: Encrypted packet (len=1448)
  192 6.483618086 192.168.1.16 → 10.6.15.144  TCP 66 59298 → 22 [ACK] Seq=13129 Ack=68877 Win=6155 Len=0 TSval=5926339 TSecr=6522716
  193 6.483738892  10.6.15.144 → 192.168.1.16 SSH 1514 Server: Encrypted packet (len=1448)
  194 6.483748477 192.168.1.16 → 10.6.15.144  TCP 66 59298 → 22 [ACK] Seq=13129 Ack=70325 Win=6155 Len=0 TSval=5926339 TSecr=6522716
  195 6.483921300 192.168.1.16 → 10.6.15.144  SSH 102 Client: Encrypted packet (len=36)
  196 6.484066367  10.6.15.144 → 192.168.1.16 SSH 1514 Server: Encrypted packet (len=1448)
  197 6.493684858  10.6.15.144 → 192.168.1.16 SSH 1514 Server: Encrypted packet (len=1448)
  198 6.493701011 192.168.1.16 → 10.6.15.144  TCP 66 59298 → 22 [ACK] Seq=13165 Ack=73221 Win=6155 Len=0 TSval=5926342 TSecr=6522716
  199 6.493866440  10.6.15.144 → 192.168.1.16 SSH 1514 Server: Encrypted packet (len=1448)
  200 6.503386505  10.6.15.144 → 192.168.1.16 SSH 1514 Server: Encrypted packet (len=1448)
  201 6.503405228 192.168.1.16 → 10.6.15.144  TCP 66 59298 → 22 [ACK] Seq=13165 Ack=76117 Win=6155 Len=0 TSval=5926344 TSecr=6522718
  202 6.503562400  10.6.15.144 → 192.168.1.16 SSH 1514 Server: Encrypted packet (len=1448)
  203 6.511927292  10.6.15.144 → 192.168.1.16 SSH 1514 Server: Encrypted packet (len=1448)
  204 6.511946497 192.168.1.16 → 10.6.15.144  TCP 66 59298 → 22 [ACK] Seq=13165 Ack=79013 Win=6155 Len=0 TSval=5926347 TSecr=6522721
  205 6.512110186  10.6.15.144 → 192.168.1.16 SSH 1514 Server: Encrypted packet (len=1448)
  206 6.521914177  10.6.15.144 → 192.168.1.16 SSH 1514 Server: Encrypted packet (len=1448)
  207 6.521934282 192.168.1.16 → 10.6.15.144  TCP 66 59298 → 22 [ACK] Seq=13165 Ack=81909 Win=6155 Len=0 TSval=5926349 TSecr=6522723
  208 6.522103365  10.6.15.144 → 192.168.1.16 SSH 1514 Server: Encrypted packet (len=1448)
  209 6.531149867  10.6.15.144 → 192.168.1.16 SSH 1514 Server: Encrypted packet (len=1448)
  210 6.531170817 192.168.1.16 → 10.6.15.144  TCP 66 59298 → 22 [ACK] Seq=13165 Ack=84805 Win=6155 Len=0 TSval=5926351 TSecr=6522725
  211 6.531332050  10.6.15.144 → 192.168.1.16 SSH 1514 Server: Encrypted packet (len=1448)
  212 6.538809540  10.6.15.144 → 192.168.1.16 SSH 1514 Server: Encrypted packet (len=1448)
  213 6.538830310 192.168.1.16 → 10.6.15.144  TCP 66 59298 → 22 [ACK] Seq=13165 Ack=87701 Win=6155 Len=0 TSval=5926353 TSecr=6522728
  214 6.538988542  10.6.15.144 → 192.168.1.16 SSH 1514 Server: Encrypted packet (len=1448)
  215 6.547384789  10.6.15.144 → 192.168.1.16 SSH 1514 Server: Encrypted packet (len=1448)
  216 6.547407613 192.168.1.16 → 10.6.15.144  TCP 66 59298 → 22 [ACK] Seq=13165 Ack=90597 Win=6155 Len=0 TSval=5926355 TSecr=6522730
  217 6.547434652  10.6.15.144 → 192.168.1.16 SSH 270 Server: Encrypted packet (len=204)
  218 6.550570926 192.168.1.16 → 10.6.15.144  SSH 134 Client: Encrypted packet (len=68)
  219 6.550759426 192.168.1.16 → 10.6.15.144  SSH 134 Client: Encrypted packet (len=68)
  220 6.555660453 192.168.1.16 → 10.6.15.144  SSH 102 Client: Encrypted packet (len=36)
  221 6.558975232  10.6.15.144 → 192.168.1.16 TCP 66 22 → 59298 [ACK] Seq=90801 Ack=13301 Win=1452 Len=0 TSval=6522735 TSecr=5926356
  222 6.560933142 192.168.1.16 → 10.6.15.144  SSH 230 Client: Encrypted packet (len=164)
  223 6.561176216 192.168.1.16 → 10.6.15.144  SSH 230 Client: Encrypted packet (len=164)
  224 6.565834862 192.168.1.16 → 10.6.15.144  SSH 374 Client: Encrypted packet (len=308)
  225 6.570044703  10.6.15.144 → 192.168.1.16 TCP 66 22 → 59298 [ACK] Seq=90801 Ack=13501 Win=1452 Len=0 TSval=6522738 TSecr=5926357
  226 6.570068863 192.168.1.16 → 10.6.15.144  SSH 190 Client: Encrypted packet (len=124)
  227 6.575932564  10.6.15.144 → 192.168.1.16 TCP 66 22 → 59298 [ACK] Seq=90801 Ack=13973 Win=1452 Len=0 TSval=6522739 TSecr=5926359
  228 6.612708768  10.6.15.144 → 192.168.1.16 SSH 126 Server: Encrypted packet (len=60)
  229 6.612730545  10.6.15.144 → 192.168.1.16 SSH 138 Server: Encrypted packet (len=72)
  230 6.612779534 192.168.1.16 → 10.6.15.144  TCP 66 59298 → 22 [ACK] Seq=14097 Ack=90933 Win=6155 Len=0 TSval=5926372 TSecr=6522748
  231 6.613007076 192.168.1.16 → 10.6.15.144  SSH 102 Client: Encrypted packet (len=36)
  232 6.619752551  10.6.15.144 → 192.168.1.16 SSH 174 Server: Encrypted packet (len=108)
  233 6.620038295 192.168.1.16 → 10.6.15.144  SSH 126 Client: Encrypted packet (len=60)
  234 6.628661616  10.6.15.144 → 192.168.1.16 SSH 1514 Server: Encrypted packet (len=1448)
  235 6.628845572  10.6.15.144 → 192.168.1.16 SSH 1514 Server: Encrypted packet (len=1448)
  236 6.628853520 192.168.1.16 → 10.6.15.144  TCP 66 59298 → 22 [ACK] Seq=14193 Ack=93937 Win=6155 Len=0 TSval=5926376 TSecr=6522752
  237 6.628865668  10.6.15.144 → 192.168.1.16 SSH 70 Server: Encrypted packet (len=4)
  238 6.638421505  10.6.15.144 → 192.168.1.16 SSH 1514 Server: Encrypted packet (len=1448)
  239 6.638446944 192.168.1.16 → 10.6.15.144  TCP 66 59298 → 22 [ACK] Seq=14193 Ack=95389 Win=6155 Len=0 TSval=5926378 TSecr=6522752
  240 6.638605357  10.6.15.144 → 192.168.1.16 SSH 1514 Server: Encrypted packet (len=1448)
  241 6.649219013  10.6.15.144 → 192.168.1.16 SSH 1514 Server: Encrypted packet (len=1448)
  242 6.649236827 192.168.1.16 → 10.6.15.144  TCP 66 59298 → 22 [ACK] Seq=14193 Ack=98285 Win=6155 Len=0 TSval=5926381 TSecr=6522755
  243 6.649402794  10.6.15.144 → 192.168.1.16 SSH 1514 Server: Encrypted packet (len=1448)
  244 6.660018210  10.6.15.144 → 192.168.1.16 SSH 1514 Server: Encrypted packet (len=1448)
  245 6.660033217 192.168.1.16 → 10.6.15.144  TCP 66 59298 → 22 [ACK] Seq=14193 Ack=101181 Win=6155 Len=0 TSval=5926384 TSecr=6522757
  246 6.660201654  10.6.15.144 → 192.168.1.16 SSH 1514 Server: Encrypted packet (len=1448)
  247 6.660527291  10.6.15.144 → 192.168.1.16 SSH 1398 Server: Encrypted packet (len=1332)
  248 6.660531872 192.168.1.16 → 10.6.15.144  TCP 66 59298 → 22 [ACK] Seq=14193 Ack=103961 Win=6155 Len=0 TSval=5926384 TSecr=6522760
  249 6.676828248  10.6.15.144 → 192.168.1.16 SSH 1514 Server: Encrypted packet (len=1448)
  250 6.677012852  10.6.15.144 → 192.168.1.16 SSH 1514 Server: Encrypted packet (len=1448)
  251 6.677024112 192.168.1.16 → 10.6.15.144  TCP 66 59298 → 22 [ACK] Seq=14193 Ack=106857 Win=6155 Len=0 TSval=5926388 TSecr=6522764
  252 6.677147595  10.6.15.144 → 192.168.1.16 SSH 134 Server: Encrypted packet (len=68)
  253 6.687952879  10.6.15.144 → 192.168.1.16 SSH 1514 Server: Encrypted packet (len=1448)
  254 6.687968698 192.168.1.16 → 10.6.15.144  TCP 66 59298 → 22 [ACK] Seq=14193 Ack=108373 Win=6155 Len=0 TSval=5926391 TSecr=6522764
  255 6.687984584  10.6.15.144 → 192.168.1.16 SSH 118 Server: Encrypted packet (len=52)
  256 6.693857191  10.6.15.144 → 192.168.1.16 SSH 334 Server: Encrypted packet (len=268)
  257 6.693923747 192.168.1.16 → 10.6.15.144  TCP 66 59298 → 22 [ACK] Seq=14193 Ack=108693 Win=6155 Len=0 TSval=5926392 TSecr=6522767
  258 6.694568424 192.168.1.16 → 10.6.15.144  SSH 134 Client: Encrypted packet (len=68)
  259 6.726720698  10.6.15.144 → 192.168.1.16 SSH 1514 Server: Encrypted packet (len=1448)
  260 6.726905592  10.6.15.144 → 192.168.1.16 SSH 1514 Server: Encrypted packet (len=1448)
  261 6.726919668 192.168.1.16 → 10.6.15.144  TCP 66 59298 → 22 [ACK] Seq=14261 Ack=111589 Win=6155 Len=0 TSval=5926400 TSecr=6522776
  262 6.727093503  10.6.15.144 → 192.168.1.16 SSH 1514 Server: Encrypted packet (len=1448)
  263 6.727102656  10.6.15.144 → 192.168.1.16 SSH 142 Server: Encrypted packet (len=76)
  264 6.727107157 192.168.1.16 → 10.6.15.144  TCP 66 59298 → 22 [ACK] Seq=14261 Ack=113113 Win=6155 Len=0 TSval=5926400 TSecr=6522776
  265 6.738966945  10.6.15.144 → 192.168.1.16 SSH 1514 Server: Encrypted packet (len=1448)
  266 6.739091438  10.6.15.144 → 192.168.1.16 SSH 1514 Server: Encrypted packet (len=1448)
  267 6.739099628 192.168.1.16 → 10.6.15.144  TCP 66 59298 → 22 [ACK] Seq=14261 Ack=116009 Win=6155 Len=0 TSval=5926403 TSecr=6522779
  268 6.739452952  10.6.15.144 → 192.168.1.16 SSH 1514 Server: Encrypted packet (len=1448)
  269 6.739644593  10.6.15.144 → 192.168.1.16 SSH 1514 Server: Encrypted packet (len=1448)
  270 6.739648302 192.168.1.16 → 10.6.15.144  TCP 66 59298 → 22 [ACK] Seq=14261 Ack=118905 Win=6155 Len=0 TSval=5926403 TSecr=6522779
  271 6.749947728  10.6.15.144 → 192.168.1.16 SSH 158 Server: Encrypted packet (len=92)
  272 6.773967685  10.6.15.144 → 192.168.1.16 SSH 1514 Server: Encrypted packet (len=1448)
  273 6.773986131 192.168.1.16 → 10.6.15.144  TCP 66 59298 → 22 [ACK] Seq=14261 Ack=120445 Win=6155 Len=0 TSval=5926412 TSecr=6522782
  274 6.774111146  10.6.15.144 → 192.168.1.16 SSH 1514 Server: Encrypted packet (len=1448)
  275 6.777693804  10.6.15.144 → 192.168.1.16 SSH 1514 Server: Encrypted packet (len=1448)
  276 6.777709982 192.168.1.16 → 10.6.15.144  TCP 66 59298 → 22 [ACK] Seq=14261 Ack=123341 Win=6155 Len=0 TSval=5926413 TSecr=6522788
  277 6.784209021  10.6.15.144 → 192.168.1.16 SSH 1514 Server: Encrypted packet (len=1448)
  278 6.784346769  10.6.15.144 → 192.168.1.16 SSH 1514 Server: Encrypted packet (len=1448)
  279 6.784356954 192.168.1.16 → 10.6.15.144  TCP 66 59298 → 22 [ACK] Seq=14261 Ack=126237 Win=6155 Len=0 TSval=5926415 TSecr=6522791
  280 6.789358062  10.6.15.144 → 192.168.1.16 SSH 1514 Server: Encrypted packet (len=1448)
  281 6.789959613  10.6.15.144 → 192.168.1.16 SSH 1514 Server: Encrypted packet (len=1448)
  282 6.789970287 192.168.1.16 → 10.6.15.144  TCP 66 59298 → 22 [ACK] Seq=14261 Ack=129133 Win=6155 Len=0 TSval=5926416 TSecr=6522792
  283 6.796691285  10.6.15.144 → 192.168.1.16 SSH 1514 Server: Encrypted packet (len=1448)
  284 6.796828364  10.6.15.144 → 192.168.1.16 SSH 1514 Server: Encrypted packet (len=1448)
  285 6.796838463 192.168.1.16 → 10.6.15.144  TCP 66 59298 → 22 [ACK] Seq=14261 Ack=132029 Win=6155 Len=0 TSval=5926418 TSecr=6522794
  286 6.800496599  10.6.15.144 → 192.168.1.16 SSH 1514 Server: Encrypted packet (len=1448)
  287 6.800635041  10.6.15.144 → 192.168.1.16 SSH 1514 Server: Encrypted packet (len=1448)
  288 6.800645313 192.168.1.16 → 10.6.15.144  TCP 66 59298 → 22 [ACK] Seq=14261 Ack=134925 Win=6155 Len=0 TSval=5926419 TSecr=6522795
  289 6.808347649  10.6.15.144 → 192.168.1.16 SSH 1514 Server: Encrypted packet (len=1448)
  290 6.808529690  10.6.15.144 → 192.168.1.16 SSH 1514 Server: Encrypted packet (len=1448)
  291 6.808540965 192.168.1.16 → 10.6.15.144  TCP 66 59298 → 22 [ACK] Seq=14261 Ack=137821 Win=6155 Len=0 TSval=5926421 TSecr=6522797
  292 6.812517854  10.6.15.144 → 192.168.1.16 SSH 1514 Server: Encrypted packet (len=1448)
  293 6.812655211  10.6.15.144 → 192.168.1.16 SSH 1514 Server: Encrypted packet (len=1448)
  294 6.812665789 192.168.1.16 → 10.6.15.144  TCP 66 59298 → 22 [ACK] Seq=14261 Ack=140717 Win=6155 Len=0 TSval=5926422 TSecr=6522798
  295 6.841422528  10.6.15.144 → 192.168.1.16 SSH 1514 Server: Encrypted packet (len=1448)
  296 6.851388861  10.6.15.144 → 192.168.1.16 SSH 1514 Server: Encrypted packet (len=1448)
  297 6.851406072 192.168.1.16 → 10.6.15.144  TCP 66 59298 → 22 [ACK] Seq=14261 Ack=143613 Win=6155 Len=0 TSval=5926431 TSecr=6522806
  298 6.851525650  10.6.15.144 → 192.168.1.16 SSH 1514 Server: Encrypted packet (len=1448)
  299 6.851705265  10.6.15.144 → 192.168.1.16 SSH 1514 Server: Encrypted packet (len=1448)
  300 6.851713446 192.168.1.16 → 10.6.15.144  TCP 66 59298 → 22 [ACK] Seq=14261 Ack=146509 Win=6155 Len=0 TSval=5926431 TSecr=6522808
  301 6.863686216  10.6.15.144 → 192.168.1.16 SSH 1514 Server: Encrypted packet (len=1448)
  302 6.863977387  10.6.15.144 → 192.168.1.16 SSH 1514 Server: Encrypted packet (len=1448)
  303 6.863987998 192.168.1.16 → 10.6.15.144  TCP 66 59298 → 22 [ACK] Seq=14261 Ack=149405 Win=6155 Len=0 TSval=5926435 TSecr=6522811
  304 6.864324780  10.6.15.144 → 192.168.1.16 SSH 1514 Server: Encrypted packet (len=1448)
  305 6.865266042  10.6.15.144 → 192.168.1.16 SSH 1514 Server: Encrypted packet (len=1448)
  306 6.865276350 192.168.1.16 → 10.6.15.144  TCP 66 59298 → 22 [ACK] Seq=14261 Ack=152301 Win=6155 Len=0 TSval=5926435 TSecr=6522811
  307 6.871637640  10.6.15.144 → 192.168.1.16 SSH 1514 Server: Encrypted packet (len=1448)
  308 6.877593003  10.6.15.144 → 192.168.1.16 SSH 1514 Server: Encrypted packet (len=1448)
  309 6.877610188 192.168.1.16 → 10.6.15.144  TCP 66 59298 → 22 [ACK] Seq=14261 Ack=155197 Win=6155 Len=0 TSval=5926438 TSecr=6522813
  310 6.877757767  10.6.15.144 → 192.168.1.16 SSH 1514 Server: Encrypted packet (len=1448)
  311 6.880499665  10.6.15.144 → 192.168.1.16 SSH 1514 Server: Encrypted packet (len=1448)
  312 6.880519685 192.168.1.16 → 10.6.15.144  TCP 66 59298 → 22 [ACK] Seq=14261 Ack=158093 Win=6155 Len=0 TSval=5926439 TSecr=6522814
  313 6.890394121  10.6.15.144 → 192.168.1.16 SSH 1514 Server: Encrypted packet (len=1448)
  314 6.890573450  10.6.15.144 → 192.168.1.16 SSH 1514 Server: Encrypted packet (len=1448)
  315 6.890587034 192.168.1.16 → 10.6.15.144  TCP 66 59298 → 22 [ACK] Seq=14261 Ack=160989 Win=6155 Len=0 TSval=5926441 TSecr=6522817
  316 6.892472243  10.6.15.144 → 192.168.1.16 SSH 1514 Server: Encrypted packet (len=1448)
  317 6.892657699  10.6.15.144 → 192.168.1.16 SSH 1514 Server: Encrypted packet (len=1448)
  318 6.892667824 192.168.1.16 → 10.6.15.144  TCP 66 59298 → 22 [ACK] Seq=14261 Ack=163885 Win=6155 Len=0 TSval=5926442 TSecr=6522818
  319 6.902293863  10.6.15.144 → 192.168.1.16 SSH 1514 Server: Encrypted packet (len=1448)
  320 6.906530165  10.6.15.144 → 192.168.1.16 SSH 1514 Server: Encrypted packet (len=1448)
  321 6.906543826 192.168.1.16 → 10.6.15.144  TCP 66 59298 → 22 [ACK] Seq=14261 Ack=166781 Win=6155 Len=0 TSval=5926445 TSecr=6522820
  322 6.906723944  10.6.15.144 → 192.168.1.16 SSH 1514 Server: Encrypted packet (len=1448)
  323 6.906913302  10.6.15.144 → 192.168.1.16 SSH 1514 Server: Encrypted packet (len=1448)
  324 6.906920790 192.168.1.16 → 10.6.15.144  TCP 66 59298 → 22 [ACK] Seq=14261 Ack=169677 Win=6155 Len=0 TSval=5926445 TSecr=6522820
  325 6.907106011  10.6.15.144 → 192.168.1.16 SSH 1514 Server: Encrypted packet (len=1448)
  326 6.907299016  10.6.15.144 → 192.168.1.16 SSH 1514 Server: Encrypted packet (len=1448)
  327 6.907307466 192.168.1.16 → 10.6.15.144  TCP 66 59298 → 22 [ACK] Seq=14261 Ack=172573 Win=6155 Len=0 TSval=5926445 TSecr=6522821
  328 6.918737502  10.6.15.144 → 192.168.1.16 SSH 1514 Server: Encrypted packet (len=1448)
  329 6.918875821  10.6.15.144 → 192.168.1.16 SSH 1514 Server: Encrypted packet (len=1448)
  330 6.918885817 192.168.1.16 → 10.6.15.144  TCP 66 59298 → 22 [ACK] Seq=14261 Ack=175469 Win=6155 Len=0 TSval=5926448 TSecr=6522825
  331 6.919083910  10.6.15.144 → 192.168.1.16 SSH 1514 Server: Encrypted packet (len=1448)
  332 6.919422199  10.6.15.144 → 192.168.1.16 SSH 1514 Server: Encrypted packet (len=1448)
  333 6.919426657 192.168.1.16 → 10.6.15.144  TCP 66 59298 → 22 [ACK] Seq=14261 Ack=178365 Win=6155 Len=0 TSval=5926448 TSecr=6522825
  334 6.919613134  10.6.15.144 → 192.168.1.16 SSH 1514 Server: Encrypted packet (len=1448)
  335 6.919805791  10.6.15.144 → 192.168.1.16 SSH 1514 Server: Encrypted packet (len=1448)
  336 6.919809154 192.168.1.16 → 10.6.15.144  TCP 66 59298 → 22 [ACK] Seq=14261 Ack=181261 Win=6155 Len=0 TSval=5926448 TSecr=6522825
  337 6.948514682  10.6.15.144 → 192.168.1.16 SSH 1514 Server: Encrypted packet (len=1448)
  338 6.991931165 192.168.1.16 → 10.6.15.144  TCP 66 59298 → 22 [ACK] Seq=14261 Ack=182709 Win=6155 Len=0 TSval=5926467 TSecr=6522833
  339 7.084947325  10.6.15.144 → 192.168.1.16 SSH 1514 Server: Encrypted packet (len=1448)
  340 7.085084672  10.6.15.144 → 192.168.1.16 SSH 1514 Server: Encrypted packet (len=1448)
  341 7.085095023 192.168.1.16 → 10.6.15.144  TCP 66 59298 → 22 [ACK] Seq=14261 Ack=185605 Win=6155 Len=0 TSval=5926490 TSecr=6522866
  342 7.085274417  10.6.15.144 → 192.168.1.16 SSH 1514 Server: [TCP Previous segment not captured] , Encrypted packet (len=1448)
  343 7.085282157 192.168.1.16 → 10.6.15.144  TCP 78 [TCP Dup ACK 341#1] 59298 → 22 [ACK] Seq=14261 Ack=185605 Win=6155 Len=0 TSval=5926490 TSecr=6522866 SLE=188501 SRE=189949
  344 7.097261557  10.6.15.144 → 192.168.1.16 SSH 1514 Server: Encrypted packet (len=1448)
  345 7.097274167 192.168.1.16 → 10.6.15.144  TCP 78 [TCP Dup ACK 341#2] 59298 → 22 [ACK] Seq=14261 Ack=185605 Win=6155 Len=0 TSval=5926493 TSecr=6522866 SLE=188501 SRE=191397
  346 7.097447691  10.6.15.144 → 192.168.1.16 SSH 1514 Server: Encrypted packet (len=1448)
  347 7.097451555 192.168.1.16 → 10.6.15.144  TCP 78 [TCP Dup ACK 341#3] 59298 → 22 [ACK] Seq=14261 Ack=185605 Win=6155 Len=0 TSval=5926493 TSecr=6522866 SLE=188501 SRE=192845
  348 7.097638579  10.6.15.144 → 192.168.1.16 SSH 1514 Server: Encrypted packet (len=1448)
  349 7.097641959 192.168.1.16 → 10.6.15.144  TCP 78 [TCP Dup ACK 341#4] 59298 → 22 [ACK] Seq=14261 Ack=185605 Win=6155 Len=0 TSval=5926493 TSecr=6522866 SLE=188501 SRE=194293
  350 7.097983502  10.6.15.144 → 192.168.1.16 SSH 1514 Server: Encrypted packet (len=1448)
  351 7.097986674 192.168.1.16 → 10.6.15.144  TCP 78 [TCP Dup ACK 341#5] 59298 → 22 [ACK] Seq=14261 Ack=185605 Win=6155 Len=0 TSval=5926493 TSecr=6522866 SLE=188501 SRE=195741
  352 7.108361915  10.6.15.144 → 192.168.1.16 SSH 1514 Server: [TCP Fast Retransmission] , Encrypted packet (len=1448)
  353 7.108372495 192.168.1.16 → 10.6.15.144  TCP 78 59298 → 22 [ACK] Seq=14261 Ack=187053 Win=6155 Len=0 TSval=5926496 TSecr=6522872 SLE=188501 SRE=195741
  354 7.108551282  10.6.15.144 → 192.168.1.16 TCP 1514 [TCP Retransmission] 22 → 59298 [ACK] Seq=187053 Ack=14261 Win=1452 Len=1448 TSval=6522872 TSecr=5926493
  355 7.108556828 192.168.1.16 → 10.6.15.144  TCP 66 59298 → 22 [ACK] Seq=14261 Ack=195741 Win=6155 Len=0 TSval=5926496 TSecr=6522872
  356 7.108734531  10.6.15.144 → 192.168.1.16 SSH 1514 Server: Encrypted packet (len=1448)
  357 7.108740923 192.168.1.16 → 10.6.15.144  TCP 66 59298 → 22 [ACK] Seq=14261 Ack=197189 Win=6155 Len=0 TSval=5926496 TSecr=6522872
  358 7.111013377  10.6.15.144 → 192.168.1.16 SSH 1514 Server: Encrypted packet (len=1448)
  359 7.111018800 192.168.1.16 → 10.6.15.144  TCP 66 59298 → 22 [ACK] Seq=14261 Ack=198637 Win=6155 Len=0 TSval=5926496 TSecr=6522872
  360 7.119488579  10.6.15.144 → 192.168.1.16 SSH 1514 Server: Encrypted packet (len=1448)
  361 7.119504345 192.168.1.16 → 10.6.15.144  TCP 66 59298 → 22 [ACK] Seq=14261 Ack=200085 Win=6155 Len=0 TSval=5926498 TSecr=6522875
  362 7.119803938 192.168.1.16 → 10.6.15.144  SSH 102 Client: Encrypted packet (len=36)
  363 7.119807169  10.6.15.144 → 192.168.1.16 SSH 1514 Server: Encrypted packet (len=1448)
  364 7.119997186  10.6.15.144 → 192.168.1.16 SSH 1514 Server: Encrypted packet (len=1448)
  365 7.120003817 192.168.1.16 → 10.6.15.144  TCP 66 59298 → 22 [ACK] Seq=14297 Ack=202981 Win=6155 Len=0 TSval=5926499 TSecr=6522875
  366 7.120187248  10.6.15.144 → 192.168.1.16 SSH 1514 Server: Encrypted packet (len=1448)
  367 7.133883580  10.6.15.144 → 192.168.1.16 SSH 1514 Server: Encrypted packet (len=1448)
  368 7.133901551 192.168.1.16 → 10.6.15.144  TCP 66 59298 → 22 [ACK] Seq=14297 Ack=205877 Win=6155 Len=0 TSval=5926502 TSecr=6522875
  369 7.139859174  10.6.15.144 → 192.168.1.16 SSH 1514 Server: Encrypted packet (len=1448)
  370 7.139977446  10.6.15.144 → 192.168.1.16 SSH 1514 Server: Encrypted packet (len=1448)
  371 7.139988118 192.168.1.16 → 10.6.15.144  TCP 66 59298 → 22 [ACK] Seq=14297 Ack=208773 Win=6155 Len=0 TSval=5926504 TSecr=6522878
  372 7.140245786  10.6.15.144 → 192.168.1.16 SSH 1514 Server: Encrypted packet (len=1448)
  373 7.147237276  10.6.15.144 → 192.168.1.16 SSH 1514 Server: Encrypted packet (len=1448)
  374 7.147253500 192.168.1.16 → 10.6.15.144  TCP 66 59298 → 22 [ACK] Seq=14297 Ack=211669 Win=6155 Len=0 TSval=5926505 TSecr=6522878
  375 7.147394215  10.6.15.144 → 192.168.1.16 SSH 1514 Server: Encrypted packet (len=1448)
  376 7.151624267  10.6.15.144 → 192.168.1.16 SSH 1514 Server: Encrypted packet (len=1448)
  377 7.151630474 192.168.1.16 → 10.6.15.144  TCP 66 59298 → 22 [ACK] Seq=14297 Ack=214565 Win=6155 Len=0 TSval=5926506 TSecr=6522882
  378 7.154275905  10.6.15.144 → 192.168.1.16 SSH 1514 Server: Encrypted packet (len=1448)
  379 7.157683916  10.6.15.144 → 192.168.1.16 SSH 1514 Server: Encrypted packet (len=1448)
  380 7.157700942 192.168.1.16 → 10.6.15.144  TCP 66 59298 → 22 [ACK] Seq=14297 Ack=217461 Win=6155 Len=0 TSval=5926508 TSecr=6522883
  381 7.157860670  10.6.15.144 → 192.168.1.16 SSH 1514 Server: Encrypted packet (len=1448)
  382 7.162993235  10.6.15.144 → 192.168.1.16 SSH 1514 Server: Encrypted packet (len=1448)
  383 7.163010390 192.168.1.16 → 10.6.15.144  TCP 66 59298 → 22 [ACK] Seq=14297 Ack=220357 Win=6155 Len=0 TSval=5926509 TSecr=6522884
  384 7.163118558  10.6.15.144 → 192.168.1.16 SSH 1514 Server: Encrypted packet (len=1448)
  385 7.168310210  10.6.15.144 → 192.168.1.16 SSH 1514 Server: Encrypted packet (len=1448)
  386 7.168326422 192.168.1.16 → 10.6.15.144  TCP 66 59298 → 22 [ACK] Seq=14297 Ack=223253 Win=6155 Len=0 TSval=5926511 TSecr=6522886
  387 7.168488329  10.6.15.144 → 192.168.1.16 SSH 1514 Server: Encrypted packet (len=1448)
  388 7.173407424  10.6.15.144 → 192.168.1.16 SSH 1514 Server: Encrypted packet (len=1448)
  389 7.173424372 192.168.1.16 → 10.6.15.144  TCP 66 59298 → 22 [ACK] Seq=14297 Ack=226149 Win=6155 Len=0 TSval=5926512 TSecr=6522887
  390 7.173593916  10.6.15.144 → 192.168.1.16 SSH 1514 Server: Encrypted packet (len=1448)
  391 7.179038967  10.6.15.144 → 192.168.1.16 SSH 1514 Server: Encrypted packet (len=1448)
  392 7.179059358 192.168.1.16 → 10.6.15.144  TCP 66 59298 → 22 [ACK] Seq=14297 Ack=229045 Win=6155 Len=0 TSval=5926513 TSecr=6522888
  393 7.179214669  10.6.15.144 → 192.168.1.16 SSH 1514 Server: Encrypted packet (len=1448)
  394 7.190052810 192.168.1.16 → 10.6.15.144  SSH 294 Client: Encrypted packet (len=228)
  395 7.213882926  10.6.15.144 → 192.168.1.16 SSH 1514 Server: Encrypted packet (len=1448)
  396 7.214069868  10.6.15.144 → 192.168.1.16 SSH 1514 Server: Encrypted packet (len=1448)
  397 7.214078316 192.168.1.16 → 10.6.15.144  TCP 66 59298 → 22 [ACK] Seq=14525 Ack=233389 Win=6155 Len=0 TSval=5926522 TSecr=6522898
  398 7.214282885  10.6.15.144 → 192.168.1.16 SSH 1514 Server: Encrypted packet (len=1448)
  399 7.222409427  10.6.15.144 → 192.168.1.16 SSH 1514 Server: Encrypted packet (len=1448)
  400 7.222426662 192.168.1.16 → 10.6.15.144  TCP 66 59298 → 22 [ACK] Seq=14525 Ack=236285 Win=6155 Len=0 TSval=5926524 TSecr=6522898
  401 7.222620777  10.6.15.144 → 192.168.1.16 SSH 1514 Server: Encrypted packet (len=1448)
  402 7.222834500  10.6.15.144 → 192.168.1.16 SSH 1514 Server: Encrypted packet (len=1448)
  403 7.222839401 192.168.1.16 → 10.6.15.144  TCP 66 59298 → 22 [ACK] Seq=14525 Ack=239181 Win=6155 Len=0 TSval=5926524 TSecr=6522898
  404 7.226818874  10.6.15.144 → 192.168.1.16 SSH 1514 Server: Encrypted packet (len=1448)
  405 7.239005973  10.6.15.144 → 192.168.1.16 SSH 1514 Server: [TCP Previous segment not captured] , Encrypted packet (len=1448)
  406 7.239025084 192.168.1.16 → 10.6.15.144  TCP 78 59298 → 22 [ACK] Seq=14525 Ack=240629 Win=6155 Len=0 TSval=5926528 TSecr=6522901 SLE=242077 SRE=243525
  407 7.239246747  10.6.15.144 → 192.168.1.16 SSH 1514 Server: Encrypted packet (len=1448)
  408 7.239266704 192.168.1.16 → 10.6.15.144  TCP 78 [TCP Dup ACK 406#1] 59298 → 22 [ACK] Seq=14525 Ack=240629 Win=6155 Len=0 TSval=5926528 TSecr=6522901 SLE=242077 SRE=244973
  409 7.239487182  10.6.15.144 → 192.168.1.16 SSH 1514 Server: Encrypted packet (len=1448)
  410 7.239506336 192.168.1.16 → 10.6.15.144  TCP 78 [TCP Dup ACK 406#2] 59298 → 22 [ACK] Seq=14525 Ack=240629 Win=6155 Len=0 TSval=5926528 TSecr=6522901 SLE=242077 SRE=246421
  411 7.239726402  10.6.15.144 → 192.168.1.16 SSH 1514 Server: Encrypted packet (len=1448)
  412 7.239746120 192.168.1.16 → 10.6.15.144  TCP 78 [TCP Dup ACK 406#3] 59298 → 22 [ACK] Seq=14525 Ack=240629 Win=6155 Len=0 TSval=5926528 TSecr=6522901 SLE=242077 SRE=247869
  413 7.253795324  10.6.15.144 → 192.168.1.16 SSH 1514 Server: Encrypted packet (len=1448)
  414 7.253815216 192.168.1.16 → 10.6.15.144  TCP 78 [TCP Dup ACK 406#4] 59298 → 22 [ACK] Seq=14525 Ack=240629 Win=6155 Len=0 TSval=5926532 TSecr=6522901 SLE=242077 SRE=249317
  415 7.254043496  10.6.15.144 → 192.168.1.16 SSH 1514 Server: Encrypted packet (len=1448)
  416 7.254061488 192.168.1.16 → 10.6.15.144  TCP 78 [TCP Dup ACK 406#5] 59298 → 22 [ACK] Seq=14525 Ack=240629 Win=6155 Len=0 TSval=5926532 TSecr=6522901 SLE=242077 SRE=250765
  417 7.254274682  10.6.15.144 → 192.168.1.16 SSH 1514 Server: Encrypted packet (len=1448)
  418 7.254295140 192.168.1.16 → 10.6.15.144  TCP 78 [TCP Dup ACK 406#6] 59298 → 22 [ACK] Seq=14525 Ack=240629 Win=6155 Len=0 TSval=5926532 TSecr=6522901 SLE=242077 SRE=252213
  419 7.254632285  10.6.15.144 → 192.168.1.16 SSH 1514 Server: [TCP Fast Retransmission] , Encrypted packet (len=1448)
  420 7.254650356 192.168.1.16 → 10.6.15.144  TCP 66 59298 → 22 [ACK] Seq=14525 Ack=252213 Win=6155 Len=0 TSval=5926532 TSecr=6522908
  421 7.267404938  10.6.15.144 → 192.168.1.16 SSH 1514 Server: Encrypted packet (len=1448)
  422 7.267425753 192.168.1.16 → 10.6.15.144  TCP 66 59298 → 22 [ACK] Seq=14525 Ack=253661 Win=6155 Len=0 TSval=5926535 TSecr=6522911
  423 7.267634533  10.6.15.144 → 192.168.1.16 SSH 1514 Server: Encrypted packet (len=1448)
  424 7.267640307 192.168.1.16 → 10.6.15.144  TCP 66 59298 → 22 [ACK] Seq=14525 Ack=255109 Win=6155 Len=0 TSval=5926535 TSecr=6522911
  425 7.267874804  10.6.15.144 → 192.168.1.16 SSH 1514 Server: Encrypted packet (len=1448)
  426 7.267889104 192.168.1.16 → 10.6.15.144  TCP 66 59298 → 22 [ACK] Seq=14525 Ack=256557 Win=6155 Len=0 TSval=5926535 TSecr=6522911
  427 7.275069314 192.168.1.16 → 10.6.15.144  SSH 110 Client: Encrypted packet (len=44)
  428 7.275420328 192.168.1.16 → 10.6.15.144  SSH 330 Client: Encrypted packet (len=264)
  429 7.279012107  10.6.15.144 → 192.168.1.16 SSH 1514 Server: Encrypted packet (len=1448)
  430 7.279245912  10.6.15.144 → 192.168.1.16 SSH 1514 Server: Encrypted packet (len=1448)
  431 7.279253547 192.168.1.16 → 10.6.15.144  TCP 66 59298 → 22 [ACK] Seq=14833 Ack=259453 Win=6155 Len=0 TSval=5926538 TSecr=6522915
  432 7.280226977  10.6.15.144 → 192.168.1.16 SSH 1514 Server: Encrypted packet (len=1448)
  433 7.280292947  10.6.15.144 → 192.168.1.16 SSH 590 Server: Encrypted packet (len=524)
  434 7.280299907 192.168.1.16 → 10.6.15.144  TCP 66 59298 → 22 [ACK] Seq=14833 Ack=261425 Win=6155 Len=0 TSval=5926539 TSecr=6522915
  435 7.287181710  10.6.15.144 → 192.168.1.16 TCP 66 22 → 59298 [ACK] Seq=261425 Ack=14833 Win=1452 Len=0 TSval=6522916 TSecr=5926537
  436 7.290674325  10.6.15.144 → 192.168.1.16 SSH 126 Server: Encrypted packet (len=60)
  437 7.321948453  10.6.15.144 → 192.168.1.16 SSH 238 Server: Encrypted packet (len=172)
  438 7.321965560 192.168.1.16 → 10.6.15.144  TCP 66 59298 → 22 [ACK] Seq=14833 Ack=261657 Win=6155 Len=0 TSval=5926549 TSecr=6522916
  439 7.387178316  10.6.15.144 → 192.168.1.16 SSH 302 Server: Encrypted packet (len=236)
  440 7.427900863 192.168.1.16 → 10.6.15.144  TCP 66 59298 → 22 [ACK] Seq=14833 Ack=261893 Win=6155 Len=0 TSval=5926576 TSecr=6522942
  441 7.432464954 192.168.1.16 → 10.6.15.144  SSH 974 Client: Encrypted packet (len=908)
  442 7.433971100 192.168.1.16 → 10.6.15.144  SSH 1514 Client: Encrypted packet (len=1448)
  443 7.449852917 192.168.1.16 → 10.6.15.144  SSH 1478 Client: Encrypted packet (len=1412)
  444 7.499900378 192.168.1.16 → 10.6.15.144  TCP 1478 [TCP Retransmission] 59298 → 22 [PSH, ACK] Seq=17189 Ack=261893 Win=6155 Len=1412 TSval=5926594 TSecr=6522942
  445 7.513443981  10.6.15.144 → 192.168.1.16 TCP 78 [TCP Dup ACK 435#1] 22 → 59298 [ACK] Seq=261893 Ack=14833 Win=1452 Len=0 TSval=6522973 TSecr=5926576 SLE=17189 SRE=18601
  446 7.513460198  10.6.15.144 → 192.168.1.16 TCP 86 [TCP Dup ACK 435#2] 22 → 59298 [ACK] Seq=261893 Ack=14833 Win=1452 Len=0 TSval=6522973 TSecr=5926576 SLE=17189 SRE=18601 SLE=17189 SRE=18601
  447 7.727940716 192.168.1.16 → 10.6.15.144  TCP 974 [TCP Retransmission] 59298 → 22 [PSH, ACK] Seq=14833 Ack=261893 Win=6155 Len=908 TSval=5926651 TSecr=6522973
  448 7.741266622  10.6.15.144 → 192.168.1.16 TCP 78 22 → 59298 [ACK] Seq=261893 Ack=15741 Win=1446 Len=0 TSval=6523030 TSecr=5926651 SLE=17189 SRE=18601
  449 7.741296050 192.168.1.16 → 10.6.15.144  TCP 1514 [TCP Retransmission] 59298 → 22 [ACK] Seq=15741 Ack=261893 Win=6155 Len=1448 TSval=5926654 TSecr=6523030
  450 7.757396298  10.6.15.144 → 192.168.1.16 TCP 66 22 → 59298 [ACK] Seq=261893 Ack=18601 Win=1446 Len=0 TSval=6523034 TSecr=5926654
  451 7.842588414  10.6.15.144 → 192.168.1.16 SSH 222 Server: Encrypted packet (len=156)
  452 7.842612972 192.168.1.16 → 10.6.15.144  TCP 66 59298 → 22 [ACK] Seq=18601 Ack=262049 Win=6155 Len=0 TSval=5926679 TSecr=6523056
  453 7.859024874  10.6.15.144 → 192.168.1.16 SSH 198 Server: Encrypted packet (len=132)
  454 7.859040979 192.168.1.16 → 10.6.15.144  TCP 66 59298 → 22 [ACK] Seq=18601 Ack=262181 Win=6155 Len=0 TSval=5926683 TSecr=6523060
  455 7.859057590  10.6.15.144 → 192.168.1.16 SSH 198 Server: Encrypted packet (len=132)
  456 7.859061986 192.168.1.16 → 10.6.15.144  TCP 66 59298 → 22 [ACK] Seq=18601 Ack=262313 Win=6155 Len=0 TSval=5926683 TSecr=6523060
  457 7.859089871  10.6.15.144 → 192.168.1.16 SSH 198 Server: Encrypted packet (len=132)
  458 7.859093233 192.168.1.16 → 10.6.15.144  TCP 66 59298 → 22 [ACK] Seq=18601 Ack=262445 Win=6155 Len=0 TSval=5926683 TSecr=6523060
  459 8.041969510 192.168.1.16 → 54.76.71.168 TCP 128 42414 → 8282 [PSH, ACK] Seq=1 Ack=1 Win=296 Len=62 TSval=5926729 TSecr=610031219
  460 8.401159710 192.168.1.16 → 10.6.15.144  SSH 662 Client: Encrypted packet (len=596)
  461 8.403694918 192.168.1.16 → 10.6.15.144  SSH 782 Client: Encrypted packet (len=716)
  462 8.406236125 54.76.71.168 → 192.168.1.16 TCP 66 8282 → 42414 [ACK] Seq=1 Ack=63 Win=121 Len=0 TSval=610038704 TSecr=5926729
  463 8.412546322  10.6.15.144 → 192.168.1.16 TCP 66 22 → 59298 [ACK] Seq=262445 Ack=19197 Win=1452 Len=0 TSval=6523198 TSecr=5926819
  464 8.416140762  10.6.15.144 → 192.168.1.16 TCP 66 22 → 59298 [ACK] Seq=262445 Ack=19913 Win=1452 Len=0 TSval=6523199 TSecr=5926819
  465 8.510296734  10.6.15.144 → 192.168.1.16 SSH 198 Server: Encrypted packet (len=132)
  466 8.510315831 192.168.1.16 → 10.6.15.144  TCP 66 59298 → 22 [ACK] Seq=19913 Ack=262577 Win=6155 Len=0 TSval=5926846 TSecr=6523224
  467 8.514912781  10.6.15.144 → 192.168.1.16 SSH 198 Server: Encrypted packet (len=132)
  468 8.514929664 192.168.1.16 → 10.6.15.144  TCP 66 59298 → 22 [ACK] Seq=19913 Ack=262709 Win=6155 Len=0 TSval=5926847 TSecr=6523224
  469 8.773549664 192.168.1.16 → 10.6.15.144  SSH 206 Client: Encrypted packet (len=140)
  470 8.785853987  10.6.15.144 → 192.168.1.16 TCP 66 22 → 59298 [ACK] Seq=262709 Ack=20053 Win=1452 Len=0 TSval=6523291 TSecr=5926912
  471 8.885065751  10.6.15.144 → 192.168.1.16 SSH 222 Server: Encrypted packet (len=156)
  472 8.885092202 192.168.1.16 → 10.6.15.144  TCP 66 59298 → 22 [ACK] Seq=20053 Ack=262865 Win=6155 Len=0 TSval=5926940 TSecr=6523317
  473 10.267248747 192.168.1.16 → 10.6.15.144  SSH 102 Client: Encrypted packet (len=36)
  474 10.268600518 192.168.1.16 → 10.6.15.144  SSH 118 Client: Encrypted packet (len=52)
  475 10.277633813  10.6.15.144 → 192.168.1.16 TCP 66 22 → 59298 [ACK] Seq=262865 Ack=20089 Win=1452 Len=0 TSval=6523664 TSecr=5927285
  476 10.280091088  10.6.15.144 → 192.168.1.16 TCP 66 22 → 59298 [ACK] Seq=262865 Ack=20141 Win=1452 Len=0 TSval=6523665 TSecr=5927286
  477 10.284121522  10.6.15.144 → 192.168.1.16 SSH 110 Server: Encrypted packet (len=44)
  478 10.284140706 192.168.1.16 → 10.6.15.144  TCP 66 59298 → 22 [ACK] Seq=20141 Ack=262909 Win=6155 Len=0 TSval=5927290 TSecr=6523666
  479 10.285341947 192.168.1.16 → 10.6.15.144  SSH 422 Client: Encrypted packet (len=356)
  480 10.301477527  10.6.15.144 → 192.168.1.16 SSH 254 Server: Encrypted packet (len=188)
  481 10.301794379 192.168.1.16 → 10.6.15.144  SSH 134 Client: Encrypted packet (len=68)
  482 10.305041370 192.168.1.16 → 10.6.15.144  SSH 230 Client: Encrypted packet (len=164)
  483 10.305334583 192.168.1.16 → 10.6.15.144  SSH 1514 Client: Encrypted packet (len=1448)
  484 10.317410078  10.6.15.144 → 192.168.1.16 SSH 134 Server: Encrypted packet (len=68)
  485 10.322734903  10.6.15.144 → 192.168.1.16 SSH 138 Server: Encrypted packet (len=72)
  486 10.322754895 192.168.1.16 → 10.6.15.144  SSH 598 Client: Encrypted packet (len=532)
  487 10.323166310  10.6.15.144 → 192.168.1.16 SSH 166 Server: Encrypted packet (len=100)
  488 10.323171523 192.168.1.16 → 10.6.15.144  SSH 102 Client: Encrypted packet (len=36)
  489 10.323204699  10.6.15.144 → 192.168.1.16 SSH 134 Server: Encrypted packet (len=68)
  490 10.349784892  10.6.15.144 → 192.168.1.16 TCP 134 [TCP Retransmission] 22 → 59298 [PSH, ACK] Seq=263337 Ack=20729 Win=1452 Len=68 TSval=6523683 TSecr=5927295
  491 10.349805883 192.168.1.16 → 10.6.15.144  TCP 78 59298 → 22 [ACK] Seq=22745 Ack=263405 Win=6155 Len=0 TSval=5927306 TSecr=6523683 SLE=263337 SRE=263405
  492 10.363450353  10.6.15.144 → 192.168.1.16 TCP 78 [TCP Dup ACK 487#1] 22 → 59298 [ACK] Seq=263405 Ack=20729 Win=1452 Len=0 TSval=6523686 TSecr=5927295 SLE=22177 SRE=22709
  493 10.363472008 192.168.1.16 → 10.6.15.144  SSH 126 Client: Encrypted packet (len=60)
  494 10.363484304  10.6.15.144 → 192.168.1.16 TCP 78 [TCP Dup ACK 487#2] 22 → 59298 [ACK] Seq=263405 Ack=20729 Win=1452 Len=0 TSval=6523686 TSecr=5927295 SLE=22177 SRE=22745
  495 10.374768945  10.6.15.144 → 192.168.1.16 TCP 78 [TCP Dup ACK 487#3] 22 → 59298 [ACK] Seq=263405 Ack=20729 Win=1452 Len=0 TSval=6523689 TSecr=5927295 SLE=22177 SRE=22805
  496 10.374789150 192.168.1.16 → 10.6.15.144  SSH 1514 Client: [TCP Fast Retransmission] , Encrypted packet (len=1448)
  497 10.384350441  10.6.15.144 → 192.168.1.16 TCP 66 22 → 59298 [ACK] Seq=263405 Ack=22805 Win=1446 Len=0 TSval=6523691 TSecr=5927312
  498 11.283421989 192.168.1.16 → 10.6.15.144  SSH 230 Client: Encrypted packet (len=164)
  499 11.286559862  10.6.15.144 → 192.168.1.16 SSH 1054 Server: Encrypted packet (len=988)
  500 11.286588432 192.168.1.16 → 10.6.15.144  TCP 66 59298 → 22 [ACK] Seq=22969 Ack=264393 Win=6155 Len=0 TSval=5927540 TSecr=6523720
  501 11.286604856  10.6.15.144 → 192.168.1.16 SSH 550 Server: Encrypted packet (len=484)
  502 11.286612130 192.168.1.16 → 10.6.15.144  TCP 66 59298 → 22 [ACK] Seq=22969 Ack=264877 Win=6155 Len=0 TSval=5927540 TSecr=6523720
  503 11.286626368  10.6.15.144 → 192.168.1.16 SSH 142 Server: Encrypted packet (len=76)
  504 11.286630334 192.168.1.16 → 10.6.15.144  TCP 66 59298 → 22 [ACK] Seq=22969 Ack=264953 Win=6155 Len=0 TSval=5927540 TSecr=6523720
  505 11.287210001 192.168.1.16 → 10.6.15.144  SSH 134 Client: Encrypted packet (len=68)
  506 11.295164269  10.6.15.144 → 192.168.1.16 SSH 1054 Server: [TCP Spurious Retransmission] , Encrypted packet (len=988)
  507 11.295181612 192.168.1.16 → 10.6.15.144  TCP 78 [TCP Dup ACK 504#1] 59298 → 22 [ACK] Seq=23037 Ack=264953 Win=6155 Len=0 TSval=5927542 TSecr=6523720 SLE=263405 SRE=264393
  508 11.295295755  10.6.15.144 → 192.168.1.16 SSH 1054 Server: [TCP Spurious Retransmission] , Encrypted packet (len=988)
  509 11.295301479 192.168.1.16 → 10.6.15.144  TCP 78 [TCP Dup ACK 504#2] 59298 → 22 [ACK] Seq=23037 Ack=264953 Win=6155 Len=0 TSval=5927542 TSecr=6523720 SLE=263405 SRE=264393
  510 11.295308481  10.6.15.144 → 192.168.1.16 TCP 66 22 → 59298 [ACK] Seq=264953 Ack=22969 Win=1452 Len=0 TSval=6523919 TSecr=5927539
  511 11.295386274  10.6.15.144 → 192.168.1.16 SSH 626 Server: [TCP Spurious Retransmission] , Encrypted packet (len=560)
  512 11.295394112 192.168.1.16 → 10.6.15.144  TCP 78 [TCP Dup ACK 504#3] 59298 → 22 [ACK] Seq=23037 Ack=264953 Win=6155 Len=0 TSval=5927542 TSecr=6523919 SLE=264393 SRE=264953
  513 11.334546096  10.6.15.144 → 192.168.1.16 TCP 66 22 → 59298 [ACK] Seq=264953 Ack=23037 Win=1452 Len=0 TSval=6523929 TSecr=5927540
  514 12.934198645  10.6.15.144 → 192.168.1.16 SSH 1514 Server: Encrypted packet (len=1448)
  515 12.934242543 192.168.1.16 → 10.6.15.144  TCP 66 59298 → 22 [ACK] Seq=23037 Ack=266401 Win=6155 Len=0 TSval=5927952 TSecr=6524056
  516 12.934314889  10.6.15.144 → 192.168.1.16 SSH 1514 Server: Encrypted packet (len=1448)
  517 12.934328867 192.168.1.16 → 10.6.15.144  TCP 66 59298 → 22 [ACK] Seq=23037 Ack=267849 Win=6155 Len=0 TSval=5927952 TSecr=6524056
  518 12.934539395  10.6.15.144 → 192.168.1.16 SSH 1514 Server: Encrypted packet (len=1448)
  519 12.934556617 192.168.1.16 → 10.6.15.144  TCP 66 59298 → 22 [ACK] Seq=23037 Ack=269297 Win=6155 Len=0 TSval=5927952 TSecr=6524056
  520 12.934718172  10.6.15.144 → 192.168.1.16 SSH 1514 Server: Encrypted packet (len=1448)
  521 12.934735463 192.168.1.16 → 10.6.15.144  TCP 66 59298 → 22 [ACK] Seq=23037 Ack=270745 Win=6155 Len=0 TSval=5927952 TSecr=6524158
  522 13.633982031 192.168.1.16 → 123.108.200.124 NTP 90 NTP Version 4, client
  523 14.950466388  10.6.15.144 → 192.168.1.16 SSH 1514 Server: [TCP Spurious Retransmission] , Encrypted packet (len=1448)
  524 14.950481520 192.168.1.16 → 10.6.15.144  TCP 78 [TCP Dup ACK 521#1] 59298 → 22 [ACK] Seq=23037 Ack=270745 Win=6155 Len=0 TSval=5928456 TSecr=6524158 SLE=264953 SRE=266401
  525 15.287462353 192.168.1.16 → 10.6.15.144  SSH 206 Client: Encrypted packet (len=140)
  526 15.290519071  10.6.15.144 → 192.168.1.16 SSH 1514 Server: Encrypted packet (len=1448)
  527 15.290536960 192.168.1.16 → 10.6.15.144  TCP 66 59298 → 22 [ACK] Seq=23177 Ack=272193 Win=6155 Len=0 TSval=5928541 TSecr=6524863
  528 15.290700840  10.6.15.144 → 192.168.1.16 SSH 1514 Server: Encrypted packet (len=1448)
  529 15.290706584 192.168.1.16 → 10.6.15.144  TCP 66 59298 → 22 [ACK] Seq=23177 Ack=273641 Win=6155 Len=0 TSval=5928541 TSecr=6524863
  530 15.290899486  10.6.15.144 → 192.168.1.16 SSH 1514 Server: Encrypted packet (len=1448)
  531 15.290907690 192.168.1.16 → 10.6.15.144  TCP 66 59298 → 22 [ACK] Seq=23177 Ack=275089 Win=6155 Len=0 TSval=5928541 TSecr=6524863
  532 15.297273973  10.6.15.144 → 192.168.1.16 TCP 66 22 → 59298 [ACK] Seq=275089 Ack=23177 Win=1452 Len=0 TSval=6524920 TSecr=5928540
  533 15.300365581  10.6.15.144 → 192.168.1.16 SSH 1514 Server: Encrypted packet (len=1448)
  534 15.300375189 192.168.1.16 → 10.6.15.144  TCP 66 59298 → 22 [ACK] Seq=23177 Ack=276537 Win=6155 Len=0 TSval=5928544 TSecr=6524920
  535 15.300531717  10.6.15.144 → 192.168.1.16 SSH 1514 Server: Encrypted packet (len=1448)
  536 15.300538365 192.168.1.16 → 10.6.15.144  TCP 66 59298 → 22 [ACK] Seq=23177 Ack=277985 Win=6155 Len=0 TSval=5928544 TSecr=6524920
  537 15.300722781  10.6.15.144 → 192.168.1.16 SSH 1514 Server: Encrypted packet (len=1448)
  538 15.300729332 192.168.1.16 → 10.6.15.144  TCP 66 59298 → 22 [ACK] Seq=23177 Ack=279433 Win=6155 Len=0 TSval=5928544 TSecr=6524920
  539 15.301076279  10.6.15.144 → 192.168.1.16 SSH 1514 Server: Encrypted packet (len=1448)
  540 15.301080074 192.168.1.16 → 10.6.15.144  TCP 66 59298 → 22 [ACK] Seq=23177 Ack=280881 Win=6155 Len=0 TSval=5928544 TSecr=6524920
  541 15.311051774  10.6.15.144 → 192.168.1.16 SSH 1514 Server: Encrypted packet (len=1448)
  542 15.311068573 192.168.1.16 → 10.6.15.144  TCP 66 59298 → 22 [ACK] Seq=23177 Ack=282329 Win=6155 Len=0 TSval=5928546 TSecr=6524923
  543 15.311207154  10.6.15.144 → 192.168.1.16 SSH 1514 Server: Encrypted packet (len=1448)
  544 15.311211187 192.168.1.16 → 10.6.15.144  TCP 66 59298 → 22 [ACK] Seq=23177 Ack=283777 Win=6155 Len=0 TSval=5928546 TSecr=6524923
  545 15.311420623  10.6.15.144 → 192.168.1.16 SSH 1514 Server: Encrypted packet (len=1448)
  546 15.311424827 192.168.1.16 → 10.6.15.144  TCP 66 59298 → 22 [ACK] Seq=23177 Ack=285225 Win=6155 Len=0 TSval=5928546 TSecr=6524923
  547 15.311772518  10.6.15.144 → 192.168.1.16 SSH 1514 Server: Encrypted packet (len=1448)
  548 15.311776251 192.168.1.16 → 10.6.15.144  TCP 66 59298 → 22 [ACK] Seq=23177 Ack=286673 Win=6155 Len=0 TSval=5928546 TSecr=6524923
  549 15.311804560  10.6.15.144 → 192.168.1.16 SSH 638 Server: Encrypted packet (len=572)
  550 15.311806993 192.168.1.16 → 10.6.15.144  TCP 66 59298 → 22 [ACK] Seq=23177 Ack=287245 Win=6155 Len=0 TSval=5928546 TSecr=6524923
  551 16.934560919  10.6.15.144 → 192.168.1.16 SSH 1514 Server: Encrypted packet (len=1448)
  552 16.934588214 192.168.1.16 → 10.6.15.144  TCP 66 59298 → 22 [ACK] Seq=23177 Ack=288693 Win=6155 Len=0 TSval=5928952 TSecr=6524956
  553 16.936691297  10.6.15.144 → 192.168.1.16 SSH 1514 Server: Encrypted packet (len=1448)
  554 16.936709897 192.168.1.16 → 10.6.15.144  TCP 66 59298 → 22 [ACK] Seq=23177 Ack=290141 Win=6155 Len=0 TSval=5928953 TSecr=6524956
  555 16.936838701  10.6.15.144 → 192.168.1.16 SSH 1514 Server: Encrypted packet (len=1448)
  556 16.936844501 192.168.1.16 → 10.6.15.144  TCP 66 59298 → 22 [ACK] Seq=23177 Ack=291589 Win=6155 Len=0 TSval=5928953 TSecr=6524956
  557 16.936871838  10.6.15.144 → 192.168.1.16 SSH 638 Server: Encrypted packet (len=572)
  558 16.936874388 192.168.1.16 → 10.6.15.144  TCP 66 59298 → 22 [ACK] Seq=23177 Ack=292161 Win=6155 Len=0 TSval=5928953 TSecr=6524956
  559 16.937101691  10.6.15.144 → 192.168.1.16 SSH 1514 Server: Encrypted packet (len=1448)
  560 16.937108608 192.168.1.16 → 10.6.15.144  TCP 66 59298 → 22 [ACK] Seq=23177 Ack=293609 Win=6155 Len=0 TSval=5928953 TSecr=6524956
  561 16.937293490  10.6.15.144 → 192.168.1.16 SSH 1514 Server: Encrypted packet (len=1448)
  562 16.937300507 192.168.1.16 → 10.6.15.144  TCP 66 59298 → 22 [ACK] Seq=23177 Ack=295057 Win=6155 Len=0 TSval=5928953 TSecr=6525026
  563 16.957010974  10.6.15.144 → 192.168.1.16 SSH 1514 Server: Encrypted packet (len=1448)
  564 16.957029140 192.168.1.16 → 10.6.15.144  TCP 66 59298 → 22 [ACK] Seq=23177 Ack=296505 Win=6155 Len=0 TSval=5928958 TSecr=6525331
  565 16.974181513  10.6.15.144 → 192.168.1.16 SSH 1514 Server: Encrypted packet (len=1448)
  566 16.974199211 192.168.1.16 → 10.6.15.144  TCP 66 59298 → 22 [ACK] Seq=23177 Ack=297953 Win=6155 Len=0 TSval=5928962 TSecr=6525338
  567 16.974352855  10.6.15.144 → 192.168.1.16 SSH 1514 Server: Encrypted packet (len=1448)
  568 16.974362012 192.168.1.16 → 10.6.15.144  TCP 66 59298 → 22 [ACK] Seq=23177 Ack=299401 Win=6155 Len=0 TSval=5928962 TSecr=6525338
  569 16.974571889  10.6.15.144 → 192.168.1.16 SSH 1514 Server: Encrypted packet (len=1448)
  570 16.974578906 192.168.1.16 → 10.6.15.144  TCP 66 59298 → 22 [ACK] Seq=23177 Ack=300849 Win=6155 Len=0 TSval=5928962 TSecr=6525338
  571 16.974932174  10.6.15.144 → 192.168.1.16 SSH 1514 Server: [TCP Previous segment not captured] , Encrypted packet (len=1448)
  572 16.974937395 192.168.1.16 → 10.6.15.144  TCP 78 [TCP Dup ACK 570#1] 59298 → 22 [ACK] Seq=23177 Ack=300849 Win=6155 Len=0 TSval=5928962 TSecr=6525338 SLE=302297 SRE=303745
  573 16.975144257  10.6.15.144 → 192.168.1.16 SSH 1514 Server: Encrypted packet (len=1448)
  574 16.975148807 192.168.1.16 → 10.6.15.144  TCP 78 [TCP Dup ACK 570#2] 59298 → 22 [ACK] Seq=23177 Ack=300849 Win=6155 Len=0 TSval=5928962 TSecr=6525338 SLE=302297 SRE=305193
  575 16.986566055  10.6.15.144 → 192.168.1.16 SSH 1514 Server: Encrypted packet (len=1448)
  576 16.986587655 192.168.1.16 → 10.6.15.144  TCP 78 [TCP Dup ACK 570#3] 59298 → 22 [ACK] Seq=23177 Ack=300849 Win=6155 Len=0 TSval=5928965 TSecr=6525338 SLE=302297 SRE=306641
  577 16.986777099  10.6.15.144 → 192.168.1.16 SSH 1514 Server: Encrypted packet (len=1448)
  578 16.986799431 192.168.1.16 → 10.6.15.144  TCP 78 [TCP Dup ACK 570#4] 59298 → 22 [ACK] Seq=23177 Ack=300849 Win=6155 Len=0 TSval=5928965 TSecr=6525338 SLE=302297 SRE=308089
  579 16.991815764  10.6.15.144 → 192.168.1.16 SSH 1514 Server: Encrypted packet (len=1448)
  580 16.991835565 192.168.1.16 → 10.6.15.144  TCP 78 [TCP Dup ACK 570#5] 59298 → 22 [ACK] Seq=23177 Ack=300849 Win=6155 Len=0 TSval=5928966 TSecr=6525338 SLE=302297 SRE=309537
  581 16.992025745  10.6.15.144 → 192.168.1.16 SSH 1514 Server: Encrypted packet (len=1448)
  582 16.992032229 192.168.1.16 → 10.6.15.144  TCP 78 [TCP Dup ACK 570#6] 59298 → 22 [ACK] Seq=23177 Ack=300849 Win=6155 Len=0 TSval=5928967 TSecr=6525338 SLE=302297 SRE=310985
  583 16.992240999  10.6.15.144 → 192.168.1.16 SSH 1514 Server: Encrypted packet (len=1448)
  584 16.992244616 192.168.1.16 → 10.6.15.144  TCP 78 [TCP Dup ACK 570#7] 59298 → 22 [ACK] Seq=23177 Ack=300849 Win=6155 Len=0 TSval=5928967 TSecr=6525338 SLE=302297 SRE=312433
  585 16.992423320  10.6.15.144 → 192.168.1.16 SSH 1514 Server: Encrypted packet (len=1448)
  586 16.992426099 192.168.1.16 → 10.6.15.144  TCP 78 [TCP Dup ACK 570#8] 59298 → 22 [ACK] Seq=23177 Ack=300849 Win=6155 Len=0 TSval=5928967 TSecr=6525338 SLE=302297 SRE=313881
  587 17.035038585  10.6.15.144 → 192.168.1.16 TCP 1514 [TCP Retransmission] 22 → 59298 [ACK] Seq=300849 Ack=23177 Win=1452 Len=1448 TSval=6525351 TSecr=5928965
  588 17.035064847 192.168.1.16 → 10.6.15.144  TCP 66 59298 → 22 [ACK] Seq=23177 Ack=313881 Win=6155 Len=0 TSval=5928977 TSecr=6525351
  589 17.045669653  10.6.15.144 → 192.168.1.16 SSH 1514 Server: Encrypted packet (len=1448)
  590 17.045688223 192.168.1.16 → 10.6.15.144  TCP 66 59298 → 22 [ACK] Seq=23177 Ack=315329 Win=6155 Len=0 TSval=5928980 TSecr=6525356
  591 17.045845297  10.6.15.144 → 192.168.1.16 SSH 1514 Server: Encrypted packet (len=1448)
  592 17.045854161 192.168.1.16 → 10.6.15.144  TCP 66 59298 → 22 [ACK] Seq=23177 Ack=316777 Win=6155 Len=0 TSval=5928980 TSecr=6525356
  593 17.046070947  10.6.15.144 → 192.168.1.16 SSH 1514 Server: Encrypted packet (len=1448)
  594 17.046090341 192.168.1.16 → 10.6.15.144  TCP 66 59298 → 22 [ACK] Seq=23177 Ack=318225 Win=6155 Len=0 TSval=5928980 TSecr=6525356
  595 17.065467617  10.6.15.144 → 192.168.1.16 SSH 1514 Server: Encrypted packet (len=1448)
  596 17.065487022 192.168.1.16 → 10.6.15.144  TCP 66 59298 → 22 [ACK] Seq=23177 Ack=319673 Win=6155 Len=0 TSval=5928985 TSecr=6525356
  597 17.065641848  10.6.15.144 → 192.168.1.16 SSH 1514 Server: Encrypted packet (len=1448)
  598 17.065651196 192.168.1.16 → 10.6.15.144  TCP 66 59298 → 22 [ACK] Seq=23177 Ack=321121 Win=6155 Len=0 TSval=5928985 TSecr=6525359
  599 17.065877898  10.6.15.144 → 192.168.1.16 SSH 1514 Server: Encrypted packet (len=1448)
  600 17.065897229 192.168.1.16 → 10.6.15.144  TCP 66 59298 → 22 [ACK] Seq=23177 Ack=322569 Win=6155 Len=0 TSval=5928985 TSecr=6525359
  601 17.066037143  10.6.15.144 → 192.168.1.16 SSH 1514 Server: Encrypted packet (len=1448)
  602 17.066042212 192.168.1.16 → 10.6.15.144  TCP 66 59298 → 22 [ACK] Seq=23177 Ack=324017 Win=6155 Len=0 TSval=5928985 TSecr=6525359
  603 17.066276878  10.6.15.144 → 192.168.1.16 SSH 1514 Server: Encrypted packet (len=1448)
  604 17.066282138 192.168.1.16 → 10.6.15.144  TCP 66 59298 → 22 [ACK] Seq=23177 Ack=325465 Win=6155 Len=0 TSval=5928985 TSecr=6525359
  605 17.082274537  10.6.15.144 → 192.168.1.16 SSH 1514 Server: Encrypted packet (len=1448)
  606 17.082292138 192.168.1.16 → 10.6.15.144  TCP 66 59298 → 22 [ACK] Seq=23177 Ack=326913 Win=6155 Len=0 TSval=5928989 TSecr=6525365
  607 17.082475520  10.6.15.144 → 192.168.1.16 SSH 1514 Server: Encrypted packet (len=1448)
  608 17.082484954 192.168.1.16 → 10.6.15.144  TCP 66 59298 → 22 [ACK] Seq=23177 Ack=328361 Win=6155 Len=0 TSval=5928989 TSecr=6525365
  609 17.082749741  10.6.15.144 → 192.168.1.16 SSH 1514 Server: Encrypted packet (len=1448)
  610 17.082766386 192.168.1.16 → 10.6.15.144  TCP 66 59298 → 22 [ACK] Seq=23177 Ack=329809 Win=6155 Len=0 TSval=5928989 TSecr=6525365
  611 17.091615738  10.6.15.144 → 192.168.1.16 SSH 1514 Server: Encrypted packet (len=1448)
  612 17.091634678 192.168.1.16 → 10.6.15.144  TCP 66 59298 → 22 [ACK] Seq=23177 Ack=331257 Win=6155 Len=0 TSval=5928991 TSecr=6525365
  613 17.091657066  10.6.15.144 → 192.168.1.16 SSH 382 Server: Encrypted packet (len=316)
  614 17.091660957 192.168.1.16 → 10.6.15.144  TCP 66 59298 → 22 [ACK] Seq=23177 Ack=331573 Win=6155 Len=0 TSval=5928991 TSecr=6525365
  615 19.299915619 192.168.1.16 → 10.6.15.144  SSH 206 Client: Encrypted packet (len=140)
  616 19.507993093 192.168.1.16 → 10.6.15.144  TCP 206 [TCP Retransmission] 59298 → 22 [PSH, ACK] Seq=23177 Ack=331573 Win=6155 Len=140 TSval=5929596 TSecr=6525365
  617 19.747971720 192.168.1.16 → 10.6.15.144  TCP 206 [TCP Retransmission] 59298 → 22 [PSH, ACK] Seq=23177 Ack=331573 Win=6155 Len=140 TSval=5929653 TSecr=6525365
  618 20.135986057 192.168.1.16 → 239.255.255.250 SSDP 213 M-SEARCH * HTTP/1.1 
  619 20.195949209 192.168.1.16 → 10.6.15.144  TCP 206 [TCP Retransmission] 59298 → 22 [PSH, ACK] Seq=23177 Ack=331573 Win=6155 Len=140 TSval=5929768 TSecr=6525365
  620 21.123916710 192.168.1.16 → 10.6.15.144  TCP 206 [TCP Retransmission] 59298 → 22 [PSH, ACK] Seq=23177 Ack=331573 Win=6155 Len=140 TSval=5930000 TSecr=6525365
  621 21.127967164 192.168.1.16 → 239.255.255.250 SSDP 213 M-SEARCH * HTTP/1.1 
  622 21.174143163  10.6.15.144 → 192.168.1.16 TCP 66 22 → 59298 [ACK] Seq=331573 Ack=23317 Win=1452 Len=0 TSval=6526389 TSecr=5930000
  623 22.128789439 192.168.1.16 → 239.255.255.250 SSDP 213 M-SEARCH * HTTP/1.1 
  624 22.132804092  10.6.15.144 → 192.168.1.16 SSH 1514 Server: Encrypted packet (len=1448)
  625 22.132826579 192.168.1.16 → 10.6.15.144  TCP 66 59298 → 22 [ACK] Seq=23317 Ack=333021 Win=6155 Len=0 TSval=5930252 TSecr=6526416
  626 22.132984376  10.6.15.144 → 192.168.1.16 SSH 1514 Server: Encrypted packet (len=1448)
  627 22.132991060 192.168.1.16 → 10.6.15.144  TCP 66 59298 → 22 [ACK] Seq=23317 Ack=334469 Win=6155 Len=0 TSval=5930252 TSecr=6526416
  628 22.133016298  10.6.15.144 → 192.168.1.16 SSH 606 Server: Encrypted packet (len=540)
  629 22.133020461 192.168.1.16 → 10.6.15.144  TCP 66 59298 → 22 [ACK] Seq=23317 Ack=335009 Win=6155 Len=0 TSval=5930252 TSecr=6526417
  630 22.155684209  10.6.15.144 → 192.168.1.16 SSH 1514 Server: Encrypted packet (len=1448)
  631 22.155700818 192.168.1.16 → 10.6.15.144  TCP 66 59298 → 22 [ACK] Seq=23317 Ack=336457 Win=6155 Len=0 TSval=5930257 TSecr=6526417
  632 22.155844279  10.6.15.144 → 192.168.1.16 SSH 1514 Server: Encrypted packet (len=1448)
  633 22.155847865 192.168.1.16 → 10.6.15.144  TCP 66 59298 → 22 [ACK] Seq=23317 Ack=337905 Win=6155 Len=0 TSval=5930257 TSecr=6526417
  634 22.156078308  10.6.15.144 → 192.168.1.16 SSH 1514 Server: Encrypted packet (len=1448)
  635 22.156096722 192.168.1.16 → 10.6.15.144  TCP 66 59298 → 22 [ACK] Seq=23317 Ack=339353 Win=6155 Len=0 TSval=5930258 TSecr=6526417
  636 22.156263195  10.6.15.144 → 192.168.1.16 SSH 1514 Server: Encrypted packet (len=1448)
  637 22.156273563 192.168.1.16 → 10.6.15.144  TCP 66 59298 → 22 [ACK] Seq=23317 Ack=340801 Win=6155 Len=0 TSval=5930258 TSecr=6526479
  638 23.129036583 192.168.1.16 → 239.255.255.250 SSDP 213 M-SEARCH * HTTP/1.1 
  639 23.283082217 192.168.1.16 → 10.6.15.144  SSH 206 Client: Encrypted packet (len=140)
  640 23.511946880 192.168.1.16 → 10.6.15.144  TCP 206 [TCP Retransmission] 59298 → 22 [PSH, ACK] Seq=23317 Ack=340801 Win=6155 Len=140 TSval=5930597 TSecr=6526479
  641 23.533829795  10.6.15.144 → 192.168.1.16 SSH 1514 Server: Encrypted packet (len=1448)
  642 23.533859127 192.168.1.16 → 10.6.15.144  TCP 66 59298 → 22 [ACK] Seq=23457 Ack=342249 Win=6155 Len=0 TSval=5930602 TSecr=6526978
  643 23.533949957  10.6.15.144 → 192.168.1.16 SSH 1514 Server: Encrypted packet (len=1448)
  644 23.533954510 192.168.1.16 → 10.6.15.144  TCP 66 59298 → 22 [ACK] Seq=23457 Ack=343697 Win=6155 Len=0 TSval=5930602 TSecr=6526978
  645 23.534159987  10.6.15.144 → 192.168.1.16 SSH 1514 Server: Encrypted packet (len=1448)
  646 23.534180428 192.168.1.16 → 10.6.15.144  TCP 66 59298 → 22 [ACK] Seq=23457 Ack=345145 Win=6155 Len=0 TSval=5930602 TSecr=6526978
  647 23.572481777  10.6.15.144 → 192.168.1.16 SSH 1514 Server: Encrypted packet (len=1448)
  648 23.572498817 192.168.1.16 → 10.6.15.144  TCP 66 59298 → 22 [ACK] Seq=23457 Ack=346593 Win=6155 Len=0 TSval=5930612 TSecr=6526978
  649 23.572624988  10.6.15.144 → 192.168.1.16 SSH 1514 Server: Encrypted packet (len=1448)
  650 23.572629393 192.168.1.16 → 10.6.15.144  TCP 66 59298 → 22 [ACK] Seq=23457 Ack=348041 Win=6155 Len=0 TSval=5930612 TSecr=6526978
  651 23.572717155 192.168.1.16 → 10.6.15.144  SSH 102 Client: Encrypted packet (len=36)
  652 23.572869469  10.6.15.144 → 192.168.1.16 SSH 1514 Server: Encrypted packet (len=1448)
  653 23.573085206  10.6.15.144 → 192.168.1.16 SSH 1514 Server: Encrypted packet (len=1448)
  654 23.573091943 192.168.1.16 → 10.6.15.144  TCP 66 59298 → 22 [ACK] Seq=23493 Ack=350937 Win=6155 Len=0 TSval=5930612 TSecr=6526978
  655 23.573101423  10.6.15.144 → 192.168.1.16 TCP 78 [TCP Dup ACK 641#1] 22 → 59298 [ACK] Seq=350937 Ack=23457 Win=1452 Len=0 TSval=6526978 TSecr=5930597 SLE=23317 SRE=23457
  656 23.573317155  10.6.15.144 → 192.168.1.16 SSH 1514 Server: Encrypted packet (len=1448)
  657 23.573531826  10.6.15.144 → 192.168.1.16 SSH 1514 Server: Encrypted packet (len=1448)
  658 23.573538417 192.168.1.16 → 10.6.15.144  TCP 66 59298 → 22 [ACK] Seq=23493 Ack=353833 Win=6155 Len=0 TSval=5930612 TSecr=6526982
  659 23.573744488  10.6.15.144 → 192.168.1.16 SSH 1514 Server: Encrypted packet (len=1448)
  660 23.573980984  10.6.15.144 → 192.168.1.16 SSH 1514 Server: Encrypted packet (len=1448)
  661 23.573994212 192.168.1.16 → 10.6.15.144  TCP 66 59298 → 22 [ACK] Seq=23493 Ack=356729 Win=6155 Len=0 TSval=5930612 TSecr=6526982
  662 23.585086829  10.6.15.144 → 192.168.1.16 SSH 1514 Server: Encrypted packet (len=1448)
  663 23.585260893  10.6.15.144 → 192.168.1.16 SSH 1514 Server: [TCP Previous segment not captured] , Encrypted packet (len=1448)
  664 23.585275728 192.168.1.16 → 10.6.15.144  TCP 78 59298 → 22 [ACK] Seq=23493 Ack=358177 Win=6155 Len=0 TSval=5930615 TSecr=6526991 SLE=359625 SRE=361073
  665 23.585658029  10.6.15.144 → 192.168.1.16 SSH 1514 Server: Encrypted packet (len=1448)
  666 23.585678845 192.168.1.16 → 10.6.15.144  TCP 78 [TCP Dup ACK 664#1] 59298 → 22 [ACK] Seq=23493 Ack=358177 Win=6155 Len=0 TSval=5930615 TSecr=6526991 SLE=359625 SRE=362521
  667 23.585871657  10.6.15.144 → 192.168.1.16 SSH 1514 Server: Encrypted packet (len=1448)
  668 23.585891453 192.168.1.16 → 10.6.15.144  TCP 78 [TCP Dup ACK 664#2] 59298 → 22 [ACK] Seq=23493 Ack=358177 Win=6155 Len=0 TSval=5930615 TSecr=6526991 SLE=359625 SRE=363969
  669 23.586086708  10.6.15.144 → 192.168.1.16 SSH 1514 Server: Encrypted packet (len=1448)
  670 23.586107181 192.168.1.16 → 10.6.15.144  TCP 78 [TCP Dup ACK 664#3] 59298 → 22 [ACK] Seq=23493 Ack=358177 Win=6155 Len=0 TSval=5930615 TSecr=6526991 SLE=359625 SRE=365417
  671 23.586298561  10.6.15.144 → 192.168.1.16 SSH 1514 Server: Encrypted packet (len=1448)
  672 23.586319313 192.168.1.16 → 10.6.15.144  TCP 78 [TCP Dup ACK 664#4] 59298 → 22 [ACK] Seq=23493 Ack=358177 Win=6155 Len=0 TSval=5930615 TSecr=6526991 SLE=359625 SRE=366865
  673 23.631195278  10.6.15.144 → 192.168.1.16 SSH 1514 Server: [TCP Previous segment not captured] , Encrypted packet (len=1448)
  674 23.631214311 192.168.1.16 → 10.6.15.144  TCP 86 [TCP Dup ACK 664#5] 59298 → 22 [ACK] Seq=23493 Ack=358177 Win=6155 Len=0 TSval=5930626 TSecr=6526991 SLE=369761 SRE=371209 SLE=359625 SRE=366865
  675 23.679929784  10.6.15.144 → 192.168.1.16 SSH 1514 Server: Encrypted packet (len=1448)
  676 23.679952133 192.168.1.16 → 10.6.15.144  TCP 86 [TCP Dup ACK 664#6] 59298 → 22 [ACK] Seq=23493 Ack=358177 Win=6155 Len=0 TSval=5930639 TSecr=6526991 SLE=369761 SRE=372657 SLE=359625 SRE=366865
  677 23.785626754  10.6.15.144 → 192.168.1.16 TCP 1514 [TCP Retransmission] 22 → 59298 [ACK] Seq=358177 Ack=23493 Win=1452 Len=1448 TSval=6527041 TSecr=5930626
  678 23.785798055  10.6.15.144 → 192.168.1.16 SSH 1514 Server: Encrypted packet (len=1448)
  679 23.786068166  10.6.15.144 → 192.168.1.16 SSH 1514 Server: Encrypted packet (len=1448)
  680 23.794742480  10.6.15.144 → 192.168.1.16 SSH 1514 Server: Encrypted packet (len=1448)
  681 23.794940945  10.6.15.144 → 192.168.1.16 TCP 1514 [TCP Out-Of-Order] 22 → 59298 [ACK] Seq=366865 Ack=23493 Win=1452 Len=1448 TSval=6527041 TSecr=5930639
  682 23.795194416  10.6.15.144 → 192.168.1.16 SSH 1514 Server: Encrypted packet (len=1448)
  683 23.803981062 192.168.1.16 → 10.6.15.144  TCP 78 59298 → 22 [ACK] Seq=23493 Ack=366865 Win=6155 Len=0 TSval=5930665 TSecr=6527041 SLE=369761 SRE=372657
  684 23.803997672 192.168.1.16 → 10.6.15.144  TCP 78 [TCP Dup ACK 683#1] 59298 → 22 [ACK] Seq=23493 Ack=366865 Win=6155 Len=0 TSval=5930665 TSecr=6527041 SLE=369761 SRE=374105
  685 23.803999510 192.168.1.16 → 10.6.15.144  TCP 78 [TCP Dup ACK 683#2] 59298 → 22 [ACK] Seq=23493 Ack=366865 Win=6155 Len=0 TSval=5930665 TSecr=6527041 SLE=369761 SRE=375553
  686 23.804001178 192.168.1.16 → 10.6.15.144  TCP 78 [TCP Dup ACK 683#3] 59298 → 22 [ACK] Seq=23493 Ack=366865 Win=6155 Len=0 TSval=5930667 TSecr=6527041 SLE=369761 SRE=377001
  687 23.804002740 192.168.1.16 → 10.6.15.144  TCP 78 59298 → 22 [ACK] Seq=23493 Ack=368313 Win=6155 Len=0 TSval=5930667 TSecr=6527041 SLE=369761 SRE=377001
  688 23.804004598 192.168.1.16 → 10.6.15.144  TCP 78 [TCP Dup ACK 687#1] 59298 → 22 [ACK] Seq=23493 Ack=368313 Win=6155 Len=0 TSval=5930667 TSecr=6527041 SLE=369761 SRE=378449
  689 23.816886705  10.6.15.144 → 192.168.1.16 SSH 1514 Server: Encrypted packet (len=1448)
  690 23.816907522 192.168.1.16 → 10.6.15.144  TCP 78 [TCP Dup ACK 687#2] 59298 → 22 [ACK] Seq=23493 Ack=368313 Win=6155 Len=0 TSval=5930673 TSecr=6527041 SLE=369761 SRE=379897
  691 23.817124176  10.6.15.144 → 192.168.1.16 SSH 1514 Server: [TCP Fast Retransmission] , Encrypted packet (len=1448)
  692 23.817152934 192.168.1.16 → 10.6.15.144  TCP 66 59298 → 22 [ACK] Seq=23493 Ack=379897 Win=6155 Len=0 TSval=5930673 TSecr=6527049
  693 23.834774527  10.6.15.144 → 192.168.1.16 SSH 1514 Server: Encrypted packet (len=1448)
  694 23.834791839 192.168.1.16 → 10.6.15.144  TCP 66 59298 → 22 [ACK] Seq=23493 Ack=381345 Win=6155 Len=0 TSval=5930677 TSecr=6527049
  695 23.835095671  10.6.15.144 → 192.168.1.16 SSH 1514 Server: Encrypted packet (len=1448)
  696 23.835098530 192.168.1.16 → 10.6.15.144  TCP 66 59298 → 22 [ACK] Seq=23493 Ack=382793 Win=6155 Len=0 TSval=5930677 TSecr=6527049
  697 23.835411383  10.6.15.144 → 192.168.1.16 SSH 1514 Server: Encrypted packet (len=1448)
  698 23.835412836 192.168.1.16 → 10.6.15.144  TCP 66 59298 → 22 [ACK] Seq=23493 Ack=384241 Win=6155 Len=0 TSval=5930677 TSecr=6527049
  699 23.835734331  10.6.15.144 → 192.168.1.16 SSH 1514 Server: Encrypted packet (len=1448)
  700 23.835739962 192.168.1.16 → 10.6.15.144  TCP 66 59298 → 22 [ACK] Seq=23493 Ack=385689 Win=6155 Len=0 TSval=5930677 TSecr=6527049
  701 23.836052995  10.6.15.144 → 192.168.1.16 SSH 1514 Server: Encrypted packet (len=1448)
  702 23.836058481 192.168.1.16 → 10.6.15.144  TCP 66 59298 → 22 [ACK] Seq=23493 Ack=387137 Win=6155 Len=0 TSval=5930678 TSecr=6527050
  703 23.901449708  10.6.15.144 → 192.168.1.16 SSH 1514 Server: Encrypted packet (len=1448)
  704 23.901469225 192.168.1.16 → 10.6.15.144  TCP 66 59298 → 22 [ACK] Seq=23493 Ack=388585 Win=6155 Len=0 TSval=5930694 TSecr=6527071
  705 23.901785731  10.6.15.144 → 192.168.1.16 SSH 1514 Server: Encrypted packet (len=1448)
  706 23.901804085 192.168.1.16 → 10.6.15.144  TCP 66 59298 → 22 [ACK] Seq=23493 Ack=390033 Win=6155 Len=0 TSval=5930694 TSecr=6527071
  707 23.902056637  10.6.15.144 → 192.168.1.16 SSH 1514 Server: Encrypted packet (len=1448)
  708 23.902072092 192.168.1.16 → 10.6.15.144  TCP 66 59298 → 22 [ACK] Seq=23493 Ack=391481 Win=6155 Len=0 TSval=5930694 TSecr=6527071
  709 23.902559572  10.6.15.144 → 192.168.1.16 SSH 1514 Server: Encrypted packet (len=1448)
  710 23.902577433 192.168.1.16 → 10.6.15.144  TCP 66 59298 → 22 [ACK] Seq=23493 Ack=392929 Win=6155 Len=0 TSval=5930694 TSecr=6527071
  711 23.902826388  10.6.15.144 → 192.168.1.16 SSH 1514 Server: Encrypted packet (len=1448)
  712 23.902833916 192.168.1.16 → 10.6.15.144  TCP 66 59298 → 22 [ACK] Seq=23493 Ack=394377 Win=6155 Len=0 TSval=5930694 TSecr=6527071
  713 23.903198876  10.6.15.144 → 192.168.1.16 SSH 1514 Server: Encrypted packet (len=1448)
  714 23.903217331 192.168.1.16 → 10.6.15.144  TCP 66 59298 → 22 [ACK] Seq=23493 Ack=395825 Win=6155 Len=0 TSval=5930694 TSecr=6527071
  715 23.903526617  10.6.15.144 → 192.168.1.16 SSH 1514 Server: Encrypted packet (len=1448)
  716 23.903543926 192.168.1.16 → 10.6.15.144  TCP 66 59298 → 22 [ACK] Seq=23493 Ack=397273 Win=6155 Len=0 TSval=5930694 TSecr=6527071
  717 23.903812574  10.6.15.144 → 192.168.1.16 SSH 1514 Server: Encrypted packet (len=1448)
  718 23.903830055 192.168.1.16 → 10.6.15.144  TCP 66 59298 → 22 [ACK] Seq=23493 Ack=398721 Win=6155 Len=0 TSval=5930694 TSecr=6527071
  719 23.919097999  10.6.15.144 → 192.168.1.16 SSH 1514 Server: Encrypted packet (len=1448)
  720 23.919116381 192.168.1.16 → 10.6.15.144  TCP 66 59298 → 22 [ACK] Seq=23493 Ack=400169 Win=6155 Len=0 TSval=5930698 TSecr=6527073
  721 23.919137909  10.6.15.144 → 192.168.1.16 SSH 202 Server: Encrypted packet (len=136)
  722 23.919194501 192.168.1.16 → 10.6.15.144  TCP 66 59298 → 22 [ACK] Seq=23493 Ack=400305 Win=6155 Len=0 TSval=5930698 TSecr=6527073
  723 24.634028182 192.168.1.16 → 139.59.50.38 NTP 90 NTP Version 4, client
  724 25.162942348  10.6.15.144 → 192.168.1.16 SSH 202 Server: [TCP Spurious Retransmission] , Encrypted packet (len=136)
  725 25.162961178 192.168.1.16 → 10.6.15.144  TCP 78 [TCP Dup ACK 722#1] 59298 → 22 [ACK] Seq=23493 Ack=400305 Win=6155 Len=0 TSval=5931009 TSecr=6527109 SLE=400169 SRE=400305
  726 28.934901084 10.22.17.201 → 224.0.0.252  LLMNR 64 Standard query 0x2425 A wpad
  727 28.934939441 10.22.17.201 → 224.0.0.252  LLMNR 64 Standard query 0x725a AAAA wpad
  728 28.934945559 10.22.17.201 → 224.0.0.252  LLMNR 64 Standard query 0x2425 A wpad
  729 28.934950700 10.22.17.201 → 224.0.0.252  LLMNR 64 Standard query 0x725a AAAA wpad
