    1 0.000000000  10.6.15.144 → 192.168.1.16 SSH 150 Server: Encrypted packet (len=72)
    2 0.000021212 192.168.1.16 → 10.6.15.144  TCP 78 59298 → 22 [ACK] Seq=205 Ack=73 Win=6155 Len=0 TSval=5933727 TSecr=6529994 SLE=1 SRE=73
    3 0.161813844 192.168.1.16 → 10.6.15.144  TCP 110 [TCP Retransmission] 59298 → 22 [PSH, ACK] Seq=1 Ack=73 Win=6155 Len=44 TSval=5933768 TSecr=6529994
    4 0.173625316  10.6.15.144 → 192.168.1.16 TCP 66 22 → 59298 [ACK] Seq=73 Ack=169 Win=1452 Len=0 TSval=6530147 TSecr=5933768
    5 0.181895911 192.168.1.16 → 10.6.15.144  TCP 102 [TCP Retransmission] 59298 → 22 [PSH, ACK] Seq=169 Ack=73 Win=6155 Len=36 TSval=5933770 TSecr=6530147
    6 0.195181622  10.6.15.144 → 192.168.1.16 TCP 66 22 → 59298 [ACK] Seq=73 Ack=205 Win=1452 Len=0 TSval=6530152 TSecr=5933770
    7 0.208161105  10.6.15.144 → 192.168.1.16 SSH 110 Server: Encrypted packet (len=44)
    8 0.208177724 192.168.1.16 → 10.6.15.144  TCP 66 59298 → 22 [ACK] Seq=205 Ack=117 Win=6155 Len=0 TSval=5933779 TSecr=6530156
    9 0.208519848 192.168.1.16 → 10.6.15.144  SSH 150 Client: Encrypted packet (len=84)
   10 0.481787511 192.168.1.16 → 10.6.15.144  TCP 150 [TCP Retransmission] 59298 → 22 [PSH, ACK] Seq=205 Ack=117 Win=6155 Len=84 TSval=5933848 TSecr=6530156
   11 0.607493215  10.6.15.144 → 192.168.1.16 SSH 414 Server: Encrypted packet (len=348)
   12 0.613110333 192.168.1.16 → 10.6.15.144  SSH 918 Client: Encrypted packet (len=852)
   13 0.769833068 192.168.1.16 → 10.6.15.144  TCP 1002 [TCP Retransmission] 59298 → 22 [PSH, ACK] Seq=205 Ack=465 Win=6155 Len=936 TSval=5933920 TSecr=6530241
   14 1.345811806 192.168.1.16 → 10.6.15.144  TCP 1002 [TCP Retransmission] 59298 → 22 [PSH, ACK] Seq=205 Ack=465 Win=6155 Len=936 TSval=5934064 TSecr=6530241
   15 1.353097790  10.6.15.144 → 192.168.1.16 SSH 622 Server: Encrypted packet (len=556)
   16 1.353119295  10.6.15.144 → 192.168.1.16 SSH 254 Server: Encrypted packet (len=188)
   17 1.353169319 192.168.1.16 → 10.6.15.144  TCP 66 59298 → 22 [ACK] Seq=1141 Ack=1209 Win=6155 Len=0 TSval=5934065 TSecr=6530337
   18 1.353814480 192.168.1.16 → 10.6.15.144  SSH 134 Client: Encrypted packet (len=68)
   19 1.356674689 192.168.1.16 → 10.6.15.144  SSH 102 Client: Encrypted packet (len=36)
   20 1.357814154  10.6.15.144 → 192.168.1.16 SSH 254 Server: [TCP Spurious Retransmission] , Encrypted packet (len=188)
   21 1.357834079 192.168.1.16 → 10.6.15.144  TCP 78 [TCP Dup ACK 17#1] 59298 → 22 [ACK] Seq=1245 Ack=1209 Win=6155 Len=0 TSval=5934067 TSecr=6530443 SLE=1021 SRE=1209
   22 1.362425498  10.6.15.144 → 192.168.1.16 TCP 78 [TCP Dup ACK 15#1] 22 → 59298 [ACK] Seq=1209 Ack=1141 Win=1452 Len=0 TSval=6530444 TSecr=5934064 SLE=205 SRE=1141
   23 1.389084790  10.6.15.144 → 192.168.1.16 TCP 66 22 → 59298 [ACK] Seq=1209 Ack=1209 Win=1452 Len=0 TSval=6530451 TSecr=5934066
   24 1.389106365 192.168.1.16 → 10.6.15.144  SSH 546 Client: Encrypted packet (len=480)
   25 1.389124633  10.6.15.144 → 192.168.1.16 TCP 66 22 → 59298 [ACK] Seq=1209 Ack=1245 Win=1452 Len=0 TSval=6530451 TSecr=5934066
   26 1.401493990  10.6.15.144 → 192.168.1.16 TCP 66 22 → 59298 [ACK] Seq=1209 Ack=1725 Win=1452 Len=0 TSval=6530454 TSecr=5934074
   27 1.403421704  10.6.15.144 → 192.168.1.16 SSH 298 Server: Encrypted packet (len=232)
   28 1.445815244 192.168.1.16 → 10.6.15.144  TCP 66 59298 → 22 [ACK] Seq=1725 Ack=1441 Win=6155 Len=0 TSval=5934089 TSecr=6530454
   29 1.460382450  10.6.15.144 → 192.168.1.16 SSH 102 Server: Encrypted packet (len=36)
   30 1.460408653 192.168.1.16 → 10.6.15.144  TCP 66 59298 → 22 [ACK] Seq=1725 Ack=1477 Win=6155 Len=0 TSval=5934092 TSecr=6530469
   31 1.460745137 192.168.1.16 → 10.6.15.144  SSH 158 Client: Encrypted packet (len=92)
   32 1.472184940  10.6.15.144 → 192.168.1.16 SSH 102 Server: Encrypted packet (len=36)
   33 1.472599691 192.168.1.16 → 10.6.15.144  SSH 158 Client: Encrypted packet (len=92)
   34 1.519610349  10.6.15.144 → 192.168.1.16 TCP 66 22 → 59298 [ACK] Seq=1513 Ack=1909 Win=1452 Len=0 TSval=6530484 TSecr=5934095
   35 1.593173351  10.6.15.144 → 192.168.1.16 SSH 214 Server: Encrypted packet (len=148)
   36 1.593464220 192.168.1.16 → 10.6.15.144  SSH 134 Client: Encrypted packet (len=68)
   37 1.599795064 192.168.1.16 → 139.59.21.22 NTP 90 NTP Version 4, client
   38 1.604348889  10.6.15.144 → 192.168.1.16 TCP 66 22 → 59298 [ACK] Seq=1661 Ack=1977 Win=1452 Len=0 TSval=6530505 TSecr=5934125
   39 1.608739134  10.6.15.144 → 192.168.1.16 SSH 182 Server: Encrypted packet (len=116)
   40 1.608992958 192.168.1.16 → 10.6.15.144  SSH 134 Client: Encrypted packet (len=68)
   41 1.638962483 10.119.73.122 → 192.168.1.16 ICMP 110 Destination unreachable (Communication administratively filtered)
   42 1.657894543  10.6.15.144 → 192.168.1.16 TCP 66 22 → 59298 [ACK] Seq=1777 Ack=2045 Win=1452 Len=0 TSval=6530519 TSecr=5934129
   43 1.700850007  10.6.15.144 → 192.168.1.16 SSH 150 Server: Encrypted packet (len=84)
   44 1.700978247  10.6.15.144 → 192.168.1.16 SSH 286 Server: Encrypted packet (len=220)
   45 1.700998479 192.168.1.16 → 10.6.15.144  TCP 66 59298 → 22 [ACK] Seq=2045 Ack=2081 Win=6155 Len=0 TSval=5934152 TSecr=6530530
   46 1.702549591 192.168.1.16 → 10.6.15.144  SSH 134 Client: Encrypted packet (len=68)
   47 1.710851801  10.6.15.144 → 192.168.1.16 TCP 66 22 → 59298 [ACK] Seq=2081 Ack=2113 Win=1452 Len=0 TSval=6530532 TSecr=5934153
   48 2.167249294 192.168.1.16 → 10.6.15.144  SSH 574 Client: Encrypted packet (len=508)
   49 2.175373045  10.6.15.144 → 192.168.1.16 TCP 66 22 → 59298 [ACK] Seq=2081 Ack=2621 Win=1452 Len=0 TSval=6530649 TSecr=5934269
   50 2.391493106 192.168.1.16 → 10.6.15.144  SSH 342 Client: Encrypted packet (len=276)
   51 2.394119072 192.168.1.16 → 10.6.15.144  SSH 134 Client: Encrypted packet (len=68)
   52 2.394860211  10.6.15.144 → 192.168.1.16 SSH 390 Server: Encrypted packet (len=324)
   53 2.404009624  10.6.15.144 → 192.168.1.16 TCP 66 22 → 59298 [ACK] Seq=2405 Ack=2897 Win=1452 Len=0 TSval=6530705 TSecr=5934325
   54 2.404315294 192.168.1.16 → 10.6.15.144  SSH 278 Client: Encrypted packet (len=212)
   55 2.412581876  10.6.15.144 → 192.168.1.16 TCP 66 22 → 59298 [ACK] Seq=2405 Ack=2965 Win=1452 Len=0 TSval=6530705 TSecr=5934326
   56 2.414661756  10.6.15.144 → 192.168.1.16 TCP 66 22 → 59298 [ACK] Seq=2405 Ack=3177 Win=1452 Len=0 TSval=6530707 TSecr=5934328
   57 2.432456466 192.168.1.16 → 10.6.15.144  SSH 102 Client: Encrypted packet (len=36)
   58 2.432964354 192.168.1.16 → 10.6.15.144  SSH 294 Client: Encrypted packet (len=228)
   59 2.438156186 192.168.1.16 → 10.6.15.144  SSH 446 Client: Encrypted packet (len=380)
   60 2.442081752  10.6.15.144 → 192.168.1.16 TCP 66 22 → 59298 [ACK] Seq=2405 Ack=3213 Win=1452 Len=0 TSval=6530714 TSecr=5934335
   61 2.442814497  10.6.15.144 → 192.168.1.16 SSH 102 Server: Encrypted packet (len=36)
   62 2.449290595  10.6.15.144 → 192.168.1.16 TCP 66 22 → 59298 [ACK] Seq=2441 Ack=3821 Win=1452 Len=0 TSval=6530717 TSecr=5934335
   63 2.461827147  10.6.15.144 → 192.168.1.16 SSH 142 Server: Encrypted packet (len=76)
   64 2.461910480 192.168.1.16 → 10.6.15.144  TCP 66 59298 → 22 [ACK] Seq=3821 Ack=2517 Win=6155 Len=0 TSval=5934343 TSecr=6530714
   65 2.528399316 192.168.1.16 → 10.6.15.144  SSH 326 Client: Encrypted packet (len=260)
   66 2.549191523  10.6.15.144 → 192.168.1.16 SSH 278 Server: Encrypted packet (len=212)
   67 2.550011474 192.168.1.16 → 224.0.0.252  LLMNR 61 Standard query 0x78a5 A x
   68 2.557006470  10.6.15.144 → 192.168.1.16 SSH 398 Server: Encrypted packet (len=332)
   69 2.557080084 192.168.1.16 → 10.6.15.144  TCP 66 59298 → 22 [ACK] Seq=4081 Ack=3061 Win=6155 Len=0 TSval=5934366 TSecr=6530741
   70 2.562810339 192.168.1.16 → 10.6.15.144  SSH 398 Client: Encrypted packet (len=332)
   71 2.564231460 192.168.1.16 → 10.6.15.144  SSH 334 Client: Encrypted packet (len=268)
   72 2.577197998 192.168.1.16 → 10.6.15.144  SSH 214 Client: Encrypted packet (len=148)
   73 2.586974230  10.6.15.144 → 192.168.1.16 TCP 66 22 → 59298 [ACK] Seq=3061 Ack=4829 Win=1452 Len=0 TSval=6530751 TSecr=5934368
   74 2.586993194 192.168.1.16 → 10.6.15.144  SSH 1422 Client: Encrypted packet (len=1356)
   75 2.593257355 192.168.1.16 → 10.6.15.144  SSH 1102 Client: Encrypted packet (len=1036)
   76 2.603818795  10.6.15.144 → 192.168.1.16 TCP 66 22 → 59298 [ACK] Seq=3061 Ack=7221 Win=1452 Len=0 TSval=6530755 TSecr=5934374
   77 2.638079220  10.6.15.144 → 192.168.1.16 SSH 294 Server: Encrypted packet (len=228)
   78 2.681786904 192.168.1.16 → 10.6.15.144  TCP 66 59298 → 22 [ACK] Seq=7221 Ack=3289 Win=6155 Len=0 TSval=5934398 TSecr=6530763
   79 2.692289930  10.6.15.144 → 192.168.1.16 SSH 150 Server: Encrypted packet (len=84)
   80 2.692313010 192.168.1.16 → 10.6.15.144  TCP 66 59298 → 22 [ACK] Seq=7221 Ack=3373 Win=6155 Len=0 TSval=5934400 TSecr=6530777
   81 2.702442315  10.6.15.144 → 192.168.1.16 SSH 142 Server: Encrypted packet (len=76)
   82 2.702460548 192.168.1.16 → 10.6.15.144  TCP 66 59298 → 22 [ACK] Seq=7221 Ack=3449 Win=6155 Len=0 TSval=5934403 TSecr=6530779
   83 2.710958267  10.6.15.144 → 192.168.1.16 SSH 846 Server: Encrypted packet (len=780)
   84 2.710974354 192.168.1.16 → 10.6.15.144  TCP 66 59298 → 22 [ACK] Seq=7221 Ack=4229 Win=6155 Len=0 TSval=5934405 TSecr=6530781
   85 2.715607710  10.6.15.144 → 192.168.1.16 SSH 1514 Server: Encrypted packet (len=1448)
   86 2.715808701  10.6.15.144 → 192.168.1.16 SSH 1514 Server: Encrypted packet (len=1448)
   87 2.715817312 192.168.1.16 → 10.6.15.144  TCP 66 59298 → 22 [ACK] Seq=7221 Ack=7125 Win=6155 Len=0 TSval=5934406 TSecr=6530783
   88 2.716169206  10.6.15.144 → 192.168.1.16 SSH 1502 Server: Encrypted packet (len=1436)
   89 2.716189740 192.168.1.16 → 10.6.15.144  TCP 66 59298 → 22 [ACK] Seq=7221 Ack=8561 Win=6155 Len=0 TSval=5934406 TSecr=6530783
   90 2.722769412 192.168.1.16 → 10.6.15.144  SSH 1078 Client: Encrypted packet (len=1012)
   91 2.726808115 192.168.1.16 → 10.6.15.144  SSH 1118 Client: Encrypted packet (len=1052)
   92 2.728186491 192.168.1.16 → 10.6.15.144  SSH 1086 Client: Encrypted packet (len=1020)
   93 2.735774882  10.6.15.144 → 192.168.1.16 TCP 66 22 → 59298 [ACK] Seq=8561 Ack=9285 Win=1452 Len=0 TSval=6530788 TSecr=5934408
   94 2.763112741  10.6.15.144 → 192.168.1.16 SSH 150 Server: Encrypted packet (len=84)
   95 2.778064010  10.6.15.144 → 192.168.1.16 SSH 142 Server: Encrypted packet (len=76)
   96 2.778124755 192.168.1.16 → 10.6.15.144  TCP 66 59298 → 22 [ACK] Seq=10305 Ack=8721 Win=6155 Len=0 TSval=5934422 TSecr=6530795
   97 2.779652797  10.6.15.144 → 192.168.1.16 SSH 938 Server: Encrypted packet (len=872)
   98 2.796592776  10.6.15.144 → 192.168.1.16 SSH 1514 Server: Encrypted packet (len=1448)
   99 2.796608887 192.168.1.16 → 10.6.15.144  TCP 66 59298 → 22 [ACK] Seq=10305 Ack=11041 Win=6155 Len=0 TSval=5934426 TSecr=6530798
  100 2.796682925  10.6.15.144 → 192.168.1.16 SSH 854 Server: Encrypted packet (len=788)
  101 2.837789089 192.168.1.16 → 10.6.15.144  TCP 66 59298 → 22 [ACK] Seq=10305 Ack=11829 Win=6155 Len=0 TSval=5934437 TSecr=6530803
  102 2.848077078 192.168.1.16 → 224.0.0.252  LLMNR 61 Standard query 0x78a5 A x
  103 2.892727555  10.6.15.144 → 192.168.1.16 SSH 686 Server: Encrypted packet (len=620)
  104 2.892789327 192.168.1.16 → 10.6.15.144  TCP 66 59298 → 22 [ACK] Seq=10305 Ack=12449 Win=6155 Len=0 TSval=5934450 TSecr=6530827
  105 2.906508587  10.6.15.144 → 192.168.1.16 SSH 1514 Server: Encrypted packet (len=1448)
  106 2.906679216  10.6.15.144 → 192.168.1.16 SSH 1318 Server: Encrypted packet (len=1252)
  107 2.906687971 192.168.1.16 → 10.6.15.144  TCP 66 59298 → 22 [ACK] Seq=10305 Ack=15149 Win=6155 Len=0 TSval=5934454 TSecr=6530830
  108 2.948743539  10.6.15.144 → 192.168.1.16 SSH 1514 Server: Encrypted packet (len=1448)
  109 2.948829229  10.6.15.144 → 192.168.1.16 SSH 902 Server: Encrypted packet (len=836)
  110 2.948838505 192.168.1.16 → 10.6.15.144  TCP 66 59298 → 22 [ACK] Seq=10305 Ack=17433 Win=6155 Len=0 TSval=5934464 TSecr=6530841
  111 3.013081826  10.6.15.144 → 192.168.1.16 SSH 398 Server: Encrypted packet (len=332)
  112 3.013154187 192.168.1.16 → 10.6.15.144  TCP 66 59298 → 22 [ACK] Seq=10305 Ack=17765 Win=6155 Len=0 TSval=5934480 TSecr=6530857
  113 3.029926667  10.6.15.144 → 192.168.1.16 SSH 1358 Server: Encrypted packet (len=1292)
  114 3.029993302 192.168.1.16 → 10.6.15.144  TCP 66 59298 → 22 [ACK] Seq=10305 Ack=19057 Win=6155 Len=0 TSval=5934485 TSecr=6530861
  115 3.038922124  10.6.15.144 → 192.168.1.16 SSH 758 Server: Encrypted packet (len=692)
  116 3.038999027 192.168.1.16 → 10.6.15.144  TCP 66 59298 → 22 [ACK] Seq=10305 Ack=19749 Win=6155 Len=0 TSval=5934487 TSecr=6530863
  117 3.076086566  10.6.15.144 → 192.168.1.16 SSH 1166 Server: Encrypted packet (len=1100)
  118 3.076163744 192.168.1.16 → 10.6.15.144  TCP 66 59298 → 22 [ACK] Seq=10305 Ack=20849 Win=6155 Len=0 TSval=5934496 TSecr=6530873
  119 3.082132217  10.6.15.144 → 192.168.1.16 SSH 150 Server: Encrypted packet (len=84)
  120 3.082218773 192.168.1.16 → 10.6.15.144  TCP 66 59298 → 22 [ACK] Seq=10305 Ack=20933 Win=6155 Len=0 TSval=5934498 TSecr=6530875
  121 3.098094442 192.168.1.16 → 224.0.0.252  LLMNR 61 Standard query 0x78a5 A x
  122 3.098641924  10.6.15.144 → 192.168.1.16 SSH 1486 Server: Encrypted packet (len=1420)
  123 3.098715793 192.168.1.16 → 10.6.15.144  TCP 66 59298 → 22 [ACK] Seq=10305 Ack=22353 Win=6155 Len=0 TSval=5934502 TSecr=6530878
  124 3.101984838  10.6.15.144 → 192.168.1.16 SSH 734 Server: Encrypted packet (len=668)
  125 3.102049694 192.168.1.16 → 10.6.15.144  TCP 66 59298 → 22 [ACK] Seq=10305 Ack=23021 Win=6155 Len=0 TSval=5934503 TSecr=6530879
  126 3.131179682  10.6.15.144 → 192.168.1.16 SSH 1514 Server: Encrypted packet (len=1448)
  127 3.131410308  10.6.15.144 → 192.168.1.16 SSH 1514 Server: Encrypted packet (len=1448)
  128 3.131424852 192.168.1.16 → 10.6.15.144  TCP 66 59298 → 22 [ACK] Seq=10305 Ack=25917 Win=6155 Len=0 TSval=5934510 TSecr=6530886
  129 3.131768964  10.6.15.144 → 192.168.1.16 SSH 1334 Server: Encrypted packet (len=1268)
  130 3.131822216 192.168.1.16 → 10.6.15.144  TCP 66 59298 → 22 [ACK] Seq=10305 Ack=27185 Win=6155 Len=0 TSval=5934510 TSecr=6530886
  131 3.195163132  10.6.15.144 → 192.168.1.16 SSH 134 Server: Encrypted packet (len=68)
  132 3.195231695 192.168.1.16 → 10.6.15.144  TCP 66 59298 → 22 [ACK] Seq=10305 Ack=27253 Win=6155 Len=0 TSval=5934526 TSecr=6530902
  133 3.338784403 192.168.1.16 → 10.6.15.144  SSH 998 Client: Encrypted packet (len=932)
  134 3.340546640 192.168.1.16 → 10.6.15.144  SSH 1514 Client: Encrypted packet (len=1448)
  135 3.361177150 192.168.1.16 → 10.6.15.144  SSH 1350 Client: Encrypted packet (len=1284)
  136 3.417789471 192.168.1.16 → 10.6.15.144  TCP 1350 [TCP Retransmission] 59298 → 22 [PSH, ACK] Seq=12685 Ack=27253 Win=6155 Len=1284 TSval=5934582 TSecr=6530902
  137 3.438478491  10.6.15.144 → 192.168.1.16 TCP 78 [TCP Dup ACK 94#1] 22 → 59298 [ACK] Seq=27253 Ack=10305 Win=1452 Len=0 TSval=6530964 TSecr=5934526 SLE=12685 SRE=13969
  138 3.438499540  10.6.15.144 → 192.168.1.16 TCP 86 [TCP Dup ACK 94#2] 22 → 59298 [ACK] Seq=27253 Ack=10305 Win=1452 Len=0 TSval=6530964 TSecr=5934526 SLE=12685 SRE=13969 SLE=12685 SRE=13969
  139 3.665842477 192.168.1.16 → 10.6.15.144  TCP 998 [TCP Retransmission] 59298 → 22 [PSH, ACK] Seq=10305 Ack=27253 Win=6155 Len=932 TSval=5934644 TSecr=6530964
  140 4.161844678 192.168.1.16 → 10.6.15.144  TCP 998 [TCP Retransmission] 59298 → 22 [PSH, ACK] Seq=10305 Ack=27253 Win=6155 Len=932 TSval=5934768 TSecr=6530964
  141 4.174028087  10.6.15.144 → 192.168.1.16 TCP 78 22 → 59298 [ACK] Seq=27253 Ack=11237 Win=1446 Len=0 TSval=6531147 TSecr=5934768 SLE=12685 SRE=13969
  142 4.174055793 192.168.1.16 → 10.6.15.144  SSH 578 Client: Encrypted packet (len=512)
  143 4.275453769  10.6.15.144 → 192.168.1.16 SSH 234 Server: Encrypted packet (len=156)
  144 4.275473705 192.168.1.16 → 10.6.15.144  TCP 1514 [TCP Retransmission] 59298 → 22 [ACK] Seq=11237 Ack=27253 Win=6155 Len=1448 TSval=5934796 TSecr=6531172
  145 4.275498736 192.168.1.16 → 10.6.15.144  TCP 66 59298 → 22 [ACK] Seq=14481 Ack=27409 Win=6155 Len=0 TSval=5934796 TSecr=6531172
  146 4.326371678  10.6.15.144 → 192.168.1.16 TCP 66 22 → 59298 [ACK] Seq=27409 Ack=13969 Win=1446 Len=0 TSval=6531186 TSecr=5934796
  147 4.326394369 192.168.1.16 → 10.6.15.144  TCP 578 [TCP Retransmission] 59298 → 22 [PSH, ACK] Seq=13969 Ack=27409 Win=6155 Len=512 TSval=5934809 TSecr=6531186
  148 4.335331831  10.6.15.144 → 192.168.1.16 TCP 66 22 → 59298 [ACK] Seq=27409 Ack=14481 Win=1452 Len=0 TSval=6531188 TSecr=5934809
  149 4.337295090  10.6.15.144 → 192.168.1.16 SSH 102 Server: Encrypted packet (len=36)
  150 4.337318802 192.168.1.16 → 10.6.15.144  TCP 66 59298 → 22 [ACK] Seq=14481 Ack=27445 Win=6155 Len=0 TSval=5934811 TSecr=6531189
  151 4.430135033  10.6.15.144 → 192.168.1.16 SSH 198 Server: Encrypted packet (len=132)
  152 4.430152978 192.168.1.16 → 10.6.15.144  TCP 66 59298 → 22 [ACK] Seq=14481 Ack=27577 Win=6155 Len=0 TSval=5934835 TSecr=6531211
  153 4.430224557  10.6.15.144 → 192.168.1.16 SSH 198 Server: Encrypted packet (len=132)
  154 4.430228720 192.168.1.16 → 10.6.15.144  TCP 66 59298 → 22 [ACK] Seq=14481 Ack=27709 Win=6155 Len=0 TSval=5934835 TSecr=6531211
  155 4.430401702  10.6.15.144 → 192.168.1.16 SSH 198 Server: Encrypted packet (len=132)
  156 4.430408342 192.168.1.16 → 10.6.15.144  TCP 66 59298 → 22 [ACK] Seq=14481 Ack=27841 Win=6155 Len=0 TSval=5934835 TSecr=6531211
  157 4.441080036  10.6.15.144 → 192.168.1.16 SSH 294 Server: Encrypted packet (len=228)
  158 4.441100446 192.168.1.16 → 10.6.15.144  TCP 66 59298 → 22 [ACK] Seq=14481 Ack=28069 Win=6155 Len=0 TSval=5934837 TSecr=6531214
  159 4.441126424  10.6.15.144 → 192.168.1.16 SSH 198 Server: Encrypted packet (len=132)
  160 4.441132816 192.168.1.16 → 10.6.15.144  TCP 66 59298 → 22 [ACK] Seq=14481 Ack=28201 Win=6155 Len=0 TSval=5934837 TSecr=6531214
  161 5.221065637 192.168.1.16 → 10.6.15.144  SSH 662 Client: Encrypted packet (len=596)
  162 5.228804094 192.168.1.16 → 10.6.15.144  SSH 782 Client: Encrypted packet (len=716)
  163 5.285837450 192.168.1.16 → 10.6.15.144  TCP 782 [TCP Retransmission] 59298 → 22 [PSH, ACK] Seq=15077 Ack=28201 Win=6155 Len=716 TSval=5935049 TSecr=6531214
  164 5.295653599  10.6.15.144 → 192.168.1.16 TCP 78 [TCP Dup ACK 148#1] 22 → 59298 [ACK] Seq=28201 Ack=14481 Win=1452 Len=0 TSval=6531428 TSecr=5934837 SLE=15077 SRE=15793
  165 5.437827305 192.168.1.16 → 10.6.15.144  SSH 198 Client: Encrypted packet (len=132)
  166 5.448910158  10.6.15.144 → 192.168.1.16 TCP 78 [TCP Dup ACK 148#2] 22 → 59298 [ACK] Seq=28201 Ack=14481 Win=1452 Len=0 TSval=6531466 TSecr=5934837 SLE=15077 SRE=15925
  167 5.525857466 192.168.1.16 → 10.6.15.144  TCP 662 [TCP Retransmission] 59298 → 22 [PSH, ACK] Seq=14481 Ack=28201 Win=6155 Len=596 TSval=5935109 TSecr=6531466
  168 6.017825274 192.168.1.16 → 10.6.15.144  TCP 662 [TCP Retransmission] 59298 → 22 [PSH, ACK] Seq=14481 Ack=28201 Win=6155 Len=596 TSval=5935232 TSecr=6531466
  169 6.049347047  10.6.15.144 → 192.168.1.16 TCP 66 22 → 59298 [ACK] Seq=28201 Ack=15925 Win=1446 Len=0 TSval=6531616 TSecr=5935232
  170 6.151328327  10.6.15.144 → 192.168.1.16 SSH 422 Server: Encrypted packet (len=356)
  171 6.169845087 192.168.1.16 → 10.6.15.144  TCP 66 59298 → 22 [ACK] Seq=15925 Ack=28557 Win=6155 Len=0 TSval=5935265 TSecr=6531641
  172 8.176752463 192.168.1.16 → 10.6.15.144  SSH 294 Client: Encrypted packet (len=228)
  173 8.190653655  10.6.15.144 → 192.168.1.16 TCP 66 22 → 59298 [ACK] Seq=28557 Ack=16153 Win=1452 Len=0 TSval=6532152 TSecr=5935771
  174 8.243065665  10.6.15.144 → 192.168.1.16 SSH 142 Server: Encrypted packet (len=76)
  175 8.243093135 192.168.1.16 → 10.6.15.144  TCP 66 59298 → 22 [ACK] Seq=16153 Ack=28633 Win=6155 Len=0 TSval=5935788 TSecr=6532164
  176 9.923845348  10.6.15.144 → 192.168.1.16 SSH 142 Server: [TCP Spurious Retransmission] , Encrypted packet (len=76)
  177 9.923869682 192.168.1.16 → 10.6.15.144  TCP 78 [TCP Dup ACK 175#1] 59298 → 22 [ACK] Seq=16153 Ack=28633 Win=6155 Len=0 TSval=5936208 TSecr=6532221 SLE=28557 SRE=28633
  178 9.923889315  10.6.15.144 → 192.168.1.16 SSH 302 Server: Encrypted packet (len=236)
  179 9.923905342 192.168.1.16 → 10.6.15.144  TCP 66 59298 → 22 [ACK] Seq=16153 Ack=28869 Win=6155 Len=0 TSval=5936208 TSecr=6532242
  180 9.923916768  10.6.15.144 → 192.168.1.16 SSH 378 Server: [TCP Spurious Retransmission] , Encrypted packet (len=312)
  181 9.923921830 192.168.1.16 → 10.6.15.144  TCP 78 [TCP Dup ACK 179#1] 59298 → 22 [ACK] Seq=16153 Ack=28869 Win=6155 Len=0 TSval=5936208 TSecr=6532311 SLE=28557 SRE=28869
  182 9.924075853  10.6.15.144 → 192.168.1.16 SSH 378 Server: [TCP Spurious Retransmission] , Encrypted packet (len=312)
  183 9.924082646 192.168.1.16 → 10.6.15.144  TCP 78 [TCP Dup ACK 179#2] 59298 → 22 [ACK] Seq=16153 Ack=28869 Win=6155 Len=0 TSval=5936208 TSecr=6532425 SLE=28557 SRE=28869
  184 9.924797812 192.168.1.16 → 10.6.15.144  SSH 134 Client: Encrypted packet (len=68)
  185 9.958763885  10.6.15.144 → 192.168.1.16 TCP 66 22 → 59298 [ACK] Seq=28869 Ack=16221 Win=1452 Len=0 TSval=6532593 TSecr=5936208
  186 10.916803243  192.168.1.1 → 224.0.0.1    IGMPv2 42 Membership Query, general
  187 11.265811148 192.168.1.16 → 224.0.0.251  IGMPv2 46 Membership Report group 224.0.0.251
  188 12.713987181 192.168.1.16 → 10.6.15.144  SSH 1514 Client: Encrypted packet (len=1448)
  189 12.727178033 192.168.1.16 → 10.6.15.144  SSH 374 Client: Encrypted packet (len=308)
  190 12.737353310  10.6.15.144 → 192.168.1.16 TCP 66 22 → 59298 [ACK] Seq=28869 Ack=17669 Win=1452 Len=0 TSval=6533288 TSecr=5936906
  191 12.739687268  10.6.15.144 → 192.168.1.16 TCP 66 22 → 59298 [ACK] Seq=28869 Ack=17977 Win=1452 Len=0 TSval=6533289 TSecr=5936909
  192 12.743341623  10.6.15.144 → 192.168.1.16 SSH 142 Server: Encrypted packet (len=76)
  193 12.785841082 192.168.1.16 → 10.6.15.144  TCP 66 59298 → 22 [ACK] Seq=17977 Ack=28945 Win=6155 Len=0 TSval=5936924 TSecr=6533289
  194 12.854653770  10.6.15.144 → 192.168.1.16 SSH 974 Server: Encrypted packet (len=908)
  195 12.854680894 192.168.1.16 → 10.6.15.144  TCP 66 59298 → 22 [ACK] Seq=17977 Ack=29853 Win=6155 Len=0 TSval=5936941 TSecr=6533318
  196 12.864052835  10.6.15.144 → 192.168.1.16 SSH 454 Server: Encrypted packet (len=388)
  197 12.864069592 192.168.1.16 → 10.6.15.144  TCP 66 59298 → 22 [ACK] Seq=17977 Ack=30241 Win=6155 Len=0 TSval=5936943 TSecr=6533318
  198 12.864570657 192.168.1.16 → 10.6.15.144  SSH 134 Client: Encrypted packet (len=68)
  199 12.916043047  10.6.15.144 → 192.168.1.16 TCP 66 22 → 59298 [ACK] Seq=30241 Ack=18045 Win=1452 Len=0 TSval=6533333 TSecr=5936943
  200 16.257839222 192.168.1.16 → 224.0.0.252  IGMPv2 46 Membership Report group 224.0.0.252
  201 17.793841641 192.168.1.16 → 54.76.71.168 TCP 66 42414 → 8282 [ACK] Seq=1 Ack=1 Win=296 Len=0 TSval=5938176 TSecr=610038704
  202 18.207948837 10.22.19.163 → 224.0.0.252  LLMNR 64 Standard query 0xf82c A wpad
  203 18.207973788 10.22.19.163 → 224.0.0.252  LLMNR 64 Standard query 0xf82c A wpad
  204 26.916660478 10.22.18.208 → 224.0.0.252  LLMNR 64 Standard query 0xcb4f A wpad
  205 27.599770197 192.168.1.16 → 91.189.94.4  NTP 90 NTP Version 4, client
  206 27.602056951 10.22.18.208 → 224.0.0.252  LLMNR 64 Standard query 0xcb4f A wpad
  207 27.613306427 10.119.73.122 → 192.168.1.16 ICMP 110 Destination unreachable (Communication administratively filtered)
  208 31.599775809 192.168.1.16 → 139.59.50.38 NTP 90 NTP Version 4, client
  209 31.613087377 10.119.73.122 → 192.168.1.16 ICMP 110 Destination unreachable (Communication administratively filtered)
  210 33.925405532 10.22.18.208 → 224.0.0.252  LLMNR 68 Standard query 0x282f A plxxwypo
  211 33.925796264 10.22.18.208 → 224.0.0.252  LLMNR 73 Standard query 0xa056 A yyktcztjaqdyb
  212 33.928459774 10.22.18.208 → 224.0.0.252  LLMNR 70 Standard query 0xf1a9 A skuerecklj
