    1 0.000000000 192.168.1.16 → 10.6.15.144  SSH 314 Client: Encrypted packet (len=248)
    2 0.004827816  10.6.15.144 → 192.168.1.16 TCP 66 22 → 59298 [ACK] Seq=1 Ack=249 Win=1452 Len=0 TSval=6548076 TSecr=5951650
    3 0.014783622  10.6.15.144 → 192.168.1.16 TCP 78 [TCP Dup ACK 2#1] 22 → 59298 [ACK] Seq=1 Ack=249 Win=1452 Len=0 TSval=6548148 TSecr=5951768 SLE=1 SRE=249
    4 0.060957807  10.6.15.144 → 192.168.1.16 SSH 110 Server: Encrypted packet (len=44)
    5 0.060977191 192.168.1.16 → 10.6.15.144  TCP 66 59298 → 22 [ACK] Seq=249 Ack=45 Win=6155 Len=0 TSval=5951783 TSecr=6548160
    6 0.067411875 192.168.1.16 → 10.6.15.144  SSH 918 Client: Encrypted packet (len=852)
    7 0.106648458  10.6.15.144 → 192.168.1.16 TCP 66 22 → 59298 [ACK] Seq=45 Ack=1101 Win=1452 Len=0 TSval=6548171 TSecr=5951784
    8 0.140592494  10.6.15.144 → 192.168.1.16 SSH 622 Server: Encrypted packet (len=556)
    9 0.142977800 192.168.1.16 → 10.6.15.144  SSH 102 Client: Encrypted packet (len=36)
   10 0.144229631 192.168.1.16 → 10.6.15.144  SSH 282 Client: Encrypted packet (len=216)
   11 0.153523856  10.6.15.144 → 192.168.1.16 TCP 66 22 → 59298 [ACK] Seq=601 Ack=1353 Win=1452 Len=0 TSval=6548183 TSecr=5951803
   12 0.153544983 192.168.1.16 → 10.6.15.144  SSH 286 Client: Encrypted packet (len=220)
   13 0.155866949  10.6.15.144 → 192.168.1.16 SSH 282 Server: Encrypted packet (len=216)
   14 0.196003114 192.168.1.16 → 10.6.15.144  TCP 66 59298 → 22 [ACK] Seq=1573 Ack=817 Win=6155 Len=0 TSval=5951817 TSecr=6548183
   15 0.198606766  10.6.15.144 → 192.168.1.16 TCP 66 22 → 59298 [ACK] Seq=817 Ack=1573 Win=1452 Len=0 TSval=6548195 TSecr=5951806
   16 0.209940412  10.6.15.144 → 192.168.1.16 SSH 134 Server: Encrypted packet (len=68)
   17 0.209979249 192.168.1.16 → 10.6.15.144  TCP 66 59298 → 22 [ACK] Seq=1573 Ack=885 Win=6155 Len=0 TSval=5951820 TSecr=6548198
   18 0.209995437  10.6.15.144 → 192.168.1.16 SSH 286 Server: Encrypted packet (len=220)
   19 0.209998949 192.168.1.16 → 10.6.15.144  TCP 66 59298 → 22 [ACK] Seq=1573 Ack=1105 Win=6155 Len=0 TSval=5951820 TSecr=6548198
   20 0.211753839 192.168.1.16 → 10.6.15.144  SSH 134 Client: Encrypted packet (len=68)
   21 0.222875364  10.6.15.144 → 192.168.1.16 TCP 66 22 → 59298 [ACK] Seq=1105 Ack=1641 Win=1452 Len=0 TSval=6548200 TSecr=5951820
   22 0.316528831  10.6.15.144 → 192.168.1.16 SSH 102 Server: Encrypted packet (len=36)
   23 0.316809762 192.168.1.16 → 10.6.15.144  SSH 158 Client: Encrypted packet (len=92)
   24 0.328508416  10.6.15.144 → 192.168.1.16 TCP 66 22 → 59298 [ACK] Seq=1141 Ack=1733 Win=1452 Len=0 TSval=6548226 TSecr=5951847
   25 0.593082197 192.168.1.16 → 10.6.15.144  SSH 566 Client: Encrypted packet (len=500)
   26 0.601547384  10.6.15.144 → 192.168.1.16 SSH 182 Server: Encrypted packet (len=116)
   27 0.602133368 192.168.1.16 → 10.6.15.144  SSH 134 Client: Encrypted packet (len=68)
   28 0.608415181  10.6.15.144 → 192.168.1.16 TCP 66 22 → 59298 [ACK] Seq=1257 Ack=2233 Win=1452 Len=0 TSval=6548297 TSecr=5951916
   29 0.611899623  10.6.15.144 → 192.168.1.16 TCP 66 22 → 59298 [ACK] Seq=1257 Ack=2301 Win=1452 Len=0 TSval=6548298 TSecr=5951918
   30 0.829957283  10.6.15.144 → 192.168.1.16 SSH 374 Server: Encrypted packet (len=308)
   31 0.872000154 192.168.1.16 → 10.6.15.144  TCP 66 59298 → 22 [ACK] Seq=2301 Ack=1565 Win=6155 Len=0 TSval=5951986 TSecr=6548323
   32 0.921729928 192.168.1.16 → 10.6.15.144  SSH 366 Client: Encrypted packet (len=300)
   33 0.942295695 192.168.1.16 → 10.6.15.144  SSH 278 Client: Encrypted packet (len=212)
   34 0.957239400  10.6.15.144 → 192.168.1.16 TCP 66 22 → 59298 [ACK] Seq=1565 Ack=2813 Win=1452 Len=0 TSval=6548384 TSecr=5951998
   35 1.007528462  10.6.15.144 → 192.168.1.16 SSH 134 Server: Encrypted packet (len=68)
   36 1.007547963 192.168.1.16 → 10.6.15.144  TCP 66 59298 → 22 [ACK] Seq=2813 Ack=1633 Win=6155 Len=0 TSval=5952019 TSecr=6548396
   37 1.035886897 192.168.1.16 → 10.6.15.144  SSH 326 Client: Encrypted packet (len=260)
   38 1.063189496 192.168.1.16 → 10.6.15.144  SSH 398 Client: Encrypted packet (len=332)
   39 1.067828007 192.168.1.16 → 10.6.15.144  SSH 326 Client: Encrypted packet (len=260)
   40 1.072151839 192.168.1.16 → 10.6.15.144  SSH 214 Client: Encrypted packet (len=148)
   41 1.075687172 192.168.1.16 → 224.0.0.252  LLMNR 61 Standard query 0x475f A x
   42 1.137113275  10.6.15.144 → 192.168.1.16 TCP 78 [TCP Dup ACK 34#1] 22 → 59298 [ACK] Seq=1633 Ack=2813 Win=1452 Len=0 TSval=6548429 TSecr=5952019 SLE=3405 SRE=3665
   43 1.137130929 192.168.1.16 → 10.6.15.144  SSH 1514 Client: Encrypted packet (len=1448)
   44 1.137143640  10.6.15.144 → 192.168.1.16 TCP 78 [TCP Dup ACK 34#2] 22 → 59298 [ACK] Seq=1633 Ack=2813 Win=1452 Len=0 TSval=6548429 TSecr=5952019 SLE=3405 SRE=3813
   45 1.137149184 192.168.1.16 → 10.6.15.144  SSH 658 Client: [TCP Fast Retransmission] , Encrypted packet (len=592)
   46 1.159888386 192.168.1.16 → 10.6.15.144  SSH 1514 Client: Encrypted packet (len=1448)
   47 1.180256388  10.6.15.144 → 192.168.1.16 TCP 86 [TCP Dup ACK 34#3] 22 → 59298 [ACK] Seq=1633 Ack=2813 Win=1452 Len=0 TSval=6548440 TSecr=5952019 SLE=5261 SRE=6709 SLE=3405 SRE=3813
   48 1.180277344 192.168.1.16 → 10.6.15.144  SSH 658 Client: [TCP Fast Retransmission] , Encrypted packet (len=592)
   49 1.186363377 192.168.1.16 → 224.0.0.252  LLMNR 61 Standard query 0x475f A x
   50 1.189574661  10.6.15.144 → 192.168.1.16 TCP 78 22 → 59298 [ACK] Seq=1633 Ack=3813 Win=1445 Len=0 TSval=6548442 TSecr=5952063 SLE=5261 SRE=6709
   51 1.189597454 192.168.1.16 → 10.6.15.144  TCP 1514 [TCP Retransmission] 59298 → 22 [ACK] Seq=3813 Ack=1633 Win=6155 Len=1448 TSval=5952065 TSecr=6548442
   52 1.189611274 192.168.1.16 → 10.6.15.144  SSH 202 Client: Encrypted packet (len=136)
   53 1.238246676  10.6.15.144 → 192.168.1.16 TCP 66 22 → 59298 [ACK] Seq=1633 Ack=6709 Win=1446 Len=0 TSval=6548454 TSecr=5952065
   54 1.238263893  10.6.15.144 → 192.168.1.16 TCP 66 22 → 59298 [ACK] Seq=1633 Ack=6845 Win=1445 Len=0 TSval=6548454 TSecr=5952065
   55 1.239292924  10.6.15.144 → 192.168.1.16 SSH 102 Server: Encrypted packet (len=36)
   56 1.248363156  10.6.15.144 → 192.168.1.16 SSH 278 Server: Encrypted packet (len=212)
   57 1.248470304 192.168.1.16 → 10.6.15.144  TCP 66 59298 → 22 [ACK] Seq=6845 Ack=1881 Win=6155 Len=0 TSval=5952080 TSecr=6548454
   58 1.294091864  10.6.15.144 → 192.168.1.16 SSH 134 Server: Encrypted packet (len=68)
   59 1.336050268 192.168.1.16 → 10.6.15.144  TCP 66 59298 → 22 [ACK] Seq=6845 Ack=1949 Win=6155 Len=0 TSval=5952102 TSecr=6548468
   60 1.346866939  10.6.15.144 → 192.168.1.16 SSH 1514 Server: Encrypted packet (len=1448)
   61 1.347202202  10.6.15.144 → 192.168.1.16 SSH 1514 Server: Encrypted packet (len=1448)
   62 1.347211282 192.168.1.16 → 10.6.15.144  TCP 66 59298 → 22 [ACK] Seq=6845 Ack=4845 Win=6155 Len=0 TSval=5952104 TSecr=6548481
   63 1.347949408  10.6.15.144 → 192.168.1.16 SSH 1514 Server: Encrypted packet (len=1448)
   64 1.357682924  10.6.15.144 → 192.168.1.16 SSH 1514 Server: Encrypted packet (len=1448)
   65 1.357702384 192.168.1.16 → 10.6.15.144  TCP 66 59298 → 22 [ACK] Seq=6845 Ack=7741 Win=6155 Len=0 TSval=5952107 TSecr=6548481
   66 1.357786747  10.6.15.144 → 192.168.1.16 SSH 930 Server: Encrypted packet (len=864)
   67 1.357809451 192.168.1.16 → 10.6.15.144  TCP 66 59298 → 22 [ACK] Seq=6845 Ack=8605 Win=6155 Len=0 TSval=5952107 TSecr=6548484
   68 1.373417473 192.168.1.16 → 10.6.15.144  SSH 1078 Client: Encrypted packet (len=1012)
   69 1.376771428 192.168.1.16 → 10.6.15.144  SSH 1514 Client: Encrypted packet (len=1448)
   70 1.386802484 192.168.1.16 → 10.6.15.144  SSH 674 Client: Encrypted packet (len=608)
   71 1.436323693 192.168.1.16 → 224.0.0.252  LLMNR 61 Standard query 0x475f A x
   72 1.476049231 192.168.1.16 → 10.6.15.144  TCP 674 [TCP Retransmission] 59298 → 22 [PSH, ACK] Seq=9305 Ack=8605 Win=6155 Len=608 TSval=5952137 TSecr=6548484
   73 1.509012461  10.6.15.144 → 192.168.1.16 SSH 1514 Server: Encrypted packet (len=1436)
   74 1.509039518  10.6.15.144 → 192.168.1.16 SSH 218 Server: Encrypted packet (len=140)
   75 1.509051179 192.168.1.16 → 10.6.15.144  TCP 66 59298 → 22 [ACK] Seq=9913 Ack=10181 Win=6155 Len=0 TSval=5952145 TSecr=6548521
   76 1.521775820  10.6.15.144 → 192.168.1.16 TCP 78 [TCP Dup ACK 54#1] 22 → 59298 [ACK] Seq=10181 Ack=6845 Win=1452 Len=0 TSval=6548521 TSecr=5952104 SLE=7857 SRE=9913
   77 1.568879360 10.22.18.208 → 224.0.0.252  LLMNR 64 Standard query 0x977f A wpad
   78 1.670835573  10.6.15.144 → 192.168.1.16 SSH 402 Server: Encrypted packet (len=324)
   79 1.684879284  10.6.15.144 → 192.168.1.16 SSH 810 Server: Encrypted packet (len=732)
   80 1.684940494 192.168.1.16 → 10.6.15.144  TCP 66 59298 → 22 [ACK] Seq=9913 Ack=11237 Win=6155 Len=0 TSval=5952189 TSecr=6548562
   81 1.698970600  10.6.15.144 → 192.168.1.16 SSH 146 Server: Encrypted packet (len=68)
   82 1.740048994 192.168.1.16 → 10.6.15.144  TCP 66 59298 → 22 [ACK] Seq=9913 Ack=11305 Win=6155 Len=0 TSval=5952203 TSecr=6548566
   83 1.776981041  10.6.15.144 → 192.168.1.16 SSH 1514 Server: Encrypted packet (len=1436)
   84 1.777070990 192.168.1.16 → 10.6.15.144  TCP 66 59298 → 22 [ACK] Seq=9913 Ack=12741 Win=6155 Len=0 TSval=5952212 TSecr=6548589
   85 1.777233976  10.6.15.144 → 192.168.1.16 SSH 1514 Server: Encrypted packet (len=1436)
   86 1.778673021  10.6.15.144 → 192.168.1.16 SSH 1514 Server: Encrypted packet (len=1436)
   87 1.778700884 192.168.1.16 → 10.6.15.144  TCP 66 59298 → 22 [ACK] Seq=9913 Ack=15613 Win=6155 Len=0 TSval=5952212 TSecr=6548589
   88 1.796000943 192.168.1.16 → 10.6.15.144  TCP 1078 [TCP Retransmission] 59298 → 22 [PSH, ACK] Seq=6845 Ack=15613 Win=6155 Len=1012 TSval=5952217 TSecr=6548589
   89 2.432025725 192.168.1.16 → 10.6.15.144  TCP 1078 [TCP Retransmission] 59298 → 22 [PSH, ACK] Seq=6845 Ack=15613 Win=6155 Len=1012 TSval=5952376 TSecr=6548589
   90 2.435809121  10.6.15.144 → 192.168.1.16 SSH 1514 Server: Encrypted packet (len=1436)
   91 2.435827128 10.22.18.208 → 224.0.0.252  LLMNR 64 Standard query 0x977f A wpad
   92 2.435838593 10.22.18.100 → 224.0.0.252  LLMNR 64 Standard query 0xdc9f AAAA wpad
   93 2.436012032  10.6.15.144 → 192.168.1.16 TCP 1514 [TCP Out-Of-Order] 22 → 59298 [ACK] Seq=11305 Ack=6845 Win=1452 Len=1436 TSval=6548730 TSecr=5952104 SLE=7857 SRE=9913
   94 2.436017696 192.168.1.16 → 10.6.15.144  TCP 78 59298 → 22 [ACK] Seq=9913 Ack=17049 Win=6155 Len=0 TSval=5952377 TSecr=6548629 SLE=11305 SRE=12741
   95 2.442354314  10.6.15.144 → 192.168.1.16 SSH 1514 Server: Encrypted packet (len=1448)
   96 2.442384935 192.168.1.16 → 10.6.15.144  TCP 66 59298 → 22 [ACK] Seq=9913 Ack=18497 Win=6155 Len=0 TSval=5952378 TSecr=6548756
   97 2.442401436  10.6.15.144 → 192.168.1.16 SSH 194 Server: Encrypted packet (len=128)
   98 2.442405596 192.168.1.16 → 10.6.15.144  TCP 66 59298 → 22 [ACK] Seq=9913 Ack=18625 Win=6155 Len=0 TSval=5952378 TSecr=6548756
   99 2.504732788  10.6.15.144 → 192.168.1.16 SSH 1510 Server: Encrypted packet (len=1444)
  100 2.504757923 192.168.1.16 → 10.6.15.144  TCP 66 59298 → 22 [ACK] Seq=9913 Ack=20069 Win=6155 Len=0 TSval=5952394 TSecr=6548771
  101 2.522111633 10.22.18.100 → 224.0.0.252  LLMNR 64 Standard query 0xdc9f AAAA wpad
  102 2.546413767 192.168.1.16 → 10.6.15.144  SSH 286 Client: Encrypted packet (len=220)
  103 2.577902953 192.168.1.16 → 10.6.15.144  SSH 102 Client: Encrypted packet (len=36)
  104 2.590562649  10.6.15.144 → 192.168.1.16 TCP 66 22 → 59298 [ACK] Seq=20069 Ack=10169 Win=1452 Len=0 TSval=6548792 TSecr=5952404
  105 2.590581738 192.168.1.16 → 10.6.15.144  SSH 322 Client: Encrypted packet (len=256)
  106 2.591867769  10.6.15.144 → 192.168.1.16 SSH 102 Server: Encrypted packet (len=36)
  107 2.591875972 192.168.1.16 → 10.6.15.144  TCP 66 59298 → 22 [ACK] Seq=10425 Ack=20105 Win=6155 Len=0 TSval=5952415 TSecr=6548792
  108 2.611160525  10.6.15.144 → 192.168.1.16 SSH 686 Server: Encrypted packet (len=620)
  109 2.611182991 192.168.1.16 → 10.6.15.144  TCP 66 59298 → 22 [ACK] Seq=10425 Ack=20725 Win=6155 Len=0 TSval=5952420 TSecr=6548797
  110 2.628588918  10.6.15.144 → 192.168.1.16 SSH 1514 Server: Encrypted packet (len=1448)
  111 2.628610464 192.168.1.16 → 10.6.15.144  TCP 66 59298 → 22 [ACK] Seq=10425 Ack=22173 Win=6155 Len=0 TSval=5952425 TSecr=6548802
  112 2.628728942  10.6.15.144 → 192.168.1.16 SSH 1318 Server: Encrypted packet (len=1252)
  113 2.628735806 192.168.1.16 → 10.6.15.144  TCP 66 59298 → 22 [ACK] Seq=10425 Ack=23425 Win=6155 Len=0 TSval=5952425 TSecr=6548802
  114 2.656281849  10.6.15.144 → 192.168.1.16 SSH 222 Server: Encrypted packet (len=156)
  115 2.656296140 192.168.1.16 → 10.6.15.144  TCP 66 59298 → 22 [ACK] Seq=10425 Ack=23581 Win=6155 Len=0 TSval=5952432 TSecr=6548809
  116 2.659458428  10.6.15.144 → 192.168.1.16 SSH 1514 Server: Encrypted packet (len=1448)
  117 2.659475723 192.168.1.16 → 10.6.15.144  TCP 66 59298 → 22 [ACK] Seq=10425 Ack=25029 Win=6155 Len=0 TSval=5952432 TSecr=6548810
  118 2.659568576  10.6.15.144 → 192.168.1.16 SSH 910 Server: Encrypted packet (len=844)
  119 2.659575260 192.168.1.16 → 10.6.15.144  TCP 66 59298 → 22 [ACK] Seq=10425 Ack=25873 Win=6155 Len=0 TSval=5952432 TSecr=6548810
  120 3.730212346 192.168.1.16 → 10.6.15.144  SSH 662 Client: Encrypted packet (len=596)
  121 3.733649308 192.168.1.16 → 10.6.15.144  SSH 1514 Client: Encrypted packet (len=1448)
  122 3.750551314  10.6.15.144 → 192.168.1.16 SSH 294 Server: Encrypted packet (len=228)
  123 3.750574895 192.168.1.16 → 10.6.15.144  TCP 66 59298 → 22 [ACK] Seq=12469 Ack=26101 Win=6155 Len=0 TSval=5952705 TSecr=6548852
  124 3.750589542  10.6.15.144 → 192.168.1.16 TCP 222 [TCP Out-Of-Order] 22 → 59298 [PSH, ACK] Seq=23425 Ack=10425 Win=1452 Len=156 TSval=6549061 TSecr=5952425
  125 3.750592673 192.168.1.16 → 10.6.15.144  TCP 78 [TCP Dup ACK 123#1] 59298 → 22 [ACK] Seq=12469 Ack=26101 Win=6155 Len=0 TSval=5952705 TSecr=6548852 SLE=23425 SRE=23581
  126 3.840026206 192.168.1.16 → 10.6.15.144  SSH 250 Client: Encrypted packet (len=184)
  127 4.128012655 192.168.1.16 → 10.6.15.144  TCP 662 [TCP Retransmission] 59298 → 22 [PSH, ACK] Seq=10425 Ack=26101 Win=6155 Len=596 TSval=5952800 TSecr=6548852
  128 4.183746448  10.6.15.144 → 192.168.1.16 TCP 66 22 → 59298 [ACK] Seq=26101 Ack=11021 Win=1452 Len=0 TSval=6549191 TSecr=5952800
  129 4.183767611 192.168.1.16 → 10.6.15.144  SSH 198 Client: Encrypted packet (len=132)
  130 4.192739915  10.6.15.144 → 192.168.1.16 TCP 78 [TCP Dup ACK 128#1] 22 → 59298 [ACK] Seq=26101 Ack=11021 Win=1452 Len=0 TSval=6549193 TSecr=5952800 SLE=12653 SRE=12785
  131 4.192769324 192.168.1.16 → 10.6.15.144  TCP 1514 [TCP Retransmission] 59298 → 22 [ACK] Seq=11021 Ack=26101 Win=6155 Len=1448 TSval=5952816 TSecr=6549193
  132 4.192794980 192.168.1.16 → 10.6.15.144  TCP 250 [TCP Retransmission] 59298 → 22 [PSH, ACK] Seq=12469 Ack=26101 Win=6155 Len=184 TSval=5952816 TSecr=6549193
  133 4.204258802  10.6.15.144 → 192.168.1.16 TCP 78 22 → 59298 [ACK] Seq=26101 Ack=12469 Win=1451 Len=0 TSval=6549196 TSecr=5952816 SLE=12653 SRE=12785
  134 4.204358563  10.6.15.144 → 192.168.1.16 TCP 66 22 → 59298 [ACK] Seq=26101 Ack=12785 Win=1452 Len=0 TSval=6549196 TSecr=5952816
  135 4.243858292  10.6.15.144 → 192.168.1.16 SSH 222 Server: Encrypted packet (len=156)
  136 4.243875152 192.168.1.16 → 10.6.15.144  TCP 66 59298 → 22 [ACK] Seq=12785 Ack=26257 Win=6155 Len=0 TSval=5952828 TSecr=6549206
  137 4.306230255  10.6.15.144 → 192.168.1.16 SSH 198 Server: Encrypted packet (len=132)
  138 4.306248617 192.168.1.16 → 10.6.15.144  TCP 66 59298 → 22 [ACK] Seq=12785 Ack=26389 Win=6155 Len=0 TSval=5952844 TSecr=6549221
  139 4.306269560  10.6.15.144 → 192.168.1.16 SSH 294 Server: Encrypted packet (len=228)
  140 4.306275911 192.168.1.16 → 10.6.15.144  TCP 66 59298 → 22 [ACK] Seq=12785 Ack=26617 Win=6155 Len=0 TSval=5952844 TSecr=6549221
  141 5.773994061  10.22.18.21 → 224.0.0.252  LLMNR 64 Standard query 0xf724 ANY Aman
  142 5.948823412 192.168.1.16 → 54.76.71.168 TCP 128 42414 → 8282 [PSH, ACK] Seq=1 Ack=1 Win=296 Len=62 TSval=5953255 TSecr=610038704
  143 7.583997262 192.168.1.16 → 54.76.71.168 TCP 128 [TCP Retransmission] 42414 → 8282 [PSH, ACK] Seq=1 Ack=1 Win=296 Len=62 TSval=5953664 TSecr=610038704
  144 7.588080470 54.76.71.168 → 192.168.1.16 TCP 66 8282 → 42414 [ACK] Seq=1 Ack=63 Win=121 Len=0 TSval=610065230 TSecr=5953255
  145 7.588098714  10.22.18.21 → 224.0.0.252  LLMNR 64 Standard query 0xf724 ANY Aman
  146 8.739477239 54.76.71.168 → 192.168.1.16 TCP 78 [TCP Dup ACK 144#1] 8282 → 42414 [ACK] Seq=1 Ack=63 Win=121 Len=0 TSval=610065639 TSecr=5953664 SLE=1 SRE=63
  147 11.221379769 192.168.1.16 → 10.6.15.144  SSH 1514 Client: Encrypted packet (len=1448)
  148 11.244332804 192.168.1.16 → 10.6.15.144  SSH 374 Client: Encrypted packet (len=308)
  149 11.255323669  10.6.15.144 → 192.168.1.16 TCP 66 22 → 59298 [ACK] Seq=26617 Ack=14233 Win=1452 Len=0 TSval=6550958 TSecr=5954573
  150 11.255340037  10.6.15.144 → 192.168.1.16 TCP 66 22 → 59298 [ACK] Seq=26617 Ack=14541 Win=1452 Len=0 TSval=6550958 TSecr=5954579
  151 11.261132347  10.6.15.144 → 192.168.1.16 SSH 134 Server: Encrypted packet (len=68)
  152 11.261147330 192.168.1.16 → 10.6.15.144  TCP 66 59298 → 22 [ACK] Seq=14541 Ack=26685 Win=6155 Len=0 TSval=5954583 TSecr=6550959
  153 12.769773747  10.6.15.144 → 192.168.1.16 SSH 846 Server: Encrypted packet (len=780)
  154 12.769797444 192.168.1.16 → 10.6.15.144  TCP 66 59298 → 22 [ACK] Seq=14541 Ack=27465 Win=6155 Len=0 TSval=5954960 TSecr=6550986
  155 12.769842346  10.6.15.144 → 192.168.1.16 SSH 678 Server: Encrypted packet (len=612)
  156 12.769846743 192.168.1.16 → 10.6.15.144  TCP 66 59298 → 22 [ACK] Seq=14541 Ack=28077 Win=6155 Len=0 TSval=5954960 TSecr=6550987
  157 12.769929817  10.6.15.144 → 192.168.1.16 SSH 678 Server: [TCP Spurious Retransmission] , Encrypted packet (len=612)
  158 12.769933848 192.168.1.16 → 10.6.15.144  TCP 78 [TCP Dup ACK 156#1] 59298 → 22 [ACK] Seq=14541 Ack=28077 Win=6155 Len=0 TSval=5954960 TSecr=6551073 SLE=27465 SRE=28077
  159 12.770704215 192.168.1.16 → 10.6.15.144  SSH 134 Client: Encrypted packet (len=68)
  160 12.823614492  10.6.15.144 → 192.168.1.16 TCP 66 22 → 59298 [ACK] Seq=28077 Ack=14609 Win=1452 Len=0 TSval=6551351 TSecr=5954960
  161 20.439903099 192.168.1.16 → 192.168.1.1  DNS 74 Standard query 0xb14d A ntp.ubuntu.com
  162 20.451514828  192.168.1.1 → 192.168.1.16 DNS 138 Standard query response 0xb14d A ntp.ubuntu.com A 91.189.91.157 A 91.189.89.199 A 91.189.94.4 A 91.189.89.198
  163 20.451961743 192.168.1.16 → 91.189.91.157 NTP 90 NTP Version 4, client
  164 24.442595663 192.168.1.16 → 192.168.1.1  DNS 81 Standard query 0x47ab A 2.ubuntu.pool.ntp.org
  165 29.686420680 192.168.1.16 → 192.168.1.1  DNS 81 Standard query 0x47ab A 2.ubuntu.pool.ntp.org
  166 31.932227057 192.168.1.16 → 239.255.255.250 SSDP 213 M-SEARCH * HTTP/1.1 
  167 32.933442417 192.168.1.16 → 239.255.255.250 SSDP 213 M-SEARCH * HTTP/1.1 
  168 33.935180395 192.168.1.16 → 239.255.255.250 SSDP 213 M-SEARCH * HTTP/1.1 
