    1 0.000000000 192.168.1.16 → 10.6.15.144  SSH 138 Client: Encrypted packet (len=72)
    2 0.012803784  10.6.15.144 → 192.168.1.16 TCP 66 [TCP ACKed unseen segment] 22 → 59298 [ACK] Seq=1 Ack=181 Win=1452 Len=0 TSval=6557148 TSecr=5960768
    3 0.012825679 192.168.1.16 → 10.6.15.144  SSH 102 Client: [TCP Previous segment not captured] , Encrypted packet (len=36)
    4 0.023851590  10.6.15.144 → 192.168.1.16 TCP 66 [TCP ACKed unseen segment] 22 → 59298 [ACK] Seq=1 Ack=217 Win=1452 Len=0 TSval=6557151 TSecr=5960771
    5 0.045035950  10.6.15.144 → 192.168.1.16 SSH 126 Server: Encrypted packet (len=60)
    6 0.045058553  10.6.15.144 → 192.168.1.16 SSH 138 Server: Encrypted packet (len=72)
    7 0.045122148 192.168.1.16 → 10.6.15.144  TCP 66 59298 → 22 [ACK] Seq=217 Ack=133 Win=6155 Len=0 TSval=5960779 TSecr=6557156
    8 0.045294386 192.168.1.16 → 10.6.15.144  SSH 102 Client: Encrypted packet (len=36)
    9 0.055857497  10.6.15.144 → 192.168.1.16 SSH 102 Server: Encrypted packet (len=36)
   10 0.056206438 192.168.1.16 → 10.6.15.144  SSH 166 Client: Encrypted packet (len=100)
   11 0.071752869  10.6.15.144 → 192.168.1.16 TCP 66 22 → 59298 [ACK] Seq=169 Ack=353 Win=1452 Len=0 TSval=6557163 TSecr=5960779
   12 1.729980165  10.6.15.144 → 192.168.1.16 SSH 182 Server: Encrypted packet (len=116)
   13 1.730002860  10.6.15.144 → 192.168.1.16 SSH 110 Server: Encrypted packet (len=44)
   14 1.730009414  10.6.15.144 → 192.168.1.16 TCP 110 [TCP Retransmission] 22 → 59298 [PSH, ACK] Seq=285 Ack=353 Win=1452 Len=44 TSval=6557429 TSecr=5960779
   15 1.730018061 192.168.1.16 → 10.6.15.144  TCP 78 59298 → 22 [ACK] Seq=353 Ack=329 Win=6155 Len=0 TSval=5961200 TSecr=6557232 SLE=285 SRE=329
   16 1.730646820 192.168.1.16 → 10.6.15.144  SSH 134 Client: Encrypted packet (len=68)
   17 1.734904240 192.168.1.16 → 10.6.15.144  SSH 918 Client: Encrypted packet (len=852)
   18 1.783495152  10.6.15.144 → 192.168.1.16 TCP 66 22 → 59298 [ACK] Seq=329 Ack=421 Win=1452 Len=0 TSval=6557591 TSecr=5961200
   19 2.020051244 192.168.1.16 → 10.6.15.144  TCP 918 [TCP Retransmission] 59298 → 22 [PSH, ACK] Seq=421 Ack=329 Win=6155 Len=852 TSval=5961273 TSecr=6557591
   20 2.058893634  10.6.15.144 → 192.168.1.16 TCP 66 22 → 59298 [ACK] Seq=329 Ack=1273 Win=1452 Len=0 TSval=6557659 TSecr=5961273
   21 2.092889890  10.6.15.144 → 192.168.1.16 SSH 622 Server: Encrypted packet (len=556)
   22 2.095402282 192.168.1.16 → 10.6.15.144  SSH 102 Client: Encrypted packet (len=36)
   23 2.097419229 192.168.1.16 → 10.6.15.144  SSH 282 Client: Encrypted packet (len=216)
   24 2.099648044 192.168.1.16 → 10.6.15.144  SSH 286 Client: Encrypted packet (len=220)
   25 2.112613531  10.6.15.144 → 192.168.1.16 TCP 78 [TCP Dup ACK 20#1] 22 → 59298 [ACK] Seq=885 Ack=1273 Win=1452 Len=0 TSval=6557672 TSecr=5961273 SLE=1309 SRE=1525
   26 2.112630415  10.6.15.144 → 192.168.1.16 TCP 78 [TCP Dup ACK 20#2] 22 → 59298 [ACK] Seq=885 Ack=1273 Win=1452 Len=0 TSval=6557672 TSecr=5961273 SLE=1309 SRE=1745
   27 2.332030397 192.168.1.16 → 10.6.15.144  TCP 102 [TCP Retransmission] 59298 → 22 [PSH, ACK] Seq=1273 Ack=885 Win=6155 Len=36 TSval=5961351 TSecr=6557672
   28 2.341647776  10.6.15.144 → 192.168.1.16 TCP 66 22 → 59298 [ACK] Seq=885 Ack=1745 Win=1451 Len=0 TSval=6557730 TSecr=5961351
   29 2.343304656  10.6.15.144 → 192.168.1.16 SSH 282 Server: Encrypted packet (len=216)
   30 2.388013055 192.168.1.16 → 10.6.15.144  TCP 66 59298 → 22 [ACK] Seq=1745 Ack=1101 Win=6155 Len=0 TSval=5961365 TSecr=6557731
   31 2.391614815  10.6.15.144 → 192.168.1.16 SSH 134 Server: Encrypted packet (len=68)
   32 2.391628469 192.168.1.16 → 10.6.15.144  TCP 66 59298 → 22 [ACK] Seq=1745 Ack=1169 Win=6155 Len=0 TSval=5961365 TSecr=6557743
   33 2.415897368  10.6.15.144 → 192.168.1.16 SSH 102 Server: Encrypted packet (len=36)
   34 2.415914414 192.168.1.16 → 10.6.15.144  TCP 66 59298 → 22 [ACK] Seq=1745 Ack=1205 Win=6155 Len=0 TSval=5961371 TSecr=6557748
   35 2.416263398 192.168.1.16 → 10.6.15.144  SSH 158 Client: Encrypted packet (len=92)
   36 2.461964648  10.6.15.144 → 192.168.1.16 TCP 66 22 → 59298 [ACK] Seq=1205 Ack=1837 Win=1452 Len=0 TSval=6557761 TSecr=5961372
   37 2.546296319  10.6.15.144 → 192.168.1.16 SSH 182 Server: Encrypted packet (len=116)
   38 2.546601612 192.168.1.16 → 10.6.15.144  SSH 134 Client: Encrypted packet (len=68)
   39 2.556033359  10.6.15.144 → 192.168.1.16 TCP 66 22 → 59298 [ACK] Seq=1321 Ack=1905 Win=1452 Len=0 TSval=6557784 TSecr=5961404
   40 3.139461116 192.168.1.16 → 54.76.71.168 TCP 128 42414 → 8282 [PSH, ACK] Seq=1 Ack=1 Win=296 Len=62 TSval=5961552 TSecr=610065639
   41 3.142307541  10.6.15.144 → 192.168.1.16 SSH 382 Server: Encrypted packet (len=316)
   42 3.143169381 192.168.1.16 → 10.6.15.144  SSH 134 Client: Encrypted packet (len=68)
   43 3.153061454  10.6.15.144 → 192.168.1.16 TCP 66 22 → 59298 [ACK] Seq=1637 Ack=1973 Win=1452 Len=0 TSval=6557933 TSecr=5961553
   44 3.440330467 192.168.1.16 → 192.168.1.1  DNS 81 Standard query 0x9675 A 0.ubuntu.pool.ntp.org
   45 3.442534827 54.76.71.168 → 192.168.1.16 TCP 66 8282 → 42414 [ACK] Seq=1 Ack=63 Win=121 Len=0 TSval=610073528 TSecr=5961552
   46 3.450947370  192.168.1.1 → 192.168.1.16 DNS 145 Standard query response 0x9675 A 0.ubuntu.pool.ntp.org A 123.108.200.124 A 52.66.5.185 A 139.59.21.22 A 139.59.50.38
   47 3.451593689 192.168.1.16 → 123.108.200.124 NTP 90 NTP Version 4, client
   48 3.592043149 192.168.1.16 → 10.6.15.144  SSH 566 Client: Encrypted packet (len=500)
   49 3.603057266  10.6.15.144 → 192.168.1.16 TCP 66 22 → 59298 [ACK] Seq=1637 Ack=2473 Win=1452 Len=0 TSval=6558046 TSecr=5961665
   50 3.807055816 192.168.1.16 → 10.6.15.144  SSH 374 Client: Encrypted packet (len=308)
   51 3.811169334  10.6.15.144 → 192.168.1.16 SSH 374 Server: Encrypted packet (len=308)
   52 3.819824197  10.6.15.144 → 192.168.1.16 TCP 66 22 → 59298 [ACK] Seq=1945 Ack=2781 Win=1452 Len=0 TSval=6558100 TSecr=5961719
   53 3.830875281 192.168.1.16 → 10.6.15.144  SSH 270 Client: Encrypted packet (len=204)
   54 3.843185254  10.6.15.144 → 192.168.1.16 TCP 66 22 → 59298 [ACK] Seq=1945 Ack=2985 Win=1452 Len=0 TSval=6558106 TSecr=5961725
   55 3.890626260  10.6.15.144 → 192.168.1.16 SSH 134 Server: Encrypted packet (len=68)
   56 3.919202370 192.168.1.16 → 224.0.0.252  LLMNR 61 Standard query 0x7ced A x
   57 3.926852201 192.168.1.16 → 10.6.15.144  SSH 318 Client: Encrypted packet (len=252)
   58 3.937205356  10.6.15.144 → 192.168.1.16 TCP 66 22 → 59298 [ACK] Seq=2013 Ack=3237 Win=1452 Len=0 TSval=6558129 TSecr=5961749
   59 3.954347424 192.168.1.16 → 10.6.15.144  SSH 358 Client: Encrypted packet (len=292)
   60 3.957533795 192.168.1.16 → 10.6.15.144  SSH 394 Client: Encrypted packet (len=328)
   61 3.967345691  10.6.15.144 → 192.168.1.16 TCP 66 22 → 59298 [ACK] Seq=2013 Ack=3529 Win=1452 Len=0 TSval=6558136 TSecr=5961756
   62 3.967359650 192.168.1.16 → 10.6.15.144  SSH 214 Client: Encrypted packet (len=148)
   63 4.008000065 192.168.1.16 → 10.6.15.144  SSH 1514 Client: Encrypted packet (len=1448)
   64 4.008053211  10.6.15.144 → 192.168.1.16 TCP 78 [TCP Dup ACK 61#1] 22 → 59298 [ACK] Seq=2013 Ack=3529 Win=1452 Len=0 TSval=6558147 TSecr=5961756 SLE=3857 SRE=4005
   65 4.017727329  10.6.15.144 → 192.168.1.16 TCP 78 [TCP Dup ACK 61#2] 22 → 59298 [ACK] Seq=2013 Ack=3529 Win=1452 Len=0 TSval=6558150 TSecr=5961756 SLE=3857 SRE=5453
   66 4.017746872 192.168.1.16 → 10.6.15.144  SSH 1514 Client: Encrypted packet (len=1448)
   67 4.098817864  10.6.15.144 → 192.168.1.16 SSH 146 Server: Encrypted packet (len=68)
   68 4.140024953 192.168.1.16 → 10.6.15.144  TCP 66 59298 → 22 [ACK] Seq=6901 Ack=2081 Win=6155 Len=0 TSval=5961803 TSecr=6558170
   69 4.186362176 192.168.1.16 → 224.0.0.252  LLMNR 61 Standard query 0x7ced A x
   70 4.194538787  10.6.15.144 → 192.168.1.16 SSH 146 Server: Encrypted packet (len=68)
   71 4.194564343 192.168.1.16 → 10.6.15.144  TCP 66 59298 → 22 [ACK] Seq=6901 Ack=2149 Win=6155 Len=0 TSval=5961816 TSecr=6558193
   72 4.198972851  10.6.15.144 → 192.168.1.16 SSH 322 Server: Encrypted packet (len=244)
   73 4.199000932 192.168.1.16 → 10.6.15.144  TCP 66 59298 → 22 [ACK] Seq=6901 Ack=2393 Win=6155 Len=0 TSval=5961817 TSecr=6558194
   74 4.217278178  10.6.15.144 → 192.168.1.16 SSH 690 Server: Encrypted packet (len=612)
   75 4.217301508 192.168.1.16 → 10.6.15.144  TCP 66 59298 → 22 [ACK] Seq=6901 Ack=3005 Win=6155 Len=0 TSval=5961822 TSecr=6558199
   76 4.236003539 192.168.1.16 → 10.6.15.144  SSH 394 Client: [TCP Fast Retransmission] , Encrypted packet (len=328)
   77 4.436320340 192.168.1.16 → 224.0.0.252  LLMNR 61 Standard query 0x7ced A x
   78 4.450686241  10.6.15.144 → 192.168.1.16 SSH 410 Server: Encrypted packet (len=332)
   79 4.492024867 192.168.1.16 → 10.6.15.144  TCP 66 59298 → 22 [ACK] Seq=6901 Ack=3337 Win=6155 Len=0 TSval=5961891 TSecr=6558257
   80 4.494944537  10.6.15.144 → 192.168.1.16 SSH 1514 Server: Encrypted packet (len=1436)
   81 4.494974911 192.168.1.16 → 10.6.15.144  TCP 66 59298 → 22 [ACK] Seq=6901 Ack=4773 Win=6155 Len=0 TSval=5961891 TSecr=6558268
   82 4.495066426  10.6.15.144 → 192.168.1.16 SSH 1514 Server: Encrypted packet (len=1436)
   83 4.495071962 192.168.1.16 → 10.6.15.144  TCP 66 59298 → 22 [ACK] Seq=6901 Ack=6209 Win=6155 Len=0 TSval=5961891 TSecr=6558268
   84 4.537253235  10.6.15.144 → 192.168.1.16 SSH 1370 Server: Encrypted packet (len=1292)
   85 4.537280237 192.168.1.16 → 10.6.15.144  TCP 66 59298 → 22 [ACK] Seq=6901 Ack=7501 Win=6155 Len=0 TSval=5961902 TSecr=6558279
   86 4.704007578 192.168.1.16 → 10.6.15.144  TCP 394 [TCP Retransmission] 59298 → 22 [PSH, ACK] Seq=3529 Ack=7501 Win=6155 Len=328 TSval=5961944 TSecr=6558279
   87 5.600013948 192.168.1.16 → 10.6.15.144  TCP 394 [TCP Retransmission] 59298 → 22 [PSH, ACK] Seq=3529 Ack=7501 Win=6155 Len=328 TSval=5962168 TSecr=6558279
   88 6.755126084  10.6.15.144 → 192.168.1.16 SSH 138 Server: Encrypted packet (len=60)
   89 6.755157574 192.168.1.16 → 10.6.15.144  TCP 66 59298 → 22 [ACK] Seq=6901 Ack=7561 Win=6155 Len=0 TSval=5962456 TSecr=6558797
   90 6.755174922  10.6.15.144 → 192.168.1.16 SSH 114 Server: Encrypted packet (len=36)
   91 6.755182296 192.168.1.16 → 10.6.15.144  TCP 66 59298 → 22 [ACK] Seq=6901 Ack=7597 Win=6155 Len=0 TSval=5962456 TSecr=6558797
   92 6.755188234  10.6.15.144 → 192.168.1.16 SSH 138 Server: Encrypted packet (len=60)
   93 6.755191905 192.168.1.16 → 10.6.15.144  TCP 66 59298 → 22 [ACK] Seq=6901 Ack=7657 Win=6155 Len=0 TSval=5962456 TSecr=6558802
   94 6.817806260  10.6.15.144 → 192.168.1.16 SSH 210 Server: Encrypted packet (len=132)
   95 6.817830678 192.168.1.16 → 10.6.15.144  TCP 66 59298 → 22 [ACK] Seq=6901 Ack=7789 Win=6155 Len=0 TSval=5962472 TSecr=6558849
   96 7.392003292 192.168.1.16 → 10.6.15.144  TCP 394 [TCP Retransmission] 59298 → 22 [PSH, ACK] Seq=3529 Ack=7789 Win=6155 Len=328 TSval=5962616 TSecr=6558849
   97 7.400677532  10.6.15.144 → 192.168.1.16 TCP 66 22 → 59298 [ACK] Seq=7789 Ack=5453 Win=1443 Len=0 TSval=6558995 TSecr=5962616
   98 7.400699511 192.168.1.16 → 10.6.15.144  SSH 1514 Client: Encrypted packet (len=1448)
   99 7.400712413 192.168.1.16 → 10.6.15.144  SSH 1514 Client: Encrypted packet (len=1448)
  100 7.437760984  10.6.15.144 → 192.168.1.16 SSH 102 Server: Encrypted packet (len=36)
  101 7.437785293 192.168.1.16 → 10.6.15.144  TCP 66 59298 → 22 [ACK] Seq=9797 Ack=7825 Win=6155 Len=0 TSval=5962627 TSecr=6558996
  102 7.437801656  10.6.15.144 → 192.168.1.16 TCP 78 [TCP Dup ACK 97#1] 22 → 59298 [ACK] Seq=7825 Ack=5453 Win=1452 Len=0 TSval=6559003 TSecr=5962616 SLE=6901 SRE=8349
  103 7.437809298 192.168.1.16 → 10.6.15.144  TCP 1514 [TCP Retransmission] 59298 → 22 [ACK] Seq=5453 Ack=7825 Win=6155 Len=1448 TSval=5962627 TSecr=6559003
  104 7.456326332  10.6.15.144 → 192.168.1.16 SSH 306 Server: Encrypted packet (len=228)
  105 7.500030092 192.168.1.16 → 10.6.15.144  TCP 66 59298 → 22 [ACK] Seq=9797 Ack=8053 Win=6155 Len=0 TSval=5962643 TSecr=6559009
  106 7.505628295  10.6.15.144 → 192.168.1.16 SSH 570 Server: Encrypted packet (len=492)
  107 7.505659080 192.168.1.16 → 10.6.15.144  TCP 66 59298 → 22 [ACK] Seq=9797 Ack=8545 Win=6155 Len=0 TSval=5962644 TSecr=6559021
  108 7.598666669  10.6.15.144 → 192.168.1.16 SSH 1514 Server: Encrypted packet (len=1436)
  109 7.598693769 192.168.1.16 → 10.6.15.144  TCP 66 59298 → 22 [ACK] Seq=9797 Ack=9981 Win=6155 Len=0 TSval=5962667 TSecr=6559044
  110 7.598745414  10.6.15.144 → 192.168.1.16 SSH 950 Server: Encrypted packet (len=872)
  111 7.598751971 192.168.1.16 → 10.6.15.144  TCP 66 59298 → 22 [ACK] Seq=9797 Ack=10853 Win=6155 Len=0 TSval=5962667 TSecr=6559044
  112 7.664026386 192.168.1.16 → 10.6.15.144  TCP 1514 [TCP Retransmission] 59298 → 22 [ACK] Seq=5453 Ack=10853 Win=6155 Len=1448 TSval=5962684 TSecr=6559044
  113 7.682814624  10.6.15.144 → 192.168.1.16 TCP 66 22 → 59298 [ACK] Seq=10853 Ack=8349 Win=1446 Len=0 TSval=6559065 TSecr=5962684
  114 7.682836322 192.168.1.16 → 10.6.15.144  TCP 1514 [TCP Retransmission] 59298 → 22 [ACK] Seq=8349 Ack=10853 Win=6155 Len=1448 TSval=5962688 TSecr=6559065
  115 7.682848246 192.168.1.16 → 10.6.15.144  SSH 1514 Client: Encrypted packet (len=1448)
  116 7.682853816  10.6.15.144 → 192.168.1.16 SSH 102 Server: Encrypted packet (len=36)
  117 7.682860497 192.168.1.16 → 10.6.15.144  TCP 66 59298 → 22 [ACK] Seq=11245 Ack=10889 Win=6155 Len=0 TSval=5962688 TSecr=6559065
  118 7.709225288  10.6.15.144 → 192.168.1.16 TCP 66 22 → 59298 [ACK] Seq=10889 Ack=11245 Win=1452 Len=0 TSval=6559072 TSecr=5962688
  119 7.709246765 192.168.1.16 → 10.6.15.144  SSH 1314 Client: Encrypted packet (len=1248)
  120 7.716967111  10.6.15.144 → 192.168.1.16 SSH 138 Server: Encrypted packet (len=72)
  121 7.734242657 10.22.19.172 → 224.0.0.252  LLMNR 64 Standard query 0x9d1d A wpad
  122 7.760033153 192.168.1.16 → 10.6.15.144  TCP 66 59298 → 22 [ACK] Seq=12493 Ack=10961 Win=6155 Len=0 TSval=5962708 TSecr=6559073
  123 7.782803849  10.6.15.144 → 192.168.1.16 SSH 422 Server: Encrypted packet (len=356)
  124 7.782828101 192.168.1.16 → 10.6.15.144  TCP 66 59298 → 22 [ACK] Seq=12493 Ack=11317 Win=6155 Len=0 TSval=5962713 TSecr=6559090
  125 7.809555281  10.6.15.144 → 192.168.1.16 SSH 198 Server: Encrypted packet (len=132)
  126 7.809571326 192.168.1.16 → 10.6.15.144  TCP 66 59298 → 22 [ACK] Seq=12493 Ack=11449 Win=6155 Len=0 TSval=5962720 TSecr=6559097
  127 7.813676809  10.6.15.144 → 192.168.1.16 SSH 294 Server: Encrypted packet (len=228)
  128 7.813698491 192.168.1.16 → 10.6.15.144  TCP 66 59298 → 22 [ACK] Seq=12493 Ack=11677 Win=6155 Len=0 TSval=5962721 TSecr=6559098
  129 7.843508048  10.6.15.144 → 192.168.1.16 SSH 1374 Server: Encrypted packet (len=1308)
  130 7.843525028 192.168.1.16 → 10.6.15.144  TCP 66 59298 → 22 [ACK] Seq=12493 Ack=12985 Win=6155 Len=0 TSval=5962728 TSecr=6559105
  131 7.857705759  10.6.15.144 → 192.168.1.16 SSH 798 Server: Encrypted packet (len=732)
  132 7.857779083 192.168.1.16 → 10.6.15.144  TCP 66 59298 → 22 [ACK] Seq=12493 Ack=13717 Win=6155 Len=0 TSval=5962732 TSecr=6559109
  133 7.897067836  10.6.15.144 → 192.168.1.16 SSH 134 Server: Encrypted packet (len=68)
  134 7.897138092 192.168.1.16 → 10.6.15.144  TCP 66 59298 → 22 [ACK] Seq=12493 Ack=13785 Win=6155 Len=0 TSval=5962742 TSecr=6559119
  135 7.928126328 192.168.1.16 → 10.6.15.144  SSH 246 Client: Encrypted packet (len=180)
  136 7.936018890 192.168.1.16 → 10.6.15.144  TCP 246 [TCP Retransmission] 59298 → 22 [PSH, ACK] Seq=12493 Ack=13785 Win=6155 Len=180 TSval=5962752 TSecr=6559119
  137 7.978720426  10.6.15.144 → 192.168.1.16 TCP 78 [TCP Dup ACK 118#1] 22 → 59298 [ACK] Seq=13785 Ack=11245 Win=1452 Len=0 TSval=6559139 TSecr=5962688 SLE=12493 SRE=12673
  138 8.164007269 192.168.1.16 → 10.6.15.144  TCP 1314 [TCP Retransmission] 59298 → 22 [PSH, ACK] Seq=11245 Ack=13785 Win=6155 Len=1248 TSval=5962809 TSecr=6559139
  139 8.171860819  10.6.15.144 → 192.168.1.16 SSH 1178 Server: Encrypted packet (len=1100)
  140 8.172041323  10.6.15.144 → 192.168.1.16 SSH 1482 Server: Encrypted packet (len=1404)
  141 8.172056357 192.168.1.16 → 10.6.15.144  TCP 66 59298 → 22 [ACK] Seq=12673 Ack=16289 Win=6155 Len=0 TSval=5962811 TSecr=6559178
  142 8.172073085 10.22.19.172 → 224.0.0.252  LLMNR 64 Standard query 0x9d1d A wpad
  143 8.191297919  10.6.15.144 → 192.168.1.16 TCP 66 22 → 59298 [ACK] Seq=16289 Ack=12673 Win=1451 Len=0 TSval=6559190 TSecr=5962809
  144 8.191317045  10.6.15.144 → 192.168.1.16 SSH 102 Server: Encrypted packet (len=36)
  145 8.232002002 192.168.1.16 → 10.6.15.144  TCP 66 59298 → 22 [ACK] Seq=12673 Ack=16325 Win=6155 Len=0 TSval=5962826 TSecr=6559190
  146 8.265001889  10.6.15.144 → 192.168.1.16 SSH 150 Server: Encrypted packet (len=84)
  147 8.265091837 192.168.1.16 → 10.6.15.144  TCP 66 59298 → 22 [ACK] Seq=12673 Ack=16409 Win=6155 Len=0 TSval=5962834 TSecr=6559212
  148 8.278671911  10.6.15.144 → 192.168.1.16 SSH 198 Server: Encrypted packet (len=132)
  149 8.278784654 192.168.1.16 → 10.6.15.144  TCP 66 59298 → 22 [ACK] Seq=12673 Ack=16541 Win=6155 Len=0 TSval=5962837 TSecr=6559215
  150 9.761991649  10.6.15.144 → 192.168.1.16 SSH 334 Server: Encrypted packet (len=268)
  151 9.762017422 192.168.1.16 → 10.6.15.144  TCP 66 59298 → 22 [ACK] Seq=12673 Ack=16809 Win=6155 Len=0 TSval=5963208 TSecr=6559325
  152 9.762058093  10.6.15.144 → 192.168.1.16 SSH 838 Server: Encrypted packet (len=772)
  153 9.762064211 192.168.1.16 → 10.6.15.144  TCP 66 59298 → 22 [ACK] Seq=12673 Ack=17581 Win=6155 Len=0 TSval=5963208 TSecr=6559361
  154 9.762149157  10.6.15.144 → 192.168.1.16 SSH 798 Server: Encrypted packet (len=732)
  155 9.762154576 192.168.1.16 → 10.6.15.144  TCP 66 59298 → 22 [ACK] Seq=12673 Ack=18313 Win=6155 Len=0 TSval=5963208 TSecr=6559382
  156 9.763371669 192.168.1.16 → 10.6.15.144  SSH 134 Client: Encrypted packet (len=68)
  157 9.778407820 192.168.1.16 → 10.6.15.144  SSH 1078 Client: Encrypted packet (len=1012)
  158 9.827999933 192.168.1.16 → 10.6.15.144  SSH 138 Client: Encrypted packet (len=72)
  159 9.837052337  10.6.15.144 → 192.168.1.16 SSH 798 Server: [TCP Spurious Retransmission] , Encrypted packet (len=732)
  160 9.837071554 192.168.1.16 → 10.6.15.144  TCP 78 [TCP Dup ACK 155#1] 59298 → 22 [ACK] Seq=13825 Ack=18313 Win=6155 Len=0 TSval=5963227 TSecr=6559411 SLE=17581 SRE=18313
  161 9.837185186  10.6.15.144 → 192.168.1.16 SSH 1106 Server: [TCP Spurious Retransmission] , Encrypted packet (len=1040)
  162 9.837192194 192.168.1.16 → 10.6.15.144  TCP 78 [TCP Dup ACK 155#2] 59298 → 22 [ACK] Seq=13825 Ack=18313 Win=6155 Len=0 TSval=5963227 TSecr=6559411 SLE=16541 SRE=17581
  163 9.853577179  10.6.15.144 → 192.168.1.16 TCP 78 [TCP Dup ACK 143#1] 22 → 59298 [ACK] Seq=18313 Ack=12673 Win=1452 Len=0 TSval=6559605 TSecr=5962837 SLE=13753 SRE=13825
  164 9.996078271 192.168.1.16 → 10.6.15.144  TCP 1146 [TCP Retransmission] 59298 → 22 [PSH, ACK] Seq=12673 Ack=18313 Win=6155 Len=1080 TSval=5963265 TSecr=6559605
  165 10.018057160  10.6.15.144 → 192.168.1.16 TCP 66 22 → 59298 [ACK] Seq=18313 Ack=13825 Win=1451 Len=0 TSval=6559649 TSecr=5963265
  166 10.096136604  10.6.15.144 → 192.168.1.16 SSH 102 Server: Encrypted packet (len=36)
  167 10.096161079 192.168.1.16 → 10.6.15.144  TCP 66 59298 → 22 [ACK] Seq=13825 Ack=18349 Win=6155 Len=0 TSval=5963292 TSecr=6559669
  168 10.096485548 192.168.1.16 → 10.6.15.144  SSH 158 Client: Encrypted packet (len=92)
  169 10.107330611  10.6.15.144 → 192.168.1.16 TCP 66 22 → 59298 [ACK] Seq=18349 Ack=13917 Win=1452 Len=0 TSval=6559671 TSecr=5963292
  170 10.111480031  10.6.15.144 → 192.168.1.16 SSH 102 Server: Encrypted packet (len=36)
  171 10.111756771 192.168.1.16 → 10.6.15.144  SSH 158 Client: Encrypted packet (len=92)
  172 10.201954335  10.6.15.144 → 192.168.1.16 SSH 686 Server: Encrypted packet (len=620)
  173 10.204096583 192.168.1.16 → 10.6.15.144  SSH 1110 Client: Encrypted packet (len=1044)
  174 10.247915923  10.6.15.144 → 192.168.1.16 SSH 182 Server: Encrypted packet (len=116)
  175 10.288051460 192.168.1.16 → 10.6.15.144  TCP 66 59298 → 22 [ACK] Seq=15053 Ack=19121 Win=6155 Len=0 TSval=5963340 TSecr=6559705
  176 10.296007923 192.168.1.16 → 10.6.15.144  SSH 1146 Client: Encrypted packet (len=1080)
  177 10.397568387  10.6.15.144 → 192.168.1.16 TCP 78 [TCP Dup ACK 169#1] 22 → 59298 [ACK] Seq=19121 Ack=13917 Win=1452 Len=0 TSval=6559744 TSecr=5963292 SLE=15053 SRE=16133
  178 10.540023105 192.168.1.16 → 10.6.15.144  TCP 1202 [TCP Retransmission] 59298 → 22 [PSH, ACK] Seq=13917 Ack=19121 Win=6155 Len=1136 TSval=5963399 TSecr=6559744
  179 11.008027729 192.168.1.16 → 10.6.15.144  TCP 1202 [TCP Retransmission] 59298 → 22 [PSH, ACK] Seq=13917 Ack=19121 Win=6155 Len=1136 TSval=5963520 TSecr=6559744
  180 11.023234970  10.6.15.144 → 192.168.1.16 TCP 66 22 → 59298 [ACK] Seq=19121 Ack=16133 Win=1446 Len=0 TSval=6559900 TSecr=5963520
  181 11.023257318 192.168.1.16 → 10.6.15.144  SSH 1318 Client: Encrypted packet (len=1252)
  182 11.035590498  10.6.15.144 → 192.168.1.16 TCP 66 22 → 59298 [ACK] Seq=19121 Ack=17385 Win=1452 Len=0 TSval=6559904 TSecr=5963523
  183 11.127390185  10.6.15.144 → 192.168.1.16 SSH 182 Server: Encrypted packet (len=116)
  184 11.127410206 192.168.1.16 → 10.6.15.144  TCP 66 59298 → 22 [ACK] Seq=17385 Ack=19237 Win=6155 Len=0 TSval=5963549 TSecr=6559927
  185 11.127755141 192.168.1.16 → 10.6.15.144  SSH 134 Client: Encrypted packet (len=68)
  186 11.137122562  10.6.15.144 → 192.168.1.16 SSH 222 Server: Encrypted packet (len=156)
  187 11.143381955  10.6.15.144 → 192.168.1.16 TCP 66 22 → 59298 [ACK] Seq=19393 Ack=17453 Win=1452 Len=0 TSval=6559930 TSecr=5963549
  188 11.180000316 192.168.1.16 → 10.6.15.144  TCP 66 59298 → 22 [ACK] Seq=17453 Ack=19393 Win=6155 Len=0 TSval=5963563 TSecr=6559929
  189 12.739177295  10.6.15.144 → 192.168.1.16 SSH 1514 Server: Encrypted packet (len=1448)
  190 12.739198121 192.168.1.16 → 10.6.15.144  TCP 66 59298 → 22 [ACK] Seq=17453 Ack=20841 Win=6155 Len=0 TSval=5963952 TSecr=6560017
  191 12.739279331  10.6.15.144 → 192.168.1.16 SSH 918 Server: Encrypted packet (len=852)
  192 12.739286033 192.168.1.16 → 10.6.15.144  TCP 66 59298 → 22 [ACK] Seq=17453 Ack=21693 Win=6155 Len=0 TSval=5963952 TSecr=6560017
  193 12.739474309  10.6.15.144 → 192.168.1.16 SSH 1514 Server: Encrypted packet (len=1448)
  194 12.739480467 192.168.1.16 → 10.6.15.144  TCP 66 59298 → 22 [ACK] Seq=17453 Ack=23141 Win=6155 Len=0 TSval=5963952 TSecr=6560020
  195 12.739783833  10.6.15.144 → 192.168.1.16 SSH 1318 Server: Encrypted packet (len=1252)
  196 12.739791211 192.168.1.16 → 10.6.15.144  TCP 66 59298 → 22 [ACK] Seq=17453 Ack=24393 Win=6155 Len=0 TSval=5963952 TSecr=6560086
  197 12.739800435 10.22.17.102 → 224.0.0.252  LLMNR 64 Standard query 0x0545 A wpad
  198 12.739812038 10.22.17.102 → 224.0.0.252  LLMNR 64 Standard query 0x0545 A wpad
  199 13.200521847 192.168.1.16 → 10.6.15.144  SSH 230 Client: Encrypted packet (len=164)
  200 13.212426821  10.6.15.144 → 192.168.1.16 TCP 66 22 → 59298 [ACK] Seq=24393 Ack=17617 Win=1452 Len=0 TSval=6560448 TSecr=5964068
  201 13.439756127 192.168.1.16 → 192.168.1.1  DNS 81 Standard query 0x7013 A 1.ubuntu.pool.ntp.org
  202 13.450549174  192.168.1.1 → 192.168.1.16 DNS 145 Standard query response 0x7013 A 1.ubuntu.pool.ntp.org A 139.59.21.22 A 52.66.5.185 A 123.108.200.124 A 139.59.50.38
  203 13.451030224 192.168.1.16 → 139.59.21.22 NTP 90 NTP Version 4, client
  204 14.152912645 192.168.1.16 → 10.6.15.144  SSH 1514 Client: Encrypted packet (len=1448)
  205 14.156521011 192.168.1.16 → 10.6.15.144  SSH 382 Client: Encrypted packet (len=316)
  206 14.157782380  10.6.15.144 → 192.168.1.16 SSH 302 Server: Encrypted packet (len=236)
  207 14.157798297 192.168.1.16 → 10.6.15.144  TCP 66 59298 → 22 [ACK] Seq=19381 Ack=24629 Win=6155 Len=0 TSval=5964307 TSecr=6560555
  208 14.166452893  10.6.15.144 → 192.168.1.16 TCP 66 22 → 59298 [ACK] Seq=24629 Ack=19065 Win=1452 Len=0 TSval=6560686 TSecr=5964306
  209 14.166477728 192.168.1.16 → 10.6.15.144  SSH 134 Client: Encrypted packet (len=68)
  210 14.167431634  10.6.15.144 → 192.168.1.16 TCP 66 22 → 59298 [ACK] Seq=24629 Ack=19381 Win=1452 Len=0 TSval=6560686 TSecr=5964307
  211 14.171039706  10.6.15.144 → 192.168.1.16 SSH 134 Server: Encrypted packet (len=68)
  212 14.211733981  10.6.15.144 → 192.168.1.16 TCP 66 22 → 59298 [ACK] Seq=24697 Ack=19449 Win=1452 Len=0 TSval=6560699 TSecr=5964309
  213 14.212003849 192.168.1.16 → 10.6.15.144  TCP 66 59298 → 22 [ACK] Seq=19449 Ack=24697 Win=6155 Len=0 TSval=5964321 TSecr=6560687
  214 14.283311665  10.6.15.144 → 192.168.1.16 SSH 934 Server: Encrypted packet (len=868)
  215 14.283338468 192.168.1.16 → 10.6.15.144  TCP 66 59298 → 22 [ACK] Seq=19449 Ack=25565 Win=6155 Len=0 TSval=5964338 TSecr=6560716
  216 14.283448040  10.6.15.144 → 192.168.1.16 SSH 670 Server: Encrypted packet (len=604)
  217 14.283452616 192.168.1.16 → 10.6.15.144  TCP 66 59298 → 22 [ACK] Seq=19449 Ack=26169 Win=6155 Len=0 TSval=5964338 TSecr=6560716
  218 14.284029037 192.168.1.16 → 10.6.15.144  SSH 134 Client: Encrypted packet (len=68)
  219 14.295246154  10.6.15.144 → 192.168.1.16 TCP 66 22 → 59298 [ACK] Seq=26169 Ack=19517 Win=1452 Len=0 TSval=6560718 TSecr=5964339
  220 15.998920750 192.168.1.16 → 10.6.15.144  SSH 102 Client: Encrypted packet (len=36)
  221 16.000356194 192.168.1.16 → 10.6.15.144  SSH 318 Client: Encrypted packet (len=252)
  222 16.006450199  10.6.15.144 → 192.168.1.16 TCP 66 22 → 59298 [ACK] Seq=26169 Ack=19553 Win=1452 Len=0 TSval=6561147 TSecr=5964767
  223 16.007640194  10.6.15.144 → 192.168.1.16 TCP 66 22 → 59298 [ACK] Seq=26169 Ack=19805 Win=1452 Len=0 TSval=6561147 TSecr=5964768
  224 16.044378331  10.6.15.144 → 192.168.1.16 SSH 126 Server: Encrypted packet (len=60)
  225 16.044401375  10.6.15.144 → 192.168.1.16 SSH 138 Server: Encrypted packet (len=72)
  226 16.044464257 192.168.1.16 → 10.6.15.144  TCP 66 59298 → 22 [ACK] Seq=19805 Ack=26301 Win=6155 Len=0 TSval=5964779 TSecr=6561156
  227 16.044641771 192.168.1.16 → 10.6.15.144  SSH 102 Client: Encrypted packet (len=36)
  228 16.059611768  10.6.15.144 → 192.168.1.16 SSH 138 Server: Encrypted packet (len=72)
  229 16.060064347 192.168.1.16 → 10.6.15.144  SSH 390 Client: Encrypted packet (len=324)
  230 16.061255337 192.168.1.16 → 10.6.15.144  SSH 158 Client: Encrypted packet (len=92)
  231 16.070546207  10.6.15.144 → 192.168.1.16 TCP 66 22 → 59298 [ACK] Seq=26373 Ack=20257 Win=1452 Len=0 TSval=6561162 TSecr=5964783
  232 16.120199780  10.6.15.144 → 192.168.1.16 SSH 354 Server: Encrypted packet (len=288)
  233 16.120472518 192.168.1.16 → 10.6.15.144  SSH 134 Client: Encrypted packet (len=68)
  234 16.120754749 192.168.1.16 → 10.6.15.144  SSH 134 Client: Encrypted packet (len=68)
  235 16.120954207 192.168.1.16 → 10.6.15.144  SSH 274 Client: Encrypted packet (len=208)
  236 16.121233827 192.168.1.16 → 10.6.15.144  SSH 470 Client: Encrypted packet (len=404)
  237 16.131100989  10.6.15.144 → 192.168.1.16 TCP 66 22 → 59298 [ACK] Seq=26661 Ack=20393 Win=1452 Len=0 TSval=6561177 TSecr=5964798
  238 16.131121016 192.168.1.16 → 10.6.15.144  SSH 542 Client: Encrypted packet (len=476)
  239 16.131134306  10.6.15.144 → 192.168.1.16 TCP 66 22 → 59298 [ACK] Seq=26661 Ack=21005 Win=1452 Len=0 TSval=6561178 TSecr=5964798
  240 16.140696071  10.6.15.144 → 192.168.1.16 SSH 102 Server: Encrypted packet (len=36)
  241 16.141027931 192.168.1.16 → 10.6.15.144  SSH 166 Client: Encrypted packet (len=100)
  242 16.178610732  10.6.15.144 → 192.168.1.16 SSH 174 Server: Encrypted packet (len=108)
  243 16.178906928 192.168.1.16 → 10.6.15.144  SSH 134 Client: Encrypted packet (len=68)
  244 16.199167760  10.22.18.17 → 224.0.0.252  LLMNR 65 Standard query 0x57d1 ANY PCABI
  245 16.202656657  10.6.15.144 → 192.168.1.16 SSH 182 Server: Encrypted packet (len=116)
  246 16.203000112 192.168.1.16 → 10.6.15.144  SSH 134 Client: Encrypted packet (len=68)
  247 16.251343453  10.6.15.144 → 192.168.1.16 TCP 66 22 → 59298 [ACK] Seq=26921 Ack=21717 Win=1452 Len=0 TSval=6561208 TSecr=5964818
  248 17.761909985  10.22.18.17 → 224.0.0.252  LLMNR 65 Standard query 0x57d1 ANY PCABI
  249 17.762075141  10.6.15.144 → 192.168.1.16 SSH 1302 Server: Encrypted packet (len=1236)
  250 17.762091234  10.6.15.144 → 192.168.1.16 SSH 454 Server: Encrypted packet (len=388)
  251 17.762099374 192.168.1.16 → 10.6.15.144  TCP 66 59298 → 22 [ACK] Seq=21717 Ack=28545 Win=6155 Len=0 TSval=5965208 TSecr=6561316
  252 17.763026973 192.168.1.16 → 10.6.15.144  SSH 134 Client: Encrypted packet (len=68)
  253 17.796966947  10.6.15.144 → 192.168.1.16 SSH 398 Server: Encrypted packet (len=332)
  254 17.797014111  10.6.15.144 → 192.168.1.16 TCP 398 [TCP Retransmission] 22 → 59298 [PSH, ACK] Seq=28545 Ack=21717 Win=1452 Len=332 TSval=6561410 TSecr=5964818
  255 17.797024316 192.168.1.16 → 10.6.15.144  TCP 78 59298 → 22 [ACK] Seq=21785 Ack=28877 Win=6155 Len=0 TSval=5965217 TSecr=6561410 SLE=28545 SRE=28877
  256 17.797694023 192.168.1.16 → 10.6.15.144  SSH 134 Client: Encrypted packet (len=68)
  257 17.845053864 192.168.1.16 → 10.6.15.144  SSH 1382 Client: Encrypted packet (len=1316)
  258 17.851336151 192.168.1.16 → 10.6.15.144  SSH 1514 Client: Encrypted packet (len=1448)
  259 17.900002943 192.168.1.16 → 10.6.15.144  SSH 1514 Client: Encrypted packet (len=1448)
  260 18.128036925 192.168.1.16 → 10.6.15.144  TCP 202 [TCP Retransmission] 59298 → 22 [PSH, ACK] Seq=21717 Ack=28877 Win=6155 Len=136 TSval=5965300 TSecr=6561410
  261 18.139005228  10.6.15.144 → 192.168.1.16 TCP 66 22 → 59298 [ACK] Seq=28877 Ack=21853 Win=1452 Len=0 TSval=6561680 TSecr=5965300
  262 18.139027135 192.168.1.16 → 10.6.15.144  SSH 134 Client: Encrypted packet (len=68)
  263 18.148346368  10.6.15.144 → 192.168.1.16 TCP 78 [TCP Dup ACK 261#1] 22 → 59298 [ACK] Seq=28877 Ack=21853 Win=1452 Len=0 TSval=6561682 TSecr=5965300 SLE=26065 SRE=26133
  264 18.148368036 192.168.1.16 → 10.6.15.144  TCP 1382 [TCP Retransmission] 59298 → 22 [PSH, ACK] Seq=21853 Ack=28877 Win=6155 Len=1316 TSval=5965305 TSecr=6561682
  265 18.148382189 192.168.1.16 → 10.6.15.144  TCP 1514 [TCP Retransmission] 59298 → 22 [ACK] Seq=23169 Ack=28877 Win=6155 Len=1448 TSval=5965305 TSecr=6561682
  266 18.160680656  10.6.15.144 → 192.168.1.16 TCP 78 22 → 59298 [ACK] Seq=28877 Ack=23169 Win=1451 Len=0 TSval=6561685 TSecr=5965305 SLE=26065 SRE=26133
  267 18.160701041 192.168.1.16 → 10.6.15.144  TCP 1514 [TCP Retransmission] 59298 → 22 [ACK] Seq=24617 Ack=28877 Win=6155 Len=1448 TSval=5965308 TSecr=6561685
  268 18.163882441  10.6.15.144 → 192.168.1.16 TCP 78 22 → 59298 [ACK] Seq=28877 Ack=24617 Win=1451 Len=0 TSval=6561686 TSecr=5965305 SLE=26065 SRE=26133
  269 18.173473549  10.6.15.144 → 192.168.1.16 TCP 66 22 → 59298 [ACK] Seq=28877 Ack=26133 Win=1451 Len=0 TSval=6561688 TSecr=5965308
  270 18.261280140  10.6.15.144 → 192.168.1.16 SSH 222 Server: Encrypted packet (len=156)
  271 18.267836239  10.6.15.144 → 192.168.1.16 SSH 198 Server: Encrypted packet (len=132)
  272 18.267899951 192.168.1.16 → 10.6.15.144  TCP 66 59298 → 22 [ACK] Seq=26133 Ack=29165 Win=6155 Len=0 TSval=5965334 TSecr=6561710
  273 18.271547664  10.6.15.144 → 192.168.1.16 SSH 198 Server: Encrypted packet (len=132)
  274 18.278383965  10.6.15.144 → 192.168.1.16 SSH 198 Server: Encrypted packet (len=132)
  275 18.278452930 192.168.1.16 → 10.6.15.144  TCP 66 59298 → 22 [ACK] Seq=26133 Ack=29429 Win=6155 Len=0 TSval=5965337 TSecr=6561713
  276 19.746107044 10.22.17.102 → 224.0.0.252  LLMNR 75 Standard query 0x20a6 ANY DESKTOP-M969638
  277 19.746152184 10.22.17.102 → 224.0.0.252  LLMNR 70 Standard query 0x0fa7 A ykfzmrbszd
  278 19.746167010 10.22.17.102 → 224.0.0.252  LLMNR 67 Standard query 0x3c39 A nmphivh
  279 19.746682509 10.22.17.102 → 224.0.0.252  LLMNR 72 Standard query 0x6514 A pcsrfxchture
  280 19.746706934 10.22.17.102 → 224.0.0.252  LLMNR 75 Standard query 0x20a6 ANY DESKTOP-M969638
  281 19.750899989 10.22.17.102 → 224.0.0.252  LLMNR 70 Standard query 0x0fa7 A ykfzmrbszd
  282 19.750939529 10.22.17.102 → 224.0.0.252  LLMNR 67 Standard query 0x3c39 A nmphivh
  283 19.751161087 10.22.17.102 → 224.0.0.252  LLMNR 72 Standard query 0x6514 A pcsrfxchture
  284 20.740128374 10.22.17.102 → 224.0.0.252  LLMNR 75 Standard query 0xbf32 ANY DESKTOP-M969638
  285 20.740146685 10.22.17.102 → 224.0.0.252  LLMNR 64 Standard query 0x1f2d A wpad
  286 20.740151030 10.22.17.102 → 224.0.0.252  LLMNR 64 Standard query 0xbe7b A wpad
  287 20.742558033 10.22.17.102 → 224.0.0.252  LLMNR 75 Standard query 0xbf32 ANY DESKTOP-M969638
  288 20.776095747 10.22.17.102 → 224.0.0.252  LLMNR 64 Standard query 0x1f2d A wpad
  289 20.783143793 10.22.17.102 → 224.0.0.252  LLMNR 64 Standard query 0xbe7b A wpad
  290 21.729999142  10.6.15.144 → 192.168.1.16 SSH 174 Server: Encrypted packet (len=108)
  291 21.730036477  10.6.15.144 → 192.168.1.16 SSH 102 Server: Encrypted packet (len=36)
  292 21.730043142 10.22.17.102 → 224.0.0.252  LLMNR 73 Standard query 0xbb67 A lhzxctlcocpeu
  293 21.730111552 192.168.1.16 → 10.6.15.144  TCP 66 59298 → 22 [ACK] Seq=26133 Ack=29573 Win=6155 Len=0 TSval=5966200 TSecr=6562372
  294 21.730337867 192.168.1.16 → 10.6.15.144  SSH 138 Client: Encrypted packet (len=72)
  295 21.731008743 10.22.17.102 → 224.0.0.252  LLMNR 68 Standard query 0x9088 A cbmiudcr
  296 21.731031919 10.22.17.102 → 224.0.0.252  LLMNR 72 Standard query 0x128c A ljlslgmbuasl
  297 21.731038444 10.22.17.102 → 224.0.0.252  LLMNR 75 Standard query 0x8216 ANY DESKTOP-M969638
  298 21.731044777  10.6.15.144 → 192.168.1.16 SSH 102 Server: [TCP Spurious Retransmission] , Encrypted packet (len=36)
  299 21.731060027 192.168.1.16 → 10.6.15.144  TCP 78 [TCP Dup ACK 293#1] 59298 → 22 [ACK] Seq=26205 Ack=29573 Win=6155 Len=0 TSval=5966200 TSecr=6562472 SLE=29537 SRE=29573
  300 21.731072271 10.22.17.102 → 224.0.0.252  LLMNR 73 Standard query 0xbb67 A lhzxctlcocpeu
  301 21.731076767 10.22.17.102 → 224.0.0.252  LLMNR 72 Standard query 0x128c A ljlslgmbuasl
  302 21.731080367 10.22.17.102 → 224.0.0.252  LLMNR 68 Standard query 0x9088 A cbmiudcr
  303 21.731084723 10.22.17.102 → 224.0.0.252  LLMNR 75 Standard query 0x8216 ANY DESKTOP-M969638
  304 21.738846924  10.6.15.144 → 192.168.1.16 TCP 66 22 → 59298 [ACK] Seq=29573 Ack=26205 Win=1452 Len=0 TSval=6562580 TSecr=5966200
  305 21.738864068  10.6.15.144 → 192.168.1.16 SSH 102 Server: Encrypted packet (len=36)
  306 21.738872628 192.168.1.16 → 10.6.15.144  TCP 66 59298 → 22 [ACK] Seq=26205 Ack=29609 Win=6155 Len=0 TSval=5966202 TSecr=6562580
  307 22.722068474 10.22.17.102 → 224.0.0.252  LLMNR 75 Standard query 0x5e40 ANY DESKTOP-M969638
  308 22.722087238 10.22.17.102 → 224.0.0.252  LLMNR 75 Standard query 0x5e40 ANY DESKTOP-M969638
  309 22.838904026  10.6.15.144 → 192.168.1.16 SSH 166 Server: Encrypted packet (len=100)
  310 22.838931704  10.6.15.144 → 192.168.1.16 SSH 138 Server: Encrypted packet (len=72)
  311 22.844073611 192.168.1.16 → 10.6.15.144  TCP 66 59298 → 22 [ACK] Seq=26205 Ack=29709 Win=6155 Len=0 TSval=5966477 TSecr=6562855
  312 22.844092151 192.168.1.16 → 10.6.15.144  TCP 66 59298 → 22 [ACK] Seq=26205 Ack=29781 Win=6155 Len=0 TSval=5966477 TSecr=6562855
  313 22.844096929 192.168.1.16 → 10.6.15.144  SSH 102 Client: Encrypted packet (len=36)
  314 22.914926097  10.6.15.144 → 192.168.1.16 TCP 66 22 → 59298 [ACK] Seq=29781 Ack=26241 Win=1452 Len=0 TSval=6562874 TSecr=5966477
  315 23.777931551 10.22.17.102 → 224.0.0.252  LLMNR 64 Standard query 0xb71a A wpad
  316 23.777949184 10.22.17.102 → 224.0.0.252  LLMNR 64 Standard query 0xfbcc A wpad
  317 23.804497725  10.22.18.17 → 224.0.0.252  LLMNR 64 Standard query 0x88f3 A wpad
  318 23.804948503  10.22.18.17 → 224.0.0.252  LLMNR 64 Standard query 0xd6ef AAAA wpad
  319 23.825861959 10.22.17.102 → 224.0.0.252  LLMNR 64 Standard query 0xfbcc A wpad
  320 23.825880935 10.22.17.102 → 224.0.0.252  LLMNR 64 Standard query 0xb71a A wpad
  321 24.740490234  10.22.18.17 → 224.0.0.252  LLMNR 64 Standard query 0x88f3 A wpad
  322 24.740508048  10.22.18.17 → 224.0.0.252  LLMNR 64 Standard query 0xd6ef AAAA wpad
  323 25.439632847 192.168.1.16 → 192.168.1.1  DNS 81 Standard query 0x66f6 A 3.ubuntu.pool.ntp.org
  324 25.451386105  192.168.1.1 → 192.168.1.16 DNS 145 Standard query response 0x66f6 A 3.ubuntu.pool.ntp.org A 123.108.200.124 A 139.59.21.22 A 139.59.50.38 A 52.66.5.185
  325 25.451856406 192.168.1.16 → 123.108.200.124 NTP 90 NTP Version 4, client
  326 26.754002746  192.168.1.1 → 224.0.0.1    IGMPv2 42 Membership Query, general
  327 28.739958469 10.22.17.102 → 224.0.0.252  LLMNR 71 Standard query 0x025c A rphfjacufzh
  328 28.739975630 10.22.17.102 → 224.0.0.252  LLMNR 75 Standard query 0x69a8 A oyuibpeutwttikw
  329 28.739979235 10.22.17.102 → 224.0.0.252  LLMNR 74 Standard query 0x7cbb A jxvqqpqeeovsan
  330 28.840777979 10.22.17.102 → 224.0.0.252  LLMNR 71 Standard query 0x025c A rphfjacufzh
  331 29.762056215 10.22.17.102 → 224.0.0.252  LLMNR 75 Standard query 0x69a8 A oyuibpeutwttikw
  332 29.762088073 10.22.17.102 → 224.0.0.252  LLMNR 74 Standard query 0x7cbb A jxvqqpqeeovsan
  333 31.768142909 192.168.1.16 → 224.0.0.251  IGMPv2 46 Membership Report group 224.0.0.251
