    1 0.000000000  10.6.15.156 → 192.168.1.12 TCP 66 22 → 54766 [ACK] Seq=1 Ack=1 Win=1452 Len=0 TSval=15307547 TSecr=8376034
    2 0.189229391  10.6.15.156 → 192.168.1.12 SSH 1514 Server: Encrypted packet (len=1448)
    3 0.189271543  10.6.15.156 → 192.168.1.12 SSH 910 Server: Encrypted packet (len=844)
    4 0.189281644 192.168.1.12 → 10.6.15.156  TCP 66 54766 → 22 [ACK] Seq=1 Ack=2293 Win=6155 Len=0 TSval=8376091 TSecr=15307594
    5 0.189719736  10.6.15.156 → 192.168.1.12 SSH 206 Server: Encrypted packet (len=140)
    6 0.190059374 192.168.1.12 → 10.6.15.156  SSH 422 Client: Encrypted packet (len=356)
    7 0.190804265  10.6.15.156 → 192.168.1.12 SSH 206 Server: Encrypted packet (len=140)
    8 0.192694084  10.6.15.156 → 192.168.1.12 TCP 66 22 → 54766 [ACK] Seq=2573 Ack=357 Win=1452 Len=0 TSval=15307595 TSecr=8376091
    9 0.192715354 192.168.1.12 → 10.6.15.156  SSH 746 Client: Encrypted packet (len=680)
   10 0.194685975  10.6.15.156 → 192.168.1.12 TCP 66 22 → 54766 [ACK] Seq=2573 Ack=1037 Win=1452 Len=0 TSval=15307595 TSecr=8376092
   11 0.199049555  10.6.15.156 → 192.168.1.12 SSH 814 Server: Encrypted packet (len=748)
   12 0.199069748  10.6.15.156 → 192.168.1.12 SSH 142 Server: Encrypted packet (len=76)
   13 0.199135896 192.168.1.12 → 10.6.15.156  TCP 66 54766 → 22 [ACK] Seq=1037 Ack=3397 Win=6155 Len=0 TSval=8376093 TSecr=15307596
   14 0.229102710  10.6.15.156 → 192.168.1.12 SSH 1126 Server: Encrypted packet (len=1060)
   15 0.229903029 192.168.1.12 → 10.6.15.156  SSH 406 Client: Encrypted packet (len=340)
   16 0.231365306  10.6.15.156 → 192.168.1.12 SSH 1190 Server: Encrypted packet (len=1124)
   17 0.231733977  10.6.15.156 → 192.168.1.12 SSH 206 Server: Encrypted packet (len=140)
   18 0.231769425 192.168.1.12 → 10.6.15.156  TCP 66 54766 → 22 [ACK] Seq=1377 Ack=5721 Win=6155 Len=0 TSval=8376102 TSecr=15307604
   19 0.232508295 192.168.1.12 → 10.6.15.156  SSH 430 Client: Encrypted packet (len=364)
   20 0.236318842  10.6.15.156 → 192.168.1.12 SSH 1134 Server: Encrypted packet (len=1068)
   21 0.236337903 192.168.1.12 → 10.6.15.156  SSH 430 Client: Encrypted packet (len=364)
   22 0.236353053  10.6.15.156 → 192.168.1.12 SSH 354 Server: Encrypted packet (len=288)
   23 0.236768748 192.168.1.12 → 10.6.15.156  SSH 134 Client: Encrypted packet (len=68)
   24 0.238269128  10.6.15.156 → 192.168.1.12 TCP 66 22 → 54766 [ACK] Seq=7077 Ack=2173 Win=1452 Len=0 TSval=15307606 TSecr=8376102
   25 0.238394375 192.168.1.12 → 10.6.15.156  SSH 406 Client: Encrypted packet (len=340)
   26 0.240984786  10.6.15.156 → 192.168.1.12 SSH 1514 Server: Encrypted packet (len=1448)
   27 0.241007281 192.168.1.12 → 10.6.15.156  SSH 406 Client: Encrypted packet (len=340)
   28 0.241177979  10.6.15.156 → 192.168.1.12 SSH 1514 Server: Encrypted packet (len=1448)
   29 0.241803796  10.6.15.156 → 192.168.1.12 SSH 230 Server: Encrypted packet (len=164)
   30 0.241809182 192.168.1.12 → 10.6.15.156  TCP 66 54766 → 22 [ACK] Seq=2853 Ack=10137 Win=6155 Len=0 TSval=8376104 TSecr=15307607
   31 0.242054078  10.6.15.156 → 192.168.1.12 SSH 1514 Server: Encrypted packet (len=1448)
   32 0.242265852  10.6.15.156 → 192.168.1.12 SSH 1514 Server: Encrypted packet (len=1448)
   33 0.242271173 192.168.1.12 → 10.6.15.156  TCP 66 54766 → 22 [ACK] Seq=2853 Ack=13033 Win=6155 Len=0 TSval=8376104 TSecr=15307607
   34 0.243467861  10.6.15.156 → 192.168.1.12 SSH 1514 Server: Encrypted packet (len=1448)
   35 0.243680149  10.6.15.156 → 192.168.1.12 SSH 1514 Server: Encrypted packet (len=1448)
   36 0.243687324 192.168.1.12 → 10.6.15.156  TCP 66 54766 → 22 [ACK] Seq=2853 Ack=15929 Win=6155 Len=0 TSval=8376105 TSecr=15307607
   37 0.243892118  10.6.15.156 → 192.168.1.12 SSH 1514 Server: Encrypted packet (len=1448)
   38 0.245188723  10.6.15.156 → 192.168.1.12 SSH 1514 Server: Encrypted packet (len=1448)
   39 0.245199694 192.168.1.12 → 10.6.15.156  TCP 66 54766 → 22 [ACK] Seq=2853 Ack=18825 Win=6155 Len=0 TSval=8376105 TSecr=15307607
   40 0.245400805  10.6.15.156 → 192.168.1.12 SSH 1514 Server: Encrypted packet (len=1448)
   41 0.245436243  10.6.15.156 → 192.168.1.12 SSH 446 Server: Encrypted packet (len=380)
   42 0.245440858 192.168.1.12 → 10.6.15.156  TCP 66 54766 → 22 [ACK] Seq=2853 Ack=20653 Win=6155 Len=0 TSval=8376105 TSecr=15307607
   43 0.265153567  10.6.15.156 → 192.168.1.12 SSH 230 Server: Encrypted packet (len=164)
   44 0.307193084 192.168.1.12 → 10.6.15.156  TCP 66 54766 → 22 [ACK] Seq=2853 Ack=20817 Win=6155 Len=0 TSval=8376121 TSecr=15307613
   45 0.445741281  10.6.15.156 → 192.168.1.12 SSH 1514 Server: Encrypted packet (len=1448)
   46 0.445949017  10.6.15.156 → 192.168.1.12 SSH 1514 Server: Encrypted packet (len=1448)
   47 0.445961022 192.168.1.12 → 10.6.15.156  TCP 66 54766 → 22 [ACK] Seq=2853 Ack=23713 Win=6155 Len=0 TSval=8376155 TSecr=15307658
   48 0.446458255  10.6.15.156 → 192.168.1.12 SSH 286 Server: Encrypted packet (len=220)
   49 0.446489845 192.168.1.12 → 10.6.15.156  TCP 66 54766 → 22 [ACK] Seq=2853 Ack=23933 Win=6155 Len=0 TSval=8376155 TSecr=15307658
   50 0.448027977  10.6.15.156 → 192.168.1.12 SSH 1514 Server: Encrypted packet (len=1448)
   51 0.448250990  10.6.15.156 → 192.168.1.12 SSH 1514 Server: Encrypted packet (len=1448)
   52 0.448258616 192.168.1.12 → 10.6.15.156  TCP 66 54766 → 22 [ACK] Seq=2853 Ack=26829 Win=6155 Len=0 TSval=8376156 TSecr=15307658
   53 0.450512047  10.6.15.156 → 192.168.1.12 SSH 1514 Server: Encrypted packet (len=1448)
   54 0.450726376  10.6.15.156 → 192.168.1.12 SSH 1514 Server: Encrypted packet (len=1448)
   55 0.450734600 192.168.1.12 → 10.6.15.156  TCP 66 54766 → 22 [ACK] Seq=2853 Ack=29725 Win=6155 Len=0 TSval=8376156 TSecr=15307658
   56 0.450928617  10.6.15.156 → 192.168.1.12 SSH 1514 Server: Encrypted packet (len=1448)
   57 0.451137983  10.6.15.156 → 192.168.1.12 SSH 1514 Server: Encrypted packet (len=1448)
   58 0.451142263 192.168.1.12 → 10.6.15.156  TCP 66 54766 → 22 [ACK] Seq=2853 Ack=32621 Win=6155 Len=0 TSval=8376156 TSecr=15307658
   59 0.451368249  10.6.15.156 → 192.168.1.12 SSH 1514 Server: Encrypted packet (len=1448)
   60 0.451595309  10.6.15.156 → 192.168.1.12 SSH 1514 Server: Encrypted packet (len=1448)
   61 0.451599328 192.168.1.12 → 10.6.15.156  TCP 66 54766 → 22 [ACK] Seq=2853 Ack=35517 Win=6155 Len=0 TSval=8376157 TSecr=15307658
   62 0.451791119  10.6.15.156 → 192.168.1.12 SSH 1514 Server: Encrypted packet (len=1448)
   63 0.454609739  10.6.15.156 → 192.168.1.12 SSH 1514 Server: Encrypted packet (len=1448)
   64 0.454625860 192.168.1.12 → 10.6.15.156  TCP 66 54766 → 22 [ACK] Seq=2853 Ack=38413 Win=6155 Len=0 TSval=8376157 TSecr=15307659
   65 0.457086140  10.6.15.156 → 192.168.1.12 SSH 1514 Server: Encrypted packet (len=1448)
   66 0.457289311  10.6.15.156 → 192.168.1.12 SSH 1514 Server: Encrypted packet (len=1448)
   67 0.457298715 192.168.1.12 → 10.6.15.156  TCP 66 54766 → 22 [ACK] Seq=2853 Ack=41309 Win=6155 Len=0 TSval=8376158 TSecr=15307661
   68 0.457498190  10.6.15.156 → 192.168.1.12 SSH 1514 Server: Encrypted packet (len=1448)
   69 0.457614796 192.168.1.12 → 10.6.15.156  SSH 102 Client: Encrypted packet (len=36)
   70 0.457700465  10.6.15.156 → 192.168.1.12 SSH 1514 Server: Encrypted packet (len=1448)
   71 0.457914442  10.6.15.156 → 192.168.1.12 SSH 1514 Server: Encrypted packet (len=1448)
   72 0.457922011 192.168.1.12 → 10.6.15.156  TCP 66 54766 → 22 [ACK] Seq=2889 Ack=45653 Win=6155 Len=0 TSval=8376158 TSecr=15307661
   73 0.460445226  10.6.15.156 → 192.168.1.12 SSH 750 Server: Encrypted packet (len=684)
   74 0.497071704  10.6.15.156 → 192.168.1.12 SSH 142 Server: Encrypted packet (len=76)
   75 0.497088200 192.168.1.12 → 10.6.15.156  TCP 66 54766 → 22 [ACK] Seq=2889 Ack=46413 Win=6155 Len=0 TSval=8376168 TSecr=15307661
   76 0.500241922  10.6.15.156 → 192.168.1.12 SSH 158 Server: Encrypted packet (len=92)
   77 0.505131328  10.6.15.156 → 192.168.1.12 SSH 142 Server: Encrypted packet (len=76)
   78 0.505214168 192.168.1.12 → 10.6.15.156  TCP 66 54766 → 22 [ACK] Seq=2889 Ack=46581 Win=6155 Len=0 TSval=8376170 TSecr=15307672
   79 0.506897463  10.6.15.156 → 192.168.1.12 SSH 142 Server: Encrypted packet (len=76)
   80 0.510463193  10.6.15.156 → 192.168.1.12 SSH 142 Server: Encrypted packet (len=76)
   81 0.510548610 192.168.1.12 → 10.6.15.156  TCP 66 54766 → 22 [ACK] Seq=2889 Ack=46733 Win=6155 Len=0 TSval=8376171 TSecr=15307673
   82 0.567305864  10.6.15.156 → 192.168.1.12 SSH 222 Server: Encrypted packet (len=156)
   83 0.603325651  10.6.15.156 → 192.168.1.12 SSH 222 Server: Encrypted packet (len=156)
   84 0.603346017 192.168.1.12 → 10.6.15.156  TCP 66 54766 → 22 [ACK] Seq=2889 Ack=47045 Win=6155 Len=0 TSval=8376195 TSecr=15307688
   85 0.859843849 192.168.1.12 → 10.6.15.156  SSH 190 Client: Encrypted packet (len=124)
   86 0.865392846  10.6.15.156 → 192.168.1.12 SSH 366 Server: Encrypted packet (len=300)
   87 0.865416788 192.168.1.12 → 10.6.15.156  SSH 134 Client: Encrypted packet (len=68)
   88 0.869714436  10.6.15.156 → 192.168.1.12 SSH 142 Server: Encrypted packet (len=76)
   89 0.869744376 192.168.1.12 → 10.6.15.156  SSH 134 Client: Encrypted packet (len=68)
   90 0.907846968  10.6.15.156 → 192.168.1.12 TCP 66 22 → 54766 [ACK] Seq=47421 Ack=3149 Win=1452 Len=0 TSval=15307774 TSecr=8376261
   91 0.919822856 192.168.1.12 → 10.6.15.156  SSH 1238 Client: Encrypted packet (len=1172)
   92 0.922468143  10.6.15.156 → 192.168.1.12 TCP 66 22 → 54766 [ACK] Seq=47421 Ack=4321 Win=1452 Len=0 TSval=15307777 TSecr=8376274
   93 0.980375433 192.168.1.12 → 10.6.15.156  SSH 942 Client: Encrypted packet (len=876)
   94 0.982469092  10.6.15.156 → 192.168.1.12 TCP 66 22 → 54766 [ACK] Seq=47421 Ack=5197 Win=1452 Len=0 TSval=15307792 TSecr=8376289
   95 1.063034986  10.6.15.156 → 192.168.1.12 SSH 190 Server: Encrypted packet (len=124)
   96 1.103198932 192.168.1.12 → 10.6.15.156  TCP 66 54766 → 22 [ACK] Seq=5197 Ack=47545 Win=6155 Len=0 TSval=8376320 TSecr=15307812
   97 1.197588925  10.6.15.156 → 192.168.1.12 SSH 1198 Server: Encrypted packet (len=1132)
   98 1.197615378 192.168.1.12 → 10.6.15.156  TCP 66 54766 → 22 [ACK] Seq=5197 Ack=48677 Win=6155 Len=0 TSval=8376343 TSecr=15307846
   99 1.215195479  10.6.15.156 → 192.168.1.12 SSH 190 Server: Encrypted packet (len=124)
  100 1.215212817 192.168.1.12 → 10.6.15.156  TCP 66 54766 → 22 [ACK] Seq=5197 Ack=48801 Win=6155 Len=0 TSval=8376348 TSecr=15307850
  101 1.251666388  10.6.15.156 → 192.168.1.12 SSH 846 Server: Encrypted packet (len=780)
  102 1.251685520 192.168.1.12 → 10.6.15.156  TCP 66 54766 → 22 [ACK] Seq=5197 Ack=49581 Win=6155 Len=0 TSval=8376357 TSecr=15307859
  103 1.276424751 192.168.1.12 → 10.6.15.156  SSH 998 Client: Encrypted packet (len=932)
  104 1.279366379  10.6.15.156 → 192.168.1.12 TCP 66 22 → 54766 [ACK] Seq=49581 Ack=6129 Win=1452 Len=0 TSval=15307866 TSecr=8376363
  105 1.283793145 192.168.1.12 → 10.6.15.156  SSH 942 Client: Encrypted packet (len=876)
  106 1.285889749  10.6.15.156 → 192.168.1.12 TCP 66 22 → 54766 [ACK] Seq=49581 Ack=7005 Win=1452 Len=0 TSval=15307868 TSecr=8376365
  107 1.329069827 192.168.1.12 → 10.6.15.156  SSH 166 Client: Encrypted packet (len=100)
  108 1.329329108 192.168.1.12 → 10.6.15.156  SSH 142 Client: Encrypted packet (len=76)
  109 1.330661672  10.6.15.156 → 192.168.1.12 TCP 66 22 → 54766 [ACK] Seq=49581 Ack=7105 Win=1452 Len=0 TSval=15307879 TSecr=8376376
  110 1.330677720  10.6.15.156 → 192.168.1.12 TCP 66 22 → 54766 [ACK] Seq=49581 Ack=7181 Win=1452 Len=0 TSval=15307879 TSecr=8376376
  111 1.333236632  10.6.15.156 → 192.168.1.12 SSH 142 Server: Encrypted packet (len=76)
  112 1.367459946  10.6.15.156 → 192.168.1.12 SSH 262 Server: Encrypted packet (len=196)
  113 1.367477306 192.168.1.12 → 10.6.15.156  TCP 66 54766 → 22 [ACK] Seq=7181 Ack=49853 Win=6155 Len=0 TSval=8376386 TSecr=15307880
  114 1.368216503 192.168.1.12 → 10.6.15.156  SSH 134 Client: Encrypted packet (len=68)
  115 1.407845701  10.6.15.156 → 192.168.1.12 TCP 66 22 → 54766 [ACK] Seq=49853 Ack=7249 Win=1452 Len=0 TSval=15307899 TSecr=8376386
  116 1.469581185  10.6.15.156 → 192.168.1.12 SSH 310 Server: Encrypted packet (len=244)
  117 1.505927946  10.6.15.156 → 192.168.1.12 SSH 310 Server: Encrypted packet (len=244)
  118 1.505947062 192.168.1.12 → 10.6.15.156  TCP 66 54766 → 22 [ACK] Seq=7249 Ack=50341 Win=6155 Len=0 TSval=8376420 TSecr=15307914
  119 1.546778396  10.6.15.156 → 192.168.1.12 SSH 1078 Server: Encrypted packet (len=1012)
  120 1.587195490 192.168.1.12 → 10.6.15.156  TCP 66 54766 → 22 [ACK] Seq=7249 Ack=51353 Win=6155 Len=0 TSval=8376441 TSecr=15307933
  121 1.618470639  10.6.15.156 → 192.168.1.12 SSH 310 Server: Encrypted packet (len=244)
  122 1.618568760 192.168.1.12 → 10.6.15.156  TCP 66 54766 → 22 [ACK] Seq=7249 Ack=51597 Win=6155 Len=0 TSval=8376448 TSecr=15307951
  123 1.668900328  10.6.15.156 → 192.168.1.12 SSH 270 Server: Encrypted packet (len=204)
  124 1.668996811 192.168.1.12 → 10.6.15.156  TCP 66 54766 → 22 [ACK] Seq=7249 Ack=51801 Win=6155 Len=0 TSval=8376461 TSecr=15307963
  125 1.714490388  10.6.15.156 → 192.168.1.12 SSH 1514 Server: Encrypted packet (len=1448)
  126 1.714674913  10.6.15.156 → 192.168.1.12 SSH 1514 Server: Encrypted packet (len=1448)
  127 1.714685157 192.168.1.12 → 10.6.15.156  TCP 66 54766 → 22 [ACK] Seq=7249 Ack=54697 Win=6155 Len=0 TSval=8376472 TSecr=15307975
  128 1.714886446  10.6.15.156 → 192.168.1.12 SSH 1514 Server: Encrypted packet (len=1448)
  129 1.715104008  10.6.15.156 → 192.168.1.12 SSH 1514 Server: Encrypted packet (len=1448)
  130 1.715107499 192.168.1.12 → 10.6.15.156  TCP 66 54766 → 22 [ACK] Seq=7249 Ack=57593 Win=6155 Len=0 TSval=8376472 TSecr=15307975
  131 1.715113131  10.6.15.156 → 192.168.1.12 SSH 158 Server: Encrypted packet (len=92)
  132 1.715149743 192.168.1.12 → 10.6.15.156  TCP 66 54766 → 22 [ACK] Seq=7249 Ack=57685 Win=6155 Len=0 TSval=8376472 TSecr=15307975
  133 1.715510912  10.6.15.156 → 192.168.1.12 SSH 1514 Server: Encrypted packet (len=1448)
  134 1.715712940  10.6.15.156 → 192.168.1.12 SSH 1514 Server: Encrypted packet (len=1448)
  135 1.715720657 192.168.1.12 → 10.6.15.156  TCP 66 54766 → 22 [ACK] Seq=7249 Ack=60581 Win=6155 Len=0 TSval=8376473 TSecr=15307975
  136 1.715935346  10.6.15.156 → 192.168.1.12 SSH 1514 Server: Encrypted packet (len=1448)
  137 1.716055873  10.6.15.156 → 192.168.1.12 SSH 1094 Server: Encrypted packet (len=1028)
  138 1.716066737 192.168.1.12 → 10.6.15.156  TCP 66 54766 → 22 [ACK] Seq=7249 Ack=63057 Win=6155 Len=0 TSval=8376473 TSecr=15307975
  139 1.920262021  10.6.15.156 → 192.168.1.12 SSH 214 Server: Encrypted packet (len=148)
  140 1.920330350 192.168.1.12 → 10.6.15.156  TCP 66 54766 → 22 [ACK] Seq=7249 Ack=63205 Win=6155 Len=0 TSval=8376524 TSecr=15308027
  141 1.957678417  10.6.15.156 → 192.168.1.12 SSH 214 Server: Encrypted packet (len=148)
  142 1.957764875 192.168.1.12 → 10.6.15.156  TCP 66 54766 → 22 [ACK] Seq=7249 Ack=63353 Win=6155 Len=0 TSval=8376533 TSecr=15308036
  143 1.979733078  10.6.15.156 → 192.168.1.12 SSH 1514 Server: Encrypted packet (len=1448)
  144 1.980365219  10.6.15.156 → 192.168.1.12 SSH 1514 Server: Encrypted packet (len=1448)
  145 1.980382725 192.168.1.12 → 10.6.15.156  TCP 66 54766 → 22 [ACK] Seq=7249 Ack=66249 Win=6155 Len=0 TSval=8376539 TSecr=15308041
  146 1.980711421  10.6.15.156 → 192.168.1.12 SSH 1514 Server: Encrypted packet (len=1448)
  147 1.980887136  10.6.15.156 → 192.168.1.12 SSH 1514 Server: Encrypted packet (len=1448)
  148 1.980898326 192.168.1.12 → 10.6.15.156  TCP 66 54766 → 22 [ACK] Seq=7249 Ack=69145 Win=6155 Len=0 TSval=8376539 TSecr=15308041
  149 1.980912678  10.6.15.156 → 192.168.1.12 SSH 158 Server: Encrypted packet (len=92)
  150 1.980939173 192.168.1.12 → 10.6.15.156  TCP 66 54766 → 22 [ACK] Seq=7249 Ack=69237 Win=6155 Len=0 TSval=8376539 TSecr=15308041
  151 1.981252991  10.6.15.156 → 192.168.1.12 SSH 1514 Server: Encrypted packet (len=1448)
  152 1.981585776  10.6.15.156 → 192.168.1.12 SSH 1514 Server: Encrypted packet (len=1448)
  153 1.981591852 192.168.1.12 → 10.6.15.156  TCP 66 54766 → 22 [ACK] Seq=7249 Ack=72133 Win=6155 Len=0 TSval=8376539 TSecr=15308042
  154 1.981792274  10.6.15.156 → 192.168.1.12 SSH 1514 Server: Encrypted packet (len=1448)
  155 1.982006511  10.6.15.156 → 192.168.1.12 SSH 1514 Server: Encrypted packet (len=1448)
  156 1.982011553 192.168.1.12 → 10.6.15.156  TCP 66 54766 → 22 [ACK] Seq=7249 Ack=75029 Win=6155 Len=0 TSval=8376539 TSecr=15308042
  157 1.982217688  10.6.15.156 → 192.168.1.12 SSH 1514 Server: Encrypted packet (len=1448)
  158 1.984788110  10.6.15.156 → 192.168.1.12 SSH 1514 Server: Encrypted packet (len=1448)
  159 1.984805141 192.168.1.12 → 10.6.15.156  TCP 66 54766 → 22 [ACK] Seq=7249 Ack=77925 Win=6155 Len=0 TSval=8376540 TSecr=15308042
  160 1.984982478  10.6.15.156 → 192.168.1.12 SSH 1514 Server: Encrypted packet (len=1448)
  161 1.985194194  10.6.15.156 → 192.168.1.12 SSH 1514 Server: Encrypted packet (len=1448)
  162 1.985199310 192.168.1.12 → 10.6.15.156  TCP 66 54766 → 22 [ACK] Seq=7249 Ack=80821 Win=6155 Len=0 TSval=8376540 TSecr=15308043
  163 1.985406281  10.6.15.156 → 192.168.1.12 SSH 1514 Server: Encrypted packet (len=1448)
  164 1.985591956  10.6.15.156 → 192.168.1.12 SSH 1514 Server: Encrypted packet (len=1448)
  165 1.985595465 192.168.1.12 → 10.6.15.156  TCP 66 54766 → 22 [ACK] Seq=7249 Ack=83717 Win=6155 Len=0 TSval=8376540 TSecr=15308043
  166 1.985603592  10.6.15.156 → 192.168.1.12 SSH 274 Server: Encrypted packet (len=208)
  167 1.985629589 192.168.1.12 → 10.6.15.156  TCP 66 54766 → 22 [ACK] Seq=7249 Ack=83925 Win=6155 Len=0 TSval=8376540 TSecr=15308043
  168 2.069274418  10.6.15.156 → 192.168.1.12 SSH 222 Server: Encrypted packet (len=156)
  169 2.069364141 192.168.1.12 → 10.6.15.156  TCP 66 54766 → 22 [ACK] Seq=7249 Ack=84081 Win=6155 Len=0 TSval=8376561 TSecr=15308064
  170 2.117122032  10.6.15.156 → 192.168.1.12 SSH 222 Server: Encrypted packet (len=156)
  171 2.117206953 192.168.1.12 → 10.6.15.156  TCP 66 54766 → 22 [ACK] Seq=7249 Ack=84237 Win=6155 Len=0 TSval=8376573 TSecr=15308076
  172 2.250364333  10.6.15.156 → 192.168.1.12 SSH 1514 Server: Encrypted packet (len=1448)
  173 2.250583704  10.6.15.156 → 192.168.1.12 SSH 1514 Server: Encrypted packet (len=1448)
  174 2.250594989 192.168.1.12 → 10.6.15.156  TCP 66 54766 → 22 [ACK] Seq=7249 Ack=87133 Win=6155 Len=0 TSval=8376606 TSecr=15308109
  175 2.250809236  10.6.15.156 → 192.168.1.12 SSH 1514 Server: Encrypted packet (len=1448)
  176 2.251013695  10.6.15.156 → 192.168.1.12 SSH 1514 Server: Encrypted packet (len=1448)
  177 2.251024576 192.168.1.12 → 10.6.15.156  TCP 66 54766 → 22 [ACK] Seq=7249 Ack=90029 Win=6155 Len=0 TSval=8376606 TSecr=15308109
  178 2.251039728  10.6.15.156 → 192.168.1.12 SSH 158 Server: Encrypted packet (len=92)
  179 2.251068370 192.168.1.12 → 10.6.15.156  TCP 66 54766 → 22 [ACK] Seq=7249 Ack=90121 Win=6155 Len=0 TSval=8376606 TSecr=15308109
  180 2.251376029  10.6.15.156 → 192.168.1.12 SSH 1514 Server: Encrypted packet (len=1448)
  181 2.251587108  10.6.15.156 → 192.168.1.12 SSH 1514 Server: Encrypted packet (len=1448)
  182 2.251594334 192.168.1.12 → 10.6.15.156  TCP 66 54766 → 22 [ACK] Seq=7249 Ack=93017 Win=6155 Len=0 TSval=8376607 TSecr=15308109
  183 2.251799353  10.6.15.156 → 192.168.1.12 SSH 1514 Server: Encrypted packet (len=1448)
  184 2.252013331  10.6.15.156 → 192.168.1.12 SSH 1514 Server: Encrypted packet (len=1448)
  185 2.252018501 192.168.1.12 → 10.6.15.156  TCP 66 54766 → 22 [ACK] Seq=7249 Ack=95913 Win=6155 Len=0 TSval=8376607 TSecr=15308109
  186 2.252374252  10.6.15.156 → 192.168.1.12 SSH 1514 Server: Encrypted packet (len=1448)
  187 2.254763102  10.6.15.156 → 192.168.1.12 SSH 1514 Server: Encrypted packet (len=1448)
  188 2.254780719 192.168.1.12 → 10.6.15.156  TCP 66 54766 → 22 [ACK] Seq=7249 Ack=98809 Win=6155 Len=0 TSval=8376607 TSecr=15308109
  189 2.254939325  10.6.15.156 → 192.168.1.12 SSH 1514 Server: Encrypted packet (len=1448)
  190 2.255111169  10.6.15.156 → 192.168.1.12 SSH 358 Server: Encrypted packet (len=292)
  191 2.255115453 192.168.1.12 → 10.6.15.156  TCP 66 54766 → 22 [ACK] Seq=7249 Ack=100549 Win=6155 Len=0 TSval=8376607 TSecr=15308110
  192 2.371442852  10.6.15.156 → 192.168.1.12 SSH 294 Server: Encrypted packet (len=228)
  193 2.371533784 192.168.1.12 → 10.6.15.156  TCP 66 54766 → 22 [ACK] Seq=7249 Ack=100777 Win=6155 Len=0 TSval=8376637 TSecr=15308139
  194 2.408244901  10.6.15.156 → 192.168.1.12 SSH 310 Server: Encrypted packet (len=244)
  195 2.408317068 192.168.1.12 → 10.6.15.156  TCP 66 54766 → 22 [ACK] Seq=7249 Ack=101021 Win=6155 Len=0 TSval=8376646 TSecr=15308148
  196 2.520438491  10.6.15.156 → 192.168.1.12 SSH 406 Server: Encrypted packet (len=340)
  197 2.520525465 192.168.1.12 → 10.6.15.156  TCP 66 54766 → 22 [ACK] Seq=7249 Ack=101361 Win=6155 Len=0 TSval=8376674 TSecr=15308177
  198 2.568433266  10.6.15.156 → 192.168.1.12 SSH 534 Server: Encrypted packet (len=468)
  199 2.568523196 192.168.1.12 → 10.6.15.156  TCP 66 54766 → 22 [ACK] Seq=7249 Ack=101829 Win=6155 Len=0 TSval=8376686 TSecr=15308189
  200 2.823630842  10.6.15.156 → 192.168.1.12 SSH 342 Server: Encrypted packet (len=276)
  201 2.823657318 192.168.1.12 → 10.6.15.156  TCP 66 54766 → 22 [ACK] Seq=7249 Ack=102105 Win=6155 Len=0 TSval=8376750 TSecr=15308252
  202 2.860403574  10.6.15.156 → 192.168.1.12 SSH 302 Server: Encrypted packet (len=236)
  203 2.860421283 192.168.1.12 → 10.6.15.156  TCP 66 54766 → 22 [ACK] Seq=7249 Ack=102341 Win=6155 Len=0 TSval=8376759 TSecr=15308261
  204 2.895733532 192.168.1.12 → 10.6.15.156  SSH 102 Client: Encrypted packet (len=36)
  205 2.897996809  10.6.15.156 → 192.168.1.12 TCP 66 22 → 54766 [ACK] Seq=102341 Ack=7285 Win=1452 Len=0 TSval=15308271 TSecr=8376768
  206 2.899704906 192.168.1.12 → 10.6.15.156  SSH 110 Client: Encrypted packet (len=44)
  207 2.901205498  10.6.15.156 → 192.168.1.12 TCP 66 22 → 54766 [ACK] Seq=102341 Ack=7329 Win=1452 Len=0 TSval=15308272 TSecr=8376769
  208 2.904047570  10.6.15.156 → 192.168.1.12 SSH 110 Server: Encrypted packet (len=44)
  209 2.906203826 192.168.1.12 → 10.6.15.156  SSH 390 Client: Encrypted packet (len=324)
  210 2.911793786  10.6.15.156 → 192.168.1.12 SSH 246 Server: Encrypted packet (len=180)
  211 2.911808957 192.168.1.12 → 10.6.15.156  SSH 218 Client: Encrypted packet (len=152)
  212 2.912185116 192.168.1.12 → 10.6.15.156  SSH 102 Client: Encrypted packet (len=36)
  213 2.912879437 192.168.1.12 → 10.6.15.156  SSH 134 Client: Encrypted packet (len=68)
  214 2.914458662  10.6.15.156 → 192.168.1.12 TCP 66 22 → 54766 [ACK] Seq=102565 Ack=7841 Win=1452 Len=0 TSval=15308275 TSecr=8376772
  215 2.951858259  10.6.15.156 → 192.168.1.12 TCP 66 22 → 54766 [ACK] Seq=102565 Ack=7909 Win=1452 Len=0 TSval=15308285 TSecr=8376772
  216 2.951886110 192.168.1.12 → 10.6.15.156  SSH 318 Client: Encrypted packet (len=252)
  217 2.954821732  10.6.15.156 → 192.168.1.12 TCP 66 22 → 54766 [ACK] Seq=102565 Ack=8161 Win=1452 Len=0 TSval=15308285 TSecr=8376782
  218 2.960076199  10.6.15.156 → 192.168.1.12 SSH 166 Server: Encrypted packet (len=100)
  219 2.960098426  10.6.15.156 → 192.168.1.12 SSH 138 Server: Encrypted packet (len=72)
  220 2.960167081 192.168.1.12 → 10.6.15.156  TCP 66 54766 → 22 [ACK] Seq=8161 Ack=102737 Win=6155 Len=0 TSval=8376784 TSecr=15308286
  221 2.960346601 192.168.1.12 → 10.6.15.156  SSH 102 Client: Encrypted packet (len=36)
  222 2.971274814  10.6.15.156 → 192.168.1.12 SSH 222 Server: Encrypted packet (len=156)
  223 3.015243601 192.168.1.12 → 10.6.15.156  TCP 66 54766 → 22 [ACK] Seq=8197 Ack=102893 Win=6155 Len=0 TSval=8376798 TSecr=15308289
  224 3.155943223  10.6.15.156 → 192.168.1.12 SSH 102 Server: Encrypted packet (len=36)
  225 3.155968780 192.168.1.12 → 10.6.15.156  TCP 66 54766 → 22 [ACK] Seq=8197 Ack=102929 Win=6155 Len=0 TSval=8376833 TSecr=15308336
  226 3.156305296 192.168.1.12 → 10.6.15.156  SSH 190 Client: Encrypted packet (len=124)
  227 3.163446445  10.6.15.156 → 192.168.1.12 SSH 210 Server: Encrypted packet (len=144)
  228 3.163751279 192.168.1.12 → 10.6.15.156  SSH 138 Client: Encrypted packet (len=72)
  229 3.169000626  10.6.15.156 → 192.168.1.12 SSH 102 Server: Encrypted packet (len=36)
  230 3.169080561  10.6.15.156 → 192.168.1.12 SSH 138 Server: Encrypted packet (len=72)
  231 3.169100018 192.168.1.12 → 10.6.15.156  TCP 66 54766 → 22 [ACK] Seq=8393 Ack=103181 Win=6155 Len=0 TSval=8376836 TSecr=15308339
  232 3.169271849 192.168.1.12 → 10.6.15.156  SSH 102 Client: Encrypted packet (len=36)
  233 3.174456750  10.6.15.156 → 192.168.1.12 SSH 138 Server: Encrypted packet (len=72)
  234 3.174477403 192.168.1.12 → 10.6.15.156  SSH 150 Client: Encrypted packet (len=84)
  235 3.174825436 192.168.1.12 → 10.6.15.156  SSH 102 Client: Encrypted packet (len=36)
  236 3.176261130  10.6.15.156 → 192.168.1.12 TCP 66 22 → 54766 [ACK] Seq=103253 Ack=8549 Win=1452 Len=0 TSval=15308341 TSecr=8376837
  237 3.209145644  10.6.15.156 → 192.168.1.12 SSH 102 Server: Encrypted packet (len=36)
  238 3.209491569 192.168.1.12 → 10.6.15.156  SSH 150 Client: Encrypted packet (len=84)
  239 3.210176188  10.6.15.156 → 192.168.1.12 SSH 102 Server: Encrypted packet (len=36)
  240 3.211596723  10.6.15.156 → 192.168.1.12 SSH 138 Server: Encrypted packet (len=72)
  241 3.211618163 192.168.1.12 → 10.6.15.156  SSH 150 Client: Encrypted packet (len=84)
  242 3.218986974  10.6.15.156 → 192.168.1.12 SSH 138 Server: Encrypted packet (len=72)
  243 3.219007811 192.168.1.12 → 10.6.15.156  SSH 234 Client: Encrypted packet (len=168)
  244 3.219392630 192.168.1.12 → 10.6.15.156  SSH 102 Client: Encrypted packet (len=36)
  245 3.220297307  10.6.15.156 → 192.168.1.12 SSH 138 Server: Encrypted packet (len=72)
  246 3.220700402  10.6.15.156 → 192.168.1.12 TCP 66 22 → 54766 [ACK] Seq=103541 Ack=8921 Win=1452 Len=0 TSval=15308352 TSecr=8376848
  247 3.220712385 192.168.1.12 → 10.6.15.156  SSH 102 Client: Encrypted packet (len=36)
  248 3.259903947  10.6.15.156 → 192.168.1.12 TCP 66 22 → 54766 [ACK] Seq=103541 Ack=8957 Win=1452 Len=0 TSval=15308362 TSecr=8376849
  249 3.401842959  10.6.15.156 → 192.168.1.12 SSH 1514 Server: Encrypted packet (len=1448)
  250 3.401994385  10.6.15.156 → 192.168.1.12 SSH 1198 Server: Encrypted packet (len=1132)
  251 3.402005816 192.168.1.12 → 10.6.15.156  TCP 66 54766 → 22 [ACK] Seq=8957 Ack=106121 Win=6155 Len=0 TSval=8376894 TSecr=15308397
  252 3.402716601 192.168.1.12 → 10.6.15.156  SSH 406 Client: Encrypted packet (len=340)
  253 3.404606221  10.6.15.156 → 192.168.1.12 TCP 66 22 → 54766 [ACK] Seq=106121 Ack=9297 Win=1452 Len=0 TSval=15308398 TSecr=8376894
  254 3.423772128  10.6.15.156 → 192.168.1.12 SSH 206 Server: Encrypted packet (len=140)
  255 3.432341998  10.6.15.156 → 192.168.1.12 SSH 206 Server: Encrypted packet (len=140)
  256 3.432385374 192.168.1.12 → 10.6.15.156  TCP 66 54766 → 22 [ACK] Seq=9297 Ack=106401 Win=6155 Len=0 TSval=8376902 TSecr=15308402
  257 3.433153180 192.168.1.12 → 10.6.15.156  SSH 406 Client: Encrypted packet (len=340)
  258 3.465989628  10.6.15.156 → 192.168.1.12 SSH 206 Server: Encrypted packet (len=140)
  259 3.466641211 192.168.1.12 → 10.6.15.156  SSH 406 Client: Encrypted packet (len=340)
  260 3.469364959  10.6.15.156 → 192.168.1.12 SSH 206 Server: Encrypted packet (len=140)
  261 3.469905362  10.6.15.156 → 192.168.1.12 SSH 206 Server: Encrypted packet (len=140)
  262 3.469980107 192.168.1.12 → 10.6.15.156  TCP 66 54766 → 22 [ACK] Seq=9977 Ack=106821 Win=6155 Len=0 TSval=8376911 TSecr=15308414
  263 3.469988571 192.168.1.12 → 10.6.15.156  SSH 406 Client: Encrypted packet (len=340)
  264 3.478669321  10.6.15.156 → 192.168.1.12 SSH 346 Server: Encrypted packet (len=280)
  265 3.479459672 192.168.1.12 → 10.6.15.156  SSH 406 Client: Encrypted packet (len=340)
  266 3.519872148  10.6.15.156 → 192.168.1.12 TCP 66 22 → 54766 [ACK] Seq=107101 Ack=10657 Win=1452 Len=0 TSval=15308427 TSecr=8376914
  267 3.519892515 192.168.1.12 → 10.6.15.156  SSH 406 Client: Encrypted packet (len=340)
  268 3.521959006  10.6.15.156 → 192.168.1.12 TCP 66 22 → 54766 [ACK] Seq=107101 Ack=10997 Win=1452 Len=0 TSval=15308427 TSecr=8376924
  269 3.649350372  10.6.15.156 → 192.168.1.12 SSH 150 Server: Encrypted packet (len=84)
  270 3.650596335 192.168.1.12 → 10.6.15.156  SSH 1078 Client: Encrypted packet (len=1012)
  271 3.653033611  10.6.15.156 → 192.168.1.12 TCP 66 22 → 54766 [ACK] Seq=107185 Ack=12009 Win=1452 Len=0 TSval=15308460 TSecr=8376956
  272 3.692560349  10.6.15.156 → 192.168.1.12 SSH 142 Server: Encrypted packet (len=76)
  273 3.693806147 192.168.1.12 → 10.6.15.156  SSH 1078 Client: Encrypted packet (len=1012)
  274 3.724375302  10.6.15.156 → 192.168.1.12 SSH 206 Server: Encrypted packet (len=140)
  275 3.724399540  10.6.15.156 → 192.168.1.12 SSH 142 Server: Encrypted packet (len=76)
  276 3.724470721 192.168.1.12 → 10.6.15.156  TCP 66 54766 → 22 [ACK] Seq=13021 Ack=107477 Win=6155 Len=0 TSval=8376975 TSecr=15308478
  277 3.725769347 192.168.1.12 → 10.6.15.156  SSH 1078 Client: Encrypted packet (len=1012)
  278 3.731349918  10.6.15.156 → 192.168.1.12 SSH 142 Server: Encrypted packet (len=76)
  279 3.732600741 192.168.1.12 → 10.6.15.156  SSH 1078 Client: Encrypted packet (len=1012)
  280 3.740717729  10.6.15.156 → 192.168.1.12 SSH 142 Server: Encrypted packet (len=76)
  281 3.741990928 192.168.1.12 → 10.6.15.156  SSH 1078 Client: Encrypted packet (len=1012)
  282 3.760342678  10.6.15.156 → 192.168.1.12 SSH 206 Server: Encrypted packet (len=140)
  283 3.781962213  10.6.15.156 → 192.168.1.12 SSH 142 Server: Encrypted packet (len=76)
  284 3.782030996 192.168.1.12 → 10.6.15.156  TCP 66 54766 → 22 [ACK] Seq=16057 Ack=107845 Win=6155 Len=0 TSval=8376989 TSecr=15308487
  285 3.783217642 192.168.1.12 → 10.6.15.156  SSH 1078 Client: Encrypted packet (len=1012)
  286 3.824066400  10.6.15.156 → 192.168.1.12 TCP 66 22 → 54766 [ACK] Seq=107845 Ack=17069 Win=1452 Len=0 TSval=15308503 TSecr=8376990
  287 3.873290439  10.6.15.156 → 192.168.1.12 SSH 214 Server: Encrypted packet (len=148)
  288 3.904988761  10.6.15.156 → 192.168.1.12 SSH 318 Server: Encrypted packet (len=252)
  289 3.905006386 192.168.1.12 → 10.6.15.156  TCP 66 54766 → 22 [ACK] Seq=17069 Ack=108245 Win=6155 Len=0 TSval=8377020 TSecr=15308515
  290 3.906138807 192.168.1.12 → 10.6.15.156  SSH 1078 Client: Encrypted packet (len=1012)
  291 3.921269714  10.6.15.156 → 192.168.1.12 SSH 310 Server: Encrypted packet (len=244)
  292 3.959991082  10.6.15.156 → 192.168.1.12 SSH 318 Server: Encrypted packet (len=252)
  293 3.960006884 192.168.1.12 → 10.6.15.156  TCP 66 54766 → 22 [ACK] Seq=18081 Ack=108741 Win=6155 Len=0 TSval=8377034 TSecr=15308527
  294 3.961328861 192.168.1.12 → 10.6.15.156  SSH 1078 Client: Encrypted packet (len=1012)
  295 3.992670749  10.6.15.156 → 192.168.1.12 SSH 318 Server: Encrypted packet (len=252)
  296 3.995046415 192.168.1.12 → 10.6.15.156  SSH 1078 Client: Encrypted packet (len=1012)
  297 4.012506001  10.6.15.156 → 192.168.1.12 SSH 318 Server: Encrypted packet (len=252)
  298 4.013777304 192.168.1.12 → 10.6.15.156  SSH 1078 Client: Encrypted packet (len=1012)
  299 4.017360336  10.6.15.156 → 192.168.1.12 SSH 318 Server: Encrypted packet (len=252)
  300 4.019206055 192.168.1.12 → 10.6.15.156  SSH 1078 Client: Encrypted packet (len=1012)
  301 4.052444882  10.6.15.156 → 192.168.1.12 SSH 318 Server: Encrypted packet (len=252)
  302 4.095192794 192.168.1.12 → 10.6.15.156  TCP 66 54766 → 22 [ACK] Seq=22129 Ack=109749 Win=6155 Len=0 TSval=8377068 TSecr=15308560
  303 4.157326359  10.6.15.156 → 192.168.1.12 SSH 310 Server: Encrypted packet (len=244)
  304 4.157410199 192.168.1.12 → 10.6.15.156  TCP 66 54766 → 22 [ACK] Seq=22129 Ack=109993 Win=6155 Len=0 TSval=8377083 TSecr=15308586
  305 4.175517105  10.6.15.156 → 192.168.1.12 SSH 406 Server: Encrypted packet (len=340)
  306 4.175600900 192.168.1.12 → 10.6.15.156  TCP 66 54766 → 22 [ACK] Seq=22129 Ack=110333 Win=6155 Len=0 TSval=8377088 TSecr=15308590
  307 4.211484707  10.6.15.156 → 192.168.1.12 SSH 406 Server: Encrypted packet (len=340)
  308 4.211567663 192.168.1.12 → 10.6.15.156  TCP 66 54766 → 22 [ACK] Seq=22129 Ack=110673 Win=6155 Len=0 TSval=8377097 TSecr=15308599
  309 4.227950264  10.6.15.156 → 192.168.1.12 SSH 310 Server: Encrypted packet (len=244)
  310 4.228020155 192.168.1.12 → 10.6.15.156  TCP 66 54766 → 22 [ACK] Seq=22129 Ack=110917 Win=6155 Len=0 TSval=8377101 TSecr=15308604
  311 4.265663863  10.6.15.156 → 192.168.1.12 SSH 310 Server: Encrypted packet (len=244)
  312 4.265742898 192.168.1.12 → 10.6.15.156  TCP 66 54766 → 22 [ACK] Seq=22129 Ack=111161 Win=6155 Len=0 TSval=8377110 TSecr=15308613
  313 4.283099720  10.6.15.156 → 192.168.1.12 SSH 310 Server: Encrypted packet (len=244)
  314 4.283172257 192.168.1.12 → 10.6.15.156  TCP 66 54766 → 22 [ACK] Seq=22129 Ack=111405 Win=6155 Len=0 TSval=8377114 TSecr=15308617
  315 4.285692221  10.6.15.156 → 192.168.1.12 SSH 310 Server: Encrypted packet (len=244)
  316 4.285774367 192.168.1.12 → 10.6.15.156  TCP 66 54766 → 22 [ACK] Seq=22129 Ack=111649 Win=6155 Len=0 TSval=8377115 TSecr=15308618
  317 4.324285650  10.6.15.156 → 192.168.1.12 SSH 342 Server: Encrypted packet (len=276)
  318 4.324355810 192.168.1.12 → 10.6.15.156  TCP 66 54766 → 22 [ACK] Seq=22129 Ack=111925 Win=6155 Len=0 TSval=8377125 TSecr=15308628
  319 4.372171755  10.6.15.156 → 192.168.1.12 SSH 238 Server: Encrypted packet (len=172)
  320 4.372247063 192.168.1.12 → 10.6.15.156  TCP 66 54766 → 22 [ACK] Seq=22129 Ack=112097 Win=6155 Len=0 TSval=8377137 TSecr=15308640
  321 4.917017471 192.168.1.12 → 123.108.200.124 NTP 90 NTP Version 4, client
  322 5.226516136  10.6.15.156 → 192.168.1.12 SSH 254 Server: Encrypted packet (len=188)
  323 5.226537595 192.168.1.12 → 10.6.15.156  TCP 66 54766 → 22 [ACK] Seq=22129 Ack=112285 Win=6155 Len=0 TSval=8377350 TSecr=15308853
  324 5.274155105  10.6.15.156 → 192.168.1.12 SSH 206 Server: Encrypted packet (len=140)
  325 5.274170121 192.168.1.12 → 10.6.15.156  TCP 66 54766 → 22 [ACK] Seq=22129 Ack=112425 Win=6155 Len=0 TSval=8377362 TSecr=15308865
  326 5.528338861  10.6.15.156 → 192.168.1.12 SSH 254 Server: Encrypted packet (len=188)
  327 5.528355747 192.168.1.12 → 10.6.15.156  TCP 66 54766 → 22 [ACK] Seq=22129 Ack=112613 Win=6155 Len=0 TSval=8377426 TSecr=15308929
  328 5.564484218  10.6.15.156 → 192.168.1.12 SSH 358 Server: Encrypted packet (len=292)
  329 5.564500577 192.168.1.12 → 10.6.15.156  TCP 66 54766 → 22 [ACK] Seq=22129 Ack=112905 Win=6155 Len=0 TSval=8377435 TSecr=15308938
  330 5.677253202  10.6.15.156 → 192.168.1.12 SSH 278 Server: Encrypted packet (len=212)
  331 5.677270206 192.168.1.12 → 10.6.15.156  TCP 66 54766 → 22 [ACK] Seq=22129 Ack=113117 Win=6155 Len=0 TSval=8377463 TSecr=15308966
  332 5.725251942  10.6.15.156 → 192.168.1.12 SSH 270 Server: Encrypted packet (len=204)
  333 5.725268296 192.168.1.12 → 10.6.15.156  TCP 66 54766 → 22 [ACK] Seq=22129 Ack=113321 Win=6155 Len=0 TSval=8377475 TSecr=15308978
  334 5.743783067 10.22.17.139 → 224.0.0.252  LLMNR 64 Standard query 0x0d59 A wpad
  335 5.745825288 10.22.17.139 → 224.0.0.252  LLMNR 64 Standard query 0xa827 A wpad
  336 5.752775361 192.168.1.12 → 10.6.15.156  SSH 1238 Client: Encrypted packet (len=1172)
  337 5.791937196  10.6.15.156 → 192.168.1.12 TCP 66 22 → 54766 [ACK] Seq=113321 Ack=23301 Win=1452 Len=0 TSval=15308995 TSecr=8377482
  338 5.979556975  10.6.15.156 → 192.168.1.12 SSH 302 Server: Encrypted packet (len=236)
  339 6.015449395  10.6.15.156 → 192.168.1.12 SSH 222 Server: Encrypted packet (len=156)
  340 6.015467042 192.168.1.12 → 10.6.15.156  TCP 66 54766 → 22 [ACK] Seq=23301 Ack=113713 Win=6155 Len=0 TSval=8377548 TSecr=15309041
  341 6.026296443  10.6.15.156 → 192.168.1.12 SSH 1166 Server: Encrypted packet (len=1100)
  342 6.067243327 192.168.1.12 → 10.6.15.156  TCP 66 54766 → 22 [ACK] Seq=23301 Ack=114813 Win=6155 Len=0 TSval=8377561 TSecr=15309053
  343 6.128153706  10.6.15.156 → 192.168.1.12 SSH 190 Server: Encrypted packet (len=124)
  344 6.128173828 192.168.1.12 → 10.6.15.156  TCP 66 54766 → 22 [ACK] Seq=23301 Ack=114937 Win=6155 Len=0 TSval=8377576 TSecr=15309079
  345 6.155777367 10.22.17.139 → 224.0.0.252  LLMNR 64 Standard query 0x0d59 A wpad
  346 6.157450296 10.22.17.139 → 224.0.0.252  LLMNR 64 Standard query 0xa827 A wpad
  347 6.176250004  10.6.15.156 → 192.168.1.12 SSH 222 Server: Encrypted packet (len=156)
  348 6.176268235 192.168.1.12 → 10.6.15.156  TCP 66 54766 → 22 [ACK] Seq=23301 Ack=115093 Win=6155 Len=0 TSval=8377588 TSecr=15309091
  349 6.430356530  10.6.15.156 → 192.168.1.12 SSH 286 Server: Encrypted packet (len=220)
  350 6.430373582 192.168.1.12 → 10.6.15.156  TCP 66 54766 → 22 [ACK] Seq=23301 Ack=115313 Win=6155 Len=0 TSval=8377651 TSecr=15309154
  351 6.466192910  10.6.15.156 → 192.168.1.12 SSH 286 Server: Encrypted packet (len=220)
  352 6.466202051 192.168.1.12 → 10.6.15.156  TCP 66 54766 → 22 [ACK] Seq=23301 Ack=115533 Win=6155 Len=0 TSval=8377660 TSecr=15309163
  353 6.579311260  10.6.15.156 → 192.168.1.12 SSH 326 Server: Encrypted packet (len=260)
  354 6.579334350 192.168.1.12 → 10.6.15.156  TCP 66 54766 → 22 [ACK] Seq=23301 Ack=115793 Win=6155 Len=0 TSval=8377689 TSecr=15309191
  355 6.599919272  10.6.15.156 → 192.168.1.12 SSH 366 Server: Encrypted packet (len=300)
  356 6.599936719 192.168.1.12 → 10.6.15.156  TCP 66 54766 → 22 [ACK] Seq=23301 Ack=116093 Win=6155 Len=0 TSval=8377694 TSecr=15309197
  357 6.627249086  10.6.15.156 → 192.168.1.12 SSH 302 Server: Encrypted packet (len=236)
  358 6.627274727 192.168.1.12 → 10.6.15.156  TCP 66 54766 → 22 [ACK] Seq=23301 Ack=116329 Win=6155 Len=0 TSval=8377701 TSecr=15309203
  359 6.844527116 192.168.1.12 → 10.6.15.156  SSH 518 Client: Encrypted packet (len=452)
  360 6.846408699  10.6.15.156 → 192.168.1.12 TCP 66 22 → 54766 [ACK] Seq=116329 Ack=23753 Win=1452 Len=0 TSval=15309258 TSecr=8377755
  361 6.859272606 10.22.19.224 → 224.0.0.252  LLMNR 64 Standard query 0xb5b7 A wpad
  362 6.881331698  10.6.15.156 → 192.168.1.12 SSH 318 Server: Encrypted packet (len=252)
  363 6.881352363 192.168.1.12 → 10.6.15.156  TCP 66 54766 → 22 [ACK] Seq=23753 Ack=116581 Win=6155 Len=0 TSval=8377764 TSecr=15309267
  364 6.917391113  10.6.15.156 → 192.168.1.12 SSH 318 Server: Encrypted packet (len=252)
  365 6.917413315 192.168.1.12 → 10.6.15.156  TCP 66 54766 → 22 [ACK] Seq=23753 Ack=116833 Win=6155 Len=0 TSval=8377773 TSecr=15309276
  366 7.030434590  10.6.15.156 → 192.168.1.12 SSH 270 Server: Encrypted packet (len=204)
  367 7.030453302 192.168.1.12 → 10.6.15.156  TCP 66 54766 → 22 [ACK] Seq=23753 Ack=117037 Win=6155 Len=0 TSval=8377801 TSecr=15309304
  368 7.070415300  10.6.15.156 → 192.168.1.12 SSH 142 Server: Encrypted packet (len=76)
  369 7.070433908 192.168.1.12 → 10.6.15.156  TCP 66 54766 → 22 [ACK] Seq=23753 Ack=117113 Win=6155 Len=0 TSval=8377811 TSecr=15309314
  370 7.078118006  10.6.15.156 → 192.168.1.12 SSH 254 Server: Encrypted packet (len=188)
  371 7.078147816 192.168.1.12 → 10.6.15.156  TCP 66 54766 → 22 [ACK] Seq=23753 Ack=117301 Win=6155 Len=0 TSval=8377813 TSecr=15309316
  372 7.114222621  10.6.15.156 → 192.168.1.12 SSH 358 Server: Encrypted packet (len=292)
  373 7.114241229 192.168.1.12 → 10.6.15.156  TCP 66 54766 → 22 [ACK] Seq=23753 Ack=117593 Win=6155 Len=0 TSval=8377822 TSecr=15309325
  374 7.269729351 10.22.19.224 → 224.0.0.252  LLMNR 64 Standard query 0xb5b7 A wpad
  375 7.332322999  10.6.15.156 → 192.168.1.12 SSH 222 Server: Encrypted packet (len=156)
  376 7.332340943 192.168.1.12 → 10.6.15.156  TCP 66 54766 → 22 [ACK] Seq=23753 Ack=117749 Win=6155 Len=0 TSval=8377877 TSecr=15309380
  377 7.368480176  10.6.15.156 → 192.168.1.12 SSH 254 Server: Encrypted packet (len=188)
  378 7.368498838 192.168.1.12 → 10.6.15.156  TCP 66 54766 → 22 [ACK] Seq=23753 Ack=117937 Win=6155 Len=0 TSval=8377886 TSecr=15309389
  379 7.481980960  10.6.15.156 → 192.168.1.12 SSH 254 Server: Encrypted packet (len=188)
  380 7.481997750 192.168.1.12 → 10.6.15.156  TCP 66 54766 → 22 [ACK] Seq=23753 Ack=118125 Win=6155 Len=0 TSval=8377914 TSecr=15309417
  381 7.529189584  10.6.15.156 → 192.168.1.12 SSH 326 Server: Encrypted packet (len=260)
  382 7.529208354 192.168.1.12 → 10.6.15.156  TCP 66 54766 → 22 [ACK] Seq=23753 Ack=118385 Win=6155 Len=0 TSval=8377926 TSecr=15309429
  383 7.783561446  10.6.15.156 → 192.168.1.12 SSH 342 Server: Encrypted packet (len=276)
  384 7.783579478 192.168.1.12 → 10.6.15.156  TCP 66 54766 → 22 [ACK] Seq=23753 Ack=118661 Win=6155 Len=0 TSval=8377990 TSecr=15309492
  385 7.819589786  10.6.15.156 → 192.168.1.12 SSH 310 Server: Encrypted packet (len=244)
  386 7.819609016 192.168.1.12 → 10.6.15.156  TCP 66 54766 → 22 [ACK] Seq=23753 Ack=118905 Win=6155 Len=0 TSval=8377999 TSecr=15309501
  387 7.933134321  10.6.15.156 → 192.168.1.12 SSH 302 Server: Encrypted packet (len=236)
  388 7.933151799 192.168.1.12 → 10.6.15.156  TCP 66 54766 → 22 [ACK] Seq=23753 Ack=119141 Win=6155 Len=0 TSval=8378027 TSecr=15309530
  389 7.980366681  10.6.15.156 → 192.168.1.12 SSH 302 Server: Encrypted packet (len=236)
  390 7.980383172 192.168.1.12 → 10.6.15.156  TCP 66 54766 → 22 [ACK] Seq=23753 Ack=119377 Win=6155 Len=0 TSval=8378039 TSecr=15309542
  391 8.236606414  10.6.15.156 → 192.168.1.12 SSH 222 Server: Encrypted packet (len=156)
  392 8.236623381 192.168.1.12 → 10.6.15.156  TCP 66 54766 → 22 [ACK] Seq=23753 Ack=119533 Win=6155 Len=0 TSval=8378103 TSecr=15309605
  393 8.270330566  10.6.15.156 → 192.168.1.12 SSH 238 Server: Encrypted packet (len=172)
  394 8.270348579 192.168.1.12 → 10.6.15.156  TCP 66 54766 → 22 [ACK] Seq=23753 Ack=119705 Win=6155 Len=0 TSval=8378111 TSecr=15309614
  395 8.383428531  10.6.15.156 → 192.168.1.12 SSH 302 Server: Encrypted packet (len=236)
  396 8.383447070 192.168.1.12 → 10.6.15.156  TCP 66 54766 → 22 [ACK] Seq=23753 Ack=119941 Win=6155 Len=0 TSval=8378140 TSecr=15309642
  397 8.431127462  10.6.15.156 → 192.168.1.12 SSH 302 Server: Encrypted packet (len=236)
  398 8.431145424 192.168.1.12 → 10.6.15.156  TCP 66 54766 → 22 [ACK] Seq=23753 Ack=120177 Win=6155 Len=0 TSval=8378151 TSecr=15309654
  399 8.686044188  10.6.15.156 → 192.168.1.12 SSH 238 Server: Encrypted packet (len=172)
  400 8.686063051 192.168.1.12 → 10.6.15.156  TCP 66 54766 → 22 [ACK] Seq=23753 Ack=120349 Win=6155 Len=0 TSval=8378215 TSecr=15309718
  401 8.721459616  10.6.15.156 → 192.168.1.12 SSH 350 Server: Encrypted packet (len=284)
  402 8.721483363 192.168.1.12 → 10.6.15.156  TCP 66 54766 → 22 [ACK] Seq=23753 Ack=120633 Win=6155 Len=0 TSval=8378224 TSecr=15309727
  403 8.834381214  10.6.15.156 → 192.168.1.12 SSH 302 Server: Encrypted packet (len=236)
  404 8.834402805 192.168.1.12 → 10.6.15.156  TCP 66 54766 → 22 [ACK] Seq=23753 Ack=120869 Win=6155 Len=0 TSval=8378252 TSecr=15309755
  405 8.882567905  10.6.15.156 → 192.168.1.12 SSH 302 Server: Encrypted packet (len=236)
  406 8.882586510 192.168.1.12 → 10.6.15.156  TCP 66 54766 → 22 [ACK] Seq=23753 Ack=121105 Win=6155 Len=0 TSval=8378264 TSecr=15309767
  407 9.136418397  10.6.15.156 → 192.168.1.12 SSH 302 Server: Encrypted packet (len=236)
  408 9.136437328 192.168.1.12 → 10.6.15.156  TCP 66 54766 → 22 [ACK] Seq=23753 Ack=121341 Win=6155 Len=0 TSval=8378328 TSecr=15309831
  409 9.153797170 192.168.1.12 → 10.6.15.156  SSH 1238 Client: Encrypted packet (len=1172)
  410 9.172028195  10.6.15.156 → 192.168.1.12 SSH 182 Server: Encrypted packet (len=116)
  411 9.215242715 192.168.1.12 → 10.6.15.156  TCP 66 54766 → 22 [ACK] Seq=24925 Ack=121457 Win=6155 Len=0 TSval=8378348 TSecr=15309840
  412 9.285080599  10.6.15.156 → 192.168.1.12 SSH 182 Server: Encrypted packet (len=116)
  413 9.285103550 192.168.1.12 → 10.6.15.156  TCP 66 54766 → 22 [ACK] Seq=24925 Ack=121573 Win=6155 Len=0 TSval=8378365 TSecr=15309868
  414 9.332890273  10.6.15.156 → 192.168.1.12 SSH 190 Server: Encrypted packet (len=124)
  415 9.332903348 192.168.1.12 → 10.6.15.156  TCP 66 54766 → 22 [ACK] Seq=24925 Ack=121697 Win=6155 Len=0 TSval=8378377 TSecr=15309880
  416 9.409004871  10.6.15.156 → 192.168.1.12 SSH 102 Server: Encrypted packet (len=36)
  417 9.409028181 192.168.1.12 → 10.6.15.156  TCP 66 54766 → 22 [ACK] Seq=24925 Ack=121733 Win=6155 Len=0 TSval=8378396 TSecr=15309899
  418 9.425800278  10.6.15.156 → 192.168.1.12 SSH 102 Server: Encrypted packet (len=36)
  419 9.425812236 192.168.1.12 → 10.6.15.156  TCP 66 54766 → 22 [ACK] Seq=24925 Ack=121769 Win=6155 Len=0 TSval=8378400 TSecr=15309903
  420 9.436132658  10.6.15.156 → 192.168.1.12 SSH 1166 Server: Encrypted packet (len=1100)
  421 9.436142835 192.168.1.12 → 10.6.15.156  TCP 66 54766 → 22 [ACK] Seq=24925 Ack=122869 Win=6155 Len=0 TSval=8378403 TSecr=15309906
  422 9.587350057  10.6.15.156 → 192.168.1.12 SSH 190 Server: Encrypted packet (len=124)
  423 9.587367446 192.168.1.12 → 10.6.15.156  TCP 66 54766 → 22 [ACK] Seq=24925 Ack=122993 Win=6155 Len=0 TSval=8378441 TSecr=15309943
  424 9.705394503  10.6.15.156 → 192.168.1.12 SSH 174 Server: Encrypted packet (len=108)
  425 9.705413246 192.168.1.12 → 10.6.15.156  TCP 66 54766 → 22 [ACK] Seq=24925 Ack=123101 Win=6155 Len=0 TSval=8378470 TSecr=15309973
  426 9.705466280  10.6.15.156 → 192.168.1.12 SSH 102 Server: Encrypted packet (len=36)
  427 9.705473370 192.168.1.12 → 10.6.15.156  TCP 66 54766 → 22 [ACK] Seq=24925 Ack=123137 Win=6155 Len=0 TSval=8378470 TSecr=15309973
  428 10.038246535  10.6.15.156 → 192.168.1.12 SSH 182 Server: Encrypted packet (len=116)
  429 10.038265186 192.168.1.12 → 10.6.15.156  TCP 66 54766 → 22 [ACK] Seq=24925 Ack=123253 Win=6155 Len=0 TSval=8378553 TSecr=15310056
  430 10.074297413  10.6.15.156 → 192.168.1.12 SSH 182 Server: Encrypted packet (len=116)
  431 10.074315238 192.168.1.12 → 10.6.15.156  TCP 66 54766 → 22 [ACK] Seq=24925 Ack=123369 Win=6155 Len=0 TSval=8378562 TSecr=15310065
  432 10.187446542  10.6.15.156 → 192.168.1.12 SSH 214 Server: Encrypted packet (len=148)
  433 10.187465655 192.168.1.12 → 10.6.15.156  TCP 66 54766 → 22 [ACK] Seq=24925 Ack=123517 Win=6155 Len=0 TSval=8378591 TSecr=15310093
  434 10.235089589  10.6.15.156 → 192.168.1.12 SSH 182 Server: Encrypted packet (len=116)
  435 10.235107685 192.168.1.12 → 10.6.15.156  TCP 66 54766 → 22 [ACK] Seq=24925 Ack=123633 Win=6155 Len=0 TSval=8378602 TSecr=15310105
  436 10.489395097  10.6.15.156 → 192.168.1.12 SSH 182 Server: Encrypted packet (len=116)
  437 10.489412205 192.168.1.12 → 10.6.15.156  TCP 66 54766 → 22 [ACK] Seq=24925 Ack=123749 Win=6155 Len=0 TSval=8378666 TSecr=15310169
  438 10.525527796  10.6.15.156 → 192.168.1.12 SSH 182 Server: Encrypted packet (len=116)
  439 10.525546120 192.168.1.12 → 10.6.15.156  TCP 66 54766 → 22 [ACK] Seq=24925 Ack=123865 Win=6155 Len=0 TSval=8378675 TSecr=15310178
  440 10.917070711 192.168.1.12 → 139.59.21.22 NTP 90 NTP Version 4, client
  441 10.940320576  10.6.15.156 → 192.168.1.12 SSH 254 Server: Encrypted packet (len=188)
  442 10.940339209 192.168.1.12 → 10.6.15.156  TCP 66 54766 → 22 [ACK] Seq=24925 Ack=124053 Win=6155 Len=0 TSval=8378779 TSecr=15310282
  443 10.976223962  10.6.15.156 → 192.168.1.12 SSH 254 Server: Encrypted packet (len=188)
  444 10.976240929 192.168.1.12 → 10.6.15.156  TCP 66 54766 → 22 [ACK] Seq=24925 Ack=124241 Win=6155 Len=0 TSval=8378788 TSecr=15310291
  445 11.089213978  10.6.15.156 → 192.168.1.12 SSH 214 Server: Encrypted packet (len=148)
  446 11.089229886 192.168.1.12 → 10.6.15.156  TCP 66 54766 → 22 [ACK] Seq=24925 Ack=124389 Win=6155 Len=0 TSval=8378816 TSecr=15310319
  447 11.137289766  10.6.15.156 → 192.168.1.12 SSH 342 Server: Encrypted packet (len=276)
  448 11.137307851 192.168.1.12 → 10.6.15.156  TCP 66 54766 → 22 [ACK] Seq=24925 Ack=124665 Win=6155 Len=0 TSval=8378828 TSecr=15310331
  449 11.208971111 192.168.1.12 → 10.6.15.156  SSH 1514 Client: Encrypted packet (len=1448)
  450 11.251809325  10.6.15.156 → 192.168.1.12 TCP 66 22 → 54766 [ACK] Seq=124665 Ack=26373 Win=1452 Len=0 TSval=15310360 TSecr=8378846
  451 11.251829732 192.168.1.12 → 10.6.15.156  SSH 598 Client: Encrypted packet (len=532)
  452 11.253728943  10.6.15.156 → 192.168.1.12 TCP 66 22 → 54766 [ACK] Seq=124665 Ack=26905 Win=1452 Len=0 TSval=15310360 TSecr=8378857
  453 11.257157149  10.6.15.156 → 192.168.1.12 SSH 142 Server: Encrypted packet (len=76)
  454 11.299245939 192.168.1.12 → 10.6.15.156  TCP 66 54766 → 22 [ACK] Seq=26905 Ack=124741 Win=6155 Len=0 TSval=8378869 TSecr=15310361
  455 11.371568205  10.6.15.156 → 192.168.1.12 SSH 814 Server: Encrypted packet (len=748)
  456 11.371592959 192.168.1.12 → 10.6.15.156  TCP 66 54766 → 22 [ACK] Seq=26905 Ack=125489 Win=6155 Len=0 TSval=8378887 TSecr=15310389
  457 11.372095295  10.6.15.156 → 192.168.1.12 SSH 454 Server: Encrypted packet (len=388)
  458 11.372103419 192.168.1.12 → 10.6.15.156  TCP 66 54766 → 22 [ACK] Seq=26905 Ack=125877 Win=6155 Len=0 TSval=8378887 TSecr=15310390
  459 11.372671384 192.168.1.12 → 10.6.15.156  SSH 142 Client: Encrypted packet (len=76)
  460 11.391491577  10.6.15.156 → 192.168.1.12 SSH 374 Server: Encrypted packet (len=308)
  461 11.427410604  10.6.15.156 → 192.168.1.12 SSH 374 Server: Encrypted packet (len=308)
  462 11.427428105 192.168.1.12 → 10.6.15.156  TCP 66 54766 → 22 [ACK] Seq=26981 Ack=126493 Win=6155 Len=0 TSval=8378901 TSecr=15310394
  463 11.540501913  10.6.15.156 → 192.168.1.12 SSH 406 Server: Encrypted packet (len=340)
  464 11.583243096 192.168.1.12 → 10.6.15.156  TCP 66 54766 → 22 [ACK] Seq=26981 Ack=126833 Win=6155 Len=0 TSval=8378940 TSecr=15310432
  465 11.588183289  10.6.15.156 → 192.168.1.12 SSH 294 Server: Encrypted packet (len=228)
  466 11.588203637 192.168.1.12 → 10.6.15.156  TCP 66 54766 → 22 [ACK] Seq=26981 Ack=127061 Win=6155 Len=0 TSval=8378941 TSecr=15310444
  467 11.842593043  10.6.15.156 → 192.168.1.12 SSH 238 Server: Encrypted packet (len=172)
  468 11.842619824 192.168.1.12 → 10.6.15.156  TCP 66 54766 → 22 [ACK] Seq=26981 Ack=127233 Win=6155 Len=0 TSval=8379004 TSecr=15310507
  469 11.850333651 192.168.1.12 → 10.6.15.156  SSH 174 Client: Encrypted packet (len=108)
  470 11.878825957  10.6.15.156 → 192.168.1.12 SSH 774 Server: Encrypted packet (len=708)
  471 11.878857003 192.168.1.12 → 10.6.15.156  SSH 438 Client: Encrypted packet (len=372)
  472 11.919784840  10.6.15.156 → 192.168.1.12 TCP 66 22 → 54766 [ACK] Seq=127941 Ack=27461 Win=1452 Len=0 TSval=15310527 TSecr=8379013
  473 11.991442725  10.6.15.156 → 192.168.1.12 SSH 270 Server: Encrypted packet (len=204)
  474 12.035241896 192.168.1.12 → 10.6.15.156  TCP 66 54766 → 22 [ACK] Seq=27461 Ack=128145 Win=6155 Len=0 TSval=8379053 TSecr=15310544
  475 12.039486697  10.6.15.156 → 192.168.1.12 SSH 270 Server: Encrypted packet (len=204)
  476 12.039511024 192.168.1.12 → 10.6.15.156  TCP 66 54766 → 22 [ACK] Seq=27461 Ack=128349 Win=6155 Len=0 TSval=8379054 TSecr=15310556
  477 12.079915839  10.6.15.156 → 192.168.1.12 SSH 134 Server: Encrypted packet (len=68)
  478 12.079933045 192.168.1.12 → 10.6.15.156  TCP 66 54766 → 22 [ACK] Seq=27461 Ack=128417 Win=6155 Len=0 TSval=8379064 TSecr=15310567
  479 12.293985387  10.6.15.156 → 192.168.1.12 SSH 918 Server: Encrypted packet (len=852)
  480 12.294005409 192.168.1.12 → 10.6.15.156  TCP 66 54766 → 22 [ACK] Seq=27461 Ack=129269 Win=6155 Len=0 TSval=8379117 TSecr=15310620
  481 12.329606771  10.6.15.156 → 192.168.1.12 SSH 470 Server: Encrypted packet (len=404)
  482 12.329619524 192.168.1.12 → 10.6.15.156  TCP 66 54766 → 22 [ACK] Seq=27461 Ack=129673 Win=6155 Len=0 TSval=8379126 TSecr=15310629
  483 12.442583586  10.6.15.156 → 192.168.1.12 SSH 238 Server: Encrypted packet (len=172)
  484 12.442599532 192.168.1.12 → 10.6.15.156  TCP 66 54766 → 22 [ACK] Seq=27461 Ack=129845 Win=6155 Len=0 TSval=8379154 TSecr=15310657
  485 12.464423173  10.6.15.156 → 192.168.1.12 SSH 134 Server: Encrypted packet (len=68)
  486 12.464445458 192.168.1.12 → 10.6.15.156  TCP 66 54766 → 22 [ACK] Seq=27461 Ack=129913 Win=6155 Len=0 TSval=8379160 TSecr=15310663
  487 12.464545469  10.6.15.156 → 192.168.1.12 SSH 102 Server: Encrypted packet (len=36)
  488 12.464549506 192.168.1.12 → 10.6.15.156  TCP 66 54766 → 22 [ACK] Seq=27461 Ack=129949 Win=6155 Len=0 TSval=8379160 TSecr=15310663
  489 12.465689318 192.168.1.12 → 10.6.15.156  SSH 138 Client: Encrypted packet (len=72)
  490 12.467530450  10.6.15.156 → 192.168.1.12 TCP 66 22 → 54766 [ACK] Seq=129949 Ack=27533 Win=1452 Len=0 TSval=15310663 TSecr=8379160
  491 12.467659200  10.6.15.156 → 192.168.1.12 SSH 102 Server: Encrypted packet (len=36)
  492 12.490310172  10.6.15.156 → 192.168.1.12 SSH 318 Server: Encrypted packet (len=252)
  493 12.490394134 192.168.1.12 → 10.6.15.156  TCP 66 54766 → 22 [ACK] Seq=27533 Ack=130237 Win=6155 Len=0 TSval=8379166 TSecr=15310664
  494 12.744541609  10.6.15.156 → 192.168.1.12 SSH 502 Server: Encrypted packet (len=436)
  495 12.780548690  10.6.15.156 → 192.168.1.12 SSH 502 Server: Encrypted packet (len=436)
  496 12.780566733 192.168.1.12 → 10.6.15.156  TCP 66 54766 → 22 [ACK] Seq=27533 Ack=131109 Win=6155 Len=0 TSval=8379239 TSecr=15310733
  497 12.895624662  10.6.15.156 → 192.168.1.12 SSH 774 Server: Encrypted packet (len=708)
  498 12.939243955 192.168.1.12 → 10.6.15.156  TCP 66 54766 → 22 [ACK] Seq=27533 Ack=131817 Win=6155 Len=0 TSval=8379279 TSecr=15310770
  499 12.942878387  10.6.15.156 → 192.168.1.12 SSH 886 Server: Encrypted packet (len=820)
  500 12.942902101 192.168.1.12 → 10.6.15.156  TCP 66 54766 → 22 [ACK] Seq=27533 Ack=132637 Win=6155 Len=0 TSval=8379279 TSecr=15310782
  501 13.003765863 192.168.1.12 → 10.6.15.156  SSH 102 Client: Encrypted packet (len=36)
  502 13.004613384 192.168.1.12 → 10.6.15.156  SSH 1514 Client: Encrypted packet (len=1448)
  503 13.005418613 192.168.1.12 → 10.6.15.156  SSH 258 Client: Encrypted packet (len=192)
  504 13.007239956  10.6.15.156 → 192.168.1.12 TCP 66 22 → 54766 [ACK] Seq=132637 Ack=29209 Win=1452 Len=0 TSval=15310798 TSecr=8379295
  505 13.008403191  10.6.15.156 → 192.168.1.12 SSH 174 Server: Encrypted packet (len=108)
  506 13.008421765 192.168.1.12 → 10.6.15.156  TCP 66 54766 → 22 [ACK] Seq=29209 Ack=132745 Win=6155 Len=0 TSval=8379296 TSecr=15310799
  507 13.009649343  10.6.15.156 → 192.168.1.12 SSH 134 Server: Encrypted packet (len=68)
  508 13.009665409 192.168.1.12 → 10.6.15.156  TCP 66 54766 → 22 [ACK] Seq=29209 Ack=132813 Win=6155 Len=0 TSval=8379296 TSecr=15310799
  509 13.009790959  10.6.15.156 → 192.168.1.12 SSH 138 Server: Encrypted packet (len=72)
  510 13.009793936 192.168.1.12 → 10.6.15.156  TCP 66 54766 → 22 [ACK] Seq=29209 Ack=132885 Win=6155 Len=0 TSval=8379296 TSecr=15310799
  511 13.009925800 192.168.1.12 → 10.6.15.156  SSH 102 Client: Encrypted packet (len=36)
  512 13.012307184  10.6.15.156 → 192.168.1.12 SSH 186 Server: Encrypted packet (len=120)
  513 13.012391172  10.6.15.156 → 192.168.1.12 SSH 210 Server: Encrypted packet (len=144)
  514 13.012462524 192.168.1.12 → 10.6.15.156  TCP 66 54766 → 22 [ACK] Seq=29245 Ack=133149 Win=6155 Len=0 TSval=8379297 TSecr=15310800
  515 13.012660157 192.168.1.12 → 10.6.15.156  SSH 138 Client: Encrypted packet (len=72)
  516 13.051748842  10.6.15.156 → 192.168.1.12 TCP 66 22 → 54766 [ACK] Seq=133149 Ack=29317 Win=1452 Len=0 TSval=15310810 TSecr=8379297
  517 13.195840177  10.6.15.156 → 192.168.1.12 SSH 454 Server: Encrypted packet (len=388)
  518 13.231746136  10.6.15.156 → 192.168.1.12 SSH 422 Server: Encrypted packet (len=356)
  519 13.231762706 192.168.1.12 → 10.6.15.156  TCP 66 54766 → 22 [ACK] Seq=29317 Ack=133893 Win=6155 Len=0 TSval=8379352 TSecr=15310845
  520 13.257205624  10.6.15.156 → 192.168.1.12 SSH 210 Server: Encrypted packet (len=144)
  521 13.257491417 192.168.1.12 → 10.6.15.156  SSH 138 Client: Encrypted packet (len=72)
  522 13.258443624  10.6.15.156 → 192.168.1.12 SSH 138 Server: Encrypted packet (len=72)
  523 13.259523088  10.6.15.156 → 192.168.1.12 TCP 66 22 → 54766 [ACK] Seq=134109 Ack=29389 Win=1452 Len=0 TSval=15310861 TSecr=8379358
  524 13.259543210 192.168.1.12 → 10.6.15.156  SSH 102 Client: Encrypted packet (len=36)
  525 13.261311500  10.6.15.156 → 192.168.1.12 TCP 66 22 → 54766 [ACK] Seq=134109 Ack=29425 Win=1452 Len=0 TSval=15310862 TSecr=8379359
  526 13.276587887  10.6.15.156 → 192.168.1.12 SSH 138 Server: Encrypted packet (len=72)
  527 13.276807614 192.168.1.12 → 10.6.15.156  SSH 102 Client: Encrypted packet (len=36)
  528 13.277833830  10.6.15.156 → 192.168.1.12 SSH 138 Server: Encrypted packet (len=72)
  529 13.294949456  10.6.15.156 → 192.168.1.12 SSH 1166 Server: Encrypted packet (len=1100)
  530 13.294970898 192.168.1.12 → 10.6.15.156  SSH 102 Client: Encrypted packet (len=36)
  531 13.335780735  10.6.15.156 → 192.168.1.12 TCP 66 22 → 54766 [ACK] Seq=135353 Ack=29497 Win=1452 Len=0 TSval=15310881 TSecr=8379367
  532 13.344750667  10.6.15.156 → 192.168.1.12 SSH 790 Server: Encrypted packet (len=724)
  533 13.387218901 192.168.1.12 → 10.6.15.156  TCP 66 54766 → 22 [ACK] Seq=29497 Ack=136077 Win=6155 Len=0 TSval=8379391 TSecr=15310883
  534 13.393662105  10.6.15.156 → 192.168.1.12 SSH 678 Server: Encrypted packet (len=612)
  535 13.393743048 192.168.1.12 → 10.6.15.156  TCP 66 54766 → 22 [ACK] Seq=29497 Ack=136689 Win=6155 Len=0 TSval=8379392 TSecr=15310895
  536 13.646515555  10.6.15.156 → 192.168.1.12 SSH 374 Server: Encrypted packet (len=308)
  537 13.646544321 192.168.1.12 → 10.6.15.156  TCP 66 54766 → 22 [ACK] Seq=29497 Ack=136997 Win=6155 Len=0 TSval=8379455 TSecr=15310958
  538 13.683411454  10.6.15.156 → 192.168.1.12 SSH 342 Server: Encrypted packet (len=276)
  539 13.683429503 192.168.1.12 → 10.6.15.156  TCP 66 54766 → 22 [ACK] Seq=29497 Ack=137273 Win=6155 Len=0 TSval=8379465 TSecr=15310967
  540 13.795507826  10.6.15.156 → 192.168.1.12 SSH 406 Server: Encrypted packet (len=340)
  541 13.795525388 192.168.1.12 → 10.6.15.156  TCP 66 54766 → 22 [ACK] Seq=29497 Ack=137613 Win=6155 Len=0 TSval=8379493 TSecr=15310995
  542 13.844188360  10.6.15.156 → 192.168.1.12 SSH 406 Server: Encrypted packet (len=340)
  543 13.844211129 192.168.1.12 → 10.6.15.156  TCP 66 54766 → 22 [ACK] Seq=29497 Ack=137953 Win=6155 Len=0 TSval=8379505 TSecr=15311008
  544 14.097446217  10.6.15.156 → 192.168.1.12 SSH 302 Server: Encrypted packet (len=236)
  545 14.097462663 192.168.1.12 → 10.6.15.156  TCP 66 54766 → 22 [ACK] Seq=29497 Ack=138189 Win=6155 Len=0 TSval=8379568 TSecr=15311071
  546 14.133384662  10.6.15.156 → 192.168.1.12 SSH 302 Server: Encrypted packet (len=236)
  547 14.133402718 192.168.1.12 → 10.6.15.156  TCP 66 54766 → 22 [ACK] Seq=29497 Ack=138425 Win=6155 Len=0 TSval=8379577 TSecr=15311080
  548 14.246132975  10.6.15.156 → 192.168.1.12 SSH 182 Server: Encrypted packet (len=116)
  549 14.246150493 192.168.1.12 → 10.6.15.156  TCP 66 54766 → 22 [ACK] Seq=29497 Ack=138541 Win=6155 Len=0 TSval=8379605 TSecr=15311108
  550 14.295121350  10.6.15.156 → 192.168.1.12 SSH 182 Server: Encrypted packet (len=116)
  551 14.295138827 192.168.1.12 → 10.6.15.156  TCP 66 54766 → 22 [ACK] Seq=29497 Ack=138657 Win=6155 Len=0 TSval=8379617 TSecr=15311120
  552 14.548346267  10.6.15.156 → 192.168.1.12 SSH 238 Server: Encrypted packet (len=172)
  553 14.548364051 192.168.1.12 → 10.6.15.156  TCP 66 54766 → 22 [ACK] Seq=29497 Ack=138829 Win=6155 Len=0 TSval=8379681 TSecr=15311184
  554 14.585410005  10.6.15.156 → 192.168.1.12 SSH 238 Server: Encrypted packet (len=172)
  555 14.585428486 192.168.1.12 → 10.6.15.156  TCP 66 54766 → 22 [ACK] Seq=29497 Ack=139001 Win=6155 Len=0 TSval=8379690 TSecr=15311193
  556 14.697552922  10.6.15.156 → 192.168.1.12 SSH 374 Server: Encrypted packet (len=308)
  557 14.697570675 192.168.1.12 → 10.6.15.156  TCP 66 54766 → 22 [ACK] Seq=29497 Ack=139309 Win=6155 Len=0 TSval=8379718 TSecr=15311221
  558 14.746338850  10.6.15.156 → 192.168.1.12 SSH 438 Server: Encrypted packet (len=372)
  559 14.746358866 192.168.1.12 → 10.6.15.156  TCP 66 54766 → 22 [ACK] Seq=29497 Ack=139681 Win=6155 Len=0 TSval=8379730 TSecr=15311233
  560 14.999392156  10.6.15.156 → 192.168.1.12 SSH 238 Server: Encrypted packet (len=172)
  561 14.999410221 192.168.1.12 → 10.6.15.156  TCP 66 54766 → 22 [ACK] Seq=29497 Ack=139853 Win=6155 Len=0 TSval=8379794 TSecr=15311296
  562 15.035199484  10.6.15.156 → 192.168.1.12 SSH 238 Server: Encrypted packet (len=172)
  563 15.035216885 192.168.1.12 → 10.6.15.156  TCP 66 54766 → 22 [ACK] Seq=29497 Ack=140025 Win=6155 Len=0 TSval=8379803 TSecr=15311305
  564 15.148550720  10.6.15.156 → 192.168.1.12 SSH 518 Server: Encrypted packet (len=452)
  565 15.148568863 192.168.1.12 → 10.6.15.156  TCP 66 54766 → 22 [ACK] Seq=29497 Ack=140477 Win=6155 Len=0 TSval=8379831 TSecr=15311334
  566 15.197363187  10.6.15.156 → 192.168.1.12 SSH 406 Server: Encrypted packet (len=340)
  567 15.197381926 192.168.1.12 → 10.6.15.156  TCP 66 54766 → 22 [ACK] Seq=29497 Ack=140817 Win=6155 Len=0 TSval=8379843 TSecr=15311346
  568 15.450590217  10.6.15.156 → 192.168.1.12 SSH 470 Server: Encrypted packet (len=404)
  569 15.450608317 192.168.1.12 → 10.6.15.156  TCP 66 54766 → 22 [ACK] Seq=29497 Ack=141221 Win=6155 Len=0 TSval=8379906 TSecr=15311409
  570 15.486464150  10.6.15.156 → 192.168.1.12 SSH 470 Server: Encrypted packet (len=404)
  571 15.486481294 192.168.1.12 → 10.6.15.156  TCP 66 54766 → 22 [ACK] Seq=29497 Ack=141625 Win=6155 Len=0 TSval=8379915 TSecr=15311418
  572 15.648569110  10.6.15.156 → 192.168.1.12 SSH 214 Server: Encrypted packet (len=148)
  573 15.648586775 192.168.1.12 → 10.6.15.156  TCP 66 54766 → 22 [ACK] Seq=29497 Ack=141773 Win=6155 Len=0 TSval=8379956 TSecr=15311459
  574 15.901339882  10.6.15.156 → 192.168.1.12 SSH 302 Server: Encrypted packet (len=236)
  575 15.901357238 192.168.1.12 → 10.6.15.156  TCP 66 54766 → 22 [ACK] Seq=29497 Ack=142009 Win=6155 Len=0 TSval=8380019 TSecr=15311522
  576 15.937518109  10.6.15.156 → 192.168.1.12 SSH 302 Server: Encrypted packet (len=236)
  577 15.937535945 192.168.1.12 → 10.6.15.156  TCP 66 54766 → 22 [ACK] Seq=29497 Ack=142245 Win=6155 Len=0 TSval=8380028 TSecr=15311531
  578 16.050588990  10.6.15.156 → 192.168.1.12 SSH 438 Server: Encrypted packet (len=372)
  579 16.050608165 192.168.1.12 → 10.6.15.156  TCP 66 54766 → 22 [ACK] Seq=29497 Ack=142617 Win=6155 Len=0 TSval=8380056 TSecr=15311559
  580 16.099410793  10.6.15.156 → 192.168.1.12 SSH 374 Server: Encrypted packet (len=308)
  581 16.099428104 192.168.1.12 → 10.6.15.156  TCP 66 54766 → 22 [ACK] Seq=29497 Ack=142925 Win=6155 Len=0 TSval=8380069 TSecr=15311571
  582 16.353725484  10.6.15.156 → 192.168.1.12 SSH 238 Server: Encrypted packet (len=172)
  583 16.353744831 192.168.1.12 → 10.6.15.156  TCP 66 54766 → 22 [ACK] Seq=29497 Ack=143097 Win=6155 Len=0 TSval=8380132 TSecr=15311635
  584 16.388196042  10.6.15.156 → 192.168.1.12 SSH 238 Server: Encrypted packet (len=172)
  585 16.388213749 192.168.1.12 → 10.6.15.156  TCP 66 54766 → 22 [ACK] Seq=29497 Ack=143269 Win=6155 Len=0 TSval=8380141 TSecr=15311644
  586 16.501486590  10.6.15.156 → 192.168.1.12 SSH 238 Server: Encrypted packet (len=172)
  587 16.501504270 192.168.1.12 → 10.6.15.156  TCP 66 54766 → 22 [ACK] Seq=29497 Ack=143441 Win=6155 Len=0 TSval=8380169 TSecr=15311672
  588 16.550119569  10.6.15.156 → 192.168.1.12 SSH 238 Server: Encrypted packet (len=172)
  589 16.550139058 192.168.1.12 → 10.6.15.156  TCP 66 54766 → 22 [ACK] Seq=29497 Ack=143613 Win=6155 Len=0 TSval=8380181 TSecr=15311684
  590 16.803459139  10.6.15.156 → 192.168.1.12 SSH 270 Server: Encrypted packet (len=204)
  591 16.803477723 192.168.1.12 → 10.6.15.156  TCP 66 54766 → 22 [ACK] Seq=29497 Ack=143817 Win=6155 Len=0 TSval=8380245 TSecr=15311747
  592 16.839339698  10.6.15.156 → 192.168.1.12 SSH 270 Server: Encrypted packet (len=204)
  593 16.839360306 192.168.1.12 → 10.6.15.156  TCP 66 54766 → 22 [ACK] Seq=29497 Ack=144021 Win=6155 Len=0 TSval=8380254 TSecr=15311756
  594 16.952127001  10.6.15.156 → 192.168.1.12 SSH 206 Server: Encrypted packet (len=140)
  595 16.952145465 192.168.1.12 → 10.6.15.156  TCP 66 54766 → 22 [ACK] Seq=29497 Ack=144161 Win=6155 Len=0 TSval=8380282 TSecr=15311785
  596 17.001141694  10.6.15.156 → 192.168.1.12 SSH 198 Server: Encrypted packet (len=132)
  597 17.001158455 192.168.1.12 → 10.6.15.156  TCP 66 54766 → 22 [ACK] Seq=29497 Ack=144293 Win=6155 Len=0 TSval=8380294 TSecr=15311797
  598 17.290387531  10.6.15.156 → 192.168.1.12 SSH 182 Server: Encrypted packet (len=116)
  599 17.290405869 192.168.1.12 → 10.6.15.156  TCP 66 54766 → 22 [ACK] Seq=29497 Ack=144409 Win=6155 Len=0 TSval=8380366 TSecr=15311869
  600 17.403231945  10.6.15.156 → 192.168.1.12 SSH 238 Server: Encrypted packet (len=172)
  601 17.403251034 192.168.1.12 → 10.6.15.156  TCP 66 54766 → 22 [ACK] Seq=29497 Ack=144581 Win=6155 Len=0 TSval=8380395 TSecr=15311897
  602 17.452937106  10.6.15.156 → 192.168.1.12 SSH 334 Server: Encrypted packet (len=268)
  603 17.452954691 192.168.1.12 → 10.6.15.156  TCP 66 54766 → 22 [ACK] Seq=29497 Ack=144849 Win=6155 Len=0 TSval=8380407 TSecr=15311910
  604 17.705410335  10.6.15.156 → 192.168.1.12 SSH 270 Server: Encrypted packet (len=204)
  605 17.705428258 192.168.1.12 → 10.6.15.156  TCP 66 54766 → 22 [ACK] Seq=29497 Ack=145053 Win=6155 Len=0 TSval=8380470 TSecr=15311973
  606 17.741252167  10.6.15.156 → 192.168.1.12 SSH 238 Server: Encrypted packet (len=172)
  607 17.741270613 192.168.1.12 → 10.6.15.156  TCP 66 54766 → 22 [ACK] Seq=29497 Ack=145225 Win=6155 Len=0 TSval=8380479 TSecr=15311982
  608 18.607447395  10.6.15.156 → 192.168.1.12 SSH 182 Server: Encrypted packet (len=116)
  609 18.607466091 192.168.1.12 → 10.6.15.156  TCP 66 54766 → 22 [ACK] Seq=29497 Ack=145341 Win=6155 Len=0 TSval=8380696 TSecr=15312198
  610 18.643359510  10.6.15.156 → 192.168.1.12 SSH 238 Server: Encrypted packet (len=172)
  611 18.643378200 192.168.1.12 → 10.6.15.156  TCP 66 54766 → 22 [ACK] Seq=29497 Ack=145513 Win=6155 Len=0 TSval=8380705 TSecr=15312207
  612 18.756282672  10.6.15.156 → 192.168.1.12 SSH 214 Server: Encrypted packet (len=148)
  613 18.756301830 192.168.1.12 → 10.6.15.156  TCP 66 54766 → 22 [ACK] Seq=29497 Ack=145661 Win=6155 Len=0 TSval=8380733 TSecr=15312236
  614 18.805492964  10.6.15.156 → 192.168.1.12 SSH 214 Server: Encrypted packet (len=148)
  615 18.805512630 192.168.1.12 → 10.6.15.156  TCP 66 54766 → 22 [ACK] Seq=29497 Ack=145809 Win=6155 Len=0 TSval=8380745 TSecr=15312248
  616 19.058401582  10.6.15.156 → 192.168.1.12 SSH 270 Server: Encrypted packet (len=204)
  617 19.058420104 192.168.1.12 → 10.6.15.156  TCP 66 54766 → 22 [ACK] Seq=29497 Ack=146013 Win=6155 Len=0 TSval=8380808 TSecr=15312311
  618 19.094784872  10.6.15.156 → 192.168.1.12 SSH 214 Server: Encrypted packet (len=148)
  619 19.094801733 192.168.1.12 → 10.6.15.156  TCP 66 54766 → 22 [ACK] Seq=29497 Ack=146161 Win=6155 Len=0 TSval=8380817 TSecr=15312320
  620 19.207361881  10.6.15.156 → 192.168.1.12 SSH 238 Server: Encrypted packet (len=172)
  621 19.207380726 192.168.1.12 → 10.6.15.156  TCP 66 54766 → 22 [ACK] Seq=29497 Ack=146333 Win=6155 Len=0 TSval=8380846 TSecr=15312348
  622 19.256158506  10.6.15.156 → 192.168.1.12 SSH 238 Server: Encrypted packet (len=172)
  623 19.256176612 192.168.1.12 → 10.6.15.156  TCP 66 54766 → 22 [ACK] Seq=29497 Ack=146505 Win=6155 Len=0 TSval=8380858 TSecr=15312361
  624 19.509498359  10.6.15.156 → 192.168.1.12 SSH 406 Server: Encrypted packet (len=340)
  625 19.509518059 192.168.1.12 → 10.6.15.156  TCP 66 54766 → 22 [ACK] Seq=29497 Ack=146845 Win=6155 Len=0 TSval=8380921 TSecr=15312424
  626 19.545598134  10.6.15.156 → 192.168.1.12 SSH 406 Server: Encrypted packet (len=340)
  627 19.545615506 192.168.1.12 → 10.6.15.156  TCP 66 54766 → 22 [ACK] Seq=29497 Ack=147185 Win=6155 Len=0 TSval=8380930 TSecr=15312433
  628 19.658420370  10.6.15.156 → 192.168.1.12 SSH 374 Server: Encrypted packet (len=308)
  629 19.658439336 192.168.1.12 → 10.6.15.156  TCP 66 54766 → 22 [ACK] Seq=29497 Ack=147493 Win=6155 Len=0 TSval=8380958 TSecr=15312461
  630 19.707271455  10.6.15.156 → 192.168.1.12 SSH 374 Server: Encrypted packet (len=308)
  631 19.707287651 192.168.1.12 → 10.6.15.156  TCP 66 54766 → 22 [ACK] Seq=29497 Ack=147801 Win=6155 Len=0 TSval=8380971 TSecr=15312473
  632 19.966994794  10.6.15.156 → 192.168.1.12 SSH 182 Server: Encrypted packet (len=116)
  633 19.967012316 192.168.1.12 → 10.6.15.156  TCP 66 54766 → 22 [ACK] Seq=29497 Ack=147917 Win=6155 Len=0 TSval=8381035 TSecr=15312537
  634 19.996623797  10.6.15.156 → 192.168.1.12 SSH 182 Server: Encrypted packet (len=116)
  635 19.996640684 192.168.1.12 → 10.6.15.156  TCP 66 54766 → 22 [ACK] Seq=29497 Ack=148033 Win=6155 Len=0 TSval=8381043 TSecr=15312546
  636 20.109814762  10.6.15.156 → 192.168.1.12 SSH 238 Server: Encrypted packet (len=172)
  637 20.109832926 192.168.1.12 → 10.6.15.156  TCP 66 54766 → 22 [ACK] Seq=29497 Ack=148205 Win=6155 Len=0 TSval=8381071 TSecr=15312574
  638 20.158171833  10.6.15.156 → 192.168.1.12 SSH 222 Server: Encrypted packet (len=156)
  639 20.158189575 192.168.1.12 → 10.6.15.156  TCP 66 54766 → 22 [ACK] Seq=29497 Ack=148361 Win=6155 Len=0 TSval=8381083 TSecr=15312586
  640 20.411291834  10.6.15.156 → 192.168.1.12 SSH 206 Server: Encrypted packet (len=140)
  641 20.411310520 192.168.1.12 → 10.6.15.156  TCP 66 54766 → 22 [ACK] Seq=29497 Ack=148501 Win=6155 Len=0 TSval=8381147 TSecr=15312649
  642 20.447326749  10.6.15.156 → 192.168.1.12 SSH 238 Server: Encrypted packet (len=172)
  643 20.447344166 192.168.1.12 → 10.6.15.156  TCP 66 54766 → 22 [ACK] Seq=29497 Ack=148673 Win=6155 Len=0 TSval=8381156 TSecr=15312658
  644 20.560461467  10.6.15.156 → 192.168.1.12 SSH 238 Server: Encrypted packet (len=172)
  645 20.560479302 192.168.1.12 → 10.6.15.156  TCP 66 54766 → 22 [ACK] Seq=29497 Ack=148845 Win=6155 Len=0 TSval=8381184 TSecr=15312687
  646 20.609999965  10.6.15.156 → 192.168.1.12 SSH 270 Server: Encrypted packet (len=204)
  647 20.610023704 192.168.1.12 → 10.6.15.156  TCP 66 54766 → 22 [ACK] Seq=29497 Ack=149049 Win=6155 Len=0 TSval=8381196 TSecr=15312699
  648 20.862381607  10.6.15.156 → 192.168.1.12 SSH 302 Server: Encrypted packet (len=236)
  649 20.862398185 192.168.1.12 → 10.6.15.156  TCP 66 54766 → 22 [ACK] Seq=29497 Ack=149285 Win=6155 Len=0 TSval=8381259 TSecr=15312762
  650 20.898566093  10.6.15.156 → 192.168.1.12 SSH 270 Server: Encrypted packet (len=204)
  651 20.898583254 192.168.1.12 → 10.6.15.156  TCP 66 54766 → 22 [ACK] Seq=29497 Ack=149489 Win=6155 Len=0 TSval=8381268 TSecr=15312771
  652 21.011662923  10.6.15.156 → 192.168.1.12 SSH 270 Server: Encrypted packet (len=204)
  653 21.011680781 192.168.1.12 → 10.6.15.156  TCP 66 54766 → 22 [ACK] Seq=29497 Ack=149693 Win=6155 Len=0 TSval=8381297 TSecr=15312799
  654 21.062018082  10.6.15.156 → 192.168.1.12 SSH 238 Server: Encrypted packet (len=172)
  655 21.062037136 192.168.1.12 → 10.6.15.156  TCP 66 54766 → 22 [ACK] Seq=29497 Ack=149865 Win=6155 Len=0 TSval=8381309 TSecr=15312812
  656 21.462133191  10.6.15.156 → 192.168.1.12 SSH 182 Server: Encrypted packet (len=116)
  657 21.462152618 192.168.1.12 → 10.6.15.156  TCP 66 54766 → 22 [ACK] Seq=29497 Ack=149981 Win=6155 Len=0 TSval=8381409 TSecr=15312912
  658 21.513519119  10.6.15.156 → 192.168.1.12 SSH 182 Server: Encrypted packet (len=116)
  659 21.513537972 192.168.1.12 → 10.6.15.156  TCP 66 54766 → 22 [ACK] Seq=29497 Ack=150097 Win=6155 Len=0 TSval=8381422 TSecr=15312925
  660 21.764357487  10.6.15.156 → 192.168.1.12 SSH 270 Server: Encrypted packet (len=204)
  661 21.764376108 192.168.1.12 → 10.6.15.156  TCP 66 54766 → 22 [ACK] Seq=29497 Ack=150301 Win=6155 Len=0 TSval=8381485 TSecr=15312988
  662 21.800387256  10.6.15.156 → 192.168.1.12 SSH 270 Server: Encrypted packet (len=204)
  663 21.800405466 192.168.1.12 → 10.6.15.156  TCP 66 54766 → 22 [ACK] Seq=29497 Ack=150505 Win=6155 Len=0 TSval=8381494 TSecr=15312997
  664 21.913341600  10.6.15.156 → 192.168.1.12 SSH 238 Server: Encrypted packet (len=172)
  665 21.913361157 192.168.1.12 → 10.6.15.156  TCP 66 54766 → 22 [ACK] Seq=29497 Ack=150677 Win=6155 Len=0 TSval=8381522 TSecr=15313025
  666 21.963174268  10.6.15.156 → 192.168.1.12 SSH 270 Server: Encrypted packet (len=204)
  667 21.963197679 192.168.1.12 → 10.6.15.156  TCP 66 54766 → 22 [ACK] Seq=29497 Ack=150881 Win=6155 Len=0 TSval=8381535 TSecr=15313037
  668 22.107253832  10.6.15.156 → 192.168.1.12 SSH 158 Server: Encrypted packet (len=92)
  669 22.107272302 192.168.1.12 → 10.6.15.156  TCP 66 54766 → 22 [ACK] Seq=29497 Ack=150973 Win=6155 Len=0 TSval=8381571 TSecr=15313073
  670 22.107596180 192.168.1.12 → 10.6.15.156  SSH 158 Client: Encrypted packet (len=92)
  671 22.109286660  10.6.15.156 → 192.168.1.12 TCP 66 22 → 54766 [ACK] Seq=150973 Ack=29589 Win=1452 Len=0 TSval=15313074 TSecr=8381571
  672 22.182993007  10.6.15.156 → 192.168.1.12 SSH 150 Server: Encrypted packet (len=84)
  673 22.183324899 192.168.1.12 → 10.6.15.156  SSH 150 Client: Encrypted packet (len=84)
  674 22.185092446  10.6.15.156 → 192.168.1.12 TCP 66 22 → 54766 [ACK] Seq=151057 Ack=29673 Win=1452 Len=0 TSval=15313093 TSecr=8381590
  675 22.215485807  10.6.15.156 → 192.168.1.12 SSH 438 Server: Encrypted packet (len=372)
  676 22.251553267  10.6.15.156 → 192.168.1.12 SSH 438 Server: Encrypted packet (len=372)
  677 22.251571274 192.168.1.12 → 10.6.15.156  TCP 66 54766 → 22 [ACK] Seq=29673 Ack=151801 Win=6155 Len=0 TSval=8381607 TSecr=15313100
  678 22.364329419  10.6.15.156 → 192.168.1.12 SSH 302 Server: Encrypted packet (len=236)
  679 22.407186680 192.168.1.12 → 10.6.15.156  TCP 66 54766 → 22 [ACK] Seq=29673 Ack=152037 Win=6155 Len=0 TSval=8381646 TSecr=15313138
  680 22.414244052  10.6.15.156 → 192.168.1.12 SSH 470 Server: Encrypted packet (len=404)
  681 22.414265677 192.168.1.12 → 10.6.15.156  TCP 66 54766 → 22 [ACK] Seq=29673 Ack=152441 Win=6155 Len=0 TSval=8381647 TSecr=15313150
  682 22.666397678  10.6.15.156 → 192.168.1.12 SSH 302 Server: Encrypted packet (len=236)
  683 22.666414987 192.168.1.12 → 10.6.15.156  TCP 66 54766 → 22 [ACK] Seq=29673 Ack=152677 Win=6155 Len=0 TSval=8381710 TSecr=15313213
  684 22.702376655  10.6.15.156 → 192.168.1.12 SSH 302 Server: Encrypted packet (len=236)
  685 22.702394949 192.168.1.12 → 10.6.15.156  TCP 66 54766 → 22 [ACK] Seq=29673 Ack=152913 Win=6155 Len=0 TSval=8381719 TSecr=15313222
  686 22.816120284  10.6.15.156 → 192.168.1.12 SSH 518 Server: Encrypted packet (len=452)
  687 22.816137851 192.168.1.12 → 10.6.15.156  TCP 66 54766 → 22 [ACK] Seq=29673 Ack=153365 Win=6155 Len=0 TSval=8381748 TSecr=15313250
  688 22.865241948  10.6.15.156 → 192.168.1.12 SSH 406 Server: Encrypted packet (len=340)
  689 22.865259924 192.168.1.12 → 10.6.15.156  TCP 66 54766 → 22 [ACK] Seq=29673 Ack=153705 Win=6155 Len=0 TSval=8381760 TSecr=15313263
  690 23.117376776  10.6.15.156 → 192.168.1.12 SSH 238 Server: Encrypted packet (len=172)
  691 23.117392810 192.168.1.12 → 10.6.15.156  TCP 66 54766 → 22 [ACK] Seq=29673 Ack=153877 Win=6155 Len=0 TSval=8381823 TSecr=15313326
  692 23.153214915  10.6.15.156 → 192.168.1.12 SSH 238 Server: Encrypted packet (len=172)
  693 23.153234222 192.168.1.12 → 10.6.15.156  TCP 66 54766 → 22 [ACK] Seq=29673 Ack=154049 Win=6155 Len=0 TSval=8381832 TSecr=15313335
  694 23.183952008  10.6.15.156 → 192.168.1.12 SSH 150 Server: Encrypted packet (len=84)
  695 23.183969920 192.168.1.12 → 10.6.15.156  TCP 66 54766 → 22 [ACK] Seq=29673 Ack=154133 Win=6155 Len=0 TSval=8381840 TSecr=15313343
  696 23.184289997 192.168.1.12 → 10.6.15.156  SSH 150 Client: Encrypted packet (len=84)
  697 23.223623735  10.6.15.156 → 192.168.1.12 TCP 66 22 → 54766 [ACK] Seq=154133 Ack=29757 Win=1452 Len=0 TSval=15313353 TSecr=8381840
  698 23.341423191  10.6.15.156 → 192.168.1.12 SSH 150 Server: Encrypted packet (len=84)
  699 23.341718697 192.168.1.12 → 10.6.15.156  SSH 150 Client: Encrypted packet (len=84)
  700 23.343274722  10.6.15.156 → 192.168.1.12 TCP 66 22 → 54766 [ACK] Seq=154217 Ack=29841 Win=1452 Len=0 TSval=15313382 TSecr=8381879
  701 23.604299005  10.6.15.156 → 192.168.1.12 SSH 270 Server: Encrypted packet (len=204)
  702 23.647191125 192.168.1.12 → 10.6.15.156  TCP 66 54766 → 22 [ACK] Seq=29841 Ack=154421 Win=6155 Len=0 TSval=8381956 TSecr=15313448
  703 23.717384217  10.6.15.156 → 192.168.1.12 SSH 270 Server: Encrypted packet (len=204)
  704 23.717410297 192.168.1.12 → 10.6.15.156  TCP 66 54766 → 22 [ACK] Seq=29841 Ack=154625 Win=6155 Len=0 TSval=8381973 TSecr=15313476
  705 23.767266620  10.6.15.156 → 192.168.1.12 SSH 270 Server: Encrypted packet (len=204)
  706 23.767284835 192.168.1.12 → 10.6.15.156  TCP 66 54766 → 22 [ACK] Seq=29841 Ack=154829 Win=6155 Len=0 TSval=8381986 TSecr=15313488
  707 23.916851524  10.6.15.156 → 192.168.1.12 SSH 150 Server: Encrypted packet (len=84)
  708 23.916869335 192.168.1.12 → 10.6.15.156  TCP 66 54766 → 22 [ACK] Seq=29841 Ack=154913 Win=6155 Len=0 TSval=8382023 TSecr=15313526
  709 23.917182240 192.168.1.12 → 10.6.15.156  SSH 150 Client: Encrypted packet (len=84)
  710 23.918729668  10.6.15.156 → 192.168.1.12 TCP 66 22 → 54766 [ACK] Seq=154913 Ack=29925 Win=1452 Len=0 TSval=15313526 TSecr=8382023
  711 23.943026518  10.6.15.156 → 192.168.1.12 SSH 150 Server: Encrypted packet (len=84)
  712 23.943341964 192.168.1.12 → 10.6.15.156  SSH 150 Client: Encrypted packet (len=84)
  713 23.983975989  10.6.15.156 → 192.168.1.12 TCP 66 22 → 54766 [ACK] Seq=154997 Ack=30009 Win=1452 Len=0 TSval=15313543 TSecr=8382030
  714 24.019296491  10.6.15.156 → 192.168.1.12 SSH 270 Server: Encrypted packet (len=204)
  715 24.063244813 192.168.1.12 → 10.6.15.156  TCP 66 54766 → 22 [ACK] Seq=30009 Ack=155201 Win=6155 Len=0 TSval=8382060 TSecr=15313551
  716 24.127964006  10.6.15.156 → 192.168.1.12 SSH 150 Server: Encrypted packet (len=84)
  717 24.127990795 192.168.1.12 → 10.6.15.156  TCP 66 54766 → 22 [ACK] Seq=30009 Ack=155285 Win=6155 Len=0 TSval=8382076 TSecr=15313579
  718 24.128261366 192.168.1.12 → 10.6.15.156  SSH 150 Client: Encrypted packet (len=84)
  719 24.129481279  10.6.15.156 → 192.168.1.12 TCP 66 22 → 54766 [ACK] Seq=155285 Ack=30093 Win=1452 Len=0 TSval=15313579 TSecr=8382076
  720 24.142927088  10.6.15.156 → 192.168.1.12 SSH 150 Server: Encrypted packet (len=84)
  721 24.143148529 192.168.1.12 → 10.6.15.156  SSH 150 Client: Encrypted packet (len=84)
  722 24.183490914  10.6.15.156 → 192.168.1.12 TCP 66 22 → 54766 [ACK] Seq=155369 Ack=30177 Win=1452 Len=0 TSval=15313593 TSecr=8382079
  723 24.855346147 192.168.1.12 → 10.6.15.156  SSH 110 Client: Encrypted packet (len=44)
  724 24.856752249  10.6.15.156 → 192.168.1.12 TCP 66 22 → 54766 [ACK] Seq=155369 Ack=30221 Win=1452 Len=0 TSval=15313761 TSecr=8382258
  725 24.921882601  10.6.15.156 → 192.168.1.12 SSH 198 Server: Encrypted packet (len=132)
  726 24.957339344  10.6.15.156 → 192.168.1.12 SSH 206 Server: Encrypted packet (len=140)
  727 24.957357096 192.168.1.12 → 10.6.15.156  TCP 66 54766 → 22 [ACK] Seq=30221 Ack=155641 Win=6155 Len=0 TSval=8382283 TSecr=15313777
  728 25.070186215  10.6.15.156 → 192.168.1.12 SSH 198 Server: Encrypted packet (len=132)
  729 25.111245137 192.168.1.12 → 10.6.15.156  TCP 66 54766 → 22 [ACK] Seq=30221 Ack=155773 Win=6155 Len=0 TSval=8382322 TSecr=15313814
  730 25.119838451  10.6.15.156 → 192.168.1.12 SSH 198 Server: Encrypted packet (len=132)
  731 25.119863248 192.168.1.12 → 10.6.15.156  TCP 66 54766 → 22 [ACK] Seq=30221 Ack=155905 Win=6155 Len=0 TSval=8382324 TSecr=15313827
  732 25.136748548  10.6.15.156 → 192.168.1.12 SSH 110 Server: Encrypted packet (len=44)
  733 25.136765793 192.168.1.12 → 10.6.15.156  TCP 66 54766 → 22 [ACK] Seq=30221 Ack=155949 Win=6155 Len=0 TSval=8382328 TSecr=15313831
  734 25.137117997 192.168.1.12 → 10.6.15.156  SSH 206 Client: Encrypted packet (len=140)
  735 25.138734352  10.6.15.156 → 192.168.1.12 TCP 66 22 → 54766 [ACK] Seq=155949 Ack=30361 Win=1452 Len=0 TSval=15313831 TSecr=8382328
  736 25.372191464  10.6.15.156 → 192.168.1.12 SSH 182 Server: Encrypted packet (len=116)
  737 25.408171366  10.6.15.156 → 192.168.1.12 SSH 182 Server: Encrypted packet (len=116)
  738 25.408186992 192.168.1.12 → 10.6.15.156  TCP 66 54766 → 22 [ACK] Seq=30361 Ack=156181 Win=6155 Len=0 TSval=8382396 TSecr=15313890
  739 25.417103247  10.6.15.156 → 192.168.1.12 SSH 1514 Server: Encrypted packet (len=1448)
  740 25.417368568  10.6.15.156 → 192.168.1.12 SSH 1190 Server: Encrypted packet (len=1124)
  741 25.417379590 192.168.1.12 → 10.6.15.156  TCP 66 54766 → 22 [ACK] Seq=30361 Ack=158753 Win=6155 Len=0 TSval=8382398 TSecr=15313901
  742 25.418042611 192.168.1.12 → 10.6.15.156  SSH 406 Client: Encrypted packet (len=340)
  743 25.419730026  10.6.15.156 → 192.168.1.12 TCP 66 22 → 54766 [ACK] Seq=158753 Ack=30701 Win=1452 Len=0 TSval=15313902 TSecr=8382398
  744 25.521335095  10.6.15.156 → 192.168.1.12 SSH 238 Server: Encrypted packet (len=172)
  745 25.563202810 192.168.1.12 → 10.6.15.156  TCP 66 54766 → 22 [ACK] Seq=30701 Ack=158925 Win=6155 Len=0 TSval=8382435 TSecr=15313927
  746 25.571399438  10.6.15.156 → 192.168.1.12 SSH 182 Server: Encrypted packet (len=116)
  747 25.571425011 192.168.1.12 → 10.6.15.156  TCP 66 54766 → 22 [ACK] Seq=30701 Ack=159041 Win=6155 Len=0 TSval=8382437 TSecr=15313939
  748 25.699926124  10.6.15.156 → 192.168.1.12 SSH 158 Server: Encrypted packet (len=92)
  749 25.699952785 192.168.1.12 → 10.6.15.156  TCP 66 54766 → 22 [ACK] Seq=30701 Ack=159133 Win=6155 Len=0 TSval=8382469 TSecr=15313972
  750 25.701518677 192.168.1.12 → 10.6.15.156  SSH 1278 Client: Encrypted packet (len=1212)
  751 25.703880822  10.6.15.156 → 192.168.1.12 TCP 66 22 → 54766 [ACK] Seq=159133 Ack=31913 Win=1452 Len=0 TSval=15313973 TSecr=8382469
  752 25.823260475  10.6.15.156 → 192.168.1.12 SSH 182 Server: Encrypted packet (len=116)
  753 25.859264866  10.6.15.156 → 192.168.1.12 SSH 254 Server: Encrypted packet (len=188)
  754 25.859283148 192.168.1.12 → 10.6.15.156  TCP 66 54766 → 22 [ACK] Seq=31913 Ack=159437 Win=6155 Len=0 TSval=8382509 TSecr=15314002
  755 25.996356452  10.6.15.156 → 192.168.1.12 SSH 1126 Server: Encrypted packet (len=1060)
  756 26.039222667 192.168.1.12 → 10.6.15.156  TCP 66 54766 → 22 [ACK] Seq=31913 Ack=160497 Win=6155 Len=0 TSval=8382554 TSecr=15314046
  757 26.279352402  10.6.15.156 → 192.168.1.12 SSH 254 Server: Encrypted packet (len=188)
  758 26.279376456 192.168.1.12 → 10.6.15.156  TCP 66 54766 → 22 [ACK] Seq=31913 Ack=160685 Win=6155 Len=0 TSval=8382614 TSecr=15314115
  759 26.316471617  10.6.15.156 → 192.168.1.12 SSH 182 Server: Encrypted packet (len=116)
  760 26.316488653 192.168.1.12 → 10.6.15.156  TCP 66 54766 → 22 [ACK] Seq=31913 Ack=160801 Win=6155 Len=0 TSval=8382623 TSecr=15314124
  761 26.423407292  10.6.15.156 → 192.168.1.12 SSH 326 Server: Encrypted packet (len=260)
  762 26.423424706 192.168.1.12 → 10.6.15.156  TCP 66 54766 → 22 [ACK] Seq=31913 Ack=161061 Win=6155 Len=0 TSval=8382650 TSecr=15314152
  763 26.473197956  10.6.15.156 → 192.168.1.12 SSH 326 Server: Encrypted packet (len=260)
  764 26.473216322 192.168.1.12 → 10.6.15.156  TCP 66 54766 → 22 [ACK] Seq=31913 Ack=161321 Win=6155 Len=0 TSval=8382662 TSecr=15314165
  765 26.725281907  10.6.15.156 → 192.168.1.12 SSH 238 Server: Encrypted packet (len=172)
  766 26.725299493 192.168.1.12 → 10.6.15.156  TCP 66 54766 → 22 [ACK] Seq=31913 Ack=161493 Win=6155 Len=0 TSval=8382725 TSecr=15314228
  767 26.761251335  10.6.15.156 → 192.168.1.12 SSH 238 Server: Encrypted packet (len=172)
  768 26.761270102 192.168.1.12 → 10.6.15.156  TCP 66 54766 → 22 [ACK] Seq=31913 Ack=161665 Win=6155 Len=0 TSval=8382734 TSecr=15314237
  769 26.874430659  10.6.15.156 → 192.168.1.12 SSH 222 Server: Encrypted packet (len=156)
  770 26.874448413 192.168.1.12 → 10.6.15.156  TCP 66 54766 → 22 [ACK] Seq=31913 Ack=161821 Win=6155 Len=0 TSval=8382762 TSecr=15314265
  771 26.924374491  10.6.15.156 → 192.168.1.12 SSH 214 Server: Encrypted packet (len=148)
  772 26.924400839 192.168.1.12 → 10.6.15.156  TCP 66 54766 → 22 [ACK] Seq=31913 Ack=161969 Win=6155 Len=0 TSval=8382775 TSecr=15314278
  773 26.943128590  10.6.15.156 → 192.168.1.12 SSH 366 Server: Encrypted packet (len=300)
  774 26.943147258 192.168.1.12 → 10.6.15.156  TCP 66 54766 → 22 [ACK] Seq=31913 Ack=162269 Win=6155 Len=0 TSval=8382779 TSecr=15314282
  775 27.176254853  10.6.15.156 → 192.168.1.12 SSH 222 Server: Encrypted packet (len=156)
  776 27.176271667 192.168.1.12 → 10.6.15.156  TCP 66 54766 → 22 [ACK] Seq=31913 Ack=162425 Win=6155 Len=0 TSval=8382838 TSecr=15314341
  777 27.212328297  10.6.15.156 → 192.168.1.12 SSH 270 Server: Encrypted packet (len=204)
  778 27.212345245 192.168.1.12 → 10.6.15.156  TCP 66 54766 → 22 [ACK] Seq=31913 Ack=162629 Win=6155 Len=0 TSval=8382847 TSecr=15314350
  779 27.325258276  10.6.15.156 → 192.168.1.12 SSH 182 Server: Encrypted packet (len=116)
  780 27.325273024 192.168.1.12 → 10.6.15.156  TCP 66 54766 → 22 [ACK] Seq=31913 Ack=162745 Win=6155 Len=0 TSval=8382875 TSecr=15314378
  781 27.375160255  10.6.15.156 → 192.168.1.12 SSH 270 Server: Encrypted packet (len=204)
  782 27.375176271 192.168.1.12 → 10.6.15.156  TCP 66 54766 → 22 [ACK] Seq=31913 Ack=162949 Win=6155 Len=0 TSval=8382887 TSecr=15314390
  783 27.633551547  10.6.15.156 → 192.168.1.12 SSH 302 Server: Encrypted packet (len=236)
  784 27.633569564 192.168.1.12 → 10.6.15.156  TCP 66 54766 → 22 [ACK] Seq=31913 Ack=163185 Win=6155 Len=0 TSval=8382952 TSecr=15314453
  785 27.670097241  10.6.15.156 → 192.168.1.12 SSH 238 Server: Encrypted packet (len=172)
  786 27.670114849 192.168.1.12 → 10.6.15.156  TCP 66 54766 → 22 [ACK] Seq=31913 Ack=163357 Win=6155 Len=0 TSval=8382961 TSecr=15314462
  787 27.776349438  10.6.15.156 → 192.168.1.12 SSH 302 Server: Encrypted packet (len=236)
  788 27.776365897 192.168.1.12 → 10.6.15.156  TCP 66 54766 → 22 [ACK] Seq=31913 Ack=163593 Win=6155 Len=0 TSval=8382988 TSecr=15314491
  789 27.826373548  10.6.15.156 → 192.168.1.12 SSH 214 Server: Encrypted packet (len=148)
  790 27.826390989 192.168.1.12 → 10.6.15.156  TCP 66 54766 → 22 [ACK] Seq=31913 Ack=163741 Win=6155 Len=0 TSval=8383000 TSecr=15314503
  791 27.855277444 192.168.1.12 → 10.6.15.156  SSH 502 Client: Encrypted packet (len=436)
  792 27.857196114  10.6.15.156 → 192.168.1.12 TCP 66 22 → 54766 [ACK] Seq=163741 Ack=32349 Win=1452 Len=0 TSval=15314511 TSecr=8383008
  793 28.078814925  10.6.15.156 → 192.168.1.12 SSH 222 Server: Encrypted packet (len=156)
  794 28.081166244  10.6.15.156 → 192.168.1.12 SSH 134 Server: Encrypted packet (len=68)
  795 28.081201670 192.168.1.12 → 10.6.15.156  TCP 66 54766 → 22 [ACK] Seq=32349 Ack=163965 Win=6155 Len=0 TSval=8383064 TSecr=15314566
  796 28.114599049  10.6.15.156 → 192.168.1.12 SSH 222 Server: Encrypted packet (len=156)
  797 28.155213278 192.168.1.12 → 10.6.15.156  TCP 66 54766 → 22 [ACK] Seq=32349 Ack=164121 Win=6155 Len=0 TSval=8383083 TSecr=15314575
  798 28.227268978  10.6.15.156 → 192.168.1.12 SSH 214 Server: Encrypted packet (len=148)
  799 28.227294217 192.168.1.12 → 10.6.15.156  TCP 66 54766 → 22 [ACK] Seq=32349 Ack=164269 Win=6155 Len=0 TSval=8383101 TSecr=15314603
  800 28.277091089  10.6.15.156 → 192.168.1.12 SSH 222 Server: Encrypted packet (len=156)
  801 28.277107795 192.168.1.12 → 10.6.15.156  TCP 66 54766 → 22 [ACK] Seq=32349 Ack=164425 Win=6155 Len=0 TSval=8383113 TSecr=15314616
  802 28.444729466  10.6.15.156 → 192.168.1.12 SSH 190 Server: Encrypted packet (len=124)
  803 28.444750321 192.168.1.12 → 10.6.15.156  TCP 66 54766 → 22 [ACK] Seq=32349 Ack=164549 Win=6155 Len=0 TSval=8383155 TSecr=15314658
  804 28.678343695  10.6.15.156 → 192.168.1.12 SSH 270 Server: Encrypted packet (len=204)
  805 28.678362241 192.168.1.12 → 10.6.15.156  TCP 66 54766 → 22 [ACK] Seq=32349 Ack=164753 Win=6155 Len=0 TSval=8383213 TSecr=15314716
  806 28.728070910  10.6.15.156 → 192.168.1.12 SSH 270 Server: Encrypted packet (len=204)
  807 28.728089609 192.168.1.12 → 10.6.15.156  TCP 66 54766 → 22 [ACK] Seq=32349 Ack=164957 Win=6155 Len=0 TSval=8383226 TSecr=15314729
  808 28.980357488  10.6.15.156 → 192.168.1.12 SSH 270 Server: Encrypted packet (len=204)
  809 28.980375762 192.168.1.12 → 10.6.15.156  TCP 66 54766 → 22 [ACK] Seq=32349 Ack=165161 Win=6155 Len=0 TSval=8383289 TSecr=15314792
  810 29.016677423  10.6.15.156 → 192.168.1.12 SSH 270 Server: Encrypted packet (len=204)
  811 29.016695446 192.168.1.12 → 10.6.15.156  TCP 66 54766 → 22 [ACK] Seq=32349 Ack=165365 Win=6155 Len=0 TSval=8383298 TSecr=15314801
  812 29.433483578  10.6.15.156 → 192.168.1.12 SSH 374 Server: Encrypted packet (len=308)
  813 29.433501200 192.168.1.12 → 10.6.15.156  TCP 66 54766 → 22 [ACK] Seq=32349 Ack=165673 Win=6155 Len=0 TSval=8383402 TSecr=15314905
  814 29.467460245  10.6.15.156 → 192.168.1.12 SSH 374 Server: Encrypted packet (len=308)
  815 29.467480495 192.168.1.12 → 10.6.15.156  TCP 66 54766 → 22 [ACK] Seq=32349 Ack=165981 Win=6155 Len=0 TSval=8383411 TSecr=15314914
  816 29.580527785  10.6.15.156 → 192.168.1.12 SSH 342 Server: Encrypted packet (len=276)
  817 29.580546895 192.168.1.12 → 10.6.15.156  TCP 66 54766 → 22 [ACK] Seq=32349 Ack=166257 Win=6155 Len=0 TSval=8383439 TSecr=15314942
  818 29.630201735  10.6.15.156 → 192.168.1.12 SSH 342 Server: Encrypted packet (len=276)
  819 29.630220958 192.168.1.12 → 10.6.15.156  TCP 66 54766 → 22 [ACK] Seq=32349 Ack=166533 Win=6155 Len=0 TSval=8383451 TSecr=15314954
  820 29.797366650  10.6.15.156 → 192.168.1.12 SSH 366 Server: Encrypted packet (len=300)
  821 29.797384699 192.168.1.12 → 10.6.15.156  TCP 66 54766 → 22 [ACK] Seq=32349 Ack=166833 Win=6155 Len=0 TSval=8383493 TSecr=15314996
  822 29.814661679  10.6.15.156 → 192.168.1.12 SSH 190 Server: Encrypted packet (len=124)
  823 29.814679338 192.168.1.12 → 10.6.15.156  TCP 66 54766 → 22 [ACK] Seq=32349 Ack=166957 Win=6155 Len=0 TSval=8383497 TSecr=15315000
  824 29.848063341 192.168.1.12 → 10.6.15.156  SSH 502 Client: Encrypted packet (len=436)
  825 29.849935811  10.6.15.156 → 192.168.1.12 TCP 66 22 → 54766 [ACK] Seq=166957 Ack=32785 Win=1452 Len=0 TSval=15315009 TSecr=8383506
  826 29.882405434  10.6.15.156 → 192.168.1.12 SSH 270 Server: Encrypted packet (len=204)
  827 29.918350629  10.6.15.156 → 192.168.1.12 SSH 270 Server: Encrypted packet (len=204)
  828 29.918368302 192.168.1.12 → 10.6.15.156  TCP 66 54766 → 22 [ACK] Seq=32785 Ack=167365 Win=6155 Len=0 TSval=8383523 TSecr=15315017
  829 30.031451456  10.6.15.156 → 192.168.1.12 SSH 302 Server: Encrypted packet (len=236)
  830 30.074257576  10.6.15.156 → 192.168.1.12 SSH 134 Server: Encrypted packet (len=68)
  831 30.074283967 192.168.1.12 → 10.6.15.156  TCP 66 54766 → 22 [ACK] Seq=32785 Ack=167669 Win=6155 Len=0 TSval=8383562 TSecr=15315054
  832 30.081141368  10.6.15.156 → 192.168.1.12 SSH 310 Server: Encrypted packet (len=244)
  833 30.123242510 192.168.1.12 → 10.6.15.156  TCP 66 54766 → 22 [ACK] Seq=32785 Ack=167913 Win=6155 Len=0 TSval=8383575 TSecr=15315067
  834 30.333320886  10.6.15.156 → 192.168.1.12 SSH 182 Server: Encrypted packet (len=116)
  835 30.333341770 192.168.1.12 → 10.6.15.156  TCP 66 54766 → 22 [ACK] Seq=32785 Ack=168029 Win=6155 Len=0 TSval=8383627 TSecr=15315130
  836 30.370821470  10.6.15.156 → 192.168.1.12 SSH 182 Server: Encrypted packet (len=116)
  837 30.370830824 192.168.1.12 → 10.6.15.156  TCP 66 54766 → 22 [ACK] Seq=32785 Ack=168145 Win=6155 Len=0 TSval=8383636 TSecr=15315139
  838 30.482558315  10.6.15.156 → 192.168.1.12 SSH 182 Server: Encrypted packet (len=116)
  839 30.482574186 192.168.1.12 → 10.6.15.156  TCP 66 54766 → 22 [ACK] Seq=32785 Ack=168261 Win=6155 Len=0 TSval=8383664 TSecr=15315167
  840 30.532060326  10.6.15.156 → 192.168.1.12 SSH 182 Server: Encrypted packet (len=116)
  841 30.532077468 192.168.1.12 → 10.6.15.156  TCP 66 54766 → 22 [ACK] Seq=32785 Ack=168377 Win=6155 Len=0 TSval=8383677 TSecr=15315180
  842 30.784718012  10.6.15.156 → 192.168.1.12 SSH 342 Server: Encrypted packet (len=276)
  843 30.784735411 192.168.1.12 → 10.6.15.156  TCP 66 54766 → 22 [ACK] Seq=32785 Ack=168653 Win=6155 Len=0 TSval=8383740 TSecr=15315243
  844 30.821593582  10.6.15.156 → 192.168.1.12 SSH 550 Server: Encrypted packet (len=484)
  845 30.821611324 192.168.1.12 → 10.6.15.156  TCP 66 54766 → 22 [ACK] Seq=32785 Ack=169137 Win=6155 Len=0 TSval=8383749 TSecr=15315252
  846 30.934334184  10.6.15.156 → 192.168.1.12 SSH 214 Server: Encrypted packet (len=148)
  847 30.934357478 192.168.1.12 → 10.6.15.156  TCP 66 54766 → 22 [ACK] Seq=32785 Ack=169285 Win=6155 Len=0 TSval=8383777 TSecr=15315280
  848 30.983761331  10.6.15.156 → 192.168.1.12 SSH 334 Server: Encrypted packet (len=268)
  849 30.983779159 192.168.1.12 → 10.6.15.156  TCP 66 54766 → 22 [ACK] Seq=32785 Ack=169553 Win=6155 Len=0 TSval=8383790 TSecr=15315293
  850 31.235587250  10.6.15.156 → 192.168.1.12 SSH 470 Server: Encrypted packet (len=404)
  851 31.235605477 192.168.1.12 → 10.6.15.156  TCP 66 54766 → 22 [ACK] Seq=32785 Ack=169957 Win=6155 Len=0 TSval=8383853 TSecr=15315356
  852 31.272615157  10.6.15.156 → 192.168.1.12 SSH 270 Server: Encrypted packet (len=204)
  853 31.272633401 192.168.1.12 → 10.6.15.156  TCP 66 54766 → 22 [ACK] Seq=32785 Ack=170161 Win=6155 Len=0 TSval=8383862 TSecr=15315365
  854 31.385137137  10.6.15.156 → 192.168.1.12 SSH 534 Server: Encrypted packet (len=468)
  855 31.385155274 192.168.1.12 → 10.6.15.156  TCP 66 54766 → 22 [ACK] Seq=32785 Ack=170629 Win=6155 Len=0 TSval=8383890 TSecr=15315393
  856 31.434245648  10.6.15.156 → 192.168.1.12 SSH 270 Server: Encrypted packet (len=204)
  857 31.434263706 192.168.1.12 → 10.6.15.156  TCP 66 54766 → 22 [ACK] Seq=32785 Ack=170833 Win=6155 Len=0 TSval=8383902 TSecr=15315405
  858 31.686620909  10.6.15.156 → 192.168.1.12 SSH 182 Server: Encrypted packet (len=116)
  859 31.686644584 192.168.1.12 → 10.6.15.156  TCP 66 54766 → 22 [ACK] Seq=32785 Ack=170949 Win=6155 Len=0 TSval=8383965 TSecr=15315468
  860 31.723169575  10.6.15.156 → 192.168.1.12 SSH 182 Server: Encrypted packet (len=116)
  861 31.723188957 192.168.1.12 → 10.6.15.156  TCP 66 54766 → 22 [ACK] Seq=32785 Ack=171065 Win=6155 Len=0 TSval=8383975 TSecr=15315477
  862 31.835469781  10.6.15.156 → 192.168.1.12 SSH 254 Server: Encrypted packet (len=188)
  863 31.835494040 192.168.1.12 → 10.6.15.156  TCP 66 54766 → 22 [ACK] Seq=32785 Ack=171253 Win=6155 Len=0 TSval=8384003 TSecr=15315506
  864 31.885439962  10.6.15.156 → 192.168.1.12 SSH 422 Server: Encrypted packet (len=356)
  865 31.885457913 192.168.1.12 → 10.6.15.156  TCP 66 54766 → 22 [ACK] Seq=32785 Ack=171609 Win=6155 Len=0 TSval=8384015 TSecr=15315518
  866 32.137434411  10.6.15.156 → 192.168.1.12 SSH 406 Server: Encrypted packet (len=340)
  867 32.137452052 192.168.1.12 → 10.6.15.156  TCP 66 54766 → 22 [ACK] Seq=32785 Ack=171949 Win=6155 Len=0 TSval=8384078 TSecr=15315581
  868 32.174431747  10.6.15.156 → 192.168.1.12 SSH 406 Server: Encrypted packet (len=340)
  869 32.174448553 192.168.1.12 → 10.6.15.156  TCP 66 54766 → 22 [ACK] Seq=32785 Ack=172289 Win=6155 Len=0 TSval=8384087 TSecr=15315590
  870 32.286320664  10.6.15.156 → 192.168.1.12 SSH 334 Server: Encrypted packet (len=268)
  871 32.286339349 192.168.1.12 → 10.6.15.156  TCP 66 54766 → 22 [ACK] Seq=32785 Ack=172557 Win=6155 Len=0 TSval=8384115 TSecr=15315618
  872 32.336763636  10.6.15.156 → 192.168.1.12 SSH 406 Server: Encrypted packet (len=340)
  873 32.336799912 192.168.1.12 → 10.6.15.156  TCP 66 54766 → 22 [ACK] Seq=32785 Ack=172897 Win=6155 Len=0 TSval=8384128 TSecr=15315631
  874 32.588322209  10.6.15.156 → 192.168.1.12 SSH 238 Server: Encrypted packet (len=172)
  875 32.588341184 192.168.1.12 → 10.6.15.156  TCP 66 54766 → 22 [ACK] Seq=32785 Ack=173069 Win=6155 Len=0 TSval=8384191 TSecr=15315694
  876 32.625380254  10.6.15.156 → 192.168.1.12 SSH 238 Server: Encrypted packet (len=172)
  877 32.625397945 192.168.1.12 → 10.6.15.156  TCP 66 54766 → 22 [ACK] Seq=32785 Ack=173241 Win=6155 Len=0 TSval=8384200 TSecr=15315703
  878 32.737461274  10.6.15.156 → 192.168.1.12 SSH 302 Server: Encrypted packet (len=236)
  879 32.737480649 192.168.1.12 → 10.6.15.156  TCP 66 54766 → 22 [ACK] Seq=32785 Ack=173477 Win=6155 Len=0 TSval=8384228 TSecr=15315731
  880 32.787108332  10.6.15.156 → 192.168.1.12 SSH 238 Server: Encrypted packet (len=172)
  881 32.787127393 192.168.1.12 → 10.6.15.156  TCP 66 54766 → 22 [ACK] Seq=32785 Ack=173649 Win=6155 Len=0 TSval=8384240 TSecr=15315743
  882 33.039234281  10.6.15.156 → 192.168.1.12 SSH 182 Server: Encrypted packet (len=116)
  883 33.039250286 192.168.1.12 → 10.6.15.156  TCP 66 54766 → 22 [ACK] Seq=32785 Ack=173765 Win=6155 Len=0 TSval=8384304 TSecr=15315806
  884 33.076157579  10.6.15.156 → 192.168.1.12 SSH 182 Server: Encrypted packet (len=116)
  885 33.076174896 192.168.1.12 → 10.6.15.156  TCP 66 54766 → 22 [ACK] Seq=32785 Ack=173881 Win=6155 Len=0 TSval=8384313 TSecr=15315816
  886 33.639298800  10.6.15.156 → 192.168.1.12 SSH 222 Server: Encrypted packet (len=156)
  887 33.639316232 192.168.1.12 → 10.6.15.156  TCP 66 54766 → 22 [ACK] Seq=32785 Ack=174037 Win=6155 Len=0 TSval=8384454 TSecr=15315956
  888 33.689151040  10.6.15.156 → 192.168.1.12 SSH 214 Server: Encrypted packet (len=148)
  889 33.689169133 192.168.1.12 → 10.6.15.156  TCP 66 54766 → 22 [ACK] Seq=32785 Ack=174185 Win=6155 Len=0 TSval=8384466 TSecr=15315969
  890 33.941287948  10.6.15.156 → 192.168.1.12 SSH 270 Server: Encrypted packet (len=204)
  891 33.941305555 192.168.1.12 → 10.6.15.156  TCP 66 54766 → 22 [ACK] Seq=32785 Ack=174389 Win=6155 Len=0 TSval=8384529 TSecr=15316032
  892 33.979022224  10.6.15.156 → 192.168.1.12 SSH 950 Server: Encrypted packet (len=884)
  893 33.979040707 192.168.1.12 → 10.6.15.156  TCP 66 54766 → 22 [ACK] Seq=32785 Ack=175273 Win=6155 Len=0 TSval=8384538 TSecr=15316041
  894 34.092511935  10.6.15.156 → 192.168.1.12 SSH 870 Server: Encrypted packet (len=804)
  895 34.092529876 192.168.1.12 → 10.6.15.156  TCP 66 54766 → 22 [ACK] Seq=32785 Ack=176077 Win=6155 Len=0 TSval=8384567 TSecr=15316069
  896 34.140994634  10.6.15.156 → 192.168.1.12 SSH 870 Server: Encrypted packet (len=804)
  897 34.141012976 192.168.1.12 → 10.6.15.156  TCP 66 54766 → 22 [ACK] Seq=32785 Ack=176881 Win=6155 Len=0 TSval=8384579 TSecr=15316082
