    1 0.000000000  10.6.15.156 → 192.168.1.12 SSH 182 Server: Encrypted packet (len=116)
    2 0.000017012 192.168.1.12 → 10.6.15.156  TCP 66 54766 → 22 [ACK] Seq=1 Ack=117 Win=6155 Len=0 TSval=8033994 TSecr=14965493
    3 0.056004444  10.6.15.156 → 192.168.1.12 SSH 182 Server: Encrypted packet (len=116)
    4 0.056022335 192.168.1.12 → 10.6.15.156  TCP 66 54766 → 22 [ACK] Seq=1 Ack=233 Win=6155 Len=0 TSval=8034008 TSecr=14965507
    5 0.156240800  10.6.15.156 → 192.168.1.12 SSH 182 Server: Encrypted packet (len=116)
    6 0.242318776  10.6.15.156 → 192.168.1.12 SSH 174 Server: Encrypted packet (len=108)
    7 0.242338931  10.6.15.156 → 192.168.1.12 SSH 102 Server: Encrypted packet (len=36)
    8 0.297977983  10.6.15.156 → 192.168.1.12 SSH 110 Server: Encrypted packet (len=44)
    9 0.621717963 192.168.1.12 → 10.6.15.156  TCP 66 54766 → 22 [ACK] Seq=1 Ack=349 Win=6155 Len=0 TSval=8034033 TSecr=14965532
   10 0.621731424 192.168.1.12 → 10.6.15.156  TCP 66 54766 → 22 [ACK] Seq=1 Ack=457 Win=6155 Len=0 TSval=8034055 TSecr=14965554
   11 0.621733208 192.168.1.12 → 10.6.15.156  TCP 66 54766 → 22 [ACK] Seq=1 Ack=493 Win=6155 Len=0 TSval=8034055 TSecr=14965554
   12 0.621735100 192.168.1.12 → 10.6.15.156  SSH 138 Client: Encrypted packet (len=72)
   13 0.621739172 192.168.1.12 → 10.6.15.156  TCP 66 54766 → 22 [ACK] Seq=73 Ack=537 Win=6155 Len=0 TSval=8034081 TSecr=14965567
   14 0.621741212 192.168.1.12 → 10.6.15.156  SSH 118 Client: Encrypted packet (len=52)
   15 0.622559880  10.6.15.156 → 192.168.1.12 SSH 190 Server: Encrypted packet (len=124)
   16 0.622583532  10.6.15.156 → 192.168.1.12 SSH 354 Server: Encrypted packet (len=288)
   17 0.622588312  10.6.15.156 → 192.168.1.12 SSH 102 Server: Encrypted packet (len=36)
   18 0.622603286  10.6.15.156 → 192.168.1.12 SSH 102 Server: Encrypted packet (len=36)
   19 0.622662625 192.168.1.12 → 10.6.15.156  TCP 66 54766 → 22 [ACK] Seq=125 Ack=1021 Win=6155 Len=0 TSval=8034150 TSecr=14965576
   20 0.623154603  10.6.15.156 → 192.168.1.12 SSH 214 Server: Encrypted packet (len=148)
   21 0.623163275  10.6.15.156 → 192.168.1.12 SSH 222 Server: Encrypted packet (len=156)
   22 0.623195288 192.168.1.12 → 10.6.15.156  TCP 66 54766 → 22 [ACK] Seq=125 Ack=1325 Win=6155 Len=0 TSval=8034150 TSecr=14965606
   23 0.624860530  10.6.15.156 → 192.168.1.12 SSH 270 Server: Encrypted packet (len=204)
   24 0.624882165  10.6.15.156 → 192.168.1.12 TCP 66 22 → 54766 [ACK] Seq=1529 Ack=125 Win=1452 Len=0 TSval=14965649 TSecr=8034055
   25 0.624952756 192.168.1.12 → 10.6.15.156  TCP 66 54766 → 22 [ACK] Seq=125 Ack=1529 Win=6155 Len=0 TSval=8034150 TSecr=14965649
   26 0.624968492  10.6.15.156 → 192.168.1.12 SSH 102 Server: Encrypted packet (len=36)
   27 0.625021071 192.168.1.12 → 10.6.15.156  TCP 66 54766 → 22 [ACK] Seq=125 Ack=1565 Win=6155 Len=0 TSval=8034150 TSecr=14965649
   28 0.835064279  10.6.15.156 → 192.168.1.12 SSH 238 Server: Encrypted packet (len=172)
   29 0.866001866  10.6.15.156 → 192.168.1.12 SSH 174 Server: Encrypted packet (len=108)
   30 0.866095887  10.6.15.156 → 192.168.1.12 SSH 102 Server: Encrypted packet (len=36)
   31 0.902462250  10.6.15.156 → 192.168.1.12 SSH 270 Server: Encrypted packet (len=204)
   32 0.957946176  10.6.15.156 → 192.168.1.12 SSH 342 Server: Encrypted packet (len=276)
   33 1.020177607  10.6.15.156 → 192.168.1.12 SSH 182 Server: Encrypted packet (len=116)
   34 1.333685872 192.168.1.12 → 10.6.15.156  TCP 66 54766 → 22 [ACK] Seq=125 Ack=1737 Win=6155 Len=0 TSval=8034203 TSecr=14965702
   35 1.333696062 192.168.1.12 → 10.6.15.156  TCP 66 54766 → 22 [ACK] Seq=125 Ack=1845 Win=6155 Len=0 TSval=8034211 TSecr=14965709
   36 1.333697826 192.168.1.12 → 10.6.15.156  TCP 66 54766 → 22 [ACK] Seq=125 Ack=1881 Win=6155 Len=0 TSval=8034211 TSecr=14965709
   37 1.333699393 192.168.1.12 → 10.6.15.156  SSH 138 Client: Encrypted packet (len=72)
   38 1.333702039 192.168.1.12 → 10.6.15.156  TCP 66 54766 → 22 [ACK] Seq=197 Ack=2361 Win=6155 Len=0 TSval=8034234 TSecr=14965718
   39 1.333703732 192.168.1.12 → 10.6.15.156  TCP 66 54766 → 22 [ACK] Seq=197 Ack=2477 Win=6155 Len=0 TSval=8034264 TSecr=14965748
   40 1.334441625 192.168.1.12 → 10.6.15.156  SSH 994 Client: Encrypted packet (len=928)
   41 1.334534711  10.6.15.156 → 192.168.1.12 SSH 270 Server: Encrypted packet (len=204)
   42 1.334553296  10.6.15.156 → 192.168.1.12 SSH 270 Server: Encrypted packet (len=204)
   43 1.334614605 192.168.1.12 → 10.6.15.156  TCP 66 54766 → 22 [ACK] Seq=1125 Ack=2885 Win=6155 Len=0 TSval=8034328 TSecr=14965758
   44 1.336494148  10.6.15.156 → 192.168.1.12 SSH 102 Server: Encrypted packet (len=36)
   45 1.336576779 192.168.1.12 → 10.6.15.156  TCP 66 54766 → 22 [ACK] Seq=1125 Ack=2921 Win=6155 Len=0 TSval=8034328 TSecr=14965827
   46 1.355804309  10.6.15.156 → 192.168.1.12 SSH 270 Server: Encrypted packet (len=204)
   47 1.355885665 192.168.1.12 → 10.6.15.156  TCP 66 54766 → 22 [ACK] Seq=1125 Ack=3125 Win=6155 Len=0 TSval=8034333 TSecr=14965832
   48 1.384472556  10.6.15.156 → 192.168.1.12 SSH 210 Server: Encrypted packet (len=144)
   49 1.384538159 192.168.1.12 → 10.6.15.156  TCP 66 54766 → 22 [ACK] Seq=1125 Ack=3269 Win=6155 Len=0 TSval=8034340 TSecr=14965839
   50 1.384814137 192.168.1.12 → 10.6.15.156  SSH 138 Client: Encrypted packet (len=72)
   51 1.385998767  10.6.15.156 → 192.168.1.12 SSH 102 Server: Encrypted packet (len=36)
   52 1.407944500  10.6.15.156 → 192.168.1.12 SSH 102 Server: Encrypted packet (len=36)
   53 1.408026531 192.168.1.12 → 10.6.15.156  TCP 66 54766 → 22 [ACK] Seq=1197 Ack=3341 Win=6155 Len=0 TSval=8034346 TSecr=14965839
   54 1.408805300  10.6.15.156 → 192.168.1.12 SSH 954 Server: Encrypted packet (len=888)
   55 1.408814648  10.6.15.156 → 192.168.1.12 SSH 102 Server: Encrypted packet (len=36)
   56 1.408840539 192.168.1.12 → 10.6.15.156  TCP 66 54766 → 22 [ACK] Seq=1197 Ack=4265 Win=6155 Len=0 TSval=8034346 TSecr=14965845
   57 1.424886450 192.168.1.12 → 10.6.15.156  SSH 1514 Client: Encrypted packet (len=1448)
   58 1.466753228  10.6.15.156 → 192.168.1.12 TCP 66 22 → 54766 [ACK] Seq=4265 Ack=2645 Win=1452 Len=0 TSval=14965860 TSecr=8034350
   59 1.466775430 192.168.1.12 → 10.6.15.156  SSH 1126 Client: Encrypted packet (len=1060)
   60 1.469641873  10.6.15.156 → 192.168.1.12 TCP 66 22 → 54766 [ACK] Seq=4265 Ack=3705 Win=1452 Len=0 TSval=14965860 TSecr=8034361
   61 1.472349964  10.6.15.156 → 192.168.1.12 SSH 142 Server: Encrypted packet (len=76)
   62 1.509822622  10.6.15.156 → 192.168.1.12 SSH 998 Server: Encrypted packet (len=932)
   63 1.509838765 192.168.1.12 → 10.6.15.156  TCP 66 54766 → 22 [ACK] Seq=3705 Ack=5273 Win=6155 Len=0 TSval=8034372 TSecr=14965861
   64 1.555085329  10.6.15.156 → 192.168.1.12 SSH 138 Server: Encrypted packet (len=72)
   65 1.581730696  10.6.15.156 → 192.168.1.12 SSH 1110 Server: Encrypted packet (len=1044)
   66 1.582664924  10.6.15.156 → 192.168.1.12 SSH 390 Server: Encrypted packet (len=324)
   67 1.716006444  10.6.15.156 → 192.168.1.12 SSH 110 Server: Encrypted packet (len=44)
   68 1.718661203  10.6.15.156 → 192.168.1.12 SSH 102 Server: Encrypted packet (len=36)
   69 1.723638020  10.6.15.156 → 192.168.1.12 SSH 158 Server: Encrypted packet (len=92)
   70 1.724907570  10.6.15.156 → 192.168.1.12 SSH 1514 Server: Encrypted packet (len=1448)
   71 1.725072660  10.6.15.156 → 192.168.1.12 SSH 1514 Server: Encrypted packet (len=1448)
   72 1.725478375  10.6.15.156 → 192.168.1.12 SSH 638 Server: Encrypted packet (len=572)
   73 1.730674805  10.6.15.156 → 192.168.1.12 SSH 138 Server: Encrypted packet (len=72)
   74 1.732304097  10.6.15.156 → 192.168.1.12 SSH 102 Server: Encrypted packet (len=36)
   75 1.733708796  10.6.15.156 → 192.168.1.12 SSH 102 Server: Encrypted packet (len=36)
   76 1.737256837  10.6.15.156 → 192.168.1.12 SSH 982 Server: Encrypted packet (len=916)
   77 2.053727782 192.168.1.12 → 10.6.15.156  SSH 102 Client: Encrypted packet (len=36)
   78 2.053739491 192.168.1.12 → 10.6.15.156  TCP 66 54766 → 22 [ACK] Seq=3741 Ack=6713 Win=6155 Len=0 TSval=8034390 TSecr=14965888
   79 2.053741234 192.168.1.12 → 10.6.15.156  SSH 142 Client: Encrypted packet (len=76)
   80 2.053743531 192.168.1.12 → 10.6.15.156  TCP 66 54766 → 22 [ACK] Seq=3817 Ack=6885 Win=6155 Len=0 TSval=8034425 TSecr=14965923
   81 2.053745251 192.168.1.12 → 10.6.15.156  TCP 66 54766 → 22 [ACK] Seq=3817 Ack=9781 Win=6155 Len=0 TSval=8034425 TSecr=14965924
   82 2.053746974 192.168.1.12 → 10.6.15.156  TCP 66 54766 → 22 [ACK] Seq=3817 Ack=10425 Win=6155 Len=0 TSval=8034427 TSecr=14965924
   83 2.053748667 192.168.1.12 → 10.6.15.156  TCP 66 54766 → 22 [ACK] Seq=3817 Ack=10497 Win=6155 Len=0 TSval=8034428 TSecr=14965926
   84 2.053750401 192.168.1.12 → 10.6.15.156  TCP 66 54766 → 22 [ACK] Seq=3817 Ack=11413 Win=6155 Len=0 TSval=8034439 TSecr=14965927
   85 2.054632202 192.168.1.12 → 10.6.15.156  SSH 478 Client: Encrypted packet (len=412)
   86 2.054655855  10.6.15.156 → 192.168.1.12 SSH 102 Server: Encrypted packet (len=36)
   87 2.054673998  10.6.15.156 → 192.168.1.12 SSH 102 Server: Encrypted packet (len=36)
   88 2.054742008 192.168.1.12 → 10.6.15.156  TCP 66 54766 → 22 [ACK] Seq=4229 Ack=11485 Win=6155 Len=0 TSval=8034508 TSecr=14965930
   89 2.054794185  10.6.15.156 → 192.168.1.12 SSH 950 Server: Encrypted packet (len=884)
   90 2.054798090  10.6.15.156 → 192.168.1.12 SSH 138 Server: Encrypted packet (len=72)
   91 2.054801379  10.6.15.156 → 192.168.1.12 SSH 110 Server: Encrypted packet (len=44)
   92 2.054830685 192.168.1.12 → 10.6.15.156  TCP 66 54766 → 22 [ACK] Seq=4229 Ack=12485 Win=6155 Len=0 TSval=8034508 TSecr=14965944
   93 2.054977039  10.6.15.156 → 192.168.1.12 SSH 138 Server: Encrypted packet (len=72)
   94 2.054989987  10.6.15.156 → 192.168.1.12 SSH 102 Server: Encrypted packet (len=36)
   95 2.055031087 192.168.1.12 → 10.6.15.156  TCP 66 54766 → 22 [ACK] Seq=4229 Ack=12593 Win=6155 Len=0 TSval=8034508 TSecr=14965948
   96 2.056652948  10.6.15.156 → 192.168.1.12 SSH 630 Server: Encrypted packet (len=564)
   97 2.056675894 192.168.1.12 → 10.6.15.156  SSH 174 Client: Encrypted packet (len=108)
   98 2.056715748  10.6.15.156 → 192.168.1.12 TCP 66 22 → 54766 [ACK] Seq=13157 Ack=4229 Win=1452 Len=0 TSval=14966007 TSecr=8034423
   99 2.098050205  10.6.15.156 → 192.168.1.12 TCP 66 22 → 54766 [ACK] Seq=13157 Ack=4337 Win=1452 Len=0 TSval=14966018 TSecr=8034508
  100 2.098072510 192.168.1.12 → 10.6.15.156  SSH 138 Client: Encrypted packet (len=72)
  101 2.099779544  10.6.15.156 → 192.168.1.12 TCP 66 22 → 54766 [ACK] Seq=13157 Ack=4409 Win=1452 Len=0 TSval=14966018 TSecr=8034519
  102 2.115429518 192.168.1.12 → 139.59.21.22 NTP 90 NTP Version 4, client
  103 2.187562561  10.6.15.156 → 192.168.1.12 SSH 238 Server: Encrypted packet (len=172)
  104 2.229622576 192.168.1.12 → 10.6.15.156  TCP 66 54766 → 22 [ACK] Seq=4409 Ack=13329 Win=6155 Len=0 TSval=8034552 TSecr=14966040
  105 2.255485324  10.6.15.156 → 192.168.1.12 SSH 206 Server: Encrypted packet (len=140)
  106 2.255574603 192.168.1.12 → 10.6.15.156  TCP 66 54766 → 22 [ACK] Seq=4409 Ack=13469 Win=6155 Len=0 TSval=8034558 TSecr=14966057
  107 2.442912086  10.6.15.156 → 192.168.1.12 SSH 758 Server: Encrypted packet (len=692)
  108 2.451698546  10.6.15.156 → 192.168.1.12 SSH 1470 Server: Encrypted packet (len=1404)
  109 2.452523862  10.6.15.156 → 192.168.1.12 SSH 1514 Server: Encrypted packet (len=1448)
  110 2.452699190  10.6.15.156 → 192.168.1.12 SSH 1514 Server: Encrypted packet (len=1448)
  111 2.453000098  10.6.15.156 → 192.168.1.12 SSH 1414 Server: Encrypted packet (len=1348)
  112 2.453174855  10.6.15.156 → 192.168.1.12 SSH 1514 Server: Encrypted packet (len=1448)
  113 2.453334728  10.6.15.156 → 192.168.1.12 SSH 1414 Server: Encrypted packet (len=1348)
  114 2.456883414  10.6.15.156 → 192.168.1.12 SSH 126 Server: Encrypted packet (len=60)
  115 2.458057241  10.6.15.156 → 192.168.1.12 SSH 1514 Server: Encrypted packet (len=1448)
  116 2.458210716  10.6.15.156 → 192.168.1.12 SSH 1222 Server: Encrypted packet (len=1156)
  117 2.773719434 192.168.1.12 → 10.6.15.156  TCP 66 54766 → 22 [ACK] Seq=4409 Ack=14161 Win=6155 Len=0 TSval=8034605 TSecr=14966104
  118 2.773729423 192.168.1.12 → 10.6.15.156  TCP 66 54766 → 22 [ACK] Seq=4409 Ack=15565 Win=6155 Len=0 TSval=8034607 TSecr=14966106
  119 2.773730998 192.168.1.12 → 10.6.15.156  TCP 66 54766 → 22 [ACK] Seq=4409 Ack=18461 Win=6155 Len=0 TSval=8034607 TSecr=14966106
  120 2.773732573 192.168.1.12 → 10.6.15.156  TCP 66 54766 → 22 [ACK] Seq=4409 Ack=19809 Win=6155 Len=0 TSval=8034607 TSecr=14966106
  121 2.773734263 192.168.1.12 → 10.6.15.156  TCP 66 54766 → 22 [ACK] Seq=4409 Ack=22605 Win=6155 Len=0 TSval=8034607 TSecr=14966106
  122 2.773735848 192.168.1.12 → 10.6.15.156  TCP 66 54766 → 22 [ACK] Seq=4409 Ack=22665 Win=6155 Len=0 TSval=8034608 TSecr=14966107
  123 2.773737365 192.168.1.12 → 10.6.15.156  TCP 66 54766 → 22 [ACK] Seq=4409 Ack=25269 Win=6155 Len=0 TSval=8034609 TSecr=14966107
  124 2.775221264  10.6.15.156 → 192.168.1.12 SSH 1514 Server: Encrypted packet (len=1448)
  125 2.775329990  10.6.15.156 → 192.168.1.12 SSH 1514 Server: Encrypted packet (len=1448)
  126 2.775341965 192.168.1.12 → 10.6.15.156  TCP 66 54766 → 22 [ACK] Seq=4409 Ack=28165 Win=6155 Len=0 TSval=8034688 TSecr=14966108
  127 2.775535679  10.6.15.156 → 192.168.1.12 SSH 1514 Server: Encrypted packet (len=1448)
  128 2.775560102  10.6.15.156 → 192.168.1.12 SSH 150 Server: Encrypted packet (len=84)
  129 2.775578082 192.168.1.12 → 10.6.15.156  TCP 66 54766 → 22 [ACK] Seq=4409 Ack=29697 Win=6155 Len=0 TSval=8034688 TSecr=14966108
  130 2.775699316  10.6.15.156 → 192.168.1.12 SSH 1514 Server: Encrypted packet (len=1448)
  131 2.775875215  10.6.15.156 → 192.168.1.12 SSH 1514 Server: Encrypted packet (len=1448)
  132 2.775880610 192.168.1.12 → 10.6.15.156  TCP 66 54766 → 22 [ACK] Seq=4409 Ack=32593 Win=6155 Len=0 TSval=8034688 TSecr=14966108
  133 2.775974111  10.6.15.156 → 192.168.1.12 SSH 1054 Server: Encrypted packet (len=988)
  134 2.776002759 192.168.1.12 → 10.6.15.156  TCP 66 54766 → 22 [ACK] Seq=4409 Ack=33581 Win=6155 Len=0 TSval=8034688 TSecr=14966108
  135 2.776162547  10.6.15.156 → 192.168.1.12 SSH 1514 Server: Encrypted packet (len=1448)
  136 2.776332241  10.6.15.156 → 192.168.1.12 SSH 1514 Server: Encrypted packet (len=1448)
  137 2.776337766 192.168.1.12 → 10.6.15.156  TCP 66 54766 → 22 [ACK] Seq=4409 Ack=36477 Win=6155 Len=0 TSval=8034688 TSecr=14966108
  138 2.776672503  10.6.15.156 → 192.168.1.12 SSH 1514 Server: Encrypted packet (len=1448)
  139 2.776744659  10.6.15.156 → 192.168.1.12 SSH 886 Server: Encrypted packet (len=820)
  140 2.776747336 192.168.1.12 → 10.6.15.156  TCP 66 54766 → 22 [ACK] Seq=4409 Ack=38745 Win=6155 Len=0 TSval=8034688 TSecr=14966108
  141 2.777084400  10.6.15.156 → 192.168.1.12 SSH 1514 Server: Encrypted packet (len=1448)
  142 2.777256937  10.6.15.156 → 192.168.1.12 SSH 1514 Server: Encrypted packet (len=1448)
  143 2.777260693 192.168.1.12 → 10.6.15.156  TCP 66 54766 → 22 [ACK] Seq=4409 Ack=41641 Win=6155 Len=0 TSval=8034688 TSecr=14966187
  144 2.777457235  10.6.15.156 → 192.168.1.12 SSH 1514 Server: Encrypted packet (len=1448)
  145 2.779026199  10.6.15.156 → 192.168.1.12 SSH 1514 Server: Encrypted packet (len=1448)
  146 2.779034931 192.168.1.12 → 10.6.15.156  TCP 66 54766 → 22 [ACK] Seq=4409 Ack=44537 Win=6155 Len=0 TSval=8034689 TSecr=14966187
  147 2.779195075  10.6.15.156 → 192.168.1.12 SSH 1514 Server: Encrypted packet (len=1448)
  148 2.779394219  10.6.15.156 → 192.168.1.12 SSH 1514 Server: Encrypted packet (len=1448)
  149 2.779399927 192.168.1.12 → 10.6.15.156  TCP 66 54766 → 22 [ACK] Seq=4409 Ack=47433 Win=6155 Len=0 TSval=8034689 TSecr=14966187
  150 2.779548115  10.6.15.156 → 192.168.1.12 SSH 1514 Server: Encrypted packet (len=1448)
  151 2.779739352  10.6.15.156 → 192.168.1.12 SSH 1514 Server: Encrypted packet (len=1448)
  152 2.779742910 192.168.1.12 → 10.6.15.156  TCP 66 54766 → 22 [ACK] Seq=4409 Ack=50329 Win=6155 Len=0 TSval=8034689 TSecr=14966187
  153 2.779912587  10.6.15.156 → 192.168.1.12 SSH 1514 Server: Encrypted packet (len=1448)
  154 2.780059211  10.6.15.156 → 192.168.1.12 SSH 1514 Server: Encrypted packet (len=1448)
  155 2.780064654 192.168.1.12 → 10.6.15.156  TCP 66 54766 → 22 [ACK] Seq=4409 Ack=53225 Win=6155 Len=0 TSval=8034689 TSecr=14966187
  156 2.780072408 192.168.1.12 → 10.6.15.156  SSH 102 Client: Encrypted packet (len=36)
  157 2.780381025  10.6.15.156 → 192.168.1.12 SSH 1514 Server: Encrypted packet (len=1448)
  158 2.780553702  10.6.15.156 → 192.168.1.12 SSH 1514 Server: Encrypted packet (len=1448)
  159 2.780559541 192.168.1.12 → 10.6.15.156  TCP 66 54766 → 22 [ACK] Seq=4445 Ack=56121 Win=6155 Len=0 TSval=8034689 TSecr=14966188
  160 2.780754797  10.6.15.156 → 192.168.1.12 SSH 1514 Server: Encrypted packet (len=1448)
  161 2.780927674  10.6.15.156 → 192.168.1.12 SSH 1514 Server: Encrypted packet (len=1448)
  162 2.780930962 192.168.1.12 → 10.6.15.156  TCP 66 54766 → 22 [ACK] Seq=4445 Ack=59017 Win=6155 Len=0 TSval=8034689 TSecr=14966188
  163 2.781099947  10.6.15.156 → 192.168.1.12 SSH 1514 Server: Encrypted packet (len=1448)
  164 2.781256588  10.6.15.156 → 192.168.1.12 SSH 1514 Server: Encrypted packet (len=1448)
  165 2.781261258 192.168.1.12 → 10.6.15.156  TCP 66 54766 → 22 [ACK] Seq=4445 Ack=61913 Win=6155 Len=0 TSval=8034689 TSecr=14966188
  166 2.781417857  10.6.15.156 → 192.168.1.12 SSH 1514 Server: Encrypted packet (len=1448)
  167 2.781607921  10.6.15.156 → 192.168.1.12 SSH 1514 Server: Encrypted packet (len=1448)
  168 2.781616251 192.168.1.12 → 10.6.15.156  TCP 66 54766 → 22 [ACK] Seq=4445 Ack=64809 Win=6155 Len=0 TSval=8034690 TSecr=14966188
  169 2.781769015  10.6.15.156 → 192.168.1.12 SSH 1514 Server: Encrypted packet (len=1448)
  170 2.783512346  10.6.15.156 → 192.168.1.12 SSH 1514 Server: Encrypted packet (len=1448)
  171 2.783523012 192.168.1.12 → 10.6.15.156  TCP 66 54766 → 22 [ACK] Seq=4445 Ack=67705 Win=6155 Len=0 TSval=8034690 TSecr=14966188
  172 2.783676304  10.6.15.156 → 192.168.1.12 SSH 1514 Server: Encrypted packet (len=1448)
  173 2.783851790  10.6.15.156 → 192.168.1.12 SSH 1514 Server: Encrypted packet (len=1448)
  174 2.783854947 192.168.1.12 → 10.6.15.156  TCP 66 54766 → 22 [ACK] Seq=4445 Ack=70601 Win=6155 Len=0 TSval=8034690 TSecr=14966188
  175 2.784009706  10.6.15.156 → 192.168.1.12 SSH 1514 Server: Encrypted packet (len=1448)
  176 2.784181365  10.6.15.156 → 192.168.1.12 SSH 1514 Server: Encrypted packet (len=1448)
  177 2.784185892 192.168.1.12 → 10.6.15.156  TCP 66 54766 → 22 [ACK] Seq=4445 Ack=73497 Win=6155 Len=0 TSval=8034690 TSecr=14966188
  178 2.784497593  10.6.15.156 → 192.168.1.12 SSH 1514 Server: Encrypted packet (len=1448)
  179 2.784670088  10.6.15.156 → 192.168.1.12 SSH 1514 Server: Encrypted packet (len=1448)
  180 2.784678529 192.168.1.12 → 10.6.15.156  TCP 66 54766 → 22 [ACK] Seq=4445 Ack=76393 Win=6155 Len=0 TSval=8034690 TSecr=14966189
  181 2.784842156  10.6.15.156 → 192.168.1.12 SSH 1514 Server: Encrypted packet (len=1448)
  182 2.785013649  10.6.15.156 → 192.168.1.12 SSH 1514 Server: Encrypted packet (len=1448)
  183 2.785020199 192.168.1.12 → 10.6.15.156  TCP 66 54766 → 22 [ACK] Seq=4445 Ack=79289 Win=6155 Len=0 TSval=8034690 TSecr=14966189
  184 2.785187355  10.6.15.156 → 192.168.1.12 SSH 1514 Server: Encrypted packet (len=1448)
  185 2.785359232  10.6.15.156 → 192.168.1.12 SSH 1514 Server: Encrypted packet (len=1448)
  186 2.785365216 192.168.1.12 → 10.6.15.156  TCP 66 54766 → 22 [ACK] Seq=4445 Ack=82185 Win=6155 Len=0 TSval=8034690 TSecr=14966189
  187 2.785533694  10.6.15.156 → 192.168.1.12 SSH 1514 Server: Encrypted packet (len=1448)
  188 2.785856716  10.6.15.156 → 192.168.1.12 SSH 1514 Server: Encrypted packet (len=1448)
  189 2.785861785 192.168.1.12 → 10.6.15.156  TCP 66 54766 → 22 [ACK] Seq=4445 Ack=85081 Win=6155 Len=0 TSval=8034691 TSecr=14966189
  190 2.786027504  10.6.15.156 → 192.168.1.12 SSH 1514 Server: Encrypted packet (len=1448)
  191 2.786199220  10.6.15.156 → 192.168.1.12 SSH 1514 Server: Encrypted packet (len=1448)
  192 2.786202246 192.168.1.12 → 10.6.15.156  TCP 66 54766 → 22 [ACK] Seq=4445 Ack=87977 Win=6155 Len=0 TSval=8034691 TSecr=14966189
  193 2.786207709  10.6.15.156 → 192.168.1.12 TCP 66 22 → 54766 [ACK] Seq=87977 Ack=4445 Win=1452 Len=0 TSval=14966189 TSecr=8034689
  194 2.786223650  10.6.15.156 → 192.168.1.12 SSH 250 Server: Encrypted packet (len=184)
  195 2.829595501 192.168.1.12 → 10.6.15.156  TCP 66 54766 → 22 [ACK] Seq=4445 Ack=88161 Win=6155 Len=0 TSval=8034702 TSecr=14966189
  196 2.833606795 192.168.1.12 → 10.6.15.156  SSH 166 Client: Encrypted packet (len=100)
  197 2.862295738  10.6.15.156 → 192.168.1.12 SSH 190 Server: Encrypted packet (len=124)
  198 2.862331775 192.168.1.12 → 10.6.15.156  SSH 258 Client: Encrypted packet (len=192)
  199 2.903415820  10.6.15.156 → 192.168.1.12 TCP 66 22 → 54766 [ACK] Seq=88285 Ack=4737 Win=1452 Len=0 TSval=14966219 TSecr=8034710
  200 2.944749709 192.168.1.12 → 10.6.15.156  SSH 678 Client: Encrypted packet (len=612)
  201 2.945356460 192.168.1.12 → 10.6.15.156  SSH 302 Client: Encrypted packet (len=236)
  202 2.947209311  10.6.15.156 → 192.168.1.12 TCP 66 22 → 54766 [ACK] Seq=88285 Ack=5349 Win=1452 Len=0 TSval=14966230 TSecr=8034730
  203 2.947788321  10.6.15.156 → 192.168.1.12 TCP 66 22 → 54766 [ACK] Seq=88285 Ack=5585 Win=1452 Len=0 TSval=14966230 TSecr=8034730
  204 2.971989506  10.22.17.94 → 224.0.0.252  LLMNR 75 Standard query 0x77af ANY DESKTOP-U824Q6A
  205 3.089558366  10.6.15.156 → 192.168.1.12 SSH 190 Server: Encrypted packet (len=124)
  206 3.156952649  10.6.15.156 → 192.168.1.12 SSH 182 Server: Encrypted packet (len=116)
  207 3.493719802 192.168.1.12 → 10.6.15.156  SSH 166 Client: Encrypted packet (len=100)
  208 3.493731693 192.168.1.12 → 10.6.15.156  TCP 66 54766 → 22 [ACK] Seq=5685 Ack=88409 Win=6155 Len=0 TSval=8034777 TSecr=14966265
  209 3.493733568 192.168.1.12 → 10.6.15.156  TCP 66 54766 → 22 [ACK] Seq=5685 Ack=88525 Win=6155 Len=0 TSval=8034783 TSecr=14966282
  210 3.494263124 192.168.1.12 → 10.6.15.156  SSH 622 Client: Encrypted packet (len=556)
  211 3.494451192  10.6.15.156 → 192.168.1.12 SSH 182 Server: Encrypted packet (len=116)
  212 3.494475731  10.6.15.156 → 192.168.1.12 SSH 198 Server: Encrypted packet (len=132)
  213 3.494549355 192.168.1.12 → 10.6.15.156  TCP 66 54766 → 22 [ACK] Seq=6241 Ack=88773 Win=6155 Len=0 TSval=8034868 TSecr=14966296
  214 3.497261374  10.6.15.156 → 192.168.1.12 SSH 1514 Server: Encrypted packet (len=1448)
  215 3.497461253  10.6.15.156 → 192.168.1.12 SSH 1514 Server: Encrypted packet (len=1448)
  216 3.497469095 192.168.1.12 → 10.6.15.156  TCP 66 54766 → 22 [ACK] Seq=6241 Ack=91669 Win=6155 Len=0 TSval=8034868 TSecr=14966299
  217 3.497481112  10.6.15.156 → 192.168.1.12 SSH 470 Server: Encrypted packet (len=404)
  218 3.497508084 192.168.1.12 → 10.6.15.156  TCP 66 54766 → 22 [ACK] Seq=6241 Ack=92073 Win=6155 Len=0 TSval=8034868 TSecr=14966299
  219 3.498597013  10.6.15.156 → 192.168.1.12 SSH 1514 Server: Encrypted packet (len=1448)
  220 3.498765618  10.6.15.156 → 192.168.1.12 SSH 1514 Server: Encrypted packet (len=1448)
  221 3.498773444 192.168.1.12 → 10.6.15.156  TCP 66 54766 → 22 [ACK] Seq=6241 Ack=94969 Win=6155 Len=0 TSval=8034869 TSecr=14966299
  222 3.498937108  10.6.15.156 → 192.168.1.12 SSH 1514 Server: Encrypted packet (len=1448)
  223 3.499056348  10.6.15.156 → 192.168.1.12 SSH 1110 Server: Encrypted packet (len=1044)
  224 3.499061977 192.168.1.12 → 10.6.15.156  TCP 66 54766 → 22 [ACK] Seq=6241 Ack=97461 Win=6155 Len=0 TSval=8034869 TSecr=14966299
  225 3.499240800  10.6.15.156 → 192.168.1.12 SSH 1514 Server: Encrypted packet (len=1448)
  226 3.499411525  10.6.15.156 → 192.168.1.12 SSH 1514 Server: Encrypted packet (len=1448)
  227 3.499418176 192.168.1.12 → 10.6.15.156  TCP 66 54766 → 22 [ACK] Seq=6241 Ack=100357 Win=6155 Len=0 TSval=8034869 TSecr=14966300
  228 3.499590969  10.6.15.156 → 192.168.1.12 SSH 1514 Server: Encrypted packet (len=1448)
  229 3.499764070  10.6.15.156 → 192.168.1.12 SSH 1514 Server: Encrypted packet (len=1448)
  230 3.499775207 192.168.1.12 → 10.6.15.156  TCP 66 54766 → 22 [ACK] Seq=6241 Ack=103253 Win=6155 Len=0 TSval=8034869 TSecr=14966300
  231 3.499929386  10.6.15.156 → 192.168.1.12 SSH 1514 Server: Encrypted packet (len=1448)
  232 3.500127796  10.6.15.156 → 192.168.1.12 SSH 638 Server: Encrypted packet (len=572)
  233 3.500132284 192.168.1.12 → 10.6.15.156  TCP 66 54766 → 22 [ACK] Seq=6241 Ack=105273 Win=6155 Len=0 TSval=8034869 TSecr=14966300
  234 3.500326262  10.6.15.156 → 192.168.1.12 SSH 1514 Server: Encrypted packet (len=1448)
  235 3.500501482  10.6.15.156 → 192.168.1.12 SSH 1514 Server: Encrypted packet (len=1448)
  236 3.500509028 192.168.1.12 → 10.6.15.156  TCP 66 54766 → 22 [ACK] Seq=6241 Ack=108169 Win=6155 Len=0 TSval=8034869 TSecr=14966300
  237 3.500670104  10.6.15.156 → 192.168.1.12 SSH 1514 Server: Encrypted packet (len=1448)
  238 3.500844049  10.6.15.156 → 192.168.1.12 SSH 1514 Server: Encrypted packet (len=1448)
  239 3.500850885 192.168.1.12 → 10.6.15.156  TCP 66 54766 → 22 [ACK] Seq=6241 Ack=111065 Win=6155 Len=0 TSval=8034869 TSecr=14966300
  240 3.501017144  10.6.15.156 → 192.168.1.12 SSH 1514 Server: Encrypted packet (len=1448)
  241 3.501147058  10.6.15.156 → 192.168.1.12 SSH 1222 Server: Encrypted packet (len=1156)
  242 3.501154830 192.168.1.12 → 10.6.15.156  TCP 66 54766 → 22 [ACK] Seq=6241 Ack=113669 Win=6155 Len=0 TSval=8034869 TSecr=14966300
  243 3.501330865  10.6.15.156 → 192.168.1.12 SSH 1514 Server: Encrypted packet (len=1448)
  244 3.501416439 192.168.1.12 → 10.6.15.156  SSH 102 Client: Encrypted packet (len=36)
  245 3.501501663  10.6.15.156 → 192.168.1.12 SSH 1514 Server: Encrypted packet (len=1448)
  246 3.503166423  10.6.15.156 → 192.168.1.12 SSH 1514 Server: Encrypted packet (len=1448)
  247 3.503190854 192.168.1.12 → 10.6.15.156  TCP 66 54766 → 22 [ACK] Seq=6277 Ack=118013 Win=6155 Len=0 TSval=8034870 TSecr=14966301
  248 3.503334117  10.6.15.156 → 192.168.1.12 SSH 1514 Server: Encrypted packet (len=1448)
  249 3.503512446  10.6.15.156 → 192.168.1.12 SSH 1514 Server: Encrypted packet (len=1448)
  250 3.503516288 192.168.1.12 → 10.6.15.156  TCP 66 54766 → 22 [ACK] Seq=6277 Ack=120909 Win=6155 Len=0 TSval=8034870 TSecr=14966301
  251 3.503649767  10.6.15.156 → 192.168.1.12 SSH 1310 Server: Encrypted packet (len=1244)
  252 3.503740795  10.6.15.156 → 192.168.1.12 SSH 894 Server: Encrypted packet (len=828)
  253 3.503743476 192.168.1.12 → 10.6.15.156  TCP 66 54766 → 22 [ACK] Seq=6277 Ack=122981 Win=6155 Len=0 TSval=8034870 TSecr=14966301
  254 3.503931765  10.6.15.156 → 192.168.1.12 SSH 1514 Server: Encrypted packet (len=1448)
  255 3.507316617  10.22.17.94 → 224.0.0.252  LLMNR 75 Standard query 0x77af ANY DESKTOP-U824Q6A
  256 3.507333267  10.6.15.156 → 192.168.1.12 TCP 66 22 → 54766 [ACK] Seq=124429 Ack=5685 Win=1452 Len=0 TSval=14966367 TSecr=8034742
  257 3.507342895 192.168.1.12 → 10.6.15.156  SSH 150 Client: Encrypted packet (len=84)
  258 3.507528493  10.6.15.156 → 192.168.1.12 SSH 1514 Server: Encrypted packet (len=1448)
  259 3.507712208  10.6.15.156 → 192.168.1.12 SSH 1514 Server: Encrypted packet (len=1448)
  260 3.507716123 192.168.1.12 → 10.6.15.156  TCP 66 54766 → 22 [ACK] Seq=6361 Ack=127325 Win=6155 Len=0 TSval=8034871 TSecr=14966367
  261 3.507883890  10.6.15.156 → 192.168.1.12 SSH 1514 Server: Encrypted packet (len=1448)
  262 3.508047637  10.6.15.156 → 192.168.1.12 SSH 1514 Server: Encrypted packet (len=1448)
  263 3.508050572 192.168.1.12 → 10.6.15.156  TCP 66 54766 → 22 [ACK] Seq=6361 Ack=130221 Win=6155 Len=0 TSval=8034871 TSecr=14966367
  264 3.508230220  10.6.15.156 → 192.168.1.12 SSH 1514 Server: Encrypted packet (len=1448)
  265 3.508402493  10.6.15.156 → 192.168.1.12 SSH 1514 Server: Encrypted packet (len=1448)
  266 3.508407155 192.168.1.12 → 10.6.15.156  TCP 66 54766 → 22 [ACK] Seq=6361 Ack=133117 Win=6155 Len=0 TSval=8034871 TSecr=14966367
  267 3.508575044  10.6.15.156 → 192.168.1.12 SSH 1514 Server: Encrypted packet (len=1448)
  268 3.508911226  10.6.15.156 → 192.168.1.12 SSH 1514 Server: Encrypted packet (len=1448)
  269 3.508914482 192.168.1.12 → 10.6.15.156  TCP 66 54766 → 22 [ACK] Seq=6361 Ack=136013 Win=6155 Len=0 TSval=8034871 TSecr=14966368
  270 3.508920316  10.6.15.156 → 192.168.1.12 SSH 78 Server: Encrypted packet (len=12)
  271 3.510660130  10.6.15.156 → 192.168.1.12 TCP 66 22 → 54766 [ACK] Seq=136025 Ack=6361 Win=1452 Len=0 TSval=14966371 TSecr=8034869
  272 3.511051253 192.168.1.12 → 10.6.15.156  SSH 138 Client: Encrypted packet (len=72)
  273 3.513068635  10.6.15.156 → 192.168.1.12 SSH 102 Server: Encrypted packet (len=36)
  274 3.513085899 192.168.1.12 → 10.6.15.156  SSH 138 Client: Encrypted packet (len=72)
  275 3.515407762  10.6.15.156 → 192.168.1.12 SSH 102 Server: Encrypted packet (len=36)
  276 3.516129746 192.168.1.12 → 10.6.15.156  SSH 166 Client: Encrypted packet (len=100)
  277 3.554213583  10.6.15.156 → 192.168.1.12 TCP 66 22 → 54766 [ACK] Seq=136097 Ack=6605 Win=1452 Len=0 TSval=14966382 TSecr=8034873
  278 3.599981530  10.6.15.156 → 192.168.1.12 SSH 318 Server: Encrypted packet (len=252)
  279 3.609412478  10.6.15.156 → 192.168.1.12 SSH 1514 Server: Encrypted packet (len=1448)
  280 3.609428536 192.168.1.12 → 10.6.15.156  TCP 66 54766 → 22 [ACK] Seq=6605 Ack=137797 Win=6155 Len=0 TSval=8034896 TSecr=14966393
  281 3.609551760  10.6.15.156 → 192.168.1.12 SSH 1514 Server: Encrypted packet (len=1448)
  282 3.609557630  10.6.15.156 → 192.168.1.12 SSH 126 Server: Encrypted packet (len=60)
  283 3.609562177 192.168.1.12 → 10.6.15.156  TCP 66 54766 → 22 [ACK] Seq=6605 Ack=139305 Win=6155 Len=0 TSval=8034896 TSecr=14966395
  284 3.612502825  10.6.15.156 → 192.168.1.12 SSH 1514 Server: Encrypted packet (len=1448)
  285 3.612665485  10.6.15.156 → 192.168.1.12 SSH 1514 Server: Encrypted packet (len=1448)
  286 3.612676691 192.168.1.12 → 10.6.15.156  TCP 66 54766 → 22 [ACK] Seq=6605 Ack=142201 Win=6155 Len=0 TSval=8034897 TSecr=14966395
  287 3.612838496  10.6.15.156 → 192.168.1.12 SSH 1514 Server: Encrypted packet (len=1448)
  288 3.612937388  10.6.15.156 → 192.168.1.12 SSH 982 Server: Encrypted packet (len=916)
  289 3.612943263 192.168.1.12 → 10.6.15.156  TCP 66 54766 → 22 [ACK] Seq=6605 Ack=144565 Win=6155 Len=0 TSval=8034897 TSecr=14966395
  290 3.613122838  10.6.15.156 → 192.168.1.12 SSH 1514 Server: Encrypted packet (len=1448)
  291 3.613296666  10.6.15.156 → 192.168.1.12 SSH 1514 Server: Encrypted packet (len=1448)
  292 3.613303135 192.168.1.12 → 10.6.15.156  TCP 66 54766 → 22 [ACK] Seq=6605 Ack=147461 Win=6155 Len=0 TSval=8034897 TSecr=14966396
  293 3.613470367  10.6.15.156 → 192.168.1.12 SSH 1514 Server: Encrypted packet (len=1448)
  294 3.613643447  10.6.15.156 → 192.168.1.12 SSH 1514 Server: Encrypted packet (len=1448)
  295 3.613650828 192.168.1.12 → 10.6.15.156  TCP 66 54766 → 22 [ACK] Seq=6605 Ack=150357 Win=6155 Len=0 TSval=8034898 TSecr=14966396
  296 3.613727513  10.6.15.156 → 192.168.1.12 SSH 878 Server: Encrypted packet (len=812)
  297 3.618516054  10.6.15.156 → 192.168.1.12 SSH 1514 Server: Encrypted packet (len=1448)
  298 3.618526843 192.168.1.12 → 10.6.15.156  TCP 66 54766 → 22 [ACK] Seq=6605 Ack=152617 Win=6155 Len=0 TSval=8034899 TSecr=14966396
  299 3.618688468  10.6.15.156 → 192.168.1.12 SSH 1514 Server: Encrypted packet (len=1448)
  300 3.618867861  10.6.15.156 → 192.168.1.12 SSH 1514 Server: Encrypted packet (len=1448)
  301 3.618879662 192.168.1.12 → 10.6.15.156  TCP 66 54766 → 22 [ACK] Seq=6605 Ack=155513 Win=6155 Len=0 TSval=8034899 TSecr=14966396
  302 3.619037998  10.6.15.156 → 192.168.1.12 SSH 1514 Server: Encrypted packet (len=1448)
  303 3.619046449  10.6.15.156 → 192.168.1.12 SSH 390 Server: Encrypted packet (len=324)
  304 3.619050440 192.168.1.12 → 10.6.15.156  TCP 66 54766 → 22 [ACK] Seq=6605 Ack=157285 Win=6155 Len=0 TSval=8034899 TSecr=14966396
  305 3.619098998  10.6.15.156 → 192.168.1.12 SSH 542 Server: Encrypted packet (len=476)
  306 3.621975539 192.168.1.12 → 10.6.15.156  SSH 158 Client: Encrypted packet (len=92)
  307 3.623650975  10.6.15.156 → 192.168.1.12 TCP 66 22 → 54766 [ACK] Seq=157761 Ack=6697 Win=1452 Len=0 TSval=14966399 TSecr=8034900
  308 3.663531383  10.6.15.156 → 192.168.1.12 SSH 326 Server: Encrypted packet (len=260)
  309 3.764152643  10.6.15.156 → 192.168.1.12 SSH 238 Server: Encrypted packet (len=172)
  310 3.834760381  10.6.15.156 → 192.168.1.12 TCP 238 [TCP Retransmission] 22 → 54766 [PSH, ACK] Seq=158021 Ack=6697 Win=1452 Len=172 TSval=14966452 TSecr=8034900
  311 3.875941501  10.6.15.156 → 192.168.1.12 SSH 422 Server: Encrypted packet (len=356)
  312 3.878795418  10.6.15.156 → 192.168.1.12 SSH 1514 Server: Encrypted packet (len=1448)
  313 3.878900638  10.6.15.156 → 192.168.1.12 SSH 1514 Server: Encrypted packet (len=1448)
  314 3.879446851  10.6.15.156 → 192.168.1.12 SSH 950 Server: Encrypted packet (len=884)
  315 3.881450800  10.6.15.156 → 192.168.1.12 SSH 1514 Server: Encrypted packet (len=1448)
  316 3.881613764  10.6.15.156 → 192.168.1.12 SSH 1514 Server: Encrypted packet (len=1448)
  317 3.881785751  10.6.15.156 → 192.168.1.12 SSH 1514 Server: Encrypted packet (len=1448)
  318 3.881959351  10.6.15.156 → 192.168.1.12 SSH 1514 Server: Encrypted packet (len=1448)
  319 3.882141747  10.6.15.156 → 192.168.1.12 SSH 1514 Server: Encrypted packet (len=1448)
  320 3.882462133  10.6.15.156 → 192.168.1.12 SSH 1514 Server: Encrypted packet (len=1448)
  321 3.882628904  10.6.15.156 → 192.168.1.12 SSH 1514 Server: Encrypted packet (len=1448)
  322 3.882802378  10.6.15.156 → 192.168.1.12 SSH 1514 Server: Encrypted packet (len=1448)
  323 3.882976188  10.6.15.156 → 192.168.1.12 SSH 1514 Server: Encrypted packet (len=1448)
  324 3.883057899  10.6.15.156 → 192.168.1.12 SSH 862 Server: Encrypted packet (len=796)
  325 3.883692921  10.6.15.156 → 192.168.1.12 SSH 1514 Server: Encrypted packet (len=1448)
  326 3.883859392  10.6.15.156 → 192.168.1.12 SSH 1514 Server: Encrypted packet (len=1448)
  327 3.884192465  10.6.15.156 → 192.168.1.12 SSH 1514 Server: Encrypted packet (len=1448)
  328 3.884357062  10.6.15.156 → 192.168.1.12 SSH 1514 Server: Encrypted packet (len=1448)
  329 3.884532169  10.6.15.156 → 192.168.1.12 SSH 1514 Server: Encrypted packet (len=1448)
  330 3.888186798  10.6.15.156 → 192.168.1.12 SSH 1514 Server: Encrypted packet (len=1448)
  331 3.888329928  10.6.15.156 → 192.168.1.12 SSH 1514 Server: Encrypted packet (len=1448)
  332 3.888538512  10.6.15.156 → 192.168.1.12 SSH 1514 Server: Encrypted packet (len=1448)
  333 3.888707121  10.6.15.156 → 192.168.1.12 SSH 1514 Server: Encrypted packet (len=1448)
  334 3.888868705  10.6.15.156 → 192.168.1.12 SSH 1514 Server: Encrypted packet (len=1448)
  335 3.889047031  10.6.15.156 → 192.168.1.12 SSH 1514 Server: Encrypted packet (len=1448)
  336 3.889211421  10.6.15.156 → 192.168.1.12 SSH 322 Server: Encrypted packet (len=256)
  337 3.889398228  10.6.15.156 → 192.168.1.12 SSH 1514 Server: Encrypted packet (len=1448)
  338 3.889560665  10.6.15.156 → 192.168.1.12 SSH 1514 Server: Encrypted packet (len=1448)
  339 3.889759651  10.6.15.156 → 192.168.1.12 SSH 1514 Server: Encrypted packet (len=1448)
  340 3.889915846  10.6.15.156 → 192.168.1.12 SSH 1514 Server: Encrypted packet (len=1448)
  341 3.890087354  10.6.15.156 → 192.168.1.12 SSH 1514 Server: Encrypted packet (len=1448)
  342 4.225658671 192.168.1.12 → 10.6.15.156  TCP 66 54766 → 22 [ACK] Seq=6697 Ack=158021 Win=6155 Len=0 TSval=8034921 TSecr=14966409
  343 4.225668666 192.168.1.12 → 10.6.15.156  TCP 66 54766 → 22 [ACK] Seq=6697 Ack=158193 Win=6155 Len=0 TSval=8034935 TSecr=14966434
  344 4.225670540 192.168.1.12 → 10.6.15.156  TCP 78 [TCP Dup ACK 343#1] 54766 → 22 [ACK] Seq=6697 Ack=158193 Win=6155 Len=0 TSval=8034953 TSecr=14966452 SLE=158021 SRE=158193
  345 4.225672491 192.168.1.12 → 10.6.15.156  TCP 66 54766 → 22 [ACK] Seq=6697 Ack=158549 Win=6155 Len=0 TSval=8034963 TSecr=14966462
  346 4.225674152 192.168.1.12 → 10.6.15.156  TCP 66 54766 → 22 [ACK] Seq=6697 Ack=159997 Win=6155 Len=0 TSval=8034964 TSecr=14966463
  347 4.225675873 192.168.1.12 → 10.6.15.156  TCP 66 54766 → 22 [ACK] Seq=6697 Ack=161445 Win=6155 Len=0 TSval=8034964 TSecr=14966463
  348 4.225677630 192.168.1.12 → 10.6.15.156  TCP 66 54766 → 22 [ACK] Seq=6697 Ack=162329 Win=6155 Len=0 TSval=8034964 TSecr=14966463
  349 4.225679300 192.168.1.12 → 10.6.15.156  TCP 66 54766 → 22 [ACK] Seq=6697 Ack=163777 Win=6155 Len=0 TSval=8034964 TSecr=14966463
  350 4.225680799 192.168.1.12 → 10.6.15.156  TCP 66 54766 → 22 [ACK] Seq=6697 Ack=165225 Win=6155 Len=0 TSval=8034965 TSecr=14966463
  351 4.225682296 192.168.1.12 → 10.6.15.156  TCP 66 54766 → 22 [ACK] Seq=6697 Ack=166673 Win=6155 Len=0 TSval=8034965 TSecr=14966463
  352 4.225683741 192.168.1.12 → 10.6.15.156  TCP 66 54766 → 22 [ACK] Seq=6697 Ack=168121 Win=6155 Len=0 TSval=8034965 TSecr=14966463
  353 4.225685455 192.168.1.12 → 10.6.15.156  TCP 66 54766 → 22 [ACK] Seq=6697 Ack=169569 Win=6155 Len=0 TSval=8034965 TSecr=14966463
  354 4.225686961 192.168.1.12 → 10.6.15.156  TCP 66 54766 → 22 [ACK] Seq=6697 Ack=171017 Win=6155 Len=0 TSval=8034965 TSecr=14966463
  355 4.225688472 192.168.1.12 → 10.6.15.156  TCP 66 54766 → 22 [ACK] Seq=6697 Ack=172465 Win=6155 Len=0 TSval=8034965 TSecr=14966463
  356 4.225690013 192.168.1.12 → 10.6.15.156  TCP 66 54766 → 22 [ACK] Seq=6697 Ack=173913 Win=6155 Len=0 TSval=8034965 TSecr=14966463
  357 4.225691708 192.168.1.12 → 10.6.15.156  TCP 66 54766 → 22 [ACK] Seq=6697 Ack=175361 Win=6155 Len=0 TSval=8034965 TSecr=14966463
  358 4.225693429 192.168.1.12 → 10.6.15.156  TCP 66 54766 → 22 [ACK] Seq=6697 Ack=176157 Win=6155 Len=0 TSval=8034965 TSecr=14966463
  359 4.225694922 192.168.1.12 → 10.6.15.156  TCP 66 54766 → 22 [ACK] Seq=6697 Ack=177605 Win=6155 Len=0 TSval=8034965 TSecr=14966464
  360 4.225696912 192.168.1.12 → 10.6.15.156  TCP 66 54766 → 22 [ACK] Seq=6697 Ack=180501 Win=6155 Len=0 TSval=8034965 TSecr=14966464
  361 4.225699006 192.168.1.12 → 10.6.15.156  TCP 66 54766 → 22 [ACK] Seq=6697 Ack=183397 Win=6155 Len=0 TSval=8034965 TSecr=14966464
  362 4.225700645 192.168.1.12 → 10.6.15.156  TCP 66 54766 → 22 [ACK] Seq=6697 Ack=186293 Win=6155 Len=0 TSval=8034966 TSecr=14966464
  363 4.225702161 192.168.1.12 → 10.6.15.156  TCP 66 54766 → 22 [ACK] Seq=6697 Ack=189189 Win=6155 Len=0 TSval=8034966 TSecr=14966464
  364 4.225703747 192.168.1.12 → 10.6.15.156  TCP 66 54766 → 22 [ACK] Seq=6697 Ack=192085 Win=6155 Len=0 TSval=8034966 TSecr=14966464
  365 4.225705659 192.168.1.12 → 10.6.15.156  TCP 66 54766 → 22 [ACK] Seq=6697 Ack=192341 Win=6155 Len=0 TSval=8034966 TSecr=14966464
  366 4.225707205 192.168.1.12 → 10.6.15.156  TCP 66 54766 → 22 [ACK] Seq=6697 Ack=195237 Win=6155 Len=0 TSval=8034966 TSecr=14966465
  367 4.225708662 192.168.1.12 → 10.6.15.156  TCP 66 54766 → 22 [ACK] Seq=6697 Ack=198133 Win=6155 Len=0 TSval=8034967 TSecr=14966465
  368 4.225710224 192.168.1.12 → 10.6.15.156  TCP 66 54766 → 22 [ACK] Seq=6697 Ack=199581 Win=6155 Len=0 TSval=8034978 TSecr=14966465
  369 4.225715942 192.168.1.12 → 10.6.15.156  SSH 126 Client: Encrypted packet (len=60)
  370 4.227190171  10.22.17.94 → 224.0.0.252  LLMNR 75 Standard query 0xb02c ANY DESKTOP-U824Q6A
  371 4.227418287  10.6.15.156 → 192.168.1.12 SSH 1514 Server: Encrypted packet (len=1448)
  372 4.229393588  10.6.15.156 → 192.168.1.12 SSH 1514 Server: Encrypted packet (len=1448)
  373 4.229400886 192.168.1.12 → 10.6.15.156  TCP 66 54766 → 22 [ACK] Seq=6757 Ack=202477 Win=6155 Len=0 TSval=8035051 TSecr=14966483
  374 4.229588043  10.6.15.156 → 192.168.1.12 SSH 1514 Server: Encrypted packet (len=1448)
  375 4.229783191  10.6.15.156 → 192.168.1.12 SSH 1514 Server: Encrypted packet (len=1448)
  376 4.229790002 192.168.1.12 → 10.6.15.156  TCP 66 54766 → 22 [ACK] Seq=6757 Ack=205373 Win=6155 Len=0 TSval=8035052 TSecr=14966550
  377 4.229968597  10.6.15.156 → 192.168.1.12 SSH 1514 Server: Encrypted packet (len=1448)
  378 4.230160470  10.6.15.156 → 192.168.1.12 SSH 1514 Server: Encrypted packet (len=1448)
