    1 0.000000000 192.168.1.12 → 239.255.255.250 SSDP 213 M-SEARCH * HTTP/1.1 
    2 0.111264724  10.6.15.156 → 192.168.1.12 SSH 238 Server: Encrypted packet (len=172)
    3 0.111303362 192.168.1.12 → 10.6.15.156  TCP 66 54766 → 22 [ACK] Seq=1 Ack=173 Win=6155 Len=0 TSval=8042997 TSecr=14974496
    4 0.231764577  10.6.15.156 → 192.168.1.12 SSH 286 Server: Encrypted packet (len=220)
    5 0.231783543 192.168.1.12 → 10.6.15.156  TCP 66 54766 → 22 [ACK] Seq=1 Ack=393 Win=6155 Len=0 TSval=8043027 TSecr=14974526
    6 0.237281686 192.168.1.12 → 10.6.15.156  SSH 102 Client: Encrypted packet (len=36)
    7 0.276618977  10.6.15.156 → 192.168.1.12 TCP 66 22 → 54766 [ACK] Seq=393 Ack=37 Win=1452 Len=0 TSval=14974538 TSecr=8043029
    8 0.276639272 192.168.1.12 → 10.6.15.156  SSH 670 Client: Encrypted packet (len=604)
    9 0.278505795  10.6.15.156 → 192.168.1.12 TCP 66 22 → 54766 [ACK] Seq=393 Ack=641 Win=1452 Len=0 TSval=14974538 TSecr=8043039
   10 0.327000168  10.6.15.156 → 192.168.1.12 SSH 102 Server: Encrypted packet (len=36)
   11 0.327799553  10.6.15.156 → 192.168.1.12 SSH 102 Server: Encrypted packet (len=36)
   12 0.327822865 192.168.1.12 → 10.6.15.156  TCP 66 54766 → 22 [ACK] Seq=641 Ack=465 Win=6155 Len=0 TSval=8043051 TSecr=14974550
   13 0.350593107  10.6.15.156 → 192.168.1.12 SSH 102 Server: Encrypted packet (len=36)
   14 0.351707537  10.6.15.156 → 192.168.1.12 SSH 102 Server: Encrypted packet (len=36)
   15 0.351735624 192.168.1.12 → 10.6.15.156  TCP 66 54766 → 22 [ACK] Seq=641 Ack=537 Win=6155 Len=0 TSval=8043057 TSecr=14974556
   16 0.491062341  10.6.15.156 → 192.168.1.12 SSH 138 Server: Encrypted packet (len=72)
   17 0.491306435 192.168.1.12 → 10.6.15.156  SSH 102 Client: Encrypted packet (len=36)
   18 0.495115372  10.6.15.156 → 192.168.1.12 TCP 66 22 → 54766 [ACK] Seq=609 Ack=677 Win=1452 Len=0 TSval=14974592 TSecr=8043092
   19 0.645527983  10.6.15.156 → 192.168.1.12 SSH 138 Server: Encrypted packet (len=72)
   20 0.645754491 192.168.1.12 → 10.6.15.156  SSH 102 Client: Encrypted packet (len=36)
   21 0.647136435  10.6.15.156 → 192.168.1.12 TCP 66 22 → 54766 [ACK] Seq=681 Ack=713 Win=1452 Len=0 TSval=14974630 TSecr=8043131
   22 0.660227655  10.6.15.156 → 192.168.1.12 SSH 1514 Server: Encrypted packet (len=1448)
   23 0.660249780  10.6.15.156 → 192.168.1.12 SSH 190 Server: Encrypted packet (len=124)
   24 0.660269180 192.168.1.12 → 10.6.15.156  TCP 66 54766 → 22 [ACK] Seq=713 Ack=2253 Win=6155 Len=0 TSval=8043134 TSecr=14974633
   25 0.660543507  10.6.15.156 → 192.168.1.12 SSH 1514 Server: Encrypted packet (len=1448)
   26 0.660743774  10.6.15.156 → 192.168.1.12 SSH 806 Server: Encrypted packet (len=740)
   27 0.660751598 192.168.1.12 → 10.6.15.156  TCP 66 54766 → 22 [ACK] Seq=713 Ack=4441 Win=6155 Len=0 TSval=8043135 TSecr=14974633
   28 0.681128876 192.168.1.12 → 10.6.15.156  SSH 142 Client: Encrypted packet (len=76)
   29 0.683615541  10.6.15.156 → 192.168.1.12 SSH 102 Server: Encrypted packet (len=36)
   30 0.684897273  10.6.15.156 → 192.168.1.12 SSH 182 Server: Encrypted packet (len=116)
   31 0.684919298 192.168.1.12 → 10.6.15.156  SSH 366 Client: Encrypted packet (len=300)
   32 0.701464327  10.6.15.156 → 192.168.1.12 SSH 138 Server: Encrypted packet (len=72)
   33 0.727797288  10.6.15.156 → 192.168.1.12 SSH 102 Server: Encrypted packet (len=36)
   34 0.727881430 192.168.1.12 → 10.6.15.156  TCP 66 54766 → 22 [ACK] Seq=1089 Ack=4701 Win=6155 Len=0 TSval=8043151 TSecr=14974644
   35 0.731476124  10.6.15.156 → 192.168.1.12 SSH 102 Server: Encrypted packet (len=36)
   36 0.745046268  10.6.15.156 → 192.168.1.12 SSH 102 Server: Encrypted packet (len=36)
   37 0.745126107 192.168.1.12 → 10.6.15.156  TCP 66 54766 → 22 [ACK] Seq=1089 Ack=4773 Win=6155 Len=0 TSval=8043156 TSecr=14974651
   38 0.746606367  10.6.15.156 → 192.168.1.12 SSH 102 Server: Encrypted packet (len=36)
   39 0.786631989  10.6.15.156 → 192.168.1.12 SSH 238 Server: Encrypted packet (len=172)
   40 0.786648727 192.168.1.12 → 10.6.15.156  TCP 66 54766 → 22 [ACK] Seq=1089 Ack=4981 Win=6155 Len=0 TSval=8043166 TSecr=14974655
   41 1.000631845 192.168.1.12 → 239.255.255.250 SSDP 213 M-SEARCH * HTTP/1.1 
   42 1.013617363  10.6.15.156 → 192.168.1.12 SSH 342 Server: Encrypted packet (len=276)
   43 1.056327150 192.168.1.12 → 10.6.15.156  TCP 66 54766 → 22 [ACK] Seq=1089 Ack=5257 Win=6155 Len=0 TSval=8043234 TSecr=14974722
   44 1.064975704  10.6.15.156 → 192.168.1.12 SSH 750 Server: Encrypted packet (len=684)
   45 1.065003893 192.168.1.12 → 10.6.15.156  TCP 66 54766 → 22 [ACK] Seq=1089 Ack=5941 Win=6155 Len=0 TSval=8043236 TSecr=14974735
   46 1.069756189  10.6.15.156 → 192.168.1.12 SSH 158 Server: Encrypted packet (len=92)
   47 1.069773551 192.168.1.12 → 10.6.15.156  TCP 66 54766 → 22 [ACK] Seq=1089 Ack=6033 Win=6155 Len=0 TSval=8043237 TSecr=14974736
   48 1.071215533  10.6.15.156 → 192.168.1.12 SSH 1514 Server: Encrypted packet (len=1448)
   49 1.071230648 192.168.1.12 → 10.6.15.156  TCP 66 54766 → 22 [ACK] Seq=1089 Ack=7481 Win=6155 Len=0 TSval=8043237 TSecr=14974736
   50 1.071381135  10.6.15.156 → 192.168.1.12 SSH 1402 Server: Encrypted packet (len=1336)
   51 1.071385587 192.168.1.12 → 10.6.15.156  TCP 66 54766 → 22 [ACK] Seq=1089 Ack=8817 Win=6155 Len=0 TSval=8043237 TSecr=14974736
   52 1.072741376  10.6.15.156 → 192.168.1.12 SSH 1514 Server: Encrypted packet (len=1448)
   53 1.072756405 192.168.1.12 → 10.6.15.156  TCP 66 54766 → 22 [ACK] Seq=1089 Ack=10265 Win=6155 Len=0 TSval=8043238 TSecr=14974736
   54 1.072928584  10.6.15.156 → 192.168.1.12 SSH 1514 Server: Encrypted packet (len=1448)
   55 1.072935461 192.168.1.12 → 10.6.15.156  TCP 66 54766 → 22 [ACK] Seq=1089 Ack=11713 Win=6155 Len=0 TSval=8043238 TSecr=14974736
   56 1.073202362  10.6.15.156 → 192.168.1.12 SSH 1054 Server: Encrypted packet (len=988)
   57 1.073208221 192.168.1.12 → 10.6.15.156  TCP 66 54766 → 22 [ACK] Seq=1089 Ack=12701 Win=6155 Len=0 TSval=8043238 TSecr=14974736
   58 1.073414656  10.6.15.156 → 192.168.1.12 SSH 1514 Server: Encrypted packet (len=1448)
   59 1.073419246 192.168.1.12 → 10.6.15.156  TCP 66 54766 → 22 [ACK] Seq=1089 Ack=14149 Win=6155 Len=0 TSval=8043238 TSecr=14974737
   60 1.073615549  10.6.15.156 → 192.168.1.12 SSH 1514 Server: Encrypted packet (len=1448)
   61 1.073621067 192.168.1.12 → 10.6.15.156  TCP 66 54766 → 22 [ACK] Seq=1089 Ack=15597 Win=6155 Len=0 TSval=8043238 TSecr=14974737
   62 1.073629487  10.6.15.156 → 192.168.1.12 SSH 318 Server: Encrypted packet (len=252)
   63 1.073634415 192.168.1.12 → 10.6.15.156  TCP 66 54766 → 22 [ACK] Seq=1089 Ack=15849 Win=6155 Len=0 TSval=8043238 TSecr=14974737
   64 1.077029047  10.6.15.156 → 192.168.1.12 SSH 1514 Server: Encrypted packet (len=1448)
   65 1.077034302 192.168.1.12 → 10.6.15.156  TCP 66 54766 → 22 [ACK] Seq=1089 Ack=17297 Win=6155 Len=0 TSval=8043239 TSecr=14974737
   66 1.077217342  10.6.15.156 → 192.168.1.12 SSH 1222 Server: Encrypted packet (len=1156)
   67 1.077220692 192.168.1.12 → 10.6.15.156  TCP 66 54766 → 22 [ACK] Seq=1089 Ack=18453 Win=6155 Len=0 TSval=8043239 TSecr=14974737
   68 1.077571066  10.6.15.156 → 192.168.1.12 SSH 1514 Server: Encrypted packet (len=1448)
   69 1.077581697 192.168.1.12 → 10.6.15.156  TCP 66 54766 → 22 [ACK] Seq=1089 Ack=19901 Win=6155 Len=0 TSval=8043239 TSecr=14974737
   70 1.077759277  10.6.15.156 → 192.168.1.12 SSH 1514 Server: Encrypted packet (len=1448)
   71 1.077766746 192.168.1.12 → 10.6.15.156  TCP 66 54766 → 22 [ACK] Seq=1089 Ack=21349 Win=6155 Len=0 TSval=8043239 TSecr=14974737
   72 1.077953718  10.6.15.156 → 192.168.1.12 SSH 1514 Server: Encrypted packet (len=1448)
   73 1.077960723 192.168.1.12 → 10.6.15.156  TCP 66 54766 → 22 [ACK] Seq=1089 Ack=22797 Win=6155 Len=0 TSval=8043239 TSecr=14974737
   74 1.078018694  10.6.15.156 → 192.168.1.12 SSH 886 Server: Encrypted packet (len=820)
   75 1.078041268 192.168.1.12 → 10.6.15.156  TCP 66 54766 → 22 [ACK] Seq=1089 Ack=23617 Win=6155 Len=0 TSval=8043239 TSecr=14974737
   76 1.078384203  10.6.15.156 → 192.168.1.12 SSH 1514 Server: Encrypted packet (len=1448)
   77 1.078597953  10.6.15.156 → 192.168.1.12 SSH 1514 Server: Encrypted packet (len=1448)
   78 1.078602942 192.168.1.12 → 10.6.15.156  TCP 66 54766 → 22 [ACK] Seq=1089 Ack=26513 Win=6155 Len=0 TSval=8043239 TSecr=14974738
   79 1.078788582  10.6.15.156 → 192.168.1.12 SSH 1514 Server: Encrypted packet (len=1448)
   80 1.078981812  10.6.15.156 → 192.168.1.12 SSH 1514 Server: Encrypted packet (len=1448)
   81 1.078985128 192.168.1.12 → 10.6.15.156  TCP 66 54766 → 22 [ACK] Seq=1089 Ack=29409 Win=6155 Len=0 TSval=8043239 TSecr=14974738
   82 1.079155678  10.6.15.156 → 192.168.1.12 SSH 1514 Server: Encrypted packet (len=1448)
   83 1.079491422  10.6.15.156 → 192.168.1.12 SSH 1514 Server: Encrypted packet (len=1448)
   84 1.079496488 192.168.1.12 → 10.6.15.156  TCP 66 54766 → 22 [ACK] Seq=1089 Ack=32305 Win=6155 Len=0 TSval=8043239 TSecr=14974738
   85 1.079710718  10.6.15.156 → 192.168.1.12 SSH 1514 Server: Encrypted packet (len=1448)
   86 1.079902978  10.6.15.156 → 192.168.1.12 SSH 1514 Server: Encrypted packet (len=1448)
   87 1.079905997 192.168.1.12 → 10.6.15.156  TCP 66 54766 → 22 [ACK] Seq=1089 Ack=35201 Win=6155 Len=0 TSval=8043239 TSecr=14974738
   88 1.080094963  10.6.15.156 → 192.168.1.12 SSH 1514 Server: Encrypted packet (len=1448)
   89 1.080257646  10.6.15.156 → 192.168.1.12 SSH 1514 Server: Encrypted packet (len=1448)
   90 1.080266726 192.168.1.12 → 10.6.15.156  TCP 66 54766 → 22 [ACK] Seq=1089 Ack=38097 Win=6155 Len=0 TSval=8043240 TSecr=14974738
   91 1.080452093  10.6.15.156 → 192.168.1.12 SSH 1514 Server: Encrypted packet (len=1448)
   92 1.080642890  10.6.15.156 → 192.168.1.12 SSH 1514 Server: Encrypted packet (len=1448)
   93 1.080648118 192.168.1.12 → 10.6.15.156  TCP 66 54766 → 22 [ACK] Seq=1089 Ack=40993 Win=6155 Len=0 TSval=8043240 TSecr=14974738
   94 1.083099241  10.6.15.156 → 192.168.1.12 SSH 1514 Server: Encrypted packet (len=1448)
   95 1.083112346  10.6.15.156 → 192.168.1.12 SSH 346 Server: Encrypted packet (len=280)
   96 1.083120091 192.168.1.12 → 10.6.15.156  TCP 66 54766 → 22 [ACK] Seq=1089 Ack=42721 Win=6155 Len=0 TSval=8043240 TSecr=14974739
   97 1.085340117  10.6.15.156 → 192.168.1.12 SSH 150 Server: Encrypted packet (len=84)
   98 1.085423052 192.168.1.12 → 10.6.15.156  TCP 66 54766 → 22 [ACK] Seq=1089 Ack=42805 Win=6155 Len=0 TSval=8043241 TSecr=14974740
   99 1.086241399  10.6.15.156 → 192.168.1.12 SSH 1514 Server: Encrypted packet (len=1448)
  100 1.086385665  10.6.15.156 → 192.168.1.12 SSH 1222 Server: Encrypted packet (len=1156)
  101 1.086395042 192.168.1.12 → 10.6.15.156  TCP 66 54766 → 22 [ACK] Seq=1089 Ack=45409 Win=6155 Len=0 TSval=8043241 TSecr=14974740
  102 1.086737522  10.6.15.156 → 192.168.1.12 SSH 1514 Server: Encrypted packet (len=1448)
  103 1.086747873  10.6.15.156 → 192.168.1.12 SSH 118 Server: Encrypted packet (len=52)
  104 1.086753461 192.168.1.12 → 10.6.15.156  TCP 66 54766 → 22 [ACK] Seq=1089 Ack=46909 Win=6155 Len=0 TSval=8043241 TSecr=14974740
  105 1.091715716  10.6.15.156 → 192.168.1.12 SSH 1514 Server: Encrypted packet (len=1448)
  106 1.091898608  10.6.15.156 → 192.168.1.12 SSH 1514 Server: Encrypted packet (len=1448)
  107 1.091913120 192.168.1.12 → 10.6.15.156  TCP 66 54766 → 22 [ACK] Seq=1089 Ack=49805 Win=6155 Len=0 TSval=8043242 TSecr=14974740
  108 1.092091066  10.6.15.156 → 192.168.1.12 SSH 1514 Server: Encrypted packet (len=1448)
  109 1.092184921  10.6.15.156 → 192.168.1.12 SSH 886 Server: Encrypted packet (len=820)
  110 1.092192294 192.168.1.12 → 10.6.15.156  TCP 66 54766 → 22 [ACK] Seq=1089 Ack=52073 Win=6155 Len=0 TSval=8043242 TSecr=14974740
  111 1.092353635 192.168.1.12 → 10.6.15.156  SSH 102 Client: Encrypted packet (len=36)
  112 1.092400676  10.6.15.156 → 192.168.1.12 SSH 1514 Server: Encrypted packet (len=1448)
  113 1.092587794  10.6.15.156 → 192.168.1.12 SSH 1514 Server: Encrypted packet (len=1448)
  114 1.092595696 192.168.1.12 → 10.6.15.156  TCP 66 54766 → 22 [ACK] Seq=1125 Ack=54969 Win=6155 Len=0 TSval=8043243 TSecr=14974741
  115 1.092778614  10.6.15.156 → 192.168.1.12 SSH 1514 Server: Encrypted packet (len=1448)
  116 1.092971244  10.6.15.156 → 192.168.1.12 SSH 1514 Server: Encrypted packet (len=1448)
  117 1.092979041 192.168.1.12 → 10.6.15.156  TCP 66 54766 → 22 [ACK] Seq=1125 Ack=57865 Win=6155 Len=0 TSval=8043243 TSecr=14974741
  118 1.093041105  10.6.15.156 → 192.168.1.12 SSH 718 Server: Encrypted packet (len=652)
  119 1.093410241  10.6.15.156 → 192.168.1.12 SSH 1514 Server: Encrypted packet (len=1448)
  120 1.093418895 192.168.1.12 → 10.6.15.156  TCP 66 54766 → 22 [ACK] Seq=1125 Ack=59965 Win=6155 Len=0 TSval=8043243 TSecr=14974741
  121 1.093602243  10.6.15.156 → 192.168.1.12 SSH 1514 Server: Encrypted packet (len=1448)
  122 1.093793155  10.6.15.156 → 192.168.1.12 SSH 1514 Server: Encrypted packet (len=1448)
  123 1.093799520 192.168.1.12 → 10.6.15.156  TCP 66 54766 → 22 [ACK] Seq=1125 Ack=62861 Win=6155 Len=0 TSval=8043243 TSecr=14974741
  124 1.093889740  10.6.15.156 → 192.168.1.12 SSH 886 Server: Encrypted packet (len=820)
  125 1.094099127  10.6.15.156 → 192.168.1.12 SSH 1514 Server: Encrypted packet (len=1448)
  126 1.094104473 192.168.1.12 → 10.6.15.156  TCP 66 54766 → 22 [ACK] Seq=1125 Ack=65129 Win=6155 Len=0 TSval=8043243 TSecr=14974741
  127 1.094292601  10.6.15.156 → 192.168.1.12 SSH 1514 Server: Encrypted packet (len=1448)
  128 1.094482864  10.6.15.156 → 192.168.1.12 SSH 1514 Server: Encrypted packet (len=1448)
  129 1.094489493 192.168.1.12 → 10.6.15.156  TCP 66 54766 → 22 [ACK] Seq=1125 Ack=68025 Win=6155 Len=0 TSval=8043243 TSecr=14974741
  130 1.094600075  10.6.15.156 → 192.168.1.12 SSH 1022 Server: Encrypted packet (len=956)
  131 1.094805133  10.6.15.156 → 192.168.1.12 SSH 1514 Server: Encrypted packet (len=1448)
  132 1.094810911 192.168.1.12 → 10.6.15.156  TCP 66 54766 → 22 [ACK] Seq=1125 Ack=70429 Win=6155 Len=0 TSval=8043243 TSecr=14974741
  133 1.096293303  10.6.15.156 → 192.168.1.12 SSH 1514 Server: Encrypted packet (len=1448)
  134 1.096478409  10.6.15.156 → 192.168.1.12 SSH 1514 Server: Encrypted packet (len=1448)
  135 1.096485938 192.168.1.12 → 10.6.15.156  TCP 66 54766 → 22 [ACK] Seq=1125 Ack=73325 Win=6155 Len=0 TSval=8043244 TSecr=14974741
  136 1.096673259  10.6.15.156 → 192.168.1.12 SSH 1514 Server: Encrypted packet (len=1448)
  137 1.096863720  10.6.15.156 → 192.168.1.12 SSH 1514 Server: Encrypted packet (len=1448)
  138 1.096867633 192.168.1.12 → 10.6.15.156  TCP 66 54766 → 22 [ACK] Seq=1125 Ack=76221 Win=6155 Len=0 TSval=8043244 TSecr=14974741
  139 1.096909451  10.6.15.156 → 192.168.1.12 SSH 550 Server: Encrypted packet (len=484)
  140 1.097128831  10.6.15.156 → 192.168.1.12 SSH 1514 Server: Encrypted packet (len=1448)
  141 1.097132713 192.168.1.12 → 10.6.15.156  TCP 66 54766 → 22 [ACK] Seq=1125 Ack=78153 Win=6155 Len=0 TSval=8043244 TSecr=14974741
  142 1.097319934  10.6.15.156 → 192.168.1.12 SSH 1514 Server: Encrypted packet (len=1448)
  143 1.097325367  10.6.15.156 → 192.168.1.12 SSH 102 Server: Encrypted packet (len=36)
  144 1.097328777 192.168.1.12 → 10.6.15.156  TCP 66 54766 → 22 [ACK] Seq=1125 Ack=79637 Win=6155 Len=0 TSval=8043244 TSecr=14974741
  145 1.116959534  10.6.15.156 → 192.168.1.12 SSH 382 Server: Encrypted packet (len=316)
  146 1.136347251  10.6.15.156 → 192.168.1.12 SSH 374 Server: Encrypted packet (len=308)
  147 1.136422744 192.168.1.12 → 10.6.15.156  TCP 66 54766 → 22 [ACK] Seq=1125 Ack=80261 Win=6155 Len=0 TSval=8043254 TSecr=14974748
  148 1.166407184 192.168.1.12 → 10.6.15.156  SSH 470 Client: Encrypted packet (len=404)
  149 1.209713305  10.6.15.156 → 192.168.1.12 TCP 66 22 → 54766 [ACK] Seq=80261 Ack=1529 Win=1452 Len=0 TSval=14974771 TSecr=8043261
  150 1.209730796 192.168.1.12 → 10.6.15.156  SSH 358 Client: Encrypted packet (len=292)
  151 1.212018408  10.6.15.156 → 192.168.1.12 TCP 66 22 → 54766 [ACK] Seq=80261 Ack=1821 Win=1452 Len=0 TSval=14974771 TSecr=8043272
  152 1.237698735  10.6.15.156 → 192.168.1.12 SSH 326 Server: Encrypted packet (len=260)
  153 1.272603513  10.6.15.156 → 192.168.1.12 SSH 366 Server: Encrypted packet (len=300)
  154 1.272623876 192.168.1.12 → 10.6.15.156  TCP 66 54766 → 22 [ACK] Seq=1821 Ack=80821 Win=6155 Len=0 TSval=8043288 TSecr=14974778
  155 1.315459504 192.168.1.12 → 10.6.15.156  SSH 678 Client: Encrypted packet (len=612)
  156 1.356575300  10.6.15.156 → 192.168.1.12 TCP 66 22 → 54766 [ACK] Seq=80821 Ack=2433 Win=1452 Len=0 TSval=14974808 TSecr=8043298
  157 1.356593308 192.168.1.12 → 10.6.15.156  SSH 302 Client: Encrypted packet (len=236)
  158 1.358222484  10.6.15.156 → 192.168.1.12 TCP 66 22 → 54766 [ACK] Seq=80821 Ack=2669 Win=1452 Len=0 TSval=14974808 TSecr=8043309
  159 1.380519781 192.168.1.12 → 10.6.15.156  SSH 166 Client: Encrypted packet (len=100)
  160 1.380737646 192.168.1.12 → 10.6.15.156  SSH 234 Client: Encrypted packet (len=168)
  161 1.382088279  10.6.15.156 → 192.168.1.12 TCP 66 22 → 54766 [ACK] Seq=80821 Ack=2769 Win=1452 Len=0 TSval=14974814 TSecr=8043315
  162 1.382105904  10.6.15.156 → 192.168.1.12 TCP 66 22 → 54766 [ACK] Seq=80821 Ack=2937 Win=1452 Len=0 TSval=14974814 TSecr=8043315
  163 1.441620350 192.168.1.12 → 10.6.15.156  SSH 1514 Client: Encrypted packet (len=1448)
  164 1.442299230 192.168.1.12 → 10.6.15.156  SSH 814 Client: Encrypted packet (len=748)
  165 1.443988639  10.6.15.156 → 192.168.1.12 TCP 66 22 → 54766 [ACK] Seq=80821 Ack=5133 Win=1450 Len=0 TSval=14974829 TSecr=8043330
  166 1.448676202  10.6.15.156 → 192.168.1.12 SSH 142 Server: Encrypted packet (len=76)
  167 1.464520790  10.6.15.156 → 192.168.1.12 SSH 246 Server: Encrypted packet (len=180)
  168 1.464589200 192.168.1.12 → 10.6.15.156  TCP 66 54766 → 22 [ACK] Seq=5133 Ack=81077 Win=6155 Len=0 TSval=8043336 TSecr=14974830
  169 1.531652553  10.6.15.156 → 192.168.1.12 SSH 238 Server: Encrypted packet (len=172)
  170 1.566621018  10.6.15.156 → 192.168.1.12 SSH 926 Server: Encrypted packet (len=860)
  171 1.566636827 192.168.1.12 → 10.6.15.156  TCP 66 54766 → 22 [ACK] Seq=5133 Ack=82109 Win=6155 Len=0 TSval=8043361 TSecr=14974851
  172 1.566653565  10.6.15.156 → 192.168.1.12 SSH 502 Server: Encrypted packet (len=436)
  173 1.567354732 192.168.1.12 → 10.6.15.156  SSH 142 Client: Encrypted packet (len=76)
  174 1.590168810  10.6.15.156 → 192.168.1.12 SSH 190 Server: Encrypted packet (len=124)
  175 1.590195155  10.6.15.156 → 192.168.1.12 SSH 302 Server: Encrypted packet (len=236)
  176 1.590263547 192.168.1.12 → 10.6.15.156  TCP 66 54766 → 22 [ACK] Seq=5209 Ack=82905 Win=6155 Len=0 TSval=8043367 TSecr=14974865
  177 1.590924660  10.6.15.156 → 192.168.1.12 SSH 1514 Server: Encrypted packet (len=1448)
  178 1.591120040  10.6.15.156 → 192.168.1.12 SSH 1514 Server: Encrypted packet (len=1448)
  179 1.591128408 192.168.1.12 → 10.6.15.156  TCP 66 54766 → 22 [ACK] Seq=5209 Ack=85801 Win=6155 Len=0 TSval=8043367 TSecr=14974866
  180 1.591383070  10.6.15.156 → 192.168.1.12 SSH 1014 Server: Encrypted packet (len=948)
  181 1.591719216  10.6.15.156 → 192.168.1.12 SSH 1514 Server: Encrypted packet (len=1448)
  182 1.591727364 192.168.1.12 → 10.6.15.156  TCP 66 54766 → 22 [ACK] Seq=5209 Ack=88197 Win=6155 Len=0 TSval=8043367 TSecr=14974866
  183 1.592035969  10.6.15.156 → 192.168.1.12 SSH 1514 Server: Encrypted packet (len=1448)
  184 1.592223782  10.6.15.156 → 192.168.1.12 SSH 1514 Server: Encrypted packet (len=1448)
  185 1.592227405 192.168.1.12 → 10.6.15.156  TCP 66 54766 → 22 [ACK] Seq=5209 Ack=91093 Win=6155 Len=0 TSval=8043367 TSecr=14974866
  186 1.592595487  10.6.15.156 → 192.168.1.12 SSH 1514 Server: Encrypted packet (len=1448)
  187 1.592777983  10.6.15.156 → 192.168.1.12 SSH 1514 Server: Encrypted packet (len=1448)
  188 1.592785363 192.168.1.12 → 10.6.15.156  TCP 66 54766 → 22 [ACK] Seq=5209 Ack=93989 Win=6155 Len=0 TSval=8043368 TSecr=14974866
  189 1.592794795  10.6.15.156 → 192.168.1.12 SSH 198 Server: Encrypted packet (len=132)
  190 1.593721983 192.168.1.12 → 10.6.15.156  SSH 150 Client: Encrypted packet (len=84)
  191 1.598140545  10.6.15.156 → 192.168.1.12 SSH 838 Server: Encrypted packet (len=772)
  192 1.601879915  10.6.15.156 → 192.168.1.12 SSH 142 Server: Encrypted packet (len=76)
  193 1.601959269 192.168.1.12 → 10.6.15.156  TCP 66 54766 → 22 [ACK] Seq=5293 Ack=94969 Win=6155 Len=0 TSval=8043370 TSecr=14974868
  194 1.602602886 192.168.1.12 → 10.6.15.156  SSH 150 Client: Encrypted packet (len=84)
  195 1.604247647  10.6.15.156 → 192.168.1.12 SSH 1514 Server: Encrypted packet (len=1448)
  196 1.604438182  10.6.15.156 → 192.168.1.12 SSH 1514 Server: Encrypted packet (len=1448)
  197 1.604449903 192.168.1.12 → 10.6.15.156  TCP 66 54766 → 22 [ACK] Seq=5377 Ack=97865 Win=6155 Len=0 TSval=8043371 TSecr=14974869
  198 1.604467688  10.6.15.156 → 192.168.1.12 SSH 470 Server: Encrypted packet (len=404)
  199 1.604846145  10.6.15.156 → 192.168.1.12 SSH 1514 Server: Encrypted packet (len=1448)
  200 1.604853168 192.168.1.12 → 10.6.15.156  TCP 66 54766 → 22 [ACK] Seq=5377 Ack=99717 Win=6155 Len=0 TSval=8043371 TSecr=14974869
  201 1.605038318  10.6.15.156 → 192.168.1.12 SSH 1514 Server: Encrypted packet (len=1448)
  202 1.605382392  10.6.15.156 → 192.168.1.12 SSH 1514 Server: Encrypted packet (len=1448)
  203 1.605388438 192.168.1.12 → 10.6.15.156  TCP 66 54766 → 22 [ACK] Seq=5377 Ack=102613 Win=6155 Len=0 TSval=8043371 TSecr=14974869
  204 1.605573811  10.6.15.156 → 192.168.1.12 SSH 1514 Server: Encrypted packet (len=1448)
  205 1.605581486  10.6.15.156 → 192.168.1.12 SSH 278 Server: Encrypted packet (len=212)
  206 1.605585708 192.168.1.12 → 10.6.15.156  TCP 66 54766 → 22 [ACK] Seq=5377 Ack=104273 Win=6155 Len=0 TSval=8043371 TSecr=14974869
  207 1.606877395  10.6.15.156 → 192.168.1.12 SSH 1514 Server: Encrypted packet (len=1448)
  208 1.607068073  10.6.15.156 → 192.168.1.12 SSH 1514 Server: Encrypted packet (len=1448)
  209 1.607073910 192.168.1.12 → 10.6.15.156  TCP 66 54766 → 22 [ACK] Seq=5377 Ack=107169 Win=6155 Len=0 TSval=8043371 TSecr=14974870
  210 1.607259933  10.6.15.156 → 192.168.1.12 SSH 1514 Server: Encrypted packet (len=1448)
  211 1.607453052  10.6.15.156 → 192.168.1.12 SSH 1514 Server: Encrypted packet (len=1448)
  212 1.607459111 192.168.1.12 → 10.6.15.156  TCP 66 54766 → 22 [ACK] Seq=5377 Ack=110065 Win=6155 Len=0 TSval=8043371 TSecr=14974870
  213 1.607644157  10.6.15.156 → 192.168.1.12 SSH 1514 Server: Encrypted packet (len=1448)
  214 1.607744061  10.6.15.156 → 192.168.1.12 SSH 910 Server: Encrypted packet (len=844)
  215 1.607749091 192.168.1.12 → 10.6.15.156  TCP 66 54766 → 22 [ACK] Seq=5377 Ack=112357 Win=6155 Len=0 TSval=8043371 TSecr=14974870
  216 1.608986764  10.6.15.156 → 192.168.1.12 SSH 1514 Server: Encrypted packet (len=1448)
  217 1.609174763  10.6.15.156 → 192.168.1.12 SSH 1514 Server: Encrypted packet (len=1448)
  218 1.609180717 192.168.1.12 → 10.6.15.156  TCP 66 54766 → 22 [ACK] Seq=5377 Ack=115253 Win=6155 Len=0 TSval=8043372 TSecr=14974870
  219 1.609366130  10.6.15.156 → 192.168.1.12 SSH 1514 Server: Encrypted packet (len=1448)
  220 1.609557446  10.6.15.156 → 192.168.1.12 SSH 1514 Server: Encrypted packet (len=1448)
  221 1.609562066 192.168.1.12 → 10.6.15.156  TCP 66 54766 → 22 [ACK] Seq=5377 Ack=118149 Win=6155 Len=0 TSval=8043372 TSecr=14974870
  222 1.609749874  10.6.15.156 → 192.168.1.12 SSH 1514 Server: Encrypted packet (len=1448)
  223 1.610078470  10.6.15.156 → 192.168.1.12 SSH 1406 Server: Encrypted packet (len=1340)
  224 1.610082966 192.168.1.12 → 10.6.15.156  TCP 66 54766 → 22 [ACK] Seq=5377 Ack=120937 Win=6155 Len=0 TSval=8043372 TSecr=14974870
  225 1.610273543  10.6.15.156 → 192.168.1.12 SSH 1514 Server: Encrypted packet (len=1448)
  226 1.610466360  10.6.15.156 → 192.168.1.12 SSH 1514 Server: Encrypted packet (len=1448)
  227 1.610471782 192.168.1.12 → 10.6.15.156  TCP 66 54766 → 22 [ACK] Seq=5377 Ack=123833 Win=6155 Len=0 TSval=8043372 TSecr=14974871
  228 1.610657124  10.6.15.156 → 192.168.1.12 SSH 1514 Server: Encrypted packet (len=1448)
  229 1.610848931  10.6.15.156 → 192.168.1.12 SSH 1514 Server: Encrypted packet (len=1448)
  230 1.610854392 192.168.1.12 → 10.6.15.156  TCP 66 54766 → 22 [ACK] Seq=5377 Ack=126729 Win=6155 Len=0 TSval=8043372 TSecr=14974871
  231 1.611041408  10.6.15.156 → 192.168.1.12 SSH 1514 Server: Encrypted packet (len=1448)
  232 1.611154917  10.6.15.156 → 192.168.1.12 SSH 998 Server: Encrypted packet (len=932)
  233 1.611159918 192.168.1.12 → 10.6.15.156  TCP 66 54766 → 22 [ACK] Seq=5377 Ack=129109 Win=6155 Len=0 TSval=8043372 TSecr=14974871
  234 1.688580614  10.6.15.156 → 192.168.1.12 SSH 190 Server: Encrypted packet (len=124)
  235 1.732279044 192.168.1.12 → 10.6.15.156  TCP 66 54766 → 22 [ACK] Seq=5377 Ack=129233 Win=6155 Len=0 TSval=8043403 TSecr=14974891
  236 1.761735859  10.6.15.156 → 192.168.1.12 SSH 422 Server: Encrypted packet (len=356)
  237 1.761832252 192.168.1.12 → 10.6.15.156  TCP 66 54766 → 22 [ACK] Seq=5377 Ack=129589 Win=6155 Len=0 TSval=8043410 TSecr=14974909
  238 1.764193953  10.6.15.156 → 192.168.1.12 SSH 1514 Server: Encrypted packet (len=1448)
  239 1.764296591  10.6.15.156 → 192.168.1.12 SSH 1206 Server: Encrypted packet (len=1140)
  240 1.764307358 192.168.1.12 → 10.6.15.156  TCP 66 54766 → 22 [ACK] Seq=5377 Ack=132177 Win=6155 Len=0 TSval=8043411 TSecr=14974909
  241 1.764592270  10.6.15.156 → 192.168.1.12 SSH 1302 Server: Encrypted packet (len=1236)
  242 1.764630206 192.168.1.12 → 10.6.15.156  TCP 66 54766 → 22 [ACK] Seq=5377 Ack=133413 Win=6155 Len=0 TSval=8043411 TSecr=14974909
  243 1.764791408  10.6.15.156 → 192.168.1.12 SSH 1514 Server: Encrypted packet (len=1448)
  244 1.764897815  10.6.15.156 → 192.168.1.12 SSH 966 Server: Encrypted packet (len=900)
  245 1.764905444 192.168.1.12 → 10.6.15.156  TCP 66 54766 → 22 [ACK] Seq=5377 Ack=135761 Win=6155 Len=0 TSval=8043411 TSecr=14974909
  246 1.765269656  10.6.15.156 → 192.168.1.12 SSH 1514 Server: Encrypted packet (len=1448)
  247 1.765416230  10.6.15.156 → 192.168.1.12 SSH 1214 Server: Encrypted packet (len=1148)
  248 1.765423825 192.168.1.12 → 10.6.15.156  TCP 66 54766 → 22 [ACK] Seq=5377 Ack=138357 Win=6155 Len=0 TSval=8043411 TSecr=14974909
  249 1.765603742  10.6.15.156 → 192.168.1.12 SSH 1514 Server: Encrypted packet (len=1448)
  250 1.765803494  10.6.15.156 → 192.168.1.12 SSH 1514 Server: Encrypted packet (len=1448)
  251 1.765808318 192.168.1.12 → 10.6.15.156  TCP 66 54766 → 22 [ACK] Seq=5377 Ack=141253 Win=6155 Len=0 TSval=8043411 TSecr=14974910
  252 1.766073571  10.6.15.156 → 192.168.1.12 SSH 1054 Server: Encrypted packet (len=988)
  253 1.766092013 192.168.1.12 → 10.6.15.156  TCP 66 54766 → 22 [ACK] Seq=5377 Ack=142241 Win=6155 Len=0 TSval=8043411 TSecr=14974910
  254 1.766436348  10.6.15.156 → 192.168.1.12 SSH 1514 Server: Encrypted packet (len=1448)
  255 1.766622735  10.6.15.156 → 192.168.1.12 SSH 1514 Server: Encrypted packet (len=1448)
  256 1.766627214 192.168.1.12 → 10.6.15.156  TCP 66 54766 → 22 [ACK] Seq=5377 Ack=145137 Win=6155 Len=0 TSval=8043411 TSecr=14974910
  257 1.766965870  10.6.15.156 → 192.168.1.12 SSH 1514 Server: Encrypted packet (len=1448)
  258 1.767018354  10.6.15.156 → 192.168.1.12 SSH 790 Server: Encrypted packet (len=724)
  259 1.767021394 192.168.1.12 → 10.6.15.156  TCP 66 54766 → 22 [ACK] Seq=5377 Ack=147309 Win=6155 Len=0 TSval=8043411 TSecr=14974910
  260 1.769376899  10.6.15.156 → 192.168.1.12 SSH 1514 Server: Encrypted packet (len=1448)
  261 1.769553667  10.6.15.156 → 192.168.1.12 SSH 1514 Server: Encrypted packet (len=1448)
  262 1.769560670 192.168.1.12 → 10.6.15.156  TCP 66 54766 → 22 [ACK] Seq=5377 Ack=150205 Win=6155 Len=0 TSval=8043412 TSecr=14974910
  263 1.769750269  10.6.15.156 → 192.168.1.12 SSH 1514 Server: Encrypted packet (len=1448)
  264 1.769942051  10.6.15.156 → 192.168.1.12 SSH 1514 Server: Encrypted packet (len=1448)
  265 1.769944821 192.168.1.12 → 10.6.15.156  TCP 66 54766 → 22 [ACK] Seq=5377 Ack=153101 Win=6155 Len=0 TSval=8043412 TSecr=14974910
  266 1.770133065  10.6.15.156 → 192.168.1.12 SSH 1514 Server: Encrypted packet (len=1448)
  267 1.770333086  10.6.15.156 → 192.168.1.12 SSH 1514 Server: Encrypted packet (len=1448)
  268 1.770340741 192.168.1.12 → 10.6.15.156  TCP 66 54766 → 22 [ACK] Seq=5377 Ack=155997 Win=6155 Len=0 TSval=8043412 TSecr=14974910
  269 1.770519409  10.6.15.156 → 192.168.1.12 SSH 1514 Server: Encrypted packet (len=1448)
  270 1.770728316  10.6.15.156 → 192.168.1.12 SSH 614 Server: Encrypted packet (len=548)
  271 1.770733273 192.168.1.12 → 10.6.15.156  TCP 66 54766 → 22 [ACK] Seq=5377 Ack=157993 Win=6155 Len=0 TSval=8043412 TSecr=14974910
  272 1.771044027  10.6.15.156 → 192.168.1.12 SSH 1514 Server: Encrypted packet (len=1448)
  273 1.771395974  10.6.15.156 → 192.168.1.12 SSH 1514 Server: Encrypted packet (len=1448)
  274 1.771401980 192.168.1.12 → 10.6.15.156  TCP 66 54766 → 22 [ACK] Seq=5377 Ack=160889 Win=6155 Len=0 TSval=8043412 TSecr=14974911
  275 1.771586771  10.6.15.156 → 192.168.1.12 SSH 1514 Server: Encrypted packet (len=1448)
  276 1.772791679  10.6.15.156 → 192.168.1.12 SSH 1514 Server: Encrypted packet (len=1448)
  277 1.772795895 192.168.1.12 → 10.6.15.156  TCP 66 54766 → 22 [ACK] Seq=5377 Ack=163785 Win=6155 Len=0 TSval=8043413 TSecr=14974911
  278 1.772977334  10.6.15.156 → 192.168.1.12 SSH 1514 Server: Encrypted packet (len=1448)
  279 1.773170336  10.6.15.156 → 192.168.1.12 SSH 1514 Server: Encrypted packet (len=1448)
  280 1.773173785 192.168.1.12 → 10.6.15.156  TCP 66 54766 → 22 [ACK] Seq=5377 Ack=166681 Win=6155 Len=0 TSval=8043413 TSecr=14974911
  281 1.773366587  10.6.15.156 → 192.168.1.12 SSH 1514 Server: Encrypted packet (len=1448)
  282 1.773556767  10.6.15.156 → 192.168.1.12 SSH 1514 Server: Encrypted packet (len=1448)
  283 1.773559456 192.168.1.12 → 10.6.15.156  TCP 66 54766 → 22 [ACK] Seq=5377 Ack=169577 Win=6155 Len=0 TSval=8043413 TSecr=14974911
  284 1.773748816  10.6.15.156 → 192.168.1.12 SSH 1514 Server: Encrypted packet (len=1448)
  285 1.773936976  10.6.15.156 → 192.168.1.12 SSH 1514 Server: Encrypted packet (len=1448)
  286 1.773939511 192.168.1.12 → 10.6.15.156  TCP 66 54766 → 22 [ACK] Seq=5377 Ack=172473 Win=6155 Len=0 TSval=8043413 TSecr=14974911
  287 1.774137077  10.6.15.156 → 192.168.1.12 SSH 1514 Server: Encrypted packet (len=1448)
  288 1.774159355  10.6.15.156 → 192.168.1.12 SSH 538 Server: Encrypted packet (len=472)
  289 1.774162570 192.168.1.12 → 10.6.15.156  TCP 66 54766 → 22 [ACK] Seq=5377 Ack=174393 Win=6155 Len=0 TSval=8043413 TSecr=14974911
  290 1.775918742  10.6.15.156 → 192.168.1.12 SSH 1514 Server: Encrypted packet (len=1448)
  291 1.776101516  10.6.15.156 → 192.168.1.12 SSH 1514 Server: Encrypted packet (len=1448)
  292 1.776109411 192.168.1.12 → 10.6.15.156  TCP 66 54766 → 22 [ACK] Seq=5377 Ack=177289 Win=6155 Len=0 TSval=8043413 TSecr=14974912
  293 1.776446380  10.6.15.156 → 192.168.1.12 SSH 1514 Server: Encrypted packet (len=1448)
  294 1.776656929  10.6.15.156 → 192.168.1.12 SSH 1514 Server: Encrypted packet (len=1448)
  295 1.776660188 192.168.1.12 → 10.6.15.156  TCP 66 54766 → 22 [ACK] Seq=5377 Ack=180185 Win=6155 Len=0 TSval=8043414 TSecr=14974912
  296 1.776846535  10.6.15.156 → 192.168.1.12 SSH 1514 Server: Encrypted packet (len=1448)
  297 1.777013675  10.6.15.156 → 192.168.1.12 SSH 1514 Server: Encrypted packet (len=1448)
  298 1.777016788 192.168.1.12 → 10.6.15.156  TCP 66 54766 → 22 [ACK] Seq=5377 Ack=183081 Win=6155 Len=0 TSval=8043414 TSecr=14974912
  299 1.777233075  10.6.15.156 → 192.168.1.12 SSH 1514 Server: Encrypted packet (len=1448)
  300 1.777574449  10.6.15.156 → 192.168.1.12 SSH 1514 Server: Encrypted packet (len=1448)
  301 1.777577414 192.168.1.12 → 10.6.15.156  TCP 66 54766 → 22 [ACK] Seq=5377 Ack=185977 Win=6155 Len=0 TSval=8043414 TSecr=14974912
  302 1.777773418  10.6.15.156 → 192.168.1.12 SSH 1514 Server: Encrypted packet (len=1448)
  303 1.777943522  10.6.15.156 → 192.168.1.12 SSH 1514 Server: Encrypted packet (len=1448)
  304 1.777946662 192.168.1.12 → 10.6.15.156  TCP 66 54766 → 22 [ACK] Seq=5377 Ack=188873 Win=6155 Len=0 TSval=8043414 TSecr=14974912
  305 1.778134952  10.6.15.156 → 192.168.1.12 SSH 1514 Server: Encrypted packet (len=1448)
  306 1.778327143  10.6.15.156 → 192.168.1.12 SSH 1514 Server: Encrypted packet (len=1448)
  307 1.778330245 192.168.1.12 → 10.6.15.156  TCP 66 54766 → 22 [ACK] Seq=5377 Ack=191769 Win=6155 Len=0 TSval=8043414 TSecr=14974912
  308 1.778518734  10.6.15.156 → 192.168.1.12 SSH 1514 Server: Encrypted packet (len=1448)
  309 1.778857756  10.6.15.156 → 192.168.1.12 SSH 1514 Server: Encrypted packet (len=1448)
  310 1.778863344 192.168.1.12 → 10.6.15.156  TCP 66 54766 → 22 [ACK] Seq=5377 Ack=194665 Win=6155 Len=0 TSval=8043414 TSecr=14974912
  311 1.779045718  10.6.15.156 → 192.168.1.12 SSH 1514 Server: Encrypted packet (len=1448)
  312 1.779237343  10.6.15.156 → 192.168.1.12 SSH 1514 Server: Encrypted packet (len=1448)
  313 1.779239861 192.168.1.12 → 10.6.15.156  TCP 66 54766 → 22 [ACK] Seq=5377 Ack=197561 Win=6155 Len=0 TSval=8043414 TSecr=14974912
  314 1.779430015  10.6.15.156 → 192.168.1.12 SSH 1514 Server: Encrypted packet (len=1448)
  315 1.779650730  10.6.15.156 → 192.168.1.12 SSH 1514 Server: Encrypted packet (len=1448)
  316 1.779653408 192.168.1.12 → 10.6.15.156  TCP 66 54766 → 22 [ACK] Seq=5377 Ack=200457 Win=6155 Len=0 TSval=8043414 TSecr=14974913
  317 1.779844317  10.6.15.156 → 192.168.1.12 SSH 1514 Server: Encrypted packet (len=1448)
  318 1.780035347  10.6.15.156 → 192.168.1.12 SSH 1514 Server: Encrypted packet (len=1448)
  319 1.780038304 192.168.1.12 → 10.6.15.156  TCP 66 54766 → 22 [ACK] Seq=5377 Ack=203353 Win=6155 Len=0 TSval=8043414 TSecr=14974913
  320 1.780197789  10.6.15.156 → 192.168.1.12 SSH 1514 Server: Encrypted packet (len=1448)
  321 1.780419381  10.6.15.156 → 192.168.1.12 SSH 1514 Server: Encrypted packet (len=1448)
  322 1.780422458 192.168.1.12 → 10.6.15.156  TCP 66 54766 → 22 [ACK] Seq=5377 Ack=206249 Win=6155 Len=0 TSval=8043415 TSecr=14974913
  323 1.782919437  10.6.15.156 → 192.168.1.12 SSH 1514 Server: Encrypted packet (len=1448)
  324 1.783100953  10.6.15.156 → 192.168.1.12 SSH 1514 Server: Encrypted packet (len=1448)
  325 1.783106757 192.168.1.12 → 10.6.15.156  TCP 66 54766 → 22 [ACK] Seq=5377 Ack=209145 Win=6155 Len=0 TSval=8043415 TSecr=14974913
  326 1.783304127  10.6.15.156 → 192.168.1.12 SSH 1514 Server: Encrypted packet (len=1448)
  327 1.783514493  10.6.15.156 → 192.168.1.12 SSH 1514 Server: Encrypted packet (len=1448)
  328 1.783517960 192.168.1.12 → 10.6.15.156  TCP 66 54766 → 22 [ACK] Seq=5377 Ack=212041 Win=6155 Len=0 TSval=8043415 TSecr=14974913
  329 1.783686659  10.6.15.156 → 192.168.1.12 SSH 1514 Server: Encrypted packet (len=1448)
  330 1.783898130  10.6.15.156 → 192.168.1.12 SSH 1514 Server: Encrypted packet (len=1448)
  331 1.783901261 192.168.1.12 → 10.6.15.156  TCP 66 54766 → 22 [ACK] Seq=5377 Ack=214937 Win=6155 Len=0 TSval=8043415 TSecr=14974913
  332 1.784089816  10.6.15.156 → 192.168.1.12 SSH 1514 Server: Encrypted packet (len=1448)
  333 1.784251594  10.6.15.156 → 192.168.1.12 SSH 1514 Server: Encrypted packet (len=1448)
  334 1.784254278 192.168.1.12 → 10.6.15.156  TCP 66 54766 → 22 [ACK] Seq=5377 Ack=217833 Win=6155 Len=0 TSval=8043415 TSecr=14974913
  335 1.784454740  10.6.15.156 → 192.168.1.12 SSH 1514 Server: Encrypted packet (len=1448)
  336 1.784792439  10.6.15.156 → 192.168.1.12 SSH 1514 Server: Encrypted packet (len=1448)
  337 1.784799088 192.168.1.12 → 10.6.15.156  TCP 66 54766 → 22 [ACK] Seq=5377 Ack=220729 Win=6155 Len=0 TSval=8043416 TSecr=14974913
  338 1.784989639  10.6.15.156 → 192.168.1.12 SSH 1514 Server: Encrypted packet (len=1448)
  339 1.785182194  10.6.15.156 → 192.168.1.12 SSH 1514 Server: Encrypted packet (len=1448)
  340 1.785189357 192.168.1.12 → 10.6.15.156  TCP 66 54766 → 22 [ACK] Seq=5377 Ack=223625 Win=6155 Len=0 TSval=8043416 TSecr=14974913
  341 1.785375960  10.6.15.156 → 192.168.1.12 SSH 1514 Server: Encrypted packet (len=1448)
  342 1.785558131  10.6.15.156 → 192.168.1.12 SSH 1514 Server: Encrypted packet (len=1448)
  343 1.785564113 192.168.1.12 → 10.6.15.156  TCP 66 54766 → 22 [ACK] Seq=5377 Ack=226521 Win=6155 Len=0 TSval=8043416 TSecr=14974913
  344 1.785750944  10.6.15.156 → 192.168.1.12 SSH 1514 Server: Encrypted packet (len=1448)
  345 1.785944175  10.6.15.156 → 192.168.1.12 SSH 1514 Server: Encrypted packet (len=1448)
  346 1.785951891 192.168.1.12 → 10.6.15.156  TCP 66 54766 → 22 [ACK] Seq=5377 Ack=229417 Win=6155 Len=0 TSval=8043416 TSecr=14974914
  347 1.786146575  10.6.15.156 → 192.168.1.12 SSH 1514 Server: Encrypted packet (len=1448)
  348 1.786336382  10.6.15.156 → 192.168.1.12 SSH 1514 Server: Encrypted packet (len=1448)
  349 1.786342381 192.168.1.12 → 10.6.15.156  TCP 66 54766 → 22 [ACK] Seq=5377 Ack=232313 Win=6155 Len=0 TSval=8043416 TSecr=14974914
  350 1.787717663  10.6.15.156 → 192.168.1.12 SSH 1514 Server: Encrypted packet (len=1448)
  351 1.787890796  10.6.15.156 → 192.168.1.12 SSH 1514 Server: Encrypted packet (len=1448)
  352 1.787898705 192.168.1.12 → 10.6.15.156  TCP 66 54766 → 22 [ACK] Seq=5377 Ack=235209 Win=6155 Len=0 TSval=8043416 TSecr=14974914
  353 1.788082601  10.6.15.156 → 192.168.1.12 SSH 1514 Server: Encrypted packet (len=1448)
  354 1.788286467  10.6.15.156 → 192.168.1.12 SSH 1514 Server: Encrypted packet (len=1448)
  355 1.788289617 192.168.1.12 → 10.6.15.156  TCP 66 54766 → 22 [ACK] Seq=5377 Ack=238105 Win=6155 Len=0 TSval=8043417 TSecr=14974914
  356 1.788467743  10.6.15.156 → 192.168.1.12 SSH 1514 Server: Encrypted packet (len=1448)
  357 1.788660380  10.6.15.156 → 192.168.1.12 SSH 1514 Server: Encrypted packet (len=1448)
  358 1.788664532 192.168.1.12 → 10.6.15.156  TCP 66 54766 → 22 [ACK] Seq=5377 Ack=241001 Win=6155 Len=0 TSval=8043417 TSecr=14974914
  359 1.788851288  10.6.15.156 → 192.168.1.12 SSH 1514 Server: Encrypted packet (len=1448)
  360 1.789043335  10.6.15.156 → 192.168.1.12 SSH 1514 Server: Encrypted packet (len=1448)
  361 1.789047375 192.168.1.12 → 10.6.15.156  TCP 66 54766 → 22 [ACK] Seq=5377 Ack=243897 Win=6155 Len=0 TSval=8043417 TSecr=14974914
  362 1.789237919  10.6.15.156 → 192.168.1.12 SSH 1514 Server: Encrypted packet (len=1448)
  363 1.789593269  10.6.15.156 → 192.168.1.12 SSH 1514 Server: Encrypted packet (len=1448)
  364 1.789613882 192.168.1.12 → 10.6.15.156  TCP 66 54766 → 22 [ACK] Seq=5377 Ack=246793 Win=6155 Len=0 TSval=8043417 TSecr=14974914
  365 1.789779764  10.6.15.156 → 192.168.1.12 SSH 1514 Server: Encrypted packet (len=1448)
  366 1.789968050  10.6.15.156 → 192.168.1.12 SSH 1514 Server: Encrypted packet (len=1448)
  367 1.789977264 192.168.1.12 → 10.6.15.156  TCP 66 54766 → 22 [ACK] Seq=5377 Ack=249689 Win=6155 Len=0 TSval=8043417 TSecr=14974914
  368 1.790156305  10.6.15.156 → 192.168.1.12 SSH 1514 Server: Encrypted packet (len=1448)
  369 1.790349663  10.6.15.156 → 192.168.1.12 SSH 1514 Server: Encrypted packet (len=1448)
  370 1.790354985 192.168.1.12 → 10.6.15.156  TCP 66 54766 → 22 [ACK] Seq=5377 Ack=252585 Win=6155 Len=0 TSval=8043417 TSecr=14974915
  371 1.790546989  10.6.15.156 → 192.168.1.12 SSH 1514 Server: Encrypted packet (len=1448)
  372 1.790733342  10.6.15.156 → 192.168.1.12 SSH 1514 Server: Encrypted packet (len=1448)
  373 1.790739349 192.168.1.12 → 10.6.15.156  TCP 66 54766 → 22 [ACK] Seq=5377 Ack=255481 Win=6155 Len=0 TSval=8043417 TSecr=14974915
  374 1.790927718  10.6.15.156 → 192.168.1.12 SSH 1514 Server: Encrypted packet (len=1448)
  375 1.791118475  10.6.15.156 → 192.168.1.12 SSH 1514 Server: Encrypted packet (len=1448)
  376 1.791124094 192.168.1.12 → 10.6.15.156  TCP 66 54766 → 22 [ACK] Seq=5377 Ack=258377 Win=6155 Len=0 TSval=8043417 TSecr=14974915
  377 1.792614186  10.6.15.156 → 192.168.1.12 SSH 1514 Server: Encrypted packet (len=1448)
  378 1.792796052  10.6.15.156 → 192.168.1.12 SSH 1514 Server: Encrypted packet (len=1448)
  379 1.792808976 192.168.1.12 → 10.6.15.156  TCP 66 54766 → 22 [ACK] Seq=5377 Ack=261273 Win=6155 Len=0 TSval=8043418 TSecr=14974915
  380 1.792987751  10.6.15.156 → 192.168.1.12 SSH 1514 Server: Encrypted packet (len=1448)
