    1 0.000000000  10.6.15.156 → 192.168.1.12 SSH 238 Server: Encrypted packet (len=172)
    2 0.000026938 192.168.1.12 → 10.6.15.156  TCP 66 54766 → 22 [ACK] Seq=1 Ack=173 Win=6155 Len=0 TSval=8052034 TSecr=14983533
    3 0.056189870  10.6.15.156 → 192.168.1.12 SSH 238 Server: Encrypted packet (len=172)
    4 0.056264269 192.168.1.12 → 10.6.15.156  TCP 66 54766 → 22 [ACK] Seq=1 Ack=345 Win=6155 Len=0 TSval=8052048 TSecr=14983547
    5 0.158840486  10.6.15.156 → 192.168.1.12 SSH 182 Server: Encrypted packet (len=116)
    6 0.158918048 192.168.1.12 → 10.6.15.156  TCP 66 54766 → 22 [ACK] Seq=1 Ack=461 Win=6155 Len=0 TSval=8052074 TSecr=14983572
    7 0.184773410  10.6.15.156 → 192.168.1.12 SSH 286 Server: Encrypted packet (len=220)
    8 0.184851977 192.168.1.12 → 10.6.15.156  TCP 66 54766 → 22 [ACK] Seq=1 Ack=681 Win=6155 Len=0 TSval=8052080 TSecr=14983579
    9 0.191407937 192.168.1.12 → 10.6.15.156  SSH 110 Client: Encrypted packet (len=44)
   10 0.229131343  10.6.15.156 → 192.168.1.12 TCP 66 22 → 54766 [ACK] Seq=681 Ack=45 Win=1452 Len=0 TSval=14983591 TSecr=8052082
   11 0.229152459 192.168.1.12 → 10.6.15.156  SSH 642 Client: Encrypted packet (len=576)
   12 0.231031145  10.6.15.156 → 192.168.1.12 TCP 66 22 → 54766 [ACK] Seq=681 Ack=621 Win=1452 Len=0 TSval=14983591 TSecr=8052091
   13 0.280880016  10.6.15.156 → 192.168.1.12 SSH 102 Server: Encrypted packet (len=36)
   14 0.280901998  10.6.15.156 → 192.168.1.12 SSH 102 Server: Encrypted packet (len=36)
   15 0.280967349 192.168.1.12 → 10.6.15.156  TCP 66 54766 → 22 [ACK] Seq=621 Ack=753 Win=6155 Len=0 TSval=8052104 TSecr=14983603
   16 0.302351941  10.6.15.156 → 192.168.1.12 SSH 102 Server: Encrypted packet (len=36)
   17 0.304024204  10.6.15.156 → 192.168.1.12 SSH 102 Server: Encrypted packet (len=36)
   18 0.304097893 192.168.1.12 → 10.6.15.156  TCP 66 54766 → 22 [ACK] Seq=621 Ack=825 Win=6155 Len=0 TSval=8052110 TSecr=14983609
   19 0.383236188  10.6.15.156 → 192.168.1.12 SSH 182 Server: Encrypted packet (len=116)
   20 0.425213637 192.168.1.12 → 10.6.15.156  TCP 66 54766 → 22 [ACK] Seq=621 Ack=941 Win=6155 Len=0 TSval=8052141 TSecr=14983629
   21 0.450622199  10.6.15.156 → 192.168.1.12 SSH 182 Server: Encrypted packet (len=116)
   22 0.450705907 192.168.1.12 → 10.6.15.156  TCP 66 54766 → 22 [ACK] Seq=621 Ack=1057 Win=6155 Len=0 TSval=8052147 TSecr=14983646
   23 0.506124827  10.6.15.156 → 192.168.1.12 SSH 238 Server: Encrypted packet (len=172)
   24 0.506209978 192.168.1.12 → 10.6.15.156  TCP 66 54766 → 22 [ACK] Seq=621 Ack=1229 Win=6155 Len=0 TSval=8052161 TSecr=14983660
   25 0.607398381  10.6.15.156 → 192.168.1.12 SSH 274 Server: Encrypted packet (len=208)
   26 0.607482765 192.168.1.12 → 10.6.15.156  TCP 66 54766 → 22 [ACK] Seq=621 Ack=1437 Win=6155 Len=0 TSval=8052186 TSecr=14983685
   27 0.610383301  10.6.15.156 → 192.168.1.12 SSH 102 Server: Encrypted packet (len=36)
   28 0.610466235 192.168.1.12 → 10.6.15.156  TCP 66 54766 → 22 [ACK] Seq=621 Ack=1473 Win=6155 Len=0 TSval=8052187 TSecr=14983686
   29 0.616239591  10.6.15.156 → 192.168.1.12 SSH 1514 Server: Encrypted packet (len=1448)
   30 0.616321403  10.6.15.156 → 192.168.1.12 SSH 1358 Server: Encrypted packet (len=1292)
   31 0.616329322 192.168.1.12 → 10.6.15.156  TCP 66 54766 → 22 [ACK] Seq=621 Ack=4213 Win=6155 Len=0 TSval=8052188 TSecr=14983687
   32 0.616595013  10.6.15.156 → 192.168.1.12 SSH 1102 Server: Encrypted packet (len=1036)
   33 0.616630873 192.168.1.12 → 10.6.15.156  TCP 66 54766 → 22 [ACK] Seq=621 Ack=5249 Win=6155 Len=0 TSval=8052188 TSecr=14983687
   34 0.635001763 192.168.1.12 → 10.6.15.156  SSH 142 Client: Encrypted packet (len=76)
   35 0.637106306  10.6.15.156 → 192.168.1.12 TCP 66 22 → 54766 [ACK] Seq=5249 Ack=697 Win=1452 Len=0 TSval=14983692 TSecr=8052193
   36 0.638761230 192.168.1.12 → 10.6.15.156  SSH 118 Client: Encrypted packet (len=52)
   37 0.640080872  10.6.15.156 → 192.168.1.12 TCP 66 22 → 54766 [ACK] Seq=5249 Ack=749 Win=1452 Len=0 TSval=14983693 TSecr=8052194
   38 0.640120189 192.168.1.12 → 10.6.15.156  SSH 134 Client: Encrypted packet (len=68)
   39 0.641646102  10.6.15.156 → 192.168.1.12 TCP 66 22 → 54766 [ACK] Seq=5249 Ack=817 Win=1452 Len=0 TSval=14983694 TSecr=8052194
   40 0.641666093 192.168.1.12 → 10.6.15.156  SSH 142 Client: Encrypted packet (len=76)
   41 0.643187105  10.6.15.156 → 192.168.1.12 TCP 66 22 → 54766 [ACK] Seq=5249 Ack=893 Win=1452 Len=0 TSval=14983694 TSecr=8052195
   42 0.643716608 192.168.1.12 → 10.6.15.156  SSH 118 Client: Encrypted packet (len=52)
   43 0.643924413 192.168.1.12 → 10.6.15.156  SSH 118 Client: Encrypted packet (len=52)
   44 0.644757056  10.6.15.156 → 192.168.1.12 SSH 110 Server: Encrypted packet (len=44)
   45 0.645131456  10.6.15.156 → 192.168.1.12 TCP 66 22 → 54766 [ACK] Seq=5293 Ack=997 Win=1452 Len=0 TSval=14983695 TSecr=8052195
   46 0.654040409  10.6.15.156 → 192.168.1.12 SSH 102 Server: Encrypted packet (len=36)
   47 0.654121773 192.168.1.12 → 10.6.15.156  TCP 66 54766 → 22 [ACK] Seq=997 Ack=5329 Win=6155 Len=0 TSval=8052198 TSecr=14983694
   48 0.654562028 192.168.1.12 → 10.6.15.156  SSH 518 Client: Encrypted packet (len=452)
   49 0.670586666  10.6.15.156 → 192.168.1.12 SSH 186 Server: Encrypted packet (len=120)
   50 0.670913780 192.168.1.12 → 10.6.15.156  SSH 158 Client: Encrypted packet (len=92)
   51 0.676570976  10.6.15.156 → 192.168.1.12 SSH 102 Server: Encrypted packet (len=36)
   52 0.678874588  10.6.15.156 → 192.168.1.12 SSH 102 Server: Encrypted packet (len=36)
   53 0.678957527 192.168.1.12 → 10.6.15.156  TCP 66 54766 → 22 [ACK] Seq=1541 Ack=5521 Win=6155 Len=0 TSval=8052204 TSecr=14983702
   54 0.714072251  10.6.15.156 → 192.168.1.12 SSH 102 Server: Encrypted packet (len=36)
   55 0.757192666 192.168.1.12 → 10.6.15.156  TCP 66 54766 → 22 [ACK] Seq=1541 Ack=5557 Win=6155 Len=0 TSval=8052224 TSecr=14983712
   56 0.901437617  10.6.15.156 → 192.168.1.12 SSH 198 Server: Encrypted packet (len=132)
   57 0.901525996 192.168.1.12 → 10.6.15.156  TCP 66 54766 → 22 [ACK] Seq=1541 Ack=5689 Win=6155 Len=0 TSval=8052260 TSecr=14983759
   58 0.917659031  10.6.15.156 → 192.168.1.12 SSH 198 Server: [TCP Spurious Retransmission] , Encrypted packet (len=132)
   59 0.917678532 192.168.1.12 → 10.6.15.156  TCP 78 [TCP Dup ACK 57#1] 54766 → 22 [ACK] Seq=1541 Ack=5689 Win=6155 Len=0 TSval=8052264 TSecr=14983763 SLE=5557 SRE=5689
   60 1.018300560  10.6.15.156 → 192.168.1.12 SSH 182 Server: Encrypted packet (len=116)
   61 1.018325802 192.168.1.12 → 10.6.15.156  TCP 66 54766 → 22 [ACK] Seq=1541 Ack=5805 Win=6155 Len=0 TSval=8052289 TSecr=14983788
   62 1.020942876  10.6.15.156 → 192.168.1.12 SSH 1514 Server: Encrypted packet (len=1448)
   63 1.020961003 192.168.1.12 → 10.6.15.156  TCP 66 54766 → 22 [ACK] Seq=1541 Ack=7253 Win=6155 Len=0 TSval=8052289 TSecr=14983788
   64 1.021045111  10.6.15.156 → 192.168.1.12 SSH 1514 Server: Encrypted packet (len=1448)
   65 1.021049512 192.168.1.12 → 10.6.15.156  TCP 66 54766 → 22 [ACK] Seq=1541 Ack=8701 Win=6155 Len=0 TSval=8052289 TSecr=14983788
   66 1.021240317  10.6.15.156 → 192.168.1.12 SSH 1514 Server: Encrypted packet (len=1448)
   67 1.021247843 192.168.1.12 → 10.6.15.156  TCP 66 54766 → 22 [ACK] Seq=1541 Ack=10149 Win=6155 Len=0 TSval=8052290 TSecr=14983788
   68 1.021349355  10.6.15.156 → 192.168.1.12 SSH 1006 Server: Encrypted packet (len=940)
   69 1.021356036 192.168.1.12 → 10.6.15.156  TCP 66 54766 → 22 [ACK] Seq=1541 Ack=11089 Win=6155 Len=0 TSval=8052290 TSecr=14983788
   70 1.021395271  10.6.15.156 → 192.168.1.12 SSH 710 Server: Encrypted packet (len=644)
   71 1.021397968 192.168.1.12 → 10.6.15.156  TCP 66 54766 → 22 [ACK] Seq=1541 Ack=11733 Win=6155 Len=0 TSval=8052290 TSecr=14983788
   72 1.025152520  10.6.15.156 → 192.168.1.12 SSH 158 Server: Encrypted packet (len=92)
   73 1.025172587 192.168.1.12 → 10.6.15.156  TCP 66 54766 → 22 [ACK] Seq=1541 Ack=11825 Win=6155 Len=0 TSval=8052290 TSecr=14983790
   74 1.025383489 192.168.1.12 → 10.6.15.156  SSH 102 Client: Encrypted packet (len=36)
   75 1.026377659  10.6.15.156 → 192.168.1.12 SSH 1514 Server: Encrypted packet (len=1448)
   76 1.026653915  10.6.15.156 → 192.168.1.12 SSH 1342 Server: Encrypted packet (len=1276)
   77 1.026666696 192.168.1.12 → 10.6.15.156  TCP 66 54766 → 22 [ACK] Seq=1577 Ack=14549 Win=6155 Len=0 TSval=8052291 TSecr=14983790
   78 1.041280018  10.6.15.156 → 192.168.1.12 SSH 1462 Server: Encrypted packet (len=1396)
   79 1.042180166  10.6.15.156 → 192.168.1.12 SSH 1514 Server: Encrypted packet (len=1448)
   80 1.042194197 192.168.1.12 → 10.6.15.156  TCP 66 54766 → 22 [ACK] Seq=1577 Ack=17393 Win=6155 Len=0 TSval=8052295 TSecr=14983793
   81 1.042329339  10.6.15.156 → 192.168.1.12 SSH 1514 Server: Encrypted packet (len=1448)
   82 1.042809232  10.6.15.156 → 192.168.1.12 SSH 1474 Server: Encrypted packet (len=1408)
   83 1.042817493 192.168.1.12 → 10.6.15.156  TCP 66 54766 → 22 [ACK] Seq=1577 Ack=20249 Win=6155 Len=0 TSval=8052295 TSecr=14983794
   84 1.043097100  10.6.15.156 → 192.168.1.12 SSH 1514 Server: Encrypted packet (len=1448)
   85 1.043228514  10.6.15.156 → 192.168.1.12 SSH 1222 Server: Encrypted packet (len=1156)
   86 1.043235200 192.168.1.12 → 10.6.15.156  TCP 66 54766 → 22 [ACK] Seq=1577 Ack=22853 Win=6155 Len=0 TSval=8052295 TSecr=14983794
   87 1.043490154 192.168.1.12 → 10.6.15.156  SSH 102 Client: Encrypted packet (len=36)
   88 1.045170391  10.6.15.156 → 192.168.1.12 SSH 1514 Server: Encrypted packet (len=1448)
   89 1.045347451  10.6.15.156 → 192.168.1.12 SSH 1514 Server: Encrypted packet (len=1448)
   90 1.045354050 192.168.1.12 → 10.6.15.156  TCP 66 54766 → 22 [ACK] Seq=1613 Ack=25749 Win=6155 Len=0 TSval=8052296 TSecr=14983794
   91 1.045504597  10.6.15.156 → 192.168.1.12 SSH 1514 Server: Encrypted packet (len=1448)
   92 1.045681062  10.6.15.156 → 192.168.1.12 SSH 1514 Server: Encrypted packet (len=1448)
   93 1.045686884 192.168.1.12 → 10.6.15.156  TCP 66 54766 → 22 [ACK] Seq=1613 Ack=28645 Win=6155 Len=0 TSval=8052296 TSecr=14983794
   94 1.047065290  10.6.15.156 → 192.168.1.12 SSH 1514 Server: Encrypted packet (len=1448)
   95 1.047185276  10.6.15.156 → 192.168.1.12 SSH 1138 Server: Encrypted packet (len=1072)
   96 1.047191485 192.168.1.12 → 10.6.15.156  TCP 66 54766 → 22 [ACK] Seq=1613 Ack=31165 Win=6155 Len=0 TSval=8052296 TSecr=14983795
   97 1.048558802  10.6.15.156 → 192.168.1.12 SSH 1514 Server: Encrypted packet (len=1448)
   98 1.048724999  10.6.15.156 → 192.168.1.12 SSH 1514 Server: Encrypted packet (len=1448)
   99 1.048731841 192.168.1.12 → 10.6.15.156  TCP 66 54766 → 22 [ACK] Seq=1613 Ack=34061 Win=6155 Len=0 TSval=8052296 TSecr=14983795
  100 1.048897471  10.6.15.156 → 192.168.1.12 SSH 1514 Server: Encrypted packet (len=1448)
  101 1.049060664  10.6.15.156 → 192.168.1.12 SSH 1514 Server: Encrypted packet (len=1448)
  102 1.049063009 192.168.1.12 → 10.6.15.156  TCP 66 54766 → 22 [ACK] Seq=1613 Ack=36957 Win=6155 Len=0 TSval=8052296 TSecr=14983795
  103 1.049395819  10.6.15.156 → 192.168.1.12 SSH 1514 Server: Encrypted packet (len=1448)
  104 1.049559037  10.6.15.156 → 192.168.1.12 SSH 1514 Server: Encrypted packet (len=1448)
  105 1.049563881 192.168.1.12 → 10.6.15.156  TCP 66 54766 → 22 [ACK] Seq=1613 Ack=39853 Win=6155 Len=0 TSval=8052297 TSecr=14983795
  106 1.049735135  10.6.15.156 → 192.168.1.12 SSH 1514 Server: Encrypted packet (len=1448)
  107 1.049905266  10.6.15.156 → 192.168.1.12 SSH 1514 Server: Encrypted packet (len=1448)
  108 1.049910062 192.168.1.12 → 10.6.15.156  TCP 66 54766 → 22 [ACK] Seq=1613 Ack=42749 Win=6155 Len=0 TSval=8052297 TSecr=14983795
  109 1.050076903  10.6.15.156 → 192.168.1.12 SSH 1514 Server: Encrypted packet (len=1448)
  110 1.050251024  10.6.15.156 → 192.168.1.12 SSH 1514 Server: Encrypted packet (len=1448)
  111 1.050255009 192.168.1.12 → 10.6.15.156  TCP 66 54766 → 22 [ACK] Seq=1613 Ack=45645 Win=6155 Len=0 TSval=8052297 TSecr=14983795
  112 1.053563131  10.6.15.156 → 192.168.1.12 SSH 1514 Server: Encrypted packet (len=1448)
  113 1.053725686  10.6.15.156 → 192.168.1.12 SSH 1514 Server: Encrypted packet (len=1448)
  114 1.053734962 192.168.1.12 → 10.6.15.156  TCP 66 54766 → 22 [ACK] Seq=1613 Ack=48541 Win=6155 Len=0 TSval=8052298 TSecr=14983796
  115 1.054053744  10.6.15.156 → 192.168.1.12 SSH 1514 Server: Encrypted packet (len=1448)
  116 1.054224344  10.6.15.156 → 192.168.1.12 SSH 1514 Server: Encrypted packet (len=1448)
  117 1.054231136 192.168.1.12 → 10.6.15.156  TCP 66 54766 → 22 [ACK] Seq=1613 Ack=51437 Win=6155 Len=0 TSval=8052298 TSecr=14983796
  118 1.054396451  10.6.15.156 → 192.168.1.12 SSH 1514 Server: Encrypted packet (len=1448)
  119 1.054581623  10.6.15.156 → 192.168.1.12 SSH 1514 Server: Encrypted packet (len=1448)
  120 1.054585261 192.168.1.12 → 10.6.15.156  TCP 66 54766 → 22 [ACK] Seq=1613 Ack=54333 Win=6155 Len=0 TSval=8052298 TSecr=14983796
  121 1.054753361  10.6.15.156 → 192.168.1.12 SSH 1514 Server: Encrypted packet (len=1448)
  122 1.055072155  10.6.15.156 → 192.168.1.12 SSH 1514 Server: Encrypted packet (len=1448)
  123 1.055079537 192.168.1.12 → 10.6.15.156  TCP 66 54766 → 22 [ACK] Seq=1613 Ack=57229 Win=6155 Len=0 TSval=8052298 TSecr=14983796
  124 1.055240408  10.6.15.156 → 192.168.1.12 SSH 1514 Server: Encrypted packet (len=1448)
  125 1.055411835  10.6.15.156 → 192.168.1.12 SSH 1514 Server: Encrypted packet (len=1448)
  126 1.055418113 192.168.1.12 → 10.6.15.156  TCP 66 54766 → 22 [ACK] Seq=1613 Ack=60125 Win=6155 Len=0 TSval=8052298 TSecr=14983796
  127 1.055585772  10.6.15.156 → 192.168.1.12 SSH 1514 Server: Encrypted packet (len=1448)
  128 1.055755626  10.6.15.156 → 192.168.1.12 SSH 1514 Server: Encrypted packet (len=1448)
  129 1.055760896 192.168.1.12 → 10.6.15.156  TCP 66 54766 → 22 [ACK] Seq=1613 Ack=63021 Win=6155 Len=0 TSval=8052298 TSecr=14983796
  130 1.055931870  10.6.15.156 → 192.168.1.12 SSH 1514 Server: Encrypted packet (len=1448)
  131 1.056105528  10.6.15.156 → 192.168.1.12 SSH 1514 Server: Encrypted packet (len=1448)
  132 1.056113460 192.168.1.12 → 10.6.15.156  TCP 66 54766 → 22 [ACK] Seq=1613 Ack=65917 Win=6155 Len=0 TSval=8052298 TSecr=14983796
  133 1.056277571  10.6.15.156 → 192.168.1.12 SSH 1514 Server: Encrypted packet (len=1448)
  134 1.057546937  10.6.15.156 → 192.168.1.12 SSH 1514 Server: Encrypted packet (len=1448)
  135 1.057560061 192.168.1.12 → 10.6.15.156  TCP 66 54766 → 22 [ACK] Seq=1613 Ack=68813 Win=6155 Len=0 TSval=8052299 TSecr=14983796
  136 1.057717991  10.6.15.156 → 192.168.1.12 SSH 1514 Server: Encrypted packet (len=1448)
  137 1.057886095  10.6.15.156 → 192.168.1.12 SSH 1514 Server: Encrypted packet (len=1448)
  138 1.057892716 192.168.1.12 → 10.6.15.156  TCP 66 54766 → 22 [ACK] Seq=1613 Ack=71709 Win=6155 Len=0 TSval=8052299 TSecr=14983796
  139 1.058064819  10.6.15.156 → 192.168.1.12 SSH 1514 Server: Encrypted packet (len=1448)
  140 1.058232556  10.6.15.156 → 192.168.1.12 SSH 1514 Server: Encrypted packet (len=1448)
  141 1.058239212 192.168.1.12 → 10.6.15.156  TCP 66 54766 → 22 [ACK] Seq=1613 Ack=74605 Win=6155 Len=0 TSval=8052299 TSecr=14983796
  142 1.058404609  10.6.15.156 → 192.168.1.12 SSH 1514 Server: Encrypted packet (len=1448)
  143 1.058575644  10.6.15.156 → 192.168.1.12 SSH 1514 Server: Encrypted packet (len=1448)
  144 1.058582131 192.168.1.12 → 10.6.15.156  TCP 66 54766 → 22 [ACK] Seq=1613 Ack=77501 Win=6155 Len=0 TSval=8052299 TSecr=14983796
  145 1.058751415  10.6.15.156 → 192.168.1.12 SSH 1514 Server: Encrypted packet (len=1448)
  146 1.058808486  10.6.15.156 → 192.168.1.12 SSH 682 Server: Encrypted packet (len=616)
  147 1.058814359 192.168.1.12 → 10.6.15.156  TCP 66 54766 → 22 [ACK] Seq=1613 Ack=79565 Win=6155 Len=0 TSval=8052299 TSecr=14983796
  148 1.058968628  10.6.15.156 → 192.168.1.12 SSH 158 Server: Encrypted packet (len=92)
  149 1.059147294 192.168.1.12 → 10.6.15.156  SSH 150 Client: Encrypted packet (len=84)
  150 1.074205677  10.6.15.156 → 192.168.1.12 SSH 382 Server: Encrypted packet (len=316)
  151 1.082900580  10.6.15.156 → 192.168.1.12 SSH 254 Server: Encrypted packet (len=188)
  152 1.082964113 192.168.1.12 → 10.6.15.156  TCP 66 54766 → 22 [ACK] Seq=1697 Ack=80161 Win=6155 Len=0 TSval=8052305 TSecr=14983802
  153 1.083170950 192.168.1.12 → 10.6.15.156  SSH 142 Client: Encrypted packet (len=76)
  154 1.121300649  10.6.15.156 → 192.168.1.12 TCP 66 22 → 54766 [ACK] Seq=80161 Ack=1773 Win=1452 Len=0 TSval=14983814 TSecr=8052305
  155 1.121327998 192.168.1.12 → 10.6.15.156  SSH 470 Client: Encrypted packet (len=404)
  156 1.138913884  10.6.15.156 → 192.168.1.12 TCP 66 22 → 54766 [ACK] Seq=80161 Ack=2177 Win=1452 Len=0 TSval=14983814 TSecr=8052315
  157 1.143934539 192.168.1.12 → 10.6.15.156  SSH 174 Client: Encrypted packet (len=108)
  158 1.146193705  10.6.15.156 → 192.168.1.12 TCP 66 22 → 54766 [ACK] Seq=80161 Ack=2285 Win=1452 Len=0 TSval=14983820 TSecr=8052320
  159 1.147885721 192.168.1.12 → 10.6.15.156  SSH 158 Client: Encrypted packet (len=92)
  160 1.148118573 192.168.1.12 → 10.6.15.156  SSH 166 Client: Encrypted packet (len=100)
  161 1.149942369  10.6.15.156 → 192.168.1.12 TCP 66 22 → 54766 [ACK] Seq=80161 Ack=2477 Win=1452 Len=0 TSval=14983821 TSecr=8052321
  162 1.226869297  10.6.15.156 → 192.168.1.12 SSH 358 Server: Encrypted packet (len=292)
  163 1.239276342 192.168.1.12 → 10.6.15.156  SSH 678 Client: Encrypted packet (len=612)
  164 1.241434074  10.6.15.156 → 192.168.1.12 TCP 66 22 → 54766 [ACK] Seq=80453 Ack=3089 Win=1452 Len=0 TSval=14983844 TSecr=8052344
  165 1.241448479 192.168.1.12 → 10.6.15.156  SSH 302 Client: Encrypted packet (len=236)
  166 1.243564260  10.6.15.156 → 192.168.1.12 TCP 66 22 → 54766 [ACK] Seq=80453 Ack=3325 Win=1452 Len=0 TSval=14983844 TSecr=8052345
  167 1.290596472 192.168.1.12 → 10.6.15.156  SSH 158 Client: Encrypted packet (len=92)
  168 1.290825067 192.168.1.12 → 10.6.15.156  SSH 234 Client: Encrypted packet (len=168)
  169 1.293497583  10.6.15.156 → 192.168.1.12 TCP 66 22 → 54766 [ACK] Seq=80453 Ack=3585 Win=1452 Len=0 TSval=14983856 TSecr=8052357
  170 1.420102755 192.168.1.12 → 10.6.15.156  SSH 1514 Client: Encrypted packet (len=1448)
  171 1.421879249 192.168.1.12 → 10.6.15.156  SSH 806 Client: Encrypted packet (len=740)
  172 1.424078136  10.6.15.156 → 192.168.1.12 TCP 66 22 → 54766 [ACK] Seq=80453 Ack=5773 Win=1452 Len=0 TSval=14983889 TSecr=8052389
  173 1.426428628  10.6.15.156 → 192.168.1.12 SSH 142 Server: Encrypted packet (len=76)
  174 1.469241113 192.168.1.12 → 10.6.15.156  TCP 66 54766 → 22 [ACK] Seq=5773 Ack=80529 Win=6155 Len=0 TSval=8052402 TSecr=14983890
  175 1.509631871  10.6.15.156 → 192.168.1.12 SSH 166 Server: Encrypted packet (len=100)
  176 1.509659671  10.6.15.156 → 192.168.1.12 SSH 294 Server: Encrypted packet (len=228)
  177 1.509699192 192.168.1.12 → 10.6.15.156  TCP 66 54766 → 22 [ACK] Seq=5773 Ack=80857 Win=6155 Len=0 TSval=8052412 TSecr=14983910
  178 1.529683775  10.6.15.156 → 192.168.1.12 SSH 294 Server: Encrypted packet (len=228)
  179 1.529749081 192.168.1.12 → 10.6.15.156  TCP 66 54766 → 22 [ACK] Seq=5773 Ack=81085 Win=6155 Len=0 TSval=8052417 TSecr=14983916
  180 1.530965741  10.6.15.156 → 192.168.1.12 SSH 1514 Server: Encrypted packet (len=1448)
  181 1.531082080  10.6.15.156 → 192.168.1.12 SSH 1166 Server: Encrypted packet (len=1100)
  182 1.531089868 192.168.1.12 → 10.6.15.156  TCP 66 54766 → 22 [ACK] Seq=5773 Ack=83633 Win=6155 Len=0 TSval=8052417 TSecr=14983916
  183 1.532012385  10.6.15.156 → 192.168.1.12 SSH 1514 Server: Encrypted packet (len=1448)
  184 1.532219718  10.6.15.156 → 192.168.1.12 SSH 1514 Server: Encrypted packet (len=1448)
  185 1.532226614 192.168.1.12 → 10.6.15.156  TCP 66 54766 → 22 [ACK] Seq=5773 Ack=86529 Win=6155 Len=0 TSval=8052417 TSecr=14983916
  186 1.532543190  10.6.15.156 → 192.168.1.12 SSH 1514 Server: Encrypted packet (len=1448)
  187 1.532706621  10.6.15.156 → 192.168.1.12 SSH 1514 Server: Encrypted packet (len=1448)
  188 1.532711440 192.168.1.12 → 10.6.15.156  TCP 66 54766 → 22 [ACK] Seq=5773 Ack=89425 Win=6155 Len=0 TSval=8052417 TSecr=14983916
  189 1.532778604  10.6.15.156 → 192.168.1.12 SSH 718 Server: Encrypted packet (len=652)
  190 1.532833323 192.168.1.12 → 10.6.15.156  TCP 66 54766 → 22 [ACK] Seq=5773 Ack=90077 Win=6155 Len=0 TSval=8052417 TSecr=14983916
  191 1.532940492  10.6.15.156 → 192.168.1.12 SSH 1514 Server: Encrypted packet (len=1448)
  192 1.533170680  10.6.15.156 → 192.168.1.12 SSH 862 Server: Encrypted packet (len=796)
  193 1.533182814 192.168.1.12 → 10.6.15.156  TCP 66 54766 → 22 [ACK] Seq=5773 Ack=92321 Win=6155 Len=0 TSval=8052418 TSecr=14983916
  194 1.534294034  10.6.15.156 → 192.168.1.12 SSH 150 Server: Encrypted packet (len=84)
  195 1.534351489 192.168.1.12 → 10.6.15.156  TCP 66 54766 → 22 [ACK] Seq=5773 Ack=92405 Win=6155 Len=0 TSval=8052418 TSecr=14983917
  196 1.535472958 192.168.1.12 → 10.6.15.156  SSH 150 Client: Encrypted packet (len=84)
  197 1.536668609  10.6.15.156 → 192.168.1.12 SSH 1514 Server: Encrypted packet (len=1448)
  198 1.536797570  10.6.15.156 → 192.168.1.12 SSH 1262 Server: Encrypted packet (len=1196)
  199 1.536804786 192.168.1.12 → 10.6.15.156  TCP 66 54766 → 22 [ACK] Seq=5857 Ack=95049 Win=6155 Len=0 TSval=8052418 TSecr=14983917
  200 1.538572916  10.6.15.156 → 192.168.1.12 SSH 1514 Server: Encrypted packet (len=1448)
  201 1.538741662  10.6.15.156 → 192.168.1.12 SSH 1514 Server: Encrypted packet (len=1448)
  202 1.538747294 192.168.1.12 → 10.6.15.156  TCP 66 54766 → 22 [ACK] Seq=5857 Ack=97945 Win=6155 Len=0 TSval=8052419 TSecr=14983918
  203 1.542206946  10.6.15.156 → 192.168.1.12 SSH 1514 Server: Encrypted packet (len=1448)
  204 1.542329723  10.6.15.156 → 192.168.1.12 SSH 1118 Server: Encrypted packet (len=1052)
  205 1.542333853 192.168.1.12 → 10.6.15.156  TCP 66 54766 → 22 [ACK] Seq=5857 Ack=100445 Win=6155 Len=0 TSval=8052420 TSecr=14983918
  206 1.542500275  10.6.15.156 → 192.168.1.12 SSH 1514 Server: Encrypted packet (len=1448)
  207 1.542676356  10.6.15.156 → 192.168.1.12 SSH 1514 Server: Encrypted packet (len=1448)
  208 1.542683171 192.168.1.12 → 10.6.15.156  TCP 66 54766 → 22 [ACK] Seq=5857 Ack=103341 Win=6155 Len=0 TSval=8052420 TSecr=14983918
  209 1.542845958  10.6.15.156 → 192.168.1.12 SSH 1514 Server: Encrypted packet (len=1448)
  210 1.543018702  10.6.15.156 → 192.168.1.12 SSH 1514 Server: Encrypted packet (len=1448)
  211 1.543022658 192.168.1.12 → 10.6.15.156  TCP 66 54766 → 22 [ACK] Seq=5857 Ack=106237 Win=6155 Len=0 TSval=8052420 TSecr=14983918
  212 1.543192000  10.6.15.156 → 192.168.1.12 SSH 1514 Server: Encrypted packet (len=1448)
  213 1.543240812  10.6.15.156 → 192.168.1.12 SSH 622 Server: Encrypted packet (len=556)
  214 1.543243693 192.168.1.12 → 10.6.15.156  TCP 66 54766 → 22 [ACK] Seq=5857 Ack=108241 Win=6155 Len=0 TSval=8052420 TSecr=14983918
  215 1.543438848  10.6.15.156 → 192.168.1.12 SSH 1514 Server: Encrypted packet (len=1448)
  216 1.543763460  10.6.15.156 → 192.168.1.12 SSH 1514 Server: Encrypted packet (len=1448)
  217 1.543771429 192.168.1.12 → 10.6.15.156  TCP 66 54766 → 22 [ACK] Seq=5857 Ack=111137 Win=6155 Len=0 TSval=8052420 TSecr=14983919
  218 1.543935557  10.6.15.156 → 192.168.1.12 SSH 1514 Server: Encrypted packet (len=1448)
  219 1.544107683  10.6.15.156 → 192.168.1.12 SSH 1514 Server: Encrypted packet (len=1448)
  220 1.544115037 192.168.1.12 → 10.6.15.156  TCP 66 54766 → 22 [ACK] Seq=5857 Ack=114033 Win=6155 Len=0 TSval=8052420 TSecr=14983919
  221 1.544282926  10.6.15.156 → 192.168.1.12 SSH 1514 Server: Encrypted packet (len=1448)
  222 1.544454199  10.6.15.156 → 192.168.1.12 SSH 1514 Server: Encrypted packet (len=1448)
  223 1.544461556 192.168.1.12 → 10.6.15.156  TCP 66 54766 → 22 [ACK] Seq=5857 Ack=116929 Win=6155 Len=0 TSval=8052420 TSecr=14983919
  224 1.544501564  10.6.15.156 → 192.168.1.12 SSH 610 Server: Encrypted packet (len=544)
  225 1.544700532  10.6.15.156 → 192.168.1.12 SSH 1514 Server: Encrypted packet (len=1448)
  226 1.544706958 192.168.1.12 → 10.6.15.156  TCP 66 54766 → 22 [ACK] Seq=5857 Ack=118921 Win=6155 Len=0 TSval=8052420 TSecr=14983919
  227 1.544872001  10.6.15.156 → 192.168.1.12 SSH 1514 Server: Encrypted packet (len=1448)
  228 1.545047530  10.6.15.156 → 192.168.1.12 SSH 1514 Server: Encrypted packet (len=1448)
  229 1.545054373 192.168.1.12 → 10.6.15.156  TCP 66 54766 → 22 [ACK] Seq=5857 Ack=121817 Win=6155 Len=0 TSval=8052420 TSecr=14983919
  230 1.546486596  10.6.15.156 → 192.168.1.12 SSH 1514 Server: Encrypted packet (len=1448)
  231 1.546653338  10.6.15.156 → 192.168.1.12 SSH 1514 Server: Encrypted packet (len=1448)
  232 1.546664096 192.168.1.12 → 10.6.15.156  TCP 66 54766 → 22 [ACK] Seq=5857 Ack=124713 Win=6155 Len=0 TSval=8052421 TSecr=14983919
  233 1.546825755  10.6.15.156 → 192.168.1.12 SSH 1514 Server: Encrypted packet (len=1448)
  234 1.546971591  10.6.15.156 → 192.168.1.12 SSH 1330 Server: Encrypted packet (len=1264)
  235 1.546978484 192.168.1.12 → 10.6.15.156  TCP 66 54766 → 22 [ACK] Seq=5857 Ack=127425 Win=6155 Len=0 TSval=8052421 TSecr=14983919
  236 1.548899585 192.168.1.12 → 10.6.15.156  SSH 150 Client: Encrypted packet (len=84)
  237 1.548993827  10.6.15.156 → 192.168.1.12 SSH 934 Server: Encrypted packet (len=868)
  238 1.549952613  10.6.15.156 → 192.168.1.12 SSH 566 Server: Encrypted packet (len=500)
  239 1.549996162 192.168.1.12 → 10.6.15.156  TCP 66 54766 → 22 [ACK] Seq=5941 Ack=128793 Win=6155 Len=0 TSval=8052422 TSecr=14983920
  240 1.550383243 192.168.1.12 → 10.6.15.156  SSH 142 Client: Encrypted packet (len=76)
  241 1.552430199  10.6.15.156 → 192.168.1.12 TCP 66 22 → 54766 [ACK] Seq=128793 Ack=6017 Win=1452 Len=0 TSval=14983921 TSecr=8052421
  242 1.620548657  10.6.15.156 → 192.168.1.12 SSH 302 Server: Encrypted packet (len=236)
  243 1.620574415  10.6.15.156 → 192.168.1.12 SSH 102 Server: Encrypted packet (len=36)
  244 1.620629469 192.168.1.12 → 10.6.15.156  TCP 66 54766 → 22 [ACK] Seq=6017 Ack=129065 Win=6155 Len=0 TSval=8052439 TSecr=14983938
  245 1.621985445 192.168.1.12 → 10.6.15.156  SSH 138 Client: Encrypted packet (len=72)
  246 1.623636700  10.6.15.156 → 192.168.1.12 SSH 102 Server: Encrypted packet (len=36)
  247 1.665191457 192.168.1.12 → 10.6.15.156  TCP 66 54766 → 22 [ACK] Seq=6089 Ack=129101 Win=6155 Len=0 TSval=8052451 TSecr=14983939
  248 1.669463422  10.6.15.156 → 192.168.1.12 SSH 358 Server: Encrypted packet (len=292)
  249 1.669544341 192.168.1.12 → 10.6.15.156  TCP 66 54766 → 22 [ACK] Seq=6089 Ack=129393 Win=6155 Len=0 TSval=8052452 TSecr=14983951
  250 1.672349514  10.6.15.156 → 192.168.1.12 SSH 1514 Server: Encrypted packet (len=1448)
  251 1.672431408  10.6.15.156 → 192.168.1.12 SSH 1214 Server: Encrypted packet (len=1148)
  252 1.672440457 192.168.1.12 → 10.6.15.156  TCP 66 54766 → 22 [ACK] Seq=6089 Ack=131989 Win=6155 Len=0 TSval=8052452 TSecr=14983951
  253 1.674589045  10.6.15.156 → 192.168.1.12 SSH 1514 Server: Encrypted packet (len=1448)
  254 1.674758036  10.6.15.156 → 192.168.1.12 SSH 1514 Server: Encrypted packet (len=1448)
  255 1.674767468 192.168.1.12 → 10.6.15.156  TCP 66 54766 → 22 [ACK] Seq=6089 Ack=134885 Win=6155 Len=0 TSval=8052453 TSecr=14983952
  256 1.674923337  10.6.15.156 → 192.168.1.12 SSH 1514 Server: Encrypted packet (len=1448)
  257 1.675089293  10.6.15.156 → 192.168.1.12 SSH 1514 Server: Encrypted packet (len=1448)
  258 1.675096671 192.168.1.12 → 10.6.15.156  TCP 66 54766 → 22 [ACK] Seq=6089 Ack=137781 Win=6155 Len=0 TSval=8052453 TSecr=14983952
  259 1.675262398  10.6.15.156 → 192.168.1.12 SSH 1514 Server: Encrypted packet (len=1448)
  260 1.675411580  10.6.15.156 → 192.168.1.12 SSH 1366 Server: Encrypted packet (len=1300)
  261 1.675415928 192.168.1.12 → 10.6.15.156  TCP 66 54766 → 22 [ACK] Seq=6089 Ack=140529 Win=6155 Len=0 TSval=8052453 TSecr=14983952
  262 1.676953711  10.6.15.156 → 192.168.1.12 SSH 1514 Server: Encrypted packet (len=1448)
  263 1.677112780  10.6.15.156 → 192.168.1.12 SSH 1514 Server: Encrypted packet (len=1448)
  264 1.677117632 192.168.1.12 → 10.6.15.156  TCP 66 54766 → 22 [ACK] Seq=6089 Ack=143425 Win=6155 Len=0 TSval=8052453 TSecr=14983952
  265 1.677308873  10.6.15.156 → 192.168.1.12 SSH 1514 Server: Encrypted packet (len=1448)
  266 1.677487027  10.6.15.156 → 192.168.1.12 SSH 1514 Server: Encrypted packet (len=1448)
  267 1.677490548 192.168.1.12 → 10.6.15.156  TCP 66 54766 → 22 [ACK] Seq=6089 Ack=146321 Win=6155 Len=0 TSval=8052454 TSecr=14983952
  268 1.677664818  10.6.15.156 → 192.168.1.12 SSH 1514 Server: Encrypted packet (len=1448)
  269 1.677982831  10.6.15.156 → 192.168.1.12 SSH 1514 Server: Encrypted packet (len=1448)
  270 1.677987721 192.168.1.12 → 10.6.15.156  TCP 66 54766 → 22 [ACK] Seq=6089 Ack=149217 Win=6155 Len=0 TSval=8052454 TSecr=14983952
  271 1.678157632  10.6.15.156 → 192.168.1.12 SSH 1514 Server: Encrypted packet (len=1448)
  272 1.678302036  10.6.15.156 → 192.168.1.12 SSH 1514 Server: Encrypted packet (len=1448)
  273 1.678306908 192.168.1.12 → 10.6.15.156  TCP 66 54766 → 22 [ACK] Seq=6089 Ack=152113 Win=6155 Len=0 TSval=8052454 TSecr=14983952
  274 1.678472826  10.6.15.156 → 192.168.1.12 SSH 1514 Server: Encrypted packet (len=1448)
  275 1.678646658  10.6.15.156 → 192.168.1.12 SSH 1514 Server: Encrypted packet (len=1448)
  276 1.678650719 192.168.1.12 → 10.6.15.156  TCP 66 54766 → 22 [ACK] Seq=6089 Ack=155009 Win=6155 Len=0 TSval=8052454 TSecr=14983952
  277 1.678853127  10.6.15.156 → 192.168.1.12 SSH 1514 Server: Encrypted packet (len=1448)
  278 1.679018151  10.6.15.156 → 192.168.1.12 SSH 398 Server: Encrypted packet (len=332)
  279 1.679023575 192.168.1.12 → 10.6.15.156  TCP 66 54766 → 22 [ACK] Seq=6089 Ack=156789 Win=6155 Len=0 TSval=8052454 TSecr=14983952
  280 1.679190966  10.6.15.156 → 192.168.1.12 SSH 1514 Server: Encrypted packet (len=1448)
  281 1.679369021  10.6.15.156 → 192.168.1.12 SSH 1514 Server: Encrypted packet (len=1448)
  282 1.679375011 192.168.1.12 → 10.6.15.156  TCP 66 54766 → 22 [ACK] Seq=6089 Ack=159685 Win=6155 Len=0 TSval=8052454 TSecr=14983953
  283 1.679567916  10.6.15.156 → 192.168.1.12 SSH 1514 Server: Encrypted packet (len=1448)
  284 1.679735090  10.6.15.156 → 192.168.1.12 SSH 1514 Server: Encrypted packet (len=1448)
  285 1.679739107 192.168.1.12 → 10.6.15.156  TCP 66 54766 → 22 [ACK] Seq=6089 Ack=162581 Win=6155 Len=0 TSval=8052454 TSecr=14983953
  286 1.680980361  10.6.15.156 → 192.168.1.12 SSH 1514 Server: Encrypted packet (len=1448)
  287 1.681123013  10.6.15.156 → 192.168.1.12 SSH 1514 Server: Encrypted packet (len=1448)
  288 1.681125327 192.168.1.12 → 10.6.15.156  TCP 66 54766 → 22 [ACK] Seq=6089 Ack=165477 Win=6155 Len=0 TSval=8052454 TSecr=14983953
  289 1.681326121  10.6.15.156 → 192.168.1.12 SSH 1514 Server: Encrypted packet (len=1448)
  290 1.681495201  10.6.15.156 → 192.168.1.12 SSH 1514 Server: Encrypted packet (len=1448)
  291 1.681497983 192.168.1.12 → 10.6.15.156  TCP 66 54766 → 22 [ACK] Seq=6089 Ack=168373 Win=6155 Len=0 TSval=8052455 TSecr=14983953
  292 1.681666497  10.6.15.156 → 192.168.1.12 SSH 1514 Server: Encrypted packet (len=1448)
  293 1.681817193  10.6.15.156 → 192.168.1.12 SSH 1514 Server: Encrypted packet (len=1448)
  294 1.681819196 192.168.1.12 → 10.6.15.156  TCP 66 54766 → 22 [ACK] Seq=6089 Ack=171269 Win=6155 Len=0 TSval=8052455 TSecr=14983953
  295 1.682017157  10.6.15.156 → 192.168.1.12 SSH 1514 Server: Encrypted packet (len=1448)
  296 1.682022203  10.6.15.156 → 192.168.1.12 SSH 182 Server: Encrypted packet (len=116)
  297 1.682025630 192.168.1.12 → 10.6.15.156  TCP 66 54766 → 22 [ACK] Seq=6089 Ack=172833 Win=6155 Len=0 TSval=8052455 TSecr=14983953
  298 1.683977139  10.6.15.156 → 192.168.1.12 SSH 1514 Server: Encrypted packet (len=1448)
  299 1.684143711  10.6.15.156 → 192.168.1.12 SSH 1514 Server: Encrypted packet (len=1448)
  300 1.684147579 192.168.1.12 → 10.6.15.156  TCP 66 54766 → 22 [ACK] Seq=6089 Ack=175729 Win=6155 Len=0 TSval=8052455 TSecr=14983954
  301 1.684453926  10.6.15.156 → 192.168.1.12 SSH 1514 Server: Encrypted packet (len=1448)
  302 1.684626804  10.6.15.156 → 192.168.1.12 SSH 1514 Server: Encrypted packet (len=1448)
  303 1.684630179 192.168.1.12 → 10.6.15.156  TCP 66 54766 → 22 [ACK] Seq=6089 Ack=178625 Win=6155 Len=0 TSval=8052455 TSecr=14983954
  304 1.684801404  10.6.15.156 → 192.168.1.12 SSH 1514 Server: Encrypted packet (len=1448)
  305 1.684968271  10.6.15.156 → 192.168.1.12 SSH 1514 Server: Encrypted packet (len=1448)
  306 1.684976196 192.168.1.12 → 10.6.15.156  TCP 66 54766 → 22 [ACK] Seq=6089 Ack=181521 Win=6155 Len=0 TSval=8052455 TSecr=14983954
  307 1.685138388  10.6.15.156 → 192.168.1.12 SSH 1514 Server: Encrypted packet (len=1448)
  308 1.685463695  10.6.15.156 → 192.168.1.12 SSH 1514 Server: Encrypted packet (len=1448)
  309 1.685469953 192.168.1.12 → 10.6.15.156  TCP 66 54766 → 22 [ACK] Seq=6089 Ack=184417 Win=6155 Len=0 TSval=8052456 TSecr=14983954
  310 1.685634999  10.6.15.156 → 192.168.1.12 SSH 1514 Server: Encrypted packet (len=1448)
  311 1.685807708  10.6.15.156 → 192.168.1.12 SSH 1514 Server: Encrypted packet (len=1448)
  312 1.685812755 192.168.1.12 → 10.6.15.156  TCP 66 54766 → 22 [ACK] Seq=6089 Ack=187313 Win=6155 Len=0 TSval=8052456 TSecr=14983954
  313 1.685981942  10.6.15.156 → 192.168.1.12 SSH 1514 Server: Encrypted packet (len=1448)
  314 1.686154593  10.6.15.156 → 192.168.1.12 SSH 1514 Server: Encrypted packet (len=1448)
  315 1.686159727 192.168.1.12 → 10.6.15.156  TCP 66 54766 → 22 [ACK] Seq=6089 Ack=190209 Win=6155 Len=0 TSval=8052456 TSecr=14983954
  316 1.686328096  10.6.15.156 → 192.168.1.12 SSH 1514 Server: Encrypted packet (len=1448)
  317 1.686501496  10.6.15.156 → 192.168.1.12 SSH 1514 Server: Encrypted packet (len=1448)
  318 1.686509124 192.168.1.12 → 10.6.15.156  TCP 66 54766 → 22 [ACK] Seq=6089 Ack=193105 Win=6155 Len=0 TSval=8052456 TSecr=14983955
  319 1.686826021  10.6.15.156 → 192.168.1.12 SSH 1514 Server: Encrypted packet (len=1448)
  320 1.686997623  10.6.15.156 → 192.168.1.12 SSH 1514 Server: Encrypted packet (len=1448)
  321 1.687003743 192.168.1.12 → 10.6.15.156  TCP 66 54766 → 22 [ACK] Seq=6089 Ack=196001 Win=6155 Len=0 TSval=8052456 TSecr=14983955
  322 1.687169104  10.6.15.156 → 192.168.1.12 SSH 1514 Server: Encrypted packet (len=1448)
  323 1.687342977  10.6.15.156 → 192.168.1.12 SSH 1514 Server: Encrypted packet (len=1448)
  324 1.687348632 192.168.1.12 → 10.6.15.156  TCP 66 54766 → 22 [ACK] Seq=6089 Ack=198897 Win=6155 Len=0 TSval=8052456 TSecr=14983955
  325 1.687515266  10.6.15.156 → 192.168.1.12 SSH 1514 Server: Encrypted packet (len=1448)
  326 1.687687906  10.6.15.156 → 192.168.1.12 SSH 1514 Server: Encrypted packet (len=1448)
  327 1.687695002 192.168.1.12 → 10.6.15.156  TCP 66 54766 → 22 [ACK] Seq=6089 Ack=201793 Win=6155 Len=0 TSval=8052456 TSecr=14983955
  328 1.687861825  10.6.15.156 → 192.168.1.12 SSH 1514 Server: Encrypted packet (len=1448)
  329 1.687948117  10.6.15.156 → 192.168.1.12 SSH 762 Server: Encrypted packet (len=696)
  330 1.687954202 192.168.1.12 → 10.6.15.156  TCP 66 54766 → 22 [ACK] Seq=6089 Ack=203937 Win=6155 Len=0 TSval=8052456 TSecr=14983955
  331 1.688130489  10.6.15.156 → 192.168.1.12 SSH 1514 Server: Encrypted packet (len=1448)
  332 1.689612696  10.6.15.156 → 192.168.1.12 SSH 1514 Server: Encrypted packet (len=1448)
  333 1.689618123 192.168.1.12 → 10.6.15.156  TCP 66 54766 → 22 [ACK] Seq=6089 Ack=206833 Win=6155 Len=0 TSval=8052457 TSecr=14983955
  334 1.689798514  10.6.15.156 → 192.168.1.12 SSH 1514 Server: Encrypted packet (len=1448)
  335 1.689965464  10.6.15.156 → 192.168.1.12 SSH 1514 Server: Encrypted packet (len=1448)
  336 1.689968210 192.168.1.12 → 10.6.15.156  TCP 66 54766 → 22 [ACK] Seq=6089 Ack=209729 Win=6155 Len=0 TSval=8052457 TSecr=14983955
  337 1.690138284  10.6.15.156 → 192.168.1.12 SSH 1514 Server: Encrypted packet (len=1448)
  338 1.690316533  10.6.15.156 → 192.168.1.12 SSH 1514 Server: Encrypted packet (len=1448)
  339 1.690319192 192.168.1.12 → 10.6.15.156  TCP 66 54766 → 22 [ACK] Seq=6089 Ack=212625 Win=6155 Len=0 TSval=8052457 TSecr=14983955
  340 1.690485095  10.6.15.156 → 192.168.1.12 SSH 1514 Server: Encrypted packet (len=1448)
  341 1.690661611  10.6.15.156 → 192.168.1.12 SSH 1514 Server: Encrypted packet (len=1448)
  342 1.690664432 192.168.1.12 → 10.6.15.156  TCP 66 54766 → 22 [ACK] Seq=6089 Ack=215521 Win=6155 Len=0 TSval=8052457 TSecr=14983955
  343 1.690815037  10.6.15.156 → 192.168.1.12 SSH 1514 Server: Encrypted packet (len=1448)
  344 1.690988067  10.6.15.156 → 192.168.1.12 SSH 1514 Server: Encrypted packet (len=1448)
  345 1.690991438 192.168.1.12 → 10.6.15.156  TCP 66 54766 → 22 [ACK] Seq=6089 Ack=218417 Win=6155 Len=0 TSval=8052457 TSecr=14983955
  346 1.691305456  10.6.15.156 → 192.168.1.12 SSH 1514 Server: Encrypted packet (len=1448)
  347 1.691479620  10.6.15.156 → 192.168.1.12 SSH 1514 Server: Encrypted packet (len=1448)
  348 1.691485977 192.168.1.12 → 10.6.15.156  TCP 66 54766 → 22 [ACK] Seq=6089 Ack=221313 Win=6155 Len=0 TSval=8052457 TSecr=14983955
  349 1.691650818  10.6.15.156 → 192.168.1.12 SSH 1514 Server: Encrypted packet (len=1448)
  350 1.691821748  10.6.15.156 → 192.168.1.12 SSH 1514 Server: Encrypted packet (len=1448)
  351 1.691825900 192.168.1.12 → 10.6.15.156  TCP 66 54766 → 22 [ACK] Seq=6089 Ack=224209 Win=6155 Len=0 TSval=8052457 TSecr=14983956
  352 1.691997756  10.6.15.156 → 192.168.1.12 SSH 1514 Server: Encrypted packet (len=1448)
  353 1.692172469  10.6.15.156 → 192.168.1.12 SSH 1514 Server: Encrypted packet (len=1448)
  354 1.692179923 192.168.1.12 → 10.6.15.156  TCP 66 54766 → 22 [ACK] Seq=6089 Ack=227105 Win=6155 Len=0 TSval=8052457 TSecr=14983956
  355 1.692342421  10.6.15.156 → 192.168.1.12 SSH 1514 Server: Encrypted packet (len=1448)
  356 1.699638735  10.6.15.156 → 192.168.1.12 SSH 1514 Server: Encrypted packet (len=1448)
  357 1.699656699 192.168.1.12 → 10.6.15.156  TCP 66 54766 → 22 [ACK] Seq=6089 Ack=230001 Win=6155 Len=0 TSval=8052459 TSecr=14983956
  358 1.699761666  10.6.15.156 → 192.168.1.12 SSH 1514 Server: Encrypted packet (len=1448)
  359 1.699942403  10.6.15.156 → 192.168.1.12 SSH 1514 Server: Encrypted packet (len=1448)
  360 1.699947759 192.168.1.12 → 10.6.15.156  TCP 66 54766 → 22 [ACK] Seq=6089 Ack=232897 Win=6155 Len=0 TSval=8052459 TSecr=14983956
  361 1.700111196  10.6.15.156 → 192.168.1.12 SSH 1514 Server: Encrypted packet (len=1448)
  362 1.700268922  10.6.15.156 → 192.168.1.12 SSH 1514 Server: Encrypted packet (len=1448)
  363 1.700271854 192.168.1.12 → 10.6.15.156  TCP 66 54766 → 22 [ACK] Seq=6089 Ack=235793 Win=6155 Len=0 TSval=8052459 TSecr=14983956
  364 1.700433731  10.6.15.156 → 192.168.1.12 SSH 1514 Server: Encrypted packet (len=1448)
  365 1.700606972  10.6.15.156 → 192.168.1.12 SSH 1514 Server: Encrypted packet (len=1448)
  366 1.700612972 192.168.1.12 → 10.6.15.156  TCP 66 54766 → 22 [ACK] Seq=6089 Ack=238689 Win=6155 Len=0 TSval=8052459 TSecr=14983956
  367 1.700803523  10.6.15.156 → 192.168.1.12 SSH 1514 Server: Encrypted packet (len=1448)
  368 1.700980279  10.6.15.156 → 192.168.1.12 SSH 1514 Server: Encrypted packet (len=1448)
  369 1.700984114 192.168.1.12 → 10.6.15.156  TCP 66 54766 → 22 [ACK] Seq=6089 Ack=241585 Win=6155 Len=0 TSval=8052459 TSecr=14983956
  370 1.701276091  10.6.15.156 → 192.168.1.12 SSH 1514 Server: Encrypted packet (len=1448)
  371 1.701478412  10.6.15.156 → 192.168.1.12 SSH 1514 Server: Encrypted packet (len=1448)
  372 1.701486365 192.168.1.12 → 10.6.15.156  TCP 66 54766 → 22 [ACK] Seq=6089 Ack=244481 Win=6155 Len=0 TSval=8052460 TSecr=14983956
  373 1.701644589  10.6.15.156 → 192.168.1.12 SSH 1514 Server: Encrypted packet (len=1448)
  374 1.701818118  10.6.15.156 → 192.168.1.12 SSH 1514 Server: Encrypted packet (len=1448)
  375 1.701821155 192.168.1.12 → 10.6.15.156  TCP 66 54766 → 22 [ACK] Seq=6089 Ack=247377 Win=6155 Len=0 TSval=8052460 TSecr=14983956
  376 1.701990600  10.6.15.156 → 192.168.1.12 SSH 1514 Server: Encrypted packet (len=1448)
  377 1.702149553  10.6.15.156 → 192.168.1.12 SSH 1514 Server: Encrypted packet (len=1448)
  378 1.702152382 192.168.1.12 → 10.6.15.156  TCP 66 54766 → 22 [ACK] Seq=6089 Ack=250273 Win=6155 Len=0 TSval=8052460 TSecr=14983956
