    1 0.000000000 192.168.1.16 → 10.6.15.144  SSH 134 Client: Encrypted packet (len=68)
    2 0.001007130 192.168.1.16 → 10.6.15.144  SSH 134 Client: Encrypted packet (len=68)
    3 0.001792297  10.6.15.144 → 192.168.1.16 SSH 134 Server: Encrypted packet (len=68)
    4 0.002209853  10.6.15.144 → 192.168.1.16 SSH 374 Server: Encrypted packet (len=308)
    5 0.002238615 192.168.1.16 → 10.6.15.144  TCP 66 59298 → 22 [ACK] Seq=137 Ack=377 Win=3666 Len=0 TSval=4363100 TSecr=4959233
    6 0.002520270 192.168.1.16 → 10.6.15.144  SSH 134 Client: Encrypted packet (len=68)
    7 0.002693876  10.6.15.144 → 192.168.1.16 SSH 574 Server: Encrypted packet (len=508)
    8 0.003200192  10.6.15.144 → 192.168.1.16 SSH 146 Server: Encrypted packet (len=80)
    9 0.003236687 192.168.1.16 → 10.6.15.144  TCP 66 59298 → 22 [ACK] Seq=205 Ack=965 Win=3666 Len=0 TSval=4363101 TSecr=4959249
   10 0.004063813 192.168.1.16 → 10.6.15.144  SSH 382 Client: Encrypted packet (len=316)
   11 0.010751933  10.6.15.144 → 192.168.1.16 TCP 66 22 → 59298 [ACK] Seq=965 Ack=69 Win=1452 Len=0 TSval=4959446 TSecr=4363100
   12 0.011124866  10.6.15.144 → 192.168.1.16 TCP 66 22 → 59298 [ACK] Seq=965 Ack=137 Win=1452 Len=0 TSval=4959446 TSecr=4363100
   13 0.012607779  10.6.15.144 → 192.168.1.16 TCP 66 22 → 59298 [ACK] Seq=965 Ack=205 Win=1452 Len=0 TSval=4959447 TSecr=4363100
   14 0.014073691  10.6.15.144 → 192.168.1.16 TCP 66 22 → 59298 [ACK] Seq=965 Ack=521 Win=1452 Len=0 TSval=4959447 TSecr=4363101
   15 0.654680791 192.168.1.16 → 54.76.71.168 TCP 66 42414 → 8282 [ACK] Seq=1 Ack=1 Win=296 Len=0 TSval=4363264 TSecr=608463704
   16 0.656437873  10.6.15.144 → 192.168.1.16 SSH 486 Server: Encrypted packet (len=420)
   17 0.658585269 192.168.1.16 → 10.6.15.144  SSH 126 Client: Encrypted packet (len=60)
   18 0.661000870 192.168.1.16 → 10.6.15.144  SSH 110 Client: Encrypted packet (len=44)
   19 0.667790568  10.6.15.144 → 192.168.1.16 TCP 66 22 → 59298 [ACK] Seq=1385 Ack=581 Win=1452 Len=0 TSval=4959611 TSecr=4363264
   20 0.669878819  10.6.15.144 → 192.168.1.16 TCP 66 22 → 59298 [ACK] Seq=1385 Ack=625 Win=1452 Len=0 TSval=4959611 TSecr=4363265
   21 2.416518384 54.76.71.168 → 192.168.1.16 TCP 66 [TCP ACKed unseen segment] 8282 → 42414 [ACK] Seq=1 Ack=2 Win=121 Len=0 TSval=608475240 TSecr=4351728
   22 2.416535155  10.6.15.144 → 192.168.1.16 SSH 102 Server: Encrypted packet (len=36)
   23 2.416545180  10.6.15.144 → 192.168.1.16 SSH 102 Server: Encrypted packet (len=36)
   24 2.416595809 192.168.1.16 → 10.6.15.144  TCP 66 59298 → 22 [ACK] Seq=625 Ack=1457 Win=3666 Len=0 TSval=4363704 TSecr=4959695
   25 2.416715277  10.6.15.144 → 192.168.1.16 SSH 138 Server: Encrypted packet (len=72)
   26 2.416845601 192.168.1.16 → 10.6.15.144  SSH 102 Client: Encrypted packet (len=36)
   27 2.417222323 192.168.1.16 → 10.6.15.144  SSH 570 Client: Encrypted packet (len=504)
   28 2.426816261  10.6.15.144 → 192.168.1.16 TCP 66 22 → 59298 [ACK] Seq=1529 Ack=661 Win=1452 Len=0 TSval=4960050 TSecr=4363704
   29 2.427615634  10.6.15.144 → 192.168.1.16 TCP 66 22 → 59298 [ACK] Seq=1529 Ack=1165 Win=1452 Len=0 TSval=4960050 TSecr=4363704
   30 2.477946241  10.6.15.144 → 192.168.1.16 SSH 238 Server: Encrypted packet (len=172)
   31 2.478208031 192.168.1.16 → 10.6.15.144  SSH 142 Client: Encrypted packet (len=76)
   32 2.487851610  10.6.15.144 → 192.168.1.16 TCP 66 22 → 59298 [ACK] Seq=1701 Ack=1241 Win=1452 Len=0 TSval=4960065 TSecr=4363719
   33 2.520596899  10.6.15.144 → 192.168.1.16 SSH 1514 Server: Encrypted packet (len=1448)
   34 2.520686262  10.6.15.144 → 192.168.1.16 SSH 1302 Server: Encrypted packet (len=1236)
   35 2.520695039 192.168.1.16 → 10.6.15.144  TCP 66 59298 → 22 [ACK] Seq=1241 Ack=4385 Win=3666 Len=0 TSval=4363730 TSecr=4960073
   36 2.521106714  10.6.15.144 → 192.168.1.16 SSH 1514 Server: Encrypted packet (len=1448)
   37 2.531238074  10.6.15.144 → 192.168.1.16 SSH 414 Server: Encrypted packet (len=348)
   38 2.531255354 192.168.1.16 → 10.6.15.144  TCP 66 59298 → 22 [ACK] Seq=1241 Ack=6181 Win=3666 Len=0 TSval=4363733 TSecr=4960074
   39 2.532209371 192.168.1.16 → 10.6.15.144  SSH 174 Client: Encrypted packet (len=108)
   40 2.535093553 192.168.1.16 → 10.6.15.144  SSH 230 Client: Encrypted packet (len=164)
   41 2.535400036 192.168.1.16 → 10.6.15.144  SSH 894 Client: Encrypted packet (len=828)
   42 2.544260299  10.6.15.144 → 192.168.1.16 TCP 66 22 → 59298 [ACK] Seq=6181 Ack=1513 Win=1452 Len=0 TSval=4960080 TSecr=4363733
   43 2.585925510  10.6.15.144 → 192.168.1.16 TCP 66 22 → 59298 [ACK] Seq=6181 Ack=2341 Win=1452 Len=0 TSval=4960090 TSecr=4363734
   44 2.628914314  10.6.15.144 → 192.168.1.16 SSH 198 Server: Encrypted packet (len=132)
   45 2.629215550 192.168.1.16 → 10.6.15.144  SSH 126 Client: Encrypted packet (len=60)
   46 2.639135686  10.6.15.144 → 192.168.1.16 TCP 66 22 → 59298 [ACK] Seq=6313 Ack=2401 Win=1452 Len=0 TSval=4960103 TSecr=4363757
   47 2.662173464  10.6.15.144 → 192.168.1.16 SSH 1514 Server: [TCP Previous segment not captured] , Encrypted packet (len=1448)
   48 2.662193673 192.168.1.16 → 10.6.15.144  TCP 78 [TCP Dup ACK 45#1] 59298 → 22 [ACK] Seq=2401 Ack=6313 Win=3666 Len=0 TSval=4363765 TSecr=4960103 SLE=7761 SRE=9209
   49 2.662294706  10.6.15.144 → 192.168.1.16 SSH 1126 Server: Encrypted packet (len=1060)
   50 2.662299833 192.168.1.16 → 10.6.15.144  TCP 78 [TCP Dup ACK 45#2] 59298 → 22 [ACK] Seq=2401 Ack=6313 Win=3666 Len=0 TSval=4363765 TSecr=4960103 SLE=7761 SRE=10269
   51 2.663793755  10.6.15.144 → 192.168.1.16 SSH 1514 Server: Encrypted packet (len=1448)
   52 2.663804555 192.168.1.16 → 10.6.15.144  TCP 78 [TCP Dup ACK 45#3] 59298 → 22 [ACK] Seq=2401 Ack=6313 Win=3666 Len=0 TSval=4363766 TSecr=4960103 SLE=7761 SRE=11717
   53 2.672887097  10.6.15.144 → 192.168.1.16 SSH 1514 Server: Encrypted packet (len=1448)
   54 2.672906696 192.168.1.16 → 10.6.15.144  TCP 78 [TCP Dup ACK 45#4] 59298 → 22 [ACK] Seq=2401 Ack=6313 Win=3666 Len=0 TSval=4363768 TSecr=4960103 SLE=7761 SRE=13165
   55 2.673076406  10.6.15.144 → 192.168.1.16 SSH 1514 Server: Encrypted packet (len=1448)
   56 2.673096102 192.168.1.16 → 10.6.15.144  TCP 78 [TCP Dup ACK 45#5] 59298 → 22 [ACK] Seq=2401 Ack=6313 Win=3666 Len=0 TSval=4363768 TSecr=4960103 SLE=7761 SRE=14613
   57 2.674004033  10.6.15.144 → 192.168.1.16 SSH 1514 Server: [TCP Fast Retransmission] , Encrypted packet (len=1448)
   58 2.674030417 192.168.1.16 → 10.6.15.144  TCP 66 59298 → 22 [ACK] Seq=2401 Ack=14613 Win=3666 Len=0 TSval=4363768 TSecr=4960112
   59 2.683609369  10.6.15.144 → 192.168.1.16 SSH 1514 Server: Encrypted packet (len=1448)
   60 2.683626148 192.168.1.16 → 10.6.15.144  TCP 66 59298 → 22 [ACK] Seq=2401 Ack=16061 Win=3666 Len=0 TSval=4363771 TSecr=4960114
   61 2.684696377  10.6.15.144 → 192.168.1.16 SSH 1514 Server: Encrypted packet (len=1448)
   62 2.684713219 192.168.1.16 → 10.6.15.144  TCP 66 59298 → 22 [ACK] Seq=2401 Ack=17509 Win=3666 Len=0 TSval=4363771 TSecr=4960114
   63 2.687918980 192.168.1.16 → 10.6.15.144  SSH 142 Client: Encrypted packet (len=76)
   64 2.688927314 192.168.1.16 → 10.6.15.144  SSH 150 Client: Encrypted packet (len=84)
   65 2.690405718 192.168.1.16 → 10.6.15.144  SSH 134 Client: Encrypted packet (len=68)
   66 2.694461947  10.6.15.144 → 192.168.1.16 SSH 1514 Server: Encrypted packet (len=1448)
   67 2.694647195  10.6.15.144 → 192.168.1.16 SSH 1514 Server: Encrypted packet (len=1448)
   68 2.694658657 192.168.1.16 → 10.6.15.144  TCP 66 59298 → 22 [ACK] Seq=2629 Ack=20405 Win=3666 Len=0 TSval=4363774 TSecr=4960117
   69 2.694831212  10.6.15.144 → 192.168.1.16 SSH 478 Server: Encrypted packet (len=412)
   70 2.696401998 192.168.1.16 → 10.6.15.144  SSH 366 Client: Encrypted packet (len=300)
   71 2.697334972 192.168.1.16 → 10.6.15.144  SSH 134 Client: Encrypted packet (len=68)
   72 2.697587494 192.168.1.16 → 10.6.15.144  SSH 118 Client: Encrypted packet (len=52)
   73 2.698918525  10.6.15.144 → 192.168.1.16 TCP 66 22 → 59298 [ACK] Seq=20817 Ack=2561 Win=1452 Len=0 TSval=4960118 TSecr=4363772
   74 2.698941073 192.168.1.16 → 10.6.15.144  SSH 206 Client: Encrypted packet (len=140)
   75 2.704518856  10.6.15.144 → 192.168.1.16 TCP 66 22 → 59298 [ACK] Seq=20817 Ack=2929 Win=1452 Len=0 TSval=4960120 TSecr=4363772
   76 2.738665520 192.168.1.16 → 10.6.15.144  TCP 206 [TCP Retransmission] 59298 → 22 [PSH, ACK] Seq=3049 Ack=20817 Win=3666 Len=140 TSval=4363785 TSecr=4960120
   77 2.744324928  10.6.15.144 → 192.168.1.16 TCP 66 22 → 59298 [ACK] Seq=20817 Ack=3189 Win=1452 Len=0 TSval=4960130 TSecr=4363774
   78 2.748743917  10.6.15.144 → 192.168.1.16 TCP 78 [TCP Dup ACK 77#1] 22 → 59298 [ACK] Seq=20817 Ack=3189 Win=1452 Len=0 TSval=4960131 TSecr=4363785 SLE=3049 SRE=3189
   79 2.817864005 192.168.1.16 → 10.6.15.144  SSH 222 Client: Encrypted packet (len=156)
   80 2.818169979 192.168.1.16 → 10.6.15.144  SSH 278 Client: Encrypted packet (len=212)
   81 2.823795213 192.168.1.16 → 10.6.15.144  SSH 190 Client: Encrypted packet (len=124)
   82 2.824072306 192.168.1.16 → 10.6.15.144  SSH 298 Client: Encrypted packet (len=232)
   83 2.825411454 192.168.1.16 → 10.6.15.144  SSH 190 Client: Encrypted packet (len=124)
   84 2.825686050 192.168.1.16 → 10.6.15.144  SSH 290 Client: Encrypted packet (len=224)
   85 2.828187334  10.6.15.144 → 192.168.1.16 TCP 66 22 → 59298 [ACK] Seq=20817 Ack=3345 Win=1452 Len=0 TSval=4960150 TSecr=4363804
   86 2.828204578 192.168.1.16 → 10.6.15.144  SSH 562 Client: Encrypted packet (len=496)
   87 2.828312212  10.6.15.144 → 192.168.1.16 TCP 66 22 → 59298 [ACK] Seq=20817 Ack=3557 Win=1452 Len=0 TSval=4960150 TSecr=4363804
   88 2.833573340  10.6.15.144 → 192.168.1.16 TCP 66 22 → 59298 [ACK] Seq=20817 Ack=3681 Win=1452 Len=0 TSval=4960152 TSecr=4363806
   89 2.834045489  10.6.15.144 → 192.168.1.16 TCP 66 22 → 59298 [ACK] Seq=20817 Ack=3913 Win=1451 Len=0 TSval=4960152 TSecr=4363806
   90 2.835178458  10.6.15.144 → 192.168.1.16 TCP 66 22 → 59298 [ACK] Seq=20817 Ack=4037 Win=1451 Len=0 TSval=4960152 TSecr=4363806
   91 2.835313977  10.6.15.144 → 192.168.1.16 TCP 66 22 → 59298 [ACK] Seq=20817 Ack=4261 Win=1450 Len=0 TSval=4960152 TSecr=4363806
   92 2.838584837  10.6.15.144 → 192.168.1.16 TCP 66 22 → 59298 [ACK] Seq=20817 Ack=4757 Win=1447 Len=0 TSval=4960153 TSecr=4363807
   93 2.893680609  10.6.15.144 → 192.168.1.16 SSH 1514 Server: Encrypted packet (len=1448)
   94 2.893868062  10.6.15.144 → 192.168.1.16 SSH 1514 Server: Encrypted packet (len=1448)
   95 2.893877086 192.168.1.16 → 10.6.15.144  TCP 66 59298 → 22 [ACK] Seq=4757 Ack=23713 Win=3666 Len=0 TSval=4363823 TSecr=4960166
   96 2.894058978  10.6.15.144 → 192.168.1.16 SSH 1514 Server: Encrypted packet (len=1448)
   97 2.904439601  10.6.15.144 → 192.168.1.16 SSH 1514 Server: [TCP Previous segment not captured] , Encrypted packet (len=1448)
   98 2.904457186 192.168.1.16 → 10.6.15.144  TCP 78 59298 → 22 [ACK] Seq=4757 Ack=25161 Win=3666 Len=0 TSval=4363826 TSecr=4960166 SLE=26609 SRE=28057
   99 2.904629956  10.6.15.144 → 192.168.1.16 SSH 1514 Server: Encrypted packet (len=1448)
  100 2.904649994 192.168.1.16 → 10.6.15.144  TCP 78 [TCP Dup ACK 98#1] 59298 → 22 [ACK] Seq=4757 Ack=25161 Win=3666 Len=0 TSval=4363826 TSecr=4960166 SLE=26609 SRE=29505
  101 2.916505579  10.6.15.144 → 192.168.1.16 SSH 1514 Server: Encrypted packet (len=1448)
  102 2.916530718 192.168.1.16 → 10.6.15.144  TCP 78 [TCP Dup ACK 98#2] 59298 → 22 [ACK] Seq=4757 Ack=25161 Win=3666 Len=0 TSval=4363829 TSecr=4960166 SLE=26609 SRE=30953
  103 2.916692649  10.6.15.144 → 192.168.1.16 SSH 1514 Server: Encrypted packet (len=1448)
  104 2.916700430 192.168.1.16 → 10.6.15.144  TCP 78 [TCP Dup ACK 98#3] 59298 → 22 [ACK] Seq=4757 Ack=25161 Win=3666 Len=0 TSval=4363829 TSecr=4960166 SLE=26609 SRE=32401
  105 2.916882737  10.6.15.144 → 192.168.1.16 SSH 1514 Server: Encrypted packet (len=1448)
  106 2.916889534 192.168.1.16 → 10.6.15.144  TCP 78 [TCP Dup ACK 98#4] 59298 → 22 [ACK] Seq=4757 Ack=25161 Win=3666 Len=0 TSval=4363829 TSecr=4960166 SLE=26609 SRE=33849
  107 2.927542141  10.6.15.144 → 192.168.1.16 SSH 1514 Server: [TCP Fast Retransmission] , Encrypted packet (len=1448)
  108 2.927570748 192.168.1.16 → 10.6.15.144  TCP 66 59298 → 22 [ACK] Seq=4757 Ack=33849 Win=3666 Len=0 TSval=4363832 TSecr=4960175
  109 2.936982599  10.6.15.144 → 192.168.1.16 SSH 1514 Server: [TCP Previous segment not captured] , Encrypted packet (len=1448)
  110 2.937000310 192.168.1.16 → 10.6.15.144  TCP 78 [TCP Dup ACK 108#1] 59298 → 22 [ACK] Seq=4757 Ack=33849 Win=3666 Len=0 TSval=4363834 TSecr=4960175 SLE=35297 SRE=36745
  111 2.947000135  10.6.15.144 → 192.168.1.16 SSH 1514 Server: Encrypted packet (len=1448)
  112 2.947019941 192.168.1.16 → 10.6.15.144  TCP 78 [TCP Dup ACK 108#2] 59298 → 22 [ACK] Seq=4757 Ack=33849 Win=3666 Len=0 TSval=4363837 TSecr=4960175 SLE=35297 SRE=38193
  113 2.956870731  10.6.15.144 → 192.168.1.16 SSH 1514 Server: Encrypted packet (len=1448)
  114 2.956889940 192.168.1.16 → 10.6.15.144  TCP 78 [TCP Dup ACK 108#3] 59298 → 22 [ACK] Seq=4757 Ack=33849 Win=3666 Len=0 TSval=4363839 TSecr=4960175 SLE=35297 SRE=39641
  115 2.966013542  10.6.15.144 → 192.168.1.16 SSH 1514 Server: [TCP Fast Retransmission] , Encrypted packet (len=1448)
  116 2.966035965 192.168.1.16 → 10.6.15.144  TCP 66 59298 → 22 [ACK] Seq=4757 Ack=39641 Win=3666 Len=0 TSval=4363841 TSecr=4960185
  117 2.966159482  10.6.15.144 → 192.168.1.16 SSH 1514 Server: Encrypted packet (len=1448)
  118 2.966162747 192.168.1.16 → 10.6.15.144  TCP 66 59298 → 22 [ACK] Seq=4757 Ack=41089 Win=3666 Len=0 TSval=4363841 TSecr=4960185
  119 2.967032902 192.168.1.16 → 10.6.15.144  SSH 174 Client: Encrypted packet (len=108)
  120 2.967292935 192.168.1.16 → 10.6.15.144  SSH 134 Client: Encrypted packet (len=68)
  121 2.976827777  10.6.15.144 → 192.168.1.16 SSH 1514 Server: Encrypted packet (len=1448)
  122 2.977006382  10.6.15.144 → 192.168.1.16 SSH 1514 Server: Encrypted packet (len=1448)
  123 2.977016010 192.168.1.16 → 10.6.15.144  TCP 66 59298 → 22 [ACK] Seq=4933 Ack=43985 Win=3666 Len=0 TSval=4363844 TSecr=4960187
  124 2.977354875  10.6.15.144 → 192.168.1.16 SSH 1514 Server: Encrypted packet (len=1448)
  125 2.977363676  10.6.15.144 → 192.168.1.16 TCP 66 22 → 59298 [ACK] Seq=45433 Ack=4933 Win=1452 Len=0 TSval=4960188 TSecr=4363842
  126 2.988351741  10.6.15.144 → 192.168.1.16 SSH 1514 Server: Encrypted packet (len=1448)
  127 2.988368863 192.168.1.16 → 10.6.15.144  TCP 66 59298 → 22 [ACK] Seq=4933 Ack=46881 Win=3666 Len=0 TSval=4363847 TSecr=4960187
  128 2.988530333  10.6.15.144 → 192.168.1.16 SSH 1514 Server: Encrypted packet (len=1448)
  129 2.989641154 192.168.1.16 → 10.6.15.144  SSH 174 Client: Encrypted packet (len=108)
  130 2.989909707 192.168.1.16 → 10.6.15.144  SSH 158 Client: Encrypted packet (len=92)
  131 2.999504944  10.6.15.144 → 192.168.1.16 SSH 1514 Server: [TCP Previous segment not captured] , Encrypted packet (len=1448)
  132 2.999523419 192.168.1.16 → 10.6.15.144  TCP 78 [TCP Dup ACK 129#1] 59298 → 22 [ACK] Seq=5133 Ack=48329 Win=3666 Len=0 TSval=4363850 TSecr=4960190 SLE=49777 SRE=51225
  133 2.999862105  10.6.15.144 → 192.168.1.16 SSH 1514 Server: Encrypted packet (len=1448)
  134 2.999887232 192.168.1.16 → 10.6.15.144  TCP 78 [TCP Dup ACK 129#2] 59298 → 22 [ACK] Seq=5133 Ack=48329 Win=3666 Len=0 TSval=4363850 TSecr=4960190 SLE=49777 SRE=52673
  135 3.009377776  10.6.15.144 → 192.168.1.16 SSH 1514 Server: Encrypted packet (len=1448)
  136 3.009403320 192.168.1.16 → 10.6.15.144  TCP 78 [TCP Dup ACK 129#3] 59298 → 22 [ACK] Seq=5133 Ack=48329 Win=3666 Len=0 TSval=4363852 TSecr=4960190 SLE=49777 SRE=54121
  137 3.009563350  10.6.15.144 → 192.168.1.16 SSH 1514 Server: Encrypted packet (len=1448)
  138 3.009569525 192.168.1.16 → 10.6.15.144  TCP 78 [TCP Dup ACK 129#4] 59298 → 22 [ACK] Seq=5133 Ack=48329 Win=3666 Len=0 TSval=4363852 TSecr=4960190 SLE=49777 SRE=55569
  139 3.020987937  10.6.15.144 → 192.168.1.16 SSH 1514 Server: [TCP Fast Retransmission] , Encrypted packet (len=1448)
  140 3.021016641 192.168.1.16 → 10.6.15.144  TCP 66 59298 → 22 [ACK] Seq=5133 Ack=55569 Win=3666 Len=0 TSval=4363855 TSecr=4960198
  141 3.021109065  10.6.15.144 → 192.168.1.16 SSH 1514 Server: Encrypted packet (len=1448)
  142 3.021112978 192.168.1.16 → 10.6.15.144  TCP 66 59298 → 22 [ACK] Seq=5133 Ack=57017 Win=3666 Len=0 TSval=4363855 TSecr=4960198
  143 3.031725959  10.6.15.144 → 192.168.1.16 SSH 1514 Server: Encrypted packet (len=1448)
  144 3.031748373 192.168.1.16 → 10.6.15.144  TCP 66 59298 → 22 [ACK] Seq=5133 Ack=58465 Win=3666 Len=0 TSval=4363858 TSecr=4960201
  145 3.031891478  10.6.15.144 → 192.168.1.16 SSH 1514 Server: Encrypted packet (len=1448)
  146 3.031894858 192.168.1.16 → 10.6.15.144  TCP 66 59298 → 22 [ACK] Seq=5133 Ack=59913 Win=3666 Len=0 TSval=4363858 TSecr=4960201
  147 3.032096959  10.6.15.144 → 192.168.1.16 SSH 1514 Server: Encrypted packet (len=1448)
  148 3.032103425 192.168.1.16 → 10.6.15.144  TCP 66 59298 → 22 [ACK] Seq=5133 Ack=61361 Win=3666 Len=0 TSval=4363858 TSecr=4960201
  149 3.046714871  10.6.15.144 → 192.168.1.16 SSH 1514 Server: Encrypted packet (len=1448)
  150 3.046733408 192.168.1.16 → 10.6.15.144  TCP 66 59298 → 22 [ACK] Seq=5133 Ack=62809 Win=3666 Len=0 TSval=4363862 TSecr=4960205
  151 3.047926501  10.6.15.144 → 192.168.1.16 SSH 1514 Server: Encrypted packet (len=1448)
  152 3.047943523 192.168.1.16 → 10.6.15.144  TCP 66 59298 → 22 [ACK] Seq=5133 Ack=64257 Win=3666 Len=0 TSval=4363862 TSecr=4960205
  153 3.048596698  10.6.15.144 → 192.168.1.16 SSH 1514 Server: Encrypted packet (len=1448)
  154 3.048612897 192.168.1.16 → 10.6.15.144  TCP 66 59298 → 22 [ACK] Seq=5133 Ack=65705 Win=3666 Len=0 TSval=4363862 TSecr=4960205
  155 3.058967393  10.6.15.144 → 192.168.1.16 SSH 1514 Server: Encrypted packet (len=1448)
  156 3.058986085 192.168.1.16 → 10.6.15.144  TCP 66 59298 → 22 [ACK] Seq=5133 Ack=67153 Win=3666 Len=0 TSval=4363865 TSecr=4960208
  157 3.059119456  10.6.15.144 → 192.168.1.16 SSH 1514 Server: Encrypted packet (len=1448)
  158 3.059124854 192.168.1.16 → 10.6.15.144  TCP 66 59298 → 22 [ACK] Seq=5133 Ack=68601 Win=3666 Len=0 TSval=4363865 TSecr=4960208
  159 3.059499134  10.6.15.144 → 192.168.1.16 SSH 1514 Server: Encrypted packet (len=1448)
  160 3.059516185 192.168.1.16 → 10.6.15.144  TCP 66 59298 → 22 [ACK] Seq=5133 Ack=70049 Win=3666 Len=0 TSval=4363865 TSecr=4960208
  161 3.069178593  10.6.15.144 → 192.168.1.16 SSH 1514 Server: Encrypted packet (len=1448)
  162 3.069195586 192.168.1.16 → 10.6.15.144  TCP 66 59298 → 22 [ACK] Seq=5133 Ack=71497 Win=3666 Len=0 TSval=4363867 TSecr=4960211
  163 3.069355371  10.6.15.144 → 192.168.1.16 SSH 1514 Server: Encrypted packet (len=1448)
  164 3.069360468 192.168.1.16 → 10.6.15.144  TCP 66 59298 → 22 [ACK] Seq=5133 Ack=72945 Win=3666 Len=0 TSval=4363867 TSecr=4960211
  165 3.069672338  10.6.15.144 → 192.168.1.16 SSH 1514 Server: Encrypted packet (len=1448)
  166 3.069677273 192.168.1.16 → 10.6.15.144  TCP 66 59298 → 22 [ACK] Seq=5133 Ack=74393 Win=3666 Len=0 TSval=4363867 TSecr=4960211
  167 3.080089613  10.6.15.144 → 192.168.1.16 SSH 1514 Server: Encrypted packet (len=1448)
  168 3.080106864 192.168.1.16 → 10.6.15.144  TCP 66 59298 → 22 [ACK] Seq=5133 Ack=75841 Win=3666 Len=0 TSval=4363870 TSecr=4960213
  169 3.080269188  10.6.15.144 → 192.168.1.16 SSH 1514 Server: Encrypted packet (len=1448)
  170 3.080612567  10.6.15.144 → 192.168.1.16 SSH 1514 Server: Encrypted packet (len=1448)
  171 3.080615354 192.168.1.16 → 10.6.15.144  TCP 66 59298 → 22 [ACK] Seq=5133 Ack=78737 Win=3666 Len=0 TSval=4363870 TSecr=4960213
  172 3.092444846  10.6.15.144 → 192.168.1.16 SSH 1514 Server: Encrypted packet (len=1448)
  173 3.092562434  10.6.15.144 → 192.168.1.16 SSH 1514 Server: Encrypted packet (len=1448)
  174 3.092571543 192.168.1.16 → 10.6.15.144  TCP 66 59298 → 22 [ACK] Seq=5133 Ack=81633 Win=3666 Len=0 TSval=4363873 TSecr=4960216
  175 3.092907845  10.6.15.144 → 192.168.1.16 SSH 1514 Server: Encrypted packet (len=1448)
  176 3.093098559  10.6.15.144 → 192.168.1.16 SSH 1514 Server: Encrypted packet (len=1448)
  177 3.093105268 192.168.1.16 → 10.6.15.144  TCP 66 59298 → 22 [ACK] Seq=5133 Ack=84529 Win=3666 Len=0 TSval=4363873 TSecr=4960216
  178 3.103639371  10.6.15.144 → 192.168.1.16 SSH 1514 Server: Encrypted packet (len=1448)
  179 3.103823107  10.6.15.144 → 192.168.1.16 SSH 1514 Server: Encrypted packet (len=1448)
  180 3.103832504 192.168.1.16 → 10.6.15.144  TCP 66 59298 → 22 [ACK] Seq=5133 Ack=87425 Win=3666 Len=0 TSval=4363876 TSecr=4960219
  181 3.104171317  10.6.15.144 → 192.168.1.16 SSH 1514 Server: Encrypted packet (len=1448)
  182 3.104363993  10.6.15.144 → 192.168.1.16 SSH 1514 Server: Encrypted packet (len=1448)
  183 3.104370414 192.168.1.16 → 10.6.15.144  TCP 66 59298 → 22 [ACK] Seq=5133 Ack=90321 Win=3666 Len=0 TSval=4363876 TSecr=4960219
  184 3.114296744  10.6.15.144 → 192.168.1.16 SSH 1514 Server: Encrypted packet (len=1448)
  185 3.114453817  10.6.15.144 → 192.168.1.16 SSH 1514 Server: Encrypted packet (len=1448)
  186 3.114464903 192.168.1.16 → 10.6.15.144  TCP 66 59298 → 22 [ACK] Seq=5133 Ack=93217 Win=3666 Len=0 TSval=4363878 TSecr=4960222
  187 3.114639940  10.6.15.144 → 192.168.1.16 SSH 1514 Server: Encrypted packet (len=1448)
  188 3.115022826  10.6.15.144 → 192.168.1.16 SSH 1514 Server: Encrypted packet (len=1448)
  189 3.115040239 192.168.1.16 → 10.6.15.144  TCP 66 59298 → 22 [ACK] Seq=5133 Ack=96113 Win=3666 Len=0 TSval=4363879 TSecr=4960222
  190 3.125399490  10.6.15.144 → 192.168.1.16 SSH 1514 Server: Encrypted packet (len=1448)
  191 3.125538242  10.6.15.144 → 192.168.1.16 SSH 1514 Server: Encrypted packet (len=1448)
  192 3.125548870 192.168.1.16 → 10.6.15.144  TCP 66 59298 → 22 [ACK] Seq=5133 Ack=99009 Win=3666 Len=0 TSval=4363881 TSecr=4960225
  193 3.125717808  10.6.15.144 → 192.168.1.16 SSH 1514 Server: Encrypted packet (len=1448)
  194 3.126085558  10.6.15.144 → 192.168.1.16 SSH 1514 Server: Encrypted packet (len=1448)
  195 3.126091918 192.168.1.16 → 10.6.15.144  TCP 66 59298 → 22 [ACK] Seq=5133 Ack=101905 Win=3666 Len=0 TSval=4363881 TSecr=4960225
  196 3.137016500  10.6.15.144 → 192.168.1.16 SSH 1514 Server: [TCP Previous segment not captured] , Encrypted packet (len=1448)
  197 3.137035265 192.168.1.16 → 10.6.15.144  TCP 78 [TCP Dup ACK 195#1] 59298 → 22 [ACK] Seq=5133 Ack=101905 Win=3666 Len=0 TSval=4363884 TSecr=4960225 SLE=103353 SRE=104801
  198 3.137169590  10.6.15.144 → 192.168.1.16 SSH 1514 Server: Encrypted packet (len=1448)
  199 3.137179759 192.168.1.16 → 10.6.15.144  TCP 78 [TCP Dup ACK 195#2] 59298 → 22 [ACK] Seq=5133 Ack=101905 Win=3666 Len=0 TSval=4363884 TSecr=4960225 SLE=103353 SRE=106249
  200 3.137362070  10.6.15.144 → 192.168.1.16 SSH 1514 Server: Encrypted packet (len=1448)
  201 3.137369506 192.168.1.16 → 10.6.15.144  TCP 78 [TCP Dup ACK 195#3] 59298 → 22 [ACK] Seq=5133 Ack=101905 Win=3666 Len=0 TSval=4363884 TSecr=4960225 SLE=103353 SRE=107697
  202 3.150074569  10.6.15.144 → 192.168.1.16 SSH 1514 Server: Encrypted packet (len=1448)
  203 3.150097118 192.168.1.16 → 10.6.15.144  TCP 78 [TCP Dup ACK 195#4] 59298 → 22 [ACK] Seq=5133 Ack=101905 Win=3666 Len=0 TSval=4363887 TSecr=4960225 SLE=103353 SRE=109145
  204 3.150259237  10.6.15.144 → 192.168.1.16 SSH 1514 Server: Encrypted packet (len=1448)
  205 3.150265445 192.168.1.16 → 10.6.15.144  TCP 78 [TCP Dup ACK 195#5] 59298 → 22 [ACK] Seq=5133 Ack=101905 Win=3666 Len=0 TSval=4363887 TSecr=4960225 SLE=103353 SRE=110593
  206 3.150449220  10.6.15.144 → 192.168.1.16 SSH 1514 Server: Encrypted packet (len=1448)
  207 3.150453245 192.168.1.16 → 10.6.15.144  TCP 78 [TCP Dup ACK 195#6] 59298 → 22 [ACK] Seq=5133 Ack=101905 Win=3666 Len=0 TSval=4363887 TSecr=4960225 SLE=103353 SRE=112041
  208 3.150668939  10.6.15.144 → 192.168.1.16 SSH 1514 Server: [TCP Fast Retransmission] , Encrypted packet (len=1448)
  209 3.150678216 192.168.1.16 → 10.6.15.144  TCP 66 59298 → 22 [ACK] Seq=5133 Ack=112041 Win=3658 Len=0 TSval=4363888 TSecr=4960231
  210 3.160476483  10.6.15.144 → 192.168.1.16 SSH 1514 Server: Encrypted packet (len=1448)
  211 3.160492561 192.168.1.16 → 10.6.15.144  TCP 66 59298 → 22 [ACK] Seq=5133 Ack=113489 Win=3666 Len=0 TSval=4363890 TSecr=4960234
  212 3.160656168  10.6.15.144 → 192.168.1.16 SSH 1514 Server: Encrypted packet (len=1448)
  213 3.160658944 192.168.1.16 → 10.6.15.144  TCP 66 59298 → 22 [ACK] Seq=5133 Ack=114937 Win=3666 Len=0 TSval=4363890 TSecr=4960234
  214 3.161000578  10.6.15.144 → 192.168.1.16 SSH 1514 Server: Encrypted packet (len=1448)
  215 3.161003473 192.168.1.16 → 10.6.15.144  TCP 66 59298 → 22 [ACK] Seq=5133 Ack=116385 Win=3666 Len=0 TSval=4363890 TSecr=4960234
  216 3.170392899  10.6.15.144 → 192.168.1.16 SSH 1514 Server: Encrypted packet (len=1448)
  217 3.170419507 192.168.1.16 → 10.6.15.144  TCP 66 59298 → 22 [ACK] Seq=5133 Ack=117833 Win=3666 Len=0 TSval=4363892 TSecr=4960236
  218 3.170517220  10.6.15.144 → 192.168.1.16 SSH 1514 Server: Encrypted packet (len=1448)
  219 3.170523269 192.168.1.16 → 10.6.15.144  TCP 66 59298 → 22 [ACK] Seq=5133 Ack=119281 Win=3666 Len=0 TSval=4363892 TSecr=4960236
  220 3.170734804  10.6.15.144 → 192.168.1.16 SSH 1514 Server: Encrypted packet (len=1448)
  221 3.170741360 192.168.1.16 → 10.6.15.144  TCP 66 59298 → 22 [ACK] Seq=5133 Ack=120729 Win=3666 Len=0 TSval=4363893 TSecr=4960236
  222 3.171111953  10.6.15.144 → 192.168.1.16 SSH 1514 Server: Encrypted packet (len=1448)
  223 3.171129701 192.168.1.16 → 10.6.15.144  TCP 66 59298 → 22 [ACK] Seq=5133 Ack=122177 Win=3666 Len=0 TSval=4363893 TSecr=4960236
  224 3.181111269  10.6.15.144 → 192.168.1.16 SSH 1514 Server: Encrypted packet (len=1448)
  225 3.181128120 192.168.1.16 → 10.6.15.144  TCP 66 59298 → 22 [ACK] Seq=5133 Ack=123625 Win=3666 Len=0 TSval=4363895 TSecr=4960239
  226 3.181237804  10.6.15.144 → 192.168.1.16 SSH 1514 Server: Encrypted packet (len=1448)
  227 3.181244469 192.168.1.16 → 10.6.15.144  TCP 66 59298 → 22 [ACK] Seq=5133 Ack=125073 Win=3666 Len=0 TSval=4363895 TSecr=4960239
  228 3.181350995 192.168.1.16 → 10.6.15.144  SSH 102 Client: Encrypted packet (len=36)
  229 3.181440444  10.6.15.144 → 192.168.1.16 SSH 1514 Server: Encrypted packet (len=1448)
  230 3.181774255  10.6.15.144 → 192.168.1.16 SSH 1514 Server: Encrypted packet (len=1448)
  231 3.181782158 192.168.1.16 → 10.6.15.144  TCP 66 59298 → 22 [ACK] Seq=5169 Ack=127969 Win=3666 Len=0 TSval=4363895 TSecr=4960239
  232 3.192383602  10.6.15.144 → 192.168.1.16 SSH 1514 Server: Encrypted packet (len=1448)
  233 3.192567663  10.6.15.144 → 192.168.1.16 SSH 1514 Server: Encrypted packet (len=1448)
  234 3.192580299 192.168.1.16 → 10.6.15.144  TCP 66 59298 → 22 [ACK] Seq=5169 Ack=130865 Win=3666 Len=0 TSval=4363898 TSecr=4960241
  235 3.192936113  10.6.15.144 → 192.168.1.16 SSH 1514 Server: Encrypted packet (len=1448)
  236 3.193122085  10.6.15.144 → 192.168.1.16 SSH 1514 Server: Encrypted packet (len=1448)
  237 3.193128787 192.168.1.16 → 10.6.15.144  TCP 66 59298 → 22 [ACK] Seq=5169 Ack=133761 Win=3666 Len=0 TSval=4363898 TSecr=4960241
  238 3.203769129  10.6.15.144 → 192.168.1.16 SSH 1514 Server: Encrypted packet (len=1448)
  239 3.203919068  10.6.15.144 → 192.168.1.16 SSH 1514 Server: Encrypted packet (len=1448)
  240 3.203929175 192.168.1.16 → 10.6.15.144  TCP 66 59298 → 22 [ACK] Seq=5169 Ack=136657 Win=3666 Len=0 TSval=4363901 TSecr=4960244
  241 3.204302353  10.6.15.144 → 192.168.1.16 SSH 1514 Server: Encrypted packet (len=1448)
  242 3.204460319  10.6.15.144 → 192.168.1.16 SSH 1514 Server: Encrypted packet (len=1448)
  243 3.204470841 192.168.1.16 → 10.6.15.144  TCP 66 59298 → 22 [ACK] Seq=5169 Ack=139553 Win=3666 Len=0 TSval=4363901 TSecr=4960244
  244 3.215402244  10.6.15.144 → 192.168.1.16 SSH 1514 Server: [TCP Previous segment not captured] , Encrypted packet (len=1448)
  245 3.215419919 192.168.1.16 → 10.6.15.144  TCP 78 [TCP Dup ACK 243#1] 59298 → 22 [ACK] Seq=5169 Ack=139553 Win=3666 Len=0 TSval=4363904 TSecr=4960244 SLE=141001 SRE=142449
  246 3.215571518  10.6.15.144 → 192.168.1.16 SSH 1514 Server: Encrypted packet (len=1448)
  247 3.215579197 192.168.1.16 → 10.6.15.144  TCP 78 [TCP Dup ACK 243#2] 59298 → 22 [ACK] Seq=5169 Ack=139553 Win=3666 Len=0 TSval=4363904 TSecr=4960244 SLE=141001 SRE=143897
  248 3.215776626  10.6.15.144 → 192.168.1.16 SSH 1514 Server: Encrypted packet (len=1448)
  249 3.215784008 192.168.1.16 → 10.6.15.144  TCP 78 [TCP Dup ACK 243#3] 59298 → 22 [ACK] Seq=5169 Ack=139553 Win=3666 Len=0 TSval=4363904 TSecr=4960244 SLE=141001 SRE=145345
  250 3.225879334  10.6.15.144 → 192.168.1.16 SSH 1514 Server: Encrypted packet (len=1448)
  251 3.225898484 192.168.1.16 → 10.6.15.144  TCP 78 [TCP Dup ACK 243#4] 59298 → 22 [ACK] Seq=5169 Ack=139553 Win=3666 Len=0 TSval=4363906 TSecr=4960244 SLE=141001 SRE=146793
  252 3.226073043  10.6.15.144 → 192.168.1.16 SSH 1514 Server: Encrypted packet (len=1448)
  253 3.226092356 192.168.1.16 → 10.6.15.144  TCP 78 [TCP Dup ACK 243#5] 59298 → 22 [ACK] Seq=5169 Ack=139553 Win=3666 Len=0 TSval=4363906 TSecr=4960244 SLE=141001 SRE=148241
  254 3.226413995  10.6.15.144 → 192.168.1.16 SSH 1514 Server: Encrypted packet (len=1448)
  255 3.226432832 192.168.1.16 → 10.6.15.144  TCP 78 [TCP Dup ACK 243#6] 59298 → 22 [ACK] Seq=5169 Ack=139553 Win=3666 Len=0 TSval=4363906 TSecr=4960244 SLE=141001 SRE=149689
  256 3.226606571  10.6.15.144 → 192.168.1.16 SSH 1514 Server: [TCP Fast Retransmission] , Encrypted packet (len=1448)
  257 3.226634329 192.168.1.16 → 10.6.15.144  TCP 66 59298 → 22 [ACK] Seq=5169 Ack=149689 Win=3658 Len=0 TSval=4363906 TSecr=4960250
  258 3.235993623  10.6.15.144 → 192.168.1.16 SSH 1514 Server: Encrypted packet (len=1448)
  259 3.236011313 192.168.1.16 → 10.6.15.144  TCP 66 59298 → 22 [ACK] Seq=5169 Ack=151137 Win=3666 Len=0 TSval=4363909 TSecr=4960253
  260 3.236139319  10.6.15.144 → 192.168.1.16 SSH 1514 Server: Encrypted packet (len=1448)
  261 3.236143994 192.168.1.16 → 10.6.15.144  TCP 66 59298 → 22 [ACK] Seq=5169 Ack=152585 Win=3666 Len=0 TSval=4363909 TSecr=4960253
  262 3.236386210  10.6.15.144 → 192.168.1.16 SSH 1514 Server: Encrypted packet (len=1448)
  263 3.236403376 192.168.1.16 → 10.6.15.144  TCP 66 59298 → 22 [ACK] Seq=5169 Ack=154033 Win=3666 Len=0 TSval=4363909 TSecr=4960253
  264 3.247191278  10.6.15.144 → 192.168.1.16 SSH 1514 Server: Encrypted packet (len=1448)
  265 3.247208044 192.168.1.16 → 10.6.15.144  TCP 66 59298 → 22 [ACK] Seq=5169 Ack=155481 Win=3666 Len=0 TSval=4363912 TSecr=4960255
  266 3.247511256  10.6.15.144 → 192.168.1.16 SSH 1514 Server: [TCP Previous segment not captured] , Encrypted packet (len=1448)
  267 3.247528727 192.168.1.16 → 10.6.15.144  TCP 78 [TCP Dup ACK 265#1] 59298 → 22 [ACK] Seq=5169 Ack=155481 Win=3666 Len=0 TSval=4363912 TSecr=4960255 SLE=156929 SRE=158377
  268 3.247704300  10.6.15.144 → 192.168.1.16 SSH 1514 Server: Encrypted packet (len=1448)
  269 3.247724262 192.168.1.16 → 10.6.15.144  TCP 78 [TCP Dup ACK 265#2] 59298 → 22 [ACK] Seq=5169 Ack=155481 Win=3666 Len=0 TSval=4363912 TSecr=4960255 SLE=156929 SRE=159825
  270 3.258155580  10.6.15.144 → 192.168.1.16 SSH 1514 Server: Encrypted packet (len=1448)
  271 3.258173550 192.168.1.16 → 10.6.15.144  TCP 78 [TCP Dup ACK 265#3] 59298 → 22 [ACK] Seq=5169 Ack=155481 Win=3666 Len=0 TSval=4363914 TSecr=4960255 SLE=156929 SRE=161273
  272 3.258360132  10.6.15.144 → 192.168.1.16 SSH 1514 Server: Encrypted packet (len=1448)
  273 3.258377487 192.168.1.16 → 10.6.15.144  TCP 78 [TCP Dup ACK 265#4] 59298 → 22 [ACK] Seq=5169 Ack=155481 Win=3666 Len=0 TSval=4363914 TSecr=4960255 SLE=156929 SRE=162721
  274 3.258580773  10.6.15.144 → 192.168.1.16 SSH 1514 Server: Encrypted packet (len=1448)
  275 3.258601241 192.168.1.16 → 10.6.15.144  TCP 78 [TCP Dup ACK 265#5] 59298 → 22 [ACK] Seq=5169 Ack=155481 Win=3666 Len=0 TSval=4363914 TSecr=4960255 SLE=156929 SRE=164169
  276 3.258931971  10.6.15.144 → 192.168.1.16 SSH 1514 Server: Encrypted packet (len=1448)
  277 3.258950608 192.168.1.16 → 10.6.15.144  TCP 78 [TCP Dup ACK 265#6] 59298 → 22 [ACK] Seq=5169 Ack=155481 Win=3666 Len=0 TSval=4363915 TSecr=4960255 SLE=156929 SRE=165617
  278 3.269333552  10.6.15.144 → 192.168.1.16 SSH 1514 Server: [TCP Fast Retransmission] , Encrypted packet (len=1448)
  279 3.269360610 192.168.1.16 → 10.6.15.144  TCP 66 59298 → 22 [ACK] Seq=5169 Ack=165617 Win=3658 Len=0 TSval=4363917 TSecr=4960261
  280 3.269606826  10.6.15.144 → 192.168.1.16 SSH 1514 Server: Encrypted packet (len=1448)
  281 3.269613270 192.168.1.16 → 10.6.15.144  TCP 66 59298 → 22 [ACK] Seq=5169 Ack=167065 Win=3666 Len=0 TSval=4363917 TSecr=4960261
  282 3.269783043  10.6.15.144 → 192.168.1.16 SSH 1514 Server: Encrypted packet (len=1448)
  283 3.269791221 192.168.1.16 → 10.6.15.144  TCP 66 59298 → 22 [ACK] Seq=5169 Ack=168513 Win=3666 Len=0 TSval=4363917 TSecr=4960261
  284 3.280633079  10.6.15.144 → 192.168.1.16 SSH 1514 Server: Encrypted packet (len=1448)
  285 3.280651246 192.168.1.16 → 10.6.15.144  TCP 66 59298 → 22 [ACK] Seq=5169 Ack=169961 Win=3666 Len=0 TSval=4363920 TSecr=4960263
  286 3.280780233  10.6.15.144 → 192.168.1.16 SSH 1514 Server: Encrypted packet (len=1448)
  287 3.280785617 192.168.1.16 → 10.6.15.144  TCP 66 59298 → 22 [ACK] Seq=5169 Ack=171409 Win=3666 Len=0 TSval=4363920 TSecr=4960263
  288 3.280998108  10.6.15.144 → 192.168.1.16 SSH 1514 Server: Encrypted packet (len=1448)
  289 3.281015123 192.168.1.16 → 10.6.15.144  TCP 66 59298 → 22 [ACK] Seq=5169 Ack=172857 Win=3666 Len=0 TSval=4363920 TSecr=4960263
  290 3.281302377  10.6.15.144 → 192.168.1.16 SSH 1514 Server: Encrypted packet (len=1448)
  291 3.281308995 192.168.1.16 → 10.6.15.144  TCP 66 59298 → 22 [ACK] Seq=5169 Ack=174305 Win=3666 Len=0 TSval=4363920 TSecr=4960263
  292 3.291416518  10.6.15.144 → 192.168.1.16 SSH 1514 Server: Encrypted packet (len=1448)
  293 3.291434228 192.168.1.16 → 10.6.15.144  TCP 66 59298 → 22 [ACK] Seq=5169 Ack=175753 Win=3666 Len=0 TSval=4363923 TSecr=4960266
  294 3.291564529  10.6.15.144 → 192.168.1.16 SSH 1514 Server: Encrypted packet (len=1448)
  295 3.291570140 192.168.1.16 → 10.6.15.144  TCP 66 59298 → 22 [ACK] Seq=5169 Ack=177201 Win=3666 Len=0 TSval=4363923 TSecr=4960266
  296 3.291813134  10.6.15.144 → 192.168.1.16 SSH 1514 Server: Encrypted packet (len=1448)
  297 3.291829335 192.168.1.16 → 10.6.15.144  TCP 66 59298 → 22 [ACK] Seq=5169 Ack=178649 Win=3666 Len=0 TSval=4363923 TSecr=4960266
  298 3.292143125  10.6.15.144 → 192.168.1.16 SSH 1514 Server: Encrypted packet (len=1448)
  299 3.292161694 192.168.1.16 → 10.6.15.144  TCP 66 59298 → 22 [ACK] Seq=5169 Ack=180097 Win=3666 Len=0 TSval=4363923 TSecr=4960266
  300 3.302978497  10.6.15.144 → 192.168.1.16 SSH 1514 Server: Encrypted packet (len=1448)
  301 3.302995521 192.168.1.16 → 10.6.15.144  TCP 66 59298 → 22 [ACK] Seq=5169 Ack=181545 Win=3666 Len=0 TSval=4363926 TSecr=4960269
  302 3.303126266  10.6.15.144 → 192.168.1.16 SSH 1514 Server: Encrypted packet (len=1448)
  303 3.303131608 192.168.1.16 → 10.6.15.144  TCP 66 59298 → 22 [ACK] Seq=5169 Ack=182993 Win=3666 Len=0 TSval=4363926 TSecr=4960269
  304 3.303376983  10.6.15.144 → 192.168.1.16 SSH 1514 Server: Encrypted packet (len=1448)
  305 3.303393279 192.168.1.16 → 10.6.15.144  TCP 66 59298 → 22 [ACK] Seq=5169 Ack=184441 Win=3666 Len=0 TSval=4363926 TSecr=4960269
  306 3.303482641  10.6.15.144 → 192.168.1.16 SSH 1514 Server: Encrypted packet (len=1448)
  307 3.303486827 192.168.1.16 → 10.6.15.144  TCP 66 59298 → 22 [ACK] Seq=5169 Ack=185889 Win=3666 Len=0 TSval=4363926 TSecr=4960269
  308 3.314241252  10.6.15.144 → 192.168.1.16 SSH 1514 Server: Encrypted packet (len=1448)
  309 3.314420341  10.6.15.144 → 192.168.1.16 SSH 1514 Server: Encrypted packet (len=1448)
  310 3.314431819 192.168.1.16 → 10.6.15.144  TCP 66 59298 → 22 [ACK] Seq=5169 Ack=188785 Win=3666 Len=0 TSval=4363928 TSecr=4960272
  311 3.314772149  10.6.15.144 → 192.168.1.16 SSH 1514 Server: Encrypted packet (len=1448)
  312 3.314957113  10.6.15.144 → 192.168.1.16 SSH 1514 Server: Encrypted packet (len=1448)
  313 3.314963329 192.168.1.16 → 10.6.15.144  TCP 66 59298 → 22 [ACK] Seq=5169 Ack=191681 Win=3666 Len=0 TSval=4363929 TSecr=4960272
  314 3.326324355  10.6.15.144 → 192.168.1.16 SSH 1514 Server: Encrypted packet (len=1448)
  315 3.326496194  10.6.15.144 → 192.168.1.16 SSH 1514 Server: Encrypted packet (len=1448)
  316 3.326504490 192.168.1.16 → 10.6.15.144  TCP 66 59298 → 22 [ACK] Seq=5169 Ack=194577 Win=3666 Len=0 TSval=4363931 TSecr=4960275
  317 3.336930133  10.6.15.144 → 192.168.1.16 SSH 1514 Server: [TCP Previous segment not captured] , Encrypted packet (len=1448)
  318 3.336943668 192.168.1.16 → 10.6.15.144  TCP 78 [TCP Dup ACK 316#1] 59298 → 22 [ACK] Seq=5169 Ack=194577 Win=3666 Len=0 TSval=4363934 TSecr=4960275 SLE=197473 SRE=198921
  319 3.337114442  10.6.15.144 → 192.168.1.16 SSH 1514 Server: Encrypted packet (len=1448)
  320 3.337119040 192.168.1.16 → 10.6.15.144  TCP 78 [TCP Dup ACK 316#2] 59298 → 22 [ACK] Seq=5169 Ack=194577 Win=3666 Len=0 TSval=4363934 TSecr=4960275 SLE=197473 SRE=200369
  321 3.347355429  10.6.15.144 → 192.168.1.16 SSH 1514 Server: Encrypted packet (len=1448)
  322 3.347373937 192.168.1.16 → 10.6.15.144  TCP 78 [TCP Dup ACK 316#3] 59298 → 22 [ACK] Seq=5169 Ack=194577 Win=3666 Len=0 TSval=4363937 TSecr=4960275 SLE=197473 SRE=201817
  323 3.347534302  10.6.15.144 → 192.168.1.16 SSH 1514 Server: Encrypted packet (len=1448)
  324 3.347537637 192.168.1.16 → 10.6.15.144  TCP 78 [TCP Dup ACK 316#4] 59298 → 22 [ACK] Seq=5169 Ack=194577 Win=3666 Len=0 TSval=4363937 TSecr=4960275 SLE=197473 SRE=203265
  325 3.347725103  10.6.15.144 → 192.168.1.16 SSH 1514 Server: [TCP Fast Retransmission] , Encrypted packet (len=1448)
  326 3.347731445 192.168.1.16 → 10.6.15.144  TCP 78 59298 → 22 [ACK] Seq=5169 Ack=196025 Win=3666 Len=0 TSval=4363937 TSecr=4960280 SLE=197473 SRE=203265
  327 3.358299375  10.6.15.144 → 192.168.1.16 TCP 1514 [TCP Retransmission] 22 → 59298 [ACK] Seq=196025 Ack=5169 Win=1452 Len=1448 TSval=4960283 TSecr=4363937
  328 3.358329558 192.168.1.16 → 10.6.15.144  TCP 66 59298 → 22 [ACK] Seq=5169 Ack=203265 Win=3666 Len=0 TSval=4363939 TSecr=4960283
  329 3.358417394  10.6.15.144 → 192.168.1.16 SSH 1514 Server: Encrypted packet (len=1448)
  330 3.358421522 192.168.1.16 → 10.6.15.144  TCP 66 59298 → 22 [ACK] Seq=5169 Ack=204713 Win=3666 Len=0 TSval=4363939 TSecr=4960283
  331 3.358610294  10.6.15.144 → 192.168.1.16 SSH 1514 Server: Encrypted packet (len=1448)
  332 3.358614161 192.168.1.16 → 10.6.15.144  TCP 66 59298 → 22 [ACK] Seq=5169 Ack=206161 Win=3666 Len=0 TSval=4363939 TSecr=4960283
  333 3.359546732 192.168.1.16 → 10.6.15.144  SSH 206 Client: Encrypted packet (len=140)
  334 3.363576888 192.168.1.16 → 10.6.15.144  SSH 614 Client: Encrypted packet (len=548)
  335 3.369305101  10.6.15.144 → 192.168.1.16 SSH 1514 Server: Encrypted packet (len=1448)
  336 3.369463268  10.6.15.144 → 192.168.1.16 SSH 1514 Server: Encrypted packet (len=1448)
  337 3.369475212 192.168.1.16 → 10.6.15.144  TCP 66 59298 → 22 [ACK] Seq=5857 Ack=209057 Win=3666 Len=0 TSval=4363942 TSecr=4960286
  338 3.369652003  10.6.15.144 → 192.168.1.16 SSH 1514 Server: Encrypted packet (len=1448)
  339 3.369968654  10.6.15.144 → 192.168.1.16 SSH 1514 Server: Encrypted packet (len=1448)
  340 3.369978626 192.168.1.16 → 10.6.15.144  TCP 66 59298 → 22 [ACK] Seq=5857 Ack=211953 Win=3666 Len=0 TSval=4363942 TSecr=4960286
  341 3.373960920  10.6.15.144 → 192.168.1.16 TCP 66 22 → 59298 [ACK] Seq=211953 Ack=5857 Win=1452 Len=0 TSval=4960287 TSecr=4363940
  342 3.380602261  10.6.15.144 → 192.168.1.16 SSH 1514 Server: Encrypted packet (len=1448)
  343 3.380788903  10.6.15.144 → 192.168.1.16 SSH 1514 Server: Encrypted packet (len=1448)
  344 3.380800266 192.168.1.16 → 10.6.15.144  TCP 66 59298 → 22 [ACK] Seq=5857 Ack=214849 Win=3666 Len=0 TSval=4363945 TSecr=4960288
  345 3.380984826  10.6.15.144 → 192.168.1.16 SSH 1514 Server: Encrypted packet (len=1448)
  346 3.381360285  10.6.15.144 → 192.168.1.16 SSH 1514 Server: Encrypted packet (len=1448)
  347 3.381378099 192.168.1.16 → 10.6.15.144  TCP 66 59298 → 22 [ACK] Seq=5857 Ack=217745 Win=3666 Len=0 TSval=4363945 TSecr=4960288
