    1 0.000000000 192.168.1.16 → 54.76.71.168 TCP 128 42414 → 8282 [PSH, ACK] Seq=1 Ack=1 Win=296 Len=62 TSval=4378536 TSecr=608486935
    2 1.760002937 192.168.1.16 → 54.76.71.168 TCP 128 [TCP Retransmission] 42414 → 8282 [PSH, ACK] Seq=1 Ack=1 Win=296 Len=62 TSval=4378976 TSecr=608486935
    3 4.811996084  10.6.15.144 → 192.168.1.16 SSH 158 Server: Encrypted packet (len=92)
    4 4.828009661 192.168.1.16 → 10.6.15.144  SSH 138 Client: Encrypted packet (len=72)
    5 4.829078422 192.168.1.16 → 10.6.15.144  SSH 1062 Client: Encrypted packet (len=996)
    6 4.838812781  10.6.15.144 → 192.168.1.16 TCP 66 22 → 59298 [ACK] Seq=93 Ack=73 Win=1452 Len=0 TSval=4976089 TSecr=4379739
    7 4.839328945  10.6.15.144 → 192.168.1.16 SSH 102 Server: Encrypted packet (len=36)
    8 4.843439744  10.6.15.144 → 192.168.1.16 SSH 354 Server: Encrypted packet (len=288)
    9 4.843509694 192.168.1.16 → 10.6.15.144  TCP 66 59298 → 22 [ACK] Seq=1069 Ack=417 Win=3666 Len=0 TSval=4379746 TSecr=4976089
   10 4.879654121  10.6.15.144 → 192.168.1.16 SSH 110 Server: Encrypted packet (len=44)
   11 4.880010522 192.168.1.16 → 10.6.15.144  SSH 166 Client: Encrypted packet (len=100)
   12 4.881980672  10.6.15.144 → 192.168.1.16 SSH 102 Server: Encrypted packet (len=36)
   13 4.882239913 192.168.1.16 → 10.6.15.144  SSH 158 Client: Encrypted packet (len=92)
   14 4.886915037  10.6.15.144 → 192.168.1.16 SSH 102 Server: Encrypted packet (len=36)
   15 4.887231798 192.168.1.16 → 10.6.15.144  SSH 158 Client: Encrypted packet (len=92)
   16 4.891521809  10.6.15.144 → 192.168.1.16 TCP 66 22 → 59298 [ACK] Seq=533 Ack=1261 Win=1452 Len=0 TSval=4976103 TSecr=4379756
   17 4.894377743  10.6.15.144 → 192.168.1.16 SSH 138 Server: Encrypted packet (len=72)
   18 4.894714750 192.168.1.16 → 10.6.15.144  SSH 158 Client: Encrypted packet (len=92)
   19 4.894999468 192.168.1.16 → 10.6.15.144  SSH 158 Client: Encrypted packet (len=92)
   20 4.904827171  10.6.15.144 → 192.168.1.16 TCP 66 22 → 59298 [ACK] Seq=605 Ack=1445 Win=1452 Len=0 TSval=4976106 TSecr=4379757
   21 4.906657793  10.6.15.144 → 192.168.1.16 SSH 102 Server: Encrypted packet (len=36)
   22 4.906982286 192.168.1.16 → 10.6.15.144  SSH 158 Client: Encrypted packet (len=92)
   23 4.926279905  10.6.15.144 → 192.168.1.16 SSH 134 Server: Encrypted packet (len=68)
   24 4.928172081  10.6.15.144 → 192.168.1.16 SSH 182 Server: Encrypted packet (len=116)
   25 4.928243628 192.168.1.16 → 10.6.15.144  TCP 66 59298 → 22 [ACK] Seq=1629 Ack=825 Win=3666 Len=0 TSval=4379768 TSecr=4976111
   26 4.928494438 192.168.1.16 → 10.6.15.144  SSH 134 Client: Encrypted packet (len=68)
   27 4.934415188  10.6.15.144 → 192.168.1.16 SSH 182 Server: Encrypted packet (len=116)
   28 4.934701274 192.168.1.16 → 10.6.15.144  SSH 134 Client: Encrypted packet (len=68)
   29 4.938670647  10.6.15.144 → 192.168.1.16 SSH 102 Server: Encrypted packet (len=36)
   30 4.938986653 192.168.1.16 → 10.6.15.144  SSH 158 Client: Encrypted packet (len=92)
   31 4.940240655  10.6.15.144 → 192.168.1.16 SSH 1514 Server: Encrypted packet (len=1448)
   32 4.946043371  10.6.15.144 → 192.168.1.16 SSH 1514 Server: Encrypted packet (len=1448)
   33 4.946063630 192.168.1.16 → 10.6.15.144  TCP 66 59298 → 22 [ACK] Seq=1857 Ack=3873 Win=3666 Len=0 TSval=4379772 TSecr=4976114
   34 4.949235879  10.6.15.144 → 192.168.1.16 SSH 1514 Server: Encrypted packet (len=1448)
   35 4.956122220  10.6.15.144 → 192.168.1.16 SSH 1514 Server: Encrypted packet (len=1448)
   36 4.956142127 192.168.1.16 → 10.6.15.144  TCP 66 59298 → 22 [ACK] Seq=1857 Ack=6769 Win=3666 Len=0 TSval=4379775 TSecr=4976117
   37 4.956304468  10.6.15.144 → 192.168.1.16 SSH 1514 Server: Encrypted packet (len=1448)
   38 4.967038131  10.6.15.144 → 192.168.1.16 SSH 1514 Server: Encrypted packet (len=1448)
   39 4.967058937 192.168.1.16 → 10.6.15.144  TCP 66 59298 → 22 [ACK] Seq=1857 Ack=9665 Win=3666 Len=0 TSval=4379777 TSecr=4976118
   40 4.967219557  10.6.15.144 → 192.168.1.16 SSH 1514 Server: Encrypted packet (len=1448)
   41 4.980603549  10.6.15.144 → 192.168.1.16 SSH 1514 Server: [TCP Previous segment not captured] , Encrypted packet (len=1448)
   42 4.980626160 192.168.1.16 → 10.6.15.144  TCP 78 59298 → 22 [ACK] Seq=1857 Ack=11113 Win=3666 Len=0 TSval=4379781 TSecr=4976121 SLE=12561 SRE=14009
   43 4.991860442  10.6.15.144 → 192.168.1.16 SSH 1514 Server: Encrypted packet (len=1448)
   44 4.991886502 192.168.1.16 → 10.6.15.144  TCP 78 [TCP Dup ACK 42#1] 59298 → 22 [ACK] Seq=1857 Ack=11113 Win=3666 Len=0 TSval=4379783 TSecr=4976121 SLE=12561 SRE=15457
   45 4.991905698  10.6.15.144 → 192.168.1.16 SSH 482 Server: Encrypted packet (len=416)
   46 4.991912069 192.168.1.16 → 10.6.15.144  TCP 78 [TCP Dup ACK 42#2] 59298 → 22 [ACK] Seq=1857 Ack=11113 Win=3666 Len=0 TSval=4379783 TSecr=4976121 SLE=12561 SRE=15873
   47 5.002558429  10.6.15.144 → 192.168.1.16 SSH 1514 Server: [TCP Fast Retransmission] , Encrypted packet (len=1448)
   48 5.002591157 192.168.1.16 → 10.6.15.144  TCP 66 59298 → 22 [ACK] Seq=1857 Ack=15873 Win=3666 Len=0 TSval=4379786 TSecr=4976130
   49 5.003136548 192.168.1.16 → 10.6.15.144  SSH 134 Client: Encrypted packet (len=68)
   50 5.005247215 192.168.1.16 → 10.6.15.144  SSH 134 Client: Encrypted packet (len=68)
   51 5.009489211 192.168.1.16 → 10.6.15.144  SSH 134 Client: Encrypted packet (len=68)
   52 5.013494056 192.168.1.16 → 10.6.15.144  SSH 134 Client: Encrypted packet (len=68)
   53 5.015170141  10.6.15.144 → 192.168.1.16 TCP 66 22 → 59298 [ACK] Seq=15873 Ack=1993 Win=1452 Len=0 TSval=4976133 TSecr=4379786
   54 5.015773827 192.168.1.16 → 10.6.15.144  SSH 134 Client: Encrypted packet (len=68)
   55 5.023551449  10.6.15.144 → 192.168.1.16 TCP 66 22 → 59298 [ACK] Seq=15873 Ack=2129 Win=1452 Len=0 TSval=4976135 TSecr=4379788
   56 5.064357487  10.6.15.144 → 192.168.1.16 TCP 66 22 → 59298 [ACK] Seq=15873 Ack=2197 Win=1452 Len=0 TSval=4976146 TSecr=4379789
   57 5.471951502 192.168.1.16 → 54.76.71.168 TCP 128 [TCP Retransmission] 42414 → 8282 [PSH, ACK] Seq=1 Ack=1 Win=296 Len=62 TSval=4379904 TSecr=608486935
   58 5.495717337 192.168.1.16 → 10.6.15.144  SSH 262 Client: Encrypted packet (len=196)
   59 5.505736099  10.6.15.144 → 192.168.1.16 TCP 66 22 → 59298 [ACK] Seq=15873 Ack=2393 Win=1452 Len=0 TSval=4976256 TSecr=4379909
   60 5.553666030  10.6.15.144 → 192.168.1.16 SSH 270 Server: Encrypted packet (len=204)
   61 5.595949477 192.168.1.16 → 10.6.15.144  TCP 66 59298 → 22 [ACK] Seq=2393 Ack=16077 Win=3666 Len=0 TSval=4379935 TSecr=4976268
   62 5.634216818 54.76.71.168 → 192.168.1.16 TCP 78 8282 → 42414 [ACK] Seq=1 Ack=63 Win=121 Len=0 TSval=608491880 TSecr=4379904 SLE=1 SRE=63
   63 11.681911073  10.6.15.144 → 192.168.1.16 SSH 134 Server: Encrypted packet (len=68)
   64 11.681935108 192.168.1.16 → 10.6.15.144  TCP 66 59298 → 22 [ACK] Seq=2393 Ack=16145 Win=3666 Len=0 TSval=4381456 TSecr=4977701
   65 11.681950051  10.6.15.144 → 192.168.1.16 SSH 102 Server: Encrypted packet (len=36)
   66 11.681956216 192.168.1.16 → 10.6.15.144  TCP 66 59298 → 22 [ACK] Seq=2393 Ack=16181 Win=3666 Len=0 TSval=4381456 TSecr=4977701
   67 11.681961813  10.6.15.144 → 192.168.1.16 SSH 102 Server: [TCP Spurious Retransmission] , Encrypted packet (len=36)
   68 11.681965527 192.168.1.16 → 10.6.15.144  TCP 78 [TCP Dup ACK 66#1] 59298 → 22 [ACK] Seq=2393 Ack=16181 Win=3666 Len=0 TSval=4381456 TSecr=4977717 SLE=16145 SRE=16181
   69 11.682254803 192.168.1.16 → 10.6.15.144  SSH 138 Client: Encrypted packet (len=72)
   70 11.682799372  10.6.15.144 → 192.168.1.16 SSH 170 Server: [TCP Spurious Retransmission] , Encrypted packet (len=104)
   71 11.682822401 192.168.1.16 → 10.6.15.144  TCP 78 [TCP Dup ACK 66#2] 59298 → 22 [ACK] Seq=2465 Ack=16181 Win=3666 Len=0 TSval=4381456 TSecr=4977798 SLE=16077 SRE=16181
   72 11.691888000  10.6.15.144 → 192.168.1.16 TCP 66 22 → 59298 [ACK] Seq=16181 Ack=2465 Win=1452 Len=0 TSval=4977802 TSecr=4381456
   73 11.691905711  10.6.15.144 → 192.168.1.16 SSH 102 Server: Encrypted packet (len=36)
   74 11.691914277 192.168.1.16 → 10.6.15.144  TCP 66 59298 → 22 [ACK] Seq=2465 Ack=16217 Win=3666 Len=0 TSval=4381458 TSecr=4977803
   75 14.689918151  10.6.15.144 → 192.168.1.16 SSH 126 Server: Encrypted packet (len=60)
   76 14.689942249 192.168.1.16 → 10.6.15.144  TCP 66 59298 → 22 [ACK] Seq=2465 Ack=16277 Win=3666 Len=0 TSval=4382208 TSecr=4978353
   77 14.690196535 192.168.1.16 → 10.6.15.144  SSH 102 Client: Encrypted packet (len=36)
   78 14.690603770  10.6.15.144 → 192.168.1.16 SSH 102 Server: Encrypted packet (len=36)
   79 14.690750137 192.168.1.16 → 10.6.15.144  SSH 102 Client: Encrypted packet (len=36)
   80 14.691099366  10.6.15.144 → 192.168.1.16 SSH 102 Server: [TCP Spurious Retransmission] , Encrypted packet (len=36)
   81 14.691108525 192.168.1.16 → 10.6.15.144  TCP 78 [TCP Dup ACK 79#1] 59298 → 22 [ACK] Seq=2537 Ack=16313 Win=3666 Len=0 TSval=4382208 TSecr=4978389 SLE=16277 SRE=16313
   82 14.691547293  10.6.15.144 → 192.168.1.16 SSH 162 Server: [TCP Spurious Retransmission] , Encrypted packet (len=96)
   83 14.691568052 192.168.1.16 → 10.6.15.144  TCP 78 [TCP Dup ACK 79#2] 59298 → 22 [ACK] Seq=2537 Ack=16313 Win=3666 Len=0 TSval=4382208 TSecr=4978517 SLE=16217 SRE=16313
   84 14.700163471  10.6.15.144 → 192.168.1.16 SSH 102 Server: Encrypted packet (len=36)
   85 14.700184795 192.168.1.16 → 10.6.15.144  TCP 66 59298 → 22 [ACK] Seq=2537 Ack=16349 Win=3666 Len=0 TSval=4382211 TSecr=4978555
   86 14.745562639  10.6.15.144 → 192.168.1.16 TCP 66 22 → 59298 [ACK] Seq=16349 Ack=2537 Win=1452 Len=0 TSval=4978565 TSecr=4382208
   87 15.681961697  10.6.15.144 → 192.168.1.16 SSH 166 Server: Encrypted packet (len=100)
   88 15.681988460 192.168.1.16 → 10.6.15.144  TCP 66 59298 → 22 [ACK] Seq=2537 Ack=16449 Win=3666 Len=0 TSval=4382456 TSecr=4978625
   89 15.682325948  10.6.15.144 → 192.168.1.16 SSH 102 Server: Encrypted packet (len=36)
   90 15.682337731 192.168.1.16 → 10.6.15.144  TCP 66 59298 → 22 [ACK] Seq=2537 Ack=16485 Win=3666 Len=0 TSval=4382456 TSecr=4978625
   91 15.682814666  10.6.15.144 → 192.168.1.16 SSH 166 Server: Encrypted packet (len=100)
   92 15.682823728 192.168.1.16 → 10.6.15.144  TCP 66 59298 → 22 [ACK] Seq=2537 Ack=16585 Win=3666 Len=0 TSval=4382456 TSecr=4978644
   93 15.683301805  10.6.15.144 → 192.168.1.16 SSH 102 Server: Encrypted packet (len=36)
   94 15.683320094 192.168.1.16 → 10.6.15.144  TCP 66 59298 → 22 [ACK] Seq=2537 Ack=16621 Win=3666 Len=0 TSval=4382456 TSecr=4978716
   95 15.961349586 192.168.1.16 → 10.6.15.144  SSH 1514 Client: Encrypted packet (len=1448)
   96 15.962999604 192.168.1.16 → 10.6.15.144  SSH 342 Client: Encrypted packet (len=276)
   97 15.973116293  10.6.15.144 → 192.168.1.16 TCP 66 22 → 59298 [ACK] Seq=16621 Ack=4261 Win=1447 Len=0 TSval=4978873 TSecr=4382526
   98 15.983396963  10.6.15.144 → 192.168.1.16 SSH 134 Server: Encrypted packet (len=68)
   99 15.983424008 192.168.1.16 → 10.6.15.144  TCP 66 59298 → 22 [ACK] Seq=4261 Ack=16689 Win=3666 Len=0 TSval=4382531 TSecr=4978875
  100 17.671401842  10.6.15.144 → 192.168.1.16 SSH 918 Server: Encrypted packet (len=852)
  101 17.671422268 192.168.1.16 → 10.6.15.144  TCP 66 59298 → 22 [ACK] Seq=4261 Ack=17541 Win=3666 Len=0 TSval=4382953 TSecr=4978904
  102 17.671880161  10.6.15.144 → 192.168.1.16 SSH 430 Server: Encrypted packet (len=364)
  103 17.671885905 192.168.1.16 → 10.6.15.144  TCP 66 59298 → 22 [ACK] Seq=4261 Ack=17905 Win=3666 Len=0 TSval=4382953 TSecr=4978905
  104 17.672364128 192.168.1.16 → 10.6.15.144  SSH 134 Client: Encrypted packet (len=68)
  105 17.673941927  10.6.15.144 → 192.168.1.16 SSH 430 Server: [TCP Spurious Retransmission] , Encrypted packet (len=364)
  106 17.673952200 192.168.1.16 → 10.6.15.144  TCP 78 [TCP Dup ACK 103#1] 59298 → 22 [ACK] Seq=4329 Ack=17905 Win=3666 Len=0 TSval=4382954 TSecr=4979049 SLE=17541 SRE=17905
  107 17.718304874  10.6.15.144 → 192.168.1.16 TCP 66 22 → 59298 [ACK] Seq=17905 Ack=4329 Win=1452 Len=0 TSval=4979310 TSecr=4382954
  108 25.666256427  10.6.15.144 → 192.168.1.16 SSH 126 Server: Encrypted packet (len=60)
  109 25.666281223 192.168.1.16 → 10.6.15.144  TCP 66 59298 → 22 [ACK] Seq=4329 Ack=17965 Win=3666 Len=0 TSval=4384952 TSecr=4981112
  110 25.666619280  10.6.15.144 → 192.168.1.16 SSH 102 Server: Encrypted packet (len=36)
  111 25.666627576 192.168.1.16 → 10.6.15.144  TCP 66 59298 → 22 [ACK] Seq=4329 Ack=18001 Win=3666 Len=0 TSval=4384952 TSecr=4981112
  112 25.667145917  10.6.15.144 → 192.168.1.16 SSH 186 Server: Encrypted packet (len=120)
  113 25.667163757 192.168.1.16 → 10.6.15.144  TCP 66 59298 → 22 [ACK] Seq=4329 Ack=18121 Win=3666 Len=0 TSval=4384952 TSecr=4981118
  114 25.676771993  10.6.15.144 → 192.168.1.16 SSH 330 Server: Encrypted packet (len=264)
  115 25.676788210 192.168.1.16 → 10.6.15.144  TCP 66 59298 → 22 [ACK] Seq=4329 Ack=18385 Win=3666 Len=0 TSval=4384955 TSecr=4981299
  116 26.689952221  10.6.15.144 → 192.168.1.16 SSH 138 Server: Encrypted packet (len=72)
  117 26.689969079 192.168.1.16 → 10.6.15.144  TCP 66 59298 → 22 [ACK] Seq=4329 Ack=18457 Win=3666 Len=0 TSval=4385208 TSecr=4981504
  118 26.690195536 192.168.1.16 → 10.6.15.144  SSH 102 Client: Encrypted packet (len=36)
  119 26.698537322  10.6.15.144 → 192.168.1.16 TCP 66 22 → 59298 [ACK] Seq=18457 Ack=4365 Win=1452 Len=0 TSval=4981555 TSecr=4385208
