    1 0.000000000 192.168.1.12 → 10.6.15.156  SSH 158 Client: Encrypted packet (len=92)
    2 0.000010929 192.168.1.12 → 10.6.15.156  TCP 66 54766 → 22 [ACK] Seq=93 Ack=1725 Win=6155 Len=0 TSval=7944232 TSecr=14875726
    3 0.000012975 192.168.1.12 → 10.6.15.156  TCP 66 54766 → 22 [ACK] Seq=93 Ack=3377 Win=6155 Len=0 TSval=7944232 TSecr=14875730
    4 0.000014771 192.168.1.12 → 10.6.15.156  TCP 66 54766 → 22 [ACK] Seq=93 Ack=3533 Win=6155 Len=0 TSval=7944256 TSecr=14875743
    5 0.000492951 192.168.1.12 → 10.6.15.156  SSH 586 Client: Encrypted packet (len=520)
    6 0.001091627  10.6.15.156 → 192.168.1.12 SSH 214 Server: Encrypted packet (len=148)
    7 0.001113346  10.6.15.156 → 192.168.1.12 SSH 182 Server: Encrypted packet (len=116)
    8 0.001185815 192.168.1.12 → 10.6.15.156  TCP 66 54766 → 22 [ACK] Seq=613 Ack=3797 Win=6155 Len=0 TSval=7944330 TSecr=14875757
    9 0.002166360  10.6.15.156 → 192.168.1.12 TCP 66 22 → 54766 [ACK] Seq=3797 Ack=613 Win=1452 Len=0 TSval=14875828 TSecr=7944203
   10 0.004511781  10.6.15.156 → 192.168.1.12 SSH 142 Server: Encrypted packet (len=76)
   11 0.004605189 192.168.1.12 → 10.6.15.156  TCP 66 54766 → 22 [ACK] Seq=613 Ack=3873 Win=6155 Len=0 TSval=7944331 TSecr=14875828
   12 0.045012729  10.6.15.156 → 192.168.1.12 SSH 238 Server: Encrypted packet (len=172)
   13 0.045099383 192.168.1.12 → 10.6.15.156  TCP 66 54766 → 22 [ACK] Seq=613 Ack=4045 Win=6155 Len=0 TSval=7944341 TSecr=14875839
   14 0.115643517  10.6.15.156 → 192.168.1.12 SSH 390 Server: Encrypted packet (len=324)
   15 0.115734839 192.168.1.12 → 10.6.15.156  TCP 66 54766 → 22 [ACK] Seq=613 Ack=4369 Win=6155 Len=0 TSval=7944358 TSecr=14875856
   16 0.147464589  10.6.15.156 → 192.168.1.12 SSH 206 Server: Encrypted packet (len=140)
   17 0.147550425 192.168.1.12 → 10.6.15.156  TCP 66 54766 → 22 [ACK] Seq=613 Ack=4509 Win=6155 Len=0 TSval=7944366 TSecr=14875864
   18 0.148268705 192.168.1.12 → 10.6.15.156  SSH 438 Client: Encrypted packet (len=372)
   19 0.149027968  10.6.15.156 → 192.168.1.12 SSH 174 Server: Encrypted packet (len=108)
   20 0.170073594  10.6.15.156 → 192.168.1.12 SSH 334 Server: Encrypted packet (len=268)
   21 0.170095565 192.168.1.12 → 10.6.15.156  SSH 790 Client: Encrypted packet (len=724)
   22 0.201421244  10.6.15.156 → 192.168.1.12 SSH 878 Server: Encrypted packet (len=812)
   23 0.202780443 192.168.1.12 → 10.6.15.156  SSH 134 Client: Encrypted packet (len=68)
   24 0.253048844  10.6.15.156 → 192.168.1.12 TCP 66 22 → 54766 [ACK] Seq=5697 Ack=1777 Win=1452 Len=0 TSval=14875891 TSecr=7944380
   25 0.266358357  10.6.15.156 → 192.168.1.12 SSH 374 Server: Encrypted packet (len=308)
   26 0.298439060  10.6.15.156 → 192.168.1.12 SSH 174 Server: Encrypted packet (len=108)
   27 0.334387450  10.6.15.156 → 192.168.1.12 SSH 1510 Server: Encrypted packet (len=1444)
   28 0.723945148 192.168.1.12 → 10.6.15.156  SSH 470 Client: Encrypted packet (len=404)
   29 0.723955598 192.168.1.12 → 10.6.15.156  TCP 66 54766 → 22 [ACK] Seq=2181 Ack=6113 Win=6155 Len=0 TSval=7944404 TSecr=14875894
   30 0.723957596 192.168.1.12 → 10.6.15.156  TCP 66 54766 → 22 [ACK] Seq=2181 Ack=7557 Win=6155 Len=0 TSval=7944430 TSecr=14875910
   31 0.724683147  10.6.15.156 → 192.168.1.12 SSH 238 Server: Encrypted packet (len=172)
   32 0.724718725  10.6.15.156 → 192.168.1.12 SSH 238 Server: Encrypted packet (len=172)
   33 0.724748697  10.6.15.156 → 192.168.1.12 SSH 238 Server: Encrypted packet (len=172)
   34 0.724764491 192.168.1.12 → 10.6.15.156  TCP 66 54766 → 22 [ACK] Seq=2181 Ack=8073 Win=6155 Len=0 TSval=7944511 TSecr=14875951
   35 0.724787709  10.6.15.156 → 192.168.1.12 SSH 214 Server: Encrypted packet (len=148)
   36 0.724837941 192.168.1.12 → 10.6.15.156  TCP 66 54766 → 22 [ACK] Seq=2181 Ack=8221 Win=6155 Len=0 TSval=7944511 TSecr=14876007
   37 0.726502076  10.6.15.156 → 192.168.1.12 TCP 66 22 → 54766 [ACK] Seq=8221 Ack=2181 Win=1452 Len=0 TSval=14876009 TSecr=7944393
   38 0.729797417  10.6.15.156 → 192.168.1.12 SSH 142 Server: Encrypted packet (len=76)
   39 0.729882552 192.168.1.12 → 10.6.15.156  TCP 66 54766 → 22 [ACK] Seq=2181 Ack=8297 Win=6155 Len=0 TSval=7944512 TSecr=14876010
   40 0.795421040  10.6.15.156 → 192.168.1.12 SSH 1222 Server: Encrypted packet (len=1156)
   41 0.795508981 192.168.1.12 → 10.6.15.156  TCP 66 54766 → 22 [ACK] Seq=2181 Ack=9453 Win=6155 Len=0 TSval=7944528 TSecr=14876026
   42 0.796359072 192.168.1.12 → 10.6.15.156  SSH 134 Client: Encrypted packet (len=68)
   43 0.837013854  10.6.15.156 → 192.168.1.12 TCP 66 22 → 54766 [ACK] Seq=9453 Ack=2249 Win=1452 Len=0 TSval=14876037 TSecr=7944529
   44 0.837036515 192.168.1.12 → 10.6.15.156  SSH 174 Client: Encrypted packet (len=108)
   45 0.838742405  10.6.15.156 → 192.168.1.12 TCP 66 22 → 54766 [ACK] Seq=9453 Ack=2357 Win=1452 Len=0 TSval=14876037 TSecr=7944539
   46 0.948559326  10.6.15.156 → 192.168.1.12 SSH 182 Server: Encrypted packet (len=116)
   47 1.016682141  10.6.15.156 → 192.168.1.12 SSH 278 Server: Encrypted packet (len=212)
   48 1.071595022  10.6.15.156 → 192.168.1.12 SSH 214 Server: Encrypted packet (len=148)
   49 1.116948421  10.6.15.156 → 192.168.1.12 SSH 766 Server: Encrypted packet (len=700)
   50 1.444002835 192.168.1.12 → 10.6.15.156  TCP 66 54766 → 22 [ACK] Seq=2357 Ack=9569 Win=6155 Len=0 TSval=7944578 TSecr=14876064
   51 1.444013144 192.168.1.12 → 10.6.15.156  TCP 66 54766 → 22 [ACK] Seq=2357 Ack=9781 Win=6155 Len=0 TSval=7944584 TSecr=14876081
   52 1.444014911 192.168.1.12 → 10.6.15.156  TCP 66 54766 → 22 [ACK] Seq=2357 Ack=9929 Win=6155 Len=0 TSval=7944597 TSecr=14876095
   53 1.444016709 192.168.1.12 → 10.6.15.156  TCP 66 54766 → 22 [ACK] Seq=2357 Ack=10629 Win=6155 Len=0 TSval=7944609 TSecr=14876107
   54 1.444018935 192.168.1.12 → 10.6.15.156  SSH 134 Client: Encrypted packet (len=68)
   55 1.445271670 192.168.1.12 → 10.6.15.156  SSH 206 Client: Encrypted packet (len=140)
   56 1.445722204  10.6.15.156 → 192.168.1.12 SSH 406 Server: Encrypted packet (len=340)
   57 1.445750440  10.6.15.156 → 192.168.1.12 SSH 406 Server: Encrypted packet (len=340)
   58 1.445822550 192.168.1.12 → 10.6.15.156  TCP 66 54766 → 22 [ACK] Seq=2565 Ack=11309 Win=6155 Len=0 TSval=7944691 TSecr=14876119
   59 1.446937146  10.6.15.156 → 192.168.1.12 TCP 66 22 → 54766 [ACK] Seq=11309 Ack=2425 Win=1452 Len=0 TSval=14876189 TSecr=7944609
   60 1.447648265  10.6.15.156 → 192.168.1.12 TCP 66 22 → 54766 [ACK] Seq=11309 Ack=2565 Win=1452 Len=0 TSval=14876189 TSecr=7944691
   61 1.466071344  10.6.15.156 → 192.168.1.12 SSH 302 Server: Encrypted packet (len=236)
   62 1.484029307  10.6.15.156 → 192.168.1.12 SSH 254 Server: Encrypted packet (len=188)
   63 1.484111809 192.168.1.12 → 10.6.15.156  TCP 66 54766 → 22 [ACK] Seq=2565 Ack=11733 Win=6155 Len=0 TSval=7944701 TSecr=14876194
   64 1.484944373 192.168.1.12 → 10.6.15.156  SSH 174 Client: Encrypted packet (len=108)
   65 1.522665735  10.6.15.156 → 192.168.1.12 SSH 374 Server: Encrypted packet (len=308)
   66 1.563089093 192.168.1.12 → 10.6.15.156  SSH 214 Client: Encrypted packet (len=148)
   67 1.601735252  10.6.15.156 → 192.168.1.12 SSH 214 Server: Encrypted packet (len=148)
   68 1.603405002 192.168.1.12 → 10.6.15.156  SSH 134 Client: Encrypted packet (len=68)
   69 1.603661959 192.168.1.12 → 10.6.15.156  SSH 134 Client: Encrypted packet (len=68)
   70 1.605116879  10.6.15.156 → 192.168.1.12 TCP 66 22 → 54766 [ACK] Seq=12189 Ack=2957 Win=1452 Len=0 TSval=14876229 TSecr=7944730
   71 1.619200038 192.168.1.12 → 10.6.15.156  SSH 214 Client: Encrypted packet (len=148)
   72 1.619610524  10.6.15.156 → 192.168.1.12 SSH 254 Server: Encrypted packet (len=188)
   73 1.659147265  10.6.15.156 → 192.168.1.12 SSH 206 Server: Encrypted packet (len=140)
   74 2.159950488 192.168.1.12 → 10.6.15.156  TCP 66 54766 → 22 [ACK] Seq=3105 Ack=12517 Win=6155 Len=0 TSval=7944744 TSecr=14876232
   75 2.159959363 192.168.1.12 → 10.6.15.156  SSH 134 Client: Encrypted packet (len=68)
   76 2.160328694 192.168.1.12 → 10.6.15.156  SSH 1198 Client: Encrypted packet (len=1132)
   77 2.163996842  10.6.15.156 → 192.168.1.12 SSH 182 Server: Encrypted packet (len=116)
   78 2.164013739  10.6.15.156 → 192.168.1.12 SSH 254 Server: Encrypted packet (len=188)
   79 2.164078009 192.168.1.12 → 10.6.15.156  TCP 66 54766 → 22 [ACK] Seq=4305 Ack=12821 Win=6155 Len=0 TSval=7944871 TSecr=14876307
   80 2.164166916  10.6.15.156 → 192.168.1.12 TCP 66 22 → 54766 [ACK] Seq=12821 Ack=4305 Win=1452 Len=0 TSval=14876368 TSecr=7944744
   81 2.165593450  10.6.15.156 → 192.168.1.12 SSH 350 Server: Encrypted packet (len=284)
   82 2.166164355 192.168.1.12 → 10.6.15.156  SSH 134 Client: Encrypted packet (len=68)
   83 2.201559951  10.6.15.156 → 192.168.1.12 SSH 262 Server: Encrypted packet (len=196)
   84 2.201584468  10.6.15.156 → 192.168.1.12 SSH 166 Server: Encrypted packet (len=100)
   85 2.201654887 192.168.1.12 → 10.6.15.156  TCP 66 54766 → 22 [ACK] Seq=4373 Ack=13401 Win=6155 Len=0 TSval=7944880 TSecr=14876378
   86 2.202588528 192.168.1.12 → 10.6.15.156  SSH 174 Client: Encrypted packet (len=108)
   87 2.204808828  10.6.15.156 → 192.168.1.12 SSH 142 Server: Encrypted packet (len=76)
   88 2.204833196 192.168.1.12 → 10.6.15.156  SSH 134 Client: Encrypted packet (len=68)
   89 2.206796947  10.6.15.156 → 192.168.1.12 SSH 166 Server: Encrypted packet (len=100)
   90 2.206820708 192.168.1.12 → 10.6.15.156  SSH 134 Client: Encrypted packet (len=68)
   91 2.207161256 192.168.1.12 → 10.6.15.156  SSH 134 Client: Encrypted packet (len=68)
   92 2.208604052  10.6.15.156 → 192.168.1.12 TCP 66 22 → 54766 [ACK] Seq=13577 Ack=4685 Win=1452 Len=0 TSval=14876380 TSecr=7944881
   93 2.220324275 192.168.1.12 → 10.6.15.156  SSH 190 Client: Encrypted packet (len=124)
   94 2.257956806  10.6.15.156 → 192.168.1.12 SSH 174 Server: Encrypted packet (len=108)
   95 2.258648726 192.168.1.12 → 10.6.15.156  SSH 166 Client: Encrypted packet (len=100)
   96 2.299789901  10.6.15.156 → 192.168.1.12 SSH 182 Server: Encrypted packet (len=116)
   97 2.299809846 192.168.1.12 → 10.6.15.156  SSH 182 Client: Encrypted packet (len=116)
   98 2.337616751  10.6.15.156 → 192.168.1.12 SSH 206 Server: Encrypted packet (len=140)
   99 2.338322849 192.168.1.12 → 10.6.15.156  SSH 166 Client: Encrypted packet (len=100)
  100 2.368479122  10.6.15.156 → 192.168.1.12 SSH 214 Server: Encrypted packet (len=148)
  101 2.424499816  10.6.15.156 → 192.168.1.12 SSH 214 Server: Encrypted packet (len=148)
  102 2.521070724  10.6.15.156 → 192.168.1.12 SSH 214 Server: Encrypted packet (len=148)
  103 2.871946929 192.168.1.12 → 10.6.15.156  SSH 182 Client: Encrypted packet (len=116)
  104 2.871958946 192.168.1.12 → 10.6.15.156  TCP 66 54766 → 22 [ACK] Seq=5241 Ack=14237 Win=6155 Len=0 TSval=7944950 TSecr=14876433
  105 2.871960704 192.168.1.12 → 10.6.15.156  TCP 66 54766 → 22 [ACK] Seq=5241 Ack=14385 Win=6155 Len=0 TSval=7944960 TSecr=14876458
  106 2.872422825 192.168.1.12 → 10.6.15.156  SSH 126 Client: Encrypted packet (len=60)
  107 2.872810413  10.6.15.156 → 192.168.1.12 SSH 214 Server: [TCP Spurious Retransmission] , Encrypted packet (len=148)
  108 2.872822928 192.168.1.12 → 10.6.15.156  TCP 78 [TCP Dup ACK 105#1] 54766 → 22 [ACK] Seq=5301 Ack=14385 Win=6155 Len=0 TSval=7945048 TSecr=14876504 SLE=14237 SRE=14385
  109 2.872830405  10.6.15.156 → 192.168.1.12 SSH 238 Server: Encrypted packet (len=172)
  110 2.872837508 192.168.1.12 → 10.6.15.156  TCP 66 54766 → 22 [ACK] Seq=5301 Ack=14557 Win=6155 Len=0 TSval=7945048 TSecr=14876515
  111 2.872851216  10.6.15.156 → 192.168.1.12 SSH 214 Server: Encrypted packet (len=148)
  112 2.872854780 192.168.1.12 → 10.6.15.156  TCP 66 54766 → 22 [ACK] Seq=5301 Ack=14705 Win=6155 Len=0 TSval=7945048 TSecr=14876532
  113 2.874068917  10.6.15.156 → 192.168.1.12 TCP 66 22 → 54766 [ACK] Seq=14705 Ack=5301 Win=1452 Len=0 TSval=14876546 TSecr=7944922
  114 2.875526001  10.6.15.156 → 192.168.1.12 SSH 214 Server: Encrypted packet (len=148)
  115 2.875543539 192.168.1.12 → 10.6.15.156  TCP 66 54766 → 22 [ACK] Seq=5301 Ack=14853 Win=6155 Len=0 TSval=7945048 TSecr=14876546
  116 2.908950310  10.6.15.156 → 192.168.1.12 SSH 230 Server: Encrypted packet (len=164)
  117 2.908967971 192.168.1.12 → 10.6.15.156  TCP 66 54766 → 22 [ACK] Seq=5301 Ack=15017 Win=6155 Len=0 TSval=7945057 TSecr=14876555
  118 2.909677903 192.168.1.12 → 10.6.15.156  SSH 166 Client: Encrypted packet (len=100)
  119 2.972150248  10.6.15.156 → 192.168.1.12 SSH 182 Server: Encrypted packet (len=116)
  120 2.972173487 192.168.1.12 → 10.6.15.156  SSH 198 Client: Encrypted packet (len=132)
  121 3.009545069  10.6.15.156 → 192.168.1.12 SSH 206 Server: Encrypted packet (len=140)
  122 3.010245451 192.168.1.12 → 10.6.15.156  SSH 174 Client: Encrypted packet (len=108)
  123 3.076775761  10.6.15.156 → 192.168.1.12 TCP 66 22 → 54766 [ACK] Seq=15273 Ack=5641 Win=1452 Len=0 TSval=14876597 TSecr=7945082
  124 3.091359171  10.6.15.156 → 192.168.1.12 SSH 110 Server: Encrypted packet (len=44)
  125 3.272110095  10.6.15.156 → 192.168.1.12 SSH 182 Server: Encrypted packet (len=116)
  126 3.591968298 192.168.1.12 → 10.6.15.156  SSH 374 Client: Encrypted packet (len=308)
  127 3.591978918 192.168.1.12 → 10.6.15.156  TCP 66 54766 → 22 [ACK] Seq=5949 Ack=15433 Win=6155 Len=0 TSval=7945165 TSecr=14876645
  128 3.592746692  10.6.15.156 → 192.168.1.12 SSH 334 Server: Encrypted packet (len=268)
  129 3.592765789 192.168.1.12 → 10.6.15.156  TCP 66 54766 → 22 [ACK] Seq=5949 Ack=15701 Win=6155 Len=0 TSval=7945228 TSecr=14876659
  130 3.592791102  10.6.15.156 → 192.168.1.12 SSH 406 Server: Encrypted packet (len=340)
  131 3.592795520 192.168.1.12 → 10.6.15.156  TCP 66 54766 → 22 [ACK] Seq=5949 Ack=16041 Win=6155 Len=0 TSval=7945228 TSecr=14876683
  132 3.594104496  10.6.15.156 → 192.168.1.12 TCP 66 22 → 54766 [ACK] Seq=16041 Ack=5949 Win=1452 Len=0 TSval=14876726 TSecr=7945102
  133 3.653199143  10.6.15.156 → 192.168.1.12 SSH 438 Server: Encrypted packet (len=372)
  134 3.653217109 192.168.1.12 → 10.6.15.156  TCP 66 54766 → 22 [ACK] Seq=5949 Ack=16413 Win=6155 Len=0 TSval=7945243 TSecr=14876741
  135 3.721228249  10.6.15.156 → 192.168.1.12 SSH 406 Server: Encrypted packet (len=340)
  136 3.721247223 192.168.1.12 → 10.6.15.156  TCP 66 54766 → 22 [ACK] Seq=5949 Ack=16753 Win=6155 Len=0 TSval=7945260 TSecr=14876758
  137 3.789905797  10.6.15.156 → 192.168.1.12 SSH 238 Server: Encrypted packet (len=172)
  138 3.789925831 192.168.1.12 → 10.6.15.156  TCP 66 54766 → 22 [ACK] Seq=5949 Ack=16925 Win=6155 Len=0 TSval=7945277 TSecr=14876772
  139 3.819515709  10.6.15.156 → 192.168.1.12 SSH 222 Server: Encrypted packet (len=156)
  140 3.874400012  10.6.15.156 → 192.168.1.12 SSH 214 Server: Encrypted packet (len=148)
  141 4.307963462 192.168.1.12 → 10.6.15.156  TCP 66 54766 → 22 [ACK] Seq=5949 Ack=17081 Win=6155 Len=0 TSval=7945284 TSecr=14876782
  142 4.307973198 192.168.1.12 → 10.6.15.156  TCP 66 54766 → 22 [ACK] Seq=5949 Ack=17229 Win=6155 Len=0 TSval=7945298 TSecr=14876796
  143 4.309160218  10.6.15.156 → 192.168.1.12 SSH 182 Server: Encrypted packet (len=116)
  144 4.309228798 192.168.1.12 → 10.6.15.156  TCP 66 54766 → 22 [ACK] Seq=5949 Ack=17345 Win=6155 Len=0 TSval=7945407 TSecr=14876853
  145 4.554825370  10.6.15.156 → 192.168.1.12 SSH 182 Server: Encrypted packet (len=116)
  146 4.623014416  10.6.15.156 → 192.168.1.12 SSH 182 Server: Encrypted packet (len=116)
  147 4.680042938  10.6.15.156 → 192.168.1.12 SSH 182 Server: Encrypted packet (len=116)
  148 5.019936808 192.168.1.12 → 10.6.15.156  TCP 66 54766 → 22 [ACK] Seq=5949 Ack=17461 Win=6155 Len=0 TSval=7945468 TSecr=14876966
  149 5.019946883 192.168.1.12 → 10.6.15.156  TCP 66 54766 → 22 [ACK] Seq=5949 Ack=17577 Win=6155 Len=0 TSval=7945485 TSecr=14876983
  150 5.019948825 192.168.1.12 → 10.6.15.156  TCP 66 54766 → 22 [ACK] Seq=5949 Ack=17693 Win=6155 Len=0 TSval=7945500 TSecr=14876997
  151 5.020641689  10.6.15.156 → 192.168.1.12 SSH 182 Server: Encrypted packet (len=116)
  152 5.020713259 192.168.1.12 → 10.6.15.156  TCP 66 54766 → 22 [ACK] Seq=5949 Ack=17809 Win=6155 Len=0 TSval=7945585 TSecr=14877021
  153 5.073882697  10.6.15.156 → 192.168.1.12 SSH 182 Server: Encrypted packet (len=116)
  154 5.073952491 192.168.1.12 → 10.6.15.156  TCP 66 54766 → 22 [ACK] Seq=5949 Ack=17925 Win=6155 Len=0 TSval=7945598 TSecr=14877096
  155 5.130450789  10.6.15.156 → 192.168.1.12 SSH 182 Server: Encrypted packet (len=116)
  156 5.130542290 192.168.1.12 → 10.6.15.156  TCP 66 54766 → 22 [ACK] Seq=5949 Ack=18041 Win=6155 Len=0 TSval=7945612 TSecr=14877110
  157 5.226998703  10.6.15.156 → 192.168.1.12 SSH 182 Server: Encrypted packet (len=116)
  158 5.779931396 192.168.1.12 → 10.6.15.156  TCP 66 54766 → 22 [ACK] Seq=5949 Ack=18157 Win=6155 Len=0 TSval=7945636 TSecr=14877134
  159 5.779940922 192.168.1.12 → 192.168.1.1  DNS 81 Standard query 0x371f A 2.ubuntu.pool.ntp.org
  160 5.780611816  10.6.15.156 → 192.168.1.12 SSH 182 Server: Encrypted packet (len=116)
  161 5.780671334 192.168.1.12 → 10.6.15.156  TCP 66 54766 → 22 [ACK] Seq=5949 Ack=18273 Win=6155 Len=0 TSval=7945775 TSecr=14877192
  162 5.780772239  10.6.15.156 → 192.168.1.12 SSH 238 Server: Encrypted packet (len=172)
  163 5.780792371 192.168.1.12 → 10.6.15.156  TCP 66 54766 → 22 [ACK] Seq=5949 Ack=18445 Win=6155 Len=0 TSval=7945775 TSecr=14877247
  164 5.780924608  10.6.15.156 → 192.168.1.12 SSH 158 Server: Encrypted packet (len=92)
  165 5.780955291 192.168.1.12 → 10.6.15.156  TCP 66 54766 → 22 [ACK] Seq=5949 Ack=18537 Win=6155 Len=0 TSval=7945775 TSecr=14877257
  166 5.781126699 192.168.1.12 → 10.6.15.156  SSH 150 Client: Encrypted packet (len=84)
  167 5.783210885  192.168.1.1 → 192.168.1.12 DNS 145 Standard query response 0x371f A 2.ubuntu.pool.ntp.org A 139.59.50.38 A 139.59.16.133 A 139.59.21.22 A 123.108.200.124
  168 5.783350794  10.6.15.156 → 192.168.1.12 TCP 66 22 → 54766 [ACK] Seq=18537 Ack=6033 Win=1452 Len=0 TSval=14877273 TSecr=7945775
  169 5.783616990 192.168.1.12 → 139.59.50.38 NTP 90 NTP Version 4, client
  170 5.907895866  10.6.15.156 → 192.168.1.12 SSH 238 Server: Encrypted packet (len=172)
  171 5.955901386 192.168.1.12 → 10.6.15.156  TCP 66 54766 → 22 [ACK] Seq=6033 Ack=18709 Win=6155 Len=0 TSval=7945819 TSecr=14877304
  172 5.975928289  10.6.15.156 → 192.168.1.12 SSH 230 Server: Encrypted packet (len=164)
  173 5.976000411 192.168.1.12 → 10.6.15.156  TCP 66 54766 → 22 [ACK] Seq=6033 Ack=18873 Win=6155 Len=0 TSval=7945824 TSecr=14877321
  174 6.032790792  10.6.15.156 → 192.168.1.12 SSH 238 Server: Encrypted packet (len=172)
  175 6.129095261  10.6.15.156 → 192.168.1.12 SSH 182 Server: Encrypted packet (len=116)
  176 6.547999338 192.168.1.12 → 10.6.15.156  TCP 66 54766 → 22 [ACK] Seq=6033 Ack=19045 Win=6155 Len=0 TSval=7945838 TSecr=14877336
  177 6.548010023 192.168.1.12 → 10.6.15.156  TCP 66 54766 → 22 [ACK] Seq=6033 Ack=19161 Win=6155 Len=0 TSval=7945862 TSecr=14877360
  178 6.549543046  10.6.15.156 → 192.168.1.12 SSH 158 Server: Encrypted packet (len=92)
  179 6.549633470 192.168.1.12 → 10.6.15.156  TCP 66 54766 → 22 [ACK] Seq=6033 Ack=19253 Win=6155 Len=0 TSval=7945967 TSecr=14877413
  180 6.549874378 192.168.1.12 → 10.6.15.156  SSH 150 Client: Encrypted packet (len=84)
  181 6.550303783  10.6.15.156 → 192.168.1.12 SSH 182 Server: Encrypted packet (len=116)
  182 6.550810098  10.6.15.156 → 192.168.1.12 SSH 182 Server: Encrypted packet (len=116)
  183 6.550818967  10.6.15.156 → 192.168.1.12 SSH 182 Server: Encrypted packet (len=116)
  184 6.550847139 192.168.1.12 → 10.6.15.156  TCP 66 54766 → 22 [ACK] Seq=6117 Ack=19601 Win=6155 Len=0 TSval=7945967 TSecr=14877417
  185 6.552067316  10.6.15.156 → 192.168.1.12 TCP 66 22 → 54766 [ACK] Seq=19601 Ack=6117 Win=1452 Len=0 TSval=14877465 TSecr=7945967
  186 6.809774179  10.6.15.156 → 192.168.1.12 SSH 182 Server: Encrypted packet (len=116)
  187 6.878032412  10.6.15.156 → 192.168.1.12 SSH 374 Server: Encrypted packet (len=308)
  188 6.935139964  10.6.15.156 → 192.168.1.12 SSH 406 Server: Encrypted packet (len=340)
  189 7.311961596 192.168.1.12 → 10.6.15.156  TCP 66 54766 → 22 [ACK] Seq=6117 Ack=19717 Win=6155 Len=0 TSval=7946043 TSecr=14877530
  190 7.311973812 192.168.1.12 → 10.6.15.156  TCP 66 54766 → 22 [ACK] Seq=6117 Ack=20025 Win=6155 Len=0 TSval=7946049 TSecr=14877547
  191 7.311976281 192.168.1.12 → 10.6.15.156  TCP 66 54766 → 22 [ACK] Seq=6117 Ack=20365 Win=6155 Len=0 TSval=7946063 TSecr=14877561
  192 7.314783981  10.6.15.156 → 192.168.1.12 SSH 406 Server: Encrypted packet (len=340)
  193 7.314825879  10.6.15.156 → 192.168.1.12 SSH 374 Server: Encrypted packet (len=308)
  194 7.314859338 192.168.1.12 → 10.6.15.156  TCP 66 54766 → 22 [ACK] Seq=6117 Ack=21013 Win=6155 Len=0 TSval=7946158 TSecr=14877585
  195 7.328881661  10.6.15.156 → 192.168.1.12 SSH 182 Server: Encrypted packet (len=116)
  196 7.328955219 192.168.1.12 → 10.6.15.156  TCP 66 54766 → 22 [ACK] Seq=6117 Ack=21129 Win=6155 Len=0 TSval=7946162 TSecr=14877660
  197 7.780224634  10.6.15.156 → 192.168.1.12 SSH 182 Server: Encrypted packet (len=116)
  198 7.780311094 192.168.1.12 → 10.6.15.156  TCP 66 54766 → 22 [ACK] Seq=6117 Ack=21245 Win=6155 Len=0 TSval=7946275 TSecr=14877772
  199 7.836561778  10.6.15.156 → 192.168.1.12 SSH 182 Server: Encrypted packet (len=116)
  200 7.836645522 192.168.1.12 → 10.6.15.156  TCP 66 54766 → 22 [ACK] Seq=6117 Ack=21361 Win=6155 Len=0 TSval=7946289 TSecr=14877787
  201 7.933286542  10.6.15.156 → 192.168.1.12 SSH 254 Server: Encrypted packet (len=188)
  202 7.933359745 192.168.1.12 → 10.6.15.156  TCP 66 54766 → 22 [ACK] Seq=6117 Ack=21549 Win=6155 Len=0 TSval=7946313 TSecr=14877811
  203 8.167941227  10.6.15.156 → 192.168.1.12 SSH 358 Server: Encrypted packet (len=292)
  204 8.168028529 192.168.1.12 → 10.6.15.156  TCP 66 54766 → 22 [ACK] Seq=6117 Ack=21841 Win=6155 Len=0 TSval=7946372 TSecr=14877868
  205 8.231255467  10.6.15.156 → 192.168.1.12 SSH 254 Server: Encrypted packet (len=188)
  206 8.231335557 192.168.1.12 → 10.6.15.156  TCP 66 54766 → 22 [ACK] Seq=6117 Ack=22029 Win=6155 Len=0 TSval=7946387 TSecr=14877885
  207 8.289692987  10.6.15.156 → 192.168.1.12 SSH 214 Server: Encrypted packet (len=148)
  208 8.289765207 192.168.1.12 → 10.6.15.156  TCP 66 54766 → 22 [ACK] Seq=6117 Ack=22177 Win=6155 Len=0 TSval=7946402 TSecr=14877899
  209 8.614837286  10.6.15.156 → 192.168.1.12 SSH 238 Server: Encrypted packet (len=172)
  210 8.614931200 192.168.1.12 → 10.6.15.156  TCP 66 54766 → 22 [ACK] Seq=6117 Ack=22349 Win=6155 Len=0 TSval=7946483 TSecr=14877981
  211 8.835259406  10.6.15.156 → 192.168.1.12 SSH 286 Server: Encrypted packet (len=220)
  212 8.835349273 192.168.1.12 → 10.6.15.156  TCP 66 54766 → 22 [ACK] Seq=6117 Ack=22569 Win=6155 Len=0 TSval=7946538 TSecr=14878036
  213 9.065069756  10.6.15.156 → 192.168.1.12 SSH 182 Server: Encrypted packet (len=116)
  214 9.065160369 192.168.1.12 → 10.6.15.156  TCP 66 54766 → 22 [ACK] Seq=6117 Ack=22685 Win=6155 Len=0 TSval=7946596 TSecr=14878094
  215 9.133160208  10.6.15.156 → 192.168.1.12 SSH 358 Server: Encrypted packet (len=292)
  216 9.133249710 192.168.1.12 → 10.6.15.156  TCP 66 54766 → 22 [ACK] Seq=6117 Ack=22977 Win=6155 Len=0 TSval=7946613 TSecr=14878111
  217 9.191550897  10.6.15.156 → 192.168.1.12 SSH 358 Server: Encrypted packet (len=292)
  218 9.191629033 192.168.1.12 → 10.6.15.156  TCP 66 54766 → 22 [ACK] Seq=6117 Ack=23269 Win=6155 Len=0 TSval=7946627 TSecr=14878125
  219 9.286225346  10.6.15.156 → 192.168.1.12 SSH 214 Server: Encrypted packet (len=148)
  220 9.286316007 192.168.1.12 → 10.6.15.156  TCP 66 54766 → 22 [ACK] Seq=6117 Ack=23417 Win=6155 Len=0 TSval=7946651 TSecr=14878149
  221 9.315847832  10.6.15.156 → 192.168.1.12 SSH 102 Server: Encrypted packet (len=36)
  222 9.315929938 192.168.1.12 → 10.6.15.156  TCP 66 54766 → 22 [ACK] Seq=6117 Ack=23453 Win=6155 Len=0 TSval=7946659 TSecr=14878156
  223 9.345763564  10.6.15.156 → 192.168.1.12 SSH 150 Server: Encrypted packet (len=84)
  224 9.345834128 192.168.1.12 → 10.6.15.156  TCP 66 54766 → 22 [ACK] Seq=6117 Ack=23537 Win=6155 Len=0 TSval=7946666 TSecr=14878164
  225 9.346027914 192.168.1.12 → 10.6.15.156  SSH 150 Client: Encrypted packet (len=84)
  226 9.347880785  10.6.15.156 → 192.168.1.12 TCP 66 22 → 54766 [ACK] Seq=23537 Ack=6201 Win=1452 Len=0 TSval=14878164 TSecr=7946666
  227 9.623296928  10.6.15.156 → 192.168.1.12 SSH 150 Server: Encrypted packet (len=84)
  228 9.623583168 192.168.1.12 → 10.6.15.156  SSH 150 Client: Encrypted packet (len=84)
  229 9.625614658  10.6.15.156 → 192.168.1.12 TCP 66 22 → 54766 [ACK] Seq=23621 Ack=6285 Win=1452 Len=0 TSval=14878234 TSecr=7946735
  230 9.737148630  10.6.15.156 → 192.168.1.12 SSH 182 Server: Encrypted packet (len=116)
  231 9.791923238 192.168.1.12 → 10.6.15.156  TCP 66 54766 → 22 [ACK] Seq=6285 Ack=23737 Win=6155 Len=0 TSval=7946778 TSecr=14878262
  232 9.966572763  10.6.15.156 → 192.168.1.12 SSH 182 Server: Encrypted packet (len=116)
  233 9.966648559 192.168.1.12 → 10.6.15.156  TCP 66 54766 → 22 [ACK] Seq=6285 Ack=23853 Win=6155 Len=0 TSval=7946821 TSecr=14878319
  234 10.034926871  10.6.15.156 → 192.168.1.12 SSH 182 Server: Encrypted packet (len=116)
  235 10.035000067 192.168.1.12 → 10.6.15.156  TCP 66 54766 → 22 [ACK] Seq=6285 Ack=23969 Win=6155 Len=0 TSval=7946838 TSecr=14878336
  236 10.091454976  10.6.15.156 → 192.168.1.12 SSH 182 Server: Encrypted packet (len=116)
  237 10.091527472 192.168.1.12 → 10.6.15.156  TCP 66 54766 → 22 [ACK] Seq=6285 Ack=24085 Win=6155 Len=0 TSval=7946852 TSecr=14878350
  238 10.418052991  10.6.15.156 → 192.168.1.12 SSH 222 Server: Encrypted packet (len=156)
  239 10.418141917 192.168.1.12 → 10.6.15.156  TCP 66 54766 → 22 [ACK] Seq=6285 Ack=24241 Win=6155 Len=0 TSval=7946934 TSecr=14878432
  240 10.486104394  10.6.15.156 → 192.168.1.12 SSH 270 Server: Encrypted packet (len=204)
  241 10.486196359 192.168.1.12 → 10.6.15.156  TCP 66 54766 → 22 [ACK] Seq=6285 Ack=24445 Win=6155 Len=0 TSval=7946951 TSecr=14878449
  242 10.542525614  10.6.15.156 → 192.168.1.12 SSH 270 Server: Encrypted packet (len=204)
  243 10.542614593 192.168.1.12 → 10.6.15.156  TCP 66 54766 → 22 [ACK] Seq=6285 Ack=24649 Win=6155 Len=0 TSval=7946965 TSecr=14878463
  244 10.638911455  10.6.15.156 → 192.168.1.12 SSH 270 Server: Encrypted packet (len=204)
  245 10.638991250 192.168.1.12 → 10.6.15.156  TCP 66 54766 → 22 [ACK] Seq=6285 Ack=24853 Win=6155 Len=0 TSval=7946989 TSecr=14878487
  246 11.319773330  10.6.15.156 → 192.168.1.12 SSH 238 Server: Encrypted packet (len=172)
  247 11.319845402 192.168.1.12 → 10.6.15.156  TCP 66 54766 → 22 [ACK] Seq=6285 Ack=25025 Win=6155 Len=0 TSval=7947159 TSecr=14878657
  248 11.388056662  10.6.15.156 → 192.168.1.12 SSH 222 Server: Encrypted packet (len=156)
  249 11.388133367 192.168.1.12 → 10.6.15.156  TCP 66 54766 → 22 [ACK] Seq=6285 Ack=25181 Win=6155 Len=0 TSval=7947177 TSecr=14878674
  250 11.445855292  10.6.15.156 → 192.168.1.12 SSH 222 Server: Encrypted packet (len=156)
  251 11.445963549 192.168.1.12 → 10.6.15.156  TCP 66 54766 → 22 [ACK] Seq=6285 Ack=25337 Win=6155 Len=0 TSval=7947191 TSecr=14878689
  252 11.547029941  10.6.15.156 → 192.168.1.12 SSH 286 Server: Encrypted packet (len=220)
  253 11.547100817 192.168.1.12 → 10.6.15.156  TCP 66 54766 → 22 [ACK] Seq=6285 Ack=25557 Win=6155 Len=0 TSval=7947216 TSecr=14878713
  254 11.698578414 192.168.1.12 → 10.6.15.156  SSH 102 Client: Encrypted packet (len=36)
  255 11.702236445  10.6.15.156 → 192.168.1.12 TCP 66 22 → 54766 [ACK] Seq=25557 Ack=6321 Win=1452 Len=0 TSval=14878753 TSecr=7947254
  256 11.702257348 192.168.1.12 → 10.6.15.156  SSH 382 Client: Encrypted packet (len=316)
  257 11.704348168  10.6.15.156 → 192.168.1.12 TCP 66 22 → 54766 [ACK] Seq=25557 Ack=6637 Win=1452 Len=0 TSval=14878753 TSecr=7947255
  258 11.705056081  10.6.15.156 → 192.168.1.12 SSH 102 Server: Encrypted packet (len=36)
  259 11.705140977 192.168.1.12 → 10.6.15.156  TCP 66 54766 → 22 [ACK] Seq=6637 Ack=25593 Win=6155 Len=0 TSval=7947256 TSecr=14878754
  260 11.706611361  10.6.15.156 → 192.168.1.12 SSH 210 Server: Encrypted packet (len=144)
  261 11.706681392 192.168.1.12 → 10.6.15.156  TCP 66 54766 → 22 [ACK] Seq=6637 Ack=25737 Win=6155 Len=0 TSval=7947256 TSecr=14878754
  262 11.706924801 192.168.1.12 → 10.6.15.156  SSH 138 Client: Encrypted packet (len=72)
  263 11.744670366  10.6.15.156 → 192.168.1.12 TCP 66 22 → 54766 [ACK] Seq=25737 Ack=6709 Win=1452 Len=0 TSval=14878764 TSecr=7947256
  264 11.771334548  10.6.15.156 → 192.168.1.12 SSH 182 Server: Encrypted packet (len=116)
  265 11.811924338 192.168.1.12 → 10.6.15.156  TCP 66 54766 → 22 [ACK] Seq=6709 Ack=25853 Win=6155 Len=0 TSval=7947283 TSecr=14878770
  266 11.846243376  10.6.15.156 → 192.168.1.12 SSH 138 Server: Encrypted packet (len=72)
  267 11.846328676 192.168.1.12 → 10.6.15.156  TCP 66 54766 → 22 [ACK] Seq=6709 Ack=25925 Win=6155 Len=0 TSval=7947291 TSecr=14878789
  268 11.846488484 192.168.1.12 → 10.6.15.156  SSH 102 Client: Encrypted packet (len=36)
  269 11.847703242  10.6.15.156 → 192.168.1.12 TCP 66 22 → 54766 [ACK] Seq=25925 Ack=6745 Win=1452 Len=0 TSval=14878789 TSecr=7947291
  270 11.883974866  10.6.15.156 → 192.168.1.12 SSH 110 Server: Encrypted packet (len=44)
  271 11.884382282 192.168.1.12 → 10.6.15.156  SSH 406 Client: Encrypted packet (len=340)
  272 11.895541062  10.6.15.156 → 192.168.1.12 SSH 214 Server: Encrypted packet (len=148)
  273 11.935872969 192.168.1.12 → 10.6.15.156  TCP 66 54766 → 22 [ACK] Seq=7085 Ack=26117 Win=6155 Len=0 TSval=7947314 TSecr=14878801
  274 12.068215707  10.6.15.156 → 192.168.1.12 SSH 1514 Server: Encrypted packet (len=1448)
  275 12.068239558  10.6.15.156 → 192.168.1.12 SSH 630 Server: Encrypted packet (len=564)
  276 12.068249983 192.168.1.12 → 10.6.15.156  TCP 66 54766 → 22 [ACK] Seq=7085 Ack=28129 Win=6155 Len=0 TSval=7947347 TSecr=14878844
  277 12.068510539  10.6.15.156 → 192.168.1.12 SSH 1046 Server: Encrypted packet (len=980)
  278 12.068542430 192.168.1.12 → 10.6.15.156  TCP 66 54766 → 22 [ACK] Seq=7085 Ack=29109 Win=6155 Len=0 TSval=7947347 TSecr=14878844
  279 12.069452119 192.168.1.12 → 10.6.15.156  SSH 214 Client: Encrypted packet (len=148)
  280 12.110117980  10.6.15.156 → 192.168.1.12 TCP 66 22 → 54766 [ACK] Seq=29109 Ack=7233 Win=1452 Len=0 TSval=14878855 TSecr=7947347
  281 12.110136333 192.168.1.12 → 10.6.15.156  SSH 1330 Client: Encrypted packet (len=1264)
  282 12.113533270  10.6.15.156 → 192.168.1.12 TCP 66 22 → 54766 [ACK] Seq=29109 Ack=8497 Win=1452 Len=0 TSval=14878856 TSecr=7947357
  283 12.221909797  10.6.15.156 → 192.168.1.12 SSH 270 Server: Encrypted packet (len=204)
  284 12.251056804  10.6.15.156 → 192.168.1.12 SSH 430 Server: Encrypted packet (len=364)
  285 12.251141129 192.168.1.12 → 10.6.15.156  TCP 66 54766 → 22 [ACK] Seq=8497 Ack=29677 Win=6155 Len=0 TSval=7947392 TSecr=14878883
  286 12.251425597 192.168.1.12 → 10.6.15.156  SSH 134 Client: Encrypted packet (len=68)
  287 12.253146117  10.6.15.156 → 192.168.1.12 TCP 66 22 → 54766 [ACK] Seq=29677 Ack=8565 Win=1452 Len=0 TSval=14878891 TSecr=7947392
  288 12.289911026  10.6.15.156 → 192.168.1.12 SSH 270 Server: Encrypted packet (len=204)
  289 12.292963346  10.6.15.156 → 192.168.1.12 SSH 134 Server: Encrypted packet (len=68)
  290 12.293048131 192.168.1.12 → 10.6.15.156  TCP 66 54766 → 22 [ACK] Seq=8565 Ack=29949 Win=6155 Len=0 TSval=7947403 TSecr=14878900
  291 12.294127798  10.6.15.156 → 192.168.1.12 SSH 446 Server: Encrypted packet (len=380)
  292 12.335903316 192.168.1.12 → 10.6.15.156  TCP 66 54766 → 22 [ACK] Seq=8565 Ack=30329 Win=6155 Len=0 TSval=7947414 TSecr=14878901
  293 12.346712831  10.6.15.156 → 192.168.1.12 SSH 270 Server: Encrypted packet (len=204)
  294 12.346799879 192.168.1.12 → 10.6.15.156  TCP 66 54766 → 22 [ACK] Seq=8565 Ack=30533 Win=6155 Len=0 TSval=7947416 TSecr=14878914
  295 12.443612931  10.6.15.156 → 192.168.1.12 SSH 342 Server: Encrypted packet (len=276)
  296 12.443698036 192.168.1.12 → 10.6.15.156  TCP 66 54766 → 22 [ACK] Seq=8565 Ack=30809 Win=6155 Len=0 TSval=7947440 TSecr=14878938
  297 12.497191090 192.168.1.12 → 10.6.15.156  SSH 1514 Client: Encrypted packet (len=1448)
  298 12.536736902  10.6.15.156 → 192.168.1.12 TCP 66 22 → 54766 [ACK] Seq=30809 Ack=10013 Win=1452 Len=0 TSval=14878962 TSecr=7947454
  299 12.536755213 192.168.1.12 → 10.6.15.156  SSH 606 Client: Encrypted packet (len=540)
  300 12.538682187  10.6.15.156 → 192.168.1.12 TCP 66 22 → 54766 [ACK] Seq=30809 Ack=10553 Win=1452 Len=0 TSval=14878962 TSecr=7947464
  301 12.541766298  10.6.15.156 → 192.168.1.12 SSH 142 Server: Encrypted packet (len=76)
  302 12.541852560 192.168.1.12 → 10.6.15.156  TCP 66 54766 → 22 [ACK] Seq=10553 Ack=30885 Win=6155 Len=0 TSval=7947465 TSecr=14878963
  303 12.643805950  10.6.15.156 → 192.168.1.12 SSH 902 Server: Encrypted packet (len=836)
  304 12.643939808 192.168.1.12 → 10.6.15.156  TCP 66 54766 → 22 [ACK] Seq=10553 Ack=31721 Win=6155 Len=0 TSval=7947491 TSecr=14878988
  305 12.644735559  10.6.15.156 → 192.168.1.12 SSH 526 Server: Encrypted packet (len=460)
  306 12.644772759 192.168.1.12 → 10.6.15.156  TCP 66 54766 → 22 [ACK] Seq=10553 Ack=32181 Win=6155 Len=0 TSval=7947491 TSecr=14878989
  307 12.645123200 192.168.1.12 → 10.6.15.156  SSH 134 Client: Encrypted packet (len=68)
  308 12.673205685  10.6.15.156 → 192.168.1.12 SSH 470 Server: Encrypted packet (len=404)
  309 12.715923903 192.168.1.12 → 10.6.15.156  TCP 66 54766 → 22 [ACK] Seq=10621 Ack=32585 Win=6155 Len=0 TSval=7947509 TSecr=14878996
  310 12.739497927  10.6.15.156 → 192.168.1.12 SSH 102 Server: Encrypted packet (len=36)
  311 12.739580204 192.168.1.12 → 10.6.15.156  TCP 66 54766 → 22 [ACK] Seq=10621 Ack=32621 Win=6155 Len=0 TSval=7947514 TSecr=14879012
  312 12.742201227  10.6.15.156 → 192.168.1.12 SSH 486 Server: Encrypted packet (len=420)
  313 12.742288772 192.168.1.12 → 10.6.15.156  TCP 66 54766 → 22 [ACK] Seq=10621 Ack=33041 Win=6155 Len=0 TSval=7947515 TSecr=14879013
  314 12.797844747  10.6.15.156 → 192.168.1.12 SSH 454 Server: Encrypted packet (len=388)
  315 12.797931700 192.168.1.12 → 10.6.15.156  TCP 66 54766 → 22 [ACK] Seq=10621 Ack=33429 Win=6155 Len=0 TSval=7947529 TSecr=14879027
  316 12.894607367  10.6.15.156 → 192.168.1.12 SSH 406 Server: Encrypted packet (len=340)
  317 12.894692691 192.168.1.12 → 10.6.15.156  TCP 66 54766 → 22 [ACK] Seq=10621 Ack=33769 Win=6155 Len=0 TSval=7947553 TSecr=14879051
  318 13.123732716  10.6.15.156 → 192.168.1.12 SSH 182 Server: Encrypted packet (len=116)
  319 13.123817442 192.168.1.12 → 10.6.15.156  TCP 66 54766 → 22 [ACK] Seq=10621 Ack=33885 Win=6155 Len=0 TSval=7947610 TSecr=14879108
  320 13.192045953  10.6.15.156 → 192.168.1.12 SSH 182 Server: Encrypted packet (len=116)
  321 13.192131487 192.168.1.12 → 10.6.15.156  TCP 66 54766 → 22 [ACK] Seq=10621 Ack=34001 Win=6155 Len=0 TSval=7947628 TSecr=14879125
  322 13.249718365  10.6.15.156 → 192.168.1.12 SSH 182 Server: Encrypted packet (len=116)
  323 13.249802802 192.168.1.12 → 10.6.15.156  TCP 66 54766 → 22 [ACK] Seq=10621 Ack=34117 Win=6155 Len=0 TSval=7947642 TSecr=14879140
  324 13.345037268  10.6.15.156 → 192.168.1.12 SSH 182 Server: Encrypted packet (len=116)
  325 13.345121548 192.168.1.12 → 10.6.15.156  TCP 66 54766 → 22 [ACK] Seq=10621 Ack=34233 Win=6155 Len=0 TSval=7947666 TSecr=14879164
  326 13.574875993  10.6.15.156 → 192.168.1.12 SSH 254 Server: Encrypted packet (len=188)
  327 13.574950880 192.168.1.12 → 10.6.15.156  TCP 66 54766 → 22 [ACK] Seq=10621 Ack=34421 Win=6155 Len=0 TSval=7947723 TSecr=14879221
  328 13.643137810  10.6.15.156 → 192.168.1.12 SSH 326 Server: Encrypted packet (len=260)
  329 13.643225115 192.168.1.12 → 10.6.15.156  TCP 66 54766 → 22 [ACK] Seq=10621 Ack=34681 Win=6155 Len=0 TSval=7947740 TSecr=14879238
  330 13.699969682  10.6.15.156 → 192.168.1.12 SSH 390 Server: Encrypted packet (len=324)
  331 13.700044686 192.168.1.12 → 10.6.15.156  TCP 66 54766 → 22 [ACK] Seq=10621 Ack=35005 Win=6155 Len=0 TSval=7947755 TSecr=14879252
  332 13.775280886 192.168.1.12 → 192.168.1.1  DNS 81 Standard query 0x2c25 A 0.ubuntu.pool.ntp.org
  333 13.797090909  10.6.15.156 → 192.168.1.12 SSH 358 Server: Encrypted packet (len=292)
  334 13.797155345 192.168.1.12 → 10.6.15.156  TCP 66 54766 → 22 [ACK] Seq=10621 Ack=35297 Win=6155 Len=0 TSval=7947779 TSecr=14879276
  335 14.027734458  10.6.15.156 → 192.168.1.12 SSH 326 Server: Encrypted packet (len=260)
  336 14.027822645 192.168.1.12 → 10.6.15.156  TCP 66 54766 → 22 [ACK] Seq=10621 Ack=35557 Win=6155 Len=0 TSval=7947836 TSecr=14879334
  337 14.094070504  10.6.15.156 → 192.168.1.12 SSH 254 Server: Encrypted packet (len=188)
  338 14.094157799 192.168.1.12 → 10.6.15.156  TCP 66 54766 → 22 [ACK] Seq=10621 Ack=35745 Win=6155 Len=0 TSval=7947853 TSecr=14879351
  339 14.150680062  10.6.15.156 → 192.168.1.12 SSH 182 Server: Encrypted packet (len=116)
  340 14.150764528 192.168.1.12 → 10.6.15.156  TCP 66 54766 → 22 [ACK] Seq=10621 Ack=35861 Win=6155 Len=0 TSval=7947867 TSecr=14879365
  341 14.247088181  10.6.15.156 → 192.168.1.12 SSH 214 Server: Encrypted packet (len=148)
  342 14.247177372 192.168.1.12 → 10.6.15.156  TCP 66 54766 → 22 [ACK] Seq=10621 Ack=36009 Win=6155 Len=0 TSval=7947891 TSecr=14879389
  343 14.267969577 10.22.17.232 → 224.0.0.252  LLMNR 64 Standard query 0x33a7 A wpad
  344 14.268603877 10.22.17.232 → 224.0.0.252  LLMNR 64 Standard query 0x7c56 A wpad
  345 14.476861026  10.6.15.156 → 192.168.1.12 SSH 182 Server: Encrypted packet (len=116)
  346 14.476924692 192.168.1.12 → 10.6.15.156  TCP 66 54766 → 22 [ACK] Seq=10621 Ack=36125 Win=6155 Len=0 TSval=7947949 TSecr=14879447
  347 14.495849621  10.6.15.156 → 192.168.1.12 SSH 150 Server: Encrypted packet (len=84)
  348 14.495937371 192.168.1.12 → 10.6.15.156  TCP 66 54766 → 22 [ACK] Seq=10621 Ack=36209 Win=6155 Len=0 TSval=7947954 TSecr=14879451
  349 14.496184824 192.168.1.12 → 10.6.15.156  SSH 150 Client: Encrypted packet (len=84)
  350 14.536733067  10.6.15.156 → 192.168.1.12 TCP 66 22 → 54766 [ACK] Seq=36209 Ack=10705 Win=1452 Len=0 TSval=14879462 TSecr=7947954
  351 14.538182491  10.6.15.156 → 192.168.1.12 SSH 150 Server: Encrypted packet (len=84)
  352 14.538462341 192.168.1.12 → 10.6.15.156  SSH 150 Client: Encrypted packet (len=84)
  353 14.540232257  10.6.15.156 → 192.168.1.12 TCP 66 22 → 54766 [ACK] Seq=36293 Ack=10789 Win=1452 Len=0 TSval=14879462 TSecr=7947964
  354 14.545232100  10.6.15.156 → 192.168.1.12 SSH 222 Server: Encrypted packet (len=156)
  355 14.587909871 192.168.1.12 → 10.6.15.156  TCP 66 54766 → 22 [ACK] Seq=10789 Ack=36449 Win=6155 Len=0 TSval=7947977 TSecr=14879464
  356 14.601517713  10.6.15.156 → 192.168.1.12 SSH 182 Server: Encrypted packet (len=116)
  357 14.601601658 192.168.1.12 → 10.6.15.156  TCP 66 54766 → 22 [ACK] Seq=10789 Ack=36565 Win=6155 Len=0 TSval=7947980 TSecr=14879478
  358 14.678086602 10.22.17.232 → 224.0.0.252  LLMNR 64 Standard query 0x7c56 A wpad
  359 14.678106703 10.22.17.232 → 224.0.0.252  LLMNR 64 Standard query 0x33a7 A wpad
  360 14.698801722  10.6.15.156 → 192.168.1.12 SSH 214 Server: Encrypted packet (len=148)
  361 14.698876514 192.168.1.12 → 10.6.15.156  TCP 66 54766 → 22 [ACK] Seq=10789 Ack=36713 Win=6155 Len=0 TSval=7948004 TSecr=14879502
  362 14.927908478  10.6.15.156 → 192.168.1.12 SSH 302 Server: Encrypted packet (len=236)
  363 14.927996430 192.168.1.12 → 10.6.15.156  TCP 66 54766 → 22 [ACK] Seq=10789 Ack=36949 Win=6155 Len=0 TSval=7948062 TSecr=14879559
  364 15.052690890  10.6.15.156 → 192.168.1.12 SSH 222 Server: Encrypted packet (len=156)
  365 15.052778713 192.168.1.12 → 10.6.15.156  TCP 66 54766 → 22 [ACK] Seq=10789 Ack=37105 Win=6155 Len=0 TSval=7948093 TSecr=14879591
  366 15.150475430  10.6.15.156 → 192.168.1.12 SSH 182 Server: Encrypted packet (len=116)
  367 15.150564199 192.168.1.12 → 10.6.15.156  TCP 66 54766 → 22 [ACK] Seq=10789 Ack=37221 Win=6155 Len=0 TSval=7948117 TSecr=14879615
  368 15.447097452  10.6.15.156 → 192.168.1.12 SSH 270 Server: Encrypted packet (len=204)
  369 15.447125984 192.168.1.12 → 10.6.15.156  TCP 66 54766 → 22 [ACK] Seq=10789 Ack=37425 Win=6155 Len=0 TSval=7948191 TSecr=14879689
  370 15.503637715  10.6.15.156 → 192.168.1.12 SSH 238 Server: Encrypted packet (len=172)
  371 15.503655546 192.168.1.12 → 10.6.15.156  TCP 66 54766 → 22 [ACK] Seq=10789 Ack=37597 Win=6155 Len=0 TSval=7948205 TSecr=14879703
  372 15.600097429  10.6.15.156 → 192.168.1.12 SSH 238 Server: Encrypted packet (len=172)
  373 15.600114219 192.168.1.12 → 10.6.15.156  TCP 66 54766 → 22 [ACK] Seq=10789 Ack=37769 Win=6155 Len=0 TSval=7948230 TSecr=14879727
  374 15.830058934  10.6.15.156 → 192.168.1.12 SSH 374 Server: Encrypted packet (len=308)
  375 15.830077011 192.168.1.12 → 10.6.15.156  TCP 66 54766 → 22 [ACK] Seq=10789 Ack=38077 Win=6155 Len=0 TSval=7948287 TSecr=14879785
  376 15.899440753  10.6.15.156 → 192.168.1.12 SSH 222 Server: Encrypted packet (len=156)
  377 15.899457954 192.168.1.12 → 10.6.15.156  TCP 66 54766 → 22 [ACK] Seq=10789 Ack=38233 Win=6155 Len=0 TSval=7948304 TSecr=14879802
  378 15.954610707  10.6.15.156 → 192.168.1.12 SSH 214 Server: Encrypted packet (len=148)
  379 15.954628832 192.168.1.12 → 10.6.15.156  TCP 66 54766 → 22 [ACK] Seq=10789 Ack=38381 Win=6155 Len=0 TSval=7948318 TSecr=14879816
  380 16.052342282  10.6.15.156 → 192.168.1.12 SSH 254 Server: Encrypted packet (len=188)
  381 16.052359765 192.168.1.12 → 10.6.15.156  TCP 66 54766 → 22 [ACK] Seq=10789 Ack=38569 Win=6155 Len=0 TSval=7948343 TSecr=14879840
  382 16.268603762  10.22.18.83 → 224.0.0.252  LLMNR 64 Standard query 0x7f4c A wpad
  383 16.281526941  10.6.15.156 → 192.168.1.12 SSH 238 Server: Encrypted packet (len=172)
  384 16.281544745 192.168.1.12 → 10.6.15.156  TCP 66 54766 → 22 [ACK] Seq=10789 Ack=38741 Win=6155 Len=0 TSval=7948400 TSecr=14879898
  385 16.350921351  10.6.15.156 → 192.168.1.12 SSH 342 Server: Encrypted packet (len=276)
  386 16.350938101 192.168.1.12 → 10.6.15.156  TCP 66 54766 → 22 [ACK] Seq=10789 Ack=39017 Win=6155 Len=0 TSval=7948417 TSecr=14879915
  387 16.405869190  10.6.15.156 → 192.168.1.12 SSH 406 Server: Encrypted packet (len=340)
  388 16.405887841 192.168.1.12 → 10.6.15.156  TCP 66 54766 → 22 [ACK] Seq=10789 Ack=39357 Win=6155 Len=0 TSval=7948431 TSecr=14879929
  389 16.502420525  10.6.15.156 → 192.168.1.12 SSH 438 Server: Encrypted packet (len=372)
  390 16.502439149 192.168.1.12 → 10.6.15.156  TCP 66 54766 → 22 [ACK] Seq=10789 Ack=39729 Win=6155 Len=0 TSval=7948455 TSecr=14879953
  391 16.679011211  10.22.18.83 → 224.0.0.252  LLMNR 64 Standard query 0x7f4c A wpad
  392 16.731889479  10.6.15.156 → 192.168.1.12 SSH 182 Server: Encrypted packet (len=116)
  393 16.731907041 192.168.1.12 → 10.6.15.156  TCP 66 54766 → 22 [ACK] Seq=10789 Ack=39845 Win=6155 Len=0 TSval=7948513 TSecr=14880010
  394 16.800002848  10.6.15.156 → 192.168.1.12 SSH 230 Server: Encrypted packet (len=164)
  395 16.800018275 192.168.1.12 → 10.6.15.156  TCP 66 54766 → 22 [ACK] Seq=10789 Ack=40009 Win=6155 Len=0 TSval=7948530 TSecr=14880027
  396 16.857187391  10.6.15.156 → 192.168.1.12 SSH 238 Server: Encrypted packet (len=172)
  397 16.857202989 192.168.1.12 → 10.6.15.156  TCP 66 54766 → 22 [ACK] Seq=10789 Ack=40181 Win=6155 Len=0 TSval=7948544 TSecr=14880042
  398 16.953355892  10.6.15.156 → 192.168.1.12 SSH 182 Server: Encrypted packet (len=116)
  399 16.953373392 192.168.1.12 → 10.6.15.156  TCP 66 54766 → 22 [ACK] Seq=10789 Ack=40297 Win=6155 Len=0 TSval=7948568 TSecr=14880066
  400 17.250927484  10.6.15.156 → 192.168.1.12 SSH 214 Server: Encrypted packet (len=148)
  401 17.250944166 192.168.1.12 → 10.6.15.156  TCP 66 54766 → 22 [ACK] Seq=10789 Ack=40445 Win=6155 Len=0 TSval=7948642 TSecr=14880140
  402 17.307667083  10.6.15.156 → 192.168.1.12 SSH 238 Server: Encrypted packet (len=172)
  403 17.307684480 192.168.1.12 → 10.6.15.156  TCP 66 54766 → 22 [ACK] Seq=10789 Ack=40617 Win=6155 Len=0 TSval=7948656 TSecr=14880154
  404 17.404192440  10.6.15.156 → 192.168.1.12 SSH 270 Server: Encrypted packet (len=204)
  405 17.404208573 192.168.1.12 → 10.6.15.156  TCP 66 54766 → 22 [ACK] Seq=10789 Ack=40821 Win=6155 Len=0 TSval=7948681 TSecr=14880178
  406 17.634152635  10.6.15.156 → 192.168.1.12 SSH 390 Server: Encrypted packet (len=324)
  407 17.634170948 192.168.1.12 → 10.6.15.156  TCP 66 54766 → 22 [ACK] Seq=10789 Ack=41145 Win=6155 Len=0 TSval=7948738 TSecr=14880236
  408 17.702199926  10.6.15.156 → 192.168.1.12 SSH 486 Server: Encrypted packet (len=420)
  409 17.702214522 192.168.1.12 → 10.6.15.156  TCP 66 54766 → 22 [ACK] Seq=10789 Ack=41565 Win=6155 Len=0 TSval=7948755 TSecr=14880253
  410 17.758764579  10.6.15.156 → 192.168.1.12 SSH 454 Server: Encrypted packet (len=388)
  411 17.758781967 192.168.1.12 → 10.6.15.156  TCP 66 54766 → 22 [ACK] Seq=10789 Ack=41953 Win=6155 Len=0 TSval=7948769 TSecr=14880267
  412 17.855284390  10.6.15.156 → 192.168.1.12 SSH 422 Server: Encrypted packet (len=356)
  413 17.855304415 192.168.1.12 → 10.6.15.156  TCP 66 54766 → 22 [ACK] Seq=10789 Ack=42309 Win=6155 Len=0 TSval=7948793 TSecr=14880291
  414 18.025283041 10.22.19.229 → 224.0.0.252  LLMNR 65 Standard query 0x4a30 ANY NeviN
  415 18.085300698  10.6.15.156 → 192.168.1.12 SSH 454 Server: Encrypted packet (len=388)
  416 18.085317298 192.168.1.12 → 10.6.15.156  TCP 66 54766 → 22 [ACK] Seq=10789 Ack=42697 Win=6155 Len=0 TSval=7948851 TSecr=14880349
  417 18.153638860  10.6.15.156 → 192.168.1.12 SSH 678 Server: Encrypted packet (len=612)
  418 18.153655203 192.168.1.12 → 10.6.15.156  TCP 66 54766 → 22 [ACK] Seq=10789 Ack=43309 Win=6155 Len=0 TSval=7948868 TSecr=14880366
  419 18.210065351  10.6.15.156 → 192.168.1.12 SSH 662 Server: Encrypted packet (len=596)
  420 18.210081489 192.168.1.12 → 10.6.15.156  TCP 66 54766 → 22 [ACK] Seq=10789 Ack=43905 Win=6155 Len=0 TSval=7948882 TSecr=14880380
  421 18.306385317  10.6.15.156 → 192.168.1.12 SSH 662 Server: Encrypted packet (len=596)
  422 18.306406636 192.168.1.12 → 10.6.15.156  TCP 66 54766 → 22 [ACK] Seq=10789 Ack=44501 Win=6155 Len=0 TSval=7948906 TSecr=14880404
  423 18.434982301 10.22.19.229 → 224.0.0.252  LLMNR 65 Standard query 0x4a30 ANY NeviN
  424 18.536190563  10.6.15.156 → 192.168.1.12 SSH 710 Server: Encrypted packet (len=644)
  425 18.536207752 192.168.1.12 → 10.6.15.156  TCP 66 54766 → 22 [ACK] Seq=10789 Ack=45145 Win=6155 Len=0 TSval=7948964 TSecr=14880461
  426 18.604811060  10.6.15.156 → 192.168.1.12 SSH 358 Server: Encrypted packet (len=292)
  427 18.604831706 192.168.1.12 → 10.6.15.156  TCP 66 54766 → 22 [ACK] Seq=10789 Ack=45437 Win=6155 Len=0 TSval=7948981 TSecr=14880478
  428 18.660841302  10.6.15.156 → 192.168.1.12 SSH 326 Server: Encrypted packet (len=260)
  429 18.660857363 192.168.1.12 → 10.6.15.156  TCP 66 54766 → 22 [ACK] Seq=10789 Ack=45697 Win=6155 Len=0 TSval=7948995 TSecr=14880493
  430 18.757228815  10.6.15.156 → 192.168.1.12 SSH 334 Server: Encrypted packet (len=268)
  431 18.757246089 192.168.1.12 → 10.6.15.156  TCP 66 54766 → 22 [ACK] Seq=10789 Ack=45965 Win=6155 Len=0 TSval=7949019 TSecr=14880517
  432 18.868009515 192.168.1.12 → 192.168.1.1  DNS 81 Standard query 0x2c25 A 0.ubuntu.pool.ntp.org
  433 18.871086288  192.168.1.1 → 192.168.1.12 DNS 145 Standard query response 0x2c25 A 0.ubuntu.pool.ntp.org A 123.108.200.124 A 139.59.16.133 A 139.59.50.38 A 139.59.21.22
  434 18.871552167 192.168.1.12 → 123.108.200.124 NTP 90 NTP Version 4, client
  435 18.986744800  10.6.15.156 → 192.168.1.12 SSH 214 Server: Encrypted packet (len=148)
  436 18.986761899 192.168.1.12 → 10.6.15.156  TCP 66 54766 → 22 [ACK] Seq=10789 Ack=46113 Win=6155 Len=0 TSval=7949076 TSecr=14880574
  437 19.055236162  10.6.15.156 → 192.168.1.12 SSH 286 Server: Encrypted packet (len=220)
  438 19.055304985 192.168.1.12 → 10.6.15.156  TCP 66 54766 → 22 [ACK] Seq=10789 Ack=46333 Win=6155 Len=0 TSval=7949093 TSecr=14880591
  439 19.111643751  10.6.15.156 → 192.168.1.12 SSH 286 Server: Encrypted packet (len=220)
  440 19.111729737 192.168.1.12 → 10.6.15.156  TCP 66 54766 → 22 [ACK] Seq=10789 Ack=46553 Win=6155 Len=0 TSval=7949107 TSecr=14880605
  441 19.209049369  10.6.15.156 → 192.168.1.12 SSH 254 Server: Encrypted packet (len=188)
  442 19.209119610 192.168.1.12 → 10.6.15.156  TCP 66 54766 → 22 [ACK] Seq=10789 Ack=46741 Win=6155 Len=0 TSval=7949132 TSecr=14880630
  443 19.261385601 10.22.19.229 → 224.0.0.252  LLMNR 65 Standard query 0x6ada ANY NeviN
  444 19.438024936  10.6.15.156 → 192.168.1.12 SSH 374 Server: Encrypted packet (len=308)
  445 19.438103519 192.168.1.12 → 10.6.15.156  TCP 66 54766 → 22 [ACK] Seq=10789 Ack=47049 Win=6155 Len=0 TSval=7949189 TSecr=14880687
  446 19.506099628  10.6.15.156 → 192.168.1.12 SSH 342 Server: Encrypted packet (len=276)
  447 19.506165616 192.168.1.12 → 10.6.15.156  TCP 66 54766 → 22 [ACK] Seq=10789 Ack=47325 Win=6155 Len=0 TSval=7949206 TSecr=14880704
  448 19.562693393  10.6.15.156 → 192.168.1.12 SSH 342 Server: Encrypted packet (len=276)
  449 19.562763349 192.168.1.12 → 10.6.15.156  TCP 66 54766 → 22 [ACK] Seq=10789 Ack=47601 Win=6155 Len=0 TSval=7949220 TSecr=14880718
  450 19.661221075  10.6.15.156 → 192.168.1.12 SSH 374 Server: Encrypted packet (len=308)
  451 19.661307772 192.168.1.12 → 10.6.15.156  TCP 66 54766 → 22 [ACK] Seq=10789 Ack=47909 Win=6155 Len=0 TSval=7949245 TSecr=14880743
  452 19.673978424 10.22.19.229 → 224.0.0.252  LLMNR 65 Standard query 0x6ada ANY NeviN
  453 19.747308331  10.6.15.156 → 192.168.1.12 SSH 150 Server: Encrypted packet (len=84)
  454 19.747381722 192.168.1.12 → 10.6.15.156  TCP 66 54766 → 22 [ACK] Seq=10789 Ack=47993 Win=6155 Len=0 TSval=7949266 TSecr=14880764
  455 19.747634968 192.168.1.12 → 10.6.15.156  SSH 150 Client: Encrypted packet (len=84)
  456 19.790450126  10.6.15.156 → 192.168.1.12 TCP 66 22 → 54766 [ACK] Seq=47993 Ack=10873 Win=1452 Len=0 TSval=14880775 TSecr=7949266
  457 19.888967274  10.6.15.156 → 192.168.1.12 SSH 342 Server: Encrypted packet (len=276)
  458 19.931871096 192.168.1.12 → 10.6.15.156  TCP 66 54766 → 22 [ACK] Seq=10873 Ack=48269 Win=6155 Len=0 TSval=7949313 TSecr=14880800
  459 19.943501664  10.6.15.156 → 192.168.1.12 SSH 150 Server: Encrypted packet (len=84)
  460 19.943564107 192.168.1.12 → 10.6.15.156  TCP 66 54766 → 22 [ACK] Seq=10873 Ack=48353 Win=6155 Len=0 TSval=7949315 TSecr=14880813
  461 19.943748760 192.168.1.12 → 10.6.15.156  SSH 150 Client: Encrypted packet (len=84)
  462 19.945346829  10.6.15.156 → 192.168.1.12 TCP 66 22 → 54766 [ACK] Seq=48353 Ack=10957 Win=1452 Len=0 TSval=14880814 TSecr=7949315
  463 19.957172331  10.6.15.156 → 192.168.1.12 SSH 438 Server: Encrypted packet (len=372)
  464 19.999903959 192.168.1.12 → 10.6.15.156  TCP 66 54766 → 22 [ACK] Seq=10957 Ack=48725 Win=6155 Len=0 TSval=7949330 TSecr=14880817
  465 20.013685319  10.6.15.156 → 192.168.1.12 SSH 438 Server: Encrypted packet (len=372)
  466 20.013788168 192.168.1.12 → 10.6.15.156  TCP 66 54766 → 22 [ACK] Seq=10957 Ack=49097 Win=6155 Len=0 TSval=7949333 TSecr=14880831
  467 20.060224290 10.22.19.229 → 224.0.0.252  LLMNR 70 Standard query 0xe640 A mdltvukxyp
  468 20.062173894 10.22.19.229 → 224.0.0.252  LLMNR 67 Standard query 0xde87 A vktieqg
  469 20.067458993 10.22.19.229 → 224.0.0.252  LLMNR 71 Standard query 0x3fed A tqvozamwodd
  470 20.110557844  10.6.15.156 → 192.168.1.12 SSH 486 Server: Encrypted packet (len=420)
  471 20.110659706 192.168.1.12 → 10.6.15.156  TCP 66 54766 → 22 [ACK] Seq=10957 Ack=49517 Win=6155 Len=0 TSval=7949357 TSecr=14880855
  472 20.340147593  10.6.15.156 → 192.168.1.12 SSH 438 Server: Encrypted packet (len=372)
  473 20.340223623 192.168.1.12 → 10.6.15.156  TCP 66 54766 → 22 [ACK] Seq=10957 Ack=49889 Win=6155 Len=0 TSval=7949415 TSecr=14880912
  474 20.408036783  10.6.15.156 → 192.168.1.12 SSH 310 Server: Encrypted packet (len=244)
  475 20.408121534 192.168.1.12 → 10.6.15.156  TCP 66 54766 → 22 [ACK] Seq=10957 Ack=50133 Win=6155 Len=0 TSval=7949432 TSecr=14880929
  476 20.464931890  10.6.15.156 → 192.168.1.12 SSH 302 Server: Encrypted packet (len=236)
  477 20.465006144 192.168.1.12 → 10.6.15.156  TCP 66 54766 → 22 [ACK] Seq=10957 Ack=50369 Win=6155 Len=0 TSval=7949446 TSecr=14880944
  478 20.470303177 10.22.19.229 → 224.0.0.252  LLMNR 70 Standard query 0xe640 A mdltvukxyp
  479 20.472258122 10.22.19.229 → 224.0.0.252  LLMNR 67 Standard query 0xde87 A vktieqg
  480 20.477311797 10.22.19.229 → 224.0.0.252  LLMNR 71 Standard query 0x3fed A tqvozamwodd
  481 20.561107811  10.6.15.156 → 192.168.1.12 SSH 222 Server: Encrypted packet (len=156)
  482 20.561193023 192.168.1.12 → 10.6.15.156  TCP 66 54766 → 22 [ACK] Seq=10957 Ack=50525 Win=6155 Len=0 TSval=7949470 TSecr=14880968
  483 20.916535900  10.6.15.156 → 192.168.1.12 SSH 238 Server: Encrypted packet (len=172)
  484 20.916559004 192.168.1.12 → 10.6.15.156  TCP 66 54766 → 22 [ACK] Seq=10957 Ack=50697 Win=6155 Len=0 TSval=7949559 TSecr=14881056
  485 21.011956327  10.6.15.156 → 192.168.1.12 SSH 214 Server: Encrypted packet (len=148)
  486 21.011974546 192.168.1.12 → 10.6.15.156  TCP 66 54766 → 22 [ACK] Seq=10957 Ack=50845 Win=6155 Len=0 TSval=7949583 TSecr=14881080
  487 21.242005561  10.6.15.156 → 192.168.1.12 SSH 486 Server: Encrypted packet (len=420)
  488 21.242023218 192.168.1.12 → 10.6.15.156  TCP 66 54766 → 22 [ACK] Seq=10957 Ack=51265 Win=6155 Len=0 TSval=7949640 TSecr=14881138
  489 21.310438943  10.6.15.156 → 192.168.1.12 SSH 486 Server: Encrypted packet (len=420)
  490 21.310456326 192.168.1.12 → 10.6.15.156  TCP 66 54766 → 22 [ACK] Seq=10957 Ack=51685 Win=6155 Len=0 TSval=7949657 TSecr=14881155
  491 21.366955771  10.6.15.156 → 192.168.1.12 SSH 406 Server: Encrypted packet (len=340)
  492 21.366973777 192.168.1.12 → 10.6.15.156  TCP 66 54766 → 22 [ACK] Seq=10957 Ack=52025 Win=6155 Len=0 TSval=7949671 TSecr=14881169
  493 21.380683127  10.6.15.156 → 192.168.1.12 SSH 406 Server: [TCP Spurious Retransmission] , Encrypted packet (len=340)
  494 21.380703619 192.168.1.12 → 10.6.15.156  TCP 78 [TCP Dup ACK 492#1] 54766 → 22 [ACK] Seq=10957 Ack=52025 Win=6155 Len=0 TSval=7949675 TSecr=14881173 SLE=51685 SRE=52025
  495 21.463345304  10.6.15.156 → 192.168.1.12 SSH 438 Server: Encrypted packet (len=372)
  496 21.463363360 192.168.1.12 → 10.6.15.156  TCP 66 54766 → 22 [ACK] Seq=10957 Ack=52397 Win=6155 Len=0 TSval=7949695 TSecr=14881193
  497 21.817490080  10.6.15.156 → 192.168.1.12 SSH 206 Server: Encrypted packet (len=140)
  498 21.817506740 192.168.1.12 → 10.6.15.156  TCP 66 54766 → 22 [ACK] Seq=10957 Ack=52537 Win=6155 Len=0 TSval=7949784 TSecr=14881282
  499 21.914037241  10.6.15.156 → 192.168.1.12 SSH 206 Server: Encrypted packet (len=140)
  500 21.914054893 192.168.1.12 → 10.6.15.156  TCP 66 54766 → 22 [ACK] Seq=10957 Ack=52677 Win=6155 Len=0 TSval=7949808 TSecr=14881306
  501 22.145348052  10.6.15.156 → 192.168.1.12 SSH 206 Server: Encrypted packet (len=140)
  502 22.145363755 192.168.1.12 → 10.6.15.156  TCP 66 54766 → 22 [ACK] Seq=10957 Ack=52817 Win=6155 Len=0 TSval=7949866 TSecr=14881363
  503 22.212366944  10.6.15.156 → 192.168.1.12 SSH 422 Server: Encrypted packet (len=356)
  504 22.212384720 192.168.1.12 → 10.6.15.156  TCP 66 54766 → 22 [ACK] Seq=10957 Ack=53173 Win=6155 Len=0 TSval=7949883 TSecr=14881380
  505 22.268810228  10.6.15.156 → 192.168.1.12 SSH 374 Server: Encrypted packet (len=308)
  506 22.268826302 192.168.1.12 → 10.6.15.156  TCP 66 54766 → 22 [ACK] Seq=10957 Ack=53481 Win=6155 Len=0 TSval=7949897 TSecr=14881395
  507 22.365298002  10.6.15.156 → 192.168.1.12 SSH 374 Server: Encrypted packet (len=308)
  508 22.365315547 192.168.1.12 → 10.6.15.156  TCP 66 54766 → 22 [ACK] Seq=10957 Ack=53789 Win=6155 Len=0 TSval=7949921 TSecr=14881419
  509 22.595298013  10.6.15.156 → 192.168.1.12 SSH 374 Server: Encrypted packet (len=308)
  510 22.595319304 192.168.1.12 → 10.6.15.156  TCP 66 54766 → 22 [ACK] Seq=10957 Ack=54097 Win=6155 Len=0 TSval=7949978 TSecr=14881476
  511 22.719506260  10.6.15.156 → 192.168.1.12 SSH 182 Server: Encrypted packet (len=116)
  512 22.719530481 192.168.1.12 → 10.6.15.156  TCP 66 54766 → 22 [ACK] Seq=10957 Ack=54213 Win=6155 Len=0 TSval=7950009 TSecr=14881507
  513 22.816945394  10.6.15.156 → 192.168.1.12 SSH 182 Server: Encrypted packet (len=116)
  514 22.816960057 192.168.1.12 → 10.6.15.156  TCP 66 54766 → 22 [ACK] Seq=10957 Ack=54329 Win=6155 Len=0 TSval=7950034 TSecr=14881531
  515 23.045632109  10.6.15.156 → 192.168.1.12 SSH 182 Server: Encrypted packet (len=116)
  516 23.045648419 192.168.1.12 → 10.6.15.156  TCP 66 54766 → 22 [ACK] Seq=10957 Ack=54445 Win=6155 Len=0 TSval=7950091 TSecr=14881589
  517 23.114117251  10.6.15.156 → 192.168.1.12 SSH 182 Server: Encrypted packet (len=116)
  518 23.114135100 192.168.1.12 → 10.6.15.156  TCP 66 54766 → 22 [ACK] Seq=10957 Ack=54561 Win=6155 Len=0 TSval=7950108 TSecr=14881606
  519 23.170384822  10.6.15.156 → 192.168.1.12 SSH 182 Server: Encrypted packet (len=116)
  520 23.170400314 192.168.1.12 → 10.6.15.156  TCP 66 54766 → 22 [ACK] Seq=10957 Ack=54677 Win=6155 Len=0 TSval=7950122 TSecr=14881620
  521 23.267101488  10.6.15.156 → 192.168.1.12 SSH 214 Server: Encrypted packet (len=148)
  522 23.267122469 192.168.1.12 → 10.6.15.156  TCP 66 54766 → 22 [ACK] Seq=10957 Ack=54825 Win=6155 Len=0 TSval=7950146 TSecr=14881644
  523 23.496990766  10.6.15.156 → 192.168.1.12 SSH 254 Server: Encrypted packet (len=188)
  524 23.497008911 192.168.1.12 → 10.6.15.156  TCP 66 54766 → 22 [ACK] Seq=10957 Ack=55013 Win=6155 Len=0 TSval=7950204 TSecr=14881702
  525 23.565362207  10.6.15.156 → 192.168.1.12 SSH 222 Server: Encrypted packet (len=156)
  526 23.565379364 192.168.1.12 → 10.6.15.156  TCP 66 54766 → 22 [ACK] Seq=10957 Ack=55169 Win=6155 Len=0 TSval=7950221 TSecr=14881719
  527 23.621446828  10.6.15.156 → 192.168.1.12 SSH 222 Server: Encrypted packet (len=156)
  528 23.621463414 192.168.1.12 → 10.6.15.156  TCP 66 54766 → 22 [ACK] Seq=10957 Ack=55325 Win=6155 Len=0 TSval=7950235 TSecr=14881733
  529 23.718331338  10.6.15.156 → 192.168.1.12 SSH 214 Server: Encrypted packet (len=148)
  530 23.718420396 192.168.1.12 → 10.6.15.156  TCP 66 54766 → 22 [ACK] Seq=10957 Ack=55473 Win=6155 Len=0 TSval=7950259 TSecr=14881757
  531 23.958733743  10.6.15.156 → 192.168.1.12 SSH 182 Server: Encrypted packet (len=116)
  532 23.958821249 192.168.1.12 → 10.6.15.156  TCP 66 54766 → 22 [ACK] Seq=10957 Ack=55589 Win=6155 Len=0 TSval=7950319 TSecr=14881817
  533 24.016114415  10.6.15.156 → 192.168.1.12 SSH 222 Server: Encrypted packet (len=156)
  534 24.016203001 192.168.1.12 → 10.6.15.156  TCP 66 54766 → 22 [ACK] Seq=10957 Ack=55745 Win=6155 Len=0 TSval=7950334 TSecr=14881831
  535 24.073030019  10.6.15.156 → 192.168.1.12 SSH 238 Server: Encrypted packet (len=172)
  536 24.073115868 192.168.1.12 → 10.6.15.156  TCP 66 54766 → 22 [ACK] Seq=10957 Ack=55917 Win=6155 Len=0 TSval=7950348 TSecr=14881846
  537 24.169373978  10.6.15.156 → 192.168.1.12 SSH 214 Server: Encrypted packet (len=148)
  538 24.169443061 192.168.1.12 → 10.6.15.156  TCP 66 54766 → 22 [ACK] Seq=10957 Ack=56065 Win=6155 Len=0 TSval=7950372 TSecr=14881870
  539 24.399063748  10.6.15.156 → 192.168.1.12 SSH 254 Server: Encrypted packet (len=188)
  540 24.399150054 192.168.1.12 → 10.6.15.156  TCP 66 54766 → 22 [ACK] Seq=10957 Ack=56253 Win=6155 Len=0 TSval=7950429 TSecr=14881927
  541 24.468878120  10.6.15.156 → 192.168.1.12 SSH 318 Server: Encrypted packet (len=252)
  542 24.468958542 192.168.1.12 → 10.6.15.156  TCP 66 54766 → 22 [ACK] Seq=10957 Ack=56505 Win=6155 Len=0 TSval=7950447 TSecr=14881944
  543 24.529329704  10.6.15.156 → 192.168.1.12 SSH 254 Server: Encrypted packet (len=188)
  544 24.529414503 192.168.1.12 → 10.6.15.156  TCP 66 54766 → 22 [ACK] Seq=10957 Ack=56693 Win=6155 Len=0 TSval=7950462 TSecr=14881959
  545 24.620663117  10.6.15.156 → 192.168.1.12 SSH 254 Server: Encrypted packet (len=188)
  546 24.620750047 192.168.1.12 → 10.6.15.156  TCP 66 54766 → 22 [ACK] Seq=10957 Ack=56881 Win=6155 Len=0 TSval=7950485 TSecr=14881983
  547 24.849746694  10.6.15.156 → 192.168.1.12 SSH 222 Server: Encrypted packet (len=156)
  548 24.849834335 192.168.1.12 → 10.6.15.156  TCP 66 54766 → 22 [ACK] Seq=10957 Ack=57037 Win=6155 Len=0 TSval=7950542 TSecr=14882040
  549 25.071086850  10.6.15.156 → 192.168.1.12 SSH 182 Server: Encrypted packet (len=116)
  550 25.071172248 192.168.1.12 → 10.6.15.156  TCP 66 54766 → 22 [ACK] Seq=10957 Ack=57153 Win=6155 Len=0 TSval=7950597 TSecr=14882095
  551 25.248807374  10.6.15.156 → 192.168.1.12 SSH 190 Server: Encrypted packet (len=124)
  552 25.248887483 192.168.1.12 → 10.6.15.156  TCP 66 54766 → 22 [ACK] Seq=10957 Ack=57277 Win=6155 Len=0 TSval=7950642 TSecr=14882140
  553 25.301095796  10.6.15.156 → 192.168.1.12 SSH 238 Server: Encrypted packet (len=172)
  554 25.301187918 192.168.1.12 → 10.6.15.156  TCP 66 54766 → 22 [ACK] Seq=10957 Ack=57449 Win=6155 Len=0 TSval=7950655 TSecr=14882153
  555 25.371132463  10.6.15.156 → 192.168.1.12 SSH 438 Server: Encrypted packet (len=372)
  556 25.371198718 192.168.1.12 → 10.6.15.156  TCP 66 54766 → 22 [ACK] Seq=10957 Ack=57821 Win=6155 Len=0 TSval=7950672 TSecr=14882170
  557 25.425743661  10.6.15.156 → 192.168.1.12 SSH 438 Server: Encrypted packet (len=372)
  558 25.425828703 192.168.1.12 → 10.6.15.156  TCP 66 54766 → 22 [ACK] Seq=10957 Ack=58193 Win=6155 Len=0 TSval=7950686 TSecr=14882184
  559 25.524997049  10.6.15.156 → 192.168.1.12 SSH 502 Server: Encrypted packet (len=436)
  560 25.525079541 192.168.1.12 → 10.6.15.156  TCP 66 54766 → 22 [ACK] Seq=10957 Ack=58629 Win=6155 Len=0 TSval=7950711 TSecr=14882208
  561 25.752061638  10.6.15.156 → 192.168.1.12 SSH 470 Server: Encrypted packet (len=404)
  562 25.752145621 192.168.1.12 → 10.6.15.156  TCP 66 54766 → 22 [ACK] Seq=10957 Ack=59033 Win=6155 Len=0 TSval=7950768 TSecr=14882265
  563 25.792500609  10.6.15.156 → 192.168.1.12 SSH 102 Server: Encrypted packet (len=36)
  564 25.792577513 192.168.1.12 → 10.6.15.156  TCP 66 54766 → 22 [ACK] Seq=10957 Ack=59069 Win=6155 Len=0 TSval=7950778 TSecr=14882276
  565 25.820011063  10.6.15.156 → 192.168.1.12 SSH 286 Server: Encrypted packet (len=220)
  566 25.820074691 192.168.1.12 → 10.6.15.156  TCP 66 54766 → 22 [ACK] Seq=10957 Ack=59289 Win=6155 Len=0 TSval=7950785 TSecr=14882282
  567 25.876723280  10.6.15.156 → 192.168.1.12 SSH 318 Server: Encrypted packet (len=252)
  568 25.876787811 192.168.1.12 → 10.6.15.156  TCP 66 54766 → 22 [ACK] Seq=10957 Ack=59541 Win=6155 Len=0 TSval=7950799 TSecr=14882297
  569 25.973104202  10.6.15.156 → 192.168.1.12 SSH 198 Server: Encrypted packet (len=132)
  570 25.973191292 192.168.1.12 → 10.6.15.156  TCP 66 54766 → 22 [ACK] Seq=10957 Ack=59673 Win=6155 Len=0 TSval=7950823 TSecr=14882321
  571 26.202947432  10.6.15.156 → 192.168.1.12 SSH 222 Server: Encrypted packet (len=156)
  572 26.203025941 192.168.1.12 → 10.6.15.156  TCP 66 54766 → 22 [ACK] Seq=10957 Ack=59829 Win=6155 Len=0 TSval=7950880 TSecr=14882378
  573 26.271347815  10.6.15.156 → 192.168.1.12 SSH 222 Server: Encrypted packet (len=156)
  574 26.271434316 192.168.1.12 → 10.6.15.156  TCP 66 54766 → 22 [ACK] Seq=10957 Ack=59985 Win=6155 Len=0 TSval=7950897 TSecr=14882395
  575 26.327514666  10.6.15.156 → 192.168.1.12 SSH 182 Server: Encrypted packet (len=116)
  576 26.327599410 192.168.1.12 → 10.6.15.156  TCP 66 54766 → 22 [ACK] Seq=10957 Ack=60101 Win=6155 Len=0 TSval=7950911 TSecr=14882409
  577 26.424851146  10.6.15.156 → 192.168.1.12 SSH 182 Server: Encrypted packet (len=116)
  578 26.424922622 192.168.1.12 → 10.6.15.156  TCP 66 54766 → 22 [ACK] Seq=10957 Ack=60217 Win=6155 Len=0 TSval=7950936 TSecr=14882433
  579 26.654253734  10.6.15.156 → 192.168.1.12 SSH 230 Server: Encrypted packet (len=164)
  580 26.654324488 192.168.1.12 → 10.6.15.156  TCP 66 54766 → 22 [ACK] Seq=10957 Ack=60381 Win=6155 Len=0 TSval=7950993 TSecr=14882491
  581 26.722105152  10.6.15.156 → 192.168.1.12 SSH 238 Server: Encrypted packet (len=172)
  582 26.722178187 192.168.1.12 → 10.6.15.156  TCP 66 54766 → 22 [ACK] Seq=10957 Ack=60553 Win=6155 Len=0 TSval=7951010 TSecr=14882508
  583 26.778626150  10.6.15.156 → 192.168.1.12 SSH 270 Server: Encrypted packet (len=204)
  584 26.778717266 192.168.1.12 → 10.6.15.156  TCP 66 54766 → 22 [ACK] Seq=10957 Ack=60757 Win=6155 Len=0 TSval=7951024 TSecr=14882522
  585 26.875129652  10.6.15.156 → 192.168.1.12 SSH 270 Server: Encrypted packet (len=204)
  586 26.875214512 192.168.1.12 → 10.6.15.156  TCP 66 54766 → 22 [ACK] Seq=10957 Ack=60961 Win=6155 Len=0 TSval=7951048 TSecr=14882546
  587 27.555808019  10.6.15.156 → 192.168.1.12 SSH 254 Server: Encrypted packet (len=188)
  588 27.555830558 192.168.1.12 → 10.6.15.156  TCP 66 54766 → 22 [ACK] Seq=10957 Ack=61149 Win=6155 Len=0 TSval=7951218 TSecr=14882716
  589 27.624719537  10.6.15.156 → 192.168.1.12 SSH 318 Server: Encrypted packet (len=252)
  590 27.624736167 192.168.1.12 → 10.6.15.156  TCP 66 54766 → 22 [ACK] Seq=10957 Ack=61401 Win=6155 Len=0 TSval=7951236 TSecr=14882733
  591 27.680694777  10.6.15.156 → 192.168.1.12 SSH 318 Server: Encrypted packet (len=252)
  592 27.680713780 192.168.1.12 → 10.6.15.156  TCP 66 54766 → 22 [ACK] Seq=10957 Ack=61653 Win=6155 Len=0 TSval=7951250 TSecr=14882748
  593 27.777671192  10.6.15.156 → 192.168.1.12 SSH 406 Server: Encrypted packet (len=340)
  594 27.777688551 192.168.1.12 → 10.6.15.156  TCP 66 54766 → 22 [ACK] Seq=10957 Ack=61993 Win=6155 Len=0 TSval=7951274 TSecr=14882772
  595 28.006896796  10.6.15.156 → 192.168.1.12 SSH 302 Server: Encrypted packet (len=236)
  596 28.006915377 192.168.1.12 → 10.6.15.156  TCP 66 54766 → 22 [ACK] Seq=10957 Ack=62229 Win=6155 Len=0 TSval=7951331 TSecr=14882829
  597 28.075162837  10.6.15.156 → 192.168.1.12 SSH 270 Server: Encrypted packet (len=204)
  598 28.075180223 192.168.1.12 → 10.6.15.156  TCP 66 54766 → 22 [ACK] Seq=10957 Ack=62433 Win=6155 Len=0 TSval=7951348 TSecr=14882846
  599 28.136196128  10.6.15.156 → 192.168.1.12 SSH 238 Server: Encrypted packet (len=172)
  600 28.136212401 192.168.1.12 → 10.6.15.156  TCP 66 54766 → 22 [ACK] Seq=10957 Ack=62605 Win=6155 Len=0 TSval=7951364 TSecr=14882860
  601 28.457801075  10.6.15.156 → 192.168.1.12 SSH 222 Server: Encrypted packet (len=156)
  602 28.457818738 192.168.1.12 → 10.6.15.156  TCP 66 54766 → 22 [ACK] Seq=10957 Ack=62761 Win=6155 Len=0 TSval=7951444 TSecr=14882942
  603 28.477059382 10.22.18.100 → 224.0.0.252  LLMNR 64 Standard query 0xc3b5 A wpad
  604 28.477441393 10.22.18.100 → 224.0.0.252  LLMNR 64 Standard query 0xa2bd AAAA wpad
  605 28.526066993  10.6.15.156 → 192.168.1.12 SSH 182 Server: Encrypted packet (len=116)
  606 28.526084097 192.168.1.12 → 10.6.15.156  TCP 66 54766 → 22 [ACK] Seq=10957 Ack=62877 Win=6155 Len=0 TSval=7951461 TSecr=14882959
  607 28.582483002  10.6.15.156 → 192.168.1.12 SSH 182 Server: Encrypted packet (len=116)
  608 28.582501061 192.168.1.12 → 10.6.15.156  TCP 66 54766 → 22 [ACK] Seq=10957 Ack=62993 Win=6155 Len=0 TSval=7951475 TSecr=14882973
  609 28.678970032  10.6.15.156 → 192.168.1.12 SSH 182 Server: Encrypted packet (len=116)
  610 28.678990049 192.168.1.12 → 10.6.15.156  TCP 66 54766 → 22 [ACK] Seq=10957 Ack=63109 Win=6155 Len=0 TSval=7951499 TSecr=14882997
  611 28.688571356  10.6.15.156 → 192.168.1.12 SSH 182 Server: [TCP Spurious Retransmission] , Encrypted packet (len=116)
  612 28.688596240 192.168.1.12 → 10.6.15.156  TCP 78 [TCP Dup ACK 610#1] 54766 → 22 [ACK] Seq=10957 Ack=63109 Win=6155 Len=0 TSval=7951502 TSecr=14883000 SLE=62993 SRE=63109
  613 28.886966439 10.22.18.100 → 224.0.0.252  LLMNR 64 Standard query 0xc3b5 A wpad
  614 28.887467584 10.22.18.100 → 224.0.0.252  LLMNR 64 Standard query 0xa2bd AAAA wpad
  615 28.909337661  10.6.15.156 → 192.168.1.12 SSH 374 Server: Encrypted packet (len=308)
  616 28.909349567 192.168.1.12 → 10.6.15.156  TCP 66 54766 → 22 [ACK] Seq=10957 Ack=63417 Win=6155 Len=0 TSval=7951557 TSecr=14883055
  617 28.977286157  10.6.15.156 → 192.168.1.12 SSH 486 Server: Encrypted packet (len=420)
  618 28.977309544 192.168.1.12 → 10.6.15.156  TCP 66 54766 → 22 [ACK] Seq=10957 Ack=63837 Win=6155 Len=0 TSval=7951574 TSecr=14883072
  619 29.033823056  10.6.15.156 → 192.168.1.12 SSH 486 Server: Encrypted packet (len=420)
  620 29.033842000 192.168.1.12 → 10.6.15.156  TCP 66 54766 → 22 [ACK] Seq=10957 Ack=64257 Win=6155 Len=0 TSval=7951588 TSecr=14883086
  621 29.130335636  10.6.15.156 → 192.168.1.12 SSH 486 Server: Encrypted packet (len=420)
  622 29.130353689 192.168.1.12 → 10.6.15.156  TCP 66 54766 → 22 [ACK] Seq=10957 Ack=64677 Win=6155 Len=0 TSval=7951612 TSecr=14883110
  623 29.284598009  10.6.15.156 → 192.168.1.12 SSH 190 Server: Encrypted packet (len=124)
  624 29.284615168 192.168.1.12 → 10.6.15.156  TCP 66 54766 → 22 [ACK] Seq=10957 Ack=64801 Win=6155 Len=0 TSval=7951651 TSecr=14883148
  625 29.359840907  10.6.15.156 → 192.168.1.12 SSH 270 Server: Encrypted packet (len=204)
  626 29.359858743 192.168.1.12 → 10.6.15.156  TCP 66 54766 → 22 [ACK] Seq=10957 Ack=65005 Win=6155 Len=0 TSval=7951669 TSecr=14883167
  627 29.935579689  10.6.15.156 → 192.168.1.12 SSH 206 Server: Encrypted packet (len=140)
  628 29.935597190 192.168.1.12 → 10.6.15.156  TCP 66 54766 → 22 [ACK] Seq=10957 Ack=65145 Win=6155 Len=0 TSval=7951813 TSecr=14883311
  629 29.939363545 10.22.17.139 → 224.0.0.252  LLMNR 67 Standard query 0xf96d A zhxjgdm
  630 29.939708841 10.22.17.139 → 224.0.0.252  LLMNR 68 Standard query 0xc2d0 A zyrlcywi
  631 29.985634138  192.168.1.1 → 224.0.0.1    IGMPv2 42 Membership Query, general
  632 30.032542742  10.6.15.156 → 192.168.1.12 SSH 238 Server: Encrypted packet (len=172)
  633 30.032560019 192.168.1.12 → 10.6.15.156  TCP 66 54766 → 22 [ACK] Seq=10957 Ack=65317 Win=6155 Len=0 TSval=7951838 TSecr=14883335
  634 30.075169428 10.22.17.139 → 224.0.0.252  LLMNR 64 Standard query 0x0400 A wpad
  635 30.075713824 10.22.17.139 → 224.0.0.252  LLMNR 64 Standard query 0x1ff6 A wpad
  636 30.261755831  10.6.15.156 → 192.168.1.12 SSH 238 Server: Encrypted packet (len=172)
  637 30.261773849 192.168.1.12 → 10.6.15.156  TCP 66 54766 → 22 [ACK] Seq=10957 Ack=65489 Win=6155 Len=0 TSval=7951895 TSecr=14883393
  638 30.329916094  10.6.15.156 → 192.168.1.12 SSH 238 Server: Encrypted packet (len=172)
  639 30.329934107 192.168.1.12 → 10.6.15.156  TCP 66 54766 → 22 [ACK] Seq=10957 Ack=65661 Win=6155 Len=0 TSval=7951912 TSecr=14883410
  640 30.353348649 10.22.17.139 → 224.0.0.252  LLMNR 67 Standard query 0xf96d A zhxjgdm
  641 30.353413131 10.22.17.139 → 224.0.0.252  LLMNR 68 Standard query 0xc2d0 A zyrlcywi
  642 30.388829073  10.6.15.156 → 192.168.1.12 SSH 182 Server: Encrypted packet (len=116)
  643 30.388846656 192.168.1.12 → 10.6.15.156  TCP 66 54766 → 22 [ACK] Seq=10957 Ack=65777 Win=6155 Len=0 TSval=7951927 TSecr=14883424
  644 30.490964872 10.22.17.139 → 224.0.0.252  LLMNR 64 Standard query 0x1ff6 A wpad
  645 30.491077081 10.22.17.139 → 224.0.0.252  LLMNR 64 Standard query 0x0400 A wpad
  646 30.712767493  10.6.15.156 → 192.168.1.12 SSH 214 Server: Encrypted packet (len=148)
  647 30.712785755 192.168.1.12 → 10.6.15.156  TCP 66 54766 → 22 [ACK] Seq=10957 Ack=65925 Win=6155 Len=0 TSval=7952008 TSecr=14883506
  648 30.781241174  10.6.15.156 → 192.168.1.12 SSH 222 Server: Encrypted packet (len=156)
  649 30.781260495 192.168.1.12 → 10.6.15.156  TCP 66 54766 → 22 [ACK] Seq=10957 Ack=66081 Win=6155 Len=0 TSval=7952025 TSecr=14883523
  650 30.792514607  10.6.15.156 → 192.168.1.12 SSH 222 Server: [TCP Spurious Retransmission] , Encrypted packet (len=156)
  651 30.792535040 192.168.1.12 → 10.6.15.156  TCP 78 [TCP Dup ACK 649#1] 54766 → 22 [ACK] Seq=10957 Ack=66081 Win=6155 Len=0 TSval=7952028 TSecr=14883526 SLE=65925 SRE=66081
  652 30.837527400  10.6.15.156 → 192.168.1.12 SSH 222 Server: Encrypted packet (len=156)
  653 30.837546141 192.168.1.12 → 10.6.15.156  TCP 66 54766 → 22 [ACK] Seq=10957 Ack=66237 Win=6155 Len=0 TSval=7952039 TSecr=14883537
  654 30.839869792 192.168.1.12 → 224.0.0.252  IGMPv2 46 Membership Report group 224.0.0.252
  655 30.934183193  10.6.15.156 → 192.168.1.12 SSH 238 Server: Encrypted packet (len=172)
  656 30.934203984 192.168.1.12 → 10.6.15.156  TCP 66 54766 → 22 [ACK] Seq=10957 Ack=66409 Win=6155 Len=0 TSval=7952063 TSecr=14883561
  657 31.164054779  10.6.15.156 → 192.168.1.12 SSH 374 Server: Encrypted packet (len=308)
  658 31.164073399 192.168.1.12 → 10.6.15.156  TCP 66 54766 → 22 [ACK] Seq=10957 Ack=66717 Win=6155 Len=0 TSval=7952121 TSecr=14883618
  659 31.232037917  10.6.15.156 → 192.168.1.12 SSH 334 Server: Encrypted packet (len=268)
  660 31.232053727 192.168.1.12 → 10.6.15.156  TCP 66 54766 → 22 [ACK] Seq=10957 Ack=66985 Win=6155 Len=0 TSval=7952138 TSecr=14883635
  661 31.288787391  10.6.15.156 → 192.168.1.12 SSH 374 Server: Encrypted packet (len=308)
  662 31.288806884 192.168.1.12 → 10.6.15.156  TCP 66 54766 → 22 [ACK] Seq=10957 Ack=67293 Win=6155 Len=0 TSval=7952152 TSecr=14883650
  663 31.385200622  10.6.15.156 → 192.168.1.12 SSH 374 Server: Encrypted packet (len=308)
  664 31.385218693 192.168.1.12 → 10.6.15.156  TCP 66 54766 → 22 [ACK] Seq=10957 Ack=67601 Win=6155 Len=0 TSval=7952176 TSecr=14883674
  665 31.614861486  10.6.15.156 → 192.168.1.12 SSH 222 Server: Encrypted packet (len=156)
  666 31.614878623 192.168.1.12 → 10.6.15.156  TCP 66 54766 → 22 [ACK] Seq=10957 Ack=67757 Win=6155 Len=0 TSval=7952233 TSecr=14883731
  667 31.683035491  10.6.15.156 → 192.168.1.12 SSH 238 Server: Encrypted packet (len=172)
  668 31.683053895 192.168.1.12 → 10.6.15.156  TCP 66 54766 → 22 [ACK] Seq=10957 Ack=67929 Win=6155 Len=0 TSval=7952250 TSecr=14883748
  669 31.739593936  10.6.15.156 → 192.168.1.12 SSH 206 Server: Encrypted packet (len=140)
  670 31.739610605 192.168.1.12 → 10.6.15.156  TCP 66 54766 → 22 [ACK] Seq=10957 Ack=68069 Win=6155 Len=0 TSval=7952264 TSecr=14883762
  671 31.836085749  10.6.15.156 → 192.168.1.12 SSH 182 Server: Encrypted packet (len=116)
  672 31.836100487 192.168.1.12 → 10.6.15.156  TCP 66 54766 → 22 [ACK] Seq=10957 Ack=68185 Win=6155 Len=0 TSval=7952289 TSecr=14883786
  673 31.945410037 10.22.17.139 → 224.0.0.252  LLMNR 68 Standard query 0x1056 A migthipb
  674 32.287126325  10.6.15.156 → 192.168.1.12 SSH 334 Server: Encrypted packet (len=268)
  675 32.287142117 192.168.1.12 → 10.6.15.156  TCP 66 54766 → 22 [ACK] Seq=10957 Ack=68453 Win=6155 Len=0 TSval=7952401 TSecr=14883899
  676 32.367978269 10.22.17.139 → 224.0.0.252  LLMNR 68 Standard query 0x1056 A migthipb
  677 32.517591018  10.6.15.156 → 192.168.1.12 SSH 454 Server: Encrypted packet (len=388)
  678 32.517606693 192.168.1.12 → 10.6.15.156  TCP 66 54766 → 22 [ACK] Seq=10957 Ack=68841 Win=6155 Len=0 TSval=7952459 TSecr=14883957
  679 32.585617578  10.6.15.156 → 192.168.1.12 SSH 454 Server: Encrypted packet (len=388)
  680 32.585635341 192.168.1.12 → 10.6.15.156  TCP 66 54766 → 22 [ACK] Seq=10957 Ack=69229 Win=6155 Len=0 TSval=7952476 TSecr=14883974
  681 32.641695667  10.6.15.156 → 192.168.1.12 SSH 454 Server: Encrypted packet (len=388)
  682 32.641715465 192.168.1.12 → 10.6.15.156  TCP 66 54766 → 22 [ACK] Seq=10957 Ack=69617 Win=6155 Len=0 TSval=7952490 TSecr=14883988
  683 32.738176758  10.6.15.156 → 192.168.1.12 SSH 270 Server: Encrypted packet (len=204)
  684 32.738193735 192.168.1.12 → 10.6.15.156  TCP 66 54766 → 22 [ACK] Seq=10957 Ack=69821 Win=6155 Len=0 TSval=7952514 TSecr=14884012
  685 32.968107652  10.6.15.156 → 192.168.1.12 SSH 198 Server: Encrypted packet (len=132)
  686 32.968123628 192.168.1.12 → 10.6.15.156  TCP 66 54766 → 22 [ACK] Seq=10957 Ack=69953 Win=6155 Len=0 TSval=7952572 TSecr=14884069
  687 33.035910027  10.6.15.156 → 192.168.1.12 SSH 238 Server: Encrypted packet (len=172)
  688 33.035925786 192.168.1.12 → 10.6.15.156  TCP 66 54766 → 22 [ACK] Seq=10957 Ack=70125 Win=6155 Len=0 TSval=7952589 TSecr=14884086
  689 33.092543241  10.6.15.156 → 192.168.1.12 SSH 198 Server: Encrypted packet (len=132)
  690 33.092563160 192.168.1.12 → 10.6.15.156  TCP 66 54766 → 22 [ACK] Seq=10957 Ack=70257 Win=6155 Len=0 TSval=7952603 TSecr=14884101
  691 33.189949480  10.6.15.156 → 192.168.1.12 SSH 198 Server: Encrypted packet (len=132)
  692 33.189965825 192.168.1.12 → 10.6.15.156  TCP 66 54766 → 22 [ACK] Seq=10957 Ack=70389 Win=6155 Len=0 TSval=7952627 TSecr=14884125
  693 33.392440903  10.6.15.156 → 192.168.1.12 SSH 198 Server: [TCP Spurious Retransmission] , Encrypted packet (len=132)
  694 33.392460632 192.168.1.12 → 10.6.15.156  TCP 78 [TCP Dup ACK 692#1] 54766 → 22 [ACK] Seq=10957 Ack=70389 Win=6155 Len=0 TSval=7952678 TSecr=14884176 SLE=70257 SRE=70389
  695 33.418656901  10.6.15.156 → 192.168.1.12 SSH 254 Server: Encrypted packet (len=188)
  696 33.418674742 192.168.1.12 → 10.6.15.156  TCP 66 54766 → 22 [ACK] Seq=10957 Ack=70577 Win=6155 Len=0 TSval=7952684 TSecr=14884182
  697 33.487194205  10.6.15.156 → 192.168.1.12 SSH 214 Server: Encrypted packet (len=148)
  698 33.487211713 192.168.1.12 → 10.6.15.156  TCP 66 54766 → 22 [ACK] Seq=10957 Ack=70725 Win=6155 Len=0 TSval=7952701 TSecr=14884199
  699 33.545218922  10.6.15.156 → 192.168.1.12 SSH 214 Server: Encrypted packet (len=148)
  700 33.545239837 192.168.1.12 → 10.6.15.156  TCP 66 54766 → 22 [ACK] Seq=10957 Ack=70873 Win=6155 Len=0 TSval=7952716 TSecr=14884213
  701 33.640128672  10.6.15.156 → 192.168.1.12 SSH 254 Server: Encrypted packet (len=188)
  702 33.640147089 192.168.1.12 → 10.6.15.156  TCP 66 54766 → 22 [ACK] Seq=10957 Ack=71061 Win=6155 Len=0 TSval=7952740 TSecr=14884237
  703 33.869919023  10.6.15.156 → 192.168.1.12 SSH 182 Server: Encrypted packet (len=116)
  704 33.869934847 192.168.1.12 → 10.6.15.156  TCP 66 54766 → 22 [ACK] Seq=10957 Ack=71177 Win=6155 Len=0 TSval=7952797 TSecr=14884295
  705 33.937881021  10.6.15.156 → 192.168.1.12 SSH 182 Server: Encrypted packet (len=116)
  706 33.937901046 192.168.1.12 → 10.6.15.156  TCP 66 54766 → 22 [ACK] Seq=10957 Ack=71293 Win=6155 Len=0 TSval=7952814 TSecr=14884312
  707 33.994746094  10.6.15.156 → 192.168.1.12 SSH 182 Server: Encrypted packet (len=116)
  708 33.994764285 192.168.1.12 → 10.6.15.156  TCP 66 54766 → 22 [ACK] Seq=10957 Ack=71409 Win=6155 Len=0 TSval=7952828 TSecr=14884326
  709 34.091060559  10.6.15.156 → 192.168.1.12 SSH 182 Server: Encrypted packet (len=116)
  710 34.091079966 192.168.1.12 → 10.6.15.156  TCP 66 54766 → 22 [ACK] Seq=10957 Ack=71525 Win=6155 Len=0 TSval=7952852 TSecr=14884350
