    1 0.000000000  10.6.15.156 → 192.168.1.12 SSH 294 Server: Encrypted packet (len=228)
    2 0.000083019 192.168.1.12 → 10.6.15.156  TCP 66 54766 → 22 [ACK] Seq=1 Ack=229 Win=6155 Len=0 TSval=8168997 TSecr=15100497
    3 0.069594655 192.168.1.12 → 10.6.15.156  SSH 102 Client: Encrypted packet (len=36)
    4 0.073013720  10.6.15.156 → 192.168.1.12 TCP 66 22 → 54766 [ACK] Seq=229 Ack=37 Win=1452 Len=0 TSval=15100515 TSecr=8169014
    5 0.073032184 192.168.1.12 → 10.6.15.156  SSH 110 Client: Encrypted packet (len=44)
    6 0.074452425  10.6.15.156 → 192.168.1.12 TCP 66 22 → 54766 [ACK] Seq=229 Ack=81 Win=1452 Len=0 TSval=15100516 TSecr=8169015
    7 0.091592188  10.6.15.156 → 192.168.1.12 SSH 138 Server: Encrypted packet (len=72)
    8 0.091670789 192.168.1.12 → 10.6.15.156  TCP 66 54766 → 22 [ACK] Seq=81 Ack=301 Win=6155 Len=0 TSval=8169020 TSecr=15100520
    9 0.091849152 192.168.1.12 → 10.6.15.156  SSH 102 Client: Encrypted packet (len=36)
   10 0.115156890  10.6.15.156 → 192.168.1.12 SSH 102 Server: Encrypted packet (len=36)
   11 0.115180453 192.168.1.12 → 10.6.15.156  SSH 362 Client: Encrypted packet (len=296)
   12 0.115653087 192.168.1.12 → 10.6.15.156  SSH 158 Client: Encrypted packet (len=92)
   13 0.117220987  10.6.15.156 → 192.168.1.12 TCP 66 22 → 54766 [ACK] Seq=337 Ack=505 Win=1452 Len=0 TSval=15100527 TSecr=8169026
   14 0.129544506 192.168.1.12 → 10.6.15.156  SSH 102 Client: Encrypted packet (len=36)
   15 0.129807557 192.168.1.12 → 10.6.15.156  SSH 110 Client: Encrypted packet (len=44)
   16 0.131054171  10.6.15.156 → 192.168.1.12 TCP 66 22 → 54766 [ACK] Seq=337 Ack=585 Win=1452 Len=0 TSval=15100530 TSecr=8169029
   17 0.131072225 192.168.1.12 → 10.6.15.156  SSH 310 Client: Encrypted packet (len=244)
   18 0.148566424  10.6.15.156 → 192.168.1.12 SSH 138 Server: Encrypted packet (len=72)
   19 0.148792083 192.168.1.12 → 10.6.15.156  SSH 102 Client: Encrypted packet (len=36)
   20 0.166893563  10.6.15.156 → 192.168.1.12 SSH 470 Server: Encrypted packet (len=404)
   21 0.214869745 192.168.1.12 → 10.6.15.156  TCP 66 54766 → 22 [ACK] Seq=865 Ack=813 Win=6155 Len=0 TSval=8169051 TSecr=15100539
   22 0.222161063  10.6.15.156 → 192.168.1.12 SSH 422 Server: Encrypted packet (len=356)
   23 0.222229449 192.168.1.12 → 10.6.15.156  TCP 66 54766 → 22 [ACK] Seq=865 Ack=1169 Win=6155 Len=0 TSval=8169052 TSecr=15100553
   24 0.270178323  10.6.15.156 → 192.168.1.12 SSH 438 Server: Encrypted packet (len=372)
   25 0.270256508 192.168.1.12 → 10.6.15.156  TCP 66 54766 → 22 [ACK] Seq=865 Ack=1541 Win=6155 Len=0 TSval=8169064 TSecr=15100565
   26 0.274019164  10.6.15.156 → 192.168.1.12 SSH 222 Server: Encrypted packet (len=156)
   27 0.274102192 192.168.1.12 → 10.6.15.156  TCP 66 54766 → 22 [ACK] Seq=865 Ack=1697 Win=6155 Len=0 TSval=8169065 TSecr=15100566
   28 0.290486930  10.6.15.156 → 192.168.1.12 SSH 550 Server: Encrypted packet (len=484)
   29 0.290566857 192.168.1.12 → 10.6.15.156  TCP 66 54766 → 22 [ACK] Seq=865 Ack=2181 Win=6155 Len=0 TSval=8169069 TSecr=15100570
   30 0.322508265  10.6.15.156 → 192.168.1.12 SSH 278 Server: Encrypted packet (len=212)
   31 0.322596725 192.168.1.12 → 10.6.15.156  TCP 66 54766 → 22 [ACK] Seq=865 Ack=2393 Win=6155 Len=0 TSval=8169077 TSecr=15100578
   32 0.346313230  10.6.15.156 → 192.168.1.12 SSH 694 Server: Encrypted packet (len=628)
   33 0.346390577 192.168.1.12 → 10.6.15.156  TCP 66 54766 → 22 [ACK] Seq=865 Ack=3021 Win=6155 Len=0 TSval=8169083 TSecr=15100584
   34 0.371601477  10.6.15.156 → 192.168.1.12 SSH 102 Server: Encrypted packet (len=36)
   35 0.371675691 192.168.1.12 → 10.6.15.156  TCP 66 54766 → 22 [ACK] Seq=865 Ack=3057 Win=6155 Len=0 TSval=8169090 TSecr=15100590
   36 0.372050706 192.168.1.12 → 10.6.15.156  SSH 646 Client: Encrypted packet (len=580)
   37 0.413229058  10.6.15.156 → 192.168.1.12 TCP 66 22 → 54766 [ACK] Seq=3057 Ack=1445 Win=1452 Len=0 TSval=15100601 TSecr=8169090
   38 0.450814864  10.6.15.156 → 192.168.1.12 SSH 630 Server: Encrypted packet (len=564)
   39 0.490871099 192.168.1.12 → 10.6.15.156  TCP 66 54766 → 22 [ACK] Seq=1445 Ack=3621 Win=6155 Len=0 TSval=8169120 TSecr=15100610
   40 0.568732868 192.168.1.12 → 10.6.15.156  SSH 102 Client: Encrypted packet (len=36)
   41 0.570221199  10.6.15.156 → 192.168.1.12 TCP 66 22 → 54766 [ACK] Seq=3621 Ack=1481 Win=1452 Len=0 TSval=15100640 TSecr=8169139
   42 0.570235270 192.168.1.12 → 10.6.15.156  SSH 174 Client: Encrypted packet (len=108)
   43 0.571884191  10.6.15.156 → 192.168.1.12 TCP 66 22 → 54766 [ACK] Seq=3621 Ack=1589 Win=1452 Len=0 TSval=15100640 TSecr=8169139
   44 0.574712754  10.6.15.156 → 192.168.1.12 SSH 138 Server: Encrypted packet (len=72)
   45 0.574800501 192.168.1.12 → 10.6.15.156  TCP 66 54766 → 22 [ACK] Seq=1589 Ack=3693 Win=6155 Len=0 TSval=8169140 TSecr=15100641
   46 0.577121906 192.168.1.12 → 10.6.15.156  SSH 158 Client: Encrypted packet (len=92)
   47 0.589355186  10.6.15.156 → 192.168.1.12 SSH 138 Server: Encrypted packet (len=72)
   48 0.589377895 192.168.1.12 → 10.6.15.156  SSH 206 Client: Encrypted packet (len=140)
   49 0.589422317  10.6.15.156 → 192.168.1.12 SSH 422 Server: Encrypted packet (len=356)
   50 0.589875219 192.168.1.12 → 10.6.15.156  SSH 102 Client: Encrypted packet (len=36)
   51 0.591343487  10.6.15.156 → 192.168.1.12 TCP 66 22 → 54766 [ACK] Seq=4121 Ack=1857 Win=1452 Len=0 TSval=15100645 TSecr=8169144
   52 0.593081392 192.168.1.12 → 10.6.15.156  SSH 222 Client: Encrypted packet (len=156)
   53 0.601030270  10.6.15.156 → 192.168.1.12 SSH 214 Server: Encrypted packet (len=148)
   54 0.610553641  10.6.15.156 → 192.168.1.12 SSH 138 Server: Encrypted packet (len=72)
   55 0.610640260 192.168.1.12 → 10.6.15.156  TCP 66 54766 → 22 [ACK] Seq=2013 Ack=4341 Win=6155 Len=0 TSval=8169149 TSecr=15100648
   56 0.610869287 192.168.1.12 → 10.6.15.156  SSH 102 Client: Encrypted packet (len=36)
   57 0.618477830  10.6.15.156 → 192.168.1.12 SSH 470 Server: Encrypted packet (len=404)
   58 0.627839763 192.168.1.12 → 10.6.15.156  SSH 310 Client: Encrypted packet (len=244)
   59 0.658008827  10.6.15.156 → 192.168.1.12 SSH 334 Server: Encrypted packet (len=268)
   60 0.658044913 192.168.1.12 → 10.6.15.156  SSH 146 Client: Encrypted packet (len=80)
   61 0.673877314  10.6.15.156 → 192.168.1.12 SSH 438 Server: Encrypted packet (len=372)
   62 0.676482857  10.6.15.156 → 192.168.1.12 SSH 174 Server: Encrypted packet (len=108)
   63 0.676571690 192.168.1.12 → 10.6.15.156  TCP 66 54766 → 22 [ACK] Seq=2373 Ack=5493 Win=6155 Len=0 TSval=8169166 TSecr=15100666
   64 0.676818401 192.168.1.12 → 10.6.15.156  SSH 102 Client: Encrypted packet (len=36)
   65 0.717195829  10.6.15.156 → 192.168.1.12 TCP 66 22 → 54766 [ACK] Seq=5493 Ack=2409 Win=1452 Len=0 TSval=15100677 TSecr=8169166
   66 0.717213350 192.168.1.12 → 10.6.15.156  SSH 166 Client: Encrypted packet (len=100)
   67 0.718883018  10.6.15.156 → 192.168.1.12 TCP 66 22 → 54766 [ACK] Seq=5493 Ack=2509 Win=1452 Len=0 TSval=15100677 TSecr=8169176
   68 0.737495578  10.6.15.156 → 192.168.1.12 SSH 158 Server: Encrypted packet (len=92)
   69 0.741517488  10.6.15.156 → 192.168.1.12 SSH 518 Server: Encrypted packet (len=452)
   70 0.741602680 192.168.1.12 → 10.6.15.156  TCP 66 54766 → 22 [ACK] Seq=2509 Ack=6037 Win=6155 Len=0 TSval=8169182 TSecr=15100681
   71 0.796667959  10.6.15.156 → 192.168.1.12 SSH 190 Server: Encrypted packet (len=124)
   72 0.815172790  10.6.15.156 → 192.168.1.12 SSH 1514 Server: Encrypted packet (len=1448)
   73 0.815188825 192.168.1.12 → 10.6.15.156  TCP 66 54766 → 22 [ACK] Seq=2509 Ack=7609 Win=6155 Len=0 TSval=8169201 TSecr=15100696
   74 0.815311158  10.6.15.156 → 192.168.1.12 SSH 1222 Server: Encrypted packet (len=1156)
   75 0.816713123  10.6.15.156 → 192.168.1.12 SSH 1514 Server: Encrypted packet (len=1448)
   76 0.816740567 192.168.1.12 → 10.6.15.156  TCP 66 54766 → 22 [ACK] Seq=2509 Ack=10213 Win=6155 Len=0 TSval=8169201 TSecr=15100701
   77 0.816893567  10.6.15.156 → 192.168.1.12 SSH 1514 Server: Encrypted packet (len=1448)
   78 0.817028565  10.6.15.156 → 192.168.1.12 SSH 118 Server: Encrypted packet (len=52)
   79 0.817035362 192.168.1.12 → 10.6.15.156  TCP 66 54766 → 22 [ACK] Seq=2509 Ack=11713 Win=6155 Len=0 TSval=8169201 TSecr=15100701
   80 0.822563853 192.168.1.12 → 10.6.15.156  SSH 630 Client: Encrypted packet (len=564)
   81 0.827578307  10.6.15.156 → 192.168.1.12 SSH 366 Server: Encrypted packet (len=300)
   82 0.828340455 192.168.1.12 → 10.6.15.156  SSH 142 Client: Encrypted packet (len=76)
   83 0.869165797  10.6.15.156 → 192.168.1.12 TCP 66 22 → 54766 [ACK] Seq=12013 Ack=3149 Win=1452 Len=0 TSval=15100715 TSecr=8169204
   84 0.901481372  10.6.15.156 → 192.168.1.12 SSH 238 Server: Encrypted packet (len=172)
   85 0.942874787 192.168.1.12 → 10.6.15.156  TCP 66 54766 → 22 [ACK] Seq=3149 Ack=12185 Win=6155 Len=0 TSval=8169233 TSecr=15100723
   86 1.075206993  10.6.15.156 → 192.168.1.12 SSH 134 Server: Encrypted packet (len=68)
   87 1.075225167  10.6.15.156 → 192.168.1.12 SSH 102 Server: Encrypted packet (len=36)
   88 1.075278710 192.168.1.12 → 10.6.15.156  TCP 66 54766 → 22 [ACK] Seq=3149 Ack=12289 Win=6155 Len=0 TSval=8169266 TSecr=15100766
   89 1.075467916 192.168.1.12 → 10.6.15.156  SSH 138 Client: Encrypted packet (len=72)
   90 1.077207581  10.6.15.156 → 192.168.1.12 TCP 66 22 → 54766 [ACK] Seq=12289 Ack=3221 Win=1452 Len=0 TSval=15100767 TSecr=8169266
   91 1.077587417  10.6.15.156 → 192.168.1.12 SSH 102 Server: Encrypted packet (len=36)
   92 1.118871756 192.168.1.12 → 10.6.15.156  TCP 66 54766 → 22 [ACK] Seq=3221 Ack=12325 Win=6155 Len=0 TSval=8169277 TSecr=15100767
   93 1.123725751  10.6.15.156 → 192.168.1.12 SSH 390 Server: Encrypted packet (len=324)
   94 1.123797959 192.168.1.12 → 10.6.15.156  TCP 66 54766 → 22 [ACK] Seq=3221 Ack=12649 Win=6155 Len=0 TSval=8169278 TSecr=15100778
   95 1.128368295 192.168.1.12 → 10.6.15.156  SSH 198 Client: Encrypted packet (len=132)
   96 1.140932723  10.6.15.156 → 192.168.1.12 SSH 118 Server: Encrypted packet (len=52)
   97 1.166102490 192.168.1.12 → 10.6.15.156  SSH 230 Client: Encrypted packet (len=164)
   98 1.192427753  10.6.15.156 → 192.168.1.12 SSH 278 Server: Encrypted packet (len=212)
   99 1.192449580 192.168.1.12 → 10.6.15.156  SSH 110 Client: Encrypted packet (len=44)
  100 1.210645637  10.6.15.156 → 192.168.1.12 SSH 102 Server: Encrypted packet (len=36)
  101 1.210982472 192.168.1.12 → 10.6.15.156  SSH 134 Client: Encrypted packet (len=68)
  102 1.231752725  10.6.15.156 → 192.168.1.12 SSH 1514 Server: Encrypted packet (len=1448)
  103 1.231776938  10.6.15.156 → 192.168.1.12 SSH 206 Server: Encrypted packet (len=140)
  104 1.231788184 192.168.1.12 → 10.6.15.156  TCP 66 54766 → 22 [ACK] Seq=3629 Ack=14537 Win=6155 Len=0 TSval=8169305 TSecr=15100805
  105 1.231926545  10.6.15.156 → 192.168.1.12 SSH 294 Server: Encrypted packet (len=228)
  106 1.249531565  10.6.15.156 → 192.168.1.12 SSH 270 Server: Encrypted packet (len=204)
  107 1.249599909 192.168.1.12 → 10.6.15.156  TCP 66 54766 → 22 [ACK] Seq=3629 Ack=14969 Win=6155 Len=0 TSval=8169309 TSecr=15100805
  108 1.352495229  10.6.15.156 → 192.168.1.12 SSH 222 Server: Encrypted packet (len=156)
  109 1.381764874 192.168.1.12 → 10.6.15.156  SSH 222 Client: Encrypted packet (len=156)
  110 1.384420142  10.6.15.156 → 192.168.1.12 SSH 134 Server: Encrypted packet (len=68)
  111 1.409849683  10.6.15.156 → 192.168.1.12 SSH 134 Server: Encrypted packet (len=68)
  112 1.409936434 192.168.1.12 → 10.6.15.156  TCP 66 54766 → 22 [ACK] Seq=3785 Ack=15261 Win=6155 Len=0 TSval=8169349 TSecr=15100843
  113 1.574906868  10.6.15.156 → 192.168.1.12 SSH 270 Server: Encrypted packet (len=204)
  114 1.618869275 192.168.1.12 → 10.6.15.156  TCP 66 54766 → 22 [ACK] Seq=3785 Ack=15465 Win=6155 Len=0 TSval=8169402 TSecr=15100891
  115 1.645335466  10.6.15.156 → 192.168.1.12 SSH 222 Server: Encrypted packet (len=156)
  116 1.645435376 192.168.1.12 → 10.6.15.156  TCP 66 54766 → 22 [ACK] Seq=3785 Ack=15621 Win=6155 Len=0 TSval=8169408 TSecr=15100908
  117 1.669590983  10.6.15.156 → 192.168.1.12 SSH 318 Server: Encrypted packet (len=252)
  118 1.669687418 192.168.1.12 → 10.6.15.156  TCP 66 54766 → 22 [ACK] Seq=3785 Ack=15873 Win=6155 Len=0 TSval=8169414 TSecr=15100915
  119 1.698826236  10.6.15.156 → 192.168.1.12 SSH 238 Server: Encrypted packet (len=172)
  120 1.698923174 192.168.1.12 → 10.6.15.156  TCP 66 54766 → 22 [ACK] Seq=3785 Ack=16045 Win=6155 Len=0 TSval=8169422 TSecr=15100922
  121 1.741510713 192.168.1.12 → 10.6.15.156  SSH 102 Client: Encrypted packet (len=36)
  122 1.761493420  10.6.15.156 → 192.168.1.12 SSH 138 Server: Encrypted packet (len=72)
  123 1.761513922 192.168.1.12 → 10.6.15.156  SSH 886 Client: Encrypted packet (len=820)
  124 1.762310943 192.168.1.12 → 10.6.15.156  SSH 102 Client: Encrypted packet (len=36)
  125 1.763914930  10.6.15.156 → 192.168.1.12 TCP 66 22 → 54766 [ACK] Seq=16117 Ack=4677 Win=1452 Len=0 TSval=15100938 TSecr=8169437
  126 1.823670418 192.168.1.12 → 10.6.15.156  SSH 742 Client: Encrypted packet (len=676)
  127 1.865193066  10.6.15.156 → 192.168.1.12 TCP 66 22 → 54766 [ACK] Seq=16117 Ack=5353 Win=1452 Len=0 TSval=15100964 TSecr=8169453
  128 1.870168612  10.6.15.156 → 192.168.1.12 SSH 1038 Server: Encrypted packet (len=972)
  129 1.870895142 192.168.1.12 → 10.6.15.156  SSH 282 Client: Encrypted packet (len=216)
  130 1.872663096  10.6.15.156 → 192.168.1.12 TCP 66 22 → 54766 [ACK] Seq=17089 Ack=5569 Win=1452 Len=0 TSval=15100965 TSecr=8169465
  131 1.872683505 192.168.1.12 → 10.6.15.156  SSH 158 Client: Encrypted packet (len=92)
  132 1.874215866  10.6.15.156 → 192.168.1.12 TCP 66 22 → 54766 [ACK] Seq=17089 Ack=5661 Win=1452 Len=0 TSval=15100966 TSecr=8169465
  133 1.877086763  10.6.15.156 → 192.168.1.12 SSH 1514 Server: Encrypted packet (len=1448)
  134 1.877236443  10.6.15.156 → 192.168.1.12 SSH 1514 Server: Encrypted packet (len=1448)
  135 1.877245347 192.168.1.12 → 10.6.15.156  TCP 66 54766 → 22 [ACK] Seq=5661 Ack=19985 Win=6155 Len=0 TSval=8169466 TSecr=15100966
  136 1.877438437  10.6.15.156 → 192.168.1.12 SSH 1514 Server: Encrypted packet (len=1448)
  137 1.877629053  10.6.15.156 → 192.168.1.12 SSH 1514 Server: Encrypted packet (len=1448)
  138 1.877640860 192.168.1.12 → 10.6.15.156  TCP 66 54766 → 22 [ACK] Seq=5661 Ack=22881 Win=6155 Len=0 TSval=8169466 TSecr=15100966
  139 1.877813342  10.6.15.156 → 192.168.1.12 SSH 1514 Server: Encrypted packet (len=1448)
  140 1.878005490  10.6.15.156 → 192.168.1.12 SSH 1514 Server: Encrypted packet (len=1448)
  141 1.878009275 192.168.1.12 → 10.6.15.156  TCP 66 54766 → 22 [ACK] Seq=5661 Ack=25777 Win=6155 Len=0 TSval=8169466 TSecr=15100966
  142 1.878197524  10.6.15.156 → 192.168.1.12 SSH 1514 Server: Encrypted packet (len=1448)
  143 1.878549606  10.6.15.156 → 192.168.1.12 SSH 1514 Server: Encrypted packet (len=1448)
  144 1.878552897 192.168.1.12 → 10.6.15.156  TCP 66 54766 → 22 [ACK] Seq=5661 Ack=28673 Win=6155 Len=0 TSval=8169466 TSecr=15100966
  145 1.878729825  10.6.15.156 → 192.168.1.12 SSH 1514 Server: Encrypted packet (len=1448)
  146 1.878896686  10.6.15.156 → 192.168.1.12 SSH 1514 Server: Encrypted packet (len=1448)
  147 1.878900509 192.168.1.12 → 10.6.15.156  TCP 66 54766 → 22 [ACK] Seq=5661 Ack=31569 Win=6155 Len=0 TSval=8169467 TSecr=15100966
  148 1.878907390  10.6.15.156 → 192.168.1.12 SSH 110 Server: Encrypted packet (len=44)
  149 1.879117448  10.6.15.156 → 192.168.1.12 SSH 1514 Server: Encrypted packet (len=1448)
  150 1.879121695 192.168.1.12 → 10.6.15.156  TCP 66 54766 → 22 [ACK] Seq=5661 Ack=33061 Win=6155 Len=0 TSval=8169467 TSecr=15100966
  151 1.879328542  10.6.15.156 → 192.168.1.12 SSH 1514 Server: Encrypted packet (len=1448)
  152 1.879429587  10.6.15.156 → 192.168.1.12 SSH 918 Server: Encrypted packet (len=852)
  153 1.879432771 192.168.1.12 → 10.6.15.156  TCP 66 54766 → 22 [ACK] Seq=5661 Ack=35361 Win=6155 Len=0 TSval=8169467 TSecr=15100966
  154 1.887817019  10.6.15.156 → 192.168.1.12 SSH 134 Server: Encrypted packet (len=68)
  155 1.887933355  10.6.15.156 → 192.168.1.12 SSH 102 Server: Encrypted packet (len=36)
  156 1.887959995 192.168.1.12 → 10.6.15.156  TCP 66 54766 → 22 [ACK] Seq=5661 Ack=35465 Win=6155 Len=0 TSval=8169469 TSecr=15100969
  157 1.888089103 192.168.1.12 → 10.6.15.156  SSH 138 Client: Encrypted packet (len=72)
  158 1.889850243  10.6.15.156 → 192.168.1.12 SSH 102 Server: Encrypted packet (len=36)
  159 1.915233634  10.6.15.156 → 192.168.1.12 SSH 138 Server: Encrypted packet (len=72)
  160 1.915318915 192.168.1.12 → 10.6.15.156  TCP 66 54766 → 22 [ACK] Seq=5733 Ack=35573 Win=6155 Len=0 TSval=8169476 TSecr=15100970
  161 1.915485381 192.168.1.12 → 10.6.15.156  SSH 102 Client: Encrypted packet (len=36)
  162 1.916102844  10.6.15.156 → 192.168.1.12 SSH 138 Server: Encrypted packet (len=72)
  163 1.937486582  10.6.15.156 → 192.168.1.12 SSH 1514 Server: Encrypted packet (len=1448)
  164 1.937508061 192.168.1.12 → 10.6.15.156  SSH 102 Client: Encrypted packet (len=36)
  165 1.937553375  10.6.15.156 → 192.168.1.12 SSH 270 Server: Encrypted packet (len=204)
  166 1.950730069  10.6.15.156 → 192.168.1.12 SSH 138 Server: Encrypted packet (len=72)
  167 1.950796646 192.168.1.12 → 10.6.15.156  TCP 66 54766 → 22 [ACK] Seq=5805 Ack=37369 Win=6155 Len=0 TSval=8169484 TSecr=15100982
  168 1.950966389 192.168.1.12 → 10.6.15.156  SSH 102 Client: Encrypted packet (len=36)
  169 1.993232461  10.6.15.156 → 192.168.1.12 TCP 66 22 → 54766 [ACK] Seq=37369 Ack=5841 Win=1452 Len=0 TSval=15100996 TSecr=8169485
  170 2.004218767  10.6.15.156 → 192.168.1.12 SSH 138 Server: Encrypted packet (len=72)
  171 2.004453982 192.168.1.12 → 10.6.15.156  SSH 102 Client: Encrypted packet (len=36)
  172 2.006030455  10.6.15.156 → 192.168.1.12 TCP 66 22 → 54766 [ACK] Seq=37441 Ack=5877 Win=1452 Len=0 TSval=15100999 TSecr=8169498
  173 2.082388647  10.6.15.156 → 192.168.1.12 SSH 110 Server: Encrypted packet (len=44)
  174 2.094231872  10.6.15.156 → 192.168.1.12 SSH 190 Server: Encrypted packet (len=124)
  175 2.094328037 192.168.1.12 → 10.6.15.156  TCP 66 54766 → 22 [ACK] Seq=5877 Ack=37609 Win=6155 Len=0 TSval=8169520 TSecr=15101018
  176 2.427280070  10.6.15.156 → 192.168.1.12 SSH 134 Server: Encrypted packet (len=68)
  177 2.427424766  10.6.15.156 → 192.168.1.12 SSH 102 Server: Encrypted packet (len=36)
  178 2.427447864 192.168.1.12 → 10.6.15.156  TCP 66 54766 → 22 [ACK] Seq=5877 Ack=37713 Win=6155 Len=0 TSval=8169604 TSecr=15101104
  179 2.427554169 192.168.1.12 → 10.6.15.156  SSH 138 Client: Encrypted packet (len=72)
  180 2.429287828  10.6.15.156 → 192.168.1.12 TCP 66 22 → 54766 [ACK] Seq=37713 Ack=5949 Win=1452 Len=0 TSval=15101105 TSecr=8169604
  181 2.429766099  10.6.15.156 → 192.168.1.12 SSH 102 Server: Encrypted packet (len=36)
  182 2.470921546 192.168.1.12 → 10.6.15.156  TCP 66 54766 → 22 [ACK] Seq=5949 Ack=37749 Win=6155 Len=0 TSval=8169615 TSecr=15101105
  183 2.478329953  10.6.15.156 → 192.168.1.12 SSH 190 Server: Encrypted packet (len=124)
  184 2.478352705 192.168.1.12 → 10.6.15.156  TCP 66 54766 → 22 [ACK] Seq=5949 Ack=37873 Win=6155 Len=0 TSval=8169616 TSecr=15101116
  185 2.600537407  10.6.15.156 → 192.168.1.12 SSH 190 Server: Encrypted packet (len=124)
  186 2.600555595 192.168.1.12 → 10.6.15.156  TCP 66 54766 → 22 [ACK] Seq=5949 Ack=37997 Win=6155 Len=0 TSval=8169647 TSecr=15101147
  187 2.705432422  10.6.15.156 → 192.168.1.12 SSH 190 Server: Encrypted packet (len=124)
  188 2.705458133 192.168.1.12 → 10.6.15.156  TCP 66 54766 → 22 [ACK] Seq=5949 Ack=38121 Win=6155 Len=0 TSval=8169673 TSecr=15101174
  189 2.891637632 192.168.1.12 → 10.6.15.156  SSH 934 Client: Encrypted packet (len=868)
  190 2.928184449  10.6.15.156 → 192.168.1.12 SSH 270 Server: Encrypted packet (len=204)
  191 2.928210680 192.168.1.12 → 10.6.15.156  TCP 66 54766 → 22 [ACK] Seq=6817 Ack=38325 Win=6155 Len=0 TSval=8169729 TSecr=15101229
  192 2.996395587  10.6.15.156 → 192.168.1.12 SSH 342 Server: Encrypted packet (len=276)
  193 2.996412890 192.168.1.12 → 10.6.15.156  TCP 66 54766 → 22 [ACK] Seq=6817 Ack=38601 Win=6155 Len=0 TSval=8169746 TSecr=15101246
  194 3.051977581  10.6.15.156 → 192.168.1.12 SSH 310 Server: Encrypted packet (len=244)
  195 3.051995982 192.168.1.12 → 10.6.15.156  TCP 66 54766 → 22 [ACK] Seq=6817 Ack=38845 Win=6155 Len=0 TSval=8169760 TSecr=15101260
  196 3.156605572  10.6.15.156 → 192.168.1.12 SSH 302 Server: Encrypted packet (len=236)
  197 3.156630780 192.168.1.12 → 10.6.15.156  TCP 66 54766 → 22 [ACK] Seq=6817 Ack=39081 Win=6155 Len=0 TSval=8169786 TSecr=15101286
  198 3.299990624  10.6.15.156 → 192.168.1.12 SSH 534 Server: Encrypted packet (len=468)
  199 3.300005720 192.168.1.12 → 10.6.15.156  TCP 66 54766 → 22 [ACK] Seq=6817 Ack=39549 Win=6155 Len=0 TSval=8169822 TSecr=15101322
  200 3.378913432  10.6.15.156 → 192.168.1.12 SSH 374 Server: Encrypted packet (len=308)
  201 3.378928324 192.168.1.12 → 10.6.15.156  TCP 66 54766 → 22 [ACK] Seq=6817 Ack=39857 Win=6155 Len=0 TSval=8169842 TSecr=15101342
  202 3.447751392  10.6.15.156 → 192.168.1.12 SSH 270 Server: Encrypted packet (len=204)
  203 3.447766707 192.168.1.12 → 10.6.15.156  TCP 66 54766 → 22 [ACK] Seq=6817 Ack=40061 Win=6155 Len=0 TSval=8169859 TSecr=15101359
  204 3.503083005  10.6.15.156 → 192.168.1.12 SSH 302 Server: Encrypted packet (len=236)
  205 3.503100729 192.168.1.12 → 10.6.15.156  TCP 66 54766 → 22 [ACK] Seq=6817 Ack=40297 Win=6155 Len=0 TSval=8169873 TSecr=15101373
  206 3.607493322  10.6.15.156 → 192.168.1.12 SSH 302 Server: Encrypted packet (len=236)
  207 3.607510815 192.168.1.12 → 10.6.15.156  TCP 66 54766 → 22 [ACK] Seq=6817 Ack=40533 Win=6155 Len=0 TSval=8169899 TSecr=15101399
  208 3.898281876  10.6.15.156 → 192.168.1.12 SSH 294 Server: Encrypted packet (len=228)
  209 3.898300142 192.168.1.12 → 10.6.15.156  TCP 66 54766 → 22 [ACK] Seq=6817 Ack=40761 Win=6155 Len=0 TSval=8169971 TSecr=15101472
  210 3.953855249  10.6.15.156 → 192.168.1.12 SSH 254 Server: Encrypted packet (len=188)
  211 3.953872758 192.168.1.12 → 10.6.15.156  TCP 66 54766 → 22 [ACK] Seq=6817 Ack=40949 Win=6155 Len=0 TSval=8169985 TSecr=15101486
  212 4.058693513  10.6.15.156 → 192.168.1.12 SSH 286 Server: Encrypted packet (len=220)
  213 4.058711326 192.168.1.12 → 10.6.15.156  TCP 66 54766 → 22 [ACK] Seq=6817 Ack=41169 Win=6155 Len=0 TSval=8170011 TSecr=15101512
  214 4.280922638  10.6.15.156 → 192.168.1.12 SSH 422 Server: Encrypted packet (len=356)
  215 4.280940322 192.168.1.12 → 10.6.15.156  TCP 66 54766 → 22 [ACK] Seq=6817 Ack=41525 Win=6155 Len=0 TSval=8170067 TSecr=15101567
  216 4.349424805  10.6.15.156 → 192.168.1.12 SSH 342 Server: Encrypted packet (len=276)
  217 4.349442314 192.168.1.12 → 10.6.15.156  TCP 66 54766 → 22 [ACK] Seq=6817 Ack=41801 Win=6155 Len=0 TSval=8170084 TSecr=15101585
  218 4.405275771  10.6.15.156 → 192.168.1.12 SSH 358 Server: Encrypted packet (len=292)
  219 4.405297938 192.168.1.12 → 10.6.15.156  TCP 66 54766 → 22 [ACK] Seq=6817 Ack=42093 Win=6155 Len=0 TSval=8170098 TSecr=15101598
  220 4.512490773  10.6.15.156 → 192.168.1.12 SSH 374 Server: Encrypted packet (len=308)
  221 4.512509425 192.168.1.12 → 10.6.15.156  TCP 66 54766 → 22 [ACK] Seq=6817 Ack=42401 Win=6155 Len=0 TSval=8170125 TSecr=15101625
  222 4.855765340  10.6.15.156 → 192.168.1.12 SSH 206 Server: Encrypted packet (len=140)
  223 4.855782419 192.168.1.12 → 10.6.15.156  TCP 66 54766 → 22 [ACK] Seq=6817 Ack=42541 Win=6155 Len=0 TSval=8170211 TSecr=15101711
  224 5.182644114  10.6.15.156 → 192.168.1.12 SSH 206 Server: Encrypted packet (len=140)
  225 5.182659913 192.168.1.12 → 10.6.15.156  TCP 66 54766 → 22 [ACK] Seq=6817 Ack=42681 Win=6155 Len=0 TSval=8170292 TSecr=15101793
  226 5.251245151  10.6.15.156 → 192.168.1.12 SSH 222 Server: Encrypted packet (len=156)
  227 5.251263451 192.168.1.12 → 10.6.15.156  TCP 66 54766 → 22 [ACK] Seq=6817 Ack=42837 Win=6155 Len=0 TSval=8170310 TSecr=15101810
  228 5.306588329  10.6.15.156 → 192.168.1.12 SSH 222 Server: Encrypted packet (len=156)
  229 5.306605632 192.168.1.12 → 10.6.15.156  TCP 66 54766 → 22 [ACK] Seq=6817 Ack=42993 Win=6155 Len=0 TSval=8170323 TSecr=15101824
  230 5.411492848  10.6.15.156 → 192.168.1.12 SSH 254 Server: Encrypted packet (len=188)
  231 5.411511748 192.168.1.12 → 10.6.15.156  TCP 66 54766 → 22 [ACK] Seq=6817 Ack=43181 Win=6155 Len=0 TSval=8170350 TSecr=15101850
  232 5.634189005  10.6.15.156 → 192.168.1.12 SSH 582 Server: Encrypted packet (len=516)
  233 5.634207244 192.168.1.12 → 10.6.15.156  TCP 66 54766 → 22 [ACK] Seq=6817 Ack=43697 Win=6155 Len=0 TSval=8170405 TSecr=15101906
  234 5.703710312  10.6.15.156 → 192.168.1.12 SSH 222 Server: Encrypted packet (len=156)
  235 5.703728526 192.168.1.12 → 10.6.15.156  TCP 66 54766 → 22 [ACK] Seq=6817 Ack=43853 Win=6155 Len=0 TSval=8170423 TSecr=15101923
  236 5.758049022  10.6.15.156 → 192.168.1.12 SSH 238 Server: Encrypted packet (len=172)
  237 5.758067882 192.168.1.12 → 10.6.15.156  TCP 66 54766 → 22 [ACK] Seq=6817 Ack=44025 Win=6155 Len=0 TSval=8170436 TSecr=15101937
  238 5.862395163  10.6.15.156 → 192.168.1.12 SSH 206 Server: Encrypted packet (len=140)
  239 5.862413283 192.168.1.12 → 10.6.15.156  TCP 66 54766 → 22 [ACK] Seq=6817 Ack=44165 Win=6155 Len=0 TSval=8170462 TSecr=15101963
  240 6.084875306  10.6.15.156 → 192.168.1.12 SSH 286 Server: Encrypted packet (len=220)
  241 6.084891417 192.168.1.12 → 10.6.15.156  TCP 66 54766 → 22 [ACK] Seq=6817 Ack=44385 Win=6155 Len=0 TSval=8170518 TSecr=15102018
  242 6.153968275  10.6.15.156 → 192.168.1.12 SSH 326 Server: Encrypted packet (len=260)
  243 6.153994018 192.168.1.12 → 10.6.15.156  TCP 66 54766 → 22 [ACK] Seq=6817 Ack=44645 Win=6155 Len=0 TSval=8170535 TSecr=15102036
  244 6.209429965  10.6.15.156 → 192.168.1.12 SSH 286 Server: Encrypted packet (len=220)
  245 6.209448199 192.168.1.12 → 10.6.15.156  TCP 66 54766 → 22 [ACK] Seq=6817 Ack=44865 Win=6155 Len=0 TSval=8170549 TSecr=15102049
  246 6.313793692  10.6.15.156 → 192.168.1.12 SSH 582 Server: Encrypted packet (len=516)
  247 6.313810518 192.168.1.12 → 10.6.15.156  TCP 66 54766 → 22 [ACK] Seq=6817 Ack=45381 Win=6155 Len=0 TSval=8170575 TSecr=15102076
  248 6.397148182  192.168.1.1 → 224.0.0.1    IGMPv2 42 Membership Query, general
  249 6.536007580  10.6.15.156 → 192.168.1.12 SSH 182 Server: Encrypted packet (len=116)
  250 6.536025567 192.168.1.12 → 10.6.15.156  TCP 66 54766 → 22 [ACK] Seq=6817 Ack=45497 Win=6155 Len=0 TSval=8170631 TSecr=15102131
  251 6.604456852  10.6.15.156 → 192.168.1.12 SSH 486 Server: Encrypted packet (len=420)
  252 6.604478896 192.168.1.12 → 10.6.15.156  TCP 66 54766 → 22 [ACK] Seq=6817 Ack=45917 Win=6155 Len=0 TSval=8170648 TSecr=15102148
  253 6.604631373 192.168.1.12 → 10.6.15.156  SSH 102 Client: Encrypted packet (len=36)
  254 6.645260318  10.6.15.156 → 192.168.1.12 TCP 66 22 → 54766 [ACK] Seq=45917 Ack=6853 Win=1452 Len=0 TSval=15102159 TSecr=8170648
  255 6.660099656  10.6.15.156 → 192.168.1.12 SSH 486 Server: Encrypted packet (len=420)
  256 6.702925693 192.168.1.12 → 10.6.15.156  TCP 66 54766 → 22 [ACK] Seq=6853 Ack=46337 Win=6155 Len=0 TSval=8170673 TSecr=15102162
  257 6.766186042  10.6.15.156 → 192.168.1.12 SSH 182 Server: Encrypted packet (len=116)
  258 6.766212101 192.168.1.12 → 10.6.15.156  TCP 66 54766 → 22 [ACK] Seq=6853 Ack=46453 Win=6155 Len=0 TSval=8170688 TSecr=15102188
  259 6.953215076  10.6.15.156 → 192.168.1.12 SSH 190 Server: Encrypted packet (len=124)
  260 6.953240732 192.168.1.12 → 10.6.15.156  TCP 66 54766 → 22 [ACK] Seq=6853 Ack=46577 Win=6155 Len=0 TSval=8170735 TSecr=15102236
  261 6.987229202  10.6.15.156 → 192.168.1.12 SSH 358 Server: Encrypted packet (len=292)
  262 6.987248429 192.168.1.12 → 10.6.15.156  TCP 66 54766 → 22 [ACK] Seq=6853 Ack=46869 Win=6155 Len=0 TSval=8170744 TSecr=15102244
  263 7.050868326 192.168.1.12 → 224.0.0.251  IGMPv2 46 Membership Report group 224.0.0.251
  264 7.055281660  10.6.15.156 → 192.168.1.12 SSH 182 Server: Encrypted packet (len=116)
  265 7.055293671 192.168.1.12 → 10.6.15.156  TCP 66 54766 → 22 [ACK] Seq=6853 Ack=46985 Win=6155 Len=0 TSval=8170761 TSecr=15102261
  266 7.110680371  10.6.15.156 → 192.168.1.12 SSH 182 Server: Encrypted packet (len=116)
  267 7.110698712 192.168.1.12 → 10.6.15.156  TCP 66 54766 → 22 [ACK] Seq=6853 Ack=47101 Win=6155 Len=0 TSval=8170774 TSecr=15102275
  268 7.215519162  10.6.15.156 → 192.168.1.12 SSH 222 Server: Encrypted packet (len=156)
  269 7.215537662 192.168.1.12 → 10.6.15.156  TCP 66 54766 → 22 [ACK] Seq=6853 Ack=47257 Win=6155 Len=0 TSval=8170801 TSecr=15102301
  270 7.437850406  10.6.15.156 → 192.168.1.12 SSH 182 Server: Encrypted packet (len=116)
  271 7.437867539 192.168.1.12 → 10.6.15.156  TCP 66 54766 → 22 [ACK] Seq=6853 Ack=47373 Win=6155 Len=0 TSval=8170856 TSecr=15102357
  272 7.506353616  10.6.15.156 → 192.168.1.12 SSH 334 Server: Encrypted packet (len=268)
  273 7.506371735 192.168.1.12 → 10.6.15.156  TCP 66 54766 → 22 [ACK] Seq=6853 Ack=47641 Win=6155 Len=0 TSval=8170873 TSecr=15102374
  274 7.561935835  10.6.15.156 → 192.168.1.12 SSH 342 Server: Encrypted packet (len=276)
  275 7.561954305 192.168.1.12 → 10.6.15.156  TCP 66 54766 → 22 [ACK] Seq=6853 Ack=47917 Win=6155 Len=0 TSval=8170887 TSecr=15102388
  276 7.669405052  10.6.15.156 → 192.168.1.12 SSH 342 Server: Encrypted packet (len=276)
  277 7.669423340 192.168.1.12 → 10.6.15.156  TCP 66 54766 → 22 [ACK] Seq=6853 Ack=48193 Win=6155 Len=0 TSval=8170914 TSecr=15102414
  278 7.888709467  10.6.15.156 → 192.168.1.12 SSH 238 Server: Encrypted packet (len=172)
  279 7.888726882 192.168.1.12 → 10.6.15.156  TCP 66 54766 → 22 [ACK] Seq=6853 Ack=48365 Win=6155 Len=0 TSval=8170969 TSecr=15102469
  280 7.957215463  10.6.15.156 → 192.168.1.12 SSH 182 Server: Encrypted packet (len=116)
  281 7.957234714 192.168.1.12 → 10.6.15.156  TCP 66 54766 → 22 [ACK] Seq=6853 Ack=48481 Win=6155 Len=0 TSval=8170986 TSecr=15102487
  282 8.012773656  10.6.15.156 → 192.168.1.12 SSH 182 Server: Encrypted packet (len=116)
  283 8.012846407 192.168.1.12 → 10.6.15.156  TCP 66 54766 → 22 [ACK] Seq=6853 Ack=48597 Win=6155 Len=0 TSval=8171000 TSecr=15102500
  284 8.568451758  10.6.15.156 → 192.168.1.12 SSH 222 Server: Encrypted packet (len=156)
  285 8.568479252 192.168.1.12 → 10.6.15.156  TCP 66 54766 → 22 [ACK] Seq=6853 Ack=48753 Win=6155 Len=0 TSval=8171139 TSecr=15102639
  286 8.859386205  10.6.15.156 → 192.168.1.12 SSH 374 Server: Encrypted packet (len=308)
  287 8.859404099 192.168.1.12 → 10.6.15.156  TCP 66 54766 → 22 [ACK] Seq=6853 Ack=49061 Win=6155 Len=0 TSval=8171212 TSecr=15102712
  288 8.916894816  10.6.15.156 → 192.168.1.12 SSH 422 Server: Encrypted packet (len=356)
  289 8.916911863 192.168.1.12 → 10.6.15.156  TCP 66 54766 → 22 [ACK] Seq=6853 Ack=49417 Win=6155 Len=0 TSval=8171226 TSecr=15102726
  290 9.019615342  10.6.15.156 → 192.168.1.12 SSH 358 Server: Encrypted packet (len=292)
  291 9.019636458 192.168.1.12 → 10.6.15.156  TCP 66 54766 → 22 [ACK] Seq=6853 Ack=49709 Win=6155 Len=0 TSval=8171252 TSecr=15102752
  292 9.241885081  10.6.15.156 → 192.168.1.12 SSH 358 Server: Encrypted packet (len=292)
  293 9.241903799 192.168.1.12 → 10.6.15.156  TCP 66 54766 → 22 [ACK] Seq=6853 Ack=50001 Win=6155 Len=0 TSval=8171307 TSecr=15102808
  294 9.310224045  10.6.15.156 → 192.168.1.12 SSH 286 Server: Encrypted packet (len=220)
  295 9.310239163 192.168.1.12 → 10.6.15.156  TCP 66 54766 → 22 [ACK] Seq=6853 Ack=50221 Win=6155 Len=0 TSval=8171324 TSecr=15102825
  296 9.365762624  10.6.15.156 → 192.168.1.12 SSH 238 Server: Encrypted packet (len=172)
  297 9.365774979 192.168.1.12 → 10.6.15.156  TCP 66 54766 → 22 [ACK] Seq=6853 Ack=50393 Win=6155 Len=0 TSval=8171338 TSecr=15102839
  298 9.470533165  10.6.15.156 → 192.168.1.12 SSH 238 Server: Encrypted packet (len=172)
  299 9.470550769 192.168.1.12 → 10.6.15.156  TCP 66 54766 → 22 [ACK] Seq=6853 Ack=50565 Win=6155 Len=0 TSval=8171364 TSecr=15102865
  300 9.578897233 192.168.1.12 → 224.0.0.252  IGMPv2 46 Membership Report group 224.0.0.252
  301 9.692794398  10.6.15.156 → 192.168.1.12 SSH 342 Server: Encrypted packet (len=276)
  302 9.692810799 192.168.1.12 → 10.6.15.156  TCP 66 54766 → 22 [ACK] Seq=6853 Ack=50841 Win=6155 Len=0 TSval=8171420 TSecr=15102920
  303 9.761288570  10.6.15.156 → 192.168.1.12 SSH 238 Server: Encrypted packet (len=172)
  304 9.761306401 192.168.1.12 → 10.6.15.156  TCP 66 54766 → 22 [ACK] Seq=6853 Ack=51013 Win=6155 Len=0 TSval=8171437 TSecr=15102938
  305 9.817094508  10.6.15.156 → 192.168.1.12 SSH 238 Server: Encrypted packet (len=172)
  306 9.817113460 192.168.1.12 → 10.6.15.156  TCP 66 54766 → 22 [ACK] Seq=6853 Ack=51185 Win=6155 Len=0 TSval=8171451 TSecr=15102951
  307 9.922848742  10.6.15.156 → 192.168.1.12 SSH 694 Server: Encrypted packet (len=628)
  308 9.922872859 192.168.1.12 → 10.6.15.156  TCP 66 54766 → 22 [ACK] Seq=6853 Ack=51813 Win=6155 Len=0 TSval=8171478 TSecr=15102978
  309 9.933708507  10.6.15.156 → 192.168.1.12 SSH 694 Server: [TCP Spurious Retransmission] , Encrypted packet (len=628)
  310 9.933730189 192.168.1.12 → 10.6.15.156  TCP 78 [TCP Dup ACK 308#1] 54766 → 22 [ACK] Seq=6853 Ack=51813 Win=6155 Len=0 TSval=8171480 TSecr=15102981 SLE=51185 SRE=51813
  311 10.144687189  10.6.15.156 → 192.168.1.12 SSH 1158 Server: Encrypted packet (len=1092)
  312 10.144706406 192.168.1.12 → 10.6.15.156  TCP 66 54766 → 22 [ACK] Seq=6853 Ack=52905 Win=6155 Len=0 TSval=8171533 TSecr=15103033
  313 10.215362339  10.6.15.156 → 192.168.1.12 SSH 950 Server: Encrypted packet (len=884)
  314 10.215380432 192.168.1.12 → 10.6.15.156  TCP 66 54766 → 22 [ACK] Seq=6853 Ack=53789 Win=6155 Len=0 TSval=8171551 TSecr=15103050
  315 10.268753796  10.6.15.156 → 192.168.1.12 SSH 1158 Server: Encrypted packet (len=1092)
  316 10.268771290 192.168.1.12 → 10.6.15.156  TCP 66 54766 → 22 [ACK] Seq=6853 Ack=54881 Win=6155 Len=0 TSval=8171564 TSecr=15103064
  317 10.374063635  10.6.15.156 → 192.168.1.12 SSH 950 Server: Encrypted packet (len=884)
  318 10.374082675 192.168.1.12 → 10.6.15.156  TCP 66 54766 → 22 [ACK] Seq=6853 Ack=55765 Win=6155 Len=0 TSval=8171590 TSecr=15103090
  319 10.551330195  10.6.15.156 → 192.168.1.12 SSH 190 Server: Encrypted packet (len=124)
  320 10.551348725 192.168.1.12 → 10.6.15.156  TCP 66 54766 → 22 [ACK] Seq=6853 Ack=55889 Win=6155 Len=0 TSval=8171635 TSecr=15103135
  321 10.594623934  10.6.15.156 → 192.168.1.12 SSH 198 Server: Encrypted packet (len=132)
  322 10.594641989 192.168.1.12 → 10.6.15.156  TCP 66 54766 → 22 [ACK] Seq=6853 Ack=56021 Win=6155 Len=0 TSval=8171645 TSecr=15103146
  323 10.663676934  10.6.15.156 → 192.168.1.12 SSH 582 Server: Encrypted packet (len=516)
  324 10.663696028 192.168.1.12 → 10.6.15.156  TCP 66 54766 → 22 [ACK] Seq=6853 Ack=56537 Win=6155 Len=0 TSval=8171663 TSecr=15103163
  325 10.694337063 192.168.1.12 → 10.6.15.156  SSH 1514 Client: Encrypted packet (len=1448)
  326 10.696943715  10.6.15.156 → 192.168.1.12 TCP 66 22 → 54766 [ACK] Seq=56537 Ack=8301 Win=1452 Len=0 TSval=15103171 TSecr=8171670
  327 10.696964892 192.168.1.12 → 10.6.15.156  SSH 862 Client: Encrypted packet (len=796)
  328 10.698994479  10.6.15.156 → 192.168.1.12 TCP 66 22 → 54766 [ACK] Seq=56537 Ack=9097 Win=1452 Len=0 TSval=15103172 TSecr=8171671
  329 10.701816903  10.6.15.156 → 192.168.1.12 SSH 142 Server: Encrypted packet (len=76)
  330 10.718799953  10.6.15.156 → 192.168.1.12 SSH 286 Server: Encrypted packet (len=220)
  331 10.718911264 192.168.1.12 → 10.6.15.156  TCP 66 54766 → 22 [ACK] Seq=9097 Ack=56833 Win=6155 Len=0 TSval=8171677 TSecr=15103173
  332 10.817821278  10.6.15.156 → 192.168.1.12 SSH 814 Server: Encrypted packet (len=748)
  333 10.817844177  10.6.15.156 → 192.168.1.12 SSH 366 Server: Encrypted packet (len=300)
  334 10.817916302 192.168.1.12 → 10.6.15.156  TCP 66 54766 → 22 [ACK] Seq=9097 Ack=57881 Win=6155 Len=0 TSval=8171701 TSecr=15103202
  335 10.818656489 192.168.1.12 → 10.6.15.156  SSH 134 Client: Encrypted packet (len=68)
  336 10.823784442  10.6.15.156 → 192.168.1.12 SSH 438 Server: Encrypted packet (len=372)
  337 10.866898090 192.168.1.12 → 10.6.15.156  TCP 66 54766 → 22 [ACK] Seq=9165 Ack=58253 Win=6155 Len=0 TSval=8171714 TSecr=15103203
  338 11.036574036 192.168.1.12 → 10.6.15.156  SSH 118 Client: Encrypted packet (len=52)
  339 11.048523096  10.6.15.156 → 192.168.1.12 SSH 566 Server: Encrypted packet (len=500)
  340 11.048553026 192.168.1.12 → 10.6.15.156  TCP 66 54766 → 22 [ACK] Seq=9217 Ack=58753 Win=6155 Len=0 TSval=8171759 TSecr=15103259
  341 11.114489113  10.6.15.156 → 192.168.1.12 SSH 582 Server: Encrypted packet (len=516)
  342 11.114506881 192.168.1.12 → 10.6.15.156  TCP 66 54766 → 22 [ACK] Seq=9217 Ack=59269 Win=6155 Len=0 TSval=8171775 TSecr=15103276
  343 11.170103311  10.6.15.156 → 192.168.1.12 SSH 550 Server: Encrypted packet (len=484)
  344 11.170119739 192.168.1.12 → 10.6.15.156  TCP 66 54766 → 22 [ACK] Seq=9217 Ack=59753 Win=6155 Len=0 TSval=8171789 TSecr=15103290
  345 11.253495932  10.6.15.156 → 192.168.1.12 SSH 110 Server: Encrypted packet (len=44)
  346 11.253513794 192.168.1.12 → 10.6.15.156  TCP 66 54766 → 22 [ACK] Seq=9217 Ack=59797 Win=6155 Len=0 TSval=8171810 TSecr=15103311
  347 11.253920036 192.168.1.12 → 10.6.15.156  SSH 350 Client: Encrypted packet (len=284)
  348 11.274692238  10.6.15.156 → 192.168.1.12 SSH 438 Server: Encrypted packet (len=372)
  349 11.314923424 192.168.1.12 → 10.6.15.156  TCP 66 54766 → 22 [ACK] Seq=9501 Ack=60169 Win=6155 Len=0 TSval=8171826 TSecr=15103316
  350 11.471551444  10.6.15.156 → 192.168.1.12 SSH 190 Server: Encrypted packet (len=124)
  351 11.471577358 192.168.1.12 → 10.6.15.156  TCP 66 54766 → 22 [ACK] Seq=9501 Ack=60293 Win=6155 Len=0 TSval=8171865 TSecr=15103365
  352 11.496851713  10.6.15.156 → 192.168.1.12 SSH 326 Server: Encrypted packet (len=260)
  353 11.496870011 192.168.1.12 → 10.6.15.156  TCP 66 54766 → 22 [ACK] Seq=9501 Ack=60553 Win=6155 Len=0 TSval=8171871 TSecr=15103371
  354 11.565362404  10.6.15.156 → 192.168.1.12 SSH 182 Server: Encrypted packet (len=116)
  355 11.565383520 192.168.1.12 → 10.6.15.156  TCP 66 54766 → 22 [ACK] Seq=9501 Ack=60669 Win=6155 Len=0 TSval=8171888 TSecr=15103389
  356 11.620839634  10.6.15.156 → 192.168.1.12 SSH 254 Server: Encrypted packet (len=188)
  357 11.620857284 192.168.1.12 → 10.6.15.156  TCP 66 54766 → 22 [ACK] Seq=9501 Ack=60857 Win=6155 Len=0 TSval=8171902 TSecr=15103402
  358 11.725416068  10.6.15.156 → 192.168.1.12 SSH 198 Server: Encrypted packet (len=132)
  359 11.725432570 192.168.1.12 → 10.6.15.156  TCP 66 54766 → 22 [ACK] Seq=9501 Ack=60989 Win=6155 Len=0 TSval=8171928 TSecr=15103429
  360 11.947649345  10.6.15.156 → 192.168.1.12 SSH 198 Server: Encrypted packet (len=132)
  361 11.947667321 192.168.1.12 → 10.6.15.156  TCP 66 54766 → 22 [ACK] Seq=9501 Ack=61121 Win=6155 Len=0 TSval=8171984 TSecr=15103484
  362 12.016970001  10.6.15.156 → 192.168.1.12 SSH 742 Server: Encrypted packet (len=676)
  363 12.016992182 192.168.1.12 → 10.6.15.156  TCP 66 54766 → 22 [ACK] Seq=9501 Ack=61797 Win=6155 Len=0 TSval=8172001 TSecr=15103501
  364 12.072538664  10.6.15.156 → 192.168.1.12 SSH 710 Server: Encrypted packet (len=644)
  365 12.072564380 192.168.1.12 → 10.6.15.156  TCP 66 54766 → 22 [ACK] Seq=9501 Ack=62441 Win=6155 Len=0 TSval=8172015 TSecr=15103515
  366 12.176852094  10.6.15.156 → 192.168.1.12 SSH 710 Server: Encrypted packet (len=644)
  367 12.176870529 192.168.1.12 → 10.6.15.156  TCP 66 54766 → 22 [ACK] Seq=9501 Ack=63085 Win=6155 Len=0 TSval=8172041 TSecr=15103541
  368 12.359670916  10.6.15.156 → 192.168.1.12 SSH 158 Server: Encrypted packet (len=92)
  369 12.359685890 192.168.1.12 → 10.6.15.156  TCP 66 54766 → 22 [ACK] Seq=9501 Ack=63177 Win=6155 Len=0 TSval=8172087 TSecr=15103587
  370 12.359926816 192.168.1.12 → 10.6.15.156  SSH 158 Client: Encrypted packet (len=92)
  371 12.399184430  10.6.15.156 → 192.168.1.12 SSH 710 Server: Encrypted packet (len=644)
  372 12.442864494 192.168.1.12 → 10.6.15.156  TCP 66 54766 → 22 [ACK] Seq=9593 Ack=63821 Win=6155 Len=0 TSval=8172108 TSecr=15103597
  373 12.467812907  10.6.15.156 → 192.168.1.12 SSH 182 Server: Encrypted packet (len=116)
  374 12.467840276 192.168.1.12 → 10.6.15.156  TCP 66 54766 → 22 [ACK] Seq=9593 Ack=63937 Win=6155 Len=0 TSval=8172114 TSecr=15103614
  375 12.627547207  10.6.15.156 → 192.168.1.12 SSH 302 Server: Encrypted packet (len=236)
  376 12.627575399 192.168.1.12 → 10.6.15.156  TCP 66 54766 → 22 [ACK] Seq=9593 Ack=64173 Win=6155 Len=0 TSval=8172154 TSecr=15103654
  377 12.637502156  10.6.15.156 → 192.168.1.12 SSH 150 Server: Encrypted packet (len=84)
  378 12.637519440 192.168.1.12 → 10.6.15.156  TCP 66 54766 → 22 [ACK] Seq=9593 Ack=64257 Win=6155 Len=0 TSval=8172156 TSecr=15103657
  379 12.637829921 192.168.1.12 → 10.6.15.156  SSH 150 Client: Encrypted packet (len=84)
  380 12.677161818  10.6.15.156 → 192.168.1.12 TCP 66 22 → 54766 [ACK] Seq=64257 Ack=9677 Win=1452 Len=0 TSval=15103667 TSecr=8172156
  381 12.849779523  10.6.15.156 → 192.168.1.12 SSH 310 Server: Encrypted packet (len=244)
  382 12.890922278 192.168.1.12 → 10.6.15.156  TCP 66 54766 → 22 [ACK] Seq=9677 Ack=64501 Win=6155 Len=0 TSval=8172220 TSecr=15103710
  383 12.918244705  10.6.15.156 → 192.168.1.12 SSH 310 Server: Encrypted packet (len=244)
  384 12.918274970 192.168.1.12 → 10.6.15.156  TCP 66 54766 → 22 [ACK] Seq=9677 Ack=64745 Win=6155 Len=0 TSval=8172226 TSecr=15103727
  385 12.974126069  10.6.15.156 → 192.168.1.12 SSH 302 Server: Encrypted packet (len=236)
  386 12.974143496 192.168.1.12 → 10.6.15.156  TCP 66 54766 → 22 [ACK] Seq=9677 Ack=64981 Win=6155 Len=0 TSval=8172240 TSecr=15103741
  387 13.301230353  10.6.15.156 → 192.168.1.12 SSH 222 Server: Encrypted packet (len=156)
  388 13.301247721 192.168.1.12 → 10.6.15.156  TCP 66 54766 → 22 [ACK] Seq=9677 Ack=65137 Win=6155 Len=0 TSval=8172322 TSecr=15103822
  389 13.369158587  10.6.15.156 → 192.168.1.12 SSH 222 Server: Encrypted packet (len=156)
  390 13.369176272 192.168.1.12 → 10.6.15.156  TCP 66 54766 → 22 [ACK] Seq=9677 Ack=65293 Win=6155 Len=0 TSval=8172339 TSecr=15103840
  391 13.424869510  10.6.15.156 → 192.168.1.12 SSH 222 Server: Encrypted packet (len=156)
  392 13.424887810 192.168.1.12 → 10.6.15.156  TCP 66 54766 → 22 [ACK] Seq=9677 Ack=65449 Win=6155 Len=0 TSval=8172353 TSecr=15103853
  393 13.529402003  10.6.15.156 → 192.168.1.12 SSH 222 Server: Encrypted packet (len=156)
  394 13.529420161 192.168.1.12 → 10.6.15.156  TCP 66 54766 → 22 [ACK] Seq=9677 Ack=65605 Win=6155 Len=0 TSval=8172379 TSecr=15103880
  395 13.751753231  10.6.15.156 → 192.168.1.12 SSH 254 Server: Encrypted packet (len=188)
  396 13.751772181 192.168.1.12 → 10.6.15.156  TCP 66 54766 → 22 [ACK] Seq=9677 Ack=65793 Win=6155 Len=0 TSval=8172435 TSecr=15103935
  397 13.820119176  10.6.15.156 → 192.168.1.12 SSH 206 Server: Encrypted packet (len=140)
  398 13.820135858 192.168.1.12 → 10.6.15.156  TCP 66 54766 → 22 [ACK] Seq=9677 Ack=65933 Win=6155 Len=0 TSval=8172452 TSecr=15103952
  399 13.875777318  10.6.15.156 → 192.168.1.12 SSH 198 Server: Encrypted packet (len=132)
  400 13.875795653 192.168.1.12 → 10.6.15.156  TCP 66 54766 → 22 [ACK] Seq=9677 Ack=66065 Win=6155 Len=0 TSval=8172466 TSecr=15103966
  401 13.980324666  10.6.15.156 → 192.168.1.12 SSH 198 Server: Encrypted packet (len=132)
  402 13.980348120 192.168.1.12 → 10.6.15.156  TCP 66 54766 → 22 [ACK] Seq=9677 Ack=66197 Win=6155 Len=0 TSval=8172492 TSecr=15103992
  403 14.009432966  10.6.15.156 → 192.168.1.12 SSH 138 Server: Encrypted packet (len=72)
  404 14.009451376 192.168.1.12 → 10.6.15.156  TCP 66 54766 → 22 [ACK] Seq=9677 Ack=66269 Win=6155 Len=0 TSval=8172499 TSecr=15104000
  405 14.009707382 192.168.1.12 → 10.6.15.156  SSH 102 Client: Encrypted packet (len=36)
  406 14.010927290  10.6.15.156 → 192.168.1.12 TCP 66 22 → 54766 [ACK] Seq=66269 Ack=9713 Win=1452 Len=0 TSval=15104000 TSecr=8172499
  407 14.202921588  10.6.15.156 → 192.168.1.12 SSH 238 Server: Encrypted packet (len=172)
  408 14.246921859 192.168.1.12 → 10.6.15.156  TCP 66 54766 → 22 [ACK] Seq=9713 Ack=66441 Win=6155 Len=0 TSval=8172559 TSecr=15104048
  409 14.271468390  10.6.15.156 → 192.168.1.12 SSH 270 Server: Encrypted packet (len=204)
  410 14.271496035 192.168.1.12 → 10.6.15.156  TCP 66 54766 → 22 [ACK] Seq=9713 Ack=66645 Win=6155 Len=0 TSval=8172565 TSecr=15104065
  411 14.326997446  10.6.15.156 → 192.168.1.12 SSH 334 Server: Encrypted packet (len=268)
  412 14.327016246 192.168.1.12 → 10.6.15.156  TCP 66 54766 → 22 [ACK] Seq=9713 Ack=66913 Win=6155 Len=0 TSval=8172579 TSecr=15104079
  413 14.431620835  10.6.15.156 → 192.168.1.12 SSH 438 Server: Encrypted packet (len=372)
  414 14.431638890 192.168.1.12 → 10.6.15.156  TCP 66 54766 → 22 [ACK] Seq=9713 Ack=67285 Win=6155 Len=0 TSval=8172605 TSecr=15104105
  415 14.653880903  10.6.15.156 → 192.168.1.12 SSH 342 Server: Encrypted packet (len=276)
  416 14.653898993 192.168.1.12 → 10.6.15.156  TCP 66 54766 → 22 [ACK] Seq=9713 Ack=67561 Win=6155 Len=0 TSval=8172660 TSecr=15104161
  417 14.722292821  10.6.15.156 → 192.168.1.12 SSH 302 Server: Encrypted packet (len=236)
  418 14.722311179 192.168.1.12 → 10.6.15.156  TCP 66 54766 → 22 [ACK] Seq=9713 Ack=67797 Win=6155 Len=0 TSval=8172677 TSecr=15104178
  419 14.777777568  10.6.15.156 → 192.168.1.12 SSH 518 Server: Encrypted packet (len=452)
  420 14.777864466 192.168.1.12 → 10.6.15.156  TCP 66 54766 → 22 [ACK] Seq=9713 Ack=68249 Win=6155 Len=0 TSval=8172691 TSecr=15104192
  421 14.882628179  10.6.15.156 → 192.168.1.12 SSH 422 Server: Encrypted packet (len=356)
  422 14.882715575 192.168.1.12 → 10.6.15.156  TCP 66 54766 → 22 [ACK] Seq=9713 Ack=68605 Win=6155 Len=0 TSval=8172717 TSecr=15104218
  423 15.034588753 192.168.1.12 → 10.6.15.156  SSH 102 Client: Encrypted packet (len=36)
  424 15.036785287  10.6.15.156 → 192.168.1.12 TCP 66 22 → 54766 [ACK] Seq=68605 Ack=9749 Win=1452 Len=0 TSval=15104256 TSecr=8172755
  425 15.036806273 192.168.1.12 → 10.6.15.156  SSH 470 Client: Encrypted packet (len=404)
  426 15.039406375  10.6.15.156 → 192.168.1.12 TCP 66 22 → 54766 [ACK] Seq=68605 Ack=10153 Win=1452 Len=0 TSval=15104257 TSecr=8172756
  427 15.042185412  10.6.15.156 → 192.168.1.12 SSH 138 Server: Encrypted packet (len=72)
  428 15.042266623 192.168.1.12 → 10.6.15.156  TCP 66 54766 → 22 [ACK] Seq=10153 Ack=68677 Win=6155 Len=0 TSval=8172757 TSecr=15104257
  429 15.042430017 192.168.1.12 → 10.6.15.156  SSH 102 Client: Encrypted packet (len=36)
  430 15.042785077  10.6.15.156 → 192.168.1.12 SSH 210 Server: Encrypted packet (len=144)
  431 15.076474488  10.6.15.156 → 192.168.1.12 SSH 138 Server: Encrypted packet (len=72)
  432 15.076494993 192.168.1.12 → 10.6.15.156  SSH 138 Client: Encrypted packet (len=72)
  433 15.077001570 192.168.1.12 → 10.6.15.156  SSH 102 Client: Encrypted packet (len=36)
  434 15.077794062  10.6.15.156 → 192.168.1.12 SSH 210 Server: Encrypted packet (len=144)
  435 15.078100707  10.6.15.156 → 192.168.1.12 SSH 138 Server: Encrypted packet (len=72)
  436 15.078117589 192.168.1.12 → 10.6.15.156  TCP 66 54766 → 22 [ACK] Seq=10297 Ack=69109 Win=6155 Len=0 TSval=8172766 TSecr=15104267
  437 15.078396639 192.168.1.12 → 10.6.15.156  SSH 174 Client: Encrypted packet (len=108)
  438 15.079340704  10.6.15.156 → 192.168.1.12 TCP 66 22 → 54766 [ACK] Seq=69109 Ack=10297 Win=1452 Len=0 TSval=15104267 TSecr=8172766
  439 15.079738152  10.6.15.156 → 192.168.1.12 SSH 210 Server: Encrypted packet (len=144)
  440 15.104825443  10.6.15.156 → 192.168.1.12 SSH 342 Server: Encrypted packet (len=276)
  441 15.104843995 192.168.1.12 → 10.6.15.156  SSH 138 Client: Encrypted packet (len=72)
  442 15.145817246  10.6.15.156 → 192.168.1.12 TCP 66 22 → 54766 [ACK] Seq=69529 Ack=10477 Win=1452 Len=0 TSval=15104284 TSecr=8172773
  443 15.173416931  10.6.15.156 → 192.168.1.12 SSH 454 Server: Encrypted packet (len=388)
  444 15.187319108  10.6.15.156 → 192.168.1.12 SSH 110 Server: Encrypted packet (len=44)
  445 15.187410818 192.168.1.12 → 10.6.15.156  TCP 66 54766 → 22 [ACK] Seq=10477 Ack=69961 Win=6155 Len=0 TSval=8172794 TSecr=15104291
  446 15.187741999 192.168.1.12 → 10.6.15.156  SSH 182 Client: Encrypted packet (len=116)
  447 15.188436606  10.6.15.156 → 192.168.1.12 SSH 102 Server: Encrypted packet (len=36)
  448 15.189487753  10.6.15.156 → 192.168.1.12 TCP 66 22 → 54766 [ACK] Seq=69997 Ack=10593 Win=1452 Len=0 TSval=15104295 TSecr=8172794
  449 15.189508763 192.168.1.12 → 10.6.15.156  SSH 134 Client: Encrypted packet (len=68)
  450 15.191027200  10.6.15.156 → 192.168.1.12 TCP 66 22 → 54766 [ACK] Seq=69997 Ack=10661 Win=1452 Len=0 TSval=15104295 TSecr=8172794
  451 15.228741056  10.6.15.156 → 192.168.1.12 SSH 214 Server: Encrypted packet (len=148)
  452 15.252477301  10.6.15.156 → 192.168.1.12 SSH 138 Server: Encrypted packet (len=72)
  453 15.252592614 192.168.1.12 → 10.6.15.156  TCP 66 54766 → 22 [ACK] Seq=10661 Ack=70217 Win=6155 Len=0 TSval=8172810 TSecr=15104304
  454 15.252750086 192.168.1.12 → 10.6.15.156  SSH 102 Client: Encrypted packet (len=36)
  455 15.280752827  10.6.15.156 → 192.168.1.12 SSH 150 Server: Encrypted packet (len=84)
  456 15.281016756 192.168.1.12 → 10.6.15.156  SSH 158 Client: Encrypted packet (len=92)
  457 15.321074840  10.6.15.156 → 192.168.1.12 TCP 66 22 → 54766 [ACK] Seq=70301 Ack=10789 Win=1452 Len=0 TSval=15104328 TSecr=8172817
  458 15.335024803  10.6.15.156 → 192.168.1.12 SSH 222 Server: Encrypted packet (len=156)
  459 15.341454622  10.6.15.156 → 192.168.1.12 SSH 406 Server: Encrypted packet (len=340)
  460 15.341487122 192.168.1.12 → 10.6.15.156  TCP 66 54766 → 22 [ACK] Seq=10789 Ack=70797 Win=6155 Len=0 TSval=8172832 TSecr=15104331
  461 15.343820585  10.6.15.156 → 192.168.1.12 SSH 214 Server: Encrypted packet (len=148)
  462 15.386878703 192.168.1.12 → 10.6.15.156  TCP 66 54766 → 22 [ACK] Seq=10789 Ack=70945 Win=6155 Len=0 TSval=8172844 TSecr=15104333
  463 15.555847981  10.6.15.156 → 192.168.1.12 SSH 422 Server: Encrypted packet (len=356)
  464 15.555934722 192.168.1.12 → 10.6.15.156  TCP 66 54766 → 22 [ACK] Seq=10789 Ack=71301 Win=6155 Len=0 TSval=8172886 TSecr=15104386
  465 15.624457425  10.6.15.156 → 192.168.1.12 SSH 438 Server: Encrypted packet (len=372)
  466 15.624543669 192.168.1.12 → 10.6.15.156  TCP 66 54766 → 22 [ACK] Seq=10789 Ack=71673 Win=6155 Len=0 TSval=8172903 TSecr=15104403
  467 15.679938191  10.6.15.156 → 192.168.1.12 SSH 406 Server: Encrypted packet (len=340)
  468 15.680023288 192.168.1.12 → 10.6.15.156  TCP 66 54766 → 22 [ACK] Seq=10789 Ack=72013 Win=6155 Len=0 TSval=8172917 TSecr=15104417
  469 15.782467628  10.6.15.156 → 192.168.1.12 SSH 150 Server: Encrypted packet (len=84)
  470 15.782549852 192.168.1.12 → 10.6.15.156  TCP 66 54766 → 22 [ACK] Seq=10789 Ack=72097 Win=6155 Len=0 TSval=8172942 TSecr=15104443
  471 15.782762262 192.168.1.12 → 10.6.15.156  SSH 150 Client: Encrypted packet (len=84)
  472 15.783992246  10.6.15.156 → 192.168.1.12 TCP 66 22 → 54766 [ACK] Seq=72097 Ack=10873 Win=1452 Len=0 TSval=15104443 TSecr=8172942
  473 15.785090983  10.6.15.156 → 192.168.1.12 SSH 518 Server: Encrypted packet (len=452)
  474 15.826895746 192.168.1.12 → 10.6.15.156  TCP 66 54766 → 22 [ACK] Seq=10873 Ack=72549 Win=6155 Len=0 TSval=8172954 TSecr=15104443
  475 16.006800995  10.6.15.156 → 192.168.1.12 SSH 302 Server: Encrypted packet (len=236)
  476 16.006906745 192.168.1.12 → 10.6.15.156  TCP 66 54766 → 22 [ACK] Seq=10873 Ack=72785 Win=6155 Len=0 TSval=8172999 TSecr=15104499
  477 16.075449831  10.6.15.156 → 192.168.1.12 SSH 334 Server: Encrypted packet (len=268)
  478 16.075537407 192.168.1.12 → 10.6.15.156  TCP 66 54766 → 22 [ACK] Seq=10873 Ack=73053 Win=6155 Len=0 TSval=8173016 TSecr=15104516
  479 16.131576396  10.6.15.156 → 192.168.1.12 SSH 374 Server: Encrypted packet (len=308)
  480 16.131653034 192.168.1.12 → 10.6.15.156  TCP 66 54766 → 22 [ACK] Seq=10873 Ack=73361 Win=6155 Len=0 TSval=8173030 TSecr=15104530
  481 16.235463297  10.6.15.156 → 192.168.1.12 SSH 238 Server: Encrypted packet (len=172)
  482 16.235544831 192.168.1.12 → 10.6.15.156  TCP 66 54766 → 22 [ACK] Seq=10873 Ack=73533 Win=6155 Len=0 TSval=8173056 TSecr=15104556
  483 16.457804621  10.6.15.156 → 192.168.1.12 SSH 270 Server: Encrypted packet (len=204)
  484 16.457888235 192.168.1.12 → 10.6.15.156  TCP 66 54766 → 22 [ACK] Seq=10873 Ack=73737 Win=6155 Len=0 TSval=8173111 TSecr=15104612
  485 16.526100043  10.6.15.156 → 192.168.1.12 SSH 182 Server: Encrypted packet (len=116)
  486 16.526167108 192.168.1.12 → 10.6.15.156  TCP 66 54766 → 22 [ACK] Seq=10873 Ack=73853 Win=6155 Len=0 TSval=8173128 TSecr=15104629
  487 16.581725338  10.6.15.156 → 192.168.1.12 SSH 190 Server: Encrypted packet (len=124)
  488 16.581903796 192.168.1.12 → 10.6.15.156  TCP 66 54766 → 22 [ACK] Seq=10873 Ack=73977 Win=6155 Len=0 TSval=8173142 TSecr=15104643
  489 16.909033683  10.6.15.156 → 192.168.1.12 SSH 230 Server: Encrypted packet (len=164)
  490 16.909059725 192.168.1.12 → 10.6.15.156  TCP 66 54766 → 22 [ACK] Seq=10873 Ack=74141 Win=6155 Len=0 TSval=8173224 TSecr=15104724
  491 16.977208751  10.6.15.156 → 192.168.1.12 SSH 214 Server: Encrypted packet (len=148)
  492 16.977226944 192.168.1.12 → 10.6.15.156  TCP 66 54766 → 22 [ACK] Seq=10873 Ack=74289 Win=6155 Len=0 TSval=8173241 TSecr=15104742
  493 17.032818609  10.6.15.156 → 192.168.1.12 SSH 182 Server: Encrypted packet (len=116)
  494 17.032836488 192.168.1.12 → 10.6.15.156  TCP 66 54766 → 22 [ACK] Seq=10873 Ack=74405 Win=6155 Len=0 TSval=8173255 TSecr=15104755
  495 17.104749899 192.168.1.12 → 91.189.91.157 NTP 90 NTP Version 4, client
  496 17.137894635  10.6.15.156 → 192.168.1.12 SSH 222 Server: Encrypted packet (len=156)
  497 17.137913490 192.168.1.12 → 10.6.15.156  TCP 66 54766 → 22 [ACK] Seq=10873 Ack=74561 Win=6155 Len=0 TSval=8173281 TSecr=15104782
  498 17.359700588  10.6.15.156 → 192.168.1.12 SSH 238 Server: Encrypted packet (len=172)
  499 17.359724884 192.168.1.12 → 10.6.15.156  TCP 66 54766 → 22 [ACK] Seq=10873 Ack=74733 Win=6155 Len=0 TSval=8173337 TSecr=15104837
  500 17.428764816  10.6.15.156 → 192.168.1.12 SSH 270 Server: Encrypted packet (len=204)
  501 17.428783104 192.168.1.12 → 10.6.15.156  TCP 66 54766 → 22 [ACK] Seq=10873 Ack=74937 Win=6155 Len=0 TSval=8173354 TSecr=15104854
  502 17.483797882  10.6.15.156 → 192.168.1.12 SSH 270 Server: Encrypted packet (len=204)
  503 17.483815805 192.168.1.12 → 10.6.15.156  TCP 66 54766 → 22 [ACK] Seq=10873 Ack=75141 Win=6155 Len=0 TSval=8173368 TSecr=15104868
  504 17.588725552  10.6.15.156 → 192.168.1.12 SSH 270 Server: Encrypted packet (len=204)
  505 17.588744898 192.168.1.12 → 10.6.15.156  TCP 66 54766 → 22 [ACK] Seq=10873 Ack=75345 Win=6155 Len=0 TSval=8173394 TSecr=15104894
  506 17.810774995  10.6.15.156 → 192.168.1.12 SSH 342 Server: Encrypted packet (len=276)
  507 17.810794228 192.168.1.12 → 10.6.15.156  TCP 66 54766 → 22 [ACK] Seq=10873 Ack=75621 Win=6155 Len=0 TSval=8173449 TSecr=15104950
  508 17.879401909  10.6.15.156 → 192.168.1.12 SSH 406 Server: Encrypted packet (len=340)
  509 17.879421503 192.168.1.12 → 10.6.15.156  TCP 66 54766 → 22 [ACK] Seq=10873 Ack=75961 Win=6155 Len=0 TSval=8173467 TSecr=15104967
  510 17.935153817  10.6.15.156 → 192.168.1.12 SSH 302 Server: Encrypted packet (len=236)
  511 17.935179765 192.168.1.12 → 10.6.15.156  TCP 66 54766 → 22 [ACK] Seq=10873 Ack=76197 Win=6155 Len=0 TSval=8173481 TSecr=15104981
  512 18.050262720  10.6.15.156 → 192.168.1.12 SSH 406 Server: Encrypted packet (len=340)
  513 18.050279605 192.168.1.12 → 10.6.15.156  TCP 66 54766 → 22 [ACK] Seq=10873 Ack=76537 Win=6155 Len=0 TSval=8173509 TSecr=15105007
  514 18.261733763  10.6.15.156 → 192.168.1.12 SSH 214 Server: Encrypted packet (len=148)
  515 18.261752399 192.168.1.12 → 10.6.15.156  TCP 66 54766 → 22 [ACK] Seq=10873 Ack=76685 Win=6155 Len=0 TSval=8173562 TSecr=15105063
  516 18.331498654  10.6.15.156 → 192.168.1.12 SSH 182 Server: Encrypted packet (len=116)
  517 18.331514328 192.168.1.12 → 10.6.15.156  TCP 66 54766 → 22 [ACK] Seq=10873 Ack=76801 Win=6155 Len=0 TSval=8173580 TSecr=15105080
  518 18.385727617  10.6.15.156 → 192.168.1.12 SSH 270 Server: Encrypted packet (len=204)
  519 18.385740578 192.168.1.12 → 10.6.15.156  TCP 66 54766 → 22 [ACK] Seq=10873 Ack=77005 Win=6155 Len=0 TSval=8173593 TSecr=15105094
  520 18.490789031  10.6.15.156 → 192.168.1.12 SSH 182 Server: Encrypted packet (len=116)
  521 18.490803296 192.168.1.12 → 10.6.15.156  TCP 66 54766 → 22 [ACK] Seq=10873 Ack=77121 Win=6155 Len=0 TSval=8173619 TSecr=15105120
  522 18.781195135  10.6.15.156 → 192.168.1.12 SSH 222 Server: Encrypted packet (len=156)
  523 18.781212544 192.168.1.12 → 10.6.15.156  TCP 66 54766 → 22 [ACK] Seq=10873 Ack=77277 Win=6155 Len=0 TSval=8173692 TSecr=15105193
  524 18.836777654  10.6.15.156 → 192.168.1.12 SSH 214 Server: Encrypted packet (len=148)
  525 18.836795077 192.168.1.12 → 10.6.15.156  TCP 66 54766 → 22 [ACK] Seq=10873 Ack=77425 Win=6155 Len=0 TSval=8173706 TSecr=15105206
  526 18.941292726  10.6.15.156 → 192.168.1.12 SSH 214 Server: Encrypted packet (len=148)
  527 18.941311247 192.168.1.12 → 10.6.15.156  TCP 66 54766 → 22 [ACK] Seq=10873 Ack=77573 Win=6155 Len=0 TSval=8173732 TSecr=15105233
  528 19.163872172  10.6.15.156 → 192.168.1.12 SSH 390 Server: Encrypted packet (len=324)
  529 19.163890956 192.168.1.12 → 10.6.15.156  TCP 66 54766 → 22 [ACK] Seq=10873 Ack=77897 Win=6155 Len=0 TSval=8173788 TSecr=15105288
  530 19.232285817  10.6.15.156 → 192.168.1.12 SSH 334 Server: Encrypted packet (len=268)
  531 19.232302316 192.168.1.12 → 10.6.15.156  TCP 66 54766 → 22 [ACK] Seq=10873 Ack=78165 Win=6155 Len=0 TSval=8173805 TSecr=15105305
  532 19.287996381  10.6.15.156 → 192.168.1.12 SSH 358 Server: Encrypted packet (len=292)
  533 19.288015320 192.168.1.12 → 10.6.15.156  TCP 66 54766 → 22 [ACK] Seq=10873 Ack=78457 Win=6155 Len=0 TSval=8173819 TSecr=15105319
  534 19.392613717  10.6.15.156 → 192.168.1.12 SSH 422 Server: Encrypted packet (len=356)
  535 19.392632355 192.168.1.12 → 10.6.15.156  TCP 66 54766 → 22 [ACK] Seq=10873 Ack=78813 Win=6155 Len=0 TSval=8173845 TSecr=15105345
  536 19.614771191  10.6.15.156 → 192.168.1.12 SSH 302 Server: Encrypted packet (len=236)
  537 19.614788973 192.168.1.12 → 10.6.15.156  TCP 66 54766 → 22 [ACK] Seq=10873 Ack=79049 Win=6155 Len=0 TSval=8173900 TSecr=15105401
  538 19.684178260  10.6.15.156 → 192.168.1.12 SSH 302 Server: Encrypted packet (len=236)
  539 19.684196469 192.168.1.12 → 10.6.15.156  TCP 66 54766 → 22 [ACK] Seq=10873 Ack=79285 Win=6155 Len=0 TSval=8173918 TSecr=15105418
  540 19.741447358  10.6.15.156 → 192.168.1.12 SSH 406 Server: Encrypted packet (len=340)
  541 19.741465687 192.168.1.12 → 10.6.15.156  TCP 66 54766 → 22 [ACK] Seq=10873 Ack=79625 Win=6155 Len=0 TSval=8173932 TSecr=15105432
  542 19.843509944  10.6.15.156 → 192.168.1.12 SSH 334 Server: Encrypted packet (len=268)
  543 19.843527684 192.168.1.12 → 10.6.15.156  TCP 66 54766 → 22 [ACK] Seq=10873 Ack=79893 Win=6155 Len=0 TSval=8173958 TSecr=15105458
  544 20.065992436  10.6.15.156 → 192.168.1.12 SSH 438 Server: Encrypted packet (len=372)
  545 20.066009695 192.168.1.12 → 10.6.15.156  TCP 66 54766 → 22 [ACK] Seq=10873 Ack=80265 Win=6155 Len=0 TSval=8174013 TSecr=15105514
  546 20.134156904  10.6.15.156 → 192.168.1.12 SSH 238 Server: Encrypted packet (len=172)
  547 20.134174659 192.168.1.12 → 10.6.15.156  TCP 66 54766 → 22 [ACK] Seq=10873 Ack=80437 Win=6155 Len=0 TSval=8174030 TSecr=15105531
  548 20.189954205  10.6.15.156 → 192.168.1.12 SSH 406 Server: Encrypted packet (len=340)
  549 20.189972088 192.168.1.12 → 10.6.15.156  TCP 66 54766 → 22 [ACK] Seq=10873 Ack=80777 Win=6155 Len=0 TSval=8174044 TSecr=15105545
  550 20.296175110  10.6.15.156 → 192.168.1.12 SSH 238 Server: Encrypted packet (len=172)
  551 20.296193043 192.168.1.12 → 10.6.15.156  TCP 66 54766 → 22 [ACK] Seq=10873 Ack=80949 Win=6155 Len=0 TSval=8174071 TSecr=15105571
  552 20.432188870  10.6.15.156 → 192.168.1.12 SSH 150 Server: Encrypted packet (len=84)
  553 20.432206932 192.168.1.12 → 10.6.15.156  TCP 66 54766 → 22 [ACK] Seq=10873 Ack=81033 Win=6155 Len=0 TSval=8174105 TSecr=15105605
  554 20.432484737 192.168.1.12 → 10.6.15.156  SSH 150 Client: Encrypted packet (len=84)
  555 20.473074598  10.6.15.156 → 192.168.1.12 TCP 66 22 → 54766 [ACK] Seq=81033 Ack=10957 Win=1452 Len=0 TSval=15105616 TSecr=8174105
  556 20.480319048  10.6.15.156 → 192.168.1.12 SSH 150 Server: Encrypted packet (len=84)
  557 20.480597803 192.168.1.12 → 10.6.15.156  SSH 150 Client: Encrypted packet (len=84)
  558 20.482226882  10.6.15.156 → 192.168.1.12 TCP 66 22 → 54766 [ACK] Seq=81117 Ack=11041 Win=1452 Len=0 TSval=15105618 TSecr=8174117
  559 20.516652001  10.6.15.156 → 192.168.1.12 SSH 238 Server: Encrypted packet (len=172)
  560 20.558923480 192.168.1.12 → 10.6.15.156  TCP 66 54766 → 22 [ACK] Seq=11041 Ack=81289 Win=6155 Len=0 TSval=8174137 TSecr=15105626
  561 20.585533042  10.6.15.156 → 192.168.1.12 SSH 518 Server: Encrypted packet (len=452)
  562 20.585621308 192.168.1.12 → 10.6.15.156  TCP 66 54766 → 22 [ACK] Seq=11041 Ack=81741 Win=6155 Len=0 TSval=8174143 TSecr=15105644
  563 20.640817466  10.6.15.156 → 192.168.1.12 SSH 270 Server: Encrypted packet (len=204)
  564 20.640904736 192.168.1.12 → 10.6.15.156  TCP 66 54766 → 22 [ACK] Seq=11041 Ack=81945 Win=6155 Len=0 TSval=8174157 TSecr=15105657
  565 20.745632474  10.6.15.156 → 192.168.1.12 SSH 406 Server: Encrypted packet (len=340)
  566 20.745718199 192.168.1.12 → 10.6.15.156  TCP 66 54766 → 22 [ACK] Seq=11041 Ack=82285 Win=6155 Len=0 TSval=8174183 TSecr=15105684
  567 20.967753035  10.6.15.156 → 192.168.1.12 SSH 222 Server: Encrypted packet (len=156)
  568 20.967781979 192.168.1.12 → 10.6.15.156  TCP 66 54766 → 22 [ACK] Seq=11041 Ack=82441 Win=6155 Len=0 TSval=8174239 TSecr=15105739
  569 21.036331685  10.6.15.156 → 192.168.1.12 SSH 238 Server: Encrypted packet (len=172)
  570 21.036349876 192.168.1.12 → 10.6.15.156  TCP 66 54766 → 22 [ACK] Seq=11041 Ack=82613 Win=6155 Len=0 TSval=8174256 TSecr=15105756
  571 21.091922809  10.6.15.156 → 192.168.1.12 SSH 270 Server: Encrypted packet (len=204)
  572 21.091942197 192.168.1.12 → 10.6.15.156  TCP 66 54766 → 22 [ACK] Seq=11041 Ack=82817 Win=6155 Len=0 TSval=8174270 TSecr=15105770
  573 21.196459318  10.6.15.156 → 192.168.1.12 SSH 270 Server: Encrypted packet (len=204)
  574 21.196476906 192.168.1.12 → 10.6.15.156  TCP 66 54766 → 22 [ACK] Seq=11041 Ack=83021 Win=6155 Len=0 TSval=8174296 TSecr=15105796
  575 21.418902493  10.6.15.156 → 192.168.1.12 SSH 454 Server: Encrypted packet (len=388)
  576 21.418919969 192.168.1.12 → 10.6.15.156  TCP 66 54766 → 22 [ACK] Seq=11041 Ack=83409 Win=6155 Len=0 TSval=8174352 TSecr=15105852
  577 21.487587533  10.6.15.156 → 192.168.1.12 SSH 342 Server: Encrypted packet (len=276)
  578 21.487598826 192.168.1.12 → 10.6.15.156  TCP 66 54766 → 22 [ACK] Seq=11041 Ack=83685 Win=6155 Len=0 TSval=8174369 TSecr=15105869
  579 21.542986982  10.6.15.156 → 192.168.1.12 SSH 406 Server: Encrypted packet (len=340)
  580 21.543006551 192.168.1.12 → 10.6.15.156  TCP 66 54766 → 22 [ACK] Seq=11041 Ack=84025 Win=6155 Len=0 TSval=8174383 TSecr=15105883
  581 21.647486577  10.6.15.156 → 192.168.1.12 SSH 374 Server: Encrypted packet (len=308)
  582 21.647505987 192.168.1.12 → 10.6.15.156  TCP 66 54766 → 22 [ACK] Seq=11041 Ack=84333 Win=6155 Len=0 TSval=8174409 TSecr=15105909
  583 21.869774154  10.6.15.156 → 192.168.1.12 SSH 238 Server: Encrypted packet (len=172)
  584 21.869792454 192.168.1.12 → 10.6.15.156  TCP 66 54766 → 22 [ACK] Seq=11041 Ack=84505 Win=6155 Len=0 TSval=8174464 TSecr=15105965
  585 21.938323769  10.6.15.156 → 192.168.1.12 SSH 302 Server: Encrypted packet (len=236)
  586 21.938342351 192.168.1.12 → 10.6.15.156  TCP 66 54766 → 22 [ACK] Seq=11041 Ack=84741 Win=6155 Len=0 TSval=8174481 TSecr=15105982
  587 21.993763782  10.6.15.156 → 192.168.1.12 SSH 182 Server: Encrypted packet (len=116)
  588 21.993781716 192.168.1.12 → 10.6.15.156  TCP 66 54766 → 22 [ACK] Seq=11041 Ack=84857 Win=6155 Len=0 TSval=8174495 TSecr=15105996
  589 22.098443887  10.6.15.156 → 192.168.1.12 SSH 222 Server: Encrypted packet (len=156)
  590 22.098467505 192.168.1.12 → 10.6.15.156  TCP 66 54766 → 22 [ACK] Seq=11041 Ack=85013 Win=6155 Len=0 TSval=8174521 TSecr=15106022
  591 22.320744108  10.6.15.156 → 192.168.1.12 SSH 222 Server: Encrypted packet (len=156)
  592 22.320762412 192.168.1.12 → 10.6.15.156  TCP 66 54766 → 22 [ACK] Seq=11041 Ack=85169 Win=6155 Len=0 TSval=8174577 TSecr=15106077
  593 22.549440427  10.6.15.156 → 192.168.1.12 SSH 238 Server: Encrypted packet (len=172)
  594 22.549457194 192.168.1.12 → 10.6.15.156  TCP 66 54766 → 22 [ACK] Seq=11041 Ack=85341 Win=6155 Len=0 TSval=8174634 TSecr=15106135
  595 22.775584511  10.6.15.156 → 192.168.1.12 SSH 302 Server: Encrypted packet (len=236)
  596 22.775601805 192.168.1.12 → 10.6.15.156  TCP 66 54766 → 22 [ACK] Seq=11041 Ack=85577 Win=6155 Len=0 TSval=8174691 TSecr=15106190
  597 22.841495959  10.6.15.156 → 192.168.1.12 SSH 374 Server: Encrypted packet (len=308)
  598 22.841514777 192.168.1.12 → 10.6.15.156  TCP 66 54766 → 22 [ACK] Seq=11041 Ack=85885 Win=6155 Len=0 TSval=8174707 TSecr=15106207
  599 22.895768056  10.6.15.156 → 192.168.1.12 SSH 374 Server: Encrypted packet (len=308)
  600 22.895792288 192.168.1.12 → 10.6.15.156  TCP 66 54766 → 22 [ACK] Seq=11041 Ack=86193 Win=6155 Len=0 TSval=8174721 TSecr=15106221
  601 23.000557976  10.6.15.156 → 192.168.1.12 SSH 270 Server: Encrypted packet (len=204)
  602 23.000575072 192.168.1.12 → 10.6.15.156  TCP 66 54766 → 22 [ACK] Seq=11041 Ack=86397 Win=6155 Len=0 TSval=8174747 TSecr=15106247
  603 23.675113854  10.6.15.156 → 192.168.1.12 SSH 190 Server: Encrypted packet (len=124)
  604 23.675130964 192.168.1.12 → 10.6.15.156  TCP 66 54766 → 22 [ACK] Seq=11041 Ack=86521 Win=6155 Len=0 TSval=8174916 TSecr=15106416
  605 23.902450126  10.6.15.156 → 192.168.1.12 SSH 254 Server: Encrypted packet (len=188)
  606 23.902468635 192.168.1.12 → 10.6.15.156  TCP 66 54766 → 22 [ACK] Seq=11041 Ack=86709 Win=6155 Len=0 TSval=8174972 TSecr=15106473
  607 24.124675176  10.6.15.156 → 192.168.1.12 SSH 254 Server: Encrypted packet (len=188)
  608 24.124693017 192.168.1.12 → 10.6.15.156  TCP 66 54766 → 22 [ACK] Seq=11041 Ack=86897 Win=6155 Len=0 TSval=8175028 TSecr=15106528
  609 24.193445492  10.6.15.156 → 192.168.1.12 SSH 326 Server: Encrypted packet (len=260)
  610 24.193464833 192.168.1.12 → 10.6.15.156  TCP 66 54766 → 22 [ACK] Seq=11041 Ack=87157 Win=6155 Len=0 TSval=8175045 TSecr=15106546
  611 24.248854210  10.6.15.156 → 192.168.1.12 SSH 326 Server: Encrypted packet (len=260)
  612 24.248871469 192.168.1.12 → 10.6.15.156  TCP 66 54766 → 22 [ACK] Seq=11041 Ack=87417 Win=6155 Len=0 TSval=8175059 TSecr=15106560
  613 24.353400833  10.6.15.156 → 192.168.1.12 SSH 238 Server: Encrypted packet (len=172)
  614 24.353415317 192.168.1.12 → 10.6.15.156  TCP 66 54766 → 22 [ACK] Seq=11041 Ack=87589 Win=6155 Len=0 TSval=8175085 TSecr=15106586
  615 24.575969441  10.6.15.156 → 192.168.1.12 SSH 230 Server: Encrypted packet (len=164)
  616 24.575987594 192.168.1.12 → 10.6.15.156  TCP 66 54766 → 22 [ACK] Seq=11041 Ack=87753 Win=6155 Len=0 TSval=8175141 TSecr=15106641
  617 24.699925014  10.6.15.156 → 192.168.1.12 SSH 302 Server: Encrypted packet (len=236)
  618 24.699943069 192.168.1.12 → 10.6.15.156  TCP 66 54766 → 22 [ACK] Seq=11041 Ack=87989 Win=6155 Len=0 TSval=8175172 TSecr=15106672
  619 24.804687986  10.6.15.156 → 192.168.1.12 SSH 270 Server: Encrypted packet (len=204)
  620 24.804704809 192.168.1.12 → 10.6.15.156  TCP 66 54766 → 22 [ACK] Seq=11041 Ack=88193 Win=6155 Len=0 TSval=8175198 TSecr=15106698
  621 25.026656290  10.6.15.156 → 192.168.1.12 SSH 318 Server: Encrypted packet (len=252)
  622 25.026679630 192.168.1.12 → 10.6.15.156  TCP 66 54766 → 22 [ACK] Seq=11041 Ack=88445 Win=6155 Len=0 TSval=8175253 TSecr=15106754
  623 25.095640430  10.6.15.156 → 192.168.1.12 SSH 390 Server: Encrypted packet (len=324)
  624 25.095659251 192.168.1.12 → 10.6.15.156  TCP 66 54766 → 22 [ACK] Seq=11041 Ack=88769 Win=6155 Len=0 TSval=8175271 TSecr=15106771
  625 25.150839902  10.6.15.156 → 192.168.1.12 SSH 318 Server: Encrypted packet (len=252)
  626 25.150859149 192.168.1.12 → 10.6.15.156  TCP 66 54766 → 22 [ACK] Seq=11041 Ack=89021 Win=6155 Len=0 TSval=8175284 TSecr=15106785
  627 25.255509553  10.6.15.156 → 192.168.1.12 SSH 294 Server: Encrypted packet (len=228)
  628 25.255529948 192.168.1.12 → 10.6.15.156  TCP 66 54766 → 22 [ACK] Seq=11041 Ack=89249 Win=6155 Len=0 TSval=8175311 TSecr=15106811
  629 25.477753213  10.6.15.156 → 192.168.1.12 SSH 334 Server: Encrypted packet (len=268)
  630 25.477770932 192.168.1.12 → 10.6.15.156  TCP 66 54766 → 22 [ACK] Seq=11041 Ack=89517 Win=6155 Len=0 TSval=8175366 TSecr=15106867
  631 25.546436692  10.6.15.156 → 192.168.1.12 SSH 406 Server: Encrypted packet (len=340)
  632 25.546455832 192.168.1.12 → 10.6.15.156  TCP 66 54766 → 22 [ACK] Seq=11041 Ack=89857 Win=6155 Len=0 TSval=8175383 TSecr=15106884
  633 25.601909868  10.6.15.156 → 192.168.1.12 SSH 302 Server: Encrypted packet (len=236)
  634 25.601927933 192.168.1.12 → 10.6.15.156  TCP 66 54766 → 22 [ACK] Seq=11041 Ack=90093 Win=6155 Len=0 TSval=8175397 TSecr=15106898
  635 25.706743274  10.6.15.156 → 192.168.1.12 SSH 302 Server: Encrypted packet (len=236)
  636 25.706762045 192.168.1.12 → 10.6.15.156  TCP 66 54766 → 22 [ACK] Seq=11041 Ack=90329 Win=6155 Len=0 TSval=8175423 TSecr=15106924
  637 25.928993194  10.6.15.156 → 192.168.1.12 SSH 550 Server: Encrypted packet (len=484)
  638 25.929013172 192.168.1.12 → 10.6.15.156  TCP 66 54766 → 22 [ACK] Seq=11041 Ack=90813 Win=6155 Len=0 TSval=8175479 TSecr=15106980
  639 25.997209941  10.6.15.156 → 192.168.1.12 SSH 334 Server: Encrypted packet (len=268)
  640 25.997228288 192.168.1.12 → 10.6.15.156  TCP 66 54766 → 22 [ACK] Seq=11041 Ack=91081 Win=6155 Len=0 TSval=8175496 TSecr=15106997
  641 26.053225385  10.6.15.156 → 192.168.1.12 SSH 422 Server: Encrypted packet (len=356)
  642 26.053244490 192.168.1.12 → 10.6.15.156  TCP 66 54766 → 22 [ACK] Seq=11041 Ack=91437 Win=6155 Len=0 TSval=8175510 TSecr=15107011
  643 26.157755026  10.6.15.156 → 192.168.1.12 SSH 334 Server: Encrypted packet (len=268)
  644 26.157773972 192.168.1.12 → 10.6.15.156  TCP 66 54766 → 22 [ACK] Seq=11041 Ack=91705 Win=6155 Len=0 TSval=8175536 TSecr=15107037
  645 26.379674744  10.6.15.156 → 192.168.1.12 SSH 182 Server: Encrypted packet (len=116)
  646 26.379692376 192.168.1.12 → 10.6.15.156  TCP 66 54766 → 22 [ACK] Seq=11041 Ack=91821 Win=6155 Len=0 TSval=8175592 TSecr=15107092
  647 26.448357451  10.6.15.156 → 192.168.1.12 SSH 406 Server: Encrypted packet (len=340)
  648 26.448375515 192.168.1.12 → 10.6.15.156  TCP 66 54766 → 22 [ACK] Seq=11041 Ack=92161 Win=6155 Len=0 TSval=8175609 TSecr=15107109
  649 26.482930285  10.6.15.156 → 192.168.1.12 SSH 150 Server: Encrypted packet (len=84)
  650 26.482950610 192.168.1.12 → 10.6.15.156  TCP 66 54766 → 22 [ACK] Seq=11041 Ack=92245 Win=6155 Len=0 TSval=8175618 TSecr=15107118
  651 26.483229001 192.168.1.12 → 10.6.15.156  SSH 150 Client: Encrypted packet (len=84)
  652 26.503832194  10.6.15.156 → 192.168.1.12 SSH 302 Server: Encrypted packet (len=236)
  653 26.546921022 192.168.1.12 → 10.6.15.156  TCP 66 54766 → 22 [ACK] Seq=11125 Ack=92481 Win=6155 Len=0 TSval=8175634 TSecr=15107123
  654 26.563423040  10.6.15.156 → 192.168.1.12 SSH 150 Server: Encrypted packet (len=84)
  655 26.563446787 192.168.1.12 → 10.6.15.156  TCP 66 54766 → 22 [ACK] Seq=11125 Ack=92565 Win=6155 Len=0 TSval=8175638 TSecr=15107138
  656 26.563707741 192.168.1.12 → 10.6.15.156  SSH 150 Client: Encrypted packet (len=84)
  657 26.600155726  10.6.15.156 → 192.168.1.12 SSH 102 Server: Encrypted packet (len=36)
  658 26.608421875  10.6.15.156 → 192.168.1.12 SSH 406 Server: Encrypted packet (len=340)
  659 26.608505353 192.168.1.12 → 10.6.15.156  TCP 66 54766 → 22 [ACK] Seq=11209 Ack=92941 Win=6155 Len=0 TSval=8175649 TSecr=15107147
  660 26.830672131  10.6.15.156 → 192.168.1.12 SSH 214 Server: Encrypted packet (len=148)
  661 26.870926950 192.168.1.12 → 10.6.15.156  TCP 66 54766 → 22 [ACK] Seq=11209 Ack=93089 Win=6155 Len=0 TSval=8175715 TSecr=15107205
  662 26.900932389  10.6.15.156 → 192.168.1.12 SSH 182 Server: Encrypted packet (len=116)
  663 26.900960509 192.168.1.12 → 10.6.15.156  TCP 66 54766 → 22 [ACK] Seq=11209 Ack=93205 Win=6155 Len=0 TSval=8175722 TSecr=15107222
  664 26.954693112  10.6.15.156 → 192.168.1.12 SSH 182 Server: Encrypted packet (len=116)
  665 26.954711864 192.168.1.12 → 10.6.15.156  TCP 66 54766 → 22 [ACK] Seq=11209 Ack=93321 Win=6155 Len=0 TSval=8175735 TSecr=15107236
  666 27.059334109  10.6.15.156 → 192.168.1.12 SSH 182 Server: Encrypted packet (len=116)
  667 27.059351758 192.168.1.12 → 10.6.15.156  TCP 66 54766 → 22 [ACK] Seq=11209 Ack=93437 Win=6155 Len=0 TSval=8175762 TSecr=15107262
  668 27.281476563  10.6.15.156 → 192.168.1.12 SSH 182 Server: Encrypted packet (len=116)
  669 27.281494589 192.168.1.12 → 10.6.15.156  TCP 66 54766 → 22 [ACK] Seq=11209 Ack=93553 Win=6155 Len=0 TSval=8175817 TSecr=15107318
  670 27.350098046  10.6.15.156 → 192.168.1.12 SSH 238 Server: Encrypted packet (len=172)
  671 27.350116939 192.168.1.12 → 10.6.15.156  TCP 66 54766 → 22 [ACK] Seq=11209 Ack=93725 Win=6155 Len=0 TSval=8175834 TSecr=15107335
  672 27.405584280  10.6.15.156 → 192.168.1.12 SSH 238 Server: Encrypted packet (len=172)
  673 27.405598196 192.168.1.12 → 10.6.15.156  TCP 66 54766 → 22 [ACK] Seq=11209 Ack=93897 Win=6155 Len=0 TSval=8175848 TSecr=15107349
  674 27.510428368  10.6.15.156 → 192.168.1.12 SSH 302 Server: Encrypted packet (len=236)
  675 27.510446349 192.168.1.12 → 10.6.15.156  TCP 66 54766 → 22 [ACK] Seq=11209 Ack=94133 Win=6155 Len=0 TSval=8175874 TSecr=15107375
  676 27.733124825  10.6.15.156 → 192.168.1.12 SSH 270 Server: Encrypted packet (len=204)
  677 27.733206871 192.168.1.12 → 10.6.15.156  TCP 66 54766 → 22 [ACK] Seq=11209 Ack=94337 Win=6155 Len=0 TSval=8175930 TSecr=15107430
  678 27.801125095  10.6.15.156 → 192.168.1.12 SSH 198 Server: Encrypted packet (len=132)
  679 27.801210520 192.168.1.12 → 10.6.15.156  TCP 66 54766 → 22 [ACK] Seq=11209 Ack=94469 Win=6155 Len=0 TSval=8175947 TSecr=15107448
  680 27.856713694  10.6.15.156 → 192.168.1.12 SSH 206 Server: Encrypted packet (len=140)
  681 27.856800357 192.168.1.12 → 10.6.15.156  TCP 66 54766 → 22 [ACK] Seq=11209 Ack=94609 Win=6155 Len=0 TSval=8175961 TSecr=15107461
  682 28.183817120  10.6.15.156 → 192.168.1.12 SSH 214 Server: Encrypted packet (len=148)
  683 28.183843511 192.168.1.12 → 10.6.15.156  TCP 66 54766 → 22 [ACK] Seq=11209 Ack=94757 Win=6155 Len=0 TSval=8176043 TSecr=15107543
  684 28.252898012  10.6.15.156 → 192.168.1.12 SSH 222 Server: Encrypted packet (len=156)
  685 28.252915924 192.168.1.12 → 10.6.15.156  TCP 66 54766 → 22 [ACK] Seq=11209 Ack=94913 Win=6155 Len=0 TSval=8176060 TSecr=15107560
  686 28.307636723  10.6.15.156 → 192.168.1.12 SSH 222 Server: Encrypted packet (len=156)
  687 28.307654117 192.168.1.12 → 10.6.15.156  TCP 66 54766 → 22 [ACK] Seq=11209 Ack=95069 Win=6155 Len=0 TSval=8176074 TSecr=15107574
  688 28.412406497  10.6.15.156 → 192.168.1.12 SSH 254 Server: Encrypted packet (len=188)
  689 28.412424569 192.168.1.12 → 10.6.15.156  TCP 66 54766 → 22 [ACK] Seq=11209 Ack=95257 Win=6155 Len=0 TSval=8176100 TSecr=15107600
  690 28.703143021  10.6.15.156 → 192.168.1.12 SSH 182 Server: Encrypted packet (len=116)
  691 28.703161382 192.168.1.12 → 10.6.15.156  TCP 66 54766 → 22 [ACK] Seq=11209 Ack=95373 Win=6155 Len=0 TSval=8176173 TSecr=15107673
  692 28.758668100  10.6.15.156 → 192.168.1.12 SSH 182 Server: Encrypted packet (len=116)
  693 28.758685043 192.168.1.12 → 10.6.15.156  TCP 66 54766 → 22 [ACK] Seq=11209 Ack=95489 Win=6155 Len=0 TSval=8176186 TSecr=15107687
  694 29.088402985  10.6.15.156 → 192.168.1.12 SSH 214 Server: Encrypted packet (len=148)
  695 29.088419654 192.168.1.12 → 10.6.15.156  TCP 66 54766 → 22 [ACK] Seq=11209 Ack=95637 Win=6155 Len=0 TSval=8176269 TSecr=15107769
  696 29.154150902  10.6.15.156 → 192.168.1.12 SSH 182 Server: Encrypted packet (len=116)
  697 29.154169333 192.168.1.12 → 10.6.15.156  TCP 66 54766 → 22 [ACK] Seq=11209 Ack=95753 Win=6155 Len=0 TSval=8176285 TSecr=15107786
  698 29.209639271  10.6.15.156 → 192.168.1.12 SSH 182 Server: Encrypted packet (len=116)
  699 29.209657661 192.168.1.12 → 10.6.15.156  TCP 66 54766 → 22 [ACK] Seq=11209 Ack=95869 Win=6155 Len=0 TSval=8176299 TSecr=15107800
  700 29.314187647  10.6.15.156 → 192.168.1.12 SSH 182 Server: Encrypted packet (len=116)
  701 29.314208747 192.168.1.12 → 10.6.15.156  TCP 66 54766 → 22 [ACK] Seq=11209 Ack=95985 Win=6155 Len=0 TSval=8176325 TSecr=15107826
  702 29.605129103  10.6.15.156 → 192.168.1.12 SSH 182 Server: Encrypted packet (len=116)
  703 29.605156098 192.168.1.12 → 10.6.15.156  TCP 66 54766 → 22 [ACK] Seq=11209 Ack=96101 Win=6155 Len=0 TSval=8176398 TSecr=15107899
  704 29.660645572  10.6.15.156 → 192.168.1.12 SSH 182 Server: Encrypted packet (len=116)
  705 29.660663379 192.168.1.12 → 10.6.15.156  TCP 66 54766 → 22 [ACK] Seq=11209 Ack=96217 Win=6155 Len=0 TSval=8176412 TSecr=15107912
  706 29.765221736  10.6.15.156 → 192.168.1.12 SSH 182 Server: Encrypted packet (len=116)
  707 29.765258780 192.168.1.12 → 10.6.15.156  TCP 66 54766 → 22 [ACK] Seq=11209 Ack=96333 Win=6155 Len=0 TSval=8176438 TSecr=15107939
  708 29.987767143  10.6.15.156 → 192.168.1.12 SSH 286 Server: Encrypted packet (len=220)
  709 29.987785254 192.168.1.12 → 10.6.15.156  TCP 66 54766 → 22 [ACK] Seq=11209 Ack=96553 Win=6155 Len=0 TSval=8176494 TSecr=15107994
  710 30.056167800  10.6.15.156 → 192.168.1.12 SSH 182 Server: Encrypted packet (len=116)
  711 30.056185345 192.168.1.12 → 10.6.15.156  TCP 66 54766 → 22 [ACK] Seq=11209 Ack=96669 Win=6155 Len=0 TSval=8176511 TSecr=15108011
  712 30.104707861 192.168.1.12 → 52.66.76.135 NTP 90 NTP Version 4, client
  713 30.111904725  10.6.15.156 → 192.168.1.12 SSH 182 Server: Encrypted packet (len=116)
  714 30.111922093 192.168.1.12 → 10.6.15.156  TCP 66 54766 → 22 [ACK] Seq=11209 Ack=96785 Win=6155 Len=0 TSval=8176525 TSecr=15108025
  715 30.216678015  10.6.15.156 → 192.168.1.12 SSH 182 Server: Encrypted packet (len=116)
  716 30.216695760 192.168.1.12 → 10.6.15.156  TCP 66 54766 → 22 [ACK] Seq=11209 Ack=96901 Win=6155 Len=0 TSval=8176551 TSecr=15108051
  717 30.507136426  10.6.15.156 → 192.168.1.12 SSH 238 Server: Encrypted packet (len=172)
  718 30.507153339 192.168.1.12 → 10.6.15.156  TCP 66 54766 → 22 [ACK] Seq=11209 Ack=97073 Win=6155 Len=0 TSval=8176624 TSecr=15108124
  719 30.562835893  10.6.15.156 → 192.168.1.12 SSH 270 Server: Encrypted packet (len=204)
  720 30.562855463 192.168.1.12 → 10.6.15.156  TCP 66 54766 → 22 [ACK] Seq=11209 Ack=97277 Win=6155 Len=0 TSval=8176637 TSecr=15108138
  721 30.667446425  10.6.15.156 → 192.168.1.12 SSH 270 Server: Encrypted packet (len=204)
  722 30.667465270 192.168.1.12 → 10.6.15.156  TCP 66 54766 → 22 [ACK] Seq=11209 Ack=97481 Win=6155 Len=0 TSval=8176664 TSecr=15108164
  723 30.889733703  10.6.15.156 → 192.168.1.12 SSH 182 Server: Encrypted packet (len=116)
  724 30.889750806 192.168.1.12 → 10.6.15.156  TCP 66 54766 → 22 [ACK] Seq=11209 Ack=97597 Win=6155 Len=0 TSval=8176719 TSecr=15108220
  725 30.958243097  10.6.15.156 → 192.168.1.12 SSH 318 Server: Encrypted packet (len=252)
  726 30.958263455 192.168.1.12 → 10.6.15.156  TCP 66 54766 → 22 [ACK] Seq=11209 Ack=97849 Win=6155 Len=0 TSval=8176736 TSecr=15108237
  727 31.013774817  10.6.15.156 → 192.168.1.12 SSH 406 Server: Encrypted packet (len=340)
  728 31.013790125 192.168.1.12 → 10.6.15.156  TCP 66 54766 → 22 [ACK] Seq=11209 Ack=98189 Win=6155 Len=0 TSval=8176750 TSecr=15108251
  729 31.118913167  10.6.15.156 → 192.168.1.12 SSH 406 Server: Encrypted packet (len=340)
  730 31.118931573 192.168.1.12 → 10.6.15.156  TCP 66 54766 → 22 [ACK] Seq=11209 Ack=98529 Win=6155 Len=0 TSval=8176777 TSecr=15108277
  731 31.341271624  10.6.15.156 → 192.168.1.12 SSH 454 Server: Encrypted packet (len=388)
  732 31.341289786 192.168.1.12 → 10.6.15.156  TCP 66 54766 → 22 [ACK] Seq=11209 Ack=98917 Win=6155 Len=0 TSval=8176832 TSecr=15108332
  733 31.409346951  10.6.15.156 → 192.168.1.12 SSH 374 Server: Encrypted packet (len=308)
  734 31.409365753 192.168.1.12 → 10.6.15.156  TCP 66 54766 → 22 [ACK] Seq=11209 Ack=99225 Win=6155 Len=0 TSval=8176849 TSecr=15108350
  735 31.435526750  10.6.15.156 → 192.168.1.12 SSH 190 Server: Encrypted packet (len=124)
  736 31.435543299 192.168.1.12 → 10.6.15.156  TCP 66 54766 → 22 [ACK] Seq=11209 Ack=99349 Win=6155 Len=0 TSval=8176856 TSecr=15108356
  737 31.443632093  10.6.15.156 → 192.168.1.12 SSH 190 Server: Encrypted packet (len=124)
  738 31.443649778 192.168.1.12 → 10.6.15.156  TCP 66 54766 → 22 [ACK] Seq=11209 Ack=99473 Win=6155 Len=0 TSval=8176858 TSecr=15108358
  739 31.464739639  10.6.15.156 → 192.168.1.12 SSH 238 Server: Encrypted packet (len=172)
  740 31.464757456 192.168.1.12 → 10.6.15.156  TCP 66 54766 → 22 [ACK] Seq=11209 Ack=99645 Win=6155 Len=0 TSval=8176863 TSecr=15108364
  741 31.570366971  10.6.15.156 → 192.168.1.12 SSH 366 Server: Encrypted packet (len=300)
  742 31.570383856 192.168.1.12 → 10.6.15.156  TCP 66 54766 → 22 [ACK] Seq=11209 Ack=99945 Win=6155 Len=0 TSval=8176889 TSecr=15108390
  743 31.791916778  10.6.15.156 → 192.168.1.12 SSH 438 Server: Encrypted packet (len=372)
  744 31.791934731 192.168.1.12 → 10.6.15.156  TCP 66 54766 → 22 [ACK] Seq=11209 Ack=100317 Win=6155 Len=0 TSval=8176945 TSecr=15108445
  745 31.860618568  10.6.15.156 → 192.168.1.12 SSH 422 Server: Encrypted packet (len=356)
  746 31.860635764 192.168.1.12 → 10.6.15.156  TCP 66 54766 → 22 [ACK] Seq=11209 Ack=100673 Win=6155 Len=0 TSval=8176962 TSecr=15108462
  747 31.915851043  10.6.15.156 → 192.168.1.12 SSH 422 Server: Encrypted packet (len=356)
  748 31.915869382 192.168.1.12 → 10.6.15.156  TCP 66 54766 → 22 [ACK] Seq=11209 Ack=101029 Win=6155 Len=0 TSval=8176976 TSecr=15108476
  749 32.020502665  10.6.15.156 → 192.168.1.12 SSH 302 Server: Encrypted packet (len=236)
  750 32.020581528 192.168.1.12 → 10.6.15.156  TCP 66 54766 → 22 [ACK] Seq=11209 Ack=101265 Win=6155 Len=0 TSval=8177002 TSecr=15108502
  751 32.104747790 192.168.1.12 → 139.59.21.22 NTP 90 NTP Version 4, client
  752 32.242682003  10.6.15.156 → 192.168.1.12 SSH 302 Server: Encrypted packet (len=236)
  753 32.242767453 192.168.1.12 → 10.6.15.156  TCP 66 54766 → 22 [ACK] Seq=11209 Ack=101501 Win=6155 Len=0 TSval=8177057 TSecr=15108558
  754 32.311086357  10.6.15.156 → 192.168.1.12 SSH 182 Server: Encrypted packet (len=116)
  755 32.311192707 192.168.1.12 → 10.6.15.156  TCP 66 54766 → 22 [ACK] Seq=11209 Ack=101617 Win=6155 Len=0 TSval=8177075 TSecr=15108575
  756 32.320939144  10.6.15.156 → 192.168.1.12 SSH 182 Server: [TCP Spurious Retransmission] , Encrypted packet (len=116)
  757 32.320959401 192.168.1.12 → 10.6.15.156  TCP 78 [TCP Dup ACK 755#1] 54766 → 22 [ACK] Seq=11209 Ack=101617 Win=6155 Len=0 TSval=8177077 TSecr=15108578 SLE=101501 SRE=101617
  758 32.366545945  10.6.15.156 → 192.168.1.12 SSH 182 Server: Encrypted packet (len=116)
  759 32.366571646 192.168.1.12 → 10.6.15.156  TCP 66 54766 → 22 [ACK] Seq=11209 Ack=101733 Win=6155 Len=0 TSval=8177088 TSecr=15108589
  760 32.471339757  10.6.15.156 → 192.168.1.12 SSH 182 Server: Encrypted packet (len=116)
  761 32.471357751 192.168.1.12 → 10.6.15.156  TCP 66 54766 → 22 [ACK] Seq=11209 Ack=101849 Win=6155 Len=0 TSval=8177115 TSecr=15108615
  762 32.762270237  10.6.15.156 → 192.168.1.12 SSH 318 Server: Encrypted packet (len=252)
  763 32.762288157 192.168.1.12 → 10.6.15.156  TCP 66 54766 → 22 [ACK] Seq=11209 Ack=102101 Win=6155 Len=0 TSval=8177187 TSecr=15108688
  764 32.817947739  10.6.15.156 → 192.168.1.12 SSH 318 Server: Encrypted packet (len=252)
  765 32.817965736 192.168.1.12 → 10.6.15.156  TCP 66 54766 → 22 [ACK] Seq=11209 Ack=102353 Win=6155 Len=0 TSval=8177201 TSecr=15108702
  766 32.922521282  10.6.15.156 → 192.168.1.12 SSH 318 Server: Encrypted packet (len=252)
  767 32.922538694 192.168.1.12 → 10.6.15.156  TCP 66 54766 → 22 [ACK] Seq=11209 Ack=102605 Win=6155 Len=0 TSval=8177227 TSecr=15108728
  768 33.146921995  10.6.15.156 → 192.168.1.12 SSH 254 Server: Encrypted packet (len=188)
  769 33.146939458 192.168.1.12 → 10.6.15.156  TCP 66 54766 → 22 [ACK] Seq=11209 Ack=102793 Win=6155 Len=0 TSval=8177284 TSecr=15108784
  770 33.595796239  10.6.15.156 → 192.168.1.12 SSH 270 Server: Encrypted packet (len=204)
  771 33.595814133 192.168.1.12 → 10.6.15.156  TCP 66 54766 → 22 [ACK] Seq=11209 Ack=102997 Win=6155 Len=0 TSval=8177396 TSecr=15108896
  772 33.664857502  10.6.15.156 → 192.168.1.12 SSH 254 Server: Encrypted packet (len=188)
  773 33.664875898 192.168.1.12 → 10.6.15.156  TCP 66 54766 → 22 [ACK] Seq=11209 Ack=103185 Win=6155 Len=0 TSval=8177413 TSecr=15108913
  774 33.719696154  10.6.15.156 → 192.168.1.12 SSH 214 Server: Encrypted packet (len=148)
  775 33.719714220 192.168.1.12 → 10.6.15.156  TCP 66 54766 → 22 [ACK] Seq=11209 Ack=103333 Win=6155 Len=0 TSval=8177427 TSecr=15108927
  776 33.824361278  10.6.15.156 → 192.168.1.12 SSH 318 Server: Encrypted packet (len=252)
  777 33.824379839 192.168.1.12 → 10.6.15.156  TCP 66 54766 → 22 [ACK] Seq=11209 Ack=103585 Win=6155 Len=0 TSval=8177453 TSecr=15108953
  778 34.046659178  10.6.15.156 → 192.168.1.12 SSH 302 Server: Encrypted packet (len=236)
  779 34.046677032 192.168.1.12 → 10.6.15.156  TCP 66 54766 → 22 [ACK] Seq=11209 Ack=103821 Win=6155 Len=0 TSval=8177508 TSecr=15109009
  780 34.115372442  10.6.15.156 → 192.168.1.12 SSH 422 Server: Encrypted packet (len=356)
  781 34.115390206 192.168.1.12 → 10.6.15.156  TCP 66 54766 → 22 [ACK] Seq=11209 Ack=104177 Win=6155 Len=0 TSval=8177526 TSecr=15109026
  782 34.171056330  10.6.15.156 → 192.168.1.12 SSH 454 Server: Encrypted packet (len=388)
  783 34.171074266 192.168.1.12 → 10.6.15.156  TCP 66 54766 → 22 [ACK] Seq=11209 Ack=104565 Win=6155 Len=0 TSval=8177540 TSecr=15109040
  784 34.275601092  10.6.15.156 → 192.168.1.12 SSH 358 Server: Encrypted packet (len=292)
  785 34.275620007 192.168.1.12 → 10.6.15.156  TCP 66 54766 → 22 [ACK] Seq=11209 Ack=104857 Win=6155 Len=0 TSval=8177566 TSecr=15109066
  786 34.498046887  10.6.15.156 → 192.168.1.12 SSH 254 Server: Encrypted packet (len=188)
  787 34.498064877 192.168.1.12 → 10.6.15.156  TCP 66 54766 → 22 [ACK] Seq=11209 Ack=105045 Win=6155 Len=0 TSval=8177621 TSecr=15109122
  788 34.632309245 192.168.1.12 → 10.6.15.156  SSH 138 Client: Encrypted packet (len=72)
  789 34.634301457  10.6.15.156 → 192.168.1.12 SSH 102 Server: Encrypted packet (len=36)
  790 34.634312523 192.168.1.12 → 10.6.15.156  SSH 178 Client: Encrypted packet (len=112)
  791 34.673337348  10.6.15.156 → 192.168.1.12 TCP 66 22 → 54766 [ACK] Seq=105081 Ack=11393 Win=1452 Len=0 TSval=15109166 TSecr=8177655
  792 34.786146620  10.6.15.156 → 192.168.1.12 SSH 102 Server: Encrypted packet (len=36)
  793 34.786473101 192.168.1.12 → 10.6.15.156  SSH 126 Client: Encrypted packet (len=60)
  794 34.788088487  10.6.15.156 → 192.168.1.12 TCP 66 22 → 54766 [ACK] Seq=105117 Ack=11453 Win=1452 Len=0 TSval=15109194 TSecr=8177693
  795 34.788615177  10.6.15.156 → 192.168.1.12 SSH 182 Server: Encrypted packet (len=116)
  796 34.830921653 192.168.1.12 → 10.6.15.156  TCP 66 54766 → 22 [ACK] Seq=11453 Ack=105233 Win=6155 Len=0 TSval=8177705 TSecr=15109194
