    1 0.000000000 192.168.1.16 → 10.6.15.145  SSH 814 Client: Encrypted packet (len=748)
    2 0.069775971  10.6.15.145 → 192.168.1.16 SSH 834 Server: Encrypted packet (len=768)
    3 0.069801916 192.168.1.16 → 10.6.15.145  TCP 66 52104 → 22 [ACK] Seq=749 Ack=769 Win=1438 Len=0 TSval=1227042 TSecr=24041366
    4 0.070278224  192.168.1.1 → 224.0.0.1    IGMPv2 42 Membership Query, general
    5 0.153255894  10.6.15.145 → 192.168.1.16 SSH 1514 Server: [TCP Previous segment not captured] , Encrypted packet (len=1448)
    6 0.153282361 192.168.1.16 → 10.6.15.145  TCP 78 [TCP Dup ACK 3#1] 52104 → 22 [ACK] Seq=749 Ack=769 Win=1438 Len=0 TSval=1227063 TSecr=24041366 SLE=1533 SRE=2981
    7 0.153434059  10.6.15.145 → 192.168.1.16 SSH 1514 Server: Encrypted packet (len=1448)
    8 0.153445293 192.168.1.16 → 10.6.15.145  TCP 78 [TCP Dup ACK 3#2] 52104 → 22 [ACK] Seq=749 Ack=769 Win=1438 Len=0 TSval=1227063 TSecr=24041366 SLE=1533 SRE=4429
    9 0.156643525  10.6.15.145 → 192.168.1.16 SSH 830 Server: [TCP Fast Retransmission] , Encrypted packet (len=764)
   10 0.156679762 192.168.1.16 → 10.6.15.145  TCP 66 52104 → 22 [ACK] Seq=749 Ack=4429 Win=1422 Len=0 TSval=1227064 TSecr=24041587
   11 0.161126590  10.6.15.145 → 192.168.1.16 SSH 1514 Server: Encrypted packet (len=1448)
   12 0.161147509 192.168.1.16 → 10.6.15.145  TCP 66 52104 → 22 [ACK] Seq=749 Ack=5877 Win=1422 Len=0 TSval=1227065 TSecr=24041587
   13 0.193118572  10.6.15.145 → 192.168.1.16 SSH 318 Server: Encrypted packet (len=252)
   14 0.193138034 192.168.1.16 → 10.6.15.145  TCP 66 52104 → 22 [ACK] Seq=749 Ack=6129 Win=1422 Len=0 TSval=1227073 TSecr=24041596
   15 1.180002591 192.168.1.16 → 10.6.15.145  SSH 1514 Client: Encrypted packet (len=1448)
   16 4.733913961  10.6.15.145 → 192.168.1.16 SSH 102 Server: Encrypted packet (len=36)
   17 4.733938662 192.168.1.16 → 10.6.15.145  TCP 66 52104 → 22 [ACK] Seq=2197 Ack=6165 Win=1444 Len=0 TSval=1228208 TSecr=24042691
   18 5.728641982  10.22.18.34 → 224.0.0.252  LLMNR 104 Standard query 0x25e6 A do_this_before_bed_and_lose_22_kg_in_3_weeks
   19 5.732077478  10.22.18.34 → 224.0.0.252  LLMNR 116 Standard query 0xc99f A bald_man_regrew_his_hair_by_doing_something_super_simple
   20 5.756001791 192.168.1.16 → 10.6.15.145  SSH 1514 Client: Encrypted packet (len=1448)
   21 5.758262840  10.6.15.145 → 192.168.1.16 TCP 78 [TCP Dup ACK 2#1] 22 → 52104 [ACK] Seq=6165 Ack=4294966541 Win=1452 Len=0 TSval=24042988 TSecr=1226527 SLE=2197 SRE=3645
   22 5.758279906 192.168.1.16 → 10.6.15.145  TCP 822 [TCP Out-Of-Order] 52104 → 22 [PSH, ACK] Seq=4294966541 Ack=6165 Win=1444 Len=756 TSval=1228464 TSecr=24042988
   23 5.760118048  10.6.15.145 → 192.168.1.16 TCP 78 22 → 52104 [ACK] Seq=6165 Ack=1 Win=1447 Len=0 TSval=24042988 TSecr=1228464 SLE=2197 SRE=3645
   24 5.760130862 192.168.1.16 → 10.6.15.145  TCP 814 [TCP Retransmission] 52104 → 22 [PSH, ACK] Seq=1 Ack=6165 Win=1444 Len=748 TSval=1228465 TSecr=24042988
   25 5.760139364 192.168.1.16 → 10.6.15.145  TCP 1514 [TCP Retransmission] 52104 → 22 [ACK] Seq=749 Ack=6165 Win=1444 Len=1448 TSval=1228465 TSecr=24042988
   26 5.761313906  10.6.15.145 → 192.168.1.16 SSH 186 Server: Encrypted packet (len=108)
   27 5.761325207 192.168.1.16 → 10.6.15.145  TCP 66 52104 → 22 [ACK] Seq=3645 Ack=6273 Win=1444 Len=0 TSval=1228465 TSecr=24042988
   28 5.762131318  10.6.15.145 → 192.168.1.16 TCP 78 22 → 52104 [ACK] Seq=6273 Ack=749 Win=1447 Len=0 TSval=24042989 TSecr=1228465 SLE=2197 SRE=3645
   29 5.762143807 192.168.1.16 → 10.6.15.145  SSH 1514 Client: Encrypted packet (len=1448)
   30 5.762902715  10.6.15.145 → 192.168.1.16 TCP 66 22 → 52104 [ACK] Seq=6273 Ack=3645 Win=1446 Len=0 TSval=24042989 TSecr=1228465
   31 5.762913947 192.168.1.16 → 10.6.15.145  SSH 1514 Client: Encrypted packet (len=1448)
   32 5.765507674  10.6.15.145 → 192.168.1.16 SSH 174 Server: Encrypted packet (len=108)
   33 5.766468848  10.6.15.145 → 192.168.1.16 SSH 182 Server: Encrypted packet (len=116)
   34 5.766479717 192.168.1.16 → 10.6.15.145  SSH 1514 Client: Encrypted packet (len=1448)
   35 5.766492760  10.6.15.145 → 192.168.1.16 SSH 102 Server: Encrypted packet (len=36)
   36 5.771427537  10.6.15.145 → 192.168.1.16 SSH 102 Server: Encrypted packet (len=36)
   37 5.771451163 192.168.1.16 → 10.6.15.145  SSH 1030 Client: Encrypted packet (len=964)
   38 5.772234381 192.168.1.16 → 10.6.15.145  SSH 446 Client: Encrypted packet (len=380)
   39 5.775481167  10.6.15.145 → 192.168.1.16 TCP 66 22 → 52104 [ACK] Seq=6569 Ack=9333 Win=1452 Len=0 TSval=24042991 TSecr=1228467
   40 5.776439545  10.6.15.145 → 192.168.1.16 SSH 102 Server: Encrypted packet (len=36)
   41 5.776452576  10.6.15.145 → 192.168.1.16 SSH 102 Server: Encrypted packet (len=36)
   42 5.776504237 192.168.1.16 → 10.6.15.145  TCP 66 52104 → 22 [ACK] Seq=9333 Ack=6641 Win=1444 Len=0 TSval=1228469 TSecr=24042992
   43 5.776888851  10.6.15.145 → 192.168.1.16 SSH 102 Server: Encrypted packet (len=36)
   44 5.776908522 192.168.1.16 → 10.6.15.145  SSH 158 Client: Encrypted packet (len=92)
   45 5.777161849 192.168.1.16 → 10.6.15.145  SSH 150 Client: Encrypted packet (len=84)
   46 5.778788883  10.6.15.145 → 192.168.1.16 SSH 346 Server: Encrypted packet (len=280)
   47 5.778805167  10.6.15.145 → 192.168.1.16 TCP 66 22 → 52104 [ACK] Seq=6957 Ack=9509 Win=1452 Len=0 TSval=24042993 TSecr=1228469
   48 5.779310957 192.168.1.16 → 10.6.15.145  SSH 302 Client: Encrypted packet (len=236)
   49 5.779621003  10.6.15.145 → 192.168.1.16 SSH 206 Server: Encrypted packet (len=140)
   50 5.781319539 192.168.1.16 → 10.6.15.145  SSH 338 Client: Encrypted packet (len=272)
   51 5.781695411  10.6.15.145 → 192.168.1.16 SSH 166 Server: Encrypted packet (len=100)
   52 5.783237569  10.6.15.145 → 192.168.1.16 SSH 166 Server: Encrypted packet (len=100)
   53 5.783249108 192.168.1.16 → 10.6.15.145  SSH 330 Client: Encrypted packet (len=264)
   54 5.784758221  10.6.15.145 → 192.168.1.16 TCP 66 22 → 52104 [ACK] Seq=7297 Ack=10281 Win=1452 Len=0 TSval=24042994 TSecr=1228470
   55 5.784769693 192.168.1.16 → 10.6.15.145  SSH 302 Client: Encrypted packet (len=236)
   56 5.785091555 192.168.1.16 → 10.6.15.145  SSH 294 Client: Encrypted packet (len=228)
   57 5.785501910  10.6.15.145 → 192.168.1.16 SSH 166 Server: Encrypted packet (len=100)
   58 5.785521614  10.6.15.145 → 192.168.1.16 SSH 138 Server: Encrypted packet (len=72)
   59 5.785558199 192.168.1.16 → 10.6.15.145  TCP 66 52104 → 22 [ACK] Seq=10745 Ack=7469 Win=1444 Len=0 TSval=1228471 TSecr=24042994
   60 5.786144071  10.6.15.145 → 192.168.1.16 SSH 158 Server: Encrypted packet (len=92)
   61 5.786646584  10.6.15.145 → 192.168.1.16 TCP 66 22 → 52104 [ACK] Seq=7561 Ack=10745 Win=1452 Len=0 TSval=24042995 TSecr=1228471
   62 5.786662224 192.168.1.16 → 10.6.15.145  SSH 330 Client: Encrypted packet (len=264)
   63 5.787354067 192.168.1.16 → 10.6.15.145  SSH 102 Client: Encrypted packet (len=36)
   64 5.787682920  10.6.15.145 → 192.168.1.16 SSH 158 Server: Encrypted packet (len=92)
   65 5.787702430  10.6.15.145 → 192.168.1.16 SSH 138 Server: Encrypted packet (len=72)
   66 5.787767507 192.168.1.16 → 10.6.15.145  TCP 66 52104 → 22 [ACK] Seq=11045 Ack=7725 Win=1444 Len=0 TSval=1228471 TSecr=24042995
   67 5.788773543  10.6.15.145 → 192.168.1.16 SSH 158 Server: Encrypted packet (len=92)
   68 5.788790433 192.168.1.16 → 10.6.15.145  SSH 1514 Client: Encrypted packet (len=1448)
   69 5.789613475  10.6.15.145 → 192.168.1.16 SSH 158 Server: Encrypted packet (len=92)
   70 5.789627950 192.168.1.16 → 10.6.15.145  SSH 166 Client: Encrypted packet (len=100)
   71 5.789644468  10.6.15.145 → 192.168.1.16 SSH 214 Server: Encrypted packet (len=148)
   72 5.791051070  10.6.15.145 → 192.168.1.16 SSH 206 Server: Encrypted packet (len=140)
   73 5.791067400 192.168.1.16 → 10.6.15.145  SSH 186 Client: Encrypted packet (len=120)
   74 5.791838050  10.6.15.145 → 192.168.1.16 SSH 134 Server: Encrypted packet (len=68)
   75 5.791853023 192.168.1.16 → 10.6.15.145  SSH 102 Client: Encrypted packet (len=36)
   76 5.792960566  10.6.15.145 → 192.168.1.16 SSH 326 Server: Encrypted packet (len=260)
   77 5.794661168  10.6.15.145 → 192.168.1.16 SSH 126 Server: Encrypted packet (len=60)
   78 5.794685656  10.6.15.145 → 192.168.1.16 SSH 126 Server: Encrypted packet (len=60)
   79 5.794745203 192.168.1.16 → 10.6.15.145  TCP 66 52104 → 22 [ACK] Seq=12749 Ack=8645 Win=1444 Len=0 TSval=1228473 TSecr=24042996
   80 5.796504184  10.6.15.145 → 192.168.1.16 SSH 694 Server: Encrypted packet (len=628)
   81 5.797185934  10.6.15.145 → 192.168.1.16 SSH 138 Server: Encrypted packet (len=72)
   82 5.797224829 192.168.1.16 → 10.6.15.145  TCP 66 52104 → 22 [ACK] Seq=12749 Ack=9345 Win=1444 Len=0 TSval=1228474 TSecr=24042997
   83 5.797377750 192.168.1.16 → 10.6.15.145  SSH 102 Client: Encrypted packet (len=36)
   84 5.798138961  10.6.15.145 → 192.168.1.16 SSH 110 Server: Encrypted packet (len=44)
   85 5.798747993  10.6.15.145 → 192.168.1.16 SSH 102 Server: Encrypted packet (len=36)
   86 5.798759730  10.6.15.145 → 192.168.1.16 SSH 102 Server: Encrypted packet (len=36)
   87 5.798788084 192.168.1.16 → 10.6.15.145  TCP 66 52104 → 22 [ACK] Seq=12785 Ack=9461 Win=1444 Len=0 TSval=1228474 TSecr=24042998
   88 5.798871939 192.168.1.16 → 10.6.15.145  SSH 102 Client: Encrypted packet (len=36)
   89 5.799162439 192.168.1.16 → 10.6.15.145  SSH 134 Client: Encrypted packet (len=68)
   90 5.801901743  10.6.15.145 → 192.168.1.16 TCP 66 22 → 52104 [ACK] Seq=9461 Ack=12821 Win=1452 Len=0 TSval=24042998 TSecr=1228474
   91 5.801925689 192.168.1.16 → 10.6.15.145  SSH 482 Client: Encrypted packet (len=416)
   92 5.801945501  10.6.15.145 → 192.168.1.16 SSH 134 Server: Encrypted packet (len=68)
   93 5.801956468  10.6.15.145 → 192.168.1.16 SSH 138 Server: Encrypted packet (len=72)
   94 5.801978561  10.6.15.145 → 192.168.1.16 SSH 138 Server: Encrypted packet (len=72)
   95 5.802015887 192.168.1.16 → 10.6.15.145  TCP 66 52104 → 22 [ACK] Seq=13305 Ack=9673 Win=1444 Len=0 TSval=1228475 TSecr=24042998
   96 5.802567222 192.168.1.16 → 10.6.15.145  SSH 138 Client: Encrypted packet (len=72)
   97 5.803670517  10.6.15.145 → 192.168.1.16 TCP 66 22 → 52104 [ACK] Seq=9673 Ack=13305 Win=1452 Len=0 TSval=24042999 TSecr=1228474
   98 5.828324188  10.6.15.145 → 192.168.1.16 SSH 102 Server: Encrypted packet (len=36)
   99 5.830085951  10.6.15.145 → 192.168.1.16 SSH 990 Server: Encrypted packet (len=924)
  100 5.830148917 192.168.1.16 → 10.6.15.145  TCP 66 52104 → 22 [ACK] Seq=13377 Ack=10633 Win=1444 Len=0 TSval=1228482 TSecr=24043005
  101 5.831004575 192.168.1.16 → 10.6.15.145  SSH 158 Client: Encrypted packet (len=92)
  102 5.833624686 192.168.1.16 → 10.6.15.145  SSH 134 Client: Encrypted packet (len=68)
  103 5.835576099 192.168.1.16 → 10.6.15.145  SSH 102 Client: Encrypted packet (len=36)
  104 5.835678715  10.6.15.145 → 192.168.1.16 SSH 126 Server: Encrypted packet (len=60)
  105 5.835698810  10.6.15.145 → 192.168.1.16 SSH 134 Server: Encrypted packet (len=68)
  106 5.835720557  10.6.15.145 → 192.168.1.16 SSH 138 Server: Encrypted packet (len=72)
  107 5.835728618 192.168.1.16 → 10.6.15.145  TCP 66 52104 → 22 [ACK] Seq=13573 Ack=10833 Win=1444 Len=0 TSval=1228483 TSecr=24043006
  108 5.836024508 192.168.1.16 → 10.6.15.145  SSH 102 Client: Encrypted packet (len=36)
  109 5.836291067 192.168.1.16 → 10.6.15.145  SSH 102 Client: Encrypted packet (len=36)
  110 5.837173561  10.6.15.145 → 192.168.1.16 TCP 66 22 → 52104 [ACK] Seq=10833 Ack=13573 Win=1452 Len=0 TSval=24043007 TSecr=1228483
  111 5.837187776 192.168.1.16 → 10.6.15.145  SSH 146 Client: Encrypted packet (len=80)
  112 5.837812274  10.6.15.145 → 192.168.1.16 TCP 66 22 → 52104 [ACK] Seq=10833 Ack=13645 Win=1452 Len=0 TSval=24043008 TSecr=1228484
  113 5.837831137  10.6.15.145 → 192.168.1.16 SSH 102 Server: Encrypted packet (len=36)
  114 5.838138544 192.168.1.16 → 10.6.15.145  SSH 382 Client: Encrypted packet (len=316)
  115 5.838243364  10.6.15.145 → 192.168.1.16 SSH 166 Server: Encrypted packet (len=100)
  116 5.838672409 192.168.1.16 → 10.6.15.145  SSH 302 Client: Encrypted packet (len=236)
  117 5.839257702  10.6.15.145 → 192.168.1.16 SSH 138 Server: Encrypted packet (len=72)
  118 5.839375712 192.168.1.16 → 10.6.15.145  SSH 102 Client: Encrypted packet (len=36)
  119 5.839944626  10.6.15.145 → 192.168.1.16 SSH 230 Server: Encrypted packet (len=164)
  120 5.840119073 192.168.1.16 → 10.6.15.145  SSH 134 Client: Encrypted packet (len=68)
  121 5.840432183  10.6.15.145 → 192.168.1.16 SSH 182 Server: Encrypted packet (len=116)
  122 5.840578863 192.168.1.16 → 10.6.15.145  SSH 134 Client: Encrypted packet (len=68)
  123 5.841179764  10.6.15.145 → 192.168.1.16 SSH 138 Server: Encrypted packet (len=72)
  124 5.841297711 192.168.1.16 → 10.6.15.145  SSH 102 Client: Encrypted packet (len=36)
  125 5.842196639  10.6.15.145 → 192.168.1.16 TCP 66 22 → 52104 [ACK] Seq=11393 Ack=14449 Win=1452 Len=0 TSval=24043009 TSecr=1228485
  126 5.842219668  10.6.15.145 → 192.168.1.16 SSH 138 Server: Encrypted packet (len=72)
  127 5.842347622 192.168.1.16 → 10.6.15.145  SSH 102 Client: Encrypted packet (len=36)
  128 5.843699810  10.6.15.145 → 192.168.1.16 TCP 66 22 → 52104 [ACK] Seq=11465 Ack=14521 Win=1452 Len=0 TSval=24043009 TSecr=1228485
  129 5.861830636  10.6.15.145 → 192.168.1.16 SSH 134 Server: Encrypted packet (len=68)
  130 5.862685250  10.6.15.145 → 192.168.1.16 SSH 126 Server: Encrypted packet (len=60)
  131 5.862702423  10.6.15.145 → 192.168.1.16 SSH 138 Server: Encrypted packet (len=72)
  132 5.862710777 192.168.1.16 → 10.6.15.145  TCP 66 52104 → 22 [ACK] Seq=14521 Ack=11665 Win=1444 Len=0 TSval=1228490 TSecr=24043014
  133 5.862859622 192.168.1.16 → 10.6.15.145  SSH 102 Client: Encrypted packet (len=36)
  134 5.865843224  10.6.15.145 → 192.168.1.16 SSH 238 Server: Encrypted packet (len=172)
  135 5.866092940 192.168.1.16 → 10.6.15.145  SSH 102 Client: Encrypted packet (len=36)
  136 5.867510599  10.6.15.145 → 192.168.1.16 TCP 66 22 → 52104 [ACK] Seq=11837 Ack=14593 Win=1452 Len=0 TSval=24043015 TSecr=1228490
  137 5.867522429  10.6.15.145 → 192.168.1.16 SSH 102 Server: Encrypted packet (len=36)
  138 5.867788214 192.168.1.16 → 10.6.15.145  SSH 158 Client: Encrypted packet (len=92)
  139 5.869283295  10.6.15.145 → 192.168.1.16 SSH 138 Server: Encrypted packet (len=72)
  140 5.869433030 192.168.1.16 → 10.6.15.145  SSH 102 Client: Encrypted packet (len=36)
  141 5.909920677  10.6.15.145 → 192.168.1.16 TCP 66 22 → 52104 [ACK] Seq=11945 Ack=14721 Win=1452 Len=0 TSval=24043026 TSecr=1228492
  142 5.911510121  10.6.15.145 → 192.168.1.16 SSH 230 Server: Encrypted packet (len=164)
  143 5.911865148 192.168.1.16 → 10.6.15.145  SSH 134 Client: Encrypted packet (len=68)
  144 5.912502748 192.168.1.16 → 10.6.15.145  SSH 702 Client: Encrypted packet (len=636)
  145 5.913270444  10.6.15.145 → 192.168.1.16 TCP 66 22 → 52104 [ACK] Seq=12109 Ack=14789 Win=1452 Len=0 TSval=24043026 TSecr=1228502
  146 5.914296412  10.6.15.145 → 192.168.1.16 TCP 66 22 → 52104 [ACK] Seq=12109 Ack=15425 Win=1452 Len=0 TSval=24043027 TSecr=1228503
  147 5.951596060  10.6.15.145 → 192.168.1.16 SSH 174 Server: Encrypted packet (len=108)
  148 5.951655168  10.6.15.145 → 192.168.1.16 SSH 462 Server: Encrypted packet (len=396)
  149 5.951694813 192.168.1.16 → 10.6.15.145  TCP 66 52104 → 22 [ACK] Seq=15425 Ack=12613 Win=1444 Len=0 TSval=1228512 TSecr=24043036
  150 5.952870932 192.168.1.16 → 10.6.15.145  SSH 206 Client: Encrypted packet (len=140)
  151 5.957063571  10.6.15.145 → 192.168.1.16 SSH 390 Server: Encrypted packet (len=324)
  152 5.976581715  10.6.15.145 → 192.168.1.16 SSH 150 Server: Encrypted packet (len=84)
  153 5.976640458 192.168.1.16 → 10.6.15.145  TCP 66 52104 → 22 [ACK] Seq=15565 Ack=13021 Win=1444 Len=0 TSval=1228519 TSecr=24043037
  154 5.977161998  10.6.15.145 → 192.168.1.16 SSH 186 Server: Encrypted packet (len=120)
  155 5.977360042 192.168.1.16 → 10.6.15.145  SSH 910 Client: Encrypted packet (len=844)
  156 5.977827835 192.168.1.16 → 10.6.15.145  SSH 190 Client: Encrypted packet (len=124)
  157 5.978104807 192.168.1.16 → 10.6.15.145  SSH 950 Client: Encrypted packet (len=884)
  158 5.979117963  10.6.15.145 → 192.168.1.16 SSH 670 Server: Encrypted packet (len=604)
  159 5.979704162  10.6.15.145 → 192.168.1.16 TCP 66 22 → 52104 [ACK] Seq=13745 Ack=16533 Win=1452 Len=0 TSval=24043043 TSecr=1228519
  160 5.981526164  10.6.15.145 → 192.168.1.16 SSH 678 Server: Encrypted packet (len=612)
  161 5.981581953 192.168.1.16 → 10.6.15.145  TCP 66 52104 → 22 [ACK] Seq=17417 Ack=14357 Win=1444 Len=0 TSval=1228520 TSecr=24043043
  162 5.981597762 192.168.1.16 → 10.6.15.145  SSH 974 Client: Encrypted packet (len=908)
  163 5.985040782  10.6.15.145 → 192.168.1.16 SSH 702 Server: Encrypted packet (len=636)
  164 5.988515216  10.6.15.145 → 192.168.1.16 SSH 102 Server: Encrypted packet (len=36)
  165 5.988576485 192.168.1.16 → 10.6.15.145  TCP 66 52104 → 22 [ACK] Seq=18325 Ack=15029 Win=1444 Len=0 TSval=1228522 TSecr=24043044
  166 5.996301040 192.168.1.16 → 10.6.15.145  SSH 182 Client: Encrypted packet (len=116)
  167 6.006497299  10.6.15.145 → 192.168.1.16 SSH 102 Server: Encrypted packet (len=36)
  168 6.006797273 192.168.1.16 → 10.6.15.145  SSH 158 Client: Encrypted packet (len=92)
  169 6.026815965  10.6.15.145 → 192.168.1.16 SSH 102 Server: Encrypted packet (len=36)
  170 6.027150208 192.168.1.16 → 10.6.15.145  SSH 182 Client: Encrypted packet (len=116)
  171 6.036794352  10.6.15.145 → 192.168.1.16 SSH 398 Server: Encrypted packet (len=332)
  172 6.039490900  10.6.15.145 → 192.168.1.16 SSH 102 Server: Encrypted packet (len=36)
  173 6.039533959 192.168.1.16 → 10.6.15.145  TCP 66 52104 → 22 [ACK] Seq=18649 Ack=15469 Win=1444 Len=0 TSval=1228534 TSecr=24043057
  174 6.039787238 192.168.1.16 → 10.6.15.145  SSH 158 Client: Encrypted packet (len=92)
  175 6.041201651  10.6.15.145 → 192.168.1.16 SSH 174 Server: Encrypted packet (len=108)
  176 6.041449017 192.168.1.16 → 10.6.15.145  SSH 126 Client: Encrypted packet (len=60)
  177 6.043106533  10.6.15.145 → 192.168.1.16 SSH 798 Server: Encrypted packet (len=732)
  178 6.053315552  10.6.15.145 → 192.168.1.16 SSH 102 Server: Encrypted packet (len=36)
  179 6.053389520 192.168.1.16 → 10.6.15.145  TCP 66 52104 → 22 [ACK] Seq=18801 Ack=16345 Win=1444 Len=0 TSval=1228538 TSecr=24043059
  180 6.053751117 192.168.1.16 → 10.6.15.145  SSH 198 Client: Encrypted packet (len=132)
  181 6.054396809 192.168.1.16 → 10.6.15.145  SSH 214 Client: Encrypted packet (len=148)
  182 6.054625929 192.168.1.16 → 10.6.15.145  SSH 1514 Client: Encrypted packet (len=1448)
  183 6.055274471 192.168.1.16 → 10.6.15.145  SSH 166 Client: Encrypted packet (len=100)
  184 6.055373447 192.168.1.16 → 10.6.15.145  SSH 1514 Client: Encrypted packet (len=1448)
  185 6.058442431 192.168.1.16 → 10.6.15.145  SSH 838 Client: Encrypted packet (len=772)
  186 6.059137387  10.6.15.145 → 192.168.1.16 TCP 66 22 → 52104 [ACK] Seq=16345 Ack=19081 Win=1452 Len=0 TSval=24043062 TSecr=1228538
  187 6.059511013  10.6.15.145 → 192.168.1.16 TCP 66 22 → 52104 [ACK] Seq=16345 Ack=20629 Win=1452 Len=0 TSval=24043063 TSecr=1228538
  188 6.060020282  10.6.15.145 → 192.168.1.16 TCP 66 22 → 52104 [ACK] Seq=16345 Ack=22849 Win=1452 Len=0 TSval=24043063 TSecr=1228538
  189 6.095457818  10.6.15.145 → 192.168.1.16 SSH 134 Server: Encrypted packet (len=68)
  190 6.095478091  10.6.15.145 → 192.168.1.16 SSH 138 Server: Encrypted packet (len=72)
  191 6.095521425 192.168.1.16 → 10.6.15.145  TCP 66 52104 → 22 [ACK] Seq=22849 Ack=16485 Win=1444 Len=0 TSval=1228548 TSecr=24043072
  192 6.095731376 192.168.1.16 → 10.6.15.145  SSH 102 Client: Encrypted packet (len=36)
  193 6.114941213  10.6.15.145 → 192.168.1.16 SSH 138 Server: Encrypted packet (len=72)
  194 6.115205773 192.168.1.16 → 10.6.15.145  SSH 102 Client: Encrypted packet (len=36)
  195 6.131917612  10.6.15.145 → 192.168.1.16 SSH 182 Server: Encrypted packet (len=116)
  196 6.131936135  10.6.15.145 → 192.168.1.16 SSH 138 Server: Encrypted packet (len=72)
  197 6.131975128 192.168.1.16 → 10.6.15.145  TCP 66 52104 → 22 [ACK] Seq=22921 Ack=16745 Win=1444 Len=0 TSval=1228557 TSecr=24043077
  198 6.132009420 192.168.1.16 → 10.6.15.145  TCP 102 [TCP Retransmission] 52104 → 22 [PSH, ACK] Seq=22885 Ack=16745 Win=1444 Len=36 TSval=1228558 TSecr=24043077
  199 6.132022396  10.6.15.145 → 192.168.1.16 SSH 578 Server: Encrypted packet (len=512)
  200 6.135178988 192.168.1.16 → 10.6.15.145  SSH 958 Client: Encrypted packet (len=892)
  201 6.157378543  10.22.18.34 → 224.0.0.252  LLMNR 104 Standard query 0x25e6 A do_this_before_bed_and_lose_22_kg_in_3_weeks
  202 6.157397633  10.22.18.34 → 224.0.0.252  LLMNR 116 Standard query 0xc99f A bald_man_regrew_his_hair_by_doing_something_super_simple
  203 6.308008953 192.168.1.16 → 10.6.15.145  TCP 1030 [TCP Retransmission] 52104 → 22 [PSH, ACK] Seq=22849 Ack=17257 Win=1444 Len=964 TSval=1228602 TSecr=24043081
  204 6.338196812  10.6.15.145 → 192.168.1.16 SSH 838 Server: [TCP Spurious Retransmission] , Encrypted packet (len=772)
  205 6.338218132 192.168.1.16 → 10.6.15.145  TCP 78 [TCP Dup ACK 200#1] 52104 → 22 [ACK] Seq=23813 Ack=17257 Win=1444 Len=0 TSval=1228609 TSecr=24043133 SLE=16485 SRE=17257
  206 6.455891655  10.6.15.145 → 192.168.1.16 SSH 1514 Server: Encrypted packet (len=1448)
  207 6.460016625 192.168.1.16 → 10.6.15.145  TCP 66 52104 → 22 [ACK] Seq=23813 Ack=18705 Win=1433 Len=0 TSval=1228638 TSecr=24043161
  208 6.460032071 192.168.1.16 → 10.6.15.145  SSH 102 Client: Encrypted packet (len=36)
  209 6.460035555 192.168.1.16 → 10.6.15.145  SSH 1514 Client: Encrypted packet (len=1448)
  210 6.515997806 192.168.1.16 → 10.6.15.145  SSH 338 Client: Encrypted packet (len=272)
  211 6.660027056  10.6.15.145 → 192.168.1.16 SSH 346 Server: [TCP Previous segment not captured] , Encrypted packet (len=280)
  212 6.664065939 192.168.1.16 → 10.6.15.145  TCP 78 [TCP Dup ACK 207#1] 52104 → 22 [ACK] Seq=25569 Ack=18705 Win=1444 Len=0 TSval=1228690 TSecr=24043161 SLE=21601 SRE=21881
  213 6.760050250 192.168.1.16 → 10.6.15.145  TCP 350 [TCP Retransmission] 52104 → 22 [PSH, ACK] Seq=25297 Ack=18705 Win=1444 Len=272 TSval=1228715 TSecr=24043161 SLE=21601 SRE=21881
  214 7.132025471 192.168.1.16 → 10.6.15.145  TCP 1514 [TCP Retransmission] 52104 → 22 [ACK] Seq=23849 Ack=18705 Win=1444 Len=1436 TSval=1228808 TSecr=24043161 SLE=21601 SRE=21881
  215 7.237269583  10.6.15.145 → 192.168.1.16 TCP 1514 [TCP Retransmission] 22 → 52104 [ACK] Seq=18705 Ack=23849 Win=1452 Len=1448 TSval=24043276 TSecr=1228639
  216 7.237291261 192.168.1.16 → 10.6.15.145  TCP 78 52104 → 22 [ACK] Seq=25569 Ack=20153 Win=1433 Len=0 TSval=1228834 TSecr=24043276 SLE=21601 SRE=21881
  217 7.399974580  10.6.15.145 → 192.168.1.16 SSH 1514 Server: Encrypted packet (len=1448)
  218 7.400028415 192.168.1.16 → 10.6.15.145  TCP 78 [TCP Dup ACK 216#1] 52104 → 22 [ACK] Seq=25569 Ack=20153 Win=1433 Len=0 TSval=1228875 TSecr=24043276 SLE=21601 SRE=23329
  219 7.400601166  10.6.15.145 → 192.168.1.16 SSH 1514 Server: Encrypted packet (len=1448)
  220 7.407732916  10.6.15.145 → 192.168.1.16 TCP 1514 [TCP Retransmission] 22 → 52104 [ACK] Seq=20153 Ack=23849 Win=1452 Len=1448 TSval=24043400 TSecr=1228639
  221 7.420032801 192.168.1.16 → 10.6.15.145  TCP 78 [TCP Dup ACK 216#2] 52104 → 22 [ACK] Seq=25569 Ack=20153 Win=1433 Len=0 TSval=1228875 TSecr=24043276 SLE=21601 SRE=24777
  222 7.420719565 192.168.1.16 → 10.6.15.145  TCP 66 52104 → 22 [ACK] Seq=25569 Ack=24777 Win=1422 Len=0 TSval=1228876 TSecr=24043400
  223 7.835999658 192.168.1.16 → 10.6.15.145  TCP 1514 [TCP Retransmission] 52104 → 22 [ACK] Seq=23849 Ack=24777 Win=1444 Len=1448 TSval=1228984 TSecr=24043400
  224 8.636054768 192.168.1.16 → 224.0.0.251  IGMPv2 46 Membership Report group 224.0.0.251
  225 8.638015797  10.6.15.145 → 192.168.1.16 SSH 1514 Server: [TCP Spurious Retransmission] , Encrypted packet (len=1448)
  226 8.638032970 192.168.1.16 → 10.6.15.145  TCP 78 [TCP Dup ACK 222#1] 52104 → 22 [ACK] Seq=25569 Ack=24777 Win=1444 Len=0 TSval=1229184 TSecr=24043400 SLE=20153 SRE=21601
  227 8.723057707  10.6.15.145 → 192.168.1.16 SSH 1270 Server: Encrypted packet (len=1204)
  228 8.723080010 192.168.1.16 → 10.6.15.145  TCP 66 52104 → 22 [ACK] Seq=25569 Ack=25981 Win=1435 Len=0 TSval=1229205 TSecr=24043729
  229 8.892060316 192.168.1.16 → 224.0.0.252  IGMPv2 46 Membership Report group 224.0.0.252
  230 9.212026380 192.168.1.16 → 10.6.15.145  TCP 1514 [TCP Retransmission] 52104 → 22 [ACK] Seq=23849 Ack=25981 Win=1444 Len=1448 TSval=1229328 TSecr=24043729
  231 9.214887654  10.22.18.46 → 224.0.0.252  LLMNR 64 Standard query 0x6743 A wpad
  232 9.253955042  10.6.15.145 → 192.168.1.16 TCP 66 22 → 52104 [ACK] Seq=25981 Ack=25297 Win=1452 Len=0 TSval=24043862 TSecr=1229328
  233 9.253975098 192.168.1.16 → 10.6.15.145  SSH 1502 Client: Encrypted packet (len=1436)
  234 9.253986032 192.168.1.16 → 10.6.15.145  SSH 1514 Client: Encrypted packet (len=1448)
  235 9.256186260  10.6.15.145 → 192.168.1.16 TCP 78 [TCP Dup ACK 232#1] 22 → 52104 [ACK] Seq=25981 Ack=25297 Win=1452 Len=0 TSval=24043862 TSecr=1229328 SLE=25569 SRE=27005
  236 9.256192872 192.168.1.16 → 10.6.15.145  TCP 338 [TCP Out-Of-Order] 52104 → 22 [PSH, ACK] Seq=25297 Ack=25981 Win=1444 Len=272 TSval=1229339 TSecr=24043862
  237 9.256701269  10.6.15.145 → 192.168.1.16 TCP 78 [TCP Dup ACK 232#2] 22 → 52104 [ACK] Seq=25981 Ack=25297 Win=1452 Len=0 TSval=24043862 TSecr=1229328 SLE=25569 SRE=28453
  238 9.256705935 192.168.1.16 → 10.6.15.145  SSH 794 Client: Encrypted packet (len=728)
  239 9.257726093  10.6.15.145 → 192.168.1.16 TCP 66 22 → 52104 [ACK] Seq=25981 Ack=28453 Win=1438 Len=0 TSval=24043863 TSecr=1229339
  240 9.258686454  10.6.15.145 → 192.168.1.16 TCP 66 22 → 52104 [ACK] Seq=25981 Ack=29181 Win=1452 Len=0 TSval=24043863 TSecr=1229339
  241 10.017512407 192.168.1.16 → 10.6.15.145  SSH 454 Client: Encrypted packet (len=388)
  242 10.019268192  10.6.15.145 → 192.168.1.16 SSH 654 Server: Encrypted packet (len=588)
  243 10.019286985 192.168.1.16 → 10.6.15.145  TCP 66 52104 → 22 [ACK] Seq=29569 Ack=26569 Win=1440 Len=0 TSval=1229529 TSecr=24043916
  244 10.019296277  10.6.15.145 → 192.168.1.16 SSH 350 Server: Encrypted packet (len=284)
  245 10.019300638 192.168.1.16 → 10.6.15.145  TCP 66 52104 → 22 [ACK] Seq=29569 Ack=26853 Win=1438 Len=0 TSval=1229529 TSecr=24043916
  246 10.019377532  10.6.15.145 → 192.168.1.16 SSH 606 Server: Encrypted packet (len=540)
  247 10.019381545 192.168.1.16 → 10.6.15.145  TCP 66 52104 → 22 [ACK] Seq=29569 Ack=27393 Win=1434 Len=0 TSval=1229529 TSecr=24043917
  248 10.019541384  10.22.18.46 → 224.0.0.252  LLMNR 64 Standard query 0x6743 A wpad
  249 10.019773005  10.6.15.145 → 192.168.1.16 SSH 1514 Server: Encrypted packet (len=1448)
  250 10.019782563 192.168.1.16 → 10.6.15.145  TCP 66 52104 → 22 [ACK] Seq=29569 Ack=28841 Win=1423 Len=0 TSval=1229529 TSecr=24044023
  251 10.021008395 192.168.1.16 → 10.6.15.145  SSH 134 Client: Encrypted packet (len=68)
  252 10.022706395  10.6.15.145 → 192.168.1.16 TCP 66 22 → 52104 [ACK] Seq=28841 Ack=29569 Win=1452 Len=0 TSval=24044053 TSecr=1229529
  253 10.025282156  10.6.15.145 → 192.168.1.16 SSH 1514 Server: Encrypted packet (len=1448)
  254 10.025464462  10.6.15.145 → 192.168.1.16 SSH 1514 Server: Encrypted packet (len=1448)
  255 10.025502868 192.168.1.16 → 10.6.15.145  TCP 66 52104 → 22 [ACK] Seq=29637 Ack=31737 Win=1444 Len=0 TSval=1229531 TSecr=24044054
  256 10.025653507  10.6.15.145 → 192.168.1.16 SSH 1514 Server: Encrypted packet (len=1448)
  257 10.028961155 192.168.1.16 → 10.6.15.145  SSH 206 Client: Encrypted packet (len=140)
  258 10.034099050  10.6.15.145 → 192.168.1.16 SSH 922 Server: Encrypted packet (len=856)
  259 10.034116498 192.168.1.16 → 10.6.15.145  SSH 346 Client: Encrypted packet (len=280)
  260 10.084010365 192.168.1.16 → 10.6.15.145  SSH 1514 Client: Encrypted packet (len=1448)
  261 10.238680338  10.6.15.145 → 192.168.1.16 SSH 310 Server: Encrypted packet (len=244)
  262 10.280052606 192.168.1.16 → 10.6.15.145  TCP 66 52104 → 22 [ACK] Seq=31505 Ack=34285 Win=1444 Len=0 TSval=1229595 TSecr=24044108
  263 10.287999413 192.168.1.16 → 10.6.15.145  SSH 1514 Client: Encrypted packet (len=1448)
  264 10.588005767 192.168.1.16 → 10.6.15.145  TCP 486 [TCP Retransmission] 52104 → 22 [PSH, ACK] Seq=29637 Ack=34285 Win=1444 Len=420 TSval=1229672 TSecr=24044108
  265 11.164008107 192.168.1.16 → 10.6.15.145  TCP 486 [TCP Retransmission] 52104 → 22 [PSH, ACK] Seq=29637 Ack=34285 Win=1444 Len=420 TSval=1229816 TSecr=24044108
  266 11.165908323  10.6.15.145 → 192.168.1.16 SSH 166 Server: Encrypted packet (len=100)
  267 11.165931093 192.168.1.16 → 10.6.15.145  SSH 238 Client: Encrypted packet (len=172)
  268 11.165952132 192.168.1.16 → 10.6.15.145  TCP 66 52104 → 22 [ACK] Seq=33125 Ack=34385 Win=1444 Len=0 TSval=1229816 TSecr=24044231
  269 11.165959231  10.6.15.145 → 192.168.1.16 SSH 430 Server: Encrypted packet (len=364)
  270 11.165962653 192.168.1.16 → 10.6.15.145  TCP 1514 [TCP Out-Of-Order] 52104 → 22 [ACK] Seq=30057 Ack=34385 Win=1444 Len=1448 TSval=1229816 TSecr=24044319
  271 11.165978976  10.6.15.145 → 192.168.1.16 SSH 414 Server: Encrypted packet (len=348)
  272 11.166040451 192.168.1.16 → 10.6.15.145  TCP 66 52104 → 22 [ACK] Seq=33125 Ack=35097 Win=1444 Len=0 TSval=1229816 TSecr=24044319
  273 11.166179222  10.6.15.145 → 192.168.1.16 SSH 414 Server: Encrypted packet (len=348)
  274 11.166301201  10.6.15.145 → 192.168.1.16 TCP 78 [TCP Dup ACK 266#1] 22 → 52104 [ACK] Seq=35445 Ack=30057 Win=1452 Len=0 TSval=24044340 TSecr=1229816 SLE=29637 SRE=30057
  275 11.167972786  10.6.15.145 → 192.168.1.16 TCP 78 [TCP Dup ACK 266#2] 22 → 52104 [ACK] Seq=35445 Ack=30057 Win=1452 Len=0 TSval=24044340 TSecr=1229816 SLE=32953 SRE=33125
  276 11.167987959 192.168.1.16 → 10.6.15.145  TCP 1514 [TCP Out-Of-Order] 52104 → 22 [ACK] Seq=31505 Ack=35445 Win=1444 Len=1448 TSval=1229816 TSecr=24044325
  277 11.168695977  10.6.15.145 → 192.168.1.16 TCP 78 22 → 52104 [ACK] Seq=35445 Ack=31505 Win=1451 Len=0 TSval=24044340 TSecr=1229816 SLE=32953 SRE=33125
  278 11.168719993 192.168.1.16 → 10.6.15.145  SSH 126 Client: Encrypted packet (len=60)
  279 11.170036303  10.6.15.145 → 192.168.1.16 TCP 66 22 → 52104 [ACK] Seq=35445 Ack=33125 Win=1451 Len=0 TSval=24044341 TSecr=1229816
  280 11.170048596  10.6.15.145 → 192.168.1.16 TCP 66 22 → 52104 [ACK] Seq=35445 Ack=33185 Win=1451 Len=0 TSval=24044341 TSecr=1229817
  281 11.913990035 192.168.1.16 → 10.6.15.145  SSH 590 Client: Encrypted packet (len=524)
  282 11.918720928  10.6.15.145 → 192.168.1.16 SSH 606 Server: Encrypted packet (len=540)
  283 11.918735237  10.6.15.145 → 192.168.1.16 SSH 414 Server: Encrypted packet (len=348)
  284 11.918771482 192.168.1.16 → 10.6.15.145  TCP 66 52104 → 22 [ACK] Seq=33709 Ack=36333 Win=1444 Len=0 TSval=1230004 TSecr=24044430
  285 11.918873706  10.6.15.145 → 192.168.1.16 SSH 918 Server: Encrypted packet (len=852)
  286 11.919087649  10.6.15.145 → 192.168.1.16 SSH 518 Server: Encrypted packet (len=452)
  287 11.919096410  10.6.15.145 → 192.168.1.16 TCP 66 22 → 52104 [ACK] Seq=37637 Ack=33709 Win=1452 Len=0 TSval=24044527 TSecr=1230003
  288 11.919123264 192.168.1.16 → 10.6.15.145  TCP 66 52104 → 22 [ACK] Seq=33709 Ack=37637 Win=1444 Len=0 TSval=1230004 TSecr=24044433
  289 11.920057514 192.168.1.16 → 10.6.15.145  SSH 206 Client: Encrypted packet (len=140)
  290 11.921141686  10.6.15.145 → 192.168.1.16 SSH 1014 Server: Encrypted packet (len=948)
  291 11.924743171 192.168.1.16 → 10.6.15.145  SSH 774 Client: Encrypted packet (len=708)
  292 11.926703510  10.6.15.145 → 192.168.1.16 TCP 66 22 → 52104 [ACK] Seq=38585 Ack=34557 Win=1452 Len=0 TSval=24044530 TSecr=1230005
  293 12.099523765 192.168.1.16 → 10.6.15.145  SSH 766 Client: Encrypted packet (len=700)
  294 12.134328572  10.6.15.145 → 192.168.1.16 SSH 302 Server: Encrypted packet (len=236)
  295 12.176014819 192.168.1.16 → 10.6.15.145  TCP 66 52104 → 22 [ACK] Seq=35257 Ack=38821 Win=1444 Len=0 TSval=1230069 TSecr=24044582
  296 13.725972652  10.6.15.145 → 192.168.1.16 SSH 422 Server: Encrypted packet (len=356)
  297 13.725992543 192.168.1.16 → 10.6.15.145  TCP 66 52104 → 22 [ACK] Seq=35257 Ack=39177 Win=1442 Len=0 TSval=1230456 TSecr=24044619
  298 13.726065698  10.6.15.145 → 192.168.1.16 SSH 710 Server: Encrypted packet (len=644)
  299 13.726068578 192.168.1.16 → 10.6.15.145  TCP 66 52104 → 22 [ACK] Seq=35257 Ack=39821 Win=1437 Len=0 TSval=1230456 TSecr=24044623
  300 13.726073872  10.6.15.145 → 192.168.1.16 SSH 102 Server: Encrypted packet (len=36)
  301 13.726076746 192.168.1.16 → 10.6.15.145  TCP 66 52104 → 22 [ACK] Seq=35257 Ack=39857 Win=1437 Len=0 TSval=1230456 TSecr=24044623
  302 13.726292254  10.6.15.145 → 192.168.1.16 SSH 350 Server: Encrypted packet (len=284)
  303 13.726299339 192.168.1.16 → 10.6.15.145  TCP 66 52104 → 22 [ACK] Seq=35257 Ack=40141 Win=1435 Len=0 TSval=1230456 TSecr=24044628
  304 13.726332990  10.6.15.145 → 192.168.1.16 SSH 350 Server: [TCP Spurious Retransmission] , Encrypted packet (len=284)
  305 13.726338110 192.168.1.16 → 10.6.15.145  TCP 78 [TCP Dup ACK 303#1] 52104 → 22 [ACK] Seq=35257 Ack=40141 Win=1435 Len=0 TSval=1230456 TSecr=24044746 SLE=39857 SRE=40141
  306 13.727568336 192.168.1.16 → 10.6.15.145  SSH 138 Client: Encrypted packet (len=72)
  307 13.729584626 192.168.1.16 → 10.6.15.145  SSH 774 Client: Encrypted packet (len=708)
  308 13.731286862  10.6.15.145 → 192.168.1.16 SSH 102 Server: Encrypted packet (len=36)
  309 13.772020868 192.168.1.16 → 10.6.15.145  TCP 66 52104 → 22 [ACK] Seq=36037 Ack=40177 Win=1444 Len=0 TSval=1230468 TSecr=24044980
  310 13.775810162  10.6.15.145 → 192.168.1.16 TCP 66 22 → 52104 [ACK] Seq=40177 Ack=36037 Win=1452 Len=0 TSval=24044991 TSecr=1230457
  311 14.718095286  10.6.15.145 → 192.168.1.16 SSH 710 Server: Encrypted packet (len=644)
  312 14.718121409 192.168.1.16 → 10.6.15.145  TCP 66 52104 → 22 [ACK] Seq=36037 Ack=40821 Win=1439 Len=0 TSval=1230704 TSecr=24045074
  313 14.718155158  10.6.15.145 → 192.168.1.16 SSH 102 Server: Encrypted packet (len=36)
  314 14.718161273 192.168.1.16 → 10.6.15.145  TCP 66 52104 → 22 [ACK] Seq=36037 Ack=40857 Win=1439 Len=0 TSval=1230704 TSecr=24045074
  315 14.719642001 192.168.1.16 → 10.6.15.145  SSH 138 Client: Encrypted packet (len=72)
  316 14.721273250  10.6.15.145 → 192.168.1.16 TCP 66 22 → 52104 [ACK] Seq=40857 Ack=36109 Win=1452 Len=0 TSval=24045228 TSecr=1230704
  317 14.721401721  10.6.15.145 → 192.168.1.16 SSH 102 Server: Encrypted packet (len=36)
  318 14.764054148 192.168.1.16 → 10.6.15.145  TCP 66 52104 → 22 [ACK] Seq=36109 Ack=40893 Win=1444 Len=0 TSval=1230716 TSecr=24045228
  319 16.702862017  10.6.15.145 → 192.168.1.16 SSH 102 Server: Encrypted packet (len=36)
  320 16.702887003 192.168.1.16 → 10.6.15.145  TCP 66 52104 → 22 [ACK] Seq=36109 Ack=40929 Win=1444 Len=0 TSval=1231200 TSecr=24045506
  321 20.702015774  10.22.18.77 → 224.0.0.252  LLMNR 64 Standard query 0x7f0d A wpad
  322 21.725863480  10.22.18.77 → 224.0.0.252  LLMNR 64 Standard query 0x7f0d A wpad
  323 27.097452033 192.168.1.16 → 10.6.15.145  SSH 102 Client: Encrypted packet (len=36)
  324 27.101072399 192.168.1.16 → 10.6.15.145  SSH 1266 Client: Encrypted packet (len=1200)
  325 27.104778587  10.6.15.145 → 192.168.1.16 TCP 66 22 → 52104 [ACK] Seq=40929 Ack=37345 Win=1452 Len=0 TSval=24048324 TSecr=1233799
  326 27.105144057  10.6.15.145 → 192.168.1.16 SSH 102 Server: Encrypted packet (len=36)
  327 27.105157128 192.168.1.16 → 10.6.15.145  TCP 66 52104 → 22 [ACK] Seq=37345 Ack=40965 Win=1444 Len=0 TSval=1233801 TSecr=24048324
  328 27.144617519  10.6.15.145 → 192.168.1.16 SSH 194 Server: Encrypted packet (len=128)
  329 27.144634692 192.168.1.16 → 10.6.15.145  TCP 66 52104 → 22 [ACK] Seq=37345 Ack=41093 Win=1443 Len=0 TSval=1233811 TSecr=24048333
  330 27.144655907  10.6.15.145 → 192.168.1.16 SSH 210 Server: Encrypted packet (len=144)
  331 27.144663294 192.168.1.16 → 10.6.15.145  TCP 66 52104 → 22 [ACK] Seq=37345 Ack=41237 Win=1442 Len=0 TSval=1233811 TSecr=24048333
  332 27.144925223 192.168.1.16 → 10.6.15.145  SSH 138 Client: Encrypted packet (len=72)
  333 27.149691671 192.168.1.16 → 192.168.1.1  DNS 81 Standard query 0x9eaa A update.googleapis.com
  334 27.156927456  192.168.1.1 → 192.168.1.16 DNS 97 Standard query response 0x9eaa A update.googleapis.com A 216.58.197.35
  335 27.157332468 192.168.1.16 → 216.58.197.35 TCP 74 49076 → 443 [SYN] Seq=0 Win=29200 Len=0 MSS=1460 SACK_PERM=1 TSval=1233814 TSecr=0 WS=128
  336 27.162390937 216.58.197.35 → 192.168.1.16 TCP 74 443 → 49076 [SYN, ACK] Seq=0 Ack=1 Win=42408 Len=0 MSS=1380 SACK_PERM=1 TSval=1371697368 TSecr=1233814 WS=256
  337 27.162424148 192.168.1.16 → 216.58.197.35 TCP 66 49076 → 443 [ACK] Seq=1 Ack=1 Win=29312 Len=0 TSval=1233815 TSecr=1371697368
  338 27.162565941 192.168.1.16 → 216.58.197.35 SSL 271 Client Hello
  339 27.167479388 216.58.197.35 → 192.168.1.16 TCP 66 443 → 49076 [ACK] Seq=1 Ack=206 Win=43520 Len=0 TSval=1371697374 TSecr=1233815
  340 27.170829199 216.58.197.35 → 192.168.1.16 TLSv1.2 1484 Server Hello
  341 27.170849605 192.168.1.16 → 216.58.197.35 TCP 66 49076 → 443 [ACK] Seq=206 Ack=1419 Win=32128 Len=0 TSval=1233817 TSecr=1371697377
  342 27.171005427 216.58.197.35 → 192.168.1.16 TCP 1484 [TCP segment of a reassembled PDU]
  343 27.171012064 192.168.1.16 → 216.58.197.35 TCP 66 49076 → 443 [ACK] Seq=206 Ack=2837 Win=34944 Len=0 TSval=1233817 TSecr=1371697377
  344 27.171468732 216.58.197.35 → 192.168.1.16 TLSv1.2 726 Certificate, Server Key Exchange, Server Hello Done
  345 27.171474829 192.168.1.16 → 216.58.197.35 TCP 66 49076 → 443 [ACK] Seq=206 Ack=3497 Win=37760 Len=0 TSval=1233817 TSecr=1371697377
  346 27.172232925 192.168.1.16 → 216.58.197.35 TLSv1.2 159 Client Key Exchange, Change Cipher Spec, Hello Request, Hello Request
  347 27.174260387 192.168.1.16 → 216.58.197.35 TLSv1.2 119 Application Data
  348 27.174388725 192.168.1.16 → 216.58.197.35 TLSv1.2 1434 Application Data, Application Data, Application Data
  349 27.174505009 192.168.1.16 → 216.58.197.35 TCP 1434 [TCP segment of a reassembled PDU]
  350 27.174963266 192.168.1.16 → 216.58.197.35 TLSv1.2 158 Application Data
  351 27.176193912 216.58.197.35 → 192.168.1.16 TLSv1.2 350 New Session Ticket, Change Cipher Spec, Hello Request, Hello Request
  352 27.176214932 216.58.197.35 → 192.168.1.16 TLSv1.2 135 Application Data
  353 27.176244379 192.168.1.16 → 216.58.197.35 TCP 66 49076 → 443 [ACK] Seq=3180 Ack=3850 Win=40576 Len=0 TSval=1233819 TSecr=1371697383
  354 27.176339510 192.168.1.16 → 216.58.197.35 TLSv1.2 104 Application Data
  355 27.177302577 216.58.197.35 → 192.168.1.16 TCP 66 443 → 49076 [ACK] Seq=3850 Ack=1720 Win=46336 Len=0 TSval=1371697385 TSecr=1233818
  356 27.177656129 216.58.197.35 → 192.168.1.16 TCP 66 443 → 49076 [ACK] Seq=3850 Ack=3180 Win=49152 Len=0 TSval=1371697386 TSecr=1233818
  357 27.177669600 216.58.197.35 → 192.168.1.16 TLSv1.2 104 Application Data
  358 27.185601371  10.6.15.145 → 192.168.1.16 TCP 66 22 → 52104 [ACK] Seq=41237 Ack=37417 Win=1452 Len=0 TSval=24048345 TSecr=1233811
  359 27.203717989  10.6.15.145 → 192.168.1.16 SSH 138 Server: Encrypted packet (len=72)
  360 27.203871010 192.168.1.16 → 10.6.15.145  SSH 102 Client: Encrypted packet (len=36)
  361 27.206362059  10.6.15.145 → 192.168.1.16 TCP 66 22 → 52104 [ACK] Seq=41309 Ack=37453 Win=1452 Len=0 TSval=24048349 TSecr=1233825
  362 27.218920233 216.58.197.35 → 192.168.1.16 TCP 66 443 → 49076 [ACK] Seq=3888 Ack=3218 Win=49152 Len=0 TSval=1371697387 TSecr=1233819
  363 27.220052302 192.168.1.16 → 216.58.197.35 TCP 66 49076 → 443 [ACK] Seq=3218 Ack=3888 Win=40576 Len=0 TSval=1233830 TSecr=1371697386
  364 27.307666516 192.168.1.16 → 224.0.0.252  LLMNR 64 Standard query 0x2ebb A wpad
  365 27.323932906  10.6.15.145 → 192.168.1.16 SSH 126 Server: Encrypted packet (len=60)
  366 27.323953669  10.6.15.145 → 192.168.1.16 SSH 138 Server: Encrypted packet (len=72)
  367 27.323958477  10.6.15.145 → 192.168.1.16 SSH 126 Server: Encrypted packet (len=60)
  368 27.323961948  10.6.15.145 → 192.168.1.16 SSH 138 Server: Encrypted packet (len=72)
  369 27.324042713 192.168.1.16 → 10.6.15.145  TCP 66 52104 → 22 [ACK] Seq=37453 Ack=41573 Win=1444 Len=0 TSval=1233856 TSecr=24048377
  370 27.324259087 192.168.1.16 → 10.6.15.145  SSH 138 Client: Encrypted packet (len=72)
  371 27.338497839  10.6.15.145 → 192.168.1.16 SSH 342 Server: Encrypted packet (len=276)
  372 27.338520240  10.6.15.145 → 192.168.1.16 TCP 66 22 → 52104 [ACK] Seq=41849 Ack=37525 Win=1452 Len=0 TSval=24048381 TSecr=1233856
  373 27.380010301 192.168.1.16 → 10.6.15.145  TCP 66 52104 → 22 [ACK] Seq=37525 Ack=41849 Win=1444 Len=0 TSval=1233870 TSecr=24048381
  374 27.384670993 216.58.197.35 → 192.168.1.16 TLSv1.2 104 [TCP Spurious Retransmission] , Application Data
  375 27.384690704 192.168.1.16 → 216.58.197.35 TCP 78 [TCP Dup ACK 363#1] 49076 → 443 [ACK] Seq=3218 Ack=3888 Win=40576 Len=0 TSval=1233871 TSecr=1371697592 SLE=3850 SRE=3888
  376 27.384704303 216.58.197.35 → 192.168.1.16 TLSv1.2 698 Application Data
  377 27.384718123 192.168.1.16 → 216.58.197.35 TCP 66 49076 → 443 [ACK] Seq=3218 Ack=4520 Win=43392 Len=0 TSval=1233871 TSecr=1371697592
  378 27.386337825 216.58.197.35 → 192.168.1.16 TLSv1.2 853 Application Data, Application Data
  379 27.386357488 192.168.1.16 → 216.58.197.35 TCP 66 49076 → 443 [ACK] Seq=3218 Ack=5307 Win=46336 Len=0 TSval=1233871 TSecr=1371697592
  380 27.386381060 216.58.197.35 → 192.168.1.16 TLSv1.2 112 Application Data
  381 27.386393591 192.168.1.16 → 216.58.197.35 TCP 66 49076 → 443 [ACK] Seq=3218 Ack=5353 Win=46336 Len=0 TSval=1233871 TSecr=1371697593
  382 27.386658396 192.168.1.16 → 216.58.197.35 TLSv1.2 112 Application Data
  383 27.389304649 216.58.197.35 → 192.168.1.16 TCP 66 443 → 49076 [ACK] Seq=5353 Ack=3264 Win=49152 Len=0 TSval=1371697597 TSecr=1233871
  384 27.468905765  10.6.15.145 → 192.168.1.16 SSH 174 Server: Encrypted packet (len=108)
  385 27.468932830 192.168.1.16 → 10.6.15.145  TCP 66 52104 → 22 [ACK] Seq=37525 Ack=41957 Win=1444 Len=0 TSval=1233892 TSecr=24048415
  386 27.468948074  10.6.15.145 → 192.168.1.16 SSH 138 Server: Encrypted packet (len=72)
  387 27.468954859 192.168.1.16 → 10.6.15.145  TCP 66 52104 → 22 [ACK] Seq=37525 Ack=42029 Win=1444 Len=0 TSval=1233892 TSecr=24048415
  388 27.469123283 192.168.1.16 → 10.6.15.145  SSH 102 Client: Encrypted packet (len=36)
  389 27.469666579  10.6.15.145 → 192.168.1.16 SSH 138 Server: Encrypted packet (len=72)
  390 27.469836480 192.168.1.16 → 10.6.15.145  SSH 102 Client: Encrypted packet (len=36)
  391 27.470613828  10.6.15.145 → 192.168.1.16 TCP 66 22 → 52104 [ACK] Seq=42101 Ack=37561 Win=1452 Len=0 TSval=24048416 TSecr=1233892
  392 27.470635041  10.6.15.145 → 192.168.1.16 SSH 138 Server: Encrypted packet (len=72)
  393 27.470808066 192.168.1.16 → 10.6.15.145  SSH 102 Client: Encrypted packet (len=36)
  394 27.472264246  10.6.15.145 → 192.168.1.16 TCP 66 22 → 52104 [ACK] Seq=42173 Ack=37633 Win=1452 Len=0 TSval=24048416 TSecr=1233892
  395 27.473317911  10.6.15.145 → 192.168.1.16 SSH 166 Server: Encrypted packet (len=100)
  396 27.473340857  10.6.15.145 → 192.168.1.16 SSH 138 Server: Encrypted packet (len=72)
  397 27.473392446 192.168.1.16 → 10.6.15.145  TCP 66 52104 → 22 [ACK] Seq=37633 Ack=42345 Win=1444 Len=0 TSval=1233893 TSecr=24048416
  398 27.473442140  10.6.15.145 → 192.168.1.16 SSH 138 Server: Encrypted packet (len=72)
  399 27.473529205 192.168.1.16 → 10.6.15.145  SSH 102 Client: Encrypted packet (len=36)
  400 27.473874288 192.168.1.16 → 10.6.15.145  SSH 102 Client: Encrypted packet (len=36)
  401 27.475259584  10.6.15.145 → 192.168.1.16 TCP 66 22 → 52104 [ACK] Seq=42417 Ack=37705 Win=1452 Len=0 TSval=24048417 TSecr=1233893
  402 27.477506428  10.6.15.145 → 192.168.1.16 SSH 138 Server: Encrypted packet (len=72)
  403 27.477668432 192.168.1.16 → 10.6.15.145  SSH 102 Client: Encrypted packet (len=36)
  404 27.491874545  10.6.15.145 → 192.168.1.16 SSH 138 Server: Encrypted packet (len=72)
  405 27.492066238 192.168.1.16 → 10.6.15.145  SSH 102 Client: Encrypted packet (len=36)
  406 27.529622145  10.6.15.145 → 192.168.1.16 TCP 66 22 → 52104 [ACK] Seq=42561 Ack=37777 Win=1452 Len=0 TSval=24048431 TSecr=1233898
  407 27.557698366 192.168.1.16 → 224.0.0.252  LLMNR 64 Standard query 0x2ebb A wpad
  408 27.807691405 192.168.1.16 → 224.0.0.252  LLMNR 64 Standard query 0x2ebb A wpad
  409 27.810309319  10.6.15.145 → 192.168.1.16 SSH 138 Server: Encrypted packet (len=72)
  410 27.810333139  10.6.15.145 → 192.168.1.16 SSH 138 Server: Encrypted packet (len=72)
  411 27.810386628 192.168.1.16 → 10.6.15.145  TCP 66 52104 → 22 [ACK] Seq=37777 Ack=42705 Win=1444 Len=0 TSval=1233977 TSecr=24048488
  412 27.810525087 192.168.1.16 → 10.6.15.145  SSH 138 Client: Encrypted packet (len=72)
  413 27.811936313  10.6.15.145 → 192.168.1.16 TCP 66 22 → 52104 [ACK] Seq=42705 Ack=37849 Win=1452 Len=0 TSval=24048501 TSecr=1233977
