    1 0.000000000 ZioncomE_53:dd:d4 → HonHaiPr_1f:71:b9 EAPOL 169 Key (Message 3 of 4)
    2 0.000142429 HonHaiPr_1f:71:b9 → ZioncomE_53:dd:d4 EAPOL 113 Key (Message 4 of 4)
    3 0.096976210 192.168.1.16 → 224.0.0.251  MDNS 82 Standard query 0x0000 PTR _googlecast._tcp.local, "QM" question
    4 0.097023387 fe80::60bd:1940:a0d8:49f9 → ff02::fb     MDNS 102 Standard query 0x0000 PTR _googlecast._tcp.local, "QM" question
    5 0.097107223 192.168.1.16 → 224.0.0.251  MDNS 82 Standard query 0x0000 PTR _googlecast._tcp.local, "QM" question
    6 0.097158973 fe80::60bd:1940:a0d8:49f9 → ff02::fb     MDNS 102 Standard query 0x0000 PTR _googlecast._tcp.local, "QM" question
    7 0.099300787 192.168.1.16 → 239.255.255.250 SSDP 213 M-SEARCH * HTTP/1.1 
    8 1.097452117 192.168.1.16 → 224.0.0.251  MDNS 82 Standard query 0x0000 PTR _googlecast._tcp.local, "QM" question
    9 1.098233814 fe80::60bd:1940:a0d8:49f9 → ff02::fb     MDNS 102 Standard query 0x0000 PTR _googlecast._tcp.local, "QM" question
   10 1.098239734 192.168.1.16 → 224.0.0.251  MDNS 82 Standard query 0x0000 PTR _googlecast._tcp.local, "QM" question
   11 1.098241479 fe80::60bd:1940:a0d8:49f9 → ff02::fb     MDNS 102 Standard query 0x0000 PTR _googlecast._tcp.local, "QM" question
   12 1.102028543 ZioncomE_53:dd:d4 → HonHaiPr_1f:71:b9 EAPOL 169 Key (Message 3 of 4)
   13 1.102135711 HonHaiPr_1f:71:b9 → ZioncomE_53:dd:d4 EAPOL 113 Key (Message 4 of 4)
   14 1.462990996 192.168.1.16 → 10.6.15.145  SSH 154 Client: Encrypted packet (len=88)
   15 4.915439847 ZioncomE_53:dd:d4 → HonHaiPr_1f:71:b9 EAPOL 135 Key (Message 1 of 4)
   16 4.915580301 HonHaiPr_1f:71:b9 → ZioncomE_53:dd:d4 EAPOL 135 Key (Message 2 of 4)
   17 4.920663576 ZioncomE_53:dd:d4 → HonHaiPr_1f:71:b9 EAPOL 169 Key (Message 3 of 4)
   18 4.920734515 HonHaiPr_1f:71:b9 → ZioncomE_53:dd:d4 EAPOL 113 Key (Message 4 of 4)
   19 4.930999249 fe80::60bd:1940:a0d8:49f9 → ff02::16     ICMPv6 90 Multicast Listener Report Message v2
   20 4.931024521 192.168.1.16 → 224.0.0.252  IGMPv2 46 Membership Report group 224.0.0.252
   21 5.005076227  10.6.15.145 → 192.168.1.16 SSH 126 Server: Encrypted packet (len=60)
   22 5.005103845 192.168.1.16 → 10.6.15.145  TCP 78 [TCP Dup ACK 14#1] 52104 → 22 [ACK] Seq=89 Ack=1 Win=1444 Len=0 TSval=1243701 TSecr=24054551 SLE=69 SRE=129
   23 5.055984017 fe80::60bd:1940:a0d8:49f9 → ff02::1:3    LLMNR 93 Standard query 0x1ade ANY theenterprise
   24 5.056030823 192.168.1.16 → 224.0.0.252  LLMNR 73 Standard query 0x2e62 ANY theenterprise
   25 5.112830258 192.168.1.16 → 224.0.0.251  MDNS 82 Standard query 0x0000 PTR _googlecast._tcp.local, "QM" question
   26 5.112865319 fe80::60bd:1940:a0d8:49f9 → ff02::fb     MDNS 102 Standard query 0x0000 PTR _googlecast._tcp.local, "QM" question
   27 5.112896187 192.168.1.16 → 224.0.0.251  MDNS 82 Standard query 0x0000 PTR _googlecast._tcp.local, "QM" question
   28 5.112906948 fe80::60bd:1940:a0d8:49f9 → ff02::fb     MDNS 102 Standard query 0x0000 PTR _googlecast._tcp.local, "QM" question
   29 5.160981199  10.6.15.145 → 192.168.1.16 TCP 134 [TCP Retransmission] 22 → 52104 [PSH, ACK] Seq=1 Ack=1 Win=1452 Len=68 TSval=24058264 TSecr=1240014
   30 5.161004477 192.168.1.16 → 10.6.15.145  TCP 66 52104 → 22 [ACK] Seq=89 Ack=129 Win=1443 Len=0 TSval=1243740 TSecr=24058264
   31 5.239025812 fe80::60bd:1940:a0d8:49f9 → ff02::16     ICMPv6 90 Multicast Listener Report Message v2
   32 5.362991313 fe80::60bd:1940:a0d8:49f9 → ff02::1:3    LLMNR 93 Standard query 0x1ade ANY theenterprise
   33 5.363000594 192.168.1.16 → 224.0.0.252  LLMNR 73 Standard query 0x2e62 ANY theenterprise
   34 5.606662201 fe80::60bd:1940:a0d8:49f9 → ff02::1:3    LLMNR 93 Standard query 0x1ade ANY theenterprise
   35 5.607440300 192.168.1.16 → 224.0.0.252  LLMNR 73 Standard query 0x2e62 ANY theenterprise
   36 6.113964905 192.168.1.16 → 224.0.0.251  MDNS 82 Standard query 0x0000 PTR _googlecast._tcp.local, "QM" question
   37 6.114755720 fe80::60bd:1940:a0d8:49f9 → ff02::fb     MDNS 102 Standard query 0x0000 PTR _googlecast._tcp.local, "QM" question
   38 6.114760675 192.168.1.16 → 224.0.0.251  MDNS 82 Standard query 0x0000 PTR _googlecast._tcp.local, "QM" question
   39 6.114762124 fe80::60bd:1940:a0d8:49f9 → ff02::fb     MDNS 102 Standard query 0x0000 PTR _googlecast._tcp.local, "QM" question
   40 6.422792589 192.168.1.16 → 239.255.255.250 SSDP 213 M-SEARCH * HTTP/1.1 
   41 7.422982861 192.168.1.16 → 239.255.255.250 SSDP 213 M-SEARCH * HTTP/1.1 
   42 8.374967057 192.168.1.16 → 224.0.0.252  IGMPv2 46 Membership Report group 224.0.0.252
   43 8.424100859 192.168.1.16 → 239.255.255.250 SSDP 213 M-SEARCH * HTTP/1.1 
   44 8.630978977 192.168.1.16 → 10.6.15.145  TCP 154 [TCP Retransmission] 52104 → 22 [PSH, ACK] Seq=1 Ack=129 Win=1444 Len=88 TSval=1244608 TSecr=24058264
   45 8.648245714  10.6.15.145 → 192.168.1.16 SSH 134 Server: [TCP Spurious Retransmission] , Encrypted packet (len=68)
   46 8.648264626 192.168.1.16 → 10.6.15.145  TCP 78 [TCP Dup ACK 30#1] 52104 → 22 [ACK] Seq=89 Ack=129 Win=1444 Len=0 TSval=1244612 TSecr=24058264 SLE=1 SRE=69
   47 8.692136085  10.6.15.145 → 192.168.1.16 TCP 66 22 → 52104 [ACK] Seq=129 Ack=89 Win=1452 Len=0 TSval=24059146 TSecr=1244608
   48 8.692157152 192.168.1.16 → 10.6.15.145  SSH 1514 Client: Encrypted packet (len=1448)
   49 8.692168662 192.168.1.16 → 10.6.15.145  SSH 1514 Client: Encrypted packet (len=1448)
   50 8.738963329 192.168.1.16 → 10.6.15.145  SSH 1514 Client: Encrypted packet (len=1448)
   51 8.963001527 192.168.1.16 → 10.6.15.145  TCP 1514 [TCP Retransmission] 52104 → 22 [ACK] Seq=89 Ack=129 Win=1444 Len=1448 TSval=1244691 TSecr=24059146
   52 9.228631639  10.6.15.145 → 192.168.1.16 SSH 110 Server: Encrypted packet (len=44)
   53 9.228653111 192.168.1.16 → 10.6.15.145  TCP 66 52104 → 22 [ACK] Seq=4433 Ack=173 Win=1444 Len=0 TSval=1244757 TSecr=24059221
   54 9.228663526  10.6.15.145 → 192.168.1.16 SSH 138 Server: Encrypted packet (len=72)
   55 9.228666942 192.168.1.16 → 10.6.15.145  TCP 66 52104 → 22 [ACK] Seq=4433 Ack=245 Win=1444 Len=0 TSval=1244757 TSecr=24059221
   56 9.423507427 192.168.1.16 → 224.0.0.251  MDNS 82 Standard query 0x0000 PTR _googlecast._tcp.local, "QM" question
   57 9.424279641 fe80::60bd:1940:a0d8:49f9 → ff02::fb     MDNS 102 Standard query 0x0000 PTR _googlecast._tcp.local, "QM" question
   58 9.424284965 192.168.1.16 → 224.0.0.251  MDNS 82 Standard query 0x0000 PTR _googlecast._tcp.local, "QM" question
   59 9.424286858 fe80::60bd:1940:a0d8:49f9 → ff02::fb     MDNS 102 Standard query 0x0000 PTR _googlecast._tcp.local, "QM" question
   60 9.424688712 192.168.1.16 → 239.255.255.250 SSDP 213 M-SEARCH * HTTP/1.1 
   61 9.431024729 192.168.1.16 → 10.6.15.145  TCP 1514 [TCP Retransmission] 52104 → 22 [ACK] Seq=89 Ack=245 Win=1444 Len=1448 TSval=1244808 TSecr=24059221
   62 9.438978350  10.6.15.145 → 192.168.1.16 TCP 66 22 → 52104 [ACK] Seq=245 Ack=1537 Win=1452 Len=0 TSval=24059333 TSecr=1244808
   63 9.439001511 192.168.1.16 → 10.6.15.145  SSH 1514 Client: Encrypted packet (len=1448)
   64 9.439014639 192.168.1.16 → 10.6.15.145  SSH 910 Client: Encrypted packet (len=844)
   65 9.552747152  10.6.15.145 → 192.168.1.16 TCP 78 [TCP Dup ACK 62#1] 22 → 52104 [ACK] Seq=245 Ack=1537 Win=1452 Len=0 TSval=24059361 TSecr=1244808 SLE=5881 SRE=6725
   66 9.552769952 192.168.1.16 → 10.6.15.145  TCP 1514 [TCP Retransmission] 52104 → 22 [ACK] Seq=1537 Ack=245 Win=1444 Len=1448 TSval=1244838 TSecr=24059361
   67 9.787013729 192.168.1.16 → 10.6.15.145  TCP 1514 [TCP Retransmission] 52104 → 22 [ACK] Seq=1537 Ack=245 Win=1444 Len=1448 TSval=1244897 TSecr=24059361
   68 10.263017904 192.168.1.16 → 10.6.15.145  TCP 1514 [TCP Retransmission] 52104 → 22 [ACK] Seq=1537 Ack=245 Win=1444 Len=1448 TSval=1245016 TSecr=24059361
   69 10.424369323 192.168.1.16 → 224.0.0.251  MDNS 82 Standard query 0x0000 PTR _googlecast._tcp.local, "QM" question
   70 10.425133699 fe80::60bd:1940:a0d8:49f9 → ff02::fb     MDNS 102 Standard query 0x0000 PTR _googlecast._tcp.local, "QM" question
   71 10.425139321 192.168.1.16 → 224.0.0.251  MDNS 82 Standard query 0x0000 PTR _googlecast._tcp.local, "QM" question
   72 10.425141076 fe80::60bd:1940:a0d8:49f9 → ff02::fb     MDNS 102 Standard query 0x0000 PTR _googlecast._tcp.local, "QM" question
   73 10.427011111  10.6.15.145 → 192.168.1.16 SSH 870 Server: Encrypted packet (len=792)
   74 10.427036658 192.168.1.16 → 10.6.15.145  TCP 66 52104 → 22 [ACK] Seq=6725 Ack=1037 Win=1438 Len=0 TSval=1245057 TSecr=24059577
   75 10.427047786  10.6.15.145 → 192.168.1.16 SSH 366 Server: Encrypted packet (len=288)
   76 10.427052131 192.168.1.16 → 10.6.15.145  TCP 66 52104 → 22 [ACK] Seq=6725 Ack=1325 Win=1436 Len=0 TSval=1245057 TSecr=24059577
   77 10.512772632  10.6.15.145 → 192.168.1.16 SSH 150 Server: Encrypted packet (len=72)
   78 10.512801000 192.168.1.16 → 10.6.15.145  TCP 66 52104 → 22 [ACK] Seq=6725 Ack=1397 Win=1436 Len=0 TSval=1245078 TSecr=24059586
   79 10.512815894  10.6.15.145 → 192.168.1.16 SSH 114 Server: Encrypted packet (len=36)
   80 10.512821327 192.168.1.16 → 10.6.15.145  TCP 66 52104 → 22 [ACK] Seq=6725 Ack=1433 Win=1436 Len=0 TSval=1245078 TSecr=24059588
   81 10.934995657 192.168.1.16 → 216.58.197.35 TCP 66 49076 → 443 [ACK] Seq=1 Ack=1 Win=362 Len=0 TSval=1245184 TSecr=1371697597
   82 11.052600407 216.58.197.35 → 192.168.1.16 TCP 66 [TCP ACKed unseen segment] 443 → 49076 [ACK] Seq=1 Ack=2 Win=192 Len=0 TSval=1371742962 TSecr=1233871
   83 11.222989960 192.168.1.16 → 10.6.15.145  TCP 1514 [TCP Retransmission] 52104 → 22 [ACK] Seq=1537 Ack=1433 Win=1444 Len=1448 TSval=1245256 TSecr=24059588
   84 11.228573345  10.6.15.145 → 192.168.1.16 SSH 498 Server: Encrypted packet (len=420)
   85 11.228600254 192.168.1.16 → 10.6.15.145  SSH 1514 Client: Encrypted packet (len=1448)
   86 11.228616108 192.168.1.16 → 10.6.15.145  SSH 782 Client: Encrypted packet (len=716)
   87 11.228632295 192.168.1.16 → 10.6.15.145  TCP 66 52104 → 22 [ACK] Seq=8889 Ack=1853 Win=1441 Len=0 TSval=1245257 TSecr=24059781
   88 11.231297504  10.6.15.145 → 192.168.1.16 TCP 78 [TCP Window Update] 22 → 52104 [ACK] Seq=1853 Ack=2985 Win=1447 Len=0 TSval=24059781 TSecr=1245256 SLE=5881 SRE=8173
   89 11.231315081 192.168.1.16 → 10.6.15.145  TCP 1514 [TCP Out-Of-Order] 52104 → 22 [ACK] Seq=2985 Ack=1853 Win=1444 Len=1448 TSval=1245258 TSecr=24059781
   90 11.231335032  10.6.15.145 → 192.168.1.16 SSH 114 Server: Encrypted packet (len=36)
   91 11.231468236  10.6.15.145 → 192.168.1.16 TCP 78 [TCP Dup ACK 84#1] 22 → 52104 [ACK] Seq=1889 Ack=2985 Win=1447 Len=0 TSval=24059781 TSecr=1245256 SLE=5881 SRE=8889
   92 11.231476250 192.168.1.16 → 10.6.15.145  TCP 1514 [TCP Out-Of-Order] 52104 → 22 [ACK] Seq=4433 Ack=1889 Win=1444 Len=1448 TSval=1245258 TSecr=24059781
   93 11.234593612  10.6.15.145 → 192.168.1.16 TCP 78 22 → 52104 [ACK] Seq=1889 Ack=4433 Win=1436 Len=0 TSval=24059782 TSecr=1245258 SLE=5881 SRE=8889
   94 11.234613925 192.168.1.16 → 10.6.15.145  SSH 1514 Client: Encrypted packet (len=1448)
   95 11.235926106  10.6.15.145 → 192.168.1.16 TCP 66 22 → 52104 [ACK] Seq=1889 Ack=8889 Win=1431 Len=0 TSval=24059782 TSecr=1245258
   96 11.235937789 192.168.1.16 → 10.6.15.145  SSH 298 Client: Encrypted packet (len=232)
   97 11.237135206  10.6.15.145 → 192.168.1.16 TCP 66 22 → 52104 [ACK] Seq=1889 Ack=10337 Win=1423 Len=0 TSval=24059783 TSecr=1245258
   98 11.237270805  10.6.15.145 → 192.168.1.16 TCP 66 22 → 52104 [ACK] Seq=1889 Ack=10569 Win=1422 Len=0 TSval=24059783 TSecr=1245259
   99 11.275279701  10.6.15.145 → 192.168.1.16 SSH 138 Server: Encrypted packet (len=72)
  100 11.275715945 192.168.1.16 → 10.6.15.145  SSH 166 Client: Encrypted packet (len=100)
  101 11.277735985  10.6.15.145 → 192.168.1.16 SSH 698 Server: Encrypted packet (len=632)
  102 11.277747910  10.6.15.145 → 192.168.1.16 SSH 318 Server: Encrypted packet (len=252)
  103 11.277784238 192.168.1.16 → 10.6.15.145  TCP 66 52104 → 22 [ACK] Seq=10669 Ack=2845 Win=1444 Len=0 TSval=1245269 TSecr=24059793
  104 11.278151029 192.168.1.16 → 10.6.15.145  SSH 174 Client: Encrypted packet (len=108)
  105 11.278615091 192.168.1.16 → 10.6.15.145  SSH 158 Client: Encrypted packet (len=92)
  106 11.280126812  10.6.15.145 → 192.168.1.16 TCP 66 22 → 52104 [ACK] Seq=2845 Ack=10869 Win=1452 Len=0 TSval=24059794 TSecr=1245269
  107 11.280146930 192.168.1.16 → 10.6.15.145  SSH 458 Client: Encrypted packet (len=392)
  108 11.280167526  10.6.15.145 → 192.168.1.16 SSH 150 Server: Encrypted packet (len=84)
  109 11.280320949  10.6.15.145 → 192.168.1.16 SSH 166 Server: Encrypted packet (len=100)
  110 11.280356542 192.168.1.16 → 10.6.15.145  TCP 66 52104 → 22 [ACK] Seq=11261 Ack=3029 Win=1444 Len=0 TSval=1245270 TSecr=24059794
  111 11.280472805  10.6.15.145 → 192.168.1.16 SSH 138 Server: Encrypted packet (len=72)
  112 11.280858524 192.168.1.16 → 10.6.15.145  SSH 154 Client: Encrypted packet (len=88)
  113 11.282207508  10.6.15.145 → 192.168.1.16 TCP 66 22 → 52104 [ACK] Seq=3101 Ack=11349 Win=1452 Len=0 TSval=24059794 TSecr=1245270
  114 11.283960564  10.6.15.145 → 192.168.1.16 SSH 1514 Server: Encrypted packet (len=1448)
  115 11.283993800  10.6.15.145 → 192.168.1.16 SSH 566 Server: Encrypted packet (len=500)
  116 11.284017772 192.168.1.16 → 10.6.15.145  TCP 66 52104 → 22 [ACK] Seq=11349 Ack=5049 Win=1444 Len=0 TSval=1245271 TSecr=24059794
  117 11.284169174  10.6.15.145 → 192.168.1.16 SSH 230 Server: Encrypted packet (len=164)
  118 11.284199866  10.6.15.145 → 192.168.1.16 SSH 214 Server: Encrypted packet (len=148)
  119 11.284239157 192.168.1.16 → 10.6.15.145  TCP 66 52104 → 22 [ACK] Seq=11349 Ack=5361 Win=1444 Len=0 TSval=1245271 TSecr=24059794
  120 11.285782835 192.168.1.16 → 10.6.15.145  SSH 350 Client: Encrypted packet (len=284)
  121 11.286286698  10.6.15.145 → 192.168.1.16 SSH 110 Server: Encrypted packet (len=44)
  122 11.286812693 192.168.1.16 → 10.6.15.145  SSH 102 Client: Encrypted packet (len=36)
  123 11.287281382 192.168.1.16 → 10.6.15.145  SSH 302 Client: Encrypted packet (len=236)
  124 11.287940328 192.168.1.16 → 10.6.15.145  SSH 142 Client: Encrypted packet (len=76)
  125 11.288565921  10.6.15.145 → 192.168.1.16 TCP 66 22 → 52104 [ACK] Seq=5405 Ack=11669 Win=1452 Len=0 TSval=24059796 TSecr=1245271
  126 11.288929503 192.168.1.16 → 10.6.15.145  SSH 454 Client: Encrypted packet (len=388)
  127 11.289385504 192.168.1.16 → 10.6.15.145  SSH 1026 Client: Encrypted packet (len=960)
  128 11.290291838  10.6.15.145 → 192.168.1.16 TCP 66 22 → 52104 [ACK] Seq=5405 Ack=11981 Win=1452 Len=0 TSval=24059796 TSecr=1245272
  129 11.290303206 192.168.1.16 → 10.6.15.145  SSH 1514 Client: Encrypted packet (len=1448)
  130 11.290309740 192.168.1.16 → 10.6.15.145  SSH 150 Client: Encrypted packet (len=84)
  131 11.290394978  10.6.15.145 → 192.168.1.16 SSH 486 Server: Encrypted packet (len=420)
  132 11.290401408  10.6.15.145 → 192.168.1.16 SSH 138 Server: Encrypted packet (len=72)
  133 11.290430998 192.168.1.16 → 10.6.15.145  TCP 66 52104 → 22 [ACK] Seq=14861 Ack=5897 Win=1444 Len=0 TSval=1245272 TSecr=24059796
  134 11.293730138  10.6.15.145 → 192.168.1.16 SSH 158 Server: Encrypted packet (len=92)
  135 11.293744881 192.168.1.16 → 10.6.15.145  SSH 102 Client: Encrypted packet (len=36)
  136 11.293758343  10.6.15.145 → 192.168.1.16 SSH 158 Server: Encrypted packet (len=92)
  137 11.293762570  10.6.15.145 → 192.168.1.16 TCP 66 22 → 52104 [ACK] Seq=6081 Ack=14861 Win=1452 Len=0 TSval=24059797 TSecr=1245272
  138 11.293767747  10.6.15.145 → 192.168.1.16 SSH 126 Server: Encrypted packet (len=60)
  139 11.293778987  10.6.15.145 → 192.168.1.16 SSH 102 Server: Encrypted packet (len=36)
  140 11.293806122 192.168.1.16 → 10.6.15.145  TCP 66 52104 → 22 [ACK] Seq=14897 Ack=6177 Win=1444 Len=0 TSval=1245273 TSecr=24059796
  141 11.294272490 192.168.1.16 → 10.6.15.145  SSH 286 Client: Encrypted packet (len=220)
  142 11.295550574  10.6.15.145 → 192.168.1.16 SSH 346 Server: Encrypted packet (len=280)
  143 11.295967037 192.168.1.16 → 10.6.15.145  SSH 302 Client: Encrypted packet (len=236)
  144 11.297031730 192.168.1.16 → 10.6.15.145  SSH 294 Client: Encrypted packet (len=228)
  145 11.297681842  10.6.15.145 → 192.168.1.16 TCP 66 22 → 52104 [ACK] Seq=6457 Ack=15353 Win=1452 Len=0 TSval=24059798 TSecr=1245273
  146 11.297702614 192.168.1.16 → 10.6.15.145  SSH 102 Client: Encrypted packet (len=36)
  147 11.298042483 192.168.1.16 → 10.6.15.145  SSH 294 Client: Encrypted packet (len=228)
  148 11.298765666 192.168.1.16 → 10.6.15.145  SSH 918 Client: Encrypted packet (len=852)
  149 11.299660460  10.6.15.145 → 192.168.1.16 SSH 166 Server: Encrypted packet (len=100)
  150 11.300186019  10.6.15.145 → 192.168.1.16 TCP 66 22 → 52104 [ACK] Seq=6557 Ack=15845 Win=1452 Len=0 TSval=24059798 TSecr=1245274
  151 11.300339285  10.6.15.145 → 192.168.1.16 SSH 202 Server: Encrypted packet (len=136)
  152 11.300357262 192.168.1.16 → 10.6.15.145  TCP 66 52104 → 22 [ACK] Seq=16697 Ack=6693 Win=1444 Len=0 TSval=1245275 TSecr=24059798
  153 11.300522016 192.168.1.16 → 10.6.15.145  SSH 126 Client: Encrypted packet (len=60)
  154 11.300906174 192.168.1.16 → 10.6.15.145  SSH 406 Client: Encrypted packet (len=340)
  155 11.302032663  10.6.15.145 → 192.168.1.16 TCP 66 22 → 52104 [ACK] Seq=6693 Ack=16757 Win=1452 Len=0 TSval=24059799 TSecr=1245274
  156 11.302039599  10.6.15.145 → 192.168.1.16 SSH 230 Server: Encrypted packet (len=164)
  157 11.302173910 192.168.1.16 → 10.6.15.145  SSH 102 Client: Encrypted packet (len=36)
  158 11.302237886  10.6.15.145 → 192.168.1.16 SSH 138 Server: Encrypted packet (len=72)
  159 11.302596035 192.168.1.16 → 10.6.15.145  SSH 102 Client: Encrypted packet (len=36)
  160 11.302725272  10.6.15.145 → 192.168.1.16 SSH 162 Server: Encrypted packet (len=96)
  161 11.303109923 192.168.1.16 → 10.6.15.145  SSH 446 Client: Encrypted packet (len=380)
  162 11.304269912  10.6.15.145 → 192.168.1.16 TCP 66 22 → 52104 [ACK] Seq=7025 Ack=17169 Win=1452 Len=0 TSval=24059800 TSecr=1245275
  163 11.307598386  10.6.15.145 → 192.168.1.16 SSH 510 Server: Encrypted packet (len=444)
  164 11.307621249  10.6.15.145 → 192.168.1.16 SSH 166 Server: Encrypted packet (len=100)
  165 11.307626458  10.6.15.145 → 192.168.1.16 SSH 206 Server: Encrypted packet (len=140)
  166 11.307679675 192.168.1.16 → 10.6.15.145  TCP 66 52104 → 22 [ACK] Seq=17549 Ack=7709 Win=1444 Len=0 TSval=1245277 TSecr=24059800
  167 11.308968395 192.168.1.16 → 10.6.15.145  SSH 302 Client: Encrypted packet (len=236)
  168 11.309847799 192.168.1.16 → 10.6.15.145  SSH 134 Client: Encrypted packet (len=68)
  169 11.310081648  10.6.15.145 → 192.168.1.16 SSH 138 Server: Encrypted packet (len=72)
  170 11.310102300  10.6.15.145 → 192.168.1.16 SSH 138 Server: Encrypted packet (len=72)
  171 11.310113660 192.168.1.16 → 10.6.15.145  TCP 66 52104 → 22 [ACK] Seq=17853 Ack=7853 Win=1444 Len=0 TSval=1245277 TSecr=24059800
  172 11.310573417 192.168.1.16 → 10.6.15.145  SSH 102 Client: Encrypted packet (len=36)
  173 11.310997569  10.6.15.145 → 192.168.1.16 SSH 222 Server: Encrypted packet (len=156)
  174 11.311809235 192.168.1.16 → 10.6.15.145  SSH 302 Client: Encrypted packet (len=236)
  175 11.311928725  10.6.15.145 → 192.168.1.16 TCP 66 22 → 52104 [ACK] Seq=8009 Ack=17889 Win=1452 Len=0 TSval=24059801 TSecr=1245277
  176 11.312848626 192.168.1.16 → 10.6.15.145  SSH 230 Client: Encrypted packet (len=164)
  177 11.313178259 192.168.1.16 → 10.6.15.145  SSH 390 Client: Encrypted packet (len=324)
  178 11.313297424  10.6.15.145 → 192.168.1.16 SSH 230 Server: Encrypted packet (len=164)
  179 11.313319597  10.6.15.145 → 192.168.1.16 SSH 182 Server: Encrypted packet (len=116)
  180 11.313385493 192.168.1.16 → 10.6.15.145  TCP 66 52104 → 22 [ACK] Seq=18613 Ack=8289 Win=1444 Len=0 TSval=1245278 TSecr=24059802
  181 11.313394159 192.168.1.16 → 10.6.15.145  SSH 1514 Client: Encrypted packet (len=1448)
  182 11.314992478  10.6.15.145 → 192.168.1.16 TCP 66 22 → 52104 [ACK] Seq=8289 Ack=18289 Win=1452 Len=0 TSval=24059802 TSecr=1245278
  183 11.315006933 192.168.1.16 → 10.6.15.145  SSH 382 Client: Encrypted packet (len=316)
  184 11.315017734  10.6.15.145 → 192.168.1.16 SSH 182 Server: Encrypted packet (len=116)
  185 11.315545324 192.168.1.16 → 10.6.15.145  SSH 134 Client: Encrypted packet (len=68)
  186 11.315970753  10.6.15.145 → 192.168.1.16 SSH 158 Server: Encrypted packet (len=92)
  187 11.316134662 192.168.1.16 → 10.6.15.145  SSH 126 Client: Encrypted packet (len=60)
  188 11.316568056  10.6.15.145 → 192.168.1.16 SSH 126 Server: Encrypted packet (len=60)
  189 11.316703467  10.6.15.145 → 192.168.1.16 TCP 66 22 → 52104 [ACK] Seq=8557 Ack=20445 Win=1452 Len=0 TSval=24059803 TSecr=1245279
  190 11.319452399  10.6.15.145 → 192.168.1.16 SSH 346 Server: Encrypted packet (len=280)
  191 11.319498462 192.168.1.16 → 10.6.15.145  TCP 66 52104 → 22 [ACK] Seq=20505 Ack=8837 Win=1444 Len=0 TSval=1245280 TSecr=24059803
  192 11.319666424 192.168.1.16 → 10.6.15.145  SSH 134 Client: Encrypted packet (len=68)
  193 11.319989854 192.168.1.16 → 10.6.15.145  SSH 134 Client: Encrypted packet (len=68)
  194 11.321458782  10.6.15.145 → 192.168.1.16 TCP 66 22 → 52104 [ACK] Seq=8837 Ack=20641 Win=1452 Len=0 TSval=24059804 TSecr=1245280
  195 11.323873344  10.6.15.145 → 192.168.1.16 SSH 126 Server: Encrypted packet (len=60)
  196 11.324010356  10.6.15.145 → 192.168.1.16 SSH 138 Server: Encrypted packet (len=72)
  197 11.324043765 192.168.1.16 → 10.6.15.145  TCP 66 52104 → 22 [ACK] Seq=20641 Ack=8969 Win=1444 Len=0 TSval=1245281 TSecr=24059804
  198 11.324161422 192.168.1.16 → 10.6.15.145  SSH 102 Client: Encrypted packet (len=36)
  199 11.328784674  10.6.15.145 → 192.168.1.16 SSH 230 Server: Encrypted packet (len=164)
  200 11.328889293  10.6.15.145 → 192.168.1.16 SSH 126 Server: Encrypted packet (len=60)
  201 11.328905331 192.168.1.16 → 10.6.15.145  TCP 66 52104 → 22 [ACK] Seq=20677 Ack=9193 Win=1444 Len=0 TSval=1245282 TSecr=24059806
  202 11.329031154 192.168.1.16 → 10.6.15.145  SSH 134 Client: Encrypted packet (len=68)
  203 11.330419097 192.168.1.16 → 10.6.15.145  SSH 230 Client: Encrypted packet (len=164)
  204 11.330667189 192.168.1.16 → 10.6.15.145  SSH 566 Client: Encrypted packet (len=500)
  205 11.331989482  10.6.15.145 → 192.168.1.16 TCP 66 22 → 52104 [ACK] Seq=9193 Ack=20909 Win=1452 Len=0 TSval=24059806 TSecr=1245282
  206 11.338896601  10.6.15.145 → 192.168.1.16 SSH 1022 Server: Encrypted packet (len=956)
  207 11.338911331  10.6.15.145 → 192.168.1.16 SSH 142 Server: Encrypted packet (len=76)
  208 11.338941218 192.168.1.16 → 10.6.15.145  TCP 66 52104 → 22 [ACK] Seq=21409 Ack=10225 Win=1444 Len=0 TSval=1245284 TSecr=24059808
  209 11.339522099 192.168.1.16 → 10.6.15.145  SSH 134 Client: Encrypted packet (len=68)
  210 11.345113219 192.168.1.16 → 10.6.15.145  SSH 110 Client: Encrypted packet (len=44)
  211 11.346463780  10.6.15.145 → 192.168.1.16 TCP 66 22 → 52104 [ACK] Seq=10225 Ack=21521 Win=1452 Len=0 TSval=24059810 TSecr=1245285
  212 11.349516047  10.6.15.145 → 192.168.1.16 SSH 342 Server: Encrypted packet (len=276)
  213 11.349535785  10.6.15.145 → 192.168.1.16 SSH 166 Server: Encrypted packet (len=100)
  214 11.349581258 192.168.1.16 → 10.6.15.145  TCP 66 52104 → 22 [ACK] Seq=21521 Ack=10601 Win=1444 Len=0 TSval=1245287 TSecr=24059811
  215 11.349704097  10.6.15.145 → 192.168.1.16 SSH 138 Server: Encrypted packet (len=72)
  216 11.349851685 192.168.1.16 → 10.6.15.145  SSH 102 Client: Encrypted packet (len=36)
  217 11.350986002  10.6.15.145 → 192.168.1.16 SSH 126 Server: Encrypted packet (len=60)
  218 11.352865268  10.6.15.145 → 192.168.1.16 SSH 1134 Server: Encrypted packet (len=1068)
  219 11.352905895 192.168.1.16 → 10.6.15.145  TCP 66 52104 → 22 [ACK] Seq=21557 Ack=11801 Win=1444 Len=0 TSval=1245288 TSecr=24059811
  220 11.353210464  10.6.15.145 → 192.168.1.16 SSH 1514 Server: Encrypted packet (len=1448)
  221 11.353465419  10.6.15.145 → 192.168.1.16 SSH 1030 Server: Encrypted packet (len=964)
  222 11.353482340 192.168.1.16 → 10.6.15.145  TCP 66 52104 → 22 [ACK] Seq=21557 Ack=14213 Win=1444 Len=0 TSval=1245288 TSecr=24059812
  223 11.354500153 192.168.1.16 → 10.6.15.145  SSH 214 Client: Encrypted packet (len=148)
  224 11.354731897 192.168.1.16 → 10.6.15.145  SSH 222 Client: Encrypted packet (len=156)
  225 11.355411008 192.168.1.16 → 10.6.15.145  SSH 350 Client: Encrypted packet (len=284)
  226 11.355538191  10.6.15.145 → 192.168.1.16 SSH 214 Server: Encrypted packet (len=148)
  227 11.355906987 192.168.1.16 → 10.6.15.145  SSH 134 Client: Encrypted packet (len=68)
  228 11.356605821  10.6.15.145 → 192.168.1.16 TCP 66 22 → 52104 [ACK] Seq=14361 Ack=21861 Win=1452 Len=0 TSval=24059813 TSecr=1245288
  229 11.357376126  10.6.15.145 → 192.168.1.16 SSH 182 Server: Encrypted packet (len=116)
  230 11.357502252  10.6.15.145 → 192.168.1.16 SSH 134 Server: Encrypted packet (len=68)
  231 11.357521445 192.168.1.16 → 10.6.15.145  TCP 66 52104 → 22 [ACK] Seq=22213 Ack=14545 Win=1444 Len=0 TSval=1245289 TSecr=24059813
  232 11.357562042 192.168.1.16 → 10.6.15.145  SSH 134 Client: Encrypted packet (len=68)
  233 11.358119245  10.6.15.145 → 192.168.1.16 SSH 134 Server: Encrypted packet (len=68)
  234 11.358143729  10.6.15.145 → 192.168.1.16 SSH 326 Server: Encrypted packet (len=260)
  235 11.358152547 192.168.1.16 → 10.6.15.145  TCP 66 52104 → 22 [ACK] Seq=22281 Ack=14873 Win=1444 Len=0 TSval=1245289 TSecr=24059813
  236 11.365780156  10.6.15.145 → 192.168.1.16 SSH 582 Server: Encrypted packet (len=516)
  237 11.365803927  10.6.15.145 → 192.168.1.16 SSH 134 Server: Encrypted packet (len=68)
  238 11.365859683 192.168.1.16 → 10.6.15.145  TCP 66 52104 → 22 [ACK] Seq=22281 Ack=15457 Win=1444 Len=0 TSval=1245291 TSecr=24059815
  239 11.366418080 192.168.1.16 → 10.6.15.145  SSH 134 Client: Encrypted packet (len=68)
  240 11.377722047  10.6.15.145 → 192.168.1.16 SSH 222 Server: Encrypted packet (len=156)
  241 11.382259411  10.6.15.145 → 192.168.1.16 SSH 230 Server: Encrypted packet (len=164)
  242 11.382310999 192.168.1.16 → 10.6.15.145  TCP 66 52104 → 22 [ACK] Seq=22349 Ack=15777 Win=1444 Len=0 TSval=1245295 TSecr=24059818
  243 11.390358042  10.6.15.145 → 192.168.1.16 SSH 422 Server: Encrypted packet (len=356)
  244 11.390375741  10.6.15.145 → 192.168.1.16 SSH 134 Server: Encrypted packet (len=68)
  245 11.390424136 192.168.1.16 → 10.6.15.145  TCP 66 52104 → 22 [ACK] Seq=22349 Ack=16201 Win=1444 Len=0 TSval=1245297 TSecr=24059821
  246 11.390699265 192.168.1.16 → 10.6.15.145  SSH 126 Client: Encrypted packet (len=60)
  247 11.391487556  10.6.15.145 → 192.168.1.16 SSH 358 Server: Encrypted packet (len=292)
  248 11.391896508 192.168.1.16 → 10.6.15.145  SSH 134 Client: Encrypted packet (len=68)
  249 11.395831790  10.6.15.145 → 192.168.1.16 TCP 66 22 → 52104 [ACK] Seq=16493 Ack=22477 Win=1452 Len=0 TSval=24059822 TSecr=1245297
  250 11.405241037 192.168.1.16 → 10.6.15.145  SSH 102 Client: Encrypted packet (len=36)
  251 11.405699735 192.168.1.16 → 10.6.15.145  SSH 110 Client: Encrypted packet (len=44)
  252 11.407074499  10.6.15.145 → 192.168.1.16 TCP 66 22 → 52104 [ACK] Seq=16493 Ack=22557 Win=1452 Len=0 TSval=24059825 TSecr=1245301
  253 11.442645380  10.6.15.145 → 192.168.1.16 SSH 194 Server: Encrypted packet (len=128)
  254 11.442669314  10.6.15.145 → 192.168.1.16 SSH 210 Server: Encrypted packet (len=144)
  255 11.442734170 192.168.1.16 → 10.6.15.145  TCP 66 52104 → 22 [ACK] Seq=22557 Ack=16765 Win=1444 Len=0 TSval=1245310 TSecr=24059834
  256 11.443149743 192.168.1.16 → 10.6.15.145  SSH 138 Client: Encrypted packet (len=72)
  257 11.447540268  10.6.15.145 → 192.168.1.16 SSH 134 Server: Encrypted packet (len=68)
  258 11.447554084  10.6.15.145 → 192.168.1.16 SSH 138 Server: Encrypted packet (len=72)
  259 11.447598160 192.168.1.16 → 10.6.15.145  TCP 66 52104 → 22 [ACK] Seq=22629 Ack=16905 Win=1444 Len=0 TSval=1245312 TSecr=24059835
  260 11.447752257 192.168.1.16 → 10.6.15.145  SSH 102 Client: Encrypted packet (len=36)
  261 11.471357762  10.6.15.145 → 192.168.1.16 SSH 454 Server: Encrypted packet (len=388)
  262 11.471972970  10.6.15.145 → 192.168.1.16 SSH 1514 Server: Encrypted packet (len=1448)
  263 11.471992251  10.6.15.145 → 192.168.1.16 SSH 78 Server: Encrypted packet (len=12)
  264 11.472103580 192.168.1.16 → 10.6.15.145  TCP 66 52104 → 22 [ACK] Seq=22665 Ack=18753 Win=1444 Len=0 TSval=1245318 TSecr=24059841
  265 11.472344380  10.6.15.145 → 192.168.1.16 SSH 1514 Server: Encrypted packet (len=1448)
  266 11.474314378  10.6.15.145 → 192.168.1.16 SSH 1514 Server: Encrypted packet (len=1448)
  267 11.474383320 192.168.1.16 → 10.6.15.145  TCP 66 52104 → 22 [ACK] Seq=22665 Ack=21649 Win=1444 Len=0 TSval=1245318 TSecr=24059841
  268 11.474519686  10.6.15.145 → 192.168.1.16 SSH 1514 Server: Encrypted packet (len=1448)
  269 11.474668339  10.6.15.145 → 192.168.1.16 SSH 198 Server: Encrypted packet (len=132)
  270 11.474697952 192.168.1.16 → 10.6.15.145  TCP 66 52104 → 22 [ACK] Seq=22665 Ack=23229 Win=1444 Len=0 TSval=1245318 TSecr=24059842
  271 11.478781042 192.168.1.16 → 10.6.15.145  SSH 134 Client: Encrypted packet (len=68)
  272 11.480151031 192.168.1.16 → 10.6.15.145  SSH 398 Client: Encrypted packet (len=332)
  273 11.481080174 192.168.1.16 → 10.6.15.145  SSH 222 Client: Encrypted packet (len=156)
  274 11.481164001 192.168.1.16 → 10.6.15.145  SSH 1514 Client: Encrypted packet (len=1448)
  275 11.481306685 192.168.1.16 → 10.6.15.145  SSH 694 Client: Encrypted packet (len=628)
  276 11.482253636  10.6.15.145 → 192.168.1.16 TCP 66 22 → 52104 [ACK] Seq=23229 Ack=23065 Win=1452 Len=0 TSval=24059844 TSecr=1245319
  277 11.483933345  10.6.15.145 → 192.168.1.16 TCP 66 22 → 52104 [ACK] Seq=23229 Ack=25297 Win=1452 Len=0 TSval=24059844 TSecr=1245320
  278 11.487713367  10.6.15.145 → 192.168.1.16 SSH 670 Server: Encrypted packet (len=604)
  279 11.489060756  10.6.15.145 → 192.168.1.16 SSH 138 Server: Encrypted packet (len=72)
  280 11.489124547 192.168.1.16 → 10.6.15.145  TCP 66 52104 → 22 [ACK] Seq=25297 Ack=23905 Win=1444 Len=0 TSval=1245322 TSecr=24059845
  281 11.489192931  10.6.15.145 → 192.168.1.16 SSH 102 Server: Encrypted packet (len=36)
  282 11.489348554  10.6.15.145 → 192.168.1.16 SSH 174 Server: Encrypted packet (len=108)
  283 11.489379644 192.168.1.16 → 10.6.15.145  TCP 66 52104 → 22 [ACK] Seq=25297 Ack=24049 Win=1444 Len=0 TSval=1245322 TSecr=24059846
  284 11.489562783 192.168.1.16 → 10.6.15.145  SSH 102 Client: Encrypted packet (len=36)
  285 11.490682348 192.168.1.16 → 10.6.15.145  SSH 206 Client: Encrypted packet (len=140)
  286 11.490910259 192.168.1.16 → 10.6.15.145  SSH 206 Client: Encrypted packet (len=140)
  287 11.491012066  10.6.15.145 → 192.168.1.16 SSH 102 Server: Encrypted packet (len=36)
  288 11.491342583 192.168.1.16 → 10.6.15.145  SSH 298 Client: Encrypted packet (len=232)
  289 11.491675230 192.168.1.16 → 10.6.15.145  SSH 974 Client: Encrypted packet (len=908)
  290 11.492148728 192.168.1.16 → 10.6.15.145  SSH 398 Client: Encrypted packet (len=332)
  291 11.492535205  10.6.15.145 → 192.168.1.16 TCP 66 22 → 52104 [ACK] Seq=24085 Ack=25613 Win=1452 Len=0 TSval=24059847 TSecr=1245322
  292 11.493430339  10.6.15.145 → 192.168.1.16 TCP 66 22 → 52104 [ACK] Seq=24085 Ack=26753 Win=1452 Len=0 TSval=24059847 TSecr=1245323
  293 11.532540716  10.6.15.145 → 192.168.1.16 TCP 66 22 → 52104 [ACK] Seq=24085 Ack=27085 Win=1452 Len=0 TSval=24059857 TSecr=1245323
  294 11.549422010  10.6.15.145 → 192.168.1.16 SSH 182 Server: Encrypted packet (len=116)
  295 11.549793294  10.6.15.145 → 192.168.1.16 SSH 462 Server: Encrypted packet (len=396)
  296 11.549835681 192.168.1.16 → 10.6.15.145  TCP 66 52104 → 22 [ACK] Seq=27085 Ack=24597 Win=1444 Len=0 TSval=1245337 TSecr=24059861
  297 11.550627258 192.168.1.16 → 10.6.15.145  SSH 206 Client: Encrypted packet (len=140)
  298 11.551991355  10.6.15.145 → 192.168.1.16 TCP 66 22 → 52104 [ACK] Seq=24597 Ack=27225 Win=1452 Len=0 TSval=24059861 TSecr=1245337
  299 11.560106380  10.6.15.145 → 192.168.1.16 SSH 102 Server: Encrypted packet (len=36)
  300 11.560475914 192.168.1.16 → 10.6.15.145  SSH 206 Client: Encrypted packet (len=140)
  301 11.586047034  10.6.15.145 → 192.168.1.16 SSH 102 Server: Encrypted packet (len=36)
  302 11.586394109 192.168.1.16 → 10.6.15.145  SSH 150 Client: Encrypted packet (len=84)
  303 11.589694317  10.6.15.145 → 192.168.1.16 SSH 102 Server: Encrypted packet (len=36)
  304 11.590014210 192.168.1.16 → 10.6.15.145  SSH 422 Client: Encrypted packet (len=356)
  305 11.591931947  10.6.15.145 → 192.168.1.16 SSH 102 Server: Encrypted packet (len=36)
  306 11.592178278 192.168.1.16 → 10.6.15.145  SSH 158 Client: Encrypted packet (len=92)
  307 11.594630145  10.6.15.145 → 192.168.1.16 SSH 102 Server: Encrypted packet (len=36)
  308 11.595035401 192.168.1.16 → 10.6.15.145  SSH 414 Client: Encrypted packet (len=348)
  309 11.597538146  10.6.15.145 → 192.168.1.16 SSH 102 Server: Encrypted packet (len=36)
  310 11.597870656 192.168.1.16 → 10.6.15.145  SSH 150 Client: Encrypted packet (len=84)
  311 11.601967464  10.6.15.145 → 192.168.1.16 SSH 158 Server: Encrypted packet (len=92)
  312 11.602254547  10.6.15.145 → 192.168.1.16 SSH 1038 Server: Encrypted packet (len=972)
  313 11.602289256 192.168.1.16 → 10.6.15.145  TCP 66 52104 → 22 [ACK] Seq=28329 Ack=25877 Win=1444 Len=0 TSval=1245350 TSecr=24059874
  314 11.602427439  10.6.15.145 → 192.168.1.16 SSH 446 Server: Encrypted packet (len=380)
  315 11.602572063  10.6.15.145 → 192.168.1.16 SSH 134 Server: Encrypted packet (len=68)
  316 11.602599815 192.168.1.16 → 10.6.15.145  TCP 66 52104 → 22 [ACK] Seq=28329 Ack=26325 Win=1444 Len=0 TSval=1245350 TSecr=24059874
  317 11.602862542 192.168.1.16 → 10.6.15.145  SSH 134 Client: Encrypted packet (len=68)
  318 11.618643701  10.6.15.145 → 192.168.1.16 SSH 414 Server: Encrypted packet (len=348)
  319 11.624898997  10.6.15.145 → 192.168.1.16 SSH 110 Server: Encrypted packet (len=44)
  320 11.624967375 192.168.1.16 → 10.6.15.145  TCP 66 52104 → 22 [ACK] Seq=28397 Ack=26717 Win=1444 Len=0 TSval=1245356 TSecr=24059878
  321 11.625266836 192.168.1.16 → 10.6.15.145  SSH 198 Client: Encrypted packet (len=132)
  322 11.625952890  10.6.15.145 → 192.168.1.16 SSH 138 Server: Encrypted packet (len=72)
  323 11.626112118 192.168.1.16 → 10.6.15.145  SSH 102 Client: Encrypted packet (len=36)
  324 11.627352919  10.6.15.145 → 192.168.1.16 TCP 66 22 → 52104 [ACK] Seq=26789 Ack=28565 Win=1452 Len=0 TSval=24059880 TSecr=1245356
  325 11.634626582  10.6.15.145 → 192.168.1.16 SSH 138 Server: Encrypted packet (len=72)
  326 11.634852507 192.168.1.16 → 10.6.15.145  SSH 102 Client: Encrypted packet (len=36)
  327 11.636005735  10.6.15.145 → 192.168.1.16 SSH 142 Server: Encrypted packet (len=76)
  328 11.636566694  10.6.15.145 → 192.168.1.16 SSH 470 Server: Encrypted packet (len=404)
  329 11.636601508 192.168.1.16 → 10.6.15.145  TCP 66 52104 → 22 [ACK] Seq=28601 Ack=27341 Win=1444 Len=0 TSval=1245359 TSecr=24059882
  330 11.636682434 192.168.1.16 → 10.6.15.145  SSH 102 Client: Encrypted packet (len=36)
  331 11.638202749  10.6.15.145 → 192.168.1.16 SSH 102 Server: Encrypted packet (len=36)
  332 11.638779441  10.6.15.145 → 192.168.1.16 SSH 102 Server: Encrypted packet (len=36)
  333 11.638808252 192.168.1.16 → 10.6.15.145  TCP 66 52104 → 22 [ACK] Seq=28637 Ack=27413 Win=1444 Len=0 TSval=1245359 TSecr=24059883
  334 11.639171217 192.168.1.16 → 10.6.15.145  SSH 398 Client: Encrypted packet (len=332)
  335 11.641762619  10.6.15.145 → 192.168.1.16 SSH 1118 Server: Encrypted packet (len=1052)
  336 11.642103556  10.6.15.145 → 192.168.1.16 SSH 1514 Server: Encrypted packet (len=1448)
  337 11.642131302 192.168.1.16 → 10.6.15.145  TCP 66 52104 → 22 [ACK] Seq=28969 Ack=29913 Win=1444 Len=0 TSval=1245360 TSecr=24059884
  338 11.642135060  10.6.15.145 → 192.168.1.16 SSH 422 Server: Encrypted packet (len=356)
  339 11.642296582  10.6.15.145 → 192.168.1.16 SSH 110 Server: Encrypted packet (len=44)
  340 11.642317737 192.168.1.16 → 10.6.15.145  TCP 66 52104 → 22 [ACK] Seq=28969 Ack=30313 Win=1444 Len=0 TSval=1245360 TSecr=24059884
  341 11.642926783 192.168.1.16 → 10.6.15.145  SSH 206 Client: Encrypted packet (len=140)
  342 11.643642426 192.168.1.16 → 10.6.15.145  SSH 158 Client: Encrypted packet (len=92)
  343 11.644895453  10.6.15.145 → 192.168.1.16 SSH 1326 Server: Encrypted packet (len=1260)
  344 11.645663039 192.168.1.16 → 10.6.15.145  SSH 206 Client: Encrypted packet (len=140)
  345 11.647155077  10.6.15.145 → 192.168.1.16 TCP 66 22 → 52104 [ACK] Seq=31573 Ack=29341 Win=1452 Len=0 TSval=24059885 TSecr=1245361
  346 11.652137982  10.6.15.145 → 192.168.1.16 SSH 158 Server: Encrypted packet (len=92)
  347 11.652205464  10.6.15.145 → 192.168.1.16 SSH 470 Server: Encrypted packet (len=404)
  348 11.652268735 192.168.1.16 → 10.6.15.145  TCP 66 52104 → 22 [ACK] Seq=29341 Ack=32069 Win=1444 Len=0 TSval=1245363 TSecr=24059886
  349 11.653013024 192.168.1.16 → 10.6.15.145  SSH 206 Client: Encrypted packet (len=140)
  350 11.655463331  10.6.15.145 → 192.168.1.16 SSH 926 Server: Encrypted packet (len=860)
  351 11.655515019  10.6.15.145 → 192.168.1.16 SSH 486 Server: Encrypted packet (len=420)
  352 11.655537251 192.168.1.16 → 10.6.15.145  TCP 66 52104 → 22 [ACK] Seq=29481 Ack=33349 Win=1444 Len=0 TSval=1245364 TSecr=24059887
  353 11.656431541 192.168.1.16 → 10.6.15.145  SSH 206 Client: Encrypted packet (len=140)
  354 11.696206131  10.6.15.145 → 192.168.1.16 TCP 66 22 → 52104 [ACK] Seq=33349 Ack=29621 Win=1452 Len=0 TSval=24059898 TSecr=1245364
  355 11.702994421 192.168.1.16 → 224.0.0.252  IGMPv2 46 Membership Report group 224.0.0.252
  356 11.707874480  10.6.15.145 → 192.168.1.16 SSH 1514 Server: Encrypted packet (len=1448)
  357 11.707898430  10.6.15.145 → 192.168.1.16 SSH 438 Server: Encrypted packet (len=372)
  358 11.707964184 192.168.1.16 → 10.6.15.145  TCP 66 52104 → 22 [ACK] Seq=29621 Ack=35169 Win=1444 Len=0 TSval=1245377 TSecr=24059900
  359 11.708222797  10.6.15.145 → 192.168.1.16 SSH 1214 Server: Encrypted packet (len=1148)
  360 11.708232104  10.6.15.145 → 192.168.1.16 SSH 134 Server: Encrypted packet (len=68)
  361 11.708256179 192.168.1.16 → 10.6.15.145  TCP 66 52104 → 22 [ACK] Seq=29621 Ack=36385 Win=1444 Len=0 TSval=1245377 TSecr=24059900
  362 11.710307495  10.6.15.145 → 192.168.1.16 SSH 1514 Server: Encrypted packet (len=1448)
  363 11.710458127  10.6.15.145 → 192.168.1.16 SSH 1514 Server: Encrypted packet (len=1448)
  364 11.710489722 192.168.1.16 → 10.6.15.145  TCP 66 52104 → 22 [ACK] Seq=29621 Ack=39281 Win=1444 Len=0 TSval=1245377 TSecr=24059901
  365 11.710593098  10.6.15.145 → 192.168.1.16 SSH 142 Server: Encrypted packet (len=76)
  366 11.710667252  10.6.15.145 → 192.168.1.16 SSH 462 Server: Encrypted packet (len=396)
  367 11.710686045 192.168.1.16 → 10.6.15.145  TCP 66 52104 → 22 [ACK] Seq=29621 Ack=39753 Win=1444 Len=0 TSval=1245377 TSecr=24059901
  368 11.712222847 192.168.1.16 → 10.6.15.145  SSH 206 Client: Encrypted packet (len=140)
  369 11.712249432  10.6.15.145 → 192.168.1.16 SSH 238 Server: Encrypted packet (len=172)
  370 11.713335299 192.168.1.16 → 10.6.15.145  SSH 206 Client: Encrypted packet (len=140)
  371 11.713847279  10.6.15.145 → 192.168.1.16 TCP 66 22 → 52104 [ACK] Seq=39925 Ack=29761 Win=1452 Len=0 TSval=24059902 TSecr=1245378
  372 11.714106398 192.168.1.16 → 10.6.15.145  SSH 206 Client: Encrypted packet (len=140)
  373 11.714709756  10.6.15.145 → 192.168.1.16 TCP 66 22 → 52104 [ACK] Seq=39925 Ack=29901 Win=1452 Len=0 TSval=24059902 TSecr=1245378
  374 11.716647731 192.168.1.16 → 10.6.15.145  SSH 1514 Client: Encrypted packet (len=1448)
  375 11.716768156  10.6.15.145 → 192.168.1.16 TCP 66 22 → 52104 [ACK] Seq=39925 Ack=30041 Win=1452 Len=0 TSval=24059902 TSecr=1245378
  376 11.721522971 192.168.1.16 → 10.6.15.145  SSH 374 Client: Encrypted packet (len=308)
  377 11.738967765 192.168.1.16 → 10.6.15.145  TCP 374 [TCP Retransmission] 52104 → 22 [PSH, ACK] Seq=31489 Ack=39925 Win=1444 Len=308 TSval=1245385 TSecr=24059902
  378 11.751842936  10.6.15.145 → 192.168.1.16 TCP 78 [TCP Dup ACK 375#1] 22 → 52104 [ACK] Seq=39925 Ack=30041 Win=1452 Len=0 TSval=24059911 TSecr=1245378 SLE=31489 SRE=31797
  379 11.751859945  10.6.15.145 → 192.168.1.16 TCP 86 [TCP Dup ACK 375#2] 22 → 52104 [ACK] Seq=39925 Ack=30041 Win=1452 Len=0 TSval=24059911 TSecr=1245378 SLE=31489 SRE=31797 SLE=31489 SRE=31797
  380 11.776182837  10.6.15.145 → 192.168.1.16 SSH 234 Server: Encrypted packet (len=156)
  381 11.780904943  10.6.15.145 → 192.168.1.16 SSH 474 Server: Encrypted packet (len=396)
  382 11.780949786 192.168.1.16 → 10.6.15.145  TCP 66 52104 → 22 [ACK] Seq=31797 Ack=40477 Win=1444 Len=0 TSval=1245395 TSecr=24059918
  383 11.781834524 192.168.1.16 → 10.6.15.145  SSH 206 Client: Encrypted packet (len=140)
  384 11.783934100  10.6.15.145 → 192.168.1.16 TCP 78 [TCP Dup ACK 375#3] 22 → 52104 [ACK] Seq=40477 Ack=30041 Win=1452 Len=0 TSval=24059919 TSecr=1245378 SLE=31489 SRE=31937
  385 11.950971155 192.168.1.16 → 10.6.15.145  TCP 1514 [TCP Retransmission] 52104 → 22 [ACK] Seq=30041 Ack=40477 Win=1444 Len=1448 TSval=1245438 TSecr=24059919
  386 12.320965283  10.6.15.145 → 192.168.1.16 SSH 162 Server: Encrypted packet (len=84)
  387 12.320993655  10.6.15.145 → 192.168.1.16 SSH 154 Server: Encrypted packet (len=76)
  388 12.321001340  10.6.15.145 → 192.168.1.16 SSH 154 Server: Encrypted packet (len=76)
  389 12.321063023 192.168.1.16 → 10.6.15.145  TCP 66 52104 → 22 [ACK] Seq=31937 Ack=40713 Win=1444 Len=0 TSval=1245530 TSecr=24059956
  390 12.333944496  10.6.15.145 → 192.168.1.16 SSH 242 Server: Encrypted packet (len=164)
  391 12.333966623  10.6.15.145 → 192.168.1.16 TCP 242 [TCP Retransmission] 22 → 52104 [PSH, ACK] Seq=40713 Ack=30041 Win=1452 Len=164 TSval=24059962 TSecr=1245378 SLE=31489 SRE=31937
  392 12.333975094 192.168.1.16 → 10.6.15.145  TCP 78 52104 → 22 [ACK] Seq=31937 Ack=40877 Win=1443 Len=0 TSval=1245533 TSecr=24059962 SLE=40713 SRE=40877
  393 12.334011126  10.6.15.145 → 192.168.1.16 SSH 478 Server: [TCP Spurious Retransmission] , Encrypted packet (len=400)
  394 12.334014871 192.168.1.16 → 10.6.15.145  TCP 78 [TCP Dup ACK 392#1] 52104 → 22 [ACK] Seq=31937 Ack=40877 Win=1443 Len=0 TSval=1245533 TSecr=24060013 SLE=40477 SRE=40877
  395 12.374963551 192.168.1.16 → 10.6.15.145  TCP 1514 [TCP Retransmission] 52104 → 22 [ACK] Seq=30041 Ack=40877 Win=1444 Len=1448 TSval=1245544 TSecr=24060013
  396 12.393835867  10.6.15.145 → 192.168.1.16 SSH 1514 Server: Encrypted packet (len=1436)
  397 12.393859219 192.168.1.16 → 10.6.15.145  TCP 66 52104 → 22 [ACK] Seq=31937 Ack=42313 Win=1433 Len=0 TSval=1245548 TSecr=24060071
  398 12.394037566  10.6.15.145 → 192.168.1.16 SSH 1514 Server: Encrypted packet (len=1436)
  399 12.394044640 192.168.1.16 → 10.6.15.145  TCP 66 52104 → 22 [ACK] Seq=31937 Ack=43749 Win=1422 Len=0 TSval=1245548 TSecr=24060071
  400 12.394250674  10.6.15.145 → 192.168.1.16 SSH 1514 Server: Encrypted packet (len=1436)
  401 12.394260680 192.168.1.16 → 10.6.15.145  TCP 66 52104 → 22 [ACK] Seq=31937 Ack=45185 Win=1422 Len=0 TSval=1245548 TSecr=24060071
  402 12.394463574  10.6.15.145 → 192.168.1.16 SSH 1514 Server: Encrypted packet (len=1436)
  403 12.394473266 192.168.1.16 → 10.6.15.145  TCP 66 52104 → 22 [ACK] Seq=31937 Ack=46621 Win=1422 Len=0 TSval=1245548 TSecr=24060071
  404 12.394480742  10.6.15.145 → 192.168.1.16 TCP 66 22 → 52104 [ACK] Seq=46621 Ack=31937 Win=1446 Len=0 TSval=24060072 TSecr=1245544
  405 12.394487266 192.168.1.16 → 10.6.15.145  SSH 1138 Client: Encrypted packet (len=1072)
  406 12.396278746 192.168.1.16 → 10.6.15.145  SSH 206 Client: Encrypted packet (len=140)
  407 12.398311327  10.6.15.145 → 192.168.1.16 SSH 1514 Server: Encrypted packet (len=1448)
  408 12.398323055  10.6.15.145 → 192.168.1.16 SSH 1490 Server: Encrypted packet (len=1424)
  409 12.398325677  10.6.15.145 → 192.168.1.16 SSH 1514 Server: Encrypted packet (len=1448)
  410 12.398350838 192.168.1.16 → 10.6.15.145  TCP 66 52104 → 22 [ACK] Seq=33149 Ack=50941 Win=1444 Len=0 TSval=1245549 TSecr=24060072
  411 12.398481849  10.6.15.145 → 192.168.1.16 SSH 1490 Server: Encrypted packet (len=1424)
  412 12.398760058  10.6.15.145 → 192.168.1.16 TCP 66 22 → 52104 [ACK] Seq=52365 Ack=33149 Win=1452 Len=0 TSval=24060073 TSecr=1245548
  413 12.398769300 192.168.1.16 → 10.6.15.145  SSH 206 Client: Encrypted packet (len=140)
  414 12.399453472 192.168.1.16 → 10.6.15.145  SSH 206 Client: Encrypted packet (len=140)
  415 12.402039279  10.6.15.145 → 192.168.1.16 SSH 706 Server: Encrypted packet (len=640)
  416 12.402381764 192.168.1.16 → 10.6.15.145  SSH 206 Client: Encrypted packet (len=140)
  417 12.403042087 192.168.1.16 → 10.6.15.145  SSH 246 Client: Encrypted packet (len=180)
  418 12.403830253  10.6.15.145 → 192.168.1.16 TCP 66 22 → 52104 [ACK] Seq=53005 Ack=33429 Win=1452 Len=0 TSval=24060074 TSecr=1245549
  419 12.404358067 192.168.1.16 → 10.6.15.145  SSH 206 Client: Encrypted packet (len=140)
  420 12.404990690  10.6.15.145 → 192.168.1.16 TCP 66 22 → 52104 [ACK] Seq=53005 Ack=33749 Win=1452 Len=0 TSval=24060075 TSecr=1245550
  421 12.405652313 192.168.1.16 → 10.6.15.145  SSH 206 Client: Encrypted packet (len=140)
  422 12.407076927  10.6.15.145 → 192.168.1.16 TCP 66 22 → 52104 [ACK] Seq=53005 Ack=34029 Win=1452 Len=0 TSval=24060075 TSecr=1245551
  423 12.408145444 192.168.1.16 → 10.6.15.145  SSH 102 Client: Encrypted packet (len=36)
  424 12.408729997 192.168.1.16 → 10.6.15.145  SSH 294 Client: Encrypted packet (len=228)
  425 12.409878011 192.168.1.16 → 10.6.15.145  SSH 1514 Client: Encrypted packet (len=1448)
  426 12.412780690 192.168.1.16 → 10.6.15.145  SSH 454 Client: Encrypted packet (len=388)
  427 12.415977358  10.6.15.145 → 192.168.1.16 TCP 66 22 → 52104 [ACK] Seq=53005 Ack=34293 Win=1452 Len=0 TSval=24060076 TSecr=1245552
  428 12.415993599  10.6.15.145 → 192.168.1.16 TCP 66 22 → 52104 [ACK] Seq=53005 Ack=36129 Win=1452 Len=0 TSval=24060077 TSecr=1245552
  429 12.425293039 192.168.1.16 → 224.0.0.251  MDNS 82 Standard query 0x0000 PTR _googlecast._tcp.local, "QM" question
  430 12.425338189 fe80::60bd:1940:a0d8:49f9 → ff02::fb     MDNS 102 Standard query 0x0000 PTR _googlecast._tcp.local, "QM" question
  431 12.425386414 192.168.1.16 → 224.0.0.251  MDNS 82 Standard query 0x0000 PTR _googlecast._tcp.local, "QM" question
  432 12.425403051 fe80::60bd:1940:a0d8:49f9 → ff02::fb     MDNS 102 Standard query 0x0000 PTR _googlecast._tcp.local, "QM" question
  433 14.008842705  10.6.15.145 → 192.168.1.16 SSH 142 Server: Encrypted packet (len=76)
  434 14.008866077  10.6.15.145 → 192.168.1.16 SSH 142 Server: Encrypted packet (len=76)
  435 14.008900471  10.6.15.145 → 192.168.1.16 SSH 702 Server: Encrypted packet (len=636)
  436 14.008939877 192.168.1.16 → 10.6.15.145  TCP 66 52104 → 22 [ACK] Seq=36129 Ack=53793 Win=1444 Len=0 TSval=1245952 TSecr=24060125
  437 14.009081264  10.6.15.145 → 192.168.1.16 SSH 182 Server: Encrypted packet (len=116)
  438 14.009278464  10.6.15.145 → 192.168.1.16 SSH 1314 Server: Encrypted packet (len=1248)
  439 14.009306840 192.168.1.16 → 10.6.15.145  TCP 66 52104 → 22 [ACK] Seq=36129 Ack=55157 Win=1444 Len=0 TSval=1245952 TSecr=24060126
  440 14.009377045  10.6.15.145 → 192.168.1.16 TCP 970 [TCP Out-Of-Order] 22 → 52104 [PSH, ACK] Seq=53005 Ack=36129 Win=1452 Len=904 TSval=24060234 TSecr=1245552
  441 14.009380108 192.168.1.16 → 10.6.15.145  TCP 78 [TCP Dup ACK 439#1] 52104 → 22 [ACK] Seq=36129 Ack=55157 Win=1444 Len=0 TSval=1245952 TSecr=24060126 SLE=53005 SRE=53909
  442 14.009506308  10.6.15.145 → 192.168.1.16 TCP 970 [TCP Out-Of-Order] 22 → 52104 [PSH, ACK] Seq=53005 Ack=36129 Win=1452 Len=904 TSval=24060422 TSecr=1245552
  443 14.009513980 192.168.1.16 → 10.6.15.145  TCP 78 [TCP Dup ACK 439#2] 52104 → 22 [ACK] Seq=36129 Ack=55157 Win=1444 Len=0 TSval=1245952 TSecr=24060126 SLE=53005 SRE=53909
  444 14.010997751 192.168.1.16 → 10.6.15.145  SSH 1022 Client: Encrypted packet (len=956)
  445 14.011539138 192.168.1.16 → 10.6.15.145  SSH 1082 Client: Encrypted packet (len=1016)
  446 14.012296644  10.6.15.145 → 192.168.1.16 SSH 1514 Server: Encrypted packet (len=1448)
  447 14.012480343  10.6.15.145 → 192.168.1.16 SSH 1514 Server: Encrypted packet (len=1448)
  448 14.012548358  10.6.15.145 → 192.168.1.16 SSH 714 Server: Encrypted packet (len=648)
  449 14.012558854 192.168.1.16 → 10.6.15.145  SSH 198 Client: Encrypted packet (len=132)
  450 14.014331922 192.168.1.16 → 10.6.15.145  SSH 138 Client: Encrypted packet (len=72)
  451 14.014749494  10.6.15.145 → 192.168.1.16 TCP 66 22 → 52104 [ACK] Seq=58701 Ack=38101 Win=1452 Len=0 TSval=24060477 TSecr=1245953
  452 14.015617326  10.6.15.145 → 192.168.1.16 TCP 66 22 → 52104 [ACK] Seq=58701 Ack=38305 Win=1452 Len=0 TSval=24060477 TSecr=1245953
  453 14.019158597 192.168.1.16 → 10.6.15.145  SSH 126 Client: Encrypted packet (len=60)
  454 14.019884543 192.168.1.16 → 10.6.15.145  SSH 202 Client: Encrypted packet (len=136)
  455 14.020348563 192.168.1.16 → 10.6.15.145  SSH 126 Client: Encrypted packet (len=60)
  456 14.021680520  10.6.15.145 → 192.168.1.16 TCP 66 22 → 52104 [ACK] Seq=58701 Ack=38501 Win=1452 Len=0 TSval=24060479 TSecr=1245955
  457 14.028461775 192.168.1.16 → 10.6.15.145  SSH 214 Client: Encrypted packet (len=148)
  458 14.028853871 192.168.1.16 → 10.6.15.145  SSH 1514 Client: Encrypted packet (len=1448)
  459 14.029551843 192.168.1.16 → 10.6.15.145  SSH 166 Client: Encrypted packet (len=100)
  460 14.029873296  10.6.15.145 → 192.168.1.16 TCP 66 22 → 52104 [ACK] Seq=58701 Ack=38709 Win=1452 Len=0 TSval=24060481 TSecr=1245955
  461 14.031041948  10.6.15.145 → 192.168.1.16 TCP 66 22 → 52104 [ACK] Seq=58701 Ack=40257 Win=1452 Len=0 TSval=24060481 TSecr=1245957
  462 15.039396898  10.6.15.145 → 192.168.1.16 SSH 1514 Server: Encrypted packet (len=1448)
  463 15.039570592  10.6.15.145 → 192.168.1.16 SSH 1510 Server: Encrypted packet (len=1444)
  464 15.039610866 192.168.1.16 → 10.6.15.145  TCP 66 52104 → 22 [ACK] Seq=40257 Ack=61593 Win=1444 Len=0 TSval=1246210 TSecr=24060530
  465 15.039644811  10.6.15.145 → 192.168.1.16 SSH 678 Server: Encrypted packet (len=612)
  466 15.039852293  10.6.15.145 → 192.168.1.16 SSH 1514 Server: Encrypted packet (len=1448)
  467 15.039877669 192.168.1.16 → 10.6.15.145  TCP 66 52104 → 22 [ACK] Seq=40257 Ack=63653 Win=1444 Len=0 TSval=1246210 TSecr=24060530
  468 15.040819051 192.168.1.16 → 10.6.15.145  SSH 206 Client: Encrypted packet (len=140)
  469 15.041434155  10.6.15.145 → 192.168.1.16 SSH 458 Server: Encrypted packet (len=392)
  470 15.058319984 192.168.1.16 → 10.6.15.145  SSH 102 Client: Encrypted packet (len=36)
  471 15.059273466 192.168.1.16 → 10.6.15.145  SSH 118 Client: Encrypted packet (len=52)
  472 15.059748965  10.6.15.145 → 192.168.1.16 TCP 66 22 → 52104 [ACK] Seq=64045 Ack=40433 Win=1452 Len=0 TSval=24060738 TSecr=1246210
  473 15.059762321 192.168.1.16 → 10.6.15.145  SSH 102 Client: Encrypted packet (len=36)
  474 15.061155480  10.6.15.145 → 192.168.1.16 TCP 66 22 → 52104 [ACK] Seq=64045 Ack=40521 Win=1452 Len=0 TSval=24060739 TSecr=1246215
  475 15.065164308 192.168.1.16 → 10.6.15.145  SSH 102 Client: Encrypted packet (len=36)
  476 15.066038801 192.168.1.16 → 10.6.15.145  SSH 118 Client: Encrypted packet (len=52)
  477 15.067733883  10.6.15.145 → 192.168.1.16 TCP 66 22 → 52104 [ACK] Seq=64045 Ack=40609 Win=1452 Len=0 TSval=24060740 TSecr=1246216
  478 15.228120048 192.168.1.16 → 10.6.15.145  SSH 766 Client: Encrypted packet (len=700)
  479 15.255636317  10.6.15.145 → 192.168.1.16 SSH 142 Server: Encrypted packet (len=76)
  480 15.282411903  10.6.15.145 → 192.168.1.16 SSH 126 Server: Encrypted packet (len=60)
  481 15.282434591  10.6.15.145 → 192.168.1.16 SSH 138 Server: Encrypted packet (len=72)
  482 15.282503428 192.168.1.16 → 10.6.15.145  TCP 66 52104 → 22 [ACK] Seq=41309 Ack=64253 Win=1444 Len=0 TSval=1246270 TSecr=24060787
  483 15.282753355 192.168.1.16 → 10.6.15.145  SSH 102 Client: Encrypted packet (len=36)
  484 15.297155844 192.168.1.16 → 10.6.15.145  SSH 222 Client: Encrypted packet (len=156)
  485 15.297431886 192.168.1.16 → 10.6.15.145  SSH 1166 Client: Encrypted packet (len=1100)
  486 15.302212173  10.6.15.145 → 192.168.1.16 TCP 66 22 → 52104 [ACK] Seq=64253 Ack=41501 Win=1452 Len=0 TSval=24060798 TSecr=1246270
  487 15.336562909  10.6.15.145 → 192.168.1.16 SSH 126 Server: Encrypted packet (len=60)
  488 15.336587883  10.6.15.145 → 192.168.1.16 SSH 138 Server: Encrypted packet (len=72)
  489 15.336635367 192.168.1.16 → 10.6.15.145  TCP 66 52104 → 22 [ACK] Seq=42601 Ack=64385 Win=1444 Len=0 TSval=1246284 TSecr=24060807
  490 15.336811701 192.168.1.16 → 10.6.15.145  SSH 102 Client: Encrypted packet (len=36)
  491 15.417745921  10.6.15.145 → 192.168.1.16 SSH 102 Server: Encrypted packet (len=36)
  492 15.418037241 192.168.1.16 → 10.6.15.145  SSH 174 Client: Encrypted packet (len=108)
  493 15.426705044  10.6.15.145 → 192.168.1.16 SSH 102 Server: Encrypted packet (len=36)
  494 15.427015085 192.168.1.16 → 10.6.15.145  SSH 158 Client: Encrypted packet (len=92)
  495 15.441742799  10.6.15.145 → 192.168.1.16 TCP 78 [TCP Dup ACK 487#1] 22 → 52104 [ACK] Seq=64457 Ack=42601 Win=1452 Len=0 TSval=24060834 TSecr=1246284 SLE=42637 SRE=42745
  496 15.449215291  10.6.15.145 → 192.168.1.16 SSH 354 Server: Encrypted packet (len=276)
  497 15.468626595  10.6.15.145 → 192.168.1.16 SSH 194 Server: Encrypted packet (len=116)
  498 15.468692241 192.168.1.16 → 10.6.15.145  TCP 66 52104 → 22 [ACK] Seq=42837 Ack=64849 Win=1444 Len=0 TSval=1246317 TSecr=24060835
  499 15.539240962 192.168.1.16 → 10.6.15.145  SSH 726 Client: Encrypted packet (len=660)
  500 15.554969275 192.168.1.16 → 10.6.15.145  TCP 102 [TCP Retransmission] 52104 → 22 [PSH, ACK] Seq=42601 Ack=64849 Win=1444 Len=36 TSval=1246339 TSecr=24060835
  501 15.990990113 192.168.1.16 → 10.6.15.145  TCP 102 [TCP Retransmission] 52104 → 22 [PSH, ACK] Seq=42601 Ack=64849 Win=1444 Len=36 TSval=1246448 TSecr=24060835
  502 15.993421267  10.6.15.145 → 192.168.1.16 SSH 1514 Server: Encrypted packet (len=1436)
  503 15.996981785  10.6.15.145 → 192.168.1.16 SSH 1502 Server: Encrypted packet (len=1436)
  504 15.997001506 192.168.1.16 → 10.6.15.145  TCP 818 [TCP Retransmission] 52104 → 22 [PSH, ACK] Seq=42745 Ack=67721 Win=1422 Len=752 TSval=1246449 TSecr=24060940
  505 15.997095518  10.6.15.145 → 192.168.1.16 SSH 1118 Server: Encrypted packet (len=1052)
  506 16.006066796 192.168.1.16 → 10.6.15.145  SSH 274 Client: Encrypted packet (len=208)
  507 16.034375781  10.6.15.145 → 192.168.1.16 TCP 78 [TCP Dup ACK 503#1] 22 → 52104 [ACK] Seq=68773 Ack=42745 Win=1452 Len=0 TSval=24060981 TSecr=1246448 SLE=43497 SRE=43705
  508 16.034398052 192.168.1.16 → 10.6.15.145  TCP 818 [TCP Retransmission] 52104 → 22 [PSH, ACK] Seq=42745 Ack=68773 Win=1444 Len=752 TSval=1246458 TSecr=24060981
  509 16.250966249 192.168.1.16 → 10.6.15.145  TCP 818 [TCP Retransmission] 52104 → 22 [PSH, ACK] Seq=42745 Ack=68773 Win=1444 Len=752 TSval=1246513 TSecr=24060981
  510 16.695023187 192.168.1.16 → 10.6.15.145  TCP 818 [TCP Retransmission] 52104 → 22 [PSH, ACK] Seq=42745 Ack=68773 Win=1444 Len=752 TSval=1246624 TSecr=24060981
  511 16.807208844  10.6.15.145 → 192.168.1.16 SSH 1434 Server: Encrypted packet (len=1356)
  512 16.851017189 192.168.1.16 → 10.6.15.145  TCP 66 52104 → 22 [ACK] Seq=43705 Ack=70129 Win=1444 Len=0 TSval=1246663 TSecr=24061062
  513 16.904863238  10.6.15.145 → 192.168.1.16 SSH 1434 Server: [TCP Spurious Retransmission] , Encrypted packet (len=1356)
  514 16.904884842 192.168.1.16 → 10.6.15.145  TCP 78 [TCP Dup ACK 512#1] 52104 → 22 [ACK] Seq=43705 Ack=70129 Win=1444 Len=0 TSval=1246676 TSecr=24061200 SLE=68773 SRE=70129
  515 17.591017697 192.168.1.16 → 10.6.15.145  TCP 818 [TCP Retransmission] 52104 → 22 [PSH, ACK] Seq=42745 Ack=70129 Win=1444 Len=752 TSval=1246848 TSecr=24061200
  516 17.596285237  10.6.15.145 → 192.168.1.16 TCP 66 22 → 52104 [ACK] Seq=70129 Ack=43705 Win=1446 Len=0 TSval=24061373 TSecr=1246848
  517 17.596305554 192.168.1.16 → 10.6.15.145  SSH 206 Client: Encrypted packet (len=140)
  518 17.598505180  10.6.15.145 → 192.168.1.16 TCP 66 22 → 52104 [ACK] Seq=70129 Ack=43845 Win=1452 Len=0 TSval=24061373 TSecr=1246849
  519 17.685056306  10.6.15.145 → 192.168.1.16 SSH 206 Server: Encrypted packet (len=140)
  520 17.685074800 192.168.1.16 → 10.6.15.145  TCP 66 52104 → 22 [ACK] Seq=43845 Ack=70269 Win=1443 Len=0 TSval=1246871 TSecr=24061395
  521 17.685662861 192.168.1.16 → 10.6.15.145  SSH 134 Client: Encrypted packet (len=68)
  522 17.691559730  10.6.15.145 → 192.168.1.16 TCP 66 22 → 52104 [ACK] Seq=70269 Ack=43913 Win=1452 Len=0 TSval=24061396 TSecr=1246871
  523 19.033472583  10.6.15.145 → 192.168.1.16 SSH 414 Server: Encrypted packet (len=348)
  524 19.033866108  10.6.15.145 → 192.168.1.16 SSH 526 Server: Encrypted packet (len=460)
  525 19.033941345 192.168.1.16 → 10.6.15.145  TCP 66 52104 → 22 [ACK] Seq=43913 Ack=71077 Win=1444 Len=0 TSval=1247208 TSecr=24061462
  526 19.034272621  10.6.15.145 → 192.168.1.16 SSH 1014 Server: Encrypted packet (len=948)
  527 19.034926411 192.168.1.16 → 10.6.15.145  SSH 206 Client: Encrypted packet (len=140)
  528 19.048022891  10.6.15.145 → 192.168.1.16 SSH 118 Server: Encrypted packet (len=52)
  529 19.048041985  10.6.15.145 → 192.168.1.16 TCP 66 22 → 52104 [ACK] Seq=72077 Ack=44053 Win=1452 Len=0 TSval=24061733 TSecr=1247208
  530 19.048737055 192.168.1.16 → 10.6.15.145  SSH 438 Client: Encrypted packet (len=372)
  531 19.262992656 192.168.1.16 → 10.6.15.145  TCP 438 [TCP Retransmission] 52104 → 22 [PSH, ACK] Seq=44053 Ack=72077 Win=1444 Len=372 TSval=1247266 TSecr=24061733
  532 19.301934362  10.6.15.145 → 192.168.1.16 TCP 66 22 → 52104 [ACK] Seq=72077 Ack=44425 Win=1452 Len=0 TSval=24061799 TSecr=1247266
  533 19.401793814  10.6.15.145 → 192.168.1.16 SSH 414 Server: Encrypted packet (len=348)
  534 19.442966692 192.168.1.16 → 10.6.15.145  TCP 66 52104 → 22 [ACK] Seq=44425 Ack=72425 Win=1444 Len=0 TSval=1247311 TSecr=24061824
  535 21.018551629  10.6.15.145 → 192.168.1.16 SSH 174 Server: Encrypted packet (len=108)
  536 21.018577289 192.168.1.16 → 10.6.15.145  TCP 66 52104 → 22 [ACK] Seq=44425 Ack=72533 Win=1444 Len=0 TSval=1247704 TSecr=24061874
  537 21.018593017  10.6.15.145 → 192.168.1.16 SSH 102 Server: Encrypted packet (len=36)
  538 21.018599614 192.168.1.16 → 10.6.15.145  TCP 66 52104 → 22 [ACK] Seq=44425 Ack=72569 Win=1444 Len=0 TSval=1247704 TSecr=24061875
  539 21.018610558  10.6.15.145 → 192.168.1.16 SSH 158 Server: Encrypted packet (len=92)
  540 21.018617026 192.168.1.16 → 10.6.15.145  TCP 66 52104 → 22 [ACK] Seq=44425 Ack=72661 Win=1444 Len=0 TSval=1247704 TSecr=24061891
  541 21.019902261 192.168.1.16 → 10.6.15.145  SSH 774 Client: Encrypted packet (len=708)
  542 21.037302965  10.6.15.145 → 192.168.1.16 SSH 158 Server: [TCP Spurious Retransmission] , Encrypted packet (len=92)
  543 21.037321564 192.168.1.16 → 10.6.15.145  TCP 78 [TCP Dup ACK 540#1] 52104 → 22 [ACK] Seq=45133 Ack=72661 Win=1444 Len=0 TSval=1247709 TSecr=24062041 SLE=72569 SRE=72661
  544 21.216874317 192.168.1.16 → 10.6.15.145  SSH 726 Client: Encrypted packet (len=660)
  545 21.226440972  10.6.15.145 → 192.168.1.16 TCP 78 [TCP Dup ACK 532#1] 22 → 52104 [ACK] Seq=72661 Ack=44425 Win=1452 Len=0 TSval=24062280 TSecr=1247704 SLE=45133 SRE=45793
  546 21.238990737 192.168.1.16 → 10.6.15.145  TCP 774 [TCP Retransmission] 52104 → 22 [PSH, ACK] Seq=44425 Ack=72661 Win=1444 Len=708 TSval=1247760 TSecr=24062280
  547 21.686992944 192.168.1.16 → 10.6.15.145  TCP 774 [TCP Retransmission] 52104 → 22 [PSH, ACK] Seq=44425 Ack=72661 Win=1444 Len=708 TSval=1247872 TSecr=24062280
  548 22.583008736 192.168.1.16 → 10.6.15.145  TCP 774 [TCP Retransmission] 52104 → 22 [PSH, ACK] Seq=44425 Ack=72661 Win=1444 Len=708 TSval=1248096 TSecr=24062280
  549 22.642040202  10.6.15.145 → 192.168.1.16 TCP 66 22 → 52104 [ACK] Seq=72661 Ack=45793 Win=1446 Len=0 TSval=24062634 TSecr=1248096
  550 25.513918473 ZioncomE_53:dd:d4 → HonHaiPr_1f:71:b9 EAPOL 135 Key (Message 1 of 4)
  551 25.514143251 HonHaiPr_1f:71:b9 → ZioncomE_53:dd:d4 EAPOL 135 Key (Message 2 of 4)
  552 25.531050194 ZioncomE_53:dd:d4 → HonHaiPr_1f:71:b9 EAPOL 169 Key (Message 3 of 4)
  553 25.531138570 HonHaiPr_1f:71:b9 → ZioncomE_53:dd:d4 EAPOL 113 Key (Message 4 of 4)
  554 25.542987649 fe80::60bd:1940:a0d8:49f9 → ff02::16     ICMPv6 90 Multicast Listener Report Message v2
  555 25.543012570 192.168.1.16 → 224.0.0.252  IGMPv2 46 Membership Report group 224.0.0.252
  556 25.606667108 192.168.1.16 → 224.0.0.252  LLMNR 73 Standard query 0xd0bb ANY theenterprise
  557 25.731087289 fe80::60bd:1940:a0d8:49f9 → ff02::1:3    LLMNR 93 Standard query 0xb61a ANY theenterprise
  558 25.731845070 192.168.1.16 → 224.0.0.252  LLMNR 73 Standard query 0xd0bb ANY theenterprise
  559 25.859023440 fe80::60bd:1940:a0d8:49f9 → ff02::1:3    LLMNR 93 Standard query 0xb61a ANY theenterprise
  560 25.859032413 192.168.1.16 → 224.0.0.252  LLMNR 73 Standard query 0xd0bb ANY theenterprise
  561 25.942976037 fe80::60bd:1940:a0d8:49f9 → ff02::16     ICMPv6 90 Multicast Listener Report Message v2
  562 26.107019265 192.168.1.16 → 10.6.15.145  SSH 154 Client: Encrypted packet (len=88)
  563 26.107027822 fe80::60bd:1940:a0d8:49f9 → ff02::1:3    LLMNR 93 Standard query 0xb61a ANY theenterprise
  564 27.002508061  10.6.15.145 → 192.168.1.16 SSH 1022 Server: Encrypted packet (len=956)
  565 27.002538145 192.168.1.16 → 10.6.15.145  TCP 66 52104 → 22 [ACK] Seq=45881 Ack=73617 Win=1437 Len=0 TSval=1249200 TSecr=24063612
  566 27.033678426 192.168.1.16 → 239.255.255.250 SSDP 213 M-SEARCH * HTTP/1.1 
  567 27.894993461 192.168.1.16 → 10.6.15.145  TCP 154 [TCP Retransmission] 52104 → 22 [PSH, ACK] Seq=45793 Ack=73617 Win=1444 Len=88 TSval=1249424 TSecr=24063612
  568 28.039043847 192.168.1.16 → 239.255.255.250 SSDP 213 M-SEARCH * HTTP/1.1 
  569 29.034811147 192.168.1.16 → 239.255.255.250 SSDP 213 M-SEARCH * HTTP/1.1 
