    1 0.000000000 192.168.1.12 → 10.6.15.156  TCP 66 54766 → 22 [ACK] Seq=1 Ack=1 Win=6155 Len=0 TSval=8303858 TSecr=15235349
    2 0.000010198 192.168.1.12 → 10.6.15.156  TCP 66 54766 → 22 [ACK] Seq=1 Ack=173 Win=6155 Len=0 TSval=8303861 TSecr=15235363
    3 0.000012119 192.168.1.12 → 10.6.15.156  TCP 66 54766 → 22 [ACK] Seq=1 Ack=345 Win=6155 Len=0 TSval=8303865 TSecr=15235367
    4 0.000013683 192.168.1.12 → 10.6.15.156  TCP 78 [TCP Dup ACK 3#1] 54766 → 22 [ACK] Seq=1 Ack=345 Win=6155 Len=0 TSval=8303891 TSecr=15235393 SLE=173 SRE=345
    5 0.001178161  10.6.15.156 → 192.168.1.12 SSH 198 Server: Encrypted packet (len=132)
    6 0.001204898 192.168.1.12 → 10.6.15.156  TCP 66 54766 → 22 [ACK] Seq=1 Ack=477 Win=6155 Len=0 TSval=8303973 TSecr=15235446
    7 0.001335131  10.6.15.156 → 192.168.1.12 SSH 1514 Server: Encrypted packet (len=1448)
    8 0.001339376 192.168.1.12 → 10.6.15.156  TCP 66 54766 → 22 [ACK] Seq=1 Ack=1925 Win=6155 Len=0 TSval=8303973 TSecr=15235454
    9 0.001539804  10.6.15.156 → 192.168.1.12 SSH 1514 Server: Encrypted packet (len=1448)
   10 0.001547314 192.168.1.12 → 10.6.15.156  TCP 66 54766 → 22 [ACK] Seq=1 Ack=3373 Win=6155 Len=0 TSval=8303973 TSecr=15235454
   11 0.001933213  10.6.15.156 → 192.168.1.12 SSH 1514 Server: Encrypted packet (len=1448)
   12 0.001952448 192.168.1.12 → 10.6.15.156  TCP 66 54766 → 22 [ACK] Seq=1 Ack=4821 Win=6155 Len=0 TSval=8303973 TSecr=15235454
   13 0.001986844  10.6.15.156 → 192.168.1.12 SSH 1022 Server: Encrypted packet (len=956)
   14 0.001993355 192.168.1.12 → 10.6.15.156  TCP 66 54766 → 22 [ACK] Seq=1 Ack=5777 Win=6155 Len=0 TSval=8303973 TSecr=15235454
   15 0.002189459  10.6.15.156 → 192.168.1.12 SSH 1514 Server: Encrypted packet (len=1448)
   16 0.002195706 192.168.1.12 → 10.6.15.156  TCP 66 54766 → 22 [ACK] Seq=1 Ack=7225 Win=6155 Len=0 TSval=8303973 TSecr=15235455
   17 0.002356922  10.6.15.156 → 192.168.1.12 SSH 1358 Server: Encrypted packet (len=1292)
   18 0.002363000 192.168.1.12 → 10.6.15.156  TCP 66 54766 → 22 [ACK] Seq=1 Ack=8517 Win=6155 Len=0 TSval=8303973 TSecr=15235455
   19 0.002372004  10.6.15.156 → 192.168.1.12 SSH 182 Server: Encrypted packet (len=116)
   20 0.002374621 192.168.1.12 → 10.6.15.156  TCP 66 54766 → 22 [ACK] Seq=1 Ack=8633 Win=6155 Len=0 TSval=8303973 TSecr=15235475
   21 0.100548857  10.6.15.156 → 192.168.1.12 SSH 1514 Server: Encrypted packet (len=1448)
   22 0.100564623 192.168.1.12 → 10.6.15.156  TCP 66 54766 → 22 [ACK] Seq=1 Ack=10081 Win=6155 Len=0 TSval=8303998 TSecr=15235499
   23 0.100730247  10.6.15.156 → 192.168.1.12 SSH 1514 Server: Encrypted packet (len=1448)
   24 0.100733419 192.168.1.12 → 10.6.15.156  TCP 66 54766 → 22 [ACK] Seq=1 Ack=11529 Win=6155 Len=0 TSval=8303998 TSecr=15235499
   25 0.100907598  10.6.15.156 → 192.168.1.12 SSH 1514 Server: Encrypted packet (len=1448)
   26 0.100909970 192.168.1.12 → 10.6.15.156  TCP 66 54766 → 22 [ACK] Seq=1 Ack=12977 Win=6155 Len=0 TSval=8303998 TSecr=15235499
   27 0.101113379  10.6.15.156 → 192.168.1.12 SSH 1514 Server: Encrypted packet (len=1448)
   28 0.101116829 192.168.1.12 → 10.6.15.156  TCP 66 54766 → 22 [ACK] Seq=1 Ack=14425 Win=6155 Len=0 TSval=8303998 TSecr=15235499
   29 0.101131548  10.6.15.156 → 192.168.1.12 SSH 430 Server: Encrypted packet (len=364)
   30 0.101133568 192.168.1.12 → 10.6.15.156  TCP 66 54766 → 22 [ACK] Seq=1 Ack=14789 Win=6155 Len=0 TSval=8303998 TSecr=15235499
   31 0.266768736  10.6.15.156 → 192.168.1.12 SSH 230 Server: Encrypted packet (len=164)
   32 0.266949827  10.6.15.156 → 192.168.1.12 SSH 1286 Server: Encrypted packet (len=1220)
   33 0.267068291  10.6.15.156 → 192.168.1.12 SSH 990 Server: Encrypted packet (len=924)
   34 0.267072339  10.6.15.156 → 192.168.1.12 SSH 182 Server: Encrypted packet (len=116)
   35 0.267665969  10.6.15.156 → 192.168.1.12 SSH 934 Server: Encrypted packet (len=868)
   36 0.267703933  10.6.15.156 → 192.168.1.12 SSH 398 Server: Encrypted packet (len=332)
   37 0.267932942  10.6.15.156 → 192.168.1.12 SSH 518 Server: Encrypted packet (len=452)
   38 0.307032930  10.6.15.156 → 192.168.1.12 SSH 614 Server: Encrypted packet (len=548)
   39 0.307537425  10.6.15.156 → 192.168.1.12 SSH 1022 Server: Encrypted packet (len=956)
   40 0.307798610  10.6.15.156 → 192.168.1.12 SSH 1070 Server: Encrypted packet (len=1004)
   41 0.308043338  10.6.15.156 → 192.168.1.12 SSH 958 Server: Encrypted packet (len=892)
   42 0.309182334  10.6.15.156 → 192.168.1.12 SSH 1454 Server: Encrypted packet (len=1388)
   43 0.309226618  10.6.15.156 → 192.168.1.12 SSH 638 Server: Encrypted packet (len=572)
   44 0.309460686  10.6.15.156 → 192.168.1.12 SSH 662 Server: Encrypted packet (len=596)
   45 0.309716273  10.6.15.156 → 192.168.1.12 SSH 958 Server: Encrypted packet (len=892)
   46 0.310339464  10.6.15.156 → 192.168.1.12 SSH 1166 Server: Encrypted packet (len=1100)
   47 0.339320140  10.6.15.156 → 192.168.1.12 SSH 190 Server: Encrypted packet (len=124)
   48 0.400634441  10.6.15.156 → 192.168.1.12 SSH 238 Server: Encrypted packet (len=172)
   49 0.711930889 192.168.1.12 → 10.6.15.156  TCP 66 54766 → 22 [ACK] Seq=1 Ack=14953 Win=6155 Len=0 TSval=8304039 TSecr=15235541
   50 0.711941218 192.168.1.12 → 10.6.15.156  TCP 66 54766 → 22 [ACK] Seq=1 Ack=16173 Win=6155 Len=0 TSval=8304039 TSecr=15235541
   51 0.711942971 192.168.1.12 → 10.6.15.156  TCP 66 54766 → 22 [ACK] Seq=1 Ack=17097 Win=6155 Len=0 TSval=8304039 TSecr=15235541
   52 0.711944639 192.168.1.12 → 10.6.15.156  TCP 66 54766 → 22 [ACK] Seq=1 Ack=17213 Win=6155 Len=0 TSval=8304039 TSecr=15235541
   53 0.711946374 192.168.1.12 → 10.6.15.156  TCP 66 54766 → 22 [ACK] Seq=1 Ack=18081 Win=6155 Len=0 TSval=8304039 TSecr=15235541
   54 0.711947950 192.168.1.12 → 10.6.15.156  TCP 66 54766 → 22 [ACK] Seq=1 Ack=18413 Win=6155 Len=0 TSval=8304039 TSecr=15235541
   55 0.711949557 192.168.1.12 → 10.6.15.156  TCP 66 54766 → 22 [ACK] Seq=1 Ack=18865 Win=6155 Len=0 TSval=8304040 TSecr=15235541
   56 0.711951078 192.168.1.12 → 10.6.15.156  TCP 66 54766 → 22 [ACK] Seq=1 Ack=19413 Win=6155 Len=0 TSval=8304049 TSecr=15235551
   57 0.711952763 192.168.1.12 → 10.6.15.156  TCP 66 54766 → 22 [ACK] Seq=1 Ack=20369 Win=6155 Len=0 TSval=8304049 TSecr=15235551
   58 0.711954229 192.168.1.12 → 10.6.15.156  TCP 66 54766 → 22 [ACK] Seq=1 Ack=21373 Win=6155 Len=0 TSval=8304049 TSecr=15235551
   59 0.711955852 192.168.1.12 → 10.6.15.156  TCP 66 54766 → 22 [ACK] Seq=1 Ack=22265 Win=6155 Len=0 TSval=8304050 TSecr=15235552
   60 0.711957385 192.168.1.12 → 10.6.15.156  TCP 66 54766 → 22 [ACK] Seq=1 Ack=24225 Win=6155 Len=0 TSval=8304050 TSecr=15235552
   61 0.711959093 192.168.1.12 → 10.6.15.156  TCP 66 54766 → 22 [ACK] Seq=1 Ack=24821 Win=6155 Len=0 TSval=8304050 TSecr=15235552
   62 0.711960639 192.168.1.12 → 10.6.15.156  TCP 66 54766 → 22 [ACK] Seq=1 Ack=25713 Win=6155 Len=0 TSval=8304050 TSecr=15235552
   63 0.711962161 192.168.1.12 → 10.6.15.156  TCP 66 54766 → 22 [ACK] Seq=1 Ack=26813 Win=6155 Len=0 TSval=8304050 TSecr=15235552
   64 0.711963717 192.168.1.12 → 10.6.15.156  SSH 214 Client: Encrypted packet (len=148)
   65 0.711966940 192.168.1.12 → 10.6.15.156  TCP 66 54766 → 22 [ACK] Seq=149 Ack=26937 Win=6155 Len=0 TSval=8304068 TSecr=15235559
   66 0.711968805 192.168.1.12 → 10.6.15.156  SSH 534 Client: Encrypted packet (len=468)
   67 0.714173751  10.6.15.156 → 192.168.1.12 SSH 1514 Server: Encrypted packet (len=1448)
   68 0.714189988 192.168.1.12 → 10.6.15.156  TCP 682 [TCP Retransmission] 54766 → 22 [PSH, ACK] Seq=1 Ack=27109 Win=6155 Len=616 TSval=8304151 TSecr=15235586
   69 0.714298810  10.6.15.156 → 192.168.1.12 SSH 1182 Server: Encrypted packet (len=1116)
   70 0.714302171 192.168.1.12 → 10.6.15.156  TCP 66 54766 → 22 [ACK] Seq=617 Ack=29673 Win=6155 Len=0 TSval=8304151 TSecr=15235586
   71 0.714497645  10.6.15.156 → 192.168.1.12 SSH 1514 Server: Encrypted packet (len=1448)
   72 0.714870061  10.6.15.156 → 192.168.1.12 SSH 1514 Server: Encrypted packet (len=1448)
   73 0.714876826 192.168.1.12 → 10.6.15.156  TCP 66 54766 → 22 [ACK] Seq=617 Ack=32569 Win=6155 Len=0 TSval=8304151 TSecr=15235616
   74 0.715044370  10.6.15.156 → 192.168.1.12 SSH 1514 Server: Encrypted packet (len=1448)
   75 0.715253094  10.6.15.156 → 192.168.1.12 SSH 1514 Server: Encrypted packet (len=1448)
   76 0.715259803 192.168.1.12 → 10.6.15.156  TCP 66 54766 → 22 [ACK] Seq=617 Ack=35465 Win=6155 Len=0 TSval=8304151 TSecr=15235653
   77 0.715592825  10.6.15.156 → 192.168.1.12 SSH 1514 Server: Encrypted packet (len=1448)
   78 0.715765465  10.6.15.156 → 192.168.1.12 SSH 1514 Server: Encrypted packet (len=1448)
   79 0.715769128 192.168.1.12 → 10.6.15.156  TCP 66 54766 → 22 [ACK] Seq=617 Ack=38361 Win=6155 Len=0 TSval=8304151 TSecr=15235653
   80 0.715972486  10.6.15.156 → 192.168.1.12 SSH 1514 Server: Encrypted packet (len=1448)
   81 0.718008344  10.6.15.156 → 192.168.1.12 SSH 1514 Server: Encrypted packet (len=1448)
   82 0.718016895 192.168.1.12 → 10.6.15.156  TCP 66 54766 → 22 [ACK] Seq=617 Ack=41257 Win=6155 Len=0 TSval=8304152 TSecr=15235653
   83 0.718191915  10.6.15.156 → 192.168.1.12 SSH 1514 Server: Encrypted packet (len=1448)
   84 0.718197798  10.6.15.156 → 192.168.1.12 SSH 1514 Server: Encrypted packet (len=1448)
   85 0.718203084 192.168.1.12 → 10.6.15.156  TCP 66 54766 → 22 [ACK] Seq=617 Ack=44153 Win=6155 Len=0 TSval=8304152 TSecr=15235653
   86 0.718209712  10.6.15.156 → 192.168.1.12 SSH 1514 Server: Encrypted packet (len=1448)
   87 0.718212148  10.6.15.156 → 192.168.1.12 SSH 1514 Server: Encrypted packet (len=1448)
   88 0.718214648 192.168.1.12 → 10.6.15.156  TCP 66 54766 → 22 [ACK] Seq=617 Ack=47049 Win=6155 Len=0 TSval=8304152 TSecr=15235653
   89 0.720472470  10.6.15.156 → 192.168.1.12 SSH 1514 Server: Encrypted packet (len=1448)
   90 0.720597114  10.6.15.156 → 192.168.1.12 SSH 1514 Server: Encrypted packet (len=1448)
   91 0.720605366 192.168.1.12 → 10.6.15.156  TCP 66 54766 → 22 [ACK] Seq=617 Ack=49945 Win=6155 Len=0 TSval=8304153 TSecr=15235653
   92 0.720787625  10.6.15.156 → 192.168.1.12 SSH 1514 Server: Encrypted packet (len=1448)
   93 0.720980553  10.6.15.156 → 192.168.1.12 SSH 1514 Server: Encrypted packet (len=1448)
   94 0.720988933 192.168.1.12 → 10.6.15.156  TCP 66 54766 → 22 [ACK] Seq=617 Ack=52841 Win=6155 Len=0 TSval=8304153 TSecr=15235653
   95 0.721183897  10.6.15.156 → 192.168.1.12 SSH 1514 Server: Encrypted packet (len=1448)
   96 0.721361280  10.6.15.156 → 192.168.1.12 SSH 1514 Server: Encrypted packet (len=1448)
   97 0.721367652 192.168.1.12 → 10.6.15.156  TCP 66 54766 → 22 [ACK] Seq=617 Ack=55737 Win=6155 Len=0 TSval=8304153 TSecr=15235653
   98 0.721554926  10.6.15.156 → 192.168.1.12 SSH 1514 Server: Encrypted packet (len=1448)
   99 0.721561304  10.6.15.156 → 192.168.1.12 SSH 1514 Server: Encrypted packet (len=1448)
  100 0.721565659 192.168.1.12 → 10.6.15.156  TCP 66 54766 → 22 [ACK] Seq=617 Ack=58633 Win=6155 Len=0 TSval=8304153 TSecr=15235653
  101 0.721745320  10.6.15.156 → 192.168.1.12 SSH 1514 Server: Encrypted packet (len=1448)
  102 0.721753119 192.168.1.12 → 10.6.15.156  SSH 102 Client: Encrypted packet (len=36)
  103 0.723893711  10.6.15.156 → 192.168.1.12 SSH 1514 Server: Encrypted packet (len=1448)
  104 0.723908541  10.6.15.156 → 192.168.1.12 TCP 78 [TCP Dup ACK 103#1] 22 → 54766 [ACK] Seq=61529 Ack=617 Win=1452 Len=0 TSval=15235654 TSecr=8304151 SLE=1 SRE=617
  105 0.724079032  10.6.15.156 → 192.168.1.12 SSH 1514 Server: Encrypted packet (len=1448)
  106 0.724083859 192.168.1.12 → 10.6.15.156  TCP 66 54766 → 22 [ACK] Seq=653 Ack=62977 Win=6155 Len=0 TSval=8304154 TSecr=15235653
  107 0.724269817  10.6.15.156 → 192.168.1.12 SSH 1514 Server: Encrypted packet (len=1448)
  108 0.724312829  10.6.15.156 → 192.168.1.12 SSH 526 Server: Encrypted packet (len=460)
  109 0.724315624 192.168.1.12 → 10.6.15.156  TCP 66 54766 → 22 [ACK] Seq=653 Ack=64885 Win=6155 Len=0 TSval=8304154 TSecr=15235654
  110 0.759915780  10.6.15.156 → 192.168.1.12 TCP 66 22 → 54766 [ACK] Seq=64885 Ack=653 Win=1452 Len=0 TSval=15235665 TSecr=8304153
  111 0.789949328  10.6.15.156 → 192.168.1.12 SSH 206 Server: Encrypted packet (len=140)
  112 0.831875694 192.168.1.12 → 10.6.15.156  TCP 66 54766 → 22 [ACK] Seq=653 Ack=65025 Win=6155 Len=0 TSval=8304181 TSecr=15235672
  113 0.851553639  10.6.15.156 → 192.168.1.12 SSH 246 Server: Encrypted packet (len=180)
  114 0.851620363 192.168.1.12 → 10.6.15.156  TCP 66 54766 → 22 [ACK] Seq=653 Ack=65205 Win=6155 Len=0 TSval=8304185 TSecr=15235687
  115 0.906433407  10.6.15.156 → 192.168.1.12 SSH 238 Server: Encrypted packet (len=172)
  116 0.906502304 192.168.1.12 → 10.6.15.156  TCP 66 54766 → 22 [ACK] Seq=653 Ack=65377 Win=6155 Len=0 TSval=8304199 TSecr=15235701
  117 0.923992282  10.6.15.156 → 192.168.1.12 SSH 238 Server: Encrypted packet (len=172)
  118 1.026212027  10.6.15.156 → 192.168.1.12 SSH 1514 Server: Encrypted packet (len=1448)
  119 1.026228563  10.6.15.156 → 192.168.1.12 SSH 438 Server: Encrypted packet (len=372)
  120 1.032898810  10.6.15.156 → 192.168.1.12 SSH 1514 Server: Encrypted packet (len=1448)
  121 1.032944551  10.6.15.156 → 192.168.1.12 SSH 606 Server: Encrypted packet (len=540)
  122 1.065953598  10.6.15.156 → 192.168.1.12 SSH 1514 Server: Encrypted packet (len=1448)
  123 1.065970169  10.6.15.156 → 192.168.1.12 SSH 446 Server: Encrypted packet (len=380)
  124 1.432005687 192.168.1.12 → 91.189.89.199 NTP 90 NTP Version 4, client
  125 1.432014739 192.168.1.12 → 10.6.15.156  TCP 66 54766 → 22 [ACK] Seq=653 Ack=65549 Win=6155 Len=0 TSval=8304204 TSecr=15235706
  126 1.432018054 192.168.1.12 → 10.6.15.156  TCP 66 54766 → 22 [ACK] Seq=653 Ack=67369 Win=6155 Len=0 TSval=8304229 TSecr=15235731
  127 1.432019628 192.168.1.12 → 10.6.15.156  TCP 66 54766 → 22 [ACK] Seq=653 Ack=69357 Win=6155 Len=0 TSval=8304231 TSecr=15235733
  128 1.432021269 192.168.1.12 → 10.6.15.156  TCP 66 54766 → 22 [ACK] Seq=653 Ack=71185 Win=6155 Len=0 TSval=8304239 TSecr=15235740
  129 1.432023086 192.168.1.12 → 10.6.15.156  SSH 238 Client: Encrypted packet (len=172)
  130 1.432025652 192.168.1.12 → 10.6.15.156  SSH 610 Client: Encrypted packet (len=544)
  131 1.433715208  10.6.15.156 → 192.168.1.12 SSH 446 Server: [TCP Spurious Retransmission] , Encrypted packet (len=380)
  132 1.433736107 192.168.1.12 → 10.6.15.156  TCP 78 [TCP Dup ACK 128#1] 54766 → 22 [ACK] Seq=1369 Ack=71185 Win=6155 Len=0 TSval=8304331 TSecr=15235768 SLE=70805 SRE=71185
  133 1.433749604  10.6.15.156 → 192.168.1.12 SSH 342 Server: Encrypted packet (len=276)
  134 1.433763463 192.168.1.12 → 10.6.15.156  TCP 66 54766 → 22 [ACK] Seq=1369 Ack=71461 Win=6155 Len=0 TSval=8304331 TSecr=15235785
  135 1.433770680  10.6.15.156 → 192.168.1.12 SSH 254 Server: Encrypted packet (len=188)
  136 1.433774452 192.168.1.12 → 10.6.15.156  TCP 66 54766 → 22 [ACK] Seq=1369 Ack=71649 Win=6155 Len=0 TSval=8304331 TSecr=15235800
  137 1.433968210  10.6.15.156 → 192.168.1.12 SSH 1514 Server: Encrypted packet (len=1448)
  138 1.433975277 192.168.1.12 → 10.6.15.156  TCP 66 54766 → 22 [ACK] Seq=1369 Ack=73097 Win=6155 Len=0 TSval=8304331 TSecr=15235801
  139 1.434147404  10.6.15.156 → 192.168.1.12 SSH 1514 Server: Encrypted packet (len=1448)
  140 1.434154516 192.168.1.12 → 10.6.15.156  TCP 66 54766 → 22 [ACK] Seq=1369 Ack=74545 Win=6155 Len=0 TSval=8304331 TSecr=15235801
  141 1.434244731  10.6.15.156 → 192.168.1.12 SSH 902 Server: Encrypted packet (len=836)
  142 1.434249466 192.168.1.12 → 10.6.15.156  TCP 66 54766 → 22 [ACK] Seq=1369 Ack=75381 Win=6155 Len=0 TSval=8304331 TSecr=15235801
  143 1.434258036  10.6.15.156 → 192.168.1.12 SSH 254 Server: Encrypted packet (len=188)
  144 1.434260769 192.168.1.12 → 10.6.15.156  TCP 66 54766 → 22 [ACK] Seq=1369 Ack=75569 Win=6155 Len=0 TSval=8304331 TSecr=15235814
  145 1.434299401  10.6.15.156 → 192.168.1.12 SSH 254 Server: Encrypted packet (len=188)
  146 1.434303225 192.168.1.12 → 10.6.15.156  TCP 66 54766 → 22 [ACK] Seq=1369 Ack=75757 Win=6155 Len=0 TSval=8304331 TSecr=15235818
  147 1.440497787  10.6.15.156 → 192.168.1.12 TCP 66 22 → 54766 [ACK] Seq=75757 Ack=825 Win=1452 Len=0 TSval=15235833 TSecr=8304244
  148 1.440513093  10.6.15.156 → 192.168.1.12 TCP 66 22 → 54766 [ACK] Seq=75757 Ack=1369 Win=1452 Len=0 TSval=15235833 TSecr=8304320
  149 1.440535366 10.119.73.122 → 192.168.1.12 ICMP 110 Destination unreachable (Communication administratively filtered)
  150 1.465981635 192.168.1.12 → 10.6.15.156  SSH 1422 Client: Encrypted packet (len=1356)
  151 1.468620757  10.6.15.156 → 192.168.1.12 TCP 66 22 → 54766 [ACK] Seq=75757 Ack=2725 Win=1452 Len=0 TSval=15235842 TSecr=8304339
  152 1.470092255 192.168.1.12 → 10.6.15.156  SSH 182 Client: Encrypted packet (len=116)
  153 1.471143814 192.168.1.12 → 10.6.15.156  SSH 1514 Client: Encrypted packet (len=1448)
  154 1.471964619 192.168.1.12 → 10.6.15.156  SSH 1514 Client: Encrypted packet (len=1448)
  155 1.472071845  10.6.15.156 → 192.168.1.12 TCP 66 22 → 54766 [ACK] Seq=75757 Ack=2841 Win=1452 Len=0 TSval=15235843 TSecr=8304340
  156 1.477459920 192.168.1.12 → 10.6.15.156  SSH 546 Client: Encrypted packet (len=480)
  157 1.479083723  10.6.15.156 → 192.168.1.12 TCP 66 22 → 54766 [ACK] Seq=75757 Ack=5737 Win=1452 Len=0 TSval=15235844 TSecr=8304340
  158 1.479100497  10.6.15.156 → 192.168.1.12 TCP 66 22 → 54766 [ACK] Seq=75757 Ack=6217 Win=1452 Len=0 TSval=15235844 TSecr=8304342
  159 1.510404414 192.168.1.12 → 10.6.15.156  SSH 926 Client: Encrypted packet (len=860)
  160 1.513284036  10.6.15.156 → 192.168.1.12 TCP 66 22 → 54766 [ACK] Seq=75757 Ack=7077 Win=1452 Len=0 TSval=15235853 TSecr=8304350
  161 1.528577549 192.168.1.12 → 10.6.15.156  SSH 198 Client: Encrypted packet (len=132)
  162 1.528908827 192.168.1.12 → 10.6.15.156  SSH 1514 Client: Encrypted packet (len=1448)
  163 1.529783758 192.168.1.12 → 10.6.15.156  SSH 310 Client: Encrypted packet (len=244)
  164 1.530102921 192.168.1.12 → 10.6.15.156  SSH 174 Client: Encrypted packet (len=108)
  165 1.530453894  10.6.15.156 → 192.168.1.12 TCP 66 22 → 54766 [ACK] Seq=75757 Ack=7209 Win=1452 Len=0 TSval=15235857 TSecr=8304355
  166 1.531337958  10.6.15.156 → 192.168.1.12 TCP 66 22 → 54766 [ACK] Seq=75757 Ack=8901 Win=1452 Len=0 TSval=15235857 TSecr=8304355
  167 1.531352702 192.168.1.12 → 10.6.15.156  SSH 598 Client: Encrypted packet (len=532)
  168 1.531368404  10.6.15.156 → 192.168.1.12 TCP 66 22 → 54766 [ACK] Seq=75757 Ack=9009 Win=1452 Len=0 TSval=15235857 TSecr=8304355
  169 1.533000646 192.168.1.12 → 10.6.15.156  SSH 1514 Client: Encrypted packet (len=1448)
  170 1.533888852 192.168.1.12 → 10.6.15.156  SSH 1514 Client: Encrypted packet (len=1448)
  171 1.533989150  10.6.15.156 → 192.168.1.12 TCP 66 22 → 54766 [ACK] Seq=75757 Ack=9541 Win=1452 Len=0 TSval=15235858 TSecr=8304355
  172 1.534904627 192.168.1.12 → 10.6.15.156  SSH 1514 Client: Encrypted packet (len=1448)
  173 1.535789706 192.168.1.12 → 10.6.15.156  SSH 1514 Client: Encrypted packet (len=1448)
  174 1.536677834 192.168.1.12 → 10.6.15.156  SSH 1514 Client: Encrypted packet (len=1448)
  175 1.536769094  10.6.15.156 → 192.168.1.12 TCP 66 22 → 54766 [ACK] Seq=75757 Ack=12437 Win=1452 Len=0 TSval=15235859 TSecr=8304356
  176 1.537694777 192.168.1.12 → 10.6.15.156  SSH 1514 Client: Encrypted packet (len=1448)
  177 1.538554740 192.168.1.12 → 10.6.15.156  SSH 1514 Client: Encrypted packet (len=1448)
  178 1.538676989  10.6.15.156 → 192.168.1.12 TCP 66 22 → 54766 [ACK] Seq=75757 Ack=15333 Win=1452 Len=0 TSval=15235859 TSecr=8304356
  179 1.539609526 192.168.1.12 → 10.6.15.156  SSH 1514 Client: Encrypted packet (len=1448)
  180 1.540467641 192.168.1.12 → 10.6.15.156  SSH 1514 Client: Encrypted packet (len=1448)
  181 1.540573056  10.6.15.156 → 192.168.1.12 TCP 66 22 → 54766 [ACK] Seq=75757 Ack=18229 Win=1452 Len=0 TSval=15235860 TSecr=8304357
  182 1.541506296 192.168.1.12 → 10.6.15.156  SSH 1514 Client: Encrypted packet (len=1448)
  183 1.542364632 192.168.1.12 → 10.6.15.156  SSH 1514 Client: Encrypted packet (len=1448)
  184 1.542466915  10.6.15.156 → 192.168.1.12 TCP 66 22 → 54766 [ACK] Seq=75757 Ack=21125 Win=1452 Len=0 TSval=15235860 TSecr=8304357
  185 1.543392681 192.168.1.12 → 10.6.15.156  SSH 1514 Client: Encrypted packet (len=1448)
  186 1.544111138 192.168.1.12 → 10.6.15.156  SSH 1514 Client: Encrypted packet (len=1448)
  187 1.544229060  10.6.15.156 → 192.168.1.12 TCP 66 22 → 54766 [ACK] Seq=75757 Ack=24021 Win=1452 Len=0 TSval=15235861 TSecr=8304358
  188 1.545158892 192.168.1.12 → 10.6.15.156  SSH 1514 Client: Encrypted packet (len=1448)
  189 1.546047211 192.168.1.12 → 10.6.15.156  SSH 1514 Client: Encrypted packet (len=1448)
  190 1.546149737  10.6.15.156 → 192.168.1.12 TCP 66 22 → 54766 [ACK] Seq=75757 Ack=26917 Win=1452 Len=0 TSval=15235861 TSecr=8304358
  191 1.547084771 192.168.1.12 → 10.6.15.156  SSH 1514 Client: Encrypted packet (len=1448)
  192 1.547974966 192.168.1.12 → 10.6.15.156  SSH 1514 Client: Encrypted packet (len=1448)
  193 1.548076400  10.6.15.156 → 192.168.1.12 TCP 66 22 → 54766 [ACK] Seq=75757 Ack=29813 Win=1452 Len=0 TSval=15235861 TSecr=8304359
  194 1.549006629 192.168.1.12 → 10.6.15.156  SSH 1514 Client: Encrypted packet (len=1448)
  195 1.549877788 192.168.1.12 → 10.6.15.156  SSH 1514 Client: Encrypted packet (len=1448)
  196 1.549976712  10.6.15.156 → 192.168.1.12 TCP 66 22 → 54766 [ACK] Seq=75757 Ack=32709 Win=1452 Len=0 TSval=15235862 TSecr=8304359
  197 1.550915889 192.168.1.12 → 10.6.15.156  SSH 1514 Client: Encrypted packet (len=1448)
  198 1.551794044 192.168.1.12 → 10.6.15.156  SSH 1514 Client: Encrypted packet (len=1448)
  199 1.551896703  10.6.15.156 → 192.168.1.12 TCP 66 22 → 54766 [ACK] Seq=75757 Ack=35605 Win=1452 Len=0 TSval=15235862 TSecr=8304360
  200 1.552834520 192.168.1.12 → 10.6.15.156  SSH 1514 Client: Encrypted packet (len=1448)
  201 1.553711492 192.168.1.12 → 10.6.15.156  SSH 1514 Client: Encrypted packet (len=1448)
  202 1.553814691  10.6.15.156 → 192.168.1.12 TCP 66 22 → 54766 [ACK] Seq=75757 Ack=38501 Win=1452 Len=0 TSval=15235863 TSecr=8304360
  203 1.554739097 192.168.1.12 → 10.6.15.156  SSH 1514 Client: Encrypted packet (len=1448)
  204 1.555614612 192.168.1.12 → 10.6.15.156  SSH 1514 Client: Encrypted packet (len=1448)
  205 1.558559122 192.168.1.12 → 10.6.15.156  SSH 1514 Client: Encrypted packet (len=1448)
  206 1.558655765  10.6.15.156 → 192.168.1.12 TCP 66 22 → 54766 [ACK] Seq=75757 Ack=41397 Win=1452 Len=0 TSval=15235863 TSecr=8304360
  207 1.558675241  10.6.15.156 → 192.168.1.12 TCP 66 22 → 54766 [ACK] Seq=75757 Ack=44293 Win=1452 Len=0 TSval=15235864 TSecr=8304361
  208 1.559613144 192.168.1.12 → 10.6.15.156  SSH 1514 Client: Encrypted packet (len=1448)
  209 1.560506855 192.168.1.12 → 10.6.15.156  SSH 1514 Client: Encrypted packet (len=1448)
  210 1.561329470 192.168.1.12 → 10.6.15.156  SSH 1514 Client: Encrypted packet (len=1448)
  211 1.561425100  10.6.15.156 → 192.168.1.12 TCP 66 22 → 54766 [ACK] Seq=75757 Ack=47189 Win=1452 Len=0 TSval=15235865 TSecr=8304361
  212 1.562291291 192.168.1.12 → 10.6.15.156  SSH 1514 Client: Encrypted packet (len=1448)
  213 1.563119702 192.168.1.12 → 10.6.15.156  SSH 1514 Client: Encrypted packet (len=1448)
  214 1.563217771  10.6.15.156 → 192.168.1.12 TCP 66 22 → 54766 [ACK] Seq=75757 Ack=50085 Win=1452 Len=0 TSval=15235865 TSecr=8304362
  215 1.564075168 192.168.1.12 → 10.6.15.156  SSH 1514 Client: Encrypted packet (len=1448)
  216 1.565272266 192.168.1.12 → 10.6.15.156  SSH 1514 Client: Encrypted packet (len=1448)
  217 1.565371812  10.6.15.156 → 192.168.1.12 TCP 66 22 → 54766 [ACK] Seq=75757 Ack=52981 Win=1452 Len=0 TSval=15235866 TSecr=8304363
  218 1.566238080 192.168.1.12 → 10.6.15.156  SSH 1514 Client: Encrypted packet (len=1448)
  219 1.571712645 192.168.1.12 → 10.6.15.156  SSH 1514 Client: Encrypted packet (len=1448)
  220 1.572530741 192.168.1.12 → 10.6.15.156  SSH 1514 Client: Encrypted packet (len=1448)
  221 1.573355452 192.168.1.12 → 10.6.15.156  SSH 1514 Client: Encrypted packet (len=1448)
  222 1.573475799  10.6.15.156 → 192.168.1.12 TCP 66 22 → 54766 [ACK] Seq=75757 Ack=55877 Win=1452 Len=0 TSval=15235866 TSecr=8304363
  223 1.573614449  10.6.15.156 → 192.168.1.12 TCP 66 22 → 54766 [ACK] Seq=75757 Ack=58773 Win=1452 Len=0 TSval=15235868 TSecr=8304364
  224 1.574490231 192.168.1.12 → 10.6.15.156  SSH 1514 Client: Encrypted packet (len=1448)
  225 1.575312912 192.168.1.12 → 10.6.15.156  SSH 1514 Client: Encrypted packet (len=1448)
  226 1.580814394 192.168.1.12 → 10.6.15.156  SSH 1514 Client: Encrypted packet (len=1448)
  227 1.581638077 192.168.1.12 → 10.6.15.156  SSH 1514 Client: Encrypted packet (len=1448)
  228 1.581798043  10.6.15.156 → 192.168.1.12 SSH 102 Server: Encrypted packet (len=36)
  229 1.581868932  10.6.15.156 → 192.168.1.12 SSH 142 Server: Encrypted packet (len=76)
  230 1.581893474 192.168.1.12 → 10.6.15.156  TCP 66 54766 → 22 [ACK] Seq=68909 Ack=75869 Win=6155 Len=0 TSval=8304368 TSecr=15235868
  231 1.582034307  10.6.15.156 → 192.168.1.12 TCP 66 22 → 54766 [ACK] Seq=75869 Ack=64565 Win=1452 Len=0 TSval=15235869 TSecr=8304366
  232 1.582950659 192.168.1.12 → 10.6.15.156  SSH 1514 Client: Encrypted packet (len=1448)
  233 1.582959068 192.168.1.12 → 10.6.15.156  SSH 1514 Client: Encrypted packet (len=1448)
  234 1.584448359 192.168.1.12 → 10.6.15.156  SSH 1514 Client: Encrypted packet (len=1448)
  235 1.584552048  10.6.15.156 → 192.168.1.12 TCP 66 22 → 54766 [ACK] Seq=75869 Ack=67461 Win=1452 Len=0 TSval=15235870 TSecr=8304366
  236 1.585426851 192.168.1.12 → 10.6.15.156  SSH 1514 Client: Encrypted packet (len=1448)
  237 1.585601807  10.6.15.156 → 192.168.1.12 TCP 66 22 → 54766 [ACK] Seq=75869 Ack=70357 Win=1452 Len=0 TSval=15235871 TSecr=8304368
  238 1.586469201 192.168.1.12 → 10.6.15.156  SSH 1514 Client: Encrypted packet (len=1448)
  239 1.587278526 192.168.1.12 → 10.6.15.156  SSH 1514 Client: Encrypted packet (len=1448)
  240 1.588087394 192.168.1.12 → 10.6.15.156  SSH 1514 Client: Encrypted packet (len=1448)
  241 1.588189460  10.6.15.156 → 192.168.1.12 TCP 66 22 → 54766 [ACK] Seq=75869 Ack=73253 Win=1452 Len=0 TSval=15235871 TSecr=8304368
  242 1.588209664  10.6.15.156 → 192.168.1.12 SSH 134 Server: Encrypted packet (len=68)
  243 1.589086176 192.168.1.12 → 10.6.15.156  SSH 1514 Client: Encrypted packet (len=1448)
  244 1.589200945  10.6.15.156 → 192.168.1.12 TCP 66 22 → 54766 [ACK] Seq=75937 Ack=76149 Win=1452 Len=0 TSval=15235872 TSecr=8304369
  245 1.590045281 192.168.1.12 → 10.6.15.156  SSH 1514 Client: Encrypted packet (len=1448)
  246 1.590855244 192.168.1.12 → 10.6.15.156  SSH 1514 Client: Encrypted packet (len=1448)
  247 1.590957095  10.6.15.156 → 192.168.1.12 TCP 66 22 → 54766 [ACK] Seq=75937 Ack=79045 Win=1452 Len=0 TSval=15235872 TSecr=8304369
  248 1.591833149 192.168.1.12 → 10.6.15.156  SSH 1514 Client: Encrypted packet (len=1448)
  249 1.592655791 192.168.1.12 → 10.6.15.156  SSH 1514 Client: Encrypted packet (len=1448)
  250 1.592755550  10.6.15.156 → 192.168.1.12 TCP 66 22 → 54766 [ACK] Seq=75937 Ack=81941 Win=1452 Len=0 TSval=15235873 TSecr=8304370
  251 1.594110586 192.168.1.12 → 10.6.15.156  SSH 1514 Client: Encrypted packet (len=1448)
  252 1.594245883  10.6.15.156 → 192.168.1.12 TCP 66 22 → 54766 [ACK] Seq=75937 Ack=84837 Win=1452 Len=0 TSval=15235873 TSecr=8304370
  253 1.595120104 192.168.1.12 → 10.6.15.156  SSH 1514 Client: Encrypted packet (len=1448)
  254 1.600656751 192.168.1.12 → 10.6.15.156  SSH 1514 Client: Encrypted packet (len=1448)
  255 1.601476821 192.168.1.12 → 10.6.15.156  SSH 1514 Client: Encrypted packet (len=1448)
  256 1.603258691 192.168.1.12 → 10.6.15.156  SSH 1514 Client: Encrypted packet (len=1448)
  257 1.604071629 192.168.1.12 → 10.6.15.156  SSH 1514 Client: Encrypted packet (len=1448)
  258 1.604876158 192.168.1.12 → 10.6.15.156  SSH 1514 Client: Encrypted packet (len=1448)
  259 1.605054025  10.6.15.156 → 192.168.1.12 TCP 66 22 → 54766 [ACK] Seq=75937 Ack=87733 Win=1452 Len=0 TSval=15235874 TSecr=8304371
  260 1.605192069  10.6.15.156 → 192.168.1.12 TCP 66 22 → 54766 [ACK] Seq=75937 Ack=90629 Win=1452 Len=0 TSval=15235875 TSecr=8304371
  261 1.606043880 192.168.1.12 → 10.6.15.156  SSH 1514 Client: Encrypted packet (len=1448)
  262 1.606861366 192.168.1.12 → 10.6.15.156  SSH 1514 Client: Encrypted packet (len=1448)
  263 1.609945724 192.168.1.12 → 10.6.15.156  SSH 1514 Client: Encrypted packet (len=1448)
  264 1.610046567  10.6.15.156 → 192.168.1.12 TCP 66 22 → 54766 [ACK] Seq=75937 Ack=93525 Win=1452 Len=0 TSval=15235876 TSecr=8304373
  265 1.610070565  10.6.15.156 → 192.168.1.12 SSH 134 Server: Encrypted packet (len=68)
  266 1.610076713  10.6.15.156 → 192.168.1.12 TCP 66 22 → 54766 [ACK] Seq=76005 Ack=96421 Win=1452 Len=0 TSval=15235877 TSecr=8304374
  267 1.610108029  10.6.15.156 → 192.168.1.12 SSH 166 Server: Encrypted packet (len=100)
  268 1.611000051 192.168.1.12 → 10.6.15.156  SSH 1514 Client: Encrypted packet (len=1448)
  269 1.612791116 192.168.1.12 → 10.6.15.156  SSH 1514 Client: Encrypted packet (len=1448)
  270 1.612900915  10.6.15.156 → 192.168.1.12 SSH 198 Server: Encrypted packet (len=132)
  271 1.612915953  10.6.15.156 → 192.168.1.12 SSH 134 Server: Encrypted packet (len=68)
  272 1.612935894  10.6.15.156 → 192.168.1.12 SSH 134 Server: Encrypted packet (len=68)
  273 1.612968982 192.168.1.12 → 10.6.15.156  TCP 66 54766 → 22 [ACK] Seq=103661 Ack=76373 Win=6155 Len=0 TSval=8304376 TSecr=15235878
  274 1.614914366 192.168.1.12 → 10.6.15.156  SSH 1514 Client: Encrypted packet (len=1448)
  275 1.614930095 192.168.1.12 → 10.6.15.156  SSH 1514 Client: Encrypted packet (len=1448)
  276 1.615044409  10.6.15.156 → 192.168.1.12 TCP 66 22 → 54766 [ACK] Seq=76373 Ack=102213 Win=1452 Len=0 TSval=15235878 TSecr=8304375
  277 1.616470759 192.168.1.12 → 10.6.15.156  SSH 1514 Client: Encrypted packet (len=1448)
  278 1.617283439 192.168.1.12 → 10.6.15.156  SSH 1514 Client: Encrypted packet (len=1448)
  279 1.618090940 192.168.1.12 → 10.6.15.156  SSH 1514 Client: Encrypted packet (len=1448)
  280 1.618195851  10.6.15.156 → 192.168.1.12 TCP 66 22 → 54766 [ACK] Seq=76373 Ack=105109 Win=1452 Len=0 TSval=15235879 TSecr=8304376
  281 1.619039304 192.168.1.12 → 10.6.15.156  SSH 1514 Client: Encrypted packet (len=1448)
  282 1.619214874  10.6.15.156 → 192.168.1.12 TCP 66 22 → 54766 [ACK] Seq=76373 Ack=108005 Win=1452 Len=0 TSval=15235879 TSecr=8304376
  283 1.620065418 192.168.1.12 → 10.6.15.156  SSH 1514 Client: Encrypted packet (len=1448)
  284 1.620755640 192.168.1.12 → 10.6.15.156  SSH 1514 Client: Encrypted packet (len=1448)
  285 1.620893367  10.6.15.156 → 192.168.1.12 TCP 66 22 → 54766 [ACK] Seq=76373 Ack=110901 Win=1452 Len=0 TSval=15235880 TSecr=8304377
  286 1.621757124 192.168.1.12 → 10.6.15.156  SSH 1514 Client: Encrypted packet (len=1448)
  287 1.622564126 192.168.1.12 → 10.6.15.156  SSH 1514 Client: Encrypted packet (len=1448)
  288 1.623364274 192.168.1.12 → 10.6.15.156  SSH 1514 Client: Encrypted packet (len=1448)
  289 1.623465781  10.6.15.156 → 192.168.1.12 TCP 66 22 → 54766 [ACK] Seq=76373 Ack=113797 Win=1452 Len=0 TSval=15235880 TSecr=8304377
  290 1.624349939 192.168.1.12 → 10.6.15.156  SSH 1514 Client: Encrypted packet (len=1448)
  291 1.625157793 192.168.1.12 → 10.6.15.156  SSH 1514 Client: Encrypted packet (len=1448)
  292 1.625268900  10.6.15.156 → 192.168.1.12 TCP 66 22 → 54766 [ACK] Seq=76373 Ack=116693 Win=1452 Len=0 TSval=15235881 TSecr=8304378
  293 1.625291359  10.6.15.156 → 192.168.1.12 SSH 166 Server: Encrypted packet (len=100)
  294 1.625310258  10.6.15.156 → 192.168.1.12 SSH 134 Server: Encrypted packet (len=68)
  295 1.625348570 192.168.1.12 → 10.6.15.156  TCP 66 54766 → 22 [ACK] Seq=122485 Ack=76541 Win=6155 Len=0 TSval=8304379 TSecr=15235881
  296 1.626256614 192.168.1.12 → 10.6.15.156  SSH 1514 Client: Encrypted packet (len=1448)
  297 1.626262727 192.168.1.12 → 10.6.15.156  SSH 1514 Client: Encrypted packet (len=1448)
  298 1.628900994 192.168.1.12 → 10.6.15.156  SSH 1514 Client: Encrypted packet (len=1448)
  299 1.629050195  10.6.15.156 → 192.168.1.12 TCP 66 22 → 54766 [ACK] Seq=76541 Ack=119589 Win=1452 Len=0 TSval=15235881 TSecr=8304378
  300 1.629173181  10.6.15.156 → 192.168.1.12 TCP 66 22 → 54766 [ACK] Seq=76541 Ack=122485 Win=1452 Len=0 TSval=15235882 TSecr=8304379
  301 1.630065005 192.168.1.12 → 10.6.15.156  SSH 1514 Client: Encrypted packet (len=1448)
  302 1.630884661 192.168.1.12 → 10.6.15.156  SSH 1514 Client: Encrypted packet (len=1448)
  303 1.630996601  10.6.15.156 → 192.168.1.12 TCP 66 22 → 54766 [ACK] Seq=76541 Ack=125381 Win=1452 Len=0 TSval=15235882 TSecr=8304379
  304 1.631835460 192.168.1.12 → 10.6.15.156  SSH 1514 Client: Encrypted packet (len=1448)
  305 1.633611465 192.168.1.12 → 10.6.15.156  SSH 1514 Client: Encrypted packet (len=1448)
  306 1.634423676 192.168.1.12 → 10.6.15.156  SSH 1514 Client: Encrypted packet (len=1448)
  307 1.635239743 192.168.1.12 → 10.6.15.156  SSH 1514 Client: Encrypted packet (len=1448)
  308 1.635347417  10.6.15.156 → 192.168.1.12 TCP 66 22 → 54766 [ACK] Seq=76541 Ack=128277 Win=1452 Len=0 TSval=15235883 TSecr=8304380
  309 1.635479985  10.6.15.156 → 192.168.1.12 TCP 66 22 → 54766 [ACK] Seq=76541 Ack=131173 Win=1452 Len=0 TSval=15235883 TSecr=8304380
  310 1.636996652  10.6.15.156 → 192.168.1.12 TCP 66 22 → 54766 [ACK] Seq=76541 Ack=134069 Win=1452 Len=0 TSval=15235884 TSecr=8304381
  311 1.643323110  10.6.15.156 → 192.168.1.12 SSH 166 Server: Encrypted packet (len=100)
  312 1.646267731  10.6.15.156 → 192.168.1.12 SSH 166 Server: Encrypted packet (len=100)
  313 1.646282911  10.6.15.156 → 192.168.1.12 SSH 134 Server: Encrypted packet (len=68)
  314 1.646455074  10.6.15.156 → 192.168.1.12 SSH 134 Server: Encrypted packet (len=68)
  315 1.646764812  10.6.15.156 → 192.168.1.12 SSH 134 Server: Encrypted packet (len=68)
  316 1.660115643  10.6.15.156 → 192.168.1.12 SSH 166 Server: Encrypted packet (len=100)
  317 1.660134535  10.6.15.156 → 192.168.1.12 SSH 134 Server: Encrypted packet (len=68)
  318 1.660161145  10.6.15.156 → 192.168.1.12 SSH 134 Server: Encrypted packet (len=68)
  319 1.660182126  10.6.15.156 → 192.168.1.12 SSH 126 Server: Encrypted packet (len=60)
  320 1.660206033  10.6.15.156 → 192.168.1.12 SSH 134 Server: Encrypted packet (len=68)
  321 1.660232693  10.6.15.156 → 192.168.1.12 SSH 134 Server: Encrypted packet (len=68)
  322 1.660257784  10.6.15.156 → 192.168.1.12 SSH 134 Server: Encrypted packet (len=68)
  323 1.660281446  10.6.15.156 → 192.168.1.12 SSH 134 Server: Encrypted packet (len=68)
  324 1.662033809  10.6.15.156 → 192.168.1.12 SSH 134 Server: Encrypted packet (len=68)
  325 1.692172953  10.6.15.156 → 192.168.1.12 SSH 310 Server: Encrypted packet (len=244)
  326 1.753616302  10.6.15.156 → 192.168.1.12 SSH 302 Server: Encrypted packet (len=236)
  327 1.768565423  10.6.15.156 → 192.168.1.12 SSH 1514 Server: Encrypted packet (len=1448)
  328 1.768584827  10.6.15.156 → 192.168.1.12 SSH 1054 Server: Encrypted packet (len=988)
  329 2.151967883 192.168.1.12 → 10.6.15.156  SSH 1514 Client: Encrypted packet (len=1448)
  330 2.151980605 192.168.1.12 → 10.6.15.156  TCP 66 54766 → 22 [ACK] Seq=136965 Ack=76809 Win=6155 Len=0 TSval=8304384 TSecr=15235885
  331 2.151982749 192.168.1.12 → 10.6.15.156  TCP 66 54766 → 22 [ACK] Seq=136965 Ack=76945 Win=6155 Len=0 TSval=8304384 TSecr=15235886
  332 2.151984669 192.168.1.12 → 10.6.15.156  TCP 66 54766 → 22 [ACK] Seq=136965 Ack=77241 Win=6155 Len=0 TSval=8304388 TSecr=15235889
  333 2.151986390 192.168.1.12 → 10.6.15.156  TCP 66 54766 → 22 [ACK] Seq=136965 Ack=77445 Win=6155 Len=0 TSval=8304388 TSecr=15235889
  334 2.151988258 192.168.1.12 → 10.6.15.156  TCP 66 54766 → 22 [ACK] Seq=136965 Ack=77581 Win=6155 Len=0 TSval=8304388 TSecr=15235890
  335 2.151989897 192.168.1.12 → 10.6.15.156  TCP 66 54766 → 22 [ACK] Seq=136965 Ack=77825 Win=6155 Len=0 TSval=8304407 TSecr=15235897
  336 2.151991780 192.168.1.12 → 10.6.15.156  TCP 66 54766 → 22 [ACK] Seq=136965 Ack=78061 Win=6155 Len=0 TSval=8304411 TSecr=15235913
  337 2.151993435 192.168.1.12 → 10.6.15.156  TCP 66 54766 → 22 [ACK] Seq=136965 Ack=80497 Win=6155 Len=0 TSval=8304415 TSecr=15235916
  338 2.152893731 192.168.1.12 → 10.6.15.156  SSH 1514 Client: Encrypted packet (len=1448)
  339 2.154505121  10.6.15.156 → 192.168.1.12 SSH 1514 Server: Encrypted packet (len=1448)
  340 2.155517468  10.6.15.156 → 192.168.1.12 SSH 1514 Server: Encrypted packet (len=1448)
  341 2.155540958 192.168.1.12 → 10.6.15.156  SSH 1514 Client: Encrypted packet (len=1448)
  342 2.155713872  10.6.15.156 → 192.168.1.12 SSH 1514 Server: Encrypted packet (len=1448)
  343 2.155947718  10.6.15.156 → 192.168.1.12 SSH 1514 Server: Encrypted packet (len=1448)
  344 2.155954949 192.168.1.12 → 10.6.15.156  TCP 66 54766 → 22 [ACK] Seq=139861 Ack=86289 Win=6155 Len=0 TSval=8304512 TSecr=15236013
  345 2.156152260  10.6.15.156 → 192.168.1.12 SSH 1514 Server: Encrypted packet (len=1448)
  346 2.156355020  10.6.15.156 → 192.168.1.12 SSH 1514 Server: Encrypted packet (len=1448)
  347 2.156362740 192.168.1.12 → 10.6.15.156  TCP 66 54766 → 22 [ACK] Seq=139861 Ack=89185 Win=6155 Len=0 TSval=8304512 TSecr=15236013
  348 2.156568772  10.6.15.156 → 192.168.1.12 SSH 1514 Server: Encrypted packet (len=1448)
  349 2.156942061  10.6.15.156 → 192.168.1.12 SSH 1514 Server: Encrypted packet (len=1448)
  350 2.156949157 192.168.1.12 → 10.6.15.156  TCP 66 54766 → 22 [ACK] Seq=139861 Ack=92081 Win=6155 Len=0 TSval=8304512 TSecr=15236013
  351 2.157145391  10.6.15.156 → 192.168.1.12 SSH 1514 Server: Encrypted packet (len=1448)
  352 2.157360965  10.6.15.156 → 192.168.1.12 SSH 1514 Server: Encrypted packet (len=1448)
  353 2.157368079 192.168.1.12 → 10.6.15.156  TCP 66 54766 → 22 [ACK] Seq=139861 Ack=94977 Win=6155 Len=0 TSval=8304512 TSecr=15236013
  354 2.157573727  10.6.15.156 → 192.168.1.12 SSH 1514 Server: Encrypted packet (len=1448)
  355 2.157788808  10.6.15.156 → 192.168.1.12 SSH 1514 Server: Encrypted packet (len=1448)
  356 2.157797459 192.168.1.12 → 10.6.15.156  TCP 66 54766 → 22 [ACK] Seq=139861 Ack=97873 Win=6155 Len=0 TSval=8304512 TSecr=15236013
  357 2.157999671  10.6.15.156 → 192.168.1.12 SSH 1514 Server: Encrypted packet (len=1448)
  358 2.158179003  10.6.15.156 → 192.168.1.12 SSH 1306 Server: Encrypted packet (len=1240)
  359 2.158184238 192.168.1.12 → 10.6.15.156  TCP 66 54766 → 22 [ACK] Seq=139861 Ack=100561 Win=6155 Len=0 TSval=8304512 TSecr=15236013
  360 2.159232889 192.168.1.12 → 10.6.15.156  SSH 1514 Client: Encrypted packet (len=1448)
  361 2.159242417 192.168.1.12 → 10.6.15.156  SSH 1514 Client: Encrypted packet (len=1448)
  362 2.160747157 192.168.1.12 → 10.6.15.156  SSH 1514 Client: Encrypted packet (len=1448)
  363 2.160849185  10.6.15.156 → 192.168.1.12 TCP 66 22 → 54766 [ACK] Seq=100561 Ack=139861 Win=1452 Len=0 TSval=15236015 TSecr=8304511
  364 2.161723509 192.168.1.12 → 10.6.15.156  SSH 1514 Client: Encrypted packet (len=1448)
  365 2.162539868 192.168.1.12 → 10.6.15.156  SSH 1514 Client: Encrypted packet (len=1448)
  366 2.162642291  10.6.15.156 → 192.168.1.12 TCP 66 22 → 54766 [ACK] Seq=100561 Ack=142757 Win=1452 Len=0 TSval=15236015 TSecr=8304512
  367 2.163497540 192.168.1.12 → 10.6.15.156  SSH 1514 Client: Encrypted packet (len=1448)
  368 2.164317543 192.168.1.12 → 10.6.15.156  SSH 1514 Client: Encrypted packet (len=1448)
  369 2.165140515 192.168.1.12 → 10.6.15.156  SSH 1514 Client: Encrypted packet (len=1448)
  370 2.165965566 192.168.1.12 → 10.6.15.156  SSH 1514 Client: Encrypted packet (len=1448)
  371 2.166066103  10.6.15.156 → 192.168.1.12 TCP 66 22 → 54766 [ACK] Seq=100561 Ack=145653 Win=1452 Len=0 TSval=15236016 TSecr=8304513
  372 2.166082721  10.6.15.156 → 192.168.1.12 TCP 66 22 → 54766 [ACK] Seq=100561 Ack=148549 Win=1452 Len=0 TSval=15236016 TSecr=8304513
  373 2.166957422 192.168.1.12 → 10.6.15.156  SSH 1514 Client: Encrypted packet (len=1448)
  374 2.167771069 192.168.1.12 → 10.6.15.156  SSH 1514 Client: Encrypted packet (len=1448)
  375 2.167888296  10.6.15.156 → 192.168.1.12 TCP 66 22 → 54766 [ACK] Seq=100561 Ack=151445 Win=1452 Len=0 TSval=15236016 TSecr=8304514
  376 2.168726631 192.168.1.12 → 10.6.15.156  SSH 1514 Client: Encrypted packet (len=1448)
