    1 0.000000000 192.168.1.12 → 10.6.15.156  SSH 222 Client: Encrypted packet (len=156)
    2 0.043805015  10.6.15.156 → 192.168.1.12 TCP 66 22 → 54766 [ACK] Seq=1 Ack=157 Win=1452 Len=0 TSval=15244570 TSecr=8313056
    3 0.043829507 192.168.1.12 → 10.6.15.156  SSH 542 Client: Encrypted packet (len=476)
    4 0.045595811  10.6.15.156 → 192.168.1.12 TCP 66 22 → 54766 [ACK] Seq=1 Ack=633 Win=1452 Len=0 TSval=15244570 TSecr=8313067
    5 0.082902427  10.6.15.156 → 192.168.1.12 SSH 278 Server: Encrypted packet (len=212)
    6 0.124026360  10.6.15.156 → 192.168.1.12 SSH 1514 Server: Encrypted packet (len=1448)
    7 0.124041981 192.168.1.12 → 10.6.15.156  TCP 66 54766 → 22 [ACK] Seq=633 Ack=1661 Win=6155 Len=0 TSval=8313087 TSecr=15244579
    8 0.124207036  10.6.15.156 → 192.168.1.12 SSH 1514 Server: Encrypted packet (len=1448)
    9 0.124212866  10.6.15.156 → 192.168.1.12 SSH 110 Server: Encrypted packet (len=44)
   10 0.124217727 192.168.1.12 → 10.6.15.156  TCP 66 54766 → 22 [ACK] Seq=633 Ack=3153 Win=6155 Len=0 TSval=8313087 TSecr=15244588
   11 0.124418760  10.6.15.156 → 192.168.1.12 SSH 1514 Server: Encrypted packet (len=1448)
   12 0.124625968  10.6.15.156 → 192.168.1.12 SSH 1514 Server: Encrypted packet (len=1448)
   13 0.124632203 192.168.1.12 → 10.6.15.156  TCP 66 54766 → 22 [ACK] Seq=633 Ack=6049 Win=6155 Len=0 TSval=8313088 TSecr=15244588
   14 0.124776027  10.6.15.156 → 192.168.1.12 SSH 1246 Server: Encrypted packet (len=1180)
   15 0.124964032  10.6.15.156 → 192.168.1.12 SSH 1514 Server: Encrypted packet (len=1448)
   16 0.124969160 192.168.1.12 → 10.6.15.156  TCP 66 54766 → 22 [ACK] Seq=633 Ack=8677 Win=6155 Len=0 TSval=8313088 TSecr=15244588
   17 0.125152136  10.6.15.156 → 192.168.1.12 SSH 1514 Server: Encrypted packet (len=1448)
   18 0.125156927  10.6.15.156 → 192.168.1.12 SSH 110 Server: Encrypted packet (len=44)
   19 0.125159051 192.168.1.12 → 10.6.15.156  TCP 66 54766 → 22 [ACK] Seq=633 Ack=10169 Win=6155 Len=0 TSval=8313088 TSecr=15244588
   20 0.127064862  10.6.15.156 → 192.168.1.12 SSH 1514 Server: Encrypted packet (len=1448)
   21 0.127257097  10.6.15.156 → 192.168.1.12 SSH 1514 Server: Encrypted packet (len=1448)
   22 0.127263918 192.168.1.12 → 10.6.15.156  TCP 66 54766 → 22 [ACK] Seq=633 Ack=13065 Win=6155 Len=0 TSval=8313088 TSecr=15244589
   23 0.127274740  10.6.15.156 → 192.168.1.12 SSH 110 Server: Encrypted packet (len=44)
   24 0.127454417  10.6.15.156 → 192.168.1.12 SSH 1514 Server: Encrypted packet (len=1448)
   25 0.127459903 192.168.1.12 → 10.6.15.156  TCP 66 54766 → 22 [ACK] Seq=633 Ack=14557 Win=6155 Len=0 TSval=8313088 TSecr=15244589
   26 0.127645295  10.6.15.156 → 192.168.1.12 SSH 1514 Server: Encrypted packet (len=1448)
   27 0.127652798  10.6.15.156 → 192.168.1.12 SSH 110 Server: Encrypted packet (len=44)
   28 0.127656570 192.168.1.12 → 10.6.15.156  TCP 66 54766 → 22 [ACK] Seq=633 Ack=16049 Win=6155 Len=0 TSval=8313088 TSecr=15244589
   29 0.127856593  10.6.15.156 → 192.168.1.12 SSH 1514 Server: Encrypted packet (len=1448)
   30 0.128046626  10.6.15.156 → 192.168.1.12 SSH 1514 Server: Encrypted packet (len=1448)
   31 0.128050723 192.168.1.12 → 10.6.15.156  TCP 66 54766 → 22 [ACK] Seq=633 Ack=18945 Win=6155 Len=0 TSval=8313088 TSecr=15244589
   32 0.129014422  10.6.15.156 → 192.168.1.12 SSH 1026 Server: Encrypted packet (len=960)
   33 0.144981782  10.6.15.156 → 192.168.1.12 SSH 270 Server: Encrypted packet (len=204)
   34 0.145059337 192.168.1.12 → 10.6.15.156  TCP 66 54766 → 22 [ACK] Seq=633 Ack=20109 Win=6155 Len=0 TSval=8313093 TSecr=15244590
   35 0.171291353  10.6.15.156 → 192.168.1.12 SSH 1514 Server: Encrypted packet (len=1448)
   36 0.171318900  10.6.15.156 → 192.168.1.12 SSH 470 Server: Encrypted packet (len=404)
   37 0.171329134 192.168.1.12 → 10.6.15.156  TCP 66 54766 → 22 [ACK] Seq=633 Ack=21961 Win=6155 Len=0 TSval=8313099 TSecr=15244601
   38 0.171858369  10.6.15.156 → 192.168.1.12 SSH 710 Server: Encrypted packet (len=644)
   39 0.171912535  10.6.15.156 → 192.168.1.12 SSH 470 Server: Encrypted packet (len=404)
   40 0.171956313 192.168.1.12 → 10.6.15.156  TCP 66 54766 → 22 [ACK] Seq=633 Ack=23009 Win=6155 Len=0 TSval=8313099 TSecr=15244601
   41 0.172750241  10.6.15.156 → 192.168.1.12 SSH 430 Server: Encrypted packet (len=364)
   42 0.173624988  10.6.15.156 → 192.168.1.12 SSH 286 Server: Encrypted packet (len=220)
   43 0.173692079 192.168.1.12 → 10.6.15.156  TCP 66 54766 → 22 [ACK] Seq=633 Ack=23593 Win=6155 Len=0 TSval=8313100 TSecr=15244602
   44 0.174223378  10.6.15.156 → 192.168.1.12 SSH 246 Server: Encrypted packet (len=180)
   45 0.174963667  10.6.15.156 → 192.168.1.12 SSH 278 Server: Encrypted packet (len=212)
   46 0.175033738 192.168.1.12 → 10.6.15.156  TCP 66 54766 → 22 [ACK] Seq=633 Ack=23985 Win=6155 Len=0 TSval=8313100 TSecr=15244602
   47 0.182642243  10.6.15.156 → 192.168.1.12 SSH 1514 Server: Encrypted packet (len=1448)
   48 0.182737269  10.6.15.156 → 192.168.1.12 SSH 950 Server: Encrypted packet (len=884)
   49 0.182746695 192.168.1.12 → 10.6.15.156  TCP 66 54766 → 22 [ACK] Seq=633 Ack=26317 Win=6155 Len=0 TSval=8313102 TSecr=15244604
   50 0.184797835  10.6.15.156 → 192.168.1.12 SSH 550 Server: Encrypted packet (len=484)
   51 0.199833122  10.6.15.156 → 192.168.1.12 SSH 270 Server: Encrypted packet (len=204)
   52 0.199917900 192.168.1.12 → 10.6.15.156  TCP 66 54766 → 22 [ACK] Seq=633 Ack=27005 Win=6155 Len=0 TSval=8313106 TSecr=15244605
   53 0.202029632  10.6.15.156 → 192.168.1.12 SSH 230 Server: Encrypted packet (len=164)
   54 0.217465191  10.6.15.156 → 192.168.1.12 SSH 270 Server: Encrypted packet (len=204)
   55 0.217548896 192.168.1.12 → 10.6.15.156  TCP 66 54766 → 22 [ACK] Seq=633 Ack=27373 Win=6155 Len=0 TSval=8313111 TSecr=15244609
   56 0.311796310  10.6.15.156 → 192.168.1.12 SSH 1514 Server: Encrypted packet (len=1448)
   57 0.311818838  10.6.15.156 → 192.168.1.12 SSH 446 Server: Encrypted packet (len=380)
   58 0.311829934 192.168.1.12 → 10.6.15.156  TCP 66 54766 → 22 [ACK] Seq=633 Ack=29201 Win=6155 Len=0 TSval=8313134 TSecr=15244636
   59 0.335186780  10.6.15.156 → 192.168.1.12 SSH 1514 Server: Encrypted packet (len=1448)
   60 0.335215335  10.6.15.156 → 192.168.1.12 SSH 438 Server: Encrypted packet (len=372)
   61 0.335226783 192.168.1.12 → 10.6.15.156  TCP 66 54766 → 22 [ACK] Seq=633 Ack=31021 Win=6155 Len=0 TSval=8313140 TSecr=15244642
   62 0.346559682  10.6.15.156 → 192.168.1.12 SSH 1514 Server: Encrypted packet (len=1448)
   63 0.346970708  10.6.15.156 → 192.168.1.12 SSH 606 Server: Encrypted packet (len=540)
   64 0.346984494 192.168.1.12 → 10.6.15.156  TCP 66 54766 → 22 [ACK] Seq=633 Ack=33009 Win=6155 Len=0 TSval=8313143 TSecr=15244645
   65 0.505988657  10.6.15.156 → 192.168.1.12 SSH 1514 Server: Encrypted packet (len=1448)
   66 0.506497264  10.6.15.156 → 192.168.1.12 SSH 1514 Server: Encrypted packet (len=1448)
   67 0.506506132 192.168.1.12 → 10.6.15.156  TCP 66 54766 → 22 [ACK] Seq=633 Ack=35905 Win=6155 Len=0 TSval=8313183 TSecr=15244685
   68 0.506944492  10.6.15.156 → 192.168.1.12 SSH 902 Server: Encrypted packet (len=836)
   69 0.534851072  10.6.15.156 → 192.168.1.12 SSH 190 Server: Encrypted packet (len=124)
   70 0.534927752 192.168.1.12 → 10.6.15.156  TCP 66 54766 → 22 [ACK] Seq=633 Ack=36865 Win=6155 Len=0 TSval=8313190 TSecr=15244685
   71 0.596184714  10.6.15.156 → 192.168.1.12 SSH 190 Server: Encrypted packet (len=124)
   72 0.636305352 192.168.1.12 → 10.6.15.156  TCP 66 54766 → 22 [ACK] Seq=633 Ack=36989 Win=6155 Len=0 TSval=8313216 TSecr=15244708
   73 0.652898662  10.6.15.156 → 192.168.1.12 SSH 342 Server: Encrypted packet (len=276)
   74 0.652972034 192.168.1.12 → 10.6.15.156  TCP 66 54766 → 22 [ACK] Seq=633 Ack=37265 Win=6155 Len=0 TSval=8313220 TSecr=15244721
   75 0.657145484 192.168.1.12 → 239.255.255.250 SSDP 213 M-SEARCH * HTTP/1.1 
   76 0.668580851  10.6.15.156 → 192.168.1.12 SSH 342 Server: Encrypted packet (len=276)
   77 0.668659390 192.168.1.12 → 10.6.15.156  TCP 66 54766 → 22 [ACK] Seq=633 Ack=37541 Win=6155 Len=0 TSval=8313224 TSecr=15244726
   78 0.746549001 192.168.1.12 → 10.6.15.156  SSH 238 Client: Encrypted packet (len=172)
   79 0.787873970  10.6.15.156 → 192.168.1.12 TCP 66 22 → 54766 [ACK] Seq=37541 Ack=805 Win=1452 Len=0 TSval=15244756 TSecr=8313243
   80 0.852977185 192.168.1.12 → 10.6.15.156  SSH 534 Client: Encrypted packet (len=468)
   81 0.854780940  10.6.15.156 → 192.168.1.12 TCP 66 22 → 54766 [ACK] Seq=37541 Ack=1273 Win=1452 Len=0 TSval=15244772 TSecr=8313270
   82 0.856742166 192.168.1.12 → 10.6.15.156  SSH 318 Client: Encrypted packet (len=252)
   83 0.858892812  10.6.15.156 → 192.168.1.12 TCP 66 22 → 54766 [ACK] Seq=37541 Ack=1525 Win=1452 Len=0 TSval=15244773 TSecr=8313271
   84 0.957770355 192.168.1.12 → 10.6.15.156  SSH 214 Client: Encrypted packet (len=148)
   85 0.960038690 192.168.1.12 → 10.6.15.156  SSH 1342 Client: Encrypted packet (len=1276)
   86 0.960787729 192.168.1.12 → 10.6.15.156  SSH 1014 Client: Encrypted packet (len=948)
   87 0.961489210  10.6.15.156 → 192.168.1.12 TCP 66 22 → 54766 [ACK] Seq=37541 Ack=1673 Win=1452 Len=0 TSval=15244799 TSecr=8313296
   88 0.962271439  10.6.15.156 → 192.168.1.12 TCP 66 22 → 54766 [ACK] Seq=37541 Ack=2949 Win=1452 Len=0 TSval=15244799 TSecr=8313296
   89 0.962809946  10.6.15.156 → 192.168.1.12 TCP 66 22 → 54766 [ACK] Seq=37541 Ack=3897 Win=1452 Len=0 TSval=15244799 TSecr=8313297
   90 0.963118938 192.168.1.12 → 10.6.15.156  SSH 1514 Client: Encrypted packet (len=1448)
   91 0.964917322 192.168.1.12 → 10.6.15.156  SSH 1046 Client: Encrypted packet (len=980)
   92 0.965648216  10.6.15.156 → 192.168.1.12 TCP 66 22 → 54766 [ACK] Seq=37541 Ack=5345 Win=1452 Len=0 TSval=15244800 TSecr=8313297
   93 0.966996358  10.6.15.156 → 192.168.1.12 TCP 66 22 → 54766 [ACK] Seq=37541 Ack=6325 Win=1452 Len=0 TSval=15244800 TSecr=8313298
   94 0.978315878 192.168.1.12 → 10.6.15.156  SSH 926 Client: Encrypted packet (len=860)
   95 0.983671190  10.6.15.156 → 192.168.1.12 TCP 66 22 → 54766 [ACK] Seq=37541 Ack=7185 Win=1452 Len=0 TSval=15244804 TSecr=8313301
   96 0.985053653  10.6.15.156 → 192.168.1.12 SSH 582 Server: Encrypted packet (len=516)
   97 0.985064897 192.168.1.12 → 10.6.15.156  TCP 66 54766 → 22 [ACK] Seq=7185 Ack=38057 Win=6155 Len=0 TSval=8313303 TSecr=15244805
   98 0.997474392 192.168.1.12 → 10.6.15.156  SSH 1514 Client: Encrypted packet (len=1448)
   99 1.005534315 192.168.1.12 → 10.6.15.156  SSH 1514 Client: Encrypted packet (len=1448)
  100 1.006362390 192.168.1.12 → 10.6.15.156  SSH 1514 Client: Encrypted packet (len=1448)
  101 1.007179542 192.168.1.12 → 10.6.15.156  SSH 1514 Client: Encrypted packet (len=1448)
  102 1.007996733 192.168.1.12 → 10.6.15.156  SSH 1514 Client: Encrypted packet (len=1448)
  103 1.008343397  10.6.15.156 → 192.168.1.12 TCP 66 22 → 54766 [ACK] Seq=38057 Ack=10081 Win=1452 Len=0 TSval=15244811 TSecr=8313306
  104 1.009131823 192.168.1.12 → 10.6.15.156  SSH 1514 Client: Encrypted packet (len=1448)
  105 1.012203344 192.168.1.12 → 10.6.15.156  SSH 1514 Client: Encrypted packet (len=1448)
  106 1.012378412  10.6.15.156 → 192.168.1.12 TCP 66 22 → 54766 [ACK] Seq=38057 Ack=12977 Win=1452 Len=0 TSval=15244811 TSecr=8313308
  107 1.013158611 192.168.1.12 → 10.6.15.156  SSH 1514 Client: Encrypted packet (len=1448)
  108 1.014962452 192.168.1.12 → 10.6.15.156  SSH 1514 Client: Encrypted packet (len=1448)
  109 1.015092657  10.6.15.156 → 192.168.1.12 TCP 66 22 → 54766 [ACK] Seq=38057 Ack=15873 Win=1452 Len=0 TSval=15244812 TSecr=8313308
  110 1.016847864 192.168.1.12 → 10.6.15.156  SSH 1514 Client: Encrypted packet (len=1448)
  111 1.017640964 192.168.1.12 → 10.6.15.156  SSH 1514 Client: Encrypted packet (len=1448)
  112 1.017762923  10.6.15.156 → 192.168.1.12 TCP 66 22 → 54766 [ACK] Seq=38057 Ack=18769 Win=1452 Len=0 TSval=15244813 TSecr=8313309
  113 1.018542189 192.168.1.12 → 10.6.15.156  SSH 1514 Client: Encrypted packet (len=1448)
  114 1.019345887 192.168.1.12 → 10.6.15.156  SSH 1514 Client: Encrypted packet (len=1448)
  115 1.020149444 192.168.1.12 → 10.6.15.156  SSH 1514 Client: Encrypted packet (len=1448)
  116 1.020260955  10.6.15.156 → 192.168.1.12 TCP 66 22 → 54766 [ACK] Seq=38057 Ack=21665 Win=1452 Len=0 TSval=15244813 TSecr=8313310
  117 1.021058287 192.168.1.12 → 10.6.15.156  SSH 1514 Client: Encrypted packet (len=1448)
  118 1.021868119 192.168.1.12 → 10.6.15.156  SSH 1514 Client: Encrypted packet (len=1448)
  119 1.021984772  10.6.15.156 → 192.168.1.12 TCP 66 22 → 54766 [ACK] Seq=38057 Ack=24561 Win=1452 Len=0 TSval=15244814 TSecr=8313311
  120 1.022646827  10.6.15.156 → 192.168.1.12 TCP 66 22 → 54766 [ACK] Seq=38057 Ack=27457 Win=1452 Len=0 TSval=15244814 TSecr=8313311
  121 1.024054393 192.168.1.12 → 10.6.15.156  SSH 1514 Client: Encrypted packet (len=1448)
  122 1.024165775  10.6.15.156 → 192.168.1.12 TCP 66 22 → 54766 [ACK] Seq=38057 Ack=30353 Win=1452 Len=0 TSval=15244815 TSecr=8313312
  123 1.024935902 192.168.1.12 → 10.6.15.156  SSH 1514 Client: Encrypted packet (len=1448)
  124 1.025732479 192.168.1.12 → 10.6.15.156  SSH 1514 Client: Encrypted packet (len=1448)
  125 1.026525169 192.168.1.12 → 10.6.15.156  SSH 1514 Client: Encrypted packet (len=1448)
  126 1.027317268 192.168.1.12 → 10.6.15.156  SSH 1514 Client: Encrypted packet (len=1448)
  127 1.027433652  10.6.15.156 → 192.168.1.12 TCP 66 22 → 54766 [ACK] Seq=38057 Ack=33249 Win=1452 Len=0 TSval=15244815 TSecr=8313312
  128 1.028201540 192.168.1.12 → 10.6.15.156  SSH 1514 Client: Encrypted packet (len=1448)
  129 1.028986434 192.168.1.12 → 10.6.15.156  SSH 1514 Client: Encrypted packet (len=1448)
  130 1.029141401  10.6.15.156 → 192.168.1.12 SSH 102 Server: Encrypted packet (len=36)
  131 1.029941087 192.168.1.12 → 10.6.15.156  SSH 1514 Client: Encrypted packet (len=1448)
  132 1.030721543 192.168.1.12 → 10.6.15.156  SSH 1514 Client: Encrypted packet (len=1448)
  133 1.030877209  10.6.15.156 → 192.168.1.12 TCP 66 22 → 54766 [ACK] Seq=38093 Ack=37593 Win=1452 Len=0 TSval=15244816 TSecr=8313313
  134 1.031657773 192.168.1.12 → 10.6.15.156  SSH 1514 Client: Encrypted packet (len=1448)
  135 1.031790120  10.6.15.156 → 192.168.1.12 TCP 66 22 → 54766 [ACK] Seq=38093 Ack=40489 Win=1452 Len=0 TSval=15244816 TSecr=8313313
  136 1.032579809 192.168.1.12 → 10.6.15.156  SSH 1514 Client: Encrypted packet (len=1448)
  137 1.033395407 192.168.1.12 → 10.6.15.156  SSH 1514 Client: Encrypted packet (len=1448)
  138 1.033503833  10.6.15.156 → 192.168.1.12 TCP 66 22 → 54766 [ACK] Seq=38093 Ack=43385 Win=1452 Len=0 TSval=15244817 TSecr=8313314
  139 1.034279080 192.168.1.12 → 10.6.15.156  SSH 1514 Client: Encrypted packet (len=1448)
  140 1.035073294 192.168.1.12 → 10.6.15.156  SSH 1514 Client: Encrypted packet (len=1448)
  141 1.035178661  10.6.15.156 → 192.168.1.12 TCP 66 22 → 54766 [ACK] Seq=38093 Ack=46281 Win=1452 Len=0 TSval=15244817 TSecr=8313314
  142 1.035959726 192.168.1.12 → 10.6.15.156  SSH 1514 Client: Encrypted packet (len=1448)
  143 1.036765699 192.168.1.12 → 10.6.15.156  SSH 778 Client: Encrypted packet (len=712)
  144 1.036895825  10.6.15.156 → 192.168.1.12 TCP 66 22 → 54766 [ACK] Seq=38093 Ack=49177 Win=1452 Len=0 TSval=15244818 TSecr=8313315
  145 1.037646847 192.168.1.12 → 10.6.15.156  SSH 1514 Client: Encrypted packet (len=1448)
  146 1.038461018 192.168.1.12 → 10.6.15.156  SSH 1514 Client: Encrypted packet (len=1448)
  147 1.038562338  10.6.15.156 → 192.168.1.12 TCP 66 22 → 54766 [ACK] Seq=38093 Ack=52073 Win=1452 Len=0 TSval=15244818 TSecr=8313315
  148 1.039344427 192.168.1.12 → 10.6.15.156  SSH 1514 Client: Encrypted packet (len=1448)
  149 1.040161067 192.168.1.12 → 10.6.15.156  SSH 1514 Client: Encrypted packet (len=1448)
  150 1.040261955  10.6.15.156 → 192.168.1.12 TCP 66 22 → 54766 [ACK] Seq=38093 Ack=54233 Win=1452 Len=0 TSval=15244819 TSecr=8313316
  151 1.040690411 192.168.1.12 → 10.6.15.156  SSH 1514 Client: Encrypted packet (len=1448)
  152 1.041509287 192.168.1.12 → 10.6.15.156  SSH 1514 Client: Encrypted packet (len=1448)
  153 1.042338820  10.6.15.156 → 192.168.1.12 TCP 66 22 → 54766 [ACK] Seq=38093 Ack=57129 Win=1452 Len=0 TSval=15244819 TSecr=8313316
  154 1.043440705 192.168.1.12 → 10.6.15.156  SSH 1514 Client: Encrypted packet (len=1448)
  155 1.044240056 192.168.1.12 → 10.6.15.156  SSH 1514 Client: Encrypted packet (len=1448)
  156 1.044354084  10.6.15.156 → 192.168.1.12 TCP 66 22 → 54766 [ACK] Seq=38093 Ack=60025 Win=1452 Len=0 TSval=15244819 TSecr=8313316
  157 1.045131434 192.168.1.12 → 10.6.15.156  SSH 1514 Client: Encrypted packet (len=1448)
  158 1.045927027 192.168.1.12 → 10.6.15.156  SSH 1514 Client: Encrypted packet (len=1448)
  159 1.046031294  10.6.15.156 → 192.168.1.12 TCP 66 22 → 54766 [ACK] Seq=38093 Ack=62921 Win=1452 Len=0 TSval=15244820 TSecr=8313317
  160 1.046811277 192.168.1.12 → 10.6.15.156  SSH 1514 Client: Encrypted packet (len=1448)
  161 1.047613628 192.168.1.12 → 10.6.15.156  SSH 1514 Client: Encrypted packet (len=1448)
  162 1.047787154  10.6.15.156 → 192.168.1.12 SSH 598 Server: Encrypted packet (len=532)
  163 1.048569655 192.168.1.12 → 10.6.15.156  SSH 1514 Client: Encrypted packet (len=1448)
  164 1.049363935 192.168.1.12 → 10.6.15.156  SSH 1514 Client: Encrypted packet (len=1448)
  165 1.049513125  10.6.15.156 → 192.168.1.12 TCP 66 22 → 54766 [ACK] Seq=38625 Ack=67265 Win=1452 Len=0 TSval=15244821 TSecr=8313318
  166 1.050282112 192.168.1.12 → 10.6.15.156  SSH 1514 Client: Encrypted packet (len=1448)
  167 1.050431437  10.6.15.156 → 192.168.1.12 TCP 66 22 → 54766 [ACK] Seq=38625 Ack=70161 Win=1452 Len=0 TSval=15244821 TSecr=8313318
  168 1.051222511 192.168.1.12 → 10.6.15.156  SSH 1514 Client: Encrypted packet (len=1448)
  169 1.052013467 192.168.1.12 → 10.6.15.156  SSH 1514 Client: Encrypted packet (len=1448)
  170 1.052806592 192.168.1.12 → 10.6.15.156  SSH 1514 Client: Encrypted packet (len=1448)
  171 1.052922728  10.6.15.156 → 192.168.1.12 SSH 142 Server: Encrypted packet (len=76)
  172 1.052943943  10.6.15.156 → 192.168.1.12 SSH 134 Server: Encrypted packet (len=68)
  173 1.052956208  10.6.15.156 → 192.168.1.12 TCP 66 22 → 54766 [ACK] Seq=38769 Ack=74505 Win=1452 Len=0 TSval=15244822 TSecr=8313319
  174 1.052994066 192.168.1.12 → 10.6.15.156  TCP 66 54766 → 22 [ACK] Seq=78849 Ack=38769 Win=6155 Len=0 TSval=8313320 TSecr=15244821
  175 1.053829116 192.168.1.12 → 10.6.15.156  SSH 1514 Client: Encrypted packet (len=1448)
  176 1.053835638 192.168.1.12 → 10.6.15.156  SSH 1514 Client: Encrypted packet (len=1448)
  177 1.055343460 192.168.1.12 → 10.6.15.156  SSH 1514 Client: Encrypted packet (len=1448)
  178 1.055433939  10.6.15.156 → 192.168.1.12 TCP 66 22 → 54766 [ACK] Seq=38769 Ack=77401 Win=1452 Len=0 TSval=15244822 TSecr=8313319
  179 1.056230171 192.168.1.12 → 10.6.15.156  SSH 1514 Client: Encrypted packet (len=1448)
  180 1.056406729  10.6.15.156 → 192.168.1.12 TCP 66 22 → 54766 [ACK] Seq=38769 Ack=80297 Win=1452 Len=0 TSval=15244823 TSecr=8313320
  181 1.057183408 192.168.1.12 → 10.6.15.156  SSH 1514 Client: Encrypted packet (len=1448)
  182 1.058002563  10.6.15.156 → 192.168.1.12 TCP 66 22 → 54766 [ACK] Seq=38769 Ack=83193 Win=1452 Len=0 TSval=15244823 TSecr=8313320
  183 1.059129555 192.168.1.12 → 10.6.15.156  SSH 1514 Client: Encrypted packet (len=1448)
  184 1.061295269 192.168.1.12 → 10.6.15.156  SSH 1514 Client: Encrypted packet (len=1448)
  185 1.064149804 192.168.1.12 → 10.6.15.156  SSH 1514 Client: Encrypted packet (len=1448)
  186 1.064252564  10.6.15.156 → 192.168.1.12 TCP 66 22 → 54766 [ACK] Seq=38769 Ack=86089 Win=1452 Len=0 TSval=15244824 TSecr=8313320
  187 1.065033024 192.168.1.12 → 10.6.15.156  SSH 1514 Client: Encrypted packet (len=1448)
  188 1.065854459 192.168.1.12 → 10.6.15.156  SSH 1514 Client: Encrypted packet (len=1448)
  189 1.066005677  10.6.15.156 → 192.168.1.12 TCP 66 22 → 54766 [ACK] Seq=38769 Ack=88985 Win=1452 Len=0 TSval=15244825 TSecr=8313321
  190 1.066791402 192.168.1.12 → 10.6.15.156  SSH 1514 Client: Encrypted packet (len=1448)
  191 1.067607495 192.168.1.12 → 10.6.15.156  SSH 1514 Client: Encrypted packet (len=1448)
  192 1.067743295  10.6.15.156 → 192.168.1.12 SSH 134 Server: Encrypted packet (len=68)
  193 1.067759456  10.6.15.156 → 192.168.1.12 SSH 134 Server: Encrypted packet (len=68)
  194 1.067810655 192.168.1.12 → 10.6.15.156  TCP 66 54766 → 22 [ACK] Seq=96225 Ack=38905 Win=6155 Len=0 TSval=8313323 TSecr=15244825
  195 1.067989687  10.6.15.156 → 192.168.1.12 SSH 1514 Server: Encrypted packet (len=1448)
  196 1.068113872  10.6.15.156 → 192.168.1.12 SSH 1054 Server: Encrypted packet (len=988)
  197 1.068118296 192.168.1.12 → 10.6.15.156  TCP 66 54766 → 22 [ACK] Seq=96225 Ack=41341 Win=6155 Len=0 TSval=8313323 TSecr=15244825
  198 1.069012061 192.168.1.12 → 10.6.15.156  SSH 1514 Client: Encrypted packet (len=1448)
  199 1.069026965 192.168.1.12 → 10.6.15.156  SSH 1514 Client: Encrypted packet (len=1448)
  200 1.069114486  10.6.15.156 → 192.168.1.12 TCP 66 22 → 54766 [ACK] Seq=41341 Ack=93329 Win=1452 Len=0 TSval=15244826 TSecr=8313323
  201 1.070580576 192.168.1.12 → 10.6.15.156  SSH 1514 Client: Encrypted packet (len=1448)
  202 1.070683166  10.6.15.156 → 192.168.1.12 TCP 66 22 → 54766 [ACK] Seq=41341 Ack=96225 Win=1452 Len=0 TSval=15244826 TSecr=8313323
  203 1.071485053 192.168.1.12 → 10.6.15.156  SSH 1514 Client: Encrypted packet (len=1448)
  204 1.072309948 192.168.1.12 → 10.6.15.156  SSH 1514 Client: Encrypted packet (len=1448)
  205 1.072403543  10.6.15.156 → 192.168.1.12 TCP 66 22 → 54766 [ACK] Seq=41341 Ack=99121 Win=1452 Len=0 TSval=15244827 TSecr=8313324
  206 1.073185014 192.168.1.12 → 10.6.15.156  SSH 1514 Client: Encrypted packet (len=1448)
  207 1.073998926 192.168.1.12 → 10.6.15.156  SSH 1514 Client: Encrypted packet (len=1448)
  208 1.074101041  10.6.15.156 → 192.168.1.12 TCP 66 22 → 54766 [ACK] Seq=41341 Ack=102017 Win=1452 Len=0 TSval=15244827 TSecr=8313324
  209 1.074885716 192.168.1.12 → 10.6.15.156  SSH 1514 Client: Encrypted packet (len=1448)
  210 1.078597777 192.168.1.12 → 10.6.15.156  SSH 1514 Client: Encrypted packet (len=1448)
  211 1.079419881 192.168.1.12 → 10.6.15.156  SSH 1514 Client: Encrypted packet (len=1448)
  212 1.080226577 192.168.1.12 → 10.6.15.156  SSH 1514 Client: Encrypted packet (len=1448)
  213 1.085687480 192.168.1.12 → 10.6.15.156  SSH 1514 Client: Encrypted packet (len=1448)
  214 1.086514254 192.168.1.12 → 10.6.15.156  SSH 1514 Client: Encrypted packet (len=1448)
  215 1.088167633  10.6.15.156 → 192.168.1.12 TCP 66 22 → 54766 [ACK] Seq=41341 Ack=104913 Win=1452 Len=0 TSval=15244827 TSecr=8313325
  216 1.088197088 192.168.1.12 → 10.6.15.156  SSH 1514 Client: Encrypted packet (len=1448)
  217 1.089017652 192.168.1.12 → 10.6.15.156  SSH 1514 Client: Encrypted packet (len=1448)
  218 1.089115334  10.6.15.156 → 192.168.1.12 TCP 66 22 → 54766 [ACK] Seq=41341 Ack=107809 Win=1452 Len=0 TSval=15244829 TSecr=8313325
  219 1.089130830  10.6.15.156 → 192.168.1.12 TCP 66 22 → 54766 [ACK] Seq=41341 Ack=110705 Win=1452 Len=0 TSval=15244829 TSecr=8313326
  220 1.089152655  10.6.15.156 → 192.168.1.12 SSH 166 Server: Encrypted packet (len=100)
  221 1.089172900  10.6.15.156 → 192.168.1.12 SSH 134 Server: Encrypted packet (len=68)
  222 1.089186393  10.6.15.156 → 192.168.1.12 TCP 66 22 → 54766 [ACK] Seq=41509 Ack=113601 Win=1452 Len=0 TSval=15244831 TSecr=8313326
  223 1.089218655  10.6.15.156 → 192.168.1.12 SSH 166 Server: Encrypted packet (len=100)
  224 1.089218725 192.168.1.12 → 10.6.15.156  TCP 66 54766 → 22 [ACK] Seq=117945 Ack=41509 Win=6155 Len=0 TSval=8313329 TSecr=15244829
  225 1.090106619 192.168.1.12 → 10.6.15.156  SSH 1514 Client: Encrypted packet (len=1448)
  226 1.090121991 192.168.1.12 → 10.6.15.156  SSH 1514 Client: Encrypted packet (len=1448)
  227 1.091614695 192.168.1.12 → 10.6.15.156  SSH 1514 Client: Encrypted packet (len=1448)
  228 1.091730388  10.6.15.156 → 192.168.1.12 SSH 134 Server: Encrypted packet (len=68)
  229 1.091748677  10.6.15.156 → 192.168.1.12 SSH 134 Server: Encrypted packet (len=68)
  230 1.091772600  10.6.15.156 → 192.168.1.12 SSH 134 Server: Encrypted packet (len=68)
  231 1.091785591  10.6.15.156 → 192.168.1.12 TCP 66 22 → 54766 [ACK] Seq=41813 Ack=117945 Win=1452 Len=0 TSval=15244831 TSecr=8313328
  232 1.091797220 192.168.1.12 → 10.6.15.156  TCP 66 54766 → 22 [ACK] Seq=122289 Ack=41813 Win=6155 Len=0 TSval=8313329 TSecr=15244831
  233 1.092644884 192.168.1.12 → 10.6.15.156  SSH 1514 Client: Encrypted packet (len=1448)
  234 1.092657826 192.168.1.12 → 10.6.15.156  SSH 1514 Client: Encrypted packet (len=1448)
  235 1.094148625 192.168.1.12 → 10.6.15.156  SSH 1514 Client: Encrypted packet (len=1448)
  236 1.094250216  10.6.15.156 → 192.168.1.12 TCP 66 22 → 54766 [ACK] Seq=41813 Ack=120841 Win=1452 Len=0 TSval=15244832 TSecr=8313329
  237 1.095019985 192.168.1.12 → 10.6.15.156  SSH 1514 Client: Encrypted packet (len=1448)
  238 1.095174141  10.6.15.156 → 192.168.1.12 TCP 66 22 → 54766 [ACK] Seq=41813 Ack=123737 Win=1452 Len=0 TSval=15244832 TSecr=8313329
  239 1.095960768 192.168.1.12 → 10.6.15.156  SSH 1514 Client: Encrypted packet (len=1448)
  240 1.096766150 192.168.1.12 → 10.6.15.156  SSH 1514 Client: Encrypted packet (len=1448)
  241 1.096870754  10.6.15.156 → 192.168.1.12 TCP 66 22 → 54766 [ACK] Seq=41813 Ack=126633 Win=1452 Len=0 TSval=15244833 TSecr=8313330
  242 1.097647597 192.168.1.12 → 10.6.15.156  SSH 1514 Client: Encrypted packet (len=1448)
  243 1.103135482 192.168.1.12 → 10.6.15.156  SSH 1514 Client: Encrypted packet (len=1448)
  244 1.103308889  10.6.15.156 → 192.168.1.12 TCP 66 22 → 54766 [ACK] Seq=41813 Ack=129529 Win=1452 Len=0 TSval=15244833 TSecr=8313330
  245 1.104123594 192.168.1.12 → 10.6.15.156  SSH 1514 Client: Encrypted packet (len=1448)
  246 1.104345926  10.6.15.156 → 192.168.1.12 SSH 454 Server: Encrypted packet (len=388)
  247 1.104374055  10.6.15.156 → 192.168.1.12 SSH 134 Server: Encrypted packet (len=68)
  248 1.104424093 192.168.1.12 → 10.6.15.156  TCP 66 54766 → 22 [ACK] Seq=135321 Ack=42269 Win=6155 Len=0 TSval=8313333 TSecr=15244834
  249 1.105215657 192.168.1.12 → 10.6.15.156  SSH 1514 Client: Encrypted packet (len=1448)
  250 1.105226433 192.168.1.12 → 10.6.15.156  SSH 1514 Client: Encrypted packet (len=1448)
  251 1.105730120  10.6.15.156 → 192.168.1.12 SSH 134 Server: Encrypted packet (len=68)
  252 1.105744348  10.6.15.156 → 192.168.1.12 SSH 134 Server: Encrypted packet (len=68)
  253 1.105803365 192.168.1.12 → 10.6.15.156  TCP 66 54766 → 22 [ACK] Seq=138217 Ack=42405 Win=6155 Len=0 TSval=8313333 TSecr=15244834
  254 1.107207133 192.168.1.12 → 10.6.15.156  SSH 1514 Client: Encrypted packet (len=1448)
  255 1.107218949 192.168.1.12 → 10.6.15.156  SSH 1514 Client: Encrypted packet (len=1448)
  256 1.107329293  10.6.15.156 → 192.168.1.12 TCP 66 22 → 54766 [ACK] Seq=42405 Ack=133873 Win=1452 Len=0 TSval=15244835 TSecr=8313331
  257 1.108707942 192.168.1.12 → 10.6.15.156  SSH 1514 Client: Encrypted packet (len=1448)
  258 1.108822748  10.6.15.156 → 192.168.1.12 TCP 66 22 → 54766 [ACK] Seq=42405 Ack=136769 Win=1452 Len=0 TSval=15244836 TSecr=8313332
  259 1.109608089 192.168.1.12 → 10.6.15.156  SSH 1514 Client: Encrypted packet (len=1448)
  260 1.115514233 192.168.1.12 → 10.6.15.156  SSH 1514 Client: Encrypted packet (len=1448)
  261 1.117321514 192.168.1.12 → 10.6.15.156  SSH 1514 Client: Encrypted packet (len=1448)
  262 1.117472604  10.6.15.156 → 192.168.1.12 TCP 66 22 → 54766 [ACK] Seq=42405 Ack=139665 Win=1452 Len=0 TSval=15244836 TSecr=8313333
  263 1.119218195 192.168.1.12 → 10.6.15.156  SSH 1514 Client: Encrypted packet (len=1448)
  264 1.120029281 192.168.1.12 → 10.6.15.156  SSH 1514 Client: Encrypted packet (len=1448)
  265 1.120132041  10.6.15.156 → 192.168.1.12 TCP 66 22 → 54766 [ACK] Seq=42405 Ack=142561 Win=1452 Len=0 TSval=15244836 TSecr=8313333
  266 1.120148714  10.6.15.156 → 192.168.1.12 TCP 66 22 → 54766 [ACK] Seq=42405 Ack=145457 Win=1452 Len=0 TSval=15244838 TSecr=8313334
  267 1.120232239  10.6.15.156 → 192.168.1.12 SSH 522 Server: Encrypted packet (len=456)
  268 1.120253219  10.6.15.156 → 192.168.1.12 SSH 198 Server: Encrypted packet (len=132)
  269 1.120273120  10.6.15.156 → 192.168.1.12 SSH 134 Server: Encrypted packet (len=68)
  270 1.120337645 192.168.1.12 → 10.6.15.156  TCP 66 54766 → 22 [ACK] Seq=149801 Ack=43061 Win=6155 Len=0 TSval=8313337 TSecr=15244838
  271 1.121153948 192.168.1.12 → 10.6.15.156  SSH 1514 Client: Encrypted packet (len=1448)
  272 1.121168031 192.168.1.12 → 10.6.15.156  SSH 1514 Client: Encrypted packet (len=1448)
  273 1.122669441 192.168.1.12 → 10.6.15.156  SSH 1514 Client: Encrypted packet (len=1448)
  274 1.122979191  10.6.15.156 → 192.168.1.12 TCP 66 22 → 54766 [ACK] Seq=43061 Ack=148353 Win=1452 Len=0 TSval=15244839 TSecr=8313336
  275 1.123769456 192.168.1.12 → 10.6.15.156  SSH 1514 Client: Encrypted packet (len=1448)
  276 1.124589850 192.168.1.12 → 10.6.15.156  SSH 1514 Client: Encrypted packet (len=1448)
  277 1.124698218  10.6.15.156 → 192.168.1.12 TCP 66 22 → 54766 [ACK] Seq=43061 Ack=151249 Win=1452 Len=0 TSval=15244839 TSecr=8313336
  278 1.130140962 192.168.1.12 → 10.6.15.156  SSH 1514 Client: Encrypted packet (len=1448)
  279 1.130961640 192.168.1.12 → 10.6.15.156  SSH 1514 Client: Encrypted packet (len=1448)
  280 1.131130988  10.6.15.156 → 192.168.1.12 TCP 66 22 → 54766 [ACK] Seq=43061 Ack=154145 Win=1452 Len=0 TSval=15244840 TSecr=8313337
  281 1.131159465  10.6.15.156 → 192.168.1.12 SSH 166 Server: Encrypted packet (len=100)
  282 1.131185979  10.6.15.156 → 192.168.1.12 SSH 134 Server: Encrypted packet (len=68)
  283 1.131221665 192.168.1.12 → 10.6.15.156  TCP 66 54766 → 22 [ACK] Seq=159937 Ack=43229 Win=6155 Len=0 TSval=8313339 TSecr=15244840
  284 1.132061196 192.168.1.12 → 10.6.15.156  SSH 1514 Client: Encrypted packet (len=1448)
  285 1.132075879 192.168.1.12 → 10.6.15.156  SSH 1514 Client: Encrypted packet (len=1448)
  286 1.132169987  10.6.15.156 → 192.168.1.12 SSH 134 Server: Encrypted packet (len=68)
  287 1.132184037  10.6.15.156 → 192.168.1.12 SSH 134 Server: Encrypted packet (len=68)
  288 1.132210578  10.6.15.156 → 192.168.1.12 SSH 134 Server: Encrypted packet (len=68)
  289 1.132230761 192.168.1.12 → 10.6.15.156  TCP 66 54766 → 22 [ACK] Seq=162833 Ack=43433 Win=6155 Len=0 TSval=8313339 TSecr=15244840
  290 1.132232084  10.6.15.156 → 192.168.1.12 SSH 134 Server: Encrypted packet (len=68)
  291 1.133685410 192.168.1.12 → 10.6.15.156  SSH 1514 Client: Encrypted packet (len=1448)
  292 1.133697973 192.168.1.12 → 10.6.15.156  SSH 1514 Client: Encrypted packet (len=1448)
  293 1.133814470  10.6.15.156 → 192.168.1.12 TCP 66 22 → 54766 [ACK] Seq=43501 Ack=158489 Win=1452 Len=0 TSval=15244842 TSecr=8313338
  294 1.135186044 192.168.1.12 → 10.6.15.156  SSH 1514 Client: Encrypted packet (len=1448)
  295 1.135280742  10.6.15.156 → 192.168.1.12 TCP 66 22 → 54766 [ACK] Seq=43501 Ack=161385 Win=1452 Len=0 TSval=15244842 TSecr=8313339
  296 1.136078637 192.168.1.12 → 10.6.15.156  SSH 1514 Client: Encrypted packet (len=1448)
  297 1.136880586 192.168.1.12 → 10.6.15.156  SSH 1514 Client: Encrypted packet (len=1448)
  298 1.137676803 192.168.1.12 → 10.6.15.156  SSH 1514 Client: Encrypted packet (len=1448)
  299 1.138472522 192.168.1.12 → 10.6.15.156  SSH 1514 Client: Encrypted packet (len=1448)
  300 1.139272522 192.168.1.12 → 10.6.15.156  SSH 1514 Client: Encrypted packet (len=1448)
  301 1.139374114  10.6.15.156 → 192.168.1.12 TCP 66 22 → 54766 [ACK] Seq=43501 Ack=164281 Win=1452 Len=0 TSval=15244843 TSecr=8313339
  302 1.139406851  10.6.15.156 → 192.168.1.12 SSH 202 Server: Encrypted packet (len=136)
  303 1.139422862  10.6.15.156 → 192.168.1.12 TCP 66 22 → 54766 [ACK] Seq=43637 Ack=167177 Win=1452 Len=0 TSval=15244843 TSecr=8313340
  304 1.139436115  10.6.15.156 → 192.168.1.12 TCP 66 22 → 54766 [ACK] Seq=43637 Ack=170073 Win=1452 Len=0 TSval=15244843 TSecr=8313340
  305 1.140252276 192.168.1.12 → 10.6.15.156  SSH 1514 Client: Encrypted packet (len=1448)
  306 1.141066537 192.168.1.12 → 10.6.15.156  SSH 1514 Client: Encrypted packet (len=1448)
  307 1.141187947  10.6.15.156 → 192.168.1.12 SSH 166 Server: Encrypted packet (len=100)
  308 1.141207765  10.6.15.156 → 192.168.1.12 SSH 134 Server: Encrypted packet (len=68)
  309 1.141227518  10.6.15.156 → 192.168.1.12 SSH 134 Server: Encrypted packet (len=68)
  310 1.141249992  10.6.15.156 → 192.168.1.12 SSH 134 Server: Encrypted packet (len=68)
  311 1.141254302 192.168.1.12 → 10.6.15.156  TCP 66 54766 → 22 [ACK] Seq=177313 Ack=43873 Win=6155 Len=0 TSval=8313342 TSecr=15244843
  312 1.141270771  10.6.15.156 → 192.168.1.12 SSH 126 Server: Encrypted packet (len=60)
  313 1.141291550  10.6.15.156 → 192.168.1.12 SSH 134 Server: Encrypted packet (len=68)
  314 1.141322256 192.168.1.12 → 10.6.15.156  TCP 66 54766 → 22 [ACK] Seq=177313 Ack=44069 Win=6155 Len=0 TSval=8313342 TSecr=15244844
  315 1.142149853 192.168.1.12 → 10.6.15.156  SSH 1514 Client: Encrypted packet (len=1448)
  316 1.142160018 192.168.1.12 → 10.6.15.156  SSH 1514 Client: Encrypted packet (len=1448)
  317 1.143588436 192.168.1.12 → 10.6.15.156  SSH 1514 Client: Encrypted packet (len=1448)
  318 1.144163247  10.6.15.156 → 192.168.1.12 SSH 166 Server: Encrypted packet (len=100)
  319 1.144180036  10.6.15.156 → 192.168.1.12 SSH 134 Server: Encrypted packet (len=68)
  320 1.144185012  10.6.15.156 → 192.168.1.12 TCP 66 22 → 54766 [ACK] Seq=44237 Ack=175865 Win=1452 Len=0 TSval=15244844 TSecr=8313341
  321 1.144204166 192.168.1.12 → 10.6.15.156  TCP 66 54766 → 22 [ACK] Seq=181657 Ack=44237 Win=6155 Len=0 TSval=8313342 TSecr=15244844
  322 1.145049417 192.168.1.12 → 10.6.15.156  SSH 1514 Client: Encrypted packet (len=1448)
  323 1.145060897 192.168.1.12 → 10.6.15.156  SSH 1514 Client: Encrypted packet (len=1448)
  324 1.145167989  10.6.15.156 → 192.168.1.12 TCP 66 22 → 54766 [ACK] Seq=44237 Ack=178761 Win=1452 Len=0 TSval=15244845 TSecr=8313342
  325 1.146537235 192.168.1.12 → 10.6.15.156  SSH 1514 Client: Encrypted packet (len=1448)
  326 1.146634793  10.6.15.156 → 192.168.1.12 TCP 66 22 → 54766 [ACK] Seq=44237 Ack=181657 Win=1452 Len=0 TSval=15244845 TSecr=8313342
  327 1.147421207 192.168.1.12 → 10.6.15.156  SSH 1514 Client: Encrypted packet (len=1448)
  328 1.148235687 192.168.1.12 → 10.6.15.156  SSH 1514 Client: Encrypted packet (len=1448)
  329 1.148341108  10.6.15.156 → 192.168.1.12 TCP 66 22 → 54766 [ACK] Seq=44237 Ack=184553 Win=1452 Len=0 TSval=15244846 TSecr=8313343
  330 1.150443527 192.168.1.12 → 10.6.15.156  SSH 1514 Client: Encrypted packet (len=1448)
  331 1.151254448 192.168.1.12 → 10.6.15.156  SSH 1514 Client: Encrypted packet (len=1448)
  332 1.151791129  10.6.15.156 → 192.168.1.12 TCP 66 22 → 54766 [ACK] Seq=44237 Ack=187449 Win=1452 Len=0 TSval=15244846 TSecr=8313343
  333 1.152645068 192.168.1.12 → 10.6.15.156  SSH 1514 Client: Encrypted packet (len=1448)
  334 1.153043943  10.6.15.156 → 192.168.1.12 TCP 66 22 → 54766 [ACK] Seq=44237 Ack=190345 Win=1452 Len=0 TSval=15244847 TSecr=8313343
  335 1.153899585 192.168.1.12 → 10.6.15.156  SSH 1514 Client: Encrypted packet (len=1448)
  336 1.154712172 192.168.1.12 → 10.6.15.156  SSH 1514 Client: Encrypted packet (len=1448)
  337 1.155532113 192.168.1.12 → 10.6.15.156  SSH 1514 Client: Encrypted packet (len=1448)
  338 1.155631368  10.6.15.156 → 192.168.1.12 TCP 66 22 → 54766 [ACK] Seq=44237 Ack=193241 Win=1452 Len=0 TSval=15244847 TSecr=8313344
  339 1.156490775 192.168.1.12 → 10.6.15.156  SSH 1514 Client: Encrypted packet (len=1448)
  340 1.157325045 192.168.1.12 → 10.6.15.156  SSH 1514 Client: Encrypted packet (len=1448)
  341 1.158146314 192.168.1.12 → 10.6.15.156  SSH 1514 Client: Encrypted packet (len=1448)
  342 1.158967089 192.168.1.12 → 10.6.15.156  SSH 1514 Client: Encrypted packet (len=1448)
  343 1.159781983 192.168.1.12 → 10.6.15.156  SSH 1514 Client: Encrypted packet (len=1448)
  344 1.159886074  10.6.15.156 → 192.168.1.12 TCP 66 22 → 54766 [ACK] Seq=44237 Ack=196137 Win=1452 Len=0 TSval=15244848 TSecr=8313345
  345 1.159897825  10.6.15.156 → 192.168.1.12 TCP 66 22 → 54766 [ACK] Seq=44237 Ack=199033 Win=1452 Len=0 TSval=15244848 TSecr=8313345
  346 1.160776804 192.168.1.12 → 10.6.15.156  SSH 1514 Client: Encrypted packet (len=1448)
  347 1.160891085  10.6.15.156 → 192.168.1.12 TCP 66 22 → 54766 [ACK] Seq=44237 Ack=201929 Win=1452 Len=0 TSval=15244849 TSecr=8313346
  348 1.161750311 192.168.1.12 → 10.6.15.156  SSH 1514 Client: Encrypted packet (len=1448)
  349 1.162546293 192.168.1.12 → 10.6.15.156  SSH 1514 Client: Encrypted packet (len=1448)
  350 1.165415710 192.168.1.12 → 10.6.15.156  SSH 1514 Client: Encrypted packet (len=1448)
  351 1.165556236  10.6.15.156 → 192.168.1.12 TCP 66 22 → 54766 [ACK] Seq=44237 Ack=204825 Win=1452 Len=0 TSval=15244849 TSecr=8313346
  352 1.165570802  10.6.15.156 → 192.168.1.12 TCP 66 22 → 54766 [ACK] Seq=44237 Ack=207721 Win=1452 Len=0 TSval=15244850 TSecr=8313347
  353 1.166470583 192.168.1.12 → 10.6.15.156  SSH 1514 Client: Encrypted packet (len=1448)
  354 1.167283297 192.168.1.12 → 10.6.15.156  SSH 1514 Client: Encrypted packet (len=1448)
  355 1.168102075 192.168.1.12 → 10.6.15.156  SSH 1514 Client: Encrypted packet (len=1448)
  356 1.168200296  10.6.15.156 → 192.168.1.12 TCP 66 22 → 54766 [ACK] Seq=44237 Ack=210617 Win=1452 Len=0 TSval=15244851 TSecr=8313347
  357 1.169062512 192.168.1.12 → 10.6.15.156  SSH 1514 Client: Encrypted packet (len=1448)
  358 1.169878100 192.168.1.12 → 10.6.15.156  SSH 1514 Client: Encrypted packet (len=1448)
  359 1.169978805  10.6.15.156 → 192.168.1.12 TCP 66 22 → 54766 [ACK] Seq=44237 Ack=213513 Win=1452 Len=0 TSval=15244851 TSecr=8313348
  360 1.170832709 192.168.1.12 → 10.6.15.156  SSH 1514 Client: Encrypted packet (len=1448)
  361 1.171648466 192.168.1.12 → 10.6.15.156  SSH 1514 Client: Encrypted packet (len=1448)
  362 1.171752953  10.6.15.156 → 192.168.1.12 TCP 66 22 → 54766 [ACK] Seq=44237 Ack=216409 Win=1452 Len=0 TSval=15244851 TSecr=8313348
  363 1.182604616 192.168.1.12 → 10.6.15.156  SSH 1514 Client: Encrypted packet (len=1448)
  364 1.184640682  10.6.15.156 → 192.168.1.12 TCP 66 22 → 54766 [ACK] Seq=44237 Ack=219305 Win=1452 Len=0 TSval=15244852 TSecr=8313349
  365 1.184892375  10.6.15.156 → 192.168.1.12 SSH 166 Server: Encrypted packet (len=100)
  366 1.185114001  10.6.15.156 → 192.168.1.12 SSH 134 Server: Encrypted packet (len=68)
  367 1.185319656  10.6.15.156 → 192.168.1.12 SSH 126 Server: Encrypted packet (len=60)
  368 1.185495500  10.6.15.156 → 192.168.1.12 SSH 134 Server: Encrypted packet (len=68)
  369 1.185522091  10.6.15.156 → 192.168.1.12 SSH 166 Server: Encrypted packet (len=100)
  370 1.185543037  10.6.15.156 → 192.168.1.12 SSH 134 Server: Encrypted packet (len=68)
  371 1.185564905  10.6.15.156 → 192.168.1.12 SSH 134 Server: Encrypted packet (len=68)
  372 1.185587939  10.6.15.156 → 192.168.1.12 SSH 134 Server: Encrypted packet (len=68)
  373 1.185609525  10.6.15.156 → 192.168.1.12 SSH 134 Server: Encrypted packet (len=68)
  374 1.185919147 192.168.1.12 → 10.6.15.156  TCP 66 54766 → 22 [ACK] Seq=222201 Ack=44905 Win=6155 Len=0 TSval=8313353 TSecr=15244852
  375 1.187691488 192.168.1.12 → 10.6.15.156  SSH 1514 Client: Encrypted packet (len=1448)
  376 1.187870449 192.168.1.12 → 10.6.15.156  SSH 1514 Client: Encrypted packet (len=1448)
  377 1.189266829 192.168.1.12 → 10.6.15.156  SSH 1514 Client: Encrypted packet (len=1448)
  378 1.189399401  10.6.15.156 → 192.168.1.12 SSH 134 Server: [TCP Spurious Retransmission] , Encrypted packet (len=68)
  379 1.189411448 192.168.1.12 → 10.6.15.156  TCP 78 [TCP Dup ACK 374#1] 54766 → 22 [ACK] Seq=226545 Ack=44905 Win=6155 Len=0 TSval=8313354 TSecr=15244856 SLE=44837 SRE=44905
  380 1.190314822 192.168.1.12 → 10.6.15.156  SSH 1502 Client: Encrypted packet (len=1436)
  381 1.191225948  10.6.15.156 → 192.168.1.12 TCP 66 22 → 54766 [ACK] Seq=44905 Ack=223649 Win=1452 Len=0 TSval=15244856 TSecr=8313352
  382 1.191760139  10.6.15.156 → 192.168.1.12 TCP 66 22 → 54766 [ACK] Seq=44905 Ack=226545 Win=1452 Len=0 TSval=15244857 TSecr=8313353
  383 1.195975605  10.6.15.156 → 192.168.1.12 SSH 134 Server: Encrypted packet (len=68)
