    1 0.000000000  10.6.15.145 → 192.168.1.16 SSH 142 Server: Encrypted packet (len=76)
    2 0.000098783  10.6.15.145 → 192.168.1.16 SSH 662 Server: Encrypted packet (len=596)
    3 0.000106043  10.6.15.145 → 192.168.1.16 SSH 102 Server: Encrypted packet (len=36)
    4 0.000124750 192.168.1.16 → 10.6.15.145  TCP 66 52104 → 22 [ACK] Seq=1 Ack=709 Win=6157 Len=0 TSval=1526712 TSecr=24340927
    5 0.000929440 192.168.1.16 → 10.6.15.145  SSH 134 Client: Encrypted packet (len=68)
    6 0.065609846 192.168.1.16 → 10.6.15.145  SSH 138 Client: Encrypted packet (len=72)
    7 0.093596680 192.168.1.16 → 10.6.15.145  SSH 246 Client: Encrypted packet (len=180)
    8 0.126329470  10.6.15.145 → 192.168.1.16 TCP 78 [TCP Dup ACK 1#1] 22 → 52104 [ACK] Seq=709 Ack=1 Win=1452 Len=0 TSval=24341270 TSecr=1526313 SLE=69 SRE=141
    9 0.309597388 192.168.1.16 → 10.6.15.145  TCP 134 [TCP Retransmission] 52104 → 22 [PSH, ACK] Seq=1 Ack=709 Win=6157 Len=68 TSval=1526790 TSecr=24341270
   10 0.311972903  10.6.15.145 → 192.168.1.16 TCP 66 22 → 52104 [ACK] Seq=709 Ack=141 Win=1452 Len=0 TSval=24341316 TSecr=1526790
   11 0.311995849 192.168.1.16 → 10.6.15.145  TCP 246 [TCP Retransmission] 52104 → 22 [PSH, ACK] Seq=141 Ack=709 Win=6157 Len=180 TSval=1526790 TSecr=24341316
   12 0.312011785  10.6.15.145 → 192.168.1.16 SSH 102 Server: Encrypted packet (len=36)
   13 0.353014325  10.6.15.145 → 192.168.1.16 TCP 66 22 → 52104 [ACK] Seq=745 Ack=321 Win=1452 Len=0 TSval=24341327 TSecr=1526790
   14 0.353595041 192.168.1.16 → 10.6.15.145  TCP 66 52104 → 22 [ACK] Seq=321 Ack=745 Win=6157 Len=0 TSval=1526801 TSecr=24341316
   15 0.441209136 192.168.1.16 → 10.6.15.145  SSH 102 Client: Encrypted packet (len=36)
   16 0.495749007  10.6.15.145 → 192.168.1.16 SSH 138 Server: Encrypted packet (len=72)
   17 0.495776551 192.168.1.16 → 10.6.15.145  TCP 66 52104 → 22 [ACK] Seq=357 Ack=817 Win=6157 Len=0 TSval=1526836 TSecr=24341362
   18 0.495940844 192.168.1.16 → 10.6.15.145  SSH 102 Client: Encrypted packet (len=36)
   19 0.497464924  10.6.15.145 → 192.168.1.16 SSH 102 Server: Encrypted packet (len=36)
   20 0.526798663  10.6.15.145 → 192.168.1.16 TCP 78 [TCP Dup ACK 13#1] 22 → 52104 [ACK] Seq=853 Ack=321 Win=1452 Len=0 TSval=24341370 TSecr=1526801 SLE=357 SRE=393
   21 0.526819171 192.168.1.16 → 10.6.15.145  SSH 158 Client: Encrypted packet (len=92)
   22 0.532371248  10.6.15.145 → 192.168.1.16 TCP 78 [TCP Dup ACK 13#2] 22 → 52104 [ACK] Seq=853 Ack=321 Win=1452 Len=0 TSval=24341370 TSecr=1526801 SLE=357 SRE=485
   23 0.661651594 192.168.1.16 → 10.6.15.145  TCP 102 [TCP Retransmission] 52104 → 22 [PSH, ACK] Seq=321 Ack=853 Win=6157 Len=36 TSval=1526878 TSecr=24341370
   24 0.665005890  10.6.15.145 → 192.168.1.16 SSH 150 Server: Encrypted packet (len=72)
   25 0.665032873  10.6.15.145 → 192.168.1.16 SSH 150 Server: Encrypted packet (len=72)
   26 0.665090308 192.168.1.16 → 10.6.15.145  TCP 66 52104 → 22 [ACK] Seq=485 Ack=997 Win=6157 Len=0 TSval=1526878 TSecr=24341404
   27 0.665507843  10.6.15.145 → 192.168.1.16 TCP 66 22 → 52104 [ACK] Seq=997 Ack=485 Win=1452 Len=0 TSval=24341404 TSecr=1526878
   28 0.665517305 192.168.1.16 → 10.6.15.145  SSH 138 Client: Encrypted packet (len=72)
   29 0.665525710  10.6.15.145 → 192.168.1.16 SSH 138 Server: Encrypted packet (len=72)
   30 0.665794229 192.168.1.16 → 10.6.15.145  SSH 102 Client: Encrypted packet (len=36)
   31 0.667511035  10.6.15.145 → 192.168.1.16 TCP 66 22 → 52104 [ACK] Seq=1069 Ack=593 Win=1452 Len=0 TSval=24341405 TSecr=1526878
   32 1.983531270  10.6.15.145 → 192.168.1.16 SSH 206 Server: Encrypted packet (len=140)
   33 1.983560960  10.6.15.145 → 192.168.1.16 SSH 222 Server: Encrypted packet (len=156)
   34 1.983571009  10.6.15.145 → 192.168.1.16 SSH 110 Server: Encrypted packet (len=44)
   35 1.983651377 192.168.1.16 → 10.6.15.145  TCP 66 52104 → 22 [ACK] Seq=593 Ack=1409 Win=6157 Len=0 TSval=1527208 TSecr=24341451
   36 1.983718938  10.6.15.145 → 192.168.1.16 SSH 110 Server: [TCP Spurious Retransmission] , Encrypted packet (len=44)
   37 1.983725564 192.168.1.16 → 10.6.15.145  TCP 78 [TCP Dup ACK 35#1] 52104 → 22 [ACK] Seq=593 Ack=1409 Win=6157 Len=0 TSval=1527208 TSecr=24341667 SLE=1365 SRE=1409
   38 1.985627373 192.168.1.16 → 10.6.15.145  SSH 174 Client: Encrypted packet (len=108)
   39 1.985947703 192.168.1.16 → 10.6.15.145  SSH 158 Client: Encrypted packet (len=92)
   40 1.988345332  10.6.15.145 → 192.168.1.16 TCP 66 22 → 52104 [ACK] Seq=1409 Ack=793 Win=1452 Len=0 TSval=24341735 TSecr=1527209
   41 2.975583044  10.6.15.145 → 192.168.1.16 SSH 198 Server: Encrypted packet (len=132)
   42 2.975616673  10.6.15.145 → 192.168.1.16 SSH 206 Server: Encrypted packet (len=140)
   43 2.975627355  10.6.15.145 → 192.168.1.16 SSH 230 Server: Encrypted packet (len=164)
   44 2.975707409 192.168.1.16 → 10.6.15.145  TCP 66 52104 → 22 [ACK] Seq=793 Ack=1845 Win=6157 Len=0 TSval=1527456 TSecr=24341781
   45 2.977366295 192.168.1.16 → 10.6.15.145  SSH 174 Client: Encrypted packet (len=108)
   46 3.023728755  10.6.15.145 → 192.168.1.16 TCP 66 22 → 52104 [ACK] Seq=1845 Ack=901 Win=1452 Len=0 TSval=24341993 TSecr=1527456
   47 7.187551932  10.6.15.145 → 192.168.1.16 SSH 198 Server: Encrypted packet (len=132)
   48 7.187569312  10.6.15.145 → 192.168.1.16 TCP 198 [TCP Retransmission] 22 → 52104 [PSH, ACK] Seq=1845 Ack=901 Win=1452 Len=132 TSval=24342316 TSecr=1527456
   49 7.187576108 192.168.1.16 → 10.6.15.145  TCP 78 52104 → 22 [ACK] Seq=901 Ack=1977 Win=6157 Len=0 TSval=1528509 TSecr=24342316 SLE=1845 SRE=1977
   50 7.187606289  10.6.15.145 → 192.168.1.16 SSH 198 Server: [TCP Spurious Retransmission] , Encrypted packet (len=132)
   51 7.187610280 192.168.1.16 → 10.6.15.145  TCP 78 [TCP Dup ACK 49#1] 52104 → 22 [ACK] Seq=901 Ack=1977 Win=6157 Len=0 TSval=1528509 TSecr=24342980 SLE=1845 SRE=1977
   52 11.179276456 192.168.1.16 → 10.6.15.145  SSH 262 Client: Encrypted packet (len=196)
   53 11.180070407 192.168.1.16 → 10.6.15.145  SSH 1514 Client: Encrypted packet (len=1448)
   54 11.180441044 192.168.1.16 → 10.6.15.145  SSH 118 Client: Encrypted packet (len=52)
   55 11.181671648  10.6.15.145 → 192.168.1.16 TCP 66 22 → 52104 [ACK] Seq=1977 Ack=1097 Win=1452 Len=0 TSval=24344034 TSecr=1529507
   56 11.182786707  10.6.15.145 → 192.168.1.16 TCP 66 22 → 52104 [ACK] Seq=1977 Ack=2597 Win=1452 Len=0 TSval=24344034 TSecr=1529507
   57 11.184266784  10.6.15.145 → 192.168.1.16 SSH 134 Server: Encrypted packet (len=68)
   58 11.184291381 192.168.1.16 → 10.6.15.145  TCP 66 52104 → 22 [ACK] Seq=2597 Ack=2045 Win=6157 Len=0 TSval=1529508 TSecr=24344034
   59 12.960280197  10.6.15.145 → 192.168.1.16 SSH 910 Server: Encrypted packet (len=844)
   60 12.960323658 192.168.1.16 → 10.6.15.145  TCP 66 52104 → 22 [ACK] Seq=2597 Ack=2889 Win=6157 Len=0 TSval=1529952 TSecr=24344064
   61 12.960712899  10.6.15.145 → 192.168.1.16 SSH 390 Server: Encrypted packet (len=324)
   62 12.960731682 192.168.1.16 → 10.6.15.145  TCP 66 52104 → 22 [ACK] Seq=2597 Ack=3213 Win=6157 Len=0 TSval=1529952 TSecr=24344064
   63 12.961081335  10.6.15.145 → 192.168.1.16 SSH 134 Server: Encrypted packet (len=68)
   64 12.961089574 192.168.1.16 → 10.6.15.145  TCP 66 52104 → 22 [ACK] Seq=2597 Ack=3281 Win=6157 Len=0 TSval=1529952 TSecr=24344064
   65 12.961484093  10.6.15.145 → 192.168.1.16 SSH 134 Server: [TCP Spurious Retransmission] , Encrypted packet (len=68)
   66 12.961502412 192.168.1.16 → 10.6.15.145  TCP 78 [TCP Dup ACK 64#1] 52104 → 22 [ACK] Seq=2597 Ack=3281 Win=6157 Len=0 TSval=1529952 TSecr=24344411 SLE=3213 SRE=3281
   67 12.961694638 192.168.1.16 → 10.6.15.145  SSH 134 Client: Encrypted packet (len=68)
   68 13.001600735  10.6.15.145 → 192.168.1.16 TCP 66 22 → 52104 [ACK] Seq=3281 Ack=2665 Win=1452 Len=0 TSval=24344489 TSecr=1529953
   69 16.886228038 192.168.1.16 → 139.59.21.22 NTP 90 NTP Version 4, client
   70 20.961031757  10.6.15.145 → 192.168.1.16 SSH 158 Server: Encrypted packet (len=92)
   71 20.961067885  10.6.15.145 → 192.168.1.16 SSH 102 Server: Encrypted packet (len=36)
   72 20.961175018 192.168.1.16 → 10.6.15.145  TCP 66 52104 → 22 [ACK] Seq=2665 Ack=3409 Win=6157 Len=0 TSval=1531952 TSecr=24346373
   73 20.961724780 192.168.1.16 → 10.6.15.145  SSH 138 Client: Encrypted packet (len=72)
   74 20.963341300  10.6.15.145 → 192.168.1.16 TCP 66 22 → 52104 [ACK] Seq=3409 Ack=2737 Win=1452 Len=0 TSval=24346479 TSecr=1531953
   75 20.963732345  10.6.15.145 → 192.168.1.16 SSH 102 Server: Encrypted packet (len=36)
   76 21.005629318 192.168.1.16 → 10.6.15.145  TCP 66 52104 → 22 [ACK] Seq=2737 Ack=3445 Win=6157 Len=0 TSval=1531964 TSecr=24346479
   77 23.887880028 192.168.1.16 → 192.168.1.1  DNS 74 Standard query 0x734b A ntp.ubuntu.com
   78 23.893745774  192.168.1.1 → 192.168.1.16 DNS 138 Standard query response 0x734b A ntp.ubuntu.com A 91.189.89.198 A 91.189.89.199 A 91.189.94.4 A 91.189.91.157
   79 23.894848226 192.168.1.16 → 91.189.89.198 NTP 90 NTP Version 4, client
   80 24.886257025 192.168.1.16 → 123.108.200.124 NTP 90 NTP Version 4, client
