    1 0.000000000  10.6.15.145 → 192.168.1.16 SSH 134 Server: Encrypted packet (len=68)
    2 0.000024834 192.168.1.16 → 10.6.15.145  TCP 66 52104 → 22 [ACK] Seq=1 Ack=69 Win=6157 Len=0 TSval=1534456 TSecr=24348778
    3 0.000689859  10.6.15.145 → 192.168.1.16 SSH 662 Server: Encrypted packet (len=596)
    4 0.000696502 192.168.1.16 → 10.6.15.145  TCP 66 52104 → 22 [ACK] Seq=1 Ack=665 Win=6157 Len=0 TSval=1534456 TSecr=24348778
    5 0.000737237  10.6.15.145 → 192.168.1.16 SSH 542 Server: Encrypted packet (len=476)
    6 0.000740314 192.168.1.16 → 10.6.15.145  TCP 66 52104 → 22 [ACK] Seq=1 Ack=1141 Win=6157 Len=0 TSval=1534456 TSecr=24348864
    7 0.001542363 192.168.1.16 → 10.6.15.145  SSH 134 Client: Encrypted packet (len=68)
    8 0.046454044  10.6.15.145 → 192.168.1.16 TCP 66 22 → 52104 [ACK] Seq=1141 Ack=69 Win=1452 Len=0 TSval=24348993 TSecr=1534457
    9 0.070115212 192.168.1.16 → 10.6.15.145  SSH 102 Client: Encrypted packet (len=36)
   10 0.070824774 192.168.1.16 → 10.6.15.145  SSH 138 Client: Encrypted packet (len=72)
   11 0.071628550  10.6.15.145 → 192.168.1.16 TCP 66 22 → 52104 [ACK] Seq=1141 Ack=105 Win=1452 Len=0 TSval=24349000 TSecr=1534474
   12 0.072073444  10.6.15.145 → 192.168.1.16 TCP 66 22 → 52104 [ACK] Seq=1141 Ack=177 Win=1452 Len=0 TSval=24349001 TSecr=1534474
   13 0.255256662 192.168.1.16 → 10.6.15.145  SSH 262 Client: Encrypted packet (len=196)
   14 0.256978528 192.168.1.16 → 10.6.15.145  SSH 1246 Client: Encrypted packet (len=1180)
   15 0.258506968  10.6.15.145 → 192.168.1.16 SSH 138 Server: Encrypted packet (len=72)
   16 0.258522341  10.6.15.145 → 192.168.1.16 SSH 110 Server: Encrypted packet (len=44)
   17 0.258564669 192.168.1.16 → 10.6.15.145  TCP 66 52104 → 22 [ACK] Seq=1553 Ack=1257 Win=6157 Len=0 TSval=1534521 TSecr=24349046
   18 0.259276041  10.6.15.145 → 192.168.1.16 TCP 66 22 → 52104 [ACK] Seq=1257 Ack=373 Win=1452 Len=0 TSval=24349047 TSecr=1534520
   19 0.259285475 192.168.1.16 → 10.6.15.145  SSH 186 Client: Encrypted packet (len=120)
   20 0.260248254  10.6.15.145 → 192.168.1.16 TCP 66 22 → 52104 [ACK] Seq=1257 Ack=1553 Win=1452 Len=0 TSval=24349048 TSecr=1534520
   21 0.260789021  10.6.15.145 → 192.168.1.16 SSH 134 Server: Encrypted packet (len=68)
   22 0.300112227  10.6.15.145 → 192.168.1.16 TCP 66 22 → 52104 [ACK] Seq=1325 Ack=1673 Win=1452 Len=0 TSval=24349058 TSecr=1534521
   23 0.301014359 192.168.1.16 → 10.6.15.145  TCP 66 52104 → 22 [ACK] Seq=1673 Ack=1325 Win=6157 Len=0 TSval=1534532 TSecr=24349048
   24 0.425066062 192.168.1.16 → 10.6.15.145  SSH 102 Client: Encrypted packet (len=36)
   25 0.427031211  10.6.15.145 → 192.168.1.16 SSH 138 Server: Encrypted packet (len=72)
   26 0.427057094 192.168.1.16 → 10.6.15.145  TCP 66 52104 → 22 [ACK] Seq=1709 Ack=1397 Win=6157 Len=0 TSval=1534563 TSecr=24349088
   27 0.427291651 192.168.1.16 → 10.6.15.145  SSH 102 Client: Encrypted packet (len=36)
   28 0.427573726  10.6.15.145 → 192.168.1.16 TCP 66 22 → 52104 [ACK] Seq=1397 Ack=1709 Win=1452 Len=0 TSval=24349089 TSecr=1534562
   29 0.428654215  10.6.15.145 → 192.168.1.16 TCP 66 22 → 52104 [ACK] Seq=1397 Ack=1745 Win=1452 Len=0 TSval=24349090 TSecr=1534563
   30 0.446117232  10.6.15.145 → 192.168.1.16 SSH 206 Server: Encrypted packet (len=140)
   31 0.446144523  10.6.15.145 → 192.168.1.16 SSH 222 Server: Encrypted packet (len=156)
   32 0.446185175 192.168.1.16 → 10.6.15.145  TCP 66 52104 → 22 [ACK] Seq=1745 Ack=1693 Win=6157 Len=0 TSval=1534568 TSecr=24349094
   33 0.447754106 192.168.1.16 → 10.6.15.145  SSH 166 Client: Encrypted packet (len=100)
   34 0.466884482  10.6.15.145 → 192.168.1.16 SSH 198 Server: Encrypted packet (len=132)
   35 0.468964060  10.6.15.145 → 192.168.1.16 SSH 1514 Server: Encrypted packet (len=1448)
   36 0.468974757 192.168.1.16 → 10.6.15.145  TCP 66 52104 → 22 [ACK] Seq=1845 Ack=3273 Win=6157 Len=0 TSval=1534573 TSecr=24349099
   37 0.468988784  10.6.15.145 → 192.168.1.16 SSH 78 Server: Encrypted packet (len=12)
   38 0.469634880  10.6.15.145 → 192.168.1.16 SSH 1514 Server: Encrypted packet (len=1448)
   39 0.469643092 192.168.1.16 → 10.6.15.145  TCP 66 52104 → 22 [ACK] Seq=1845 Ack=4733 Win=6157 Len=0 TSval=1534574 TSecr=24349099
   40 0.471115440  10.6.15.145 → 192.168.1.16 SSH 1514 Server: Encrypted packet (len=1448)
   41 0.471136348  10.6.15.145 → 192.168.1.16 SSH 82 Server: Encrypted packet (len=16)
   42 0.471146010 192.168.1.16 → 10.6.15.145  TCP 66 52104 → 22 [ACK] Seq=1845 Ack=6197 Win=6157 Len=0 TSval=1534574 TSecr=24349100
   43 0.471782373 192.168.1.16 → 10.6.15.145  SSH 134 Client: Encrypted packet (len=68)
   44 0.474278800 192.168.1.16 → 10.6.15.145  SSH 1514 Client: Encrypted packet (len=1448)
   45 0.475530854 192.168.1.16 → 10.6.15.145  SSH 214 Client: Encrypted packet (len=148)
   46 0.477233104  10.6.15.145 → 192.168.1.16 TCP 66 22 → 52104 [ACK] Seq=6197 Ack=3509 Win=1452 Len=0 TSval=24349102 TSecr=1534574
   47 0.575680890 192.168.1.16 → 10.6.15.145  SSH 630 Client: Encrypted packet (len=564)
   48 0.600701353  10.6.15.145 → 192.168.1.16 SSH 942 Server: Encrypted packet (len=876)
   49 0.601893206  10.6.15.145 → 192.168.1.16 SSH 678 Server: Encrypted packet (len=612)
   50 0.601910345 192.168.1.16 → 10.6.15.145  TCP 66 52104 → 22 [ACK] Seq=4073 Ack=7685 Win=6157 Len=0 TSval=1534607 TSecr=24349133
   51 0.602406848 192.168.1.16 → 10.6.15.145  SSH 134 Client: Encrypted packet (len=68)
   52 0.633472957  10.6.15.145 → 192.168.1.16 SSH 198 Server: Encrypted packet (len=132)
   53 0.677067274 192.168.1.16 → 10.6.15.145  TCP 66 52104 → 22 [ACK] Seq=4141 Ack=7817 Win=6157 Len=0 TSval=1534626 TSecr=24349141
   54 0.679922358  10.6.15.145 → 192.168.1.16 SSH 174 Server: Encrypted packet (len=108)
   55 0.680021073 192.168.1.16 → 10.6.15.145  TCP 66 52104 → 22 [ACK] Seq=4141 Ack=7925 Win=6157 Len=0 TSval=1534626 TSecr=24349152
   56 0.680807768 192.168.1.16 → 10.6.15.145  SSH 134 Client: Encrypted packet (len=68)
   57 0.730854698  10.6.15.145 → 192.168.1.16 TCP 66 22 → 52104 [ACK] Seq=7925 Ack=4209 Win=1452 Len=0 TSval=24349165 TSecr=1534626
   58 1.983103108  10.6.15.145 → 192.168.1.16 SSH 102 Server: Encrypted packet (len=36)
   59 1.983138329  10.6.15.145 → 192.168.1.16 TCP 102 [TCP Retransmission] 22 → 52104 [PSH, ACK] Seq=7925 Ack=4209 Win=1452 Len=36 TSval=24349342 TSecr=1534626
   60 1.983152668 192.168.1.16 → 10.6.15.145  TCP 78 52104 → 22 [ACK] Seq=4209 Ack=7961 Win=6157 Len=0 TSval=1534952 TSecr=24349342 SLE=7925 SRE=7961
   61 1.983627346 192.168.1.16 → 10.6.15.145  SSH 158 Client: Encrypted packet (len=92)
   62 1.985275084  10.6.15.145 → 192.168.1.16 TCP 66 22 → 52104 [ACK] Seq=7961 Ack=4301 Win=1452 Len=0 TSval=24349479 TSecr=1534952
   63 2.913745311 192.168.1.16 → 192.168.1.1  DNS 81 Standard query 0xc835 A 2.ubuntu.pool.ntp.org
   64 2.915477294  10.6.15.145 → 192.168.1.16 SSH 206 Server: Encrypted packet (len=140)
   65 2.915577542  10.6.15.145 → 192.168.1.16 SSH 214 Server: Encrypted packet (len=148)
   66 2.915607772 192.168.1.16 → 10.6.15.145  TCP 66 52104 → 22 [ACK] Seq=4301 Ack=8249 Win=6157 Len=0 TSval=1535185 TSecr=24349567
   67 2.917748399  192.168.1.1 → 192.168.1.16 DNS 129 Standard query response 0xc835 A 2.ubuntu.pool.ntp.org A 139.59.21.22 A 13.126.27.131 A 123.108.200.124
   68 2.917803066 192.168.1.16 → 10.6.15.145  SSH 174 Client: Encrypted packet (len=108)
   69 2.918608364 192.168.1.16 → 139.59.21.22 NTP 90 NTP Version 4, client
   70 2.919803375  10.6.15.145 → 192.168.1.16 TCP 66 22 → 52104 [ACK] Seq=8249 Ack=4409 Win=1452 Len=0 TSval=24349712 TSecr=1535186
   71 3.999299601  10.6.15.145 → 192.168.1.16 SSH 134 Server: Encrypted packet (len=68)
   72 3.999331455  10.6.15.145 → 192.168.1.16 SSH 158 Server: Encrypted packet (len=92)
   73 3.999340226  10.6.15.145 → 192.168.1.16 TCP 158 [TCP Retransmission] 22 → 52104 [PSH, ACK] Seq=8317 Ack=4409 Win=1452 Len=92 TSval=24349937 TSecr=1535186
   74 3.999353283 192.168.1.16 → 10.6.15.145  TCP 78 52104 → 22 [ACK] Seq=4409 Ack=8409 Win=6157 Len=0 TSval=1535456 TSecr=24349800 SLE=8317 SRE=8409
   75 6.909628884 192.168.1.16 → 139.59.21.22 NTP 90 NTP Version 4, client
   76 6.912747001 10.119.73.122 → 192.168.1.16 ICMP 110 Destination unreachable (Communication administratively filtered)
   77 10.039855382  192.168.1.1 → 239.255.255.250 SSDP 302 NOTIFY * HTTP/1.1 
   78 10.042326376  192.168.1.1 → 239.255.255.250 SSDP 311 NOTIFY * HTTP/1.1 
   79 10.049834055  192.168.1.1 → 239.255.255.250 SSDP 374 NOTIFY * HTTP/1.1 
   80 10.050382704  192.168.1.1 → 239.255.255.250 SSDP 370 NOTIFY * HTTP/1.1 
   81 10.050925215  192.168.1.1 → 239.255.255.250 SSDP 350 NOTIFY * HTTP/1.1 
   82 10.053394479  192.168.1.1 → 239.255.255.250 SSDP 382 NOTIFY * HTTP/1.1 
   83 10.056136198  192.168.1.1 → 239.255.255.250 SSDP 364 NOTIFY * HTTP/1.1 
   84 10.058880845  192.168.1.1 → 239.255.255.250 SSDP 366 NOTIFY * HTTP/1.1 
   85 10.061180865  192.168.1.1 → 239.255.255.250 SSDP 302 NOTIFY * HTTP/1.1 
   86 10.063630318  192.168.1.1 → 239.255.255.250 SSDP 311 NOTIFY * HTTP/1.1 
   87 10.066455020  192.168.1.1 → 239.255.255.250 SSDP 374 NOTIFY * HTTP/1.1 
   88 10.069203492  192.168.1.1 → 239.255.255.250 SSDP 370 NOTIFY * HTTP/1.1 
   89 10.071820278  192.168.1.1 → 239.255.255.250 SSDP 350 NOTIFY * HTTP/1.1 
   90 10.074726364  192.168.1.1 → 239.255.255.250 SSDP 382 NOTIFY * HTTP/1.1 
   91 10.077453956  192.168.1.1 → 239.255.255.250 SSDP 364 NOTIFY * HTTP/1.1 
   92 10.080228643  192.168.1.1 → 239.255.255.250 SSDP 366 NOTIFY * HTTP/1.1 
   93 21.985349801  192.168.1.1 → 224.0.0.1    IGMPv2 42 Membership Query, general
