    1 0.000000000 192.168.1.16 → 123.108.200.124 NTP 90 NTP Version 4, client
    2 0.000776613 192.168.1.16 → 139.59.50.38 NTP 90 NTP Version 4, client
    3 0.001908637  10.6.15.144 → 192.168.1.16 SSH 1514 Server: Encrypted packet (len=1448)
    4 0.001926081 192.168.1.16 → 10.6.15.144  TCP 66 59298 → 22 [ACK] Seq=1 Ack=1449 Win=5703 Len=0 TSval=4689377 TSecr=5285617
    5 0.002082976  10.6.15.144 → 192.168.1.16 SSH 494 Server: Encrypted packet (len=428)
    6 0.002088498 192.168.1.16 → 10.6.15.144  TCP 66 59298 → 22 [ACK] Seq=1 Ack=1877 Win=5703 Len=0 TSval=4689378 TSecr=5285617
    7 0.002258728  10.6.15.144 → 192.168.1.16 SSH 494 Server: [TCP Spurious Retransmission] , Encrypted packet (len=428)
    8 0.002266119 192.168.1.16 → 10.6.15.144  TCP 78 [TCP Dup ACK 6#1] 59298 → 22 [ACK] Seq=1 Ack=1877 Win=5703 Len=0 TSval=4689378 TSecr=5285635 SLE=1449 SRE=1877
    9 0.002594332  10.6.15.144 → 192.168.1.16 TCP 1514 [TCP Out-Of-Order] 22 → 59298 [ACK] Seq=1 Ack=1 Win=1452 Len=1448 TSval=5285708 TSecr=4689142
   10 0.002601280 192.168.1.16 → 10.6.15.144  TCP 78 [TCP Dup ACK 6#2] 59298 → 22 [ACK] Seq=1 Ack=1877 Win=5703 Len=0 TSval=4689378 TSecr=5285635 SLE=1 SRE=1449
   11 0.006901200 192.168.1.16 → 10.6.15.144  SSH 366 Client: Encrypted packet (len=300)
   12 0.056049213  10.6.15.144 → 192.168.1.16 TCP 66 22 → 59298 [ACK] Seq=1877 Ack=301 Win=1452 Len=0 TSval=5285742 TSecr=4689379
   13 1.341318244  10.6.15.144 → 192.168.1.16 SSH 1514 Server: Encrypted packet (len=1448)
   14 1.341634605  10.6.15.144 → 192.168.1.16 SSH 1514 Server: Encrypted packet (len=1448)
   15 1.341646185 192.168.1.16 → 10.6.15.144  TCP 66 59298 → 22 [ACK] Seq=301 Ack=4773 Win=5703 Len=0 TSval=4689712 TSecr=5285883
   16 1.341957774  10.6.15.144 → 192.168.1.16 SSH 1514 Server: Encrypted packet (len=1448)
   17 1.342082105  10.6.15.144 → 192.168.1.16 SSH 110 Server: Encrypted packet (len=44)
   18 1.342088316 192.168.1.16 → 10.6.15.144  TCP 66 59298 → 22 [ACK] Seq=301 Ack=6265 Win=5703 Len=0 TSval=4689713 TSecr=5285883
   19 1.342457999  10.6.15.144 → 192.168.1.16 SSH 1514 Server: Encrypted packet (len=1448)
   20 1.342779364  10.6.15.144 → 192.168.1.16 SSH 1514 Server: [TCP Previous segment not captured] , Encrypted packet (len=1448)
   21 1.342798078 192.168.1.16 → 10.6.15.144  TCP 78 59298 → 22 [ACK] Seq=301 Ack=7713 Win=5703 Len=0 TSval=4689713 TSecr=5285883 SLE=9161 SRE=10609
   22 1.353031519  10.6.15.144 → 192.168.1.16 SSH 1514 Server: Encrypted packet (len=1448)
   23 1.353049972 192.168.1.16 → 10.6.15.144  TCP 78 [TCP Dup ACK 21#1] 59298 → 22 [ACK] Seq=301 Ack=7713 Win=5703 Len=0 TSval=4689715 TSecr=5285883 SLE=9161 SRE=12057
   24 1.353368153  10.6.15.144 → 192.168.1.16 SSH 1494 Server: Encrypted packet (len=1428)
   25 1.353374199 192.168.1.16 → 10.6.15.144  TCP 78 [TCP Dup ACK 21#2] 59298 → 22 [ACK] Seq=301 Ack=7713 Win=5703 Len=0 TSval=4689715 TSecr=5285883 SLE=9161 SRE=13485
   26 1.363940783  10.6.15.144 → 192.168.1.16 SSH 1514 Server: [TCP Fast Retransmission] , Encrypted packet (len=1448)
   27 1.363971263 192.168.1.16 → 10.6.15.144  TCP 66 59298 → 22 [ACK] Seq=301 Ack=13485 Win=5703 Len=0 TSval=4689718 TSecr=5286068
   28 1.364144451 192.168.1.16 → 10.6.15.144  SSH 102 Client: Encrypted packet (len=36)
   29 1.373653603  10.6.15.144 → 192.168.1.16 TCP 66 22 → 59298 [ACK] Seq=13485 Ack=337 Win=1452 Len=0 TSval=5286071 TSecr=4689718
   30 1.494005060 192.168.1.16 → 10.6.15.144  SSH 118 Client: Encrypted packet (len=52)
   31 1.494873956 192.168.1.16 → 10.6.15.144  SSH 534 Client: Encrypted packet (len=468)
   32 1.504048149  10.6.15.144 → 192.168.1.16 TCP 66 22 → 59298 [ACK] Seq=13485 Ack=389 Win=1452 Len=0 TSval=5286104 TSecr=4689747
   33 1.505702635  10.6.15.144 → 192.168.1.16 TCP 66 22 → 59298 [ACK] Seq=13485 Ack=857 Win=1452 Len=0 TSval=5286104 TSecr=4689751
   34 1.506797768  10.6.15.144 → 192.168.1.16 SSH 110 Server: Encrypted packet (len=44)
   35 1.507130555 192.168.1.16 → 10.6.15.144  SSH 182 Client: Encrypted packet (len=116)
   36 1.507884244  10.6.15.144 → 192.168.1.16 SSH 102 Server: Encrypted packet (len=36)
   37 1.508127731 192.168.1.16 → 10.6.15.144  SSH 470 Client: Encrypted packet (len=404)
   38 1.508988945  10.6.15.144 → 192.168.1.16 SSH 102 Server: Encrypted packet (len=36)
   39 1.509160673 192.168.1.16 → 10.6.15.144  SSH 174 Client: Encrypted packet (len=108)
   40 1.517714125  10.6.15.144 → 192.168.1.16 TCP 66 22 → 59298 [ACK] Seq=13601 Ack=1377 Win=1452 Len=0 TSval=5286107 TSecr=4689754
   41 1.521585696  10.6.15.144 → 192.168.1.16 SSH 1514 Server: Encrypted packet (len=1448)
   42 1.521600719  10.6.15.144 → 192.168.1.16 SSH 1486 Server: Encrypted packet (len=1420)
   43 1.521608151 192.168.1.16 → 10.6.15.144  TCP 66 59298 → 22 [ACK] Seq=1485 Ack=16469 Win=5703 Len=0 TSval=4689757 TSecr=5286108
   44 1.521979615  10.6.15.144 → 192.168.1.16 SSH 230 Server: Encrypted packet (len=164)
   45 1.521994439  10.6.15.144 → 192.168.1.16 SSH 110 Server: Encrypted packet (len=44)
   46 1.522005345 192.168.1.16 → 10.6.15.144  TCP 66 59298 → 22 [ACK] Seq=1485 Ack=16677 Win=5703 Len=0 TSval=4689758 TSecr=5286108
   47 1.522010848  10.6.15.144 → 192.168.1.16 SSH 102 Server: Encrypted packet (len=36)
   48 1.522843892 192.168.1.16 → 10.6.15.144  SSH 350 Client: Encrypted packet (len=284)
   49 1.523692067 192.168.1.16 → 10.6.15.144  SSH 302 Client: Encrypted packet (len=236)
   50 1.524417923 192.168.1.16 → 10.6.15.144  SSH 430 Client: Encrypted packet (len=364)
   51 1.524758413 192.168.1.16 → 10.6.15.144  SSH 158 Client: Encrypted packet (len=92)
   52 1.529642361  10.6.15.144 → 192.168.1.16 SSH 1514 Server: Encrypted packet (len=1448)
   53 1.529728513  10.6.15.144 → 192.168.1.16 SSH 874 Server: Encrypted packet (len=808)
   54 1.529738114 192.168.1.16 → 10.6.15.144  TCP 66 59298 → 22 [ACK] Seq=2461 Ack=18969 Win=5703 Len=0 TSval=4689759 TSecr=5286110
   55 1.530034167 192.168.1.16 → 10.6.15.144  SSH 158 Client: Encrypted packet (len=92)
   56 1.531009272 192.168.1.16 → 10.6.15.144  SSH 334 Client: Encrypted packet (len=268)
   57 1.531436285  10.6.15.144 → 192.168.1.16 TCP 66 22 → 59298 [ACK] Seq=18969 Ack=2005 Win=1452 Len=0 TSval=5286111 TSecr=4689758
   58 1.532173834  10.6.15.144 → 192.168.1.16 TCP 66 22 → 59298 [ACK] Seq=18969 Ack=2461 Win=1452 Len=0 TSval=5286111 TSecr=4689758
   59 1.536466720  10.6.15.144 → 192.168.1.16 SSH 486 Server: Encrypted packet (len=420)
   60 1.539479383  10.6.15.144 → 192.168.1.16 TCP 66 22 → 59298 [ACK] Seq=19389 Ack=2821 Win=1452 Len=0 TSval=5286113 TSecr=4689760
   61 1.544847272  10.6.15.144 → 192.168.1.16 SSH 454 Server: Encrypted packet (len=388)
   62 1.544903858 192.168.1.16 → 10.6.15.144  TCP 66 59298 → 22 [ACK] Seq=2821 Ack=19777 Win=5703 Len=0 TSval=4689763 TSecr=5286112
   63 1.550634388  10.6.15.144 → 192.168.1.16 SSH 222 Server: Encrypted packet (len=156)
   64 1.551160672 192.168.1.16 → 10.6.15.144  SSH 302 Client: Encrypted packet (len=236)
   65 1.557927542  10.6.15.144 → 192.168.1.16 SSH 174 Server: Encrypted packet (len=108)
   66 1.558432324 192.168.1.16 → 10.6.15.144  SSH 302 Client: Encrypted packet (len=236)
   67 1.566652319  10.6.15.144 → 192.168.1.16 SSH 110 Server: Encrypted packet (len=44)
   68 1.567032397 192.168.1.16 → 10.6.15.144  SSH 166 Client: Encrypted packet (len=100)
   69 1.572273529 192.168.1.16 → 10.6.15.144  SSH 102 Client: Encrypted packet (len=36)
   70 1.572730656  10.6.15.144 → 192.168.1.16 SSH 166 Server: Encrypted packet (len=100)
   71 1.573225349 192.168.1.16 → 10.6.15.144  SSH 302 Client: Encrypted packet (len=236)
   72 1.582388510  10.6.15.144 → 192.168.1.16 TCP 66 22 → 59298 [ACK] Seq=20185 Ack=3429 Win=1452 Len=0 TSval=5286123 TSecr=4689769
   73 1.595773241  10.6.15.144 → 192.168.1.16 SSH 166 Server: Encrypted packet (len=100)
   74 1.596799980 192.168.1.16 → 10.6.15.144  SSH 302 Client: Encrypted packet (len=236)
   75 1.641131112  10.6.15.144 → 192.168.1.16 SSH 1514 Server: Encrypted packet (len=1448)
   76 1.641153043  10.6.15.144 → 192.168.1.16 SSH 158 Server: Encrypted packet (len=92)
   77 1.641161297 192.168.1.16 → 10.6.15.144  TCP 66 59298 → 22 [ACK] Seq=3901 Ack=21825 Win=5703 Len=0 TSval=4689787 TSecr=5286138
   78 1.642250864  10.6.15.144 → 192.168.1.16 SSH 1514 Server: Encrypted packet (len=1448)
   79 1.642434918  10.6.15.144 → 192.168.1.16 SSH 1514 Server: Encrypted packet (len=1448)
   80 1.642447759 192.168.1.16 → 10.6.15.144  TCP 66 59298 → 22 [ACK] Seq=3901 Ack=24721 Win=5703 Len=0 TSval=4689788 TSecr=5286138
   81 1.643152772  10.6.15.144 → 192.168.1.16 SSH 1514 Server: Encrypted packet (len=1448)
   82 1.652022125  10.6.15.144 → 192.168.1.16 SSH 1514 Server: Encrypted packet (len=1448)
   83 1.652038678 192.168.1.16 → 10.6.15.144  TCP 66 59298 → 22 [ACK] Seq=3901 Ack=27617 Win=5703 Len=0 TSval=4689790 TSecr=5286138
   84 1.652193673  10.6.15.144 → 192.168.1.16 SSH 1514 Server: Encrypted packet (len=1448)
   85 1.653029287  10.6.15.144 → 192.168.1.16 SSH 1514 Server: Encrypted packet (len=1448)
   86 1.653040721 192.168.1.16 → 10.6.15.144  TCP 66 59298 → 22 [ACK] Seq=3901 Ack=30513 Win=5703 Len=0 TSval=4689790 TSecr=5286140
   87 1.662668851  10.6.15.144 → 192.168.1.16 SSH 1514 Server: [TCP Previous segment not captured] , Encrypted packet (len=1448)
   88 1.662691907 192.168.1.16 → 10.6.15.144  TCP 78 [TCP Dup ACK 86#1] 59298 → 22 [ACK] Seq=3901 Ack=30513 Win=5703 Len=0 TSval=4689793 TSecr=5286140 SLE=31961 SRE=33409
   89 1.662851170  10.6.15.144 → 192.168.1.16 SSH 1514 Server: Encrypted packet (len=1448)
   90 1.662862185 192.168.1.16 → 10.6.15.144  TCP 78 [TCP Dup ACK 86#2] 59298 → 22 [ACK] Seq=3901 Ack=30513 Win=5703 Len=0 TSval=4689793 TSecr=5286140 SLE=31961 SRE=34857
   91 1.663156639  10.6.15.144 → 192.168.1.16 SSH 1266 Server: Encrypted packet (len=1200)
   92 1.663165393 192.168.1.16 → 10.6.15.144  TCP 78 [TCP Dup ACK 86#3] 59298 → 22 [ACK] Seq=3901 Ack=30513 Win=5703 Len=0 TSval=4689793 TSecr=5286140 SLE=31961 SRE=36057
   93 1.673978744  10.6.15.144 → 192.168.1.16 SSH 1514 Server: [TCP Fast Retransmission] , Encrypted packet (len=1448)
   94 1.674004266 192.168.1.16 → 10.6.15.144  TCP 66 59298 → 22 [ACK] Seq=3901 Ack=36057 Win=5703 Len=0 TSval=4689796 TSecr=5286146
   95 1.675121537 192.168.1.16 → 10.6.15.144  SSH 134 Client: Encrypted packet (len=68)
   96 1.675455294 192.168.1.16 → 10.6.15.144  SSH 398 Client: Encrypted packet (len=332)
   97 1.687692781  10.6.15.144 → 192.168.1.16 TCP 66 22 → 59298 [ACK] Seq=36057 Ack=4301 Win=1452 Len=0 TSval=5286149 TSecr=4689796
   98 1.785996961  10.6.15.144 → 192.168.1.16 SSH 1514 Server: Encrypted packet (len=1448)
   99 1.786040783  10.6.15.144 → 192.168.1.16 SSH 614 Server: Encrypted packet (len=548)
  100 1.786049997 192.168.1.16 → 10.6.15.144  TCP 66 59298 → 22 [ACK] Seq=4301 Ack=38053 Win=5703 Len=0 TSval=4689824 TSecr=5286174
  101 1.786820196  10.6.15.144 → 192.168.1.16 SSH 1462 Server: Encrypted packet (len=1396)
  102 1.788562896 192.168.1.16 → 10.6.15.144  SSH 206 Client: Encrypted packet (len=140)
  103 1.839989892  10.6.15.144 → 192.168.1.16 TCP 66 22 → 59298 [ACK] Seq=39449 Ack=4441 Win=1452 Len=0 TSval=5286188 TSecr=4689824
  104 1.871557110  10.6.15.144 → 192.168.1.16 SSH 358 Server: Encrypted packet (len=292)
  105 1.872363009 192.168.1.16 → 10.6.15.144  SSH 638 Client: Encrypted packet (len=572)
  106 1.881810913  10.6.15.144 → 192.168.1.16 TCP 66 22 → 59298 [ACK] Seq=39741 Ack=5013 Win=1452 Len=0 TSval=5286198 TSecr=4689845
  107 1.954557835  10.6.15.144 → 192.168.1.16 SSH 1174 Server: Encrypted packet (len=1108)
  108 1.997957118 192.168.1.16 → 10.6.15.144  TCP 66 59298 → 22 [ACK] Seq=5013 Ack=40849 Win=5703 Len=0 TSval=4689877 TSecr=5286216
  109 2.169959603 192.168.1.16 → 216.58.196.110 TCP 66 47124 → 80 [ACK] Seq=1 Ack=1 Win=273 Len=0 TSval=4689920 TSecr=1019771268
  110 2.309605281 192.168.1.16 → 10.6.15.144  SSH 686 Client: Encrypted packet (len=620)
  111 2.322836769  10.6.15.144 → 192.168.1.16 TCP 66 22 → 59298 [ACK] Seq=40849 Ack=5633 Win=1452 Len=0 TSval=5286308 TSecr=4689954
  112 2.359788623  10.6.15.144 → 192.168.1.16 SSH 182 Server: Encrypted packet (len=116)
  113 2.359816669 192.168.1.16 → 10.6.15.144  TCP 66 59298 → 22 [ACK] Seq=5633 Ack=40965 Win=5703 Len=0 TSval=4689967 TSecr=5286317
  114 2.359836054  10.6.15.144 → 192.168.1.16 SSH 142 Server: Encrypted packet (len=76)
  115 2.359842940 192.168.1.16 → 10.6.15.144  TCP 66 59298 → 22 [ACK] Seq=5633 Ack=41041 Win=5703 Len=0 TSval=4689967 TSecr=5286317
  116 2.360586383 192.168.1.16 → 10.6.15.144  SSH 134 Client: Encrypted packet (len=68)
  117 2.389290879 192.168.1.16 → 10.6.15.144  SSH 1514 Client: Encrypted packet (len=1448)
  118 2.390115687 192.168.1.16 → 10.6.15.144  SSH 222 Client: Encrypted packet (len=156)
  119 2.400120600  10.6.15.144 → 192.168.1.16 TCP 66 22 → 59298 [ACK] Seq=41041 Ack=7149 Win=1452 Len=0 TSval=5286328 TSecr=4689967
  120 2.439801760  10.6.15.144 → 192.168.1.16 TCP 66 22 → 59298 [ACK] Seq=41041 Ack=7305 Win=1452 Len=0 TSval=5286338 TSecr=4689975
  121 2.520900441 192.168.1.16 → 10.6.15.144  SSH 1514 Client: Encrypted packet (len=1448)
  122 2.521768039 192.168.1.16 → 10.6.15.144  SSH 782 Client: Encrypted packet (len=716)
  123 2.531673308  10.6.15.144 → 192.168.1.16 TCP 66 22 → 59298 [ACK] Seq=41041 Ack=8753 Win=1452 Len=0 TSval=5286360 TSecr=4690007
  124 2.531796772  10.6.15.144 → 192.168.1.16 TCP 66 22 → 59298 [ACK] Seq=41041 Ack=9469 Win=1452 Len=0 TSval=5286361 TSecr=4690007
  125 2.586993596 192.168.1.16 → 10.6.15.144  SSH 734 Client: Encrypted packet (len=668)
  126 2.594423541 192.168.1.16 → 10.6.15.144  SSH 126 Client: Encrypted packet (len=60)
  127 2.597394048  10.6.15.144 → 192.168.1.16 TCP 66 22 → 59298 [ACK] Seq=41041 Ack=10137 Win=1452 Len=0 TSval=5286377 TSecr=4690024
  128 2.604310943  10.6.15.144 → 192.168.1.16 TCP 66 22 → 59298 [ACK] Seq=41041 Ack=10197 Win=1452 Len=0 TSval=5286379 TSecr=4690026
  129 2.646191175  10.6.15.144 → 192.168.1.16 SSH 102 Server: Encrypted packet (len=36)
  130 2.665484087  10.6.15.144 → 192.168.1.16 SSH 334 Server: Encrypted packet (len=268)
  131 2.665544920 192.168.1.16 → 10.6.15.144  TCP 66 59298 → 22 [ACK] Seq=10197 Ack=41345 Win=5703 Len=0 TSval=4690043 TSecr=5286389
  132 2.708752207  10.6.15.144 → 192.168.1.16 SSH 870 Server: Encrypted packet (len=804)
  133 2.750007665 192.168.1.16 → 10.6.15.144  TCP 66 59298 → 22 [ACK] Seq=10197 Ack=42149 Win=5703 Len=0 TSval=4690065 TSecr=5286405
  134 2.758056224  10.6.15.144 → 192.168.1.16 SSH 110 Server: Encrypted packet (len=44)
  135 2.758076393 192.168.1.16 → 10.6.15.144  TCP 66 59298 → 22 [ACK] Seq=10197 Ack=42193 Win=5703 Len=0 TSval=4690067 TSecr=5286417
  136 2.758449474 192.168.1.16 → 10.6.15.144  SSH 422 Client: Encrypted packet (len=356)
  137 2.761414666 192.168.1.16 → 10.6.15.144  SSH 526 Client: Encrypted packet (len=460)
  138 2.768409856  10.6.15.144 → 192.168.1.16 TCP 66 22 → 59298 [ACK] Seq=42193 Ack=10553 Win=1452 Len=0 TSval=5286420 TSecr=4690067
  139 2.773617542  10.6.15.144 → 192.168.1.16 TCP 66 22 → 59298 [ACK] Seq=42193 Ack=11013 Win=1452 Len=0 TSval=5286420 TSecr=4690067
  140 2.774606337  10.6.15.144 → 192.168.1.16 SSH 262 Server: Encrypted packet (len=196)
  141 2.774627684  10.6.15.144 → 192.168.1.16 SSH 142 Server: Encrypted packet (len=76)
  142 2.774694041 192.168.1.16 → 10.6.15.144  TCP 66 59298 → 22 [ACK] Seq=11013 Ack=42465 Win=5703 Len=0 TSval=4690071 TSecr=5286421
  143 2.775340242 192.168.1.16 → 10.6.15.144  SSH 134 Client: Encrypted packet (len=68)
  144 2.783009397  10.6.15.144 → 192.168.1.16 SSH 1030 Server: Encrypted packet (len=964)
  145 2.824930150  10.6.15.144 → 192.168.1.16 TCP 66 22 → 59298 [ACK] Seq=43429 Ack=11081 Win=1452 Len=0 TSval=5286434 TSecr=4690071
  146 2.826028743 192.168.1.16 → 10.6.15.144  TCP 66 59298 → 22 [ACK] Seq=11081 Ack=43429 Win=5703 Len=0 TSval=4690084 TSecr=5286423
  147 2.921862717  10.6.15.144 → 192.168.1.16 SSH 230 Server: Encrypted packet (len=164)
  148 2.921885424 192.168.1.16 → 10.6.15.144  TCP 66 59298 → 22 [ACK] Seq=11081 Ack=43593 Win=5703 Len=0 TSval=4690107 TSecr=5286458
  149 2.922223810 192.168.1.16 → 10.6.15.144  SSH 134 Client: Encrypted packet (len=68)
  150 2.924028725 192.168.1.16 → 10.6.15.144  SSH 710 Client: Encrypted packet (len=644)
  151 2.931058216  10.6.15.144 → 192.168.1.16 TCP 66 22 → 59298 [ACK] Seq=43593 Ack=11149 Win=1452 Len=0 TSval=5286461 TSecr=4690108
  152 2.933423437  10.6.15.144 → 192.168.1.16 TCP 66 22 → 59298 [ACK] Seq=43593 Ack=11793 Win=1452 Len=0 TSval=5286461 TSecr=4690108
  153 2.995259259 192.168.1.16 → 10.6.15.144  SSH 478 Client: Encrypted packet (len=412)
  154 3.004147606  10.6.15.144 → 192.168.1.16 TCP 66 22 → 59298 [ACK] Seq=43593 Ack=12205 Win=1452 Len=0 TSval=5286479 TSecr=4690126
  155 3.007599130  10.6.15.144 → 192.168.1.16 SSH 254 Server: Encrypted packet (len=188)
  156 3.008291007 192.168.1.16 → 10.6.15.144  SSH 134 Client: Encrypted packet (len=68)
  157 3.026031269 192.168.1.16 → 10.6.15.144  SSH 494 Client: Encrypted packet (len=428)
  158 3.036048787  10.6.15.144 → 192.168.1.16 TCP 66 22 → 59298 [ACK] Seq=43781 Ack=12701 Win=1452 Len=0 TSval=5286487 TSecr=4690129
  159 3.039691897  10.6.15.144 → 192.168.1.16 SSH 246 Server: Encrypted packet (len=180)
  160 3.040407820 192.168.1.16 → 10.6.15.144  SSH 134 Client: Encrypted packet (len=68)
  161 3.086388540  10.6.15.144 → 192.168.1.16 TCP 66 22 → 59298 [ACK] Seq=43961 Ack=12769 Win=1452 Len=0 TSval=5286500 TSecr=4690137
  162 3.091676900  10.6.15.144 → 192.168.1.16 SSH 566 Server: Encrypted packet (len=500)
  163 3.134014380 192.168.1.16 → 10.6.15.144  TCP 66 59298 → 22 [ACK] Seq=12769 Ack=44461 Win=5703 Len=0 TSval=4690161 TSecr=5286501
  164 3.218964967 10.22.19.186 → 224.0.0.252  LLMNR 64 Standard query 0xb0b5 A wpad
  165 4.316049997  10.6.15.144 → 192.168.1.16 SSH 134 Server: Encrypted packet (len=68)
  166 4.316108854 192.168.1.16 → 10.6.15.144  TCP 66 59298 → 22 [ACK] Seq=12769 Ack=44529 Win=5703 Len=0 TSval=4690456 TSecr=5286581
  167 4.316164032  10.6.15.144 → 192.168.1.16 SSH 102 Server: Encrypted packet (len=36)
  168 4.316185511 192.168.1.16 → 10.6.15.144  TCP 66 59298 → 22 [ACK] Seq=12769 Ack=44565 Win=5703 Len=0 TSval=4690456 TSecr=5286581
  169 4.316210525  10.6.15.144 → 192.168.1.16 SSH 102 Server: [TCP Spurious Retransmission] , Encrypted packet (len=36)
  170 4.316228597 192.168.1.16 → 10.6.15.144  TCP 78 [TCP Dup ACK 168#1] 59298 → 22 [ACK] Seq=12769 Ack=44565 Win=5703 Len=0 TSval=4690456 TSecr=5286595 SLE=44529 SRE=44565
  171 4.316253274 10.22.19.186 → 224.0.0.252  LLMNR 64 Standard query 0xb0b5 A wpad
  172 4.316296489  10.6.15.144 → 192.168.1.16 SSH 170 Server: [TCP Spurious Retransmission] , Encrypted packet (len=104)
  173 4.316316495 192.168.1.16 → 10.6.15.144  TCP 78 [TCP Dup ACK 168#2] 59298 → 22 [ACK] Seq=12769 Ack=44565 Win=5703 Len=0 TSval=4690456 TSecr=5286654 SLE=44461 SRE=44565
  174 4.316344425  10.6.15.144 → 192.168.1.16 SSH 170 Server: [TCP Spurious Retransmission] , Encrypted packet (len=104)
  175 4.316356463 192.168.1.16 → 10.6.15.144  TCP 78 [TCP Dup ACK 168#3] 59298 → 22 [ACK] Seq=12769 Ack=44565 Win=5703 Len=0 TSval=4690456 TSecr=5286772 SLE=44461 SRE=44565
  176 4.316990243 192.168.1.16 → 10.6.15.144  SSH 138 Client: Encrypted packet (len=72)
  177 4.326232567  10.6.15.144 → 192.168.1.16 TCP 66 22 → 59298 [ACK] Seq=44565 Ack=12841 Win=1452 Len=0 TSval=5286809 TSecr=4690456
  178 4.326723218  10.6.15.144 → 192.168.1.16 SSH 102 Server: Encrypted packet (len=36)
  179 4.370008425 192.168.1.16 → 10.6.15.144  TCP 66 59298 → 22 [ACK] Seq=12841 Ack=44601 Win=5703 Len=0 TSval=4690470 TSecr=5286809
  180 8.320130443 10.22.16.104 → 224.0.0.252  LLMNR 64 Standard query 0x1834 A wpad
  181 8.320172857 10.22.16.104 → 224.0.0.252  LLMNR 64 Standard query 0x1834 A wpad
  182 9.307944605  10.6.15.144 → 192.168.1.16 SSH 102 Server: Encrypted packet (len=36)
  183 9.307968296 192.168.1.16 → 10.6.15.144  TCP 66 59298 → 22 [ACK] Seq=12841 Ack=44637 Win=5703 Len=0 TSval=4691704 TSecr=5287888
  184 9.307984126  10.6.15.144 → 192.168.1.16 SSH 102 Server: [TCP Spurious Retransmission] , Encrypted packet (len=36)
  185 9.307988834 192.168.1.16 → 10.6.15.144  TCP 78 [TCP Dup ACK 183#1] 59298 → 22 [ACK] Seq=12841 Ack=44637 Win=5703 Len=0 TSval=4691704 TSecr=5287986 SLE=44601 SRE=44637
  186 12.315969073  10.6.15.144 → 192.168.1.16 SSH 102 Server: Encrypted packet (len=36)
  187 12.315996246 192.168.1.16 → 10.6.15.144  TCP 66 59298 → 22 [ACK] Seq=12841 Ack=44673 Win=5703 Len=0 TSval=4692456 TSecr=5288615
  188 12.316030493  10.6.15.144 → 192.168.1.16 SSH 102 Server: [TCP Spurious Retransmission] , Encrypted packet (len=36)
  189 12.316039440 192.168.1.16 → 10.6.15.144  TCP 78 [TCP Dup ACK 187#1] 59298 → 22 [ACK] Seq=12841 Ack=44673 Win=5703 Len=0 TSval=4692456 TSecr=5288738 SLE=44637 SRE=44673
  190 12.380401785 192.168.1.16 → 10.6.15.144  SSH 1514 Client: Encrypted packet (len=1448)
  191 12.381357702 192.168.1.16 → 10.6.15.144  SSH 366 Client: Encrypted packet (len=300)
  192 12.391405419  10.6.15.144 → 192.168.1.16 TCP 66 22 → 59298 [ACK] Seq=44673 Ack=14589 Win=1452 Len=0 TSval=5288825 TSecr=4692472
  193 12.410712749  10.6.15.144 → 192.168.1.16 SSH 142 Server: Encrypted packet (len=76)
  194 12.410729250 192.168.1.16 → 10.6.15.144  TCP 66 59298 → 22 [ACK] Seq=14589 Ack=44749 Win=5703 Len=0 TSval=4692480 TSecr=5288830
  195 13.340164278  10.6.15.144 → 192.168.1.16 SSH 1038 Server: Encrypted packet (len=972)
  196 13.340195450 192.168.1.16 → 10.6.15.144  TCP 66 59298 → 22 [ACK] Seq=14589 Ack=45721 Win=5703 Len=0 TSval=4692712 TSecr=5288859
  197 13.340216405  10.6.15.144 → 192.168.1.16 SSH 510 Server: Encrypted packet (len=444)
  198 13.340224177 192.168.1.16 → 10.6.15.144  TCP 66 59298 → 22 [ACK] Seq=14589 Ack=46165 Win=5703 Len=0 TSval=4692712 TSecr=5288859
  199 13.340233491  10.6.15.144 → 192.168.1.16 SSH 510 Server: [TCP Spurious Retransmission] , Encrypted packet (len=444)
  200 13.340238931 192.168.1.16 → 10.6.15.144  TCP 78 [TCP Dup ACK 198#1] 59298 → 22 [ACK] Seq=14589 Ack=46165 Win=5703 Len=0 TSval=4692712 TSecr=5288977 SLE=45721 SRE=46165
  201 13.341207544 192.168.1.16 → 10.6.15.144  SSH 134 Client: Encrypted packet (len=68)
  202 13.388334724  10.6.15.144 → 192.168.1.16 TCP 66 22 → 59298 [ACK] Seq=46165 Ack=14657 Win=1452 Len=0 TSval=5289075 TSecr=4692712
  203 14.300013528  10.6.15.144 → 192.168.1.16 SSH 102 Server: Encrypted packet (len=36)
  204 14.300057582  10.6.15.144 → 192.168.1.16 TCP 102 [TCP Retransmission] 22 → 59298 [PSH, ACK] Seq=46165 Ack=14657 Win=1452 Len=36 TSval=5289294 TSecr=4692712
  205 14.300075608 192.168.1.16 → 10.6.15.144  TCP 78 59298 → 22 [ACK] Seq=14657 Ack=46201 Win=5703 Len=0 TSval=4692952 TSecr=5289294 SLE=46165 SRE=46201
  206 17.307945217  10.6.15.144 → 192.168.1.16 SSH 102 Server: Encrypted packet (len=36)
  207 17.307980213 192.168.1.16 → 10.6.15.144  TCP 66 59298 → 22 [ACK] Seq=14657 Ack=46237 Win=5703 Len=0 TSval=4693704 TSecr=5289849
  208 18.299878778  10.6.15.144 → 192.168.1.16 SSH 102 Server: Encrypted packet (len=36)
  209 18.299910604 192.168.1.16 → 10.6.15.144  TCP 66 59298 → 22 [ACK] Seq=14657 Ack=46273 Win=5703 Len=0 TSval=4693952 TSecr=5290103
  210 18.300251813  10.6.15.144 → 192.168.1.16 SSH 102 Server: [TCP Spurious Retransmission] , Encrypted packet (len=36)
  211 18.300274354 192.168.1.16 → 10.6.15.144  TCP 78 [TCP Dup ACK 209#1] 59298 → 22 [ACK] Seq=14657 Ack=46273 Win=5703 Len=0 TSval=4693952 TSecr=5290301 SLE=46237 SRE=46273
  212 18.554015477 192.168.1.16 → 180.149.60.78 TCP 66 33168 → 80 [RST, ACK] Seq=1 Ack=1 Win=477 Len=0 TSval=4694016 TSecr=1019750278
  213 18.554831093 192.168.1.16 → 180.149.60.76 TCP 66 41596 → 80 [RST, ACK] Seq=1 Ack=1 Win=319 Len=0 TSval=4694016 TSecr=1019750265
  214 19.020079686 fe80::60bd:1940:a0d8:49f9 → ff02::fb     MDNS 124 Standard query 0x0000 PTR _nmea-0183._tcp.local, "QM" question PTR _ipp._tcp.local, "QM" question PTR _ipps._tcp.local, "QM" question
  215 20.792284950 192.168.1.16 → 224.0.0.251  MDNS 104 Standard query 0x0000 PTR _nmea-0183._tcp.local, "QM" question PTR _ipp._tcp.local, "QM" question PTR _ipps._tcp.local, "QM" question
  216 20.813931835  10.6.15.144 → 192.168.1.16 SSH 102 Server: Encrypted packet (len=36)
  217 20.813949184 192.168.1.16 → 10.6.15.144  TCP 66 59298 → 22 [ACK] Seq=14657 Ack=46309 Win=5703 Len=0 TSval=4694580 TSecr=5290931
  218 23.323953341  10.6.15.144 → 192.168.1.16 SSH 126 Server: Encrypted packet (len=60)
  219 23.323971137 192.168.1.16 → 10.6.15.144  TCP 66 59298 → 22 [ACK] Seq=14657 Ack=46369 Win=5703 Len=0 TSval=4695208 TSecr=5291501
  220 23.333906290  10.6.15.144 → 192.168.1.16 SSH 102 Server: Encrypted packet (len=36)
  221 23.333924589 192.168.1.16 → 10.6.15.144  TCP 66 59298 → 22 [ACK] Seq=14657 Ack=46405 Win=5703 Len=0 TSval=4695210 TSecr=5291561
