    1 0.000000000  10.6.15.144 → 192.168.1.16 SSH 1514 Server: Encrypted packet (len=1448)
    2 0.000016106 192.168.1.16 → 10.6.15.144  TCP 66 59298 → 22 [ACK] Seq=1 Ack=1449 Win=5703 Len=0 TSval=4704722 TSecr=5301047
    3 0.000674066  10.6.15.144 → 192.168.1.16 SSH 438 Server: Encrypted packet (len=372)
    4 0.006486061 192.168.1.16 → 10.6.15.144  SSH 646 Client: Encrypted packet (len=580)
    5 0.053786397  10.6.15.144 → 192.168.1.16 TCP 66 22 → 59298 [ACK] Seq=1821 Ack=581 Win=1452 Len=0 TSval=5301087 TSecr=4704724
    6 0.115699125  10.6.15.144 → 192.168.1.16 SSH 142 Server: Encrypted packet (len=76)
    7 0.115959357 192.168.1.16 → 10.6.15.144  SSH 134 Client: Encrypted packet (len=68)
    8 0.126065345  10.6.15.144 → 192.168.1.16 TCP 66 22 → 59298 [ACK] Seq=1897 Ack=649 Win=1452 Len=0 TSval=5301105 TSecr=4704751
    9 0.919014487  10.6.15.144 → 192.168.1.16 SSH 1514 Server: Encrypted packet (len=1448)
   10 0.919197818  10.6.15.144 → 192.168.1.16 SSH 1514 Server: Encrypted packet (len=1448)
   11 0.919207930 192.168.1.16 → 10.6.15.144  TCP 66 59298 → 22 [ACK] Seq=649 Ack=4793 Win=5703 Len=0 TSval=4704952 TSecr=5301239
   12 0.919222841  10.6.15.144 → 192.168.1.16 SSH 110 Server: Encrypted packet (len=44)
   13 0.919557238  10.6.15.144 → 192.168.1.16 SSH 1514 Server: Encrypted packet (len=1448)
   14 0.919562749 192.168.1.16 → 10.6.15.144  TCP 66 59298 → 22 [ACK] Seq=649 Ack=6285 Win=5703 Len=0 TSval=4704952 TSecr=5301239
   15 0.930243049  10.6.15.144 → 192.168.1.16 SSH 1514 Server: Encrypted packet (len=1448)
   16 0.930387836  10.6.15.144 → 192.168.1.16 SSH 1514 Server: Encrypted packet (len=1448)
   17 0.930397704 192.168.1.16 → 10.6.15.144  TCP 66 59298 → 22 [ACK] Seq=649 Ack=9181 Win=5703 Len=0 TSval=4704955 TSecr=5301305
   18 0.930584518  10.6.15.144 → 192.168.1.16 SSH 1514 Server: Encrypted packet (len=1448)
   19 0.940195793  10.6.15.144 → 192.168.1.16 SSH 1514 Server: Encrypted packet (len=1448)
   20 0.940212419 192.168.1.16 → 10.6.15.144  TCP 66 59298 → 22 [ACK] Seq=649 Ack=12077 Win=5703 Len=0 TSval=4704957 TSecr=5301305
   21 0.940311627  10.6.15.144 → 192.168.1.16 SSH 1474 Server: Encrypted packet (len=1408)
   22 0.980892584 192.168.1.16 → 10.6.15.144  TCP 66 59298 → 22 [ACK] Seq=649 Ack=13485 Win=5703 Len=0 TSval=4704968 TSecr=5301308
   23 0.987931432 192.168.1.16 → 239.255.255.250 SSDP 213 M-SEARCH * HTTP/1.1 
   24 1.085252467 192.168.1.16 → 10.6.15.144  SSH 126 Client: Encrypted packet (len=60)
   25 1.086491354 192.168.1.16 → 10.6.15.144  SSH 346 Client: Encrypted packet (len=280)
   26 1.088442505 192.168.1.16 → 10.6.15.144  SSH 254 Client: Encrypted packet (len=188)
   27 1.095021142  10.6.15.144 → 192.168.1.16 TCP 66 22 → 59298 [ACK] Seq=13485 Ack=709 Win=1452 Len=0 TSval=5301347 TSecr=4704994
   28 1.096394172  10.6.15.144 → 192.168.1.16 TCP 66 22 → 59298 [ACK] Seq=13485 Ack=989 Win=1452 Len=0 TSval=5301347 TSecr=4704994
   29 1.097391897  10.6.15.144 → 192.168.1.16 SSH 110 Server: Encrypted packet (len=44)
   30 1.097403307 192.168.1.16 → 10.6.15.144  TCP 66 59298 → 22 [ACK] Seq=1177 Ack=13529 Win=5703 Len=0 TSval=4704997 TSecr=5301347
   31 1.097706076 192.168.1.16 → 10.6.15.144  SSH 174 Client: Encrypted packet (len=108)
   32 1.100367863  10.6.15.144 → 192.168.1.16 SSH 102 Server: Encrypted packet (len=36)
   33 1.100647160 192.168.1.16 → 10.6.15.144  SSH 174 Client: Encrypted packet (len=108)
   34 1.106655663  10.6.15.144 → 192.168.1.16 SSH 102 Server: Encrypted packet (len=36)
   35 1.107053840 192.168.1.16 → 10.6.15.144  SSH 470 Client: Encrypted packet (len=404)
   36 1.110551210  10.6.15.144 → 192.168.1.16 TCP 66 22 → 59298 [ACK] Seq=13601 Ack=1393 Win=1452 Len=0 TSval=5301351 TSecr=4704997
   37 1.112205893  10.6.15.144 → 192.168.1.16 SSH 950 Server: Encrypted packet (len=884)
   38 1.112528201  10.6.15.144 → 192.168.1.16 SSH 1514 Server: Encrypted packet (len=1448)
   39 1.112539074 192.168.1.16 → 10.6.15.144  TCP 66 59298 → 22 [ACK] Seq=1797 Ack=15933 Win=5703 Len=0 TSval=4705000 TSecr=5301351
   40 1.117396200  10.6.15.144 → 192.168.1.16 SSH 1514 Server: Encrypted packet (len=1448)
   41 1.119022965 192.168.1.16 → 10.6.15.144  SSH 350 Client: Encrypted packet (len=284)
   42 1.120298661 192.168.1.16 → 10.6.15.144  SSH 430 Client: Encrypted packet (len=364)
   43 1.122804121  10.6.15.144 → 192.168.1.16 SSH 1514 Server: Encrypted packet (len=1448)
   44 1.122819750  10.6.15.144 → 192.168.1.16 SSH 258 Server: Encrypted packet (len=192)
   45 1.122831032 192.168.1.16 → 10.6.15.144  TCP 66 59298 → 22 [ACK] Seq=2445 Ack=19021 Win=5703 Len=0 TSval=4705003 TSecr=5301354
   46 1.123198264 192.168.1.16 → 10.6.15.144  SSH 158 Client: Encrypted packet (len=92)
   47 1.124707332 192.168.1.16 → 10.6.15.144  SSH 334 Client: Encrypted packet (len=268)
   48 1.125402147  10.6.15.144 → 192.168.1.16 SSH 102 Server: Encrypted packet (len=36)
   49 1.129969618  10.6.15.144 → 192.168.1.16 TCP 66 22 → 59298 [ACK] Seq=19057 Ack=2445 Win=1452 Len=0 TSval=5301356 TSecr=4705002
   50 1.129992664 192.168.1.16 → 10.6.15.144  SSH 486 Client: Encrypted packet (len=420)
   51 1.134767429  10.6.15.144 → 192.168.1.16 TCP 66 22 → 59298 [ACK] Seq=19057 Ack=2805 Win=1452 Len=0 TSval=5301357 TSecr=4705003
   52 1.138300481  10.6.15.144 → 192.168.1.16 SSH 486 Server: Encrypted packet (len=420)
   53 1.146864440  10.6.15.144 → 192.168.1.16 SSH 214 Server: Encrypted packet (len=148)
   54 1.146930107 192.168.1.16 → 10.6.15.144  TCP 66 59298 → 22 [ACK] Seq=3225 Ack=19625 Win=5703 Len=0 TSval=4705009 TSecr=5301358
   55 1.147372475 192.168.1.16 → 10.6.15.144  SSH 302 Client: Encrypted packet (len=236)
   56 1.151046760  10.6.15.144 → 192.168.1.16 SSH 166 Server: Encrypted packet (len=100)
   57 1.151604981 192.168.1.16 → 10.6.15.144  SSH 302 Client: Encrypted packet (len=236)
   58 1.155720809  10.6.15.144 → 192.168.1.16 SSH 266 Server: Encrypted packet (len=200)
   59 1.156210593 192.168.1.16 → 10.6.15.144  SSH 302 Client: Encrypted packet (len=236)
   60 1.159384304 192.168.1.16 → 10.6.15.144  SSH 294 Client: Encrypted packet (len=228)
   61 1.161501173  10.6.15.144 → 192.168.1.16 TCP 66 22 → 59298 [ACK] Seq=19925 Ack=3697 Win=1452 Len=0 TSval=5301364 TSecr=4705009
   62 1.167891014  10.6.15.144 → 192.168.1.16 TCP 66 22 → 59298 [ACK] Seq=19925 Ack=4161 Win=1452 Len=0 TSval=5301366 TSecr=4705011
   63 1.177104024 192.168.1.16 → 10.6.15.144  SSH 110 Client: Encrypted packet (len=44)
   64 1.225681228  10.6.15.144 → 192.168.1.16 TCP 66 22 → 59298 [ACK] Seq=19925 Ack=4205 Win=1452 Len=0 TSval=5301380 TSecr=4705017
   65 1.235556714  10.6.15.144 → 192.168.1.16 SSH 182 Server: Encrypted packet (len=116)
   66 1.235770979  10.6.15.144 → 192.168.1.16 SSH 1514 Server: Encrypted packet (len=1448)
   67 1.235779355 192.168.1.16 → 10.6.15.144  TCP 66 59298 → 22 [ACK] Seq=4205 Ack=21489 Win=5703 Len=0 TSval=4705031 TSecr=5301381
   68 1.235960033  10.6.15.144 → 192.168.1.16 SSH 1494 Server: Encrypted packet (len=1428)
   69 1.236153293  10.6.15.144 → 192.168.1.16 SSH 1514 Server: Encrypted packet (len=1448)
   70 1.236159237 192.168.1.16 → 10.6.15.144  TCP 66 59298 → 22 [ACK] Seq=4205 Ack=24365 Win=5703 Len=0 TSval=4705031 TSecr=5301382
   71 1.245649362  10.6.15.144 → 192.168.1.16 SSH 1514 Server: Encrypted packet (len=1448)
   72 1.245836249  10.6.15.144 → 192.168.1.16 SSH 1514 Server: Encrypted packet (len=1448)
   73 1.245845280 192.168.1.16 → 10.6.15.144  TCP 66 59298 → 22 [ACK] Seq=4205 Ack=27261 Win=5703 Len=0 TSval=4705034 TSecr=5301385
   74 1.246167110  10.6.15.144 → 192.168.1.16 SSH 1514 Server: Encrypted packet (len=1448)
   75 1.246357186  10.6.15.144 → 192.168.1.16 SSH 1514 Server: Encrypted packet (len=1448)
   76 1.246362067 192.168.1.16 → 10.6.15.144  TCP 66 59298 → 22 [ACK] Seq=4205 Ack=30157 Win=5703 Len=0 TSval=4705034 TSecr=5301385
   77 1.255725684  10.6.15.144 → 192.168.1.16 SSH 1514 Server: Encrypted packet (len=1448)
   78 1.255917430  10.6.15.144 → 192.168.1.16 SSH 1514 Server: Encrypted packet (len=1448)
   79 1.255925912 192.168.1.16 → 10.6.15.144  TCP 66 59298 → 22 [ACK] Seq=4205 Ack=33053 Win=5703 Len=0 TSval=4705036 TSecr=5301387
   80 1.256119333  10.6.15.144 → 192.168.1.16 SSH 1514 Server: Encrypted packet (len=1448)
   81 1.256281574  10.6.15.144 → 192.168.1.16 SSH 1454 Server: Encrypted packet (len=1388)
   82 1.256286233 192.168.1.16 → 10.6.15.144  TCP 66 59298 → 22 [ACK] Seq=4205 Ack=35889 Win=5703 Len=0 TSval=4705036 TSecr=5301387
   83 1.257278718 192.168.1.16 → 10.6.15.144  SSH 134 Client: Encrypted packet (len=68)
   84 1.257773199 192.168.1.16 → 10.6.15.144  SSH 398 Client: Encrypted packet (len=332)
   85 1.264941296  10.6.15.144 → 192.168.1.16 TCP 66 22 → 59298 [ACK] Seq=35889 Ack=4273 Win=1452 Len=0 TSval=5301390 TSecr=4705037
   86 1.265069645  10.6.15.144 → 192.168.1.16 TCP 66 22 → 59298 [ACK] Seq=35889 Ack=4605 Win=1452 Len=0 TSval=5301390 TSecr=4705037
   87 1.333002862  10.6.15.144 → 192.168.1.16 SSH 454 Server: Encrypted packet (len=388)
   88 1.340967983  10.6.15.144 → 192.168.1.16 SSH 1514 Server: Encrypted packet (len=1448)
   89 1.340990476 192.168.1.16 → 10.6.15.144  TCP 66 59298 → 22 [ACK] Seq=4605 Ack=37725 Win=5703 Len=0 TSval=4705058 TSecr=5301406
   90 1.390369024  10.6.15.144 → 192.168.1.16 SSH 1462 Server: [TCP Previous segment not captured] , Encrypted packet (len=1396)
   91 1.390392064 192.168.1.16 → 10.6.15.144  TCP 78 [TCP Dup ACK 89#1] 59298 → 22 [ACK] Seq=4605 Ack=37725 Win=5703 Len=0 TSval=4705070 TSecr=5301406 SLE=38273 SRE=39669
   92 1.572671078 192.168.1.16 → 10.6.15.144  SSH 714 Client: Encrypted packet (len=636)
   93 1.583053915  10.6.15.144 → 192.168.1.16 TCP 66 22 → 59298 [ACK] Seq=39669 Ack=5241 Win=1452 Len=0 TSval=5301469 TSecr=4705115
   94 1.624286820  10.6.15.144 → 192.168.1.16 SSH 158 Server: Encrypted packet (len=92)
   95 1.624307831 192.168.1.16 → 10.6.15.144  TCP 78 [TCP Dup ACK 89#2] 59298 → 22 [ACK] Seq=5241 Ack=37725 Win=5703 Len=0 TSval=4705128 TSecr=5301406 SLE=38273 SRE=39761
   96 1.624325228  10.6.15.144 → 192.168.1.16 SSH 142 Server: Encrypted packet (len=76)
   97 1.624330497 192.168.1.16 → 10.6.15.144  TCP 78 [TCP Dup ACK 89#3] 59298 → 22 [ACK] Seq=5241 Ack=37725 Win=5703 Len=0 TSval=4705128 TSecr=5301406 SLE=38273 SRE=39837
   98 1.630044964  10.6.15.144 → 192.168.1.16 SSH 614 Server: [TCP Fast Retransmission] , Encrypted packet (len=548)
   99 1.630062749 192.168.1.16 → 10.6.15.144  TCP 66 59298 → 22 [ACK] Seq=5241 Ack=39837 Win=5703 Len=0 TSval=4705130 TSecr=5301481
  100 1.630734101 192.168.1.16 → 10.6.15.144  SSH 134 Client: Encrypted packet (len=68)
  101 1.631564606 192.168.1.16 → 10.6.15.144  SSH 206 Client: Encrypted packet (len=140)
  102 1.640846742  10.6.15.144 → 192.168.1.16 TCP 66 22 → 59298 [ACK] Seq=39837 Ack=5309 Win=1452 Len=0 TSval=5301483 TSecr=4705130
  103 1.641318029  10.6.15.144 → 192.168.1.16 TCP 66 22 → 59298 [ACK] Seq=39837 Ack=5449 Win=1452 Len=0 TSval=5301483 TSecr=4705130
  104 1.710025947  10.6.15.144 → 192.168.1.16 SSH 366 Server: Encrypted packet (len=300)
  105 1.710570050 192.168.1.16 → 10.6.15.144  SSH 646 Client: Encrypted packet (len=580)
  106 1.720815600  10.6.15.144 → 192.168.1.16 TCP 66 22 → 59298 [ACK] Seq=40137 Ack=6029 Win=1452 Len=0 TSval=5301503 TSecr=4705150
  107 1.795044476  10.6.15.144 → 192.168.1.16 SSH 1174 Server: Encrypted packet (len=1108)
  108 1.836896909 192.168.1.16 → 10.6.15.144  TCP 66 59298 → 22 [ACK] Seq=6029 Ack=41245 Win=5703 Len=0 TSval=4705182 TSecr=5301522
  109 1.988095572 192.168.1.16 → 239.255.255.250 SSDP 213 M-SEARCH * HTTP/1.1 
  110 1.992627686 192.168.1.16 → 10.6.15.144  SSH 1514 Client: Encrypted packet (len=1448)
  111 1.993113585 192.168.1.16 → 10.6.15.144  SSH 222 Client: Encrypted packet (len=156)
  112 2.004310076  10.6.15.144 → 192.168.1.16 TCP 66 22 → 59298 [ACK] Seq=41245 Ack=7477 Win=1452 Len=0 TSval=5301574 TSecr=4705220
  113 2.004331555  10.6.15.144 → 192.168.1.16 TCP 66 22 → 59298 [ACK] Seq=41245 Ack=7633 Win=1452 Len=0 TSval=5301574 TSecr=4705221
  114 2.013353182 192.168.1.16 → 10.6.15.144  SSH 406 Client: Encrypted packet (len=340)
  115 2.023132111  10.6.15.144 → 192.168.1.16 TCP 66 22 → 59298 [ACK] Seq=41245 Ack=7973 Win=1452 Len=0 TSval=5301579 TSecr=4705226
  116 2.034171688 192.168.1.16 → 10.6.15.144  SSH 1514 Client: Encrypted packet (len=1448)
  117 2.034635384 192.168.1.16 → 10.6.15.144  SSH 782 Client: Encrypted packet (len=716)
  118 2.044694307  10.6.15.144 → 192.168.1.16 TCP 66 22 → 59298 [ACK] Seq=41245 Ack=10137 Win=1447 Len=0 TSval=5301584 TSecr=4705231
  119 2.094478059 192.168.1.16 → 10.6.15.144  SSH 126 Client: Encrypted packet (len=60)
  120 2.095249530 192.168.1.16 → 10.6.15.144  SSH 734 Client: Encrypted packet (len=668)
  121 2.102032949  10.6.15.144 → 192.168.1.16 TCP 66 22 → 59298 [ACK] Seq=41245 Ack=10197 Win=1452 Len=0 TSval=5301599 TSecr=4705246
  122 2.103250478  10.6.15.144 → 192.168.1.16 TCP 66 22 → 59298 [ACK] Seq=41245 Ack=10865 Win=1452 Len=0 TSval=5301599 TSecr=4705246
  123 2.184776999  10.6.15.144 → 192.168.1.16 SSH 334 Server: Encrypted packet (len=268)
  124 2.184793506 192.168.1.16 → 10.6.15.144  TCP 66 59298 → 22 [ACK] Seq=10865 Ack=41513 Win=5703 Len=0 TSval=4705268 TSecr=5301619
  125 2.254166412  10.6.15.144 → 192.168.1.16 SSH 110 Server: Encrypted packet (len=44)
  126 2.254182311 192.168.1.16 → 10.6.15.144  TCP 66 59298 → 22 [ACK] Seq=10865 Ack=41557 Win=5703 Len=0 TSval=4705286 TSecr=5301637
  127 2.254553535 192.168.1.16 → 10.6.15.144  SSH 422 Client: Encrypted packet (len=356)
  128 2.264353592  10.6.15.144 → 192.168.1.16 TCP 66 22 → 59298 [ACK] Seq=41557 Ack=11221 Win=1452 Len=0 TSval=5301639 TSecr=4705286
  129 2.298266699  10.6.15.144 → 192.168.1.16 SSH 1366 Server: Encrypted packet (len=1300)
  130 2.318121283  10.6.15.144 → 192.168.1.16 SSH 870 Server: Encrypted packet (len=804)
  131 2.318136428 192.168.1.16 → 10.6.15.144  TCP 66 59298 → 22 [ACK] Seq=11221 Ack=43661 Win=5703 Len=0 TSval=4705302 TSecr=5301647
  132 2.332903049  10.6.15.144 → 192.168.1.16 SSH 190 Server: Encrypted packet (len=124)
  133 2.333771016  10.6.15.144 → 192.168.1.16 SSH 1514 Server: Encrypted packet (len=1448)
  134 2.333789032 192.168.1.16 → 10.6.15.144  TCP 66 59298 → 22 [ACK] Seq=11221 Ack=45233 Win=5703 Len=0 TSval=4705306 TSecr=5301656
  135 2.333812244  10.6.15.144 → 192.168.1.16 SSH 78 Server: Encrypted packet (len=12)
  136 2.344214556  10.6.15.144 → 192.168.1.16 SSH 1514 Server: Encrypted packet (len=1448)
  137 2.344231877 192.168.1.16 → 10.6.15.144  TCP 66 59298 → 22 [ACK] Seq=11221 Ack=46693 Win=5703 Len=0 TSval=4705308 TSecr=5301656
  138 2.344394777  10.6.15.144 → 192.168.1.16 SSH 1514 Server: Encrypted packet (len=1448)
  139 2.355140774  10.6.15.144 → 192.168.1.16 SSH 1514 Server: Encrypted packet (len=1448)
  140 2.355152767 192.168.1.16 → 10.6.15.144  TCP 66 59298 → 22 [ACK] Seq=11221 Ack=49589 Win=5703 Len=0 TSval=4705311 TSecr=5301659
  141 2.365740603  10.6.15.144 → 192.168.1.16 SSH 1514 Server: [TCP Previous segment not captured] , Encrypted packet (len=1448)
  142 2.365762493 192.168.1.16 → 10.6.15.144  TCP 78 [TCP Dup ACK 140#1] 59298 → 22 [ACK] Seq=11221 Ack=49589 Win=5703 Len=0 TSval=4705314 TSecr=5301659 SLE=51037 SRE=52485
  143 2.365924749  10.6.15.144 → 192.168.1.16 SSH 1514 Server: Encrypted packet (len=1448)
  144 2.365935969 192.168.1.16 → 10.6.15.144  TCP 78 [TCP Dup ACK 140#2] 59298 → 22 [ACK] Seq=11221 Ack=49589 Win=5703 Len=0 TSval=4705314 TSecr=5301659 SLE=51037 SRE=53933
  145 2.376695560  10.6.15.144 → 192.168.1.16 SSH 1486 Server: Encrypted packet (len=1420)
  146 2.376719263 192.168.1.16 → 10.6.15.144  TCP 78 [TCP Dup ACK 140#3] 59298 → 22 [ACK] Seq=11221 Ack=49589 Win=5703 Len=0 TSval=4705316 TSecr=5301659 SLE=51037 SRE=55353
  147 2.387172849  10.6.15.144 → 192.168.1.16 SSH 1514 Server: [TCP Fast Retransmission] , Encrypted packet (len=1448)
  148 2.387200393 192.168.1.16 → 10.6.15.144  TCP 66 59298 → 22 [ACK] Seq=11221 Ack=55353 Win=5703 Len=0 TSval=4705319 TSecr=5301670
  149 2.388341674 192.168.1.16 → 10.6.15.144  SSH 134 Client: Encrypted packet (len=68)
  150 2.409522621 192.168.1.16 → 10.6.15.144  SSH 702 Client: Encrypted packet (len=636)
  151 2.418765475  10.6.15.144 → 192.168.1.16 SSH 230 Server: Encrypted packet (len=164)
  152 2.419363657 192.168.1.16 → 10.6.15.144  SSH 134 Client: Encrypted packet (len=68)
  153 2.422560609 192.168.1.16 → 10.6.15.144  SSH 1494 Client: Encrypted packet (len=1428)
  154 2.425111210 192.168.1.16 → 10.6.15.144  SSH 1414 Client: Encrypted packet (len=1348)
  155 2.429335651  10.6.15.144 → 192.168.1.16 TCP 66 22 → 59298 [ACK] Seq=55517 Ack=11993 Win=1452 Len=0 TSval=5301680 TSecr=4705325
  156 2.429360205 192.168.1.16 → 10.6.15.144  SSH 710 Client: Encrypted packet (len=644)
  157 2.435386253  10.6.15.144 → 192.168.1.16 TCP 66 22 → 59298 [ACK] Seq=55517 Ack=14769 Win=1452 Len=0 TSval=5301682 TSecr=4705328
  158 2.452174725  10.6.15.144 → 192.168.1.16 SSH 1514 Server: Encrypted packet (len=1448)
  159 2.452393825  10.6.15.144 → 192.168.1.16 SSH 1514 Server: Encrypted packet (len=1448)
  160 2.452406138 192.168.1.16 → 10.6.15.144  TCP 66 59298 → 22 [ACK] Seq=15413 Ack=58413 Win=5703 Len=0 TSval=4705335 TSecr=5301686
  161 2.464572820  10.6.15.144 → 192.168.1.16 SSH 1514 Server: Encrypted packet (len=1448)
  162 2.464757536  10.6.15.144 → 192.168.1.16 SSH 1514 Server: Encrypted packet (len=1448)
  163 2.464766883 192.168.1.16 → 10.6.15.144  TCP 66 59298 → 22 [ACK] Seq=15413 Ack=61309 Win=5703 Len=0 TSval=4705338 TSecr=5301689
  164 2.464949312  10.6.15.144 → 192.168.1.16 SSH 1514 Server: Encrypted packet (len=1448)
  165 2.474424661 192.168.1.16 → 10.6.15.144  SSH 526 Client: Encrypted packet (len=460)
  166 2.475553987  10.6.15.144 → 192.168.1.16 SSH 1514 Server: Encrypted packet (len=1448)
  167 2.475741954  10.6.15.144 → 192.168.1.16 SSH 1514 Server: Encrypted packet (len=1448)
  168 2.475747150 192.168.1.16 → 10.6.15.144  TCP 66 59298 → 22 [ACK] Seq=15873 Ack=65653 Win=5703 Len=0 TSval=4705341 TSecr=5301692
  169 2.485459131  10.6.15.144 → 192.168.1.16 SSH 1514 Server: Encrypted packet (len=1448)
  170 2.486219720  10.6.15.144 → 192.168.1.16 SSH 1514 Server: Encrypted packet (len=1448)
  171 2.486235240 192.168.1.16 → 10.6.15.144  TCP 66 59298 → 22 [ACK] Seq=15873 Ack=68549 Win=5703 Len=0 TSval=4705344 TSecr=5301694
  172 2.486401610  10.6.15.144 → 192.168.1.16 SSH 1514 Server: Encrypted packet (len=1448)
  173 2.497363256  10.6.15.144 → 192.168.1.16 SSH 1514 Server: Encrypted packet (len=1448)
  174 2.497389129 192.168.1.16 → 10.6.15.144  TCP 66 59298 → 22 [ACK] Seq=15873 Ack=71445 Win=5703 Len=0 TSval=4705347 TSecr=5301695
  175 2.497539676  10.6.15.144 → 192.168.1.16 SSH 1514 Server: Encrypted packet (len=1448)
  176 2.497781860 192.168.1.16 → 10.6.15.144  SSH 494 Client: Encrypted packet (len=428)
  177 2.508135760  10.6.15.144 → 192.168.1.16 SSH 1514 Server: Encrypted packet (len=1448)
  178 2.508310874  10.6.15.144 → 192.168.1.16 SSH 1514 Server: Encrypted packet (len=1448)
  179 2.508318989 192.168.1.16 → 10.6.15.144  TCP 66 59298 → 22 [ACK] Seq=16301 Ack=75789 Win=5703 Len=0 TSval=4705349 TSecr=5301700
  180 2.508634661  10.6.15.144 → 192.168.1.16 SSH 1514 Server: Encrypted packet (len=1448)
  181 2.519248044  10.6.15.144 → 192.168.1.16 SSH 1514 Server: Encrypted packet (len=1448)
  182 2.519268701 192.168.1.16 → 10.6.15.144  TCP 66 59298 → 22 [ACK] Seq=16301 Ack=78685 Win=5703 Len=0 TSval=4705352 TSecr=5301700
  183 2.519426091  10.6.15.144 → 192.168.1.16 SSH 1514 Server: Encrypted packet (len=1448)
  184 2.528814301  10.6.15.144 → 192.168.1.16 SSH 1514 Server: Encrypted packet (len=1448)
  185 2.528833999 192.168.1.16 → 10.6.15.144  TCP 66 59298 → 22 [ACK] Seq=16301 Ack=81581 Win=5703 Len=0 TSval=4705354 TSecr=5301703
  186 2.528995537  10.6.15.144 → 192.168.1.16 SSH 1514 Server: Encrypted packet (len=1448)
  187 2.534119731 192.168.1.16 → 10.6.15.144  SSH 486 Client: Encrypted packet (len=420)
  188 2.538634243  10.6.15.144 → 192.168.1.16 SSH 1514 Server: Encrypted packet (len=1448)
  189 2.538821843  10.6.15.144 → 192.168.1.16 SSH 1514 Server: Encrypted packet (len=1448)
  190 2.538830590 192.168.1.16 → 10.6.15.144  TCP 66 59298 → 22 [ACK] Seq=16721 Ack=85925 Win=5703 Len=0 TSval=4705357 TSecr=5301708
  191 2.539172628  10.6.15.144 → 192.168.1.16 SSH 1514 Server: Encrypted packet (len=1448)
  192 2.548979675  10.6.15.144 → 192.168.1.16 SSH 1514 Server: Encrypted packet (len=1448)
  193 2.549000898 192.168.1.16 → 10.6.15.144  TCP 66 59298 → 22 [ACK] Seq=16721 Ack=88821 Win=5703 Len=0 TSval=4705360 TSecr=5301708
  194 2.549152907  10.6.15.144 → 192.168.1.16 SSH 1514 Server: Encrypted packet (len=1448)
  195 2.559184721  10.6.15.144 → 192.168.1.16 SSH 1514 Server: Encrypted packet (len=1448)
  196 2.559205277 192.168.1.16 → 10.6.15.144  TCP 66 59298 → 22 [ACK] Seq=16721 Ack=91717 Win=5703 Len=0 TSval=4705362 TSecr=5301710
  197 2.559377156  10.6.15.144 → 192.168.1.16 SSH 1514 Server: Encrypted packet (len=1448)
  198 2.569693837  10.6.15.144 → 192.168.1.16 SSH 1514 Server: Encrypted packet (len=1448)
  199 2.569718905 192.168.1.16 → 10.6.15.144  TCP 66 59298 → 22 [ACK] Seq=16721 Ack=94613 Win=5703 Len=0 TSval=4705365 TSecr=5301713
  200 2.569826970  10.6.15.144 → 192.168.1.16 SSH 1514 Server: Encrypted packet (len=1448)
  201 2.581076564  10.6.15.144 → 192.168.1.16 SSH 1514 Server: Encrypted packet (len=1448)
  202 2.581093140 192.168.1.16 → 10.6.15.144  TCP 66 59298 → 22 [ACK] Seq=16721 Ack=97509 Win=5703 Len=0 TSval=4705368 TSecr=5301715
  203 2.581233212  10.6.15.144 → 192.168.1.16 SSH 1514 Server: Encrypted packet (len=1448)
  204 2.581460036  10.6.15.144 → 192.168.1.16 SSH 1514 Server: Encrypted packet (len=1448)
  205 2.581475428 192.168.1.16 → 10.6.15.144  TCP 66 59298 → 22 [ACK] Seq=16721 Ack=100405 Win=5703 Len=0 TSval=4705368 TSecr=5301718
  206 2.585154978  10.6.15.144 → 192.168.1.16 SSH 1514 Server: Encrypted packet (len=1448)
  207 2.591954517  10.6.15.144 → 192.168.1.16 SSH 1514 Server: Encrypted packet (len=1448)
  208 2.591974786 192.168.1.16 → 10.6.15.144  TCP 66 59298 → 22 [ACK] Seq=16721 Ack=103301 Win=5703 Len=0 TSval=4705370 TSecr=5301718
  209 2.592145491  10.6.15.144 → 192.168.1.16 SSH 1514 Server: Encrypted packet (len=1448)
  210 2.592325813  10.6.15.144 → 192.168.1.16 SSH 1514 Server: Encrypted packet (len=1448)
  211 2.592333926 192.168.1.16 → 10.6.15.144  TCP 66 59298 → 22 [ACK] Seq=16721 Ack=106197 Win=5703 Len=0 TSval=4705370 TSecr=5301721
  212 2.592671402  10.6.15.144 → 192.168.1.16 SSH 1514 Server: Encrypted packet (len=1448)
  213 2.603716085  10.6.15.144 → 192.168.1.16 SSH 1514 Server: Encrypted packet (len=1448)
  214 2.603735175 192.168.1.16 → 10.6.15.144  TCP 66 59298 → 22 [ACK] Seq=16721 Ack=109093 Win=5703 Len=0 TSval=4705373 TSecr=5301721
  215 2.603867893  10.6.15.144 → 192.168.1.16 SSH 1514 Server: Encrypted packet (len=1448)
  216 2.604067471  10.6.15.144 → 192.168.1.16 SSH 1514 Server: Encrypted packet (len=1448)
  217 2.604071554 192.168.1.16 → 10.6.15.144  TCP 66 59298 → 22 [ACK] Seq=16721 Ack=111989 Win=5703 Len=0 TSval=4705373 TSecr=5301724
  218 2.604743546  10.6.15.144 → 192.168.1.16 SSH 1514 Server: Encrypted packet (len=1448)
  219 2.615182003  10.6.15.144 → 192.168.1.16 SSH 1514 Server: Encrypted packet (len=1448)
  220 2.615199780 192.168.1.16 → 10.6.15.144  TCP 66 59298 → 22 [ACK] Seq=16721 Ack=114885 Win=5703 Len=0 TSval=4705376 TSecr=5301724
  221 2.615330740  10.6.15.144 → 192.168.1.16 SSH 1514 Server: Encrypted packet (len=1448)
  222 2.615523894  10.6.15.144 → 192.168.1.16 SSH 1514 Server: Encrypted packet (len=1448)
  223 2.615532462 192.168.1.16 → 10.6.15.144  TCP 66 59298 → 22 [ACK] Seq=16721 Ack=117781 Win=5703 Len=0 TSval=4705376 TSecr=5301727
  224 2.615865081  10.6.15.144 → 192.168.1.16 SSH 1514 Server: Encrypted packet (len=1448)
  225 2.618923690 192.168.1.16 → 52.66.5.185  NTP 90 NTP Version 4, client
  226 2.628139781  10.6.15.144 → 192.168.1.16 SSH 1514 Server: Encrypted packet (len=1448)
  227 2.628155751 192.168.1.16 → 10.6.15.144  TCP 66 59298 → 22 [ACK] Seq=16721 Ack=120677 Win=5703 Len=0 TSval=4705379 TSecr=5301727
  228 2.628311675  10.6.15.144 → 192.168.1.16 SSH 1514 Server: Encrypted packet (len=1448)
  229 2.628521309  10.6.15.144 → 192.168.1.16 SSH 1514 Server: Encrypted packet (len=1448)
  230 2.628526207 192.168.1.16 → 10.6.15.144  TCP 66 59298 → 22 [ACK] Seq=16721 Ack=123573 Win=5703 Len=0 TSval=4705379 TSecr=5301730
  231 2.628686287  10.6.15.144 → 192.168.1.16 SSH 1514 Server: Encrypted packet (len=1448)
  232 2.639527379  10.6.15.144 → 192.168.1.16 SSH 1514 Server: Encrypted packet (len=1448)
  233 2.639546282 192.168.1.16 → 10.6.15.144  TCP 66 59298 → 22 [ACK] Seq=16721 Ack=126469 Win=5703 Len=0 TSval=4705382 TSecr=5301730
  234 2.639652051  10.6.15.144 → 192.168.1.16 SSH 1514 Server: Encrypted packet (len=1448)
  235 2.639842455  10.6.15.144 → 192.168.1.16 SSH 1514 Server: Encrypted packet (len=1448)
  236 2.639846909 192.168.1.16 → 10.6.15.144  TCP 66 59298 → 22 [ACK] Seq=16721 Ack=129365 Win=5703 Len=0 TSval=4705382 TSecr=5301733
  237 2.640212023  10.6.15.144 → 192.168.1.16 SSH 1514 Server: Encrypted packet (len=1448)
  238 2.650951751  10.6.15.144 → 192.168.1.16 SSH 1514 Server: Encrypted packet (len=1448)
  239 2.650970409 192.168.1.16 → 10.6.15.144  TCP 66 59298 → 22 [ACK] Seq=16721 Ack=132261 Win=5703 Len=0 TSval=4705385 TSecr=5301733
  240 2.651076241  10.6.15.144 → 192.168.1.16 SSH 1514 Server: Encrypted packet (len=1448)
  241 2.651486247  10.6.15.144 → 192.168.1.16 SSH 1514 Server: [TCP Previous segment not captured] , Encrypted packet (len=1448)
  242 2.651505071 192.168.1.16 → 10.6.15.144  TCP 78 59298 → 22 [ACK] Seq=16721 Ack=133709 Win=5703 Len=0 TSval=4705385 TSecr=5301736 SLE=135157 SRE=136605
  243 2.661015797  10.6.15.144 → 192.168.1.16 SSH 1514 Server: Encrypted packet (len=1448)
  244 2.661032226 192.168.1.16 → 10.6.15.144  TCP 78 [TCP Dup ACK 242#1] 59298 → 22 [ACK] Seq=16721 Ack=133709 Win=5703 Len=0 TSval=4705388 TSecr=5301736 SLE=135157 SRE=138053
  245 2.661188232  10.6.15.144 → 192.168.1.16 SSH 1514 Server: Encrypted packet (len=1448)
  246 2.661196912 192.168.1.16 → 10.6.15.144  TCP 78 [TCP Dup ACK 242#2] 59298 → 22 [ACK] Seq=16721 Ack=133709 Win=5703 Len=0 TSval=4705388 TSecr=5301736 SLE=135157 SRE=139501
  247 2.661541585  10.6.15.144 → 192.168.1.16 SSH 1514 Server: Encrypted packet (len=1448)
  248 2.661550836 192.168.1.16 → 10.6.15.144  TCP 78 [TCP Dup ACK 242#3] 59298 → 22 [ACK] Seq=16721 Ack=133709 Win=5703 Len=0 TSval=4705388 TSecr=5301736 SLE=135157 SRE=140949
  249 2.661724860  10.6.15.144 → 192.168.1.16 SSH 1514 Server: Encrypted packet (len=1448)
  250 2.661734255 192.168.1.16 → 10.6.15.144  TCP 78 [TCP Dup ACK 242#4] 59298 → 22 [ACK] Seq=16721 Ack=133709 Win=5703 Len=0 TSval=4705388 TSecr=5301736 SLE=135157 SRE=142397
  251 2.661915250  10.6.15.144 → 192.168.1.16 SSH 1514 Server: Encrypted packet (len=1448)
  252 2.661921838 192.168.1.16 → 10.6.15.144  TCP 78 [TCP Dup ACK 242#5] 59298 → 22 [ACK] Seq=16721 Ack=133709 Win=5703 Len=0 TSval=4705388 TSecr=5301736 SLE=135157 SRE=143845
  253 2.671576628  10.6.15.144 → 192.168.1.16 SSH 1514 Server: Encrypted packet (len=1448)
  254 2.671595805 192.168.1.16 → 10.6.15.144  TCP 78 [TCP Dup ACK 242#6] 59298 → 22 [ACK] Seq=16721 Ack=133709 Win=5703 Len=0 TSval=4705390 TSecr=5301736 SLE=135157 SRE=145293
  255 2.672876310  10.6.15.144 → 192.168.1.16 SSH 1514 Server: [TCP Fast Retransmission] , Encrypted packet (len=1448)
  256 2.672895599 192.168.1.16 → 10.6.15.144  TCP 66 59298 → 22 [ACK] Seq=16721 Ack=145293 Win=5703 Len=0 TSval=4705391 TSecr=5301741
  257 2.673057641  10.6.15.144 → 192.168.1.16 SSH 1514 Server: Encrypted packet (len=1448)
  258 2.673063693 192.168.1.16 → 10.6.15.144  TCP 66 59298 → 22 [ACK] Seq=16721 Ack=146741 Win=5703 Len=0 TSval=4705391 TSecr=5301741
  259 2.673403901  10.6.15.144 → 192.168.1.16 SSH 1514 Server: Encrypted packet (len=1448)
  260 2.673411829 192.168.1.16 → 10.6.15.144  TCP 66 59298 → 22 [ACK] Seq=16721 Ack=148189 Win=5703 Len=0 TSval=4705391 TSecr=5301741
  261 2.681476868  10.6.15.144 → 192.168.1.16 SSH 1514 Server: Encrypted packet (len=1448)
  262 2.681493896 192.168.1.16 → 10.6.15.144  TCP 66 59298 → 22 [ACK] Seq=16721 Ack=149637 Win=5703 Len=0 TSval=4705393 TSecr=5301743
  263 2.683738665  10.6.15.144 → 192.168.1.16 SSH 1514 Server: Encrypted packet (len=1448)
  264 2.683746257 192.168.1.16 → 10.6.15.144  TCP 66 59298 → 22 [ACK] Seq=16721 Ack=151085 Win=5703 Len=0 TSval=4705393 TSecr=5301744
  265 2.683927992  10.6.15.144 → 192.168.1.16 SSH 1514 Server: Encrypted packet (len=1448)
  266 2.683931058 192.168.1.16 → 10.6.15.144  TCP 66 59298 → 22 [ACK] Seq=16721 Ack=152533 Win=5703 Len=0 TSval=4705393 TSecr=5301744
  267 2.684106043  10.6.15.144 → 192.168.1.16 SSH 1514 Server: Encrypted packet (len=1448)
  268 2.684109268 192.168.1.16 → 10.6.15.144  TCP 66 59298 → 22 [ACK] Seq=16721 Ack=153981 Win=5703 Len=0 TSval=4705393 TSecr=5301744
  269 2.691592945  10.6.15.144 → 192.168.1.16 SSH 1514 Server: Encrypted packet (len=1448)
  270 2.691601984 192.168.1.16 → 10.6.15.144  TCP 66 59298 → 22 [ACK] Seq=16721 Ack=155429 Win=5703 Len=0 TSval=4705395 TSecr=5301746
  271 2.691755646  10.6.15.144 → 192.168.1.16 SSH 1514 Server: Encrypted packet (len=1448)
  272 2.691757885 192.168.1.16 → 10.6.15.144  TCP 66 59298 → 22 [ACK] Seq=16721 Ack=156877 Win=5703 Len=0 TSval=4705395 TSecr=5301746
  273 2.694941295  10.6.15.144 → 192.168.1.16 SSH 1514 Server: Encrypted packet (len=1448)
  274 2.694958189 192.168.1.16 → 10.6.15.144  TCP 66 59298 → 22 [ACK] Seq=16721 Ack=158325 Win=5703 Len=0 TSval=4705396 TSecr=5301747
  275 2.695107115  10.6.15.144 → 192.168.1.16 SSH 1514 Server: Encrypted packet (len=1448)
  276 2.695111589 192.168.1.16 → 10.6.15.144  TCP 66 59298 → 22 [ACK] Seq=16721 Ack=159773 Win=5703 Len=0 TSval=4705396 TSecr=5301747
  277 2.695315769  10.6.15.144 → 192.168.1.16 SSH 1514 Server: Encrypted packet (len=1448)
  278 2.695320009 192.168.1.16 → 10.6.15.144  TCP 66 59298 → 22 [ACK] Seq=16721 Ack=161221 Win=5703 Len=0 TSval=4705396 TSecr=5301747
  279 2.695662600  10.6.15.144 → 192.168.1.16 SSH 1514 Server: Encrypted packet (len=1448)
  280 2.695667246 192.168.1.16 → 10.6.15.144  TCP 66 59298 → 22 [ACK] Seq=16721 Ack=162669 Win=5703 Len=0 TSval=4705396 TSecr=5301747
  281 2.701856344  10.6.15.144 → 192.168.1.16 SSH 1514 Server: Encrypted packet (len=1448)
  282 2.701872152 192.168.1.16 → 10.6.15.144  TCP 66 59298 → 22 [ACK] Seq=16721 Ack=164117 Win=5703 Len=0 TSval=4705398 TSecr=5301749
  283 2.702041130  10.6.15.144 → 192.168.1.16 SSH 1514 Server: Encrypted packet (len=1448)
  284 2.702044351 192.168.1.16 → 10.6.15.144  TCP 66 59298 → 22 [ACK] Seq=16721 Ack=165565 Win=5703 Len=0 TSval=4705398 TSecr=5301749
  285 2.706306151  10.6.15.144 → 192.168.1.16 SSH 1514 Server: Encrypted packet (len=1448)
  286 2.706527126  10.6.15.144 → 192.168.1.16 SSH 1514 Server: Encrypted packet (len=1448)
  287 2.706533830 192.168.1.16 → 10.6.15.144  TCP 66 59298 → 22 [ACK] Seq=16721 Ack=168461 Win=5703 Len=0 TSval=4705399 TSecr=5301750
  288 2.706875065  10.6.15.144 → 192.168.1.16 SSH 1514 Server: Encrypted packet (len=1448)
  289 2.707067233  10.6.15.144 → 192.168.1.16 SSH 1514 Server: Encrypted packet (len=1448)
  290 2.707073624 192.168.1.16 → 10.6.15.144  TCP 66 59298 → 22 [ACK] Seq=16721 Ack=171357 Win=5703 Len=0 TSval=4705399 TSecr=5301750
  291 2.712483882  10.6.15.144 → 192.168.1.16 SSH 1514 Server: Encrypted packet (len=1448)
  292 2.712672672  10.6.15.144 → 192.168.1.16 SSH 1514 Server: Encrypted packet (len=1448)
  293 2.712679663 192.168.1.16 → 10.6.15.144  TCP 66 59298 → 22 [ACK] Seq=16721 Ack=174253 Win=5703 Len=0 TSval=4705400 TSecr=5301751
  294 2.717578484  10.6.15.144 → 192.168.1.16 SSH 1514 Server: Encrypted packet (len=1448)
  295 2.717916981  10.6.15.144 → 192.168.1.16 SSH 1514 Server: Encrypted packet (len=1448)
  296 2.717924875 192.168.1.16 → 10.6.15.144  TCP 66 59298 → 22 [ACK] Seq=16721 Ack=177149 Win=5703 Len=0 TSval=4705402 TSecr=5301752
  297 2.718079057 192.168.1.16 → 10.6.15.144  SSH 102 Client: Encrypted packet (len=36)
  298 2.718090813  10.6.15.144 → 192.168.1.16 SSH 1514 Server: Encrypted packet (len=1448)
  299 2.718301778  10.6.15.144 → 192.168.1.16 SSH 1514 Server: Encrypted packet (len=1448)
  300 2.718304584 192.168.1.16 → 10.6.15.144  TCP 66 59298 → 22 [ACK] Seq=16757 Ack=180045 Win=5703 Len=0 TSval=4705402 TSecr=5301752
  301 2.718663936 192.168.1.16 → 10.6.15.144  SSH 102 Client: Encrypted packet (len=36)
  302 2.723709293  10.6.15.144 → 192.168.1.16 SSH 1514 Server: Encrypted packet (len=1448)
  303 2.723720153  10.6.15.144 → 192.168.1.16 SSH 1514 Server: Encrypted packet (len=1448)
  304 2.723725803 192.168.1.16 → 10.6.15.144  TCP 66 59298 → 22 [ACK] Seq=16793 Ack=182941 Win=5703 Len=0 TSval=4705403 TSecr=5301754
  305 2.730529960  10.6.15.144 → 192.168.1.16 SSH 1514 Server: Encrypted packet (len=1448)
  306 2.730795651  10.6.15.144 → 192.168.1.16 SSH 1514 Server: Encrypted packet (len=1448)
  307 2.730812504 192.168.1.16 → 10.6.15.144  TCP 66 59298 → 22 [ACK] Seq=16793 Ack=185837 Win=5703 Len=0 TSval=4705405 TSecr=5301755
  308 2.731094809  10.6.15.144 → 192.168.1.16 SSH 1514 Server: Encrypted packet (len=1448)
  309 2.731399775  10.6.15.144 → 192.168.1.16 SSH 1514 Server: Encrypted packet (len=1448)
  310 2.731410749 192.168.1.16 → 10.6.15.144  TCP 66 59298 → 22 [ACK] Seq=16793 Ack=188733 Win=5703 Len=0 TSval=4705405 TSecr=5301755
  311 2.732366241 192.168.1.16 → 10.6.15.144  SSH 134 Client: Encrypted packet (len=68)
  312 2.734203003  10.6.15.144 → 192.168.1.16 SSH 1514 Server: Encrypted packet (len=1448)
  313 2.734496378  10.6.15.144 → 192.168.1.16 SSH 1514 Server: Encrypted packet (len=1448)
  314 2.734510049 192.168.1.16 → 10.6.15.144  TCP 66 59298 → 22 [ACK] Seq=16861 Ack=191629 Win=5703 Len=0 TSval=4705406 TSecr=5301757
  315 2.740771236  10.6.15.144 → 192.168.1.16 SSH 874 Server: Encrypted packet (len=808)
  316 2.744283380 192.168.1.16 → 10.6.15.144  SSH 134 Client: Encrypted packet (len=68)
  317 2.749832047 192.168.1.16 → 10.6.15.144  SSH 1502 Client: Encrypted packet (len=1436)
  318 2.752916297  10.6.15.144 → 192.168.1.16 TCP 66 22 → 59298 [ACK] Seq=192437 Ack=16929 Win=1452 Len=0 TSval=5301762 TSecr=4705405
  319 2.778804036  10.6.15.144 → 192.168.1.16 SSH 1514 Server: Encrypted packet (len=1448)
  320 2.781764052  10.6.15.144 → 192.168.1.16 SSH 1514 Server: Encrypted packet (len=1448)
  321 2.781781473 192.168.1.16 → 10.6.15.144  TCP 66 59298 → 22 [ACK] Seq=18365 Ack=195333 Win=5703 Len=0 TSval=4705418 TSecr=5301768
  322 2.781815409  10.6.15.144 → 192.168.1.16 SSH 110 Server: Encrypted packet (len=44)
  323 2.782143131  10.6.15.144 → 192.168.1.16 SSH 1514 Server: Encrypted packet (len=1448)
  324 2.782150939 192.168.1.16 → 10.6.15.144  TCP 66 59298 → 22 [ACK] Seq=18365 Ack=196825 Win=5703 Len=0 TSval=4705418 TSecr=5301768
  325 2.782444750  10.6.15.144 → 192.168.1.16 SSH 1514 Server: Encrypted packet (len=1448)
  326 2.782746934  10.6.15.144 → 192.168.1.16 SSH 1514 Server: Encrypted packet (len=1448)
  327 2.782755378 192.168.1.16 → 10.6.15.144  TCP 66 59298 → 22 [ACK] Seq=18365 Ack=199721 Win=5703 Len=0 TSval=4705418 TSecr=5301768
  328 2.793675167  10.6.15.144 → 192.168.1.16 SSH 1514 Server: Encrypted packet (len=1448)
  329 2.793991923  10.6.15.144 → 192.168.1.16 SSH 1514 Server: Encrypted packet (len=1448)
  330 2.793998513 192.168.1.16 → 10.6.15.144  TCP 66 59298 → 22 [ACK] Seq=18365 Ack=202617 Win=5703 Len=0 TSval=4705421 TSecr=5301771
  331 2.794209095  10.6.15.144 → 192.168.1.16 SSH 1514 Server: Encrypted packet (len=1448)
  332 2.794398391  10.6.15.144 → 192.168.1.16 SSH 1514 Server: Encrypted packet (len=1448)
  333 2.794402599 192.168.1.16 → 10.6.15.144  TCP 66 59298 → 22 [ACK] Seq=18365 Ack=205513 Win=5703 Len=0 TSval=4705421 TSecr=5301771
  334 2.794597166  10.6.15.144 → 192.168.1.16 SSH 1514 Server: Encrypted packet (len=1448)
  335 2.794784140  10.6.15.144 → 192.168.1.16 SSH 1514 Server: Encrypted packet (len=1448)
  336 2.794787403 192.168.1.16 → 10.6.15.144  TCP 66 59298 → 22 [ACK] Seq=18365 Ack=208409 Win=5703 Len=0 TSval=4705421 TSecr=5301771
  337 2.805832628  10.6.15.144 → 192.168.1.16 SSH 1514 Server: Encrypted packet (len=1448)
  338 2.805994814  10.6.15.144 → 192.168.1.16 SSH 1514 Server: Encrypted packet (len=1448)
  339 2.806001073 192.168.1.16 → 10.6.15.144  TCP 66 59298 → 22 [ACK] Seq=18365 Ack=211305 Win=5703 Len=0 TSval=4705424 TSecr=5301774
  340 2.806186300  10.6.15.144 → 192.168.1.16 SSH 1514 Server: Encrypted packet (len=1448)
  341 2.806523793  10.6.15.144 → 192.168.1.16 SSH 1514 Server: Encrypted packet (len=1448)
  342 2.806531079 192.168.1.16 → 10.6.15.144  TCP 66 59298 → 22 [ACK] Seq=18365 Ack=214201 Win=5703 Len=0 TSval=4705424 TSecr=5301774
  343 2.806714441  10.6.15.144 → 192.168.1.16 SSH 1514 Server: Encrypted packet (len=1448)
  344 2.806905853  10.6.15.144 → 192.168.1.16 SSH 1514 Server: Encrypted packet (len=1448)
  345 2.806912879 192.168.1.16 → 10.6.15.144  TCP 66 59298 → 22 [ACK] Seq=18365 Ack=217097 Win=5703 Len=0 TSval=4705424 TSecr=5301774
  346 2.817647507  10.6.15.144 → 192.168.1.16 SSH 1514 Server: Encrypted packet (len=1448)
  347 2.817808238  10.6.15.144 → 192.168.1.16 SSH 1514 Server: Encrypted packet (len=1448)
  348 2.817814634 192.168.1.16 → 10.6.15.144  TCP 66 59298 → 22 [ACK] Seq=18365 Ack=219993 Win=5703 Len=0 TSval=4705427 TSecr=5301777
  349 2.818172648  10.6.15.144 → 192.168.1.16 SSH 1514 Server: Encrypted packet (len=1448)
  350 2.818360818  10.6.15.144 → 192.168.1.16 SSH 1514 Server: Encrypted packet (len=1448)
  351 2.818366381 192.168.1.16 → 10.6.15.144  TCP 66 59298 → 22 [ACK] Seq=18365 Ack=222889 Win=5703 Len=0 TSval=4705427 TSecr=5301777
  352 2.818552366  10.6.15.144 → 192.168.1.16 SSH 1514 Server: Encrypted packet (len=1448)
  353 2.829130677  10.6.15.144 → 192.168.1.16 SSH 1514 Server: [TCP Previous segment not captured] , Encrypted packet (len=1448)
  354 2.829148525 192.168.1.16 → 10.6.15.144  TCP 78 59298 → 22 [ACK] Seq=18365 Ack=224337 Win=5703 Len=0 TSval=4705430 TSecr=5301777 SLE=225785 SRE=227233
  355 2.829309861  10.6.15.144 → 192.168.1.16 SSH 1514 Server: Encrypted packet (len=1448)
  356 2.829313697 192.168.1.16 → 10.6.15.144  TCP 78 [TCP Dup ACK 354#1] 59298 → 22 [ACK] Seq=18365 Ack=224337 Win=5703 Len=0 TSval=4705430 TSecr=5301777 SLE=225785 SRE=228681
  357 2.829658154  10.6.15.144 → 192.168.1.16 SSH 1514 Server: Encrypted packet (len=1448)
  358 2.829664004 192.168.1.16 → 10.6.15.144  TCP 78 [TCP Dup ACK 354#2] 59298 → 22 [ACK] Seq=18365 Ack=224337 Win=5703 Len=0 TSval=4705430 TSecr=5301777 SLE=225785 SRE=230129
  359 2.829847346  10.6.15.144 → 192.168.1.16 SSH 1514 Server: Encrypted packet (len=1448)
  360 2.829849999 192.168.1.16 → 10.6.15.144  TCP 78 [TCP Dup ACK 354#3] 59298 → 22 [ACK] Seq=18365 Ack=224337 Win=5703 Len=0 TSval=4705430 TSecr=5301777 SLE=225785 SRE=231577
  361 2.840507670  10.6.15.144 → 192.168.1.16 SSH 1514 Server: Encrypted packet (len=1448)
  362 2.840527383 192.168.1.16 → 10.6.15.144  TCP 78 [TCP Dup ACK 354#4] 59298 → 22 [ACK] Seq=18365 Ack=224337 Win=5703 Len=0 TSval=4705432 TSecr=5301777 SLE=225785 SRE=233025
  363 2.840710863  10.6.15.144 → 192.168.1.16 SSH 1514 Server: Encrypted packet (len=1448)
  364 2.840717770 192.168.1.16 → 10.6.15.144  TCP 78 [TCP Dup ACK 354#5] 59298 → 22 [ACK] Seq=18365 Ack=224337 Win=5703 Len=0 TSval=4705432 TSecr=5301777 SLE=225785 SRE=234473
  365 2.840910104  10.6.15.144 → 192.168.1.16 SSH 1514 Server: Encrypted packet (len=1448)
  366 2.840917681 192.168.1.16 → 10.6.15.144  TCP 78 [TCP Dup ACK 354#6] 59298 → 22 [ACK] Seq=18365 Ack=224337 Win=5703 Len=0 TSval=4705433 TSecr=5301777 SLE=225785 SRE=235921
  367 2.841245308  10.6.15.144 → 192.168.1.16 SSH 1514 Server: Encrypted packet (len=1448)
  368 2.841253531 192.168.1.16 → 10.6.15.144  TCP 78 [TCP Dup ACK 354#7] 59298 → 22 [ACK] Seq=18365 Ack=224337 Win=5703 Len=0 TSval=4705433 TSecr=5301777 SLE=225785 SRE=237369
