    1 0.000000000 10.22.18.209 → 224.0.0.252  LLMNR 64 Standard query 0xdb46 A wpad
    2 0.001076832 10.22.18.209 → 224.0.0.252  LLMNR 64 Standard query 0xdb46 A wpad
    3 4.992126038 10.22.17.255 → 224.0.0.252  LLMNR 64 Standard query 0x9a8d A wpad
    4 5.984023652 10.22.17.255 → 224.0.0.252  LLMNR 64 Standard query 0x9a8d A wpad
    5 6.976043848 10.22.18.209 → 224.0.0.252  LLMNR 64 Standard query 0x6a04 A wpad
    6 6.976069903 10.22.18.209 → 224.0.0.252  LLMNR 64 Standard query 0x6a04 A wpad
    7 9.260769443 192.168.1.16 → 10.6.15.144  SSH 262 Client: Encrypted packet (len=196)
    8 9.261915029 192.168.1.16 → 10.6.15.144  SSH 1110 Client: Encrypted packet (len=1044)
    9 9.266055160  10.6.15.144 → 192.168.1.16 TCP 66 22 → 59298 [ACK] Seq=1 Ack=197 Win=1452 Len=0 TSval=3521839 TSecr=2925523
   10 9.268142775  10.6.15.144 → 192.168.1.16 TCP 66 22 → 59298 [ACK] Seq=1 Ack=1241 Win=1452 Len=0 TSval=3521839 TSecr=2925523
   11 9.268954195  10.6.15.144 → 192.168.1.16 SSH 134 Server: Encrypted packet (len=68)
   12 9.310106210 192.168.1.16 → 10.6.15.144  TCP 66 59298 → 22 [ACK] Seq=1241 Ack=69 Win=1494 Len=0 TSval=2925536 TSecr=3521840
   13 9.355981569  10.6.15.144 → 192.168.1.16 SSH 230 Server: Encrypted packet (len=164)
   14 9.356005102 192.168.1.16 → 10.6.15.144  TCP 66 59298 → 22 [ACK] Seq=1241 Ack=233 Win=1494 Len=0 TSval=2925547 TSecr=3521861
   15 9.358248038  10.6.15.144 → 192.168.1.16 SSH 1214 Server: Encrypted packet (len=1148)
   16 9.358266433 192.168.1.16 → 10.6.15.144  TCP 66 59298 → 22 [ACK] Seq=1241 Ack=1381 Win=1494 Len=0 TSval=2925548 TSecr=3521861
   17 9.358754080 192.168.1.16 → 10.6.15.144  SSH 134 Client: Encrypted packet (len=68)
   18 9.360013855 192.168.1.16 → 10.6.15.144  SSH 222 Client: Encrypted packet (len=156)
   19 9.360199114 192.168.1.16 → 10.6.15.144  SSH 1514 Client: Encrypted packet (len=1448)
   20 9.360282969 192.168.1.16 → 10.6.15.144  SSH 118 Client: Encrypted packet (len=52)
   21 9.367200942  10.6.15.144 → 192.168.1.16 TCP 66 22 → 59298 [ACK] Seq=1381 Ack=1465 Win=1452 Len=0 TSval=3521863 TSecr=2925548
   22 9.367220659  10.6.15.144 → 192.168.1.16 TCP 66 22 → 59298 [ACK] Seq=1381 Ack=2965 Win=1452 Len=0 TSval=3521864 TSecr=2925548
   23 9.438093913 192.168.1.16 → 104.18.58.29 TCP 66 42716 → 80 [ACK] Seq=1 Ack=1 Win=625 Len=0 TSval=2925568 TSecr=1019056593
   24 9.497974259  10.6.15.144 → 192.168.1.16 SSH 918 Server: Encrypted packet (len=852)
   25 9.498303211  10.6.15.144 → 192.168.1.16 SSH 278 Server: Encrypted packet (len=212)
   26 9.498313226  10.6.15.144 → 192.168.1.16 SSH 134 Server: Encrypted packet (len=68)
   27 9.498340826 192.168.1.16 → 10.6.15.144  TCP 66 59298 → 22 [ACK] Seq=2965 Ack=2513 Win=1494 Len=0 TSval=2925583 TSecr=3521896
   28 9.498644043 192.168.1.16 → 10.6.15.144  SSH 134 Client: Encrypted packet (len=68)
   29 9.542205416  10.6.15.144 → 192.168.1.16 TCP 66 22 → 59298 [ACK] Seq=2513 Ack=3033 Win=1452 Len=0 TSval=3521908 TSecr=2925583
   30 13.984304296  10.6.15.144 → 192.168.1.16 SSH 102 Server: Encrypted packet (len=36)
   31 13.984685712  10.6.15.144 → 192.168.1.16 SSH 102 Server: Encrypted packet (len=36)
   32 13.984710247  10.6.15.144 → 192.168.1.16 TCP 102 [TCP Retransmission] 22 → 59298 [PSH, ACK] Seq=2549 Ack=3033 Win=1452 Len=36 TSval=3522871 TSecr=2925583
   33 13.984723412 192.168.1.16 → 10.6.15.144  TCP 78 59298 → 22 [ACK] Seq=3033 Ack=2585 Win=1494 Len=0 TSval=2926704 TSecr=3522853 SLE=2549 SRE=2585
   34 13.984740602  10.6.15.144 → 192.168.1.16 SSH 102 Server: Encrypted packet (len=36)
   35 13.984747540 192.168.1.16 → 10.6.15.144  TCP 66 59298 → 22 [ACK] Seq=3033 Ack=2621 Win=1494 Len=0 TSval=2926704 TSecr=3522872
   36 13.984756354  10.6.15.144 → 192.168.1.16 SSH 174 Server: [TCP Spurious Retransmission] , Encrypted packet (len=108)
   37 13.984760029 192.168.1.16 → 10.6.15.144  TCP 78 [TCP Dup ACK 35#1] 59298 → 22 [ACK] Seq=3033 Ack=2621 Win=1494 Len=0 TSval=2926704 TSecr=3522940 SLE=2513 SRE=2621
   38 14.005728279  192.168.1.1 → 239.255.255.250 SSDP 302 NOTIFY * HTTP/1.1 
   39 14.008210285  192.168.1.1 → 239.255.255.250 SSDP 311 NOTIFY * HTTP/1.1 
   40 14.011021742  192.168.1.1 → 239.255.255.250 SSDP 374 NOTIFY * HTTP/1.1 
   41 14.016088659  192.168.1.1 → 239.255.255.250 SSDP 370 NOTIFY * HTTP/1.1 
   42 14.016633159  192.168.1.1 → 239.255.255.250 SSDP 350 NOTIFY * HTTP/1.1 
   43 14.020922006  192.168.1.1 → 239.255.255.250 SSDP 382 NOTIFY * HTTP/1.1 
   44 14.022026300  192.168.1.1 → 239.255.255.250 SSDP 364 NOTIFY * HTTP/1.1 
   45 14.024761984  192.168.1.1 → 239.255.255.250 SSDP 366 NOTIFY * HTTP/1.1 
   46 14.027066144  192.168.1.1 → 239.255.255.250 SSDP 302 NOTIFY * HTTP/1.1 
   47 14.029499149  192.168.1.1 → 239.255.255.250 SSDP 311 NOTIFY * HTTP/1.1 
   48 14.032310000  192.168.1.1 → 239.255.255.250 SSDP 374 NOTIFY * HTTP/1.1 
   49 14.035055042  192.168.1.1 → 239.255.255.250 SSDP 370 NOTIFY * HTTP/1.1 
   50 14.040599186  192.168.1.1 → 239.255.255.250 SSDP 382 NOTIFY * HTTP/1.1 
   51 14.043313251  192.168.1.1 → 239.255.255.250 SSDP 364 NOTIFY * HTTP/1.1 
   52 14.046059925  192.168.1.1 → 239.255.255.250 SSDP 366 NOTIFY * HTTP/1.1 
   53 14.073215960 192.168.1.16 → 54.76.71.168 TCP 128 42414 → 8282 [PSH, ACK] Seq=1 Ack=1 Win=296 Len=62 TSval=2926726 TSecr=607031913
   54 14.976006591 54.76.71.168 → 192.168.1.16 TCP 66 8282 → 42414 [ACK] Seq=1 Ack=63 Win=121 Len=0 TSval=607038708 TSecr=2926726
   55 14.976391320 10.22.18.209 → 224.0.0.252  LLMNR 64 Standard query 0x4c34 A wpad
   56 14.976782788 10.22.18.209 → 224.0.0.252  LLMNR 64 Standard query 0x4c34 A wpad
   57 19.678128888 192.168.1.16 → 23.47.235.27 TCP 66 45742 → 80 [ACK] Seq=1 Ack=1 Win=274 Len=0 TSval=2928128 TSecr=1019053136
   58 20.991990466 10.22.18.209 → 224.0.0.252  LLMNR 64 Standard query 0x27a7 A wpad
   59 20.992375526 10.22.18.209 → 224.0.0.252  LLMNR 64 Standard query 0x27a7 A wpad
   60 23.774096384 192.168.1.16 → 216.58.197.34 TCP 66 33712 → 80 [ACK] Seq=1 Ack=1 Win=229 Len=0 TSval=2929152 TSecr=1019075974
   61 23.774881331 192.168.1.16 → 104.18.58.29 TCP 66 43030 → 80 [ACK] Seq=1 Ack=1 Win=229 Len=0 TSval=2929152 TSecr=1019053507
   62 23.774883847 192.168.1.16 → 216.58.197.34 TCP 66 33710 → 80 [ACK] Seq=1 Ack=1 Win=229 Len=0 TSval=2929152 TSecr=1019075974
   63 23.774885429 192.168.1.16 → 104.18.58.29 TCP 66 43028 → 80 [ACK] Seq=1 Ack=1 Win=229 Len=0 TSval=2929152 TSecr=1019053503
   64 23.774887047 192.168.1.16 → 104.28.26.124 TCP 66 47168 → 80 [ACK] Seq=1 Ack=1 Win=229 Len=0 TSval=2929152 TSecr=1019053503
   65 27.676136641 192.168.1.16 → 139.59.21.22 NTP 90 NTP Version 4, client
   66 27.686234121 10.119.73.122 → 192.168.1.16 ICMP 110 Destination unreachable (Communication administratively filtered)
