    1 0.000000000    127.0.0.1 → 127.0.0.1    TCP 68 39662 → 1080 [FIN, ACK] Seq=1 Ack=1 Win=342 Len=0 TSval=3304786 TSecr=3302839
    2 0.000084674    127.0.0.1 → 127.0.0.1    TCP 68 39684 → 1080 [FIN, ACK] Seq=1 Ack=1 Win=342 Len=0 TSval=3304786 TSecr=3303648
    3 0.000116130    127.0.0.1 → 127.0.0.1    TCP 68 39690 → 1080 [FIN, ACK] Seq=1 Ack=1 Win=342 Len=0 TSval=3304786 TSecr=3303648
    4 0.000139679    127.0.0.1 → 127.0.0.1    TCP 68 39692 → 1080 [FIN, ACK] Seq=1 Ack=1 Win=342 Len=0 TSval=3304786 TSecr=3303653
    5 0.000161986    127.0.0.1 → 127.0.0.1    TCP 68 39694 → 1080 [FIN, ACK] Seq=1 Ack=1 Win=342 Len=0 TSval=3304786 TSecr=3303653
    6 0.000183476    127.0.0.1 → 127.0.0.1    TCP 68 39686 → 1080 [FIN, ACK] Seq=1 Ack=1 Win=342 Len=0 TSval=3304786 TSecr=3303648
    7 0.000203006    127.0.0.1 → 127.0.0.1    TCP 68 39688 → 1080 [FIN, ACK] Seq=1 Ack=1 Win=342 Len=0 TSval=3304786 TSecr=3303648
    8 0.000655099    127.0.0.1 → 127.0.0.1    TCP 68 39660 → 1080 [FIN, ACK] Seq=1 Ack=1 Win=342 Len=0 TSval=3304786 TSecr=3301090
    9 0.001902263    127.0.0.1 → 127.0.0.1    TCP 68 39652 → 1080 [FIN, ACK] Seq=1 Ack=1 Win=2512 Len=0 TSval=3304787 TSecr=3300240
   10 0.045356140    127.0.0.1 → 127.0.0.1    TCP 68 1080 → 39660 [ACK] Seq=1 Ack=2 Win=342 Len=0 TSval=3304798 TSecr=3304786
   11 0.045359854    127.0.0.1 → 127.0.0.1    TCP 68 1080 → 39688 [ACK] Seq=1 Ack=2 Win=342 Len=0 TSval=3304798 TSecr=3304786
   12 0.045361969    127.0.0.1 → 127.0.0.1    TCP 68 1080 → 39686 [ACK] Seq=1 Ack=2 Win=342 Len=0 TSval=3304798 TSecr=3304786
   13 0.045363982    127.0.0.1 → 127.0.0.1    TCP 68 1080 → 39694 [ACK] Seq=1 Ack=2 Win=342 Len=0 TSval=3304798 TSecr=3304786
   14 0.045366147    127.0.0.1 → 127.0.0.1    TCP 68 1080 → 39692 [ACK] Seq=1 Ack=2 Win=342 Len=0 TSval=3304798 TSecr=3304786
   15 0.045368453    127.0.0.1 → 127.0.0.1    TCP 68 1080 → 39690 [ACK] Seq=1 Ack=2 Win=342 Len=0 TSval=3304798 TSecr=3304786
   16 0.045370907    127.0.0.1 → 127.0.0.1    TCP 68 1080 → 39684 [ACK] Seq=1 Ack=2 Win=342 Len=0 TSval=3304798 TSecr=3304786
   17 0.045372628    127.0.0.1 → 127.0.0.1    TCP 68 1080 → 39662 [ACK] Seq=1 Ack=2 Win=342 Len=0 TSval=3304798 TSecr=3304786
   18 0.045375391    127.0.0.1 → 127.0.0.1    TCP 68 1080 → 39652 [ACK] Seq=1 Ack=2 Win=372 Len=0 TSval=3304798 TSecr=3304787
   19 0.055605434          ::1 → ::1          UDP 65 52820 → 52820 Len=1
   20 0.055645880    127.0.0.1 → 127.0.1.1    DNS 67 Standard query 0x1b08 SOA local
   21 0.101960620    127.0.0.1 → 127.0.0.1    TCP 76 39736 → 1080 [SYN] Seq=0 Win=43690 Len=0 MSS=65495 SACK_PERM=1 TSval=3304812 TSecr=0 WS=128
   22 0.101973526    127.0.0.1 → 127.0.0.1    TCP 76 1080 → 39736 [SYN, ACK] Seq=0 Ack=1 Win=43690 Len=0 MSS=65495 SACK_PERM=1 TSval=3304812 TSecr=3304812 WS=128
   23 0.101984440    127.0.0.1 → 127.0.0.1    TCP 68 39736 → 1080 [ACK] Seq=1 Ack=1 Win=43776 Len=0 TSval=3304812 TSecr=3304812
   24 0.102088494    127.0.0.1 → 127.0.0.1    Socks 71 Version: 5 Connect to server request
   25 0.102095206    127.0.0.1 → 127.0.0.1    TCP 68 1080 → 39736 [ACK] Seq=1 Ack=4 Win=43776 Len=0 TSval=3304812 TSecr=3304812
   26 0.102120931    127.0.0.1 → 127.0.0.1    Socks 70 Version: 5 Connect to server response
   27 0.102131363    127.0.0.1 → 127.0.0.1    TCP 68 39736 → 1080 [ACK] Seq=4 Ack=3 Win=43776 Len=0 TSval=3304812 TSecr=3304812
   28 0.102145294    127.0.0.1 → 127.0.0.1    Socks 81 Version: 5 Command Request - Connect
   29 0.145355913    127.0.0.1 → 127.0.0.1    TCP 68 1080 → 39736 [ACK] Seq=3 Ack=17 Win=43776 Len=0 TSval=3304823 TSecr=3304812
   30 0.263764530    127.0.0.1 → 127.0.0.1    TCP 76 39738 → 1080 [SYN] Seq=0 Win=43690 Len=0 MSS=65495 SACK_PERM=1 TSval=3304852 TSecr=0 WS=128
   31 0.263777971    127.0.0.1 → 127.0.0.1    TCP 76 1080 → 39738 [SYN, ACK] Seq=0 Ack=1 Win=43690 Len=0 MSS=65495 SACK_PERM=1 TSval=3304852 TSecr=3304852 WS=128
   32 0.263787938    127.0.0.1 → 127.0.0.1    TCP 68 39738 → 1080 [ACK] Seq=1 Ack=1 Win=43776 Len=0 TSval=3304852 TSecr=3304852
   33 0.263838310    127.0.0.1 → 127.0.0.1    Socks 71 Version: 5 Connect to server request
   34 0.263841657    127.0.0.1 → 127.0.0.1    TCP 68 1080 → 39738 [ACK] Seq=1 Ack=4 Win=43776 Len=0 TSval=3304852 TSecr=3304852
   35 0.263862237    127.0.0.1 → 127.0.0.1    Socks 70 Version: 5 Connect to server response
   36 0.263866487    127.0.0.1 → 127.0.0.1    TCP 68 39738 → 1080 [ACK] Seq=4 Ack=3 Win=43776 Len=0 TSval=3304852 TSecr=3304852
   37 0.263931181    127.0.0.1 → 127.0.0.1    Socks 94 Version: 5 Command Request - Connect
   38 0.305407275    127.0.0.1 → 127.0.0.1    TCP 68 1080 → 39738 [ACK] Seq=3 Ack=30 Win=43776 Len=0 TSval=3304863 TSecr=3304852
   39 5.055668172    127.0.0.1 → 127.0.1.1    DNS 67 Standard query 0x1b08 SOA local
   40 5.055717205    127.0.1.1 → 127.0.0.1    DNS 67 Standard query response 0x1b08 Refused SOA local
