    1 0.000000000 192.168.1.12 → 10.6.15.156  SSH 126 Client: Encrypted packet (len=60)
    2 0.001554579  10.6.15.156 → 192.168.1.12 TCP 66 22 → 54766 [ACK] Seq=1 Ack=61 Win=1452 Len=0 TSval=14759001 TSecr=7827505
    3 0.059444517 192.168.1.12 → 224.0.0.252  IGMPv2 46 Membership Report group 224.0.0.252
    4 0.272284034  10.6.15.156 → 192.168.1.12 SSH 102 Server: Encrypted packet (len=36)
    5 0.315461118 192.168.1.12 → 10.6.15.156  TCP 66 54766 → 22 [ACK] Seq=61 Ack=37 Win=4866 Len=0 TSval=7827584 TSecr=14759069
    6 0.703508379  10.6.15.156 → 192.168.1.12 SSH 162 Server: Encrypted packet (len=96)
    7 0.703536161 192.168.1.12 → 10.6.15.156  TCP 66 54766 → 22 [ACK] Seq=61 Ack=133 Win=4866 Len=0 TSval=7827681 TSecr=14759177
    8 0.718636101  10.6.15.156 → 192.168.1.12 SSH 138 Server: Encrypted packet (len=72)
    9 0.718653084 192.168.1.12 → 10.6.15.156  TCP 66 54766 → 22 [ACK] Seq=61 Ack=205 Win=4866 Len=0 TSval=7827684 TSecr=14759181
   10 0.857838500  10.6.15.156 → 192.168.1.12 SSH 138 Server: Encrypted packet (len=72)
   11 0.857856625 192.168.1.12 → 10.6.15.156  TCP 66 54766 → 22 [ACK] Seq=61 Ack=277 Win=4866 Len=0 TSval=7827719 TSecr=14759216
   12 0.874351793  10.6.15.156 → 192.168.1.12 SSH 138 Server: Encrypted packet (len=72)
   13 0.874369520 192.168.1.12 → 10.6.15.156  TCP 66 54766 → 22 [ACK] Seq=61 Ack=349 Win=4866 Len=0 TSval=7827723 TSecr=14759220
   14 0.874390648  10.6.15.156 → 192.168.1.12 SSH 102 Server: Encrypted packet (len=36)
   15 0.874402868 192.168.1.12 → 10.6.15.156  TCP 66 54766 → 22 [ACK] Seq=61 Ack=385 Win=4866 Len=0 TSval=7827723 TSecr=14759220
   16 0.876872895  10.6.15.156 → 192.168.1.12 SSH 102 Server: Encrypted packet (len=36)
   17 0.876890103 192.168.1.12 → 10.6.15.156  TCP 66 54766 → 22 [ACK] Seq=61 Ack=421 Win=4866 Len=0 TSval=7827724 TSecr=14759220
   18 0.895330123  10.6.15.156 → 192.168.1.12 SSH 102 Server: Encrypted packet (len=36)
   19 0.895348268 192.168.1.12 → 10.6.15.156  TCP 66 54766 → 22 [ACK] Seq=61 Ack=457 Win=4866 Len=0 TSval=7827728 TSecr=14759224
   20 0.895365472  10.6.15.156 → 192.168.1.12 SSH 102 Server: Encrypted packet (len=36)
   21 0.895368710 192.168.1.12 → 10.6.15.156  TCP 66 54766 → 22 [ACK] Seq=61 Ack=493 Win=4866 Len=0 TSval=7827728 TSecr=14759224
   22 0.895374695  10.6.15.156 → 192.168.1.12 SSH 102 Server: Encrypted packet (len=36)
   23 0.895376783 192.168.1.12 → 10.6.15.156  TCP 66 54766 → 22 [ACK] Seq=61 Ack=529 Win=4866 Len=0 TSval=7827728 TSecr=14759225
   24 0.907112857 192.168.1.12 → 10.6.15.156  SSH 102 Client: Encrypted packet (len=36)
   25 0.908520168  10.6.15.156 → 192.168.1.12 TCP 66 22 → 54766 [ACK] Seq=529 Ack=97 Win=1452 Len=0 TSval=14759228 TSecr=7827731
   26 1.054927071 192.168.1.12 → 10.6.15.156  SSH 102 Client: Encrypted packet (len=36)
   27 1.056292216  10.6.15.156 → 192.168.1.12 TCP 66 22 → 54766 [ACK] Seq=529 Ack=133 Win=1452 Len=0 TSval=14759265 TSecr=7827768
   28 1.060589940 192.168.1.12 → 10.6.15.156  SSH 102 Client: Encrypted packet (len=36)
   29 1.061926813  10.6.15.156 → 192.168.1.12 TCP 66 22 → 54766 [ACK] Seq=529 Ack=169 Win=1452 Len=0 TSval=14759267 TSecr=7827770
   30 1.063062688 192.168.1.12 → 10.6.15.156  SSH 102 Client: Encrypted packet (len=36)
   31 1.063269959 192.168.1.12 → 10.6.15.156  SSH 102 Client: Encrypted packet (len=36)
   32 1.063450456 192.168.1.12 → 10.6.15.156  SSH 102 Client: Encrypted packet (len=36)
   33 1.064723397  10.6.15.156 → 192.168.1.12 TCP 66 22 → 54766 [ACK] Seq=529 Ack=205 Win=1452 Len=0 TSval=14759267 TSecr=7827770
   34 1.064734492 192.168.1.12 → 10.6.15.156  SSH 210 Client: Encrypted packet (len=144)
   35 1.064744100  10.6.15.156 → 192.168.1.12 TCP 66 22 → 54766 [ACK] Seq=529 Ack=241 Win=1452 Len=0 TSval=14759267 TSecr=7827770
   36 1.064758039  10.6.15.156 → 192.168.1.12 TCP 66 22 → 54766 [ACK] Seq=529 Ack=277 Win=1452 Len=0 TSval=14759267 TSecr=7827771
   37 1.066756264  10.6.15.156 → 192.168.1.12 TCP 66 22 → 54766 [ACK] Seq=529 Ack=421 Win=1452 Len=0 TSval=14759268 TSecr=7827771
   38 1.086885589 192.168.1.12 → 10.6.15.156  SSH 102 Client: Encrypted packet (len=36)
   39 1.088747257  10.6.15.156 → 192.168.1.12 TCP 66 22 → 54766 [ACK] Seq=529 Ack=457 Win=1452 Len=0 TSval=14759273 TSecr=7827776
   40 1.252037354 192.168.1.12 → 10.6.15.156  SSH 126 Client: Encrypted packet (len=60)
   41 1.253865933  10.6.15.156 → 192.168.1.12 TCP 66 22 → 54766 [ACK] Seq=529 Ack=517 Win=1452 Len=0 TSval=14759315 TSecr=7827818
   42 1.259977266 192.168.1.12 → 10.6.15.156  SSH 102 Client: Encrypted packet (len=36)
   43 1.261356222  10.6.15.156 → 192.168.1.12 TCP 66 22 → 54766 [ACK] Seq=529 Ack=553 Win=1452 Len=0 TSval=14759316 TSecr=7827820
   44 1.272161313  10.6.15.156 → 192.168.1.12 SSH 102 Server: Encrypted packet (len=36)
   45 1.272479974 192.168.1.12 → 10.6.15.156  SSH 390 Client: Encrypted packet (len=324)
   46 1.292469457  10.6.15.156 → 192.168.1.12 SSH 182 Server: Encrypted packet (len=116)
   47 1.299566780  10.6.15.156 → 192.168.1.12 SSH 102 Server: Encrypted packet (len=36)
   48 1.299626757 192.168.1.12 → 10.6.15.156  TCP 66 54766 → 22 [ACK] Seq=877 Ack=717 Win=4866 Len=0 TSval=7827830 TSecr=14759324
   49 1.300013241 192.168.1.12 → 10.6.15.156  SSH 1382 Client: Encrypted packet (len=1316)
   50 1.341795008  10.6.15.156 → 192.168.1.12 TCP 66 22 → 54766 [ACK] Seq=717 Ack=2193 Win=1452 Len=0 TSval=14759337 TSecr=7827830
   51 1.348814844  10.6.15.156 → 192.168.1.12 SSH 350 Server: Encrypted packet (len=284)
   52 1.391407223 192.168.1.12 → 10.6.15.156  TCP 66 54766 → 22 [ACK] Seq=2193 Ack=1001 Win=4866 Len=0 TSval=7827853 TSecr=14759338
   53 2.487668640  10.6.15.156 → 192.168.1.12 SSH 102 Server: Encrypted packet (len=36)
   54 2.487698144 192.168.1.12 → 10.6.15.156  TCP 66 54766 → 22 [ACK] Seq=2193 Ack=1037 Win=4866 Len=0 TSval=7828127 TSecr=14759623
   55 2.611371023  10.6.15.156 → 192.168.1.12 SSH 102 Server: Encrypted packet (len=36)
   56 2.611389105 192.168.1.12 → 10.6.15.156  TCP 66 54766 → 22 [ACK] Seq=2193 Ack=1073 Win=4866 Len=0 TSval=7828157 TSecr=14759654
   57 2.612688313  10.6.15.156 → 192.168.1.12 SSH 102 Server: Encrypted packet (len=36)
   58 2.612707246 192.168.1.12 → 10.6.15.156  TCP 66 54766 → 22 [ACK] Seq=2193 Ack=1109 Win=4866 Len=0 TSval=7828158 TSecr=14759654
   59 2.616242930 192.168.1.12 → 10.6.15.156  SSH 102 Client: Encrypted packet (len=36)
   60 2.617707500  10.6.15.156 → 192.168.1.12 TCP 66 22 → 54766 [ACK] Seq=1109 Ack=2229 Win=1452 Len=0 TSval=14759656 TSecr=7828159
   61 2.617735347 192.168.1.12 → 10.6.15.156  SSH 102 Client: Encrypted packet (len=36)
   62 2.619516030  10.6.15.156 → 192.168.1.12 TCP 66 22 → 54766 [ACK] Seq=1109 Ack=2265 Win=1452 Len=0 TSval=14759656 TSecr=7828159
   63 2.629201372  10.6.15.156 → 192.168.1.12 SSH 102 Server: Encrypted packet (len=36)
   64 2.631067069  10.6.15.156 → 192.168.1.12 SSH 102 Server: Encrypted packet (len=36)
   65 2.631136074 192.168.1.12 → 10.6.15.156  TCP 66 54766 → 22 [ACK] Seq=2265 Ack=1181 Win=4866 Len=0 TSval=7828162 TSecr=14759658
   66 2.633593959 192.168.1.12 → 10.6.15.156  SSH 102 Client: Encrypted packet (len=36)
   67 2.636964782  10.6.15.156 → 192.168.1.12 SSH 102 Server: Encrypted packet (len=36)
   68 2.636991291 192.168.1.12 → 10.6.15.156  SSH 102 Client: Encrypted packet (len=36)
   69 2.638997881  10.6.15.156 → 192.168.1.12 TCP 66 22 → 54766 [ACK] Seq=1217 Ack=2337 Win=1452 Len=0 TSval=14759661 TSecr=7828163
   70 2.649426449  10.6.15.156 → 192.168.1.12 SSH 102 Server: Encrypted packet (len=36)
   71 2.691464414 192.168.1.12 → 10.6.15.156  TCP 66 54766 → 22 [ACK] Seq=2337 Ack=1253 Win=4866 Len=0 TSval=7828178 TSecr=14759663
   72 2.757866223  10.6.15.156 → 192.168.1.12 SSH 102 Server: Encrypted packet (len=36)
   73 2.757891690 192.168.1.12 → 10.6.15.156  TCP 66 54766 → 22 [ACK] Seq=2337 Ack=1289 Win=4866 Len=0 TSval=7828194 TSecr=14759690
   74 2.766334236  10.6.15.156 → 192.168.1.12 SSH 102 Server: Encrypted packet (len=36)
   75 2.766350873 192.168.1.12 → 10.6.15.156  TCP 66 54766 → 22 [ACK] Seq=2337 Ack=1325 Win=4866 Len=0 TSval=7828196 TSecr=14759693
   76 2.781992398  10.6.15.156 → 192.168.1.12 SSH 102 Server: Encrypted packet (len=36)
   77 2.782008913 192.168.1.12 → 10.6.15.156  TCP 66 54766 → 22 [ACK] Seq=2337 Ack=1361 Win=4866 Len=0 TSval=7828200 TSecr=14759696
   78 2.784130510  10.6.15.156 → 192.168.1.12 SSH 102 Server: Encrypted packet (len=36)
   79 2.784144919 192.168.1.12 → 10.6.15.156  TCP 66 54766 → 22 [ACK] Seq=2337 Ack=1397 Win=4866 Len=0 TSval=7828201 TSecr=14759697
   80 2.996140480 192.168.1.12 → 10.6.15.156  SSH 862 Client: Encrypted packet (len=796)
   81 3.037817222  10.6.15.156 → 192.168.1.12 TCP 66 22 → 54766 [ACK] Seq=1397 Ack=3133 Win=1452 Len=0 TSval=14759761 TSecr=7828254
   82 3.037836441 192.168.1.12 → 10.6.15.156  SSH 862 Client: Encrypted packet (len=796)
   83 3.039940516  10.6.15.156 → 192.168.1.12 TCP 66 22 → 54766 [ACK] Seq=1397 Ack=3929 Win=1452 Len=0 TSval=14759761 TSecr=7828264
   84 3.217742871  10.6.15.156 → 192.168.1.12 SSH 454 Server: Encrypted packet (len=388)
   85 3.217764160 192.168.1.12 → 10.6.15.156  TCP 66 54766 → 22 [ACK] Seq=3929 Ack=1785 Win=4866 Len=0 TSval=7828309 TSecr=14759805
   86 3.254652587  10.6.15.156 → 192.168.1.12 SSH 454 Server: Encrypted packet (len=388)
   87 3.254670603 192.168.1.12 → 10.6.15.156  TCP 66 54766 → 22 [ACK] Seq=3929 Ack=2173 Win=4866 Len=0 TSval=7828318 TSecr=14759815
   88 3.990828731 192.168.1.12 → 10.6.15.156  SSH 862 Client: Encrypted packet (len=796)
   89 3.994816218  10.6.15.156 → 192.168.1.12 TCP 66 22 → 54766 [ACK] Seq=2173 Ack=4725 Win=1452 Len=0 TSval=14760000 TSecr=7828502
   90 4.197300362  10.6.15.156 → 192.168.1.12 SSH 102 Server: Encrypted packet (len=36)
   91 4.197320187 192.168.1.12 → 10.6.15.156  TCP 66 54766 → 22 [ACK] Seq=4725 Ack=2209 Win=4866 Len=0 TSval=7828554 TSecr=14760050
   92 4.208252436  10.6.15.156 → 192.168.1.12 SSH 454 Server: Encrypted packet (len=388)
   93 4.208280100 192.168.1.12 → 10.6.15.156  TCP 66 54766 → 22 [ACK] Seq=4725 Ack=2597 Win=4866 Len=0 TSval=7828557 TSecr=14760053
   94 4.337128444  10.6.15.156 → 192.168.1.12 SSH 102 Server: Encrypted packet (len=36)
   95 4.337154663 192.168.1.12 → 10.6.15.156  TCP 66 54766 → 22 [ACK] Seq=4725 Ack=2633 Win=4866 Len=0 TSval=7828589 TSecr=14760085
   96 4.354077992  10.6.15.156 → 192.168.1.12 SSH 102 Server: Encrypted packet (len=36)
   97 4.354094745 192.168.1.12 → 10.6.15.156  TCP 66 54766 → 22 [ACK] Seq=4725 Ack=2669 Win=4866 Len=0 TSval=7828593 TSecr=14760090
   98 4.356401986  10.6.15.156 → 192.168.1.12 SSH 102 Server: Encrypted packet (len=36)
   99 4.356421518 192.168.1.12 → 10.6.15.156  TCP 66 54766 → 22 [ACK] Seq=4725 Ack=2705 Win=4866 Len=0 TSval=7828594 TSecr=14760090
  100 4.381016922 192.168.1.12 → 10.6.15.156  SSH 102 Client: Encrypted packet (len=36)
  101 4.383274762  10.6.15.156 → 192.168.1.12 TCP 66 22 → 54766 [ACK] Seq=2705 Ack=4761 Win=1452 Len=0 TSval=14760097 TSecr=7828600
  102 4.406529662 192.168.1.12 → 10.6.15.156  SSH 206 Client: Encrypted packet (len=140)
  103 4.408139123  10.6.15.156 → 192.168.1.12 TCP 66 22 → 54766 [ACK] Seq=2705 Ack=4901 Win=1452 Len=0 TSval=14760103 TSecr=7828606
  104 4.422829770  10.6.15.156 → 192.168.1.12 SSH 102 Server: Encrypted packet (len=36)
  105 4.423175508 192.168.1.12 → 10.6.15.156  SSH 542 Client: Encrypted packet (len=476)
  106 4.462780620  10.6.15.156 → 192.168.1.12 TCP 66 22 → 54766 [ACK] Seq=2741 Ack=5377 Win=1452 Len=0 TSval=14760117 TSecr=7828610
  107 4.462800516 192.168.1.12 → 10.6.15.156  SSH 174 Client: Encrypted packet (len=108)
  108 4.464421336  10.6.15.156 → 192.168.1.12 TCP 66 22 → 54766 [ACK] Seq=2741 Ack=5485 Win=1452 Len=0 TSval=14760117 TSecr=7828620
  109 4.499206530  10.6.15.156 → 192.168.1.12 SSH 1514 Server: Encrypted packet (len=1448)
  110 4.499226620  10.6.15.156 → 192.168.1.12 SSH 158 Server: Encrypted packet (len=92)
  111 4.499234337 192.168.1.12 → 10.6.15.156  TCP 66 54766 → 22 [ACK] Seq=5485 Ack=4281 Win=4866 Len=0 TSval=7828629 TSecr=14760126
  112 4.601684593  10.6.15.156 → 192.168.1.12 SSH 142 Server: Encrypted packet (len=76)
  113 4.601703133  10.6.15.156 → 192.168.1.12 SSH 102 Server: Encrypted packet (len=36)
  114 4.601754410 192.168.1.12 → 10.6.15.156  TCP 66 54766 → 22 [ACK] Seq=5485 Ack=4393 Win=4866 Len=0 TSval=7828655 TSecr=14760152
  115 4.605089184 192.168.1.12 → 10.6.15.156  SSH 138 Client: Encrypted packet (len=72)
  116 4.607025682  10.6.15.156 → 192.168.1.12 SSH 102 Server: Encrypted packet (len=36)
  117 4.647407529 192.168.1.12 → 10.6.15.156  TCP 66 54766 → 22 [ACK] Seq=5557 Ack=4429 Win=4866 Len=0 TSval=7828667 TSecr=14760153
  118 4.679821187  10.6.15.156 → 192.168.1.12 SSH 102 Server: Encrypted packet (len=36)
  119 4.679841304 192.168.1.12 → 10.6.15.156  TCP 66 54766 → 22 [ACK] Seq=5557 Ack=4465 Win=4866 Len=0 TSval=7828675 TSecr=14760171
  120 5.006255132 192.168.1.12 → 10.6.15.156  SSH 158 Client: Encrypted packet (len=92)
  121 5.008326553 192.168.1.12 → 10.6.15.156  SSH 1514 Client: Encrypted packet (len=1448)
  122 5.008830297 192.168.1.12 → 10.6.15.156  SSH 210 Client: Encrypted packet (len=144)
  123 5.010505202  10.6.15.156 → 192.168.1.12 TCP 66 22 → 54766 [ACK] Seq=4465 Ack=7241 Win=1452 Len=0 TSval=14760254 TSecr=7828756
  124 5.020370038 192.168.1.12 → 10.6.15.156  SSH 198 Client: Encrypted packet (len=132)
  125 5.025357765  10.6.15.156 → 192.168.1.12 SSH 150 Server: Encrypted packet (len=84)
  126 5.025376974 192.168.1.12 → 10.6.15.156  TCP 66 54766 → 22 [ACK] Seq=7373 Ack=4549 Win=4866 Len=0 TSval=7828761 TSecr=14760257
  127 5.151836346  10.6.15.156 → 192.168.1.12 SSH 1514 Server: Encrypted packet (len=1448)
  128 5.151855451 192.168.1.12 → 10.6.15.156  TCP 66 54766 → 22 [ACK] Seq=7373 Ack=5997 Win=4866 Len=0 TSval=7828793 TSecr=14760289
  129 5.151999148  10.6.15.156 → 192.168.1.12 SSH 1514 Server: Encrypted packet (len=1448)
  130 5.152008160 192.168.1.12 → 10.6.15.156  TCP 66 54766 → 22 [ACK] Seq=7373 Ack=7445 Win=4866 Len=0 TSval=7828793 TSecr=14760289
  131 5.152337520  10.6.15.156 → 192.168.1.12 SSH 1514 Server: Encrypted packet (len=1448)
  132 5.152345350 192.168.1.12 → 10.6.15.156  TCP 66 54766 → 22 [ACK] Seq=7373 Ack=8893 Win=4866 Len=0 TSval=7828793 TSecr=14760289
  133 5.152522303  10.6.15.156 → 192.168.1.12 SSH 1514 Server: Encrypted packet (len=1448)
  134 5.152539122 192.168.1.12 → 10.6.15.156  TCP 66 54766 → 22 [ACK] Seq=7373 Ack=10341 Win=4866 Len=0 TSval=7828793 TSecr=14760289
  135 5.152548713  10.6.15.156 → 192.168.1.12 SSH 102 Server: Encrypted packet (len=36)
  136 5.152553043 192.168.1.12 → 10.6.15.156  TCP 66 54766 → 22 [ACK] Seq=7373 Ack=10377 Win=4866 Len=0 TSval=7828793 TSecr=14760289
  137 5.153468476  10.6.15.156 → 192.168.1.12 SSH 1514 Server: Encrypted packet (len=1448)
  138 5.153490770 192.168.1.12 → 10.6.15.156  TCP 66 54766 → 22 [ACK] Seq=7373 Ack=11825 Win=4866 Len=0 TSval=7828793 TSecr=14760289
  139 5.155104186  10.6.15.156 → 192.168.1.12 SSH 1514 Server: Encrypted packet (len=1448)
  140 5.155122729 192.168.1.12 → 10.6.15.156  TCP 66 54766 → 22 [ACK] Seq=7373 Ack=13273 Win=4866 Len=0 TSval=7828793 TSecr=14760290
  141 5.155285764  10.6.15.156 → 192.168.1.12 SSH 1514 Server: Encrypted packet (len=1448)
  142 5.155292946 192.168.1.12 → 10.6.15.156  TCP 66 54766 → 22 [ACK] Seq=7373 Ack=14721 Win=4866 Len=0 TSval=7828793 TSecr=14760290
  143 5.155488528  10.6.15.156 → 192.168.1.12 SSH 1514 Server: Encrypted packet (len=1448)
  144 5.155494977 192.168.1.12 → 10.6.15.156  TCP 66 54766 → 22 [ACK] Seq=7373 Ack=16169 Win=4866 Len=0 TSval=7828794 TSecr=14760290
  145 5.155669118  10.6.15.156 → 192.168.1.12 SSH 1514 Server: Encrypted packet (len=1448)
  146 5.155675286 192.168.1.12 → 10.6.15.156  TCP 66 54766 → 22 [ACK] Seq=7373 Ack=17617 Win=4866 Len=0 TSval=7828794 TSecr=14760290
  147 5.155861396  10.6.15.156 → 192.168.1.12 SSH 1514 Server: Encrypted packet (len=1448)
  148 5.155867336 192.168.1.12 → 10.6.15.156  TCP 66 54766 → 22 [ACK] Seq=7373 Ack=19065 Win=4866 Len=0 TSval=7828794 TSecr=14760290
  149 5.156207492  10.6.15.156 → 192.168.1.12 SSH 1514 Server: Encrypted packet (len=1448)
  150 5.156214776 192.168.1.12 → 10.6.15.156  TCP 66 54766 → 22 [ACK] Seq=7373 Ack=20513 Win=4866 Len=0 TSval=7828794 TSecr=14760290
  151 5.159951095  10.6.15.156 → 192.168.1.12 SSH 1514 Server: Encrypted packet (len=1448)
  152 5.159970961 192.168.1.12 → 10.6.15.156  TCP 66 54766 → 22 [ACK] Seq=7373 Ack=21961 Win=4866 Len=0 TSval=7828795 TSecr=14760291
  153 5.160134836  10.6.15.156 → 192.168.1.12 SSH 1514 Server: Encrypted packet (len=1448)
  154 5.160139495 192.168.1.12 → 10.6.15.156  TCP 66 54766 → 22 [ACK] Seq=7373 Ack=23409 Win=4866 Len=0 TSval=7828795 TSecr=14760291
  155 5.160326906  10.6.15.156 → 192.168.1.12 SSH 1514 Server: Encrypted packet (len=1448)
  156 5.160332784 192.168.1.12 → 10.6.15.156  TCP 66 54766 → 22 [ACK] Seq=7373 Ack=24857 Win=4866 Len=0 TSval=7828795 TSecr=14760291
  157 5.160519747  10.6.15.156 → 192.168.1.12 SSH 1514 Server: Encrypted packet (len=1448)
  158 5.160710262  10.6.15.156 → 192.168.1.12 SSH 1514 Server: Encrypted packet (len=1448)
  159 5.160716721 192.168.1.12 → 10.6.15.156  TCP 66 54766 → 22 [ACK] Seq=7373 Ack=27753 Win=4866 Len=0 TSval=7828795 TSecr=14760291
  160 5.160903704  10.6.15.156 → 192.168.1.12 SSH 1514 Server: Encrypted packet (len=1448)
  161 5.161095678  10.6.15.156 → 192.168.1.12 SSH 1514 Server: Encrypted packet (len=1448)
  162 5.161102686 192.168.1.12 → 10.6.15.156  TCP 66 54766 → 22 [ACK] Seq=7373 Ack=30649 Win=4866 Len=0 TSval=7828795 TSecr=14760291
  163 5.165098937  10.6.15.156 → 192.168.1.12 SSH 514 Server: Encrypted packet (len=448)
  164 5.165158113 192.168.1.12 → 10.6.15.156  TCP 66 54766 → 22 [ACK] Seq=7373 Ack=31097 Win=4866 Len=0 TSval=7828796 TSecr=14760292
  165 5.165272380 192.168.1.12 → 10.6.15.156  SSH 102 Client: Encrypted packet (len=36)
  166 5.205738708  10.6.15.156 → 192.168.1.12 TCP 66 22 → 54766 [ACK] Seq=31097 Ack=7409 Win=1452 Len=0 TSval=14760303 TSecr=7828796
  167 5.223476852  10.6.15.156 → 192.168.1.12 SSH 102 Server: Encrypted packet (len=36)
  168 5.224732835  10.6.15.156 → 192.168.1.12 SSH 454 Server: Encrypted packet (len=388)
  169 5.224804834 192.168.1.12 → 10.6.15.156  TCP 66 54766 → 22 [ACK] Seq=7409 Ack=31521 Win=4866 Len=0 TSval=7828811 TSecr=14760307
  170 5.227555044  10.6.15.156 → 192.168.1.12 SSH 454 Server: Encrypted packet (len=388)
  171 5.271407797 192.168.1.12 → 10.6.15.156  TCP 66 54766 → 22 [ACK] Seq=7409 Ack=31909 Win=4866 Len=0 TSval=7828823 TSecr=14760308
  172 5.438806493 192.168.1.12 → 10.6.15.156  SSH 118 Client: Encrypted packet (len=52)
  173 5.440264024  10.6.15.156 → 192.168.1.12 TCP 66 22 → 54766 [ACK] Seq=31909 Ack=7461 Win=1452 Len=0 TSval=14760361 TSecr=7828864
  174 5.462795020 192.168.1.12 → 10.6.15.156  SSH 230 Client: Encrypted packet (len=164)
  175 5.464486770  10.6.15.156 → 192.168.1.12 TCP 66 22 → 54766 [ACK] Seq=31909 Ack=7625 Win=1452 Len=0 TSval=14760367 TSecr=7828870
  176 5.466699970 192.168.1.12 → 10.6.15.156  SSH 182 Client: Encrypted packet (len=116)
  177 5.470473283  10.6.15.156 → 192.168.1.12 TCP 66 22 → 54766 [ACK] Seq=31909 Ack=7741 Win=1452 Len=0 TSval=14760368 TSecr=7828871
  178 5.516047948 192.168.1.12 → 10.6.15.156  SSH 182 Client: Encrypted packet (len=116)
  179 5.516315708 192.168.1.12 → 10.6.15.156  SSH 222 Client: Encrypted packet (len=156)
  180 5.516679013  10.6.15.156 → 192.168.1.12 SSH 102 Server: Encrypted packet (len=36)
  181 5.516688836 192.168.1.12 → 10.6.15.156  TCP 66 54766 → 22 [ACK] Seq=8013 Ack=31945 Win=4866 Len=0 TSval=7828884 TSecr=14760380
  182 5.517003181 192.168.1.12 → 10.6.15.156  SSH 502 Client: Encrypted packet (len=436)
  183 5.517762483  10.6.15.156 → 192.168.1.12 TCP 66 22 → 54766 [ACK] Seq=31945 Ack=7857 Win=1452 Len=0 TSval=14760381 TSecr=7828884
  184 5.517771855  10.6.15.156 → 192.168.1.12 TCP 66 22 → 54766 [ACK] Seq=31945 Ack=8013 Win=1452 Len=0 TSval=14760381 TSecr=7828884
  185 5.518948702  10.6.15.156 → 192.168.1.12 TCP 66 22 → 54766 [ACK] Seq=31945 Ack=8449 Win=1452 Len=0 TSval=14760381 TSecr=7828884
  186 5.556420841  10.6.15.156 → 192.168.1.12 SSH 1514 Server: Encrypted packet (len=1448)
  187 5.556601813  10.6.15.156 → 192.168.1.12 SSH 1514 Server: Encrypted packet (len=1448)
  188 5.556610977 192.168.1.12 → 10.6.15.156  TCP 66 54766 → 22 [ACK] Seq=8449 Ack=34841 Win=4866 Len=0 TSval=7828894 TSecr=14760390
  189 5.556623896  10.6.15.156 → 192.168.1.12 SSH 142 Server: Encrypted packet (len=76)
  190 5.558444542  10.6.15.156 → 192.168.1.12 SSH 958 Server: Encrypted packet (len=892)
  191 5.558514107 192.168.1.12 → 10.6.15.156  TCP 66 54766 → 22 [ACK] Seq=8449 Ack=35809 Win=4866 Len=0 TSval=7828894 TSecr=14760390
  192 5.573419467 10.22.17.139 → 224.0.0.252  LLMNR 64 Standard query 0xee56 A wpad
  193 5.574988503 10.22.17.139 → 224.0.0.252  LLMNR 64 Standard query 0x1998 A wpad
  194 5.591259361  10.6.15.156 → 192.168.1.12 SSH 742 Server: Encrypted packet (len=676)
  195 5.592263369 192.168.1.12 → 10.6.15.156  SSH 254 Client: Encrypted packet (len=188)
  196 5.606512956  10.6.15.156 → 192.168.1.12 SSH 150 Server: Encrypted packet (len=84)
  197 5.609697025  10.6.15.156 → 192.168.1.12 SSH 1514 Server: Encrypted packet (len=1448)
  198 5.609715802 192.168.1.12 → 10.6.15.156  TCP 66 54766 → 22 [ACK] Seq=8637 Ack=38017 Win=4866 Len=0 TSval=7828907 TSecr=14760403
  199 5.609782812  10.6.15.156 → 192.168.1.12 SSH 1246 Server: Encrypted packet (len=1180)
  200 5.610145561  10.6.15.156 → 192.168.1.12 SSH 1514 Server: Encrypted packet (len=1448)
  201 5.610153128 192.168.1.12 → 10.6.15.156  TCP 66 54766 → 22 [ACK] Seq=8637 Ack=40645 Win=4866 Len=0 TSval=7828907 TSecr=14760403
  202 5.610457330  10.6.15.156 → 192.168.1.12 SSH 1514 Server: Encrypted packet (len=1448)
  203 5.610649477  10.6.15.156 → 192.168.1.12 SSH 1514 Server: Encrypted packet (len=1448)
  204 5.610661104 192.168.1.12 → 10.6.15.156  TCP 66 54766 → 22 [ACK] Seq=8637 Ack=43541 Win=4866 Len=0 TSval=7828907 TSecr=14760404
  205 5.611308516  10.6.15.156 → 192.168.1.12 SSH 1514 Server: Encrypted packet (len=1448)
  206 5.613282304  10.6.15.156 → 192.168.1.12 SSH 1514 Server: Encrypted packet (len=1448)
  207 5.613299105 192.168.1.12 → 10.6.15.156  TCP 66 54766 → 22 [ACK] Seq=8637 Ack=46437 Win=4866 Len=0 TSval=7828908 TSecr=14760404
  208 5.613407997  10.6.15.156 → 192.168.1.12 SSH 1134 Server: Encrypted packet (len=1068)
  209 5.629600172  10.6.15.156 → 192.168.1.12 SSH 374 Server: Encrypted packet (len=308)
  210 5.629659283 192.168.1.12 → 10.6.15.156  TCP 66 54766 → 22 [ACK] Seq=8637 Ack=47813 Win=4866 Len=0 TSval=7828912 TSecr=14760404
  211 5.630247822 192.168.1.12 → 10.6.15.156  SSH 678 Client: Encrypted packet (len=612)
  212 5.634611602  10.6.15.156 → 192.168.1.12 SSH 150 Server: Encrypted packet (len=84)
  213 5.643907461  10.6.15.156 → 192.168.1.12 SSH 1514 Server: Encrypted packet (len=1448)
  214 5.643928254 192.168.1.12 → 10.6.15.156  TCP 66 54766 → 22 [ACK] Seq=9249 Ack=49345 Win=4866 Len=0 TSval=7828916 TSecr=14760410
  215 5.644085283  10.6.15.156 → 192.168.1.12 SSH 1514 Server: Encrypted packet (len=1448)
  216 5.644276963  10.6.15.156 → 192.168.1.12 SSH 1514 Server: Encrypted packet (len=1448)
  217 5.644283459 192.168.1.12 → 10.6.15.156  TCP 66 54766 → 22 [ACK] Seq=9249 Ack=52241 Win=4866 Len=0 TSval=7828916 TSecr=14760412
  218 5.644469161  10.6.15.156 → 192.168.1.12 SSH 1514 Server: Encrypted packet (len=1448)
  219 5.644476440  10.6.15.156 → 192.168.1.12 SSH 158 Server: Encrypted packet (len=92)
  220 5.644480057 192.168.1.12 → 10.6.15.156  TCP 66 54766 → 22 [ACK] Seq=9249 Ack=53781 Win=4866 Len=0 TSval=7828916 TSecr=14760412
  221 5.644838421  10.6.15.156 → 192.168.1.12 SSH 1514 Server: Encrypted packet (len=1448)
  222 5.649888095  10.6.15.156 → 192.168.1.12 SSH 1514 Server: Encrypted packet (len=1448)
  223 5.649903210 192.168.1.12 → 10.6.15.156  TCP 66 54766 → 22 [ACK] Seq=9249 Ack=56677 Win=4866 Len=0 TSval=7828917 TSecr=14760412
  224 5.650071021  10.6.15.156 → 192.168.1.12 SSH 1514 Server: Encrypted packet (len=1448)
  225 5.650262036  10.6.15.156 → 192.168.1.12 SSH 1514 Server: Encrypted packet (len=1448)
  226 5.650265027 192.168.1.12 → 10.6.15.156  TCP 66 54766 → 22 [ACK] Seq=9249 Ack=59573 Win=4866 Len=0 TSval=7828917 TSecr=14760413
  227 5.650271279  10.6.15.156 → 192.168.1.12 SSH 158 Server: Encrypted packet (len=92)
  228 5.667895394  10.6.15.156 → 192.168.1.12 SSH 582 Server: Encrypted packet (len=516)
  229 5.667955299 192.168.1.12 → 10.6.15.156  TCP 66 54766 → 22 [ACK] Seq=9249 Ack=60181 Win=4866 Len=0 TSval=7828922 TSecr=14760413
  230 5.731730920  10.6.15.156 → 192.168.1.12 SSH 1514 Server: Encrypted packet (len=1448)
  231 5.731914597  10.6.15.156 → 192.168.1.12 SSH 1514 Server: Encrypted packet (len=1448)
  232 5.731923955 192.168.1.12 → 10.6.15.156  TCP 66 54766 → 22 [ACK] Seq=9249 Ack=63077 Win=4866 Len=0 TSval=7828938 TSecr=14760434
  233 5.732042235  10.6.15.156 → 192.168.1.12 SSH 110 Server: Encrypted packet (len=44)
  234 5.733023393  10.6.15.156 → 192.168.1.12 SSH 1514 Server: Encrypted packet (len=1448)
  235 5.733040128 192.168.1.12 → 10.6.15.156  TCP 66 54766 → 22 [ACK] Seq=9249 Ack=64569 Win=4866 Len=0 TSval=7828938 TSecr=14760434
  236 5.733210357  10.6.15.156 → 192.168.1.12 SSH 1514 Server: Encrypted packet (len=1448)
  237 5.733550870  10.6.15.156 → 192.168.1.12 SSH 1494 Server: Encrypted packet (len=1428)
  238 5.733560791 192.168.1.12 → 10.6.15.156  TCP 66 54766 → 22 [ACK] Seq=9249 Ack=67445 Win=4866 Len=0 TSval=7828938 TSecr=14760434
  239 5.753746114  10.6.15.156 → 192.168.1.12 SSH 1514 Server: Encrypted packet (len=1448)
  240 5.753928956  10.6.15.156 → 192.168.1.12 SSH 1514 Server: Encrypted packet (len=1448)
  241 5.753937820 192.168.1.12 → 10.6.15.156  TCP 66 54766 → 22 [ACK] Seq=9249 Ack=70341 Win=4866 Len=0 TSval=7828943 TSecr=14760439
  242 5.754050148  10.6.15.156 → 192.168.1.12 SSH 134 Server: Encrypted packet (len=68)
  243 5.759916705  10.6.15.156 → 192.168.1.12 SSH 1514 Server: Encrypted packet (len=1448)
  244 5.759930270 192.168.1.12 → 10.6.15.156  TCP 66 54766 → 22 [ACK] Seq=9249 Ack=71857 Win=4866 Len=0 TSval=7828945 TSecr=14760439
  245 5.760104652  10.6.15.156 → 192.168.1.12 SSH 1514 Server: Encrypted packet (len=1448)
  246 5.760443724  10.6.15.156 → 192.168.1.12 SSH 1514 Server: Encrypted packet (len=1448)
  247 5.760448252 192.168.1.12 → 10.6.15.156  TCP 66 54766 → 22 [ACK] Seq=9249 Ack=74753 Win=4866 Len=0 TSval=7828945 TSecr=14760441
  248 5.760455340  10.6.15.156 → 192.168.1.12 SSH 142 Server: Encrypted packet (len=76)
  249 5.761999733  10.6.15.156 → 192.168.1.12 SSH 1514 Server: Encrypted packet (len=1448)
  250 5.762013886 192.168.1.12 → 10.6.15.156  TCP 66 54766 → 22 [ACK] Seq=9249 Ack=76277 Win=4866 Len=0 TSval=7828945 TSecr=14760441
  251 5.762180402  10.6.15.156 → 192.168.1.12 SSH 1514 Server: Encrypted packet (len=1448)
  252 5.762512842  10.6.15.156 → 192.168.1.12 SSH 1514 Server: Encrypted packet (len=1448)
  253 5.762518065 192.168.1.12 → 10.6.15.156  TCP 66 54766 → 22 [ACK] Seq=9249 Ack=79173 Win=4866 Len=0 TSval=7828945 TSecr=14760441
  254 5.762709935  10.6.15.156 → 192.168.1.12 SSH 1514 Server: Encrypted packet (len=1448)
  255 5.763050311  10.6.15.156 → 192.168.1.12 SSH 1514 Server: Encrypted packet (len=1448)
  256 5.763057446 192.168.1.12 → 10.6.15.156  TCP 66 54766 → 22 [ACK] Seq=9249 Ack=82069 Win=4866 Len=0 TSval=7828945 TSecr=14760442
  257 5.763239459  10.6.15.156 → 192.168.1.12 SSH 1514 Server: Encrypted packet (len=1448)
  258 5.765760330  10.6.15.156 → 192.168.1.12 SSH 1514 Server: Encrypted packet (len=1448)
  259 5.765776759 192.168.1.12 → 10.6.15.156  TCP 66 54766 → 22 [ACK] Seq=9249 Ack=84965 Win=4866 Len=0 TSval=7828946 TSecr=14760442
  260 5.765941478  10.6.15.156 → 192.168.1.12 SSH 1514 Server: Encrypted packet (len=1448)
  261 5.766134380  10.6.15.156 → 192.168.1.12 SSH 1514 Server: Encrypted packet (len=1448)
  262 5.766141818 192.168.1.12 → 10.6.15.156  TCP 66 54766 → 22 [ACK] Seq=9249 Ack=87861 Win=4866 Len=0 TSval=7828946 TSecr=14760442
  263 5.766152840  10.6.15.156 → 192.168.1.12 SSH 258 Server: Encrypted packet (len=192)
  264 5.807413390 192.168.1.12 → 10.6.15.156  TCP 66 54766 → 22 [ACK] Seq=9249 Ack=88053 Win=4866 Len=0 TSval=7828957 TSecr=14760442
  265 5.812253723 192.168.1.12 → 10.6.15.156  SSH 302 Client: Encrypted packet (len=236)
  266 5.853984846  10.6.15.156 → 192.168.1.12 TCP 66 22 → 54766 [ACK] Seq=88053 Ack=9485 Win=1452 Len=0 TSval=14760465 TSecr=7828958
  267 5.870273436  10.6.15.156 → 192.168.1.12 SSH 1514 Server: Encrypted packet (len=1448)
  268 5.870454249  10.6.15.156 → 192.168.1.12 SSH 1514 Server: Encrypted packet (len=1448)
  269 5.870462556 192.168.1.12 → 10.6.15.156  TCP 66 54766 → 22 [ACK] Seq=9485 Ack=90949 Win=4866 Len=0 TSval=7828972 TSecr=14760468
  270 5.870687818  10.6.15.156 → 192.168.1.12 SSH 790 Server: Encrypted packet (len=724)
  271 5.870707510 192.168.1.12 → 10.6.15.156  TCP 66 54766 → 22 [ACK] Seq=9485 Ack=91673 Win=4866 Len=0 TSval=7828972 TSecr=14760468
  272 5.941003149  10.6.15.156 → 192.168.1.12 SSH 342 Server: Encrypted packet (len=276)
  273 5.941068575 192.168.1.12 → 10.6.15.156  TCP 66 54766 → 22 [ACK] Seq=9485 Ack=91949 Win=4866 Len=0 TSval=7828990 TSecr=14760486
  274 5.993193588 10.22.17.139 → 224.0.0.252  LLMNR 64 Standard query 0x1998 A wpad
  275 5.993636042 10.22.17.139 → 224.0.0.252  LLMNR 64 Standard query 0xee56 A wpad
  276 6.015402942 192.168.1.12 → 10.6.15.156  SSH 310 Client: Encrypted packet (len=244)
  277 6.017642686  10.6.15.156 → 192.168.1.12 TCP 66 22 → 54766 [ACK] Seq=91949 Ack=9729 Win=1452 Len=0 TSval=14760506 TSecr=7829008
  278 6.017666399 192.168.1.12 → 10.6.15.156  SSH 310 Client: Encrypted packet (len=244)
  279 6.019497481  10.6.15.156 → 192.168.1.12 TCP 66 22 → 54766 [ACK] Seq=91949 Ack=9973 Win=1452 Len=0 TSval=14760506 TSecr=7829009
  280 6.143120089  10.6.15.156 → 192.168.1.12 SSH 334 Server: Encrypted packet (len=268)
  281 6.143200977 192.168.1.12 → 10.6.15.156  TCP 66 54766 → 22 [ACK] Seq=9973 Ack=92217 Win=4866 Len=0 TSval=7829040 TSecr=14760537
  282 6.144880233  10.6.15.156 → 192.168.1.12 SSH 334 Server: Encrypted packet (len=268)
  283 6.144939074 192.168.1.12 → 10.6.15.156  TCP 66 54766 → 22 [ACK] Seq=9973 Ack=92485 Win=4866 Len=0 TSval=7829041 TSecr=14760537
  284 6.356620992 192.168.1.12 → 10.6.15.156  SSH 110 Client: Encrypted packet (len=44)
  285 6.358154221  10.6.15.156 → 192.168.1.12 TCP 66 22 → 54766 [ACK] Seq=92485 Ack=10017 Win=1452 Len=0 TSval=14760591 TSecr=7829094
  286 6.487209634  10.6.15.156 → 192.168.1.12 SSH 110 Server: Encrypted packet (len=44)
  287 6.487235319 192.168.1.12 → 10.6.15.156  TCP 66 54766 → 22 [ACK] Seq=10017 Ack=92529 Win=4866 Len=0 TSval=7829126 TSecr=14760622
  288 6.487652224 192.168.1.12 → 10.6.15.156  SSH 406 Client: Encrypted packet (len=340)
  289 6.489382677  10.6.15.156 → 192.168.1.12 TCP 66 22 → 54766 [ACK] Seq=92529 Ack=10357 Win=1452 Len=0 TSval=14760623 TSecr=7829127
  290 6.614049801  10.6.15.156 → 192.168.1.12 SSH 262 Server: Encrypted packet (len=196)
  291 6.614341753 192.168.1.12 → 10.6.15.156  SSH 142 Client: Encrypted packet (len=76)
  292 6.615972013  10.6.15.156 → 192.168.1.12 TCP 66 22 → 54766 [ACK] Seq=92725 Ack=10433 Win=1452 Len=0 TSval=14760655 TSecr=7829158
  293 6.615993198 192.168.1.12 → 10.6.15.156  SSH 862 Client: Encrypted packet (len=796)
  294 6.618116713  10.6.15.156 → 192.168.1.12 TCP 66 22 → 54766 [ACK] Seq=92725 Ack=11229 Win=1452 Len=0 TSval=14760656 TSecr=7829159
  295 6.742203933  10.6.15.156 → 192.168.1.12 SSH 582 Server: Encrypted packet (len=516)
  296 6.742227660  10.6.15.156 → 192.168.1.12 SSH 102 Server: Encrypted packet (len=36)
  297 6.742286189 192.168.1.12 → 10.6.15.156  TCP 66 54766 → 22 [ACK] Seq=11229 Ack=93277 Win=4866 Len=0 TSval=7829190 TSecr=14760687
  298 6.744329441 192.168.1.12 → 10.6.15.156  SSH 138 Client: Encrypted packet (len=72)
  299 6.745863829  10.6.15.156 → 192.168.1.12 TCP 66 22 → 54766 [ACK] Seq=93277 Ack=11301 Win=1452 Len=0 TSval=14760688 TSecr=7829191
  300 6.745997396  10.6.15.156 → 192.168.1.12 SSH 102 Server: Encrypted packet (len=36)
  301 6.787421261 192.168.1.12 → 10.6.15.156  TCP 66 54766 → 22 [ACK] Seq=11301 Ack=93313 Win=4866 Len=0 TSval=7829202 TSecr=14760688
  302 7.003187474 192.168.1.12 → 10.6.15.156  SSH 246 Client: Encrypted packet (len=180)
  303 7.009140806  10.6.15.156 → 192.168.1.12 SSH 150 Server: Encrypted packet (len=84)
  304 7.009153058 192.168.1.12 → 10.6.15.156  SSH 978 Client: Encrypted packet (len=912)
  305 7.009839368 192.168.1.12 → 10.6.15.156  SSH 198 Client: Encrypted packet (len=132)
  306 7.011645651  10.6.15.156 → 192.168.1.12 SSH 1514 Server: Encrypted packet (len=1448)
  307 7.011829125  10.6.15.156 → 192.168.1.12 SSH 1514 Server: Encrypted packet (len=1448)
  308 7.011836306 192.168.1.12 → 10.6.15.156  TCP 66 54766 → 22 [ACK] Seq=12525 Ack=96293 Win=4866 Len=0 TSval=7829258 TSecr=14760754
  309 7.012022622  10.6.15.156 → 192.168.1.12 SSH 1514 Server: Encrypted packet (len=1448)
  310 7.012028073  10.6.15.156 → 192.168.1.12 SSH 102 Server: Encrypted packet (len=36)
  311 7.012031251 192.168.1.12 → 10.6.15.156  TCP 66 54766 → 22 [ACK] Seq=12525 Ack=97777 Win=4866 Len=0 TSval=7829258 TSecr=14760754
  312 7.012167581  10.6.15.156 → 192.168.1.12 TCP 66 22 → 54766 [ACK] Seq=97777 Ack=12525 Win=1452 Len=0 TSval=14760754 TSecr=7829257
  313 7.012403226  10.6.15.156 → 192.168.1.12 SSH 1514 Server: Encrypted packet (len=1448)
  314 7.012592363  10.6.15.156 → 192.168.1.12 SSH 1514 Server: Encrypted packet (len=1448)
  315 7.012598125 192.168.1.12 → 10.6.15.156  TCP 66 54766 → 22 [ACK] Seq=12525 Ack=100673 Win=4866 Len=0 TSval=7829258 TSecr=14760754
  316 7.012934979  10.6.15.156 → 192.168.1.12 SSH 1514 Server: Encrypted packet (len=1448)
  317 7.015196669  10.6.15.156 → 192.168.1.12 SSH 1514 Server: Encrypted packet (len=1448)
  318 7.015213591 192.168.1.12 → 10.6.15.156  TCP 66 54766 → 22 [ACK] Seq=12525 Ack=103569 Win=4866 Len=0 TSval=7829258 TSecr=14760754
  319 7.015379844  10.6.15.156 → 192.168.1.12 SSH 1514 Server: Encrypted packet (len=1448)
  320 7.015577011  10.6.15.156 → 192.168.1.12 SSH 1514 Server: Encrypted packet (len=1448)
  321 7.015580895 192.168.1.12 → 10.6.15.156  TCP 66 54766 → 22 [ACK] Seq=12525 Ack=106465 Win=4866 Len=0 TSval=7829259 TSecr=14760755
  322 7.015765291  10.6.15.156 → 192.168.1.12 SSH 1514 Server: Encrypted packet (len=1448)
  323 7.015902426 192.168.1.12 → 10.6.15.156  SSH 102 Client: Encrypted packet (len=36)
  324 7.015961599  10.6.15.156 → 192.168.1.12 SSH 1514 Server: Encrypted packet (len=1448)
  325 7.016146773  10.6.15.156 → 192.168.1.12 SSH 1514 Server: Encrypted packet (len=1448)
  326 7.016150454 192.168.1.12 → 10.6.15.156  TCP 66 54766 → 22 [ACK] Seq=12561 Ack=110809 Win=4866 Len=0 TSval=7829259 TSecr=14760755
  327 7.018687014  10.6.15.156 → 192.168.1.12 SSH 1514 Server: Encrypted packet (len=1448)
  328 7.018869138  10.6.15.156 → 192.168.1.12 SSH 1514 Server: Encrypted packet (len=1448)
  329 7.018878849 192.168.1.12 → 10.6.15.156  TCP 66 54766 → 22 [ACK] Seq=12561 Ack=113705 Win=4866 Len=0 TSval=7829259 TSecr=14760756
  330 7.019062347  10.6.15.156 → 192.168.1.12 SSH 1514 Server: Encrypted packet (len=1448)
  331 7.019253982  10.6.15.156 → 192.168.1.12 SSH 1514 Server: Encrypted packet (len=1448)
  332 7.019260451 192.168.1.12 → 10.6.15.156  TCP 66 54766 → 22 [ACK] Seq=12561 Ack=116601 Win=4866 Len=0 TSval=7829259 TSecr=14760756
  333 7.019447173  10.6.15.156 → 192.168.1.12 SSH 1514 Server: Encrypted packet (len=1448)
  334 7.019638430  10.6.15.156 → 192.168.1.12 SSH 1514 Server: Encrypted packet (len=1448)
  335 7.019648268 192.168.1.12 → 10.6.15.156  TCP 66 54766 → 22 [ACK] Seq=12561 Ack=119497 Win=4866 Len=0 TSval=7829260 TSecr=14760756
  336 7.019982931  10.6.15.156 → 192.168.1.12 SSH 1514 Server: Encrypted packet (len=1448)
  337 7.020174510  10.6.15.156 → 192.168.1.12 SSH 1514 Server: Encrypted packet (len=1448)
  338 7.020180461 192.168.1.12 → 10.6.15.156  TCP 66 54766 → 22 [ACK] Seq=12561 Ack=122393 Win=4866 Len=0 TSval=7829260 TSecr=14760756
  339 7.025152310  10.6.15.156 → 192.168.1.12 SSH 1514 Server: Encrypted packet (len=1448)
  340 7.025332964  10.6.15.156 → 192.168.1.12 SSH 1514 Server: Encrypted packet (len=1448)
  341 7.025342205 192.168.1.12 → 10.6.15.156  TCP 66 54766 → 22 [ACK] Seq=12561 Ack=125289 Win=4866 Len=0 TSval=7829261 TSecr=14760757
  342 7.025524496  10.6.15.156 → 192.168.1.12 SSH 1514 Server: Encrypted packet (len=1448)
  343 7.025716666  10.6.15.156 → 192.168.1.12 SSH 1514 Server: Encrypted packet (len=1448)
  344 7.025721154 192.168.1.12 → 10.6.15.156  TCP 66 54766 → 22 [ACK] Seq=12561 Ack=128185 Win=4866 Len=0 TSval=7829261 TSecr=14760757
  345 7.025909190  10.6.15.156 → 192.168.1.12 SSH 1514 Server: Encrypted packet (len=1448)
  346 7.026100856  10.6.15.156 → 192.168.1.12 SSH 1514 Server: Encrypted packet (len=1448)
  347 7.026107180 192.168.1.12 → 10.6.15.156  TCP 66 54766 → 22 [ACK] Seq=12561 Ack=131081 Win=4866 Len=0 TSval=7829261 TSecr=14760757
  348 7.026448917  10.6.15.156 → 192.168.1.12 SSH 1514 Server: Encrypted packet (len=1448)
  349 7.026641024  10.6.15.156 → 192.168.1.12 SSH 1514 Server: Encrypted packet (len=1448)
  350 7.026649491 192.168.1.12 → 10.6.15.156  TCP 66 54766 → 22 [ACK] Seq=12561 Ack=133977 Win=4866 Len=0 TSval=7829261 TSecr=14760757
  351 7.035400209  10.6.15.156 → 192.168.1.12 SSH 1514 Server: Encrypted packet (len=1448)
  352 7.035575812  10.6.15.156 → 192.168.1.12 SSH 1514 Server: Encrypted packet (len=1448)
  353 7.035587083 192.168.1.12 → 10.6.15.156  TCP 66 54766 → 22 [ACK] Seq=12561 Ack=136873 Win=4866 Len=0 TSval=7829264 TSecr=14760760
  354 7.035767744  10.6.15.156 → 192.168.1.12 SSH 1514 Server: Encrypted packet (len=1448)
  355 7.039413192  10.6.15.156 → 192.168.1.12 SSH 1514 Server: Encrypted packet (len=1448)
  356 7.039428813 192.168.1.12 → 10.6.15.156  TCP 66 54766 → 22 [ACK] Seq=12561 Ack=139769 Win=4866 Len=0 TSval=7829265 TSecr=14760760
  357 7.039587625  10.6.15.156 → 192.168.1.12 SSH 1514 Server: Encrypted packet (len=1448)
  358 7.039778911  10.6.15.156 → 192.168.1.12 SSH 1514 Server: Encrypted packet (len=1448)
  359 7.039783527 192.168.1.12 → 10.6.15.156  TCP 66 54766 → 22 [ACK] Seq=12561 Ack=142665 Win=4866 Len=0 TSval=7829265 TSecr=14760760
  360 7.039969915  10.6.15.156 → 192.168.1.12 SSH 1514 Server: Encrypted packet (len=1448)
  361 7.040161115  10.6.15.156 → 192.168.1.12 SSH 1514 Server: Encrypted packet (len=1448)
  362 7.040164615 192.168.1.12 → 10.6.15.156  TCP 66 54766 → 22 [ACK] Seq=12561 Ack=145561 Win=4866 Len=0 TSval=7829265 TSecr=14760760
  363 7.043383879  10.6.15.156 → 192.168.1.12 SSH 1514 Server: Encrypted packet (len=1448)
  364 7.043574325  10.6.15.156 → 192.168.1.12 SSH 1514 Server: Encrypted packet (len=1448)
  365 7.043584778 192.168.1.12 → 10.6.15.156  TCP 66 54766 → 22 [ACK] Seq=12561 Ack=148457 Win=4866 Len=0 TSval=7829266 TSecr=14760761
  366 7.044571286  10.6.15.156 → 192.168.1.12 SSH 1514 Server: Encrypted packet (len=1448)
  367 7.044760061  10.6.15.156 → 192.168.1.12 SSH 1514 Server: Encrypted packet (len=1448)
  368 7.044766609 192.168.1.12 → 10.6.15.156  TCP 66 54766 → 22 [ACK] Seq=12561 Ack=151353 Win=4866 Len=0 TSval=7829266 TSecr=14760762
  369 7.045105614  10.6.15.156 → 192.168.1.12 SSH 1514 Server: Encrypted packet (len=1448)
  370 7.045296247  10.6.15.156 → 192.168.1.12 SSH 1514 Server: Encrypted packet (len=1448)
  371 7.045302140 192.168.1.12 → 10.6.15.156  TCP 66 54766 → 22 [ACK] Seq=12561 Ack=154249 Win=4866 Len=0 TSval=7829266 TSecr=14760762
  372 7.045487964  10.6.15.156 → 192.168.1.12 SSH 1514 Server: Encrypted packet (len=1448)
  373 7.046853437  10.6.15.156 → 192.168.1.12 SSH 1514 Server: Encrypted packet (len=1448)
  374 7.046861009 192.168.1.12 → 10.6.15.156  TCP 66 54766 → 22 [ACK] Seq=12561 Ack=157145 Win=4866 Len=0 TSval=7829266 TSecr=14760762
  375 7.047042678  10.6.15.156 → 192.168.1.12 SSH 1514 Server: Encrypted packet (len=1448)
  376 7.047234634  10.6.15.156 → 192.168.1.12 SSH 1514 Server: Encrypted packet (len=1448)
  377 7.047240246 192.168.1.12 → 10.6.15.156  TCP 66 54766 → 22 [ACK] Seq=12561 Ack=160041 Win=4866 Len=0 TSval=7829266 TSecr=14760762
  378 7.049059952  10.6.15.156 → 192.168.1.12 SSH 1514 Server: Encrypted packet (len=1448)
  379 7.049251377  10.6.15.156 → 192.168.1.12 SSH 1514 Server: Encrypted packet (len=1448)
  380 7.049260092 192.168.1.12 → 10.6.15.156  TCP 66 54766 → 22 [ACK] Seq=12561 Ack=162937 Win=4866 Len=0 TSval=7829267 TSecr=14760763
  381 7.049441534  10.6.15.156 → 192.168.1.12 SSH 1514 Server: Encrypted packet (len=1448)
  382 7.049635044  10.6.15.156 → 192.168.1.12 SSH 1514 Server: Encrypted packet (len=1448)
  383 7.049642600 192.168.1.12 → 10.6.15.156  TCP 66 54766 → 22 [ACK] Seq=12561 Ack=165833 Win=4866 Len=0 TSval=7829267 TSecr=14760763
  384 7.049978341  10.6.15.156 → 192.168.1.12 SSH 1514 Server: Encrypted packet (len=1448)
  385 7.050170160  10.6.15.156 → 192.168.1.12 SSH 1514 Server: Encrypted packet (len=1448)
  386 7.050175622 192.168.1.12 → 10.6.15.156  TCP 66 54766 → 22 [ACK] Seq=12561 Ack=168729 Win=4866 Len=0 TSval=7829267 TSecr=14760763
  387 7.050362599  10.6.15.156 → 192.168.1.12 SSH 1514 Server: Encrypted packet (len=1448)
  388 7.051454711  10.6.15.156 → 192.168.1.12 SSH 1514 Server: Encrypted packet (len=1448)
  389 7.051470536 192.168.1.12 → 10.6.15.156  TCP 66 54766 → 22 [ACK] Seq=12561 Ack=171625 Win=4866 Len=0 TSval=7829268 TSecr=14760763
  390 7.053921280  10.6.15.156 → 192.168.1.12 SSH 1514 Server: Encrypted packet (len=1448)
  391 7.054102160  10.6.15.156 → 192.168.1.12 SSH 1514 Server: Encrypted packet (len=1448)
  392 7.054111302 192.168.1.12 → 10.6.15.156  TCP 66 54766 → 22 [ACK] Seq=12561 Ack=174521 Win=4866 Len=0 TSval=7829268 TSecr=14760764
  393 7.054293919  10.6.15.156 → 192.168.1.12 SSH 1514 Server: Encrypted packet (len=1448)
  394 7.054487210  10.6.15.156 → 192.168.1.12 SSH 1514 Server: Encrypted packet (len=1448)
  395 7.054494424 192.168.1.12 → 10.6.15.156  TCP 66 54766 → 22 [ACK] Seq=12561 Ack=177417 Win=4866 Len=0 TSval=7829268 TSecr=14760764
  396 7.054680130  10.6.15.156 → 192.168.1.12 SSH 1514 Server: Encrypted packet (len=1448)
  397 7.054872147  10.6.15.156 → 192.168.1.12 SSH 1514 Server: Encrypted packet (len=1448)
  398 7.054877865 192.168.1.12 → 10.6.15.156  TCP 66 54766 → 22 [ACK] Seq=12561 Ack=180313 Win=4866 Len=0 TSval=7829268 TSecr=14760764
  399 7.055216510  10.6.15.156 → 192.168.1.12 SSH 1514 Server: Encrypted packet (len=1448)
  400 7.055420799  10.6.15.156 → 192.168.1.12 SSH 1514 Server: Encrypted packet (len=1448)
  401 7.055426657 192.168.1.12 → 10.6.15.156  TCP 66 54766 → 22 [ACK] Seq=12561 Ack=183209 Win=4866 Len=0 TSval=7829269 TSecr=14760764
  402 7.058048142  10.6.15.156 → 192.168.1.12 SSH 1514 Server: Encrypted packet (len=1448)
  403 7.058228894  10.6.15.156 → 192.168.1.12 SSH 1514 Server: Encrypted packet (len=1448)
  404 7.058238633 192.168.1.12 → 10.6.15.156  TCP 66 54766 → 22 [ACK] Seq=12561 Ack=186105 Win=4866 Len=0 TSval=7829269 TSecr=14760765
  405 7.058422713  10.6.15.156 → 192.168.1.12 SSH 1514 Server: Encrypted packet (len=1448)
  406 7.058614084  10.6.15.156 → 192.168.1.12 SSH 1514 Server: Encrypted packet (len=1448)
  407 7.058622268 192.168.1.12 → 10.6.15.156  TCP 66 54766 → 22 [ACK] Seq=12561 Ack=189001 Win=4866 Len=0 TSval=7829269 TSecr=14760765
  408 7.058809209  10.6.15.156 → 192.168.1.12 SSH 1514 Server: Encrypted packet (len=1448)
  409 7.058997452  10.6.15.156 → 192.168.1.12 SSH 1514 Server: Encrypted packet (len=1448)
  410 7.059004491 192.168.1.12 → 10.6.15.156  TCP 66 54766 → 22 [ACK] Seq=12561 Ack=191897 Win=4866 Len=0 TSval=7829269 TSecr=14760765
  411 7.059344948  10.6.15.156 → 192.168.1.12 SSH 1514 Server: Encrypted packet (len=1448)
  412 7.059534690  10.6.15.156 → 192.168.1.12 SSH 1514 Server: Encrypted packet (len=1448)
  413 7.059542165 192.168.1.12 → 10.6.15.156  TCP 66 54766 → 22 [ACK] Seq=12561 Ack=194793 Win=4866 Len=0 TSval=7829270 TSecr=14760765
  414 7.062047561  10.6.15.156 → 192.168.1.12 SSH 1514 Server: Encrypted packet (len=1448)
  415 7.063344916  10.6.15.156 → 192.168.1.12 SSH 1514 Server: Encrypted packet (len=1448)
  416 7.063363750 192.168.1.12 → 10.6.15.156  TCP 66 54766 → 22 [ACK] Seq=12561 Ack=197689 Win=4866 Len=0 TSval=7829270 TSecr=14760766
  417 7.063535876  10.6.15.156 → 192.168.1.12 SSH 1514 Server: Encrypted packet (len=1448)
  418 7.063542287  10.6.15.156 → 192.168.1.12 SSH 1514 Server: Encrypted packet (len=1448)
  419 7.063546714 192.168.1.12 → 10.6.15.156  TCP 66 54766 → 22 [ACK] Seq=12561 Ack=200585 Win=4866 Len=0 TSval=7829271 TSecr=14760766
  420 7.063552030  10.6.15.156 → 192.168.1.12 SSH 1514 Server: Encrypted packet (len=1448)
  421 7.063553839  10.6.15.156 → 192.168.1.12 SSH 1514 Server: Encrypted packet (len=1448)
  422 7.063556091 192.168.1.12 → 10.6.15.156  TCP 66 54766 → 22 [ACK] Seq=12561 Ack=203481 Win=4866 Len=0 TSval=7829271 TSecr=14760766
  423 7.063880454  10.6.15.156 → 192.168.1.12 SSH 1514 Server: Encrypted packet (len=1448)
  424 7.064069446  10.6.15.156 → 192.168.1.12 SSH 1514 Server: Encrypted packet (len=1448)
  425 7.064076150 192.168.1.12 → 10.6.15.156  TCP 66 54766 → 22 [ACK] Seq=12561 Ack=206377 Win=4866 Len=0 TSval=7829271 TSecr=14760766
  426 7.067489233  10.6.15.156 → 192.168.1.12 SSH 1514 Server: Encrypted packet (len=1448)
  427 7.067670981  10.6.15.156 → 192.168.1.12 SSH 1514 Server: Encrypted packet (len=1448)
  428 7.067681749 192.168.1.12 → 10.6.15.156  TCP 66 54766 → 22 [ACK] Seq=12561 Ack=209273 Win=4866 Len=0 TSval=7829272 TSecr=14760768
  429 7.067862028  10.6.15.156 → 192.168.1.12 SSH 1514 Server: Encrypted packet (len=1448)
  430 7.068052837  10.6.15.156 → 192.168.1.12 SSH 1514 Server: Encrypted packet (len=1448)
  431 7.068058862 192.168.1.12 → 10.6.15.156  TCP 66 54766 → 22 [ACK] Seq=12561 Ack=212169 Win=4866 Len=0 TSval=7829272 TSecr=14760768
  432 7.068211926 192.168.1.12 → 10.6.15.156  SSH 102 Client: Encrypted packet (len=36)
  433 7.068251650  10.6.15.156 → 192.168.1.12 SSH 1514 Server: Encrypted packet (len=1448)
  434 7.068437526  10.6.15.156 → 192.168.1.12 SSH 1514 Server: Encrypted packet (len=1448)
  435 7.068443651 192.168.1.12 → 10.6.15.156  TCP 66 54766 → 22 [ACK] Seq=12597 Ack=215065 Win=4866 Len=0 TSval=7829272 TSecr=14760768
  436 7.068785427  10.6.15.156 → 192.168.1.12 SSH 1514 Server: Encrypted packet (len=1448)
  437 7.068973896  10.6.15.156 → 192.168.1.12 SSH 1514 Server: Encrypted packet (len=1448)
  438 7.068982412 192.168.1.12 → 10.6.15.156  TCP 66 54766 → 22 [ACK] Seq=12597 Ack=217961 Win=4866 Len=0 TSval=7829272 TSecr=14760768
  439 7.071553140  10.6.15.156 → 192.168.1.12 SSH 1514 Server: Encrypted packet (len=1448)
  440 7.071734431  10.6.15.156 → 192.168.1.12 SSH 1514 Server: Encrypted packet (len=1448)
  441 7.071743019 192.168.1.12 → 10.6.15.156  TCP 66 54766 → 22 [ACK] Seq=12597 Ack=220857 Win=4866 Len=0 TSval=7829273 TSecr=14760769
  442 7.071924686  10.6.15.156 → 192.168.1.12 SSH 1514 Server: Encrypted packet (len=1448)
  443 7.072116131  10.6.15.156 → 192.168.1.12 SSH 1514 Server: Encrypted packet (len=1448)
  444 7.072118847 192.168.1.12 → 10.6.15.156  TCP 66 54766 → 22 [ACK] Seq=12597 Ack=223753 Win=4866 Len=0 TSval=7829273 TSecr=14760769
  445 7.072309232  10.6.15.156 → 192.168.1.12 SSH 1514 Server: Encrypted packet (len=1448)
  446 7.072653790  10.6.15.156 → 192.168.1.12 SSH 1514 Server: Encrypted packet (len=1448)
  447 7.072657273 192.168.1.12 → 10.6.15.156  TCP 66 54766 → 22 [ACK] Seq=12597 Ack=226649 Win=4866 Len=0 TSval=7829273 TSecr=14760769
  448 7.072845208  10.6.15.156 → 192.168.1.12 SSH 1514 Server: Encrypted packet (len=1448)
  449 7.076307815  10.6.15.156 → 192.168.1.12 SSH 1514 Server: Encrypted packet (len=1448)
  450 7.076320518 192.168.1.12 → 10.6.15.156  TCP 66 54766 → 22 [ACK] Seq=12597 Ack=229545 Win=4866 Len=0 TSval=7829274 TSecr=14760769
  451 7.076651296  10.6.15.156 → 192.168.1.12 SSH 1514 Server: Encrypted packet (len=1448)
  452 7.076843931  10.6.15.156 → 192.168.1.12 SSH 1514 Server: Encrypted packet (len=1448)
  453 7.076849157 192.168.1.12 → 10.6.15.156  TCP 66 54766 → 22 [ACK] Seq=12597 Ack=232441 Win=4866 Len=0 TSval=7829274 TSecr=14760770
  454 7.077036237  10.6.15.156 → 192.168.1.12 SSH 1514 Server: Encrypted packet (len=1448)
  455 7.077226368  10.6.15.156 → 192.168.1.12 SSH 1514 Server: Encrypted packet (len=1448)
  456 7.077230811 192.168.1.12 → 10.6.15.156  TCP 66 54766 → 22 [ACK] Seq=12597 Ack=235337 Win=4866 Len=0 TSval=7829274 TSecr=14760770
  457 7.077418157  10.6.15.156 → 192.168.1.12 SSH 1514 Server: Encrypted packet (len=1448)
  458 7.077609514  10.6.15.156 → 192.168.1.12 SSH 1514 Server: Encrypted packet (len=1448)
  459 7.077613572 192.168.1.12 → 10.6.15.156  TCP 66 54766 → 22 [ACK] Seq=12597 Ack=238233 Win=4866 Len=0 TSval=7829274 TSecr=14760770
  460 7.080122684  10.6.15.156 → 192.168.1.12 SSH 1514 Server: Encrypted packet (len=1448)
  461 7.080310645  10.6.15.156 → 192.168.1.12 SSH 1514 Server: Encrypted packet (len=1448)
  462 7.080316372 192.168.1.12 → 10.6.15.156  TCP 66 54766 → 22 [ACK] Seq=12597 Ack=241129 Win=4866 Len=0 TSval=7829275 TSecr=14760771
  463 7.080502128  10.6.15.156 → 192.168.1.12 SSH 1514 Server: Encrypted packet (len=1448)
  464 7.080694137  10.6.15.156 → 192.168.1.12 SSH 1514 Server: Encrypted packet (len=1448)
  465 7.080698545 192.168.1.12 → 10.6.15.156  TCP 66 54766 → 22 [ACK] Seq=12597 Ack=244025 Win=4866 Len=0 TSval=7829275 TSecr=14760771
  466 7.080887168  10.6.15.156 → 192.168.1.12 SSH 1514 Server: Encrypted packet (len=1448)
  467 7.081078559  10.6.15.156 → 192.168.1.12 SSH 1514 Server: Encrypted packet (len=1448)
  468 7.081083971 192.168.1.12 → 10.6.15.156  TCP 66 54766 → 22 [ACK] Seq=12597 Ack=246921 Win=4866 Len=0 TSval=7829275 TSecr=14760771
  469 7.081422206  10.6.15.156 → 192.168.1.12 SSH 1514 Server: Encrypted packet (len=1448)
  470 7.081612333  10.6.15.156 → 192.168.1.12 SSH 1514 Server: Encrypted packet (len=1448)
  471 7.081617112 192.168.1.12 → 10.6.15.156  TCP 66 54766 → 22 [ACK] Seq=12597 Ack=249817 Win=4866 Len=0 TSval=7829275 TSecr=14760771
  472 7.083746986  10.6.15.156 → 192.168.1.12 SSH 1514 Server: Encrypted packet (len=1448)
  473 7.083940480  10.6.15.156 → 192.168.1.12 SSH 1514 Server: Encrypted packet (len=1448)
  474 7.083948299 192.168.1.12 → 10.6.15.156  TCP 66 54766 → 22 [ACK] Seq=12597 Ack=252713 Win=4866 Len=0 TSval=7829276 TSecr=14760772
  475 7.084273831  10.6.15.156 → 192.168.1.12 SSH 1514 Server: Encrypted packet (len=1448)
  476 7.084466247  10.6.15.156 → 192.168.1.12 SSH 1514 Server: Encrypted packet (len=1448)
  477 7.084471710 192.168.1.12 → 10.6.15.156  TCP 66 54766 → 22 [ACK] Seq=12597 Ack=255609 Win=4866 Len=0 TSval=7829276 TSecr=14760772
  478 7.084656157  10.6.15.156 → 192.168.1.12 SSH 1514 Server: Encrypted packet (len=1448)
  479 7.091046827  10.6.15.156 → 192.168.1.12 SSH 1514 Server: Encrypted packet (len=1448)
  480 7.091058998 192.168.1.12 → 10.6.15.156  TCP 66 54766 → 22 [ACK] Seq=12597 Ack=258505 Win=4866 Len=0 TSval=7829277 TSecr=14760772
  481 7.091405723  10.6.15.156 → 192.168.1.12 SSH 1514 Server: Encrypted packet (len=1448)
  482 7.091584705  10.6.15.156 → 192.168.1.12 SSH 1514 Server: Encrypted packet (len=1448)
  483 7.091590626 192.168.1.12 → 10.6.15.156  TCP 66 54766 → 22 [ACK] Seq=12597 Ack=261401 Win=4866 Len=0 TSval=7829278 TSecr=14760772
  484 7.091775247  10.6.15.156 → 192.168.1.12 SSH 1514 Server: Encrypted packet (len=1448)
  485 7.092120554  10.6.15.156 → 192.168.1.12 SSH 1514 Server: Encrypted packet (len=1448)
  486 7.092125562 192.168.1.12 → 10.6.15.156  TCP 66 54766 → 22 [ACK] Seq=12597 Ack=264297 Win=4866 Len=0 TSval=7829278 TSecr=14760772
  487 7.092310790  10.6.15.156 → 192.168.1.12 SSH 1514 Server: Encrypted packet (len=1448)
  488 7.092658018  10.6.15.156 → 192.168.1.12 SSH 1514 Server: Encrypted packet (len=1448)
  489 7.092663880 192.168.1.12 → 10.6.15.156  TCP 66 54766 → 22 [ACK] Seq=12597 Ack=267193 Win=4866 Len=0 TSval=7829278 TSecr=14760774
  490 7.092848216  10.6.15.156 → 192.168.1.12 SSH 1514 Server: Encrypted packet (len=1448)
  491 7.095674378  10.6.15.156 → 192.168.1.12 SSH 1514 Server: Encrypted packet (len=1448)
  492 7.095683872 192.168.1.12 → 10.6.15.156  TCP 66 54766 → 22 [ACK] Seq=12597 Ack=270089 Win=4866 Len=0 TSval=7829279 TSecr=14760774
  493 7.095863020  10.6.15.156 → 192.168.1.12 SSH 1514 Server: Encrypted packet (len=1448)
  494 7.096055106  10.6.15.156 → 192.168.1.12 SSH 1514 Server: Encrypted packet (len=1448)
  495 7.096059891 192.168.1.12 → 10.6.15.156  TCP 66 54766 → 22 [ACK] Seq=12597 Ack=272985 Win=4866 Len=0 TSval=7829279 TSecr=14760775
  496 7.096247207  10.6.15.156 → 192.168.1.12 SSH 1514 Server: Encrypted packet (len=1448)
  497 7.096439466  10.6.15.156 → 192.168.1.12 SSH 1514 Server: Encrypted packet (len=1448)
  498 7.096444371 192.168.1.12 → 10.6.15.156  TCP 66 54766 → 22 [ACK] Seq=12597 Ack=275881 Win=4866 Len=0 TSval=7829279 TSecr=14760775
  499 7.096974650  10.6.15.156 → 192.168.1.12 SSH 1514 Server: Encrypted packet (len=1448)
  500 7.097297945  10.6.15.156 → 192.168.1.12 SSH 1514 Server: Encrypted packet (len=1448)
  501 7.097303224 192.168.1.12 → 10.6.15.156  TCP 66 54766 → 22 [ACK] Seq=12597 Ack=278777 Win=4866 Len=0 TSval=7829279 TSecr=14760775
  502 7.097489025  10.6.15.156 → 192.168.1.12 SSH 1514 Server: Encrypted packet (len=1448)
  503 7.100025303  10.6.15.156 → 192.168.1.12 SSH 1514 Server: Encrypted packet (len=1448)
  504 7.100033111 192.168.1.12 → 10.6.15.156  TCP 66 54766 → 22 [ACK] Seq=12597 Ack=281673 Win=4866 Len=0 TSval=7829280 TSecr=14760775
  505 7.100215938  10.6.15.156 → 192.168.1.12 SSH 1514 Server: Encrypted packet (len=1448)
  506 7.100406472  10.6.15.156 → 192.168.1.12 SSH 1514 Server: Encrypted packet (len=1448)
  507 7.100413252 192.168.1.12 → 10.6.15.156  TCP 66 54766 → 22 [ACK] Seq=12597 Ack=284569 Win=4866 Len=0 TSval=7829280 TSecr=14760776
  508 7.100598918  10.6.15.156 → 192.168.1.12 SSH 1514 Server: Encrypted packet (len=1448)
  509 7.100789590  10.6.15.156 → 192.168.1.12 SSH 1514 Server: Encrypted packet (len=1448)
  510 7.100795864 192.168.1.12 → 10.6.15.156  TCP 66 54766 → 22 [ACK] Seq=12597 Ack=287465 Win=4866 Len=0 TSval=7829280 TSecr=14760776
  511 7.100982348  10.6.15.156 → 192.168.1.12 SSH 1514 Server: Encrypted packet (len=1448)
  512 7.101333069  10.6.15.156 → 192.168.1.12 SSH 1514 Server: Encrypted packet (len=1448)
  513 7.101341746 192.168.1.12 → 10.6.15.156  TCP 66 54766 → 22 [ACK] Seq=12597 Ack=290361 Win=4866 Len=0 TSval=7829280 TSecr=14760776
  514 7.101520292  10.6.15.156 → 192.168.1.12 SSH 1514 Server: Encrypted packet (len=1448)
  515 7.104032012  10.6.15.156 → 192.168.1.12 SSH 1514 Server: Encrypted packet (len=1448)
  516 7.104048837 192.168.1.12 → 10.6.15.156  TCP 66 54766 → 22 [ACK] Seq=12597 Ack=293257 Win=4866 Len=0 TSval=7829281 TSecr=14760776
  517 7.104215015  10.6.15.156 → 192.168.1.12 SSH 1514 Server: Encrypted packet (len=1448)
  518 7.104406388  10.6.15.156 → 192.168.1.12 SSH 1514 Server: Encrypted packet (len=1448)
  519 7.104411102 192.168.1.12 → 10.6.15.156  TCP 66 54766 → 22 [ACK] Seq=12597 Ack=296153 Win=4866 Len=0 TSval=7829281 TSecr=14760777
  520 7.104598404  10.6.15.156 → 192.168.1.12 SSH 1514 Server: Encrypted packet (len=1448)
  521 7.104790068  10.6.15.156 → 192.168.1.12 SSH 1514 Server: Encrypted packet (len=1448)
  522 7.104794592 192.168.1.12 → 10.6.15.156  TCP 66 54766 → 22 [ACK] Seq=12597 Ack=299049 Win=4866 Len=0 TSval=7829281 TSecr=14760777
  523 7.104983317  10.6.15.156 → 192.168.1.12 SSH 1514 Server: Encrypted packet (len=1448)
  524 7.105329299  10.6.15.156 → 192.168.1.12 SSH 1514 Server: Encrypted packet (len=1448)
  525 7.105335261 192.168.1.12 → 10.6.15.156  TCP 66 54766 → 22 [ACK] Seq=12597 Ack=301945 Win=4866 Len=0 TSval=7829281 TSecr=14760777
  526 7.105520225  10.6.15.156 → 192.168.1.12 SSH 1514 Server: Encrypted packet (len=1448)
  527 7.109573242  10.6.15.156 → 192.168.1.12 SSH 1514 Server: Encrypted packet (len=1448)
  528 7.109584781 192.168.1.12 → 10.6.15.156  TCP 66 54766 → 22 [ACK] Seq=12597 Ack=304841 Win=4866 Len=0 TSval=7829282 TSecr=14760777
  529 7.109755187  10.6.15.156 → 192.168.1.12 SSH 1514 Server: Encrypted packet (len=1448)
  530 7.109946417  10.6.15.156 → 192.168.1.12 SSH 1514 Server: Encrypted packet (len=1448)
  531 7.109950181 192.168.1.12 → 10.6.15.156  TCP 66 54766 → 22 [ACK] Seq=12597 Ack=307737 Win=4866 Len=0 TSval=7829282 TSecr=14760778
  532 7.111250457  10.6.15.156 → 192.168.1.12 SSH 1514 Server: Encrypted packet (len=1448)
  533 7.111416740  10.6.15.156 → 192.168.1.12 SSH 1514 Server: Encrypted packet (len=1448)
  534 7.111420749 192.168.1.12 → 10.6.15.156  TCP 66 54766 → 22 [ACK] Seq=12597 Ack=310633 Win=4866 Len=0 TSval=7829283 TSecr=14760778
  535 7.111426888  10.6.15.156 → 192.168.1.12 SSH 1514 Server: Encrypted packet (len=1448)
  536 7.111429364  10.6.15.156 → 192.168.1.12 SSH 1514 Server: Encrypted packet (len=1448)
  537 7.111431140 192.168.1.12 → 10.6.15.156  TCP 66 54766 → 22 [ACK] Seq=12597 Ack=313529 Win=4866 Len=0 TSval=7829283 TSecr=14760778
  538 7.111433276  10.6.15.156 → 192.168.1.12 SSH 1514 Server: Encrypted packet (len=1448)
  539 7.111521079 192.168.1.12 → 10.6.15.156  SSH 102 Client: Encrypted packet (len=36)
  540 7.115225254  10.6.15.156 → 192.168.1.12 SSH 1514 Server: Encrypted packet (len=1448)
  541 7.115409996  10.6.15.156 → 192.168.1.12 SSH 1514 Server: Encrypted packet (len=1448)
  542 7.115414724 192.168.1.12 → 10.6.15.156  TCP 66 54766 → 22 [ACK] Seq=12633 Ack=317873 Win=4866 Len=0 TSval=7829284 TSecr=14760779
  543 7.115420548  10.6.15.156 → 192.168.1.12 SSH 1514 Server: Encrypted packet (len=1448)
  544 7.115422742  10.6.15.156 → 192.168.1.12 SSH 1514 Server: Encrypted packet (len=1448)
  545 7.115424787 192.168.1.12 → 10.6.15.156  TCP 66 54766 → 22 [ACK] Seq=12633 Ack=320769 Win=4866 Len=0 TSval=7829284 TSecr=14760779
  546 7.115427172  10.6.15.156 → 192.168.1.12 SSH 1514 Server: Encrypted packet (len=1448)
  547 7.115428878  10.6.15.156 → 192.168.1.12 SSH 1514 Server: Encrypted packet (len=1448)
  548 7.115431077 192.168.1.12 → 10.6.15.156  TCP 66 54766 → 22 [ACK] Seq=12633 Ack=323665 Win=4866 Len=0 TSval=7829284 TSecr=14760779
  549 7.115787172  10.6.15.156 → 192.168.1.12 SSH 1514 Server: Encrypted packet (len=1448)
  550 7.115977245  10.6.15.156 → 192.168.1.12 SSH 1514 Server: Encrypted packet (len=1448)
  551 7.115984031 192.168.1.12 → 10.6.15.156  TCP 66 54766 → 22 [ACK] Seq=12633 Ack=326561 Win=4866 Len=0 TSval=7829284 TSecr=14760779
  552 7.116170731  10.6.15.156 → 192.168.1.12 SSH 1514 Server: Encrypted packet (len=1448)
  553 7.118647274  10.6.15.156 → 192.168.1.12 SSH 1514 Server: Encrypted packet (len=1448)
  554 7.118654449 192.168.1.12 → 10.6.15.156  TCP 66 54766 → 22 [ACK] Seq=12633 Ack=329457 Win=4866 Len=0 TSval=7829284 TSecr=14760779
  555 7.118831447  10.6.15.156 → 192.168.1.12 SSH 1514 Server: Encrypted packet (len=1448)
  556 7.119025159  10.6.15.156 → 192.168.1.12 SSH 1514 Server: Encrypted packet (len=1448)
  557 7.119028769 192.168.1.12 → 10.6.15.156  TCP 66 54766 → 22 [ACK] Seq=12633 Ack=332353 Win=4866 Len=0 TSval=7829284 TSecr=14760781
  558 7.119188631  10.6.15.156 → 192.168.1.12 SSH 1514 Server: Encrypted packet (len=1448)
  559 7.119380756  10.6.15.156 → 192.168.1.12 SSH 1514 Server: Encrypted packet (len=1448)
  560 7.119385631 192.168.1.12 → 10.6.15.156  TCP 66 54766 → 22 [ACK] Seq=12633 Ack=335249 Win=4866 Len=0 TSval=7829284 TSecr=14760781
  561 7.119729506  10.6.15.156 → 192.168.1.12 SSH 1514 Server: Encrypted packet (len=1448)
  562 7.119919585  10.6.15.156 → 192.168.1.12 SSH 1514 Server: Encrypted packet (len=1448)
  563 7.119927778 192.168.1.12 → 10.6.15.156  TCP 66 54766 → 22 [ACK] Seq=12633 Ack=338145 Win=4866 Len=0 TSval=7829285 TSecr=14760781
  564 7.120110526  10.6.15.156 → 192.168.1.12 SSH 1514 Server: Encrypted packet (len=1448)
  565 7.120306276  10.6.15.156 → 192.168.1.12 SSH 1514 Server: Encrypted packet (len=1448)
  566 7.120315632 192.168.1.12 → 10.6.15.156  TCP 66 54766 → 22 [ACK] Seq=12633 Ack=341041 Win=4866 Len=0 TSval=7829285 TSecr=14760781
  567 7.122870880  10.6.15.156 → 192.168.1.12 SSH 1514 Server: Encrypted packet (len=1448)
  568 7.123056768  10.6.15.156 → 192.168.1.12 SSH 1514 Server: Encrypted packet (len=1448)
  569 7.123064207 192.168.1.12 → 10.6.15.156  TCP 66 54766 → 22 [ACK] Seq=12633 Ack=343937 Win=4866 Len=0 TSval=7829285 TSecr=14760782
  570 7.123222965  10.6.15.156 → 192.168.1.12 SSH 1514 Server: Encrypted packet (len=1448)
  571 7.123418160  10.6.15.156 → 192.168.1.12 SSH 1514 Server: Encrypted packet (len=1448)
  572 7.123422944 192.168.1.12 → 10.6.15.156  TCP 66 54766 → 22 [ACK] Seq=12633 Ack=346833 Win=4866 Len=0 TSval=7829286 TSecr=14760782
  573 7.123638025  10.6.15.156 → 192.168.1.12 SSH 1514 Server: Encrypted packet (len=1448)
  574 7.123832804  10.6.15.156 → 192.168.1.12 SSH 1514 Server: Encrypted packet (len=1448)
  575 7.123839631 192.168.1.12 → 10.6.15.156  TCP 66 54766 → 22 [ACK] Seq=12633 Ack=349729 Win=4866 Len=0 TSval=7829286 TSecr=14760782
  576 7.124175489  10.6.15.156 → 192.168.1.12 SSH 1514 Server: Encrypted packet (len=1448)
  577 7.124362240  10.6.15.156 → 192.168.1.12 SSH 1514 Server: Encrypted packet (len=1448)
  578 7.124366754 192.168.1.12 → 10.6.15.156  TCP 66 54766 → 22 [ACK] Seq=12633 Ack=352625 Win=4866 Len=0 TSval=7829286 TSecr=14760782
  579 7.124529313  10.6.15.156 → 192.168.1.12 SSH 1514 Server: Encrypted packet (len=1448)
  580 7.124726963  10.6.15.156 → 192.168.1.12 SSH 1514 Server: Encrypted packet (len=1448)
  581 7.124730823 192.168.1.12 → 10.6.15.156  TCP 66 54766 → 22 [ACK] Seq=12633 Ack=355521 Win=4866 Len=0 TSval=7829286 TSecr=14760782
  582 7.124928674  10.6.15.156 → 192.168.1.12 SSH 1514 Server: Encrypted packet (len=1448)
  583 7.127580059  10.6.15.156 → 192.168.1.12 SSH 1514 Server: Encrypted packet (len=1448)
  584 7.127591532 192.168.1.12 → 10.6.15.156  TCP 66 54766 → 22 [ACK] Seq=12633 Ack=358417 Win=4866 Len=0 TSval=7829287 TSecr=14760782
  585 7.127746245  10.6.15.156 → 192.168.1.12 SSH 1514 Server: Encrypted packet (len=1448)
  586 7.127954508  10.6.15.156 → 192.168.1.12 SSH 1514 Server: Encrypted packet (len=1448)
  587 7.127959669 192.168.1.12 → 10.6.15.156  TCP 66 54766 → 22 [ACK] Seq=12633 Ack=361313 Win=4866 Len=0 TSval=7829287 TSecr=14760783
  588 7.128139252  10.6.15.156 → 192.168.1.12 SSH 1514 Server: Encrypted packet (len=1448)
  589 7.128336951  10.6.15.156 → 192.168.1.12 SSH 1514 Server: Encrypted packet (len=1448)
  590 7.128339921 192.168.1.12 → 10.6.15.156  TCP 66 54766 → 22 [ACK] Seq=12633 Ack=364209 Win=4866 Len=0 TSval=7829287 TSecr=14760783
  591 7.132477007  10.6.15.156 → 192.168.1.12 SSH 1514 Server: Encrypted packet (len=1448)
  592 7.132819829  10.6.15.156 → 192.168.1.12 SSH 1514 Server: Encrypted packet (len=1448)
  593 7.132827166 192.168.1.12 → 10.6.15.156  TCP 66 54766 → 22 [ACK] Seq=12633 Ack=367105 Win=4866 Len=0 TSval=7829288 TSecr=14760783
  594 7.132983151  10.6.15.156 → 192.168.1.12 SSH 1514 Server: Encrypted packet (len=1448)
  595 7.133202687  10.6.15.156 → 192.168.1.12 SSH 1514 Server: Encrypted packet (len=1448)
  596 7.133205817 192.168.1.12 → 10.6.15.156  TCP 66 54766 → 22 [ACK] Seq=12633 Ack=370001 Win=4866 Len=0 TSval=7829288 TSecr=14760783
  597 7.133323766  10.6.15.156 → 192.168.1.12 SSH 1202 Server: Encrypted packet (len=1136)
  598 7.175407206 192.168.1.12 → 10.6.15.156  TCP 66 54766 → 22 [ACK] Seq=12633 Ack=371137 Win=4866 Len=0 TSval=7829299 TSecr=14760783
  599 7.255070168  10.6.15.156 → 192.168.1.12 SSH 1514 Server: Encrypted packet (len=1448)
  600 7.255093215  10.6.15.156 → 192.168.1.12 SSH 110 Server: Encrypted packet (len=44)
  601 7.255103278 192.168.1.12 → 10.6.15.156  TCP 66 54766 → 22 [ACK] Seq=12633 Ack=372629 Win=4866 Len=0 TSval=7829318 TSecr=14760815
  602 7.257695058  10.6.15.156 → 192.168.1.12 SSH 1514 Server: Encrypted packet (len=1448)
  603 7.257718006  10.6.15.156 → 192.168.1.12 SSH 110 Server: Encrypted packet (len=44)
  604 7.257726209 192.168.1.12 → 10.6.15.156  TCP 66 54766 → 22 [ACK] Seq=12633 Ack=374121 Win=4866 Len=0 TSval=7829319 TSecr=14760815
  605 7.260575582  10.6.15.156 → 192.168.1.12 SSH 1514 Server: Encrypted packet (len=1448)
  606 7.260699642  10.6.15.156 → 192.168.1.12 SSH 1514 Server: Encrypted packet (len=1448)
  607 7.260710352 192.168.1.12 → 10.6.15.156  TCP 66 54766 → 22 [ACK] Seq=12633 Ack=377017 Win=4866 Len=0 TSval=7829320 TSecr=14760816
  608 7.260835404  10.6.15.156 → 192.168.1.12 SSH 110 Server: Encrypted packet (len=44)
  609 7.260867025 192.168.1.12 → 10.6.15.156  TCP 66 54766 → 22 [ACK] Seq=12633 Ack=377061 Win=4866 Len=0 TSval=7829320 TSecr=14760816
  610 7.263002825  10.6.15.156 → 192.168.1.12 SSH 1514 Server: Encrypted packet (len=1448)
  611 7.263127427  10.6.15.156 → 192.168.1.12 SSH 1514 Server: Encrypted packet (len=1448)
  612 7.263136492 192.168.1.12 → 10.6.15.156  TCP 66 54766 → 22 [ACK] Seq=12633 Ack=379957 Win=4866 Len=0 TSval=7829320 TSecr=14760817
  613 7.263916577  10.6.15.156 → 192.168.1.12 SSH 110 Server: Encrypted packet (len=44)
  614 7.264027014 192.168.1.12 → 10.6.15.156  TCP 66 54766 → 22 [ACK] Seq=12633 Ack=380001 Win=4866 Len=0 TSval=7829321 TSecr=14760817
  615 7.264092398  10.6.15.156 → 192.168.1.12 SSH 1514 Server: Encrypted packet (len=1448)
  616 7.264301944  10.6.15.156 → 192.168.1.12 SSH 1514 Server: Encrypted packet (len=1448)
  617 7.264314767 192.168.1.12 → 10.6.15.156  TCP 66 54766 → 22 [ACK] Seq=12633 Ack=382897 Win=4866 Len=0 TSval=7829321 TSecr=14760817
  618 7.266022151  10.6.15.156 → 192.168.1.12 SSH 110 Server: Encrypted packet (len=44)
  619 7.266130429 192.168.1.12 → 10.6.15.156  TCP 66 54766 → 22 [ACK] Seq=12633 Ack=382941 Win=4866 Len=0 TSval=7829321 TSecr=14760817
  620 7.266223498  10.6.15.156 → 192.168.1.12 SSH 1514 Server: Encrypted packet (len=1448)
  621 7.266440159  10.6.15.156 → 192.168.1.12 SSH 1514 Server: Encrypted packet (len=1448)
  622 7.266446277 192.168.1.12 → 10.6.15.156  TCP 66 54766 → 22 [ACK] Seq=12633 Ack=385837 Win=4866 Len=0 TSval=7829321 TSecr=14760817
  623 7.266751876  10.6.15.156 → 192.168.1.12 SSH 1514 Server: Encrypted packet (len=1448)
  624 7.266757558  10.6.15.156 → 192.168.1.12 SSH 110 Server: Encrypted packet (len=44)
  625 7.266760442 192.168.1.12 → 10.6.15.156  TCP 66 54766 → 22 [ACK] Seq=12633 Ack=387329 Win=4866 Len=0 TSval=7829321 TSecr=14760817
  626 7.266965218  10.6.15.156 → 192.168.1.12 SSH 1514 Server: Encrypted packet (len=1448)
  627 7.267156835  10.6.15.156 → 192.168.1.12 SSH 1514 Server: Encrypted packet (len=1448)
  628 7.267163611 192.168.1.12 → 10.6.15.156  TCP 66 54766 → 22 [ACK] Seq=12633 Ack=390225 Win=4866 Len=0 TSval=7829321 TSecr=14760818
  629 7.267502429  10.6.15.156 → 192.168.1.12 SSH 1514 Server: Encrypted packet (len=1448)
  630 7.267691403  10.6.15.156 → 192.168.1.12 SSH 1514 Server: Encrypted packet (len=1448)
  631 7.267699990 192.168.1.12 → 10.6.15.156  TCP 66 54766 → 22 [ACK] Seq=12633 Ack=393121 Win=4866 Len=0 TSval=7829322 TSecr=14760818
  632 7.267711027  10.6.15.156 → 192.168.1.12 SSH 110 Server: Encrypted packet (len=44)
  633 7.267736397 192.168.1.12 → 10.6.15.156  TCP 66 54766 → 22 [ACK] Seq=12633 Ack=393165 Win=4866 Len=0 TSval=7829322 TSecr=14760818
  634 7.269978245  10.6.15.156 → 192.168.1.12 SSH 1514 Server: Encrypted packet (len=1448)
  635 7.270158294  10.6.15.156 → 192.168.1.12 SSH 1514 Server: Encrypted packet (len=1448)
  636 7.270165961 192.168.1.12 → 10.6.15.156  TCP 66 54766 → 22 [ACK] Seq=12633 Ack=396061 Win=4866 Len=0 TSval=7829322 TSecr=14760818
  637 7.270348512  10.6.15.156 → 192.168.1.12 SSH 1514 Server: Encrypted packet (len=1448)
  638 7.270545312  10.6.15.156 → 192.168.1.12 SSH 1514 Server: Encrypted packet (len=1448)
  639 7.270548165 192.168.1.12 → 10.6.15.156  TCP 66 54766 → 22 [ACK] Seq=12633 Ack=398957 Win=4866 Len=0 TSval=7829322 TSecr=14760818
  640 7.270744380  10.6.15.156 → 192.168.1.12 SSH 1514 Server: Encrypted packet (len=1448)
  641 7.270924124  10.6.15.156 → 192.168.1.12 SSH 1514 Server: Encrypted packet (len=1448)
  642 7.270928602 192.168.1.12 → 10.6.15.156  TCP 66 54766 → 22 [ACK] Seq=12633 Ack=401853 Win=4866 Len=0 TSval=7829322 TSecr=14760818
  643 7.271121381  10.6.15.156 → 192.168.1.12 SSH 1514 Server: Encrypted packet (len=1448)
  644 7.271442238  10.6.15.156 → 192.168.1.12 SSH 1514 Server: Encrypted packet (len=1448)
  645 7.271445564 192.168.1.12 → 10.6.15.156  TCP 66 54766 → 22 [ACK] Seq=12633 Ack=404749 Win=4866 Len=0 TSval=7829323 TSecr=14760818
  646 7.271657168  10.6.15.156 → 192.168.1.12 SSH 1514 Server: Encrypted packet (len=1448)
  647 7.271848685  10.6.15.156 → 192.168.1.12 SSH 1514 Server: Encrypted packet (len=1448)
  648 7.271851233 192.168.1.12 → 10.6.15.156  TCP 66 54766 → 22 [ACK] Seq=12633 Ack=407645 Win=4866 Len=0 TSval=7829323 TSecr=14760818
  649 7.272018690  10.6.15.156 → 192.168.1.12 SSH 1366 Server: Encrypted packet (len=1300)
  650 7.272069076 192.168.1.12 → 10.6.15.156  TCP 66 54766 → 22 [ACK] Seq=12633 Ack=408945 Win=4866 Len=0 TSval=7829323 TSecr=14760818
  651 7.450797228 10.22.17.139 → 224.0.0.252  LLMNR 68 Standard query 0xce88 A hdiyhqfo
  652 7.878266782 10.22.17.139 → 224.0.0.252  LLMNR 68 Standard query 0xce88 A hdiyhqfo
  653 8.074883308 192.168.1.12 → 192.168.1.1  DNS 74 Standard query 0x1252 A ntp.ubuntu.com
  654 8.077392028  192.168.1.1 → 192.168.1.12 DNS 138 Standard query response 0x1252 A ntp.ubuntu.com A 91.189.94.4 A 91.189.89.199 A 91.189.91.157 A 91.189.89.198
  655 8.077843131 192.168.1.12 → 91.189.94.4  NTP 90 NTP Version 4, client
  656 8.995005817 192.168.1.12 → 10.6.15.156  SSH 862 Client: Encrypted packet (len=796)
  657 9.034857755  10.6.15.156 → 192.168.1.12 TCP 66 22 → 54766 [ACK] Seq=408945 Ack=13429 Win=1452 Len=0 TSval=14761260 TSecr=7829753
  658 9.034876932 192.168.1.12 → 10.6.15.156  SSH 862 Client: Encrypted packet (len=796)
  659 9.037480764  10.6.15.156 → 192.168.1.12 TCP 66 22 → 54766 [ACK] Seq=408945 Ack=14225 Win=1452 Len=0 TSval=14761260 TSecr=7829763
  660 9.214079579  10.6.15.156 → 192.168.1.12 SSH 454 Server: Encrypted packet (len=388)
  661 9.214098248 192.168.1.12 → 10.6.15.156  TCP 66 54766 → 22 [ACK] Seq=14225 Ack=409333 Win=4866 Len=0 TSval=7829808 TSecr=14761305
  662 9.251038708  10.6.15.156 → 192.168.1.12 SSH 454 Server: Encrypted packet (len=388)
  663 9.251063749 192.168.1.12 → 10.6.15.156  TCP 66 54766 → 22 [ACK] Seq=14225 Ack=409721 Win=4866 Len=0 TSval=7829817 TSecr=14761314
  664 9.458264705 10.22.17.139 → 224.0.0.252  LLMNR 72 Standard query 0x8e01 A lpyqwahkmged
  665 9.459121981 10.22.17.139 → 224.0.0.252  LLMNR 67 Standard query 0xc6fc A zwsunnx
  666 9.873746015 10.22.17.139 → 224.0.0.252  LLMNR 67 Standard query 0xc6fc A zwsunnx
  667 9.873769264 10.22.17.139 → 224.0.0.252  LLMNR 72 Standard query 0x8e01 A lpyqwahkmged
  668 10.002591480 192.168.1.12 → 10.6.15.156  SSH 862 Client: Encrypted packet (len=796)
  669 10.005325654  10.6.15.156 → 192.168.1.12 TCP 66 22 → 54766 [ACK] Seq=409721 Ack=15021 Win=1452 Len=0 TSval=14761502 TSecr=7830005
  670 10.219527237  10.6.15.156 → 192.168.1.12 SSH 454 Server: Encrypted packet (len=388)
  671 10.219551860 192.168.1.12 → 10.6.15.156  TCP 66 54766 → 22 [ACK] Seq=15021 Ack=410109 Win=4866 Len=0 TSval=7830060 TSecr=14761556
  672 10.256944863 192.168.1.12 → 10.6.15.156  SSH 1514 Client: Encrypted packet (len=1448)
  673 10.263647593  10.6.15.156 → 192.168.1.12 TCP 66 22 → 54766 [ACK] Seq=410109 Ack=16469 Win=1452 Len=0 TSval=14761567 TSecr=7830069
  674 10.263666585 192.168.1.12 → 10.6.15.156  SSH 646 Client: Encrypted packet (len=580)
  675 10.265606987  10.6.15.156 → 192.168.1.12 TCP 66 22 → 54766 [ACK] Seq=410109 Ack=17049 Win=1452 Len=0 TSval=14761568 TSecr=7830071
  676 10.268946725  10.6.15.156 → 192.168.1.12 SSH 142 Server: Encrypted packet (len=76)
  677 10.311458091 192.168.1.12 → 10.6.15.156  TCP 66 54766 → 22 [ACK] Seq=17049 Ack=410185 Win=4866 Len=0 TSval=7830083 TSecr=14761568
  678 10.375143099  10.6.15.156 → 192.168.1.12 SSH 942 Server: Encrypted packet (len=876)
  679 10.375168172 192.168.1.12 → 10.6.15.156  TCP 66 54766 → 22 [ACK] Seq=17049 Ack=411061 Win=4866 Len=0 TSval=7830098 TSecr=14761595
  680 10.375935841  10.6.15.156 → 192.168.1.12 SSH 462 Server: Encrypted packet (len=396)
  681 10.375954901 192.168.1.12 → 10.6.15.156  TCP 66 54766 → 22 [ACK] Seq=17049 Ack=411457 Win=4866 Len=0 TSval=7830099 TSecr=14761595
  682 10.376501087 192.168.1.12 → 10.6.15.156  SSH 142 Client: Encrypted packet (len=76)
  683 10.418086725  10.6.15.156 → 192.168.1.12 TCP 66 22 → 54766 [ACK] Seq=411457 Ack=17125 Win=1452 Len=0 TSval=14761606 TSecr=7830099
  684 10.996266021 192.168.1.12 → 10.6.15.156  SSH 862 Client: Encrypted packet (len=796)
  685 10.996834505 192.168.1.12 → 10.6.15.156  SSH 862 Client: Encrypted packet (len=796)
  686 11.000370878  10.6.15.156 → 192.168.1.12 TCP 66 22 → 54766 [ACK] Seq=411457 Ack=17921 Win=1452 Len=0 TSval=14761751 TSecr=7830254
  687 11.000400447  10.6.15.156 → 192.168.1.12 TCP 66 22 → 54766 [ACK] Seq=411457 Ack=18717 Win=1452 Len=0 TSval=14761751 TSecr=7830254
  688 11.073279878 192.168.1.12 → 139.59.21.22 NTP 90 NTP Version 4, client
  689 11.212480115  10.6.15.156 → 192.168.1.12 SSH 454 Server: Encrypted packet (len=388)
  690 11.215776949  10.6.15.156 → 192.168.1.12 SSH 454 Server: Encrypted packet (len=388)
  691 11.215879376 192.168.1.12 → 10.6.15.156  TCP 66 54766 → 22 [ACK] Seq=18717 Ack=412233 Win=4866 Len=0 TSval=7830309 TSecr=14761804
  692 14.992639001 192.168.1.12 → 10.6.15.156  SSH 862 Client: Encrypted packet (len=796)
  693 15.003029835  10.6.15.156 → 192.168.1.12 TCP 66 22 → 54766 [ACK] Seq=412233 Ack=19513 Win=1452 Len=0 TSval=14762750 TSecr=7831253
  694 15.003051214 192.168.1.12 → 10.6.15.156  SSH 862 Client: Encrypted packet (len=796)
  695 15.011175875  10.6.15.156 → 192.168.1.12 TCP 66 22 → 54766 [ACK] Seq=412233 Ack=20309 Win=1452 Len=0 TSval=14762752 TSecr=7831255
  696 15.243588123  10.6.15.156 → 192.168.1.12 SSH 454 Server: Encrypted packet (len=388)
  697 15.251668059  10.6.15.156 → 192.168.1.12 SSH 454 Server: Encrypted packet (len=388)
  698 15.251731421 192.168.1.12 → 10.6.15.156  TCP 66 54766 → 22 [ACK] Seq=20309 Ack=413009 Win=4866 Len=0 TSval=7831318 TSecr=14762812
  699 15.993645465 192.168.1.12 → 10.6.15.156  SSH 862 Client: Encrypted packet (len=796)
  700 15.995784200  10.6.15.156 → 192.168.1.12 TCP 66 22 → 54766 [ACK] Seq=413009 Ack=21105 Win=1452 Len=0 TSval=14763000 TSecr=7831503
  701 16.210145047  10.6.15.156 → 192.168.1.12 SSH 454 Server: Encrypted packet (len=388)
  702 16.251460198 192.168.1.12 → 10.6.15.156  TCP 66 54766 → 22 [ACK] Seq=21105 Ack=413397 Win=4866 Len=0 TSval=7831568 TSecr=14763054
  703 16.277449943 10.22.17.139 → 224.0.0.252  LLMNR 75 Standard query 0x52a6 A ievmdcoaoomasiy
  704 16.688879667 10.22.17.139 → 224.0.0.252  LLMNR 75 Standard query 0x52a6 A ievmdcoaoomasiy
  705 16.996080277 192.168.1.12 → 10.6.15.156  SSH 862 Client: Encrypted packet (len=796)
  706 16.998125261  10.6.15.156 → 192.168.1.12 TCP 66 22 → 54766 [ACK] Seq=413397 Ack=21901 Win=1452 Len=0 TSval=14763251 TSecr=7831754
  707 16.998143841 192.168.1.12 → 10.6.15.156  SSH 862 Client: Encrypted packet (len=796)
  708 16.998857742  10.6.15.156 → 192.168.1.12 SSH 102 Server: Encrypted packet (len=36)
  709 16.998879970 192.168.1.12 → 10.6.15.156  TCP 66 54766 → 22 [ACK] Seq=22697 Ack=413433 Win=4866 Len=0 TSval=7831754 TSecr=14763251
  710 17.037663167  10.6.15.156 → 192.168.1.12 TCP 66 22 → 54766 [ACK] Seq=413433 Ack=22697 Win=1452 Len=0 TSval=14763261 TSecr=7831754
  711 17.213315000  10.6.15.156 → 192.168.1.12 SSH 454 Server: Encrypted packet (len=388)
  712 17.213341886 192.168.1.12 → 10.6.15.156  TCP 66 54766 → 22 [ACK] Seq=22697 Ack=413821 Win=4866 Len=0 TSval=7831808 TSecr=14763304
  713 17.217258272  10.6.15.156 → 192.168.1.12 SSH 454 Server: Encrypted packet (len=388)
  714 17.217281523 192.168.1.12 → 10.6.15.156  TCP 66 54766 → 22 [ACK] Seq=22697 Ack=414209 Win=4866 Len=0 TSval=7831809 TSecr=14763305
  715 17.271277392 10.22.17.139 → 224.0.0.252  LLMNR 64 Standard query 0x7aff A wpad
  716 17.272784362 10.22.17.139 → 224.0.0.252  LLMNR 64 Standard query 0xcf45 A wpad
  717 17.678429777 10.22.17.139 → 224.0.0.252  LLMNR 64 Standard query 0xcf45 A wpad
  718 17.678857768 10.22.17.139 → 224.0.0.252  LLMNR 64 Standard query 0x7aff A wpad
  719 18.288555759 10.22.17.139 → 224.0.0.252  LLMNR 68 Standard query 0x46cc A zvolubfx
  720 18.288905366 10.22.17.139 → 224.0.0.252  LLMNR 69 Standard query 0x79fc A ngieizgzg
  721 18.712114167 10.22.17.139 → 224.0.0.252  LLMNR 68 Standard query 0x46cc A zvolubfx
  722 18.712521286 10.22.17.139 → 224.0.0.252  LLMNR 69 Standard query 0x79fc A ngieizgzg
  723 19.428498043 192.168.1.12 → 10.6.15.156  SSH 102 Client: Encrypted packet (len=36)
  724 19.430187594  10.6.15.156 → 192.168.1.12 TCP 66 22 → 54766 [ACK] Seq=414209 Ack=22733 Win=1452 Len=0 TSval=14763859 TSecr=7832362
  725 19.430205913 192.168.1.12 → 10.6.15.156  SSH 206 Client: Encrypted packet (len=140)
  726 19.431980552  10.6.15.156 → 192.168.1.12 TCP 66 22 → 54766 [ACK] Seq=414209 Ack=22873 Win=1452 Len=0 TSval=14763859 TSecr=7832362
  727 19.607802745  10.6.15.156 → 192.168.1.12 SSH 138 Server: Encrypted packet (len=72)
  728 19.607819917 192.168.1.12 → 10.6.15.156  TCP 66 54766 → 22 [ACK] Seq=22873 Ack=414281 Win=4866 Len=0 TSval=7832407 TSecr=14763903
  729 19.608054315 192.168.1.12 → 10.6.15.156  SSH 102 Client: Encrypted packet (len=36)
  730 19.609355165  10.6.15.156 → 192.168.1.12 TCP 66 22 → 54766 [ACK] Seq=414281 Ack=22909 Win=1452 Len=0 TSval=14763903 TSecr=7832407
  731 19.611207124  10.6.15.156 → 192.168.1.12 SSH 138 Server: Encrypted packet (len=72)
  732 19.611437560 192.168.1.12 → 10.6.15.156  SSH 102 Client: Encrypted packet (len=36)
  733 19.647575624  10.6.15.156 → 192.168.1.12 SSH 350 Server: Encrypted packet (len=284)
  734 19.647813141 192.168.1.12 → 10.6.15.156  SSH 102 Client: Encrypted packet (len=36)
  735 19.685642810  10.6.15.156 → 192.168.1.12 TCP 66 22 → 54766 [ACK] Seq=414637 Ack=22981 Win=1452 Len=0 TSval=14763923 TSecr=7832417
  736 20.994789756 192.168.1.12 → 10.6.15.156  SSH 862 Client: Encrypted packet (len=796)
  737 20.996882826  10.6.15.156 → 192.168.1.12 TCP 66 22 → 54766 [ACK] Seq=414637 Ack=23777 Win=1452 Len=0 TSval=14764250 TSecr=7832753
  738 20.996901941 192.168.1.12 → 10.6.15.156  SSH 862 Client: Encrypted packet (len=796)
  739 20.998824723  10.6.15.156 → 192.168.1.12 TCP 66 22 → 54766 [ACK] Seq=414637 Ack=24573 Win=1452 Len=0 TSval=14764251 TSecr=7832754
  740 21.214342031  10.6.15.156 → 192.168.1.12 SSH 454 Server: Encrypted packet (len=388)
  741 21.214720463  10.6.15.156 → 192.168.1.12 SSH 454 Server: Encrypted packet (len=388)
  742 21.214755060 192.168.1.12 → 10.6.15.156  TCP 66 54766 → 22 [ACK] Seq=24573 Ack=415413 Win=4866 Len=0 TSval=7832808 TSecr=14764304
  743 21.856221234 192.168.1.12 → 239.255.255.250 SSDP 213 M-SEARCH * HTTP/1.1 
  744 21.996651904 192.168.1.12 → 10.6.15.156  SSH 862 Client: Encrypted packet (len=796)
  745 21.998795558  10.6.15.156 → 192.168.1.12 TCP 66 22 → 54766 [ACK] Seq=415413 Ack=25369 Win=1452 Len=0 TSval=14764501 TSecr=7833004
  746 22.215659836  10.6.15.156 → 192.168.1.12 SSH 454 Server: Encrypted packet (len=388)
  747 22.259459512 192.168.1.12 → 10.6.15.156  TCP 66 54766 → 22 [ACK] Seq=25369 Ack=415801 Win=4866 Len=0 TSval=7833070 TSecr=14764555
  748 22.303022841 10.22.17.139 → 224.0.0.252  LLMNR 69 Standard query 0xdfdf A ngieizgzg
  749 22.303366027 10.22.17.139 → 224.0.0.252  LLMNR 68 Standard query 0x89bf A zvolubfx
  750 22.303788702 10.22.17.139 → 224.0.0.252  LLMNR 75 Standard query 0x0169 A ievmdcoaoomasiy
  751 22.714317479 10.22.17.139 → 224.0.0.252  LLMNR 75 Standard query 0x0169 A ievmdcoaoomasiy
  752 22.714698925 10.22.17.139 → 224.0.0.252  LLMNR 68 Standard query 0x89bf A zvolubfx
  753 22.715053056 10.22.17.139 → 224.0.0.252  LLMNR 69 Standard query 0xdfdf A ngieizgzg
  754 22.857055139 192.168.1.12 → 239.255.255.250 SSDP 213 M-SEARCH * HTTP/1.1 
  755 22.996475175 192.168.1.12 → 10.6.15.156  SSH 862 Client: Encrypted packet (len=796)
  756 22.998534829  10.6.15.156 → 192.168.1.12 TCP 66 22 → 54766 [ACK] Seq=415801 Ack=26165 Win=1452 Len=0 TSval=14764751 TSecr=7833254
  757 22.998544875 192.168.1.12 → 10.6.15.156  SSH 862 Client: Encrypted packet (len=796)
  758 23.000619557  10.6.15.156 → 192.168.1.12 TCP 66 22 → 54766 [ACK] Seq=415801 Ack=26961 Win=1452 Len=0 TSval=14764751 TSecr=7833254
  759 23.214596332  10.6.15.156 → 192.168.1.12 SSH 454 Server: Encrypted packet (len=388)
  760 23.214614085 192.168.1.12 → 10.6.15.156  TCP 66 54766 → 22 [ACK] Seq=26961 Ack=416189 Win=4866 Len=0 TSval=7833308 TSecr=14764805
  761 23.217924159  10.6.15.156 → 192.168.1.12 SSH 454 Server: Encrypted packet (len=388)
  762 23.217958541 192.168.1.12 → 10.6.15.156  TCP 66 54766 → 22 [ACK] Seq=26961 Ack=416577 Win=4866 Len=0 TSval=7833309 TSecr=14764805
  763 23.857990904 192.168.1.12 → 239.255.255.250 SSDP 213 M-SEARCH * HTTP/1.1 
  764 24.858982562 192.168.1.12 → 239.255.255.250 SSDP 213 M-SEARCH * HTTP/1.1 
  765 26.293486630 10.22.17.139 → 224.0.0.252  LLMNR 64 Standard query 0x0523 A wpad
  766 26.295533609 10.22.17.139 → 224.0.0.252  LLMNR 64 Standard query 0x62dc A wpad
  767 26.703765706 10.22.17.139 → 224.0.0.252  LLMNR 64 Standard query 0x62dc A wpad
  768 26.704117826 10.22.17.139 → 224.0.0.252  LLMNR 64 Standard query 0x0523 A wpad
  769 26.996199350 192.168.1.12 → 10.6.15.156  SSH 862 Client: Encrypted packet (len=796)
  770 26.998317021  10.6.15.156 → 192.168.1.12 TCP 66 22 → 54766 [ACK] Seq=416577 Ack=27757 Win=1452 Len=0 TSval=14765751 TSecr=7834254
  771 26.998337063 192.168.1.12 → 10.6.15.156  SSH 862 Client: Encrypted packet (len=796)
  772 27.000340145  10.6.15.156 → 192.168.1.12 TCP 66 22 → 54766 [ACK] Seq=416577 Ack=28553 Win=1452 Len=0 TSval=14765751 TSecr=7834254
  773 27.214756903  10.6.15.156 → 192.168.1.12 SSH 454 Server: Encrypted packet (len=388)
  774 27.214783264 192.168.1.12 → 10.6.15.156  TCP 66 54766 → 22 [ACK] Seq=28553 Ack=416965 Win=4866 Len=0 TSval=7834308 TSecr=14765805
  775 27.215221588  10.6.15.156 → 192.168.1.12 SSH 454 Server: Encrypted packet (len=388)
  776 27.215229733 192.168.1.12 → 10.6.15.156  TCP 66 54766 → 22 [ACK] Seq=28553 Ack=417353 Win=4866 Len=0 TSval=7834308 TSecr=14765805
  777 27.979082031  10.22.18.62 → 224.0.0.252  LLMNR 64 Standard query 0x5d05 A wpad
  778 27.993630153 192.168.1.12 → 10.6.15.156  SSH 862 Client: Encrypted packet (len=796)
  779 27.995827676  10.6.15.156 → 192.168.1.12 TCP 66 22 → 54766 [ACK] Seq=417353 Ack=29349 Win=1452 Len=0 TSval=14766000 TSecr=7834503
  780 28.073259398 192.168.1.12 → 123.108.200.124 NTP 90 NTP Version 4, client
  781 28.212965281  10.6.15.156 → 192.168.1.12 SSH 454 Server: Encrypted packet (len=388)
  782 28.213012671 192.168.1.12 → 10.6.15.156  TCP 66 54766 → 22 [ACK] Seq=29349 Ack=417741 Win=4866 Len=0 TSval=7834558 TSecr=14766054
  783 28.389967276  10.22.18.62 → 224.0.0.252  LLMNR 64 Standard query 0x5d05 A wpad
  784 28.992913017 192.168.1.12 → 10.6.15.156  SSH 862 Client: Encrypted packet (len=796)
  785 28.996939786  10.6.15.156 → 192.168.1.12 TCP 66 22 → 54766 [ACK] Seq=417741 Ack=30145 Win=1452 Len=0 TSval=14766250 TSecr=7834753
  786 28.996949570 192.168.1.12 → 10.6.15.156  SSH 862 Client: Encrypted packet (len=796)
  787 28.999917876  10.6.15.156 → 192.168.1.12 TCP 66 22 → 54766 [ACK] Seq=417741 Ack=30941 Win=1452 Len=0 TSval=14766251 TSecr=7834754
  788 29.212874338  10.6.15.156 → 192.168.1.12 SSH 454 Server: Encrypted packet (len=388)
  789 29.212900277 192.168.1.12 → 10.6.15.156  TCP 66 54766 → 22 [ACK] Seq=30941 Ack=418129 Win=4866 Len=0 TSval=7834808 TSecr=14766304
  790 29.213508588  10.6.15.156 → 192.168.1.12 SSH 454 Server: Encrypted packet (len=388)
  791 29.213518468 192.168.1.12 → 10.6.15.156  TCP 66 54766 → 22 [ACK] Seq=30941 Ack=418517 Win=4866 Len=0 TSval=7834808 TSecr=14766305
  792 29.995536539 192.168.1.12 → 10.6.15.156  SSH 158 Client: Encrypted packet (len=92)
  793 29.997167437  10.6.15.156 → 192.168.1.12 TCP 66 22 → 54766 [ACK] Seq=418517 Ack=31033 Win=1452 Len=0 TSval=14766500 TSecr=7835004
  794 30.213109400  10.6.15.156 → 192.168.1.12 SSH 102 Server: Encrypted packet (len=36)
  795 30.213134990 192.168.1.12 → 10.6.15.156  TCP 66 54766 → 22 [ACK] Seq=31033 Ack=418553 Win=4866 Len=0 TSval=7835058 TSecr=14766554
  796 32.992932617 192.168.1.12 → 10.6.15.156  SSH 862 Client: Encrypted packet (len=796)
  797 32.996934260  10.6.15.156 → 192.168.1.12 TCP 66 22 → 54766 [ACK] Seq=418553 Ack=31829 Win=1452 Len=0 TSval=14767250 TSecr=7835753
  798 32.996954598 192.168.1.12 → 10.6.15.156  SSH 862 Client: Encrypted packet (len=796)
  799 32.998988725  10.6.15.156 → 192.168.1.12 TCP 66 22 → 54766 [ACK] Seq=418553 Ack=32625 Win=1452 Len=0 TSval=14767251 TSecr=7835754
  800 33.209409701  10.6.15.156 → 192.168.1.12 SSH 454 Server: Encrypted packet (len=388)
  801 33.209436088 192.168.1.12 → 10.6.15.156  TCP 66 54766 → 22 [ACK] Seq=32625 Ack=418941 Win=4866 Len=0 TSval=7835807 TSecr=14767303
  802 33.215681009  10.6.15.156 → 192.168.1.12 SSH 454 Server: Encrypted packet (len=388)
  803 33.215698488 192.168.1.12 → 10.6.15.156  TCP 66 54766 → 22 [ACK] Seq=32625 Ack=419329 Win=4866 Len=0 TSval=7835809 TSecr=14767305
  804 34.001818212 192.168.1.12 → 10.6.15.156  SSH 862 Client: Encrypted packet (len=796)
  805 34.004400337  10.6.15.156 → 192.168.1.12 TCP 66 22 → 54766 [ACK] Seq=419329 Ack=33421 Win=1452 Len=0 TSval=14767502 TSecr=7836005
  806 34.220802118  10.6.15.156 → 192.168.1.12 SSH 454 Server: Encrypted packet (len=388)
  807 34.220827478 192.168.1.12 → 10.6.15.156  TCP 66 54766 → 22 [ACK] Seq=33421 Ack=419717 Win=4866 Len=0 TSval=7836060 TSecr=14767556
  808 34.428394303 192.168.1.12 → 10.6.15.156  SSH 126 Client: Encrypted packet (len=60)
  809 34.431535919  10.6.15.156 → 192.168.1.12 TCP 66 22 → 54766 [ACK] Seq=419717 Ack=33481 Win=1452 Len=0 TSval=14767609 TSecr=7836112
