    1 0.000000000  10.6.15.144 → 192.168.1.16 SSH 110 Server: Encrypted packet (len=44)
    2 0.000319413  10.6.15.144 → 192.168.1.16 SSH 102 Server: Encrypted packet (len=36)
    3 0.000441190 192.168.1.16 → 10.6.15.144  TCP 66 59298 → 22 [ACK] Seq=1 Ack=81 Win=5703 Len=0 TSval=5354704 TSecr=5950844
    4 0.000454087 192.168.1.16 → 10.6.15.144  SSH 582 Client: Encrypted packet (len=516)
    5 0.001116097  10.6.15.144 → 192.168.1.16 SSH 102 Server: [TCP Spurious Retransmission] , Encrypted packet (len=36)
    6 0.001121274 192.168.1.16 → 10.6.15.144  TCP 78 [TCP Dup ACK 3#1] 59298 → 22 [ACK] Seq=517 Ack=81 Win=5703 Len=0 TSval=5354704 TSecr=5950988 SLE=45 SRE=81
    7 0.010846736  10.6.15.144 → 192.168.1.16 TCP 66 22 → 59298 [ACK] Seq=81 Ack=517 Win=1452 Len=0 TSval=5951071 TSecr=5354704
    8 0.992075172  10.6.15.144 → 192.168.1.16 SSH 374 Server: Encrypted packet (len=308)
    9 0.992096447 192.168.1.16 → 10.6.15.144  TCP 66 59298 → 22 [ACK] Seq=517 Ack=389 Win=5703 Len=0 TSval=5354952 TSecr=5951154
   10 0.994483382 192.168.1.16 → 10.6.15.144  SSH 118 Client: Encrypted packet (len=52)
   11 0.998712998 192.168.1.16 → 10.6.15.144  SSH 102 Client: Encrypted packet (len=36)
   12 1.000640763  10.6.15.144 → 192.168.1.16 SSH 102 Server: Encrypted packet (len=36)
   13 1.000755392 192.168.1.16 → 10.6.15.144  SSH 102 Client: Encrypted packet (len=36)
   14 1.001077657 10.22.19.132 → 224.0.0.252  LLMNR 73 Standard query 0x14e7 A amzhdgdpnvwlj
   15 1.001090980 10.22.19.132 → 224.0.0.252  LLMNR 75 Standard query 0xfe91 A hcyycxpljyxyotp
   16 1.001094752 10.22.19.132 → 224.0.0.252  LLMNR 67 Standard query 0xf4d8 A azrjdwv
   17 1.007942460  10.6.15.144 → 192.168.1.16 TCP 66 22 → 59298 [ACK] Seq=425 Ack=569 Win=1452 Len=0 TSval=5951320 TSecr=5354953
   18 1.048224937  10.6.15.144 → 192.168.1.16 TCP 66 22 → 59298 [ACK] Seq=425 Ack=641 Win=1452 Len=0 TSval=5951331 TSecr=5354954
   19 1.087047089  10.6.15.144 → 192.168.1.16 SSH 102 Server: Encrypted packet (len=36)
   20 1.130070534 192.168.1.16 → 10.6.15.144  TCP 66 59298 → 22 [ACK] Seq=641 Ack=461 Win=5703 Len=0 TSval=5354987 TSecr=5951340
   21 1.138115201 10.22.19.132 → 224.0.0.252  LLMNR 73 Standard query 0x14e7 A amzhdgdpnvwlj
   22 1.185119406 10.22.19.132 → 224.0.0.252  LLMNR 67 Standard query 0xf4d8 A azrjdwv
   23 1.185140401 10.22.19.132 → 224.0.0.252  LLMNR 75 Standard query 0xfe91 A hcyycxpljyxyotp
   24 2.720823386 192.168.1.16 → 10.6.15.144  SSH 1310 Client: Encrypted packet (len=1244)
   25 2.722732169  10.6.15.144 → 192.168.1.16 SSH 102 Server: Encrypted packet (len=36)
   26 2.722759459 192.168.1.16 → 10.6.15.144  TCP 66 59298 → 22 [ACK] Seq=1885 Ack=497 Win=5703 Len=0 TSval=5355385 TSecr=5951549
   27 2.722774842  10.6.15.144 → 192.168.1.16 SSH 102 Server: [TCP Spurious Retransmission] , Encrypted packet (len=36)
   28 2.722780747 192.168.1.16 → 10.6.15.144  TCP 78 [TCP Dup ACK 26#1] 59298 → 22 [ACK] Seq=1885 Ack=497 Win=5703 Len=0 TSval=5355385 TSecr=5951708 SLE=461 SRE=497
   29 2.723102108 192.168.1.16 → 10.6.15.144  SSH 174 Client: Encrypted packet (len=108)
   30 2.730852918  10.6.15.144 → 192.168.1.16 TCP 66 22 → 59298 [ACK] Seq=497 Ack=1993 Win=1452 Len=0 TSval=5951752 TSecr=5355384
   31 2.732316199  10.6.15.144 → 192.168.1.16 SSH 134 Server: Encrypted packet (len=68)
   32 2.774090287 192.168.1.16 → 10.6.15.144  TCP 66 59298 → 22 [ACK] Seq=1993 Ack=565 Win=5703 Len=0 TSval=5355398 TSecr=5951752
   33 2.832040054  10.6.15.144 → 192.168.1.16 SSH 742 Server: Encrypted packet (len=676)
   34 2.832068963 192.168.1.16 → 10.6.15.144  TCP 66 59298 → 22 [ACK] Seq=1993 Ack=1241 Win=5703 Len=0 TSval=5355412 TSecr=5951776
   35 2.832544840  10.6.15.144 → 192.168.1.16 SSH 518 Server: Encrypted packet (len=452)
   36 2.832552403 192.168.1.16 → 10.6.15.144  TCP 66 59298 → 22 [ACK] Seq=1993 Ack=1693 Win=5703 Len=0 TSval=5355412 TSecr=5951777
   37 2.832924073 192.168.1.16 → 10.6.15.144  SSH 134 Client: Encrypted packet (len=68)
   38 2.900166369  10.6.15.144 → 192.168.1.16 TCP 66 22 → 59298 [ACK] Seq=1693 Ack=2061 Win=1452 Len=0 TSval=5951794 TSecr=5355412
   39 4.991874777  10.6.15.144 → 192.168.1.16 SSH 138 Server: Encrypted packet (len=72)
   40 4.991893125  10.6.15.144 → 192.168.1.16 TCP 138 [TCP Retransmission] 22 → 59298 [PSH, ACK] Seq=1693 Ack=2061 Win=1452 Len=72 TSval=5952271 TSecr=5355412
   41 4.991901275 192.168.1.16 → 10.6.15.144  TCP 78 59298 → 22 [ACK] Seq=2061 Ack=1765 Win=5703 Len=0 TSval=5355952 TSecr=5952271 SLE=1693 SRE=1765
   42 4.992087605 192.168.1.16 → 10.6.15.144  SSH 102 Client: Encrypted packet (len=36)
   43 5.000235007  10.6.15.144 → 192.168.1.16 TCP 66 22 → 59298 [ACK] Seq=1765 Ack=2097 Win=1452 Len=0 TSval=5952319 TSecr=5355952
   44 6.016150303  10.6.15.144 → 192.168.1.16 SSH 982 Server: Encrypted packet (len=916)
   45 6.016351055  10.6.15.144 → 192.168.1.16 SSH 1514 Server: Encrypted packet (len=1448)
   46 6.016358597 192.168.1.16 → 10.6.15.144  TCP 66 59298 → 22 [ACK] Seq=2097 Ack=4129 Win=5703 Len=0 TSval=5356208 TSecr=5952448
   47 6.016372622  10.6.15.144 → 192.168.1.16 SSH 246 Server: Encrypted packet (len=180)
   48 6.017279491 192.168.1.16 → 10.6.15.144  SSH 206 Client: Encrypted packet (len=140)
   49 6.019632510 192.168.1.16 → 10.6.15.144  SSH 230 Client: Encrypted packet (len=164)
   50 6.019913460 192.168.1.16 → 10.6.15.144  SSH 918 Client: Encrypted packet (len=852)
   51 6.027181850  10.6.15.144 → 192.168.1.16 TCP 66 22 → 59298 [ACK] Seq=4309 Ack=2237 Win=1452 Len=0 TSval=5952575 TSecr=5356208
   52 6.029610241  10.6.15.144 → 192.168.1.16 TCP 66 22 → 59298 [ACK] Seq=4309 Ack=2401 Win=1452 Len=0 TSval=5952576 TSecr=5356209
   53 6.030196214  10.6.15.144 → 192.168.1.16 TCP 66 22 → 59298 [ACK] Seq=4309 Ack=3253 Win=1452 Len=0 TSval=5952576 TSecr=5356209
   54 7.008044841  10.22.18.17 → 224.0.0.252  LLMNR 64 Standard query 0xeb5c A wpad
   55 7.052838753  10.22.18.17 → 224.0.0.252  LLMNR 64 Standard query 0xeb5c A wpad
   56 8.993986824  10.6.15.144 → 192.168.1.16 SSH 358 Server: Encrypted packet (len=292)
   57 8.994007943  10.6.15.144 → 192.168.1.16 SSH 166 Server: Encrypted packet (len=100)
   58 8.994014582  10.6.15.144 → 192.168.1.16 SSH 102 Server: Encrypted packet (len=36)
   59 8.994109790 192.168.1.16 → 10.6.15.144  TCP 66 59298 → 22 [ACK] Seq=3253 Ack=4737 Win=5703 Len=0 TSval=5356953 TSecr=5953164
   60 8.994423509 192.168.1.16 → 10.6.15.144  SSH 126 Client: Encrypted packet (len=60)
   61 9.000861289  10.6.15.144 → 192.168.1.16 TCP 66 22 → 59298 [ACK] Seq=4737 Ack=3313 Win=1452 Len=0 TSval=5953320 TSecr=5356953
   62 9.984208181  10.6.15.144 → 192.168.1.16 SSH 1514 Server: Encrypted packet (len=1448)
   63 9.984384823  10.6.15.144 → 192.168.1.16 SSH 1446 Server: Encrypted packet (len=1380)
   64 9.984393798 192.168.1.16 → 10.6.15.144  TCP 66 59298 → 22 [ACK] Seq=3313 Ack=7565 Win=5703 Len=0 TSval=5357200 TSecr=5953507
   65 9.984583999  10.6.15.144 → 192.168.1.16 SSH 1514 Server: Encrypted packet (len=1448)
   66 9.995543455  10.6.15.144 → 192.168.1.16 SSH 1514 Server: Encrypted packet (len=1448)
   67 9.995564130 192.168.1.16 → 10.6.15.144  TCP 66 59298 → 22 [ACK] Seq=3313 Ack=10461 Win=5703 Len=0 TSval=5357203 TSecr=5953507
   68 9.995721726  10.6.15.144 → 192.168.1.16 SSH 1514 Server: Encrypted packet (len=1448)
   69 10.006198555  10.6.15.144 → 192.168.1.16 SSH 1514 Server: Encrypted packet (len=1448)
   70 10.006220250 192.168.1.16 → 10.6.15.144  TCP 66 59298 → 22 [ACK] Seq=3313 Ack=13357 Win=5703 Len=0 TSval=5357206 TSecr=5953567
   71 10.006379801  10.6.15.144 → 192.168.1.16 SSH 1514 Server: Encrypted packet (len=1448)
   72 10.009897624 192.168.1.16 → 10.6.15.144  SSH 138 Client: Encrypted packet (len=72)
   73 10.011324139 192.168.1.16 → 10.6.15.144  SSH 102 Client: Encrypted packet (len=36)
   74 10.015727050 192.168.1.16 → 10.6.15.144  SSH 118 Client: Encrypted packet (len=52)
   75 10.016937011 192.168.1.16 → 10.6.15.144  SSH 138 Client: Encrypted packet (len=72)
   76 10.017972803  10.6.15.144 → 192.168.1.16 SSH 1514 Server: Encrypted packet (len=1448)
   77 10.018265141 192.168.1.16 → 10.6.15.144  SSH 102 Client: Encrypted packet (len=36)
   78 10.018834214 192.168.1.16 → 10.6.15.144  SSH 138 Client: Encrypted packet (len=72)
   79 10.020627430  10.6.15.144 → 192.168.1.16 SSH 1514 Server: [TCP Previous segment not captured] , Encrypted packet (len=1448)
   80 10.020653700 192.168.1.16 → 10.6.15.144  TCP 78 [TCP Dup ACK 77#1] 59298 → 22 [ACK] Seq=3653 Ack=16253 Win=5703 Len=0 TSval=5357209 TSecr=5953573 SLE=17701 SRE=19149
   81 10.026300365  10.6.15.144 → 192.168.1.16 TCP 66 22 → 59298 [ACK] Seq=19149 Ack=3473 Win=1452 Len=0 TSval=5953575 TSecr=5357207
   82 10.027988901  10.6.15.144 → 192.168.1.16 SSH 254 Server: Encrypted packet (len=188)
   83 10.028009790 192.168.1.16 → 10.6.15.144  TCP 78 [TCP Dup ACK 77#2] 59298 → 22 [ACK] Seq=3653 Ack=16253 Win=5703 Len=0 TSval=5357211 TSecr=5953573 SLE=17701 SRE=19337
   84 10.054745979 192.168.1.16 → 10.6.15.144  SSH 122 Client: Encrypted packet (len=44)
   85 10.064131106  10.6.15.144 → 192.168.1.16 TCP 66 22 → 59298 [ACK] Seq=19337 Ack=3697 Win=1452 Len=0 TSval=5953585 TSecr=5357209
   86 10.120255125  10.6.15.144 → 192.168.1.16 SSH 1514 Server: Encrypted packet (len=1448)
   87 10.120272681 192.168.1.16 → 10.6.15.144  TCP 78 [TCP Dup ACK 77#3] 59298 → 22 [ACK] Seq=3697 Ack=16253 Win=5703 Len=0 TSval=5357234 TSecr=5953573 SLE=17701 SRE=20785
   88 10.120440141  10.6.15.144 → 192.168.1.16 SSH 1514 Server: Encrypted packet (len=1448)
   89 10.120446249 192.168.1.16 → 10.6.15.144  TCP 78 [TCP Dup ACK 77#4] 59298 → 22 [ACK] Seq=3697 Ack=16253 Win=5703 Len=0 TSval=5357234 TSecr=5953573 SLE=17701 SRE=22233
   90 10.129989235  10.6.15.144 → 192.168.1.16 SSH 1514 Server: [TCP Fast Retransmission] , Encrypted packet (len=1448)
   91 10.130020456 192.168.1.16 → 10.6.15.144  TCP 66 59298 → 22 [ACK] Seq=3697 Ack=22233 Win=5703 Len=0 TSval=5357236 TSecr=5953601
   92 10.130155537  10.6.15.144 → 192.168.1.16 SSH 1514 Server: Encrypted packet (len=1448)
   93 10.130161525 192.168.1.16 → 10.6.15.144  TCP 66 59298 → 22 [ACK] Seq=3697 Ack=23681 Win=5703 Len=0 TSval=5357237 TSecr=5953601
   94 10.140645197  10.6.15.144 → 192.168.1.16 SSH 1514 Server: Encrypted packet (len=1448)
   95 10.140660636 192.168.1.16 → 10.6.15.144  TCP 66 59298 → 22 [ACK] Seq=3697 Ack=25129 Win=5703 Len=0 TSval=5357239 TSecr=5953604
   96 10.140815683  10.6.15.144 → 192.168.1.16 SSH 1514 Server: Encrypted packet (len=1448)
   97 10.140824965 192.168.1.16 → 10.6.15.144  TCP 66 59298 → 22 [ACK] Seq=3697 Ack=26577 Win=5703 Len=0 TSval=5357239 TSecr=5953604
   98 10.141393194  10.6.15.144 → 192.168.1.16 SSH 1514 Server: Encrypted packet (len=1448)
   99 10.141407094 192.168.1.16 → 10.6.15.144  TCP 66 59298 → 22 [ACK] Seq=3697 Ack=28025 Win=5703 Len=0 TSval=5357239 TSecr=5953604
  100 10.150784673  10.6.15.144 → 192.168.1.16 SSH 1514 Server: Encrypted packet (len=1448)
  101 10.150801149 192.168.1.16 → 10.6.15.144  TCP 66 59298 → 22 [ACK] Seq=3697 Ack=29473 Win=5703 Len=0 TSval=5357242 TSecr=5953606
  102 10.150969372  10.6.15.144 → 192.168.1.16 SSH 1514 Server: Encrypted packet (len=1448)
  103 10.150979571 192.168.1.16 → 10.6.15.144  TCP 66 59298 → 22 [ACK] Seq=3697 Ack=30921 Win=5703 Len=0 TSval=5357242 TSecr=5953606
  104 10.151612871  10.6.15.144 → 192.168.1.16 SSH 1514 Server: Encrypted packet (len=1448)
  105 10.151621665 192.168.1.16 → 10.6.15.144  TCP 66 59298 → 22 [ACK] Seq=3697 Ack=32369 Win=5703 Len=0 TSval=5357242 TSecr=5953606
  106 10.161237635  10.6.15.144 → 192.168.1.16 SSH 1422 Server: Encrypted packet (len=1356)
  107 10.161254033 192.168.1.16 → 10.6.15.144  TCP 66 59298 → 22 [ACK] Seq=3697 Ack=33725 Win=5703 Len=0 TSval=5357244 TSecr=5953609
  108 10.197492923 192.168.1.16 → 10.6.15.144  SSH 102 Client: Encrypted packet (len=36)
  109 10.244037290  10.6.15.144 → 192.168.1.16 TCP 66 22 → 59298 [ACK] Seq=33725 Ack=3733 Win=1452 Len=0 TSval=5953630 TSecr=5357253
  110 10.338994180  10.6.15.144 → 192.168.1.16 SSH 110 Server: Encrypted packet (len=44)
  111 10.339269994 192.168.1.16 → 10.6.15.144  SSH 158 Client: Encrypted packet (len=92)
  112 10.349320694  10.6.15.144 → 192.168.1.16 TCP 66 22 → 59298 [ACK] Seq=33769 Ack=3825 Win=1452 Len=0 TSval=5953656 TSecr=5357289
  113 10.415765395  10.6.15.144 → 192.168.1.16 SSH 102 Server: Encrypted packet (len=36)
  114 10.416077977 192.168.1.16 → 10.6.15.144  SSH 166 Client: Encrypted packet (len=100)
  115 10.426463743  10.6.15.144 → 192.168.1.16 TCP 66 22 → 59298 [ACK] Seq=33805 Ack=3925 Win=1452 Len=0 TSval=5953675 TSecr=5357308
  116 10.692055664 192.168.1.16 → 139.59.21.22 NTP 90 NTP Version 4, client
  117 10.693975324  10.6.15.144 → 192.168.1.16 SSH 1514 Server: Encrypted packet (len=1448)
  118 10.694029844  10.6.15.144 → 192.168.1.16 SSH 670 Server: Encrypted packet (len=604)
  119 10.694038112 192.168.1.16 → 10.6.15.144  TCP 66 59298 → 22 [ACK] Seq=3925 Ack=35857 Win=5703 Len=0 TSval=5357377 TSecr=5953711
  120 10.694115830  10.6.15.144 → 192.168.1.16 SSH 670 Server: [TCP Spurious Retransmission] , Encrypted packet (len=604)
  121 10.694120553 192.168.1.16 → 10.6.15.144  TCP 78 [TCP Dup ACK 119#1] 59298 → 22 [ACK] Seq=3925 Ack=35857 Win=5703 Len=0 TSval=5357378 TSecr=5953731 SLE=35253 SRE=35857
  122 10.695101084 192.168.1.16 → 10.6.15.144  SSH 206 Client: Encrypted packet (len=140)
  123 10.705115735  10.6.15.144 → 192.168.1.16 TCP 66 22 → 59298 [ACK] Seq=35857 Ack=4065 Win=1452 Len=0 TSval=5953745 TSecr=5357378
  124 10.709054776  10.6.15.144 → 192.168.1.16 SSH 102 Server: Encrypted packet (len=36)
  125 10.709395440 192.168.1.16 → 10.6.15.144  SSH 150 Client: Encrypted packet (len=84)
  126 10.709748826  10.6.15.144 → 192.168.1.16 SSH 102 Server: Encrypted packet (len=36)
  127 10.710101893 192.168.1.16 → 10.6.15.144  SSH 158 Client: Encrypted packet (len=92)
  128 10.710423976  10.6.15.144 → 192.168.1.16 SSH 102 Server: Encrypted packet (len=36)
  129 10.710649916 192.168.1.16 → 10.6.15.144  SSH 158 Client: Encrypted packet (len=92)
  130 10.720064179  10.6.15.144 → 192.168.1.16 TCP 66 22 → 59298 [ACK] Seq=35965 Ack=4241 Win=1452 Len=0 TSval=5953749 TSecr=5357381
  131 10.735842613  10.6.15.144 → 192.168.1.16 SSH 138 Server: Encrypted packet (len=72)
  132 10.736072829 192.168.1.16 → 10.6.15.144  SSH 102 Client: Encrypted packet (len=36)
  133 10.784661934  10.6.15.144 → 192.168.1.16 TCP 66 22 → 59298 [ACK] Seq=36037 Ack=4369 Win=1452 Len=0 TSval=5953765 TSecr=5357388
  134 10.786431668  10.6.15.144 → 192.168.1.16 SSH 102 Server: Encrypted packet (len=36)
  135 10.786810658 192.168.1.16 → 10.6.15.144  SSH 174 Client: Encrypted packet (len=108)
  136 10.796920722  10.6.15.144 → 192.168.1.16 TCP 66 22 → 59298 [ACK] Seq=36073 Ack=4477 Win=1452 Len=0 TSval=5953768 TSecr=5357401
  137 12.000004740  10.6.15.144 → 192.168.1.16 SSH 150 Server: Encrypted packet (len=84)
  138 12.000330122  10.6.15.144 → 192.168.1.16 SSH 1514 Server: Encrypted packet (len=1448)
  139 12.000338795 192.168.1.16 → 10.6.15.144  TCP 66 59298 → 22 [ACK] Seq=4477 Ack=37605 Win=5703 Len=0 TSval=5357704 TSecr=5953799
  140 12.000458007  10.6.15.144 → 192.168.1.16 SSH 222 Server: Encrypted packet (len=156)
  141 12.000663234  10.6.15.144 → 192.168.1.16 SSH 518 Server: Encrypted packet (len=452)
  142 12.000689793 192.168.1.16 → 10.6.15.144  TCP 66 59298 → 22 [ACK] Seq=4477 Ack=38213 Win=5703 Len=0 TSval=5357704 TSecr=5953835
  143 12.000800403  10.6.15.144 → 192.168.1.16 TCP 150 [TCP Out-Of-Order] 22 → 59298 [PSH, ACK] Seq=36073 Ack=4477 Win=1452 Len=84 TSval=5953933 TSecr=5357401
  144 12.000806048 192.168.1.16 → 10.6.15.144  TCP 78 [TCP Dup ACK 142#1] 59298 → 22 [ACK] Seq=4477 Ack=38213 Win=5703 Len=0 TSval=5357704 TSecr=5953835 SLE=36073 SRE=36157
  145 12.002190282 192.168.1.16 → 10.6.15.144  SSH 206 Client: Encrypted packet (len=140)
  146 12.002862043 192.168.1.16 → 10.6.15.144  SSH 206 Client: Encrypted packet (len=140)
  147 12.005076942 192.168.1.16 → 10.6.15.144  SSH 222 Client: Encrypted packet (len=156)
  148 12.005618865 192.168.1.16 → 10.6.15.144  SSH 334 Client: Encrypted packet (len=268)
  149 12.005890971 192.168.1.16 → 10.6.15.144  SSH 486 Client: Encrypted packet (len=420)
  150 12.006196949 192.168.1.16 → 10.6.15.144  SSH 946 Client: Encrypted packet (len=880)
  151 12.006691752 192.168.1.16 → 10.6.15.144  SSH 1086 Client: Encrypted packet (len=1020)
  152 12.011415471  10.6.15.144 → 192.168.1.16 SSH 894 Server: Encrypted packet (len=828)
  153 12.013797429  10.6.15.144 → 192.168.1.16 TCP 66 22 → 59298 [ACK] Seq=39041 Ack=4617 Win=1452 Len=0 TSval=5954072 TSecr=5357705
  154 12.013812528 192.168.1.16 → 10.6.15.144  SSH 290 Client: Encrypted packet (len=224)
  155 12.013931256  10.6.15.144 → 192.168.1.16 TCP 66 22 → 59298 [ACK] Seq=39041 Ack=4757 Win=1452 Len=0 TSval=5954072 TSecr=5357705
  156 12.015229584  10.6.15.144 → 192.168.1.16 TCP 66 22 → 59298 [ACK] Seq=39041 Ack=4913 Win=1452 Len=0 TSval=5954072 TSecr=5357705
  157 12.015329111  10.6.15.144 → 192.168.1.16 TCP 66 22 → 59298 [ACK] Seq=39041 Ack=5181 Win=1452 Len=0 TSval=5954072 TSecr=5357705
  158 12.015866827  10.6.15.144 → 192.168.1.16 TCP 66 22 → 59298 [ACK] Seq=39041 Ack=5601 Win=1452 Len=0 TSval=5954073 TSecr=5357705
  159 12.016379759  10.6.15.144 → 192.168.1.16 TCP 66 22 → 59298 [ACK] Seq=39041 Ack=6481 Win=1452 Len=0 TSval=5954073 TSecr=5357706
  160 12.016947516  10.6.15.144 → 192.168.1.16 TCP 66 22 → 59298 [ACK] Seq=39041 Ack=7501 Win=1452 Len=0 TSval=5954073 TSecr=5357706
  161 12.023899601  10.6.15.144 → 192.168.1.16 TCP 66 22 → 59298 [ACK] Seq=39041 Ack=7725 Win=1452 Len=0 TSval=5954075 TSecr=5357707
  162 13.024552706  10.6.15.144 → 192.168.1.16 SSH 350 Server: Encrypted packet (len=284)
  163 13.024684084  10.6.15.144 → 192.168.1.16 SSH 526 Server: [TCP Previous segment not captured] , Encrypted packet (len=460)
  164 13.024689314 192.168.1.16 → 10.6.15.144  TCP 78 59298 → 22 [ACK] Seq=7725 Ack=39325 Win=5703 Len=0 TSval=5357960 TSecr=5954197 SLE=39665 SRE=40125
  165 13.024887540  10.6.15.144 → 192.168.1.16 SSH 350 Server: Encrypted packet (len=284)
  166 13.024895549 192.168.1.16 → 10.6.15.144  TCP 78 [TCP Dup ACK 164#1] 59298 → 22 [ACK] Seq=7725 Ack=39325 Win=5703 Len=0 TSval=5357960 TSecr=5954197 SLE=39665 SRE=40409
  167 14.016050714  10.6.15.144 → 192.168.1.16 SSH 334 Server: Encrypted packet (len=268)
  168 14.016070110 192.168.1.16 → 10.6.15.144  TCP 78 [TCP Dup ACK 164#2] 59298 → 22 [ACK] Seq=7725 Ack=39325 Win=5703 Len=0 TSval=5358208 TSecr=5954197 SLE=39665 SRE=40677
  169 14.016144769  10.6.15.144 → 192.168.1.16 SSH 166 Server: Encrypted packet (len=100)
  170 14.016153626 192.168.1.16 → 10.6.15.144  TCP 78 [TCP Dup ACK 164#3] 59298 → 22 [ACK] Seq=7725 Ack=39325 Win=5703 Len=0 TSval=5358208 TSecr=5954197 SLE=39665 SRE=40777
  171 14.016502273  10.6.15.144 → 192.168.1.16 SSH 1514 Server: Encrypted packet (len=1448)
  172 14.016509997 192.168.1.16 → 10.6.15.144  TCP 78 [TCP Dup ACK 164#4] 59298 → 22 [ACK] Seq=7725 Ack=39325 Win=5703 Len=0 TSval=5358208 TSecr=5954197 SLE=39665 SRE=42225
  173 14.026612065  10.6.15.144 → 192.168.1.16 SSH 406 Server: [TCP Fast Retransmission] , Encrypted packet (len=340)
  174 14.026638679 192.168.1.16 → 10.6.15.144  TCP 66 59298 → 22 [ACK] Seq=7725 Ack=42225 Win=5703 Len=0 TSval=5358211 TSecr=5954575
  175 14.026907972  10.6.15.144 → 192.168.1.16 SSH 1514 Server: Encrypted packet (len=1448)
  176 14.026914793 192.168.1.16 → 10.6.15.144  TCP 66 59298 → 22 [ACK] Seq=7725 Ack=43673 Win=5703 Len=0 TSval=5358211 TSecr=5954575
  177 14.027675131 192.168.1.16 → 10.6.15.144  SSH 206 Client: Encrypted packet (len=140)
  178 14.028250952 192.168.1.16 → 10.6.15.144  SSH 186 Client: Encrypted packet (len=120)
  179 14.031083632 192.168.1.16 → 10.6.15.144  SSH 430 Client: Encrypted packet (len=364)
  180 14.037517223  10.6.15.144 → 192.168.1.16 TCP 66 [TCP Previous segment not captured] 22 → 59298 [ACK] Seq=48017 Ack=7865 Win=1452 Len=0 TSval=5954578 TSecr=5358211
  181 14.038024669  10.6.15.144 → 192.168.1.16 TCP 66 22 → 59298 [ACK] Seq=48017 Ack=7985 Win=1452 Len=0 TSval=5954578 TSecr=5358211
  182 14.046564429  10.6.15.144 → 192.168.1.16 TCP 66 22 → 59298 [ACK] Seq=48017 Ack=8349 Win=1452 Len=0 TSval=5954579 TSecr=5358212
  183 15.009007470  10.6.15.144 → 192.168.1.16 SSH 1514 Server: Encrypted packet (len=1448)
  184 15.009025714 192.168.1.16 → 10.6.15.144  TCP 78 [TCP Dup ACK 176#1] 59298 → 22 [ACK] Seq=8349 Ack=43673 Win=5703 Len=0 TSval=5358456 TSecr=5954575 SLE=48017 SRE=49465
  185 15.019566272  10.6.15.144 → 192.168.1.16 TCP 1514 [TCP Retransmission] 22 → 59298 [ACK] Seq=43673 Ack=8349 Win=1452 Len=1448 TSval=5954823 TSecr=5358456
  186 15.019588106 192.168.1.16 → 10.6.15.144  TCP 78 59298 → 22 [ACK] Seq=8349 Ack=45121 Win=5703 Len=0 TSval=5358459 TSecr=5954823 SLE=48017 SRE=49465
  187 15.024838676  192.168.1.1 → 239.255.255.250 SSDP 302 NOTIFY * HTTP/1.1 
  188 15.027288827  192.168.1.1 → 239.255.255.250 SSDP 311 NOTIFY * HTTP/1.1 
  189 15.030042981  192.168.1.1 → 239.255.255.250 SSDP 374 NOTIFY * HTTP/1.1 
  190 15.034939022  192.168.1.1 → 239.255.255.250 SSDP 370 NOTIFY * HTTP/1.1 
  191 15.035463830  192.168.1.1 → 239.255.255.250 SSDP 350 NOTIFY * HTTP/1.1 
  192 15.038321883  192.168.1.1 → 239.255.255.250 SSDP 382 NOTIFY * HTTP/1.1 
  193 15.041043926  192.168.1.1 → 239.255.255.250 SSDP 364 NOTIFY * HTTP/1.1 
  194 15.043843748  192.168.1.1 → 239.255.255.250 SSDP 366 NOTIFY * HTTP/1.1 
  195 15.046107194  192.168.1.1 → 239.255.255.250 SSDP 302 NOTIFY * HTTP/1.1 
  196 15.048571092  192.168.1.1 → 239.255.255.250 SSDP 311 NOTIFY * HTTP/1.1 
  197 15.051359986  192.168.1.1 → 239.255.255.250 SSDP 374 NOTIFY * HTTP/1.1 
  198 15.054138847  192.168.1.1 → 239.255.255.250 SSDP 370 NOTIFY * HTTP/1.1 
  199 15.056753859  192.168.1.1 → 239.255.255.250 SSDP 350 NOTIFY * HTTP/1.1 
  200 15.059672282  192.168.1.1 → 239.255.255.250 SSDP 382 NOTIFY * HTTP/1.1 
  201 15.062418876  192.168.1.1 → 239.255.255.250 SSDP 364 NOTIFY * HTTP/1.1 
  202 15.065170113  192.168.1.1 → 239.255.255.250 SSDP 366 NOTIFY * HTTP/1.1 
  203 16.994054014  10.6.15.144 → 192.168.1.16 TCP 1514 [TCP Retransmission] 22 → 59298 [ACK] Seq=45121 Ack=8349 Win=1452 Len=1448 TSval=5955272 TSecr=5358459
  204 16.994073749 192.168.1.16 → 10.6.15.144  TCP 78 59298 → 22 [ACK] Seq=8349 Ack=46569 Win=5703 Len=0 TSval=5358953 TSecr=5955272 SLE=48017 SRE=49465
  205 17.004775108  10.6.15.144 → 192.168.1.16 TCP 1514 [TCP Retransmission] 22 → 59298 [ACK] Seq=46569 Ack=8349 Win=1452 Len=1448 TSval=5955320 TSecr=5358953
  206 17.004797514 192.168.1.16 → 10.6.15.144  TCP 66 59298 → 22 [ACK] Seq=8349 Ack=49465 Win=5703 Len=0 TSval=5358955 TSecr=5955320
  207 17.005294716  10.6.15.144 → 192.168.1.16 SSH 1514 Server: Encrypted packet (len=1448)
  208 17.005300583 192.168.1.16 → 10.6.15.144  TCP 66 59298 → 22 [ACK] Seq=8349 Ack=50913 Win=5703 Len=0 TSval=5358955 TSecr=5955320
  209 17.015613736  10.6.15.144 → 192.168.1.16 SSH 1514 Server: [TCP Previous segment not captured] , Encrypted packet (len=1448)
  210 17.015631962 192.168.1.16 → 10.6.15.144  TCP 78 [TCP Dup ACK 208#1] 59298 → 22 [ACK] Seq=8349 Ack=50913 Win=5703 Len=0 TSval=5358958 TSecr=5955320 SLE=52361 SRE=53809
  211 17.016220478  10.6.15.144 → 192.168.1.16 SSH 1514 Server: Encrypted packet (len=1448)
  212 17.016240476 192.168.1.16 → 10.6.15.144  TCP 78 [TCP Dup ACK 208#2] 59298 → 22 [ACK] Seq=8349 Ack=50913 Win=5703 Len=0 TSval=5358958 TSecr=5955320 SLE=52361 SRE=55257
  213 17.026005054  10.6.15.144 → 192.168.1.16 SSH 1514 Server: Encrypted packet (len=1448)
  214 17.026023327 192.168.1.16 → 10.6.15.144  TCP 78 [TCP Dup ACK 208#3] 59298 → 22 [ACK] Seq=8349 Ack=50913 Win=5703 Len=0 TSval=5358960 TSecr=5955320 SLE=52361 SRE=56705
  215 17.026599181  10.6.15.144 → 192.168.1.16 SSH 1514 Server: Encrypted packet (len=1448)
  216 17.026619452 192.168.1.16 → 10.6.15.144  TCP 78 [TCP Dup ACK 208#4] 59298 → 22 [ACK] Seq=8349 Ack=50913 Win=5703 Len=0 TSval=5358961 TSecr=5955320 SLE=52361 SRE=58153
  217 17.036319904  10.6.15.144 → 192.168.1.16 SSH 1514 Server: [TCP Fast Retransmission] , Encrypted packet (len=1448)
  218 17.036349360 192.168.1.16 → 10.6.15.144  TCP 66 59298 → 22 [ACK] Seq=8349 Ack=58153 Win=5703 Len=0 TSval=5358963 TSecr=5955328
  219 17.036990217  10.6.15.144 → 192.168.1.16 SSH 1514 Server: Encrypted packet (len=1448)
  220 17.036997134 192.168.1.16 → 10.6.15.144  TCP 66 59298 → 22 [ACK] Seq=8349 Ack=59601 Win=5703 Len=0 TSval=5358963 TSecr=5955328
  221 17.047500177  10.6.15.144 → 192.168.1.16 SSH 1514 Server: Encrypted packet (len=1448)
  222 17.047520289 192.168.1.16 → 10.6.15.144  TCP 66 59298 → 22 [ACK] Seq=8349 Ack=61049 Win=5703 Len=0 TSval=5358966 TSecr=5955330
  223 17.049081781  10.6.15.144 → 192.168.1.16 SSH 1514 Server: Encrypted packet (len=1448)
  224 17.049091048 192.168.1.16 → 10.6.15.144  TCP 66 59298 → 22 [ACK] Seq=8349 Ack=62497 Win=5703 Len=0 TSval=5358966 TSecr=5955330
  225 17.058118095  10.6.15.144 → 192.168.1.16 SSH 1514 Server: [TCP Previous segment not captured] , Encrypted packet (len=1448)
  226 17.058135633 192.168.1.16 → 10.6.15.144  TCP 78 [TCP Dup ACK 224#1] 59298 → 22 [ACK] Seq=8349 Ack=62497 Win=5703 Len=0 TSval=5358969 TSecr=5955330 SLE=63945 SRE=65393
  227 17.059561556  10.6.15.144 → 192.168.1.16 SSH 1514 Server: Encrypted packet (len=1448)
  228 17.059569377 192.168.1.16 → 10.6.15.144  TCP 78 [TCP Dup ACK 224#2] 59298 → 22 [ACK] Seq=8349 Ack=62497 Win=5703 Len=0 TSval=5358969 TSecr=5955330 SLE=63945 SRE=66841
  229 17.068398853  10.6.15.144 → 192.168.1.16 SSH 1514 Server: Encrypted packet (len=1448)
  230 17.068410635 192.168.1.16 → 10.6.15.144  TCP 78 [TCP Dup ACK 224#3] 59298 → 22 [ACK] Seq=8349 Ack=62497 Win=5703 Len=0 TSval=5358971 TSecr=5955330 SLE=63945 SRE=68289
  231 17.069789733  10.6.15.144 → 192.168.1.16 SSH 1514 Server: Encrypted packet (len=1448)
  232 17.069809602 192.168.1.16 → 10.6.15.144  TCP 78 [TCP Dup ACK 224#4] 59298 → 22 [ACK] Seq=8349 Ack=62497 Win=5703 Len=0 TSval=5358971 TSecr=5955330 SLE=63945 SRE=69737
  233 17.080224081  10.6.15.144 → 192.168.1.16 SSH 1514 Server: Encrypted packet (len=1448)
  234 17.080243967 192.168.1.16 → 10.6.15.144  TCP 78 [TCP Dup ACK 224#5] 59298 → 22 [ACK] Seq=8349 Ack=62497 Win=5703 Len=0 TSval=5358974 TSecr=5955330 SLE=63945 SRE=71185
  235 17.092901904  10.6.15.144 → 192.168.1.16 SSH 1514 Server: [TCP Fast Retransmission] , Encrypted packet (len=1448)
  236 17.092931014 192.168.1.16 → 10.6.15.144  TCP 66 59298 → 22 [ACK] Seq=8349 Ack=71185 Win=5703 Len=0 TSval=5358977 TSecr=5955342
  237 17.093431760  10.6.15.144 → 192.168.1.16 SSH 1514 Server: Encrypted packet (len=1448)
  238 17.093438981 192.168.1.16 → 10.6.15.144  TCP 66 59298 → 22 [ACK] Seq=8349 Ack=72633 Win=5703 Len=0 TSval=5358977 TSecr=5955342
  239 17.103206586  10.6.15.144 → 192.168.1.16 SSH 1514 Server: Encrypted packet (len=1448)
  240 17.103223743 192.168.1.16 → 10.6.15.144  TCP 66 59298 → 22 [ACK] Seq=8349 Ack=74081 Win=5703 Len=0 TSval=5358980 TSecr=5955344
  241 17.103761698  10.6.15.144 → 192.168.1.16 SSH 1514 Server: Encrypted packet (len=1448)
  242 17.103771963 192.168.1.16 → 10.6.15.144  TCP 66 59298 → 22 [ACK] Seq=8349 Ack=75529 Win=5703 Len=0 TSval=5358980 TSecr=5955344
  243 17.104362161  10.6.15.144 → 192.168.1.16 SSH 1514 Server: Encrypted packet (len=1448)
  244 17.104370919 192.168.1.16 → 10.6.15.144  TCP 66 59298 → 22 [ACK] Seq=8349 Ack=76977 Win=5703 Len=0 TSval=5358980 TSecr=5955344
  245 17.114889950  10.6.15.144 → 192.168.1.16 SSH 1514 Server: Encrypted packet (len=1448)
  246 17.114908514 192.168.1.16 → 10.6.15.144  TCP 66 59298 → 22 [ACK] Seq=8349 Ack=78425 Win=5703 Len=0 TSval=5358983 TSecr=5955347
  247 17.116635760  10.6.15.144 → 192.168.1.16 SSH 1514 Server: Encrypted packet (len=1448)
  248 17.116652700 192.168.1.16 → 10.6.15.144  TCP 66 59298 → 22 [ACK] Seq=8349 Ack=79873 Win=5703 Len=0 TSval=5358983 TSecr=5955347
  249 17.117659996  10.6.15.144 → 192.168.1.16 SSH 1514 Server: Encrypted packet (len=1448)
  250 17.117665958 192.168.1.16 → 10.6.15.144  TCP 66 59298 → 22 [ACK] Seq=8349 Ack=81321 Win=5703 Len=0 TSval=5358983 TSecr=5955347
  251 17.130927114  10.6.15.144 → 192.168.1.16 SSH 1514 Server: Encrypted packet (len=1448)
  252 17.130945598 192.168.1.16 → 10.6.15.144  TCP 66 59298 → 22 [ACK] Seq=8349 Ack=82769 Win=5703 Len=0 TSval=5358987 TSecr=5955350
  253 17.131519128  10.6.15.144 → 192.168.1.16 SSH 1514 Server: Encrypted packet (len=1448)
  254 17.131537613 192.168.1.16 → 10.6.15.144  TCP 66 59298 → 22 [ACK] Seq=8349 Ack=84217 Win=5703 Len=0 TSval=5358987 TSecr=5955350
  255 17.135809847  10.6.15.144 → 192.168.1.16 SSH 1514 Server: Encrypted packet (len=1448)
  256 17.135822976 192.168.1.16 → 10.6.15.144  TCP 66 59298 → 22 [ACK] Seq=8349 Ack=85665 Win=5703 Len=0 TSval=5358988 TSecr=5955350
  257 17.136097759 192.168.1.16 → 10.6.15.144  SSH 138 Client: Encrypted packet (len=72)
  258 17.142086461  10.6.15.144 → 192.168.1.16 SSH 1514 Server: Encrypted packet (len=1448)
  259 17.144056470  10.6.15.144 → 192.168.1.16 SSH 1514 Server: Encrypted packet (len=1448)
  260 17.144064999 192.168.1.16 → 10.6.15.144  TCP 66 59298 → 22 [ACK] Seq=8421 Ack=88561 Win=5703 Len=0 TSval=5358990 TSecr=5955354
  261 17.146205002  10.6.15.144 → 192.168.1.16 SSH 1514 Server: Encrypted packet (len=1448)
  262 17.146783631  10.6.15.144 → 192.168.1.16 SSH 1514 Server: Encrypted packet (len=1448)
  263 17.146801200 192.168.1.16 → 10.6.15.144  TCP 66 59298 → 22 [ACK] Seq=8421 Ack=91457 Win=5703 Len=0 TSval=5358991 TSecr=5955355
  264 17.147104710  10.6.15.144 → 192.168.1.16 TCP 66 22 → 59298 [ACK] Seq=91457 Ack=8421 Win=1452 Len=0 TSval=5955355 TSecr=5358988
  265 17.154462954  10.6.15.144 → 192.168.1.16 SSH 1514 Server: Encrypted packet (len=1448)
  266 17.155005579  10.6.15.144 → 192.168.1.16 SSH 1514 Server: Encrypted packet (len=1448)
  267 17.155022548 192.168.1.16 → 10.6.15.144  TCP 66 59298 → 22 [ACK] Seq=8421 Ack=94353 Win=5703 Len=0 TSval=5358993 TSecr=5955357
  268 17.159920424  10.6.15.144 → 192.168.1.16 SSH 1514 Server: Encrypted packet (len=1448)
  269 17.160478582  10.6.15.144 → 192.168.1.16 SSH 1514 Server: Encrypted packet (len=1448)
  270 17.160497099 192.168.1.16 → 10.6.15.144  TCP 66 59298 → 22 [ACK] Seq=8421 Ack=97249 Win=5703 Len=0 TSval=5358994 TSecr=5955358
  271 17.165333092  10.6.15.144 → 192.168.1.16 SSH 1514 Server: Encrypted packet (len=1448)
  272 17.170764105  10.6.15.144 → 192.168.1.16 SSH 1514 Server: [TCP Previous segment not captured] , Encrypted packet (len=1448)
  273 17.170781765 192.168.1.16 → 10.6.15.144  TCP 78 59298 → 22 [ACK] Seq=8421 Ack=98697 Win=5703 Len=0 TSval=5358997 TSecr=5955360 SLE=100145 SRE=101593
  274 17.181193793  10.6.15.144 → 192.168.1.16 SSH 1514 Server: [TCP Previous segment not captured] , Encrypted packet (len=1448)
  275 17.181210521 192.168.1.16 → 10.6.15.144  TCP 86 [TCP Dup ACK 273#1] 59298 → 22 [ACK] Seq=8421 Ack=98697 Win=5703 Len=0 TSval=5358999 TSecr=5955360 SLE=103041 SRE=104489 SLE=100145 SRE=101593
  276 17.181373785  10.6.15.144 → 192.168.1.16 SSH 1514 Server: Encrypted packet (len=1448)
  277 17.181382154 192.168.1.16 → 10.6.15.144  TCP 86 [TCP Dup ACK 273#2] 59298 → 22 [ACK] Seq=8421 Ack=98697 Win=5703 Len=0 TSval=5358999 TSecr=5955360 SLE=103041 SRE=105937 SLE=100145 SRE=101593
  278 19.008069425  10.6.15.144 → 192.168.1.16 TCP 1514 [TCP Retransmission] 22 → 59298 [ACK] Seq=98697 Ack=8421 Win=1452 Len=1448 TSval=5955452 TSecr=5358999
  279 19.008098337 192.168.1.16 → 10.6.15.144  TCP 78 59298 → 22 [ACK] Seq=8421 Ack=101593 Win=5703 Len=0 TSval=5359456 TSecr=5955452 SLE=103041 SRE=105937
  280 19.008192323  10.6.15.144 → 192.168.1.16 SSH 1514 Server: [TCP Spurious Retransmission] , Encrypted packet (len=1448)
  281 19.008196541 192.168.1.16 → 10.6.15.144  TCP 86 [TCP Dup ACK 279#1] 59298 → 22 [ACK] Seq=8421 Ack=101593 Win=5703 Len=0 TSval=5359456 TSecr=5955452 SLE=98697 SRE=100145 SLE=103041 SRE=105937
  282 19.018956243  10.6.15.144 → 192.168.1.16 SSH 1514 Server: [TCP Previous segment not captured] , Encrypted packet (len=1448)
  283 19.018973490 192.168.1.16 → 10.6.15.144  TCP 86 [TCP Dup ACK 279#2] 59298 → 22 [ACK] Seq=8421 Ack=101593 Win=5703 Len=0 TSval=5359459 TSecr=5955452 SLE=107385 SRE=108833 SLE=103041 SRE=105937
  284 19.019138812  10.6.15.144 → 192.168.1.16 SSH 1514 Server: Encrypted packet (len=1448)
  285 19.019146789 192.168.1.16 → 10.6.15.144  TCP 86 [TCP Dup ACK 279#3] 59298 → 22 [ACK] Seq=8421 Ack=101593 Win=5703 Len=0 TSval=5359459 TSecr=5955452 SLE=107385 SRE=110281 SLE=103041 SRE=105937
  286 19.029650820  10.6.15.144 → 192.168.1.16 SSH 1514 Server: [TCP Fast Retransmission] , Encrypted packet (len=1448)
  287 19.029672935 192.168.1.16 → 10.6.15.144  TCP 78 59298 → 22 [ACK] Seq=8421 Ack=105937 Win=5703 Len=0 TSval=5359461 TSecr=5955826 SLE=107385 SRE=110281
  288 19.029828993  10.6.15.144 → 192.168.1.16 SSH 1514 Server: Encrypted packet (len=1448)
  289 19.029837071 192.168.1.16 → 10.6.15.144  TCP 78 [TCP Dup ACK 287#1] 59298 → 22 [ACK] Seq=8421 Ack=105937 Win=5703 Len=0 TSval=5359461 TSecr=5955826 SLE=107385 SRE=111729
  290 20.992168623  10.6.15.144 → 192.168.1.16 TCP 1514 [TCP Retransmission] 22 → 59298 [ACK] Seq=105937 Ack=8421 Win=1452 Len=1448 TSval=5956231 TSecr=5359461
  291 20.992197872 192.168.1.16 → 10.6.15.144  TCP 66 59298 → 22 [ACK] Seq=8421 Ack=111729 Win=5703 Len=0 TSval=5359952 TSecr=5956231
  292 20.992524445 192.168.1.16 → 10.6.15.144  SSH 138 Client: Encrypted packet (len=72)
  293 21.002701524  10.6.15.144 → 192.168.1.16 SSH 1514 Server: Encrypted packet (len=1448)
  294 21.002828891  10.6.15.144 → 192.168.1.16 SSH 1514 Server: [TCP Previous segment not captured] , Encrypted packet (len=1448)
  295 21.002835537 192.168.1.16 → 10.6.15.144  TCP 78 59298 → 22 [ACK] Seq=8493 Ack=113177 Win=5703 Len=0 TSval=5359955 TSecr=5956319 SLE=114625 SRE=116073
  296 21.009743233 192.168.1.16 → 10.6.15.144  SSH 1514 Client: Encrypted packet (len=1436)
  297 21.010409077 192.168.1.16 → 10.6.15.144  SSH 342 Client: Encrypted packet (len=264)
  298 21.013227781  10.6.15.144 → 192.168.1.16 SSH 1514 Server: Encrypted packet (len=1448)
  299 21.013258309 192.168.1.16 → 10.6.15.144  TCP 78 [TCP Dup ACK 295#1] 59298 → 22 [ACK] Seq=10193 Ack=113177 Win=5703 Len=0 TSval=5359957 TSecr=5956319 SLE=114625 SRE=117521
  300 21.013367505  10.6.15.144 → 192.168.1.16 SSH 1514 Server: Encrypted packet (len=1448)
  301 21.013380104 192.168.1.16 → 10.6.15.144  TCP 78 [TCP Dup ACK 295#2] 59298 → 22 [ACK] Seq=10193 Ack=113177 Win=5703 Len=0 TSval=5359957 TSecr=5956319 SLE=114625 SRE=118969
  302 21.020501765  10.6.15.144 → 192.168.1.16 TCP 66 22 → 59298 [ACK] Seq=118969 Ack=10193 Win=1452 Len=0 TSval=5956324 TSecr=5359956
  303 21.024940749  10.6.15.144 → 192.168.1.16 SSH 1514 Server: Encrypted packet (len=1448)
  304 21.024960590 192.168.1.16 → 10.6.15.144  TCP 78 [TCP Dup ACK 295#3] 59298 → 22 [ACK] Seq=10193 Ack=113177 Win=5703 Len=0 TSval=5359960 TSecr=5956319 SLE=114625 SRE=120417
  305 21.025097334  10.6.15.144 → 192.168.1.16 SSH 1514 Server: [TCP Fast Retransmission] , Encrypted packet (len=1448)
  306 21.025113830 192.168.1.16 → 10.6.15.144  TCP 66 59298 → 22 [ACK] Seq=10193 Ack=120417 Win=5703 Len=0 TSval=5359960 TSecr=5956324
  307 21.035406206  10.6.15.144 → 192.168.1.16 SSH 1514 Server: Encrypted packet (len=1448)
  308 21.035422043 192.168.1.16 → 10.6.15.144  TCP 66 59298 → 22 [ACK] Seq=10193 Ack=121865 Win=5703 Len=0 TSval=5359963 TSecr=5956327
  309 21.035733231  10.6.15.144 → 192.168.1.16 SSH 1514 Server: Encrypted packet (len=1448)
  310 21.035740494 192.168.1.16 → 10.6.15.144  TCP 66 59298 → 22 [ACK] Seq=10193 Ack=123313 Win=5703 Len=0 TSval=5359963 TSecr=5956327
  311 21.045743807  10.6.15.144 → 192.168.1.16 SSH 1514 Server: Encrypted packet (len=1448)
  312 21.045755914 192.168.1.16 → 10.6.15.144  TCP 66 59298 → 22 [ACK] Seq=10193 Ack=124761 Win=5703 Len=0 TSval=5359965 TSecr=5956330
  313 21.045895046  10.6.15.144 → 192.168.1.16 SSH 1514 Server: Encrypted packet (len=1448)
  314 21.045899538 192.168.1.16 → 10.6.15.144  TCP 66 59298 → 22 [ACK] Seq=10193 Ack=126209 Win=5703 Len=0 TSval=5359965 TSecr=5956330
  315 21.046101507  10.6.15.144 → 192.168.1.16 SSH 1514 Server: Encrypted packet (len=1448)
  316 21.046110886 192.168.1.16 → 10.6.15.144  TCP 66 59298 → 22 [ACK] Seq=10193 Ack=127657 Win=5703 Len=0 TSval=5359966 TSecr=5956330
  317 21.055501685  10.6.15.144 → 192.168.1.16 SSH 1514 Server: Encrypted packet (len=1448)
  318 21.055518868 192.168.1.16 → 10.6.15.144  TCP 66 59298 → 22 [ACK] Seq=10193 Ack=129105 Win=5703 Len=0 TSval=5359968 TSecr=5956333
  319 21.055621337  10.6.15.144 → 192.168.1.16 SSH 1514 Server: Encrypted packet (len=1448)
  320 21.055625751 192.168.1.16 → 10.6.15.144  TCP 66 59298 → 22 [ACK] Seq=10193 Ack=130553 Win=5703 Len=0 TSval=5359968 TSecr=5956333
  321 21.055846301  10.6.15.144 → 192.168.1.16 SSH 1514 Server: Encrypted packet (len=1448)
  322 21.055853375 192.168.1.16 → 10.6.15.144  TCP 66 59298 → 22 [ACK] Seq=10193 Ack=132001 Win=5703 Len=0 TSval=5359968 TSecr=5956333
  323 21.066506938  10.6.15.144 → 192.168.1.16 SSH 1514 Server: Encrypted packet (len=1448)
  324 21.066525509 192.168.1.16 → 10.6.15.144  TCP 66 59298 → 22 [ACK] Seq=10193 Ack=133449 Win=5703 Len=0 TSval=5359971 TSecr=5956335
  325 21.066629999  10.6.15.144 → 192.168.1.16 SSH 1514 Server: Encrypted packet (len=1448)
  326 21.066634315 192.168.1.16 → 10.6.15.144  TCP 66 59298 → 22 [ACK] Seq=10193 Ack=134897 Win=5703 Len=0 TSval=5359971 TSecr=5956335
  327 21.067041461  10.6.15.144 → 192.168.1.16 SSH 1514 Server: Encrypted packet (len=1448)
  328 21.067059579 192.168.1.16 → 10.6.15.144  TCP 66 59298 → 22 [ACK] Seq=10193 Ack=136345 Win=5703 Len=0 TSval=5359971 TSecr=5956335
  329 21.077636522  10.6.15.144 → 192.168.1.16 SSH 1514 Server: Encrypted packet (len=1448)
  330 21.077652630 192.168.1.16 → 10.6.15.144  TCP 66 59298 → 22 [ACK] Seq=10193 Ack=137793 Win=5703 Len=0 TSval=5359973 TSecr=5956338
  331 21.077799914  10.6.15.144 → 192.168.1.16 SSH 1514 Server: Encrypted packet (len=1448)
  332 21.077805851 192.168.1.16 → 10.6.15.144  TCP 66 59298 → 22 [ACK] Seq=10193 Ack=139241 Win=5703 Len=0 TSval=5359973 TSecr=5956338
  333 21.088618947  10.6.15.144 → 192.168.1.16 SSH 1514 Server: [TCP Previous segment not captured] , Encrypted packet (len=1448)
  334 21.088637597 192.168.1.16 → 10.6.15.144  TCP 78 [TCP Dup ACK 332#1] 59298 → 22 [ACK] Seq=10193 Ack=139241 Win=5703 Len=0 TSval=5359976 TSecr=5956338 SLE=140689 SRE=142137
  335 21.088810225  10.6.15.144 → 192.168.1.16 SSH 1514 Server: Encrypted packet (len=1448)
  336 21.088830829 192.168.1.16 → 10.6.15.144  TCP 78 [TCP Dup ACK 332#2] 59298 → 22 [ACK] Seq=10193 Ack=139241 Win=5703 Len=0 TSval=5359976 TSecr=5956338 SLE=140689 SRE=143585
  337 21.099353556  10.6.15.144 → 192.168.1.16 SSH 1514 Server: Encrypted packet (len=1448)
  338 21.099371373 192.168.1.16 → 10.6.15.144  TCP 78 [TCP Dup ACK 332#3] 59298 → 22 [ACK] Seq=10193 Ack=139241 Win=5703 Len=0 TSval=5359979 TSecr=5956338 SLE=140689 SRE=145033
  339 21.099534895  10.6.15.144 → 192.168.1.16 SSH 1514 Server: Encrypted packet (len=1448)
  340 21.099538878 192.168.1.16 → 10.6.15.144  TCP 78 [TCP Dup ACK 332#4] 59298 → 22 [ACK] Seq=10193 Ack=139241 Win=5703 Len=0 TSval=5359979 TSecr=5956338 SLE=140689 SRE=146481
  341 21.099725843  10.6.15.144 → 192.168.1.16 SSH 1514 Server: Encrypted packet (len=1448)
  342 21.099729525 192.168.1.16 → 10.6.15.144  TCP 78 [TCP Dup ACK 332#5] 59298 → 22 [ACK] Seq=10193 Ack=139241 Win=5703 Len=0 TSval=5359979 TSecr=5956338 SLE=140689 SRE=147929
  343 21.111021782  10.6.15.144 → 192.168.1.16 SSH 1514 Server: [TCP Fast Retransmission] , Encrypted packet (len=1448)
  344 21.111046954 192.168.1.16 → 10.6.15.144  TCP 66 59298 → 22 [ACK] Seq=10193 Ack=147929 Win=5703 Len=0 TSval=5359982 TSecr=5956346
  345 21.111144460  10.6.15.144 → 192.168.1.16 SSH 1514 Server: Encrypted packet (len=1448)
  346 21.111149912 192.168.1.16 → 10.6.15.144  TCP 66 59298 → 22 [ACK] Seq=10193 Ack=149377 Win=5703 Len=0 TSval=5359982 TSecr=5956346
