    1 0.000000000 192.168.1.16 → 91.189.94.4  NTP 90 NTP Version 4, client
    2 0.001886555  10.6.15.144 → 192.168.1.16 SSH 110 Server: Encrypted packet (len=44)
    3 0.001903235 192.168.1.16 → 10.6.15.144  TCP 66 59298 → 22 [ACK] Seq=1 Ack=45 Win=5703 Len=0 TSval=5385377 TSecr=5981616
    4 0.001911258  10.22.18.98 → 224.0.0.252  LLMNR 64 Standard query 0x37a0 A wpad
    5 0.001921795  10.22.18.98 → 224.0.0.252  LLMNR 64 Standard query 0xc89f A wpad
    6 0.001925880  10.6.15.144 → 192.168.1.16 SSH 110 Server: [TCP Spurious Retransmission] , Encrypted packet (len=44)
    7 0.001930246 192.168.1.16 → 10.6.15.144  TCP 78 [TCP Dup ACK 3#1] 59298 → 22 [ACK] Seq=1 Ack=45 Win=5703 Len=0 TSval=5385377 TSecr=5981681 SLE=1 SRE=45
    8 0.002142919  10.6.15.144 → 192.168.1.16 SSH 1514 Server: Encrypted packet (len=1448)
    9 0.002151303 192.168.1.16 → 10.6.15.144  TCP 66 59298 → 22 [ACK] Seq=1 Ack=1493 Win=5703 Len=0 TSval=5385378 TSecr=5981697
   10 0.002261749 192.168.1.16 → 10.6.15.144  SSH 158 Client: Encrypted packet (len=92)
   11 0.003226418  10.6.15.144 → 192.168.1.16 SSH 1514 Server: [TCP Previous segment not captured] , Encrypted packet (len=1448)
   12 0.003246336 192.168.1.16 → 10.6.15.144  TCP 78 [TCP Dup ACK 9#1] 59298 → 22 [ACK] Seq=93 Ack=1493 Win=5703 Len=0 TSval=5385378 TSecr=5981697 SLE=2873 SRE=4321
   13 0.003419424  10.6.15.144 → 192.168.1.16 SSH 1514 Server: Encrypted packet (len=1448)
   14 0.003440288 192.168.1.16 → 10.6.15.144  TCP 78 [TCP Dup ACK 9#2] 59298 → 22 [ACK] Seq=93 Ack=1493 Win=5703 Len=0 TSval=5385378 TSecr=5981697 SLE=2873 SRE=5769
   15 0.012993876  10.6.15.144 → 192.168.1.16 SSH 1514 Server: Encrypted packet (len=1448)
   16 0.013019831 192.168.1.16 → 10.6.15.144  TCP 78 [TCP Dup ACK 9#3] 59298 → 22 [ACK] Seq=93 Ack=1493 Win=5703 Len=0 TSval=5385380 TSecr=5981697 SLE=2873 SRE=7217
   17 0.013183691  10.6.15.144 → 192.168.1.16 SSH 1514 Server: Encrypted packet (len=1448)
   18 0.013192162 192.168.1.16 → 10.6.15.144  TCP 78 [TCP Dup ACK 9#4] 59298 → 22 [ACK] Seq=93 Ack=1493 Win=5703 Len=0 TSval=5385380 TSecr=5981697 SLE=2873 SRE=8665
   19 0.013199617  10.6.15.144 → 192.168.1.16 TCP 66 22 → 59298 [ACK] Seq=8665 Ack=93 Win=1452 Len=0 TSval=5981745 TSecr=5385378
   20 0.016708328  10.6.15.144 → 192.168.1.16 SSH 1514 Server: Encrypted packet (len=1448)
   21 0.016726241 192.168.1.16 → 10.6.15.144  TCP 78 [TCP Dup ACK 9#5] 59298 → 22 [ACK] Seq=93 Ack=1493 Win=5703 Len=0 TSval=5385381 TSecr=5981697 SLE=2873 SRE=10113
   22 0.017027534  10.6.15.144 → 192.168.1.16 SSH 1514 Server: Encrypted packet (len=1448)
   23 0.017036454 192.168.1.16 → 10.6.15.144  TCP 78 [TCP Dup ACK 9#6] 59298 → 22 [ACK] Seq=93 Ack=1493 Win=5703 Len=0 TSval=5385381 TSecr=5981697 SLE=2873 SRE=11561
   24 0.023919885  10.6.15.144 → 192.168.1.16 SSH 1446 Server: [TCP Fast Retransmission] , Encrypted packet (len=1380)
   25 0.023943209 192.168.1.16 → 10.6.15.144  TCP 66 59298 → 22 [ACK] Seq=93 Ack=11561 Win=5703 Len=0 TSval=5385383 TSecr=5981748
   26 0.024199556 192.168.1.16 → 10.6.15.144  SSH 102 Client: Encrypted packet (len=36)
   27 0.029089743  10.6.15.144 → 192.168.1.16 SSH 1514 Server: [TCP Previous segment not captured] , Encrypted packet (len=1448)
   28 0.029115495 192.168.1.16 → 10.6.15.144  TCP 78 [TCP Dup ACK 25#1] 59298 → 22 [ACK] Seq=129 Ack=11561 Win=5703 Len=0 TSval=5385384 TSecr=5981748 SLE=13009 SRE=14457
   29 0.034267277  10.6.15.144 → 192.168.1.16 SSH 1514 Server: Encrypted packet (len=1448)
   30 0.034292796 192.168.1.16 → 10.6.15.144  TCP 78 [TCP Dup ACK 25#2] 59298 → 22 [ACK] Seq=129 Ack=11561 Win=5703 Len=0 TSval=5385386 TSecr=5981748 SLE=13009 SRE=15905
   31 0.039454230  10.6.15.144 → 192.168.1.16 SSH 1514 Server: Encrypted packet (len=1448)
   32 0.039479766 192.168.1.16 → 10.6.15.144  TCP 78 [TCP Dup ACK 25#3] 59298 → 22 [ACK] Seq=129 Ack=11561 Win=5703 Len=0 TSval=5385387 TSecr=5981748 SLE=13009 SRE=17353
   33 0.044763825  10.6.15.144 → 192.168.1.16 SSH 1514 Server: Encrypted packet (len=1448)
   34 0.044786879 192.168.1.16 → 10.6.15.144  TCP 78 [TCP Dup ACK 25#4] 59298 → 22 [ACK] Seq=129 Ack=11561 Win=5703 Len=0 TSval=5385388 TSecr=5981748 SLE=13009 SRE=18801
   35 0.050562743  10.6.15.144 → 192.168.1.16 SSH 1514 Server: [TCP Fast Retransmission] , Encrypted packet (len=1448)
   36 0.050591856 192.168.1.16 → 10.6.15.144  TCP 66 59298 → 22 [ACK] Seq=129 Ack=18801 Win=5703 Len=0 TSval=5385390 TSecr=5981754
   37 0.055323651  10.6.15.144 → 192.168.1.16 SSH 1514 Server: Encrypted packet (len=1448)
   38 0.055345401 192.168.1.16 → 10.6.15.144  TCP 66 59298 → 22 [ACK] Seq=129 Ack=20249 Win=5703 Len=0 TSval=5385391 TSecr=5981756
   39 0.061084070  10.6.15.144 → 192.168.1.16 SSH 1514 Server: Encrypted packet (len=1448)
   40 0.061105671 192.168.1.16 → 10.6.15.144  TCP 66 59298 → 22 [ACK] Seq=129 Ack=21697 Win=5703 Len=0 TSval=5385392 TSecr=5981757
   41 0.067681214  10.6.15.144 → 192.168.1.16 SSH 1514 Server: Encrypted packet (len=1448)
   42 0.067700652 192.168.1.16 → 10.6.15.144  TCP 66 59298 → 22 [ACK] Seq=129 Ack=23145 Win=5703 Len=0 TSval=5385394 TSecr=5981758
   43 0.067865536  10.6.15.144 → 192.168.1.16 SSH 1514 Server: Encrypted packet (len=1448)
   44 0.067870041 192.168.1.16 → 10.6.15.144  TCP 66 59298 → 22 [ACK] Seq=129 Ack=24593 Win=5703 Len=0 TSval=5385394 TSecr=5981758
   45 0.071579130  10.6.15.144 → 192.168.1.16 SSH 1514 Server: Encrypted packet (len=1448)
   46 0.071597717 192.168.1.16 → 10.6.15.144  TCP 66 59298 → 22 [ACK] Seq=129 Ack=26041 Win=5703 Len=0 TSval=5385395 TSecr=5981760
   47 0.078587137  10.6.15.144 → 192.168.1.16 SSH 1514 Server: Encrypted packet (len=1448)
   48 0.078608276 192.168.1.16 → 10.6.15.144  TCP 66 59298 → 22 [ACK] Seq=129 Ack=27489 Win=5703 Len=0 TSval=5385397 TSecr=5981762
   49 0.081803368  10.6.15.144 → 192.168.1.16 SSH 538 Server: [TCP Previous segment not captured] , Encrypted packet (len=472)
   50 0.081826848 192.168.1.16 → 10.6.15.144  TCP 78 [TCP Dup ACK 48#1] 59298 → 22 [ACK] Seq=129 Ack=27489 Win=5703 Len=0 TSval=5385397 TSecr=5981762 SLE=28937 SRE=29409
   51 0.111883811 192.168.1.16 → 10.6.15.144  SSH 114 Client: Encrypted packet (len=36)
   52 0.158502696  10.6.15.144 → 192.168.1.16 TCP 66 22 → 59298 [ACK] Seq=29409 Ack=165 Win=1452 Len=0 TSval=5981783 TSecr=5385405
   53 0.190566620  10.22.18.98 → 224.0.0.252  LLMNR 72 Standard query 0x7d87 A hkuzqrosmrpe
   54 0.197588092  10.22.18.98 → 224.0.0.252  LLMNR 74 Standard query 0xa99d A wlblhxhwhgfrdq
   55 0.197714250  10.22.18.98 → 224.0.0.252  LLMNR 70 Standard query 0x42d6 A yfhlyvsesk
   56 0.274620748 192.168.1.16 → 10.6.15.144  SSH 250 Client: Encrypted packet (len=172)
   57 0.283874700  10.6.15.144 → 192.168.1.16 TCP 66 22 → 59298 [ACK] Seq=29409 Ack=337 Win=1452 Len=0 TSval=5981813 TSecr=5385446
   58 0.313962105 192.168.1.16 → 54.76.71.168 TCP 66 42414 → 8282 [ACK] Seq=1 Ack=1 Win=296 Len=0 TSval=5385456 TSecr=609485926
   59 0.336564212  10.6.15.144 → 192.168.1.16 SSH 110 Server: Encrypted packet (len=44)
   60 0.336580626 192.168.1.16 → 10.6.15.144  TCP 78 [TCP Dup ACK 48#2] 59298 → 22 [ACK] Seq=337 Ack=27489 Win=5703 Len=0 TSval=5385461 TSecr=5981762 SLE=28937 SRE=29453
   61 0.376908684 192.168.1.16 → 10.6.15.144  SSH 186 Client: Encrypted packet (len=108)
   62 0.378169131 192.168.1.16 → 10.6.15.144  SSH 154 Client: Encrypted packet (len=76)
   63 0.386650915  10.6.15.144 → 192.168.1.16 TCP 66 22 → 59298 [ACK] Seq=29453 Ack=445 Win=1452 Len=0 TSval=5981839 TSecr=5385471
   64 0.473030084 54.76.71.168 → 192.168.1.16 TCP 66 [TCP ACKed unseen segment] 8282 → 42414 [ACK] Seq=1 Ack=2 Win=121 Len=0 TSval=609497430 TSecr=5361832
   65 0.473939375  10.6.15.144 → 192.168.1.16 TCP 1514 [TCP Retransmission] 22 → 59298 [ACK] Seq=27489 Ack=445 Win=1452 Len=1448 TSval=5981861 TSecr=5385471
   66 0.473966845 192.168.1.16 → 10.6.15.144  TCP 66 59298 → 22 [ACK] Seq=521 Ack=29453 Win=5703 Len=0 TSval=5385496 TSecr=5981861
   67 0.474341601 192.168.1.16 → 10.6.15.144  SSH 190 Client: Encrypted packet (len=124)
   68 0.512547899  10.6.15.144 → 192.168.1.16 TCP 78 [TCP Dup ACK 63#1] 22 → 59298 [ACK] Seq=29453 Ack=445 Win=1452 Len=0 TSval=5981870 TSecr=5385471 SLE=521 SRE=645
   69 0.601963388 192.168.1.16 → 10.6.15.144  TCP 142 [TCP Retransmission] 59298 → 22 [PSH, ACK] Seq=445 Ack=29453 Win=5703 Len=76 TSval=5385528 TSecr=5981870
   70 0.607730439  10.6.15.144 → 192.168.1.16 SSH 162 Server: Encrypted packet (len=84)
   71 0.609146532  10.6.15.144 → 192.168.1.16 SSH 1514 Server: Encrypted packet (len=1436)
   72 0.609164242 192.168.1.16 → 10.6.15.144  TCP 66 59298 → 22 [ACK] Seq=645 Ack=30973 Win=5703 Len=0 TSval=5385529 TSecr=5981894
   73 0.609178069  10.6.15.144 → 192.168.1.16 SSH 134 Server: Encrypted packet (len=56)
   74 0.609287029  10.22.18.98 → 224.0.0.252  LLMNR 72 Standard query 0x7d87 A hkuzqrosmrpe
   75 0.612149199  10.22.18.98 → 224.0.0.252  LLMNR 74 Standard query 0xa99d A wlblhxhwhgfrdq
   76 0.612167548  10.6.15.144 → 192.168.1.16 TCP 66 22 → 59298 [ACK] Seq=31029 Ack=645 Win=1452 Len=0 TSval=5981895 TSecr=5385528
   77 0.612848281  10.22.18.98 → 224.0.0.252  LLMNR 70 Standard query 0x42d6 A yfhlyvsesk
   78 0.618663490  10.6.15.144 → 192.168.1.16 SSH 1514 Server: Encrypted packet (len=1448)
   79 0.618680133 192.168.1.16 → 10.6.15.144  TCP 66 59298 → 22 [ACK] Seq=645 Ack=32477 Win=5703 Len=0 TSval=5385532 TSecr=5981894
   80 0.618835884  10.6.15.144 → 192.168.1.16 SSH 1514 Server: Encrypted packet (len=1448)
   81 0.630647796  10.6.15.144 → 192.168.1.16 SSH 1514 Server: Encrypted packet (len=1448)
   82 0.630669490 192.168.1.16 → 10.6.15.144  TCP 66 59298 → 22 [ACK] Seq=645 Ack=35373 Win=5703 Len=0 TSval=5385535 TSecr=5981897
   83 0.641343185  10.6.15.144 → 192.168.1.16 SSH 1514 Server: [TCP Previous segment not captured] , Encrypted packet (len=1448)
   84 0.641365559 192.168.1.16 → 10.6.15.144  TCP 78 [TCP Dup ACK 82#1] 59298 → 22 [ACK] Seq=645 Ack=35373 Win=5703 Len=0 TSval=5385537 TSecr=5981897 SLE=36821 SRE=38269
   85 0.641382607  10.6.15.144 → 192.168.1.16 SSH 422 Server: Encrypted packet (len=356)
   86 0.641388801 192.168.1.16 → 10.6.15.144  TCP 78 [TCP Dup ACK 82#2] 59298 → 22 [ACK] Seq=645 Ack=35373 Win=5703 Len=0 TSval=5385537 TSecr=5981897 SLE=36821 SRE=38625
   87 0.789344064 192.168.1.16 → 10.6.15.144  SSH 1074 Client: Encrypted packet (len=996)
   88 0.798802771 192.168.1.16 → 10.6.15.144  SSH 1122 Client: Encrypted packet (len=1044)
   89 0.809060595  10.6.15.144 → 192.168.1.16 TCP 66 [TCP Previous segment not captured] 22 → 59298 [ACK] Seq=39165 Ack=2685 Win=1452 Len=0 TSval=5981944 TSecr=5385574
   90 0.827006071  10.6.15.144 → 192.168.1.16 SSH 254 Server: Encrypted packet (len=188)
   91 0.827022687 192.168.1.16 → 10.6.15.144  TCP 86 [TCP Dup ACK 82#3] 59298 → 22 [ACK] Seq=2685 Ack=35373 Win=5703 Len=0 TSval=5385584 TSecr=5981897 SLE=39165 SRE=39353 SLE=36821 SRE=38625
   92 0.837565415  10.6.15.144 → 192.168.1.16 SSH 1514 Server: [TCP Fast Retransmission] , Encrypted packet (len=1448)
   93 0.837603471 192.168.1.16 → 10.6.15.144  TCP 78 59298 → 22 [ACK] Seq=2685 Ack=38625 Win=5703 Len=0 TSval=5385586 TSecr=5981951 SLE=39165 SRE=39353
   94 0.846901806  10.6.15.144 → 192.168.1.16 TCP 606 [TCP Retransmission] 22 → 59298 [PSH, ACK] Seq=38625 Ack=2685 Win=1452 Len=540 TSval=5981954 TSecr=5385586
   95 0.846928976 192.168.1.16 → 10.6.15.144  TCP 66 59298 → 22 [ACK] Seq=2685 Ack=39353 Win=5703 Len=0 TSval=5385589 TSecr=5981954
   96 0.847300321 192.168.1.16 → 10.6.15.144  SSH 134 Client: Encrypted packet (len=68)
   97 0.893447053  10.6.15.144 → 192.168.1.16 TCP 66 22 → 59298 [ACK] Seq=39353 Ack=2753 Win=1452 Len=0 TSval=5981966 TSecr=5385589
   98 0.917396666 192.168.1.16 → 10.6.15.144  SSH 182 Client: Encrypted packet (len=116)
   99 0.927339259  10.6.15.144 → 192.168.1.16 TCP 66 22 → 59298 [ACK] Seq=39353 Ack=2869 Win=1452 Len=0 TSval=5981974 TSecr=5385606
  100 0.934898254  10.6.15.144 → 192.168.1.16 SSH 142 Server: Encrypted packet (len=76)
  101 0.977961195 192.168.1.16 → 10.6.15.144  TCP 66 59298 → 22 [ACK] Seq=2869 Ack=39429 Win=5703 Len=0 TSval=5385622 TSecr=5981976
  102 2.300493417  10.6.15.144 → 192.168.1.16 SSH 142 Server: Encrypted packet (len=76)
  103 2.300519601 192.168.1.16 → 10.6.15.144  TCP 66 59298 → 22 [ACK] Seq=2869 Ack=39505 Win=5703 Len=0 TSval=5385952 TSecr=5982024
  104 2.300710770  10.6.15.144 → 192.168.1.16 SSH 918 Server: Encrypted packet (len=852)
  105 2.300719282 192.168.1.16 → 10.6.15.144  TCP 66 59298 → 22 [ACK] Seq=2869 Ack=40357 Win=5703 Len=0 TSval=5385952 TSecr=5982054
  106 2.300948857  10.6.15.144 → 192.168.1.16 SSH 918 Server: [TCP Spurious Retransmission] , Encrypted packet (len=852)
  107 2.300956777 192.168.1.16 → 10.6.15.144  TCP 78 [TCP Dup ACK 105#1] 59298 → 22 [ACK] Seq=2869 Ack=40357 Win=5703 Len=0 TSval=5385952 TSecr=5982066 SLE=39505 SRE=40357
  108 2.301201605  10.6.15.144 → 192.168.1.16 SSH 994 Server: [TCP Spurious Retransmission] , Encrypted packet (len=928)
  109 2.301208995 192.168.1.16 → 10.6.15.144  TCP 78 [TCP Dup ACK 105#2] 59298 → 22 [ACK] Seq=2869 Ack=40357 Win=5703 Len=0 TSval=5385952 TSecr=5982129 SLE=39429 SRE=40357
  110 2.301699826  10.6.15.144 → 192.168.1.16 SSH 994 Server: [TCP Spurious Retransmission] , Encrypted packet (len=928)
  111 2.301712832 192.168.1.16 → 10.6.15.144  TCP 78 [TCP Dup ACK 105#3] 59298 → 22 [ACK] Seq=2869 Ack=40357 Win=5703 Len=0 TSval=5385952 TSecr=5982255 SLE=39429 SRE=40357
  112 2.311968696  10.6.15.144 → 192.168.1.16 SSH 646 Server: Encrypted packet (len=580)
  113 2.311989869 192.168.1.16 → 10.6.15.144  TCP 66 59298 → 22 [ACK] Seq=2869 Ack=40937 Win=5703 Len=0 TSval=5385955 TSecr=5982320
  114 2.486357281 192.168.1.16 → 10.6.15.144  SSH 1514 Client: Encrypted packet (len=1448)
  115 2.487877955 192.168.1.16 → 10.6.15.144  SSH 446 Client: Encrypted packet (len=380)
  116 2.498091799  10.6.15.144 → 192.168.1.16 TCP 66 22 → 59298 [ACK] Seq=40937 Ack=4697 Win=1452 Len=0 TSval=5982367 TSecr=5385999
  117 2.499152304 192.168.1.16 → 10.6.15.144  SSH 598 Client: Encrypted packet (len=532)
  118 2.543779967 192.168.1.16 → 10.6.15.144  SSH 102 Client: Encrypted packet (len=36)
  119 2.544055974 192.168.1.16 → 10.6.15.144  SSH 102 Client: Encrypted packet (len=36)
  120 2.545271178  10.6.15.144 → 192.168.1.16 TCP 66 22 → 59298 [ACK] Seq=40937 Ack=5229 Win=1452 Len=0 TSval=5982379 TSecr=5386002
  121 2.553646055  10.6.15.144 → 192.168.1.16 TCP 66 22 → 59298 [ACK] Seq=40937 Ack=5265 Win=1452 Len=0 TSval=5982381 TSecr=5386013
  122 2.553664186  10.6.15.144 → 192.168.1.16 TCP 66 22 → 59298 [ACK] Seq=40937 Ack=5301 Win=1452 Len=0 TSval=5982381 TSecr=5386013
  123 2.559675227  10.6.15.144 → 192.168.1.16 SSH 446 Server: Encrypted packet (len=380)
  124 2.559685242 192.168.1.16 → 10.6.15.144  TCP 66 59298 → 22 [ACK] Seq=5301 Ack=41317 Win=5703 Len=0 TSval=5386017 TSecr=5982382
  125 2.589290533  10.6.15.144 → 192.168.1.16 SSH 102 Server: Encrypted packet (len=36)
  126 2.589308190 192.168.1.16 → 10.6.15.144  TCP 66 59298 → 22 [ACK] Seq=5301 Ack=41353 Win=5703 Len=0 TSval=5386024 TSecr=5982389
  127 2.589702115 192.168.1.16 → 10.6.15.144  SSH 374 Client: Encrypted packet (len=308)
  128 2.637637933  10.6.15.144 → 192.168.1.16 TCP 66 22 → 59298 [ACK] Seq=41353 Ack=5609 Win=1452 Len=0 TSval=5982402 TSecr=5386024
  129 3.000001702 192.168.1.16 → 52.66.5.185  NTP 90 NTP Version 4, client
  130 3.001695955  10.6.15.144 → 192.168.1.16 SSH 230 Server: Encrypted packet (len=164)
  131 3.002004581 192.168.1.16 → 10.6.15.144  SSH 134 Client: Encrypted packet (len=68)
  132 3.002343051 192.168.1.16 → 10.6.15.144  SSH 734 Client: Encrypted packet (len=668)
  133 3.012694574  10.6.15.144 → 192.168.1.16 TCP 66 22 → 59298 [ACK] Seq=41517 Ack=5677 Win=1452 Len=0 TSval=5982495 TSecr=5386128
  134 3.012714037  10.6.15.144 → 192.168.1.16 TCP 66 22 → 59298 [ACK] Seq=41517 Ack=6345 Win=1452 Len=0 TSval=5982495 TSecr=5386128
  135 3.038172252  10.6.15.144 → 192.168.1.16 SSH 206 Server: Encrypted packet (len=140)
  136 3.046974785  10.6.15.144 → 192.168.1.16 SSH 454 Server: Encrypted packet (len=388)
  137 3.047055115 192.168.1.16 → 10.6.15.144  TCP 66 59298 → 22 [ACK] Seq=6345 Ack=42045 Win=5703 Len=0 TSval=5386139 TSecr=5982502
  138 3.048375981 192.168.1.16 → 10.6.15.144  SSH 102 Client: Encrypted packet (len=36)
  139 3.057037440  10.6.15.144 → 192.168.1.16 SSH 102 Server: Encrypted packet (len=36)
  140 3.057183247 192.168.1.16 → 10.6.15.144  SSH 102 Client: Encrypted packet (len=36)
  141 3.058314445  10.6.15.144 → 192.168.1.16 SSH 102 Server: Encrypted packet (len=36)
  142 3.102011553 192.168.1.16 → 10.6.15.144  TCP 66 59298 → 22 [ACK] Seq=6417 Ack=42117 Win=5703 Len=0 TSval=5386153 TSecr=5982507
  143 3.104868383  10.6.15.144 → 192.168.1.16 TCP 66 22 → 59298 [ACK] Seq=42117 Ack=6417 Win=1452 Len=0 TSval=5982519 TSecr=5386141
  144 4.317911682  10.6.15.144 → 192.168.1.16 SSH 138 Server: Encrypted packet (len=72)
  145 4.317986510 192.168.1.16 → 10.6.15.144  TCP 66 59298 → 22 [ACK] Seq=6417 Ack=42189 Win=5703 Len=0 TSval=5386457 TSecr=5982549
  146 4.318045933  10.6.15.144 → 192.168.1.16 SSH 138 Server: [TCP Spurious Retransmission] , Encrypted packet (len=72)
  147 4.318071402 192.168.1.16 → 10.6.15.144  TCP 78 [TCP Dup ACK 145#1] 59298 → 22 [ACK] Seq=6417 Ack=42189 Win=5703 Len=0 TSval=5386457 TSecr=5982633 SLE=42117 SRE=42189
  148 4.318584432 192.168.1.16 → 10.6.15.144  SSH 102 Client: Encrypted packet (len=36)
  149 4.326701853  10.6.15.144 → 192.168.1.16 TCP 66 22 → 59298 [ACK] Seq=42189 Ack=6453 Win=1452 Len=0 TSval=5982824 TSecr=5386457
  150 5.308200489  10.6.15.144 → 192.168.1.16 SSH 1198 Server: Encrypted packet (len=1132)
  151 5.350030089 192.168.1.16 → 10.6.15.144  TCP 66 59298 → 22 [ACK] Seq=6453 Ack=43321 Win=5703 Len=0 TSval=5386715 TSecr=5982950
  152 5.358024138  10.6.15.144 → 192.168.1.16 SSH 1198 Server: [TCP Spurious Retransmission] , Encrypted packet (len=1132)
  153 5.358054916 192.168.1.16 → 10.6.15.144  TCP 78 [TCP Dup ACK 151#1] 59298 → 22 [ACK] Seq=6453 Ack=43321 Win=5703 Len=0 TSval=5386717 TSecr=5983082 SLE=42189 SRE=43321
  154 6.300173134  10.6.15.144 → 192.168.1.16 SSH 1514 Server: Encrypted packet (len=1448)
  155 6.300206268 192.168.1.16 → 10.6.15.144  TCP 66 59298 → 22 [ACK] Seq=6453 Ack=44769 Win=5703 Len=0 TSval=5386952 TSecr=5983144
  156 6.300226989  10.6.15.144 → 192.168.1.16 SSH 318 Server: Encrypted packet (len=252)
  157 6.300235253 192.168.1.16 → 10.6.15.144  TCP 66 59298 → 22 [ACK] Seq=6453 Ack=45021 Win=5703 Len=0 TSval=5386952 TSecr=5983144
  158 6.300244271  10.6.15.144 → 192.168.1.16 SSH 318 Server: [TCP Spurious Retransmission] , Encrypted packet (len=252)
  159 6.300249416 192.168.1.16 → 10.6.15.144  TCP 78 [TCP Dup ACK 157#1] 59298 → 22 [ACK] Seq=6453 Ack=45021 Win=5703 Len=0 TSval=5386952 TSecr=5983274 SLE=44769 SRE=45021
  160 6.301749823 192.168.1.16 → 10.6.15.144  SSH 206 Client: Encrypted packet (len=140)
  161 6.313876442  10.6.15.144 → 192.168.1.16 TCP 66 22 → 59298 [ACK] Seq=45021 Ack=6593 Win=1452 Len=0 TSval=5983320 TSecr=5386952
  162 7.291958903  10.6.15.144 → 192.168.1.16 SSH 350 Server: Encrypted packet (len=284)
  163 7.333989183 192.168.1.16 → 10.6.15.144  TCP 66 59298 → 22 [ACK] Seq=6593 Ack=45305 Win=5703 Len=0 TSval=5387211 TSecr=5983486
  164 8.398265549 192.168.1.16 → 10.6.15.144  SSH 110 Client: Encrypted packet (len=44)
  165 8.407405326 192.168.1.16 → 54.76.71.168 TCP 128 [TCP Previous segment not captured] 42414 → 8282 [PSH, ACK] Seq=2 Ack=1 Win=296 Len=62 TSval=5387479 TSecr=609497430
  166 8.408637818  10.6.15.144 → 192.168.1.16 TCP 66 22 → 59298 [ACK] Seq=45305 Ack=6637 Win=1452 Len=0 TSval=5983844 TSecr=5387477
  167 9.307897144 54.76.71.168 → 192.168.1.16 TCP 66 [TCP ACKed unseen segment] 8282 → 42414 [ACK] Seq=1 Ack=64 Win=121 Len=0 TSval=609499454 TSecr=5387479
  168 9.307917056  10.6.15.144 → 192.168.1.16 SSH 102 Server: Encrypted packet (len=36)
  169 9.307932197 192.168.1.16 → 10.6.15.144  TCP 66 59298 → 22 [ACK] Seq=6637 Ack=45341 Win=5703 Len=0 TSval=5387704 TSecr=5983983
  170 9.308355500 192.168.1.16 → 10.6.15.144  SSH 478 Client: Encrypted packet (len=412)
  171 9.313751185  10.6.15.144 → 192.168.1.16 TCP 66 22 → 59298 [ACK] Seq=45341 Ack=7049 Win=1452 Len=0 TSval=5984072 TSecr=5387704
  172 10.300020693  10.6.15.144 → 192.168.1.16 SSH 494 Server: Encrypted packet (len=428)
  173 10.300044489  10.6.15.144 → 192.168.1.16 TCP 494 [TCP Retransmission] 22 → 59298 [PSH, ACK] Seq=45341 Ack=7049 Win=1452 Len=428 TSval=5984301 TSecr=5387704
  174 10.300054207 192.168.1.16 → 10.6.15.144  TCP 78 59298 → 22 [ACK] Seq=7049 Ack=45769 Win=5703 Len=0 TSval=5387952 TSecr=5984301 SLE=45341 SRE=45769
  175 10.302749649 192.168.1.16 → 10.6.15.144  SSH 102 Client: Encrypted packet (len=36)
  176 10.302945731 192.168.1.16 → 10.6.15.144  SSH 138 Client: Encrypted packet (len=72)
  177 10.303131547 192.168.1.16 → 10.6.15.144  SSH 174 Client: Encrypted packet (len=108)
  178 10.312732922  10.6.15.144 → 192.168.1.16 TCP 66 22 → 59298 [ACK] Seq=45769 Ack=7085 Win=1452 Len=0 TSval=5984320 TSecr=5387953
  179 10.312755143 192.168.1.16 → 10.6.15.144  SSH 182 Client: Encrypted packet (len=116)
  180 10.312771382  10.6.15.144 → 192.168.1.16 TCP 66 22 → 59298 [ACK] Seq=45769 Ack=7157 Win=1452 Len=0 TSval=5984320 TSecr=5387953
  181 10.312778320  10.6.15.144 → 192.168.1.16 TCP 66 22 → 59298 [ACK] Seq=45769 Ack=7265 Win=1452 Len=0 TSval=5984320 TSecr=5387953
  182 10.314150534  10.6.15.144 → 192.168.1.16 SSH 138 Server: Encrypted packet (len=72)
  183 10.314168379  10.6.15.144 → 192.168.1.16 SSH 138 Server: Encrypted packet (len=72)
  184 10.314227115 192.168.1.16 → 10.6.15.144  TCP 66 59298 → 22 [ACK] Seq=7381 Ack=45913 Win=5703 Len=0 TSval=5387956 TSecr=5984321
  185 10.314420987 192.168.1.16 → 10.6.15.144  SSH 138 Client: Encrypted packet (len=72)
  186 10.317001013  10.6.15.144 → 192.168.1.16 SSH 138 Server: Encrypted packet (len=72)
  187 10.317206430 192.168.1.16 → 10.6.15.144  SSH 102 Client: Encrypted packet (len=36)
  188 10.324255591  10.6.15.144 → 192.168.1.16 TCP 66 22 → 59298 [ACK] Seq=45985 Ack=7453 Win=1452 Len=0 TSval=5984323 TSecr=5387955
  189 10.324389040  10.6.15.144 → 192.168.1.16 SSH 138 Server: Encrypted packet (len=72)
  190 10.324569360 192.168.1.16 → 10.6.15.144  SSH 102 Client: Encrypted packet (len=36)
  191 10.326945077  10.6.15.144 → 192.168.1.16 SSH 138 Server: Encrypted packet (len=72)
  192 10.327073736 192.168.1.16 → 10.6.15.144  SSH 102 Client: Encrypted packet (len=36)
  193 10.337241375  10.6.15.144 → 192.168.1.16 TCP 66 22 → 59298 [ACK] Seq=46129 Ack=7561 Win=1452 Len=0 TSval=5984326 TSecr=5387958
  194 10.358734753  10.6.15.144 → 192.168.1.16 SSH 210 Server: Encrypted packet (len=144)
  195 10.358986777 192.168.1.16 → 10.6.15.144  SSH 138 Client: Encrypted packet (len=72)
  196 10.410423919  10.6.15.144 → 192.168.1.16 SSH 138 Server: Encrypted packet (len=72)
  197 10.410815147 192.168.1.16 → 10.6.15.144  SSH 102 Client: Encrypted packet (len=36)
  198 10.469473125  10.6.15.144 → 192.168.1.16 TCP 66 22 → 59298 [ACK] Seq=46345 Ack=7669 Win=1452 Len=0 TSval=5984360 TSecr=5387980
  199 10.520994489  10.6.15.144 → 192.168.1.16 SSH 102 Server: Encrypted packet (len=36)
  200 10.521336368 192.168.1.16 → 10.6.15.144  SSH 166 Client: Encrypted packet (len=100)
  201 10.531516149  10.6.15.144 → 192.168.1.16 TCP 66 22 → 59298 [ACK] Seq=46381 Ack=7769 Win=1452 Len=0 TSval=5984375 TSecr=5388007
  202 11.034223023 192.168.1.16 → 10.6.15.144  SSH 262 Client: Encrypted packet (len=196)
  203 11.034995949 192.168.1.16 → 10.6.15.144  SSH 1514 Client: Encrypted packet (len=1448)
  204 11.035319480 192.168.1.16 → 10.6.15.144  SSH 142 Client: Encrypted packet (len=76)
  205 11.036369701  10.6.15.144 → 192.168.1.16 SSH 1514 Server: Encrypted packet (len=1448)
  206 11.036449290  10.6.15.144 → 192.168.1.16 SSH 1238 Server: Encrypted packet (len=1172)
  207 11.036460966 192.168.1.16 → 10.6.15.144  TCP 66 59298 → 22 [ACK] Seq=9489 Ack=49001 Win=5703 Len=0 TSval=5388136 TSecr=5984425
  208 11.036610917  10.6.15.144 → 192.168.1.16 SSH 1238 Server: [TCP Spurious Retransmission] , Encrypted packet (len=1172)
  209 11.036618452 192.168.1.16 → 10.6.15.144  TCP 78 [TCP Dup ACK 207#1] 59298 → 22 [ACK] Seq=9489 Ack=49001 Win=5703 Len=0 TSval=5388136 TSecr=5984493 SLE=47829 SRE=49001
  210 11.043290763  10.6.15.144 → 192.168.1.16 TCP 66 22 → 59298 [ACK] Seq=49001 Ack=7965 Win=1452 Len=0 TSval=5984503 TSecr=5388136
  211 11.043311383 192.168.1.16 → 10.6.15.144  SSH 206 Client: Encrypted packet (len=140)
  212 11.044101647  10.6.15.144 → 192.168.1.16 TCP 66 22 → 59298 [ACK] Seq=49001 Ack=9489 Win=1452 Len=0 TSval=5984504 TSecr=5388136
  213 11.045830020  10.6.15.144 → 192.168.1.16 SSH 142 Server: Encrypted packet (len=76)
  214 11.086014233 192.168.1.16 → 10.6.15.144  TCP 66 59298 → 22 [ACK] Seq=9629 Ack=49077 Win=5703 Len=0 TSval=5388149 TSecr=5984504
  215 11.092445976  10.6.15.144 → 192.168.1.16 TCP 66 22 → 59298 [ACK] Seq=49077 Ack=9629 Win=1452 Len=0 TSval=5984516 TSecr=5388138
  216 11.162720328  10.6.15.144 → 192.168.1.16 SSH 1150 Server: Encrypted packet (len=1084)
  217 11.162744961 192.168.1.16 → 10.6.15.144  TCP 66 59298 → 22 [ACK] Seq=9629 Ack=50161 Win=5703 Len=0 TSval=5388168 TSecr=5984533
  218 11.168102058  10.6.15.144 → 192.168.1.16 SSH 134 Server: Encrypted packet (len=68)
  219 11.168118871 192.168.1.16 → 10.6.15.144  TCP 66 59298 → 22 [ACK] Seq=9629 Ack=50229 Win=5703 Len=0 TSval=5388169 TSecr=5984534
  220 11.168377614 192.168.1.16 → 10.6.15.144  SSH 134 Client: Encrypted packet (len=68)
  221 11.178104746  10.6.15.144 → 192.168.1.16 TCP 66 22 → 59298 [ACK] Seq=50229 Ack=9697 Win=1452 Len=0 TSval=5984537 TSecr=5388169
  222 11.253225292  10.6.15.144 → 192.168.1.16 SSH 366 Server: Encrypted packet (len=300)
  223 11.258089426 192.168.1.16 → 10.6.15.144  SSH 638 Client: Encrypted packet (len=572)
  224 11.268317766  10.6.15.144 → 192.168.1.16 TCP 66 22 → 59298 [ACK] Seq=50529 Ack=10269 Win=1452 Len=0 TSval=5984559 TSecr=5388192
  225 12.316694240  10.6.15.144 → 192.168.1.16 SSH 1514 Server: Encrypted packet (len=1448)
  226 12.316717893  10.6.15.144 → 192.168.1.16 SSH 118 Server: Encrypted packet (len=52)
  227 12.316727905 192.168.1.16 → 10.6.15.144  TCP 66 59298 → 22 [ACK] Seq=10269 Ack=52029 Win=5703 Len=0 TSval=5388456 TSecr=5984609
  228 12.316837061  10.6.15.144 → 192.168.1.16 SSH 1514 Server: Encrypted packet (len=1448)
  229 12.317206365  10.6.15.144 → 192.168.1.16 SSH 1514 Server: Encrypted packet (len=1448)
  230 12.317210926 192.168.1.16 → 10.6.15.144  TCP 66 59298 → 22 [ACK] Seq=10269 Ack=54925 Win=5703 Len=0 TSval=5388456 TSecr=5984609
  231 12.326229579  10.6.15.144 → 192.168.1.16 SSH 1514 Server: Encrypted packet (len=1448)
  232 12.326382357  10.6.15.144 → 192.168.1.16 SSH 1514 Server: Encrypted packet (len=1448)
  233 12.326392422 192.168.1.16 → 10.6.15.144  TCP 66 59298 → 22 [ACK] Seq=10269 Ack=57821 Win=5703 Len=0 TSval=5388459 TSecr=5984824
  234 12.326548530  10.6.15.144 → 192.168.1.16 SSH 1514 Server: Encrypted packet (len=1448)
  235 12.333784944  10.6.15.144 → 192.168.1.16 SSH 1514 Server: Encrypted packet (len=1448)
  236 12.333802410 192.168.1.16 → 10.6.15.144  TCP 66 59298 → 22 [ACK] Seq=10269 Ack=60717 Win=5703 Len=0 TSval=5388460 TSecr=5984824
  237 12.333904887  10.6.15.144 → 192.168.1.16 SSH 1514 Server: Encrypted packet (len=1448)
  238 12.340985317  10.6.15.144 → 192.168.1.16 SSH 1514 Server: Encrypted packet (len=1448)
  239 12.341002732 192.168.1.16 → 10.6.15.144  TCP 66 59298 → 22 [ACK] Seq=10269 Ack=63613 Win=5703 Len=0 TSval=5388462 TSecr=5984826
  240 12.341104918  10.6.15.144 → 192.168.1.16 SSH 1514 Server: Encrypted packet (len=1448)
  241 12.348056041  10.6.15.144 → 192.168.1.16 SSH 1514 Server: Encrypted packet (len=1448)
  242 12.348073467 192.168.1.16 → 10.6.15.144  TCP 66 59298 → 22 [ACK] Seq=10269 Ack=66509 Win=5703 Len=0 TSval=5388464 TSecr=5984828
  243 12.348177686  10.6.15.144 → 192.168.1.16 SSH 1514 Server: Encrypted packet (len=1448)
  244 12.356118659  10.6.15.144 → 192.168.1.16 SSH 1514 Server: Encrypted packet (len=1448)
  245 12.356135524 192.168.1.16 → 10.6.15.144  TCP 66 59298 → 22 [ACK] Seq=10269 Ack=69405 Win=5703 Len=0 TSval=5388466 TSecr=5984830
  246 12.356240989  10.6.15.144 → 192.168.1.16 SSH 1514 Server: Encrypted packet (len=1448)
  247 12.356557090  10.6.15.144 → 192.168.1.16 SSH 1302 Server: Encrypted packet (len=1236)
  248 12.356564536 192.168.1.16 → 10.6.15.144  TCP 66 59298 → 22 [ACK] Seq=10269 Ack=72089 Win=5703 Len=0 TSval=5388466 TSecr=5984832
  249 15.306541168  10.22.18.98 → 224.0.0.252  LLMNR 69 Standard query 0x408d A ryhxdwdfz
  250 15.306587511  10.22.18.98 → 224.0.0.252  LLMNR 75 Standard query 0x7b0d A htsrqrqfoxccdjw
  251 15.344737923  10.22.18.98 → 224.0.0.252  LLMNR 68 Standard query 0x9caf A ivlbiumg
  252 16.316030969  10.22.18.98 → 224.0.0.252  LLMNR 69 Standard query 0x408d A ryhxdwdfz
  253 16.316070793  10.22.18.98 → 224.0.0.252  LLMNR 75 Standard query 0x7b0d A htsrqrqfoxccdjw
  254 16.316081826  10.22.18.98 → 224.0.0.252  LLMNR 68 Standard query 0x9caf A ivlbiumg
  255 18.300031034  10.22.18.98 → 224.0.0.252  LLMNR 65 Standard query 0xb246 ANY Febin
  256 18.357645854  192.168.1.1 → 255.255.255.255 DHCP 298 DHCP NAK      - Transaction ID 0x237b33fe
  257 19.324034225  10.22.18.98 → 224.0.0.252  LLMNR 65 Standard query 0xb246 ANY Febin
  258 19.324078343  10.22.18.17 → 224.0.0.252  LLMNR 64 Standard query 0x6e1e A wpad
  259 19.387604029  10.22.18.17 → 224.0.0.252  LLMNR 64 Standard query 0x6e1e A wpad
  260 20.000174352 192.168.1.16 → 123.108.200.124 NTP 90 NTP Version 4, client
  261 20.013255587 10.119.73.122 → 192.168.1.16 ICMP 110 Destination unreachable (Communication administratively filtered)
  262 20.504384620 192.168.1.16 → 10.6.15.144  SSH 262 Client: Encrypted packet (len=196)
  263 20.505173543 192.168.1.16 → 10.6.15.144  SSH 1514 Client: Encrypted packet (len=1448)
  264 20.506772704 192.168.1.16 → 10.6.15.144  SSH 254 Client: Encrypted packet (len=188)
  265 20.515253192  10.6.15.144 → 192.168.1.16 TCP 66 22 → 59298 [ACK] Seq=72089 Ack=10465 Win=1452 Len=0 TSval=5986871 TSecr=5390503
  266 20.516566953  10.6.15.144 → 192.168.1.16 TCP 66 22 → 59298 [ACK] Seq=72089 Ack=11913 Win=1452 Len=0 TSval=5986871 TSecr=5390503
  267 20.516586363  10.6.15.144 → 192.168.1.16 TCP 66 22 → 59298 [ACK] Seq=72089 Ack=12101 Win=1452 Len=0 TSval=5986871 TSecr=5390504
  268 21.307969802  10.6.15.144 → 192.168.1.16 SSH 142 Server: Encrypted packet (len=76)
  269 21.350012892 192.168.1.16 → 10.6.15.144  TCP 66 59298 → 22 [ACK] Seq=12101 Ack=72165 Win=5703 Len=0 TSval=5390715 TSecr=5987056
  270 21.469163931  10.6.15.144 → 192.168.1.16 SSH 206 Server: Encrypted packet (len=140)
  271 21.474064524 192.168.1.16 → 10.6.15.144  TCP 66 59298 → 22 [ACK] Seq=12101 Ack=72305 Win=5703 Len=0 TSval=5390744 TSecr=5987110
  272 21.515130639  10.22.18.98 → 224.0.0.252  LLMNR 64 Standard query 0x1f53 A wpad
  273 21.516587203  10.22.18.98 → 224.0.0.252  LLMNR 64 Standard query 0xd821 A wpad
  274 21.544074155  192.168.1.1 → 255.255.255.255 DHCP 298 DHCP NAK      - Transaction ID 0x237b33fe
  275 22.300385645  10.22.18.98 → 224.0.0.252  LLMNR 64 Standard query 0xd821 A wpad
  276 22.300427743  10.22.18.98 → 224.0.0.252  LLMNR 64 Standard query 0x1f53 A wpad
  277 23.324051069  10.22.18.98 → 224.0.0.252  LLMNR 72 Standard query 0xbcc6 A oacvnrjieznn
  278 23.324095339  10.22.18.98 → 224.0.0.252  LLMNR 69 Standard query 0xd38c A qvmloaktn
  279 23.324114080  10.22.18.98 → 224.0.0.252  LLMNR 74 Standard query 0xd5f1 A tyzvymklbtdwiv
  280 23.324494176  10.22.18.98 → 224.0.0.252  LLMNR 69 Standard query 0xd38c A qvmloaktn
  281 23.324534893  10.22.18.98 → 224.0.0.252  LLMNR 74 Standard query 0xd5f1 A tyzvymklbtdwiv
  282 23.324551378  10.22.18.98 → 224.0.0.252  LLMNR 72 Standard query 0xbcc6 A oacvnrjieznn
  283 23.324564639  10.22.18.98 → 224.0.0.252  LLMNR 65 Standard query 0x6fcf ANY Febin
  284 23.393053389  10.22.18.98 → 224.0.0.252  LLMNR 65 Standard query 0x6fcf ANY Febin
  285 29.000051453 192.168.1.16 → 139.59.21.22 NTP 90 NTP Version 4, client
  286 29.012403297 10.119.73.122 → 192.168.1.16 ICMP 110 Destination unreachable (Communication administratively filtered)
  287 30.000068895 192.168.1.16 → 52.66.5.185  NTP 90 NTP Version 4, client
  288 31.324067271  10.22.18.98 → 224.0.0.252  LLMNR 64 Standard query 0x03dd A wpad
  289 31.335567565  10.22.18.98 → 224.0.0.252  LLMNR 64 Standard query 0x03dd A wpad
  290 32.318649457  192.168.1.1 → 255.255.255.255 DHCP 298 DHCP NAK      - Transaction ID 0x121538ac
  291 32.318696391  10.22.18.89 → 224.0.0.252  LLMNR 62 Standard query 0xa934 ANY KV
  292 33.307980126  10.22.18.89 → 224.0.0.252  LLMNR 62 Standard query 0xa934 ANY KV
  293 33.308365464  10.22.18.89 → 224.0.0.252  LLMNR 62 Standard query 0x6cc8 ANY KV
  294 34.300077845  10.22.18.89 → 224.0.0.252  LLMNR 62 Standard query 0x6cc8 ANY KV
  295 35.323998226  10.22.18.98 → 224.0.0.252  LLMNR 65 Standard query 0xd13d ANY Febin
  296 35.324349743  10.22.18.98 → 224.0.0.252  LLMNR 65 Standard query 0xd13d ANY Febin
  297 35.325081664  10.22.18.89 → 224.0.0.252  LLMNR 62 Standard query 0x73da ANY KV
  298 35.400249777 192.168.1.16 → 54.76.71.168 TCP 128 42414 → 8282 [PSH, ACK] Seq=64 Ack=1 Win=296 Len=62 TSval=5394227 TSecr=609499454
  299 36.306034933 192.168.1.16 → 216.58.196.99 TCP 66 39784 → 443 [ACK] Seq=1 Ack=1 Win=339 Len=0 TSval=5394454 TSecr=1133894748
  300 36.307763522 54.76.71.168 → 192.168.1.16 TCP 66 8282 → 42414 [ACK] Seq=1 Ack=126 Win=121 Len=0 TSval=609506202 TSecr=5394227
  301 36.307805659  10.22.18.89 → 224.0.0.252  LLMNR 62 Standard query 0x73da ANY KV
  302 36.307841448  10.22.18.89 → 224.0.0.252  LLMNR 62 Standard query 0xd62d ANY KV
  303 36.314094618 216.58.196.99 → 192.168.1.16 TCP 66 [TCP ACKed unseen segment] 443 → 39784 [ACK] Seq=1 Ack=2 Win=175 Len=0 TSval=1133939762 TSecr=5383200
  304 37.307989623  10.22.18.89 → 224.0.0.252  LLMNR 62 Standard query 0xd62d ANY KV
  305 38.327277950  10.22.18.89 → 224.0.0.252  LLMNR 62 Standard query 0xaa8f ANY KV
