    1 0.000000000  10.6.15.144 → 192.168.1.16 SSH 102 Server: Encrypted packet (len=36)
    2 0.000186906  10.6.15.144 → 192.168.1.16 SSH 1514 Server: Encrypted packet (len=1448)
    3 0.000194429 192.168.1.16 → 10.6.15.144  TCP 66 59298 → 22 [ACK] Seq=1 Ack=1485 Win=5703 Len=0 TSval=5395704 TSecr=5991808
    4 0.000345660  10.6.15.144 → 192.168.1.16 SSH 1102 Server: Encrypted packet (len=1036)
    5 0.000627108  10.6.15.144 → 192.168.1.16 TCP 1102 [TCP Retransmission] 22 → 59298 [PSH, ACK] Seq=1485 Ack=1 Win=1452 Len=1036 TSval=5991860 TSecr=5395394
    6 0.000634860 192.168.1.16 → 10.6.15.144  TCP 78 59298 → 22 [ACK] Seq=1 Ack=2521 Win=5703 Len=0 TSval=5395704 TSecr=5991860 SLE=1485 SRE=2521
    7 0.000828934  10.6.15.144 → 192.168.1.16 SSH 1514 Server: Encrypted packet (len=1448)
    8 0.000835385 192.168.1.16 → 10.6.15.144  TCP 66 59298 → 22 [ACK] Seq=1 Ack=3969 Win=5703 Len=0 TSval=5395704 TSecr=5991924
    9 0.001014676  10.6.15.144 → 192.168.1.16 SSH 1514 Server: Encrypted packet (len=1448)
   10 0.001018598 192.168.1.16 → 10.6.15.144  TCP 66 59298 → 22 [ACK] Seq=1 Ack=5417 Win=5703 Len=0 TSval=5395704 TSecr=5991936
   11 0.001025350  10.6.15.144 → 192.168.1.16 TCP 102 [TCP Out-Of-Order] 22 → 59298 [PSH, ACK] Seq=1 Ack=1 Win=1452 Len=36 TSval=5992012 TSecr=5395394
   12 0.001027249 192.168.1.16 → 10.6.15.144  TCP 78 [TCP Dup ACK 10#1] 59298 → 22 [ACK] Seq=1 Ack=5417 Win=5703 Len=0 TSval=5395704 TSecr=5991936 SLE=1 SRE=37
   13 0.001352011 192.168.1.16 → 10.6.15.144  SSH 206 Client: Encrypted packet (len=140)
   14 0.011029982  10.6.15.144 → 192.168.1.16 SSH 1514 Server: Encrypted packet (len=1448)
   15 0.011221827  10.6.15.144 → 192.168.1.16 SSH 1514 Server: Encrypted packet (len=1448)
   16 0.011234409 192.168.1.16 → 10.6.15.144  TCP 66 59298 → 22 [ACK] Seq=141 Ack=8313 Win=5703 Len=0 TSval=5395707 TSecr=5992072
   17 0.011400777  10.6.15.144 → 192.168.1.16 SSH 1514 Server: Encrypted packet (len=1448)
   18 0.011530043  10.6.15.144 → 192.168.1.16 TCP 66 22 → 59298 [ACK] Seq=9761 Ack=141 Win=1452 Len=0 TSval=5992072 TSecr=5395704
   19 0.021555450  10.6.15.144 → 192.168.1.16 SSH 1514 Server: Encrypted packet (len=1448)
   20 0.021575523 192.168.1.16 → 10.6.15.144  TCP 66 59298 → 22 [ACK] Seq=141 Ack=11209 Win=5703 Len=0 TSval=5395709 TSecr=5992072
   21 0.021736186  10.6.15.144 → 192.168.1.16 SSH 1514 Server: Encrypted packet (len=1448)
   22 0.031479530  10.6.15.144 → 192.168.1.16 SSH 1514 Server: Encrypted packet (len=1448)
   23 0.031504024 192.168.1.16 → 10.6.15.144  TCP 66 59298 → 22 [ACK] Seq=141 Ack=14105 Win=5703 Len=0 TSval=5395712 TSecr=5992075
   24 0.031655467  10.6.15.144 → 192.168.1.16 SSH 1514 Server: Encrypted packet (len=1448)
   25 0.042321687  10.6.15.144 → 192.168.1.16 SSH 1514 Server: Encrypted packet (len=1448)
   26 0.042335137 192.168.1.16 → 10.6.15.144  TCP 66 59298 → 22 [ACK] Seq=141 Ack=17001 Win=5703 Len=0 TSval=5395715 TSecr=5992077
   27 0.042505025  10.6.15.144 → 192.168.1.16 SSH 1514 Server: Encrypted packet (len=1448)
   28 0.051471986  10.6.15.144 → 192.168.1.16 SSH 1514 Server: Encrypted packet (len=1448)
   29 0.051489349 192.168.1.16 → 10.6.15.144  TCP 66 59298 → 22 [ACK] Seq=141 Ack=19897 Win=5703 Len=0 TSval=5395717 TSecr=5992080
   30 0.051657833  10.6.15.144 → 192.168.1.16 SSH 1514 Server: Encrypted packet (len=1448)
   31 0.059264281  10.6.15.144 → 192.168.1.16 SSH 1514 Server: Encrypted packet (len=1448)
   32 0.059281373 192.168.1.16 → 10.6.15.144  TCP 66 59298 → 22 [ACK] Seq=141 Ack=22793 Win=5703 Len=0 TSval=5395719 TSecr=5992082
   33 0.059446719  10.6.15.144 → 192.168.1.16 SSH 1514 Server: Encrypted packet (len=1448)
   34 0.067380759  10.6.15.144 → 192.168.1.16 SSH 1514 Server: Encrypted packet (len=1448)
   35 0.067401584 192.168.1.16 → 10.6.15.144  TCP 66 59298 → 22 [ACK] Seq=141 Ack=25689 Win=5703 Len=0 TSval=5395721 TSecr=5992085
   36 0.067562315  10.6.15.144 → 192.168.1.16 SSH 1514 Server: Encrypted packet (len=1448)
   37 0.078038379  10.6.15.144 → 192.168.1.16 SSH 1514 Server: Encrypted packet (len=1448)
   38 0.078059794 192.168.1.16 → 10.6.15.144  TCP 66 59298 → 22 [ACK] Seq=141 Ack=28585 Win=5703 Len=0 TSval=5395724 TSecr=5992087
   39 0.078219507  10.6.15.144 → 192.168.1.16 SSH 1514 Server: Encrypted packet (len=1448)
   40 0.078344447  10.6.15.144 → 192.168.1.16 SSH 1062 Server: Encrypted packet (len=996)
   41 0.078351263 192.168.1.16 → 10.6.15.144  TCP 66 59298 → 22 [ACK] Seq=141 Ack=31029 Win=5703 Len=0 TSval=5395724 TSecr=5992089
   42 0.101727607 192.168.1.16 → 10.6.15.144  SSH 102 Client: Encrypted packet (len=36)
   43 0.145978943  10.6.15.144 → 192.168.1.16 TCP 66 22 → 59298 [ACK] Seq=31029 Ack=177 Win=1452 Len=0 TSval=5992107 TSecr=5395729
   44 0.370148543 192.168.1.16 → 10.6.15.144  SSH 174 Client: Encrypted packet (len=108)
   45 0.372254957 192.168.1.16 → 10.6.15.144  SSH 134 Client: Encrypted packet (len=68)
   46 0.374127971  10.6.15.144 → 192.168.1.16 SSH 350 Server: Encrypted packet (len=284)
   47 0.382100451  10.6.15.144 → 192.168.1.16 TCP 66 22 → 59298 [ACK] Seq=31313 Ack=285 Win=1452 Len=0 TSval=5992165 TSecr=5395797
   48 0.418060650 192.168.1.16 → 10.6.15.144  TCP 66 59298 → 22 [ACK] Seq=353 Ack=31313 Win=5703 Len=0 TSval=5395809 TSecr=5992150
   49 0.610032703 192.168.1.16 → 10.6.15.144  TCP 134 [TCP Retransmission] 59298 → 22 [PSH, ACK] Seq=285 Ack=31313 Win=5703 Len=68 TSval=5395857 TSecr=5992150
   50 0.620837767  10.6.15.144 → 192.168.1.16 TCP 78 22 → 59298 [ACK] Seq=31313 Ack=353 Win=1452 Len=0 TSval=5992224 TSecr=5395857 SLE=285 SRE=353
   51 0.661573520 192.168.1.16 → 10.6.15.144  SSH 214 Client: Encrypted packet (len=148)
   52 0.671645884  10.6.15.144 → 192.168.1.16 TCP 66 22 → 59298 [ACK] Seq=31313 Ack=501 Win=1452 Len=0 TSval=5992237 TSecr=5395869
   53 0.673972898  10.6.15.144 → 192.168.1.16 SSH 238 Server: Encrypted packet (len=172)
   54 0.673998104 192.168.1.16 → 10.6.15.144  TCP 66 59298 → 22 [ACK] Seq=501 Ack=31485 Win=5703 Len=0 TSval=5395872 TSecr=5992238
   55 0.674014967  10.6.15.144 → 192.168.1.16 SSH 142 Server: Encrypted packet (len=76)
   56 0.674028273 192.168.1.16 → 10.6.15.144  TCP 66 59298 → 22 [ACK] Seq=501 Ack=31561 Win=5703 Len=0 TSval=5395873 TSecr=5992238
   57 0.674596696 192.168.1.16 → 10.6.15.144  SSH 174 Client: Encrypted packet (len=108)
   58 0.689752728  10.6.15.144 → 192.168.1.16 SSH 494 Server: Encrypted packet (len=428)
   59 0.692839605  10.6.15.144 → 192.168.1.16 SSH 142 Server: Encrypted packet (len=76)
   60 0.692922969 192.168.1.16 → 10.6.15.144  TCP 66 59298 → 22 [ACK] Seq=609 Ack=32065 Win=5703 Len=0 TSval=5395877 TSecr=5992242
   61 0.777067213 192.168.1.16 → 10.6.15.144  SSH 1062 Client: Encrypted packet (len=996)
   62 0.789419501 192.168.1.16 → 10.6.15.144  SSH 1110 Client: Encrypted packet (len=1044)
   63 0.799951007  10.6.15.144 → 192.168.1.16 TCP 66 22 → 59298 [ACK] Seq=32065 Ack=2649 Win=1452 Len=0 TSval=5992269 TSecr=5395898
   64 0.981149803 192.168.1.16 → 10.6.15.144  SSH 182 Client: Encrypted packet (len=116)
   65 1.028798056  10.6.15.144 → 192.168.1.16 TCP 66 22 → 59298 [ACK] Seq=32065 Ack=2765 Win=1452 Len=0 TSval=5992327 TSecr=5395949
   66 1.097513277  10.6.15.144 → 192.168.1.16 SSH 142 Server: Encrypted packet (len=76)
   67 1.138033380 192.168.1.16 → 10.6.15.144  TCP 66 59298 → 22 [ACK] Seq=2765 Ack=32141 Win=5703 Len=0 TSval=5395989 TSecr=5992344
   68 2.976105930  10.6.15.144 → 192.168.1.16 SSH 814 Server: Encrypted packet (len=748)
   69 2.976130592 192.168.1.16 → 10.6.15.144  TCP 66 59298 → 22 [ACK] Seq=2765 Ack=32889 Win=5703 Len=0 TSval=5396448 TSecr=5992394
   70 2.976145776  10.6.15.144 → 192.168.1.16 SSH 214 Server: Encrypted packet (len=148)
   71 2.976151038 192.168.1.16 → 10.6.15.144  TCP 66 59298 → 22 [ACK] Seq=2765 Ack=33037 Win=5703 Len=0 TSval=5396448 TSecr=5992397
   72 2.976156677  10.6.15.144 → 192.168.1.16 SSH 190 Server: Encrypted packet (len=124)
   73 2.976159177 192.168.1.16 → 10.6.15.144  TCP 66 59298 → 22 [ACK] Seq=2765 Ack=33161 Win=5703 Len=0 TSval=5396448 TSecr=5992398
   74 2.976245693  10.6.15.144 → 192.168.1.16 SSH 110 Server: Encrypted packet (len=44)
   75 2.976249552 192.168.1.16 → 10.6.15.144  TCP 66 59298 → 22 [ACK] Seq=2765 Ack=33205 Win=5703 Len=0 TSval=5396448 TSecr=5992402
   76 2.976269568  10.6.15.144 → 192.168.1.16 SSH 110 Server: [TCP Spurious Retransmission] , Encrypted packet (len=44)
   77 2.976272303 192.168.1.16 → 10.6.15.144  TCP 78 [TCP Dup ACK 75#1] 59298 → 22 [ACK] Seq=2765 Ack=33205 Win=5703 Len=0 TSval=5396448 TSecr=5992440 SLE=33161 SRE=33205
   78 2.976450544  10.6.15.144 → 192.168.1.16 SSH 1130 Server: [TCP Spurious Retransmission] , Encrypted packet (len=1064)
   79 2.976457989 192.168.1.16 → 10.6.15.144  TCP 78 [TCP Dup ACK 75#2] 59298 → 22 [ACK] Seq=2765 Ack=33205 Win=5703 Len=0 TSval=5396448 TSecr=5992612 SLE=32141 SRE=33205
   80 2.977918167 192.168.1.16 → 10.6.15.144  SSH 158 Client: Encrypted packet (len=92)
   81 2.987555773  10.6.15.144 → 192.168.1.16 TCP 66 22 → 59298 [ACK] Seq=33205 Ack=2857 Win=1452 Len=0 TSval=5992816 TSecr=5396448
   82 3.147131272 192.168.1.16 → 10.6.15.144  SSH 1514 Client: Encrypted packet (len=1448)
   83 3.150359085 192.168.1.16 → 10.6.15.144  SSH 446 Client: Encrypted packet (len=380)
   84 3.160325381  10.6.15.144 → 192.168.1.16 TCP 66 22 → 59298 [ACK] Seq=33205 Ack=4685 Win=1452 Len=0 TSval=5992859 TSecr=5396491
   85 3.162630511 192.168.1.16 → 10.6.15.144  SSH 598 Client: Encrypted packet (len=532)
   86 3.172163708  10.6.15.144 → 192.168.1.16 TCP 66 22 → 59298 [ACK] Seq=33205 Ack=5217 Win=1452 Len=0 TSval=5992863 TSecr=5396495
   87 3.201316790  10.6.15.144 → 192.168.1.16 SSH 238 Server: Encrypted packet (len=172)
   88 3.201600236 192.168.1.16 → 10.6.15.144  SSH 134 Client: Encrypted packet (len=68)
   89 3.207715781 192.168.1.16 → 10.6.15.144  SSH 102 Client: Encrypted packet (len=36)
   90 3.207978712 192.168.1.16 → 10.6.15.144  SSH 110 Client: Encrypted packet (len=44)
   91 3.214747753  10.6.15.144 → 192.168.1.16 TCP 66 22 → 59298 [ACK] Seq=33377 Ack=5321 Win=1452 Len=0 TSval=5992874 TSecr=5396504
   92 3.218965935  10.6.15.144 → 192.168.1.16 SSH 446 Server: Encrypted packet (len=380)
   93 3.252249171  10.6.15.144 → 192.168.1.16 SSH 102 Server: Encrypted packet (len=36)
   94 3.252266790 192.168.1.16 → 10.6.15.144  TCP 66 59298 → 22 [ACK] Seq=5365 Ack=33793 Win=5703 Len=0 TSval=5396517 TSecr=5992875
   95 3.252630388 192.168.1.16 → 10.6.15.144  SSH 158 Client: Encrypted packet (len=92)
   96 3.295926109  10.6.15.144 → 192.168.1.16 SSH 230 Server: Encrypted packet (len=164)
   97 3.296237543 192.168.1.16 → 10.6.15.144  SSH 134 Client: Encrypted packet (len=68)
   98 3.296556781 192.168.1.16 → 10.6.15.144  SSH 734 Client: Encrypted packet (len=668)
   99 3.307006316  10.6.15.144 → 192.168.1.16 TCP 66 22 → 59298 [ACK] Seq=33957 Ack=6193 Win=1452 Len=0 TSval=5992896 TSecr=5396528
  100 3.340565920  10.6.15.144 → 192.168.1.16 SSH 454 Server: Encrypted packet (len=388)
  101 3.340589104  10.6.15.144 → 192.168.1.16 SSH 102 Server: Encrypted packet (len=36)
  102 3.340655116 192.168.1.16 → 10.6.15.144  TCP 66 59298 → 22 [ACK] Seq=6193 Ack=34381 Win=5703 Len=0 TSval=5396539 TSecr=5992905
  103 3.341982707 192.168.1.16 → 10.6.15.144  SSH 138 Client: Encrypted packet (len=72)
  104 3.351650380  10.6.15.144 → 192.168.1.16 SSH 102 Server: Encrypted packet (len=36)
  105 3.384029049  10.6.15.144 → 192.168.1.16 SSH 138 Server: Encrypted packet (len=72)
  106 3.384072445 192.168.1.16 → 10.6.15.144  TCP 66 59298 → 22 [ACK] Seq=6265 Ack=34489 Win=5703 Len=0 TSval=5396550 TSecr=5992907
  107 3.384401856 192.168.1.16 → 10.6.15.144  SSH 102 Client: Encrypted packet (len=36)
  108 3.430366939  10.6.15.144 → 192.168.1.16 TCP 66 22 → 59298 [ACK] Seq=34489 Ack=6301 Win=1452 Len=0 TSval=5992928 TSecr=5396550
  109 3.498083172  10.22.18.89 → 224.0.0.252  LLMNR 64 Standard query 0xc9c4 A wpad
  110 4.994101566  10.6.15.144 → 192.168.1.16 SSH 206 Server: Encrypted packet (len=140)
  111 4.994129114  10.22.18.89 → 224.0.0.252  LLMNR 64 Standard query 0xc9c4 A wpad
  112 4.994153601  10.6.15.144 → 192.168.1.16 TCP 206 [TCP Retransmission] 22 → 59298 [PSH, ACK] Seq=34489 Ack=6301 Win=1452 Len=140 TSval=5993095 TSecr=5396550
  113 4.994167748 192.168.1.16 → 10.6.15.144  TCP 78 59298 → 22 [ACK] Seq=6301 Ack=34629 Win=5703 Len=0 TSval=5396953 TSecr=5993095 SLE=34489 SRE=34629
  114 6.018273532  10.22.18.89 → 224.0.0.252  LLMNR 62 Standard query 0xcdf6 ANY KV
  115 11.021435549 192.168.1.16 → 10.6.15.144  SSH 1514 Client: Encrypted packet (len=1448)
  116 11.273501662  10.6.15.144 → 192.168.1.16 TCP 66 22 → 59298 [ACK] Seq=34629 Ack=7749 Win=1452 Len=0 TSval=5994888 TSecr=5398459
  117 11.370177549 192.168.1.16 → 10.6.15.144  SSH 318 Client: Encrypted packet (len=252)
  118 11.787329368  10.6.15.144 → 192.168.1.16 TCP 66 22 → 59298 [ACK] Seq=34629 Ack=8001 Win=1452 Len=0 TSval=5995018 TSecr=5398516
  119 18.122085093  10.6.15.144 → 192.168.1.16 SSH 1398 Server: Encrypted packet (len=1332)
  120 18.122115573  10.22.18.98 → 224.0.0.252  LLMNR 64 Standard query 0x46f8 A wpad
  121 18.122127375  10.22.18.98 → 224.0.0.252  LLMNR 64 Standard query 0xe468 A wpad
  122 18.138136460 192.168.1.16 → 10.6.15.144  TCP 66 59298 → 22 [ACK] Seq=8001 Ack=35961 Win=5703 Len=0 TSval=5400235 TSecr=5996468
  123 18.138906959 192.168.1.16 → 10.6.15.144  SSH 134 Client: Encrypted packet (len=68)
  124 18.188021471  10.6.15.144 → 192.168.1.16 TCP 66 22 → 59298 [ACK] Seq=35961 Ack=8069 Win=1452 Len=0 TSval=5996617 TSecr=5400235
  125 19.008086166  10.22.18.98 → 224.0.0.252  LLMNR 64 Standard query 0x46f8 A wpad
  126 19.008131355  10.22.18.98 → 224.0.0.252  LLMNR 64 Standard query 0xe468 A wpad
  127 19.045661559  10.22.18.98 → 224.0.0.252  LLMNR 73 Standard query 0xcf76 A qzaiwevptxtoz
  128 19.045760953  10.22.18.98 → 224.0.0.252  LLMNR 72 Standard query 0x01b2 A vumsinmygjea
  129 20.001530346  10.22.18.98 → 224.0.0.252  LLMNR 73 Standard query 0xcf76 A qzaiwevptxtoz
  130 20.001613593  10.22.18.98 → 224.0.0.252  LLMNR 72 Standard query 0x01b2 A vumsinmygjea
  131 20.390766887 192.168.1.16 → 10.6.15.144  SSH 102 Client: Encrypted packet (len=36)
  132 20.391879753 192.168.1.16 → 10.6.15.144  SSH 354 Client: Encrypted packet (len=288)
  133 20.392104334 192.168.1.16 → 10.6.15.144  SSH 142 Client: Encrypted packet (len=76)
  134 20.394999781 192.168.1.16 → 10.6.15.144  SSH 230 Client: Encrypted packet (len=164)
  135 20.395304287 192.168.1.16 → 10.6.15.144  SSH 1514 Client: Encrypted packet (len=1448)
  136 20.401440421  10.6.15.144 → 192.168.1.16 TCP 66 22 → 59298 [ACK] Seq=35961 Ack=8105 Win=1452 Len=0 TSval=5997170 TSecr=5400802
  137 20.401460066 192.168.1.16 → 10.6.15.144  SSH 302 Client: Encrypted packet (len=236)
  138 20.412349154  10.6.15.144 → 192.168.1.16 TCP 66 22 → 59298 [ACK] Seq=35961 Ack=8393 Win=1452 Len=0 TSval=5997170 TSecr=5400802
  139 20.412372420  10.6.15.144 → 192.168.1.16 TCP 66 22 → 59298 [ACK] Seq=35961 Ack=8469 Win=1452 Len=0 TSval=5997170 TSecr=5400802
  140 20.412378309  10.6.15.144 → 192.168.1.16 TCP 66 22 → 59298 [ACK] Seq=35961 Ack=8633 Win=1452 Len=0 TSval=5997171 TSecr=5400803
  141 20.412397267  10.6.15.144 → 192.168.1.16 TCP 66 22 → 59298 [ACK] Seq=35961 Ack=10081 Win=1452 Len=0 TSval=5997171 TSecr=5400803
  142 20.416170669  10.6.15.144 → 192.168.1.16 TCP 66 22 → 59298 [ACK] Seq=35961 Ack=10317 Win=1451 Len=0 TSval=5997174 TSecr=5400804
  143 20.434920324  10.6.15.144 → 192.168.1.16 SSH 498 Server: Encrypted packet (len=432)
  144 20.435529433 192.168.1.16 → 10.6.15.144  SSH 282 Client: Encrypted packet (len=216)
  145 20.491823711  10.6.15.144 → 192.168.1.16 TCP 66 22 → 59298 [ACK] Seq=36393 Ack=10533 Win=1452 Len=0 TSval=5997193 TSecr=5400813
  146 20.575123044  10.6.15.144 → 192.168.1.16 SSH 110 Server: Encrypted packet (len=44)
  147 20.575514125 192.168.1.16 → 10.6.15.144  SSH 422 Client: Encrypted packet (len=356)
  148 20.585639252  10.6.15.144 → 192.168.1.16 TCP 66 22 → 59298 [ACK] Seq=36437 Ack=10889 Win=1452 Len=0 TSval=5997216 TSecr=5400848
  149 20.664865849  10.6.15.144 → 192.168.1.16 SSH 158 Server: Encrypted packet (len=92)
  150 20.665146359 192.168.1.16 → 10.6.15.144  SSH 102 Client: Encrypted packet (len=36)
  151 20.675150909  10.6.15.144 → 192.168.1.16 TCP 66 22 → 59298 [ACK] Seq=36529 Ack=10925 Win=1452 Len=0 TSval=5997238 TSecr=5400870
  152 20.685334637  10.6.15.144 → 192.168.1.16 SSH 138 Server: Encrypted packet (len=72)
  153 20.685559667 192.168.1.16 → 10.6.15.144  SSH 102 Client: Encrypted packet (len=36)
  154 20.727418467  10.6.15.144 → 192.168.1.16 SSH 126 Server: Encrypted packet (len=60)
  155 20.727442844  10.6.15.144 → 192.168.1.16 SSH 138 Server: Encrypted packet (len=72)
  156 20.727504614 192.168.1.16 → 10.6.15.144  TCP 66 59298 → 22 [ACK] Seq=10961 Ack=36733 Win=5703 Len=0 TSval=5400886 TSecr=5997251
  157 20.727680894 192.168.1.16 → 10.6.15.144  SSH 102 Client: Encrypted packet (len=36)
  158 20.741574592  10.6.15.144 → 192.168.1.16 SSH 1514 Server: Encrypted packet (len=1448)
  159 20.741667395  10.6.15.144 → 192.168.1.16 SSH 918 Server: Encrypted packet (len=852)
  160 20.741678552 192.168.1.16 → 10.6.15.144  TCP 66 59298 → 22 [ACK] Seq=10997 Ack=39033 Win=5703 Len=0 TSval=5400889 TSecr=5997255
  161 20.742026158  10.6.15.144 → 192.168.1.16 SSH 1514 Server: Encrypted packet (len=1448)
  162 20.742088671  10.6.15.144 → 192.168.1.16 SSH 678 Server: Encrypted packet (len=612)
  163 20.742092497 192.168.1.16 → 10.6.15.144  TCP 66 59298 → 22 [ACK] Seq=10997 Ack=41093 Win=5703 Len=0 TSval=5400890 TSecr=5997255
  164 20.751406780  10.6.15.144 → 192.168.1.16 SSH 1142 Server: Encrypted packet (len=1076)
  165 20.752998790 192.168.1.16 → 10.6.15.144  SSH 206 Client: Encrypted packet (len=140)
  166 20.757360812  10.6.15.144 → 192.168.1.16 SSH 134 Server: Encrypted packet (len=68)
  167 20.798037603 192.168.1.16 → 10.6.15.144  TCP 66 59298 → 22 [ACK] Seq=11137 Ack=42237 Win=5703 Len=0 TSval=5400904 TSecr=5997259
  168 20.804202887  10.6.15.144 → 192.168.1.16 TCP 66 22 → 59298 [ACK] Seq=42237 Ack=11137 Win=1452 Len=0 TSval=5997271 TSecr=5400892
  169 20.858923256  10.6.15.144 → 192.168.1.16 SSH 138 Server: Encrypted packet (len=72)
  170 20.858947297 192.168.1.16 → 10.6.15.144  TCP 66 59298 → 22 [ACK] Seq=11137 Ack=42309 Win=5703 Len=0 TSval=5400919 TSecr=5997284
  171 20.859147155 192.168.1.16 → 10.6.15.144  SSH 102 Client: Encrypted packet (len=36)
  172 20.869111328  10.6.15.144 → 192.168.1.16 TCP 66 22 → 59298 [ACK] Seq=42309 Ack=11173 Win=1452 Len=0 TSval=5997287 TSecr=5400919
  173 20.903536109  10.6.15.144 → 192.168.1.16 SSH 374 Server: Encrypted packet (len=308)
  174 20.914708487 192.168.1.16 → 10.6.15.144  SSH 622 Client: Encrypted packet (len=556)
  175 20.963698383  10.6.15.144 → 192.168.1.16 TCP 66 22 → 59298 [ACK] Seq=42617 Ack=11729 Win=1452 Len=0 TSval=5997311 TSecr=5400933
  176 20.971888554  10.6.15.144 → 192.168.1.16 SSH 206 Server: Encrypted packet (len=140)
  177 21.014035374 192.168.1.16 → 10.6.15.144  TCP 66 59298 → 22 [ACK] Seq=11729 Ack=42757 Win=5703 Len=0 TSval=5400958 TSecr=5997312
  178 21.070699341  10.6.15.144 → 192.168.1.16 SSH 1514 Server: Encrypted packet (len=1448)
  179 21.070724258 192.168.1.16 → 10.6.15.144  TCP 66 59298 → 22 [ACK] Seq=11729 Ack=44205 Win=5703 Len=0 TSval=5400972 TSecr=5997337
  180 21.070888506  10.6.15.144 → 192.168.1.16 SSH 1514 Server: Encrypted packet (len=1448)
  181 21.070893193 192.168.1.16 → 10.6.15.144  TCP 66 59298 → 22 [ACK] Seq=11729 Ack=45653 Win=5703 Len=0 TSval=5400972 TSecr=5997337
  182 21.070898819  10.6.15.144 → 192.168.1.16 SSH 110 Server: Encrypted packet (len=44)
  183 21.070920105 192.168.1.16 → 10.6.15.144  TCP 66 59298 → 22 [ACK] Seq=11729 Ack=45697 Win=5703 Len=0 TSval=5400972 TSecr=5997337
  184 21.071232563  10.6.15.144 → 192.168.1.16 SSH 1514 Server: Encrypted packet (len=1448)
  185 21.082228272  10.6.15.144 → 192.168.1.16 SSH 1514 Server: Encrypted packet (len=1448)
  186 21.082245795 192.168.1.16 → 10.6.15.144  TCP 66 59298 → 22 [ACK] Seq=11729 Ack=48593 Win=5703 Len=0 TSval=5400975 TSecr=5997337
  187 21.082408100  10.6.15.144 → 192.168.1.16 SSH 1514 Server: Encrypted packet (len=1448)
  188 21.092873344  10.6.15.144 → 192.168.1.16 SSH 1514 Server: Encrypted packet (len=1448)
  189 21.092892039 192.168.1.16 → 10.6.15.144  TCP 66 59298 → 22 [ACK] Seq=11729 Ack=51489 Win=5703 Len=0 TSval=5400977 TSecr=5997340
  190 21.093055404  10.6.15.144 → 192.168.1.16 SSH 1514 Server: Encrypted packet (len=1448)
  191 21.105899411  10.6.15.144 → 192.168.1.16 SSH 1514 Server: Encrypted packet (len=1448)
  192 21.105917419 192.168.1.16 → 10.6.15.144  TCP 66 59298 → 22 [ACK] Seq=11729 Ack=54385 Win=5703 Len=0 TSval=5400980 TSecr=5997343
  193 21.106078932  10.6.15.144 → 192.168.1.16 SSH 1514 Server: Encrypted packet (len=1448)
  194 21.117571983  10.6.15.144 → 192.168.1.16 SSH 1514 Server: Encrypted packet (len=1448)
  195 21.117588120 192.168.1.16 → 10.6.15.144  TCP 66 59298 → 22 [ACK] Seq=11729 Ack=57281 Win=5703 Len=0 TSval=5400983 TSecr=5997347
  196 21.117608650  10.6.15.144 → 192.168.1.16 SSH 286 Server: Encrypted packet (len=220)
  197 21.117668870 192.168.1.16 → 10.6.15.144  TCP 66 59298 → 22 [ACK] Seq=11729 Ack=57501 Win=5703 Len=0 TSval=5400983 TSecr=5997349
  198 21.150779895  10.6.15.144 → 192.168.1.16 SSH 126 Server: Encrypted packet (len=60)
  199 21.150799535  10.6.15.144 → 192.168.1.16 SSH 138 Server: Encrypted packet (len=72)
  200 21.150860985 192.168.1.16 → 10.6.15.144  TCP 66 59298 → 22 [ACK] Seq=11729 Ack=57633 Win=5703 Len=0 TSval=5400992 TSecr=5997357
  201 21.151062337 192.168.1.16 → 10.6.15.144  SSH 102 Client: Encrypted packet (len=36)
  202 21.159218778  10.6.15.144 → 192.168.1.16 TCP 66 22 → 59298 [ACK] Seq=57633 Ack=11765 Win=1452 Len=0 TSval=5997360 TSecr=5400992
  203 21.207472348  10.6.15.144 → 192.168.1.16 SSH 1514 Server: Encrypted packet (len=1448)
  204 21.207646533  10.6.15.144 → 192.168.1.16 SSH 1514 Server: Encrypted packet (len=1448)
  205 21.207657626 192.168.1.16 → 10.6.15.144  TCP 66 59298 → 22 [ACK] Seq=11765 Ack=60529 Win=5703 Len=0 TSval=5401006 TSecr=5997372
  206 21.207673881  10.6.15.144 → 192.168.1.16 SSH 110 Server: Encrypted packet (len=44)
  207 21.208006646  10.6.15.144 → 192.168.1.16 SSH 1514 Server: Encrypted packet (len=1448)
  208 21.208011586 192.168.1.16 → 10.6.15.144  TCP 66 59298 → 22 [ACK] Seq=11765 Ack=62021 Win=5703 Len=0 TSval=5401006 TSecr=5997372
  209 21.216275442  10.6.15.144 → 192.168.1.16 SSH 1514 Server: Encrypted packet (len=1448)
  210 21.216446612  10.6.15.144 → 192.168.1.16 SSH 1514 Server: Encrypted packet (len=1448)
  211 21.216459251 192.168.1.16 → 10.6.15.144  TCP 66 59298 → 22 [ACK] Seq=11765 Ack=64917 Win=5703 Len=0 TSval=5401008 TSecr=5997374
  212 21.216638750  10.6.15.144 → 192.168.1.16 SSH 1514 Server: Encrypted packet (len=1448)
  213 21.216984506  10.6.15.144 → 192.168.1.16 SSH 1514 Server: Encrypted packet (len=1448)
  214 21.216991236 192.168.1.16 → 10.6.15.144  TCP 66 59298 → 22 [ACK] Seq=11765 Ack=67813 Win=5703 Len=0 TSval=5401008 TSecr=5997374
  215 21.227754667  10.6.15.144 → 192.168.1.16 SSH 1514 Server: Encrypted packet (len=1448)
  216 21.227936006  10.6.15.144 → 192.168.1.16 SSH 1514 Server: Encrypted packet (len=1448)
  217 21.227945415 192.168.1.16 → 10.6.15.144  TCP 66 59298 → 22 [ACK] Seq=11765 Ack=70709 Win=5703 Len=0 TSval=5401011 TSecr=5997376
  218 21.228279016  10.6.15.144 → 192.168.1.16 SSH 1514 Server: [TCP Previous segment not captured] , Encrypted packet (len=1448)
  219 21.228284605 192.168.1.16 → 10.6.15.144  TCP 78 [TCP Dup ACK 217#1] 59298 → 22 [ACK] Seq=11765 Ack=70709 Win=5703 Len=0 TSval=5401011 TSecr=5997376 SLE=72157 SRE=73605
  220 21.238892535  10.6.15.144 → 192.168.1.16 SSH 1514 Server: Encrypted packet (len=1448)
  221 21.238913024 192.168.1.16 → 10.6.15.144  TCP 78 [TCP Dup ACK 217#2] 59298 → 22 [ACK] Seq=11765 Ack=70709 Win=5703 Len=0 TSval=5401014 TSecr=5997376 SLE=72157 SRE=75053
  222 21.239071137  10.6.15.144 → 192.168.1.16 SSH 1514 Server: Encrypted packet (len=1448)
  223 21.239076320 192.168.1.16 → 10.6.15.144  TCP 78 [TCP Dup ACK 217#3] 59298 → 22 [ACK] Seq=11765 Ack=70709 Win=5703 Len=0 TSval=5401014 TSecr=5997376 SLE=72157 SRE=76501
  224 21.239413398  10.6.15.144 → 192.168.1.16 SSH 1514 Server: Encrypted packet (len=1448)
  225 21.239417714 192.168.1.16 → 10.6.15.144  TCP 78 [TCP Dup ACK 217#4] 59298 → 22 [ACK] Seq=11765 Ack=70709 Win=5703 Len=0 TSval=5401014 TSecr=5997376 SLE=72157 SRE=77949
  226 21.249718230  10.6.15.144 → 192.168.1.16 SSH 1514 Server: Encrypted packet (len=1448)
  227 21.249736876 192.168.1.16 → 10.6.15.144  TCP 78 [TCP Dup ACK 217#5] 59298 → 22 [ACK] Seq=11765 Ack=70709 Win=5703 Len=0 TSval=5401016 TSecr=5997376 SLE=72157 SRE=79397
  228 21.249900094  10.6.15.144 → 192.168.1.16 SSH 1514 Server: [TCP Fast Retransmission] , Encrypted packet (len=1448)
  229 21.249907611 192.168.1.16 → 10.6.15.144  TCP 66 59298 → 22 [ACK] Seq=11765 Ack=79397 Win=5703 Len=0 TSval=5401016 TSecr=5997382
  230 21.260106497  10.6.15.144 → 192.168.1.16 SSH 1514 Server: Encrypted packet (len=1448)
  231 21.260123384 192.168.1.16 → 10.6.15.144  TCP 66 59298 → 22 [ACK] Seq=11765 Ack=80845 Win=5703 Len=0 TSval=5401019 TSecr=5997384
  232 21.260288316  10.6.15.144 → 192.168.1.16 SSH 1514 Server: Encrypted packet (len=1448)
  233 21.260292496 192.168.1.16 → 10.6.15.144  TCP 66 59298 → 22 [ACK] Seq=11765 Ack=82293 Win=5703 Len=0 TSval=5401019 TSecr=5997384
  234 21.270247722  10.6.15.144 → 192.168.1.16 SSH 1514 Server: Encrypted packet (len=1448)
  235 21.270268604 192.168.1.16 → 10.6.15.144  TCP 66 59298 → 22 [ACK] Seq=11765 Ack=83741 Win=5703 Len=0 TSval=5401022 TSecr=5997387
  236 21.270434774  10.6.15.144 → 192.168.1.16 SSH 1514 Server: Encrypted packet (len=1448)
  237 21.270439558 192.168.1.16 → 10.6.15.144  TCP 66 59298 → 22 [ACK] Seq=11765 Ack=85189 Win=5703 Len=0 TSval=5401022 TSecr=5997387
  238 21.270623145  10.6.15.144 → 192.168.1.16 SSH 1514 Server: Encrypted packet (len=1448)
  239 21.270627215 192.168.1.16 → 10.6.15.144  TCP 66 59298 → 22 [ACK] Seq=11765 Ack=86637 Win=5703 Len=0 TSval=5401022 TSecr=5997387
  240 21.281061651  10.6.15.144 → 192.168.1.16 SSH 726 Server: Encrypted packet (len=660)
  241 21.281091073 192.168.1.16 → 10.6.15.144  TCP 66 59298 → 22 [ACK] Seq=11765 Ack=87297 Win=5703 Len=0 TSval=5401024 TSecr=5997390
  242 21.351513333  10.6.15.144 → 192.168.1.16 SSH 1514 Server: Encrypted packet (len=1448)
  243 21.351529006 192.168.1.16 → 10.6.15.144  TCP 66 59298 → 22 [ACK] Seq=11765 Ack=88745 Win=5703 Len=0 TSval=5401042 TSecr=5997407
  244 21.351696446  10.6.15.144 → 192.168.1.16 SSH 1514 Server: Encrypted packet (len=1448)
  245 21.351702013 192.168.1.16 → 10.6.15.144  TCP 66 59298 → 22 [ACK] Seq=11765 Ack=90193 Win=5703 Len=0 TSval=5401042 TSecr=5997407
  246 21.351831980  10.6.15.144 → 192.168.1.16 SSH 110 Server: Encrypted packet (len=44)
  247 21.351837247 192.168.1.16 → 10.6.15.144  TCP 66 59298 → 22 [ACK] Seq=11765 Ack=90237 Win=5703 Len=0 TSval=5401042 TSecr=5997407
  248 21.352059114  10.6.15.144 → 192.168.1.16 SSH 1514 Server: Encrypted packet (len=1448)
  249 21.352064558 192.168.1.16 → 10.6.15.144  TCP 66 59298 → 22 [ACK] Seq=11765 Ack=91685 Win=5703 Len=0 TSval=5401042 TSecr=5997407
  250 21.360854739  10.6.15.144 → 192.168.1.16 SSH 1514 Server: Encrypted packet (len=1448)
  251 21.360866560 192.168.1.16 → 10.6.15.144  TCP 66 59298 → 22 [ACK] Seq=11765 Ack=93133 Win=5703 Len=0 TSval=5401044 TSecr=5997410
  252 21.361040386  10.6.15.144 → 192.168.1.16 SSH 1514 Server: Encrypted packet (len=1448)
  253 21.361046217 192.168.1.16 → 10.6.15.144  TCP 66 59298 → 22 [ACK] Seq=11765 Ack=94581 Win=5703 Len=0 TSval=5401044 TSecr=5997410
  254 21.361233218  10.6.15.144 → 192.168.1.16 SSH 1514 Server: Encrypted packet (len=1448)
  255 21.361238763 192.168.1.16 → 10.6.15.144  TCP 66 59298 → 22 [ACK] Seq=11765 Ack=96029 Win=5703 Len=0 TSval=5401044 TSecr=5997410
  256 21.361595455  10.6.15.144 → 192.168.1.16 SSH 1514 Server: Encrypted packet (len=1448)
  257 21.361606000 192.168.1.16 → 10.6.15.144  TCP 66 59298 → 22 [ACK] Seq=11765 Ack=97477 Win=5703 Len=0 TSval=5401044 TSecr=5997410
  258 21.369560787  10.6.15.144 → 192.168.1.16 SSH 1514 Server: Encrypted packet (len=1448)
  259 21.369738375  10.6.15.144 → 192.168.1.16 SSH 1514 Server: Encrypted packet (len=1448)
  260 21.369744918 192.168.1.16 → 10.6.15.144  TCP 66 59298 → 22 [ACK] Seq=11765 Ack=100373 Win=5703 Len=0 TSval=5401046 TSecr=5997412
  261 21.370088477  10.6.15.144 → 192.168.1.16 SSH 1514 Server: Encrypted packet (len=1448)
  262 21.370280196  10.6.15.144 → 192.168.1.16 SSH 1514 Server: Encrypted packet (len=1448)
  263 21.370285745 192.168.1.16 → 10.6.15.144  TCP 66 59298 → 22 [ACK] Seq=11765 Ack=103269 Win=5703 Len=0 TSval=5401047 TSecr=5997412
  264 21.380913877  10.6.15.144 → 192.168.1.16 SSH 1514 Server: Encrypted packet (len=1448)
  265 21.381103956  10.6.15.144 → 192.168.1.16 SSH 1514 Server: Encrypted packet (len=1448)
  266 21.381111142 192.168.1.16 → 10.6.15.144  TCP 66 59298 → 22 [ACK] Seq=11765 Ack=106165 Win=5703 Len=0 TSval=5401049 TSecr=5997414
  267 21.381296273  10.6.15.144 → 192.168.1.16 SSH 1514 Server: Encrypted packet (len=1448)
  268 21.381635874  10.6.15.144 → 192.168.1.16 SSH 1514 Server: Encrypted packet (len=1448)
  269 21.381640014 192.168.1.16 → 10.6.15.144  TCP 66 59298 → 22 [ACK] Seq=11765 Ack=109061 Win=5703 Len=0 TSval=5401049 TSecr=5997414
  270 21.391222210  10.6.15.144 → 192.168.1.16 SSH 1514 Server: Encrypted packet (len=1448)
  271 21.391408028  10.6.15.144 → 192.168.1.16 SSH 1514 Server: Encrypted packet (len=1448)
  272 21.391414052 192.168.1.16 → 10.6.15.144  TCP 66 59298 → 22 [ACK] Seq=11765 Ack=111957 Win=5703 Len=0 TSval=5401052 TSecr=5997417
  273 21.391749927  10.6.15.144 → 192.168.1.16 SSH 1514 Server: Encrypted packet (len=1448)
  274 21.391928474  10.6.15.144 → 192.168.1.16 SSH 1514 Server: Encrypted packet (len=1448)
  275 21.391934327 192.168.1.16 → 10.6.15.144  TCP 66 59298 → 22 [ACK] Seq=11765 Ack=114853 Win=5703 Len=0 TSval=5401052 TSecr=5997417
  276 21.401080387  10.6.15.144 → 192.168.1.16 SSH 1514 Server: Encrypted packet (len=1448)
  277 21.401264710  10.6.15.144 → 192.168.1.16 SSH 1514 Server: Encrypted packet (len=1448)
  278 21.401271030 192.168.1.16 → 10.6.15.144  TCP 66 59298 → 22 [ACK] Seq=11765 Ack=117749 Win=5703 Len=0 TSval=5401054 TSecr=5997420
  279 21.401609359  10.6.15.144 → 192.168.1.16 SSH 1514 Server: Encrypted packet (len=1448)
  280 21.401782723  10.6.15.144 → 192.168.1.16 SSH 1514 Server: Encrypted packet (len=1448)
  281 21.401785808 192.168.1.16 → 10.6.15.144  TCP 66 59298 → 22 [ACK] Seq=11765 Ack=120645 Win=5703 Len=0 TSval=5401054 TSecr=5997420
  282 21.411064784  10.6.15.144 → 192.168.1.16 SSH 1514 Server: Encrypted packet (len=1448)
  283 21.411247703  10.6.15.144 → 192.168.1.16 SSH 1514 Server: Encrypted packet (len=1448)
  284 21.411254023 192.168.1.16 → 10.6.15.144  TCP 66 59298 → 22 [ACK] Seq=11765 Ack=123541 Win=5703 Len=0 TSval=5401057 TSecr=5997423
  285 21.411591948  10.6.15.144 → 192.168.1.16 SSH 1514 Server: Encrypted packet (len=1448)
  286 21.411784217  10.6.15.144 → 192.168.1.16 SSH 1514 Server: Encrypted packet (len=1448)
  287 21.411789696 192.168.1.16 → 10.6.15.144  TCP 66 59298 → 22 [ACK] Seq=11765 Ack=126437 Win=5703 Len=0 TSval=5401057 TSecr=5997423
  288 21.421000991  10.6.15.144 → 192.168.1.16 SSH 1514 Server: Encrypted packet (len=1448)
  289 21.421182470  10.6.15.144 → 192.168.1.16 SSH 1514 Server: Encrypted packet (len=1448)
  290 21.421188999 192.168.1.16 → 10.6.15.144  TCP 66 59298 → 22 [ACK] Seq=11765 Ack=129333 Win=5703 Len=0 TSval=5401059 TSecr=5997425
  291 21.421381918  10.6.15.144 → 192.168.1.16 SSH 1514 Server: Encrypted packet (len=1448)
  292 21.421701723  10.6.15.144 → 192.168.1.16 SSH 1514 Server: Encrypted packet (len=1448)
  293 21.421706256 192.168.1.16 → 10.6.15.144  TCP 66 59298 → 22 [ACK] Seq=11765 Ack=132229 Win=5703 Len=0 TSval=5401059 TSecr=5997425
  294 21.428948146  10.6.15.144 → 192.168.1.16 SSH 1514 Server: Encrypted packet (len=1448)
  295 21.429136468  10.6.15.144 → 192.168.1.16 SSH 1514 Server: Encrypted packet (len=1448)
  296 21.429142976 192.168.1.16 → 10.6.15.144  TCP 66 59298 → 22 [ACK] Seq=11765 Ack=135125 Win=5703 Len=0 TSval=5401061 TSecr=5997427
  297 21.429329970  10.6.15.144 → 192.168.1.16 SSH 1514 Server: Encrypted packet (len=1448)
  298 21.429408125 192.168.1.16 → 10.6.15.144  SSH 102 Client: Encrypted packet (len=36)
  299 21.429671919  10.6.15.144 → 192.168.1.16 SSH 1514 Server: Encrypted packet (len=1448)
  300 21.437690604  10.6.15.144 → 192.168.1.16 SSH 1514 Server: Encrypted packet (len=1448)
  301 21.437706947 192.168.1.16 → 10.6.15.144  TCP 66 59298 → 22 [ACK] Seq=11801 Ack=139469 Win=5703 Len=0 TSval=5401063 TSecr=5997427
  302 21.437889347  10.6.15.144 → 192.168.1.16 SSH 1514 Server: Encrypted packet (len=1448)
  303 21.438219280  10.6.15.144 → 192.168.1.16 SSH 1514 Server: Encrypted packet (len=1448)
  304 21.438228161 192.168.1.16 → 10.6.15.144  TCP 66 59298 → 22 [ACK] Seq=11801 Ack=142365 Win=5703 Len=0 TSval=5401064 TSecr=5997429
  305 21.438409234  10.6.15.144 → 192.168.1.16 SSH 1514 Server: Encrypted packet (len=1448)
  306 21.447698044  10.6.15.144 → 192.168.1.16 SSH 1514 Server: Encrypted packet (len=1448)
  307 21.447706612 192.168.1.16 → 10.6.15.144  TCP 66 59298 → 22 [ACK] Seq=11801 Ack=145261 Win=5703 Len=0 TSval=5401066 TSecr=5997429
  308 21.448017178  10.6.15.144 → 192.168.1.16 SSH 1514 Server: Encrypted packet (len=1448)
  309 21.448125324  10.6.15.144 → 192.168.1.16 SSH 70 Server: Encrypted packet (len=4)
  310 21.448131164 192.168.1.16 → 10.6.15.144  TCP 66 59298 → 22 [ACK] Seq=11801 Ack=146713 Win=5703 Len=0 TSval=5401066 TSecr=5997432
  311 21.492759841  10.6.15.144 → 192.168.1.16 SSH 1514 Server: Encrypted packet (len=1448)
  312 21.492775024  10.6.15.144 → 192.168.1.16 SSH 110 Server: Encrypted packet (len=44)
  313 21.492781317 192.168.1.16 → 10.6.15.144  TCP 66 59298 → 22 [ACK] Seq=11801 Ack=148205 Win=5703 Len=0 TSval=5401077 TSecr=5997442
  314 21.493112556  10.6.15.144 → 192.168.1.16 SSH 1514 Server: Encrypted packet (len=1448)
  315 21.493305878  10.6.15.144 → 192.168.1.16 SSH 1514 Server: Encrypted packet (len=1448)
  316 21.493311508 192.168.1.16 → 10.6.15.144  TCP 66 59298 → 22 [ACK] Seq=11801 Ack=151101 Win=5703 Len=0 TSval=5401077 TSecr=5997443
  317 21.493496540  10.6.15.144 → 192.168.1.16 SSH 1514 Server: Encrypted packet (len=1448)
  318 21.493631667  10.6.15.144 → 192.168.1.16 SSH 110 Server: Encrypted packet (len=44)
  319 21.493637503 192.168.1.16 → 10.6.15.144  TCP 66 59298 → 22 [ACK] Seq=11801 Ack=152593 Win=5703 Len=0 TSval=5401077 TSecr=5997443
  320 21.503957586  10.6.15.144 → 192.168.1.16 SSH 1514 Server: Encrypted packet (len=1448)
  321 21.504139956  10.6.15.144 → 192.168.1.16 SSH 1514 Server: Encrypted packet (len=1448)
  322 21.504145059 192.168.1.16 → 10.6.15.144  TCP 66 59298 → 22 [ACK] Seq=11801 Ack=155489 Win=5703 Len=0 TSval=5401080 TSecr=5997445
  323 21.504331704  10.6.15.144 → 192.168.1.16 SSH 1514 Server: Encrypted packet (len=1448)
  324 21.504677369  10.6.15.144 → 192.168.1.16 SSH 1514 Server: Encrypted packet (len=1448)
  325 21.504680356 192.168.1.16 → 10.6.15.144  TCP 66 59298 → 22 [ACK] Seq=11801 Ack=158385 Win=5703 Len=0 TSval=5401080 TSecr=5997445
  326 21.504873053  10.6.15.144 → 192.168.1.16 SSH 1514 Server: Encrypted packet (len=1448)
  327 21.505064973  10.6.15.144 → 192.168.1.16 SSH 1514 Server: Encrypted packet (len=1448)
  328 21.505070374 192.168.1.16 → 10.6.15.144  TCP 66 59298 → 22 [ACK] Seq=11801 Ack=161281 Win=5703 Len=0 TSval=5401080 TSecr=5997445
  329 21.515193756  10.6.15.144 → 192.168.1.16 SSH 1514 Server: Encrypted packet (len=1448)
  330 21.515376194  10.6.15.144 → 192.168.1.16 SSH 1514 Server: Encrypted packet (len=1448)
  331 21.515384540 192.168.1.16 → 10.6.15.144  TCP 66 59298 → 22 [ACK] Seq=11801 Ack=164177 Win=5703 Len=0 TSval=5401083 TSecr=5997448
  332 21.515569113  10.6.15.144 → 192.168.1.16 SSH 1514 Server: Encrypted packet (len=1448)
  333 21.515913462  10.6.15.144 → 192.168.1.16 SSH 1514 Server: Encrypted packet (len=1448)
  334 21.515919233 192.168.1.16 → 10.6.15.144  TCP 66 59298 → 22 [ACK] Seq=11801 Ack=167073 Win=5703 Len=0 TSval=5401083 TSecr=5997448
  335 21.516092223  10.6.15.144 → 192.168.1.16 SSH 1514 Server: Encrypted packet (len=1448)
  336 21.516279667  10.6.15.144 → 192.168.1.16 SSH 1514 Server: Encrypted packet (len=1448)
  337 21.516284086 192.168.1.16 → 10.6.15.144  TCP 66 59298 → 22 [ACK] Seq=11801 Ack=169969 Win=5703 Len=0 TSval=5401083 TSecr=5997448
  338 21.526775430  10.6.15.144 → 192.168.1.16 SSH 1514 Server: Encrypted packet (len=1448)
  339 21.526944402  10.6.15.144 → 192.168.1.16 SSH 1514 Server: Encrypted packet (len=1448)
  340 21.526954239 192.168.1.16 → 10.6.15.144  TCP 66 59298 → 22 [ACK] Seq=11801 Ack=172865 Win=5703 Len=0 TSval=5401086 TSecr=5997451
  341 21.527290375  10.6.15.144 → 192.168.1.16 SSH 1514 Server: Encrypted packet (len=1448)
  342 21.527482111  10.6.15.144 → 192.168.1.16 SSH 1514 Server: Encrypted packet (len=1448)
  343 21.527486249 192.168.1.16 → 10.6.15.144  TCP 66 59298 → 22 [ACK] Seq=11801 Ack=175761 Win=5703 Len=0 TSval=5401086 TSecr=5997451
  344 21.527673285  10.6.15.144 → 192.168.1.16 SSH 1514 Server: Encrypted packet (len=1448)
  345 21.527865135  10.6.15.144 → 192.168.1.16 SSH 1514 Server: Encrypted packet (len=1448)
  346 21.527869851 192.168.1.16 → 10.6.15.144  TCP 66 59298 → 22 [ACK] Seq=11801 Ack=178657 Win=5703 Len=0 TSval=5401086 TSecr=5997451
  347 21.538633241  10.6.15.144 → 192.168.1.16 SSH 1514 Server: Encrypted packet (len=1448)
  348 21.538946093  10.6.15.144 → 192.168.1.16 SSH 1514 Server: [TCP Previous segment not captured] , Encrypted packet (len=1448)
  349 21.538953839 192.168.1.16 → 10.6.15.144  TCP 78 59298 → 22 [ACK] Seq=11801 Ack=180105 Win=5703 Len=0 TSval=5401089 TSecr=5997454 SLE=181553 SRE=183001
  350 21.539137818  10.6.15.144 → 192.168.1.16 SSH 1514 Server: Encrypted packet (len=1448)
  351 21.539143046 192.168.1.16 → 10.6.15.144  TCP 78 [TCP Dup ACK 349#1] 59298 → 22 [ACK] Seq=11801 Ack=180105 Win=5703 Len=0 TSval=5401089 TSecr=5997454 SLE=181553 SRE=184449
  352 21.539328903  10.6.15.144 → 192.168.1.16 SSH 1514 Server: Encrypted packet (len=1448)
  353 21.539333068 192.168.1.16 → 10.6.15.144  TCP 78 [TCP Dup ACK 349#2] 59298 → 22 [ACK] Seq=11801 Ack=180105 Win=5703 Len=0 TSval=5401089 TSecr=5997454 SLE=181553 SRE=185897
  354 21.539671791  10.6.15.144 → 192.168.1.16 SSH 1514 Server: Encrypted packet (len=1448)
  355 21.539676315 192.168.1.16 → 10.6.15.144  TCP 78 [TCP Dup ACK 349#3] 59298 → 22 [ACK] Seq=11801 Ack=180105 Win=5703 Len=0 TSval=5401089 TSecr=5997454 SLE=181553 SRE=187345
  356 21.549721255  10.6.15.144 → 192.168.1.16 SSH 1514 Server: Encrypted packet (len=1448)
  357 21.549738930 192.168.1.16 → 10.6.15.144  TCP 78 [TCP Dup ACK 349#4] 59298 → 22 [ACK] Seq=11801 Ack=180105 Win=5703 Len=0 TSval=5401091 TSecr=5997454 SLE=181553 SRE=188793
  358 21.549903682  10.6.15.144 → 192.168.1.16 SSH 1514 Server: Encrypted packet (len=1448)
  359 21.549909527 192.168.1.16 → 10.6.15.144  TCP 78 [TCP Dup ACK 349#5] 59298 → 22 [ACK] Seq=11801 Ack=180105 Win=5703 Len=0 TSval=5401091 TSecr=5997454 SLE=181553 SRE=190241
  360 21.550097270  10.6.15.144 → 192.168.1.16 SSH 1514 Server: Encrypted packet (len=1448)
  361 21.550104007 192.168.1.16 → 10.6.15.144  TCP 78 [TCP Dup ACK 349#6] 59298 → 22 [ACK] Seq=11801 Ack=180105 Win=5703 Len=0 TSval=5401092 TSecr=5997454 SLE=181553 SRE=191689
  362 21.550441857  10.6.15.144 → 192.168.1.16 SSH 1514 Server: Encrypted packet (len=1448)
  363 21.550448606 192.168.1.16 → 10.6.15.144  TCP 78 [TCP Dup ACK 349#7] 59298 → 22 [ACK] Seq=11801 Ack=180105 Win=5703 Len=0 TSval=5401092 TSecr=5997454 SLE=181553 SRE=193137
  364 21.550632825  10.6.15.144 → 192.168.1.16 SSH 1514 Server: [TCP Fast Retransmission] , Encrypted packet (len=1448)
