    1 0.000000000  10.6.15.145 → 192.168.1.16 SSH 102 Server: Encrypted packet (len=36)
    2 0.000024584 192.168.1.16 → 10.6.15.145  TCP 66 52104 → 22 [ACK] Seq=1 Ack=37 Win=6157 Len=0 TSval=1394208 TSecr=24208594
    3 0.000378226  10.6.15.145 → 192.168.1.16 SSH 102 Server: Encrypted packet (len=36)
    4 0.000385818 192.168.1.16 → 10.6.15.145  TCP 66 52104 → 22 [ACK] Seq=1 Ack=73 Win=6157 Len=0 TSval=1394208 TSecr=24208594
    5 0.001119120  10.6.15.145 → 192.168.1.16 SSH 102 Server: Encrypted packet (len=36)
    6 0.001127192 192.168.1.16 → 10.6.15.145  TCP 66 52104 → 22 [ACK] Seq=1 Ack=109 Win=6157 Len=0 TSval=1394208 TSecr=24208595
    7 0.001502596  10.6.15.145 → 192.168.1.16 SSH 102 Server: Encrypted packet (len=36)
    8 0.001511267 192.168.1.16 → 10.6.15.145  TCP 66 52104 → 22 [ACK] Seq=1 Ack=145 Win=6157 Len=0 TSval=1394208 TSecr=24208610
    9 0.001536114  10.6.15.145 → 192.168.1.16 SSH 210 Server: Encrypted packet (len=144)
   10 0.001542597 192.168.1.16 → 10.6.15.145  TCP 66 52104 → 22 [ACK] Seq=1 Ack=289 Win=6157 Len=0 TSval=1394208 TSecr=24208622
   11 0.001556387  10.6.15.145 → 192.168.1.16 SSH 174 Server: Encrypted packet (len=108)
   12 0.001559634 192.168.1.16 → 10.6.15.145  TCP 66 52104 → 22 [ACK] Seq=1 Ack=397 Win=6157 Len=0 TSval=1394208 TSecr=24208712
   13 0.001794151 192.168.1.16 → 10.6.15.145  SSH 102 Client: Encrypted packet (len=36)
   14 0.002124496 192.168.1.16 → 10.6.15.145  SSH 342 Client: Encrypted packet (len=276)
   15 0.003636122  10.6.15.145 → 192.168.1.16 TCP 66 22 → 52104 [ACK] Seq=397 Ack=313 Win=1452 Len=0 TSval=24208734 TSecr=1394208
   16 0.078940949  192.168.1.1 → 255.255.255.255 DHCP 298 DHCP NAK      - Transaction ID 0xd076604d
   17 0.992138256  10.6.15.145 → 192.168.1.16 SSH 126 Server: Encrypted packet (len=60)
   18 0.992159114  10.6.15.145 → 192.168.1.16 SSH 102 Server: Encrypted packet (len=36)
   19 0.992218155 192.168.1.16 → 10.6.15.145  TCP 66 52104 → 22 [ACK] Seq=313 Ack=493 Win=6157 Len=0 TSval=1394456 TSecr=24208858
   20 0.992346582  10.6.15.145 → 192.168.1.16 SSH 1514 Server: Encrypted packet (len=1448)
   21 0.992773646  10.6.15.145 → 192.168.1.16 SSH 406 Server: Encrypted packet (len=340)
   22 0.992778621 192.168.1.16 → 10.6.15.145  TCP 66 52104 → 22 [ACK] Seq=313 Ack=2281 Win=6157 Len=0 TSval=1394456 TSecr=24208865
   23 0.992969861  10.6.15.145 → 192.168.1.16 SSH 1514 Server: Encrypted packet (len=1448)
   24 0.993139483  10.6.15.145 → 192.168.1.16 SSH 1374 Server: Encrypted packet (len=1308)
   25 0.993145804 192.168.1.16 → 10.6.15.145  TCP 66 52104 → 22 [ACK] Seq=313 Ack=5037 Win=6157 Len=0 TSval=1394456 TSecr=24208866
   26 0.994423562  10.6.15.145 → 192.168.1.16 SSH 1514 Server: Encrypted packet (len=1448)
   27 0.994621236  10.6.15.145 → 192.168.1.16 SSH 1514 Server: Encrypted packet (len=1448)
   28 0.994631194 192.168.1.16 → 10.6.15.145  TCP 66 52104 → 22 [ACK] Seq=313 Ack=7933 Win=6157 Len=0 TSval=1394457 TSecr=24208981
   29 0.995251711  10.6.15.145 → 192.168.1.16 SSH 1386 Server: Encrypted packet (len=1320)
   30 1.038187801 192.168.1.16 → 10.6.15.145  TCP 66 52104 → 22 [ACK] Seq=313 Ack=9253 Win=6157 Len=0 TSval=1394468 TSecr=24208982
   31 1.984288891  10.6.15.145 → 192.168.1.16 SSH 1294 Server: Encrypted packet (len=1228)
   32 1.984311908 192.168.1.16 → 10.6.15.145  TCP 66 52104 → 22 [ACK] Seq=313 Ack=10481 Win=6157 Len=0 TSval=1394704 TSecr=24209125
   33 1.984397585  10.6.15.145 → 192.168.1.16 SSH 1022 Server: Encrypted packet (len=956)
   34 1.984403874 192.168.1.16 → 10.6.15.145  TCP 66 52104 → 22 [ACK] Seq=313 Ack=11437 Win=6157 Len=0 TSval=1394704 TSecr=24209125
   35 1.984533840  10.6.15.145 → 192.168.1.16 SSH 1046 Server: Encrypted packet (len=980)
   36 1.984539137 192.168.1.16 → 10.6.15.145  TCP 66 52104 → 22 [ACK] Seq=313 Ack=12417 Win=6157 Len=0 TSval=1394704 TSecr=24209125
   37 1.985151893  10.6.15.145 → 192.168.1.16 SSH 1438 Server: Encrypted packet (len=1372)
   38 1.985163601 192.168.1.16 → 10.6.15.145  TCP 66 52104 → 22 [ACK] Seq=313 Ack=13789 Win=6157 Len=0 TSval=1394704 TSecr=24209125
   39 1.985279249  10.6.15.145 → 192.168.1.16 SSH 1046 Server: Encrypted packet (len=980)
   40 1.985284202 192.168.1.16 → 10.6.15.145  TCP 66 52104 → 22 [ACK] Seq=313 Ack=14769 Win=6157 Len=0 TSval=1394704 TSecr=24209125
   41 1.985377708  10.6.15.145 → 192.168.1.16 SSH 878 Server: Encrypted packet (len=812)
   42 1.985385618 192.168.1.16 → 10.6.15.145  TCP 66 52104 → 22 [ACK] Seq=313 Ack=15581 Win=6157 Len=0 TSval=1394704 TSecr=24209125
   43 1.986873004  10.6.15.145 → 192.168.1.16 SSH 1514 Server: Encrypted packet (len=1448)
   44 1.986887040 192.168.1.16 → 10.6.15.145  TCP 66 52104 → 22 [ACK] Seq=313 Ack=17029 Win=6157 Len=0 TSval=1394705 TSecr=24209230
   45 1.987060725  10.6.15.145 → 192.168.1.16 SSH 1514 Server: Encrypted packet (len=1448)
   46 1.987067294 192.168.1.16 → 10.6.15.145  TCP 66 52104 → 22 [ACK] Seq=313 Ack=18477 Win=6157 Len=0 TSval=1394705 TSecr=24209230
   47 1.988197496  10.6.15.145 → 192.168.1.16 SSH 1514 Server: Encrypted packet (len=1448)
   48 1.988215421 192.168.1.16 → 10.6.15.145  TCP 66 52104 → 22 [ACK] Seq=313 Ack=19925 Win=6157 Len=0 TSval=1394705 TSecr=24209230
   49 1.988379159  10.6.15.145 → 192.168.1.16 SSH 1514 Server: Encrypted packet (len=1448)
   50 1.988386895 192.168.1.16 → 10.6.15.145  TCP 66 52104 → 22 [ACK] Seq=313 Ack=21373 Win=6157 Len=0 TSval=1394705 TSecr=24209230
   51 1.988572828  10.6.15.145 → 192.168.1.16 SSH 1514 Server: Encrypted packet (len=1448)
   52 1.988581276 192.168.1.16 → 10.6.15.145  TCP 66 52104 → 22 [ACK] Seq=313 Ack=22821 Win=6157 Len=0 TSval=1394705 TSecr=24209230
   53 1.988695998  10.6.15.145 → 192.168.1.16 SSH 1062 Server: Encrypted packet (len=996)
   54 1.988700743 192.168.1.16 → 10.6.15.145  TCP 66 52104 → 22 [ACK] Seq=313 Ack=23817 Win=6157 Len=0 TSval=1394705 TSecr=24209230
   55 1.989539818 192.168.1.16 → 10.6.15.145  SSH 138 Client: Encrypted packet (len=72)
   56 1.991465956  10.6.15.145 → 192.168.1.16 SSH 102 Server: Encrypted packet (len=36)
   57 1.992469532 192.168.1.16 → 10.6.15.145  SSH 138 Client: Encrypted packet (len=72)
   58 1.996201993  10.6.15.145 → 192.168.1.16 SSH 102 Server: Encrypted packet (len=36)
   59 1.996789966 192.168.1.16 → 10.6.15.145  SSH 118 Client: Encrypted packet (len=52)
   60 1.996989617 192.168.1.16 → 10.6.15.145  SSH 102 Client: Encrypted packet (len=36)
   61 1.997173933 192.168.1.16 → 10.6.15.145  SSH 102 Client: Encrypted packet (len=36)
   62 1.998209171  10.6.15.145 → 192.168.1.16 TCP 66 22 → 52104 [ACK] Seq=23889 Ack=545 Win=1452 Len=0 TSval=24209233 TSecr=1394707
   63 1.998973144 192.168.1.16 → 10.6.15.145  SSH 334 Client: Encrypted packet (len=268)
   64 1.999218436 192.168.1.16 → 10.6.15.145  SSH 142 Client: Encrypted packet (len=76)
   65 2.000542045  10.6.15.145 → 192.168.1.16 TCP 66 22 → 52104 [ACK] Seq=23889 Ack=925 Win=1452 Len=0 TSval=24209233 TSecr=1394707
   66 2.011240266  10.6.15.145 → 192.168.1.16 SSH 134 Server: Encrypted packet (len=68)
   67 2.011261810  10.6.15.145 → 192.168.1.16 SSH 102 Server: Encrypted packet (len=36)
   68 2.011319383 192.168.1.16 → 10.6.15.145  TCP 66 52104 → 22 [ACK] Seq=925 Ack=23993 Win=6157 Len=0 TSval=1394711 TSecr=24209236
   69 2.027952785  10.6.15.145 → 192.168.1.16 SSH 126 Server: Encrypted packet (len=60)
   70 2.027971940  10.6.15.145 → 192.168.1.16 SSH 102 Server: Encrypted packet (len=36)
   71 2.028031041 192.168.1.16 → 10.6.15.145  TCP 66 52104 → 22 [ACK] Seq=925 Ack=24089 Win=6157 Len=0 TSval=1394715 TSecr=24209240
   72 2.040491729  10.6.15.145 → 192.168.1.16 SSH 102 Server: Encrypted packet (len=36)
   73 2.041179529 192.168.1.16 → 10.6.15.145  SSH 398 Client: Encrypted packet (len=332)
   74 2.041931231 192.168.1.16 → 10.6.15.145  SSH 138 Client: Encrypted packet (len=72)
   75 2.042131693 192.168.1.16 → 10.6.15.145  SSH 138 Client: Encrypted packet (len=72)
   76 2.042717952 192.168.1.16 → 10.6.15.145  SSH 510 Client: Encrypted packet (len=444)
   77 2.043332678 192.168.1.16 → 10.6.15.145  SSH 510 Client: Encrypted packet (len=444)
   78 2.043807152  10.6.15.145 → 192.168.1.16 TCP 66 22 → 52104 [ACK] Seq=24125 Ack=1329 Win=1452 Len=0 TSval=24209244 TSecr=1394718
   79 2.044199885  10.6.15.145 → 192.168.1.16 SSH 102 Server: Encrypted packet (len=36)
   80 2.044218928  10.6.15.145 → 192.168.1.16 SSH 102 Server: Encrypted packet (len=36)
   81 2.044277636 192.168.1.16 → 10.6.15.145  TCP 66 52104 → 22 [ACK] Seq=2289 Ack=24197 Win=6157 Len=0 TSval=1394719 TSecr=24209244
   82 2.045318377  10.6.15.145 → 192.168.1.16 TCP 66 22 → 52104 [ACK] Seq=24197 Ack=2289 Win=1452 Len=0 TSval=24209244 TSecr=1394719
   83 2.049041971 192.168.1.16 → 10.6.15.145  SSH 510 Client: Encrypted packet (len=444)
   84 2.049347690 192.168.1.16 → 10.6.15.145  SSH 510 Client: Encrypted packet (len=444)
   85 2.050757064  10.6.15.145 → 192.168.1.16 TCP 66 22 → 52104 [ACK] Seq=24197 Ack=3177 Win=1452 Len=0 TSval=24209246 TSecr=1394720
   86 2.053107813 192.168.1.16 → 10.6.15.145  SSH 110 Client: Encrypted packet (len=44)
   87 2.055459180 192.168.1.16 → 10.6.15.145  SSH 110 Client: Encrypted packet (len=44)
   88 2.056900733  10.6.15.145 → 192.168.1.16 TCP 66 22 → 52104 [ACK] Seq=24197 Ack=3265 Win=1452 Len=0 TSval=24209247 TSecr=1394721
   89 2.057219816 192.168.1.16 → 10.6.15.145  SSH 110 Client: Encrypted packet (len=44)
   90 2.065252317 192.168.1.16 → 10.6.15.145  SSH 110 Client: Encrypted packet (len=44)
   91 2.066171273 192.168.1.16 → 10.6.15.145  SSH 102 Client: Encrypted packet (len=36)
   92 2.066956805 192.168.1.16 → 10.6.15.145  SSH 118 Client: Encrypted packet (len=52)
   93 2.086177145 192.168.1.16 → 10.6.15.145  TCP 118 [TCP Retransmission] 52104 → 22 [PSH, ACK] Seq=3389 Ack=24197 Win=6157 Len=52 TSval=1394730 TSecr=24209247
   94 2.087556555  10.6.15.145 → 192.168.1.16 TCP 78 22 → 52104 [ACK] Seq=24197 Ack=3441 Win=1452 Len=0 TSval=24209255 TSecr=1394722 SLE=3389 SRE=3441
   95 2.134796836 192.168.1.16 → 10.6.15.145  SSH 102 Client: Encrypted packet (len=36)
   96 2.135248146 192.168.1.16 → 10.6.15.145  SSH 102 Client: Encrypted packet (len=36)
   97 2.135907722 192.168.1.16 → 10.6.15.145  SSH 102 Client: Encrypted packet (len=36)
   98 2.136189903  10.6.15.145 → 192.168.1.16 TCP 66 22 → 52104 [ACK] Seq=24197 Ack=3477 Win=1452 Len=0 TSval=24209267 TSecr=1394742
   99 2.136575654  10.6.15.145 → 192.168.1.16 TCP 66 22 → 52104 [ACK] Seq=24197 Ack=3513 Win=1452 Len=0 TSval=24209267 TSecr=1394742
  100 2.137251766  10.6.15.145 → 192.168.1.16 TCP 66 22 → 52104 [ACK] Seq=24197 Ack=3549 Win=1452 Len=0 TSval=24209267 TSecr=1394742
  101 2.143413887 192.168.1.16 → 10.6.15.145  SSH 110 Client: Encrypted packet (len=44)
  102 2.143650313 192.168.1.16 → 10.6.15.145  SSH 110 Client: Encrypted packet (len=44)
  103 2.143842116 192.168.1.16 → 10.6.15.145  SSH 110 Client: Encrypted packet (len=44)
  104 2.144608085  10.6.15.145 → 192.168.1.16 TCP 66 22 → 52104 [ACK] Seq=24197 Ack=3593 Win=1452 Len=0 TSval=24209269 TSecr=1394744
  105 2.144994639  10.6.15.145 → 192.168.1.16 TCP 66 22 → 52104 [ACK] Seq=24197 Ack=3637 Win=1452 Len=0 TSval=24209269 TSecr=1394744
  106 2.145007503  10.6.15.145 → 192.168.1.16 TCP 66 22 → 52104 [ACK] Seq=24197 Ack=3681 Win=1452 Len=0 TSval=24209269 TSecr=1394744
  107 2.151524442 192.168.1.16 → 10.6.15.145  SSH 102 Client: Encrypted packet (len=36)
  108 2.152803219  10.6.15.145 → 192.168.1.16 TCP 66 22 → 52104 [ACK] Seq=24197 Ack=3717 Win=1452 Len=0 TSval=24209271 TSecr=1394746
  109 2.154177978 192.168.1.16 → 10.6.15.145  SSH 102 Client: Encrypted packet (len=36)
  110 2.154848365 192.168.1.16 → 10.6.15.145  SSH 102 Client: Encrypted packet (len=36)
  111 2.155439855 192.168.1.16 → 10.6.15.145  SSH 102 Client: Encrypted packet (len=36)
  112 2.157803447  10.6.15.145 → 192.168.1.16 TCP 66 22 → 52104 [ACK] Seq=24197 Ack=3753 Win=1452 Len=0 TSval=24209272 TSecr=1394747
  113 2.157822638 192.168.1.16 → 10.6.15.145  SSH 226 Client: Encrypted packet (len=160)
  114 2.157839947  10.6.15.145 → 192.168.1.16 TCP 66 22 → 52104 [ACK] Seq=24197 Ack=3789 Win=1452 Len=0 TSval=24209272 TSecr=1394747
  115 2.159173084  10.6.15.145 → 192.168.1.16 TCP 66 22 → 52104 [ACK] Seq=24197 Ack=3825 Win=1452 Len=0 TSval=24209273 TSecr=1394747
  116 2.159190214  10.6.15.145 → 192.168.1.16 TCP 66 22 → 52104 [ACK] Seq=24197 Ack=3985 Win=1451 Len=0 TSval=24209273 TSecr=1394747
  117 4.037729927 192.168.1.16 → 54.172.47.69 STUN 62 Binding Request
  118 4.992859905  10.6.15.145 → 192.168.1.16 SSH 1514 Server: Encrypted packet (len=1448)
  119 4.992986105  10.6.15.145 → 192.168.1.16 SSH 1514 Server: Encrypted packet (len=1448)
  120 4.992990748 192.168.1.16 → 10.6.15.145  TCP 66 52104 → 22 [ACK] Seq=3985 Ack=27093 Win=6157 Len=0 TSval=1395456 TSecr=24209947
  121 4.993148472 192.168.1.16 → 10.6.15.145  SSH 142 Client: Encrypted packet (len=76)
  122 4.993201103  10.6.15.145 → 192.168.1.16 SSH 1514 Server: Encrypted packet (len=1448)
  123 4.993377754  10.6.15.145 → 192.168.1.16 SSH 1514 Server: Encrypted packet (len=1448)
  124 4.993381832 192.168.1.16 → 10.6.15.145  TCP 66 52104 → 22 [ACK] Seq=4061 Ack=29989 Win=6157 Len=0 TSval=1395456 TSecr=24209947
  125 4.993568587  10.6.15.145 → 192.168.1.16 SSH 1514 Server: Encrypted packet (len=1448)
  126 4.993761986  10.6.15.145 → 192.168.1.16 SSH 1514 Server: Encrypted packet (len=1448)
  127 4.993766435 192.168.1.16 → 10.6.15.145  TCP 66 52104 → 22 [ACK] Seq=4061 Ack=32885 Win=6157 Len=0 TSval=1395456 TSecr=24209947
  128 4.994113012 192.168.1.16 → 10.6.15.145  SSH 102 Client: Encrypted packet (len=36)
  129 4.994360930 192.168.1.16 → 10.6.15.145  SSH 102 Client: Encrypted packet (len=36)
  130 4.994973600 192.168.1.16 → 10.6.15.145  SSH 102 Client: Encrypted packet (len=36)
  131 4.995300471 192.168.1.16 → 10.6.15.145  SSH 166 Client: Encrypted packet (len=100)
  132 4.995492269 192.168.1.16 → 10.6.15.145  SSH 226 Client: Encrypted packet (len=160)
  133 4.995807431  10.6.15.145 → 192.168.1.16 SSH 1514 Server: Encrypted packet (len=1448)
  134 4.996575755  10.6.15.145 → 192.168.1.16 SSH 1514 Server: Encrypted packet (len=1448)
  135 4.996587572 192.168.1.16 → 10.6.15.145  TCP 66 52104 → 22 [ACK] Seq=4429 Ack=35781 Win=6157 Len=0 TSval=1395457 TSecr=24209982
  136 4.996599367  10.6.15.145 → 192.168.1.16 TCP 66 22 → 52104 [ACK] Seq=35781 Ack=4061 Win=1452 Len=0 TSval=24209982 TSecr=1395456
  137 4.996604951 192.168.1.16 → 10.6.15.145  SSH 174 Client: Encrypted packet (len=108)
  138 4.997713808  10.6.15.145 → 192.168.1.16 SSH 1514 Server: Encrypted packet (len=1448)
  139 4.997898263  10.6.15.145 → 192.168.1.16 SSH 1514 Server: Encrypted packet (len=1448)
  140 4.997908449 192.168.1.16 → 10.6.15.145  TCP 66 52104 → 22 [ACK] Seq=4537 Ack=38677 Win=6157 Len=0 TSval=1395457 TSecr=24209982
  141 4.998091584  10.6.15.145 → 192.168.1.16 SSH 1514 Server: Encrypted packet (len=1448)
  142 4.998190880  10.6.15.145 → 192.168.1.16 SSH 850 Server: Encrypted packet (len=784)
  143 4.998198200 192.168.1.16 → 10.6.15.145  TCP 66 52104 → 22 [ACK] Seq=4537 Ack=40909 Win=6157 Len=0 TSval=1395458 TSecr=24209982
  144 4.998207217  10.6.15.145 → 192.168.1.16 TCP 66 22 → 52104 [ACK] Seq=40909 Ack=4133 Win=1452 Len=0 TSval=24209982 TSecr=1395456
  145 4.998216256  10.6.15.145 → 192.168.1.16 TCP 66 22 → 52104 [ACK] Seq=40909 Ack=4269 Win=1452 Len=0 TSval=24209982 TSecr=1395457
  146 4.998628909  10.6.15.145 → 192.168.1.16 SSH 174 Server: Encrypted packet (len=108)
  147 4.999264761 192.168.1.16 → 10.6.15.145  SSH 426 Client: Encrypted packet (len=360)
  148 5.000236457 192.168.1.16 → 10.6.15.145  SSH 382 Client: Encrypted packet (len=316)
  149 5.000494473 192.168.1.16 → 10.6.15.145  SSH 174 Client: Encrypted packet (len=108)
  150 5.000682410 192.168.1.16 → 10.6.15.145  SSH 382 Client: Encrypted packet (len=316)
  151 5.000925056 192.168.1.16 → 10.6.15.145  SSH 234 Client: Encrypted packet (len=168)
  152 5.001023130  10.6.15.145 → 192.168.1.16 TCP 66 22 → 52104 [ACK] Seq=41017 Ack=4897 Win=1452 Len=0 TSval=24209983 TSecr=1395457
  153 5.001387085 192.168.1.16 → 10.6.15.145  SSH 150 Client: Encrypted packet (len=84)
  154 5.001583692 192.168.1.16 → 10.6.15.145  SSH 402 Client: Encrypted packet (len=336)
  155 5.002055997  10.6.15.145 → 192.168.1.16 TCP 66 22 → 52104 [ACK] Seq=41017 Ack=5637 Win=1452 Len=0 TSval=24209984 TSecr=1395458
  156 5.002245489 192.168.1.16 → 10.6.15.145  SSH 510 Client: Encrypted packet (len=444)
  157 5.002757121  10.6.15.145 → 192.168.1.16 TCP 66 22 → 52104 [ACK] Seq=41017 Ack=5889 Win=1452 Len=0 TSval=24209984 TSecr=1395458
  158 5.003885355  10.6.15.145 → 192.168.1.16 TCP 66 22 → 52104 [ACK] Seq=41017 Ack=6669 Win=1452 Len=0 TSval=24209984 TSecr=1395458
  159 5.036657664  10.6.15.145 → 192.168.1.16 SSH 1166 Server: Encrypted packet (len=1100)
  160 5.037167679  10.6.15.145 → 192.168.1.16 SSH 1190 Server: Encrypted packet (len=1124)
  161 5.037177910 192.168.1.16 → 10.6.15.145  TCP 66 52104 → 22 [ACK] Seq=6669 Ack=43241 Win=6157 Len=0 TSval=1395467 TSecr=24209992
  162 5.037674226  10.6.15.145 → 192.168.1.16 SSH 1158 Server: Encrypted packet (len=1092)
  163 5.038242520  10.6.15.145 → 192.168.1.16 SSH 1514 Server: Encrypted packet (len=1448)
  164 5.038252516 192.168.1.16 → 10.6.15.145  TCP 66 52104 → 22 [ACK] Seq=6669 Ack=45781 Win=6157 Len=0 TSval=1395468 TSecr=24209992
  165 5.038400909  10.6.15.145 → 192.168.1.16 SSH 1358 Server: Encrypted packet (len=1292)
  166 5.039311285 192.168.1.16 → 10.6.15.145  SSH 206 Client: Encrypted packet (len=140)
  167 5.061794957  10.6.15.145 → 192.168.1.16 SSH 198 Server: Encrypted packet (len=132)
  168 5.061825551  10.6.15.145 → 192.168.1.16 SSH 150 Server: Encrypted packet (len=84)
  169 5.061868680 192.168.1.16 → 10.6.15.145  TCP 66 52104 → 22 [ACK] Seq=6809 Ack=47289 Win=6157 Len=0 TSval=1395473 TSecr=24209998
  170 5.062368389  10.6.15.145 → 192.168.1.16 SSH 470 Server: Encrypted packet (len=404)
  171 5.063679996 192.168.1.16 → 10.6.15.145  SSH 206 Client: Encrypted packet (len=140)
  172 5.067633079  10.6.15.145 → 192.168.1.16 SSH 350 Server: Encrypted packet (len=284)
  173 5.093865352 192.168.1.16 → 10.6.15.145  SSH 510 Client: Encrypted packet (len=444)
  174 5.095529099  10.6.15.145 → 192.168.1.16 TCP 66 22 → 52104 [ACK] Seq=47977 Ack=7393 Win=1452 Len=0 TSval=24210007 TSecr=1395474
  175 5.105895322  10.6.15.145 → 192.168.1.16 SSH 1514 Server: Encrypted packet (len=1448)
  176 5.106079463  10.6.15.145 → 192.168.1.16 SSH 1514 Server: Encrypted packet (len=1448)
  177 5.106091304 192.168.1.16 → 10.6.15.145  TCP 66 52104 → 22 [ACK] Seq=7393 Ack=50873 Win=6157 Len=0 TSval=1395484 TSecr=24210009
  178 5.106647148  10.6.15.145 → 192.168.1.16 SSH 1350 Server: Encrypted packet (len=1284)
  179 5.108388340  10.6.15.145 → 192.168.1.16 SSH 1514 Server: Encrypted packet (len=1448)
  180 5.108407284 192.168.1.16 → 10.6.15.145  TCP 66 52104 → 22 [ACK] Seq=7393 Ack=53605 Win=6157 Len=0 TSval=1395485 TSecr=24210009
  181 5.108572119  10.6.15.145 → 192.168.1.16 SSH 1514 Server: Encrypted packet (len=1448)
  182 5.108763399  10.6.15.145 → 192.168.1.16 SSH 1514 Server: Encrypted packet (len=1448)
  183 5.108773210 192.168.1.16 → 10.6.15.145  TCP 66 52104 → 22 [ACK] Seq=7393 Ack=56501 Win=6157 Len=0 TSval=1395485 TSecr=24210010
  184 5.108964575  10.6.15.145 → 192.168.1.16 SSH 1514 Server: Encrypted packet (len=1448)
  185 5.109145612  10.6.15.145 → 192.168.1.16 SSH 1514 Server: Encrypted packet (len=1448)
  186 5.109155906 192.168.1.16 → 10.6.15.145  TCP 66 52104 → 22 [ACK] Seq=7393 Ack=59397 Win=6157 Len=0 TSval=1395485 TSecr=24210010
  187 5.111486880  10.6.15.145 → 192.168.1.16 SSH 1514 Server: Encrypted packet (len=1448)
  188 5.111681161  10.6.15.145 → 192.168.1.16 SSH 1514 Server: Encrypted packet (len=1448)
  189 5.111699601 192.168.1.16 → 10.6.15.145  TCP 66 52104 → 22 [ACK] Seq=7393 Ack=62293 Win=6157 Len=0 TSval=1395486 TSecr=24210011
  190 5.111865073  10.6.15.145 → 192.168.1.16 SSH 1514 Server: Encrypted packet (len=1448)
  191 5.112056003  10.6.15.145 → 192.168.1.16 SSH 1514 Server: Encrypted packet (len=1448)
  192 5.112061417 192.168.1.16 → 10.6.15.145  TCP 66 52104 → 22 [ACK] Seq=7393 Ack=65189 Win=6157 Len=0 TSval=1395486 TSecr=24210011
  193 5.112636034  10.6.15.145 → 192.168.1.16 SSH 1514 Server: Encrypted packet (len=1448)
  194 5.112828759  10.6.15.145 → 192.168.1.16 SSH 1514 Server: Encrypted packet (len=1448)
  195 5.112835805 192.168.1.16 → 10.6.15.145  TCP 66 52104 → 22 [ACK] Seq=7393 Ack=68085 Win=6157 Len=0 TSval=1395486 TSecr=24210011
  196 5.114303568  10.6.15.145 → 192.168.1.16 SSH 1514 Server: Encrypted packet (len=1448)
  197 5.114494297  10.6.15.145 → 192.168.1.16 SSH 1514 Server: Encrypted packet (len=1448)
  198 5.114502713 192.168.1.16 → 10.6.15.145  TCP 66 52104 → 22 [ACK] Seq=7393 Ack=70981 Win=6157 Len=0 TSval=1395487 TSecr=24210011
  199 5.115516035  10.6.15.145 → 192.168.1.16 SSH 1514 Server: Encrypted packet (len=1448)
  200 5.115705964  10.6.15.145 → 192.168.1.16 SSH 1514 Server: Encrypted packet (len=1448)
  201 5.115713261 192.168.1.16 → 10.6.15.145  TCP 66 52104 → 22 [ACK] Seq=7393 Ack=73877 Win=6157 Len=0 TSval=1395487 TSecr=24210011
  202 5.115898198  10.6.15.145 → 192.168.1.16 SSH 1514 Server: Encrypted packet (len=1448)
  203 5.116090578  10.6.15.145 → 192.168.1.16 SSH 1514 Server: Encrypted packet (len=1448)
  204 5.116095922 192.168.1.16 → 10.6.15.145  TCP 66 52104 → 22 [ACK] Seq=7393 Ack=76773 Win=6157 Len=0 TSval=1395487 TSecr=24210011
  205 5.116105214  10.6.15.145 → 192.168.1.16 SSH 322 Server: Encrypted packet (len=256)
  206 5.156438690  10.6.15.145 → 192.168.1.16 SSH 110 Server: Encrypted packet (len=44)
  207 5.156456757 192.168.1.16 → 10.6.15.145  TCP 66 52104 → 22 [ACK] Seq=7393 Ack=77073 Win=6157 Len=0 TSval=1395497 TSecr=24210012
  208 5.156779390 192.168.1.16 → 10.6.15.145  SSH 150 Client: Encrypted packet (len=84)
  209 5.164136514  10.6.15.145 → 192.168.1.16 SSH 1514 Server: Encrypted packet (len=1448)
  210 5.164168322  10.6.15.145 → 192.168.1.16 SSH 126 Server: Encrypted packet (len=60)
  211 5.164180696 192.168.1.16 → 10.6.15.145  TCP 66 52104 → 22 [ACK] Seq=7477 Ack=78581 Win=6157 Len=0 TSval=1395499 TSecr=24210024
  212 5.164964071  10.6.15.145 → 192.168.1.16 SSH 1514 Server: Encrypted packet (len=1448)
  213 5.165152345  10.6.15.145 → 192.168.1.16 SSH 1514 Server: Encrypted packet (len=1448)
  214 5.165166400 192.168.1.16 → 10.6.15.145  TCP 66 52104 → 22 [ACK] Seq=7477 Ack=81477 Win=6157 Len=0 TSval=1395499 TSecr=24210024
  215 5.165757956  10.6.15.145 → 192.168.1.16 SSH 1514 Server: Encrypted packet (len=1448)
  216 5.165773744  10.6.15.145 → 192.168.1.16 SSH 110 Server: Encrypted packet (len=44)
  217 5.165781659 192.168.1.16 → 10.6.15.145  TCP 66 52104 → 22 [ACK] Seq=7477 Ack=82969 Win=6157 Len=0 TSval=1395499 TSecr=24210024
  218 5.166373152  10.6.15.145 → 192.168.1.16 SSH 1514 Server: Encrypted packet (len=1448)
  219 5.166558982  10.6.15.145 → 192.168.1.16 SSH 1514 Server: Encrypted packet (len=1448)
  220 5.166572356 192.168.1.16 → 10.6.15.145  TCP 66 52104 → 22 [ACK] Seq=7477 Ack=85865 Win=6157 Len=0 TSval=1395500 TSecr=24210024
  221 5.172452661  10.6.15.145 → 192.168.1.16 SSH 1514 Server: Encrypted packet (len=1448)
  222 5.172638138  10.6.15.145 → 192.168.1.16 SSH 1514 Server: Encrypted packet (len=1448)
  223 5.172655549 192.168.1.16 → 10.6.15.145  TCP 66 52104 → 22 [ACK] Seq=7477 Ack=88761 Win=6157 Len=0 TSval=1395501 TSecr=24210024
  224 5.172828214  10.6.15.145 → 192.168.1.16 SSH 1514 Server: Encrypted packet (len=1448)
  225 5.173021327  10.6.15.145 → 192.168.1.16 SSH 1514 Server: Encrypted packet (len=1448)
  226 5.173032490 192.168.1.16 → 10.6.15.145  TCP 66 52104 → 22 [ACK] Seq=7477 Ack=91657 Win=6157 Len=0 TSval=1395501 TSecr=24210025
  227 5.173146640  10.6.15.145 → 192.168.1.16 SSH 1094 Server: Encrypted packet (len=1028)
  228 5.173350990  10.6.15.145 → 192.168.1.16 SSH 1514 Server: Encrypted packet (len=1448)
  229 5.173359487 192.168.1.16 → 10.6.15.145  TCP 66 52104 → 22 [ACK] Seq=7477 Ack=94133 Win=6157 Len=0 TSval=1395501 TSecr=24210025
  230 5.173544023  10.6.15.145 → 192.168.1.16 SSH 1514 Server: Encrypted packet (len=1448)
  231 5.173735259  10.6.15.145 → 192.168.1.16 SSH 1514 Server: Encrypted packet (len=1448)
  232 5.173744727 192.168.1.16 → 10.6.15.145  TCP 66 52104 → 22 [ACK] Seq=7477 Ack=97029 Win=6157 Len=0 TSval=1395501 TSecr=24210026
  233 5.173926280  10.6.15.145 → 192.168.1.16 SSH 1514 Server: Encrypted packet (len=1448)
  234 5.174496003  10.6.15.145 → 192.168.1.16 SSH 1094 Server: Encrypted packet (len=1028)
  235 5.174513265 192.168.1.16 → 10.6.15.145  TCP 66 52104 → 22 [ACK] Seq=7477 Ack=99505 Win=6157 Len=0 TSval=1395502 TSecr=24210026
  236 5.177116539 192.168.1.16 → 10.6.15.145  SSH 102 Client: Encrypted packet (len=36)
  237 5.178484416 192.168.1.16 → 10.6.15.145  SSH 110 Client: Encrypted packet (len=44)
  238 5.179756361  10.6.15.145 → 192.168.1.16 TCP 66 22 → 52104 [ACK] Seq=99505 Ack=7557 Win=1452 Len=0 TSval=24210028 TSecr=1395502
  239 5.190280488  10.6.15.145 → 192.168.1.16 SSH 1514 Server: Encrypted packet (len=1448)
  240 5.190463766  10.6.15.145 → 192.168.1.16 SSH 1514 Server: Encrypted packet (len=1448)
  241 5.190477926 192.168.1.16 → 10.6.15.145  TCP 66 52104 → 22 [ACK] Seq=7557 Ack=102401 Win=6157 Len=0 TSval=1395506 TSecr=24210030
  242 5.191039526  10.6.15.145 → 192.168.1.16 SSH 1514 Server: Encrypted packet (len=1448)
  243 5.191054028  10.6.15.145 → 192.168.1.16 SSH 110 Server: Encrypted packet (len=44)
  244 5.191061411 192.168.1.16 → 10.6.15.145  TCP 66 52104 → 22 [ACK] Seq=7557 Ack=103893 Win=6157 Len=0 TSval=1395506 TSecr=24210030
  245 5.192128354  10.6.15.145 → 192.168.1.16 SSH 1514 Server: Encrypted packet (len=1448)
  246 5.192313405  10.6.15.145 → 192.168.1.16 SSH 1514 Server: Encrypted packet (len=1448)
  247 5.192324993 192.168.1.16 → 10.6.15.145  TCP 66 52104 → 22 [ACK] Seq=7557 Ack=106789 Win=6157 Len=0 TSval=1395506 TSecr=24210031
  248 5.192505993  10.6.15.145 → 192.168.1.16 SSH 1514 Server: Encrypted packet (len=1448)
  249 5.192699056  10.6.15.145 → 192.168.1.16 SSH 1514 Server: Encrypted packet (len=1448)
  250 5.192709271 192.168.1.16 → 10.6.15.145  TCP 66 52104 → 22 [ACK] Seq=7557 Ack=109685 Win=6157 Len=0 TSval=1395506 TSecr=24210031
  251 5.192889445  10.6.15.145 → 192.168.1.16 SSH 1514 Server: Encrypted packet (len=1448)
  252 5.192900154  10.6.15.145 → 192.168.1.16 SSH 110 Server: Encrypted packet (len=44)
  253 5.192905800 192.168.1.16 → 10.6.15.145  TCP 66 52104 → 22 [ACK] Seq=7557 Ack=111177 Win=6157 Len=0 TSval=1395506 TSecr=24210031
  254 5.194011779  10.6.15.145 → 192.168.1.16 SSH 1514 Server: Encrypted packet (len=1448)
  255 5.194199547  10.6.15.145 → 192.168.1.16 SSH 1514 Server: Encrypted packet (len=1448)
  256 5.194214288 192.168.1.16 → 10.6.15.145  TCP 66 52104 → 22 [ACK] Seq=7557 Ack=114073 Win=6157 Len=0 TSval=1395507 TSecr=24210031
  257 5.194390572  10.6.15.145 → 192.168.1.16 SSH 1514 Server: Encrypted packet (len=1448)
  258 5.194581688  10.6.15.145 → 192.168.1.16 SSH 1514 Server: Encrypted packet (len=1448)
  259 5.194592727 192.168.1.16 → 10.6.15.145  TCP 66 52104 → 22 [ACK] Seq=7557 Ack=116969 Win=6157 Len=0 TSval=1395507 TSecr=24210031
  260 5.195250325  10.6.15.145 → 192.168.1.16 SSH 1514 Server: Encrypted packet (len=1448)
  261 5.195438530  10.6.15.145 → 192.168.1.16 SSH 1514 Server: Encrypted packet (len=1448)
  262 5.195450591 192.168.1.16 → 10.6.15.145  TCP 66 52104 → 22 [ACK] Seq=7557 Ack=119865 Win=6157 Len=0 TSval=1395507 TSecr=24210032
  263 5.196503158  10.6.15.145 → 192.168.1.16 SSH 1514 Server: Encrypted packet (len=1448)
  264 5.196689849  10.6.15.145 → 192.168.1.16 SSH 1514 Server: Encrypted packet (len=1448)
  265 5.196701408 192.168.1.16 → 10.6.15.145  TCP 66 52104 → 22 [ACK] Seq=7557 Ack=122761 Win=6157 Len=0 TSval=1395507 TSecr=24210032
  266 5.196881305  10.6.15.145 → 192.168.1.16 SSH 1514 Server: Encrypted packet (len=1448)
  267 5.197074509  10.6.15.145 → 192.168.1.16 SSH 1514 Server: Encrypted packet (len=1448)
  268 5.197082942 192.168.1.16 → 10.6.15.145  TCP 66 52104 → 22 [ACK] Seq=7557 Ack=125657 Win=6157 Len=0 TSval=1395507 TSecr=24210032
  269 5.197671583  10.6.15.145 → 192.168.1.16 SSH 1514 Server: Encrypted packet (len=1448)
  270 5.197686140  10.6.15.145 → 192.168.1.16 SSH 154 Server: Encrypted packet (len=88)
  271 5.197693855 192.168.1.16 → 10.6.15.145  TCP 66 52104 → 22 [ACK] Seq=7557 Ack=127193 Win=6157 Len=0 TSval=1395507 TSecr=24210032
  272 5.204328560  10.6.15.145 → 192.168.1.16 SSH 1514 Server: Encrypted packet (len=1448)
  273 5.204349310  10.6.15.145 → 192.168.1.16 SSH 118 Server: Encrypted packet (len=52)
  274 5.204359791 192.168.1.16 → 10.6.15.145  TCP 66 52104 → 22 [ACK] Seq=7557 Ack=128693 Win=6157 Len=0 TSval=1395509 TSecr=24210034
  275 5.204994265  10.6.15.145 → 192.168.1.16 SSH 1514 Server: Encrypted packet (len=1448)
  276 5.205187972  10.6.15.145 → 192.168.1.16 SSH 1514 Server: Encrypted packet (len=1448)
  277 5.205198921 192.168.1.16 → 10.6.15.145  TCP 66 52104 → 22 [ACK] Seq=7557 Ack=131589 Win=6157 Len=0 TSval=1395509 TSecr=24210034
  278 5.205216668  10.6.15.145 → 192.168.1.16 SSH 134 Server: Encrypted packet (len=68)
  279 5.208105810  10.6.15.145 → 192.168.1.16 SSH 1514 Server: Encrypted packet (len=1448)
  280 5.208125135 192.168.1.16 → 10.6.15.145  TCP 66 52104 → 22 [ACK] Seq=7557 Ack=133105 Win=6157 Len=0 TSval=1395510 TSecr=24210034
  281 5.208288105  10.6.15.145 → 192.168.1.16 SSH 1514 Server: Encrypted packet (len=1448)
  282 5.208703427  10.6.15.145 → 192.168.1.16 SSH 134 Server: Encrypted packet (len=68)
  283 5.208712242 192.168.1.16 → 10.6.15.145  TCP 66 52104 → 22 [ACK] Seq=7557 Ack=134621 Win=6157 Len=0 TSval=1395510 TSecr=24210035
  284 5.208929864  10.6.15.145 → 192.168.1.16 SSH 1514 Server: Encrypted packet (len=1448)
  285 5.208941233  10.6.15.145 → 192.168.1.16 SSH 118 Server: Encrypted packet (len=52)
  286 5.208947230 192.168.1.16 → 10.6.15.145  TCP 66 52104 → 22 [ACK] Seq=7557 Ack=136121 Win=6157 Len=0 TSval=1395510 TSecr=24210035
  287 5.212006908  10.6.15.145 → 192.168.1.16 SSH 1514 Server: Encrypted packet (len=1448)
  288 5.212187715  10.6.15.145 → 192.168.1.16 SSH 1514 Server: Encrypted packet (len=1448)
  289 5.212197740 192.168.1.16 → 10.6.15.145  TCP 66 52104 → 22 [ACK] Seq=7557 Ack=139017 Win=6157 Len=0 TSval=1395511 TSecr=24210036
  290 5.212578013  10.6.15.145 → 192.168.1.16 SSH 134 Server: Encrypted packet (len=68)
  291 5.212805396  10.6.15.145 → 192.168.1.16 SSH 1514 Server: Encrypted packet (len=1448)
  292 5.212810842 192.168.1.16 → 10.6.15.145  TCP 66 52104 → 22 [ACK] Seq=7557 Ack=140533 Win=6157 Len=0 TSval=1395511 TSecr=24210036
  293 5.212829903  10.6.15.145 → 192.168.1.16 SSH 118 Server: Encrypted packet (len=52)
  294 5.216195213  10.6.15.145 → 192.168.1.16 SSH 1514 Server: Encrypted packet (len=1448)
  295 5.216212056 192.168.1.16 → 10.6.15.145  TCP 66 52104 → 22 [ACK] Seq=7557 Ack=142033 Win=6157 Len=0 TSval=1395512 TSecr=24210036
  296 5.216383332  10.6.15.145 → 192.168.1.16 SSH 1514 Server: Encrypted packet (len=1448)
  297 5.216571762  10.6.15.145 → 192.168.1.16 SSH 1514 Server: Encrypted packet (len=1448)
  298 5.216580908 192.168.1.16 → 10.6.15.145  TCP 66 52104 → 22 [ACK] Seq=7557 Ack=144929 Win=6157 Len=0 TSval=1395512 TSecr=24210037
  299 5.216594027  10.6.15.145 → 192.168.1.16 SSH 142 Server: Encrypted packet (len=76)
  300 5.216785967  10.6.15.145 → 192.168.1.16 SSH 1514 Server: Encrypted packet (len=1448)
  301 5.216794588 192.168.1.16 → 10.6.15.145  TCP 66 52104 → 22 [ACK] Seq=7557 Ack=146453 Win=6157 Len=0 TSval=1395512 TSecr=24210037
  302 5.216808464  10.6.15.145 → 192.168.1.16 SSH 110 Server: Encrypted packet (len=44)
  303 5.217833646  10.6.15.145 → 192.168.1.16 SSH 1514 Server: Encrypted packet (len=1448)
  304 5.217848054 192.168.1.16 → 10.6.15.145  TCP 66 52104 → 22 [ACK] Seq=7557 Ack=147945 Win=6157 Len=0 TSval=1395512 TSecr=24210037
  305 5.217872693  10.6.15.145 → 192.168.1.16 SSH 110 Server: Encrypted packet (len=44)
  306 5.218041888  10.6.15.145 → 192.168.1.16 SSH 1514 Server: Encrypted packet (len=1448)
  307 5.218049274 192.168.1.16 → 10.6.15.145  TCP 66 52104 → 22 [ACK] Seq=7557 Ack=149437 Win=6157 Len=0 TSval=1395512 TSecr=24210037
  308 5.218241318  10.6.15.145 → 192.168.1.16 SSH 1514 Server: Encrypted packet (len=1448)
  309 5.218422729  10.6.15.145 → 192.168.1.16 SSH 1514 Server: Encrypted packet (len=1448)
  310 5.218429842 192.168.1.16 → 10.6.15.145  TCP 66 52104 → 22 [ACK] Seq=7557 Ack=152333 Win=6157 Len=0 TSval=1395513 TSecr=24210037
  311 5.219950592  10.6.15.145 → 192.168.1.16 SSH 1514 Server: Encrypted packet (len=1448)
  312 5.220957716  10.6.15.145 → 192.168.1.16 SSH 1514 Server: Encrypted packet (len=1448)
  313 5.220967876 192.168.1.16 → 10.6.15.145  TCP 66 52104 → 22 [ACK] Seq=7557 Ack=155229 Win=6157 Len=0 TSval=1395513 TSecr=24210037
  314 5.221148401  10.6.15.145 → 192.168.1.16 SSH 1514 Server: Encrypted packet (len=1448)
  315 5.221341952  10.6.15.145 → 192.168.1.16 SSH 1514 Server: Encrypted packet (len=1448)
  316 5.221349669 192.168.1.16 → 10.6.15.145  TCP 66 52104 → 22 [ACK] Seq=7557 Ack=158125 Win=6157 Len=0 TSval=1395513 TSecr=24210038
  317 5.221532081  10.6.15.145 → 192.168.1.16 SSH 1514 Server: Encrypted packet (len=1448)
  318 5.221725001  10.6.15.145 → 192.168.1.16 SSH 1514 Server: Encrypted packet (len=1448)
  319 5.221733495 192.168.1.16 → 10.6.15.145  TCP 66 52104 → 22 [ACK] Seq=7557 Ack=161021 Win=6157 Len=0 TSval=1395513 TSecr=24210038
  320 5.221777018  10.6.15.145 → 192.168.1.16 SSH 590 Server: Encrypted packet (len=524)
  321 5.223159552  10.6.15.145 → 192.168.1.16 SSH 1514 Server: Encrypted packet (len=1448)
  322 5.223176963 192.168.1.16 → 10.6.15.145  TCP 66 52104 → 22 [ACK] Seq=7557 Ack=162993 Win=6157 Len=0 TSval=1395514 TSecr=24210038
  323 5.223346444  10.6.15.145 → 192.168.1.16 SSH 1514 Server: Encrypted packet (len=1448)
  324 5.223536348  10.6.15.145 → 192.168.1.16 SSH 1514 Server: Encrypted packet (len=1448)
  325 5.223545977 192.168.1.16 → 10.6.15.145  TCP 66 52104 → 22 [ACK] Seq=7557 Ack=165889 Win=6157 Len=0 TSval=1395514 TSecr=24210038
  326 5.223560421  10.6.15.145 → 192.168.1.16 SSH 142 Server: Encrypted packet (len=76)
  327 5.223751430  10.6.15.145 → 192.168.1.16 SSH 1514 Server: Encrypted packet (len=1448)
  328 5.223758541 192.168.1.16 → 10.6.15.145  TCP 66 52104 → 22 [ACK] Seq=7557 Ack=167413 Win=6157 Len=0 TSval=1395514 TSecr=24210038
  329 5.223941281  10.6.15.145 → 192.168.1.16 SSH 1514 Server: Encrypted packet (len=1448)
  330 5.224564970  10.6.15.145 → 192.168.1.16 SSH 1514 Server: Encrypted packet (len=1448)
  331 5.224575009 192.168.1.16 → 10.6.15.145  TCP 66 52104 → 22 [ACK] Seq=7557 Ack=170309 Win=6157 Len=0 TSval=1395514 TSecr=24210039
  332 5.224589309  10.6.15.145 → 192.168.1.16 SSH 142 Server: Encrypted packet (len=76)
  333 5.225593651 192.168.1.16 → 10.6.15.145  SSH 102 Client: Encrypted packet (len=36)
  334 5.225895221 192.168.1.16 → 10.6.15.145  SSH 110 Client: Encrypted packet (len=44)
  335 5.226208449  10.6.15.145 → 192.168.1.16 SSH 1514 Server: Encrypted packet (len=1448)
  336 5.226397126  10.6.15.145 → 192.168.1.16 SSH 1514 Server: Encrypted packet (len=1448)
  337 5.226405221 192.168.1.16 → 10.6.15.145  TCP 66 52104 → 22 [ACK] Seq=7637 Ack=173281 Win=6157 Len=0 TSval=1395515 TSecr=24210039
  338 5.227045047  10.6.15.145 → 192.168.1.16 SSH 1514 Server: Encrypted packet (len=1448)
  339 5.227056773  10.6.15.145 → 192.168.1.16 SSH 142 Server: Encrypted packet (len=76)
  340 5.227066786 192.168.1.16 → 10.6.15.145  TCP 66 52104 → 22 [ACK] Seq=7637 Ack=174805 Win=6157 Len=0 TSval=1395515 TSecr=24210039
  341 5.230337785  10.6.15.145 → 192.168.1.16 TCP 66 22 → 52104 [ACK] Seq=174805 Ack=7637 Win=1452 Len=0 TSval=24210040 TSecr=1395514
  342 5.230567735  10.6.15.145 → 192.168.1.16 SSH 1514 Server: Encrypted packet (len=1448)
  343 5.230758339  10.6.15.145 → 192.168.1.16 SSH 1514 Server: Encrypted packet (len=1448)
  344 5.230770576 192.168.1.16 → 10.6.15.145  TCP 66 52104 → 22 [ACK] Seq=7637 Ack=177701 Win=6157 Len=0 TSval=1395516 TSecr=24210040
  345 5.230786523  10.6.15.145 → 192.168.1.16 SSH 134 Server: Encrypted packet (len=68)
  346 5.230972867  10.6.15.145 → 192.168.1.16 SSH 1514 Server: Encrypted packet (len=1448)
  347 5.230981498 192.168.1.16 → 10.6.15.145  TCP 66 52104 → 22 [ACK] Seq=7637 Ack=179217 Win=6157 Len=0 TSval=1395516 TSecr=24210040
  348 5.230995237  10.6.15.145 → 192.168.1.16 SSH 118 Server: Encrypted packet (len=52)
  349 5.231999518  10.6.15.145 → 192.168.1.16 SSH 1514 Server: Encrypted packet (len=1448)
  350 5.232019050 192.168.1.16 → 10.6.15.145  TCP 66 52104 → 22 [ACK] Seq=7637 Ack=180717 Win=6157 Len=0 TSval=1395516 TSecr=24210040
  351 5.232032360  10.6.15.145 → 192.168.1.16 SSH 118 Server: Encrypted packet (len=52)
  352 5.232836253  10.6.15.145 → 192.168.1.16 SSH 1514 Server: Encrypted packet (len=1448)
  353 5.232851875 192.168.1.16 → 10.6.15.145  TCP 66 52104 → 22 [ACK] Seq=7637 Ack=182217 Win=6157 Len=0 TSval=1395516 TSecr=24210041
  354 5.233023466  10.6.15.145 → 192.168.1.16 SSH 1514 Server: Encrypted packet (len=1448)
  355 5.233466859  10.6.15.145 → 192.168.1.16 SSH 134 Server: Encrypted packet (len=68)
  356 5.233478062 192.168.1.16 → 10.6.15.145  TCP 66 52104 → 22 [ACK] Seq=7637 Ack=183733 Win=6157 Len=0 TSval=1395516 TSecr=24210041
  357 5.234726737  10.6.15.145 → 192.168.1.16 SSH 1514 Server: Encrypted packet (len=1448)
  358 5.234746643  10.6.15.145 → 192.168.1.16 SSH 118 Server: Encrypted packet (len=52)
  359 5.234756528 192.168.1.16 → 10.6.15.145  TCP 66 52104 → 22 [ACK] Seq=7637 Ack=185233 Win=6157 Len=0 TSval=1395517 TSecr=24210041
  360 5.235330008  10.6.15.145 → 192.168.1.16 SSH 1514 Server: Encrypted packet (len=1448)
  361 5.235517246  10.6.15.145 → 192.168.1.16 SSH 1514 Server: Encrypted packet (len=1448)
  362 5.235524894 192.168.1.16 → 10.6.15.145  TCP 66 52104 → 22 [ACK] Seq=7637 Ack=188129 Win=6157 Len=0 TSval=1395517 TSecr=24210042
  363 5.235538021  10.6.15.145 → 192.168.1.16 SSH 134 Server: Encrypted packet (len=68)
  364 5.237187500  10.6.15.145 → 192.168.1.16 SSH 1514 Server: Encrypted packet (len=1448)
  365 5.237202868 192.168.1.16 → 10.6.15.145  TCP 66 52104 → 22 [ACK] Seq=7637 Ack=189645 Win=6157 Len=0 TSval=1395517 TSecr=24210042
  366 5.237373788  10.6.15.145 → 192.168.1.16 SSH 1514 Server: Encrypted packet (len=1448)
  367 5.237763741  10.6.15.145 → 192.168.1.16 SSH 134 Server: Encrypted packet (len=68)
  368 5.237773850 192.168.1.16 → 10.6.15.145  TCP 66 52104 → 22 [ACK] Seq=7637 Ack=191161 Win=6157 Len=0 TSval=1395517 TSecr=24210042
  369 5.237992800  10.6.15.145 → 192.168.1.16 SSH 1514 Server: Encrypted packet (len=1448)
  370 5.238004178  10.6.15.145 → 192.168.1.16 SSH 118 Server: Encrypted packet (len=52)
  371 5.238010732 192.168.1.16 → 10.6.15.145  TCP 66 52104 → 22 [ACK] Seq=7637 Ack=192661 Win=6157 Len=0 TSval=1395517 TSecr=24210042
  372 5.240321567  10.6.15.145 → 192.168.1.16 SSH 1514 Server: Encrypted packet (len=1448)
  373 5.240332908  10.6.15.145 → 192.168.1.16 SSH 118 Server: Encrypted packet (len=52)
  374 5.240348035 192.168.1.16 → 10.6.15.145  TCP 66 52104 → 22 [ACK] Seq=7637 Ack=194161 Win=6157 Len=0 TSval=1395518 TSecr=24210043
  375 5.253160180 192.168.1.16 → 10.6.15.145  SSH 558 Client: Encrypted packet (len=492)
  376 5.294283283  10.6.15.145 → 192.168.1.16 TCP 66 22 → 52104 [ACK] Seq=194161 Ack=8129 Win=1452 Len=0 TSval=24210057 TSecr=1395521
  377 5.298915673  10.6.15.145 → 192.168.1.16 SSH 110 Server: Encrypted packet (len=44)
  378 5.299210879 192.168.1.16 → 10.6.15.145  SSH 158 Client: Encrypted packet (len=92)
  379 5.300717051  10.6.15.145 → 192.168.1.16 TCP 66 22 → 52104 [ACK] Seq=194205 Ack=8221 Win=1452 Len=0 TSval=24210058 TSecr=1395533
  380 5.304354930  10.6.15.145 → 192.168.1.16 SSH 1514 Server: Encrypted packet (len=1448)
  381 5.304536136  10.6.15.145 → 192.168.1.16 SSH 1514 Server: Encrypted packet (len=1448)
