    1 0.000000000 192.168.1.16 → 10.6.15.144  SSH 694 Client: Encrypted packet (len=628)
    2 0.005365871  10.6.15.144 → 192.168.1.16 SSH 1514 Server: Encrypted packet (len=1448)
    3 0.005678111  10.6.15.144 → 192.168.1.16 SSH 1514 Server: Encrypted packet (len=1448)
    4 0.005696677 192.168.1.16 → 10.6.15.144  TCP 66 59298 → 22 [ACK] Seq=629 Ack=2897 Win=6155 Len=0 TSval=6081003 TSecr=6677331
    5 0.006001403  10.6.15.144 → 192.168.1.16 SSH 1514 Server: Encrypted packet (len=1448)
    6 0.006316662  10.6.15.144 → 192.168.1.16 SSH 1514 Server: Encrypted packet (len=1448)
    7 0.006333916 192.168.1.16 → 10.6.15.144  TCP 66 59298 → 22 [ACK] Seq=629 Ack=5793 Win=6155 Len=0 TSval=6081003 TSecr=6677331
    8 0.013858744  10.6.15.144 → 192.168.1.16 TCP 66 22 → 59298 [ACK] Seq=5793 Ack=629 Win=1452 Len=0 TSval=6677385 TSecr=6081002
    9 0.017751718  10.6.15.144 → 192.168.1.16 SSH 1514 Server: Encrypted packet (len=1448)
   10 0.018059521  10.6.15.144 → 192.168.1.16 SSH 1514 Server: Encrypted packet (len=1448)
   11 0.018074275 192.168.1.16 → 10.6.15.144  TCP 66 59298 → 22 [ACK] Seq=629 Ack=8689 Win=6155 Len=0 TSval=6081006 TSecr=6677385
   12 0.018375111  10.6.15.144 → 192.168.1.16 SSH 1514 Server: Encrypted packet (len=1448)
   13 0.028053201  10.6.15.144 → 192.168.1.16 SSH 1514 Server: Encrypted packet (len=1448)
   14 0.028075699 192.168.1.16 → 10.6.15.144  TCP 66 59298 → 22 [ACK] Seq=629 Ack=11585 Win=6155 Len=0 TSval=6081009 TSecr=6677385
   15 0.028123011  10.6.15.144 → 192.168.1.16 SSH 494 Server: Encrypted packet (len=428)
   16 0.029975966 192.168.1.16 → 10.6.15.144  SSH 206 Client: Encrypted packet (len=140)
   17 0.040433821 192.168.1.16 → 10.6.15.144  SSH 230 Client: Encrypted packet (len=164)
   18 0.042285793 192.168.1.16 → 10.6.15.144  SSH 1514 Client: Encrypted packet (len=1448)
   19 0.046166410 192.168.1.16 → 10.6.15.144  SSH 390 Client: Encrypted packet (len=324)
   20 0.047046263  10.6.15.144 → 192.168.1.16 SSH 1514 Server: Encrypted packet (len=1448)
   21 0.047067612 192.168.1.16 → 10.6.15.144  SSH 254 Client: Encrypted packet (len=188)
   22 0.047360861  10.6.15.144 → 192.168.1.16 SSH 1514 Server: Encrypted packet (len=1448)
   23 0.047679707  10.6.15.144 → 192.168.1.16 SSH 1514 Server: Encrypted packet (len=1448)
   24 0.047691136 192.168.1.16 → 10.6.15.144  TCP 66 59298 → 22 [ACK] Seq=2893 Ack=16357 Win=6155 Len=0 TSval=6081013 TSecr=6677392
   25 0.052332596  10.6.15.144 → 192.168.1.16 TCP 66 22 → 59298 [ACK] Seq=16357 Ack=2381 Win=1452 Len=0 TSval=6677394 TSecr=6081012
   26 0.060166226  10.6.15.144 → 192.168.1.16 SSH 1514 Server: Encrypted packet (len=1448)
   27 0.060478242  10.6.15.144 → 192.168.1.16 SSH 1514 Server: Encrypted packet (len=1448)
   28 0.060488779 192.168.1.16 → 10.6.15.144  TCP 66 59298 → 22 [ACK] Seq=2893 Ack=19253 Win=6155 Len=0 TSval=6081017 TSecr=6677396
   29 0.060799076  10.6.15.144 → 192.168.1.16 SSH 1514 Server: Encrypted packet (len=1448)
   30 0.061117938  10.6.15.144 → 192.168.1.16 SSH 1514 Server: Encrypted packet (len=1448)
   31 0.061128552 192.168.1.16 → 10.6.15.144  TCP 66 59298 → 22 [ACK] Seq=2893 Ack=22149 Win=6155 Len=0 TSval=6081017 TSecr=6677396
   32 0.069872605  10.6.15.144 → 192.168.1.16 SSH 1514 Server: Encrypted packet (len=1448)
   33 0.070185259  10.6.15.144 → 192.168.1.16 SSH 1514 Server: Encrypted packet (len=1448)
   34 0.070199797 192.168.1.16 → 10.6.15.144  TCP 66 59298 → 22 [ACK] Seq=2893 Ack=25045 Win=6155 Len=0 TSval=6081019 TSecr=6677399
   35 0.070242371  10.6.15.144 → 192.168.1.16 SSH 370 Server: Encrypted packet (len=304)
   36 0.100860336  10.6.15.144 → 192.168.1.16 SSH 174 Server: Encrypted packet (len=108)
   37 0.100880651 192.168.1.16 → 10.6.15.144  TCP 66 59298 → 22 [ACK] Seq=2893 Ack=25457 Win=6155 Len=0 TSval=6081027 TSecr=6677399
   38 0.107060946  10.6.15.144 → 192.168.1.16 SSH 1514 Server: Encrypted packet (len=1448)
   39 0.107115653  10.6.15.144 → 192.168.1.16 SSH 454 Server: Encrypted packet (len=388)
   40 0.107127039 192.168.1.16 → 10.6.15.144  TCP 66 59298 → 22 [ACK] Seq=2893 Ack=27293 Win=6155 Len=0 TSval=6081028 TSecr=6677407
   41 0.111378492  10.6.15.144 → 192.168.1.16 SSH 1514 Server: Encrypted packet (len=1448)
   42 0.111687322  10.6.15.144 → 192.168.1.16 SSH 1514 Server: Encrypted packet (len=1448)
   43 0.111701693 192.168.1.16 → 10.6.15.144  TCP 66 59298 → 22 [ACK] Seq=2893 Ack=30189 Win=6155 Len=0 TSval=6081029 TSecr=6677409
   44 0.115920294  10.6.15.144 → 192.168.1.16 SSH 1514 Server: Encrypted packet (len=1448)
   45 0.116230469  10.6.15.144 → 192.168.1.16 SSH 1514 Server: Encrypted packet (len=1448)
   46 0.116243705 192.168.1.16 → 10.6.15.144  TCP 66 59298 → 22 [ACK] Seq=2893 Ack=33085 Win=6155 Len=0 TSval=6081031 TSecr=6677410
   47 0.119176901  10.6.15.144 → 192.168.1.16 SSH 1514 Server: Encrypted packet (len=1448)
   48 0.119489019  10.6.15.144 → 192.168.1.16 SSH 1514 Server: Encrypted packet (len=1448)
   49 0.119495883 192.168.1.16 → 10.6.15.144  TCP 66 59298 → 22 [ACK] Seq=2893 Ack=35981 Win=6155 Len=0 TSval=6081031 TSecr=6677412
   50 0.124407479  10.6.15.144 → 192.168.1.16 SSH 1514 Server: Encrypted packet (len=1448)
   51 0.124855140  10.6.15.144 → 192.168.1.16 SSH 1514 Server: Encrypted packet (len=1448)
   52 0.124864557 192.168.1.16 → 10.6.15.144  TCP 66 59298 → 22 [ACK] Seq=2893 Ack=38877 Win=6155 Len=0 TSval=6081033 TSecr=6677413
   53 0.127688503  10.6.15.144 → 192.168.1.16 SSH 1514 Server: Encrypted packet (len=1448)
   54 0.128125547  10.6.15.144 → 192.168.1.16 SSH 1514 Server: Encrypted packet (len=1448)
   55 0.128137850 192.168.1.16 → 10.6.15.144  TCP 66 59298 → 22 [ACK] Seq=2893 Ack=41773 Win=6155 Len=0 TSval=6081034 TSecr=6677414
   56 0.134047893  10.6.15.144 → 192.168.1.16 SSH 1514 Server: Encrypted packet (len=1448)
   57 0.134361372  10.6.15.144 → 192.168.1.16 SSH 1514 Server: Encrypted packet (len=1448)
   58 0.134372762 192.168.1.16 → 10.6.15.144  TCP 66 59298 → 22 [ACK] Seq=2893 Ack=44669 Win=6155 Len=0 TSval=6081035 TSecr=6677415
   59 0.137214247  10.6.15.144 → 192.168.1.16 SSH 1514 Server: Encrypted packet (len=1448)
   60 0.137521808  10.6.15.144 → 192.168.1.16 SSH 1514 Server: Encrypted packet (len=1448)
   61 0.137530836 192.168.1.16 → 10.6.15.144  TCP 66 59298 → 22 [ACK] Seq=2893 Ack=47565 Win=6155 Len=0 TSval=6081036 TSecr=6677416
   62 0.144236603  10.6.15.144 → 192.168.1.16 SSH 1514 Server: Encrypted packet (len=1448)
   63 0.144560876  10.6.15.144 → 192.168.1.16 SSH 1514 Server: Encrypted packet (len=1448)
   64 0.144568908 192.168.1.16 → 10.6.15.144  TCP 66 59298 → 22 [ACK] Seq=2893 Ack=50461 Win=6155 Len=0 TSval=6081038 TSecr=6677417
   65 0.148908346  10.6.15.144 → 192.168.1.16 SSH 1514 Server: Encrypted packet (len=1448)
   66 0.149219812  10.6.15.144 → 192.168.1.16 SSH 1514 Server: Encrypted packet (len=1448)
   67 0.149229777 192.168.1.16 → 10.6.15.144  TCP 66 59298 → 22 [ACK] Seq=2893 Ack=53357 Win=6155 Len=0 TSval=6081039 TSecr=6677418
   68 0.156087304  10.6.15.144 → 192.168.1.16 SSH 1514 Server: Encrypted packet (len=1448)
   69 0.156400407  10.6.15.144 → 192.168.1.16 SSH 1514 Server: Encrypted packet (len=1448)
   70 0.156407695 192.168.1.16 → 10.6.15.144  TCP 66 59298 → 22 [ACK] Seq=2893 Ack=56253 Win=6155 Len=0 TSval=6081041 TSecr=6677420
   71 0.160157511  10.6.15.144 → 192.168.1.16 SSH 1514 Server: Encrypted packet (len=1448)
   72 0.161017811  10.6.15.144 → 192.168.1.16 SSH 1514 Server: Encrypted packet (len=1448)
   73 0.161028493 192.168.1.16 → 10.6.15.144  TCP 66 59298 → 22 [ACK] Seq=2893 Ack=59149 Win=6155 Len=0 TSval=6081042 TSecr=6677421
   74 0.166934750  10.6.15.144 → 192.168.1.16 SSH 1514 Server: Encrypted packet (len=1448)
   75 0.168383178  10.6.15.144 → 192.168.1.16 SSH 1514 Server: Encrypted packet (len=1448)
   76 0.168395976 192.168.1.16 → 10.6.15.144  TCP 66 59298 → 22 [ACK] Seq=2893 Ack=62045 Win=6155 Len=0 TSval=6081044 TSecr=6677423
   77 0.172752101  10.6.15.144 → 192.168.1.16 SSH 1514 Server: Encrypted packet (len=1448)
   78 0.173061765  10.6.15.144 → 192.168.1.16 SSH 1514 Server: Encrypted packet (len=1448)
   79 0.173076659 192.168.1.16 → 10.6.15.144  TCP 66 59298 → 22 [ACK] Seq=2893 Ack=64941 Win=6155 Len=0 TSval=6081045 TSecr=6677424
   80 0.181437707  10.6.15.144 → 192.168.1.16 SSH 1514 Server: Encrypted packet (len=1448)
   81 0.181748621  10.6.15.144 → 192.168.1.16 SSH 1514 Server: Encrypted packet (len=1448)
   82 0.181759092 192.168.1.16 → 10.6.15.144  TCP 66 59298 → 22 [ACK] Seq=2893 Ack=67837 Win=6155 Len=0 TSval=6081047 TSecr=6677426
   83 0.184222446  10.6.15.144 → 192.168.1.16 SSH 1514 Server: Encrypted packet (len=1448)
   84 0.184532985  10.6.15.144 → 192.168.1.16 SSH 1514 Server: Encrypted packet (len=1448)
   85 0.184542850 192.168.1.16 → 10.6.15.144  TCP 66 59298 → 22 [ACK] Seq=2893 Ack=70733 Win=6155 Len=0 TSval=6081048 TSecr=6677427
   86 0.192364370  10.6.15.144 → 192.168.1.16 SSH 1514 Server: Encrypted packet (len=1448)
   87 0.195184906  10.6.15.144 → 192.168.1.16 SSH 1514 Server: Encrypted packet (len=1448)
   88 0.195201226 192.168.1.16 → 10.6.15.144  TCP 66 59298 → 22 [ACK] Seq=2893 Ack=73629 Win=6155 Len=0 TSval=6081050 TSecr=6677429
   89 0.195542830  10.6.15.144 → 192.168.1.16 SSH 1514 Server: Encrypted packet (len=1448)
   90 0.195895607  10.6.15.144 → 192.168.1.16 SSH 1514 Server: Encrypted packet (len=1448)
   91 0.195900890 192.168.1.16 → 10.6.15.144  TCP 66 59298 → 22 [ACK] Seq=2893 Ack=76525 Win=6155 Len=0 TSval=6081051 TSecr=6677429
   92 0.196270900  10.6.15.144 → 192.168.1.16 SSH 1514 Server: [TCP Previous segment not captured] , Encrypted packet (len=1448)
   93 0.196277976 192.168.1.16 → 10.6.15.144  TCP 78 [TCP Dup ACK 91#1] 59298 → 22 [ACK] Seq=2893 Ack=76525 Win=6155 Len=0 TSval=6081051 TSecr=6677429 SLE=77973 SRE=79421
   94 0.209148195  10.6.15.144 → 192.168.1.16 SSH 1514 Server: Encrypted packet (len=1448)
   95 0.209166550 192.168.1.16 → 10.6.15.144  TCP 78 [TCP Dup ACK 91#2] 59298 → 22 [ACK] Seq=2893 Ack=76525 Win=6155 Len=0 TSval=6081054 TSecr=6677429 SLE=77973 SRE=80869
   96 0.209583923  10.6.15.144 → 192.168.1.16 SSH 1514 Server: Encrypted packet (len=1448)
   97 0.209590893 192.168.1.16 → 10.6.15.144  TCP 78 [TCP Dup ACK 91#3] 59298 → 22 [ACK] Seq=2893 Ack=76525 Win=6155 Len=0 TSval=6081054 TSecr=6677429 SLE=77973 SRE=82317
   98 0.209903627  10.6.15.144 → 192.168.1.16 SSH 1514 Server: Encrypted packet (len=1448)
   99 0.209910574 192.168.1.16 → 10.6.15.144  TCP 78 [TCP Dup ACK 91#4] 59298 → 22 [ACK] Seq=2893 Ack=76525 Win=6155 Len=0 TSval=6081054 TSecr=6677429 SLE=77973 SRE=83765
  100 0.210223903  10.6.15.144 → 192.168.1.16 SSH 1514 Server: Encrypted packet (len=1448)
  101 0.210231255 192.168.1.16 → 10.6.15.144  TCP 78 [TCP Dup ACK 91#5] 59298 → 22 [ACK] Seq=2893 Ack=76525 Win=6155 Len=0 TSval=6081054 TSecr=6677429 SLE=77973 SRE=85213
  102 0.210536516  10.6.15.144 → 192.168.1.16 SSH 1514 Server: Encrypted packet (len=1448)
  103 0.210539821 192.168.1.16 → 10.6.15.144  TCP 78 [TCP Dup ACK 91#6] 59298 → 22 [ACK] Seq=2893 Ack=76525 Win=6155 Len=0 TSval=6081054 TSecr=6677429 SLE=77973 SRE=86661
  104 0.222175019  10.6.15.144 → 192.168.1.16 SSH 1514 Server: Encrypted packet (len=1448)
  105 0.222192644 192.168.1.16 → 10.6.15.144  TCP 78 [TCP Dup ACK 91#7] 59298 → 22 [ACK] Seq=2893 Ack=76525 Win=6155 Len=0 TSval=6081057 TSecr=6677429 SLE=77973 SRE=88109
  106 0.222470277  10.6.15.144 → 192.168.1.16 SSH 1514 Server: [TCP Fast Retransmission] , Encrypted packet (len=1448)
  107 0.222480368 192.168.1.16 → 10.6.15.144  TCP 66 59298 → 22 [ACK] Seq=2893 Ack=88109 Win=6155 Len=0 TSval=6081057 TSecr=6677436
  108 0.222947350  10.6.15.144 → 192.168.1.16 SSH 1514 Server: Encrypted packet (len=1448)
  109 0.222955607 192.168.1.16 → 10.6.15.144  TCP 66 59298 → 22 [ACK] Seq=2893 Ack=89557 Win=6155 Len=0 TSval=6081057 TSecr=6677437
  110 0.223265808  10.6.15.144 → 192.168.1.16 SSH 1514 Server: Encrypted packet (len=1448)
  111 0.223274198 192.168.1.16 → 10.6.15.144  TCP 66 59298 → 22 [ACK] Seq=2893 Ack=91005 Win=6155 Len=0 TSval=6081057 TSecr=6677437
  112 0.233172353  10.6.15.144 → 192.168.1.16 SSH 1514 Server: Encrypted packet (len=1448)
  113 0.233188044 192.168.1.16 → 10.6.15.144  TCP 66 59298 → 22 [ACK] Seq=2893 Ack=92453 Win=6155 Len=0 TSval=6081060 TSecr=6677440
  114 0.233494386  10.6.15.144 → 192.168.1.16 SSH 1514 Server: Encrypted packet (len=1448)
  115 0.233500248 192.168.1.16 → 10.6.15.144  TCP 66 59298 → 22 [ACK] Seq=2893 Ack=93901 Win=6155 Len=0 TSval=6081060 TSecr=6677440
  116 0.233650903 192.168.1.16 → 10.6.15.144  SSH 102 Client: Encrypted packet (len=36)
  117 0.233809495  10.6.15.144 → 192.168.1.16 SSH 1514 Server: Encrypted packet (len=1448)
  118 0.234127438  10.6.15.144 → 192.168.1.16 SSH 1514 Server: Encrypted packet (len=1448)
  119 0.234131509 192.168.1.16 → 10.6.15.144  TCP 66 59298 → 22 [ACK] Seq=2929 Ack=96797 Win=6155 Len=0 TSval=6081060 TSecr=6677440
  120 0.246491250  10.6.15.144 → 192.168.1.16 SSH 1514 Server: Encrypted packet (len=1448)
  121 0.246806517  10.6.15.144 → 192.168.1.16 SSH 1514 Server: Encrypted packet (len=1448)
  122 0.246815879 192.168.1.16 → 10.6.15.144  TCP 66 59298 → 22 [ACK] Seq=2929 Ack=99693 Win=6155 Len=0 TSval=6081063 TSecr=6677442
  123 0.247122740  10.6.15.144 → 192.168.1.16 SSH 1514 Server: Encrypted packet (len=1448)
  124 0.247443286  10.6.15.144 → 192.168.1.16 SSH 1514 Server: Encrypted packet (len=1448)
  125 0.247447919 192.168.1.16 → 10.6.15.144  TCP 66 59298 → 22 [ACK] Seq=2929 Ack=102589 Win=6155 Len=0 TSval=6081063 TSecr=6677442
  126 0.247761306  10.6.15.144 → 192.168.1.16 SSH 1514 Server: Encrypted packet (len=1448)
  127 0.248086435  10.6.15.144 → 192.168.1.16 SSH 1514 Server: Encrypted packet (len=1448)
  128 0.248093102 192.168.1.16 → 10.6.15.144  TCP 66 59298 → 22 [ACK] Seq=2929 Ack=105485 Win=6155 Len=0 TSval=6081064 TSecr=6677442
  129 0.258033667  10.6.15.144 → 192.168.1.16 SSH 1514 Server: Encrypted packet (len=1448)
  130 0.258344066  10.6.15.144 → 192.168.1.16 SSH 1514 Server: Encrypted packet (len=1448)
  131 0.258351765 192.168.1.16 → 10.6.15.144  TCP 66 59298 → 22 [ACK] Seq=2929 Ack=108381 Win=6155 Len=0 TSval=6081066 TSecr=6677446
  132 0.258663528  10.6.15.144 → 192.168.1.16 SSH 1514 Server: Encrypted packet (len=1448)
  133 0.258985942  10.6.15.144 → 192.168.1.16 SSH 1514 Server: Encrypted packet (len=1448)
  134 0.258995701 192.168.1.16 → 10.6.15.144  TCP 66 59298 → 22 [ACK] Seq=2929 Ack=111277 Win=6155 Len=0 TSval=6081066 TSecr=6677446
  135 0.259304692  10.6.15.144 → 192.168.1.16 SSH 1514 Server: Encrypted packet (len=1448)
  136 0.259773380  10.6.15.144 → 192.168.1.16 SSH 1514 Server: Encrypted packet (len=1448)
  137 0.259787865 192.168.1.16 → 10.6.15.144  TCP 66 59298 → 22 [ACK] Seq=2929 Ack=114173 Win=6155 Len=0 TSval=6081066 TSecr=6677446
  138 0.271377680  10.6.15.144 → 192.168.1.16 SSH 1514 Server: Encrypted packet (len=1448)
  139 0.271687411  10.6.15.144 → 192.168.1.16 SSH 1514 Server: Encrypted packet (len=1448)
  140 0.271701070 192.168.1.16 → 10.6.15.144  TCP 66 59298 → 22 [ACK] Seq=2929 Ack=117069 Win=6155 Len=0 TSval=6081069 TSecr=6677449
  141 0.272008821  10.6.15.144 → 192.168.1.16 SSH 1514 Server: Encrypted packet (len=1448)
  142 0.272328139  10.6.15.144 → 192.168.1.16 SSH 1514 Server: Encrypted packet (len=1448)
  143 0.272337650 192.168.1.16 → 10.6.15.144  TCP 66 59298 → 22 [ACK] Seq=2929 Ack=119965 Win=6155 Len=0 TSval=6081070 TSecr=6677449
  144 0.272644184  10.6.15.144 → 192.168.1.16 SSH 1514 Server: Encrypted packet (len=1448)
  145 0.273115332  10.6.15.144 → 192.168.1.16 SSH 1514 Server: Encrypted packet (len=1448)
  146 0.273123904 192.168.1.16 → 10.6.15.144  TCP 66 59298 → 22 [ACK] Seq=2929 Ack=122861 Win=6155 Len=0 TSval=6081070 TSecr=6677449
  147 0.284691459  10.6.15.144 → 192.168.1.16 SSH 1514 Server: Encrypted packet (len=1448)
  148 0.284999007  10.6.15.144 → 192.168.1.16 SSH 1514 Server: Encrypted packet (len=1448)
  149 0.285010907 192.168.1.16 → 10.6.15.144  TCP 66 59298 → 22 [ACK] Seq=2929 Ack=125757 Win=6155 Len=0 TSval=6081073 TSecr=6677452
  150 0.285321176  10.6.15.144 → 192.168.1.16 SSH 1514 Server: Encrypted packet (len=1448)
  151 0.285638985  10.6.15.144 → 192.168.1.16 SSH 1514 Server: Encrypted packet (len=1448)
  152 0.285647094 192.168.1.16 → 10.6.15.144  TCP 66 59298 → 22 [ACK] Seq=2929 Ack=128653 Win=6155 Len=0 TSval=6081073 TSecr=6677452
  153 0.285959311  10.6.15.144 → 192.168.1.16 SSH 1514 Server: Encrypted packet (len=1448)
  154 0.286279159  10.6.15.144 → 192.168.1.16 SSH 1514 Server: Encrypted packet (len=1448)
  155 0.286286845 192.168.1.16 → 10.6.15.144  TCP 66 59298 → 22 [ACK] Seq=2929 Ack=131549 Win=6155 Len=0 TSval=6081073 TSecr=6677452
  156 0.297377843  10.6.15.144 → 192.168.1.16 SSH 1514 Server: Encrypted packet (len=1448)
  157 0.297736346  10.6.15.144 → 192.168.1.16 SSH 1514 Server: Encrypted packet (len=1448)
  158 0.297748898 192.168.1.16 → 10.6.15.144  TCP 66 59298 → 22 [ACK] Seq=2929 Ack=134445 Win=6155 Len=0 TSval=6081076 TSecr=6677455
  159 0.298099585  10.6.15.144 → 192.168.1.16 SSH 1514 Server: Encrypted packet (len=1448)
  160 0.298457861  10.6.15.144 → 192.168.1.16 SSH 1514 Server: Encrypted packet (len=1448)
  161 0.298465824 192.168.1.16 → 10.6.15.144  TCP 66 59298 → 22 [ACK] Seq=2929 Ack=137341 Win=6155 Len=0 TSval=6081076 TSecr=6677455
  162 0.298818338  10.6.15.144 → 192.168.1.16 SSH 1514 Server: Encrypted packet (len=1448)
  163 0.299178537  10.6.15.144 → 192.168.1.16 SSH 1514 Server: Encrypted packet (len=1448)
  164 0.299184594 192.168.1.16 → 10.6.15.144  TCP 66 59298 → 22 [ACK] Seq=2929 Ack=140237 Win=6155 Len=0 TSval=6081076 TSecr=6677455
  165 0.310461373  10.6.15.144 → 192.168.1.16 SSH 1514 Server: Encrypted packet (len=1448)
  166 0.314875283  10.6.15.144 → 192.168.1.16 SSH 1514 Server: Encrypted packet (len=1448)
  167 0.314895879 192.168.1.16 → 10.6.15.144  TCP 66 59298 → 22 [ACK] Seq=2929 Ack=143133 Win=6155 Len=0 TSval=6081080 TSecr=6677458
  168 0.315187474  10.6.15.144 → 192.168.1.16 SSH 1514 Server: Encrypted packet (len=1448)
  169 0.315506956  10.6.15.144 → 192.168.1.16 SSH 1514 Server: Encrypted packet (len=1448)
  170 0.315519661 192.168.1.16 → 10.6.15.144  TCP 66 59298 → 22 [ACK] Seq=2929 Ack=146029 Win=6155 Len=0 TSval=6081080 TSecr=6677458
  171 0.315824771  10.6.15.144 → 192.168.1.16 SSH 1514 Server: Encrypted packet (len=1448)
  172 0.316149705  10.6.15.144 → 192.168.1.16 SSH 1514 Server: Encrypted packet (len=1448)
  173 0.316158029 192.168.1.16 → 10.6.15.144  TCP 66 59298 → 22 [ACK] Seq=2929 Ack=148925 Win=6155 Len=0 TSval=6081081 TSecr=6677458
  174 0.316286116 192.168.1.16 → 10.6.15.144  SSH 214 Client: Encrypted packet (len=148)
  175 0.318613588 192.168.1.16 → 10.6.15.144  SSH 230 Client: Encrypted packet (len=164)
  176 0.319377828 192.168.1.16 → 10.6.15.144  SSH 366 Client: Encrypted packet (len=300)
  177 0.323282805 192.168.1.16 → 10.6.15.144  SSH 1514 Client: Encrypted packet (len=1448)
  178 0.327419962  10.6.15.144 → 192.168.1.16 SSH 1514 Server: Encrypted packet (len=1448)
  179 0.327715421  10.6.15.144 → 192.168.1.16 SSH 1514 Server: Encrypted packet (len=1448)
  180 0.327722831 192.168.1.16 → 10.6.15.144  TCP 66 59298 → 22 [ACK] Seq=4989 Ack=151821 Win=6155 Len=0 TSval=6081083 TSecr=6677463
  181 0.329207412  10.6.15.144 → 192.168.1.16 SSH 1514 Server: Encrypted packet (len=1448)
  182 0.329520764  10.6.15.144 → 192.168.1.16 SSH 1514 Server: Encrypted packet (len=1448)
  183 0.329526324 192.168.1.16 → 10.6.15.144  TCP 66 59298 → 22 [ACK] Seq=4989 Ack=154717 Win=6155 Len=0 TSval=6081084 TSecr=6677463
  184 0.329841777  10.6.15.144 → 192.168.1.16 SSH 1514 Server: Encrypted packet (len=1448)
  185 0.330160504  10.6.15.144 → 192.168.1.16 SSH 1514 Server: Encrypted packet (len=1448)
  186 0.330164720 192.168.1.16 → 10.6.15.144  TCP 66 59298 → 22 [ACK] Seq=4989 Ack=157613 Win=6155 Len=0 TSval=6081084 TSecr=6677463
  187 0.330439536  10.6.15.144 → 192.168.1.16 TCP 66 22 → 59298 [ACK] Seq=157613 Ack=3241 Win=1452 Len=0 TSval=6677463 TSecr=6081081
  188 0.330447141 192.168.1.16 → 10.6.15.144  SSH 594 Client: Encrypted packet (len=528)
  189 0.335902578  10.6.15.144 → 192.168.1.16 TCP 66 22 → 59298 [ACK] Seq=157613 Ack=4989 Win=1452 Len=0 TSval=6677465 TSecr=6081081
  190 0.338974396  10.6.15.144 → 192.168.1.16 SSH 1514 Server: Encrypted packet (len=1448)
  191 0.339274852  10.6.15.144 → 192.168.1.16 SSH 1514 Server: Encrypted packet (len=1448)
  192 0.339283835 192.168.1.16 → 10.6.15.144  TCP 66 59298 → 22 [ACK] Seq=5517 Ack=160509 Win=6155 Len=0 TSval=6081086 TSecr=6677466
  193 0.345166264  10.6.15.144 → 192.168.1.16 SSH 1514 Server: Encrypted packet (len=1448)
  194 0.345476803  10.6.15.144 → 192.168.1.16 SSH 1514 Server: Encrypted packet (len=1448)
  195 0.345485939 192.168.1.16 → 10.6.15.144  TCP 66 59298 → 22 [ACK] Seq=5517 Ack=163405 Win=6155 Len=0 TSval=6081088 TSecr=6677466
  196 0.345794886  10.6.15.144 → 192.168.1.16 SSH 1514 Server: Encrypted packet (len=1448)
  197 0.348808873  10.6.15.144 → 192.168.1.16 SSH 1514 Server: Encrypted packet (len=1448)
  198 0.348822586 192.168.1.16 → 10.6.15.144  TCP 66 59298 → 22 [ACK] Seq=5517 Ack=166301 Win=6155 Len=0 TSval=6081089 TSecr=6677466
  199 0.349251572  10.6.15.144 → 192.168.1.16 SSH 1514 Server: Encrypted packet (len=1448)
  200 0.349568200  10.6.15.144 → 192.168.1.16 SSH 1514 Server: Encrypted packet (len=1448)
  201 0.349572426 192.168.1.16 → 10.6.15.144  TCP 66 59298 → 22 [ACK] Seq=5517 Ack=169197 Win=6155 Len=0 TSval=6081089 TSecr=6677468
  202 0.358860269  10.6.15.144 → 192.168.1.16 SSH 1514 Server: Encrypted packet (len=1448)
  203 0.359169696  10.6.15.144 → 192.168.1.16 SSH 1514 Server: Encrypted packet (len=1448)
  204 0.359174496 192.168.1.16 → 10.6.15.144  TCP 66 59298 → 22 [ACK] Seq=5517 Ack=172093 Win=6155 Len=0 TSval=6081091 TSecr=6677471
  205 0.359643346  10.6.15.144 → 192.168.1.16 SSH 1514 Server: Encrypted packet (len=1448)
  206 0.359964400  10.6.15.144 → 192.168.1.16 SSH 1514 Server: Encrypted packet (len=1448)
  207 0.359967182 192.168.1.16 → 10.6.15.144  TCP 66 59298 → 22 [ACK] Seq=5517 Ack=174989 Win=6155 Len=0 TSval=6081092 TSecr=6677471
  208 0.360282513  10.6.15.144 → 192.168.1.16 SSH 1514 Server: Encrypted packet (len=1448)
  209 0.360751169  10.6.15.144 → 192.168.1.16 SSH 1514 Server: Encrypted packet (len=1448)
  210 0.360754427 192.168.1.16 → 10.6.15.144  TCP 66 59298 → 22 [ACK] Seq=5517 Ack=177885 Win=6155 Len=0 TSval=6081092 TSecr=6677471
  211 0.369484624  10.6.15.144 → 192.168.1.16 SSH 1514 Server: Encrypted packet (len=1448)
  212 0.369810545  10.6.15.144 → 192.168.1.16 SSH 1514 Server: Encrypted packet (len=1448)
  213 0.369817911 192.168.1.16 → 10.6.15.144  TCP 66 59298 → 22 [ACK] Seq=5517 Ack=180781 Win=6155 Len=0 TSval=6081094 TSecr=6677474
  214 0.370131219  10.6.15.144 → 192.168.1.16 SSH 1514 Server: Encrypted packet (len=1448)
  215 0.370436637  10.6.15.144 → 192.168.1.16 SSH 1514 Server: Encrypted packet (len=1448)
  216 0.370441883 192.168.1.16 → 10.6.15.144  TCP 66 59298 → 22 [ACK] Seq=5517 Ack=183677 Win=6155 Len=0 TSval=6081094 TSecr=6677474
  217 0.370772655  10.6.15.144 → 192.168.1.16 SSH 1514 Server: Encrypted packet (len=1448)
  218 0.371242278  10.6.15.144 → 192.168.1.16 SSH 1514 Server: Encrypted packet (len=1448)
  219 0.371263846 192.168.1.16 → 10.6.15.144  TCP 66 59298 → 22 [ACK] Seq=5517 Ack=186573 Win=6155 Len=0 TSval=6081094 TSecr=6677474
  220 0.376097757 192.168.1.16 → 10.6.15.144  SSH 1174 Client: Encrypted packet (len=1108)
  221 0.378318532  10.6.15.144 → 192.168.1.16 SSH 1514 Server: Encrypted packet (len=1448)
  222 0.378759791  10.6.15.144 → 192.168.1.16 SSH 1514 Server: Encrypted packet (len=1448)
  223 0.378772768 192.168.1.16 → 10.6.15.144  TCP 66 59298 → 22 [ACK] Seq=6625 Ack=189469 Win=6155 Len=0 TSval=6081096 TSecr=6677476
  224 0.379078949  10.6.15.144 → 192.168.1.16 SSH 1514 Server: Encrypted packet (len=1448)
  225 0.379396785  10.6.15.144 → 192.168.1.16 SSH 1514 Server: Encrypted packet (len=1448)
  226 0.379407844 192.168.1.16 → 10.6.15.144  TCP 66 59298 → 22 [ACK] Seq=6625 Ack=192365 Win=6155 Len=0 TSval=6081096 TSecr=6677476
  227 0.379880214  10.6.15.144 → 192.168.1.16 SSH 1514 Server: Encrypted packet (len=1448)
  228 0.380187033  10.6.15.144 → 192.168.1.16 SSH 1514 Server: Encrypted packet (len=1448)
  229 0.380197035 192.168.1.16 → 10.6.15.144  TCP 66 59298 → 22 [ACK] Seq=6625 Ack=195261 Win=6155 Len=0 TSval=6081097 TSecr=6677476
  230 0.384919837 192.168.1.16 → 10.6.15.144  SSH 1078 Client: Encrypted packet (len=1012)
  231 0.387758511  10.6.15.144 → 192.168.1.16 SSH 1514 Server: Encrypted packet (len=1448)
  232 0.388071830  10.6.15.144 → 192.168.1.16 SSH 1514 Server: Encrypted packet (len=1448)
  233 0.388083071 192.168.1.16 → 10.6.15.144  TCP 66 59298 → 22 [ACK] Seq=7637 Ack=198157 Win=6155 Len=0 TSval=6081099 TSecr=6677479
  234 0.388404524  10.6.15.144 → 192.168.1.16 SSH 1514 Server: Encrypted packet (len=1448)
  235 0.388721295  10.6.15.144 → 192.168.1.16 SSH 1514 Server: Encrypted packet (len=1448)
  236 0.388726328 192.168.1.16 → 10.6.15.144  TCP 66 59298 → 22 [ACK] Seq=7637 Ack=201053 Win=6155 Len=0 TSval=6081099 TSecr=6677479
  237 0.389194402  10.6.15.144 → 192.168.1.16 SSH 1514 Server: Encrypted packet (len=1448)
  238 0.389514625  10.6.15.144 → 192.168.1.16 SSH 1514 Server: Encrypted packet (len=1448)
  239 0.389518481 192.168.1.16 → 10.6.15.144  TCP 66 59298 → 22 [ACK] Seq=7637 Ack=203949 Win=6155 Len=0 TSval=6081099 TSecr=6677479
  240 0.389834406  10.6.15.144 → 192.168.1.16 SSH 1514 Server: Encrypted packet (len=1448)
  241 0.390153728  10.6.15.144 → 192.168.1.16 SSH 1514 Server: Encrypted packet (len=1448)
  242 0.390159136 192.168.1.16 → 10.6.15.144  TCP 66 59298 → 22 [ACK] Seq=7637 Ack=206845 Win=6155 Len=0 TSval=6081099 TSecr=6677479
  243 0.396242143  10.6.15.144 → 192.168.1.16 SSH 1514 Server: Encrypted packet (len=1448)
  244 0.396556472  10.6.15.144 → 192.168.1.16 SSH 1514 Server: Encrypted packet (len=1448)
  245 0.396571121 192.168.1.16 → 10.6.15.144  TCP 66 59298 → 22 [ACK] Seq=7637 Ack=209741 Win=6155 Len=0 TSval=6081101 TSecr=6677481
  246 0.396876117  10.6.15.144 → 192.168.1.16 SSH 1514 Server: Encrypted packet (len=1448)
  247 0.397193484  10.6.15.144 → 192.168.1.16 SSH 1514 Server: Encrypted packet (len=1448)
  248 0.397205156 192.168.1.16 → 10.6.15.144  TCP 66 59298 → 22 [ACK] Seq=7637 Ack=212637 Win=6155 Len=0 TSval=6081101 TSecr=6677481
  249 0.400833586  10.6.15.144 → 192.168.1.16 SSH 1514 Server: Encrypted packet (len=1448)
  250 0.401149976  10.6.15.144 → 192.168.1.16 SSH 1514 Server: Encrypted packet (len=1448)
  251 0.401160577 192.168.1.16 → 10.6.15.144  TCP 66 59298 → 22 [ACK] Seq=7637 Ack=215533 Win=6155 Len=0 TSval=6081102 TSecr=6677481
  252 0.401468781  10.6.15.144 → 192.168.1.16 SSH 1514 Server: Encrypted packet (len=1448)
  253 0.401786776  10.6.15.144 → 192.168.1.16 SSH 1514 Server: Encrypted packet (len=1448)
  254 0.401797647 192.168.1.16 → 10.6.15.144  TCP 66 59298 → 22 [ACK] Seq=7637 Ack=218429 Win=6155 Len=0 TSval=6081102 TSecr=6677481
  255 0.406193625 192.168.1.16 → 10.6.15.144  SSH 110 Client: Encrypted packet (len=44)
  256 0.408400083  10.6.15.144 → 192.168.1.16 SSH 1514 Server: Encrypted packet (len=1448)
  257 0.408714235  10.6.15.144 → 192.168.1.16 SSH 1514 Server: Encrypted packet (len=1448)
  258 0.408729811 192.168.1.16 → 10.6.15.144  TCP 66 59298 → 22 [ACK] Seq=7681 Ack=221325 Win=6155 Len=0 TSval=6081104 TSecr=6677484
  259 0.409034147  10.6.15.144 → 192.168.1.16 SSH 1514 Server: Encrypted packet (len=1448)
  260 0.409355123  10.6.15.144 → 192.168.1.16 SSH 1514 Server: Encrypted packet (len=1448)
  261 0.409369033 192.168.1.16 → 10.6.15.144  TCP 66 59298 → 22 [ACK] Seq=7681 Ack=224221 Win=6155 Len=0 TSval=6081104 TSecr=6677484
  262 0.409672592  10.6.15.144 → 192.168.1.16 SSH 1514 Server: Encrypted packet (len=1448)
  263 0.414942445  10.6.15.144 → 192.168.1.16 SSH 1514 Server: Encrypted packet (len=1448)
  264 0.414964551 192.168.1.16 → 10.6.15.144  TCP 66 59298 → 22 [ACK] Seq=7681 Ack=227117 Win=6155 Len=0 TSval=6081105 TSecr=6677484
  265 0.415260677  10.6.15.144 → 192.168.1.16 SSH 1514 Server: Encrypted packet (len=1448)
  266 0.415579874  10.6.15.144 → 192.168.1.16 SSH 1514 Server: Encrypted packet (len=1448)
  267 0.415591336 192.168.1.16 → 10.6.15.144  TCP 66 59298 → 22 [ACK] Seq=7681 Ack=230013 Win=6155 Len=0 TSval=6081105 TSecr=6677484
  268 0.420339544  10.6.15.144 → 192.168.1.16 SSH 1514 Server: Encrypted packet (len=1448)
  269 0.420649795  10.6.15.144 → 192.168.1.16 SSH 1514 Server: Encrypted packet (len=1448)
  270 0.420659737 192.168.1.16 → 10.6.15.144  TCP 66 59298 → 22 [ACK] Seq=7681 Ack=232909 Win=6155 Len=0 TSval=6081107 TSecr=6677487
  271 0.420969167  10.6.15.144 → 192.168.1.16 SSH 1514 Server: Encrypted packet (len=1448)
  272 0.421288238  10.6.15.144 → 192.168.1.16 SSH 1514 Server: Encrypted packet (len=1448)
  273 0.421299375 192.168.1.16 → 10.6.15.144  TCP 66 59298 → 22 [ACK] Seq=7681 Ack=235805 Win=6155 Len=0 TSval=6081107 TSecr=6677487
  274 0.424473126  10.6.15.144 → 192.168.1.16 SSH 1514 Server: Encrypted packet (len=1448)
  275 0.424782909  10.6.15.144 → 192.168.1.16 SSH 1514 Server: Encrypted packet (len=1448)
  276 0.424790992 192.168.1.16 → 10.6.15.144  TCP 66 59298 → 22 [ACK] Seq=7681 Ack=238701 Win=6155 Len=0 TSval=6081108 TSecr=6677488
  277 0.425103006  10.6.15.144 → 192.168.1.16 SSH 1514 Server: Encrypted packet (len=1448)
  278 0.425421915  10.6.15.144 → 192.168.1.16 SSH 1514 Server: Encrypted packet (len=1448)
  279 0.425431734 192.168.1.16 → 10.6.15.144  TCP 66 59298 → 22 [ACK] Seq=7681 Ack=241597 Win=6155 Len=0 TSval=6081108 TSecr=6677488
  280 0.430089191  10.6.15.144 → 192.168.1.16 SSH 1514 Server: Encrypted packet (len=1448)
  281 0.430403699  10.6.15.144 → 192.168.1.16 SSH 1514 Server: Encrypted packet (len=1448)
  282 0.430409865 192.168.1.16 → 10.6.15.144  TCP 66 59298 → 22 [ACK] Seq=7681 Ack=244493 Win=6155 Len=0 TSval=6081109 TSecr=6677489
  283 0.430728282  10.6.15.144 → 192.168.1.16 SSH 1514 Server: Encrypted packet (len=1448)
  284 0.431042209  10.6.15.144 → 192.168.1.16 SSH 1514 Server: Encrypted packet (len=1448)
  285 0.431047017 192.168.1.16 → 10.6.15.144  TCP 66 59298 → 22 [ACK] Seq=7681 Ack=247389 Win=6155 Len=0 TSval=6081109 TSecr=6677489
  286 0.434823296  10.6.15.144 → 192.168.1.16 SSH 1514 Server: Encrypted packet (len=1448)
  287 0.435138789  10.6.15.144 → 192.168.1.16 SSH 1514 Server: Encrypted packet (len=1448)
  288 0.435143840 192.168.1.16 → 10.6.15.144  TCP 66 59298 → 22 [ACK] Seq=7681 Ack=250285 Win=6155 Len=0 TSval=6081110 TSecr=6677490
  289 0.435458565  10.6.15.144 → 192.168.1.16 SSH 1514 Server: Encrypted packet (len=1448)
  290 0.435776439  10.6.15.144 → 192.168.1.16 SSH 1514 Server: Encrypted packet (len=1448)
  291 0.435778933 192.168.1.16 → 10.6.15.144  TCP 66 59298 → 22 [ACK] Seq=7681 Ack=253181 Win=6155 Len=0 TSval=6081110 TSecr=6677490
  292 0.440813853  10.6.15.144 → 192.168.1.16 SSH 1514 Server: Encrypted packet (len=1448)
  293 0.440993681 192.168.1.16 → 10.6.15.144  SSH 102 Client: Encrypted packet (len=36)
  294 0.441126636  10.6.15.144 → 192.168.1.16 SSH 1514 Server: Encrypted packet (len=1448)
  295 0.441447303  10.6.15.144 → 192.168.1.16 SSH 1514 Server: Encrypted packet (len=1448)
  296 0.441453742 192.168.1.16 → 10.6.15.144  TCP 66 59298 → 22 [ACK] Seq=7717 Ack=257525 Win=6155 Len=0 TSval=6081112 TSecr=6677491
  297 0.441764188  10.6.15.144 → 192.168.1.16 SSH 1514 Server: Encrypted packet (len=1448)
  298 0.446380966  10.6.15.144 → 192.168.1.16 SSH 1514 Server: Encrypted packet (len=1448)
  299 0.446393495 192.168.1.16 → 10.6.15.144  TCP 66 59298 → 22 [ACK] Seq=7717 Ack=260421 Win=6155 Len=0 TSval=6081113 TSecr=6677491
  300 0.446705274  10.6.15.144 → 192.168.1.16 SSH 1514 Server: Encrypted packet (len=1448)
  301 0.446964294 192.168.1.16 → 10.6.15.144  SSH 126 Client: Encrypted packet (len=60)
  302 0.447033285  10.6.15.144 → 192.168.1.16 SSH 1514 Server: Encrypted packet (len=1448)
  303 0.447344258  10.6.15.144 → 192.168.1.16 SSH 1514 Server: Encrypted packet (len=1448)
  304 0.447348733 192.168.1.16 → 10.6.15.144  TCP 66 59298 → 22 [ACK] Seq=7777 Ack=264765 Win=6155 Len=0 TSval=6081113 TSecr=6677493
  305 0.453000269  10.6.15.144 → 192.168.1.16 SSH 1514 Server: Encrypted packet (len=1448)
  306 0.453316538  10.6.15.144 → 192.168.1.16 SSH 1514 Server: Encrypted packet (len=1448)
  307 0.453322404 192.168.1.16 → 10.6.15.144  TCP 66 59298 → 22 [ACK] Seq=7777 Ack=267661 Win=6155 Len=0 TSval=6081115 TSecr=6677494
  308 0.457381290  10.6.15.144 → 192.168.1.16 SSH 1514 Server: Encrypted packet (len=1448)
  309 0.457694436  10.6.15.144 → 192.168.1.16 SSH 1514 Server: Encrypted packet (len=1448)
  310 0.457705067 192.168.1.16 → 10.6.15.144  TCP 66 59298 → 22 [ACK] Seq=7777 Ack=270557 Win=6155 Len=0 TSval=6081116 TSecr=6677496
  311 0.458015267  10.6.15.144 → 192.168.1.16 SSH 1514 Server: Encrypted packet (len=1448)
  312 0.458333038  10.6.15.144 → 192.168.1.16 SSH 1514 Server: Encrypted packet (len=1448)
  313 0.458340749 192.168.1.16 → 10.6.15.144  TCP 66 59298 → 22 [ACK] Seq=7777 Ack=273453 Win=6155 Len=0 TSval=6081116 TSecr=6677496
  314 0.458650299  10.6.15.144 → 192.168.1.16 SSH 1514 Server: Encrypted packet (len=1448)
  315 0.458974085  10.6.15.144 → 192.168.1.16 SSH 1514 Server: Encrypted packet (len=1448)
  316 0.458979261 192.168.1.16 → 10.6.15.144  TCP 66 59298 → 22 [ACK] Seq=7777 Ack=276349 Win=6155 Len=0 TSval=6081116 TSecr=6677496
  317 0.463249243  10.6.15.144 → 192.168.1.16 SSH 1514 Server: Encrypted packet (len=1448)
  318 0.463560121  10.6.15.144 → 192.168.1.16 SSH 1514 Server: Encrypted packet (len=1448)
  319 0.463568914 192.168.1.16 → 10.6.15.144  TCP 66 59298 → 22 [ACK] Seq=7777 Ack=279245 Win=6155 Len=0 TSval=6081117 TSecr=6677497
  320 0.467371795  10.6.15.144 → 192.168.1.16 SSH 1514 Server: Encrypted packet (len=1448)
  321 0.468903763  10.6.15.144 → 192.168.1.16 SSH 1514 Server: Encrypted packet (len=1448)
  322 0.468915432 192.168.1.16 → 10.6.15.144  TCP 66 59298 → 22 [ACK] Seq=7777 Ack=282141 Win=6155 Len=0 TSval=6081119 TSecr=6677498
  323 0.469218562  10.6.15.144 → 192.168.1.16 SSH 1514 Server: Encrypted packet (len=1448)
  324 0.469536958  10.6.15.144 → 192.168.1.16 SSH 1514 Server: Encrypted packet (len=1448)
  325 0.469543111 192.168.1.16 → 10.6.15.144  TCP 66 59298 → 22 [ACK] Seq=7777 Ack=285037 Win=6155 Len=0 TSval=6081119 TSecr=6677499
  326 0.470013031  10.6.15.144 → 192.168.1.16 SSH 1514 Server: Encrypted packet (len=1448)
  327 0.470329027  10.6.15.144 → 192.168.1.16 SSH 1514 Server: Encrypted packet (len=1448)
  328 0.470334305 192.168.1.16 → 10.6.15.144  TCP 66 59298 → 22 [ACK] Seq=7777 Ack=287933 Win=6155 Len=0 TSval=6081119 TSecr=6677499
  329 0.474935283  10.6.15.144 → 192.168.1.16 SSH 1514 Server: Encrypted packet (len=1448)
  330 0.475249126  10.6.15.144 → 192.168.1.16 SSH 1514 Server: Encrypted packet (len=1448)
  331 0.475257850 192.168.1.16 → 10.6.15.144  TCP 66 59298 → 22 [ACK] Seq=7777 Ack=290829 Win=6155 Len=0 TSval=6081120 TSecr=6677500
  332 0.482018714  10.6.15.144 → 192.168.1.16 SSH 1514 Server: Encrypted packet (len=1448)
  333 0.482331017  10.6.15.144 → 192.168.1.16 SSH 1514 Server: Encrypted packet (len=1448)
  334 0.482345995 192.168.1.16 → 10.6.15.144  TCP 66 59298 → 22 [ACK] Seq=7777 Ack=293725 Win=6155 Len=0 TSval=6081122 TSecr=6677501
  335 0.482651398  10.6.15.144 → 192.168.1.16 SSH 1514 Server: [TCP Previous segment not captured] , Encrypted packet (len=1448)
  336 0.482663998 192.168.1.16 → 10.6.15.144  TCP 78 [TCP Dup ACK 334#1] 59298 → 22 [ACK] Seq=7777 Ack=293725 Win=6155 Len=0 TSval=6081122 TSecr=6677501 SLE=295173 SRE=296621
  337 0.482969029  10.6.15.144 → 192.168.1.16 SSH 1514 Server: Encrypted packet (len=1448)
  338 0.482979378 192.168.1.16 → 10.6.15.144  TCP 78 [TCP Dup ACK 334#2] 59298 → 22 [ACK] Seq=7777 Ack=293725 Win=6155 Len=0 TSval=6081122 TSecr=6677501 SLE=295173 SRE=298069
  339 0.483285940  10.6.15.144 → 192.168.1.16 SSH 1514 Server: Encrypted packet (len=1448)
  340 0.483296281 192.168.1.16 → 10.6.15.144  TCP 78 [TCP Dup ACK 334#3] 59298 → 22 [ACK] Seq=7777 Ack=293725 Win=6155 Len=0 TSval=6081122 TSecr=6677501 SLE=295173 SRE=299517
  341 0.486514378  10.6.15.144 → 192.168.1.16 SSH 1514 Server: Encrypted packet (len=1448)
  342 0.486533705 192.168.1.16 → 10.6.15.144  TCP 78 [TCP Dup ACK 334#4] 59298 → 22 [ACK] Seq=7777 Ack=293725 Win=6155 Len=0 TSval=6081123 TSecr=6677501 SLE=295173 SRE=300965
  343 0.486823735  10.6.15.144 → 192.168.1.16 SSH 1514 Server: Encrypted packet (len=1448)
  344 0.486832760 192.168.1.16 → 10.6.15.144  TCP 78 [TCP Dup ACK 334#5] 59298 → 22 [ACK] Seq=7777 Ack=293725 Win=6155 Len=0 TSval=6081123 TSecr=6677501 SLE=295173 SRE=302413
  345 0.494608452  10.6.15.144 → 192.168.1.16 SSH 1514 Server: Encrypted packet (len=1448)
  346 0.494630681 192.168.1.16 → 10.6.15.144  TCP 78 [TCP Dup ACK 334#6] 59298 → 22 [ACK] Seq=7777 Ack=293725 Win=6155 Len=0 TSval=6081125 TSecr=6677501 SLE=295173 SRE=303861
  347 0.494921625  10.6.15.144 → 192.168.1.16 SSH 1514 Server: Encrypted packet (len=1448)
  348 0.494933413 192.168.1.16 → 10.6.15.144  TCP 78 [TCP Dup ACK 334#7] 59298 → 22 [ACK] Seq=7777 Ack=293725 Win=6155 Len=0 TSval=6081125 TSecr=6677501 SLE=295173 SRE=305309
  349 0.495240708  10.6.15.144 → 192.168.1.16 SSH 1514 Server: Encrypted packet (len=1448)
  350 0.495252018 192.168.1.16 → 10.6.15.144  TCP 78 [TCP Dup ACK 334#8] 59298 → 22 [ACK] Seq=7777 Ack=293725 Win=6155 Len=0 TSval=6081125 TSecr=6677501 SLE=295173 SRE=306757
  351 0.495561724  10.6.15.144 → 192.168.1.16 SSH 1514 Server: Encrypted packet (len=1448)
  352 0.495573256 192.168.1.16 → 10.6.15.144  TCP 78 [TCP Dup ACK 334#9] 59298 → 22 [ACK] Seq=7777 Ack=293725 Win=6155 Len=0 TSval=6081125 TSecr=6677501 SLE=295173 SRE=308205
  353 0.495880996  10.6.15.144 → 192.168.1.16 SSH 1514 Server: Encrypted packet (len=1448)
  354 0.495892595 192.168.1.16 → 10.6.15.144  TCP 78 [TCP Dup ACK 334#10] 59298 → 22 [ACK] Seq=7777 Ack=293725 Win=6155 Len=0 TSval=6081126 TSecr=6677501 SLE=295173 SRE=309653
  355 0.496353705  10.6.15.144 → 192.168.1.16 SSH 1514 Server: Encrypted packet (len=1448)
  356 0.496363605 192.168.1.16 → 10.6.15.144  TCP 78 [TCP Dup ACK 334#11] 59298 → 22 [ACK] Seq=7777 Ack=293725 Win=6155 Len=0 TSval=6081126 TSecr=6677501 SLE=295173 SRE=311101
  357 0.496671636  10.6.15.144 → 192.168.1.16 SSH 1514 Server: [TCP Fast Retransmission] , Encrypted packet (len=1448)
  358 0.496684106 192.168.1.16 → 10.6.15.144  TCP 66 59298 → 22 [ACK] Seq=7777 Ack=311101 Win=6155 Len=0 TSval=6081126 TSecr=6677505
  359 0.498091631  10.6.15.144 → 192.168.1.16 SSH 1514 Server: Encrypted packet (len=1448)
  360 0.498105649 192.168.1.16 → 10.6.15.144  TCP 66 59298 → 22 [ACK] Seq=7777 Ack=312549 Win=6155 Len=0 TSval=6081126 TSecr=6677505
  361 0.498408463  10.6.15.144 → 192.168.1.16 SSH 1514 Server: Encrypted packet (len=1448)
  362 0.498417884 192.168.1.16 → 10.6.15.144  TCP 66 59298 → 22 [ACK] Seq=7777 Ack=313997 Win=6155 Len=0 TSval=6081126 TSecr=6677505
  363 0.507865548  10.6.15.144 → 192.168.1.16 SSH 1514 Server: Encrypted packet (len=1448)
  364 0.507886783 192.168.1.16 → 10.6.15.144  TCP 66 59298 → 22 [ACK] Seq=7777 Ack=315445 Win=6155 Len=0 TSval=6081129 TSecr=6677508
  365 0.508172003  10.6.15.144 → 192.168.1.16 SSH 1514 Server: Encrypted packet (len=1448)
  366 0.508181887 192.168.1.16 → 10.6.15.144  TCP 66 59298 → 22 [ACK] Seq=7777 Ack=316893 Win=6155 Len=0 TSval=6081129 TSecr=6677508
  367 0.508489653  10.6.15.144 → 192.168.1.16 SSH 1514 Server: Encrypted packet (len=1448)
  368 0.508498204 192.168.1.16 → 10.6.15.144  TCP 66 59298 → 22 [ACK] Seq=7777 Ack=318341 Win=6155 Len=0 TSval=6081129 TSecr=6677508
  369 0.508596940 192.168.1.16 → 10.6.15.144  SSH 670 Client: Encrypted packet (len=604)
  370 0.508808256  10.6.15.144 → 192.168.1.16 SSH 1514 Server: Encrypted packet (len=1448)
  371 0.512545644  10.6.15.144 → 192.168.1.16 SSH 1514 Server: Encrypted packet (len=1448)
