    1 0.000000000  10.6.15.144 → 192.168.1.16 SSH 174 Server: Encrypted packet (len=108)
    2 0.001069799  10.6.15.144 → 192.168.1.16 SSH 454 Server: Encrypted packet (len=388)
    3 0.001129789 192.168.1.16 → 10.6.15.144  TCP 66 59298 → 22 [ACK] Seq=1 Ack=497 Win=6155 Len=0 TSval=6089996 TSecr=6686375
    4 0.001845238  10.6.15.144 → 192.168.1.16 SSH 1514 Server: Encrypted packet (len=1448)
    5 0.002057303  10.6.15.144 → 192.168.1.16 SSH 1514 Server: Encrypted packet (len=1448)
    6 0.002066851 192.168.1.16 → 10.6.15.144  TCP 66 59298 → 22 [ACK] Seq=1 Ack=3393 Win=6155 Len=0 TSval=6089996 TSecr=6686376
    7 0.011635678  10.6.15.144 → 192.168.1.16 SSH 1514 Server: Encrypted packet (len=1448)
    8 0.011837799  10.6.15.144 → 192.168.1.16 SSH 1514 Server: Encrypted packet (len=1448)
    9 0.011845252 192.168.1.16 → 10.6.15.144  TCP 66 59298 → 22 [ACK] Seq=1 Ack=6289 Win=6155 Len=0 TSval=6089998 TSecr=6686378
   10 0.012721635  10.6.15.144 → 192.168.1.16 SSH 1514 Server: Encrypted packet (len=1448)
   11 0.012912502  10.6.15.144 → 192.168.1.16 SSH 1514 Server: Encrypted packet (len=1448)
   12 0.012925363 192.168.1.16 → 10.6.15.144  TCP 66 59298 → 22 [ACK] Seq=1 Ack=9185 Win=6155 Len=0 TSval=6089999 TSecr=6686378
   13 0.022797220  10.6.15.144 → 192.168.1.16 SSH 1514 Server: Encrypted packet (len=1448)
   14 0.022985478  10.6.15.144 → 192.168.1.16 SSH 1514 Server: Encrypted packet (len=1448)
   15 0.022993647 192.168.1.16 → 10.6.15.144  TCP 66 59298 → 22 [ACK] Seq=1 Ack=12081 Win=6155 Len=0 TSval=6090001 TSecr=6686381
   16 0.023027959 192.168.1.16 → 10.6.15.144  SSH 102 Client: Encrypted packet (len=36)
   17 0.023949202  10.6.15.144 → 192.168.1.16 SSH 1514 Server: Encrypted packet (len=1448)
   18 0.024161749  10.6.15.144 → 192.168.1.16 SSH 1514 Server: Encrypted packet (len=1448)
   19 0.024168939 192.168.1.16 → 10.6.15.144  TCP 66 59298 → 22 [ACK] Seq=37 Ack=14977 Win=6155 Len=0 TSval=6090001 TSecr=6686381
   20 0.031984318  10.6.15.144 → 192.168.1.16 SSH 1514 Server: Encrypted packet (len=1448)
   21 0.032190778  10.6.15.144 → 192.168.1.16 SSH 1514 Server: Encrypted packet (len=1448)
   22 0.032205371 192.168.1.16 → 10.6.15.144  TCP 66 59298 → 22 [ACK] Seq=37 Ack=17873 Win=6155 Len=0 TSval=6090003 TSecr=6686384
   23 0.033047129  10.6.15.144 → 192.168.1.16 SSH 1514 Server: Encrypted packet (len=1448)
   24 0.033260693  10.6.15.144 → 192.168.1.16 SSH 1514 Server: Encrypted packet (len=1448)
   25 0.033269768 192.168.1.16 → 10.6.15.144  TCP 66 59298 → 22 [ACK] Seq=37 Ack=20769 Win=6155 Len=0 TSval=6090004 TSecr=6686384
   26 0.059985957  10.6.15.144 → 192.168.1.16 SSH 1514 Server: Encrypted packet (len=1448)
   27 0.068764028  10.6.15.144 → 192.168.1.16 SSH 1514 Server: Encrypted packet (len=1448)
   28 0.068780549 192.168.1.16 → 10.6.15.144  TCP 66 59298 → 22 [ACK] Seq=37 Ack=23665 Win=6155 Len=0 TSval=6090013 TSecr=6686390
   29 0.068970605  10.6.15.144 → 192.168.1.16 SSH 1514 Server: Encrypted packet (len=1448)
   30 0.074624997  10.6.15.144 → 192.168.1.16 SSH 1514 Server: Encrypted packet (len=1448)
   31 0.074640922 192.168.1.16 → 10.6.15.144  TCP 66 59298 → 22 [ACK] Seq=37 Ack=26561 Win=6155 Len=0 TSval=6090014 TSecr=6686392
   32 0.074831549  10.6.15.144 → 192.168.1.16 SSH 1514 Server: Encrypted packet (len=1448)
   33 0.075042530  10.6.15.144 → 192.168.1.16 SSH 1514 Server: Encrypted packet (len=1448)
   34 0.075047348 192.168.1.16 → 10.6.15.144  TCP 66 59298 → 22 [ACK] Seq=37 Ack=29457 Win=6155 Len=0 TSval=6090014 TSecr=6686392
   35 0.079282690  10.6.15.144 → 192.168.1.16 SSH 1514 Server: Encrypted packet (len=1448)
   36 0.079488117  10.6.15.144 → 192.168.1.16 SSH 1514 Server: Encrypted packet (len=1448)
   37 0.079498381 192.168.1.16 → 10.6.15.144  TCP 66 59298 → 22 [ACK] Seq=37 Ack=32353 Win=6155 Len=0 TSval=6090015 TSecr=6686395
   38 0.081860845 192.168.1.16 → 10.6.15.144  SSH 102 Client: Encrypted packet (len=36)
   39 0.082287375 192.168.1.16 → 10.6.15.144  SSH 102 Client: Encrypted packet (len=36)
   40 0.085598317 192.168.1.16 → 10.6.15.144  SSH 126 Client: Encrypted packet (len=60)
   41 0.085991761  10.6.15.144 → 192.168.1.16 SSH 1514 Server: Encrypted packet (len=1448)
   42 0.086001429 192.168.1.16 → 10.6.15.144  SSH 102 Client: Encrypted packet (len=36)
   43 0.086198464  10.6.15.144 → 192.168.1.16 SSH 1514 Server: Encrypted packet (len=1448)
   44 0.086413424  10.6.15.144 → 192.168.1.16 SSH 1514 Server: Encrypted packet (len=1448)
   45 0.086418969 192.168.1.16 → 10.6.15.144  TCP 66 59298 → 22 [ACK] Seq=205 Ack=36697 Win=6155 Len=0 TSval=6090017 TSecr=6686396
   46 0.086627145  10.6.15.144 → 192.168.1.16 SSH 1514 Server: Encrypted packet (len=1448)
   47 0.090093014  10.6.15.144 → 192.168.1.16 SSH 1514 Server: Encrypted packet (len=1448)
   48 0.090110159 192.168.1.16 → 10.6.15.144  TCP 66 59298 → 22 [ACK] Seq=205 Ack=39593 Win=6155 Len=0 TSval=6090018 TSecr=6686396
   49 0.090301878  10.6.15.144 → 192.168.1.16 SSH 1514 Server: Encrypted packet (len=1448)
   50 0.091743067  10.6.15.144 → 192.168.1.16 TCP 66 22 → 59298 [ACK] Seq=41041 Ack=109 Win=1452 Len=0 TSval=6686398 TSecr=6090016
   51 0.091760386 192.168.1.16 → 10.6.15.144  SSH 242 Client: Encrypted packet (len=176)
   52 0.092111772 192.168.1.16 → 10.6.15.144  SSH 206 Client: Encrypted packet (len=140)
   53 0.097741945  10.6.15.144 → 192.168.1.16 SSH 1514 Server: Encrypted packet (len=1448)
   54 0.097965535  10.6.15.144 → 192.168.1.16 SSH 1514 Server: Encrypted packet (len=1448)
   55 0.097976338 192.168.1.16 → 10.6.15.144  TCP 66 59298 → 22 [ACK] Seq=521 Ack=43937 Win=6155 Len=0 TSval=6090020 TSecr=6686399
   56 0.100665378  10.6.15.144 → 192.168.1.16 SSH 1514 Server: Encrypted packet (len=1448)
   57 0.100878104  10.6.15.144 → 192.168.1.16 SSH 1514 Server: Encrypted packet (len=1448)
   58 0.100888784 192.168.1.16 → 10.6.15.144  TCP 66 59298 → 22 [ACK] Seq=521 Ack=46833 Win=6155 Len=0 TSval=6090021 TSecr=6686400
   59 0.102067445  10.6.15.144 → 192.168.1.16 SSH 1514 Server: Encrypted packet (len=1448)
   60 0.102278768  10.6.15.144 → 192.168.1.16 SSH 1514 Server: Encrypted packet (len=1448)
   61 0.102284284 192.168.1.16 → 10.6.15.144  TCP 66 59298 → 22 [ACK] Seq=521 Ack=49729 Win=6155 Len=0 TSval=6090021 TSecr=6686401
   62 0.108313853  10.6.15.144 → 192.168.1.16 SSH 1514 Server: Encrypted packet (len=1448)
   63 0.110905887  10.6.15.144 → 192.168.1.16 SSH 1514 Server: Encrypted packet (len=1448)
   64 0.110918696 192.168.1.16 → 10.6.15.144  TCP 66 59298 → 22 [ACK] Seq=521 Ack=52625 Win=6155 Len=0 TSval=6090023 TSecr=6686402
   65 0.111118521  10.6.15.144 → 192.168.1.16 SSH 1514 Server: Encrypted packet (len=1448)
   66 0.111758904  10.6.15.144 → 192.168.1.16 SSH 1514 Server: Encrypted packet (len=1448)
   67 0.111772711 192.168.1.16 → 10.6.15.144  TCP 66 59298 → 22 [ACK] Seq=521 Ack=55521 Win=6155 Len=0 TSval=6090023 TSecr=6686403
   68 0.112970188  10.6.15.144 → 192.168.1.16 SSH 1514 Server: Encrypted packet (len=1448)
   69 0.121484371  10.6.15.144 → 192.168.1.16 SSH 1514 Server: [TCP Previous segment not captured] , Encrypted packet (len=1448)
   70 0.121510043 192.168.1.16 → 10.6.15.144  TCP 78 59298 → 22 [ACK] Seq=521 Ack=56969 Win=6155 Len=0 TSval=6090026 TSecr=6686403 SLE=58417 SRE=59865
   71 0.121687809  10.6.15.144 → 192.168.1.16 SSH 1514 Server: Encrypted packet (len=1448)
   72 0.121692347 192.168.1.16 → 10.6.15.144  TCP 78 [TCP Dup ACK 70#1] 59298 → 22 [ACK] Seq=521 Ack=56969 Win=6155 Len=0 TSval=6090026 TSecr=6686403 SLE=58417 SRE=61313
   73 0.122352480  10.6.15.144 → 192.168.1.16 SSH 1514 Server: Encrypted packet (len=1448)
   74 0.122357446 192.168.1.16 → 10.6.15.144  TCP 78 [TCP Dup ACK 70#2] 59298 → 22 [ACK] Seq=521 Ack=56969 Win=6155 Len=0 TSval=6090026 TSecr=6686403 SLE=58417 SRE=62761
   75 0.122565442  10.6.15.144 → 192.168.1.16 SSH 1514 Server: Encrypted packet (len=1448)
   76 0.122568594 192.168.1.16 → 10.6.15.144  TCP 78 [TCP Dup ACK 70#3] 59298 → 22 [ACK] Seq=521 Ack=56969 Win=6155 Len=0 TSval=6090026 TSecr=6686403 SLE=58417 SRE=64209
   77 0.132173871  10.6.15.144 → 192.168.1.16 SSH 1514 Server: Encrypted packet (len=1448)
   78 0.132189273 192.168.1.16 → 10.6.15.144  TCP 78 [TCP Dup ACK 70#4] 59298 → 22 [ACK] Seq=521 Ack=56969 Win=6155 Len=0 TSval=6090028 TSecr=6686403 SLE=58417 SRE=65657
   79 0.132380229  10.6.15.144 → 192.168.1.16 SSH 1514 Server: Encrypted packet (len=1448)
   80 0.132385678 192.168.1.16 → 10.6.15.144  TCP 78 [TCP Dup ACK 70#5] 59298 → 22 [ACK] Seq=521 Ack=56969 Win=6155 Len=0 TSval=6090028 TSecr=6686403 SLE=58417 SRE=67105
   81 0.132595144  10.6.15.144 → 192.168.1.16 SSH 1514 Server: Encrypted packet (len=1448)
   82 0.132603423 192.168.1.16 → 10.6.15.144  TCP 78 [TCP Dup ACK 70#6] 59298 → 22 [ACK] Seq=521 Ack=56969 Win=6155 Len=0 TSval=6090028 TSecr=6686403 SLE=58417 SRE=68553
   83 0.133243622  10.6.15.144 → 192.168.1.16 SSH 1514 Server: [TCP Fast Retransmission] , Encrypted packet (len=1448)
   84 0.133259089 192.168.1.16 → 10.6.15.144  TCP 66 59298 → 22 [ACK] Seq=521 Ack=68553 Win=6155 Len=0 TSval=6090029 TSecr=6686408
   85 0.142442668  10.6.15.144 → 192.168.1.16 SSH 1514 Server: Encrypted packet (len=1448)
   86 0.142456503 192.168.1.16 → 10.6.15.144  TCP 66 59298 → 22 [ACK] Seq=521 Ack=70001 Win=6155 Len=0 TSval=6090031 TSecr=6686411
   87 0.142646983  10.6.15.144 → 192.168.1.16 SSH 1514 Server: Encrypted packet (len=1448)
   88 0.142651605 192.168.1.16 → 10.6.15.144  TCP 66 59298 → 22 [ACK] Seq=521 Ack=71449 Win=6155 Len=0 TSval=6090031 TSecr=6686411
   89 0.142862143  10.6.15.144 → 192.168.1.16 SSH 1514 Server: Encrypted packet (len=1448)
   90 0.142867507 192.168.1.16 → 10.6.15.144  TCP 66 59298 → 22 [ACK] Seq=521 Ack=72897 Win=6155 Len=0 TSval=6090031 TSecr=6686411
   91 0.153997533  10.6.15.144 → 192.168.1.16 SSH 1514 Server: [TCP Previous segment not captured] , Encrypted packet (len=1448)
   92 0.154019551 192.168.1.16 → 10.6.15.144  TCP 78 [TCP Dup ACK 90#1] 59298 → 22 [ACK] Seq=521 Ack=72897 Win=6155 Len=0 TSval=6090034 TSecr=6686411 SLE=74345 SRE=75793
   93 0.154202143  10.6.15.144 → 192.168.1.16 SSH 1514 Server: Encrypted packet (len=1448)
   94 0.154211592 192.168.1.16 → 10.6.15.144  TCP 78 [TCP Dup ACK 90#2] 59298 → 22 [ACK] Seq=521 Ack=72897 Win=6155 Len=0 TSval=6090034 TSecr=6686411 SLE=74345 SRE=77241
   95 0.154416778  10.6.15.144 → 192.168.1.16 SSH 1514 Server: Encrypted packet (len=1448)
   96 0.154426914 192.168.1.16 → 10.6.15.144  TCP 78 [TCP Dup ACK 90#3] 59298 → 22 [ACK] Seq=521 Ack=72897 Win=6155 Len=0 TSval=6090034 TSecr=6686411 SLE=74345 SRE=78689
   97 0.154537518 192.168.1.16 → 10.6.15.144  SSH 114 Client: Encrypted packet (len=36)
   98 0.155202829 192.168.1.16 → 10.6.15.144  SSH 130 Client: Encrypted packet (len=52)
   99 0.159991577 192.168.1.16 → 10.6.15.144  SSH 114 Client: Encrypted packet (len=36)
  100 0.162263364 192.168.1.16 → 10.6.15.144  SSH 114 Client: Encrypted packet (len=36)
  101 0.165083076  10.6.15.144 → 192.168.1.16 SSH 1514 Server: Encrypted packet (len=1448)
  102 0.165109341 192.168.1.16 → 10.6.15.144  TCP 78 [TCP Dup ACK 90#4] 59298 → 22 [ACK] Seq=681 Ack=72897 Win=6155 Len=0 TSval=6090037 TSecr=6686411 SLE=74345 SRE=80137
  103 0.165781677  10.6.15.144 → 192.168.1.16 SSH 1514 Server: Encrypted packet (len=1448)
  104 0.165805623 192.168.1.16 → 10.6.15.144  TCP 78 [TCP Dup ACK 90#5] 59298 → 22 [ACK] Seq=681 Ack=72897 Win=6155 Len=0 TSval=6090037 TSecr=6686411 SLE=74345 SRE=81585
  105 0.166700862  10.6.15.144 → 192.168.1.16 SSH 1514 Server: Encrypted packet (len=1448)
  106 0.166717767 192.168.1.16 → 10.6.15.144  TCP 78 [TCP Dup ACK 90#6] 59298 → 22 [ACK] Seq=681 Ack=72897 Win=6155 Len=0 TSval=6090037 TSecr=6686411 SLE=74345 SRE=83033
  107 0.167251914  10.6.15.144 → 192.168.1.16 SSH 1514 Server: [TCP Fast Retransmission] , Encrypted packet (len=1448)
  108 0.167273918 192.168.1.16 → 10.6.15.144  TCP 66 59298 → 22 [ACK] Seq=681 Ack=83033 Win=6155 Len=0 TSval=6090037 TSecr=6686416
  109 0.167623492  10.6.15.144 → 192.168.1.16 TCP 66 22 → 59298 [ACK] Seq=83033 Ack=609 Win=1452 Len=0 TSval=6686417 TSecr=6090034
  110 0.172137101  10.6.15.144 → 192.168.1.16 TCP 66 22 → 59298 [ACK] Seq=83033 Ack=681 Win=1452 Len=0 TSval=6686418 TSecr=6090035
  111 0.176497583  10.6.15.144 → 192.168.1.16 SSH 1514 Server: Encrypted packet (len=1448)
  112 0.176519531 192.168.1.16 → 10.6.15.144  TCP 66 59298 → 22 [ACK] Seq=681 Ack=84481 Win=6155 Len=0 TSval=6090039 TSecr=6686419
  113 0.177276050  10.6.15.144 → 192.168.1.16 SSH 1514 Server: Encrypted packet (len=1448)
  114 0.177293260 192.168.1.16 → 10.6.15.144  TCP 66 59298 → 22 [ACK] Seq=681 Ack=85929 Win=6155 Len=0 TSval=6090040 TSecr=6686419
  115 0.177947925  10.6.15.144 → 192.168.1.16 SSH 1514 Server: Encrypted packet (len=1448)
  116 0.177963205 192.168.1.16 → 10.6.15.144  TCP 66 59298 → 22 [ACK] Seq=681 Ack=87377 Win=6155 Len=0 TSval=6090040 TSecr=6686419
  117 0.178186463 192.168.1.16 → 10.6.15.144  SSH 286 Client: Encrypted packet (len=220)
  118 0.178474432 192.168.1.16 → 10.6.15.144  SSH 1246 Client: Encrypted packet (len=1180)
  119 0.187862879  10.6.15.144 → 192.168.1.16 SSH 1514 Server: Encrypted packet (len=1448)
  120 0.188065780  10.6.15.144 → 192.168.1.16 SSH 1514 Server: Encrypted packet (len=1448)
  121 0.188080283 192.168.1.16 → 10.6.15.144  TCP 66 59298 → 22 [ACK] Seq=2081 Ack=90273 Win=6155 Len=0 TSval=6090042 TSecr=6686422
  122 0.188688176  10.6.15.144 → 192.168.1.16 SSH 1514 Server: Encrypted packet (len=1448)
  123 0.188891460  10.6.15.144 → 192.168.1.16 SSH 1514 Server: Encrypted packet (len=1448)
  124 0.188899714 192.168.1.16 → 10.6.15.144  TCP 66 59298 → 22 [ACK] Seq=2081 Ack=93169 Win=6155 Len=0 TSval=6090043 TSecr=6686422
  125 0.189311492  10.6.15.144 → 192.168.1.16 TCP 66 22 → 59298 [ACK] Seq=93169 Ack=2081 Win=1452 Len=0 TSval=6686422 TSecr=6090040
  126 0.198669477  10.6.15.144 → 192.168.1.16 SSH 1514 Server: Encrypted packet (len=1448)
  127 0.199428203  10.6.15.144 → 192.168.1.16 SSH 1514 Server: [TCP Previous segment not captured] , Encrypted packet (len=1448)
  128 0.199437222 192.168.1.16 → 10.6.15.144  TCP 78 59298 → 22 [ACK] Seq=2081 Ack=94617 Win=6155 Len=0 TSval=6090045 TSecr=6686425 SLE=96065 SRE=97513
  129 0.199640242  10.6.15.144 → 192.168.1.16 SSH 1514 Server: Encrypted packet (len=1448)
  130 0.199644749 192.168.1.16 → 10.6.15.144  TCP 78 [TCP Dup ACK 128#1] 59298 → 22 [ACK] Seq=2081 Ack=94617 Win=6155 Len=0 TSval=6090045 TSecr=6686425 SLE=96065 SRE=98961
  131 0.210633389  10.6.15.144 → 192.168.1.16 SSH 1514 Server: Encrypted packet (len=1448)
  132 0.210647376 192.168.1.16 → 10.6.15.144  TCP 78 [TCP Dup ACK 128#2] 59298 → 22 [ACK] Seq=2081 Ack=94617 Win=6155 Len=0 TSval=6090048 TSecr=6686425 SLE=96065 SRE=100409
  133 0.210837548  10.6.15.144 → 192.168.1.16 SSH 1514 Server: Encrypted packet (len=1448)
  134 0.210842410 192.168.1.16 → 10.6.15.144  TCP 78 [TCP Dup ACK 128#3] 59298 → 22 [ACK] Seq=2081 Ack=94617 Win=6155 Len=0 TSval=6090048 TSecr=6686425 SLE=96065 SRE=101857
  135 0.213754247  10.6.15.144 → 192.168.1.16 SSH 1514 Server: Encrypted packet (len=1448)
  136 0.213762101 192.168.1.16 → 10.6.15.144  TCP 78 [TCP Dup ACK 128#4] 59298 → 22 [ACK] Seq=2081 Ack=94617 Win=6155 Len=0 TSval=6090049 TSecr=6686425 SLE=96065 SRE=103305
  137 0.222022692  10.6.15.144 → 192.168.1.16 SSH 1514 Server: [TCP Fast Retransmission] , Encrypted packet (len=1448)
  138 0.222036697 192.168.1.16 → 10.6.15.144  TCP 66 59298 → 22 [ACK] Seq=2081 Ack=103305 Win=6155 Len=0 TSval=6090051 TSecr=6686431
  139 0.222829403  10.6.15.144 → 192.168.1.16 SSH 1514 Server: Encrypted packet (len=1448)
  140 0.222835784 192.168.1.16 → 10.6.15.144  TCP 66 59298 → 22 [ACK] Seq=2081 Ack=104753 Win=6155 Len=0 TSval=6090051 TSecr=6686431
  141 0.232671807  10.6.15.144 → 192.168.1.16 SSH 1514 Server: Encrypted packet (len=1448)
  142 0.232698583 192.168.1.16 → 10.6.15.144  TCP 66 59298 → 22 [ACK] Seq=2081 Ack=106201 Win=6155 Len=0 TSval=6090054 TSecr=6686433
  143 0.233347264  10.6.15.144 → 192.168.1.16 SSH 1514 Server: Encrypted packet (len=1448)
  144 0.233353447 192.168.1.16 → 10.6.15.144  TCP 66 59298 → 22 [ACK] Seq=2081 Ack=107649 Win=6155 Len=0 TSval=6090054 TSecr=6686433
  145 0.233558920  10.6.15.144 → 192.168.1.16 SSH 1514 Server: Encrypted packet (len=1448)
  146 0.233562520 192.168.1.16 → 10.6.15.144  TCP 66 59298 → 22 [ACK] Seq=2081 Ack=109097 Win=6155 Len=0 TSval=6090054 TSecr=6686433
  147 0.242952501  10.6.15.144 → 192.168.1.16 SSH 1514 Server: Encrypted packet (len=1448)
  148 0.242968717 192.168.1.16 → 10.6.15.144  TCP 66 59298 → 22 [ACK] Seq=2081 Ack=110545 Win=6155 Len=0 TSval=6090056 TSecr=6686436
  149 0.243137832 192.168.1.16 → 10.6.15.144  SSH 102 Client: Encrypted packet (len=36)
  150 0.243877976  10.6.15.144 → 192.168.1.16 SSH 1514 Server: Encrypted packet (len=1448)
  151 0.244098691  10.6.15.144 → 192.168.1.16 SSH 1514 Server: Encrypted packet (len=1448)
  152 0.244103101 192.168.1.16 → 10.6.15.144  TCP 66 59298 → 22 [ACK] Seq=2117 Ack=113441 Win=6155 Len=0 TSval=6090056 TSecr=6686436
  153 0.253683433  10.6.15.144 → 192.168.1.16 SSH 1514 Server: Encrypted packet (len=1448)
  154 0.253884492  10.6.15.144 → 192.168.1.16 SSH 1514 Server: Encrypted packet (len=1448)
  155 0.253897520 192.168.1.16 → 10.6.15.144  TCP 66 59298 → 22 [ACK] Seq=2117 Ack=116337 Win=6155 Len=0 TSval=6090059 TSecr=6686439
  156 0.254899082  10.6.15.144 → 192.168.1.16 SSH 1514 Server: Encrypted packet (len=1448)
  157 0.255105539  10.6.15.144 → 192.168.1.16 SSH 1514 Server: Encrypted packet (len=1448)
  158 0.255117558 192.168.1.16 → 10.6.15.144  TCP 66 59298 → 22 [ACK] Seq=2117 Ack=119233 Win=6155 Len=0 TSval=6090059 TSecr=6686439
  159 0.265006479  10.6.15.144 → 192.168.1.16 SSH 1514 Server: Encrypted packet (len=1448)
  160 0.265578669  10.6.15.144 → 192.168.1.16 SSH 1514 Server: [TCP Previous segment not captured] , Encrypted packet (len=1448)
  161 0.265593773 192.168.1.16 → 10.6.15.144  TCP 78 59298 → 22 [ACK] Seq=2117 Ack=120681 Win=6155 Len=0 TSval=6090062 TSecr=6686441 SLE=122129 SRE=123577
  162 0.265787519  10.6.15.144 → 192.168.1.16 SSH 1514 Server: Encrypted packet (len=1448)
  163 0.265797202 192.168.1.16 → 10.6.15.144  TCP 78 [TCP Dup ACK 161#1] 59298 → 22 [ACK] Seq=2117 Ack=120681 Win=6155 Len=0 TSval=6090062 TSecr=6686441 SLE=122129 SRE=125025
  164 0.277966811  10.6.15.144 → 192.168.1.16 SSH 1514 Server: Encrypted packet (len=1448)
  165 0.277985255 192.168.1.16 → 10.6.15.144  TCP 78 [TCP Dup ACK 161#2] 59298 → 22 [ACK] Seq=2117 Ack=120681 Win=6155 Len=0 TSval=6090065 TSecr=6686441 SLE=122129 SRE=126473
  166 0.278170857  10.6.15.144 → 192.168.1.16 SSH 1514 Server: Encrypted packet (len=1448)
  167 0.278175876 192.168.1.16 → 10.6.15.144  TCP 78 [TCP Dup ACK 161#3] 59298 → 22 [ACK] Seq=2117 Ack=120681 Win=6155 Len=0 TSval=6090065 TSecr=6686441 SLE=122129 SRE=127921
  168 0.278389430  10.6.15.144 → 192.168.1.16 SSH 1514 Server: Encrypted packet (len=1448)
  169 0.278399547 192.168.1.16 → 10.6.15.144  TCP 78 [TCP Dup ACK 161#4] 59298 → 22 [ACK] Seq=2117 Ack=120681 Win=6155 Len=0 TSval=6090065 TSecr=6686441 SLE=122129 SRE=129369
  170 0.286962196  10.6.15.144 → 192.168.1.16 SSH 1514 Server: [TCP Fast Retransmission] , Encrypted packet (len=1448)
  171 0.286988398 192.168.1.16 → 10.6.15.144  TCP 66 59298 → 22 [ACK] Seq=2117 Ack=129369 Win=6155 Len=0 TSval=6090067 TSecr=6686447
  172 0.287164995  10.6.15.144 → 192.168.1.16 SSH 1514 Server: Encrypted packet (len=1448)
  173 0.287172315 192.168.1.16 → 10.6.15.144  TCP 66 59298 → 22 [ACK] Seq=2117 Ack=130817 Win=6155 Len=0 TSval=6090067 TSecr=6686447
  174 0.292126594 192.168.1.16 → 10.6.15.144  SSH 670 Client: Encrypted packet (len=604)
  175 0.296557094  10.6.15.144 → 192.168.1.16 SSH 1514 Server: Encrypted packet (len=1448)
  176 0.296762384  10.6.15.144 → 192.168.1.16 SSH 1514 Server: Encrypted packet (len=1448)
  177 0.296770983 192.168.1.16 → 10.6.15.144  TCP 66 59298 → 22 [ACK] Seq=2721 Ack=133713 Win=6155 Len=0 TSval=6090070 TSecr=6686449
  178 0.297443818  10.6.15.144 → 192.168.1.16 SSH 1514 Server: Encrypted packet (len=1448)
  179 0.305234624  10.6.15.144 → 192.168.1.16 SSH 1514 Server: Encrypted packet (len=1448)
  180 0.305261443 192.168.1.16 → 10.6.15.144  TCP 66 59298 → 22 [ACK] Seq=2721 Ack=136609 Win=6155 Len=0 TSval=6090072 TSecr=6686449
  181 0.305437765  10.6.15.144 → 192.168.1.16 SSH 1514 Server: Encrypted packet (len=1448)
  182 0.317107141  10.6.15.144 → 192.168.1.16 SSH 1514 Server: Encrypted packet (len=1448)
  183 0.317130253 192.168.1.16 → 10.6.15.144  TCP 66 59298 → 22 [ACK] Seq=2721 Ack=139505 Win=6155 Len=0 TSval=6090075 TSecr=6686452
  184 0.317310815  10.6.15.144 → 192.168.1.16 SSH 1514 Server: Encrypted packet (len=1448)
  185 0.317522433  10.6.15.144 → 192.168.1.16 SSH 1514 Server: Encrypted packet (len=1448)
  186 0.317534187 192.168.1.16 → 10.6.15.144  TCP 66 59298 → 22 [ACK] Seq=2721 Ack=142401 Win=6155 Len=0 TSval=6090075 TSecr=6686454
  187 0.326610889  10.6.15.144 → 192.168.1.16 SSH 1514 Server: Encrypted packet (len=1448)
  188 0.326813148  10.6.15.144 → 192.168.1.16 SSH 1514 Server: Encrypted packet (len=1448)
  189 0.326823386 192.168.1.16 → 10.6.15.144  TCP 66 59298 → 22 [ACK] Seq=2721 Ack=145297 Win=6155 Len=0 TSval=6090077 TSecr=6686457
  190 0.327520352  10.6.15.144 → 192.168.1.16 SSH 1514 Server: Encrypted packet (len=1448)
  191 0.327733319  10.6.15.144 → 192.168.1.16 SSH 1514 Server: Encrypted packet (len=1448)
  192 0.327740408 192.168.1.16 → 10.6.15.144  TCP 66 59298 → 22 [ACK] Seq=2721 Ack=148193 Win=6155 Len=0 TSval=6090077 TSecr=6686457
  193 0.337363260  10.6.15.144 → 192.168.1.16 SSH 1514 Server: Encrypted packet (len=1448)
  194 0.337563871  10.6.15.144 → 192.168.1.16 SSH 1514 Server: Encrypted packet (len=1448)
  195 0.337575634 192.168.1.16 → 10.6.15.144  TCP 66 59298 → 22 [ACK] Seq=2721 Ack=151089 Win=6155 Len=0 TSval=6090080 TSecr=6686459
  196 0.338287466  10.6.15.144 → 192.168.1.16 SSH 1514 Server: Encrypted packet (len=1448)
  197 0.338493108  10.6.15.144 → 192.168.1.16 SSH 1514 Server: Encrypted packet (len=1448)
  198 0.338501913 192.168.1.16 → 10.6.15.144  TCP 66 59298 → 22 [ACK] Seq=2721 Ack=153985 Win=6155 Len=0 TSval=6090080 TSecr=6686460
  199 0.347680769  10.6.15.144 → 192.168.1.16 SSH 1514 Server: Encrypted packet (len=1448)
  200 0.347878138  10.6.15.144 → 192.168.1.16 SSH 1514 Server: Encrypted packet (len=1448)
  201 0.347885702 192.168.1.16 → 10.6.15.144  TCP 66 59298 → 22 [ACK] Seq=2721 Ack=156881 Win=6155 Len=0 TSval=6090082 TSecr=6686462
  202 0.348790876  10.6.15.144 → 192.168.1.16 SSH 1514 Server: Encrypted packet (len=1448)
  203 0.349003624  10.6.15.144 → 192.168.1.16 SSH 1514 Server: Encrypted packet (len=1448)
  204 0.349009626 192.168.1.16 → 10.6.15.144  TCP 66 59298 → 22 [ACK] Seq=2721 Ack=159777 Win=6155 Len=0 TSval=6090083 TSecr=6686462
  205 0.358380801  10.6.15.144 → 192.168.1.16 SSH 1514 Server: Encrypted packet (len=1448)
  206 0.358586617  10.6.15.144 → 192.168.1.16 SSH 1514 Server: Encrypted packet (len=1448)
  207 0.358595395 192.168.1.16 → 10.6.15.144  TCP 66 59298 → 22 [ACK] Seq=2721 Ack=162673 Win=6155 Len=0 TSval=6090085 TSecr=6686465
  208 0.359189323  10.6.15.144 → 192.168.1.16 SSH 1514 Server: Encrypted packet (len=1448)
  209 0.359401986  10.6.15.144 → 192.168.1.16 SSH 1514 Server: Encrypted packet (len=1448)
  210 0.359409483 192.168.1.16 → 10.6.15.144  TCP 66 59298 → 22 [ACK] Seq=2721 Ack=165569 Win=6155 Len=0 TSval=6090085 TSecr=6686465
  211 0.369403805  10.6.15.144 → 192.168.1.16 SSH 1514 Server: Encrypted packet (len=1448)
  212 0.369611211  10.6.15.144 → 192.168.1.16 SSH 1514 Server: Encrypted packet (len=1448)
  213 0.369620074 192.168.1.16 → 10.6.15.144  TCP 66 59298 → 22 [ACK] Seq=2721 Ack=168465 Win=6155 Len=0 TSval=6090088 TSecr=6686467
  214 0.370302878  10.6.15.144 → 192.168.1.16 SSH 1514 Server: Encrypted packet (len=1448)
  215 0.370515972  10.6.15.144 → 192.168.1.16 SSH 1514 Server: Encrypted packet (len=1448)
  216 0.370522680 192.168.1.16 → 10.6.15.144  TCP 66 59298 → 22 [ACK] Seq=2721 Ack=171361 Win=6155 Len=0 TSval=6090088 TSecr=6686468
  217 0.380236143  10.6.15.144 → 192.168.1.16 SSH 1514 Server: Encrypted packet (len=1448)
  218 0.381078221  10.6.15.144 → 192.168.1.16 SSH 1514 Server: [TCP Previous segment not captured] , Encrypted packet (len=1448)
  219 0.381088168 192.168.1.16 → 10.6.15.144  TCP 78 59298 → 22 [ACK] Seq=2721 Ack=172809 Win=6155 Len=0 TSval=6090091 TSecr=6686470 SLE=174257 SRE=175705
  220 0.392076369  10.6.15.144 → 192.168.1.16 SSH 1514 Server: [TCP Previous segment not captured] , Encrypted packet (len=1448)
  221 0.392093554 192.168.1.16 → 10.6.15.144  TCP 86 [TCP Dup ACK 219#1] 59298 → 22 [ACK] Seq=2721 Ack=172809 Win=6155 Len=0 TSval=6090093 TSecr=6686470 SLE=177153 SRE=178601 SLE=174257 SRE=175705
  222 0.392287178  10.6.15.144 → 192.168.1.16 SSH 1514 Server: Encrypted packet (len=1448)
  223 0.392302942 192.168.1.16 → 10.6.15.144  TCP 86 [TCP Dup ACK 219#2] 59298 → 22 [ACK] Seq=2721 Ack=172809 Win=6155 Len=0 TSval=6090093 TSecr=6686470 SLE=177153 SRE=180049 SLE=174257 SRE=175705
  224 0.392497651  10.6.15.144 → 192.168.1.16 SSH 1514 Server: Encrypted packet (len=1448)
  225 0.392505892 192.168.1.16 → 10.6.15.144  TCP 86 [TCP Dup ACK 219#3] 59298 → 22 [ACK] Seq=2721 Ack=172809 Win=6155 Len=0 TSval=6090093 TSecr=6686470 SLE=177153 SRE=181497 SLE=174257 SRE=175705
  226 0.403945362  10.6.15.144 → 192.168.1.16 SSH 1514 Server: [TCP Fast Retransmission] , Encrypted packet (len=1448)
  227 0.403969482 192.168.1.16 → 10.6.15.144  TCP 78 59298 → 22 [ACK] Seq=2721 Ack=175705 Win=6155 Len=0 TSval=6090096 TSecr=6686476 SLE=177153 SRE=181497
  228 0.404148602  10.6.15.144 → 192.168.1.16 SSH 1514 Server: Encrypted packet (len=1448)
  229 0.404155450 192.168.1.16 → 10.6.15.144  TCP 78 [TCP Dup ACK 227#1] 59298 → 22 [ACK] Seq=2721 Ack=175705 Win=6155 Len=0 TSval=6090096 TSecr=6686476 SLE=177153 SRE=182945
  230 0.415249818  10.6.15.144 → 192.168.1.16 SSH 1514 Server: Encrypted packet (len=1448)
  231 0.415271797 192.168.1.16 → 10.6.15.144  TCP 78 [TCP Dup ACK 227#2] 59298 → 22 [ACK] Seq=2721 Ack=175705 Win=6155 Len=0 TSval=6090099 TSecr=6686476 SLE=177153 SRE=184393
  232 0.415451542  10.6.15.144 → 192.168.1.16 SSH 1514 Server: [TCP Fast Retransmission] , Encrypted packet (len=1448)
  233 0.415465411 192.168.1.16 → 10.6.15.144  TCP 66 59298 → 22 [ACK] Seq=2721 Ack=184393 Win=6155 Len=0 TSval=6090099 TSecr=6686479
  234 0.415667453  10.6.15.144 → 192.168.1.16 SSH 1514 Server: Encrypted packet (len=1448)
  235 0.415673863 192.168.1.16 → 10.6.15.144  TCP 66 59298 → 22 [ACK] Seq=2721 Ack=185841 Win=6155 Len=0 TSval=6090099 TSecr=6686479
  236 0.429255686  10.6.15.144 → 192.168.1.16 SSH 1514 Server: Encrypted packet (len=1448)
  237 0.429281338 192.168.1.16 → 10.6.15.144  TCP 66 59298 → 22 [ACK] Seq=2721 Ack=187289 Win=6155 Len=0 TSval=6090103 TSecr=6686482
  238 0.429461156  10.6.15.144 → 192.168.1.16 SSH 1514 Server: Encrypted packet (len=1448)
  239 0.429470860 192.168.1.16 → 10.6.15.144  TCP 66 59298 → 22 [ACK] Seq=2721 Ack=188737 Win=6155 Len=0 TSval=6090103 TSecr=6686482
  240 0.429673832  10.6.15.144 → 192.168.1.16 SSH 1514 Server: Encrypted packet (len=1448)
  241 0.429681844 192.168.1.16 → 10.6.15.144  TCP 66 59298 → 22 [ACK] Seq=2721 Ack=190185 Win=6155 Len=0 TSval=6090103 TSecr=6686482
  242 0.429887420  10.6.15.144 → 192.168.1.16 SSH 1514 Server: Encrypted packet (len=1448)
  243 0.429895057 192.168.1.16 → 10.6.15.144  TCP 66 59298 → 22 [ACK] Seq=2721 Ack=191633 Win=6155 Len=0 TSval=6090103 TSecr=6686482
  244 0.440402724  10.6.15.144 → 192.168.1.16 SSH 1514 Server: Encrypted packet (len=1448)
  245 0.440424267 192.168.1.16 → 10.6.15.144  TCP 66 59298 → 22 [ACK] Seq=2721 Ack=193081 Win=6155 Len=0 TSval=6090105 TSecr=6686485
  246 0.440606793  10.6.15.144 → 192.168.1.16 SSH 1514 Server: Encrypted packet (len=1448)
  247 0.440616498 192.168.1.16 → 10.6.15.144  TCP 66 59298 → 22 [ACK] Seq=2721 Ack=194529 Win=6155 Len=0 TSval=6090105 TSecr=6686485
  248 0.441323513  10.6.15.144 → 192.168.1.16 SSH 1514 Server: Encrypted packet (len=1448)
  249 0.441332025 192.168.1.16 → 10.6.15.144  TCP 66 59298 → 22 [ACK] Seq=2721 Ack=195977 Win=6155 Len=0 TSval=6090106 TSecr=6686485
  250 0.451476964  10.6.15.144 → 192.168.1.16 SSH 1514 Server: [TCP Previous segment not captured] , Encrypted packet (len=1448)
  251 0.451501249 192.168.1.16 → 10.6.15.144  TCP 78 [TCP Dup ACK 249#1] 59298 → 22 [ACK] Seq=2721 Ack=195977 Win=6155 Len=0 TSval=6090108 TSecr=6686485 SLE=197425 SRE=198873
  252 0.451682053  10.6.15.144 → 192.168.1.16 SSH 1514 Server: Encrypted packet (len=1448)
  253 0.451694621 192.168.1.16 → 10.6.15.144  TCP 78 [TCP Dup ACK 249#2] 59298 → 22 [ACK] Seq=2721 Ack=195977 Win=6155 Len=0 TSval=6090108 TSecr=6686485 SLE=197425 SRE=200321
  254 0.452404857  10.6.15.144 → 192.168.1.16 SSH 1514 Server: Encrypted packet (len=1448)
  255 0.452419951 192.168.1.16 → 10.6.15.144  TCP 78 [TCP Dup ACK 249#3] 59298 → 22 [ACK] Seq=2721 Ack=195977 Win=6155 Len=0 TSval=6090108 TSecr=6686485 SLE=197425 SRE=201769
  256 0.452599438  10.6.15.144 → 192.168.1.16 SSH 1414 Server: Encrypted packet (len=1348)
  257 0.452609879 192.168.1.16 → 10.6.15.144  TCP 78 [TCP Dup ACK 249#4] 59298 → 22 [ACK] Seq=2721 Ack=195977 Win=6155 Len=0 TSval=6090108 TSecr=6686485 SLE=197425 SRE=203117
  258 0.463221698  10.6.15.144 → 192.168.1.16 SSH 1514 Server: [TCP Fast Retransmission] , Encrypted packet (len=1448)
  259 0.463248900 192.168.1.16 → 10.6.15.144  TCP 66 59298 → 22 [ACK] Seq=2721 Ack=203117 Win=6155 Len=0 TSval=6090111 TSecr=6686491
  260 0.464234014 192.168.1.16 → 10.6.15.144  SSH 210 Client: Encrypted packet (len=144)
  261 0.468896788 192.168.1.16 → 10.6.15.144  SSH 422 Client: Encrypted packet (len=356)
  262 0.471130530 192.168.1.16 → 10.6.15.144  SSH 590 Client: Encrypted packet (len=524)
  263 0.481203771  10.6.15.144 → 192.168.1.16 TCP 66 22 → 59298 [ACK] Seq=203117 Ack=3221 Win=1452 Len=0 TSval=6686495 TSecr=6090111
  264 0.521251565  10.6.15.144 → 192.168.1.16 TCP 66 22 → 59298 [ACK] Seq=203117 Ack=3745 Win=1452 Len=0 TSval=6686506 TSecr=6090113
  265 0.522774939  10.6.15.144 → 192.168.1.16 SSH 1514 Server: Encrypted packet (len=1448)
  266 0.522986052  10.6.15.144 → 192.168.1.16 SSH 1510 Server: Encrypted packet (len=1444)
  267 0.522999787 192.168.1.16 → 10.6.15.144  TCP 66 59298 → 22 [ACK] Seq=3745 Ack=206009 Win=6155 Len=0 TSval=6090126 TSecr=6686506
  268 0.524515240  10.6.15.144 → 192.168.1.16 SSH 686 Server: Encrypted packet (len=620)
  269 0.525424369 192.168.1.16 → 10.6.15.144  SSH 206 Client: Encrypted packet (len=140)
  270 0.526386699 192.168.1.16 → 10.6.15.144  SSH 1514 Client: Encrypted packet (len=1448)
  271 0.527195299 192.168.1.16 → 10.6.15.144  SSH 342 Client: Encrypted packet (len=276)
  272 0.533144311  10.6.15.144 → 192.168.1.16 SSH 578 Server: Encrypted packet (len=512)
  273 0.534408783 192.168.1.16 → 10.6.15.144  SSH 206 Client: Encrypted packet (len=140)
  274 0.535330688  10.6.15.144 → 192.168.1.16 TCP 66 22 → 59298 [ACK] Seq=207141 Ack=3885 Win=1452 Len=0 TSval=6686509 TSecr=6090127
  275 0.537537581  10.6.15.144 → 192.168.1.16 TCP 66 22 → 59298 [ACK] Seq=207141 Ack=5609 Win=1452 Len=0 TSval=6686510 TSecr=6090127
  276 0.544835857  10.6.15.144 → 192.168.1.16 TCP 66 22 → 59298 [ACK] Seq=207141 Ack=5749 Win=1452 Len=0 TSval=6686511 TSecr=6090129
  277 0.575131204  10.6.15.144 → 192.168.1.16 SSH 382 Server: Encrypted packet (len=316)
  278 0.578293944  10.6.15.144 → 192.168.1.16 SSH 758 Server: Encrypted packet (len=692)
  279 0.578380182 192.168.1.16 → 10.6.15.144  TCP 66 59298 → 22 [ACK] Seq=5749 Ack=208149 Win=6155 Len=0 TSval=6090140 TSecr=6686519
  280 0.580391376 192.168.1.16 → 10.6.15.144  SSH 102 Client: Encrypted packet (len=36)
  281 0.580626495 192.168.1.16 → 10.6.15.144  SSH 102 Client: Encrypted packet (len=36)
  282 0.580840530 192.168.1.16 → 10.6.15.144  SSH 102 Client: Encrypted packet (len=36)
  283 0.581055157 192.168.1.16 → 10.6.15.144  SSH 138 Client: Encrypted packet (len=72)
  284 0.581284293 192.168.1.16 → 10.6.15.144  SSH 138 Client: Encrypted packet (len=72)
  285 0.584735034  10.6.15.144 → 192.168.1.16 SSH 366 Server: Encrypted packet (len=300)
  286 0.590538894  10.6.15.144 → 192.168.1.16 TCP 66 22 → 59298 [ACK] Seq=208449 Ack=5821 Win=1452 Len=0 TSval=6686523 TSecr=6090140
  287 0.590562753 192.168.1.16 → 10.6.15.144  SSH 342 Client: Encrypted packet (len=276)
  288 0.590581761  10.6.15.144 → 192.168.1.16 TCP 66 22 → 59298 [ACK] Seq=208449 Ack=5929 Win=1452 Len=0 TSval=6686523 TSecr=6090141
  289 0.600692870  10.6.15.144 → 192.168.1.16 TCP 66 22 → 59298 [ACK] Seq=208449 Ack=6277 Win=1452 Len=0 TSval=6686525 TSecr=6090141
  290 0.609908493  10.6.15.144 → 192.168.1.16 SSH 138 Server: Encrypted packet (len=72)
  291 0.610219614 192.168.1.16 → 10.6.15.144  SSH 102 Client: Encrypted packet (len=36)
  292 0.617552568  10.6.15.144 → 192.168.1.16 SSH 110 Server: Encrypted packet (len=44)
  293 0.618017172 192.168.1.16 → 10.6.15.144  SSH 462 Client: Encrypted packet (len=396)
  294 0.627852022  10.6.15.144 → 192.168.1.16 TCP 66 22 → 59298 [ACK] Seq=208565 Ack=6709 Win=1452 Len=0 TSval=6686532 TSecr=6090148
  295 0.630610721  10.6.15.144 → 192.168.1.16 SSH 138 Server: Encrypted packet (len=72)
  296 0.630930734 192.168.1.16 → 10.6.15.144  SSH 102 Client: Encrypted packet (len=36)
  297 0.635012745  10.6.15.144 → 192.168.1.16 SSH 238 Server: Encrypted packet (len=172)
  298 0.635805231 192.168.1.16 → 10.6.15.144  SSH 302 Client: Encrypted packet (len=236)
  299 0.637750167  10.6.15.144 → 192.168.1.16 SSH 134 Server: Encrypted packet (len=68)
  300 0.637779151  10.6.15.144 → 192.168.1.16 SSH 138 Server: Encrypted packet (len=72)
  301 0.637825650 192.168.1.16 → 10.6.15.144  TCP 66 59298 → 22 [ACK] Seq=6981 Ack=208949 Win=6155 Len=0 TSval=6090155 TSecr=6686535
  302 0.638096985 192.168.1.16 → 10.6.15.144  SSH 102 Client: Encrypted packet (len=36)
  303 0.641555900  10.6.15.144 → 192.168.1.16 SSH 294 Server: Encrypted packet (len=228)
  304 0.641921926 192.168.1.16 → 10.6.15.144  SSH 102 Client: Encrypted packet (len=36)
  305 0.642143923 192.168.1.16 → 10.6.15.144  SSH 406 Client: Encrypted packet (len=340)
  306 0.645812641  10.6.15.144 → 192.168.1.16 SSH 138 Server: Encrypted packet (len=72)
  307 0.646034605 192.168.1.16 → 10.6.15.144  SSH 102 Client: Encrypted packet (len=36)
  308 0.647813618  10.6.15.144 → 192.168.1.16 SSH 102 Server: Encrypted packet (len=36)
  309 0.648100595 192.168.1.16 → 10.6.15.144  SSH 158 Client: Encrypted packet (len=92)
  310 0.648878093  10.6.15.144 → 192.168.1.16 SSH 166 Server: Encrypted packet (len=100)
  311 0.652134359  10.6.15.144 → 192.168.1.16 TCP 66 22 → 59298 [ACK] Seq=209385 Ack=7393 Win=1452 Len=0 TSval=6686538 TSecr=6090156
  312 0.653587832  10.6.15.144 → 192.168.1.16 SSH 138 Server: Encrypted packet (len=72)
  313 0.654495282 192.168.1.16 → 10.6.15.144  TCP 66 59298 → 22 [ACK] Seq=7521 Ack=209457 Win=6155 Len=0 TSval=6090159 TSecr=6686537
  314 0.654650843 192.168.1.16 → 10.6.15.144  SSH 102 Client: Encrypted packet (len=36)
  315 0.658343049  10.6.15.144 → 192.168.1.16 TCP 66 22 → 59298 [ACK] Seq=209457 Ack=7521 Win=1452 Len=0 TSval=6686540 TSecr=6090157
  316 0.662699982  10.6.15.144 → 192.168.1.16 SSH 102 Server: Encrypted packet (len=36)
  317 0.663058377 192.168.1.16 → 10.6.15.144  SSH 158 Client: Encrypted packet (len=92)
  318 0.674056139  10.6.15.144 → 192.168.1.16 TCP 66 22 → 59298 [ACK] Seq=209493 Ack=7649 Win=1452 Len=0 TSval=6686543 TSecr=6090159
  319 0.689988793  10.6.15.144 → 192.168.1.16 SSH 190 Server: Encrypted packet (len=124)
  320 0.692910202  10.6.15.144 → 192.168.1.16 SSH 454 Server: Encrypted packet (len=388)
  321 0.692982958 192.168.1.16 → 10.6.15.144  TCP 66 59298 → 22 [ACK] Seq=7649 Ack=210005 Win=6155 Len=0 TSval=6090169 TSecr=6686548
  322 0.693839694 192.168.1.16 → 10.6.15.144  SSH 206 Client: Encrypted packet (len=140)
  323 0.699635083  10.6.15.144 → 192.168.1.16 SSH 1514 Server: Encrypted packet (len=1448)
  324 0.699697403  10.6.15.144 → 192.168.1.16 SSH 662 Server: Encrypted packet (len=596)
  325 0.699708978 192.168.1.16 → 10.6.15.144  TCP 66 59298 → 22 [ACK] Seq=7789 Ack=212049 Win=6155 Len=0 TSval=6090170 TSecr=6686550
  326 0.702136367  10.6.15.144 → 192.168.1.16 SSH 1166 Server: Encrypted packet (len=1100)
  327 0.702160801  10.6.15.144 → 192.168.1.16 SSH 174 Server: Encrypted packet (len=108)
  328 0.702217629 192.168.1.16 → 10.6.15.144  TCP 66 59298 → 22 [ACK] Seq=7789 Ack=213257 Win=6155 Len=0 TSval=6090171 TSecr=6686551
  329 0.703441596 192.168.1.16 → 10.6.15.144  SSH 206 Client: Encrypted packet (len=140)
  330 0.705533666 192.168.1.16 → 10.6.15.144  SSH 1174 Client: Encrypted packet (len=1108)
  331 0.708742937  10.6.15.144 → 192.168.1.16 SSH 454 Server: Encrypted packet (len=388)
  332 0.710419694 192.168.1.16 → 10.6.15.144  SSH 206 Client: Encrypted packet (len=140)
  333 0.711954829 192.168.1.16 → 10.6.15.144  SSH 1078 Client: Encrypted packet (len=1012)
  334 0.716001520  10.6.15.144 → 192.168.1.16 TCP 66 22 → 59298 [ACK] Seq=213645 Ack=9037 Win=1452 Len=0 TSval=6686554 TSecr=6090171
  335 0.720224666  10.6.15.144 → 192.168.1.16 SSH 238 Server: Encrypted packet (len=172)
  336 0.724611353 192.168.1.16 → 10.6.15.144  SSH 134 Client: Encrypted packet (len=68)
  337 0.729958980 192.168.1.16 → 10.6.15.144  SSH 230 Client: Encrypted packet (len=164)
  338 0.730243382 192.168.1.16 → 10.6.15.144  SSH 206 Client: Encrypted packet (len=140)
  339 0.732051124  10.6.15.144 → 192.168.1.16 SSH 182 Server: Encrypted packet (len=116)
  340 0.732505812 192.168.1.16 → 10.6.15.144  SSH 134 Client: Encrypted packet (len=68)
  341 0.741219739  10.6.15.144 → 192.168.1.16 TCP 66 22 → 59298 [ACK] Seq=213933 Ack=10421 Win=1452 Len=0 TSval=6686560 TSecr=6090176
  342 0.742896088  10.6.15.144 → 192.168.1.16 TCP 66 22 → 59298 [ACK] Seq=213933 Ack=10629 Win=1452 Len=0 TSval=6686561 TSecr=6090178
  343 0.742951199  10.6.15.144 → 192.168.1.16 SSH 366 Server: Encrypted packet (len=300)
  344 0.750447081  10.6.15.144 → 192.168.1.16 SSH 146 Server: Encrypted packet (len=80)
  345 0.750511670 192.168.1.16 → 10.6.15.144  TCP 66 59298 → 22 [ACK] Seq=10629 Ack=214313 Win=6155 Len=0 TSval=6090183 TSecr=6686561
  346 0.750773035 192.168.1.16 → 10.6.15.144  SSH 158 Client: Encrypted packet (len=92)
  347 0.751000399 192.168.1.16 → 10.6.15.144  SSH 158 Client: Encrypted packet (len=92)
  348 0.760642343  10.6.15.144 → 192.168.1.16 TCP 66 22 → 59298 [ACK] Seq=214313 Ack=10813 Win=1452 Len=0 TSval=6686565 TSecr=6090183
  349 0.763497633  10.6.15.144 → 192.168.1.16 SSH 1514 Server: Encrypted packet (len=1448)
  350 0.763585064  10.6.15.144 → 192.168.1.16 SSH 774 Server: Encrypted packet (len=708)
  351 0.763593445 192.168.1.16 → 10.6.15.144  TCP 66 59298 → 22 [ACK] Seq=10813 Ack=216469 Win=6155 Len=0 TSval=6090186 TSecr=6686566
  352 0.763965520  10.6.15.144 → 192.168.1.16 SSH 1514 Server: Encrypted packet (len=1448)
  353 0.763973523  10.6.15.144 → 192.168.1.16 SSH 110 Server: Encrypted packet (len=44)
  354 0.763978089 192.168.1.16 → 10.6.15.144  TCP 66 59298 → 22 [ACK] Seq=10813 Ack=217961 Win=6155 Len=0 TSval=6090186 TSecr=6686566
  355 0.774060098  10.6.15.144 → 192.168.1.16 SSH 1514 Server: Encrypted packet (len=1448)
  356 0.777377471  10.6.15.144 → 192.168.1.16 SSH 1514 Server: Encrypted packet (len=1448)
  357 0.777396834 192.168.1.16 → 10.6.15.144  TCP 66 59298 → 22 [ACK] Seq=10813 Ack=220857 Win=6155 Len=0 TSval=6090190 TSecr=6686569
  358 0.777584174  10.6.15.144 → 192.168.1.16 SSH 1514 Server: Encrypted packet (len=1448)
  359 0.777757679  10.6.15.144 → 192.168.1.16 SSH 1278 Server: Encrypted packet (len=1212)
  360 0.777763644 192.168.1.16 → 10.6.15.144  TCP 66 59298 → 22 [ACK] Seq=10813 Ack=223517 Win=6155 Len=0 TSval=6090190 TSecr=6686569
  361 0.788703398  10.6.15.144 → 192.168.1.16 SSH 1514 Server: Encrypted packet (len=1448)
  362 0.788900554  10.6.15.144 → 192.168.1.16 SSH 1514 Server: Encrypted packet (len=1448)
