    1 0.000000000 192.168.1.12 → 239.255.255.250 SSDP 213 M-SEARCH * HTTP/1.1 
    2 1.003677752  192.168.1.1 → 239.255.255.250 SSDP 302 NOTIFY * HTTP/1.1 
    3 1.006749255  192.168.1.1 → 239.255.255.250 SSDP 311 NOTIFY * HTTP/1.1 
    4 1.010157031  192.168.1.1 → 239.255.255.250 SSDP 374 NOTIFY * HTTP/1.1 
    5 1.013588311  192.168.1.1 → 239.255.255.250 SSDP 370 NOTIFY * HTTP/1.1 
    6 1.016941544  192.168.1.1 → 239.255.255.250 SSDP 350 NOTIFY * HTTP/1.1 
    7 1.020440416  192.168.1.1 → 239.255.255.250 SSDP 382 NOTIFY * HTTP/1.1 
    8 1.027138126  192.168.1.1 → 239.255.255.250 SSDP 366 NOTIFY * HTTP/1.1 
    9 1.030041686  192.168.1.1 → 239.255.255.250 SSDP 302 NOTIFY * HTTP/1.1 
   10 1.033089917  192.168.1.1 → 239.255.255.250 SSDP 311 NOTIFY * HTTP/1.1 
   11 1.036510788  192.168.1.1 → 239.255.255.250 SSDP 374 NOTIFY * HTTP/1.1 
   12 1.039824466  192.168.1.1 → 239.255.255.250 SSDP 370 NOTIFY * HTTP/1.1 
   13 1.043051309  192.168.1.1 → 239.255.255.250 SSDP 350 NOTIFY * HTTP/1.1 
   14 1.046574440  192.168.1.1 → 239.255.255.250 SSDP 382 NOTIFY * HTTP/1.1 
   15 1.049893556  192.168.1.1 → 239.255.255.250 SSDP 364 NOTIFY * HTTP/1.1 
   16 1.053232578  192.168.1.1 → 239.255.255.250 SSDP 366 NOTIFY * HTTP/1.1 
   17 1.201311966  10.6.15.156 → 192.168.1.12 SSH 1514 Server: Encrypted packet (len=1448)
   18 1.201419126  10.6.15.156 → 192.168.1.12 SSH 378 Server: Encrypted packet (len=312)
   19 1.201432174 192.168.1.12 → 10.6.15.156  TCP 66 54766 → 22 [ACK] Seq=1 Ack=1761 Win=2571 Len=0 TSval=7324016 TSecr=14255506
   20 1.201668647 192.168.1.12 → 10.6.15.156  SSH 390 Client: Encrypted packet (len=324)
   21 1.203930615  10.6.15.156 → 192.168.1.12 TCP 66 22 → 54766 [ACK] Seq=1761 Ack=325 Win=1452 Len=0 TSval=14255507 TSecr=7324016
   22 1.203944361 192.168.1.12 → 10.6.15.156  SSH 1470 Client: Encrypted packet (len=1404)
   23 1.207010656  10.6.15.156 → 192.168.1.12 TCP 66 22 → 54766 [ACK] Seq=1761 Ack=1729 Win=1452 Len=0 TSval=14255507 TSecr=7324016
   24 1.359747427  10.6.15.156 → 192.168.1.12 SSH 102 Server: Encrypted packet (len=36)
   25 1.360072081 192.168.1.12 → 10.6.15.156  SSH 190 Client: Encrypted packet (len=124)
   26 1.361787325  10.6.15.156 → 192.168.1.12 TCP 66 22 → 54766 [ACK] Seq=1797 Ack=1853 Win=1452 Len=0 TSval=14255546 TSecr=7324055
   27 1.371264739  10.6.15.156 → 192.168.1.12 SSH 102 Server: Encrypted packet (len=36)
   28 1.371581973 192.168.1.12 → 10.6.15.156  SSH 150 Client: Encrypted packet (len=84)
   29 1.377631639  10.6.15.156 → 192.168.1.12 SSH 102 Server: Encrypted packet (len=36)
   30 1.377952311 192.168.1.12 → 10.6.15.156  SSH 158 Client: Encrypted packet (len=92)
   31 1.419293785  10.6.15.156 → 192.168.1.12 TCP 66 22 → 54766 [ACK] Seq=1869 Ack=2029 Win=1452 Len=0 TSval=14255561 TSecr=7324060
   32 1.479233541  10.6.15.156 → 192.168.1.12 SSH 102 Server: Encrypted packet (len=36)
   33 1.479553201 192.168.1.12 → 10.6.15.156  SSH 150 Client: Encrypted packet (len=84)
   34 1.487644158  10.6.15.156 → 192.168.1.12 TCP 66 22 → 54766 [ACK] Seq=1905 Ack=2113 Win=1452 Len=0 TSval=14255576 TSecr=7324085
   35 1.549281150  10.6.15.156 → 192.168.1.12 SSH 102 Server: Encrypted packet (len=36)
   36 1.549621489 192.168.1.12 → 10.6.15.156  SSH 158 Client: Encrypted packet (len=92)
   37 1.550623304  10.6.15.156 → 192.168.1.12 SSH 102 Server: Encrypted packet (len=36)
   38 1.551802385  10.6.15.156 → 192.168.1.12 TCP 66 22 → 54766 [ACK] Seq=1977 Ack=2205 Win=1452 Len=0 TSval=14255594 TSecr=7324103
   39 1.551823190 192.168.1.12 → 10.6.15.156  SSH 150 Client: Encrypted packet (len=84)
   40 1.554075108  10.6.15.156 → 192.168.1.12 TCP 66 22 → 54766 [ACK] Seq=1977 Ack=2289 Win=1452 Len=0 TSval=14255594 TSecr=7324103
   41 1.558977781  10.6.15.156 → 192.168.1.12 SSH 1254 Server: Encrypted packet (len=1188)
   42 1.600940702 192.168.1.12 → 10.6.15.156  TCP 66 54766 → 22 [ACK] Seq=2289 Ack=3165 Win=2571 Len=0 TSval=7324116 TSecr=14255595
   43 1.614074630  10.6.15.156 → 192.168.1.12 SSH 542 Server: Encrypted packet (len=476)
   44 1.614100235 192.168.1.12 → 10.6.15.156  TCP 66 54766 → 22 [ACK] Seq=2289 Ack=3641 Win=2571 Len=0 TSval=7324119 TSecr=14255609
   45 1.615102419 192.168.1.12 → 10.6.15.156  SSH 206 Client: Encrypted packet (len=140)
   46 1.655744078  10.6.15.156 → 192.168.1.12 TCP 66 22 → 54766 [ACK] Seq=3641 Ack=2429 Win=1452 Len=0 TSval=14255620 TSecr=7324119
   47 1.691738416  10.6.15.156 → 192.168.1.12 SSH 110 Server: Encrypted packet (len=44)
   48 1.691877055  10.6.15.156 → 192.168.1.12 SSH 158 Server: Encrypted packet (len=92)
   49 1.691894902 192.168.1.12 → 10.6.15.156  TCP 66 54766 → 22 [ACK] Seq=2429 Ack=3777 Win=2571 Len=0 TSval=7324138 TSecr=14255629
   50 1.692080572 192.168.1.12 → 10.6.15.156  SSH 150 Client: Encrypted packet (len=84)
   51 1.692473292  10.6.15.156 → 192.168.1.12 SSH 478 Server: Encrypted packet (len=412)
   52 1.693401762  10.6.15.156 → 192.168.1.12 TCP 66 22 → 54766 [ACK] Seq=4189 Ack=2513 Win=1452 Len=0 TSval=14255629 TSecr=7324138
   53 1.693412452 192.168.1.12 → 10.6.15.156  SSH 206 Client: Encrypted packet (len=140)
   54 1.695140572  10.6.15.156 → 192.168.1.12 TCP 66 22 → 54766 [ACK] Seq=4189 Ack=2653 Win=1452 Len=0 TSval=14255630 TSecr=7324139
   55 1.701529617  10.6.15.156 → 192.168.1.12 SSH 534 Server: Encrypted packet (len=468)
   56 1.702537333 192.168.1.12 → 10.6.15.156  SSH 206 Client: Encrypted packet (len=140)
   57 1.707299178  10.6.15.156 → 192.168.1.12 SSH 1294 Server: Encrypted packet (len=1228)
   58 1.708183859  10.6.15.156 → 192.168.1.12 SSH 462 Server: Encrypted packet (len=396)
   59 1.708201628 192.168.1.12 → 10.6.15.156  TCP 66 54766 → 22 [ACK] Seq=2793 Ack=6281 Win=2571 Len=0 TSval=7324142 TSecr=14255632
   60 1.708259500  10.6.15.156 → 192.168.1.12 SSH 174 Server: Encrypted packet (len=108)
   61 1.708329723  10.6.15.156 → 192.168.1.12 SSH 478 Server: Encrypted packet (len=412)
   62 1.708333521  10.22.17.94 → 224.0.0.252  LLMNR 64 Standard query 0x171a A wpad
   63 1.708354053  10.22.17.94 → 224.0.0.252  LLMNR 64 Standard query 0x43d5 A wpad
   64 1.708390162 192.168.1.12 → 10.6.15.156  TCP 66 54766 → 22 [ACK] Seq=2793 Ack=6801 Win=2571 Len=0 TSval=7324142 TSecr=14255632
   65 1.709322056 192.168.1.12 → 10.6.15.156  SSH 206 Client: Encrypted packet (len=140)
   66 1.718988714  10.6.15.156 → 192.168.1.12 SSH 550 Server: Encrypted packet (len=484)
   67 1.719007587 192.168.1.12 → 10.6.15.156  SSH 206 Client: Encrypted packet (len=140)
   68 1.759100048  10.6.15.156 → 192.168.1.12 TCP 66 22 → 54766 [ACK] Seq=7285 Ack=3073 Win=1452 Len=0 TSval=14255646 TSecr=7324145
   69 1.759120054 192.168.1.12 → 10.6.15.156  SSH 206 Client: Encrypted packet (len=140)
   70 1.759976831  10.6.15.156 → 192.168.1.12 SSH 1190 Server: Encrypted packet (len=1124)
   71 1.760955881  10.6.15.156 → 192.168.1.12 TCP 66 22 → 54766 [ACK] Seq=8409 Ack=3213 Win=1452 Len=0 TSval=14255646 TSecr=7324155
   72 1.761050574 192.168.1.12 → 10.6.15.156  SSH 206 Client: Encrypted packet (len=140)
   73 1.762684003  10.6.15.156 → 192.168.1.12 TCP 66 22 → 54766 [ACK] Seq=8409 Ack=3353 Win=1452 Len=0 TSval=14255646 TSecr=7324156
   74 1.775844231  10.6.15.156 → 192.168.1.12 SSH 534 Server: Encrypted packet (len=468)
   75 1.776946694 192.168.1.12 → 10.6.15.156  SSH 206 Client: Encrypted packet (len=140)
   76 1.815292713  10.6.15.156 → 192.168.1.12 TCP 66 22 → 54766 [ACK] Seq=8877 Ack=3493 Win=1452 Len=0 TSval=14255660 TSecr=7324160
   77 1.817518953  10.6.15.156 → 192.168.1.12 SSH 198 Server: Encrypted packet (len=132)
   78 1.817860809  10.6.15.156 → 192.168.1.12 SSH 462 Server: Encrypted packet (len=396)
   79 1.817890221 192.168.1.12 → 10.6.15.156  TCP 66 54766 → 22 [ACK] Seq=3493 Ack=9405 Win=2571 Len=0 TSval=7324170 TSecr=14255660
   80 1.818785205 192.168.1.12 → 10.6.15.156  SSH 206 Client: Encrypted packet (len=140)
   81 1.820391131  10.6.15.156 → 192.168.1.12 TCP 66 22 → 54766 [ACK] Seq=9405 Ack=3633 Win=1452 Len=0 TSval=14255661 TSecr=7324170
   82 1.866432316  10.6.15.156 → 192.168.1.12 SSH 942 Server: Encrypted packet (len=876)
   83 1.867217742 192.168.1.12 → 10.6.15.156  SSH 430 Client: Encrypted packet (len=364)
   84 1.869090055  10.6.15.156 → 192.168.1.12 TCP 66 22 → 54766 [ACK] Seq=10281 Ack=3997 Win=1452 Len=0 TSval=14255673 TSecr=7324182
   85 1.887961507  10.6.15.156 → 192.168.1.12 SSH 214 Server: Encrypted packet (len=148)
   86 1.888725931 192.168.1.12 → 10.6.15.156  SSH 422 Client: Encrypted packet (len=356)
   87 1.899738545  10.6.15.156 → 192.168.1.12 SSH 238 Server: Encrypted packet (len=172)
   88 1.900010923 192.168.1.12 → 10.6.15.156  SSH 134 Client: Encrypted packet (len=68)
   89 1.901736378  10.6.15.156 → 192.168.1.12 SSH 306 Server: Encrypted packet (len=240)
   90 1.901803288  10.6.15.156 → 192.168.1.12 SSH 134 Server: Encrypted packet (len=68)
   91 1.901842845 192.168.1.12 → 10.6.15.156  TCP 66 54766 → 22 [ACK] Seq=4421 Ack=10909 Win=2571 Len=0 TSval=7324191 TSecr=14255681
   92 1.902537013 192.168.1.12 → 10.6.15.156  SSH 422 Client: Encrypted packet (len=356)
   93 1.945274872  10.6.15.156 → 192.168.1.12 TCP 66 22 → 54766 [ACK] Seq=10909 Ack=4777 Win=1452 Len=0 TSval=14255692 TSecr=7324191
   94 1.945293638 192.168.1.12 → 10.6.15.156  SSH 134 Client: Encrypted packet (len=68)
   95 1.947612120  10.6.15.156 → 192.168.1.12 TCP 66 22 → 54766 [ACK] Seq=10909 Ack=4845 Win=1452 Len=0 TSval=14255692 TSecr=7324202
   96 2.015846423  10.6.15.156 → 192.168.1.12 SSH 366 Server: Encrypted packet (len=300)
   97 2.016413269 192.168.1.12 → 10.6.15.156  SSH 654 Client: Encrypted packet (len=588)
   98 2.018876944  10.6.15.156 → 192.168.1.12 TCP 66 22 → 54766 [ACK] Seq=11209 Ack=5433 Win=1452 Len=0 TSval=14255710 TSecr=7324219
   99 2.107366167  10.6.15.156 → 192.168.1.12 SSH 558 Server: Encrypted packet (len=492)
  100 2.108415245 192.168.1.12 → 10.6.15.156  SSH 206 Client: Encrypted packet (len=140)
  101 2.110111805  10.6.15.156 → 192.168.1.12 TCP 66 22 → 54766 [ACK] Seq=11701 Ack=5573 Win=1452 Len=0 TSval=14255733 TSecr=7324242
  102 2.118757074  10.22.17.94 → 224.0.0.252  LLMNR 64 Standard query 0x171a A wpad
  103 2.118882825  10.22.17.94 → 224.0.0.252  LLMNR 64 Standard query 0x43d5 A wpad
  104 2.174935403  10.6.15.156 → 192.168.1.12 SSH 350 Server: Encrypted packet (len=284)
  105 2.192996804  10.6.15.156 → 192.168.1.12 SSH 350 Server: Encrypted packet (len=284)
  106 2.193060306 192.168.1.12 → 10.6.15.156  TCP 66 54766 → 22 [ACK] Seq=5573 Ack=12269 Win=2571 Len=0 TSval=7324264 TSecr=14255749
  107 2.218516178  10.6.15.156 → 192.168.1.12 SSH 422 Server: Encrypted packet (len=356)
  108 2.230724360 192.168.1.12 → 139.59.16.133 NTP 90 NTP Version 4, client
  109 2.241071747  10.6.15.156 → 192.168.1.12 SSH 190 Server: Encrypted packet (len=124)
  110 2.241126873 192.168.1.12 → 10.6.15.156  TCP 66 54766 → 22 [ACK] Seq=5573 Ack=12749 Win=2571 Len=0 TSval=7324276 TSecr=14255760
  111 2.241233532  10.6.15.156 → 192.168.1.12 SSH 462 Server: Encrypted packet (len=396)
  112 2.242116372 192.168.1.12 → 10.6.15.156  SSH 206 Client: Encrypted packet (len=140)
  113 2.243770858  10.6.15.156 → 192.168.1.12 TCP 66 22 → 54766 [ACK] Seq=13145 Ack=5713 Win=1452 Len=0 TSval=14255767 TSecr=7324276
  114 2.268817725  10.6.15.156 → 192.168.1.12 SSH 422 Server: Encrypted packet (len=356)
  115 2.308937339 192.168.1.12 → 10.6.15.156  TCP 66 54766 → 22 [ACK] Seq=5713 Ack=13501 Win=2571 Len=0 TSval=7324293 TSecr=14255773
  116 2.318608262  10.6.15.156 → 192.168.1.12 SSH 414 Server: Encrypted packet (len=348)
  117 2.318685845 192.168.1.12 → 10.6.15.156  TCP 66 54766 → 22 [ACK] Seq=5713 Ack=13849 Win=2571 Len=0 TSval=7324295 TSecr=14255785
  118 2.343114509  10.6.15.156 → 192.168.1.12 SSH 350 Server: Encrypted packet (len=284)
  119 2.343192368 192.168.1.12 → 10.6.15.156  TCP 66 54766 → 22 [ACK] Seq=5713 Ack=14133 Win=2571 Len=0 TSval=7324301 TSecr=14255791
  120 2.371336143  10.6.15.156 → 192.168.1.12 SSH 158 Server: Encrypted packet (len=92)
  121 2.371414919 192.168.1.12 → 10.6.15.156  TCP 66 54766 → 22 [ACK] Seq=5713 Ack=14225 Win=2571 Len=0 TSval=7324308 TSecr=14255799
  122 2.371989074 192.168.1.12 → 10.6.15.156  SSH 1126 Client: Encrypted packet (len=1060)
  123 2.403014571  10.6.15.156 → 192.168.1.12 SSH 150 Server: Encrypted packet (len=84)
  124 2.408445242  10.6.15.156 → 192.168.1.12 SSH 534 Server: Encrypted packet (len=468)
  125 2.408501842  10.6.15.156 → 192.168.1.12 SSH 102 Server: Encrypted packet (len=36)
  126 2.408535966 192.168.1.12 → 10.6.15.156  TCP 66 54766 → 22 [ACK] Seq=6773 Ack=14813 Win=2571 Len=0 TSval=7324317 TSecr=14255806
  127 2.409899243 192.168.1.12 → 10.6.15.156  SSH 138 Client: Encrypted packet (len=72)
  128 2.411854631  10.6.15.156 → 192.168.1.12 SSH 102 Server: Encrypted packet (len=36)
  129 2.424170216  10.6.15.156 → 192.168.1.12 SSH 150 Server: Encrypted packet (len=84)
  130 2.424227288 192.168.1.12 → 10.6.15.156  TCP 66 54766 → 22 [ACK] Seq=6845 Ack=14933 Win=2571 Len=0 TSval=7324321 TSecr=14255809
  131 2.437709471  10.6.15.156 → 192.168.1.12 SSH 398 Server: Encrypted packet (len=332)
  132 2.480890139 192.168.1.12 → 10.6.15.156  TCP 66 54766 → 22 [ACK] Seq=6845 Ack=15265 Win=2571 Len=0 TSval=7324336 TSecr=14255815
  133 2.728341322  10.6.15.156 → 192.168.1.12 SSH 398 Server: Encrypted packet (len=332)
  134 2.728366539 192.168.1.12 → 10.6.15.156  TCP 66 54766 → 22 [ACK] Seq=6845 Ack=15597 Win=2571 Len=0 TSval=7324397 TSecr=14255888
  135 2.786239956  10.6.15.156 → 192.168.1.12 SSH 398 Server: Encrypted packet (len=332)
  136 2.786258663 192.168.1.12 → 10.6.15.156  TCP 66 54766 → 22 [ACK] Seq=6845 Ack=15929 Win=2571 Len=0 TSval=7324412 TSecr=14255902
  137 2.863119032  10.6.15.156 → 192.168.1.12 SSH 390 Server: Encrypted packet (len=324)
  138 2.863135403 192.168.1.12 → 10.6.15.156  TCP 66 54766 → 22 [ACK] Seq=6845 Ack=16253 Win=2571 Len=0 TSval=7324431 TSecr=14255921
  139 2.863150914  10.6.15.156 → 192.168.1.12 SSH 102 Server: Encrypted packet (len=36)
  140 2.863155211 192.168.1.12 → 10.6.15.156  TCP 66 54766 → 22 [ACK] Seq=6845 Ack=16289 Win=2571 Len=0 TSval=7324431 TSecr=14255922
  141 2.864573695 192.168.1.12 → 10.6.15.156  SSH 138 Client: Encrypted packet (len=72)
  142 2.868547894  10.6.15.156 → 192.168.1.12 SSH 102 Server: Encrypted packet (len=36)
  143 2.908911317 192.168.1.12 → 10.6.15.156  TCP 66 54766 → 22 [ACK] Seq=6917 Ack=16325 Win=2571 Len=0 TSval=7324443 TSecr=14255923
  144 3.694605510  10.6.15.156 → 192.168.1.12 SSH 398 Server: Encrypted packet (len=332)
  145 3.694632420 192.168.1.12 → 10.6.15.156  TCP 66 54766 → 22 [ACK] Seq=6917 Ack=16657 Win=2571 Len=0 TSval=7324639 TSecr=14256129
  146 3.942358895  10.6.15.156 → 192.168.1.12 SSH 846 Server: Encrypted packet (len=780)
  147 3.942377498 192.168.1.12 → 10.6.15.156  TCP 66 54766 → 22 [ACK] Seq=6917 Ack=17437 Win=2571 Len=0 TSval=7324701 TSecr=14256191
  148 5.957066067 192.168.1.12 → 10.6.15.156  SSH 302 Client: Encrypted packet (len=236)
  149 5.995299713  10.6.15.156 → 192.168.1.12 TCP 66 22 → 54766 [ACK] Seq=17437 Ack=7153 Win=1452 Len=0 TSval=14256705 TSecr=7325205
  150 6.026065320  10.6.15.156 → 192.168.1.12 SSH 502 Server: Encrypted packet (len=436)
  151 6.026081687 192.168.1.12 → 10.6.15.156  TCP 66 54766 → 22 [ACK] Seq=7153 Ack=17873 Win=2571 Len=0 TSval=7325222 TSecr=14256712
  152 6.026541134 192.168.1.12 → 10.6.15.156  SSH 134 Client: Encrypted packet (len=68)
  153 6.029315120  10.6.15.156 → 192.168.1.12 TCP 66 22 → 54766 [ACK] Seq=17873 Ack=7221 Win=1452 Len=0 TSval=14256713 TSecr=7325222
  154 6.707137306  10.22.17.94 → 224.0.0.252  LLMNR 64 Standard query 0x150b A wpad
  155 6.766771361  10.22.17.94 → 224.0.0.252  LLMNR 64 Standard query 0xd587 A wpad
  156 7.117220089  10.22.17.94 → 224.0.0.252  LLMNR 64 Standard query 0x150b A wpad
  157 7.177729164  10.22.17.94 → 224.0.0.252  LLMNR 64 Standard query 0xd587 A wpad
  158 7.966453198 192.168.1.12 → 10.6.15.156  SSH 262 Client: Encrypted packet (len=196)
  159 7.966691253 192.168.1.12 → 10.6.15.156  SSH 1514 Client: Encrypted packet (len=1448)
  160 7.967222374 192.168.1.12 → 10.6.15.156  SSH 470 Client: Encrypted packet (len=404)
  161 7.968420843  10.6.15.156 → 192.168.1.12 TCP 66 22 → 54766 [ACK] Seq=17873 Ack=7417 Win=1452 Len=0 TSval=14257198 TSecr=7325707
  162 7.969187230  10.6.15.156 → 192.168.1.12 TCP 66 22 → 54766 [ACK] Seq=17873 Ack=9269 Win=1451 Len=0 TSval=14257198 TSecr=7325707
  163 7.970966795  10.6.15.156 → 192.168.1.12 SSH 142 Server: Encrypted packet (len=76)
  164 8.012902532 192.168.1.12 → 10.6.15.156  TCP 66 54766 → 22 [ACK] Seq=9269 Ack=17949 Win=2571 Len=0 TSval=7325719 TSecr=14257198
  165 8.089992621  10.6.15.156 → 192.168.1.12 SSH 1070 Server: Encrypted packet (len=1004)
  166 8.090019690 192.168.1.12 → 10.6.15.156  TCP 66 54766 → 22 [ACK] Seq=9269 Ack=18953 Win=2571 Len=0 TSval=7325738 TSecr=14257228
  167 8.091042544  10.6.15.156 → 192.168.1.12 SSH 342 Server: Encrypted packet (len=276)
  168 8.091060969 192.168.1.12 → 10.6.15.156  TCP 66 54766 → 22 [ACK] Seq=9269 Ack=19229 Win=2571 Len=0 TSval=7325738 TSecr=14257228
  169 8.091119160  10.6.15.156 → 192.168.1.12 SSH 134 Server: Encrypted packet (len=68)
  170 8.091125610 192.168.1.12 → 10.6.15.156  TCP 66 54766 → 22 [ACK] Seq=9269 Ack=19297 Win=2571 Len=0 TSval=7325738 TSecr=14257228
  171 8.091614690 192.168.1.12 → 10.6.15.156  SSH 134 Client: Encrypted packet (len=68)
  172 8.131906095  10.6.15.156 → 192.168.1.12 TCP 66 22 → 54766 [ACK] Seq=19297 Ack=9337 Win=1452 Len=0 TSval=14257239 TSecr=7325738
  173 8.723062540  10.6.15.156 → 192.168.1.12 SSH 462 Server: Encrypted packet (len=396)
  174 8.723967931 192.168.1.12 → 10.6.15.156  SSH 206 Client: Encrypted packet (len=140)
  175 8.725787754  10.6.15.156 → 192.168.1.12 TCP 66 22 → 54766 [ACK] Seq=19693 Ack=9477 Win=1452 Len=0 TSval=14257387 TSecr=7325896
  176 9.722985429  10.6.15.156 → 192.168.1.12 SSH 126 Server: Encrypted packet (len=60)
  177 9.723052807  10.6.15.156 → 192.168.1.12 SSH 102 Server: Encrypted packet (len=36)
  178 9.723078754 192.168.1.12 → 10.6.15.156  TCP 66 54766 → 22 [ACK] Seq=9477 Ack=19789 Win=2571 Len=0 TSval=7326146 TSecr=14257636
  179 9.740167997  10.6.15.156 → 192.168.1.12 SSH 126 Server: Encrypted packet (len=60)
  180 9.740236561  10.6.15.156 → 192.168.1.12 SSH 102 Server: Encrypted packet (len=36)
  181 9.740254473 192.168.1.12 → 10.6.15.156  TCP 66 54766 → 22 [ACK] Seq=9477 Ack=19885 Win=2571 Len=0 TSval=7326150 TSecr=14257641
  182 9.773896265  10.6.15.156 → 192.168.1.12 SSH 102 Server: Encrypted packet (len=36)
  183 9.780423885  10.6.15.156 → 192.168.1.12 SSH 126 Server: Encrypted packet (len=60)
  184 9.780491511  10.6.15.156 → 192.168.1.12 SSH 102 Server: Encrypted packet (len=36)
  185 9.780511450 192.168.1.12 → 10.6.15.156  TCP 66 54766 → 22 [ACK] Seq=9477 Ack=20017 Win=2571 Len=0 TSval=7326160 TSecr=14257649
  186 10.407238397  10.6.15.156 → 192.168.1.12 SSH 102 Server: Encrypted packet (len=36)
  187 10.407527995 192.168.1.12 → 10.6.15.156  SSH 138 Client: Encrypted packet (len=72)
  188 10.409057632  10.6.15.156 → 192.168.1.12 TCP 66 22 → 54766 [ACK] Seq=20053 Ack=9549 Win=1452 Len=0 TSval=14257808 TSecr=7326317
  189 10.409225432  10.6.15.156 → 192.168.1.12 SSH 102 Server: Encrypted packet (len=36)
  190 10.452887225 192.168.1.12 → 10.6.15.156  TCP 66 54766 → 22 [ACK] Seq=9549 Ack=20089 Win=2571 Len=0 TSval=7326329 TSecr=14257808
  191 11.610963173  192.168.1.1 → 224.0.0.1    IGMPv2 42 Membership Query, general
  192 11.916690788  10.6.15.156 → 192.168.1.12 SSH 102 Server: Encrypted packet (len=36)
  193 11.916727187 192.168.1.12 → 10.6.15.156  TCP 66 54766 → 22 [ACK] Seq=9549 Ack=20125 Win=2571 Len=0 TSval=7326694 TSecr=14258185
  194 13.846361439 192.168.1.12 → 10.6.15.156  SSH 302 Client: Encrypted packet (len=236)
  195 13.887242287  10.6.15.156 → 192.168.1.12 TCP 66 22 → 54766 [ACK] Seq=20125 Ack=9785 Win=1452 Len=0 TSval=14258678 TSecr=7327177
  196 13.919117698  10.6.15.156 → 192.168.1.12 SSH 102 Server: Encrypted packet (len=36)
  197 13.919135696 192.168.1.12 → 10.6.15.156  TCP 66 54766 → 22 [ACK] Seq=9785 Ack=20161 Win=2571 Len=0 TSval=7327195 TSecr=14258685
  198 14.233337226  10.6.15.156 → 192.168.1.12 SSH 486 Server: Encrypted packet (len=420)
  199 14.233381829 192.168.1.12 → 10.6.15.156  TCP 66 54766 → 22 [ACK] Seq=9785 Ack=20581 Win=2571 Len=0 TSval=7327274 TSecr=14258763
  200 14.234493159 192.168.1.12 → 10.6.15.156  SSH 134 Client: Encrypted packet (len=68)
  201 14.236663757  10.6.15.156 → 192.168.1.12 TCP 66 22 → 54766 [ACK] Seq=20581 Ack=9853 Win=1452 Len=0 TSval=14258765 TSecr=7327274
  202 15.230805316 192.168.1.12 → 139.59.16.133 NTP 90 NTP Version 4, client
  203 15.233513940 10.119.73.122 → 192.168.1.12 ICMP 110 Destination unreachable (Communication administratively filtered)
  204 16.112963453 192.168.1.12 → 216.58.197.42 TCP 66 43102 → 443 [ACK] Seq=1 Ack=1 Win=494 Len=0 TSval=7327744 TSecr=11639242
  205 16.113049194 192.168.1.12 → 216.58.196.99 TCP 66 46320 → 443 [ACK] Seq=1 Ack=1 Win=339 Len=0 TSval=7327744 TSecr=1636470404
  206 16.115360152 216.58.197.42 → 192.168.1.12 TCP 66 [TCP ACKed unseen segment] 443 → 43102 [ACK] Seq=1 Ack=2 Win=188 Len=0 TSval=11684298 TSecr=7293498
  207 16.115925988 216.58.196.99 → 192.168.1.12 TCP 66 [TCP ACKed unseen segment] 443 → 46320 [ACK] Seq=1 Ack=2 Win=175 Len=0 TSval=1636515460 TSecr=7293537
  208 17.571310128  10.6.15.156 → 192.168.1.12 SSH 382 Server: Encrypted packet (len=316)
  209 17.571627198  10.6.15.156 → 192.168.1.12 SSH 102 Server: Encrypted packet (len=36)
  210 17.571659988 192.168.1.12 → 10.6.15.156  TCP 66 54766 → 22 [ACK] Seq=9853 Ack=20933 Win=2571 Len=0 TSval=7328108 TSecr=14259598
  211 20.464944883 192.168.1.12 → 224.0.0.252  IGMPv2 46 Membership Report group 224.0.0.252
  212 21.232944675 192.168.1.12 → 224.0.0.251  IGMPv2 46 Membership Report group 224.0.0.251
  213 22.230842946 192.168.1.12 → 139.59.16.133 NTP 90 NTP Version 4, client
  214 22.233466464 10.119.73.122 → 192.168.1.12 ICMP 110 Destination unreachable (Communication administratively filtered)
  215 30.230751529 192.168.1.12 → 52.66.76.135 NTP 90 NTP Version 4, client
  216 30.233843990 10.119.73.122 → 192.168.1.12 ICMP 110 Destination unreachable (Communication administratively filtered)
