    1 0.000000000 192.168.1.16 → 192.168.1.1  DNS 89 Standard query 0x62b5 A clientservices.googleapis.com
    2 0.001827650  10.6.15.144 → 192.168.1.16 SSH 430 Server: Encrypted packet (len=364)
    3 0.001967553  10.6.15.144 → 192.168.1.16 SSH 1038 Server: Encrypted packet (len=972)
    4 0.002001281 192.168.1.16 → 10.6.15.144  TCP 66 59298 → 22 [ACK] Seq=1 Ack=1337 Win=3666 Len=0 TSval=4482820 TSecr=5079121
    5 0.002012249 192.168.1.16 → 10.6.15.144  SSH 210 Client: Encrypted packet (len=144)
    6 0.002063558  10.6.15.144 → 192.168.1.16 SSH 714 Server: Encrypted packet (len=648)
    7 0.002765765  10.6.15.144 → 192.168.1.16 SSH 138 Server: Encrypted packet (len=72)
    8 0.002840206 192.168.1.16 → 10.6.15.144  TCP 66 59298 → 22 [ACK] Seq=145 Ack=2057 Win=3666 Len=0 TSval=4482821 TSecr=5079121
    9 0.002852813 192.168.1.16 → 10.6.15.144  SSH 426 Client: Encrypted packet (len=360)
   10 0.003682356 192.168.1.16 → 10.6.15.144  SSH 406 Client: Encrypted packet (len=340)
   11 0.012111058  192.168.1.1 → 192.168.1.16 DNS 105 Standard query response 0x62b5 A clientservices.googleapis.com A 216.58.197.35
   12 0.012581798 192.168.1.16 → 216.58.197.35 TCP 74 45076 → 443 [SYN] Seq=0 Win=29200 Len=0 MSS=1460 SACK_PERM=1 TSval=4482823 TSecr=0 WS=128
   13 0.013614351  10.6.15.144 → 192.168.1.16 SSH 1142 Server: Encrypted packet (len=1076)
   14 0.013632633  10.6.15.144 → 192.168.1.16 TCP 66 22 → 59298 [ACK] Seq=3133 Ack=145 Win=1452 Len=0 TSval=5079169 TSecr=4482820
   15 0.013641773  10.6.15.144 → 192.168.1.16 TCP 66 22 → 59298 [ACK] Seq=3133 Ack=505 Win=1452 Len=0 TSval=5079169 TSecr=4482821
   16 0.013911424 192.168.1.16 → 10.6.15.144  SSH 138 Client: Encrypted packet (len=72)
   17 0.014693858  10.6.15.144 → 192.168.1.16 TCP 66 22 → 59298 [ACK] Seq=3133 Ack=845 Win=1452 Len=0 TSval=5079169 TSecr=4482821
   18 0.014727578 192.168.1.16 → 10.6.15.144  SSH 134 Client: Encrypted packet (len=68)
   19 0.014907666 192.168.1.16 → 10.6.15.144  SSH 250 Client: Encrypted packet (len=184)
   20 0.015744355 192.168.1.16 → 10.6.15.144  SSH 334 Client: Encrypted packet (len=268)
   21 0.020634597  10.6.15.144 → 192.168.1.16 SSH 138 Server: Encrypted packet (len=72)
   22 0.020872212 192.168.1.16 → 10.6.15.144  SSH 102 Client: Encrypted packet (len=36)
   23 0.024486431  10.6.15.144 → 192.168.1.16 TCP 66 22 → 59298 [ACK] Seq=3205 Ack=985 Win=1452 Len=0 TSval=5079172 TSecr=4482823
   24 0.025957672  10.6.15.144 → 192.168.1.16 TCP 66 22 → 59298 [ACK] Seq=3205 Ack=1437 Win=1452 Len=0 TSval=5079172 TSecr=4482824
   25 0.039832013 216.58.197.35 → 192.168.1.16 TCP 74 443 → 45076 [SYN, ACK] Seq=0 Ack=1 Win=42408 Len=0 MSS=1380 SACK_PERM=1 TSval=4267604265 TSecr=4482823 WS=256
   26 0.039861327 192.168.1.16 → 216.58.197.35 TCP 66 45076 → 443 [ACK] Seq=1 Ack=1 Win=29312 Len=0 TSval=4482830 TSecr=4267604265
   27 0.039976024 192.168.1.16 → 216.58.197.35 SSL 279 Client Hello
   28 0.051335756 216.58.197.35 → 192.168.1.16 TCP 66 443 → 45076 [ACK] Seq=1 Ack=214 Win=43520 Len=0 TSval=4267604277 TSecr=4482830
   29 0.052762152 216.58.197.35 → 192.168.1.16 TLSv1.2 1484 Server Hello
   30 0.052788731 192.168.1.16 → 216.58.197.35 TCP 66 45076 → 443 [ACK] Seq=214 Ack=1419 Win=32128 Len=0 TSval=4482833 TSecr=4267604278
   31 0.052882173 216.58.197.35 → 192.168.1.16 TCP 1484 [TCP segment of a reassembled PDU]
   32 0.052887392 192.168.1.16 → 216.58.197.35 TCP 66 45076 → 443 [ACK] Seq=214 Ack=2837 Win=34944 Len=0 TSval=4482833 TSecr=4267604278
   33 0.054440350 216.58.197.35 → 192.168.1.16 TLSv1.2 725 Certificate, Server Key Exchange, Server Hello Done
   34 0.054457555 192.168.1.16 → 216.58.197.35 TCP 66 45076 → 443 [ACK] Seq=214 Ack=3496 Win=37760 Len=0 TSval=4482833 TSecr=4267604278
   35 0.055247900 192.168.1.16 → 216.58.197.35 TLSv1.2 159 Client Key Exchange, Change Cipher Spec, Hello Request, Hello Request
   36 0.057432581 192.168.1.16 → 216.58.197.35 TLSv1.2 119 Application Data
   37 0.057643549 192.168.1.16 → 216.58.197.35 TLSv1.2 405 Application Data, Application Data, Application Data
   38 0.069583865  10.6.15.144 → 192.168.1.16 TCP 66 22 → 59298 [ACK] Seq=3205 Ack=1473 Win=1452 Len=0 TSval=5079184 TSecr=4482825
   39 0.075026980 216.58.197.35 → 192.168.1.16 TLSv1.2 135 [TCP Previous segment not captured] , Application Data
   40 0.075050358 192.168.1.16 → 216.58.197.35 TCP 78 [TCP Window Update] 45076 → 443 [ACK] Seq=699 Ack=3496 Win=40576 Len=0 TSval=4482839 TSecr=4267604278 SLE=3780 SRE=3849
   41 0.075065348 216.58.197.35 → 192.168.1.16 TCP 350 [TCP Out-Of-Order] 443 → 45076 [PSH, ACK] Seq=3496 Ack=699 Win=44800 Len=284 TSval=4267604301 TSecr=4482834
   42 0.075074715 192.168.1.16 → 216.58.197.35 TCP 66 45076 → 443 [ACK] Seq=699 Ack=3849 Win=43392 Len=0 TSval=4482839 TSecr=4267604301
   43 0.075199281 192.168.1.16 → 216.58.197.35 TLSv1.2 104 Application Data
   44 0.075670766 216.58.197.35 → 192.168.1.16 TLSv1.2 104 Application Data
   45 0.079920531  10.6.15.144 → 192.168.1.16 SSH 138 Server: Encrypted packet (len=72)
   46 0.080138059 192.168.1.16 → 10.6.15.144  SSH 102 Client: Encrypted packet (len=36)
   47 0.090023333  10.6.15.144 → 192.168.1.16 TCP 66 22 → 59298 [ACK] Seq=3277 Ack=1509 Win=1452 Len=0 TSval=5079188 TSecr=4482840
   48 0.096513881  10.6.15.144 → 192.168.1.16 SSH 102 Server: Encrypted packet (len=36)
   49 0.096851214 192.168.1.16 → 10.6.15.144  SSH 398 Client: Encrypted packet (len=332)
   50 0.098133806  10.6.15.144 → 192.168.1.16 SSH 138 Server: Encrypted packet (len=72)
   51 0.098474215 192.168.1.16 → 10.6.15.144  SSH 158 Client: Encrypted packet (len=92)
   52 0.101358358  10.6.15.144 → 192.168.1.16 SSH 102 Server: Encrypted packet (len=36)
   53 0.101368503 192.168.1.16 → 10.6.15.144  SSH 150 Client: Encrypted packet (len=84)
   54 0.101377505  10.6.15.144 → 192.168.1.16 SSH 102 Server: Encrypted packet (len=36)
   55 0.102302758 192.168.1.16 → 10.6.15.144  SSH 250 Client: Encrypted packet (len=184)
   56 0.107050642  10.6.15.144 → 192.168.1.16 SSH 318 Server: Encrypted packet (len=252)
   57 0.107398819 192.168.1.16 → 10.6.15.144  SSH 150 Client: Encrypted packet (len=84)
   58 0.107731419 192.168.1.16 → 10.6.15.144  SSH 402 Client: Encrypted packet (len=336)
   59 0.109083911 192.168.1.16 → 10.6.15.144  SSH 226 Client: Encrypted packet (len=160)
   60 0.112102331  10.6.15.144 → 192.168.1.16 TCP 66 22 → 59298 [ACK] Seq=3709 Ack=2017 Win=1452 Len=0 TSval=5079194 TSecr=4482844
   61 0.117551612  10.6.15.144 → 192.168.1.16 TCP 66 22 → 59298 [ACK] Seq=3709 Ack=2285 Win=1452 Len=0 TSval=5079195 TSecr=4482845
   62 0.118982383  10.6.15.144 → 192.168.1.16 TCP 66 22 → 59298 [ACK] Seq=3709 Ack=2781 Win=1452 Len=0 TSval=5079196 TSecr=4482847
   63 0.122734522 192.168.1.16 → 216.58.197.35 TCP 66 45076 → 443 [ACK] Seq=737 Ack=3887 Win=43392 Len=0 TSval=4482851 TSecr=4267604302
   64 0.125870542 216.58.197.35 → 192.168.1.16 TCP 66 443 → 45076 [ACK] Seq=3887 Ack=737 Win=44800 Len=0 TSval=4267604312 TSecr=4482839
   65 0.183534007  10.6.15.144 → 192.168.1.16 SSH 102 Server: Encrypted packet (len=36)
   66 0.183811457 192.168.1.16 → 10.6.15.144  SSH 138 Client: Encrypted packet (len=72)
   67 0.184888237  10.6.15.144 → 192.168.1.16 SSH 102 Server: Encrypted packet (len=36)
   68 0.185103824 192.168.1.16 → 10.6.15.144  SSH 138 Client: Encrypted packet (len=72)
   69 0.189900793  10.6.15.144 → 192.168.1.16 SSH 102 Server: Encrypted packet (len=36)
   70 0.190148853 192.168.1.16 → 10.6.15.144  SSH 138 Client: Encrypted packet (len=72)
   71 0.193870309  10.6.15.144 → 192.168.1.16 SSH 102 Server: Encrypted packet (len=36)
   72 0.195151067  10.6.15.144 → 192.168.1.16 SSH 102 Server: Encrypted packet (len=36)
   73 0.195222648 192.168.1.16 → 10.6.15.144  TCP 66 59298 → 22 [ACK] Seq=2997 Ack=3889 Win=3666 Len=0 TSval=4482869 TSecr=5079214
   74 0.200571859  10.6.15.144 → 192.168.1.16 SSH 102 Server: Encrypted packet (len=36)
   75 0.207677737  10.6.15.144 → 192.168.1.16 SSH 518 Server: Encrypted packet (len=452)
   76 0.207750211 192.168.1.16 → 10.6.15.144  TCP 66 59298 → 22 [ACK] Seq=2997 Ack=4377 Win=3666 Len=0 TSval=4482872 TSecr=5079216
   77 0.208690228 192.168.1.16 → 10.6.15.144  SSH 206 Client: Encrypted packet (len=140)
   78 0.208994813  10.6.15.144 → 192.168.1.16 SSH 230 Server: Encrypted packet (len=164)
   79 0.209975907 192.168.1.16 → 10.6.15.144  SSH 134 Client: Encrypted packet (len=68)
   80 0.217878665  10.6.15.144 → 192.168.1.16 SSH 174 Server: Encrypted packet (len=108)
   81 0.218158734 192.168.1.16 → 10.6.15.144  SSH 134 Client: Encrypted packet (len=68)
   82 0.218450149  10.6.15.144 → 192.168.1.16 SSH 174 Server: Encrypted packet (len=108)
   83 0.219620256 192.168.1.16 → 10.6.15.144  SSH 134 Client: Encrypted packet (len=68)
   84 0.227975777  10.6.15.144 → 192.168.1.16 TCP 66 22 → 59298 [ACK] Seq=4757 Ack=3273 Win=1452 Len=0 TSval=5079223 TSecr=4482872
   85 0.229144076  10.6.15.144 → 192.168.1.16 SSH 182 Server: Encrypted packet (len=116)
   86 0.229445083 192.168.1.16 → 10.6.15.144  SSH 134 Client: Encrypted packet (len=68)
   87 0.239817312  10.6.15.144 → 192.168.1.16 TCP 66 22 → 59298 [ACK] Seq=4873 Ack=3409 Win=1452 Len=0 TSval=5079226 TSecr=4482875
   88 0.263373636 216.58.197.35 → 192.168.1.16 TLSv1.2 112 [TCP Previous segment not captured] , Application Data
   89 0.263394271 192.168.1.16 → 216.58.197.35 TCP 78 [TCP Dup ACK 63#1] 45076 → 443 [ACK] Seq=737 Ack=3887 Win=43392 Len=0 TSval=4482886 TSecr=4267604312 SLE=4068 SRE=4114
   90 0.279654857 216.58.197.35 → 192.168.1.16 TCP 247 [TCP Out-Of-Order] 443 → 45076 [PSH, ACK] Seq=3887 Ack=737 Win=44800 Len=181 TSval=4267604506 TSecr=4482886
   91 0.279678565 192.168.1.16 → 216.58.197.35 TCP 66 45076 → 443 [ACK] Seq=737 Ack=4114 Win=46336 Len=0 TSval=4482890 TSecr=4267604506
   92 0.279964187 192.168.1.16 → 216.58.197.35 TLSv1.2 112 Application Data
   93 0.291049238 216.58.197.35 → 192.168.1.16 TCP 66 443 → 45076 [ACK] Seq=4114 Ack=783 Win=44800 Len=0 TSval=4267604517 TSecr=4482890
   94 0.383264092  10.6.15.144 → 192.168.1.16 SSH 222 Server: Encrypted packet (len=156)
   95 0.383566328 192.168.1.16 → 10.6.15.144  SSH 134 Client: Encrypted packet (len=68)
   96 0.390390659  10.6.15.144 → 192.168.1.16 SSH 182 Server: Encrypted packet (len=116)
   97 0.390687043 192.168.1.16 → 10.6.15.144  SSH 134 Client: Encrypted packet (len=68)
   98 0.392763057  10.6.15.144 → 192.168.1.16 SSH 1514 Server: Encrypted packet (len=1448)
   99 0.392772423  10.6.15.144 → 192.168.1.16 SSH 406 Server: Encrypted packet (len=340)
  100 0.392776293 192.168.1.16 → 10.6.15.144  TCP 66 59298 → 22 [ACK] Seq=3545 Ack=6933 Win=3666 Len=0 TSval=4482918 TSecr=5079264
  101 0.393408141 192.168.1.16 → 10.6.15.144  SSH 454 Client: Encrypted packet (len=388)
  102 0.394324104  10.6.15.144 → 192.168.1.16 SSH 174 Server: Encrypted packet (len=108)
  103 0.401005634  10.6.15.144 → 192.168.1.16 SSH 974 Server: Encrypted packet (len=908)
  104 0.401078425 192.168.1.16 → 10.6.15.144  TCP 66 59298 → 22 [ACK] Seq=3933 Ack=7949 Win=3666 Len=0 TSval=4482920 TSecr=5079265
  105 0.402044990 192.168.1.16 → 10.6.15.144  SSH 206 Client: Encrypted packet (len=140)
  106 0.402594883 192.168.1.16 → 10.6.15.144  SSH 406 Client: Encrypted packet (len=340)
  107 0.403317713 192.168.1.16 → 10.6.15.144  SSH 406 Client: Encrypted packet (len=340)
  108 0.403427764  10.6.15.144 → 192.168.1.16 SSH 166 Server: Encrypted packet (len=100)
  109 0.404058439 192.168.1.16 → 10.6.15.144  SSH 446 Client: Encrypted packet (len=380)
  110 0.404555521  10.6.15.144 → 192.168.1.16 SSH 282 Server: Encrypted packet (len=216)
  111 0.405137995 192.168.1.16 → 10.6.15.144  SSH 134 Client: Encrypted packet (len=68)
  112 0.406639287 192.168.1.16 → 10.6.15.144  SSH 438 Client: Encrypted packet (len=372)
  113 0.411347285  10.6.15.144 → 192.168.1.16 SSH 1222 Server: Encrypted packet (len=1156)
  114 0.412377696 192.168.1.16 → 10.6.15.144  SSH 206 Client: Encrypted packet (len=140)
  115 0.413164485  10.6.15.144 → 192.168.1.16 TCP 66 22 → 59298 [ACK] Seq=9421 Ack=4413 Win=1452 Len=0 TSval=5079269 TSecr=4482920
  116 0.414040414 192.168.1.16 → 10.6.15.144  SSH 206 Client: Encrypted packet (len=140)
  117 0.414123577  10.6.15.144 → 192.168.1.16 TCP 66 22 → 59298 [ACK] Seq=9421 Ack=5133 Win=1452 Len=0 TSval=5079269 TSecr=4482921
  118 0.415362803 192.168.1.16 → 10.6.15.144  SSH 406 Client: Encrypted packet (len=340)
  119 0.419633367  10.6.15.144 → 192.168.1.16 TCP 66 22 → 59298 [ACK] Seq=9421 Ack=5573 Win=1452 Len=0 TSval=5079271 TSecr=4482921
  120 0.423917928  10.6.15.144 → 192.168.1.16 TCP 66 22 → 59298 [ACK] Seq=9421 Ack=5853 Win=1452 Len=0 TSval=5079272 TSecr=4482923
  121 0.461802314  10.6.15.144 → 192.168.1.16 TCP 66 22 → 59298 [ACK] Seq=9421 Ack=6193 Win=1452 Len=0 TSval=5079282 TSecr=4482924
  122 1.553276955  10.6.15.144 → 192.168.1.16 SSH 390 Server: Encrypted packet (len=324)
  123 1.553294497  10.6.15.144 → 192.168.1.16 SSH 358 Server: Encrypted packet (len=292)
  124 1.553332866  10.6.15.144 → 192.168.1.16 SSH 358 Server: Encrypted packet (len=292)
  125 1.553354048 192.168.1.16 → 10.6.15.144  TCP 66 59298 → 22 [ACK] Seq=6193 Ack=10329 Win=3666 Len=0 TSval=4483208 TSecr=5079338
  126 1.558492125  10.6.15.144 → 192.168.1.16 SSH 334 Server: Encrypted packet (len=268)
  127 1.558705929  10.6.15.144 → 192.168.1.16 SSH 1486 Server: Encrypted packet (len=1420)
  128 1.558713949 192.168.1.16 → 10.6.15.144  TCP 66 59298 → 22 [ACK] Seq=6193 Ack=12017 Win=3666 Len=0 TSval=4483210 TSecr=5079340
  129 1.558855452  10.6.15.144 → 192.168.1.16 TCP 1242 [TCP Out-Of-Order] 22 → 59298 [PSH, ACK] Seq=9421 Ack=6193 Win=1452 Len=1176 TSval=5079440 TSecr=4482924
  130 1.558859991 192.168.1.16 → 10.6.15.144  TCP 78 [TCP Dup ACK 128#1] 59298 → 22 [ACK] Seq=6193 Ack=12017 Win=3666 Len=0 TSval=4483210 TSecr=5079340 SLE=9421 SRE=10597
  131 1.596956144  10.6.15.144 → 192.168.1.16 SSH 110 Server: Encrypted packet (len=44)
  132 1.596968642 192.168.1.16 → 10.6.15.144  TCP 66 59298 → 22 [ACK] Seq=6193 Ack=12061 Win=3666 Len=0 TSval=4483219 TSecr=5079565
  133 1.597331652 192.168.1.16 → 10.6.15.144  SSH 398 Client: Encrypted packet (len=332)
  134 1.608045274  10.6.15.144 → 192.168.1.16 TCP 66 22 → 59298 [ACK] Seq=12061 Ack=6525 Win=1452 Len=0 TSval=5079568 TSecr=4483219
  135 2.544640952  10.6.15.144 → 192.168.1.16 SSH 214 Server: Encrypted packet (len=148)
  136 2.544942711 192.168.1.16 → 10.6.15.144  SSH 134 Client: Encrypted packet (len=68)
  137 2.546158941 192.168.1.16 → 10.6.15.144  SSH 582 Client: Encrypted packet (len=516)
  138 2.554735898  10.6.15.144 → 192.168.1.16 TCP 66 22 → 59298 [ACK] Seq=12209 Ack=6593 Win=1452 Len=0 TSval=5079805 TSecr=4483456
  139 2.555917820  10.6.15.144 → 192.168.1.16 TCP 66 22 → 59298 [ACK] Seq=12209 Ack=7109 Win=1452 Len=0 TSval=5079805 TSecr=4483456
  140 3.537626446  10.6.15.144 → 192.168.1.16 SSH 1514 Server: Encrypted packet (len=1448)
  141 3.537778469  10.6.15.144 → 192.168.1.16 SSH 1514 Server: Encrypted packet (len=1448)
  142 3.537788925 192.168.1.16 → 10.6.15.144  TCP 66 59298 → 22 [ACK] Seq=7109 Ack=15105 Win=3666 Len=0 TSval=4483704 TSecr=5079960
  143 3.537804297  10.6.15.144 → 192.168.1.16 SSH 110 Server: Encrypted packet (len=44)
  144 3.538139827  10.6.15.144 → 192.168.1.16 SSH 1514 Server: Encrypted packet (len=1448)
  145 3.538143886 192.168.1.16 → 10.6.15.144  TCP 66 59298 → 22 [ACK] Seq=7109 Ack=16597 Win=3666 Len=0 TSval=4483704 TSecr=5079960
  146 3.538329756  10.6.15.144 → 192.168.1.16 SSH 1514 Server: Encrypted packet (len=1448)
  147 3.549070412  10.6.15.144 → 192.168.1.16 SSH 1514 Server: Encrypted packet (len=1448)
  148 3.549087187 192.168.1.16 → 10.6.15.144  TCP 66 59298 → 22 [ACK] Seq=7109 Ack=19493 Win=3666 Len=0 TSval=4483707 TSecr=5080020
  149 3.549249663  10.6.15.144 → 192.168.1.16 SSH 1514 Server: Encrypted packet (len=1448)
  150 3.549448976  10.6.15.144 → 192.168.1.16 SSH 1514 Server: Encrypted packet (len=1448)
  151 3.549455792 192.168.1.16 → 10.6.15.144  TCP 66 59298 → 22 [ACK] Seq=7109 Ack=22389 Win=3666 Len=0 TSval=4483707 TSecr=5080053
  152 3.560107363  10.6.15.144 → 192.168.1.16 SSH 1514 Server: Encrypted packet (len=1448)
  153 3.560256148  10.6.15.144 → 192.168.1.16 SSH 1514 Server: Encrypted packet (len=1448)
  154 3.560266059 192.168.1.16 → 10.6.15.144  TCP 66 59298 → 22 [ACK] Seq=7109 Ack=25285 Win=3666 Len=0 TSval=4483710 TSecr=5080056
  155 3.560433318  10.6.15.144 → 192.168.1.16 SSH 1514 Server: Encrypted packet (len=1448)
  156 3.560573834  10.6.15.144 → 192.168.1.16 SSH 198 Server: Encrypted packet (len=132)
  157 3.560578707 192.168.1.16 → 10.6.15.144  TCP 66 59298 → 22 [ACK] Seq=7109 Ack=26865 Win=3666 Len=0 TSval=4483710 TSecr=5080056
  158 4.528904845  10.6.15.144 → 192.168.1.16 SSH 1514 Server: Encrypted packet (len=1448)
  159 4.529225642  10.6.15.144 → 192.168.1.16 SSH 1514 Server: Encrypted packet (len=1448)
  160 4.529242341 192.168.1.16 → 10.6.15.144  TCP 66 59298 → 22 [ACK] Seq=7109 Ack=29761 Win=3666 Len=0 TSval=4483952 TSecr=5080087
  161 4.529278268  10.6.15.144 → 192.168.1.16 SSH 110 Server: Encrypted packet (len=44)
  162 4.529654426  10.6.15.144 → 192.168.1.16 SSH 1514 Server: Encrypted packet (len=1448)
  163 4.529659143 192.168.1.16 → 10.6.15.144  TCP 66 59298 → 22 [ACK] Seq=7109 Ack=31253 Win=3666 Len=0 TSval=4483952 TSecr=5080088
  164 4.529974274  10.6.15.144 → 192.168.1.16 SSH 1514 Server: Encrypted packet (len=1448)
  165 4.530296025  10.6.15.144 → 192.168.1.16 SSH 1514 Server: [TCP Previous segment not captured] , Encrypted packet (len=1448)
  166 4.530300470 192.168.1.16 → 10.6.15.144  TCP 78 59298 → 22 [ACK] Seq=7109 Ack=32701 Win=3666 Len=0 TSval=4483952 TSecr=5080088 SLE=34149 SRE=35597
  167 4.540777900  10.6.15.144 → 192.168.1.16 SSH 1514 Server: Encrypted packet (len=1448)
  168 4.540796529 192.168.1.16 → 10.6.15.144  TCP 78 [TCP Dup ACK 166#1] 59298 → 22 [ACK] Seq=7109 Ack=32701 Win=3666 Len=0 TSval=4483955 TSecr=5080088 SLE=34149 SRE=37045
  169 4.541098348  10.6.15.144 → 192.168.1.16 SSH 1514 Server: Encrypted packet (len=1448)
  170 4.541117892 192.168.1.16 → 10.6.15.144  TCP 78 [TCP Dup ACK 166#2] 59298 → 22 [ACK] Seq=7109 Ack=32701 Win=3666 Len=0 TSval=4483955 TSecr=5080088 SLE=34149 SRE=38493
  171 4.541417782  10.6.15.144 → 192.168.1.16 SSH 1514 Server: Encrypted packet (len=1448)
  172 4.541437998 192.168.1.16 → 10.6.15.144  TCP 78 [TCP Dup ACK 166#3] 59298 → 22 [ACK] Seq=7109 Ack=32701 Win=3666 Len=0 TSval=4483955 TSecr=5080088 SLE=34149 SRE=39941
  173 4.541712175  10.6.15.144 → 192.168.1.16 SSH 1514 Server: Encrypted packet (len=1448)
  174 4.541723476 192.168.1.16 → 10.6.15.144  TCP 78 [TCP Dup ACK 166#4] 59298 → 22 [ACK] Seq=7109 Ack=32701 Win=3666 Len=0 TSval=4483955 TSecr=5080088 SLE=34149 SRE=41389
  175 4.542032608  10.6.15.144 → 192.168.1.16 SSH 1514 Server: Encrypted packet (len=1448)
  176 4.542042939 192.168.1.16 → 10.6.15.144  TCP 78 [TCP Dup ACK 166#5] 59298 → 22 [ACK] Seq=7109 Ack=32701 Win=3666 Len=0 TSval=4483955 TSecr=5080088 SLE=34149 SRE=42837
  177 4.542347629  10.6.15.144 → 192.168.1.16 SSH 1514 Server: Encrypted packet (len=1448)
  178 4.542353545 192.168.1.16 → 10.6.15.144  TCP 78 [TCP Dup ACK 166#6] 59298 → 22 [ACK] Seq=7109 Ack=32701 Win=3666 Len=0 TSval=4483955 TSecr=5080088 SLE=34149 SRE=44285
  179 4.553006648  10.6.15.144 → 192.168.1.16 SSH 1514 Server: Encrypted packet (len=1448)
  180 4.553025825 192.168.1.16 → 10.6.15.144  TCP 78 [TCP Dup ACK 166#7] 59298 → 22 [ACK] Seq=7109 Ack=32701 Win=3666 Len=0 TSval=4483958 TSecr=5080088 SLE=34149 SRE=45733
  181 4.553158930  10.6.15.144 → 192.168.1.16 SSH 1514 Server: [TCP Fast Retransmission] , Encrypted packet (len=1448)
  182 4.553174246 192.168.1.16 → 10.6.15.144  TCP 66 59298 → 22 [ACK] Seq=7109 Ack=45733 Win=3658 Len=0 TSval=4483958 TSecr=5080304
  183 4.553472701  10.6.15.144 → 192.168.1.16 SSH 1514 Server: Encrypted packet (len=1448)
  184 4.553478409 192.168.1.16 → 10.6.15.144  TCP 66 59298 → 22 [ACK] Seq=7109 Ack=47181 Win=3666 Len=0 TSval=4483958 TSecr=5080304
  185 4.553488937  10.6.15.144 → 192.168.1.16 SSH 334 Server: Encrypted packet (len=268)
  186 4.553491947 192.168.1.16 → 10.6.15.144  TCP 66 59298 → 22 [ACK] Seq=7109 Ack=47449 Win=3666 Len=0 TSval=4483958 TSecr=5080304
  187 4.571184628 192.168.1.16 → 10.6.15.144  SSH 526 Client: Encrypted packet (len=460)
  188 4.573680273 192.168.1.16 → 10.6.15.144  SSH 102 Client: Encrypted packet (len=36)
  189 4.573975238 192.168.1.16 → 10.6.15.144  SSH 102 Client: Encrypted packet (len=36)
  190 4.574190119 192.168.1.16 → 10.6.15.144  SSH 138 Client: Encrypted packet (len=72)
  191 4.574778672 192.168.1.16 → 10.6.15.144  SSH 102 Client: Encrypted packet (len=36)
  192 4.577900363 192.168.1.16 → 10.6.15.144  SSH 146 Client: Encrypted packet (len=80)
  193 4.578136729 192.168.1.16 → 10.6.15.144  SSH 138 Client: Encrypted packet (len=72)
  194 4.581430501  10.6.15.144 → 192.168.1.16 TCP 66 22 → 59298 [ACK] Seq=47449 Ack=7569 Win=1452 Len=0 TSval=5080311 TSecr=4483963
  195 4.583512361  10.6.15.144 → 192.168.1.16 TCP 66 22 → 59298 [ACK] Seq=47449 Ack=7605 Win=1452 Len=0 TSval=5080312 TSecr=4483963
  196 4.583526873  10.6.15.144 → 192.168.1.16 TCP 66 22 → 59298 [ACK] Seq=47449 Ack=7641 Win=1452 Len=0 TSval=5080312 TSecr=4483963
  197 4.583685796  10.6.15.144 → 192.168.1.16 TCP 66 22 → 59298 [ACK] Seq=47449 Ack=7713 Win=1452 Len=0 TSval=5080312 TSecr=4483963
  198 4.584203224  10.6.15.144 → 192.168.1.16 TCP 66 22 → 59298 [ACK] Seq=47449 Ack=7749 Win=1452 Len=0 TSval=5080312 TSecr=4483964
  199 4.587702304  10.6.15.144 → 192.168.1.16 TCP 66 22 → 59298 [ACK] Seq=47449 Ack=7829 Win=1452 Len=0 TSval=5080313 TSecr=4483964
  200 4.587713294  10.6.15.144 → 192.168.1.16 TCP 66 22 → 59298 [ACK] Seq=47449 Ack=7901 Win=1452 Len=0 TSval=5080313 TSecr=4483964
  201 4.654881127 192.168.1.16 → 10.6.15.144  SSH 534 Client: Encrypted packet (len=468)
  202 4.663260190 192.168.1.16 → 10.6.15.144  SSH 102 Client: Encrypted packet (len=36)
  203 4.664056730 192.168.1.16 → 10.6.15.144  SSH 542 Client: Encrypted packet (len=476)
  204 4.667963932  10.6.15.144 → 192.168.1.16 TCP 66 22 → 59298 [ACK] Seq=47449 Ack=8369 Win=1452 Len=0 TSval=5080333 TSecr=4483984
  205 4.668252751 192.168.1.16 → 10.6.15.144  SSH 558 Client: Encrypted packet (len=492)
  206 4.668562984 192.168.1.16 → 10.6.15.144  SSH 534 Client: Encrypted packet (len=468)
  207 4.669320315 192.168.1.16 → 10.6.15.144  SSH 102 Client: Encrypted packet (len=36)
  208 4.669846587 192.168.1.16 → 10.6.15.144  SSH 102 Client: Encrypted packet (len=36)
  209 4.673213002  10.6.15.144 → 192.168.1.16 TCP 66 22 → 59298 [ACK] Seq=47449 Ack=8405 Win=1452 Len=0 TSval=5080334 TSecr=4483986
  210 4.674171951  10.6.15.144 → 192.168.1.16 TCP 66 22 → 59298 [ACK] Seq=47449 Ack=8881 Win=1452 Len=0 TSval=5080335 TSecr=4483986
  211 4.680027229  10.6.15.144 → 192.168.1.16 TCP 66 22 → 59298 [ACK] Seq=47449 Ack=9373 Win=1452 Len=0 TSval=5080336 TSecr=4483987
  212 4.680044410  10.6.15.144 → 192.168.1.16 TCP 66 22 → 59298 [ACK] Seq=47449 Ack=9841 Win=1452 Len=0 TSval=5080336 TSecr=4483987
  213 4.680056014  10.6.15.144 → 192.168.1.16 TCP 66 22 → 59298 [ACK] Seq=47449 Ack=9877 Win=1452 Len=0 TSval=5080336 TSecr=4483987
  214 4.680076774  10.6.15.144 → 192.168.1.16 TCP 66 22 → 59298 [ACK] Seq=47449 Ack=9913 Win=1452 Len=0 TSval=5080336 TSecr=4483987
  215 4.720817386 192.168.1.16 → 10.6.15.144  SSH 102 Client: Encrypted packet (len=36)
  216 4.731640805  10.6.15.144 → 192.168.1.16 TCP 66 22 → 59298 [ACK] Seq=47449 Ack=9949 Win=1452 Len=0 TSval=5080349 TSecr=4484000
  217 4.762447527  10.6.15.144 → 192.168.1.16 SSH 110 Server: Encrypted packet (len=44)
  218 4.762506607  10.6.15.144 → 192.168.1.16 SSH 462 Server: Encrypted packet (len=396)
  219 4.762522729 192.168.1.16 → 10.6.15.144  TCP 66 59298 → 22 [ACK] Seq=9949 Ack=47889 Win=3666 Len=0 TSval=4484010 TSecr=5080356
  220 4.762727200  10.6.15.144 → 192.168.1.16 SSH 1514 Server: Encrypted packet (len=1448)
  221 4.762736346  10.6.15.144 → 192.168.1.16 SSH 110 Server: Encrypted packet (len=44)
  222 4.762740881 192.168.1.16 → 10.6.15.144  TCP 66 59298 → 22 [ACK] Seq=9949 Ack=49381 Win=3666 Len=0 TSval=4484011 TSecr=5080356
  223 4.762752457  10.6.15.144 → 192.168.1.16 SSH 102 Server: Encrypted packet (len=36)
  224 4.763544120 192.168.1.16 → 10.6.15.144  SSH 382 Client: Encrypted packet (len=316)
  225 4.764837748 192.168.1.16 → 10.6.15.144  SSH 158 Client: Encrypted packet (len=92)
  226 4.774512974  10.6.15.144 → 192.168.1.16 SSH 282 Server: Encrypted packet (len=216)
  227 4.774645010  10.6.15.144 → 192.168.1.16 TCP 66 22 → 59298 [ACK] Seq=49633 Ack=10357 Win=1452 Len=0 TSval=5080360 TSecr=4484011
  228 4.774885408 192.168.1.16 → 10.6.15.144  SSH 150 Client: Encrypted packet (len=84)
  229 4.778938307  10.6.15.144 → 192.168.1.16 SSH 102 Server: Encrypted packet (len=36)
  230 4.779421235 192.168.1.16 → 10.6.15.144  SSH 586 Client: Encrypted packet (len=520)
  231 4.789688212  10.6.15.144 → 192.168.1.16 TCP 66 22 → 59298 [ACK] Seq=49669 Ack=10961 Win=1452 Len=0 TSval=5080363 TSecr=4484014
  232 4.852471750  10.6.15.144 → 192.168.1.16 SSH 1366 Server: Encrypted packet (len=1300)
  233 4.854654566 192.168.1.16 → 10.6.15.144  SSH 566 Client: Encrypted packet (len=500)
  234 4.855332356  10.6.15.144 → 192.168.1.16 SSH 1514 Server: Encrypted packet (len=1448)
  235 4.855519939  10.6.15.144 → 192.168.1.16 SSH 1514 Server: [TCP Previous segment not captured] , Encrypted packet (len=1448)
  236 4.855534019 192.168.1.16 → 10.6.15.144  TCP 78 59298 → 22 [ACK] Seq=11461 Ack=52417 Win=3666 Len=0 TSval=4484034 TSecr=5080380 SLE=53865 SRE=55313
  237 4.855547369  10.6.15.144 → 192.168.1.16 SSH 282 Server: Encrypted packet (len=216)
  238 4.855552796 192.168.1.16 → 10.6.15.144  TCP 78 [TCP Dup ACK 236#1] 59298 → 22 [ACK] Seq=11461 Ack=52417 Win=3666 Len=0 TSval=4484034 TSecr=5080380 SLE=53865 SRE=55529
  239 4.866131961  10.6.15.144 → 192.168.1.16 SSH 1514 Server: Encrypted packet (len=1448)
  240 4.866157104 192.168.1.16 → 10.6.15.144  TCP 78 [TCP Dup ACK 236#2] 59298 → 22 [ACK] Seq=11461 Ack=52417 Win=3666 Len=0 TSval=4484036 TSecr=5080380 SLE=53865 SRE=56977
  241 4.866314468  10.6.15.144 → 192.168.1.16 SSH 1514 Server: Encrypted packet (len=1448)
  242 4.866324510 192.168.1.16 → 10.6.15.144  TCP 78 [TCP Dup ACK 236#3] 59298 → 22 [ACK] Seq=11461 Ack=52417 Win=3666 Len=0 TSval=4484036 TSecr=5080380 SLE=53865 SRE=58425
  243 4.866655490  10.6.15.144 → 192.168.1.16 SSH 1514 Server: Encrypted packet (len=1448)
  244 4.866670844 192.168.1.16 → 10.6.15.144  TCP 78 [TCP Dup ACK 236#4] 59298 → 22 [ACK] Seq=11461 Ack=52417 Win=3666 Len=0 TSval=4484037 TSecr=5080380 SLE=53865 SRE=59873
  245 4.866850662  10.6.15.144 → 192.168.1.16 SSH 1514 Server: Encrypted packet (len=1448)
  246 4.866858978 192.168.1.16 → 10.6.15.144  TCP 78 [TCP Dup ACK 236#5] 59298 → 22 [ACK] Seq=11461 Ack=52417 Win=3666 Len=0 TSval=4484037 TSecr=5080380 SLE=53865 SRE=61321
  247 4.877392242  10.6.15.144 → 192.168.1.16 SSH 1514 Server: [TCP Fast Retransmission] , Encrypted packet (len=1448)
  248 4.877416449 192.168.1.16 → 10.6.15.144  TCP 66 59298 → 22 [ACK] Seq=11461 Ack=61321 Win=3666 Len=0 TSval=4484039 TSecr=5080385
  249 4.877432053  10.6.15.144 → 192.168.1.16 SSH 98 Server: Encrypted packet (len=32)
  250 4.877436623 192.168.1.16 → 10.6.15.144  TCP 66 59298 → 22 [ACK] Seq=11461 Ack=61353 Win=3666 Len=0 TSval=4484039 TSecr=5080385
  251 4.879235894 192.168.1.16 → 10.6.15.144  SSH 158 Client: Encrypted packet (len=92)
  252 4.879455313 192.168.1.16 → 10.6.15.144  SSH 242 Client: Encrypted packet (len=176)
  253 4.882623642 192.168.1.16 → 10.6.15.144  SSH 462 Client: Encrypted packet (len=396)
  254 4.885777567 192.168.1.16 → 10.6.15.144  SSH 558 Client: Encrypted packet (len=492)
  255 4.889403453  10.6.15.144 → 192.168.1.16 TCP 66 22 → 59298 [ACK] Seq=61353 Ack=11729 Win=1452 Len=0 TSval=5080388 TSecr=4484040
  256 4.895452732  10.6.15.144 → 192.168.1.16 TCP 66 22 → 59298 [ACK] Seq=61353 Ack=12617 Win=1452 Len=0 TSval=5080390 TSecr=4484040
  257 4.922339863  10.6.15.144 → 192.168.1.16 SSH 102 Server: Encrypted packet (len=36)
  258 4.922746238 192.168.1.16 → 10.6.15.144  SSH 150 Client: Encrypted packet (len=84)
  259 4.951191320  10.6.15.144 → 192.168.1.16 SSH 262 Server: Encrypted packet (len=196)
  260 4.951566791 192.168.1.16 → 10.6.15.144  SSH 134 Client: Encrypted packet (len=68)
  261 4.953382564 192.168.1.16 → 10.6.15.144  SSH 526 Client: Encrypted packet (len=460)
  262 4.953417488  10.6.15.144 → 192.168.1.16 SSH 182 Server: Encrypted packet (len=116)
  263 4.953793246 192.168.1.16 → 10.6.15.144  SSH 134 Client: Encrypted packet (len=68)
  264 4.955718584 192.168.1.16 → 10.6.15.144  SSH 526 Client: Encrypted packet (len=460)
  265 4.963397367  10.6.15.144 → 192.168.1.16 TCP 66 22 → 59298 [ACK] Seq=61701 Ack=13297 Win=1452 Len=0 TSval=5080407 TSecr=4484058
  266 4.968114763  10.6.15.144 → 192.168.1.16 SSH 1514 Server: Encrypted packet (len=1448)
  267 4.968295630  10.6.15.144 → 192.168.1.16 SSH 1490 Server: Encrypted packet (len=1424)
  268 4.968305355 192.168.1.16 → 10.6.15.144  TCP 66 59298 → 22 [ACK] Seq=13757 Ack=64573 Win=3666 Len=0 TSval=4484062 TSecr=5080408
  269 4.968501322  10.6.15.144 → 192.168.1.16 SSH 634 Server: Encrypted packet (len=568)
  270 4.968680173 192.168.1.16 → 10.6.15.144  SSH 134 Client: Encrypted packet (len=68)
  271 4.970666735  10.6.15.144 → 192.168.1.16 SSH 182 Server: Encrypted packet (len=116)
  272 4.970701255 192.168.1.16 → 10.6.15.144  SSH 206 Client: Encrypted packet (len=140)
  273 4.972203044 192.168.1.16 → 10.6.15.144  SSH 134 Client: Encrypted packet (len=68)
  274 4.974282620 192.168.1.16 → 10.6.15.144  SSH 206 Client: Encrypted packet (len=140)
  275 4.975452074 192.168.1.16 → 10.6.15.144  SSH 134 Client: Encrypted packet (len=68)
  276 4.976770026 192.168.1.16 → 10.6.15.144  SSH 526 Client: Encrypted packet (len=460)
  277 4.977050487 192.168.1.16 → 10.6.15.144  SSH 654 Client: Encrypted packet (len=588)
  278 4.977256229 192.168.1.16 → 10.6.15.144  SSH 1514 Client: Encrypted packet (len=1448)
  279 4.977359336 192.168.1.16 → 10.6.15.144  SSH 110 Client: Encrypted packet (len=44)
  280 4.980405889  10.6.15.144 → 192.168.1.16 TCP 66 22 → 59298 [ACK] Seq=65257 Ack=13965 Win=1452 Len=0 TSval=5080411 TSecr=4484062
  281 4.981089165  10.6.15.144 → 192.168.1.16 SSH 158 Server: Encrypted packet (len=92)
  282 4.981284743  10.6.15.144 → 192.168.1.16 SSH 462 Server: Encrypted packet (len=396)
  283 4.981314281 192.168.1.16 → 10.6.15.144  TCP 66 59298 → 22 [ACK] Seq=16781 Ack=65745 Win=3666 Len=0 TSval=4484065 TSecr=5080411
  284 4.983216535 192.168.1.16 → 10.6.15.144  SSH 206 Client: Encrypted packet (len=140)
  285 4.984111496  10.6.15.144 → 192.168.1.16 TCP 66 22 → 59298 [ACK] Seq=65745 Ack=14173 Win=1452 Len=0 TSval=5080412 TSecr=4484063
  286 4.985193438 192.168.1.16 → 10.6.15.144  SSH 654 Client: Encrypted packet (len=588)
  287 4.987491920  10.6.15.144 → 192.168.1.16 TCP 66 22 → 59298 [ACK] Seq=65745 Ack=14701 Win=1452 Len=0 TSval=5080413 TSecr=4484064
  288 4.987507462  10.6.15.144 → 192.168.1.16 TCP 66 22 → 59298 [ACK] Seq=65745 Ack=16781 Win=1452 Len=0 TSval=5080413 TSecr=4484064
  289 4.997145191  10.6.15.144 → 192.168.1.16 TCP 66 22 → 59298 [ACK] Seq=65745 Ack=17509 Win=1452 Len=0 TSval=5080415 TSecr=4484066
  290 5.017435951  10.6.15.144 → 192.168.1.16 SSH 518 Server: Encrypted packet (len=452)
  291 5.018743001 192.168.1.16 → 10.6.15.144  SSH 206 Client: Encrypted packet (len=140)
  292 5.020915789 192.168.1.16 → 10.6.15.144  SSH 654 Client: Encrypted packet (len=588)
  293 5.031193425  10.6.15.144 → 192.168.1.16 TCP 66 22 → 59298 [ACK] Seq=66197 Ack=18237 Win=1452 Len=0 TSval=5080424 TSecr=4484075
  294 5.068253759  10.6.15.144 → 192.168.1.16 SSH 518 Server: [TCP Previous segment not captured] , Encrypted packet (len=452)
  295 5.068276419 192.168.1.16 → 10.6.15.144  TCP 78 [TCP Dup ACK 291#1] 59298 → 22 [ACK] Seq=18237 Ack=66197 Win=3666 Len=0 TSval=4484087 TSecr=5080424 SLE=66969 SRE=67421
  296 5.071088913  10.6.15.144 → 192.168.1.16 SSH 238 Server: Encrypted packet (len=172)
  297 5.071107571 192.168.1.16 → 10.6.15.144  TCP 78 [TCP Dup ACK 291#2] 59298 → 22 [ACK] Seq=18237 Ack=66197 Win=3666 Len=0 TSval=4484088 TSecr=5080424 SLE=66969 SRE=67593
  298 5.073421367  10.6.15.144 → 192.168.1.16 SSH 1514 Server: Encrypted packet (len=1448)
  299 5.073438705 192.168.1.16 → 10.6.15.144  TCP 78 [TCP Dup ACK 291#3] 59298 → 22 [ACK] Seq=18237 Ack=66197 Win=3666 Len=0 TSval=4484088 TSecr=5080424 SLE=66969 SRE=69041
  300 5.078061943  10.6.15.144 → 192.168.1.16 SSH 1514 Server: Encrypted packet (len=1448)
  301 5.078081194 192.168.1.16 → 10.6.15.144  TCP 78 [TCP Dup ACK 291#4] 59298 → 22 [ACK] Seq=18237 Ack=66197 Win=3666 Len=0 TSval=4484089 TSecr=5080424 SLE=66969 SRE=70489
  302 5.081235045  10.6.15.144 → 192.168.1.16 SSH 1514 Server: Encrypted packet (len=1448)
  303 5.081256590 192.168.1.16 → 10.6.15.144  TCP 78 [TCP Dup ACK 291#5] 59298 → 22 [ACK] Seq=18237 Ack=66197 Win=3666 Len=0 TSval=4484090 TSecr=5080424 SLE=66969 SRE=71937
  304 5.083404518  10.6.15.144 → 192.168.1.16 SSH 838 Server: [TCP Fast Retransmission] , Encrypted packet (len=772)
  305 5.083429057 192.168.1.16 → 10.6.15.144  TCP 66 59298 → 22 [ACK] Seq=18237 Ack=71937 Win=3666 Len=0 TSval=4484091 TSecr=5080437
  306 5.085056367 192.168.1.16 → 10.6.15.144  SSH 206 Client: Encrypted packet (len=140)
  307 5.086442219 192.168.1.16 → 10.6.15.144  SSH 134 Client: Encrypted packet (len=68)
  308 5.088474290 192.168.1.16 → 10.6.15.144  SSH 646 Client: Encrypted packet (len=580)
  309 5.092467389  10.6.15.144 → 192.168.1.16 SSH 1514 Server: Encrypted packet (len=1448)
  310 5.094292032  10.6.15.144 → 192.168.1.16 SSH 1514 Server: Encrypted packet (len=1448)
  311 5.094306555 192.168.1.16 → 10.6.15.144  TCP 66 59298 → 22 [ACK] Seq=19025 Ack=74833 Win=3666 Len=0 TSval=4484093 TSecr=5080439
  312 5.096406142  10.6.15.144 → 192.168.1.16 TCP 66 22 → 59298 [ACK] Seq=74833 Ack=18445 Win=1452 Len=0 TSval=5080440 TSecr=4484091
  313 5.104756470  10.6.15.144 → 192.168.1.16 SSH 1514 Server: Encrypted packet (len=1448)
  314 5.104940713  10.6.15.144 → 192.168.1.16 SSH 1514 Server: Encrypted packet (len=1448)
  315 5.104954100 192.168.1.16 → 10.6.15.144  TCP 66 59298 → 22 [ACK] Seq=19025 Ack=77729 Win=3666 Len=0 TSval=4484096 TSecr=5080442
  316 5.105131214  10.6.15.144 → 192.168.1.16 SSH 1514 Server: Encrypted packet (len=1448)
  317 5.115822801  10.6.15.144 → 192.168.1.16 SSH 1514 Server: [TCP Previous segment not captured] , Encrypted packet (len=1448)
  318 5.115839076 192.168.1.16 → 10.6.15.144  TCP 78 59298 → 22 [ACK] Seq=19025 Ack=79177 Win=3666 Len=0 TSval=4484099 TSecr=5080442 SLE=80625 SRE=82073
  319 5.126386956  10.6.15.144 → 192.168.1.16 SSH 1514 Server: Encrypted packet (len=1448)
  320 5.126403886 192.168.1.16 → 10.6.15.144  TCP 78 [TCP Dup ACK 318#1] 59298 → 22 [ACK] Seq=19025 Ack=79177 Win=3666 Len=0 TSval=4484101 TSecr=5080442 SLE=80625 SRE=83521
  321 5.126579075  10.6.15.144 → 192.168.1.16 SSH 1514 Server: Encrypted packet (len=1448)
  322 5.126585136 192.168.1.16 → 10.6.15.144  TCP 78 [TCP Dup ACK 318#2] 59298 → 22 [ACK] Seq=19025 Ack=79177 Win=3666 Len=0 TSval=4484101 TSecr=5080442 SLE=80625 SRE=84969
  323 5.126760393  10.6.15.144 → 192.168.1.16 SSH 1514 Server: Encrypted packet (len=1448)
  324 5.126766677 192.168.1.16 → 10.6.15.144  TCP 78 [TCP Dup ACK 318#3] 59298 → 22 [ACK] Seq=19025 Ack=79177 Win=3666 Len=0 TSval=4484102 TSecr=5080442 SLE=80625 SRE=86417
  325 5.137223579  10.6.15.144 → 192.168.1.16 SSH 950 Server: Encrypted packet (len=884)
  326 5.137241744 192.168.1.16 → 10.6.15.144  TCP 78 [TCP Dup ACK 318#4] 59298 → 22 [ACK] Seq=19025 Ack=79177 Win=3666 Len=0 TSval=4484104 TSecr=5080442 SLE=80625 SRE=87301
  327 5.137413096  10.6.15.144 → 192.168.1.16 SSH 1514 Server: [TCP Fast Retransmission] , Encrypted packet (len=1448)
  328 5.137424413 192.168.1.16 → 10.6.15.144  TCP 66 59298 → 22 [ACK] Seq=19025 Ack=87301 Win=3666 Len=0 TSval=4484104 TSecr=5080450
  329 5.138760065 192.168.1.16 → 10.6.15.144  SSH 206 Client: Encrypted packet (len=140)
  330 5.141417299 192.168.1.16 → 10.6.15.144  SSH 134 Client: Encrypted packet (len=68)
  331 5.143022742 192.168.1.16 → 10.6.15.144  SSH 654 Client: Encrypted packet (len=588)
  332 5.147702737  10.6.15.144 → 192.168.1.16 SSH 1514 Server: Encrypted packet (len=1448)
  333 5.147883946  10.6.15.144 → 192.168.1.16 SSH 1514 Server: Encrypted packet (len=1448)
  334 5.147899365 192.168.1.16 → 10.6.15.144  TCP 66 59298 → 22 [ACK] Seq=19821 Ack=90197 Win=3666 Len=0 TSval=4484107 TSecr=5080453
  335 5.149706064 192.168.1.16 → 10.6.15.144  SSH 446 Client: Encrypted packet (len=380)
  336 5.151293257  10.6.15.144 → 192.168.1.16 TCP 66 22 → 59298 [ACK] Seq=90197 Ack=19233 Win=1452 Len=0 TSval=5080454 TSecr=4484105
  337 5.158578759  10.6.15.144 → 192.168.1.16 SSH 1514 Server: Encrypted packet (len=1448)
  338 5.158760965  10.6.15.144 → 192.168.1.16 SSH 1514 Server: Encrypted packet (len=1448)
  339 5.158770761 192.168.1.16 → 10.6.15.144  TCP 66 59298 → 22 [ACK] Seq=20201 Ack=93093 Win=3666 Len=0 TSval=4484110 TSecr=5080455
  340 5.158952944  10.6.15.144 → 192.168.1.16 SSH 1514 Server: Encrypted packet (len=1448)
  341 5.169426932  10.6.15.144 → 192.168.1.16 SSH 1514 Server: Encrypted packet (len=1448)
  342 5.169447333 192.168.1.16 → 10.6.15.144  TCP 66 59298 → 22 [ACK] Seq=20201 Ack=95989 Win=3666 Len=0 TSval=4484112 TSecr=5080455
  343 5.169607977  10.6.15.144 → 192.168.1.16 SSH 1514 Server: Encrypted packet (len=1448)
  344 5.180183381  10.6.15.144 → 192.168.1.16 SSH 1514 Server: Encrypted packet (len=1448)
  345 5.180197979 192.168.1.16 → 10.6.15.144  TCP 66 59298 → 22 [ACK] Seq=20201 Ack=98885 Win=3666 Len=0 TSval=4484115 TSecr=5080458
  346 5.180360340  10.6.15.144 → 192.168.1.16 SSH 1514 Server: Encrypted packet (len=1448)
  347 5.180553567  10.6.15.144 → 192.168.1.16 SSH 1514 Server: Encrypted packet (len=1448)
  348 5.180559820 192.168.1.16 → 10.6.15.144  TCP 66 59298 → 22 [ACK] Seq=20201 Ack=101781 Win=3666 Len=0 TSval=4484115 TSecr=5080461
  349 5.192253152  10.6.15.144 → 192.168.1.16 SSH 1514 Server: Encrypted packet (len=1448)
  350 5.192438767  10.6.15.144 → 192.168.1.16 SSH 1514 Server: Encrypted packet (len=1448)
  351 5.192449215 192.168.1.16 → 10.6.15.144  TCP 66 59298 → 22 [ACK] Seq=20201 Ack=104677 Win=3666 Len=0 TSval=4484118 TSecr=5080464
  352 5.192627607  10.6.15.144 → 192.168.1.16 SSH 1514 Server: [TCP Previous segment not captured] , Encrypted packet (len=1448)
  353 5.192636746 192.168.1.16 → 10.6.15.144  TCP 78 [TCP Dup ACK 351#1] 59298 → 22 [ACK] Seq=20201 Ack=104677 Win=3666 Len=0 TSval=4484118 TSecr=5080464 SLE=106125 SRE=107573
  354 5.197783701 192.168.1.16 → 10.6.15.144  SSH 538 Client: Encrypted packet (len=460)
  355 5.203249313  10.6.15.144 → 192.168.1.16 SSH 1514 Server: Encrypted packet (len=1448)
  356 5.203269510 192.168.1.16 → 10.6.15.144  TCP 78 [TCP Dup ACK 351#2] 59298 → 22 [ACK] Seq=20661 Ack=104677 Win=3666 Len=0 TSval=4484121 TSecr=5080464 SLE=106125 SRE=109021
  357 5.203434201  10.6.15.144 → 192.168.1.16 SSH 1514 Server: Encrypted packet (len=1448)
  358 5.203441486 192.168.1.16 → 10.6.15.144  TCP 78 [TCP Dup ACK 351#3] 59298 → 22 [ACK] Seq=20661 Ack=104677 Win=3666 Len=0 TSval=4484121 TSecr=5080464 SLE=106125 SRE=110469
  359 5.203625787  10.6.15.144 → 192.168.1.16 SSH 1514 Server: Encrypted packet (len=1448)
  360 5.203633387 192.168.1.16 → 10.6.15.144  TCP 78 [TCP Dup ACK 351#4] 59298 → 22 [ACK] Seq=20661 Ack=104677 Win=3666 Len=0 TSval=4484121 TSecr=5080464 SLE=106125 SRE=111917
  361 5.213968082  10.6.15.144 → 192.168.1.16 SSH 1514 Server: Encrypted packet (len=1448)
  362 5.213985152 192.168.1.16 → 10.6.15.144  TCP 78 [TCP Dup ACK 351#5] 59298 → 22 [ACK] Seq=20661 Ack=104677 Win=3666 Len=0 TSval=4484123 TSecr=5080464 SLE=106125 SRE=113365
  363 5.214152408  10.6.15.144 → 192.168.1.16 SSH 1514 Server: [TCP Fast Retransmission] , Encrypted packet (len=1448)
