    1 0.000000000  10.6.15.144 → 192.168.1.16 SSH 182 Server: Encrypted packet (len=116)
    2 0.000325397 192.168.1.16 → 10.6.15.144  SSH 134 Client: Encrypted packet (len=68)
    3 0.002286336  10.6.15.144 → 192.168.1.16 SSH 1514 Server: Encrypted packet (len=1448)
    4 0.002570527  10.6.15.144 → 192.168.1.16 SSH 1514 Server: Encrypted packet (len=1448)
    5 0.002587893 192.168.1.16 → 10.6.15.144  TCP 66 59298 → 22 [ACK] Seq=69 Ack=3013 Win=3666 Len=0 TSval=4498141 TSecr=5094487
    6 0.011131188  10.6.15.144 → 192.168.1.16 SSH 1514 Server: Encrypted packet (len=1448)
    7 0.013290563  10.6.15.144 → 192.168.1.16 SSH 1514 Server: Encrypted packet (len=1448)
    8 0.013307654 192.168.1.16 → 10.6.15.144  TCP 66 59298 → 22 [ACK] Seq=69 Ack=5909 Win=3666 Len=0 TSval=4498144 TSecr=5094489
    9 0.013427896  10.6.15.144 → 192.168.1.16 SSH 1514 Server: Encrypted packet (len=1448)
   10 0.024943160  10.6.15.144 → 192.168.1.16 SSH 1514 Server: [TCP Previous segment not captured] , Encrypted packet (len=1448)
   11 0.024961640 192.168.1.16 → 10.6.15.144  TCP 78 59298 → 22 [ACK] Seq=69 Ack=7357 Win=3666 Len=0 TSval=4498147 TSecr=5094490 SLE=8805 SRE=10253
   12 0.025131846  10.6.15.144 → 192.168.1.16 SSH 1514 Server: Encrypted packet (len=1448)
   13 0.025138865 192.168.1.16 → 10.6.15.144  TCP 78 [TCP Dup ACK 11#1] 59298 → 22 [ACK] Seq=69 Ack=7357 Win=3666 Len=0 TSval=4498147 TSecr=5094490 SLE=8805 SRE=11701
   14 0.035721881  10.6.15.144 → 192.168.1.16 SSH 1514 Server: Encrypted packet (len=1448)
   15 0.035744468 192.168.1.16 → 10.6.15.144  TCP 78 [TCP Dup ACK 11#2] 59298 → 22 [ACK] Seq=69 Ack=7357 Win=3666 Len=0 TSval=4498149 TSecr=5094490 SLE=8805 SRE=13149
   16 0.035760928  10.6.15.144 → 192.168.1.16 SSH 154 Server: [TCP Previous segment not captured] , Encrypted packet (len=88)
   17 0.035765346 192.168.1.16 → 10.6.15.144  TCP 86 [TCP Dup ACK 11#3] 59298 → 22 [ACK] Seq=69 Ack=7357 Win=3666 Len=0 TSval=4498149 TSecr=5094490 SLE=14597 SRE=14685 SLE=8805 SRE=13149
   18 0.046309670  10.6.15.144 → 192.168.1.16 SSH 1514 Server: [TCP Fast Retransmission] , Encrypted packet (len=1448)
   19 0.046338869 192.168.1.16 → 10.6.15.144  TCP 78 59298 → 22 [ACK] Seq=69 Ack=13149 Win=3666 Len=0 TSval=4498152 TSecr=5094498 SLE=14597 SRE=14685
   20 0.056384601  10.6.15.144 → 192.168.1.16 SSH 170 Server: Encrypted packet (len=104)
   21 0.056404766 192.168.1.16 → 10.6.15.144  TCP 78 [TCP Dup ACK 19#1] 59298 → 22 [ACK] Seq=69 Ack=13149 Win=3666 Len=0 TSval=4498155 TSecr=5094498 SLE=14597 SRE=14789
   22 0.059981228 10.22.18.108 → 224.0.0.252  LLMNR 64 Standard query 0x2ddf A wpad
   23 0.068725813  10.6.15.144 → 192.168.1.16 TCP 1514 [TCP Retransmission] 22 → 59298 [ACK] Seq=13149 Ack=69 Win=1452 Len=1448 TSval=5094504 TSecr=4498155
   24 0.068755320 192.168.1.16 → 10.6.15.144  TCP 66 59298 → 22 [ACK] Seq=69 Ack=14789 Win=3666 Len=0 TSval=4498158 TSecr=5094504
   25 1.404107085 192.168.1.16 → 10.6.15.144  SSH 1514 Client: Encrypted packet (len=1448)
   26 1.568041750 192.168.1.16 → 10.6.15.144  SSH 582 Client: Encrypted packet (len=516)
   27 1.810316009  10.6.15.144 → 192.168.1.16 SSH 1514 Server: Encrypted packet (len=1448)
   28 1.810470636  10.6.15.144 → 192.168.1.16 SSH 1514 Server: Encrypted packet (len=1448)
   29 1.810673172  10.6.15.144 → 192.168.1.16 SSH 1514 Server: Encrypted packet (len=1448)
   30 1.811008564  10.6.15.144 → 192.168.1.16 TCP 1514 [TCP Out-Of-Order] 22 → 59298 [ACK] Seq=14789 Ack=69 Win=1452 Len=1448 TSval=5094673 TSecr=4498158
   31 1.811199352  10.6.15.144 → 192.168.1.16 TCP 1514 [TCP Out-Of-Order] 22 → 59298 [ACK] Seq=14789 Ack=69 Win=1452 Len=1448 TSval=5094781 TSecr=4498158
   32 1.811375439  192.168.1.1 → 224.0.0.1    IGMPv2 42 Membership Query, general
   33 1.820340699  10.6.15.144 → 192.168.1.16 TCP 66 22 → 59298 [ACK] Seq=19133 Ack=2033 Win=1452 Len=0 TSval=5094942 TSecr=4498476
   34 1.916122905 192.168.1.16 → 10.6.15.144  SSH 1514 Client: [TCP Spurious Retransmission] , Encrypted packet (len=1448)
   35 1.916142026 192.168.1.16 → 10.6.15.144  TCP 66 59298 → 22 [ACK] Seq=2033 Ack=16237 Win=3666 Len=0 TSval=4498593 TSecr=5094611
   36 1.916146157 192.168.1.16 → 10.6.15.144  TCP 66 59298 → 22 [ACK] Seq=2033 Ack=17685 Win=3666 Len=0 TSval=4498593 TSecr=5094611
   37 1.916149015 192.168.1.16 → 10.6.15.144  TCP 66 59298 → 22 [ACK] Seq=2033 Ack=19133 Win=3666 Len=0 TSval=4498593 TSecr=5094619
   38 1.916152994 192.168.1.16 → 10.6.15.144  TCP 78 [TCP Dup ACK 37#1] 59298 → 22 [ACK] Seq=2033 Ack=19133 Win=3666 Len=0 TSval=4498593 TSecr=5094619 SLE=14789 SRE=16237
   39 1.916156134 192.168.1.16 → 10.6.15.144  TCP 78 [TCP Dup ACK 37#2] 59298 → 22 [ACK] Seq=2033 Ack=19133 Win=3666 Len=0 TSval=4498593 TSecr=5094619 SLE=14789 SRE=16237
   40 2.436065976  10.6.15.144 → 192.168.1.16 TCP 78 [TCP Dup ACK 33#1] 22 → 59298 [ACK] Seq=19133 Ack=2033 Win=1452 Len=0 TSval=5095070 TSecr=4498476 SLE=69 SRE=1517
   41 2.436083885  10.6.15.144 → 192.168.1.16 SSH 1514 Server: Encrypted packet (len=1448)
   42 2.436108722 192.168.1.16 → 10.6.15.144  TCP 66 59298 → 22 [ACK] Seq=2033 Ack=20581 Win=3666 Len=0 TSval=4498750 TSecr=5095070
   43 2.436127772  10.6.15.144 → 192.168.1.16 SSH 1514 Server: Encrypted packet (len=1448)
   44 2.436136872 192.168.1.16 → 10.6.15.144  TCP 66 59298 → 22 [ACK] Seq=2033 Ack=22029 Win=3666 Len=0 TSval=4498750 TSecr=5095070
   45 2.436140543  10.6.15.144 → 192.168.1.16 SSH 1514 Server: Encrypted packet (len=1448)
   46 2.436143821 192.168.1.16 → 10.6.15.144  TCP 66 59298 → 22 [ACK] Seq=2033 Ack=23477 Win=3666 Len=0 TSval=4498750 TSecr=5095070
   47 2.436348131 192.168.1.16 → 10.6.15.144  SSH 102 Client: Encrypted packet (len=36)
   48 2.843487046  10.6.15.144 → 192.168.1.16 SSH 1514 Server: Encrypted packet (len=1448)
   49 2.843701641  10.6.15.144 → 192.168.1.16 SSH 1514 Server: [TCP Previous segment not captured] , Encrypted packet (len=1448)
   50 2.843814201  10.6.15.144 → 192.168.1.16 TCP 66 [TCP Previous segment not captured] 22 → 59298 [ACK] Seq=29269 Ack=2069 Win=1452 Len=0 TSval=5095198 TSecr=4498750
   51 2.944115485 192.168.1.16 → 10.6.15.144  TCP 78 59298 → 22 [ACK] Seq=2069 Ack=24925 Win=3666 Len=0 TSval=4498851 TSecr=5095198 SLE=26373 SRE=27821
   52 3.359412910  10.6.15.144 → 192.168.1.16 SSH 1514 Server: Encrypted packet (len=1448)
   53 3.359591864  10.6.15.144 → 192.168.1.16 SSH 1514 Server: Encrypted packet (len=1448)
   54 3.359760199  10.6.15.144 → 192.168.1.16 SSH 1514 Server: Encrypted packet (len=1448)
   55 3.456113235 192.168.1.16 → 224.0.0.252  IGMPv2 46 Membership Report group 224.0.0.252
   56 3.456128881 192.168.1.16 → 10.6.15.144  TCP 86 [TCP Dup ACK 51#1] 59298 → 22 [ACK] Seq=2069 Ack=24925 Win=3666 Len=0 TSval=4498980 TSecr=5095198 SLE=29269 SRE=30717 SLE=26373 SRE=27821
   57 3.456132132 192.168.1.16 → 10.6.15.144  TCP 86 [TCP Dup ACK 51#2] 59298 → 22 [ACK] Seq=2069 Ack=24925 Win=3666 Len=0 TSval=4498980 TSecr=5095198 SLE=29269 SRE=32165 SLE=26373 SRE=27821
   58 3.456133957 192.168.1.16 → 10.6.15.144  TCP 86 [TCP Dup ACK 51#3] 59298 → 22 [ACK] Seq=2069 Ack=24925 Win=3666 Len=0 TSval=4498980 TSecr=5095198 SLE=29269 SRE=33613 SLE=26373 SRE=27821
   59 4.073426159  10.6.15.144 → 192.168.1.16 TCP 1514 [TCP Retransmission] 22 → 59298 [ACK] Seq=24925 Ack=2069 Win=1452 Len=1448 TSval=5095505 TSecr=4498980
   60 4.073549504  10.6.15.144 → 192.168.1.16 TCP 1514 [TCP Retransmission] 22 → 59298 [ACK] Seq=27821 Ack=2069 Win=1452 Len=1448 TSval=5095505 TSecr=4498980
   61 4.073735146  10.6.15.144 → 192.168.1.16 SSH 1514 Server: Encrypted packet (len=1448)
   62 4.172101998 192.168.1.16 → 10.6.15.144  TCP 78 59298 → 22 [ACK] Seq=2069 Ack=27821 Win=3666 Len=0 TSval=4499159 TSecr=5095505 SLE=29269 SRE=33613
   63 4.172120311 192.168.1.16 → 10.6.15.144  TCP 66 59298 → 22 [ACK] Seq=2069 Ack=33613 Win=3666 Len=0 TSval=4499159 TSecr=5095505
   64 4.172123680 192.168.1.16 → 10.6.15.144  TCP 66 59298 → 22 [ACK] Seq=2069 Ack=35061 Win=3666 Len=0 TSval=4499159 TSecr=5095505
   65 4.591378845  10.6.15.144 → 192.168.1.16 SSH 1514 Server: Encrypted packet (len=1448)
   66 4.591408751  10.6.15.144 → 192.168.1.16 SSH 866 Server: Encrypted packet (len=800)
   67 4.692098666 192.168.1.16 → 10.6.15.144  TCP 66 59298 → 22 [ACK] Seq=2069 Ack=36509 Win=3666 Len=0 TSval=4499288 TSecr=5095635
   68 4.692117114 192.168.1.16 → 10.6.15.144  TCP 66 59298 → 22 [ACK] Seq=2069 Ack=37309 Win=3666 Len=0 TSval=4499288 TSecr=5095635
   69 4.692119666 192.168.1.16 → 10.6.15.144  SSH 134 Client: Encrypted packet (len=68)
   70 4.692122872 192.168.1.16 → 10.6.15.144  SSH 1514 Client: Encrypted packet (len=1448)
   71 5.107106439  10.6.15.144 → 192.168.1.16 TCP 66 22 → 59298 [ACK] Seq=37309 Ack=2137 Win=1452 Len=0 TSval=5095764 TSecr=4499289
   72 5.108994887  10.6.15.144 → 192.168.1.16 SSH 174 Server: Encrypted packet (len=108)
   73 5.204103685 192.168.1.16 → 10.6.15.144  SSH 1514 Client: Encrypted packet (len=1448)
   74 5.204120935 192.168.1.16 → 10.6.15.144  SSH 1334 Client: Encrypted packet (len=1268)
   75 5.204123901 192.168.1.16 → 10.6.15.144  TCP 66 59298 → 22 [ACK] Seq=6301 Ack=37417 Win=3666 Len=0 TSval=4499429 TSecr=5095764
   76 5.724013416  10.6.15.144 → 192.168.1.16 TCP 66 [TCP Previous segment not captured] 22 → 59298 [ACK] Seq=37805 Ack=6301 Win=1452 Len=0 TSval=5095892 TSecr=4499415
   77 7.352015022  10.6.15.144 → 192.168.1.16 SSH 1514 Server: [TCP Previous segment not captured] , Encrypted packet (len=1448)
   78 7.368088905 192.168.1.16 → 10.6.15.144  TCP 78 [TCP Dup ACK 75#1] 59298 → 22 [ACK] Seq=6301 Ack=37417 Win=3666 Len=0 TSval=4499979 TSecr=5095764 SLE=38945 SRE=40393
   79 7.380113783  10.6.15.144 → 192.168.1.16 TCP 1030 [TCP Retransmission] 22 → 59298 [PSH, ACK] Seq=37417 Ack=6301 Win=1452 Len=964 TSval=5096332 TSecr=4499979
   80 7.380142488 192.168.1.16 → 10.6.15.144  TCP 78 59298 → 22 [ACK] Seq=6301 Ack=38381 Win=3666 Len=0 TSval=4499986 TSecr=5096332 SLE=38945 SRE=40393
   81 7.381024082 192.168.1.16 → 10.6.15.144  SSH 170 Client: Encrypted packet (len=92)
   82 7.430182895  10.6.15.144 → 192.168.1.16 TCP 66 [TCP Previous segment not captured] 22 → 59298 [ACK] Seq=41841 Ack=6393 Win=1452 Len=0 TSval=5096345 TSecr=4499986
   83 9.274078561  10.6.15.144 → 192.168.1.16 TCP 630 [TCP Retransmission] 22 → 59298 [PSH, ACK] Seq=38381 Ack=6393 Win=1452 Len=564 TSval=5096806 TSecr=4499986
   84 9.274108343 192.168.1.16 → 10.6.15.144  TCP 66 59298 → 22 [ACK] Seq=6393 Ack=40393 Win=3666 Len=0 TSval=4500459 TSecr=5096806
   85 9.284581527  10.6.15.144 → 192.168.1.16 TCP 1514 [TCP Retransmission] 22 → 59298 [ACK] Seq=40393 Ack=6393 Win=1452 Len=1448 TSval=5096808 TSecr=4500459
   86 9.284602351 192.168.1.16 → 10.6.15.144  TCP 66 59298 → 22 [ACK] Seq=6393 Ack=41841 Win=3666 Len=0 TSval=4500462 TSecr=5096808
   87 9.284892950  10.6.15.144 → 192.168.1.16 SSH 1514 Server: Encrypted packet (len=1448)
   88 9.284899691 192.168.1.16 → 10.6.15.144  TCP 66 59298 → 22 [ACK] Seq=6393 Ack=43289 Win=3666 Len=0 TSval=4500462 TSecr=5096808
   89 9.285202482  10.6.15.144 → 192.168.1.16 SSH 1426 Server: Encrypted packet (len=1360)
   90 9.285209435 192.168.1.16 → 10.6.15.144  TCP 66 59298 → 22 [ACK] Seq=6393 Ack=44649 Win=3666 Len=0 TSval=4500462 TSecr=5096808
   91 9.285822633 192.168.1.16 → 10.6.15.144  SSH 138 Client: Encrypted packet (len=72)
   92 9.295632805  10.6.15.144 → 192.168.1.16 TCP 66 22 → 59298 [ACK] Seq=44649 Ack=6465 Win=1452 Len=0 TSval=5096811 TSecr=4500462
   93 9.295764807  10.6.15.144 → 192.168.1.16 SSH 102 Server: Encrypted packet (len=36)
   94 9.336042110 192.168.1.16 → 10.6.15.144  TCP 66 59298 → 22 [ACK] Seq=6465 Ack=44685 Win=3666 Len=0 TSval=4500475 TSecr=5096811
   95 9.356048616 192.168.1.16 → 172.217.24.106 TCP 66 60650 → 443 [ACK] Seq=1 Ack=1 Win=262 Len=0 TSval=4500480 TSecr=2503058879
   96 9.399504251 172.217.24.106 → 192.168.1.16 TCP 66 [TCP ACKed unseen segment] 443 → 60650 [ACK] Seq=1 Ack=2 Win=181 Len=0 TSval=2503103935 TSecr=4477589
   97 9.946083921 192.168.1.16 → 13.126.27.131 NTP 90 NTP Version 4, client
   98 9.967985078 10.119.73.122 → 192.168.1.16 ICMP 110 Destination unreachable (Communication administratively filtered)
   99 10.596337848 192.168.1.16 → 10.6.15.144  SSH 102 Client: Encrypted packet (len=36)
  100 10.597644965 192.168.1.16 → 10.6.15.144  SSH 282 Client: Encrypted packet (len=216)
  101 10.597861607 192.168.1.16 → 10.6.15.144  SSH 174 Client: Encrypted packet (len=108)
  102 10.598323613  10.6.15.144 → 192.168.1.16 SSH 126 Server: Encrypted packet (len=60)
  103 10.598339695 192.168.1.16 → 10.6.15.144  SSH 282 Client: Encrypted packet (len=216)
  104 10.598460589  10.6.15.144 → 192.168.1.16 SSH 102 Server: Encrypted packet (len=36)
  105 10.598941887 192.168.1.16 → 10.6.15.144  SSH 142 Client: Encrypted packet (len=76)
  106 10.608595471  10.6.15.144 → 192.168.1.16 TCP 66 22 → 59298 [ACK] Seq=44781 Ack=6825 Win=1452 Len=0 TSval=5097139 TSecr=4500790
  107 10.608718836  10.6.15.144 → 192.168.1.16 TCP 66 22 → 59298 [ACK] Seq=44781 Ack=7117 Win=1452 Len=0 TSval=5097139 TSecr=4500790
  108 10.636024034 192.168.1.16 → 224.0.0.251  IGMPv2 46 Membership Report group 224.0.0.251
  109 12.241513077  10.6.15.144 → 192.168.1.16 SSH 102 Server: Encrypted packet (len=36)
  110 12.241547632  10.6.15.144 → 192.168.1.16 SSH 126 Server: Encrypted packet (len=60)
  111 12.241559394  10.6.15.144 → 192.168.1.16 SSH 210 Server: Encrypted packet (len=144)
  112 12.241633205 192.168.1.16 → 10.6.15.144  TCP 66 59298 → 22 [ACK] Seq=7117 Ack=45021 Win=3666 Len=0 TSval=4501201 TSecr=5097182
  113 12.242032044 192.168.1.16 → 10.6.15.144  SSH 138 Client: Encrypted packet (len=72)
  114 12.242293847  10.6.15.144 → 192.168.1.16 SSH 1514 Server: Encrypted packet (len=1448)
  115 12.242305540 10.22.18.108 → 224.0.0.252  LLMNR 64 Standard query 0xf7ca A wpad
  116 12.242324767 10.22.18.108 → 224.0.0.252  LLMNR 64 Standard query 0xf7ca A wpad
  117 12.243217844 192.168.1.16 → 10.6.15.144  SSH 310 Client: Encrypted packet (len=244)
  118 12.244079381 192.168.1.16 → 10.6.15.144  SSH 318 Client: Encrypted packet (len=252)
  119 12.253198941  10.6.15.144 → 192.168.1.16 SSH 306 Server: Encrypted packet (len=240)
  120 12.253484763  10.6.15.144 → 192.168.1.16 TCP 66 22 → 59298 [ACK] Seq=46709 Ack=7433 Win=1452 Len=0 TSval=5097550 TSecr=4501201
  121 12.253532624 192.168.1.16 → 10.6.15.144  SSH 174 Client: Encrypted packet (len=108)
  122 12.263572737  10.6.15.144 → 192.168.1.16 TCP 66 22 → 59298 [ACK] Seq=46709 Ack=7793 Win=1452 Len=0 TSval=5097553 TSecr=4501202
  123 13.262237931  10.6.15.144 → 192.168.1.16 SSH 1514 Server: Encrypted packet (len=1448)
  124 13.262289396  10.6.15.144 → 192.168.1.16 SSH 926 Server: Encrypted packet (len=860)
  125 13.262299188 192.168.1.16 → 10.6.15.144  TCP 66 59298 → 22 [ACK] Seq=7793 Ack=49017 Win=3666 Len=0 TSval=4501456 TSecr=5097589
  126 13.262548510  10.6.15.144 → 192.168.1.16 SSH 1514 Server: Encrypted packet (len=1448)
  127 13.275770337  10.6.15.144 → 192.168.1.16 SSH 306 Server: [TCP Previous segment not captured] , Encrypted packet (len=240)
  128 13.275789819 192.168.1.16 → 10.6.15.144  TCP 78 59298 → 22 [ACK] Seq=7793 Ack=50465 Win=3666 Len=0 TSval=4501459 TSecr=5097589 SLE=51913 SRE=52153
  129 14.348973509 192.168.1.16 → 54.76.71.168 TCP 128 42414 → 8282 [PSH, ACK] Seq=1 Ack=1 Win=296 Len=62 TSval=4501728 TSecr=608606202
  130 15.246068500 54.76.71.168 → 192.168.1.16 TCP 66 8282 → 42414 [ACK] Seq=1 Ack=63 Win=121 Len=0 TSval=608613704 TSecr=4501728
  131 16.270780911  10.6.15.144 → 192.168.1.16 TCP 1514 [TCP Retransmission] 22 → 59298 [ACK] Seq=50465 Ack=7793 Win=1452 Len=1448 TSval=5098370 TSecr=4501459
  132 16.270809148 192.168.1.16 → 10.6.15.144  TCP 66 59298 → 22 [ACK] Seq=7793 Ack=52153 Win=3666 Len=0 TSval=4502208 TSecr=5098370
  133 16.270824102 10.22.16.104 → 224.0.0.252  LLMNR 64 Standard query 0x90aa A wpad
  134 16.272731197 192.168.1.16 → 10.6.15.144  SSH 214 Client: Encrypted packet (len=148)
  135 16.322064575  10.6.15.144 → 192.168.1.16 TCP 66 22 → 59298 [ACK] Seq=52153 Ack=7941 Win=1452 Len=0 TSval=5098568 TSecr=4502209
  136 16.423488527  10.6.15.144 → 192.168.1.16 SSH 382 Server: Encrypted packet (len=316)
  137 16.436620228 192.168.1.16 → 192.168.1.1  DNS 77 Standard query 0xcf95 A ocsp.comodoca.com
  138 16.446891794  192.168.1.1 → 192.168.1.16 DNS 93 Standard query response 0xcf95 A ocsp.comodoca.com A 178.255.83.1
  139 16.447498493 192.168.1.16 → 178.255.83.1 TCP 74 35214 → 80 [SYN] Seq=0 Win=29200 Len=0 MSS=1460 SACK_PERM=1 TSval=4502252 TSecr=0 WS=128
  140 16.457187124 178.255.83.1 → 192.168.1.16 TCP 74 80 → 35214 [SYN, ACK] Seq=0 Ack=1 Win=14480 Len=0 MSS=1460 SACK_PERM=1 TSval=1019718820 TSecr=4502252 WS=512
  141 16.457226491 192.168.1.16 → 178.255.83.1 TCP 66 35214 → 80 [ACK] Seq=1 Ack=1 Win=29312 Len=0 TSval=4502255 TSecr=1019718820
  142 16.457407050 192.168.1.16 → 178.255.83.1 HTTP 447 GET /MHIwcDBOMEwwSjAJBgUrDgMCGgUABBT0MXB3rveIElndnl0j8v4md2bQRgQUOdr%2FyigUiqh0Ewi55A6p0vp%2BnWkCEQCc%2FEFPFPMmH0T4XM1RpOGHoh4wHDAaBgkrBgEFBQcwAQQEDTALBgkrBgEFBQcwAQE%3D HTTP/1.1 
  143 16.464095398 192.168.1.16 → 10.6.15.144  TCP 66 59298 → 22 [ACK] Seq=7941 Ack=52469 Win=3666 Len=0 TSval=4502257 TSecr=5098593
  144 16.467551165 178.255.83.1 → 192.168.1.16 TCP 66 80 → 35214 [ACK] Seq=1 Ack=382 Win=15872 Len=0 TSval=1019718821 TSecr=4502255
  145 17.262655448 10.22.16.104 → 224.0.0.252  LLMNR 64 Standard query 0x90aa A wpad
  146 17.262748596 178.255.83.1 → 192.168.1.16 OCSP 926 Response
  147 17.262783617 192.168.1.16 → 178.255.83.1 TCP 66 35214 → 80 [ACK] Seq=382 Ack=861 Win=30976 Len=0 TSval=4502456 TSecr=1019718851
  148 17.262809237 178.255.83.1 → 192.168.1.16 TCP 66 80 → 35214 [FIN, ACK] Seq=861 Ack=382 Win=15872 Len=0 TSval=1019718851 TSecr=4502255
  149 17.263342682 192.168.1.16 → 178.255.83.1 TCP 66 35214 → 80 [FIN, ACK] Seq=382 Ack=862 Win=30976 Len=0 TSval=4502456 TSecr=1019718851
  150 17.269840532 192.168.1.16 → 10.6.15.144  SSH 630 Client: Encrypted packet (len=564)
  151 17.272907653 178.255.83.1 → 192.168.1.16 TCP 66 80 → 35214 [ACK] Seq=862 Ack=383 Win=15872 Len=0 TSval=1019718902 TSecr=4502456
  152 17.280549124  10.6.15.144 → 192.168.1.16 TCP 66 22 → 59298 [ACK] Seq=52469 Ack=8505 Win=1452 Len=0 TSval=5098807 TSecr=4502458
  153 18.286276544  10.6.15.144 → 192.168.1.16 SSH 1514 Server: Encrypted packet (len=1448)
  154 18.286311538 192.168.1.16 → 10.6.15.144  TCP 66 59298 → 22 [ACK] Seq=8505 Ack=53917 Win=3666 Len=0 TSval=4502712 TSecr=5098842
  155 18.286387109  10.6.15.144 → 192.168.1.16 SSH 1514 Server: Encrypted packet (len=1448)
  156 18.286391028 192.168.1.16 → 10.6.15.144  TCP 66 59298 → 22 [ACK] Seq=8505 Ack=55365 Win=3666 Len=0 TSval=4502712 TSecr=5098842
  157 18.286396793  10.6.15.144 → 192.168.1.16 SSH 110 Server: Encrypted packet (len=44)
  158 18.286400782 192.168.1.16 → 10.6.15.144  TCP 66 59298 → 22 [ACK] Seq=8505 Ack=55409 Win=3666 Len=0 TSval=4502712 TSecr=5098842
  159 18.297113513  10.6.15.144 → 192.168.1.16 SSH 1514 Server: Encrypted packet (len=1448)
  160 18.297133112 192.168.1.16 → 10.6.15.144  TCP 66 59298 → 22 [ACK] Seq=8505 Ack=56857 Win=3666 Len=0 TSval=4502715 TSecr=5099061
  161 18.297258080  10.6.15.144 → 192.168.1.16 SSH 1466 Server: Encrypted packet (len=1400)
  162 18.297263826 192.168.1.16 → 10.6.15.144  TCP 66 59298 → 22 [ACK] Seq=8505 Ack=58257 Win=3666 Len=0 TSval=4502715 TSecr=5099061
  163 18.298197815 192.168.1.16 → 10.6.15.144  SSH 138 Client: Encrypted packet (len=72)
  164 18.308140210  10.6.15.144 → 192.168.1.16 TCP 66 22 → 59298 [ACK] Seq=58257 Ack=8577 Win=1452 Len=0 TSval=5099064 TSecr=4502715
  165 18.308159826  10.6.15.144 → 192.168.1.16 SSH 102 Server: Encrypted packet (len=36)
  166 18.352019083 192.168.1.16 → 10.6.15.144  TCP 66 59298 → 22 [ACK] Seq=8577 Ack=58293 Win=3666 Len=0 TSval=4502729 TSecr=5099064
  167 19.312633151  192.168.1.1 → 239.255.255.250 SSDP 302 NOTIFY * HTTP/1.1 
  168 19.315735004  192.168.1.1 → 239.255.255.250 SSDP 311 NOTIFY * HTTP/1.1 
  169 19.324314797  192.168.1.1 → 239.255.255.250 SSDP 374 NOTIFY * HTTP/1.1 
  170 19.327854744  192.168.1.1 → 239.255.255.250 SSDP 370 NOTIFY * HTTP/1.1 
  171 19.330916521  192.168.1.1 → 239.255.255.250 SSDP 350 NOTIFY * HTTP/1.1 
  172 19.334441899  192.168.1.1 → 239.255.255.250 SSDP 382 NOTIFY * HTTP/1.1 
  173 19.337805757  192.168.1.1 → 239.255.255.250 SSDP 364 NOTIFY * HTTP/1.1 
  174 19.341133715  192.168.1.1 → 239.255.255.250 SSDP 366 NOTIFY * HTTP/1.1 
  175 19.344145904  192.168.1.1 → 239.255.255.250 SSDP 302 NOTIFY * HTTP/1.1 
  176 19.347135556  192.168.1.1 → 239.255.255.250 SSDP 311 NOTIFY * HTTP/1.1 
  177 19.350546494  192.168.1.1 → 239.255.255.250 SSDP 374 NOTIFY * HTTP/1.1 
  178 19.918255218 192.168.1.16 → 10.6.15.144  SSH 138 Client: Encrypted packet (len=72)
  179 19.923298357 192.168.1.16 → 10.6.15.144  SSH 878 Client: Encrypted packet (len=812)
  180 19.932439271  10.6.15.144 → 192.168.1.16 SSH 102 Server: Encrypted packet (len=36)
  181 19.932464914 192.168.1.16 → 10.6.15.144  TCP 66 59298 → 22 [ACK] Seq=9461 Ack=58329 Win=3666 Len=0 TSval=4503124 TSecr=5099470
  182 19.934172434  10.6.15.144 → 192.168.1.16 SSH 138 Server: Encrypted packet (len=72)
  183 19.934181046 192.168.1.16 → 10.6.15.144  TCP 66 59298 → 22 [ACK] Seq=9461 Ack=58401 Win=3666 Len=0 TSval=4503124 TSecr=5099470
  184 21.262475755  10.6.15.144 → 192.168.1.16 SSH 238 Server: Encrypted packet (len=172)
  185 21.262509164 192.168.1.16 → 10.6.15.144  TCP 66 59298 → 22 [ACK] Seq=9461 Ack=58573 Win=3666 Len=0 TSval=4503456 TSecr=5099597
  186 21.262528692  10.6.15.144 → 192.168.1.16 SSH 238 Server: [TCP Spurious Retransmission] , Encrypted packet (len=172)
  187 21.262535483 192.168.1.16 → 10.6.15.144  TCP 78 [TCP Dup ACK 185#1] 59298 → 22 [ACK] Seq=9461 Ack=58573 Win=3666 Len=0 TSval=4503456 TSecr=5099770 SLE=58401 SRE=58573
  188 21.950025988 192.168.1.16 → 192.168.1.1  DNS 74 Standard query 0xcc75 A ntp.ubuntu.com
  189 21.961379588  192.168.1.1 → 192.168.1.16 DNS 138 Standard query response 0xcc75 A ntp.ubuntu.com A 91.189.94.4 A 91.189.89.198 A 91.189.91.157 A 91.189.89.199
  190 21.962077465 192.168.1.16 → 91.189.94.4  NTP 90 NTP Version 4, client
  191 25.946072031 192.168.1.16 → 139.59.21.22 NTP 90 NTP Version 4, client
  192 29.836098318 192.168.1.16 → 216.58.197.35 TCP 66 45076 → 443 [ACK] Seq=1 Ack=1 Win=362 Len=0 TSval=4505600 TSecr=4267650300
  193 29.853913485 216.58.197.35 → 192.168.1.16 TCP 66 [TCP ACKed unseen segment] 443 → 45076 [ACK] Seq=1 Ack=2 Win=175 Len=0 TSval=4267695360 TSecr=4482890
