    1 0.000000000  10.6.15.144 → 192.168.1.16 SSH 1514 Server: Encrypted packet (len=1448)
    2 0.000332429  10.6.15.144 → 192.168.1.16 SSH 1514 Server: Encrypted packet (len=1448)
    3 0.000342645 192.168.1.16 → 10.6.15.144  TCP 66 59298 → 22 [ACK] Seq=1 Ack=2897 Win=3666 Len=0 TSval=3676200 TSecr=4272246
    4 0.000444220  10.6.15.144 → 192.168.1.16 SSH 110 Server: Encrypted packet (len=44)
    5 0.000786178  10.6.15.144 → 192.168.1.16 SSH 1514 Server: Encrypted packet (len=1448)
    6 0.000794330 192.168.1.16 → 10.6.15.144  TCP 66 59298 → 22 [ACK] Seq=1 Ack=4389 Win=3666 Len=0 TSval=3676200 TSecr=4272246
    7 0.000918726 10.22.18.196 → 224.0.0.252  LLMNR 66 Standard query 0x7119 ANY THISPC
    8 0.001260480  10.6.15.144 → 192.168.1.16 TCP 1514 [TCP Out-Of-Order] 22 → 59298 [ACK] Seq=1 Ack=1 Win=1452 Len=1448 TSval=4272360 TSecr=3675879
    9 0.001266808 192.168.1.16 → 10.6.15.144  TCP 78 [TCP Dup ACK 6#1] 59298 → 22 [ACK] Seq=1 Ack=4389 Win=3666 Len=0 TSval=3676200 TSecr=4272246 SLE=1 SRE=1449
   10 0.001375128 10.22.18.196 → 224.0.0.252  LLMNR 66 Standard query 0x7119 ANY THISPC
   11 0.011937766  10.6.15.144 → 192.168.1.16 SSH 1514 Server: Encrypted packet (len=1448)
   12 0.011955965 192.168.1.16 → 10.6.15.144  TCP 66 59298 → 22 [ACK] Seq=1 Ack=5837 Win=3666 Len=0 TSval=3676203 TSecr=4272532
   13 0.012260978  10.6.15.144 → 192.168.1.16 SSH 1514 Server: Encrypted packet (len=1448)
   14 0.012279061 192.168.1.16 → 10.6.15.144  TCP 66 59298 → 22 [ACK] Seq=1 Ack=7285 Win=3666 Len=0 TSval=3676203 TSecr=4272532
   15 0.012541083  10.6.15.144 → 192.168.1.16 SSH 1514 Server: Encrypted packet (len=1448)
   16 0.012548634 192.168.1.16 → 10.6.15.144  TCP 66 59298 → 22 [ACK] Seq=1 Ack=8733 Win=3666 Len=0 TSval=3676203 TSecr=4272532
   17 0.023104509  10.6.15.144 → 192.168.1.16 SSH 1514 Server: Encrypted packet (len=1448)
   18 0.023122530 192.168.1.16 → 10.6.15.144  TCP 66 59298 → 22 [ACK] Seq=1 Ack=10181 Win=3666 Len=0 TSval=3676206 TSecr=4272535
   19 0.023428456  10.6.15.144 → 192.168.1.16 SSH 1514 Server: Encrypted packet (len=1448)
   20 0.023445832 192.168.1.16 → 10.6.15.144  TCP 66 59298 → 22 [ACK] Seq=1 Ack=11629 Win=3666 Len=0 TSval=3676206 TSecr=4272535
   21 0.023709020  10.6.15.144 → 192.168.1.16 SSH 1514 Server: Encrypted packet (len=1448)
   22 0.023716787 192.168.1.16 → 10.6.15.144  TCP 66 59298 → 22 [ACK] Seq=1 Ack=13077 Win=3666 Len=0 TSval=3676206 TSecr=4272535
   23 0.034209610  10.6.15.144 → 192.168.1.16 SSH 1514 Server: Encrypted packet (len=1448)
   24 0.034228024 192.168.1.16 → 10.6.15.144  TCP 66 59298 → 22 [ACK] Seq=1 Ack=14525 Win=3666 Len=0 TSval=3676209 TSecr=4272537
   25 0.034498338  10.6.15.144 → 192.168.1.16 SSH 1514 Server: Encrypted packet (len=1448)
   26 0.034505837 192.168.1.16 → 10.6.15.144  TCP 66 59298 → 22 [ACK] Seq=1 Ack=15973 Win=3666 Len=0 TSval=3676209 TSecr=4272537
   27 0.034700916  10.6.15.144 → 192.168.1.16 SSH 762 Server: Encrypted packet (len=696)
   28 0.034708291 192.168.1.16 → 10.6.15.144  TCP 66 59298 → 22 [ACK] Seq=1 Ack=16669 Win=3666 Len=0 TSval=3676209 TSecr=4272537
   29 1.322367291 192.168.1.16 → 10.6.15.144  SSH 982 Client: Encrypted packet (len=916)
   30 1.369845435  10.6.15.144 → 192.168.1.16 TCP 66 22 → 59298 [ACK] Seq=16669 Ack=917 Win=1452 Len=0 TSval=4272872 TSecr=3676531
   31 2.107468742 192.168.1.16 → 54.76.71.168 TCP 128 42414 → 8282 [PSH, ACK] Seq=1 Ack=1 Win=296 Len=62 TSval=3676727 TSecr=607781203
   32 2.109070669 10.22.18.209 → 224.0.0.252  LLMNR 64 Standard query 0x1e96 A wpad
   33 2.109926613  10.6.15.144 → 192.168.1.16 SSH 1118 Server: Encrypted packet (len=1052)
   34 2.109951726 192.168.1.16 → 10.6.15.144  TCP 66 59298 → 22 [ACK] Seq=917 Ack=17721 Win=3666 Len=0 TSval=3676728 TSecr=4272971
   35 2.110253967 10.22.18.209 → 224.0.0.252  LLMNR 64 Standard query 0x1e96 A wpad
   36 2.160268159 192.168.1.16 → 10.6.15.144  SSH 102 Client: Encrypted packet (len=36)
   37 2.167962738 192.168.1.16 → 10.6.15.144  SSH 694 Client: Encrypted packet (len=628)
   38 2.172122239  10.6.15.144 → 192.168.1.16 TCP 66 22 → 59298 [ACK] Seq=17721 Ack=953 Win=1452 Len=0 TSval=4273072 TSecr=3676740
   39 2.181595843  10.6.15.144 → 192.168.1.16 TCP 66 22 → 59298 [ACK] Seq=17721 Ack=1581 Win=1452 Len=0 TSval=4273074 TSecr=3676742
   40 2.199018583  10.6.15.144 → 192.168.1.16 SSH 110 Server: Encrypted packet (len=44)
   41 2.199035040 192.168.1.16 → 10.6.15.144  TCP 66 59298 → 22 [ACK] Seq=1581 Ack=17765 Win=3666 Len=0 TSval=3676750 TSecr=4273079
   42 2.199327678 192.168.1.16 → 10.6.15.144  SSH 158 Client: Encrypted packet (len=92)
   43 2.229244680  10.6.15.144 → 192.168.1.16 SSH 1514 Server: Encrypted packet (len=1448)
   44 2.229327907  10.6.15.144 → 192.168.1.16 SSH 958 Server: Encrypted packet (len=892)
   45 2.229335023 192.168.1.16 → 10.6.15.144  TCP 66 59298 → 22 [ACK] Seq=1673 Ack=20105 Win=3666 Len=0 TSval=3676757 TSecr=4273086
   46 2.239399684  10.6.15.144 → 192.168.1.16 SSH 182 Server: Encrypted packet (len=116)
   47 2.239694351 192.168.1.16 → 10.6.15.144  SSH 134 Client: Encrypted packet (len=68)
   48 2.270429186 54.76.71.168 → 192.168.1.16 TCP 66 8282 → 42414 [ACK] Seq=1 Ack=63 Win=121 Len=0 TSval=607788704 TSecr=3676727
   49 2.309907482  10.6.15.144 → 192.168.1.16 TCP 66 22 → 59298 [ACK] Seq=20221 Ack=1741 Win=1452 Len=0 TSval=4273107 TSecr=3676760
   50 6.016206477 10.22.17.246 → 224.0.0.252  LLMNR 64 Standard query 0x92da A wpad
   51 6.016245772 10.22.17.246 → 224.0.0.252  LLMNR 64 Standard query 0xd96b A wpad
   52 6.016256768 10.22.17.246 → 224.0.0.252  LLMNR 64 Standard query 0x298b A wpad
   53 6.016266365 10.22.17.246 → 224.0.0.252  LLMNR 64 Standard query 0x92da A wpad
   54 6.016654491 10.22.17.246 → 224.0.0.252  LLMNR 64 Standard query 0xd96b A wpad
   55 6.016691263 10.22.17.246 → 224.0.0.252  LLMNR 64 Standard query 0x298b A wpad
   56 8.031712004 10.22.18.199 → 224.0.0.252  LLMNR 64 Standard query 0x4ee2 A wpad
   57 9.023555610 10.22.18.199 → 224.0.0.252  LLMNR 64 Standard query 0x4ee2 A wpad
   58 9.023954612  10.6.15.144 → 192.168.1.16 SSH 166 Server: Encrypted packet (len=100)
   59 9.024326840  10.6.15.144 → 192.168.1.16 SSH 102 Server: Encrypted packet (len=36)
   60 9.024399650 192.168.1.16 → 10.6.15.144  TCP 66 59298 → 22 [ACK] Seq=1741 Ack=20357 Win=3666 Len=0 TSval=3678456 TSecr=4274715
   61 9.024767371  10.6.15.144 → 192.168.1.16 SSH 102 Server: [TCP Spurious Retransmission] , Encrypted packet (len=36)
   62 9.024786136 192.168.1.16 → 10.6.15.144  TCP 78 [TCP Dup ACK 60#1] 59298 → 22 [ACK] Seq=1741 Ack=20357 Win=3666 Len=0 TSval=3678456 TSecr=4274761 SLE=20321 SRE=20357
   63 10.016234920 10.22.18.100 → 224.0.0.252  LLMNR 64 Standard query 0xe894 A wpad
   64 10.016581838 10.22.18.100 → 224.0.0.252  LLMNR 64 Standard query 0x8543 A wpad
   65 10.016998104 10.22.18.100 → 224.0.0.252  LLMNR 64 Standard query 0x5cf9 AAAA wpad
   66 10.017344320 10.22.18.209 → 224.0.0.252  LLMNR 64 Standard query 0xacad A wpad
   67 10.017728797 10.22.18.209 → 224.0.0.252  LLMNR 64 Standard query 0xacad A wpad
   68 10.018150423 10.22.18.100 → 224.0.0.252  LLMNR 64 Standard query 0xe894 A wpad
   69 10.018533228 10.22.18.100 → 224.0.0.252  LLMNR 64 Standard query 0x8543 A wpad
   70 10.018917218 10.22.18.100 → 224.0.0.252  LLMNR 64 Standard query 0x5cf9 AAAA wpad
   71 11.063158866 192.168.1.16 → 10.6.15.144  SSH 1514 Client: Encrypted packet (len=1448)
   72 11.069265196 192.168.1.16 → 10.6.15.144  SSH 846 Client: Encrypted packet (len=780)
   73 11.079570901  10.6.15.144 → 192.168.1.16 TCP 66 22 → 59298 [ACK] Seq=20357 Ack=3189 Win=1452 Len=0 TSval=4275299 TSecr=3678966
   74 11.080294968  10.6.15.144 → 192.168.1.16 TCP 66 22 → 59298 [ACK] Seq=20357 Ack=3969 Win=1452 Len=0 TSval=4275299 TSecr=3678967
   75 11.088947081  10.6.15.144 → 192.168.1.16 SSH 134 Server: Encrypted packet (len=68)
   76 11.088964603 192.168.1.16 → 10.6.15.144  TCP 66 59298 → 22 [ACK] Seq=3969 Ack=20425 Win=3666 Len=0 TSval=3678972 TSecr=4275301
   77 12.031719143  10.6.15.144 → 192.168.1.16 SSH 182 Server: Encrypted packet (len=116)
   78 12.031755723 192.168.1.16 → 10.6.15.144  TCP 66 59298 → 22 [ACK] Seq=3969 Ack=20541 Win=3666 Len=0 TSval=3679208 TSecr=4275332
   79 12.032219968  10.6.15.144 → 192.168.1.16 SSH 1134 Server: Encrypted packet (len=1068)
   80 12.032233599 192.168.1.16 → 10.6.15.144  TCP 66 59298 → 22 [ACK] Seq=3969 Ack=21609 Win=3666 Len=0 TSval=3679208 TSecr=4275384
   81 12.033005124 192.168.1.16 → 10.6.15.144  SSH 134 Client: Encrypted packet (len=68)
   82 12.081200570  10.6.15.144 → 192.168.1.16 TCP 66 22 → 59298 [ACK] Seq=21609 Ack=4037 Win=1452 Len=0 TSval=4275550 TSecr=3679208
   83 13.025816400  10.6.15.144 → 192.168.1.16 SSH 166 Server: Encrypted packet (len=100)
   84 13.025835648  10.6.15.144 → 192.168.1.16 SSH 102 Server: Encrypted packet (len=36)
   85 13.025888717 192.168.1.16 → 10.6.15.144  TCP 66 59298 → 22 [ACK] Seq=4037 Ack=21745 Win=3666 Len=0 TSval=3679457 TSecr=4275597
   86 15.007658094 10.22.18.100 → 224.0.0.252  LLMNR 64 Standard query 0x7df6 A wpad
   87 15.007709553 10.22.18.100 → 224.0.0.252  LLMNR 64 Standard query 0x7df6 A wpad
   88 16.032209435 10.22.17.246 → 224.0.0.252  LLMNR 66 Standard query 0x7023 A DELL35
   89 16.032252150 10.22.17.246 → 224.0.0.252  LLMNR 66 Standard query 0x4170 AAAA DELL35
   90 16.032261692 10.22.18.196 → 224.0.0.252  LLMNR 66 Standard query 0x6b3c A DELL35
   91 16.032652346 10.22.18.196 → 224.0.0.252  LLMNR 66 Standard query 0x3f2a AAAA DELL35
   92 19.007656900  10.6.15.144 → 192.168.1.16 SSH 126 Server: Encrypted packet (len=60)
   93 19.008040714  10.6.15.144 → 192.168.1.16 SSH 102 Server: Encrypted packet (len=36)
   94 19.008113240 192.168.1.16 → 10.6.15.144  TCP 66 59298 → 22 [ACK] Seq=4037 Ack=21841 Win=3666 Len=0 TSval=3680952 TSecr=4277174
   95 19.018192719  10.6.15.144 → 192.168.1.16 SSH 162 Server: Encrypted packet (len=96)
   96 19.061672963 192.168.1.16 → 10.6.15.144  TCP 66 59298 → 22 [ACK] Seq=4037 Ack=21937 Win=3666 Len=0 TSval=3680966 TSecr=4277284
   97 21.707668503 192.168.1.16 → 123.108.200.124 NTP 90 NTP Version 4, client
