    1 0.000000000  10.6.15.156 → 192.168.1.12 SSH 1514 Server: Encrypted packet (len=1448)
    2 0.000182689  10.6.15.156 → 192.168.1.12 SSH 1514 Server: Encrypted packet (len=1448)
    3 0.000192229 192.168.1.12 → 10.6.15.156  TCP 66 54766 → 22 [ACK] Seq=37 Ack=2897 Win=2571 Len=0 TSval=7377463 TSecr=14308948
    4 0.000374643  10.6.15.156 → 192.168.1.12 SSH 1514 Server: Encrypted packet (len=1448)
    5 0.000572701  10.6.15.156 → 192.168.1.12 SSH 1514 Server: Encrypted packet (len=1448)
    6 0.000578037 192.168.1.12 → 10.6.15.156  TCP 66 54766 → 22 [ACK] Seq=37 Ack=5793 Win=2571 Len=0 TSval=7377463 TSecr=14308948
    7 0.000759741  10.6.15.156 → 192.168.1.12 SSH 1514 Server: Encrypted packet (len=1448)
    8 0.000948822  10.6.15.156 → 192.168.1.12 SSH 1514 Server: Encrypted packet (len=1448)
    9 0.000952280 192.168.1.12 → 10.6.15.156  TCP 66 54766 → 22 [ACK] Seq=37 Ack=8689 Win=2571 Len=0 TSval=7377463 TSecr=14308949
   10 0.001141512  10.6.15.156 → 192.168.1.12 SSH 1514 Server: Encrypted packet (len=1448)
   11 0.001334916  10.6.15.156 → 192.168.1.12 SSH 1514 Server: Encrypted packet (len=1448)
   12 0.001337352 192.168.1.12 → 10.6.15.156  TCP 66 54766 → 22 [ACK] Seq=37 Ack=11585 Win=2571 Len=0 TSval=7377463 TSecr=14308949
   13 0.001530408  10.6.15.156 → 192.168.1.12 SSH 1514 Server: Encrypted packet (len=1448)
   14 0.001873161  10.6.15.156 → 192.168.1.12 SSH 1514 Server: Encrypted packet (len=1448)
   15 0.001879848 192.168.1.12 → 10.6.15.156  TCP 66 54766 → 22 [ACK] Seq=37 Ack=14481 Win=2571 Len=0 TSval=7377463 TSecr=14308949
   16 0.002064482  10.6.15.156 → 192.168.1.12 SSH 1514 Server: Encrypted packet (len=1448)
   17 0.002258487  10.6.15.156 → 192.168.1.12 SSH 1514 Server: Encrypted packet (len=1448)
   18 0.002265964 192.168.1.12 → 10.6.15.156  TCP 66 54766 → 22 [ACK] Seq=37 Ack=17377 Win=2571 Len=0 TSval=7377463 TSecr=14308949
   19 0.002448702  10.6.15.156 → 192.168.1.12 SSH 1514 Server: Encrypted packet (len=1448)
   20 0.002641779  10.6.15.156 → 192.168.1.12 SSH 1514 Server: Encrypted packet (len=1448)
   21 0.002649109 192.168.1.12 → 10.6.15.156  TCP 66 54766 → 22 [ACK] Seq=37 Ack=20273 Win=2571 Len=0 TSval=7377463 TSecr=14308949
   22 0.002834647  10.6.15.156 → 192.168.1.12 SSH 1514 Server: Encrypted packet (len=1448)
   23 0.003026650  10.6.15.156 → 192.168.1.12 SSH 1514 Server: Encrypted packet (len=1448)
   24 0.003035209 192.168.1.12 → 10.6.15.156  TCP 66 54766 → 22 [ACK] Seq=37 Ack=23169 Win=2571 Len=0 TSval=7377463 TSecr=14308950
   25 0.003222901  10.6.15.156 → 192.168.1.12 SSH 1514 Server: Encrypted packet (len=1448)
   26 0.003409025  10.6.15.156 → 192.168.1.12 SSH 1514 Server: Encrypted packet (len=1448)
   27 0.003415842 192.168.1.12 → 10.6.15.156  TCP 66 54766 → 22 [ACK] Seq=37 Ack=26065 Win=2571 Len=0 TSval=7377464 TSecr=14308950
   28 0.004955678  10.6.15.156 → 192.168.1.12 SSH 1514 Server: Encrypted packet (len=1448)
   29 0.005148960  10.6.15.156 → 192.168.1.12 SSH 1514 Server: Encrypted packet (len=1448)
   30 0.005155462 192.168.1.12 → 10.6.15.156  TCP 66 54766 → 22 [ACK] Seq=37 Ack=28961 Win=2571 Len=0 TSval=7377464 TSecr=14308950
   31 0.005336901  10.6.15.156 → 192.168.1.12 SSH 1514 Server: Encrypted packet (len=1448)
   32 0.005529183  10.6.15.156 → 192.168.1.12 SSH 1514 Server: Encrypted packet (len=1448)
   33 0.005532930 192.168.1.12 → 10.6.15.156  TCP 66 54766 → 22 [ACK] Seq=37 Ack=31857 Win=2571 Len=0 TSval=7377464 TSecr=14308950
   34 0.005722966  10.6.15.156 → 192.168.1.12 SSH 1514 Server: Encrypted packet (len=1448)
   35 0.005914607  10.6.15.156 → 192.168.1.12 SSH 1514 Server: Encrypted packet (len=1448)
   36 0.005918510 192.168.1.12 → 10.6.15.156  TCP 66 54766 → 22 [ACK] Seq=37 Ack=34753 Win=2571 Len=0 TSval=7377464 TSecr=14308950
   37 0.006107713  10.6.15.156 → 192.168.1.12 SSH 1514 Server: Encrypted packet (len=1448)
   38 0.006297268  10.6.15.156 → 192.168.1.12 SSH 1514 Server: Encrypted packet (len=1448)
   39 0.006300803 192.168.1.12 → 10.6.15.156  TCP 66 54766 → 22 [ACK] Seq=37 Ack=37649 Win=2571 Len=0 TSval=7377464 TSecr=14308950
   40 0.006491323  10.6.15.156 → 192.168.1.12 SSH 1514 Server: Encrypted packet (len=1448)
   41 0.006705067 192.168.1.12 → 10.6.15.156  SSH 102 Client: Encrypted packet (len=36)
   42 0.006835292  10.6.15.156 → 192.168.1.12 SSH 1514 Server: Encrypted packet (len=1448)
   43 0.007026477  10.6.15.156 → 192.168.1.12 SSH 1514 Server: Encrypted packet (len=1448)
   44 0.007033488 192.168.1.12 → 10.6.15.156  TCP 66 54766 → 22 [ACK] Seq=73 Ack=41993 Win=2571 Len=0 TSval=7377464 TSecr=14308951
   45 0.007239134  10.6.15.156 → 192.168.1.12 SSH 1514 Server: Encrypted packet (len=1448)
   46 0.007410806  10.6.15.156 → 192.168.1.12 SSH 1514 Server: Encrypted packet (len=1448)
   47 0.007417123 192.168.1.12 → 10.6.15.156  TCP 66 54766 → 22 [ACK] Seq=73 Ack=44889 Win=2571 Len=0 TSval=7377465 TSecr=14308951
   48 0.007603958  10.6.15.156 → 192.168.1.12 SSH 1514 Server: Encrypted packet (len=1448)
   49 0.007795981  10.6.15.156 → 192.168.1.12 SSH 1514 Server: Encrypted packet (len=1448)
   50 0.007804379 192.168.1.12 → 10.6.15.156  TCP 66 54766 → 22 [ACK] Seq=73 Ack=47785 Win=2571 Len=0 TSval=7377465 TSecr=14308951
   51 0.007987018  10.6.15.156 → 192.168.1.12 SSH 1514 Server: Encrypted packet (len=1448)
   52 0.008180717  10.6.15.156 → 192.168.1.12 SSH 1514 Server: Encrypted packet (len=1448)
   53 0.008189433 192.168.1.12 → 10.6.15.156  TCP 66 54766 → 22 [ACK] Seq=73 Ack=50681 Win=2571 Len=0 TSval=7377465 TSecr=14308951
   54 0.008305059  10.6.15.156 → 192.168.1.12 SSH 1078 Server: Encrypted packet (len=1012)
   55 0.009136454  10.22.18.63 → 224.0.0.252  LLMNR 64 Standard query 0x5b04 A wpad
   56 0.009226572  10.6.15.156 → 192.168.1.12 SSH 582 Server: Encrypted packet (len=516)
   57 0.009235022 192.168.1.12 → 10.6.15.156  TCP 66 54766 → 22 [ACK] Seq=73 Ack=52209 Win=2571 Len=0 TSval=7377465 TSecr=14308951
   58 0.046463800 192.168.1.12 → 10.6.15.156  SSH 214 Client: Encrypted packet (len=148)
   59 0.050119836  10.6.15.156 → 192.168.1.12 TCP 66 22 → 54766 [ACK] Seq=52209 Ack=73 Win=1452 Len=0 TSval=14308966 TSecr=7377464
   60 0.050139289  10.6.15.156 → 192.168.1.12 TCP 66 22 → 54766 [ACK] Seq=52209 Ack=221 Win=1452 Len=0 TSval=14308966 TSecr=7377474
   61 0.055743314 192.168.1.12 → 10.6.15.156  SSH 174 Client: Encrypted packet (len=108)
   62 0.058372469  10.6.15.156 → 192.168.1.12 TCP 66 22 → 54766 [ACK] Seq=52209 Ack=329 Win=1452 Len=0 TSval=14308968 TSecr=7377477
   63 0.098190506 192.168.1.12 → 10.6.15.156  SSH 214 Client: Encrypted packet (len=148)
   64 0.101089628  10.6.15.156 → 192.168.1.12 TCP 66 22 → 54766 [ACK] Seq=52209 Ack=477 Win=1452 Len=0 TSval=14308979 TSecr=7377487
   65 0.101104640 192.168.1.12 → 10.6.15.156  SSH 174 Client: Encrypted packet (len=108)
   66 0.102823428  10.6.15.156 → 192.168.1.12 TCP 66 22 → 54766 [ACK] Seq=52209 Ack=585 Win=1452 Len=0 TSval=14308980 TSecr=7377488
   67 0.166256349  10.6.15.156 → 192.168.1.12 SSH 150 Server: Encrypted packet (len=84)
   68 0.169512965  10.6.15.156 → 192.168.1.12 SSH 1514 Server: Encrypted packet (len=1448)
   69 0.169522734 192.168.1.12 → 10.6.15.156  TCP 66 54766 → 22 [ACK] Seq=585 Ack=53741 Win=2571 Len=0 TSval=7377505 TSecr=14308995
   70 0.169651765  10.6.15.156 → 192.168.1.12 SSH 1222 Server: Encrypted packet (len=1156)
   71 0.178347027  10.6.15.156 → 192.168.1.12 SSH 1514 Server: Encrypted packet (len=1448)
   72 0.178362021 192.168.1.12 → 10.6.15.156  TCP 66 54766 → 22 [ACK] Seq=585 Ack=56345 Win=2571 Len=0 TSval=7377507 TSecr=14308996
   73 0.178528994  10.6.15.156 → 192.168.1.12 SSH 1514 Server: Encrypted packet (len=1448)
   74 0.178753479  10.6.15.156 → 192.168.1.12 SSH 726 Server: Encrypted packet (len=660)
   75 0.178755995 192.168.1.12 → 10.6.15.156  TCP 66 54766 → 22 [ACK] Seq=585 Ack=58453 Win=2571 Len=0 TSval=7377507 TSecr=14308998
   76 0.225089112  10.6.15.156 → 192.168.1.12 SSH 1514 Server: Encrypted packet (len=1448)
   77 0.225272419  10.6.15.156 → 192.168.1.12 SSH 1514 Server: Encrypted packet (len=1448)
   78 0.225283240 192.168.1.12 → 10.6.15.156  TCP 66 54766 → 22 [ACK] Seq=585 Ack=61349 Win=2571 Len=0 TSval=7377519 TSecr=14309009
   79 0.225400712  10.6.15.156 → 192.168.1.12 SSH 70 Server: Encrypted packet (len=4)
   80 0.228497905  10.6.15.156 → 192.168.1.12 SSH 150 Server: Encrypted packet (len=84)
   81 0.228542847 192.168.1.12 → 10.6.15.156  TCP 66 54766 → 22 [ACK] Seq=585 Ack=61437 Win=2571 Len=0 TSval=7377520 TSecr=14309009
   82 0.235319261  10.6.15.156 → 192.168.1.12 SSH 1514 Server: Encrypted packet (len=1448)
   83 0.235506279  10.6.15.156 → 192.168.1.12 SSH 1514 Server: Encrypted packet (len=1448)
   84 0.235515032 192.168.1.12 → 10.6.15.156  TCP 66 54766 → 22 [ACK] Seq=585 Ack=64333 Win=2571 Len=0 TSval=7377522 TSecr=14309012
   85 0.235697272  10.6.15.156 → 192.168.1.12 SSH 1514 Server: Encrypted packet (len=1448)
   86 0.235704123  10.6.15.156 → 192.168.1.12 SSH 110 Server: Encrypted packet (len=44)
   87 0.235719745 192.168.1.12 → 10.6.15.156  TCP 66 54766 → 22 [ACK] Seq=585 Ack=65825 Win=2571 Len=0 TSval=7377522 TSecr=14309012
   88 0.238186736  10.6.15.156 → 192.168.1.12 SSH 1514 Server: Encrypted packet (len=1448)
   89 0.238374194  10.6.15.156 → 192.168.1.12 SSH 1514 Server: Encrypted packet (len=1448)
   90 0.238381020 192.168.1.12 → 10.6.15.156  TCP 66 54766 → 22 [ACK] Seq=585 Ack=68721 Win=2571 Len=0 TSval=7377522 TSecr=14309013
   91 0.238719132  10.6.15.156 → 192.168.1.12 SSH 1514 Server: Encrypted packet (len=1448)
   92 0.238909935  10.6.15.156 → 192.168.1.12 SSH 1514 Server: Encrypted packet (len=1448)
   93 0.238914691 192.168.1.12 → 10.6.15.156  TCP 66 54766 → 22 [ACK] Seq=585 Ack=71617 Win=2571 Len=0 TSval=7377522 TSecr=14309013
   94 0.239102795  10.6.15.156 → 192.168.1.12 SSH 1514 Server: Encrypted packet (len=1448)
   95 0.239294582  10.6.15.156 → 192.168.1.12 SSH 1514 Server: Encrypted packet (len=1448)
   96 0.239304232 192.168.1.12 → 10.6.15.156  TCP 66 54766 → 22 [ACK] Seq=585 Ack=74513 Win=2571 Len=0 TSval=7377523 TSecr=14309013
   97 0.239486434  10.6.15.156 → 192.168.1.12 SSH 1514 Server: Encrypted packet (len=1448)
   98 0.239678901  10.6.15.156 → 192.168.1.12 SSH 1514 Server: Encrypted packet (len=1448)
   99 0.239683986 192.168.1.12 → 10.6.15.156  TCP 66 54766 → 22 [ACK] Seq=585 Ack=77409 Win=2571 Len=0 TSval=7377523 TSecr=14309013
  100 0.239731507  10.6.15.156 → 192.168.1.12 SSH 598 Server: Encrypted packet (len=532)
  101 0.239949909  10.6.15.156 → 192.168.1.12 SSH 1514 Server: Encrypted packet (len=1448)
  102 0.239954759 192.168.1.12 → 10.6.15.156  TCP 66 54766 → 22 [ACK] Seq=585 Ack=79389 Win=2571 Len=0 TSval=7377523 TSecr=14309013
  103 0.240140790  10.6.15.156 → 192.168.1.12 SSH 1514 Server: Encrypted packet (len=1448)
  104 0.240490583  10.6.15.156 → 192.168.1.12 SSH 1514 Server: Encrypted packet (len=1448)
  105 0.240499353 192.168.1.12 → 10.6.15.156  TCP 66 54766 → 22 [ACK] Seq=585 Ack=82285 Win=2571 Len=0 TSval=7377523 TSecr=14309013
  106 0.240681071  10.6.15.156 → 192.168.1.12 SSH 1514 Server: Encrypted packet (len=1448)
  107 0.240872119  10.6.15.156 → 192.168.1.12 SSH 1514 Server: Encrypted packet (len=1448)
  108 0.240878293 192.168.1.12 → 10.6.15.156  TCP 66 54766 → 22 [ACK] Seq=585 Ack=85181 Win=2571 Len=0 TSval=7377523 TSecr=14309013
  109 0.241062298  10.6.15.156 → 192.168.1.12 SSH 1514 Server: Encrypted packet (len=1448)
  110 0.241253766  10.6.15.156 → 192.168.1.12 SSH 1514 Server: Encrypted packet (len=1448)
  111 0.241256007 192.168.1.12 → 10.6.15.156  TCP 66 54766 → 22 [ACK] Seq=585 Ack=88077 Win=2571 Len=0 TSval=7377523 TSecr=14309013
  112 0.241447203  10.6.15.156 → 192.168.1.12 SSH 1514 Server: Encrypted packet (len=1448)
  113 0.241642294  10.6.15.156 → 192.168.1.12 SSH 1514 Server: Encrypted packet (len=1448)
  114 0.241649117 192.168.1.12 → 10.6.15.156  TCP 66 54766 → 22 [ACK] Seq=585 Ack=90973 Win=2571 Len=0 TSval=7377523 TSecr=14309013
  115 0.241834203  10.6.15.156 → 192.168.1.12 SSH 1514 Server: Encrypted packet (len=1448)
  116 0.242024570  10.6.15.156 → 192.168.1.12 SSH 1514 Server: Encrypted packet (len=1448)
  117 0.242031462 192.168.1.12 → 10.6.15.156  TCP 66 54766 → 22 [ACK] Seq=585 Ack=93869 Win=2571 Len=0 TSval=7377523 TSecr=14309013
  118 0.242928929  10.6.15.156 → 192.168.1.12 SSH 566 Server: Encrypted packet (len=500)
  119 0.243148152  10.6.15.156 → 192.168.1.12 SSH 1514 Server: Encrypted packet (len=1448)
  120 0.243156889 192.168.1.12 → 10.6.15.156  TCP 66 54766 → 22 [ACK] Seq=585 Ack=95817 Win=2571 Len=0 TSval=7377523 TSecr=14309013
  121 0.243308068  10.6.15.156 → 192.168.1.12 SSH 1318 Server: Encrypted packet (len=1252)
  122 0.286883411  10.6.15.156 → 192.168.1.12 SSH 1514 Server: Encrypted packet (len=1448)
  123 0.286908234 192.168.1.12 → 10.6.15.156  TCP 66 54766 → 22 [ACK] Seq=585 Ack=98517 Win=2571 Len=0 TSval=7377534 TSecr=14309014
  124 0.287062482  10.6.15.156 → 192.168.1.12 SSH 1514 Server: Encrypted packet (len=1448)
  125 0.287195557  10.6.15.156 → 192.168.1.12 SSH 110 Server: Encrypted packet (len=44)
  126 0.287201490 192.168.1.12 → 10.6.15.156  TCP 66 54766 → 22 [ACK] Seq=585 Ack=100009 Win=2571 Len=0 TSval=7377534 TSecr=14309025
  127 0.287497452  10.6.15.156 → 192.168.1.12 SSH 1158 Server: Encrypted packet (len=1092)
  128 0.331235418 192.168.1.12 → 10.6.15.156  TCP 66 54766 → 22 [ACK] Seq=585 Ack=101101 Win=2571 Len=0 TSval=7377546 TSecr=14309025
  129 0.341928195 192.168.1.12 → 10.6.15.156  SSH 238 Client: Encrypted packet (len=172)
  130 0.343529635  10.6.15.156 → 192.168.1.12 TCP 66 22 → 54766 [ACK] Seq=101101 Ack=757 Win=1452 Len=0 TSval=14309040 TSecr=7377548
  131 0.347196287  10.6.15.156 → 192.168.1.12 SSH 150 Server: Encrypted packet (len=84)
  132 0.347280608 192.168.1.12 → 10.6.15.156  TCP 66 54766 → 22 [ACK] Seq=757 Ack=101185 Win=2571 Len=0 TSval=7377550 TSecr=14309041
  133 0.357626504  10.6.15.156 → 192.168.1.12 SSH 134 Server: Encrypted packet (len=68)
  134 0.357683951 192.168.1.12 → 10.6.15.156  TCP 66 54766 → 22 [ACK] Seq=757 Ack=101253 Win=2571 Len=0 TSval=7377552 TSecr=14309043
  135 0.372678908 192.168.1.12 → 10.6.15.156  SSH 198 Client: Encrypted packet (len=132)
  136 0.395238066  10.6.15.156 → 192.168.1.12 SSH 1514 Server: Encrypted packet (len=1448)
  137 0.395264418  10.6.15.156 → 192.168.1.12 SSH 382 Server: Encrypted packet (len=316)
  138 0.395274289 192.168.1.12 → 10.6.15.156  TCP 66 54766 → 22 [ACK] Seq=889 Ack=103017 Win=2571 Len=0 TSval=7377562 TSecr=14309052
  139 0.395418846 192.168.1.12 → 10.6.15.156  SSH 102 Client: Encrypted packet (len=36)
  140 0.396647663  10.6.15.156 → 192.168.1.12 SSH 1514 Server: Encrypted packet (len=1448)
  141 0.396832975  10.6.15.156 → 192.168.1.12 SSH 1514 Server: Encrypted packet (len=1448)
  142 0.396844332 192.168.1.12 → 10.6.15.156  TCP 66 54766 → 22 [ACK] Seq=925 Ack=105913 Win=2571 Len=0 TSval=7377562 TSecr=14309053
  143 0.397022762  10.6.15.156 → 192.168.1.12 SSH 1514 Server: Encrypted packet (len=1448)
  144 0.397213655  10.6.15.156 → 192.168.1.12 SSH 1514 Server: Encrypted packet (len=1448)
  145 0.397220015 192.168.1.12 → 10.6.15.156  TCP 66 54766 → 22 [ACK] Seq=925 Ack=108809 Win=2571 Len=0 TSval=7377562 TSecr=14309053
  146 0.397230684  10.6.15.156 → 192.168.1.12 SSH 102 Server: Encrypted packet (len=36)
  147 0.397576682  10.6.15.156 → 192.168.1.12 SSH 1514 Server: Encrypted packet (len=1448)
  148 0.397583080 192.168.1.12 → 10.6.15.156  TCP 66 54766 → 22 [ACK] Seq=925 Ack=110293 Win=2571 Len=0 TSval=7377562 TSecr=14309053
  149 0.397766704  10.6.15.156 → 192.168.1.12 SSH 1514 Server: Encrypted packet (len=1448)
  150 0.397958211  10.6.15.156 → 192.168.1.12 SSH 1514 Server: Encrypted packet (len=1448)
  151 0.397964032 192.168.1.12 → 10.6.15.156  TCP 66 54766 → 22 [ACK] Seq=925 Ack=113189 Win=2571 Len=0 TSval=7377562 TSecr=14309053
  152 0.398305438  10.6.15.156 → 192.168.1.12 SSH 1514 Server: Encrypted packet (len=1448)
  153 0.398369478  10.6.15.156 → 192.168.1.12 SSH 686 Server: Encrypted packet (len=620)
  154 0.398374284 192.168.1.12 → 10.6.15.156  TCP 66 54766 → 22 [ACK] Seq=925 Ack=115257 Win=2571 Len=0 TSval=7377562 TSecr=14309053
  155 0.399969339  10.6.15.156 → 192.168.1.12 SSH 1514 Server: Encrypted packet (len=1448)
  156 0.400150298  10.6.15.156 → 192.168.1.12 SSH 1514 Server: Encrypted packet (len=1448)
  157 0.400161709 192.168.1.12 → 10.6.15.156  TCP 66 54766 → 22 [ACK] Seq=925 Ack=118153 Win=2571 Len=0 TSval=7377563 TSecr=14309054
  158 0.400496299  10.6.15.156 → 192.168.1.12 SSH 1514 Server: Encrypted packet (len=1448)
  159 0.400515573  10.6.15.156 → 192.168.1.12 SSH 374 Server: Encrypted packet (len=308)
  160 0.400521928 192.168.1.12 → 10.6.15.156  TCP 66 54766 → 22 [ACK] Seq=925 Ack=119909 Win=2571 Len=0 TSval=7377563 TSecr=14309054
  161 0.400739753  10.6.15.156 → 192.168.1.12 SSH 1514 Server: Encrypted packet (len=1448)
  162 0.400929019  10.6.15.156 → 192.168.1.12 SSH 1514 Server: Encrypted packet (len=1448)
  163 0.400936792 192.168.1.12 → 10.6.15.156  TCP 66 54766 → 22 [ACK] Seq=925 Ack=122805 Win=2571 Len=0 TSval=7377563 TSecr=14309054
  164 0.401272737  10.6.15.156 → 192.168.1.12 SSH 1514 Server: Encrypted packet (len=1448)
  165 0.401462894  10.6.15.156 → 192.168.1.12 SSH 1514 Server: Encrypted packet (len=1448)
  166 0.401472015 192.168.1.12 → 10.6.15.156  TCP 66 54766 → 22 [ACK] Seq=925 Ack=125701 Win=2571 Len=0 TSval=7377563 TSecr=14309054
  167 0.401485719  10.6.15.156 → 192.168.1.12 SSH 94 Server: Encrypted packet (len=28)
  168 0.401674286  10.6.15.156 → 192.168.1.12 SSH 1514 Server: Encrypted packet (len=1448)
  169 0.401681458 192.168.1.12 → 10.6.15.156  TCP 66 54766 → 22 [ACK] Seq=925 Ack=127177 Win=2571 Len=0 TSval=7377563 TSecr=14309054
  170 0.401865878  10.6.15.156 → 192.168.1.12 SSH 1514 Server: Encrypted packet (len=1448)
  171 0.402059094  10.6.15.156 → 192.168.1.12 SSH 1514 Server: Encrypted packet (len=1448)
  172 0.402067424 192.168.1.12 → 10.6.15.156  TCP 66 54766 → 22 [ACK] Seq=925 Ack=130073 Win=2571 Len=0 TSval=7377563 TSecr=14309054
  173 0.402249657  10.6.15.156 → 192.168.1.12 SSH 1514 Server: Encrypted packet (len=1448)
  174 0.402384097  10.6.15.156 → 192.168.1.12 SSH 110 Server: Encrypted packet (len=44)
  175 0.402392217 192.168.1.12 → 10.6.15.156  TCP 66 54766 → 22 [ACK] Seq=925 Ack=131565 Win=2571 Len=0 TSval=7377563 TSecr=14309054
  176 0.402612555  10.6.15.156 → 192.168.1.12 SSH 1514 Server: Encrypted packet (len=1448)
  177 0.402803328  10.6.15.156 → 192.168.1.12 SSH 1514 Server: Encrypted packet (len=1448)
  178 0.402810733 192.168.1.12 → 10.6.15.156  TCP 66 54766 → 22 [ACK] Seq=925 Ack=134461 Win=2571 Len=0 TSval=7377563 TSecr=14309054
  179 0.402995930  10.6.15.156 → 192.168.1.12 SSH 1514 Server: Encrypted packet (len=1448)
  180 0.403188366  10.6.15.156 → 192.168.1.12 SSH 1514 Server: Encrypted packet (len=1448)
  181 0.403196069 192.168.1.12 → 10.6.15.156  TCP 66 54766 → 22 [ACK] Seq=925 Ack=137357 Win=2571 Len=0 TSval=7377563 TSecr=14309054
  182 0.403208039  10.6.15.156 → 192.168.1.12 SSH 110 Server: Encrypted packet (len=44)
  183 0.403398149  10.6.15.156 → 192.168.1.12 SSH 1514 Server: Encrypted packet (len=1448)
  184 0.403404988 192.168.1.12 → 10.6.15.156  TCP 66 54766 → 22 [ACK] Seq=925 Ack=138849 Win=2571 Len=0 TSval=7377564 TSecr=14309054
  185 0.403589450  10.6.15.156 → 192.168.1.12 SSH 1514 Server: Encrypted packet (len=1448)
  186 0.403781302  10.6.15.156 → 192.168.1.12 SSH 1514 Server: Encrypted packet (len=1448)
  187 0.403787785 192.168.1.12 → 10.6.15.156  TCP 66 54766 → 22 [ACK] Seq=925 Ack=141745 Win=2571 Len=0 TSval=7377564 TSecr=14309054
  188 0.405326866  10.6.15.156 → 192.168.1.12 SSH 1514 Server: Encrypted packet (len=1448)
  189 0.405344272  10.6.15.156 → 192.168.1.12 SSH 110 Server: Encrypted packet (len=44)
  190 0.405361838 192.168.1.12 → 10.6.15.156  TCP 66 54766 → 22 [ACK] Seq=925 Ack=143237 Win=2571 Len=0 TSval=7377564 TSecr=14309054
  191 0.405539999  10.6.15.156 → 192.168.1.12 SSH 1514 Server: Encrypted packet (len=1448)
  192 0.405725566  10.6.15.156 → 192.168.1.12 SSH 1514 Server: Encrypted packet (len=1448)
  193 0.405731179 192.168.1.12 → 10.6.15.156  TCP 66 54766 → 22 [ACK] Seq=925 Ack=146133 Win=2571 Len=0 TSval=7377564 TSecr=14309054
  194 0.405740659  10.6.15.156 → 192.168.1.12 SSH 110 Server: Encrypted packet (len=44)
  195 0.405935449  10.6.15.156 → 192.168.1.12 SSH 1514 Server: Encrypted packet (len=1448)
  196 0.405940075 192.168.1.12 → 10.6.15.156  TCP 66 54766 → 22 [ACK] Seq=925 Ack=147625 Win=2571 Len=0 TSval=7377564 TSecr=14309054
  197 0.406128085  10.6.15.156 → 192.168.1.12 SSH 1514 Server: Encrypted packet (len=1448)
  198 0.409238417  10.6.15.156 → 192.168.1.12 SSH 1514 Server: Encrypted packet (len=1448)
  199 0.409258894 192.168.1.12 → 10.6.15.156  TCP 66 54766 → 22 [ACK] Seq=925 Ack=150521 Win=2571 Len=0 TSval=7377565 TSecr=14309054
  200 0.409419769  10.6.15.156 → 192.168.1.12 SSH 1514 Server: Encrypted packet (len=1448)
  201 0.409430648  10.6.15.156 → 192.168.1.12 SSH 110 Server: Encrypted packet (len=44)
  202 0.409435661 192.168.1.12 → 10.6.15.156  TCP 66 54766 → 22 [ACK] Seq=925 Ack=152013 Win=2571 Len=0 TSval=7377565 TSecr=14309054
  203 0.409630560  10.6.15.156 → 192.168.1.12 SSH 1514 Server: Encrypted packet (len=1448)
  204 0.409823307  10.6.15.156 → 192.168.1.12 SSH 1514 Server: Encrypted packet (len=1448)
  205 0.409831081 192.168.1.12 → 10.6.15.156  TCP 66 54766 → 22 [ACK] Seq=925 Ack=154909 Win=2571 Len=0 TSval=7377565 TSecr=14309054
  206 0.409842539  10.6.15.156 → 192.168.1.12 SSH 110 Server: Encrypted packet (len=44)
  207 0.410033105  10.6.15.156 → 192.168.1.12 SSH 1514 Server: Encrypted packet (len=1448)
  208 0.410039753 192.168.1.12 → 10.6.15.156  TCP 66 54766 → 22 [ACK] Seq=925 Ack=156401 Win=2571 Len=0 TSval=7377565 TSecr=14309054
  209 0.410224582  10.6.15.156 → 192.168.1.12 SSH 1514 Server: Encrypted packet (len=1448)
  210 0.410233108  10.6.15.156 → 192.168.1.12 SSH 110 Server: Encrypted packet (len=44)
  211 0.410237431 192.168.1.12 → 10.6.15.156  TCP 66 54766 → 22 [ACK] Seq=925 Ack=157893 Win=2571 Len=0 TSval=7377565 TSecr=14309054
  212 0.410591046  10.6.15.156 → 192.168.1.12 SSH 1514 Server: Encrypted packet (len=1448)
  213 0.410779971  10.6.15.156 → 192.168.1.12 SSH 1514 Server: Encrypted packet (len=1448)
  214 0.410787404 192.168.1.12 → 10.6.15.156  TCP 66 54766 → 22 [ACK] Seq=925 Ack=160789 Win=2571 Len=0 TSval=7377565 TSecr=14309054
  215 0.410799688  10.6.15.156 → 192.168.1.12 SSH 110 Server: Encrypted packet (len=44)
  216 0.410991168  10.6.15.156 → 192.168.1.12 SSH 1514 Server: Encrypted packet (len=1448)
  217 0.410996789 192.168.1.12 → 10.6.15.156  TCP 66 54766 → 22 [ACK] Seq=925 Ack=162281 Win=2571 Len=0 TSval=7377565 TSecr=14309054
  218 0.411184630  10.6.15.156 → 192.168.1.12 SSH 1514 Server: Encrypted packet (len=1448)
  219 0.411376172  10.6.15.156 → 192.168.1.12 SSH 1514 Server: Encrypted packet (len=1448)
  220 0.411383676 192.168.1.12 → 10.6.15.156  TCP 66 54766 → 22 [ACK] Seq=925 Ack=165177 Win=2571 Len=0 TSval=7377566 TSecr=14309055
  221 0.411567663  10.6.15.156 → 192.168.1.12 SSH 1514 Server: Encrypted packet (len=1448)
  222 0.411577351  10.6.15.156 → 192.168.1.12 SSH 110 Server: Encrypted packet (len=44)
  223 0.411581859 192.168.1.12 → 10.6.15.156  TCP 66 54766 → 22 [ACK] Seq=925 Ack=166669 Win=2571 Len=0 TSval=7377566 TSecr=14309055
  224 0.411778052  10.6.15.156 → 192.168.1.12 SSH 1514 Server: Encrypted packet (len=1448)
  225 0.414440213  10.6.15.156 → 192.168.1.12 SSH 1514 Server: Encrypted packet (len=1448)
  226 0.414459983 192.168.1.12 → 10.6.15.156  TCP 66 54766 → 22 [ACK] Seq=925 Ack=169565 Win=2571 Len=0 TSval=7377566 TSecr=14309055
  227 0.414480745  10.6.15.156 → 192.168.1.12 SSH 110 Server: Encrypted packet (len=44)
  228 0.414641863  10.6.15.156 → 192.168.1.12 SSH 1514 Server: Encrypted packet (len=1448)
  229 0.414647579 192.168.1.12 → 10.6.15.156  TCP 66 54766 → 22 [ACK] Seq=925 Ack=171057 Win=2571 Len=0 TSval=7377566 TSecr=14309055
  230 0.414832995  10.6.15.156 → 192.168.1.12 SSH 1514 Server: Encrypted packet (len=1448)
  231 0.414979756  10.6.15.156 → 192.168.1.12 SSH 1206 Server: Encrypted packet (len=1140)
  232 0.414988216 192.168.1.12 → 10.6.15.156  TCP 66 54766 → 22 [ACK] Seq=925 Ack=173645 Win=2571 Len=0 TSval=7377566 TSecr=14309055
  233 0.415001697  10.22.18.63 → 224.0.0.252  LLMNR 64 Standard query 0x5b04 A wpad
  234 0.424272409 192.168.1.12 → 10.6.15.156  SSH 198 Client: Encrypted packet (len=132)
  235 0.439039115  10.6.15.156 → 192.168.1.12 SSH 1514 Server: Encrypted packet (len=1448)
  236 0.439225592  10.6.15.156 → 192.168.1.12 SSH 1514 Server: Encrypted packet (len=1448)
  237 0.439236460 192.168.1.12 → 10.6.15.156  TCP 66 54766 → 22 [ACK] Seq=1057 Ack=176541 Win=2571 Len=0 TSval=7377573 TSecr=14309063
  238 0.439409080  10.6.15.156 → 192.168.1.12 SSH 1514 Server: Encrypted packet (len=1448)
  239 0.439600040  10.6.15.156 → 192.168.1.12 SSH 1514 Server: Encrypted packet (len=1448)
  240 0.439604495 192.168.1.12 → 10.6.15.156  TCP 66 54766 → 22 [ACK] Seq=1057 Ack=179437 Win=2571 Len=0 TSval=7377573 TSecr=14309063
  241 0.439612810  10.6.15.156 → 192.168.1.12 SSH 110 Server: Encrypted packet (len=44)
  242 0.439960798  10.6.15.156 → 192.168.1.12 SSH 1514 Server: Encrypted packet (len=1448)
  243 0.439964825 192.168.1.12 → 10.6.15.156  TCP 66 54766 → 22 [ACK] Seq=1057 Ack=180929 Win=2571 Len=0 TSval=7377573 TSecr=14309063
  244 0.440153474  10.6.15.156 → 192.168.1.12 SSH 1514 Server: Encrypted packet (len=1448)
  245 0.440346677  10.6.15.156 → 192.168.1.12 SSH 1514 Server: Encrypted packet (len=1448)
  246 0.440352121 192.168.1.12 → 10.6.15.156  TCP 66 54766 → 22 [ACK] Seq=1057 Ack=183825 Win=2571 Len=0 TSval=7377573 TSecr=14309063
  247 0.440546366  10.6.15.156 → 192.168.1.12 SSH 1514 Server: Encrypted packet (len=1448)
  248 0.442349485  10.6.15.156 → 192.168.1.12 SSH 102 Server: Encrypted packet (len=36)
  249 0.442362667 192.168.1.12 → 10.6.15.156  TCP 66 54766 → 22 [ACK] Seq=1057 Ack=185309 Win=2571 Len=0 TSval=7377573 TSecr=14309063
  250 0.442572010  10.6.15.156 → 192.168.1.12 SSH 1514 Server: Encrypted packet (len=1448)
  251 0.442765224  10.6.15.156 → 192.168.1.12 SSH 1514 Server: Encrypted packet (len=1448)
  252 0.442771815 192.168.1.12 → 10.6.15.156  TCP 66 54766 → 22 [ACK] Seq=1057 Ack=188205 Win=2571 Len=0 TSval=7377573 TSecr=14309063
  253 0.442783841  10.6.15.156 → 192.168.1.12 SSH 110 Server: Encrypted packet (len=44)
  254 0.442973797  10.6.15.156 → 192.168.1.12 SSH 1514 Server: Encrypted packet (len=1448)
  255 0.442978490 192.168.1.12 → 10.6.15.156  TCP 66 54766 → 22 [ACK] Seq=1057 Ack=189697 Win=2571 Len=0 TSval=7377573 TSecr=14309063
  256 0.443167064  10.6.15.156 → 192.168.1.12 SSH 1514 Server: Encrypted packet (len=1448)
  257 0.443175555  10.6.15.156 → 192.168.1.12 SSH 110 Server: Encrypted packet (len=44)
  258 0.443180244 192.168.1.12 → 10.6.15.156  TCP 66 54766 → 22 [ACK] Seq=1057 Ack=191189 Win=2571 Len=0 TSval=7377573 TSecr=14309064
  259 0.443533861  10.6.15.156 → 192.168.1.12 SSH 1514 Server: Encrypted packet (len=1448)
  260 0.443721801  10.6.15.156 → 192.168.1.12 SSH 1514 Server: Encrypted packet (len=1448)
  261 0.443728699 192.168.1.12 → 10.6.15.156  TCP 66 54766 → 22 [ACK] Seq=1057 Ack=194085 Win=2571 Len=0 TSval=7377574 TSecr=14309064
  262 0.443915455  10.6.15.156 → 192.168.1.12 SSH 1514 Server: Encrypted packet (len=1448)
  263 0.444105797  10.6.15.156 → 192.168.1.12 SSH 1514 Server: Encrypted packet (len=1448)
  264 0.444112188 192.168.1.12 → 10.6.15.156  TCP 66 54766 → 22 [ACK] Seq=1057 Ack=196981 Win=2571 Len=0 TSval=7377574 TSecr=14309064
  265 0.444124268  10.6.15.156 → 192.168.1.12 SSH 110 Server: Encrypted packet (len=44)
  266 0.444316290  10.6.15.156 → 192.168.1.12 SSH 1514 Server: Encrypted packet (len=1448)
  267 0.444321660 192.168.1.12 → 10.6.15.156  TCP 66 54766 → 22 [ACK] Seq=1057 Ack=198473 Win=2571 Len=0 TSval=7377574 TSecr=14309064
  268 0.444524521  10.6.15.156 → 192.168.1.12 SSH 1514 Server: Encrypted packet (len=1448)
  269 0.444702751  10.6.15.156 → 192.168.1.12 SSH 1514 Server: Encrypted packet (len=1448)
  270 0.444711819 192.168.1.12 → 10.6.15.156  TCP 66 54766 → 22 [ACK] Seq=1057 Ack=201369 Win=2571 Len=0 TSval=7377574 TSecr=14309064
  271 0.444894436  10.6.15.156 → 192.168.1.12 SSH 1514 Server: Encrypted packet (len=1448)
  272 0.446065370  10.6.15.156 → 192.168.1.12 SSH 1514 Server: Encrypted packet (len=1448)
  273 0.446084785 192.168.1.12 → 10.6.15.156  TCP 66 54766 → 22 [ACK] Seq=1057 Ack=204265 Win=2571 Len=0 TSval=7377574 TSecr=14309064
  274 0.446107948  10.6.15.156 → 192.168.1.12 SSH 598 Server: Encrypted packet (len=532)
  275 0.446286755 192.168.1.12 → 10.6.15.156  SSH 102 Client: Encrypted packet (len=36)
  276 0.487090382  10.6.15.156 → 192.168.1.12 TCP 66 22 → 54766 [ACK] Seq=204797 Ack=1093 Win=1452 Len=0 TSval=14309076 TSecr=7377574
  277 0.972727187 192.168.1.12 → 10.6.15.156  SSH 302 Client: Encrypted packet (len=236)
  278 0.976200928  10.6.15.156 → 192.168.1.12 TCP 66 22 → 54766 [ACK] Seq=204797 Ack=1329 Win=1452 Len=0 TSval=14309198 TSecr=7377706
  279 0.981858393 192.168.1.12 → 10.6.15.156  SSH 294 Client: Encrypted packet (len=228)
  280 0.983608632  10.6.15.156 → 192.168.1.12 TCP 66 22 → 54766 [ACK] Seq=204797 Ack=1557 Win=1452 Len=0 TSval=14309200 TSecr=7377708
  281 1.094896247  10.6.15.156 → 192.168.1.12 SSH 342 Server: Encrypted packet (len=276)
  282 1.101878379  10.6.15.156 → 192.168.1.12 SSH 334 Server: Encrypted packet (len=268)
  283 1.101943842 192.168.1.12 → 10.6.15.156  TCP 66 54766 → 22 [ACK] Seq=1557 Ack=205341 Win=2571 Len=0 TSval=7377738 TSecr=14309227
  284 1.113981001 192.168.1.12 → 10.6.15.156  SSH 198 Client: Encrypted packet (len=132)
  285 1.116168417  10.6.15.156 → 192.168.1.12 TCP 66 22 → 54766 [ACK] Seq=205341 Ack=1689 Win=1452 Len=0 TSval=14309233 TSecr=7377741
  286 1.116193144 192.168.1.12 → 10.6.15.156  SSH 330 Client: Encrypted packet (len=264)
  287 1.117863902  10.6.15.156 → 192.168.1.12 TCP 66 22 → 54766 [ACK] Seq=205341 Ack=1953 Win=1452 Len=0 TSval=14309233 TSecr=7377742
  288 1.119512594 192.168.1.12 → 10.6.15.156  SSH 206 Client: Encrypted packet (len=140)
  289 1.121768766  10.6.15.156 → 192.168.1.12 TCP 66 22 → 54766 [ACK] Seq=205341 Ack=2093 Win=1452 Len=0 TSval=14309234 TSecr=7377743
  290 1.121783847 192.168.1.12 → 10.6.15.156  SSH 198 Client: Encrypted packet (len=132)
  291 1.122150461 192.168.1.12 → 10.6.15.156  SSH 330 Client: Encrypted packet (len=264)
  292 1.125185434  10.6.15.156 → 192.168.1.12 TCP 66 22 → 54766 [ACK] Seq=205341 Ack=2225 Win=1452 Len=0 TSval=14309235 TSecr=7377743
  293 1.125202937 192.168.1.12 → 10.6.15.156  SSH 330 Client: Encrypted packet (len=264)
  294 1.125215633  10.6.15.156 → 192.168.1.12 TCP 66 22 → 54766 [ACK] Seq=205341 Ack=2489 Win=1452 Len=0 TSval=14309235 TSecr=7377743
  295 1.126879064  10.6.15.156 → 192.168.1.12 TCP 66 22 → 54766 [ACK] Seq=205341 Ack=2753 Win=1452 Len=0 TSval=14309236 TSecr=7377744
  296 1.138123560  10.6.15.156 → 192.168.1.12 SSH 1514 Server: Encrypted packet (len=1448)
  297 1.138308828  10.6.15.156 → 192.168.1.12 SSH 1514 Server: Encrypted packet (len=1448)
  298 1.138318759 192.168.1.12 → 10.6.15.156  TCP 66 54766 → 22 [ACK] Seq=2753 Ack=208237 Win=2571 Len=0 TSval=7377747 TSecr=14309238
  299 1.138499435  10.6.15.156 → 192.168.1.12 SSH 1514 Server: Encrypted packet (len=1448)
  300 1.138691902  10.6.15.156 → 192.168.1.12 SSH 1514 Server: Encrypted packet (len=1448)
  301 1.138697708 192.168.1.12 → 10.6.15.156  TCP 66 54766 → 22 [ACK] Seq=2753 Ack=211133 Win=2571 Len=0 TSval=7377747 TSecr=14309238
  302 1.138705507  10.6.15.156 → 192.168.1.12 SSH 110 Server: Encrypted packet (len=44)
  303 1.139973765  10.6.15.156 → 192.168.1.12 SSH 1514 Server: Encrypted packet (len=1448)
  304 1.139982933 192.168.1.12 → 10.6.15.156  TCP 66 54766 → 22 [ACK] Seq=2753 Ack=212625 Win=2571 Len=0 TSval=7377748 TSecr=14309238
  305 1.140163894  10.6.15.156 → 192.168.1.12 SSH 1514 Server: Encrypted packet (len=1448)
  306 1.140355169  10.6.15.156 → 192.168.1.12 SSH 1514 Server: Encrypted packet (len=1448)
  307 1.140361954 192.168.1.12 → 10.6.15.156  TCP 66 54766 → 22 [ACK] Seq=2753 Ack=215521 Win=2571 Len=0 TSval=7377748 TSecr=14309238
  308 1.140548472  10.6.15.156 → 192.168.1.12 SSH 1514 Server: Encrypted packet (len=1448)
  309 1.140720361  10.6.15.156 → 192.168.1.12 SSH 1514 Server: Encrypted packet (len=1448)
  310 1.140724480 192.168.1.12 → 10.6.15.156  TCP 66 54766 → 22 [ACK] Seq=2753 Ack=218417 Win=2571 Len=0 TSval=7377748 TSecr=14309238
  311 1.140930986  10.6.15.156 → 192.168.1.12 SSH 1514 Server: Encrypted packet (len=1448)
  312 1.141103893  10.6.15.156 → 192.168.1.12 SSH 1514 Server: Encrypted packet (len=1448)
  313 1.141107841 192.168.1.12 → 10.6.15.156  TCP 66 54766 → 22 [ACK] Seq=2753 Ack=221313 Win=2571 Len=0 TSval=7377748 TSecr=14309238
  314 1.141256876  10.6.15.156 → 192.168.1.12 SSH 102 Server: Encrypted packet (len=36)
  315 1.142751424  10.6.15.156 → 192.168.1.12 SSH 1514 Server: Encrypted packet (len=1448)
  316 1.142769360 192.168.1.12 → 10.6.15.156  TCP 66 54766 → 22 [ACK] Seq=2753 Ack=222797 Win=2571 Len=0 TSval=7377748 TSecr=14309238
  317 1.142788000  10.6.15.156 → 192.168.1.12 SSH 110 Server: Encrypted packet (len=44)
  318 1.160549228  10.6.15.156 → 192.168.1.12 SSH 1514 Server: Encrypted packet (len=1448)
  319 1.160571552 192.168.1.12 → 10.6.15.156  TCP 66 54766 → 22 [ACK] Seq=2753 Ack=224289 Win=2571 Len=0 TSval=7377753 TSecr=14309239
  320 1.160724491  10.6.15.156 → 192.168.1.12 SSH 1514 Server: Encrypted packet (len=1448)
  321 1.160914514  10.6.15.156 → 192.168.1.12 SSH 1514 Server: Encrypted packet (len=1448)
  322 1.160920030 192.168.1.12 → 10.6.15.156  TCP 66 54766 → 22 [ACK] Seq=2753 Ack=227185 Win=2571 Len=0 TSval=7377753 TSecr=14309244
  323 1.161107079  10.6.15.156 → 192.168.1.12 SSH 1514 Server: Encrypted packet (len=1448)
  324 1.161113505  10.6.15.156 → 192.168.1.12 SSH 102 Server: Encrypted packet (len=36)
  325 1.161117140 192.168.1.12 → 10.6.15.156  TCP 66 54766 → 22 [ACK] Seq=2753 Ack=228669 Win=2571 Len=0 TSval=7377753 TSecr=14309244
  326 1.162708280  10.6.15.156 → 192.168.1.12 SSH 1514 Server: Encrypted packet (len=1448)
  327 1.162901142  10.6.15.156 → 192.168.1.12 SSH 1514 Server: Encrypted packet (len=1448)
  328 1.162909734 192.168.1.12 → 10.6.15.156  TCP 66 54766 → 22 [ACK] Seq=2753 Ack=231565 Win=2571 Len=0 TSval=7377753 TSecr=14309244
  329 1.163092517  10.6.15.156 → 192.168.1.12 SSH 1514 Server: Encrypted packet (len=1448)
  330 1.163275469  10.6.15.156 → 192.168.1.12 SSH 1514 Server: Encrypted packet (len=1448)
  331 1.163280793 192.168.1.12 → 10.6.15.156  TCP 66 54766 → 22 [ACK] Seq=2753 Ack=234461 Win=2571 Len=0 TSval=7377754 TSecr=14309244
  332 1.163466656  10.6.15.156 → 192.168.1.12 SSH 1514 Server: Encrypted packet (len=1448)
  333 1.163657438  10.6.15.156 → 192.168.1.12 SSH 1514 Server: Encrypted packet (len=1448)
  334 1.163665159 192.168.1.12 → 10.6.15.156  TCP 66 54766 → 22 [ACK] Seq=2753 Ack=237357 Win=2571 Len=0 TSval=7377754 TSecr=14309244
  335 1.164012819  10.6.15.156 → 192.168.1.12 SSH 1514 Server: Encrypted packet (len=1448)
  336 1.164190981  10.6.15.156 → 192.168.1.12 SSH 1514 Server: Encrypted packet (len=1448)
  337 1.164195912 192.168.1.12 → 10.6.15.156  TCP 66 54766 → 22 [ACK] Seq=2753 Ack=240253 Win=2571 Len=0 TSval=7377754 TSecr=14309244
  338 1.164204140  10.6.15.156 → 192.168.1.12 SSH 94 Server: Encrypted packet (len=28)
  339 1.164403544  10.6.15.156 → 192.168.1.12 SSH 1514 Server: Encrypted packet (len=1448)
  340 1.164407833 192.168.1.12 → 10.6.15.156  TCP 66 54766 → 22 [ACK] Seq=2753 Ack=241729 Win=2571 Len=0 TSval=7377754 TSecr=14309244
  341 1.164593901  10.6.15.156 → 192.168.1.12 SSH 1514 Server: Encrypted packet (len=1448)
  342 1.164800292  10.6.15.156 → 192.168.1.12 SSH 1514 Server: Encrypted packet (len=1448)
  343 1.164803948 192.168.1.12 → 10.6.15.156  TCP 66 54766 → 22 [ACK] Seq=2753 Ack=244625 Win=2571 Len=0 TSval=7377754 TSecr=14309244
  344 1.164991600  10.6.15.156 → 192.168.1.12 SSH 1514 Server: Encrypted packet (len=1448)
  345 1.165169120  10.6.15.156 → 192.168.1.12 SSH 1514 Server: Encrypted packet (len=1448)
  346 1.165171624 192.168.1.12 → 10.6.15.156  TCP 66 54766 → 22 [ACK] Seq=2753 Ack=247521 Win=2571 Len=0 TSval=7377754 TSecr=14309244
  347 1.165375561  10.6.15.156 → 192.168.1.12 SSH 1514 Server: Encrypted packet (len=1448)
  348 1.167024839  10.6.15.156 → 192.168.1.12 SSH 1514 Server: Encrypted packet (len=1448)
  349 1.167034693 192.168.1.12 → 10.6.15.156  TCP 66 54766 → 22 [ACK] Seq=2753 Ack=250417 Win=2571 Len=0 TSval=7377754 TSecr=14309244
  350 1.167044150  10.6.15.156 → 192.168.1.12 SSH 166 Server: Encrypted packet (len=100)
  351 1.167253402  10.6.15.156 → 192.168.1.12 SSH 1514 Server: Encrypted packet (len=1448)
  352 1.167258627 192.168.1.12 → 10.6.15.156  TCP 66 54766 → 22 [ACK] Seq=2753 Ack=251965 Win=2571 Len=0 TSval=7377755 TSecr=14309244
  353 1.167430759  10.6.15.156 → 192.168.1.12 SSH 1514 Server: Encrypted packet (len=1448)
  354 1.167622540  10.6.15.156 → 192.168.1.12 SSH 1514 Server: Encrypted packet (len=1448)
  355 1.167626242 192.168.1.12 → 10.6.15.156  TCP 66 54766 → 22 [ACK] Seq=2753 Ack=254861 Win=2571 Len=0 TSval=7377755 TSecr=14309245
  356 1.167815209  10.6.15.156 → 192.168.1.12 SSH 1514 Server: Encrypted packet (len=1448)
  357 1.168157473  10.6.15.156 → 192.168.1.12 SSH 1514 Server: Encrypted packet (len=1448)
  358 1.168161199 192.168.1.12 → 10.6.15.156  TCP 66 54766 → 22 [ACK] Seq=2753 Ack=257757 Win=2571 Len=0 TSval=7377755 TSecr=14309245
  359 1.168337955  10.6.15.156 → 192.168.1.12 SSH 1514 Server: Encrypted packet (len=1448)
  360 1.168553093  10.6.15.156 → 192.168.1.12 SSH 1514 Server: Encrypted packet (len=1448)
  361 1.168558939 192.168.1.12 → 10.6.15.156  TCP 66 54766 → 22 [ACK] Seq=2753 Ack=260653 Win=2571 Len=0 TSval=7377755 TSecr=14309245
  362 1.168733924  10.6.15.156 → 192.168.1.12 SSH 1514 Server: Encrypted packet (len=1448)
  363 1.168915025  10.6.15.156 → 192.168.1.12 SSH 1514 Server: Encrypted packet (len=1448)
  364 1.168921207 192.168.1.12 → 10.6.15.156  TCP 66 54766 → 22 [ACK] Seq=2753 Ack=263549 Win=2571 Len=0 TSval=7377755 TSecr=14309245
  365 1.169107411  10.6.15.156 → 192.168.1.12 SSH 1514 Server: Encrypted packet (len=1448)
  366 1.169298895  10.6.15.156 → 192.168.1.12 SSH 1514 Server: Encrypted packet (len=1448)
  367 1.169308118 192.168.1.12 → 10.6.15.156  TCP 66 54766 → 22 [ACK] Seq=2753 Ack=266445 Win=2571 Len=0 TSval=7377755 TSecr=14309245
  368 1.169491800  10.6.15.156 → 192.168.1.12 SSH 1514 Server: Encrypted packet (len=1448)
  369 1.170793314  10.6.15.156 → 192.168.1.12 SSH 1514 Server: Encrypted packet (len=1448)
  370 1.170812384 192.168.1.12 → 10.6.15.156  TCP 66 54766 → 22 [ACK] Seq=2753 Ack=269341 Win=2571 Len=0 TSval=7377755 TSecr=14309245
  371 1.170976621  10.6.15.156 → 192.168.1.12 SSH 1514 Server: Encrypted packet (len=1448)
  372 1.171168495  10.6.15.156 → 192.168.1.12 SSH 1514 Server: Encrypted packet (len=1448)
  373 1.171174601 192.168.1.12 → 10.6.15.156  TCP 66 54766 → 22 [ACK] Seq=2753 Ack=272237 Win=2571 Len=0 TSval=7377755 TSecr=14309245
  374 1.171373339  10.6.15.156 → 192.168.1.12 SSH 1514 Server: Encrypted packet (len=1448)
  375 1.171716132  10.6.15.156 → 192.168.1.12 SSH 1514 Server: Encrypted packet (len=1448)
  376 1.171719999 192.168.1.12 → 10.6.15.156  TCP 66 54766 → 22 [ACK] Seq=2753 Ack=275133 Win=2571 Len=0 TSval=7377756 TSecr=14309245
  377 1.171897693  10.6.15.156 → 192.168.1.12 SSH 1514 Server: Encrypted packet (len=1448)
  378 1.172101136  10.6.15.156 → 192.168.1.12 SSH 1514 Server: Encrypted packet (len=1448)
  379 1.172105376 192.168.1.12 → 10.6.15.156  TCP 66 54766 → 22 [ACK] Seq=2753 Ack=278029 Win=2571 Len=0 TSval=7377756 TSecr=14309247
  380 1.172446321  10.6.15.156 → 192.168.1.12 SSH 1514 Server: Encrypted packet (len=1448)
  381 1.172636965  10.6.15.156 → 192.168.1.12 SSH 1514 Server: Encrypted packet (len=1448)
