    1 0.000000000  10.6.15.144 → 192.168.1.16 SSH 1514 Server: Encrypted packet (len=1448)
    2 0.000026719 192.168.1.16 → 10.6.15.144  TCP 66 59298 → 22 [ACK] Seq=1 Ack=1449 Win=3666 Len=0 TSval=4129200 TSecr=4725159
    3 0.000287085  10.6.15.144 → 192.168.1.16 SSH 1514 Server: Encrypted packet (len=1448)
    4 0.000295941 192.168.1.16 → 10.6.15.144  TCP 66 59298 → 22 [ACK] Seq=1 Ack=2897 Win=3666 Len=0 TSval=4129200 TSecr=4725159
    5 0.000387942  10.6.15.144 → 192.168.1.16 SSH 126 Server: Encrypted packet (len=60)
    6 0.000391840 192.168.1.16 → 10.6.15.144  TCP 66 59298 → 22 [ACK] Seq=1 Ack=2957 Win=3666 Len=0 TSval=4129200 TSecr=4725159
    7 0.001580321  10.6.15.144 → 192.168.1.16 SSH 1514 Server: Encrypted packet (len=1448)
    8 0.001596152 192.168.1.16 → 10.6.15.144  TCP 66 59298 → 22 [ACK] Seq=1 Ack=4405 Win=3666 Len=0 TSval=4129200 TSecr=4725167
    9 0.008879723 10.22.18.209 → 224.0.0.252  LLMNR 64 Standard query 0x9b5a A wpad
   10 0.008897763 10.22.18.209 → 224.0.0.252  LLMNR 64 Standard query 0x9b5a A wpad
   11 0.009171680  10.6.15.144 → 192.168.1.16 SSH 1514 Server: [TCP Spurious Retransmission] , Encrypted packet (len=1448)
   12 0.009182118 192.168.1.16 → 10.6.15.144  TCP 78 [TCP Dup ACK 8#1] 59298 → 22 [ACK] Seq=1 Ack=4405 Win=3666 Len=0 TSval=4129202 TSecr=4725167 SLE=1 SRE=1449
   13 0.009405938  10.6.15.144 → 192.168.1.16 SSH 1514 Server: [TCP Spurious Retransmission] , Encrypted packet (len=1448)
   14 0.009410743 192.168.1.16 → 10.6.15.144  TCP 78 [TCP Dup ACK 8#2] 59298 → 22 [ACK] Seq=1 Ack=4405 Win=3666 Len=0 TSval=4129202 TSecr=4725167 SLE=1 SRE=1449
   15 0.010433635  10.6.15.144 → 192.168.1.16 SSH 1514 Server: Encrypted packet (len=1448)
   16 0.010447179 192.168.1.16 → 10.6.15.144  TCP 66 59298 → 22 [ACK] Seq=1 Ack=5853 Win=3666 Len=0 TSval=4129203 TSecr=4725541
   17 0.010622311  10.6.15.144 → 192.168.1.16 SSH 1514 Server: Encrypted packet (len=1448)
   18 0.010629842 192.168.1.16 → 10.6.15.144  TCP 66 59298 → 22 [ACK] Seq=1 Ack=7301 Win=3666 Len=0 TSval=4129203 TSecr=4725541
   19 0.013224109  10.6.15.144 → 192.168.1.16 SSH 1514 Server: Encrypted packet (len=1448)
   20 0.013245660 192.168.1.16 → 10.6.15.144  TCP 66 59298 → 22 [ACK] Seq=1 Ack=8749 Win=3666 Len=0 TSval=4129203 TSecr=4725542
   21 0.018823803  10.6.15.144 → 192.168.1.16 SSH 1514 Server: Encrypted packet (len=1448)
   22 0.018844516 192.168.1.16 → 10.6.15.144  TCP 66 59298 → 22 [ACK] Seq=1 Ack=10197 Win=3666 Len=0 TSval=4129205 TSecr=4725544
   23 0.019347780  10.6.15.144 → 192.168.1.16 SSH 586 Server: Encrypted packet (len=520)
   24 0.019361203 192.168.1.16 → 10.6.15.144  TCP 66 59298 → 22 [ACK] Seq=1 Ack=10717 Win=3666 Len=0 TSval=4129205 TSecr=4725544
   25 0.019676075 192.168.1.16 → 10.6.15.144  SSH 102 Client: Encrypted packet (len=36)
   26 0.026200998 192.168.1.16 → 10.6.15.144  SSH 138 Client: Encrypted packet (len=72)
   27 0.027659094  10.6.15.144 → 192.168.1.16 TCP 66 22 → 59298 [ACK] Seq=10717 Ack=37 Win=1452 Len=0 TSval=4725546 TSecr=4129205
   28 0.034031452  10.6.15.144 → 192.168.1.16 TCP 66 22 → 59298 [ACK] Seq=10717 Ack=109 Win=1452 Len=0 TSval=4725548 TSecr=4129207
   29 0.034479289  10.6.15.144 → 192.168.1.16 SSH 102 Server: Encrypted packet (len=36)
   30 0.077786898 192.168.1.16 → 10.6.15.144  TCP 66 59298 → 22 [ACK] Seq=109 Ack=10753 Win=3666 Len=0 TSval=4129220 TSecr=4725548
   31 0.274016001 192.168.1.16 → 10.6.15.144  SSH 102 Client: Encrypted packet (len=36)
   32 0.323727246  10.6.15.144 → 192.168.1.16 TCP 66 22 → 59298 [ACK] Seq=10753 Ack=145 Win=1452 Len=0 TSval=4725620 TSecr=4129269
   33 0.370463077 192.168.1.16 → 10.6.15.144  SSH 102 Client: Encrypted packet (len=36)
   34 0.370933298 192.168.1.16 → 10.6.15.144  SSH 102 Client: Encrypted packet (len=36)
   35 0.376353397 192.168.1.16 → 10.6.15.144  SSH 102 Client: Encrypted packet (len=36)
   36 0.378224872 192.168.1.16 → 10.6.15.144  SSH 102 Client: Encrypted packet (len=36)
   37 0.378463741 192.168.1.16 → 10.6.15.144  SSH 102 Client: Encrypted packet (len=36)
   38 0.379471415 192.168.1.16 → 10.6.15.144  SSH 102 Client: Encrypted packet (len=36)
   39 0.380398229  10.6.15.144 → 192.168.1.16 TCP 66 22 → 59298 [ACK] Seq=10753 Ack=181 Win=1452 Len=0 TSval=4725634 TSecr=4129293
   40 0.380907735  10.6.15.144 → 192.168.1.16 TCP 66 22 → 59298 [ACK] Seq=10753 Ack=217 Win=1452 Len=0 TSval=4725634 TSecr=4129293
   41 0.386224083  10.6.15.144 → 192.168.1.16 TCP 66 22 → 59298 [ACK] Seq=10753 Ack=253 Win=1452 Len=0 TSval=4725635 TSecr=4129294
   42 0.387856896  10.6.15.144 → 192.168.1.16 TCP 66 22 → 59298 [ACK] Seq=10753 Ack=289 Win=1452 Len=0 TSval=4725636 TSecr=4129295
   43 0.387985841  10.6.15.144 → 192.168.1.16 TCP 66 22 → 59298 [ACK] Seq=10753 Ack=325 Win=1452 Len=0 TSval=4725636 TSecr=4129295
   44 0.389325604  10.6.15.144 → 192.168.1.16 TCP 66 22 → 59298 [ACK] Seq=10753 Ack=361 Win=1452 Len=0 TSval=4725636 TSecr=4129295
   45 0.418192857  10.6.15.144 → 192.168.1.16 SSH 102 Server: Encrypted packet (len=36)
   46 0.418208965 192.168.1.16 → 10.6.15.144  TCP 66 59298 → 22 [ACK] Seq=361 Ack=10789 Win=3666 Len=0 TSval=4129305 TSecr=4725643
   47 0.419363928 192.168.1.16 → 10.6.15.144  SSH 166 Client: Encrypted packet (len=100)
   48 0.419855919  10.6.15.144 → 192.168.1.16 SSH 102 Server: Encrypted packet (len=36)
   49 0.420155816 192.168.1.16 → 10.6.15.144  SSH 102 Client: Encrypted packet (len=36)
   50 0.420440774 192.168.1.16 → 10.6.15.144  SSH 158 Client: Encrypted packet (len=92)
   51 0.420676278 192.168.1.16 → 10.6.15.144  SSH 102 Client: Encrypted packet (len=36)
   52 0.422098910  10.6.15.144 → 192.168.1.16 SSH 102 Server: Encrypted packet (len=36)
   53 0.422404955 192.168.1.16 → 10.6.15.144  SSH 110 Client: Encrypted packet (len=44)
   54 0.430157970  10.6.15.144 → 192.168.1.16 TCP 66 22 → 59298 [ACK] Seq=10861 Ack=497 Win=1452 Len=0 TSval=4725646 TSecr=4129305
   55 0.430285003  10.6.15.144 → 192.168.1.16 TCP 66 22 → 59298 [ACK] Seq=10861 Ack=625 Win=1452 Len=0 TSval=4725646 TSecr=4129305
   56 0.458346407  10.6.15.144 → 192.168.1.16 SSH 238 Server: Encrypted packet (len=172)
   57 0.458642333 192.168.1.16 → 10.6.15.144  SSH 134 Client: Encrypted packet (len=68)
   58 0.461576007  10.6.15.144 → 192.168.1.16 SSH 1514 Server: Encrypted packet (len=1448)
   59 0.461722048  10.6.15.144 → 192.168.1.16 SSH 1278 Server: Encrypted packet (len=1212)
   60 0.461731118 192.168.1.16 → 10.6.15.144  TCP 66 59298 → 22 [ACK] Seq=737 Ack=13693 Win=3666 Len=0 TSval=4129315 TSecr=4725654
   61 0.463086010 192.168.1.16 → 10.6.15.144  SSH 206 Client: Encrypted packet (len=140)
   62 0.472815463  10.6.15.144 → 192.168.1.16 TCP 66 22 → 59298 [ACK] Seq=13693 Ack=877 Win=1452 Len=0 TSval=4725657 TSecr=4129315
   63 0.491128268  10.6.15.144 → 192.168.1.16 SSH 110 Server: Encrypted packet (len=44)
   64 0.491485675 192.168.1.16 → 10.6.15.144  SSH 110 Client: Encrypted packet (len=44)
   65 0.501730091  10.6.15.144 → 192.168.1.16 SSH 182 Server: Encrypted packet (len=116)
   66 0.511430964  10.6.15.144 → 192.168.1.16 SSH 438 Server: Encrypted packet (len=372)
   67 0.511505417 192.168.1.16 → 10.6.15.144  TCP 66 59298 → 22 [ACK] Seq=921 Ack=14225 Win=3666 Len=0 TSval=4129328 TSecr=4725664
   68 0.535377831  10.6.15.144 → 192.168.1.16 SSH 310 Server: Encrypted packet (len=244)
   69 0.577785751 192.168.1.16 → 10.6.15.144  TCP 66 59298 → 22 [ACK] Seq=921 Ack=14469 Win=3666 Len=0 TSval=4129345 TSecr=4725672
   70 0.586045249  10.6.15.144 → 192.168.1.16 SSH 138 Server: Encrypted packet (len=72)
   71 0.586074499 192.168.1.16 → 10.6.15.144  TCP 66 59298 → 22 [ACK] Seq=921 Ack=14541 Win=3666 Len=0 TSval=4129347 TSecr=4725685
   72 0.586329919 192.168.1.16 → 10.6.15.144  SSH 102 Client: Encrypted packet (len=36)
   73 0.590490930  10.6.15.144 → 192.168.1.16 SSH 138 Server: Encrypted packet (len=72)
   74 0.590784248 192.168.1.16 → 10.6.15.144  SSH 102 Client: Encrypted packet (len=36)
   75 0.593655932  10.6.15.144 → 192.168.1.16 SSH 138 Server: Encrypted packet (len=72)
   76 0.593922227 192.168.1.16 → 10.6.15.144  SSH 102 Client: Encrypted packet (len=36)
   77 0.598350561 192.168.1.16 → 10.6.15.144  SSH 326 Client: Encrypted packet (len=260)
   78 0.600855279  10.6.15.144 → 192.168.1.16 TCP 66 22 → 59298 [ACK] Seq=14685 Ack=993 Win=1452 Len=0 TSval=4725689 TSecr=4129347
   79 0.603174822  10.6.15.144 → 192.168.1.16 SSH 150 Server: Encrypted packet (len=84)
   80 0.608598016  10.6.15.144 → 192.168.1.16 TCP 66 22 → 59298 [ACK] Seq=14769 Ack=1289 Win=1452 Len=0 TSval=4725691 TSecr=4129349
   81 0.636031017  10.6.15.144 → 192.168.1.16 SSH 182 Server: Encrypted packet (len=116)
   82 0.636046863 192.168.1.16 → 10.6.15.144  TCP 66 59298 → 22 [ACK] Seq=1289 Ack=14885 Win=3666 Len=0 TSval=4129359 TSecr=4725689
   83 0.637300160  10.6.15.144 → 192.168.1.16 SSH 138 Server: Encrypted packet (len=72)
   84 0.637520728 192.168.1.16 → 10.6.15.144  SSH 102 Client: Encrypted packet (len=36)
   85 0.641623953  10.6.15.144 → 192.168.1.16 SSH 102 Server: Encrypted packet (len=36)
   86 0.642098399 192.168.1.16 → 10.6.15.144  SSH 118 Client: Encrypted packet (len=52)
   87 0.650422504  10.6.15.144 → 192.168.1.16 TCP 66 22 → 59298 [ACK] Seq=14993 Ack=1377 Win=1452 Len=0 TSval=4725702 TSecr=4129359
   88 0.893368523 192.168.1.16 → 10.6.15.144  SSH 550 Client: Encrypted packet (len=484)
   89 0.895295327 192.168.1.16 → 10.6.15.144  SSH 510 Client: Encrypted packet (len=444)
   90 0.896024411  10.6.15.144 → 192.168.1.16 SSH 166 Server: Encrypted packet (len=100)
   91 0.896271126 192.168.1.16 → 10.6.15.144  SSH 102 Client: Encrypted packet (len=36)
   92 0.905876185  10.6.15.144 → 192.168.1.16 TCP 66 22 → 59298 [ACK] Seq=15093 Ack=2305 Win=1452 Len=0 TSval=4725765 TSecr=4129423
   93 0.911578808  10.6.15.144 → 192.168.1.16 SSH 262 Server: Encrypted packet (len=196)
   94 0.911601194  10.6.15.144 → 192.168.1.16 SSH 254 Server: Encrypted packet (len=188)
   95 0.911668004 192.168.1.16 → 10.6.15.144  TCP 66 59298 → 22 [ACK] Seq=2341 Ack=15477 Win=3666 Len=0 TSval=4129428 TSecr=4725766
   96 0.912973933 192.168.1.16 → 10.6.15.144  SSH 134 Client: Encrypted packet (len=68)
   97 0.939147027 192.168.1.16 → 10.6.15.144  SSH 686 Client: Encrypted packet (len=620)
   98 0.949464947  10.6.15.144 → 192.168.1.16 TCP 66 22 → 59298 [ACK] Seq=15477 Ack=3029 Win=1452 Len=0 TSval=4725776 TSecr=4129428
   99 0.952883186  10.6.15.144 → 192.168.1.16 SSH 286 Server: Encrypted packet (len=220)
  100 0.953866555 192.168.1.16 → 10.6.15.144  SSH 134 Client: Encrypted packet (len=68)
  101 1.002351574  10.6.15.144 → 192.168.1.16 TCP 66 22 → 59298 [ACK] Seq=15697 Ack=3097 Win=1452 Len=0 TSval=4725790 TSecr=4129439
  102 1.087000454  10.6.15.144 → 192.168.1.16 SSH 138 Server: Encrypted packet (len=72)
  103 1.087223896 192.168.1.16 → 10.6.15.144  SSH 102 Client: Encrypted packet (len=36)
  104 1.094530935  10.6.15.144 → 192.168.1.16 SSH 1514 Server: Encrypted packet (len=1448)
  105 1.094590173  10.6.15.144 → 192.168.1.16 SSH 1062 Server: Encrypted packet (len=996)
  106 1.094605932 192.168.1.16 → 10.6.15.144  TCP 66 59298 → 22 [ACK] Seq=3133 Ack=18213 Win=3666 Len=0 TSval=4129474 TSecr=4725812
  107 1.097227004  10.6.15.144 → 192.168.1.16 TCP 66 [TCP Previous segment not captured] 22 → 59298 [ACK] Seq=19661 Ack=3133 Win=1452 Len=0 TSval=4725813 TSecr=4129472
  108 1.105080408  10.6.15.144 → 192.168.1.16 SSH 1514 Server: Encrypted packet (len=1448)
  109 1.105097666 192.168.1.16 → 10.6.15.144  TCP 78 [TCP Dup ACK 106#1] 59298 → 22 [ACK] Seq=3133 Ack=18213 Win=3666 Len=0 TSval=4129476 TSecr=4725812 SLE=19661 SRE=21109
  110 1.105247334  10.6.15.144 → 192.168.1.16 SSH 1514 Server: Encrypted packet (len=1448)
  111 1.105254307 192.168.1.16 → 10.6.15.144  TCP 78 [TCP Dup ACK 106#2] 59298 → 22 [ACK] Seq=3133 Ack=18213 Win=3666 Len=0 TSval=4129476 TSecr=4725812 SLE=19661 SRE=22557
  112 1.116042043  10.6.15.144 → 192.168.1.16 SSH 1514 Server: Encrypted packet (len=1448)
  113 1.116059321 192.168.1.16 → 10.6.15.144  TCP 78 [TCP Dup ACK 106#3] 59298 → 22 [ACK] Seq=3133 Ack=18213 Win=3666 Len=0 TSval=4129479 TSecr=4725812 SLE=19661 SRE=24005
  114 1.116224756  10.6.15.144 → 192.168.1.16 SSH 1514 Server: Encrypted packet (len=1448)
  115 1.116232307 192.168.1.16 → 10.6.15.144  TCP 78 [TCP Dup ACK 106#4] 59298 → 22 [ACK] Seq=3133 Ack=18213 Win=3666 Len=0 TSval=4129479 TSecr=4725812 SLE=19661 SRE=25453
  116 1.116417256  10.6.15.144 → 192.168.1.16 SSH 1514 Server: Encrypted packet (len=1448)
  117 1.116424745 192.168.1.16 → 10.6.15.144  TCP 78 [TCP Dup ACK 106#5] 59298 → 22 [ACK] Seq=3133 Ack=18213 Win=3666 Len=0 TSval=4129479 TSecr=4725812 SLE=19661 SRE=26901
  118 1.126823869  10.6.15.144 → 192.168.1.16 SSH 1514 Server: [TCP Fast Retransmission] , Encrypted packet (len=1448)
  119 1.126852691 192.168.1.16 → 10.6.15.144  TCP 66 59298 → 22 [ACK] Seq=3133 Ack=26901 Win=3666 Len=0 TSval=4129482 TSecr=4725820
  120 1.126946125  10.6.15.144 → 192.168.1.16 SSH 1514 Server: Encrypted packet (len=1448)
  121 1.126953416 192.168.1.16 → 10.6.15.144  TCP 66 59298 → 22 [ACK] Seq=3133 Ack=28349 Win=3666 Len=0 TSval=4129482 TSecr=4725820
  122 1.137706356  10.6.15.144 → 192.168.1.16 SSH 1514 Server: Encrypted packet (len=1448)
  123 1.137729767 192.168.1.16 → 10.6.15.144  TCP 66 59298 → 22 [ACK] Seq=3133 Ack=29797 Win=3666 Len=0 TSval=4129484 TSecr=4725823
  124 1.137889077  10.6.15.144 → 192.168.1.16 SSH 1514 Server: Encrypted packet (len=1448)
  125 1.137898959 192.168.1.16 → 10.6.15.144  TCP 66 59298 → 22 [ACK] Seq=3133 Ack=31245 Win=3666 Len=0 TSval=4129485 TSecr=4725823
  126 1.138080010  10.6.15.144 → 192.168.1.16 SSH 1514 Server: Encrypted packet (len=1448)
  127 1.138091826 192.168.1.16 → 10.6.15.144  TCP 66 59298 → 22 [ACK] Seq=3133 Ack=32693 Win=3666 Len=0 TSval=4129485 TSecr=4725823
  128 1.148459289  10.6.15.144 → 192.168.1.16 SSH 1514 Server: Encrypted packet (len=1448)
  129 1.148479541 192.168.1.16 → 10.6.15.144  TCP 66 59298 → 22 [ACK] Seq=3133 Ack=34141 Win=3666 Len=0 TSval=4129487 TSecr=4725826
  130 1.148642219  10.6.15.144 → 192.168.1.16 SSH 1514 Server: Encrypted packet (len=1448)
  131 1.148652193 192.168.1.16 → 10.6.15.144  TCP 66 59298 → 22 [ACK] Seq=3133 Ack=35589 Win=3666 Len=0 TSval=4129487 TSecr=4725826
  132 1.148986979  10.6.15.144 → 192.168.1.16 SSH 1514 Server: Encrypted packet (len=1448)
  133 1.148998565 192.168.1.16 → 10.6.15.144  TCP 66 59298 → 22 [ACK] Seq=3133 Ack=37037 Win=3666 Len=0 TSval=4129487 TSecr=4725826
  134 1.159594974  10.6.15.144 → 192.168.1.16 SSH 1514 Server: Encrypted packet (len=1448)
  135 1.159614559 192.168.1.16 → 10.6.15.144  TCP 66 59298 → 22 [ACK] Seq=3133 Ack=38485 Win=3666 Len=0 TSval=4129490 TSecr=4725828
  136 1.159779514  10.6.15.144 → 192.168.1.16 SSH 1514 Server: Encrypted packet (len=1448)
  137 1.159790079 192.168.1.16 → 10.6.15.144  TCP 66 59298 → 22 [ACK] Seq=3133 Ack=39933 Win=3666 Len=0 TSval=4129490 TSecr=4725828
  138 1.159969998  10.6.15.144 → 192.168.1.16 SSH 1514 Server: Encrypted packet (len=1448)
  139 1.159979920 192.168.1.16 → 10.6.15.144  TCP 66 59298 → 22 [ACK] Seq=3133 Ack=41381 Win=3666 Len=0 TSval=4129490 TSecr=4725828
  140 1.160314948  10.6.15.144 → 192.168.1.16 SSH 1514 Server: Encrypted packet (len=1448)
  141 1.160325132 192.168.1.16 → 10.6.15.144  TCP 66 59298 → 22 [ACK] Seq=3133 Ack=42829 Win=3666 Len=0 TSval=4129490 TSecr=4725828
  142 1.172394263  10.6.15.144 → 192.168.1.16 SSH 1514 Server: Encrypted packet (len=1448)
  143 1.172414149 192.168.1.16 → 10.6.15.144  TCP 66 59298 → 22 [ACK] Seq=3133 Ack=44277 Win=3666 Len=0 TSval=4129493 TSecr=4725831
  144 1.172577911  10.6.15.144 → 192.168.1.16 SSH 1514 Server: Encrypted packet (len=1448)
  145 1.172587855 192.168.1.16 → 10.6.15.144  TCP 66 59298 → 22 [ACK] Seq=3133 Ack=45725 Win=3666 Len=0 TSval=4129493 TSecr=4725831
  146 1.172771115  10.6.15.144 → 192.168.1.16 SSH 1514 Server: Encrypted packet (len=1448)
  147 1.172779784 192.168.1.16 → 10.6.15.144  TCP 66 59298 → 22 [ACK] Seq=3133 Ack=47173 Win=3666 Len=0 TSval=4129493 TSecr=4725831
  148 1.172962719  10.6.15.144 → 192.168.1.16 SSH 1514 Server: Encrypted packet (len=1448)
  149 1.184166243  10.6.15.144 → 192.168.1.16 SSH 1514 Server: [TCP Previous segment not captured] , Encrypted packet (len=1448)
  150 1.184187941 192.168.1.16 → 10.6.15.144  TCP 78 59298 → 22 [ACK] Seq=3133 Ack=48621 Win=3666 Len=0 TSval=4129496 TSecr=4725831 SLE=50069 SRE=51517
  151 1.195340376  10.6.15.144 → 192.168.1.16 SSH 1514 Server: Encrypted packet (len=1448)
  152 1.195369275 192.168.1.16 → 10.6.15.144  TCP 78 [TCP Dup ACK 150#1] 59298 → 22 [ACK] Seq=3133 Ack=48621 Win=3666 Len=0 TSval=4129499 TSecr=4725831 SLE=50069 SRE=52965
  153 1.195525988  10.6.15.144 → 192.168.1.16 SSH 1514 Server: [TCP Previous segment not captured] , Encrypted packet (len=1448)
  154 1.195537679 192.168.1.16 → 10.6.15.144  TCP 86 [TCP Dup ACK 150#2] 59298 → 22 [ACK] Seq=3133 Ack=48621 Win=3666 Len=0 TSval=4129499 TSecr=4725831 SLE=54413 SRE=55861 SLE=50069 SRE=52965
  155 1.206122438  10.6.15.144 → 192.168.1.16 SSH 1514 Server: Encrypted packet (len=1448)
  156 1.206144969 192.168.1.16 → 10.6.15.144  TCP 86 [TCP Dup ACK 150#3] 59298 → 22 [ACK] Seq=3133 Ack=48621 Win=3666 Len=0 TSval=4129502 TSecr=4725831 SLE=54413 SRE=57309 SLE=50069 SRE=52965
  157 1.206307070  10.6.15.144 → 192.168.1.16 SSH 1514 Server: [TCP Fast Retransmission] , Encrypted packet (len=1448)
  158 1.206326221 192.168.1.16 → 10.6.15.144  TCP 78 59298 → 22 [ACK] Seq=3133 Ack=52965 Win=3666 Len=0 TSval=4129502 TSecr=4725840 SLE=54413 SRE=57309
  159 1.217388267  10.6.15.144 → 192.168.1.16 SSH 1514 Server: Encrypted packet (len=1448)
  160 1.217410841 192.168.1.16 → 10.6.15.144  TCP 78 [TCP Dup ACK 158#1] 59298 → 22 [ACK] Seq=3133 Ack=52965 Win=3666 Len=0 TSval=4129504 TSecr=4725840 SLE=54413 SRE=58757
  161 1.227788366  10.6.15.144 → 192.168.1.16 TCP 1514 [TCP Retransmission] 22 → 59298 [ACK] Seq=52965 Ack=3133 Win=1452 Len=1448 TSval=4725845 TSecr=4129504
  162 1.227816822 192.168.1.16 → 10.6.15.144  TCP 66 59298 → 22 [ACK] Seq=3133 Ack=58757 Win=3666 Len=0 TSval=4129507 TSecr=4725845
  163 1.227972266  10.6.15.144 → 192.168.1.16 SSH 1514 Server: Encrypted packet (len=1448)
  164 1.227983189 192.168.1.16 → 10.6.15.144  TCP 66 59298 → 22 [ACK] Seq=3133 Ack=60205 Win=3666 Len=0 TSval=4129507 TSecr=4725845
  165 1.228104425 192.168.1.16 → 10.6.15.144  SSH 102 Client: Encrypted packet (len=36)
  166 1.239275070  10.6.15.144 → 192.168.1.16 SSH 1514 Server: [TCP Previous segment not captured] , Encrypted packet (len=1448)
  167 1.239298456 192.168.1.16 → 10.6.15.144  TCP 78 [TCP Dup ACK 164#1] 59298 → 22 [ACK] Seq=3169 Ack=60205 Win=3666 Len=0 TSval=4129510 TSecr=4725845 SLE=61653 SRE=63101
  168 1.249227113  10.6.15.144 → 192.168.1.16 SSH 1514 Server: [TCP Previous segment not captured] , Encrypted packet (len=1448)
  169 1.249251064 192.168.1.16 → 10.6.15.144  TCP 86 [TCP Dup ACK 164#2] 59298 → 22 [ACK] Seq=3169 Ack=60205 Win=3666 Len=0 TSval=4129512 TSecr=4725845 SLE=64549 SRE=65997 SLE=61653 SRE=63101
  170 1.258920406  10.6.15.144 → 192.168.1.16 SSH 1514 Server: [TCP Fast Retransmission] , Encrypted packet (len=1448)
  171 1.258957297 192.168.1.16 → 10.6.15.144  TCP 78 59298 → 22 [ACK] Seq=3169 Ack=63101 Win=3666 Len=0 TSval=4129515 TSecr=4725853 SLE=64549 SRE=65997
  172 1.267307062  10.6.15.144 → 192.168.1.16 SSH 1514 Server: Encrypted packet (len=1448)
  173 1.267328947 192.168.1.16 → 10.6.15.144  TCP 78 [TCP Dup ACK 171#1] 59298 → 22 [ACK] Seq=3169 Ack=63101 Win=3666 Len=0 TSval=4129517 TSecr=4725853 SLE=64549 SRE=67445
  174 1.277164535  10.6.15.144 → 192.168.1.16 TCP 1514 [TCP Retransmission] 22 → 59298 [ACK] Seq=63101 Ack=3169 Win=1452 Len=1448 TSval=4725858 TSecr=4129517
  175 1.277198414 192.168.1.16 → 10.6.15.144  TCP 66 59298 → 22 [ACK] Seq=3169 Ack=67445 Win=3666 Len=0 TSval=4129519 TSecr=4725858
  176 1.277348140  10.6.15.144 → 192.168.1.16 SSH 1514 Server: Encrypted packet (len=1448)
  177 1.277355958 192.168.1.16 → 10.6.15.144  TCP 66 59298 → 22 [ACK] Seq=3169 Ack=68893 Win=3666 Len=0 TSval=4129519 TSecr=4725858
  178 1.287470110  10.6.15.144 → 192.168.1.16 SSH 1514 Server: Encrypted packet (len=1448)
  179 1.287490154 192.168.1.16 → 10.6.15.144  TCP 66 59298 → 22 [ACK] Seq=3169 Ack=70341 Win=3666 Len=0 TSval=4129522 TSecr=4725860
  180 1.287650243  10.6.15.144 → 192.168.1.16 SSH 1514 Server: Encrypted packet (len=1448)
  181 1.287658253 192.168.1.16 → 10.6.15.144  TCP 66 59298 → 22 [ACK] Seq=3169 Ack=71789 Win=3666 Len=0 TSval=4129522 TSecr=4725860
  182 1.287842107  10.6.15.144 → 192.168.1.16 SSH 1514 Server: Encrypted packet (len=1448)
  183 1.287850501 192.168.1.16 → 10.6.15.144  TCP 66 59298 → 22 [ACK] Seq=3169 Ack=73237 Win=3666 Len=0 TSval=4129522 TSecr=4725860
  184 1.298411390  10.6.15.144 → 192.168.1.16 SSH 1514 Server: Encrypted packet (len=1448)
  185 1.298431394 192.168.1.16 → 10.6.15.144  TCP 66 59298 → 22 [ACK] Seq=3169 Ack=74685 Win=3666 Len=0 TSval=4129525 TSecr=4725863
  186 1.298594477  10.6.15.144 → 192.168.1.16 SSH 1514 Server: Encrypted packet (len=1448)
  187 1.298603765 192.168.1.16 → 10.6.15.144  TCP 66 59298 → 22 [ACK] Seq=3169 Ack=76133 Win=3666 Len=0 TSval=4129525 TSecr=4725863
  188 1.298799440  10.6.15.144 → 192.168.1.16 SSH 598 Server: Encrypted packet (len=532)
  189 1.298806821 192.168.1.16 → 10.6.15.144  TCP 66 59298 → 22 [ACK] Seq=3169 Ack=76665 Win=3666 Len=0 TSval=4129525 TSecr=4725863
  190 5.707764853 192.168.1.16 → 52.66.5.185  NTP 90 NTP Version 4, client
  191 7.008954060 10.22.18.209 → 224.0.0.252  LLMNR 64 Standard query 0x269f A wpad
  192 7.009336241 10.22.18.209 → 224.0.0.252  LLMNR 64 Standard query 0x269f A wpad
  193 7.110361764  10.22.17.29 → 224.0.0.252  LLMNR 64 Standard query 0x445f A wpad
  194 8.033051926 10.22.17.220 → 224.0.0.252  LLMNR 64 Standard query 0x58f7 A wpad
  195 8.033405540  10.22.17.29 → 224.0.0.252  LLMNR 64 Standard query 0x445f A wpad
  196 8.033789677 10.22.17.220 → 224.0.0.252  LLMNR 64 Standard query 0x58f7 A wpad
  197 8.509836636 192.168.1.16 → 74.125.68.95 TCP 66 49060 → 443 [ACK] Seq=1 Ack=1 Win=262 Len=0 TSval=4131328 TSecr=880027227
  198 8.558624591 74.125.68.95 → 192.168.1.16 TCP 66 [TCP ACKed unseen segment] 443 → 49060 [ACK] Seq=1 Ack=2 Win=177 Len=0 TSval=880072282 TSecr=4086116
  199 9.707826320 192.168.1.16 → 52.66.5.185  NTP 90 NTP Version 4, client
  200 11.009913422 192.168.1.16 → 10.6.15.144  SSH 1514 Client: Encrypted packet (len=1448)
  201 11.010829355 192.168.1.16 → 10.6.15.144  SSH 302 Client: Encrypted packet (len=236)
  202 11.021005088  10.6.15.144 → 192.168.1.16 TCP 66 22 → 59298 [ACK] Seq=76665 Ack=4853 Win=1452 Len=0 TSval=4728294 TSecr=4131953
  203 11.025362013  10.6.15.144 → 192.168.1.16 SSH 142 Server: Encrypted packet (len=76)
  204 11.025379310 192.168.1.16 → 10.6.15.144  TCP 66 59298 → 22 [ACK] Seq=4853 Ack=76741 Win=3666 Len=0 TSval=4131956 TSecr=4728295
  205 12.031928570  10.6.15.144 → 192.168.1.16 SSH 1046 Server: Encrypted packet (len=980)
  206 12.031953155 192.168.1.16 → 10.6.15.144  TCP 66 59298 → 22 [ACK] Seq=4853 Ack=77721 Win=3666 Len=0 TSval=4132208 TSecr=4728324
  207 12.032402892  10.6.15.144 → 192.168.1.16 SSH 382 Server: Encrypted packet (len=316)
  208 12.032409948 192.168.1.16 → 10.6.15.144  TCP 66 59298 → 22 [ACK] Seq=4853 Ack=78037 Win=3666 Len=0 TSval=4132208 TSecr=4728325
  209 12.032860574  10.6.15.144 → 192.168.1.16 SSH 382 Server: [TCP Spurious Retransmission] , Encrypted packet (len=316)
  210 12.032869739 192.168.1.16 → 10.6.15.144  TCP 78 [TCP Dup ACK 208#1] 59298 → 22 [ACK] Seq=4853 Ack=78037 Win=3666 Len=0 TSval=4132208 TSecr=4728331 SLE=77721 SRE=78037
  211 12.033538909  10.6.15.144 → 192.168.1.16 SSH 1362 Server: [TCP Spurious Retransmission] , Encrypted packet (len=1296)
  212 12.033551800 192.168.1.16 → 10.6.15.144  TCP 78 [TCP Dup ACK 208#2] 59298 → 22 [ACK] Seq=4853 Ack=78037 Win=3666 Len=0 TSval=4132208 TSecr=4728387 SLE=76741 SRE=78037
  213 12.033687802 192.168.1.16 → 10.6.15.144  SSH 134 Client: Encrypted packet (len=68)
  214 12.034528558  10.6.15.144 → 192.168.1.16 SSH 1362 Server: [TCP Spurious Retransmission] , Encrypted packet (len=1296)
  215 12.034548442 192.168.1.16 → 10.6.15.144  TCP 78 [TCP Dup ACK 208#3] 59298 → 22 [ACK] Seq=4921 Ack=78037 Win=3666 Len=0 TSval=4132209 TSecr=4728499 SLE=76741 SRE=78037
  216 12.076999003  10.22.17.29 → 224.0.0.252  LLMNR 64 Standard query 0x4756 A wpad
  217 12.083370261  10.6.15.144 → 192.168.1.16 TCP 66 22 → 59298 [ACK] Seq=78037 Ack=4921 Win=1452 Len=0 TSval=4728560 TSecr=4132208
  218 12.088650044 10.22.17.220 → 224.0.0.252  LLMNR 64 Standard query 0xf316 A wpad
  219 12.707836455 192.168.1.16 → 139.59.21.22 NTP 90 NTP Version 4, client
  220 12.709483811  10.22.17.29 → 224.0.0.252  LLMNR 64 Standard query 0x4756 A wpad
  221 12.709506983 10.22.17.220 → 224.0.0.252  LLMNR 64 Standard query 0xf316 A wpad
  222 14.106515362 10.22.17.220 → 224.0.0.252  LLMNR 67 Standard query 0x5da9 A xhezjof
  223 14.107341807 10.22.17.220 → 224.0.0.252  LLMNR 70 Standard query 0xc44f A lcwluexauq
  224 14.108236607 10.22.17.220 → 224.0.0.252  LLMNR 74 Standard query 0xd865 A yeonyorvxxincd
  225 15.007665126 10.22.18.209 → 224.0.0.252  LLMNR 64 Standard query 0x27d0 A wpad
  226 15.007688928 10.22.18.209 → 224.0.0.252  LLMNR 64 Standard query 0x27d0 A wpad
  227 15.007694349 10.22.17.220 → 224.0.0.252  LLMNR 67 Standard query 0x5da9 A xhezjof
  228 15.008111903 10.22.17.220 → 224.0.0.252  LLMNR 70 Standard query 0xc44f A lcwluexauq
  229 15.008134950 10.22.17.220 → 224.0.0.252  LLMNR 74 Standard query 0xd865 A yeonyorvxxincd
  230 16.113461833 10.22.18.100 → 224.0.0.252  LLMNR 64 Standard query 0xee2c A wpad
  231 16.113827229 10.22.18.100 → 224.0.0.252  LLMNR 64 Standard query 0xed6c AAAA wpad
  232 17.024372043 10.22.18.100 → 224.0.0.252  LLMNR 64 Standard query 0xee2c A wpad
  233 17.027676660 10.22.18.100 → 224.0.0.252  LLMNR 64 Standard query 0xed6c AAAA wpad
  234 20.110714189 10.22.17.220 → 224.0.0.252  LLMNR 67 Standard query 0xa765 A xhezjof
  235 20.110739217 10.22.17.220 → 224.0.0.252  LLMNR 74 Standard query 0x0b79 A yeonyorvxxincd
  236 20.112126185 10.22.17.220 → 224.0.0.252  LLMNR 70 Standard query 0x54cd A lcwluexauq
  237 21.023746168 10.22.17.220 → 224.0.0.252  LLMNR 74 Standard query 0x0b79 A yeonyorvxxincd
  238 21.023769693 10.22.17.220 → 224.0.0.252  LLMNR 67 Standard query 0xa765 A xhezjof
  239 21.023775548 10.22.17.220 → 224.0.0.252  LLMNR 70 Standard query 0x54cd A lcwluexauq
  240 23.007841467 10.22.18.209 → 224.0.0.252  LLMNR 64 Standard query 0x3319 A wpad
  241 23.007888273 10.22.18.209 → 224.0.0.252  LLMNR 64 Standard query 0x3319 A wpad
  242 23.046309704 192.168.1.16 → 239.255.255.250 SSDP 213 M-SEARCH * HTTP/1.1 
  243 24.047904942 192.168.1.16 → 239.255.255.250 SSDP 213 M-SEARCH * HTTP/1.1 
  244 25.048907074 192.168.1.16 → 239.255.255.250 SSDP 213 M-SEARCH * HTTP/1.1 
  245 26.049891023 192.168.1.16 → 239.255.255.250 SSDP 213 M-SEARCH * HTTP/1.1 
