    1 0.000000000  10.6.15.144 → 192.168.1.16 SSH 1514 Server: Encrypted packet (len=1448)
    2 0.000634700  10.6.15.144 → 192.168.1.16 SSH 1514 Server: Encrypted packet (len=1448)
    3 0.000651516 192.168.1.16 → 10.6.15.144  TCP 66 59298 → 22 [ACK] Seq=1 Ack=2897 Win=5703 Len=0 TSval=5806456 TSecr=6402494
    4 0.000918613  10.6.15.144 → 192.168.1.16 SSH 1514 Server: Encrypted packet (len=1448)
    5 0.001124889  10.6.15.144 → 192.168.1.16 SSH 1514 Server: Encrypted packet (len=1448)
    6 0.001142083 192.168.1.16 → 10.6.15.144  TCP 66 59298 → 22 [ACK] Seq=1 Ack=5793 Win=5703 Len=0 TSval=5806456 TSecr=6402494
    7 0.001273318  10.6.15.144 → 192.168.1.16 TCP 1514 [TCP Out-Of-Order] 22 → 59298 [ACK] Seq=1 Ack=1 Win=1452 Len=1448 TSval=6402607 TSecr=5806074
    8 0.001278819 192.168.1.16 → 10.6.15.144  TCP 78 [TCP Dup ACK 6#1] 59298 → 22 [ACK] Seq=1 Ack=5793 Win=5703 Len=0 TSval=5806456 TSecr=6402494 SLE=1 SRE=1449
    9 0.001285021 10.22.19.135 → 224.0.0.252  LLMNR 66 Standard query 0x5ee3 A DELL35
   10 0.001296467 10.22.19.135 → 224.0.0.252  LLMNR 66 Standard query 0x8404 AAAA DELL35
   11 0.001503640  10.6.15.144 → 192.168.1.16 TCP 1514 [TCP Out-Of-Order] 22 → 59298 [ACK] Seq=1 Ack=1 Win=1452 Len=1448 TSval=6402789 TSecr=5806074
   12 0.001509960 192.168.1.16 → 10.6.15.144  TCP 78 [TCP Dup ACK 6#2] 59298 → 22 [ACK] Seq=1 Ack=5793 Win=5703 Len=0 TSval=5806456 TSecr=6402494 SLE=1 SRE=1449
   13 0.012109624  10.6.15.144 → 192.168.1.16 SSH 1514 Server: Encrypted packet (len=1448)
   14 0.012130779 192.168.1.16 → 10.6.15.144  TCP 66 59298 → 22 [ACK] Seq=1 Ack=7241 Win=5703 Len=0 TSval=5806459 TSecr=6402833
   15 0.012288391  10.6.15.144 → 192.168.1.16 SSH 1514 Server: Encrypted packet (len=1448)
   16 0.012294991 192.168.1.16 → 10.6.15.144  TCP 66 59298 → 22 [ACK] Seq=1 Ack=8689 Win=5703 Len=0 TSval=5806459 TSecr=6402833
   17 0.012633699  10.6.15.144 → 192.168.1.16 SSH 1514 Server: Encrypted packet (len=1448)
   18 0.012643472 192.168.1.16 → 10.6.15.144  TCP 66 59298 → 22 [ACK] Seq=1 Ack=10137 Win=5703 Len=0 TSval=5806459 TSecr=6402833
   19 0.023146042  10.6.15.144 → 192.168.1.16 SSH 1514 Server: Encrypted packet (len=1448)
   20 0.023166758 192.168.1.16 → 10.6.15.144  TCP 66 59298 → 22 [ACK] Seq=1 Ack=11585 Win=5703 Len=0 TSval=5806462 TSecr=6402836
   21 0.023326908  10.6.15.144 → 192.168.1.16 SSH 1514 Server: Encrypted packet (len=1448)
   22 0.023335006 192.168.1.16 → 10.6.15.144  TCP 66 59298 → 22 [ACK] Seq=1 Ack=13033 Win=5703 Len=0 TSval=5806462 TSecr=6402836
   23 0.023518502  10.6.15.144 → 192.168.1.16 SSH 1514 Server: Encrypted packet (len=1448)
   24 0.023525556 192.168.1.16 → 10.6.15.144  TCP 66 59298 → 22 [ACK] Seq=1 Ack=14481 Win=5703 Len=0 TSval=5806462 TSecr=6402836
   25 0.034188727  10.6.15.144 → 192.168.1.16 SSH 1514 Server: Encrypted packet (len=1448)
   26 0.034210774 192.168.1.16 → 10.6.15.144  TCP 66 59298 → 22 [ACK] Seq=1 Ack=15929 Win=5703 Len=0 TSval=5806465 TSecr=6402838
   27 0.034367175  10.6.15.144 → 192.168.1.16 SSH 1514 Server: Encrypted packet (len=1448)
   28 0.034374458 192.168.1.16 → 10.6.15.144  TCP 66 59298 → 22 [ACK] Seq=1 Ack=17377 Win=5703 Len=0 TSval=5806465 TSecr=6402838
   29 0.034558866  10.6.15.144 → 192.168.1.16 SSH 1514 Server: Encrypted packet (len=1448)
   30 0.034565388 192.168.1.16 → 10.6.15.144  TCP 66 59298 → 22 [ACK] Seq=1 Ack=18825 Win=5703 Len=0 TSval=5806465 TSecr=6402838
   31 0.045034766  10.6.15.144 → 192.168.1.16 SSH 1514 Server: Encrypted packet (len=1448)
   32 0.045060866 192.168.1.16 → 10.6.15.144  TCP 66 59298 → 22 [ACK] Seq=1 Ack=20273 Win=5703 Len=0 TSval=5806467 TSecr=6402841
   33 0.045213937  10.6.15.144 → 192.168.1.16 SSH 1514 Server: Encrypted packet (len=1448)
   34 0.045219832 192.168.1.16 → 10.6.15.144  TCP 66 59298 → 22 [ACK] Seq=1 Ack=21721 Win=5703 Len=0 TSval=5806467 TSecr=6402841
   35 0.045561026  10.6.15.144 → 192.168.1.16 SSH 1514 Server: Encrypted packet (len=1448)
   36 0.045569128 192.168.1.16 → 10.6.15.144  TCP 66 59298 → 22 [ACK] Seq=1 Ack=23169 Win=5703 Len=0 TSval=5806467 TSecr=6402841
   37 0.045750383  10.6.15.144 → 192.168.1.16 SSH 1514 Server: Encrypted packet (len=1448)
   38 0.045756760 192.168.1.16 → 10.6.15.144  TCP 66 59298 → 22 [ACK] Seq=1 Ack=24617 Win=5703 Len=0 TSval=5806467 TSecr=6402841
   39 0.056593599  10.6.15.144 → 192.168.1.16 SSH 1514 Server: [TCP Previous segment not captured] , Encrypted packet (len=1448)
   40 0.056610211 192.168.1.16 → 10.6.15.144  TCP 78 [TCP Dup ACK 38#1] 59298 → 22 [ACK] Seq=1 Ack=24617 Win=5703 Len=0 TSval=5806470 TSecr=6402841 SLE=26065 SRE=27513
   41 0.067217412  10.6.15.144 → 192.168.1.16 SSH 1514 Server: [TCP Previous segment not captured] , Encrypted packet (len=1448)
   42 0.067228649 192.168.1.16 → 10.6.15.144  TCP 86 [TCP Dup ACK 38#2] 59298 → 22 [ACK] Seq=1 Ack=24617 Win=5703 Len=0 TSval=5806473 TSecr=6402841 SLE=30409 SRE=31857 SLE=26065 SRE=27513
   43 0.077701796  10.6.15.144 → 192.168.1.16 SSH 1514 Server: [TCP Fast Retransmission] , Encrypted packet (len=1448)
   44 0.077728956 192.168.1.16 → 10.6.15.144  TCP 78 59298 → 22 [ACK] Seq=1 Ack=27513 Win=5703 Len=0 TSval=5806475 TSecr=6402849 SLE=30409 SRE=31857
   45 0.142234524 192.168.1.16 → 10.6.15.144  SSH 290 Client: Encrypted packet (len=212)
   46 0.142513486 192.168.1.16 → 10.6.15.144  SSH 178 Client: Encrypted packet (len=100)
   47 0.150348722  10.6.15.144 → 192.168.1.16 TCP 66 22 → 59298 [ACK] Seq=31857 Ack=313 Win=1452 Len=0 TSval=6402868 TSecr=5806492
   48 1.984581651  10.6.15.144 → 192.168.1.16 TCP 1514 [TCP Retransmission] 22 → 59298 [ACK] Seq=27513 Ack=313 Win=1452 Len=1448 TSval=6403217 TSecr=5806492
   49 1.984607646 192.168.1.16 → 10.6.15.144  TCP 78 59298 → 22 [ACK] Seq=313 Ack=28961 Win=5703 Len=0 TSval=5806952 TSecr=6403217 SLE=30409 SRE=31857
   50 1.997137560  10.6.15.144 → 192.168.1.16 TCP 1514 [TCP Retransmission] 22 → 59298 [ACK] Seq=28961 Ack=313 Win=1452 Len=1448 TSval=6403329 TSecr=5806952
   51 1.997164531 192.168.1.16 → 10.6.15.144  TCP 66 59298 → 22 [ACK] Seq=313 Ack=31857 Win=5703 Len=0 TSval=5806955 TSecr=6403329
   52 1.997420397  10.6.15.144 → 192.168.1.16 SSH 1514 Server: Encrypted packet (len=1448)
   53 1.997428805 192.168.1.16 → 10.6.15.144  TCP 66 59298 → 22 [ACK] Seq=313 Ack=33305 Win=5703 Len=0 TSval=5806955 TSecr=6403329
   54 2.008031338  10.6.15.144 → 192.168.1.16 SSH 1514 Server: Encrypted packet (len=1448)
   55 2.008049439 192.168.1.16 → 10.6.15.144  TCP 66 59298 → 22 [ACK] Seq=313 Ack=34753 Win=5703 Len=0 TSval=5806958 TSecr=6403332
   56 2.008195761  10.6.15.144 → 192.168.1.16 SSH 1514 Server: [TCP Previous segment not captured] , Encrypted packet (len=1448)
   57 2.008201670 192.168.1.16 → 10.6.15.144  TCP 78 [TCP Dup ACK 55#1] 59298 → 22 [ACK] Seq=313 Ack=34753 Win=5703 Len=0 TSval=5806958 TSecr=6403332 SLE=36201 SRE=37649
   58 2.018762003  10.6.15.144 → 192.168.1.16 SSH 1514 Server: Encrypted packet (len=1448)
   59 2.018783039 192.168.1.16 → 10.6.15.144  TCP 78 [TCP Dup ACK 55#2] 59298 → 22 [ACK] Seq=313 Ack=34753 Win=5703 Len=0 TSval=5806961 TSecr=6403332 SLE=36201 SRE=39097
   60 2.019078882  10.6.15.144 → 192.168.1.16 SSH 1514 Server: Encrypted packet (len=1448)
   61 2.019098501 192.168.1.16 → 10.6.15.144  TCP 78 [TCP Dup ACK 55#3] 59298 → 22 [ACK] Seq=313 Ack=34753 Win=5703 Len=0 TSval=5806961 TSecr=6403332 SLE=36201 SRE=40545
   62 2.029015127  10.6.15.144 → 192.168.1.16 SSH 1514 Server: Encrypted packet (len=1448)
   63 2.029042769 192.168.1.16 → 10.6.15.144  TCP 78 [TCP Dup ACK 55#4] 59298 → 22 [ACK] Seq=313 Ack=34753 Win=5703 Len=0 TSval=5806963 TSecr=6403332 SLE=36201 SRE=41993
   64 2.029185218  10.6.15.144 → 192.168.1.16 SSH 1514 Server: [TCP Fast Retransmission] , Encrypted packet (len=1448)
   65 2.029193188 192.168.1.16 → 10.6.15.144  TCP 66 59298 → 22 [ACK] Seq=313 Ack=41993 Win=5703 Len=0 TSval=5806963 TSecr=6403337
   66 2.037988531  10.6.15.144 → 192.168.1.16 SSH 378 Server: Encrypted packet (len=312)
   67 2.038008395 192.168.1.16 → 10.6.15.144  TCP 66 59298 → 22 [ACK] Seq=313 Ack=42305 Win=5703 Len=0 TSval=5806966 TSecr=6403340
   68 2.161822688 192.168.1.16 → 10.6.15.144  SSH 478 Client: Encrypted packet (len=412)
   69 2.162899012 192.168.1.16 → 10.6.15.144  SSH 1106 Client: Encrypted packet (len=1040)
   70 2.173016627  10.6.15.144 → 192.168.1.16 TCP 66 22 → 59298 [ACK] Seq=42305 Ack=1765 Win=1452 Len=0 TSval=6403373 TSecr=5806994
   71 2.174775057  10.6.15.144 → 192.168.1.16 SSH 302 Server: Encrypted packet (len=236)
   72 2.174792320 192.168.1.16 → 10.6.15.144  TCP 66 59298 → 22 [ACK] Seq=1765 Ack=42541 Win=5703 Len=0 TSval=5807000 TSecr=6403374
   73 2.175495037  10.6.15.144 → 192.168.1.16 SSH 214 Server: Encrypted packet (len=148)
   74 2.175506496 192.168.1.16 → 10.6.15.144  TCP 66 59298 → 22 [ACK] Seq=1765 Ack=42689 Win=5703 Len=0 TSval=5807000 TSecr=6403374
   75 2.175580355 192.168.1.16 → 10.6.15.144  SSH 134 Client: Encrypted packet (len=68)
   76 2.185381026 192.168.1.16 → 10.6.15.144  SSH 102 Client: Encrypted packet (len=36)
   77 2.195205488  10.6.15.144 → 192.168.1.16 TCP 66 22 → 59298 [ACK] Seq=42689 Ack=1869 Win=1452 Len=0 TSval=6403379 TSecr=5807000
   78 2.221777798  10.6.15.144 → 192.168.1.16 SSH 390 Server: Encrypted packet (len=324)
   79 2.265779457 192.168.1.16 → 10.6.15.144  TCP 66 59298 → 22 [ACK] Seq=1869 Ack=43013 Win=5703 Len=0 TSval=5807023 TSecr=6403385
   80 2.270580532 192.168.1.16 → 10.6.15.144  SSH 1110 Client: Encrypted packet (len=1044)
   81 2.318989590  10.6.15.144 → 192.168.1.16 TCP 66 22 → 59298 [ACK] Seq=43013 Ack=2913 Win=1452 Len=0 TSval=6403410 TSecr=5807024
   82 2.319166401  10.6.15.144 → 192.168.1.16 SSH 454 Server: Encrypted packet (len=388)
   83 2.319174795 192.168.1.16 → 10.6.15.144  TCP 66 59298 → 22 [ACK] Seq=2913 Ack=43401 Win=5703 Len=0 TSval=5807036 TSecr=6403410
   84 2.319190040  10.6.15.144 → 192.168.1.16 SSH 102 Server: Encrypted packet (len=36)
   85 2.319193551 192.168.1.16 → 10.6.15.144  TCP 66 59298 → 22 [ACK] Seq=2913 Ack=43437 Win=5703 Len=0 TSval=5807036 TSecr=6403410
   86 2.320608011 192.168.1.16 → 10.6.15.144  SSH 138 Client: Encrypted packet (len=72)
   87 2.330329922  10.6.15.144 → 192.168.1.16 TCP 66 22 → 59298 [ACK] Seq=43437 Ack=2985 Win=1452 Len=0 TSval=6403413 TSecr=5807036
   88 2.330350812  10.6.15.144 → 192.168.1.16 SSH 102 Server: Encrypted packet (len=36)
   89 2.373831334 192.168.1.16 → 10.6.15.144  TCP 66 59298 → 22 [ACK] Seq=2985 Ack=43473 Win=5703 Len=0 TSval=5807050 TSecr=6403413
   90 2.408992715  10.6.15.144 → 192.168.1.16 SSH 110 Server: Encrypted packet (len=44)
   91 2.409018623 192.168.1.16 → 10.6.15.144  TCP 66 59298 → 22 [ACK] Seq=2985 Ack=43517 Win=5703 Len=0 TSval=5807058 TSecr=6403432
   92 2.409392627 192.168.1.16 → 10.6.15.144  SSH 158 Client: Encrypted packet (len=92)
   93 2.458167764  10.6.15.144 → 192.168.1.16 TCP 66 22 → 59298 [ACK] Seq=43517 Ack=3077 Win=1452 Len=0 TSval=6403445 TSecr=5807058
   94 3.999806453  10.6.15.144 → 192.168.1.16 SSH 238 Server: Encrypted packet (len=172)
   95 3.999844993  10.6.15.144 → 192.168.1.16 TCP 238 [TCP Retransmission] 22 → 59298 [PSH, ACK] Seq=43517 Ack=3077 Win=1452 Len=172 TSval=6403550 TSecr=5807058
   96 3.999861723 192.168.1.16 → 10.6.15.144  TCP 78 59298 → 22 [ACK] Seq=3077 Ack=43689 Win=5703 Len=0 TSval=5807456 TSecr=6403550 SLE=43517 SRE=43689
   97 3.999886315  10.6.15.144 → 192.168.1.16 SSH 238 Server: [TCP Spurious Retransmission] , Encrypted packet (len=172)
   98 3.999893185 192.168.1.16 → 10.6.15.144  TCP 78 [TCP Dup ACK 96#1] 59298 → 22 [ACK] Seq=3077 Ack=43689 Win=5703 Len=0 TSval=5807456 TSecr=6403657 SLE=43517 SRE=43689
   99 3.999904611 10.22.19.135 → 224.0.0.252  LLMNR 66 Standard query 0x0dd1 A DELL35
  100 3.999933883 10.22.19.135 → 224.0.0.252  LLMNR 66 Standard query 0xb4ff AAAA DELL35
  101 4.000510529 192.168.1.16 → 10.6.15.144  SSH 134 Client: Encrypted packet (len=68)
  102 4.001128207 192.168.1.16 → 10.6.15.144  SSH 870 Client: Encrypted packet (len=804)
  103 4.010041640  10.6.15.144 → 192.168.1.16 TCP 66 22 → 59298 [ACK] Seq=43689 Ack=3145 Win=1452 Len=0 TSval=6403833 TSecr=5807456
  104 4.010873329  10.6.15.144 → 192.168.1.16 TCP 66 22 → 59298 [ACK] Seq=43689 Ack=3949 Win=1452 Len=0 TSval=6403833 TSecr=5807456
  105 4.144215240 192.168.1.16 → 10.6.15.144  SSH 206 Client: Encrypted packet (len=140)
  106 4.154999065  10.6.15.144 → 192.168.1.16 TCP 66 22 → 59298 [ACK] Seq=43689 Ack=4089 Win=1452 Len=0 TSval=6403869 TSecr=5807492
  107 4.992267214  10.6.15.144 → 192.168.1.16 SSH 150 Server: Encrypted packet (len=84)
  108 4.992285799  10.6.15.144 → 192.168.1.16 SSH 302 Server: Encrypted packet (len=236)
  109 4.992313213  10.6.15.144 → 192.168.1.16 TCP 302 [TCP Retransmission] 22 → 59298 [PSH, ACK] Seq=43773 Ack=4089 Win=1452 Len=236 TSval=6404010 TSecr=5807492
  110 4.992321594 192.168.1.16 → 10.6.15.144  TCP 78 59298 → 22 [ACK] Seq=4089 Ack=44009 Win=5703 Len=0 TSval=5807704 TSecr=6403903 SLE=43773 SRE=44009
  111 5.983913059  10.6.15.144 → 192.168.1.16 SSH 262 Server: Encrypted packet (len=196)
  112 5.983957952 192.168.1.16 → 10.6.15.144  TCP 66 59298 → 22 [ACK] Seq=4089 Ack=44205 Win=5703 Len=0 TSval=5807952 TSecr=6404237
  113 5.988297537 192.168.1.16 → 10.6.15.144  SSH 190 Client: Encrypted packet (len=124)
  114 5.988529107 192.168.1.16 → 10.6.15.144  SSH 190 Client: Encrypted packet (len=124)
  115 5.997772574  10.6.15.144 → 192.168.1.16 TCP 66 22 → 59298 [ACK] Seq=44205 Ack=4213 Win=1452 Len=0 TSval=6404330 TSecr=5807953
  116 5.997784025  10.6.15.144 → 192.168.1.16 TCP 66 22 → 59298 [ACK] Seq=44205 Ack=4337 Win=1452 Len=0 TSval=6404330 TSecr=5807953
  117 6.086393889  10.6.15.144 → 192.168.1.16 SSH 282 Server: Encrypted packet (len=216)
  118 6.086960423 192.168.1.16 → 10.6.15.144  SSH 174 Client: Encrypted packet (len=108)
  119 6.097334620  10.6.15.144 → 192.168.1.16 TCP 66 22 → 59298 [ACK] Seq=44421 Ack=4445 Win=1452 Len=0 TSval=6404354 TSecr=5807978
  120 8.000122614 10.22.19.135 → 224.0.0.252  LLMNR 66 Standard query 0xd22d A DELL35
  121 8.000156723 10.22.19.135 → 224.0.0.252  LLMNR 66 Standard query 0x974f AAAA DELL35
  122 8.992217089  10.6.15.144 → 192.168.1.16 SSH 134 Server: Encrypted packet (len=68)
  123 8.992240369  10.6.15.144 → 192.168.1.16 SSH 102 Server: Encrypted packet (len=36)
  124 8.992323465 192.168.1.16 → 10.6.15.144  TCP 66 59298 → 22 [ACK] Seq=4445 Ack=44525 Win=5703 Len=0 TSval=5808704 TSecr=6405028
  125 8.999544078  10.6.15.144 → 192.168.1.16 SSH 162 Server: Encrypted packet (len=96)
  126 9.008133033  192.168.1.1 → 239.255.255.250 SSDP 302 NOTIFY * HTTP/1.1 
  127 9.013682207  192.168.1.1 → 239.255.255.250 SSDP 311 NOTIFY * HTTP/1.1 
  128 9.020132713  192.168.1.1 → 239.255.255.250 SSDP 374 NOTIFY * HTTP/1.1 
  129 9.026306805  192.168.1.1 → 239.255.255.250 SSDP 370 NOTIFY * HTTP/1.1 
  130 9.032211833  192.168.1.1 → 239.255.255.250 SSDP 350 NOTIFY * HTTP/1.1 
  131 9.038811509  192.168.1.1 → 239.255.255.250 SSDP 382 NOTIFY * HTTP/1.1 
  132 9.041839763 192.168.1.16 → 10.6.15.144  TCP 66 59298 → 22 [ACK] Seq=4445 Ack=44621 Win=5703 Len=0 TSval=5808717 TSecr=6405081
  133 9.045037472  192.168.1.1 → 239.255.255.250 SSDP 364 NOTIFY * HTTP/1.1 
  134 9.051533344  192.168.1.1 → 239.255.255.250 SSDP 366 NOTIFY * HTTP/1.1 
  135 9.056811365  192.168.1.1 → 239.255.255.250 SSDP 302 NOTIFY * HTTP/1.1 
  136 9.062365137  192.168.1.1 → 239.255.255.250 SSDP 311 NOTIFY * HTTP/1.1 
  137 9.068555805  192.168.1.1 → 239.255.255.250 SSDP 374 NOTIFY * HTTP/1.1 
  138 9.074712639  192.168.1.1 → 239.255.255.250 SSDP 370 NOTIFY * HTTP/1.1 
  139 9.080698654  192.168.1.1 → 239.255.255.250 SSDP 350 NOTIFY * HTTP/1.1 
  140 9.087548667  192.168.1.1 → 239.255.255.250 SSDP 382 NOTIFY * HTTP/1.1 
  141 9.093876937  192.168.1.1 → 239.255.255.250 SSDP 364 NOTIFY * HTTP/1.1 
  142 9.100111869  192.168.1.1 → 239.255.255.250 SSDP 366 NOTIFY * HTTP/1.1 
  143 11.007867370  10.22.17.98 → 224.0.0.252  LLMNR 64 Standard query 0x99b1 A wpad
  144 11.007905083  10.22.17.98 → 224.0.0.252  LLMNR 64 Standard query 0x99b1 A wpad
  145 11.010885096 192.168.1.16 → 10.6.15.144  SSH 1514 Client: Encrypted packet (len=1448)
  146 11.011643258 192.168.1.16 → 10.6.15.144  SSH 374 Client: Encrypted packet (len=308)
  147 11.021870173  10.6.15.144 → 192.168.1.16 TCP 66 22 → 59298 [ACK] Seq=44621 Ack=6201 Win=1447 Len=0 TSval=6405585 TSecr=5809209
  148 11.024984831  10.6.15.144 → 192.168.1.16 SSH 142 Server: Encrypted packet (len=76)
  149 11.025017190 192.168.1.16 → 10.6.15.144  TCP 66 59298 → 22 [ACK] Seq=6201 Ack=44697 Win=5703 Len=0 TSval=5809212 TSecr=6405586
  150 19.666173156 ZioncomE_53:dd:d4 → HonHaiPr_1f:71:b9 EAPOL 135 Key (Message 1 of 4)
  151 19.666309918 HonHaiPr_1f:71:b9 → ZioncomE_53:dd:d4 EAPOL 135 Key (Message 2 of 4)
  152 19.671436529 ZioncomE_53:dd:d4 → HonHaiPr_1f:71:b9 EAPOL 169 Key (Message 3 of 4)
  153 19.671539783 HonHaiPr_1f:71:b9 → ZioncomE_53:dd:d4 EAPOL 113 Key (Message 4 of 4)
  154 19.685787408 fe80::60bd:1940:a0d8:49f9 → ff02::16     ICMPv6 90 Multicast Listener Report Message v2
  155 19.685818969 192.168.1.16 → 224.0.0.252  IGMPv2 46 Membership Report group 224.0.0.252
  156 19.784008025 192.168.1.16 → 224.0.0.252  LLMNR 73 Standard query 0x84cf ANY theenterprise
  157 19.784065431 fe80::60bd:1940:a0d8:49f9 → ff02::1:3    LLMNR 93 Standard query 0x82b9 ANY theenterprise
  158 19.932160119 192.168.1.16 → 224.0.0.252  LLMNR 73 Standard query 0x84cf ANY theenterprise
  159 19.932952121 fe80::60bd:1940:a0d8:49f9 → ff02::1:3    LLMNR 93 Standard query 0x82b9 ANY theenterprise
  160 20.029836364 fe80::60bd:1940:a0d8:49f9 → ff02::16     ICMPv6 90 Multicast Listener Report Message v2
  161 20.041302259  10.6.15.144 → 192.168.1.16 SSH 1490 Server: Encrypted packet (len=1424)
  162 20.041335259 192.168.1.16 → 10.6.15.144  TCP 66 [TCP Previous segment not captured] 59298 → 22 [ACK] Seq=6289 Ack=46121 Win=5703 Len=0 TSval=5811466 TSecr=6407840
  163 20.068861071  10.6.15.144 → 192.168.1.16 SSH 1490 Server: Encrypted packet (len=1424)
  164 20.068889127 192.168.1.16 → 10.6.15.144  TCP 66 59298 → 22 [ACK] Seq=6289 Ack=47545 Win=5703 Len=0 TSval=5811473 TSecr=6407843
  165 20.189879694 192.168.1.16 → 224.0.0.252  LLMNR 73 Standard query 0x84cf ANY theenterprise
  166 20.190658419 fe80::60bd:1940:a0d8:49f9 → ff02::1:3    LLMNR 93 Standard query 0x82b9 ANY theenterprise
  167 20.384672392 192.168.1.16 → 54.76.71.168 TCP 128 42414 → 8282 [PSH, ACK] Seq=1 Ack=1 Win=296 Len=62 TSval=5811552 TSecr=609915230
  168 20.683918264 192.168.1.16 → 139.59.21.22 NTP 90 NTP Version 4, client
  169 20.688688643 54.76.71.168 → 192.168.1.16 TCP 66 8282 → 42414 [ACK] Seq=1 Ack=63 Win=121 Len=0 TSval=609923528 TSecr=5811552
  170 20.700216128 10.119.73.122 → 192.168.1.16 ICMP 110 Destination unreachable (Communication administratively filtered)
  171 21.175839628 192.168.1.16 → 239.255.255.250 SSDP 213 M-SEARCH * HTTP/1.1 
  172 21.179419022 10.22.17.187 → 224.0.0.252  LLMNR 64 Standard query 0x1a76 A wpad
  173 21.983849528 10.22.17.187 → 224.0.0.252  LLMNR 64 Standard query 0x1a76 A wpad
  174 22.176546833 192.168.1.16 → 239.255.255.250 SSDP 213 M-SEARCH * HTTP/1.1 
  175 23.085849405  10.22.18.99 → 224.0.0.252  LLMNR 64 Standard query 0xccb0 A wpad
  176 23.177613732 192.168.1.16 → 239.255.255.250 SSDP 213 M-SEARCH * HTTP/1.1 
  177 23.185598395  10.22.18.99 → 224.0.0.252  LLMNR 64 Standard query 0xccb0 A wpad
  178 24.176666767 192.168.1.16 → 224.0.0.251  MDNS 82 Standard query 0x0000 PTR _googlecast._tcp.local, "QM" question
  179 24.177438262 fe80::60bd:1940:a0d8:49f9 → ff02::fb     MDNS 102 Standard query 0x0000 PTR _googlecast._tcp.local, "QM" question
  180 24.177445923 192.168.1.16 → 224.0.0.251  MDNS 82 Standard query 0x0000 PTR _googlecast._tcp.local, "QM" question
  181 24.177448812 fe80::60bd:1940:a0d8:49f9 → ff02::fb     MDNS 102 Standard query 0x0000 PTR _googlecast._tcp.local, "QM" question
  182 24.177932664 192.168.1.16 → 239.255.255.250 SSDP 213 M-SEARCH * HTTP/1.1 
  183 25.177052576 192.168.1.16 → 224.0.0.251  MDNS 82 Standard query 0x0000 PTR _googlecast._tcp.local, "QM" question
  184 25.177824983 fe80::60bd:1940:a0d8:49f9 → ff02::fb     MDNS 102 Standard query 0x0000 PTR _googlecast._tcp.local, "QM" question
  185 25.177832345 192.168.1.16 → 224.0.0.251  MDNS 82 Standard query 0x0000 PTR _googlecast._tcp.local, "QM" question
  186 25.177834439 fe80::60bd:1940:a0d8:49f9 → ff02::fb     MDNS 102 Standard query 0x0000 PTR _googlecast._tcp.local, "QM" question
  187 25.983986765  10.22.18.99 → 224.0.0.252  LLMNR 64 Standard query 0x4661 A wpad
  188 25.984357301  10.22.18.99 → 224.0.0.252  LLMNR 64 Standard query 0x4661 A wpad
  189 26.653854517 192.168.1.16 → 10.6.15.144  TCP 154 [TCP Retransmission] 59298 → 22 [PSH, ACK] Seq=6201 Ack=47545 Win=5703 Len=88 TSval=5813120 TSecr=6407843
  190 26.698962902  10.6.15.144 → 192.168.1.16 SSH 110 Server: Encrypted packet (len=44)
  191 26.699019017 192.168.1.16 → 10.6.15.144  SSH 1514 Client: Encrypted packet (len=1448)
  192 26.699045281 192.168.1.16 → 10.6.15.144  SSH 470 Client: Encrypted packet (len=404)
  193 26.711263533  10.6.15.144 → 192.168.1.16 TCP 66 22 → 59298 [ACK] Seq=47589 Ack=8141 Win=1452 Len=0 TSval=6409508 TSecr=5813131
  194 26.711294869 192.168.1.16 → 10.6.15.144  SSH 174 Client: Encrypted packet (len=108)
  195 26.712628068  10.6.15.144 → 192.168.1.16 SSH 210 Server: Encrypted packet (len=144)
  196 26.713142867  10.6.15.144 → 192.168.1.16 SSH 102 Server: Encrypted packet (len=36)
  197 26.713359098 192.168.1.16 → 10.6.15.144  TCP 66 59298 → 22 [ACK] Seq=8249 Ack=47769 Win=5703 Len=0 TSval=5813134 TSecr=6409508
  198 26.713745889 192.168.1.16 → 10.6.15.144  SSH 454 Client: Encrypted packet (len=388)
  199 26.723664367  10.6.15.144 → 192.168.1.16 SSH 354 Server: Encrypted packet (len=288)
  200 26.724351229 192.168.1.16 → 10.6.15.144  SSH 210 Client: Encrypted packet (len=144)
  201 26.726703206  10.6.15.144 → 192.168.1.16 SSH 246 Server: Encrypted packet (len=180)
  202 26.727318884 192.168.1.16 → 10.6.15.144  SSH 302 Client: Encrypted packet (len=236)
  203 26.737207441  10.6.15.144 → 192.168.1.16 TCP 66 22 → 59298 [ACK] Seq=48237 Ack=9017 Win=1452 Len=0 TSval=6409514 TSecr=5813137
  204 26.737229107 192.168.1.16 → 10.6.15.144  SSH 1162 Client: Encrypted packet (len=1096)
  205 26.750529576  10.6.15.144 → 192.168.1.16 SSH 166 Server: Encrypted packet (len=100)
  206 26.750890053 192.168.1.16 → 10.6.15.144  SSH 134 Client: Encrypted packet (len=68)
  207 26.751713803  10.6.15.144 → 192.168.1.16 SSH 134 Server: Encrypted packet (len=68)
  208 26.757676067  10.6.15.144 → 192.168.1.16 SSH 1030 Server: Encrypted packet (len=964)
  209 26.757771531 192.168.1.16 → 10.6.15.144  TCP 66 59298 → 22 [ACK] Seq=10181 Ack=49369 Win=5703 Len=0 TSval=5813145 TSecr=6409518
  210 26.761840582  10.6.15.144 → 192.168.1.16 SSH 1514 Server: Encrypted packet (len=1448)
  211 26.767066748  10.6.15.144 → 192.168.1.16 SSH 766 Server: Encrypted packet (len=700)
  212 26.767084975 192.168.1.16 → 10.6.15.144  TCP 66 59298 → 22 [ACK] Seq=10181 Ack=51517 Win=5703 Len=0 TSval=5813148 TSecr=6409520
  213 26.768293977 192.168.1.16 → 10.6.15.144  SSH 334 Client: Encrypted packet (len=268)
  214 26.792928680  10.6.15.144 → 192.168.1.16 SSH 582 Server: Encrypted packet (len=516)
  215 26.792955056  10.6.15.144 → 192.168.1.16 SSH 142 Server: Encrypted packet (len=76)
  216 26.793022767 192.168.1.16 → 10.6.15.144  TCP 66 59298 → 22 [ACK] Seq=10449 Ack=52109 Win=5703 Len=0 TSval=5813154 TSecr=6409529
  217 26.793648550 192.168.1.16 → 10.6.15.144  SSH 142 Client: Encrypted packet (len=76)
  218 26.796680803  10.6.15.144 → 192.168.1.16 SSH 198 Server: Encrypted packet (len=132)
  219 26.797138489 192.168.1.16 → 10.6.15.144  SSH 134 Client: Encrypted packet (len=68)
  220 26.808438195  10.6.15.144 → 192.168.1.16 TCP 66 22 → 59298 [ACK] Seq=52241 Ack=10593 Win=1452 Len=0 TSval=6409532 TSecr=5813154
  221 26.811497128  10.6.15.144 → 192.168.1.16 SSH 422 Server: Encrypted packet (len=356)
  222 26.812643803 192.168.1.16 → 10.6.15.144  SSH 318 Client: Encrypted packet (len=252)
  223 26.860711529  10.6.15.144 → 192.168.1.16 SSH 126 Server: Encrypted packet (len=60)
  224 26.860736252  10.6.15.144 → 192.168.1.16 SSH 214 Server: Encrypted packet (len=148)
  225 26.860742311  10.6.15.144 → 192.168.1.16 SSH 230 Server: Encrypted packet (len=164)
  226 26.860816100 192.168.1.16 → 10.6.15.144  TCP 66 59298 → 22 [ACK] Seq=10845 Ack=52969 Win=5703 Len=0 TSval=5813171 TSecr=6409544
  227 27.177750336 192.168.1.16 → 224.0.0.251  MDNS 82 Standard query 0x0000 PTR _googlecast._tcp.local, "QM" question
  228 27.178555898 fe80::60bd:1940:a0d8:49f9 → ff02::fb     MDNS 102 Standard query 0x0000 PTR _googlecast._tcp.local, "QM" question
  229 27.178565116 192.168.1.16 → 224.0.0.251  MDNS 82 Standard query 0x0000 PTR _googlecast._tcp.local, "QM" question
  230 27.178568303 fe80::60bd:1940:a0d8:49f9 → ff02::fb     MDNS 102 Standard query 0x0000 PTR _googlecast._tcp.local, "QM" question
  231 28.701831320 192.168.1.16 → 224.0.0.252  IGMPv2 46 Membership Report group 224.0.0.252
  232 29.683822778 192.168.1.16 → 123.108.200.124 NTP 90 NTP Version 4, client
  233 29.685513784  10.6.15.144 → 192.168.1.16 SSH 138 Server: Encrypted packet (len=72)
  234 29.685536820  10.6.15.144 → 192.168.1.16 TCP 138 [TCP Retransmission] 22 → 59298 [PSH, ACK] Seq=52969 Ack=10845 Win=1452 Len=72 TSval=6410178 TSecr=5813171
  235 29.685545941 192.168.1.16 → 10.6.15.144  TCP 78 59298 → 22 [ACK] Seq=10845 Ack=53041 Win=5703 Len=0 TSval=5813877 TSecr=6410178 SLE=52969 SRE=53041
  236 29.685852562 192.168.1.16 → 10.6.15.144  SSH 102 Client: Encrypted packet (len=36)
  237 29.733611880  10.6.15.144 → 192.168.1.16 TCP 66 22 → 59298 [ACK] Seq=53041 Ack=10881 Win=1452 Len=0 TSval=6410264 TSecr=5813878
  238 32.992020856  10.6.15.144 → 192.168.1.16 SSH 138 Server: Encrypted packet (len=72)
  239 32.992487094 192.168.1.16 → 10.6.15.144  SSH 102 Client: Encrypted packet (len=36)
  240 33.004383111  10.6.15.144 → 192.168.1.16 TCP 66 22 → 59298 [ACK] Seq=53113 Ack=10917 Win=1452 Len=0 TSval=6411081 TSecr=5814704
  241 33.821871662 192.168.1.16 → 224.0.0.252  IGMPv2 46 Membership Report group 224.0.0.252
  242 38.683918016 192.168.1.16 → 123.108.200.124 NTP 90 NTP Version 4, client
  243 38.712607058  10.22.18.17 → 224.0.0.252  LLMNR 64 Standard query 0xcf72 A wpad
  244 38.713082924  10.22.18.17 → 224.0.0.252  LLMNR 64 Standard query 0xed5d AAAA wpad
  245 39.999787476  10.22.18.17 → 224.0.0.252  LLMNR 64 Standard query 0xcf72 A wpad
  246 40.000173872  10.22.18.17 → 224.0.0.252  LLMNR 64 Standard query 0xed5d AAAA wpad
  247 43.007904756  10.6.15.144 → 192.168.1.16 SSH 138 Server: Encrypted packet (len=72)
  248 43.008483539 192.168.1.16 → 10.6.15.144  SSH 102 Client: Encrypted packet (len=36)
  249 43.233851266 192.168.1.16 → 10.6.15.144  TCP 102 [TCP Retransmission] 59298 → 22 [PSH, ACK] Seq=10917 Ack=53185 Win=5703 Len=36 TSval=5817265 TSecr=6413553
  250 43.461843168 192.168.1.16 → 10.6.15.144  TCP 102 [TCP Retransmission] 59298 → 22 [PSH, ACK] Seq=10917 Ack=53185 Win=5703 Len=36 TSval=5817322 TSecr=6413553
