    1 0.000000000 192.168.1.16 → 10.6.15.144  SSH 102 Client: Encrypted packet (len=36)
    2 0.001702156  10.6.15.144 → 192.168.1.16 SSH 138 Server: Encrypted packet (len=72)
    3 0.001715407 192.168.1.16 → 10.6.15.144  TCP 78 [TCP Dup ACK 1#1] 59298 → 22 [ACK] Seq=37 Ack=1 Win=5703 Len=0 TSval=5817672 TSecr=6413859 SLE=4294967225 SRE=1
    4 1.122064752  10.6.15.144 → 192.168.1.16 TCP 66 22 → 59298 [ACK] Seq=1 Ack=37 Win=1452 Len=0 TSval=6414078 TSecr=5817672
    5 1.122086255 192.168.1.16 → 10.6.15.144  SSH 658 Client: Encrypted packet (len=592)
    6 1.130816801  10.6.15.144 → 192.168.1.16 TCP 66 22 → 59298 [ACK] Seq=1 Ack=629 Win=1452 Len=0 TSval=6414329 TSecr=5817952
    7 1.133821779  10.6.15.144 → 192.168.1.16 SSH 110 Server: Encrypted packet (len=44)
    8 1.133838340 192.168.1.16 → 10.6.15.144  TCP 66 59298 → 22 [ACK] Seq=629 Ack=45 Win=5703 Len=0 TSval=5817955 TSecr=6414329
    9 1.133859392  10.6.15.144 → 192.168.1.16 SSH 102 Server: Encrypted packet (len=36)
   10 1.133865414 192.168.1.16 → 10.6.15.144  TCP 66 59298 → 22 [ACK] Seq=629 Ack=81 Win=5703 Len=0 TSval=5817955 TSecr=6414329
   11 1.134194948 192.168.1.16 → 10.6.15.144  SSH 150 Client: Encrypted packet (len=84)
   12 1.135996972 192.168.1.16 → 10.6.15.144  SSH 150 Client: Encrypted packet (len=84)
   13 1.144294884  10.6.15.144 → 192.168.1.16 SSH 138 Server: Encrypted packet (len=72)
   14 1.147829658  10.6.15.144 → 192.168.1.16 TCP 66 22 → 59298 [ACK] Seq=153 Ack=797 Win=1452 Len=0 TSval=6414332 TSecr=5817955
   15 1.147851754 192.168.1.16 → 10.6.15.144  SSH 242 Client: Encrypted packet (len=176)
   16 1.166895112  10.6.15.144 → 192.168.1.16 SSH 174 Server: Encrypted packet (len=108)
   17 1.167242918  10.6.15.144 → 192.168.1.16 SSH 138 Server: Encrypted packet (len=72)
   18 1.167328695 192.168.1.16 → 10.6.15.144  TCP 66 59298 → 22 [ACK] Seq=973 Ack=333 Win=5703 Len=0 TSval=5817963 TSecr=6414337
   19 1.167342296 192.168.1.16 → 10.6.15.144  SSH 358 Client: Encrypted packet (len=292)
   20 1.167755496 192.168.1.16 → 10.6.15.144  SSH 642 Client: Encrypted packet (len=576)
   21 1.169106721  10.6.15.144 → 192.168.1.16 SSH 102 Server: Encrypted packet (len=36)
   22 1.177302670  10.6.15.144 → 192.168.1.16 SSH 142 Server: Encrypted packet (len=76)
   23 1.177391263 192.168.1.16 → 10.6.15.144  TCP 66 59298 → 22 [ACK] Seq=1841 Ack=445 Win=5703 Len=0 TSval=5817966 TSecr=6414338
   24 1.178660178  10.6.15.144 → 192.168.1.16 TCP 66 22 → 59298 [ACK] Seq=445 Ack=1841 Win=1452 Len=0 TSval=6414340 TSecr=5817963
   25 1.178681888 192.168.1.16 → 10.6.15.144  SSH 158 Client: Encrypted packet (len=92)
   26 1.182020378  10.6.15.144 → 192.168.1.16 SSH 138 Server: Encrypted packet (len=72)
   27 1.182400296 192.168.1.16 → 10.6.15.144  SSH 158 Client: Encrypted packet (len=92)
   28 1.182646447 192.168.1.16 → 10.6.15.144  SSH 150 Client: Encrypted packet (len=84)
   29 1.187776391  10.6.15.144 → 192.168.1.16 SSH 1090 Server: Encrypted packet (len=1024)
   30 1.189124864 192.168.1.16 → 10.6.15.144  SSH 334 Client: Encrypted packet (len=268)
   31 1.191774151  10.6.15.144 → 192.168.1.16 TCP 66 22 → 59298 [ACK] Seq=1541 Ack=2109 Win=1452 Len=0 TSval=6414344 TSecr=5817966
   32 1.191785965 192.168.1.16 → 10.6.15.144  SSH 334 Client: Encrypted packet (len=268)
   33 1.195378994  10.6.15.144 → 192.168.1.16 SSH 1514 Server: Encrypted packet (len=1448)
   34 1.195387598  10.6.15.144 → 192.168.1.16 SSH 430 Server: Encrypted packet (len=364)
   35 1.195393981 192.168.1.16 → 10.6.15.144  TCP 66 59298 → 22 [ACK] Seq=2645 Ack=3353 Win=5703 Len=0 TSval=5817970 TSecr=6414345
   36 1.196557446 192.168.1.16 → 10.6.15.144  SSH 334 Client: Encrypted packet (len=268)
   37 1.199589386  10.6.15.144 → 192.168.1.16 SSH 330 Server: Encrypted packet (len=264)
   38 1.201246629 192.168.1.16 → 10.6.15.144  SSH 334 Client: Encrypted packet (len=268)
   39 1.206143280  10.6.15.144 → 192.168.1.16 SSH 850 Server: Encrypted packet (len=784)
   40 1.209883785  10.6.15.144 → 192.168.1.16 SSH 454 Server: Encrypted packet (len=388)
   41 1.209969679 192.168.1.16 → 10.6.15.144  TCP 66 59298 → 22 [ACK] Seq=3181 Ack=4789 Win=5703 Len=0 TSval=5817974 TSecr=6414348
   42 1.212525678  10.6.15.144 → 192.168.1.16 SSH 362 Server: Encrypted packet (len=296)
   43 1.212844493 192.168.1.16 → 10.6.15.144  SSH 134 Client: Encrypted packet (len=68)
   44 1.214774683 192.168.1.16 → 10.6.15.144  SSH 134 Client: Encrypted packet (len=68)
   45 1.218716966  10.6.15.144 → 192.168.1.16 SSH 1514 Server: Encrypted packet (len=1448)
   46 1.218838458  10.6.15.144 → 192.168.1.16 SSH 1514 Server: Encrypted packet (len=1448)
   47 1.218847381 192.168.1.16 → 10.6.15.144  TCP 66 59298 → 22 [ACK] Seq=3317 Ack=7981 Win=5703 Len=0 TSval=5817976 TSecr=6414351
   48 1.219840038 192.168.1.16 → 10.6.15.144  SSH 206 Client: Encrypted packet (len=140)
   49 1.223800132  10.6.15.144 → 192.168.1.16 SSH 554 Server: Encrypted packet (len=488)
   50 1.225454015 192.168.1.16 → 10.6.15.144  SSH 206 Client: Encrypted packet (len=140)
   51 1.226552234 192.168.1.16 → 10.6.15.144  SSH 206 Client: Encrypted packet (len=140)
   52 1.229574679  10.6.15.144 → 192.168.1.16 SSH 510 Server: Encrypted packet (len=444)
   53 1.230749365 192.168.1.16 → 10.6.15.144  SSH 206 Client: Encrypted packet (len=140)
   54 1.235855424  10.6.15.144 → 192.168.1.16 TCP 66 22 → 59298 [ACK] Seq=8913 Ack=3597 Win=1452 Len=0 TSval=6414355 TSecr=5817976
   55 1.239966469  10.6.15.144 → 192.168.1.16 SSH 246 Server: Encrypted packet (len=180)
   56 1.240000345  10.6.15.144 → 192.168.1.16 SSH 182 Server: Encrypted packet (len=116)
   57 1.240081807 192.168.1.16 → 10.6.15.144  TCP 66 59298 → 22 [ACK] Seq=3877 Ack=9209 Win=5703 Len=0 TSval=5817982 TSecr=6414356
   58 1.240330683 192.168.1.16 → 10.6.15.144  SSH 134 Client: Encrypted packet (len=68)
   59 1.242896176 192.168.1.16 → 10.6.15.144  SSH 134 Client: Encrypted packet (len=68)
   60 1.266643934  10.6.15.144 → 192.168.1.16 SSH 342 Server: Encrypted packet (len=276)
   61 1.307946692 192.168.1.16 → 10.6.15.144  TCP 66 59298 → 22 [ACK] Seq=4013 Ack=9485 Win=5703 Len=0 TSval=5817999 TSecr=6414362
   62 1.347961787 192.168.1.16 → 10.6.15.144  TCP 134 [TCP Retransmission] 59298 → 22 [PSH, ACK] Seq=3945 Ack=9485 Win=5703 Len=68 TSval=5818009 TSecr=6414362
   63 1.400529844  10.6.15.144 → 192.168.1.16 SSH 838 Server: Encrypted packet (len=772)
   64 1.400611702 192.168.1.16 → 10.6.15.144  TCP 66 59298 → 22 [ACK] Seq=4013 Ack=10257 Win=5703 Len=0 TSval=5818022 TSecr=6414396
   65 1.471072066  10.6.15.144 → 192.168.1.16 SSH 1514 Server: Encrypted packet (len=1448)
   66 1.471233994  10.6.15.144 → 192.168.1.16 SSH 1514 Server: Encrypted packet (len=1448)
   67 1.471243265 192.168.1.16 → 10.6.15.144  TCP 66 59298 → 22 [ACK] Seq=4013 Ack=13153 Win=5703 Len=0 TSval=5818039 TSecr=6414413
   68 1.471825468  10.6.15.144 → 192.168.1.16 SSH 1514 Server: Encrypted packet (len=1448)
   69 1.481278126  10.6.15.144 → 192.168.1.16 SSH 1514 Server: Encrypted packet (len=1448)
   70 1.481295382 192.168.1.16 → 10.6.15.144  TCP 66 59298 → 22 [ACK] Seq=4013 Ack=16049 Win=5703 Len=0 TSval=5818042 TSecr=6414413
   71 1.481398716  10.6.15.144 → 192.168.1.16 SSH 1514 Server: Encrypted packet (len=1448)
   72 1.491717693  10.6.15.144 → 192.168.1.16 SSH 1514 Server: Encrypted packet (len=1448)
   73 1.491739566 192.168.1.16 → 10.6.15.144  TCP 66 59298 → 22 [ACK] Seq=4013 Ack=18945 Win=5703 Len=0 TSval=5818044 TSecr=6414416
   74 1.491896567  10.6.15.144 → 192.168.1.16 SSH 1514 Server: Encrypted packet (len=1448)
   75 1.501990445  10.6.15.144 → 192.168.1.16 SSH 1514 Server: Encrypted packet (len=1448)
   76 1.502012476 192.168.1.16 → 10.6.15.144  TCP 66 59298 → 22 [ACK] Seq=4013 Ack=21841 Win=5703 Len=0 TSval=5818047 TSecr=6414418
   77 1.502168070  10.6.15.144 → 192.168.1.16 SSH 1514 Server: Encrypted packet (len=1448)
   78 1.515039436  10.6.15.144 → 192.168.1.16 SSH 1058 Server: Encrypted packet (len=992)
   79 1.515059898 192.168.1.16 → 10.6.15.144  TCP 66 59298 → 22 [ACK] Seq=4013 Ack=24281 Win=5703 Len=0 TSval=5818050 TSecr=6414421
   80 1.614464536  10.6.15.144 → 192.168.1.16 SSH 1058 Server: [TCP Spurious Retransmission] , Encrypted packet (len=992)
   81 1.614490455 192.168.1.16 → 10.6.15.144  TCP 78 [TCP Dup ACK 79#1] 59298 → 22 [ACK] Seq=4013 Ack=24281 Win=5703 Len=0 TSval=5818075 TSecr=6414450 SLE=23289 SRE=24281
   82 1.622240541 192.168.1.16 → 10.6.15.144  SSH 206 Client: Encrypted packet (len=140)
   83 1.649531942  10.6.15.144 → 192.168.1.16 TCP 78 [TCP Dup ACK 60#1] 22 → 59298 [ACK] Seq=24281 Ack=3877 Win=1452 Len=0 TSval=6414458 TSecr=5817979 SLE=4013 SRE=4153
   84 1.706473449  10.6.15.144 → 192.168.1.16 SSH 1514 Server: Encrypted packet (len=1436)
   85 1.706497187 192.168.1.16 → 10.6.15.144  TCP 66 59298 → 22 [ACK] Seq=4153 Ack=25717 Win=5703 Len=0 TSval=5818098 TSecr=6414472
   86 1.706685636  10.6.15.144 → 192.168.1.16 SSH 1514 Server: Encrypted packet (len=1436)
   87 1.706698960 192.168.1.16 → 10.6.15.144  TCP 66 59298 → 22 [ACK] Seq=4153 Ack=27153 Win=5703 Len=0 TSval=5818098 TSecr=6414472
   88 1.707038033  10.6.15.144 → 192.168.1.16 SSH 1514 Server: Encrypted packet (len=1436)
   89 1.707045773 192.168.1.16 → 10.6.15.144  TCP 66 59298 → 22 [ACK] Seq=4153 Ack=28589 Win=5703 Len=0 TSval=5818098 TSecr=6414472
   90 1.707231359  10.6.15.144 → 192.168.1.16 SSH 1390 Server: Encrypted packet (len=1312)
   91 1.707237937 192.168.1.16 → 10.6.15.144  TCP 66 59298 → 22 [ACK] Seq=4153 Ack=29901 Win=5703 Len=0 TSval=5818098 TSecr=6414472
   92 1.724357182  10.6.15.144 → 192.168.1.16 SSH 1514 Server: Encrypted packet (len=1436)
   93 1.724381148 192.168.1.16 → 10.6.15.144  TCP 66 59298 → 22 [ACK] Seq=4153 Ack=31337 Win=5703 Len=0 TSval=5818103 TSecr=6414477
   94 1.724565173  10.6.15.144 → 192.168.1.16 SSH 1514 Server: Encrypted packet (len=1436)
   95 1.724577813 192.168.1.16 → 10.6.15.144  TCP 66 59298 → 22 [ACK] Seq=4153 Ack=32773 Win=5703 Len=0 TSval=5818103 TSecr=6414477
   96 1.724791282  10.6.15.144 → 192.168.1.16 SSH 1514 Server: Encrypted packet (len=1436)
   97 1.724798537 192.168.1.16 → 10.6.15.144  TCP 66 59298 → 22 [ACK] Seq=4153 Ack=34209 Win=5703 Len=0 TSval=5818103 TSecr=6414477
   98 1.737129565  10.6.15.144 → 192.168.1.16 SSH 1514 Server: Encrypted packet (len=1436)
   99 1.737163140 192.168.1.16 → 10.6.15.144  TCP 66 59298 → 22 [ACK] Seq=4153 Ack=35645 Win=5703 Len=0 TSval=5818106 TSecr=6414480
  100 1.737343113  10.6.15.144 → 192.168.1.16 SSH 1514 Server: Encrypted packet (len=1436)
  101 1.737353978 192.168.1.16 → 10.6.15.144  TCP 66 59298 → 22 [ACK] Seq=4153 Ack=37081 Win=5703 Len=0 TSval=5818106 TSecr=6414480
  102 1.737564530  10.6.15.144 → 192.168.1.16 SSH 1514 Server: Encrypted packet (len=1436)
  103 1.737577331 192.168.1.16 → 10.6.15.144  TCP 66 59298 → 22 [ACK] Seq=4153 Ack=38517 Win=5703 Len=0 TSval=5818106 TSecr=6414480
  104 1.800084981  10.6.15.144 → 192.168.1.16 SSH 1514 Server: Encrypted packet (len=1436)
  105 1.800116012 192.168.1.16 → 10.6.15.144  TCP 66 59298 → 22 [ACK] Seq=4153 Ack=39953 Win=5703 Len=0 TSval=5818122 TSecr=6414496
  106 1.800317161  10.6.15.144 → 192.168.1.16 SSH 1514 Server: Encrypted packet (len=1436)
  107 1.800331455 192.168.1.16 → 10.6.15.144  TCP 66 59298 → 22 [ACK] Seq=4153 Ack=41389 Win=5703 Len=0 TSval=5818122 TSecr=6414496
  108 1.800556081  10.6.15.144 → 192.168.1.16 SSH 1514 Server: Encrypted packet (len=1436)
  109 1.800567357 192.168.1.16 → 10.6.15.144  TCP 66 59298 → 22 [ACK] Seq=4153 Ack=42825 Win=5703 Len=0 TSval=5818122 TSecr=6414496
  110 1.800947225  10.6.15.144 → 192.168.1.16 SSH 1514 Server: Encrypted packet (len=1436)
  111 1.800964488 192.168.1.16 → 10.6.15.144  TCP 66 59298 → 22 [ACK] Seq=4153 Ack=44261 Win=5703 Len=0 TSval=5818122 TSecr=6414496
  112 1.812490832  10.6.15.144 → 192.168.1.16 SSH 1514 Server: Encrypted packet (len=1436)
  113 1.812728123  10.6.15.144 → 192.168.1.16 SSH 1514 Server: Encrypted packet (len=1436)
  114 1.812748432 192.168.1.16 → 10.6.15.144  TCP 66 59298 → 22 [ACK] Seq=4153 Ack=47133 Win=5703 Len=0 TSval=5818125 TSecr=6414499
  115 1.812840372  10.6.15.144 → 192.168.1.16 SSH 814 Server: Encrypted packet (len=736)
  116 1.812883458 192.168.1.16 → 10.6.15.144  TCP 66 59298 → 22 [ACK] Seq=4153 Ack=47869 Win=5703 Len=0 TSval=5818125 TSecr=6414499
  117 1.847962688 192.168.1.16 → 10.6.15.144  TCP 202 [TCP Retransmission] 59298 → 22 [PSH, ACK] Seq=3877 Ack=47869 Win=5703 Len=136 TSval=5818134 TSecr=6414499
  118 1.867472945  10.6.15.144 → 192.168.1.16 SSH 814 Server: [TCP Spurious Retransmission] , Encrypted packet (len=736)
  119 1.867493710 192.168.1.16 → 10.6.15.144  TCP 78 [TCP Dup ACK 116#1] 59298 → 22 [ACK] Seq=4153 Ack=47869 Win=5703 Len=0 TSval=5818138 TSecr=6414513 SLE=47133 SRE=47869
  120 3.071979281 192.168.1.16 → 10.6.15.144  TCP 202 [TCP Retransmission] 59298 → 22 [PSH, ACK] Seq=3877 Ack=47869 Win=5703 Len=136 TSval=5818440 TSecr=6414513
  121 3.400376063  10.6.15.144 → 192.168.1.16 SSH 150 Server: Encrypted packet (len=72)
  122 3.405797867  10.6.15.144 → 192.168.1.16 TCP 150 [TCP Retransmission] 22 → 59298 [PSH, ACK] Seq=47869 Ack=3877 Win=1452 Len=72 TSval=6414854 TSecr=5817979 SLE=4013 SRE=4153
  123 3.405824143  10.6.15.144 → 192.168.1.16 TCP 66 22 → 59298 [ACK] Seq=47941 Ack=4153 Win=1452 Len=0 TSval=6414897 TSecr=5818440
  124 3.409335699  10.6.15.144 → 192.168.1.16 SSH 150 Server: Encrypted packet (len=84)
  125 3.500094531 192.168.1.16 → 10.6.15.144  TCP 66 59298 → 22 [ACK] Seq=4153 Ack=47941 Win=5703 Len=0 TSval=5818522 TSecr=6414720
  126 3.500111221 192.168.1.16 → 10.6.15.144  TCP 78 [TCP Dup ACK 125#1] 59298 → 22 [ACK] Seq=4153 Ack=47941 Win=5703 Len=0 TSval=5818523 TSecr=6414854 SLE=47869 SRE=47941
  127 3.500112940 192.168.1.16 → 10.6.15.144  SSH 1514 Client: Encrypted packet (len=1448)
  128 3.500117502 192.168.1.16 → 10.6.15.144  SSH 1242 Client: Encrypted packet (len=1176)
  129 3.500119703 192.168.1.16 → 10.6.15.144  TCP 66 59298 → 22 [ACK] Seq=6777 Ack=48025 Win=5703 Len=0 TSval=5818535 TSecr=6414898
  130 4.032000628 192.168.1.16 → 10.6.15.144  TCP 1514 [TCP Retransmission] 59298 → 22 [ACK] Seq=4153 Ack=48025 Win=5703 Len=1448 TSval=5818680 TSecr=6414898
  131 4.543996143  10.6.15.144 → 192.168.1.16 TCP 78 [TCP Previous segment not captured] 22 → 59298 [ACK] Seq=48789 Ack=6777 Win=1452 Len=0 TSval=6415155 TSecr=5818535 SLE=4153 SRE=5601
  132 4.544029003 192.168.1.16 → 10.6.15.144  SSH 286 Client: Encrypted packet (len=220)
  133 4.939745544  10.6.15.144 → 192.168.1.16 TCP 830 [TCP Retransmission] 22 → 59298 [PSH, ACK] Seq=48025 Ack=6777 Win=1452 Len=764 TSval=6415281 TSecr=5818535
  134 5.040095770 192.168.1.16 → 10.6.15.144  TCP 66 59298 → 22 [ACK] Seq=6997 Ack=48789 Win=5703 Len=0 TSval=5818906 TSecr=6415281
  135 5.055977271 192.168.1.16 → 10.6.15.144  TCP 286 [TCP Retransmission] 59298 → 22 [PSH, ACK] Seq=6777 Ack=48789 Win=5703 Len=220 TSval=5818936 TSecr=6415281
  136 6.592000430 192.168.1.16 → 10.6.15.144  TCP 286 [TCP Retransmission] 59298 → 22 [PSH, ACK] Seq=6777 Ack=48789 Win=5703 Len=220 TSval=5819320 TSecr=6415281
  137 6.955994974  10.6.15.144 → 192.168.1.16 TCP 78 [TCP Previous segment not captured] 22 → 59298 [ACK] Seq=51677 Ack=6997 Win=1452 Len=0 TSval=6415758 TSecr=5819320 SLE=6777 SRE=6997
  138 7.805772720  10.6.15.144 → 192.168.1.16 TCP 1514 [TCP Retransmission] 22 → 59298 [ACK] Seq=48789 Ack=6997 Win=1452 Len=1448 TSval=6415993 TSecr=5819320
  139 7.805799515 192.168.1.16 → 10.6.15.144  TCP 66 59298 → 22 [ACK] Seq=6997 Ack=50237 Win=5703 Len=0 TSval=5819623 TSecr=6415993
  140 7.806180781 192.168.1.16 → 10.6.15.144  SSH 102 Client: Encrypted packet (len=36)
  141 7.807397316 192.168.1.16 → 10.6.15.144  SSH 134 Client: Encrypted packet (len=68)
  142 7.816975712  10.6.15.144 → 192.168.1.16 SSH 446 Server: Encrypted packet (len=380)
  143 7.816993580 192.168.1.16 → 10.6.15.144  TCP 78 [TCP Dup ACK 139#1] 59298 → 22 [ACK] Seq=7101 Ack=50237 Win=5703 Len=0 TSval=5819626 TSecr=6415993 SLE=51677 SRE=52057
  144 7.817005418  10.6.15.144 → 192.168.1.16 TCP 66 22 → 59298 [ACK] Seq=52057 Ack=7033 Win=1452 Len=0 TSval=6416000 TSecr=5819623
  145 7.817010631 192.168.1.16 → 10.6.15.144  SSH 330 Client: Encrypted packet (len=252)
  146 7.818233792  10.6.15.144 → 192.168.1.16 TCP 1422 [TCP Out-Of-Order] 22 → 59298 [PSH, ACK] Seq=50237 Ack=7033 Win=1452 Len=1356 TSval=6416000 TSecr=5819623
  147 7.818244551 192.168.1.16 → 10.6.15.144  TCP 78 59298 → 22 [ACK] Seq=7353 Ack=51593 Win=5703 Len=0 TSval=5819626 TSecr=6416000 SLE=51677 SRE=52057
  148 7.821928072 192.168.1.16 → 123.108.200.124 NTP 90 NTP Version 4, client
  149 7.831466355  10.6.15.144 → 192.168.1.16 TCP 150 [TCP Retransmission] 22 → 59298 [PSH, ACK] Seq=51593 Ack=7101 Win=1452 Len=84 TSval=6416002 TSecr=5819623
  150 7.831489152 192.168.1.16 → 10.6.15.144  SSH 662 Client: Encrypted packet (len=596)
  151 7.850638215  10.6.15.144 → 192.168.1.16 TCP 66 22 → 59298 [ACK] Seq=52057 Ack=7949 Win=1452 Len=0 TSval=6416008 TSecr=5819626
  152 7.850658005 192.168.1.16 → 10.6.15.144  SSH 138 Client: Encrypted packet (len=72)
  153 7.854172133  10.6.15.144 → 192.168.1.16 SSH 102 Server: Encrypted packet (len=36)
  154 7.862088144  10.6.15.144 → 192.168.1.16 SSH 142 Server: Encrypted packet (len=76)
  155 7.862169220 192.168.1.16 → 10.6.15.144  TCP 66 59298 → 22 [ACK] Seq=8021 Ack=52169 Win=5703 Len=0 TSval=5819637 TSecr=6416009
  156 7.864521894  10.6.15.144 → 192.168.1.16 SSH 774 Server: Encrypted packet (len=708)
  157 7.865299761 192.168.1.16 → 10.6.15.144  SSH 134 Client: Encrypted packet (len=68)
  158 7.911357113  10.6.15.144 → 192.168.1.16 TCP 66 22 → 59298 [ACK] Seq=52877 Ack=8089 Win=1452 Len=0 TSval=6416024 TSecr=5819638
  159 9.121859096  10.6.15.144 → 192.168.1.16 SSH 238 Server: Encrypted packet (len=172)
  160 9.121876718  10.6.15.144 → 192.168.1.16 TCP 238 [TCP Retransmission] 22 → 59298 [PSH, ACK] Seq=52877 Ack=8089 Win=1452 Len=172 TSval=6416137 TSecr=5819638
  161 9.121884866 192.168.1.16 → 10.6.15.144  TCP 78 59298 → 22 [ACK] Seq=8089 Ack=53049 Win=5703 Len=0 TSval=5819952 TSecr=6416137 SLE=52877 SRE=53049
  162 9.121914952  10.6.15.144 → 192.168.1.16 SSH 238 Server: [TCP Spurious Retransmission] , Encrypted packet (len=172)
  163 9.121917340 192.168.1.16 → 10.6.15.144  TCP 78 [TCP Dup ACK 161#1] 59298 → 22 [ACK] Seq=8089 Ack=53049 Win=5703 Len=0 TSval=5819952 TSecr=6416274 SLE=52877 SRE=53049
  164 9.122228874 192.168.1.16 → 10.6.15.144  SSH 134 Client: Encrypted packet (len=68)
  165 9.126287133 192.168.1.16 → 10.6.15.144  SSH 870 Client: Encrypted packet (len=804)
  166 9.142138520  10.6.15.144 → 192.168.1.16 TCP 66 22 → 59298 [ACK] Seq=53049 Ack=8157 Win=1452 Len=0 TSval=6416330 TSecr=5819952
  167 9.535961438 192.168.1.16 → 10.6.15.144  TCP 870 [TCP Retransmission] 59298 → 22 [PSH, ACK] Seq=8157 Ack=53049 Win=5703 Len=804 TSval=5820056 TSecr=6416330
  168 9.570549067  10.6.15.144 → 192.168.1.16 TCP 66 22 → 59298 [ACK] Seq=53049 Ack=8961 Win=1452 Len=0 TSval=6416438 TSecr=5820056
  169 11.137871722  10.6.15.144 → 192.168.1.16 SSH 262 Server: Encrypted packet (len=196)
  170 11.137923046  10.6.15.144 → 192.168.1.16 TCP 262 [TCP Retransmission] 22 → 59298 [PSH, ACK] Seq=53049 Ack=8961 Win=1452 Len=196 TSval=6416601 TSecr=5820056
  171 11.137945508 192.168.1.16 → 10.6.15.144  TCP 78 59298 → 22 [ACK] Seq=8961 Ack=53245 Win=5703 Len=0 TSval=5820456 TSecr=6416601 SLE=53049 SRE=53245
  172 11.151424491 192.168.1.16 → 10.6.15.144  SSH 190 Client: Encrypted packet (len=124)
  173 11.152339350 192.168.1.16 → 10.6.15.144  SSH 190 Client: Encrypted packet (len=124)
  174 11.160975029  10.6.15.144 → 192.168.1.16 TCP 66 22 → 59298 [ACK] Seq=53245 Ack=9085 Win=1452 Len=0 TSval=6416836 TSecr=5820459
  175 11.162814418  10.6.15.144 → 192.168.1.16 TCP 66 22 → 59298 [ACK] Seq=53245 Ack=9209 Win=1452 Len=0 TSval=6416837 TSecr=5820460
  176 12.130918136  10.6.15.144 → 192.168.1.16 SSH 134 Server: Encrypted packet (len=68)
  177 12.130942072  10.6.15.144 → 192.168.1.16 SSH 102 Server: Encrypted packet (len=36)
  178 12.130952260  10.6.15.144 → 192.168.1.16 SSH 186 Server: Encrypted packet (len=120)
  179 12.131020026 192.168.1.16 → 10.6.15.144  TCP 66 59298 → 22 [ACK] Seq=9209 Ack=53469 Win=5703 Len=0 TSval=5820704 TSecr=6417028
  180 12.140807131  10.6.15.144 → 192.168.1.16 SSH 330 Server: Encrypted packet (len=264)
  181 12.184006531 192.168.1.16 → 10.6.15.144  TCP 66 59298 → 22 [ACK] Seq=9209 Ack=53733 Win=5703 Len=0 TSval=5820718 TSecr=6417081
  182 12.492517615 192.168.1.16 → 10.6.15.144  SSH 1278 Client: Encrypted packet (len=1212)
  183 12.504359081  10.6.15.144 → 192.168.1.16 TCP 66 22 → 59298 [ACK] Seq=53733 Ack=10421 Win=1452 Len=0 TSval=6417172 TSecr=5820795
  184 12.513511127  10.6.15.144 → 192.168.1.16 SSH 142 Server: Encrypted packet (len=76)
  185 12.513529166 192.168.1.16 → 10.6.15.144  TCP 66 59298 → 22 [ACK] Seq=10421 Ack=53809 Win=5703 Len=0 TSval=5820800 TSecr=6417173
  186 14.115125598  10.6.15.144 → 192.168.1.16 SSH 1514 Server: Encrypted packet (len=1448)
  187 14.115193439 192.168.1.16 → 10.6.15.144  TCP 66 59298 → 22 [ACK] Seq=10421 Ack=55257 Win=5703 Len=0 TSval=5821200 TSecr=6417252
  188 14.115219136  10.6.15.144 → 192.168.1.16 SSH 1422 Server: Encrypted packet (len=1356)
  189 14.115228249 192.168.1.16 → 10.6.15.144  TCP 66 59298 → 22 [ACK] Seq=10421 Ack=56613 Win=5703 Len=0 TSval=5821200 TSecr=6417252
  190 14.115235652  10.6.15.144 → 192.168.1.16 SSH 526 Server: Encrypted packet (len=460)
  191 14.115239790 192.168.1.16 → 10.6.15.144  TCP 66 59298 → 22 [ACK] Seq=10421 Ack=57073 Win=5703 Len=0 TSval=5821200 TSecr=6417348
  192 14.116435291 192.168.1.16 → 10.6.15.144  SSH 134 Client: Encrypted packet (len=68)
  193 14.118705757 192.168.1.16 → 10.6.15.144  SSH 1514 Client: Encrypted packet (len=1448)
  194 14.125363544  10.6.15.144 → 192.168.1.16 SSH 138 Server: Encrypted packet (len=72)
  195 14.129222751  10.6.15.144 → 192.168.1.16 TCP 66 22 → 59298 [ACK] Seq=57145 Ack=11937 Win=1452 Len=0 TSval=6417578 TSecr=5821201
  196 14.129244815 192.168.1.16 → 10.6.15.144  SSH 338 Client: Encrypted packet (len=272)
  197 14.179146547  10.6.15.144 → 192.168.1.16 TCP 66 22 → 59298 [ACK] Seq=57145 Ack=12209 Win=1452 Len=0 TSval=6417591 TSecr=5821204
  198 14.260671073  10.6.15.144 → 192.168.1.16 SSH 958 Server: Encrypted packet (len=892)
  199 14.260709883  10.6.15.144 → 192.168.1.16 SSH 382 Server: Encrypted packet (len=316)
  200 14.260823166 192.168.1.16 → 10.6.15.144  TCP 66 59298 → 22 [ACK] Seq=12209 Ack=58353 Win=5703 Len=0 TSval=5821237 TSecr=6417611
  201 14.261913167 192.168.1.16 → 10.6.15.144  SSH 134 Client: Encrypted packet (len=68)
  202 14.271890536  10.6.15.144 → 192.168.1.16 TCP 66 22 → 59298 [ACK] Seq=58353 Ack=12277 Win=1452 Len=0 TSval=6417614 TSecr=5821237
  203 16.130848278  10.22.18.52 → 224.0.0.252  LLMNR 62 Standard query 0x1843 ANY HP
  204 16.130895329  10.22.18.52 → 224.0.0.252  LLMNR 62 Standard query 0x33ff ANY HP
  205 16.130907227  10.22.18.52 → 224.0.0.252  LLMNR 64 Standard query 0x7b1f A wpad
  206 16.136361192  10.22.18.52 → 224.0.0.252  LLMNR 62 Standard query 0xec72 ANY HP
  207 16.136424205  10.6.15.144 → 192.168.1.16 SSH 714 Server: Encrypted packet (len=648)
  208 16.136454124  10.22.18.52 → 224.0.0.252  LLMNR 64 Standard query 0x7b1f A wpad
  209 16.139066064 192.168.1.16 → 10.6.15.144  SSH 390 Client: Encrypted packet (len=324)
  210 16.148867468  10.6.15.144 → 192.168.1.16 TCP 66 22 → 59298 [ACK] Seq=59001 Ack=12601 Win=1452 Len=0 TSval=6418083 TSecr=5821706
  211 17.122571692  10.22.18.52 → 224.0.0.252  LLMNR 62 Standard query 0xd5af ANY HP
  212 17.122618726  10.22.18.52 → 224.0.0.252  LLMNR 67 Standard query 0xa610 A vmnjley
  213 17.122631154  10.22.18.52 → 224.0.0.252  LLMNR 72 Standard query 0x4d35 A jsyhjrgdnsrc
  214 17.123072075  10.22.18.52 → 224.0.0.252  LLMNR 70 Standard query 0xc99c A smjbjvvwdd
  215 18.114721509  10.22.18.52 → 224.0.0.252  LLMNR 70 Standard query 0xc99c A smjbjvvwdd
  216 18.114772608  10.22.18.52 → 224.0.0.252  LLMNR 67 Standard query 0xa610 A vmnjley
  217 18.114784551  10.22.18.52 → 224.0.0.252  LLMNR 72 Standard query 0x4d35 A jsyhjrgdnsrc
  218 18.114795621  10.6.15.144 → 192.168.1.16 SSH 210 Server: Encrypted packet (len=144)
  219 18.115740748 192.168.1.16 → 10.6.15.144  SSH 138 Client: Encrypted packet (len=72)
  220 18.126001548  10.6.15.144 → 192.168.1.16 TCP 66 22 → 59298 [ACK] Seq=59145 Ack=12673 Win=1452 Len=0 TSval=6418577 TSecr=5822200
  221 19.138425239  10.22.18.52 → 224.0.0.252  LLMNR 62 Standard query 0x0119 ANY HP
  222 19.138470112  10.22.18.52 → 224.0.0.252  LLMNR 64 Standard query 0xf411 A wpad
  223 20.130396069  10.22.18.52 → 224.0.0.252  LLMNR 64 Standard query 0xf411 A wpad
  224 20.130435336  10.6.15.144 → 192.168.1.16 SSH 210 Server: Encrypted packet (len=144)
  225 20.131085291 192.168.1.16 → 10.6.15.144  SSH 138 Client: Encrypted packet (len=72)
  226 20.416025338 192.168.1.16 → 10.6.15.144  TCP 138 [TCP Retransmission] 59298 → 22 [PSH, ACK] Seq=12673 Ack=59289 Win=5703 Len=72 TSval=5822776 TSecr=6419072
  227 20.450124210  10.6.15.144 → 192.168.1.16 TCP 66 22 → 59298 [ACK] Seq=59289 Ack=12745 Win=1452 Len=0 TSval=6419158 TSecr=5822776
  228 21.216001338 192.168.1.16 → 54.76.71.168 TCP 66 42414 → 8282 [ACK] Seq=1 Ack=1 Win=296 Len=0 TSval=5822976 TSecr=609923528
  229 21.238470019  10.6.15.144 → 192.168.1.16 SSH 126 Server: Encrypted packet (len=60)
  230 21.238493923  10.6.15.144 → 192.168.1.16 SSH 102 Server: Encrypted packet (len=36)
  231 21.238568852 192.168.1.16 → 10.6.15.144  TCP 66 59298 → 22 [ACK] Seq=12745 Ack=59385 Win=5703 Len=0 TSval=5822981 TSecr=6419356
  232 21.240773988  10.6.15.144 → 192.168.1.16 SSH 126 Server: Encrypted packet (len=60)
  233 21.248523376  10.6.15.144 → 192.168.1.16 SSH 102 Server: Encrypted packet (len=36)
  234 21.248611372 192.168.1.16 → 10.6.15.144  TCP 66 59298 → 22 [ACK] Seq=12745 Ack=59481 Win=5703 Len=0 TSval=5822984 TSecr=6419356
  235 22.146246944 54.76.71.168 → 192.168.1.16 TCP 66 [TCP ACKed unseen segment] 8282 → 42414 [ACK] Seq=1 Ack=2 Win=121 Len=0 TSval=609934951 TSecr=5811552
  236 22.146271287  10.22.18.52 → 224.0.0.252  LLMNR 64 Standard query 0xc78f A wpad
  237 22.146299659  10.22.18.52 → 224.0.0.252  LLMNR 64 Standard query 0xc78f A wpad
  238 23.137998432  10.22.18.52 → 224.0.0.252  LLMNR 70 Standard query 0xa7fd A hkcquyqkxi
  239 23.138029370  10.22.18.52 → 224.0.0.252  LLMNR 68 Standard query 0x96ff A rdidphjl
  240 23.138036697  10.22.18.52 → 224.0.0.252  LLMNR 75 Standard query 0xf4eb A vefjhmvxmjozxqs
  241 23.138402774  10.22.18.52 → 224.0.0.252  LLMNR 68 Standard query 0x96ff A rdidphjl
  242 23.138416067  10.22.18.52 → 224.0.0.252  LLMNR 70 Standard query 0xa7fd A hkcquyqkxi
  243 23.138421224  10.22.18.52 → 224.0.0.252  LLMNR 75 Standard query 0xf4eb A vefjhmvxmjozxqs
  244 26.146478375  10.22.17.72 → 224.0.0.252  LLMNR 64 Standard query 0x8314 A wpad
  245 26.146848059  10.22.17.72 → 224.0.0.252  LLMNR 64 Standard query 0x8314 A wpad
  246 29.121944716  10.22.18.52 → 224.0.0.252  LLMNR 70 Standard query 0xf5d3 A hkcquyqkxi
  247 29.123038080  10.22.18.52 → 224.0.0.252  LLMNR 68 Standard query 0x7525 A rdidphjl
  248 29.123427693  10.22.18.52 → 224.0.0.252  LLMNR 75 Standard query 0x64d5 A vefjhmvxmjozxqs
  249 29.123461886  10.22.18.52 → 224.0.0.252  LLMNR 70 Standard query 0xc12c A hkcquyqkxi
  250 29.123471500  10.22.18.52 → 224.0.0.252  LLMNR 75 Standard query 0x7cb3 A vefjhmvxmjozxqs
  251 29.123479653  10.22.18.52 → 224.0.0.252  LLMNR 68 Standard query 0x675f A rdidphjl
  252 29.123490106  10.22.18.52 → 224.0.0.252  LLMNR 70 Standard query 0xf5d3 A hkcquyqkxi
  253 29.123496959  10.22.18.52 → 224.0.0.252  LLMNR 68 Standard query 0x7525 A rdidphjl
  254 29.123504889  10.22.18.52 → 224.0.0.252  LLMNR 75 Standard query 0x64d5 A vefjhmvxmjozxqs
  255 29.123513961  10.22.18.52 → 224.0.0.252  LLMNR 70 Standard query 0xc12c A hkcquyqkxi
  256 29.123521897  10.22.18.52 → 224.0.0.252  LLMNR 75 Standard query 0x7cb3 A vefjhmvxmjozxqs
  257 29.124167148  10.22.18.52 → 224.0.0.252  LLMNR 68 Standard query 0x675f A rdidphjl
  258 30.113952202  10.6.15.144 → 192.168.1.16 SSH 138 Server: [TCP Previous segment not captured] , Encrypted packet (len=72)
  259 30.113971742 192.168.1.16 → 10.6.15.144  TCP 78 [TCP Dup ACK 234#1] 59298 → 22 [ACK] Seq=12745 Ack=59481 Win=5703 Len=0 TSval=5825200 TSecr=6419356 SLE=59553 SRE=59625
  260 31.179222126  10.6.15.144 → 192.168.1.16 TCP 138 [TCP Retransmission] 22 → 59298 [PSH, ACK] Seq=59481 Ack=12745 Win=1452 Len=72 TSval=6421841 TSecr=5825200
  261 31.179251781 192.168.1.16 → 10.6.15.144  TCP 66 59298 → 22 [ACK] Seq=12745 Ack=59625 Win=5703 Len=0 TSval=5825466 TSecr=6421841
  262 31.179613660 192.168.1.16 → 10.6.15.144  SSH 138 Client: Encrypted packet (len=72)
  263 31.189562007  10.6.15.144 → 192.168.1.16 TCP 66 22 → 59298 [ACK] Seq=59625 Ack=12817 Win=1452 Len=0 TSval=6421843 TSecr=5825466
  264 34.145931162  10.22.18.52 → 224.0.0.252  LLMNR 64 Standard query 0x5180 A wpad
  265 34.146419078  10.22.18.52 → 224.0.0.252  LLMNR 64 Standard query 0x5180 A wpad
  266 35.138416577  10.22.17.72 → 224.0.0.252  LLMNR 64 Standard query 0x22c6 A wpad
  267 35.138448909  10.22.17.72 → 224.0.0.252  LLMNR 64 Standard query 0x22c6 A wpad
  268 37.122022505  10.6.15.144 → 192.168.1.16 SSH 138 Server: Encrypted packet (len=72)
  269 37.122063393  10.6.15.144 → 192.168.1.16 TCP 138 [TCP Retransmission] 22 → 59298 [PSH, ACK] Seq=59625 Ack=12817 Win=1452 Len=72 TSval=6423317 TSecr=5825466
  270 37.122082954 192.168.1.16 → 10.6.15.144  TCP 78 59298 → 22 [ACK] Seq=12817 Ack=59697 Win=5703 Len=0 TSval=5826952 TSecr=6423317 SLE=59625 SRE=59697
  271 37.122577133 192.168.1.16 → 10.6.15.144  SSH 102 Client: Encrypted packet (len=36)
  272 37.136477650  10.6.15.144 → 192.168.1.16 TCP 66 22 → 59298 [ACK] Seq=59697 Ack=12853 Win=1452 Len=0 TSval=6423329 TSecr=5826952
  273 37.825618111 192.168.1.16 → 192.168.1.1  DNS 74 Standard query 0x338a A ntp.ubuntu.com
  274 37.827337550  10.6.15.144 → 192.168.1.16 SSH 138 Server: Encrypted packet (len=72)
  275 37.827823444 192.168.1.16 → 10.6.15.144  SSH 102 Client: Encrypted packet (len=36)
  276 37.836767775  192.168.1.1 → 192.168.1.16 DNS 138 Standard query response 0x338a A ntp.ubuntu.com A 91.189.89.199 A 91.189.89.198 A 91.189.94.4 A 91.189.91.157
  277 37.837433668 192.168.1.16 → 91.189.89.199 NTP 90 NTP Version 4, client
  278 37.837740200  10.6.15.144 → 192.168.1.16 TCP 66 22 → 59298 [ACK] Seq=59769 Ack=12889 Win=1452 Len=0 TSval=6423505 TSecr=5827128
  279 37.848118043 10.119.73.122 → 192.168.1.16 ICMP 110 Destination unreachable (Communication administratively filtered)
  280 40.824566192 192.168.1.16 → 192.168.1.1  DNS 81 Standard query 0xc900 A 2.ubuntu.pool.ntp.org
  281 40.837376514  192.168.1.1 → 192.168.1.16 DNS 145 Standard query response 0xc900 A 2.ubuntu.pool.ntp.org A 139.59.21.22 A 52.66.5.185 A 123.108.200.124 A 139.59.50.38
  282 40.837859848 192.168.1.16 → 139.59.21.22 NTP 90 NTP Version 4, client
  283 43.137938821  10.6.15.144 → 192.168.1.16 SSH 138 Server: Encrypted packet (len=72)
  284 43.138391965 192.168.1.16 → 10.6.15.144  SSH 102 Client: Encrypted packet (len=36)
  285 43.147305891  10.6.15.144 → 192.168.1.16 TCP 66 22 → 59298 [ACK] Seq=59841 Ack=12925 Win=1452 Len=0 TSval=6424833 TSecr=5828456
  286 44.129986201  10.6.15.144 → 192.168.1.16 SSH 174 Server: Encrypted packet (len=108)
  287 44.130279335  10.6.15.144 → 192.168.1.16 SSH 102 Server: Encrypted packet (len=36)
  288 44.130374932 192.168.1.16 → 10.6.15.144  TCP 66 59298 → 22 [ACK] Seq=12925 Ack=59985 Win=5703 Len=0 TSval=5828704 TSecr=6424990
  289 44.130796600 192.168.1.16 → 10.6.15.144  SSH 138 Client: Encrypted packet (len=72)
  290 44.139259185  10.6.15.144 → 192.168.1.16 TCP 66 22 → 59298 [ACK] Seq=59985 Ack=12997 Win=1452 Len=0 TSval=6425081 TSecr=5828704
  291 44.139681787  10.6.15.144 → 192.168.1.16 SSH 102 Server: Encrypted packet (len=36)
  292 44.180021656 192.168.1.16 → 10.6.15.144  TCP 66 59298 → 22 [ACK] Seq=12997 Ack=60021 Win=5703 Len=0 TSval=5828717 TSecr=6425081
