    1 0.000000000 192.168.1.16 → 224.0.0.252  LLMNR 68 Standard query 0x460f A ltjwtlpb
    2 0.000773925 192.168.1.16 → 224.0.0.252  LLMNR 67 Standard query 0xdb38 A ieywaiy
    3 0.000779742 192.168.1.16 → 224.0.0.252  LLMNR 67 Standard query 0x8a4e A msihwtt
    4 0.007911000  10.6.15.145 → 192.168.1.16 SSH 1514 Server: Encrypted packet (len=1448)
    5 0.008095191  10.6.15.145 → 192.168.1.16 SSH 1514 Server: Encrypted packet (len=1448)
    6 0.008103864  10.6.15.145 → 192.168.1.16 SSH 110 Server: Encrypted packet (len=44)
    7 0.008129443 192.168.1.16 → 10.6.15.145  TCP 66 52104 → 22 [ACK] Seq=1 Ack=2941 Win=1426 Len=0 TSval=1145666 TSecr=23960173
    8 0.010508088  10.6.15.145 → 192.168.1.16 SSH 1514 Server: Encrypted packet (len=1448)
    9 0.010517038  10.6.15.145 → 192.168.1.16 SSH 142 Server: Encrypted packet (len=76)
   10 0.010539667 192.168.1.16 → 10.6.15.145  TCP 66 52104 → 22 [ACK] Seq=1 Ack=4465 Win=1426 Len=0 TSval=1145667 TSecr=23960173
   11 0.010703545  10.6.15.145 → 192.168.1.16 SSH 1514 Server: Encrypted packet (len=1448)
   12 0.011040066  10.6.15.145 → 192.168.1.16 SSH 1514 Server: Encrypted packet (len=1448)
   13 0.011067846 192.168.1.16 → 10.6.15.145  TCP 66 52104 → 22 [ACK] Seq=1 Ack=7361 Win=1426 Len=0 TSval=1145667 TSecr=23960174
   14 0.011232886  10.6.15.145 → 192.168.1.16 SSH 1514 Server: Encrypted packet (len=1448)
   15 0.013296174  10.6.15.145 → 192.168.1.16 SSH 1514 Server: Encrypted packet (len=1448)
   16 0.013362328 192.168.1.16 → 10.6.15.145  TCP 66 52104 → 22 [ACK] Seq=1 Ack=10257 Win=1426 Len=0 TSval=1145667 TSecr=23960189
   17 0.013489792  10.6.15.145 → 192.168.1.16 SSH 1514 Server: Encrypted packet (len=1448)
   18 0.015760707  10.6.15.145 → 192.168.1.16 SSH 1254 Server: Encrypted packet (len=1188)
   19 0.015820918 192.168.1.16 → 10.6.15.145  TCP 66 52104 → 22 [ACK] Seq=1 Ack=12893 Win=1426 Len=0 TSval=1145668 TSecr=23960190
   20 0.111748464  10.6.15.145 → 192.168.1.16 SSH 1514 Server: Encrypted packet (len=1448)
   21 0.111774728  10.6.15.145 → 192.168.1.16 SSH 110 Server: Encrypted packet (len=44)
   22 0.111818850 192.168.1.16 → 10.6.15.145  TCP 66 52104 → 22 [ACK] Seq=1 Ack=14385 Win=1426 Len=0 TSval=1145692 TSecr=23960215
   23 0.112124807  10.6.15.145 → 192.168.1.16 SSH 1514 Server: Encrypted packet (len=1448)
   24 0.112333965  10.6.15.145 → 192.168.1.16 SSH 1514 Server: Encrypted packet (len=1448)
   25 0.112355985 192.168.1.16 → 10.6.15.145  TCP 66 52104 → 22 [ACK] Seq=1 Ack=17281 Win=1426 Len=0 TSval=1145692 TSecr=23960215
   26 0.112545220  10.6.15.145 → 192.168.1.16 SSH 1514 Server: Encrypted packet (len=1448)
   27 0.112680486  10.6.15.145 → 192.168.1.16 SSH 110 Server: Encrypted packet (len=44)
   28 0.112697045 192.168.1.16 → 10.6.15.145  TCP 66 52104 → 22 [ACK] Seq=1 Ack=18773 Win=1426 Len=0 TSval=1145692 TSecr=23960215
   29 0.117384244  10.6.15.145 → 192.168.1.16 SSH 1514 Server: Encrypted packet (len=1448)
   30 0.117579305  10.6.15.145 → 192.168.1.16 SSH 1514 Server: Encrypted packet (len=1448)
   31 0.117605860 192.168.1.16 → 10.6.15.145  TCP 66 52104 → 22 [ACK] Seq=1 Ack=21669 Win=1426 Len=0 TSval=1145693 TSecr=23960216
   32 0.117794219  10.6.15.145 → 192.168.1.16 SSH 1514 Server: Encrypted packet (len=1448)
   33 0.118004659  10.6.15.145 → 192.168.1.16 SSH 1514 Server: Encrypted packet (len=1448)
   34 0.118031562 192.168.1.16 → 10.6.15.145  TCP 66 52104 → 22 [ACK] Seq=1 Ack=24565 Win=1426 Len=0 TSval=1145693 TSecr=23960216
   35 0.118220725  10.6.15.145 → 192.168.1.16 SSH 1514 Server: Encrypted packet (len=1448)
   36 0.118433875  10.6.15.145 → 192.168.1.16 SSH 1514 Server: Encrypted packet (len=1448)
   37 0.118458665 192.168.1.16 → 10.6.15.145  TCP 66 52104 → 22 [ACK] Seq=1 Ack=27461 Win=1426 Len=0 TSval=1145694 TSecr=23960216
   38 0.121241271  10.6.15.145 → 192.168.1.16 SSH 1514 Server: Encrypted packet (len=1448)
   39 0.121449428  10.6.15.145 → 192.168.1.16 SSH 1514 Server: Encrypted packet (len=1448)
   40 0.121473084 192.168.1.16 → 10.6.15.145  TCP 66 52104 → 22 [ACK] Seq=1 Ack=30357 Win=1426 Len=0 TSval=1145694 TSecr=23960217
   41 0.121676721  10.6.15.145 → 192.168.1.16 SSH 1514 Server: Encrypted packet (len=1448)
   42 0.121874078  10.6.15.145 → 192.168.1.16 SSH 1514 Server: Encrypted packet (len=1448)
   43 0.121886166 192.168.1.16 → 10.6.15.145  TCP 66 52104 → 22 [ACK] Seq=1 Ack=33253 Win=1426 Len=0 TSval=1145694 TSecr=23960217
   44 0.122087816  10.6.15.145 → 192.168.1.16 SSH 1514 Server: Encrypted packet (len=1448)
   45 0.122317533  10.6.15.145 → 192.168.1.16 SSH 1514 Server: Encrypted packet (len=1448)
   46 0.122333231 192.168.1.16 → 10.6.15.145  TCP 66 52104 → 22 [ACK] Seq=1 Ack=36149 Win=1426 Len=0 TSval=1145695 TSecr=23960217
   47 0.126156872  10.6.15.145 → 192.168.1.16 SSH 1514 Server: Encrypted packet (len=1448)
   48 0.126371281  10.6.15.145 → 192.168.1.16 SSH 1514 Server: Encrypted packet (len=1448)
   49 0.126393802 192.168.1.16 → 10.6.15.145  TCP 66 52104 → 22 [ACK] Seq=1 Ack=39045 Win=1426 Len=0 TSval=1145696 TSecr=23960217
   50 0.128726022  10.6.15.145 → 192.168.1.16 SSH 1514 Server: Encrypted packet (len=1448)
   51 0.128953035  10.6.15.145 → 192.168.1.16 SSH 1514 Server: Encrypted packet (len=1448)
   52 0.128968026 192.168.1.16 → 10.6.15.145  TCP 66 52104 → 22 [ACK] Seq=1 Ack=41941 Win=1426 Len=0 TSval=1145696 TSecr=23960219
   53 0.129115293  10.6.15.145 → 192.168.1.16 SSH 374 Server: Encrypted packet (len=308)
   54 0.170312765 192.168.1.16 → 10.6.15.145  TCP 66 52104 → 22 [ACK] Seq=1 Ack=42249 Win=1426 Len=0 TSval=1145707 TSecr=23960219
   55 0.205762853  10.6.15.145 → 192.168.1.16 SSH 110 Server: Encrypted packet (len=44)
   56 0.205841285 192.168.1.16 → 10.6.15.145  TCP 66 52104 → 22 [ACK] Seq=1 Ack=42293 Win=1426 Len=0 TSval=1145715 TSecr=23960238
   57 0.206221130 192.168.1.16 → 10.6.15.145  SSH 158 Client: Encrypted packet (len=92)
   58 0.207771950  10.6.15.145 → 192.168.1.16 TCP 66 22 → 52104 [ACK] Seq=42293 Ack=93 Win=1452 Len=0 TSval=23960239 TSecr=1145715
   59 0.213245958  10.6.15.145 → 192.168.1.16 SSH 1514 Server: Encrypted packet (len=1448)
   60 0.213319285  10.6.15.145 → 192.168.1.16 SSH 654 Server: Encrypted packet (len=588)
   61 0.213376809 192.168.1.16 → 10.6.15.145  TCP 66 52104 → 22 [ACK] Seq=93 Ack=44329 Win=1426 Len=0 TSval=1145717 TSecr=23960240
   62 0.213736943  10.6.15.145 → 192.168.1.16 SSH 1514 Server: Encrypted packet (len=1448)
   63 0.213800989  10.6.15.145 → 192.168.1.16 SSH 574 Server: Encrypted packet (len=508)
   64 0.213822290 192.168.1.16 → 10.6.15.145  TCP 66 52104 → 22 [ACK] Seq=93 Ack=46285 Win=1426 Len=0 TSval=1145717 TSecr=23960240
   65 0.215055349 192.168.1.16 → 10.6.15.145  SSH 206 Client: Encrypted packet (len=140)
   66 0.219713992  10.6.15.145 → 192.168.1.16 SSH 454 Server: Encrypted packet (len=388)
   67 0.237376865  10.6.15.145 → 192.168.1.16 SSH 110 Server: Encrypted packet (len=44)
   68 0.237442574 192.168.1.16 → 10.6.15.145  TCP 66 52104 → 22 [ACK] Seq=233 Ack=46717 Win=1426 Len=0 TSval=1145723 TSecr=23960242
   69 0.261134570 192.168.1.16 → 10.6.15.145  SSH 158 Client: Encrypted packet (len=92)
   70 0.272091874  10.6.15.145 → 192.168.1.16 SSH 1514 Server: Encrypted packet (len=1448)
   71 0.272322733  10.6.15.145 → 192.168.1.16 SSH 1514 Server: Encrypted packet (len=1448)
   72 0.272333214  10.6.15.145 → 192.168.1.16 SSH 110 Server: Encrypted packet (len=44)
   73 0.272360567 192.168.1.16 → 10.6.15.145  TCP 66 52104 → 22 [ACK] Seq=325 Ack=49657 Win=1426 Len=0 TSval=1145732 TSecr=23960254
   74 0.272586530  10.6.15.145 → 192.168.1.16 SSH 1514 Server: Encrypted packet (len=1448)
   75 0.272825782  10.6.15.145 → 192.168.1.16 SSH 1514 Server: Encrypted packet (len=1448)
   76 0.272855443 192.168.1.16 → 10.6.15.145  TCP 66 52104 → 22 [ACK] Seq=325 Ack=52553 Win=1426 Len=0 TSval=1145732 TSecr=23960255
   77 0.273580015  10.6.15.145 → 192.168.1.16 SSH 1486 Server: Encrypted packet (len=1420)
   78 0.306650582  10.6.15.145 → 192.168.1.16 SSH 1310 Server: Encrypted packet (len=1244)
   79 0.306672257 192.168.1.16 → 10.6.15.145  TCP 66 52104 → 22 [ACK] Seq=325 Ack=55217 Win=1422 Len=0 TSval=1145741 TSecr=23960255
   80 0.307013808  10.6.15.145 → 192.168.1.16 SSH 1514 Server: Encrypted packet (len=1448)
   81 0.307026215  10.6.15.145 → 192.168.1.16 SSH 230 Server: Encrypted packet (len=164)
   82 0.307031595 192.168.1.16 → 10.6.15.145  TCP 66 52104 → 22 [ACK] Seq=325 Ack=56829 Win=1422 Len=0 TSval=1145741 TSecr=23960263
   83 0.310422389 192.168.1.16 → 10.6.15.145  SSH 206 Client: Encrypted packet (len=140)
   84 0.321363617 192.168.1.16 → 10.6.15.145  SSH 462 Client: Encrypted packet (len=396)
   85 0.322875714  10.6.15.145 → 192.168.1.16 TCP 66 22 → 52104 [ACK] Seq=56829 Ack=861 Win=1452 Len=0 TSval=23960267 TSecr=1145742
   86 0.349981139  10.6.15.145 → 192.168.1.16 SSH 438 Server: Encrypted packet (len=372)
   87 0.390314323 192.168.1.16 → 10.6.15.145  TCP 66 52104 → 22 [ACK] Seq=861 Ack=57201 Win=1426 Len=0 TSval=1145762 TSecr=23960274
   88 0.939376808 192.168.1.16 → 224.0.0.251  MDNS 78 Standard query 0x0000 PTR _privet._tcp.local, "QM" question
   89 0.940162860 fe80::60bd:1940:a0d8:49f9 → ff02::fb     MDNS 98 Standard query 0x0000 PTR _privet._tcp.local, "QM" question
   90 0.941539457  10.6.15.145 → 192.168.1.16 SSH 1514 Server: Encrypted packet (len=1448)
   91 0.941565955 192.168.1.16 → 10.6.15.145  TCP 66 52104 → 22 [ACK] Seq=861 Ack=58649 Win=1422 Len=0 TSval=1145899 TSecr=23960334
   92 0.942486803  10.6.15.145 → 192.168.1.16 SSH 1514 Server: Encrypted packet (len=1448)
   93 0.942496224 192.168.1.16 → 10.6.15.145  TCP 66 52104 → 22 [ACK] Seq=861 Ack=60097 Win=1422 Len=0 TSval=1145900 TSecr=23960334
   94 0.942602051  10.6.15.145 → 192.168.1.16 SSH 110 Server: Encrypted packet (len=44)
   95 0.942608557 192.168.1.16 → 10.6.15.145  TCP 66 52104 → 22 [ACK] Seq=861 Ack=60141 Win=1422 Len=0 TSval=1145900 TSecr=23960334
   96 0.942728778  10.6.15.145 → 192.168.1.16 SSH 686 Server: Encrypted packet (len=620)
   97 0.942733601 192.168.1.16 → 10.6.15.145  TCP 66 52104 → 22 [ACK] Seq=861 Ack=60761 Win=1422 Len=0 TSval=1145900 TSecr=23960334
   98 0.942840616  10.6.15.145 → 192.168.1.16 SSH 686 Server: [TCP Spurious Retransmission] , Encrypted packet (len=620)
   99 0.942846760 192.168.1.16 → 10.6.15.145  TCP 78 [TCP Window Update] 52104 → 22 [ACK] Seq=861 Ack=60761 Win=1426 Len=0 TSval=1145900 TSecr=23960344 SLE=60141 SRE=60761
  100 0.943102551  10.6.15.145 → 192.168.1.16 TCP 1514 [TCP Out-Of-Order] 22 → 52104 [ACK] Seq=57201 Ack=861 Win=1452 Len=1448 TSval=23960401 TSecr=1145762
  101 0.943106742 192.168.1.16 → 10.6.15.145  TCP 78 [TCP Dup ACK 97#1] 52104 → 22 [ACK] Seq=861 Ack=60761 Win=1426 Len=0 TSval=1145900 TSecr=23960344 SLE=57201 SRE=58649
  102 1.070354952 192.168.1.16 → 10.6.15.145  SSH 110 Client: Encrypted packet (len=44)
  103 1.075832381  10.6.15.145 → 192.168.1.16 SSH 110 Server: Encrypted packet (len=44)
  104 1.075863021 192.168.1.16 → 10.6.15.145  TCP 66 52104 → 22 [ACK] Seq=905 Ack=60805 Win=1426 Len=0 TSval=1145933 TSecr=23960456
  105 1.076382042 192.168.1.16 → 10.6.15.145  SSH 158 Client: Encrypted packet (len=92)
  106 1.082466111  10.6.15.145 → 192.168.1.16 SSH 1514 Server: Encrypted packet (len=1448)
  107 1.082679598  10.6.15.145 → 192.168.1.16 SSH 1430 Server: Encrypted packet (len=1364)
  108 1.082766552 192.168.1.16 → 10.6.15.145  TCP 66 52104 → 22 [ACK] Seq=997 Ack=63617 Win=1426 Len=0 TSval=1145935 TSecr=23960457
  109 1.084370990 192.168.1.16 → 10.6.15.145  SSH 174 Client: Encrypted packet (len=108)
  110 1.088767198  10.6.15.145 → 192.168.1.16 SSH 454 Server: Encrypted packet (len=388)
  111 1.088807225 192.168.1.16 → 10.6.15.145  SSH 222 Client: Encrypted packet (len=156)
  112 1.089078671 192.168.1.16 → 10.6.15.145  SSH 462 Client: Encrypted packet (len=396)
  113 1.089330176 192.168.1.16 → 10.6.15.145  SSH 126 Client: Encrypted packet (len=60)
  114 1.091961595  10.6.15.145 → 192.168.1.16 TCP 66 22 → 52104 [ACK] Seq=64005 Ack=1717 Win=1452 Len=0 TSval=23960460 TSecr=1145936
  115 1.095010144  10.6.15.145 → 192.168.1.16 SSH 134 Server: Encrypted packet (len=68)
  116 1.138310012 192.168.1.16 → 10.6.15.145  TCP 66 52104 → 22 [ACK] Seq=1717 Ack=64073 Win=1426 Len=0 TSval=1145949 TSecr=23960460
  117 1.178827572  10.6.15.145 → 192.168.1.16 SSH 526 Server: Encrypted packet (len=460)
  118 1.178850486 192.168.1.16 → 10.6.15.145  TCP 66 52104 → 22 [ACK] Seq=1717 Ack=64533 Win=1423 Len=0 TSval=1145959 TSecr=23960481
  119 1.179563563 192.168.1.16 → 10.6.15.145  SSH 134 Client: Encrypted packet (len=68)
  120 1.219132775  10.6.15.145 → 192.168.1.16 TCP 66 22 → 52104 [ACK] Seq=64533 Ack=1785 Win=1452 Len=0 TSval=23960492 TSecr=1145959
  121 1.488674061 192.168.1.16 → 224.0.0.252  LLMNR 64 Standard query 0x8c38 A wpad
  122 1.749952983 192.168.1.16 → 224.0.0.252  LLMNR 64 Standard query 0x8c38 A wpad
  123 1.870351994 192.168.1.16 → 10.6.15.145  SSH 118 Client: Encrypted packet (len=52)
  124 1.873318622 192.168.1.16 → 10.6.15.145  SSH 302 Client: Encrypted packet (len=236)
  125 1.873546812 192.168.1.16 → 10.6.15.145  SSH 126 Client: Encrypted packet (len=60)
  126 1.874312962 192.168.1.16 → 10.6.15.145  SSH 870 Client: Encrypted packet (len=804)
  127 1.875770521  10.6.15.145 → 192.168.1.16 TCP 66 22 → 52104 [ACK] Seq=64533 Ack=2073 Win=1452 Len=0 TSval=23960656 TSecr=1146127
  128 1.878008576  10.6.15.145 → 192.168.1.16 TCP 66 22 → 52104 [ACK] Seq=64533 Ack=2937 Win=1452 Len=0 TSval=23960656 TSecr=1146132
  129 1.903663912 192.168.1.16 → 10.6.15.145  SSH 142 Client: Encrypted packet (len=76)
  130 1.904388600 192.168.1.16 → 10.6.15.145  SSH 750 Client: Encrypted packet (len=684)
  131 1.909596739  10.6.15.145 → 192.168.1.16 TCP 66 22 → 52104 [ACK] Seq=64533 Ack=3013 Win=1452 Len=0 TSval=23960664 TSecr=1146140
  132 1.910356582  10.6.15.145 → 192.168.1.16 TCP 66 22 → 52104 [ACK] Seq=64533 Ack=3697 Win=1452 Len=0 TSval=23960664 TSecr=1146140
  133 1.917803854  10.6.15.145 → 192.168.1.16 SSH 494 Server: Encrypted packet (len=428)
  134 1.918470144 192.168.1.16 → 10.6.15.145  SSH 134 Client: Encrypted packet (len=68)
  135 1.928414038  10.6.15.145 → 192.168.1.16 SSH 102 Server: Encrypted packet (len=36)
  136 1.928745860 192.168.1.16 → 10.6.15.145  SSH 174 Client: Encrypted packet (len=108)
  137 1.971360232  10.6.15.145 → 192.168.1.16 TCP 66 22 → 52104 [ACK] Seq=64997 Ack=3873 Win=1452 Len=0 TSval=23960680 TSecr=1146146
  138 1.971828902  10.6.15.145 → 192.168.1.16 SSH 638 Server: Encrypted packet (len=572)
  139 1.972147835  10.6.15.145 → 192.168.1.16 SSH 1110 Server: Encrypted packet (len=1044)
  140 1.972196952 192.168.1.16 → 10.6.15.145  TCP 66 52104 → 22 [ACK] Seq=3873 Ack=66613 Win=1426 Len=0 TSval=1146157 TSecr=23960680
  141 1.972980849 192.168.1.16 → 10.6.15.145  SSH 206 Client: Encrypted packet (len=140)
  142 1.975770119  10.6.15.145 → 192.168.1.16 TCP 66 22 → 52104 [ACK] Seq=66613 Ack=4013 Win=1452 Len=0 TSval=23960681 TSecr=1146157
  143 1.977577116 192.168.1.16 → 10.6.15.145  SSH 142 Client: Encrypted packet (len=76)
  144 1.979340514 192.168.1.16 → 10.6.15.145  SSH 1198 Client: Encrypted packet (len=1132)
  145 1.980867662  10.6.15.145 → 192.168.1.16 TCP 66 22 → 52104 [ACK] Seq=66613 Ack=4089 Win=1452 Len=0 TSval=23960682 TSecr=1146158
  146 1.983746053  10.6.15.145 → 192.168.1.16 TCP 66 22 → 52104 [ACK] Seq=66613 Ack=5221 Win=1452 Len=0 TSval=23960682 TSecr=1146159
  147 1.999947035 192.168.1.16 → 224.0.0.252  LLMNR 64 Standard query 0x8c38 A wpad
  148 2.012436710  10.6.15.145 → 192.168.1.16 SSH 382 Server: Encrypted packet (len=316)
  149 2.012717898 192.168.1.16 → 10.6.15.145  SSH 126 Client: Encrypted packet (len=60)
  150 2.018696068  10.6.15.145 → 192.168.1.16 SSH 134 Server: Encrypted packet (len=68)
  151 2.037900211  10.6.15.145 → 192.168.1.16 SSH 134 Server: Encrypted packet (len=68)
  152 2.037965378 192.168.1.16 → 10.6.15.145  TCP 66 52104 → 22 [ACK] Seq=5281 Ack=67065 Win=1426 Len=0 TSval=1146173 TSecr=23960691
  153 2.116736640 192.168.1.16 → 10.6.15.145  SSH 102 Client: Encrypted packet (len=36)
  154 2.120002532 192.168.1.16 → 10.6.15.145  SSH 102 Client: Encrypted packet (len=36)
  155 2.121439478  10.6.15.145 → 192.168.1.16 TCP 66 22 → 52104 [ACK] Seq=67065 Ack=5353 Win=1452 Len=0 TSval=23960717 TSecr=1146193
  156 2.144095136  10.6.15.145 → 192.168.1.16 SSH 630 Server: Encrypted packet (len=564)
  157 2.153758041 192.168.1.16 → 10.6.15.145  SSH 118 Client: Encrypted packet (len=52)
  158 2.159696185  10.6.15.145 → 192.168.1.16 SSH 110 Server: Encrypted packet (len=44)
  159 2.159814277  10.6.15.145 → 192.168.1.16 SSH 102 Server: Encrypted packet (len=36)
  160 2.159841888 192.168.1.16 → 10.6.15.145  TCP 66 52104 → 22 [ACK] Seq=5405 Ack=67709 Win=1426 Len=0 TSval=1146204 TSecr=23960726
  161 2.159949082 192.168.1.16 → 10.6.15.145  SSH 158 Client: Encrypted packet (len=92)
  162 2.160251176 192.168.1.16 → 10.6.15.145  SSH 150 Client: Encrypted packet (len=84)
  163 2.162721830  10.6.15.145 → 192.168.1.16 TCP 66 22 → 52104 [ACK] Seq=67709 Ack=5581 Win=1452 Len=0 TSval=23960727 TSecr=1146204
  164 2.195003456  10.6.15.145 → 192.168.1.16 SSH 630 Server: Encrypted packet (len=564)
  165 2.200588110  10.6.15.145 → 192.168.1.16 SSH 1422 Server: Encrypted packet (len=1356)
  166 2.200610319  10.6.15.145 → 192.168.1.16 SSH 510 Server: Encrypted packet (len=444)
  167 2.200666398 192.168.1.16 → 10.6.15.145  TCP 66 52104 → 22 [ACK] Seq=5581 Ack=70073 Win=1426 Len=0 TSval=1146214 TSecr=23960735
  168 2.201629119 192.168.1.16 → 10.6.15.145  SSH 206 Client: Encrypted packet (len=140)
  169 2.203165926 192.168.1.16 → 10.6.15.145  SSH 206 Client: Encrypted packet (len=140)
  170 2.204060704 192.168.1.16 → 10.6.15.145  SSH 102 Client: Encrypted packet (len=36)
  171 2.204351531 192.168.1.16 → 10.6.15.145  SSH 610 Client: Encrypted packet (len=544)
  172 2.204868349 192.168.1.16 → 10.6.15.145  SSH 206 Client: Encrypted packet (len=140)
  173 2.204983227  10.6.15.145 → 192.168.1.16 TCP 66 22 → 52104 [ACK] Seq=70073 Ack=5861 Win=1452 Len=0 TSval=23960738 TSecr=1146214
  174 2.206128308  10.6.15.145 → 192.168.1.16 TCP 66 22 → 52104 [ACK] Seq=70073 Ack=6441 Win=1452 Len=0 TSval=23960738 TSecr=1146215
  175 2.239435587  10.6.15.145 → 192.168.1.16 SSH 358 Server: Encrypted packet (len=292)
  176 2.239741561 192.168.1.16 → 10.6.15.145  SSH 126 Client: Encrypted packet (len=60)
  177 2.242147523  10.6.15.145 → 192.168.1.16 SSH 350 Server: Encrypted packet (len=284)
  178 2.242164604  10.6.15.145 → 192.168.1.16 SSH 126 Server: Encrypted packet (len=60)
  179 2.242214405 192.168.1.16 → 10.6.15.145  TCP 66 52104 → 22 [ACK] Seq=6641 Ack=70709 Win=1426 Len=0 TSval=1146224 TSecr=23960747
  180 2.242329002  10.6.15.145 → 192.168.1.16 SSH 138 Server: Encrypted packet (len=72)
  181 2.242449226 192.168.1.16 → 10.6.15.145  SSH 102 Client: Encrypted packet (len=36)
  182 2.245172749  10.6.15.145 → 192.168.1.16 SSH 750 Server: Encrypted packet (len=684)
  183 2.252316622 192.168.1.16 → 10.6.15.145  SSH 230 Client: Encrypted packet (len=164)
  184 2.252528241 192.168.1.16 → 10.6.15.145  SSH 126 Client: Encrypted packet (len=60)
  185 2.252690615 192.168.1.16 → 10.6.15.145  SSH 1030 Client: Encrypted packet (len=964)
  186 2.253047551 192.168.1.16 → 10.6.15.145  SSH 206 Client: Encrypted packet (len=140)
  187 2.254029065  10.6.15.145 → 192.168.1.16 TCP 66 22 → 52104 [ACK] Seq=71465 Ack=6901 Win=1452 Len=0 TSval=23960750 TSecr=1146225
  188 2.254456317  10.6.15.145 → 192.168.1.16 TCP 66 22 → 52104 [ACK] Seq=71465 Ack=8005 Win=1452 Len=0 TSval=23960750 TSecr=1146227
  189 2.289065141  10.6.15.145 → 192.168.1.16 SSH 134 Server: Encrypted packet (len=68)
  190 2.330368803 192.168.1.16 → 10.6.15.145  TCP 66 52104 → 22 [ACK] Seq=8005 Ack=71533 Win=1426 Len=0 TSval=1146247 TSecr=23960759
  191 2.371393676  10.6.15.145 → 192.168.1.16 SSH 110 Server: Encrypted packet (len=44)
  192 2.371466770 192.168.1.16 → 10.6.15.145  TCP 66 52104 → 22 [ACK] Seq=8005 Ack=71577 Win=1426 Len=0 TSval=1146257 TSecr=23960780
  193 2.371724730 192.168.1.16 → 10.6.15.145  SSH 150 Client: Encrypted packet (len=84)
  194 2.411102160  10.6.15.145 → 192.168.1.16 TCP 66 22 → 52104 [ACK] Seq=71577 Ack=8089 Win=1452 Len=0 TSval=23960790 TSecr=1146257
  195 2.481055260  10.6.15.145 → 192.168.1.16 SSH 1510 Server: Encrypted packet (len=1444)
  196 2.492227114  10.6.15.145 → 192.168.1.16 SSH 1222 Server: Encrypted packet (len=1156)
  197 2.492301371 192.168.1.16 → 10.6.15.145  TCP 66 52104 → 22 [ACK] Seq=8089 Ack=74177 Win=1426 Len=0 TSval=1146287 TSecr=23960807
  198 2.591113251  10.6.15.145 → 192.168.1.16 SSH 1514 Server: Encrypted packet (len=1448)
  199 2.591137361  10.6.15.145 → 192.168.1.16 SSH 270 Server: Encrypted packet (len=204)
  200 2.591156279  10.6.15.145 → 192.168.1.16 SSH 558 Server: Encrypted packet (len=492)
  201 2.591209194 192.168.1.16 → 10.6.15.145  TCP 66 52104 → 22 [ACK] Seq=8089 Ack=76321 Win=1426 Len=0 TSval=1146312 TSecr=23960834
  202 2.592205928 192.168.1.16 → 10.6.15.145  SSH 206 Client: Encrypted packet (len=140)
  203 2.593817244  10.6.15.145 → 192.168.1.16 TCP 66 22 → 52104 [ACK] Seq=76321 Ack=8229 Win=1452 Len=0 TSval=23960835 TSecr=1146312
  204 3.601658098 192.168.1.16 → 10.6.15.145  SSH 238 Client: Encrypted packet (len=172)
  205 3.604418436  10.6.15.145 → 192.168.1.16 SSH 150 Server: Encrypted packet (len=84)
  206 3.604429625  10.6.15.145 → 192.168.1.16 TCP 150 [TCP Retransmission] 22 → 52104 [PSH, ACK] Seq=76321 Ack=8229 Win=1452 Len=84 TSval=23960946 TSecr=1146312
  207 3.604434368 192.168.1.16 → 10.6.15.145  TCP 78 52104 → 22 [ACK] Seq=8401 Ack=76405 Win=1426 Len=0 TSval=1146565 TSecr=23960946 SLE=76321 SRE=76405
  208 3.604441362  10.6.15.145 → 192.168.1.16 SSH 150 Server: [TCP Spurious Retransmission] , Encrypted packet (len=84)
  209 3.604443450 192.168.1.16 → 10.6.15.145  TCP 78 [TCP Dup ACK 207#1] 52104 → 22 [ACK] Seq=8401 Ack=76405 Win=1426 Len=0 TSval=1146565 TSecr=23961006 SLE=76321 SRE=76405
  210 3.604906149  10.6.15.145 → 192.168.1.16 TCP 66 22 → 52104 [ACK] Seq=76405 Ack=8401 Win=1452 Len=0 TSval=23961088 TSecr=1146564
  211 3.608032422 192.168.1.16 → 10.6.15.145  SSH 638 Client: Encrypted packet (len=572)
  212 3.609757320  10.6.15.145 → 192.168.1.16 TCP 66 22 → 52104 [ACK] Seq=76405 Ack=8973 Win=1452 Len=0 TSval=23961089 TSecr=1146566
  213 5.152348867  10.6.15.145 → 192.168.1.16 SSH 270 Server: Encrypted packet (len=204)
  214 5.152372113  10.6.15.145 → 192.168.1.16 SSH 358 Server: Encrypted packet (len=292)
  215 5.152428190 192.168.1.16 → 10.6.15.145  TCP 66 52104 → 22 [ACK] Seq=8973 Ack=76901 Win=1426 Len=0 TSval=1146952 TSecr=23961143
  216 5.152570742  10.6.15.145 → 192.168.1.16 SSH 1514 Server: Encrypted packet (len=1448)
  217 5.152900972  10.6.15.145 → 192.168.1.16 SSH 1514 Server: Encrypted packet (len=1448)
  218 5.152932110 192.168.1.16 → 10.6.15.145  TCP 66 52104 → 22 [ACK] Seq=8973 Ack=79797 Win=1426 Len=0 TSval=1146952 TSecr=23961156
  219 5.153093808  10.6.15.145 → 192.168.1.16 SSH 1514 Server: Encrypted packet (len=1448)
  220 5.153106561  10.6.15.145 → 192.168.1.16 SSH 110 Server: Encrypted packet (len=44)
  221 5.153125516 192.168.1.16 → 10.6.15.145  TCP 66 52104 → 22 [ACK] Seq=8973 Ack=81289 Win=1426 Len=0 TSval=1146952 TSecr=23961156
  222 5.153307235  10.6.15.145 → 192.168.1.16 SSH 1514 Server: Encrypted packet (len=1448)
  223 5.153504826  10.6.15.145 → 192.168.1.16 SSH 1514 Server: Encrypted packet (len=1448)
  224 5.153527789 192.168.1.16 → 10.6.15.145  TCP 66 52104 → 22 [ACK] Seq=8973 Ack=84185 Win=1426 Len=0 TSval=1146952 TSecr=23961156
  225 5.153668298  10.6.15.145 → 192.168.1.16 SSH 366 Server: Encrypted packet (len=300)
  226 5.153713936  10.6.15.145 → 192.168.1.16 TCP 366 [TCP Retransmission] 22 → 52104 [PSH, ACK] Seq=84185 Ack=8973 Win=1452 Len=300 TSval=23961200 TSecr=1146566
  227 5.153720486 192.168.1.16 → 10.6.15.145  TCP 78 52104 → 22 [ACK] Seq=8973 Ack=84485 Win=1426 Len=0 TSval=1146952 TSecr=23961200 SLE=84185 SRE=84485
  228 5.153795522  10.6.15.145 → 192.168.1.16 TCP 562 [TCP Out-Of-Order] 22 → 52104 [PSH, ACK] Seq=76405 Ack=8973 Win=1452 Len=496 TSval=23961375 TSecr=1146566
  229 5.153799755 192.168.1.16 → 10.6.15.145  TCP 78 [TCP Dup ACK 227#1] 52104 → 22 [ACK] Seq=8973 Ack=84485 Win=1426 Len=0 TSval=1146952 TSecr=23961200 SLE=76405 SRE=76901
  230 5.374336500 192.168.1.16 → 74.125.68.188 TCP 66 41530 → 5228 [FIN, ACK] Seq=1 Ack=1 Win=229 Len=0 TSval=1147008 TSecr=2385297628
  231 6.357966371 fe80::60bd:1940:a0d8:49f9 → ff02::fb     MDNS 102 Standard query 0x0000 PTR _pgpkey-hkp._tcp.local, "QM" question
  232 6.358678120 192.168.1.16 → 224.0.0.251  MDNS 82 Standard query 0x0000 PTR _pgpkey-hkp._tcp.local, "QM" question
  233 11.030257637 192.168.1.16 → 10.6.15.145  SSH 1278 Client: Encrypted packet (len=1212)
  234 11.034117185  10.6.15.145 → 192.168.1.16 TCP 66 22 → 52104 [ACK] Seq=84485 Ack=10185 Win=1452 Len=0 TSval=23962945 TSecr=1148421
  235 11.035825056  10.6.15.145 → 192.168.1.16 SSH 142 Server: Encrypted packet (len=76)
  236 11.035856503 192.168.1.16 → 10.6.15.145  TCP 66 52104 → 22 [ACK] Seq=10185 Ack=84561 Win=1426 Len=0 TSval=1148423 TSecr=23962946
  237 12.160371243  10.6.15.145 → 192.168.1.16 SSH 182 Server: Encrypted packet (len=116)
  238 12.160406958 192.168.1.16 → 10.6.15.145  TCP 66 52104 → 22 [ACK] Seq=10185 Ack=84677 Win=1426 Len=0 TSval=1148704 TSecr=23962986
  239 12.160518273  10.6.15.145 → 192.168.1.16 SSH 1514 Server: Encrypted packet (len=1448)
  240 12.160525930 192.168.1.16 → 10.6.15.145  TCP 66 52104 → 22 [ACK] Seq=10185 Ack=86125 Win=1422 Len=0 TSval=1148704 TSecr=23962986
  241 12.160730742  10.6.15.145 → 192.168.1.16 SSH 1494 Server: Encrypted packet (len=1428)
  242 12.160744383 192.168.1.16 → 10.6.15.145  TCP 66 52104 → 22 [ACK] Seq=10185 Ack=87553 Win=1422 Len=0 TSval=1148704 TSecr=23962986
  243 12.161578344  10.6.15.145 → 192.168.1.16 SSH 1514 Server: Encrypted packet (len=1448)
  244 12.161603451 192.168.1.16 → 10.6.15.145  TCP 66 52104 → 22 [ACK] Seq=10185 Ack=89001 Win=1422 Len=0 TSval=1148704 TSecr=23962986
  245 12.161644724  10.6.15.145 → 192.168.1.16 SSH 1126 Server: Encrypted packet (len=1060)
  246 12.161655380 192.168.1.16 → 10.6.15.145  TCP 66 52104 → 22 [ACK] Seq=10185 Ack=90061 Win=1422 Len=0 TSval=1148704 TSecr=23962986
  247 12.161692016  10.6.15.145 → 192.168.1.16 SSH 526 Server: Encrypted packet (len=460)
  248 12.161696667 192.168.1.16 → 10.6.15.145  TCP 66 52104 → 22 [ACK] Seq=10185 Ack=90521 Win=1422 Len=0 TSval=1148704 TSecr=23962986
  249 12.162642194 192.168.1.16 → 10.6.15.145  SSH 134 Client: Encrypted packet (len=68)
  250 12.164323188 192.168.1.16 → 10.6.15.145  SSH 1514 Client: Encrypted packet (len=1448)
  251 12.165008643 192.168.1.16 → 10.6.15.145  SSH 190 Client: Encrypted packet (len=124)
  252 12.166562696  10.6.15.145 → 192.168.1.16 TCP 66 22 → 52104 [ACK] Seq=90521 Ack=11825 Win=1452 Len=0 TSval=23963228 TSecr=1148705
  253 13.156159255  10.6.15.145 → 192.168.1.16 SSH 1022 Server: Encrypted packet (len=956)
  254 13.156203143  10.6.15.145 → 192.168.1.16 SSH 478 Server: Encrypted packet (len=412)
  255 13.156312575 192.168.1.16 → 10.6.15.145  TCP 66 52104 → 22 [ACK] Seq=11825 Ack=91889 Win=1426 Len=0 TSval=1148953 TSecr=23963258
  256 13.157556650 192.168.1.16 → 10.6.15.145  SSH 134 Client: Encrypted packet (len=68)
  257 13.370315108 192.168.1.16 → 10.6.15.145  TCP 134 [TCP Retransmission] 52104 → 22 [PSH, ACK] Seq=11825 Ack=91889 Win=1426 Len=68 TSval=1149007 TSecr=23963258
  258 13.586360768 192.168.1.16 → 10.6.15.145  TCP 134 [TCP Retransmission] 52104 → 22 [PSH, ACK] Seq=11825 Ack=91889 Win=1426 Len=68 TSval=1149061 TSecr=23963258
  259 14.014363954 192.168.1.16 → 10.6.15.145  TCP 134 [TCP Retransmission] 52104 → 22 [PSH, ACK] Seq=11825 Ack=91889 Win=1426 Len=68 TSval=1149168 TSecr=23963258
  260 14.018630007  10.6.15.145 → 192.168.1.16 SSH 478 Server: [TCP Spurious Retransmission] , Encrypted packet (len=412)
  261 14.018651040 192.168.1.16 → 10.6.15.145  TCP 78 [TCP Dup ACK 255#1] 52104 → 22 [ACK] Seq=11893 Ack=91889 Win=1426 Len=0 TSval=1149169 TSecr=23963654 SLE=91477 SRE=91889
  262 14.878370668 192.168.1.16 → 10.6.15.145  TCP 134 [TCP Retransmission] 52104 → 22 [PSH, ACK] Seq=11825 Ack=91889 Win=1426 Len=68 TSval=1149384 TSecr=23963654
  263 14.889028404  10.6.15.145 → 192.168.1.16 TCP 66 22 → 52104 [ACK] Seq=91889 Ack=11893 Win=1452 Len=0 TSval=23963730 TSecr=1149168
  264 14.890276958  10.6.15.145 → 192.168.1.16 TCP 78 [TCP Dup ACK 263#1] 22 → 52104 [ACK] Seq=91889 Ack=11893 Win=1452 Len=0 TSval=23963907 TSecr=1149384 SLE=11825 SRE=11893
  265 20.130444391  10.6.15.145 → 192.168.1.16 SSH 174 Server: Encrypted packet (len=108)
  266 20.130481273 192.168.1.16 → 10.6.15.145  TCP 66 52104 → 22 [ACK] Seq=11893 Ack=91997 Win=1426 Len=0 TSval=1150697 TSecr=23964936
  267 20.130511605  10.6.15.145 → 192.168.1.16 SSH 102 Server: Encrypted packet (len=36)
  268 20.130522386 192.168.1.16 → 10.6.15.145  TCP 66 52104 → 22 [ACK] Seq=11893 Ack=92033 Win=1426 Len=0 TSval=1150697 TSecr=23964936
  269 20.130532311  10.6.15.145 → 192.168.1.16 SSH 166 Server: Encrypted packet (len=100)
  270 20.130536175 192.168.1.16 → 10.6.15.145  TCP 66 52104 → 22 [ACK] Seq=11893 Ack=92133 Win=1426 Len=0 TSval=1150697 TSecr=23965081
  271 20.137639857  10.6.15.145 → 192.168.1.16 SSH 102 Server: Encrypted packet (len=36)
  272 20.137668495 192.168.1.16 → 10.6.15.145  TCP 66 52104 → 22 [ACK] Seq=11893 Ack=92169 Win=1426 Len=0 TSval=1150698 TSecr=23965081
  273 20.137705078  10.6.15.145 → 192.168.1.16 SSH 166 Server: Encrypted packet (len=100)
  274 20.137712531 192.168.1.16 → 10.6.15.145  TCP 66 52104 → 22 [ACK] Seq=11893 Ack=92269 Win=1426 Len=0 TSval=1150698 TSecr=23965196
  275 20.137728951  10.6.15.145 → 192.168.1.16 SSH 102 Server: Encrypted packet (len=36)
  276 20.137736354 192.168.1.16 → 10.6.15.145  TCP 66 52104 → 22 [ACK] Seq=11893 Ack=92305 Win=1426 Len=0 TSval=1150698 TSecr=23965196
  277 20.478367947 192.168.1.16 → 74.125.68.188 TCP 66 [TCP Retransmission] 41530 → 5228 [FIN, ACK] Seq=1 Ack=1 Win=229 Len=0 TSval=1150784 TSecr=2385297628
  278 22.374455984 fe80::60bd:1940:a0d8:49f9 → ff02::fb     MDNS 102 Standard query 0x0000 PTR _pgpkey-hkp._tcp.local, "QM" question
  279 22.375220108 192.168.1.16 → 224.0.0.251  MDNS 82 Standard query 0x0000 PTR _pgpkey-hkp._tcp.local, "QM" question
  280 24.257146962 10.22.18.220 → 224.0.0.252  LLMNR 66 Standard query 0x1281 A isatap
  281 26.147716116 10.22.18.220 → 224.0.0.252  LLMNR 66 Standard query 0x1281 A isatap
