    1 0.000000000  10.6.15.145 → 192.168.1.16 SSH 1514 Server: Encrypted packet (len=1448)
    2 0.000023834 192.168.1.16 → 10.6.15.145  TCP 66 52104 → 22 [ACK] Seq=1 Ack=1449 Win=1422 Len=0 TSval=1169208 TSecr=23983413
    3 0.000176480  10.6.15.145 → 192.168.1.16 SSH 1514 Server: Encrypted packet (len=1448)
    4 0.000179618 192.168.1.16 → 10.6.15.145  TCP 66 52104 → 22 [ACK] Seq=1 Ack=2897 Win=1422 Len=0 TSval=1169208 TSecr=23983413
    5 0.000265019  10.6.15.145 → 192.168.1.16 SSH 982 Server: Encrypted packet (len=916)
    6 0.000267021 192.168.1.16 → 10.6.15.145  TCP 66 52104 → 22 [ACK] Seq=1 Ack=3813 Win=1422 Len=0 TSval=1169208 TSecr=23983413
    7 0.000932200  10.6.15.145 → 192.168.1.16 SSH 1514 Server: Encrypted packet (len=1448)
    8 0.000939812 192.168.1.16 → 10.6.15.145  TCP 66 52104 → 22 [ACK] Seq=1 Ack=5261 Win=1422 Len=0 TSval=1169208 TSecr=23983497
    9 0.003913862  10.6.15.145 → 192.168.1.16 SSH 1514 Server: Encrypted packet (len=1448)
   10 0.003930077 192.168.1.16 → 10.6.15.145  TCP 66 52104 → 22 [ACK] Seq=1 Ack=6709 Win=1422 Len=0 TSval=1169209 TSecr=23983732
   11 0.004093500  10.6.15.145 → 192.168.1.16 SSH 1514 Server: Encrypted packet (len=1448)
   12 0.004096715 192.168.1.16 → 10.6.15.145  TCP 66 52104 → 22 [ACK] Seq=1 Ack=8157 Win=1422 Len=0 TSval=1169209 TSecr=23983732
   13 0.004284430  10.6.15.145 → 192.168.1.16 SSH 1514 Server: Encrypted packet (len=1448)
   14 0.004287210 192.168.1.16 → 10.6.15.145  TCP 66 52104 → 22 [ACK] Seq=1 Ack=9605 Win=1422 Len=0 TSval=1169209 TSecr=23983732
   15 0.007366025  10.6.15.145 → 192.168.1.16 SSH 1514 Server: Encrypted packet (len=1448)
   16 0.007369789 192.168.1.16 → 10.6.15.145  TCP 66 52104 → 22 [ACK] Seq=1 Ack=11053 Win=1422 Len=0 TSval=1169210 TSecr=23983732
   17 0.007544163  10.6.15.145 → 192.168.1.16 SSH 1514 Server: Encrypted packet (len=1448)
   18 0.007547544 192.168.1.16 → 10.6.15.145  TCP 66 52104 → 22 [ACK] Seq=1 Ack=12501 Win=1422 Len=0 TSval=1169210 TSecr=23983732
   19 0.007736542  10.6.15.145 → 192.168.1.16 SSH 1514 Server: Encrypted packet (len=1448)
   20 0.007739516 192.168.1.16 → 10.6.15.145  TCP 66 52104 → 22 [ACK] Seq=1 Ack=13949 Win=1422 Len=0 TSval=1169210 TSecr=23983732
   21 0.011044338  10.6.15.145 → 192.168.1.16 SSH 1514 Server: Encrypted packet (len=1448)
   22 0.011061710 192.168.1.16 → 10.6.15.145  TCP 66 52104 → 22 [ACK] Seq=1 Ack=15397 Win=1422 Len=0 TSval=1169211 TSecr=23983733
   23 0.011233741  10.6.15.145 → 192.168.1.16 SSH 1514 Server: Encrypted packet (len=1448)
   24 0.011239740 192.168.1.16 → 10.6.15.145  TCP 66 52104 → 22 [ACK] Seq=1 Ack=16845 Win=1422 Len=0 TSval=1169211 TSecr=23983733
   25 0.011425273  10.6.15.145 → 192.168.1.16 SSH 1514 Server: Encrypted packet (len=1448)
   26 0.011433836 192.168.1.16 → 10.6.15.145  TCP 66 52104 → 22 [ACK] Seq=1 Ack=18293 Win=1422 Len=0 TSval=1169211 TSecr=23983733
   27 0.013828359  10.6.15.145 → 192.168.1.16 SSH 1514 Server: Encrypted packet (len=1448)
   28 0.013859939 192.168.1.16 → 10.6.15.145  TCP 66 52104 → 22 [ACK] Seq=1 Ack=19741 Win=1422 Len=0 TSval=1169212 TSecr=23983734
   29 0.014010754  10.6.15.145 → 192.168.1.16 SSH 1514 Server: Encrypted packet (len=1448)
   30 0.014022585 192.168.1.16 → 10.6.15.145  TCP 66 52104 → 22 [ACK] Seq=1 Ack=21189 Win=1422 Len=0 TSval=1169212 TSecr=23983734
   31 0.014201919  10.6.15.145 → 192.168.1.16 SSH 1514 Server: Encrypted packet (len=1448)
   32 0.014213734 192.168.1.16 → 10.6.15.145  SSH 102 Client: Encrypted packet (len=36)
   33 0.014543633  10.6.15.145 → 192.168.1.16 SSH 1514 Server: Encrypted packet (len=1448)
   34 0.014577640 192.168.1.16 → 10.6.15.145  TCP 66 52104 → 22 [ACK] Seq=37 Ack=24085 Win=1426 Len=0 TSval=1169212 TSecr=23983734
   35 0.016736064  10.6.15.145 → 192.168.1.16 SSH 1514 Server: Encrypted packet (len=1448)
   36 0.016918387  10.6.15.145 → 192.168.1.16 SSH 1514 Server: Encrypted packet (len=1448)
   37 0.016949662 192.168.1.16 → 10.6.15.145  TCP 66 52104 → 22 [ACK] Seq=37 Ack=26981 Win=1426 Len=0 TSval=1169212 TSecr=23983735
   38 0.017266847  10.6.15.145 → 192.168.1.16 SSH 1514 Server: Encrypted packet (len=1448)
   39 0.017456941  10.6.15.145 → 192.168.1.16 SSH 1514 Server: Encrypted packet (len=1448)
   40 0.017487200 192.168.1.16 → 10.6.15.145  TCP 66 52104 → 22 [ACK] Seq=37 Ack=29877 Win=1426 Len=0 TSval=1169212 TSecr=23983735
   41 0.019557117  10.6.15.145 → 192.168.1.16 SSH 1514 Server: Encrypted packet (len=1448)
   42 0.019738977  10.6.15.145 → 192.168.1.16 SSH 1514 Server: Encrypted packet (len=1448)
   43 0.019785074 192.168.1.16 → 10.6.15.145  TCP 66 52104 → 22 [ACK] Seq=37 Ack=32773 Win=1426 Len=0 TSval=1169213 TSecr=23983736
   44 0.019931561  10.6.15.145 → 192.168.1.16 SSH 1514 Server: Encrypted packet (len=1448)
   45 0.020589370  10.6.15.145 → 192.168.1.16 SSH 1514 Server: Encrypted packet (len=1448)
   46 0.020624900 192.168.1.16 → 10.6.15.145  TCP 66 52104 → 22 [ACK] Seq=37 Ack=35669 Win=1426 Len=0 TSval=1169213 TSecr=23983736
   47 0.022788134  10.6.15.145 → 192.168.1.16 SSH 1514 Server: Encrypted packet (len=1448)
   48 0.022969902  10.6.15.145 → 192.168.1.16 SSH 1514 Server: Encrypted packet (len=1448)
   49 0.022998545 192.168.1.16 → 10.6.15.145  TCP 66 52104 → 22 [ACK] Seq=37 Ack=38565 Win=1426 Len=0 TSval=1169214 TSecr=23983737
   50 0.023164897  10.6.15.145 → 192.168.1.16 SSH 1514 Server: Encrypted packet (len=1448)
   51 0.023506799  10.6.15.145 → 192.168.1.16 SSH 1514 Server: Encrypted packet (len=1448)
   52 0.023546155 192.168.1.16 → 10.6.15.145  TCP 66 52104 → 22 [ACK] Seq=37 Ack=41461 Win=1426 Len=0 TSval=1169214 TSecr=23983737
   53 0.025662684  10.6.15.145 → 192.168.1.16 SSH 1514 Server: Encrypted packet (len=1448)
   54 0.025867181  10.6.15.145 → 192.168.1.16 SSH 1514 Server: Encrypted packet (len=1448)
   55 0.025900430 192.168.1.16 → 10.6.15.145  TCP 66 52104 → 22 [ACK] Seq=37 Ack=44357 Win=1426 Len=0 TSval=1169215 TSecr=23983737
   56 0.026042394  10.6.15.145 → 192.168.1.16 SSH 1514 Server: Encrypted packet (len=1448)
   57 0.026388846  10.6.15.145 → 192.168.1.16 SSH 1514 Server: Encrypted packet (len=1448)
   58 0.026430812 192.168.1.16 → 10.6.15.145  TCP 66 52104 → 22 [ACK] Seq=37 Ack=47253 Win=1426 Len=0 TSval=1169215 TSecr=23983737
   59 0.026576020  10.6.15.145 → 192.168.1.16 SSH 1502 Server: Encrypted packet (len=1436)
   60 0.073862583 192.168.1.16 → 10.6.15.145  TCP 66 52104 → 22 [ACK] Seq=37 Ack=48689 Win=1426 Len=0 TSval=1169227 TSecr=23983737
   61 0.274870900 192.168.1.16 → 10.6.15.145  SSH 182 Client: Encrypted packet (len=116)
   62 0.314179410  10.6.15.145 → 192.168.1.16 TCP 66 22 → 52104 [ACK] Seq=48689 Ack=153 Win=1452 Len=0 TSval=23983810 TSecr=1169277
   63 0.972705385 192.168.1.16 → 10.6.15.145  SSH 302 Client: Encrypted packet (len=236)
   64 0.984526025  10.6.15.145 → 192.168.1.16 SSH 1514 Server: Encrypted packet (len=1448)
   65 0.984556093 192.168.1.16 → 10.6.15.145  TCP 66 52104 → 22 [ACK] Seq=389 Ack=50137 Win=1422 Len=0 TSval=1169454 TSecr=23983876
   66 0.984847077  10.6.15.145 → 192.168.1.16 SSH 790 Server: Encrypted packet (len=724)
   67 0.984856734 192.168.1.16 → 10.6.15.145  TCP 66 52104 → 22 [ACK] Seq=389 Ack=50861 Win=1422 Len=0 TSval=1169454 TSecr=23983876
   68 0.985182280  10.6.15.145 → 192.168.1.16 SSH 790 Server: [TCP Spurious Retransmission] , Encrypted packet (len=724)
   69 0.985191396 192.168.1.16 → 10.6.15.145  TCP 78 [TCP Window Update] 52104 → 22 [ACK] Seq=389 Ack=50861 Win=1426 Len=0 TSval=1169454 TSecr=23983900 SLE=50137 SRE=50861
   70 0.985327166  10.6.15.145 → 192.168.1.16 TCP 66 22 → 52104 [ACK] Seq=50861 Ack=389 Win=1452 Len=0 TSval=23983975 TSecr=1169451
   71 0.985355965  10.6.15.145 → 192.168.1.16 SSH 142 Server: Encrypted packet (len=76)
   72 0.985361096 192.168.1.16 → 10.6.15.145  TCP 66 52104 → 22 [ACK] Seq=389 Ack=50937 Win=1426 Len=0 TSval=1169454 TSecr=23983976
   73 1.064122526  10.6.15.145 → 192.168.1.16 SSH 374 Server: Encrypted packet (len=308)
   74 1.064142476 192.168.1.16 → 10.6.15.145  TCP 66 52104 → 22 [ACK] Seq=389 Ack=51245 Win=1424 Len=0 TSval=1169474 TSecr=23983996
   75 1.064856826 192.168.1.16 → 10.6.15.145  SSH 134 Client: Encrypted packet (len=68)
   76 1.105808444  10.6.15.145 → 192.168.1.16 TCP 66 22 → 52104 [ACK] Seq=51245 Ack=457 Win=1452 Len=0 TSval=23984008 TSecr=1169474
   77 1.814167092 192.168.1.16 → 10.6.15.145  SSH 374 Client: Encrypted packet (len=308)
   78 1.817224563  10.6.15.145 → 192.168.1.16 TCP 66 22 → 52104 [ACK] Seq=51245 Ack=765 Win=1452 Len=0 TSval=23984185 TSecr=1169662
   79 1.834613226 192.168.1.16 → 10.6.15.145  SSH 182 Client: Encrypted packet (len=116)
   80 1.834832182 192.168.1.16 → 10.6.15.145  SSH 134 Client: Encrypted packet (len=68)
   81 1.835793863  10.6.15.145 → 192.168.1.16 TCP 66 22 → 52104 [ACK] Seq=51245 Ack=881 Win=1452 Len=0 TSval=23984190 TSecr=1169667
   82 1.835815446  10.6.15.145 → 192.168.1.16 TCP 66 22 → 52104 [ACK] Seq=51245 Ack=949 Win=1452 Len=0 TSval=23984190 TSecr=1169667
   83 1.854046434  10.6.15.145 → 192.168.1.16 SSH 150 Server: Encrypted packet (len=84)
   84 1.864059947 192.168.1.16 → 10.6.15.145  SSH 446 Client: Encrypted packet (len=380)
   85 1.868597828  10.6.15.145 → 192.168.1.16 SSH 262 Server: Encrypted packet (len=196)
   86 1.868617915  10.6.15.145 → 192.168.1.16 SSH 134 Server: Encrypted packet (len=68)
   87 1.868666931 192.168.1.16 → 10.6.15.145  TCP 66 52104 → 22 [ACK] Seq=1329 Ack=51593 Win=1426 Len=0 TSval=1169675 TSecr=23984198
   88 1.869817748 192.168.1.16 → 10.6.15.145  SSH 134 Client: Encrypted packet (len=68)
   89 1.913645773  10.6.15.145 → 192.168.1.16 TCP 66 22 → 52104 [ACK] Seq=51593 Ack=1397 Win=1452 Len=0 TSval=23984210 TSecr=1169675
   90 2.064594053 192.168.1.16 → 10.6.15.145  SSH 350 Client: Encrypted packet (len=284)
   91 2.065618551  10.6.15.145 → 192.168.1.16 SSH 142 Server: Encrypted packet (len=76)
   92 2.066192546  10.6.15.145 → 192.168.1.16 SSH 326 Server: Encrypted packet (len=260)
   93 2.066236268 192.168.1.16 → 10.6.15.145  TCP 66 52104 → 22 [ACK] Seq=1681 Ack=51929 Win=1426 Len=0 TSval=1169725 TSecr=23984235
   94 2.066324413  10.6.15.145 → 192.168.1.16 TCP 66 22 → 52104 [ACK] Seq=51929 Ack=1681 Win=1452 Len=0 TSval=23984248 TSecr=1169724
   95 2.101866635  10.6.15.145 → 192.168.1.16 SSH 182 Server: Encrypted packet (len=116)
   96 2.101891713  10.6.15.145 → 192.168.1.16 SSH 142 Server: Encrypted packet (len=76)
   97 2.101938089 192.168.1.16 → 10.6.15.145  TCP 66 52104 → 22 [ACK] Seq=1681 Ack=52121 Win=1426 Len=0 TSval=1169734 TSecr=23984257
   98 2.102051924  10.6.15.145 → 192.168.1.16 SSH 150 Server: Encrypted packet (len=84)
   99 2.108757116 192.168.1.16 → 10.6.15.145  SSH 342 Client: Encrypted packet (len=276)
  100 2.118648415  10.6.15.145 → 192.168.1.16 SSH 358 Server: Encrypted packet (len=292)
  101 2.131349079 192.168.1.16 → 10.6.15.145  SSH 638 Client: Encrypted packet (len=572)
  102 2.147226036  10.6.15.145 → 192.168.1.16 SSH 142 Server: Encrypted packet (len=76)
  103 2.161489359  10.22.18.37 → 224.0.0.252  LLMNR 66 Standard query 0xe350 A isatap
  104 2.189903494 192.168.1.16 → 10.6.15.145  TCP 66 52104 → 22 [ACK] Seq=2529 Ack=52573 Win=1426 Len=0 TSval=1169756 TSecr=23984268
  105 2.267947969  10.22.18.37 → 224.0.0.252  LLMNR 66 Standard query 0xe350 A isatap
  106 2.333745658  10.6.15.145 → 192.168.1.16 SSH 1246 Server: Encrypted packet (len=1180)
  107 2.333766624 192.168.1.16 → 10.6.15.145  TCP 66 52104 → 22 [ACK] Seq=2529 Ack=53753 Win=1422 Len=0 TSval=1169791 TSecr=23984314
  108 2.343578572  10.6.15.145 → 192.168.1.16 SSH 1222 Server: Encrypted packet (len=1156)
  109 2.343593705 192.168.1.16 → 10.6.15.145  TCP 66 52104 → 22 [ACK] Seq=2529 Ack=54909 Win=1422 Len=0 TSval=1169794 TSecr=23984317
  110 2.377430628  10.6.15.145 → 192.168.1.16 SSH 278 Server: Encrypted packet (len=212)
  111 2.377458357 192.168.1.16 → 10.6.15.145  TCP 66 52104 → 22 [ACK] Seq=2529 Ack=55121 Win=1422 Len=0 TSval=1169802 TSecr=23984325
  112 3.390068170 192.168.1.16 → 10.6.15.145  SSH 182 Client: Encrypted packet (len=116)
  113 3.609883488 192.168.1.16 → 10.6.15.145  TCP 182 [TCP Retransmission] 52104 → 22 [PSH, ACK] Seq=2529 Ack=55121 Win=1426 Len=116 TSval=1170111 TSecr=23984325
  114 3.673806974  10.6.15.145 → 192.168.1.16 TCP 66 22 → 52104 [ACK] Seq=55121 Ack=2645 Win=1452 Len=0 TSval=23984650 TSecr=1170111
  115 4.998299860  10.6.15.145 → 192.168.1.16 SSH 358 Server: Encrypted packet (len=292)
  116 4.998325762 192.168.1.16 → 10.6.15.145  TCP 66 52104 → 22 [ACK] Seq=2645 Ack=55413 Win=1424 Len=0 TSval=1170458 TSecr=23984713
  117 4.999534494  10.6.15.145 → 192.168.1.16 SSH 1514 Server: Encrypted packet (len=1448)
  118 4.999549906 192.168.1.16 → 10.6.15.145  TCP 66 52104 → 22 [ACK] Seq=2645 Ack=56861 Win=1422 Len=0 TSval=1170458 TSecr=23984714
  119 4.999879050  10.6.15.145 → 192.168.1.16 SSH 1514 Server: Encrypted packet (len=1448)
  120 4.999887944 192.168.1.16 → 10.6.15.145  TCP 66 52104 → 22 [ACK] Seq=2645 Ack=58309 Win=1422 Len=0 TSval=1170458 TSecr=23984714
  121 4.999898704  10.6.15.145 → 192.168.1.16 SSH 110 Server: Encrypted packet (len=44)
  122 4.999902490 192.168.1.16 → 10.6.15.145  TCP 66 52104 → 22 [ACK] Seq=2645 Ack=58353 Win=1422 Len=0 TSval=1170458 TSecr=23984714
  123 5.000113071  10.6.15.145 → 192.168.1.16 SSH 1514 Server: Encrypted packet (len=1448)
  124 5.000119751 192.168.1.16 → 10.6.15.145  TCP 66 52104 → 22 [ACK] Seq=2645 Ack=59801 Win=1422 Len=0 TSval=1170458 TSecr=23984732
  125 5.000128831  10.6.15.145 → 192.168.1.16 TCP 358 [TCP Out-Of-Order] 22 → 52104 [PSH, ACK] Seq=55121 Ack=2645 Win=1452 Len=292 TSval=23984819 TSecr=1170111
  126 5.000131152 192.168.1.16 → 10.6.15.145  TCP 78 [TCP Dup ACK 124#1] 52104 → 22 [ACK] Seq=2645 Ack=59801 Win=1422 Len=0 TSval=1170458 TSecr=23984732 SLE=55121 SRE=55413
  127 5.046532961  10.6.15.145 → 192.168.1.16 SSH 358 Server: [TCP Spurious Retransmission] , Encrypted packet (len=292)
  128 5.046550545 192.168.1.16 → 10.6.15.145  TCP 78 [TCP Window Update] 52104 → 22 [ACK] Seq=2645 Ack=59801 Win=1426 Len=0 TSval=1170470 TSecr=23984732 SLE=55121 SRE=55413
  129 5.902446418 192.168.1.16 → 91.189.91.157 NTP 90 NTP Version 4, client
  130 6.013899143  10.6.15.145 → 192.168.1.16 SSH 366 Server: [TCP Previous segment not captured] , Encrypted packet (len=300)
  131 6.029929808 192.168.1.16 → 10.6.15.145  TCP 78 [TCP Dup ACK 124#2] 52104 → 22 [ACK] Seq=2645 Ack=59801 Win=1426 Len=0 TSval=1170712 TSecr=23984732 SLE=62697 SRE=62997
  132 6.902523930 192.168.1.16 → 13.126.27.131 NTP 90 NTP Version 4, client
  133 7.200812155  10.6.15.145 → 192.168.1.16 TCP 1514 [TCP Retransmission] 22 → 52104 [ACK] Seq=59801 Ack=2645 Win=1452 Len=1448 TSval=23985406 TSecr=1170470
  134 7.200838910 192.168.1.16 → 10.6.15.145  TCP 78 52104 → 22 [ACK] Seq=2645 Ack=61249 Win=1415 Len=0 TSval=1171008 TSecr=23985406 SLE=62697 SRE=62997
  135 8.902449245 192.168.1.16 → 52.66.5.185  NTP 90 NTP Version 4, client
  136 8.904102546  10.22.18.37 → 224.0.0.252  LLMNR 66 Standard query 0xb20a A isatap
  137 8.904244499  10.22.18.37 → 224.0.0.252  LLMNR 66 Standard query 0xb20a A isatap
  138 10.017859189  10.6.15.145 → 192.168.1.16 SSH 1514 Server: [TCP Spurious Retransmission] , Encrypted packet (len=1448)
  139 10.017877961 192.168.1.16 → 10.6.15.145  TCP 86 [TCP Window Update] 52104 → 22 [ACK] Seq=2645 Ack=61249 Win=1422 Len=0 TSval=1171713 TSecr=23986068 SLE=59801 SRE=61249 SLE=62697 SRE=62997
  140 18.658219733 ZioncomE_53:dd:d4 → HonHaiPr_1f:71:b9 EAPOL 135 Key (Message 1 of 4)
  141 18.658613886 HonHaiPr_1f:71:b9 → ZioncomE_53:dd:d4 EAPOL 135 Key (Message 2 of 4)
  142 18.663525362 ZioncomE_53:dd:d4 → HonHaiPr_1f:71:b9 EAPOL 169 Key (Message 3 of 4)
  143 18.663584227 HonHaiPr_1f:71:b9 → ZioncomE_53:dd:d4 EAPOL 113 Key (Message 4 of 4)
  144 18.677854984 fe80::60bd:1940:a0d8:49f9 → ff02::16     ICMPv6 90 Multicast Listener Report Message v2
  145 18.677880400 192.168.1.16 → 224.0.0.252  IGMPv2 46 Membership Report group 224.0.0.252
  146 18.784520408 192.168.1.16 → 224.0.0.252  LLMNR 73 Standard query 0x29ea ANY theenterprise
  147 18.784578105 fe80::60bd:1940:a0d8:49f9 → ff02::1:3    LLMNR 93 Standard query 0x84d6 ANY theenterprise
  148 19.073542279 192.168.1.16 → 224.0.0.252  LLMNR 73 Standard query 0x29ea ANY theenterprise
  149 19.074307848 fe80::60bd:1940:a0d8:49f9 → ff02::1:3    LLMNR 93 Standard query 0x84d6 ANY theenterprise
  150 19.323543154 192.168.1.16 → 224.0.0.252  LLMNR 73 Standard query 0x29ea ANY theenterprise
  151 19.324314666 fe80::60bd:1940:a0d8:49f9 → ff02::1:3    LLMNR 93 Standard query 0x84d6 ANY theenterprise
  152 19.389857772 fe80::60bd:1940:a0d8:49f9 → ff02::16     ICMPv6 90 Multicast Listener Report Message v2
  153 19.645881346 192.168.1.16 → 224.0.0.252  IGMPv2 46 Membership Report group 224.0.0.252
  154 20.165639211 192.168.1.16 → 239.255.255.250 SSDP 213 M-SEARCH * HTTP/1.1 
  155 21.166412253 192.168.1.16 → 239.255.255.250 SSDP 213 M-SEARCH * HTTP/1.1 
  156 21.789903339 192.168.1.16 → 224.0.0.252  IGMPv2 46 Membership Report group 224.0.0.252
  157 22.166784494 192.168.1.16 → 239.255.255.250 SSDP 213 M-SEARCH * HTTP/1.1 
  158 24.418457012 ZioncomE_53:dd:d4 → HonHaiPr_1f:71:b9 EAPOL 135 Key (Message 1 of 4)
  159 24.418655658 HonHaiPr_1f:71:b9 → ZioncomE_53:dd:d4 EAPOL 135 Key (Message 2 of 4)
  160 24.423699798 ZioncomE_53:dd:d4 → HonHaiPr_1f:71:b9 EAPOL 169 Key (Message 3 of 4)
  161 24.423775421 HonHaiPr_1f:71:b9 → ZioncomE_53:dd:d4 EAPOL 113 Key (Message 4 of 4)
  162 24.433870443 fe80::60bd:1940:a0d8:49f9 → ff02::16     ICMPv6 90 Multicast Listener Report Message v2
  163 24.433891265 192.168.1.16 → 224.0.0.252  IGMPv2 46 Membership Report group 224.0.0.252
  164 24.573923563 192.168.1.16 → 224.0.0.252  LLMNR 73 Standard query 0xb866 ANY theenterprise
  165 24.574694375 fe80::60bd:1940:a0d8:49f9 → ff02::1:3    LLMNR 93 Standard query 0xb800 ANY theenterprise
  166 24.823541534 192.168.1.16 → 224.0.0.252  LLMNR 73 Standard query 0xb866 ANY theenterprise
  167 24.824318985 fe80::60bd:1940:a0d8:49f9 → ff02::1:3    LLMNR 93 Standard query 0xb800 ANY theenterprise
  168 24.861912681 fe80::60bd:1940:a0d8:49f9 → ff02::16     ICMPv6 90 Multicast Listener Report Message v2
  169 25.073601842 192.168.1.16 → 224.0.0.252  LLMNR 73 Standard query 0xb866 ANY theenterprise
  170 25.074416824 fe80::60bd:1940:a0d8:49f9 → ff02::1:3    LLMNR 93 Standard query 0xb800 ANY theenterprise
  171 25.629910087 192.168.1.16 → 10.6.15.145  SSH 1514 Client: Encrypted packet (len=1436)
  172 25.716490219  10.6.15.145 → 192.168.1.16 SSH 1514 Server: [TCP Spurious Retransmission] , Encrypted packet (len=1448)
  173 25.716519001 192.168.1.16 → 10.6.15.145  TCP 86 [TCP Previous segment not captured] 52104 → 22 [ACK] Seq=4313 Ack=61249 Win=1422 Len=0 TSval=1175637 TSecr=23990040 SLE=59801 SRE=61249 SLE=62697 SRE=62997
  174 25.748649426  10.6.15.145 → 192.168.1.16 SSH 498 Server: Encrypted packet (len=432)
  175 25.748671878 192.168.1.16 → 10.6.15.145  TCP 78 [TCP Dup ACK 134#1] 52104 → 22 [ACK] Seq=4313 Ack=61249 Win=1422 Len=0 TSval=1175645 TSecr=23990040 SLE=62697 SRE=63429
  176 25.752873025  10.6.15.145 → 192.168.1.16 TCP 1514 [TCP Retransmission] 22 → 52104 [ACK] Seq=61249 Ack=2645 Win=1452 Len=1448 TSval=23990169 TSecr=1170470
  177 25.752904186 192.168.1.16 → 10.6.15.145  TCP 66 52104 → 22 [ACK] Seq=4313 Ack=63429 Win=1422 Len=0 TSval=1175646 TSecr=23990169
  178 25.902449460 192.168.1.16 → 123.108.200.124 NTP 90 NTP Version 4, client
  179 25.925686252 192.168.1.16 → 239.255.255.250 SSDP 213 M-SEARCH * HTTP/1.1 
  180 26.909908175 192.168.1.16 → 224.0.0.252  IGMPv2 46 Membership Report group 224.0.0.252
  181 26.926438726 192.168.1.16 → 239.255.255.250 SSDP 213 M-SEARCH * HTTP/1.1 
  182 27.927349916 192.168.1.16 → 239.255.255.250 SSDP 213 M-SEARCH * HTTP/1.1 
