    1 0.000000000 192.168.1.16 → 10.6.15.144  SSH 166 Client: Encrypted packet (len=100)
    2 0.001732809  10.6.15.144 → 192.168.1.16 SSH 170 Server: Encrypted packet (len=104)
    3 0.002188517 192.168.1.16 → 10.6.15.144  SSH 350 Client: Encrypted packet (len=284)
    4 0.002272212  10.6.15.144 → 192.168.1.16 SSH 102 Server: Encrypted packet (len=36)
    5 0.002907378  10.6.15.144 → 192.168.1.16 SSH 358 Server: Encrypted packet (len=292)
    6 0.002935794 192.168.1.16 → 10.6.15.144  TCP 66 59298 → 22 [ACK] Seq=385 Ack=433 Win=5703 Len=0 TSval=5709667 TSecr=6305736
    7 0.003163787 192.168.1.16 → 10.6.15.144  SSH 134 Client: Encrypted packet (len=68)
    8 0.004347645  10.6.15.144 → 192.168.1.16 SSH 582 Server: Encrypted packet (len=516)
    9 0.010039069  10.6.15.144 → 192.168.1.16 TCP 66 22 → 59298 [ACK] Seq=949 Ack=101 Win=1452 Len=0 TSval=6306041 TSecr=5709667
   10 0.012822755  10.6.15.144 → 192.168.1.16 TCP 66 22 → 59298 [ACK] Seq=949 Ack=385 Win=1452 Len=0 TSval=6306042 TSecr=5709667
   11 0.015226527  10.6.15.144 → 192.168.1.16 TCP 66 22 → 59298 [ACK] Seq=949 Ack=453 Win=1452 Len=0 TSval=6306043 TSecr=5709668
   12 0.047079908 192.168.1.16 → 10.6.15.144  TCP 66 59298 → 22 [ACK] Seq=453 Ack=949 Win=5703 Len=0 TSval=5709679 TSecr=6305942
   13 1.142459826  10.6.15.144 → 192.168.1.16 SSH 318 Server: Encrypted packet (len=252)
   14 1.142485994 192.168.1.16 → 10.6.15.144  TCP 66 59298 → 22 [ACK] Seq=453 Ack=1201 Win=5703 Len=0 TSval=5709952 TSecr=6306135
   15 1.142499148 10.22.19.132 → 224.0.0.252  LLMNR 75 Standard query 0x20a0 ANY LAPTOP-AV6MDEDP
   16 1.144800579 192.168.1.16 → 10.6.15.144  SSH 138 Client: Encrypted packet (len=72)
   17 1.145222432 192.168.1.16 → 10.6.15.144  SSH 110 Client: Encrypted packet (len=44)
   18 1.145404254 192.168.1.16 → 10.6.15.144  SSH 102 Client: Encrypted packet (len=36)
   19 1.154700433  10.6.15.144 → 192.168.1.16 TCP 66 22 → 59298 [ACK] Seq=1201 Ack=525 Win=1452 Len=0 TSval=6306327 TSecr=5709953
   20 1.154716811  10.6.15.144 → 192.168.1.16 TCP 66 22 → 59298 [ACK] Seq=1201 Ack=569 Win=1452 Len=0 TSval=6306327 TSecr=5709953
   21 1.154720854  10.6.15.144 → 192.168.1.16 TCP 66 22 → 59298 [ACK] Seq=1201 Ack=605 Win=1452 Len=0 TSval=6306327 TSecr=5709953
   22 1.155289835 10.22.19.132 → 224.0.0.252  LLMNR 75 Standard query 0x20a0 ANY LAPTOP-AV6MDEDP
   23 1.155302468  10.6.15.144 → 192.168.1.16 SSH 102 Server: Encrypted packet (len=36)
   24 1.159138509  10.6.15.144 → 192.168.1.16 SSH 102 Server: Encrypted packet (len=36)
   25 1.159221681 192.168.1.16 → 10.6.15.144  TCP 66 59298 → 22 [ACK] Seq=605 Ack=1273 Win=5703 Len=0 TSval=5709957 TSecr=6306328
   26 1.159532152 192.168.1.16 → 10.6.15.144  SSH 182 Client: Encrypted packet (len=116)
   27 1.161897896  10.6.15.144 → 192.168.1.16 SSH 102 Server: Encrypted packet (len=36)
   28 1.162122173 192.168.1.16 → 10.6.15.144  SSH 158 Client: Encrypted packet (len=92)
   29 1.170477212  10.6.15.144 → 192.168.1.16 TCP 66 22 → 59298 [ACK] Seq=1309 Ack=813 Win=1452 Len=0 TSval=6306332 TSecr=5709957
   30 1.176915150  10.6.15.144 → 192.168.1.16 SSH 1514 Server: Encrypted packet (len=1448)
   31 1.177086329  10.6.15.144 → 192.168.1.16 SSH 1514 Server: Encrypted packet (len=1448)
   32 1.177096713 192.168.1.16 → 10.6.15.144  TCP 66 59298 → 22 [ACK] Seq=813 Ack=4205 Win=5703 Len=0 TSval=5709961 TSecr=6306333
   33 1.177545978  10.6.15.144 → 192.168.1.16 SSH 510 Server: Encrypted packet (len=444)
   34 1.178639465 192.168.1.16 → 10.6.15.144  SSH 214 Client: Encrypted packet (len=148)
   35 1.183794356 192.168.1.16 → 10.6.15.144  SSH 782 Client: Encrypted packet (len=716)
   36 1.186467411  10.6.15.144 → 192.168.1.16 SSH 534 Server: Encrypted packet (len=468)
   37 1.187514197 192.168.1.16 → 10.6.15.144  SSH 206 Client: Encrypted packet (len=140)
   38 1.193890277  10.6.15.144 → 192.168.1.16 SSH 342 Server: Encrypted packet (len=276)
   39 1.197721995  10.6.15.144 → 192.168.1.16 TCP 66 22 → 59298 [ACK] Seq=5393 Ack=1817 Win=1452 Len=0 TSval=6306338 TSecr=5709963
   40 1.202656527  10.6.15.144 → 192.168.1.16 SSH 318 Server: Encrypted packet (len=252)
   41 1.202718537 192.168.1.16 → 10.6.15.144  TCP 66 59298 → 22 [ACK] Seq=1817 Ack=5645 Win=5703 Len=0 TSval=5709967 TSecr=6306337
   42 2.133299669  10.6.15.144 → 192.168.1.16 SSH 1514 Server: Encrypted packet (len=1448)
   43 2.133448044  10.6.15.144 → 192.168.1.16 SSH 1514 Server: Encrypted packet (len=1448)
   44 2.133456967 192.168.1.16 → 10.6.15.144  TCP 66 59298 → 22 [ACK] Seq=1817 Ack=8541 Win=5703 Len=0 TSval=5710200 TSecr=6306514
   45 2.133648607  10.6.15.144 → 192.168.1.16 SSH 1514 Server: Encrypted packet (len=1448)
   46 2.144258029  10.6.15.144 → 192.168.1.16 SSH 1514 Server: Encrypted packet (len=1448)
   47 2.144280808 192.168.1.16 → 10.6.15.144  TCP 66 59298 → 22 [ACK] Seq=1817 Ack=11437 Win=5703 Len=0 TSval=5710203 TSecr=6306514
   48 2.144313973  10.6.15.144 → 192.168.1.16 SSH 690 Server: [TCP Previous segment not captured] , Encrypted packet (len=624)
   49 2.144320505 192.168.1.16 → 10.6.15.144  TCP 78 [TCP Dup ACK 47#1] 59298 → 22 [ACK] Seq=1817 Ack=11437 Win=5703 Len=0 TSval=5710203 TSecr=6306514 SLE=12885 SRE=13509
   50 3.156958375 10.22.19.132 → 224.0.0.252  LLMNR 75 Standard query 0x0624 ANY LAPTOP-AV6MDEDP
   51 3.157047353 10.22.19.132 → 224.0.0.252  LLMNR 64 Standard query 0x8235 A wpad
   52 3.157193203 10.22.19.132 → 224.0.0.252  LLMNR 64 Standard query 0x9ec4 A wpad
   53 4.148933120 10.22.19.132 → 224.0.0.252  LLMNR 75 Standard query 0x0624 ANY LAPTOP-AV6MDEDP
   54 4.149063430 10.22.19.132 → 224.0.0.252  LLMNR 64 Standard query 0x9ec4 A wpad
   55 4.149201372 10.22.19.132 → 224.0.0.252  LLMNR 64 Standard query 0x8235 A wpad
   56 4.149336489 10.22.19.132 → 224.0.0.252  LLMNR 75 Standard query 0x4d5b ANY LAPTOP-AV6MDEDP
   57 4.149688860  10.6.15.144 → 192.168.1.16 TCP 1514 [TCP Retransmission] 22 → 59298 [ACK] Seq=11437 Ack=1817 Win=1452 Len=1448 TSval=6307001 TSecr=5710203
   58 4.149711213 192.168.1.16 → 10.6.15.144  TCP 66 59298 → 22 [ACK] Seq=1817 Ack=13509 Win=5703 Len=0 TSval=5710704 TSecr=6307001
   59 4.149795372 10.22.19.132 → 224.0.0.252  LLMNR 75 Standard query 0x4d5b ANY LAPTOP-AV6MDEDP
   60 4.170479737 192.168.1.16 → 10.6.15.144  SSH 118 Client: Encrypted packet (len=52)
   61 4.171107167 192.168.1.16 → 10.6.15.144  SSH 218 Client: Encrypted packet (len=152)
   62 4.173842770 192.168.1.16 → 10.6.15.144  SSH 102 Client: Encrypted packet (len=36)
   63 4.175666081 192.168.1.16 → 10.6.15.144  SSH 102 Client: Encrypted packet (len=36)
   64 4.177749323 192.168.1.16 → 10.6.15.144  SSH 102 Client: Encrypted packet (len=36)
   65 4.180071890 192.168.1.16 → 10.6.15.144  SSH 102 Client: Encrypted packet (len=36)
   66 4.215046802 192.168.1.16 → 10.6.15.144  TCP 102 [TCP Retransmission] 59298 → 22 [PSH, ACK] Seq=2129 Ack=13509 Win=5703 Len=36 TSval=5710721 TSecr=6307001
   67 4.223556846  10.6.15.144 → 192.168.1.16 TCP 66 22 → 59298 [ACK] Seq=13509 Ack=2165 Win=1452 Len=0 TSval=6307095 TSecr=5710710
   68 4.224898433  10.6.15.144 → 192.168.1.16 TCP 78 [TCP Dup ACK 67#1] 22 → 59298 [ACK] Seq=13509 Ack=2165 Win=1452 Len=0 TSval=6307095 TSecr=5710721 SLE=2129 SRE=2165
   69 4.282570772  10.6.15.144 → 192.168.1.16 SSH 102 Server: Encrypted packet (len=36)
   70 4.282887249 192.168.1.16 → 10.6.15.144  SSH 174 Client: Encrypted packet (len=108)
   71 4.286125265  10.6.15.144 → 192.168.1.16 SSH 138 Server: Encrypted packet (len=72)
   72 4.286266663  10.6.15.144 → 192.168.1.16 SSH 174 Server: Encrypted packet (len=108)
   73 4.286292394 192.168.1.16 → 10.6.15.144  TCP 66 59298 → 22 [ACK] Seq=2273 Ack=13725 Win=5703 Len=0 TSval=5710738 TSecr=6307110
   74 4.286467472 192.168.1.16 → 10.6.15.144  SSH 174 Client: Encrypted packet (len=108)
   75 4.286696349 192.168.1.16 → 10.6.15.144  SSH 166 Client: Encrypted packet (len=100)
   76 4.286869346 192.168.1.16 → 10.6.15.144  SSH 334 Client: Encrypted packet (len=268)
   77 4.292659098  10.6.15.144 → 192.168.1.16 SSH 174 Server: Encrypted packet (len=108)
   78 4.292958987 192.168.1.16 → 10.6.15.144  SSH 150 Client: Encrypted packet (len=84)
   79 4.293151744 192.168.1.16 → 10.6.15.144  SSH 242 Client: Encrypted packet (len=176)
   80 4.297476176  10.6.15.144 → 192.168.1.16 TCP 66 22 → 59298 [ACK] Seq=13833 Ack=2749 Win=1452 Len=0 TSval=6307113 TSecr=5710738
   81 4.302364208  10.6.15.144 → 192.168.1.16 SSH 1514 Server: Encrypted packet (len=1448)
   82 4.302497904  10.6.15.144 → 192.168.1.16 SSH 326 Server: Encrypted packet (len=260)
   83 4.302505505 192.168.1.16 → 10.6.15.144  TCP 66 59298 → 22 [ACK] Seq=3009 Ack=15541 Win=5703 Len=0 TSval=5710742 TSecr=6307114
   84 4.302685889  10.6.15.144 → 192.168.1.16 SSH 454 Server: Encrypted packet (len=388)
   85 4.303796451 192.168.1.16 → 10.6.15.144  SSH 206 Client: Encrypted packet (len=140)
   86 4.310431799 192.168.1.16 → 10.6.15.144  SSH 230 Client: Encrypted packet (len=164)
   87 4.310641805 192.168.1.16 → 10.6.15.144  SSH 358 Client: Encrypted packet (len=292)
   88 4.313822829  10.6.15.144 → 192.168.1.16 SSH 1514 Server: Encrypted packet (len=1448)
   89 4.314142272  10.6.15.144 → 192.168.1.16 SSH 1514 Server: Encrypted packet (len=1448)
   90 4.314149745 192.168.1.16 → 10.6.15.144  TCP 66 59298 → 22 [ACK] Seq=3605 Ack=18825 Win=5703 Len=0 TSval=5710745 TSecr=6307117
   91 4.315109722 192.168.1.16 → 10.6.15.144  SSH 206 Client: Encrypted packet (len=140)
   92 4.323242192 192.168.1.16 → 10.6.15.144  SSH 222 Client: Encrypted packet (len=156)
   93 4.323447631 192.168.1.16 → 10.6.15.144  SSH 334 Client: Encrypted packet (len=268)
   94 4.323654139 192.168.1.16 → 10.6.15.144  SSH 214 Client: Encrypted packet (len=148)
   95 4.347867871  10.6.15.144 → 192.168.1.16 SSH 1514 Server: Encrypted packet (len=1436)
   96 4.347966710  10.6.15.144 → 192.168.1.16 TCP 78 [TCP Dup ACK 88#1] 22 → 59298 [ACK] Seq=20261 Ack=3009 Win=1452 Len=0 TSval=6307126 TSecr=5710740 SLE=3149 SRE=3605
   97 4.348320802  10.6.15.144 → 192.168.1.16 SSH 1514 Server: Encrypted packet (len=1436)
   98 4.348332046 192.168.1.16 → 10.6.15.144  TCP 66 59298 → 22 [ACK] Seq=4317 Ack=21697 Win=5703 Len=0 TSval=5710754 TSecr=6307126
   99 4.348428237  10.6.15.144 → 192.168.1.16 SSH 102 Server: Encrypted packet (len=24)
  100 4.348569898  10.6.15.144 → 192.168.1.16 TCP 78 [TCP Dup ACK 88#2] 22 → 59298 [ACK] Seq=21721 Ack=3009 Win=1452 Len=0 TSval=6307126 TSecr=5710740 SLE=3149 SRE=3745
  101 4.348576558 192.168.1.16 → 10.6.15.144  SSH 206 Client: [TCP Fast Retransmission] , Encrypted packet (len=140)
  102 4.348707079  10.6.15.144 → 192.168.1.16 TCP 78 [TCP Dup ACK 88#3] 22 → 59298 [ACK] Seq=21721 Ack=3009 Win=1452 Len=0 TSval=6307126 TSecr=5710740 SLE=3149 SRE=3901
  103 4.348844862  10.6.15.144 → 192.168.1.16 TCP 78 [TCP Dup ACK 88#4] 22 → 59298 [ACK] Seq=21721 Ack=3009 Win=1452 Len=0 TSval=6307126 TSecr=5710740 SLE=3149 SRE=4169
  104 4.348981143  10.6.15.144 → 192.168.1.16 TCP 78 [TCP Dup ACK 88#5] 22 → 59298 [ACK] Seq=21721 Ack=3009 Win=1452 Len=0 TSval=6307126 TSecr=5710740 SLE=3149 SRE=4317
  105 4.348987833 192.168.1.16 → 10.6.15.144  SSH 206 Client: Encrypted packet (len=140)
  106 4.357902525  10.6.15.144 → 192.168.1.16 SSH 962 Server: Encrypted packet (len=884)
  107 4.358010373  10.6.15.144 → 192.168.1.16 TCP 66 22 → 59298 [ACK] Seq=22605 Ack=4317 Win=1442 Len=0 TSval=6307128 TSecr=5710754
  108 4.358025744 192.168.1.16 → 10.6.15.144  SSH 826 Client: Encrypted packet (len=760)
  109 4.358144490  10.6.15.144 → 192.168.1.16 TCP 66 22 → 59298 [ACK] Seq=22605 Ack=4457 Win=1441 Len=0 TSval=6307128 TSecr=5710754
  110 4.358928526 192.168.1.16 → 10.6.15.144  SSH 206 Client: Encrypted packet (len=140)
  111 4.360908372 192.168.1.16 → 10.6.15.144  SSH 206 Client: Encrypted packet (len=140)
  112 4.362513416 192.168.1.16 → 10.6.15.144  SSH 358 Client: Encrypted packet (len=292)
  113 4.364635683  10.6.15.144 → 192.168.1.16 SSH 350 Server: Encrypted packet (len=284)
  114 4.364657539 192.168.1.16 → 10.6.15.144  SSH 530 Client: Encrypted packet (len=464)
  115 4.364724289  10.6.15.144 → 192.168.1.16 SSH 634 Server: Encrypted packet (len=568)
  116 4.369693751  10.6.15.144 → 192.168.1.16 SSH 1514 Server: Encrypted packet (len=1448)
  117 4.369715428 192.168.1.16 → 10.6.15.144  SSH 134 Client: Encrypted packet (len=68)
  118 4.372352548  10.6.15.144 → 192.168.1.16 TCP 66 22 → 59298 [ACK] Seq=24905 Ack=5497 Win=1452 Len=0 TSval=6307132 TSecr=5710756
  119 4.372375239 192.168.1.16 → 10.6.15.144  SSH 186 Client: Encrypted packet (len=120)
  120 4.381402363  10.6.15.144 → 192.168.1.16 SSH 1514 Server: Encrypted packet (len=1448)
  121 4.384897772  10.6.15.144 → 192.168.1.16 SSH 1514 Server: [TCP Previous segment not captured] , Encrypted packet (len=1448)
  122 4.384923557 192.168.1.16 → 10.6.15.144  TCP 78 59298 → 22 [ACK] Seq=6441 Ack=26353 Win=5703 Len=0 TSval=5710763 TSecr=6307134 SLE=27801 SRE=29249
  123 4.395741186  10.6.15.144 → 192.168.1.16 SSH 1514 Server: Encrypted packet (len=1448)
  124 4.395764560 192.168.1.16 → 10.6.15.144  TCP 78 [TCP Dup ACK 122#1] 59298 → 22 [ACK] Seq=6441 Ack=26353 Win=5703 Len=0 TSval=5710766 TSecr=6307134 SLE=27801 SRE=30697
  125 4.395893454  10.6.15.144 → 192.168.1.16 SSH 1514 Server: Encrypted packet (len=1448)
  126 4.395903456 192.168.1.16 → 10.6.15.144  TCP 78 [TCP Dup ACK 122#2] 59298 → 22 [ACK] Seq=6441 Ack=26353 Win=5703 Len=0 TSval=5710766 TSecr=6307134 SLE=27801 SRE=32145
  127 4.408833112  10.6.15.144 → 192.168.1.16 SSH 1514 Server: Encrypted packet (len=1448)
  128 4.408852840 192.168.1.16 → 10.6.15.144  TCP 78 [TCP Dup ACK 122#3] 59298 → 22 [ACK] Seq=6441 Ack=26353 Win=5703 Len=0 TSval=5710769 TSecr=6307134 SLE=27801 SRE=33593
  129 4.408987195  10.6.15.144 → 192.168.1.16 SSH 1514 Server: [TCP Fast Retransmission] , Encrypted packet (len=1448)
  130 4.409004874 192.168.1.16 → 10.6.15.144  TCP 66 59298 → 22 [ACK] Seq=6441 Ack=33593 Win=5703 Len=0 TSval=5710769 TSecr=6307140
  131 4.420411660  10.6.15.144 → 192.168.1.16 SSH 1514 Server: Encrypted packet (len=1448)
  132 4.420429599 192.168.1.16 → 10.6.15.144  TCP 66 59298 → 22 [ACK] Seq=6441 Ack=35041 Win=5703 Len=0 TSval=5710772 TSecr=6307144
  133 4.420531455  10.6.15.144 → 192.168.1.16 SSH 1514 Server: Encrypted packet (len=1448)
  134 4.420535693 192.168.1.16 → 10.6.15.144  TCP 66 59298 → 22 [ACK] Seq=6441 Ack=36489 Win=5703 Len=0 TSval=5710772 TSecr=6307144
  135 4.433532718  10.6.15.144 → 192.168.1.16 SSH 1514 Server: Encrypted packet (len=1448)
  136 4.433559165 192.168.1.16 → 10.6.15.144  TCP 66 59298 → 22 [ACK] Seq=6441 Ack=37937 Win=5703 Len=0 TSval=5710775 TSecr=6307147
  137 4.433651457  10.6.15.144 → 192.168.1.16 SSH 1514 Server: Encrypted packet (len=1448)
  138 4.433656390 192.168.1.16 → 10.6.15.144  TCP 66 59298 → 22 [ACK] Seq=6441 Ack=39385 Win=5703 Len=0 TSval=5710775 TSecr=6307147
  139 4.434024092  10.6.15.144 → 192.168.1.16 SSH 1514 Server: Encrypted packet (len=1448)
  140 4.434028865 192.168.1.16 → 10.6.15.144  TCP 66 59298 → 22 [ACK] Seq=6441 Ack=40833 Win=5703 Len=0 TSval=5710775 TSecr=6307147
  141 4.447163036  10.6.15.144 → 192.168.1.16 SSH 1514 Server: Encrypted packet (len=1448)
  142 4.447178921 192.168.1.16 → 10.6.15.144  TCP 66 59298 → 22 [ACK] Seq=6441 Ack=42281 Win=5703 Len=0 TSval=5710779 TSecr=6307150
  143 4.447317075  10.6.15.144 → 192.168.1.16 SSH 1514 Server: Encrypted packet (len=1448)
  144 4.447321227 192.168.1.16 → 10.6.15.144  TCP 66 59298 → 22 [ACK] Seq=6441 Ack=43729 Win=5703 Len=0 TSval=5710779 TSecr=6307150
  145 4.447511523  10.6.15.144 → 192.168.1.16 SSH 1514 Server: Encrypted packet (len=1448)
  146 4.447517760 192.168.1.16 → 10.6.15.144  TCP 66 59298 → 22 [ACK] Seq=6441 Ack=45177 Win=5703 Len=0 TSval=5710779 TSecr=6307150
  147 4.458686511  10.6.15.144 → 192.168.1.16 SSH 1514 Server: Encrypted packet (len=1448)
  148 4.458703822 192.168.1.16 → 10.6.15.144  TCP 66 59298 → 22 [ACK] Seq=6441 Ack=46625 Win=5703 Len=0 TSval=5710781 TSecr=6307153
  149 4.458836634  10.6.15.144 → 192.168.1.16 SSH 1514 Server: Encrypted packet (len=1448)
  150 4.458840738 192.168.1.16 → 10.6.15.144  TCP 66 59298 → 22 [ACK] Seq=6441 Ack=48073 Win=5703 Len=0 TSval=5710781 TSecr=6307153
  151 4.459030708  10.6.15.144 → 192.168.1.16 SSH 1514 Server: Encrypted packet (len=1448)
  152 4.459036068 192.168.1.16 → 10.6.15.144  TCP 66 59298 → 22 [ACK] Seq=6441 Ack=49521 Win=5703 Len=0 TSval=5710781 TSecr=6307153
  153 4.469179004  10.6.15.144 → 192.168.1.16 SSH 1514 Server: Encrypted packet (len=1448)
  154 4.469196637 192.168.1.16 → 10.6.15.144  TCP 66 59298 → 22 [ACK] Seq=6441 Ack=50969 Win=5703 Len=0 TSval=5710784 TSecr=6307156
  155 4.469300888  10.6.15.144 → 192.168.1.16 SSH 1514 Server: Encrypted packet (len=1448)
  156 4.469305311 192.168.1.16 → 10.6.15.144  TCP 66 59298 → 22 [ACK] Seq=6441 Ack=52417 Win=5703 Len=0 TSval=5710784 TSecr=6307156
  157 4.469647410  10.6.15.144 → 192.168.1.16 SSH 1514 Server: Encrypted packet (len=1448)
  158 4.469653990 192.168.1.16 → 10.6.15.144  TCP 66 59298 → 22 [ACK] Seq=6441 Ack=53865 Win=5703 Len=0 TSval=5710784 TSecr=6307156
  159 4.469866119  10.6.15.144 → 192.168.1.16 SSH 1514 Server: Encrypted packet (len=1448)
  160 4.480605451  10.6.15.144 → 192.168.1.16 SSH 1514 Server: Encrypted packet (len=1448)
  161 4.480623206 192.168.1.16 → 10.6.15.144  TCP 66 59298 → 22 [ACK] Seq=6441 Ack=56761 Win=5703 Len=0 TSval=5710787 TSecr=6307156
  162 4.480724192  10.6.15.144 → 192.168.1.16 SSH 1514 Server: Encrypted packet (len=1448)
  163 4.491116419  10.6.15.144 → 192.168.1.16 SSH 1514 Server: Encrypted packet (len=1448)
  164 4.491132087 192.168.1.16 → 10.6.15.144  TCP 66 59298 → 22 [ACK] Seq=6441 Ack=59657 Win=5703 Len=0 TSval=5710790 TSecr=6307159
  165 4.491290276  10.6.15.144 → 192.168.1.16 SSH 1514 Server: Encrypted packet (len=1448)
  166 4.501885975  10.6.15.144 → 192.168.1.16 SSH 1514 Server: Encrypted packet (len=1448)
  167 4.501903882 192.168.1.16 → 10.6.15.144  TCP 66 59298 → 22 [ACK] Seq=6441 Ack=62553 Win=5703 Len=0 TSval=5710792 TSecr=6307161
  168 4.502003885  10.6.15.144 → 192.168.1.16 SSH 1514 Server: Encrypted packet (len=1448)
  169 4.502218604  10.6.15.144 → 192.168.1.16 SSH 1514 Server: Encrypted packet (len=1448)
  170 4.502223034 192.168.1.16 → 10.6.15.144  TCP 66 59298 → 22 [ACK] Seq=6441 Ack=65449 Win=5703 Len=0 TSval=5710792 TSecr=6307164
  171 4.502539321  10.6.15.144 → 192.168.1.16 SSH 1514 Server: Encrypted packet (len=1448)
  172 4.513247815  10.6.15.144 → 192.168.1.16 SSH 1514 Server: Encrypted packet (len=1448)
  173 4.513265411 192.168.1.16 → 10.6.15.144  TCP 66 59298 → 22 [ACK] Seq=6441 Ack=68345 Win=5703 Len=0 TSval=5710795 TSecr=6307164
  174 4.513414706  10.6.15.144 → 192.168.1.16 SSH 1514 Server: Encrypted packet (len=1448)
  175 4.513617805  10.6.15.144 → 192.168.1.16 SSH 1514 Server: Encrypted packet (len=1448)
  176 4.513622452 192.168.1.16 → 10.6.15.144  TCP 66 59298 → 22 [ACK] Seq=6441 Ack=71241 Win=5703 Len=0 TSval=5710795 TSecr=6307167
  177 4.523804106  10.6.15.144 → 192.168.1.16 SSH 1514 Server: [TCP Previous segment not captured] , Encrypted packet (len=1448)
  178 4.523821999 192.168.1.16 → 10.6.15.144  TCP 78 [TCP Dup ACK 176#1] 59298 → 22 [ACK] Seq=6441 Ack=71241 Win=5703 Len=0 TSval=5710798 TSecr=6307167 SLE=72689 SRE=74137
  179 4.523987483  10.6.15.144 → 192.168.1.16 SSH 1514 Server: Encrypted packet (len=1448)
  180 4.523996036 192.168.1.16 → 10.6.15.144  TCP 78 [TCP Dup ACK 176#2] 59298 → 22 [ACK] Seq=6441 Ack=71241 Win=5703 Len=0 TSval=5710798 TSecr=6307167 SLE=72689 SRE=75585
  181 4.524331314  10.6.15.144 → 192.168.1.16 SSH 1514 Server: Encrypted packet (len=1448)
  182 4.524339774 192.168.1.16 → 10.6.15.144  TCP 78 [TCP Dup ACK 176#3] 59298 → 22 [ACK] Seq=6441 Ack=71241 Win=5703 Len=0 TSval=5710798 TSecr=6307167 SLE=72689 SRE=77033
  183 4.524495726  10.6.15.144 → 192.168.1.16 SSH 1514 Server: Encrypted packet (len=1448)
  184 4.524501733 192.168.1.16 → 10.6.15.144  TCP 78 [TCP Dup ACK 176#4] 59298 → 22 [ACK] Seq=6441 Ack=71241 Win=5703 Len=0 TSval=5710798 TSecr=6307167 SLE=72689 SRE=78481
  185 4.534956567  10.6.15.144 → 192.168.1.16 SSH 1514 Server: Encrypted packet (len=1448)
  186 4.534974144 192.168.1.16 → 10.6.15.144  TCP 78 [TCP Dup ACK 176#5] 59298 → 22 [ACK] Seq=6441 Ack=71241 Win=5703 Len=0 TSval=5710800 TSecr=6307167 SLE=72689 SRE=79929
  187 4.535161265  10.6.15.144 → 192.168.1.16 SSH 1514 Server: Encrypted packet (len=1448)
  188 4.535173668 192.168.1.16 → 10.6.15.144  TCP 78 [TCP Dup ACK 176#6] 59298 → 22 [ACK] Seq=6441 Ack=71241 Win=5703 Len=0 TSval=5710801 TSecr=6307167 SLE=72689 SRE=81377
  189 4.535357815  10.6.15.144 → 192.168.1.16 SSH 1514 Server: [TCP Fast Retransmission] , Encrypted packet (len=1448)
  190 4.535381452 192.168.1.16 → 10.6.15.144  TCP 66 59298 → 22 [ACK] Seq=6441 Ack=81377 Win=5703 Len=0 TSval=5710801 TSecr=6307172
  191 4.545892258  10.6.15.144 → 192.168.1.16 SSH 1514 Server: Encrypted packet (len=1448)
  192 4.545910503 192.168.1.16 → 10.6.15.144  TCP 66 59298 → 22 [ACK] Seq=6441 Ack=82825 Win=5703 Len=0 TSval=5710803 TSecr=6307175
  193 4.546069663  10.6.15.144 → 192.168.1.16 SSH 1514 Server: Encrypted packet (len=1448)
  194 4.546073103 192.168.1.16 → 10.6.15.144  TCP 66 59298 → 22 [ACK] Seq=6441 Ack=84273 Win=5703 Len=0 TSval=5710803 TSecr=6307175
  195 4.546480491  10.6.15.144 → 192.168.1.16 SSH 1514 Server: Encrypted packet (len=1448)
  196 4.546498830 192.168.1.16 → 10.6.15.144  TCP 66 59298 → 22 [ACK] Seq=6441 Ack=85721 Win=5703 Len=0 TSval=5710803 TSecr=6307175
  197 4.556886810  10.6.15.144 → 192.168.1.16 SSH 1514 Server: Encrypted packet (len=1448)
  198 4.556912261 192.168.1.16 → 10.6.15.144  TCP 66 59298 → 22 [ACK] Seq=6441 Ack=87169 Win=5703 Len=0 TSval=5710806 TSecr=6307178
  199 4.557047743  10.6.15.144 → 192.168.1.16 SSH 1514 Server: Encrypted packet (len=1448)
  200 4.557053212 192.168.1.16 → 10.6.15.144  TCP 66 59298 → 22 [ACK] Seq=6441 Ack=88617 Win=5703 Len=0 TSval=5710806 TSecr=6307178
  201 4.569660022  10.6.15.144 → 192.168.1.16 SSH 1514 Server: [TCP Previous segment not captured] , Encrypted packet (len=1448)
  202 4.569677984 192.168.1.16 → 10.6.15.144  TCP 78 [TCP Dup ACK 200#1] 59298 → 22 [ACK] Seq=6441 Ack=88617 Win=5703 Len=0 TSval=5710809 TSecr=6307178 SLE=90065 SRE=91513
  203 4.569850629  10.6.15.144 → 192.168.1.16 SSH 1514 Server: [TCP Previous segment not captured] , Encrypted packet (len=1448)
  204 4.569870013 192.168.1.16 → 10.6.15.144  TCP 86 [TCP Dup ACK 200#2] 59298 → 22 [ACK] Seq=6441 Ack=88617 Win=5703 Len=0 TSval=5710809 TSecr=6307178 SLE=92961 SRE=94409 SLE=90065 SRE=91513
  205 4.580474570  10.6.15.144 → 192.168.1.16 SSH 1514 Server: [TCP Fast Retransmission] , Encrypted packet (len=1448)
  206 4.580490655 192.168.1.16 → 10.6.15.144  TCP 78 59298 → 22 [ACK] Seq=6441 Ack=91513 Win=5703 Len=0 TSval=5710812 TSecr=6307184 SLE=92961 SRE=94409
  207 5.565231975 192.168.1.16 → 10.6.15.144  SSH 1514 Client: Encrypted packet (len=1436)
  208 5.568308815 192.168.1.16 → 10.6.15.144  SSH 374 Client: Encrypted packet (len=296)
  209 5.569147105  10.6.15.144 → 192.168.1.16 TCP 1514 [TCP Retransmission] 22 → 59298 [ACK] Seq=91513 Ack=6441 Win=1452 Len=1448 TSval=6307244 TSecr=5710812
  210 5.569160416 192.168.1.16 → 10.6.15.144  TCP 66 59298 → 22 [ACK] Seq=8173 Ack=94409 Win=5703 Len=0 TSval=5711059 TSecr=6307244
  211 5.569331788  10.6.15.144 → 192.168.1.16 SSH 1514 Server: [TCP Spurious Retransmission] , Encrypted packet (len=1448)
  212 5.569336341 192.168.1.16 → 10.6.15.144  TCP 78 [TCP Dup ACK 210#1] 59298 → 22 [ACK] Seq=8173 Ack=94409 Win=5703 Len=0 TSval=5711059 TSecr=6307244 SLE=91513 SRE=92961
  213 5.578726251  10.6.15.144 → 192.168.1.16 TCP 66 [TCP Previous segment not captured] 22 → 59298 [ACK] Seq=97305 Ack=8173 Win=1452 Len=0 TSval=6307433 TSecr=5711058
  214 5.579965210  10.6.15.144 → 192.168.1.16 SSH 1514 Server: Encrypted packet (len=1448)
  215 5.579984750 192.168.1.16 → 10.6.15.144  TCP 78 [TCP Dup ACK 210#2] 59298 → 22 [ACK] Seq=8173 Ack=94409 Win=5703 Len=0 TSval=5711062 TSecr=6307244 SLE=97305 SRE=98753
  216 5.580102959  10.6.15.144 → 192.168.1.16 SSH 1514 Server: Encrypted packet (len=1448)
  217 5.580113485 192.168.1.16 → 10.6.15.144  TCP 78 [TCP Dup ACK 210#3] 59298 → 22 [ACK] Seq=8173 Ack=94409 Win=5703 Len=0 TSval=5711062 TSecr=6307244 SLE=97305 SRE=100201
  218 5.580279886  10.6.15.144 → 192.168.1.16 SSH 1514 Server: Encrypted packet (len=1448)
  219 5.580285540 192.168.1.16 → 10.6.15.144  TCP 78 [TCP Dup ACK 210#4] 59298 → 22 [ACK] Seq=8173 Ack=94409 Win=5703 Len=0 TSval=5711062 TSecr=6307244 SLE=97305 SRE=101649
  220 5.591006258  10.6.15.144 → 192.168.1.16 SSH 1514 Server: [TCP Fast Retransmission] , Encrypted packet (len=1448)
  221 5.591022024 192.168.1.16 → 10.6.15.144  TCP 78 59298 → 22 [ACK] Seq=8173 Ack=95857 Win=5703 Len=0 TSval=5711064 TSecr=6307436 SLE=97305 SRE=101649
  222 5.591162402  10.6.15.144 → 192.168.1.16 TCP 1514 [TCP Retransmission] 22 → 59298 [ACK] Seq=95857 Ack=8173 Win=1452 Len=1448 TSval=6307436 TSecr=5711062
  223 5.591171863 192.168.1.16 → 10.6.15.144  TCP 66 59298 → 22 [ACK] Seq=8173 Ack=101649 Win=5703 Len=0 TSval=5711065 TSecr=6307436
  224 5.593866920  10.6.15.144 → 192.168.1.16 SSH 1514 Server: Encrypted packet (len=1448)
  225 5.593892483 192.168.1.16 → 10.6.15.144  TCP 66 59298 → 22 [ACK] Seq=8173 Ack=103097 Win=5703 Len=0 TSval=5711065 TSecr=6307436
  226 5.604351841  10.6.15.144 → 192.168.1.16 SSH 1514 Server: Encrypted packet (len=1448)
  227 5.604371552 192.168.1.16 → 10.6.15.144  TCP 66 59298 → 22 [ACK] Seq=8173 Ack=104545 Win=5703 Len=0 TSval=5711068 TSecr=6307440
  228 5.604489296  10.6.15.144 → 192.168.1.16 SSH 1514 Server: Encrypted packet (len=1448)
  229 5.604498169 192.168.1.16 → 10.6.15.144  TCP 66 59298 → 22 [ACK] Seq=8173 Ack=105993 Win=5703 Len=0 TSval=5711068 TSecr=6307440
  230 5.615199416  10.6.15.144 → 192.168.1.16 SSH 1514 Server: [TCP Previous segment not captured] , Encrypted packet (len=1448)
  231 5.615216047 192.168.1.16 → 10.6.15.144  TCP 78 [TCP Dup ACK 229#1] 59298 → 22 [ACK] Seq=8173 Ack=105993 Win=5703 Len=0 TSval=5711071 TSecr=6307440 SLE=107441 SRE=108889
  232 5.615356484  10.6.15.144 → 192.168.1.16 SSH 1514 Server: Encrypted packet (len=1448)
  233 5.615362426 192.168.1.16 → 10.6.15.144  TCP 78 [TCP Dup ACK 229#2] 59298 → 22 [ACK] Seq=8173 Ack=105993 Win=5703 Len=0 TSval=5711071 TSecr=6307440 SLE=107441 SRE=110337
  234 5.625917513  10.6.15.144 → 192.168.1.16 SSH 1514 Server: Encrypted packet (len=1448)
  235 5.625938403 192.168.1.16 → 10.6.15.144  TCP 78 [TCP Dup ACK 229#3] 59298 → 22 [ACK] Seq=8173 Ack=105993 Win=5703 Len=0 TSval=5711073 TSecr=6307440 SLE=107441 SRE=111785
  236 5.626073505  10.6.15.144 → 192.168.1.16 SSH 1514 Server: Encrypted packet (len=1448)
  237 5.626083103 192.168.1.16 → 10.6.15.144  TCP 78 [TCP Dup ACK 229#4] 59298 → 22 [ACK] Seq=8173 Ack=105993 Win=5703 Len=0 TSval=5711073 TSecr=6307440 SLE=107441 SRE=113233
  238 5.626300800  10.6.15.144 → 192.168.1.16 SSH 1514 Server: Encrypted packet (len=1448)
  239 5.626321272 192.168.1.16 → 10.6.15.144  TCP 78 [TCP Dup ACK 229#5] 59298 → 22 [ACK] Seq=8173 Ack=105993 Win=5703 Len=0 TSval=5711073 TSecr=6307440 SLE=107441 SRE=114681
  240 5.638281400  10.6.15.144 → 192.168.1.16 SSH 1514 Server: [TCP Fast Retransmission] , Encrypted packet (len=1448)
  241 5.638306751 192.168.1.16 → 10.6.15.144  TCP 66 59298 → 22 [ACK] Seq=8173 Ack=114681 Win=5703 Len=0 TSval=5711076 TSecr=6307448
  242 5.638420017  10.6.15.144 → 192.168.1.16 SSH 1514 Server: Encrypted packet (len=1448)
  243 5.638429088 192.168.1.16 → 10.6.15.144  TCP 66 59298 → 22 [ACK] Seq=8173 Ack=116129 Win=5703 Len=0 TSval=5711076 TSecr=6307448
  244 5.649166518  10.6.15.144 → 192.168.1.16 SSH 1514 Server: Encrypted packet (len=1448)
  245 5.649182760 192.168.1.16 → 10.6.15.144  TCP 66 59298 → 22 [ACK] Seq=8173 Ack=117577 Win=5703 Len=0 TSval=5711079 TSecr=6307451
  246 5.649334921  10.6.15.144 → 192.168.1.16 SSH 1514 Server: Encrypted packet (len=1448)
  247 5.649337856 192.168.1.16 → 10.6.15.144  TCP 66 59298 → 22 [ACK] Seq=8173 Ack=119025 Win=5703 Len=0 TSval=5711079 TSecr=6307451
  248 5.649526441  10.6.15.144 → 192.168.1.16 SSH 1514 Server: Encrypted packet (len=1448)
  249 5.649530088 192.168.1.16 → 10.6.15.144  TCP 66 59298 → 22 [ACK] Seq=8173 Ack=120473 Win=5703 Len=0 TSval=5711079 TSecr=6307451
  250 5.660230239  10.6.15.144 → 192.168.1.16 SSH 1514 Server: Encrypted packet (len=1448)
  251 5.660251406 192.168.1.16 → 10.6.15.144  TCP 66 59298 → 22 [ACK] Seq=8173 Ack=121921 Win=5703 Len=0 TSval=5711082 TSecr=6307454
  252 5.660412290  10.6.15.144 → 192.168.1.16 SSH 1514 Server: Encrypted packet (len=1448)
  253 5.660420517 192.168.1.16 → 10.6.15.144  TCP 66 59298 → 22 [ACK] Seq=8173 Ack=123369 Win=5703 Len=0 TSval=5711082 TSecr=6307454
  254 5.671115278  10.6.15.144 → 192.168.1.16 SSH 1514 Server: [TCP Previous segment not captured] , Encrypted packet (len=1448)
  255 5.671139929 192.168.1.16 → 10.6.15.144  TCP 78 [TCP Dup ACK 253#1] 59298 → 22 [ACK] Seq=8173 Ack=123369 Win=5703 Len=0 TSval=5711085 TSecr=6307454 SLE=124817 SRE=126265
  256 5.671356107  10.6.15.144 → 192.168.1.16 SSH 1514 Server: Encrypted packet (len=1448)
  257 5.671377931 192.168.1.16 → 10.6.15.144  TCP 78 [TCP Dup ACK 253#2] 59298 → 22 [ACK] Seq=8173 Ack=123369 Win=5703 Len=0 TSval=5711085 TSecr=6307454 SLE=124817 SRE=127713
  258 5.681698525  10.6.15.144 → 192.168.1.16 SSH 1514 Server: Encrypted packet (len=1448)
  259 5.681716716 192.168.1.16 → 10.6.15.144  TCP 78 [TCP Dup ACK 253#3] 59298 → 22 [ACK] Seq=8173 Ack=123369 Win=5703 Len=0 TSval=5711087 TSecr=6307454 SLE=124817 SRE=129161
  260 5.681907172  10.6.15.144 → 192.168.1.16 SSH 1514 Server: Encrypted packet (len=1448)
  261 5.681910901 192.168.1.16 → 10.6.15.144  TCP 78 [TCP Dup ACK 253#4] 59298 → 22 [ACK] Seq=8173 Ack=123369 Win=5703 Len=0 TSval=5711087 TSecr=6307454 SLE=124817 SRE=130609
  262 5.682250206  10.6.15.144 → 192.168.1.16 SSH 1514 Server: Encrypted packet (len=1448)
  263 5.682253473 192.168.1.16 → 10.6.15.144  TCP 78 [TCP Dup ACK 253#5] 59298 → 22 [ACK] Seq=8173 Ack=123369 Win=5703 Len=0 TSval=5711087 TSecr=6307454 SLE=124817 SRE=132057
  264 5.691842526  10.6.15.144 → 192.168.1.16 SSH 1514 Server: [TCP Fast Retransmission] , Encrypted packet (len=1448)
  265 5.691864651 192.168.1.16 → 10.6.15.144  TCP 66 59298 → 22 [ACK] Seq=8173 Ack=132057 Win=5703 Len=0 TSval=5711090 TSecr=6307462
  266 5.692006132  10.6.15.144 → 192.168.1.16 SSH 1514 Server: Encrypted packet (len=1448)
  267 5.692013383 192.168.1.16 → 10.6.15.144  TCP 66 59298 → 22 [ACK] Seq=8173 Ack=133505 Win=5703 Len=0 TSval=5711090 TSecr=6307462
  268 5.701005257  10.6.15.144 → 192.168.1.16 SSH 1514 Server: Encrypted packet (len=1448)
  269 5.701023278 192.168.1.16 → 10.6.15.144  TCP 66 59298 → 22 [ACK] Seq=8173 Ack=134953 Win=5703 Len=0 TSval=5711092 TSecr=6307464
  270 5.701900321  10.6.15.144 → 192.168.1.16 SSH 1514 Server: Encrypted packet (len=1448)
  271 5.701909453 192.168.1.16 → 10.6.15.144  TCP 66 59298 → 22 [ACK] Seq=8173 Ack=136401 Win=5703 Len=0 TSval=5711092 TSecr=6307464
  272 5.702207809  10.6.15.144 → 192.168.1.16 SSH 1514 Server: Encrypted packet (len=1448)
  273 5.702212163 192.168.1.16 → 10.6.15.144  TCP 66 59298 → 22 [ACK] Seq=8173 Ack=137849 Win=5703 Len=0 TSval=5711092 TSecr=6307464
  274 5.712092802  10.6.15.144 → 192.168.1.16 SSH 1514 Server: Encrypted packet (len=1448)
  275 5.712111089 192.168.1.16 → 10.6.15.144  TCP 66 59298 → 22 [ACK] Seq=8173 Ack=139297 Win=5703 Len=0 TSval=5711095 TSecr=6307467
  276 5.712233348  10.6.15.144 → 192.168.1.16 SSH 1514 Server: Encrypted packet (len=1448)
  277 5.712243047 192.168.1.16 → 10.6.15.144  TCP 66 59298 → 22 [ACK] Seq=8173 Ack=140745 Win=5703 Len=0 TSval=5711095 TSecr=6307467
  278 5.712594403  10.6.15.144 → 192.168.1.16 SSH 1514 Server: Encrypted packet (len=1448)
  279 5.712600926 192.168.1.16 → 10.6.15.144  TCP 66 59298 → 22 [ACK] Seq=8173 Ack=142193 Win=5703 Len=0 TSval=5711095 TSecr=6307467
  280 5.723486053  10.6.15.144 → 192.168.1.16 SSH 1514 Server: Encrypted packet (len=1448)
  281 5.723504414 192.168.1.16 → 10.6.15.144  TCP 66 59298 → 22 [ACK] Seq=8173 Ack=143641 Win=5703 Len=0 TSval=5711098 TSecr=6307469
  282 5.723625358  10.6.15.144 → 192.168.1.16 SSH 1514 Server: Encrypted packet (len=1448)
  283 5.723634573 192.168.1.16 → 10.6.15.144  TCP 66 59298 → 22 [ACK] Seq=8173 Ack=145089 Win=5703 Len=0 TSval=5711098 TSecr=6307469
  284 5.723829480  10.6.15.144 → 192.168.1.16 SSH 1514 Server: Encrypted packet (len=1448)
  285 5.723836333 192.168.1.16 → 10.6.15.144  TCP 66 59298 → 22 [ACK] Seq=8173 Ack=146537 Win=5703 Len=0 TSval=5711098 TSecr=6307469
  286 5.735005174  10.6.15.144 → 192.168.1.16 SSH 1514 Server: [TCP Previous segment not captured] , Encrypted packet (len=1448)
  287 5.735023616 192.168.1.16 → 10.6.15.144  TCP 78 [TCP Dup ACK 285#1] 59298 → 22 [ACK] Seq=8173 Ack=146537 Win=5703 Len=0 TSval=5711100 TSecr=6307469 SLE=149433 SRE=150881
  288 5.747428654  10.6.15.144 → 192.168.1.16 SSH 1514 Server: Encrypted packet (len=1448)
  289 5.747449036 192.168.1.16 → 10.6.15.144  TCP 78 [TCP Dup ACK 285#2] 59298 → 22 [ACK] Seq=8173 Ack=146537 Win=5703 Len=0 TSval=5711104 TSecr=6307469 SLE=149433 SRE=152329
  290 5.747695500  10.6.15.144 → 192.168.1.16 SSH 1514 Server: Encrypted packet (len=1448)
  291 5.747716591 192.168.1.16 → 10.6.15.144  TCP 78 [TCP Dup ACK 285#3] 59298 → 22 [ACK] Seq=8173 Ack=146537 Win=5703 Len=0 TSval=5711104 TSecr=6307469 SLE=149433 SRE=153777
  292 5.758180224  10.6.15.144 → 192.168.1.16 SSH 1514 Server: [TCP Fast Retransmission] , Encrypted packet (len=1448)
  293 5.758204854 192.168.1.16 → 10.6.15.144  TCP 78 59298 → 22 [ACK] Seq=8173 Ack=147985 Win=5703 Len=0 TSval=5711106 TSecr=6307478 SLE=149433 SRE=153777
  294 5.758348114  10.6.15.144 → 192.168.1.16 TCP 1514 [TCP Retransmission] 22 → 59298 [ACK] Seq=147985 Ack=8173 Win=1452 Len=1448 TSval=6307478 TSecr=5711104
  295 5.758363123 192.168.1.16 → 10.6.15.144  TCP 66 59298 → 22 [ACK] Seq=8173 Ack=153777 Win=5703 Len=0 TSval=5711106 TSecr=6307478
  296 5.769072385  10.6.15.144 → 192.168.1.16 SSH 1514 Server: Encrypted packet (len=1448)
  297 5.769089641 192.168.1.16 → 10.6.15.144  TCP 66 59298 → 22 [ACK] Seq=8173 Ack=155225 Win=5703 Len=0 TSval=5711109 TSecr=6307481
  298 5.769256749  10.6.15.144 → 192.168.1.16 SSH 1514 Server: Encrypted packet (len=1448)
  299 5.769266550 192.168.1.16 → 10.6.15.144  TCP 66 59298 → 22 [ACK] Seq=8173 Ack=156673 Win=5703 Len=0 TSval=5711109 TSecr=6307481
  300 5.769363461 192.168.1.16 → 10.6.15.144  SSH 102 Client: Encrypted packet (len=36)
  301 5.779904060  10.6.15.144 → 192.168.1.16 SSH 1514 Server: Encrypted packet (len=1448)
  302 5.780041295  10.6.15.144 → 192.168.1.16 SSH 1514 Server: Encrypted packet (len=1448)
  303 5.780054899 192.168.1.16 → 10.6.15.144  TCP 66 59298 → 22 [ACK] Seq=8209 Ack=159569 Win=5703 Len=0 TSval=5711112 TSecr=6307483
  304 5.780217197  10.6.15.144 → 192.168.1.16 SSH 1514 Server: Encrypted packet (len=1448)
  305 5.790849632  10.6.15.144 → 192.168.1.16 SSH 1514 Server: Encrypted packet (len=1448)
  306 5.790871704 192.168.1.16 → 10.6.15.144  TCP 66 59298 → 22 [ACK] Seq=8209 Ack=162465 Win=5703 Len=0 TSval=5711114 TSecr=6307483
  307 5.790985128  10.6.15.144 → 192.168.1.16 SSH 1514 Server: Encrypted packet (len=1448)
  308 5.791192170  10.6.15.144 → 192.168.1.16 SSH 1514 Server: Encrypted packet (len=1448)
  309 5.791198777 192.168.1.16 → 10.6.15.144  TCP 66 59298 → 22 [ACK] Seq=8209 Ack=165361 Win=5703 Len=0 TSval=5711115 TSecr=6307486
  310 5.801704947  10.6.15.144 → 192.168.1.16 SSH 1514 Server: Encrypted packet (len=1448)
  311 5.801833240  10.6.15.144 → 192.168.1.16 SSH 1514 Server: Encrypted packet (len=1448)
  312 5.801843500 192.168.1.16 → 10.6.15.144  TCP 66 59298 → 22 [ACK] Seq=8209 Ack=168257 Win=5703 Len=0 TSval=5711117 TSecr=6307489
  313 5.802190005  10.6.15.144 → 192.168.1.16 SSH 1514 Server: Encrypted packet (len=1448)
  314 5.802375892  10.6.15.144 → 192.168.1.16 SSH 1514 Server: Encrypted packet (len=1448)
  315 5.802379047 192.168.1.16 → 10.6.15.144  TCP 66 59298 → 22 [ACK] Seq=8209 Ack=171153 Win=5703 Len=0 TSval=5711117 TSecr=6307489
  316 5.812741636  10.6.15.144 → 192.168.1.16 SSH 1514 Server: Encrypted packet (len=1448)
  317 5.812905493  10.6.15.144 → 192.168.1.16 SSH 1514 Server: Encrypted packet (len=1448)
  318 5.812915632 192.168.1.16 → 10.6.15.144  TCP 66 59298 → 22 [ACK] Seq=8209 Ack=174049 Win=5703 Len=0 TSval=5711120 TSecr=6307492
  319 5.813094395  10.6.15.144 → 192.168.1.16 SSH 1514 Server: Encrypted packet (len=1448)
  320 5.813493147  10.6.15.144 → 192.168.1.16 SSH 1514 Server: Encrypted packet (len=1448)
  321 5.813509807 192.168.1.16 → 10.6.15.144  TCP 66 59298 → 22 [ACK] Seq=8209 Ack=176945 Win=5703 Len=0 TSval=5711120 TSecr=6307492
  322 5.824292237  10.6.15.144 → 192.168.1.16 SSH 1514 Server: Encrypted packet (len=1448)
  323 5.824441130  10.6.15.144 → 192.168.1.16 SSH 1514 Server: Encrypted packet (len=1448)
  324 5.824449663 192.168.1.16 → 10.6.15.144  TCP 66 59298 → 22 [ACK] Seq=8209 Ack=179841 Win=5703 Len=0 TSval=5711123 TSecr=6307495
  325 5.824636238  10.6.15.144 → 192.168.1.16 SSH 1514 Server: Encrypted packet (len=1448)
  326 5.834911891  10.6.15.144 → 192.168.1.16 SSH 1514 Server: [TCP Previous segment not captured] , Encrypted packet (len=1448)
  327 5.834930855 192.168.1.16 → 10.6.15.144  TCP 78 59298 → 22 [ACK] Seq=8209 Ack=181289 Win=5703 Len=0 TSval=5711125 TSecr=6307495 SLE=182737 SRE=184185
  328 5.835040328  10.6.15.144 → 192.168.1.16 SSH 1514 Server: Encrypted packet (len=1448)
  329 5.835047409 192.168.1.16 → 10.6.15.144  TCP 78 [TCP Dup ACK 327#1] 59298 → 22 [ACK] Seq=8209 Ack=181289 Win=5703 Len=0 TSval=5711126 TSecr=6307495 SLE=182737 SRE=185633
  330 5.844637576  10.6.15.144 → 192.168.1.16 SSH 1514 Server: Encrypted packet (len=1448)
  331 5.844658141 192.168.1.16 → 10.6.15.144  TCP 78 [TCP Dup ACK 327#2] 59298 → 22 [ACK] Seq=8209 Ack=181289 Win=5703 Len=0 TSval=5711128 TSecr=6307495 SLE=182737 SRE=187081
  332 5.844792763  10.6.15.144 → 192.168.1.16 SSH 1514 Server: Encrypted packet (len=1448)
  333 5.844802686 192.168.1.16 → 10.6.15.144  TCP 78 [TCP Dup ACK 327#3] 59298 → 22 [ACK] Seq=8209 Ack=181289 Win=5703 Len=0 TSval=5711128 TSecr=6307495 SLE=182737 SRE=188529
  334 5.845173251  10.6.15.144 → 192.168.1.16 SSH 1514 Server: Encrypted packet (len=1448)
  335 5.845192676 192.168.1.16 → 10.6.15.144  TCP 78 [TCP Dup ACK 327#4] 59298 → 22 [ACK] Seq=8209 Ack=181289 Win=5703 Len=0 TSval=5711128 TSecr=6307495 SLE=182737 SRE=189977
  336 5.853533545  10.6.15.144 → 192.168.1.16 SSH 1514 Server: [TCP Fast Retransmission] , Encrypted packet (len=1448)
  337 5.853558370 192.168.1.16 → 10.6.15.144  TCP 66 59298 → 22 [ACK] Seq=8209 Ack=189977 Win=5703 Len=0 TSval=5711130 TSecr=6307503
  338 5.854459369  10.6.15.144 → 192.168.1.16 SSH 1514 Server: Encrypted packet (len=1448)
  339 5.854475838 192.168.1.16 → 10.6.15.144  TCP 66 59298 → 22 [ACK] Seq=8209 Ack=191425 Win=5703 Len=0 TSval=5711130 TSecr=6307503
  340 5.862017391  10.6.15.144 → 192.168.1.16 SSH 1514 Server: Encrypted packet (len=1448)
  341 5.862033679 192.168.1.16 → 10.6.15.144  TCP 66 59298 → 22 [ACK] Seq=8209 Ack=192873 Win=5703 Len=0 TSval=5711132 TSecr=6307505
  342 5.862901687  10.6.15.144 → 192.168.1.16 SSH 1514 Server: Encrypted packet (len=1448)
  343 5.862908913 192.168.1.16 → 10.6.15.144  TCP 66 59298 → 22 [ACK] Seq=8209 Ack=194321 Win=5703 Len=0 TSval=5711132 TSecr=6307505
  344 5.863092874  10.6.15.144 → 192.168.1.16 SSH 1514 Server: Encrypted packet (len=1448)
  345 5.863096083 192.168.1.16 → 10.6.15.144  TCP 66 59298 → 22 [ACK] Seq=8209 Ack=195769 Win=5703 Len=0 TSval=5711133 TSecr=6307505
  346 5.869791404  10.6.15.144 → 192.168.1.16 SSH 1514 Server: Encrypted packet (len=1448)
  347 5.869815748 192.168.1.16 → 10.6.15.144  TCP 66 59298 → 22 [ACK] Seq=8209 Ack=197217 Win=5703 Len=0 TSval=5711134 TSecr=6307507
  348 5.871360616  10.6.15.144 → 192.168.1.16 SSH 1514 Server: Encrypted packet (len=1448)
