    1 0.000000000  10.6.15.144 → 192.168.1.16 SSH 614 Server: Encrypted packet (len=548)
    2 0.000024938  10.6.15.144 → 192.168.1.16 TCP 614 [TCP Retransmission] 22 → 59298 [PSH, ACK] Seq=1 Ack=1 Win=1452 Len=548 TSval=4429224 TSecr=3832677
    3 0.000035314 192.168.1.16 → 10.6.15.144  TCP 78 59298 → 22 [ACK] Seq=1 Ack=549 Win=3666 Len=0 TSval=3832953 TSecr=4429224 SLE=1 SRE=549
    4 0.000845213 192.168.1.16 → 10.6.15.144  SSH 134 Client: Encrypted packet (len=68)
    5 0.004763485 192.168.1.16 → 10.6.15.144  SSH 246 Client: Encrypted packet (len=180)
    6 0.010811363  10.6.15.144 → 192.168.1.16 TCP 66 22 → 59298 [ACK] Seq=549 Ack=69 Win=1452 Len=0 TSval=4429288 TSecr=3832954
    7 0.014840395  10.6.15.144 → 192.168.1.16 TCP 66 22 → 59298 [ACK] Seq=549 Ack=249 Win=1452 Len=0 TSval=4429289 TSecr=3832955
    8 1.018756679 10.22.19.172 → 224.0.0.252  LLMNR 64 Standard query 0x3319 A wpad
    9 1.018806742  10.6.15.144 → 192.168.1.16 SSH 366 Server: Encrypted packet (len=300)
   10 1.018819521  10.6.15.144 → 192.168.1.16 SSH 126 Server: Encrypted packet (len=60)
   11 1.018842023  10.6.15.144 → 192.168.1.16 SSH 134 Server: Encrypted packet (len=68)
   12 1.018853869 10.22.19.172 → 224.0.0.252  LLMNR 64 Standard query 0x3319 A wpad
   13 1.018856010 192.168.1.16 → 10.6.15.144  TCP 66 59298 → 22 [ACK] Seq=249 Ack=977 Win=3666 Len=0 TSval=3833208 TSecr=4429336
   14 1.019593519 192.168.1.16 → 10.6.15.144  SSH 134 Client: Encrypted packet (len=68)
   15 1.023324536 192.168.1.16 → 10.6.15.144  SSH 262 Client: Encrypted packet (len=196)
   16 1.030171025  10.6.15.144 → 192.168.1.16 TCP 66 22 → 59298 [ACK] Seq=977 Ack=317 Win=1452 Len=0 TSval=4429543 TSecr=3833208
   17 1.036925906  10.6.15.144 → 192.168.1.16 TCP 66 22 → 59298 [ACK] Seq=977 Ack=513 Win=1452 Len=0 TSval=4429544 TSecr=3833209
   18 2.010688250  10.6.15.144 → 192.168.1.16 SSH 358 Server: Encrypted packet (len=292)
   19 2.010871619  10.6.15.144 → 192.168.1.16 SSH 1414 Server: Encrypted packet (len=1348)
   20 2.010879966 192.168.1.16 → 10.6.15.144  TCP 66 59298 → 22 [ACK] Seq=513 Ack=2617 Win=3666 Len=0 TSval=3833456 TSecr=4429576
   21 2.011066805  10.6.15.144 → 192.168.1.16 SSH 1514 Server: Encrypted packet (len=1448)
   22 2.021629659  10.6.15.144 → 192.168.1.16 SSH 1514 Server: Encrypted packet (len=1448)
   23 2.021649444 192.168.1.16 → 10.6.15.144  TCP 66 59298 → 22 [ACK] Seq=513 Ack=5513 Win=3666 Len=0 TSval=3833459 TSecr=4429680
   24 2.021809900  10.6.15.144 → 192.168.1.16 SSH 1514 Server: Encrypted packet (len=1448)
   25 2.032475042  10.6.15.144 → 192.168.1.16 SSH 1514 Server: [TCP Previous segment not captured] , Encrypted packet (len=1448)
   26 2.032493195 192.168.1.16 → 10.6.15.144  TCP 78 59298 → 22 [ACK] Seq=513 Ack=6961 Win=3666 Len=0 TSval=3833461 TSecr=4429791 SLE=8409 SRE=9857
   27 2.044723397  10.6.15.144 → 192.168.1.16 SSH 1514 Server: Encrypted packet (len=1448)
   28 2.044745064 192.168.1.16 → 10.6.15.144  TCP 78 [TCP Dup ACK 26#1] 59298 → 22 [ACK] Seq=513 Ack=6961 Win=3666 Len=0 TSval=3833465 TSecr=4429791 SLE=8409 SRE=11305
   29 2.044902569  10.6.15.144 → 192.168.1.16 SSH 1514 Server: Encrypted packet (len=1448)
   30 2.044907705 192.168.1.16 → 10.6.15.144  TCP 78 [TCP Dup ACK 26#2] 59298 → 22 [ACK] Seq=513 Ack=6961 Win=3666 Len=0 TSval=3833465 TSecr=4429791 SLE=8409 SRE=12753
   31 4.026755824  10.6.15.144 → 192.168.1.16 TCP 1514 [TCP Retransmission] 22 → 59298 [ACK] Seq=6961 Ack=513 Win=1452 Len=1448 TSval=4430235 TSecr=3833461
   32 4.026781092 192.168.1.16 → 10.6.15.144  TCP 66 59298 → 22 [ACK] Seq=513 Ack=12753 Win=3666 Len=0 TSval=3833960 TSecr=4430235
   33 4.026795503 10.22.18.209 → 224.0.0.252  LLMNR 64 Standard query 0x7a17 A wpad
   34 4.026881069 10.22.18.209 → 224.0.0.252  LLMNR 64 Standard query 0x7a17 A wpad
   35 4.090441029  10.6.15.144 → 192.168.1.16 SSH 1514 Server: Encrypted packet (len=1448)
   36 4.090459417 192.168.1.16 → 10.6.15.144  TCP 66 59298 → 22 [ACK] Seq=513 Ack=14201 Win=3666 Len=0 TSval=3833976 TSecr=4430308
   37 4.090616158  10.6.15.144 → 192.168.1.16 SSH 1514 Server: Encrypted packet (len=1448)
   38 4.090623269 192.168.1.16 → 10.6.15.144  TCP 66 59298 → 22 [ACK] Seq=513 Ack=15649 Win=3666 Len=0 TSval=3833976 TSecr=4430308
   39 4.090808901  10.6.15.144 → 192.168.1.16 SSH 1514 Server: Encrypted packet (len=1448)
   40 4.090814813 192.168.1.16 → 10.6.15.144  TCP 66 59298 → 22 [ACK] Seq=513 Ack=17097 Win=3666 Len=0 TSval=3833976 TSecr=4430308
   41 4.101469164  10.6.15.144 → 192.168.1.16 SSH 1514 Server: Encrypted packet (len=1448)
   42 4.101487504 192.168.1.16 → 10.6.15.144  TCP 66 59298 → 22 [ACK] Seq=513 Ack=18545 Win=3666 Len=0 TSval=3833979 TSecr=4430311
   43 4.101622808  10.6.15.144 → 192.168.1.16 SSH 1514 Server: Encrypted packet (len=1448)
   44 4.101631853 192.168.1.16 → 10.6.15.144  TCP 66 59298 → 22 [ACK] Seq=513 Ack=19993 Win=3666 Len=0 TSval=3833979 TSecr=4430311
   45 4.102006110  10.6.15.144 → 192.168.1.16 SSH 1514 Server: Encrypted packet (len=1448)
   46 4.102025215 192.168.1.16 → 10.6.15.144  TCP 66 59298 → 22 [ACK] Seq=513 Ack=21441 Win=3666 Len=0 TSval=3833979 TSecr=4430311
   47 4.112845775  10.6.15.144 → 192.168.1.16 SSH 1514 Server: Encrypted packet (len=1448)
   48 4.112865240 192.168.1.16 → 10.6.15.144  TCP 66 59298 → 22 [ACK] Seq=513 Ack=22889 Win=3666 Len=0 TSval=3833982 TSecr=4430314
   49 4.113015255  10.6.15.144 → 192.168.1.16 SSH 1514 Server: Encrypted packet (len=1448)
   50 4.113019806 192.168.1.16 → 10.6.15.144  TCP 66 59298 → 22 [ACK] Seq=513 Ack=24337 Win=3666 Len=0 TSval=3833982 TSecr=4430314
   51 4.113205995  10.6.15.144 → 192.168.1.16 SSH 1514 Server: Encrypted packet (len=1448)
   52 4.113211547 192.168.1.16 → 10.6.15.144  TCP 66 59298 → 22 [ACK] Seq=513 Ack=25785 Win=3666 Len=0 TSval=3833982 TSecr=4430314
   53 4.124292997  10.6.15.144 → 192.168.1.16 SSH 1514 Server: Encrypted packet (len=1448)
   54 4.124310447 192.168.1.16 → 10.6.15.144  TCP 66 59298 → 22 [ACK] Seq=513 Ack=27233 Win=3666 Len=0 TSval=3833984 TSecr=4430316
   55 4.124505121  10.6.15.144 → 192.168.1.16 SSH 1514 Server: Encrypted packet (len=1448)
   56 4.124515771 192.168.1.16 → 10.6.15.144  TCP 66 59298 → 22 [ACK] Seq=513 Ack=28681 Win=3666 Len=0 TSval=3833984 TSecr=4430316
   57 4.124697429  10.6.15.144 → 192.168.1.16 SSH 1514 Server: Encrypted packet (len=1448)
   58 4.124706510 192.168.1.16 → 10.6.15.144  TCP 66 59298 → 22 [ACK] Seq=513 Ack=30129 Win=3666 Len=0 TSval=3833985 TSecr=4430316
   59 4.138573922  10.6.15.144 → 192.168.1.16 SSH 1514 Server: Encrypted packet (len=1448)
   60 4.138591942 192.168.1.16 → 10.6.15.144  TCP 66 59298 → 22 [ACK] Seq=513 Ack=31577 Win=3666 Len=0 TSval=3833988 TSecr=4430319
   61 4.138727257  10.6.15.144 → 192.168.1.16 SSH 1514 Server: Encrypted packet (len=1448)
   62 4.138735678 192.168.1.16 → 10.6.15.144  TCP 66 59298 → 22 [ACK] Seq=513 Ack=33025 Win=3666 Len=0 TSval=3833988 TSecr=4430319
   63 4.139104035  10.6.15.144 → 192.168.1.16 SSH 1514 Server: Encrypted packet (len=1448)
   64 4.139121180 192.168.1.16 → 10.6.15.144  TCP 66 59298 → 22 [ACK] Seq=513 Ack=34473 Win=3666 Len=0 TSval=3833988 TSecr=4430319
   65 4.149158736  10.6.15.144 → 192.168.1.16 SSH 1514 Server: Encrypted packet (len=1448)
   66 4.153643748  10.6.15.144 → 192.168.1.16 SSH 1514 Server: Encrypted packet (len=1448)
   67 4.153660444 192.168.1.16 → 10.6.15.144  TCP 66 59298 → 22 [ACK] Seq=513 Ack=37369 Win=3666 Len=0 TSval=3833992 TSecr=4430323
   68 4.153829683  10.6.15.144 → 192.168.1.16 SSH 1514 Server: Encrypted packet (len=1448)
   69 4.154019528  10.6.15.144 → 192.168.1.16 SSH 1514 Server: Encrypted packet (len=1448)
   70 4.154023656 192.168.1.16 → 10.6.15.144  TCP 66 59298 → 22 [ACK] Seq=513 Ack=40265 Win=3666 Len=0 TSval=3833992 TSecr=4430323
   71 4.165403562  10.6.15.144 → 192.168.1.16 SSH 1514 Server: Encrypted packet (len=1448)
   72 4.165555533  10.6.15.144 → 192.168.1.16 SSH 1514 Server: Encrypted packet (len=1448)
   73 4.165565448 192.168.1.16 → 10.6.15.144  TCP 66 59298 → 22 [ACK] Seq=513 Ack=43161 Win=3666 Len=0 TSval=3833995 TSecr=4430327
   74 4.165749258  10.6.15.144 → 192.168.1.16 SSH 1514 Server: Encrypted packet (len=1448)
   75 4.165911309  10.6.15.144 → 192.168.1.16 SSH 1514 Server: Encrypted packet (len=1448)
   76 4.165917480 192.168.1.16 → 10.6.15.144  TCP 66 59298 → 22 [ACK] Seq=513 Ack=46057 Win=3666 Len=0 TSval=3833995 TSecr=4430327
   77 4.177186474  10.6.15.144 → 192.168.1.16 SSH 1514 Server: Encrypted packet (len=1448)
   78 4.177335374  10.6.15.144 → 192.168.1.16 SSH 1514 Server: Encrypted packet (len=1448)
   79 4.177345664 192.168.1.16 → 10.6.15.144  TCP 66 59298 → 22 [ACK] Seq=513 Ack=48953 Win=3666 Len=0 TSval=3833998 TSecr=4430330
   80 4.177528839  10.6.15.144 → 192.168.1.16 SSH 1514 Server: Encrypted packet (len=1448)
   81 4.177721410  10.6.15.144 → 192.168.1.16 SSH 1514 Server: Encrypted packet (len=1448)
   82 4.177731079 192.168.1.16 → 10.6.15.144  TCP 66 59298 → 22 [ACK] Seq=513 Ack=51849 Win=3666 Len=0 TSval=3833998 TSecr=4430330
   83 4.188984134  10.6.15.144 → 192.168.1.16 SSH 1514 Server: Encrypted packet (len=1448)
   84 4.189179666  10.6.15.144 → 192.168.1.16 SSH 1514 Server: Encrypted packet (len=1448)
   85 4.189194964 192.168.1.16 → 10.6.15.144  TCP 66 59298 → 22 [ACK] Seq=513 Ack=54745 Win=3666 Len=0 TSval=3834001 TSecr=4430333
   86 4.189332059  10.6.15.144 → 192.168.1.16 SSH 1514 Server: Encrypted packet (len=1448)
   87 4.189526874  10.6.15.144 → 192.168.1.16 SSH 1514 Server: Encrypted packet (len=1448)
   88 4.189532085 192.168.1.16 → 10.6.15.144  TCP 66 59298 → 22 [ACK] Seq=513 Ack=57641 Win=3666 Len=0 TSval=3834001 TSecr=4430333
   89 4.200252873  10.6.15.144 → 192.168.1.16 SSH 1514 Server: Encrypted packet (len=1448)
   90 4.200405629  10.6.15.144 → 192.168.1.16 SSH 1514 Server: Encrypted packet (len=1448)
   91 4.200417788 192.168.1.16 → 10.6.15.144  TCP 66 59298 → 22 [ACK] Seq=513 Ack=60537 Win=3666 Len=0 TSval=3834003 TSecr=4430336
   92 4.203876751  10.6.15.144 → 192.168.1.16 SSH 1514 Server: Encrypted packet (len=1448)
   93 4.204009313  10.6.15.144 → 192.168.1.16 SSH 1514 Server: Encrypted packet (len=1448)
   94 4.204015245 192.168.1.16 → 10.6.15.144  TCP 66 59298 → 22 [ACK] Seq=513 Ack=63433 Win=3666 Len=0 TSval=3834004 TSecr=4430336
   95 4.204220701  10.6.15.144 → 192.168.1.16 SSH 1514 Server: Encrypted packet (len=1448)
   96 4.204411779  10.6.15.144 → 192.168.1.16 SSH 1514 Server: Encrypted packet (len=1448)
   97 4.204415923 192.168.1.16 → 10.6.15.144  TCP 66 59298 → 22 [ACK] Seq=513 Ack=66329 Win=3666 Len=0 TSval=3834004 TSecr=4430336
   98 4.213534586  10.6.15.144 → 192.168.1.16 SSH 1514 Server: Encrypted packet (len=1448)
   99 4.213718052  10.6.15.144 → 192.168.1.16 SSH 1514 Server: Encrypted packet (len=1448)
  100 4.213726495 192.168.1.16 → 10.6.15.144  TCP 66 59298 → 22 [ACK] Seq=513 Ack=69225 Win=3666 Len=0 TSval=3834007 TSecr=4430339
  101 4.215506342  10.6.15.144 → 192.168.1.16 SSH 1514 Server: Encrypted packet (len=1448)
  102 4.215696974  10.6.15.144 → 192.168.1.16 SSH 1514 Server: Encrypted packet (len=1448)
  103 4.215701834 192.168.1.16 → 10.6.15.144  TCP 66 59298 → 22 [ACK] Seq=513 Ack=72121 Win=3666 Len=0 TSval=3834007 TSecr=4430339
  104 4.215885819  10.6.15.144 → 192.168.1.16 SSH 1514 Server: Encrypted packet (len=1448)
  105 4.216711747  10.6.15.144 → 192.168.1.16 SSH 1514 Server: Encrypted packet (len=1448)
  106 4.216716273 192.168.1.16 → 10.6.15.144  TCP 66 59298 → 22 [ACK] Seq=513 Ack=75017 Win=3666 Len=0 TSval=3834008 TSecr=4430339
  107 4.224542092  10.6.15.144 → 192.168.1.16 SSH 1514 Server: Encrypted packet (len=1448)
  108 4.227136359  10.6.15.144 → 192.168.1.16 SSH 1514 Server: [TCP Previous segment not captured] , Encrypted packet (len=1448)
  109 4.227154146 192.168.1.16 → 10.6.15.144  TCP 78 59298 → 22 [ACK] Seq=513 Ack=76465 Win=3666 Len=0 TSval=3834010 TSecr=4430342 SLE=77913 SRE=79361
  110 4.227286327  10.6.15.144 → 192.168.1.16 SSH 1514 Server: Encrypted packet (len=1448)
  111 4.227294320 192.168.1.16 → 10.6.15.144  TCP 78 [TCP Dup ACK 109#1] 59298 → 22 [ACK] Seq=513 Ack=76465 Win=3666 Len=0 TSval=3834010 TSecr=4430342 SLE=77913 SRE=80809
  112 4.227628920  10.6.15.144 → 192.168.1.16 SSH 1514 Server: Encrypted packet (len=1448)
  113 4.227634354 192.168.1.16 → 10.6.15.144  TCP 78 [TCP Dup ACK 109#2] 59298 → 22 [ACK] Seq=513 Ack=76465 Win=3666 Len=0 TSval=3834010 TSecr=4430342 SLE=77913 SRE=82257
  114 4.227792790  10.6.15.144 → 192.168.1.16 SSH 1514 Server: Encrypted packet (len=1448)
  115 4.227798365 192.168.1.16 → 10.6.15.144  TCP 78 [TCP Dup ACK 109#3] 59298 → 22 [ACK] Seq=513 Ack=76465 Win=3666 Len=0 TSval=3834010 TSecr=4430342 SLE=77913 SRE=83705
  116 4.239015043  10.6.15.144 → 192.168.1.16 SSH 1514 Server: Encrypted packet (len=1448)
  117 4.239038167 192.168.1.16 → 10.6.15.144  TCP 78 [TCP Dup ACK 109#4] 59298 → 22 [ACK] Seq=513 Ack=76465 Win=3666 Len=0 TSval=3834013 TSecr=4430342 SLE=77913 SRE=85153
  118 4.239197710  10.6.15.144 → 192.168.1.16 SSH 1514 Server: Encrypted packet (len=1448)
  119 4.239207205 192.168.1.16 → 10.6.15.144  TCP 78 [TCP Dup ACK 109#5] 59298 → 22 [ACK] Seq=513 Ack=76465 Win=3666 Len=0 TSval=3834013 TSecr=4430342 SLE=77913 SRE=86601
  120 4.239424850  10.6.15.144 → 192.168.1.16 SSH 1514 Server: Encrypted packet (len=1448)
  121 4.239444811 192.168.1.16 → 10.6.15.144  TCP 78 [TCP Dup ACK 109#6] 59298 → 22 [ACK] Seq=513 Ack=76465 Win=3666 Len=0 TSval=3834013 TSecr=4430342 SLE=77913 SRE=88049
  122 4.239643047  10.6.15.144 → 192.168.1.16 SSH 1514 Server: [TCP Fast Retransmission] , Encrypted packet (len=1448)
  123 4.239668265 192.168.1.16 → 10.6.15.144  TCP 66 59298 → 22 [ACK] Seq=513 Ack=88049 Win=3658 Len=0 TSval=3834013 TSecr=4430345
  124 4.245590970 192.168.1.16 → 10.6.15.144  SSH 118 Client: Encrypted packet (len=52)
  125 4.251185956  10.6.15.144 → 192.168.1.16 SSH 1514 Server: Encrypted packet (len=1448)
  126 4.251363990  10.6.15.144 → 192.168.1.16 SSH 1514 Server: Encrypted packet (len=1448)
  127 4.251371330 192.168.1.16 → 10.6.15.144  TCP 66 59298 → 22 [ACK] Seq=565 Ack=90945 Win=3666 Len=0 TSval=3834016 TSecr=4430348
  128 4.255736605  10.6.15.144 → 192.168.1.16 TCP 66 [TCP Previous segment not captured] 22 → 59298 [ACK] Seq=92393 Ack=565 Win=1452 Len=0 TSval=4430349 TSecr=3834015
  129 4.262349046  10.6.15.144 → 192.168.1.16 SSH 1514 Server: Encrypted packet (len=1448)
  130 4.262365339 192.168.1.16 → 10.6.15.144  TCP 78 [TCP Dup ACK 127#1] 59298 → 22 [ACK] Seq=565 Ack=90945 Win=3666 Len=0 TSval=3834019 TSecr=4430348 SLE=92393 SRE=93841
  131 4.262531174  10.6.15.144 → 192.168.1.16 SSH 1514 Server: Encrypted packet (len=1448)
  132 4.262538512 192.168.1.16 → 10.6.15.144  TCP 78 [TCP Dup ACK 127#2] 59298 → 22 [ACK] Seq=565 Ack=90945 Win=3666 Len=0 TSval=3834019 TSecr=4430348 SLE=92393 SRE=95289
  133 4.262722974  10.6.15.144 → 192.168.1.16 SSH 1514 Server: Encrypted packet (len=1448)
  134 4.262729450 192.168.1.16 → 10.6.15.144  TCP 78 [TCP Dup ACK 127#3] 59298 → 22 [ACK] Seq=565 Ack=90945 Win=3666 Len=0 TSval=3834019 TSecr=4430348 SLE=92393 SRE=96737
  135 4.262904493  10.6.15.144 → 192.168.1.16 SSH 1514 Server: Encrypted packet (len=1448)
  136 4.262911203 192.168.1.16 → 10.6.15.144  TCP 78 [TCP Dup ACK 127#4] 59298 → 22 [ACK] Seq=565 Ack=90945 Win=3666 Len=0 TSval=3834019 TSecr=4430348 SLE=92393 SRE=98185
  137 4.273731857  10.6.15.144 → 192.168.1.16 SSH 1514 Server: Encrypted packet (len=1448)
  138 4.273748928 192.168.1.16 → 10.6.15.144  TCP 78 [TCP Dup ACK 127#5] 59298 → 22 [ACK] Seq=565 Ack=90945 Win=3666 Len=0 TSval=3834022 TSecr=4430348 SLE=92393 SRE=99633
  139 4.273911610  10.6.15.144 → 192.168.1.16 SSH 1514 Server: Encrypted packet (len=1448)
  140 4.273913856 192.168.1.16 → 10.6.15.144  TCP 78 [TCP Dup ACK 127#6] 59298 → 22 [ACK] Seq=565 Ack=90945 Win=3666 Len=0 TSval=3834022 TSecr=4430348 SLE=92393 SRE=101081
  141 4.274260012  10.6.15.144 → 192.168.1.16 SSH 1514 Server: [TCP Fast Retransmission] , Encrypted packet (len=1448)
  142 4.274274483 192.168.1.16 → 10.6.15.144  TCP 66 59298 → 22 [ACK] Seq=565 Ack=101081 Win=3658 Len=0 TSval=3834022 TSecr=4430354
  143 4.274446726 192.168.1.16 → 10.6.15.144  SSH 102 Client: Encrypted packet (len=36)
  144 4.284865997  10.6.15.144 → 192.168.1.16 SSH 1514 Server: Encrypted packet (len=1448)
  145 4.285049939  10.6.15.144 → 192.168.1.16 SSH 1514 Server: Encrypted packet (len=1448)
  146 4.285059655 192.168.1.16 → 10.6.15.144  TCP 66 59298 → 22 [ACK] Seq=601 Ack=103977 Win=3666 Len=0 TSval=3834025 TSecr=4430357
  147 4.285393852  10.6.15.144 → 192.168.1.16 SSH 1514 Server: Encrypted packet (len=1448)
  148 4.300755590  10.6.15.144 → 192.168.1.16 SSH 1514 Server: Encrypted packet (len=1448)
  149 4.300775516 192.168.1.16 → 10.6.15.144  TCP 66 59298 → 22 [ACK] Seq=601 Ack=106873 Win=3666 Len=0 TSval=3834029 TSecr=4430357
  150 4.300942357  10.6.15.144 → 192.168.1.16 SSH 1514 Server: Encrypted packet (len=1448)
  151 4.301134034  10.6.15.144 → 192.168.1.16 SSH 1514 Server: Encrypted packet (len=1448)
  152 4.301140694 192.168.1.16 → 10.6.15.144  TCP 66 59298 → 22 [ACK] Seq=601 Ack=109769 Win=3666 Len=0 TSval=3834029 TSecr=4430359
  153 4.313183807  10.6.15.144 → 192.168.1.16 SSH 1514 Server: Encrypted packet (len=1448)
  154 4.313302684  10.6.15.144 → 192.168.1.16 SSH 1514 Server: Encrypted packet (len=1448)
  155 4.313311099 192.168.1.16 → 10.6.15.144  TCP 66 59298 → 22 [ACK] Seq=601 Ack=112665 Win=3666 Len=0 TSval=3834032 TSecr=4430363
  156 4.313498088  10.6.15.144 → 192.168.1.16 SSH 1514 Server: Encrypted packet (len=1448)
  157 4.313716684  10.6.15.144 → 192.168.1.16 SSH 1514 Server: Encrypted packet (len=1448)
  158 4.313721794 192.168.1.16 → 10.6.15.144  TCP 66 59298 → 22 [ACK] Seq=601 Ack=115561 Win=3666 Len=0 TSval=3834032 TSecr=4430363
  159 4.325014757  10.6.15.144 → 192.168.1.16 SSH 1514 Server: Encrypted packet (len=1448)
  160 4.325163396  10.6.15.144 → 192.168.1.16 SSH 1514 Server: Encrypted packet (len=1448)
  161 4.325171113 192.168.1.16 → 10.6.15.144  TCP 66 59298 → 22 [ACK] Seq=601 Ack=118457 Win=3666 Len=0 TSval=3834035 TSecr=4430367
  162 4.325533244  10.6.15.144 → 192.168.1.16 SSH 1514 Server: Encrypted packet (len=1448)
  163 4.325723680  10.6.15.144 → 192.168.1.16 SSH 1514 Server: Encrypted packet (len=1448)
  164 4.325730343 192.168.1.16 → 10.6.15.144  TCP 66 59298 → 22 [ACK] Seq=601 Ack=121353 Win=3666 Len=0 TSval=3834035 TSecr=4430367
  165 4.336285516  10.6.15.144 → 192.168.1.16 SSH 1514 Server: Encrypted packet (len=1448)
  166 4.336437372  10.6.15.144 → 192.168.1.16 SSH 1514 Server: Encrypted packet (len=1448)
  167 4.336447474 192.168.1.16 → 10.6.15.144  TCP 66 59298 → 22 [ACK] Seq=601 Ack=124249 Win=3666 Len=0 TSval=3834037 TSecr=4430370
  168 4.336784566  10.6.15.144 → 192.168.1.16 SSH 1514 Server: Encrypted packet (len=1448)
  169 4.336998260  10.6.15.144 → 192.168.1.16 SSH 1514 Server: Encrypted packet (len=1448)
  170 4.337015621 192.168.1.16 → 10.6.15.144  TCP 66 59298 → 22 [ACK] Seq=601 Ack=127145 Win=3666 Len=0 TSval=3834038 TSecr=4430370
  171 4.346014260 192.168.1.16 → 10.6.15.144  SSH 126 Client: Encrypted packet (len=60)
  172 4.346245509 192.168.1.16 → 10.6.15.144  SSH 110 Client: Encrypted packet (len=44)
  173 4.346460548 192.168.1.16 → 10.6.15.144  SSH 102 Client: Encrypted packet (len=36)
  174 4.347927819  10.6.15.144 → 192.168.1.16 SSH 1514 Server: Encrypted packet (len=1448)
  175 4.348117756  10.6.15.144 → 192.168.1.16 SSH 1514 Server: Encrypted packet (len=1448)
  176 4.348122177 192.168.1.16 → 10.6.15.144  TCP 66 59298 → 22 [ACK] Seq=741 Ack=130041 Win=3666 Len=0 TSval=3834040 TSecr=4430372
  177 4.348310196  10.6.15.144 → 192.168.1.16 SSH 1514 Server: Encrypted packet (len=1448)
  178 4.348501888  10.6.15.144 → 192.168.1.16 SSH 1514 Server: Encrypted packet (len=1448)
  179 4.348505089 192.168.1.16 → 10.6.15.144  TCP 66 59298 → 22 [ACK] Seq=741 Ack=132937 Win=3666 Len=0 TSval=3834040 TSecr=4430372
  180 4.354579584 192.168.1.16 → 10.6.15.144  SSH 102 Client: Encrypted packet (len=36)
  181 4.356237266  10.6.15.144 → 192.168.1.16 TCP 66 22 → 59298 [ACK] Seq=132937 Ack=705 Win=1452 Len=0 TSval=4430375 TSecr=3834040
  182 4.356257895 192.168.1.16 → 10.6.15.144  SSH 146 Client: Encrypted packet (len=80)
  183 4.358885435  10.6.15.144 → 192.168.1.16 SSH 1514 Server: Encrypted packet (len=1448)
  184 4.359067943  10.6.15.144 → 192.168.1.16 SSH 1514 Server: Encrypted packet (len=1448)
  185 4.359076376 192.168.1.16 → 10.6.15.144  TCP 66 59298 → 22 [ACK] Seq=857 Ack=135833 Win=3666 Len=0 TSval=3834043 TSecr=4430375
  186 4.359427023  10.6.15.144 → 192.168.1.16 SSH 1514 Server: Encrypted packet (len=1448)
  187 4.359605025  10.6.15.144 → 192.168.1.16 SSH 1514 Server: Encrypted packet (len=1448)
  188 4.359612128 192.168.1.16 → 10.6.15.144  TCP 66 59298 → 22 [ACK] Seq=857 Ack=138729 Win=3666 Len=0 TSval=3834043 TSecr=4430375
  189 4.366923161 192.168.1.16 → 10.6.15.144  SSH 110 Client: Encrypted packet (len=44)
  190 4.368876319 192.168.1.16 → 10.6.15.144  SSH 102 Client: Encrypted packet (len=36)
  191 4.370113570  10.6.15.144 → 192.168.1.16 TCP 66 22 → 59298 [ACK] Seq=138729 Ack=857 Win=1452 Len=0 TSval=4430377 TSecr=3834042
  192 4.370460721  10.6.15.144 → 192.168.1.16 SSH 1514 Server: Encrypted packet (len=1448)
  193 4.370649780  10.6.15.144 → 192.168.1.16 SSH 1514 Server: Encrypted packet (len=1448)
  194 4.370662264 192.168.1.16 → 10.6.15.144  TCP 66 59298 → 22 [ACK] Seq=937 Ack=141625 Win=3666 Len=0 TSval=3834046 TSecr=4430378
  195 4.370841395  10.6.15.144 → 192.168.1.16 SSH 1514 Server: Encrypted packet (len=1448)
  196 4.371033546  10.6.15.144 → 192.168.1.16 SSH 1514 Server: Encrypted packet (len=1448)
  197 4.371043131 192.168.1.16 → 10.6.15.144  TCP 66 59298 → 22 [ACK] Seq=937 Ack=144521 Win=3666 Len=0 TSval=3834046 TSecr=4430378
  198 4.371881442 192.168.1.16 → 10.6.15.144  SSH 110 Client: Encrypted packet (len=44)
  199 4.373169838 192.168.1.16 → 10.6.15.144  SSH 102 Client: Encrypted packet (len=36)
  200 4.374162312 192.168.1.16 → 10.6.15.144  SSH 102 Client: Encrypted packet (len=36)
  201 4.378828662  10.6.15.144 → 192.168.1.16 TCP 66 22 → 59298 [ACK] Seq=144521 Ack=937 Win=1452 Len=0 TSval=4430380 TSecr=3834045
  202 4.378854212 192.168.1.16 → 10.6.15.144  SSH 174 Client: Encrypted packet (len=108)
  203 4.382271207 192.168.1.16 → 10.6.15.144  SSH 102 Client: Encrypted packet (len=36)
  204 4.382533904  10.6.15.144 → 192.168.1.16 SSH 1514 Server: Encrypted packet (len=1448)
  205 4.382550490 192.168.1.16 → 10.6.15.144  SSH 102 Client: Encrypted packet (len=36)
  206 4.382719641  10.6.15.144 → 192.168.1.16 SSH 1514 Server: Encrypted packet (len=1448)
  207 4.383070562  10.6.15.144 → 192.168.1.16 SSH 1514 Server: Encrypted packet (len=1448)
  208 4.383083472 192.168.1.16 → 10.6.15.144  TCP 66 59298 → 22 [ACK] Seq=1233 Ack=148865 Win=3666 Len=0 TSval=3834049 TSecr=4430381
  209 4.383255674  10.6.15.144 → 192.168.1.16 SSH 1514 Server: Encrypted packet (len=1448)
  210 4.383823529  10.6.15.144 → 192.168.1.16 TCP 66 22 → 59298 [ACK] Seq=150313 Ack=1017 Win=1452 Len=0 TSval=4430382 TSecr=3834046
  211 4.383836318 192.168.1.16 → 10.6.15.144  SSH 102 Client: Encrypted packet (len=36)
  212 4.384156511 192.168.1.16 → 10.6.15.144  SSH 102 Client: Encrypted packet (len=36)
  213 4.389004072  10.6.15.144 → 192.168.1.16 TCP 66 22 → 59298 [ACK] Seq=150313 Ack=1161 Win=1452 Len=0 TSval=4430383 TSecr=3834047
  214 4.389022415 192.168.1.16 → 10.6.15.144  SSH 138 Client: Encrypted packet (len=72)
  215 4.389893934 192.168.1.16 → 10.6.15.144  SSH 102 Client: Encrypted packet (len=36)
  216 4.391678589  10.6.15.144 → 192.168.1.16 SSH 1514 Server: Encrypted packet (len=1448)
  217 4.394146947  10.6.15.144 → 192.168.1.16 SSH 1514 Server: Encrypted packet (len=1448)
  218 4.394170797 192.168.1.16 → 10.6.15.144  SSH 138 Client: Encrypted packet (len=72)
  219 4.394331537  10.6.15.144 → 192.168.1.16 SSH 1514 Server: Encrypted packet (len=1448)
  220 4.394520197  10.6.15.144 → 192.168.1.16 SSH 1514 Server: Encrypted packet (len=1448)
  221 4.394527916 192.168.1.16 → 10.6.15.144  TCP 66 59298 → 22 [ACK] Seq=1485 Ack=156105 Win=3666 Len=0 TSval=3834052 TSecr=4430384
  222 4.394543748  10.6.15.144 → 192.168.1.16 TCP 66 22 → 59298 [ACK] Seq=156105 Ack=1305 Win=1452 Len=0 TSval=4430384 TSecr=3834049
  223 4.401655716 192.168.1.16 → 10.6.15.144  SSH 102 Client: Encrypted packet (len=36)
  224 4.403303484 192.168.1.16 → 10.6.15.144  SSH 102 Client: Encrypted packet (len=36)
  225 4.403951410  10.6.15.144 → 192.168.1.16 TCP 66 22 → 59298 [ACK] Seq=156105 Ack=1413 Win=1452 Len=0 TSval=4430386 TSecr=3834051
  226 4.404390446 192.168.1.16 → 10.6.15.144  SSH 102 Client: Encrypted packet (len=36)
  227 4.405313636  10.6.15.144 → 192.168.1.16 SSH 1514 Server: [TCP Previous segment not captured] , Encrypted packet (len=1448)
  228 4.405334024 192.168.1.16 → 10.6.15.144  TCP 78 [TCP Dup ACK 221#1] 59298 → 22 [ACK] Seq=1593 Ack=156105 Win=3666 Len=0 TSval=3834055 TSecr=4430386 SLE=157553 SRE=159001
  229 4.406261139 192.168.1.16 → 10.6.15.144  SSH 114 Client: Encrypted packet (len=36)
  230 4.407958224 192.168.1.16 → 10.6.15.144  SSH 114 Client: Encrypted packet (len=36)
  231 4.408337131 192.168.1.16 → 10.6.15.144  SSH 186 Client: Encrypted packet (len=108)
  232 4.408917337  10.6.15.144 → 192.168.1.16 SSH 1514 Server: Encrypted packet (len=1448)
  233 4.408926103 192.168.1.16 → 10.6.15.144  TCP 78 [TCP Dup ACK 221#2] 59298 → 22 [ACK] Seq=1773 Ack=156105 Win=3666 Len=0 TSval=3834056 TSecr=4430386 SLE=157553 SRE=160449
  234 4.409125821  10.6.15.144 → 192.168.1.16 SSH 1514 Server: Encrypted packet (len=1448)
  235 4.409130845 192.168.1.16 → 10.6.15.144  TCP 78 [TCP Dup ACK 221#3] 59298 → 22 [ACK] Seq=1773 Ack=156105 Win=3666 Len=0 TSval=3834056 TSecr=4430386 SLE=157553 SRE=161897
  236 4.413733814  10.6.15.144 → 192.168.1.16 TCP 66 22 → 59298 [ACK] Seq=161897 Ack=1557 Win=1452 Len=0 TSval=4430389 TSecr=3834054
  237 4.416508608  10.6.15.144 → 192.168.1.16 SSH 1514 Server: Encrypted packet (len=1448)
  238 4.416533061 192.168.1.16 → 10.6.15.144  TCP 78 [TCP Dup ACK 221#4] 59298 → 22 [ACK] Seq=1773 Ack=156105 Win=3666 Len=0 TSval=3834057 TSecr=4430386 SLE=157553 SRE=163345
  239 4.418208785  10.6.15.144 → 192.168.1.16 SSH 1514 Server: Encrypted packet (len=1448)
  240 4.418229930 192.168.1.16 → 10.6.15.144  TCP 78 [TCP Dup ACK 221#5] 59298 → 22 [ACK] Seq=1773 Ack=156105 Win=3666 Len=0 TSval=3834058 TSecr=4430386 SLE=157553 SRE=164793
  241 4.418244641  10.6.15.144 → 192.168.1.16 TCP 66 22 → 59298 [ACK] Seq=164793 Ack=1665 Win=1452 Len=0 TSval=4430390 TSecr=3834055
  242 4.419791209  10.6.15.144 → 192.168.1.16 SSH 1514 Server: Encrypted packet (len=1448)
  243 4.419814288 192.168.1.16 → 10.6.15.144  TCP 78 [TCP Dup ACK 221#6] 59298 → 22 [ACK] Seq=1773 Ack=156105 Win=3666 Len=0 TSval=3834058 TSecr=4430386 SLE=157553 SRE=166241
  244 4.428684993  10.6.15.144 → 192.168.1.16 SSH 1514 Server: Encrypted packet (len=1448)
  245 4.428701529 192.168.1.16 → 10.6.15.144  TCP 78 [TCP Dup ACK 221#7] 59298 → 22 [ACK] Seq=1773 Ack=156105 Win=3666 Len=0 TSval=3834061 TSecr=4430386 SLE=157553 SRE=167689
  246 4.430206658  10.6.15.144 → 192.168.1.16 SSH 1514 Server: Encrypted packet (len=1448)
  247 4.430227618 192.168.1.16 → 10.6.15.144  TCP 78 [TCP Dup ACK 221#8] 59298 → 22 [ACK] Seq=1773 Ack=156105 Win=3666 Len=0 TSval=3834061 TSecr=4430386 SLE=157553 SRE=169137
  248 4.440359426  10.6.15.144 → 192.168.1.16 SSH 1514 Server: [TCP Fast Retransmission] , Encrypted packet (len=1448)
  249 4.440387706 192.168.1.16 → 10.6.15.144  TCP 66 59298 → 22 [ACK] Seq=1773 Ack=169137 Win=3658 Len=0 TSval=3834063 TSecr=4430395
  250 4.440610846  10.6.15.144 → 192.168.1.16 SSH 1514 Server: [TCP Previous segment not captured] , Encrypted packet (len=1448)
  251 4.440615114 192.168.1.16 → 10.6.15.144  TCP 78 [TCP Window Update] 59298 → 22 [ACK] Seq=1773 Ack=169137 Win=3666 Len=0 TSval=3834063 TSecr=4430395 SLE=170585 SRE=172033
  252 4.450134475 192.168.1.16 → 10.6.15.144  SSH 114 Client: Encrypted packet (len=36)
  253 4.450866860 192.168.1.16 → 10.6.15.144  SSH 114 Client: Encrypted packet (len=36)
  254 4.451423688  10.6.15.144 → 192.168.1.16 SSH 1514 Server: Encrypted packet (len=1448)
  255 4.451442486 192.168.1.16 → 10.6.15.144  TCP 78 [TCP Dup ACK 249#1] 59298 → 22 [ACK] Seq=1845 Ack=169137 Win=3666 Len=0 TSval=3834066 TSecr=4430395 SLE=170585 SRE=173481
  256 4.451611757  10.6.15.144 → 192.168.1.16 SSH 1514 Server: Encrypted packet (len=1448)
  257 4.451622035 192.168.1.16 → 10.6.15.144  TCP 78 [TCP Dup ACK 249#2] 59298 → 22 [ACK] Seq=1845 Ack=169137 Win=3666 Len=0 TSval=3834066 TSecr=4430395 SLE=170585 SRE=174929
  258 4.452375864 192.168.1.16 → 10.6.15.144  SSH 114 Client: Encrypted packet (len=36)
  259 4.453375000 192.168.1.16 → 10.6.15.144  SSH 114 Client: Encrypted packet (len=36)
  260 4.454464876 192.168.1.16 → 10.6.15.144  SSH 114 Client: Encrypted packet (len=36)
  261 4.454866475 192.168.1.16 → 10.6.15.144  SSH 114 Client: Encrypted packet (len=36)
  262 4.461383148  10.6.15.144 → 192.168.1.16 TCP 66 22 → 59298 [ACK] Seq=174929 Ack=1845 Win=1452 Len=0 TSval=4430401 TSecr=3834066
  263 4.461403609 192.168.1.16 → 10.6.15.144  SSH 150 Client: Encrypted packet (len=72)
  264 4.462982054  10.6.15.144 → 192.168.1.16 SSH 1514 Server: Encrypted packet (len=1448)
  265 4.462992287 192.168.1.16 → 10.6.15.144  TCP 78 [TCP Dup ACK 249#3] 59298 → 22 [ACK] Seq=2061 Ack=169137 Win=3666 Len=0 TSval=3834069 TSecr=4430395 SLE=170585 SRE=176377
  266 4.463156807  10.6.15.144 → 192.168.1.16 SSH 1514 Server: [TCP Fast Retransmission] , Encrypted packet (len=1448)
  267 4.463166192 192.168.1.16 → 10.6.15.144  TCP 66 59298 → 22 [ACK] Seq=2061 Ack=176377 Win=3666 Len=0 TSval=3834069 TSecr=4430401
  268 4.463301136  10.6.15.144 → 192.168.1.16 TCP 66 22 → 59298 [ACK] Seq=176377 Ack=1917 Win=1452 Len=0 TSval=4430401 TSecr=3834066
  269 4.464819563  10.6.15.144 → 192.168.1.16 TCP 66 22 → 59298 [ACK] Seq=176377 Ack=1989 Win=1452 Len=0 TSval=4430402 TSecr=3834067
  270 4.475523328  10.6.15.144 → 192.168.1.16 SSH 1514 Server: Encrypted packet (len=1448)
  271 4.475542934 192.168.1.16 → 10.6.15.144  TCP 66 59298 → 22 [ACK] Seq=2061 Ack=177825 Win=3666 Len=0 TSval=3834072 TSecr=4430404
  272 4.475705206  10.6.15.144 → 192.168.1.16 SSH 1514 Server: Encrypted packet (len=1448)
  273 4.475711868 192.168.1.16 → 10.6.15.144  TCP 66 59298 → 22 [ACK] Seq=2061 Ack=179273 Win=3666 Len=0 TSval=3834072 TSecr=4430404
  274 4.486315897  10.6.15.144 → 192.168.1.16 SSH 1514 Server: Encrypted packet (len=1448)
  275 4.486332535 192.168.1.16 → 10.6.15.144  TCP 66 59298 → 22 [ACK] Seq=2061 Ack=180721 Win=3666 Len=0 TSval=3834075 TSecr=4430407
  276 4.486517735  10.6.15.144 → 192.168.1.16 SSH 1514 Server: Encrypted packet (len=1448)
  277 4.486522071 192.168.1.16 → 10.6.15.144  TCP 66 59298 → 22 [ACK] Seq=2061 Ack=182169 Win=3666 Len=0 TSval=3834075 TSecr=4430407
  278 4.497022325  10.6.15.144 → 192.168.1.16 SSH 1514 Server: [TCP Previous segment not captured] , Encrypted packet (len=1448)
  279 4.497040521 192.168.1.16 → 10.6.15.144  TCP 78 [TCP Dup ACK 277#1] 59298 → 22 [ACK] Seq=2061 Ack=182169 Win=3666 Len=0 TSval=3834078 TSecr=4430407 SLE=183617 SRE=185065
  280 4.497214999  10.6.15.144 → 192.168.1.16 SSH 1514 Server: Encrypted packet (len=1448)
  281 4.497234157 192.168.1.16 → 10.6.15.144  TCP 78 [TCP Dup ACK 277#2] 59298 → 22 [ACK] Seq=2061 Ack=182169 Win=3666 Len=0 TSval=3834078 TSecr=4430407 SLE=183617 SRE=186513
  282 4.507812795  10.6.15.144 → 192.168.1.16 SSH 1514 Server: Encrypted packet (len=1448)
  283 4.507831090 192.168.1.16 → 10.6.15.144  TCP 78 [TCP Dup ACK 277#3] 59298 → 22 [ACK] Seq=2061 Ack=182169 Win=3666 Len=0 TSval=3834080 TSecr=4430407 SLE=183617 SRE=187961
  284 4.511311726  10.6.15.144 → 192.168.1.16 SSH 1514 Server: Encrypted packet (len=1448)
  285 4.511330733 192.168.1.16 → 10.6.15.144  TCP 78 [TCP Dup ACK 277#4] 59298 → 22 [ACK] Seq=2061 Ack=182169 Win=3666 Len=0 TSval=3834081 TSecr=4430407 SLE=183617 SRE=189409
  286 4.520526527  10.6.15.144 → 192.168.1.16 SSH 1514 Server: [TCP Fast Retransmission] , Encrypted packet (len=1448)
  287 4.520548694 192.168.1.16 → 10.6.15.144  TCP 66 59298 → 22 [ACK] Seq=2061 Ack=189409 Win=3666 Len=0 TSval=3834083 TSecr=4430416
  288 4.521456729  10.6.15.144 → 192.168.1.16 SSH 1514 Server: Encrypted packet (len=1448)
  289 4.521463503 192.168.1.16 → 10.6.15.144  TCP 66 59298 → 22 [ACK] Seq=2061 Ack=190857 Win=3666 Len=0 TSval=3834084 TSecr=4430416
  290 4.531188025  10.6.15.144 → 192.168.1.16 SSH 1514 Server: Encrypted packet (len=1448)
  291 4.531194690 192.168.1.16 → 10.6.15.144  TCP 66 59298 → 22 [ACK] Seq=2061 Ack=192305 Win=3666 Len=0 TSval=3834086 TSecr=4430418
  292 4.531904288  10.6.15.144 → 192.168.1.16 SSH 1514 Server: Encrypted packet (len=1448)
  293 4.531911130 192.168.1.16 → 10.6.15.144  TCP 66 59298 → 22 [ACK] Seq=2061 Ack=193753 Win=3666 Len=0 TSval=3834086 TSecr=4430418
  294 4.532072041  10.6.15.144 → 192.168.1.16 SSH 1514 Server: Encrypted packet (len=1448)
  295 4.532078773 192.168.1.16 → 10.6.15.144  TCP 66 59298 → 22 [ACK] Seq=2061 Ack=195201 Win=3666 Len=0 TSval=3834086 TSecr=4430418
  296 4.541854926  10.6.15.144 → 192.168.1.16 SSH 1514 Server: Encrypted packet (len=1448)
  297 4.541872749 192.168.1.16 → 10.6.15.144  TCP 66 59298 → 22 [ACK] Seq=2061 Ack=196649 Win=3666 Len=0 TSval=3834089 TSecr=4430421
  298 4.542654458  10.6.15.144 → 192.168.1.16 SSH 1514 Server: Encrypted packet (len=1448)
  299 4.542672390 192.168.1.16 → 10.6.15.144  TCP 66 59298 → 22 [ACK] Seq=2061 Ack=198097 Win=3666 Len=0 TSval=3834089 TSecr=4430421
  300 4.552431105  10.6.15.144 → 192.168.1.16 SSH 1514 Server: [TCP Previous segment not captured] , Encrypted packet (len=1448)
  301 4.552450630 192.168.1.16 → 10.6.15.144  TCP 78 [TCP Dup ACK 299#1] 59298 → 22 [ACK] Seq=2061 Ack=198097 Win=3666 Len=0 TSval=3834091 TSecr=4430421 SLE=199545 SRE=200993
  302 4.552745772  10.6.15.144 → 192.168.1.16 SSH 1514 Server: Encrypted packet (len=1448)
  303 4.552754107 192.168.1.16 → 10.6.15.144  TCP 78 [TCP Dup ACK 299#2] 59298 → 22 [ACK] Seq=2061 Ack=198097 Win=3666 Len=0 TSval=3834092 TSecr=4430421 SLE=199545 SRE=202441
  304 4.563233708  10.6.15.144 → 192.168.1.16 SSH 1514 Server: Encrypted packet (len=1448)
  305 4.563254122 192.168.1.16 → 10.6.15.144  TCP 78 [TCP Dup ACK 299#3] 59298 → 22 [ACK] Seq=2061 Ack=198097 Win=3666 Len=0 TSval=3834094 TSecr=4430421 SLE=199545 SRE=203889
  306 4.563422588  10.6.15.144 → 192.168.1.16 SSH 1514 Server: Encrypted packet (len=1448)
  307 4.563442050 192.168.1.16 → 10.6.15.144  TCP 78 [TCP Dup ACK 299#4] 59298 → 22 [ACK] Seq=2061 Ack=198097 Win=3666 Len=0 TSval=3834094 TSecr=4430421 SLE=199545 SRE=205337
  308 4.574629067  10.6.15.144 → 192.168.1.16 SSH 1514 Server: [TCP Fast Retransmission] , Encrypted packet (len=1448)
  309 4.574651237 192.168.1.16 → 10.6.15.144  TCP 66 59298 → 22 [ACK] Seq=2061 Ack=205337 Win=3666 Len=0 TSval=3834097 TSecr=4430429
  310 4.574811958  10.6.15.144 → 192.168.1.16 SSH 1514 Server: Encrypted packet (len=1448)
  311 4.574816987 192.168.1.16 → 10.6.15.144  TCP 66 59298 → 22 [ACK] Seq=2061 Ack=206785 Win=3666 Len=0 TSval=3834097 TSecr=4430429
  312 4.575105308 192.168.1.16 → 10.6.15.144  SSH 102 Client: Encrypted packet (len=36)
  313 4.585634783  10.6.15.144 → 192.168.1.16 SSH 1514 Server: Encrypted packet (len=1448)
  314 4.585816059  10.6.15.144 → 192.168.1.16 SSH 1514 Server: Encrypted packet (len=1448)
  315 4.585828457 192.168.1.16 → 10.6.15.144  TCP 66 59298 → 22 [ACK] Seq=2097 Ack=209681 Win=3666 Len=0 TSval=3834100 TSecr=4430432
  316 4.586008879  10.6.15.144 → 192.168.1.16 SSH 1514 Server: Encrypted packet (len=1448)
  317 4.596576835  10.6.15.144 → 192.168.1.16 SSH 1514 Server: Encrypted packet (len=1448)
  318 4.596599860 192.168.1.16 → 10.6.15.144  TCP 66 59298 → 22 [ACK] Seq=2097 Ack=212577 Win=3666 Len=0 TSval=3834102 TSecr=4430432
  319 4.596701659  10.6.15.144 → 192.168.1.16 SSH 1514 Server: Encrypted packet (len=1448)
  320 4.607608900  10.6.15.144 → 192.168.1.16 SSH 1514 Server: Encrypted packet (len=1448)
  321 4.607625593 192.168.1.16 → 10.6.15.144  TCP 66 59298 → 22 [ACK] Seq=2097 Ack=215473 Win=3666 Len=0 TSval=3834105 TSecr=4430435
  322 4.607790208  10.6.15.144 → 192.168.1.16 SSH 1514 Server: Encrypted packet (len=1448)
  323 4.619221467  10.6.15.144 → 192.168.1.16 SSH 1514 Server: [TCP Previous segment not captured] , Encrypted packet (len=1448)
  324 4.619241342 192.168.1.16 → 10.6.15.144  TCP 78 59298 → 22 [ACK] Seq=2097 Ack=216921 Win=3666 Len=0 TSval=3834108 TSecr=4430437 SLE=218369 SRE=219817
  325 4.629599312  10.6.15.144 → 192.168.1.16 SSH 1514 Server: Encrypted packet (len=1448)
  326 4.629619296 192.168.1.16 → 10.6.15.144  TCP 78 [TCP Dup ACK 324#1] 59298 → 22 [ACK] Seq=2097 Ack=216921 Win=3666 Len=0 TSval=3834111 TSecr=4430437 SLE=218369 SRE=221265
  327 4.629915943  10.6.15.144 → 192.168.1.16 SSH 1514 Server: Encrypted packet (len=1448)
  328 4.629936517 192.168.1.16 → 10.6.15.144  TCP 78 [TCP Dup ACK 324#2] 59298 → 22 [ACK] Seq=2097 Ack=216921 Win=3666 Len=0 TSval=3834111 TSecr=4430437 SLE=218369 SRE=222713
  329 4.640228836  10.6.15.144 → 192.168.1.16 SSH 1514 Server: Encrypted packet (len=1448)
  330 4.640247152 192.168.1.16 → 10.6.15.144  TCP 78 [TCP Dup ACK 324#3] 59298 → 22 [ACK] Seq=2097 Ack=216921 Win=3666 Len=0 TSval=3834113 TSecr=4430437 SLE=218369 SRE=224161
  331 4.640538968  10.6.15.144 → 192.168.1.16 SSH 1514 Server: [TCP Fast Retransmission] , Encrypted packet (len=1448)
  332 4.640550234 192.168.1.16 → 10.6.15.144  TCP 66 59298 → 22 [ACK] Seq=2097 Ack=224161 Win=3666 Len=0 TSval=3834113 TSecr=4430446
  333 4.651273123  10.6.15.144 → 192.168.1.16 SSH 1514 Server: Encrypted packet (len=1448)
  334 4.651293551 192.168.1.16 → 10.6.15.144  TCP 66 59298 → 22 [ACK] Seq=2097 Ack=225609 Win=3666 Len=0 TSval=3834116 TSecr=4430448
  335 4.651426902  10.6.15.144 → 192.168.1.16 SSH 1514 Server: Encrypted packet (len=1448)
  336 4.651430852 192.168.1.16 → 10.6.15.144  TCP 66 59298 → 22 [ACK] Seq=2097 Ack=227057 Win=3666 Len=0 TSval=3834116 TSecr=4430448
  337 4.665859106  10.6.15.144 → 192.168.1.16 SSH 1514 Server: Encrypted packet (len=1448)
  338 4.665877164 192.168.1.16 → 10.6.15.144  TCP 66 59298 → 22 [ACK] Seq=2097 Ack=228505 Win=3666 Len=0 TSval=3834120 TSecr=4430451
  339 4.666032868  10.6.15.144 → 192.168.1.16 SSH 1514 Server: Encrypted packet (len=1448)
  340 4.666037649 192.168.1.16 → 10.6.15.144  TCP 66 59298 → 22 [ACK] Seq=2097 Ack=229953 Win=3666 Len=0 TSval=3834120 TSecr=4430451
  341 4.666247416  10.6.15.144 → 192.168.1.16 SSH 1514 Server: Encrypted packet (len=1448)
  342 4.666253423 192.168.1.16 → 10.6.15.144  TCP 66 59298 → 22 [ACK] Seq=2097 Ack=231401 Win=3666 Len=0 TSval=3834120 TSecr=4430451
  343 4.676899973  10.6.15.144 → 192.168.1.16 SSH 1514 Server: Encrypted packet (len=1448)
  344 4.676918260 192.168.1.16 → 10.6.15.144  TCP 66 59298 → 22 [ACK] Seq=2097 Ack=232849 Win=3666 Len=0 TSval=3834123 TSecr=4430455
  345 4.677086017  10.6.15.144 → 192.168.1.16 SSH 1514 Server: Encrypted packet (len=1448)
  346 4.677094870 192.168.1.16 → 10.6.15.144  TCP 66 59298 → 22 [ACK] Seq=2097 Ack=234297 Win=3666 Len=0 TSval=3834123 TSecr=4430455
  347 4.677273322  10.6.15.144 → 192.168.1.16 SSH 1514 Server: Encrypted packet (len=1448)
  348 4.677279931 192.168.1.16 → 10.6.15.144  TCP 66 59298 → 22 [ACK] Seq=2097 Ack=235745 Win=3666 Len=0 TSval=3834123 TSecr=4430455
  349 4.687937252  10.6.15.144 → 192.168.1.16 SSH 1514 Server: Encrypted packet (len=1448)
  350 4.687954410 192.168.1.16 → 10.6.15.144  TCP 66 59298 → 22 [ACK] Seq=2097 Ack=237193 Win=3666 Len=0 TSval=3834125 TSecr=4430457
  351 4.688087391  10.6.15.144 → 192.168.1.16 SSH 1514 Server: Encrypted packet (len=1448)
  352 4.688096615 192.168.1.16 → 10.6.15.144  TCP 66 59298 → 22 [ACK] Seq=2097 Ack=238641 Win=3666 Len=0 TSval=3834125 TSecr=4430457
  353 4.689429339 192.168.1.16 → 10.6.15.144  SSH 134 Client: Encrypted packet (len=68)
