    1 0.000000000 fe80::60bd:1940:a0d8:49f9 → fe80::60bd:1940:a0d8:49f9 LLMNR 123 Standard query response 0x61bf ANY theenterprise AAAA fe80::60bd:1940:a0d8:49f9
    2 0.000018901 192.168.1.16 → 192.168.1.16 LLMNR 91 Standard query response 0x8c09 ANY theenterprise A 192.168.1.16
    3 0.019712041 fe80::60bd:1940:a0d8:49f9 → ff02::1:3    LLMNR 95 Standard query 0x61bf ANY theenterprise
    4 0.020485831 192.168.1.16 → 224.0.0.252  LLMNR 75 Standard query 0x8c09 ANY theenterprise
    5 0.143732580 fe80::60bd:1940:a0d8:49f9 → ff02::16     ICMPv6 92 Multicast Listener Report Message v2
    6 0.250013421 fe80::60bd:1940:a0d8:49f9 → fe80::60bd:1940:a0d8:49f9 LLMNR 123 Standard query response 0x61bf ANY theenterprise AAAA fe80::60bd:1940:a0d8:49f9
    7 0.250032473 192.168.1.16 → 192.168.1.16 LLMNR 91 Standard query response 0x8c09 ANY theenterprise A 192.168.1.16
    8 0.267674121 fe80::60bd:1940:a0d8:49f9 → ff02::1:3    LLMNR 95 Standard query 0x61bf ANY theenterprise
    9 0.268435560 192.168.1.16 → 224.0.0.252  LLMNR 75 Standard query 0x8c09 ANY theenterprise
   10 0.296814934  10.6.15.144 → 192.168.1.16 SSH 356 Server: Encrypted packet (len=288)
   11 0.296929239    127.0.0.1 → 127.0.0.1    Socks 99 Unknown
   12 0.296933355    127.0.0.1 → 127.0.0.1    TCP 68 42040 → 1080 [ACK] Seq=1 Ack=32 Win=359 Len=0 TSval=3537201 TSecr=3537201
   13 0.296940165    127.0.0.1 → 127.0.0.1    Socks 99 Unknown
   14 0.296941794    127.0.0.1 → 127.0.0.1    TCP 68 42044 → 1080 [ACK] Seq=1 Ack=32 Win=359 Len=0 TSval=3537201 TSecr=3537201
   15 0.296947106    127.0.0.1 → 127.0.0.1    Socks 99 Unknown
   16 0.296948705    127.0.0.1 → 127.0.0.1    TCP 68 41982 → 1080 [ACK] Seq=1 Ack=32 Win=392 Len=0 TSval=3537201 TSecr=3537201
   17 0.296955971    127.0.0.1 → 127.0.0.1    TCP 68 1080 → 42040 [FIN, ACK] Seq=32 Ack=1 Win=361 Len=0 TSval=3537201 TSecr=3537201
   18 0.296960202    127.0.0.1 → 127.0.0.1    TCP 68 1080 → 42044 [FIN, ACK] Seq=32 Ack=1 Win=361 Len=0 TSval=3537201 TSecr=3537201
   19 0.296964678    127.0.0.1 → 127.0.0.1    TCP 68 1080 → 41982 [FIN, ACK] Seq=32 Ack=1 Win=404 Len=0 TSval=3537201 TSecr=3537201
   20 0.339694636 192.168.1.16 → 10.6.15.144  TCP 68 59298 → 22 [ACK] Seq=97 Ack=289 Win=3666 Len=0 TSval=3537212 TSecr=4133527
   21 0.339681072    127.0.0.1 → 127.0.0.1    TCP 68 41982 → 1080 [ACK] Seq=1 Ack=33 Win=392 Len=0 TSval=3537212 TSecr=3537201
   22 0.339683638    127.0.0.1 → 127.0.0.1    TCP 68 42044 → 1080 [ACK] Seq=1 Ack=33 Win=359 Len=0 TSval=3537212 TSecr=3537201
   23 0.339685354    127.0.0.1 → 127.0.0.1    TCP 68 42040 → 1080 [ACK] Seq=1 Ack=33 Win=359 Len=0 TSval=3537212 TSecr=3537201
   24 0.350302245  10.6.15.144 → 192.168.1.16 SSH 164 Server: Encrypted packet (len=96)
   25 0.350328589 192.168.1.16 → 10.6.15.144  TCP 68 59298 → 22 [ACK] Seq=97 Ack=385 Win=3666 Len=0 TSval=3537214 TSecr=4133540
   26 0.350424087    127.0.0.1 → 127.0.0.1    Socks 99 Unknown
   27 0.350428639    127.0.0.1 → 127.0.0.1    TCP 68 42048 → 1080 [ACK] Seq=1 Ack=32 Win=359 Len=0 TSval=3537214 TSecr=3537214
   28 0.350441089    127.0.0.1 → 127.0.0.1    TCP 68 1080 → 42048 [FIN, ACK] Seq=32 Ack=1 Win=361 Len=0 TSval=3537214 TSecr=3537214
   29 0.391684512    127.0.0.1 → 127.0.0.1    TCP 68 42048 → 1080 [ACK] Seq=1 Ack=33 Win=359 Len=0 TSval=3537225 TSecr=3537214
   30 0.451681700 192.168.1.16 → 10.6.15.144  TCP 164 [TCP Retransmission] 59298 → 22 [PSH, ACK] Seq=1 Ack=385 Win=3666 Len=96 TSval=3537240 TSecr=4133540
   31 0.794817971    127.0.0.1 → 127.0.0.1    Socks 110 Unknown
   32 0.794829627    127.0.0.1 → 127.0.0.1    TCP 68 1080 → 40950 [ACK] Seq=1 Ack=43 Win=434 Len=0 TSval=3537325 TSecr=3537325
   33 0.794858767    127.0.0.1 → 127.0.0.1    Socks 110 Unknown
   34 0.794863621    127.0.0.1 → 127.0.0.1    TCP 68 1080 → 40950 [ACK] Seq=1 Ack=85 Win=434 Len=0 TSval=3537325 TSecr=3537325
   35 1.282596708 192.168.1.16 → 239.255.255.250 SSDP 215 M-SEARCH * HTTP/1.1 
   36 1.284294452    127.0.0.1 → 127.0.0.1    Socks 165 Unknown
   37 1.284308112    127.0.0.1 → 127.0.0.1    TCP 68 1080 → 40872 [ACK] Seq=1 Ack=98 Win=372 Len=0 TSval=3537448 TSecr=3537448
   38 1.284326218    127.0.0.1 → 127.0.0.1    Socks 114 Unknown
   39 1.284328831    127.0.0.1 → 127.0.0.1    TCP 68 1080 → 40872 [ACK] Seq=1 Ack=144 Win=372 Len=0 TSval=3537448 TSecr=3537448
   40 1.286603300  10.6.15.144 → 192.168.1.16 TCP 68 22 → 59298 [ACK] Seq=385 Ack=97 Win=1452 Len=0 TSval=4133568 TSecr=3537240
   41 1.286614388 192.168.1.16 → 10.6.15.144  SSH 1516 Client: Encrypted packet (len=1448)
   42 1.286623805 192.168.1.16 → 10.6.15.144  SSH 1296 Client: Encrypted packet (len=1228)
   43 1.286629452  10.6.15.144 → 192.168.1.16 SSH 104 Server: Encrypted packet (len=36)
   44 1.286636279 192.168.1.16 → 10.6.15.144  TCP 68 59298 → 22 [ACK] Seq=2773 Ack=421 Win=3666 Len=0 TSval=3537448 TSecr=4133577
   45 1.286641050 10.22.18.209 → 224.0.0.252  LLMNR 66 Standard query 0xfbce A wpad
   46 1.286701884    127.0.0.1 → 127.0.0.1    Socks 78 Version: 5 Connect to server request Command Request - Connect
   47 1.286807323    127.0.0.1 → 127.0.0.1    Socks 585 Version: 5 Connect to server response
   48 1.286815919    127.0.0.1 → 127.0.0.1    TCP 68 1080 → 42052 [ACK] Seq=11 Ack=518 Win=350 Len=0 TSval=3537448 TSecr=3537448
   49 1.288054899 10.22.18.209 → 224.0.0.252  LLMNR 66 Standard query 0xfbce A wpad
   50 1.288085519  10.6.15.144 → 192.168.1.16 SSH 140 Server: Encrypted packet (len=72)
   51 1.288100162 192.168.1.16 → 10.6.15.144  TCP 68 59298 → 22 [ACK] Seq=2773 Ack=493 Win=3666 Len=0 TSval=3537449 TSecr=4133635
   52 1.288120015  10.6.15.144 → 192.168.1.16 SSH 140 Server: [TCP Spurious Retransmission] , Encrypted packet (len=72)
   53 1.288129454 192.168.1.16 → 10.6.15.144  TCP 80 [TCP Dup ACK 51#1] 59298 → 22 [ACK] Seq=2773 Ack=493 Win=3666 Len=0 TSval=3537449 TSecr=4133671 SLE=421 SRE=493
   54 1.288195499    127.0.0.1 → 127.0.0.1    TCP 68 1080 → 41990 [FIN, ACK] Seq=1 Ack=1 Win=367 Len=0 TSval=3537449 TSecr=3536831
   55 1.288203662    127.0.0.1 → 127.0.0.1    TCP 68 41990 → 1080 [ACK] Seq=1 Ack=2 Win=359 Len=0 TSval=3537449 TSecr=3537449
   56 1.297874470  10.6.15.144 → 192.168.1.16 TCP 68 22 → 59298 [ACK] Seq=493 Ack=2773 Win=1452 Len=0 TSval=4133777 TSecr=3537448
   57 1.297892879 192.168.1.16 → 10.6.15.144  SSH 508 Client: Encrypted packet (len=440)
   58 1.298385919  10.6.15.144 → 192.168.1.16 SSH 140 Server: Encrypted packet (len=72)
   59 1.301013398  10.6.15.144 → 192.168.1.16 SSH 144 Server: Encrypted packet (len=76)
   60 1.301088114 192.168.1.16 → 10.6.15.144  TCP 68 59298 → 22 [ACK] Seq=3213 Ack=641 Win=3666 Len=0 TSval=3537452 TSecr=4133777
   61 1.301137600    127.0.0.1 → 127.0.0.1    Socks 114 Unknown
   62 1.343638710    127.0.0.1 → 127.0.0.1    TCP 68 40872 → 1080 [ACK] Seq=144 Ack=47 Win=412 Len=0 TSval=3537463 TSecr=3537452
   63 1.343958204  10.6.15.144 → 192.168.1.16 SSH 336 Server: Encrypted packet (len=268)
   64 1.343984787  10.6.15.144 → 192.168.1.16 SSH 324 Server: Encrypted packet (len=256)
   65 1.344045127 192.168.1.16 → 10.6.15.144  TCP 68 59298 → 22 [ACK] Seq=3213 Ack=1165 Win=3666 Len=0 TSval=3537463 TSecr=4133788
   66 1.344099080    127.0.0.1 → 127.0.0.1    Socks 219 Version: 5
   67 1.344111186    127.0.0.1 → 127.0.0.1    Socks 353 Unknown
   68 1.344113168    127.0.0.1 → 127.0.0.1    TCP 68 40872 → 1080 [ACK] Seq=144 Ack=332 Win=421 Len=0 TSval=3537463 TSecr=3537463
   69 1.344379239    127.0.0.1 → 127.0.0.1    Socks 284 Version: 5
   70 1.344389065    127.0.0.1 → 127.0.0.1    TCP 68 1080 → 42052 [ACK] Seq=162 Ack=734 Win=359 Len=0 TSval=3537463 TSecr=3537463
   71 1.344505912 192.168.1.16 → 10.6.15.144  SSH 304 Client: Encrypted packet (len=236)
   72 1.345704993    127.0.0.1 → 127.0.0.1    Socks 283 Version: 5
   73 1.345709944    127.0.0.1 → 127.0.0.1    TCP 68 1080 → 42052 [ACK] Seq=162 Ack=949 Win=367 Len=0 TSval=3537463 TSecr=3537463
   74 1.347354095 192.168.1.16 → 10.6.15.144  SSH 320 Client: Encrypted packet (len=252)
   75 1.350494703  10.6.15.144 → 192.168.1.16 SSH 208 Server: Encrypted packet (len=140)
   76 1.350604884    127.0.0.1 → 127.0.0.1    Socks 191 Unknown
   77 1.350608753    127.0.0.1 → 127.0.0.1    TCP 68 40872 → 1080 [ACK] Seq=144 Ack=455 Win=421 Len=0 TSval=3537464 TSecr=3537464
   78 1.351002939    127.0.0.1 → 127.0.0.1    Socks 114 Unknown
   79 1.351096050 192.168.1.16 → 10.6.15.144  SSH 144 Client: Encrypted packet (len=76)
   80 1.359820788  10.6.15.144 → 192.168.1.16 TCP 68 22 → 59298 [ACK] Seq=1305 Ack=3701 Win=1452 Len=0 TSval=4133793 TSecr=3537463
   81 1.391681403    127.0.0.1 → 127.0.0.1    TCP 68 1080 → 40872 [ACK] Seq=455 Ack=190 Win=372 Len=0 TSval=3537475 TSecr=3537464
   82 1.393204574  10.6.15.144 → 192.168.1.16 SSH 128 Server: Encrypted packet (len=60)
   83 1.393309374    127.0.0.1 → 127.0.0.1    Socks 98 Version: 5
   84 1.395782201  10.6.15.144 → 192.168.1.16 SSH 216 Server: Encrypted packet (len=148)
   85 1.395856355 192.168.1.16 → 10.6.15.144  TCP 68 59298 → 22 [ACK] Seq=3777 Ack=1513 Win=3666 Len=0 TSval=3537476 TSecr=4133801
   86 1.395899686    127.0.0.1 → 127.0.0.1    Socks 186 Version: 5
   87 1.395947312    127.0.0.1 → 127.0.0.1    TCP 68 42052 → 1080 [ACK] Seq=949 Ack=310 Win=350 Len=0 TSval=3537476 TSecr=3537475
   88 1.397666143  10.6.15.144 → 192.168.1.16 SSH 240 Server: Encrypted packet (len=172)
   89 1.397775236    127.0.0.1 → 127.0.0.1    Socks 202 Version: 5
   90 1.439687280 192.168.1.16 → 10.6.15.144  TCP 68 59298 → 22 [ACK] Seq=3777 Ack=1685 Win=3666 Len=0 TSval=3537487 TSecr=4133802
   91 1.439681500    127.0.0.1 → 127.0.0.1    TCP 68 42052 → 1080 [ACK] Seq=949 Ack=444 Win=359 Len=0 TSval=3537487 TSecr=3537476
   92 1.535188159  10.6.15.144 → 192.168.1.16 SSH 104 Server: Encrypted packet (len=36)
   93 1.535212649 192.168.1.16 → 10.6.15.144  TCP 68 59298 → 22 [ACK] Seq=3777 Ack=1721 Win=3666 Len=0 TSval=3537510 TSecr=4133836
   94 1.535313598    127.0.0.1 → 127.0.0.1    Socks 78 Version: 5 Connect to server request Command Request - Connect
   95 1.535461255    127.0.0.1 → 127.0.0.1    Socks 585 Version: 5 Connect to server response
   96 1.535471552    127.0.0.1 → 127.0.0.1    TCP 68 1080 → 42082 [ACK] Seq=11 Ack=518 Win=350 Len=0 TSval=3537510 TSecr=3537510
   97 1.535602909 192.168.1.16 → 10.6.15.144  SSH 392 Client: Encrypted packet (len=324)
   98 1.543000440  10.6.15.144 → 192.168.1.16 SSH 104 Server: Encrypted packet (len=36)
   99 1.543097981    127.0.0.1 → 127.0.0.1    Socks 78 Version: 5 Connect to server request Command Request - Connect
  100 1.543226505    127.0.0.1 → 127.0.0.1    Socks 585 Version: 5 Connect to server response
  101 1.543235672    127.0.0.1 → 127.0.0.1    TCP 68 1080 → 42076 [ACK] Seq=11 Ack=518 Win=350 Len=0 TSval=3537512 TSecr=3537512
  102 1.543358271 192.168.1.16 → 10.6.15.144  SSH 384 Client: Encrypted packet (len=316)
  103 1.544590681  10.6.15.144 → 192.168.1.16 SSH 104 Server: Encrypted packet (len=36)
  104 1.544641412    127.0.0.1 → 127.0.0.1    Socks 78 Version: 5 Connect to server request Command Request - Connect
  105 1.544720251    127.0.0.1 → 127.0.0.1    Socks 585 Version: 5 Connect to server response
  106 1.544727617    127.0.0.1 → 127.0.0.1    TCP 68 1080 → 42080 [ACK] Seq=11 Ack=518 Win=350 Len=0 TSval=3537513 TSecr=3537513
  107 1.544831530 192.168.1.16 → 10.6.15.144  SSH 392 Client: Encrypted packet (len=324)
  108 1.553677738  10.6.15.144 → 192.168.1.16 TCP 68 22 → 59298 [ACK] Seq=1793 Ack=4417 Win=1452 Len=0 TSval=4133841 TSecr=3537510
  109 1.572070811  10.6.15.144 → 192.168.1.16 SSH 104 Server: Encrypted packet (len=36)
  110 1.572183486    127.0.0.1 → 127.0.0.1    Socks 78 Version: 5 Connect to server request Command Request - Connect
  111 1.572315550    127.0.0.1 → 127.0.0.1    Socks 585 Version: 5 Connect to server response
  112 1.572324020    127.0.0.1 → 127.0.0.1    TCP 68 1080 → 42074 [ACK] Seq=11 Ack=518 Win=350 Len=0 TSval=3537520 TSecr=3537520
  113 1.572400116 192.168.1.16 → 10.6.15.144  SSH 152 Client: Encrypted packet (len=84)
  114 1.580105597  10.6.15.144 → 192.168.1.16 SSH 1516 Server: Encrypted packet (len=1448)
  115 1.580277819  10.6.15.144 → 192.168.1.16 SSH 1516 Server: Encrypted packet (len=1448)
  116 1.580286712 192.168.1.16 → 10.6.15.144  TCP 68 59298 → 22 [ACK] Seq=4825 Ack=4725 Win=3666 Len=0 TSval=3537522 TSecr=4133847
  117 1.581557140  10.6.15.144 → 192.168.1.16 SSH 1408 Server: Encrypted packet (len=1340)
  118 1.581693762    127.0.0.1 → 127.0.0.1    Socks 4262 Unknown
  119 1.591069424  10.6.15.144 → 192.168.1.16 SSH 1516 Server: Encrypted packet (len=1448)
  120 1.591089440 192.168.1.16 → 10.6.15.144  TCP 68 59298 → 22 [ACK] Seq=4825 Ack=7513 Win=3666 Len=0 TSval=3537524 TSecr=4133847
  121 1.591273527  10.6.15.144 → 192.168.1.16 SSH 1516 Server: Encrypted packet (len=1448)
  122 1.602371847  10.6.15.144 → 192.168.1.16 SSH 1516 Server: Encrypted packet (len=1448)
  123 1.602388207 192.168.1.16 → 10.6.15.144  TCP 68 59298 → 22 [ACK] Seq=4825 Ack=10409 Win=3666 Len=0 TSval=3537527 TSecr=4133850
  124 1.613606717  10.6.15.144 → 192.168.1.16 SSH 1516 Server: [TCP Previous segment not captured] , Encrypted packet (len=1448)
  125 1.613623042 192.168.1.16 → 10.6.15.144  TCP 80 [TCP Dup ACK 123#1] 59298 → 22 [ACK] Seq=4825 Ack=10409 Win=3666 Len=0 TSval=3537530 TSecr=4133850 SLE=11857 SRE=13305
  126 1.613815281  10.6.15.144 → 192.168.1.16 SSH 1516 Server: Encrypted packet (len=1448)
  127 1.613823125 192.168.1.16 → 10.6.15.144  TCP 80 [TCP Dup ACK 123#2] 59298 → 22 [ACK] Seq=4825 Ack=10409 Win=3666 Len=0 TSval=3537530 TSecr=4133850 SLE=11857 SRE=14753
  128 1.613966276  10.6.15.144 → 192.168.1.16 SSH 1252 Server: Encrypted packet (len=1184)
  129 1.613974388 192.168.1.16 → 10.6.15.144  TCP 80 [TCP Dup ACK 123#3] 59298 → 22 [ACK] Seq=4825 Ack=10409 Win=3666 Len=0 TSval=3537530 TSecr=4133850 SLE=11857 SRE=15937
  130 1.621816945  10.6.15.144 → 192.168.1.16 SSH 1516 Server: [TCP Fast Retransmission] , Encrypted packet (len=1448)
  131 1.621828128 192.168.1.16 → 10.6.15.144  TCP 68 59298 → 22 [ACK] Seq=4825 Ack=15937 Win=3666 Len=0 TSval=3537532 TSecr=4133859
  132 1.621968572    127.0.0.1 → 127.0.0.1    Socks 78 Version: 5 Connect to server request Command Request - Connect
  133 1.621984237    127.0.0.1 → 127.0.0.1    Socks 9854 Unknown
  134 1.621989045    127.0.0.1 → 127.0.0.1    TCP 68 41968 → 1080 [ACK] Seq=1 Ack=13981 Win=3420 Len=0 TSval=3537532 TSecr=3537522
  135 1.622090084    127.0.0.1 → 127.0.0.1    Socks 585 Version: 5 Connect to server response
  136 1.622098509    127.0.0.1 → 127.0.0.1    TCP 68 1080 → 42078 [ACK] Seq=11 Ack=518 Win=350 Len=0 TSval=3537532 TSecr=3537532
  137 1.622181519 192.168.1.16 → 10.6.15.144  SSH 160 Client: Encrypted packet (len=92)
  138 1.672077930  10.6.15.144 → 192.168.1.16 TCP 68 22 → 59298 [ACK] Seq=15937 Ack=4917 Win=1452 Len=0 TSval=4133871 TSecr=3537532
  139 1.782733552  10.6.15.144 → 192.168.1.16 SSH 248 Server: Encrypted packet (len=180)
  140 1.782849469    127.0.0.1 → 127.0.0.1    Socks 220 Version: 5
  141 1.782989014    127.0.0.1 → 127.0.0.1    Socks 119 Version: 5
  142 1.783004355    127.0.0.1 → 127.0.0.1    TCP 68 1080 → 42082 [ACK] Seq=163 Ack=569 Win=350 Len=0 TSval=3537572 TSecr=3537572
  143 1.795710116 192.168.1.16 → 10.6.15.144  SSH 136 Client: Encrypted packet (len=68)
  144 1.805710627  10.6.15.144 → 192.168.1.16 TCP 68 22 → 59298 [ACK] Seq=16117 Ack=4985 Win=1452 Len=0 TSval=4133904 TSecr=3537572
  145 1.807590021  10.6.15.144 → 192.168.1.16 SSH 216 Server: Encrypted packet (len=148)
  146 1.807700644    127.0.0.1 → 127.0.0.1    Socks 205 Version: 5
  147 1.807809173    127.0.0.1 → 127.0.0.1    Socks 119 Version: 5
  148 1.807818881    127.0.0.1 → 127.0.0.1    TCP 68 1080 → 42076 [ACK] Seq=148 Ack=569 Win=350 Len=0 TSval=3537579 TSecr=3537579
  149 1.807892480 192.168.1.16 → 10.6.15.144  SSH 136 Client: Encrypted packet (len=68)
  150 1.808329753  10.6.15.144 → 192.168.1.16 SSH 216 Server: Encrypted packet (len=148)
  151 1.808378930    127.0.0.1 → 127.0.0.1    Socks 205 Version: 5
  152 1.808902541    127.0.0.1 → 127.0.0.1    Socks 119 Version: 5
  153 1.808909445    127.0.0.1 → 127.0.0.1    TCP 68 1080 → 42080 [ACK] Seq=148 Ack=569 Win=350 Len=0 TSval=3537579 TSecr=3537579
  154 1.808973255 192.168.1.16 → 10.6.15.144  SSH 136 Client: Encrypted packet (len=68)
  155 1.820888480  10.6.15.144 → 192.168.1.16 TCP 68 22 → 59298 [ACK] Seq=16413 Ack=5121 Win=1452 Len=0 TSval=4133907 TSecr=3537579
  156 1.825764694  10.6.15.144 → 192.168.1.16 SSH 1516 Server: Encrypted packet (len=1448)
  157 1.825921251  10.6.15.144 → 192.168.1.16 SSH 1516 Server: Encrypted packet (len=1448)
  158 1.825932155 192.168.1.16 → 10.6.15.144  TCP 68 59298 → 22 [ACK] Seq=5121 Ack=19309 Win=3666 Len=0 TSval=3537583 TSecr=4133909
  159 1.826652452  10.6.15.144 → 192.168.1.16 SSH 1408 Server: Encrypted packet (len=1340)
  160 1.826729949    127.0.0.1 → 127.0.0.1    Socks 4262 Unknown
  161 1.836616868  10.6.15.144 → 192.168.1.16 SSH 1516 Server: Encrypted packet (len=1448)
  162 1.836632391 192.168.1.16 → 10.6.15.144  TCP 68 59298 → 22 [ACK] Seq=5121 Ack=22097 Win=3666 Len=0 TSval=3537586 TSecr=4133909
  163 1.836798148  10.6.15.144 → 192.168.1.16 SSH 1516 Server: Encrypted packet (len=1448)
  164 1.847181590  10.6.15.144 → 192.168.1.16 SSH 1516 Server: Encrypted packet (len=1448)
  165 1.847203297 192.168.1.16 → 10.6.15.144  TCP 68 59298 → 22 [ACK] Seq=5121 Ack=24993 Win=3666 Len=0 TSval=3537588 TSecr=4133912
  166 1.847361831  10.6.15.144 → 192.168.1.16 SSH 1516 Server: Encrypted packet (len=1448)
  167 1.857195493    127.0.0.1 → 127.0.0.1    TCP 68 42048 → 1080 [RST, ACK] Seq=1 Ack=33 Win=359 Len=0 TSval=3537591 TSecr=3537214
  168 1.857297206    127.0.0.1 → 127.0.0.1    TCP 68 41964 → 1080 [FIN, ACK] Seq=1 Ack=1 Win=350 Len=0 TSval=3537591 TSecr=3534518
  169 1.857310434 192.168.1.16 → 10.6.15.144  SSH 140 Client: Encrypted packet (len=72)
  170 1.857350732    127.0.0.1 → 127.0.0.1    TCP 68 41986 → 1080 [FIN, ACK] Seq=1 Ack=1 Win=350 Len=0 TSval=3537591 TSecr=3534522
  171 1.857389804    127.0.0.1 → 127.0.0.1    TCP 68 41984 → 1080 [FIN, ACK] Seq=1 Ack=1 Win=350 Len=0 TSval=3537591 TSecr=3534528
  172 1.857427600    127.0.0.1 → 127.0.0.1    TCP 68 41988 → 1080 [FIN, ACK] Seq=1 Ack=1 Win=350 Len=0 TSval=3537591 TSecr=3534528
  173 1.857476113    127.0.0.1 → 127.0.0.1    TCP 68 41980 → 1080 [FIN, ACK] Seq=1 Ack=1 Win=1415 Len=0 TSval=3537591 TSecr=3534878
  174 1.857511942  10.6.15.144 → 192.168.1.16 SSH 1516 Server: Encrypted packet (len=1448)
  175 1.857512706    127.0.0.1 → 127.0.0.1    TCP 68 41976 → 1080 [FIN, ACK] Seq=1 Ack=1 Win=1415 Len=0 TSval=3537591 TSecr=3534881
  176 1.857549101    127.0.0.1 → 127.0.0.1    TCP 68 41978 → 1080 [FIN, ACK] Seq=1 Ack=1 Win=1415 Len=0 TSval=3537591 TSecr=3534881
  177 1.857588775    127.0.0.1 → 127.0.0.1    TCP 68 41982 → 1080 [RST, ACK] Seq=1 Ack=33 Win=392 Len=0 TSval=3537591 TSecr=3537201
  178 1.857630787    127.0.0.1 → 127.0.0.1    TCP 68 42040 → 1080 [RST, ACK] Seq=1 Ack=33 Win=359 Len=0 TSval=3537591 TSecr=3537201
  179 1.857669253    127.0.0.1 → 127.0.0.1    TCP 68 42044 → 1080 [RST, ACK] Seq=1 Ack=33 Win=359 Len=0 TSval=3537591 TSecr=3537201
  180 1.857696420  10.6.15.144 → 192.168.1.16 SSH 1516 Server: Encrypted packet (len=1448)
  181 1.857702800 192.168.1.16 → 10.6.15.144  TCP 68 59298 → 22 [ACK] Seq=5193 Ack=29337 Win=3666 Len=0 TSval=3537591 TSecr=4133917
  182 1.857761417    127.0.0.1 → 127.0.0.1    TCP 76 42124 → 1080 [SYN] Seq=0 Win=43690 Len=0 MSS=65495 SACK_PERM=1 TSval=3537591 TSecr=0 WS=128
  183 1.857767519    127.0.0.1 → 127.0.0.1    TCP 76 1080 → 42124 [SYN, ACK] Seq=0 Ack=1 Win=43690 Len=0 MSS=65495 SACK_PERM=1 TSval=3537591 TSecr=3537591 WS=128
  184 1.857774439    127.0.0.1 → 127.0.0.1    TCP 68 42124 → 1080 [ACK] Seq=1 Ack=1 Win=43776 Len=0 TSval=3537591 TSecr=3537591
  185 1.857885912    127.0.0.1 → 127.0.0.1    Socks 71 Version: 5 Connect to server request
  186 1.857891067    127.0.0.1 → 127.0.0.1    TCP 68 1080 → 42124 [ACK] Seq=1 Ack=4 Win=43776 Len=0 TSval=3537591 TSecr=3537591
  187 1.857920216    127.0.0.1 → 127.0.0.1    Socks 70 Version: 5 Connect to server response
  188 1.857923641    127.0.0.1 → 127.0.0.1    TCP 68 42124 → 1080 [ACK] Seq=4 Ack=3 Win=43776 Len=0 TSval=3537591 TSecr=3537591
  189 1.857988265 192.168.1.16 → 10.6.15.144  SSH 536 Client: Encrypted packet (len=468)
  190 1.859114420    127.0.0.1 → 127.0.0.1    Socks 85 Version: 5 Command Request - Connect
  191 1.859551890    127.0.0.1 → 127.0.0.1    Socks 402 Unknown
  192 1.859560997    127.0.0.1 → 127.0.0.1    TCP 68 1080 → 40598 [ACK] Seq=1 Ack=335 Win=3637 Len=0 TSval=3537591 TSecr=3537591
  193 1.859584711    127.0.0.1 → 127.0.0.1    Socks 344 Unknown
  194 1.859587098    127.0.0.1 → 127.0.0.1    TCP 68 1080 → 40598 [ACK] Seq=1 Ack=611 Win=3637 Len=0 TSval=3537591 TSecr=3537591
  195 1.859990481 192.168.1.16 → 10.6.15.144  SSH 808 Client: Encrypted packet (len=740)
  196 1.867633155    127.0.0.1 → 127.0.0.1    TCP 68 41968 → 1080 [ACK] Seq=1 Ack=18175 Win=3637 Len=0 TSval=3537594 TSecr=3537583
  197 1.868431193  10.6.15.144 → 192.168.1.16 SSH 1516 Server: Encrypted packet (len=1448)
  198 1.868612270  10.6.15.144 → 192.168.1.16 SSH 1516 Server: Encrypted packet (len=1448)
  199 1.868625784 192.168.1.16 → 10.6.15.144  TCP 68 59298 → 22 [ACK] Seq=6401 Ack=32233 Win=3666 Len=0 TSval=3537594 TSecr=4133919
  200 1.868677032    127.0.0.1 → 127.0.0.1    Socks 9854 Unknown
  201 1.868687933    127.0.0.1 → 127.0.0.1    TCP 68 41968 → 1080 [ACK] Seq=1 Ack=27961 Win=3637 Len=0 TSval=3537594 TSecr=3537594
  202 1.869212926  10.6.15.144 → 192.168.1.16 SSH 1516 Server: Encrypted packet (len=1448)
  203 1.869400498  10.6.15.144 → 192.168.1.16 SSH 1516 Server: Encrypted packet (len=1448)
  204 1.869408934 192.168.1.16 → 10.6.15.144  TCP 68 59298 → 22 [ACK] Seq=6401 Ack=35129 Win=3666 Len=0 TSval=3537594 TSecr=4133919
  205 1.871152409  10.6.15.144 → 192.168.1.16 TCP 68 22 → 59298 [ACK] Seq=35129 Ack=6401 Win=1452 Len=0 TSval=4133920 TSecr=3537591
  206 1.879051216  10.6.15.144 → 192.168.1.16 SSH 1516 Server: Encrypted packet (len=1448)
  207 1.879231124  10.6.15.144 → 192.168.1.16 SSH 1516 Server: Encrypted packet (len=1448)
  208 1.879240515 192.168.1.16 → 10.6.15.144  TCP 68 59298 → 22 [ACK] Seq=6401 Ack=38025 Win=3666 Len=0 TSval=3537596 TSecr=4133922
  209 1.880718858  10.6.15.144 → 192.168.1.16 SSH 1516 Server: Encrypted packet (len=1448)
  210 1.880909148  10.6.15.144 → 192.168.1.16 SSH 1516 Server: Encrypted packet (len=1448)
  211 1.880919192 192.168.1.16 → 10.6.15.144  TCP 68 59298 → 22 [ACK] Seq=6401 Ack=40921 Win=3666 Len=0 TSval=3537597 TSecr=4133922
  212 1.890165383  10.6.15.144 → 192.168.1.16 SSH 1516 Server: Encrypted packet (len=1448)
  213 1.890344890  10.6.15.144 → 192.168.1.16 SSH 1516 Server: Encrypted packet (len=1448)
  214 1.890356889 192.168.1.16 → 10.6.15.144  TCP 68 59298 → 22 [ACK] Seq=6401 Ack=43817 Win=3666 Len=0 TSval=3537599 TSecr=4133925
  215 1.892228630  10.6.15.144 → 192.168.1.16 SSH 1124 Server: Encrypted packet (len=1056)
  216 1.892540362    127.0.0.1 → 127.0.0.1    Socks 205 Version: 5
  217 1.892555910    127.0.0.1 → 127.0.0.1    Socks 205 Version: 5
  218 1.892565200    127.0.0.1 → 127.0.0.1    Socks 14048 Unknown
  219 1.892569623    127.0.0.1 → 127.0.0.1    TCP 68 41968 → 1080 [ACK] Seq=1 Ack=41941 Win=3637 Len=0 TSval=3537600 TSecr=3537600
  220 1.892677289    127.0.0.1 → 127.0.0.1    Socks 119 Version: 5
  221 1.892685407    127.0.0.1 → 127.0.0.1    TCP 68 1080 → 42074 [ACK] Seq=148 Ack=569 Win=350 Len=0 TSval=3537600 TSecr=3537600
  222 1.892839020 192.168.1.16 → 10.6.15.144  SSH 136 Client: Encrypted packet (len=68)
  223 1.893709964    127.0.0.1 → 127.0.0.1    Socks 119 Version: 5
  224 1.893717074    127.0.0.1 → 127.0.0.1    TCP 68 1080 → 42078 [ACK] Seq=148 Ack=569 Win=350 Len=0 TSval=3537600 TSecr=3537600
  225 1.893778434 192.168.1.16 → 10.6.15.144  SSH 136 Client: Encrypted packet (len=68)
  226 1.899644729    127.0.0.1 → 127.0.0.1    TCP 68 1080 → 42124 [ACK] Seq=3 Ack=21 Win=43776 Len=0 TSval=3537602 TSecr=3537591
  227 1.899650507    127.0.0.1 → 127.0.0.1    TCP 68 1080 → 41978 [ACK] Seq=1 Ack=2 Win=350 Len=0 TSval=3537602 TSecr=3537591
  228 1.899652798    127.0.0.1 → 127.0.0.1    TCP 68 1080 → 41976 [ACK] Seq=1 Ack=2 Win=350 Len=0 TSval=3537602 TSecr=3537591
  229 1.899653930    127.0.0.1 → 127.0.0.1    TCP 68 1080 → 41980 [ACK] Seq=1 Ack=2 Win=350 Len=0 TSval=3537602 TSecr=3537591
  230 1.899655663    127.0.0.1 → 127.0.0.1    TCP 68 1080 → 41988 [ACK] Seq=1 Ack=2 Win=350 Len=0 TSval=3537602 TSecr=3537591
  231 1.899657041    127.0.0.1 → 127.0.0.1    TCP 68 1080 → 41984 [ACK] Seq=1 Ack=2 Win=350 Len=0 TSval=3537602 TSecr=3537591
  232 1.899658403    127.0.0.1 → 127.0.0.1    TCP 68 1080 → 41986 [ACK] Seq=1 Ack=2 Win=350 Len=0 TSval=3537602 TSecr=3537591
  233 1.899660226    127.0.0.1 → 127.0.0.1    TCP 68 1080 → 41964 [ACK] Seq=1 Ack=2 Win=350 Len=0 TSval=3537602 TSecr=3537591
  234 1.903284041  10.6.15.144 → 192.168.1.16 TCP 68 22 → 59298 [ACK] Seq=44873 Ack=6537 Win=1452 Len=0 TSval=4133928 TSecr=3537600
  235 1.963012429  10.6.15.144 → 192.168.1.16 SSH 208 Server: Encrypted packet (len=140)
  236 1.963096886    127.0.0.1 → 127.0.0.1    Socks 179 Unknown
  237 1.963677488    127.0.0.1 → 127.0.0.1    Socks 114 Unknown
  238 1.963690113    127.0.0.1 → 127.0.0.1    TCP 68 1080 → 40598 [ACK] Seq=112 Ack=657 Win=3637 Len=0 TSval=3537618 TSecr=3537618
  239 1.963772512 192.168.1.16 → 10.6.15.144  SSH 136 Client: Encrypted packet (len=68)
  240 2.011639555  10.6.15.144 → 192.168.1.16 TCP 68 22 → 59298 [ACK] Seq=45013 Ack=6605 Win=1452 Len=0 TSval=4133956 TSecr=3537618
  241 2.070199581  10.6.15.144 → 192.168.1.16 SSH 1516 Server: Encrypted packet (len=1448)
  242 2.073344549  10.6.15.144 → 192.168.1.16 SSH 1456 Server: Encrypted packet (len=1388)
  243 2.073360079 192.168.1.16 → 10.6.15.144  TCP 68 59298 → 22 [ACK] Seq=6605 Ack=47849 Win=3666 Len=0 TSval=3537645 TSecr=4133970
  244 2.073466035    127.0.0.1 → 127.0.0.1    Socks 2864 Unknown
  245 2.073470606    127.0.0.1 → 127.0.0.1    TCP 68 41968 → 1080 [ACK] Seq=1 Ack=44737 Win=3637 Len=0 TSval=3537645 TSecr=3537645
  246 2.073533084  10.6.15.144 → 192.168.1.16 SSH 1516 Server: Encrypted packet (len=1448)
  247 2.073722324  10.6.15.144 → 192.168.1.16 SSH 1516 Server: Encrypted packet (len=1448)
  248 2.073726002 192.168.1.16 → 10.6.15.144  TCP 68 59298 → 22 [ACK] Seq=6605 Ack=50745 Win=3666 Len=0 TSval=3537645 TSecr=4133970
  249 2.085516262  10.6.15.144 → 192.168.1.16 SSH 1516 Server: Encrypted packet (len=1448)
  250 2.085618778    127.0.0.1 → 127.0.0.1    Socks 4262 Unknown
  251 2.085623366    127.0.0.1 → 127.0.0.1    TCP 68 41968 → 1080 [ACK] Seq=1 Ack=48931 Win=3637 Len=0 TSval=3537648 TSecr=3537648
  252 2.085697759  10.6.15.144 → 192.168.1.16 SSH 1516 Server: Encrypted packet (len=1448)
  253 2.085705211 192.168.1.16 → 10.6.15.144  TCP 68 59298 → 22 [ACK] Seq=6605 Ack=53641 Win=3666 Len=0 TSval=3537648 TSecr=4133973
  254 2.085769834    127.0.0.1 → 127.0.0.1    Socks 1466 Unknown
  255 2.085773477    127.0.0.1 → 127.0.0.1    TCP 68 41968 → 1080 [ACK] Seq=1 Ack=50329 Win=3637 Len=0 TSval=3537648 TSecr=3537648
  256 2.085888666  10.6.15.144 → 192.168.1.16 SSH 1516 Server: Encrypted packet (len=1448)
  257 2.086078403  10.6.15.144 → 192.168.1.16 SSH 1516 Server: Encrypted packet (len=1448)
  258 2.086083681 192.168.1.16 → 10.6.15.144  TCP 68 59298 → 22 [ACK] Seq=6605 Ack=56537 Win=3666 Len=0 TSval=3537648 TSecr=4133973
  259 2.086150051    127.0.0.1 → 127.0.0.1    Socks 2864 Unknown
  260 2.086153543    127.0.0.1 → 127.0.0.1    TCP 68 41968 → 1080 [ACK] Seq=1 Ack=53125 Win=3637 Len=0 TSval=3537648 TSecr=3537648
  261 2.096652584  10.6.15.144 → 192.168.1.16 SSH 1516 Server: Encrypted packet (len=1448)
  262 2.096774147    127.0.0.1 → 127.0.0.1    Socks 1466 Unknown
  263 2.096779641    127.0.0.1 → 127.0.0.1    TCP 68 41968 → 1080 [ACK] Seq=1 Ack=54523 Win=3637 Len=0 TSval=3537651 TSecr=3537651
  264 2.096842385  10.6.15.144 → 192.168.1.16 SSH 1516 Server: Encrypted packet (len=1448)
  265 2.096849461 192.168.1.16 → 10.6.15.144  TCP 68 59298 → 22 [ACK] Seq=6605 Ack=59433 Win=3666 Len=0 TSval=3537651 TSecr=4133977
  266 2.097178910  10.6.15.144 → 192.168.1.16 SSH 1516 Server: Encrypted packet (len=1448)
  267 2.097248632    127.0.0.1 → 127.0.0.1    Socks 2864 Unknown
  268 2.097253014    127.0.0.1 → 127.0.0.1    TCP 68 41968 → 1080 [ACK] Seq=1 Ack=57319 Win=3637 Len=0 TSval=3537651 TSecr=3537651
  269 2.097371295  10.6.15.144 → 192.168.1.16 SSH 1516 Server: Encrypted packet (len=1448)
  270 2.097377524 192.168.1.16 → 10.6.15.144  TCP 68 59298 → 22 [ACK] Seq=6605 Ack=62329 Win=3666 Len=0 TSval=3537651 TSecr=4133977
  271 2.104543434    127.0.0.1 → 127.0.0.1    TCP 76 42126 → 1080 [SYN] Seq=0 Win=43690 Len=0 MSS=65495 SACK_PERM=1 TSval=3537653 TSecr=0 WS=128
  272 2.104554128    127.0.0.1 → 127.0.0.1    TCP 76 1080 → 42126 [SYN, ACK] Seq=0 Ack=1 Win=43690 Len=0 MSS=65495 SACK_PERM=1 TSval=3537653 TSecr=3537653 WS=128
  273 2.104563282    127.0.0.1 → 127.0.0.1    TCP 68 42126 → 1080 [ACK] Seq=1 Ack=1 Win=43776 Len=0 TSval=3537653 TSecr=3537653
  274 2.105894351    127.0.0.1 → 127.0.0.1    Socks 71 Version: 5 Connect to server request
  275 2.105906091    127.0.0.1 → 127.0.0.1    TCP 68 1080 → 42126 [ACK] Seq=1 Ack=4 Win=43776 Len=0 TSval=3537653 TSecr=3537653
  276 2.105973505    127.0.0.1 → 127.0.0.1    Socks 70 Version: 5 Connect to server response
  277 2.105979153    127.0.0.1 → 127.0.0.1    TCP 68 42126 → 1080 [ACK] Seq=4 Ack=3 Win=43776 Len=0 TSval=3537653 TSecr=3537653
  278 2.106259652    127.0.0.1 → 127.0.0.1    Socks 85 Version: 5 Command Request - Connect
  279 2.106345467    127.0.0.1 → 127.0.0.1    Socks 537 Unknown
  280 2.106350647    127.0.0.1 → 127.0.0.1    TCP 68 1080 → 41878 [ACK] Seq=1 Ack=470 Win=384 Len=0 TSval=3537653 TSecr=3537653
  281 2.106372089 192.168.1.16 → 10.6.15.144  SSH 104 Client: Encrypted packet (len=36)
  282 2.106578211 192.168.1.16 → 10.6.15.144  SSH 584 Client: Encrypted packet (len=516)
  283 2.106606341    127.0.0.1 → 127.0.0.1    TCP 76 42128 → 1080 [SYN] Seq=0 Win=43690 Len=0 MSS=65495 SACK_PERM=1 TSval=3537653 TSecr=0 WS=128
  284 2.106612598    127.0.0.1 → 127.0.0.1    TCP 76 1080 → 42128 [SYN, ACK] Seq=0 Ack=1 Win=43690 Len=0 MSS=65495 SACK_PERM=1 TSval=3537653 TSecr=3537653 WS=128
  285 2.106618004    127.0.0.1 → 127.0.0.1    TCP 68 42128 → 1080 [ACK] Seq=1 Ack=1 Win=43776 Len=0 TSval=3537653 TSecr=3537653
  286 2.107188900    127.0.0.1 → 127.0.0.1    Socks 71 Version: 5 Connect to server request
  287 2.107194707    127.0.0.1 → 127.0.0.1    TCP 68 1080 → 42128 [ACK] Seq=1 Ack=4 Win=43776 Len=0 TSval=3537653 TSecr=3537653
  288 2.107226462    127.0.0.1 → 127.0.0.1    Socks 70 Version: 5 Connect to server response
  289 2.107230976    127.0.0.1 → 127.0.0.1    TCP 68 42128 → 1080 [ACK] Seq=4 Ack=3 Win=43776 Len=0 TSval=3537653 TSecr=3537653
  290 2.107541550    127.0.0.1 → 127.0.0.1    Socks 91 Version: 5 Command Request - Connect
  291 2.107645557 192.168.1.16 → 10.6.15.144  SSH 112 Client: Encrypted packet (len=44)
  292 2.108178033  10.6.15.144 → 192.168.1.16 SSH 1516 Server: Encrypted packet (len=1448)
  293 2.108273016    127.0.0.1 → 127.0.0.1    Socks 2864 Unknown
  294 2.108279183    127.0.0.1 → 127.0.0.1    TCP 68 41968 → 1080 [ACK] Seq=1 Ack=60115 Win=3637 Len=0 TSval=3537654 TSecr=3537654
  295 2.108355278  10.6.15.144 → 192.168.1.16 SSH 1516 Server: Encrypted packet (len=1448)
  296 2.108363314 192.168.1.16 → 10.6.15.144  TCP 68 59298 → 22 [ACK] Seq=7201 Ack=65225 Win=3666 Len=0 TSval=3537654 TSecr=4133979
  297 2.116455551  10.6.15.144 → 192.168.1.16 TCP 68 [TCP Previous segment not captured] 22 → 59298 [ACK] Seq=68121 Ack=6641 Win=1452 Len=0 TSval=4133982 TSecr=3537653
  298 2.116578592  10.6.15.144 → 192.168.1.16 TCP 68 22 → 59298 [ACK] Seq=68121 Ack=7157 Win=1452 Len=0 TSval=4133982 TSecr=3537653
  299 2.117428329  10.6.15.144 → 192.168.1.16 TCP 68 22 → 59298 [ACK] Seq=68121 Ack=7201 Win=1452 Len=0 TSval=4133982 TSecr=3537654
  300 2.119414585  10.6.15.144 → 192.168.1.16 SSH 1516 Server: Encrypted packet (len=1448)
  301 2.119429369 192.168.1.16 → 10.6.15.144  TCP 80 [TCP Dup ACK 296#1] 59298 → 22 [ACK] Seq=7201 Ack=65225 Win=3666 Len=0 TSval=3537656 TSecr=4133979 SLE=68121 SRE=69569
  302 2.119465863  10.6.15.144 → 192.168.1.16 SSH 596 Server: Encrypted packet (len=528)
  303 2.119471049 192.168.1.16 → 10.6.15.144  TCP 80 [TCP Dup ACK 296#2] 59298 → 22 [ACK] Seq=7201 Ack=65225 Win=3666 Len=0 TSval=3537656 TSecr=4133979 SLE=68121 SRE=70097
  304 2.129770064  10.6.15.144 → 192.168.1.16 SSH 1516 Server: [TCP Fast Retransmission] , Encrypted packet (len=1448)
  305 2.129796864 192.168.1.16 → 10.6.15.144  TCP 80 59298 → 22 [ACK] Seq=7201 Ack=66673 Win=3666 Len=0 TSval=3537659 TSecr=4133985 SLE=68121 SRE=70097
  306 2.129887119    127.0.0.1 → 127.0.0.1    Socks 2864 Unknown
  307 2.129893031    127.0.0.1 → 127.0.0.1    TCP 68 41968 → 1080 [ACK] Seq=1 Ack=62911 Win=3637 Len=0 TSval=3537659 TSecr=3537659
  308 2.139373515  10.6.15.144 → 192.168.1.16 TCP 1516 [TCP Retransmission] 22 → 59298 [ACK] Seq=66673 Ack=7201 Win=1452 Len=1448 TSval=4133988 TSecr=3537659
  309 2.139400782 192.168.1.16 → 10.6.15.144  TCP 68 59298 → 22 [ACK] Seq=7201 Ack=70097 Win=3666 Len=0 TSval=3537661 TSecr=4133988
  310 2.139481642    127.0.0.1 → 127.0.0.1    TCP 68 1080 → 41988 [FIN, ACK] Seq=1 Ack=2 Win=350 Len=0 TSval=3537661 TSecr=3537591
  311 2.139497881    127.0.0.1 → 127.0.0.1    TCP 68 41988 → 1080 [ACK] Seq=2 Ack=2 Win=350 Len=0 TSval=3537661 TSecr=3537661
  312 2.139518728    127.0.0.1 → 127.0.0.1    TCP 68 1080 → 41978 [FIN, ACK] Seq=1 Ack=2 Win=350 Len=0 TSval=3537661 TSecr=3537591
  313 2.139521969    127.0.0.1 → 127.0.0.1    TCP 68 41978 → 1080 [ACK] Seq=2 Ack=2 Win=1415 Len=0 TSval=3537661 TSecr=3537661
  314 2.139532847    127.0.0.1 → 127.0.0.1    TCP 68 1080 → 41976 [FIN, ACK] Seq=1 Ack=2 Win=350 Len=0 TSval=3537661 TSecr=3537591
  315 2.139535170    127.0.0.1 → 127.0.0.1    TCP 68 41976 → 1080 [ACK] Seq=2 Ack=2 Win=1415 Len=0 TSval=3537661 TSecr=3537661
  316 2.139543107    127.0.0.1 → 127.0.0.1    TCP 68 1080 → 41980 [FIN, ACK] Seq=1 Ack=2 Win=350 Len=0 TSval=3537661 TSecr=3537591
  317 2.139545124    127.0.0.1 → 127.0.0.1    TCP 68 41980 → 1080 [ACK] Seq=2 Ack=2 Win=1415 Len=0 TSval=3537661 TSecr=3537661
  318 2.139556826    127.0.0.1 → 127.0.0.1    TCP 68 1080 → 41986 [FIN, ACK] Seq=1 Ack=2 Win=350 Len=0 TSval=3537661 TSecr=3537591
  319 2.139558896    127.0.0.1 → 127.0.0.1    TCP 68 41986 → 1080 [ACK] Seq=2 Ack=2 Win=350 Len=0 TSval=3537661 TSecr=3537661
  320 2.139570874    127.0.0.1 → 127.0.0.1    TCP 68 1080 → 41964 [FIN, ACK] Seq=1 Ack=2 Win=350 Len=0 TSval=3537661 TSecr=3537591
  321 2.139572937    127.0.0.1 → 127.0.0.1    TCP 68 41964 → 1080 [ACK] Seq=2 Ack=2 Win=350 Len=0 TSval=3537661 TSecr=3537661
  322 2.139581811    127.0.0.1 → 127.0.0.1    TCP 68 1080 → 41984 [FIN, ACK] Seq=1 Ack=2 Win=350 Len=0 TSval=3537661 TSecr=3537591
  323 2.139584185    127.0.0.1 → 127.0.0.1    TCP 68 41984 → 1080 [ACK] Seq=2 Ack=2 Win=350 Len=0 TSval=3537661 TSecr=3537661
  324 2.139907734    127.0.0.1 → 127.0.0.1    Socks 78 Version: 5, Remote Port: 443 Command Response - Connect
  325 2.139918824    127.0.0.1 → 127.0.0.1    Socks 3214 Unknown
  326 2.139920838    127.0.0.1 → 127.0.0.1    TCP 68 41968 → 1080 [ACK] Seq=1 Ack=66057 Win=3637 Len=0 TSval=3537662 TSecr=3537662
  327 2.139930215 192.168.1.16 → 10.6.15.144  SSH 320 Client: Encrypted packet (len=252)
  328 2.140553698    127.0.0.1 → 127.0.0.1    SSL 585 Client Hello
  329 2.140564622    127.0.0.1 → 127.0.0.1    TCP 68 1080 → 42124 [ACK] Seq=13 Ack=538 Win=44800 Len=0 TSval=3537662 TSecr=3537662
  330 2.140659501 192.168.1.16 → 10.6.15.144  SSH 160 Client: Encrypted packet (len=92)
  331 2.147631997    127.0.0.1 → 127.0.0.1    TCP 68 1080 → 42128 [ACK] Seq=3 Ack=27 Win=43776 Len=0 TSval=3537664 TSecr=3537653
  332 2.147634865    127.0.0.1 → 127.0.0.1    TCP 68 1080 → 42126 [ACK] Seq=3 Ack=21 Win=43776 Len=0 TSval=3537664 TSecr=3537653
  333 2.149969319    127.0.0.1 → 127.0.0.1    TCP 76 42130 → 1080 [SYN] Seq=0 Win=43690 Len=0 MSS=65495 SACK_PERM=1 TSval=3537664 TSecr=0 WS=128
  334 2.149983584    127.0.0.1 → 127.0.0.1    TCP 76 1080 → 42130 [SYN, ACK] Seq=0 Ack=1 Win=43690 Len=0 MSS=65495 SACK_PERM=1 TSval=3537664 TSecr=3537664 WS=128
  335 2.149994779    127.0.0.1 → 127.0.0.1    TCP 68 42130 → 1080 [ACK] Seq=1 Ack=1 Win=43776 Len=0 TSval=3537664 TSecr=3537664
  336 2.150549096  10.6.15.144 → 192.168.1.16 TCP 68 22 → 59298 [ACK] Seq=70097 Ack=7545 Win=1452 Len=0 TSval=4133990 TSecr=3537662
  337 2.150920991    127.0.0.1 → 127.0.0.1    Socks 71 Version: 5 Connect to server request
  338 2.150932442    127.0.0.1 → 127.0.0.1    TCP 68 1080 → 42130 [ACK] Seq=1 Ack=4 Win=43776 Len=0 TSval=3537664 TSecr=3537664
  339 2.151002958    127.0.0.1 → 127.0.0.1    Socks 70 Version: 5 Connect to server response
  340 2.151008081    127.0.0.1 → 127.0.0.1    TCP 68 42130 → 1080 [ACK] Seq=4 Ack=3 Win=43776 Len=0 TSval=3537664 TSecr=3537664
  341 2.151075822    127.0.0.1 → 127.0.0.1    Socks 89 Version: 5 Command Request - Connect
  342 2.151151393 192.168.1.16 → 10.6.15.144  SSH 112 Client: Encrypted packet (len=44)
  343 2.151273784    127.0.0.1 → 127.0.0.1    Socks 148 Unknown
  344 2.151283521    127.0.0.1 → 127.0.0.1    TCP 68 1080 → 41900 [ACK] Seq=1 Ack=81 Win=359 Len=0 TSval=3537664 TSecr=3537664
  345 2.151374578 192.168.1.16 → 10.6.15.144  SSH 184 Client: Encrypted packet (len=116)
  346 2.161607066  10.6.15.144 → 192.168.1.16 TCP 68 22 → 59298 [ACK] Seq=70097 Ack=7705 Win=1452 Len=0 TSval=4133993 TSecr=3537664
  347 2.171834826    127.0.0.1 → 127.0.0.1    TCP 76 42132 → 1080 [SYN] Seq=0 Win=43690 Len=0 MSS=65495 SACK_PERM=1 TSval=3537670 TSecr=0 WS=128
  348 2.171848962    127.0.0.1 → 127.0.0.1    TCP 76 1080 → 42132 [SYN, ACK] Seq=0 Ack=1 Win=43690 Len=0 MSS=65495 SACK_PERM=1 TSval=3537670 TSecr=3537670 WS=128
  349 2.171860651    127.0.0.1 → 127.0.0.1    TCP 68 42132 → 1080 [ACK] Seq=1 Ack=1 Win=43776 Len=0 TSval=3537670 TSecr=3537670
  350 2.173735599    127.0.0.1 → 127.0.0.1    Socks 71 Version: 5 Connect to server request
  351 2.173750700    127.0.0.1 → 127.0.0.1    TCP 68 1080 → 42132 [ACK] Seq=1 Ack=4 Win=43776 Len=0 TSval=3537670 TSecr=3537670
  352 2.173809887    127.0.0.1 → 127.0.0.1    Socks 70 Version: 5 Connect to server response
  353 2.173814372    127.0.0.1 → 127.0.0.1    TCP 68 42132 → 1080 [ACK] Seq=4 Ack=3 Win=43776 Len=0 TSval=3537670 TSecr=3537670
  354 2.174118534    127.0.0.1 → 127.0.0.1    Socks 85 Version: 5 Command Request - Connect
  355 2.174212440 192.168.1.16 → 10.6.15.144  SSH 104 Client: Encrypted packet (len=36)
  356 2.191647955    127.0.0.1 → 127.0.0.1    TCP 68 1080 → 42130 [ACK] Seq=3 Ack=25 Win=43776 Len=0 TSval=3537675 TSecr=3537664
  357 2.196924104    127.0.0.1 → 127.0.0.1    TCP 76 42134 → 1080 [SYN] Seq=0 Win=43690 Len=0 MSS=65495 SACK_PERM=1 TSval=3537676 TSecr=0 WS=128
  358 2.196933993    127.0.0.1 → 127.0.0.1    TCP 76 1080 → 42134 [SYN, ACK] Seq=0 Ack=1 Win=43690 Len=0 MSS=65495 SACK_PERM=1 TSval=3537676 TSecr=3537676 WS=128
  359 2.196942896    127.0.0.1 → 127.0.0.1    TCP 68 42134 → 1080 [ACK] Seq=1 Ack=1 Win=43776 Len=0 TSval=3537676 TSecr=3537676
  360 2.197044515    127.0.0.1 → 127.0.0.1    Socks 71 Version: 5 Connect to server request
  361 2.197049998    127.0.0.1 → 127.0.0.1    TCP 68 1080 → 42134 [ACK] Seq=1 Ack=4 Win=43776 Len=0 TSval=3537676 TSecr=3537676
  362 2.197084241    127.0.0.1 → 127.0.0.1    Socks 70 Version: 5 Connect to server response
  363 2.197089806    127.0.0.1 → 127.0.0.1    TCP 68 42134 → 1080 [ACK] Seq=4 Ack=3 Win=43776 Len=0 TSval=3537676 TSecr=3537676
  364 2.197116942    127.0.0.1 → 127.0.0.1    Socks 85 Version: 5 Command Request - Connect
  365 2.197194518 192.168.1.16 → 10.6.15.144  SSH 104 Client: Encrypted packet (len=36)
