    1 0.000000000 ZioncomE_53:dd:d4 → HonHaiPr_1f:71:b9 EAPOL 135 Key (Message 1 of 4)
    2 0.000166709 HonHaiPr_1f:71:b9 → ZioncomE_53:dd:d4 EAPOL 135 Key (Message 2 of 4)
    3 0.006124816 ZioncomE_53:dd:d4 → HonHaiPr_1f:71:b9 EAPOL 169 Key (Message 3 of 4)
    4 0.006205321 HonHaiPr_1f:71:b9 → ZioncomE_53:dd:d4 EAPOL 113 Key (Message 4 of 4)
    5 0.014918498 fe80::60bd:1940:a0d8:49f9 → ff02::16     ICMPv6 90 Multicast Listener Report Message v2
    6 0.014947764 192.168.1.16 → 224.0.0.252  IGMPv2 46 Membership Report group 224.0.0.252
    7 0.037234594 fe80::60bd:1940:a0d8:49f9 → ff02::1:3    LLMNR 93 Standard query 0xd7c7 ANY theenterprise
    8 0.097511774 192.168.1.16 → 224.0.0.251  MDNS 82 Standard query 0x0000 PTR _googlecast._tcp.local, "QM" question
    9 0.097547728 fe80::60bd:1940:a0d8:49f9 → ff02::fb     MDNS 102 Standard query 0x0000 PTR _googlecast._tcp.local, "QM" question
   10 0.097578606 192.168.1.16 → 224.0.0.251  MDNS 82 Standard query 0x0000 PTR _googlecast._tcp.local, "QM" question
   11 0.097588720 fe80::60bd:1940:a0d8:49f9 → ff02::fb     MDNS 102 Standard query 0x0000 PTR _googlecast._tcp.local, "QM" question
   12 0.139028597 192.168.1.16 → 224.0.0.252  LLMNR 73 Standard query 0xc122 ANY theenterprise
   13 0.139084094 fe80::60bd:1940:a0d8:49f9 → ff02::1:3    LLMNR 93 Standard query 0xd7c7 ANY theenterprise
   14 0.287231300 192.168.1.16 → 224.0.0.252  LLMNR 73 Standard query 0xc122 ANY theenterprise
   15 0.288006149 fe80::60bd:1940:a0d8:49f9 → ff02::1:3    LLMNR 93 Standard query 0xd7c7 ANY theenterprise
   16 0.426938095 192.168.1.16 → 10.6.15.144  SSH 162 Client: Encrypted packet (len=96)
   17 0.476812971  10.6.15.144 → 192.168.1.16 TCP 66 22 → 59298 [ACK] Seq=1521 Ack=97 Win=1452 Len=0 TSval=4165251 TSecr=3568912
   18 0.476838615 192.168.1.16 → 10.6.15.144  SSH 154 Client: Encrypted packet (len=88)
   19 0.487544276  10.6.15.144 → 192.168.1.16 TCP 66 22 → 59298 [ACK] Seq=1521 Ack=185 Win=1452 Len=0 TSval=4165253 TSecr=3568924
   20 0.490948958 fe80::60bd:1940:a0d8:49f9 → ff02::16     ICMPv6 90 Multicast Listener Report Message v2
   21 0.537235375 192.168.1.16 → 224.0.0.252  LLMNR 73 Standard query 0xc122 ANY theenterprise
   22 1.098326202 192.168.1.16 → 224.0.0.251  MDNS 82 Standard query 0x0000 PTR _googlecast._tcp.local, "QM" question
   23 1.099088412 fe80::60bd:1940:a0d8:49f9 → ff02::fb     MDNS 102 Standard query 0x0000 PTR _googlecast._tcp.local, "QM" question
   24 1.099094509 192.168.1.16 → 224.0.0.251  MDNS 82 Standard query 0x0000 PTR _googlecast._tcp.local, "QM" question
   25 1.099096413 fe80::60bd:1940:a0d8:49f9 → ff02::fb     MDNS 102 Standard query 0x0000 PTR _googlecast._tcp.local, "QM" question
   26 1.508144229 192.168.1.16 → 239.255.255.250 SSDP 213 M-SEARCH * HTTP/1.1 
   27 1.509857116 192.168.1.16 → 10.6.15.144  SSH 110 Client: Encrypted packet (len=44)
   28 1.730960890 192.168.1.16 → 10.6.15.144  TCP 110 [TCP Retransmission] 59298 → 22 [PSH, ACK] Seq=185 Ack=1 Win=3666 Len=44 TSval=3569238 TSecr=4164084
   29 1.742074785  10.6.15.144 → 192.168.1.16 TCP 66 22 → 59298 [ACK] Seq=1521 Ack=229 Win=1452 Len=0 TSval=4165567 TSecr=3569238
   30 1.962932615 192.168.1.16 → 224.0.0.252  IGMPv2 46 Membership Report group 224.0.0.252
   31 2.040575154 192.168.1.16 → 10.6.15.144  SSH 102 Client: Encrypted packet (len=36)
   32 2.050427036  10.6.15.144 → 192.168.1.16 TCP 66 22 → 59298 [ACK] Seq=1521 Ack=265 Win=1452 Len=0 TSval=4165644 TSecr=3569315
   33 2.508408390 192.168.1.16 → 239.255.255.250 SSDP 213 M-SEARCH * HTTP/1.1 
   34 2.536280931 10.22.18.209 → 224.0.0.252  LLMNR 64 Standard query 0x0b32 A wpad
   35 2.635547612 10.22.18.209 → 224.0.0.252  LLMNR 64 Standard query 0x0b32 A wpad
   36 3.434966377 192.168.1.16 → 104.31.74.124 TCP 66 38120 → 80 [ACK] Seq=1 Ack=1 Win=274 Len=0 TSval=3569664 TSecr=1019309628
   37 3.498962884 192.168.1.16 → 224.0.0.252  IGMPv2 46 Membership Report group 224.0.0.252
   38 3.509093972 192.168.1.16 → 239.255.255.250 SSDP 213 M-SEARCH * HTTP/1.1 
   39 4.508524797 192.168.1.16 → 224.0.0.251  MDNS 82 Standard query 0x0000 PTR _googlecast._tcp.local, "QM" question
   40 4.509299664 fe80::60bd:1940:a0d8:49f9 → ff02::fb     MDNS 102 Standard query 0x0000 PTR _googlecast._tcp.local, "QM" question
   41 4.509304775 192.168.1.16 → 224.0.0.251  MDNS 82 Standard query 0x0000 PTR _googlecast._tcp.local, "QM" question
   42 4.509306258 fe80::60bd:1940:a0d8:49f9 → ff02::fb     MDNS 102 Standard query 0x0000 PTR _googlecast._tcp.local, "QM" question
   43 4.509723931 192.168.1.16 → 239.255.255.250 SSDP 213 M-SEARCH * HTTP/1.1 
   44 5.509645985 192.168.1.16 → 224.0.0.251  MDNS 82 Standard query 0x0000 PTR _googlecast._tcp.local, "QM" question
   45 5.510426798 fe80::60bd:1940:a0d8:49f9 → ff02::fb     MDNS 102 Standard query 0x0000 PTR _googlecast._tcp.local, "QM" question
   46 5.510435282 192.168.1.16 → 224.0.0.251  MDNS 82 Standard query 0x0000 PTR _googlecast._tcp.local, "QM" question
   47 5.510437764 fe80::60bd:1940:a0d8:49f9 → ff02::fb     MDNS 102 Standard query 0x0000 PTR _googlecast._tcp.local, "QM" question
   48 6.605293481  10.6.15.144 → 192.168.1.16 TCP 218 [TCP Retransmission] 22 → 59298 [PSH, ACK] Seq=1 Ack=265 Win=1452 Len=152 TSval=4166604 TSecr=3569315
   49 6.605516529 192.168.1.16 → 10.6.15.144  SSH 102 Client: Encrypted packet (len=36)
   50 6.606108658 192.168.1.16 → 10.6.15.144  SSH 250 Client: Encrypted packet (len=184)
   51 6.615349062  10.6.15.144 → 192.168.1.16 SSH 318 Server: Encrypted packet (len=252)
   52 6.615369628 192.168.1.16 → 10.6.15.144  TCP 78 [TCP Dup ACK 49#1] 59298 → 22 [ACK] Seq=485 Ack=153 Win=3666 Len=0 TSval=3570459 TSecr=4166604 SLE=1521 SRE=1773
   53 6.624573135  10.6.15.144 → 192.168.1.16 TCP 1434 [TCP Retransmission] 22 → 59298 [PSH, ACK] Seq=153 Ack=485 Win=1452 Len=1368 TSval=4166788 TSecr=3570456
   54 6.624604877 192.168.1.16 → 10.6.15.144  TCP 66 59298 → 22 [ACK] Seq=485 Ack=1773 Win=3666 Len=0 TSval=3570461 TSecr=4166788
   55 6.625501319 192.168.1.16 → 10.6.15.144  SSH 354 Client: Encrypted packet (len=288)
   56 6.626238154 192.168.1.16 → 10.6.15.144  SSH 1162 Client: Encrypted packet (len=1096)
   57 6.637291002  10.6.15.144 → 192.168.1.16 TCP 66 22 → 59298 [ACK] Seq=1773 Ack=1869 Win=1452 Len=0 TSval=4166791 TSecr=3570461
   58 6.637311507 192.168.1.16 → 10.6.15.144  SSH 1514 Client: Encrypted packet (len=1448)
   59 6.637325488 192.168.1.16 → 10.6.15.144  SSH 1514 Client: Encrypted packet (len=1448)
   60 6.649000547  10.6.15.144 → 192.168.1.16 TCP 66 22 → 59298 [ACK] Seq=1773 Ack=4765 Win=1452 Len=0 TSval=4166794 TSecr=3570464
   61 6.649021337 192.168.1.16 → 10.6.15.144  SSH 966 Client: Encrypted packet (len=900)
   62 6.662873821  10.6.15.144 → 192.168.1.16 SSH 394 Server: Encrypted packet (len=328)
   63 6.663185404 192.168.1.16 → 10.6.15.144  SSH 134 Client: Encrypted packet (len=68)
   64 6.663496673  10.6.15.144 → 192.168.1.16 SSH 166 Server: Encrypted packet (len=100)
   65 6.664173398 192.168.1.16 → 10.6.15.144  SSH 302 Client: Encrypted packet (len=236)
   66 6.664913423 192.168.1.16 → 10.6.15.144  SSH 134 Client: Encrypted packet (len=68)
   67 6.665669411 192.168.1.16 → 10.6.15.144  SSH 230 Client: Encrypted packet (len=164)
   68 6.674154293  10.6.15.144 → 192.168.1.16 TCP 66 22 → 59298 [ACK] Seq=2201 Ack=5969 Win=1452 Len=0 TSval=4166800 TSecr=3570471
   69 6.674175472 192.168.1.16 → 10.6.15.144  SSH 1514 Client: Encrypted packet (len=1448)
   70 6.674188534 192.168.1.16 → 10.6.15.144  SSH 1514 Client: Encrypted packet (len=1448)
   71 6.674198121  10.6.15.144 → 192.168.1.16 SSH 214 Server: Encrypted packet (len=148)
   72 6.675206575  10.6.15.144 → 192.168.1.16 SSH 166 Server: Encrypted packet (len=100)
   73 6.675217438 192.168.1.16 → 10.6.15.144  SSH 742 Client: Encrypted packet (len=676)
   74 6.677182466  10.6.15.144 → 192.168.1.16 SSH 158 Server: Encrypted packet (len=92)
   75 6.677199588 192.168.1.16 → 10.6.15.144  SSH 394 Client: Encrypted packet (len=328)
   76 6.684904405  10.6.15.144 → 192.168.1.16 TCP 66 22 → 59298 [ACK] Seq=2541 Ack=9097 Win=1452 Len=0 TSval=4166803 TSecr=3570473
   77 6.685297563  10.6.15.144 → 192.168.1.16 SSH 134 Server: Encrypted packet (len=68)
   78 6.688390003  10.6.15.144 → 192.168.1.16 SSH 190 Server: Encrypted packet (len=124)
   79 6.688465868 192.168.1.16 → 10.6.15.144  TCP 66 59298 → 22 [ACK] Seq=10101 Ack=2733 Win=3666 Len=0 TSval=3570477 TSecr=4166803
   80 6.688698318 192.168.1.16 → 10.6.15.144  SSH 126 Client: Encrypted packet (len=60)
   81 6.699592537  10.6.15.144 → 192.168.1.16 TCP 66 22 → 59298 [ACK] Seq=2733 Ack=10161 Win=1452 Len=0 TSval=4166806 TSecr=3570474
   82 6.722931642  10.6.15.144 → 192.168.1.16 SSH 126 Server: Encrypted packet (len=60)
   83 6.732988747  10.6.15.144 → 192.168.1.16 SSH 214 Server: Encrypted packet (len=148)
   84 6.733065098 192.168.1.16 → 10.6.15.144  TCP 66 59298 → 22 [ACK] Seq=10161 Ack=2941 Win=3666 Len=0 TSval=3570488 TSecr=4166812
   85 6.737036410  10.6.15.144 → 192.168.1.16 SSH 230 Server: Encrypted packet (len=164)
   86 6.743490635  10.6.15.144 → 192.168.1.16 SSH 622 Server: Encrypted packet (len=556)
   87 6.743561797 192.168.1.16 → 10.6.15.144  TCP 66 59298 → 22 [ACK] Seq=10161 Ack=3661 Win=3666 Len=0 TSval=3570491 TSecr=4166816
   88 6.744329761 192.168.1.16 → 10.6.15.144  SSH 134 Client: Encrypted packet (len=68)
   89 6.772049846  10.6.15.144 → 192.168.1.16 SSH 214 Server: Encrypted packet (len=148)
   90 6.772074676  10.6.15.144 → 192.168.1.16 SSH 134 Server: Encrypted packet (len=68)
   91 6.772138721 192.168.1.16 → 10.6.15.144  TCP 66 59298 → 22 [ACK] Seq=10229 Ack=3877 Win=3666 Len=0 TSval=3570498 TSecr=4166825
   92 6.772660435 192.168.1.16 → 10.6.15.144  SSH 134 Client: Encrypted packet (len=68)
   93 6.826794737  10.6.15.144 → 192.168.1.16 TCP 66 22 → 59298 [ACK] Seq=3877 Ack=10297 Win=1452 Len=0 TSval=4166839 TSecr=3570498
   94 6.854976988  10.6.15.144 → 192.168.1.16 SSH 214 Server: Encrypted packet (len=148)
   95 6.855264224 192.168.1.16 → 10.6.15.144  SSH 134 Client: Encrypted packet (len=68)
   96 6.856940274 192.168.1.16 → 10.6.15.144  SSH 1514 Client: Encrypted packet (len=1448)
   97 6.858721456 192.168.1.16 → 10.6.15.144  SSH 126 Client: Encrypted packet (len=60)
   98 6.865847246  10.6.15.144 → 192.168.1.16 TCP 66 22 → 59298 [ACK] Seq=4025 Ack=10365 Win=1452 Len=0 TSval=4166848 TSecr=3570519
   99 6.868747706  10.6.15.144 → 192.168.1.16 TCP 66 22 → 59298 [ACK] Seq=4025 Ack=11873 Win=1452 Len=0 TSval=4166849 TSecr=3570519
  100 6.874457045  10.6.15.144 → 192.168.1.16 SSH 214 Server: Encrypted packet (len=148)
  101 6.874720917 192.168.1.16 → 10.6.15.144  SSH 134 Client: Encrypted packet (len=68)
  102 6.875568582  10.6.15.144 → 192.168.1.16 SSH 182 Server: Encrypted packet (len=116)
  103 6.876103895 192.168.1.16 → 10.6.15.144  SSH 134 Client: Encrypted packet (len=68)
  104 6.876669714  10.6.15.144 → 192.168.1.16 SSH 246 Server: Encrypted packet (len=180)
  105 6.877224596 192.168.1.16 → 10.6.15.144  SSH 134 Client: Encrypted packet (len=68)
  106 6.885402628  10.6.15.144 → 192.168.1.16 SSH 1042 Server: Encrypted packet (len=976)
  107 6.885720260 192.168.1.16 → 10.6.15.144  SSH 134 Client: Encrypted packet (len=68)
  108 6.885784062  10.6.15.144 → 192.168.1.16 SSH 174 Server: Encrypted packet (len=108)
  109 6.887185745  10.6.15.144 → 192.168.1.16 SSH 182 Server: Encrypted packet (len=116)
  110 6.887195434 192.168.1.16 → 10.6.15.144  SSH 134 Client: Encrypted packet (len=68)
  111 6.888368863 192.168.1.16 → 10.6.15.144  SSH 134 Client: Encrypted packet (len=68)
  112 6.889078000 192.168.1.16 → 10.6.15.144  SSH 134 Client: Encrypted packet (len=68)
  113 6.897675964  10.6.15.144 → 192.168.1.16 SSH 710 Server: Encrypted packet (len=644)
  114 6.897700402 192.168.1.16 → 10.6.15.144  SSH 474 Client: Encrypted packet (len=408)
  115 6.899592237  10.6.15.144 → 192.168.1.16 TCP 66 22 → 59298 [ACK] Seq=6313 Ack=12281 Win=1452 Len=0 TSval=4166856 TSecr=3570527
  116 6.899607375 192.168.1.16 → 10.6.15.144  SSH 134 Client: Encrypted packet (len=68)
  117 6.900183444 192.168.1.16 → 10.6.15.144  SSH 134 Client: Encrypted packet (len=68)
  118 6.908427254  10.6.15.144 → 192.168.1.16 TCP 66 22 → 59298 [ACK] Seq=6313 Ack=12757 Win=1452 Len=0 TSval=4166859 TSecr=3570527
  119 6.908448366 192.168.1.16 → 10.6.15.144  SSH 1010 Client: Encrypted packet (len=944)
  120 6.909575140  10.6.15.144 → 192.168.1.16 TCP 66 22 → 59298 [ACK] Seq=6313 Ack=12893 Win=1452 Len=0 TSval=4166859 TSecr=3570530
  121 6.922112789  10.6.15.144 → 192.168.1.16 SSH 382 Server: Encrypted packet (len=316)
  122 6.922664195  10.6.15.144 → 192.168.1.16 SSH 78 Server: [TCP Previous segment not captured] , Encrypted packet (len=12)
  123 6.922673816 192.168.1.16 → 10.6.15.144  TCP 78 59298 → 22 [ACK] Seq=13837 Ack=6629 Win=3666 Len=0 TSval=3570535 TSecr=4166862 SLE=8077 SRE=8089
  124 6.933768356  10.6.15.144 → 192.168.1.16 SSH 1514 Server: Encrypted packet (len=1448)
  125 6.933785607 192.168.1.16 → 10.6.15.144  TCP 78 [TCP Dup ACK 123#1] 59298 → 22 [ACK] Seq=13837 Ack=6629 Win=3666 Len=0 TSval=3570538 TSecr=4166862 SLE=8077 SRE=9537
  126 6.933873957  10.6.15.144 → 192.168.1.16 SSH 1014 Server: Encrypted packet (len=948)
  127 6.933881400 192.168.1.16 → 10.6.15.144  TCP 78 [TCP Dup ACK 123#2] 59298 → 22 [ACK] Seq=13837 Ack=6629 Win=3666 Len=0 TSval=3570538 TSecr=4166862 SLE=8077 SRE=10485
  128 6.944387332  10.6.15.144 → 192.168.1.16 SSH 1514 Server: [TCP Fast Retransmission] , Encrypted packet (len=1448)
  129 6.944415246 192.168.1.16 → 10.6.15.144  TCP 66 59298 → 22 [ACK] Seq=13837 Ack=10485 Win=3666 Len=0 TSval=3570541 TSecr=4166867
  130 6.944724132 192.168.1.16 → 10.6.15.144  SSH 134 Client: Encrypted packet (len=68)
  131 6.945558005 192.168.1.16 → 10.6.15.144  SSH 134 Client: Encrypted packet (len=68)
  132 6.947080761 192.168.1.16 → 10.6.15.144  SSH 134 Client: Encrypted packet (len=68)
  133 6.948493146 192.168.1.16 → 10.6.15.144  SSH 1342 Client: Encrypted packet (len=1276)
  134 6.955549924  10.6.15.144 → 192.168.1.16 TCP 66 22 → 59298 [ACK] Seq=10485 Ack=13973 Win=1452 Len=0 TSval=4166870 TSecr=3570541
  135 6.959182339  10.6.15.144 → 192.168.1.16 TCP 66 22 → 59298 [ACK] Seq=10485 Ack=15317 Win=1452 Len=0 TSval=4166871 TSecr=3570542
  136 6.970651585  10.6.15.144 → 192.168.1.16 SSH 174 Server: Encrypted packet (len=108)
  137 6.970954203 192.168.1.16 → 10.6.15.144  SSH 134 Client: Encrypted packet (len=68)
  138 7.019253315  10.6.15.144 → 192.168.1.16 TCP 66 22 → 59298 [ACK] Seq=10593 Ack=15385 Win=1452 Len=0 TSval=4166887 TSecr=3570548
  139 7.073547139  10.6.15.144 → 192.168.1.16 SSH 838 Server: Encrypted packet (len=772)
  140 7.075279368  10.6.15.144 → 192.168.1.16 SSH 534 Server: Encrypted packet (len=468)
  141 7.075330782 192.168.1.16 → 10.6.15.144  TCP 66 59298 → 22 [ACK] Seq=15385 Ack=11833 Win=3666 Len=0 TSval=3570574 TSecr=4166900
  142 7.075805573 192.168.1.16 → 10.6.15.144  SSH 134 Client: Encrypted packet (len=68)
  143 7.085936976  10.6.15.144 → 192.168.1.16 TCP 66 22 → 59298 [ACK] Seq=11833 Ack=15453 Win=1452 Len=0 TSval=4166903 TSecr=3570574
  144 7.150702931  10.6.15.144 → 192.168.1.16 SSH 678 Server: Encrypted packet (len=612)
  145 7.153324107 192.168.1.16 → 10.6.15.144  SSH 806 Client: Encrypted packet (len=740)
  146 7.154731203  10.6.15.144 → 192.168.1.16 SSH 1514 Server: Encrypted packet (len=1448)
  147 7.154878963  10.6.15.144 → 192.168.1.16 SSH 1278 Server: Encrypted packet (len=1212)
  148 7.154888768 192.168.1.16 → 10.6.15.144  TCP 66 59298 → 22 [ACK] Seq=16193 Ack=15105 Win=3666 Len=0 TSval=3570593 TSecr=4166920
  149 7.156021475 192.168.1.16 → 10.6.15.144  SSH 214 Client: Encrypted packet (len=148)
  150 7.164394199  10.6.15.144 → 192.168.1.16 SSH 182 Server: Encrypted packet (len=116)
  151 7.164628848 192.168.1.16 → 10.6.15.144  SSH 134 Client: Encrypted packet (len=68)
  152 7.174958740  10.6.15.144 → 192.168.1.16 TCP 66 22 → 59298 [ACK] Seq=15221 Ack=16409 Win=1452 Len=0 TSval=4166925 TSecr=3570594
  153 7.510669267 192.168.1.16 → 224.0.0.251  MDNS 82 Standard query 0x0000 PTR _googlecast._tcp.local, "QM" question
  154 7.511349555 fe80::60bd:1940:a0d8:49f9 → ff02::fb     MDNS 102 Standard query 0x0000 PTR _googlecast._tcp.local, "QM" question
  155 7.511355624 192.168.1.16 → 224.0.0.251  MDNS 82 Standard query 0x0000 PTR _googlecast._tcp.local, "QM" question
  156 7.511357697 fe80::60bd:1940:a0d8:49f9 → ff02::fb     MDNS 102 Standard query 0x0000 PTR _googlecast._tcp.local, "QM" question
  157 7.513090928  10.6.15.144 → 192.168.1.16 SSH 174 Server: Encrypted packet (len=108)
  158 7.513299890  10.6.15.144 → 192.168.1.16 SSH 1454 Server: [TCP Previous segment not captured] , Encrypted packet (len=1388)
  159 7.513307041 192.168.1.16 → 10.6.15.144  TCP 78 59298 → 22 [ACK] Seq=16409 Ack=15329 Win=3666 Len=0 TSval=3570683 TSecr=4166966 SLE=16777 SRE=18165
  160 7.513347756 192.168.1.16 → 10.6.15.144  SSH 146 Client: Encrypted packet (len=68)
  161 7.513491724  10.6.15.144 → 192.168.1.16 SSH 1514 Server: Encrypted packet (len=1448)
  162 7.513499811 192.168.1.16 → 10.6.15.144  TCP 78 [TCP Dup ACK 159#1] 59298 → 22 [ACK] Seq=16477 Ack=15329 Win=3666 Len=0 TSval=3570683 TSecr=4166966 SLE=16777 SRE=19613
  163 7.522788831  10.6.15.144 → 192.168.1.16 SSH 1514 Server: Encrypted packet (len=1448)
  164 7.522809387 192.168.1.16 → 10.6.15.144  TCP 78 [TCP Dup ACK 159#2] 59298 → 22 [ACK] Seq=16477 Ack=15329 Win=3666 Len=0 TSval=3570685 TSecr=4166966 SLE=16777 SRE=21061
  165 7.522926744  10.6.15.144 → 192.168.1.16 SSH 1514 Server: Encrypted packet (len=1448)
  166 7.522933807 192.168.1.16 → 10.6.15.144  TCP 78 [TCP Dup ACK 159#3] 59298 → 22 [ACK] Seq=16477 Ack=15329 Win=3666 Len=0 TSval=3570686 TSecr=4166966 SLE=16777 SRE=22509
  167 7.535312085  10.6.15.144 → 192.168.1.16 SSH 1514 Server: Encrypted packet (len=1448)
  168 7.535330361 192.168.1.16 → 10.6.15.144  TCP 78 [TCP Dup ACK 159#4] 59298 → 22 [ACK] Seq=16477 Ack=15329 Win=3666 Len=0 TSval=3570689 TSecr=4166966 SLE=16777 SRE=23957
  169 7.545833371  10.6.15.144 → 192.168.1.16 SSH 1514 Server: [TCP Fast Retransmission] , Encrypted packet (len=1448)
  170 7.545853942 192.168.1.16 → 10.6.15.144  TCP 66 59298 → 22 [ACK] Seq=16477 Ack=23957 Win=3666 Len=0 TSval=3570691 TSecr=4167018
  171 7.545998708  10.6.15.144 → 192.168.1.16 SSH 1514 Server: Encrypted packet (len=1448)
  172 7.546006993 192.168.1.16 → 10.6.15.144  TCP 66 59298 → 22 [ACK] Seq=16477 Ack=25405 Win=3666 Len=0 TSval=3570691 TSecr=4167018
  173 7.559186361  10.6.15.144 → 192.168.1.16 SSH 1514 Server: Encrypted packet (len=1448)
  174 7.559206704 192.168.1.16 → 10.6.15.144  TCP 66 59298 → 22 [ACK] Seq=16477 Ack=26853 Win=3666 Len=0 TSval=3570695 TSecr=4167020
  175 7.559358758  10.6.15.144 → 192.168.1.16 SSH 1514 Server: Encrypted packet (len=1448)
  176 7.559363939 192.168.1.16 → 10.6.15.144  TCP 66 59298 → 22 [ACK] Seq=16477 Ack=28301 Win=3666 Len=0 TSval=3570695 TSecr=4167020
  177 7.559550734  10.6.15.144 → 192.168.1.16 SSH 1514 Server: Encrypted packet (len=1448)
  178 7.559556722 192.168.1.16 → 10.6.15.144  TCP 66 59298 → 22 [ACK] Seq=16477 Ack=29749 Win=3666 Len=0 TSval=3570695 TSecr=4167020
  179 7.570774300  10.6.15.144 → 192.168.1.16 SSH 1514 Server: Encrypted packet (len=1448)
  180 7.570790687 192.168.1.16 → 10.6.15.144  TCP 66 59298 → 22 [ACK] Seq=16477 Ack=31197 Win=3666 Len=0 TSval=3570697 TSecr=4167024
  181 7.571090335 192.168.1.16 → 10.6.15.144  SSH 134 Client: Encrypted packet (len=68)
  182 7.572531772 192.168.1.16 → 10.6.15.144  SSH 134 Client: Encrypted packet (len=68)
  183 7.582690365  10.6.15.144 → 192.168.1.16 TCP 66 [TCP Previous segment not captured] 22 → 59298 [ACK] Seq=35541 Ack=16613 Win=1452 Len=0 TSval=4167027 TSecr=3570698
  184 7.636158975  10.6.15.144 → 192.168.1.16 SSH 1514 Server: Encrypted packet (len=1448)
  185 7.636176406 192.168.1.16 → 10.6.15.144  TCP 78 [TCP Dup ACK 180#1] 59298 → 22 [ACK] Seq=16613 Ack=31197 Win=3666 Len=0 TSval=3570714 TSecr=4167024 SLE=35541 SRE=36989
  186 7.644985563  10.6.15.144 → 192.168.1.16 TCP 1514 [TCP Retransmission] 22 → 59298 [ACK] Seq=31197 Ack=16613 Win=1452 Len=1448 TSval=4167043 TSecr=3570714
  187 7.645011425 192.168.1.16 → 10.6.15.144  TCP 78 59298 → 22 [ACK] Seq=16613 Ack=32645 Win=3666 Len=0 TSval=3570716 TSecr=4167043 SLE=35541 SRE=36989
  188 8.588964644  10.6.15.144 → 192.168.1.16 TCP 1514 [TCP Retransmission] 22 → 59298 [ACK] Seq=32645 Ack=16613 Win=1452 Len=1448 TSval=4167114 TSecr=3570716
  189 8.588991017 192.168.1.16 → 10.6.15.144  TCP 78 59298 → 22 [ACK] Seq=16613 Ack=34093 Win=3666 Len=0 TSval=3570952 TSecr=4167114 SLE=35541 SRE=36989
  190 8.589125862  10.6.15.144 → 192.168.1.16 SSH 1514 Server: [TCP Spurious Retransmission] , Encrypted packet (len=1448)
  191 8.589135215 192.168.1.16 → 10.6.15.144  TCP 86 [TCP Dup ACK 189#1] 59298 → 22 [ACK] Seq=16613 Ack=34093 Win=3666 Len=0 TSval=3570952 TSecr=4167252 SLE=32645 SRE=34093 SLE=35541 SRE=36989
  192 8.601105607  10.6.15.144 → 192.168.1.16 SSH 1514 Server: Encrypted packet (len=1448)
  193 8.601127586 192.168.1.16 → 10.6.15.144  TCP 78 [TCP Dup ACK 189#2] 59298 → 22 [ACK] Seq=16613 Ack=34093 Win=3666 Len=0 TSval=3570955 TSecr=4167252 SLE=35541 SRE=38437
  194 8.601285519  10.6.15.144 → 192.168.1.16 SSH 1514 Server: Encrypted packet (len=1448)
  195 8.601293925 192.168.1.16 → 10.6.15.144  TCP 78 [TCP Dup ACK 189#3] 59298 → 22 [ACK] Seq=16613 Ack=34093 Win=3666 Len=0 TSval=3570955 TSecr=4167252 SLE=35541 SRE=39885
  196 8.612328563  10.6.15.144 → 192.168.1.16 SSH 1514 Server: [TCP Fast Retransmission] , Encrypted packet (len=1448)
  197 8.612357715 192.168.1.16 → 10.6.15.144  TCP 66 59298 → 22 [ACK] Seq=16613 Ack=39885 Win=3666 Len=0 TSval=3570958 TSecr=4167284
  198 8.612466615  10.6.15.144 → 192.168.1.16 SSH 1514 Server: Encrypted packet (len=1448)
  199 8.612474960 192.168.1.16 → 10.6.15.144  TCP 66 59298 → 22 [ACK] Seq=16613 Ack=41333 Win=3666 Len=0 TSval=3570958 TSecr=4167284
  200 8.626473670  10.6.15.144 → 192.168.1.16 SSH 1514 Server: Encrypted packet (len=1448)
  201 8.626491464 192.168.1.16 → 10.6.15.144  TCP 66 59298 → 22 [ACK] Seq=16613 Ack=42781 Win=3666 Len=0 TSval=3570961 TSecr=4167288
  202 8.626656662  10.6.15.144 → 192.168.1.16 SSH 1514 Server: Encrypted packet (len=1448)
  203 8.626662044 192.168.1.16 → 10.6.15.144  TCP 66 59298 → 22 [ACK] Seq=16613 Ack=44229 Win=3666 Len=0 TSval=3570961 TSecr=4167288
  204 8.626848627  10.6.15.144 → 192.168.1.16 SSH 1514 Server: Encrypted packet (len=1448)
  205 8.626855214 192.168.1.16 → 10.6.15.144  TCP 66 59298 → 22 [ACK] Seq=16613 Ack=45677 Win=3666 Len=0 TSval=3570961 TSecr=4167288
  206 8.633205768 192.168.1.16 → 10.6.15.144  SSH 814 Client: Encrypted packet (len=748)
  207 8.636708673  10.6.15.144 → 192.168.1.16 SSH 1514 Server: Encrypted packet (len=1448)
  208 8.636907291  10.6.15.144 → 192.168.1.16 SSH 1514 Server: Encrypted packet (len=1448)
  209 8.636915931 192.168.1.16 → 10.6.15.144  TCP 66 59298 → 22 [ACK] Seq=17361 Ack=48573 Win=3666 Len=0 TSval=3570964 TSecr=4167291
  210 8.637270356  10.6.15.144 → 192.168.1.16 SSH 1514 Server: Encrypted packet (len=1448)
  211 8.647680887  10.6.15.144 → 192.168.1.16 SSH 1514 Server: Encrypted packet (len=1448)
  212 8.647702372 192.168.1.16 → 10.6.15.144  TCP 66 59298 → 22 [ACK] Seq=17361 Ack=51469 Win=3666 Len=0 TSval=3570967 TSecr=4167291
  213 8.647885138  10.6.15.144 → 192.168.1.16 SSH 1514 Server: Encrypted packet (len=1448)
  214 8.658656088  10.6.15.144 → 192.168.1.16 SSH 1514 Server: Encrypted packet (len=1448)
  215 8.658674889 192.168.1.16 → 10.6.15.144  TCP 66 59298 → 22 [ACK] Seq=17361 Ack=54365 Win=3666 Len=0 TSval=3570969 TSecr=4167293
  216 8.658863096  10.6.15.144 → 192.168.1.16 SSH 1514 Server: Encrypted packet (len=1448)
  217 8.670307243  10.6.15.144 → 192.168.1.16 SSH 1514 Server: Encrypted packet (len=1448)
  218 8.670323448 192.168.1.16 → 10.6.15.144  TCP 66 59298 → 22 [ACK] Seq=17361 Ack=57261 Win=3666 Len=0 TSval=3570972 TSecr=4167296
  219 8.670509793  10.6.15.144 → 192.168.1.16 SSH 1514 Server: Encrypted packet (len=1448)
  220 8.681392350  10.6.15.144 → 192.168.1.16 SSH 1514 Server: Encrypted packet (len=1448)
  221 8.681408145 192.168.1.16 → 10.6.15.144  TCP 66 59298 → 22 [ACK] Seq=17361 Ack=60157 Win=3666 Len=0 TSval=3570975 TSecr=4167299
  222 8.691939519  10.6.15.144 → 192.168.1.16 SSH 1514 Server: [TCP Previous segment not captured] , Encrypted packet (len=1448)
  223 8.691962998 192.168.1.16 → 10.6.15.144  TCP 78 [TCP Dup ACK 221#1] 59298 → 22 [ACK] Seq=17361 Ack=60157 Win=3666 Len=0 TSval=3570978 TSecr=4167299 SLE=61605 SRE=63053
  224 8.692142384  10.6.15.144 → 192.168.1.16 SSH 1514 Server: Encrypted packet (len=1448)
  225 8.692152053 192.168.1.16 → 10.6.15.144  TCP 78 [TCP Dup ACK 221#2] 59298 → 22 [ACK] Seq=17361 Ack=60157 Win=3666 Len=0 TSval=3570978 TSecr=4167299 SLE=61605 SRE=64501
  226 8.704650079  10.6.15.144 → 192.168.1.16 SSH 1514 Server: Encrypted packet (len=1448)
  227 8.704669025 192.168.1.16 → 10.6.15.144  TCP 78 [TCP Dup ACK 221#3] 59298 → 22 [ACK] Seq=17361 Ack=60157 Win=3666 Len=0 TSval=3570981 TSecr=4167299 SLE=61605 SRE=65949
  228 8.704854057  10.6.15.144 → 192.168.1.16 SSH 1514 Server: Encrypted packet (len=1448)
  229 8.704857722 192.168.1.16 → 10.6.15.144  TCP 78 [TCP Dup ACK 221#4] 59298 → 22 [ACK] Seq=17361 Ack=60157 Win=3666 Len=0 TSval=3570981 TSecr=4167299 SLE=61605 SRE=67397
  230 8.705067711  10.6.15.144 → 192.168.1.16 SSH 1514 Server: Encrypted packet (len=1448)
  231 8.705070733 192.168.1.16 → 10.6.15.144  TCP 78 [TCP Dup ACK 221#5] 59298 → 22 [ACK] Seq=17361 Ack=60157 Win=3666 Len=0 TSval=3570981 TSecr=4167299 SLE=61605 SRE=68845
  232 8.717629937  10.6.15.144 → 192.168.1.16 SSH 1514 Server: [TCP Fast Retransmission] , Encrypted packet (len=1448)
  233 8.717653389 192.168.1.16 → 10.6.15.144  TCP 66 59298 → 22 [ACK] Seq=17361 Ack=68845 Win=3666 Len=0 TSval=3570984 TSecr=4167310
  234 8.717817214  10.6.15.144 → 192.168.1.16 SSH 1514 Server: Encrypted packet (len=1448)
  235 8.717824431 192.168.1.16 → 10.6.15.144  TCP 66 59298 → 22 [ACK] Seq=17361 Ack=70293 Win=3666 Len=0 TSval=3570984 TSecr=4167310
  236 8.726143455  10.6.15.144 → 192.168.1.16 SSH 1514 Server: Encrypted packet (len=1448)
  237 8.726162659 192.168.1.16 → 10.6.15.144  TCP 66 59298 → 22 [ACK] Seq=17361 Ack=71741 Win=3666 Len=0 TSval=3570986 TSecr=4167313
  238 8.726348476  10.6.15.144 → 192.168.1.16 SSH 1514 Server: Encrypted packet (len=1448)
  239 8.726356689 192.168.1.16 → 10.6.15.144  TCP 66 59298 → 22 [ACK] Seq=17361 Ack=73189 Win=3666 Len=0 TSval=3570986 TSecr=4167313
  240 8.726566125  10.6.15.144 → 192.168.1.16 SSH 1514 Server: Encrypted packet (len=1448)
  241 8.726575150 192.168.1.16 → 10.6.15.144  TCP 66 59298 → 22 [ACK] Seq=17361 Ack=74637 Win=3666 Len=0 TSval=3570986 TSecr=4167313
  242 8.737450736  10.6.15.144 → 192.168.1.16 SSH 1514 Server: Encrypted packet (len=1448)
  243 8.737466362 192.168.1.16 → 10.6.15.144  TCP 66 59298 → 22 [ACK] Seq=17361 Ack=76085 Win=3666 Len=0 TSval=3570989 TSecr=4167316
  244 8.737668678  10.6.15.144 → 192.168.1.16 SSH 1514 Server: Encrypted packet (len=1448)
  245 8.737675155 192.168.1.16 → 10.6.15.144  TCP 66 59298 → 22 [ACK] Seq=17361 Ack=77533 Win=3666 Len=0 TSval=3570989 TSecr=4167316
  246 8.738019656  10.6.15.144 → 192.168.1.16 SSH 1514 Server: Encrypted packet (len=1448)
  247 8.738023424 192.168.1.16 → 10.6.15.144  TCP 66 59298 → 22 [ACK] Seq=17361 Ack=78981 Win=3666 Len=0 TSval=3570989 TSecr=4167316
  248 8.750385009  10.6.15.144 → 192.168.1.16 SSH 1514 Server: Encrypted packet (len=1448)
  249 8.750400522 192.168.1.16 → 10.6.15.144  TCP 66 59298 → 22 [ACK] Seq=17361 Ack=80429 Win=3666 Len=0 TSval=3570992 TSecr=4167319
  250 8.750573114  10.6.15.144 → 192.168.1.16 SSH 1514 Server: Encrypted packet (len=1448)
  251 8.750579777 192.168.1.16 → 10.6.15.144  TCP 66 59298 → 22 [ACK] Seq=17361 Ack=81877 Win=3666 Len=0 TSval=3570992 TSecr=4167319
  252 8.750786226  10.6.15.144 → 192.168.1.16 SSH 1514 Server: Encrypted packet (len=1448)
  253 8.750791240 192.168.1.16 → 10.6.15.144  TCP 66 59298 → 22 [ACK] Seq=17361 Ack=83325 Win=3666 Len=0 TSval=3570992 TSecr=4167319
  254 8.750869215  10.6.15.144 → 192.168.1.16 SSH 734 Server: Encrypted packet (len=668)
  255 8.750873412 192.168.1.16 → 10.6.15.144  TCP 66 59298 → 22 [ACK] Seq=17361 Ack=83993 Win=3666 Len=0 TSval=3570992 TSecr=4167319
  256 8.874949139 192.168.1.16 → 10.6.15.144  SSH 798 Client: Encrypted packet (len=732)
  257 8.878925494 192.168.1.16 → 10.6.15.144  SSH 918 Client: Encrypted packet (len=852)
  258 8.881527059  10.6.15.144 → 192.168.1.16 SSH 454 Server: Encrypted packet (len=388)
  259 8.881557084 192.168.1.16 → 10.6.15.144  TCP 66 59298 → 22 [ACK] Seq=18945 Ack=84381 Win=3666 Len=0 TSval=3571025 TSecr=4167350
  260 8.890833148  10.6.15.144 → 192.168.1.16 TCP 66 22 → 59298 [ACK] Seq=84381 Ack=18945 Win=1452 Len=0 TSval=4167354 TSecr=3571020
  261 8.907935228 192.168.1.16 → 10.6.15.144  SSH 806 Client: Encrypted packet (len=740)
  262 8.908475100 192.168.1.16 → 10.6.15.144  SSH 102 Client: Encrypted packet (len=36)
  263 8.909252810 192.168.1.16 → 10.6.15.144  SSH 110 Client: Encrypted packet (len=44)
  264 8.918911387  10.6.15.144 → 192.168.1.16 TCP 66 22 → 59298 [ACK] Seq=84381 Ack=19721 Win=1452 Len=0 TSval=4167361 TSecr=3571032
  265 8.922364241  10.6.15.144 → 192.168.1.16 SSH 138 Server: Encrypted packet (len=72)
  266 8.922619600 192.168.1.16 → 10.6.15.144  SSH 102 Client: Encrypted packet (len=36)
  267 8.941206242 192.168.1.16 → 10.6.15.144  SSH 878 Client: Encrypted packet (len=812)
  268 8.951074872  10.6.15.144 → 192.168.1.16 TCP 66 22 → 59298 [ACK] Seq=84453 Ack=20613 Win=1452 Len=0 TSval=4167369 TSecr=3571035
  269 8.976161706 192.168.1.16 → 10.6.15.144  SSH 798 Client: Encrypted packet (len=732)
  270 8.994191516 192.168.1.16 → 10.6.15.144  SSH 478 Client: Encrypted packet (len=412)
  271 9.005109744  10.6.15.144 → 192.168.1.16 TCP 66 22 → 59298 [ACK] Seq=84453 Ack=21757 Win=1452 Len=0 TSval=4167383 TSecr=3571049
  272 9.019032956 192.168.1.16 → 10.6.15.144  SSH 886 Client: Encrypted packet (len=820)
  273 9.019672901 192.168.1.16 → 10.6.15.144  SSH 838 Client: Encrypted packet (len=772)
  274 9.028867862  10.6.15.144 → 192.168.1.16 TCP 66 22 → 59298 [ACK] Seq=84453 Ack=23349 Win=1452 Len=0 TSval=4167389 TSecr=3571060
  275 9.086208746 192.168.1.16 → 10.6.15.144  SSH 102 Client: Encrypted packet (len=36)
  276 9.086944283 192.168.1.16 → 10.6.15.144  SSH 118 Client: Encrypted packet (len=52)
  277 9.095577801 192.168.1.16 → 10.6.15.144  SSH 102 Client: Encrypted packet (len=36)
  278 9.096304394  10.6.15.144 → 192.168.1.16 TCP 66 22 → 59298 [ACK] Seq=84453 Ack=23437 Win=1452 Len=0 TSval=4167406 TSecr=3571076
  279 9.099611416 192.168.1.16 → 10.6.15.144  SSH 110 Client: Encrypted packet (len=44)
  280 9.108794372  10.6.15.144 → 192.168.1.16 TCP 66 22 → 59298 [ACK] Seq=84453 Ack=23517 Win=1452 Len=0 TSval=4167409 TSecr=3571079
  281 9.111966517  10.6.15.144 → 192.168.1.16 SSH 110 Server: Encrypted packet (len=44)
  282 9.112377860 192.168.1.16 → 10.6.15.144  SSH 1166 Client: Encrypted packet (len=1100)
  283 9.113054634 192.168.1.16 → 10.6.15.144  SSH 406 Client: Encrypted packet (len=340)
  284 9.119350201  10.6.15.144 → 192.168.1.16 SSH 454 Server: Encrypted packet (len=388)
  285 9.121662122  10.6.15.144 → 192.168.1.16 SSH 102 Server: Encrypted packet (len=36)
  286 9.121733411 192.168.1.16 → 10.6.15.144  TCP 66 59298 → 22 [ACK] Seq=24957 Ack=84921 Win=3666 Len=0 TSval=3571085 TSecr=4167411
  287 9.122569226 192.168.1.16 → 10.6.15.144  SSH 398 Client: Encrypted packet (len=332)
  288 9.123089002  10.6.15.144 → 192.168.1.16 TCP 66 22 → 59298 [ACK] Seq=84921 Ack=24957 Win=1452 Len=0 TSval=4167412 TSecr=3571083
  289 9.127340554  10.6.15.144 → 192.168.1.16 SSH 454 Server: Encrypted packet (len=388)
  290 9.127492746  10.6.15.144 → 192.168.1.16 SSH 254 Server: Encrypted packet (len=188)
  291 9.127518773 192.168.1.16 → 10.6.15.144  TCP 66 59298 → 22 [ACK] Seq=25289 Ack=85497 Win=3666 Len=0 TSval=3571087 TSecr=4167413
  292 9.128263392 192.168.1.16 → 10.6.15.144  SSH 134 Client: Encrypted packet (len=68)
  293 9.134669159 192.168.1.16 → 10.6.15.144  SSH 102 Client: Encrypted packet (len=36)
  294 9.135420248 192.168.1.16 → 10.6.15.144  SSH 230 Client: Encrypted packet (len=164)
  295 9.136063458 192.168.1.16 → 10.6.15.144  SSH 798 Client: Encrypted packet (len=732)
  296 9.138187121  10.6.15.144 → 192.168.1.16 TCP 66 22 → 59298 [ACK] Seq=85497 Ack=25357 Win=1452 Len=0 TSval=4167416 TSecr=3571085
  297 9.138202551 192.168.1.16 → 10.6.15.144  SSH 550 Client: Encrypted packet (len=484)
  298 9.141837327 192.168.1.16 → 10.6.15.144  SSH 798 Client: Encrypted packet (len=732)
  299 9.142005526  10.6.15.144 → 192.168.1.16 SSH 166 Server: Encrypted packet (len=100)
  300 9.145952018  10.6.15.144 → 192.168.1.16 SSH 102 Server: Encrypted packet (len=36)
  301 9.145972130  10.6.15.144 → 192.168.1.16 TCP 66 22 → 59298 [ACK] Seq=85633 Ack=25557 Win=1452 Len=0 TSval=4167418 TSecr=3571088
  302 9.145985325 192.168.1.16 → 10.6.15.144  SSH 126 Client: Encrypted packet (len=60)
  303 9.146078633  10.6.15.144 → 192.168.1.16 SSH 678 Server: Encrypted packet (len=612)
  304 9.146941904 192.168.1.16 → 10.6.15.144  SSH 406 Client: Encrypted packet (len=340)
  305 9.147746003  10.6.15.144 → 192.168.1.16 SSH 134 Server: Encrypted packet (len=68)
  306 9.151417409  10.6.15.144 → 192.168.1.16 TCP 66 22 → 59298 [ACK] Seq=86313 Ack=26773 Win=1452 Len=0 TSval=4167419 TSecr=3571089
  307 9.156090635  10.6.15.144 → 192.168.1.16 TCP 66 22 → 59298 [ACK] Seq=86313 Ack=27565 Win=1452 Len=0 TSval=4167420 TSecr=3571090
  308 9.158497203 192.168.1.16 → 10.6.15.144  SSH 102 Client: Encrypted packet (len=36)
  309 9.160185560 192.168.1.16 → 10.6.15.144  SSH 102 Client: Encrypted packet (len=36)
  310 9.160410105 192.168.1.16 → 10.6.15.144  SSH 118 Client: Encrypted packet (len=52)
  311 9.160627752 192.168.1.16 → 10.6.15.144  SSH 110 Client: Encrypted packet (len=44)
  312 9.161468178  10.6.15.144 → 192.168.1.16 SSH 102 Server: Encrypted packet (len=36)
  313 9.161832359 192.168.1.16 → 10.6.15.144  SSH 174 Client: Encrypted packet (len=108)
  314 9.170172145  10.6.15.144 → 192.168.1.16 TCP 66 22 → 59298 [ACK] Seq=86349 Ack=27977 Win=1452 Len=0 TSval=4167424 TSecr=3571094
  315 9.170192602  10.6.15.144 → 192.168.1.16 TCP 66 22 → 59298 [ACK] Seq=86349 Ack=28073 Win=1452 Len=0 TSval=4167424 TSecr=3571095
  316 9.181864839  10.6.15.144 → 192.168.1.16 SSH 366 Server: Encrypted packet (len=300)
  317 9.188279412 192.168.1.16 → 10.6.15.144  SSH 798 Client: Encrypted packet (len=732)
  318 9.231215487  10.6.15.144 → 192.168.1.16 SSH 1398 Server: Encrypted packet (len=1332)
  319 9.231402540  10.6.15.144 → 192.168.1.16 SSH 1398 Server: Encrypted packet (len=1332)
  320 9.231409472 192.168.1.16 → 10.6.15.144  TCP 66 59298 → 22 [ACK] Seq=28913 Ack=89313 Win=3666 Len=0 TSval=3571113 TSecr=4167439
  321 9.231770865  10.6.15.144 → 192.168.1.16 SSH 1514 Server: Encrypted packet (len=1448)
  322 9.231936182  10.6.15.144 → 192.168.1.16 SSH 1238 Server: Encrypted packet (len=1172)
  323 9.231942287 192.168.1.16 → 10.6.15.144  TCP 66 59298 → 22 [ACK] Seq=28913 Ack=91933 Win=3666 Len=0 TSval=3571113 TSecr=4167439
  324 9.242928508  10.6.15.144 → 192.168.1.16 SSH 822 Server: Encrypted packet (len=756)
  325 9.243633134 192.168.1.16 → 10.6.15.144  SSH 134 Client: Encrypted packet (len=68)
  326 9.268412766  10.6.15.144 → 192.168.1.16 SSH 318 Server: Encrypted packet (len=252)
  327 9.275306501 192.168.1.16 → 10.6.15.144  SSH 822 Client: Encrypted packet (len=756)
  328 9.304536790  10.6.15.144 → 192.168.1.16 SSH 454 Server: Encrypted packet (len=388)
  329 9.322270381  10.6.15.144 → 192.168.1.16 SSH 110 Server: Encrypted packet (len=44)
  330 9.322340714 192.168.1.16 → 10.6.15.144  TCP 66 59298 → 22 [ACK] Seq=29737 Ack=93373 Win=3666 Len=0 TSval=3571135 TSecr=4167458
  331 9.324429497 192.168.1.16 → 10.6.15.144  SSH 422 Client: Encrypted packet (len=356)
  332 9.336417287  10.6.15.144 → 192.168.1.16 SSH 138 Server: Encrypted packet (len=72)
  333 9.336609062 192.168.1.16 → 10.6.15.144  SSH 102 Client: Encrypted packet (len=36)
  334 9.339711650  10.6.15.144 → 192.168.1.16 SSH 138 Server: Encrypted packet (len=72)
  335 9.339891527 192.168.1.16 → 10.6.15.144  SSH 102 Client: Encrypted packet (len=36)
  336 9.350864109  10.6.15.144 → 192.168.1.16 TCP 66 22 → 59298 [ACK] Seq=93517 Ack=30165 Win=1452 Len=0 TSval=4167469 TSecr=3571139
  337 9.353374654  10.6.15.144 → 192.168.1.16 SSH 366 Server: Encrypted packet (len=300)
  338 9.366643021  10.6.15.144 → 192.168.1.16 SSH 254 Server: Encrypted packet (len=188)
  339 9.366699267 192.168.1.16 → 10.6.15.144  TCP 66 59298 → 22 [ACK] Seq=30165 Ack=94005 Win=3666 Len=0 TSval=3571146 TSecr=4167470
  340 9.366945488 192.168.1.16 → 10.6.15.144  SSH 174 Client: Encrypted packet (len=108)
  341 9.367218201 192.168.1.16 → 10.6.15.144  SSH 582 Client: Encrypted packet (len=516)
  342 9.373193300  10.6.15.144 → 192.168.1.16 SSH 630 Server: Encrypted packet (len=564)
  343 9.375812604 192.168.1.16 → 10.6.15.144  SSH 942 Client: Encrypted packet (len=876)
  344 9.382102595  10.6.15.144 → 192.168.1.16 TCP 66 22 → 59298 [ACK] Seq=94569 Ack=30789 Win=1452 Len=0 TSval=4167477 TSecr=3571147
  345 9.383310025  10.6.15.144 → 192.168.1.16 SSH 446 Server: Encrypted packet (len=380)
  346 9.383453288  10.6.15.144 → 192.168.1.16 SSH 138 Server: Encrypted packet (len=72)
  347 9.383482160 192.168.1.16 → 10.6.15.144  TCP 66 59298 → 22 [ACK] Seq=31665 Ack=95021 Win=3666 Len=0 TSval=3571151 TSecr=4167477
  348 9.383665050 192.168.1.16 → 10.6.15.144  SSH 102 Client: Encrypted packet (len=36)
  349 9.384200868  10.6.15.144 → 192.168.1.16 SSH 238 Server: Encrypted packet (len=172)
  350 9.385208532 192.168.1.16 → 10.6.15.144  SSH 134 Client: Encrypted packet (len=68)
  351 9.386164616  10.6.15.144 → 192.168.1.16 SSH 102 Server: Encrypted packet (len=36)
  352 9.386723500 192.168.1.16 → 10.6.15.144  SSH 158 Client: Encrypted packet (len=92)
  353 9.388029209 192.168.1.16 → 10.6.15.144  SSH 474 Client: Encrypted packet (len=408)
  354 9.395329858  10.6.15.144 → 192.168.1.16 TCP 66 [TCP Previous segment not captured] 22 → 59298 [ACK] Seq=95653 Ack=31769 Win=1452 Len=0 TSval=4167480 TSecr=3571151
  355 9.398413989  10.6.15.144 → 192.168.1.16 TCP 66 22 → 59298 [ACK] Seq=95653 Ack=32269 Win=1452 Len=0 TSval=4167481 TSecr=3571151
  356 9.401727526  10.6.15.144 → 192.168.1.16 SSH 138 Server: Encrypted packet (len=72)
  357 9.401740466 192.168.1.16 → 10.6.15.144  TCP 78 [TCP Dup ACK 352#1] 59298 → 22 [ACK] Seq=32269 Ack=95229 Win=3666 Len=0 TSval=3571155 TSecr=4167478 SLE=95653 SRE=95725
  358 9.407742642  10.6.15.144 → 192.168.1.16 SSH 138 Server: Encrypted packet (len=72)
  359 9.407756027 192.168.1.16 → 10.6.15.144  TCP 78 [TCP Dup ACK 352#2] 59298 → 22 [ACK] Seq=32269 Ack=95229 Win=3666 Len=0 TSval=3571157 TSecr=4167478 SLE=95653 SRE=95797
  360 9.428308353  10.6.15.144 → 192.168.1.16 SSH 446 Server: Encrypted packet (len=380)
  361 9.428323417 192.168.1.16 → 10.6.15.144  TCP 78 [TCP Dup ACK 352#3] 59298 → 22 [ACK] Seq=32269 Ack=95229 Win=3666 Len=0 TSval=3571162 TSecr=4167478 SLE=95653 SRE=96177
  362 9.437853570  10.6.15.144 → 192.168.1.16 SSH 490 Server: [TCP Fast Retransmission] , Encrypted packet (len=424)
  363 9.437879079 192.168.1.16 → 10.6.15.144  TCP 66 59298 → 22 [ACK] Seq=32269 Ack=96177 Win=3666 Len=0 TSval=3571164 TSecr=4167491
  364 9.438159304 192.168.1.16 → 10.6.15.144  SSH 138 Client: Encrypted packet (len=72)
  365 9.439334826 192.168.1.16 → 10.6.15.144  SSH 406 Client: Encrypted packet (len=340)
  366 9.443488175  10.6.15.144 → 192.168.1.16 SSH 102 Server: Encrypted packet (len=36)
  367 9.443990097 192.168.1.16 → 10.6.15.144  SSH 138 Client: Encrypted packet (len=72)
  368 9.448692342  10.6.15.144 → 192.168.1.16 TCP 66 22 → 59298 [ACK] Seq=96213 Ack=32681 Win=1452 Len=0 TSval=4167494 TSecr=3571164
  369 9.453152239  10.6.15.144 → 192.168.1.16 SSH 102 Server: Encrypted packet (len=36)
  370 9.494879641  10.6.15.144 → 192.168.1.16 SSH 102 Server: Encrypted packet (len=36)
  371 9.494903985 192.168.1.16 → 10.6.15.144  TCP 66 59298 → 22 [ACK] Seq=32753 Ack=96285 Win=3666 Len=0 TSval=3571179 TSecr=4167495
  372 9.495421211 192.168.1.16 → 10.6.15.144  SSH 398 Client: Encrypted packet (len=332)
  373 9.523755209  10.6.15.144 → 192.168.1.16 SSH 366 Server: Encrypted packet (len=300)
  374 9.563969513  10.6.15.144 → 192.168.1.16 SSH 1514 Server: Encrypted packet (len=1448)
  375 9.563985923 192.168.1.16 → 10.6.15.144  TCP 66 59298 → 22 [ACK] Seq=33085 Ack=98033 Win=3666 Len=0 TSval=3571196 TSecr=4167512
  376 9.564157861  10.6.15.144 → 192.168.1.16 SSH 1390 Server: Encrypted packet (len=1324)
  377 9.565443545 192.168.1.16 → 10.6.15.144  SSH 206 Client: Encrypted packet (len=140)
  378 9.567296926 192.168.1.16 → 10.6.15.144  SSH 190 Client: Encrypted packet (len=124)
  379 9.567826272 192.168.1.16 → 10.6.15.144  SSH 634 Client: Encrypted packet (len=568)
  380 9.577206399  10.6.15.144 → 192.168.1.16 TCP 66 22 → 59298 [ACK] Seq=99357 Ack=33349 Win=1452 Len=0 TSval=4167526 TSecr=3571196
  381 9.613230103  10.6.15.144 → 192.168.1.16 SSH 598 Server: Encrypted packet (len=532)
  382 9.618166530  10.6.15.144 → 192.168.1.16 SSH 630 Server: Encrypted packet (len=564)
  383 9.618238575 192.168.1.16 → 10.6.15.144  TCP 66 59298 → 22 [ACK] Seq=33917 Ack=100453 Win=3666 Len=0 TSval=3571209 TSecr=4167535
  384 9.620393434  10.6.15.144 → 192.168.1.16 SSH 166 Server: Encrypted packet (len=100)
  385 9.620709407 192.168.1.16 → 10.6.15.144  SSH 134 Client: Encrypted packet (len=68)
  386 9.628443898  10.6.15.144 → 192.168.1.16 SSH 1066 Server: Encrypted packet (len=1000)
  387 9.630222500  10.6.15.144 → 192.168.1.16 SSH 222 Server: Encrypted packet (len=156)
  388 9.630289932 192.168.1.16 → 10.6.15.144  TCP 66 59298 → 22 [ACK] Seq=33985 Ack=101709 Win=3666 Len=0 TSval=3571212 TSecr=4167538
  389 9.630586225 192.168.1.16 → 10.6.15.144  SSH 134 Client: Encrypted packet (len=68)
  390 9.640316402  10.6.15.144 → 192.168.1.16 TCP 66 22 → 59298 [ACK] Seq=101709 Ack=34053 Win=1452 Len=0 TSval=4167542 TSecr=3571210
  391 9.656758680 192.168.1.16 → 10.6.15.144  SSH 110 Client: Encrypted packet (len=44)
  392 9.667588141  10.6.15.144 → 192.168.1.16 SSH 238 Server: Encrypted packet (len=172)
  393 9.667869741 192.168.1.16 → 10.6.15.144  SSH 134 Client: Encrypted packet (len=68)
  394 9.669202267 192.168.1.16 → 10.6.15.144  SSH 230 Client: Encrypted packet (len=164)
  395 9.669721715 192.168.1.16 → 10.6.15.144  SSH 366 Client: Encrypted packet (len=300)
  396 9.678535701  10.6.15.144 → 192.168.1.16 TCP 66 22 → 59298 [ACK] Seq=101881 Ack=34329 Win=1452 Len=0 TSval=4167551 TSecr=3571222
  397 9.680597327  10.6.15.144 → 192.168.1.16 SSH 1514 Server: Encrypted packet (len=1448)
  398 9.680810325  10.6.15.144 → 192.168.1.16 SSH 1514 Server: Encrypted packet (len=1448)
  399 9.680822323 192.168.1.16 → 10.6.15.144  TCP 66 59298 → 22 [ACK] Seq=34629 Ack=104777 Win=3666 Len=0 TSval=3571225 TSecr=4167552
  400 9.681021008  10.6.15.144 → 192.168.1.16 SSH 1514 Server: Encrypted packet (len=1448)
  401 9.691457066  10.6.15.144 → 192.168.1.16 SSH 1514 Server: Encrypted packet (len=1448)
  402 9.691472063 192.168.1.16 → 10.6.15.144  TCP 66 59298 → 22 [ACK] Seq=34629 Ack=107673 Win=3666 Len=0 TSval=3571228 TSecr=4167552
  403 9.691664129  10.6.15.144 → 192.168.1.16 SSH 1514 Server: Encrypted packet (len=1448)
  404 9.702157335  10.6.15.144 → 192.168.1.16 SSH 1514 Server: Encrypted packet (len=1448)
  405 9.702172983 192.168.1.16 → 10.6.15.144  TCP 66 59298 → 22 [ACK] Seq=34629 Ack=110569 Win=3666 Len=0 TSval=3571230 TSecr=4167554
  406 9.702361061  10.6.15.144 → 192.168.1.16 SSH 1514 Server: Encrypted packet (len=1448)
  407 9.713094912  10.6.15.144 → 192.168.1.16 SSH 1514 Server: Encrypted packet (len=1448)
  408 9.713104867 192.168.1.16 → 10.6.15.144  TCP 66 59298 → 22 [ACK] Seq=34629 Ack=113465 Win=3666 Len=0 TSval=3571233 TSecr=4167557
  409 9.713299308  10.6.15.144 → 192.168.1.16 SSH 1514 Server: Encrypted packet (len=1448)
  410 9.724066283  10.6.15.144 → 192.168.1.16 SSH 1514 Server: Encrypted packet (len=1448)
  411 9.724083845 192.168.1.16 → 10.6.15.144  TCP 66 59298 → 22 [ACK] Seq=34629 Ack=116361 Win=3666 Len=0 TSval=3571236 TSecr=4167560
  412 9.724276800  10.6.15.144 → 192.168.1.16 SSH 1514 Server: Encrypted packet (len=1448)
  413 9.734087089  10.6.15.144 → 192.168.1.16 SSH 1514 Server: Encrypted packet (len=1448)
  414 9.734106654 192.168.1.16 → 10.6.15.144  TCP 66 59298 → 22 [ACK] Seq=34629 Ack=119257 Win=3666 Len=0 TSval=3571238 TSecr=4167562
  415 9.734128062  10.6.15.144 → 192.168.1.16 SSH 98 Server: Encrypted packet (len=32)
  416 9.774905891 192.168.1.16 → 10.6.15.144  TCP 66 59298 → 22 [ACK] Seq=34629 Ack=119289 Win=3666 Len=0 TSval=3571249 TSecr=4167565
  417 9.888176135  10.6.15.144 → 192.168.1.16 SSH 446 Server: Encrypted packet (len=380)
  418 9.888194520  10.6.15.144 → 192.168.1.16 SSH 134 Server: Encrypted packet (len=68)
  419 9.888233465 192.168.1.16 → 10.6.15.144  TCP 66 59298 → 22 [ACK] Seq=34629 Ack=119737 Win=3666 Len=0 TSval=3571277 TSecr=4167582
  420 9.888245683  10.6.15.144 → 192.168.1.16 SSH 350 Server: Encrypted packet (len=284)
  421 9.888294823 192.168.1.16 → 10.6.15.144  TCP 66 59298 → 22 [ACK] Seq=34629 Ack=120021 Win=3666 Len=0 TSval=3571277 TSecr=4167582
  422 9.888428675  10.6.15.144 → 192.168.1.16 SSH 214 Server: Encrypted packet (len=148)
  423 9.888454420 192.168.1.16 → 10.6.15.144  TCP 66 59298 → 22 [ACK] Seq=34629 Ack=120169 Win=3666 Len=0 TSval=3571277 TSecr=4167590
  424 9.888463966  10.6.15.144 → 192.168.1.16 SSH 214 Server: [TCP Spurious Retransmission] , Encrypted packet (len=148)
  425 9.888469814 192.168.1.16 → 10.6.15.144  TCP 78 [TCP Dup ACK 423#1] 59298 → 22 [ACK] Seq=34629 Ack=120169 Win=3666 Len=0 TSval=3571277 TSecr=4167602 SLE=120021 SRE=120169
  426 9.888878445 192.168.1.16 → 10.6.15.144  SSH 126 Client: Encrypted packet (len=60)
  427 9.889836441 192.168.1.16 → 10.6.15.144  SSH 134 Client: Encrypted packet (len=68)
  428 9.891110131 192.168.1.16 → 10.6.15.144  SSH 790 Client: Encrypted packet (len=724)
  429 9.899264422  10.6.15.144 → 192.168.1.16 SSH 110 Server: Encrypted packet (len=44)
  430 9.899660880 192.168.1.16 → 10.6.15.144  SSH 406 Client: Encrypted packet (len=340)
  431 9.900597329  10.6.15.144 → 192.168.1.16 TCP 66 22 → 59298 [ACK] Seq=120213 Ack=34757 Win=1452 Len=0 TSval=4167606 TSecr=3571277
  432 9.909491056  10.6.15.144 → 192.168.1.16 TCP 66 22 → 59298 [ACK] Seq=120213 Ack=35821 Win=1452 Len=0 TSval=4167609 TSecr=3571278
  433 9.969479272  10.6.15.144 → 192.168.1.16 SSH 166 Server: Encrypted packet (len=100)
  434 9.969770037 192.168.1.16 → 10.6.15.144  SSH 126 Client: Encrypted packet (len=60)
  435 9.970244778  10.6.15.144 → 192.168.1.16 SSH 134 Server: Encrypted packet (len=68)
  436 9.972001908  10.6.15.144 → 192.168.1.16 SSH 406 Server: Encrypted packet (len=340)
  437 9.972034810 192.168.1.16 → 10.6.15.144  TCP 66 59298 → 22 [ACK] Seq=35881 Ack=120721 Win=3666 Len=0 TSval=3571298 TSecr=4167624
  438 10.199036992 192.168.1.16 → 10.6.15.144  TCP 126 [TCP Retransmission] 59298 → 22 [PSH, ACK] Seq=35821 Ack=120721 Win=3666 Len=60 TSval=3571353 TSecr=4167624
  439 10.199790676  10.6.15.144 → 192.168.1.16 TCP 66 22 → 59298 [ACK] Seq=120721 Ack=35881 Win=1452 Len=0 TSval=4167637 TSecr=3571297
  440 10.209178824  10.6.15.144 → 192.168.1.16 TCP 78 [TCP Dup ACK 439#1] 22 → 59298 [ACK] Seq=120721 Ack=35881 Win=1452 Len=0 TSval=4167684 TSecr=3571353 SLE=35821 SRE=35881
  441 10.220970227  10.6.15.144 → 192.168.1.16 SSH 390 Server: Encrypted packet (len=324)
  442 10.262909644 192.168.1.16 → 10.6.15.144  TCP 66 59298 → 22 [ACK] Seq=35881 Ack=121045 Win=3666 Len=0 TSval=3571371 TSecr=4167687
  443 10.511735617 10.22.18.209 → 224.0.0.252  LLMNR 64 Standard query 0xfb5c A wpad
  444 10.511798345 10.22.18.209 → 224.0.0.252  LLMNR 64 Standard query 0xfb5c A wpad
  445 10.823896345  10.6.15.144 → 192.168.1.16 SSH 534 Server: Encrypted packet (len=468)
  446 10.823921636 192.168.1.16 → 10.6.15.144  TCP 66 59298 → 22 [ACK] Seq=35881 Ack=121513 Win=3666 Len=0 TSval=3571511 TSecr=4167804
  447 10.824938251 192.168.1.16 → 10.6.15.144  SSH 206 Client: Encrypted packet (len=140)
  448 10.826347662 192.168.1.16 → 10.6.15.144  SSH 222 Client: Encrypted packet (len=156)
  449 10.826631857 192.168.1.16 → 10.6.15.144  SSH 382 Client: Encrypted packet (len=316)
  450 10.835350730  10.6.15.144 → 192.168.1.16 TCP 66 22 → 59298 [ACK] Seq=121513 Ack=36021 Win=1452 Len=0 TSval=4167840 TSecr=3571511
  451 10.836277760  10.6.15.144 → 192.168.1.16 TCP 66 22 → 59298 [ACK] Seq=121513 Ack=36177 Win=1452 Len=0 TSval=4167841 TSecr=3571511
  452 10.836378811  10.6.15.144 → 192.168.1.16 TCP 66 22 → 59298 [ACK] Seq=121513 Ack=36493 Win=1452 Len=0 TSval=4167841 TSecr=3571511
  453 11.136164974  10.6.15.144 → 192.168.1.16 SSH 414 Server: Encrypted packet (len=348)
  454 11.136242445  10.6.15.144 → 192.168.1.16 SSH 134 Server: Encrypted packet (len=68)
  455 11.136269017 192.168.1.16 → 10.6.15.144  TCP 66 59298 → 22 [ACK] Seq=36493 Ack=121929 Win=3666 Len=0 TSval=3571589 TSecr=4167897
  456 11.136431892  10.6.15.144 → 192.168.1.16 SSH 350 Server: Encrypted packet (len=284)
  457 11.136535564 192.168.1.16 → 10.6.15.144  SSH 126 Client: Encrypted packet (len=60)
  458 11.146303188  10.6.15.144 → 192.168.1.16 TCP 66 22 → 59298 [ACK] Seq=122213 Ack=36553 Win=1452 Len=0 TSval=4167918 TSecr=3571589
  459 11.147538104 192.168.1.16 → 10.6.15.144  SSH 246 Client: Encrypted packet (len=180)
  460 11.148116100 192.168.1.16 → 10.6.15.144  SSH 1062 Client: Encrypted packet (len=996)
  461 11.157092750  10.6.15.144 → 192.168.1.16 TCP 66 22 → 59298 [ACK] Seq=122213 Ack=36733 Win=1452 Len=0 TSval=4167921 TSecr=3571592
  462 11.158815160  10.6.15.144 → 192.168.1.16 TCP 66 22 → 59298 [ACK] Seq=122213 Ack=37729 Win=1452 Len=0 TSval=4167921 TSecr=3571592
  463 11.161461919 192.168.1.16 → 10.6.15.144  SSH 302 Client: Encrypted packet (len=236)
  464 11.171162490  10.6.15.144 → 192.168.1.16 TCP 66 22 → 59298 [ACK] Seq=122213 Ack=37965 Win=1452 Len=0 TSval=4167924 TSecr=3571595
  465 11.228132248  10.6.15.144 → 192.168.1.16 SSH 126 Server: Encrypted packet (len=60)
  466 11.228157275  10.6.15.144 → 192.168.1.16 SSH 102 Server: Encrypted packet (len=36)
  467 11.228220411 192.168.1.16 → 10.6.15.144  TCP 66 59298 → 22 [ACK] Seq=37965 Ack=122309 Win=3666 Len=0 TSval=3571612 TSecr=4167939
  468 11.449791350  10.6.15.144 → 192.168.1.16 SSH 350 Server: Encrypted packet (len=284)
  469 11.449860338  10.6.15.144 → 192.168.1.16 SSH 630 Server: Encrypted packet (len=564)
  470 11.449912058  10.6.15.144 → 192.168.1.16 SSH 350 Server: Encrypted packet (len=284)
  471 11.449919219 192.168.1.16 → 10.6.15.144  TCP 66 59298 → 22 [ACK] Seq=37965 Ack=123157 Win=3666 Len=0 TSval=3571667 TSecr=4167976
  472 11.490943435 192.168.1.16 → 10.6.15.144  TCP 66 59298 → 22 [ACK] Seq=37965 Ack=123441 Win=3666 Len=0 TSval=3571678 TSecr=4167981
  473 12.071038886 192.168.1.16 → 10.6.15.144  SSH 138 Client: Encrypted packet (len=72)
  474 12.071339417 192.168.1.16 → 10.6.15.144  SSH 798 Client: Encrypted packet (len=732)
  475 12.081143835  10.6.15.144 → 192.168.1.16 TCP 66 22 → 59298 [ACK] Seq=123441 Ack=38037 Win=1452 Len=0 TSval=4168152 TSecr=3571804
  476 12.081259927  10.6.15.144 → 192.168.1.16 SSH 102 Server: Encrypted packet (len=36)
  477 12.081287538 192.168.1.16 → 10.6.15.144  TCP 66 59298 → 22 [ACK] Seq=38769 Ack=123477 Win=3666 Len=0 TSval=3571825 TSecr=4168152
  478 12.124153733  10.6.15.144 → 192.168.1.16 TCP 66 22 → 59298 [ACK] Seq=123477 Ack=38769 Win=1452 Len=0 TSval=4168162 TSecr=3571823
  479 12.388023719  10.6.15.144 → 192.168.1.16 SSH 454 Server: Encrypted packet (len=388)
  480 12.388064335 192.168.1.16 → 10.6.15.144  TCP 66 59298 → 22 [ACK] Seq=38769 Ack=123865 Win=3666 Len=0 TSval=3571902 TSecr=4168214
  481 13.370994223 192.168.1.16 → 91.189.91.157 NTP 90 NTP Version 4, client
  482 15.628960997  10.6.15.144 → 192.168.1.16 SSH 126 Server: Encrypted packet (len=60)
  483 15.628996895 192.168.1.16 → 10.6.15.144  TCP 66 59298 → 22 [ACK] Seq=38769 Ack=123925 Win=3666 Len=0 TSval=3572712 TSecr=4168710
  484 15.630051225  10.6.15.144 → 192.168.1.16 SSH 102 Server: Encrypted packet (len=36)
  485 15.630073607 192.168.1.16 → 10.6.15.144  TCP 66 59298 → 22 [ACK] Seq=38769 Ack=123961 Win=3666 Len=0 TSval=3572712 TSecr=4168710
  486 15.630106448  10.6.15.144 → 192.168.1.16 SSH 126 Server: Encrypted packet (len=60)
  487 15.630116917 192.168.1.16 → 10.6.15.144  TCP 66 59298 → 22 [ACK] Seq=38769 Ack=124021 Win=3666 Len=0 TSval=3572712 TSecr=4168719
  488 15.630128680  10.6.15.144 → 192.168.1.16 SSH 102 Server: Encrypted packet (len=36)
  489 15.630132895 192.168.1.16 → 10.6.15.144  TCP 66 59298 → 22 [ACK] Seq=38769 Ack=124057 Win=3666 Len=0 TSval=3572712 TSecr=4168719
  490 15.630144326  10.6.15.144 → 192.168.1.16 SSH 354 Server: Encrypted packet (len=288)
  491 15.630149844 192.168.1.16 → 10.6.15.144  TCP 66 59298 → 22 [ACK] Seq=38769 Ack=124345 Win=3666 Len=0 TSval=3572712 TSecr=4168747
  492 15.630196873  10.6.15.144 → 192.168.1.16 SSH 546 Server: [TCP Spurious Retransmission] , Encrypted packet (len=480)
  493 15.630205784 192.168.1.16 → 10.6.15.144  TCP 78 [TCP Dup ACK 491#1] 59298 → 22 [ACK] Seq=38769 Ack=124345 Win=3666 Len=0 TSval=3572712 TSecr=4168811 SLE=123865 SRE=124345
  494 15.630277921  10.6.15.144 → 192.168.1.16 SSH 546 Server: [TCP Spurious Retransmission] , Encrypted packet (len=480)
  495 15.630285433 192.168.1.16 → 10.6.15.144  TCP 78 [TCP Dup ACK 491#2] 59298 → 22 [ACK] Seq=38769 Ack=124345 Win=3666 Len=0 TSval=3572712 TSecr=4168939 SLE=123865 SRE=124345
  496 15.640861658  10.6.15.144 → 192.168.1.16 SSH 162 Server: Encrypted packet (len=96)
  497 15.640883766 192.168.1.16 → 10.6.15.144  TCP 66 59298 → 22 [ACK] Seq=38769 Ack=124441 Win=3666 Len=0 TSval=3572715 TSecr=4169042
  498 17.612921014  10.6.15.144 → 192.168.1.16 SSH 126 Server: Encrypted packet (len=60)
  499 17.612940917 192.168.1.16 → 10.6.15.144  TCP 66 59298 → 22 [ACK] Seq=38769 Ack=124501 Win=3666 Len=0 TSval=3573208 TSecr=4169466
  500 17.612964698  10.6.15.144 → 192.168.1.16 SSH 102 Server: Encrypted packet (len=36)
  501 17.612973326 192.168.1.16 → 10.6.15.144  TCP 66 59298 → 22 [ACK] Seq=38769 Ack=124537 Win=3666 Len=0 TSval=3573208 TSecr=4169466
  502 17.770983925 192.168.1.16 → 54.76.71.168 TCP 66 42414 → 8282 [ACK] Seq=1 Ack=1 Win=296 Len=0 TSval=3573248 TSecr=607673527
  503 18.605889137 54.76.71.168 → 192.168.1.16 TCP 66 [TCP ACKed unseen segment] 8282 → 42414 [ACK] Seq=1 Ack=2 Win=121 Len=0 TSval=607685226 TSecr=3561550
  504 18.605916355 10.22.18.209 → 224.0.0.252  LLMNR 64 Standard query 0x6833 A wpad
  505 18.605940488 10.22.18.209 → 224.0.0.252  LLMNR 64 Standard query 0x6833 A wpad
  506 19.622829253 192.168.1.16 → 10.6.15.144  SSH 1310 Client: Encrypted packet (len=1244)
  507 19.633715710  10.6.15.144 → 192.168.1.16 TCP 66 22 → 59298 [ACK] Seq=124537 Ack=40013 Win=1452 Len=0 TSval=4170040 TSecr=3573710
  508 19.636192743  10.6.15.144 → 192.168.1.16 SSH 142 Server: Encrypted packet (len=76)
  509 19.636211271 192.168.1.16 → 10.6.15.144  TCP 66 59298 → 22 [ACK] Seq=40013 Ack=124613 Win=3666 Len=0 TSval=3573714 TSecr=4170041
  510 19.727336227  10.6.15.144 → 192.168.1.16 SSH 230 Server: Encrypted packet (len=164)
  511 19.727373593 192.168.1.16 → 10.6.15.144  TCP 66 59298 → 22 [ACK] Seq=40013 Ack=124777 Win=3666 Len=0 TSval=3573737 TSecr=4170063
  512 19.729279223  10.6.15.144 → 192.168.1.16 SSH 1222 Server: Encrypted packet (len=1156)
  513 19.729316339 192.168.1.16 → 10.6.15.144  TCP 66 59298 → 22 [ACK] Seq=40013 Ack=125933 Win=3666 Len=0 TSval=3573737 TSecr=4170064
  514 19.730522888 192.168.1.16 → 10.6.15.144  SSH 134 Client: Encrypted packet (len=68)
  515 19.733937287 192.168.1.16 → 10.6.15.144  SSH 1514 Client: Encrypted packet (len=1448)
  516 19.734861744 192.168.1.16 → 10.6.15.144  SSH 302 Client: Encrypted packet (len=236)
  517 19.744675395  10.6.15.144 → 192.168.1.16 TCP 66 22 → 59298 [ACK] Seq=125933 Ack=41765 Win=1452 Len=0 TSval=4170068 TSecr=3573737
  518 20.366009405 192.168.1.16 → 224.0.0.251  MDNS 104 Standard query 0x0000 PTR _nmea-0183._tcp.local, "QM" question PTR _ipp._tcp.local, "QM" question PTR _ipps._tcp.local, "QM" question
  519 20.367992208  10.6.15.144 → 192.168.1.16 SSH 158 Server: Encrypted packet (len=92)
  520 20.368110412  10.6.15.144 → 192.168.1.16 SSH 886 Server: Encrypted packet (len=820)
  521 20.368128560 192.168.1.16 → 10.6.15.144  TCP 66 59298 → 22 [ACK] Seq=41765 Ack=126845 Win=3666 Len=0 TSval=3573897 TSecr=4170099
  522 20.368182038  10.6.15.144 → 192.168.1.16 SSH 542 Server: Encrypted packet (len=476)
  523 20.368361431  10.6.15.144 → 192.168.1.16 SSH 134 Server: Encrypted packet (len=68)
  524 20.368389817 192.168.1.16 → 10.6.15.144  TCP 66 59298 → 22 [ACK] Seq=41765 Ack=127389 Win=3666 Len=0 TSval=3573897 TSecr=4170100
  525 20.368734215 192.168.1.16 → 10.6.15.144  SSH 134 Client: Encrypted packet (len=68)
  526 20.416022482  10.6.15.144 → 192.168.1.16 TCP 66 22 → 59298 [ACK] Seq=127389 Ack=41833 Win=1452 Len=0 TSval=4170236 TSecr=3573897
  527 20.814876654 fe80::60bd:1940:a0d8:49f9 → ff02::fb     MDNS 124 Standard query 0x0000 PTR _nmea-0183._tcp.local, "QM" question PTR _ipp._tcp.local, "QM" question PTR _ipps._tcp.local, "QM" question
  528 21.288952656 192.168.1.16 → 123.108.200.124 NTP 90 NTP Version 4, client
  529 21.290709275  10.22.17.98 → 224.0.0.252  LLMNR 64 Standard query 0xa80c A wpad
  530 21.350357091  10.22.17.98 → 224.0.0.252  LLMNR 64 Standard query 0xa80c A wpad
  531 23.288985365 192.168.1.16 → 13.126.27.131 NTP 90 NTP Version 4, client
  532 23.303493766 10.119.73.122 → 192.168.1.16 ICMP 110 Destination unreachable (Communication administratively filtered)
  533 25.288992517 192.168.1.16 → 13.126.27.131 NTP 90 NTP Version 4, client
  534 26.145237905 192.168.1.16 → 10.6.15.144  SSH 138 Client: Encrypted packet (len=72)
  535 26.146588492 192.168.1.16 → 10.6.15.144  SSH 966 Client: Encrypted packet (len=900)
  536 26.148604764 192.168.1.16 → 10.6.15.144  SSH 1174 Client: Encrypted packet (len=1108)
  537 26.148738768 10.22.18.209 → 224.0.0.252  LLMNR 64 Standard query 0xcf4f A wpad
  538 26.155659948  10.6.15.144 → 192.168.1.16 TCP 66 22 → 59298 [ACK] Seq=127389 Ack=41905 Win=1452 Len=0 TSval=4171671 TSecr=3575341
  539 26.155680995  10.6.15.144 → 192.168.1.16 SSH 102 Server: Encrypted packet (len=36)
  540 26.158182135  10.6.15.144 → 192.168.1.16 SSH 282 Server: Encrypted packet (len=216)
  541 26.158255926 192.168.1.16 → 10.6.15.144  TCP 66 59298 → 22 [ACK] Seq=43913 Ack=127641 Win=3666 Len=0 TSval=3575344 TSecr=4171671
  542 26.171273219 10.22.18.209 → 224.0.0.252  LLMNR 64 Standard query 0xcf4f A wpad
  543 26.195396672  10.6.15.144 → 192.168.1.16 TCP 66 22 → 59298 [ACK] Seq=127641 Ack=43913 Win=1452 Len=0 TSval=4171681 TSecr=3575342
