    1 0.000000000  10.6.15.144 → 192.168.1.16 SSH 438 Server: Encrypted packet (len=372)
    2 0.000082970 192.168.1.16 → 10.6.15.144  TCP 66 59298 → 22 [ACK] Seq=1 Ack=373 Win=5703 Len=0 TSval=4999630 TSecr=5595987
    3 1.287941524  10.6.15.144 → 192.168.1.16 SSH 1514 Server: Encrypted packet (len=1448)
    4 1.287966668 192.168.1.16 → 10.6.15.144  TCP 66 59298 → 22 [ACK] Seq=1 Ack=1821 Win=5703 Len=0 TSval=4999952 TSecr=5596019
    5 1.288036223  10.6.15.144 → 192.168.1.16 SSH 1334 Server: Encrypted packet (len=1268)
    6 1.288041306 192.168.1.16 → 10.6.15.144  TCP 66 59298 → 22 [ACK] Seq=1 Ack=3089 Win=5703 Len=0 TSval=4999952 TSecr=5596019
    7 1.288248514  10.6.15.144 → 192.168.1.16 SSH 1514 Server: Encrypted packet (len=1448)
    8 1.288255378 192.168.1.16 → 10.6.15.144  TCP 66 59298 → 22 [ACK] Seq=1 Ack=4537 Win=5703 Len=0 TSval=4999952 TSecr=5596019
    9 1.288580948  10.6.15.144 → 192.168.1.16 SSH 1514 Server: Encrypted packet (len=1448)
   10 1.288589442 192.168.1.16 → 10.6.15.144  TCP 66 59298 → 22 [ACK] Seq=1 Ack=5985 Win=5703 Len=0 TSval=4999952 TSecr=5596033
   11 1.288772584  10.6.15.144 → 192.168.1.16 TCP 1514 [TCP Out-Of-Order] 22 → 59298 [ACK] Seq=373 Ack=1 Win=1452 Len=1448 TSval=5596106 TSecr=4999630
   12 1.288780274 192.168.1.16 → 10.6.15.144  TCP 78 [TCP Dup ACK 10#1] 59298 → 22 [ACK] Seq=1 Ack=5985 Win=5703 Len=0 TSval=4999952 TSecr=5596033 SLE=373 SRE=1821
   13 1.288964466  10.6.15.144 → 192.168.1.16 TCP 1514 [TCP Out-Of-Order] 22 → 59298 [ACK] Seq=373 Ack=1 Win=1452 Len=1448 TSval=5596252 TSecr=4999630
   14 1.288972379 192.168.1.16 → 10.6.15.144  TCP 78 [TCP Dup ACK 10#2] 59298 → 22 [ACK] Seq=1 Ack=5985 Win=5703 Len=0 TSval=4999952 TSecr=5596033 SLE=373 SRE=1821
   15 1.299639296  10.6.15.144 → 192.168.1.16 SSH 1514 Server: Encrypted packet (len=1448)
   16 1.299659220 192.168.1.16 → 10.6.15.144  TCP 66 59298 → 22 [ACK] Seq=1 Ack=7433 Win=5703 Len=0 TSval=4999955 TSecr=5596312
   17 1.299810777  10.6.15.144 → 192.168.1.16 SSH 1514 Server: Encrypted packet (len=1448)
   18 1.299816835 192.168.1.16 → 10.6.15.144  TCP 66 59298 → 22 [ACK] Seq=1 Ack=8881 Win=5703 Len=0 TSval=4999955 TSecr=5596312
   19 1.310479331  10.6.15.144 → 192.168.1.16 SSH 1514 Server: [TCP Previous segment not captured] , Encrypted packet (len=1448)
   20 1.310502578 192.168.1.16 → 10.6.15.144  TCP 78 [TCP Dup ACK 18#1] 59298 → 22 [ACK] Seq=1 Ack=8881 Win=5703 Len=0 TSval=4999958 TSecr=5596312 SLE=10329 SRE=11777
   21 1.310658715  10.6.15.144 → 192.168.1.16 SSH 1514 Server: Encrypted packet (len=1448)
   22 1.310667467 192.168.1.16 → 10.6.15.144  TCP 78 [TCP Dup ACK 18#2] 59298 → 22 [ACK] Seq=1 Ack=8881 Win=5703 Len=0 TSval=4999958 TSecr=5596312 SLE=10329 SRE=13225
   23 1.320848254  10.6.15.144 → 192.168.1.16 SSH 1514 Server: Encrypted packet (len=1448)
   24 1.320872167 192.168.1.16 → 10.6.15.144  TCP 78 [TCP Dup ACK 18#3] 59298 → 22 [ACK] Seq=1 Ack=8881 Win=5703 Len=0 TSval=4999960 TSecr=5596312 SLE=10329 SRE=14673
   25 1.321025930  10.6.15.144 → 192.168.1.16 SSH 1514 Server: Encrypted packet (len=1448)
   26 1.321034764 192.168.1.16 → 10.6.15.144  TCP 78 [TCP Dup ACK 18#4] 59298 → 22 [ACK] Seq=1 Ack=8881 Win=5703 Len=0 TSval=4999960 TSecr=5596312 SLE=10329 SRE=16121
   27 1.330475979  10.6.15.144 → 192.168.1.16 SSH 1514 Server: [TCP Fast Retransmission] , Encrypted packet (len=1448)
   28 1.330507957 192.168.1.16 → 10.6.15.144  TCP 66 59298 → 22 [ACK] Seq=1 Ack=16121 Win=5703 Len=0 TSval=4999963 TSecr=5596320
   29 1.330784197  10.6.15.144 → 192.168.1.16 SSH 1514 Server: Encrypted packet (len=1448)
   30 1.330788979 192.168.1.16 → 10.6.15.144  TCP 66 59298 → 22 [ACK] Seq=1 Ack=17569 Win=5703 Len=0 TSval=4999963 TSecr=5596320
   31 1.334041710 192.168.1.16 → 10.6.15.144  SSH 550 Client: Encrypted packet (len=484)
   32 1.340172685  10.6.15.144 → 192.168.1.16 SSH 1514 Server: Encrypted packet (len=1448)
   33 1.340356142  10.6.15.144 → 192.168.1.16 SSH 1514 Server: Encrypted packet (len=1448)
   34 1.340364571 192.168.1.16 → 10.6.15.144  TCP 66 59298 → 22 [ACK] Seq=485 Ack=20465 Win=5703 Len=0 TSval=4999965 TSecr=5596322
   35 1.340545645  10.6.15.144 → 192.168.1.16 SSH 1514 Server: Encrypted packet (len=1448)
   36 1.342851502 192.168.1.16 → 10.6.15.144  SSH 230 Client: Encrypted packet (len=164)
   37 1.343072082 192.168.1.16 → 10.6.15.144  SSH 1514 Client: Encrypted packet (len=1448)
   38 1.343509217 192.168.1.16 → 10.6.15.144  SSH 470 Client: Encrypted packet (len=404)
   39 1.351150220  10.6.15.144 → 192.168.1.16 SSH 1514 Server: Encrypted packet (len=1448)
   40 1.351331642  10.6.15.144 → 192.168.1.16 SSH 1514 Server: Encrypted packet (len=1448)
   41 1.351339209 192.168.1.16 → 10.6.15.144  TCP 66 59298 → 22 [ACK] Seq=2501 Ack=24809 Win=5703 Len=0 TSval=4999968 TSecr=5596325
   42 1.353642440  10.6.15.144 → 192.168.1.16 SSH 1514 Server: Encrypted packet (len=1448)
   43 1.353739583  10.6.15.144 → 192.168.1.16 TCP 66 22 → 59298 [ACK] Seq=26257 Ack=2501 Win=1452 Len=0 TSval=5596326 TSecr=4999966
   44 1.361399221  10.6.15.144 → 192.168.1.16 SSH 518 Server: Encrypted packet (len=452)
   45 1.361420316 192.168.1.16 → 10.6.15.144  TCP 66 59298 → 22 [ACK] Seq=2501 Ack=26709 Win=5703 Len=0 TSval=4999970 TSecr=5596325
   46 1.987763352 192.168.1.16 → 13.126.27.131 NTP 90 NTP Version 4, client
   47 1.989520863  10.6.15.144 → 192.168.1.16 SSH 998 Server: Encrypted packet (len=932)
   48 1.989660980  10.6.15.144 → 192.168.1.16 SSH 414 Server: Encrypted packet (len=348)
   49 1.989677885 192.168.1.16 → 10.6.15.144  TCP 66 59298 → 22 [ACK] Seq=2501 Ack=27989 Win=5703 Len=0 TSval=5000127 TSecr=5596359
   50 1.989809769 10.22.17.200 → 224.0.0.252  LLMNR 64 Standard query 0x4af6 A wpad
   51 1.989946569 10.22.17.200 → 224.0.0.252  LLMNR 64 Standard query 0x88fd AAAA wpad
   52 1.990123904  10.6.15.144 → 192.168.1.16 SSH 414 Server: [TCP Spurious Retransmission] , Encrypted packet (len=348)
   53 1.990132935 192.168.1.16 → 10.6.15.144  TCP 78 [TCP Dup ACK 49#1] 59298 → 22 [ACK] Seq=2501 Ack=27989 Win=5703 Len=0 TSval=5000128 TSecr=5596415 SLE=27641 SRE=27989
   54 1.990192546 192.168.1.16 → 10.6.15.144  SSH 134 Client: Encrypted packet (len=68)
   55 1.990386085  10.6.15.144 → 192.168.1.16 SSH 950 Server: Encrypted packet (len=884)
   56 1.990501101 10.22.17.200 → 224.0.0.252  LLMNR 64 Standard query 0x4af6 A wpad
   57 1.990640254 10.22.17.200 → 224.0.0.252  LLMNR 64 Standard query 0x88fd AAAA wpad
   58 1.992039576 192.168.1.16 → 10.6.15.144  SSH 222 Client: Encrypted packet (len=156)
   59 1.993487736 192.168.1.16 → 10.6.15.144  SSH 1246 Client: Encrypted packet (len=1180)
   60 2.002167740  10.6.15.144 → 192.168.1.16 TCP 66 22 → 59298 [ACK] Seq=28873 Ack=2725 Win=1452 Len=0 TSval=5596488 TSecr=5000128
   61 2.041724693  10.6.15.144 → 192.168.1.16 TCP 66 22 → 59298 [ACK] Seq=28873 Ack=3905 Win=1452 Len=0 TSval=5596498 TSecr=5000128
   62 2.074764356 192.168.1.16 → 10.6.15.144  SSH 190 Client: Encrypted packet (len=124)
   63 2.075469981 192.168.1.16 → 10.6.15.144  SSH 142 Client: Encrypted packet (len=76)
   64 2.084723241  10.6.15.144 → 192.168.1.16 TCP 66 22 → 59298 [ACK] Seq=28873 Ack=4029 Win=1452 Len=0 TSval=5596508 TSecr=5000149
   65 2.084852812  10.6.15.144 → 192.168.1.16 TCP 66 22 → 59298 [ACK] Seq=28873 Ack=4105 Win=1452 Len=0 TSval=5596508 TSecr=5000149
   66 2.090474418  10.6.15.144 → 192.168.1.16 SSH 142 Server: Encrypted packet (len=76)
   67 2.120852250  10.6.15.144 → 192.168.1.16 SSH 638 Server: Encrypted packet (len=572)
   68 2.120913143 192.168.1.16 → 10.6.15.144  TCP 66 59298 → 22 [ACK] Seq=4105 Ack=29521 Win=5703 Len=0 TSval=5000160 TSecr=5596509
   69 2.122364517  10.6.15.144 → 192.168.1.16 SSH 590 Server: Encrypted packet (len=524)
   70 2.123351843 192.168.1.16 → 10.6.15.144  SSH 134 Client: Encrypted packet (len=68)
   71 2.130778443  10.6.15.144 → 192.168.1.16 SSH 582 Server: Encrypted packet (len=516)
   72 2.131596362 192.168.1.16 → 10.6.15.144  SSH 134 Client: Encrypted packet (len=68)
   73 2.141717044  10.6.15.144 → 192.168.1.16 TCP 66 22 → 59298 [ACK] Seq=30561 Ack=4241 Win=1452 Len=0 TSval=5596523 TSecr=5000161
   74 2.153500174 192.168.1.16 → 10.6.15.144  SSH 1350 Client: Encrypted packet (len=1284)
   75 2.197154578 192.168.1.16 → 10.6.15.144  SSH 686 Client: Encrypted packet (len=620)
   76 2.205654382  10.6.15.144 → 192.168.1.16 TCP 66 22 → 59298 [ACK] Seq=30561 Ack=5525 Win=1452 Len=0 TSval=5596539 TSecr=5000168
   77 2.208056062  10.6.15.144 → 192.168.1.16 TCP 66 22 → 59298 [ACK] Seq=30561 Ack=6145 Win=1452 Len=0 TSval=5596539 TSecr=5000179
   78 2.234345437 192.168.1.16 → 10.6.15.144  SSH 958 Client: Encrypted packet (len=892)
   79 2.242488967  10.6.15.144 → 192.168.1.16 TCP 66 22 → 59298 [ACK] Seq=30561 Ack=7037 Win=1452 Len=0 TSval=5596548 TSecr=5000189
   80 2.248172590  10.6.15.144 → 192.168.1.16 SSH 670 Server: Encrypted packet (len=604)
   81 2.274231585 192.168.1.16 → 10.6.15.144  SSH 598 Client: Encrypted packet (len=532)
   82 2.276679051 192.168.1.16 → 10.6.15.144  SSH 446 Client: Encrypted packet (len=380)
   83 2.276923478 192.168.1.16 → 10.6.15.144  SSH 446 Client: Encrypted packet (len=380)
   84 2.277776203  10.6.15.144 → 192.168.1.16 SSH 462 Server: Encrypted packet (len=396)
   85 2.278750129 192.168.1.16 → 10.6.15.144  SSH 534 Client: Encrypted packet (len=468)
   86 2.279598599 192.168.1.16 → 10.6.15.144  SSH 574 Client: Encrypted packet (len=508)
   87 2.288292368 192.168.1.16 → 10.6.15.144  SSH 566 Client: Encrypted packet (len=500)
   88 2.289800685  10.6.15.144 → 192.168.1.16 TCP 66 22 → 59298 [ACK] Seq=31561 Ack=8329 Win=1452 Len=0 TSval=5596559 TSecr=5000199
   89 2.289934790  10.6.15.144 → 192.168.1.16 TCP 66 22 → 59298 [ACK] Seq=31561 Ack=9305 Win=1452 Len=0 TSval=5596560 TSecr=5000200
   90 2.295603756 192.168.1.16 → 10.6.15.144  SSH 1182 Client: Encrypted packet (len=1116)
   91 2.300588272 192.168.1.16 → 10.6.15.144  SSH 1350 Client: Encrypted packet (len=1284)
   92 2.305778520  10.6.15.144 → 192.168.1.16 TCP 66 22 → 59298 [ACK] Seq=31561 Ack=10921 Win=1452 Len=0 TSval=5596564 TSecr=5000202
   93 2.319016499  10.6.15.144 → 192.168.1.16 SSH 294 Server: Encrypted packet (len=228)
   94 2.319831820 192.168.1.16 → 10.6.15.144  SSH 142 Client: Encrypted packet (len=76)
   95 2.321762290  10.6.15.144 → 192.168.1.16 SSH 150 Server: Encrypted packet (len=84)
   96 2.326905076 192.168.1.16 → 10.6.15.144  SSH 414 Client: Encrypted packet (len=348)
   97 2.337078982  10.6.15.144 → 192.168.1.16 TCP 66 22 → 59298 [ACK] Seq=31873 Ack=12629 Win=1452 Len=0 TSval=5596571 TSecr=5000210
   98 2.338058471  10.6.15.144 → 192.168.1.16 SSH 430 Server: Encrypted packet (len=364)
   99 2.345292825  10.6.15.144 → 192.168.1.16 SSH 142 Server: Encrypted packet (len=76)
  100 2.345360096 192.168.1.16 → 10.6.15.144  TCP 66 59298 → 22 [ACK] Seq=12629 Ack=32313 Win=5703 Len=0 TSval=5000216 TSecr=5596571
  101 2.348217539  10.6.15.144 → 192.168.1.16 SSH 734 Server: Encrypted packet (len=668)
  102 2.355637201  10.6.15.144 → 192.168.1.16 SSH 1034 Server: Encrypted packet (len=968)
  103 2.355656122 192.168.1.16 → 10.6.15.144  TCP 66 59298 → 22 [ACK] Seq=12629 Ack=33949 Win=5703 Len=0 TSval=5000219 TSecr=5596574
  104 2.424949245  10.6.15.144 → 192.168.1.16 SSH 462 Server: Encrypted packet (len=396)
  105 2.465751991 192.168.1.16 → 10.6.15.144  TCP 66 59298 → 22 [ACK] Seq=12629 Ack=34345 Win=5703 Len=0 TSval=5000247 TSecr=5596593
  106 2.532388248  10.6.15.144 → 192.168.1.16 SSH 1514 Server: Encrypted packet (len=1448)
  107 2.532408253  10.6.15.144 → 192.168.1.16 SSH 294 Server: Encrypted packet (len=228)
  108 2.532416988 192.168.1.16 → 10.6.15.144  TCP 66 59298 → 22 [ACK] Seq=12629 Ack=36021 Win=5703 Len=0 TSval=5000263 TSecr=5596620
  109 2.532745199  10.6.15.144 → 192.168.1.16 SSH 1514 Server: Encrypted packet (len=1448)
  110 2.545718613  10.6.15.144 → 192.168.1.16 SSH 1514 Server: [TCP Previous segment not captured] , Encrypted packet (len=1448)
  111 2.545739088 192.168.1.16 → 10.6.15.144  TCP 78 59298 → 22 [ACK] Seq=12629 Ack=37469 Win=5703 Len=0 TSval=5000267 TSecr=5596620 SLE=38917 SRE=40365
  112 2.555535540  10.6.15.144 → 192.168.1.16 SSH 1514 Server: Encrypted packet (len=1448)
  113 2.555557352 192.168.1.16 → 10.6.15.144  TCP 78 [TCP Dup ACK 111#1] 59298 → 22 [ACK] Seq=12629 Ack=37469 Win=5703 Len=0 TSval=5000269 TSecr=5596620 SLE=38917 SRE=41813
  114 2.555715602  10.6.15.144 → 192.168.1.16 SSH 1514 Server: Encrypted packet (len=1448)
  115 2.555722978 192.168.1.16 → 10.6.15.144  TCP 78 [TCP Dup ACK 111#2] 59298 → 22 [ACK] Seq=12629 Ack=37469 Win=5703 Len=0 TSval=5000269 TSecr=5596620 SLE=38917 SRE=43261
  116 2.566936742  10.6.15.144 → 192.168.1.16 SSH 1514 Server: Encrypted packet (len=1448)
  117 2.566956025 192.168.1.16 → 10.6.15.144  TCP 78 [TCP Dup ACK 111#3] 59298 → 22 [ACK] Seq=12629 Ack=37469 Win=5703 Len=0 TSval=5000272 TSecr=5596620 SLE=38917 SRE=44709
  118 2.567120758  10.6.15.144 → 192.168.1.16 SSH 1514 Server: [TCP Fast Retransmission] , Encrypted packet (len=1448)
  119 2.567136182 192.168.1.16 → 10.6.15.144  TCP 66 59298 → 22 [ACK] Seq=12629 Ack=44709 Win=5703 Len=0 TSval=5000272 TSecr=5596629
  120 2.577577276  10.6.15.144 → 192.168.1.16 SSH 646 Server: Encrypted packet (len=580)
  121 2.577598540 192.168.1.16 → 10.6.15.144  TCP 66 59298 → 22 [ACK] Seq=12629 Ack=45289 Win=5703 Len=0 TSval=5000274 TSecr=5596631
  122 2.578786295 192.168.1.16 → 10.6.15.144  SSH 134 Client: Encrypted packet (len=68)
  123 2.625966371  10.6.15.144 → 192.168.1.16 TCP 66 22 → 59298 [ACK] Seq=45289 Ack=12697 Win=1452 Len=0 TSval=5596644 TSecr=5000275
  124 2.718455883 192.168.1.16 → 10.6.15.144  SSH 110 Client: Encrypted packet (len=44)
  125 2.720198159 192.168.1.16 → 10.6.15.144  SSH 310 Client: Encrypted packet (len=244)
  126 2.726816854  10.6.15.144 → 192.168.1.16 TCP 66 22 → 59298 [ACK] Seq=45289 Ack=12741 Win=1452 Len=0 TSval=5596669 TSecr=5000310
  127 2.728791165  10.6.15.144 → 192.168.1.16 TCP 66 22 → 59298 [ACK] Seq=45289 Ack=12985 Win=1452 Len=0 TSval=5596670 TSecr=5000310
  128 2.744063734  10.6.15.144 → 192.168.1.16 SSH 110 Server: Encrypted packet (len=44)
  129 2.744642829 192.168.1.16 → 10.6.15.144  SSH 150 Client: Encrypted packet (len=84)
  130 2.792498076  10.6.15.144 → 192.168.1.16 SSH 1514 Server: Encrypted packet (len=1448)
  131 2.792685043  10.6.15.144 → 192.168.1.16 SSH 1514 Server: Encrypted packet (len=1448)
  132 2.792697682 192.168.1.16 → 10.6.15.144  TCP 66 59298 → 22 [ACK] Seq=13069 Ack=48229 Win=5703 Len=0 TSval=5000328 TSecr=5596685
  133 2.792829100  10.6.15.144 → 192.168.1.16 SSH 230 Server: Encrypted packet (len=164)
  134 2.794345107 192.168.1.16 → 10.6.15.144  SSH 334 Client: Encrypted packet (len=268)
  135 2.808116448  10.6.15.144 → 192.168.1.16 SSH 494 Server: Encrypted packet (len=428)
  136 2.848725541  10.6.15.144 → 192.168.1.16 SSH 1514 Server: Encrypted packet (len=1448)
  137 2.848747686 192.168.1.16 → 10.6.15.144  TCP 66 59298 → 22 [ACK] Seq=13337 Ack=50269 Win=5703 Len=0 TSval=5000342 TSecr=5596689
  138 2.848772383  10.6.15.144 → 192.168.1.16 SSH 662 Server: Encrypted packet (len=596)
  139 2.850875928 192.168.1.16 → 10.6.15.144  SSH 134 Client: Encrypted packet (len=68)
  140 2.900438447  10.6.15.144 → 192.168.1.16 TCP 66 22 → 59298 [ACK] Seq=50865 Ack=13405 Win=1452 Len=0 TSval=5596713 TSecr=5000343
  141 3.127195893 192.168.1.16 → 10.6.15.144  SSH 1514 Client: Encrypted packet (len=1448)
  142 3.129139886 192.168.1.16 → 10.6.15.144  SSH 1166 Client: Encrypted packet (len=1100)
  143 3.139195611  10.6.15.144 → 192.168.1.16 TCP 66 22 → 59298 [ACK] Seq=50865 Ack=15953 Win=1452 Len=0 TSval=5596772 TSecr=5000412
  144 4.296162709  10.6.15.144 → 192.168.1.16 SSH 1514 Server: Encrypted packet (len=1448)
  145 4.296270267  10.6.15.144 → 192.168.1.16 SSH 1514 Server: Encrypted packet (len=1448)
  146 4.296293464 192.168.1.16 → 10.6.15.144  TCP 66 59298 → 22 [ACK] Seq=15953 Ack=53761 Win=5703 Len=0 TSval=5000704 TSecr=5596863
  147 4.296321056  10.6.15.144 → 192.168.1.16 SSH 286 Server: Encrypted packet (len=220)
  148 4.296682481  10.6.15.144 → 192.168.1.16 SSH 1514 Server: Encrypted packet (len=1448)
  149 4.296699653 192.168.1.16 → 10.6.15.144  TCP 66 59298 → 22 [ACK] Seq=15953 Ack=55429 Win=5703 Len=0 TSval=5000704 TSecr=5596863
  150 4.296877515  10.6.15.144 → 192.168.1.16 TCP 1514 [TCP Out-Of-Order] 22 → 59298 [ACK] Seq=50865 Ack=15953 Win=1452 Len=1448 TSval=5596953 TSecr=5000412
  151 4.296894807 192.168.1.16 → 10.6.15.144  TCP 78 [TCP Dup ACK 149#1] 59298 → 22 [ACK] Seq=15953 Ack=55429 Win=5703 Len=0 TSval=5000704 TSecr=5596863 SLE=50865 SRE=52313
  152 4.304613858  10.6.15.144 → 192.168.1.16 SSH 1514 Server: Encrypted packet (len=1448)
  153 4.304643872 192.168.1.16 → 10.6.15.144  TCP 66 59298 → 22 [ACK] Seq=15953 Ack=56877 Win=5703 Len=0 TSval=5000706 TSecr=5597064
  154 4.304714291  10.6.15.144 → 192.168.1.16 SSH 1494 Server: Encrypted packet (len=1428)
  155 4.304721673 192.168.1.16 → 10.6.15.144  TCP 66 59298 → 22 [ACK] Seq=15953 Ack=58305 Win=5703 Len=0 TSval=5000706 TSecr=5597064
  156 4.306096488 192.168.1.16 → 10.6.15.144  SSH 134 Client: Encrypted packet (len=68)
  157 4.313791949  10.6.15.144 → 192.168.1.16 TCP 66 22 → 59298 [ACK] Seq=58305 Ack=16021 Win=1452 Len=0 TSval=5597066 TSecr=5000707
  158 15.303811906 10.22.18.208 → 224.0.0.252  LLMNR 63 Standard query 0x6ef4 ANY LSK
  159 15.391919963 10.22.18.208 → 224.0.0.252  LLMNR 63 Standard query 0x6ef4 ANY LSK
  160 18.279828511  10.22.18.17 → 224.0.0.252  LLMNR 64 Standard query 0xd9ba A wpad
  161 18.280212450  10.22.18.17 → 224.0.0.252  LLMNR 64 Standard query 0x8ea2 AAAA wpad
  162 18.344335245  10.22.18.17 → 224.0.0.252  LLMNR 64 Standard query 0xd9ba A wpad
  163 18.346392771  10.22.18.17 → 224.0.0.252  LLMNR 64 Standard query 0x8ea2 AAAA wpad
  164 19.303830317  10.6.15.144 → 192.168.1.16 SSH 110 Server: Encrypted packet (len=44)
  165 19.304143789  10.6.15.144 → 192.168.1.16 TCP 110 [TCP Retransmission] 22 → 59298 [PSH, ACK] Seq=58305 Ack=16021 Win=1452 Len=44 TSval=5600720 TSecr=5000707
  166 19.304161715 192.168.1.16 → 10.6.15.144  TCP 78 59298 → 22 [ACK] Seq=16021 Ack=58349 Win=5703 Len=0 TSval=5004456 TSecr=5600720 SLE=58305 SRE=58349
  167 19.304264008 192.168.1.16 → 10.6.15.144  SSH 102 Client: Encrypted packet (len=36)
  168 19.314057475  10.6.15.144 → 192.168.1.16 TCP 66 22 → 59298 [ACK] Seq=58349 Ack=16057 Win=1452 Len=0 TSval=5600816 TSecr=5004456
  169 19.327187811  10.6.15.144 → 192.168.1.16 SSH 138 Server: Encrypted packet (len=72)
  170 19.327476257 192.168.1.16 → 10.6.15.144  SSH 102 Client: Encrypted packet (len=36)
  171 19.381432582  10.6.15.144 → 192.168.1.16 TCP 66 22 → 59298 [ACK] Seq=58421 Ack=16093 Win=1452 Len=0 TSval=5600833 TSecr=5004462
  172 20.295776375  10.6.15.144 → 192.168.1.16 SSH 174 Server: Encrypted packet (len=108)
  173 20.296104624  10.6.15.144 → 192.168.1.16 SSH 102 Server: Encrypted packet (len=36)
  174 20.296154452 192.168.1.16 → 10.6.15.144  TCP 66 59298 → 22 [ACK] Seq=16093 Ack=58565 Win=5703 Len=0 TSval=5004704 TSecr=5600872
  175 20.297134110  10.6.15.144 → 192.168.1.16 SSH 210 Server: Encrypted packet (len=144)
  176 20.306673804  10.6.15.144 → 192.168.1.16 SSH 490 Server: Encrypted packet (len=424)
  177 20.306792707 192.168.1.16 → 10.6.15.144  TCP 66 59298 → 22 [ACK] Seq=16093 Ack=59133 Win=5703 Len=0 TSval=5004707 TSecr=5600957
  178 21.287791147 10.22.16.141 → 224.0.0.252  LLMNR 64 Standard query 0x2e80 ANY Dell
  179 25.287877345  10.6.15.144 → 192.168.1.16 SSH 550 Server: Encrypted packet (len=484)
  180 25.287917074  10.6.15.144 → 192.168.1.16 TCP 550 [TCP Retransmission] 22 → 59298 [PSH, ACK] Seq=59133 Ack=16093 Win=1452 Len=484 TSval=5602260 TSecr=5004707
  181 25.287935156 192.168.1.16 → 10.6.15.144  TCP 78 59298 → 22 [ACK] Seq=16093 Ack=59617 Win=5703 Len=0 TSval=5005952 TSecr=5602260 SLE=59133 SRE=59617
  182 25.542209271 192.168.1.16 → 10.6.15.144  SSH 1422 Client: Encrypted packet (len=1356)
  183 25.555479123  10.6.15.144 → 192.168.1.16 TCP 66 22 → 59298 [ACK] Seq=59617 Ack=17449 Win=1452 Len=0 TSval=5602376 TSecr=5006016
  184 25.563933126  10.6.15.144 → 192.168.1.16 SSH 142 Server: Encrypted packet (len=76)
  185 25.563951888 192.168.1.16 → 10.6.15.144  TCP 66 59298 → 22 [ACK] Seq=17449 Ack=59693 Win=5703 Len=0 TSval=5006021 TSecr=5602378
  186 25.826812939 192.168.1.16 → 10.6.15.144  SSH 630 Client: Encrypted packet (len=564)
  187 25.832232954  10.6.15.144 → 192.168.1.16 SSH 182 Server: Encrypted packet (len=116)
  188 25.832267377 192.168.1.16 → 10.6.15.144  TCP 66 59298 → 22 [ACK] Seq=18013 Ack=59809 Win=5703 Len=0 TSval=5006088 TSecr=5602419
  189 25.832686744  10.6.15.144 → 192.168.1.16 SSH 1514 Server: Encrypted packet (len=1448)
  190 25.832698404 192.168.1.16 → 10.6.15.144  TCP 66 59298 → 22 [ACK] Seq=18013 Ack=61257 Win=5703 Len=0 TSval=5006088 TSecr=5602419
  191 25.843291583  10.6.15.144 → 192.168.1.16 SSH 1514 Server: Encrypted packet (len=1448)
  192 25.843313581 192.168.1.16 → 10.6.15.144  TCP 66 59298 → 22 [ACK] Seq=18013 Ack=62705 Win=5703 Len=0 TSval=5006091 TSecr=5602448
  193 25.843439151  10.6.15.144 → 192.168.1.16 SSH 1514 Server: Encrypted packet (len=1448)
  194 25.843442055 192.168.1.16 → 10.6.15.144  TCP 66 59298 → 22 [ACK] Seq=18013 Ack=64153 Win=5703 Len=0 TSval=5006091 TSecr=5602448
  195 25.844611194  10.6.15.144 → 192.168.1.16 SSH 958 Server: Encrypted packet (len=892)
  196 25.844630490 192.168.1.16 → 10.6.15.144  TCP 66 59298 → 22 [ACK] Seq=18013 Ack=65045 Win=5703 Len=0 TSval=5006091 TSecr=5602448
  197 25.845520382 192.168.1.16 → 10.6.15.144  SSH 134 Client: Encrypted packet (len=68)
  198 25.896950964  10.6.15.144 → 192.168.1.16 TCP 66 22 → 59298 [ACK] Seq=65045 Ack=18081 Win=1452 Len=0 TSval=5602462 TSecr=5006091
  199 25.926273338  10.6.15.144 → 192.168.1.16 SSH 174 Server: Encrypted packet (len=108)
  200 25.926876733 192.168.1.16 → 10.6.15.144  SSH 134 Client: Encrypted packet (len=68)
  201 25.936815288  10.6.15.144 → 192.168.1.16 TCP 66 22 → 59298 [ACK] Seq=65153 Ack=18149 Win=1452 Len=0 TSval=5602471 TSecr=5006112
  202 27.987770169 192.168.1.16 → 123.108.200.124 NTP 90 NTP Version 4, client
  203 34.311869264 10.22.17.220 → 224.0.0.252  LLMNR 64 Standard query 0x1447 A wpad
  204 34.312255551 10.22.17.220 → 224.0.0.252  LLMNR 64 Standard query 0x1447 A wpad
  205 40.987802182 192.168.1.16 → 91.189.91.157 NTP 90 NTP Version 4, client
  206 40.990801267  10.6.15.144 → 192.168.1.16 SSH 158 Server: Encrypted packet (len=92)
  207 40.991113887  10.6.15.144 → 192.168.1.16 SSH 102 Server: Encrypted packet (len=36)
  208 40.991130586  10.6.15.144 → 192.168.1.16 TCP 102 [TCP Retransmission] 22 → 59298 [PSH, ACK] Seq=65245 Ack=18149 Win=1452 Len=36 TSval=5606195 TSecr=5006112
  209 40.991146543 192.168.1.16 → 10.6.15.144  TCP 78 59298 → 22 [ACK] Seq=18149 Ack=65281 Win=5703 Len=0 TSval=5009878 TSecr=5606133 SLE=65245 SRE=65281
  210 40.991182983  10.6.15.144 → 192.168.1.16 SSH 102 Server: Encrypted packet (len=36)
  211 40.991193722 192.168.1.16 → 10.6.15.144  TCP 66 59298 → 22 [ACK] Seq=18149 Ack=65317 Win=5703 Len=0 TSval=5009878 TSecr=5606209
  212 40.991642603 192.168.1.16 → 10.6.15.144  SSH 174 Client: Encrypted packet (len=108)
  213 41.003594939  10.6.15.144 → 192.168.1.16 TCP 66 22 → 59298 [ACK] Seq=65317 Ack=18257 Win=1452 Len=0 TSval=5606238 TSecr=5009878
  214 41.003616487  10.6.15.144 → 192.168.1.16 SSH 102 Server: Encrypted packet (len=36)
  215 41.008388270  10.6.15.144 → 192.168.1.16 SSH 138 Server: Encrypted packet (len=72)
  216 41.008480424 192.168.1.16 → 10.6.15.144  TCP 66 59298 → 22 [ACK] Seq=18257 Ack=65425 Win=5703 Len=0 TSval=5009882 TSecr=5606238
  217 41.008622373 192.168.1.16 → 10.6.15.144  SSH 102 Client: Encrypted packet (len=36)
  218 41.057015732  10.6.15.144 → 192.168.1.16 TCP 66 22 → 59298 [ACK] Seq=65425 Ack=18293 Win=1452 Len=0 TSval=5606252 TSecr=5009882
  219 42.309804066 192.168.1.16 → 54.76.71.168 TCP 66 42414 → 8282 [ACK] Seq=1 Ack=1 Win=296 Len=0 TSval=5010208 TSecr=609110631
  220 43.304374931 54.76.71.168 → 192.168.1.16 TCP 66 [TCP ACKed unseen segment] 8282 → 42414 [ACK] Seq=1 Ack=2 Win=121 Len=0 TSval=609122184 TSecr=4986551
