    1 0.000000000 192.168.1.16 → 54.192.190.228 TCP 66 33568 → 80 [ACK] Seq=1 Ack=1 Win=239 Len=0 TSval=7622656 TSecr=1012072872
    2 0.000767506 192.168.1.16 → 151.101.8.223 TCP 66 54978 → 443 [ACK] Seq=1 Ack=1 Win=591 Len=0 TSval=7622656 TSecr=304322279
    3 0.000773255 192.168.1.16 → 23.47.251.27 TCP 66 38888 → 80 [ACK] Seq=1 Ack=1 Win=274 Len=0 TSval=7622656 TSecr=1012081959
    4 0.000774734 192.168.1.16 → 151.101.193.69 TCP 66 33220 → 443 [ACK] Seq=1 Ack=1 Win=410 Len=0 TSval=7622656 TSecr=304322279
    5 0.000776059 192.168.1.16 → 118.214.110.12 TCP 66 54048 → 443 [ACK] Seq=1 Ack=1 Win=387 Len=0 TSval=7622656 TSecr=332619926
    6 0.000777415 192.168.1.16 → 23.185.0.2   TCP 66 54374 → 443 [ACK] Seq=1 Ack=1 Win=364 Len=0 TSval=7622656 TSecr=2742411641
    7 0.002470528 23.47.251.27 → 192.168.1.16 TCP 66 [TCP ACKed unseen segment] 80 → 38888 [ACK] Seq=1 Ack=2 Win=31 Len=0 TSval=1012086465 TSecr=7543581
    8 0.005911730 118.214.110.12 → 192.168.1.16 TCP 66 [TCP ACKed unseen segment] 443 → 54048 [ACK] Seq=1 Ack=2 Win=1067 Len=0 TSval=332664983 TSecr=7543603
    9 0.039387528 151.101.8.223 → 192.168.1.16 TCP 66 [TCP ACKed unseen segment] 443 → 54978 [ACK] Seq=1 Ack=2 Win=61 Len=0 TSval=304333543 TSecr=7543599
   10 0.039767686 151.101.193.69 → 192.168.1.16 TCP 66 [TCP ACKed unseen segment] 443 → 33220 [ACK] Seq=1 Ack=2 Win=61 Len=0 TSval=304333543 TSecr=7543515
   11 0.041050817   23.185.0.2 → 192.168.1.16 TCP 66 [TCP ACKed unseen segment] 443 → 54374 [ACK] Seq=1 Ack=2 Win=61 Len=0 TSval=2742422905 TSecr=7543563
   12 1.181368199 192.168.1.16 → 10.6.15.144  SSH 222 Client: Encrypted packet (len=156)
   13 1.182646407 192.168.1.16 → 10.6.15.144  SSH 1286 Client: Encrypted packet (len=1220)
   14 1.186195622  10.6.15.144 → 192.168.1.16 TCP 66 22 → 58518 [ACK] Seq=1 Ack=157 Win=1452 Len=0 TSval=7073237 TSecr=7622951
   15 1.188096706  10.6.15.144 → 192.168.1.16 TCP 66 22 → 58518 [ACK] Seq=1 Ack=1377 Win=1450 Len=0 TSval=7073238 TSecr=7622951
   16 2.047998276 192.168.1.16 → 52.216.131.141 TCP 66 47572 → 443 [ACK] Seq=1 Ack=1 Win=3079 Len=0 SLE=513 SRE=14849
   17 3.169879043 52.216.131.141 → 192.168.1.16 TCP 60 [TCP ACKed unseen segment] 443 → 47572 [ACK] Seq=14849 Ack=2 Win=70 Len=0
   18 4.161965934  10.6.15.144 → 192.168.1.16 SSH 390 Server: Encrypted packet (len=324)
   19 4.161986780 192.168.1.16 → 10.6.15.144  TCP 66 58518 → 22 [ACK] Seq=1377 Ack=325 Win=2263 Len=0 TSval=7623696 TSecr=7073814
   20 4.162510792  10.6.15.144 → 192.168.1.16 SSH 282 Server: Encrypted packet (len=216)
   21 4.162516009 192.168.1.16 → 10.6.15.144  TCP 66 58518 → 22 [ACK] Seq=1377 Ack=541 Win=2263 Len=0 TSval=7623696 TSecr=7073814
   22 4.162666486 192.168.1.16 → 10.6.15.144  SSH 174 Client: Encrypted packet (len=108)
   23 4.163442765  10.6.15.144 → 192.168.1.16 SSH 134 Server: Encrypted packet (len=68)
   24 4.163870547  10.6.15.144 → 192.168.1.16 SSH 638 Server: Encrypted packet (len=572)
   25 4.163881456 192.168.1.16 → 10.6.15.144  TCP 66 58518 → 22 [ACK] Seq=1485 Ack=1181 Win=2263 Len=0 TSval=7623696 TSecr=7073815
   26 4.164357744 10.22.18.209 → 224.0.0.252  LLMNR 64 Standard query 0x8fb6 A wpad
   27 4.164730175 10.22.18.209 → 224.0.0.252  LLMNR 64 Standard query 0x8fb6 A wpad
   28 4.165249743  10.6.15.144 → 192.168.1.16 SSH 554 Server: Encrypted packet (len=488)
   29 4.165587002 192.168.1.16 → 10.6.15.144  SSH 134 Client: Encrypted packet (len=68)
   30 4.165632360  10.6.15.144 → 192.168.1.16 TCP 66 22 → 58518 [ACK] Seq=1669 Ack=1485 Win=1452 Len=0 TSval=7073982 TSecr=7623696
   31 4.166114990 192.168.1.16 → 10.6.15.144  SSH 182 Client: Encrypted packet (len=116)
   32 4.167167212  10.6.15.144 → 192.168.1.16 TCP 66 22 → 58518 [ACK] Seq=1669 Ack=1553 Win=1452 Len=0 TSval=7073983 TSecr=7623697
   33 4.167617591  10.6.15.144 → 192.168.1.16 TCP 66 22 → 58518 [ACK] Seq=1669 Ack=1669 Win=1452 Len=0 TSval=7073983 TSecr=7623697
   34 5.185895340  10.6.15.144 → 192.168.1.16 SSH 110 Server: Encrypted packet (len=44)
   35 5.191465118  10.6.15.144 → 192.168.1.16 SSH 162 Server: Encrypted packet (len=96)
   36 5.191514328 192.168.1.16 → 10.6.15.144  TCP 66 58518 → 22 [ACK] Seq=1669 Ack=1809 Win=2263 Len=0 TSval=7623953 TSecr=7074079
   37 5.262009854 192.168.1.16 → 10.6.15.144  SSH 102 Client: Encrypted packet (len=36)
   38 5.264608137  10.6.15.144 → 192.168.1.16 TCP 66 22 → 58518 [ACK] Seq=1809 Ack=1705 Win=1452 Len=0 TSval=7074257 TSecr=7623971
   39 6.144006129 192.168.1.16 → 104.20.136.42 TCP 66 45658 → 80 [ACK] Seq=1 Ack=1 Win=241 Len=0 TSval=7624192 TSecr=1012059993
   40 6.255983990 192.168.1.16 → 104.24.28.86 TCP 54 46600 → 443 [ACK] Seq=1 Ack=1 Win=453 Len=0
   41 6.271996593 192.168.1.16 → 151.101.9.140 TCP 66 36298 → 443 [ACK] Seq=1 Ack=1 Win=364 Len=0 TSval=7624224 TSecr=2547869650
   42 7.171711518 151.101.9.140 → 192.168.1.16 TCP 66 [TCP ACKed unseen segment] 443 → 36298 [ACK] Seq=1 Ack=2 Win=61 Len=0 TSval=2547880945 TSecr=7543632
   43 7.171851309  10.6.15.144 → 192.168.1.16 SSH 102 Server: Encrypted packet (len=36)
   44 7.173202619 104.24.28.86 → 192.168.1.16 TCP 60 [TCP ACKed unseen segment] 443 → 46600 [ACK] Seq=1 Ack=2 Win=31 Len=0
   45 7.215998906 192.168.1.16 → 10.6.15.144  TCP 66 58518 → 22 [ACK] Seq=1705 Ack=1845 Win=2263 Len=0 TSval=7624460 TSecr=7074648
   46 8.161832338 10.22.19.176 → 224.0.0.252  LLMNR 67 Standard query 0xc79a ANY jayBook
   47 8.161964740 10.22.19.176 → 224.0.0.252  LLMNR 67 Standard query 0xc79a ANY jayBook
   48 8.192024345 192.168.1.16 → 151.101.8.133 TCP 66 51412 → 443 [ACK] Seq=1 Ack=1 Win=455 Len=0 TSval=7624704 TSecr=324718345
   49 8.232611392 151.101.8.133 → 192.168.1.16 TCP 66 [TCP ACKed unseen segment] 443 → 51412 [ACK] Seq=1 Ack=2 Win=61 Len=0 TSval=324729609 TSecr=7544892
   50 9.219307404 10.22.19.176 → 224.0.0.252  LLMNR 67 Standard query 0x4112 ANY jayBook
   51 9.219410106 10.22.19.176 → 224.0.0.252  LLMNR 67 Standard query 0x4112 ANY jayBook
   52 12.163533754 10.22.18.209 → 224.0.0.252  LLMNR 64 Standard query 0x3beb A wpad
   53 12.164230927 10.22.18.209 → 224.0.0.252  LLMNR 64 Standard query 0x3beb A wpad
   54 12.178588583 192.168.1.16 → 10.6.15.144  SSH 102 Client: Encrypted packet (len=36)
   55 12.387972212 192.168.1.16 → 10.6.15.144  TCP 102 [TCP Retransmission] 58518 → 22 [PSH, ACK] Seq=1705 Ack=1845 Win=2263 Len=36 TSval=7625753 TSecr=7074648
   56 12.412946089  10.6.15.144 → 192.168.1.16 TCP 66 22 → 58518 [ACK] Seq=1845 Ack=1741 Win=1452 Len=0 TSval=7076044 TSecr=7625753
   57 13.183981967 192.168.1.16 → 104.24.29.86 TCP 54 50612 → 443 [ACK] Seq=1 Ack=1 Win=411 Len=0
   58 14.178866543 104.24.29.86 → 192.168.1.16 TCP 60 [TCP ACKed unseen segment] 443 → 50612 [ACK] Seq=1 Ack=2 Win=31 Len=0
   59 14.179030616  10.6.15.144 → 192.168.1.16 SSH 102 Server: Encrypted packet (len=36)
   60 14.179043786 192.168.1.16 → 10.6.15.144  TCP 66 58518 → 22 [ACK] Seq=1741 Ack=1881 Win=2263 Len=0 TSval=7626200 TSecr=7076435
   61 16.201874892 192.168.1.16 → 10.6.15.144  SSH 262 Client: Encrypted packet (len=196)
   62 16.202444258 192.168.1.16 → 10.6.15.144  SSH 1382 Client: Encrypted packet (len=1316)
   63 16.206709239  10.6.15.144 → 192.168.1.16 TCP 66 22 → 58518 [ACK] Seq=1881 Ack=1937 Win=1452 Len=0 TSval=7076992 TSecr=7626706
   64 16.208765976  10.6.15.144 → 192.168.1.16 SSH 134 Server: Encrypted packet (len=68)
   65 16.208794874 192.168.1.16 → 10.6.15.144  TCP 66 58518 → 22 [ACK] Seq=3253 Ack=1949 Win=2263 Len=0 TSval=7626708 TSecr=7076993
   66 16.248934640  10.6.15.144 → 192.168.1.16 TCP 66 22 → 58518 [ACK] Seq=1949 Ack=3253 Win=1452 Len=0 TSval=7077004 TSecr=7626706
   67 16.324179011  10.6.15.144 → 192.168.1.16 SSH 182 Server: Encrypted packet (len=116)
   68 16.324197464 192.168.1.16 → 10.6.15.144  TCP 66 58518 → 22 [ACK] Seq=3253 Ack=2065 Win=2263 Len=0 TSval=7626737 TSecr=7077022
   69 16.324852295  10.6.15.144 → 192.168.1.16 SSH 822 Server: Encrypted packet (len=756)
   70 16.324871425 192.168.1.16 → 10.6.15.144  TCP 66 58518 → 22 [ACK] Seq=3253 Ack=2821 Win=2263 Len=0 TSval=7626737 TSecr=7077022
   71 16.324892156  10.6.15.144 → 192.168.1.16 SSH 630 Server: Encrypted packet (len=564)
   72 16.324899188 192.168.1.16 → 10.6.15.144  TCP 66 58518 → 22 [ACK] Seq=3253 Ack=3385 Win=2263 Len=0 TSval=7626737 TSecr=7077022
   73 16.325366871 192.168.1.16 → 10.6.15.144  SSH 134 Client: Encrypted packet (len=68)
   74 16.328161183  10.6.15.144 → 192.168.1.16 TCP 66 22 → 58518 [ACK] Seq=3385 Ack=3321 Win=1452 Len=0 TSval=7077023 TSecr=7626737
   75 16.330019092  10.6.15.144 → 192.168.1.16 SSH 102 Server: Encrypted packet (len=36)
   76 16.371978864 192.168.1.16 → 10.6.15.144  TCP 66 58518 → 22 [ACK] Seq=3321 Ack=3421 Win=2263 Len=0 TSval=7626749 TSecr=7077024
   77 18.177953345  10.22.17.94 → 224.0.0.252  LLMNR 75 Standard query 0x5448 ANY DESKTOP-U824Q6A
   78 18.178020467  10.22.17.94 → 224.0.0.252  LLMNR 75 Standard query 0x5448 ANY DESKTOP-U824Q6A
   79 18.178194932  10.22.17.94 → 224.0.0.252  LLMNR 75 Standard query 0x6bd1 ANY DESKTOP-U824Q6A
   80 19.169762626  10.22.17.94 → 224.0.0.252  LLMNR 75 Standard query 0x6bd1 ANY DESKTOP-U824Q6A
   81 19.170184346  10.22.17.94 → 224.0.0.252  LLMNR 75 Standard query 0xed8e ANY DESKTOP-U824Q6A
   82 20.225867664  10.22.17.94 → 224.0.0.252  LLMNR 75 Standard query 0xed8e ANY DESKTOP-U824Q6A
   83 20.225885236 10.22.18.209 → 224.0.0.252  LLMNR 64 Standard query 0x6679 A wpad
   84 20.225889497 10.22.18.209 → 224.0.0.252  LLMNR 64 Standard query 0x6679 A wpad
   85 20.225892688  10.22.17.94 → 224.0.0.252  LLMNR 75 Standard query 0xe139 ANY DESKTOP-U824Q6A
   86 20.479983106 192.168.1.16 → 50.19.253.241 TCP 66 40316 → 443 [ACK] Seq=1 Ack=1 Win=839 Len=0 TSval=7627776 TSecr=43781451
   87 22.209899647  10.22.17.94 → 224.0.0.252  LLMNR 75 Standard query 0xe139 ANY DESKTOP-U824Q6A
   88 22.209923227  10.22.17.94 → 224.0.0.252  LLMNR 64 Standard query 0xfaf4 A wpad
   89 22.209929492  10.22.17.94 → 224.0.0.252  LLMNR 64 Standard query 0xbe25 A wpad
   90 22.210347987  10.22.17.94 → 224.0.0.252  LLMNR 64 Standard query 0x29a2 A wpad
   91 22.210371310  10.22.17.94 → 224.0.0.252  LLMNR 64 Standard query 0x4fc7 A wpad
   92 22.210376965  10.22.17.94 → 224.0.0.252  LLMNR 64 Standard query 0xa527 A wpad
   93 22.210381747  10.22.17.94 → 224.0.0.252  LLMNR 64 Standard query 0xac49 A wpad
   94 22.210385251  10.22.17.94 → 224.0.0.252  LLMNR 64 Standard query 0x76b2 A wpad
   95 22.210389447  10.6.15.144 → 192.168.1.16 SSH 134 Server: Encrypted packet (len=68)
   96 22.210406687 192.168.1.16 → 10.6.15.144  TCP 66 58518 → 22 [ACK] Seq=3321 Ack=3489 Win=2263 Len=0 TSval=7628208 TSecr=7078182
   97 22.210851290  10.6.15.144 → 192.168.1.16 SSH 102 Server: Encrypted packet (len=36)
   98 22.210869398 192.168.1.16 → 10.6.15.144  TCP 66 58518 → 22 [ACK] Seq=3321 Ack=3525 Win=2263 Len=0 TSval=7628208 TSecr=7078182
   99 22.210890920  10.22.17.94 → 224.0.0.252  LLMNR 64 Standard query 0xfaf4 A wpad
  100 22.210906861  10.22.17.94 → 224.0.0.252  LLMNR 64 Standard query 0xbe25 A wpad
  101 22.210910865  10.22.17.94 → 224.0.0.252  LLMNR 64 Standard query 0x29a2 A wpad
  102 22.210914337  10.22.17.94 → 224.0.0.252  LLMNR 64 Standard query 0x4fc7 A wpad
  103 22.210917852  10.22.17.94 → 224.0.0.252  LLMNR 64 Standard query 0xa527 A wpad
  104 22.210921198  10.22.17.94 → 224.0.0.252  LLMNR 64 Standard query 0xac49 A wpad
  105 22.211673691  10.22.17.94 → 224.0.0.252  LLMNR 64 Standard query 0x76b2 A wpad
  106 22.211696284  10.6.15.144 → 192.168.1.16 SSH 102 Server: [TCP Spurious Retransmission] , Encrypted packet (len=36)
  107 22.211708310 192.168.1.16 → 10.6.15.144  TCP 78 [TCP Dup ACK 98#1] 58518 → 22 [ACK] Seq=3321 Ack=3525 Win=2263 Len=0 TSval=7628208 TSecr=7078290 SLE=3489 SRE=3525
  108 22.528020416 192.168.1.16 → 52.216.131.141 TCP 82 47568 → 443 [ACK] Seq=1 Ack=1 Win=6152 Len=0 SLE=513 SRE=82433 SLE=94721 SRE=97793 SLE=85505 SRE=86529
  109 24.167982629  10.22.17.94 → 224.0.0.252  LLMNR 64 Standard query 0xaa36 A wpad
  110 24.168100600  10.22.17.94 → 224.0.0.252  LLMNR 64 Standard query 0x9369 A wpad
  111 24.168245010  10.22.17.94 → 224.0.0.252  LLMNR 64 Standard query 0xbb94 A wpad
  112 24.168385764  10.22.17.94 → 224.0.0.252  LLMNR 64 Standard query 0x7aac A wpad
  113 24.168522349  10.22.17.94 → 224.0.0.252  LLMNR 64 Standard query 0x0e5a A wpad
  114 24.168661820  10.22.17.94 → 224.0.0.252  LLMNR 64 Standard query 0x3334 A wpad
  115 24.168795917  10.22.17.94 → 224.0.0.252  LLMNR 64 Standard query 0x60ca A wpad
  116 24.168894497  10.22.17.94 → 224.0.0.252  LLMNR 64 Standard query 0xaa36 A wpad
  117 24.169031543  10.22.17.94 → 224.0.0.252  LLMNR 64 Standard query 0xbb94 A wpad
  118 24.169168438  10.22.17.94 → 224.0.0.252  LLMNR 64 Standard query 0x9369 A wpad
  119 24.169304795  10.22.17.94 → 224.0.0.252  LLMNR 64 Standard query 0x7aac A wpad
  120 24.169487059  10.22.17.94 → 224.0.0.252  LLMNR 64 Standard query 0x0e5a A wpad
  121 24.169619106  10.22.17.94 → 224.0.0.252  LLMNR 64 Standard query 0x3334 A wpad
  122 24.169755653  10.22.17.94 → 224.0.0.252  LLMNR 64 Standard query 0x60ca A wpad
  123 25.187474966  10.22.18.98 → 224.0.0.252  LLMNR 64 Standard query 0xf0c7 A wpad
  124 25.187495009  10.22.18.98 → 224.0.0.252  LLMNR 64 Standard query 0xf0c7 A wpad
  125 28.167379844 10.22.18.209 → 224.0.0.252  LLMNR 64 Standard query 0x317d A wpad
  126 28.168055102 10.22.18.209 → 224.0.0.252  LLMNR 64 Standard query 0x317d A wpad
  127 29.074063964 192.168.1.16 → 192.168.1.1  DNS 81 Standard query 0x01da A 3.ubuntu.pool.ntp.org
  128 29.103525619  192.168.1.1 → 192.168.1.16 DNS 97 Standard query response 0x01da A 3.ubuntu.pool.ntp.org A 123.108.200.124
  129 29.103938472 192.168.1.16 → 123.108.200.124 NTP 90 NTP Version 4, client
  130 30.074179222 192.168.1.16 → 192.168.1.1  DNS 81 Standard query 0x32d3 A 1.ubuntu.pool.ntp.org
  131 30.077385705  192.168.1.1 → 192.168.1.16 DNS 97 Standard query response 0x32d3 A 1.ubuntu.pool.ntp.org A 123.108.200.124
  132 30.077698742 192.168.1.16 → 123.108.200.124 NTP 90 NTP Version 4, client
  133 35.733439969 ZioncomE_53:dd:d6 → HonHaiPr_1f:71:b9 EAPOL 135 Key (Message 1 of 4)
  134 35.733595527 HonHaiPr_1f:71:b9 → ZioncomE_53:dd:d6 EAPOL 135 Key (Message 2 of 4)
  135 35.738724926 ZioncomE_53:dd:d6 → HonHaiPr_1f:71:b9 EAPOL 169 Key (Message 3 of 4)
  136 35.738788171 HonHaiPr_1f:71:b9 → ZioncomE_53:dd:d6 EAPOL 113 Key (Message 4 of 4)
  137 35.747983525 fe80::820e:b87b:de2a:4286 → ff02::16     ICMPv6 90 Multicast Listener Report Message v2
  138 35.748017427 192.168.1.16 → 224.0.0.252  IGMPv2 46 Membership Report group 224.0.0.252
  139 35.773307230  192.168.1.1 → 192.168.1.255 IAPP 58 Announce Request(0) (version=0)[Malformed Packet]
  140 35.773626134  192.168.1.1 → 224.0.1.178  UDP 58 3517 → 3517 Len=16
  141 35.865629706 fe80::820e:b87b:de2a:4286 → ff02::1:3    LLMNR 93 Standard query 0x2df4 ANY theenterprise
  142 35.865672625 192.168.1.16 → 224.0.0.252  LLMNR 73 Standard query 0xacba ANY theenterprise
  143 35.969418901 fe80::820e:b87b:de2a:4286 → ff02::1:3    LLMNR 93 Standard query 0x2df4 ANY theenterprise
  144 35.969462466 192.168.1.16 → 224.0.0.252  LLMNR 73 Standard query 0xacba ANY theenterprise
  145 36.031984528 fe80::820e:b87b:de2a:4286 → ff02::16     ICMPv6 90 Multicast Listener Report Message v2
  146 36.085575992  10.22.17.94 → 224.0.0.252  LLMNR 64 Standard query 0x2d67 A wpad
  147 36.085666937 192.168.1.16 → 224.0.0.252  LLMNR 73 Standard query 0xacba ANY theenterprise
  148 36.085706927 fe80::820e:b87b:de2a:4286 → ff02::1:3    LLMNR 93 Standard query 0x2df4 ANY theenterprise
  149 36.090154918  10.22.17.94 → 224.0.0.252  LLMNR 64 Standard query 0x78bd A wpad
  150 36.097638760  10.22.17.94 → 224.0.0.252  LLMNR 64 Standard query 0xc9ba A wpad
  151 36.098080136  10.22.17.94 → 224.0.0.252  LLMNR 64 Standard query 0x198b A wpad
  152 36.106568811  10.22.17.94 → 224.0.0.252  LLMNR 64 Standard query 0x8638 A wpad
  153 36.109551135  10.22.17.94 → 224.0.0.252  LLMNR 64 Standard query 0xc6aa A wpad
  154 36.109936066  10.22.17.94 → 224.0.0.252  LLMNR 64 Standard query 0xf398 A wpad
  155 36.232019107 192.168.1.16 → 10.6.15.144  SSH 154 Client: Encrypted packet (len=88)
  156 36.296275193  10.6.15.144 → 192.168.1.16 SSH 102 Server: Encrypted packet (len=36)
  157 36.296303240 192.168.1.16 → 10.6.15.144  SSH 174 Client: Encrypted packet (len=108)
  158 36.296770733 192.168.1.16 → 10.6.15.144  SSH 574 Client: Encrypted packet (len=508)
  159 36.298349016  10.6.15.144 → 192.168.1.16 SSH 102 Server: Encrypted packet (len=36)
  160 36.335884254  10.6.15.144 → 192.168.1.16 SSH 246 Server: Encrypted packet (len=180)
  161 36.335907949 192.168.1.16 → 10.6.15.144  TCP 66 58518 → 22 [ACK] Seq=4025 Ack=3777 Win=2263 Len=0 TSval=7631739 TSecr=7082016
  162 36.336371999 192.168.1.16 → 10.6.15.144  SSH 310 Client: Encrypted packet (len=244)
  163 36.337208879 192.168.1.16 → 10.6.15.144  SSH 318 Client: Encrypted packet (len=252)
  164 36.339106673  10.6.15.144 → 192.168.1.16 TCP 66 22 → 58518 [ACK] Seq=3777 Ack=4521 Win=1452 Len=0 TSval=7082026 TSecr=7631740
  165 36.375379788  10.6.15.144 → 192.168.1.16 SSH 126 Server: Encrypted packet (len=60)
  166 36.378645986  10.6.15.144 → 192.168.1.16 SSH 214 Server: Encrypted packet (len=148)
  167 36.378691882 192.168.1.16 → 10.6.15.144  TCP 66 58518 → 22 [ACK] Seq=4521 Ack=3985 Win=2263 Len=0 TSval=7631750 TSecr=7082035
  168 36.379758525  10.6.15.144 → 192.168.1.16 SSH 238 Server: Encrypted packet (len=172)
  169 36.419975359 192.168.1.16 → 10.6.15.144  TCP 66 58518 → 22 [ACK] Seq=4521 Ack=4157 Win=2263 Len=0 TSval=7631761 TSecr=7082036
  170 36.489612206  10.22.17.94 → 224.0.0.252  LLMNR 64 Standard query 0x78bd A wpad
  171 36.489628984  10.22.17.94 → 224.0.0.252  LLMNR 64 Standard query 0x2d67 A wpad
  172 36.489632259  10.22.17.94 → 224.0.0.252  LLMNR 64 Standard query 0xc9ba A wpad
  173 36.490052552  10.22.17.94 → 224.0.0.252  LLMNR 64 Standard query 0x8638 A wpad
  174 36.490059355  10.22.17.94 → 224.0.0.252  LLMNR 64 Standard query 0x198b A wpad
  175 36.490063489  10.22.17.94 → 224.0.0.252  LLMNR 64 Standard query 0xc6aa A wpad
  176 36.491135987  10.22.17.94 → 224.0.0.252  LLMNR 64 Standard query 0xf398 A wpad
  177 36.531611152  10.6.15.144 → 192.168.1.16 SSH 138 Server: Encrypted packet (len=72)
  178 36.531630402 192.168.1.16 → 10.6.15.144  TCP 66 58518 → 22 [ACK] Seq=4521 Ack=4229 Win=2263 Len=0 TSval=7631788 TSecr=7082074
  179 36.531769112 192.168.1.16 → 10.6.15.144  SSH 102 Client: Encrypted packet (len=36)
  180 36.588522801  10.6.15.144 → 192.168.1.16 TCP 66 22 → 58518 [ACK] Seq=4229 Ack=4557 Win=1452 Len=0 TSval=7082089 TSecr=7631788
  181 36.863968190 192.168.1.16 → 216.58.196.106 TCP 66 56232 → 443 [ACK] Seq=1 Ack=1 Win=384 Len=0 TSval=7631872 TSecr=298593771
  182 36.864735489 192.168.1.16 → 52.16.201.221 TCP 128 52032 → 8282 [PSH, ACK] Seq=1 Ack=1 Win=296 Len=62 TSval=7631872 TSecr=589320240
  183 36.866337592  192.168.1.1 → 224.0.0.1    IGMPv2 42 Membership Query, general
  184 36.867875101 216.58.196.106 → 192.168.1.16 TCP 66 [TCP ACKed unseen segment] 443 → 56232 [ACK] Seq=1 Ack=2 Win=179 Len=0 TSval=298683882 TSecr=7574747
  185 37.074399786 192.168.1.16 → 192.168.1.1  DNS 74 Standard query 0x8559 A ntp.ubuntu.com
  186 37.077659299  192.168.1.1 → 192.168.1.16 DNS 138 Standard query response 0x8559 A ntp.ubuntu.com A 91.189.94.4 A 91.189.89.198 A 91.189.89.199 A 91.189.91.157
  187 37.078049102 192.168.1.16 → 91.189.94.4  NTP 90 NTP Version 4, client
  188 37.240549968 192.168.1.16 → 10.6.15.144  SSH 102 Client: Encrypted packet (len=36)
  189 37.241316634 192.168.1.16 → 239.255.255.250 SSDP 213 M-SEARCH * HTTP/1.1 
  190 37.241556927 192.168.1.16 → 10.6.15.144  SSH 102 Client: Encrypted packet (len=36)
  191 37.242797076  10.6.15.144 → 192.168.1.16 TCP 66 22 → 58518 [ACK] Seq=4229 Ack=4593 Win=1452 Len=0 TSval=7082252 TSecr=7631966
  192 37.242854149 192.168.1.16 → 10.6.15.144  SSH 238 Client: Encrypted packet (len=172)
  193 37.244641904  10.6.15.144 → 192.168.1.16 TCP 66 22 → 58518 [ACK] Seq=4229 Ack=4629 Win=1452 Len=0 TSval=7082253 TSecr=7631966
  194 37.244777017  10.6.15.144 → 192.168.1.16 TCP 66 22 → 58518 [ACK] Seq=4229 Ack=4801 Win=1452 Len=0 TSval=7082253 TSecr=7631966
  195 37.247993372  10.6.15.144 → 192.168.1.16 SSH 142 Server: Encrypted packet (len=76)
  196 37.279072643  10.6.15.144 → 192.168.1.16 SSH 102 Server: Encrypted packet (len=36)
  197 37.279129051 192.168.1.16 → 10.6.15.144  TCP 66 58518 → 22 [ACK] Seq=4801 Ack=4341 Win=2263 Len=0 TSval=7631975 TSecr=7082253
  198 37.279364932 192.168.1.16 → 10.6.15.144  SSH 166 Client: Encrypted packet (len=100)
  199 37.289113125  10.6.15.144 → 192.168.1.16 SSH 390 Server: Encrypted packet (len=324)
  200 37.289192095  10.6.15.144 → 192.168.1.16 SSH 206 Server: Encrypted packet (len=140)
  201 37.289236642 192.168.1.16 → 10.6.15.144  TCP 66 58518 → 22 [ACK] Seq=4901 Ack=4805 Win=2263 Len=0 TSval=7631978 TSecr=7082264
  202 37.289750831 192.168.1.16 → 10.6.15.144  SSH 142 Client: Encrypted packet (len=76)
  203 37.316983821  10.6.15.144 → 192.168.1.16 SSH 174 Server: Encrypted packet (len=108)
  204 37.317469337 192.168.1.16 → 10.6.15.144  SSH 294 Client: Encrypted packet (len=228)
  205 37.318295685 192.168.1.16 → 10.6.15.144  SSH 318 Client: Encrypted packet (len=252)
  206 37.320678652  10.6.15.144 → 192.168.1.16 TCP 66 22 → 58518 [ACK] Seq=4913 Ack=5457 Win=1452 Len=0 TSval=7082271 TSecr=7631985
  207 37.359893785  10.6.15.144 → 192.168.1.16 SSH 118 Server: Encrypted packet (len=52)
  208 37.360027243  10.6.15.144 → 192.168.1.16 SSH 214 Server: Encrypted packet (len=148)
  209 37.360049344 192.168.1.16 → 10.6.15.144  TCP 66 58518 → 22 [ACK] Seq=5457 Ack=5113 Win=2263 Len=0 TSval=7631996 TSecr=7082281
  210 37.360186088  10.6.15.144 → 192.168.1.16 SSH 230 Server: Encrypted packet (len=164)
  211 37.403965208 192.168.1.16 → 10.6.15.144  TCP 66 58518 → 22 [ACK] Seq=5457 Ack=5277 Win=2263 Len=0 TSval=7632007 TSecr=7082281
  212 37.679562660 192.168.1.16 → 10.6.15.144  SSH 766 Client: Encrypted packet (len=700)
  213 37.681716346  10.6.15.144 → 192.168.1.16 SSH 138 Server: Encrypted packet (len=72)
  214 37.681739829 192.168.1.16 → 10.6.15.144  TCP 66 58518 → 22 [ACK] Seq=6157 Ack=5349 Win=2263 Len=0 TSval=7632076 TSecr=7082319
  215 37.681874186 192.168.1.16 → 10.6.15.144  SSH 102 Client: Encrypted packet (len=36)
  216 37.684867213  10.6.15.144 → 192.168.1.16 TCP 66 22 → 58518 [ACK] Seq=5349 Ack=6193 Win=1452 Len=0 TSval=7082362 TSecr=7632075
  217 37.685765903  10.6.15.144 → 192.168.1.16 SSH 134 Server: Encrypted packet (len=68)
  218 37.728001457 192.168.1.16 → 10.6.15.144  TCP 66 58518 → 22 [ACK] Seq=6193 Ack=5417 Win=2263 Len=0 TSval=7632088 TSecr=7082363
  219 37.769505997  10.6.15.144 → 192.168.1.16 SSH 198 Server: Encrypted packet (len=132)
  220 37.769525537 192.168.1.16 → 10.6.15.144  TCP 66 58518 → 22 [ACK] Seq=6193 Ack=5549 Win=2263 Len=0 TSval=7632098 TSecr=7082383
  221 37.769994608 192.168.1.16 → 10.6.15.144  SSH 134 Client: Encrypted packet (len=68)
  222 37.808972792  10.6.15.144 → 192.168.1.16 TCP 66 22 → 58518 [ACK] Seq=5549 Ack=6261 Win=1452 Len=0 TSval=7082394 TSecr=7632098
  223 37.861173570  10.6.15.144 → 192.168.1.16 SSH 102 Server: Encrypted packet (len=36)
  224 37.903980309 192.168.1.16 → 10.6.15.144  TCP 66 58518 → 22 [ACK] Seq=6261 Ack=5585 Win=2263 Len=0 TSval=7632132 TSecr=7082407
  225 38.241230246 192.168.1.16 → 239.255.255.250 SSDP 213 M-SEARCH * HTTP/1.1 
  226 39.241951470 192.168.1.16 → 239.255.255.250 SSDP 213 M-SEARCH * HTTP/1.1 
