    1 0.000000000  10.6.15.156 → 192.168.1.12 SSH 230 Server: Encrypted packet (len=164)
    2 0.000306169 192.168.1.12 → 10.6.15.156  SSH 134 Client: Encrypted packet (len=68)
    3 0.001976434  10.6.15.156 → 192.168.1.12 TCP 66 22 → 54766 [ACK] Seq=165 Ack=69 Win=1452 Len=0 TSval=14353962 TSecr=7422470
    4 0.010521248  10.6.15.156 → 192.168.1.12 SSH 1514 Server: Encrypted packet (len=1448)
    5 0.010560252  10.6.15.156 → 192.168.1.12 SSH 974 Server: Encrypted packet (len=908)
    6 0.010571927 192.168.1.12 → 10.6.15.156  TCP 66 54766 → 22 [ACK] Seq=69 Ack=2521 Win=2592 Len=0 TSval=7422473 TSecr=14353964
    7 0.011585853 192.168.1.12 → 10.6.15.156  SSH 206 Client: Encrypted packet (len=140)
    8 0.051875991  10.6.15.156 → 192.168.1.12 TCP 66 22 → 54766 [ACK] Seq=2521 Ack=209 Win=1452 Len=0 TSval=14353975 TSecr=7422473
    9 0.273846232  10.6.15.156 → 192.168.1.12 SSH 142 Server: Encrypted packet (len=76)
   10 0.314142223 192.168.1.12 → 10.6.15.156  TCP 66 54766 → 22 [ACK] Seq=209 Ack=2597 Win=2592 Len=0 TSval=7422549 TSecr=14354030
   11 0.486114714 192.168.1.12 → 224.0.0.252  IGMPv2 46 Membership Report group 224.0.0.252
   12 0.759066907  10.6.15.156 → 192.168.1.12 SSH 1514 Server: Encrypted packet (len=1448)
   13 0.759095842 192.168.1.12 → 10.6.15.156  TCP 66 54766 → 22 [ACK] Seq=209 Ack=4045 Win=2592 Len=0 TSval=7422660 TSecr=14354150
   14 0.759256796  10.6.15.156 → 192.168.1.12 SSH 1514 Server: Encrypted packet (len=1448)
   15 0.759260768 192.168.1.12 → 10.6.15.156  TCP 66 54766 → 22 [ACK] Seq=209 Ack=5493 Win=2592 Len=0 TSval=7422660 TSecr=14354150
   16 0.759446363  10.6.15.156 → 192.168.1.12 SSH 1514 Server: Encrypted packet (len=1448)
   17 0.759450555 192.168.1.12 → 10.6.15.156  TCP 66 54766 → 22 [ACK] Seq=209 Ack=6941 Win=2592 Len=0 TSval=7422660 TSecr=14354150
   18 0.759638304  10.6.15.156 → 192.168.1.12 SSH 1514 Server: Encrypted packet (len=1448)
   19 0.759642173 192.168.1.12 → 10.6.15.156  TCP 66 54766 → 22 [ACK] Seq=209 Ack=8389 Win=2592 Len=0 TSval=7422660 TSecr=14354150
   20 0.759648426  10.6.15.156 → 192.168.1.12 SSH 102 Server: Encrypted packet (len=36)
   21 0.759661287 192.168.1.12 → 10.6.15.156  TCP 66 54766 → 22 [ACK] Seq=209 Ack=8425 Win=2592 Len=0 TSval=7422660 TSecr=14354150
   22 0.759850847  10.6.15.156 → 192.168.1.12 SSH 1514 Server: Encrypted packet (len=1448)
   23 0.759856037 192.168.1.12 → 10.6.15.156  TCP 66 54766 → 22 [ACK] Seq=209 Ack=9873 Win=2592 Len=0 TSval=7422660 TSecr=14354151
   24 0.760043845  10.6.15.156 → 192.168.1.12 SSH 1514 Server: Encrypted packet (len=1448)
   25 0.760049336 192.168.1.12 → 10.6.15.156  TCP 66 54766 → 22 [ACK] Seq=209 Ack=11321 Win=2592 Len=0 TSval=7422660 TSecr=14354151
   26 0.760234702  10.6.15.156 → 192.168.1.12 SSH 1514 Server: Encrypted packet (len=1448)
   27 0.760240507 192.168.1.12 → 10.6.15.156  TCP 66 54766 → 22 [ACK] Seq=209 Ack=12769 Win=2592 Len=0 TSval=7422660 TSecr=14354151
   28 0.760426393  10.6.15.156 → 192.168.1.12 SSH 1514 Server: Encrypted packet (len=1448)
   29 0.760432595 192.168.1.12 → 10.6.15.156  TCP 66 54766 → 22 [ACK] Seq=209 Ack=14217 Win=2592 Len=0 TSval=7422660 TSecr=14354151
   30 0.761085962  10.6.15.156 → 192.168.1.12 SSH 1514 Server: Encrypted packet (len=1448)
   31 0.761098404 192.168.1.12 → 10.6.15.156  TCP 66 54766 → 22 [ACK] Seq=209 Ack=15665 Win=2592 Len=0 TSval=7422660 TSecr=14354151
   32 0.763609459  10.6.15.156 → 192.168.1.12 SSH 1514 Server: Encrypted packet (len=1448)
   33 0.763625577 192.168.1.12 → 10.6.15.156  TCP 66 54766 → 22 [ACK] Seq=209 Ack=17113 Win=2592 Len=0 TSval=7422661 TSecr=14354152
   34 0.763791065  10.6.15.156 → 192.168.1.12 SSH 1514 Server: Encrypted packet (len=1448)
   35 0.763794916 192.168.1.12 → 10.6.15.156  TCP 66 54766 → 22 [ACK] Seq=209 Ack=18561 Win=2592 Len=0 TSval=7422661 TSecr=14354152
   36 0.763984179  10.6.15.156 → 192.168.1.12 SSH 1514 Server: Encrypted packet (len=1448)
   37 0.763989266 192.168.1.12 → 10.6.15.156  TCP 66 54766 → 22 [ACK] Seq=209 Ack=20009 Win=2592 Len=0 TSval=7422661 TSecr=14354152
   38 0.764176711  10.6.15.156 → 192.168.1.12 SSH 1514 Server: Encrypted packet (len=1448)
   39 0.764182074 192.168.1.12 → 10.6.15.156  TCP 66 54766 → 22 [ACK] Seq=209 Ack=21457 Win=2592 Len=0 TSval=7422661 TSecr=14354152
   40 0.764368829  10.6.15.156 → 192.168.1.12 SSH 1514 Server: Encrypted packet (len=1448)
   41 0.764375122 192.168.1.12 → 10.6.15.156  TCP 66 54766 → 22 [ACK] Seq=209 Ack=22905 Win=2592 Len=0 TSval=7422661 TSecr=14354152
   42 0.764714391  10.6.15.156 → 192.168.1.12 SSH 1514 Server: Encrypted packet (len=1448)
   43 0.764720772 192.168.1.12 → 10.6.15.156  TCP 66 54766 → 22 [ACK] Seq=209 Ack=24353 Win=2592 Len=0 TSval=7422661 TSecr=14354152
   44 0.764905111  10.6.15.156 → 192.168.1.12 SSH 1514 Server: Encrypted packet (len=1448)
   45 0.765098957  10.6.15.156 → 192.168.1.12 SSH 1514 Server: Encrypted packet (len=1448)
   46 0.765106938 192.168.1.12 → 10.6.15.156  TCP 66 54766 → 22 [ACK] Seq=209 Ack=27249 Win=2592 Len=0 TSval=7422661 TSecr=14354152
   47 0.765289892  10.6.15.156 → 192.168.1.12 SSH 1514 Server: Encrypted packet (len=1448)
   48 0.765299326  10.6.15.156 → 192.168.1.12 SSH 194 Server: Encrypted packet (len=128)
   49 0.765304806 192.168.1.12 → 10.6.15.156  TCP 66 54766 → 22 [ACK] Seq=209 Ack=28825 Win=2592 Len=0 TSval=7422661 TSecr=14354152
   50 0.765436967 192.168.1.12 → 10.6.15.156  SSH 102 Client: Encrypted packet (len=36)
   51 0.767333748  10.6.15.156 → 192.168.1.12 TCP 66 22 → 54766 [ACK] Seq=28825 Ack=245 Win=1452 Len=0 TSval=14354153 TSecr=7422661
   52 0.771262513 192.168.1.12 → 10.6.15.156  SSH 102 Client: Encrypted packet (len=36)
   53 0.771690674 192.168.1.12 → 10.6.15.156  SSH 102 Client: Encrypted packet (len=36)
   54 0.773224104  10.6.15.156 → 192.168.1.12 TCP 66 22 → 54766 [ACK] Seq=28825 Ack=281 Win=1452 Len=0 TSval=14354155 TSecr=7422663
   55 0.773243427  10.6.15.156 → 192.168.1.12 TCP 66 22 → 54766 [ACK] Seq=28825 Ack=317 Win=1452 Len=0 TSval=14354155 TSecr=7422663
   56 0.784227540 192.168.1.12 → 10.6.15.156  SSH 102 Client: Encrypted packet (len=36)
   57 0.785541673  10.6.15.156 → 192.168.1.12 TCP 66 22 → 54766 [ACK] Seq=28825 Ack=353 Win=1452 Len=0 TSval=14354158 TSecr=7422666
   58 0.785564577 192.168.1.12 → 10.6.15.156  SSH 102 Client: Encrypted packet (len=36)
   59 0.787046736  10.6.15.156 → 192.168.1.12 TCP 66 22 → 54766 [ACK] Seq=28825 Ack=389 Win=1452 Len=0 TSval=14354158 TSecr=7422666
   60 0.787178390  10.6.15.156 → 192.168.1.12 SSH 110 Server: Encrypted packet (len=44)
   61 0.789677368  10.6.15.156 → 192.168.1.12 SSH 102 Server: Encrypted packet (len=36)
   62 0.789758959 192.168.1.12 → 10.6.15.156  TCP 66 54766 → 22 [ACK] Seq=389 Ack=28905 Win=2592 Len=0 TSval=7422667 TSecr=14354158
   63 0.793329958 192.168.1.12 → 10.6.15.156  SSH 150 Client: Encrypted packet (len=84)
   64 0.811613494  10.6.15.156 → 192.168.1.12 SSH 1514 Server: Encrypted packet (len=1448)
   65 0.811636936 192.168.1.12 → 10.6.15.156  SSH 158 Client: Encrypted packet (len=92)
   66 0.811783626  10.6.15.156 → 192.168.1.12 SSH 1446 Server: Encrypted packet (len=1380)
   67 0.812122041  10.6.15.156 → 192.168.1.12 TCP 1446 [TCP Retransmission] 22 → 54766 [PSH, ACK] Seq=30353 Ack=473 Win=1452 Len=1380 TSval=14354165 TSecr=7422668
   68 0.812130648 192.168.1.12 → 10.6.15.156  TCP 78 54766 → 22 [ACK] Seq=565 Ack=31733 Win=2592 Len=0 TSval=7422673 TSecr=14354165 SLE=30353 SRE=31733
   69 0.813064929 192.168.1.12 → 10.6.15.156  SSH 174 Client: Encrypted packet (len=108)
   70 0.817296447  10.6.15.156 → 192.168.1.12 TCP 66 22 → 54766 [ACK] Seq=31733 Ack=673 Win=1452 Len=0 TSval=14354165 TSecr=7422673
   71 0.818656922  10.6.15.156 → 192.168.1.12 SSH 414 Server: Encrypted packet (len=348)
   72 0.821311564  10.6.15.156 → 192.168.1.12 SSH 1514 Server: Encrypted packet (len=1448)
   73 0.821332873 192.168.1.12 → 10.6.15.156  TCP 66 54766 → 22 [ACK] Seq=673 Ack=33529 Win=2592 Len=0 TSval=7422675 TSecr=14354166
   74 0.821565742  10.6.15.156 → 192.168.1.12 SSH 1150 Server: Encrypted packet (len=1084)
   75 0.822988364 192.168.1.12 → 10.6.15.156  SSH 206 Client: Encrypted packet (len=140)
   76 0.827981551  10.6.15.156 → 192.168.1.12 SSH 342 Server: Encrypted packet (len=276)
   77 0.869267388 192.168.1.12 → 10.6.15.156  SSH 230 Client: Encrypted packet (len=164)
   78 0.875480208  10.6.15.156 → 192.168.1.12 SSH 182 Server: Encrypted packet (len=116)
   79 0.875509671 192.168.1.12 → 10.6.15.156  SSH 902 Client: Encrypted packet (len=836)
   80 0.876123099 192.168.1.12 → 10.6.15.156  SSH 126 Client: Encrypted packet (len=60)
   81 0.877895191  10.6.15.156 → 192.168.1.12 TCP 66 22 → 54766 [ACK] Seq=35005 Ack=1873 Win=1452 Len=0 TSval=14354181 TSecr=7422689
   82 0.885521870  10.6.15.156 → 192.168.1.12 SSH 1514 Server: Encrypted packet (len=1448)
   83 0.885704003  10.6.15.156 → 192.168.1.12 SSH 1514 Server: Encrypted packet (len=1448)
   84 0.885716665 192.168.1.12 → 10.6.15.156  TCP 66 54766 → 22 [ACK] Seq=1873 Ack=37901 Win=2592 Len=0 TSval=7422691 TSecr=14354183
   85 0.885836383  10.6.15.156 → 192.168.1.12 SSH 102 Server: Encrypted packet (len=36)
   86 0.887185329  10.6.15.156 → 192.168.1.12 SSH 1514 Server: Encrypted packet (len=1448)
   87 0.887207527 192.168.1.12 → 10.6.15.156  TCP 66 54766 → 22 [ACK] Seq=1873 Ack=39385 Win=2592 Len=0 TSval=7422692 TSecr=14354183
   88 0.887362939  10.6.15.156 → 192.168.1.12 SSH 1514 Server: Encrypted packet (len=1448)
   89 0.887556312  10.6.15.156 → 192.168.1.12 SSH 1514 Server: Encrypted packet (len=1448)
   90 0.887565993 192.168.1.12 → 10.6.15.156  TCP 66 54766 → 22 [ACK] Seq=1873 Ack=42281 Win=2592 Len=0 TSval=7422692 TSecr=14354183
   91 0.887747069  10.6.15.156 → 192.168.1.12 SSH 1514 Server: Encrypted packet (len=1448)
   92 0.888093395  10.6.15.156 → 192.168.1.12 SSH 1514 Server: Encrypted packet (len=1448)
   93 0.888105432 192.168.1.12 → 10.6.15.156  TCP 66 54766 → 22 [ACK] Seq=1873 Ack=45177 Win=2592 Len=0 TSval=7422692 TSecr=14354183
   94 0.888287627  10.6.15.156 → 192.168.1.12 SSH 1514 Server: Encrypted packet (len=1448)
   95 0.888475866  10.6.15.156 → 192.168.1.12 SSH 1514 Server: Encrypted packet (len=1448)
   96 0.888485200 192.168.1.12 → 10.6.15.156  TCP 66 54766 → 22 [ACK] Seq=1873 Ack=48073 Win=2592 Len=0 TSval=7422692 TSecr=14354183
   97 0.890587176  10.6.15.156 → 192.168.1.12 SSH 1514 Server: Encrypted packet (len=1448)
   98 0.890773654  10.6.15.156 → 192.168.1.12 SSH 1514 Server: Encrypted packet (len=1448)
   99 0.890782638 192.168.1.12 → 10.6.15.156  TCP 66 54766 → 22 [ACK] Seq=1873 Ack=50969 Win=2592 Len=0 TSval=7422693 TSecr=14354184
  100 0.890951044  10.6.15.156 → 192.168.1.12 SSH 394 Server: Encrypted packet (len=328)
  101 0.934100654 192.168.1.12 → 10.6.15.156  TCP 66 54766 → 22 [ACK] Seq=1873 Ack=51297 Win=2592 Len=0 TSval=7422704 TSecr=14354184
  102 1.031293461  10.6.15.156 → 192.168.1.12 SSH 138 Server: Encrypted packet (len=72)
  103 1.031313559 192.168.1.12 → 10.6.15.156  TCP 66 54766 → 22 [ACK] Seq=1873 Ack=51369 Win=2592 Len=0 TSval=7422728 TSecr=14354219
  104 1.031494860 192.168.1.12 → 10.6.15.156  SSH 102 Client: Encrypted packet (len=36)
  105 1.041248186  10.6.15.156 → 192.168.1.12 SSH 138 Server: Encrypted packet (len=72)
  106 1.041437162 192.168.1.12 → 10.6.15.156  SSH 102 Client: Encrypted packet (len=36)
  107 1.080100333  10.6.15.156 → 192.168.1.12 TCP 66 22 → 54766 [ACK] Seq=51441 Ack=1945 Win=1452 Len=0 TSval=14354232 TSecr=7422730
  108 1.136083903 192.168.1.12 → 10.6.15.156  SSH 102 Client: Encrypted packet (len=36)
  109 1.138634039  10.6.15.156 → 192.168.1.12 TCP 66 22 → 54766 [ACK] Seq=51441 Ack=1981 Win=1452 Len=0 TSval=14354246 TSecr=7422754
  110 1.138659417 192.168.1.12 → 10.6.15.156  SSH 102 Client: Encrypted packet (len=36)
  111 1.141703393  10.6.15.156 → 192.168.1.12 TCP 66 22 → 54766 [ACK] Seq=51441 Ack=2017 Win=1452 Len=0 TSval=14354247 TSecr=7422755
  112 1.142289670  10.6.15.156 → 192.168.1.12 SSH 166 Server: Encrypted packet (len=100)
  113 1.142305272  10.6.15.156 → 192.168.1.12 SSH 138 Server: Encrypted packet (len=72)
  114 1.142373746 192.168.1.12 → 10.6.15.156  TCP 66 54766 → 22 [ACK] Seq=2017 Ack=51613 Win=2592 Len=0 TSval=7422756 TSecr=14354247
  115 1.142551044 192.168.1.12 → 10.6.15.156  SSH 102 Client: Encrypted packet (len=36)
  116 1.183975692  10.6.15.156 → 192.168.1.12 TCP 66 22 → 54766 [ACK] Seq=51613 Ack=2053 Win=1452 Len=0 TSval=14354258 TSecr=7422756
  117 1.183998830 192.168.1.12 → 10.6.15.156  SSH 222 Client: Encrypted packet (len=156)
  118 1.185733768  10.6.15.156 → 192.168.1.12 TCP 66 22 → 54766 [ACK] Seq=51613 Ack=2209 Win=1452 Len=0 TSval=14354258 TSecr=7422766
  119 1.188244048  10.6.15.156 → 192.168.1.12 SSH 142 Server: Encrypted packet (len=76)
  120 1.221515577  10.6.15.156 → 192.168.1.12 SSH 534 Server: Encrypted packet (len=468)
  121 1.221536182 192.168.1.12 → 10.6.15.156  TCP 66 54766 → 22 [ACK] Seq=2209 Ack=52157 Win=2592 Len=0 TSval=7422775 TSecr=14354259
  122 1.223787746 192.168.1.12 → 10.6.15.156  SSH 134 Client: Encrypted packet (len=68)
  123 1.244878799  10.6.15.156 → 192.168.1.12 SSH 110 Server: Encrypted packet (len=44)
  124 1.245207036 192.168.1.12 → 10.6.15.156  SSH 190 Client: Encrypted packet (len=124)
  125 1.283783688  10.6.15.156 → 192.168.1.12 TCP 66 22 → 54766 [ACK] Seq=52201 Ack=2401 Win=1452 Len=0 TSval=14354283 TSecr=7422781
  126 1.289762099 192.168.1.12 → 10.6.15.156  SSH 742 Client: Encrypted packet (len=676)
  127 1.291815984  10.6.15.156 → 192.168.1.12 TCP 66 22 → 54766 [ACK] Seq=52201 Ack=3077 Win=1452 Len=0 TSval=14354285 TSecr=7422792
  128 1.295871108  10.6.15.156 → 192.168.1.12 SSH 390 Server: Encrypted packet (len=324)
  129 1.320100684 192.168.1.12 → 10.6.15.156  SSH 566 Client: Encrypted packet (len=500)
  130 1.320521377 192.168.1.12 → 10.6.15.156  SSH 134 Client: Encrypted packet (len=68)
  131 1.322084646  10.6.15.156 → 192.168.1.12 TCP 66 22 → 54766 [ACK] Seq=52525 Ack=3645 Win=1452 Len=0 TSval=14354292 TSecr=7422800
  132 1.325318145  10.6.15.156 → 192.168.1.12 SSH 302 Server: Encrypted packet (len=236)
  133 1.326352367 192.168.1.12 → 10.6.15.156  SSH 134 Client: Encrypted packet (len=68)
  134 1.356417251  10.6.15.156 → 192.168.1.12 SSH 1514 Server: Encrypted packet (len=1448)
  135 1.356712209  10.6.15.156 → 192.168.1.12 SSH 1406 Server: Encrypted packet (len=1340)
  136 1.356726091 192.168.1.12 → 10.6.15.156  TCP 66 54766 → 22 [ACK] Seq=3713 Ack=55549 Win=2592 Len=0 TSval=7422809 TSecr=14354301
  137 1.359287781 192.168.1.12 → 10.6.15.156  SSH 238 Client: Encrypted packet (len=172)
  138 1.399751988  10.6.15.156 → 192.168.1.12 TCP 66 22 → 54766 [ACK] Seq=55549 Ack=3885 Win=1452 Len=0 TSval=14354312 TSecr=7422810
  139 1.409044841 192.168.1.12 → 10.6.15.156  SSH 102 Client: Encrypted packet (len=36)
  140 1.410660575  10.6.15.156 → 192.168.1.12 TCP 66 22 → 54766 [ACK] Seq=55549 Ack=3921 Win=1452 Len=0 TSval=14354314 TSecr=7422822
  141 1.410675278 192.168.1.12 → 10.6.15.156  SSH 810 Client: Encrypted packet (len=744)
  142 1.412469769  10.6.15.156 → 192.168.1.12 SSH 166 Server: Encrypted packet (len=100)
  143 1.412607687  10.6.15.156 → 192.168.1.12 SSH 138 Server: Encrypted packet (len=72)
  144 1.412639384 192.168.1.12 → 10.6.15.156  TCP 66 54766 → 22 [ACK] Seq=4665 Ack=55721 Win=2592 Len=0 TSval=7422823 TSecr=14354315
  145 1.412656728 192.168.1.12 → 10.6.15.156  SSH 102 Client: Encrypted packet (len=36)
  146 1.416949270  10.6.15.156 → 192.168.1.12 SSH 382 Server: Encrypted packet (len=316)
  147 1.458087343 192.168.1.12 → 10.6.15.156  TCP 66 54766 → 22 [ACK] Seq=4701 Ack=56037 Win=2592 Len=0 TSval=7422835 TSecr=14354316
  148 1.468082702  10.6.15.156 → 192.168.1.12 SSH 174 Server: Encrypted packet (len=108)
  149 1.468152740 192.168.1.12 → 10.6.15.156  TCP 66 54766 → 22 [ACK] Seq=4701 Ack=56145 Win=2592 Len=0 TSval=7422837 TSecr=14354328
  150 1.470451045 192.168.1.12 → 10.6.15.156  SSH 678 Client: Encrypted packet (len=612)
  151 1.484234348  10.6.15.156 → 192.168.1.12 SSH 102 Server: Encrypted packet (len=36)
  152 1.484555508 192.168.1.12 → 10.6.15.156  SSH 150 Client: Encrypted packet (len=84)
  153 1.524833298  10.6.15.156 → 192.168.1.12 TCP 66 22 → 54766 [ACK] Seq=56181 Ack=5397 Win=1452 Len=0 TSval=14354343 TSecr=7422841
  154 1.557695016  10.6.15.156 → 192.168.1.12 SSH 222 Server: Encrypted packet (len=156)
  155 1.558551714 192.168.1.12 → 10.6.15.156  SSH 134 Client: Encrypted packet (len=68)
  156 1.560238828  10.6.15.156 → 192.168.1.12 TCP 66 22 → 54766 [ACK] Seq=56337 Ack=5465 Win=1452 Len=0 TSval=14354352 TSecr=7422860
  157 1.560830365 192.168.1.12 → 10.6.15.156  SSH 686 Client: Encrypted packet (len=620)
  158 1.562792156  10.6.15.156 → 192.168.1.12 TCP 66 22 → 54766 [ACK] Seq=56337 Ack=6085 Win=1452 Len=0 TSval=14354352 TSecr=7422860
  159 1.580701635 192.168.1.12 → 10.6.15.156  SSH 294 Client: Encrypted packet (len=228)
  160 1.581006262 192.168.1.12 → 10.6.15.156  SSH 278 Client: Encrypted packet (len=212)
  161 1.582468254  10.6.15.156 → 192.168.1.12 TCP 66 22 → 54766 [ACK] Seq=56337 Ack=6525 Win=1452 Len=0 TSval=14354357 TSecr=7422865
  162 1.588003492  10.6.15.156 → 192.168.1.12 SSH 598 Server: Encrypted packet (len=532)
  163 1.588094935  10.6.15.156 → 192.168.1.12 SSH 774 Server: Encrypted packet (len=708)
  164 1.588145118 192.168.1.12 → 10.6.15.156  TCP 66 54766 → 22 [ACK] Seq=6525 Ack=57577 Win=2592 Len=0 TSval=7422867 TSecr=14354358
  165 1.607869424  10.6.15.156 → 192.168.1.12 SSH 374 Server: Encrypted packet (len=308)
  166 1.607887213  10.6.15.156 → 192.168.1.12 SSH 230 Server: Encrypted packet (len=164)
  167 1.607941744 192.168.1.12 → 10.6.15.156  TCP 66 54766 → 22 [ACK] Seq=6525 Ack=58049 Win=2592 Len=0 TSval=7422872 TSecr=14354364
  168 1.635923484  10.6.15.156 → 192.168.1.12 SSH 542 Server: Encrypted packet (len=476)
  169 1.682086558 192.168.1.12 → 10.6.15.156  TCP 66 54766 → 22 [ACK] Seq=6525 Ack=58525 Win=2592 Len=0 TSval=7422891 TSecr=14354371
  170 1.795983611 192.168.1.12 → 10.6.15.156  SSH 774 Client: Encrypted packet (len=708)
  171 1.835720386  10.6.15.156 → 192.168.1.12 TCP 66 22 → 54766 [ACK] Seq=58525 Ack=7233 Win=1452 Len=0 TSval=14354421 TSecr=7422919
  172 1.837012743 192.168.1.12 → 10.6.15.156  SSH 1030 Client: Encrypted packet (len=964)
  173 1.839528027  10.6.15.156 → 192.168.1.12 TCP 66 22 → 54766 [ACK] Seq=58525 Ack=8197 Win=1452 Len=0 TSval=14354421 TSecr=7422929
  174 1.896884057  10.6.15.156 → 192.168.1.12 SSH 142 Server: Encrypted packet (len=76)
  175 1.896905199 192.168.1.12 → 10.6.15.156  TCP 66 54766 → 22 [ACK] Seq=8197 Ack=58601 Win=2592 Len=0 TSval=7422944 TSecr=14354436
  176 2.094539413  10.6.15.156 → 192.168.1.12 SSH 286 Server: Encrypted packet (len=220)
  177 2.094560194 192.168.1.12 → 10.6.15.156  TCP 66 54766 → 22 [ACK] Seq=8197 Ack=58821 Win=2592 Len=0 TSval=7422994 TSecr=14354485
  178 2.407161579  10.6.15.156 → 192.168.1.12 SSH 990 Server: Encrypted packet (len=924)
  179 2.407186411 192.168.1.12 → 10.6.15.156  TCP 66 54766 → 22 [ACK] Seq=8197 Ack=59745 Win=2592 Len=0 TSval=7423072 TSecr=14354563
  180 6.635196904  10.6.15.156 → 192.168.1.12 SSH 102 Server: Encrypted packet (len=36)
  181 6.635224756 192.168.1.12 → 10.6.15.156  TCP 66 54766 → 22 [ACK] Seq=8197 Ack=59781 Win=2592 Len=0 TSval=7424129 TSecr=14355620
  182 9.486093996  10.6.15.156 → 192.168.1.12 SSH 102 Server: Encrypted packet (len=36)
  183 9.486111479 192.168.1.12 → 10.6.15.156  TCP 66 54766 → 22 [ACK] Seq=8197 Ack=59817 Win=2592 Len=0 TSval=7424842 TSecr=14356333
  184 11.127469199  10.22.17.65 → 224.0.0.252  LLMNR 64 Standard query 0x8bde A wpad
  185 11.127593265  10.22.17.65 → 224.0.0.252  LLMNR 64 Standard query 0xc92a AAAA wpad
  186 11.213897783 192.168.1.12 → 192.168.1.1  DNS 81 Standard query 0x3fad A 0.ubuntu.pool.ntp.org
  187 11.216689509  192.168.1.1 → 192.168.1.12 DNS 145 Standard query response 0x3fad A 0.ubuntu.pool.ntp.org A 139.59.16.133 A 139.59.21.22 A 52.66.76.135 A 123.108.200.124
  188 11.217177263 192.168.1.12 → 139.59.16.133 NTP 90 NTP Version 4, client
  189 11.539590143  10.22.17.65 → 224.0.0.252  LLMNR 64 Standard query 0x8bde A wpad
  190 11.539674121  10.22.17.65 → 224.0.0.252  LLMNR 64 Standard query 0xc92a AAAA wpad
  191 11.776873271 192.168.1.12 → 10.6.15.156  SSH 1514 Client: Encrypted packet (len=1448)
  192 11.779589922  10.6.15.156 → 192.168.1.12 TCP 66 22 → 54766 [ACK] Seq=59817 Ack=9645 Win=1452 Len=0 TSval=14356907 TSecr=7425414
  193 11.779611346 192.168.1.12 → 10.6.15.156  SSH 382 Client: Encrypted packet (len=316)
  194 11.781223024  10.6.15.156 → 192.168.1.12 TCP 66 22 → 54766 [ACK] Seq=59817 Ack=9961 Win=1452 Len=0 TSval=14356907 TSecr=7425415
  195 11.784593600  10.6.15.156 → 192.168.1.12 SSH 142 Server: Encrypted packet (len=76)
  196 11.784611031 192.168.1.12 → 10.6.15.156  TCP 66 54766 → 22 [ACK] Seq=9961 Ack=59893 Win=2592 Len=0 TSval=7425416 TSecr=14356908
  197 11.896738463  10.6.15.156 → 192.168.1.12 SSH 910 Server: Encrypted packet (len=844)
  198 11.896757103 192.168.1.12 → 10.6.15.156  TCP 66 54766 → 22 [ACK] Seq=9961 Ack=60737 Win=2592 Len=0 TSval=7425444 TSecr=14356936
  199 11.897635040  10.6.15.156 → 192.168.1.12 SSH 486 Server: Encrypted packet (len=420)
  200 11.897653276 192.168.1.12 → 10.6.15.156  TCP 66 54766 → 22 [ACK] Seq=9961 Ack=61157 Win=2592 Len=0 TSval=7425444 TSecr=14356936
  201 11.898343665 192.168.1.12 → 10.6.15.156  SSH 134 Client: Encrypted packet (len=68)
  202 11.939687080  10.6.15.156 → 192.168.1.12 TCP 66 22 → 54766 [ACK] Seq=61157 Ack=10029 Win=1452 Len=0 TSval=14356947 TSecr=7425445
  203 19.509532251  10.6.15.156 → 192.168.1.12 SSH 202 Server: Encrypted packet (len=136)
  204 19.510355144  10.6.15.156 → 192.168.1.12 SSH 138 Server: Encrypted packet (len=72)
  205 19.510434722 192.168.1.12 → 10.6.15.156  TCP 66 54766 → 22 [ACK] Seq=10029 Ack=61365 Win=2592 Len=0 TSval=7427348 TSecr=14358839
  206 19.511505678  10.6.15.156 → 192.168.1.12 SSH 126 Server: Encrypted packet (len=60)
  207 19.511918767  10.6.15.156 → 192.168.1.12 SSH 102 Server: Encrypted packet (len=36)
  208 19.511996869 192.168.1.12 → 10.6.15.156  TCP 66 54766 → 22 [ACK] Seq=10029 Ack=61461 Win=2592 Len=0 TSval=7427348 TSecr=14358839
  209 22.213763084 192.168.1.12 → 192.168.1.1  DNS 81 Standard query 0x5875 A 3.ubuntu.pool.ntp.org
  210 22.215925227  192.168.1.1 → 192.168.1.12 DNS 145 Standard query response 0x5875 A 3.ubuntu.pool.ntp.org A 139.59.21.22 A 52.66.76.135 A 123.108.200.124 A 139.59.50.38
  211 22.216419950 192.168.1.12 → 139.59.21.22 NTP 90 NTP Version 4, client
  212 26.598118595 192.168.1.12 → 216.58.196.99 TCP 66 47232 → 443 [ACK] Seq=1 Ack=1 Win=362 Len=0 TSval=7429120 TSecr=3273701719
  213 26.600621675 216.58.196.99 → 192.168.1.12 TCP 66 [TCP ACKed unseen segment] 443 → 47232 [ACK] Seq=1 Ack=2 Win=202 Len=0 TSval=3273748571 TSecr=7383120
  214 31.213694646 192.168.1.12 → 192.168.1.1  DNS 81 Standard query 0xc236 A 1.ubuntu.pool.ntp.org
  215 31.215960662  192.168.1.1 → 192.168.1.12 DNS 145 Standard query response 0xc236 A 1.ubuntu.pool.ntp.org A 52.66.76.135 A 139.59.16.133 A 139.59.50.38 A 123.108.200.124
  216 31.216443628 192.168.1.12 → 52.66.76.135 NTP 90 NTP Version 4, client
