    1 0.000000000  10.6.15.144 → 192.168.1.16 SSH 214 Server: Encrypted packet (len=148)
    2 0.000017789  10.6.15.144 → 192.168.1.16 SSH 182 Server: Encrypted packet (len=116)
    3 0.000042356  10.6.15.144 → 192.168.1.16 SSH 298 Server: Encrypted packet (len=232)
    4 0.000080023 192.168.1.16 → 10.6.15.144  TCP 66 59298 → 22 [ACK] Seq=1 Ack=497 Win=3666 Len=0 TSval=4250953 TSecr=4846997
    5 0.000292729  10.6.15.144 → 192.168.1.16 SSH 1514 Server: Encrypted packet (len=1448)
    6 0.000337534 192.168.1.16 → 10.6.15.144  SSH 134 Client: Encrypted packet (len=68)
    7 0.000349250  10.6.15.144 → 192.168.1.16 TCP 562 [TCP Out-Of-Order] 22 → 59298 [PSH, ACK] Seq=1 Ack=1 Win=1452 Len=496 TSval=4847293 TSecr=4250609
    8 0.000355744 192.168.1.16 → 10.6.15.144  TCP 78 [TCP Dup ACK 6#1] 59298 → 22 [ACK] Seq=69 Ack=1945 Win=3666 Len=0 TSval=4250953 TSecr=4847036 SLE=1 SRE=497
    9 0.002024156 192.168.1.16 → 10.6.15.144  SSH 338 Client: Encrypted packet (len=272)
   10 0.011662253  10.6.15.144 → 192.168.1.16 SSH 1514 Server: Encrypted packet (len=1448)
   11 0.011808149  10.6.15.144 → 192.168.1.16 SSH 1514 Server: Encrypted packet (len=1448)
   12 0.011826147 192.168.1.16 → 10.6.15.144  TCP 66 59298 → 22 [ACK] Seq=341 Ack=4841 Win=3666 Len=0 TSval=4250956 TSecr=4847296
   13 0.012798019 192.168.1.16 → 10.6.15.144  SSH 214 Client: Encrypted packet (len=148)
   14 0.024941265  10.6.15.144 → 192.168.1.16 SSH 1514 Server: [TCP Previous segment not captured] , Encrypted packet (len=1448)
   15 0.024962981 192.168.1.16 → 10.6.15.144  TCP 78 [TCP Dup ACK 12#1] 59298 → 22 [ACK] Seq=489 Ack=4841 Win=3666 Len=0 TSval=4250959 TSecr=4847296 SLE=6289 SRE=7737
   16 0.025152901  10.6.15.144 → 192.168.1.16 SSH 1514 Server: Encrypted packet (len=1448)
   17 0.025176345 192.168.1.16 → 10.6.15.144  TCP 78 [TCP Dup ACK 12#2] 59298 → 22 [ACK] Seq=489 Ack=4841 Win=3666 Len=0 TSval=4250959 TSecr=4847296 SLE=6289 SRE=9185
   18 0.035729377  10.6.15.144 → 192.168.1.16 SSH 1514 Server: Encrypted packet (len=1448)
   19 0.035751569 192.168.1.16 → 10.6.15.144  TCP 78 [TCP Dup ACK 12#3] 59298 → 22 [ACK] Seq=489 Ack=4841 Win=3666 Len=0 TSval=4250961 TSecr=4847296 SLE=6289 SRE=10633
   20 0.035909056  10.6.15.144 → 192.168.1.16 SSH 1514 Server: Encrypted packet (len=1448)
   21 0.035918540 192.168.1.16 → 10.6.15.144  TCP 78 [TCP Dup ACK 12#4] 59298 → 22 [ACK] Seq=489 Ack=4841 Win=3666 Len=0 TSval=4250962 TSecr=4847296 SLE=6289 SRE=12081
   22 0.046550255  10.6.15.144 → 192.168.1.16 SSH 1514 Server: [TCP Fast Retransmission] , Encrypted packet (len=1448)
   23 0.046573804 192.168.1.16 → 10.6.15.144  TCP 66 59298 → 22 [ACK] Seq=489 Ack=12081 Win=3666 Len=0 TSval=4250964 TSecr=4847305
   24 0.046718418  10.6.15.144 → 192.168.1.16 SSH 1514 Server: Encrypted packet (len=1448)
   25 0.046722084 192.168.1.16 → 10.6.15.144  TCP 66 59298 → 22 [ACK] Seq=489 Ack=13529 Win=3666 Len=0 TSval=4250964 TSecr=4847305
   26 0.046918344 192.168.1.16 → 10.6.15.144  SSH 134 Client: Encrypted packet (len=68)
   27 0.047877601 192.168.1.16 → 10.6.15.144  SSH 206 Client: Encrypted packet (len=140)
   28 0.058834788  10.6.15.144 → 192.168.1.16 SSH 1514 Server: Encrypted packet (len=1448)
   29 0.059035653  10.6.15.144 → 192.168.1.16 SSH 1514 Server: Encrypted packet (len=1448)
   30 0.059042769 192.168.1.16 → 10.6.15.144  TCP 66 59298 → 22 [ACK] Seq=697 Ack=16425 Win=3666 Len=0 TSval=4250967 TSecr=4847308
   31 0.059398288  10.6.15.144 → 192.168.1.16 SSH 1514 Server: Encrypted packet (len=1448)
   32 0.059408547  10.6.15.144 → 192.168.1.16 TCP 66 22 → 59298 [ACK] Seq=17873 Ack=697 Win=1452 Len=0 TSval=4847308 TSecr=4250964
   33 0.070007626  10.6.15.144 → 192.168.1.16 SSH 1514 Server: Encrypted packet (len=1448)
   34 0.070027186 192.168.1.16 → 10.6.15.144  TCP 66 59298 → 22 [ACK] Seq=697 Ack=19321 Win=3666 Len=0 TSval=4250970 TSecr=4847308
   35 0.070207946  10.6.15.144 → 192.168.1.16 SSH 1514 Server: Encrypted packet (len=1448)
   36 0.081263748  10.6.15.144 → 192.168.1.16 SSH 1514 Server: Encrypted packet (len=1448)
   37 0.081284575 192.168.1.16 → 10.6.15.144  TCP 66 59298 → 22 [ACK] Seq=697 Ack=22217 Win=3666 Len=0 TSval=4250973 TSecr=4847311
   38 0.081465127  10.6.15.144 → 192.168.1.16 SSH 1514 Server: Encrypted packet (len=1448)
   39 0.092100223  10.6.15.144 → 192.168.1.16 SSH 1514 Server: Encrypted packet (len=1448)
   40 0.092119278 192.168.1.16 → 10.6.15.144  TCP 66 59298 → 22 [ACK] Seq=697 Ack=25113 Win=3666 Len=0 TSval=4250976 TSecr=4847314
   41 0.092290623  10.6.15.144 → 192.168.1.16 SSH 1514 Server: Encrypted packet (len=1448)
   42 0.102938676  10.6.15.144 → 192.168.1.16 SSH 1514 Server: Encrypted packet (len=1448)
   43 0.102956299 192.168.1.16 → 10.6.15.144  TCP 66 59298 → 22 [ACK] Seq=697 Ack=28009 Win=3666 Len=0 TSval=4250978 TSecr=4847317
   44 0.103138712  10.6.15.144 → 192.168.1.16 SSH 1514 Server: Encrypted packet (len=1448)
   45 0.113975859  10.6.15.144 → 192.168.1.16 SSH 1514 Server: Encrypted packet (len=1448)
   46 0.113996284 192.168.1.16 → 10.6.15.144  TCP 66 59298 → 22 [ACK] Seq=697 Ack=30905 Win=3666 Len=0 TSval=4250981 TSecr=4847319
   47 0.114179523  10.6.15.144 → 192.168.1.16 SSH 1514 Server: Encrypted packet (len=1448)
   48 0.126421683  10.6.15.144 → 192.168.1.16 SSH 1514 Server: Encrypted packet (len=1448)
   49 0.126442799 192.168.1.16 → 10.6.15.144  TCP 66 59298 → 22 [ACK] Seq=697 Ack=33801 Win=3666 Len=0 TSval=4250984 TSecr=4847322
   50 0.126621471  10.6.15.144 → 192.168.1.16 SSH 1514 Server: Encrypted packet (len=1448)
   51 0.129170001 192.168.1.16 → 10.6.15.144  SSH 206 Client: Encrypted packet (len=140)
   52 0.140579862  10.6.15.144 → 192.168.1.16 SSH 1514 Server: Encrypted packet (len=1448)
   53 0.140772104  10.6.15.144 → 192.168.1.16 SSH 1514 Server: Encrypted packet (len=1448)
   54 0.140780168 192.168.1.16 → 10.6.15.144  TCP 66 59298 → 22 [ACK] Seq=837 Ack=38145 Win=3666 Len=0 TSval=4250988 TSecr=4847329
   55 0.140984540  10.6.15.144 → 192.168.1.16 SSH 1514 Server: Encrypted packet (len=1448)
   56 0.141348187  10.6.15.144 → 192.168.1.16 SSH 1514 Server: Encrypted packet (len=1448)
   57 0.141353225 192.168.1.16 → 10.6.15.144  TCP 66 59298 → 22 [ACK] Seq=837 Ack=41041 Win=3666 Len=0 TSval=4250988 TSecr=4847329
   58 0.153072657  10.6.15.144 → 192.168.1.16 SSH 1514 Server: Encrypted packet (len=1448)
   59 0.153283188  10.6.15.144 → 192.168.1.16 SSH 1514 Server: Encrypted packet (len=1448)
   60 0.153289127 192.168.1.16 → 10.6.15.144  TCP 66 59298 → 22 [ACK] Seq=837 Ack=43937 Win=3666 Len=0 TSval=4250991 TSecr=4847332
   61 0.153496311  10.6.15.144 → 192.168.1.16 SSH 1514 Server: Encrypted packet (len=1448)
   62 0.153708787  10.6.15.144 → 192.168.1.16 SSH 1514 Server: Encrypted packet (len=1448)
   63 0.153713234 192.168.1.16 → 10.6.15.144  TCP 66 59298 → 22 [ACK] Seq=837 Ack=46833 Win=3666 Len=0 TSval=4250991 TSecr=4847332
   64 0.164408142  10.6.15.144 → 192.168.1.16 SSH 1514 Server: Encrypted packet (len=1448)
   65 0.164611136  10.6.15.144 → 192.168.1.16 SSH 1514 Server: Encrypted packet (len=1448)
   66 0.164618252 192.168.1.16 → 10.6.15.144  TCP 66 59298 → 22 [ACK] Seq=837 Ack=49729 Win=3666 Len=0 TSval=4250994 TSecr=4847335
   67 0.164825428  10.6.15.144 → 192.168.1.16 SSH 1514 Server: Encrypted packet (len=1448)
   68 0.164953616 192.168.1.16 → 10.6.15.144  SSH 102 Client: Encrypted packet (len=36)
   69 0.165190715  10.6.15.144 → 192.168.1.16 SSH 1514 Server: Encrypted packet (len=1448)
   70 0.175289674  10.6.15.144 → 192.168.1.16 SSH 1514 Server: Encrypted packet (len=1448)
   71 0.175312727 192.168.1.16 → 10.6.15.144  TCP 66 59298 → 22 [ACK] Seq=873 Ack=54073 Win=3666 Len=0 TSval=4250996 TSecr=4847335
   72 0.175489879  10.6.15.144 → 192.168.1.16 SSH 1514 Server: Encrypted packet (len=1448)
   73 0.175705074  10.6.15.144 → 192.168.1.16 SSH 1514 Server: Encrypted packet (len=1448)
   74 0.175714754 192.168.1.16 → 10.6.15.144  TCP 66 59298 → 22 [ACK] Seq=873 Ack=56969 Win=3666 Len=0 TSval=4250996 TSecr=4847337
   75 0.176075290  10.6.15.144 → 192.168.1.16 SSH 1514 Server: Encrypted packet (len=1448)
   76 0.176252916 192.168.1.16 → 10.6.15.144  SSH 102 Client: Encrypted packet (len=36)
   77 0.177244494 192.168.1.16 → 10.6.15.144  SSH 110 Client: Encrypted packet (len=44)
   78 0.186714639  10.6.15.144 → 192.168.1.16 SSH 1514 Server: Encrypted packet (len=1448)
   79 0.186917032  10.6.15.144 → 192.168.1.16 SSH 1514 Server: Encrypted packet (len=1448)
   80 0.186926690 192.168.1.16 → 10.6.15.144  TCP 66 59298 → 22 [ACK] Seq=953 Ack=61313 Win=3666 Len=0 TSval=4250999 TSecr=4847340
   81 0.187279956  10.6.15.144 → 192.168.1.16 SSH 1514 Server: Encrypted packet (len=1448)
   82 0.187311354  10.6.15.144 → 192.168.1.16 SSH 430 Server: Encrypted packet (len=364)
   83 0.187321750 192.168.1.16 → 10.6.15.144  TCP 66 59298 → 22 [ACK] Seq=953 Ack=63125 Win=3666 Len=0 TSval=4250999 TSecr=4847340
   84 0.187333668  10.6.15.144 → 192.168.1.16 TCP 66 22 → 59298 [ACK] Seq=63125 Ack=953 Win=1452 Len=0 TSval=4847341 TSecr=4250997
   85 0.219829062 192.168.1.16 → 224.0.0.251  IGMPv2 46 Membership Report group 224.0.0.251
   86 0.233813067  10.6.15.144 → 192.168.1.16 SSH 110 Server: Encrypted packet (len=44)
   87 0.234223611 192.168.1.16 → 10.6.15.144  SSH 374 Client: Encrypted packet (len=308)
   88 0.238605708  10.6.15.144 → 192.168.1.16 SSH 158 Server: Encrypted packet (len=92)
   89 0.274169829  10.6.15.144 → 192.168.1.16 SSH 142 Server: Encrypted packet (len=76)
   90 0.274192210 192.168.1.16 → 10.6.15.144  TCP 66 59298 → 22 [ACK] Seq=1261 Ack=63337 Win=3666 Len=0 TSval=4251021 TSecr=4847353
   91 0.294154204  10.6.15.144 → 192.168.1.16 SSH 246 Server: Encrypted packet (len=180)
   92 0.295576699 192.168.1.16 → 10.6.15.144  SSH 134 Client: Encrypted packet (len=68)
   93 0.314697338 192.168.1.16 → 10.6.15.144  SSH 502 Client: Encrypted packet (len=436)
   94 0.325119350  10.6.15.144 → 192.168.1.16 TCP 66 22 → 59298 [ACK] Seq=63517 Ack=1765 Win=1452 Len=0 TSval=4847375 TSecr=4251026
   95 0.336121051  10.6.15.144 → 192.168.1.16 SSH 138 Server: Encrypted packet (len=72)
   96 0.336445190 192.168.1.16 → 10.6.15.144  SSH 102 Client: Encrypted packet (len=36)
   97 0.382828880  10.6.15.144 → 192.168.1.16 TCP 66 22 → 59298 [ACK] Seq=63589 Ack=1801 Win=1452 Len=0 TSval=4847390 TSecr=4251037
   98 0.437539981  10.6.15.144 → 192.168.1.16 SSH 142 Server: Encrypted packet (len=76)
   99 0.479834185 192.168.1.16 → 10.6.15.144  TCP 66 59298 → 22 [ACK] Seq=1801 Ack=63665 Win=3666 Len=0 TSval=4251073 TSecr=4847403
  100 0.489020805 192.168.1.16 → 10.6.15.144  SSH 206 Client: Encrypted packet (len=140)
  101 0.491065907 192.168.1.16 → 10.6.15.144  SSH 102 Client: Encrypted packet (len=36)
  102 0.491231541 192.168.1.16 → 10.6.15.144  SSH 102 Client: Encrypted packet (len=36)
  103 0.493354981 192.168.1.16 → 10.6.15.144  SSH 118 Client: Encrypted packet (len=52)
  104 0.493584724 192.168.1.16 → 10.6.15.144  SSH 102 Client: Encrypted packet (len=36)
  105 0.498571922  10.6.15.144 → 192.168.1.16 TCP 66 22 → 59298 [ACK] Seq=63665 Ack=1941 Win=1452 Len=0 TSval=4847419 TSecr=4251075
  106 0.500331608  10.6.15.144 → 192.168.1.16 TCP 66 22 → 59298 [ACK] Seq=63665 Ack=2013 Win=1452 Len=0 TSval=4847419 TSecr=4251075
  107 0.502892656  10.6.15.144 → 192.168.1.16 TCP 66 22 → 59298 [ACK] Seq=63665 Ack=2101 Win=1452 Len=0 TSval=4847420 TSecr=4251076
  108 0.529226611 192.168.1.16 → 10.6.15.144  SSH 102 Client: Encrypted packet (len=36)
  109 0.529459095 192.168.1.16 → 10.6.15.144  SSH 102 Client: Encrypted packet (len=36)
  110 0.538796722  10.6.15.144 → 192.168.1.16 TCP 66 22 → 59298 [ACK] Seq=63665 Ack=2173 Win=1452 Len=0 TSval=4847429 TSecr=4251085
  111 0.546705873  10.6.15.144 → 192.168.1.16 SSH 102 Server: Encrypted packet (len=36)
  112 0.546724659  10.6.15.144 → 192.168.1.16 SSH 102 Server: Encrypted packet (len=36)
  113 0.546784933 192.168.1.16 → 10.6.15.144  TCP 66 59298 → 22 [ACK] Seq=2173 Ack=63737 Win=3666 Len=0 TSval=4251089 TSecr=4847430
  114 0.547270986 192.168.1.16 → 10.6.15.144  SSH 422 Client: Encrypted packet (len=356)
  115 0.547625504 192.168.1.16 → 10.6.15.144  SSH 158 Client: Encrypted packet (len=92)
  116 0.551689626 192.168.1.16 → 10.6.15.144  SSH 102 Client: Encrypted packet (len=36)
  117 0.552199195 192.168.1.16 → 10.6.15.144  SSH 102 Client: Encrypted packet (len=36)
  118 0.557167059  10.6.15.144 → 192.168.1.16 TCP 66 22 → 59298 [ACK] Seq=63737 Ack=2621 Win=1452 Len=0 TSval=4847433 TSecr=4251089
  119 0.557823707 192.168.1.16 → 10.6.15.144  SSH 102 Client: Encrypted packet (len=36)
  120 0.558109054 192.168.1.16 → 10.6.15.144  SSH 102 Client: Encrypted packet (len=36)
  121 0.562449305  10.6.15.144 → 192.168.1.16 TCP 66 22 → 59298 [ACK] Seq=63737 Ack=2693 Win=1452 Len=0 TSval=4847434 TSecr=4251090
  122 0.563564488 192.168.1.16 → 10.6.15.144  SSH 102 Client: Encrypted packet (len=36)
  123 0.563867056 192.168.1.16 → 10.6.15.144  SSH 102 Client: Encrypted packet (len=36)
  124 0.567981225  10.6.15.144 → 192.168.1.16 TCP 66 22 → 59298 [ACK] Seq=63737 Ack=2765 Win=1452 Len=0 TSval=4847436 TSecr=4251092
  125 0.570252498 192.168.1.16 → 10.6.15.144  SSH 102 Client: Encrypted packet (len=36)
  126 0.570626296 192.168.1.16 → 10.6.15.144  SSH 102 Client: Encrypted packet (len=36)
  127 0.573677689  10.6.15.144 → 192.168.1.16 TCP 66 22 → 59298 [ACK] Seq=63737 Ack=2837 Win=1452 Len=0 TSval=4847437 TSecr=4251093
  128 0.578055687 192.168.1.16 → 10.6.15.144  SSH 102 Client: Encrypted packet (len=36)
  129 0.578341259 192.168.1.16 → 10.6.15.144  SSH 102 Client: Encrypted packet (len=36)
  130 0.580234353  10.6.15.144 → 192.168.1.16 TCP 66 22 → 59298 [ACK] Seq=63737 Ack=2909 Win=1452 Len=0 TSval=4847439 TSecr=4251095
  131 0.587565782  10.6.15.144 → 192.168.1.16 TCP 66 22 → 59298 [ACK] Seq=63737 Ack=2981 Win=1452 Len=0 TSval=4847441 TSecr=4251097
  132 0.601510775  10.6.15.144 → 192.168.1.16 SSH 222 Server: Encrypted packet (len=156)
  133 0.601535740  10.6.15.144 → 192.168.1.16 SSH 182 Server: Encrypted packet (len=116)
  134 0.601576323 192.168.1.16 → 10.6.15.144  TCP 66 59298 → 22 [ACK] Seq=2981 Ack=64009 Win=3666 Len=0 TSval=4251103 TSecr=4847444
  135 0.601780049 192.168.1.16 → 10.6.15.144  SSH 134 Client: Encrypted packet (len=68)
  136 0.602542615 192.168.1.16 → 10.6.15.144  SSH 134 Client: Encrypted packet (len=68)
  137 0.614337504  10.6.15.144 → 192.168.1.16 TCP 66 22 → 59298 [ACK] Seq=64009 Ack=3117 Win=1452 Len=0 TSval=4847447 TSecr=4251103
  138 0.615438639  10.6.15.144 → 192.168.1.16 SSH 134 Server: Encrypted packet (len=68)
  139 0.615468040  10.6.15.144 → 192.168.1.16 SSH 138 Server: Encrypted packet (len=72)
  140 0.615515542 192.168.1.16 → 10.6.15.144  TCP 66 59298 → 22 [ACK] Seq=3117 Ack=64149 Win=3666 Len=0 TSval=4251106 TSecr=4847448
  141 0.615687286 192.168.1.16 → 10.6.15.144  SSH 102 Client: Encrypted packet (len=36)
  142 0.664850251  10.6.15.144 → 192.168.1.16 TCP 66 22 → 59298 [ACK] Seq=64149 Ack=3153 Win=1452 Len=0 TSval=4847460 TSecr=4251106
  143 0.670294017  10.6.15.144 → 192.168.1.16 SSH 126 Server: Encrypted packet (len=60)
  144 0.670314126  10.6.15.144 → 192.168.1.16 SSH 138 Server: Encrypted packet (len=72)
  145 0.670380400 192.168.1.16 → 10.6.15.144  TCP 66 59298 → 22 [ACK] Seq=3153 Ack=64281 Win=3666 Len=0 TSval=4251120 TSecr=4847461
  146 0.670609981 192.168.1.16 → 10.6.15.144  SSH 102 Client: Encrypted packet (len=36)
  147 0.679865346  10.6.15.144 → 192.168.1.16 TCP 66 22 → 59298 [ACK] Seq=64281 Ack=3189 Win=1452 Len=0 TSval=4847464 TSecr=4251120
  148 0.684639991  10.6.15.144 → 192.168.1.16 SSH 910 Server: Encrypted packet (len=844)
  149 0.688634774  10.6.15.144 → 192.168.1.16 SSH 134 Server: Encrypted packet (len=68)
  150 0.688655511  10.6.15.144 → 192.168.1.16 SSH 138 Server: Encrypted packet (len=72)
  151 0.688727503 192.168.1.16 → 10.6.15.144  TCP 66 59298 → 22 [ACK] Seq=3189 Ack=65265 Win=3666 Len=0 TSval=4251125 TSecr=4847465
  152 0.689021064 192.168.1.16 → 10.6.15.144  SSH 102 Client: Encrypted packet (len=36)
  153 0.692183135  10.6.15.144 → 192.168.1.16 SSH 126 Server: Encrypted packet (len=60)
  154 0.692200371  10.6.15.144 → 192.168.1.16 SSH 138 Server: Encrypted packet (len=72)
  155 0.692258616 192.168.1.16 → 10.6.15.144  TCP 66 59298 → 22 [ACK] Seq=3225 Ack=65397 Win=3666 Len=0 TSval=4251126 TSecr=4847467
  156 0.692463742 192.168.1.16 → 10.6.15.144  SSH 102 Client: Encrypted packet (len=36)
  157 0.698756697  10.6.15.144 → 192.168.1.16 SSH 198 Server: Encrypted packet (len=132)
  158 0.699039651 192.168.1.16 → 10.6.15.144  SSH 102 Client: Encrypted packet (len=36)
  159 0.702253072  10.6.15.144 → 192.168.1.16 TCP 66 22 → 59298 [ACK] Seq=65529 Ack=3261 Win=1452 Len=0 TSval=4847469 TSecr=4251125
  160 0.710103437  10.6.15.144 → 192.168.1.16 SSH 126 Server: Encrypted packet (len=60)
  161 0.710125036  10.6.15.144 → 192.168.1.16 SSH 138 Server: Encrypted packet (len=72)
  162 0.710179330 192.168.1.16 → 10.6.15.144  TCP 66 59298 → 22 [ACK] Seq=3297 Ack=65661 Win=3666 Len=0 TSval=4251130 TSecr=4847471
  163 0.710473724 192.168.1.16 → 10.6.15.144  SSH 102 Client: Encrypted packet (len=36)
  164 0.721684404  10.6.15.144 → 192.168.1.16 SSH 138 Server: [TCP Previous segment not captured] , Encrypted packet (len=72)
  165 0.721703604 192.168.1.16 → 10.6.15.144  TCP 78 [TCP Dup ACK 162#1] 59298 → 22 [ACK] Seq=3333 Ack=65661 Win=3666 Len=0 TSval=4251133 TSecr=4847471 SLE=65721 SRE=65793
  166 0.760861099  10.6.15.144 → 192.168.1.16 SSH 110 Server: Encrypted packet (len=44)
  167 0.760877554 192.168.1.16 → 10.6.15.144  TCP 78 [TCP Dup ACK 162#2] 59298 → 22 [ACK] Seq=3333 Ack=65661 Win=3666 Len=0 TSval=4251143 TSecr=4847471 SLE=65721 SRE=65837
  168 0.782706391  10.6.15.144 → 192.168.1.16 SSH 102 Server: Encrypted packet (len=36)
  169 0.782727196 192.168.1.16 → 10.6.15.144  TCP 78 [TCP Dup ACK 162#3] 59298 → 22 [ACK] Seq=3333 Ack=65661 Win=3666 Len=0 TSval=4251148 TSecr=4847471 SLE=65721 SRE=65873
  170 0.788851156  10.6.15.144 → 192.168.1.16 SSH 102 Server: Encrypted packet (len=36)
  171 0.788874147 192.168.1.16 → 10.6.15.144  TCP 78 [TCP Dup ACK 162#4] 59298 → 22 [ACK] Seq=3333 Ack=65661 Win=3666 Len=0 TSval=4251150 TSecr=4847471 SLE=65721 SRE=65909
  172 0.790354540 192.168.1.16 → 10.6.15.144  SSH 114 Client: Encrypted packet (len=36)
  173 0.791072560 192.168.1.16 → 10.6.15.144  SSH 122 Client: Encrypted packet (len=44)
  174 0.792595161  10.6.15.144 → 192.168.1.16 SSH 126 Server: [TCP Fast Retransmission] , Encrypted packet (len=60)
  175 0.792620318 192.168.1.16 → 10.6.15.144  TCP 66 59298 → 22 [ACK] Seq=3413 Ack=65909 Win=3666 Len=0 TSval=4251151 TSecr=4847492
  176 0.792922048 192.168.1.16 → 10.6.15.144  SSH 102 Client: Encrypted packet (len=36)
  177 0.794994706  10.6.15.144 → 192.168.1.16 SSH 102 Server: Encrypted packet (len=36)
  178 0.796234499 192.168.1.16 → 10.6.15.144  SSH 190 Client: Encrypted packet (len=124)
  179 0.796504317 192.168.1.16 → 10.6.15.144  SSH 234 Client: Encrypted packet (len=168)
  180 0.798317438 192.168.1.16 → 10.6.15.144  SSH 158 Client: Encrypted packet (len=92)
  181 0.801101907  10.6.15.144 → 192.168.1.16 TCP 66 22 → 59298 [ACK] Seq=65945 Ack=3413 Win=1452 Len=0 TSval=4847494 TSecr=4251150
  182 0.802962907  10.6.15.144 → 192.168.1.16 SSH 102 Server: Encrypted packet (len=36)
  183 0.804820104  10.6.15.144 → 192.168.1.16 SSH 126 Server: Encrypted packet (len=60)
  184 0.804888641 192.168.1.16 → 10.6.15.144  TCP 66 59298 → 22 [ACK] Seq=3833 Ack=66041 Win=3666 Len=0 TSval=4251154 TSecr=4847494
  185 0.806035950  10.6.15.144 → 192.168.1.16 SSH 138 Server: Encrypted packet (len=72)
  186 0.806131812 192.168.1.16 → 10.6.15.144  SSH 150 Client: Encrypted packet (len=84)
  187 0.806409292 192.168.1.16 → 10.6.15.144  SSH 102 Client: Encrypted packet (len=36)
  188 0.807424019 192.168.1.16 → 10.6.15.144  SSH 102 Client: Encrypted packet (len=36)
  189 0.808002816 192.168.1.16 → 10.6.15.144  SSH 118 Client: Encrypted packet (len=52)
  190 0.808334991  10.6.15.144 → 192.168.1.16 TCP 66 22 → 59298 [ACK] Seq=66113 Ack=3833 Win=1452 Len=0 TSval=4847496 TSecr=4251152
  191 0.816139514  10.6.15.144 → 192.168.1.16 TCP 66 22 → 59298 [ACK] Seq=66113 Ack=3953 Win=1452 Len=0 TSval=4847498 TSecr=4251154
  192 0.818817436  10.6.15.144 → 192.168.1.16 TCP 66 22 → 59298 [ACK] Seq=66113 Ack=4041 Win=1452 Len=0 TSval=4847498 TSecr=4251154
  193 0.843526344  10.6.15.144 → 192.168.1.16 SSH 126 Server: Encrypted packet (len=60)
  194 0.843542139  10.6.15.144 → 192.168.1.16 SSH 138 Server: Encrypted packet (len=72)
  195 0.843597595 192.168.1.16 → 10.6.15.144  TCP 66 59298 → 22 [ACK] Seq=4041 Ack=66245 Win=3666 Len=0 TSval=4251163 TSecr=4847505
  196 0.843768846 192.168.1.16 → 10.6.15.144  SSH 102 Client: Encrypted packet (len=36)
  197 0.862850977  10.6.15.144 → 192.168.1.16 SSH 126 Server: Encrypted packet (len=60)
  198 0.862868358  10.6.15.144 → 192.168.1.16 SSH 138 Server: Encrypted packet (len=72)
  199 0.862922090 192.168.1.16 → 10.6.15.144  TCP 66 59298 → 22 [ACK] Seq=4077 Ack=66377 Win=3666 Len=0 TSval=4251168 TSecr=4847509
  200 0.863101077 192.168.1.16 → 10.6.15.144  SSH 102 Client: Encrypted packet (len=36)
  201 0.911245055  10.6.15.144 → 192.168.1.16 TCP 66 22 → 59298 [ACK] Seq=66377 Ack=4113 Win=1452 Len=0 TSval=4847522 TSecr=4251168
  202 0.985252010  10.6.15.144 → 192.168.1.16 SSH 398 Server: Encrypted packet (len=332)
  203 1.016096915  10.6.15.144 → 192.168.1.16 SSH 102 Server: Encrypted packet (len=36)
  204 1.016111284 192.168.1.16 → 10.6.15.144  TCP 66 59298 → 22 [ACK] Seq=4113 Ack=66745 Win=3666 Len=0 TSval=4251207 TSecr=4847540
  205 1.016416523 192.168.1.16 → 10.6.15.144  SSH 206 Client: Encrypted packet (len=140)
  206 1.023509311  10.6.15.144 → 192.168.1.16 SSH 238 Server: Encrypted packet (len=172)
  207 1.023792333 192.168.1.16 → 10.6.15.144  SSH 134 Client: Encrypted packet (len=68)
  208 1.024312382 192.168.1.16 → 10.6.15.144  SSH 1514 Client: Encrypted packet (len=1448)
  209 1.025125408 192.168.1.16 → 10.6.15.144  SSH 686 Client: Encrypted packet (len=620)
  210 1.025702718  10.6.15.144 → 192.168.1.16 SSH 182 Server: Encrypted packet (len=116)
  211 1.025999716 192.168.1.16 → 10.6.15.144  SSH 134 Client: Encrypted packet (len=68)
  212 1.026445030 192.168.1.16 → 10.6.15.144  SSH 550 Client: Encrypted packet (len=484)
  213 1.026948755  10.6.15.144 → 192.168.1.16 TCP 66 22 → 59298 [ACK] Seq=67033 Ack=4253 Win=1452 Len=0 TSval=4847550 TSecr=4251207
  214 1.026958956 192.168.1.16 → 10.6.15.144  SSH 1514 Client: Encrypted packet (len=1448)
  215 1.026964996 192.168.1.16 → 10.6.15.144  SSH 334 Client: Encrypted packet (len=268)
  216 1.030690345  10.6.15.144 → 192.168.1.16 SSH 218 Server: Encrypted packet (len=152)
  217 1.033020859  10.6.15.144 → 192.168.1.16 SSH 182 Server: Encrypted packet (len=116)
  218 1.033080252 192.168.1.16 → 10.6.15.144  TCP 66 59298 → 22 [ACK] Seq=8657 Ack=67301 Win=3666 Len=0 TSval=4251211 TSecr=4847551
  219 1.035242010  10.6.15.144 → 192.168.1.16 TCP 66 22 → 59298 [ACK] Seq=67301 Ack=6389 Win=1452 Len=0 TSval=4847553 TSecr=4251208
  220 1.035261633 192.168.1.16 → 10.6.15.144  SSH 1514 Client: Encrypted packet (len=1448)
  221 1.035274027 192.168.1.16 → 10.6.15.144  SSH 1514 Client: Encrypted packet (len=1448)
  222 1.035405356  10.6.15.144 → 192.168.1.16 SSH 182 Server: Encrypted packet (len=116)
  223 1.036849380 192.168.1.16 → 10.6.15.144  SSH 1514 Client: Encrypted packet (len=1448)
  224 1.036974996  10.6.15.144 → 192.168.1.16 TCP 66 22 → 59298 [ACK] Seq=67417 Ack=6941 Win=1452 Len=0 TSval=4847553 TSecr=4251209
  225 1.036984683 192.168.1.16 → 10.6.15.144  SSH 1514 Client: Encrypted packet (len=1448)
  226 1.044144647 192.168.1.16 → 10.6.15.144  SSH 1078 Client: Encrypted packet (len=1012)
  227 1.047914813  10.6.15.144 → 192.168.1.16 TCP 66 22 → 59298 [ACK] Seq=67417 Ack=8657 Win=1452 Len=0 TSval=4847553 TSecr=4251209
  228 1.048049648  10.6.15.144 → 192.168.1.16 TCP 66 22 → 59298 [ACK] Seq=67417 Ack=11553 Win=1452 Len=0 TSval=4847555 TSecr=4251211
  229 1.053116645  10.6.15.144 → 192.168.1.16 TCP 66 22 → 59298 [ACK] Seq=67417 Ack=14449 Win=1452 Len=0 TSval=4847557 TSecr=4251212
  230 1.095259258  10.6.15.144 → 192.168.1.16 TCP 66 22 → 59298 [ACK] Seq=67417 Ack=15461 Win=1452 Len=0 TSval=4847568 TSecr=4251214
  231 1.126032219  10.22.18.17 → 224.0.0.252  LLMNR 64 Standard query 0xec77 A wpad
  232 1.128106096  10.22.18.17 → 224.0.0.252  LLMNR 64 Standard query 0x2acd AAAA wpad
  233 2.013703977  10.6.15.144 → 192.168.1.16 SSH 214 Server: Encrypted packet (len=148)
  234 2.013887428  10.6.15.144 → 192.168.1.16 SSH 454 Server: Encrypted packet (len=388)
  235 2.013915501 192.168.1.16 → 10.6.15.144  TCP 66 59298 → 22 [ACK] Seq=15461 Ack=67953 Win=3666 Len=0 TSval=4251456 TSecr=4847604
  236 2.014005922 192.168.1.16 → 10.6.15.144  SSH 134 Client: Encrypted packet (len=68)
  237 2.014041854  10.6.15.144 → 192.168.1.16 SSH 214 Server: Encrypted packet (len=148)
  238 2.014232913  10.6.15.144 → 192.168.1.16 SSH 454 Server: Encrypted packet (len=388)
  239 2.014262544 192.168.1.16 → 10.6.15.144  TCP 66 59298 → 22 [ACK] Seq=15529 Ack=68489 Win=3666 Len=0 TSval=4251456 TSecr=4847609
  240 2.014535198  10.6.15.144 → 192.168.1.16 SSH 1230 Server: Encrypted packet (len=1164)
  241 2.014802928  10.6.15.144 → 192.168.1.16 TCP 1138 [TCP Out-Of-Order] 22 → 59298 [PSH, ACK] Seq=67417 Ack=15461 Win=1452 Len=1072 TSval=4847673 TSecr=4251214
  242 2.014812441 192.168.1.16 → 10.6.15.144  TCP 78 59298 → 22 [ACK] Seq=15529 Ack=69653 Win=3666 Len=0 TSval=4251456 TSecr=4847673 SLE=67417 SRE=68489
  243 2.014913411  10.22.18.17 → 224.0.0.252  LLMNR 64 Standard query 0xec77 A wpad
  244 2.015048878  10.22.18.17 → 224.0.0.252  LLMNR 64 Standard query 0x2acd AAAA wpad
  245 2.015131139 192.168.1.16 → 10.6.15.144  SSH 1514 Client: Encrypted packet (len=1448)
  246 2.015350639  10.6.15.144 → 192.168.1.16 TCP 1138 [TCP Out-Of-Order] 22 → 59298 [PSH, ACK] Seq=67417 Ack=15461 Win=1452 Len=1072 TSval=4847781 TSecr=4251214
  247 2.015358247 192.168.1.16 → 10.6.15.144  TCP 78 [TCP Dup ACK 242#1] 59298 → 22 [ACK] Seq=16977 Ack=69653 Win=3666 Len=0 TSval=4251456 TSecr=4847673 SLE=67417 SRE=68489
  248 2.016442393 192.168.1.16 → 10.6.15.144  SSH 1514 Client: Encrypted packet (len=1448)
  249 2.016457810 192.168.1.16 → 10.6.15.144  SSH 254 Client: Encrypted packet (len=188)
  250 2.019115504 192.168.1.16 → 10.6.15.144  SSH 478 Client: Encrypted packet (len=412)
  251 2.020977002 192.168.1.16 → 10.6.15.144  SSH 550 Client: Encrypted packet (len=484)
  252 2.021309890 192.168.1.16 → 10.6.15.144  SSH 1514 Client: Encrypted packet (len=1448)
  253 2.021389880 192.168.1.16 → 10.6.15.144  SSH 318 Client: Encrypted packet (len=252)
  254 2.025399904  10.6.15.144 → 192.168.1.16 TCP 66 22 → 59298 [ACK] Seq=69653 Ack=15529 Win=1452 Len=0 TSval=4847800 TSecr=4251456
  255 2.025417473 192.168.1.16 → 10.6.15.144  SSH 1514 Client: Encrypted packet (len=1448)
  256 2.026555563  10.6.15.144 → 192.168.1.16 SSH 1230 Server: [TCP Spurious Retransmission] , Encrypted packet (len=1164)
  257 2.026567931 192.168.1.16 → 10.6.15.144  TCP 78 [TCP Dup ACK 242#2] 59298 → 22 [ACK] Seq=22657 Ack=69653 Win=3666 Len=0 TSval=4251459 TSecr=4847800 SLE=68489 SRE=69653
  258 2.026667665  10.6.15.144 → 192.168.1.16 SSH 102 Server: Encrypted packet (len=36)
  259 2.026674978 192.168.1.16 → 10.6.15.144  TCP 66 59298 → 22 [ACK] Seq=22657 Ack=69689 Win=3666 Len=0 TSval=4251459 TSecr=4847800
  260 2.027343337  10.6.15.144 → 192.168.1.16 TCP 66 22 → 59298 [ACK] Seq=69689 Ack=18613 Win=1452 Len=0 TSval=4847801 TSecr=4251456
  261 2.027351616 192.168.1.16 → 10.6.15.144  SSH 1514 Client: Encrypted packet (len=1448)
  262 2.027357227 192.168.1.16 → 10.6.15.144  SSH 1514 Client: Encrypted packet (len=1448)
  263 2.028210814 192.168.1.16 → 10.6.15.144  SSH 1514 Client: Encrypted packet (len=1448)
  264 2.031216605  10.6.15.144 → 192.168.1.16 TCP 66 22 → 59298 [ACK] Seq=69689 Ack=19509 Win=1452 Len=0 TSval=4847802 TSecr=4251457
  265 2.031227185 192.168.1.16 → 10.6.15.144  SSH 1514 Client: Encrypted packet (len=1448)
  266 2.031233962 192.168.1.16 → 10.6.15.144  SSH 1514 Client: Encrypted packet (len=1448)
  267 2.032979532  10.6.15.144 → 192.168.1.16 TCP 66 22 → 59298 [ACK] Seq=69689 Ack=21209 Win=1452 Len=0 TSval=4847802 TSecr=4251458
  268 2.032992527 192.168.1.16 → 10.6.15.144  SSH 862 Client: Encrypted packet (len=796)
  269 2.038294551  10.6.15.144 → 192.168.1.16 TCP 66 22 → 59298 [ACK] Seq=69689 Ack=24105 Win=1452 Len=0 TSval=4847803 TSecr=4251459
  270 2.039604782  10.6.15.144 → 192.168.1.16 TCP 66 22 → 59298 [ACK] Seq=69689 Ack=27001 Win=1452 Len=0 TSval=4847804 TSecr=4251459
  271 2.042605893  10.6.15.144 → 192.168.1.16 TCP 66 22 → 59298 [ACK] Seq=69689 Ack=29897 Win=1452 Len=0 TSval=4847804 TSecr=4251460
  272 2.081740108  10.6.15.144 → 192.168.1.16 TCP 66 22 → 59298 [ACK] Seq=69689 Ack=30693 Win=1452 Len=0 TSval=4847815 TSecr=4251461
  273 2.136403686 192.168.1.16 → 10.6.15.144  SSH 246 Client: Encrypted packet (len=180)
  274 2.140583488 192.168.1.16 → 10.6.15.144  SSH 102 Client: Encrypted packet (len=36)
  275 2.140805745 192.168.1.16 → 10.6.15.144  SSH 110 Client: Encrypted packet (len=44)
  276 2.146060426  10.6.15.144 → 192.168.1.16 TCP 66 22 → 59298 [ACK] Seq=69689 Ack=30873 Win=1452 Len=0 TSval=4847830 TSecr=4251487
  277 2.150128234  10.6.15.144 → 192.168.1.16 TCP 66 22 → 59298 [ACK] Seq=69689 Ack=30909 Win=1452 Len=0 TSval=4847831 TSecr=4251488
  278 2.150149482  10.6.15.144 → 192.168.1.16 TCP 66 22 → 59298 [ACK] Seq=69689 Ack=30953 Win=1452 Len=0 TSval=4847831 TSecr=4251488
  279 2.244961537  10.6.15.144 → 192.168.1.16 SSH 646 Server: Encrypted packet (len=580)
  280 2.252744338  10.6.15.144 → 192.168.1.16 SSH 1278 Server: Encrypted packet (len=1212)
  281 2.252760250 192.168.1.16 → 10.6.15.144  TCP 66 59298 → 22 [ACK] Seq=30953 Ack=71481 Win=3666 Len=0 TSval=4251516 TSecr=4847855
  282 2.255108893  10.6.15.144 → 192.168.1.16 SSH 446 Server: Encrypted packet (len=380)
  283 2.263310750  10.6.15.144 → 192.168.1.16 SSH 1330 Server: Encrypted packet (len=1264)
  284 2.263333123 192.168.1.16 → 10.6.15.144  TCP 66 59298 → 22 [ACK] Seq=30953 Ack=73125 Win=3666 Len=0 TSval=4251518 TSecr=4847857
  285 2.263979454 192.168.1.16 → 10.6.15.144  SSH 134 Client: Encrypted packet (len=68)
  286 2.265799455 192.168.1.16 → 10.6.15.144  SSH 1514 Client: Encrypted packet (len=1448)
  287 2.267941508 192.168.1.16 → 10.6.15.144  SSH 1514 Client: Encrypted packet (len=1448)
  288 2.267962243 192.168.1.16 → 10.6.15.144  SSH 1514 Client: Encrypted packet (len=1448)
  289 2.268767279 192.168.1.16 → 10.6.15.144  SSH 1514 Client: Encrypted packet (len=1448)
  290 2.269455064 192.168.1.16 → 10.6.15.144  SSH 1514 Client: Encrypted packet (len=1448)
  291 2.278259687 192.168.1.16 → 10.6.15.144  SSH 1514 Client: Encrypted packet (len=1448)
  292 2.278278947 192.168.1.16 → 10.6.15.144  SSH 1514 Client: Encrypted packet (len=1448)
  293 2.278351441  10.6.15.144 → 192.168.1.16 TCP 66 22 → 59298 [ACK] Seq=73125 Ack=31021 Win=1452 Len=0 TSval=4847863 TSecr=4251519
  294 2.279790317 192.168.1.16 → 10.6.15.144  SSH 1514 Client: Encrypted packet (len=1448)
  295 2.279807695 192.168.1.16 → 10.6.15.144  SSH 1514 Client: Encrypted packet (len=1448)
  296 2.281415044  10.6.15.144 → 192.168.1.16 TCP 66 22 → 59298 [ACK] Seq=73125 Ack=33917 Win=1452 Len=0 TSval=4847863 TSecr=4251519
  297 2.281437575 192.168.1.16 → 10.6.15.144  SSH 802 Client: Encrypted packet (len=736)
  298 2.286488848  10.6.15.144 → 192.168.1.16 TCP 66 22 → 59298 [ACK] Seq=73125 Ack=36813 Win=1452 Len=0 TSval=4847865 TSecr=4251520
  299 2.289581342  10.6.15.144 → 192.168.1.16 TCP 66 22 → 59298 [ACK] Seq=73125 Ack=39709 Win=1452 Len=0 TSval=4847866 TSecr=4251520
  300 2.290548670  10.6.15.144 → 192.168.1.16 TCP 66 22 → 59298 [ACK] Seq=73125 Ack=42605 Win=1452 Len=0 TSval=4847866 TSecr=4251522
  301 2.291785939  10.6.15.144 → 192.168.1.16 TCP 66 22 → 59298 [ACK] Seq=73125 Ack=44789 Win=1452 Len=0 TSval=4847867 TSecr=4251522
  302 2.311110084  10.6.15.144 → 192.168.1.16 SSH 138 Server: Encrypted packet (len=72)
  303 2.311298941 192.168.1.16 → 10.6.15.144  SSH 102 Client: Encrypted packet (len=36)
  304 2.364680033  10.6.15.144 → 192.168.1.16 SSH 134 Server: Encrypted packet (len=68)
  305 2.364699398  10.6.15.144 → 192.168.1.16 SSH 138 Server: Encrypted packet (len=72)
  306 2.364757792 192.168.1.16 → 10.6.15.144  TCP 66 59298 → 22 [ACK] Seq=44825 Ack=73337 Win=3666 Len=0 TSval=4251544 TSecr=4847885
  307 2.364919257 192.168.1.16 → 10.6.15.144  SSH 102 Client: Encrypted packet (len=36)
  308 2.390442374 192.168.1.16 → 10.6.15.144  SSH 1514 Client: Encrypted packet (len=1448)
  309 2.390466131 192.168.1.16 → 10.6.15.144  SSH 1514 Client: Encrypted packet (len=1448)
  310 2.392241593 192.168.1.16 → 10.6.15.144  SSH 1514 Client: Encrypted packet (len=1448)
  311 2.392940412 192.168.1.16 → 10.6.15.144  SSH 1514 Client: Encrypted packet (len=1448)
  312 2.393639518 192.168.1.16 → 10.6.15.144  SSH 1514 Client: Encrypted packet (len=1448)
  313 2.394375858 192.168.1.16 → 10.6.15.144  SSH 1514 Client: Encrypted packet (len=1448)
  314 2.395073574 192.168.1.16 → 10.6.15.144  SSH 1514 Client: Encrypted packet (len=1448)
  315 2.395762198 192.168.1.16 → 10.6.15.144  SSH 1514 Client: Encrypted packet (len=1448)
  316 2.401204541  10.6.15.144 → 192.168.1.16 TCP 66 22 → 59298 [ACK] Seq=73337 Ack=46309 Win=1452 Len=0 TSval=4847894 TSecr=4251544
  317 2.401231161 192.168.1.16 → 10.6.15.144  SSH 1514 Client: Encrypted packet (len=1448)
  318 2.401246480 192.168.1.16 → 10.6.15.144  SSH 1514 Client: Encrypted packet (len=1448)
  319 2.405644263  10.6.15.144 → 192.168.1.16 TCP 66 22 → 59298 [ACK] Seq=73337 Ack=49205 Win=1452 Len=0 TSval=4847895 TSecr=4251550
  320 2.405669982 192.168.1.16 → 10.6.15.144  SSH 1514 Client: Encrypted packet (len=1448)
  321 2.405685156 192.168.1.16 → 10.6.15.144  SSH 1514 Client: Encrypted packet (len=1448)
  322 2.405692585  10.6.15.144 → 192.168.1.16 TCP 66 22 → 59298 [ACK] Seq=73337 Ack=52101 Win=1452 Len=0 TSval=4847895 TSecr=4251551
  323 2.406569184 192.168.1.16 → 10.6.15.144  SSH 1514 Client: Encrypted packet (len=1448)
  324 2.407261738 192.168.1.16 → 10.6.15.144  SSH 1514 Client: Encrypted packet (len=1448)
  325 2.408799386  10.6.15.144 → 192.168.1.16 TCP 66 22 → 59298 [ACK] Seq=73337 Ack=54997 Win=1452 Len=0 TSval=4847895 TSecr=4251551
  326 2.408812940 192.168.1.16 → 10.6.15.144  SSH 1514 Client: Encrypted packet (len=1448)
  327 2.408824599 192.168.1.16 → 10.6.15.144  SSH 546 Client: Encrypted packet (len=480)
  328 2.412208864  10.6.15.144 → 192.168.1.16 TCP 66 22 → 59298 [ACK] Seq=73337 Ack=57893 Win=1452 Len=0 TSval=4847897 TSecr=4251551
  329 2.415089159  10.6.15.144 → 192.168.1.16 SSH 102 Server: Encrypted packet (len=36)
  330 2.415473220 192.168.1.16 → 10.6.15.144  SSH 318 Client: Encrypted packet (len=252)
  331 2.417370094  10.6.15.144 → 192.168.1.16 TCP 66 22 → 59298 [ACK] Seq=73373 Ack=62237 Win=1452 Len=0 TSval=4847898 TSecr=4251554
  332 2.418631940  10.6.15.144 → 192.168.1.16 TCP 66 22 → 59298 [ACK] Seq=73373 Ack=65133 Win=1452 Len=0 TSval=4847898 TSecr=4251554
  333 2.421009071  10.6.15.144 → 192.168.1.16 TCP 66 22 → 59298 [ACK] Seq=73373 Ack=67061 Win=1452 Len=0 TSval=4847899 TSecr=4251555
  334 2.428782159 192.168.1.16 → 10.6.15.144  SSH 550 Client: Encrypted packet (len=484)
  335 2.429243529 192.168.1.16 → 10.6.15.144  SSH 142 Client: Encrypted packet (len=76)
  336 2.439220061  10.6.15.144 → 192.168.1.16 TCP 66 22 → 59298 [ACK] Seq=73373 Ack=67797 Win=1452 Len=0 TSval=4847904 TSecr=4251556
  337 2.442352387  10.6.15.144 → 192.168.1.16 SSH 302 Server: Encrypted packet (len=236)
  338 2.443410836 192.168.1.16 → 10.6.15.144  SSH 134 Client: Encrypted packet (len=68)
  339 2.447924135 192.168.1.16 → 10.6.15.144  SSH 550 Client: Encrypted packet (len=484)
  340 2.448708333 192.168.1.16 → 10.6.15.144  SSH 1514 Client: Encrypted packet (len=1448)
  341 2.448724657 192.168.1.16 → 10.6.15.144  SSH 1514 Client: Encrypted packet (len=1448)
  342 2.449528473 192.168.1.16 → 10.6.15.144  SSH 1514 Client: Encrypted packet (len=1448)
  343 2.450220767 192.168.1.16 → 10.6.15.144  SSH 1514 Client: Encrypted packet (len=1448)
  344 2.450913437 192.168.1.16 → 10.6.15.144  SSH 1514 Client: Encrypted packet (len=1448)
  345 2.451715614 192.168.1.16 → 10.6.15.144  SSH 1514 Client: Encrypted packet (len=1448)
  346 2.452318788 192.168.1.16 → 10.6.15.144  SSH 1514 Client: Encrypted packet (len=1448)
  347 2.457364037  10.6.15.144 → 192.168.1.16 TCP 66 22 → 59298 [ACK] Seq=73609 Ack=68425 Win=1452 Len=0 TSval=4847908 TSecr=4251563
  348 2.457381522 192.168.1.16 → 10.6.15.144  SSH 526 Client: Encrypted packet (len=460)
  349 2.459346543  10.6.15.144 → 192.168.1.16 TCP 66 22 → 59298 [ACK] Seq=73609 Ack=71321 Win=1452 Len=0 TSval=4847909 TSecr=4251565
  350 2.460759898  10.6.15.144 → 192.168.1.16 TCP 66 22 → 59298 [ACK] Seq=73609 Ack=74217 Win=1452 Len=0 TSval=4847909 TSecr=4251565
  351 2.462524281  10.6.15.144 → 192.168.1.16 TCP 66 22 → 59298 [ACK] Seq=73609 Ack=77113 Win=1452 Len=0 TSval=4847909 TSecr=4251565
  352 2.469761562  10.6.15.144 → 192.168.1.16 TCP 66 22 → 59298 [ACK] Seq=73609 Ack=79021 Win=1452 Len=0 TSval=4847911 TSecr=4251566
  353 2.493030470  10.6.15.144 → 192.168.1.16 SSH 446 Server: Encrypted packet (len=380)
  354 2.512006896  10.6.15.144 → 192.168.1.16 SSH 454 Server: Encrypted packet (len=388)
  355 2.512072103 192.168.1.16 → 10.6.15.144  TCP 66 59298 → 22 [ACK] Seq=79021 Ack=74377 Win=3666 Len=0 TSval=4251581 TSecr=4847917
  356 2.528777888  10.6.15.144 → 192.168.1.16 SSH 454 Server: Encrypted packet (len=388)
  357 2.571836614 192.168.1.16 → 10.6.15.144  TCP 66 59298 → 22 [ACK] Seq=79021 Ack=74765 Win=3666 Len=0 TSval=4251596 TSecr=4847926
  358 2.606310626 192.168.1.16 → 10.6.15.144  SSH 102 Client: Encrypted packet (len=36)
  359 2.607114544 192.168.1.16 → 10.6.15.144  SSH 118 Client: Encrypted packet (len=52)
  360 2.616783577  10.6.15.144 → 192.168.1.16 TCP 66 22 → 59298 [ACK] Seq=74765 Ack=79109 Win=1452 Len=0 TSval=4847948 TSecr=4251604
  361 2.625259608 192.168.1.16 → 10.6.15.144  SSH 102 Client: Encrypted packet (len=36)
  362 2.627864343 192.168.1.16 → 10.6.15.144  SSH 134 Client: Encrypted packet (len=68)
  363 2.628901969 192.168.1.16 → 10.6.15.144  SSH 102 Client: Encrypted packet (len=36)
  364 2.629346322 192.168.1.16 → 10.6.15.144  SSH 102 Client: Encrypted packet (len=36)
  365 2.663827934 192.168.1.16 → 10.6.15.144  TCP 102 [TCP Retransmission] 59298 → 22 [PSH, ACK] Seq=79249 Ack=74765 Win=3666 Len=36 TSval=4251619 TSecr=4847948
  366 2.671218099  10.6.15.144 → 192.168.1.16 TCP 66 22 → 59298 [ACK] Seq=74765 Ack=79285 Win=1452 Len=0 TSval=4847962 TSecr=4251609
  367 2.673810862  10.6.15.144 → 192.168.1.16 TCP 78 [TCP Dup ACK 366#1] 22 → 59298 [ACK] Seq=74765 Ack=79285 Win=1452 Len=0 TSval=4847962 TSecr=4251619 SLE=79249 SRE=79285
  368 2.918287710 192.168.1.16 → 10.6.15.144  SSH 102 Client: Encrypted packet (len=36)
  369 2.919271883 192.168.1.16 → 10.6.15.144  SSH 118 Client: Encrypted packet (len=52)
  370 2.928595379  10.6.15.144 → 192.168.1.16 TCP 66 22 → 59298 [ACK] Seq=74765 Ack=79321 Win=1452 Len=0 TSval=4848026 TSecr=4251682
  371 2.928613113  10.6.15.144 → 192.168.1.16 TCP 66 22 → 59298 [ACK] Seq=74765 Ack=79373 Win=1452 Len=0 TSval=4848026 TSecr=4251682
  372 2.930552317 192.168.1.16 → 10.6.15.144  SSH 238 Client: Encrypted packet (len=172)
  373 2.930839546 192.168.1.16 → 10.6.15.144  SSH 142 Client: Encrypted packet (len=76)
  374 2.940497176  10.6.15.144 → 192.168.1.16 TCP 66 22 → 59298 [ACK] Seq=74765 Ack=79545 Win=1451 Len=0 TSval=4848029 TSecr=4251685
  375 2.940513052  10.6.15.144 → 192.168.1.16 TCP 66 22 → 59298 [ACK] Seq=74765 Ack=79621 Win=1451 Len=0 TSval=4848029 TSecr=4251685
  376 2.942314188 192.168.1.16 → 10.6.15.144  SSH 102 Client: Encrypted packet (len=36)
  377 2.943602643 192.168.1.16 → 10.6.15.144  SSH 118 Client: Encrypted packet (len=52)
  378 2.952913020 192.168.1.16 → 10.6.15.144  SSH 102 Client: Encrypted packet (len=36)
