    1 0.000000000 192.168.1.12 → 10.6.15.156  SSH 102 Client: Encrypted packet (len=36)
    2 0.000250212 192.168.1.12 → 10.6.15.156  SSH 126 Client: Encrypted packet (len=60)
    3 0.001905382  10.6.15.156 → 192.168.1.12 TCP 66 22 → 54766 [ACK] Seq=1 Ack=37 Win=1452 Len=0 TSval=14408001 TSecr=7476509
    4 0.001921724  10.6.15.156 → 192.168.1.12 TCP 66 22 → 54766 [ACK] Seq=1 Ack=97 Win=1452 Len=0 TSval=14408001 TSecr=7476509
    5 0.005963424 192.168.1.12 → 10.6.15.156  SSH 102 Client: Encrypted packet (len=36)
    6 0.007696560  10.6.15.156 → 192.168.1.12 TCP 66 22 → 54766 [ACK] Seq=1 Ack=133 Win=1452 Len=0 TSval=14408003 TSecr=7476510
    7 0.007717739 192.168.1.12 → 10.6.15.156  SSH 110 Client: Encrypted packet (len=44)
    8 0.009193821  10.6.15.156 → 192.168.1.12 TCP 66 22 → 54766 [ACK] Seq=1 Ack=177 Win=1452 Len=0 TSval=14408003 TSecr=7476511
    9 0.012807155  10.6.15.156 → 192.168.1.12 SSH 110 Server: Encrypted packet (len=44)
   10 0.013925282 192.168.1.12 → 10.6.15.156  SSH 398 Client: Encrypted packet (len=332)
   11 0.021414113  10.6.15.156 → 192.168.1.12 SSH 238 Server: Encrypted packet (len=172)
   12 0.021432021 192.168.1.12 → 10.6.15.156  SSH 138 Client: Encrypted packet (len=72)
   13 0.021969919 192.168.1.12 → 10.6.15.156  SSH 134 Client: Encrypted packet (len=68)
   14 0.022755316 192.168.1.12 → 10.6.15.156  SSH 1514 Client: Encrypted packet (len=1448)
   15 0.023572974 192.168.1.12 → 10.6.15.156  SSH 126 Client: Encrypted packet (len=60)
   16 0.023683732  10.6.15.156 → 192.168.1.12 TCP 66 22 → 54766 [ACK] Seq=217 Ack=649 Win=1452 Len=0 TSval=14408007 TSecr=7476514
   17 0.025481740  10.6.15.156 → 192.168.1.12 TCP 66 22 → 54766 [ACK] Seq=217 Ack=2157 Win=1452 Len=0 TSval=14408007 TSecr=7476515
   18 0.029660479  10.6.15.156 → 192.168.1.12 SSH 406 Server: Encrypted packet (len=340)
   19 0.040465214  10.6.15.156 → 192.168.1.12 SSH 102 Server: Encrypted packet (len=36)
   20 0.040540859 192.168.1.12 → 10.6.15.156  TCP 66 54766 → 22 [ACK] Seq=2157 Ack=593 Win=2901 Len=0 TSval=7476519 TSecr=14408008
   21 0.040834955 192.168.1.12 → 10.6.15.156  SSH 518 Client: Encrypted packet (len=452)
   22 0.061684347  10.6.15.156 → 192.168.1.12 SSH 102 Server: Encrypted packet (len=36)
   23 0.061987509 192.168.1.12 → 10.6.15.156  SSH 150 Client: Encrypted packet (len=84)
   24 0.102339283  10.6.15.156 → 192.168.1.12 TCP 66 22 → 54766 [ACK] Seq=629 Ack=2693 Win=1452 Len=0 TSval=14408027 TSecr=7476524
   25 0.113360614  10.6.15.156 → 192.168.1.12 SSH 138 Server: Encrypted packet (len=72)
   26 0.113528572 192.168.1.12 → 10.6.15.156  SSH 102 Client: Encrypted packet (len=36)
   27 0.115801442  10.6.15.156 → 192.168.1.12 TCP 66 22 → 54766 [ACK] Seq=701 Ack=2729 Win=1452 Len=0 TSval=14408030 TSecr=7476537
   28 0.120267126 192.168.1.12 → 10.6.15.156  SSH 102 Client: Encrypted packet (len=36)
   29 0.120495769 192.168.1.12 → 10.6.15.156  SSH 102 Client: Encrypted packet (len=36)
   30 0.121783743  10.6.15.156 → 192.168.1.12 TCP 66 22 → 54766 [ACK] Seq=701 Ack=2765 Win=1452 Len=0 TSval=14408032 TSecr=7476539
   31 0.122051323  10.6.15.156 → 192.168.1.12 TCP 66 22 → 54766 [ACK] Seq=701 Ack=2801 Win=1452 Len=0 TSval=14408032 TSecr=7476539
   32 0.129723279  10.6.15.156 → 192.168.1.12 SSH 138 Server: Encrypted packet (len=72)
   33 0.129975504 192.168.1.12 → 10.6.15.156  SSH 102 Client: Encrypted packet (len=36)
   34 0.131077832  10.6.15.156 → 192.168.1.12 SSH 910 Server: Encrypted packet (len=844)
   35 0.131812390  10.6.15.156 → 192.168.1.12 SSH 1514 Server: Encrypted packet (len=1448)
   36 0.131827304 192.168.1.12 → 10.6.15.156  TCP 66 54766 → 22 [ACK] Seq=2837 Ack=3065 Win=2901 Len=0 TSval=7476542 TSecr=14408034
   37 0.131911209  10.6.15.156 → 192.168.1.12 SSH 950 Server: Encrypted packet (len=884)
   38 0.135533491 192.168.1.12 → 10.6.15.156  SSH 134 Client: Encrypted packet (len=68)
   39 0.162920011  10.6.15.156 → 192.168.1.12 SSH 110 Server: Encrypted packet (len=44)
   40 0.195460160  10.6.15.156 → 192.168.1.12 SSH 582 Server: Encrypted packet (len=516)
   41 0.195480815 192.168.1.12 → 10.6.15.156  TCP 66 54766 → 22 [ACK] Seq=2905 Ack=4509 Win=2901 Len=0 TSval=7476558 TSecr=14408042
   42 0.228098646  10.6.15.156 → 192.168.1.12 SSH 138 Server: Encrypted packet (len=72)
   43 0.228291721 192.168.1.12 → 10.6.15.156  SSH 102 Client: Encrypted packet (len=36)
   44 0.244856331  10.6.15.156 → 192.168.1.12 SSH 138 Server: Encrypted packet (len=72)
   45 0.245103229 192.168.1.12 → 10.6.15.156  SSH 102 Client: Encrypted packet (len=36)
   46 0.285935513  10.6.15.156 → 192.168.1.12 TCP 66 22 → 54766 [ACK] Seq=4653 Ack=2977 Win=1452 Len=0 TSval=14408073 TSecr=7476570
   47 0.328635105 192.168.1.12 → 10.6.15.156  SSH 102 Client: Encrypted packet (len=36)
   48 0.328944041 192.168.1.12 → 10.6.15.156  SSH 118 Client: Encrypted packet (len=52)
   49 0.330454867  10.6.15.156 → 192.168.1.12 TCP 66 22 → 54766 [ACK] Seq=4653 Ack=3065 Win=1452 Len=0 TSval=14408084 TSecr=7476591
   50 0.333212981  10.6.15.156 → 192.168.1.12 SSH 110 Server: Encrypted packet (len=44)
   51 0.333616884 192.168.1.12 → 10.6.15.156  SSH 390 Client: Encrypted packet (len=324)
   52 0.339661468  10.6.15.156 → 192.168.1.12 SSH 214 Server: Encrypted packet (len=148)
   53 0.339923141 192.168.1.12 → 10.6.15.156  SSH 134 Client: Encrypted packet (len=68)
   54 0.341136315 192.168.1.12 → 10.6.15.156  SSH 1514 Client: Encrypted packet (len=1448)
   55 0.341947194 192.168.1.12 → 10.6.15.156  SSH 286 Client: Encrypted packet (len=220)
   56 0.343734997  10.6.15.156 → 192.168.1.12 TCP 66 22 → 54766 [ACK] Seq=4845 Ack=5125 Win=1452 Len=0 TSval=14408087 TSecr=7476594
   57 0.348435962  10.6.15.156 → 192.168.1.12 SSH 422 Server: Encrypted packet (len=356)
   58 0.368546994  10.6.15.156 → 192.168.1.12 SSH 138 Server: Encrypted packet (len=72)
   59 0.368626686 192.168.1.12 → 10.6.15.156  TCP 66 54766 → 22 [ACK] Seq=5125 Ack=5273 Win=2901 Len=0 TSval=7476601 TSecr=14408088
   60 0.368812582 192.168.1.12 → 10.6.15.156  SSH 102 Client: Encrypted packet (len=36)
   61 0.410672408  10.6.15.156 → 192.168.1.12 TCP 66 22 → 54766 [ACK] Seq=5273 Ack=5161 Win=1452 Len=0 TSval=14408104 TSecr=7476601
   62 0.434081159 192.168.1.12 → 10.6.15.156  SSH 102 Client: Encrypted packet (len=36)
   63 0.434324072 192.168.1.12 → 10.6.15.156  SSH 110 Client: Encrypted packet (len=44)
   64 0.435728335  10.6.15.156 → 192.168.1.12 TCP 66 22 → 54766 [ACK] Seq=5273 Ack=5241 Win=1452 Len=0 TSval=14408110 TSecr=7476617
   65 0.442595128 192.168.1.12 → 10.6.15.156  SSH 102 Client: Encrypted packet (len=36)
   66 0.444144286  10.6.15.156 → 192.168.1.12 TCP 66 22 → 54766 [ACK] Seq=5273 Ack=5277 Win=1452 Len=0 TSval=14408112 TSecr=7476619
   67 0.444160812 192.168.1.12 → 10.6.15.156  SSH 118 Client: Encrypted packet (len=52)
   68 0.445706822  10.6.15.156 → 192.168.1.12 TCP 66 22 → 54766 [ACK] Seq=5273 Ack=5329 Win=1452 Len=0 TSval=14408113 TSecr=7476620
   69 0.448432783  10.6.15.156 → 192.168.1.12 SSH 102 Server: Encrypted packet (len=36)
   70 0.448770424 192.168.1.12 → 10.6.15.156  SSH 390 Client: Encrypted packet (len=324)
   71 0.454755144  10.6.15.156 → 192.168.1.12 SSH 214 Server: Encrypted packet (len=148)
   72 0.455016218 192.168.1.12 → 10.6.15.156  SSH 134 Client: Encrypted packet (len=68)
   73 0.475760314  10.6.15.156 → 192.168.1.12 SSH 174 Server: Encrypted packet (len=108)
   74 0.475775470 192.168.1.12 → 10.6.15.156  SSH 590 Client: Encrypted packet (len=524)
   75 0.476270695 192.168.1.12 → 10.6.15.156  SSH 218 Client: Encrypted packet (len=152)
   76 0.477989532  10.6.15.156 → 192.168.1.12 TCP 66 22 → 54766 [ACK] Seq=5565 Ack=6397 Win=1452 Len=0 TSval=14408121 TSecr=7476628
   77 0.481745120  10.6.15.156 → 192.168.1.12 SSH 510 Server: Encrypted packet (len=444)
   78 0.482871739  10.6.15.156 → 192.168.1.12 SSH 138 Server: Encrypted packet (len=72)
   79 0.482940167 192.168.1.12 → 10.6.15.156  TCP 66 54766 → 22 [ACK] Seq=6397 Ack=6081 Win=2901 Len=0 TSval=7476630 TSecr=14408121
   80 0.483148777 192.168.1.12 → 10.6.15.156  SSH 102 Client: Encrypted packet (len=36)
   81 0.520889831  10.6.15.156 → 192.168.1.12 SSH 558 Server: Encrypted packet (len=492)
   82 0.522178659 192.168.1.12 → 10.6.15.156  SSH 206 Client: Encrypted packet (len=140)
   83 0.564255986  10.6.15.156 → 192.168.1.12 TCP 66 22 → 54766 [ACK] Seq=6573 Ack=6573 Win=1452 Len=0 TSval=14408142 TSecr=7476639
   84 0.564398460  10.6.15.156 → 192.168.1.12 SSH 150 Server: Encrypted packet (len=84)
   85 0.566619096 192.168.1.12 → 10.6.15.156  SSH 630 Client: Encrypted packet (len=564)
   86 0.568687092  10.6.15.156 → 192.168.1.12 TCP 66 22 → 54766 [ACK] Seq=6657 Ack=7137 Win=1452 Len=0 TSval=14408143 TSecr=7476650
   87 0.574191729 192.168.1.12 → 10.6.15.156  SSH 102 Client: Encrypted packet (len=36)
   88 0.575759991  10.6.15.156 → 192.168.1.12 TCP 66 22 → 54766 [ACK] Seq=6657 Ack=7173 Win=1452 Len=0 TSval=14408145 TSecr=7476652
   89 0.575781450 192.168.1.12 → 10.6.15.156  SSH 126 Client: Encrypted packet (len=60)
   90 0.577555601  10.6.15.156 → 192.168.1.12 TCP 66 22 → 54766 [ACK] Seq=6657 Ack=7233 Win=1452 Len=0 TSval=14408146 TSecr=7476653
   91 0.580389336  10.6.15.156 → 192.168.1.12 SSH 102 Server: Encrypted packet (len=36)
   92 0.581029191 192.168.1.12 → 10.6.15.156  SSH 166 Client: Encrypted packet (len=100)
   93 0.620392816  10.6.15.156 → 192.168.1.12 SSH 1514 Server: Encrypted packet (len=1448)
   94 0.620419672 192.168.1.12 → 10.6.15.156  SSH 234 Client: Encrypted packet (len=168)
   95 0.620525323  10.6.15.156 → 192.168.1.12 SSH 1190 Server: Encrypted packet (len=1124)
   96 0.661742035  10.6.15.156 → 192.168.1.12 TCP 66 22 → 54766 [ACK] Seq=9265 Ack=7501 Win=1452 Len=0 TSval=14408167 TSecr=7476664
   97 0.661760047 192.168.1.12 → 10.6.15.156  SSH 690 Client: Encrypted packet (len=624)
   98 0.666161181  10.6.15.156 → 192.168.1.12 TCP 66 22 → 54766 [ACK] Seq=9265 Ack=8125 Win=1452 Len=0 TSval=14408167 TSecr=7476674
   99 0.666636271  10.6.15.156 → 192.168.1.12 SSH 150 Server: Encrypted packet (len=84)
  100 0.667358067  10.6.15.156 → 192.168.1.12 SSH 454 Server: Encrypted packet (len=388)
  101 0.667393094 192.168.1.12 → 10.6.15.156  TCP 66 54766 → 22 [ACK] Seq=8125 Ack=9737 Win=2901 Len=0 TSval=7476676 TSecr=14408168
  102 0.674799484  10.6.15.156 → 192.168.1.12 SSH 138 Server: Encrypted packet (len=72)
  103 0.675038992 192.168.1.12 → 10.6.15.156  SSH 102 Client: Encrypted packet (len=36)
  104 0.712438137  10.6.15.156 → 192.168.1.12 SSH 518 Server: Encrypted packet (len=452)
  105 0.713419136 192.168.1.12 → 10.6.15.156  SSH 142 Client: Encrypted packet (len=76)
  106 0.718162180  10.6.15.156 → 192.168.1.12 SSH 138 Server: Encrypted packet (len=72)
  107 0.718432286 192.168.1.12 → 10.6.15.156  SSH 102 Client: Encrypted packet (len=36)
  108 0.722971507  10.6.15.156 → 192.168.1.12 SSH 138 Server: Encrypted packet (len=72)
  109 0.723217293 192.168.1.12 → 10.6.15.156  SSH 102 Client: Encrypted packet (len=36)
  110 0.758486714  10.6.15.156 → 192.168.1.12 SSH 110 Server: Encrypted packet (len=44)
  111 0.768623355  10.6.15.156 → 192.168.1.12 SSH 102 Server: Encrypted packet (len=36)
  112 0.768703410 192.168.1.12 → 10.6.15.156  TCP 66 54766 → 22 [ACK] Seq=8309 Ack=10485 Win=2901 Len=0 TSval=7476701 TSecr=14408191
  113 0.794287366 192.168.1.12 → 10.6.15.156  SSH 102 Client: Encrypted packet (len=36)
  114 0.799766264  10.6.15.156 → 192.168.1.12 SSH 138 Server: Encrypted packet (len=72)
  115 0.799784138 192.168.1.12 → 10.6.15.156  SSH 190 Client: Encrypted packet (len=124)
  116 0.800130642 192.168.1.12 → 10.6.15.156  SSH 102 Client: Encrypted packet (len=36)
  117 0.801548091  10.6.15.156 → 192.168.1.12 TCP 66 22 → 54766 [ACK] Seq=10557 Ack=8505 Win=1452 Len=0 TSval=14408201 TSecr=7476709
  118 0.804058825  10.6.15.156 → 192.168.1.12 SSH 138 Server: Encrypted packet (len=72)
  119 0.804413579 192.168.1.12 → 10.6.15.156  SSH 102 Client: Encrypted packet (len=36)
  120 0.845819417  10.6.15.156 → 192.168.1.12 TCP 66 22 → 54766 [ACK] Seq=10629 Ack=8541 Win=1452 Len=0 TSval=14408213 TSecr=7476710
  121 0.845836473 192.168.1.12 → 10.6.15.156  SSH 390 Client: Encrypted packet (len=324)
  122 0.847801468  10.6.15.156 → 192.168.1.12 TCP 66 22 → 54766 [ACK] Seq=10629 Ack=8865 Win=1452 Len=0 TSval=14408213 TSecr=7476720
  123 0.848763827  10.6.15.156 → 192.168.1.12 SSH 958 Server: Encrypted packet (len=892)
  124 0.872874444 192.168.1.12 → 10.6.15.156  SSH 102 Client: Encrypted packet (len=36)
  125 0.873106595 192.168.1.12 → 10.6.15.156  SSH 102 Client: Encrypted packet (len=36)
  126 0.874510103  10.6.15.156 → 192.168.1.12 TCP 66 22 → 54766 [ACK] Seq=11521 Ack=8937 Win=1452 Len=0 TSval=14408220 TSecr=7476727
  127 0.874622780 192.168.1.12 → 10.6.15.156  SSH 118 Client: Encrypted packet (len=52)
  128 0.874848816 192.168.1.12 → 10.6.15.156  SSH 102 Client: Encrypted packet (len=36)
  129 0.876042828  10.6.15.156 → 192.168.1.12 TCP 66 22 → 54766 [ACK] Seq=11521 Ack=9025 Win=1452 Len=0 TSval=14408220 TSecr=7476727
  130 0.877575456 192.168.1.12 → 10.6.15.156  SSH 102 Client: Encrypted packet (len=36)
  131 0.880441502  10.6.15.156 → 192.168.1.12 SSH 138 Server: Encrypted packet (len=72)
  132 0.880463430 192.168.1.12 → 10.6.15.156  SSH 118 Client: Encrypted packet (len=52)
  133 0.886578611  10.6.15.156 → 192.168.1.12 SSH 102 Server: Encrypted packet (len=36)
  134 0.886591277 192.168.1.12 → 10.6.15.156  SSH 138 Client: Encrypted packet (len=72)
  135 0.886887172 192.168.1.12 → 10.6.15.156  SSH 102 Client: Encrypted packet (len=36)
  136 0.887090527 192.168.1.12 → 10.6.15.156  SSH 426 Client: Encrypted packet (len=360)
  137 0.887960005 192.168.1.12 → 10.6.15.156  SSH 1514 Client: Encrypted packet (len=1448)
  138 0.888783006 192.168.1.12 → 10.6.15.156  SSH 702 Client: Encrypted packet (len=636)
  139 0.888868890  10.6.15.156 → 192.168.1.12 TCP 66 22 → 54766 [ACK] Seq=11629 Ack=9221 Win=1452 Len=0 TSval=14408223 TSecr=7476730
  140 0.892089305  10.6.15.156 → 192.168.1.12 TCP 66 22 → 54766 [ACK] Seq=11629 Ack=11029 Win=1452 Len=0 TSval=14408224 TSecr=7476731
  141 0.892223150  10.6.15.156 → 192.168.1.12 SSH 102 Server: Encrypted packet (len=36)
  142 0.892549239 192.168.1.12 → 10.6.15.156  SSH 230 Client: Encrypted packet (len=164)
  143 0.892924868  10.6.15.156 → 192.168.1.12 SSH 102 Server: Encrypted packet (len=36)
  144 0.895147204  10.6.15.156 → 192.168.1.12 SSH 210 Server: Encrypted packet (len=144)
  145 0.895161984 192.168.1.12 → 10.6.15.156  SSH 110 Client: Encrypted packet (len=44)
  146 0.895464743 192.168.1.12 → 10.6.15.156  SSH 138 Client: Encrypted packet (len=72)
  147 0.896227573  10.6.15.156 → 192.168.1.12 SSH 230 Server: Encrypted packet (len=164)
  148 0.898320241  10.6.15.156 → 192.168.1.12 TCP 66 22 → 54766 [ACK] Seq=12009 Ack=11945 Win=1452 Len=0 TSval=14408225 TSecr=7476733
  149 0.898345326 192.168.1.12 → 10.6.15.156  SSH 762 Client: Encrypted packet (len=696)
  150 0.898456632  10.6.15.156 → 192.168.1.12 SSH 146 Server: Encrypted packet (len=80)
  151 0.921639277  10.6.15.156 → 192.168.1.12 SSH 734 Server: Encrypted packet (len=668)
  152 0.921707899 192.168.1.12 → 10.6.15.156  TCP 66 54766 → 22 [ACK] Seq=12641 Ack=12757 Win=2901 Len=0 TSval=7476739 TSecr=14408226
  153 0.923454704 192.168.1.12 → 10.6.15.156  SSH 134 Client: Encrypted packet (len=68)
  154 0.962155667  10.6.15.156 → 192.168.1.12 TCP 66 22 → 54766 [ACK] Seq=12757 Ack=12709 Win=1452 Len=0 TSval=14408242 TSecr=7476740
  155 0.978563199  10.6.15.156 → 192.168.1.12 SSH 138 Server: Encrypted packet (len=72)
  156 0.978846010 192.168.1.12 → 10.6.15.156  SSH 102 Client: Encrypted packet (len=36)
  157 0.980430753  10.6.15.156 → 192.168.1.12 TCP 66 22 → 54766 [ACK] Seq=12829 Ack=12745 Win=1452 Len=0 TSval=14408246 TSecr=7476754
  158 0.980446484 192.168.1.12 → 10.6.15.156  SSH 102 Client: Encrypted packet (len=36)
  159 0.982232788  10.6.15.156 → 192.168.1.12 TCP 66 22 → 54766 [ACK] Seq=12829 Ack=12781 Win=1452 Len=0 TSval=14408247 TSecr=7476754
  160 0.982244842 192.168.1.12 → 10.6.15.156  SSH 254 Client: Encrypted packet (len=188)
  161 0.984015125  10.6.15.156 → 192.168.1.12 TCP 66 22 → 54766 [ACK] Seq=12829 Ack=12969 Win=1452 Len=0 TSval=14408247 TSecr=7476754
  162 0.998411873  10.6.15.156 → 192.168.1.12 SSH 470 Server: Encrypted packet (len=404)
  163 1.006182292  10.6.15.156 → 192.168.1.12 SSH 110 Server: Encrypted packet (len=44)
  164 1.006243826 192.168.1.12 → 10.6.15.156  TCP 66 54766 → 22 [ACK] Seq=12969 Ack=13277 Win=2901 Len=0 TSval=7476760 TSecr=14408251
  165 1.010554037  10.6.15.156 → 192.168.1.12 SSH 138 Server: Encrypted packet (len=72)
  166 1.010775609 192.168.1.12 → 10.6.15.156  SSH 102 Client: Encrypted packet (len=36)
  167 1.018946980  10.6.15.156 → 192.168.1.12 SSH 138 Server: Encrypted packet (len=72)
  168 1.019132757 192.168.1.12 → 10.6.15.156  SSH 102 Client: Encrypted packet (len=36)
  169 1.056528536 192.168.1.12 → 139.59.50.38 NTP 90 NTP Version 4, client
  170 1.058009353  10.6.15.156 → 192.168.1.12 TCP 66 22 → 54766 [ACK] Seq=13421 Ack=13041 Win=1452 Len=0 TSval=14408266 TSecr=7476764
  171 1.063272505  10.6.15.156 → 192.168.1.12 SSH 1514 Server: Encrypted packet (len=1448)
  172 1.063296526  10.6.15.156 → 192.168.1.12 SSH 134 Server: Encrypted packet (len=68)
  173 1.063305075 192.168.1.12 → 10.6.15.156  TCP 66 54766 → 22 [ACK] Seq=13041 Ack=14937 Win=2901 Len=0 TSval=7476775 TSecr=14408267
  174 1.080002939  10.6.15.156 → 192.168.1.12 SSH 138 Server: Encrypted packet (len=72)
  175 1.080224867 192.168.1.12 → 10.6.15.156  SSH 102 Client: Encrypted packet (len=36)
  176 1.081496976  10.6.15.156 → 192.168.1.12 TCP 66 22 → 54766 [ACK] Seq=15009 Ack=13077 Win=1452 Len=0 TSval=14408271 TSecr=7476779
  177 1.081515029  10.6.15.156 → 192.168.1.12 SSH 138 Server: Encrypted packet (len=72)
  178 1.081677833  10.6.15.156 → 192.168.1.12 SSH 138 Server: Encrypted packet (len=72)
  179 1.081715989 192.168.1.12 → 10.6.15.156  TCP 66 54766 → 22 [ACK] Seq=13077 Ack=15153 Win=2901 Len=0 TSval=7476779 TSecr=14408271
  180 1.081727744 192.168.1.12 → 10.6.15.156  SSH 102 Client: Encrypted packet (len=36)
  181 1.082051564 192.168.1.12 → 10.6.15.156  SSH 102 Client: Encrypted packet (len=36)
  182 1.083285486  10.6.15.156 → 192.168.1.12 TCP 66 22 → 54766 [ACK] Seq=15153 Ack=13149 Win=1452 Len=0 TSval=14408272 TSecr=7476779
  183 1.152519189 192.168.1.12 → 10.6.15.156  SSH 102 Client: Encrypted packet (len=36)
  184 1.156229021  10.6.15.156 → 192.168.1.12 SSH 138 Server: Encrypted packet (len=72)
  185 1.156246758 192.168.1.12 → 10.6.15.156  SSH 110 Client: Encrypted packet (len=44)
  186 1.156543870 192.168.1.12 → 10.6.15.156  SSH 102 Client: Encrypted packet (len=36)
  187 1.157876392  10.6.15.156 → 192.168.1.12 TCP 66 22 → 54766 [ACK] Seq=15225 Ack=13265 Win=1452 Len=0 TSval=14408291 TSecr=7476798
  188 1.168355372 192.168.1.12 → 10.6.15.156  SSH 686 Client: Encrypted packet (len=620)
  189 1.171650856  10.6.15.156 → 192.168.1.12 SSH 1486 Server: Encrypted packet (len=1420)
  190 1.198520592  10.6.15.156 → 192.168.1.12 SSH 138 Server: Encrypted packet (len=72)
  191 1.198536569 192.168.1.12 → 10.6.15.156  TCP 66 54766 → 22 [ACK] Seq=13885 Ack=16717 Win=2901 Len=0 TSval=7476808 TSecr=14408294
  192 1.198879294 192.168.1.12 → 10.6.15.156  SSH 198 Client: Encrypted packet (len=132)
  193 1.199251486  10.6.15.156 → 192.168.1.12 SSH 102 Server: Encrypted packet (len=36)
  194 1.237806052  10.6.15.156 → 192.168.1.12 TCP 66 22 → 54766 [ACK] Seq=16753 Ack=14017 Win=1452 Len=0 TSval=14408311 TSecr=7476809
  195 1.237823648 192.168.1.12 → 10.6.15.156  SSH 686 Client: Encrypted packet (len=620)
  196 1.239916867  10.6.15.156 → 192.168.1.12 TCP 66 22 → 54766 [ACK] Seq=16753 Ack=14637 Win=1452 Len=0 TSval=14408311 TSecr=7476818
  197 1.246449703 192.168.1.12 → 10.6.15.156  SSH 102 Client: Encrypted packet (len=36)
  198 1.246674871 192.168.1.12 → 10.6.15.156  SSH 110 Client: Encrypted packet (len=44)
  199 1.247945424  10.6.15.156 → 192.168.1.12 TCP 66 22 → 54766 [ACK] Seq=16753 Ack=14717 Win=1452 Len=0 TSval=14408313 TSecr=7476820
  200 1.250384797  10.6.15.156 → 192.168.1.12 SSH 138 Server: Encrypted packet (len=72)
  201 1.250622648 192.168.1.12 → 10.6.15.156  SSH 102 Client: Encrypted packet (len=36)
  202 1.289838530  10.6.15.156 → 192.168.1.12 TCP 66 22 → 54766 [ACK] Seq=16825 Ack=14753 Win=1452 Len=0 TSval=14408324 TSecr=7476821
  203 1.350603223 192.168.1.12 → 10.6.15.156  SSH 102 Client: Encrypted packet (len=36)
  204 1.350838550 192.168.1.12 → 10.6.15.156  SSH 102 Client: Encrypted packet (len=36)
  205 1.352866679  10.6.15.156 → 192.168.1.12 TCP 66 22 → 54766 [ACK] Seq=16825 Ack=14789 Win=1452 Len=0 TSval=14408339 TSecr=7476846
  206 1.352881403  10.6.15.156 → 192.168.1.12 TCP 66 22 → 54766 [ACK] Seq=16825 Ack=14825 Win=1452 Len=0 TSval=14408339 TSecr=7476847
  207 1.373143646  10.6.15.156 → 192.168.1.12 SSH 102 Server: Encrypted packet (len=36)
  208 1.373452841 192.168.1.12 → 10.6.15.156  SSH 190 Client: Encrypted packet (len=124)
  209 1.384384784  10.6.15.156 → 192.168.1.12 SSH 454 Server: Encrypted packet (len=388)
  210 1.407987949  10.6.15.156 → 192.168.1.12 SSH 126 Server: Encrypted packet (len=60)
  211 1.408010412  10.6.15.156 → 192.168.1.12 SSH 138 Server: Encrypted packet (len=72)
  212 1.408069044 192.168.1.12 → 10.6.15.156  TCP 66 54766 → 22 [ACK] Seq=14949 Ack=17381 Win=2901 Len=0 TSval=7476861 TSecr=14408347
  213 1.408226832 192.168.1.12 → 10.6.15.156  SSH 102 Client: Encrypted packet (len=36)
  214 1.415166161  10.6.15.156 → 192.168.1.12 SSH 214 Server: Encrypted packet (len=148)
  215 1.415449680 192.168.1.12 → 10.6.15.156  SSH 134 Client: Encrypted packet (len=68)
  216 1.455610640  10.6.15.156 → 192.168.1.12 TCP 66 22 → 54766 [ACK] Seq=17529 Ack=15053 Win=1452 Len=0 TSval=14408365 TSecr=7476863
  217 1.455633033 192.168.1.12 → 10.6.15.156  SSH 862 Client: Encrypted packet (len=796)
  218 1.456441796  10.6.15.156 → 192.168.1.12 SSH 182 Server: Encrypted packet (len=116)
  219 1.456461805  10.6.15.156 → 192.168.1.12 SSH 182 Server: Encrypted packet (len=116)
  220 1.456512298 192.168.1.12 → 10.6.15.156  TCP 66 54766 → 22 [ACK] Seq=15849 Ack=17761 Win=2901 Len=0 TSval=7476873 TSecr=14408365
  221 1.456801339 192.168.1.12 → 10.6.15.156  SSH 134 Client: Encrypted packet (len=68)
  222 1.457318341 192.168.1.12 → 10.6.15.156  SSH 1514 Client: Encrypted packet (len=1448)
  223 1.458151644 192.168.1.12 → 10.6.15.156  SSH 278 Client: Encrypted packet (len=212)
  224 1.458250342  10.6.15.156 → 192.168.1.12 TCP 66 22 → 54766 [ACK] Seq=17761 Ack=15849 Win=1452 Len=0 TSval=14408366 TSecr=7476873
  225 1.458860883  10.6.15.156 → 192.168.1.12 TCP 66 22 → 54766 [ACK] Seq=17761 Ack=15917 Win=1452 Len=0 TSval=14408366 TSecr=7476873
  226 1.459001884  10.6.15.156 → 192.168.1.12 SSH 102 Server: Encrypted packet (len=36)
  227 1.460033726  10.6.15.156 → 192.168.1.12 TCP 66 22 → 54766 [ACK] Seq=17797 Ack=17577 Win=1452 Len=0 TSval=14408366 TSecr=7476873
  228 1.460040320 192.168.1.12 → 10.6.15.156  SSH 198 Client: Encrypted packet (len=132)
  229 1.471536653  10.6.15.156 → 192.168.1.12 SSH 102 Server: Encrypted packet (len=36)
  230 1.471989285 192.168.1.12 → 10.6.15.156  SSH 662 Client: Encrypted packet (len=596)
  231 1.513868022  10.6.15.156 → 192.168.1.12 TCP 66 22 → 54766 [ACK] Seq=17833 Ack=18305 Win=1452 Len=0 TSval=14408380 TSecr=7476877
  232 1.519696516  10.6.15.156 → 192.168.1.12 SSH 1514 Server: Encrypted packet (len=1448)
  233 1.519879522  10.6.15.156 → 192.168.1.12 SSH 1514 Server: Encrypted packet (len=1448)
  234 1.519888820 192.168.1.12 → 10.6.15.156  TCP 66 54766 → 22 [ACK] Seq=18305 Ack=20729 Win=2901 Len=0 TSval=7476889 TSecr=14408381
  235 1.520071643  10.6.15.156 → 192.168.1.12 SSH 1514 Server: Encrypted packet (len=1448)
  236 1.520079984  10.6.15.156 → 192.168.1.12 SSH 110 Server: Encrypted packet (len=44)
  237 1.520086622 192.168.1.12 → 10.6.15.156  TCP 66 54766 → 22 [ACK] Seq=18305 Ack=22221 Win=2901 Len=0 TSval=7476889 TSecr=14408381
  238 1.520432422  10.6.15.156 → 192.168.1.12 SSH 1514 Server: Encrypted packet (len=1448)
  239 1.520623811  10.6.15.156 → 192.168.1.12 SSH 1514 Server: Encrypted packet (len=1448)
  240 1.520630482 192.168.1.12 → 10.6.15.156  TCP 66 54766 → 22 [ACK] Seq=18305 Ack=25117 Win=2901 Len=0 TSval=7476889 TSecr=14408381
  241 1.520818280  10.6.15.156 → 192.168.1.12 SSH 1514 Server: Encrypted packet (len=1448)
  242 1.520989500  10.6.15.156 → 192.168.1.12 SSH 1390 Server: Encrypted packet (len=1324)
  243 1.520996353 192.168.1.12 → 10.6.15.156  TCP 66 54766 → 22 [ACK] Seq=18305 Ack=27889 Win=2901 Len=0 TSval=7476889 TSecr=14408381
  244 1.533300323 192.168.1.12 → 10.6.15.156  SSH 102 Client: Encrypted packet (len=36)
  245 1.535975042  10.6.15.156 → 192.168.1.12 TCP 66 22 → 54766 [ACK] Seq=27889 Ack=18341 Win=1452 Len=0 TSval=14408385 TSecr=7476892
  246 1.535987055 192.168.1.12 → 10.6.15.156  SSH 102 Client: Encrypted packet (len=36)
  247 1.537806300  10.6.15.156 → 192.168.1.12 TCP 66 22 → 54766 [ACK] Seq=27889 Ack=18377 Win=1452 Len=0 TSval=14408386 TSecr=7476893
  248 1.569314363  10.6.15.156 → 192.168.1.12 SSH 238 Server: Encrypted packet (len=172)
  249 1.573573544 192.168.1.12 → 10.6.15.156  SSH 158 Client: Encrypted packet (len=92)
  250 1.575615802  10.6.15.156 → 192.168.1.12 SSH 134 Server: Encrypted packet (len=68)
  251 1.575628885  10.6.15.156 → 192.168.1.12 SSH 138 Server: Encrypted packet (len=72)
  252 1.575653477 192.168.1.12 → 10.6.15.156  TCP 66 54766 → 22 [ACK] Seq=18469 Ack=28201 Win=2901 Len=0 TSval=7476903 TSecr=14408395
  253 1.575793203 192.168.1.12 → 10.6.15.156  SSH 102 Client: Encrypted packet (len=36)
  254 1.590532151  10.6.15.156 → 192.168.1.12 SSH 214 Server: Encrypted packet (len=148)
  255 1.590842533 192.168.1.12 → 10.6.15.156  SSH 134 Client: Encrypted packet (len=68)
  256 1.629747193  10.6.15.156 → 192.168.1.12 TCP 66 22 → 54766 [ACK] Seq=28349 Ack=18573 Win=1452 Len=0 TSval=14408409 TSecr=7476907
  257 1.629767878 192.168.1.12 → 10.6.15.156  SSH 526 Client: Encrypted packet (len=460)
  258 1.631736300  10.6.15.156 → 192.168.1.12 TCP 66 22 → 54766 [ACK] Seq=28349 Ack=19033 Win=1452 Len=0 TSval=14408409 TSecr=7476916
  259 1.673533322  10.6.15.156 → 192.168.1.12 SSH 454 Server: Encrypted packet (len=388)
  260 1.675649275  10.6.15.156 → 192.168.1.12 SSH 454 Server: Encrypted packet (len=388)
  261 1.675708439 192.168.1.12 → 10.6.15.156  TCP 66 54766 → 22 [ACK] Seq=19033 Ack=29125 Win=2901 Len=0 TSval=7476928 TSecr=14408419
  262 1.676475079  10.6.15.156 → 192.168.1.12 SSH 454 Server: Encrypted packet (len=388)
  263 1.686136921  10.6.15.156 → 192.168.1.12 SSH 326 Server: Encrypted packet (len=260)
  264 1.686233803 192.168.1.12 → 10.6.15.156  TCP 66 54766 → 22 [ACK] Seq=19033 Ack=29773 Win=2901 Len=0 TSval=7476930 TSecr=14408420
  265 1.702206337  10.6.15.156 → 192.168.1.12 SSH 366 Server: Encrypted packet (len=300)
  266 1.704371637 192.168.1.12 → 10.6.15.156  SSH 398 Client: Encrypted packet (len=332)
  267 1.706793623  10.6.15.156 → 192.168.1.12 TCP 66 22 → 54766 [ACK] Seq=30073 Ack=19365 Win=1452 Len=0 TSval=14408428 TSecr=7476935
  268 1.753728617  10.6.15.156 → 192.168.1.12 SSH 102 Server: Encrypted packet (len=36)
  269 1.794757275 192.168.1.12 → 10.6.15.156  TCP 66 54766 → 22 [ACK] Seq=19365 Ack=30109 Win=2901 Len=0 TSval=7476958 TSecr=14408440
  270 1.848576426  10.6.15.156 → 192.168.1.12 SSH 638 Server: Encrypted packet (len=572)
  271 1.848659418 192.168.1.12 → 10.6.15.156  TCP 66 54766 → 22 [ACK] Seq=19365 Ack=30681 Win=2901 Len=0 TSval=7476971 TSecr=14408463
  272 2.169478444 192.168.1.12 → 10.6.15.156  SSH 1278 Client: Encrypted packet (len=1212)
  273 2.171943721  10.6.15.156 → 192.168.1.12 TCP 66 22 → 54766 [ACK] Seq=30681 Ack=20577 Win=1452 Len=0 TSval=14408544 TSecr=7477051
  274 2.337914576  10.6.15.156 → 192.168.1.12 SSH 174 Server: Encrypted packet (len=108)
  275 2.337943427 192.168.1.12 → 10.6.15.156  TCP 66 54766 → 22 [ACK] Seq=20577 Ack=30789 Win=2901 Len=0 TSval=7477093 TSecr=14408586
  276 2.388705453  10.6.15.156 → 192.168.1.12 SSH 454 Server: Encrypted packet (len=388)
  277 2.388733796 192.168.1.12 → 10.6.15.156  TCP 66 54766 → 22 [ACK] Seq=20577 Ack=31177 Win=2901 Len=0 TSval=7477106 TSecr=14408598
  278 2.974342023 192.168.1.12 → 10.6.15.156  SSH 862 Client: Encrypted packet (len=796)
  279 2.977354907  10.6.15.156 → 192.168.1.12 TCP 66 22 → 54766 [ACK] Seq=31177 Ack=21373 Win=1452 Len=0 TSval=14408745 TSecr=7477252
  280 3.194704187  10.6.15.156 → 192.168.1.12 SSH 454 Server: Encrypted packet (len=388)
  281 3.194740546 192.168.1.12 → 10.6.15.156  TCP 66 54766 → 22 [ACK] Seq=21373 Ack=31565 Win=2901 Len=0 TSval=7477307 TSecr=14408800
  282 5.394836069 192.168.1.12 → 10.6.15.156  SSH 862 Client: Encrypted packet (len=796)
  283 5.397559667  10.6.15.156 → 192.168.1.12 TCP 66 22 → 54766 [ACK] Seq=31565 Ack=22169 Win=1452 Len=0 TSval=14409351 TSecr=7477858
  284 5.614376723  10.6.15.156 → 192.168.1.12 SSH 454 Server: Encrypted packet (len=388)
  285 5.614406995 192.168.1.12 → 10.6.15.156  TCP 66 54766 → 22 [ACK] Seq=22169 Ack=31953 Win=2901 Len=0 TSval=7477912 TSecr=14409405
  286 6.976766048 192.168.1.12 → 10.6.15.156  SSH 862 Client: Encrypted packet (len=796)
  287 6.977575778 192.168.1.12 → 10.6.15.156  SSH 1514 Client: Encrypted packet (len=1448)
  288 6.978406192 192.168.1.12 → 10.6.15.156  SSH 210 Client: Encrypted packet (len=144)
  289 6.978954560  10.6.15.156 → 192.168.1.12 TCP 66 22 → 54766 [ACK] Seq=31953 Ack=22965 Win=1452 Len=0 TSval=14409746 TSecr=7478253
  290 6.980235394  10.6.15.156 → 192.168.1.12 TCP 66 22 → 54766 [ACK] Seq=31953 Ack=24557 Win=1452 Len=0 TSval=14409746 TSecr=7478253
  291 7.196510106  10.6.15.156 → 192.168.1.12 SSH 454 Server: Encrypted packet (len=388)
  292 7.196561385 192.168.1.12 → 10.6.15.156  TCP 66 54766 → 22 [ACK] Seq=24557 Ack=32341 Win=2901 Len=0 TSval=7478308 TSecr=14409800
  293 7.197834900  10.6.15.156 → 192.168.1.12 SSH 842 Server: Encrypted packet (len=776)
  294 7.197857927 192.168.1.12 → 10.6.15.156  TCP 66 54766 → 22 [ACK] Seq=24557 Ack=33117 Win=2901 Len=0 TSval=7478308 TSecr=14409800
  295 8.974028435 192.168.1.12 → 10.6.15.156  SSH 862 Client: Encrypted packet (len=796)
  296 8.977453782  10.6.15.156 → 192.168.1.12 TCP 66 22 → 54766 [ACK] Seq=33117 Ack=25353 Win=1452 Len=0 TSval=14410245 TSecr=7478752
  297 9.192696365  10.6.15.156 → 192.168.1.12 SSH 454 Server: Encrypted packet (len=388)
  298 9.192736555 192.168.1.12 → 10.6.15.156  TCP 66 54766 → 22 [ACK] Seq=25353 Ack=33505 Win=2901 Len=0 TSval=7478807 TSecr=14410299
  299 10.584055073  10.6.15.156 → 192.168.1.12 SSH 102 Server: Encrypted packet (len=36)
  300 10.584073585 192.168.1.12 → 10.6.15.156  TCP 66 54766 → 22 [ACK] Seq=25353 Ack=33541 Win=2901 Len=0 TSval=7479155 TSecr=14410647
  301 10.593799535 192.168.1.12 → 10.6.15.156  SSH 1514 Client: Encrypted packet (len=1448)
  302 10.599059844  10.6.15.156 → 192.168.1.12 TCP 66 22 → 54766 [ACK] Seq=33541 Ack=26801 Win=1452 Len=0 TSval=14410650 TSecr=7479157
  303 10.599085271 192.168.1.12 → 10.6.15.156  SSH 374 Client: Encrypted packet (len=308)
  304 10.600883513  10.6.15.156 → 192.168.1.12 TCP 66 22 → 54766 [ACK] Seq=33541 Ack=27109 Win=1452 Len=0 TSval=14410651 TSecr=7479159
  305 10.604063119  10.6.15.156 → 192.168.1.12 SSH 142 Server: Encrypted packet (len=76)
  306 10.619904902 192.168.1.12 → 10.6.15.156  SSH 102 Client: Encrypted packet (len=36)
  307 10.620124462 192.168.1.12 → 10.6.15.156  SSH 282 Client: Encrypted packet (len=216)
  308 10.620398818 192.168.1.12 → 10.6.15.156  SSH 862 Client: Encrypted packet (len=796)
  309 10.622061193  10.6.15.156 → 192.168.1.12 TCP 66 22 → 54766 [ACK] Seq=33617 Ack=27361 Win=1452 Len=0 TSval=14410657 TSecr=7479164
  310 10.659739202  10.6.15.156 → 192.168.1.12 SSH 134 Server: Encrypted packet (len=68)
  311 10.659807837  10.6.15.156 → 192.168.1.12 SSH 138 Server: Encrypted packet (len=72)
  312 10.659831666 192.168.1.12 → 10.6.15.156  TCP 66 54766 → 22 [ACK] Seq=28157 Ack=33757 Win=2901 Len=0 TSval=7479174 TSecr=14410666
  313 10.659990962 192.168.1.12 → 10.6.15.156  SSH 102 Client: Encrypted packet (len=36)
  314 10.698047542  10.6.15.156 → 192.168.1.12 TCP 66 22 → 54766 [ACK] Seq=33757 Ack=28193 Win=1452 Len=0 TSval=14410676 TSecr=7479174
  315 10.713892040  10.6.15.156 → 192.168.1.12 SSH 1046 Server: Encrypted packet (len=980)
  316 10.714010719  10.6.15.156 → 192.168.1.12 SSH 694 Server: Encrypted packet (len=628)
  317 10.714025625 192.168.1.12 → 10.6.15.156  TCP 66 54766 → 22 [ACK] Seq=28193 Ack=35365 Win=2901 Len=0 TSval=7479187 TSecr=14410679
  318 10.721690858 192.168.1.12 → 10.6.15.156  SSH 142 Client: Encrypted packet (len=76)
  319 10.723918723  10.6.15.156 → 192.168.1.12 TCP 66 22 → 54766 [ACK] Seq=35365 Ack=28269 Win=1452 Len=0 TSval=14410682 TSecr=7479189
  320 10.835323745  10.6.15.156 → 192.168.1.12 SSH 126 Server: Encrypted packet (len=60)
  321 10.835393497  10.6.15.156 → 192.168.1.12 SSH 138 Server: Encrypted packet (len=72)
  322 10.835427920 192.168.1.12 → 10.6.15.156  TCP 66 54766 → 22 [ACK] Seq=28269 Ack=35497 Win=2901 Len=0 TSval=7479218 TSecr=14410710
  323 10.835565571  10.6.15.156 → 192.168.1.12 SSH 330 Server: Encrypted packet (len=264)
  324 10.835635507 192.168.1.12 → 10.6.15.156  SSH 102 Client: Encrypted packet (len=36)
  325 10.835982918 192.168.1.12 → 10.6.15.156  SSH 138 Client: Encrypted packet (len=72)
  326 10.836344688  10.6.15.156 → 192.168.1.12 SSH 126 Server: Encrypted packet (len=60)
  327 10.836456918  10.6.15.156 → 192.168.1.12 SSH 138 Server: Encrypted packet (len=72)
  328 10.836504715 192.168.1.12 → 10.6.15.156  TCP 66 54766 → 22 [ACK] Seq=28377 Ack=35893 Win=2901 Len=0 TSval=7479218 TSecr=14410710
  329 10.836806642 192.168.1.12 → 10.6.15.156  SSH 102 Client: Encrypted packet (len=36)
  330 10.837263785  10.6.15.156 → 192.168.1.12 TCP 66 22 → 54766 [ACK] Seq=35893 Ack=28305 Win=1452 Len=0 TSval=14410710 TSecr=7479218
  331 10.837365611  10.6.15.156 → 192.168.1.12 TCP 66 22 → 54766 [ACK] Seq=35893 Ack=28377 Win=1452 Len=0 TSval=14410710 TSecr=7479218
  332 10.838258557  10.6.15.156 → 192.168.1.12 SSH 522 Server: Encrypted packet (len=456)
  333 10.838362249  10.6.15.156 → 192.168.1.12 SSH 198 Server: Encrypted packet (len=132)
  334 10.838422567 192.168.1.12 → 10.6.15.156  TCP 66 54766 → 22 [ACK] Seq=28413 Ack=36481 Win=2901 Len=0 TSval=7479218 TSecr=14410711
  335 10.838505934  10.6.15.156 → 192.168.1.12 SSH 138 Server: Encrypted packet (len=72)
  336 10.838554519 192.168.1.12 → 10.6.15.156  SSH 102 Client: Encrypted packet (len=36)
  337 10.838886526 192.168.1.12 → 10.6.15.156  SSH 102 Client: Encrypted packet (len=36)
  338 10.840251809  10.6.15.156 → 192.168.1.12 TCP 66 22 → 54766 [ACK] Seq=36553 Ack=28485 Win=1452 Len=0 TSval=14410711 TSecr=7479218
  339 12.978115309 192.168.1.12 → 10.6.15.156  SSH 138 Client: Encrypted packet (len=72)
  340 12.978851195 192.168.1.12 → 10.6.15.156  SSH 1514 Client: Encrypted packet (len=1448)
  341 12.979663997 192.168.1.12 → 10.6.15.156  SSH 210 Client: Encrypted packet (len=144)
  342 12.979958935 192.168.1.12 → 10.6.15.156  SSH 862 Client: Encrypted packet (len=796)
  343 12.980406787  10.6.15.156 → 192.168.1.12 SSH 102 Server: Encrypted packet (len=36)
  344 12.981550311  10.6.15.156 → 192.168.1.12 TCP 66 22 → 54766 [ACK] Seq=36589 Ack=30149 Win=1452 Len=0 TSval=14411247 TSecr=7479754
  345 13.022102849  10.6.15.156 → 192.168.1.12 TCP 66 22 → 54766 [ACK] Seq=36589 Ack=30945 Win=1452 Len=0 TSval=14411257 TSecr=7479754
  346 13.022736154 192.168.1.12 → 10.6.15.156  TCP 66 54766 → 22 [ACK] Seq=30945 Ack=36589 Win=2901 Len=0 TSval=7479765 TSecr=14411246
  347 13.071033834  10.6.15.156 → 192.168.1.12 SSH 102 Server: Encrypted packet (len=36)
  348 13.071059882 192.168.1.12 → 10.6.15.156  TCP 66 54766 → 22 [ACK] Seq=30945 Ack=36625 Win=2901 Len=0 TSval=7479777 TSecr=14411269
  349 13.210025974  10.6.15.156 → 192.168.1.12 SSH 454 Server: Encrypted packet (len=388)
  350 13.210056370 192.168.1.12 → 10.6.15.156  TCP 66 54766 → 22 [ACK] Seq=30945 Ack=37013 Win=2901 Len=0 TSval=7479811 TSecr=14411304
  351 13.210600142  10.6.15.156 → 192.168.1.12 SSH 454 Server: Encrypted packet (len=388)
  352 13.210610847 192.168.1.12 → 10.6.15.156  TCP 66 54766 → 22 [ACK] Seq=30945 Ack=37401 Win=2901 Len=0 TSval=7479811 TSecr=14411304
  353 13.211221379  10.6.15.156 → 192.168.1.12 SSH 454 Server: Encrypted packet (len=388)
  354 13.211233820 192.168.1.12 → 10.6.15.156  TCP 66 54766 → 22 [ACK] Seq=30945 Ack=37789 Win=2901 Len=0 TSval=7479812 TSecr=14411304
  355 13.782702532  10.6.15.156 → 192.168.1.12 SSH 102 Server: Encrypted packet (len=36)
  356 13.782739308 192.168.1.12 → 10.6.15.156  TCP 66 54766 → 22 [ACK] Seq=30945 Ack=37825 Win=2901 Len=0 TSval=7479954 TSecr=14411447
  357 14.978949541 192.168.1.12 → 10.6.15.156  SSH 862 Client: Encrypted packet (len=796)
  358 14.981682610  10.6.15.156 → 192.168.1.12 TCP 66 22 → 54766 [ACK] Seq=37825 Ack=31741 Win=1452 Len=0 TSval=14411746 TSecr=7480254
  359 15.056543839 192.168.1.12 → 123.108.200.124 NTP 90 NTP Version 4, client
  360 15.198864359  10.6.15.156 → 192.168.1.12 SSH 454 Server: Encrypted packet (len=388)
  361 15.198896732 192.168.1.12 → 10.6.15.156  TCP 66 54766 → 22 [ACK] Seq=31741 Ack=38213 Win=2901 Len=0 TSval=7480309 TSecr=14411801
  362 15.844072204 192.168.1.12 → 10.6.15.156  SSH 862 Client: Encrypted packet (len=796)
  363 15.846925596  10.6.15.156 → 192.168.1.12 TCP 66 22 → 54766 [ACK] Seq=38213 Ack=32537 Win=1452 Len=0 TSval=14411963 TSecr=7480470
  364 16.062379891  10.6.15.156 → 192.168.1.12 SSH 454 Server: Encrypted packet (len=388)
  365 16.062408094 192.168.1.12 → 10.6.15.156  TCP 66 54766 → 22 [ACK] Seq=32537 Ack=38601 Win=2901 Len=0 TSval=7480524 TSecr=14412017
  366 18.976185195 192.168.1.12 → 10.6.15.156  SSH 862 Client: Encrypted packet (len=796)
  367 18.978106932 192.168.1.12 → 10.6.15.156  SSH 1514 Client: Encrypted packet (len=1448)
  368 18.983787905 192.168.1.12 → 10.6.15.156  SSH 210 Client: Encrypted packet (len=144)
  369 18.983810184  10.6.15.156 → 192.168.1.12 TCP 66 22 → 54766 [ACK] Seq=38601 Ack=33333 Win=1452 Len=0 TSval=14412747 TSecr=7481253
  370 18.985360986  10.6.15.156 → 192.168.1.12 TCP 66 22 → 54766 [ACK] Seq=38601 Ack=34781 Win=1452 Len=0 TSval=14412748 TSecr=7481253
  371 18.985744174  10.6.15.156 → 192.168.1.12 TCP 66 22 → 54766 [ACK] Seq=38601 Ack=34925 Win=1452 Len=0 TSval=14412748 TSecr=7481255
  372 19.200290718  10.6.15.156 → 192.168.1.12 SSH 454 Server: Encrypted packet (len=388)
  373 19.200328990 192.168.1.12 → 10.6.15.156  TCP 66 54766 → 22 [ACK] Seq=34925 Ack=38989 Win=2901 Len=0 TSval=7481309 TSecr=14412801
  374 19.201485871  10.6.15.156 → 192.168.1.12 SSH 454 Server: Encrypted packet (len=388)
  375 19.201500976 192.168.1.12 → 10.6.15.156  TCP 66 54766 → 22 [ACK] Seq=34925 Ack=39377 Win=2901 Len=0 TSval=7481309 TSecr=14412801
  376 19.203569433  10.6.15.156 → 192.168.1.12 SSH 454 Server: Encrypted packet (len=388)
  377 19.203587243 192.168.1.12 → 10.6.15.156  TCP 66 54766 → 22 [ACK] Seq=34925 Ack=39765 Win=2901 Len=0 TSval=7481310 TSecr=14412802
  378 20.977053191 192.168.1.12 → 10.6.15.156  SSH 862 Client: Encrypted packet (len=796)
  379 20.979284527  10.6.15.156 → 192.168.1.12 TCP 66 22 → 54766 [ACK] Seq=39765 Ack=35721 Win=1452 Len=0 TSval=14413246 TSecr=7481753
  380 21.067584081 192.168.1.12 → 10.6.15.156  SSH 862 Client: Encrypted packet (len=796)
  381 21.069744959  10.6.15.156 → 192.168.1.12 TCP 66 22 → 54766 [ACK] Seq=39765 Ack=36517 Win=1452 Len=0 TSval=14413269 TSecr=7481776
  382 21.196886443  10.6.15.156 → 192.168.1.12 SSH 454 Server: Encrypted packet (len=388)
  383 21.196906091 192.168.1.12 → 10.6.15.156  TCP 66 54766 → 22 [ACK] Seq=36517 Ack=40153 Win=2901 Len=0 TSval=7481808 TSecr=14413300
  384 21.285354756  10.6.15.156 → 192.168.1.12 SSH 454 Server: Encrypted packet (len=388)
  385 21.285381895 192.168.1.12 → 10.6.15.156  TCP 66 54766 → 22 [ACK] Seq=36517 Ack=40541 Win=2901 Len=0 TSval=7481830 TSecr=14413322
  386 24.978657201 192.168.1.12 → 10.6.15.156  SSH 862 Client: Encrypted packet (len=796)
  387 24.979032640 192.168.1.12 → 10.6.15.156  SSH 1514 Client: Encrypted packet (len=1448)
  388 24.979887778 192.168.1.12 → 10.6.15.156  SSH 210 Client: Encrypted packet (len=144)
  389 24.980787563  10.6.15.156 → 192.168.1.12 TCP 66 22 → 54766 [ACK] Seq=40541 Ack=37313 Win=1452 Len=0 TSval=14414246 TSecr=7482753
  390 24.981464027  10.6.15.156 → 192.168.1.12 TCP 66 22 → 54766 [ACK] Seq=40541 Ack=38761 Win=1452 Len=0 TSval=14414247 TSecr=7482754
  391 24.981475177  10.6.15.156 → 192.168.1.12 TCP 66 22 → 54766 [ACK] Seq=40541 Ack=38905 Win=1452 Len=0 TSval=14414247 TSecr=7482754
  392 25.196364194  10.6.15.156 → 192.168.1.12 SSH 454 Server: Encrypted packet (len=388)
  393 25.196390860 192.168.1.12 → 10.6.15.156  TCP 66 54766 → 22 [ACK] Seq=38905 Ack=40929 Win=2901 Len=0 TSval=7482808 TSecr=14414300
  394 25.197043496  10.6.15.156 → 192.168.1.12 SSH 454 Server: Encrypted packet (len=388)
  395 25.197054819 192.168.1.12 → 10.6.15.156  TCP 66 54766 → 22 [ACK] Seq=38905 Ack=41317 Win=2901 Len=0 TSval=7482808 TSecr=14414300
  396 25.198462148  10.6.15.156 → 192.168.1.12 SSH 454 Server: Encrypted packet (len=388)
  397 25.198478083 192.168.1.12 → 10.6.15.156  TCP 66 54766 → 22 [ACK] Seq=38905 Ack=41705 Win=2901 Len=0 TSval=7482808 TSecr=14414301
  398 25.847190066  192.168.1.1 → 224.0.0.1    IGMPv2 42 Membership Query, general
  399 26.293894546 192.168.1.12 → 10.6.15.156  SSH 862 Client: Encrypted packet (len=796)
  400 26.296235856  10.6.15.156 → 192.168.1.12 TCP 66 22 → 54766 [ACK] Seq=41705 Ack=39701 Win=1452 Len=0 TSval=14414575 TSecr=7483082
  401 26.512560250  10.6.15.156 → 192.168.1.12 SSH 454 Server: Encrypted packet (len=388)
  402 26.512589843 192.168.1.12 → 10.6.15.156  TCP 66 54766 → 22 [ACK] Seq=39701 Ack=42093 Win=2901 Len=0 TSval=7483137 TSecr=14414629
  403 26.973546629 192.168.1.12 → 10.6.15.156  SSH 862 Client: Encrypted packet (len=796)
  404 26.976310734  10.6.15.156 → 192.168.1.12 TCP 66 22 → 54766 [ACK] Seq=42093 Ack=40497 Win=1452 Len=0 TSval=14414745 TSecr=7483252
  405 27.192272236  10.6.15.156 → 192.168.1.12 SSH 454 Server: Encrypted packet (len=388)
  406 27.192301465 192.168.1.12 → 10.6.15.156  TCP 66 54766 → 22 [ACK] Seq=40497 Ack=42481 Win=2901 Len=0 TSval=7483307 TSecr=14414799
  407 28.298780935 192.168.1.12 → 224.0.0.251  IGMPv2 46 Membership Report group 224.0.0.251
  408 30.974277605 192.168.1.12 → 10.6.15.156  SSH 862 Client: Encrypted packet (len=796)
  409 30.975636931 192.168.1.12 → 10.6.15.156  SSH 1514 Client: Encrypted packet (len=1448)
  410 30.977297237 192.168.1.12 → 10.6.15.156  SSH 210 Client: Encrypted packet (len=144)
  411 30.978281268  10.6.15.156 → 192.168.1.12 TCP 66 22 → 54766 [ACK] Seq=42481 Ack=41293 Win=1452 Len=0 TSval=14415746 TSecr=7484252
  412 30.979063046  10.6.15.156 → 192.168.1.12 TCP 66 22 → 54766 [ACK] Seq=42481 Ack=42885 Win=1452 Len=0 TSval=14415746 TSecr=7484253
  413 31.195171715  10.6.15.156 → 192.168.1.12 SSH 1230 Server: Encrypted packet (len=1164)
  414 31.195200527 192.168.1.12 → 10.6.15.156  TCP 66 54766 → 22 [ACK] Seq=42885 Ack=43645 Win=2901 Len=0 TSval=7484308 TSecr=14415800
  415 31.517881079 192.168.1.12 → 10.6.15.156  SSH 862 Client: Encrypted packet (len=796)
  416 31.520410278  10.6.15.156 → 192.168.1.12 TCP 66 22 → 54766 [ACK] Seq=43645 Ack=43681 Win=1452 Len=0 TSval=14415881 TSecr=7484388
  417 31.736069370  10.6.15.156 → 192.168.1.12 SSH 454 Server: Encrypted packet (len=388)
  418 31.736105628 192.168.1.12 → 10.6.15.156  TCP 66 54766 → 22 [ACK] Seq=43681 Ack=44033 Win=2901 Len=0 TSval=7484443 TSecr=14415935
  419 32.975884787 192.168.1.12 → 10.6.15.156  SSH 862 Client: Encrypted packet (len=796)
  420 32.978146104  10.6.15.156 → 192.168.1.12 TCP 66 22 → 54766 [ACK] Seq=44033 Ack=44477 Win=1452 Len=0 TSval=14416246 TSecr=7484753
  421 33.193784245  10.6.15.156 → 192.168.1.12 SSH 454 Server: Encrypted packet (len=388)
  422 33.193810740 192.168.1.12 → 10.6.15.156  TCP 66 54766 → 22 [ACK] Seq=44477 Ack=44421 Win=2901 Len=0 TSval=7484807 TSecr=14416300
  423 33.930756859 192.168.1.12 → 224.0.0.252  IGMPv2 46 Membership Report group 224.0.0.252
  424 34.056578556 192.168.1.12 → 91.189.89.199 NTP 90 NTP Version 4, client
