    1 0.000000000 192.168.1.16 → 54.76.71.168 TCP 128 42414 → 8282 [PSH, ACK] Seq=1 Ack=1 Win=296 Len=62 TSval=3478252 TSecr=607586689
    2 0.003051783  10.6.15.144 → 192.168.1.16 SSH 1514 Server: Encrypted packet (len=1448)
    3 0.003208688  10.6.15.144 → 192.168.1.16 SSH 1514 Server: Encrypted packet (len=1448)
    4 0.003219030 192.168.1.16 → 10.6.15.144  TCP 66 59298 → 22 [ACK] Seq=1 Ack=2897 Win=3666 Len=0 TSval=3478253 TSecr=4074510
    5 0.003233023  10.6.15.144 → 192.168.1.16 SSH 398 Server: Encrypted packet (len=332)
    6 0.005152154  10.6.15.144 → 192.168.1.16 SSH 1262 Server: Encrypted packet (len=1196)
    7 0.005168441 192.168.1.16 → 10.6.15.144  TCP 66 59298 → 22 [ACK] Seq=1 Ack=4425 Win=3666 Len=0 TSval=3478254 TSecr=4074510
    8 0.005281537  10.6.15.144 → 192.168.1.16 SSH 1514 Server: Encrypted packet (len=1448)
    9 0.014725447  10.6.15.144 → 192.168.1.16 SSH 1514 Server: Encrypted packet (len=1448)
   10 0.014743100 192.168.1.16 → 10.6.15.144  TCP 66 59298 → 22 [ACK] Seq=1 Ack=7321 Win=3666 Len=0 TSval=3478256 TSecr=4074556
   11 0.017203142 192.168.1.16 → 10.6.15.144  SSH 102 Client: Encrypted packet (len=36)
   12 0.017895741  10.6.15.144 → 192.168.1.16 SSH 1514 Server: Encrypted packet (len=1448)
   13 0.018087080  10.6.15.144 → 192.168.1.16 SSH 1514 Server: Encrypted packet (len=1448)
   14 0.018093489 192.168.1.16 → 10.6.15.144  TCP 66 59298 → 22 [ACK] Seq=37 Ack=10217 Win=3666 Len=0 TSval=3478257 TSecr=4074581
   15 0.018256176  10.6.15.144 → 192.168.1.16 SSH 1370 Server: Encrypted packet (len=1304)
   16 0.018845725 192.168.1.16 → 10.6.15.144  SSH 506 Client: Encrypted packet (len=440)
   17 0.030702600  10.6.15.144 → 192.168.1.16 TCP 66 22 → 59298 [ACK] Seq=11521 Ack=37 Win=1452 Len=0 TSval=4074584 TSecr=3478257
   18 0.030724274 192.168.1.16 → 10.6.15.144  SSH 686 Client: Encrypted packet (len=620)
   19 0.030795503  10.6.15.144 → 192.168.1.16 TCP 66 22 → 59298 [ACK] Seq=11521 Ack=477 Win=1452 Len=0 TSval=4074585 TSecr=3478257
   20 0.030804669  10.6.15.144 → 192.168.1.16 SSH 190 Server: Encrypted packet (len=124)
   21 0.055581297  10.6.15.144 → 192.168.1.16 SSH 138 Server: Encrypted packet (len=72)
   22 0.055647692 192.168.1.16 → 10.6.15.144  TCP 66 59298 → 22 [ACK] Seq=1097 Ack=11717 Win=3666 Len=0 TSval=3478266 TSecr=4074585
   23 0.055808221 192.168.1.16 → 10.6.15.144  SSH 102 Client: Encrypted packet (len=36)
   24 0.063729103  10.6.15.144 → 192.168.1.16 SSH 134 Server: Encrypted packet (len=68)
   25 0.063750290  10.6.15.144 → 192.168.1.16 SSH 198 Server: Encrypted packet (len=132)
   26 0.063756293  10.6.15.144 → 192.168.1.16 SSH 138 Server: Encrypted packet (len=72)
   27 0.063814116 192.168.1.16 → 10.6.15.144  TCP 66 59298 → 22 [ACK] Seq=1133 Ack=11989 Win=3666 Len=0 TSval=3478268 TSecr=4074593
   28 0.064050955 192.168.1.16 → 10.6.15.144  SSH 138 Client: Encrypted packet (len=72)
   29 0.065637524  10.6.15.144 → 192.168.1.16 SSH 126 Server: Encrypted packet (len=60)
   30 0.065659956  10.6.15.144 → 192.168.1.16 SSH 138 Server: Encrypted packet (len=72)
   31 0.065720389 192.168.1.16 → 10.6.15.144  TCP 66 59298 → 22 [ACK] Seq=1205 Ack=12121 Win=3666 Len=0 TSval=3478269 TSecr=4074594
   32 0.065895678 192.168.1.16 → 10.6.15.144  SSH 102 Client: Encrypted packet (len=36)
   33 0.075704279  10.6.15.144 → 192.168.1.16 SSH 146 Server: Encrypted packet (len=80)
   34 0.076063937 192.168.1.16 → 10.6.15.144  SSH 198 Client: Encrypted packet (len=132)
   35 0.098230904  10.6.15.144 → 192.168.1.16 TCP 66 22 → 59298 [ACK] Seq=12201 Ack=1373 Win=1452 Len=0 TSval=4074602 TSecr=3478268
   36 0.098251365 192.168.1.16 → 10.6.15.144  SSH 158 Client: Encrypted packet (len=92)
   37 0.113091740  10.6.15.144 → 192.168.1.16 SSH 126 Server: Encrypted packet (len=60)
   38 0.113117181  10.6.15.144 → 192.168.1.16 SSH 138 Server: Encrypted packet (len=72)
   39 0.113183658 192.168.1.16 → 10.6.15.144  TCP 66 59298 → 22 [ACK] Seq=1465 Ack=12333 Win=3666 Len=0 TSval=3478281 TSecr=4074605
   40 0.113358390 192.168.1.16 → 10.6.15.144  SSH 102 Client: Encrypted packet (len=36)
   41 0.138256386  10.6.15.144 → 192.168.1.16 SSH 230 Server: Encrypted packet (len=164)
   42 0.138569216 192.168.1.16 → 10.6.15.144  SSH 134 Client: Encrypted packet (len=68)
   43 0.147043920  10.6.15.144 → 192.168.1.16 SSH 166 Server: Encrypted packet (len=100)
   44 0.147371819 192.168.1.16 → 10.6.15.144  SSH 134 Client: Encrypted packet (len=68)
   45 0.158598174  10.6.15.144 → 192.168.1.16 TCP 66 22 → 59298 [ACK] Seq=12597 Ack=1637 Win=1452 Len=0 TSval=4074617 TSecr=3478287
   46 0.166074251 54.76.71.168 → 192.168.1.16 TCP 66 8282 → 42414 [ACK] Seq=1 Ack=63 Win=121 Len=0 TSval=607590230 TSecr=3478252
   47 0.181404452  10.6.15.144 → 192.168.1.16 SSH 138 Server: Encrypted packet (len=72)
   48 0.181843725 192.168.1.16 → 10.6.15.144  SSH 390 Client: Encrypted packet (len=324)
   49 0.182600430 192.168.1.16 → 10.6.15.144  SSH 158 Client: Encrypted packet (len=92)
   50 0.193221004  10.6.15.144 → 192.168.1.16 TCP 66 22 → 59298 [ACK] Seq=12669 Ack=2053 Win=1452 Len=0 TSval=4074625 TSecr=3478298
   51 0.248832827  10.6.15.144 → 192.168.1.16 SSH 138 Server: Encrypted packet (len=72)
   52 0.249046891 192.168.1.16 → 10.6.15.144  SSH 102 Client: Encrypted packet (len=36)
   53 0.272912772  10.6.15.144 → 192.168.1.16 SSH 174 Server: Encrypted packet (len=108)
   54 0.275686390 192.168.1.16 → 10.6.15.144  SSH 1366 Client: Encrypted packet (len=1300)
   55 0.279415848  10.6.15.144 → 192.168.1.16 SSH 166 Server: Encrypted packet (len=100)
   56 0.279539920  10.6.15.144 → 192.168.1.16 SSH 166 Server: Encrypted packet (len=100)
   57 0.279565582 192.168.1.16 → 10.6.15.144  TCP 66 59298 → 22 [ACK] Seq=3389 Ack=13049 Win=3666 Len=0 TSval=3478322 TSecr=4074647
   58 0.308471331  10.6.15.144 → 192.168.1.16 TCP 78 [TCP Dup ACK 50#1] 22 → 59298 [ACK] Seq=13049 Ack=2053 Win=1452 Len=0 TSval=4074654 TSecr=3478298 SLE=2089 SRE=3389
   59 0.344516231  10.6.15.144 → 192.168.1.16 SSH 266 Server: Encrypted packet (len=188)
   60 0.344796246 192.168.1.16 → 10.6.15.144  SSH 174 Client: Encrypted packet (len=108)
   61 0.355345606  10.6.15.144 → 192.168.1.16 TCP 78 [TCP Dup ACK 50#2] 22 → 59298 [ACK] Seq=13237 Ack=2053 Win=1452 Len=0 TSval=4074666 TSecr=3478298 SLE=2089 SRE=3497
   62 0.355643972  10.6.15.144 → 192.168.1.16 SSH 1514 Server: Encrypted packet (len=1436)
   63 0.355809499  10.6.15.144 → 192.168.1.16 SSH 398 Server: Encrypted packet (len=320)
   64 0.355819125 192.168.1.16 → 10.6.15.144  TCP 66 59298 → 22 [ACK] Seq=3497 Ack=14993 Win=3666 Len=0 TSval=3478341 TSecr=4074666
   65 0.355970550  10.6.15.144 → 192.168.1.16 SSH 1306 Server: Encrypted packet (len=1228)
   66 0.356887606 192.168.1.16 → 10.6.15.144  SSH 238 Client: Encrypted packet (len=172)
   67 0.369140166  10.6.15.144 → 192.168.1.16 TCP 78 [TCP Dup ACK 50#3] 22 → 59298 [ACK] Seq=16221 Ack=2053 Win=1452 Len=0 TSval=4074669 TSecr=3478298 SLE=2089 SRE=3669
   68 0.369162214 192.168.1.16 → 10.6.15.144  SSH 102 Client: [TCP Fast Retransmission] , Encrypted packet (len=36)
   69 0.379229328  10.6.15.144 → 192.168.1.16 TCP 66 22 → 59298 [ACK] Seq=16221 Ack=3669 Win=1449 Len=0 TSval=4074672 TSecr=3478345
   70 1.806087785  10.6.15.144 → 192.168.1.16 SSH 390 Server: Encrypted packet (len=324)
   71 1.806246643  10.6.15.144 → 192.168.1.16 SSH 1514 Server: Encrypted packet (len=1448)
   72 1.806254373 192.168.1.16 → 10.6.15.144  TCP 66 59298 → 22 [ACK] Seq=3669 Ack=17993 Win=3666 Len=0 TSval=3478704 TSecr=4074710
   73 1.806271759  10.6.15.144 → 192.168.1.16 SSH 118 Server: Encrypted packet (len=52)
   74 1.806628615  10.6.15.144 → 192.168.1.16 SSH 1514 Server: Encrypted packet (len=1448)
   75 1.806634509 192.168.1.16 → 10.6.15.144  TCP 66 59298 → 22 [ACK] Seq=3669 Ack=19493 Win=3666 Len=0 TSval=3478704 TSecr=4074750
   76 1.806823061  10.6.15.144 → 192.168.1.16 SSH 1514 Server: Encrypted packet (len=1448)
   77 1.807015532  10.6.15.144 → 192.168.1.16 SSH 1514 Server: Encrypted packet (len=1448)
   78 1.807019105 192.168.1.16 → 10.6.15.144  TCP 66 59298 → 22 [ACK] Seq=3669 Ack=22389 Win=3666 Len=0 TSval=3478704 TSecr=4074750
   79 1.807025300 10.22.18.220 → 224.0.0.252  LLMNR 64 Standard query 0x39e6 A wpad
   80 1.807038492 10.22.18.220 → 224.0.0.252  LLMNR 64 Standard query 0x590f AAAA wpad
   81 1.807228661  10.6.15.144 → 192.168.1.16 TCP 390 [TCP Out-Of-Order] 22 → 59298 [PSH, ACK] Seq=16221 Ack=3669 Win=1452 Len=324 TSval=4074843 TSecr=3478345
   82 1.807233445 192.168.1.16 → 10.6.15.144  TCP 78 [TCP Dup ACK 78#1] 59298 → 22 [ACK] Seq=3669 Ack=22389 Win=3666 Len=0 TSval=3478704 TSecr=4074750 SLE=16221 SRE=16545
   83 1.807240250 10.22.18.220 → 224.0.0.252  LLMNR 64 Standard query 0x590f AAAA wpad
   84 1.807245949 10.22.18.220 → 224.0.0.252  LLMNR 64 Standard query 0x39e6 A wpad
   85 1.807306039  10.6.15.144 → 192.168.1.16 TCP 390 [TCP Out-Of-Order] 22 → 59298 [PSH, ACK] Seq=16221 Ack=3669 Win=1452 Len=324 TSval=4074993 TSecr=3478345
   86 1.807309150 192.168.1.16 → 10.6.15.144  TCP 78 [TCP Dup ACK 78#2] 59298 → 22 [ACK] Seq=3669 Ack=22389 Win=3666 Len=0 TSval=3478704 TSecr=4074750 SLE=16221 SRE=16545
   87 1.818193964  10.6.15.144 → 192.168.1.16 SSH 1514 Server: Encrypted packet (len=1448)
   88 1.818210681 192.168.1.16 → 10.6.15.144  TCP 66 59298 → 22 [ACK] Seq=3669 Ack=23837 Win=3666 Len=0 TSval=3478707 TSecr=4075032
   89 1.818231945  10.6.15.144 → 192.168.1.16 SSH 446 Server: Encrypted packet (len=380)
   90 1.818236077 192.168.1.16 → 10.6.15.144  TCP 66 59298 → 22 [ACK] Seq=3669 Ack=24217 Win=3666 Len=0 TSval=3478707 TSecr=4075032
   91 1.821795979 192.168.1.16 → 10.6.15.144  SSH 138 Client: Encrypted packet (len=72)
   92 1.831618381  10.6.15.144 → 192.168.1.16 TCP 66 22 → 59298 [ACK] Seq=24217 Ack=3741 Win=1452 Len=0 TSval=4075035 TSecr=3478708
   93 1.831637497  10.6.15.144 → 192.168.1.16 SSH 102 Server: Encrypted packet (len=36)
   94 1.872089006 192.168.1.16 → 10.6.15.144  TCP 66 59298 → 22 [ACK] Seq=3741 Ack=24253 Win=3666 Len=0 TSval=3478721 TSecr=4075035
   95 2.305983617 192.168.1.16 → 10.6.15.144  SSH 862 Client: Encrypted packet (len=796)
   96 2.357055810  10.6.15.144 → 192.168.1.16 TCP 66 22 → 59298 [ACK] Seq=24253 Ack=4537 Win=1452 Len=0 TSval=4075167 TSecr=3478829
   97 2.364705344  10.6.15.144 → 192.168.1.16 SSH 1514 Server: Encrypted packet (len=1448)
   98 2.364725655 192.168.1.16 → 10.6.15.144  TCP 66 59298 → 22 [ACK] Seq=4537 Ack=25701 Win=3666 Len=0 TSval=3478844 TSecr=4075168
   99 2.364923379  10.6.15.144 → 192.168.1.16 SSH 958 Server: Encrypted packet (len=892)
  100 2.364928556 192.168.1.16 → 10.6.15.144  TCP 66 59298 → 22 [ACK] Seq=4537 Ack=26593 Win=3666 Len=0 TSval=3478844 TSecr=4075168
  101 2.488125089 192.168.1.16 → 10.6.15.144  SSH 238 Client: Encrypted packet (len=172)
  102 2.499167782  10.6.15.144 → 192.168.1.16 TCP 66 22 → 59298 [ACK] Seq=26593 Ack=4709 Win=1452 Len=0 TSval=4075202 TSecr=3478872
  103 2.527210849  10.6.15.144 → 192.168.1.16 SSH 150 Server: Encrypted packet (len=84)
  104 2.527228951 192.168.1.16 → 10.6.15.144  TCP 66 59298 → 22 [ACK] Seq=4709 Ack=26677 Win=3666 Len=0 TSval=3478884 TSecr=4075209
  105 2.536731706  10.6.15.144 → 192.168.1.16 SSH 1514 Server: Encrypted packet (len=1448)
  106 2.536750214 192.168.1.16 → 10.6.15.144  TCP 66 59298 → 22 [ACK] Seq=4709 Ack=28125 Win=3666 Len=0 TSval=3478887 TSecr=4075211
  107 2.536916326  10.6.15.144 → 192.168.1.16 SSH 1514 Server: Encrypted packet (len=1448)
  108 2.536921569 192.168.1.16 → 10.6.15.144  TCP 66 59298 → 22 [ACK] Seq=4709 Ack=29573 Win=3666 Len=0 TSval=3478887 TSecr=4075211
  109 2.537046226  10.6.15.144 → 192.168.1.16 SSH 110 Server: Encrypted packet (len=44)
  110 2.537050500 192.168.1.16 → 10.6.15.144  TCP 66 59298 → 22 [ACK] Seq=4709 Ack=29617 Win=3666 Len=0 TSval=3478887 TSecr=4075211
  111 2.537275468  10.6.15.144 → 192.168.1.16 SSH 1514 Server: Encrypted packet (len=1448)
  112 2.537281362 192.168.1.16 → 10.6.15.144  TCP 66 59298 → 22 [ACK] Seq=4709 Ack=31065 Win=3666 Len=0 TSval=3478887 TSecr=4075211
  113 2.545718788  10.6.15.144 → 192.168.1.16 SSH 1514 Server: Encrypted packet (len=1448)
  114 2.545738588 192.168.1.16 → 10.6.15.144  TCP 66 59298 → 22 [ACK] Seq=4709 Ack=32513 Win=3666 Len=0 TSval=3478889 TSecr=4075214
  115 2.553333783  10.6.15.144 → 192.168.1.16 SSH 1514 Server: Encrypted packet (len=1448)
  116 2.553349409 192.168.1.16 → 10.6.15.144  TCP 66 59298 → 22 [ACK] Seq=4709 Ack=33961 Win=3666 Len=0 TSval=3478891 TSecr=4075215
  117 2.553517630  10.6.15.144 → 192.168.1.16 SSH 1514 Server: Encrypted packet (len=1448)
  118 2.553523101 192.168.1.16 → 10.6.15.144  TCP 66 59298 → 22 [ACK] Seq=4709 Ack=35409 Win=3666 Len=0 TSval=3478891 TSecr=4075215
  119 2.556092393  10.6.15.144 → 192.168.1.16 SSH 1514 Server: [TCP Previous segment not captured] , Encrypted packet (len=1448)
  120 2.556110451 192.168.1.16 → 10.6.15.144  TCP 78 [TCP Dup ACK 118#1] 59298 → 22 [ACK] Seq=4709 Ack=35409 Win=3666 Len=0 TSval=3478892 TSecr=4075215 SLE=36857 SRE=38305
  121 2.556279163  10.6.15.144 → 192.168.1.16 SSH 1514 Server: Encrypted packet (len=1448)
  122 2.556286950 192.168.1.16 → 10.6.15.144  TCP 78 [TCP Dup ACK 118#2] 59298 → 22 [ACK] Seq=4709 Ack=35409 Win=3666 Len=0 TSval=3478892 TSecr=4075215 SLE=36857 SRE=39753
  123 2.564812905  10.6.15.144 → 192.168.1.16 SSH 1514 Server: Encrypted packet (len=1448)
  124 2.564832580 192.168.1.16 → 10.6.15.144  TCP 78 [TCP Dup ACK 118#3] 59298 → 22 [ACK] Seq=4709 Ack=35409 Win=3666 Len=0 TSval=3478894 TSecr=4075215 SLE=36857 SRE=41201
  125 2.565026275  10.6.15.144 → 192.168.1.16 SSH 1514 Server: Encrypted packet (len=1448)
  126 2.565033715 192.168.1.16 → 10.6.15.144  TCP 78 [TCP Dup ACK 118#4] 59298 → 22 [ACK] Seq=4709 Ack=35409 Win=3666 Len=0 TSval=3478894 TSecr=4075215 SLE=36857 SRE=42649
  127 2.566985222  10.6.15.144 → 192.168.1.16 SSH 1514 Server: Encrypted packet (len=1448)
  128 2.567002108 192.168.1.16 → 10.6.15.144  TCP 78 [TCP Dup ACK 118#5] 59298 → 22 [ACK] Seq=4709 Ack=35409 Win=3666 Len=0 TSval=3478894 TSecr=4075215 SLE=36857 SRE=44097
  129 2.567191913  10.6.15.144 → 192.168.1.16 SSH 1514 Server: Encrypted packet (len=1448)
  130 2.567198806 192.168.1.16 → 10.6.15.144  TCP 78 [TCP Dup ACK 118#6] 59298 → 22 [ACK] Seq=4709 Ack=35409 Win=3666 Len=0 TSval=3478894 TSecr=4075215 SLE=36857 SRE=45545
  131 2.567555273  10.6.15.144 → 192.168.1.16 SSH 1514 Server: Encrypted packet (len=1448)
  132 2.567562269 192.168.1.16 → 10.6.15.144  TCP 78 [TCP Dup ACK 118#7] 59298 → 22 [ACK] Seq=4709 Ack=35409 Win=3666 Len=0 TSval=3478894 TSecr=4075215 SLE=36857 SRE=46993
  133 2.577681760  10.6.15.144 → 192.168.1.16 SSH 1514 Server: [TCP Fast Retransmission] , Encrypted packet (len=1448)
  134 2.577708165 192.168.1.16 → 10.6.15.144  TCP 66 59298 → 22 [ACK] Seq=4709 Ack=46993 Win=3658 Len=0 TSval=3478897 TSecr=4075221
  135 2.578008126  10.6.15.144 → 192.168.1.16 SSH 1514 Server: Encrypted packet (len=1448)
  136 2.578014077 192.168.1.16 → 10.6.15.144  TCP 66 59298 → 22 [ACK] Seq=4709 Ack=48441 Win=3666 Len=0 TSval=3478897 TSecr=4075222
  137 2.578219808  10.6.15.144 → 192.168.1.16 SSH 1514 Server: Encrypted packet (len=1448)
  138 2.578225019 192.168.1.16 → 10.6.15.144  TCP 66 59298 → 22 [ACK] Seq=4709 Ack=49889 Win=3666 Len=0 TSval=3478897 TSecr=4075222
  139 2.578584378  10.6.15.144 → 192.168.1.16 SSH 1514 Server: Encrypted packet (len=1448)
  140 2.578591320 192.168.1.16 → 10.6.15.144  TCP 66 59298 → 22 [ACK] Seq=4709 Ack=51337 Win=3666 Len=0 TSval=3478897 TSecr=4075222
  141 2.590700905  10.6.15.144 → 192.168.1.16 SSH 1514 Server: Encrypted packet (len=1448)
  142 2.590717037 192.168.1.16 → 10.6.15.144  TCP 66 59298 → 22 [ACK] Seq=4709 Ack=52785 Win=3666 Len=0 TSval=3478900 TSecr=4075225
  143 2.590906816  10.6.15.144 → 192.168.1.16 SSH 1514 Server: Encrypted packet (len=1448)
  144 2.590914102 192.168.1.16 → 10.6.15.144  TCP 66 59298 → 22 [ACK] Seq=4709 Ack=54233 Win=3666 Len=0 TSval=3478900 TSecr=4075225
  145 2.591279978  10.6.15.144 → 192.168.1.16 SSH 1514 Server: Encrypted packet (len=1448)
  146 2.591287102 192.168.1.16 → 10.6.15.144  TCP 66 59298 → 22 [ACK] Seq=4709 Ack=55681 Win=3666 Len=0 TSval=3478900 TSecr=4075225
  147 2.591480771  10.6.15.144 → 192.168.1.16 SSH 1514 Server: Encrypted packet (len=1448)
  148 2.591485104 192.168.1.16 → 10.6.15.144  TCP 66 59298 → 22 [ACK] Seq=4709 Ack=57129 Win=3666 Len=0 TSval=3478900 TSecr=4075225
  149 2.602460934  10.6.15.144 → 192.168.1.16 SSH 1514 Server: Encrypted packet (len=1448)
  150 2.602476771 192.168.1.16 → 10.6.15.144  TCP 66 59298 → 22 [ACK] Seq=4709 Ack=58577 Win=3666 Len=0 TSval=3478903 TSecr=4075228
  151 2.602652810  10.6.15.144 → 192.168.1.16 SSH 1514 Server: Encrypted packet (len=1448)
  152 2.602659111 192.168.1.16 → 10.6.15.144  TCP 66 59298 → 22 [ACK] Seq=4709 Ack=60025 Win=3666 Len=0 TSval=3478903 TSecr=4075228
  153 2.605040539  10.6.15.144 → 192.168.1.16 SSH 1514 Server: [TCP Previous segment not captured] , Encrypted packet (len=1448)
  154 2.605050550 192.168.1.16 → 10.6.15.144  TCP 78 [TCP Dup ACK 152#1] 59298 → 22 [ACK] Seq=4709 Ack=60025 Win=3666 Len=0 TSval=3478904 TSecr=4075228 SLE=61473 SRE=62921
  155 2.605250997  10.6.15.144 → 192.168.1.16 SSH 1514 Server: Encrypted packet (len=1448)
  156 2.605254380 192.168.1.16 → 10.6.15.144  TCP 78 [TCP Dup ACK 152#2] 59298 → 22 [ACK] Seq=4709 Ack=60025 Win=3666 Len=0 TSval=3478904 TSecr=4075228 SLE=61473 SRE=64369
  157 2.605468787  10.6.15.144 → 192.168.1.16 SSH 1514 Server: Encrypted packet (len=1448)
  158 2.605475691 192.168.1.16 → 10.6.15.144  TCP 78 [TCP Dup ACK 152#3] 59298 → 22 [ACK] Seq=4709 Ack=60025 Win=3666 Len=0 TSval=3478904 TSecr=4075228 SLE=61473 SRE=65817
  159 2.614183051  10.6.15.144 → 192.168.1.16 SSH 1514 Server: Encrypted packet (len=1448)
  160 2.614195052 192.168.1.16 → 10.6.15.144  TCP 78 [TCP Dup ACK 152#4] 59298 → 22 [ACK] Seq=4709 Ack=60025 Win=3666 Len=0 TSval=3478906 TSecr=4075228 SLE=61473 SRE=67265
  161 2.614390996  10.6.15.144 → 192.168.1.16 SSH 1514 Server: Encrypted packet (len=1448)
  162 2.614394567 192.168.1.16 → 10.6.15.144  TCP 78 [TCP Dup ACK 152#5] 59298 → 22 [ACK] Seq=4709 Ack=60025 Win=3666 Len=0 TSval=3478906 TSecr=4075228 SLE=61473 SRE=68713
  163 2.616396282  10.6.15.144 → 192.168.1.16 SSH 1514 Server: Encrypted packet (len=1448)
  164 2.616418472 192.168.1.16 → 10.6.15.144  TCP 78 [TCP Dup ACK 152#6] 59298 → 22 [ACK] Seq=4709 Ack=60025 Win=3666 Len=0 TSval=3478907 TSecr=4075228 SLE=61473 SRE=70161
  165 2.616603479  10.6.15.144 → 192.168.1.16 SSH 1514 Server: Encrypted packet (len=1448)
  166 2.616614395 192.168.1.16 → 10.6.15.144  TCP 78 [TCP Dup ACK 152#7] 59298 → 22 [ACK] Seq=4709 Ack=60025 Win=3666 Len=0 TSval=3478907 TSecr=4075228 SLE=61473 SRE=71609
  167 2.626313176  10.6.15.144 → 192.168.1.16 SSH 1514 Server: Encrypted packet (len=1448)
  168 2.626331267 192.168.1.16 → 10.6.15.144  TCP 78 [TCP Dup ACK 152#8] 59298 → 22 [ACK] Seq=4709 Ack=60025 Win=3666 Len=0 TSval=3478909 TSecr=4075228 SLE=61473 SRE=73057
  169 2.627363521  10.6.15.144 → 192.168.1.16 SSH 1514 Server: Encrypted packet (len=1448)
  170 2.627372300 192.168.1.16 → 10.6.15.144  TCP 78 [TCP Dup ACK 152#9] 59298 → 22 [ACK] Seq=4709 Ack=60025 Win=3666 Len=0 TSval=3478909 TSecr=4075228 SLE=61473 SRE=74505
  171 2.627573346  10.6.15.144 → 192.168.1.16 SSH 1514 Server: Encrypted packet (len=1448)
  172 2.627578197 192.168.1.16 → 10.6.15.144  TCP 78 [TCP Dup ACK 152#10] 59298 → 22 [ACK] Seq=4709 Ack=60025 Win=3666 Len=0 TSval=3478909 TSecr=4075228 SLE=61473 SRE=75953
  173 2.636972360  10.6.15.144 → 192.168.1.16 SSH 1514 Server: [TCP Fast Retransmission] , Encrypted packet (len=1448)
  174 2.636994589 192.168.1.16 → 10.6.15.144  TCP 66 59298 → 22 [ACK] Seq=4709 Ack=75953 Win=3658 Len=0 TSval=3478912 TSecr=4075236
  175 2.637177568  10.6.15.144 → 192.168.1.16 SSH 1514 Server: Encrypted packet (len=1448)
  176 2.637184721 192.168.1.16 → 10.6.15.144  TCP 66 59298 → 22 [ACK] Seq=4709 Ack=77401 Win=3666 Len=0 TSval=3478912 TSecr=4075236
  177 2.639590732  10.6.15.144 → 192.168.1.16 SSH 1514 Server: Encrypted packet (len=1448)
  178 2.639604679 192.168.1.16 → 10.6.15.144  TCP 66 59298 → 22 [ACK] Seq=4709 Ack=78849 Win=3666 Len=0 TSval=3478912 TSecr=4075237
  179 2.641596908  10.6.15.144 → 192.168.1.16 SSH 1514 Server: Encrypted packet (len=1448)
  180 2.641607341 192.168.1.16 → 10.6.15.144  TCP 66 59298 → 22 [ACK] Seq=4709 Ack=80297 Win=3666 Len=0 TSval=3478913 TSecr=4075237
  181 2.647593283  10.6.15.144 → 192.168.1.16 SSH 1514 Server: Encrypted packet (len=1448)
  182 2.647607210 192.168.1.16 → 10.6.15.144  TCP 66 59298 → 22 [ACK] Seq=4709 Ack=81745 Win=3666 Len=0 TSval=3478914 TSecr=4075239
  183 2.647801738  10.6.15.144 → 192.168.1.16 SSH 1514 Server: Encrypted packet (len=1448)
  184 2.647807376 192.168.1.16 → 10.6.15.144  TCP 66 59298 → 22 [ACK] Seq=4709 Ack=83193 Win=3666 Len=0 TSval=3478914 TSecr=4075239
  185 2.651178001  10.6.15.144 → 192.168.1.16 SSH 1514 Server: Encrypted packet (len=1448)
  186 2.651193842 192.168.1.16 → 10.6.15.144  TCP 66 59298 → 22 [ACK] Seq=4709 Ack=84641 Win=3666 Len=0 TSval=3478915 TSecr=4075240
  187 2.651385610  10.6.15.144 → 192.168.1.16 SSH 1514 Server: Encrypted packet (len=1448)
  188 2.651393043 192.168.1.16 → 10.6.15.144  TCP 66 59298 → 22 [ACK] Seq=4709 Ack=86089 Win=3666 Len=0 TSval=3478915 TSecr=4075240
  189 2.658631234  10.6.15.144 → 192.168.1.16 SSH 1514 Server: Encrypted packet (len=1448)
  190 2.658646420 192.168.1.16 → 10.6.15.144  TCP 66 59298 → 22 [ACK] Seq=4709 Ack=87537 Win=3666 Len=0 TSval=3478917 TSecr=4075242
  191 2.658839896  10.6.15.144 → 192.168.1.16 SSH 1514 Server: Encrypted packet (len=1448)
  192 2.658847582 192.168.1.16 → 10.6.15.144  TCP 66 59298 → 22 [ACK] Seq=4709 Ack=88985 Win=3666 Len=0 TSval=3478917 TSecr=4075242
  193 2.659052836  10.6.15.144 → 192.168.1.16 SSH 1514 Server: Encrypted packet (len=1448)
  194 2.659058165 192.168.1.16 → 10.6.15.144  TCP 66 59298 → 22 [ACK] Seq=4709 Ack=90433 Win=3666 Len=0 TSval=3478917 TSecr=4075242
  195 2.659262009  10.6.15.144 → 192.168.1.16 SSH 1514 Server: Encrypted packet (len=1448)
  196 2.659266550 192.168.1.16 → 10.6.15.144  TCP 66 59298 → 22 [ACK] Seq=4709 Ack=91881 Win=3666 Len=0 TSval=3478917 TSecr=4075242
  197 2.662822117  10.6.15.144 → 192.168.1.16 SSH 1514 Server: Encrypted packet (len=1448)
  198 2.662832408 192.168.1.16 → 10.6.15.144  TCP 66 59298 → 22 [ACK] Seq=4709 Ack=93329 Win=3666 Len=0 TSval=3478918 TSecr=4075243
  199 2.663033402  10.6.15.144 → 192.168.1.16 SSH 1514 Server: Encrypted packet (len=1448)
  200 2.663038851 192.168.1.16 → 10.6.15.144  TCP 66 59298 → 22 [ACK] Seq=4709 Ack=94777 Win=3666 Len=0 TSval=3478918 TSecr=4075243
  201 2.670540298  10.6.15.144 → 192.168.1.16 SSH 1514 Server: Encrypted packet (len=1448)
  202 2.670554690 192.168.1.16 → 10.6.15.144  TCP 66 59298 → 22 [ACK] Seq=4709 Ack=96225 Win=3666 Len=0 TSval=3478920 TSecr=4075245
  203 2.670747306  10.6.15.144 → 192.168.1.16 SSH 1514 Server: Encrypted packet (len=1448)
  204 2.670959181  10.6.15.144 → 192.168.1.16 SSH 1514 Server: Encrypted packet (len=1448)
  205 2.670963642 192.168.1.16 → 10.6.15.144  TCP 66 59298 → 22 [ACK] Seq=4709 Ack=99121 Win=3666 Len=0 TSval=3478920 TSecr=4075245
  206 2.671172864  10.6.15.144 → 192.168.1.16 SSH 1514 Server: Encrypted packet (len=1448)
  207 2.673737805  10.6.15.144 → 192.168.1.16 SSH 1514 Server: Encrypted packet (len=1448)
  208 2.673752342 192.168.1.16 → 10.6.15.144  TCP 66 59298 → 22 [ACK] Seq=4709 Ack=102017 Win=3666 Len=0 TSval=3478921 TSecr=4075245
  209 2.673945324  10.6.15.144 → 192.168.1.16 SSH 1514 Server: Encrypted packet (len=1448)
  210 2.682157617  10.6.15.144 → 192.168.1.16 SSH 1514 Server: [TCP Previous segment not captured] , Encrypted packet (len=1448)
  211 2.682173977 192.168.1.16 → 10.6.15.144  TCP 78 59298 → 22 [ACK] Seq=4709 Ack=103465 Win=3666 Len=0 TSval=3478923 TSecr=4075245 SLE=104913 SRE=106361
  212 2.684902913  10.6.15.144 → 192.168.1.16 SSH 1514 Server: Encrypted packet (len=1448)
  213 2.684912935 192.168.1.16 → 10.6.15.144  TCP 78 [TCP Dup ACK 211#1] 59298 → 22 [ACK] Seq=4709 Ack=103465 Win=3666 Len=0 TSval=3478924 TSecr=4075245 SLE=104913 SRE=107809
  214 2.685115603  10.6.15.144 → 192.168.1.16 SSH 1514 Server: Encrypted packet (len=1448)
  215 2.685121195 192.168.1.16 → 10.6.15.144  TCP 78 [TCP Dup ACK 211#2] 59298 → 22 [ACK] Seq=4709 Ack=103465 Win=3666 Len=0 TSval=3478924 TSecr=4075245 SLE=104913 SRE=109257
  216 2.693832002  10.6.15.144 → 192.168.1.16 SSH 1514 Server: Encrypted packet (len=1448)
  217 2.693848763 192.168.1.16 → 10.6.15.144  TCP 78 [TCP Dup ACK 211#3] 59298 → 22 [ACK] Seq=4709 Ack=103465 Win=3666 Len=0 TSval=3478926 TSecr=4075245 SLE=104913 SRE=110705
  218 2.694038711  10.6.15.144 → 192.168.1.16 SSH 1514 Server: Encrypted packet (len=1448)
  219 2.694043142 192.168.1.16 → 10.6.15.144  TCP 78 [TCP Dup ACK 211#4] 59298 → 22 [ACK] Seq=4709 Ack=103465 Win=3666 Len=0 TSval=3478926 TSecr=4075245 SLE=104913 SRE=112153
  220 2.694251124  10.6.15.144 → 192.168.1.16 SSH 1514 Server: Encrypted packet (len=1448)
  221 2.694254333 192.168.1.16 → 10.6.15.144  TCP 78 [TCP Dup ACK 211#5] 59298 → 22 [ACK] Seq=4709 Ack=103465 Win=3666 Len=0 TSval=3478926 TSecr=4075245 SLE=104913 SRE=113601
  222 2.733273958  10.6.15.144 → 192.168.1.16 SSH 1514 Server: Encrypted packet (len=1448)
  223 2.733291941 192.168.1.16 → 10.6.15.144  TCP 78 [TCP Dup ACK 211#6] 59298 → 22 [ACK] Seq=4709 Ack=103465 Win=3666 Len=0 TSval=3478936 TSecr=4075245 SLE=104913 SRE=115049
  224 2.733471249  10.6.15.144 → 192.168.1.16 SSH 1514 Server: [TCP Fast Retransmission] , Encrypted packet (len=1448)
  225 2.733485403 192.168.1.16 → 10.6.15.144  TCP 66 59298 → 22 [ACK] Seq=4709 Ack=115049 Win=3658 Len=0 TSval=3478936 TSecr=4075251
  226 2.733684100  10.6.15.144 → 192.168.1.16 SSH 1514 Server: Encrypted packet (len=1448)
  227 2.733692535 192.168.1.16 → 10.6.15.144  TCP 66 59298 → 22 [ACK] Seq=4709 Ack=116497 Win=3666 Len=0 TSval=3478936 TSecr=4075254
  228 2.733708793 192.168.1.16 → 10.6.15.144  SSH 102 Client: Encrypted packet (len=36)
  229 2.733895947  10.6.15.144 → 192.168.1.16 SSH 1514 Server: Encrypted packet (len=1448)
  230 2.743468107  10.6.15.144 → 192.168.1.16 SSH 1514 Server: Encrypted packet (len=1448)
  231 2.743484595 192.168.1.16 → 10.6.15.144  TCP 66 59298 → 22 [ACK] Seq=4745 Ack=119393 Win=3666 Len=0 TSval=3478938 TSecr=4075254
  232 2.743677809  10.6.15.144 → 192.168.1.16 SSH 1514 Server: Encrypted packet (len=1448)
  233 2.744040543  10.6.15.144 → 192.168.1.16 SSH 1514 Server: Encrypted packet (len=1448)
  234 2.744050802 192.168.1.16 → 10.6.15.144  TCP 66 59298 → 22 [ACK] Seq=4745 Ack=122289 Win=3666 Len=0 TSval=3478938 TSecr=4075263
  235 2.744249941  10.6.15.144 → 192.168.1.16 SSH 1514 Server: Encrypted packet (len=1448)
  236 2.754635086  10.6.15.144 → 192.168.1.16 SSH 1514 Server: Encrypted packet (len=1448)
  237 2.754653913 192.168.1.16 → 10.6.15.144  TCP 66 59298 → 22 [ACK] Seq=4745 Ack=125185 Win=3666 Len=0 TSval=3478941 TSecr=4075263
  238 2.754840862  10.6.15.144 → 192.168.1.16 SSH 1514 Server: Encrypted packet (len=1448)
  239 2.755206771  10.6.15.144 → 192.168.1.16 SSH 1514 Server: Encrypted packet (len=1448)
  240 2.755215210 192.168.1.16 → 10.6.15.144  TCP 66 59298 → 22 [ACK] Seq=4745 Ack=128081 Win=3666 Len=0 TSval=3478941 TSecr=4075266
  241 2.755414872  10.6.15.144 → 192.168.1.16 SSH 1514 Server: Encrypted packet (len=1448)
  242 2.766693017  10.6.15.144 → 192.168.1.16 SSH 1514 Server: Encrypted packet (len=1448)
  243 2.766713203 192.168.1.16 → 10.6.15.144  TCP 66 59298 → 22 [ACK] Seq=4745 Ack=130977 Win=3666 Len=0 TSval=3478944 TSecr=4075266
  244 2.766925134  10.6.15.144 → 192.168.1.16 SSH 1514 Server: Encrypted packet (len=1448)
  245 2.767164091  10.6.15.144 → 192.168.1.16 SSH 1514 Server: Encrypted packet (len=1448)
  246 2.767170383 192.168.1.16 → 10.6.15.144  TCP 66 59298 → 22 [ACK] Seq=4745 Ack=133873 Win=3666 Len=0 TSval=3478944 TSecr=4075269
  247 2.767402398  10.6.15.144 → 192.168.1.16 SSH 1514 Server: Encrypted packet (len=1448)
  248 2.778915981  10.6.15.144 → 192.168.1.16 SSH 1514 Server: Encrypted packet (len=1448)
  249 2.778932163 192.168.1.16 → 10.6.15.144  TCP 66 59298 → 22 [ACK] Seq=4745 Ack=136769 Win=3666 Len=0 TSval=3478947 TSecr=4075269
  250 2.779147726  10.6.15.144 → 192.168.1.16 SSH 1514 Server: Encrypted packet (len=1448)
  251 2.779386635  10.6.15.144 → 192.168.1.16 SSH 1514 Server: Encrypted packet (len=1448)
  252 2.779391241 192.168.1.16 → 10.6.15.144  TCP 66 59298 → 22 [ACK] Seq=4745 Ack=139665 Win=3666 Len=0 TSval=3478947 TSecr=4075272
  253 2.779640961  10.6.15.144 → 192.168.1.16 SSH 1514 Server: Encrypted packet (len=1448)
  254 2.793475455  10.6.15.144 → 192.168.1.16 SSH 1514 Server: Encrypted packet (len=1448)
  255 2.793496446 192.168.1.16 → 10.6.15.144  TCP 66 59298 → 22 [ACK] Seq=4745 Ack=142561 Win=3666 Len=0 TSval=3478951 TSecr=4075272
  256 2.793702339  10.6.15.144 → 192.168.1.16 SSH 1514 Server: Encrypted packet (len=1448)
  257 2.793939694  10.6.15.144 → 192.168.1.16 SSH 1514 Server: [TCP Previous segment not captured] , Encrypted packet (len=1448)
  258 2.793948764 192.168.1.16 → 10.6.15.144  TCP 78 59298 → 22 [ACK] Seq=4745 Ack=144009 Win=3666 Len=0 TSval=3478951 TSecr=4075275 SLE=145457 SRE=146905
  259 2.805187870  10.6.15.144 → 192.168.1.16 SSH 1514 Server: Encrypted packet (len=1448)
  260 2.805205196 192.168.1.16 → 10.6.15.144  TCP 78 [TCP Dup ACK 258#1] 59298 → 22 [ACK] Seq=4745 Ack=144009 Win=3666 Len=0 TSval=3478954 TSecr=4075275 SLE=145457 SRE=148353
  261 2.805421865  10.6.15.144 → 192.168.1.16 SSH 1514 Server: Encrypted packet (len=1448)
  262 2.805430734 192.168.1.16 → 10.6.15.144  TCP 78 [TCP Dup ACK 258#2] 59298 → 22 [ACK] Seq=4745 Ack=144009 Win=3666 Len=0 TSval=3478954 TSecr=4075275 SLE=145457 SRE=149801
  263 2.805660051  10.6.15.144 → 192.168.1.16 SSH 1514 Server: Encrypted packet (len=1448)
  264 2.805666959 192.168.1.16 → 10.6.15.144  TCP 78 [TCP Dup ACK 258#3] 59298 → 22 [ACK] Seq=4745 Ack=144009 Win=3666 Len=0 TSval=3478954 TSecr=4075275 SLE=145457 SRE=151249
  265 2.805898263  10.6.15.144 → 192.168.1.16 SSH 1514 Server: Encrypted packet (len=1448)
  266 2.805902949 192.168.1.16 → 10.6.15.144  TCP 78 [TCP Dup ACK 258#4] 59298 → 22 [ACK] Seq=4745 Ack=144009 Win=3666 Len=0 TSval=3478954 TSecr=4075275 SLE=145457 SRE=152697
  267 2.806136767  10.6.15.144 → 192.168.1.16 SSH 1514 Server: Encrypted packet (len=1448)
  268 2.806140841 192.168.1.16 → 10.6.15.144  TCP 78 [TCP Dup ACK 258#5] 59298 → 22 [ACK] Seq=4745 Ack=144009 Win=3666 Len=0 TSval=3478954 TSecr=4075275 SLE=145457 SRE=154145
  269 2.819139772  10.6.15.144 → 192.168.1.16 SSH 1514 Server: Encrypted packet (len=1448)
  270 2.819157061 192.168.1.16 → 10.6.15.144  TCP 78 [TCP Dup ACK 258#6] 59298 → 22 [ACK] Seq=4745 Ack=144009 Win=3666 Len=0 TSval=3478957 TSecr=4075275 SLE=145457 SRE=155593
  271 2.819384121  10.6.15.144 → 192.168.1.16 SSH 1514 Server: [TCP Fast Retransmission] , Encrypted packet (len=1448)
  272 2.819395389 192.168.1.16 → 10.6.15.144  TCP 66 59298 → 22 [ACK] Seq=4745 Ack=155593 Win=3658 Len=0 TSval=3478957 TSecr=4075281
  273 2.819616075  10.6.15.144 → 192.168.1.16 SSH 1514 Server: Encrypted packet (len=1448)
  274 2.819624299 192.168.1.16 → 10.6.15.144  TCP 66 59298 → 22 [ACK] Seq=4745 Ack=157041 Win=3666 Len=0 TSval=3478957 TSecr=4075281
  275 2.830821638  10.6.15.144 → 192.168.1.16 SSH 1514 Server: [TCP Previous segment not captured] , Encrypted packet (len=1448)
  276 2.830839483 192.168.1.16 → 10.6.15.144  TCP 78 [TCP Dup ACK 274#1] 59298 → 22 [ACK] Seq=4745 Ack=157041 Win=3666 Len=0 TSval=3478960 TSecr=4075281 SLE=158489 SRE=159937
  277 2.831055686  10.6.15.144 → 192.168.1.16 SSH 1514 Server: Encrypted packet (len=1448)
  278 2.831066868 192.168.1.16 → 10.6.15.144  TCP 78 [TCP Dup ACK 274#2] 59298 → 22 [ACK] Seq=4745 Ack=157041 Win=3666 Len=0 TSval=3478960 TSecr=4075281 SLE=158489 SRE=161385
  279 2.831293801  10.6.15.144 → 192.168.1.16 SSH 1514 Server: Encrypted packet (len=1448)
  280 2.831304045 192.168.1.16 → 10.6.15.144  TCP 78 [TCP Dup ACK 274#3] 59298 → 22 [ACK] Seq=4745 Ack=157041 Win=3666 Len=0 TSval=3478960 TSecr=4075281 SLE=158489 SRE=162833
  281 2.831533042  10.6.15.144 → 192.168.1.16 SSH 1514 Server: Encrypted packet (len=1448)
  282 2.831540898 192.168.1.16 → 10.6.15.144  TCP 78 [TCP Dup ACK 274#4] 59298 → 22 [ACK] Seq=4745 Ack=157041 Win=3666 Len=0 TSval=3478960 TSecr=4075281 SLE=158489 SRE=164281
  283 2.842658685  10.6.15.144 → 192.168.1.16 SSH 1514 Server: Encrypted packet (len=1448)
  284 2.842675086 192.168.1.16 → 10.6.15.144  TCP 78 [TCP Dup ACK 274#5] 59298 → 22 [ACK] Seq=4745 Ack=157041 Win=3666 Len=0 TSval=3478963 TSecr=4075281 SLE=158489 SRE=165729
  285 2.842895451  10.6.15.144 → 192.168.1.16 SSH 1514 Server: Encrypted packet (len=1448)
  286 2.842905016 192.168.1.16 → 10.6.15.144  TCP 78 [TCP Dup ACK 274#6] 59298 → 22 [ACK] Seq=4745 Ack=157041 Win=3666 Len=0 TSval=3478963 TSecr=4075281 SLE=158489 SRE=167177
  287 2.843134574  10.6.15.144 → 192.168.1.16 SSH 1514 Server: [TCP Fast Retransmission] , Encrypted packet (len=1448)
  288 2.843146770 192.168.1.16 → 10.6.15.144  TCP 66 59298 → 22 [ACK] Seq=4745 Ack=167177 Win=3658 Len=0 TSval=3478963 TSecr=4075288
  289 3.148089393 192.168.1.16 → 104.31.74.124 TCP 66 38120 → 80 [ACK] Seq=1 Ack=1 Win=274 Len=0 TSval=3479040 TSecr=1019305028
  290 3.153838130  10.6.15.144 → 192.168.1.16 SSH 1514 Server: [TCP Spurious Retransmission] , Encrypted packet (len=1448)
  291 3.153852163 192.168.1.16 → 10.6.15.144  TCP 78 [TCP Window Update] 59298 → 22 [ACK] Seq=4745 Ack=167177 Win=3666 Len=0 TSval=3479041 TSecr=4075288 SLE=157041 SRE=158489
  292 3.247620657 104.31.74.124 → 192.168.1.16 TCP 66 [TCP ACKed unseen segment] 80 → 38120 [ACK] Seq=1 Ack=2 Win=31 Len=0 TSval=1019309557 TSecr=3467741
  293 3.248341093  10.6.15.144 → 192.168.1.16 SSH 1514 Server: Encrypted packet (len=1448)
  294 3.248362026 192.168.1.16 → 10.6.15.144  TCP 66 59298 → 22 [ACK] Seq=4745 Ack=168625 Win=3666 Len=0 TSval=3479065 TSecr=4075389
  295 3.248528866  10.6.15.144 → 192.168.1.16 SSH 1514 Server: Encrypted packet (len=1448)
  296 3.248534798 192.168.1.16 → 10.6.15.144  TCP 66 59298 → 22 [ACK] Seq=4745 Ack=170073 Win=3666 Len=0 TSval=3479065 TSecr=4075389
  297 3.266514188  10.6.15.144 → 192.168.1.16 SSH 1514 Server: Encrypted packet (len=1448)
  298 3.266533279 192.168.1.16 → 10.6.15.144  TCP 66 59298 → 22 [ACK] Seq=4745 Ack=171521 Win=3666 Len=0 TSval=3479069 TSecr=4075389
  299 3.266636157  10.6.15.144 → 192.168.1.16 SSH 1514 Server: Encrypted packet (len=1448)
  300 3.266640649 192.168.1.16 → 10.6.15.144  TCP 66 59298 → 22 [ACK] Seq=4745 Ack=172969 Win=3666 Len=0 TSval=3479069 TSecr=4075389
  301 3.266862889  10.6.15.144 → 192.168.1.16 SSH 1514 Server: Encrypted packet (len=1448)
  302 3.266870040 192.168.1.16 → 10.6.15.144  TCP 66 59298 → 22 [ACK] Seq=4745 Ack=174417 Win=3666 Len=0 TSval=3479069 TSecr=4075392
  303 3.277977142  10.6.15.144 → 192.168.1.16 SSH 1514 Server: [TCP Previous segment not captured] , Encrypted packet (len=1448)
  304 3.277995576 192.168.1.16 → 10.6.15.144  TCP 78 [TCP Dup ACK 302#1] 59298 → 22 [ACK] Seq=4745 Ack=174417 Win=3666 Len=0 TSval=3479072 TSecr=4075392 SLE=175865 SRE=177313
  305 3.278175825  10.6.15.144 → 192.168.1.16 SSH 1514 Server: Encrypted packet (len=1448)
  306 3.278186302 192.168.1.16 → 10.6.15.144  TCP 78 [TCP Dup ACK 302#2] 59298 → 22 [ACK] Seq=4745 Ack=174417 Win=3666 Len=0 TSval=3479072 TSecr=4075392 SLE=175865 SRE=178761
  307 3.289009634  10.6.15.144 → 192.168.1.16 SSH 1514 Server: Encrypted packet (len=1448)
  308 3.289029919 192.168.1.16 → 10.6.15.144  TCP 78 [TCP Dup ACK 302#3] 59298 → 22 [ACK] Seq=4745 Ack=174417 Win=3666 Len=0 TSval=3479075 TSecr=4075392 SLE=175865 SRE=180209
  309 3.289189828  10.6.15.144 → 192.168.1.16 SSH 1514 Server: Encrypted packet (len=1448)
  310 3.289193717 192.168.1.16 → 10.6.15.144  TCP 78 [TCP Dup ACK 302#4] 59298 → 22 [ACK] Seq=4745 Ack=174417 Win=3666 Len=0 TSval=3479075 TSecr=4075392 SLE=175865 SRE=181657
  311 3.289534323  10.6.15.144 → 192.168.1.16 SSH 1514 Server: Encrypted packet (len=1448)
  312 3.289537775 192.168.1.16 → 10.6.15.144  TCP 78 [TCP Dup ACK 302#5] 59298 → 22 [ACK] Seq=4745 Ack=174417 Win=3666 Len=0 TSval=3479075 TSecr=4075392 SLE=175865 SRE=183105
  313 3.300368619  10.6.15.144 → 192.168.1.16 SSH 1514 Server: [TCP Fast Retransmission] , Encrypted packet (len=1448)
  314 3.300383545 192.168.1.16 → 10.6.15.144  TCP 66 59298 → 22 [ACK] Seq=4745 Ack=183105 Win=3666 Len=0 TSval=3479078 TSecr=4075402
  315 3.311067997  10.6.15.144 → 192.168.1.16 SSH 1514 Server: [TCP Previous segment not captured] , Encrypted packet (len=1448)
  316 3.311086029 192.168.1.16 → 10.6.15.144  TCP 78 [TCP Dup ACK 314#1] 59298 → 22 [ACK] Seq=4745 Ack=183105 Win=3666 Len=0 TSval=3479080 TSecr=4075402 SLE=184553 SRE=186001
  317 3.321613680  10.6.15.144 → 192.168.1.16 SSH 1514 Server: Encrypted packet (len=1448)
  318 3.321624430 192.168.1.16 → 10.6.15.144  TCP 78 [TCP Dup ACK 314#2] 59298 → 22 [ACK] Seq=4745 Ack=183105 Win=3666 Len=0 TSval=3479083 TSecr=4075402 SLE=184553 SRE=187449
  319 3.332582883  10.6.15.144 → 192.168.1.16 SSH 1514 Server: Encrypted packet (len=1448)
  320 3.332601006 192.168.1.16 → 10.6.15.144  TCP 78 [TCP Dup ACK 314#3] 59298 → 22 [ACK] Seq=4745 Ack=183105 Win=3666 Len=0 TSval=3479086 TSecr=4075402 SLE=184553 SRE=188897
  321 3.343839931  10.6.15.144 → 192.168.1.16 SSH 1514 Server: [TCP Fast Retransmission] , Encrypted packet (len=1448)
  322 3.343862205 192.168.1.16 → 10.6.15.144  TCP 66 59298 → 22 [ACK] Seq=4745 Ack=188897 Win=3666 Len=0 TSval=3479088 TSecr=4075413
  323 3.343990972  10.6.15.144 → 192.168.1.16 SSH 1514 Server: Encrypted packet (len=1448)
  324 3.343993928 192.168.1.16 → 10.6.15.144  TCP 66 59298 → 22 [ACK] Seq=4745 Ack=190345 Win=3666 Len=0 TSval=3479088 TSecr=4075413
  325 3.355289617  10.6.15.144 → 192.168.1.16 SSH 1514 Server: Encrypted packet (len=1448)
  326 3.355307154 192.168.1.16 → 10.6.15.144  TCP 66 59298 → 22 [ACK] Seq=4745 Ack=191793 Win=3666 Len=0 TSval=3479091 TSecr=4075416
  327 3.366649237  10.6.15.144 → 192.168.1.16 SSH 1514 Server: [TCP Previous segment not captured] , Encrypted packet (len=1448)
  328 3.366668420 192.168.1.16 → 10.6.15.144  TCP 78 [TCP Dup ACK 326#1] 59298 → 22 [ACK] Seq=4745 Ack=191793 Win=3666 Len=0 TSval=3479094 TSecr=4075416 SLE=194689 SRE=196137
  329 3.379628049  10.6.15.144 → 192.168.1.16 SSH 1514 Server: Encrypted packet (len=1448)
  330 3.379649856 192.168.1.16 → 10.6.15.144  TCP 78 [TCP Dup ACK 326#2] 59298 → 22 [ACK] Seq=4745 Ack=191793 Win=3666 Len=0 TSval=3479097 TSecr=4075416 SLE=194689 SRE=197585
  331 3.391028996  10.6.15.144 → 192.168.1.16 SSH 1514 Server: [TCP Fast Retransmission] , Encrypted packet (len=1448)
  332 3.391048847 192.168.1.16 → 10.6.15.144  TCP 78 59298 → 22 [ACK] Seq=4745 Ack=193241 Win=3666 Len=0 TSval=3479100 TSecr=4075425 SLE=194689 SRE=197585
  333 3.401985847  10.6.15.144 → 192.168.1.16 SSH 1514 Server: Encrypted packet (len=1448)
  334 3.401996223 192.168.1.16 → 10.6.15.144  TCP 78 [TCP Dup ACK 332#1] 59298 → 22 [ACK] Seq=4745 Ack=193241 Win=3666 Len=0 TSval=3479103 TSecr=4075425 SLE=194689 SRE=199033
  335 3.412403615  10.6.15.144 → 192.168.1.16 TCP 1514 [TCP Retransmission] 22 → 59298 [ACK] Seq=193241 Ack=4745 Win=1452 Len=1448 TSval=4075430 TSecr=3479103
  336 3.412432706 192.168.1.16 → 10.6.15.144  TCP 66 59298 → 22 [ACK] Seq=4745 Ack=199033 Win=3666 Len=0 TSval=3479106 TSecr=4075430
  337 3.412603454  10.6.15.144 → 192.168.1.16 SSH 1514 Server: Encrypted packet (len=1448)
  338 3.412610769 192.168.1.16 → 10.6.15.144  TCP 66 59298 → 22 [ACK] Seq=4745 Ack=200481 Win=3666 Len=0 TSval=3479106 TSecr=4075430
  339 3.422923233  10.6.15.144 → 192.168.1.16 SSH 1514 Server: Encrypted packet (len=1448)
  340 3.422942004 192.168.1.16 → 10.6.15.144  TCP 66 59298 → 22 [ACK] Seq=4745 Ack=201929 Win=3666 Len=0 TSval=3479108 TSecr=4075433
  341 3.423076170  10.6.15.144 → 192.168.1.16 SSH 1514 Server: Encrypted packet (len=1448)
