    1 0.000000000  10.6.15.144 → 192.168.1.16 SSH 254 Server: Encrypted packet (len=188)
    2 0.000060191  10.6.15.144 → 192.168.1.16 SSH 822 Server: Encrypted packet (len=756)
    3 0.000081471 192.168.1.16 → 10.6.15.144  TCP 66 59298 → 22 [ACK] Seq=1 Ack=945 Win=3666 Len=0 TSval=3493952 TSecr=4090088
    4 0.000160719  10.6.15.144 → 192.168.1.16 SSH 822 Server: [TCP Spurious Retransmission] , Encrypted packet (len=756)
    5 0.000167775 192.168.1.16 → 10.6.15.144  TCP 78 [TCP Dup ACK 3#1] 59298 → 22 [ACK] Seq=1 Ack=945 Win=3666 Len=0 TSval=3493952 TSecr=4090101 SLE=189 SRE=945
    6 0.002612159 192.168.1.16 → 10.6.15.144  SSH 270 Client: Encrypted packet (len=204)
    7 0.004804007 192.168.1.16 → 10.6.15.144  SSH 270 Client: Encrypted packet (len=204)
    8 0.008572907 10.22.17.255 → 224.0.0.252  LLMNR 64 Standard query 0x6bb7 A wpad
    9 0.008754088  10.6.15.144 → 192.168.1.16 SSH 1010 Server: [TCP Spurious Retransmission] , Encrypted packet (len=944)
   10 0.008768812 192.168.1.16 → 10.6.15.144  TCP 78 [TCP Dup ACK 3#2] 59298 → 22 [ACK] Seq=409 Ack=945 Win=3666 Len=0 TSval=3493954 TSecr=4090177 SLE=1 SRE=945
   11 0.008779893 10.22.17.255 → 224.0.0.252  LLMNR 64 Standard query 0x6bb7 A wpad
   12 0.011644699  10.6.15.144 → 192.168.1.16 SSH 166 Server: Encrypted packet (len=100)
   13 0.011661888 192.168.1.16 → 10.6.15.144  TCP 66 59298 → 22 [ACK] Seq=409 Ack=1045 Win=3666 Len=0 TSval=3493955 TSecr=4090280
   14 0.013079942  10.6.15.144 → 192.168.1.16 TCP 66 22 → 59298 [ACK] Seq=1045 Ack=205 Win=1452 Len=0 TSval=4090280 TSecr=3493953
   15 0.013980803 192.168.1.16 → 10.6.15.144  SSH 1462 Client: Encrypted packet (len=1396)
   16 0.017250170  10.6.15.144 → 192.168.1.16 TCP 66 22 → 59298 [ACK] Seq=1045 Ack=409 Win=1452 Len=0 TSval=4090281 TSecr=3493953
   17 0.027119668  10.6.15.144 → 192.168.1.16 TCP 66 22 → 59298 [ACK] Seq=1045 Ack=1805 Win=1452 Len=0 TSval=4090284 TSecr=3493956
   18 0.991920419  10.6.15.144 → 192.168.1.16 SSH 166 Server: Encrypted packet (len=100)
   19 0.991947570  10.6.15.144 → 192.168.1.16 SSH 166 Server: Encrypted packet (len=100)
   20 0.991999224 192.168.1.16 → 10.6.15.144  TCP 66 59298 → 22 [ACK] Seq=1805 Ack=1245 Win=3666 Len=0 TSval=3494200 TSecr=4090339
   21 1.001934295  10.6.15.144 → 192.168.1.16 SSH 1514 Server: [TCP Previous segment not captured] , Encrypted packet (len=1448)
   22 1.001961715 192.168.1.16 → 10.6.15.144  TCP 78 [TCP Dup ACK 20#1] 59298 → 22 [ACK] Seq=1805 Ack=1245 Win=3666 Len=0 TSval=3494203 TSecr=4090339 SLE=2693 SRE=4141
   23 1.002111508  10.6.15.144 → 192.168.1.16 SSH 1514 Server: Encrypted packet (len=1448)
   24 1.002122047 192.168.1.16 → 10.6.15.144  TCP 78 [TCP Dup ACK 20#2] 59298 → 22 [ACK] Seq=1805 Ack=1245 Win=3666 Len=0 TSval=3494203 TSecr=4090339 SLE=2693 SRE=5589
   25 1.015781991  10.6.15.144 → 192.168.1.16 SSH 1514 Server: [TCP Previous segment not captured] , Encrypted packet (len=1448)
   26 1.015799478 192.168.1.16 → 10.6.15.144  TCP 86 [TCP Dup ACK 20#3] 59298 → 22 [ACK] Seq=1805 Ack=1245 Win=3666 Len=0 TSval=3494206 TSecr=4090339 SLE=7037 SRE=8485 SLE=2693 SRE=5589
   27 1.026149012  10.6.15.144 → 192.168.1.16 SSH 1514 Server: [TCP Fast Retransmission] , Encrypted packet (len=1448)
   28 1.026178320 192.168.1.16 → 10.6.15.144  TCP 78 59298 → 22 [ACK] Seq=1805 Ack=5589 Win=3666 Len=0 TSval=3494209 TSecr=4090533 SLE=7037 SRE=8485
   29 1.035802558  10.6.15.144 → 192.168.1.16 SSH 586 Server: Encrypted packet (len=520)
   30 1.035821240 192.168.1.16 → 10.6.15.144  TCP 78 [TCP Dup ACK 28#1] 59298 → 22 [ACK] Seq=1805 Ack=5589 Win=3666 Len=0 TSval=3494211 TSecr=4090533 SLE=7037 SRE=9005
   31 3.040002488  10.6.15.144 → 192.168.1.16 TCP 1514 [TCP Retransmission] 22 → 59298 [ACK] Seq=5589 Ack=1805 Win=1452 Len=1448 TSval=4090856 TSecr=3494209
   32 3.040027807 192.168.1.16 → 10.6.15.144  TCP 66 59298 → 22 [ACK] Seq=1805 Ack=9005 Win=3666 Len=0 TSval=3494712 TSecr=4090856
   33 3.043814610 192.168.1.16 → 10.6.15.144  SSH 138 Client: Encrypted packet (len=72)
   34 3.080078069  10.6.15.144 → 192.168.1.16 TCP 66 22 → 59298 [ACK] Seq=9005 Ack=1877 Win=1452 Len=0 TSval=4091047 TSecr=3494713
   35 3.080588160  10.6.15.144 → 192.168.1.16 SSH 102 Server: Encrypted packet (len=36)
   36 3.121959340 192.168.1.16 → 10.6.15.144  TCP 66 59298 → 22 [ACK] Seq=1877 Ack=9041 Win=3666 Len=0 TSval=3494733 TSecr=4091047
   37 3.520691802 192.168.1.16 → 10.6.15.144  SSH 862 Client: Encrypted packet (len=796)
   38 3.569987070  10.6.15.144 → 192.168.1.16 TCP 66 22 → 59298 [ACK] Seq=9041 Ack=2673 Win=1452 Len=0 TSval=4091170 TSecr=3494832
   39 3.612470229  10.6.15.144 → 192.168.1.16 SSH 1514 Server: Encrypted packet (len=1448)
   40 3.612495423 192.168.1.16 → 10.6.15.144  TCP 66 59298 → 22 [ACK] Seq=2673 Ack=10489 Win=3666 Len=0 TSval=3494855 TSecr=4091180
   41 3.612560435  10.6.15.144 → 192.168.1.16 SSH 958 Server: Encrypted packet (len=892)
   42 3.612564619 192.168.1.16 → 10.6.15.144  TCP 66 59298 → 22 [ACK] Seq=2673 Ack=11381 Win=3666 Len=0 TSval=3494855 TSecr=4091180
   43 5.024823455 10.22.18.209 → 224.0.0.252  LLMNR 64 Standard query 0x60b6 A wpad
   44 5.024857185 10.22.18.209 → 224.0.0.252  LLMNR 64 Standard query 0x60b6 A wpad
   45 6.016236502 10.22.17.117 → 224.0.0.252  LLMNR 64 Standard query 0x1b50 A wpad
   46 6.016282235 10.22.17.117 → 224.0.0.252  LLMNR 64 Standard query 0x1b50 A wpad
   47 8.000207183  10.6.15.144 → 192.168.1.16 SSH 102 Server: Encrypted packet (len=36)
   48 8.000258462 192.168.1.16 → 10.6.15.144  TCP 66 59298 → 22 [ACK] Seq=2673 Ack=11417 Win=3666 Len=0 TSval=3495952 TSecr=4092104
   49 8.000851122 192.168.1.16 → 10.6.15.144  SSH 138 Client: Encrypted packet (len=72)
   50 8.009211052 10.22.17.117 → 224.0.0.252  LLMNR 64 Standard query 0x25bc A wpad
   51 8.012100214  10.6.15.144 → 192.168.1.16 TCP 66 22 → 59298 [ACK] Seq=11417 Ack=2745 Win=1452 Len=0 TSval=4092280 TSecr=3495952
   52 8.012135223  10.6.15.144 → 192.168.1.16 SSH 102 Server: Encrypted packet (len=36)
   53 8.054013542 192.168.1.16 → 10.6.15.144  TCP 66 59298 → 22 [ACK] Seq=2745 Ack=11453 Win=3666 Len=0 TSval=3495966 TSecr=4092280
   54 9.024108650 10.22.17.117 → 224.0.0.252  LLMNR 64 Standard query 0x25bc A wpad
   55 10.016852420  10.6.15.144 → 192.168.1.16 SSH 102 Server: Encrypted packet (len=36)
   56 10.016906645 192.168.1.16 → 10.6.15.144  TCP 66 59298 → 22 [ACK] Seq=2745 Ack=11489 Win=3666 Len=0 TSval=3496456 TSecr=4092680
   57 10.017510040 192.168.1.16 → 10.6.15.144  SSH 138 Client: Encrypted packet (len=72)
   58 10.027742076  10.6.15.144 → 192.168.1.16 SSH 102 Server: Encrypted packet (len=36)
   59 10.070024140 192.168.1.16 → 10.6.15.144  TCP 66 59298 → 22 [ACK] Seq=2817 Ack=11525 Win=3666 Len=0 TSval=3496470 TSecr=4092784
   60 11.044235320 10.22.17.201 → 224.0.0.252  LLMNR 64 Standard query 0xa649 A wpad
   61 12.001251540 10.22.17.201 → 224.0.0.252  LLMNR 64 Standard query 0xa649 A wpad
   62 12.001271271  10.22.17.84 → 224.0.0.252  LLMNR 65 Standard query 0x99f0 A https
   63 12.007372947  10.22.17.84 → 224.0.0.252  LLMNR 65 Standard query 0x3e18 AAAA https
   64 12.007380241  10.22.17.84 → 224.0.0.252  LLMNR 65 Standard query 0x34f6 A https
   65 12.007391122  10.22.17.84 → 224.0.0.252  LLMNR 65 Standard query 0x2550 AAAA https
   66 12.080530204  10.22.17.84 → 224.0.0.252  LLMNR 65 Standard query 0x99f0 A https
   67 12.084562783  10.22.17.84 → 224.0.0.252  LLMNR 65 Standard query 0x3e18 AAAA https
   68 12.084613751  10.22.17.84 → 224.0.0.252  LLMNR 65 Standard query 0x34f6 A https
   69 12.089345145  10.22.17.84 → 224.0.0.252  LLMNR 65 Standard query 0x2550 AAAA https
   70 14.059538783 192.168.1.16 → 10.6.15.144  SSH 1514 Client: Encrypted packet (len=1448)
   71 14.067902206 192.168.1.16 → 10.6.15.144  SSH 590 Client: Encrypted packet (len=524)
   72 14.079764946  10.6.15.144 → 192.168.1.16 TCP 66 22 → 59298 [ACK] Seq=11525 Ack=4789 Win=1452 Len=0 TSval=4093797 TSecr=3497467
   73 14.080434281  10.6.15.144 → 192.168.1.16 SSH 150 Server: Encrypted packet (len=84)
   74 14.080452172 192.168.1.16 → 10.6.15.144  TCP 66 59298 → 22 [ACK] Seq=4789 Ack=11609 Win=3666 Len=0 TSval=3497472 TSecr=4093797
   75 15.008134460  10.6.15.144 → 192.168.1.16 SSH 1070 Server: Encrypted packet (len=1004)
   76 15.008169275 192.168.1.16 → 10.6.15.144  TCP 66 59298 → 22 [ACK] Seq=4789 Ack=12613 Win=3666 Len=0 TSval=3497704 TSecr=4093827
   77 15.008194015  10.6.15.144 → 192.168.1.16 SSH 534 Server: Encrypted packet (len=468)
   78 15.008202137 192.168.1.16 → 10.6.15.144  TCP 66 59298 → 22 [ACK] Seq=4789 Ack=13081 Win=3666 Len=0 TSval=3497704 TSecr=4093829
   79 15.008211960  10.6.15.144 → 192.168.1.16 SSH 534 Server: [TCP Spurious Retransmission] , Encrypted packet (len=468)
   80 15.008218002 192.168.1.16 → 10.6.15.144  TCP 78 [TCP Dup ACK 78#1] 59298 → 22 [ACK] Seq=4789 Ack=13081 Win=3666 Len=0 TSval=3497704 TSecr=4093917 SLE=12613 SRE=13081
   81 15.009176166 192.168.1.16 → 10.6.15.144  SSH 134 Client: Encrypted packet (len=68)
   82 15.057613283  10.6.15.144 → 192.168.1.16 TCP 66 22 → 59298 [ACK] Seq=13081 Ack=4857 Win=1452 Len=0 TSval=4094042 TSecr=3497704
   83 16.003720555  192.168.1.1 → 224.0.0.1    IGMPv2 42 Membership Query, general
   84 17.024602081  10.6.15.144 → 192.168.1.16 SSH 102 Server: Encrypted packet (len=36)
   85 17.024631447  10.6.15.144 → 192.168.1.16 TCP 102 [TCP Retransmission] 22 → 59298 [PSH, ACK] Seq=13081 Ack=4857 Win=1452 Len=36 TSval=4094527 TSecr=3497704
   86 17.024643446 192.168.1.16 → 10.6.15.144  TCP 78 59298 → 22 [ACK] Seq=4857 Ack=13117 Win=3666 Len=0 TSval=3498208 TSecr=4094527 SLE=13081 SRE=13117
   87 17.024971201 192.168.1.16 → 10.6.15.144  SSH 138 Client: Encrypted packet (len=72)
   88 17.035348473  10.6.15.144 → 192.168.1.16 TCP 66 22 → 59298 [ACK] Seq=13117 Ack=4929 Win=1452 Len=0 TSval=4094536 TSecr=3498208
   89 17.035364983  10.6.15.144 → 192.168.1.16 SSH 102 Server: Encrypted packet (len=36)
   90 17.078011330 192.168.1.16 → 10.6.15.144  TCP 66 59298 → 22 [ACK] Seq=4929 Ack=13153 Win=3666 Len=0 TSval=3498222 TSecr=4094536
   91 18.174009135 192.168.1.16 → 54.76.71.168 TCP 66 42414 → 8282 [ACK] Seq=1 Ack=1 Win=296 Len=0 TSval=3498496 TSecr=607598527
   92 18.942033811 192.168.1.16 → 224.0.0.252  IGMPv2 46 Membership Report group 224.0.0.252
   93 18.946292352 54.76.71.168 → 192.168.1.16 TCP 66 [TCP ACKed unseen segment] 8282 → 42414 [ACK] Seq=1 Ack=2 Win=121 Len=0 TSval=607610473 TSecr=3486550
   94 18.946307452  10.6.15.144 → 192.168.1.16 SSH 186 Server: Encrypted packet (len=120)
   95 18.946324587 192.168.1.16 → 10.6.15.144  TCP 66 59298 → 22 [ACK] Seq=4929 Ack=13273 Win=3666 Len=0 TSval=3498689 TSecr=4095010
   96 18.946339982  10.6.15.144 → 192.168.1.16 SSH 102 Server: Encrypted packet (len=36)
   97 18.946345299 192.168.1.16 → 10.6.15.144  TCP 66 59298 → 22 [ACK] Seq=4929 Ack=13309 Win=3666 Len=0 TSval=3498689 TSecr=4095010
   98 18.957747475  10.6.15.144 → 192.168.1.16 SSH 390 Server: Encrypted packet (len=324)
   99 18.957772145 192.168.1.16 → 10.6.15.144  TCP 66 59298 → 22 [ACK] Seq=4929 Ack=13633 Win=3666 Len=0 TSval=3498691 TSecr=4095017
  100 20.222014434 192.168.1.16 → 224.0.0.251  IGMPv2 46 Membership Report group 224.0.0.251
  101 23.020840341 10.22.18.209 → 224.0.0.252  LLMNR 64 Standard query 0xd062 A wpad
  102 23.119041401 10.22.18.209 → 224.0.0.252  LLMNR 64 Standard query 0xd062 A wpad
  103 23.158797315  10.6.15.144 → 192.168.1.16 SSH 102 Server: Encrypted packet (len=36)
  104 23.158818057 192.168.1.16 → 10.6.15.144  TCP 66 59298 → 22 [ACK] Seq=4929 Ack=13669 Win=3666 Len=0 TSval=3499742 TSecr=4096067
  105 23.159136670 192.168.1.16 → 10.6.15.144  SSH 138 Client: Encrypted packet (len=72)
  106 23.170558038  10.6.15.144 → 192.168.1.16 SSH 102 Server: Encrypted packet (len=36)
  107 23.214008544 192.168.1.16 → 10.6.15.144  TCP 66 59298 → 22 [ACK] Seq=5001 Ack=13705 Win=3666 Len=0 TSval=3499756 TSecr=4096069
  108 23.999976383  10.6.15.144 → 192.168.1.16 SSH 102 Server: [TCP Spurious Retransmission] , Encrypted packet (len=36)
  109 23.999996583 192.168.1.16 → 10.6.15.144  TCP 78 [TCP Dup ACK 107#1] 59298 → 22 [ACK] Seq=5001 Ack=13705 Win=3666 Len=0 TSval=3499952 TSecr=4096179 SLE=13669 SRE=13705
