    1 0.000000000 192.168.1.12 → 10.6.15.156  TCP 66 54766 → 22 [ACK] Seq=1 Ack=1 Win=4866 Len=0 TSval=7674384 TSecr=14605878
    2 0.000008404 192.168.1.12 → 10.6.15.156  SSH 102 Client: Encrypted packet (len=36)
    3 0.000011275 192.168.1.12 → 10.6.15.156  TCP 78 [TCP Dup ACK 1#1] 54766 → 22 [ACK] Seq=37 Ack=1 Win=4866 Len=0 TSval=7674387 TSecr=14605882 SLE=4294967225 SRE=1
    4 0.000012705 192.168.1.12 → 10.6.15.156  TCP 66 54766 → 22 [ACK] Seq=37 Ack=69 Win=4866 Len=0 TSval=7674400 TSecr=14605895
    5 0.000014080 192.168.1.12 → 10.6.15.156  TCP 66 54766 → 22 [ACK] Seq=37 Ack=141 Win=4866 Len=0 TSval=7674400 TSecr=14605895
    6 0.000015558 192.168.1.12 → 10.6.15.156  TCP 66 54766 → 22 [ACK] Seq=37 Ack=185 Win=4866 Len=0 TSval=7674402 TSecr=14605896
    7 0.000016934 192.168.1.12 → 10.6.15.156  TCP 66 54766 → 22 [ACK] Seq=37 Ack=221 Win=4866 Len=0 TSval=7674402 TSecr=14605896
    8 0.000018158 192.168.1.12 → 10.6.15.156  SSH 334 Client: Encrypted packet (len=268)
    9 0.000736723 192.168.1.12 → 10.6.15.156  SSH 1514 Client: Encrypted packet (len=1448)
   10 0.000834943  10.6.15.156 → 192.168.1.12 SSH 126 Server: Encrypted packet (len=60)
   11 0.000848730 192.168.1.12 → 10.6.15.156  TCP 66 54766 → 22 [ACK] Seq=1753 Ack=281 Win=4866 Len=0 TSval=7674510 TSecr=14605929
   12 0.000854773  10.6.15.156 → 192.168.1.12 SSH 138 Server: Encrypted packet (len=72)
   13 0.000858964 192.168.1.12 → 10.6.15.156  TCP 66 54766 → 22 [ACK] Seq=1753 Ack=353 Win=4866 Len=0 TSval=7674510 TSecr=14605929
   14 0.002023779  10.6.15.156 → 192.168.1.12 TCP 66 22 → 54766 [ACK] Seq=353 Ack=37 Win=1452 Len=0 TSval=14606005 TSecr=7674384
   15 0.002034358 192.168.1.12 → 10.6.15.156  SSH 1514 Client: Encrypted packet (len=1448)
   16 0.002040205 192.168.1.12 → 10.6.15.156  SSH 334 Client: Encrypted packet (len=268)
   17 0.003203180  10.6.15.156 → 192.168.1.12 TCP 66 22 → 54766 [ACK] Seq=353 Ack=305 Win=1452 Len=0 TSval=14606005 TSecr=7674447
   18 0.005216314  10.6.15.156 → 192.168.1.12 TCP 66 22 → 54766 [ACK] Seq=353 Ack=3469 Win=1452 Len=0 TSval=14606005 TSecr=7674510
   19 0.169004759  10.6.15.156 → 192.168.1.12 SSH 502 Server: Encrypted packet (len=436)
   20 0.221734567  10.6.15.156 → 192.168.1.12 SSH 246 Server: Encrypted packet (len=180)
   21 0.223486071  10.6.15.156 → 192.168.1.12 SSH 182 Server: Encrypted packet (len=116)
   22 0.235448687  10.6.15.156 → 192.168.1.12 SSH 798 Server: Encrypted packet (len=732)
   23 0.711982177 192.168.1.12 → 10.6.15.156  TCP 66 54766 → 22 [ACK] Seq=3469 Ack=789 Win=4866 Len=0 TSval=7674563 TSecr=14606046
   24 0.711992228 192.168.1.12 → 10.6.15.156  TCP 66 54766 → 22 [ACK] Seq=3469 Ack=969 Win=4866 Len=0 TSval=7674565 TSecr=14606060
   25 0.711994536 192.168.1.12 → 10.6.15.156  SSH 134 Client: Encrypted packet (len=68)
   26 0.711998348 192.168.1.12 → 10.6.15.156  TCP 66 54766 → 22 [ACK] Seq=3537 Ack=1817 Win=4866 Len=0 TSval=7674568 TSecr=14606060
   27 0.712436701 192.168.1.12 → 10.6.15.156  SSH 134 Client: Encrypted packet (len=68)
   28 0.713837129  10.6.15.156 → 192.168.1.12 TCP 66 22 → 54766 [ACK] Seq=1817 Ack=3605 Win=1452 Len=0 TSval=14606183 TSecr=7674565
   29 1.427983746 192.168.1.12 → 10.6.15.156  SSH 862 Client: Encrypted packet (len=796)
   30 1.428422880 192.168.1.12 → 10.6.15.156  SSH 290 Client: Encrypted packet (len=224)
   31 1.430510322  10.6.15.156 → 192.168.1.12 TCP 66 22 → 54766 [ACK] Seq=1817 Ack=4625 Win=1452 Len=0 TSval=14606362 TSecr=7674755
   32 1.457751728  10.6.15.156 → 192.168.1.12 SSH 138 Server: Encrypted packet (len=72)
   33 1.457969993 192.168.1.12 → 10.6.15.156  SSH 102 Client: Encrypted packet (len=36)
   34 1.505977237  10.6.15.156 → 192.168.1.12 TCP 66 22 → 54766 [ACK] Seq=1889 Ack=4661 Win=1452 Len=0 TSval=14606381 TSecr=7674874
   35 1.588124336  10.6.15.156 → 192.168.1.12 SSH 138 Server: Encrypted packet (len=72)
   36 1.588327436 192.168.1.12 → 10.6.15.156  SSH 102 Client: Encrypted packet (len=36)
   37 1.590190329  10.6.15.156 → 192.168.1.12 TCP 66 22 → 54766 [ACK] Seq=1961 Ack=4697 Win=1452 Len=0 TSval=14606402 TSecr=7674907
   38 1.642452307  10.6.15.156 → 192.168.1.12 SSH 102 Server: Encrypted packet (len=36)
   39 1.645715900  10.6.15.156 → 192.168.1.12 SSH 102 Server: Encrypted packet (len=36)
   40 1.648921170  10.6.15.156 → 192.168.1.12 SSH 102 Server: Encrypted packet (len=36)
   41 1.649116165  10.6.15.156 → 192.168.1.12 SSH 454 Server: Encrypted packet (len=388)
   42 2.143969023 192.168.1.12 → 10.6.15.156  SSH 150 Client: Encrypted packet (len=84)
   43 2.143979472 192.168.1.12 → 10.6.15.156  TCP 66 54766 → 22 [ACK] Seq=4781 Ack=2069 Win=4866 Len=0 TSval=7674922 TSecr=14606416
   44 2.143981594 192.168.1.12 → 10.6.15.156  TCP 66 54766 → 22 [ACK] Seq=4781 Ack=2457 Win=4866 Len=0 TSval=7674933 TSecr=14606416
   45 2.144399207 192.168.1.12 → 10.6.15.156  SSH 1110 Client: Encrypted packet (len=1044)
   46 2.145141126  10.22.18.25 → 224.0.0.252  LLMNR 64 Standard query 0xe89b A wpad
   47 2.149005015  10.6.15.156 → 192.168.1.12 TCP 66 22 → 54766 [ACK] Seq=2457 Ack=4781 Win=1452 Len=0 TSval=14606541 TSecr=7674920
   48 2.150189023  10.6.15.156 → 192.168.1.12 TCP 66 22 → 54766 [ACK] Seq=2457 Ack=5825 Win=1452 Len=0 TSval=14606541 TSecr=7675046
   49 2.157049868  10.6.15.156 → 192.168.1.12 SSH 126 Server: Encrypted packet (len=60)
   50 2.157066813 192.168.1.12 → 10.6.15.156  TCP 66 54766 → 22 [ACK] Seq=5825 Ack=2517 Win=4866 Len=0 TSval=7675049 TSecr=14606543
   51 2.157083025  10.6.15.156 → 192.168.1.12 SSH 138 Server: Encrypted packet (len=72)
   52 2.157089018 192.168.1.12 → 10.6.15.156  TCP 66 54766 → 22 [ACK] Seq=5825 Ack=2589 Win=4866 Len=0 TSval=7675049 TSecr=14606543
   53 2.157288963 192.168.1.12 → 10.6.15.156  SSH 102 Client: Encrypted packet (len=36)
   54 2.201546085  10.6.15.156 → 192.168.1.12 TCP 66 22 → 54766 [ACK] Seq=2589 Ack=5861 Win=1452 Len=0 TSval=14606554 TSecr=7675049
   55 2.255148506  10.22.18.25 → 224.0.0.252  LLMNR 64 Standard query 0xe89b A wpad
   56 2.360041131  10.6.15.156 → 192.168.1.12 SSH 238 Server: Encrypted packet (len=172)
   57 2.365754542  10.6.15.156 → 192.168.1.12 SSH 102 Server: Encrypted packet (len=36)
   58 2.365774859  10.6.15.156 → 192.168.1.12 SSH 182 Server: Encrypted packet (len=116)
   59 2.367487050  10.6.15.156 → 192.168.1.12 SSH 182 Server: Encrypted packet (len=116)
   60 2.367845388  10.6.15.156 → 192.168.1.12 SSH 454 Server: Encrypted packet (len=388)
   61 2.863997343 192.168.1.12 → 10.6.15.156  SSH 134 Client: Encrypted packet (len=68)
   62 2.864010896 192.168.1.12 → 10.6.15.156  TCP 66 54766 → 22 [ACK] Seq=5929 Ack=2913 Win=4866 Len=0 TSval=7675101 TSecr=14606595
   63 2.864013316 192.168.1.12 → 10.6.15.156  TCP 66 54766 → 22 [ACK] Seq=5929 Ack=3417 Win=4866 Len=0 TSval=7675101 TSecr=14606596
   64 2.864477237 192.168.1.12 → 10.6.15.156  SSH 1514 Client: Encrypted packet (len=1448)
   65 2.864493326 192.168.1.12 → 10.6.15.156  SSH 1226 Client: Encrypted packet (len=1160)
   66 2.866005246  10.6.15.156 → 192.168.1.12 TCP 66 22 → 54766 [ACK] Seq=3417 Ack=5929 Win=1452 Len=0 TSval=14606721 TSecr=7675100
   67 2.867217947  10.6.15.156 → 192.168.1.12 TCP 66 22 → 54766 [ACK] Seq=3417 Ack=8537 Win=1452 Len=0 TSval=14606721 TSecr=7675226
   68 2.973671128 192.168.1.12 → 10.6.15.156  SSH 102 Client: Encrypted packet (len=36)
   69 2.975325379  10.6.15.156 → 192.168.1.12 TCP 66 22 → 54766 [ACK] Seq=3417 Ack=8573 Win=1452 Len=0 TSval=14606748 TSecr=7675253
   70 2.978481804 192.168.1.12 → 10.6.15.156  SSH 102 Client: Encrypted packet (len=36)
   71 2.981645856  10.6.15.156 → 192.168.1.12 TCP 66 22 → 54766 [ACK] Seq=3417 Ack=8609 Win=1452 Len=0 TSval=14606750 TSecr=7675254
   72 3.082585369  10.6.15.156 → 192.168.1.12 SSH 454 Server: Encrypted packet (len=388)
   73 3.084243343  10.6.15.156 → 192.168.1.12 SSH 570 Server: Encrypted packet (len=504)
   74 3.086052756  10.6.15.156 → 192.168.1.12 SSH 454 Server: Encrypted packet (len=388)
   75 3.188121779  10.6.15.156 → 192.168.1.12 SSH 126 Server: Encrypted packet (len=60)
   76 3.188226790  10.6.15.156 → 192.168.1.12 SSH 138 Server: Encrypted packet (len=72)
   77 3.197543069  10.6.15.156 → 192.168.1.12 SSH 126 Server: Encrypted packet (len=60)
   78 3.197565869  10.6.15.156 → 192.168.1.12 SSH 138 Server: Encrypted packet (len=72)
   79 3.575983580 192.168.1.12 → 10.6.15.156  TCP 66 54766 → 22 [ACK] Seq=8609 Ack=4309 Win=4866 Len=0 TSval=7675281 TSecr=14606774
   80 3.575992228 192.168.1.12 → 10.6.15.156  SSH 134 Client: Encrypted packet (len=68)
   81 3.575995283 192.168.1.12 → 10.6.15.156  TCP 66 54766 → 22 [ACK] Seq=8677 Ack=4697 Win=4866 Len=0 TSval=7675292 TSecr=14606776
   82 3.575996861 192.168.1.12 → 10.6.15.156  TCP 66 54766 → 22 [ACK] Seq=8677 Ack=4757 Win=4866 Len=0 TSval=7675307 TSecr=14606801
   83 3.575998468 192.168.1.12 → 10.6.15.156  TCP 66 54766 → 22 [ACK] Seq=8677 Ack=4829 Win=4866 Len=0 TSval=7675307 TSecr=14606801
   84 3.576000225 192.168.1.12 → 10.6.15.156  TCP 66 54766 → 22 [ACK] Seq=8677 Ack=4961 Win=4866 Len=0 TSval=7675309 TSecr=14606804
   85 3.576554626 192.168.1.12 → 10.6.15.156  SSH 138 Client: Encrypted packet (len=72)
   86 3.577743917  10.6.15.156 → 192.168.1.12 TCP 66 22 → 54766 [ACK] Seq=4961 Ack=8677 Win=1452 Len=0 TSval=14606899 TSecr=7675281
   87 3.577763499  10.6.15.156 → 192.168.1.12 TCP 66 22 → 54766 [ACK] Seq=4961 Ack=8749 Win=1452 Len=0 TSval=14606899 TSecr=7675404
   88 5.048051705 192.168.1.12 → 10.6.15.156  SSH 102 Client: Encrypted packet (len=36)
   89 5.049581370  10.6.15.156 → 192.168.1.12 TCP 66 22 → 54766 [ACK] Seq=4961 Ack=8785 Win=1452 Len=0 TSval=14607267 TSecr=7675754
   90 5.203291191  10.6.15.156 → 192.168.1.12 SSH 102 Server: Encrypted packet (len=36)
   91 5.203315853 192.168.1.12 → 10.6.15.156  TCP 66 54766 → 22 [ACK] Seq=8785 Ack=4997 Win=4866 Len=0 TSval=7675810 TSecr=14607304
   92 5.203637797 192.168.1.12 → 10.6.15.156  SSH 158 Client: Encrypted packet (len=92)
   93 5.206223076  10.6.15.156 → 192.168.1.12 TCP 66 22 → 54766 [ACK] Seq=4997 Ack=8877 Win=1452 Len=0 TSval=14607305 TSecr=7675810
   94 5.355979684  10.6.15.156 → 192.168.1.12 SSH 246 Server: Encrypted packet (len=180)
   95 5.807978072 192.168.1.12 → 10.6.15.156  SSH 134 Client: Encrypted packet (len=68)
   96 5.808760623 192.168.1.12 → 10.6.15.156  SSH 1514 Client: Encrypted packet (len=1448)
   97 5.810195323 192.168.1.12 → 10.6.15.156  SSH 470 Client: Encrypted packet (len=404)
   98 5.810286969  10.6.15.156 → 192.168.1.12 TCP 66 22 → 54766 [ACK] Seq=5177 Ack=8945 Win=1452 Len=0 TSval=14607457 TSecr=7675849
   99 5.811063258  10.6.15.156 → 192.168.1.12 TCP 66 22 → 54766 [ACK] Seq=5177 Ack=10393 Win=1452 Len=0 TSval=14607457 TSecr=7675962
  100 5.812343765  10.6.15.156 → 192.168.1.12 TCP 66 22 → 54766 [ACK] Seq=5177 Ack=10797 Win=1452 Len=0 TSval=14607457 TSecr=7675962
  101 5.967256457  10.6.15.156 → 192.168.1.12 SSH 502 Server: Encrypted packet (len=436)
  102 6.007940091 192.168.1.12 → 10.6.15.156  TCP 66 54766 → 22 [ACK] Seq=10797 Ack=5613 Win=4866 Len=0 TSval=7676012 TSecr=14607496
  103 6.972075519 192.168.1.12 → 10.6.15.156  SSH 862 Client: Encrypted packet (len=796)
  104 6.977136431  10.6.15.156 → 192.168.1.12 TCP 66 22 → 54766 [ACK] Seq=5613 Ack=11593 Win=1452 Len=0 TSval=14607748 TSecr=7676253
  105 7.053796365 192.168.1.12 → 139.59.16.133 NTP 90 NTP Version 4, client
  106 7.195827951  10.6.15.156 → 192.168.1.12 SSH 454 Server: Encrypted packet (len=388)
  107 7.195849133 192.168.1.12 → 10.6.15.156  TCP 66 54766 → 22 [ACK] Seq=11593 Ack=6001 Win=4866 Len=0 TSval=7676308 TSecr=14607803
  108 7.975163601 192.168.1.12 → 10.6.15.156  SSH 862 Client: Encrypted packet (len=796)
  109 7.977140667  10.6.15.156 → 192.168.1.12 TCP 66 22 → 54766 [ACK] Seq=6001 Ack=12389 Win=1452 Len=0 TSval=14607998 TSecr=7676503
  110 8.196018544  10.6.15.156 → 192.168.1.12 SSH 454 Server: Encrypted packet (len=388)
  111 8.196042270 192.168.1.12 → 10.6.15.156  TCP 66 54766 → 22 [ACK] Seq=12389 Ack=6389 Win=4866 Len=0 TSval=7676559 TSecr=14608053
  112 8.982674559 192.168.1.12 → 10.6.15.156  SSH 862 Client: Encrypted packet (len=796)
  113 8.984669978  10.6.15.156 → 192.168.1.12 TCP 66 22 → 54766 [ACK] Seq=6389 Ack=13185 Win=1452 Len=0 TSval=14608250 TSecr=7676755
  114 9.203531272  10.6.15.156 → 192.168.1.12 SSH 454 Server: Encrypted packet (len=388)
  115 9.203557851 192.168.1.12 → 10.6.15.156  TCP 66 54766 → 22 [ACK] Seq=13185 Ack=6777 Win=4866 Len=0 TSval=7676810 TSecr=14608305
  116 9.671949169 192.168.1.12 → 23.58.43.27  TCP 66 47480 → 80 [ACK] Seq=1 Ack=1 Win=274 Len=0 TSval=7676928 TSecr=2209350507
  117 9.676986851  23.58.43.27 → 192.168.1.12 TCP 66 [TCP ACKed unseen segment] 80 → 47480 [ACK] Seq=1 Ack=2 Win=939 Len=0 TSval=2209395798 TSecr=7665606
  118 10.359238586 192.168.1.12 → 10.6.15.156  SSH 1514 Client: Encrypted packet (len=1448)
  119 10.361904130  10.6.15.156 → 192.168.1.12 TCP 66 22 → 54766 [ACK] Seq=6777 Ack=14633 Win=1452 Len=0 TSval=14608595 TSecr=7677099
  120 10.361924853 192.168.1.12 → 10.6.15.156  SSH 382 Client: Encrypted packet (len=316)
  121 10.363515419  10.6.15.156 → 192.168.1.12 TCP 66 22 → 54766 [ACK] Seq=6777 Ack=14949 Win=1452 Len=0 TSval=14608595 TSecr=7677100
  122 10.366556921  10.6.15.156 → 192.168.1.12 SSH 142 Server: Encrypted packet (len=76)
  123 10.366575883 192.168.1.12 → 10.6.15.156  TCP 66 54766 → 22 [ACK] Seq=14949 Ack=6853 Win=4866 Len=0 TSval=7677101 TSecr=14608596
  124 10.484173652  10.6.15.156 → 192.168.1.12 SSH 966 Server: Encrypted packet (len=900)
  125 10.484192749 192.168.1.12 → 10.6.15.156  TCP 66 54766 → 22 [ACK] Seq=14949 Ack=7753 Win=4866 Len=0 TSval=7677131 TSecr=14608625
  126 10.484634263  10.6.15.156 → 192.168.1.12 SSH 670 Server: Encrypted packet (len=604)
  127 10.484641724 192.168.1.12 → 10.6.15.156  TCP 66 54766 → 22 [ACK] Seq=14949 Ack=8357 Win=4866 Len=0 TSval=7677131 TSecr=14608625
  128 10.485080752 192.168.1.12 → 10.6.15.156  SSH 134 Client: Encrypted packet (len=68)
  129 10.525871146  10.6.15.156 → 192.168.1.12 TCP 66 22 → 54766 [ACK] Seq=8357 Ack=15017 Win=1452 Len=0 TSval=14608636 TSecr=7677131
  130 10.974400279 192.168.1.12 → 10.6.15.156  SSH 102 Client: Encrypted packet (len=36)
  131 10.974600497 192.168.1.12 → 10.6.15.156  SSH 102 Client: Encrypted packet (len=36)
  132 10.975302258 192.168.1.12 → 10.6.15.156  SSH 1514 Client: Encrypted packet (len=1448)
  133 10.977226202 192.168.1.12 → 10.6.15.156  SSH 1514 Client: Encrypted packet (len=1448)
  134 10.977805670 192.168.1.12 → 10.6.15.156  SSH 614 Client: Encrypted packet (len=548)
  135 10.977944416  10.6.15.156 → 192.168.1.12 TCP 66 22 → 54766 [ACK] Seq=8357 Ack=15053 Win=1452 Len=0 TSval=14608748 TSecr=7677253
  136 10.977958642  10.6.15.156 → 192.168.1.12 TCP 66 22 → 54766 [ACK] Seq=8357 Ack=15089 Win=1452 Len=0 TSval=14608748 TSecr=7677253
  137 10.978161831  10.6.15.156 → 192.168.1.12 TCP 66 22 → 54766 [ACK] Seq=8357 Ack=16537 Win=1452 Len=0 TSval=14608749 TSecr=7677253
  138 10.979344887  10.6.15.156 → 192.168.1.12 TCP 66 22 → 54766 [ACK] Seq=8357 Ack=17985 Win=1452 Len=0 TSval=14608749 TSecr=7677254
  139 10.979721921  10.6.15.156 → 192.168.1.12 TCP 66 22 → 54766 [ACK] Seq=8357 Ack=18533 Win=1452 Len=0 TSval=14608749 TSecr=7677254
  140 11.137499036  10.6.15.156 → 192.168.1.12 SSH 502 Server: Encrypted packet (len=436)
  141 11.143942096 192.168.1.12 → 23.58.43.27  TCP 66 47482 → 80 [ACK] Seq=1 Ack=1 Win=319 Len=0 TSval=7677296 TSecr=2209352250
  142 11.146619524  23.58.43.27 → 192.168.1.12 TCP 66 [TCP ACKed unseen segment] 80 → 47482 [ACK] Seq=1 Ack=2 Win=972 Len=0 TSval=2209397270 TSecr=7666041
  143 11.179956144 192.168.1.12 → 10.6.15.156  TCP 66 54766 → 22 [ACK] Seq=18533 Ack=8793 Win=4866 Len=0 TSval=7677305 TSecr=14608789
  144 11.194767783  10.6.15.156 → 192.168.1.12 SSH 138 Server: Encrypted packet (len=72)
  145 11.194788108 192.168.1.12 → 10.6.15.156  TCP 66 54766 → 22 [ACK] Seq=18533 Ack=8865 Win=4866 Len=0 TSval=7677308 TSecr=14608803
  146 11.194982152 192.168.1.12 → 10.6.15.156  SSH 102 Client: Encrypted packet (len=36)
  147 11.196586590  10.6.15.156 → 192.168.1.12 SSH 454 Server: Encrypted packet (len=388)
  148 11.196608089  10.6.15.156 → 192.168.1.12 SSH 138 Server: Encrypted packet (len=72)
  149 11.196673784 192.168.1.12 → 10.6.15.156  TCP 66 54766 → 22 [ACK] Seq=18569 Ack=9325 Win=4866 Len=0 TSval=7677309 TSecr=14608803
  150 11.196691787  10.6.15.156 → 192.168.1.12 TCP 66 22 → 54766 [ACK] Seq=9325 Ack=18569 Win=1452 Len=0 TSval=14608803 TSecr=7677308
  151 11.196858814 192.168.1.12 → 10.6.15.156  SSH 102 Client: Encrypted packet (len=36)
  152 11.198410166  10.6.15.156 → 192.168.1.12 SSH 454 Server: Encrypted packet (len=388)
  153 11.237440249  10.6.15.156 → 192.168.1.12 TCP 66 22 → 54766 [ACK] Seq=9713 Ack=18605 Win=1452 Len=0 TSval=14608814 TSecr=7677309
  154 11.239952169 192.168.1.12 → 10.6.15.156  TCP 66 54766 → 22 [ACK] Seq=18605 Ack=9713 Win=4866 Len=0 TSval=7677320 TSecr=14608804
  155 11.545675031  10.6.15.156 → 192.168.1.12 SSH 454 Server: [TCP Spurious Retransmission] , Encrypted packet (len=388)
  156 11.545694324 192.168.1.12 → 10.6.15.156  TCP 78 [TCP Dup ACK 154#1] 54766 → 22 [ACK] Seq=18605 Ack=9713 Win=4866 Len=0 TSval=7677396 TSecr=14608891 SLE=9325 SRE=9713
  157 12.981801034 192.168.1.12 → 10.6.15.156  SSH 862 Client: Encrypted packet (len=796)
  158 12.987414033  10.6.15.156 → 192.168.1.12 TCP 66 22 → 54766 [ACK] Seq=9713 Ack=19401 Win=1452 Len=0 TSval=14609251 TSecr=7677755
  159 13.205616252  10.6.15.156 → 192.168.1.12 SSH 454 Server: Encrypted packet (len=388)
  160 13.205643984 192.168.1.12 → 10.6.15.156  TCP 66 54766 → 22 [ACK] Seq=19401 Ack=10101 Win=4866 Len=0 TSval=7677811 TSecr=14609306
  161 13.972714531 192.168.1.12 → 10.6.15.156  SSH 102 Client: Encrypted packet (len=36)
  162 13.977139332  10.6.15.156 → 192.168.1.12 TCP 66 22 → 54766 [ACK] Seq=10101 Ack=19437 Win=1452 Len=0 TSval=14609498 TSecr=7678003
  163 13.977159960 192.168.1.12 → 10.6.15.156  SSH 862 Client: Encrypted packet (len=796)
  164 13.979250159  10.6.15.156 → 192.168.1.12 TCP 66 22 → 54766 [ACK] Seq=10101 Ack=20233 Win=1452 Len=0 TSval=14609499 TSecr=7678004
  165 14.192730190  10.6.15.156 → 192.168.1.12 SSH 126 Server: Encrypted packet (len=60)
  166 14.192746274 192.168.1.12 → 10.6.15.156  TCP 66 54766 → 22 [ACK] Seq=20233 Ack=10161 Win=4866 Len=0 TSval=7678058 TSecr=14609552
  167 14.192836827  10.6.15.156 → 192.168.1.12 SSH 138 Server: Encrypted packet (len=72)
  168 14.192839745 192.168.1.12 → 10.6.15.156  TCP 66 54766 → 22 [ACK] Seq=20233 Ack=10233 Win=4866 Len=0 TSval=7678058 TSecr=14609552
  169 14.192984037 192.168.1.12 → 10.6.15.156  SSH 102 Client: Encrypted packet (len=36)
  170 14.194427843  10.6.15.156 → 192.168.1.12 TCP 66 22 → 54766 [ACK] Seq=10233 Ack=20269 Win=1452 Len=0 TSval=14609553 TSecr=7678058
  171 14.198251369  10.6.15.156 → 192.168.1.12 SSH 454 Server: Encrypted packet (len=388)
  172 14.239954421 192.168.1.12 → 10.6.15.156  TCP 66 54766 → 22 [ACK] Seq=20269 Ack=10621 Win=4866 Len=0 TSval=7678070 TSecr=14609554
  173 14.973067806 192.168.1.12 → 10.6.15.156  SSH 862 Client: Encrypted packet (len=796)
  174 15.013460097  10.6.15.156 → 192.168.1.12 TCP 66 22 → 54766 [ACK] Seq=10621 Ack=21065 Win=1452 Len=0 TSval=14609758 TSecr=7678253
  175 15.013480161 192.168.1.12 → 10.6.15.156  SSH 198 Client: Encrypted packet (len=132)
  176 15.015076685  10.6.15.156 → 192.168.1.12 TCP 66 22 → 54766 [ACK] Seq=10621 Ack=21197 Win=1452 Len=0 TSval=14609758 TSecr=7678263
  177 15.028423652  10.6.15.156 → 192.168.1.12 SSH 150 Server: Encrypted packet (len=84)
  178 15.028442117 192.168.1.12 → 10.6.15.156  TCP 66 54766 → 22 [ACK] Seq=21197 Ack=10705 Win=4866 Len=0 TSval=7678267 TSecr=14609761
  179 15.150778501  10.6.15.156 → 192.168.1.12 SSH 1514 Server: Encrypted packet (len=1448)
  180 15.150795497 192.168.1.12 → 10.6.15.156  TCP 66 54766 → 22 [ACK] Seq=21197 Ack=12153 Win=4866 Len=0 TSval=7678297 TSecr=14609792
  181 15.151351680  10.6.15.156 → 192.168.1.12 SSH 1514 Server: Encrypted packet (len=1448)
  182 15.151358589 192.168.1.12 → 10.6.15.156  TCP 66 54766 → 22 [ACK] Seq=21197 Ack=13601 Win=4866 Len=0 TSval=7678297 TSecr=14609792
  183 15.151900104  10.6.15.156 → 192.168.1.12 SSH 1514 Server: Encrypted packet (len=1448)
  184 15.151909242 192.168.1.12 → 10.6.15.156  TCP 66 54766 → 22 [ACK] Seq=21197 Ack=15049 Win=4866 Len=0 TSval=7678298 TSecr=14609792
  185 15.152439387  10.6.15.156 → 192.168.1.12 SSH 1514 Server: Encrypted packet (len=1448)
  186 15.152444803 192.168.1.12 → 10.6.15.156  TCP 66 54766 → 22 [ACK] Seq=21197 Ack=16497 Win=4866 Len=0 TSval=7678298 TSecr=14609792
  187 15.152775633  10.6.15.156 → 192.168.1.12 SSH 110 Server: Encrypted packet (len=44)
  188 15.152782051 192.168.1.12 → 10.6.15.156  TCP 66 54766 → 22 [ACK] Seq=21197 Ack=16541 Win=4866 Len=0 TSval=7678298 TSecr=14609792
  189 15.153442272  10.6.15.156 → 192.168.1.12 SSH 1514 Server: Encrypted packet (len=1448)
  190 15.153448948 192.168.1.12 → 10.6.15.156  TCP 66 54766 → 22 [ACK] Seq=21197 Ack=17989 Win=4866 Len=0 TSval=7678298 TSecr=14609792
  191 15.154032272  10.6.15.156 → 192.168.1.12 SSH 1514 Server: Encrypted packet (len=1448)
  192 15.154038945 192.168.1.12 → 10.6.15.156  TCP 66 54766 → 22 [ACK] Seq=21197 Ack=19437 Win=4866 Len=0 TSval=7678298 TSecr=14609792
  193 15.154652620  10.6.15.156 → 192.168.1.12 SSH 1514 Server: Encrypted packet (len=1448)
  194 15.154659354 192.168.1.12 → 10.6.15.156  TCP 66 54766 → 22 [ACK] Seq=21197 Ack=20885 Win=4866 Len=0 TSval=7678298 TSecr=14609792
  195 15.155308250  10.6.15.156 → 192.168.1.12 SSH 1514 Server: Encrypted packet (len=1448)
  196 15.155312159 192.168.1.12 → 10.6.15.156  TCP 66 54766 → 22 [ACK] Seq=21197 Ack=22333 Win=4866 Len=0 TSval=7678298 TSecr=14609792
  197 15.155969531  10.6.15.156 → 192.168.1.12 SSH 1514 Server: Encrypted packet (len=1448)
  198 15.155973102 192.168.1.12 → 10.6.15.156  TCP 66 54766 → 22 [ACK] Seq=21197 Ack=23781 Win=4866 Len=0 TSval=7678299 TSecr=14609792
  199 15.156687864  10.6.15.156 → 192.168.1.12 SSH 1514 Server: Encrypted packet (len=1448)
  200 15.156691148 192.168.1.12 → 10.6.15.156  TCP 66 54766 → 22 [ACK] Seq=21197 Ack=25229 Win=4866 Len=0 TSval=7678299 TSecr=14609793
  201 15.157404827  10.6.15.156 → 192.168.1.12 SSH 1514 Server: Encrypted packet (len=1448)
  202 15.157407839 192.168.1.12 → 10.6.15.156  TCP 66 54766 → 22 [ACK] Seq=21197 Ack=26677 Win=4866 Len=0 TSval=7678299 TSecr=14609793
  203 15.158506315  10.6.15.156 → 192.168.1.12 SSH 1514 Server: Encrypted packet (len=1448)
  204 15.158509914 192.168.1.12 → 10.6.15.156  TCP 66 54766 → 22 [ACK] Seq=21197 Ack=28125 Win=4866 Len=0 TSval=7678299 TSecr=14609793
  205 15.158682353  10.6.15.156 → 192.168.1.12 SSH 1514 Server: Encrypted packet (len=1448)
  206 15.158685660 192.168.1.12 → 10.6.15.156  TCP 66 54766 → 22 [ACK] Seq=21197 Ack=29573 Win=4866 Len=0 TSval=7678299 TSecr=14609793
  207 15.158875429  10.6.15.156 → 192.168.1.12 SSH 1514 Server: Encrypted packet (len=1448)
  208 15.158878664 192.168.1.12 → 10.6.15.156  TCP 66 54766 → 22 [ACK] Seq=21197 Ack=31021 Win=4866 Len=0 TSval=7678299 TSecr=14609793
  209 15.159060977  10.6.15.156 → 192.168.1.12 SSH 1514 Server: Encrypted packet (len=1448)
  210 15.159253698  10.6.15.156 → 192.168.1.12 SSH 1514 Server: Encrypted packet (len=1448)
  211 15.159261734 192.168.1.12 → 10.6.15.156  TCP 66 54766 → 22 [ACK] Seq=21197 Ack=33917 Win=4866 Len=0 TSval=7678299 TSecr=14609793
  212 15.159445249  10.6.15.156 → 192.168.1.12 SSH 1514 Server: Encrypted packet (len=1448)
  213 15.159610032  10.6.15.156 → 192.168.1.12 SSH 1346 Server: Encrypted packet (len=1280)
  214 15.159617866 192.168.1.12 → 10.6.15.156  TCP 66 54766 → 22 [ACK] Seq=21197 Ack=36645 Win=4866 Len=0 TSval=7678299 TSecr=14609794
  215 15.159797214 192.168.1.12 → 10.6.15.156  SSH 102 Client: Encrypted packet (len=36)
  216 15.195961431  10.6.15.156 → 192.168.1.12 SSH 454 Server: Encrypted packet (len=388)
  217 15.239933867 192.168.1.12 → 10.6.15.156  TCP 66 54766 → 22 [ACK] Seq=21233 Ack=37033 Win=4866 Len=0 TSval=7678320 TSecr=14609803
  218 15.283663086 192.168.1.12 → 10.6.15.156  SSH 230 Client: Encrypted packet (len=164)
  219 15.295463840  10.6.15.156 → 192.168.1.12 SSH 150 Server: Encrypted packet (len=84)
  220 15.295491555 192.168.1.12 → 10.6.15.156  SSH 1106 Client: Encrypted packet (len=1040)
  221 15.296839803  10.6.15.156 → 192.168.1.12 SSH 1514 Server: Encrypted packet (len=1448)
  222 15.297030068  10.6.15.156 → 192.168.1.12 SSH 1514 Server: Encrypted packet (len=1448)
  223 15.297036252 192.168.1.12 → 10.6.15.156  TCP 66 54766 → 22 [ACK] Seq=22437 Ack=40013 Win=4866 Len=0 TSval=7678334 TSecr=14609828
  224 15.297458328  10.6.15.156 → 192.168.1.12 SSH 102 Server: Encrypted packet (len=36)
  225 15.300829298  10.6.15.156 → 192.168.1.12 SSH 1514 Server: Encrypted packet (len=1448)
  226 15.300845553 192.168.1.12 → 10.6.15.156  TCP 66 54766 → 22 [ACK] Seq=22437 Ack=41497 Win=4866 Len=0 TSval=7678335 TSecr=14609828
  227 15.301010675  10.6.15.156 → 192.168.1.12 SSH 1514 Server: Encrypted packet (len=1448)
  228 15.301202944  10.6.15.156 → 192.168.1.12 SSH 1514 Server: Encrypted packet (len=1448)
  229 15.301206326 192.168.1.12 → 10.6.15.156  TCP 66 54766 → 22 [ACK] Seq=22437 Ack=44393 Win=4866 Len=0 TSval=7678335 TSecr=14609829
  230 15.301395640  10.6.15.156 → 192.168.1.12 SSH 1514 Server: Encrypted packet (len=1448)
  231 15.302465966  10.6.15.156 → 192.168.1.12 SSH 1514 Server: Encrypted packet (len=1448)
  232 15.302474198 192.168.1.12 → 10.6.15.156  TCP 66 54766 → 22 [ACK] Seq=22437 Ack=47289 Win=4866 Len=0 TSval=7678335 TSecr=14609829
  233 15.302480501  10.6.15.156 → 192.168.1.12 SSH 1514 Server: Encrypted packet (len=1448)
  234 15.302482487  10.6.15.156 → 192.168.1.12 SSH 86 Server: Encrypted packet (len=20)
  235 15.302483819 192.168.1.12 → 10.6.15.156  TCP 66 54766 → 22 [ACK] Seq=22437 Ack=48757 Win=4866 Len=0 TSval=7678335 TSecr=14609829
  236 15.304335206  10.6.15.156 → 192.168.1.12 SSH 1514 Server: Encrypted packet (len=1448)
  237 15.304519485  10.6.15.156 → 192.168.1.12 SSH 1514 Server: Encrypted packet (len=1448)
  238 15.304529077 192.168.1.12 → 10.6.15.156  TCP 66 54766 → 22 [ACK] Seq=22437 Ack=51653 Win=4866 Len=0 TSval=7678336 TSecr=14609830
  239 15.304707069  10.6.15.156 → 192.168.1.12 SSH 1514 Server: Encrypted packet (len=1448)
  240 15.304895045  10.6.15.156 → 192.168.1.12 SSH 1502 Server: Encrypted packet (len=1436)
  241 15.304898652 192.168.1.12 → 10.6.15.156  TCP 66 54766 → 22 [ACK] Seq=22437 Ack=54537 Win=4866 Len=0 TSval=7678336 TSecr=14609830
  242 15.312877019  10.6.15.156 → 192.168.1.12 SSH 1514 Server: Encrypted packet (len=1448)
  243 15.313057864  10.6.15.156 → 192.168.1.12 SSH 1514 Server: Encrypted packet (len=1448)
  244 15.313065290 192.168.1.12 → 10.6.15.156  TCP 66 54766 → 22 [ACK] Seq=22437 Ack=57433 Win=4866 Len=0 TSval=7678338 TSecr=14609832
  245 15.313250676  10.6.15.156 → 192.168.1.12 SSH 1514 Server: Encrypted packet (len=1448)
  246 15.313442184  10.6.15.156 → 192.168.1.12 SSH 1514 Server: Encrypted packet (len=1448)
  247 15.313446252 192.168.1.12 → 10.6.15.156  TCP 66 54766 → 22 [ACK] Seq=22437 Ack=60329 Win=4866 Len=0 TSval=7678338 TSecr=14609832
  248 15.313452870  10.6.15.156 → 192.168.1.12 SSH 102 Server: Encrypted packet (len=36)
  249 15.314545117  10.6.15.156 → 192.168.1.12 SSH 1514 Server: Encrypted packet (len=1448)
  250 15.314558281 192.168.1.12 → 10.6.15.156  TCP 66 54766 → 22 [ACK] Seq=22437 Ack=61813 Win=4866 Len=0 TSval=7678338 TSecr=14609832
  251 15.314731740  10.6.15.156 → 192.168.1.12 SSH 1514 Server: Encrypted packet (len=1448)
  252 15.314921521  10.6.15.156 → 192.168.1.12 SSH 1514 Server: Encrypted packet (len=1448)
  253 15.314926169 192.168.1.12 → 10.6.15.156  TCP 66 54766 → 22 [ACK] Seq=22437 Ack=64709 Win=4866 Len=0 TSval=7678338 TSecr=14609833
  254 15.316095771  10.6.15.156 → 192.168.1.12 SSH 1514 Server: Encrypted packet (len=1448)
  255 15.316284096  10.6.15.156 → 192.168.1.12 SSH 1514 Server: Encrypted packet (len=1448)
  256 15.316289216 192.168.1.12 → 10.6.15.156  TCP 66 54766 → 22 [ACK] Seq=22437 Ack=67605 Win=4866 Len=0 TSval=7678339 TSecr=14609833
  257 15.316475717  10.6.15.156 → 192.168.1.12 SSH 1514 Server: Encrypted packet (len=1448)
  258 15.316667828  10.6.15.156 → 192.168.1.12 SSH 1514 Server: Encrypted packet (len=1448)
  259 15.316671114 192.168.1.12 → 10.6.15.156  TCP 66 54766 → 22 [ACK] Seq=22437 Ack=70501 Win=4866 Len=0 TSval=7678339 TSecr=14609833
  260 15.320153824  10.6.15.156 → 192.168.1.12 SSH 1514 Server: Encrypted packet (len=1448)
  261 15.320338712  10.6.15.156 → 192.168.1.12 SSH 1514 Server: Encrypted packet (len=1448)
  262 15.320344189 192.168.1.12 → 10.6.15.156  TCP 66 54766 → 22 [ACK] Seq=22437 Ack=73397 Win=4866 Len=0 TSval=7678340 TSecr=14609833
  263 15.320533468  10.6.15.156 → 192.168.1.12 SSH 1514 Server: Encrypted packet (len=1448)
  264 15.320725967  10.6.15.156 → 192.168.1.12 SSH 1514 Server: Encrypted packet (len=1448)
  265 15.320735601 192.168.1.12 → 10.6.15.156  TCP 66 54766 → 22 [ACK] Seq=22437 Ack=76293 Win=4866 Len=0 TSval=7678340 TSecr=14609833
  266 15.320916717  10.6.15.156 → 192.168.1.12 SSH 1514 Server: Encrypted packet (len=1448)
  267 15.321110381  10.6.15.156 → 192.168.1.12 SSH 1514 Server: Encrypted packet (len=1448)
  268 15.321120714 192.168.1.12 → 10.6.15.156  TCP 66 54766 → 22 [ACK] Seq=22437 Ack=79189 Win=4866 Len=0 TSval=7678340 TSecr=14609834
  269 15.321301955  10.6.15.156 → 192.168.1.12 SSH 1514 Server: Encrypted packet (len=1448)
  270 15.322065085  10.6.15.156 → 192.168.1.12 SSH 1514 Server: Encrypted packet (len=1448)
  271 15.322081663 192.168.1.12 → 10.6.15.156  TCP 66 54766 → 22 [ACK] Seq=22437 Ack=82085 Win=4866 Len=0 TSval=7678340 TSecr=14609834
  272 15.322252884  10.6.15.156 → 192.168.1.12 SSH 1514 Server: Encrypted packet (len=1448)
  273 15.326381445  10.6.15.156 → 192.168.1.12 SSH 1514 Server: Encrypted packet (len=1448)
  274 15.326397423 192.168.1.12 → 10.6.15.156  TCP 66 54766 → 22 [ACK] Seq=22437 Ack=84981 Win=4866 Len=0 TSval=7678341 TSecr=14609834
  275 15.326563873  10.6.15.156 → 192.168.1.12 SSH 1514 Server: Encrypted packet (len=1448)
  276 15.326755806  10.6.15.156 → 192.168.1.12 SSH 1514 Server: Encrypted packet (len=1448)
  277 15.326760376 192.168.1.12 → 10.6.15.156  TCP 66 54766 → 22 [ACK] Seq=22437 Ack=87877 Win=4866 Len=0 TSval=7678341 TSecr=14609835
  278 15.326949748  10.6.15.156 → 192.168.1.12 SSH 1514 Server: Encrypted packet (len=1448)
  279 15.327143323  10.6.15.156 → 192.168.1.12 SSH 1514 Server: Encrypted packet (len=1448)
  280 15.327150888 192.168.1.12 → 10.6.15.156  TCP 66 54766 → 22 [ACK] Seq=22437 Ack=90773 Win=4866 Len=0 TSval=7678341 TSecr=14609835
  281 15.327335706  10.6.15.156 → 192.168.1.12 SSH 1514 Server: Encrypted packet (len=1448)
  282 15.327527741  10.6.15.156 → 192.168.1.12 SSH 1514 Server: Encrypted packet (len=1448)
  283 15.327535559 192.168.1.12 → 10.6.15.156  TCP 66 54766 → 22 [ACK] Seq=22437 Ack=93669 Win=4866 Len=0 TSval=7678341 TSecr=14609835
  284 15.327724852  10.6.15.156 → 192.168.1.12 SSH 1514 Server: Encrypted packet (len=1448)
  285 15.330513437  10.6.15.156 → 192.168.1.12 SSH 1514 Server: Encrypted packet (len=1448)
  286 15.330538851 192.168.1.12 → 10.6.15.156  TCP 66 54766 → 22 [ACK] Seq=22437 Ack=96565 Win=4866 Len=0 TSval=7678342 TSecr=14609835
  287 15.330697577  10.6.15.156 → 192.168.1.12 SSH 1514 Server: Encrypted packet (len=1448)
  288 15.331274955  10.6.15.156 → 192.168.1.12 SSH 1514 Server: Encrypted packet (len=1448)
  289 15.331289027 192.168.1.12 → 10.6.15.156  TCP 66 54766 → 22 [ACK] Seq=22437 Ack=99461 Win=4866 Len=0 TSval=7678342 TSecr=14609836
  290 15.331464242  10.6.15.156 → 192.168.1.12 SSH 1514 Server: Encrypted packet (len=1448)
  291 15.331522755  10.6.15.156 → 192.168.1.12 SSH 646 Server: Encrypted packet (len=580)
  292 15.331528535 192.168.1.12 → 10.6.15.156  TCP 66 54766 → 22 [ACK] Seq=22437 Ack=101489 Win=4866 Len=0 TSval=7678342 TSecr=14609836
  293 15.445210726 192.168.1.12 → 10.6.15.156  SSH 678 Client: Encrypted packet (len=612)
  294 15.485187479  10.6.15.156 → 192.168.1.12 SSH 582 Server: Encrypted packet (len=516)
  295 15.485211646 192.168.1.12 → 10.6.15.156  SSH 258 Client: Encrypted packet (len=192)
  296 15.525400054  10.6.15.156 → 192.168.1.12 TCP 66 22 → 54766 [ACK] Seq=102005 Ack=23241 Win=1452 Len=0 TSval=14609886 TSecr=7678381
  297 15.525414360 192.168.1.12 → 10.6.15.156  SSH 298 Client: Encrypted packet (len=232)
  298 15.525774081 192.168.1.12 → 10.6.15.156  SSH 134 Client: Encrypted packet (len=68)
  299 15.527223159  10.6.15.156 → 192.168.1.12 TCP 66 22 → 54766 [ACK] Seq=102005 Ack=23541 Win=1452 Len=0 TSval=14609886 TSecr=7678391
  300 15.527900053 192.168.1.12 → 10.6.15.156  SSH 182 Client: Encrypted packet (len=116)
  301 15.529892289  10.6.15.156 → 192.168.1.12 TCP 66 22 → 54766 [ACK] Seq=102005 Ack=23657 Win=1452 Len=0 TSval=14609887 TSecr=7678391
  302 15.562230407 192.168.1.12 → 10.6.15.156  SSH 222 Client: Encrypted packet (len=156)
  303 15.564083653  10.6.15.156 → 192.168.1.12 TCP 66 22 → 54766 [ACK] Seq=102005 Ack=23813 Win=1452 Len=0 TSval=14609895 TSecr=7678400
  304 15.569690554  10.6.15.156 → 192.168.1.12 SSH 334 Server: Encrypted packet (len=268)
  305 15.605377520  10.6.15.156 → 192.168.1.12 SSH 150 Server: Encrypted packet (len=84)
  306 15.605393982 192.168.1.12 → 10.6.15.156  TCP 66 54766 → 22 [ACK] Seq=23813 Ack=102357 Win=4866 Len=0 TSval=7678411 TSecr=14609897
  307 15.607836067  10.6.15.156 → 192.168.1.12 SSH 1514 Server: Encrypted packet (len=1448)
  308 15.608312720  10.6.15.156 → 192.168.1.12 SSH 1222 Server: Encrypted packet (len=1156)
  309 15.608320386 192.168.1.12 → 10.6.15.156  TCP 66 54766 → 22 [ACK] Seq=23813 Ack=104961 Win=4866 Len=0 TSval=7678412 TSecr=14609906
  310 15.648879847  10.6.15.156 → 192.168.1.12 SSH 1514 Server: Encrypted packet (len=1448)
  311 15.649062009  10.6.15.156 → 192.168.1.12 SSH 1514 Server: Encrypted packet (len=1448)
  312 15.649071082 192.168.1.12 → 10.6.15.156  TCP 66 54766 → 22 [ACK] Seq=23813 Ack=107857 Win=4866 Len=0 TSval=7678422 TSecr=14609916
  313 15.649572093  10.6.15.156 → 192.168.1.12 SSH 710 Server: Encrypted packet (len=644)
  314 15.651020052  10.6.15.156 → 192.168.1.12 SSH 1514 Server: Encrypted packet (len=1448)
  315 15.651035614 192.168.1.12 → 10.6.15.156  TCP 66 54766 → 22 [ACK] Seq=23813 Ack=109949 Win=4866 Len=0 TSval=7678422 TSecr=14609916
  316 15.652027748  10.6.15.156 → 192.168.1.12 SSH 1514 Server: Encrypted packet (len=1448)
  317 15.652213672  10.6.15.156 → 192.168.1.12 SSH 1514 Server: Encrypted packet (len=1448)
  318 15.652220812 192.168.1.12 → 10.6.15.156  TCP 66 54766 → 22 [ACK] Seq=23813 Ack=112845 Win=4866 Len=0 TSval=7678423 TSecr=14609917
  319 15.652406537  10.6.15.156 → 192.168.1.12 SSH 1514 Server: Encrypted packet (len=1448)
  320 15.652538870  10.6.15.156 → 192.168.1.12 SSH 1118 Server: Encrypted packet (len=1052)
  321 15.652544409 192.168.1.12 → 10.6.15.156  TCP 66 54766 → 22 [ACK] Seq=23813 Ack=115345 Win=4866 Len=0 TSval=7678423 TSecr=14609917
  322 15.652976237  10.6.15.156 → 192.168.1.12 SSH 150 Server: Encrypted packet (len=84)
  323 15.662156760  10.6.15.156 → 192.168.1.12 SSH 1514 Server: Encrypted packet (len=1448)
  324 15.662172309 192.168.1.12 → 10.6.15.156  TCP 66 54766 → 22 [ACK] Seq=23813 Ack=116877 Win=4866 Len=0 TSval=7678425 TSecr=14609917
  325 15.662341450  10.6.15.156 → 192.168.1.12 SSH 1514 Server: Encrypted packet (len=1448)
  326 15.662531717  10.6.15.156 → 192.168.1.12 SSH 1514 Server: Encrypted packet (len=1448)
  327 15.662537783 192.168.1.12 → 10.6.15.156  TCP 66 54766 → 22 [ACK] Seq=23813 Ack=119773 Win=4866 Len=0 TSval=7678425 TSecr=14609919
  328 15.662725323  10.6.15.156 → 192.168.1.12 SSH 1514 Server: Encrypted packet (len=1448)
  329 15.662732365  10.6.15.156 → 192.168.1.12 SSH 158 Server: Encrypted packet (len=92)
  330 15.662738320 192.168.1.12 → 10.6.15.156  TCP 66 54766 → 22 [ACK] Seq=23813 Ack=121313 Win=4866 Len=0 TSval=7678425 TSecr=14609919
  331 15.666526136  10.6.15.156 → 192.168.1.12 SSH 1514 Server: Encrypted packet (len=1448)
  332 15.666703423  10.6.15.156 → 192.168.1.12 SSH 1514 Server: Encrypted packet (len=1448)
  333 15.666710836 192.168.1.12 → 10.6.15.156  TCP 66 54766 → 22 [ACK] Seq=23813 Ack=124209 Win=4866 Len=0 TSval=7678426 TSecr=14609920
  334 15.666896441  10.6.15.156 → 192.168.1.12 SSH 1514 Server: Encrypted packet (len=1448)
  335 15.667531794  10.6.15.156 → 192.168.1.12 SSH 1514 Server: Encrypted packet (len=1448)
  336 15.667541798 192.168.1.12 → 10.6.15.156  TCP 66 54766 → 22 [ACK] Seq=23813 Ack=127105 Win=4866 Len=0 TSval=7678426 TSecr=14609920
  337 15.667553449  10.6.15.156 → 192.168.1.12 SSH 158 Server: Encrypted packet (len=92)
  338 15.707917068 192.168.1.12 → 10.6.15.156  TCP 66 54766 → 22 [ACK] Seq=23813 Ack=127197 Win=4866 Len=0 TSval=7678437 TSecr=14609920
  339 15.777677366  10.6.15.156 → 192.168.1.12 SSH 1514 Server: Encrypted packet (len=1448)
  340 15.780427222  10.6.15.156 → 192.168.1.12 SSH 1514 Server: Encrypted packet (len=1448)
  341 15.780437014 192.168.1.12 → 10.6.15.156  TCP 66 54766 → 22 [ACK] Seq=23813 Ack=130093 Win=4866 Len=0 TSval=7678455 TSecr=14609948
  342 15.780449697  10.6.15.156 → 192.168.1.12 SSH 134 Server: Encrypted packet (len=68)
  343 15.780494416 192.168.1.12 → 10.6.15.156  TCP 66 54766 → 22 [ACK] Seq=23813 Ack=130161 Win=4866 Len=0 TSval=7678455 TSecr=14609949
  344 15.786600445  10.6.15.156 → 192.168.1.12 SSH 1514 Server: Encrypted packet (len=1448)
  345 15.786786015  10.6.15.156 → 192.168.1.12 SSH 1514 Server: Encrypted packet (len=1448)
  346 15.786792343 192.168.1.12 → 10.6.15.156  TCP 66 54766 → 22 [ACK] Seq=23813 Ack=133057 Win=4866 Len=0 TSval=7678456 TSecr=14609951
  347 15.786978605  10.6.15.156 → 192.168.1.12 SSH 1514 Server: Encrypted packet (len=1448)
  348 15.786993137  10.6.15.156 → 192.168.1.12 SSH 142 Server: Encrypted packet (len=76)
  349 15.786996196 192.168.1.12 → 10.6.15.156  TCP 66 54766 → 22 [ACK] Seq=23813 Ack=134581 Win=4866 Len=0 TSval=7678456 TSecr=14609951
  350 15.788299084  10.6.15.156 → 192.168.1.12 SSH 1514 Server: Encrypted packet (len=1448)
  351 15.788485550  10.6.15.156 → 192.168.1.12 SSH 1514 Server: Encrypted packet (len=1448)
  352 15.788496448 192.168.1.12 → 10.6.15.156  TCP 66 54766 → 22 [ACK] Seq=23813 Ack=137477 Win=4866 Len=0 TSval=7678457 TSecr=14609951
  353 15.788676259  10.6.15.156 → 192.168.1.12 SSH 1514 Server: Encrypted packet (len=1448)
  354 15.788867663  10.6.15.156 → 192.168.1.12 SSH 1514 Server: Encrypted packet (len=1448)
  355 15.788873858 192.168.1.12 → 10.6.15.156  TCP 66 54766 → 22 [ACK] Seq=23813 Ack=140373 Win=4866 Len=0 TSval=7678457 TSecr=14609951
  356 15.789059262  10.6.15.156 → 192.168.1.12 SSH 1514 Server: Encrypted packet (len=1448)
  357 15.790137633  10.6.15.156 → 192.168.1.12 SSH 1514 Server: Encrypted packet (len=1448)
  358 15.790152034 192.168.1.12 → 10.6.15.156  TCP 66 54766 → 22 [ACK] Seq=23813 Ack=143269 Win=4866 Len=0 TSval=7678457 TSecr=14609951
  359 15.790322057  10.6.15.156 → 192.168.1.12 SSH 1514 Server: Encrypted packet (len=1448)
  360 15.790514216  10.6.15.156 → 192.168.1.12 SSH 1514 Server: Encrypted packet (len=1448)
  361 15.790519342 192.168.1.12 → 10.6.15.156  TCP 66 54766 → 22 [ACK] Seq=23813 Ack=146165 Win=4866 Len=0 TSval=7678457 TSecr=14609951
  362 15.790707301  10.6.15.156 → 192.168.1.12 SSH 1514 Server: Encrypted packet (len=1448)
  363 15.791168728  10.6.15.156 → 192.168.1.12 SSH 258 Server: Encrypted packet (len=192)
  364 15.791174286 192.168.1.12 → 10.6.15.156  TCP 66 54766 → 22 [ACK] Seq=23813 Ack=147805 Win=4866 Len=0 TSval=7678457 TSecr=14609951
  365 15.806539814 192.168.1.12 → 10.6.15.156  SSH 302 Client: Encrypted packet (len=236)
  366 15.845468282  10.6.15.156 → 192.168.1.12 TCP 66 22 → 54766 [ACK] Seq=147805 Ack=24049 Win=1452 Len=0 TSval=14609966 TSecr=7678461
  367 15.845997785 192.168.1.12 → 10.6.15.156  SSH 206 Client: Encrypted packet (len=140)
  368 15.848562510 192.168.1.12 → 10.6.15.156  SSH 134 Client: Encrypted packet (len=68)
