    1 0.000000000 192.168.1.16 → 123.108.200.124 NTP 90 NTP Version 4, client
    2 0.001947582  10.6.15.145 → 192.168.1.16 SSH 110 Server: Encrypted packet (len=44)
    3 0.002403574 192.168.1.16 → 10.6.15.145  SSH 622 Client: Encrypted packet (len=556)
    4 0.002590808  10.6.15.145 → 192.168.1.16 SSH 102 Server: Encrypted packet (len=36)
    5 0.003883357  10.6.15.145 → 192.168.1.16 TCP 102 [TCP Retransmission] 22 → 52104 [PSH, ACK] Seq=45 Ack=1 Win=1452 Len=36 TSval=24414713 TSecr=1599991
    6 0.003905159 192.168.1.16 → 10.6.15.145  TCP 78 52104 → 22 [ACK] Seq=557 Ack=81 Win=6157 Len=0 TSval=1600435 TSecr=24414713 SLE=45 SRE=81
    7 0.004401508  10.6.15.145 → 192.168.1.16 TCP 66 22 → 52104 [ACK] Seq=81 Ack=557 Win=1452 Len=0 TSval=24414962 TSecr=1600434
    8 0.227965412 192.168.1.16 → 10.6.15.145  SSH 138 Client: Encrypted packet (len=72)
    9 0.229263770 192.168.1.16 → 10.6.15.145  SSH 138 Client: Encrypted packet (len=72)
   10 0.230235935  10.6.15.145 → 192.168.1.16 TCP 66 22 → 52104 [ACK] Seq=81 Ack=629 Win=1452 Len=0 TSval=24415018 TSecr=1600491
   11 0.230249867 192.168.1.16 → 10.6.15.145  SSH 118 Client: Encrypted packet (len=52)
   12 0.230266614  10.6.15.145 → 192.168.1.16 SSH 102 Server: Encrypted packet (len=36)
   13 0.230273548 192.168.1.16 → 10.6.15.145  TCP 66 52104 → 22 [ACK] Seq=753 Ack=117 Win=6157 Len=0 TSval=1600491 TSecr=24415018
   14 0.231117068  10.6.15.145 → 192.168.1.16 SSH 102 Server: Encrypted packet (len=36)
   15 0.231138003 192.168.1.16 → 10.6.15.145  TCP 66 52104 → 22 [ACK] Seq=753 Ack=153 Win=6157 Len=0 TSval=1600491 TSecr=24415018
   16 0.267803076  10.6.15.145 → 192.168.1.16 TCP 66 22 → 52104 [ACK] Seq=153 Ack=753 Win=1452 Len=0 TSval=24415028 TSecr=1600491
   17 0.320115029  10.6.15.145 → 192.168.1.16 SSH 486 Server: Encrypted packet (len=420)
   18 0.320131976 192.168.1.16 → 10.6.15.145  TCP 66 52104 → 22 [ACK] Seq=753 Ack=573 Win=6157 Len=0 TSval=1600514 TSecr=24415041
   19 0.322126310 192.168.1.16 → 10.6.15.145  SSH 146 Client: Encrypted packet (len=80)
   20 0.325136669  10.6.15.145 → 192.168.1.16 TCP 66 22 → 52104 [ACK] Seq=573 Ack=833 Win=1452 Len=0 TSval=24415042 TSecr=1600514
   21 0.447462681 192.168.1.16 → 10.6.15.145  SSH 102 Client: Encrypted packet (len=36)
   22 0.451003895  10.6.15.145 → 192.168.1.16 TCP 66 22 → 52104 [ACK] Seq=573 Ack=869 Win=1452 Len=0 TSval=24415073 TSecr=1600542
   23 0.535116357  10.6.15.145 → 192.168.1.16 SSH 102 Server: Encrypted packet (len=36)
   24 0.535478306 192.168.1.16 → 10.6.15.145  SSH 470 Client: Encrypted packet (len=404)
   25 0.536861405  10.6.15.145 → 192.168.1.16 SSH 102 Server: Encrypted packet (len=36)
   26 0.536882861  10.6.15.145 → 192.168.1.16 TCP 66 22 → 52104 [ACK] Seq=645 Ack=1273 Win=1452 Len=0 TSval=24415095 TSecr=1600568
   27 0.537205672 192.168.1.16 → 10.6.15.145  SSH 158 Client: Encrypted packet (len=92)
   28 0.538447178  10.6.15.145 → 192.168.1.16 TCP 66 22 → 52104 [ACK] Seq=645 Ack=1365 Win=1452 Len=0 TSval=24415095 TSecr=1600568
   29 0.540103873  10.6.15.145 → 192.168.1.16 SSH 238 Server: Encrypted packet (len=172)
   30 0.540508619 192.168.1.16 → 10.6.15.145  SSH 302 Client: Encrypted packet (len=236)
   31 0.541602091  10.6.15.145 → 192.168.1.16 SSH 166 Server: Encrypted packet (len=100)
   32 0.542115239 192.168.1.16 → 10.6.15.145  SSH 302 Client: Encrypted packet (len=236)
   33 0.543606728  10.6.15.145 → 192.168.1.16 TCP 66 22 → 52104 [ACK] Seq=917 Ack=1837 Win=1452 Len=0 TSval=24415096 TSecr=1600569
   34 0.573500973  10.6.15.145 → 192.168.1.16 SSH 102 Server: Encrypted packet (len=36)
   35 0.573516571  10.6.15.145 → 192.168.1.16 SSH 102 Server: Encrypted packet (len=36)
   36 0.573598867 192.168.1.16 → 10.6.15.145  TCP 66 52104 → 22 [ACK] Seq=1837 Ack=989 Win=6157 Len=0 TSval=1600577 TSecr=24415103
   37 0.573871374 192.168.1.16 → 10.6.15.145  SSH 166 Client: Encrypted packet (len=100)
   38 0.574096369 192.168.1.16 → 10.6.15.145  SSH 150 Client: Encrypted packet (len=84)
   39 0.576536274  10.6.15.145 → 192.168.1.16 TCP 66 22 → 52104 [ACK] Seq=989 Ack=2021 Win=1452 Len=0 TSval=24415104 TSecr=1600577
   40 0.613038444  10.6.15.145 → 192.168.1.16 SSH 1514 Server: Encrypted packet (len=1448)
   41 0.613135739  10.6.15.145 → 192.168.1.16 SSH 1246 Server: Encrypted packet (len=1180)
   42 0.613146805 192.168.1.16 → 10.6.15.145  TCP 66 52104 → 22 [ACK] Seq=2021 Ack=3617 Win=6157 Len=0 TSval=1600587 TSecr=24415114
   43 0.613537245  10.6.15.145 → 192.168.1.16 SSH 174 Server: Encrypted packet (len=108)
   44 0.614645757  10.6.15.145 → 192.168.1.16 SSH 118 Server: Encrypted packet (len=52)
   45 0.614706606 192.168.1.16 → 10.6.15.145  TCP 66 52104 → 22 [ACK] Seq=2021 Ack=3777 Win=6157 Len=0 TSval=1600587 TSecr=24415114
   46 0.615916637  10.6.15.145 → 192.168.1.16 SSH 694 Server: Encrypted packet (len=628)
   47 0.615967143  10.6.15.145 → 192.168.1.16 SSH 446 Server: Encrypted packet (len=380)
   48 0.615988714 192.168.1.16 → 10.6.15.145  TCP 66 52104 → 22 [ACK] Seq=2021 Ack=4785 Win=6157 Len=0 TSval=1600588 TSecr=24415115
   49 0.617379744 192.168.1.16 → 10.6.15.145  SSH 206 Client: Encrypted packet (len=140)
   50 0.619063310 192.168.1.16 → 10.6.15.145  SSH 206 Client: Encrypted packet (len=140)
   51 0.620349299  10.6.15.145 → 192.168.1.16 TCP 66 22 → 52104 [ACK] Seq=4785 Ack=2301 Win=1452 Len=0 TSval=24415116 TSecr=1600588
   52 0.637304566 192.168.1.16 → 10.6.15.145  SSH 102 Client: Encrypted packet (len=36)
   53 0.637900636 192.168.1.16 → 10.6.15.145  SSH 238 Client: Encrypted packet (len=172)
   54 0.638596800 192.168.1.16 → 10.6.15.145  SSH 1294 Client: Encrypted packet (len=1228)
   55 0.639230792  10.6.15.145 → 192.168.1.16 TCP 66 22 → 52104 [ACK] Seq=4785 Ack=2509 Win=1452 Len=0 TSval=24415120 TSecr=1600593
   56 0.655861642  10.6.15.145 → 192.168.1.16 SSH 462 Server: Encrypted packet (len=396)
   57 0.656854304 192.168.1.16 → 10.6.15.145  SSH 134 Client: Encrypted packet (len=68)
   58 0.656940825  10.6.15.145 → 192.168.1.16 SSH 430 Server: Encrypted packet (len=364)
   59 0.675360848  10.6.15.145 → 192.168.1.16 SSH 138 Server: Encrypted packet (len=72)
   60 0.675437509 192.168.1.16 → 10.6.15.145  TCP 66 52104 → 22 [ACK] Seq=3805 Ack=5617 Win=6157 Len=0 TSval=1600603 TSecr=24415125
   61 0.675559921 192.168.1.16 → 10.6.15.145  SSH 102 Client: Encrypted packet (len=36)
   62 0.675986976  10.6.15.145 → 192.168.1.16 SSH 134 Server: Encrypted packet (len=68)
   63 0.683710435  10.6.15.145 → 192.168.1.16 SSH 662 Server: Encrypted packet (len=596)
   64 0.683778149 192.168.1.16 → 10.6.15.145  TCP 66 52104 → 22 [ACK] Seq=3841 Ack=6281 Win=6157 Len=0 TSval=1600605 TSecr=24415129
   65 0.686111972 192.168.1.16 → 10.6.15.145  SSH 146 Client: Encrypted packet (len=80)
   66 0.723673546  10.6.15.145 → 192.168.1.16 TCP 66 22 → 52104 [ACK] Seq=6281 Ack=3921 Win=1452 Len=0 TSval=24415142 TSecr=1600605
   67 0.903796951 192.168.1.16 → 10.6.15.145  SSH 102 Client: Encrypted packet (len=36)
   68 0.904770022 192.168.1.16 → 10.6.15.145  SSH 230 Client: Encrypted packet (len=164)
   69 0.906602792  10.6.15.145 → 192.168.1.16 TCP 66 22 → 52104 [ACK] Seq=6281 Ack=3957 Win=1452 Len=0 TSval=24415187 TSecr=1600660
   70 0.906623200  10.6.15.145 → 192.168.1.16 TCP 66 22 → 52104 [ACK] Seq=6281 Ack=4121 Win=1452 Len=0 TSval=24415187 TSecr=1600660
   71 0.908014577  10.6.15.145 → 192.168.1.16 SSH 198 Server: Encrypted packet (len=132)
   72 0.908913485  10.6.15.145 → 192.168.1.16 SSH 102 Server: Encrypted packet (len=36)
   73 0.908971828 192.168.1.16 → 10.6.15.145  TCP 66 52104 → 22 [ACK] Seq=4121 Ack=6449 Win=6157 Len=0 TSval=1600661 TSecr=24415188
   74 0.911578898  10.6.15.145 → 192.168.1.16 SSH 102 Server: Encrypted packet (len=36)
   75 0.911598372  10.6.15.145 → 192.168.1.16 SSH 166 Server: Encrypted packet (len=100)
   76 0.911621865  10.6.15.145 → 192.168.1.16 SSH 138 Server: Encrypted packet (len=72)
   77 0.911639458 192.168.1.16 → 10.6.15.145  TCP 66 52104 → 22 [ACK] Seq=4121 Ack=6657 Win=6157 Len=0 TSval=1600662 TSecr=24415188
   78 0.911807116 192.168.1.16 → 10.6.15.145  SSH 102 Client: Encrypted packet (len=36)
   79 0.916120393 192.168.1.16 → 10.6.15.145  SSH 126 Client: Encrypted packet (len=60)
   80 0.916841962 192.168.1.16 → 10.6.15.145  SSH 258 Client: Encrypted packet (len=192)
   81 0.943413007 192.168.1.16 → 10.6.15.145  TCP 258 [TCP Retransmission] 52104 → 22 [PSH, ACK] Seq=4217 Ack=6657 Win=6157 Len=192 TSval=1600670 TSecr=24415188
   82 0.970909326  10.6.15.145 → 192.168.1.16 TCP 78 [TCP Dup ACK 70#1] 22 → 52104 [ACK] Seq=6657 Ack=4121 Win=1452 Len=0 TSval=24415203 TSecr=1600661 SLE=4157 SRE=4217
   83 0.970925591  10.6.15.145 → 192.168.1.16 TCP 78 [TCP Dup ACK 70#2] 22 → 52104 [ACK] Seq=6657 Ack=4121 Win=1452 Len=0 TSval=24415203 TSecr=1600661 SLE=4157 SRE=4409
   84 0.971281541  10.6.15.145 → 192.168.1.16 TCP 86 [TCP Dup ACK 70#3] 22 → 52104 [ACK] Seq=6657 Ack=4121 Win=1452 Len=0 TSval=24415203 TSecr=1600661 SLE=4217 SRE=4409 SLE=4157 SRE=4409
   85 1.159408984 192.168.1.16 → 10.6.15.145  TCP 102 [TCP Retransmission] 52104 → 22 [PSH, ACK] Seq=4121 Ack=6657 Win=6157 Len=36 TSval=1600724 TSecr=24415203
   86 1.162268100  10.6.15.145 → 192.168.1.16 TCP 66 22 → 52104 [ACK] Seq=6657 Ack=4409 Win=1450 Len=0 TSval=24415251 TSecr=1600724
   87 1.251325471  10.6.15.145 → 192.168.1.16 SSH 174 Server: Encrypted packet (len=108)
   88 1.251342541  10.6.15.145 → 192.168.1.16 SSH 118 Server: Encrypted packet (len=52)
   89 1.251415124 192.168.1.16 → 10.6.15.145  TCP 66 52104 → 22 [ACK] Seq=4409 Ack=6817 Win=6157 Len=0 TSval=1600747 TSecr=24415273
   90 1.252588539  10.6.15.145 → 192.168.1.16 SSH 446 Server: Encrypted packet (len=380)
   91 1.253587906 192.168.1.16 → 10.6.15.145  SSH 206 Client: Encrypted packet (len=140)
   92 1.254903944  10.6.15.145 → 192.168.1.16 TCP 66 22 → 52104 [ACK] Seq=7197 Ack=4549 Win=1452 Len=0 TSval=24415274 TSecr=1600747
   93 1.256637883 192.168.1.16 → 10.6.15.145  SSH 222 Client: Encrypted packet (len=156)
   94 1.256864040 192.168.1.16 → 10.6.15.145  SSH 1302 Client: Encrypted packet (len=1236)
   95 1.258037787  10.6.15.145 → 192.168.1.16 TCP 66 22 → 52104 [ACK] Seq=7197 Ack=4705 Win=1452 Len=0 TSval=24415275 TSecr=1600748
   96 1.258697687  10.6.15.145 → 192.168.1.16 TCP 66 22 → 52104 [ACK] Seq=7197 Ack=5941 Win=1452 Len=0 TSval=24415275 TSecr=1600748
   97 1.343824018  10.6.15.145 → 192.168.1.16 SSH 430 Server: Encrypted packet (len=364)
   98 1.344172406 192.168.1.16 → 10.6.15.145  SSH 126 Client: Encrypted packet (len=60)
   99 1.345492310  10.6.15.145 → 192.168.1.16 TCP 66 22 → 52104 [ACK] Seq=7561 Ack=6001 Win=1452 Len=0 TSval=24415297 TSecr=1600770
  100 1.345879002  10.6.15.145 → 192.168.1.16 SSH 134 Server: Encrypted packet (len=68)
  101 1.387439063 192.168.1.16 → 10.6.15.145  TCP 66 52104 → 22 [ACK] Seq=6001 Ack=7629 Win=6157 Len=0 TSval=1600781 TSecr=24415297
  102 1.464526392  10.6.15.145 → 192.168.1.16 SSH 158 Server: Encrypted packet (len=92)
  103 1.464554238 192.168.1.16 → 10.6.15.145  TCP 66 52104 → 22 [ACK] Seq=6001 Ack=7721 Win=6157 Len=0 TSval=1600800 TSecr=24415327
  104 1.464570976  10.6.15.145 → 192.168.1.16 SSH 118 Server: Encrypted packet (len=52)
  105 1.464576725 192.168.1.16 → 10.6.15.145  TCP 66 52104 → 22 [ACK] Seq=6001 Ack=7773 Win=6157 Len=0 TSval=1600800 TSecr=24415327
  106 1.464973335  10.6.15.145 → 192.168.1.16 SSH 462 Server: Encrypted packet (len=396)
  107 1.464980075 192.168.1.16 → 10.6.15.145  TCP 66 52104 → 22 [ACK] Seq=6001 Ack=8169 Win=6157 Len=0 TSval=1600800 TSecr=24415327
  108 1.466443860 192.168.1.16 → 10.6.15.145  SSH 206 Client: Encrypted packet (len=140)
  109 1.479046981  10.6.15.145 → 192.168.1.16 SSH 1514 Server: Encrypted packet (len=1448)
  110 1.479169209  10.6.15.145 → 192.168.1.16 SSH 1166 Server: Encrypted packet (len=1100)
  111 1.479175924 192.168.1.16 → 10.6.15.145  TCP 66 52104 → 22 [ACK] Seq=6141 Ack=10717 Win=6157 Len=0 TSval=1600803 TSecr=24415330
  112 1.479873097  10.6.15.145 → 192.168.1.16 SSH 1102 Server: Encrypted packet (len=1036)
  113 1.495903978 192.168.1.16 → 10.6.15.145  SSH 110 Client: Encrypted packet (len=44)
  114 1.496112083 192.168.1.16 → 10.6.15.145  SSH 102 Client: Encrypted packet (len=36)
  115 1.499773772  10.6.15.145 → 192.168.1.16 TCP 66 22 → 52104 [ACK] Seq=11753 Ack=6221 Win=1452 Len=0 TSval=24415336 TSecr=1600808
  116 1.513367519  10.6.15.145 → 192.168.1.16 SSH 1514 Server: Encrypted packet (len=1448)
  117 1.513388956  10.6.15.145 → 192.168.1.16 SSH 110 Server: Encrypted packet (len=44)
  118 1.513399080 192.168.1.16 → 10.6.15.145  TCP 66 52104 → 22 [ACK] Seq=6221 Ack=13245 Win=6157 Len=0 TSval=1600812 TSecr=24415339
  119 1.513997384  10.6.15.145 → 192.168.1.16 SSH 1514 Server: Encrypted packet (len=1448)
  120 1.515348018  10.6.15.145 → 192.168.1.16 SSH 1514 Server: Encrypted packet (len=1448)
  121 1.515366529 192.168.1.16 → 10.6.15.145  TCP 66 52104 → 22 [ACK] Seq=6221 Ack=16141 Win=6157 Len=0 TSval=1600812 TSecr=24415339
  122 1.515534109  10.6.15.145 → 192.168.1.16 SSH 1514 Server: Encrypted packet (len=1448)
  123 1.517333958  10.6.15.145 → 192.168.1.16 SSH 1514 Server: Encrypted packet (len=1448)
  124 1.517350809 192.168.1.16 → 10.6.15.145  TCP 66 52104 → 22 [ACK] Seq=6221 Ack=19037 Win=6157 Len=0 TSval=1600813 TSecr=24415339
  125 1.517514283  10.6.15.145 → 192.168.1.16 SSH 1514 Server: Encrypted packet (len=1448)
  126 1.519243096  10.6.15.145 → 192.168.1.16 SSH 1226 Server: Encrypted packet (len=1160)
  127 1.519263731 192.168.1.16 → 10.6.15.145  TCP 66 52104 → 22 [ACK] Seq=6221 Ack=21645 Win=6157 Len=0 TSval=1600813 TSecr=24415340
  128 1.523590576  10.6.15.145 → 192.168.1.16 SSH 110 Server: Encrypted packet (len=44)
  129 1.523940198 192.168.1.16 → 10.6.15.145  SSH 166 Client: Encrypted packet (len=100)
  130 1.544006327 192.168.1.16 → 10.6.15.145  SSH 102 Client: Encrypted packet (len=36)
  131 1.544334453 192.168.1.16 → 10.6.15.145  SSH 222 Client: Encrypted packet (len=156)
  132 1.544550952 192.168.1.16 → 10.6.15.145  SSH 258 Client: Encrypted packet (len=192)
  133 1.554837833  10.6.15.145 → 192.168.1.16 SSH 430 Server: Encrypted packet (len=364)
  134 1.566961806  10.6.15.145 → 192.168.1.16 SSH 1514 Server: Encrypted packet (len=1448)
  135 1.566977628 192.168.1.16 → 10.6.15.145  TCP 66 52104 → 22 [ACK] Seq=6705 Ack=23501 Win=6157 Len=0 TSval=1600825 TSecr=24415349
  136 1.571220234  10.6.15.145 → 192.168.1.16 SSH 1514 Server: Encrypted packet (len=1436)
  137 1.571247204 192.168.1.16 → 10.6.15.145  SSH 146 Client: Encrypted packet (len=80)
  138 1.571262446  10.6.15.145 → 192.168.1.16 TCP 78 [TCP Dup ACK 115#1] 22 → 52104 [ACK] Seq=24937 Ack=6221 Win=1452 Len=0 TSval=24415353 TSecr=1600813 SLE=6321 SRE=6513
  139 1.571662170  10.6.15.145 → 192.168.1.16 TCP 78 [TCP Dup ACK 115#2] 22 → 52104 [ACK] Seq=24937 Ack=6221 Win=1452 Len=0 TSval=24415353 TSecr=1600813 SLE=6321 SRE=6705
  140 1.571670241 192.168.1.16 → 10.6.15.145  SSH 166 Client: [TCP Fast Retransmission] , Encrypted packet (len=100)
  141 1.571892130  10.6.15.145 → 192.168.1.16 SSH 1514 Server: Encrypted packet (len=1436)
  142 1.571901004  10.6.15.145 → 192.168.1.16 SSH 102 Server: Encrypted packet (len=24)
  143 1.571905215 192.168.1.16 → 10.6.15.145  TCP 66 52104 → 22 [ACK] Seq=6785 Ack=26397 Win=6157 Len=0 TSval=1600827 TSecr=24415353
  144 1.573486390  10.6.15.145 → 192.168.1.16 SSH 1514 Server: Encrypted packet (len=1436)
  145 1.573811307  10.6.15.145 → 192.168.1.16 TCP 66 22 → 52104 [ACK] Seq=27833 Ack=6785 Win=1448 Len=0 TSval=24415354 TSecr=1600827
  146 1.573845966  10.6.15.145 → 192.168.1.16 SSH 210 Server: Encrypted packet (len=144)
  147 1.573850444 192.168.1.16 → 10.6.15.145  TCP 66 52104 → 22 [ACK] Seq=6785 Ack=27977 Win=6157 Len=0 TSval=1600827 TSecr=24415354
  148 1.599767488 192.168.1.16 → 10.6.15.145  SSH 102 Client: Encrypted packet (len=36)
  149 1.600338986 192.168.1.16 → 10.6.15.145  SSH 102 Client: Encrypted packet (len=36)
  150 1.627407481 192.168.1.16 → 10.6.15.145  TCP 102 [TCP Retransmission] 52104 → 22 [PSH, ACK] Seq=6821 Ack=27977 Win=6157 Len=36 TSval=1600841 TSecr=24415354
  151 1.639642844  10.6.15.145 → 192.168.1.16 TCP 66 22 → 52104 [ACK] Seq=27977 Ack=6857 Win=1452 Len=0 TSval=24415371 TSecr=1600834
  152 3.066352685  10.6.15.145 → 192.168.1.16 SSH 370 Server: Encrypted packet (len=304)
  153 3.066564918  10.6.15.145 → 192.168.1.16 SSH 1514 Server: Encrypted packet (len=1448)
  154 3.066577010 192.168.1.16 → 10.6.15.145  TCP 66 52104 → 22 [ACK] Seq=6857 Ack=29729 Win=6157 Len=0 TSval=1601200 TSecr=24415716
  155 3.066672854 192.168.1.16 → 10.6.15.145  SSH 102 Client: Encrypted packet (len=36)
  156 3.066752793  10.6.15.145 → 192.168.1.16 SSH 1514 Server: Encrypted packet (len=1448)
  157 3.066949359  10.6.15.145 → 192.168.1.16 SSH 1514 Server: Encrypted packet (len=1448)
  158 3.066954277 192.168.1.16 → 10.6.15.145  TCP 66 52104 → 22 [ACK] Seq=6893 Ack=32625 Win=6157 Len=0 TSval=1601200 TSecr=24415716
  159 3.067303940 192.168.1.16 → 10.6.15.145  SSH 742 Client: Encrypted packet (len=676)
  160 3.091112773  10.6.15.145 → 192.168.1.16 SSH 1514 Server: Encrypted packet (len=1448)
  161 3.091132560  10.6.15.145 → 192.168.1.16 TCP 66 22 → 52104 [ACK] Seq=34073 Ack=6893 Win=1452 Len=0 TSval=24415733 TSecr=1601200
  162 3.091440395  10.6.15.145 → 192.168.1.16 SSH 1514 Server: Encrypted packet (len=1448)
  163 3.091452023 192.168.1.16 → 10.6.15.145  TCP 66 52104 → 22 [ACK] Seq=7569 Ack=35521 Win=6157 Len=0 TSval=1601207 TSecr=24415733
  164 3.091646520  10.6.15.145 → 192.168.1.16 SSH 1514 Server: Encrypted packet (len=1448)
  165 3.096286956  10.6.15.145 → 192.168.1.16 SSH 1514 Server: Encrypted packet (len=1448)
  166 3.096308828 192.168.1.16 → 10.6.15.145  TCP 66 52104 → 22 [ACK] Seq=7569 Ack=38417 Win=6157 Len=0 TSval=1601208 TSecr=24415733
  167 3.096464423  10.6.15.145 → 192.168.1.16 SSH 1514 Server: Encrypted packet (len=1448)
  168 3.105688625  10.6.15.145 → 192.168.1.16 SSH 1514 Server: Encrypted packet (len=1448)
  169 3.105704440 192.168.1.16 → 10.6.15.145  TCP 66 52104 → 22 [ACK] Seq=7569 Ack=41313 Win=6157 Len=0 TSval=1601210 TSecr=24415735
  170 3.105869944  10.6.15.145 → 192.168.1.16 SSH 1514 Server: Encrypted packet (len=1448)
  171 3.118424888  10.6.15.145 → 192.168.1.16 SSH 1514 Server: Encrypted packet (len=1448)
  172 3.118444823 192.168.1.16 → 10.6.15.145  TCP 66 52104 → 22 [ACK] Seq=7569 Ack=44209 Win=6157 Len=0 TSval=1601213 TSecr=24415737
  173 3.121331801  10.6.15.145 → 192.168.1.16 SSH 1514 Server: Encrypted packet (len=1448)
  174 3.121515163  10.6.15.145 → 192.168.1.16 SSH 1514 Server: Encrypted packet (len=1448)
  175 3.121522849 192.168.1.16 → 10.6.15.145  TCP 66 52104 → 22 [ACK] Seq=7569 Ack=47105 Win=6157 Len=0 TSval=1601214 TSecr=24415741
  176 3.121709403  10.6.15.145 → 192.168.1.16 SSH 1514 Server: Encrypted packet (len=1448)
  177 3.121902445  10.6.15.145 → 192.168.1.16 SSH 1514 Server: Encrypted packet (len=1448)
  178 3.121910202 192.168.1.16 → 10.6.15.145  TCP 66 52104 → 22 [ACK] Seq=7569 Ack=50001 Win=6157 Len=0 TSval=1601214 TSecr=24415741
  179 3.122094188  10.6.15.145 → 192.168.1.16 SSH 1514 Server: Encrypted packet (len=1448)
  180 3.124536521  10.6.15.145 → 192.168.1.16 SSH 1514 Server: Encrypted packet (len=1448)
  181 3.124556687 192.168.1.16 → 10.6.15.145  TCP 66 52104 → 22 [ACK] Seq=7569 Ack=52897 Win=6157 Len=0 TSval=1601215 TSecr=24415741
  182 3.124716625  10.6.15.145 → 192.168.1.16 SSH 1514 Server: Encrypted packet (len=1448)
  183 3.124906763  10.6.15.145 → 192.168.1.16 SSH 1514 Server: Encrypted packet (len=1448)
  184 3.124912230 192.168.1.16 → 10.6.15.145  TCP 66 52104 → 22 [ACK] Seq=7569 Ack=55793 Win=6157 Len=0 TSval=1601215 TSecr=24415741
  185 3.125098610  10.6.15.145 → 192.168.1.16 SSH 1514 Server: Encrypted packet (len=1448)
  186 3.129538452  10.6.15.145 → 192.168.1.16 SSH 1514 Server: Encrypted packet (len=1448)
  187 3.129554245 192.168.1.16 → 10.6.15.145  TCP 66 52104 → 22 [ACK] Seq=7569 Ack=58689 Win=6157 Len=0 TSval=1601216 TSecr=24415742
  188 3.129717821  10.6.15.145 → 192.168.1.16 SSH 1514 Server: Encrypted packet (len=1448)
  189 3.129910408  10.6.15.145 → 192.168.1.16 SSH 1514 Server: Encrypted packet (len=1448)
  190 3.129913386 192.168.1.16 → 10.6.15.145  TCP 66 52104 → 22 [ACK] Seq=7569 Ack=61585 Win=6157 Len=0 TSval=1601216 TSecr=24415742
  191 3.130102855  10.6.15.145 → 192.168.1.16 SSH 1514 Server: Encrypted packet (len=1448)
  192 3.134328779 192.168.1.16 → 10.6.15.145  SSH 102 Client: Encrypted packet (len=36)
  193 3.135713289 192.168.1.16 → 10.6.15.145  SSH 102 Client: Encrypted packet (len=36)
  194 3.156216552  10.6.15.145 → 192.168.1.16 SSH 1514 Server: Encrypted packet (len=1448)
  195 3.179406602 192.168.1.16 → 10.6.15.145  SSH 174 Client: Encrypted packet (len=108)
  196 3.191161325  10.6.15.145 → 192.168.1.16 SSH 1514 Server: Encrypted packet (len=1448)
  197 3.191344712  10.6.15.145 → 192.168.1.16 SSH 1514 Server: Encrypted packet (len=1448)
  198 3.191356939 192.168.1.16 → 10.6.15.145  TCP 66 52104 → 22 [ACK] Seq=7749 Ack=67377 Win=6157 Len=0 TSval=1601231 TSecr=24415758
  199 3.195153799  10.6.15.145 → 192.168.1.16 SSH 1514 Server: Encrypted packet (len=1448)
  200 3.195340844  10.6.15.145 → 192.168.1.16 SSH 1514 Server: Encrypted packet (len=1448)
  201 3.195354268 192.168.1.16 → 10.6.15.145  TCP 66 52104 → 22 [ACK] Seq=7749 Ack=70273 Win=6157 Len=0 TSval=1601232 TSecr=24415758
  202 3.195534611  10.6.15.145 → 192.168.1.16 SSH 1514 Server: Encrypted packet (len=1448)
  203 3.195725677  10.6.15.145 → 192.168.1.16 SSH 1514 Server: Encrypted packet (len=1448)
  204 3.195732891 192.168.1.16 → 10.6.15.145  TCP 66 52104 → 22 [ACK] Seq=7749 Ack=73169 Win=6157 Len=0 TSval=1601233 TSecr=24415758
  205 3.195918244  10.6.15.145 → 192.168.1.16 SSH 1514 Server: Encrypted packet (len=1448)
  206 3.198999041  10.6.15.145 → 192.168.1.16 SSH 1514 Server: Encrypted packet (len=1448)
  207 3.199015919 192.168.1.16 → 10.6.15.145  TCP 66 52104 → 22 [ACK] Seq=7749 Ack=76065 Win=6157 Len=0 TSval=1601233 TSecr=24415759
  208 3.199179511  10.6.15.145 → 192.168.1.16 SSH 1514 Server: Encrypted packet (len=1448)
  209 3.199378545  10.6.15.145 → 192.168.1.16 SSH 1514 Server: Encrypted packet (len=1448)
  210 3.199383717 192.168.1.16 → 10.6.15.145  TCP 66 52104 → 22 [ACK] Seq=7749 Ack=78961 Win=6157 Len=0 TSval=1601233 TSecr=24415760
  211 3.199563902  10.6.15.145 → 192.168.1.16 SSH 1514 Server: Encrypted packet (len=1448)
  212 3.201591004  10.6.15.145 → 192.168.1.16 SSH 1514 Server: Encrypted packet (len=1448)
  213 3.201608096 192.168.1.16 → 10.6.15.145  TCP 66 52104 → 22 [ACK] Seq=7749 Ack=81857 Win=6157 Len=0 TSval=1601234 TSecr=24415760
  214 3.201774908  10.6.15.145 → 192.168.1.16 SSH 1514 Server: Encrypted packet (len=1448)
  215 3.202121009  10.6.15.145 → 192.168.1.16 SSH 1514 Server: Encrypted packet (len=1448)
  216 3.202129761 192.168.1.16 → 10.6.15.145  TCP 66 52104 → 22 [ACK] Seq=7749 Ack=84753 Win=6157 Len=0 TSval=1601234 TSecr=24415761
  217 3.202313817  10.6.15.145 → 192.168.1.16 SSH 1514 Server: Encrypted packet (len=1448)
  218 3.204476897  10.6.15.145 → 192.168.1.16 SSH 1514 Server: Encrypted packet (len=1448)
  219 3.204497203 192.168.1.16 → 10.6.15.145  TCP 66 52104 → 22 [ACK] Seq=7749 Ack=87649 Win=6157 Len=0 TSval=1601235 TSecr=24415761
  220 3.205003303  10.6.15.145 → 192.168.1.16 SSH 1514 Server: Encrypted packet (len=1448)
  221 3.205324148  10.6.15.145 → 192.168.1.16 SSH 1514 Server: Encrypted packet (len=1448)
  222 3.205338039 192.168.1.16 → 10.6.15.145  TCP 66 52104 → 22 [ACK] Seq=7749 Ack=90545 Win=6157 Len=0 TSval=1601235 TSecr=24415762
  223 3.205513093  10.6.15.145 → 192.168.1.16 SSH 1514 Server: Encrypted packet (len=1448)
  224 3.208153980  10.6.15.145 → 192.168.1.16 SSH 1514 Server: Encrypted packet (len=1448)
  225 3.208175701 192.168.1.16 → 10.6.15.145  TCP 66 52104 → 22 [ACK] Seq=7749 Ack=93441 Win=6157 Len=0 TSval=1601236 TSecr=24415762
  226 3.208333708  10.6.15.145 → 192.168.1.16 SSH 1514 Server: Encrypted packet (len=1448)
  227 3.208525957  10.6.15.145 → 192.168.1.16 SSH 1514 Server: Encrypted packet (len=1448)
  228 3.208533361 192.168.1.16 → 10.6.15.145  TCP 66 52104 → 22 [ACK] Seq=7749 Ack=96337 Win=6157 Len=0 TSval=1601236 TSecr=24415762
  229 3.208718060  10.6.15.145 → 192.168.1.16 SSH 1514 Server: Encrypted packet (len=1448)
  230 3.211317945  10.6.15.145 → 192.168.1.16 SSH 1514 Server: Encrypted packet (len=1448)
  231 3.211336379 192.168.1.16 → 10.6.15.145  TCP 66 52104 → 22 [ACK] Seq=7749 Ack=99233 Win=6157 Len=0 TSval=1601236 TSecr=24415762
  232 3.211503318  10.6.15.145 → 192.168.1.16 SSH 1514 Server: Encrypted packet (len=1448)
  233 3.211692682  10.6.15.145 → 192.168.1.16 SSH 1514 Server: Encrypted packet (len=1448)
  234 3.211699855 192.168.1.16 → 10.6.15.145  TCP 66 52104 → 22 [ACK] Seq=7749 Ack=102129 Win=6157 Len=0 TSval=1601237 TSecr=24415763
  235 3.211884925  10.6.15.145 → 192.168.1.16 SSH 1514 Server: Encrypted packet (len=1448)
  236 3.216474809  10.6.15.145 → 192.168.1.16 SSH 1514 Server: Encrypted packet (len=1448)
  237 3.216492546 192.168.1.16 → 10.6.15.145  TCP 66 52104 → 22 [ACK] Seq=7749 Ack=105025 Win=6157 Len=0 TSval=1601238 TSecr=24415763
  238 3.216661956  10.6.15.145 → 192.168.1.16 SSH 1514 Server: Encrypted packet (len=1448)
  239 3.216854763  10.6.15.145 → 192.168.1.16 SSH 1514 Server: Encrypted packet (len=1448)
  240 3.216861892 192.168.1.16 → 10.6.15.145  TCP 66 52104 → 22 [ACK] Seq=7749 Ack=107921 Win=6157 Len=0 TSval=1601238 TSecr=24415764
  241 3.217046139  10.6.15.145 → 192.168.1.16 SSH 1514 Server: Encrypted packet (len=1448)
  242 3.219374460  10.6.15.145 → 192.168.1.16 SSH 1514 Server: Encrypted packet (len=1448)
  243 3.219383211 192.168.1.16 → 10.6.15.145  TCP 66 52104 → 22 [ACK] Seq=7749 Ack=110817 Win=6157 Len=0 TSval=1601238 TSecr=24415764
  244 3.219567265  10.6.15.145 → 192.168.1.16 SSH 1514 Server: Encrypted packet (len=1448)
  245 3.219587843 192.168.1.16 → 10.6.15.145  SSH 102 Client: Encrypted packet (len=36)
  246 3.219758610  10.6.15.145 → 192.168.1.16 SSH 1514 Server: Encrypted packet (len=1448)
  247 3.219949770  10.6.15.145 → 192.168.1.16 SSH 1514 Server: Encrypted packet (len=1448)
  248 3.219956016 192.168.1.16 → 10.6.15.145  TCP 66 52104 → 22 [ACK] Seq=7785 Ack=115161 Win=6157 Len=0 TSval=1601239 TSecr=24415765
  249 3.222386891  10.6.15.145 → 192.168.1.16 SSH 1514 Server: Encrypted packet (len=1448)
  250 3.222574733  10.6.15.145 → 192.168.1.16 SSH 1514 Server: Encrypted packet (len=1448)
  251 3.222583493 192.168.1.16 → 10.6.15.145  TCP 66 52104 → 22 [ACK] Seq=7785 Ack=118057 Win=6157 Len=0 TSval=1601239 TSecr=24415766
  252 3.222921268  10.6.15.145 → 192.168.1.16 SSH 1514 Server: Encrypted packet (len=1448)
  253 3.223112065  10.6.15.145 → 192.168.1.16 SSH 1514 Server: Encrypted packet (len=1448)
  254 3.223127646 192.168.1.16 → 10.6.15.145  TCP 66 52104 → 22 [ACK] Seq=7785 Ack=120953 Win=6157 Len=0 TSval=1601239 TSecr=24415766
  255 3.223304602  10.6.15.145 → 192.168.1.16 SSH 1514 Server: Encrypted packet (len=1448)
  256 3.223648241  10.6.15.145 → 192.168.1.16 SSH 1514 Server: Encrypted packet (len=1448)
  257 3.223655970 192.168.1.16 → 10.6.15.145  TCP 66 52104 → 22 [ACK] Seq=7785 Ack=123849 Win=6157 Len=0 TSval=1601240 TSecr=24415766
  258 3.226261263  10.6.15.145 → 192.168.1.16 SSH 1514 Server: Encrypted packet (len=1448)
  259 3.226445671  10.6.15.145 → 192.168.1.16 SSH 1514 Server: Encrypted packet (len=1448)
  260 3.226455003 192.168.1.16 → 10.6.15.145  TCP 66 52104 → 22 [ACK] Seq=7785 Ack=126745 Win=6157 Len=0 TSval=1601240 TSecr=24415767
  261 3.226635826  10.6.15.145 → 192.168.1.16 SSH 1514 Server: Encrypted packet (len=1448)
  262 3.226828683  10.6.15.145 → 192.168.1.16 SSH 1514 Server: Encrypted packet (len=1448)
  263 3.226834604 192.168.1.16 → 10.6.15.145  TCP 66 52104 → 22 [ACK] Seq=7785 Ack=129641 Win=6157 Len=0 TSval=1601240 TSecr=24415767
  264 3.227020557  10.6.15.145 → 192.168.1.16 SSH 1514 Server: Encrypted packet (len=1448)
  265 3.227213974  10.6.15.145 → 192.168.1.16 SSH 1514 Server: Encrypted packet (len=1448)
  266 3.227219832 192.168.1.16 → 10.6.15.145  TCP 66 52104 → 22 [ACK] Seq=7785 Ack=132537 Win=6157 Len=0 TSval=1601240 TSecr=24415767
  267 3.236717688  10.6.15.145 → 192.168.1.16 SSH 1514 Server: Encrypted packet (len=1448)
  268 3.236878303  10.6.15.145 → 192.168.1.16 SSH 1514 Server: Encrypted packet (len=1448)
  269 3.236886285 192.168.1.16 → 10.6.15.145  TCP 66 52104 → 22 [ACK] Seq=7785 Ack=135433 Win=6157 Len=0 TSval=1601243 TSecr=24415768
  270 3.237048261 192.168.1.16 → 10.6.15.145  SSH 102 Client: Encrypted packet (len=36)
  271 3.237060770  10.6.15.145 → 192.168.1.16 SSH 1514 Server: Encrypted packet (len=1448)
  272 3.237252199  10.6.15.145 → 192.168.1.16 SSH 1514 Server: Encrypted packet (len=1448)
  273 3.237257317 192.168.1.16 → 10.6.15.145  TCP 66 52104 → 22 [ACK] Seq=7821 Ack=138329 Win=6157 Len=0 TSval=1601243 TSecr=24415768
  274 3.237445019  10.6.15.145 → 192.168.1.16 SSH 1514 Server: Encrypted packet (len=1448)
  275 3.237638174  10.6.15.145 → 192.168.1.16 SSH 1514 Server: Encrypted packet (len=1448)
  276 3.237643967 192.168.1.16 → 10.6.15.145  TCP 66 52104 → 22 [ACK] Seq=7821 Ack=141225 Win=6157 Len=0 TSval=1601243 TSecr=24415768
  277 3.238485786 192.168.1.16 → 10.6.15.145  SSH 206 Client: Encrypted packet (len=140)
  278 3.240145865  10.6.15.145 → 192.168.1.16 SSH 1514 Server: Encrypted packet (len=1448)
  279 3.240331295  10.6.15.145 → 192.168.1.16 SSH 1514 Server: Encrypted packet (len=1448)
  280 3.240337314 192.168.1.16 → 10.6.15.145  TCP 66 52104 → 22 [ACK] Seq=7961 Ack=144121 Win=6157 Len=0 TSval=1601244 TSecr=24415770
  281 3.240523505  10.6.15.145 → 192.168.1.16 SSH 1514 Server: Encrypted packet (len=1448)
  282 3.240530695 192.168.1.16 → 10.6.15.145  SSH 206 Client: Encrypted packet (len=140)
  283 3.240714443  10.6.15.145 → 192.168.1.16 SSH 1514 Server: Encrypted packet (len=1448)
  284 3.240908388  10.6.15.145 → 192.168.1.16 SSH 1514 Server: Encrypted packet (len=1448)
  285 3.240913698 192.168.1.16 → 10.6.15.145  TCP 66 52104 → 22 [ACK] Seq=8101 Ack=148465 Win=6157 Len=0 TSval=1601244 TSecr=24415770
  286 3.240941519  10.6.15.145 → 192.168.1.16 SSH 446 Server: Encrypted packet (len=380)
  287 3.241343838 192.168.1.16 → 10.6.15.145  SSH 102 Client: Encrypted packet (len=36)
  288 3.244190068  10.6.15.145 → 192.168.1.16 TCP 66 22 → 52104 [ACK] Seq=148845 Ack=8101 Win=1452 Len=0 TSval=24415772 TSecr=1601243
  289 3.244205326 192.168.1.16 → 10.6.15.145  SSH 346 Client: Encrypted packet (len=280)
  290 3.245719001 192.168.1.16 → 10.6.15.145  SSH 206 Client: Encrypted packet (len=140)
  291 3.246717818  10.6.15.145 → 192.168.1.16 TCP 66 22 → 52104 [ACK] Seq=148845 Ack=8417 Win=1452 Len=0 TSval=24415772 TSecr=1601244
  292 3.247711649 192.168.1.16 → 10.6.15.145  SSH 206 Client: Encrypted packet (len=140)
  293 3.249087626  10.6.15.145 → 192.168.1.16 TCP 66 22 → 52104 [ACK] Seq=148845 Ack=8697 Win=1452 Len=0 TSval=24415773 TSecr=1601245
  294 3.250438674 192.168.1.16 → 10.6.15.145  SSH 206 Client: Encrypted packet (len=140)
  295 3.250652730 192.168.1.16 → 10.6.15.145  SSH 258 Client: Encrypted packet (len=192)
  296 3.251837203  10.6.15.145 → 192.168.1.16 TCP 66 22 → 52104 [ACK] Seq=148845 Ack=9029 Win=1452 Len=0 TSval=24415774 TSecr=1601246
  297 3.257661484 192.168.1.16 → 10.6.15.145  SSH 150 Client: Encrypted packet (len=84)
  298 3.257858777 192.168.1.16 → 10.6.15.145  SSH 242 Client: Encrypted packet (len=176)
  299 3.258538175 192.168.1.16 → 10.6.15.145  SSH 230 Client: Encrypted packet (len=164)
  300 3.259254164  10.6.15.145 → 192.168.1.16 SSH 158 Server: Encrypted packet (len=92)
  301 3.259264235  10.6.15.145 → 192.168.1.16 SSH 118 Server: Encrypted packet (len=52)
  302 3.259337677 192.168.1.16 → 10.6.15.145  TCP 66 52104 → 22 [ACK] Seq=9453 Ack=148989 Win=6157 Len=0 TSval=1601248 TSecr=24415775
  303 3.259415320  10.6.15.145 → 192.168.1.16 TCP 66 22 → 52104 [ACK] Seq=148989 Ack=9289 Win=1452 Len=0 TSval=24415775 TSecr=1601248
  304 3.259425077 192.168.1.16 → 10.6.15.145  SSH 102 Client: Encrypted packet (len=36)
  305 3.259651489  10.6.15.145 → 192.168.1.16 SSH 750 Server: Encrypted packet (len=684)
  306 3.259968582 192.168.1.16 → 10.6.15.145  SSH 222 Client: Encrypted packet (len=156)
  307 3.261024067  10.6.15.145 → 192.168.1.16 TCP 66 22 → 52104 [ACK] Seq=149673 Ack=9489 Win=1452 Len=0 TSval=24415776 TSecr=1601248
  308 3.261039673 192.168.1.16 → 10.6.15.145  SSH 206 Client: Encrypted packet (len=140)
  309 3.261816205 192.168.1.16 → 10.6.15.145  SSH 334 Client: Encrypted packet (len=268)
  310 3.262360657  10.6.15.145 → 192.168.1.16 TCP 66 22 → 52104 [ACK] Seq=149673 Ack=9785 Win=1452 Len=0 TSval=24415776 TSecr=1601249
  311 3.262370843 192.168.1.16 → 10.6.15.145  SSH 1514 Client: Encrypted packet (len=1448)
  312 3.262377339 192.168.1.16 → 10.6.15.145  SSH 1282 Client: Encrypted packet (len=1216)
  313 3.264288320  10.6.15.145 → 192.168.1.16 TCP 66 22 → 52104 [ACK] Seq=149673 Ack=11501 Win=1452 Len=0 TSval=24415777 TSecr=1601249
  314 3.264309488 192.168.1.16 → 10.6.15.145  SSH 1514 Client: Encrypted packet (len=1448)
  315 3.264322527 192.168.1.16 → 10.6.15.145  SSH 1202 Client: Encrypted packet (len=1136)
  316 3.270988776  10.6.15.145 → 192.168.1.16 SSH 366 Server: Encrypted packet (len=300)
  317 3.271014938  10.6.15.145 → 192.168.1.16 SSH 134 Server: Encrypted packet (len=68)
  318 3.271022433  10.6.15.145 → 192.168.1.16 SSH 174 Server: Encrypted packet (len=108)
  319 3.271077625 192.168.1.16 → 10.6.15.145  TCP 66 52104 → 22 [ACK] Seq=15301 Ack=150149 Win=6157 Len=0 TSval=1601251 TSecr=24415777
  320 3.271093056  10.6.15.145 → 192.168.1.16 SSH 342 Server: Encrypted packet (len=276)
  321 3.271307878  10.6.15.145 → 192.168.1.16 SSH 422 Server: Encrypted packet (len=356)
  322 3.271334936 192.168.1.16 → 10.6.15.145  TCP 66 52104 → 22 [ACK] Seq=15301 Ack=150781 Win=6157 Len=0 TSval=1601251 TSecr=24415777
  323 3.273423391 192.168.1.16 → 10.6.15.145  SSH 134 Client: Encrypted packet (len=68)
  324 3.274754813  10.6.15.145 → 192.168.1.16 TCP 66 22 → 52104 [ACK] Seq=150781 Ack=15369 Win=1452 Len=0 TSval=24415779 TSecr=1601250
  325 3.277076837  10.6.15.145 → 192.168.1.16 SSH 138 Server: Encrypted packet (len=72)
  326 3.277241791 192.168.1.16 → 10.6.15.145  SSH 102 Client: Encrypted packet (len=36)
  327 3.278921411  10.6.15.145 → 192.168.1.16 SSH 158 Server: Encrypted packet (len=92)
  328 3.278938351  10.6.15.145 → 192.168.1.16 SSH 118 Server: Encrypted packet (len=52)
  329 3.278990379 192.168.1.16 → 10.6.15.145  TCP 66 52104 → 22 [ACK] Seq=15405 Ack=150997 Win=6157 Len=0 TSval=1601253 TSecr=24415780
  330 3.279155186  10.6.15.145 → 192.168.1.16 SSH 454 Server: Encrypted packet (len=388)
  331 3.280190873 192.168.1.16 → 10.6.15.145  SSH 206 Client: Encrypted packet (len=140)
  332 3.284726401  10.6.15.145 → 192.168.1.16 SSH 374 Server: Encrypted packet (len=308)
  333 3.284765514  10.6.15.145 → 192.168.1.16 SSH 438 Server: Encrypted packet (len=372)
  334 3.284814780  10.6.15.145 → 192.168.1.16 SSH 366 Server: Encrypted packet (len=300)
  335 3.284964004 192.168.1.16 → 10.6.15.145  TCP 66 52104 → 22 [ACK] Seq=15545 Ack=152365 Win=6157 Len=0 TSval=1601255 TSecr=24415781
  336 3.285228276 192.168.1.16 → 10.6.15.145  SSH 126 Client: Encrypted packet (len=60)
  337 3.286088136  10.6.15.145 → 192.168.1.16 SSH 366 Server: Encrypted packet (len=300)
  338 3.287274690  10.6.15.145 → 192.168.1.16 SSH 158 Server: Encrypted packet (len=92)
  339 3.287290234  10.6.15.145 → 192.168.1.16 SSH 118 Server: Encrypted packet (len=52)
  340 3.287319821 192.168.1.16 → 10.6.15.145  TCP 66 52104 → 22 [ACK] Seq=15605 Ack=152809 Win=6157 Len=0 TSval=1601255 TSecr=24415782
  341 3.287516307  10.6.15.145 → 192.168.1.16 SSH 522 Server: Encrypted packet (len=456)
  342 3.287752772  10.6.15.145 → 192.168.1.16 SSH 814 Server: Encrypted packet (len=748)
  343 3.287771244 192.168.1.16 → 10.6.15.145  TCP 66 52104 → 22 [ACK] Seq=15605 Ack=154013 Win=6157 Len=0 TSval=1601256 TSecr=24415782
  344 3.288398324  10.6.15.145 → 192.168.1.16 SSH 1514 Server: Encrypted packet (len=1448)
  345 3.288406272  10.6.15.145 → 192.168.1.16 SSH 110 Server: Encrypted packet (len=44)
  346 3.288409987 192.168.1.16 → 10.6.15.145  TCP 66 52104 → 22 [ACK] Seq=15605 Ack=155505 Win=6157 Len=0 TSval=1601256 TSecr=24415783
  347 3.288563062 192.168.1.16 → 10.6.15.145  SSH 206 Client: Encrypted packet (len=140)
  348 3.289876507  10.6.15.145 → 192.168.1.16 SSH 1514 Server: Encrypted packet (len=1448)
  349 3.290063050  10.6.15.145 → 192.168.1.16 SSH 1514 Server: Encrypted packet (len=1448)
  350 3.290070508 192.168.1.16 → 10.6.15.145  TCP 66 52104 → 22 [ACK] Seq=15745 Ack=158401 Win=6157 Len=0 TSval=1601256 TSecr=24415783
  351 3.290412360  10.6.15.145 → 192.168.1.16 SSH 1514 Server: Encrypted packet (len=1448)
  352 3.290600019  10.6.15.145 → 192.168.1.16 SSH 1514 Server: Encrypted packet (len=1448)
  353 3.290607732 192.168.1.16 → 10.6.15.145  TCP 66 52104 → 22 [ACK] Seq=15745 Ack=161297 Win=6157 Len=0 TSval=1601256 TSecr=24415783
  354 3.290759032  10.6.15.145 → 192.168.1.16 SSH 1306 Server: Encrypted packet (len=1240)
  355 3.291831559  10.6.15.145 → 192.168.1.16 SSH 1514 Server: Encrypted packet (len=1448)
  356 3.291847637 192.168.1.16 → 10.6.15.145  TCP 66 52104 → 22 [ACK] Seq=15745 Ack=163985 Win=6157 Len=0 TSval=1601257 TSecr=24415783
  357 3.291866518  10.6.15.145 → 192.168.1.16 SSH 110 Server: Encrypted packet (len=44)
  358 3.292280319 192.168.1.16 → 10.6.15.145  SSH 206 Client: Encrypted packet (len=140)
  359 3.293167365  10.6.15.145 → 192.168.1.16 SSH 1514 Server: Encrypted packet (len=1448)
  360 3.293356518  10.6.15.145 → 192.168.1.16 SSH 1514 Server: Encrypted packet (len=1448)
  361 3.293362250 192.168.1.16 → 10.6.15.145  TCP 66 52104 → 22 [ACK] Seq=15885 Ack=166925 Win=6157 Len=0 TSval=1601257 TSecr=24415784
  362 3.293704043  10.6.15.145 → 192.168.1.16 SSH 1514 Server: Encrypted packet (len=1448)
  363 3.293896130  10.6.15.145 → 192.168.1.16 SSH 1514 Server: Encrypted packet (len=1448)
  364 3.293902000 192.168.1.16 → 10.6.15.145  TCP 66 52104 → 22 [ACK] Seq=15885 Ack=169821 Win=6157 Len=0 TSval=1601257 TSecr=24415784
  365 3.294087102  10.6.15.145 → 192.168.1.16 SSH 1514 Server: Encrypted packet (len=1448)
  366 3.294095258  10.6.15.145 → 192.168.1.16 SSH 242 Server: Encrypted packet (len=176)
  367 3.294099261 192.168.1.16 → 10.6.15.145  TCP 66 52104 → 22 [ACK] Seq=15885 Ack=171445 Win=6157 Len=0 TSval=1601257 TSecr=24415784
  368 3.294726249 192.168.1.16 → 10.6.15.145  SSH 206 Client: Encrypted packet (len=140)
  369 3.298604762  10.6.15.145 → 192.168.1.16 SSH 134 Server: Encrypted packet (len=68)
  370 3.305686212  10.6.15.145 → 192.168.1.16 SSH 414 Server: Encrypted packet (len=348)
  371 3.305758347 192.168.1.16 → 10.6.15.145  TCP 66 52104 → 22 [ACK] Seq=16025 Ack=171861 Win=6157 Len=0 TSval=1601260 TSecr=24415785
  372 3.308008750  10.6.15.145 → 192.168.1.16 SSH 158 Server: Encrypted packet (len=92)
  373 3.308019043  10.6.15.145 → 192.168.1.16 SSH 118 Server: Encrypted packet (len=52)
  374 3.308058375 192.168.1.16 → 10.6.15.145  TCP 66 52104 → 22 [ACK] Seq=16025 Ack=172005 Win=6157 Len=0 TSval=1601261 TSecr=24415788
  375 3.311538762  10.6.15.145 → 192.168.1.16 SSH 1514 Server: Encrypted packet (len=1448)
  376 3.311725142  10.6.15.145 → 192.168.1.16 SSH 1514 Server: Encrypted packet (len=1448)
  377 3.311730694 192.168.1.16 → 10.6.15.145  TCP 66 52104 → 22 [ACK] Seq=16025 Ack=174901 Win=6157 Len=0 TSval=1601262 TSecr=24415788
  378 3.311858935  10.6.15.145 → 192.168.1.16 SSH 110 Server: Encrypted packet (len=44)
  379 3.312093978  10.6.15.145 → 192.168.1.16 SSH 1514 Server: Encrypted packet (len=1448)
  380 3.312099085 192.168.1.16 → 10.6.15.145  TCP 66 52104 → 22 [ACK] Seq=16025 Ack=176393 Win=6157 Len=0 TSval=1601262 TSecr=24415788
  381 3.312107306  10.6.15.145 → 192.168.1.16 SSH 110 Server: Encrypted packet (len=44)
  382 3.312310271  10.6.15.145 → 192.168.1.16 SSH 1514 Server: Encrypted packet (len=1448)
