    1 0.000000000  10.6.15.145 → 192.168.1.16 SSH 110 Server: Encrypted packet (len=44)
    2 0.000024481  10.6.15.145 → 192.168.1.16 TCP 110 [TCP Retransmission] 22 → 52104 [PSH, ACK] Seq=1 Ack=1 Win=1452 Len=44 TSval=24430211 TSecr=1615551
    3 0.000034273 192.168.1.16 → 10.6.15.145  TCP 78 52104 → 22 [ACK] Seq=1 Ack=45 Win=6157 Len=0 TSval=1615952 TSecr=24430211 SLE=1 SRE=45
    4 0.000047092  10.6.15.145 → 192.168.1.16 SSH 110 Server: [TCP Spurious Retransmission] , Encrypted packet (len=44)
    5 0.000050867 192.168.1.16 → 10.6.15.145  TCP 78 [TCP Dup ACK 3#1] 52104 → 22 [ACK] Seq=1 Ack=45 Win=6157 Len=0 TSval=1615952 TSecr=24430340 SLE=1 SRE=45
    6 0.000448418 192.168.1.16 → 10.6.15.145  SSH 622 Client: Encrypted packet (len=556)
    7 0.002404048  10.6.15.145 → 192.168.1.16 TCP 66 22 → 52104 [ACK] Seq=45 Ack=557 Win=1452 Len=0 TSval=24430480 TSecr=1615952
    8 1.024091438  10.6.15.145 → 192.168.1.16 SSH 486 Server: Encrypted packet (len=420)
    9 1.029542142 192.168.1.16 → 10.6.15.145  SSH 198 Client: Encrypted packet (len=132)
   10 1.030880305  10.6.15.145 → 192.168.1.16 TCP 66 22 → 52104 [ACK] Seq=465 Ack=689 Win=1452 Len=0 TSval=24430737 TSecr=1616209
   11 1.073578343  10.6.15.145 → 192.168.1.16 SSH 710 Server: Encrypted packet (len=644)
   12 1.075687901 192.168.1.16 → 10.6.15.145  SSH 102 Client: Encrypted packet (len=36)
   13 1.075876501 192.168.1.16 → 10.6.15.145  SSH 102 Client: Encrypted packet (len=36)
   14 1.076043142 192.168.1.16 → 10.6.15.145  SSH 174 Client: Encrypted packet (len=108)
   15 1.076378950 192.168.1.16 → 10.6.15.145  SSH 110 Client: Encrypted packet (len=44)
   16 1.077347468  10.6.15.145 → 192.168.1.16 TCP 66 22 → 52104 [ACK] Seq=1109 Ack=725 Win=1452 Len=0 TSval=24430748 TSecr=1616221
   17 1.077362018 192.168.1.16 → 10.6.15.145  SSH 338 Client: Encrypted packet (len=272)
   18 1.077376138  10.6.15.145 → 192.168.1.16 TCP 66 22 → 52104 [ACK] Seq=1109 Ack=761 Win=1452 Len=0 TSval=24430748 TSecr=1616221
   19 1.078343152  10.6.15.145 → 192.168.1.16 TCP 66 22 → 52104 [ACK] Seq=1109 Ack=869 Win=1452 Len=0 TSval=24430749 TSecr=1616221
   20 1.078355496  10.6.15.145 → 192.168.1.16 TCP 66 22 → 52104 [ACK] Seq=1109 Ack=913 Win=1452 Len=0 TSval=24430749 TSecr=1616221
   21 1.078695738 192.168.1.16 → 10.6.15.145  SSH 206 Client: Encrypted packet (len=140)
   22 1.078744871  10.6.15.145 → 192.168.1.16 TCP 66 22 → 52104 [ACK] Seq=1109 Ack=1185 Win=1452 Len=0 TSval=24430749 TSecr=1616221
   23 1.080033565  10.6.15.145 → 192.168.1.16 TCP 66 22 → 52104 [ACK] Seq=1109 Ack=1325 Win=1452 Len=0 TSval=24430749 TSecr=1616222
   24 1.203727575  10.6.15.145 → 192.168.1.16 SSH 426 Server: Encrypted packet (len=360)
   25 1.204150144 192.168.1.16 → 10.6.15.145  SSH 210 Client: Encrypted packet (len=144)
   26 1.204440162 192.168.1.16 → 10.6.15.145  SSH 390 Client: Encrypted packet (len=324)
   27 1.204713699 192.168.1.16 → 10.6.15.145  SSH 158 Client: Encrypted packet (len=92)
   28 1.205493269  10.6.15.145 → 192.168.1.16 TCP 66 22 → 52104 [ACK] Seq=1469 Ack=1469 Win=1452 Len=0 TSval=24430780 TSecr=1616253
   29 1.205875111  10.6.15.145 → 192.168.1.16 TCP 66 22 → 52104 [ACK] Seq=1469 Ack=1793 Win=1452 Len=0 TSval=24430781 TSecr=1616253
   30 1.206267278  10.6.15.145 → 192.168.1.16 TCP 66 22 → 52104 [ACK] Seq=1469 Ack=1885 Win=1452 Len=0 TSval=24430781 TSecr=1616253
   31 1.222086339  10.6.15.145 → 192.168.1.16 SSH 102 Server: Encrypted packet (len=36)
   32 1.222419398 192.168.1.16 → 10.6.15.145  SSH 182 Client: Encrypted packet (len=116)
   33 1.224880311  10.6.15.145 → 192.168.1.16 SSH 102 Server: Encrypted packet (len=36)
   34 1.224900505  10.6.15.145 → 192.168.1.16 SSH 102 Server: Encrypted packet (len=36)
   35 1.224965734 192.168.1.16 → 10.6.15.145  TCP 66 52104 → 22 [ACK] Seq=2001 Ack=1577 Win=6157 Len=0 TSval=1616258 TSecr=24430785
   36 1.225249640 192.168.1.16 → 10.6.15.145  SSH 158 Client: Encrypted packet (len=92)
   37 1.225307722  10.6.15.145 → 192.168.1.16 SSH 102 Server: Encrypted packet (len=36)
   38 1.225568262 192.168.1.16 → 10.6.15.145  SSH 514 Client: Encrypted packet (len=448)
   39 1.227127514  10.6.15.145 → 192.168.1.16 TCP 66 22 → 52104 [ACK] Seq=1613 Ack=2541 Win=1452 Len=0 TSval=24430786 TSecr=1616258
   40 1.233559953  10.6.15.145 → 192.168.1.16 SSH 254 Server: Encrypted packet (len=188)
   41 1.233859138 192.168.1.16 → 10.6.15.145  SSH 134 Client: Encrypted packet (len=68)
   42 1.234188874  10.6.15.145 → 192.168.1.16 SSH 182 Server: Encrypted packet (len=116)
   43 1.234414323 192.168.1.16 → 10.6.15.145  SSH 134 Client: Encrypted packet (len=68)
   44 1.235945725  10.6.15.145 → 192.168.1.16 TCP 66 22 → 52104 [ACK] Seq=1917 Ack=2677 Win=1452 Len=0 TSval=24430788 TSecr=1616260
   45 1.264536190  10.6.15.145 → 192.168.1.16 SSH 1514 Server: Encrypted packet (len=1448)
   46 1.264693685  10.6.15.145 → 192.168.1.16 SSH 1514 Server: Encrypted packet (len=1448)
   47 1.264703750 192.168.1.16 → 10.6.15.145  TCP 66 52104 → 22 [ACK] Seq=2677 Ack=4813 Win=6157 Len=0 TSval=1616268 TSecr=24430795
   48 1.265122744  10.6.15.145 → 192.168.1.16 SSH 342 Server: Encrypted packet (len=276)
   49 1.266302660 192.168.1.16 → 10.6.15.145  SSH 206 Client: Encrypted packet (len=140)
   50 1.267258492  10.6.15.145 → 192.168.1.16 SSH 526 Server: Encrypted packet (len=460)
   51 1.267268549  10.6.15.145 → 192.168.1.16 SSH 158 Server: Encrypted packet (len=92)
   52 1.267296203 192.168.1.16 → 10.6.15.145  TCP 66 52104 → 22 [ACK] Seq=2817 Ack=5641 Win=6157 Len=0 TSval=1616269 TSecr=24430796
   53 1.267696165  10.6.15.145 → 192.168.1.16 SSH 118 Server: Encrypted packet (len=52)
   54 1.267746355  10.6.15.145 → 192.168.1.16 SSH 454 Server: Encrypted packet (len=388)
   55 1.267769319 192.168.1.16 → 10.6.15.145  TCP 66 52104 → 22 [ACK] Seq=2817 Ack=6081 Win=6157 Len=0 TSval=1616269 TSecr=24430796
   56 1.268527179 192.168.1.16 → 10.6.15.145  SSH 206 Client: Encrypted packet (len=140)
   57 1.270906845 192.168.1.16 → 10.6.15.145  SSH 206 Client: Encrypted packet (len=140)
   58 1.272892981  10.6.15.145 → 192.168.1.16 SSH 1322 Server: Encrypted packet (len=1256)
   59 1.272975827  10.6.15.145 → 192.168.1.16 SSH 750 Server: Encrypted packet (len=684)
   60 1.272985410 192.168.1.16 → 10.6.15.145  TCP 66 52104 → 22 [ACK] Seq=3097 Ack=8021 Win=6157 Len=0 TSval=1616270 TSecr=24430796
   61 1.275036085 192.168.1.16 → 10.6.15.145  SSH 206 Client: Encrypted packet (len=140)
   62 1.281650059  10.6.15.145 → 192.168.1.16 SSH 150 Server: Encrypted packet (len=84)
   63 1.297394315  10.6.15.145 → 192.168.1.16 TCP 78 [TCP Dup ACK 58#1] 22 → 52104 [ACK] Seq=8105 Ack=2817 Win=1452 Len=0 TSval=24430803 TSecr=1616269 SLE=2957 SRE=3097
   64 1.297412508  10.6.15.145 → 192.168.1.16 TCP 78 [TCP Dup ACK 58#2] 22 → 52104 [ACK] Seq=8105 Ack=2817 Win=1452 Len=0 TSval=24430803 TSecr=1616269 SLE=2957 SRE=3237
   65 1.297806560  10.6.15.145 → 192.168.1.16 SSH 122 Server: Encrypted packet (len=44)
   66 1.297869748 192.168.1.16 → 10.6.15.145  TCP 66 52104 → 22 [ACK] Seq=3237 Ack=8149 Win=6157 Len=0 TSval=1616276 TSecr=24430799
   67 1.298176901 192.168.1.16 → 10.6.15.145  SSH 166 Client: Encrypted packet (len=100)
   68 1.299490235  10.6.15.145 → 192.168.1.16 TCP 78 [TCP Dup ACK 58#3] 22 → 52104 [ACK] Seq=8149 Ack=2817 Win=1452 Len=0 TSval=24430804 TSecr=1616269 SLE=2957 SRE=3337
   69 1.299501831 192.168.1.16 → 10.6.15.145  SSH 206 Client: [TCP Fast Retransmission] , Encrypted packet (len=140)
   70 1.302395901  10.6.15.145 → 192.168.1.16 TCP 66 22 → 52104 [ACK] Seq=8149 Ack=3337 Win=1451 Len=0 TSval=24430804 TSecr=1616277
   71 1.306121266  10.6.15.145 → 192.168.1.16 SSH 398 Server: Encrypted packet (len=332)
   72 1.332321949  10.6.15.145 → 192.168.1.16 SSH 138 Server: Encrypted packet (len=72)
   73 1.332399559 192.168.1.16 → 10.6.15.145  TCP 66 52104 → 22 [ACK] Seq=3337 Ack=8553 Win=6157 Len=0 TSval=1616285 TSecr=24430805
   74 1.332562275 192.168.1.16 → 10.6.15.145  SSH 102 Client: Encrypted packet (len=36)
   75 1.337412907  10.6.15.145 → 192.168.1.16 SSH 382 Server: Encrypted packet (len=316)
   76 1.337432507  10.6.15.145 → 192.168.1.16 SSH 382 Server: Encrypted packet (len=316)
   77 1.337489422 192.168.1.16 → 10.6.15.145  TCP 66 52104 → 22 [ACK] Seq=3373 Ack=9185 Win=6157 Len=0 TSval=1616286 TSecr=24430813
   78 1.338022006  10.6.15.145 → 192.168.1.16 SSH 374 Server: Encrypted packet (len=308)
   79 1.382082486 192.168.1.16 → 10.6.15.145  TCP 66 52104 → 22 [ACK] Seq=3373 Ack=9493 Win=6157 Len=0 TSval=1616298 TSecr=24430813
   80 1.410183765  10.6.15.145 → 192.168.1.16 SSH 1514 Server: Encrypted packet (len=1448)
   81 1.410367633  10.6.15.145 → 192.168.1.16 SSH 1514 Server: Encrypted packet (len=1448)
   82 1.410379706 192.168.1.16 → 10.6.15.145  TCP 66 52104 → 22 [ACK] Seq=3373 Ack=12389 Win=6157 Len=0 TSval=1616305 TSecr=24430831
   83 1.411116227  10.6.15.145 → 192.168.1.16 SSH 710 Server: Encrypted packet (len=644)
   84 1.411146264 192.168.1.16 → 10.6.15.145  TCP 66 52104 → 22 [ACK] Seq=3373 Ack=13033 Win=6157 Len=0 TSval=1616305 TSecr=24430831
   85 1.438943654  10.6.15.145 → 192.168.1.16 SSH 1514 Server: Encrypted packet (len=1448)
   86 1.439125313  10.6.15.145 → 192.168.1.16 SSH 1514 Server: Encrypted packet (len=1448)
   87 1.439139664 192.168.1.16 → 10.6.15.145  TCP 66 52104 → 22 [ACK] Seq=3373 Ack=15929 Win=6157 Len=0 TSval=1616312 TSecr=24430839
   88 1.439492267  10.6.15.145 → 192.168.1.16 SSH 110 Server: Encrypted packet (len=44)
   89 1.439545282 192.168.1.16 → 10.6.15.145  TCP 66 52104 → 22 [ACK] Seq=3373 Ack=15973 Win=6157 Len=0 TSval=1616312 TSecr=24430839
   90 1.439718763  10.6.15.145 → 192.168.1.16 SSH 1514 Server: Encrypted packet (len=1448)
   91 1.439730884  10.6.15.145 → 192.168.1.16 SSH 110 Server: Encrypted packet (len=44)
   92 1.439738306 192.168.1.16 → 10.6.15.145  TCP 66 52104 → 22 [ACK] Seq=3373 Ack=17465 Win=6157 Len=0 TSval=1616312 TSecr=24430839
   93 1.490433601 192.168.1.16 → 10.6.15.145  SSH 102 Client: Encrypted packet (len=36)
   94 1.490676824 192.168.1.16 → 10.6.15.145  SSH 102 Client: Encrypted packet (len=36)
   95 1.492036643  10.6.15.145 → 192.168.1.16 TCP 66 22 → 52104 [ACK] Seq=17465 Ack=3445 Win=1452 Len=0 TSval=24430852 TSecr=1616325
   96 1.492049969 192.168.1.16 → 10.6.15.145  SSH 498 Client: Encrypted packet (len=432)
   97 1.495852864  10.6.15.145 → 192.168.1.16 SSH 118 Server: Encrypted packet (len=52)
   98 1.495936184 192.168.1.16 → 10.6.15.145  TCP 66 52104 → 22 [ACK] Seq=3877 Ack=17517 Win=6157 Len=0 TSval=1616326 TSecr=24430853
   99 1.497948627  10.6.15.145 → 192.168.1.16 SSH 1514 Server: Encrypted packet (len=1448)
  100 1.498130354  10.6.15.145 → 192.168.1.16 SSH 1514 Server: Encrypted packet (len=1448)
  101 1.498142288 192.168.1.16 → 10.6.15.145  TCP 66 52104 → 22 [ACK] Seq=3877 Ack=20413 Win=6157 Len=0 TSval=1616327 TSecr=24430853
  102 1.499241912  10.6.15.145 → 192.168.1.16 SSH 110 Server: Encrypted packet (len=44)
  103 1.499314676 192.168.1.16 → 10.6.15.145  TCP 66 52104 → 22 [ACK] Seq=3877 Ack=20457 Win=6157 Len=0 TSval=1616327 TSecr=24430853
  104 1.499461275  10.6.15.145 → 192.168.1.16 SSH 1514 Server: Encrypted packet (len=1448)
  105 1.499501166 192.168.1.16 → 10.6.15.145  SSH 102 Client: Encrypted packet (len=36)
  106 1.499655332  10.6.15.145 → 192.168.1.16 SSH 1514 Server: Encrypted packet (len=1448)
  107 1.501199680  10.6.15.145 → 192.168.1.16 SSH 110 Server: Encrypted packet (len=44)
  108 1.501220462 192.168.1.16 → 10.6.15.145  TCP 66 52104 → 22 [ACK] Seq=3913 Ack=23397 Win=6157 Len=0 TSval=1616327 TSecr=24430853
  109 1.501242555  10.6.15.145 → 192.168.1.16 SSH 110 Server: Encrypted packet (len=44)
  110 1.501766340 192.168.1.16 → 10.6.15.145  SSH 166 Client: Encrypted packet (len=100)
  111 1.503233527  10.6.15.145 → 192.168.1.16 TCP 66 22 → 52104 [ACK] Seq=23441 Ack=4013 Win=1452 Len=0 TSval=24430855 TSecr=1616327
  112 1.513151019  10.6.15.145 → 192.168.1.16 SSH 1514 Server: Encrypted packet (len=1448)
  113 1.513173859  10.6.15.145 → 192.168.1.16 SSH 366 Server: Encrypted packet (len=300)
  114 1.513185105 192.168.1.16 → 10.6.15.145  TCP 66 52104 → 22 [ACK] Seq=4013 Ack=25189 Win=6157 Len=0 TSval=1616330 TSecr=24430857
  115 1.514310106 192.168.1.16 → 10.6.15.145  SSH 206 Client: Encrypted packet (len=140)
  116 1.518542748  10.6.15.145 → 192.168.1.16 SSH 134 Server: Encrypted packet (len=68)
  117 1.518575751  10.6.15.145 → 192.168.1.16 SSH 138 Server: Encrypted packet (len=72)
  118 1.518618786 192.168.1.16 → 10.6.15.145  TCP 66 52104 → 22 [ACK] Seq=4153 Ack=25329 Win=6157 Len=0 TSval=1616332 TSecr=24430859
  119 1.518831664 192.168.1.16 → 10.6.15.145  SSH 102 Client: Encrypted packet (len=36)
  120 1.519521498  10.6.15.145 → 192.168.1.16 SSH 110 Server: Encrypted packet (len=44)
  121 1.519826120 192.168.1.16 → 10.6.15.145  SSH 174 Client: Encrypted packet (len=108)
  122 1.520744221  10.6.15.145 → 192.168.1.16 SSH 342 Server: Encrypted packet (len=276)
  123 1.520856375  10.6.15.145 → 192.168.1.16 SSH 822 Server: Encrypted packet (len=756)
  124 1.520874756 192.168.1.16 → 10.6.15.145  TCP 66 52104 → 22 [ACK] Seq=4297 Ack=26405 Win=6157 Len=0 TSval=1616332 TSecr=24430859
  125 1.522411285  10.6.15.145 → 192.168.1.16 SSH 598 Server: Encrypted packet (len=532)
  126 1.522497861  10.6.15.145 → 192.168.1.16 SSH 718 Server: Encrypted packet (len=652)
  127 1.522594581 192.168.1.16 → 10.6.15.145  TCP 66 52104 → 22 [ACK] Seq=4297 Ack=27589 Win=6157 Len=0 TSval=1616333 TSecr=24430859
  128 1.523169943  10.6.15.145 → 192.168.1.16 SSH 758 Server: Encrypted packet (len=692)
  129 1.524165645 192.168.1.16 → 10.6.15.145  SSH 206 Client: Encrypted packet (len=140)
  130 1.526567347  10.6.15.145 → 192.168.1.16 SSH 1514 Server: Encrypted packet (len=1448)
  131 1.526737872  10.6.15.145 → 192.168.1.16 SSH 1514 Server: Encrypted packet (len=1448)
  132 1.526746174 192.168.1.16 → 10.6.15.145  TCP 66 52104 → 22 [ACK] Seq=4437 Ack=31177 Win=6157 Len=0 TSval=1616334 TSecr=24430861
  133 1.530306720  10.6.15.145 → 192.168.1.16 SSH 110 Server: Encrypted packet (len=44)
  134 1.530533332  10.6.15.145 → 192.168.1.16 SSH 1514 Server: Encrypted packet (len=1448)
  135 1.530543922 192.168.1.16 → 10.6.15.145  TCP 66 52104 → 22 [ACK] Seq=4437 Ack=32669 Win=6157 Len=0 TSval=1616335 TSecr=24430861
  136 1.530562107  10.6.15.145 → 192.168.1.16 SSH 110 Server: Encrypted packet (len=44)
  137 1.531297485  10.6.15.145 → 192.168.1.16 SSH 1514 Server: Encrypted packet (len=1448)
  138 1.531307075 192.168.1.16 → 10.6.15.145  TCP 66 52104 → 22 [ACK] Seq=4437 Ack=34161 Win=6157 Len=0 TSval=1616335 TSecr=24430861
  139 1.531330147  10.6.15.145 → 192.168.1.16 SSH 254 Server: Encrypted packet (len=188)
  140 1.531566907 192.168.1.16 → 10.6.15.145  SSH 138 Client: Encrypted packet (len=72)
  141 1.531999656  10.6.15.145 → 192.168.1.16 SSH 110 Server: Encrypted packet (len=44)
  142 1.533956945  10.6.15.145 → 192.168.1.16 SSH 102 Server: Encrypted packet (len=36)
  143 1.534001652 192.168.1.16 → 10.6.15.145  TCP 66 52104 → 22 [ACK] Seq=4509 Ack=34429 Win=6157 Len=0 TSval=1616335 TSecr=24430862
  144 1.534058601 192.168.1.16 → 10.6.15.145  SSH 166 Client: Encrypted packet (len=100)
  145 1.537820910 192.168.1.16 → 10.6.15.145  SSH 166 Client: Encrypted packet (len=100)
  146 1.545733748  10.6.15.145 → 192.168.1.16 SSH 102 Server: [TCP Spurious Retransmission] , Encrypted packet (len=36)
  147 1.545755428 192.168.1.16 → 10.6.15.145  TCP 78 [TCP Dup ACK 143#1] 52104 → 22 [ACK] Seq=4709 Ack=34429 Win=6157 Len=0 TSval=1616338 TSecr=24430866 SLE=34393 SRE=34429
  148 1.547013729  10.6.15.145 → 192.168.1.16 SSH 1302 Server: Encrypted packet (len=1236)
  149 1.547026839 192.168.1.16 → 10.6.15.145  TCP 66 52104 → 22 [ACK] Seq=4709 Ack=35665 Win=6157 Len=0 TSval=1616339 TSecr=24430866
  150 1.547055747  10.6.15.145 → 192.168.1.16 SSH 478 Server: Encrypted packet (len=412)
  151 1.547060877 192.168.1.16 → 10.6.15.145  TCP 66 52104 → 22 [ACK] Seq=4709 Ack=36077 Win=6157 Len=0 TSval=1616339 TSecr=24430866
  152 1.562024836 192.168.1.16 → 10.6.15.145  TCP 166 [TCP Retransmission] 52104 → 22 [PSH, ACK] Seq=4609 Ack=36077 Win=6157 Len=100 TSval=1616343 TSecr=24430866
  153 1.562360332  10.6.15.145 → 192.168.1.16 SSH 526 Server: Encrypted packet (len=460)
  154 1.582032374 192.168.1.16 → 10.6.15.145  SSH 242 Client: Encrypted packet (len=176)
  155 1.628621976  10.6.15.145 → 192.168.1.16 SSH 1514 Server: Encrypted packet (len=1436)
  156 1.628825495  10.6.15.145 → 192.168.1.16 SSH 1514 Server: Encrypted packet (len=1436)
  157 1.628833378 192.168.1.16 → 10.6.15.145  TCP 66 52104 → 22 [ACK] Seq=4885 Ack=39409 Win=6157 Len=0 TSval=1616359 TSecr=24430886
  158 1.629208649  10.6.15.145 → 192.168.1.16 SSH 102 Server: Encrypted packet (len=24)
  159 1.629230889  10.6.15.145 → 192.168.1.16 TCP 86 [TCP Dup ACK 133#1] 22 → 52104 [ACK] Seq=39433 Ack=4437 Win=1452 Len=0 TSval=24430886 TSecr=1616335 SLE=4609 SRE=4709 SLE=4609 SRE=4709
  160 1.629233932 192.168.1.16 → 10.6.15.145  SSH 406 Client: Encrypted packet (len=340)
  161 1.629239859  10.6.15.145 → 192.168.1.16 TCP 78 [TCP Dup ACK 133#2] 22 → 52104 [ACK] Seq=39433 Ack=4437 Win=1452 Len=0 TSval=24430886 TSecr=1616335 SLE=4609 SRE=4885
  162 1.629244548 192.168.1.16 → 10.6.15.145  SSH 238 Client: [TCP Fast Retransmission] , Encrypted packet (len=172)
  163 1.632325877  10.6.15.145 → 192.168.1.16 SSH 1514 Server: Encrypted packet (len=1436)
  164 1.633952811  10.6.15.145 → 192.168.1.16 SSH 1514 Server: Encrypted packet (len=1436)
  165 1.633978813 192.168.1.16 → 10.6.15.145  TCP 66 52104 → 22 [ACK] Seq=5225 Ack=42305 Win=6157 Len=0 TSval=1616360 TSecr=24430887
  166 1.633993200  10.6.15.145 → 192.168.1.16 SSH 102 Server: Encrypted packet (len=24)
  167 1.645160400  10.6.15.145 → 192.168.1.16 SSH 1514 Server: Encrypted packet (len=1436)
  168 1.645185214 192.168.1.16 → 10.6.15.145  TCP 66 52104 → 22 [ACK] Seq=5225 Ack=43765 Win=6157 Len=0 TSval=1616363 TSecr=24430887
  169 1.645370944  10.6.15.145 → 192.168.1.16 SSH 1514 Server: Encrypted packet (len=1436)
  170 1.645380476  10.6.15.145 → 192.168.1.16 TCP 66 22 → 52104 [ACK] Seq=45201 Ack=5225 Win=1446 Len=0 TSval=24430887 TSecr=1616359
  171 1.645386844  10.6.15.145 → 192.168.1.16 SSH 90 Server: Encrypted packet (len=24)
  172 1.645390556 192.168.1.16 → 10.6.15.145  TCP 66 52104 → 22 [ACK] Seq=5225 Ack=45225 Win=6157 Len=0 TSval=1616363 TSecr=24430887
  173 1.651053256  10.6.15.145 → 192.168.1.16 SSH 1514 Server: Encrypted packet (len=1448)
  174 1.651256026  10.6.15.145 → 192.168.1.16 SSH 1514 Server: Encrypted packet (len=1448)
  175 1.651265175 192.168.1.16 → 10.6.15.145  TCP 66 52104 → 22 [ACK] Seq=5225 Ack=48121 Win=6157 Len=0 TSval=1616365 TSecr=24430891
  176 1.651469401  10.6.15.145 → 192.168.1.16 SSH 1514 Server: Encrypted packet (len=1448)
  177 1.651682932  10.6.15.145 → 192.168.1.16 SSH 1514 Server: Encrypted packet (len=1448)
  178 1.651688449 192.168.1.16 → 10.6.15.145  TCP 66 52104 → 22 [ACK] Seq=5225 Ack=51017 Win=6157 Len=0 TSval=1616365 TSecr=24430891
  179 1.651750143  10.6.15.145 → 192.168.1.16 SSH 626 Server: Encrypted packet (len=560)
  180 1.651894124 192.168.1.16 → 10.6.15.145  SSH 102 Client: Encrypted packet (len=36)
  181 1.652121874 192.168.1.16 → 10.6.15.145  SSH 102 Client: Encrypted packet (len=36)
  182 1.656515046  10.6.15.145 → 192.168.1.16 TCP 66 22 → 52104 [ACK] Seq=51577 Ack=5297 Win=1452 Len=0 TSval=24430892 TSecr=1616365
  183 1.657501085  10.6.15.145 → 192.168.1.16 SSH 470 Server: Encrypted packet (len=404)
  184 1.668948960  10.6.15.145 → 192.168.1.16 SSH 942 Server: Encrypted packet (len=876)
  185 1.669023454 192.168.1.16 → 10.6.15.145  TCP 66 52104 → 22 [ACK] Seq=5297 Ack=52857 Win=6157 Len=0 TSval=1616369 TSecr=24430893
  186 1.669166340  10.6.15.145 → 192.168.1.16 SSH 1514 Server: Encrypted packet (len=1448)
  187 1.671093992  10.6.15.145 → 192.168.1.16 SSH 390 Server: Encrypted packet (len=324)
  188 1.671107455 192.168.1.16 → 10.6.15.145  TCP 66 52104 → 22 [ACK] Seq=5297 Ack=54629 Win=6157 Len=0 TSval=1616370 TSecr=24430896
  189 1.674943839  10.6.15.145 → 192.168.1.16 SSH 654 Server: Encrypted packet (len=588)
  190 1.675039204  10.6.15.145 → 192.168.1.16 SSH 710 Server: Encrypted packet (len=644)
  191 1.675071192 192.168.1.16 → 10.6.15.145  TCP 66 52104 → 22 [ACK] Seq=5297 Ack=55861 Win=6157 Len=0 TSval=1616371 TSecr=24430897
  192 1.675274168  10.6.15.145 → 192.168.1.16 SSH 1490 Server: Encrypted packet (len=1424)
  193 1.675488609  10.6.15.145 → 192.168.1.16 SSH 1514 Server: Encrypted packet (len=1448)
  194 1.675495504 192.168.1.16 → 10.6.15.145  TCP 66 52104 → 22 [ACK] Seq=5297 Ack=58733 Win=6157 Len=0 TSval=1616371 TSecr=24430897
  195 1.675507668  10.6.15.145 → 192.168.1.16 SSH 110 Server: Encrypted packet (len=44)
  196 1.677880629  10.6.15.145 → 192.168.1.16 SSH 1514 Server: Encrypted packet (len=1448)
  197 1.677895594 192.168.1.16 → 10.6.15.145  TCP 66 52104 → 22 [ACK] Seq=5297 Ack=60225 Win=6157 Len=0 TSval=1616371 TSecr=24430897
  198 1.678044863  10.6.15.145 → 192.168.1.16 SSH 1254 Server: Encrypted packet (len=1188)
  199 1.678206523 192.168.1.16 → 10.6.15.145  SSH 206 Client: Encrypted packet (len=140)
  200 1.681644269 192.168.1.16 → 10.6.15.145  SSH 498 Client: Encrypted packet (len=432)
  201 1.683361497  10.6.15.145 → 192.168.1.16 TCP 66 22 → 52104 [ACK] Seq=61413 Ack=5869 Win=1452 Len=0 TSval=24430900 TSecr=1616372
  202 1.695025415  10.6.15.145 → 192.168.1.16 SSH 1514 Server: Encrypted packet (len=1448)
  203 1.695229235  10.6.15.145 → 192.168.1.16 SSH 1514 Server: Encrypted packet (len=1448)
  204 1.695241468 192.168.1.16 → 10.6.15.145  TCP 66 52104 → 22 [ACK] Seq=5869 Ack=64309 Win=6157 Len=0 TSval=1616376 TSecr=24430903
  205 1.695783284  10.6.15.145 → 192.168.1.16 SSH 870 Server: Encrypted packet (len=804)
  206 1.695845970  10.6.15.145 → 192.168.1.16 SSH 518 Server: Encrypted packet (len=452)
  207 1.695904217 192.168.1.16 → 10.6.15.145  TCP 66 52104 → 22 [ACK] Seq=5869 Ack=65565 Win=6157 Len=0 TSval=1616376 TSecr=24430903
  208 1.700543966  10.6.15.145 → 192.168.1.16 SSH 230 Server: Encrypted packet (len=164)
  209 1.700774667 192.168.1.16 → 10.6.15.145  SSH 134 Client: Encrypted packet (len=68)
  210 1.701480365  10.6.15.145 → 192.168.1.16 SSH 1514 Server: Encrypted packet (len=1448)
  211 1.701492368  10.6.15.145 → 192.168.1.16 SSH 110 Server: Encrypted packet (len=44)
  212 1.701498571 192.168.1.16 → 10.6.15.145  TCP 66 52104 → 22 [ACK] Seq=5937 Ack=67221 Win=6157 Len=0 TSval=1616377 TSecr=24430904
  213 1.702086306  10.6.15.145 → 192.168.1.16 SSH 1514 Server: Encrypted packet (len=1448)
  214 1.702096098  10.6.15.145 → 192.168.1.16 SSH 110 Server: Encrypted packet (len=44)
  215 1.702099751 192.168.1.16 → 10.6.15.145  TCP 66 52104 → 22 [ACK] Seq=5937 Ack=68713 Win=6157 Len=0 TSval=1616378 TSecr=24430904
  216 1.703566586  10.6.15.145 → 192.168.1.16 SSH 1514 Server: Encrypted packet (len=1448)
  217 1.703770592  10.6.15.145 → 192.168.1.16 SSH 1514 Server: Encrypted packet (len=1448)
  218 1.703779553 192.168.1.16 → 10.6.15.145  TCP 66 52104 → 22 [ACK] Seq=5937 Ack=71609 Win=6157 Len=0 TSval=1616378 TSecr=24430905
  219 1.704394684  10.6.15.145 → 192.168.1.16 SSH 1514 Server: Encrypted packet (len=1448)
  220 1.704604787  10.6.15.145 → 192.168.1.16 SSH 1514 Server: Encrypted packet (len=1448)
  221 1.704609872 192.168.1.16 → 10.6.15.145  TCP 66 52104 → 22 [ACK] Seq=5937 Ack=74505 Win=6157 Len=0 TSval=1616378 TSecr=24430905
  222 1.706420246  10.6.15.145 → 192.168.1.16 SSH 1514 Server: Encrypted packet (len=1448)
  223 1.706631353  10.6.15.145 → 192.168.1.16 SSH 1514 Server: Encrypted packet (len=1448)
  224 1.706640429 192.168.1.16 → 10.6.15.145  TCP 66 52104 → 22 [ACK] Seq=5937 Ack=77401 Win=6157 Len=0 TSval=1616379 TSecr=24430905
  225 1.707270413  10.6.15.145 → 192.168.1.16 SSH 1514 Server: Encrypted packet (len=1448)
  226 1.707479704  10.6.15.145 → 192.168.1.16 SSH 1514 Server: Encrypted packet (len=1448)
  227 1.707487816 192.168.1.16 → 10.6.15.145  TCP 66 52104 → 22 [ACK] Seq=5937 Ack=80297 Win=6157 Len=0 TSval=1616379 TSecr=24430906
  228 1.709043530  10.6.15.145 → 192.168.1.16 SSH 1514 Server: Encrypted packet (len=1448)
  229 1.709245473  10.6.15.145 → 192.168.1.16 SSH 1514 Server: Encrypted packet (len=1448)
  230 1.709254751 192.168.1.16 → 10.6.15.145  TCP 66 52104 → 22 [ACK] Seq=5937 Ack=83193 Win=6157 Len=0 TSval=1616379 TSecr=24430906
  231 1.709686200  10.6.15.145 → 192.168.1.16 SSH 418 Server: Encrypted packet (len=352)
  232 1.719735532  10.6.15.145 → 192.168.1.16 SSH 382 Server: Encrypted packet (len=316)
  233 1.719816125 192.168.1.16 → 10.6.15.145  TCP 66 52104 → 22 [ACK] Seq=5937 Ack=83861 Win=6157 Len=0 TSval=1616382 TSecr=24430906
  234 1.721160087  10.6.15.145 → 192.168.1.16 SSH 366 Server: Encrypted packet (len=300)
  235 1.725795871  10.6.15.145 → 192.168.1.16 SSH 278 Server: Encrypted packet (len=212)
  236 1.725871014 192.168.1.16 → 10.6.15.145  TCP 66 52104 → 22 [ACK] Seq=5937 Ack=84373 Win=6157 Len=0 TSval=1616383 TSecr=24430909
  237 1.742780657  10.6.15.145 → 192.168.1.16 SSH 1514 Server: Encrypted packet (len=1448)
  238 1.742795667  10.6.15.145 → 192.168.1.16 SSH 110 Server: Encrypted packet (len=44)
  239 1.742802152 192.168.1.16 → 10.6.15.145  TCP 66 52104 → 22 [ACK] Seq=5937 Ack=85865 Win=6157 Len=0 TSval=1616388 TSecr=24430915
  240 1.764081801  10.6.15.145 → 192.168.1.16 SSH 1514 Server: Encrypted packet (len=1448)
  241 1.764097685  10.6.15.145 → 192.168.1.16 SSH 110 Server: Encrypted packet (len=44)
  242 1.764114362 192.168.1.16 → 10.6.15.145  TCP 66 52104 → 22 [ACK] Seq=5937 Ack=87357 Win=6157 Len=0 TSval=1616393 TSecr=24430919
  243 1.764312808  10.6.15.145 → 192.168.1.16 SSH 1514 Server: Encrypted packet (len=1448)
  244 1.764527144  10.6.15.145 → 192.168.1.16 SSH 1514 Server: Encrypted packet (len=1448)
  245 1.764533512 192.168.1.16 → 10.6.15.145  TCP 66 52104 → 22 [ACK] Seq=5937 Ack=90253 Win=6157 Len=0 TSval=1616393 TSecr=24430919
  246 1.764546366  10.6.15.145 → 192.168.1.16 SSH 110 Server: Encrypted packet (len=44)
  247 1.766831690  10.6.15.145 → 192.168.1.16 SSH 1514 Server: Encrypted packet (len=1448)
  248 1.766849157 192.168.1.16 → 10.6.15.145  TCP 66 52104 → 22 [ACK] Seq=5937 Ack=91745 Win=6157 Len=0 TSval=1616394 TSecr=24430919
  249 1.766877078  10.6.15.145 → 192.168.1.16 SSH 110 Server: Encrypted packet (len=44)
  250 1.785025162 192.168.1.16 → 10.6.15.145  SSH 1294 Client: Encrypted packet (len=1228)
  251 1.785595428  10.6.15.145 → 192.168.1.16 SSH 1514 Server: Encrypted packet (len=1448)
  252 1.785610265  10.6.15.145 → 192.168.1.16 SSH 110 Server: Encrypted packet (len=44)
  253 1.785617546 192.168.1.16 → 10.6.15.145  TCP 66 52104 → 22 [ACK] Seq=7165 Ack=93281 Win=6157 Len=0 TSval=1616398 TSecr=24430925
  254 1.785821702  10.6.15.145 → 192.168.1.16 SSH 1514 Server: Encrypted packet (len=1448)
  255 1.786036681  10.6.15.145 → 192.168.1.16 SSH 1514 Server: Encrypted packet (len=1448)
  256 1.786042146 192.168.1.16 → 10.6.15.145  TCP 66 52104 → 22 [ACK] Seq=7165 Ack=96177 Win=6157 Len=0 TSval=1616399 TSecr=24430925
  257 1.788496350  10.6.15.145 → 192.168.1.16 SSH 1514 Server: Encrypted packet (len=1448)
  258 1.788699823  10.6.15.145 → 192.168.1.16 SSH 1514 Server: Encrypted packet (len=1448)
  259 1.788704907 192.168.1.16 → 10.6.15.145  TCP 66 52104 → 22 [ACK] Seq=7165 Ack=99073 Win=6157 Len=0 TSval=1616399 TSecr=24430926
  260 1.789778392  10.6.15.145 → 192.168.1.16 SSH 1514 Server: Encrypted packet (len=1448)
  261 1.789979598  10.6.15.145 → 192.168.1.16 SSH 1514 Server: Encrypted packet (len=1448)
  262 1.789984359 192.168.1.16 → 10.6.15.145  TCP 66 52104 → 22 [ACK] Seq=7165 Ack=101969 Win=6157 Len=0 TSval=1616399 TSecr=24430926
  263 1.790206922  10.6.15.145 → 192.168.1.16 SSH 1514 Server: Encrypted packet (len=1448)
  264 1.790884855  10.6.15.145 → 192.168.1.16 SSH 1514 Server: Encrypted packet (len=1448)
  265 1.790889583 192.168.1.16 → 10.6.15.145  TCP 66 52104 → 22 [ACK] Seq=7165 Ack=104865 Win=6157 Len=0 TSval=1616400 TSecr=24430926
  266 1.791098832  10.6.15.145 → 192.168.1.16 SSH 1514 Server: Encrypted packet (len=1448)
  267 1.791975980  10.6.15.145 → 192.168.1.16 SSH 1514 Server: Encrypted packet (len=1448)
  268 1.791985608 192.168.1.16 → 10.6.15.145  TCP 66 52104 → 22 [ACK] Seq=7165 Ack=107761 Win=6157 Len=0 TSval=1616400 TSecr=24430927
  269 1.792188024  10.6.15.145 → 192.168.1.16 SSH 1514 Server: Encrypted packet (len=1448)
  270 1.793288360  10.6.15.145 → 192.168.1.16 SSH 1514 Server: Encrypted packet (len=1448)
  271 1.793296851 192.168.1.16 → 10.6.15.145  TCP 66 52104 → 22 [ACK] Seq=7165 Ack=110657 Win=6157 Len=0 TSval=1616400 TSecr=24430927
  272 1.793507714  10.6.15.145 → 192.168.1.16 SSH 1514 Server: Encrypted packet (len=1448)
  273 1.794343276  10.6.15.145 → 192.168.1.16 SSH 1514 Server: Encrypted packet (len=1448)
  274 1.794353036 192.168.1.16 → 10.6.15.145  TCP 66 52104 → 22 [ACK] Seq=7165 Ack=113553 Win=6157 Len=0 TSval=1616401 TSecr=24430927
  275 1.794918717  10.6.15.145 → 192.168.1.16 SSH 1514 Server: Encrypted packet (len=1448)
  276 1.795561488  10.6.15.145 → 192.168.1.16 SSH 1514 Server: Encrypted packet (len=1448)
  277 1.795569913 192.168.1.16 → 10.6.15.145  TCP 66 52104 → 22 [ACK] Seq=7165 Ack=116449 Win=6157 Len=0 TSval=1616401 TSecr=24430928
  278 1.795784532  10.6.15.145 → 192.168.1.16 SSH 1514 Server: Encrypted packet (len=1448)
  279 1.796614670  10.6.15.145 → 192.168.1.16 SSH 1514 Server: Encrypted packet (len=1448)
  280 1.796622985 192.168.1.16 → 10.6.15.145  TCP 66 52104 → 22 [ACK] Seq=7165 Ack=119345 Win=6157 Len=0 TSval=1616401 TSecr=24430928
  281 1.796828795  10.6.15.145 → 192.168.1.16 SSH 1514 Server: Encrypted packet (len=1448)
  282 1.797997861  10.6.15.145 → 192.168.1.16 SSH 1514 Server: Encrypted packet (len=1448)
  283 1.798018127 192.168.1.16 → 10.6.15.145  TCP 66 52104 → 22 [ACK] Seq=7165 Ack=122241 Win=6157 Len=0 TSval=1616401 TSecr=24430928
  284 1.798205926  10.6.15.145 → 192.168.1.16 SSH 1514 Server: Encrypted packet (len=1448)
  285 1.799015305  10.6.15.145 → 192.168.1.16 SSH 1514 Server: Encrypted packet (len=1448)
  286 1.799023805 192.168.1.16 → 10.6.15.145  TCP 66 52104 → 22 [ACK] Seq=7165 Ack=125137 Win=6157 Len=0 TSval=1616402 TSecr=24430928
  287 1.799228918  10.6.15.145 → 192.168.1.16 SSH 1514 Server: Encrypted packet (len=1448)
  288 1.800341463  10.6.15.145 → 192.168.1.16 SSH 1514 Server: Encrypted packet (len=1448)
  289 1.800350430 192.168.1.16 → 10.6.15.145  TCP 66 52104 → 22 [ACK] Seq=7165 Ack=128033 Win=6157 Len=0 TSval=1616402 TSecr=24430929
  290 1.800539611  10.6.15.145 → 192.168.1.16 SSH 1514 Server: Encrypted packet (len=1448)
  291 1.801109612  10.6.15.145 → 192.168.1.16 SSH 1034 Server: Encrypted packet (len=968)
  292 1.801115713 192.168.1.16 → 10.6.15.145  TCP 66 52104 → 22 [ACK] Seq=7165 Ack=130449 Win=6157 Len=0 TSval=1616402 TSecr=24430929
  293 1.850110950  10.6.15.145 → 192.168.1.16 SSH 1514 Server: Encrypted packet (len=1448)
  294 1.850126797  10.6.15.145 → 192.168.1.16 SSH 110 Server: Encrypted packet (len=44)
  295 1.850134634 192.168.1.16 → 10.6.15.145  TCP 66 52104 → 22 [ACK] Seq=7165 Ack=131941 Win=6157 Len=0 TSval=1616415 TSecr=24430941
  296 1.850712375  10.6.15.145 → 192.168.1.16 SSH 1514 Server: Encrypted packet (len=1448)
  297 1.850924673  10.6.15.145 → 192.168.1.16 SSH 1514 Server: Encrypted packet (len=1448)
  298 1.850931231 192.168.1.16 → 10.6.15.145  TCP 66 52104 → 22 [ACK] Seq=7165 Ack=134837 Win=6157 Len=0 TSval=1616415 TSecr=24430941
  299 1.850940433  10.6.15.145 → 192.168.1.16 SSH 110 Server: Encrypted packet (len=44)
  300 1.853124715  10.6.15.145 → 192.168.1.16 SSH 1514 Server: Encrypted packet (len=1448)
  301 1.853131320 192.168.1.16 → 10.6.15.145  TCP 66 52104 → 22 [ACK] Seq=7165 Ack=136329 Win=6157 Len=0 TSval=1616415 TSecr=24430941
  302 1.853332252  10.6.15.145 → 192.168.1.16 SSH 1514 Server: Encrypted packet (len=1448)
  303 1.854644972  10.6.15.145 → 192.168.1.16 SSH 1514 Server: Encrypted packet (len=1448)
  304 1.854651919 192.168.1.16 → 10.6.15.145  TCP 66 52104 → 22 [ACK] Seq=7165 Ack=139225 Win=6157 Len=0 TSval=1616416 TSecr=24430942
  305 1.854662130  10.6.15.145 → 192.168.1.16 SSH 154 Server: Encrypted packet (len=88)
  306 1.854789283 192.168.1.16 → 10.6.15.145  SSH 102 Client: Encrypted packet (len=36)
  307 1.855340006  10.6.15.145 → 192.168.1.16 SSH 470 Server: Encrypted packet (len=404)
  308 1.870803730  10.6.15.145 → 192.168.1.16 SSH 1514 Server: Encrypted packet (len=1448)
  309 1.870828087 192.168.1.16 → 10.6.15.145  TCP 66 52104 → 22 [ACK] Seq=7201 Ack=141165 Win=6157 Len=0 TSval=1616420 TSecr=24430943
  310 1.871005011  10.6.15.145 → 192.168.1.16 SSH 1514 Server: Encrypted packet (len=1448)
  311 1.871457370  10.6.15.145 → 192.168.1.16 SSH 110 Server: Encrypted packet (len=44)
  312 1.871466516 192.168.1.16 → 10.6.15.145  TCP 66 52104 → 22 [ACK] Seq=7201 Ack=142657 Win=6157 Len=0 TSval=1616420 TSecr=24430947
  313 1.873384600  10.6.15.145 → 192.168.1.16 SSH 1514 Server: Encrypted packet (len=1448)
  314 1.873435387  10.6.15.145 → 192.168.1.16 SSH 494 Server: Encrypted packet (len=428)
  315 1.873441234 192.168.1.16 → 10.6.15.145  TCP 66 52104 → 22 [ACK] Seq=7201 Ack=144533 Win=6157 Len=0 TSval=1616420 TSecr=24430947
  316 1.926575378 192.168.1.16 → 13.126.27.131 NTP 90 NTP Version 4, client
  317 2.139820187 192.168.1.16 → 10.6.15.145  SSH 1246 Client: Encrypted packet (len=1180)
  318 2.142353183  10.6.15.145 → 192.168.1.16 SSH 150 Server: Encrypted packet (len=84)
  319 2.142569585  10.6.15.145 → 192.168.1.16 SSH 1514 Server: Encrypted packet (len=1448)
  320 2.142580084 192.168.1.16 → 10.6.15.145  TCP 66 52104 → 22 [ACK] Seq=8381 Ack=146065 Win=6157 Len=0 TSval=1616488 TSecr=24430998
  321 2.142597318  10.6.15.145 → 192.168.1.16 SSH 110 Server: Encrypted packet (len=44)
  322 2.142718231  10.6.15.145 → 192.168.1.16 TCP 110 [TCP Retransmission] 22 → 52104 [PSH, ACK] Seq=146065 Ack=7201 Win=1452 Len=44 TSval=24431003 TSecr=1616420
  323 2.142725157 192.168.1.16 → 10.6.15.145  TCP 78 52104 → 22 [ACK] Seq=8381 Ack=146109 Win=6157 Len=0 TSval=1616488 TSecr=24431003 SLE=146065 SRE=146109
  324 2.149132009 192.168.1.16 → 10.6.15.145  SSH 1286 Client: Encrypted packet (len=1220)
  325 2.149596166 192.168.1.16 → 10.6.15.145  SSH 1286 Client: Encrypted packet (len=1220)
  326 2.151048052  10.6.15.145 → 192.168.1.16 TCP 66 22 → 52104 [ACK] Seq=146109 Ack=9601 Win=1452 Len=0 TSval=24431017 TSecr=1616487
  327 2.157341093 192.168.1.16 → 10.6.15.145  SSH 1286 Client: Encrypted packet (len=1220)
  328 2.157803333 192.168.1.16 → 10.6.15.145  SSH 1286 Client: Encrypted packet (len=1220)
  329 2.159108058  10.6.15.145 → 192.168.1.16 TCP 66 22 → 52104 [ACK] Seq=146109 Ack=12041 Win=1452 Len=0 TSval=24431019 TSecr=1616489
  330 2.165741542 192.168.1.16 → 10.6.15.145  SSH 1286 Client: Encrypted packet (len=1220)
  331 2.166208595 192.168.1.16 → 10.6.15.145  SSH 1286 Client: Encrypted packet (len=1220)
  332 2.167496533  10.6.15.145 → 192.168.1.16 TCP 66 22 → 52104 [ACK] Seq=146109 Ack=14481 Win=1452 Len=0 TSval=24431021 TSecr=1616491
  333 2.174665344 192.168.1.16 → 10.6.15.145  SSH 1286 Client: Encrypted packet (len=1220)
  334 2.175430927 192.168.1.16 → 10.6.15.145  SSH 1286 Client: Encrypted packet (len=1220)
  335 2.178374030  10.6.15.145 → 192.168.1.16 TCP 66 22 → 52104 [ACK] Seq=146109 Ack=16921 Win=1452 Len=0 TSval=24431023 TSecr=1616494
  336 2.199363331 192.168.1.16 → 10.6.15.145  SSH 1246 Client: Encrypted packet (len=1180)
  337 2.204552012  10.6.15.145 → 192.168.1.16 TCP 66 22 → 52104 [ACK] Seq=146109 Ack=19321 Win=1452 Len=0 TSval=24431029 TSecr=1616496
  338 2.212939519 192.168.1.16 → 10.6.15.145  SSH 1246 Client: Encrypted packet (len=1180)
  339 2.222500750 192.168.1.16 → 10.6.15.145  SSH 1246 Client: Encrypted packet (len=1180)
  340 2.231496458  10.6.15.145 → 192.168.1.16 TCP 66 22 → 52104 [ACK] Seq=146109 Ack=21681 Win=1452 Len=0 TSval=24431037 TSecr=1616505
  341 2.233210420 192.168.1.16 → 10.6.15.145  SSH 1246 Client: Encrypted packet (len=1180)
  342 2.275400505  10.6.15.145 → 192.168.1.16 TCP 66 22 → 52104 [ACK] Seq=146109 Ack=22861 Win=1452 Len=0 TSval=24431048 TSecr=1616510
  343 2.369271432  10.6.15.145 → 192.168.1.16 SSH 174 Server: Encrypted packet (len=108)
  344 2.391081943 192.168.1.16 → 10.6.15.145  SSH 102 Client: Encrypted packet (len=36)
  345 2.401348407  10.6.15.145 → 192.168.1.16 TCP 66 22 → 52104 [ACK] Seq=146217 Ack=22897 Win=1452 Len=0 TSval=24431079 TSecr=1616550
  346 2.432504429  10.6.15.145 → 192.168.1.16 SSH 110 Server: Encrypted packet (len=44)
  347 2.432857186 192.168.1.16 → 10.6.15.145  SSH 158 Client: Encrypted packet (len=92)
  348 2.433376497  10.6.15.145 → 192.168.1.16 SSH 1514 Server: Encrypted packet (len=1448)
  349 2.433384116  10.6.15.145 → 192.168.1.16 SSH 190 Server: Encrypted packet (len=124)
  350 2.433389622 192.168.1.16 → 10.6.15.145  TCP 66 52104 → 22 [ACK] Seq=22989 Ack=147833 Win=6157 Len=0 TSval=1616560 TSecr=24431087
  351 2.461983760  10.6.15.145 → 192.168.1.16 SSH 246 Server: Encrypted packet (len=180)
  352 2.462645100 192.168.1.16 → 10.6.15.145  SSH 134 Client: Encrypted packet (len=68)
  353 2.463195591 192.168.1.16 → 10.6.15.145  SSH 654 Client: Encrypted packet (len=588)
  354 2.463627294 192.168.1.16 → 10.6.15.145  SSH 1514 Client: Encrypted packet (len=1448)
  355 2.464841504  10.6.15.145 → 192.168.1.16 TCP 66 22 → 52104 [ACK] Seq=148013 Ack=23645 Win=1452 Len=0 TSval=24431095 TSecr=1616568
  356 2.464853734 192.168.1.16 → 10.6.15.145  SSH 1270 Client: Encrypted packet (len=1204)
  357 2.467024191  10.6.15.145 → 192.168.1.16 TCP 66 22 → 52104 [ACK] Seq=148013 Ack=26297 Win=1452 Len=0 TSval=24431096 TSecr=1616568
  358 2.493342907  10.6.15.145 → 192.168.1.16 SSH 446 Server: Encrypted packet (len=380)
  359 2.534025714 192.168.1.16 → 10.6.15.145  TCP 66 52104 → 22 [ACK] Seq=26297 Ack=148393 Win=6157 Len=0 TSval=1616586 TSecr=24431102
  360 2.666825421 192.168.1.16 → 10.6.15.145  SSH 190 Client: Encrypted packet (len=124)
  361 2.667812296 192.168.1.16 → 10.6.15.145  SSH 182 Client: Encrypted packet (len=116)
  362 2.668677379  10.6.15.145 → 192.168.1.16 SSH 1514 Server: Encrypted packet (len=1448)
  363 2.668696126 192.168.1.16 → 10.6.15.145  TCP 66 52104 → 22 [ACK] Seq=26537 Ack=149841 Win=6157 Len=0 TSval=1616619 TSecr=24431143
  364 2.668705187  10.6.15.145 → 192.168.1.16 SSH 110 Server: Encrypted packet (len=44)
  365 2.668710799 192.168.1.16 → 10.6.15.145  TCP 66 52104 → 22 [ACK] Seq=26537 Ack=149885 Win=6157 Len=0 TSval=1616619 TSecr=24431143
  366 2.668892937  10.6.15.145 → 192.168.1.16 SSH 1514 Server: Encrypted packet (len=1448)
  367 2.668899864 192.168.1.16 → 10.6.15.145  TCP 66 52104 → 22 [ACK] Seq=26537 Ack=151333 Win=6157 Len=0 TSval=1616619 TSecr=24431143
  368 2.669161187  10.6.15.145 → 192.168.1.16 SSH 110 Server: Encrypted packet (len=44)
  369 2.669165655 192.168.1.16 → 10.6.15.145  TCP 66 52104 → 22 [ACK] Seq=26537 Ack=151377 Win=6157 Len=0 TSval=1616619 TSecr=24431143
  370 2.669728072  10.6.15.145 → 192.168.1.16 TCP 66 22 → 52104 [ACK] Seq=151377 Ack=26537 Win=1452 Len=0 TSval=24431147 TSecr=1616619
  371 2.670725343  10.6.15.145 → 192.168.1.16 SSH 306 Server: Encrypted packet (len=240)
  372 2.670743272 192.168.1.16 → 10.6.15.145  TCP 66 52104 → 22 [ACK] Seq=26537 Ack=151617 Win=6157 Len=0 TSval=1616620 TSecr=24431147
  373 2.693739225 192.168.1.16 → 10.6.15.145  SSH 1514 Client: Encrypted packet (len=1448)
  374 2.694274090 192.168.1.16 → 10.6.15.145  SSH 414 Client: Encrypted packet (len=348)
  375 2.695909387  10.6.15.145 → 192.168.1.16 TCP 66 22 → 52104 [ACK] Seq=151617 Ack=28333 Win=1452 Len=0 TSval=24431153 TSecr=1616625
  376 2.705795111 192.168.1.16 → 10.6.15.145  SSH 230 Client: Encrypted packet (len=164)
  377 2.721146915  10.6.15.145 → 192.168.1.16 SSH 1514 Server: Encrypted packet (len=1448)
  378 2.721329670  10.6.15.145 → 192.168.1.16 SSH 1514 Server: Encrypted packet (len=1448)
  379 2.721337992 192.168.1.16 → 10.6.15.145  TCP 66 52104 → 22 [ACK] Seq=28497 Ack=154513 Win=6157 Len=0 TSval=1616632 TSecr=24431159
  380 2.721462640  10.6.15.145 → 192.168.1.16 SSH 110 Server: Encrypted packet (len=44)
  381 2.746213409  10.6.15.145 → 192.168.1.16 SSH 1514 Server: Encrypted packet (len=1448)
  382 2.746223903  10.6.15.145 → 192.168.1.16 SSH 358 Server: Encrypted packet (len=292)
  383 2.746223371 192.168.1.16 → 10.6.15.145  SSH 102 Client: Encrypted packet (len=36)
  384 2.746245899 192.168.1.16 → 10.6.15.145  TCP 66 52104 → 22 [ACK] Seq=28533 Ack=156297 Win=6157 Len=0 TSval=1616639 TSecr=24431165
  385 2.746840032 192.168.1.16 → 10.6.15.145  SSH 110 Client: Encrypted packet (len=44)
  386 2.748614437  10.6.15.145 → 192.168.1.16 TCP 66 22 → 52104 [ACK] Seq=156297 Ack=28577 Win=1452 Len=0 TSval=24431166 TSecr=1616639
  387 2.763325111 192.168.1.16 → 10.6.15.145  SSH 254 Client: Encrypted packet (len=188)
  388 2.783961731  10.6.15.145 → 192.168.1.16 SSH 138 Server: Encrypted packet (len=72)
  389 2.784088815  10.6.15.145 → 192.168.1.16 SSH 110 Server: Encrypted packet (len=44)
  390 2.784207589 192.168.1.16 → 10.6.15.145  TCP 66 52104 → 22 [ACK] Seq=28765 Ack=156413 Win=6157 Len=0 TSval=1616648 TSecr=24431175
  391 2.784229003 192.168.1.16 → 10.6.15.145  SSH 102 Client: Encrypted packet (len=36)
  392 2.785395301 192.168.1.16 → 10.6.15.145  SSH 422 Client: Encrypted packet (len=356)
  393 2.789640252 192.168.1.16 → 10.6.15.145  SSH 602 Client: Encrypted packet (len=536)
  394 2.807533512  10.6.15.145 → 192.168.1.16 TCP 78 [TCP Dup ACK 386#1] 22 → 52104 [ACK] Seq=156413 Ack=28577 Win=1452 Len=0 TSval=24431181 TSecr=1616639 SLE=28765 SRE=28801
  395 2.807561776 192.168.1.16 → 10.6.15.145  SSH 1350 Client: Encrypted packet (len=1284)
  396 2.807580247  10.6.15.145 → 192.168.1.16 TCP 78 [TCP Dup ACK 386#2] 22 → 52104 [ACK] Seq=156413 Ack=28577 Win=1452 Len=0 TSval=24431181 TSecr=1616639 SLE=28765 SRE=29157
  397 2.807586736  10.6.15.145 → 192.168.1.16 TCP 78 [TCP Dup ACK 386#3] 22 → 52104 [ACK] Seq=156413 Ack=28577 Win=1452 Len=0 TSval=24431181 TSecr=1616639 SLE=28765 SRE=29693
  398 2.807592035 192.168.1.16 → 10.6.15.145  SSH 254 Client: [TCP Fast Retransmission] , Encrypted packet (len=188)
  399 2.810252458  10.6.15.145 → 192.168.1.16 TCP 78 [TCP Dup ACK 386#4] 22 → 52104 [ACK] Seq=156413 Ack=28577 Win=1452 Len=0 TSval=24431181 TSecr=1616639 SLE=28765 SRE=30977
  400 2.810274916  10.6.15.145 → 192.168.1.16 TCP 66 22 → 52104 [ACK] Seq=156413 Ack=30977 Win=1434 Len=0 TSval=24431181 TSecr=1616654
  401 2.810747940 192.168.1.16 → 10.6.15.145  SSH 1494 Client: Encrypted packet (len=1428)
  402 2.813350330  10.6.15.145 → 192.168.1.16 TCP 66 22 → 52104 [ACK] Seq=156413 Ack=32405 Win=1452 Len=0 TSval=24431182 TSecr=1616655
  403 2.847198744  10.6.15.145 → 192.168.1.16 SSH 150 Server: Encrypted packet (len=84)
  404 2.851617213  10.6.15.145 → 192.168.1.16 SSH 1514 Server: Encrypted packet (len=1448)
  405 2.851638573 192.168.1.16 → 10.6.15.145  TCP 66 52104 → 22 [ACK] Seq=32405 Ack=157945 Win=6157 Len=0 TSval=1616665 TSecr=24431191
  406 2.851787759  10.6.15.145 → 192.168.1.16 SSH 1462 Server: Encrypted packet (len=1396)
  407 2.852714840 192.168.1.16 → 10.6.15.145  SSH 206 Client: Encrypted packet (len=140)
  408 2.854068259 192.168.1.16 → 10.6.15.145  SSH 590 Client: Encrypted packet (len=524)
  409 2.854504014  10.6.15.145 → 192.168.1.16 SSH 382 Server: Encrypted packet (len=316)
  410 2.870650773 192.168.1.16 → 10.6.15.145  SSH 1514 Client: Encrypted packet (len=1448)
  411 2.871193494 192.168.1.16 → 10.6.15.145  SSH 514 Client: Encrypted packet (len=448)
  412 2.873275200  10.6.15.145 → 192.168.1.16 TCP 66 22 → 52104 [ACK] Seq=159657 Ack=34517 Win=1452 Len=0 TSval=24431197 TSecr=1616666
  413 2.873305751 192.168.1.16 → 10.6.15.145  SSH 1514 Client: Encrypted packet (len=1448)
  414 2.873320521 192.168.1.16 → 10.6.15.145  SSH 830 Client: Encrypted packet (len=764)
  415 2.874452156  10.6.15.145 → 192.168.1.16 SSH 1514 Server: Encrypted packet (len=1448)
  416 2.874583471  10.6.15.145 → 192.168.1.16 SSH 1166 Server: Encrypted packet (len=1100)
  417 2.874594089 192.168.1.16 → 10.6.15.145  TCP 66 52104 → 22 [ACK] Seq=37177 Ack=162205 Win=6157 Len=0 TSval=1616671 TSecr=24431197
  418 2.876277172  10.6.15.145 → 192.168.1.16 TCP 66 22 → 52104 [ACK] Seq=162205 Ack=37177 Win=1452 Len=0 TSval=24431198 TSecr=1616670
  419 2.878686750  10.6.15.145 → 192.168.1.16 SSH 1514 Server: Encrypted packet (len=1448)
  420 2.878714906  10.6.15.145 → 192.168.1.16 SSH 390 Server: Encrypted packet (len=324)
  421 2.878723942 192.168.1.16 → 10.6.15.145  TCP 66 52104 → 22 [ACK] Seq=37177 Ack=163977 Win=6157 Len=0 TSval=1616672 TSecr=24431199
  422 2.891724495  10.6.15.145 → 192.168.1.16 SSH 366 Server: Encrypted packet (len=300)
  423 2.893751017  10.6.15.145 → 192.168.1.16 SSH 1514 Server: Encrypted packet (len=1448)
  424 2.893760105 192.168.1.16 → 10.6.15.145  TCP 66 52104 → 22 [ACK] Seq=37177 Ack=165725 Win=6157 Len=0 TSval=1616675 TSecr=24431202
  425 2.893772835  10.6.15.145 → 192.168.1.16 SSH 150 Server: Encrypted packet (len=84)
  426 2.910047797  10.6.15.145 → 192.168.1.16 SSH 1514 Server: Encrypted packet (len=1448)
  427 2.910072081 192.168.1.16 → 10.6.15.145  TCP 66 52104 → 22 [ACK] Seq=37177 Ack=167257 Win=6157 Len=0 TSval=1616680 TSecr=24431202
  428 2.910193099  10.6.15.145 → 192.168.1.16 SSH 1278 Server: Encrypted packet (len=1212)
  429 2.913920725  10.6.15.145 → 192.168.1.16 SSH 1514 Server: Encrypted packet (len=1448)
  430 2.913935352 192.168.1.16 → 10.6.15.145  TCP 66 52104 → 22 [ACK] Seq=37177 Ack=169917 Win=6157 Len=0 TSval=1616680 TSecr=24431206
  431 2.914023815  10.6.15.145 → 192.168.1.16 SSH 966 Server: Encrypted packet (len=900)
  432 2.916317193  10.6.15.145 → 192.168.1.16 SSH 1514 Server: Encrypted packet (len=1448)
  433 2.916332319 192.168.1.16 → 10.6.15.145  TCP 66 52104 → 22 [ACK] Seq=37177 Ack=172265 Win=6157 Len=0 TSval=1616681 TSecr=24431207
  434 2.916346499  10.6.15.145 → 192.168.1.16 SSH 190 Server: Encrypted packet (len=124)
  435 2.924099277 192.168.1.16 → 10.6.15.145  SSH 102 Client: Encrypted packet (len=36)
  436 2.924546990 192.168.1.16 → 10.6.15.145  SSH 102 Client: Encrypted packet (len=36)
  437 2.925961893  10.6.15.145 → 192.168.1.16 TCP 66 22 → 52104 [ACK] Seq=172389 Ack=37249 Win=1452 Len=0 TSval=24431211 TSecr=1616683
  438 2.943761641  10.6.15.145 → 192.168.1.16 SSH 1514 Server: Encrypted packet (len=1448)
  439 2.943939345  10.6.15.145 → 192.168.1.16 SSH 1514 Server: Encrypted packet (len=1448)
  440 2.943947514 192.168.1.16 → 10.6.15.145  TCP 66 52104 → 22 [ACK] Seq=37249 Ack=175285 Win=6157 Len=0 TSval=1616688 TSecr=24431215
  441 2.943960247  10.6.15.145 → 192.168.1.16 SSH 110 Server: Encrypted packet (len=44)
  442 2.956927220  10.6.15.145 → 192.168.1.16 SSH 1514 Server: Encrypted packet (len=1448)
  443 2.956943185 192.168.1.16 → 10.6.15.145  TCP 66 52104 → 22 [ACK] Seq=37249 Ack=176777 Win=6157 Len=0 TSval=1616691 TSecr=24431215
  444 2.956956656  10.6.15.145 → 192.168.1.16 SSH 302 Server: Encrypted packet (len=236)
  445 2.961427212  10.6.15.145 → 192.168.1.16 SSH 138 Server: Encrypted packet (len=72)
  446 2.961502823 192.168.1.16 → 10.6.15.145  TCP 66 52104 → 22 [ACK] Seq=37249 Ack=177085 Win=6157 Len=0 TSval=1616692 TSecr=24431218
  447 2.961690784 192.168.1.16 → 10.6.15.145  SSH 102 Client: Encrypted packet (len=36)
  448 2.962587671 192.168.1.16 → 10.6.15.145  SSH 262 Client: Encrypted packet (len=196)
  449 2.962694168  10.6.15.145 → 192.168.1.16 SSH 110 Server: Encrypted packet (len=44)
  450 2.962983673 192.168.1.16 → 10.6.15.145  SSH 422 Client: Encrypted packet (len=356)
  451 2.964370293  10.6.15.145 → 192.168.1.16 TCP 66 22 → 52104 [ACK] Seq=177129 Ack=37481 Win=1452 Len=0 TSval=24431220 TSecr=1616692
  452 3.001770515  10.6.15.145 → 192.168.1.16 TCP 66 22 → 52104 [ACK] Seq=177129 Ack=37837 Win=1452 Len=0 TSval=24431230 TSecr=1616693
  453 3.007262579  10.6.15.145 → 192.168.1.16 SSH 1514 Server: Encrypted packet (len=1448)
  454 3.007444323  10.6.15.145 → 192.168.1.16 SSH 1514 Server: Encrypted packet (len=1448)
  455 3.007450719 192.168.1.16 → 10.6.15.145  TCP 66 52104 → 22 [ACK] Seq=37837 Ack=180025 Win=6157 Len=0 TSval=1616704 TSecr=24431231
  456 3.007593857  10.6.15.145 → 192.168.1.16 SSH 202 Server: Encrypted packet (len=136)
  457 3.007662426  10.6.15.145 → 192.168.1.16 SSH 470 Server: Encrypted packet (len=404)
  458 3.007696656 192.168.1.16 → 10.6.15.145  TCP 66 52104 → 22 [ACK] Seq=37837 Ack=180565 Win=6157 Len=0 TSval=1616704 TSecr=24431231
  459 3.009209488 192.168.1.16 → 10.6.15.145  SSH 206 Client: Encrypted packet (len=140)
  460 3.010656783  10.6.15.145 → 192.168.1.16 TCP 66 22 → 52104 [ACK] Seq=180565 Ack=37977 Win=1452 Len=0 TSval=24431232 TSecr=1616704
  461 3.011836755 192.168.1.16 → 10.6.15.145  SSH 1514 Client: Encrypted packet (len=1448)
  462 3.016445973 192.168.1.16 → 10.6.15.145  SSH 486 Client: Encrypted packet (len=420)
  463 3.018006078  10.6.15.145 → 192.168.1.16 TCP 66 22 → 52104 [ACK] Seq=180565 Ack=39845 Win=1452 Len=0 TSval=24431234 TSecr=1616705
  464 3.048300789  10.6.15.145 → 192.168.1.16 SSH 366 Server: Encrypted packet (len=300)
  465 3.056386236  10.6.15.145 → 192.168.1.16 SSH 1514 Server: Encrypted packet (len=1448)
  466 3.056406657 192.168.1.16 → 10.6.15.145  TCP 66 52104 → 22 [ACK] Seq=39845 Ack=182313 Win=6157 Len=0 TSval=1616716 TSecr=24431241
  467 3.056426710  10.6.15.145 → 192.168.1.16 SSH 446 Server: Encrypted packet (len=380)
  468 3.061187518  10.6.15.145 → 192.168.1.16 SSH 1514 Server: Encrypted packet (len=1448)
  469 3.061208127 192.168.1.16 → 10.6.15.145  TCP 66 52104 → 22 [ACK] Seq=39845 Ack=184141 Win=6157 Len=0 TSval=1616717 TSecr=24431243
  470 3.061284205  10.6.15.145 → 192.168.1.16 SSH 966 Server: Encrypted packet (len=900)
  471 3.068503479  10.6.15.145 → 192.168.1.16 SSH 182 Server: Encrypted packet (len=116)
  472 3.068582270 192.168.1.16 → 10.6.15.145  TCP 66 52104 → 22 [ACK] Seq=39845 Ack=185157 Win=6157 Len=0 TSval=1616719 TSecr=24431244
  473 3.070099638  10.6.15.145 → 192.168.1.16 SSH 166 Server: Encrypted packet (len=100)
  474 3.076547823 192.168.1.16 → 10.6.15.145  SSH 102 Client: Encrypted packet (len=36)
  475 3.077007200 192.168.1.16 → 10.6.15.145  SSH 102 Client: Encrypted packet (len=36)
  476 3.077303554 192.168.1.16 → 10.6.15.145  SSH 102 Client: Encrypted packet (len=36)
  477 3.078209740  10.6.15.145 → 192.168.1.16 TCP 66 22 → 52104 [ACK] Seq=185257 Ack=39917 Win=1452 Len=0 TSval=24431249 TSecr=1616721
  478 3.078627827 192.168.1.16 → 10.6.15.145  SSH 1514 Client: Encrypted packet (len=1448)
  479 3.079133213 192.168.1.16 → 10.6.15.145  SSH 778 Client: Encrypted packet (len=712)
  480 3.080545106  10.6.15.145 → 192.168.1.16 TCP 66 22 → 52104 [ACK] Seq=185257 Ack=41401 Win=1452 Len=0 TSval=24431249 TSecr=1616721
  481 3.106384845  10.6.15.145 → 192.168.1.16 SSH 134 Server: Encrypted packet (len=68)
  482 3.106405172  10.6.15.145 → 192.168.1.16 SSH 138 Server: Encrypted packet (len=72)
  483 3.106459481 192.168.1.16 → 10.6.15.145  TCP 66 52104 → 22 [ACK] Seq=42113 Ack=185397 Win=6157 Len=0 TSval=1616729 TSecr=24431256
  484 3.106627464 192.168.1.16 → 10.6.15.145  SSH 102 Client: Encrypted packet (len=36)
  485 3.117254443  10.6.15.145 → 192.168.1.16 SSH 182 Server: Encrypted packet (len=116)
  486 3.117656172 192.168.1.16 → 10.6.15.145  SSH 414 Client: Encrypted packet (len=348)
  487 3.117924411 192.168.1.16 → 10.6.15.145  SSH 250 Client: Encrypted packet (len=184)
  488 3.119571647  10.6.15.145 → 192.168.1.16 SSH 1514 Server: Encrypted packet (len=1448)
  489 3.119580898  10.6.15.145 → 192.168.1.16 SSH 486 Server: Encrypted packet (len=420)
  490 3.119585719 192.168.1.16 → 10.6.15.145  TCP 66 52104 → 22 [ACK] Seq=42681 Ack=187381 Win=6157 Len=0 TSval=1616732 TSecr=24431259
  491 3.119741674  10.6.15.145 → 192.168.1.16 SSH 138 Server: Encrypted packet (len=72)
  492 3.119885859 192.168.1.16 → 10.6.15.145  SSH 102 Client: Encrypted packet (len=36)
  493 3.121643219  10.6.15.145 → 192.168.1.16 TCP 66 22 → 52104 [ACK] Seq=187453 Ack=42717 Win=1452 Len=0 TSval=24431259 TSecr=1616731
  494 3.123672411 192.168.1.16 → 10.6.15.145  SSH 1514 Client: Encrypted packet (len=1448)
  495 3.124200258 192.168.1.16 → 10.6.15.145  SSH 670 Client: Encrypted packet (len=604)
  496 3.125739820  10.6.15.145 → 192.168.1.16 TCP 66 22 → 52104 [ACK] Seq=187453 Ack=44769 Win=1452 Len=0 TSval=24431261 TSecr=1616733
  497 3.160969314  10.6.15.145 → 192.168.1.16 SSH 526 Server: Encrypted packet (len=460)
  498 3.160982311  10.6.15.145 → 192.168.1.16 SSH 158 Server: Encrypted packet (len=92)
  499 3.161024594 192.168.1.16 → 10.6.15.145  TCP 66 52104 → 22 [ACK] Seq=44769 Ack=188005 Win=6157 Len=0 TSval=1616742 TSecr=24431269
  500 3.161127854  10.6.15.145 → 192.168.1.16 SSH 118 Server: Encrypted packet (len=52)
  501 3.161195918  10.6.15.145 → 192.168.1.16 SSH 446 Server: Encrypted packet (len=380)
  502 3.161210303 192.168.1.16 → 10.6.15.145  TCP 66 52104 → 22 [ACK] Seq=44769 Ack=188437 Win=6157 Len=0 TSval=1616742 TSecr=24431269
  503 3.162032636 192.168.1.16 → 10.6.15.145  SSH 206 Client: Encrypted packet (len=140)
  504 3.162775670  10.6.15.145 → 192.168.1.16 SSH 590 Server: Encrypted packet (len=524)
  505 3.163872683  10.6.15.145 → 192.168.1.16 SSH 1514 Server: Encrypted packet (len=1448)
  506 3.163879493 192.168.1.16 → 10.6.15.145  TCP 66 52104 → 22 [ACK] Seq=44909 Ack=190409 Win=6157 Len=0 TSval=1616743 TSecr=24431270
  507 3.163908023  10.6.15.145 → 192.168.1.16 SSH 486 Server: Encrypted packet (len=420)
  508 3.164086866 192.168.1.16 → 10.6.15.145  SSH 206 Client: Encrypted packet (len=140)
  509 3.165641426  10.6.15.145 → 192.168.1.16 TCP 66 22 → 52104 [ACK] Seq=190829 Ack=45049 Win=1452 Len=0 TSval=24431270 TSecr=1616743
  510 3.165979038 192.168.1.16 → 10.6.15.145  SSH 206 Client: Encrypted packet (len=140)
  511 3.167772687 192.168.1.16 → 10.6.15.145  SSH 1514 Client: Encrypted packet (len=1448)
  512 3.168126574 192.168.1.16 → 10.6.15.145  SSH 1514 Client: Encrypted packet (len=1448)
  513 3.170562699 192.168.1.16 → 10.6.15.145  SSH 1514 Client: Encrypted packet (len=1448)
  514 3.170579157 192.168.1.16 → 10.6.15.145  SSH 1514 Client: Encrypted packet (len=1448)
  515 3.171566066  10.6.15.145 → 192.168.1.16 TCP 66 22 → 52104 [ACK] Seq=190829 Ack=46637 Win=1452 Len=0 TSval=24431272 TSecr=1616743
  516 3.171589137 192.168.1.16 → 10.6.15.145  SSH 1514 Client: Encrypted packet (len=1448)
  517 3.171601424 192.168.1.16 → 10.6.15.145  SSH 1034 Client: Encrypted packet (len=968)
  518 3.172609722  10.6.15.145 → 192.168.1.16 TCP 66 22 → 52104 [ACK] Seq=190829 Ack=49533 Win=1452 Len=0 TSval=24431272 TSecr=1616744
  519 3.173575725  10.6.15.145 → 192.168.1.16 TCP 66 22 → 52104 [ACK] Seq=190829 Ack=52429 Win=1452 Len=0 TSval=24431272 TSecr=1616745
  520 3.200281926  10.6.15.145 → 192.168.1.16 SSH 366 Server: Encrypted packet (len=300)
  521 3.202135524  10.6.15.145 → 192.168.1.16 SSH 366 Server: Encrypted packet (len=300)
  522 3.203015827 192.168.1.16 → 10.6.15.145  TCP 66 52104 → 22 [ACK] Seq=53397 Ack=191429 Win=6157 Len=0 TSval=1616753 TSecr=24431279
  523 3.204114144  10.6.15.145 → 192.168.1.16 SSH 366 Server: Encrypted packet (len=300)
  524 3.216426919  10.6.15.145 → 192.168.1.16 SSH 1514 Server: Encrypted packet (len=1448)
  525 3.216438148 192.168.1.16 → 10.6.15.145  TCP 66 52104 → 22 [ACK] Seq=53397 Ack=193177 Win=6157 Len=0 TSval=1616756 TSecr=24431280
  526 3.216453661  10.6.15.145 → 192.168.1.16 SSH 486 Server: Encrypted packet (len=420)
  527 3.218712665 192.168.1.16 → 10.6.15.145  SSH 1514 Client: Encrypted packet (len=1448)
  528 3.227696513 192.168.1.16 → 10.6.15.145  SSH 670 Client: Encrypted packet (len=604)
  529 3.232610116 192.168.1.16 → 10.6.15.145  SSH 1514 Client: Encrypted packet (len=1448)
  530 3.234064432  10.6.15.145 → 192.168.1.16 SSH 1514 Server: Encrypted packet (len=1448)
  531 3.234609916 192.168.1.16 → 10.6.15.145  SSH 342 Client: Encrypted packet (len=276)
  532 3.238355521  10.6.15.145 → 192.168.1.16 SSH 1514 Server: Encrypted packet (len=1448)
  533 3.246407793 192.168.1.16 → 10.6.15.145  SSH 382 Client: Encrypted packet (len=316)
  534 3.253536298  10.6.15.145 → 192.168.1.16 SSH 1514 Server: Encrypted packet (len=1448)
  535 3.253549680  10.6.15.145 → 192.168.1.16 TCP 66 22 → 52104 [ACK] Seq=197941 Ack=56897 Win=1452 Len=0 TSval=24431291 TSecr=1616759
  536 3.253871259  10.6.15.145 → 192.168.1.16 SSH 1514 Server: Encrypted packet (len=1448)
  537 3.253880546 192.168.1.16 → 10.6.15.145  TCP 66 52104 → 22 [ACK] Seq=57489 Ack=199389 Win=6157 Len=0 TSval=1616765 TSecr=24431291
  538 3.254056072  10.6.15.145 → 192.168.1.16 SSH 1514 Server: Encrypted packet (len=1448)
  539 3.254214740  10.6.15.145 → 192.168.1.16 SSH 1298 Server: Encrypted packet (len=1232)
  540 3.254222135 192.168.1.16 → 10.6.15.145  TCP 66 52104 → 22 [ACK] Seq=57489 Ack=202069 Win=6157 Len=0 TSval=1616766 TSecr=24431291
  541 3.286821425  10.6.15.145 → 192.168.1.16 SSH 1514 Server: Encrypted packet (len=1448)
  542 3.286842540  10.6.15.145 → 192.168.1.16 SSH 486 Server: Encrypted packet (len=420)
  543 3.286854356 192.168.1.16 → 10.6.15.145  TCP 66 52104 → 22 [ACK] Seq=57489 Ack=203937 Win=6157 Len=0 TSval=1616774 TSecr=24431301
  544 3.293855785  10.6.15.145 → 192.168.1.16 SSH 1514 Server: Encrypted packet (len=1448)
  545 3.293872794  10.6.15.145 → 192.168.1.16 SSH 110 Server: Encrypted packet (len=44)
  546 3.293882319 192.168.1.16 → 10.6.15.145  TCP 66 52104 → 22 [ACK] Seq=57489 Ack=205429 Win=6157 Len=0 TSval=1616775 TSecr=24431302
  547 3.294208106  10.6.15.145 → 192.168.1.16 SSH 1514 Server: Encrypted packet (len=1448)
  548 3.294334507  10.6.15.145 → 192.168.1.16 SSH 1046 Server: Encrypted packet (len=980)
  549 3.294340331 192.168.1.16 → 10.6.15.145  TCP 66 52104 → 22 [ACK] Seq=57489 Ack=207857 Win=6157 Len=0 TSval=1616776 TSecr=24431302
  550 3.299911767  10.6.15.145 → 192.168.1.16 SSH 138 Server: Encrypted packet (len=72)
  551 3.300082453 192.168.1.16 → 10.6.15.145  SSH 102 Client: Encrypted packet (len=36)
  552 3.302277133  10.6.15.145 → 192.168.1.16 TCP 78 [TCP Dup ACK 536#1] 22 → 52104 [ACK] Seq=207929 Ack=57173 Win=1452 Len=0 TSval=24431304 TSecr=1616761 SLE=57489 SRE=57525
  553 3.466028059 192.168.1.16 → 10.6.15.145  TCP 382 [TCP Retransmission] 52104 → 22 [PSH, ACK] Seq=57173 Ack=207929 Win=6157 Len=316 TSval=1616819 TSecr=24431304
  554 3.467772210  10.6.15.145 → 192.168.1.16 SSH 210 Server: Encrypted packet (len=132)
  555 3.468262891  10.6.15.145 → 192.168.1.16 TCP 66 22 → 52104 [ACK] Seq=208061 Ack=57525 Win=1451 Len=0 TSval=24431346 TSecr=1616819
  556 3.510060392 192.168.1.16 → 10.6.15.145  TCP 66 52104 → 22 [ACK] Seq=57525 Ack=208061 Win=6157 Len=0 TSval=1616830 TSecr=24431340
  557 3.567729331  10.6.15.145 → 192.168.1.16 SSH 1514 Server: Encrypted packet (len=1448)
  558 3.567814096  10.6.15.145 → 192.168.1.16 SSH 966 Server: Encrypted packet (len=900)
  559 3.567822688 192.168.1.16 → 10.6.15.145  TCP 66 52104 → 22 [ACK] Seq=57525 Ack=210409 Win=6157 Len=0 TSval=1616844 TSecr=24431371
  560 3.774055721 192.168.1.16 → 216.58.197.35 TCP 66 54042 → 443 [ACK] Seq=1 Ack=1 Win=245 Len=0 TSval=1616896 TSecr=3355199818
  561 3.777829162 216.58.197.35 → 192.168.1.16 TCP 66 [TCP ACKed unseen segment] 443 → 54042 [ACK] Seq=1 Ack=2 Win=175 Len=0 TSval=3355245290 TSecr=1594275
  562 5.071516470 192.168.1.16 → 10.6.15.145  SSH 1514 Client: Encrypted packet (len=1448)
  563 5.072048954 192.168.1.16 → 10.6.15.145  SSH 574 Client: Encrypted packet (len=508)
  564 5.077745435  10.6.15.145 → 192.168.1.16 TCP 66 22 → 52104 [ACK] Seq=210409 Ack=59481 Win=1447 Len=0 TSval=24431747 TSecr=1617220
  565 7.064303281 192.168.1.16 → 10.6.15.145  SSH 158 Client: Encrypted packet (len=92)
  566 7.276125897  10.6.15.145 → 192.168.1.16 TCP 66 22 → 52104 [ACK] Seq=210409 Ack=59573 Win=1452 Len=0 TSval=24432298 TSecr=1617718
  567 7.970168563 192.168.1.16 → 192.168.1.1  DNS 81 Standard query 0xfabf A 3.ubuntu.pool.ntp.org
  568 8.377171708  192.168.1.1 → 192.168.1.16 DNS 129 Standard query response 0xfabf A 3.ubuntu.pool.ntp.org A 123.108.200.124 A 13.126.27.131 A 139.59.21.22
  569 8.482170391 192.168.1.16 → 123.108.200.124 NTP 90 NTP Version 4, client
  570 12.426316069 192.168.1.16 → 10.6.15.145  SSH 1514 Client: Encrypted packet (len=1448)
  571 12.437253884 192.168.1.16 → 10.6.15.145  SSH 262 Client: Encrypted packet (len=196)
  572 12.467548080  10.6.15.145 → 192.168.1.16 TCP 78 [TCP Dup ACK 566#1] 22 → 52104 [ACK] Seq=210409 Ack=59573 Win=1452 Len=0 TSval=24433596 TSecr=1617718 SLE=61021 SRE=61217
  573 12.698080937 192.168.1.16 → 10.6.15.145  TCP 1514 [TCP Retransmission] 52104 → 22 [ACK] Seq=59573 Ack=210409 Win=6157 Len=1448 TSval=1619127 TSecr=24433596
  574 12.700930798  10.6.15.145 → 192.168.1.16 TCP 66 22 → 52104 [ACK] Seq=210409 Ack=61217 Win=1446 Len=0 TSval=24433654 TSecr=1619127
  575 12.709076174  10.6.15.145 → 192.168.1.16 SSH 142 Server: Encrypted packet (len=76)
  576 12.709096613 192.168.1.16 → 10.6.15.145  TCP 66 52104 → 22 [ACK] Seq=61217 Ack=210485 Win=6157 Len=0 TSval=1619129 TSecr=24433656
  577 14.014078694 192.168.1.16 → 216.58.197.35 TCP 66 54040 → 443 [ACK] Seq=1 Ack=1 Win=229 Len=0 TSval=1619456 TSecr=2850863602
  578 14.021280314  10.6.15.145 → 192.168.1.16 SSH 838 Server: Encrypted packet (len=772)
  579 14.021305048 192.168.1.16 → 10.6.15.145  TCP 66 52104 → 22 [ACK] Seq=61217 Ack=211257 Win=6157 Len=0 TSval=1619457 TSecr=24433683
  580 14.021321939  10.6.15.145 → 192.168.1.16 SSH 406 Server: Encrypted packet (len=340)
  581 14.021328137 192.168.1.16 → 10.6.15.145  TCP 66 52104 → 22 [ACK] Seq=61217 Ack=211597 Win=6157 Len=0 TSval=1619457 TSecr=24433683
  582 14.021333591  10.6.15.145 → 192.168.1.16 SSH 390 Server: Encrypted packet (len=324)
  583 14.021335435 192.168.1.16 → 10.6.15.145  TCP 66 52104 → 22 [ACK] Seq=61217 Ack=211921 Win=6157 Len=0 TSval=1619457 TSecr=24433683
  584 14.021369975  10.6.15.145 → 192.168.1.16 SSH 390 Server: [TCP Spurious Retransmission] , Encrypted packet (len=324)
  585 14.021374010 192.168.1.16 → 10.6.15.145  TCP 78 [TCP Dup ACK 583#1] 52104 → 22 [ACK] Seq=61217 Ack=211921 Win=6157 Len=0 TSval=1619457 TSecr=24433691 SLE=211597 SRE=211921
  586 14.021542663  10.6.15.145 → 192.168.1.16 TCP 1178 [TCP Out-Of-Order] 22 → 52104 [PSH, ACK] Seq=210485 Ack=61217 Win=1452 Len=1112 TSval=24433745 TSecr=1619129
  587 14.021545647 192.168.1.16 → 10.6.15.145  TCP 78 [TCP Dup ACK 583#2] 52104 → 22 [ACK] Seq=61217 Ack=211921 Win=6157 Len=0 TSval=1619457 TSecr=24433691 SLE=210485 SRE=211597
  588 14.021693308  10.6.15.145 → 192.168.1.16 TCP 1178 [TCP Out-Of-Order] 22 → 52104 [PSH, ACK] Seq=210485 Ack=61217 Win=1452 Len=1112 TSval=24433853 TSecr=1619129
  589 14.021695884 192.168.1.16 → 10.6.15.145  TCP 78 [TCP Dup ACK 583#3] 52104 → 22 [ACK] Seq=61217 Ack=211921 Win=6157 Len=0 TSval=1619457 TSecr=24433691 SLE=210485 SRE=211597
  590 14.022308495 192.168.1.16 → 10.6.15.145  SSH 142 Client: Encrypted packet (len=76)
  591 14.047598258  10.6.15.145 → 192.168.1.16 SSH 390 Server: [TCP Spurious Retransmission] , Encrypted packet (len=324)
  592 14.047618480 192.168.1.16 → 10.6.15.145  TCP 78 [TCP Dup ACK 583#4] 52104 → 22 [ACK] Seq=61293 Ack=211921 Win=6157 Len=0 TSval=1619464 TSecr=24433991 SLE=211597 SRE=211921
  593 14.085730637  10.6.15.145 → 192.168.1.16 TCP 66 22 → 52104 [ACK] Seq=211921 Ack=61293 Win=1452 Len=0 TSval=24434001 TSecr=1619458
  594 20.992028848  10.6.15.145 → 192.168.1.16 SSH 134 Server: Encrypted packet (len=68)
  595 20.992054485 192.168.1.16 → 10.6.15.145  TCP 66 52104 → 22 [ACK] Seq=61293 Ack=211989 Win=6157 Len=0 TSval=1621200 TSecr=24435724
  596 20.992069726  10.6.15.145 → 192.168.1.16 SSH 102 Server: Encrypted packet (len=36)
  597 20.992075285 192.168.1.16 → 10.6.15.145  TCP 66 52104 → 22 [ACK] Seq=61293 Ack=212025 Win=6157 Len=0 TSval=1621200 TSecr=24435724
  598 20.992343649 192.168.1.16 → 10.6.15.145  SSH 138 Client: Encrypted packet (len=72)
  599 20.993459484  10.6.15.145 → 192.168.1.16 TCP 66 22 → 52104 [ACK] Seq=212025 Ack=61365 Win=1452 Len=0 TSval=24435727 TSecr=1621200
  600 20.993467963  10.6.15.145 → 192.168.1.16 SSH 102 Server: Encrypted packet (len=36)
  601 21.034079944 192.168.1.16 → 10.6.15.145  TCP 66 52104 → 22 [ACK] Seq=61365 Ack=212061 Win=6157 Len=0 TSval=1621211 TSecr=24435728
  602 26.016331525  10.6.15.145 → 192.168.1.16 SSH 102 Server: Encrypted packet (len=36)
  603 26.016356362 192.168.1.16 → 10.6.15.145  TCP 66 52104 → 22 [ACK] Seq=61365 Ack=212097 Win=6157 Len=0 TSval=1622456 TSecr=24436941
  604 26.016621014 192.168.1.16 → 10.6.15.145  SSH 138 Client: Encrypted packet (len=72)
  605 26.021998734  10.6.15.145 → 192.168.1.16 SSH 102 Server: Encrypted packet (len=36)
  606 26.070026384 192.168.1.16 → 10.6.15.145  TCP 66 52104 → 22 [ACK] Seq=61437 Ack=212133 Win=6157 Len=0 TSval=1622470 TSecr=24436984
