    1 0.000000000 192.168.1.16 → 139.59.50.38 NTP 90 NTP Version 4, client
    2 0.001639184  10.6.15.144 → 192.168.1.16 SSH 102 Server: Encrypted packet (len=36)
    3 0.001653991  10.6.15.144 → 192.168.1.16 SSH 102 Server: Encrypted packet (len=36)
    4 0.001658204  10.6.15.144 → 192.168.1.16 TCP 102 [TCP Retransmission] 22 → 59298 [PSH, ACK] Seq=37 Ack=1 Win=1452 Len=36 TSval=6021925 TSecr=5425424
    5 0.001663383 192.168.1.16 → 10.6.15.144  TCP 78 59298 → 22 [ACK] Seq=1 Ack=73 Win=5703 Len=0 TSval=5425627 TSecr=6021861 SLE=37 SRE=73
    6 0.001982261 192.168.1.16 → 10.6.15.144  SSH 110 Client: Encrypted packet (len=44)
    7 0.009288816  10.6.15.144 → 192.168.1.16 TCP 66 22 → 59298 [ACK] Seq=73 Ack=45 Win=1452 Len=0 TSval=6021996 TSecr=5425628
    8 0.010318432 10.119.73.122 → 192.168.1.16 ICMP 110 Destination unreachable (Communication administratively filtered)
    9 0.045988240  10.6.15.144 → 192.168.1.16 SSH 206 Server: Encrypted packet (len=140)
   10 0.051037384 192.168.1.16 → 10.6.15.144  SSH 150 Client: Encrypted packet (len=84)
   11 0.104140699  10.6.15.144 → 192.168.1.16 SSH 1366 Server: Encrypted packet (len=1300)
   12 0.104264210  10.6.15.144 → 192.168.1.16 SSH 1514 Server: Encrypted packet (len=1448)
   13 0.104272538 192.168.1.16 → 10.6.15.144  TCP 66 59298 → 22 [ACK] Seq=129 Ack=2961 Win=5703 Len=0 TSval=5425653 TSecr=6022019
   14 0.104793415  10.6.15.144 → 192.168.1.16 SSH 110 Server: Encrypted packet (len=44)
   15 0.105021138  10.6.15.144 → 192.168.1.16 SSH 1514 Server: Encrypted packet (len=1448)
   16 0.105030391 192.168.1.16 → 10.6.15.144  TCP 66 59298 → 22 [ACK] Seq=129 Ack=4453 Win=5703 Len=0 TSval=5425653 TSecr=6022019
   17 0.105212218  10.6.15.144 → 192.168.1.16 SSH 1514 Server: Encrypted packet (len=1448)
   18 0.105225061  10.6.15.144 → 192.168.1.16 SSH 110 Server: Encrypted packet (len=44)
   19 0.105230186 192.168.1.16 → 10.6.15.144  TCP 66 59298 → 22 [ACK] Seq=129 Ack=5945 Win=5703 Len=0 TSval=5425653 TSecr=6022019
   20 0.105795032  10.6.15.144 → 192.168.1.16 SSH 1514 Server: Encrypted packet (len=1448)
   21 0.114984320  10.6.15.144 → 192.168.1.16 SSH 1514 Server: Encrypted packet (len=1448)
   22 0.115004624 192.168.1.16 → 10.6.15.144  TCP 66 59298 → 22 [ACK] Seq=129 Ack=8841 Win=5703 Len=0 TSval=5425656 TSecr=6022019
   23 0.115163379  10.6.15.144 → 192.168.1.16 SSH 1514 Server: Encrypted packet (len=1448)
   24 0.116704946  10.6.15.144 → 192.168.1.16 SSH 1514 Server: Encrypted packet (len=1448)
   25 0.116725334 192.168.1.16 → 10.6.15.144  TCP 66 59298 → 22 [ACK] Seq=129 Ack=11737 Win=5703 Len=0 TSval=5425656 TSecr=6022022
   26 0.116890239  10.6.15.144 → 192.168.1.16 SSH 1514 Server: [TCP Previous segment not captured] , Encrypted packet (len=1448)
   27 0.116897191 192.168.1.16 → 10.6.15.144  TCP 78 [TCP Dup ACK 25#1] 59298 → 22 [ACK] Seq=129 Ack=11737 Win=5703 Len=0 TSval=5425656 TSecr=6022022 SLE=13185 SRE=14633
   28 0.117082765  10.6.15.144 → 192.168.1.16 SSH 1514 Server: Encrypted packet (len=1448)
   29 0.117090135 192.168.1.16 → 10.6.15.144  TCP 78 [TCP Dup ACK 25#2] 59298 → 22 [ACK] Seq=129 Ack=11737 Win=5703 Len=0 TSval=5425656 TSecr=6022022 SLE=13185 SRE=16081
   30 0.124899968 192.168.1.16 → 10.6.15.144  SSH 122 Client: Encrypted packet (len=44)
   31 0.125666050 192.168.1.16 → 10.6.15.144  SSH 114 Client: Encrypted packet (len=36)
   32 0.126747547 192.168.1.16 → 10.6.15.144  SSH 114 Client: Encrypted packet (len=36)
   33 0.127262307  10.6.15.144 → 192.168.1.16 SSH 1514 Server: Encrypted packet (len=1448)
   34 0.127278284 192.168.1.16 → 10.6.15.144  TCP 78 [TCP Dup ACK 25#3] 59298 → 22 [ACK] Seq=245 Ack=11737 Win=5703 Len=0 TSval=5425659 TSecr=6022022 SLE=13185 SRE=17529
   35 0.127448525  10.6.15.144 → 192.168.1.16 SSH 1514 Server: Encrypted packet (len=1448)
   36 0.127458474 192.168.1.16 → 10.6.15.144  TCP 78 [TCP Dup ACK 25#4] 59298 → 22 [ACK] Seq=245 Ack=11737 Win=5703 Len=0 TSval=5425659 TSecr=6022022 SLE=13185 SRE=18977
   37 0.128116801  10.6.15.144 → 192.168.1.16 SSH 1514 Server: Encrypted packet (len=1448)
   38 0.128137892 192.168.1.16 → 10.6.15.144  TCP 78 [TCP Dup ACK 25#5] 59298 → 22 [ACK] Seq=245 Ack=11737 Win=5703 Len=0 TSval=5425659 TSecr=6022022 SLE=13185 SRE=20425
   39 0.128163667  10.6.15.144 → 192.168.1.16 SSH 598 Server: Encrypted packet (len=532)
   40 0.128169496 192.168.1.16 → 10.6.15.144  TCP 78 [TCP Dup ACK 25#6] 59298 → 22 [ACK] Seq=245 Ack=11737 Win=5703 Len=0 TSval=5425659 TSecr=6022022 SLE=13185 SRE=20957
   41 0.137289864  10.6.15.144 → 192.168.1.16 SSH 1514 Server: [TCP Fast Retransmission] , Encrypted packet (len=1448)
   42 0.137323955 192.168.1.16 → 10.6.15.144  TCP 66 59298 → 22 [ACK] Seq=245 Ack=20957 Win=5703 Len=0 TSval=5425661 TSecr=6022027
   43 0.189381475 192.168.1.16 → 10.6.15.144  SSH 118 Client: Encrypted packet (len=52)
   44 0.191827961 192.168.1.16 → 10.6.15.144  SSH 102 Client: Encrypted packet (len=36)
   45 0.194422554 192.168.1.16 → 10.6.15.144  SSH 102 Client: Encrypted packet (len=36)
   46 0.242352661  10.6.15.144 → 192.168.1.16 TCP 66 22 → 59298 [ACK] Seq=20957 Ack=369 Win=1452 Len=0 TSval=6022054 TSecr=5425674
   47 1.299835336  10.6.15.144 → 192.168.1.16 SSH 110 Server: Encrypted packet (len=44)
   48 1.299854400 192.168.1.16 → 10.6.15.144  TCP 66 59298 → 22 [ACK] Seq=369 Ack=21001 Win=5703 Len=0 TSval=5425952 TSecr=6022167
   49 1.299866856  10.6.15.144 → 192.168.1.16 SSH 102 Server: Encrypted packet (len=36)
   50 1.299871500 192.168.1.16 → 10.6.15.144  TCP 66 59298 → 22 [ACK] Seq=369 Ack=21037 Win=5703 Len=0 TSval=5425952 TSecr=6022168
   51 1.299876770  10.6.15.144 → 192.168.1.16 SSH 102 Server: Encrypted packet (len=36)
   52 1.299879141 192.168.1.16 → 10.6.15.144  TCP 66 59298 → 22 [ACK] Seq=369 Ack=21073 Win=5703 Len=0 TSval=5425952 TSecr=6022168
   53 1.299884573  10.6.15.144 → 192.168.1.16 SSH 102 Server: Encrypted packet (len=36)
   54 1.299885870 192.168.1.16 → 10.6.15.144  TCP 66 59298 → 22 [ACK] Seq=369 Ack=21109 Win=5703 Len=0 TSval=5425952 TSecr=6022168
   55 1.300046362  10.6.15.144 → 192.168.1.16 SSH 102 Server: Encrypted packet (len=36)
   56 1.300051345 192.168.1.16 → 10.6.15.144  TCP 66 59298 → 22 [ACK] Seq=369 Ack=21145 Win=5703 Len=0 TSval=5425952 TSecr=6022169
   57 1.300061590  10.6.15.144 → 192.168.1.16 SSH 102 Server: Encrypted packet (len=36)
   58 1.300064353 192.168.1.16 → 10.6.15.144  TCP 66 59298 → 22 [ACK] Seq=369 Ack=21181 Win=5703 Len=0 TSval=5425952 TSecr=6022191
   59 1.300225717  10.22.17.75 → 224.0.0.252  LLMNR 64 Standard query 0x38f0 A wpad
   60 1.300281037 192.168.1.16 → 10.6.15.144  SSH 182 Client: Encrypted packet (len=116)
   61 1.300624917 192.168.1.16 → 10.6.15.144  SSH 246 Client: Encrypted packet (len=180)
   62 1.300972482 192.168.1.16 → 10.6.15.144  SSH 274 Client: Encrypted packet (len=208)
   63 1.310702718  10.6.15.144 → 192.168.1.16 TCP 66 22 → 59298 [ACK] Seq=21181 Ack=485 Win=1452 Len=0 TSval=6022321 TSecr=5425952
   64 1.310722782  10.6.15.144 → 192.168.1.16 TCP 66 22 → 59298 [ACK] Seq=21181 Ack=665 Win=1452 Len=0 TSval=6022321 TSecr=5425952
   65 1.310882114  10.6.15.144 → 192.168.1.16 TCP 66 22 → 59298 [ACK] Seq=21181 Ack=873 Win=1452 Len=0 TSval=6022321 TSecr=5425952
   66 1.337052441  10.6.15.144 → 192.168.1.16 SSH 414 Server: Encrypted packet (len=348)
   67 1.338129552  10.6.15.144 → 192.168.1.16 SSH 1514 Server: Encrypted packet (len=1448)
   68 1.338144103 192.168.1.16 → 10.6.15.144  TCP 66 59298 → 22 [ACK] Seq=873 Ack=22977 Win=5703 Len=0 TSval=5425962 TSecr=6022327
   69 1.338316322  10.6.15.144 → 192.168.1.16 SSH 1514 Server: Encrypted packet (len=1448)
   70 1.338475288  10.6.15.144 → 192.168.1.16 SSH 342 Server: Encrypted packet (len=276)
   71 1.338483526 192.168.1.16 → 10.6.15.144  TCP 66 59298 → 22 [ACK] Seq=873 Ack=24701 Win=5703 Len=0 TSval=5425962 TSecr=6022328
   72 1.338696292  10.6.15.144 → 192.168.1.16 SSH 1514 Server: Encrypted packet (len=1448)
   73 1.338846187  10.6.15.144 → 192.168.1.16 SSH 1246 Server: Encrypted packet (len=1180)
   74 1.338851740 192.168.1.16 → 10.6.15.144  TCP 66 59298 → 22 [ACK] Seq=873 Ack=27329 Win=5703 Len=0 TSval=5425962 TSecr=6022328
   75 1.349673548  10.6.15.144 → 192.168.1.16 SSH 1514 Server: Encrypted packet (len=1448)
   76 1.349845834  10.6.15.144 → 192.168.1.16 SSH 1514 Server: Encrypted packet (len=1448)
   77 1.349855991 192.168.1.16 → 10.6.15.144  TCP 66 59298 → 22 [ACK] Seq=873 Ack=30225 Win=5703 Len=0 TSval=5425964 TSecr=6022330
   78 1.350024469  10.6.15.144 → 192.168.1.16 SSH 1514 Server: Encrypted packet (len=1448)
   79 1.350359727  10.6.15.144 → 192.168.1.16 SSH 1514 Server: [TCP Previous segment not captured] , Encrypted packet (len=1448)
   80 1.350368610 192.168.1.16 → 10.6.15.144  TCP 78 59298 → 22 [ACK] Seq=873 Ack=31673 Win=5703 Len=0 TSval=5425965 TSecr=6022330 SLE=33121 SRE=34569
   81 1.360056277  10.6.15.144 → 192.168.1.16 SSH 1514 Server: [TCP Previous segment not captured] , Encrypted packet (len=1448)
   82 1.360075881 192.168.1.16 → 10.6.15.144  TCP 86 [TCP Dup ACK 80#1] 59298 → 22 [ACK] Seq=873 Ack=31673 Win=5703 Len=0 TSval=5425967 TSecr=6022330 SLE=36017 SRE=37465 SLE=33121 SRE=34569
   83 1.360236638  10.6.15.144 → 192.168.1.16 SSH 1514 Server: Encrypted packet (len=1448)
   84 1.360245567 192.168.1.16 → 10.6.15.144  TCP 86 [TCP Dup ACK 80#2] 59298 → 22 [ACK] Seq=873 Ack=31673 Win=5703 Len=0 TSval=5425967 TSecr=6022330 SLE=36017 SRE=38913 SLE=33121 SRE=34569
   85 1.360429014  10.6.15.144 → 192.168.1.16 SSH 1514 Server: Encrypted packet (len=1448)
   86 1.360437146 192.168.1.16 → 10.6.15.144  TCP 86 [TCP Dup ACK 80#3] 59298 → 22 [ACK] Seq=873 Ack=31673 Win=5703 Len=0 TSval=5425967 TSecr=6022330 SLE=36017 SRE=40361 SLE=33121 SRE=34569
   87 1.360760607  10.6.15.144 → 192.168.1.16 SSH 1514 Server: Encrypted packet (len=1448)
   88 1.360768736 192.168.1.16 → 10.6.15.144  TCP 86 [TCP Dup ACK 80#4] 59298 → 22 [ACK] Seq=873 Ack=31673 Win=5703 Len=0 TSval=5425967 TSecr=6022330 SLE=36017 SRE=41809 SLE=33121 SRE=34569
   89 1.372174000  10.6.15.144 → 192.168.1.16 SSH 1514 Server: [TCP Fast Retransmission] , Encrypted packet (len=1448)
   90 1.372202312 192.168.1.16 → 10.6.15.144  TCP 78 59298 → 22 [ACK] Seq=873 Ack=34569 Win=5703 Len=0 TSval=5425970 TSecr=6022336 SLE=36017 SRE=41809
   91 1.372294163  10.6.15.144 → 192.168.1.16 TCP 1514 [TCP Retransmission] 22 → 59298 [ACK] Seq=34569 Ack=873 Win=1452 Len=1448 TSval=6022336 TSecr=5425967
   92 1.372299770 192.168.1.16 → 10.6.15.144  TCP 66 59298 → 22 [ACK] Seq=873 Ack=41809 Win=5703 Len=0 TSval=5425970 TSecr=6022336
   93 1.372490151  10.6.15.144 → 192.168.1.16 SSH 1514 Server: Encrypted packet (len=1448)
   94 1.372496517 192.168.1.16 → 10.6.15.144  TCP 66 59298 → 22 [ACK] Seq=873 Ack=43257 Win=5703 Len=0 TSval=5425970 TSecr=6022336
   95 1.372681503  10.6.15.144 → 192.168.1.16 SSH 1514 Server: Encrypted packet (len=1448)
   96 1.372690262 192.168.1.16 → 10.6.15.144  TCP 66 59298 → 22 [ACK] Seq=873 Ack=44705 Win=5703 Len=0 TSval=5425970 TSecr=6022336
   97 1.383236045  10.6.15.144 → 192.168.1.16 SSH 1514 Server: Encrypted packet (len=1448)
   98 1.383254158 192.168.1.16 → 10.6.15.144  TCP 66 59298 → 22 [ACK] Seq=873 Ack=46153 Win=5703 Len=0 TSval=5425973 TSecr=6022339
   99 1.383357910  10.6.15.144 → 192.168.1.16 SSH 1514 Server: Encrypted packet (len=1448)
  100 1.383362717 192.168.1.16 → 10.6.15.144  TCP 66 59298 → 22 [ACK] Seq=873 Ack=47601 Win=5703 Len=0 TSval=5425973 TSecr=6022339
  101 1.383550903  10.6.15.144 → 192.168.1.16 SSH 1514 Server: Encrypted packet (len=1448)
  102 1.383558717 192.168.1.16 → 10.6.15.144  TCP 66 59298 → 22 [ACK] Seq=873 Ack=49049 Win=5703 Len=0 TSval=5425973 TSecr=6022339
  103 1.383911062  10.6.15.144 → 192.168.1.16 SSH 1514 Server: Encrypted packet (len=1448)
  104 1.383921108 192.168.1.16 → 10.6.15.144  TCP 66 59298 → 22 [ACK] Seq=873 Ack=50497 Win=5703 Len=0 TSval=5425973 TSecr=6022339
  105 1.388817310  10.22.17.75 → 224.0.0.252  LLMNR 64 Standard query 0x38f0 A wpad
  106 1.395844915  10.6.15.144 → 192.168.1.16 SSH 1514 Server: Encrypted packet (len=1448)
  107 1.395865596 192.168.1.16 → 10.6.15.144  TCP 66 59298 → 22 [ACK] Seq=873 Ack=51945 Win=5703 Len=0 TSval=5425976 TSecr=6022342
  108 1.396003035  10.6.15.144 → 192.168.1.16 SSH 1514 Server: Encrypted packet (len=1448)
  109 1.396007872 192.168.1.16 → 10.6.15.144  TCP 66 59298 → 22 [ACK] Seq=873 Ack=53393 Win=5703 Len=0 TSval=5425976 TSecr=6022342
  110 1.396354480  10.6.15.144 → 192.168.1.16 SSH 1514 Server: Encrypted packet (len=1448)
  111 1.396362228 192.168.1.16 → 10.6.15.144  TCP 66 59298 → 22 [ACK] Seq=873 Ack=54841 Win=5703 Len=0 TSval=5425976 TSecr=6022342
  112 1.396538230  10.6.15.144 → 192.168.1.16 SSH 1514 Server: Encrypted packet (len=1448)
  113 1.396545714 192.168.1.16 → 10.6.15.144  TCP 66 59298 → 22 [ACK] Seq=873 Ack=56289 Win=5703 Len=0 TSval=5425976 TSecr=6022342
  114 1.396727833  10.6.15.144 → 192.168.1.16 SSH 1514 Server: Encrypted packet (len=1448)
  115 1.396735054 192.168.1.16 → 10.6.15.144  TCP 66 59298 → 22 [ACK] Seq=873 Ack=57737 Win=5703 Len=0 TSval=5425976 TSecr=6022342
  116 1.396932612  10.6.15.144 → 192.168.1.16 SSH 1514 Server: Encrypted packet (len=1448)
  117 1.396939187 192.168.1.16 → 10.6.15.144  TCP 66 59298 → 22 [ACK] Seq=873 Ack=59185 Win=5703 Len=0 TSval=5425976 TSecr=6022342
  118 1.407780484  10.6.15.144 → 192.168.1.16 SSH 1514 Server: Encrypted packet (len=1448)
  119 1.407798627 192.168.1.16 → 10.6.15.144  TCP 66 59298 → 22 [ACK] Seq=873 Ack=60633 Win=5703 Len=0 TSval=5425979 TSecr=6022345
  120 1.407901427  10.6.15.144 → 192.168.1.16 SSH 1514 Server: Encrypted packet (len=1448)
  121 1.408097860  10.6.15.144 → 192.168.1.16 SSH 1514 Server: Encrypted packet (len=1448)
  122 1.408106578 192.168.1.16 → 10.6.15.144  TCP 66 59298 → 22 [ACK] Seq=873 Ack=63529 Win=5703 Len=0 TSval=5425979 TSecr=6022345
  123 1.408483232  10.6.15.144 → 192.168.1.16 SSH 1514 Server: Encrypted packet (len=1448)
  124 1.408640873  10.6.15.144 → 192.168.1.16 SSH 1514 Server: Encrypted packet (len=1448)
  125 1.408646941 192.168.1.16 → 10.6.15.144  TCP 66 59298 → 22 [ACK] Seq=873 Ack=66425 Win=5703 Len=0 TSval=5425979 TSecr=6022345
  126 1.408824154  10.6.15.144 → 192.168.1.16 SSH 1514 Server: Encrypted packet (len=1448)
  127 1.419205311  10.6.15.144 → 192.168.1.16 SSH 1514 Server: Encrypted packet (len=1448)
  128 1.419223324 192.168.1.16 → 10.6.15.144  TCP 66 59298 → 22 [ACK] Seq=873 Ack=69321 Win=5703 Len=0 TSval=5425982 TSecr=6022345
  129 1.419325150  10.6.15.144 → 192.168.1.16 SSH 1514 Server: Encrypted packet (len=1448)
  130 1.419519251  10.6.15.144 → 192.168.1.16 SSH 1514 Server: Encrypted packet (len=1448)
  131 1.419525992 192.168.1.16 → 10.6.15.144  TCP 66 59298 → 22 [ACK] Seq=873 Ack=72217 Win=5703 Len=0 TSval=5425982 TSecr=6022348
  132 1.419865703  10.6.15.144 → 192.168.1.16 SSH 1514 Server: Encrypted packet (len=1448)
  133 1.430470437  10.6.15.144 → 192.168.1.16 SSH 1514 Server: Encrypted packet (len=1448)
  134 1.430490615 192.168.1.16 → 10.6.15.144  TCP 66 59298 → 22 [ACK] Seq=873 Ack=75113 Win=5703 Len=0 TSval=5425985 TSecr=6022348
  135 1.430588971  10.6.15.144 → 192.168.1.16 SSH 1514 Server: Encrypted packet (len=1448)
  136 1.430951727  10.6.15.144 → 192.168.1.16 SSH 1514 Server: Encrypted packet (len=1448)
  137 1.430958841 192.168.1.16 → 10.6.15.144  TCP 66 59298 → 22 [ACK] Seq=873 Ack=78009 Win=5703 Len=0 TSval=5425985 TSecr=6022350
  138 1.431140170  10.6.15.144 → 192.168.1.16 SSH 1514 Server: Encrypted packet (len=1448)
  139 1.441826977  10.6.15.144 → 192.168.1.16 SSH 1514 Server: Encrypted packet (len=1448)
  140 1.441844538 192.168.1.16 → 10.6.15.144  TCP 66 59298 → 22 [ACK] Seq=873 Ack=80905 Win=5703 Len=0 TSval=5425987 TSecr=6022350
  141 1.441973042  10.6.15.144 → 192.168.1.16 SSH 1514 Server: Encrypted packet (len=1448)
  142 1.442144130  10.6.15.144 → 192.168.1.16 SSH 1514 Server: Encrypted packet (len=1448)
  143 1.442151216 192.168.1.16 → 10.6.15.144  TCP 66 59298 → 22 [ACK] Seq=873 Ack=83801 Win=5703 Len=0 TSval=5425988 TSecr=6022353
  144 1.442518001  10.6.15.144 → 192.168.1.16 SSH 1514 Server: Encrypted packet (len=1448)
  145 1.452167654  10.6.15.144 → 192.168.1.16 SSH 1514 Server: Encrypted packet (len=1448)
  146 1.452184509 192.168.1.16 → 10.6.15.144  TCP 66 59298 → 22 [ACK] Seq=873 Ack=86697 Win=5703 Len=0 TSval=5425990 TSecr=6022353
  147 1.452448970  10.6.15.144 → 192.168.1.16 SSH 1514 Server: Encrypted packet (len=1448)
  148 1.452649329  10.6.15.144 → 192.168.1.16 SSH 1514 Server: Encrypted packet (len=1448)
  149 1.452655670 192.168.1.16 → 10.6.15.144  TCP 66 59298 → 22 [ACK] Seq=873 Ack=89593 Win=5703 Len=0 TSval=5425990 TSecr=6022356
  150 1.452831709  10.6.15.144 → 192.168.1.16 SSH 1514 Server: Encrypted packet (len=1448)
  151 1.459284033 192.168.1.16 → 10.6.15.144  SSH 110 Client: Encrypted packet (len=44)
  152 1.463623113  10.6.15.144 → 192.168.1.16 SSH 1514 Server: Encrypted packet (len=1448)
  153 1.463745650  10.6.15.144 → 192.168.1.16 SSH 1514 Server: Encrypted packet (len=1448)
  154 1.463756001 192.168.1.16 → 10.6.15.144  TCP 66 59298 → 22 [ACK] Seq=917 Ack=93937 Win=5703 Len=0 TSval=5425993 TSecr=6022359
  155 1.469735712  10.6.15.144 → 192.168.1.16 SSH 1514 Server: [TCP Previous segment not captured] , Encrypted packet (len=1448)
  156 1.469754615 192.168.1.16 → 10.6.15.144  TCP 78 [TCP Dup ACK 154#1] 59298 → 22 [ACK] Seq=917 Ack=93937 Win=5703 Len=0 TSval=5425994 TSecr=6022359 SLE=96833 SRE=98281
  157 1.469917088  10.6.15.144 → 192.168.1.16 SSH 1514 Server: Encrypted packet (len=1448)
  158 1.469921742 192.168.1.16 → 10.6.15.144  TCP 78 [TCP Dup ACK 154#2] 59298 → 22 [ACK] Seq=917 Ack=93937 Win=5703 Len=0 TSval=5425994 TSecr=6022359 SLE=96833 SRE=99729
  159 1.474632104  10.6.15.144 → 192.168.1.16 SSH 1514 Server: [TCP Previous segment not captured] , Encrypted packet (len=1448)
  160 1.474637466 192.168.1.16 → 10.6.15.144  TCP 86 [TCP Dup ACK 154#3] 59298 → 22 [ACK] Seq=917 Ack=93937 Win=5703 Len=0 TSval=5425996 TSecr=6022359 SLE=101177 SRE=102625 SLE=96833 SRE=99729
  161 1.481885904  10.6.15.144 → 192.168.1.16 SSH 1514 Server: Encrypted packet (len=1448)
  162 1.481904911 192.168.1.16 → 10.6.15.144  TCP 86 [TCP Dup ACK 154#4] 59298 → 22 [ACK] Seq=917 Ack=93937 Win=5703 Len=0 TSval=5425997 TSecr=6022359 SLE=101177 SRE=104073 SLE=96833 SRE=99729
  163 1.482067278  10.6.15.144 → 192.168.1.16 SSH 1514 Server: [TCP Fast Retransmission] , Encrypted packet (len=1448)
  164 1.482078403 192.168.1.16 → 10.6.15.144  TCP 86 59298 → 22 [ACK] Seq=917 Ack=95385 Win=5703 Len=0 TSval=5425998 TSecr=6022363 SLE=101177 SRE=104073 SLE=96833 SRE=99729
  165 1.485510458  10.6.15.144 → 192.168.1.16 TCP 1514 [TCP Retransmission] 22 → 59298 [ACK] Seq=95385 Ack=917 Win=1452 Len=1448 TSval=6022364 TSecr=5425996
  166 1.485533877 192.168.1.16 → 10.6.15.144  TCP 78 59298 → 22 [ACK] Seq=917 Ack=99729 Win=5703 Len=0 TSval=5425998 TSecr=6022364 SLE=101177 SRE=104073
  167 1.493780893  10.6.15.144 → 192.168.1.16 SSH 1514 Server: [TCP Previous segment not captured] , Encrypted packet (len=1448)
  168 1.493799565 192.168.1.16 → 10.6.15.144  TCP 86 [TCP Dup ACK 166#1] 59298 → 22 [ACK] Seq=917 Ack=99729 Win=5703 Len=0 TSval=5426000 TSecr=6022364 SLE=105521 SRE=106969 SLE=101177 SRE=104073
  169 1.496826073  10.6.15.144 → 192.168.1.16 SSH 1514 Server: Encrypted packet (len=1448)
  170 1.496832550 192.168.1.16 → 10.6.15.144  TCP 86 [TCP Dup ACK 166#2] 59298 → 22 [ACK] Seq=917 Ack=99729 Win=5703 Len=0 TSval=5426001 TSecr=6022364 SLE=105521 SRE=108417 SLE=101177 SRE=104073
  171 1.504260050  10.6.15.144 → 192.168.1.16 SSH 1514 Server: [TCP Fast Retransmission] , Encrypted packet (len=1448)
  172 1.504297855 192.168.1.16 → 10.6.15.144  TCP 78 59298 → 22 [ACK] Seq=917 Ack=104073 Win=5703 Len=0 TSval=5426003 TSecr=6022369 SLE=105521 SRE=108417
  173 1.504416687  10.6.15.144 → 192.168.1.16 SSH 1514 Server: Encrypted packet (len=1448)
  174 1.504426491 192.168.1.16 → 10.6.15.144  TCP 78 [TCP Dup ACK 172#1] 59298 → 22 [ACK] Seq=917 Ack=104073 Win=5703 Len=0 TSval=5426003 TSecr=6022369 SLE=105521 SRE=109865
  175 1.506725818  10.6.15.144 → 192.168.1.16 SSH 1514 Server: Encrypted packet (len=1448)
  176 1.506746907 192.168.1.16 → 10.6.15.144  TCP 78 [TCP Dup ACK 172#2] 59298 → 22 [ACK] Seq=917 Ack=104073 Win=5703 Len=0 TSval=5426004 TSecr=6022369 SLE=105521 SRE=111313
  177 1.514948664  10.6.15.144 → 192.168.1.16 SSH 1514 Server: Encrypted packet (len=1448)
  178 1.514966916 192.168.1.16 → 10.6.15.144  TCP 78 [TCP Dup ACK 172#3] 59298 → 22 [ACK] Seq=917 Ack=104073 Win=5703 Len=0 TSval=5426006 TSecr=6022369 SLE=105521 SRE=112761
  179 1.515112962  10.6.15.144 → 192.168.1.16 SSH 1514 Server: [TCP Fast Retransmission] , Encrypted packet (len=1448)
  180 1.515120207 192.168.1.16 → 10.6.15.144  TCP 66 59298 → 22 [ACK] Seq=917 Ack=112761 Win=5703 Len=0 TSval=5426006 TSecr=6022372
  181 1.525486756  10.6.15.144 → 192.168.1.16 SSH 1514 Server: Encrypted packet (len=1448)
  182 1.525501795 192.168.1.16 → 10.6.15.144  TCP 66 59298 → 22 [ACK] Seq=917 Ack=114209 Win=5703 Len=0 TSval=5426008 TSecr=6022374
  183 1.525663653  10.6.15.144 → 192.168.1.16 SSH 1514 Server: Encrypted packet (len=1448)
  184 1.525670308 192.168.1.16 → 10.6.15.144  TCP 66 59298 → 22 [ACK] Seq=917 Ack=115657 Win=5703 Len=0 TSval=5426008 TSecr=6022374
  185 1.534631334  10.6.15.144 → 192.168.1.16 SSH 1514 Server: Encrypted packet (len=1448)
  186 1.534643384 192.168.1.16 → 10.6.15.144  TCP 66 59298 → 22 [ACK] Seq=917 Ack=117105 Win=5703 Len=0 TSval=5426011 TSecr=6022377
  187 1.534814192  10.6.15.144 → 192.168.1.16 SSH 1514 Server: Encrypted packet (len=1448)
  188 1.534819465 192.168.1.16 → 10.6.15.144  TCP 66 59298 → 22 [ACK] Seq=917 Ack=118553 Win=5703 Len=0 TSval=5426011 TSecr=6022377
  189 1.535006752  10.6.15.144 → 192.168.1.16 SSH 1514 Server: Encrypted packet (len=1448)
  190 1.535013192 192.168.1.16 → 10.6.15.144  TCP 66 59298 → 22 [ACK] Seq=917 Ack=120001 Win=5703 Len=0 TSval=5426011 TSecr=6022377
  191 1.536628206 192.168.1.16 → 10.6.15.144  SSH 118 Client: Encrypted packet (len=52)
  192 1.540642793 192.168.1.16 → 10.6.15.144  SSH 118 Client: Encrypted packet (len=52)
  193 1.541139483 192.168.1.16 → 10.6.15.144  SSH 110 Client: Encrypted packet (len=44)
  194 1.541586122 192.168.1.16 → 10.6.15.144  SSH 210 Client: Encrypted packet (len=144)
  195 1.542264643  10.6.15.144 → 192.168.1.16 SSH 1514 Server: Encrypted packet (len=1448)
  196 1.542452792  10.6.15.144 → 192.168.1.16 SSH 1514 Server: Encrypted packet (len=1448)
  197 1.542464526 192.168.1.16 → 10.6.15.144  TCP 66 59298 → 22 [ACK] Seq=1209 Ack=122897 Win=5703 Len=0 TSval=5426013 TSecr=6022379
  198 1.542643732  10.6.15.144 → 192.168.1.16 SSH 1514 Server: Encrypted packet (len=1448)
  199 1.546799332  10.6.15.144 → 192.168.1.16 TCP 66 22 → 59298 [ACK] Seq=124345 Ack=1021 Win=1452 Len=0 TSval=6022381 TSecr=5426011
  200 1.547813960  10.6.15.144 → 192.168.1.16 TCP 66 22 → 59298 [ACK] Seq=124345 Ack=1209 Win=1452 Len=0 TSval=6022381 TSecr=5426012
  201 1.549349787  10.6.15.144 → 192.168.1.16 SSH 1514 Server: Encrypted packet (len=1448)
  202 1.549363152 192.168.1.16 → 10.6.15.144  TCP 66 59298 → 22 [ACK] Seq=1209 Ack=125793 Win=5703 Len=0 TSval=5426014 TSecr=6022379
  203 1.549548776  10.6.15.144 → 192.168.1.16 SSH 1514 Server: Encrypted packet (len=1448)
  204 1.558600467  10.6.15.144 → 192.168.1.16 SSH 1514 Server: Encrypted packet (len=1448)
  205 1.558615228 192.168.1.16 → 10.6.15.144  TCP 66 59298 → 22 [ACK] Seq=1209 Ack=128689 Win=5703 Len=0 TSval=5426017 TSecr=6022381
  206 1.558786069  10.6.15.144 → 192.168.1.16 SSH 1514 Server: Encrypted packet (len=1448)
  207 1.566583666  10.6.15.144 → 192.168.1.16 SSH 1514 Server: Encrypted packet (len=1448)
  208 1.566601450 192.168.1.16 → 10.6.15.144  TCP 66 59298 → 22 [ACK] Seq=1209 Ack=131585 Win=5703 Len=0 TSval=5426019 TSecr=6022383
  209 1.566757898  10.6.15.144 → 192.168.1.16 SSH 1514 Server: Encrypted packet (len=1448)
  210 1.567096433  10.6.15.144 → 192.168.1.16 SSH 1514 Server: Encrypted packet (len=1448)
  211 1.567104847 192.168.1.16 → 10.6.15.144  TCP 66 59298 → 22 [ACK] Seq=1209 Ack=134481 Win=5703 Len=0 TSval=5426019 TSecr=6022385
  212 1.576916327  10.6.15.144 → 192.168.1.16 SSH 1514 Server: Encrypted packet (len=1448)
  213 1.577099861  10.6.15.144 → 192.168.1.16 SSH 1514 Server: Encrypted packet (len=1448)
  214 1.577112634 192.168.1.16 → 10.6.15.144  TCP 66 59298 → 22 [ACK] Seq=1209 Ack=137377 Win=5703 Len=0 TSval=5426021 TSecr=6022387
  215 1.577290378  10.6.15.144 → 192.168.1.16 SSH 1514 Server: Encrypted packet (len=1448)
  216 1.577482997  10.6.15.144 → 192.168.1.16 SSH 1514 Server: Encrypted packet (len=1448)
  217 1.577489918 192.168.1.16 → 10.6.15.144  TCP 66 59298 → 22 [ACK] Seq=1209 Ack=140273 Win=5703 Len=0 TSval=5426021 TSecr=6022387
  218 1.585289580  10.6.15.144 → 192.168.1.16 SSH 1514 Server: Encrypted packet (len=1448)
  219 1.585347189 192.168.1.16 → 10.6.15.144  SSH 102 Client: Encrypted packet (len=36)
  220 1.585473308  10.6.15.144 → 192.168.1.16 SSH 1514 Server: Encrypted packet (len=1448)
  221 1.585666714  10.6.15.144 → 192.168.1.16 SSH 1514 Server: Encrypted packet (len=1448)
  222 1.585673589 192.168.1.16 → 10.6.15.144  TCP 66 59298 → 22 [ACK] Seq=1245 Ack=144617 Win=5703 Len=0 TSval=5426023 TSecr=6022390
  223 1.586008675  10.6.15.144 → 192.168.1.16 SSH 1514 Server: Encrypted packet (len=1448)
  224 1.586633852 192.168.1.16 → 10.6.15.144  SSH 134 Client: Encrypted packet (len=68)
  225 1.591228848 192.168.1.16 → 10.6.15.144  SSH 110 Client: Encrypted packet (len=44)
  226 1.591408648 192.168.1.16 → 10.6.15.144  SSH 134 Client: Encrypted packet (len=68)
  227 1.592864482  10.6.15.144 → 192.168.1.16 SSH 1514 Server: Encrypted packet (len=1448)
  228 1.593056972  10.6.15.144 → 192.168.1.16 SSH 1514 Server: Encrypted packet (len=1448)
  229 1.593062526 192.168.1.16 → 10.6.15.144  TCP 66 59298 → 22 [ACK] Seq=1425 Ack=148961 Win=5703 Len=0 TSval=5426025 TSecr=6022392
  230 1.593400071  10.6.15.144 → 192.168.1.16 SSH 1514 Server: Encrypted packet (len=1448)
  231 1.593591656  10.6.15.144 → 192.168.1.16 SSH 1514 Server: Encrypted packet (len=1448)
  232 1.593596815 192.168.1.16 → 10.6.15.144  TCP 66 59298 → 22 [ACK] Seq=1425 Ack=151857 Win=5703 Len=0 TSval=5426025 TSecr=6022392
  233 1.596599202  10.6.15.144 → 192.168.1.16 TCP 66 22 → 59298 [ACK] Seq=151857 Ack=1425 Win=1452 Len=0 TSval=6022393 TSecr=5426025
  234 1.598835146  10.6.15.144 → 192.168.1.16 SSH 1514 Server: Encrypted packet (len=1448)
  235 1.599008917  10.6.15.144 → 192.168.1.16 SSH 1514 Server: Encrypted packet (len=1448)
  236 1.599018021 192.168.1.16 → 10.6.15.144  TCP 66 59298 → 22 [ACK] Seq=1425 Ack=154753 Win=5703 Len=0 TSval=5426027 TSecr=6022394
  237 1.599201343  10.6.15.144 → 192.168.1.16 SSH 1514 Server: Encrypted packet (len=1448)
  238 1.599554804  10.6.15.144 → 192.168.1.16 SSH 1514 Server: Encrypted packet (len=1448)
  239 1.599560789 192.168.1.16 → 10.6.15.144  TCP 66 59298 → 22 [ACK] Seq=1425 Ack=157649 Win=5703 Len=0 TSval=5426027 TSecr=6022394
  240 1.605130329  10.6.15.144 → 192.168.1.16 SSH 1514 Server: Encrypted packet (len=1448)
  241 1.605315083  10.6.15.144 → 192.168.1.16 SSH 1514 Server: Encrypted packet (len=1448)
  242 1.605324362 192.168.1.16 → 10.6.15.144  TCP 66 59298 → 22 [ACK] Seq=1425 Ack=160545 Win=5703 Len=0 TSval=5426028 TSecr=6022395
  243 1.605658712  10.6.15.144 → 192.168.1.16 SSH 1514 Server: Encrypted packet (len=1448)
  244 1.605849520  10.6.15.144 → 192.168.1.16 SSH 1514 Server: Encrypted packet (len=1448)
  245 1.605856321 192.168.1.16 → 10.6.15.144  TCP 66 59298 → 22 [ACK] Seq=1425 Ack=163441 Win=5703 Len=0 TSval=5426028 TSecr=6022395
  246 1.611409324  10.6.15.144 → 192.168.1.16 SSH 1514 Server: Encrypted packet (len=1448)
  247 1.612132347  10.6.15.144 → 192.168.1.16 SSH 1514 Server: Encrypted packet (len=1448)
  248 1.612143555 192.168.1.16 → 10.6.15.144  TCP 66 59298 → 22 [ACK] Seq=1425 Ack=166337 Win=5703 Len=0 TSval=5426030 TSecr=6022397
  249 1.612160284  10.6.15.144 → 192.168.1.16 SSH 1514 Server: Encrypted packet (len=1448)
  250 1.612444449  10.6.15.144 → 192.168.1.16 SSH 1514 Server: Encrypted packet (len=1448)
  251 1.612452637 192.168.1.16 → 10.6.15.144  TCP 66 59298 → 22 [ACK] Seq=1425 Ack=169233 Win=5703 Len=0 TSval=5426030 TSecr=6022397
  252 1.616907445  10.6.15.144 → 192.168.1.16 SSH 1514 Server: Encrypted packet (len=1448)
  253 1.617095232  10.6.15.144 → 192.168.1.16 SSH 1514 Server: Encrypted packet (len=1448)
  254 1.617103024 192.168.1.16 → 10.6.15.144  TCP 66 59298 → 22 [ACK] Seq=1425 Ack=172129 Win=5703 Len=0 TSval=5426031 TSecr=6022399
  255 1.617445503  10.6.15.144 → 192.168.1.16 SSH 1514 Server: Encrypted packet (len=1448)
  256 1.617653096  10.6.15.144 → 192.168.1.16 SSH 1514 Server: Encrypted packet (len=1448)
  257 1.617659079 192.168.1.16 → 10.6.15.144  TCP 66 59298 → 22 [ACK] Seq=1425 Ack=175025 Win=5703 Len=0 TSval=5426031 TSecr=6022399
  258 1.622891176  10.6.15.144 → 192.168.1.16 SSH 1514 Server: Encrypted packet (len=1448)
  259 1.623077001  10.6.15.144 → 192.168.1.16 SSH 1514 Server: Encrypted packet (len=1448)
  260 1.623089268 192.168.1.16 → 10.6.15.144  TCP 66 59298 → 22 [ACK] Seq=1425 Ack=177921 Win=5703 Len=0 TSval=5426033 TSecr=6022400
  261 1.623268335  10.6.15.144 → 192.168.1.16 SSH 1514 Server: Encrypted packet (len=1448)
  262 1.623612440  10.6.15.144 → 192.168.1.16 SSH 1514 Server: Encrypted packet (len=1448)
  263 1.623621612 192.168.1.16 → 10.6.15.144  TCP 66 59298 → 22 [ACK] Seq=1425 Ack=180817 Win=5703 Len=0 TSval=5426033 TSecr=6022400
  264 1.623750454 192.168.1.16 → 10.6.15.144  SSH 102 Client: Encrypted packet (len=36)
  265 1.624018519 192.168.1.16 → 10.6.15.144  SSH 446 Client: Encrypted packet (len=380)
  266 1.630843686  10.6.15.144 → 192.168.1.16 SSH 1514 Server: Encrypted packet (len=1448)
  267 1.631034437  10.6.15.144 → 192.168.1.16 SSH 1514 Server: Encrypted packet (len=1448)
  268 1.631043407 192.168.1.16 → 10.6.15.144  TCP 66 59298 → 22 [ACK] Seq=1841 Ack=183713 Win=5703 Len=0 TSval=5426035 TSecr=6022401
  269 1.631061336  10.6.15.144 → 192.168.1.16 SSH 1514 Server: Encrypted packet (len=1448)
  270 1.631376890  10.6.15.144 → 192.168.1.16 SSH 1514 Server: Encrypted packet (len=1448)
  271 1.631384258 192.168.1.16 → 10.6.15.144  TCP 66 59298 → 22 [ACK] Seq=1841 Ack=186609 Win=5703 Len=0 TSval=5426035 TSecr=6022401
  272 1.638546021  10.6.15.144 → 192.168.1.16 SSH 1514 Server: Encrypted packet (len=1448)
  273 1.638721075  10.6.15.144 → 192.168.1.16 SSH 1514 Server: Encrypted packet (len=1448)
  274 1.638729556 192.168.1.16 → 10.6.15.144  TCP 66 59298 → 22 [ACK] Seq=1841 Ack=189505 Win=5703 Len=0 TSval=5426037 TSecr=6022403
  275 1.638914095  10.6.15.144 → 192.168.1.16 SSH 1514 Server: Encrypted packet (len=1448)
  276 1.639257936  10.6.15.144 → 192.168.1.16 SSH 1514 Server: Encrypted packet (len=1448)
  277 1.639265885 192.168.1.16 → 10.6.15.144  TCP 66 59298 → 22 [ACK] Seq=1841 Ack=192401 Win=5703 Len=0 TSval=5426037 TSecr=6022403
  278 1.639449308  10.6.15.144 → 192.168.1.16 SSH 1514 Server: Encrypted packet (len=1448)
  279 1.639639339  10.6.15.144 → 192.168.1.16 SSH 1514 Server: Encrypted packet (len=1448)
  280 1.639644448 192.168.1.16 → 10.6.15.144  TCP 66 59298 → 22 [ACK] Seq=1841 Ack=195297 Win=5703 Len=0 TSval=5426037 TSecr=6022403
  281 1.647258885  10.6.15.144 → 192.168.1.16 SSH 1514 Server: Encrypted packet (len=1448)
  282 1.647412110 192.168.1.16 → 10.6.15.144  SSH 102 Client: Encrypted packet (len=36)
  283 1.647458732  10.6.15.144 → 192.168.1.16 SSH 1514 Server: Encrypted packet (len=1448)
  284 1.647465746  10.6.15.144 → 192.168.1.16 SSH 1514 Server: Encrypted packet (len=1448)
  285 1.647471242 192.168.1.16 → 10.6.15.144  TCP 66 59298 → 22 [ACK] Seq=1877 Ack=199641 Win=5703 Len=0 TSval=5426039 TSecr=6022405
  286 1.647795726  10.6.15.144 → 192.168.1.16 SSH 1514 Server: Encrypted packet (len=1448)
  287 1.647987705  10.6.15.144 → 192.168.1.16 SSH 1514 Server: Encrypted packet (len=1448)
  288 1.647995575 192.168.1.16 → 10.6.15.144  TCP 66 59298 → 22 [ACK] Seq=1877 Ack=202537 Win=5703 Len=0 TSval=5426039 TSecr=6022405
  289 1.648177375  10.6.15.144 → 192.168.1.16 SSH 1514 Server: Encrypted packet (len=1448)
  290 1.649822885 192.168.1.16 → 10.6.15.144  SSH 126 Client: Encrypted packet (len=60)
  291 1.653794331 192.168.1.16 → 10.6.15.144  SSH 110 Client: Encrypted packet (len=44)
  292 1.656544057  10.6.15.144 → 192.168.1.16 SSH 1514 Server: Encrypted packet (len=1448)
  293 1.656675759  10.6.15.144 → 192.168.1.16 SSH 1070 Server: Encrypted packet (len=1004)
  294 1.656692054 192.168.1.16 → 10.6.15.144  TCP 66 59298 → 22 [ACK] Seq=1981 Ack=206437 Win=5703 Len=0 TSval=5426041 TSecr=6022408
  295 1.656981655 192.168.1.16 → 10.6.15.144  SSH 126 Client: Encrypted packet (len=60)
  296 1.661472399 192.168.1.16 → 10.6.15.144  SSH 118 Client: Encrypted packet (len=52)
  297 1.693964169 192.168.1.16 → 10.6.15.144  TCP 118 [TCP Retransmission] 59298 → 22 [PSH, ACK] Seq=2041 Ack=206437 Win=5703 Len=52 TSval=5426051 TSecr=6022408
  298 1.698157672  10.6.15.144 → 192.168.1.16 TCP 66 22 → 59298 [ACK] Seq=206437 Ack=2093 Win=1451 Len=0 TSval=6022418 TSecr=5426039
  299 1.703857205  10.6.15.144 → 192.168.1.16 TCP 78 [TCP Dup ACK 298#1] 22 → 59298 [ACK] Seq=206437 Ack=2093 Win=1451 Len=0 TSval=6022419 TSecr=5426051 SLE=2041 SRE=2093
  300 1.751145803 192.168.1.16 → 10.6.15.144  SSH 190 Client: Encrypted packet (len=124)
  301 1.761297952  10.6.15.144 → 192.168.1.16 TCP 66 22 → 59298 [ACK] Seq=206437 Ack=2217 Win=1451 Len=0 TSval=6022433 TSecr=5426065
  302 2.865622680 192.168.1.16 → 10.6.15.144  SSH 270 Client: Encrypted packet (len=204)
  303 2.866397790 192.168.1.16 → 10.6.15.144  SSH 1514 Client: Encrypted packet (len=1448)
  304 2.867423666 192.168.1.16 → 10.6.15.144  SSH 174 Client: Encrypted packet (len=108)
  305 2.867737655  10.6.15.144 → 192.168.1.16 SSH 1514 Server: Encrypted packet (len=1448)
  306 2.867908360  10.6.15.144 → 192.168.1.16 SSH 1514 Server: [TCP Previous segment not captured] , Encrypted packet (len=1448)
  307 2.867915402 192.168.1.16 → 10.6.15.144  TCP 78 59298 → 22 [ACK] Seq=3977 Ack=207885 Win=5703 Len=0 TSval=5426344 TSecr=6022494 SLE=209333 SRE=210781
  308 2.868114959  10.6.15.144 → 192.168.1.16 SSH 1514 Server: Encrypted packet (len=1448)
  309 2.868120763 192.168.1.16 → 10.6.15.144  SSH 162 Client: Encrypted packet (len=84)
  310 2.868309939  10.6.15.144 → 192.168.1.16 SSH 1514 Server: Encrypted packet (len=1448)
  311 2.868314483 192.168.1.16 → 10.6.15.144  TCP 78 [TCP Dup ACK 307#1] 59298 → 22 [ACK] Seq=4061 Ack=207885 Win=5703 Len=0 TSval=5426344 TSecr=6022494 SLE=209333 SRE=213677
  312 2.868483110  10.6.15.144 → 192.168.1.16 SSH 1514 Server: Encrypted packet (len=1448)
  313 2.868487597 192.168.1.16 → 10.6.15.144  TCP 78 [TCP Dup ACK 307#2] 59298 → 22 [ACK] Seq=4061 Ack=207885 Win=5703 Len=0 TSval=5426344 TSecr=6022494 SLE=209333 SRE=215125
  314 2.868690301  10.6.15.144 → 192.168.1.16 SSH 1514 Server: Encrypted packet (len=1448)
  315 2.868696184 192.168.1.16 → 10.6.15.144  TCP 78 [TCP Dup ACK 307#3] 59298 → 22 [ACK] Seq=4061 Ack=207885 Win=5703 Len=0 TSval=5426344 TSecr=6022494 SLE=209333 SRE=216573
  316 2.868887670  10.6.15.144 → 192.168.1.16 TCP 1514 [TCP Out-Of-Order] 22 → 59298 [ACK] Seq=206437 Ack=2217 Win=1452 Len=1448 TSval=6022553 TSecr=5426065
  317 2.868891887 192.168.1.16 → 10.6.15.144  TCP 86 [TCP Dup ACK 307#4] 59298 → 22 [ACK] Seq=4061 Ack=207885 Win=5703 Len=0 TSval=5426344 TSecr=6022553 SLE=206437 SRE=207885 SLE=209333 SRE=216573
  318 2.869542462  10.6.15.144 → 192.168.1.16 TCP 1514 [TCP Out-Of-Order] 22 → 59298 [ACK] Seq=206437 Ack=2217 Win=1452 Len=1448 TSval=6022659 TSecr=5426065
  319 2.869546088 192.168.1.16 → 10.6.15.144  TCP 86 [TCP Dup ACK 307#5] 59298 → 22 [ACK] Seq=4061 Ack=207885 Win=5703 Len=0 TSval=5426344 TSecr=6022659 SLE=206437 SRE=207885 SLE=209333 SRE=216573
  320 2.876174287  10.6.15.144 → 192.168.1.16 TCP 66 22 → 59298 [ACK] Seq=216573 Ack=2421 Win=1452 Len=0 TSval=6022712 TSecr=5426343
  321 2.877485289  10.6.15.144 → 192.168.1.16 TCP 66 22 → 59298 [ACK] Seq=216573 Ack=3869 Win=1452 Len=0 TSval=6022712 TSecr=5426343
  322 2.879448496  10.6.15.144 → 192.168.1.16 TCP 66 22 → 59298 [ACK] Seq=216573 Ack=3977 Win=1452 Len=0 TSval=6022713 TSecr=5426344
  323 2.880113488  10.6.15.144 → 192.168.1.16 SSH 1514 Server: Encrypted packet (len=1448)
  324 2.880133262 192.168.1.16 → 10.6.15.144  TCP 78 [TCP Dup ACK 307#6] 59298 → 22 [ACK] Seq=4061 Ack=207885 Win=5703 Len=0 TSval=5426347 TSecr=6022659 SLE=209333 SRE=218021
  325 2.880319044  10.6.15.144 → 192.168.1.16 SSH 1514 Server: Encrypted packet (len=1448)
  326 2.880325826 192.168.1.16 → 10.6.15.144  TCP 78 [TCP Dup ACK 307#7] 59298 → 22 [ACK] Seq=4061 Ack=207885 Win=5703 Len=0 TSval=5426347 TSecr=6022659 SLE=209333 SRE=219469
  327 2.880661078  10.6.15.144 → 192.168.1.16 SSH 1514 Server: Encrypted packet (len=1448)
  328 2.880664777 192.168.1.16 → 10.6.15.144  TCP 78 [TCP Dup ACK 307#8] 59298 → 22 [ACK] Seq=4061 Ack=207885 Win=5703 Len=0 TSval=5426347 TSecr=6022659 SLE=209333 SRE=220917
  329 2.891336167  10.6.15.144 → 192.168.1.16 SSH 1514 Server: Encrypted packet (len=1448)
  330 2.891356982 192.168.1.16 → 10.6.15.144  TCP 78 [TCP Dup ACK 307#9] 59298 → 22 [ACK] Seq=4061 Ack=207885 Win=5703 Len=0 TSval=5426350 TSecr=6022659 SLE=209333 SRE=222365
  331 2.891527151  10.6.15.144 → 192.168.1.16 SSH 1514 Server: Encrypted packet (len=1448)
  332 2.891547510 192.168.1.16 → 10.6.15.144  TCP 78 [TCP Dup ACK 307#10] 59298 → 22 [ACK] Seq=4061 Ack=207885 Win=5703 Len=0 TSval=5426350 TSecr=6022659 SLE=209333 SRE=223813
  333 2.891718332  10.6.15.144 → 192.168.1.16 SSH 1514 Server: [TCP Fast Retransmission] , Encrypted packet (len=1448)
  334 2.891745249 192.168.1.16 → 10.6.15.144  TCP 66 59298 → 22 [ACK] Seq=4061 Ack=223813 Win=5703 Len=0 TSval=5426350 TSecr=6022716
  335 2.896310846 192.168.1.16 → 10.6.15.144  SSH 126 Client: Encrypted packet (len=60)
  336 2.903268490  10.6.15.144 → 192.168.1.16 SSH 1514 Server: [TCP Previous segment not captured] , Encrypted packet (len=1448)
  337 2.903287274 192.168.1.16 → 10.6.15.144  TCP 78 [TCP Dup ACK 334#1] 59298 → 22 [ACK] Seq=4121 Ack=223813 Win=5703 Len=0 TSval=5426353 TSecr=6022716 SLE=225261 SRE=226709
  338 2.903487166  10.6.15.144 → 192.168.1.16 SSH 1514 Server: Encrypted packet (len=1448)
  339 2.903507154 192.168.1.16 → 10.6.15.144  TCP 78 [TCP Dup ACK 334#2] 59298 → 22 [ACK] Seq=4121 Ack=223813 Win=5703 Len=0 TSval=5426353 TSecr=6022716 SLE=225261 SRE=228157
  340 2.903715610  10.6.15.144 → 192.168.1.16 SSH 1514 Server: Encrypted packet (len=1448)
  341 2.903742253 192.168.1.16 → 10.6.15.144  TCP 78 [TCP Dup ACK 334#3] 59298 → 22 [ACK] Seq=4121 Ack=223813 Win=5703 Len=0 TSval=5426353 TSecr=6022716 SLE=225261 SRE=229605
  342 2.914285656  10.6.15.144 → 192.168.1.16 SSH 1514 Server: Encrypted packet (len=1448)
  343 2.914306947 192.168.1.16 → 10.6.15.144  TCP 78 [TCP Dup ACK 334#4] 59298 → 22 [ACK] Seq=4121 Ack=223813 Win=5703 Len=0 TSval=5426356 TSecr=6022716 SLE=225261 SRE=231053
  344 2.914597142  10.6.15.144 → 192.168.1.16 SSH 1514 Server: [TCP Fast Retransmission] , Encrypted packet (len=1448)
  345 2.914610183 192.168.1.16 → 10.6.15.144  TCP 66 59298 → 22 [ACK] Seq=4121 Ack=231053 Win=5703 Len=0 TSval=5426356 TSecr=6022721
  346 2.925090852  10.6.15.144 → 192.168.1.16 SSH 1514 Server: [TCP Previous segment not captured] , Encrypted packet (len=1448)
  347 2.925104045 192.168.1.16 → 10.6.15.144  TCP 78 [TCP Dup ACK 345#1] 59298 → 22 [ACK] Seq=4121 Ack=231053 Win=5703 Len=0 TSval=5426358 TSecr=6022721 SLE=232501 SRE=233949
  348 2.935704908  10.6.15.144 → 192.168.1.16 TCP 1514 [TCP Retransmission] 22 → 59298 [ACK] Seq=231053 Ack=4121 Win=1452 Len=1448 TSval=6022727 TSecr=5426358
  349 2.935727810 192.168.1.16 → 10.6.15.144  TCP 66 59298 → 22 [ACK] Seq=4121 Ack=233949 Win=5703 Len=0 TSval=5426361 TSecr=6022727
  350 2.935905796  10.6.15.144 → 192.168.1.16 SSH 1514 Server: Encrypted packet (len=1448)
