    1 0.000000000  10.6.15.144 → 192.168.1.16 SSH 158 Server: Encrypted packet (len=92)
    2 0.043217707 192.168.1.16 → 10.6.15.144  TCP 66 59298 → 22 [ACK] Seq=1 Ack=93 Win=5703 Len=0 TSval=5466518 TSecr=6062874
    3 0.097110797  10.6.15.144 → 192.168.1.16 SSH 102 Server: Encrypted packet (len=36)
    4 0.097171187 192.168.1.16 → 10.6.15.144  TCP 66 59298 → 22 [ACK] Seq=1 Ack=129 Win=5703 Len=0 TSval=5466531 TSecr=6062898
    5 0.097427104 192.168.1.16 → 10.6.15.144  SSH 102 Client: Encrypted packet (len=36)
    6 0.101957471 192.168.1.16 → 10.6.15.144  SSH 134 Client: Encrypted packet (len=68)
    7 0.112054853  10.6.15.144 → 192.168.1.16 TCP 66 22 → 59298 [ACK] Seq=129 Ack=105 Win=1452 Len=0 TSval=6062901 TSecr=5466531
    8 0.183288313  10.6.15.144 → 192.168.1.16 SSH 118 Server: Encrypted packet (len=52)
    9 0.197494703 192.168.1.16 → 10.6.15.144  SSH 102 Client: Encrypted packet (len=36)
   10 0.198055982 192.168.1.16 → 10.6.15.144  SSH 102 Client: Encrypted packet (len=36)
   11 0.208557880  10.6.15.144 → 192.168.1.16 TCP 66 22 → 59298 [ACK] Seq=181 Ack=177 Win=1452 Len=0 TSval=6062926 TSecr=5466556
   12 0.210107612  10.6.15.144 → 192.168.1.16 SSH 138 Server: Encrypted packet (len=72)
   13 0.210401234 192.168.1.16 → 10.6.15.144  SSH 102 Client: Encrypted packet (len=36)
   14 0.244346509  10.6.15.144 → 192.168.1.16 SSH 110 Server: Encrypted packet (len=44)
   15 0.287218118 192.168.1.16 → 10.6.15.144  TCP 66 59298 → 22 [ACK] Seq=213 Ack=297 Win=5703 Len=0 TSval=5466579 TSecr=6062935
   16 0.345854819 192.168.1.16 → 10.6.15.144  SSH 590 Client: Encrypted packet (len=524)
   17 0.347571797 192.168.1.16 → 10.6.15.144  SSH 334 Client: Encrypted packet (len=268)
   18 0.357275700  10.6.15.144 → 192.168.1.16 TCP 66 22 → 59298 [ACK] Seq=297 Ack=1005 Win=1452 Len=0 TSval=6062963 TSecr=5466593
   19 0.357840263  10.6.15.144 → 192.168.1.16 SSH 302 Server: Encrypted packet (len=236)
   20 0.357915831 192.168.1.16 → 10.6.15.144  TCP 66 59298 → 22 [ACK] Seq=1005 Ack=533 Win=5703 Len=0 TSval=5466596 TSecr=6062963
   21 0.358871275 192.168.1.16 → 10.6.15.144  SSH 134 Client: Encrypted packet (len=68)
   22 0.393215489  10.6.15.144 → 192.168.1.16 SSH 142 Server: Encrypted packet (len=76)
   23 0.394074984  10.6.15.144 → 192.168.1.16 SSH 310 Server: Encrypted packet (len=244)
   24 0.394162316 192.168.1.16 → 10.6.15.144  TCP 66 59298 → 22 [ACK] Seq=1073 Ack=853 Win=5703 Len=0 TSval=5466605 TSecr=6062972
   25 0.395241218 192.168.1.16 → 10.6.15.144  SSH 134 Client: Encrypted packet (len=68)
   26 0.423833549  10.6.15.144 → 192.168.1.16 SSH 102 Server: Encrypted packet (len=36)
   27 0.424187832 192.168.1.16 → 10.6.15.144  SSH 150 Client: Encrypted packet (len=84)
   28 0.446100813 192.168.1.16 → 10.6.15.144  SSH 102 Client: Encrypted packet (len=36)
   29 0.456212509  10.6.15.144 → 192.168.1.16 TCP 66 22 → 59298 [ACK] Seq=889 Ack=1261 Win=1452 Len=0 TSval=6062988 TSecr=5466613
   30 1.781603782  10.6.15.144 → 192.168.1.16 SSH 110 Server: Encrypted packet (len=44)
   31 1.781622661  10.6.15.144 → 192.168.1.16 SSH 166 Server: Encrypted packet (len=100)
   32 1.781627413  10.6.15.144 → 192.168.1.16 TCP 166 [TCP Retransmission] 22 → 59298 [PSH, ACK] Seq=933 Ack=1261 Win=1452 Len=100 TSval=6063057 TSecr=5466613
   33 1.781635243 192.168.1.16 → 10.6.15.144  TCP 78 59298 → 22 [ACK] Seq=1261 Ack=1033 Win=5703 Len=0 TSval=5466952 TSecr=6063022 SLE=933 SRE=1033
   34 1.781813214  10.6.15.144 → 192.168.1.16 SSH 210 Server: [TCP Spurious Retransmission] , Encrypted packet (len=144)
   35 1.781820667 192.168.1.16 → 10.6.15.144  TCP 78 [TCP Dup ACK 33#1] 59298 → 22 [ACK] Seq=1261 Ack=1033 Win=5703 Len=0 TSval=5466952 TSecr=6063134 SLE=889 SRE=1033
   36 1.781827521  10.6.15.144 → 192.168.1.16 SSH 210 Server: [TCP Spurious Retransmission] , Encrypted packet (len=144)
   37 1.781829563 192.168.1.16 → 10.6.15.144  TCP 78 [TCP Dup ACK 33#2] 59298 → 22 [ACK] Seq=1261 Ack=1033 Win=5703 Len=0 TSval=5466952 TSecr=6063288 SLE=889 SRE=1033
   38 1.903276395 192.168.1.16 → 10.6.15.144  SSH 102 Client: Encrypted packet (len=36)
   39 1.904209518 192.168.1.16 → 10.6.15.144  SSH 186 Client: Encrypted packet (len=120)
   40 1.914161482  10.6.15.144 → 192.168.1.16 TCP 66 22 → 59298 [ACK] Seq=1033 Ack=1417 Win=1452 Len=0 TSval=6063352 TSecr=5466982
   41 1.951488780  10.6.15.144 → 192.168.1.16 SSH 174 Server: Encrypted packet (len=108)
   42 1.951505348 192.168.1.16 → 10.6.15.144  TCP 66 59298 → 22 [ACK] Seq=1417 Ack=1141 Win=5703 Len=0 TSval=5466995 TSecr=6063361
   43 1.951767444 192.168.1.16 → 10.6.15.144  SSH 102 Client: Encrypted packet (len=36)
   44 1.952340140 192.168.1.16 → 10.6.15.144  SSH 1514 Client: Encrypted packet (len=1448)
   45 1.952758414  10.6.15.144 → 192.168.1.16 SSH 118 Server: Encrypted packet (len=52)
   46 1.953628627 192.168.1.16 → 10.6.15.144  SSH 974 Client: Encrypted packet (len=908)
   47 1.963152276  10.6.15.144 → 192.168.1.16 TCP 66 22 → 59298 [ACK] Seq=1193 Ack=2901 Win=1452 Len=0 TSval=6063364 TSecr=5466995
   48 2.000822479  10.6.15.144 → 192.168.1.16 TCP 66 22 → 59298 [ACK] Seq=1193 Ack=3809 Win=1452 Len=0 TSval=6063374 TSecr=5466995
   49 3.797157107  10.6.15.144 → 192.168.1.16 SSH 182 Server: Encrypted packet (len=116)
   50 3.797180154  10.6.15.144 → 192.168.1.16 TCP 182 [TCP Retransmission] 22 → 59298 [PSH, ACK] Seq=1193 Ack=3809 Win=1452 Len=116 TSval=6063531 TSecr=5466995
   51 3.797190594 192.168.1.16 → 10.6.15.144  TCP 78 59298 → 22 [ACK] Seq=3809 Ack=1309 Win=5703 Len=0 TSval=5467456 TSecr=6063531 SLE=1193 SRE=1309
   52 3.797361782  192.168.1.1 → 224.0.0.1    IGMPv2 42 Membership Query, general
   53 4.787304330 192.168.1.16 → 224.0.0.252  IGMPv2 46 Membership Report group 224.0.0.252
   54 9.481205958 192.168.1.16 → 139.59.50.38 NTP 90 NTP Version 4, client
   55 9.683280764 192.168.1.16 → 224.0.0.251  IGMPv2 46 Membership Report group 224.0.0.251
   56 10.342973340 192.168.1.16 → 10.6.15.144  SSH 1514 Client: Encrypted packet (len=1448)
   57 10.344408053 192.168.1.16 → 10.6.15.144  SSH 350 Client: Encrypted packet (len=284)
   58 10.346761849  10.6.15.144 → 192.168.1.16 SSH 102 Server: Encrypted packet (len=36)
   59 10.346803593 192.168.1.16 → 10.6.15.144  TCP 66 59298 → 22 [ACK] Seq=5541 Ack=1345 Win=5703 Len=0 TSval=5469093 TSecr=6065366
   60 10.354495708  10.6.15.144 → 192.168.1.16 TCP 66 22 → 59298 [ACK] Seq=1345 Ack=5257 Win=1452 Len=0 TSval=6065462 TSecr=5469092
   61 10.356439779  10.6.15.144 → 192.168.1.16 TCP 66 22 → 59298 [ACK] Seq=1345 Ack=5541 Win=1452 Len=0 TSval=6065463 TSecr=5469093
   62 10.359326686  10.6.15.144 → 192.168.1.16 SSH 134 Server: Encrypted packet (len=68)
   63 10.359353291 192.168.1.16 → 10.6.15.144  TCP 66 59298 → 22 [ACK] Seq=5541 Ack=1413 Win=5703 Len=0 TSval=5469097 TSecr=6065463
   64 10.881804750 192.168.1.16 → 54.76.71.168 TCP 128 42414 → 8282 [PSH, ACK] Seq=1 Ack=1 Win=296 Len=62 TSval=5469227 TSecr=609574454
   65 10.883643505  10.6.15.144 → 192.168.1.16 SSH 806 Server: Encrypted packet (len=740)
   66 10.883671757 192.168.1.16 → 10.6.15.144  TCP 66 59298 → 22 [ACK] Seq=5541 Ack=2153 Win=5703 Len=0 TSval=5469228 TSecr=6065494
   67 10.884655326  10.6.15.144 → 192.168.1.16 SSH 446 Server: Encrypted packet (len=380)
   68 10.884673164 192.168.1.16 → 10.6.15.144  TCP 66 59298 → 22 [ACK] Seq=5541 Ack=2533 Win=5703 Len=0 TSval=5469228 TSecr=6065494
   69 10.885308281 192.168.1.16 → 10.6.15.144  SSH 134 Client: Encrypted packet (len=68)
   70 10.931953247  10.6.15.144 → 192.168.1.16 TCP 66 22 → 59298 [ACK] Seq=2533 Ack=5609 Win=1452 Len=0 TSval=6065607 TSecr=5469228
   71 11.797252920 54.76.71.168 → 192.168.1.16 TCP 66 8282 → 42414 [ACK] Seq=1 Ack=63 Win=121 Len=0 TSval=609581203 TSecr=5469227
   72 18.481258969 192.168.1.16 → 52.66.5.185  NTP 90 NTP Version 4, client
   73 29.781103123  10.22.18.21 → 224.0.0.252  LLMNR 64 Standard query 0xb29f ANY Aman
   74 30.805182339  10.22.18.21 → 224.0.0.252  LLMNR 64 Standard query 0xb29f ANY Aman
   75 30.805565620  10.22.18.21 → 224.0.0.252  LLMNR 64 Standard query 0x2633 ANY Aman
   76 30.839617182  10.22.18.21 → 224.0.0.252  LLMNR 64 Standard query 0x2633 ANY Aman
   77 32.481312064 192.168.1.16 → 123.108.200.124 NTP 90 NTP Version 4, client
   78 33.781190051 10.22.18.151 → 224.0.0.252  LLMNR 69 Standard query 0xa1c4 A tufpyqjbx
   79 33.781574047 10.22.18.151 → 224.0.0.252  LLMNR 70 Standard query 0xc924 A ylwwjfauhm
   80 33.781958229 10.22.18.151 → 224.0.0.252  LLMNR 74 Standard query 0xa2fc A ovfamqpoqdcrqi
   81 33.782304735 10.22.18.151 → 224.0.0.252  LLMNR 70 Standard query 0xc924 A ylwwjfauhm
   82 33.782726785 10.22.18.151 → 224.0.0.252  LLMNR 69 Standard query 0xa1c4 A tufpyqjbx
   83 33.783073789 10.22.18.151 → 224.0.0.252  LLMNR 74 Standard query 0xa2fc A ovfamqpoqdcrqi
   84 33.783502866  10.6.15.144 → 192.168.1.16 SSH 118 Server: Encrypted packet (len=52)
   85 33.783882907  10.6.15.144 → 192.168.1.16 SSH 102 Server: Encrypted packet (len=36)
   86 33.783959195 192.168.1.16 → 10.6.15.144  TCP 66 59298 → 22 [ACK] Seq=5609 Ack=2621 Win=5703 Len=0 TSval=5474953 TSecr=6071242
   87 34.805282425  10.22.18.21 → 224.0.0.252  LLMNR 64 Standard query 0xaa4d ANY Aman
   88 34.805667167  10.22.18.21 → 224.0.0.252  LLMNR 64 Standard query 0xaa4d ANY Aman
   89 34.806076801  10.6.15.144 → 192.168.1.16 SSH 242 Server: Encrypted packet (len=176)
   90 34.806379971  10.6.15.144 → 192.168.1.16 SSH 246 Server: Encrypted packet (len=180)
   91 34.806469592 192.168.1.16 → 10.6.15.144  TCP 66 59298 → 22 [ACK] Seq=5609 Ack=2977 Win=5703 Len=0 TSval=5475208 TSecr=6071470
   92 34.806786496  10.6.15.144 → 192.168.1.16 SSH 102 Server: Encrypted packet (len=36)
   93 34.816270668  10.6.15.144 → 192.168.1.16 SSH 378 Server: Encrypted packet (len=312)
   94 34.816409338 192.168.1.16 → 10.6.15.144  TCP 66 59298 → 22 [ACK] Seq=5609 Ack=3325 Win=5703 Len=0 TSval=5475211 TSecr=6071470
   95 35.481280720 192.168.1.16 → 139.59.50.38 NTP 90 NTP Version 4, client
   96 35.492747094 10.119.73.122 → 192.168.1.16 ICMP 110 Destination unreachable (Communication administratively filtered)
