    1 0.000000000  10.6.15.156 → 192.168.1.12 SSH 502 Server: Encrypted packet (len=436)
    2 0.000026915 192.168.1.12 → 10.6.15.156  TCP 66 54766 → 22 [ACK] Seq=1 Ack=437 Win=4866 Len=0 TSval=7755554 TSecr=14687050
    3 0.036164649  10.6.15.156 → 192.168.1.12 SSH 110 Server: Encrypted packet (len=44)
    4 0.036186461 192.168.1.12 → 10.6.15.156  TCP 66 54766 → 22 [ACK] Seq=1 Ack=481 Win=4866 Len=0 TSval=7755563 TSecr=14687059
    5 0.036516068 192.168.1.12 → 10.6.15.156  SSH 430 Client: Encrypted packet (len=364)
    6 0.036537019  10.6.15.156 → 192.168.1.12 SSH 102 Server: Encrypted packet (len=36)
    7 0.038294195  10.6.15.156 → 192.168.1.12 TCP 66 22 → 54766 [ACK] Seq=517 Ack=365 Win=1452 Len=0 TSval=14687060 TSecr=7755563
    8 0.076649871 192.168.1.12 → 10.6.15.156  TCP 66 54766 → 22 [ACK] Seq=365 Ack=517 Win=4866 Len=0 TSval=7755574 TSecr=14687059
    9 0.310437293  10.6.15.156 → 192.168.1.12 SSH 382 Server: Encrypted packet (len=316)
   10 0.310463324 192.168.1.12 → 10.6.15.156  TCP 66 54766 → 22 [ACK] Seq=365 Ack=833 Win=4866 Len=0 TSval=7755632 TSecr=14687128
   11 0.454357407 192.168.1.12 → 10.6.15.156  SSH 118 Client: Encrypted packet (len=52)
   12 0.455812694  10.6.15.156 → 192.168.1.12 TCP 66 22 → 54766 [ACK] Seq=833 Ack=417 Win=1452 Len=0 TSval=14687164 TSecr=7755668
   13 0.516849181 192.168.1.12 → 10.6.15.156  SSH 150 Client: Encrypted packet (len=84)
   14 0.518401448  10.6.15.156 → 192.168.1.12 TCP 66 22 → 54766 [ACK] Seq=833 Ack=501 Win=1452 Len=0 TSval=14687180 TSecr=7755684
   15 0.792347141 192.168.1.12 → 10.6.15.156  SSH 862 Client: Encrypted packet (len=796)
   16 0.794456826  10.6.15.156 → 192.168.1.12 TCP 66 22 → 54766 [ACK] Seq=833 Ack=1297 Win=1452 Len=0 TSval=14687249 TSecr=7755752
   17 0.888648138 192.168.1.12 → 23.58.43.27  TCP 66 47480 → 80 [ACK] Seq=1 Ack=1 Win=274 Len=0 TSval=7755777 TSecr=2209666135
   18 1.231979239 192.168.1.12 → 10.6.15.156  SSH 278 Client: Encrypted packet (len=212)
   19 1.232179981 192.168.1.12 → 10.6.15.156  SSH 1514 Client: Encrypted packet (len=1448)
   20 1.233115456 192.168.1.12 → 10.6.15.156  SSH 334 Client: Encrypted packet (len=268)
   21 1.258961391  10.6.15.156 → 192.168.1.12 TCP 66 22 → 54766 [ACK] Seq=833 Ack=1509 Win=1452 Len=0 TSval=14687364 TSecr=7755862
   22 1.259125869  10.6.15.156 → 192.168.1.12 TCP 66 22 → 54766 [ACK] Seq=833 Ack=2957 Win=1444 Len=0 TSval=14687364 TSecr=7755862
   23 1.259272159  10.6.15.156 → 192.168.1.12 TCP 66 22 → 54766 [ACK] Seq=833 Ack=3225 Win=1442 Len=0 TSval=14687364 TSecr=7755863
   24 1.638635838  10.6.15.156 → 192.168.1.12 SSH 142 Server: Encrypted packet (len=76)
   25 1.638660353 192.168.1.12 → 10.6.15.156  TCP 66 54766 → 22 [ACK] Seq=3225 Ack=909 Win=4866 Len=0 TSval=7755964 TSecr=14687460
   26 1.704035193  10.6.15.156 → 192.168.1.12 SSH 102 Server: Encrypted packet (len=36)
   27 1.704052505 192.168.1.12 → 10.6.15.156  TCP 66 54766 → 22 [ACK] Seq=3225 Ack=945 Win=4866 Len=0 TSval=7755980 TSecr=14687476
   28 1.704420146 192.168.1.12 → 10.6.15.156  SSH 118 Client: Encrypted packet (len=52)
   29 1.707291197  10.6.15.156 → 192.168.1.12 TCP 66 22 → 54766 [ACK] Seq=945 Ack=3277 Win=1452 Len=0 TSval=14687477 TSecr=7755980
   30 1.745629721  10.6.15.156 → 192.168.1.12 SSH 838 Server: Encrypted packet (len=772)
   31 1.745765570  10.6.15.156 → 192.168.1.12 SSH 374 Server: Encrypted packet (len=308)
   32 1.745787722 192.168.1.12 → 10.6.15.156  TCP 66 54766 → 22 [ACK] Seq=3277 Ack=2025 Win=4866 Len=0 TSval=7755991 TSecr=14687486
   33 1.747344713 192.168.1.12 → 10.6.15.156  SSH 142 Client: Encrypted packet (len=76)
   34 1.786399202  10.6.15.156 → 192.168.1.12 TCP 66 22 → 54766 [ACK] Seq=2025 Ack=3353 Win=1452 Len=0 TSval=14687497 TSecr=7755991
   35 1.791601659  10.6.15.156 → 192.168.1.12 SSH 1514 Server: Encrypted packet (len=1448)
   36 1.791918393  10.6.15.156 → 192.168.1.12 SSH 1514 Server: Encrypted packet (len=1448)
   37 1.791928322 192.168.1.12 → 10.6.15.156  TCP 66 54766 → 22 [ACK] Seq=3353 Ack=4921 Win=4866 Len=0 TSval=7756002 TSecr=14687498
   38 1.792240496  10.6.15.156 → 192.168.1.12 SSH 1514 Server: Encrypted packet (len=1448)
   39 1.792429127  10.6.15.156 → 192.168.1.12 SSH 630 Server: Encrypted packet (len=564)
   40 1.792439268 192.168.1.12 → 10.6.15.156  TCP 66 54766 → 22 [ACK] Seq=3353 Ack=6933 Win=4866 Len=0 TSval=7756002 TSecr=14687498
   41 1.793805687  10.6.15.156 → 192.168.1.12 SSH 1514 Server: Encrypted packet (len=1448)
   42 1.794123152  10.6.15.156 → 192.168.1.12 SSH 1514 Server: Encrypted packet (len=1448)
   43 1.794132939 192.168.1.12 → 10.6.15.156  TCP 66 54766 → 22 [ACK] Seq=3353 Ack=9829 Win=4866 Len=0 TSval=7756003 TSecr=14687498
   44 1.794443552  10.6.15.156 → 192.168.1.12 SSH 1514 Server: Encrypted packet (len=1448)
   45 1.794765025  10.6.15.156 → 192.168.1.12 SSH 1514 Server: Encrypted packet (len=1448)
   46 1.794774389 192.168.1.12 → 10.6.15.156  TCP 66 54766 → 22 [ACK] Seq=3353 Ack=12725 Win=4866 Len=0 TSval=7756003 TSecr=14687498
   47 1.795104892  10.6.15.156 → 192.168.1.12 SSH 1514 Server: Encrypted packet (len=1448)
   48 1.795406816  10.6.15.156 → 192.168.1.12 SSH 1514 Server: Encrypted packet (len=1448)
   49 1.795414361 192.168.1.12 → 10.6.15.156  TCP 66 54766 → 22 [ACK] Seq=3353 Ack=15621 Win=4866 Len=0 TSval=7756003 TSecr=14687498
   50 1.795636014 192.168.1.12 → 10.6.15.156  SSH 862 Client: Encrypted packet (len=796)
   51 1.795751012  10.6.15.156 → 192.168.1.12 SSH 1514 Server: Encrypted packet (len=1448)
   52 1.796049986  10.6.15.156 → 192.168.1.12 SSH 1514 Server: Encrypted packet (len=1448)
   53 1.796057646 192.168.1.12 → 10.6.15.156  TCP 66 54766 → 22 [ACK] Seq=4149 Ack=18517 Win=4866 Len=0 TSval=7756003 TSecr=14687498
   54 1.796372181  10.6.15.156 → 192.168.1.12 SSH 1514 Server: Encrypted packet (len=1448)
   55 1.796381774  10.6.15.156 → 192.168.1.12 SSH 214 Server: Encrypted packet (len=148)
   56 1.796388800 192.168.1.12 → 10.6.15.156  TCP 66 54766 → 22 [ACK] Seq=4149 Ack=20113 Win=4866 Len=0 TSval=7756003 TSecr=14687498
   57 1.796606331  10.6.15.156 → 192.168.1.12 SSH 1514 Server: Encrypted packet (len=1448)
   58 1.796787662  10.6.15.156 → 192.168.1.12 SSH 1514 Server: Encrypted packet (len=1448)
   59 1.796794927 192.168.1.12 → 10.6.15.156  TCP 66 54766 → 22 [ACK] Seq=4149 Ack=23009 Win=4866 Len=0 TSval=7756004 TSecr=14687499
   60 1.796978510  10.6.15.156 → 192.168.1.12 SSH 1514 Server: Encrypted packet (len=1448)
   61 1.797170918  10.6.15.156 → 192.168.1.12 SSH 1514 Server: Encrypted packet (len=1448)
   62 1.797177106 192.168.1.12 → 10.6.15.156  TCP 66 54766 → 22 [ACK] Seq=4149 Ack=25905 Win=4866 Len=0 TSval=7756004 TSecr=14687499
   63 1.798195620 192.168.1.12 → 10.6.15.156  SSH 102 Client: Encrypted packet (len=36)
   64 1.799818632  10.6.15.156 → 192.168.1.12 SSH 1514 Server: Encrypted packet (len=1448)
   65 1.800004558  10.6.15.156 → 192.168.1.12 SSH 1514 Server: Encrypted packet (len=1448)
   66 1.800009847 192.168.1.12 → 10.6.15.156  TCP 66 54766 → 22 [ACK] Seq=4185 Ack=28801 Win=4866 Len=0 TSval=7756004 TSecr=14687500
   67 1.800197378  10.6.15.156 → 192.168.1.12 SSH 1514 Server: Encrypted packet (len=1448)
   68 1.800202612  10.6.15.156 → 192.168.1.12 SSH 190 Server: Encrypted packet (len=124)
   69 1.800205060 192.168.1.12 → 10.6.15.156  TCP 66 54766 → 22 [ACK] Seq=4185 Ack=30373 Win=4866 Len=0 TSval=7756004 TSecr=14687500
   70 1.800210287  10.6.15.156 → 192.168.1.12 TCP 66 22 → 54766 [ACK] Seq=30373 Ack=4149 Win=1452 Len=0 TSval=14687500 TSecr=7756003
   71 1.800227802  10.6.15.156 → 192.168.1.12 TCP 66 22 → 54766 [ACK] Seq=30373 Ack=4185 Win=1452 Len=0 TSval=14687500 TSecr=7756004
   72 1.812555765 192.168.1.12 → 10.6.15.156  SSH 102 Client: Encrypted packet (len=36)
   73 1.814525335  10.6.15.156 → 192.168.1.12 TCP 66 22 → 54766 [ACK] Seq=30373 Ack=4221 Win=1452 Len=0 TSval=14687503 TSecr=7756007
   74 1.841953383 192.168.1.12 → 10.6.15.156  SSH 102 Client: Encrypted packet (len=36)
   75 1.844573274  10.6.15.156 → 192.168.1.12 TCP 66 22 → 54766 [ACK] Seq=30373 Ack=4257 Win=1452 Len=0 TSval=14687511 TSecr=7756015
   76 1.844599901 192.168.1.12 → 10.6.15.156  SSH 118 Client: Encrypted packet (len=52)
   77 1.846908830  10.6.15.156 → 192.168.1.12 TCP 66 22 → 54766 [ACK] Seq=30373 Ack=4309 Win=1452 Len=0 TSval=14687512 TSecr=7756016
   78 1.852923434 192.168.1.12 → 10.6.15.156  SSH 102 Client: Encrypted packet (len=36)
   79 1.894571879  10.6.15.156 → 192.168.1.12 TCP 66 22 → 54766 [ACK] Seq=30373 Ack=4345 Win=1452 Len=0 TSval=14687524 TSecr=7756018
   80 1.894590625 192.168.1.12 → 10.6.15.156  SSH 102 Client: Encrypted packet (len=36)
   81 1.934922355  10.6.15.156 → 192.168.1.12 TCP 66 22 → 54766 [ACK] Seq=30373 Ack=4381 Win=1452 Len=0 TSval=14687534 TSecr=7756028
   82 2.788146140 192.168.1.12 → 10.6.15.156  SSH 102 Client: Encrypted packet (len=36)
   83 2.789920352  10.6.15.156 → 192.168.1.12 TCP 66 22 → 54766 [ACK] Seq=30373 Ack=4417 Win=1452 Len=0 TSval=14687747 TSecr=7756251
   84 2.876001180 192.168.1.12 → 192.168.1.1  DNS 81 Standard query 0x2cc0 A 3.ubuntu.pool.ntp.org
   85 2.880589602  192.168.1.1 → 192.168.1.12 DNS 145 Standard query response 0x2cc0 A 3.ubuntu.pool.ntp.org A 139.59.16.133 A 139.59.21.22 A 52.66.76.135 A 123.108.200.124
   86 2.881019165 192.168.1.12 → 139.59.16.133 NTP 90 NTP Version 4, client
   87 3.000423228  10.6.15.156 → 192.168.1.12 SSH 1514 Server: Encrypted packet (len=1448)
   88 3.000561432  10.6.15.156 → 192.168.1.12 SSH 1514 Server: Encrypted packet (len=1448)
   89 3.000571056 192.168.1.12 → 10.6.15.156  TCP 66 54766 → 22 [ACK] Seq=4417 Ack=33269 Win=4866 Len=0 TSval=7756304 TSecr=14687799
   90 3.000663927  10.6.15.156 → 192.168.1.12 SSH 1042 Server: Encrypted packet (len=976)
   91 3.000851329 192.168.1.12 → 10.6.15.156  SSH 102 Client: Encrypted packet (len=36)
   92 3.002873529  10.6.15.156 → 192.168.1.12 TCP 66 22 → 54766 [ACK] Seq=34245 Ack=4453 Win=1452 Len=0 TSval=14687801 TSecr=7756305
   93 3.002890735 192.168.1.12 → 10.6.15.156  SSH 306 Client: Encrypted packet (len=240)
   94 3.005161219  10.6.15.156 → 192.168.1.12 TCP 66 22 → 54766 [ACK] Seq=34245 Ack=4693 Win=1452 Len=0 TSval=14687801 TSecr=7756305
   95 3.029448117  10.6.15.156 → 192.168.1.12 SSH 182 Server: Encrypted packet (len=116)
   96 3.029824760 192.168.1.12 → 10.6.15.156  SSH 166 Client: Encrypted packet (len=100)
   97 3.030149757 192.168.1.12 → 10.6.15.156  SSH 210 Client: Encrypted packet (len=144)
   98 3.032244529  10.6.15.156 → 192.168.1.12 TCP 66 22 → 54766 [ACK] Seq=34361 Ack=4937 Win=1452 Len=0 TSval=14687808 TSecr=7756312
   99 3.070589208  10.6.15.156 → 192.168.1.12 SSH 1414 Server: Encrypted packet (len=1348)
  100 3.070716015  10.6.15.156 → 192.168.1.12 SSH 1514 Server: Encrypted packet (len=1448)
  101 3.070724443 192.168.1.12 → 10.6.15.156  TCP 66 54766 → 22 [ACK] Seq=4937 Ack=37157 Win=4866 Len=0 TSval=7756322 TSecr=14687817
  102 3.070907242  10.6.15.156 → 192.168.1.12 SSH 1514 Server: Encrypted packet (len=1448)
  103 3.071103717  10.6.15.156 → 192.168.1.12 SSH 1514 Server: Encrypted packet (len=1448)
  104 3.071110667 192.168.1.12 → 10.6.15.156  TCP 66 54766 → 22 [ACK] Seq=4937 Ack=40053 Win=4866 Len=0 TSval=7756322 TSecr=14687817
  105 3.071293274  10.6.15.156 → 192.168.1.12 SSH 1514 Server: Encrypted packet (len=1448)
  106 3.071484965  10.6.15.156 → 192.168.1.12 SSH 1514 Server: Encrypted packet (len=1448)
  107 3.071492881 192.168.1.12 → 10.6.15.156  TCP 66 54766 → 22 [ACK] Seq=4937 Ack=42949 Win=4866 Len=0 TSval=7756322 TSecr=14687817
  108 3.071523061  10.6.15.156 → 192.168.1.12 SSH 458 Server: Encrypted packet (len=392)
  109 3.073042922  10.6.15.156 → 192.168.1.12 SSH 1514 Server: Encrypted packet (len=1448)
  110 3.073059838 192.168.1.12 → 10.6.15.156  TCP 66 54766 → 22 [ACK] Seq=4937 Ack=44789 Win=4866 Len=0 TSval=7756323 TSecr=14687817
  111 3.073229020  10.6.15.156 → 192.168.1.12 SSH 1514 Server: Encrypted packet (len=1448)
  112 3.073569742  10.6.15.156 → 192.168.1.12 SSH 1514 Server: Encrypted packet (len=1448)
  113 3.073574760 192.168.1.12 → 10.6.15.156  TCP 66 54766 → 22 [ACK] Seq=4937 Ack=47685 Win=4866 Len=0 TSval=7756323 TSecr=14687818
  114 3.078978819  10.6.15.156 → 192.168.1.12 SSH 1514 Server: Encrypted packet (len=1448)
  115 3.079290606  10.6.15.156 → 192.168.1.12 SSH 1514 Server: Encrypted packet (len=1448)
  116 3.079301373 192.168.1.12 → 10.6.15.156  TCP 66 54766 → 22 [ACK] Seq=4937 Ack=50581 Win=4866 Len=0 TSval=7756324 TSecr=14687819
  117 3.079481726  10.6.15.156 → 192.168.1.12 SSH 1514 Server: Encrypted packet (len=1448)
  118 3.079827259  10.6.15.156 → 192.168.1.12 SSH 1514 Server: Encrypted packet (len=1448)
  119 3.079834534 192.168.1.12 → 10.6.15.156  TCP 66 54766 → 22 [ACK] Seq=4937 Ack=53477 Win=4866 Len=0 TSval=7756324 TSecr=14687819
  120 3.080013651  10.6.15.156 → 192.168.1.12 SSH 1514 Server: Encrypted packet (len=1448)
  121 3.080195855  10.6.15.156 → 192.168.1.12 SSH 1514 Server: Encrypted packet (len=1448)
  122 3.080201028 192.168.1.12 → 10.6.15.156  TCP 66 54766 → 22 [ACK] Seq=4937 Ack=56373 Win=4866 Len=0 TSval=7756324 TSecr=14687819
  123 3.080388804  10.6.15.156 → 192.168.1.12 SSH 1514 Server: Encrypted packet (len=1448)
  124 3.081913674  10.6.15.156 → 192.168.1.12 SSH 1514 Server: Encrypted packet (len=1448)
  125 3.081928556 192.168.1.12 → 10.6.15.156  TCP 66 54766 → 22 [ACK] Seq=4937 Ack=59269 Win=4866 Len=0 TSval=7756325 TSecr=14687819
  126 3.081939907  10.6.15.156 → 192.168.1.12 SSH 1514 Server: Encrypted packet (len=1448)
  127 3.081945376  10.6.15.156 → 192.168.1.12 SSH 1514 Server: Encrypted packet (len=1448)
  128 3.081948094 192.168.1.12 → 10.6.15.156  TCP 66 54766 → 22 [ACK] Seq=4937 Ack=62165 Win=4866 Len=0 TSval=7756325 TSecr=14687819
  129 3.081951133  10.6.15.156 → 192.168.1.12 SSH 1514 Server: Encrypted packet (len=1448)
  130 3.081953476  10.6.15.156 → 192.168.1.12 SSH 1514 Server: Encrypted packet (len=1448)
  131 3.081955889 192.168.1.12 → 10.6.15.156  TCP 66 54766 → 22 [ACK] Seq=4937 Ack=65061 Win=4866 Len=0 TSval=7756325 TSecr=14687819
  132 3.081958439  10.6.15.156 → 192.168.1.12 SSH 470 Server: Encrypted packet (len=404)
  133 3.083240631  10.6.15.156 → 192.168.1.12 SSH 1034 Server: Encrypted packet (len=968)
  134 3.083289052 192.168.1.12 → 10.6.15.156  TCP 66 54766 → 22 [ACK] Seq=4937 Ack=66433 Win=4866 Len=0 TSval=7756325 TSecr=14687819
  135 3.083439644  10.6.15.156 → 192.168.1.12 SSH 1514 Server: Encrypted packet (len=1448)
  136 3.083631673  10.6.15.156 → 192.168.1.12 SSH 1514 Server: Encrypted packet (len=1448)
  137 3.083638426 192.168.1.12 → 10.6.15.156  TCP 66 54766 → 22 [ACK] Seq=4937 Ack=69329 Win=4866 Len=0 TSval=7756325 TSecr=14687819
  138 3.083742210  10.6.15.156 → 192.168.1.12 SSH 982 Server: Encrypted packet (len=916)
  139 3.086065102  10.6.15.156 → 192.168.1.12 SSH 1514 Server: Encrypted packet (len=1448)
  140 3.086080060 192.168.1.12 → 10.6.15.156  TCP 66 54766 → 22 [ACK] Seq=4937 Ack=71693 Win=4866 Len=0 TSval=7756326 TSecr=14687819
  141 3.086246482  10.6.15.156 → 192.168.1.12 SSH 1514 Server: Encrypted packet (len=1448)
  142 3.086438452  10.6.15.156 → 192.168.1.12 SSH 1514 Server: Encrypted packet (len=1448)
  143 3.086441347 192.168.1.12 → 10.6.15.156  TCP 66 54766 → 22 [ACK] Seq=4937 Ack=74589 Win=4866 Len=0 TSval=7756326 TSecr=14687821
  144 3.086633447  10.6.15.156 → 192.168.1.12 SSH 1514 Server: Encrypted packet (len=1448)
  145 3.086824473  10.6.15.156 → 192.168.1.12 SSH 1514 Server: Encrypted packet (len=1448)
  146 3.086831227 192.168.1.12 → 10.6.15.156  TCP 66 54766 → 22 [ACK] Seq=4937 Ack=77485 Win=4866 Len=0 TSval=7756326 TSecr=14687821
  147 3.087014688  10.6.15.156 → 192.168.1.12 SSH 1514 Server: Encrypted packet (len=1448)
  148 3.087278657  10.6.15.156 → 192.168.1.12 SSH 974 Server: Encrypted packet (len=908)
  149 3.087285001 192.168.1.12 → 10.6.15.156  TCP 66 54766 → 22 [ACK] Seq=4937 Ack=79841 Win=4866 Len=0 TSval=7756326 TSecr=14687821
  150 3.102768683  10.6.15.156 → 192.168.1.12 SSH 238 Server: Encrypted packet (len=172)
  151 3.105287215  10.6.15.156 → 192.168.1.12 SSH 1514 Server: Encrypted packet (len=1448)
  152 3.105301714 192.168.1.12 → 10.6.15.156  TCP 66 54766 → 22 [ACK] Seq=4937 Ack=81461 Win=4866 Len=0 TSval=7756331 TSecr=14687825
  153 3.105466066  10.6.15.156 → 192.168.1.12 SSH 1514 Server: Encrypted packet (len=1448)
  154 3.105812455  10.6.15.156 → 192.168.1.12 SSH 1514 Server: Encrypted packet (len=1448)
  155 3.105815355 192.168.1.12 → 10.6.15.156  TCP 66 54766 → 22 [ACK] Seq=4937 Ack=84357 Win=4866 Len=0 TSval=7756331 TSecr=14687826
  156 3.105821139  10.6.15.156 → 192.168.1.12 SSH 142 Server: Encrypted packet (len=76)
  157 3.106001796  10.6.15.156 → 192.168.1.12 SSH 1514 Server: Encrypted packet (len=1448)
  158 3.106008689 192.168.1.12 → 10.6.15.156  TCP 66 54766 → 22 [ACK] Seq=4937 Ack=85881 Win=4866 Len=0 TSval=7756331 TSecr=14687826
  159 3.106019899  10.6.15.156 → 192.168.1.12 SSH 118 Server: Encrypted packet (len=52)
  160 3.106215552  10.6.15.156 → 192.168.1.12 SSH 1514 Server: Encrypted packet (len=1448)
  161 3.106222472 192.168.1.12 → 10.6.15.156  TCP 66 54766 → 22 [ACK] Seq=4937 Ack=87381 Win=4866 Len=0 TSval=7756331 TSecr=14687826
  162 3.106403571  10.6.15.156 → 192.168.1.12 SSH 1514 Server: Encrypted packet (len=1448)
  163 3.106595953  10.6.15.156 → 192.168.1.12 SSH 1514 Server: Encrypted packet (len=1448)
  164 3.106601001 192.168.1.12 → 10.6.15.156  TCP 66 54766 → 22 [ACK] Seq=4937 Ack=90277 Win=4866 Len=0 TSval=7756331 TSecr=14687826
  165 3.106942424  10.6.15.156 → 192.168.1.12 SSH 1514 Server: Encrypted packet (len=1448)
  166 3.106948899  10.6.15.156 → 192.168.1.12 SSH 158 Server: Encrypted packet (len=92)
  167 3.106951595 192.168.1.12 → 10.6.15.156  TCP 66 54766 → 22 [ACK] Seq=4937 Ack=91817 Win=4866 Len=0 TSval=7756331 TSecr=14687826
  168 3.107153780  10.6.15.156 → 192.168.1.12 SSH 1514 Server: Encrypted packet (len=1448)
  169 3.107346030  10.6.15.156 → 192.168.1.12 SSH 1514 Server: Encrypted packet (len=1448)
  170 3.107351460 192.168.1.12 → 10.6.15.156  TCP 66 54766 → 22 [ACK] Seq=4937 Ack=94713 Win=4866 Len=0 TSval=7756331 TSecr=14687826
  171 3.107688111  10.6.15.156 → 192.168.1.12 SSH 1514 Server: Encrypted packet (len=1448)
  172 3.107880616  10.6.15.156 → 192.168.1.12 SSH 1514 Server: Encrypted packet (len=1448)
  173 3.107884153 192.168.1.12 → 10.6.15.156  TCP 66 54766 → 22 [ACK] Seq=4937 Ack=97609 Win=4866 Len=0 TSval=7756331 TSecr=14687826
  174 3.107889926  10.6.15.156 → 192.168.1.12 SSH 158 Server: Encrypted packet (len=92)
  175 3.139598176  10.6.15.156 → 192.168.1.12 SSH 1514 Server: Encrypted packet (len=1448)
  176 3.139615803 192.168.1.12 → 10.6.15.156  TCP 66 54766 → 22 [ACK] Seq=4937 Ack=99149 Win=4866 Len=0 TSval=7756339 TSecr=14687826
  177 3.139656325  10.6.15.156 → 192.168.1.12 SSH 1014 Server: Encrypted packet (len=948)
  178 3.149885030  10.6.15.156 → 192.168.1.12 SSH 1514 Server: Encrypted packet (len=1448)
  179 3.149900940 192.168.1.12 → 10.6.15.156  TCP 66 54766 → 22 [ACK] Seq=4937 Ack=101545 Win=4866 Len=0 TSval=7756342 TSecr=14687835
  180 3.150063900  10.6.15.156 → 192.168.1.12 SSH 1514 Server: Encrypted packet (len=1448)
  181 3.150248727  10.6.15.156 → 192.168.1.12 SSH 1514 Server: Encrypted packet (len=1448)
  182 3.150253792 192.168.1.12 → 10.6.15.156  TCP 66 54766 → 22 [ACK] Seq=4937 Ack=104441 Win=4866 Len=0 TSval=7756342 TSecr=14687837
  183 3.150453012  10.6.15.156 → 192.168.1.12 SSH 1514 Server: Encrypted packet (len=1448)
  184 3.153560674  10.6.15.156 → 192.168.1.12 SSH 158 Server: Encrypted packet (len=92)
  185 3.153576013 192.168.1.12 → 10.6.15.156  TCP 66 54766 → 22 [ACK] Seq=4937 Ack=105981 Win=4866 Len=0 TSval=7756343 TSecr=14687837
  186 3.153788225  10.6.15.156 → 192.168.1.12 SSH 1514 Server: Encrypted packet (len=1448)
  187 3.153991008  10.6.15.156 → 192.168.1.12 SSH 1514 Server: Encrypted packet (len=1448)
  188 3.153999294 192.168.1.12 → 10.6.15.156  TCP 66 54766 → 22 [ACK] Seq=4937 Ack=108877 Win=4866 Len=0 TSval=7756343 TSecr=14687837
  189 3.154181253  10.6.15.156 → 192.168.1.12 SSH 1514 Server: Encrypted packet (len=1448)
  190 3.154373004  10.6.15.156 → 192.168.1.12 SSH 1514 Server: Encrypted packet (len=1448)
  191 3.154380328 192.168.1.12 → 10.6.15.156  TCP 66 54766 → 22 [ACK] Seq=4937 Ack=111773 Win=4866 Len=0 TSval=7756343 TSecr=14687837
  192 3.154565700  10.6.15.156 → 192.168.1.12 SSH 1514 Server: Encrypted packet (len=1448)
  193 3.154757875  10.6.15.156 → 192.168.1.12 SSH 1514 Server: Encrypted packet (len=1448)
  194 3.154764524 192.168.1.12 → 10.6.15.156  TCP 66 54766 → 22 [ACK] Seq=4937 Ack=114669 Win=4866 Len=0 TSval=7756343 TSecr=14687837
  195 3.154773215  10.6.15.156 → 192.168.1.12 SSH 182 Server: Encrypted packet (len=116)
  196 3.154966698  10.6.15.156 → 192.168.1.12 SSH 1514 Server: Encrypted packet (len=1448)
  197 3.154973520 192.168.1.12 → 10.6.15.156  TCP 66 54766 → 22 [ACK] Seq=4937 Ack=116233 Win=4866 Len=0 TSval=7756343 TSecr=14687837
  198 3.157040616  10.6.15.156 → 192.168.1.12 SSH 1514 Server: Encrypted packet (len=1448)
  199 3.157232082  10.6.15.156 → 192.168.1.12 SSH 1514 Server: Encrypted packet (len=1448)
  200 3.157242578 192.168.1.12 → 10.6.15.156  TCP 66 54766 → 22 [ACK] Seq=4937 Ack=119129 Win=4866 Len=0 TSval=7756344 TSecr=14687838
  201 3.157418821  10.6.15.156 → 192.168.1.12 SSH 1514 Server: Encrypted packet (len=1448)
  202 3.158929444  10.6.15.156 → 192.168.1.12 SSH 1514 Server: Encrypted packet (len=1448)
  203 3.158948799 192.168.1.12 → 10.6.15.156  TCP 66 54766 → 22 [ACK] Seq=4937 Ack=122025 Win=4866 Len=0 TSval=7756344 TSecr=14687838
  204 3.159113983  10.6.15.156 → 192.168.1.12 SSH 1514 Server: Encrypted packet (len=1448)
  205 3.159304758  10.6.15.156 → 192.168.1.12 SSH 1514 Server: Encrypted packet (len=1448)
  206 3.159313742 192.168.1.12 → 10.6.15.156  TCP 66 54766 → 22 [ACK] Seq=4937 Ack=124921 Win=4866 Len=0 TSval=7756344 TSecr=14687839
  207 3.159495375  10.6.15.156 → 192.168.1.12 SSH 1514 Server: Encrypted packet (len=1448)
  208 3.159688877  10.6.15.156 → 192.168.1.12 SSH 1514 Server: Encrypted packet (len=1448)
  209 3.159696138 192.168.1.12 → 10.6.15.156  TCP 66 54766 → 22 [ACK] Seq=4937 Ack=127817 Win=4866 Len=0 TSval=7756344 TSecr=14687839
  210 3.161679138  10.6.15.156 → 192.168.1.12 SSH 1514 Server: Encrypted packet (len=1448)
  211 3.161799954 192.168.1.12 → 10.6.15.156  SSH 206 Client: Encrypted packet (len=140)
  212 3.161870896  10.6.15.156 → 192.168.1.12 SSH 1514 Server: Encrypted packet (len=1448)
  213 3.162050085  10.6.15.156 → 192.168.1.12 SSH 1514 Server: Encrypted packet (len=1448)
  214 3.162053089 192.168.1.12 → 10.6.15.156  TCP 66 54766 → 22 [ACK] Seq=5077 Ack=132161 Win=4866 Len=0 TSval=7756345 TSecr=14687839
  215 3.162243446  10.6.15.156 → 192.168.1.12 SSH 1514 Server: Encrypted packet (len=1448)
  216 3.162434471  10.6.15.156 → 192.168.1.12 SSH 1514 Server: Encrypted packet (len=1448)
  217 3.162437422 192.168.1.12 → 10.6.15.156  TCP 66 54766 → 22 [ACK] Seq=5077 Ack=135057 Win=4866 Len=0 TSval=7756345 TSecr=14687839
  218 3.162626887  10.6.15.156 → 192.168.1.12 SSH 1514 Server: Encrypted packet (len=1448)
  219 3.162818808  10.6.15.156 → 192.168.1.12 SSH 1514 Server: Encrypted packet (len=1448)
  220 3.162821565 192.168.1.12 → 10.6.15.156  TCP 66 54766 → 22 [ACK] Seq=5077 Ack=137953 Win=4866 Len=0 TSval=7756345 TSecr=14687839
  221 3.163011246  10.6.15.156 → 192.168.1.12 SSH 1514 Server: Encrypted packet (len=1448)
  222 3.163205023  10.6.15.156 → 192.168.1.12 SSH 1514 Server: Encrypted packet (len=1448)
  223 3.163211221 192.168.1.12 → 10.6.15.156  TCP 66 54766 → 22 [ACK] Seq=5077 Ack=140849 Win=4866 Len=0 TSval=7756345 TSecr=14687839
  224 3.163553025  10.6.15.156 → 192.168.1.12 SSH 1514 Server: Encrypted packet (len=1448)
  225 3.163741753  10.6.15.156 → 192.168.1.12 SSH 1514 Server: Encrypted packet (len=1448)
  226 3.163750838 192.168.1.12 → 10.6.15.156  TCP 66 54766 → 22 [ACK] Seq=5077 Ack=143745 Win=4866 Len=0 TSval=7756345 TSecr=14687840
  227 3.163934516  10.6.15.156 → 192.168.1.12 SSH 1514 Server: Encrypted packet (len=1448)
  228 3.164124103  10.6.15.156 → 192.168.1.12 SSH 1514 Server: Encrypted packet (len=1448)
  229 3.164130326 192.168.1.12 → 10.6.15.156  TCP 66 54766 → 22 [ACK] Seq=5077 Ack=146641 Win=4866 Len=0 TSval=7756345 TSecr=14687840
  230 3.164316030  10.6.15.156 → 192.168.1.12 SSH 1514 Server: Encrypted packet (len=1448)
  231 3.164509360  10.6.15.156 → 192.168.1.12 SSH 1514 Server: Encrypted packet (len=1448)
  232 3.164515492 192.168.1.12 → 10.6.15.156  TCP 66 54766 → 22 [ACK] Seq=5077 Ack=149537 Win=4866 Len=0 TSval=7756345 TSecr=14687840
  233 3.164704757  10.6.15.156 → 192.168.1.12 SSH 1514 Server: Encrypted packet (len=1448)
  234 3.164895702  10.6.15.156 → 192.168.1.12 SSH 1514 Server: Encrypted packet (len=1448)
  235 3.164902410 192.168.1.12 → 10.6.15.156  TCP 66 54766 → 22 [ACK] Seq=5077 Ack=152433 Win=4866 Len=0 TSval=7756346 TSecr=14687840
  236 3.165084781  10.6.15.156 → 192.168.1.12 SSH 1514 Server: Encrypted packet (len=1448)
  237 3.165747466 192.168.1.12 → 10.6.15.156  SSH 134 Client: Encrypted packet (len=68)
  238 3.168423932  10.6.15.156 → 192.168.1.12 SSH 1514 Server: Encrypted packet (len=1448)
  239 3.168590274  10.6.15.156 → 192.168.1.12 SSH 1514 Server: Encrypted packet (len=1448)
  240 3.168596849 192.168.1.12 → 10.6.15.156  TCP 66 54766 → 22 [ACK] Seq=5145 Ack=156777 Win=4866 Len=0 TSval=7756347 TSecr=14687842
  241 3.169428934  10.6.15.156 → 192.168.1.12 SSH 1514 Server: Encrypted packet (len=1448)
  242 3.169455007  10.6.15.156 → 192.168.1.12 SSH 602 Server: Encrypted packet (len=536)
  243 3.169460150 192.168.1.12 → 10.6.15.156  TCP 66 54766 → 22 [ACK] Seq=5145 Ack=158761 Win=4866 Len=0 TSval=7756347 TSecr=14687842
  244 3.205042692  10.6.15.156 → 192.168.1.12 SSH 1514 Server: Encrypted packet (len=1448)
  245 3.205199876  10.6.15.156 → 192.168.1.12 SSH 1514 Server: Encrypted packet (len=1448)
  246 3.205211777 192.168.1.12 → 10.6.15.156  TCP 66 54766 → 22 [ACK] Seq=5145 Ack=161657 Win=4866 Len=0 TSval=7756356 TSecr=14687851
  247 3.205575007  10.6.15.156 → 192.168.1.12 SSH 1514 Server: Encrypted packet (len=1448)
  248 3.205733533  10.6.15.156 → 192.168.1.12 SSH 1514 Server: Encrypted packet (len=1448)
  249 3.205745331 192.168.1.12 → 10.6.15.156  TCP 66 54766 → 22 [ACK] Seq=5145 Ack=164553 Win=4866 Len=0 TSval=7756356 TSecr=14687851
  250 3.205759369  10.6.15.156 → 192.168.1.12 SSH 182 Server: Encrypted packet (len=116)
  251 3.206068159  10.6.15.156 → 192.168.1.12 SSH 1514 Server: Encrypted packet (len=1448)
  252 3.206073994 192.168.1.12 → 10.6.15.156  TCP 66 54766 → 22 [ACK] Seq=5145 Ack=166117 Win=4866 Len=0 TSval=7756356 TSecr=14687851
  253 3.206260119  10.6.15.156 → 192.168.1.12 SSH 1514 Server: Encrypted packet (len=1448)
  254 3.206450913  10.6.15.156 → 192.168.1.12 SSH 1514 Server: Encrypted packet (len=1448)
  255 3.206456666 192.168.1.12 → 10.6.15.156  TCP 66 54766 → 22 [ACK] Seq=5145 Ack=169013 Win=4866 Len=0 TSval=7756356 TSecr=14687851
  256 3.206777160  10.6.15.156 → 192.168.1.12 SSH 1310 Server: Encrypted packet (len=1244)
  257 3.207094481  10.6.15.156 → 192.168.1.12 SSH 1514 Server: Encrypted packet (len=1448)
  258 3.207104984 192.168.1.12 → 10.6.15.156  TCP 66 54766 → 22 [ACK] Seq=5145 Ack=171705 Win=4866 Len=0 TSval=7756356 TSecr=14687851
  259 3.207280092  10.6.15.156 → 192.168.1.12 SSH 1514 Server: Encrypted packet (len=1448)
  260 3.207626443  10.6.15.156 → 192.168.1.12 SSH 1514 Server: Encrypted packet (len=1448)
  261 3.207637830 192.168.1.12 → 10.6.15.156  TCP 66 54766 → 22 [ACK] Seq=5145 Ack=174601 Win=4866 Len=0 TSval=7756356 TSecr=14687852
  262 3.207815677  10.6.15.156 → 192.168.1.12 SSH 1514 Server: Encrypted packet (len=1448)
  263 3.208009571  10.6.15.156 → 192.168.1.12 SSH 1514 Server: Encrypted packet (len=1448)
  264 3.208019061 192.168.1.12 → 10.6.15.156  TCP 66 54766 → 22 [ACK] Seq=5145 Ack=177497 Win=4866 Len=0 TSval=7756356 TSecr=14687852
  265 3.208202021  10.6.15.156 → 192.168.1.12 SSH 1514 Server: Encrypted packet (len=1448)
  266 3.209482808  10.6.15.156 → 192.168.1.12 SSH 774 Server: Encrypted packet (len=708)
  267 3.209499009 192.168.1.12 → 10.6.15.156  TCP 66 54766 → 22 [ACK] Seq=5145 Ack=179653 Win=4866 Len=0 TSval=7756357 TSecr=14687852
  268 3.209689789  10.6.15.156 → 192.168.1.12 SSH 1514 Server: Encrypted packet (len=1448)
  269 3.209880574  10.6.15.156 → 192.168.1.12 SSH 1514 Server: Encrypted packet (len=1448)
  270 3.209886256 192.168.1.12 → 10.6.15.156  TCP 66 54766 → 22 [ACK] Seq=5145 Ack=182549 Win=4866 Len=0 TSval=7756357 TSecr=14687852
  271 3.210072760  10.6.15.156 → 192.168.1.12 SSH 1514 Server: Encrypted packet (len=1448)
  272 3.210416963  10.6.15.156 → 192.168.1.12 SSH 1514 Server: Encrypted packet (len=1448)
  273 3.210425049 192.168.1.12 → 10.6.15.156  TCP 66 54766 → 22 [ACK] Seq=5145 Ack=185445 Win=4866 Len=0 TSval=7756357 TSecr=14687852
  274 3.210603981  10.6.15.156 → 192.168.1.12 SSH 1514 Server: Encrypted packet (len=1448)
  275 3.210609620  10.6.15.156 → 192.168.1.12 SSH 166 Server: Encrypted packet (len=100)
  276 3.210614148 192.168.1.12 → 10.6.15.156  TCP 66 54766 → 22 [ACK] Seq=5145 Ack=186993 Win=4866 Len=0 TSval=7756357 TSecr=14687852
  277 3.210766204  10.6.15.156 → 192.168.1.12 SSH 134 Server: Encrypted packet (len=68)
  278 3.210790013  10.6.15.156 → 192.168.1.12 SSH 138 Server: Encrypted packet (len=72)
  279 3.210829220 192.168.1.12 → 10.6.15.156  TCP 66 54766 → 22 [ACK] Seq=5145 Ack=187133 Win=4866 Len=0 TSval=7756357 TSecr=14687852
  280 3.210947759 192.168.1.12 → 10.6.15.156  SSH 102 Client: Encrypted packet (len=36)
  281 3.220128843  10.6.15.156 → 192.168.1.12 SSH 1514 Server: Encrypted packet (len=1448)
  282 3.220304477  10.6.15.156 → 192.168.1.12 SSH 1514 Server: Encrypted packet (len=1448)
  283 3.220313109 192.168.1.12 → 10.6.15.156  TCP 66 54766 → 22 [ACK] Seq=5181 Ack=190029 Win=4866 Len=0 TSval=7756359 TSecr=14687855
  284 3.220486162  10.6.15.156 → 192.168.1.12 SSH 1514 Server: Encrypted packet (len=1448)
  285 3.220694458  10.6.15.156 → 192.168.1.12 SSH 1514 Server: Encrypted packet (len=1448)
  286 3.220701200 192.168.1.12 → 10.6.15.156  TCP 66 54766 → 22 [ACK] Seq=5181 Ack=192925 Win=4866 Len=0 TSval=7756360 TSecr=14687855
  287 3.220710869  10.6.15.156 → 192.168.1.12 SSH 158 Server: Encrypted packet (len=92)
  288 3.221064723  10.6.15.156 → 192.168.1.12 SSH 1514 Server: Encrypted packet (len=1448)
  289 3.221072685 192.168.1.12 → 10.6.15.156  TCP 66 54766 → 22 [ACK] Seq=5181 Ack=194465 Win=4866 Len=0 TSval=7756360 TSecr=14687855
  290 3.221240332  10.6.15.156 → 192.168.1.12 SSH 1514 Server: Encrypted packet (len=1448)
  291 3.221430442  10.6.15.156 → 192.168.1.12 SSH 1514 Server: Encrypted packet (len=1448)
  292 3.221435064 192.168.1.12 → 10.6.15.156  TCP 66 54766 → 22 [ACK] Seq=5181 Ack=197361 Win=4866 Len=0 TSval=7756360 TSecr=14687855
  293 3.221776802  10.6.15.156 → 192.168.1.12 SSH 1514 Server: Encrypted packet (len=1448)
  294 3.221968746  10.6.15.156 → 192.168.1.12 SSH 1514 Server: Encrypted packet (len=1448)
  295 3.221972887 192.168.1.12 → 10.6.15.156  TCP 66 54766 → 22 [ACK] Seq=5181 Ack=200257 Win=4866 Len=0 TSval=7756360 TSecr=14687855
  296 3.222160039  10.6.15.156 → 192.168.1.12 SSH 1514 Server: Encrypted packet (len=1448)
  297 3.222352652  10.6.15.156 → 192.168.1.12 SSH 1514 Server: Encrypted packet (len=1448)
  298 3.222356561 192.168.1.12 → 10.6.15.156  TCP 66 54766 → 22 [ACK] Seq=5181 Ack=203153 Win=4866 Len=0 TSval=7756360 TSecr=14687855
  299 3.222545083  10.6.15.156 → 192.168.1.12 SSH 1514 Server: Encrypted packet (len=1448)
  300 3.222734737  10.6.15.156 → 192.168.1.12 SSH 1514 Server: Encrypted packet (len=1448)
  301 3.222738173 192.168.1.12 → 10.6.15.156  TCP 66 54766 → 22 [ACK] Seq=5181 Ack=206049 Win=4866 Len=0 TSval=7756360 TSecr=14687855
  302 3.222928217  10.6.15.156 → 192.168.1.12 SSH 1514 Server: Encrypted packet (len=1448)
  303 3.224124512  10.6.15.156 → 192.168.1.12 SSH 230 Server: Encrypted packet (len=164)
  304 3.224129231 192.168.1.12 → 10.6.15.156  TCP 66 54766 → 22 [ACK] Seq=5181 Ack=207661 Win=4866 Len=0 TSval=7756360 TSecr=14687855
  305 3.224348697 192.168.1.12 → 10.6.15.156  SSH 102 Client: Encrypted packet (len=36)
  306 3.224352819  10.6.15.156 → 192.168.1.12 SSH 1514 Server: Encrypted packet (len=1448)
  307 3.224544648  10.6.15.156 → 192.168.1.12 SSH 1514 Server: Encrypted packet (len=1448)
  308 3.224550376 192.168.1.12 → 10.6.15.156  TCP 66 54766 → 22 [ACK] Seq=5217 Ack=210557 Win=4866 Len=0 TSval=7756360 TSecr=14687855
  309 3.224759794  10.6.15.156 → 192.168.1.12 SSH 1514 Server: Encrypted packet (len=1448)
  310 3.224927435  10.6.15.156 → 192.168.1.12 SSH 1514 Server: Encrypted packet (len=1448)
  311 3.224931263 192.168.1.12 → 10.6.15.156  TCP 66 54766 → 22 [ACK] Seq=5217 Ack=213453 Win=4866 Len=0 TSval=7756361 TSecr=14687855
  312 3.225143716  10.6.15.156 → 192.168.1.12 SSH 1514 Server: Encrypted packet (len=1448)
  313 3.225340928  10.6.15.156 → 192.168.1.12 SSH 1514 Server: Encrypted packet (len=1448)
  314 3.225344274 192.168.1.12 → 10.6.15.156  TCP 66 54766 → 22 [ACK] Seq=5217 Ack=216349 Win=4866 Len=0 TSval=7756361 TSecr=14687855
  315 3.225531232  10.6.15.156 → 192.168.1.12 SSH 1514 Server: Encrypted packet (len=1448)
  316 3.225723363  10.6.15.156 → 192.168.1.12 SSH 1514 Server: Encrypted packet (len=1448)
  317 3.225726212 192.168.1.12 → 10.6.15.156  TCP 66 54766 → 22 [ACK] Seq=5217 Ack=219245 Win=4866 Len=0 TSval=7756361 TSecr=14687855
  318 3.230412375  10.6.15.156 → 192.168.1.12 SSH 1514 Server: Encrypted packet (len=1448)
  319 3.230572081  10.6.15.156 → 192.168.1.12 SSH 1514 Server: Encrypted packet (len=1448)
  320 3.230578847 192.168.1.12 → 10.6.15.156  TCP 66 54766 → 22 [ACK] Seq=5217 Ack=222141 Win=4866 Len=0 TSval=7756362 TSecr=14687857
  321 3.230943617  10.6.15.156 → 192.168.1.12 SSH 1514 Server: Encrypted packet (len=1448)
  322 3.231134371  10.6.15.156 → 192.168.1.12 SSH 1514 Server: Encrypted packet (len=1448)
  323 3.231138749 192.168.1.12 → 10.6.15.156  TCP 66 54766 → 22 [ACK] Seq=5217 Ack=225037 Win=4866 Len=0 TSval=7756362 TSecr=14687857
  324 3.231326297  10.6.15.156 → 192.168.1.12 SSH 1514 Server: Encrypted packet (len=1448)
  325 3.231517912  10.6.15.156 → 192.168.1.12 SSH 1514 Server: Encrypted packet (len=1448)
  326 3.231521054 192.168.1.12 → 10.6.15.156  TCP 66 54766 → 22 [ACK] Seq=5217 Ack=227933 Win=4866 Len=0 TSval=7756362 TSecr=14687857
  327 3.231863448  10.6.15.156 → 192.168.1.12 SSH 1514 Server: Encrypted packet (len=1448)
  328 3.232054422  10.6.15.156 → 192.168.1.12 SSH 1514 Server: Encrypted packet (len=1448)
  329 3.232057511 192.168.1.12 → 10.6.15.156  TCP 66 54766 → 22 [ACK] Seq=5217 Ack=230829 Win=4866 Len=0 TSval=7756362 TSecr=14687857
  330 3.232247447  10.6.15.156 → 192.168.1.12 SSH 1514 Server: Encrypted packet (len=1448)
  331 3.232439891  10.6.15.156 → 192.168.1.12 SSH 1514 Server: Encrypted packet (len=1448)
  332 3.232442980 192.168.1.12 → 10.6.15.156  TCP 66 54766 → 22 [ACK] Seq=5217 Ack=233725 Win=4866 Len=0 TSval=7756362 TSecr=14687857
  333 3.232603640  10.6.15.156 → 192.168.1.12 SSH 1514 Server: Encrypted packet (len=1448)
  334 3.232799809  10.6.15.156 → 192.168.1.12 SSH 1514 Server: Encrypted packet (len=1448)
  335 3.232807079 192.168.1.12 → 10.6.15.156  TCP 66 54766 → 22 [ACK] Seq=5217 Ack=236621 Win=4866 Len=0 TSval=7756363 TSecr=14687857
  336 3.232997321  10.6.15.156 → 192.168.1.12 SSH 1514 Server: Encrypted packet (len=1448)
  337 3.233187130  10.6.15.156 → 192.168.1.12 SSH 1514 Server: Encrypted packet (len=1448)
  338 3.233191633 192.168.1.12 → 10.6.15.156  TCP 66 54766 → 22 [ACK] Seq=5217 Ack=239517 Win=4866 Len=0 TSval=7756363 TSecr=14687857
  339 3.234424846  10.6.15.156 → 192.168.1.12 SSH 1514 Server: Encrypted packet (len=1448)
  340 3.234600555  10.6.15.156 → 192.168.1.12 SSH 1514 Server: Encrypted packet (len=1448)
  341 3.234603791 192.168.1.12 → 10.6.15.156  TCP 66 54766 → 22 [ACK] Seq=5217 Ack=242413 Win=4866 Len=0 TSval=7756363 TSecr=14687858
  342 3.234792159  10.6.15.156 → 192.168.1.12 SSH 1514 Server: Encrypted packet (len=1448)
  343 3.234986491  10.6.15.156 → 192.168.1.12 SSH 1514 Server: Encrypted packet (len=1448)
  344 3.234989900 192.168.1.12 → 10.6.15.156  TCP 66 54766 → 22 [ACK] Seq=5217 Ack=245309 Win=4866 Len=0 TSval=7756363 TSecr=14687858
  345 3.235176672  10.6.15.156 → 192.168.1.12 SSH 1514 Server: Encrypted packet (len=1448)
  346 3.235361890  10.6.15.156 → 192.168.1.12 SSH 1514 Server: Encrypted packet (len=1448)
  347 3.235368568 192.168.1.12 → 10.6.15.156  TCP 66 54766 → 22 [ACK] Seq=5217 Ack=248205 Win=4866 Len=0 TSval=7756363 TSecr=14687858
  348 3.235562256  10.6.15.156 → 192.168.1.12 SSH 1514 Server: Encrypted packet (len=1448)
  349 3.235753466  10.6.15.156 → 192.168.1.12 SSH 1514 Server: Encrypted packet (len=1448)
  350 3.235757624 192.168.1.12 → 10.6.15.156  TCP 66 54766 → 22 [ACK] Seq=5217 Ack=251101 Win=4866 Len=0 TSval=7756363 TSecr=14687858
  351 3.235945470  10.6.15.156 → 192.168.1.12 SSH 1514 Server: Encrypted packet (len=1448)
  352 3.236307458  10.6.15.156 → 192.168.1.12 SSH 1514 Server: Encrypted packet (len=1448)
  353 3.236310828 192.168.1.12 → 10.6.15.156  TCP 66 54766 → 22 [ACK] Seq=5217 Ack=253997 Win=4866 Len=0 TSval=7756363 TSecr=14687858
  354 3.238754949  10.6.15.156 → 192.168.1.12 SSH 1514 Server: Encrypted packet (len=1448)
  355 3.238947114  10.6.15.156 → 192.168.1.12 SSH 1514 Server: Encrypted packet (len=1448)
  356 3.238950756 192.168.1.12 → 10.6.15.156  TCP 66 54766 → 22 [ACK] Seq=5217 Ack=256893 Win=4866 Len=0 TSval=7756364 TSecr=14687859
  357 3.239138413  10.6.15.156 → 192.168.1.12 SSH 1514 Server: Encrypted packet (len=1448)
  358 3.239483038  10.6.15.156 → 192.168.1.12 SSH 1514 Server: Encrypted packet (len=1448)
  359 3.239486551 192.168.1.12 → 10.6.15.156  TCP 66 54766 → 22 [ACK] Seq=5217 Ack=259789 Win=4866 Len=0 TSval=7756364 TSecr=14687859
  360 3.239645443  10.6.15.156 → 192.168.1.12 SSH 1514 Server: Encrypted packet (len=1448)
  361 3.240019120  10.6.15.156 → 192.168.1.12 SSH 1514 Server: Encrypted packet (len=1448)
  362 3.240022875 192.168.1.12 → 10.6.15.156  TCP 66 54766 → 22 [ACK] Seq=5217 Ack=262685 Win=4866 Len=0 TSval=7756364 TSecr=14687859
  363 3.240193532  10.6.15.156 → 192.168.1.12 SSH 1514 Server: Encrypted packet (len=1448)
  364 3.240400530  10.6.15.156 → 192.168.1.12 SSH 1514 Server: Encrypted packet (len=1448)
  365 3.240406453 192.168.1.12 → 10.6.15.156  TCP 66 54766 → 22 [ACK] Seq=5217 Ack=265581 Win=4866 Len=0 TSval=7756364 TSecr=14687859
  366 3.240567575  10.6.15.156 → 192.168.1.12 SSH 1514 Server: Encrypted packet (len=1448)
  367 3.240940586  10.6.15.156 → 192.168.1.12 SSH 1514 Server: Encrypted packet (len=1448)
  368 3.240944756 192.168.1.12 → 10.6.15.156  TCP 66 54766 → 22 [ACK] Seq=5217 Ack=268477 Win=4866 Len=0 TSval=7756365 TSecr=14687860
  369 3.241102245  10.6.15.156 → 192.168.1.12 SSH 1514 Server: Encrypted packet (len=1448)
  370 3.241300221  10.6.15.156 → 192.168.1.12 SSH 1514 Server: Encrypted packet (len=1448)
  371 3.241304363 192.168.1.12 → 10.6.15.156  TCP 66 54766 → 22 [ACK] Seq=5217 Ack=271373 Win=4866 Len=0 TSval=7756365 TSecr=14687860
  372 3.241496078  10.6.15.156 → 192.168.1.12 SSH 1514 Server: Encrypted packet (len=1448)
  373 3.241707757  10.6.15.156 → 192.168.1.12 SSH 1514 Server: Encrypted packet (len=1448)
  374 3.241711027 192.168.1.12 → 10.6.15.156  TCP 66 54766 → 22 [ACK] Seq=5217 Ack=274269 Win=4866 Len=0 TSval=7756365 TSecr=14687860
  375 3.243069038  10.6.15.156 → 192.168.1.12 SSH 1514 Server: Encrypted packet (len=1448)
  376 3.243260644  10.6.15.156 → 192.168.1.12 SSH 1514 Server: Encrypted packet (len=1448)
  377 3.243263898 192.168.1.12 → 10.6.15.156  TCP 66 54766 → 22 [ACK] Seq=5217 Ack=277165 Win=4866 Len=0 TSval=7756365 TSecr=14687860
  378 3.243425443  10.6.15.156 → 192.168.1.12 SSH 1514 Server: Encrypted packet (len=1448)
  379 3.243626967  10.6.15.156 → 192.168.1.12 SSH 1514 Server: Encrypted packet (len=1448)
  380 3.243631747 192.168.1.12 → 10.6.15.156  TCP 66 54766 → 22 [ACK] Seq=5217 Ack=280061 Win=4866 Len=0 TSval=7756365 TSecr=14687860
  381 3.243810870  10.6.15.156 → 192.168.1.12 SSH 1514 Server: Encrypted packet (len=1448)
  382 3.244029001  10.6.15.156 → 192.168.1.12 SSH 1514 Server: Encrypted packet (len=1448)
  383 3.244033144 192.168.1.12 → 10.6.15.156  TCP 66 54766 → 22 [ACK] Seq=5217 Ack=282957 Win=4866 Len=0 TSval=7756365 TSecr=14687860
  384 3.244222246  10.6.15.156 → 192.168.1.12 SSH 1514 Server: Encrypted packet (len=1448)
  385 3.244414432  10.6.15.156 → 192.168.1.12 SSH 1514 Server: Encrypted packet (len=1448)
  386 3.244417562 192.168.1.12 → 10.6.15.156  TCP 66 54766 → 22 [ACK] Seq=5217 Ack=285853 Win=4866 Len=0 TSval=7756365 TSecr=14687860
  387 3.244575599  10.6.15.156 → 192.168.1.12 SSH 1514 Server: Encrypted packet (len=1448)
  388 3.244950305  10.6.15.156 → 192.168.1.12 SSH 1514 Server: Encrypted packet (len=1448)
  389 3.244954120 192.168.1.12 → 10.6.15.156  TCP 66 54766 → 22 [ACK] Seq=5217 Ack=288749 Win=4866 Len=0 TSval=7756366 TSecr=14687860
  390 3.245140728  10.6.15.156 → 192.168.1.12 SSH 1514 Server: Encrypted packet (len=1448)
  391 3.245335164  10.6.15.156 → 192.168.1.12 SSH 1514 Server: Encrypted packet (len=1448)
  392 3.245338529 192.168.1.12 → 10.6.15.156  TCP 66 54766 → 22 [ACK] Seq=5217 Ack=291645 Win=4866 Len=0 TSval=7756366 TSecr=14687860
  393 3.245525137  10.6.15.156 → 192.168.1.12 SSH 1514 Server: Encrypted packet (len=1448)
  394 3.245717229  10.6.15.156 → 192.168.1.12 SSH 1514 Server: Encrypted packet (len=1448)
  395 3.245720293 192.168.1.12 → 10.6.15.156  TCP 66 54766 → 22 [ACK] Seq=5217 Ack=294541 Win=4866 Len=0 TSval=7756366 TSecr=14687860
  396 3.245880585  10.6.15.156 → 192.168.1.12 SSH 1514 Server: Encrypted packet (len=1448)
  397 3.246073757  10.6.15.156 → 192.168.1.12 SSH 1514 Server: Encrypted packet (len=1448)
  398 3.246078777 192.168.1.12 → 10.6.15.156  TCP 66 54766 → 22 [ACK] Seq=5217 Ack=297437 Win=4866 Len=0 TSval=7756366 TSecr=14687860
  399 3.247420299  10.6.15.156 → 192.168.1.12 SSH 1514 Server: Encrypted packet (len=1448)
  400 3.247599491  10.6.15.156 → 192.168.1.12 SSH 1514 Server: Encrypted packet (len=1448)
  401 3.247602744 192.168.1.12 → 10.6.15.156  TCP 66 54766 → 22 [ACK] Seq=5217 Ack=300333 Win=4866 Len=0 TSval=7756366 TSecr=14687861
  402 3.247819176  10.6.15.156 → 192.168.1.12 SSH 1514 Server: Encrypted packet (len=1448)
  403 3.248011389  10.6.15.156 → 192.168.1.12 SSH 1514 Server: Encrypted packet (len=1448)
  404 3.248014531 192.168.1.12 → 10.6.15.156  TCP 66 54766 → 22 [ACK] Seq=5217 Ack=303229 Win=4866 Len=0 TSval=7756366 TSecr=14687861
  405 3.248203004  10.6.15.156 → 192.168.1.12 SSH 1514 Server: Encrypted packet (len=1448)
  406 3.248367563  10.6.15.156 → 192.168.1.12 SSH 1514 Server: Encrypted packet (len=1448)
  407 3.248373329 192.168.1.12 → 10.6.15.156  TCP 66 54766 → 22 [ACK] Seq=5217 Ack=306125 Win=4866 Len=0 TSval=7756366 TSecr=14687861
  408 3.248561765  10.6.15.156 → 192.168.1.12 SSH 1514 Server: Encrypted packet (len=1448)
  409 3.248755540  10.6.15.156 → 192.168.1.12 SSH 1514 Server: Encrypted packet (len=1448)
  410 3.248762347 192.168.1.12 → 10.6.15.156  TCP 66 54766 → 22 [ACK] Seq=5217 Ack=309021 Win=4866 Len=0 TSval=7756367 TSecr=14687861
  411 3.249098694  10.6.15.156 → 192.168.1.12 SSH 1514 Server: Encrypted packet (len=1448)
  412 3.249289998  10.6.15.156 → 192.168.1.12 SSH 1514 Server: Encrypted packet (len=1448)
  413 3.249297194 192.168.1.12 → 10.6.15.156  TCP 66 54766 → 22 [ACK] Seq=5217 Ack=311917 Win=4866 Len=0 TSval=7756367 TSecr=14687861
  414 3.249477990  10.6.15.156 → 192.168.1.12 SSH 1514 Server: Encrypted packet (len=1448)
  415 3.249671071  10.6.15.156 → 192.168.1.12 SSH 1514 Server: Encrypted packet (len=1448)
  416 3.249676469 192.168.1.12 → 10.6.15.156  TCP 66 54766 → 22 [ACK] Seq=5217 Ack=314813 Win=4866 Len=0 TSval=7756367 TSecr=14687861
  417 3.249863566  10.6.15.156 → 192.168.1.12 SSH 1514 Server: Encrypted packet (len=1448)
  418 3.250055461  10.6.15.156 → 192.168.1.12 SSH 1514 Server: Encrypted packet (len=1448)
  419 3.250061821 192.168.1.12 → 10.6.15.156  TCP 66 54766 → 22 [ACK] Seq=5217 Ack=317709 Win=4866 Len=0 TSval=7756367 TSecr=14687861
  420 3.250247080  10.6.15.156 → 192.168.1.12 SSH 1514 Server: Encrypted packet (len=1448)
  421 3.250439137  10.6.15.156 → 192.168.1.12 SSH 1514 Server: Encrypted packet (len=1448)
  422 3.250444209 192.168.1.12 → 10.6.15.156  TCP 66 54766 → 22 [ACK] Seq=5217 Ack=320605 Win=4866 Len=0 TSval=7756367 TSecr=14687861
  423 3.250631307  10.6.15.156 → 192.168.1.12 SSH 1514 Server: Encrypted packet (len=1448)
  424 3.252074085  10.6.15.156 → 192.168.1.12 SSH 1514 Server: Encrypted packet (len=1448)
  425 3.252079722 192.168.1.12 → 10.6.15.156  TCP 66 54766 → 22 [ACK] Seq=5217 Ack=323501 Win=4866 Len=0 TSval=7756367 TSecr=14687861
  426 3.252265115  10.6.15.156 → 192.168.1.12 SSH 1514 Server: Encrypted packet (len=1448)
  427 3.252459534  10.6.15.156 → 192.168.1.12 SSH 1514 Server: Encrypted packet (len=1448)
  428 3.252467354 192.168.1.12 → 10.6.15.156  TCP 66 54766 → 22 [ACK] Seq=5217 Ack=326397 Win=4866 Len=0 TSval=7756367 TSecr=14687862
  429 3.252652125  10.6.15.156 → 192.168.1.12 SSH 1514 Server: Encrypted packet (len=1448)
  430 3.252842514  10.6.15.156 → 192.168.1.12 SSH 1514 Server: Encrypted packet (len=1448)
  431 3.252848507 192.168.1.12 → 10.6.15.156  TCP 66 54766 → 22 [ACK] Seq=5217 Ack=329293 Win=4866 Len=0 TSval=7756368 TSecr=14687862
  432 3.256270200  10.6.15.156 → 192.168.1.12 SSH 1514 Server: Encrypted packet (len=1448)
  433 3.256434938  10.6.15.156 → 192.168.1.12 SSH 1514 Server: Encrypted packet (len=1448)
  434 3.256444272 192.168.1.12 → 10.6.15.156  TCP 66 54766 → 22 [ACK] Seq=5217 Ack=332189 Win=4866 Len=0 TSval=7756368 TSecr=14687862
  435 3.256627233  10.6.15.156 → 192.168.1.12 SSH 1514 Server: Encrypted packet (len=1448)
  436 3.256818654  10.6.15.156 → 192.168.1.12 SSH 1514 Server: Encrypted packet (len=1448)
  437 3.256825797 192.168.1.12 → 10.6.15.156  TCP 66 54766 → 22 [ACK] Seq=5217 Ack=335085 Win=4866 Len=0 TSval=7756369 TSecr=14687862
  438 3.257013637  10.6.15.156 → 192.168.1.12 SSH 1514 Server: Encrypted packet (len=1448)
  439 3.257034966  10.6.15.156 → 192.168.1.12 SSH 406 Server: Encrypted packet (len=340)
  440 3.257042194 192.168.1.12 → 10.6.15.156  TCP 66 54766 → 22 [ACK] Seq=5217 Ack=336873 Win=4866 Len=0 TSval=7756369 TSecr=14687862
  441 3.280812357  10.6.15.156 → 192.168.1.12 SSH 1514 Server: Encrypted packet (len=1448)
  442 3.280972540  10.6.15.156 → 192.168.1.12 SSH 1514 Server: Encrypted packet (len=1448)
  443 3.280984786 192.168.1.12 → 10.6.15.156  TCP 66 54766 → 22 [ACK] Seq=5217 Ack=339769 Win=4866 Len=0 TSval=7756375 TSecr=14687870
  444 3.281159045  10.6.15.156 → 192.168.1.12 SSH 1514 Server: Encrypted packet (len=1448)
  445 3.281357774  10.6.15.156 → 192.168.1.12 SSH 1514 Server: Encrypted packet (len=1448)
  446 3.281373406 192.168.1.12 → 10.6.15.156  TCP 66 54766 → 22 [ACK] Seq=5217 Ack=342665 Win=4866 Len=0 TSval=7756375 TSecr=14687870
  447 3.281391948  10.6.15.156 → 192.168.1.12 SSH 158 Server: Encrypted packet (len=92)
  448 3.281691437  10.6.15.156 → 192.168.1.12 SSH 1514 Server: Encrypted packet (len=1448)
  449 3.281701709 192.168.1.12 → 10.6.15.156  TCP 66 54766 → 22 [ACK] Seq=5217 Ack=344205 Win=4866 Len=0 TSval=7756375 TSecr=14687870
  450 3.282016289  10.6.15.156 → 192.168.1.12 SSH 1514 Server: Encrypted packet (len=1448)
  451 3.282211393  10.6.15.156 → 192.168.1.12 SSH 1514 Server: Encrypted packet (len=1448)
  452 3.282216055 192.168.1.12 → 10.6.15.156  TCP 66 54766 → 22 [ACK] Seq=5217 Ack=347101 Win=4866 Len=0 TSval=7756375 TSecr=14687870
  453 3.282394024  10.6.15.156 → 192.168.1.12 SSH 1514 Server: Encrypted packet (len=1448)
  454 3.282763498  10.6.15.156 → 192.168.1.12 SSH 1514 Server: Encrypted packet (len=1448)
  455 3.282770103 192.168.1.12 → 10.6.15.156  TCP 66 54766 → 22 [ACK] Seq=5217 Ack=349997 Win=4866 Len=0 TSval=7756375 TSecr=14687870
  456 3.282946298  10.6.15.156 → 192.168.1.12 SSH 1514 Server: Encrypted packet (len=1448)
  457 3.283155210  10.6.15.156 → 192.168.1.12 SSH 1514 Server: Encrypted packet (len=1448)
  458 3.283161636 192.168.1.12 → 10.6.15.156  TCP 66 54766 → 22 [ACK] Seq=5217 Ack=352893 Win=4866 Len=0 TSval=7756375 TSecr=14687870
  459 3.283351207  10.6.15.156 → 192.168.1.12 SSH 1514 Server: Encrypted packet (len=1448)
  460 3.283359598  10.6.15.156 → 192.168.1.12 SSH 206 Server: Encrypted packet (len=140)
  461 3.283364139 192.168.1.12 → 10.6.15.156  TCP 66 54766 → 22 [ACK] Seq=5217 Ack=354481 Win=4866 Len=0 TSval=7756375 TSecr=14687870
  462 3.283500553 192.168.1.12 → 10.6.15.156  SSH 102 Client: Encrypted packet (len=36)
  463 3.284836950  10.6.15.156 → 192.168.1.12 SSH 1514 Server: Encrypted packet (len=1448)
  464 3.285037288  10.6.15.156 → 192.168.1.12 SSH 1514 Server: Encrypted packet (len=1448)
  465 3.285044765 192.168.1.12 → 10.6.15.156  TCP 66 54766 → 22 [ACK] Seq=5253 Ack=357377 Win=4866 Len=0 TSval=7756376 TSecr=14687871
  466 3.285219545  10.6.15.156 → 192.168.1.12 SSH 1514 Server: Encrypted packet (len=1448)
  467 3.285411327  10.6.15.156 → 192.168.1.12 SSH 1514 Server: Encrypted packet (len=1448)
  468 3.285416176 192.168.1.12 → 10.6.15.156  TCP 66 54766 → 22 [ACK] Seq=5253 Ack=360273 Win=4866 Len=0 TSval=7756376 TSecr=14687871
  469 3.285484315  10.6.15.156 → 192.168.1.12 SSH 726 Server: Encrypted packet (len=660)
  470 3.288050860  10.6.15.156 → 192.168.1.12 SSH 1514 Server: Encrypted packet (len=1448)
  471 3.288068674 192.168.1.12 → 10.6.15.156  TCP 66 54766 → 22 [ACK] Seq=5253 Ack=362381 Win=4866 Len=0 TSval=7756376 TSecr=14687871
  472 3.288233292  10.6.15.156 → 192.168.1.12 SSH 1514 Server: Encrypted packet (len=1448)
  473 3.288238056  10.6.15.156 → 192.168.1.12 SSH 134 Server: Encrypted packet (len=68)
  474 3.288240586 192.168.1.12 → 10.6.15.156  TCP 66 54766 → 22 [ACK] Seq=5253 Ack=363897 Win=4866 Len=0 TSval=7756376 TSecr=14687872
  475 3.288334737 192.168.1.12 → 10.6.15.156  SSH 102 Client: Encrypted packet (len=36)
  476 3.291250466  10.6.15.156 → 192.168.1.12 SSH 1514 Server: Encrypted packet (len=1448)
  477 3.291448893  10.6.15.156 → 192.168.1.12 SSH 1514 Server: Encrypted packet (len=1448)
  478 3.291458917 192.168.1.12 → 10.6.15.156  TCP 66 54766 → 22 [ACK] Seq=5289 Ack=366793 Win=4866 Len=0 TSval=7756377 TSecr=14687872
  479 3.291623952  10.6.15.156 → 192.168.1.12 SSH 1514 Server: Encrypted packet (len=1448)
  480 3.291816965  10.6.15.156 → 192.168.1.12 SSH 1514 Server: Encrypted packet (len=1448)
  481 3.291821204 192.168.1.12 → 10.6.15.156  TCP 66 54766 → 22 [ACK] Seq=5289 Ack=369689 Win=4866 Len=0 TSval=7756377 TSecr=14687872
  482 3.292021141  10.6.15.156 → 192.168.1.12 SSH 1514 Server: Encrypted packet (len=1448)
  483 3.292026987  10.6.15.156 → 192.168.1.12 SSH 166 Server: Encrypted packet (len=100)
  484 3.292030661 192.168.1.12 → 10.6.15.156  TCP 66 54766 → 22 [ACK] Seq=5289 Ack=371237 Win=4866 Len=0 TSval=7756377 TSecr=14687872
  485 3.292379933  10.6.15.156 → 192.168.1.12 SSH 1514 Server: Encrypted packet (len=1448)
  486 3.292570843  10.6.15.156 → 192.168.1.12 SSH 1514 Server: Encrypted packet (len=1448)
  487 3.292577290 192.168.1.12 → 10.6.15.156  TCP 66 54766 → 22 [ACK] Seq=5289 Ack=374133 Win=4866 Len=0 TSval=7756377 TSecr=14687873
  488 3.292655266  10.6.15.156 → 192.168.1.12 SSH 798 Server: Encrypted packet (len=732)
  489 3.302197139 192.168.1.12 → 10.6.15.156  SSH 134 Client: Encrypted packet (len=68)
  490 3.341711934  10.6.15.156 → 192.168.1.12 SSH 1514 Server: Encrypted packet (len=1448)
  491 3.341735965 192.168.1.12 → 10.6.15.156  SSH 258 Client: Encrypted packet (len=192)
  492 3.341886431  10.6.15.156 → 192.168.1.12 SSH 1514 Server: Encrypted packet (len=1448)
  493 3.342070027  10.6.15.156 → 192.168.1.12 SSH 1514 Server: Encrypted packet (len=1448)
  494 3.342073571 192.168.1.12 → 10.6.15.156  TCP 66 54766 → 22 [ACK] Seq=5549 Ack=379209 Win=4866 Len=0 TSval=7756390 TSecr=14687885
  495 3.342079110  10.6.15.156 → 192.168.1.12 SSH 118 Server: Encrypted packet (len=52)
  496 3.342281900  10.6.15.156 → 192.168.1.12 SSH 1514 Server: Encrypted packet (len=1448)
  497 3.342288634 192.168.1.12 → 10.6.15.156  TCP 66 54766 → 22 [ACK] Seq=5549 Ack=380709 Win=4866 Len=0 TSval=7756390 TSecr=14687885
  498 3.342298055  10.6.15.156 → 192.168.1.12 SSH 430 Server: Encrypted packet (len=364)
  499 3.344935018 192.168.1.12 → 10.6.15.156  SSH 126 Client: Encrypted packet (len=60)
  500 3.348521046  10.6.15.156 → 192.168.1.12 TCP 66 22 → 54766 [ACK] Seq=381073 Ack=5609 Win=1452 Len=0 TSval=14687887 TSecr=7756390
  501 3.380163436  10.6.15.156 → 192.168.1.12 SSH 146 Server: Encrypted packet (len=80)
  502 3.380498651 192.168.1.12 → 10.6.15.156  SSH 126 Client: Encrypted packet (len=60)
  503 3.383721718  10.6.15.156 → 192.168.1.12 SSH 1514 Server: Encrypted packet (len=1448)
  504 3.383742308  10.6.15.156 → 192.168.1.12 SSH 674 Server: Encrypted packet (len=608)
  505 3.383751684 192.168.1.12 → 10.6.15.156  TCP 66 54766 → 22 [ACK] Seq=5669 Ack=383209 Win=4866 Len=0 TSval=7756400 TSecr=14687895
  506 3.384693538  10.6.15.156 → 192.168.1.12 SSH 1514 Server: Encrypted packet (len=1448)
  507 3.384876156  10.6.15.156 → 192.168.1.12 SSH 1470 Server: Encrypted packet (len=1404)
  508 3.384886784 192.168.1.12 → 10.6.15.156  TCP 66 54766 → 22 [ACK] Seq=5669 Ack=386061 Win=4866 Len=0 TSval=7756401 TSecr=14687895
  509 3.385809913  10.6.15.156 → 192.168.1.12 SSH 1514 Server: Encrypted packet (len=1448)
  510 3.386082913  10.6.15.156 → 192.168.1.12 SSH 1222 Server: Encrypted packet (len=1156)
  511 3.386096264 192.168.1.12 → 10.6.15.156  TCP 66 54766 → 22 [ACK] Seq=5669 Ack=388665 Win=4866 Len=0 TSval=7756401 TSecr=14687896
  512 3.386992438  10.6.15.156 → 192.168.1.12 SSH 1514 Server: Encrypted packet (len=1448)
  513 3.387309478  10.6.15.156 → 192.168.1.12 SSH 1514 Server: Encrypted packet (len=1448)
  514 3.387321705 192.168.1.12 → 10.6.15.156  TCP 66 54766 → 22 [ACK] Seq=5669 Ack=391561 Win=4866 Len=0 TSval=7756401 TSecr=14687896
  515 3.387818108  10.6.15.156 → 192.168.1.12 SSH 390 Server: Encrypted packet (len=324)
  516 3.394480693 192.168.1.12 → 10.6.15.156  SSH 126 Client: Encrypted packet (len=60)
  517 3.421778610  10.6.15.156 → 192.168.1.12 SSH 1514 Server: Encrypted packet (len=1448)
  518 3.421937134  10.6.15.156 → 192.168.1.12 SSH 1514 Server: Encrypted packet (len=1448)
  519 3.421948660 192.168.1.12 → 10.6.15.156  TCP 66 54766 → 22 [ACK] Seq=5729 Ack=394781 Win=4866 Len=0 TSval=7756410 TSecr=14687905
  520 3.422273507  10.6.15.156 → 192.168.1.12 SSH 1270 Server: Encrypted packet (len=1204)
  521 3.422547077  10.6.15.156 → 192.168.1.12 SSH 1514 Server: Encrypted packet (len=1448)
  522 3.422555798 192.168.1.12 → 10.6.15.156  TCP 66 54766 → 22 [ACK] Seq=5729 Ack=397433 Win=4866 Len=0 TSval=7756410 TSecr=14687905
  523 3.422867606  10.6.15.156 → 192.168.1.12 SSH 1514 Server: Encrypted packet (len=1448)
  524 3.423060393  10.6.15.156 → 192.168.1.12 SSH 1514 Server: Encrypted packet (len=1448)
  525 3.423067948 192.168.1.12 → 10.6.15.156  TCP 66 54766 → 22 [ACK] Seq=5729 Ack=400329 Win=4866 Len=0 TSval=7756410 TSecr=14687905
  526 3.423393575  10.6.15.156 → 192.168.1.12 SSH 1514 Server: Encrypted packet (len=1448)
  527 3.423529827  10.6.15.156 → 192.168.1.12 SSH 1134 Server: Encrypted packet (len=1068)
  528 3.423539209 192.168.1.12 → 10.6.15.156  TCP 66 54766 → 22 [ACK] Seq=5729 Ack=402845 Win=4866 Len=0 TSval=7756410 TSecr=14687905
  529 3.433204917  10.6.15.156 → 192.168.1.12 SSH 1514 Server: Encrypted packet (len=1448)
  530 3.433293816  10.6.15.156 → 192.168.1.12 SSH 894 Server: Encrypted packet (len=828)
  531 3.433303243 192.168.1.12 → 10.6.15.156  TCP 66 54766 → 22 [ACK] Seq=5729 Ack=405121 Win=4866 Len=0 TSval=7756413 TSecr=14687908
  532 3.439036348 192.168.1.12 → 10.6.15.156  SSH 294 Client: Encrypted packet (len=228)
  533 3.479512206  10.6.15.156 → 192.168.1.12 TCP 66 22 → 54766 [ACK] Seq=405121 Ack=5957 Win=1452 Len=0 TSval=14687920 TSecr=7756414
  534 3.479530865 192.168.1.12 → 10.6.15.156  SSH 214 Client: Encrypted packet (len=148)
  535 3.481302472  10.6.15.156 → 192.168.1.12 TCP 66 22 → 54766 [ACK] Seq=405121 Ack=6105 Win=1452 Len=0 TSval=14687920 TSecr=7756424
  536 3.511408154  10.6.15.156 → 192.168.1.12 SSH 366 Server: Encrypted packet (len=300)
  537 3.515198323 192.168.1.12 → 10.6.15.156  SSH 126 Client: Encrypted packet (len=60)
  538 3.516640741  10.6.15.156 → 192.168.1.12 SSH 550 Server: Encrypted packet (len=484)
  539 3.549472840  10.6.15.156 → 192.168.1.12 SSH 110 Server: Encrypted packet (len=44)
  540 3.549493631 192.168.1.12 → 10.6.15.156  TCP 66 54766 → 22 [ACK] Seq=6165 Ack=405949 Win=4866 Len=0 TSval=7756442 TSecr=14687929
  541 3.549814613 192.168.1.12 → 10.6.15.156  SSH 126 Client: Encrypted packet (len=60)
  542 3.553490084  10.6.15.156 → 192.168.1.12 SSH 1270 Server: Encrypted packet (len=1204)
  543 3.557750964 192.168.1.12 → 10.6.15.156  SSH 110 Client: Encrypted packet (len=44)
  544 3.589893393  10.6.15.156 → 192.168.1.12 SSH 1514 Server: Encrypted packet (len=1448)
  545 3.590089099  10.6.15.156 → 192.168.1.12 SSH 1514 Server: Encrypted packet (len=1448)
  546 3.590099082 192.168.1.12 → 10.6.15.156  TCP 66 54766 → 22 [ACK] Seq=6269 Ack=410049 Win=4866 Len=0 TSval=7756452 TSecr=14687947
  547 3.590242626  10.6.15.156 → 192.168.1.12 SSH 238 Server: Encrypted packet (len=172)
  548 3.590440828  10.6.15.156 → 192.168.1.12 SSH 1514 Server: Encrypted packet (len=1448)
  549 3.590449107 192.168.1.12 → 10.6.15.156  TCP 66 54766 → 22 [ACK] Seq=6269 Ack=411669 Win=4866 Len=0 TSval=7756452 TSecr=14687947
  550 3.590641781  10.6.15.156 → 192.168.1.12 SSH 574 Server: Encrypted packet (len=508)
  551 3.626328826  10.6.15.156 → 192.168.1.12 SSH 526 Server: Encrypted packet (len=460)
  552 3.626346843 192.168.1.12 → 10.6.15.156  TCP 66 54766 → 22 [ACK] Seq=6269 Ack=412637 Win=4866 Len=0 TSval=7756461 TSecr=14687947
  553 3.635271432  10.6.15.156 → 192.168.1.12 SSH 1302 Server: Encrypted packet (len=1236)
  554 3.676619448 192.168.1.12 → 10.6.15.156  TCP 66 54766 → 22 [ACK] Seq=6269 Ack=413873 Win=4866 Len=0 TSval=7756474 TSecr=14687957
  555 3.799141098 192.168.1.12 → 10.6.15.156  SSH 862 Client: Encrypted packet (len=796)
  556 3.829376353 192.168.1.12 → 10.6.15.156  SSH 1514 Client: Encrypted packet (len=1448)
  557 3.830197555 192.168.1.12 → 10.6.15.156  SSH 1222 Client: Encrypted packet (len=1156)
  558 3.838104786  10.6.15.156 → 192.168.1.12 TCP 66 22 → 54766 [ACK] Seq=413873 Ack=8513 Win=1452 Len=0 TSval=14688008 TSecr=7756504
  559 3.878720627  10.6.15.156 → 192.168.1.12 TCP 66 22 → 54766 [ACK] Seq=413873 Ack=9669 Win=1452 Len=0 TSval=14688018 TSecr=7756512
  560 3.963239129  10.6.15.156 → 192.168.1.12 SSH 1190 Server: Encrypted packet (len=1124)
  561 3.963258664 192.168.1.12 → 10.6.15.156  TCP 66 54766 → 22 [ACK] Seq=9669 Ack=414997 Win=4866 Len=0 TSval=7756545 TSecr=14688039
  562 3.963281167  10.6.15.156 → 192.168.1.12 SSH 558 Server: Encrypted packet (len=492)
  563 3.963294563 192.168.1.12 → 10.6.15.156  TCP 66 54766 → 22 [ACK] Seq=9669 Ack=415489 Win=4866 Len=0 TSval=7756545 TSecr=14688040
  564 3.963926931 192.168.1.12 → 10.6.15.156  SSH 134 Client: Encrypted packet (len=68)
  565 3.967800199  10.6.15.156 → 192.168.1.12 TCP 66 22 → 54766 [ACK] Seq=415489 Ack=9737 Win=1452 Len=0 TSval=14688041 TSecr=7756545
  566 4.016724317  10.6.15.156 → 192.168.1.12 SSH 454 Server: Encrypted packet (len=388)
  567 4.060648423 192.168.1.12 → 10.6.15.156  TCP 66 54766 → 22 [ACK] Seq=9737 Ack=415877 Win=4866 Len=0 TSval=7756570 TSecr=14688054
  568 4.797472936 192.168.1.12 → 10.6.15.156  SSH 862 Client: Encrypted packet (len=796)
  569 4.802152892  10.6.15.156 → 192.168.1.12 TCP 66 22 → 54766 [ACK] Seq=415877 Ack=10533 Win=1452 Len=0 TSval=14688250 TSecr=7756754
  570 4.802174691 192.168.1.12 → 10.6.15.156  SSH 134 Client: Encrypted packet (len=68)
  571 4.805624785  10.6.15.156 → 192.168.1.12 TCP 66 22 → 54766 [ACK] Seq=415877 Ack=10601 Win=1452 Len=0 TSval=14688251 TSecr=7756755
  572 4.980615181 192.168.1.12 → 23.58.43.27  TCP 66 47482 → 80 [ACK] Seq=1 Ack=1 Win=319 Len=0 TSval=7756800 TSecr=2209668251
  573 4.986951391  23.58.43.27 → 192.168.1.12 TCP 66 [TCP ACKed unseen segment] 80 → 47482 [ACK] Seq=1 Ack=2 Win=972 Len=0 TSval=2209715287 TSecr=7666041
  574 5.015604810  10.6.15.156 → 192.168.1.12 SSH 454 Server: Encrypted packet (len=388)
  575 5.015623670 192.168.1.12 → 10.6.15.156  TCP 66 54766 → 22 [ACK] Seq=10601 Ack=416265 Win=4866 Len=0 TSval=7756808 TSecr=14688303
  576 5.018289482 192.168.1.12 → 10.6.15.156  SSH 862 Client: Encrypted packet (len=796)
  577 5.019626552  10.6.15.156 → 192.168.1.12 SSH 110 Server: Encrypted packet (len=44)
  578 5.021008392  10.6.15.156 → 192.168.1.12 TCP 66 22 → 54766 [ACK] Seq=416309 Ack=11397 Win=1452 Len=0 TSval=14688305 TSecr=7756809
  579 5.021014465 192.168.1.12 → 10.6.15.156  SSH 302 Client: Encrypted packet (len=236)
  580 5.023204286  10.6.15.156 → 192.168.1.12 TCP 66 22 → 54766 [ACK] Seq=416309 Ack=11633 Win=1452 Len=0 TSval=14688306 TSecr=7756810
  581 5.217987765 192.168.1.12 → 10.6.15.156  SSH 110 Client: Encrypted packet (len=44)
  582 5.235480064  10.6.15.156 → 192.168.1.12 SSH 454 Server: Encrypted packet (len=388)
  583 5.238680640  10.6.15.156 → 192.168.1.12 SSH 246 Server: Encrypted packet (len=180)
  584 5.238761068 192.168.1.12 → 10.6.15.156  TCP 66 54766 → 22 [ACK] Seq=11677 Ack=416877 Win=4866 Len=0 TSval=7756864 TSecr=14688359
  585 5.238998812 192.168.1.12 → 10.6.15.156  SSH 150 Client: Encrypted packet (len=84)
  586 5.266139400  10.6.15.156 → 192.168.1.12 TCP 78 [TCP Dup ACK 580#1] 22 → 54766 [ACK] Seq=416877 Ack=11633 Win=1452 Len=0 TSval=14688366 TSecr=7756810 SLE=11677 SRE=11761
  587 5.272597234 192.168.1.12 → 10.6.15.156  TCP 110 [TCP Retransmission] 54766 → 22 [PSH, ACK] Seq=11633 Ack=416877 Win=4866 Len=44 TSval=7756873 TSecr=14688366
  588 5.274073994  10.6.15.156 → 192.168.1.12 TCP 66 22 → 54766 [ACK] Seq=416877 Ack=11761 Win=1452 Len=0 TSval=14688368 TSecr=7756873
  589 6.947839750  10.6.15.156 → 192.168.1.12 SSH 102 Server: Encrypted packet (len=36)
  590 6.948231992 192.168.1.12 → 10.6.15.156  SSH 294 Client: Encrypted packet (len=228)
  591 6.949992187  10.6.15.156 → 192.168.1.12 TCP 66 22 → 54766 [ACK] Seq=416913 Ack=11989 Win=1452 Len=0 TSval=14688787 TSecr=7757291
  592 7.223857106  10.6.15.156 → 192.168.1.12 SSH 230 Server: Encrypted packet (len=164)
  593 7.223879984  10.6.15.156 → 192.168.1.12 SSH 102 Server: Encrypted packet (len=36)
  594 7.223944003 192.168.1.12 → 10.6.15.156  TCP 66 54766 → 22 [ACK] Seq=11989 Ack=417113 Win=4866 Len=0 TSval=7757360 TSecr=14688856
  595 7.225193047 192.168.1.12 → 10.6.15.156  SSH 138 Client: Encrypted packet (len=72)
  596 7.226775379  10.6.15.156 → 192.168.1.12 TCP 66 22 → 54766 [ACK] Seq=417113 Ack=12061 Win=1452 Len=0 TSval=14688857 TSecr=7757361
  597 7.227135465  10.6.15.156 → 192.168.1.12 SSH 102 Server: Encrypted packet (len=36)
  598 7.268648103 192.168.1.12 → 10.6.15.156  TCP 66 54766 → 22 [ACK] Seq=12061 Ack=417149 Win=4866 Len=0 TSval=7757372 TSecr=14688857
  599 8.799847089 192.168.1.12 → 10.6.15.156  SSH 862 Client: Encrypted packet (len=796)
  600 8.838370750  10.6.15.156 → 192.168.1.12 TCP 66 22 → 54766 [ACK] Seq=417149 Ack=12857 Win=1452 Len=0 TSval=14689260 TSecr=7757754
  601 8.838390825 192.168.1.12 → 10.6.15.156  SSH 862 Client: Encrypted packet (len=796)
  602 8.840572634  10.6.15.156 → 192.168.1.12 TCP 66 22 → 54766 [ACK] Seq=417149 Ack=13653 Win=1452 Len=0 TSval=14689260 TSecr=7757764
  603 9.016081302  10.6.15.156 → 192.168.1.12 SSH 454 Server: Encrypted packet (len=388)
  604 9.016098861 192.168.1.12 → 10.6.15.156  TCP 66 54766 → 22 [ACK] Seq=13653 Ack=417537 Win=4866 Len=0 TSval=7757808 TSecr=14689304
  605 9.058269671  10.6.15.156 → 192.168.1.12 SSH 454 Server: Encrypted packet (len=388)
  606 9.058295910 192.168.1.12 → 10.6.15.156  TCP 66 54766 → 22 [ACK] Seq=13653 Ack=417925 Win=4866 Len=0 TSval=7757819 TSecr=14689314
  607 9.497197027  10.6.15.156 → 192.168.1.12 SSH 158 Server: Encrypted packet (len=92)
  608 9.497214098 192.168.1.12 → 10.6.15.156  TCP 66 54766 → 22 [ACK] Seq=13653 Ack=418017 Win=4866 Len=0 TSval=7757929 TSecr=14689424
  609 9.497620823  10.6.15.156 → 192.168.1.12 SSH 102 Server: Encrypted packet (len=36)
  610 9.497635805 192.168.1.12 → 10.6.15.156  TCP 66 54766 → 22 [ACK] Seq=13653 Ack=418053 Win=4866 Len=0 TSval=7757929 TSecr=14689424
  611 9.800256325 192.168.1.12 → 10.6.15.156  SSH 138 Client: Encrypted packet (len=72)
  612 9.801943653  10.6.15.156 → 192.168.1.12 TCP 66 22 → 54766 [ACK] Seq=418053 Ack=13725 Win=1452 Len=0 TSval=14689500 TSecr=7758004
  613 9.801963983 192.168.1.12 → 10.6.15.156  SSH 862 Client: Encrypted packet (len=796)
  614 9.802954336  10.6.15.156 → 192.168.1.12 SSH 102 Server: Encrypted packet (len=36)
  615 9.802968632 192.168.1.12 → 10.6.15.156  TCP 66 54766 → 22 [ACK] Seq=14521 Ack=418089 Win=4866 Len=0 TSval=7758005 TSecr=14689501
  616 9.842234595  10.6.15.156 → 192.168.1.12 TCP 66 22 → 54766 [ACK] Seq=418089 Ack=14521 Win=1452 Len=0 TSval=14689511 TSecr=7758005
  617 9.876335213 192.168.1.12 → 192.168.1.1  DNS 81 Standard query 0x5c4a A 1.ubuntu.pool.ntp.org
  618 9.878499499  192.168.1.1 → 192.168.1.12 DNS 145 Standard query response 0x5c4a A 1.ubuntu.pool.ntp.org A 139.59.16.133 A 139.59.21.22 A 139.59.50.38 A 123.108.200.124
  619 9.878837982 192.168.1.12 → 139.59.16.133 NTP 90 NTP Version 4, client
  620 10.024225887  10.6.15.156 → 192.168.1.12 SSH 462 Server: Encrypted packet (len=396)
  621 10.024252472 192.168.1.12 → 10.6.15.156  TCP 66 54766 → 22 [ACK] Seq=14521 Ack=418485 Win=4866 Len=0 TSval=7758060 TSecr=14689556
  622 10.796419629 192.168.1.12 → 10.6.15.156  SSH 1514 Client: Encrypted packet (len=1448)
  623 10.796980352 192.168.1.12 → 10.6.15.156  SSH 1514 Client: Encrypted packet (len=1448)
  624 10.797939823 192.168.1.12 → 10.6.15.156  SSH 614 Client: Encrypted packet (len=548)
  625 10.799196349  10.6.15.156 → 192.168.1.12 TCP 66 22 → 54766 [ACK] Seq=418485 Ack=15969 Win=1452 Len=0 TSval=14689750 TSecr=7758253
  626 10.799217556  10.6.15.156 → 192.168.1.12 TCP 66 22 → 54766 [ACK] Seq=418485 Ack=17417 Win=1452 Len=0 TSval=14689750 TSecr=7758254
  627 10.799378577  10.6.15.156 → 192.168.1.12 TCP 66 22 → 54766 [ACK] Seq=418485 Ack=17965 Win=1452 Len=0 TSval=14689750 TSecr=7758254
  628 10.954770018  10.6.15.156 → 192.168.1.12 SSH 502 Server: Encrypted packet (len=436)
  629 10.954786536 192.168.1.12 → 10.6.15.156  TCP 66 54766 → 22 [ACK] Seq=17965 Ack=418921 Win=4866 Len=0 TSval=7758293 TSecr=14689788
  630 11.014098287  10.6.15.156 → 192.168.1.12 SSH 454 Server: Encrypted packet (len=388)
  631 11.014115735 192.168.1.12 → 10.6.15.156  TCP 66 54766 → 22 [ACK] Seq=17965 Ack=419309 Win=4866 Len=0 TSval=7758308 TSecr=14689803
  632 11.016696169  10.6.15.156 → 192.168.1.12 SSH 454 Server: Encrypted packet (len=388)
  633 11.016714482 192.168.1.12 → 10.6.15.156  TCP 66 54766 → 22 [ACK] Seq=17965 Ack=419697 Win=4866 Len=0 TSval=7758309 TSecr=14689804
  634 13.356574337 192.168.1.12 → 10.6.15.156  SSH 134 Client: Encrypted packet (len=68)
  635 13.358235335  10.6.15.156 → 192.168.1.12 TCP 66 22 → 54766 [ACK] Seq=419697 Ack=18033 Win=1452 Len=0 TSval=14690390 TSecr=7758893
  636 14.795153305 192.168.1.12 → 10.6.15.156  SSH 862 Client: Encrypted packet (len=796)
  637 14.795728594 192.168.1.12 → 10.6.15.156  SSH 862 Client: Encrypted packet (len=796)
  638 14.797308336  10.6.15.156 → 192.168.1.12 TCP 66 22 → 54766 [ACK] Seq=419697 Ack=18829 Win=1452 Len=0 TSval=14690749 TSecr=7759253
  639 14.797691269  10.6.15.156 → 192.168.1.12 TCP 66 22 → 54766 [ACK] Seq=419697 Ack=19625 Win=1452 Len=0 TSval=14690749 TSecr=7759253
  640 15.011508109  10.6.15.156 → 192.168.1.12 SSH 454 Server: Encrypted packet (len=388)
  641 15.011533781 192.168.1.12 → 10.6.15.156  TCP 66 54766 → 22 [ACK] Seq=19625 Ack=420085 Win=4866 Len=0 TSval=7759307 TSecr=14690803
  642 15.014203838  10.6.15.156 → 192.168.1.12 SSH 454 Server: Encrypted packet (len=388)
  643 15.014222079 192.168.1.12 → 10.6.15.156  TCP 66 54766 → 22 [ACK] Seq=19625 Ack=420473 Win=4866 Len=0 TSval=7759308 TSecr=14690804
  644 15.803049706 192.168.1.12 → 10.6.15.156  SSH 862 Client: Encrypted packet (len=796)
  645 15.805164202  10.6.15.156 → 192.168.1.12 TCP 66 22 → 54766 [ACK] Seq=420473 Ack=20421 Win=1452 Len=0 TSval=14691001 TSecr=7759505
  646 16.023073533  10.6.15.156 → 192.168.1.12 SSH 454 Server: Encrypted packet (len=388)
  647 16.023095482 192.168.1.12 → 10.6.15.156  TCP 66 54766 → 22 [ACK] Seq=20421 Ack=420861 Win=4866 Len=0 TSval=7759560 TSecr=14691056
  648 16.598533404  10.6.15.156 → 192.168.1.12 SSH 138 Server: Encrypted packet (len=72)
  649 16.598551538 192.168.1.12 → 10.6.15.156  TCP 66 54766 → 22 [ACK] Seq=20421 Ack=420933 Win=4866 Len=0 TSval=7759704 TSecr=14691200
  650 16.598782347 192.168.1.12 → 10.6.15.156  SSH 102 Client: Encrypted packet (len=36)
  651 16.600546039  10.6.15.156 → 192.168.1.12 TCP 66 22 → 54766 [ACK] Seq=420933 Ack=20457 Win=1452 Len=0 TSval=14691200 TSecr=7759704
  652 16.793317903 192.168.1.12 → 10.6.15.156  SSH 862 Client: Encrypted packet (len=796)
  653 16.795810576  10.6.15.156 → 192.168.1.12 TCP 66 22 → 54766 [ACK] Seq=420933 Ack=21253 Win=1452 Len=0 TSval=14691249 TSecr=7759753
  654 16.795824526 192.168.1.12 → 10.6.15.156  SSH 862 Client: Encrypted packet (len=796)
  655 16.797821544  10.6.15.156 → 192.168.1.12 TCP 66 22 → 54766 [ACK] Seq=420933 Ack=22049 Win=1452 Len=0 TSval=14691249 TSecr=7759753
  656 17.012046947  10.6.15.156 → 192.168.1.12 SSH 454 Server: Encrypted packet (len=388)
  657 17.012399617  10.6.15.156 → 192.168.1.12 SSH 454 Server: Encrypted packet (len=388)
  658 17.012432438 192.168.1.12 → 10.6.15.156  TCP 66 54766 → 22 [ACK] Seq=22049 Ack=421709 Win=4866 Len=0 TSval=7759807 TSecr=14691303
  659 20.793652674 192.168.1.12 → 10.6.15.156  SSH 862 Client: Encrypted packet (len=796)
  660 20.797768458  10.6.15.156 → 192.168.1.12 TCP 66 22 → 54766 [ACK] Seq=421709 Ack=22845 Win=1452 Len=0 TSval=14692249 TSecr=7760753
  661 20.797776968 192.168.1.12 → 10.6.15.156  SSH 862 Client: Encrypted packet (len=796)
  662 20.800476299  10.6.15.156 → 192.168.1.12 TCP 66 22 → 54766 [ACK] Seq=421709 Ack=23641 Win=1452 Len=0 TSval=14692250 TSecr=7760754
  663 21.013618125  10.6.15.156 → 192.168.1.12 SSH 454 Server: Encrypted packet (len=388)
  664 21.014362024  10.6.15.156 → 192.168.1.12 SSH 454 Server: Encrypted packet (len=388)
  665 21.014407786 192.168.1.12 → 10.6.15.156  TCP 66 54766 → 22 [ACK] Seq=23641 Ack=422485 Win=4866 Len=0 TSval=7760808 TSecr=14692303
  666 21.792182938 192.168.1.12 → 10.6.15.156  SSH 862 Client: Encrypted packet (len=796)
  667 21.794319662  10.6.15.156 → 192.168.1.12 TCP 66 22 → 54766 [ACK] Seq=422485 Ack=24437 Win=1452 Len=0 TSval=14692499 TSecr=7761002
  668 22.008662948  10.6.15.156 → 192.168.1.12 SSH 454 Server: Encrypted packet (len=388)
  669 22.052631283 192.168.1.12 → 10.6.15.156  TCP 66 54766 → 22 [ACK] Seq=24437 Ack=422873 Win=4866 Len=0 TSval=7761068 TSecr=14692552
  670 22.794320194 192.168.1.12 → 10.6.15.156  SSH 862 Client: Encrypted packet (len=796)
  671 22.930156412  10.6.15.156 → 192.168.1.12 TCP 66 22 → 54766 [ACK] Seq=422873 Ack=25233 Win=1452 Len=0 TSval=14692749 TSecr=7761253
  672 22.930176545 192.168.1.12 → 10.6.15.156  SSH 862 Client: Encrypted packet (len=796)
  673 22.935558335  10.6.15.156 → 192.168.1.12 TCP 66 22 → 54766 [ACK] Seq=422873 Ack=26029 Win=1452 Len=0 TSval=14692783 TSecr=7761287
  674 23.011128962  10.6.15.156 → 192.168.1.12 SSH 454 Server: Encrypted packet (len=388)
  675 23.011147722 192.168.1.12 → 10.6.15.156  TCP 66 54766 → 22 [ACK] Seq=26029 Ack=423261 Win=4866 Len=0 TSval=7761307 TSecr=14692803
  676 23.150521768  10.6.15.156 → 192.168.1.12 SSH 454 Server: Encrypted packet (len=388)
  677 23.150541104 192.168.1.12 → 10.6.15.156  TCP 66 54766 → 22 [ACK] Seq=26029 Ack=423649 Win=4866 Len=0 TSval=7761342 TSecr=14692837
  678 23.378950070  10.6.15.156 → 192.168.1.12 SSH 102 Server: Encrypted packet (len=36)
  679 23.378977347 192.168.1.12 → 10.6.15.156  TCP 66 54766 → 22 [ACK] Seq=26029 Ack=423685 Win=4866 Len=0 TSval=7761399 TSecr=14692895
  680 23.379323554  10.6.15.156 → 192.168.1.12 SSH 102 Server: Encrypted packet (len=36)
  681 23.379335561 192.168.1.12 → 10.6.15.156  TCP 66 54766 → 22 [ACK] Seq=26029 Ack=423721 Win=4866 Len=0 TSval=7761399 TSecr=14692895
  682 23.419397911  10.6.15.156 → 192.168.1.12 SSH 102 Server: Encrypted packet (len=36)
  683 23.419416119 192.168.1.12 → 10.6.15.156  TCP 66 54766 → 22 [ACK] Seq=26029 Ack=423757 Win=4866 Len=0 TSval=7761409 TSecr=14692905
  684 23.516231801  10.6.15.156 → 192.168.1.12 SSH 102 Server: Encrypted packet (len=36)
  685 23.516250635 192.168.1.12 → 10.6.15.156  TCP 66 54766 → 22 [ACK] Seq=26029 Ack=423793 Win=4866 Len=0 TSval=7761433 TSecr=14692929
  686 26.793573240 192.168.1.12 → 10.6.15.156  SSH 862 Client: Encrypted packet (len=796)
  687 26.795842457  10.6.15.156 → 192.168.1.12 TCP 66 22 → 54766 [ACK] Seq=423793 Ack=26825 Win=1452 Len=0 TSval=14693749 TSecr=7762253
  688 26.795858372 192.168.1.12 → 10.6.15.156  SSH 862 Client: Encrypted packet (len=796)
  689 26.798689570  10.6.15.156 → 192.168.1.12 TCP 66 22 → 54766 [ACK] Seq=423793 Ack=27621 Win=1452 Len=0 TSval=14693750 TSecr=7762253
  690 27.013021488  10.6.15.156 → 192.168.1.12 SSH 842 Server: Encrypted packet (len=776)
  691 27.013042445 192.168.1.12 → 10.6.15.156  TCP 66 54766 → 22 [ACK] Seq=27621 Ack=424569 Win=4866 Len=0 TSval=7762308 TSecr=14693803
  692 27.799236068 192.168.1.12 → 10.6.15.156  SSH 862 Client: Encrypted packet (len=796)
  693 27.801423413  10.6.15.156 → 192.168.1.12 TCP 66 22 → 54766 [ACK] Seq=424569 Ack=28417 Win=1452 Len=0 TSval=14694000 TSecr=7762504
  694 28.018197792  10.6.15.156 → 192.168.1.12 SSH 454 Server: Encrypted packet (len=388)
  695 28.018233891 192.168.1.12 → 10.6.15.156  TCP 66 54766 → 22 [ACK] Seq=28417 Ack=424957 Win=4866 Len=0 TSval=7762559 TSecr=14694055
  696 28.798392766 192.168.1.12 → 10.6.15.156  SSH 862 Client: Encrypted packet (len=796)
  697 28.801705343  10.6.15.156 → 192.168.1.12 TCP 66 22 → 54766 [ACK] Seq=424957 Ack=29213 Win=1452 Len=0 TSval=14694250 TSecr=7762754
  698 28.801725112 192.168.1.12 → 10.6.15.156  SSH 862 Client: Encrypted packet (len=796)
  699 28.811068157  10.6.15.156 → 192.168.1.12 TCP 66 22 → 54766 [ACK] Seq=424957 Ack=30009 Win=1452 Len=0 TSval=14694253 TSecr=7762755
  700 29.017464806  10.6.15.156 → 192.168.1.12 SSH 454 Server: Encrypted packet (len=388)
  701 29.017482527 192.168.1.12 → 10.6.15.156  TCP 66 54766 → 22 [ACK] Seq=30009 Ack=425345 Win=4866 Len=0 TSval=7762809 TSecr=14694304
  702 29.024122930  10.6.15.156 → 192.168.1.12 SSH 454 Server: Encrypted packet (len=388)
  703 29.024148735 192.168.1.12 → 10.6.15.156  TCP 66 54766 → 22 [ACK] Seq=30009 Ack=425733 Win=4866 Len=0 TSval=7762810 TSecr=14694306
  704 31.788751983  10.6.15.156 → 192.168.1.12 SSH 102 Server: Encrypted packet (len=36)
  705 32.216692741 192.168.1.12 → 10.6.15.156  TCP 66 54766 → 22 [ACK] Seq=30009 Ack=425769 Win=4866 Len=0 TSval=7763502 TSecr=14694997
  706 32.217761605  10.6.15.156 → 192.168.1.12 SSH 102 Server: [TCP Spurious Retransmission] , Encrypted packet (len=36)
  707 32.217778716 192.168.1.12 → 10.6.15.156  TCP 78 [TCP Dup ACK 705#1] 54766 → 22 [ACK] Seq=30009 Ack=425769 Win=4866 Len=0 TSval=7763609 TSecr=14695048 SLE=425733 SRE=425769
  708 32.218300900  10.6.15.156 → 192.168.1.12 SSH 102 Server: [TCP Spurious Retransmission] , Encrypted packet (len=36)
  709 32.218319800 192.168.1.12 → 10.6.15.156  TCP 78 [TCP Dup ACK 705#2] 54766 → 22 [ACK] Seq=30009 Ack=425769 Win=4866 Len=0 TSval=7763609 TSecr=14695099 SLE=425733 SRE=425769
  710 32.410178817 10.22.18.100 → 224.0.0.252  LLMNR 64 Standard query 0x3c3e A wpad
  711 32.410562886 10.22.18.100 → 224.0.0.252  LLMNR 64 Standard query 0x9d28 AAAA wpad
  712 32.932725781 192.168.1.12 → 10.6.15.156  SSH 862 Client: Encrypted packet (len=796)
  713 32.933443546 10.22.18.100 → 224.0.0.252  LLMNR 64 Standard query 0x9d28 AAAA wpad
  714 32.933825023 10.22.18.100 → 224.0.0.252  LLMNR 64 Standard query 0x3c3e A wpad
  715 32.935490580  10.6.15.156 → 192.168.1.12 TCP 66 22 → 54766 [ACK] Seq=425769 Ack=30805 Win=1452 Len=0 TSval=14695284 TSecr=7763753
  716 32.935511262 192.168.1.12 → 10.6.15.156  SSH 862 Client: Encrypted packet (len=796)
  717 32.937794076  10.6.15.156 → 192.168.1.12 TCP 66 22 → 54766 [ACK] Seq=425769 Ack=31601 Win=1452 Len=0 TSval=14695284 TSecr=7763788
  718 33.149042306  10.6.15.156 → 192.168.1.12 SSH 454 Server: Encrypted packet (len=388)
  719 33.155962269  10.6.15.156 → 192.168.1.12 SSH 454 Server: Encrypted packet (len=388)
  720 33.274170826  10.6.15.156 → 192.168.1.12 TCP 454 [TCP Retransmission] 22 → 54766 [PSH, ACK] Seq=426157 Ack=31601 Win=1452 Len=388 TSval=14695369 TSecr=7763788
  721 33.644724870 192.168.1.12 → 10.6.15.156  TCP 66 54766 → 22 [ACK] Seq=31601 Ack=426157 Win=4866 Len=0 TSval=7763842 TSecr=14695337
  722 33.644734685 192.168.1.12 → 10.6.15.156  TCP 66 54766 → 22 [ACK] Seq=31601 Ack=426545 Win=4866 Len=0 TSval=7763843 TSecr=14695339
  723 33.644736565 192.168.1.12 → 10.6.15.156  TCP 78 [TCP Dup ACK 722#1] 54766 → 22 [ACK] Seq=31601 Ack=426545 Win=4866 Len=0 TSval=7763873 TSecr=14695369 SLE=426157 SRE=426545
  724 33.796620813 192.168.1.12 → 10.6.15.156  SSH 862 Client: Encrypted packet (len=796)
  725 33.798626228  10.6.15.156 → 192.168.1.12 TCP 66 22 → 54766 [ACK] Seq=426545 Ack=32397 Win=1452 Len=0 TSval=14695500 TSecr=7764004
  726 34.015771339  10.6.15.156 → 192.168.1.12 SSH 454 Server: Encrypted packet (len=388)
