    1 0.000000000 192.168.1.16 → 10.6.15.144  SSH 102 Client: Encrypted packet (len=36)
    2 0.003116241  10.6.15.144 → 192.168.1.16 TCP 66 [TCP ACKed unseen segment] 22 → 58518 [ACK] Seq=1 Ack=145 Win=1452 Len=0 TSval=7031865 TSecr=7581580
    3 0.020476377 192.168.1.16 → 224.0.0.251  MDNS 82 Standard query 0x0000 PTR _googlecast._tcp.local, "QM" question
    4 0.020518144 fe80::820e:b87b:de2a:4286 → ff02::fb     MDNS 102 Standard query 0x0000 PTR _googlecast._tcp.local, "QM" question
    5 0.020565597 192.168.1.16 → 224.0.0.251  MDNS 82 Standard query 0x0000 PTR _googlecast._tcp.local, "QM" question
    6 0.020576680 fe80::820e:b87b:de2a:4286 → ff02::fb     MDNS 102 Standard query 0x0000 PTR _googlecast._tcp.local, "QM" question
    7 0.508559419 192.168.1.16 → 10.6.15.144  SSH 102 Client: [TCP Previous segment not captured] , Encrypted packet (len=36)
    8 0.509499800 192.168.1.16 → 239.255.255.250 SSDP 213 M-SEARCH * HTTP/1.1 
    9 0.510152856 192.168.1.16 → 10.6.15.144  SSH 110 Client: Encrypted packet (len=44)
   10 0.510906824  10.6.15.144 → 192.168.1.16 SSH 110 Server: [TCP ACKed unseen segment] , Encrypted packet (len=44)
   11 0.511091260  10.6.15.144 → 192.168.1.16 SSH 1270 Server: Encrypted packet (len=1204)
   12 0.511122354 192.168.1.16 → 10.6.15.144  TCP 66 58518 → 22 [ACK] Seq=225 Ack=1249 Win=2263 Len=0 TSval=7581707 TSecr=7031903
   13 0.511292691  10.6.15.144 → 192.168.1.16 SSH 1514 Server: Encrypted packet (len=1448)
   14 0.512188134  10.6.15.144 → 192.168.1.16 SSH 110 Server: Encrypted packet (len=44)
   15 0.512205734 192.168.1.16 → 10.6.15.144  TCP 66 58518 → 22 [ACK] Seq=225 Ack=2741 Win=2263 Len=0 TSval=7581708 TSecr=7031904
   16 0.512411186  10.6.15.144 → 192.168.1.16 SSH 1514 Server: Encrypted packet (len=1448)
   17 0.512422209  10.6.15.144 → 192.168.1.16 SSH 110 Server: Encrypted packet (len=44)
   18 0.512428138 192.168.1.16 → 10.6.15.144  TCP 66 58518 → 22 [ACK] Seq=225 Ack=4233 Win=2263 Len=0 TSval=7581708 TSecr=7031904
   19 0.512621172  10.6.15.144 → 192.168.1.16 SSH 1514 Server: Encrypted packet (len=1448)
   20 0.512631657  10.6.15.144 → 192.168.1.16 SSH 110 Server: Encrypted packet (len=44)
   21 0.512636776 192.168.1.16 → 10.6.15.144  TCP 66 58518 → 22 [ACK] Seq=225 Ack=5725 Win=2263 Len=0 TSval=7581708 TSecr=7031904
   22 0.512832820  10.6.15.144 → 192.168.1.16 SSH 1514 Server: Encrypted packet (len=1448)
   23 0.512994985  10.6.15.144 → 192.168.1.16 TCP 1314 [TCP Out-Of-Order] 22 → 58518 [PSH, ACK] Seq=1 Ack=145 Win=1452 Len=1248 TSval=7031985 TSecr=7581580
   24 0.513004755 192.168.1.16 → 10.6.15.144  TCP 78 58518 → 22 [ACK] Seq=225 Ack=7173 Win=2263 Len=0 TSval=7581708 TSecr=7031916 SLE=1 SRE=1249
   25 0.513016834  10.6.15.144 → 192.168.1.16 TCP 66 22 → 58518 [ACK] Seq=7173 Ack=181 Win=1452 Len=0 TSval=7031993 TSecr=7581707
   26 0.513025527 192.168.1.16 → 10.6.15.144  SSH 110 Client: Encrypted packet (len=44)
   27 0.513965012  10.6.15.144 → 192.168.1.16 TCP 66 22 → 58518 [ACK] Seq=7173 Ack=225 Win=1452 Len=0 TSval=7031993 TSecr=7581707
   28 0.514695301  10.6.15.144 → 192.168.1.16 SSH 1514 Server: Encrypted packet (len=1448)
   29 0.515691187  10.6.15.144 → 192.168.1.16 SSH 1514 Server: Encrypted packet (len=1448)
   30 0.515710480 192.168.1.16 → 10.6.15.144  TCP 66 58518 → 22 [ACK] Seq=269 Ack=10069 Win=2263 Len=0 TSval=7581708 TSecr=7031993
   31 0.515872630  10.6.15.144 → 192.168.1.16 SSH 1514 Server: Encrypted packet (len=1448)
   32 0.516066880  10.6.15.144 → 192.168.1.16 SSH 1514 Server: Encrypted packet (len=1448)
   33 0.516074359 192.168.1.16 → 10.6.15.144  TCP 66 58518 → 22 [ACK] Seq=269 Ack=12965 Win=2263 Len=0 TSval=7581709 TSecr=7031993
   34 0.516257961  10.6.15.144 → 192.168.1.16 SSH 1514 Server: Encrypted packet (len=1448)
   35 0.516449384  10.6.15.144 → 192.168.1.16 SSH 1514 Server: Encrypted packet (len=1448)
   36 0.516458146 192.168.1.16 → 10.6.15.144  TCP 66 58518 → 22 [ACK] Seq=269 Ack=15861 Win=2263 Len=0 TSval=7581709 TSecr=7031993
   37 0.517373604  10.6.15.144 → 192.168.1.16 SSH 1354 Server: Encrypted packet (len=1288)
   38 0.517814153  10.6.15.144 → 192.168.1.16 SSH 110 Server: Encrypted packet (len=44)
   39 0.517856375 192.168.1.16 → 10.6.15.144  TCP 66 58518 → 22 [ACK] Seq=269 Ack=17193 Win=2263 Len=0 TSval=7581709 TSecr=7031994
   40 0.518761849 192.168.1.16 → 10.6.15.144  SSH 174 Client: Encrypted packet (len=108)
   41 0.526557253 192.168.1.16 → 10.6.15.144  SSH 102 Client: Encrypted packet (len=36)
   42 0.528055255  10.6.15.144 → 192.168.1.16 TCP 66 22 → 58518 [ACK] Seq=17193 Ack=413 Win=1452 Len=0 TSval=7031997 TSecr=7581709
   43 0.528074829 192.168.1.16 → 10.6.15.144  SSH 526 Client: Encrypted packet (len=460)
   44 0.530866624  10.6.15.144 → 192.168.1.16 SSH 1514 Server: Encrypted packet (len=1448)
   45 0.531044691  10.6.15.144 → 192.168.1.16 SSH 1514 Server: Encrypted packet (len=1448)
   46 0.531057156 192.168.1.16 → 10.6.15.144  TCP 66 58518 → 22 [ACK] Seq=873 Ack=20089 Win=2263 Len=0 TSval=7581712 TSecr=7031997
   47 0.531937780  10.6.15.144 → 192.168.1.16 SSH 110 Server: Encrypted packet (len=44)
   48 0.532153258  10.6.15.144 → 192.168.1.16 SSH 1514 Server: Encrypted packet (len=1448)
   49 0.532162154 192.168.1.16 → 10.6.15.144  TCP 66 58518 → 22 [ACK] Seq=873 Ack=21581 Win=2263 Len=0 TSval=7581713 TSecr=7031997
   50 0.532346311  10.6.15.144 → 192.168.1.16 SSH 1514 Server: Encrypted packet (len=1448)
   51 0.532536233  10.6.15.144 → 192.168.1.16 SSH 1514 Server: Encrypted packet (len=1448)
   52 0.532545302 192.168.1.16 → 10.6.15.144  TCP 66 58518 → 22 [ACK] Seq=873 Ack=24477 Win=2263 Len=0 TSval=7581713 TSecr=7031997
   53 0.532559380  10.6.15.144 → 192.168.1.16 SSH 154 Server: Encrypted packet (len=88)
   54 0.532754184  10.6.15.144 → 192.168.1.16 SSH 1514 Server: Encrypted packet (len=1448)
   55 0.532765318 192.168.1.16 → 10.6.15.144  TCP 66 58518 → 22 [ACK] Seq=873 Ack=26013 Win=2263 Len=0 TSval=7581713 TSecr=7031997
   56 0.533664069 192.168.1.16 → 10.6.15.144  SSH 110 Client: Encrypted packet (len=44)
   57 0.533695831  10.6.15.144 → 192.168.1.16 SSH 1514 Server: Encrypted packet (len=1448)
   58 0.533885657  10.6.15.144 → 192.168.1.16 SSH 1514 Server: Encrypted packet (len=1448)
   59 0.533893522 192.168.1.16 → 10.6.15.144  TCP 66 58518 → 22 [ACK] Seq=917 Ack=28909 Win=2263 Len=0 TSval=7581713 TSecr=7031998
   60 0.534452477 192.168.1.16 → 10.6.15.144  SSH 206 Client: Encrypted packet (len=140)
   61 0.535622128  10.6.15.144 → 192.168.1.16 SSH 1514 Server: Encrypted packet (len=1448)
   62 0.535807852  10.6.15.144 → 192.168.1.16 SSH 1514 Server: Encrypted packet (len=1448)
   63 0.535816390 192.168.1.16 → 10.6.15.144  TCP 66 58518 → 22 [ACK] Seq=1057 Ack=31805 Win=2263 Len=0 TSval=7581713 TSecr=7031998
   64 0.535998926  10.6.15.144 → 192.168.1.16 SSH 1514 Server: Encrypted packet (len=1448)
   65 0.536191382  10.6.15.144 → 192.168.1.16 SSH 1514 Server: Encrypted packet (len=1448)
   66 0.536198654 192.168.1.16 → 10.6.15.144  TCP 66 58518 → 22 [ACK] Seq=1057 Ack=34701 Win=2263 Len=0 TSval=7581714 TSecr=7031998
   67 0.536382771  10.6.15.144 → 192.168.1.16 SSH 1514 Server: Encrypted packet (len=1448)
   68 0.536574159  10.6.15.144 → 192.168.1.16 SSH 1514 Server: Encrypted packet (len=1448)
   69 0.536581408 192.168.1.16 → 10.6.15.144  TCP 66 58518 → 22 [ACK] Seq=1057 Ack=37597 Win=2263 Len=0 TSval=7581714 TSecr=7031998
   70 0.537413918  10.6.15.144 → 192.168.1.16 SSH 1514 Server: Encrypted packet (len=1448)
   71 0.537604112  10.6.15.144 → 192.168.1.16 SSH 1514 Server: Encrypted packet (len=1448)
   72 0.537611834 192.168.1.16 → 10.6.15.144  TCP 66 58518 → 22 [ACK] Seq=1057 Ack=40493 Win=2263 Len=0 TSval=7581714 TSecr=7031999
   73 0.538937739  10.6.15.144 → 192.168.1.16 SSH 1514 Server: Encrypted packet (len=1448)
   74 0.539119934  10.6.15.144 → 192.168.1.16 SSH 1514 Server: Encrypted packet (len=1448)
   75 0.539128072 192.168.1.16 → 10.6.15.144  TCP 66 58518 → 22 [ACK] Seq=1057 Ack=43389 Win=2263 Len=0 TSval=7581714 TSecr=7031999
   76 0.539309656  10.6.15.144 → 192.168.1.16 SSH 1514 Server: Encrypted packet (len=1448)
   77 0.539501733  10.6.15.144 → 192.168.1.16 SSH 1514 Server: Encrypted packet (len=1448)
   78 0.539509828 192.168.1.16 → 10.6.15.144  TCP 66 58518 → 22 [ACK] Seq=1057 Ack=46285 Win=2263 Len=0 TSval=7581714 TSecr=7031999
   79 0.539586356  10.6.15.144 → 192.168.1.16 SSH 818 Server: Encrypted packet (len=752)
   80 0.541139952 192.168.1.16 → 10.6.15.144  SSH 302 Client: Encrypted packet (len=236)
   81 0.544974876 192.168.1.16 → 10.6.15.144  SSH 142 Client: Encrypted packet (len=76)
   82 0.558749860  10.6.15.144 → 192.168.1.16 TCP 66 22 → 58518 [ACK] Seq=47037 Ack=1369 Win=1452 Len=0 TSval=7032004 TSecr=7581715
   83 0.558776242 192.168.1.16 → 10.6.15.144  SSH 1142 Client: Encrypted packet (len=1076)
   84 0.558796409  10.6.15.144 → 192.168.1.16 SSH 326 Server: Encrypted packet (len=260)
   85 0.559537609 192.168.1.16 → 10.6.15.144  SSH 274 Client: Encrypted packet (len=208)
   86 0.560258108  10.6.15.144 → 192.168.1.16 SSH 166 Server: Encrypted packet (len=100)
   87 0.560540797 192.168.1.16 → 10.6.15.144  SSH 126 Client: Encrypted packet (len=60)
   88 0.561140107  10.6.15.144 → 192.168.1.16 SSH 102 Server: Encrypted packet (len=36)
   89 0.562104526  10.6.15.144 → 192.168.1.16 TCP 66 22 → 58518 [ACK] Seq=47433 Ack=2713 Win=1452 Len=0 TSval=7032005 TSecr=7581719
   90 0.563716191  10.6.15.144 → 192.168.1.16 SSH 134 Server: Encrypted packet (len=68)
   91 0.563797618 192.168.1.16 → 10.6.15.144  TCP 66 58518 → 22 [ACK] Seq=2713 Ack=47501 Win=2263 Len=0 TSval=7581720 TSecr=7032005
   92 0.595864363  10.6.15.144 → 192.168.1.16 SSH 214 Server: Encrypted packet (len=148)
   93 0.596501050 192.168.1.16 → 10.6.15.144  SSH 302 Client: Encrypted packet (len=236)
   94 0.597688851 192.168.1.16 → 10.6.15.144  SSH 310 Client: Encrypted packet (len=244)
   95 0.601180098  10.6.15.144 → 192.168.1.16 TCP 66 22 → 58518 [ACK] Seq=47649 Ack=3193 Win=1452 Len=0 TSval=7032015 TSecr=7581729
   96 0.604648117  10.6.15.144 → 192.168.1.16 SSH 550 Server: Encrypted packet (len=484)
   97 0.604666644  10.6.15.144 → 192.168.1.16 SSH 134 Server: Encrypted packet (len=68)
   98 0.604701559 192.168.1.16 → 10.6.15.144  TCP 66 58518 → 22 [ACK] Seq=3193 Ack=48201 Win=2263 Len=0 TSval=7581731 TSecr=7032016
   99 0.605696489  10.6.15.144 → 192.168.1.16 SSH 126 Server: Encrypted packet (len=60)
  100 0.605722547  10.6.15.144 → 192.168.1.16 SSH 142 Server: Encrypted packet (len=76)
  101 0.605758643 192.168.1.16 → 10.6.15.144  TCP 66 58518 → 22 [ACK] Seq=3193 Ack=48337 Win=2263 Len=0 TSval=7581731 TSecr=7032016
  102 0.605956648 192.168.1.16 → 10.6.15.144  SSH 134 Client: Encrypted packet (len=68)
  103 0.633356052  10.6.15.144 → 192.168.1.16 SSH 126 Server: Encrypted packet (len=60)
  104 0.635338887  10.6.15.144 → 192.168.1.16 SSH 214 Server: Encrypted packet (len=148)
  105 0.635400494 192.168.1.16 → 10.6.15.144  TCP 66 58518 → 22 [ACK] Seq=3261 Ack=48545 Win=2263 Len=0 TSval=7581738 TSecr=7032023
  106 0.635919993 192.168.1.16 → 10.6.15.144  SSH 102 Client: Encrypted packet (len=36)
  107 0.636846236  10.6.15.144 → 192.168.1.16 SSH 238 Server: Encrypted packet (len=172)
  108 0.638081781 192.168.1.16 → 10.6.15.144  SSH 110 Client: Encrypted packet (len=44)
  109 0.640895413  10.6.15.144 → 192.168.1.16 TCP 66 22 → 58518 [ACK] Seq=48717 Ack=3341 Win=1452 Len=0 TSval=7032025 TSecr=7581738
  110 0.838261987 192.168.1.16 → 10.6.15.144  SSH 1246 Client: Encrypted packet (len=1180)
  111 0.842289468  10.6.15.144 → 192.168.1.16 SSH 138 Server: Encrypted packet (len=72)
  112 0.842454818 192.168.1.16 → 10.6.15.144  SSH 102 Client: Encrypted packet (len=36)
  113 0.845092104  10.6.15.144 → 192.168.1.16 TCP 66 22 → 58518 [ACK] Seq=48789 Ack=4557 Win=1452 Len=0 TSval=7032076 TSecr=7581789
  114 0.845109920  10.6.15.144 → 192.168.1.16 SSH 142 Server: Encrypted packet (len=76)
  115 0.887997177 192.168.1.16 → 10.6.15.144  TCP 66 58518 → 22 [ACK] Seq=4557 Ack=48865 Win=2263 Len=0 TSval=7581802 TSecr=7032076
  116 0.904071623  10.6.15.144 → 192.168.1.16 SSH 138 Server: Encrypted packet (len=72)
  117 0.904146171 192.168.1.16 → 10.6.15.144  TCP 66 58518 → 22 [ACK] Seq=4557 Ack=48937 Win=2263 Len=0 TSval=7581806 TSecr=7032091
  118 0.904285843 192.168.1.16 → 10.6.15.144  SSH 102 Client: Encrypted packet (len=36)
  119 0.905180098  10.6.15.144 → 192.168.1.16 SSH 1514 Server: Encrypted packet (len=1448)
  120 0.905206589  10.6.15.144 → 192.168.1.16 SSH 110 Server: Encrypted packet (len=44)
  121 0.905227394 192.168.1.16 → 10.6.15.144  TCP 66 58518 → 22 [ACK] Seq=4593 Ack=50429 Win=2263 Len=0 TSval=7581806 TSecr=7032091
  122 0.908732138  10.6.15.144 → 192.168.1.16 SSH 1514 Server: Encrypted packet (len=1448)
  123 0.908941824  10.6.15.144 → 192.168.1.16 SSH 1514 Server: Encrypted packet (len=1448)
  124 0.908950869 192.168.1.16 → 10.6.15.144  TCP 66 58518 → 22 [ACK] Seq=4593 Ack=53325 Win=2263 Len=0 TSval=7581807 TSecr=7032091
  125 0.908965328  10.6.15.144 → 192.168.1.16 SSH 110 Server: Encrypted packet (len=44)
  126 0.909178276  10.6.15.144 → 192.168.1.16 SSH 1514 Server: Encrypted packet (len=1448)
  127 0.909187366 192.168.1.16 → 10.6.15.144  TCP 66 58518 → 22 [ACK] Seq=4593 Ack=54817 Win=2263 Len=0 TSval=7581807 TSecr=7032091
  128 0.909392346  10.6.15.144 → 192.168.1.16 SSH 1514 Server: Encrypted packet (len=1448)
  129 0.910052459  10.6.15.144 → 192.168.1.16 SSH 1514 Server: Encrypted packet (len=1448)
  130 0.910064241 192.168.1.16 → 10.6.15.144  TCP 66 58518 → 22 [ACK] Seq=4593 Ack=57713 Win=2263 Len=0 TSval=7581807 TSecr=7032091
  131 0.910266595  10.6.15.144 → 192.168.1.16 SSH 1514 Server: Encrypted packet (len=1448)
  132 0.911860384  10.6.15.144 → 192.168.1.16 SSH 1514 Server: Encrypted packet (len=1448)
  133 0.911869563 192.168.1.16 → 10.6.15.144  TCP 66 58518 → 22 [ACK] Seq=4593 Ack=60609 Win=2263 Len=0 TSval=7581807 TSecr=7032092
  134 0.912079141  10.6.15.144 → 192.168.1.16 SSH 1514 Server: Encrypted packet (len=1448)
  135 0.912257930  10.6.15.144 → 192.168.1.16 SSH 1514 Server: Encrypted packet (len=1448)
  136 0.912264567 192.168.1.16 → 10.6.15.144  TCP 66 58518 → 22 [ACK] Seq=4593 Ack=63505 Win=2263 Len=0 TSval=7581808 TSecr=7032092
  137 0.912472355  10.6.15.144 → 192.168.1.16 SSH 1514 Server: Encrypted packet (len=1448)
  138 0.912685797  10.6.15.144 → 192.168.1.16 SSH 1514 Server: Encrypted packet (len=1448)
  139 0.912694418 192.168.1.16 → 10.6.15.144  TCP 66 58518 → 22 [ACK] Seq=4593 Ack=66401 Win=2263 Len=0 TSval=7581808 TSecr=7032092
  140 0.913448902  10.6.15.144 → 192.168.1.16 SSH 1514 Server: Encrypted packet (len=1448)
  141 0.915610208  10.6.15.144 → 192.168.1.16 SSH 1514 Server: Encrypted packet (len=1448)
  142 0.915621757 192.168.1.16 → 10.6.15.144  TCP 66 58518 → 22 [ACK] Seq=4593 Ack=69297 Win=2263 Len=0 TSval=7581808 TSecr=7032093
  143 0.915819432  10.6.15.144 → 192.168.1.16 SSH 1514 Server: Encrypted packet (len=1448)
  144 0.916036358  10.6.15.144 → 192.168.1.16 SSH 1514 Server: Encrypted packet (len=1448)
  145 0.916045240 192.168.1.16 → 10.6.15.144  TCP 66 58518 → 22 [ACK] Seq=4593 Ack=72193 Win=2263 Len=0 TSval=7581809 TSecr=7032093
  146 0.916246328  10.6.15.144 → 192.168.1.16 SSH 1514 Server: Encrypted packet (len=1448)
  147 0.916459249  10.6.15.144 → 192.168.1.16 SSH 1514 Server: Encrypted packet (len=1448)
  148 0.916467343 192.168.1.16 → 10.6.15.144  TCP 66 58518 → 22 [ACK] Seq=4593 Ack=75089 Win=2263 Len=0 TSval=7581809 TSecr=7032093
  149 0.916674760  10.6.15.144 → 192.168.1.16 SSH 1514 Server: Encrypted packet (len=1448)
  150 0.917351275  10.6.15.144 → 192.168.1.16 SSH 1514 Server: Encrypted packet (len=1448)
  151 0.917359232 192.168.1.16 → 10.6.15.144  TCP 66 58518 → 22 [ACK] Seq=4593 Ack=77985 Win=2263 Len=0 TSval=7581809 TSecr=7032093
  152 0.917565950  10.6.15.144 → 192.168.1.16 SSH 1514 Server: Encrypted packet (len=1448)
  153 0.918970579  10.6.15.144 → 192.168.1.16 SSH 1514 Server: Encrypted packet (len=1448)
  154 0.918985814 192.168.1.16 → 10.6.15.144  TCP 66 58518 → 22 [ACK] Seq=4593 Ack=80881 Win=2263 Len=0 TSval=7581809 TSecr=7032093
  155 0.919180965  10.6.15.144 → 192.168.1.16 SSH 1514 Server: Encrypted packet (len=1448)
  156 0.919395025  10.6.15.144 → 192.168.1.16 SSH 1514 Server: Encrypted packet (len=1448)
  157 0.919403685 192.168.1.16 → 10.6.15.144  TCP 66 58518 → 22 [ACK] Seq=4593 Ack=83777 Win=2263 Len=0 TSval=7581809 TSecr=7032094
  158 0.919607279  10.6.15.144 → 192.168.1.16 SSH 1514 Server: Encrypted packet (len=1448)
  159 0.920777219  10.6.15.144 → 192.168.1.16 SSH 1514 Server: Encrypted packet (len=1448)
  160 0.920798947 192.168.1.16 → 10.6.15.144  TCP 66 58518 → 22 [ACK] Seq=4593 Ack=86673 Win=2263 Len=0 TSval=7581810 TSecr=7032094
  161 0.920980257  10.6.15.144 → 192.168.1.16 SSH 1514 Server: Encrypted packet (len=1448)
  162 0.921193315  10.6.15.144 → 192.168.1.16 SSH 1514 Server: Encrypted packet (len=1448)
  163 0.921201287 192.168.1.16 → 10.6.15.144  TCP 66 58518 → 22 [ACK] Seq=4593 Ack=89569 Win=2263 Len=0 TSval=7581810 TSecr=7032094
  164 0.921406189  10.6.15.144 → 192.168.1.16 SSH 1514 Server: Encrypted packet (len=1448)
  165 0.922517870  10.6.15.144 → 192.168.1.16 SSH 1514 Server: Encrypted packet (len=1448)
  166 0.922536783 192.168.1.16 → 10.6.15.144  TCP 66 58518 → 22 [ACK] Seq=4593 Ack=92465 Win=2263 Len=0 TSval=7581810 TSecr=7032095
  167 0.922723550  10.6.15.144 → 192.168.1.16 SSH 1514 Server: Encrypted packet (len=1448)
  168 0.922940128  10.6.15.144 → 192.168.1.16 SSH 1514 Server: Encrypted packet (len=1448)
  169 0.922948750 192.168.1.16 → 10.6.15.144  TCP 66 58518 → 22 [ACK] Seq=4593 Ack=95361 Win=2263 Len=0 TSval=7581810 TSecr=7032095
  170 0.923152112  10.6.15.144 → 192.168.1.16 SSH 1514 Server: Encrypted packet (len=1448)
  171 0.924317343  10.6.15.144 → 192.168.1.16 SSH 1514 Server: Encrypted packet (len=1448)
  172 0.924334599 192.168.1.16 → 10.6.15.144  TCP 66 58518 → 22 [ACK] Seq=4593 Ack=98257 Win=2263 Len=0 TSval=7581811 TSecr=7032095
  173 0.924524656  10.6.15.144 → 192.168.1.16 SSH 1514 Server: Encrypted packet (len=1448)
  174 0.924739544  10.6.15.144 → 192.168.1.16 SSH 1514 Server: Encrypted packet (len=1448)
  175 0.924749496 192.168.1.16 → 10.6.15.144  TCP 66 58518 → 22 [ACK] Seq=4593 Ack=101153 Win=2263 Len=0 TSval=7581811 TSecr=7032096
  176 0.924931128  10.6.15.144 → 192.168.1.16 SSH 1406 Server: Encrypted packet (len=1340)
  177 0.925355744  10.6.15.144 → 192.168.1.16 SSH 102 Server: Encrypted packet (len=36)
  178 0.925387522 192.168.1.16 → 10.6.15.144  TCP 66 58518 → 22 [ACK] Seq=4593 Ack=102529 Win=2263 Len=0 TSval=7581811 TSecr=7032096
  179 0.927035561  10.6.15.144 → 192.168.1.16 SSH 294 Server: Encrypted packet (len=228)
  180 0.929204592  10.6.15.144 → 192.168.1.16 SSH 1398 Server: Encrypted packet (len=1332)
  181 0.929226081 192.168.1.16 → 10.6.15.144  TCP 66 58518 → 22 [ACK] Seq=4593 Ack=104089 Win=2263 Len=0 TSval=7581812 TSecr=7032097
  182 0.929247561  10.6.15.144 → 192.168.1.16 SSH 102 Server: Encrypted packet (len=36)
  183 0.930656522 192.168.1.16 → 10.6.15.144  SSH 142 Client: Encrypted packet (len=76)
  184 0.933608318 192.168.1.16 → 10.6.15.144  SSH 1514 Client: Encrypted packet (len=1448)
  185 0.933630321 192.168.1.16 → 10.6.15.144  SSH 1514 Client: Encrypted packet (len=1448)
  186 0.934432872 192.168.1.16 → 10.6.15.144  SSH 126 Client: Encrypted packet (len=60)
  187 0.935887115  10.6.15.144 → 192.168.1.16 TCP 66 22 → 58518 [ACK] Seq=104125 Ack=6117 Win=1452 Len=0 TSval=7032099 TSecr=7581812
  188 0.936461619  10.6.15.144 → 192.168.1.16 TCP 66 22 → 58518 [ACK] Seq=104125 Ack=7625 Win=1452 Len=0 TSval=7032099 TSecr=7581813
  189 1.018020306  10.6.15.144 → 192.168.1.16 SSH 102 Server: Encrypted packet (len=36)
  190 1.018338203 192.168.1.16 → 10.6.15.144  SSH 198 Client: Encrypted packet (len=132)
  191 1.038945143 192.168.1.16 → 10.6.15.144  SSH 838 Client: Encrypted packet (len=772)
  192 1.046898809  10.6.15.144 → 192.168.1.16 TCP 66 22 → 58518 [ACK] Seq=104161 Ack=8529 Win=1452 Len=0 TSval=7032127 TSecr=7581834
  193 1.062654816  10.6.15.144 → 192.168.1.16 SSH 1494 Server: Encrypted packet (len=1428)
  194 1.062677269  10.6.15.144 → 192.168.1.16 SSH 430 Server: Encrypted packet (len=364)
  195 1.062689568 192.168.1.16 → 10.6.15.144  TCP 66 58518 → 22 [ACK] Seq=8529 Ack=105953 Win=2263 Len=0 TSval=7581845 TSecr=7032130
  196 1.063385109 192.168.1.16 → 10.6.15.144  SSH 134 Client: Encrypted packet (len=68)
  197 1.102901604  10.6.15.144 → 192.168.1.16 TCP 66 22 → 58518 [ACK] Seq=105953 Ack=8597 Win=1452 Len=0 TSval=7032141 TSecr=7581845
  198 1.134583640  10.6.15.144 → 192.168.1.16 SSH 142 Server: Encrypted packet (len=76)
  199 1.134600143  10.6.15.144 → 192.168.1.16 SSH 134 Server: Encrypted packet (len=68)
  200 1.134645622 192.168.1.16 → 10.6.15.144  TCP 66 58518 → 22 [ACK] Seq=8597 Ack=106097 Win=2263 Len=0 TSval=7581863 TSecr=7032148
  201 1.135205438 192.168.1.16 → 10.6.15.144  SSH 134 Client: Encrypted packet (len=68)
  202 1.136702657  10.6.15.144 → 192.168.1.16 TCP 66 22 → 58518 [ACK] Seq=106097 Ack=8665 Win=1452 Len=0 TSval=7032149 TSecr=7581863
  203 1.260003011 192.168.1.16 → 10.6.15.144  SSH 230 Client: Encrypted packet (len=164)
  204 1.262258748  10.6.15.144 → 192.168.1.16 TCP 66 22 → 58518 [ACK] Seq=106097 Ack=8829 Win=1452 Len=0 TSval=7032180 TSecr=7581890
  205 1.271747220  10.6.15.144 → 192.168.1.16 SSH 1514 Server: Encrypted packet (len=1448)
  206 1.271951673  10.6.15.144 → 192.168.1.16 SSH 1514 Server: Encrypted packet (len=1448)
  207 1.271962335 192.168.1.16 → 10.6.15.144  TCP 66 58518 → 22 [ACK] Seq=8829 Ack=108993 Win=2263 Len=0 TSval=7581898 TSecr=7032183
  208 1.274672164  10.6.15.144 → 192.168.1.16 SSH 110 Server: Encrypted packet (len=44)
  209 1.274809444 192.168.1.16 → 10.6.15.144  SSH 102 Client: Encrypted packet (len=36)
  210 1.274898040  10.6.15.144 → 192.168.1.16 SSH 1514 Server: Encrypted packet (len=1448)
  211 1.275141365  10.6.15.144 → 192.168.1.16 SSH 1514 Server: Encrypted packet (len=1448)
  212 1.275147630 192.168.1.16 → 10.6.15.144  TCP 66 58518 → 22 [ACK] Seq=8865 Ack=111933 Win=2263 Len=0 TSval=7581898 TSecr=7032183
  213 1.275155704  10.6.15.144 → 192.168.1.16 SSH 110 Server: Encrypted packet (len=44)
  214 1.275359559  10.6.15.144 → 192.168.1.16 SSH 1514 Server: Encrypted packet (len=1448)
  215 1.275365105 192.168.1.16 → 10.6.15.144  TCP 66 58518 → 22 [ACK] Seq=8865 Ack=113425 Win=2263 Len=0 TSval=7581898 TSecr=7032183
  216 1.275558393  10.6.15.144 → 192.168.1.16 SSH 1514 Server: Encrypted packet (len=1448)
  217 1.275564771  10.6.15.144 → 192.168.1.16 SSH 110 Server: Encrypted packet (len=44)
  218 1.275568520 192.168.1.16 → 10.6.15.144  TCP 66 58518 → 22 [ACK] Seq=8865 Ack=114917 Win=2263 Len=0 TSval=7581898 TSecr=7032183
  219 1.277964130  10.6.15.144 → 192.168.1.16 SSH 1514 Server: Encrypted packet (len=1448)
  220 1.278157184  10.6.15.144 → 192.168.1.16 SSH 1514 Server: Encrypted packet (len=1448)
  221 1.278164331 192.168.1.16 → 10.6.15.144  TCP 66 58518 → 22 [ACK] Seq=8865 Ack=117813 Win=2263 Len=0 TSval=7581899 TSecr=7032184
  222 1.278382132  10.6.15.144 → 192.168.1.16 SSH 1514 Server: Encrypted packet (len=1448)
  223 1.278582935  10.6.15.144 → 192.168.1.16 SSH 1514 Server: Encrypted packet (len=1448)
  224 1.278588056 192.168.1.16 → 10.6.15.144  TCP 66 58518 → 22 [ACK] Seq=8865 Ack=120709 Win=2263 Len=0 TSval=7581899 TSecr=7032184
  225 1.278795935  10.6.15.144 → 192.168.1.16 SSH 1514 Server: Encrypted packet (len=1448)
  226 1.279006508  10.6.15.144 → 192.168.1.16 SSH 1514 Server: Encrypted packet (len=1448)
  227 1.279009586 192.168.1.16 → 10.6.15.144  TCP 66 58518 → 22 [ACK] Seq=8865 Ack=123605 Win=2263 Len=0 TSval=7581899 TSecr=7032184
  228 1.280315954  10.6.15.144 → 192.168.1.16 SSH 1514 Server: Encrypted packet (len=1448)
  229 1.280531054  10.6.15.144 → 192.168.1.16 SSH 1514 Server: Encrypted packet (len=1448)
  230 1.280539659 192.168.1.16 → 10.6.15.144  TCP 66 58518 → 22 [ACK] Seq=8865 Ack=126501 Win=2263 Len=0 TSval=7581900 TSecr=7032184
  231 1.281768592  10.6.15.144 → 192.168.1.16 SSH 1514 Server: Encrypted packet (len=1448)
  232 1.282004368  10.6.15.144 → 192.168.1.16 SSH 1514 Server: Encrypted packet (len=1448)
  233 1.282010230 192.168.1.16 → 10.6.15.144  TCP 66 58518 → 22 [ACK] Seq=8865 Ack=129397 Win=2263 Len=0 TSval=7581900 TSecr=7032185
  234 1.282192510  10.6.15.144 → 192.168.1.16 SSH 1514 Server: Encrypted packet (len=1448)
  235 1.282408623  10.6.15.144 → 192.168.1.16 SSH 1514 Server: Encrypted packet (len=1448)
  236 1.282414008 192.168.1.16 → 10.6.15.144  TCP 66 58518 → 22 [ACK] Seq=8865 Ack=132293 Win=2263 Len=0 TSval=7581900 TSecr=7032185
  237 1.282621586  10.6.15.144 → 192.168.1.16 SSH 1514 Server: Encrypted packet (len=1448)
  238 1.282835261  10.6.15.144 → 192.168.1.16 SSH 1514 Server: Encrypted packet (len=1448)
  239 1.282843847 192.168.1.16 → 10.6.15.144  TCP 66 58518 → 22 [ACK] Seq=8865 Ack=135189 Win=2263 Len=0 TSval=7581900 TSecr=7032185
  240 1.283060804  10.6.15.144 → 192.168.1.16 SSH 1514 Server: Encrypted packet (len=1448)
  241 1.283260373  10.6.15.144 → 192.168.1.16 SSH 1514 Server: Encrypted packet (len=1448)
  242 1.283266519 192.168.1.16 → 10.6.15.144  TCP 66 58518 → 22 [ACK] Seq=8865 Ack=138085 Win=2263 Len=0 TSval=7581900 TSecr=7032185
  243 1.284270358  10.6.15.144 → 192.168.1.16 SSH 1514 Server: Encrypted packet (len=1448)
  244 1.284482118  10.6.15.144 → 192.168.1.16 SSH 1514 Server: Encrypted packet (len=1448)
  245 1.284487042 192.168.1.16 → 10.6.15.144  TCP 66 58518 → 22 [ACK] Seq=8865 Ack=140981 Win=2263 Len=0 TSval=7581901 TSecr=7032185
  246 1.290652291  10.6.15.144 → 192.168.1.16 SSH 1514 Server: Encrypted packet (len=1448)
  247 1.290850241  10.6.15.144 → 192.168.1.16 SSH 1514 Server: Encrypted packet (len=1448)
  248 1.290857557 192.168.1.16 → 10.6.15.144  TCP 66 58518 → 22 [ACK] Seq=8865 Ack=143877 Win=2263 Len=0 TSval=7581902 TSecr=7032186
  249 1.291076404  10.6.15.144 → 192.168.1.16 SSH 1514 Server: Encrypted packet (len=1448)
  250 1.291276380  10.6.15.144 → 192.168.1.16 SSH 1514 Server: Encrypted packet (len=1448)
  251 1.291281402 192.168.1.16 → 10.6.15.144  TCP 66 58518 → 22 [ACK] Seq=8865 Ack=146773 Win=2263 Len=0 TSval=7581902 TSecr=7032186
  252 1.291488910  10.6.15.144 → 192.168.1.16 SSH 1514 Server: Encrypted packet (len=1448)
  253 1.291702399  10.6.15.144 → 192.168.1.16 SSH 1514 Server: Encrypted packet (len=1448)
  254 1.291707824 192.168.1.16 → 10.6.15.144  TCP 66 58518 → 22 [ACK] Seq=8865 Ack=149669 Win=2263 Len=0 TSval=7581902 TSecr=7032186
  255 1.291917096  10.6.15.144 → 192.168.1.16 SSH 1514 Server: Encrypted packet (len=1448)
  256 1.292132313  10.6.15.144 → 192.168.1.16 SSH 1514 Server: Encrypted packet (len=1448)
  257 1.292140606 192.168.1.16 → 10.6.15.144  TCP 66 58518 → 22 [ACK] Seq=8865 Ack=152565 Win=2263 Len=0 TSval=7581903 TSecr=7032186
  258 1.293269378  10.6.15.144 → 192.168.1.16 SSH 1514 Server: Encrypted packet (len=1448)
  259 1.293485267  10.6.15.144 → 192.168.1.16 SSH 1514 Server: Encrypted packet (len=1448)
  260 1.293492405 192.168.1.16 → 10.6.15.144  TCP 66 58518 → 22 [ACK] Seq=8865 Ack=155461 Win=2263 Len=0 TSval=7581903 TSecr=7032188
  261 1.298875272  10.6.15.144 → 192.168.1.16 SSH 1514 Server: Encrypted packet (len=1448)
  262 1.299077642  10.6.15.144 → 192.168.1.16 SSH 1514 Server: Encrypted packet (len=1448)
  263 1.299085764 192.168.1.16 → 10.6.15.144  TCP 66 58518 → 22 [ACK] Seq=8865 Ack=158357 Win=2263 Len=0 TSval=7581904 TSecr=7032188
  264 1.299292844  10.6.15.144 → 192.168.1.16 SSH 1514 Server: Encrypted packet (len=1448)
  265 1.299515728  10.6.15.144 → 192.168.1.16 SSH 1514 Server: Encrypted packet (len=1448)
  266 1.299522515 192.168.1.16 → 10.6.15.144  TCP 66 58518 → 22 [ACK] Seq=8865 Ack=161253 Win=2263 Len=0 TSval=7581904 TSecr=7032188
  267 1.299715599  10.6.15.144 → 192.168.1.16 SSH 1514 Server: Encrypted packet (len=1448)
  268 1.299934378  10.6.15.144 → 192.168.1.16 SSH 1514 Server: Encrypted packet (len=1448)
  269 1.299939011 192.168.1.16 → 10.6.15.144  TCP 66 58518 → 22 [ACK] Seq=8865 Ack=164149 Win=2263 Len=0 TSval=7581905 TSecr=7032188
  270 1.300140299  10.6.15.144 → 192.168.1.16 SSH 1514 Server: Encrypted packet (len=1448)
  271 1.300364024  10.6.15.144 → 192.168.1.16 SSH 1514 Server: Encrypted packet (len=1448)
  272 1.300368429 192.168.1.16 → 10.6.15.144  TCP 66 58518 → 22 [ACK] Seq=8865 Ack=167045 Win=2263 Len=0 TSval=7581905 TSecr=7032188
  273 1.300568763  10.6.15.144 → 192.168.1.16 SSH 1514 Server: Encrypted packet (len=1448)
  274 1.302094074  10.6.15.144 → 192.168.1.16 SSH 1514 Server: Encrypted packet (len=1448)
  275 1.302104604 192.168.1.16 → 10.6.15.144  TCP 66 58518 → 22 [ACK] Seq=8865 Ack=169941 Win=2263 Len=0 TSval=7581905 TSecr=7032189
  276 1.321643770  10.6.15.144 → 192.168.1.16 SSH 1514 Server: Encrypted packet (len=1448)
  277 1.321852107  10.6.15.144 → 192.168.1.16 SSH 1514 Server: Encrypted packet (len=1448)
  278 1.321860426 192.168.1.16 → 10.6.15.144  TCP 66 58518 → 22 [ACK] Seq=8865 Ack=172837 Win=2263 Len=0 TSval=7581910 TSecr=7032191
  279 1.322059756  10.6.15.144 → 192.168.1.16 SSH 1514 Server: Encrypted packet (len=1448)
  280 1.322276180  10.6.15.144 → 192.168.1.16 SSH 1514 Server: Encrypted packet (len=1448)
  281 1.322281155 192.168.1.16 → 10.6.15.144  TCP 66 58518 → 22 [ACK] Seq=8865 Ack=175733 Win=2263 Len=0 TSval=7581910 TSecr=7032191
  282 1.322476883  10.6.15.144 → 192.168.1.16 SSH 1514 Server: Encrypted packet (len=1448)
  283 1.322690678  10.6.15.144 → 192.168.1.16 SSH 1514 Server: Encrypted packet (len=1448)
  284 1.322695210 192.168.1.16 → 10.6.15.144  TCP 66 58518 → 22 [ACK] Seq=8865 Ack=178629 Win=2263 Len=0 TSval=7581910 TSecr=7032191
  285 1.322902650  10.6.15.144 → 192.168.1.16 SSH 1514 Server: Encrypted packet (len=1448)
  286 1.323114943  10.6.15.144 → 192.168.1.16 SSH 1514 Server: Encrypted packet (len=1448)
  287 1.323118097 192.168.1.16 → 10.6.15.144  TCP 66 58518 → 22 [ACK] Seq=8865 Ack=181525 Win=2263 Len=0 TSval=7581910 TSecr=7032191
  288 1.323148945  10.6.15.144 → 192.168.1.16 SSH 382 Server: Encrypted packet (len=316)
  289 1.323662724  10.6.15.144 → 192.168.1.16 TCP 382 [TCP Retransmission] 22 → 58518 [PSH, ACK] Seq=181525 Ack=8865 Win=1452 Len=316 TSval=7032195 TSecr=7581905
  290 1.323671613 192.168.1.16 → 10.6.15.144  TCP 78 58518 → 22 [ACK] Seq=8865 Ack=181841 Win=2263 Len=0 TSval=7581910 TSecr=7032195 SLE=181525 SRE=181841
  291 1.335198504 192.168.1.16 → 10.6.15.144  SSH 102 Client: Encrypted packet (len=36)
  292 1.335392313 192.168.1.16 → 10.6.15.144  SSH 138 Client: Encrypted packet (len=72)
  293 1.336127330 192.168.1.16 → 10.6.15.144  SSH 210 Client: Encrypted packet (len=144)
  294 1.336323969 192.168.1.16 → 10.6.15.144  SSH 138 Client: Encrypted packet (len=72)
  295 1.346169954  10.6.15.144 → 192.168.1.16 TCP 66 22 → 58518 [ACK] Seq=181841 Ack=8973 Win=1452 Len=0 TSval=7032201 TSecr=7581913
  296 1.346189523 192.168.1.16 → 10.6.15.144  SSH 726 Client: Encrypted packet (len=660)
  297 1.346201575  10.6.15.144 → 192.168.1.16 TCP 66 22 → 58518 [ACK] Seq=181841 Ack=9189 Win=1452 Len=0 TSval=7032201 TSecr=7581914
  298 1.386838091  10.6.15.144 → 192.168.1.16 TCP 66 22 → 58518 [ACK] Seq=181841 Ack=9849 Win=1452 Len=0 TSval=7032212 TSecr=7581916
  299 1.483482128  10.6.15.144 → 192.168.1.16 SSH 470 Server: Encrypted packet (len=404)
  300 1.483499629  10.6.15.144 → 192.168.1.16 SSH 102 Server: Encrypted packet (len=36)
  301 1.483537634 192.168.1.16 → 10.6.15.144  TCP 66 58518 → 22 [ACK] Seq=9849 Ack=182281 Win=2263 Len=0 TSval=7581950 TSecr=7032236
  302 1.483838451 192.168.1.16 → 10.6.15.144  SSH 138 Client: Encrypted packet (len=72)
  303 1.484678539  10.6.15.144 → 192.168.1.16 SSH 182 Server: Encrypted packet (len=116)
  304 1.485561276  10.6.15.144 → 192.168.1.16 TCP 66 22 → 58518 [ACK] Seq=182397 Ack=9921 Win=1452 Len=0 TSval=7032236 TSecr=7581950
  305 1.487850514 192.168.1.16 → 10.6.15.144  SSH 138 Client: Encrypted packet (len=72)
  306 1.489752109  10.6.15.144 → 192.168.1.16 TCP 66 22 → 58518 [ACK] Seq=182397 Ack=9993 Win=1452 Len=0 TSval=7032237 TSecr=7581951
  307 1.489767442  10.6.15.144 → 192.168.1.16 SSH 102 Server: Encrypted packet (len=36)
  308 1.509681383 192.168.1.16 → 239.255.255.250 SSDP 213 M-SEARCH * HTTP/1.1 
  309 1.527794734  10.6.15.144 → 192.168.1.16 SSH 214 Server: Encrypted packet (len=148)
  310 1.527820825 192.168.1.16 → 10.6.15.144  TCP 66 58518 → 22 [ACK] Seq=9993 Ack=182581 Win=2263 Len=0 TSval=7581961 TSecr=7032237
  311 1.585762516  10.6.15.144 → 192.168.1.16 SSH 102 Server: Encrypted packet (len=36)
  312 1.586685088  10.6.15.144 → 192.168.1.16 SSH 102 Server: Encrypted packet (len=36)
  313 1.586735675 192.168.1.16 → 10.6.15.144  TCP 66 58518 → 22 [ACK] Seq=9993 Ack=182653 Win=2263 Len=0 TSval=7581976 TSecr=7032261
  314 1.591034539  10.6.15.144 → 192.168.1.16 SSH 102 Server: Encrypted packet (len=36)
  315 1.612966169  10.6.15.144 → 192.168.1.16 SSH 138 Server: Encrypted packet (len=72)
  316 1.613031157 192.168.1.16 → 10.6.15.144  TCP 66 58518 → 22 [ACK] Seq=9993 Ack=182761 Win=2263 Len=0 TSval=7581983 TSecr=7032262
  317 1.613223671 192.168.1.16 → 10.6.15.144  SSH 102 Client: Encrypted packet (len=36)
  318 1.620743402  10.6.15.144 → 192.168.1.16 SSH 138 Server: Encrypted packet (len=72)
  319 1.620999189 192.168.1.16 → 10.6.15.144  SSH 102 Client: Encrypted packet (len=36)
  320 1.658875479  10.6.15.144 → 192.168.1.16 TCP 66 22 → 58518 [ACK] Seq=182833 Ack=10065 Win=1452 Len=0 TSval=7032280 TSecr=7581985
  321 1.697856292  10.6.15.144 → 192.168.1.16 SSH 138 Server: Encrypted packet (len=72)
  322 1.697994353  10.6.15.144 → 192.168.1.16 SSH 102 Server: Encrypted packet (len=36)
  323 1.698010361  10.6.15.144 → 192.168.1.16 SSH 102 Server: Encrypted packet (len=36)
  324 1.698036291 192.168.1.16 → 10.6.15.144  TCP 66 58518 → 22 [ACK] Seq=10065 Ack=182977 Win=2263 Len=0 TSval=7582004 TSecr=7032289
  325 1.698208638 192.168.1.16 → 10.6.15.144  SSH 206 Client: Encrypted packet (len=140)
  326 1.699020679 192.168.1.16 → 10.6.15.144  SSH 374 Client: Encrypted packet (len=308)
  327 1.701240799  10.6.15.144 → 192.168.1.16 TCP 66 22 → 58518 [ACK] Seq=182977 Ack=10205 Win=1452 Len=0 TSval=7032290 TSecr=7582004
  328 1.701368831  10.6.15.144 → 192.168.1.16 TCP 66 22 → 58518 [ACK] Seq=182977 Ack=10513 Win=1452 Len=0 TSval=7032290 TSecr=7582004
  329 1.709337026 192.168.1.16 → 10.6.15.144  SSH 102 Client: Encrypted packet (len=36)
  330 1.710600204  10.6.15.144 → 192.168.1.16 SSH 210 Server: Encrypted packet (len=144)
  331 1.710911044 192.168.1.16 → 10.6.15.144  SSH 138 Client: Encrypted packet (len=72)
  332 1.711388085  10.6.15.144 → 192.168.1.16 SSH 138 Server: Encrypted packet (len=72)
  333 1.711526302 192.168.1.16 → 10.6.15.144  SSH 102 Client: Encrypted packet (len=36)
  334 1.712504930  10.6.15.144 → 192.168.1.16 TCP 66 22 → 58518 [ACK] Seq=183193 Ack=10621 Win=1452 Len=0 TSval=7032293 TSecr=7582007
  335 1.717252246  10.6.15.144 → 192.168.1.16 SSH 138 Server: Encrypted packet (len=72)
  336 1.717393018  10.6.15.144 → 192.168.1.16 SSH 138 Server: Encrypted packet (len=72)
  337 1.717504104 192.168.1.16 → 10.6.15.144  TCP 66 58518 → 22 [ACK] Seq=10657 Ack=183337 Win=2263 Len=0 TSval=7582009 TSecr=7032294
  338 1.717522318 192.168.1.16 → 10.6.15.144  SSH 102 Client: Encrypted packet (len=36)
  339 1.717725873 192.168.1.16 → 10.6.15.144  SSH 102 Client: Encrypted packet (len=36)
  340 1.719631160  10.6.15.144 → 192.168.1.16 TCP 66 22 → 58518 [ACK] Seq=183337 Ack=10729 Win=1452 Len=0 TSval=7032295 TSecr=7582009
  341 1.720615974  10.6.15.144 → 192.168.1.16 SSH 210 Server: Encrypted packet (len=144)
  342 1.720636239  10.6.15.144 → 192.168.1.16 SSH 138 Server: Encrypted packet (len=72)
  343 1.720666190 192.168.1.16 → 10.6.15.144  TCP 66 58518 → 22 [ACK] Seq=10729 Ack=183553 Win=2263 Len=0 TSval=7582010 TSecr=7032295
  344 1.720974292 192.168.1.16 → 10.6.15.144  SSH 174 Client: Encrypted packet (len=108)
  345 1.721660217  10.6.15.144 → 192.168.1.16 SSH 138 Server: Encrypted packet (len=72)
  346 1.721796188 192.168.1.16 → 10.6.15.144  SSH 102 Client: Encrypted packet (len=36)
  347 1.723671949  10.6.15.144 → 192.168.1.16 TCP 66 22 → 58518 [ACK] Seq=183625 Ack=10873 Win=1452 Len=0 TSval=7032296 TSecr=7582010
  348 1.742687762  10.6.15.144 → 192.168.1.16 SSH 102 Server: Encrypted packet (len=36)
  349 1.744927443  10.6.15.144 → 192.168.1.16 SSH 102 Server: Encrypted packet (len=36)
  350 1.745001092 192.168.1.16 → 10.6.15.144  TCP 66 58518 → 22 [ACK] Seq=10873 Ack=183697 Win=2263 Len=0 TSval=7582016 TSecr=7032300
  351 1.746038795  10.6.15.144 → 192.168.1.16 SSH 102 Server: Encrypted packet (len=36)
  352 1.787943396 192.168.1.16 → 10.6.15.144  TCP 66 58518 → 22 [ACK] Seq=10873 Ack=183733 Win=2263 Len=0 TSval=7582027 TSecr=7032301
  353 1.976874091 192.168.1.16 → 10.6.15.144  SSH 102 Client: Encrypted packet (len=36)
  354 1.978755807 192.168.1.16 → 10.6.15.144  SSH 102 Client: Encrypted packet (len=36)
  355 1.984333287 192.168.1.16 → 10.6.15.144  SSH 210 Client: Encrypted packet (len=144)
  356 1.994622690  10.6.15.144 → 192.168.1.16 SSH 1366 Server: Encrypted packet (len=1300)
  357 1.994653761 192.168.1.16 → 10.6.15.144  TCP 66 58518 → 22 [ACK] Seq=11089 Ack=185033 Win=2263 Len=0 TSval=7582078 TSecr=7032343
  358 1.994940391  10.6.15.144 → 192.168.1.16 SSH 1514 Server: Encrypted packet (len=1448)
  359 1.994952325 192.168.1.16 → 10.6.15.144  TCP 66 58518 → 22 [ACK] Seq=11089 Ack=186481 Win=2263 Len=0 TSval=7582078 TSecr=7032343
  360 1.994961675  10.6.15.144 → 192.168.1.16 SSH 194 Server: Encrypted packet (len=128)
  361 1.994964844 192.168.1.16 → 10.6.15.144  TCP 66 58518 → 22 [ACK] Seq=11089 Ack=186609 Win=2263 Len=0 TSval=7582078 TSecr=7032343
  362 1.994970883  10.6.15.144 → 192.168.1.16 SSH 150 Server: Encrypted packet (len=84)
  363 1.994973401 192.168.1.16 → 10.6.15.144  TCP 66 58518 → 22 [ACK] Seq=11089 Ack=186693 Win=2263 Len=0 TSval=7582078 TSecr=7032343
  364 1.995062658  10.6.15.144 → 192.168.1.16 SSH 742 Server: Encrypted packet (len=676)
  365 1.995066727 192.168.1.16 → 10.6.15.144  TCP 66 58518 → 22 [ACK] Seq=11089 Ack=187369 Win=2263 Len=0 TSval=7582078 TSecr=7032343
  366 1.995211652  10.6.15.144 → 192.168.1.16 SSH 1086 Server: Encrypted packet (len=1020)
  367 1.995217657 192.168.1.16 → 10.6.15.144  TCP 66 58518 → 22 [ACK] Seq=11089 Ack=188389 Win=2263 Len=0 TSval=7582078 TSecr=7032344
  368 1.995256130  10.6.15.144 → 192.168.1.16 SSH 454 Server: Encrypted packet (len=388)
  369 1.995260529 192.168.1.16 → 10.6.15.144  TCP 66 58518 → 22 [ACK] Seq=11089 Ack=188777 Win=2263 Len=0 TSval=7582078 TSecr=7032344
  370 1.995447438  10.6.15.144 → 192.168.1.16 SSH 1314 Server: Encrypted packet (len=1248)
  371 1.995454294 192.168.1.16 → 10.6.15.144  TCP 66 58518 → 22 [ACK] Seq=11089 Ack=190025 Win=2263 Len=0 TSval=7582078 TSecr=7032352
  372 1.996484461 192.168.1.16 → 10.6.15.144  SSH 206 Client: Encrypted packet (len=140)
  373 1.997531718 192.168.1.16 → 10.6.15.144  SSH 206 Client: Encrypted packet (len=140)
  374 1.998663130 192.168.1.16 → 10.6.15.144  SSH 206 Client: Encrypted packet (len=140)
  375 2.011603230  10.6.15.144 → 192.168.1.16 SSH 1314 Server: [TCP Spurious Retransmission] , Encrypted packet (len=1248)
  376 2.011628618 192.168.1.16 → 10.6.15.144  SSH 218 Client: Encrypted packet (len=140)
  377 2.016244917  10.6.15.144 → 192.168.1.16 TCP 78 [TCP Dup ACK 375#1] 22 → 58518 [ACK] Seq=190025 Ack=10909 Win=1452 Len=0 TSval=7032369 TSecr=7582074 SLE=10945 SRE=11089
  378 2.016258944  10.6.15.144 → 192.168.1.16 TCP 78 [TCP Dup ACK 375#2] 22 → 58518 [ACK] Seq=190025 Ack=10909 Win=1452 Len=0 TSval=7032369 TSecr=7582074 SLE=10945 SRE=11229
  379 2.016275411  10.6.15.144 → 192.168.1.16 TCP 78 [TCP Dup ACK 375#3] 22 → 58518 [ACK] Seq=190025 Ack=10909 Win=1452 Len=0 TSval=7032369 TSecr=7582074 SLE=10945 SRE=11369
  380 2.016284618 192.168.1.16 → 10.6.15.144  SSH 102 Client: [TCP Fast Retransmission] , Encrypted packet (len=36)
  381 2.016443374  10.6.15.144 → 192.168.1.16 TCP 78 [TCP Dup ACK 375#4] 22 → 58518 [ACK] Seq=190025 Ack=10909 Win=1452 Len=0 TSval=7032369 TSecr=7582074 SLE=10945 SRE=11509
  382 2.016463865  10.6.15.144 → 192.168.1.16 TCP 78 [TCP Dup ACK 375#5] 22 → 58518 [ACK] Seq=190025 Ack=10909 Win=1452 Len=0 TSval=7032369 TSecr=7582074 SLE=10945 SRE=11649
  383 2.024011533  10.6.15.144 → 192.168.1.16 TCP 66 22 → 58518 [ACK] Seq=190025 Ack=11649 Win=1447 Len=0 TSval=7032369 TSecr=7582084
  384 2.031338620 192.168.1.16 → 10.6.15.144  SSH 102 Client: Encrypted packet (len=36)
  385 2.033159610 192.168.1.16 → 10.6.15.144  SSH 102 Client: Encrypted packet (len=36)
  386 2.035163325  10.6.15.144 → 192.168.1.16 TCP 66 22 → 58518 [ACK] Seq=190025 Ack=11685 Win=1452 Len=0 TSval=7032373 TSecr=7582087
  387 2.035175403 192.168.1.16 → 10.6.15.144  SSH 174 Client: Encrypted packet (len=108)
  388 2.036507640 192.168.1.16 → 10.6.15.144  SSH 102 Client: Encrypted packet (len=36)
  389 2.037234146  10.6.15.144 → 192.168.1.16 TCP 66 22 → 58518 [ACK] Seq=190025 Ack=11721 Win=1452 Len=0 TSval=7032374 TSecr=7582088
  390 2.037255216  10.6.15.144 → 192.168.1.16 SSH 138 Server: Encrypted packet (len=72)
  391 2.037481243 192.168.1.16 → 10.6.15.144  SSH 102 Client: Encrypted packet (len=36)
  392 2.039132858  10.6.15.144 → 192.168.1.16 TCP 66 22 → 58518 [ACK] Seq=190097 Ack=11865 Win=1452 Len=0 TSval=7032374 TSecr=7582088
  393 2.055041785  10.6.15.144 → 192.168.1.16 SSH 110 Server: Encrypted packet (len=44)
  394 2.055382504 192.168.1.16 → 10.6.15.144  SSH 222 Client: Encrypted packet (len=156)
  395 2.074491384  10.6.15.144 → 192.168.1.16 SSH 270 Server: Encrypted packet (len=204)
  396 2.078367389  10.6.15.144 → 192.168.1.16 SSH 102 Server: Encrypted packet (len=36)
  397 2.078433198 192.168.1.16 → 10.6.15.144  TCP 66 58518 → 22 [ACK] Seq=12057 Ack=190381 Win=2263 Len=0 TSval=7582099 TSecr=7032383
  398 2.078794609 192.168.1.16 → 10.6.15.144  SSH 174 Client: Encrypted packet (len=108)
  399 2.122940151  10.6.15.144 → 192.168.1.16 TCP 66 22 → 58518 [ACK] Seq=190381 Ack=12165 Win=1452 Len=0 TSval=7032396 TSecr=7582099
  400 2.188289321  10.6.15.144 → 192.168.1.16 SSH 138 Server: Encrypted packet (len=72)
  401 2.188468980 192.168.1.16 → 10.6.15.144  SSH 102 Client: Encrypted packet (len=36)
  402 2.189748428  10.6.15.144 → 192.168.1.16 TCP 66 22 → 58518 [ACK] Seq=190453 Ack=12201 Win=1452 Len=0 TSval=7032412 TSecr=7582127
  403 2.234505786  10.6.15.144 → 192.168.1.16 SSH 150 Server: Encrypted packet (len=84)
  404 2.235595257  10.6.15.144 → 192.168.1.16 SSH 142 Server: Encrypted packet (len=76)
  405 2.235667577 192.168.1.16 → 10.6.15.144  TCP 66 58518 → 22 [ACK] Seq=12201 Ack=190613 Win=2263 Len=0 TSval=7582138 TSecr=7032423
  406 2.236666445  10.6.15.144 → 192.168.1.16 SSH 290 Server: Encrypted packet (len=224)
  407 2.236927693 192.168.1.16 → 10.6.15.144  SSH 102 Client: Encrypted packet (len=36)
  408 2.240381609  10.6.15.144 → 192.168.1.16 TCP 66 22 → 58518 [ACK] Seq=190837 Ack=12237 Win=1452 Len=0 TSval=7032425 TSecr=7582139
  409 2.260474640 192.168.1.16 → 10.6.15.144  SSH 102 Client: Encrypted packet (len=36)
  410 2.261226136 192.168.1.16 → 10.6.15.144  SSH 110 Client: Encrypted packet (len=44)
  411 2.262356946  10.6.15.144 → 192.168.1.16 TCP 66 22 → 58518 [ACK] Seq=190837 Ack=12273 Win=1452 Len=0 TSval=7032430 TSecr=7582145
  412 2.263191999  10.6.15.144 → 192.168.1.16 TCP 66 22 → 58518 [ACK] Seq=190837 Ack=12317 Win=1452 Len=0 TSval=7032431 TSecr=7582145
  413 2.278656655  10.6.15.144 → 192.168.1.16 SSH 138 Server: Encrypted packet (len=72)
  414 2.278884726 192.168.1.16 → 10.6.15.144  SSH 102 Client: Encrypted packet (len=36)
  415 2.291860696 192.168.1.16 → 10.6.15.144  SSH 598 Client: Encrypted packet (len=532)
  416 2.293558203  10.6.15.144 → 192.168.1.16 TCP 66 22 → 58518 [ACK] Seq=190909 Ack=12885 Win=1452 Len=0 TSval=7032438 TSecr=7582149
  417 2.295586039  10.6.15.144 → 192.168.1.16 SSH 302 Server: Encrypted packet (len=236)
  418 2.297460455 192.168.1.16 → 10.6.15.144  SSH 142 Client: Encrypted packet (len=76)
  419 2.300357676  10.6.15.144 → 192.168.1.16 SSH 138 Server: Encrypted packet (len=72)
  420 2.300559318 192.168.1.16 → 10.6.15.144  SSH 102 Client: Encrypted packet (len=36)
  421 2.302056355  10.6.15.144 → 192.168.1.16 SSH 138 Server: Encrypted packet (len=72)
  422 2.302215649 192.168.1.16 → 10.6.15.144  SSH 102 Client: Encrypted packet (len=36)
  423 2.342878883  10.6.15.144 → 192.168.1.16 TCP 66 22 → 58518 [ACK] Seq=191289 Ack=13033 Win=1452 Len=0 TSval=7032451 TSecr=7582155
  424 2.386493530  10.6.15.144 → 192.168.1.16 SSH 102 Server: Encrypted packet (len=36)
  425 2.386885553 192.168.1.16 → 10.6.15.144  SSH 158 Client: Encrypted packet (len=92)
  426 2.388285187  10.6.15.144 → 192.168.1.16 TCP 66 22 → 58518 [ACK] Seq=191325 Ack=13125 Win=1452 Len=0 TSval=7032462 TSecr=7582176
  427 2.393021767  10.6.15.144 → 192.168.1.16 SSH 102 Server: Encrypted packet (len=36)
  428 2.393504755 192.168.1.16 → 10.6.15.144  SSH 134 Client: Encrypted packet (len=68)
  429 2.399606718  10.6.15.144 → 192.168.1.16 SSH 102 Server: Encrypted packet (len=36)
  430 2.400032478 192.168.1.16 → 10.6.15.144  SSH 214 Client: Encrypted packet (len=148)
  431 2.410224883  10.6.15.144 → 192.168.1.16 SSH 102 Server: Encrypted packet (len=36)
  432 2.410572776 192.168.1.16 → 10.6.15.144  SSH 166 Client: Encrypted packet (len=100)
  433 2.412402778 23.99.92.253 → 192.168.1.16 TCP 54 443 → 51182 [RST, ACK] Seq=1 Ack=1 Win=0 Len=0
  434 2.414168708  10.6.15.144 → 192.168.1.16 SSH 102 Server: Encrypted packet (len=36)
  435 2.414517959 192.168.1.16 → 10.6.15.144  SSH 182 Client: Encrypted packet (len=116)
  436 2.416278514 23.99.92.253 → 192.168.1.16 TCP 54 443 → 51170 [RST, ACK] Seq=1 Ack=1 Win=0 Len=0
  437 2.454905054  10.6.15.144 → 192.168.1.16 TCP 66 22 → 58518 [ACK] Seq=191469 Ack=13557 Win=1452 Len=0 TSval=7032479 TSecr=7582183
  438 2.481501885  10.6.15.144 → 192.168.1.16 SSH 534 Server: Encrypted packet (len=468)
  439 2.481524534  10.6.15.144 → 192.168.1.16 SSH 102 Server: Encrypted packet (len=36)
  440 2.481578121 192.168.1.16 → 10.6.15.144  TCP 66 58518 → 22 [ACK] Seq=13557 Ack=191973 Win=2263 Len=0 TSval=7582200 TSecr=7032485
  441 2.483135057 192.168.1.16 → 10.6.15.144  SSH 138 Client: Encrypted packet (len=72)
  442 2.484517729  10.6.15.144 → 192.168.1.16 TCP 66 22 → 58518 [ACK] Seq=191973 Ack=13629 Win=1452 Len=0 TSval=7032486 TSecr=7582200
  443 2.484532367  10.6.15.144 → 192.168.1.16 SSH 102 Server: Encrypted packet (len=36)
  444 2.510400005 192.168.1.16 → 239.255.255.250 SSDP 213 M-SEARCH * HTTP/1.1 
  445 2.511941761 192.168.1.16 → 52.216.131.141 TCP 82 47568 → 443 [ACK] Seq=1 Ack=1 Win=6152 Len=0 SLE=513 SRE=82433 SLE=94721 SRE=97793 SLE=85505 SRE=86529
  446 2.527958101 192.168.1.16 → 10.6.15.144  TCP 66 58518 → 22 [ACK] Seq=13629 Ack=192009 Win=2263 Len=0 TSval=7582212 TSecr=7032486
  447 2.654072749  10.6.15.144 → 192.168.1.16 SSH 102 Server: Encrypted packet (len=36)
  448 2.654153735 192.168.1.16 → 10.6.15.144  TCP 66 58518 → 22 [ACK] Seq=13629 Ack=192045 Win=2263 Len=0 TSval=7582243 TSecr=7032524
  449 2.654484138 192.168.1.16 → 10.6.15.144  SSH 406 Client: Encrypted packet (len=340)
  450 2.658939246  10.6.15.144 → 192.168.1.16 SSH 102 Server: [TCP Spurious Retransmission] , Encrypted packet (len=36)
  451 2.658960560 192.168.1.16 → 10.6.15.144  TCP 78 [TCP Dup ACK 448#1] 58518 → 22 [ACK] Seq=13969 Ack=192045 Win=2263 Len=0 TSval=7582244 TSecr=7032530 SLE=192009 SRE=192045
  452 2.714900216  10.6.15.144 → 192.168.1.16 TCP 66 22 → 58518 [ACK] Seq=192045 Ack=13969 Win=1452 Len=0 TSval=7032544 TSecr=7582243
  453 2.726238418 52.216.131.141 → 192.168.1.16 TCP 60 [TCP ACKed unseen segment] 443 → 47568 [ACK] Seq=97793 Ack=2 Win=66 Len=0
  454 2.755656034  10.6.15.144 → 192.168.1.16 SSH 138 Server: Encrypted packet (len=72)
  455 2.755684787 192.168.1.16 → 10.6.15.144  TCP 66 58518 → 22 [ACK] Seq=13969 Ack=192117 Win=2263 Len=0 TSval=7582268 TSecr=7032554
  456 2.755855285 192.168.1.16 → 10.6.15.144  SSH 102 Client: Encrypted packet (len=36)
  457 2.756205799 192.168.1.16 → 10.6.15.144  SSH 102 Client: Encrypted packet (len=36)
  458 2.756527400  10.6.15.144 → 192.168.1.16 SSH 198 Server: Encrypted packet (len=132)
  459 2.757270083  10.6.15.144 → 192.168.1.16 SSH 1514 Server: Encrypted packet (len=1448)
  460 2.757281534 192.168.1.16 → 10.6.15.144  TCP 66 58518 → 22 [ACK] Seq=14041 Ack=193697 Win=2263 Len=0 TSval=7582269 TSecr=7032554
  461 2.757342988  10.6.15.144 → 192.168.1.16 SSH 822 Server: Encrypted packet (len=756)
  462 2.757497058  10.6.15.144 → 192.168.1.16 SSH 102 Server: Encrypted packet (len=36)
  463 2.757507442  10.6.15.144 → 192.168.1.16 TCP 66 22 → 58518 [ACK] Seq=194489 Ack=14005 Win=1452 Len=0 TSval=7032554 TSecr=7582268
  464 2.757522717  10.6.15.144 → 192.168.1.16 TCP 66 22 → 58518 [ACK] Seq=194489 Ack=14041 Win=1452 Len=0 TSval=7032554 TSecr=7582269
  465 2.757546271 192.168.1.16 → 10.6.15.144  TCP 66 58518 → 22 [ACK] Seq=14041 Ack=194489 Win=2263 Len=0 TSval=7582269 TSecr=7032554
  466 2.757810398 192.168.1.16 → 10.6.15.144  SSH 138 Client: Encrypted packet (len=72)
  467 2.761894967  10.6.15.144 → 192.168.1.16 TCP 66 22 → 58518 [ACK] Seq=194489 Ack=14113 Win=1452 Len=0 TSval=7032555 TSecr=7582269
  468 2.761911105  10.6.15.144 → 192.168.1.16 SSH 102 Server: Encrypted packet (len=36)
  469 2.764706909  10.6.15.144 → 192.168.1.16 SSH 150 Server: Encrypted packet (len=84)
  470 2.764733758  10.6.15.144 → 192.168.1.16 SSH 302 Server: Encrypted packet (len=236)
  471 2.764746528  10.6.15.144 → 192.168.1.16 SSH 102 Server: Encrypted packet (len=36)
  472 2.764788076 192.168.1.16 → 10.6.15.144  TCP 66 58518 → 22 [ACK] Seq=14113 Ack=194881 Win=2263 Len=0 TSval=7582271 TSecr=7032555
  473 2.766316291 192.168.1.16 → 10.6.15.144  SSH 138 Client: Encrypted packet (len=72)
  474 2.769183348  10.6.15.144 → 192.168.1.16 SSH 102 Server: Encrypted packet (len=36)
  475 2.790295799  10.6.15.144 → 192.168.1.16 SSH 254 Server: Encrypted packet (len=188)
  476 2.790361595 192.168.1.16 → 10.6.15.144  TCP 66 58518 → 22 [ACK] Seq=14185 Ack=195105 Win=2263 Len=0 TSval=7582277 TSecr=7032557
  477 2.793036549  10.6.15.144 → 192.168.1.16 SSH 182 Server: Encrypted packet (len=116)
  478 2.799213846  10.6.15.144 → 192.168.1.16 SSH 198 Server: Encrypted packet (len=132)
  479 2.799275094 192.168.1.16 → 10.6.15.144  TCP 66 58518 → 22 [ACK] Seq=14185 Ack=195353 Win=2263 Len=0 TSval=7582279 TSecr=7032563
  480 2.815183955 192.168.1.16 → 10.6.15.144  SSH 182 Client: Encrypted packet (len=116)
  481 2.858870912  10.6.15.144 → 192.168.1.16 TCP 66 22 → 58518 [ACK] Seq=195353 Ack=14301 Win=1452 Len=0 TSval=7032580 TSecr=7582283
  482 3.509864712 192.168.1.16 → 224.0.0.251  MDNS 82 Standard query 0x0000 PTR _googlecast._tcp.local, "QM" question
  483 3.510635318 fe80::820e:b87b:de2a:4286 → ff02::fb     MDNS 102 Standard query 0x0000 PTR _googlecast._tcp.local, "QM" question
  484 3.510640924 192.168.1.16 → 224.0.0.251  MDNS 82 Standard query 0x0000 PTR _googlecast._tcp.local, "QM" question
  485 3.510642802 fe80::820e:b87b:de2a:4286 → ff02::fb     MDNS 102 Standard query 0x0000 PTR _googlecast._tcp.local, "QM" question
  486 3.511043112 192.168.1.16 → 239.255.255.250 SSDP 213 M-SEARCH * HTTP/1.1 
  487 3.512399437  10.6.15.144 → 192.168.1.16 SSH 1514 Server: Encrypted packet (len=1448)
  488 3.512498730  10.6.15.144 → 192.168.1.16 SSH 926 Server: Encrypted packet (len=860)
  489 3.512508721 192.168.1.16 → 10.6.15.144  TCP 66 58518 → 22 [ACK] Seq=14301 Ack=197661 Win=2263 Len=0 TSval=7582458 TSecr=7032628
  490 3.512617501  10.6.15.144 → 192.168.1.16 SSH 926 Server: [TCP Spurious Retransmission] , Encrypted packet (len=860)
  491 3.512625549 192.168.1.16 → 10.6.15.144  TCP 78 [TCP Dup ACK 489#1] 58518 → 22 [ACK] Seq=14301 Ack=197661 Win=2263 Len=0 TSval=7582458 TSecr=7032634 SLE=196801 SRE=197661
  492 3.512775841  10.6.15.144 → 192.168.1.16 SSH 102 Server: Encrypted packet (len=36)
  493 3.512782994 192.168.1.16 → 10.6.15.144  TCP 66 58518 → 22 [ACK] Seq=14301 Ack=197697 Win=2263 Len=0 TSval=7582458 TSecr=7032646
  494 3.512801815  10.6.15.144 → 192.168.1.16 SSH 190 Server: Encrypted packet (len=124)
  495 3.512806827 192.168.1.16 → 10.6.15.144  TCP 66 58518 → 22 [ACK] Seq=14301 Ack=197821 Win=2263 Len=0 TSval=7582458 TSecr=7032664
  496 3.513027498  10.6.15.144 → 192.168.1.16 TCP 1514 [TCP Out-Of-Order] 22 → 58518 [ACK] Seq=195353 Ack=14301 Win=1452 Len=1448 TSval=7032723 TSecr=7582283
  497 3.513032224 192.168.1.16 → 10.6.15.144  TCP 78 [TCP Dup ACK 495#1] 58518 → 22 [ACK] Seq=14301 Ack=197821 Win=2263 Len=0 TSval=7582458 TSecr=7032664 SLE=195353 SRE=196801
  498 3.513579540 192.168.1.16 → 10.6.15.144  SSH 206 Client: Encrypted packet (len=140)
  499 3.514052059 192.168.1.16 → 10.6.15.144  SSH 158 Client: Encrypted packet (len=92)
  500 3.519394383  10.6.15.144 → 192.168.1.16 TCP 66 22 → 58518 [ACK] Seq=197821 Ack=14441 Win=1452 Len=0 TSval=7032744 TSecr=7582458
  501 3.519415495  10.6.15.144 → 192.168.1.16 TCP 66 22 → 58518 [ACK] Seq=197821 Ack=14533 Win=1452 Len=0 TSval=7032744 TSecr=7582458
  502 3.532294559 192.168.1.16 → 10.6.15.144  SSH 102 Client: Encrypted packet (len=36)
  503 3.533090664 192.168.1.16 → 10.6.15.144  SSH 102 Client: Encrypted packet (len=36)
  504 3.533558873  10.6.15.144 → 192.168.1.16 TCP 66 22 → 58518 [ACK] Seq=197821 Ack=14569 Win=1452 Len=0 TSval=7032748 TSecr=7582463
  505 3.534264859  10.6.15.144 → 192.168.1.16 TCP 66 22 → 58518 [ACK] Seq=197821 Ack=14605 Win=1452 Len=0 TSval=7032748 TSecr=7582463
  506 3.876479175 192.168.1.16 → 10.6.15.144  SSH 518 Client: Encrypted packet (len=452)
  507 3.878659618  10.6.15.144 → 192.168.1.16 SSH 102 Server: Encrypted packet (len=36)
  508 3.879135329 192.168.1.16 → 10.6.15.144  SSH 174 Client: Encrypted packet (len=108)
  509 3.880606221  10.6.15.144 → 192.168.1.16 TCP 66 22 → 58518 [ACK] Seq=197857 Ack=15057 Win=1452 Len=0 TSval=7032835 TSecr=7582549
  510 3.881663793  10.6.15.144 → 192.168.1.16 TCP 66 22 → 58518 [ACK] Seq=197857 Ack=15165 Win=1452 Len=0 TSval=7032835 TSecr=7582549
  511 3.887334125  10.6.15.144 → 192.168.1.16 SSH 366 Server: Encrypted packet (len=300)
  512 3.888484974 192.168.1.16 → 10.6.15.144  SSH 1350 Client: Encrypted packet (len=1284)
  513 3.897733554  10.6.15.144 → 192.168.1.16 SSH 502 Server: Encrypted packet (len=436)
  514 3.898626111 192.168.1.16 → 10.6.15.144  SSH 206 Client: Encrypted packet (len=140)
  515 3.901271706  10.6.15.144 → 192.168.1.16 TCP 66 22 → 58518 [ACK] Seq=198593 Ack=16589 Win=1452 Len=0 TSval=7032840 TSecr=7582552
  516 3.912703206  10.6.15.144 → 192.168.1.16 SSH 102 Server: Encrypted packet (len=36)
  517 3.913262278 192.168.1.16 → 10.6.15.144  SSH 158 Client: Encrypted packet (len=92)
  518 3.925307014 192.168.1.16 → 10.6.15.144  SSH 102 Client: Encrypted packet (len=36)
  519 3.925522377 192.168.1.16 → 10.6.15.144  SSH 102 Client: Encrypted packet (len=36)
  520 3.928989032  10.6.15.144 → 192.168.1.16 TCP 66 22 → 58518 [ACK] Seq=198629 Ack=16717 Win=1452 Len=0 TSval=7032847 TSecr=7582558
  521 3.967675000  10.6.15.144 → 192.168.1.16 TCP 66 22 → 58518 [ACK] Seq=198629 Ack=16753 Win=1452 Len=0 TSval=7032857 TSecr=7582561
  522 4.049259302 10.22.18.159 → 224.0.0.252  LLMNR 64 Standard query 0xba8e A wpad
  523 4.099807060  10.6.15.144 → 192.168.1.16 SSH 502 Server: Encrypted packet (len=436)
  524 4.103779419 192.168.1.16 → 10.6.15.144  SSH 214 Client: Encrypted packet (len=148)
  525 4.104004546 192.168.1.16 → 10.6.15.144  SSH 134 Client: Encrypted packet (len=68)
  526 4.107579854  10.6.15.144 → 192.168.1.16 TCP 66 22 → 58518 [ACK] Seq=199065 Ack=16969 Win=1452 Len=0 TSval=7032892 TSecr=7582605
  527 4.111593297  10.6.15.144 → 192.168.1.16 SSH 142 Server: Encrypted packet (len=76)
  528 4.146037242  10.6.15.144 → 192.168.1.16 SSH 606 Server: Encrypted packet (len=540)
  529 4.146053501 192.168.1.16 → 10.6.15.144  TCP 66 58518 → 22 [ACK] Seq=16969 Ack=199681 Win=2263 Len=0 TSval=7582616 TSecr=7032893
  530 4.146861222 192.168.1.16 → 10.6.15.144  SSH 134 Client: Encrypted packet (len=68)
  531 4.150464309 192.168.1.16 → 10.6.15.144  SSH 102 Client: Encrypted packet (len=36)
  532 4.150667668 192.168.1.16 → 10.6.15.144  SSH 110 Client: Encrypted packet (len=44)
  533 4.151635502  10.6.15.144 → 192.168.1.16 SSH 366 Server: Encrypted packet (len=300)
  534 4.153409560  10.6.15.144 → 192.168.1.16 TCP 66 22 → 58518 [ACK] Seq=199981 Ack=17117 Win=1452 Len=0 TSval=7032903 TSecr=7582617
  535 4.153753243 192.168.1.16 → 10.6.15.144  SSH 926 Client: Encrypted packet (len=860)
  536 4.194783910  10.6.15.144 → 192.168.1.16 TCP 66 22 → 58518 [ACK] Seq=199981 Ack=17977 Win=1452 Len=0 TSval=7032914 TSecr=7582618
  537 4.208322862  10.6.15.144 → 192.168.1.16 SSH 102 Server: Encrypted packet (len=36)
  538 4.251982404 192.168.1.16 → 10.6.15.144  TCP 66 58518 → 22 [ACK] Seq=17977 Ack=200017 Win=2263 Len=0 TSval=7582643 TSecr=7032917
  539 4.271111149  10.6.15.144 → 192.168.1.16 SSH 334 Server: Encrypted packet (len=268)
  540 4.271144681 192.168.1.16 → 10.6.15.144  TCP 66 58518 → 22 [ACK] Seq=17977 Ack=200285 Win=2263 Len=0 TSval=7582647 TSecr=7032933
  541 4.272570845 192.168.1.16 → 10.6.15.144  SSH 1382 Client: Encrypted packet (len=1316)
  542 4.282394098  10.6.15.144 → 192.168.1.16 TCP 66 22 → 58518 [ACK] Seq=200285 Ack=19293 Win=1452 Len=0 TSval=7032935 TSecr=7582648
  543 4.290723017  10.6.15.144 → 192.168.1.16 SSH 814 Server: Encrypted packet (len=748)
  544 4.290745600  10.6.15.144 → 192.168.1.16 SSH 102 Server: Encrypted packet (len=36)
  545 4.290809704 192.168.1.16 → 10.6.15.144  TCP 66 58518 → 22 [ACK] Seq=19293 Ack=201069 Win=2263 Len=0 TSval=7582652 TSecr=7032936
  546 4.292968520 192.168.1.16 → 10.6.15.144  SSH 138 Client: Encrypted packet (len=72)
  547 4.294305021  10.6.15.144 → 192.168.1.16 SSH 102 Server: Encrypted packet (len=36)
  548 4.301692927  10.6.15.144 → 192.168.1.16 SSH 174 Server: Encrypted packet (len=108)
  549 4.301759732 192.168.1.16 → 10.6.15.144  TCP 66 58518 → 22 [ACK] Seq=19365 Ack=201213 Win=2263 Len=0 TSval=7582655 TSecr=7032938
  550 4.310608756  10.6.15.144 → 192.168.1.16 SSH 138 Server: Encrypted packet (len=72)
  551 4.310832890 192.168.1.16 → 10.6.15.144  SSH 102 Client: Encrypted packet (len=36)
  552 4.352930389  10.6.15.144 → 192.168.1.16 TCP 66 22 → 58518 [ACK] Seq=201285 Ack=19401 Win=1452 Len=0 TSval=7032953 TSecr=7582657
  553 4.419025996  10.6.15.144 → 192.168.1.16 SSH 102 Server: Encrypted packet (len=36)
  554 4.419335348 192.168.1.16 → 10.6.15.144  SSH 214 Client: Encrypted packet (len=148)
  555 4.435859404  10.6.15.144 → 192.168.1.16 SSH 190 Server: Encrypted packet (len=124)
  556 4.459714893 10.22.18.159 → 224.0.0.252  LLMNR 64 Standard query 0xba8e A wpad
  557 4.475952989 192.168.1.16 → 10.6.15.144  TCP 66 58518 → 22 [ACK] Seq=19549 Ack=201445 Win=2263 Len=0 TSval=7582699 TSecr=7032971
  558 4.503064912  10.6.15.144 → 192.168.1.16 SSH 190 Server: [TCP Spurious Retransmission] , Encrypted packet (len=124)
  559 4.503084190 192.168.1.16 → 10.6.15.144  TCP 78 [TCP Dup ACK 557#1] 58518 → 22 [ACK] Seq=19549 Ack=201445 Win=2263 Len=0 TSval=7582705 TSecr=7032991 SLE=201321 SRE=201445
  560 4.510991887 192.168.1.16 → 224.0.0.251  MDNS 82 Standard query 0x0000 PTR _googlecast._tcp.local, "QM" question
  561 4.511033788 fe80::820e:b87b:de2a:4286 → ff02::fb     MDNS 102 Standard query 0x0000 PTR _googlecast._tcp.local, "QM" question
  562 4.511078389 192.168.1.16 → 224.0.0.251  MDNS 82 Standard query 0x0000 PTR _googlecast._tcp.local, "QM" question
  563 4.511090157 fe80::820e:b87b:de2a:4286 → ff02::fb     MDNS 102 Standard query 0x0000 PTR _googlecast._tcp.local, "QM" question
  564 4.527242085  10.6.15.144 → 192.168.1.16 SSH 138 Server: Encrypted packet (len=72)
  565 4.527264127 192.168.1.16 → 10.6.15.144  TCP 66 58518 → 22 [ACK] Seq=19549 Ack=201517 Win=2263 Len=0 TSval=7582711 TSecr=7032997
  566 4.527434592 192.168.1.16 → 10.6.15.144  SSH 102 Client: Encrypted packet (len=36)
  567 4.530068128  10.6.15.144 → 192.168.1.16 TCP 78 [TCP Dup ACK 552#1] 22 → 58518 [ACK] Seq=201517 Ack=19401 Win=1452 Len=0 TSval=7032997 TSecr=7582657 SLE=19549 SRE=19585
  568 4.559998045 192.168.1.16 → 50.19.253.241 TCP 66 40316 → 443 [ACK] Seq=1 Ack=1 Win=839 Len=0 TSval=7582720 TSecr=43781451
  569 4.639996452 192.168.1.16 → 10.6.15.144  TCP 214 [TCP Retransmission] 58518 → 22 [PSH, ACK] Seq=19401 Ack=201517 Win=2263 Len=148 TSval=7582740 TSecr=7032997
  570 4.642334247  10.6.15.144 → 192.168.1.16 TCP 66 22 → 58518 [ACK] Seq=201517 Ack=19585 Win=1452 Len=0 TSval=7033025 TSecr=7582740
  571 4.656997436  10.6.15.144 → 192.168.1.16 SSH 870 Server: Encrypted packet (len=804)
  572 4.657015758  10.6.15.144 → 192.168.1.16 SSH 102 Server: Encrypted packet (len=36)
  573 4.657066982 192.168.1.16 → 10.6.15.144  TCP 66 58518 → 22 [ACK] Seq=19585 Ack=202357 Win=2263 Len=0 TSval=7582744 TSecr=7033029
  574 4.658753677 192.168.1.16 → 10.6.15.144  SSH 138 Client: Encrypted packet (len=72)
  575 4.662057997 192.168.1.16 → 10.6.15.144  SSH 102 Client: Encrypted packet (len=36)
  576 4.695993808 192.168.1.16 → 10.6.15.144  SSH 102 Client: Encrypted packet (len=36)
  577 4.698590386  10.6.15.144 → 192.168.1.16 TCP 78 [TCP Dup ACK 570#1] 22 → 58518 [ACK] Seq=202357 Ack=19585 Win=1452 Len=0 TSval=7033039 TSecr=7582744 SLE=19657 SRE=19693
  578 4.702219787  10.6.15.144 → 192.168.1.16 TCP 78 [TCP Dup ACK 570#2] 22 → 58518 [ACK] Seq=202357 Ack=19585 Win=1452 Len=0 TSval=7033040 TSecr=7582744 SLE=19657 SRE=19729
  579 4.915995396 192.168.1.16 → 10.6.15.144  TCP 138 [TCP Retransmission] 58518 → 22 [PSH, ACK] Seq=19585 Ack=202357 Win=2263 Len=72 TSval=7582809 TSecr=7033040
  580 4.919587963  10.6.15.144 → 192.168.1.16 SSH 242 Server: Encrypted packet (len=164)
  581 4.919653872  10.6.15.144 → 192.168.1.16 SSH 466 Server: Encrypted packet (len=388)
  582 4.919656921  10.6.15.144 → 192.168.1.16 TCP 66 22 → 58518 [ACK] Seq=202909 Ack=19729 Win=1452 Len=0 TSval=7033095 TSecr=7582809
  583 4.919729542 192.168.1.16 → 10.6.15.144  TCP 66 58518 → 22 [ACK] Seq=19729 Ack=202909 Win=2263 Len=0 TSval=7582809 TSecr=7033091
  584 4.920634709 192.168.1.16 → 10.6.15.144  SSH 206 Client: Encrypted packet (len=140)
  585 4.923787382  10.6.15.144 → 192.168.1.16 SSH 102 Server: Encrypted packet (len=36)
  586 4.963968548 192.168.1.16 → 10.6.15.144  TCP 66 58518 → 22 [ACK] Seq=19869 Ack=202945 Win=2263 Len=0 TSval=7582821 TSecr=7033095
  587 4.993184086  10.6.15.144 → 192.168.1.16 SSH 102 Server: [TCP Spurious Retransmission] , Encrypted packet (len=36)
  588 4.993202933 192.168.1.16 → 10.6.15.144  TCP 78 [TCP Dup ACK 586#1] 58518 → 22 [ACK] Seq=19869 Ack=202945 Win=2263 Len=0 TSval=7582828 TSecr=7033113 SLE=202909 SRE=202945
  589 5.139941936 192.168.1.16 → 10.6.15.144  TCP 206 [TCP Retransmission] 58518 → 22 [PSH, ACK] Seq=19729 Ack=202945 Win=2263 Len=140 TSval=7582865 TSecr=7033113
  590 5.169434492 192.168.1.16 → 10.6.15.144  SSH 102 Client: Encrypted packet (len=36)
  591 5.171194921  10.6.15.144 → 192.168.1.16 TCP 66 22 → 58518 [ACK] Seq=202945 Ack=19905 Win=1452 Len=0 TSval=7033158 TSecr=7582865
  592 5.171210424 192.168.1.16 → 10.6.15.144  SSH 102 Client: Encrypted packet (len=36)
  593 5.201443493  10.6.15.144 → 192.168.1.16 SSH 102 Server: Encrypted packet (len=36)
  594 5.201462179 192.168.1.16 → 10.6.15.144  TCP 66 58518 → 22 [ACK] Seq=19941 Ack=202981 Win=2263 Len=0 TSval=7582880 TSecr=7033165
  595 5.209145841  10.6.15.144 → 192.168.1.16 SSH 102 Server: Encrypted packet (len=36)
  596 5.209161437 192.168.1.16 → 10.6.15.144  TCP 66 58518 → 22 [ACK] Seq=19941 Ack=203017 Win=2263 Len=0 TSval=7582882 TSecr=7033166
  597 5.292872032  10.6.15.144 → 192.168.1.16 SSH 102 Server: Encrypted packet (len=36)
  598 5.292890864 192.168.1.16 → 10.6.15.144  TCP 66 58518 → 22 [ACK] Seq=19941 Ack=203053 Win=2263 Len=0 TSval=7582903 TSecr=7033188
  599 5.293218643 192.168.1.16 → 10.6.15.144  SSH 150 Client: Encrypted packet (len=84)
  600 5.294746006  10.6.15.144 → 192.168.1.16 SSH 102 Server: Encrypted packet (len=36)
  601 5.295003135 192.168.1.16 → 10.6.15.144  SSH 390 Client: Encrypted packet (len=324)
  602 5.296932725  10.6.15.144 → 192.168.1.16 TCP 66 22 → 58518 [ACK] Seq=203089 Ack=20349 Win=1452 Len=0 TSval=7033189 TSecr=7582903
  603 6.376604494 192.168.1.16 → 91.189.89.198 NTP 90 NTP Version 4, client
  604 6.378274564  10.6.15.144 → 192.168.1.16 SSH 142 Server: Encrypted packet (len=76)
  605 6.378385512  10.6.15.144 → 192.168.1.16 SSH 138 Server: Encrypted packet (len=72)
  606 6.378407539 192.168.1.16 → 10.6.15.144  TCP 66 58518 → 22 [ACK] Seq=20349 Ack=203237 Win=2263 Len=0 TSval=7583174 TSecr=7033217
  607 6.378531619  10.6.15.144 → 192.168.1.16 SSH 138 Server: [TCP Spurious Retransmission] , Encrypted packet (len=72)
  608 6.378538637 192.168.1.16 → 10.6.15.144  TCP 78 [TCP Dup ACK 606#1] 58518 → 22 [ACK] Seq=20349 Ack=203237 Win=2263 Len=0 TSval=7583174 TSecr=7033238 SLE=203165 SRE=203237
  609 6.378589067 192.168.1.16 → 10.6.15.144  SSH 102 Client: Encrypted packet (len=36)
  610 6.378674430  10.6.15.144 → 192.168.1.16 SSH 102 Server: Encrypted packet (len=36)
  611 6.378868561  10.6.15.144 → 192.168.1.16 SSH 462 Server: Encrypted packet (len=396)
  612 6.378914051 192.168.1.16 → 10.6.15.144  TCP 66 58518 → 22 [ACK] Seq=20385 Ack=203669 Win=2263 Len=0 TSval=7583174 TSecr=7033251
  613 6.379006901  10.6.15.144 → 192.168.1.16 SSH 102 Server: Encrypted packet (len=36)
  614 6.379206130  10.6.15.144 → 192.168.1.16 SSH 502 Server: Encrypted packet (len=436)
  615 6.379237516 192.168.1.16 → 10.6.15.144  TCP 66 58518 → 22 [ACK] Seq=20385 Ack=204141 Win=2263 Len=0 TSval=7583174 TSecr=7033282
  616 6.379493947  10.6.15.144 → 192.168.1.16 SSH 1118 Server: [TCP Spurious Retransmission] , Encrypted packet (len=1052)
  617 6.379502323 192.168.1.16 → 10.6.15.144  SSH 662 Client: Encrypted packet (len=584)
  618 6.380174445 192.168.1.16 → 10.6.15.144  SSH 206 Client: Encrypted packet (len=140)
  619 6.380603055 192.168.1.16 → 10.6.15.144  SSH 138 Client: Encrypted packet (len=72)
  620 6.381783426  10.6.15.144 → 192.168.1.16 SSH 174 Server: Encrypted packet (len=108)
  621 6.382790366  10.6.15.144 → 192.168.1.16 TCP 66 22 → 58518 [ACK] Seq=204249 Ack=20969 Win=1452 Len=0 TSval=7033460 TSecr=7583174
  622 6.383390588  10.6.15.144 → 192.168.1.16 TCP 66 22 → 58518 [ACK] Seq=204249 Ack=21181 Win=1452 Len=0 TSval=7033460 TSecr=7583175
  623 6.383527830  10.6.15.144 → 192.168.1.16 SSH 102 Server: Encrypted packet (len=36)
  624 6.383593198 192.168.1.16 → 10.6.15.144  TCP 66 58518 → 22 [ACK] Seq=21181 Ack=204285 Win=2263 Len=0 TSval=7583175 TSecr=7033460
  625 6.395386001 192.168.1.16 → 10.6.15.144  SSH 138 Client: Encrypted packet (len=72)
  626 6.395898733 192.168.1.16 → 10.6.15.144  SSH 390 Client: Encrypted packet (len=324)
  627 6.397157726  10.6.15.144 → 192.168.1.16 SSH 102 Server: Encrypted packet (len=36)
  628 6.398102036  10.6.15.144 → 192.168.1.16 SSH 210 Server: Encrypted packet (len=144)
  629 6.398139961 192.168.1.16 → 10.6.15.144  TCP 66 58518 → 22 [ACK] Seq=21577 Ack=204465 Win=2263 Len=0 TSval=7583179 TSecr=7033464
  630 6.511535974 192.168.1.16 → 224.0.0.251  MDNS 82 Standard query 0x0000 PTR _googlecast._tcp.local, "QM" question
  631 6.511580089 fe80::820e:b87b:de2a:4286 → ff02::fb     MDNS 102 Standard query 0x0000 PTR _googlecast._tcp.local, "QM" question
  632 6.511629463 192.168.1.16 → 224.0.0.251  MDNS 82 Standard query 0x0000 PTR _googlecast._tcp.local, "QM" question
  633 6.511641168 fe80::820e:b87b:de2a:4286 → ff02::fb     MDNS 102 Standard query 0x0000 PTR _googlecast._tcp.local, "QM" question
  634 7.378071544 192.168.1.16 → 192.168.1.1  DNS 81 Standard query 0x0f6f A 2.ubuntu.pool.ntp.org
  635 7.379774670  10.6.15.144 → 192.168.1.16 SSH 638 Server: Encrypted packet (len=572)
  636 7.379797221  10.6.15.144 → 192.168.1.16 SSH 350 Server: Encrypted packet (len=284)
  637 7.379833847 192.168.1.16 → 10.6.15.144  TCP 66 58518 → 22 [ACK] Seq=21577 Ack=205321 Win=2263 Len=0 TSval=7583424 TSecr=7033527
  638 7.379859126  10.6.15.144 → 192.168.1.16 SSH 374 Server: Encrypted packet (len=308)
  639 7.380028575  10.6.15.144 → 192.168.1.16 SSH 102 Server: Encrypted packet (len=36)
  640 7.380034893  10.6.15.144 → 192.168.1.16 SSH 102 Server: Encrypted packet (len=36)
  641 7.380054508  10.6.15.144 → 192.168.1.16 TCP 102 [TCP Retransmission] 22 → 58518 [PSH, ACK] Seq=205665 Ack=21577 Win=1452 Len=36 TSval=7033602 TSecr=7583179
  642 7.380058134 192.168.1.16 → 10.6.15.144  TCP 78 58518 → 22 [ACK] Seq=21577 Ack=205701 Win=2263 Len=0 TSval=7583425 TSecr=7033554 SLE=205665 SRE=205701
  643 7.380064485 10.22.18.209 → 224.0.0.252  LLMNR 64 Standard query 0xbf86 A wpad
  644 7.381743227 192.168.1.16 → 10.6.15.144  SSH 1382 Client: Encrypted packet (len=1316)
  645 7.382744981 192.168.1.16 → 10.6.15.144  SSH 126 Client: Encrypted packet (len=60)
  646 7.382841947  10.6.15.144 → 192.168.1.16 SSH 102 Server: Encrypted packet (len=36)
  647 7.382858416  192.168.1.1 → 192.168.1.16 DNS 97 Standard query response 0x0f6f A 2.ubuntu.pool.ntp.org A 123.108.200.124
  648 7.383357385 192.168.1.16 → 123.108.200.124 NTP 90 NTP Version 4, client
  649 7.384189524 192.168.1.16 → 10.6.15.144  SSH 138 Client: Encrypted packet (len=72)
  650 7.384871422  10.6.15.144 → 192.168.1.16 TCP 66 22 → 58518 [ACK] Seq=205737 Ack=22953 Win=1452 Len=0 TSval=7033711 TSecr=7583425
  651 7.393899788  10.6.15.144 → 192.168.1.16 SSH 102 Server: Encrypted packet (len=36)
  652 7.420040180 10.22.18.209 → 224.0.0.252  LLMNR 64 Standard query 0xbf86 A wpad
  653 7.435960074 192.168.1.16 → 10.6.15.144  TCP 66 58518 → 22 [ACK] Seq=23025 Ack=205773 Win=2263 Len=0 TSval=7583439 TSecr=7033711
  654 8.399944481 192.168.1.16 → 224.0.0.252  IGMPv2 46 Membership Report group 224.0.0.252
  655 8.406832364  10.6.15.144 → 192.168.1.16 SSH 158 Server: Encrypted packet (len=92)
  656 8.406855802 192.168.1.16 → 10.6.15.144  TCP 66 58518 → 22 [ACK] Seq=23025 Ack=205865 Win=2263 Len=0 TSval=7583681 TSecr=7033804
  657 8.407036154  10.6.15.144 → 192.168.1.16 SSH 1514 Server: Encrypted packet (len=1448)
  658 8.407043123 192.168.1.16 → 10.6.15.144  TCP 66 58518 → 22 [ACK] Seq=23025 Ack=207313 Win=2263 Len=0 TSval=7583681 TSecr=7033804
  659 8.407052336  10.6.15.144 → 192.168.1.16 SSH 430 Server: Encrypted packet (len=364)
  660 8.407055664 192.168.1.16 → 10.6.15.144  TCP 66 58518 → 22 [ACK] Seq=23025 Ack=207677 Win=2263 Len=0 TSval=7583681 TSecr=7033804
  661 8.407340322  10.6.15.144 → 192.168.1.16 SSH 942 Server: Encrypted packet (len=876)
  662 8.407347585 192.168.1.16 → 10.6.15.144  TCP 66 58518 → 22 [ACK] Seq=23025 Ack=208553 Win=2263 Len=0 TSval=7583681 TSecr=7033894
  663 8.408330441 192.168.1.16 → 10.6.15.144  SSH 138 Client: Encrypted packet (len=72)
  664 8.408870833  10.6.15.144 → 192.168.1.16 SSH 102 Server: Encrypted packet (len=36)
  665 8.410158607  10.6.15.144 → 192.168.1.16 SSH 102 Server: Encrypted packet (len=36)
  666 8.410230883 192.168.1.16 → 10.6.15.144  TCP 66 58518 → 22 [ACK] Seq=23097 Ack=208625 Win=2263 Len=0 TSval=7583682 TSecr=7033967
  667 8.412982045 192.168.1.16 → 10.6.15.144  SSH 138 Client: Encrypted packet (len=72)
  668 8.414696402  10.6.15.144 → 192.168.1.16 SSH 102 Server: Encrypted packet (len=36)
  669 8.455938455 192.168.1.16 → 10.6.15.144  TCP 66 58518 → 22 [ACK] Seq=23169 Ack=208661 Win=2263 Len=0 TSval=7583694 TSecr=7033968
  670 9.489901307  10.6.15.144 → 192.168.1.16 SSH 126 Server: Encrypted packet (len=60)
  671 9.489928500 192.168.1.16 → 10.6.15.144  TCP 66 58518 → 22 [ACK] Seq=23169 Ack=208721 Win=2263 Len=0 TSval=7583952 TSecr=7034164
  672 10.704004069 192.168.1.16 → 89.161.158.40 TCP 66 46568 → 443 [ACK] Seq=1 Ack=1 Win=862 Len=0 TSval=7584256 TSecr=3366018016
  673 11.515476458 89.161.158.40 → 192.168.1.16 TCP 66 [TCP ACKed unseen segment] 443 → 46568 [ACK] Seq=1 Ack=2 Win=243 Len=0 TSval=3366031870 TSecr=7549512
  674 13.521837030 10.22.18.209 → 224.0.0.252  LLMNR 64 Standard query 0x40cd A wpad
  675 13.521855416 10.22.18.209 → 224.0.0.252  LLMNR 64 Standard query 0x40cd A wpad
  676 13.775997138 192.168.1.16 → 224.0.0.252  IGMPv2 46 Membership Report group 224.0.0.252
  677 14.481848894  10.6.15.144 → 192.168.1.16 SSH 102 Server: Encrypted packet (len=36)
  678 14.481869019 192.168.1.16 → 10.6.15.144  TCP 66 58518 → 22 [ACK] Seq=23169 Ack=208757 Win=2263 Len=0 TSval=7585200 TSecr=7035410
  679 16.378286612 192.168.1.16 → 192.168.1.1  DNS 81 Standard query 0x28c6 A 0.ubuntu.pool.ntp.org
  680 16.382355682  192.168.1.1 → 192.168.1.16 DNS 97 Standard query response 0x28c6 A 0.ubuntu.pool.ntp.org A 123.108.200.124
  681 16.382748114 192.168.1.16 → 123.108.200.124 NTP 90 NTP Version 4, client
  682 16.491028659  10.6.15.144 → 192.168.1.16 SSH 102 Server: Encrypted packet (len=36)
  683 16.491052227  10.6.15.144 → 192.168.1.16 SSH 138 Server: Encrypted packet (len=72)
  684 16.504028633 192.168.1.16 → 10.6.15.144  TCP 66 58518 → 22 [ACK] Seq=23169 Ack=208793 Win=2263 Len=0 TSval=7585702 TSecr=7035987
  685 16.504046623 192.168.1.16 → 10.6.15.144  TCP 66 58518 → 22 [ACK] Seq=23169 Ack=208865 Win=2263 Len=0 TSval=7585702 TSecr=7035987
  686 18.895975672 192.168.1.16 → 52.21.37.23  TCP 66 57254 → 443 [ACK] Seq=1 Ack=1 Win=455 Len=0 TSval=7586304 TSecr=1246193800
  687 18.896753686 192.168.1.16 → 216.58.196.106 TCP 66 56232 → 443 [ACK] Seq=1 Ack=1 Win=384 Len=0 TSval=7586304 TSecr=298455384
  688 19.003970762  10.6.15.144 → 192.168.1.16 SSH 102 Server: Encrypted packet (len=36)
  689 19.003993230 216.58.196.106 → 192.168.1.16 TCP 66 [TCP ACKed unseen segment] 443 → 56232 [ACK] Seq=1 Ack=2 Win=179 Len=0 TSval=298501610 TSecr=7574747
  690 19.020009141 192.168.1.16 → 10.6.15.144  TCP 66 58518 → 22 [ACK] Seq=23169 Ack=208901 Win=2263 Len=0 TSval=7586331 TSecr=7036577
  691 20.467554294  10.6.15.144 → 192.168.1.16 SSH 102 Server: [TCP Spurious Retransmission] , Encrypted packet (len=36)
  692 20.467573973 192.168.1.16 → 10.6.15.144  TCP 78 [TCP Dup ACK 690#1] 58518 → 22 [ACK] Seq=23169 Ack=208901 Win=2263 Len=0 TSval=7586696 TSecr=7036870 SLE=208865 SRE=208901
  693 20.467587975  10.22.18.98 → 224.0.0.252  LLMNR 64 Standard query 0x3475 A wpad
  694 20.468015817  10.22.18.98 → 224.0.0.252  LLMNR 64 Standard query 0x3475 A wpad
  695 22.515806969 10.22.18.209 → 224.0.0.252  LLMNR 64 Standard query 0x11d5 A wpad
  696 22.515825485 10.22.18.209 → 224.0.0.252  LLMNR 64 Standard query 0x11d5 A wpad
  697 25.039974935 192.168.1.16 → 216.58.196.110 TCP 66 43688 → 443 [ACK] Seq=1 Ack=1 Win=237 Len=0 TSval=7587840 TSecr=1379966885
  698 25.040744849 192.168.1.16 → 54.192.190.228 TCP 66 33568 → 80 [ACK] Seq=1 Ack=1 Win=239 Len=0 TSval=7587840 TSecr=1012067907
  699 25.043561018 216.58.196.110 → 192.168.1.16 TCP 66 [TCP ACKed unseen segment] 443 → 43688 [ACK] Seq=1 Ack=2 Win=170 Len=0 TSval=1380011940 TSecr=7542424
  700 28.465910149 54.192.190.228 → 192.168.1.16 TLSv1.2 112 Application Data
  701 28.466077251 192.168.1.16 → 54.192.190.228 TCP 66 59054 → 443 [FIN, ACK] Seq=1 Ack=47 Win=387 Len=0 TSval=7588696 TSecr=3809528306
  702 28.466361430 54.192.190.228 → 192.168.1.16 TLSv1.2 97 Encrypted Alert
  703 28.466374152 192.168.1.16 → 54.192.190.228 TCP 54 59054 → 443 [RST] Seq=1 Win=0 Len=0
  704 28.466760408 54.192.190.228 → 192.168.1.16 TCP 66 443 → 59054 [FIN, ACK] Seq=78 Ack=1 Win=140 Len=0 TSval=3809528306 TSecr=7543510
  705 28.466764443 192.168.1.16 → 54.192.190.228 TCP 54 59054 → 443 [RST] Seq=1 Win=0 Len=0
  706 28.467125820 54.192.190.228 → 192.168.1.16 TCP 66 [TCP Out-Of-Order] 443 → 59054 [FIN, ACK] Seq=78 Ack=1 Win=140 Len=0 TSval=3809528308 TSecr=7543510
  707 28.467138670 192.168.1.16 → 54.192.190.228 TCP 54 59054 → 443 [RST] Seq=1 Win=0 Len=0
  708 28.467302554 54.192.190.228 → 192.168.1.16 TCP 143 [TCP Out-Of-Order] 443 → 59054 [FIN, PSH, ACK] Seq=1 Ack=1 Win=140 Len=77 TSval=3809528329 TSecr=7543510
  709 28.467311288 192.168.1.16 → 54.192.190.228 TCP 54 59054 → 443 [RST] Seq=1 Win=0 Len=0
  710 28.583968463  10.6.15.144 → 192.168.1.16 SSH 102 Server: [TCP Previous segment not captured] , Encrypted packet (len=36)
  711 28.583987943 52.222.146.49 → 192.168.1.16 TLSv1.2 112 Application Data
  712 28.583997540 52.222.146.49 → 192.168.1.16 TLSv1.2 97 Encrypted Alert
  713 28.584001126 52.222.146.49 → 192.168.1.16 TCP 66 443 → 55228 [FIN, ACK] Seq=78 Ack=1 Win=122 Len=0 TSval=3659903918 TSecr=7543584
  714 28.584003618  10.22.18.98 → 224.0.0.252  LLMNR 64 Standard query 0x248b A wpad
  715 28.584011593  10.22.18.98 → 224.0.0.252  LLMNR 64 Standard query 0x5086 A wpad
  716 28.584013795 52.222.146.49 → 192.168.1.16 TCP 66 [TCP Out-Of-Order] 443 → 55228 [FIN, ACK] Seq=78 Ack=1 Win=122 Len=0 TSval=3659903946 TSecr=7543584
  717 28.584021079 54.192.190.228 → 192.168.1.16 TCP 143 [TCP Retransmission] 443 → 59054 [FIN, PSH, ACK] Seq=1 Ack=1 Win=140 Len=77 TSval=3809528371 TSecr=7543510
  718 28.584028535 54.192.190.228 → 192.168.1.16 TCP 66 [TCP ACKed unseen segment] 80 → 33568 [FIN, ACK] Seq=0 Ack=2 Win=34 Len=0 TSval=1012072872 TSecr=7544930
  719 28.584032900  10.22.18.98 → 224.0.0.252  LLMNR 64 Standard query 0x248b A wpad
  720 28.584035120  10.22.18.98 → 224.0.0.252  LLMNR 64 Standard query 0x5086 A wpad
  721 28.584036860 54.192.190.228 → 192.168.1.16 TCP 66 443 → 59054 [ACK] Seq=79 Ack=2 Win=140 Len=0 TSval=3809528381 TSecr=7588696
  722 28.584039985  10.6.15.144 → 192.168.1.16 TCP 102 [TCP Retransmission] 22 → 58518 [PSH, ACK] Seq=209009 Ack=23169 Win=1452 Len=36 TSval=7038988 TSecr=7586696
  723 28.588012467 192.168.1.16 → 10.6.15.144  TCP 78 [TCP Dup ACK 690#2] 58518 → 22 [ACK] Seq=23169 Ack=208901 Win=2263 Len=0 TSval=7588726 TSecr=7036870 SLE=209009 SRE=209045
  724 28.588794767 192.168.1.16 → 52.222.146.49 TCP 78 55228 → 443 [ACK] Seq=1 Ack=79 Win=477 Len=0 TSval=7588726 TSecr=3659903918 SLE=78 SRE=79
  725 28.588801672 192.168.1.16 → 54.192.190.228 TCP 54 59054 → 443 [RST] Seq=1 Win=0 Len=0
  726 28.588804181 192.168.1.16 → 54.192.190.228 TCP 78 [TCP Previous segment not captured] 33568 → 80 [ACK] Seq=2 Ack=1 Win=239 Len=0 TSval=7588726 TSecr=1012072872 SLE=0 SRE=1
  727 28.588806416 192.168.1.16 → 54.192.190.228 TCP 54 59054 → 443 [RST] Seq=2 Win=0 Len=0
  728 28.588808243 192.168.1.16 → 10.6.15.144  TCP 86 [TCP Dup ACK 690#3] 58518 → 22 [ACK] Seq=23169 Ack=208901 Win=2263 Len=0 TSval=7588726 TSecr=7036870 SLE=209009 SRE=209045 SLE=209009 SRE=209045
  729 28.588810403 192.168.1.16 → 52.222.146.49 TCP 66 55228 → 443 [FIN, ACK] Seq=1 Ack=79 Win=477 Len=0 TSval=7588726 TSecr=3659903918
  730 28.693566760 52.222.146.49 → 192.168.1.16 TLSv1.2 143 [TCP Spurious Retransmission] , Application Data, Encrypted Alert
  731 28.712057441 192.168.1.16 → 52.222.146.49 TCP 78 [TCP Dup ACK 724#1] 55228 → 443 [ACK] Seq=2 Ack=79 Win=477 Len=0 TSval=7588753 TSecr=3659903986 SLE=1 SRE=79
  732 28.725962961 52.222.146.49 → 192.168.1.16 TCP 66 443 → 55228 [ACK] Seq=79 Ack=2 Win=122 Len=0 TSval=3659903989 TSecr=7588726
  733 29.135962084 192.168.1.16 → 23.185.0.2   TCP 66 54374 → 443 [ACK] Seq=1 Ack=1 Win=364 Len=0 TSval=7588864 TSecr=2742377850
  734 29.136738558 192.168.1.16 → 118.214.110.12 TCP 66 54048 → 443 [ACK] Seq=1 Ack=1 Win=387 Len=0 TSval=7588864 TSecr=332484762
  735 29.136741956 192.168.1.16 → 216.58.196.99 TCP 66 52408 → 443 [ACK] Seq=1 Ack=1 Win=317 Len=0 TSval=7588864 TSecr=537519548
  736 29.136743808 192.168.1.16 → 151.101.193.69 TCP 66 33220 → 443 [ACK] Seq=1 Ack=1 Win=410 Len=0 TSval=7588864 TSecr=304288488
  737 29.136745473 192.168.1.16 → 23.47.251.27 TCP 66 38888 → 80 [ACK] Seq=1 Ack=1 Win=274 Len=0 TSval=7588864 TSecr=1012068443
  738 29.136747011 192.168.1.16 → 151.101.8.223 TCP 66 54978 → 443 [ACK] Seq=1 Ack=1 Win=591 Len=0 TSval=7588864 TSecr=304288488
  739 29.136748397 192.168.1.16 → 52.216.131.141 TCP 66 47572 → 443 [ACK] Seq=1 Ack=1 Win=3079 Len=0 SLE=513 SRE=14849
  740 29.136749880 192.168.1.16 → 216.58.196.100 TCP 66 45824 → 443 [ACK] Seq=1 Ack=1 Win=237 Len=0 TSval=7588864 TSecr=3660340023
  741 29.145067191 10.22.18.209 → 224.0.0.252  LLMNR 64 Standard query 0x63e0 A wpad
  742 29.145189351  10.22.18.98 → 224.0.0.252  LLMNR 72 Standard query 0x96ee A qblurprydxrj
  743 29.151192244  10.22.18.98 → 224.0.0.252  LLMNR 68 Standard query 0x225a A wzxxgmzw
  744 29.151214812  10.22.18.98 → 224.0.0.252  LLMNR 74 Standard query 0x1a28 A gxmamkbimhtvyt
  745 29.151223721 91.198.174.192 → 192.168.1.16 TLSv1.2 104 Application Data
  746 29.151247943 91.198.174.192 → 192.168.1.16 TLSv1.2 89 Encrypted Alert
  747 29.151258533 91.198.174.192 → 192.168.1.16 TCP 66 443 → 39374 [FIN, ACK] Seq=62 Ack=1 Win=61 Len=0 TSval=2277278251 TSecr=7543731
  748 29.151267560 10.22.18.209 → 224.0.0.252  LLMNR 64 Standard query 0x63e0 A wpad
  749 29.151277729 23.47.251.27 → 192.168.1.16 TCP 66 [TCP ACKed unseen segment] 80 → 38888 [ACK] Seq=1 Ack=2 Win=31 Len=0 TSval=1012072948 TSecr=7543581
  750 29.151285562 216.58.196.99 → 192.168.1.16 TCP 66 [TCP ACKed unseen segment] 443 → 52408 [ACK] Seq=1 Ack=2 Win=179 Len=0 TSval=537564600 TSecr=7543508
  751 29.151292448 118.214.110.12 → 192.168.1.16 TCP 66 [TCP ACKed unseen segment] 443 → 54048 [ACK] Seq=1 Ack=2 Win=1067 Len=0 TSval=332529814 TSecr=7543603
  752 29.151341121 192.168.1.16 → 91.198.174.192 TCP 66 39374 → 443 [ACK] Seq=1 Ack=63 Win=342 Len=0 TSval=7588867 TSecr=2277278251
  753 29.151431492 192.168.1.16 → 91.198.174.192 TCP 66 39374 → 443 [FIN, ACK] Seq=1 Ack=63 Win=342 Len=0 TSval=7588867 TSecr=2277278251
  754 29.176954016 151.101.193.69 → 192.168.1.16 TCP 66 [TCP ACKed unseen segment] 443 → 33220 [ACK] Seq=1 Ack=2 Win=61 Len=0 TSval=304299751 TSecr=7543515
  755 29.176971540 151.101.8.223 → 192.168.1.16 TCP 66 [TCP ACKed unseen segment] 443 → 54978 [ACK] Seq=1 Ack=2 Win=61 Len=0 TSval=304299751 TSecr=7543599
  756 29.177362587   23.185.0.2 → 192.168.1.16 TCP 66 [TCP ACKed unseen segment] 443 → 54374 [ACK] Seq=1 Ack=2 Win=61 Len=0 TSval=2742389113 TSecr=7543563
  757 29.871943765 192.168.1.16 → 91.198.174.192 TCP 66 [TCP Spurious Retransmission] 39374 → 443 [FIN, ACK] Seq=1 Ack=63 Win=342 Len=0 TSval=7589048 TSecr=2277278251
  758 29.876865608  10.22.18.98 → 224.0.0.252  LLMNR 74 Standard query 0x1a28 A gxmamkbimhtvyt
  759 29.876884856  10.22.18.98 → 224.0.0.252  LLMNR 68 Standard query 0x225a A wzxxgmzw
  760 29.876889277  10.22.18.98 → 224.0.0.252  LLMNR 72 Standard query 0x96ee A qblurprydxrj
  761 29.876905533 91.198.174.192 → 192.168.1.16 TCP 66 443 → 39374 [ACK] Seq=63 Ack=2 Win=61 Len=0 TSval=2277278401 TSecr=7588867
  762 29.876935158  10.6.15.144 → 192.168.1.16 TCP 174 [TCP Retransmission] 22 → 58518 [PSH, ACK] Seq=208901 Ack=23169 Win=1452 Len=108 TSval=7039278 TSecr=7588726
  763 29.876950881 192.168.1.16 → 10.6.15.144  TCP 66 58518 → 22 [ACK] Seq=23169 Ack=209045 Win=2263 Len=0 TSval=7589049 TSecr=7039278
  764 31.183972512 192.168.1.16 → 216.58.196.99 TCP 66 52440 → 443 [ACK] Seq=1 Ack=1 Win=237 Len=0 TSval=7589376 TSecr=1172882964
  765 31.190940546 91.198.174.192 → 192.168.1.16 TCP 66 [TCP Dup ACK 761#1] 443 → 39374 [ACK] Seq=63 Ack=2 Win=61 Len=0 TSval=2277278568 TSecr=7588867
  766 31.190961219 192.168.1.16 → 91.198.174.192 TCP 54 39374 → 443 [RST] Seq=2 Win=0 Len=0
  767 31.191639666 216.58.196.99 → 192.168.1.16 TCP 66 [TCP ACKed unseen segment] 443 → 52440 [ACK] Seq=1 Ack=2 Win=175 Len=0 TSval=1172928020 TSecr=7544226
  768 32.495998499 192.168.1.16 → 104.24.28.86 TCP 54 46600 → 443 [ACK] Seq=1 Ack=1 Win=453 Len=0
  769 32.496020268 192.168.1.16 → 151.101.9.140 TCP 66 36298 → 443 [ACK] Seq=1 Ack=1 Win=364 Len=0 TSval=7589704 TSecr=2547834833
  770 33.492881775 151.101.9.140 → 192.168.1.16 TCP 66 [TCP ACKed unseen segment] 443 → 36298 [ACK] Seq=1 Ack=2 Win=61 Len=0 TSval=2547846426 TSecr=7543632
  771 33.492900504 54.192.191.201 → 192.168.1.16 TLSv1.2 112 Application Data
  772 33.492915315 54.192.191.201 → 192.168.1.16 TLSv1.2 97 Encrypted Alert
  773 33.492922527 54.192.191.201 → 192.168.1.16 TCP 66 443 → 49764 [FIN, ACK] Seq=78 Ack=1 Win=122 Len=0 TSval=3805238247 TSecr=7544866
  774 33.492927898 54.192.191.201 → 192.168.1.16 TCP 66 [TCP Out-Of-Order] 443 → 49764 [FIN, ACK] Seq=78 Ack=1 Win=122 Len=0 TSval=3805238249 TSecr=7544866
  775 33.492938227 192.168.1.16 → 54.192.191.201 TCP 78 49764 → 443 [ACK] Seq=1 Ack=79 Win=364 Len=0 TSval=7589953 TSecr=3805238247 SLE=78 SRE=79
  776 33.492949966 54.192.191.201 → 192.168.1.16 TCP 143 [TCP Out-Of-Order] 443 → 49764 [FIN, PSH, ACK] Seq=1 Ack=1 Win=122 Len=77 TSval=3805238270 TSecr=7544866
  777 33.492952369 192.168.1.16 → 54.192.191.201 TCP 78 [TCP Dup ACK 775#1] 49764 → 443 [ACK] Seq=1 Ack=79 Win=364 Len=0 TSval=7589953 TSecr=3805238270 SLE=1 SRE=79
  778 33.492956346  10.6.15.144 → 192.168.1.16 SSH 102 Server: Encrypted packet (len=36)
  779 33.492958699 192.168.1.16 → 10.6.15.144  TCP 66 58518 → 22 [ACK] Seq=23169 Ack=209081 Win=2263 Len=0 TSval=7589953 TSecr=7040217
  780 33.493085399 192.168.1.16 → 54.192.191.201 TCP 66 49764 → 443 [FIN, ACK] Seq=1 Ack=79 Win=364 Len=0 TSval=7589953 TSecr=3805238270
  781 33.493485542 104.24.28.86 → 192.168.1.16 TCP 60 [TCP ACKed unseen segment] 443 → 46600 [ACK] Seq=1 Ack=2 Win=31 Len=0
  782 33.511742443 54.192.191.201 → 192.168.1.16 TCP 66 443 → 49764 [ACK] Seq=79 Ack=2 Win=122 Len=0 TSval=3805238282 TSecr=7589953
  783 35.279947660 192.168.1.16 → 104.20.136.42 TCP 66 45658 → 80 [ACK] Seq=1 Ack=1 Win=241 Len=0 TSval=7590400 TSecr=1012059993
  784 36.497945496  10.6.15.144 → 192.168.1.16 SSH 326 Server: Encrypted packet (len=260)
  785 36.497963217 192.168.1.16 → 10.6.15.144  TCP 66 58518 → 22 [ACK] Seq=23169 Ack=209341 Win=2263 Len=0 TSval=7590704 TSecr=7040757
  786 36.499214292  10.6.15.144 → 192.168.1.16 SSH 102 Server: Encrypted packet (len=36)
  787 36.499232035 192.168.1.16 → 10.6.15.144  TCP 66 58518 → 22 [ACK] Seq=23169 Ack=209377 Win=2263 Len=0 TSval=7590704 TSecr=7040757
  788 36.500801796  10.6.15.144 → 192.168.1.16 SSH 102 Server: [TCP Spurious Retransmission] , Encrypted packet (len=36)
  789 36.500821379 192.168.1.16 → 10.6.15.144  TCP 78 [TCP Dup ACK 787#1] 58518 → 22 [ACK] Seq=23169 Ack=209377 Win=2263 Len=0 TSval=7590705 TSecr=7040869 SLE=209341 SRE=209377
  790 37.328007196 192.168.1.16 → 151.101.8.133 TCP 66 51412 → 443 [ACK] Seq=1 Ack=1 Win=455 Len=0 TSval=7590912 TSecr=324684059
  791 37.363373998 10.22.18.209 → 224.0.0.252  LLMNR 64 Standard query 0x7854 A wpad
  792 37.364977675 10.22.18.209 → 224.0.0.252  LLMNR 64 Standard query 0x7854 A wpad
  793 39.376006145 192.168.1.16 → 104.24.29.86 TCP 54 50612 → 443 [ACK] Seq=1 Ack=1 Win=411 Len=0
