    1 0.000000000 192.168.1.16 → 10.6.15.144  SSH 190 Client: Encrypted packet (len=124)
    2 0.001915538  10.6.15.144 → 192.168.1.16 SSH 114 Server: Encrypted packet (len=36)
    3 0.001943132  10.6.15.144 → 192.168.1.16 TCP 78 [TCP Dup ACK 2#1] 22 → 58518 [ACK] Seq=37 Ack=4294967153 Win=1452 Len=0 TSval=7042042 TSecr=7591747 SLE=4294967189 SRE=125
    4 0.001953910 192.168.1.16 → 10.6.15.144  TCP 102 [TCP Out-Of-Order] 58518 → 22 [PSH, ACK] Seq=4294967153 Ack=37 Win=2263 Len=36 TSval=7591757 TSecr=7042042
    5 0.003243819  10.6.15.144 → 192.168.1.16 TCP 66 22 → 58518 [ACK] Seq=37 Ack=125 Win=1452 Len=0 TSval=7042043 TSecr=7591757
    6 0.003253433 192.168.1.16 → 10.6.15.144  SSH 158 Client: Encrypted packet (len=92)
    7 0.003639637  10.6.15.144 → 192.168.1.16 SSH 138 Server: Encrypted packet (len=72)
    8 0.003784228 192.168.1.16 → 10.6.15.144  SSH 102 Client: Encrypted packet (len=36)
    9 0.005131893  10.6.15.144 → 192.168.1.16 TCP 66 22 → 58518 [ACK] Seq=109 Ack=253 Win=1452 Len=0 TSval=7042043 TSecr=7591757
   10 0.109474616  10.6.15.144 → 192.168.1.16 SSH 102 Server: Encrypted packet (len=36)
   11 0.110380513  10.6.15.144 → 192.168.1.16 SSH 102 Server: Encrypted packet (len=36)
   12 0.113755061  10.6.15.144 → 192.168.1.16 SSH 138 Server: Encrypted packet (len=72)
   13 0.114193935  10.6.15.144 → 192.168.1.16 SSH 102 Server: Encrypted packet (len=36)
   14 0.118044171  10.6.15.144 → 192.168.1.16 SSH 102 Server: Encrypted packet (len=36)
   15 0.128000216 192.168.1.16 → 10.6.15.144  TCP 66 58518 → 22 [ACK] Seq=253 Ack=181 Win=2263 Len=0 TSval=7591784 TSecr=7042069
   16 0.128016675 192.168.1.16 → 10.6.15.144  TCP 66 58518 → 22 [ACK] Seq=253 Ack=289 Win=2263 Len=0 TSval=7591785 TSecr=7042070
   17 0.128019254 192.168.1.16 → 10.6.15.144  SSH 174 Client: Encrypted packet (len=108)
   18 0.132944996  10.6.15.144 → 192.168.1.16 SSH 246 Server: Encrypted packet (len=180)
   19 0.133449256 192.168.1.16 → 10.6.15.144  SSH 230 Client: Encrypted packet (len=164)
   20 0.133706127  10.22.18.98 → 224.0.0.252  LLMNR 65 Standard query 0x1b13 ANY Febin
   21 0.138074209  10.6.15.144 → 192.168.1.16 SSH 102 Server: Encrypted packet (len=36)
   22 0.149622997  10.6.15.144 → 192.168.1.16 SSH 102 Server: Encrypted packet (len=36)
   23 0.149709896 192.168.1.16 → 10.6.15.144  TCP 66 58518 → 22 [ACK] Seq=525 Ack=577 Win=2263 Len=0 TSval=7591794 TSecr=7042076
   24 0.150028071 192.168.1.16 → 10.6.15.144  SSH 374 Client: Encrypted packet (len=308)
   25 0.151386283  10.6.15.144 → 192.168.1.16 SSH 102 Server: Encrypted packet (len=36)
   26 0.151743900 192.168.1.16 → 10.6.15.144  SSH 166 Client: Encrypted packet (len=100)
   27 0.152153040  10.6.15.144 → 192.168.1.16 SSH 102 Server: Encrypted packet (len=36)
   28 0.152401126 192.168.1.16 → 10.6.15.144  SSH 158 Client: Encrypted packet (len=92)
   29 0.153854810  10.6.15.144 → 192.168.1.16 SSH 138 Server: Encrypted packet (len=72)
   30 0.154253094 192.168.1.16 → 10.6.15.144  SSH 166 Client: Encrypted packet (len=100)
   31 0.154389065  10.6.15.144 → 192.168.1.16 SSH 102 Server: Encrypted packet (len=36)
   32 0.161627993  10.6.15.144 → 192.168.1.16 SSH 102 Server: Encrypted packet (len=36)
   33 0.161739291 192.168.1.16 → 10.6.15.144  TCP 66 58518 → 22 [ACK] Seq=1125 Ack=793 Win=2263 Len=0 TSval=7591797 TSecr=7042081
   34 0.169709580  10.6.15.144 → 192.168.1.16 SSH 102 Server: Encrypted packet (len=36)
   35 0.170051500 192.168.1.16 → 10.6.15.144  SSH 166 Client: Encrypted packet (len=100)
   36 0.210837637  10.6.15.144 → 192.168.1.16 TCP 66 22 → 58518 [ACK] Seq=829 Ack=1225 Win=1452 Len=0 TSval=7042095 TSecr=7591799
   37 0.218597965  10.6.15.144 → 192.168.1.16 SSH 222 Server: Encrypted packet (len=156)
   38 0.220109220  10.6.15.144 → 192.168.1.16 SSH 454 Server: Encrypted packet (len=388)
   39 0.220174453 192.168.1.16 → 10.6.15.144  TCP 66 58518 → 22 [ACK] Seq=1225 Ack=1373 Win=2263 Len=0 TSval=7591812 TSecr=7042097
   40 0.221065099 192.168.1.16 → 10.6.15.144  SSH 206 Client: Encrypted packet (len=140)
   41 0.229103727  10.6.15.144 → 192.168.1.16 SSH 222 Server: Encrypted packet (len=156)
   42 0.229173442  10.6.15.144 → 192.168.1.16 SSH 454 Server: Encrypted packet (len=388)
   43 0.229240305 192.168.1.16 → 10.6.15.144  TCP 66 58518 → 22 [ACK] Seq=1365 Ack=1917 Win=2263 Len=0 TSval=7591814 TSecr=7042097
   44 0.230173318 192.168.1.16 → 10.6.15.144  SSH 206 Client: Encrypted packet (len=140)
   45 0.255959043 192.168.1.16 → 10.6.15.144  TCP 206 [TCP Retransmission] 58518 → 22 [PSH, ACK] Seq=1365 Ack=1917 Win=2263 Len=140 TSval=7591821 TSecr=7042097
   46 0.286865877  10.6.15.144 → 192.168.1.16 SSH 454 Server: [TCP Spurious Retransmission] , Encrypted packet (len=388)
   47 0.286886276 192.168.1.16 → 10.6.15.144  TCP 78 [TCP Dup ACK 43#1] 58518 → 22 [ACK] Seq=1505 Ack=1917 Win=2263 Len=0 TSval=7591828 TSecr=7042114 SLE=1529 SRE=1917
   48 0.289914767  10.6.15.144 → 192.168.1.16 TCP 78 [TCP Dup ACK 36#1] 22 → 58518 [ACK] Seq=1917 Ack=1225 Win=1452 Len=0 TSval=7042114 TSecr=7591799 SLE=1365 SRE=1505
   49 0.289932103  10.6.15.144 → 192.168.1.16 TCP 86 [TCP Dup ACK 36#2] 22 → 58518 [ACK] Seq=1917 Ack=1225 Win=1452 Len=0 TSval=7042114 TSecr=7591799 SLE=1365 SRE=1505 SLE=1365 SRE=1505
   50 0.435999130 192.168.1.16 → 10.6.15.144  TCP 206 [TCP Retransmission] 58518 → 22 [PSH, ACK] Seq=1225 Ack=1917 Win=2263 Len=140 TSval=7591866 TSecr=7042114
   51 0.439523809  10.6.15.144 → 192.168.1.16 TCP 66 22 → 58518 [ACK] Seq=1917 Ack=1505 Win=1452 Len=0 TSval=7042151 TSecr=7591866
   52 0.524548063  10.6.15.144 → 192.168.1.16 SSH 1514 Server: Encrypted packet (len=1448)
   53 0.524566469 192.168.1.16 → 10.6.15.144  TCP 66 58518 → 22 [ACK] Seq=1505 Ack=3365 Win=2263 Len=0 TSval=7591888 TSecr=7042173
   54 0.524727334  10.6.15.144 → 192.168.1.16 SSH 1514 Server: Encrypted packet (len=1448)
   55 0.524736604 192.168.1.16 → 10.6.15.144  TCP 66 58518 → 22 [ACK] Seq=1505 Ack=4813 Win=2263 Len=0 TSval=7591888 TSecr=7042173
   56 0.540003970  10.6.15.144 → 192.168.1.16 SSH 1350 Server: Encrypted packet (len=1284)
   57 0.540020734 192.168.1.16 → 10.6.15.144  TCP 66 58518 → 22 [ACK] Seq=1505 Ack=6097 Win=2263 Len=0 TSval=7591892 TSecr=7042173
   58 0.540221055  10.6.15.144 → 192.168.1.16 SSH 1514 Server: Encrypted packet (len=1448)
   59 0.540228559 192.168.1.16 → 10.6.15.144  TCP 66 58518 → 22 [ACK] Seq=1505 Ack=7545 Win=2263 Len=0 TSval=7591892 TSecr=7042173
   60 0.540443408  10.6.15.144 → 192.168.1.16 SSH 1514 Server: Encrypted packet (len=1448)
   61 0.540450681 192.168.1.16 → 10.6.15.144  TCP 66 58518 → 22 [ACK] Seq=1505 Ack=8993 Win=2263 Len=0 TSval=7591892 TSecr=7042173
   62 0.546015139 192.168.1.16 → 10.6.15.144  SSH 102 Client: Encrypted packet (len=36)
   63 0.548244567 192.168.1.16 → 10.6.15.144  SSH 102 Client: Encrypted packet (len=36)
   64 0.575949349 192.168.1.16 → 10.6.15.144  SSH 314 Client: Encrypted packet (len=248)
   65 0.601649776  10.6.15.144 → 192.168.1.16 SSH 1514 Server: Encrypted packet (len=1448)
   66 0.601879520  10.6.15.144 → 192.168.1.16 SSH 1514 Server: Encrypted packet (len=1448)
   67 0.601891485 192.168.1.16 → 10.6.15.144  TCP 66 58518 → 22 [ACK] Seq=1825 Ack=11889 Win=2263 Len=0 TSval=7591907 TSecr=7042191
   68 0.602118769  10.6.15.144 → 192.168.1.16 SSH 1514 Server: Encrypted packet (len=1448)
   69 0.602358630  10.6.15.144 → 192.168.1.16 SSH 1514 Server: Encrypted packet (len=1448)
   70 0.602367033 192.168.1.16 → 10.6.15.144  TCP 66 58518 → 22 [ACK] Seq=1825 Ack=14785 Win=2263 Len=0 TSval=7591907 TSecr=7042191
   71 0.602381449  10.6.15.144 → 192.168.1.16 TCP 66 22 → 58518 [ACK] Seq=14785 Ack=1541 Win=1452 Len=0 TSval=7042191 TSecr=7591893
   72 0.602390821  10.6.15.144 → 192.168.1.16 TCP 66 22 → 58518 [ACK] Seq=14785 Ack=1577 Win=1452 Len=0 TSval=7042191 TSecr=7591894
   73 0.602395473  10.6.15.144 → 192.168.1.16 TCP 66 22 → 58518 [ACK] Seq=14785 Ack=1825 Win=1451 Len=0 TSval=7042191 TSecr=7591901
   74 0.612029091  10.6.15.144 → 192.168.1.16 SSH 1514 Server: Encrypted packet (len=1448)
   75 0.612259681  10.6.15.144 → 192.168.1.16 SSH 1514 Server: Encrypted packet (len=1448)
   76 0.612272063 192.168.1.16 → 10.6.15.144  TCP 66 58518 → 22 [ACK] Seq=1825 Ack=17681 Win=2263 Len=0 TSval=7591910 TSecr=7042193
   77 0.612498621  10.6.15.144 → 192.168.1.16 SSH 1514 Server: Encrypted packet (len=1448)
   78 0.612739979  10.6.15.144 → 192.168.1.16 SSH 1514 Server: Encrypted packet (len=1448)
   79 0.612747189 192.168.1.16 → 10.6.15.144  TCP 66 58518 → 22 [ACK] Seq=1825 Ack=20577 Win=2263 Len=0 TSval=7591910 TSecr=7042193
   80 0.612810160  10.6.15.144 → 192.168.1.16 SSH 598 Server: Encrypted packet (len=532)
   81 0.613768491 192.168.1.16 → 10.6.15.144  SSH 206 Client: Encrypted packet (len=140)
   82 0.615998108 192.168.1.16 → 10.6.15.144  SSH 414 Client: Encrypted packet (len=348)
   83 0.667947873 192.168.1.16 → 10.6.15.144  SSH 254 Client: Encrypted packet (len=188)
   84 0.683299895  10.6.15.144 → 192.168.1.16 SSH 270 Server: Encrypted packet (len=204)
   85 0.723959411 192.168.1.16 → 10.6.15.144  TCP 66 58518 → 22 [ACK] Seq=2501 Ack=21313 Win=2263 Len=0 TSval=7591938 TSecr=7042213
   86 0.731951207 192.168.1.16 → 10.6.15.144  TCP 254 [TCP Retransmission] 58518 → 22 [PSH, ACK] Seq=2313 Ack=21313 Win=2263 Len=188 TSval=7591940 TSecr=7042213
   87 0.788253340  10.6.15.144 → 192.168.1.16 TCP 78 [TCP Dup ACK 73#1] 22 → 58518 [ACK] Seq=21313 Ack=1825 Win=1452 Len=0 TSval=7042239 TSecr=7591907 SLE=2313 SRE=2501
   88 0.788270915  10.6.15.144 → 192.168.1.16 TCP 86 [TCP Dup ACK 73#2] 22 → 58518 [ACK] Seq=21313 Ack=1825 Win=1452 Len=0 TSval=7042239 TSecr=7591907 SLE=2313 SRE=2501 SLE=2313 SRE=2501
   89 0.853816058 192.168.1.16 → 10.6.15.144  SSH 1514 Client: Encrypted packet (len=1448)
   90 0.855941301  10.6.15.144 → 192.168.1.16 TCP 78 [TCP Dup ACK 73#3] 22 → 58518 [ACK] Seq=21313 Ack=1825 Win=1452 Len=0 TSval=7042256 TSecr=7591907 SLE=2313 SRE=3949
   91 0.855964619 192.168.1.16 → 10.6.15.144  SSH 554 Client: [TCP Fast Retransmission] , Encrypted packet (len=488)
   92 0.855976804 192.168.1.16 → 10.6.15.144  SSH 1514 Client: Encrypted packet (len=1448)
   93 0.906678081  10.6.15.144 → 192.168.1.16 SSH 1514 Server: Encrypted packet (len=1436)
   94 0.906707737 192.168.1.16 → 10.6.15.144  TCP 66 58518 → 22 [ACK] Seq=5397 Ack=22749 Win=2263 Len=0 TSval=7591983 TSecr=7042268
   95 0.906723040  10.6.15.144 → 192.168.1.16 SSH 134 Server: Encrypted packet (len=56)
   96 0.906729585 192.168.1.16 → 10.6.15.144  TCP 66 58518 → 22 [ACK] Seq=5397 Ack=22805 Win=2263 Len=0 TSval=7591983 TSecr=7042268
   97 0.906878026  10.6.15.144 → 192.168.1.16 SSH 1514 Server: Encrypted packet (len=1436)
   98 0.906887867 192.168.1.16 → 10.6.15.144  TCP 66 58518 → 22 [ACK] Seq=5397 Ack=24241 Win=2263 Len=0 TSval=7591983 TSecr=7042268
   99 0.907124917  10.6.15.144 → 192.168.1.16 SSH 1514 Server: Encrypted packet (len=1436)
  100 0.907138404 192.168.1.16 → 10.6.15.144  TCP 66 58518 → 22 [ACK] Seq=5397 Ack=25677 Win=2263 Len=0 TSval=7591983 TSecr=7042268
  101 0.907148606  10.6.15.144 → 192.168.1.16 SSH 138 Server: Encrypted packet (len=60)
  102 0.907153893 192.168.1.16 → 10.6.15.144  TCP 66 58518 → 22 [ACK] Seq=5397 Ack=25737 Win=2263 Len=0 TSval=7591983 TSecr=7042268
  103 0.975406379  10.6.15.144 → 192.168.1.16 SSH 1514 Server: Encrypted packet (len=1436)
  104 0.975429228 192.168.1.16 → 10.6.15.144  TCP 66 58518 → 22 [ACK] Seq=5397 Ack=27173 Win=2263 Len=0 TSval=7592000 TSecr=7042284
  105 0.975622353  10.6.15.144 → 192.168.1.16 SSH 1514 Server: Encrypted packet (len=1436)
  106 0.975629090 192.168.1.16 → 10.6.15.144  TCP 66 58518 → 22 [ACK] Seq=5397 Ack=28609 Win=2263 Len=0 TSval=7592000 TSecr=7042284
  107 0.975860404  10.6.15.144 → 192.168.1.16 SSH 1514 Server: Encrypted packet (len=1436)
  108 0.975867125 192.168.1.16 → 10.6.15.144  TCP 66 58518 → 22 [ACK] Seq=5397 Ack=30045 Win=2263 Len=0 TSval=7592000 TSecr=7042284
  109 0.976102474  10.6.15.144 → 192.168.1.16 SSH 1514 Server: Encrypted packet (len=1436)
  110 0.976107267 192.168.1.16 → 10.6.15.144  TCP 66 58518 → 22 [ACK] Seq=5397 Ack=31481 Win=2263 Len=0 TSval=7592001 TSecr=7042284
  111 0.995805631  10.6.15.144 → 192.168.1.16 SSH 1514 Server: Encrypted packet (len=1436)
  112 0.995833177 192.168.1.16 → 10.6.15.144  TCP 66 58518 → 22 [ACK] Seq=5397 Ack=32917 Win=2263 Len=0 TSval=7592005 TSecr=7042286
  113 0.996004848  10.6.15.144 → 192.168.1.16 SSH 1514 Server: Encrypted packet (len=1436)
  114 0.996014267 192.168.1.16 → 10.6.15.144  TCP 66 58518 → 22 [ACK] Seq=5397 Ack=34353 Win=2263 Len=0 TSval=7592006 TSecr=7042286
  115 0.996283791  10.6.15.144 → 192.168.1.16 SSH 1514 Server: Encrypted packet (len=1436)
  116 0.996310862 192.168.1.16 → 10.6.15.144  TCP 66 58518 → 22 [ACK] Seq=5397 Ack=35789 Win=2263 Len=0 TSval=7592006 TSecr=7042286
  117 0.996456250  10.6.15.144 → 192.168.1.16 SSH 1514 Server: Encrypted packet (len=1436)
  118 0.996463162 192.168.1.16 → 10.6.15.144  TCP 66 58518 → 22 [ACK] Seq=5397 Ack=37225 Win=2263 Len=0 TSval=7592006 TSecr=7042286
  119 0.996711606  10.6.15.144 → 192.168.1.16 SSH 1514 Server: Encrypted packet (len=1436)
  120 0.996723823 192.168.1.16 → 10.6.15.144  TCP 66 58518 → 22 [ACK] Seq=5397 Ack=38661 Win=2263 Len=0 TSval=7592006 TSecr=7042288
  121 1.026097790  10.6.15.144 → 192.168.1.16 SSH 1514 Server: Encrypted packet (len=1436)
  122 1.026121349 192.168.1.16 → 10.6.15.144  TCP 66 58518 → 22 [ACK] Seq=5397 Ack=40097 Win=2263 Len=0 TSval=7592013 TSecr=7042296
  123 1.026331517  10.6.15.144 → 192.168.1.16 SSH 1514 Server: Encrypted packet (len=1436)
  124 1.026349051 192.168.1.16 → 10.6.15.144  TCP 66 58518 → 22 [ACK] Seq=5397 Ack=41533 Win=2263 Len=0 TSval=7592013 TSecr=7042296
  125 1.026571946  10.6.15.144 → 192.168.1.16 SSH 1514 Server: Encrypted packet (len=1436)
  126 1.035227788  10.6.15.144 → 192.168.1.16 SSH 1514 Server: Encrypted packet (len=1436)
  127 1.035254933 192.168.1.16 → 10.6.15.144  TCP 66 58518 → 22 [ACK] Seq=5397 Ack=44405 Win=2263 Len=0 TSval=7592015 TSecr=7042296
  128 1.035396969  10.6.15.144 → 192.168.1.16 SSH 1514 Server: Encrypted packet (len=1436)
  129 1.035640306  10.6.15.144 → 192.168.1.16 SSH 1514 Server: Encrypted packet (len=1436)
  130 1.035651168 192.168.1.16 → 10.6.15.144  TCP 66 58518 → 22 [ACK] Seq=5397 Ack=47277 Win=2263 Len=0 TSval=7592015 TSecr=7042299
  131 1.035748966  10.6.15.144 → 192.168.1.16 SSH 794 Server: Encrypted packet (len=716)
  132 1.035776614 192.168.1.16 → 10.6.15.144  TCP 66 58518 → 22 [ACK] Seq=5397 Ack=47993 Win=2263 Len=0 TSval=7592015 TSecr=7042299
  133 1.080008340 192.168.1.16 → 10.6.15.144  TCP 554 [TCP Retransmission] 58518 → 22 [PSH, ACK] Seq=1825 Ack=47993 Win=2263 Len=488 TSval=7592027 TSecr=7042299
  134 1.088351093  10.6.15.144 → 192.168.1.16 TCP 66 22 → 58518 [ACK] Seq=47993 Ack=3949 Win=1443 Len=0 TSval=7042312 TSecr=7592027
  135 1.088372094 192.168.1.16 → 10.6.15.144  TCP 1514 [TCP Retransmission] 58518 → 22 [ACK] Seq=3949 Ack=47993 Win=2263 Len=1448 TSval=7592029 TSecr=7042312
  136 1.088383209 192.168.1.16 → 10.6.15.144  SSH 334 Client: Encrypted packet (len=268)
  137 1.093915970  10.6.15.144 → 192.168.1.16 TCP 66 22 → 58518 [ACK] Seq=47993 Ack=5665 Win=1447 Len=0 TSval=7042315 TSecr=7592029
  138 1.096109620  10.6.15.144 → 192.168.1.16 SSH 150 Server: Encrypted packet (len=84)
  139 1.096185899 192.168.1.16 → 10.6.15.144  TCP 66 58518 → 22 [ACK] Seq=5665 Ack=48077 Win=2263 Len=0 TSval=7592031 TSecr=7042316
  140 2.800935123  10.6.15.144 → 192.168.1.16 SSH 1038 Server: Encrypted packet (len=972)
  141 2.800961647 192.168.1.16 → 10.6.15.144  TCP 66 58518 → 22 [ACK] Seq=5665 Ack=49049 Win=2263 Len=0 TSval=7592457 TSecr=7042343
  142 2.801035469  10.6.15.144 → 192.168.1.16 SSH 454 Server: Encrypted packet (len=388)
  143 2.801039936 192.168.1.16 → 10.6.15.144  TCP 66 58518 → 22 [ACK] Seq=5665 Ack=49437 Win=2263 Len=0 TSval=7592457 TSecr=7042343
  144 2.801423306  10.6.15.144 → 192.168.1.16 SSH 454 Server: [TCP Spurious Retransmission] , Encrypted packet (len=388)
  145 2.801432104 192.168.1.16 → 10.6.15.144  TCP 78 [TCP Dup ACK 143#1] 58518 → 22 [ACK] Seq=5665 Ack=49437 Win=2263 Len=0 TSval=7592457 TSecr=7042357 SLE=49049 SRE=49437
  146 2.801691683 192.168.1.16 → 10.6.15.144  SSH 142 Client: Encrypted packet (len=76)
  147 2.801801695  10.6.15.144 → 192.168.1.16 SSH 1514 Server: Encrypted packet (len=1448)
  148 2.802039959  10.6.15.144 → 192.168.1.16 SSH 1514 Server: Encrypted packet (len=1448)
  149 2.802046454 192.168.1.16 → 10.6.15.144  TCP 66 58518 → 22 [ACK] Seq=5741 Ack=52333 Win=2263 Len=0 TSval=7592457 TSecr=7042362
  150 2.802055713  10.6.15.144 → 192.168.1.16 SSH 110 Server: Encrypted packet (len=44)
  151 2.802306051  10.6.15.144 → 192.168.1.16 SSH 1514 Server: Encrypted packet (len=1448)
  152 2.802313563 192.168.1.16 → 10.6.15.144  TCP 66 58518 → 22 [ACK] Seq=5741 Ack=53825 Win=2263 Len=0 TSval=7592457 TSecr=7042362
  153 2.802547334  10.6.15.144 → 192.168.1.16 TCP 1426 [TCP Out-Of-Order] 22 → 58518 [PSH, ACK] Seq=48077 Ack=5665 Win=1452 Len=1360 TSval=7042437 TSecr=7592031
  154 2.802553710 192.168.1.16 → 10.6.15.144  TCP 78 [TCP Dup ACK 152#1] 58518 → 22 [ACK] Seq=5741 Ack=53825 Win=2263 Len=0 TSval=7592457 TSecr=7042362 SLE=48077 SRE=49437
  155 2.802775369  10.6.15.144 → 192.168.1.16 TCP 1426 [TCP Out-Of-Order] 22 → 58518 [PSH, ACK] Seq=48077 Ack=5665 Win=1452 Len=1360 TSval=7042559 TSecr=7592031
  156 2.802778363 192.168.1.16 → 10.6.15.144  TCP 78 [TCP Dup ACK 152#2] 58518 → 22 [ACK] Seq=5741 Ack=53825 Win=2263 Len=0 TSval=7592457 TSecr=7042362 SLE=48077 SRE=49437
  157 2.802782880  10.22.18.98 → 224.0.0.252  LLMNR 64 Standard query 0x496a A wpad
  158 2.802794254  10.22.18.98 → 224.0.0.252  LLMNR 64 Standard query 0x1d07 A wpad
  159 2.805598092  10.6.15.144 → 192.168.1.16 SSH 1514 Server: [TCP Spurious Retransmission] , Encrypted packet (len=1448)
  160 2.805616729 192.168.1.16 → 10.6.15.144  TCP 78 [TCP Dup ACK 152#3] 58518 → 22 [ACK] Seq=5741 Ack=53825 Win=2263 Len=0 TSval=7592458 TSecr=7042362 SLE=49437 SRE=50885
  161 2.805806041  10.6.15.144 → 192.168.1.16 SSH 1514 Server: [TCP Spurious Retransmission] , Encrypted packet (len=1448)
  162 2.805816402 192.168.1.16 → 10.6.15.144  TCP 78 [TCP Dup ACK 152#4] 58518 → 22 [ACK] Seq=5741 Ack=53825 Win=2263 Len=0 TSval=7592458 TSecr=7042362 SLE=50885 SRE=52333
  163 2.805827873  10.6.15.144 → 192.168.1.16 SSH 110 Server: [TCP Spurious Retransmission] , Encrypted packet (len=44)
  164 2.805830586 192.168.1.16 → 10.6.15.144  TCP 78 [TCP Dup ACK 152#5] 58518 → 22 [ACK] Seq=5741 Ack=53825 Win=2263 Len=0 TSval=7592458 TSecr=7042362 SLE=52333 SRE=52377
  165 2.806050639  10.6.15.144 → 192.168.1.16 SSH 1514 Server: [TCP Spurious Retransmission] , Encrypted packet (len=1448)
  166 2.806064686 192.168.1.16 → 10.6.15.144  TCP 78 [TCP Dup ACK 152#6] 58518 → 22 [ACK] Seq=5741 Ack=53825 Win=2263 Len=0 TSval=7592458 TSecr=7042743 SLE=52377 SRE=53825
  167 2.806304057  10.6.15.144 → 192.168.1.16 SSH 1514 Server: Encrypted packet (len=1448)
  168 2.806311338 192.168.1.16 → 10.6.15.144  TCP 66 58518 → 22 [ACK] Seq=5741 Ack=55273 Win=2263 Len=0 TSval=7592458 TSecr=7042743
  169 2.806676823  10.6.15.144 → 192.168.1.16 SSH 1514 Server: Encrypted packet (len=1448)
  170 2.806683047 192.168.1.16 → 10.6.15.144  TCP 66 58518 → 22 [ACK] Seq=5741 Ack=56721 Win=2263 Len=0 TSval=7592458 TSecr=7042743
  171 2.806921635  10.6.15.144 → 192.168.1.16 SSH 1514 Server: Encrypted packet (len=1448)
  172 2.806928069 192.168.1.16 → 10.6.15.144  TCP 66 58518 → 22 [ACK] Seq=5741 Ack=58169 Win=2263 Len=0 TSval=7592458 TSecr=7042743
  173 2.812639901  10.6.15.144 → 192.168.1.16 SSH 1514 Server: Encrypted packet (len=1448)
  174 2.812658520 192.168.1.16 → 10.6.15.144  TCP 66 58518 → 22 [ACK] Seq=5741 Ack=59617 Win=2263 Len=0 TSval=7592460 TSecr=7042745
  175 2.842344215  10.6.15.144 → 192.168.1.16 SSH 1514 Server: Encrypted packet (len=1448)
  176 2.842363964 192.168.1.16 → 10.6.15.144  TCP 66 58518 → 22 [ACK] Seq=5741 Ack=61065 Win=2263 Len=0 TSval=7592467 TSecr=7042751
  177 2.847625309  10.6.15.144 → 192.168.1.16 SSH 1514 Server: Encrypted packet (len=1448)
  178 2.847653672 192.168.1.16 → 10.6.15.144  TCP 66 58518 → 22 [ACK] Seq=5741 Ack=62513 Win=2263 Len=0 TSval=7592468 TSecr=7042753
  179 2.853461843  10.6.15.144 → 192.168.1.16 SSH 1514 Server: Encrypted packet (len=1448)
  180 2.853476936 192.168.1.16 → 10.6.15.144  TCP 66 58518 → 22 [ACK] Seq=5741 Ack=63961 Win=2263 Len=0 TSval=7592470 TSecr=7042753
  181 2.853699935  10.6.15.144 → 192.168.1.16 SSH 1514 Server: Encrypted packet (len=1448)
  182 2.853706327 192.168.1.16 → 10.6.15.144  TCP 66 58518 → 22 [ACK] Seq=5741 Ack=65409 Win=2263 Len=0 TSval=7592470 TSecr=7042753
  183 2.853936013  10.6.15.144 → 192.168.1.16 SSH 1514 Server: Encrypted packet (len=1448)
  184 2.853942939 192.168.1.16 → 10.6.15.144  TCP 66 58518 → 22 [ACK] Seq=5741 Ack=66857 Win=2263 Len=0 TSval=7592470 TSecr=7042753
  185 2.924030038 192.168.1.16 → 10.6.15.144  SSH 182 Client: Encrypted packet (len=116)
  186 2.941567072 192.168.1.16 → 10.6.15.144  SSH 102 Client: Encrypted packet (len=36)
  187 2.975971994 192.168.1.16 → 10.6.15.144  SSH 110 Client: Encrypted packet (len=44)
  188 3.010448464  10.6.15.144 → 192.168.1.16 SSH 1514 Server: Encrypted packet (len=1448)
  189 3.010478003 192.168.1.16 → 10.6.15.144  TCP 66 58518 → 22 [ACK] Seq=5937 Ack=68305 Win=2263 Len=0 TSval=7592509 TSecr=7042794
  190 3.010569377  10.6.15.144 → 192.168.1.16 SSH 1514 Server: Encrypted packet (len=1448)
  191 3.010574137 192.168.1.16 → 10.6.15.144  TCP 66 58518 → 22 [ACK] Seq=5937 Ack=69753 Win=2263 Len=0 TSval=7592509 TSecr=7042794
  192 3.010767608  10.6.15.144 → 192.168.1.16 SSH 1514 Server: Encrypted packet (len=1448)
  193 3.010777623 192.168.1.16 → 10.6.15.144  TCP 66 58518 → 22 [ACK] Seq=5937 Ack=71201 Win=2263 Len=0 TSval=7592509 TSecr=7042794
  194 3.010958008  10.6.15.144 → 192.168.1.16 SSH 1514 Server: Encrypted packet (len=1448)
  195 3.010971418  10.6.15.144 → 192.168.1.16 TCP 66 22 → 58518 [ACK] Seq=72649 Ack=5937 Win=1452 Len=0 TSval=7042794 TSecr=7592492
  196 3.013079659  10.6.15.144 → 192.168.1.16 SSH 1514 Server: Encrypted packet (len=1448)
  197 3.013096152 192.168.1.16 → 10.6.15.144  TCP 66 58518 → 22 [ACK] Seq=5937 Ack=74097 Win=2263 Len=0 TSval=7592510 TSecr=7042794
  198 3.013261279  10.6.15.144 → 192.168.1.16 SSH 1514 Server: Encrypted packet (len=1448)
  199 3.016442567  10.6.15.144 → 192.168.1.16 SSH 1514 Server: Encrypted packet (len=1448)
  200 3.016461175 192.168.1.16 → 10.6.15.144  TCP 66 58518 → 22 [ACK] Seq=5937 Ack=76993 Win=2263 Len=0 TSval=7592511 TSecr=7042795
  201 3.016623093  10.6.15.144 → 192.168.1.16 SSH 1514 Server: Encrypted packet (len=1448)
  202 3.016732605 192.168.1.16 → 10.6.15.144  SSH 102 Client: Encrypted packet (len=36)
  203 3.016977143  10.6.15.144 → 192.168.1.16 SSH 1514 Server: Encrypted packet (len=1448)
  204 3.017174456  10.6.15.144 → 192.168.1.16 SSH 1514 Server: Encrypted packet (len=1448)
  205 3.017182756 192.168.1.16 → 10.6.15.144  TCP 66 58518 → 22 [ACK] Seq=5973 Ack=81337 Win=2263 Len=0 TSval=7592511 TSecr=7042796
  206 3.020578285  10.6.15.144 → 192.168.1.16 SSH 1514 Server: Encrypted packet (len=1448)
  207 3.020754383  10.6.15.144 → 192.168.1.16 SSH 1514 Server: Encrypted packet (len=1448)
  208 3.020760042 192.168.1.16 → 10.6.15.144  TCP 66 58518 → 22 [ACK] Seq=5973 Ack=84233 Win=2263 Len=0 TSval=7592512 TSecr=7042797
  209 3.020946191  10.6.15.144 → 192.168.1.16 SSH 1514 Server: Encrypted packet (len=1448)
  210 3.021133948  10.6.15.144 → 192.168.1.16 SSH 1514 Server: Encrypted packet (len=1448)
  211 3.021142190 192.168.1.16 → 10.6.15.144  TCP 66 58518 → 22 [ACK] Seq=5973 Ack=87129 Win=2263 Len=0 TSval=7592512 TSecr=7042797
  212 3.022441936 192.168.1.16 → 10.6.15.144  SSH 198 Client: Encrypted packet (len=132)
  213 3.023541045  10.6.15.144 → 192.168.1.16 SSH 1514 Server: Encrypted packet (len=1448)
  214 3.023727054  10.6.15.144 → 192.168.1.16 SSH 1514 Server: Encrypted packet (len=1448)
  215 3.023735112 192.168.1.16 → 10.6.15.144  TCP 66 58518 → 22 [ACK] Seq=6105 Ack=90025 Win=2263 Len=0 TSval=7592512 TSecr=7042798
  216 3.024071615  10.6.15.144 → 192.168.1.16 SSH 1514 Server: Encrypted packet (len=1448)
  217 3.024264075  10.6.15.144 → 192.168.1.16 SSH 1514 Server: Encrypted packet (len=1448)
  218 3.024269799 192.168.1.16 → 10.6.15.144  TCP 66 58518 → 22 [ACK] Seq=6105 Ack=92921 Win=2263 Len=0 TSval=7592513 TSecr=7042798
  219 3.027574944  10.6.15.144 → 192.168.1.16 SSH 1514 Server: Encrypted packet (len=1448)
  220 3.027754587  10.6.15.144 → 192.168.1.16 SSH 1514 Server: Encrypted packet (len=1448)
  221 3.027762195 192.168.1.16 → 10.6.15.144  TCP 66 58518 → 22 [ACK] Seq=6105 Ack=95817 Win=2263 Len=0 TSval=7592513 TSecr=7042799
  222 3.027959994  10.6.15.144 → 192.168.1.16 SSH 1514 Server: Encrypted packet (len=1448)
  223 3.028139773  10.6.15.144 → 192.168.1.16 SSH 1514 Server: Encrypted packet (len=1448)
  224 3.028147293 192.168.1.16 → 10.6.15.144  TCP 66 58518 → 22 [ACK] Seq=6105 Ack=98713 Win=2263 Len=0 TSval=7592514 TSecr=7042799
  225 3.030709827  10.6.15.144 → 192.168.1.16 SSH 1514 Server: Encrypted packet (len=1448)
  226 3.030892652  10.6.15.144 → 192.168.1.16 SSH 1514 Server: Encrypted packet (len=1448)
  227 3.030901078 192.168.1.16 → 10.6.15.144  TCP 66 58518 → 22 [ACK] Seq=6105 Ack=101609 Win=2263 Len=0 TSval=7592514 TSecr=7042799
  228 3.031085075  10.6.15.144 → 192.168.1.16 SSH 1514 Server: Encrypted packet (len=1448)
  229 3.031277025  10.6.15.144 → 192.168.1.16 SSH 1514 Server: Encrypted packet (len=1448)
  230 3.031285730 192.168.1.16 → 10.6.15.144  TCP 66 58518 → 22 [ACK] Seq=6105 Ack=104505 Win=2263 Len=0 TSval=7592514 TSecr=7042799
  231 3.035128593  10.6.15.144 → 192.168.1.16 SSH 1514 Server: Encrypted packet (len=1448)
  232 3.035305454  10.6.15.144 → 192.168.1.16 SSH 1514 Server: Encrypted packet (len=1448)
  233 3.035313036 192.168.1.16 → 10.6.15.144  TCP 66 58518 → 22 [ACK] Seq=6105 Ack=107401 Win=2263 Len=0 TSval=7592515 TSecr=7042800
  234 3.035498453  10.6.15.144 → 192.168.1.16 SSH 1514 Server: Encrypted packet (len=1448)
  235 3.035691151  10.6.15.144 → 192.168.1.16 SSH 1514 Server: Encrypted packet (len=1448)
  236 3.035698782 192.168.1.16 → 10.6.15.144  TCP 66 58518 → 22 [ACK] Seq=6105 Ack=110297 Win=2263 Len=0 TSval=7592515 TSecr=7042800
  237 3.035802529 192.168.1.16 → 10.6.15.144  SSH 102 Client: Encrypted packet (len=36)
  238 3.035882438  10.6.15.144 → 192.168.1.16 SSH 1514 Server: Encrypted packet (len=1448)
  239 3.036076238  10.6.15.144 → 192.168.1.16 SSH 1514 Server: Encrypted packet (len=1448)
  240 3.036083291 192.168.1.16 → 10.6.15.144  TCP 66 58518 → 22 [ACK] Seq=6141 Ack=113193 Win=2263 Len=0 TSval=7592516 TSecr=7042800
  241 3.038456705  10.6.15.144 → 192.168.1.16 SSH 1514 Server: Encrypted packet (len=1448)
  242 3.038771837  10.6.15.144 → 192.168.1.16 SSH 1514 Server: Encrypted packet (len=1448)
  243 3.038786105 192.168.1.16 → 10.6.15.144  TCP 66 58518 → 22 [ACK] Seq=6141 Ack=116089 Win=2263 Len=0 TSval=7592516 TSecr=7042801
  244 3.038960283  10.6.15.144 → 192.168.1.16 SSH 1514 Server: Encrypted packet (len=1448)
  245 3.039126182 192.168.1.16 → 10.6.15.144  SSH 358 Client: Encrypted packet (len=292)
  246 3.039157450  10.6.15.144 → 192.168.1.16 SSH 1514 Server: Encrypted packet (len=1448)
  247 3.039500931  10.6.15.144 → 192.168.1.16 SSH 1514 Server: Encrypted packet (len=1448)
  248 3.039514582 192.168.1.16 → 10.6.15.144  TCP 66 58518 → 22 [ACK] Seq=6433 Ack=120433 Win=2263 Len=0 TSval=7592516 TSecr=7042801
  249 3.039688160  10.6.15.144 → 192.168.1.16 SSH 1514 Server: Encrypted packet (len=1448)
  250 3.040347725 192.168.1.16 → 10.6.15.144  SSH 138 Client: Encrypted packet (len=72)
  251 3.042632142  10.6.15.144 → 192.168.1.16 SSH 1514 Server: Encrypted packet (len=1448)
  252 3.042813212  10.6.15.144 → 192.168.1.16 SSH 1514 Server: Encrypted packet (len=1448)
  253 3.042822611 192.168.1.16 → 10.6.15.144  TCP 66 58518 → 22 [ACK] Seq=6505 Ack=124777 Win=2263 Len=0 TSval=7592517 TSecr=7042802
  254 3.043004694  10.6.15.144 → 192.168.1.16 SSH 1514 Server: Encrypted packet (len=1448)
  255 3.043196658  10.6.15.144 → 192.168.1.16 SSH 1514 Server: Encrypted packet (len=1448)
  256 3.043204401 192.168.1.16 → 10.6.15.144  TCP 66 58518 → 22 [ACK] Seq=6505 Ack=127673 Win=2263 Len=0 TSval=7592517 TSecr=7042802
  257 3.043388787  10.6.15.144 → 192.168.1.16 SSH 1514 Server: Encrypted packet (len=1448)
  258 3.043734039  10.6.15.144 → 192.168.1.16 SSH 1514 Server: Encrypted packet (len=1448)
  259 3.043743616 192.168.1.16 → 10.6.15.144  TCP 66 58518 → 22 [ACK] Seq=6505 Ack=130569 Win=2263 Len=0 TSval=7592517 TSecr=7042802
  260 3.046422767  10.6.15.144 → 192.168.1.16 SSH 1514 Server: Encrypted packet (len=1448)
  261 3.046603467  10.6.15.144 → 192.168.1.16 SSH 1514 Server: Encrypted packet (len=1448)
  262 3.046614911 192.168.1.16 → 10.6.15.144  TCP 66 58518 → 22 [ACK] Seq=6505 Ack=133465 Win=2263 Len=0 TSval=7592518 TSecr=7042803
  263 3.046794973  10.6.15.144 → 192.168.1.16 SSH 1514 Server: Encrypted packet (len=1448)
  264 3.046987860  10.6.15.144 → 192.168.1.16 SSH 1514 Server: Encrypted packet (len=1448)
  265 3.046995306 192.168.1.16 → 10.6.15.144  TCP 66 58518 → 22 [ACK] Seq=6505 Ack=136361 Win=2263 Len=0 TSval=7592518 TSecr=7042803
  266 3.047181093  10.6.15.144 → 192.168.1.16 SSH 1514 Server: Encrypted packet (len=1448)
  267 3.047372270  10.6.15.144 → 192.168.1.16 SSH 1514 Server: Encrypted packet (len=1448)
  268 3.047380372 192.168.1.16 → 10.6.15.144  TCP 66 58518 → 22 [ACK] Seq=6505 Ack=139257 Win=2263 Len=0 TSval=7592518 TSecr=7042803
  269 3.049531880  10.6.15.144 → 192.168.1.16 SSH 1514 Server: Encrypted packet (len=1448)
  270 3.049710867  10.6.15.144 → 192.168.1.16 SSH 1514 Server: Encrypted packet (len=1448)
  271 3.049722637 192.168.1.16 → 10.6.15.144  TCP 66 58518 → 22 [ACK] Seq=6505 Ack=142153 Win=2263 Len=0 TSval=7592519 TSecr=7042804
  272 3.050060462  10.6.15.144 → 192.168.1.16 SSH 1514 Server: Encrypted packet (len=1448)
  273 3.050249165  10.6.15.144 → 192.168.1.16 SSH 1514 Server: Encrypted packet (len=1448)
  274 3.050258917 192.168.1.16 → 10.6.15.144  TCP 66 58518 → 22 [ACK] Seq=6505 Ack=145049 Win=2263 Len=0 TSval=7592519 TSecr=7042804
  275 3.050596331  10.6.15.144 → 192.168.1.16 SSH 1514 Server: Encrypted packet (len=1448)
  276 3.050788807  10.6.15.144 → 192.168.1.16 SSH 1514 Server: Encrypted packet (len=1448)
  277 3.050800332 192.168.1.16 → 10.6.15.144  TCP 66 58518 → 22 [ACK] Seq=6505 Ack=147945 Win=2263 Len=0 TSval=7592519 TSecr=7042804
  278 3.055375087  10.6.15.144 → 192.168.1.16 SSH 1514 Server: Encrypted packet (len=1448)
  279 3.055581154  10.6.15.144 → 192.168.1.16 SSH 1514 Server: Encrypted packet (len=1448)
  280 3.055591146 192.168.1.16 → 10.6.15.144  TCP 66 58518 → 22 [ACK] Seq=6505 Ack=150841 Win=2263 Len=0 TSval=7592520 TSecr=7042805
  281 3.055795416  10.6.15.144 → 192.168.1.16 SSH 1514 Server: Encrypted packet (len=1448)
  282 3.056010270  10.6.15.144 → 192.168.1.16 SSH 1514 Server: Encrypted packet (len=1448)
  283 3.056018172 192.168.1.16 → 10.6.15.144  TCP 66 58518 → 22 [ACK] Seq=6505 Ack=153737 Win=2263 Len=0 TSval=7592521 TSecr=7042805
  284 3.056223629  10.6.15.144 → 192.168.1.16 SSH 1514 Server: Encrypted packet (len=1448)
  285 3.056435402  10.6.15.144 → 192.168.1.16 SSH 1514 Server: Encrypted packet (len=1448)
  286 3.056440346 192.168.1.16 → 10.6.15.144  TCP 66 58518 → 22 [ACK] Seq=6505 Ack=156633 Win=2263 Len=0 TSval=7592521 TSecr=7042805
  287 3.059109367  10.6.15.144 → 192.168.1.16 SSH 1514 Server: Encrypted packet (len=1448)
  288 3.059317848  10.6.15.144 → 192.168.1.16 SSH 1514 Server: Encrypted packet (len=1448)
  289 3.059329435 192.168.1.16 → 10.6.15.144  TCP 66 58518 → 22 [ACK] Seq=6505 Ack=159529 Win=2263 Len=0 TSval=7592521 TSecr=7042806
  290 3.059532299  10.6.15.144 → 192.168.1.16 SSH 1514 Server: Encrypted packet (len=1448)
  291 3.059743074  10.6.15.144 → 192.168.1.16 SSH 1514 Server: Encrypted packet (len=1448)
  292 3.059752181 192.168.1.16 → 10.6.15.144  TCP 66 58518 → 22 [ACK] Seq=6505 Ack=162425 Win=2263 Len=0 TSval=7592521 TSecr=7042806
  293 3.059984290  10.6.15.144 → 192.168.1.16 SSH 1514 Server: Encrypted packet (len=1448)
  294 3.060172974  10.6.15.144 → 192.168.1.16 SSH 1514 Server: Encrypted packet (len=1448)
  295 3.060180721 192.168.1.16 → 10.6.15.144  TCP 66 58518 → 22 [ACK] Seq=6505 Ack=165321 Win=2263 Len=0 TSval=7592522 TSecr=7042806
  296 3.065831063  10.6.15.144 → 192.168.1.16 SSH 1514 Server: Encrypted packet (len=1448)
  297 3.066035287  10.6.15.144 → 192.168.1.16 SSH 1514 Server: Encrypted packet (len=1448)
  298 3.066043296 192.168.1.16 → 10.6.15.144  TCP 66 58518 → 22 [ACK] Seq=6505 Ack=168217 Win=2263 Len=0 TSval=7592523 TSecr=7042808
  299 3.066248265  10.6.15.144 → 192.168.1.16 SSH 1514 Server: Encrypted packet (len=1448)
  300 3.066463686  10.6.15.144 → 192.168.1.16 SSH 1514 Server: Encrypted packet (len=1448)
  301 3.066469117 192.168.1.16 → 10.6.15.144  TCP 66 58518 → 22 [ACK] Seq=6505 Ack=171113 Win=2263 Len=0 TSval=7592523 TSecr=7042808
  302 3.066675767  10.6.15.144 → 192.168.1.16 SSH 1514 Server: Encrypted packet (len=1448)
  303 3.066888243  10.6.15.144 → 192.168.1.16 SSH 1514 Server: Encrypted packet (len=1448)
  304 3.066890815 192.168.1.16 → 10.6.15.144  TCP 66 58518 → 22 [ACK] Seq=6505 Ack=174009 Win=2263 Len=0 TSval=7592523 TSecr=7042808
  305 3.067253122  10.6.15.144 → 192.168.1.16 SSH 1514 Server: Encrypted packet (len=1448)
  306 3.067472326  10.6.15.144 → 192.168.1.16 SSH 1514 Server: Encrypted packet (len=1448)
  307 3.067475893 192.168.1.16 → 10.6.15.144  TCP 66 58518 → 22 [ACK] Seq=6505 Ack=176905 Win=2263 Len=0 TSval=7592523 TSecr=7042808
  308 3.069663936  10.6.15.144 → 192.168.1.16 SSH 1514 Server: Encrypted packet (len=1448)
  309 3.069864564  10.6.15.144 → 192.168.1.16 SSH 1514 Server: Encrypted packet (len=1448)
  310 3.069870155 192.168.1.16 → 10.6.15.144  TCP 66 58518 → 22 [ACK] Seq=6505 Ack=179801 Win=2263 Len=0 TSval=7592524 TSecr=7042809
  311 3.070221619  10.6.15.144 → 192.168.1.16 SSH 1514 Server: Encrypted packet (len=1448)
  312 3.070424364  10.6.15.144 → 192.168.1.16 SSH 1438 Server: Encrypted packet (len=1372)
  313 3.070428528 192.168.1.16 → 10.6.15.144  TCP 66 58518 → 22 [ACK] Seq=6505 Ack=182621 Win=2263 Len=0 TSval=7592524 TSecr=7042809
  314 3.072440571 192.168.1.16 → 10.6.15.144  SSH 230 Client: Encrypted packet (len=164)
  315 3.110367848  10.6.15.144 → 192.168.1.16 TCP 66 22 → 58518 [ACK] Seq=182621 Ack=6669 Win=1452 Len=0 TSval=7042820 TSecr=7592525
  316 3.144027395  10.22.18.98 → 224.0.0.252  LLMNR 64 Standard query 0x1d07 A wpad
  317 3.144047590  10.22.18.98 → 224.0.0.252  LLMNR 64 Standard query 0x496a A wpad
  318 3.626206065 192.168.1.16 → 10.6.15.144  SSH 190 Client: Encrypted packet (len=124)
  319 3.627902113  10.6.15.144 → 192.168.1.16 SSH 278 Server: Encrypted packet (len=212)
  320 3.628038665  10.6.15.144 → 192.168.1.16 SSH 102 Server: Encrypted packet (len=36)
  321 3.628076350 192.168.1.16 → 10.6.15.144  TCP 66 58518 → 22 [ACK] Seq=6793 Ack=182869 Win=2263 Len=0 TSval=7592664 TSecr=7042891
  322 3.628188246  10.6.15.144 → 192.168.1.16 SSH 138 Server: Encrypted packet (len=72)
  323 3.628331792  10.6.15.144 → 192.168.1.16 TCP 138 [TCP Retransmission] 22 → 58518 [PSH, ACK] Seq=182869 Ack=6669 Win=1452 Len=72 TSval=7042896 TSecr=7592525
  324 3.628340566 192.168.1.16 → 10.6.15.144  TCP 78 58518 → 22 [ACK] Seq=6793 Ack=182941 Win=2263 Len=0 TSval=7592664 TSecr=7042896 SLE=182869 SRE=182941
  325 3.628362134 192.168.1.16 → 10.6.15.144  SSH 102 Client: Encrypted packet (len=36)
  326 3.628473325  10.6.15.144 → 192.168.1.16 SSH 102 Server: Encrypted packet (len=36)
  327 3.628622715  10.6.15.144 → 192.168.1.16 SSH 138 Server: Encrypted packet (len=72)
  328 3.628651401 192.168.1.16 → 10.6.15.144  TCP 66 58518 → 22 [ACK] Seq=6829 Ack=183049 Win=2263 Len=0 TSval=7592664 TSecr=7042898
  329 3.628784656  10.6.15.144 → 192.168.1.16 SSH 262 Server: Encrypted packet (len=196)
  330 3.628937614  10.6.15.144 → 192.168.1.16 SSH 198 Server: Encrypted packet (len=132)
  331 3.628965150 192.168.1.16 → 10.6.15.144  TCP 66 58518 → 22 [ACK] Seq=6829 Ack=183377 Win=2263 Len=0 TSval=7592664 TSecr=7042910
  332 3.629070934  10.6.15.144 → 192.168.1.16 TCP 66 22 → 58518 [ACK] Seq=183377 Ack=6793 Win=1452 Len=0 TSval=7042949 TSecr=7592663
  333 3.629080687 192.168.1.16 → 10.6.15.144  SSH 102 Client: Encrypted packet (len=36)
  334 3.630626578  10.6.15.144 → 192.168.1.16 TCP 66 22 → 58518 [ACK] Seq=183377 Ack=6829 Win=1452 Len=0 TSval=7042950 TSecr=7592664
  335 3.631370466 192.168.1.16 → 10.6.15.144  SSH 138 Client: Encrypted packet (len=72)
  336 3.631801288  10.6.15.144 → 192.168.1.16 TCP 66 22 → 58518 [ACK] Seq=183377 Ack=6865 Win=1452 Len=0 TSval=7042950 TSecr=7592664
  337 3.632929271 192.168.1.16 → 10.6.15.144  SSH 254 Client: Encrypted packet (len=188)
  338 3.635112868 192.168.1.16 → 10.6.15.144  SSH 102 Client: Encrypted packet (len=36)
  339 3.637068101 192.168.1.16 → 10.6.15.144  SSH 102 Client: Encrypted packet (len=36)
  340 3.637852635  10.6.15.144 → 192.168.1.16 TCP 66 22 → 58518 [ACK] Seq=183377 Ack=6937 Win=1452 Len=0 TSval=7042950 TSecr=7592664
  341 3.637872570 192.168.1.16 → 10.6.15.144  SSH 102 Client: Encrypted packet (len=36)
  342 3.637905647  10.6.15.144 → 192.168.1.16 SSH 102 Server: Encrypted packet (len=36)
  343 3.639681848  10.6.15.144 → 192.168.1.16 TCP 66 22 → 58518 [ACK] Seq=183413 Ack=7161 Win=1452 Len=0 TSval=7042951 TSecr=7592665
  344 3.639808474  10.6.15.144 → 192.168.1.16 TCP 66 22 → 58518 [ACK] Seq=183413 Ack=7233 Win=1452 Len=0 TSval=7042952 TSecr=7592666
  345 3.677362478  10.6.15.144 → 192.168.1.16 SSH 138 Server: Encrypted packet (len=72)
  346 3.677383626 192.168.1.16 → 10.6.15.144  TCP 66 58518 → 22 [ACK] Seq=7233 Ack=183485 Win=2263 Len=0 TSval=7592676 TSecr=7042950
  347 3.677613946 192.168.1.16 → 10.6.15.144  SSH 102 Client: Encrypted packet (len=36)
  348 3.682536854 192.168.1.16 → 10.6.15.144  SSH 102 Client: Encrypted packet (len=36)
  349 3.682768604 192.168.1.16 → 10.6.15.144  SSH 102 Client: Encrypted packet (len=36)
  350 3.684903376  10.6.15.144 → 192.168.1.16 TCP 66 22 → 58518 [ACK] Seq=183485 Ack=7305 Win=1452 Len=0 TSval=7042963 TSecr=7592676
  351 3.685201964 192.168.1.16 → 10.6.15.144  SSH 102 Client: Encrypted packet (len=36)
  352 3.685970086 192.168.1.16 → 10.6.15.144  SSH 102 Client: Encrypted packet (len=36)
  353 3.686154673 192.168.1.16 → 10.6.15.144  SSH 278 Client: Encrypted packet (len=212)
  354 3.688289626  10.6.15.144 → 192.168.1.16 TCP 66 22 → 58518 [ACK] Seq=183485 Ack=7377 Win=1452 Len=0 TSval=7042964 TSecr=7592677
  355 3.688305199 192.168.1.16 → 10.6.15.144  SSH 162 Client: Encrypted packet (len=96)
  356 3.688944935  10.6.15.144 → 192.168.1.16 TCP 66 22 → 58518 [ACK] Seq=183485 Ack=7625 Win=1452 Len=0 TSval=7042964 TSecr=7592678
  357 3.697615195  10.6.15.144 → 192.168.1.16 SSH 138 Server: Encrypted packet (len=72)
  358 3.697810795 192.168.1.16 → 10.6.15.144  SSH 102 Client: Encrypted packet (len=36)
  359 3.706985959  10.6.15.144 → 192.168.1.16 SSH 102 Server: Encrypted packet (len=36)
  360 3.707308696 192.168.1.16 → 10.6.15.144  SSH 214 Client: Encrypted packet (len=148)
  361 3.722349987  10.6.15.144 → 192.168.1.16 SSH 138 Server: Encrypted packet (len=72)
  362 3.722518418 192.168.1.16 → 10.6.15.144  SSH 102 Client: Encrypted packet (len=36)
  363 3.723979352  10.6.15.144 → 192.168.1.16 SSH 138 Server: Encrypted packet (len=72)
  364 3.724153162 192.168.1.16 → 10.6.15.144  SSH 102 Client: Encrypted packet (len=36)
  365 3.748196715  10.6.15.144 → 192.168.1.16 TCP 78 [TCP Dup ACK 359#1] 22 → 58518 [ACK] Seq=183737 Ack=7757 Win=1452 Len=0 TSval=7042979 TSecr=7592681 SLE=7905 SRE=7941
  366 3.748209190  10.6.15.144 → 192.168.1.16 TCP 78 [TCP Dup ACK 359#2] 22 → 58518 [ACK] Seq=183737 Ack=7757 Win=1452 Len=0 TSval=7042979 TSecr=7592681 SLE=7905 SRE=7977
  367 3.902786404 192.168.1.16 → 10.6.15.144  SSH 102 Client: Encrypted packet (len=36)
  368 3.904614397 10.22.18.209 → 224.0.0.252  LLMNR 64 Standard query 0x938f A wpad
  369 3.905057503  10.6.15.144 → 192.168.1.16 TCP 78 [TCP Dup ACK 359#3] 22 → 58518 [ACK] Seq=183737 Ack=7757 Win=1452 Len=0 TSval=7043018 TSecr=7592681 SLE=7905 SRE=8013
  370 3.905080083 192.168.1.16 → 10.6.15.144  SSH 214 Client: [TCP Fast Retransmission] , Encrypted packet (len=148)
  371 3.906956288  10.6.15.144 → 192.168.1.16 TCP 66 22 → 58518 [ACK] Seq=183737 Ack=8013 Win=1452 Len=0 TSval=7043019 TSecr=7592733
  372 3.906991230 192.168.1.16 → 10.6.15.144  SSH 102 Client: Encrypted packet (len=36)
  373 3.916439600  10.6.15.144 → 192.168.1.16 TCP 66 22 → 58518 [ACK] Seq=183737 Ack=8049 Win=1452 Len=0 TSval=7043019 TSecr=7592733
  374 3.916578461  10.22.18.98 → 224.0.0.252  LLMNR 74 Standard query 0xd4f1 A ttdpgfnnaxhyzx
  375 3.916594317  10.22.18.98 → 224.0.0.252  LLMNR 73 Standard query 0xa39e A cdmicaijmorfz
  376 3.925537742  10.6.15.144 → 192.168.1.16 SSH 238 Server: Encrypted packet (len=172)
  377 3.941385912 192.168.1.16 → 10.6.15.144  SSH 1350 Client: Encrypted packet (len=1284)
  378 3.991243288 192.168.1.16 → 10.6.15.144  SSH 102 Client: Encrypted packet (len=36)
  379 3.994820994 192.168.1.16 → 10.6.15.144  SSH 654 Client: Encrypted packet (len=588)
  380 3.995877408  10.6.15.144 → 192.168.1.16 TCP 66 22 → 58518 [ACK] Seq=183909 Ack=9369 Win=1452 Len=0 TSval=7043041 TSecr=7592742
  381 3.999951808  10.6.15.144 → 192.168.1.16 SSH 102 Server: Encrypted packet (len=36)
  382 3.999969885  10.6.15.144 → 192.168.1.16 SSH 102 Server: Encrypted packet (len=36)
  383 4.000016464 192.168.1.16 → 10.6.15.144  TCP 66 58518 → 22 [ACK] Seq=9957 Ack=183981 Win=2263 Len=0 TSval=7592757 TSecr=7043042
  384 4.003747884 10.22.18.209 → 224.0.0.252  LLMNR 64 Standard query 0x938f A wpad
  385 4.005995032  10.6.15.144 → 192.168.1.16 SSH 102 Server: Encrypted packet (len=36)
  386 4.006411853 192.168.1.16 → 10.6.15.144  SSH 158 Client: Encrypted packet (len=92)
  387 4.008777311  10.6.15.144 → 192.168.1.16 SSH 102 Server: Encrypted packet (len=36)
  388 4.009165203 192.168.1.16 → 10.6.15.144  SSH 126 Client: Encrypted packet (len=60)
  389 4.013841894  10.6.15.144 → 192.168.1.16 SSH 138 Server: Encrypted packet (len=72)
  390 4.014087770 192.168.1.16 → 10.6.15.144  SSH 102 Client: Encrypted packet (len=36)
  391 4.020830382  10.6.15.144 → 192.168.1.16 SSH 222 Server: Encrypted packet (len=156)
  392 4.021533169 192.168.1.16 → 10.6.15.144  SSH 158 Client: Encrypted packet (len=92)
  393 4.021854619  10.6.15.144 → 192.168.1.16 SSH 182 Server: Encrypted packet (len=116)
  394 4.034698037 192.168.1.16 → 10.6.15.144  SSH 606 Client: Encrypted packet (len=540)
  395 4.035107937 192.168.1.16 → 10.6.15.144  SSH 286 Client: Encrypted packet (len=220)
  396 4.049388063  10.6.15.144 → 192.168.1.16 TCP 78 [TCP Dup ACK 391#1] 22 → 58518 [ACK] Seq=184397 Ack=10109 Win=1452 Len=0 TSval=7043054 TSecr=7592759 SLE=10145 SRE=10237
  397 4.049416487 192.168.1.16 → 10.6.15.144  SSH 142 Client: Encrypted packet (len=76)
  398 4.049435718  10.6.15.144 → 192.168.1.16 TCP 78 [TCP Dup ACK 391#2] 22 → 58518 [ACK] Seq=184397 Ack=10109 Win=1452 Len=0 TSval=7043054 TSecr=7592759 SLE=10145 SRE=10777
  399 4.049443180  10.6.15.144 → 192.168.1.16 TCP 78 [TCP Dup ACK 391#3] 22 → 58518 [ACK] Seq=184397 Ack=10109 Win=1452 Len=0 TSval=7043054 TSecr=7592759 SLE=10145 SRE=10997
  400 4.049449350 192.168.1.16 → 10.6.15.144  SSH 102 Client: [TCP Fast Retransmission] , Encrypted packet (len=36)
  401 4.051914345  10.6.15.144 → 192.168.1.16 TCP 78 [TCP Dup ACK 391#4] 22 → 58518 [ACK] Seq=184397 Ack=10109 Win=1452 Len=0 TSval=7043055 TSecr=7592759 SLE=10145 SRE=11073
  402 4.051947534  10.6.15.144 → 192.168.1.16 TCP 66 22 → 58518 [ACK] Seq=184397 Ack=11073 Win=1445 Len=0 TSval=7043055 TSecr=7592769
  403 4.054647329  10.6.15.144 → 192.168.1.16 SSH 302 Server: Encrypted packet (len=236)
  404 4.059103020 192.168.1.16 → 10.6.15.144  SSH 134 Client: Encrypted packet (len=68)
  405 4.069996469  10.6.15.144 → 192.168.1.16 SSH 102 Server: Encrypted packet (len=36)
  406 4.072672087 192.168.1.16 → 10.6.15.144  SSH 182 Client: Encrypted packet (len=116)
  407 4.075437058  10.6.15.144 → 192.168.1.16 SSH 102 Server: Encrypted packet (len=36)
  408 4.079913791  10.6.15.144 → 192.168.1.16 SSH 262 Server: Encrypted packet (len=196)
  409 4.080007408 192.168.1.16 → 10.6.15.144  TCP 66 58518 → 22 [ACK] Seq=11257 Ack=184901 Win=2263 Len=0 TSval=7592777 TSecr=7043061
  410 4.088385590  10.6.15.144 → 192.168.1.16 SSH 142 Server: Encrypted packet (len=76)
  411 4.088555181  10.6.15.144 → 192.168.1.16 SSH 310 Server: Encrypted packet (len=244)
  412 4.088576925 192.168.1.16 → 10.6.15.144  TCP 66 58518 → 22 [ACK] Seq=11257 Ack=185221 Win=2263 Len=0 TSval=7592779 TSecr=7043063
  413 4.090025357 192.168.1.16 → 10.6.15.144  SSH 134 Client: Encrypted packet (len=68)
  414 4.132880455  10.6.15.144 → 192.168.1.16 TCP 66 22 → 58518 [ACK] Seq=185221 Ack=11325 Win=1452 Len=0 TSval=7043075 TSecr=7592779
  415 4.207023016  10.6.15.144 → 192.168.1.16 SSH 102 Server: Encrypted packet (len=36)
  416 4.208554998  10.6.15.144 → 192.168.1.16 SSH 102 Server: Encrypted packet (len=36)
  417 4.208611819 192.168.1.16 → 10.6.15.144  TCP 66 58518 → 22 [ACK] Seq=11325 Ack=185293 Win=2263 Len=0 TSval=7592809 TSecr=7043094
  418 4.208847845 192.168.1.16 → 10.6.15.144  SSH 206 Client: Encrypted packet (len=140)
  419 4.209186911  10.6.15.144 → 192.168.1.16 SSH 102 Server: Encrypted packet (len=36)
  420 4.210084422  10.6.15.144 → 192.168.1.16 TCP 66 22 → 58518 [ACK] Seq=185329 Ack=11465 Win=1452 Len=0 TSval=7043094 TSecr=7592809
  421 4.210096608  10.6.15.144 → 192.168.1.16 SSH 102 Server: Encrypted packet (len=36)
  422 4.210137995 192.168.1.16 → 10.6.15.144  TCP 66 58518 → 22 [ACK] Seq=11465 Ack=185365 Win=2263 Len=0 TSval=7592809 TSecr=7043094
  423 4.210320574 192.168.1.16 → 10.6.15.144  SSH 150 Client: Encrypted packet (len=84)
  424 4.253205977  10.6.15.144 → 192.168.1.16 TCP 66 22 → 58518 [ACK] Seq=185365 Ack=11549 Win=1452 Len=0 TSval=7043105 TSecr=7592809
  425 4.261170481  10.6.15.144 → 192.168.1.16 SSH 102 Server: Encrypted packet (len=36)
  426 4.264346502  10.6.15.144 → 192.168.1.16 SSH 102 Server: Encrypted packet (len=36)
  427 4.264403466 192.168.1.16 → 10.6.15.144  TCP 66 58518 → 22 [ACK] Seq=11549 Ack=185437 Win=2263 Len=0 TSval=7592823 TSecr=7043107
  428 4.277549988  10.6.15.144 → 192.168.1.16 SSH 102 Server: Encrypted packet (len=36)
  429 4.277882743 192.168.1.16 → 10.6.15.144  SSH 142 Client: Encrypted packet (len=76)
  430 4.279454280  10.6.15.144 → 192.168.1.16 TCP 66 22 → 58518 [ACK] Seq=185473 Ack=11625 Win=1452 Len=0 TSval=7043112 TSecr=7592826
  431 4.283535692  10.6.15.144 → 192.168.1.16 SSH 138 Server: Encrypted packet (len=72)
  432 4.283703338 192.168.1.16 → 10.6.15.144  SSH 102 Client: Encrypted packet (len=36)
  433 4.319014623  10.6.15.144 → 192.168.1.16 SSH 814 Server: Encrypted packet (len=748)
  434 4.319040019  10.6.15.144 → 192.168.1.16 SSH 102 Server: Encrypted packet (len=36)
  435 4.319096330 192.168.1.16 → 10.6.15.144  TCP 66 58518 → 22 [ACK] Seq=11661 Ack=186329 Win=2263 Len=0 TSval=7592836 TSecr=7043121
  436 4.320693312 192.168.1.16 → 10.6.15.144  SSH 138 Client: Encrypted packet (len=72)
  437 4.323723162  10.22.18.98 → 224.0.0.252  LLMNR 73 Standard query 0xa39e A cdmicaijmorfz
  438 4.324461959  10.22.18.98 → 224.0.0.252  LLMNR 74 Standard query 0xd4f1 A ttdpgfnnaxhyzx
  439 4.324483012  10.6.15.144 → 192.168.1.16 SSH 102 Server: Encrypted packet (len=36)
  440 4.367955578 192.168.1.16 → 10.6.15.144  TCP 66 58518 → 22 [ACK] Seq=11733 Ack=186365 Win=2263 Len=0 TSval=7592849 TSecr=7043122
  441 4.375184075  10.6.15.144 → 192.168.1.16 SSH 138 Server: Encrypted packet (len=72)
  442 4.375203793  10.6.15.144 → 192.168.1.16 SSH 138 Server: Encrypted packet (len=72)
  443 4.375259897 192.168.1.16 → 10.6.15.144  TCP 66 58518 → 22 [ACK] Seq=11733 Ack=186509 Win=2263 Len=0 TSval=7592850 TSecr=7043134
  444 4.375532277 192.168.1.16 → 10.6.15.144  SSH 138 Client: Encrypted packet (len=72)
  445 4.375638749  10.6.15.144 → 192.168.1.16 SSH 138 Server: Encrypted packet (len=72)
  446 4.378240537 192.168.1.16 → 10.6.15.144  SSH 102 Client: Encrypted packet (len=36)
  447 4.380443457  10.6.15.144 → 192.168.1.16 SSH 138 Server: Encrypted packet (len=72)
  448 4.380458680  10.6.15.144 → 192.168.1.16 SSH 190 Server: Encrypted packet (len=124)
  449 4.380501438 192.168.1.16 → 10.6.15.144  TCP 66 58518 → 22 [ACK] Seq=11841 Ack=186777 Win=2263 Len=0 TSval=7592852 TSecr=7043135
  450 4.383323357  10.6.15.144 → 192.168.1.16 SSH 1514 Server: Encrypted packet (len=1448)
  451 4.383450402  10.6.15.144 → 192.168.1.16 SSH 930 Server: Encrypted packet (len=864)
  452 4.383459062 192.168.1.16 → 10.6.15.144  TCP 66 58518 → 22 [ACK] Seq=11841 Ack=189089 Win=2263 Len=0 TSval=7592852 TSecr=7043136
  453 4.386173039  10.6.15.144 → 192.168.1.16 SSH 138 Server: Encrypted packet (len=72)
  454 4.387291074  10.6.15.144 → 192.168.1.16 SSH 138 Server: Encrypted packet (len=72)
  455 4.387306511 192.168.1.16 → 10.6.15.144  SSH 246 Client: Encrypted packet (len=180)
  456 4.387643787 192.168.1.16 → 10.6.15.144  SSH 102 Client: Encrypted packet (len=36)
  457 4.394126014  10.6.15.144 → 192.168.1.16 SSH 350 Server: Encrypted packet (len=284)
  458 4.394143088  10.6.15.144 → 192.168.1.16 SSH 102 Server: Encrypted packet (len=36)
  459 4.394193833 192.168.1.16 → 10.6.15.144  TCP 66 58518 → 22 [ACK] Seq=12057 Ack=189553 Win=2263 Len=0 TSval=7592855 TSecr=7043138
  460 4.395337641  10.6.15.144 → 192.168.1.16 TCP 66 22 → 58518 [ACK] Seq=189553 Ack=12057 Win=1452 Len=0 TSval=7043139 TSecr=7592853
  461 4.395358385  10.6.15.144 → 192.168.1.16 SSH 102 Server: Encrypted packet (len=36)
  462 4.395567460 192.168.1.16 → 10.6.15.144  SSH 138 Client: Encrypted packet (len=72)
  463 4.403640740  10.6.15.144 → 192.168.1.16 SSH 102 Server: Encrypted packet (len=36)
  464 4.418190197 192.168.1.16 → 10.6.15.144  SSH 190 Client: Encrypted packet (len=124)
  465 4.430212964  10.6.15.144 → 192.168.1.16 SSH 246 Server: Encrypted packet (len=180)
  466 4.430557069 192.168.1.16 → 10.6.15.144  SSH 134 Client: Encrypted packet (len=68)
  467 4.433977233  10.6.15.144 → 192.168.1.16 SSH 182 Server: Encrypted packet (len=116)
  468 4.434283406 192.168.1.16 → 10.6.15.144  SSH 134 Client: Encrypted packet (len=68)
  469 4.441772100 192.168.1.16 → 10.6.15.144  SSH 1382 Client: Encrypted packet (len=1316)
  470 4.448277852  10.6.15.144 → 192.168.1.16 TCP 66 22 → 58518 [ACK] Seq=189921 Ack=12389 Win=1452 Len=0 TSval=7043151 TSecr=7592864
  471 4.465300411  10.6.15.144 → 192.168.1.16 SSH 174 Server: Encrypted packet (len=108)
  472 4.465570932  10.6.15.144 → 192.168.1.16 SSH 198 Server: Encrypted packet (len=132)
  473 4.465600673 192.168.1.16 → 10.6.15.144  TCP 66 58518 → 22 [ACK] Seq=13705 Ack=190161 Win=2263 Len=0 TSval=7592873 TSecr=7043153
  474 4.484703943  10.6.15.144 → 192.168.1.16 SSH 198 Server: [TCP Spurious Retransmission] , Encrypted packet (len=132)
  475 4.484727385 192.168.1.16 → 10.6.15.144  TCP 78 [TCP Dup ACK 473#1] 58518 → 22 [ACK] Seq=13705 Ack=190161 Win=2263 Len=0 TSval=7592878 TSecr=7043163 SLE=190029 SRE=190161
  476 4.659945554 192.168.1.16 → 10.6.15.144  TCP 1382 [TCP Retransmission] 58518 → 22 [PSH, ACK] Seq=12389 Ack=190161 Win=2263 Len=1316 TSval=7592922 TSecr=7043163
  477 4.706925256  10.6.15.144 → 192.168.1.16 SSH 494 Server: Encrypted packet (len=428)
  478 4.706957475 192.168.1.16 → 10.6.15.144  TCP 66 58518 → 22 [ACK] Seq=13705 Ack=190589 Win=2263 Len=0 TSval=7592933 TSecr=7043219
  479 4.706980788  10.6.15.144 → 192.168.1.16 SSH 102 Server: Encrypted packet (len=36)
  480 4.706991353 192.168.1.16 → 10.6.15.144  TCP 66 58518 → 22 [ACK] Seq=13705 Ack=190625 Win=2263 Len=0 TSval=7592933 TSecr=7043219
  481 4.708650289 192.168.1.16 → 10.6.15.144  SSH 138 Client: Encrypted packet (len=72)
  482 4.710034772  10.6.15.144 → 192.168.1.16 SSH 102 Server: Encrypted packet (len=36)
  483 4.751945674 192.168.1.16 → 10.6.15.144  TCP 66 58518 → 22 [ACK] Seq=13777 Ack=190661 Win=2263 Len=0 TSval=7592945 TSecr=7043219
  484 4.805895062  10.6.15.144 → 192.168.1.16 SSH 190 Server: Encrypted packet (len=124)
  485 4.805921457 192.168.1.16 → 10.6.15.144  TCP 66 58518 → 22 [ACK] Seq=13777 Ack=190785 Win=2263 Len=0 TSval=7592958 TSecr=7043242
  486 4.826479983 192.168.1.16 → 10.6.15.144  SSH 102 Client: Encrypted packet (len=36)
  487 4.836520299 192.168.1.16 → 10.6.15.144  SSH 110 Client: Encrypted packet (len=44)
  488 4.838222856  10.6.15.144 → 192.168.1.16 TCP 66 22 → 58518 [ACK] Seq=190785 Ack=13857 Win=1452 Len=0 TSval=7043251 TSecr=7592963
  489 5.242309016 192.168.1.16 → 10.6.15.144  SSH 518 Client: Encrypted packet (len=452)
  490 5.247845712  10.6.15.144 → 192.168.1.16 SSH 870 Server: Encrypted packet (len=804)
  491 5.247863112  10.6.15.144 → 192.168.1.16 SSH 102 Server: Encrypted packet (len=36)
  492 5.247875159  10.6.15.144 → 192.168.1.16 TCP 102 [TCP Retransmission] 22 → 58518 [PSH, ACK] Seq=191589 Ack=13857 Win=1452 Len=36 TSval=7043310 TSecr=7592963
  493 5.247882637 192.168.1.16 → 10.6.15.144  TCP 78 58518 → 22 [ACK] Seq=14309 Ack=191625 Win=2263 Len=0 TSval=7593068 TSecr=7043302 SLE=191589 SRE=191625
  494 5.247912234  10.6.15.144 → 192.168.1.16 SSH 102 Server: Encrypted packet (len=36)
  495 5.247914529 192.168.1.16 → 10.6.15.144  TCP 66 58518 → 22 [ACK] Seq=14309 Ack=191661 Win=2263 Len=0 TSval=7593068 TSecr=7043318
  496 5.248090459 89.161.158.40 → 192.168.1.16 TLSv1.2 112 Application Data
  497 5.248097730 192.168.1.16 → 89.161.158.40 TCP 66 46568 → 443 [ACK] Seq=1 Ack=47 Win=862 Len=0 TSval=7593069 TSecr=3366042374
  498 5.248123699 89.161.158.40 → 192.168.1.16 TLSv1.2 97 Encrypted Alert
  499 5.248127742 192.168.1.16 → 89.161.158.40 TCP 66 46568 → 443 [ACK] Seq=1 Ack=78 Win=862 Len=0 TSval=7593069 TSecr=3366042374
  500 5.248142123 89.161.158.40 → 192.168.1.16 TCP 66 443 → 46568 [FIN, ACK] Seq=78 Ack=1 Win=243 Len=0 TSval=3366042374 TSecr=7549512
  501 5.248166847  10.6.15.144 → 192.168.1.16 SSH 102 Server: Encrypted packet (len=36)
  502 5.248170514 192.168.1.16 → 10.6.15.144  TCP 66 58518 → 22 [ACK] Seq=14309 Ack=191697 Win=2263 Len=0 TSval=7593069 TSecr=7043341
  503 5.248265122 192.168.1.16 → 89.161.158.40 TCP 66 46568 → 443 [FIN, ACK] Seq=1 Ack=79 Win=862 Len=0 TSval=7593069 TSecr=3366042374
  504 5.248475501 192.168.1.16 → 10.6.15.144  SSH 158 Client: Encrypted packet (len=92)
  505 5.249218069 192.168.1.16 → 10.6.15.144  SSH 158 Client: Encrypted packet (len=92)
  506 5.250340836  10.6.15.144 → 192.168.1.16 TCP 66 22 → 58518 [ACK] Seq=191697 Ack=14401 Win=1452 Len=0 TSval=7043354 TSecr=7593067
  507 5.250356108 192.168.1.16 → 10.6.15.144  SSH 138 Client: Encrypted packet (len=72)
  508 5.252084499  10.6.15.144 → 192.168.1.16 TCP 66 22 → 58518 [ACK] Seq=191697 Ack=14565 Win=1452 Len=0 TSval=7043355 TSecr=7593069
  509 5.252105516  10.6.15.144 → 192.168.1.16 SSH 102 Server: Encrypted packet (len=36)
  510 5.295951242 192.168.1.16 → 10.6.15.144  TCP 66 58518 → 22 [ACK] Seq=14565 Ack=191733 Win=2263 Len=0 TSval=7593081 TSecr=7043355
  511 5.301991290 192.168.1.16 → 10.6.15.144  SSH 102 Client: Encrypted packet (len=36)
  512 5.303465404 192.168.1.16 → 10.6.15.144  SSH 102 Client: Encrypted packet (len=36)
  513 5.304840587  10.6.15.144 → 192.168.1.16 TCP 66 22 → 58518 [ACK] Seq=191733 Ack=14637 Win=1452 Len=0 TSval=7043368 TSecr=7593082
  514 5.675948782 192.168.1.16 → 89.161.158.40 TCP 66 [TCP Spurious Retransmission] 46568 → 443 [FIN, ACK] Seq=1 Ack=79 Win=862 Len=0 TSval=7593176 TSecr=3366042374
  515 5.677575183 89.161.158.40 → 192.168.1.16 TCP 66 443 → 46568 [ACK] Seq=79 Ack=2 Win=243 Len=0 TSval=3366042445 TSecr=7593069
  516 5.677699337  10.6.15.144 → 192.168.1.16 SSH 502 Server: Encrypted packet (len=436)
  517 5.677712224 192.168.1.16 → 10.6.15.144  TCP 66 58518 → 22 [ACK] Seq=14637 Ack=192169 Win=2263 Len=0 TSval=7593176 TSecr=7043408
  518 5.677720297  10.6.15.144 → 192.168.1.16 SSH 102 Server: Encrypted packet (len=36)
  519 5.677724029 192.168.1.16 → 10.6.15.144  TCP 66 58518 → 22 [ACK] Seq=14637 Ack=192205 Win=2263 Len=0 TSval=7593176 TSecr=7043418
  520 5.677935609  10.6.15.144 → 192.168.1.16 SSH 358 Server: Encrypted packet (len=292)
  521 5.677942863 192.168.1.16 → 10.6.15.144  TCP 66 58518 → 22 [ACK] Seq=14637 Ack=192497 Win=2263 Len=0 TSval=7593176 TSecr=7043422
  522 5.677952368  10.6.15.144 → 192.168.1.16 SSH 102 Server: Encrypted packet (len=36)
  523 5.677954405 192.168.1.16 → 10.6.15.144  TCP 66 58518 → 22 [ACK] Seq=14637 Ack=192533 Win=2263 Len=0 TSval=7593176 TSecr=7043435
  524 5.677988498  10.6.15.144 → 192.168.1.16 SSH 166 Server: Encrypted packet (len=100)
  525 5.677991101 192.168.1.16 → 10.6.15.144  TCP 66 58518 → 22 [ACK] Seq=14637 Ack=192633 Win=2263 Len=0 TSval=7593176 TSecr=7043447
  526 5.678757388 192.168.1.16 → 10.6.15.144  SSH 918 Client: Encrypted packet (len=852)
  527 5.679920795  10.6.15.144 → 192.168.1.16 SSH 102 Server: Encrypted packet (len=36)
  528 5.681504505 192.168.1.16 → 10.6.15.144  SSH 142 Client: Encrypted packet (len=76)
  529 5.683439596  10.6.15.144 → 192.168.1.16 TCP 66 22 → 58518 [ACK] Seq=192669 Ack=15565 Win=1452 Len=0 TSval=7043463 TSecr=7593176
  530 5.683838247 192.168.1.16 → 10.6.15.144  SSH 254 Client: Encrypted packet (len=188)
  531 5.688181987  10.6.15.144 → 192.168.1.16 SSH 142 Server: Encrypted packet (len=76)
  532 5.723108858  10.6.15.144 → 192.168.1.16 SSH 606 Server: Encrypted packet (len=540)
  533 5.723127370 192.168.1.16 → 10.6.15.144  TCP 66 58518 → 22 [ACK] Seq=15753 Ack=193285 Win=2263 Len=0 TSval=7593187 TSecr=7043464
  534 5.724330854 192.168.1.16 → 10.6.15.144  SSH 134 Client: Encrypted packet (len=68)
  535 5.726973514 192.168.1.16 → 10.6.15.144  SSH 138 Client: Encrypted packet (len=72)
  536 5.727695264 192.168.1.16 → 10.6.15.144  SSH 110 Client: Encrypted packet (len=44)
  537 5.729830718  10.6.15.144 → 192.168.1.16 TCP 66 22 → 58518 [ACK] Seq=193285 Ack=15893 Win=1452 Len=0 TSval=7043474 TSecr=7593188
  538 5.733894229  10.6.15.144 → 192.168.1.16 SSH 102 Server: Encrypted packet (len=36)
  539 5.775960394 192.168.1.16 → 10.6.15.144  TCP 66 58518 → 22 [ACK] Seq=15937 Ack=193321 Win=2263 Len=0 TSval=7593201 TSecr=7043474
  540 5.806425361 192.168.1.16 → 10.6.15.144  SSH 102 Client: Encrypted packet (len=36)
  541 5.840928911 89.161.158.40 → 192.168.1.16 TCP 66 [TCP Dup ACK 515#1] 443 → 46568 [ACK] Seq=79 Ack=2 Win=243 Len=0 TSval=3366042573 TSecr=7593069
  542 5.840948511 192.168.1.16 → 89.161.158.40 TCP 54 46568 → 443 [RST] Seq=2 Win=0 Len=0
  543 5.848704222  10.6.15.144 → 192.168.1.16 TCP 66 22 → 58518 [ACK] Seq=193321 Ack=15973 Win=1452 Len=0 TSval=7043504 TSecr=7593208
  544 6.765954111  10.6.15.144 → 192.168.1.16 SSH 190 Server: Encrypted packet (len=124)
  545 6.765999038 192.168.1.16 → 10.6.15.144  TCP 66 58518 → 22 [ACK] Seq=15973 Ack=193445 Win=2263 Len=0 TSval=7593448 TSecr=7043529
  546 6.766038396  10.6.15.144 → 192.168.1.16 SSH 102 Server: Encrypted packet (len=36)
  547 6.766055399 192.168.1.16 → 10.6.15.144  TCP 66 58518 → 22 [ACK] Seq=15973 Ack=193481 Win=2263 Len=0 TSval=7593448 TSecr=7043548
  548 6.766222914  10.6.15.144 → 192.168.1.16 SSH 462 Server: Encrypted packet (len=396)
  549 6.766236101 192.168.1.16 → 10.6.15.144  TCP 66 58518 → 22 [ACK] Seq=15973 Ack=193877 Win=2263 Len=0 TSval=7593448 TSecr=7043556
  550 6.766347904  10.6.15.144 → 192.168.1.16 SSH 102 Server: Encrypted packet (len=36)
  551 6.766355966 192.168.1.16 → 10.6.15.144  TCP 66 58518 → 22 [ACK] Seq=15973 Ack=193913 Win=2263 Len=0 TSval=7593448 TSecr=7043556
  552 6.766494380  10.6.15.144 → 192.168.1.16 SSH 102 Server: Encrypted packet (len=36)
  553 6.766502465 192.168.1.16 → 10.6.15.144  TCP 66 58518 → 22 [ACK] Seq=15973 Ack=193949 Win=2263 Len=0 TSval=7593448 TSecr=7043587
  554 6.766636001  10.6.15.144 → 192.168.1.16 SSH 102 Server: [TCP Spurious Retransmission] , Encrypted packet (len=36)
  555 6.766645042 192.168.1.16 → 10.6.15.144  TCP 78 [TCP Dup ACK 553#1] 58518 → 22 [ACK] Seq=15973 Ack=193949 Win=2263 Len=0 TSval=7593448 TSecr=7043615 SLE=193913 SRE=193949
  556 6.766873084  10.6.15.144 → 192.168.1.16 SSH 694 Server: [TCP Spurious Retransmission] , Encrypted packet (len=628)
  557 6.766887230 192.168.1.16 → 10.6.15.144  TCP 78 [TCP Dup ACK 553#2] 58518 → 22 [ACK] Seq=15973 Ack=193949 Win=2263 Len=0 TSval=7593448 TSecr=7043701 SLE=193321 SRE=193949
  558 6.767849456 192.168.1.16 → 10.6.15.144  SSH 206 Client: Encrypted packet (len=140)
  559 6.769460568 192.168.1.16 → 10.6.15.144  SSH 142 Client: Encrypted packet (len=76)
  560 6.769826684 192.168.1.16 → 10.6.15.144  SSH 138 Client: Encrypted packet (len=72)
  561 6.770302867  10.6.15.144 → 192.168.1.16 TCP 66 22 → 58518 [ACK] Seq=193949 Ack=16113 Win=1452 Len=0 TSval=7043734 TSecr=7593448
  562 6.771619947  10.6.15.144 → 192.168.1.16 TCP 66 22 → 58518 [ACK] Seq=193949 Ack=16189 Win=1452 Len=0 TSval=7043735 TSecr=7593449
  563 6.771749599  10.6.15.144 → 192.168.1.16 TCP 66 22 → 58518 [ACK] Seq=193949 Ack=16261 Win=1452 Len=0 TSval=7043735 TSecr=7593449
  564 6.771889154  10.6.15.144 → 192.168.1.16 SSH 102 Server: Encrypted packet (len=36)
  565 6.783749087 192.168.1.16 → 10.6.15.144  SSH 102 Client: Encrypted packet (len=36)
  566 6.810226066 192.168.1.16 → 10.6.15.144  SSH 198 Client: Encrypted packet (len=132)
  567 6.811612762  10.6.15.144 → 192.168.1.16 TCP 66 22 → 58518 [ACK] Seq=193985 Ack=16429 Win=1452 Len=0 TSval=7043745 TSecr=7593452
  568 7.019997584 192.168.1.16 → 52.216.131.141 TCP 82 47568 → 443 [ACK] Seq=1 Ack=1 Win=6152 Len=0 SLE=513 SRE=82433 SLE=94721 SRE=97793 SLE=85505 SRE=86529
  569 7.041021098  10.6.15.144 → 192.168.1.16 SSH 1514 Server: Encrypted packet (len=1448)
  570 7.041044772  10.6.15.144 → 192.168.1.16 SSH 622 Server: Encrypted packet (len=556)
  571 7.041055210 192.168.1.16 → 10.6.15.144  TCP 66 58518 → 22 [ACK] Seq=16429 Ack=195989 Win=2263 Len=0 TSval=7593517 TSecr=7043801
  572 7.041275590  10.6.15.144 → 192.168.1.16 SSH 742 Server: Encrypted packet (len=676)
  573 7.041441700  10.6.15.144 → 192.168.1.16 SSH 1062 Server: Encrypted packet (len=996)
  574 7.041449079 192.168.1.16 → 10.6.15.144  TCP 66 58518 → 22 [ACK] Seq=16429 Ack=197661 Win=2263 Len=0 TSval=7593517 TSecr=7043801
  575 7.042353360 192.168.1.16 → 10.6.15.144  SSH 206 Client: Encrypted packet (len=140)
  576 7.091079531  10.6.15.144 → 192.168.1.16 TCP 66 22 → 58518 [ACK] Seq=197661 Ack=16569 Win=1452 Len=0 TSval=7043815 TSecr=7593517
  577 7.154514346  10.6.15.144 → 192.168.1.16 SSH 374 Server: Encrypted packet (len=308)
  578 7.154537563  10.6.15.144 → 192.168.1.16 SSH 102 Server: Encrypted packet (len=36)
  579 7.154594758 192.168.1.16 → 10.6.15.144  TCP 66 58518 → 22 [ACK] Seq=16569 Ack=198005 Win=2263 Len=0 TSval=7593545 TSecr=7043829
  580 7.156224995 192.168.1.16 → 10.6.15.144  SSH 138 Client: Encrypted packet (len=72)
  581 7.161419006  10.6.15.144 → 192.168.1.16 SSH 102 Server: Encrypted packet (len=36)
  582 7.161705597 192.168.1.16 → 10.6.15.144  SSH 126 Client: Encrypted packet (len=60)
  583 7.191453857  10.6.15.144 → 192.168.1.16 TCP 78 [TCP Dup ACK 576#1] 22 → 58518 [ACK] Seq=198041 Ack=16569 Win=1452 Len=0 TSval=7043839 TSecr=7593545 SLE=16641 SRE=16701
  584 7.198485910  10.6.15.144 → 192.168.1.16 SSH 186 Server: Encrypted packet (len=108)
  585 7.234851092 52.216.131.141 → 192.168.1.16 TCP 60 [TCP ACKed unseen segment] 443 → 47568 [ACK] Seq=97793 Ack=2 Win=66 Len=0
  586 7.239959354 192.168.1.16 → 10.6.15.144  TCP 66 58518 → 22 [ACK] Seq=16701 Ack=198149 Win=2263 Len=0 TSval=7593567 TSecr=7043841
  587 7.312755595  10.6.15.144 → 192.168.1.16 SSH 162 Server: Encrypted packet (len=84)
  588 7.312783730 192.168.1.16 → 10.6.15.144  TCP 66 58518 → 22 [ACK] Seq=16701 Ack=198233 Win=2263 Len=0 TSval=7593585 TSecr=7043870
  589 7.313351513 192.168.1.16 → 10.6.15.144  SSH 574 Client: Encrypted packet (len=508)
  590 7.315080585  10.6.15.144 → 192.168.1.16 TCP 78 [TCP Dup ACK 576#2] 22 → 58518 [ACK] Seq=198233 Ack=16569 Win=1452 Len=0 TSval=7043871 TSecr=7593545 SLE=16641 SRE=17209
  591 7.379946013 192.168.1.16 → 10.6.15.144  TCP 138 [TCP Retransmission] 58518 → 22 [PSH, ACK] Seq=16569 Ack=198233 Win=2263 Len=72 TSval=7593602 TSecr=7043871
  592 7.381599894  10.6.15.144 → 192.168.1.16 TCP 66 22 → 58518 [ACK] Seq=198233 Ack=17209 Win=1449 Len=0 TSval=7043887 TSecr=7593602
  593 7.381724651  10.6.15.144 → 192.168.1.16 SSH 102 Server: Encrypted packet (len=36)
  594 7.423973779 192.168.1.16 → 10.6.15.144  TCP 66 58518 → 22 [ACK] Seq=17209 Ack=198269 Win=2263 Len=0 TSval=7593613 TSecr=7043887
  595 8.781980025  10.6.15.144 → 192.168.1.16 SSH 638 Server: Encrypted packet (len=572)
  596 8.782007580 192.168.1.16 → 10.6.15.144  TCP 66 58518 → 22 [ACK] Seq=17209 Ack=198841 Win=2263 Len=0 TSval=7593952 TSecr=7043954
  597 8.782141889  10.6.15.144 → 192.168.1.16 SSH 1514 Server: Encrypted packet (len=1448)
  598 8.782151543 192.168.1.16 → 10.6.15.144  TCP 66 58518 → 22 [ACK] Seq=17209 Ack=200289 Win=2263 Len=0 TSval=7593952 TSecr=7043981
  599 8.782174889  10.6.15.144 → 192.168.1.16 SSH 526 Server: Encrypted packet (len=460)
  600 8.782180909 192.168.1.16 → 10.6.15.144  TCP 66 58518 → 22 [ACK] Seq=17209 Ack=200749 Win=2263 Len=0 TSval=7593952 TSecr=7043981
  601 8.782332444  10.6.15.144 → 192.168.1.16 SSH 102 Server: Encrypted packet (len=36)
  602 8.782338530 192.168.1.16 → 10.6.15.144  TCP 66 58518 → 22 [ACK] Seq=17209 Ack=200785 Win=2263 Len=0 TSval=7593952 TSecr=7043981
  603 8.782349331  10.6.15.144 → 192.168.1.16 SSH 102 Server: Encrypted packet (len=36)
  604 8.782352205 192.168.1.16 → 10.6.15.144  TCP 66 58518 → 22 [ACK] Seq=17209 Ack=200821 Win=2263 Len=0 TSval=7593952 TSecr=7044004
  605 8.782367769  10.6.15.144 → 192.168.1.16 SSH 102 Server: [TCP Spurious Retransmission] , Encrypted packet (len=36)
  606 8.782372074 192.168.1.16 → 10.6.15.144  TCP 78 [TCP Dup ACK 604#1] 58518 → 22 [ACK] Seq=17209 Ack=200821 Win=2263 Len=0 TSval=7593952 TSecr=7044036 SLE=200785 SRE=200821
  607 8.782463434  10.6.15.144 → 192.168.1.16 TCP 638 [TCP Out-Of-Order] 22 → 58518 [PSH, ACK] Seq=198269 Ack=17209 Win=1452 Len=572 TSval=7044155 TSecr=7593613
  608 8.782468762 192.168.1.16 → 10.6.15.144  TCP 78 [TCP Dup ACK 604#2] 58518 → 22 [ACK] Seq=17209 Ack=200821 Win=2263 Len=0 TSval=7593952 TSecr=7044036 SLE=198269 SRE=198841
  609 8.784331662 192.168.1.16 → 10.6.15.144  SSH 138 Client: Encrypted packet (len=72)
  610 8.786542085  10.6.15.144 → 192.168.1.16 SSH 102 Server: Encrypted packet (len=36)
  611 8.827948401 192.168.1.16 → 10.6.15.144  TCP 66 58518 → 22 [ACK] Seq=17281 Ack=200857 Win=2263 Len=0 TSval=7593964 TSecr=7044238
  612 8.832501847  10.6.15.144 → 192.168.1.16 SSH 102 Server: Encrypted packet (len=36)
  613 8.832522022 192.168.1.16 → 10.6.15.144  TCP 66 58518 → 22 [ACK] Seq=17281 Ack=200893 Win=2263 Len=0 TSval=7593965 TSecr=7044250
  614 8.907972442 192.168.1.16 → 50.19.253.241 TCP 66 40316 → 443 [ACK] Seq=1 Ack=1 Win=839 Len=0 TSval=7593984 TSecr=43781451
  615 9.777850555  10.6.15.144 → 192.168.1.16 SSH 102 Server: Encrypted packet (len=36)
  616 9.777876872 192.168.1.16 → 10.6.15.144  TCP 66 58518 → 22 [ACK] Seq=17281 Ack=200929 Win=2263 Len=0 TSval=7594201 TSecr=7044298
  617 9.777891823  10.6.15.144 → 192.168.1.16 SSH 102 Server: Encrypted packet (len=36)
  618 9.777898096 192.168.1.16 → 10.6.15.144  TCP 66 58518 → 22 [ACK] Seq=17281 Ack=200965 Win=2263 Len=0 TSval=7594201 TSecr=7044404
  619 9.777904328  10.6.15.144 → 192.168.1.16 SSH 102 Server: Encrypted packet (len=36)
  620 9.777908135 192.168.1.16 → 10.6.15.144  TCP 66 58518 → 22 [ACK] Seq=17281 Ack=201001 Win=2263 Len=0 TSval=7594201 TSecr=7044408
  621 9.813146056  10.6.15.144 → 192.168.1.16 SSH 102 Server: Encrypted packet (len=36)
  622 9.813163538 192.168.1.16 → 10.6.15.144  TCP 66 58518 → 22 [ACK] Seq=17281 Ack=201037 Win=2263 Len=0 TSval=7594210 TSecr=7044495
  623 9.847585050  10.6.15.144 → 192.168.1.16 SSH 126 Server: Encrypted packet (len=60)
  624 9.847600851 192.168.1.16 → 10.6.15.144  TCP 66 58518 → 22 [ACK] Seq=17281 Ack=201097 Win=2263 Len=0 TSval=7594218 TSecr=7044504
  625 10.797841749  10.22.18.98 → 224.0.0.252  LLMNR 75 Standard query 0xc3a8 A agcbvaydsnodszs
  626 10.797862410  10.22.18.98 → 224.0.0.252  LLMNR 75 Standard query 0xc037 A agcbvaydsnodszs
  627 10.797866397  10.22.18.98 → 224.0.0.252  LLMNR 75 Standard query 0xc3a8 A agcbvaydsnodszs
  628 10.797881672  10.22.18.98 → 224.0.0.252  LLMNR 75 Standard query 0xc037 A agcbvaydsnodszs
  629 11.800023711 10.22.18.209 → 224.0.0.252  LLMNR 64 Standard query 0xb2d3 A wpad
  630 11.899315296 10.22.18.209 → 224.0.0.252  LLMNR 64 Standard query 0xb2d3 A wpad
  631 12.708789288  10.6.15.144 → 192.168.1.16 SSH 102 Server: Encrypted packet (len=36)
  632 12.708808797 192.168.1.16 → 10.6.15.144  TCP 66 58518 → 22 [ACK] Seq=17281 Ack=201133 Win=2263 Len=0 TSval=7594934 TSecr=7045094
  633 14.900670082  10.6.15.144 → 192.168.1.16 SSH 102 Server: Encrypted packet (len=36)
  634 14.900685620 192.168.1.16 → 10.6.15.144  TCP 66 58518 → 22 [ACK] Seq=17281 Ack=201169 Win=2263 Len=0 TSval=7595482 TSecr=7045750
  635 16.293428216  10.22.18.98 → 224.0.0.252  LLMNR 75 Standard query 0xfc3c A agcbvaydsnodszs
  636 17.773757392  10.22.18.98 → 224.0.0.252  LLMNR 75 Standard query 0xfc3c A agcbvaydsnodszs
  637 17.773886775  10.22.18.98 → 224.0.0.252  LLMNR 64 Standard query 0x6c0d A wpad
  638 17.774023048  10.22.18.98 → 224.0.0.252  LLMNR 64 Standard query 0x4aea A wpad
  639 18.765884576  10.22.18.98 → 224.0.0.252  LLMNR 64 Standard query 0x4aea A wpad
  640 18.766233513  10.22.18.98 → 224.0.0.252  LLMNR 64 Standard query 0x6c0d A wpad
  641 18.766589542  10.6.15.144 → 192.168.1.16 SSH 102 Server: Encrypted packet (len=36)
  642 18.766601156 192.168.1.16 → 10.6.15.144  TCP 66 58518 → 22 [ACK] Seq=17281 Ack=201205 Win=2263 Len=0 TSval=7596448 TSecr=7046598
  643 19.760773103  10.6.15.144 → 192.168.1.16 SSH 102 Server: Encrypted packet (len=36)
  644 19.760791233 192.168.1.16 → 10.6.15.144  TCP 66 58518 → 22 [ACK] Seq=17281 Ack=201241 Win=2263 Len=0 TSval=7596697 TSecr=7046793
  645 19.762299491  10.6.15.144 → 192.168.1.16 SSH 102 Server: Encrypted packet (len=36)
  646 19.762316056 192.168.1.16 → 10.6.15.144  TCP 66 58518 → 22 [ACK] Seq=17281 Ack=201277 Win=2263 Len=0 TSval=7596697 TSecr=7046793
  647 19.762336412 10.22.18.209 → 224.0.0.252  LLMNR 64 Standard query 0xc480 A wpad
  648 19.762352013  10.6.15.144 → 192.168.1.16 SSH 102 Server: [TCP Spurious Retransmission] , Encrypted packet (len=36)
  649 19.762358126 192.168.1.16 → 10.6.15.144  TCP 78 [TCP Dup ACK 646#1] 58518 → 22 [ACK] Seq=17281 Ack=201277 Win=2263 Len=0 TSval=7596697 TSecr=7046965 SLE=201241 SRE=201277
  650 19.762365887 10.22.18.209 → 224.0.0.252  LLMNR 64 Standard query 0xc480 A wpad
  651 20.670337759 192.168.1.16 → 192.168.1.1  DNS 81 Standard query 0x859b A 3.ubuntu.pool.ntp.org
  652 20.675719114  192.168.1.1 → 192.168.1.16 DNS 97 Standard query response 0x859b A 3.ubuntu.pool.ntp.org A 123.108.200.124
  653 20.676131240 192.168.1.16 → 123.108.200.124 NTP 90 NTP Version 4, client
  654 22.801286435  10.22.18.98 → 224.0.0.252  LLMNR 75 Standard query 0x2eca A agcbvaydsnodszs
  655 22.801309812  10.22.18.98 → 224.0.0.252  LLMNR 75 Standard query 0x2eca A agcbvaydsnodszs
  656 23.243949580 192.168.1.16 → 52.21.37.23  TCP 66 57254 → 443 [ACK] Seq=1 Ack=1 Win=455 Len=0 TSval=7597568 TSecr=1246193800
  657 23.299946154 192.168.1.16 → 216.58.196.106 TCP 66 56232 → 443 [ACK] Seq=1 Ack=1 Win=384 Len=0 TSval=7597582 TSecr=298501610
  658 23.305668618 216.58.196.106 → 192.168.1.16 TCP 66 [TCP ACKed unseen segment] 443 → 56232 [ACK] Seq=1 Ack=2 Win=179 Len=0 TSval=298546723 TSecr=7574747
  659 24.670077758 192.168.1.16 → 192.168.1.1  DNS 81 Standard query 0x72e1 A 1.ubuntu.pool.ntp.org
  660 24.674457598  192.168.1.1 → 192.168.1.16 DNS 97 Standard query response 0x72e1 A 1.ubuntu.pool.ntp.org A 123.108.200.124
  661 24.674879345 192.168.1.16 → 123.108.200.124 NTP 90 NTP Version 4, client
  662 27.790963322 10.22.18.209 → 224.0.0.252  LLMNR 64 Standard query 0xd486 A wpad
  663 27.790985631 10.22.18.209 → 224.0.0.252  LLMNR 64 Standard query 0xd486 A wpad
  664 29.387948891 192.168.1.16 → 216.58.196.110 TCP 66 43688 → 443 [ACK] Seq=1 Ack=1 Win=237 Len=0 TSval=7599104 TSecr=1380011940
  665 29.397081002 216.58.196.110 → 192.168.1.16 TCP 66 [TCP ACKed unseen segment] 443 → 43688 [ACK] Seq=1 Ack=2 Win=170 Len=0 TSval=1380057002 TSecr=7542424
  666 29.455136143  10.6.15.144 → 192.168.1.16 SSH 174 Server: Encrypted packet (len=108)
  667 29.455153232 192.168.1.16 → 10.6.15.144  TCP 66 58518 → 22 [ACK] Seq=17281 Ack=201385 Win=2263 Len=0 TSval=7599120 TSecr=7049405
  668 29.455176183  10.6.15.144 → 192.168.1.16 SSH 102 Server: Encrypted packet (len=36)
  669 29.455183926 192.168.1.16 → 10.6.15.144  TCP 66 58518 → 22 [ACK] Seq=17281 Ack=201421 Win=2263 Len=0 TSval=7599120 TSecr=7049405
  670 29.668581356 192.168.1.16 → 91.189.94.4  NTP 90 NTP Version 4, client
  671 31.670297519 192.168.1.16 → 192.168.1.1  DNS 81 Standard query 0xe8fa A 2.ubuntu.pool.ntp.org
  672 31.676041710  192.168.1.1 → 192.168.1.16 DNS 97 Standard query response 0xe8fa A 2.ubuntu.pool.ntp.org A 123.108.200.124
  673 31.676473019 192.168.1.16 → 123.108.200.124 NTP 90 NTP Version 4, client
  674 32.971974595 192.168.1.16 → 54.192.190.228 TCP 66 33568 → 80 [ACK] Seq=1 Ack=1 Win=239 Len=0 TSval=7600000 TSecr=1012072872
  675 33.483976037 192.168.1.16 → 216.58.196.100 TCP 66 45824 → 443 [ACK] Seq=1 Ack=1 Win=237 Len=0 TSval=7600128 TSecr=3660340023
  676 33.484761528 192.168.1.16 → 23.185.0.2   TCP 66 54374 → 443 [ACK] Seq=1 Ack=1 Win=364 Len=0 TSval=7600128 TSecr=2742389113
  677 33.484764510 192.168.1.16 → 52.216.131.141 TCP 66 47572 → 443 [ACK] Seq=1 Ack=1 Win=3079 Len=0 SLE=513 SRE=14849
  678 33.484766022 192.168.1.16 → 151.101.8.223 TCP 66 54978 → 443 [ACK] Seq=1 Ack=1 Win=591 Len=0 TSval=7600128 TSecr=304299751
  679 33.484767374 192.168.1.16 → 23.47.251.27 TCP 66 38888 → 80 [ACK] Seq=1 Ack=1 Win=274 Len=0 TSval=7600128 TSecr=1012072948
  680 33.484768620 192.168.1.16 → 151.101.193.69 TCP 66 33220 → 443 [ACK] Seq=1 Ack=1 Win=410 Len=0 TSval=7600128 TSecr=304299751
  681 33.484769927 192.168.1.16 → 216.58.196.99 TCP 66 52408 → 443 [ACK] Seq=1 Ack=1 Win=317 Len=0 TSval=7600128 TSecr=537564600
  682 33.484771375 192.168.1.16 → 118.214.110.12 TCP 66 54048 → 443 [ACK] Seq=1 Ack=1 Win=387 Len=0 TSval=7600128 TSecr=332529814
  683 33.489800073 10.22.18.159 → 224.0.0.252  LLMNR 64 Standard query 0x26a0 A wpad
  684 33.490239849 216.58.196.100 → 192.168.1.16 TCP 66 [TCP ACKed unseen segment] 443 → 45824 [ACK] Seq=1 Ack=2 Win=175 Len=0 TSval=3660432082 TSecr=7542891
  685 33.490250447 23.47.251.27 → 192.168.1.16 TCP 66 [TCP ACKed unseen segment] 80 → 38888 [ACK] Seq=1 Ack=2 Win=31 Len=0 TSval=1012077454 TSecr=7543581
  686 33.490440415 216.58.196.99 → 192.168.1.16 TCP 66 [TCP ACKed unseen segment] 443 → 52408 [ACK] Seq=1 Ack=2 Win=179 Len=0 TSval=537609657 TSecr=7543508
  687 33.490844465 118.214.110.12 → 192.168.1.16 TCP 66 [TCP ACKed unseen segment] 443 → 54048 [ACK] Seq=1 Ack=2 Win=1067 Len=0 TSval=332574871 TSecr=7543603
  688 33.527332238 151.101.8.223 → 192.168.1.16 TCP 66 [TCP ACKed unseen segment] 443 → 54978 [ACK] Seq=1 Ack=2 Win=61 Len=0 TSval=304311016 TSecr=7543599
  689 33.527348516 151.101.193.69 → 192.168.1.16 TCP 66 [TCP ACKed unseen segment] 443 → 33220 [ACK] Seq=1 Ack=2 Win=61 Len=0 TSval=304311016 TSecr=7543515
  690 33.527532242   23.185.0.2 → 192.168.1.16 TCP 66 [TCP ACKed unseen segment] 443 → 54374 [ACK] Seq=1 Ack=2 Win=61 Len=0 TSval=2742400377 TSecr=7543563
  691 33.816094539 52.216.131.141 → 192.168.1.16 TCP 60 [TCP ACKed unseen segment] 443 → 47572 [ACK] Seq=14849 Ack=2 Win=70 Len=0
  692 33.816114583 10.22.18.159 → 224.0.0.252  LLMNR 64 Standard query 0x26a0 A wpad
  693 35.303357363 ZioncomE_53:dd:d6 → HonHaiPr_1f:71:b9 EAPOL 135 Key (Message 1 of 4)
  694 35.303532666 HonHaiPr_1f:71:b9 → ZioncomE_53:dd:d6 EAPOL 135 Key (Message 2 of 4)
  695 35.312438477 ZioncomE_53:dd:d6 → HonHaiPr_1f:71:b9 EAPOL 169 Key (Message 3 of 4)
  696 35.312526752 HonHaiPr_1f:71:b9 → ZioncomE_53:dd:d6 EAPOL 113 Key (Message 4 of 4)
  697 35.323978867 fe80::820e:b87b:de2a:4286 → ff02::16     ICMPv6 90 Multicast Listener Report Message v2
  698 35.323997576 192.168.1.16 → 224.0.0.252  IGMPv2 46 Membership Report group 224.0.0.252
  699 35.329240059 10.22.18.209 → 224.0.0.252  LLMNR 64 Standard query 0x1628 A wpad
  700 35.362618930  192.168.1.1 → 192.168.1.255 IAPP 58 Announce Request(0) (version=0)[Malformed Packet]
  701 35.362937366  192.168.1.1 → 224.0.1.178  UDP 58 3517 → 3517 Len=16
  702 35.422119564 10.22.18.209 → 224.0.0.252  LLMNR 64 Standard query 0x1628 A wpad
  703 35.422254741 192.168.1.16 → 224.0.0.252  LLMNR 73 Standard query 0x03ef ANY theenterprise
  704 35.422294209 fe80::820e:b87b:de2a:4286 → ff02::1:3    LLMNR 93 Standard query 0x23f8 ANY theenterprise
  705 35.544046556 192.168.1.16 → 216.58.196.99 TCP 66 52440 → 443 [ACK] Seq=1 Ack=1 Win=237 Len=0 TSval=7600640 TSecr=1172928020
  706 35.565422286 192.168.1.16 → 224.0.0.252  LLMNR 73 Standard query 0x03ef ANY theenterprise
  707 35.565479385 fe80::820e:b87b:de2a:4286 → ff02::1:3    LLMNR 93 Standard query 0x23f8 ANY theenterprise
  708 35.659977514 192.168.1.16 → 224.0.0.252  IGMPv2 46 Membership Report group 224.0.0.252
  709 35.665563712  10.6.15.144 → 192.168.1.16 SSH 326 Server: Encrypted packet (len=260)
  710 35.665589049 192.168.1.16 → 10.6.15.144  TCP 66 [TCP Previous segment not captured] 58518 → 22 [ACK] Seq=17369 Ack=201681 Win=2263 Len=0 TSval=7600673 TSecr=7050946
  711 35.665683995  10.6.15.144 → 192.168.1.16 SSH 102 Server: Encrypted packet (len=36)
  712 35.665687474 192.168.1.16 → 10.6.15.144  TCP 66 58518 → 22 [ACK] Seq=17369 Ack=201717 Win=2263 Len=0 TSval=7600673 TSecr=7050946
  713 35.724004072 fe80::820e:b87b:de2a:4286 → ff02::16     ICMPv6 90 Multicast Listener Report Message v2
  714 35.815428902 192.168.1.16 → 224.0.0.252  LLMNR 73 Standard query 0x03ef ANY theenterprise
  715 35.815481533 fe80::820e:b87b:de2a:4286 → ff02::1:3    LLMNR 93 Standard query 0x23f8 ANY theenterprise
  716 35.884004333 192.168.1.16 → 10.6.15.144  TCP 154 [TCP Retransmission] 58518 → 22 [PSH, ACK] Seq=17281 Ack=201717 Win=2263 Len=88 TSval=7600728 TSecr=7050946
  717 36.393290499  10.6.15.144 → 192.168.1.16 SSH 102 Server: [TCP Spurious Retransmission] , Encrypted packet (len=36)
  718 36.393312364 192.168.1.16 → 10.6.15.144  TCP 78 [TCP Dup ACK 712#1] 58518 → 22 [ACK] Seq=17369 Ack=201717 Win=2263 Len=0 TSval=7600855 TSecr=7051116 SLE=201681 SRE=201717
  719 36.519980973 216.58.196.99 → 192.168.1.16 TCP 66 [TCP ACKed unseen segment] 443 → 52440 [ACK] Seq=1 Ack=2 Win=175 Len=0 TSval=1172973946 TSecr=7544226
  720 36.519996005  10.6.15.144 → 192.168.1.16 SSH 102 Server: Encrypted packet (len=36)
  721 36.523987191 192.168.1.16 → 10.6.15.144  TCP 66 58518 → 22 [ACK] Seq=17369 Ack=201753 Win=2263 Len=0 TSval=7600887 TSecr=7051153
  722 36.523994854 192.168.1.16 → 10.6.15.144  SSH 494 Client: Encrypted packet (len=428)
  723 36.813692133 192.168.1.16 → 239.255.255.250 SSDP 213 M-SEARCH * HTTP/1.1 
  724 36.875998897 192.168.1.16 → 10.6.15.144  SSH 238 Client: Encrypted packet (len=172)
  725 37.445496521  10.6.15.144 → 192.168.1.16 SSH 138 Server: Encrypted packet (len=72)
  726 37.451723735  10.6.15.144 → 192.168.1.16 TCP 66 22 → 58518 [ACK] Seq=201825 Ack=17969 Win=1452 Len=0 TSval=7051403 TSecr=7600887
  727 37.451740792 192.168.1.16 → 10.6.15.144  SSH 802 Client: Encrypted packet (len=736)
  728 37.452118484  10.6.15.144 → 192.168.1.16 SSH 142 Server: Encrypted packet (len=76)
  729 37.495977124 192.168.1.16 → 10.6.15.144  TCP 66 58518 → 22 [ACK] Seq=18705 Ack=201901 Win=2263 Len=0 TSval=7601131 TSecr=7051404
  730 37.583959311  10.6.15.144 → 192.168.1.16 SSH 142 Server: Encrypted packet (len=76)
  731 37.583984299 192.168.1.16 → 10.6.15.144  TCP 66 58518 → 22 [ACK] Seq=18705 Ack=201977 Win=2263 Len=0 TSval=7601153 TSecr=7051410
  732 37.583996079  10.6.15.144 → 192.168.1.16 SSH 238 Server: Encrypted packet (len=172)
  733 37.583998609 192.168.1.16 → 10.6.15.144  TCP 66 58518 → 22 [ACK] Seq=18705 Ack=202149 Win=2263 Len=0 TSval=7601153 TSecr=7051411
  734 37.584001531  10.6.15.144 → 192.168.1.16 SSH 390 Server: Encrypted packet (len=324)
  735 37.584003173 192.168.1.16 → 10.6.15.144  TCP 66 58518 → 22 [ACK] Seq=18705 Ack=202473 Win=2263 Len=0 TSval=7601153 TSecr=7051415
  736 37.584005440  10.6.15.144 → 192.168.1.16 SSH 166 Server: Encrypted packet (len=100)
  737 37.584007171 192.168.1.16 → 10.6.15.144  TCP 66 58518 → 22 [ACK] Seq=18705 Ack=202573 Win=2263 Len=0 TSval=7601153 TSecr=7051415
  738 37.584009657  10.6.15.144 → 192.168.1.16 SSH 134 Server: Encrypted packet (len=68)
  739 37.584011061 192.168.1.16 → 10.6.15.144  TCP 66 58518 → 22 [ACK] Seq=18705 Ack=202641 Win=2263 Len=0 TSval=7601153 TSecr=7051416
  740 37.584986414 192.168.1.16 → 10.6.15.144  SSH 302 Client: Encrypted packet (len=236)
  741 37.591855234 192.168.1.16 → 10.6.15.144  SSH 386 Client: Encrypted packet (len=320)
  742 37.592513751  10.6.15.144 → 192.168.1.16 SSH 198 Server: Encrypted packet (len=132)
  743 37.593741270  10.6.15.144 → 192.168.1.16 TCP 66 22 → 58518 [ACK] Seq=202773 Ack=19261 Win=1452 Len=0 TSval=7051440 TSecr=7601153
  744 37.593755444 192.168.1.16 → 10.6.15.144  SSH 134 Client: Encrypted packet (len=68)
  745 37.628822249  10.6.15.144 → 192.168.1.16 SSH 126 Server: Encrypted packet (len=60)
  746 37.630920371  10.6.15.144 → 192.168.1.16 SSH 214 Server: Encrypted packet (len=148)
  747 37.630989260 192.168.1.16 → 10.6.15.144  TCP 66 58518 → 22 [ACK] Seq=19329 Ack=202981 Win=2263 Len=0 TSval=7601164 TSecr=7051449
  748 37.632257617  10.6.15.144 → 192.168.1.16 SSH 238 Server: Encrypted packet (len=172)
  749 37.679952885 192.168.1.16 → 10.6.15.144  TCP 66 58518 → 22 [ACK] Seq=19329 Ack=203153 Win=2263 Len=0 TSval=7601177 TSecr=7051450
  750 37.804061310 192.168.1.16 → 104.24.28.86 TCP 54 46600 → 443 [ACK] Seq=1 Ack=1 Win=453 Len=0
  751 37.804834780 192.168.1.16 → 151.101.9.140 TCP 66 36298 → 443 [ACK] Seq=1 Ack=1 Win=364 Len=0 TSval=7601204 TSecr=2547846426
  752 37.813977494 192.168.1.16 → 239.255.255.250 SSDP 213 M-SEARCH * HTTP/1.1 
  753 38.802112103 151.101.9.140 → 192.168.1.16 TCP 66 [TCP ACKed unseen segment] 443 → 36298 [ACK] Seq=1 Ack=2 Win=61 Len=0 TSval=2547857929 TSecr=7543632
  754 38.802353736 104.24.28.86 → 192.168.1.16 TCP 60 [TCP ACKed unseen segment] 443 → 46600 [ACK] Seq=1 Ack=2 Win=31 Len=0
  755 38.814894054 192.168.1.16 → 239.255.255.250 SSDP 213 M-SEARCH * HTTP/1.1 
  756 39.628000645 192.168.1.16 → 104.20.136.42 TCP 66 45658 → 80 [ACK] Seq=1 Ack=1 Win=241 Len=0 TSval=7601664 TSecr=1012059993
  757 39.628772185 192.168.1.16 → 52.16.201.221 TCP 128 52032 → 8282 [PSH, ACK] Seq=1 Ack=1 Win=296 Len=62 TSval=7601664 TSecr=589320240
  758 39.670108160 192.168.1.16 → 192.168.1.1  DNS 81 Standard query 0x630d A 0.ubuntu.pool.ntp.org
  759 39.680888268  192.168.1.1 → 192.168.1.16 DNS 97 Standard query response 0x630d A 0.ubuntu.pool.ntp.org A 123.108.200.124
  760 39.681314029 192.168.1.16 → 123.108.200.124 NTP 90 NTP Version 4, client
  761 39.813949701 192.168.1.16 → 224.0.0.251  MDNS 82 Standard query 0x0000 PTR _googlecast._tcp.local, "QM" question
  762 39.813986314 fe80::820e:b87b:de2a:4286 → ff02::fb     MDNS 102 Standard query 0x0000 PTR _googlecast._tcp.local, "QM" question
  763 39.814015774 192.168.1.16 → 224.0.0.251  MDNS 82 Standard query 0x0000 PTR _googlecast._tcp.local, "QM" question
  764 39.814025770 fe80::820e:b87b:de2a:4286 → ff02::fb     MDNS 102 Standard query 0x0000 PTR _googlecast._tcp.local, "QM" question
  765 39.815153614 192.168.1.16 → 239.255.255.250 SSDP 213 M-SEARCH * HTTP/1.1 
