    1 0.000000000 fe80::820e:b87b:de2a:4286 → ff02::1:3    LLMNR 95 Standard query 0x3dc2 ANY theenterprise
    2 0.000044118 192.168.1.16 → 224.0.0.252  LLMNR 75 Standard query 0xa8be ANY theenterprise
    3 0.000080744 fe80::820e:b87b:de2a:4286 → fe80::820e:b87b:de2a:4286 LLMNR 123 Standard query response 0x3dc2 ANY theenterprise AAAA fe80::820e:b87b:de2a:4286
    4 0.000100879 192.168.1.16 → 192.168.1.16 LLMNR 91 Standard query response 0xa8be ANY theenterprise A 192.168.1.16
    5 0.090579812 192.168.1.16 → 224.0.0.252  IGMPv2 48 Membership Report group 224.0.0.252
    6 0.758722678 192.168.1.16 → 239.255.255.250 SSDP 215 M-SEARCH * HTTP/1.1 
    7 0.760097424    127.0.0.1 → 127.0.0.1    Socks 165 Unknown
    8 0.760128669    127.0.0.1 → 127.0.0.1    TCP 68 1080 → 58454 [ACK] Seq=1 Ack=98 Win=372 Len=0 TSval=7612463 TSecr=7612463
    9 0.760152301    127.0.0.1 → 127.0.0.1    Socks 114 Unknown
   10 0.760155546    127.0.0.1 → 127.0.0.1    TCP 68 1080 → 58454 [ACK] Seq=1 Ack=144 Win=372 Len=0 TSval=7612463 TSecr=7612463
   11 1.339305966    127.0.0.1 → 127.0.0.1    Socks 195 Unknown
   12 1.339319132    127.0.0.1 → 127.0.0.1    TCP 68 1080 → 58192 [ACK] Seq=1 Ack=128 Win=3637 Len=0 TSval=7612608 TSecr=7612608
   13 1.339347282    127.0.0.1 → 127.0.0.1    Socks 114 Unknown
   14 1.339350017    127.0.0.1 → 127.0.0.1    TCP 68 1080 → 58192 [ACK] Seq=1 Ack=174 Win=3637 Len=0 TSval=7612608 TSecr=7612608
   15 1.339362264    127.0.0.1 → 127.0.0.1    Socks 1016 Unknown
   16 1.339365993    127.0.0.1 → 127.0.0.1    TCP 68 1080 → 58192 [ACK] Seq=1 Ack=1122 Win=3637 Len=0 TSval=7612608 TSecr=7612608
   17 1.711063991  10.22.18.98 → 224.0.0.252  LLMNR 66 Standard query 0x0c39 A wpad
   18 1.711701581  10.22.18.98 → 224.0.0.252  LLMNR 66 Standard query 0x2512 A wpad
   19 1.712125416  10.22.18.98 → 224.0.0.252  LLMNR 66 Standard query 0x0c39 A wpad
   20 1.720780922  10.22.18.98 → 224.0.0.252  LLMNR 66 Standard query 0x2512 A wpad
   21 1.722552869 192.168.1.16 → 10.6.15.144  SSH 140 Client: Encrypted packet (len=72)
   22 1.726836133  10.6.15.144 → 192.168.1.16 TCP 68 22 → 58518 [ACK] Seq=1 Ack=73 Win=1452 Len=0 TSval=7062990 TSecr=7612704
   23 1.726868060 192.168.1.16 → 10.6.15.144  SSH 1516 Client: Encrypted packet (len=1448)
   24 1.726875710 192.168.1.16 → 10.6.15.144  SSH 1516 Client: Encrypted packet (len=1448)
   25 1.745346733  10.6.15.144 → 192.168.1.16 TCP 68 22 → 58518 [ACK] Seq=1 Ack=1521 Win=1452 Len=0 TSval=7062993 TSecr=7612705
   26 1.745364034 192.168.1.16 → 10.6.15.144  SSH 340 Client: Encrypted packet (len=272)
   27 1.747142179  10.6.15.144 → 192.168.1.16 TCP 68 22 → 58518 [ACK] Seq=1 Ack=2969 Win=1452 Len=0 TSval=7062994 TSecr=7612705
   28 1.747548643  10.6.15.144 → 192.168.1.16 SSH 392 Server: Encrypted packet (len=324)
   29 1.747556766 192.168.1.16 → 10.6.15.144  TCP 68 58518 → 22 [ACK] Seq=3241 Ack=325 Win=2263 Len=0 TSval=7612710 TSecr=7062994
   30 1.747983950  10.6.15.144 → 192.168.1.16 SSH 136 Server: Encrypted packet (len=68)
   31 1.747990121 192.168.1.16 → 10.6.15.144  TCP 68 58518 → 22 [ACK] Seq=3241 Ack=393 Win=2263 Len=0 TSval=7612710 TSecr=7062995
   32 1.748142282    127.0.0.1 → 127.0.0.1    Socks 114 Unknown
   33 1.753844599  10.6.15.144 → 192.168.1.16 SSH 136 Server: Encrypted packet (len=68)
   34 1.753854928 192.168.1.16 → 10.6.15.144  TCP 68 58518 → 22 [ACK] Seq=3241 Ack=461 Win=2263 Len=0 TSval=7612711 TSecr=7062996
   35 1.753902924    127.0.0.1 → 127.0.0.1    Socks 114 Unknown
   36 1.757185898  10.6.15.144 → 192.168.1.16 SSH 140 Server: Encrypted packet (len=72)
   37 1.757203943 192.168.1.16 → 10.6.15.144  TCP 68 58518 → 22 [ACK] Seq=3241 Ack=533 Win=2263 Len=0 TSval=7612712 TSecr=7062998
   38 1.757277828    127.0.0.1 → 127.0.0.1    TCP 68 1080 → 58842 [FIN, ACK] Seq=1 Ack=1 Win=351 Len=0 TSval=7612712 TSecr=7612116
   39 1.757288218    127.0.0.1 → 127.0.0.1    TCP 68 58842 → 1080 [ACK] Seq=1 Ack=2 Win=350 Len=0 TSval=7612712 TSecr=7612712
   40 1.757390062 192.168.1.16 → 10.6.15.144  SSH 104 Client: Encrypted packet (len=36)
   41 1.759073605 192.168.1.16 → 239.255.255.250 SSDP 215 M-SEARCH * HTTP/1.1 
   42 1.762115209  10.6.15.144 → 192.168.1.16 SSH 104 Server: Encrypted packet (len=36)
   43 1.762201315    127.0.0.1 → 127.0.0.1    Socks 78 Version: 5 Connect to server request Command Request - Connect
   44 1.762427901    127.0.0.1 → 127.0.0.1    Socks 585 Version: 5 Connect to server response
   45 1.762436910    127.0.0.1 → 127.0.0.1    TCP 68 1080 → 58860 [ACK] Seq=11 Ack=518 Win=350 Len=0 TSval=7612713 TSecr=7612713
   46 1.762533436 192.168.1.16 → 10.6.15.144  SSH 160 Client: Encrypted packet (len=92)
   47 1.777414024  10.6.15.144 → 192.168.1.16 SSH 104 Server: Encrypted packet (len=36)
   48 1.777506940    127.0.0.1 → 127.0.0.1    Socks 78 Version: 5 Connect to server request Command Request - Connect
   49 1.777795765  10.6.15.144 → 192.168.1.16 SSH 104 Server: Encrypted packet (len=36)
   50 1.777857157 192.168.1.16 → 10.6.15.144  TCP 68 58518 → 22 [ACK] Seq=3369 Ack=641 Win=2263 Len=0 TSval=7612717 TSecr=7063003
   51 1.777898640    127.0.0.1 → 127.0.0.1    Socks 78 Version: 5 Connect to server request Command Request - Connect
   52 1.778463630  10.6.15.144 → 192.168.1.16 SSH 104 Server: Encrypted packet (len=36)
   53 1.778495635    127.0.0.1 → 127.0.0.1    Socks 78 Version: 5 Connect to server request Command Request - Connect
   54 1.783198571  10.6.15.144 → 192.168.1.16 TCP 68 22 → 58518 [ACK] Seq=677 Ack=3369 Win=1452 Len=0 TSval=7063004 TSecr=7612712
   55 1.786141367  10.6.15.144 → 192.168.1.16 SSH 384 Server: Encrypted packet (len=316)
   56 1.786181236 192.168.1.16 → 10.6.15.144  TCP 68 58518 → 22 [ACK] Seq=3369 Ack=993 Win=2263 Len=0 TSval=7612719 TSecr=7063003
   57 1.786222299    127.0.0.1 → 127.0.0.1    Socks 354 Unknown
   58 1.786226682    127.0.0.1 → 127.0.0.1    TCP 68 58454 → 1080 [ACK] Seq=144 Ack=333 Win=384 Len=0 TSval=7612719 TSecr=7612710
   59 1.786588280  10.6.15.144 → 192.168.1.16 SSH 200 Server: Encrypted packet (len=132)
   60 1.786646067    127.0.0.1 → 127.0.0.1    Socks 191 Unknown
   61 1.786727414    127.0.0.1 → 127.0.0.1    Socks 114 Unknown
   62 1.786733978    127.0.0.1 → 127.0.0.1    TCP 68 1080 → 58454 [ACK] Seq=456 Ack=190 Win=372 Len=0 TSval=7612720 TSecr=7612720
   63 1.786811377 192.168.1.16 → 10.6.15.144  SSH 136 Client: Encrypted packet (len=68)
   64 1.794558309    127.0.0.1 → 127.0.0.1    TCP 68 58192 → 1080 [ACK] Seq=1122 Ack=47 Win=3637 Len=0 TSval=7612722 TSecr=7612711
   65 1.817938539  10.6.15.144 → 192.168.1.16 SSH 168 Server: Encrypted packet (len=100)
   66 1.818032278    127.0.0.1 → 127.0.0.1    Socks 219 Version: 5
   67 1.818302630    127.0.0.1 → 127.0.0.1    Socks 284 Version: 5
   68 1.818311514    127.0.0.1 → 127.0.0.1    TCP 68 1080 → 58860 [ACK] Seq=162 Ack=734 Win=359 Len=0 TSval=7612727 TSecr=7612727
   69 1.818429703 192.168.1.16 → 10.6.15.144  SSH 304 Client: Encrypted packet (len=236)
   70 1.818516093    127.0.0.1 → 127.0.0.1    TCP 68 58904 → 1080 [ACK] Seq=1 Ack=11 Win=342 Len=0 TSval=7612728 TSecr=7612717
   71 1.818518115    127.0.0.1 → 127.0.0.1    TCP 68 58906 → 1080 [ACK] Seq=1 Ack=11 Win=342 Len=0 TSval=7612728 TSecr=7612717
   72 1.818519773    127.0.0.1 → 127.0.0.1    TCP 68 58908 → 1080 [ACK] Seq=1 Ack=11 Win=342 Len=0 TSval=7612728 TSecr=7612717
   73 1.819169438    127.0.0.1 → 127.0.0.1    Socks 283 Version: 5
   74 1.819172828    127.0.0.1 → 127.0.0.1    TCP 68 1080 → 58860 [ACK] Seq=162 Ack=949 Win=367 Len=0 TSval=7612728 TSecr=7612728
   75 1.821197764 192.168.1.16 → 10.6.15.144  SSH 312 Client: Encrypted packet (len=244)
   76 1.824352432  10.6.15.144 → 192.168.1.16 TCP 68 22 → 58518 [ACK] Seq=1225 Ack=3917 Win=1452 Len=0 TSval=7063014 TSecr=7612727
   77 1.861077994  10.6.15.144 → 192.168.1.16 SSH 120 Server: Encrypted packet (len=52)
   78 1.861171785    127.0.0.1 → 127.0.0.1    Socks 98 Version: 5
   79 1.871613498  10.6.15.144 → 192.168.1.16 SSH 216 Server: Encrypted packet (len=148)
   80 1.871664642 192.168.1.16 → 10.6.15.144  TCP 68 58518 → 22 [ACK] Seq=3917 Ack=1425 Win=2263 Len=0 TSval=7612741 TSecr=7063023
   81 1.871704220    127.0.0.1 → 127.0.0.1    Socks 186 Version: 5
   82 1.871736102    127.0.0.1 → 127.0.0.1    TCP 68 58860 → 1080 [ACK] Seq=949 Ack=310 Win=350 Len=0 TSval=7612741 TSecr=7612738
   83 1.872242598  10.6.15.144 → 192.168.1.16 SSH 232 Server: Encrypted packet (len=164)
   84 1.872288076    127.0.0.1 → 127.0.0.1    Socks 202 Version: 5
   85 1.909223087  10.6.15.144 → 192.168.1.16 SSH 184 Server: Encrypted packet (len=116)
   86 1.909239528 192.168.1.16 → 10.6.15.144  TCP 68 58518 → 22 [ACK] Seq=3917 Ack=1705 Win=2263 Len=0 TSval=7612750 TSecr=7063024
   87 1.909308859    127.0.0.1 → 127.0.0.1    Socks 155 Unknown
   88 1.909312638    127.0.0.1 → 127.0.0.1    TCP 68 58192 → 1080 [ACK] Seq=1122 Ack=134 Win=3637 Len=0 TSval=7612750 TSecr=7612750
   89 1.911303907  10.6.15.144 → 192.168.1.16 SSH 1516 Server: Encrypted packet (len=1448)
   90 1.912406783  10.6.15.144 → 192.168.1.16 SSH 1496 Server: Encrypted packet (len=1428)
   91 1.912413824 192.168.1.16 → 10.6.15.144  TCP 68 58518 → 22 [ACK] Seq=3917 Ack=4581 Win=2263 Len=0 TSval=7612751 TSecr=7063036
   92 1.912482468    127.0.0.1 → 127.0.0.1    Socks 2904 Unknown
   93 1.912487999    127.0.0.1 → 127.0.0.1    TCP 68 58192 → 1080 [ACK] Seq=1122 Ack=2970 Win=3637 Len=0 TSval=7612751 TSecr=7612751
   94 1.913692273  10.6.15.144 → 192.168.1.16 SSH 1516 Server: Encrypted packet (len=1448)
   95 1.914396592  10.6.15.144 → 192.168.1.16 SSH 392 Server: Encrypted packet (len=324)
   96 1.914408550 192.168.1.16 → 10.6.15.144  TCP 68 58518 → 22 [ACK] Seq=3917 Ack=6353 Win=2263 Len=0 TSval=7612751 TSecr=7063036
   97 1.914478117    127.0.0.1 → 127.0.0.1    Socks 1798 Unknown
   98 1.914482300    127.0.0.1 → 127.0.0.1    TCP 68 58192 → 1080 [ACK] Seq=1122 Ack=4700 Win=3637 Len=0 TSval=7612751 TSecr=7612751
   99 1.914514379    127.0.0.1 → 127.0.0.1    TCP 68 58860 → 1080 [ACK] Seq=949 Ack=444 Win=359 Len=0 TSval=7612752 TSecr=7612741
  100 1.928125062  10.6.15.144 → 192.168.1.16 SSH 256 Server: Encrypted packet (len=188)
  101 1.928211809    127.0.0.1 → 127.0.0.1    Socks 233 Unknown
  102 1.928217366    127.0.0.1 → 127.0.0.1    TCP 68 58192 → 1080 [ACK] Seq=1122 Ack=4865 Win=3637 Len=0 TSval=7612755 TSecr=7612755
  103 1.928534636    127.0.0.1 → 127.0.0.1    Socks 114 Unknown
  104 1.928540904    127.0.0.1 → 127.0.0.1    TCP 68 1080 → 58192 [ACK] Seq=4865 Ack=1168 Win=3637 Len=0 TSval=7612755 TSecr=7612755
  105 1.928614533 192.168.1.16 → 10.6.15.144  SSH 136 Client: Encrypted packet (len=68)
  106 1.930042391    127.0.0.1 → 127.0.0.1    Socks 196 Unknown
  107 1.930049168    127.0.0.1 → 127.0.0.1    TCP 68 1080 → 58192 [ACK] Seq=4865 Ack=1296 Win=3637 Len=0 TSval=7612755 TSecr=7612755
  108 1.930071095    127.0.0.1 → 127.0.0.1    Socks 1181 Unknown
  109 1.930072947    127.0.0.1 → 127.0.0.1    TCP 68 1080 → 58192 [ACK] Seq=4865 Ack=2409 Win=3637 Len=0 TSval=7612755 TSecr=7612755
  110 1.930137907 192.168.1.16 → 10.6.15.144  SSH 232 Client: Encrypted packet (len=164)
  111 1.930415530 192.168.1.16 → 10.6.15.144  SSH 1224 Client: Encrypted packet (len=1156)
  112 1.953646682  10.6.15.144 → 192.168.1.16 SSH 136 Server: Encrypted packet (len=68)
  113 1.953746037    127.0.0.1 → 127.0.0.1    Socks 99 Unknown
  114 1.953755384    127.0.0.1 → 127.0.0.1    TCP 56 58826 → 1080 [RST] Seq=1 Win=0 Len=0
  115 1.954034793  10.6.15.144 → 192.168.1.16 SSH 140 Server: Encrypted packet (len=72)
  116 1.954113508 192.168.1.16 → 10.6.15.144  TCP 68 58518 → 22 [ACK] Seq=5305 Ack=6681 Win=2263 Len=0 TSval=7612761 TSecr=7063047
  117 1.954247457 192.168.1.16 → 10.6.15.144  SSH 104 Client: Encrypted packet (len=36)
  118 1.955143502  10.6.15.144 → 192.168.1.16 SSH 128 Server: Encrypted packet (len=60)
  119 1.955236634    127.0.0.1 → 127.0.0.1    Socks 99 Unknown
  120 1.955245614    127.0.0.1 → 127.0.0.1    TCP 56 58756 → 1080 [RST] Seq=1 Win=0 Len=0
  121 1.961520668  10.6.15.144 → 192.168.1.16 SSH 140 Server: Encrypted packet (len=72)
  122 1.961586159 192.168.1.16 → 10.6.15.144  TCP 68 58518 → 22 [ACK] Seq=5341 Ack=6813 Win=2263 Len=0 TSval=7612763 TSecr=7063047
  123 1.983377012  10.6.15.144 → 192.168.1.16 SSH 332 Server: Encrypted packet (len=264)
  124 1.983406197 192.168.1.16 → 10.6.15.144  SSH 104 Client: Encrypted packet (len=36)
  125 1.983501219    127.0.0.1 → 127.0.0.1    Socks 99 Unknown
  126 1.983510485    127.0.0.1 → 127.0.0.1    TCP 56 58828 → 1080 [RST] Seq=1 Win=0 Len=0
  127 1.983519206    127.0.0.1 → 127.0.0.1    Socks 99 Unknown
  128 1.983521042    127.0.0.1 → 127.0.0.1    TCP 56 58758 → 1080 [RST] Seq=1 Win=0 Len=0
  129 1.983800761  10.6.15.144 → 192.168.1.16 TCP 68 22 → 58518 [ACK] Seq=7077 Ack=5305 Win=1452 Len=0 TSval=7063054 TSecr=7612755
  130 1.983811916 192.168.1.16 → 10.6.15.144  SSH 140 Client: Encrypted packet (len=72)
  131 1.996118138  10.6.15.144 → 192.168.1.16 SSH 140 Server: Encrypted packet (len=72)
  132 1.996186715    127.0.0.1 → 127.0.0.1    TCP 68 1080 → 58858 [FIN, ACK] Seq=1 Ack=1 Win=367 Len=0 TSval=7612772 TSecr=7611840
  133 1.996194395    127.0.0.1 → 127.0.0.1    TCP 68 58858 → 1080 [ACK] Seq=1 Ack=2 Win=359 Len=0 TSval=7612772 TSecr=7612772
  134 1.996290690 192.168.1.16 → 10.6.15.144  SSH 104 Client: Encrypted packet (len=36)
  135 2.004491992  10.6.15.144 → 192.168.1.16 SSH 112 Server: Encrypted packet (len=44)
  136 2.004535250    127.0.0.1 → 127.0.0.1    Socks 78 Version: 5 Connect to server request Command Request - Connect
  137 2.005936120  10.6.15.144 → 192.168.1.16 SSH 140 Server: Encrypted packet (len=72)
  138 2.005961714 192.168.1.16 → 10.6.15.144  TCP 68 58518 → 22 [ACK] Seq=5485 Ack=7265 Win=2263 Len=0 TSval=7612774 TSecr=7063060
  139 2.005988281    127.0.0.1 → 127.0.0.1    Socks 78 Version: 5 Connect to server request Command Request - Connect
  140 2.005998163    127.0.0.1 → 127.0.0.1    Socks 78 Version: 5 Connect to server request Command Request - Connect
  141 2.013156496  10.6.15.144 → 192.168.1.16 TCP 80 [TCP Dup ACK 129#1] 22 → 58518 [ACK] Seq=7265 Ack=5305 Win=1452 Len=0 TSval=7063062 TSecr=7612755 SLE=5341 SRE=5377
  142 2.013537713  10.6.15.144 → 192.168.1.16 TCP 80 [TCP Dup ACK 129#2] 22 → 58518 [ACK] Seq=7265 Ack=5305 Win=1452 Len=0 TSval=7063062 TSecr=7612755 SLE=5341 SRE=5449
  143 2.013948424  10.6.15.144 → 192.168.1.16 TCP 80 [TCP Dup ACK 129#3] 22 → 58518 [ACK] Seq=7265 Ack=5305 Win=1452 Len=0 TSval=7063062 TSecr=7612755 SLE=5341 SRE=5485
  144 2.013956578 192.168.1.16 → 10.6.15.144  SSH 104 Client: [TCP Fast Retransmission] , Encrypted packet (len=36)
  145 2.015717401  10.6.15.144 → 192.168.1.16 TCP 68 22 → 58518 [ACK] Seq=7265 Ack=5485 Win=1452 Len=0 TSval=7063062 TSecr=7612776
  146 2.046574077    127.0.0.1 → 127.0.0.1    TCP 68 58902 → 1080 [ACK] Seq=1 Ack=11 Win=342 Len=0 TSval=7612785 TSecr=7612774
  147 2.046576030    127.0.0.1 → 127.0.0.1    TCP 68 58900 → 1080 [ACK] Seq=1 Ack=11 Win=342 Len=0 TSval=7612785 TSecr=7612774
  148 2.046577947    127.0.0.1 → 127.0.0.1    TCP 68 58898 → 1080 [ACK] Seq=1 Ack=11 Win=342 Len=0 TSval=7612785 TSecr=7612774
  149 2.100905090  10.6.15.144 → 192.168.1.16 SSH 640 Server: Encrypted packet (len=572)
  150 2.100987146    127.0.0.1 → 127.0.0.1    Socks 599 Unknown
  151 2.104506953  10.6.15.144 → 192.168.1.16 SSH 384 Server: Encrypted packet (len=316)
  152 2.104575087 192.168.1.16 → 10.6.15.144  TCP 68 58518 → 22 [ACK] Seq=5485 Ack=8153 Win=2263 Len=0 TSval=7612799 TSecr=7063084
  153 2.104619218    127.0.0.1 → 127.0.0.1    Socks 356 Unknown
  154 2.104666173    127.0.0.1 → 127.0.0.1    TCP 68 58192 → 1080 [ACK] Seq=2409 Ack=5684 Win=3637 Len=0 TSval=7612799 TSecr=7612798
  155 2.104887820  10.6.15.144 → 192.168.1.16 SSH 104 Server: Encrypted packet (len=36)
  156 2.104940107    127.0.0.1 → 127.0.0.1    Socks 114 Unknown
  157 2.104941052    127.0.0.1 → 127.0.0.1    Socks 78 Version: 5 Connect to server request Command Request - Connect
  158 2.104944323    127.0.0.1 → 127.0.0.1    TCP 68 1080 → 58192 [ACK] Seq=5684 Ack=2455 Win=3637 Len=0 TSval=7612799 TSecr=7612799
  159 2.104998579 192.168.1.16 → 10.6.15.144  SSH 136 Client: Encrypted packet (len=68)
  160 2.105637354  10.6.15.144 → 192.168.1.16 SSH 104 Server: Encrypted packet (len=36)
  161 2.105686514    127.0.0.1 → 127.0.0.1    Socks 78 Version: 5 Connect to server request Command Request - Connect
  162 2.106601957  10.6.15.144 → 192.168.1.16 TCP 68 22 → 58518 [ACK] Seq=8225 Ack=5553 Win=1452 Len=0 TSval=7063085 TSecr=7612799
  163 2.108594861  10.6.15.144 → 192.168.1.16 SSH 112 Server: Encrypted packet (len=44)
  164 2.108659934 192.168.1.16 → 10.6.15.144  TCP 68 58518 → 22 [ACK] Seq=5553 Ack=8269 Win=2263 Len=0 TSval=7612800 TSecr=7063085
  165 2.108700795    127.0.0.1 → 127.0.0.1    Socks 78 Version: 5 Connect to server request Command Request - Connect
  166 2.108854106    127.0.0.1 → 127.0.0.1    Socks 1335 Version: 5 Connect to server response
  167 2.108864757    127.0.0.1 → 127.0.0.1    TCP 68 1080 → 58888 [ACK] Seq=11 Ack=1268 Win=1365 Len=0 TSval=7612800 TSecr=7612800
  168 2.108953741 192.168.1.16 → 10.6.15.144  SSH 184 Client: Encrypted packet (len=116)
  169 2.109354626  10.6.15.144 → 192.168.1.16 SSH 140 Server: Encrypted packet (len=72)
  170 2.109452887    127.0.0.1 → 127.0.0.1    Socks 78 Version: 5 Connect to server request Command Request - Connect
  171 2.109464151    127.0.0.1 → 127.0.0.1    Socks 78 Version: 5 Connect to server request Command Request - Connect
  172 2.112566014  10.6.15.144 → 192.168.1.16 SSH 104 Server: Encrypted packet (len=36)
  173 2.112631784 192.168.1.16 → 10.6.15.144  TCP 68 58518 → 22 [ACK] Seq=5669 Ack=8377 Win=2263 Len=0 TSval=7612801 TSecr=7063086
  174 2.112685985    127.0.0.1 → 127.0.0.1    Socks 78 Version: 5 Connect to server request Command Request - Connect
  175 2.112826715    127.0.0.1 → 127.0.0.1    Socks 585 Version: 5 Connect to server response
  176 2.112836229    127.0.0.1 → 127.0.0.1    TCP 68 1080 → 58922 [ACK] Seq=11 Ack=518 Win=350 Len=0 TSval=7612801 TSecr=7612801
  177 2.112985280 192.168.1.16 → 10.6.15.144  SSH 432 Client: Encrypted packet (len=364)
  178 2.115409891  10.6.15.144 → 192.168.1.16 SSH 104 Server: Encrypted packet (len=36)
  179 2.115486082    127.0.0.1 → 127.0.0.1    Socks 78 Version: 5 Connect to server request Command Request - Connect
  180 2.115597541    127.0.0.1 → 127.0.0.1    Socks 585 Version: 5 Connect to server response
  181 2.115605654    127.0.0.1 → 127.0.0.1    TCP 68 1080 → 58924 [ACK] Seq=11 Ack=518 Win=350 Len=0 TSval=7612802 TSecr=7612802
  182 2.115682816 192.168.1.16 → 10.6.15.144  SSH 160 Client: Encrypted packet (len=92)
  183 2.116068506  10.6.15.144 → 192.168.1.16 SSH 104 Server: Encrypted packet (len=36)
  184 2.116130282    127.0.0.1 → 127.0.0.1    Socks 78 Version: 5 Connect to server request Command Request - Connect
  185 2.116219414    127.0.0.1 → 127.0.0.1    Socks 585 Version: 5 Connect to server response
  186 2.116226770    127.0.0.1 → 127.0.0.1    TCP 68 1080 → 58926 [ACK] Seq=11 Ack=518 Win=350 Len=0 TSval=7612802 TSecr=7612802
  187 2.117120087  10.6.15.144 → 192.168.1.16 SSH 104 Server: Encrypted packet (len=36)
  188 2.117147844 192.168.1.16 → 10.6.15.144  TCP 68 58518 → 22 [ACK] Seq=6125 Ack=8485 Win=2263 Len=0 TSval=7612802 TSecr=7063087
  189 2.117177772    127.0.0.1 → 127.0.0.1    Socks 78 Version: 5 Connect to server request Command Request - Connect
  190 2.117256281    127.0.0.1 → 127.0.0.1    Socks 585 Version: 5 Connect to server response
  191 2.117264078    127.0.0.1 → 127.0.0.1    TCP 68 1080 → 58928 [ACK] Seq=11 Ack=518 Win=350 Len=0 TSval=7612802 TSecr=7612802
  192 2.127335329  10.6.15.144 → 192.168.1.16 SSH 104 Server: Encrypted packet (len=36)
  193 2.127440702    127.0.0.1 → 127.0.0.1    Socks 78 Version: 5 Connect to server request Command Request - Connect
  194 2.127789462  10.6.15.144 → 192.168.1.16 SSH 140 Server: Encrypted packet (len=72)
  195 2.127817850 192.168.1.16 → 10.6.15.144  TCP 68 58518 → 22 [ACK] Seq=6125 Ack=8593 Win=2263 Len=0 TSval=7612805 TSecr=7063090
  196 2.127851980    127.0.0.1 → 127.0.0.1    Socks 78 Version: 5 Connect to server request Command Request - Connect
  197 2.127860930    127.0.0.1 → 127.0.0.1    Socks 78 Version: 5 Connect to server request Command Request - Connect
  198 2.127977228    127.0.0.1 → 127.0.0.1    Socks 269 Version: 5 Connect to server response
  199 2.127986523    127.0.0.1 → 127.0.0.1    TCP 68 1080 → 58930 [ACK] Seq=11 Ack=202 Win=350 Len=0 TSval=7612805 TSecr=7612805
  200 2.131992995  10.6.15.144 → 192.168.1.16 SSH 104 Server: Encrypted packet (len=36)
  201 2.132094926    127.0.0.1 → 127.0.0.1    Socks 78 Version: 5 Connect to server request Command Request - Connect
  202 2.135956008  10.6.15.144 → 192.168.1.16 SSH 104 Server: Encrypted packet (len=36)
  203 2.136041117 192.168.1.16 → 10.6.15.144  TCP 68 58518 → 22 [ACK] Seq=6125 Ack=8665 Win=2263 Len=0 TSval=7612807 TSecr=7063091
  204 2.136090509    127.0.0.1 → 127.0.0.1    Socks 78 Version: 5 Connect to server request Command Request - Connect
  205 2.136239272    127.0.0.1 → 127.0.0.1    Socks 1281 Version: 5 Connect to server response
  206 2.136248809    127.0.0.1 → 127.0.0.1    TCP 68 1080 → 58886 [ACK] Seq=11 Ack=1214 Win=1365 Len=0 TSval=7612807 TSecr=7612807
  207 2.137459010  10.6.15.144 → 192.168.1.16 SSH 104 Server: Encrypted packet (len=36)
  208 2.137568602    127.0.0.1 → 127.0.0.1    Socks 78 Version: 5 Connect to server request Command Request - Connect
  209 2.142152202  10.6.15.144 → 192.168.1.16 SSH 140 Server: Encrypted packet (len=72)
  210 2.142225835 192.168.1.16 → 10.6.15.144  TCP 68 58518 → 22 [ACK] Seq=6125 Ack=8773 Win=2263 Len=0 TSval=7612808 TSecr=7063092
  211 2.142274302    127.0.0.1 → 127.0.0.1    Socks 78 Version: 5 Connect to server request Command Request - Connect
  212 2.142286155    127.0.0.1 → 127.0.0.1    Socks 78 Version: 5 Connect to server request Command Request - Connect
  213 2.146524891    127.0.0.1 → 127.0.0.1    TCP 68 58892 → 1080 [ACK] Seq=1 Ack=11 Win=342 Len=0 TSval=7612810 TSecr=7612799
  214 2.146527725    127.0.0.1 → 127.0.0.1    TCP 68 58890 → 1080 [ACK] Seq=1 Ack=11 Win=342 Len=0 TSval=7612810 TSecr=7612799
  215 2.150550836    127.0.0.1 → 127.0.0.1    TCP 68 58896 → 1080 [ACK] Seq=1 Ack=11 Win=342 Len=0 TSval=7612811 TSecr=7612800
  216 2.150553476    127.0.0.1 → 127.0.0.1    TCP 68 58894 → 1080 [ACK] Seq=1 Ack=11 Win=342 Len=0 TSval=7612811 TSecr=7612800
  217 2.156579818  10.6.15.144 → 192.168.1.16 SSH 224 Server: Encrypted packet (len=144)
  218 2.156608278 192.168.1.16 → 10.6.15.144  SSH 532 Client: Encrypted packet (len=464)
  219 2.156791031    127.0.0.1 → 127.0.0.1    Socks 78 Version: 5 Connect to server request Command Request - Connect
  220 2.156803373    127.0.0.1 → 127.0.0.1    Socks 78 Version: 5 Connect to server request Command Request - Connect
  221 2.170539004    127.0.0.1 → 127.0.0.1    TCP 68 58916 → 1080 [ACK] Seq=1 Ack=11 Win=342 Len=0 TSval=7612816 TSecr=7612805
  222 2.170540701    127.0.0.1 → 127.0.0.1    TCP 68 58910 → 1080 [ACK] Seq=1 Ack=11 Win=342 Len=0 TSval=7612816 TSecr=7612805
  223 2.173157678  10.6.15.144 → 192.168.1.16 TCP 80 [TCP Dup ACK 172#1] 22 → 58518 [ACK] Seq=8917 Ack=5669 Win=1452 Len=0 TSval=7063102 TSecr=7612801 SLE=6033 SRE=6589
  224 2.173180018 192.168.1.16 → 10.6.15.144  SSH 104 Client: Encrypted packet (len=36)
  225 2.174526729    127.0.0.1 → 127.0.0.1    TCP 68 58882 → 1080 [ACK] Seq=1 Ack=11 Win=342 Len=0 TSval=7612817 TSecr=7612806
  226 2.174823033  10.6.15.144 → 192.168.1.16 TCP 80 [TCP Dup ACK 172#2] 22 → 58518 [ACK] Seq=8917 Ack=5669 Win=1452 Len=0 TSval=7063102 TSecr=7612801 SLE=6033 SRE=6625
  227 2.174837640 192.168.1.16 → 10.6.15.144  SSH 432 Client: [TCP Fast Retransmission] , Encrypted packet (len=364)
  228 2.176579325  10.6.15.144 → 192.168.1.16 TCP 68 22 → 58518 [ACK] Seq=8917 Ack=6625 Win=1445 Len=0 TSval=7063103 TSecr=7612817
  229 2.178551001    127.0.0.1 → 127.0.0.1    TCP 68 58912 → 1080 [ACK] Seq=1 Ack=11 Win=342 Len=0 TSval=7612818 TSecr=7612807
  230 2.182550609    127.0.0.1 → 127.0.0.1    TCP 68 58920 → 1080 [ACK] Seq=1 Ack=11 Win=342 Len=0 TSval=7612819 TSecr=7612808
  231 2.182552315    127.0.0.1 → 127.0.0.1    TCP 68 58914 → 1080 [ACK] Seq=1 Ack=11 Win=342 Len=0 TSval=7612819 TSecr=7612808
  232 2.198577670    127.0.0.1 → 127.0.0.1    TCP 68 58918 → 1080 [ACK] Seq=1 Ack=11 Win=342 Len=0 TSval=7612823 TSecr=7612812
  233 2.198579357    127.0.0.1 → 127.0.0.1    TCP 68 58884 → 1080 [ACK] Seq=1 Ack=11 Win=342 Len=0 TSval=7612823 TSecr=7612812
  234 2.256556648  10.22.18.98 → 224.0.0.252  LLMNR 71 Standard query 0xe951 A sxipiwpqd
  235 2.258255182  10.22.18.98 → 224.0.0.252  LLMNR 76 Standard query 0x7a8b A dugdelhqaeedlp
  236 2.618526512 192.168.1.16 → 151.101.9.140 TCP 68 36298 → 443 [ACK] Seq=1 Ack=1 Win=364 Len=0 TSval=7612928 TSecr=2547857929
  237 2.619290853 192.168.1.16 → 104.20.136.42 TCP 68 45658 → 80 [ACK] Seq=1 Ack=1 Win=241 Len=0 TSval=7612928 TSecr=1012059993
  238 2.619296254 192.168.1.16 → 104.24.28.86 TCP 56 46600 → 443 [ACK] Seq=1 Ack=1 Win=453 Len=0
  239 2.631899153  10.6.15.144 → 192.168.1.16 SSH 112 Server: Encrypted packet (len=44)
  240 2.631988273    127.0.0.1 → 127.0.0.1    Socks 290 Version: 5
  241 2.632573350  10.6.15.144 → 192.168.1.16 SSH 1516 Server: Encrypted packet (len=1448)
  242 2.632583271 192.168.1.16 → 10.6.15.144  TCP 68 58518 → 22 [ACK] Seq=6625 Ack=10409 Win=2263 Len=0 TSval=7612931 TSecr=7063179
  243 2.633261962  10.6.15.144 → 192.168.1.16 SSH 1176 Server: Encrypted packet (len=1108)
  244 2.633406613    127.0.0.1 → 127.0.0.1    Socks 3084 Version: 5
  245 2.633471997    127.0.0.1 → 127.0.0.1    TCP 68 58930 → 1080 [ACK] Seq=202 Ack=3027 Win=1365 Len=0 TSval=7612931 TSecr=7612931
  246 2.633822218  10.6.15.144 → 192.168.1.16 SSH 984 Server: Encrypted packet (len=916)
  247 2.633832645 192.168.1.16 → 10.6.15.144  TCP 68 58518 → 22 [ACK] Seq=6625 Ack=12433 Win=2263 Len=0 TSval=7612931 TSecr=7063198
  248 2.633929654    127.0.0.1 → 127.0.0.1    Socks 1516 Version: 5
  249 2.634239922    127.0.0.1 → 127.0.0.1    Socks 161 Version: 5
  250 2.634244126    127.0.0.1 → 127.0.0.1    TCP 68 1080 → 58930 [ACK] Seq=3027 Ack=295 Win=350 Len=0 TSval=7612931 TSecr=7612931
  251 2.634359264 192.168.1.16 → 10.6.15.144  SSH 184 Client: Encrypted packet (len=116)
  252 2.635591640    127.0.0.1 → 127.0.0.1    TCP 68 58928 → 1080 [ACK] Seq=518 Ack=1459 Win=1365 Len=0 TSval=7612932 TSecr=7612931
  253 2.638193311  10.6.15.144 → 192.168.1.16 SSH 488 Server: Encrypted packet (len=420)
  254 2.638264770    127.0.0.1 → 127.0.0.1    Socks 1540 Version: 5
  255 2.638665786  10.6.15.144 → 192.168.1.16 SSH 512 Server: Encrypted packet (len=444)
  256 2.638686932 192.168.1.16 → 10.6.15.144  TCP 68 58518 → 22 [ACK] Seq=6741 Ack=13297 Win=2263 Len=0 TSval=7612933 TSecr=7063198
  257 2.638723165    127.0.0.1 → 127.0.0.1    Socks 2988 Version: 5
  258 2.639008071    127.0.0.1 → 127.0.0.1    Socks 194 Version: 5
  259 2.639016619    127.0.0.1 → 127.0.0.1    TCP 68 1080 → 58928 [ACK] Seq=2931 Ack=644 Win=350 Len=0 TSval=7612933 TSecr=7612933
  260 2.639036436    127.0.0.1 → 127.0.0.1    TCP 68 58922 → 1080 [ACK] Seq=518 Ack=2931 Win=1365 Len=0 TSval=7612933 TSecr=7612933
  261 2.639079747 192.168.1.16 → 10.6.15.144  SSH 216 Client: Encrypted packet (len=148)
  262 2.639156751  10.6.15.144 → 192.168.1.16 SSH 512 Server: Encrypted packet (len=444)
  263 2.639202358    127.0.0.1 → 127.0.0.1    Socks 2988 Version: 5
  264 2.639716054    127.0.0.1 → 127.0.0.1    Socks 194 Version: 5
  265 2.639718684    127.0.0.1 → 127.0.0.1    TCP 68 1080 → 58922 [ACK] Seq=2931 Ack=644 Win=350 Len=0 TSval=7612933 TSecr=7612933
  266 2.639737939    127.0.0.1 → 127.0.0.1    TCP 68 58926 → 1080 [ACK] Seq=518 Ack=2931 Win=1365 Len=0 TSval=7612933 TSecr=7612933
  267 2.639808502  10.6.15.144 → 192.168.1.16 SSH 512 Server: Encrypted packet (len=444)
  268 2.639826252 192.168.1.16 → 10.6.15.144  TCP 68 58518 → 22 [ACK] Seq=6889 Ack=14185 Win=2263 Len=0 TSval=7612933 TSecr=7063199
  269 2.639858065    127.0.0.1 → 127.0.0.1    Socks 2988 Version: 5
  270 2.640419177    127.0.0.1 → 127.0.0.1    Socks 194 Version: 5
  271 2.640421874    127.0.0.1 → 127.0.0.1    TCP 68 1080 → 58926 [ACK] Seq=2931 Ack=644 Win=350 Len=0 TSval=7612933 TSecr=7612933
  272 2.640440705    127.0.0.1 → 127.0.0.1    TCP 68 58924 → 1080 [ACK] Seq=518 Ack=2931 Win=1365 Len=0 TSval=7612933 TSecr=7612933
  273 2.641065479    127.0.0.1 → 127.0.0.1    Socks 194 Version: 5
  274 2.641067761    127.0.0.1 → 127.0.0.1    TCP 68 1080 → 58924 [ACK] Seq=2931 Ack=644 Win=350 Len=0 TSval=7612933 TSecr=7612933
  275 2.641251070  10.6.15.144 → 192.168.1.16 SSH 1516 Server: Encrypted packet (len=1448)
  276 2.646383637  10.6.15.144 → 192.168.1.16 SSH 1516 Server: Encrypted packet (len=1448)
  277 2.646387285 192.168.1.16 → 10.6.15.144  TCP 68 58518 → 22 [ACK] Seq=6889 Ack=17081 Win=2263 Len=0 TSval=7612934 TSecr=7063200
  278 2.646461286    127.0.0.1 → 127.0.0.1    Socks 2964 Version: 5
  279 2.646494849    127.0.0.1 → 127.0.0.1    TCP 68 58886 → 1080 [ACK] Seq=1214 Ack=2907 Win=1365 Len=0 TSval=7612934 TSecr=7612934
  280 2.646692824  10.6.15.144 → 192.168.1.16 SSH 1516 Server: Encrypted packet (len=1448)
  281 2.647012973  10.6.15.144 → 192.168.1.16 SSH 1516 Server: Encrypted packet (len=1448)
  282 2.647021343 192.168.1.16 → 10.6.15.144  TCP 68 58518 → 22 [ACK] Seq=6889 Ack=19977 Win=2263 Len=0 TSval=7612935 TSecr=7063217
  283 2.647336120  10.6.15.144 → 192.168.1.16 SSH 1516 Server: Encrypted packet (len=1448)
  284 2.647351036  10.6.15.144 → 192.168.1.16 TCP 68 22 → 58518 [ACK] Seq=21425 Ack=6741 Win=1452 Len=0 TSval=7063218 TSecr=7612931
  285 2.647362166 192.168.1.16 → 10.6.15.144  SSH 488 Client: Encrypted packet (len=420)
  286 2.647691174  10.6.15.144 → 192.168.1.16 SSH 1516 Server: Encrypted packet (len=1448)
  287 2.647998016  10.6.15.144 → 192.168.1.16 SSH 1516 Server: Encrypted packet (len=1448)
  288 2.648004714 192.168.1.16 → 10.6.15.144  TCP 68 58518 → 22 [ACK] Seq=7309 Ack=24321 Win=2263 Len=0 TSval=7612935 TSecr=7063219
  289 2.649456248  10.6.15.144 → 192.168.1.16 SSH 1516 Server: Encrypted packet (len=1448)
  290 2.649771571  10.6.15.144 → 192.168.1.16 SSH 1516 Server: Encrypted packet (len=1448)
  291 2.649784187 192.168.1.16 → 10.6.15.144  TCP 68 58518 → 22 [ACK] Seq=7309 Ack=27217 Win=2263 Len=0 TSval=7612935 TSecr=7063219
  292 2.650518274  10.6.15.144 → 192.168.1.16 SSH 1420 Server: Encrypted packet (len=1352)
  293 2.650695779    127.0.0.1 → 127.0.0.1    Socks 11652 Version: 5
  294 2.653398960    127.0.0.1 → 127.0.0.1    TCP 76 58972 → 1080 [SYN] Seq=0 Win=43690 Len=0 MSS=65495 SACK_PERM=1 TSval=7612936 TSecr=0 WS=128
  295 2.653414701    127.0.0.1 → 127.0.0.1    TCP 76 1080 → 58972 [SYN, ACK] Seq=0 Ack=1 Win=43690 Len=0 MSS=65495 SACK_PERM=1 TSval=7612936 TSecr=7612936 WS=128
  296 2.653426577    127.0.0.1 → 127.0.0.1    TCP 68 58972 → 1080 [ACK] Seq=1 Ack=1 Win=43776 Len=0 TSval=7612936 TSecr=7612936
  297 2.653669256    127.0.0.1 → 127.0.0.1    TCP 68 58890 → 1080 [FIN, ACK] Seq=1 Ack=11 Win=342 Len=0 TSval=7612936 TSecr=7612799
  298 2.653751029 192.168.1.16 → 10.6.15.144  SSH 104 Client: Encrypted packet (len=36)
  299 2.653851123    127.0.0.1 → 127.0.0.1    TCP 76 58974 → 1080 [SYN] Seq=0 Win=43690 Len=0 MSS=65495 SACK_PERM=1 TSval=7612936 TSecr=0 WS=128
  300 2.653859287    127.0.0.1 → 127.0.0.1    TCP 76 1080 → 58974 [SYN, ACK] Seq=0 Ack=1 Win=43690 Len=0 MSS=65495 SACK_PERM=1 TSval=7612936 TSecr=7612936 WS=128
  301 2.653866998    127.0.0.1 → 127.0.0.1    TCP 68 58974 → 1080 [ACK] Seq=1 Ack=1 Win=43776 Len=0 TSval=7612936 TSecr=7612936
  302 2.654060165    127.0.0.1 → 127.0.0.1    TCP 68 58892 → 1080 [FIN, ACK] Seq=1 Ack=11 Win=342 Len=0 TSval=7612936 TSecr=7612799
  303 2.654185862    127.0.0.1 → 127.0.0.1    TCP 76 58976 → 1080 [SYN] Seq=0 Win=43690 Len=0 MSS=65495 SACK_PERM=1 TSval=7612936 TSecr=0 WS=128
  304 2.654191773    127.0.0.1 → 127.0.0.1    TCP 76 1080 → 58976 [SYN, ACK] Seq=0 Ack=1 Win=43690 Len=0 MSS=65495 SACK_PERM=1 TSval=7612936 TSecr=7612936 WS=128
  305 2.654197807    127.0.0.1 → 127.0.0.1    TCP 68 58976 → 1080 [ACK] Seq=1 Ack=1 Win=43776 Len=0 TSval=7612936 TSecr=7612936
  306 2.654388004    127.0.0.1 → 127.0.0.1    TCP 68 58894 → 1080 [FIN, ACK] Seq=1 Ack=11 Win=342 Len=0 TSval=7612936 TSecr=7612800
  307 2.654516251    127.0.0.1 → 127.0.0.1    TCP 76 58978 → 1080 [SYN] Seq=0 Win=43690 Len=0 MSS=65495 SACK_PERM=1 TSval=7612936 TSecr=0 WS=128
  308 2.654522643    127.0.0.1 → 127.0.0.1    TCP 76 1080 → 58978 [SYN, ACK] Seq=0 Ack=1 Win=43690 Len=0 MSS=65495 SACK_PERM=1 TSval=7612937 TSecr=7612936 WS=128
  309 2.654541042    127.0.0.1 → 127.0.0.1    TCP 68 58978 → 1080 [ACK] Seq=1 Ack=1 Win=43776 Len=0 TSval=7612937 TSecr=7612937
  310 2.655135500    127.0.0.1 → 127.0.0.1    Socks 71 Version: 5 Connect to server request
  311 2.655146450    127.0.0.1 → 127.0.0.1    TCP 68 1080 → 58972 [ACK] Seq=1 Ack=4 Win=43776 Len=0 TSval=7612937 TSecr=7612937
  312 2.655203255    127.0.0.1 → 127.0.0.1    Socks 70 Version: 5 Connect to server response
  313 2.655224527    127.0.0.1 → 127.0.0.1    TCP 68 58972 → 1080 [ACK] Seq=4 Ack=3 Win=43776 Len=0 TSval=7612937 TSecr=7612937
  314 2.655239438    127.0.0.1 → 127.0.0.1    Socks 88 Version: 5 Command Request - Connect
  315 2.655348548    127.0.0.1 → 127.0.0.1    Socks 71 Version: 5 Connect to server request
  316 2.655354204    127.0.0.1 → 127.0.0.1    TCP 68 1080 → 58974 [ACK] Seq=1 Ack=4 Win=43776 Len=0 TSval=7612937 TSecr=7612937
  317 2.655384839    127.0.0.1 → 127.0.0.1    Socks 70 Version: 5 Connect to server response
  318 2.655402237    127.0.0.1 → 127.0.0.1    TCP 68 58974 → 1080 [ACK] Seq=4 Ack=3 Win=43776 Len=0 TSval=7612937 TSecr=7612937
  319 2.655413936    127.0.0.1 → 127.0.0.1    Socks 88 Version: 5 Command Request - Connect
  320 2.655494210    127.0.0.1 → 127.0.0.1    Socks 71 Version: 5 Connect to server request
  321 2.655498946    127.0.0.1 → 127.0.0.1    TCP 68 1080 → 58976 [ACK] Seq=1 Ack=4 Win=43776 Len=0 TSval=7612937 TSecr=7612937
  322 2.655527065    127.0.0.1 → 127.0.0.1    Socks 70 Version: 5 Connect to server response
  323 2.655543171    127.0.0.1 → 127.0.0.1    TCP 68 58976 → 1080 [ACK] Seq=4 Ack=3 Win=43776 Len=0 TSval=7612937 TSecr=7612937
  324 2.655554188    127.0.0.1 → 127.0.0.1    Socks 89 Version: 5 Command Request - Connect
  325 2.655629761    127.0.0.1 → 127.0.0.1    Socks 71 Version: 5 Connect to server request
  326 2.655634460    127.0.0.1 → 127.0.0.1    TCP 68 1080 → 58978 [ACK] Seq=1 Ack=4 Win=43776 Len=0 TSval=7612937 TSecr=7612937
  327 2.655662015    127.0.0.1 → 127.0.0.1    Socks 70 Version: 5 Connect to server response
  328 2.655678256    127.0.0.1 → 127.0.0.1    TCP 68 58978 → 1080 [ACK] Seq=4 Ack=3 Win=43776 Len=0 TSval=7612937 TSecr=7612937
  329 2.655689242    127.0.0.1 → 127.0.0.1    Socks 90 Version: 5 Command Request - Connect
  330 2.656780713  10.6.15.144 → 192.168.1.16 TCP 68 22 → 58518 [ACK] Seq=28569 Ack=7345 Win=1452 Len=0 TSval=7063223 TSecr=7612935
  331 2.656804426 192.168.1.16 → 10.6.15.144  SSH 316 Client: Encrypted packet (len=248)
  332 2.670166882  10.22.18.98 → 224.0.0.252  LLMNR 71 Standard query 0xe951 A sxipiwpqd
  333 2.670927428  10.22.18.98 → 224.0.0.252  LLMNR 76 Standard query 0x7a8b A dugdelhqaeedlp
  334 2.674526407    127.0.0.1 → 127.0.0.1    TCP 68 58888 → 1080 [ACK] Seq=1268 Ack=233 Win=350 Len=0 TSval=7612942 TSecr=7612931
  335 2.694527393    127.0.0.1 → 127.0.0.1    TCP 68 1080 → 58894 [ACK] Seq=11 Ack=2 Win=342 Len=0 TSval=7612947 TSecr=7612936
  336 2.694527368    127.0.0.1 → 127.0.0.1    TCP 68 58886 → 1080 [ACK] Seq=1214 Ack=14491 Win=2388 Len=0 TSval=7612947 TSecr=7612936
  337 2.694530516    127.0.0.1 → 127.0.0.1    TCP 68 1080 → 58892 [ACK] Seq=11 Ack=2 Win=342 Len=0 TSval=7612947 TSecr=7612936
  338 2.694531961    127.0.0.1 → 127.0.0.1    TCP 68 1080 → 58890 [ACK] Seq=11 Ack=2 Win=342 Len=0 TSval=7612947 TSecr=7612936
  339 2.695872450  10.6.15.144 → 192.168.1.16 TCP 68 22 → 58518 [ACK] Seq=28569 Ack=7593 Win=1452 Len=0 TSval=7063233 TSecr=7612937
  340 2.698531122    127.0.0.1 → 127.0.0.1    TCP 68 1080 → 58978 [ACK] Seq=3 Ack=26 Win=43776 Len=0 TSval=7612948 TSecr=7612937
  341 2.698534417    127.0.0.1 → 127.0.0.1    TCP 68 1080 → 58976 [ACK] Seq=3 Ack=25 Win=43776 Len=0 TSval=7612948 TSecr=7612937
  342 2.698535873    127.0.0.1 → 127.0.0.1    TCP 68 1080 → 58974 [ACK] Seq=3 Ack=24 Win=43776 Len=0 TSval=7612948 TSecr=7612937
  343 2.698537541    127.0.0.1 → 127.0.0.1    TCP 68 1080 → 58972 [ACK] Seq=3 Ack=24 Win=43776 Len=0 TSval=7612948 TSecr=7612937
  344 2.732921085  10.6.15.144 → 192.168.1.16 SSH 112 Server: Encrypted packet (len=44)
  345 2.733032003    127.0.0.1 → 127.0.0.1    Socks 78 Version: 5, Remote Port: 80 Command Response - Connect
  346 2.759410652 192.168.1.16 → 239.255.255.250 SSDP 215 M-SEARCH * HTTP/1.1 
  347 2.768703911    127.0.0.1 → 127.0.0.1    TCP 68 58896 → 1080 [FIN, ACK] Seq=1 Ack=11 Win=342 Len=0 TSval=7612965 TSecr=7612800
  348 2.768778242    127.0.0.1 → 127.0.0.1    TCP 76 58980 → 1080 [SYN] Seq=0 Win=43690 Len=0 MSS=65495 SACK_PERM=1 TSval=7612965 TSecr=0 WS=128
  349 2.768784310    127.0.0.1 → 127.0.0.1    TCP 76 1080 → 58980 [SYN, ACK] Seq=0 Ack=1 Win=43690 Len=0 MSS=65495 SACK_PERM=1 TSval=7612965 TSecr=7612965 WS=128
  350 2.768791034    127.0.0.1 → 127.0.0.1    TCP 68 58980 → 1080 [ACK] Seq=1 Ack=1 Win=43776 Len=0 TSval=7612965 TSecr=7612965
  351 2.768808952 192.168.1.16 → 10.6.15.144  SSH 104 Client: Encrypted packet (len=36)
  352 2.768858384    127.0.0.1 → 127.0.0.1    Socks 71 Version: 5 Connect to server request
  353 2.768862771    127.0.0.1 → 127.0.0.1    TCP 68 1080 → 58980 [ACK] Seq=1 Ack=4 Win=43776 Len=0 TSval=7612965 TSecr=7612965
  354 2.768884378    127.0.0.1 → 127.0.0.1    Socks 70 Version: 5 Connect to server response
  355 2.768889306    127.0.0.1 → 127.0.0.1    TCP 68 58980 → 1080 [ACK] Seq=4 Ack=3 Win=43776 Len=0 TSval=7612965 TSecr=7612965
  356 2.768910090    127.0.0.1 → 127.0.0.1    Socks 91 Version: 5 Command Request - Connect
  357 2.769043306 192.168.1.16 → 10.6.15.144  SSH 112 Client: Encrypted packet (len=44)
  358 2.770223258  10.6.15.144 → 192.168.1.16 TCP 68 22 → 58518 [ACK] Seq=28613 Ack=7629 Win=1452 Len=0 TSval=7063251 TSecr=7612965
  359 2.770236837  10.6.15.144 → 192.168.1.16 TCP 68 22 → 58518 [ACK] Seq=28613 Ack=7673 Win=1452 Len=0 TSval=7063251 TSecr=7612965
  360 2.774538503    127.0.0.1 → 127.0.0.1    TCP 68 58978 → 1080 [ACK] Seq=26 Ack=13 Win=43776 Len=0 TSval=7612967 TSecr=7612956
  361 2.784083582 104.24.28.86 → 192.168.1.16 TCP 62 [TCP ACKed unseen segment] 443 → 46600 [ACK] Seq=1 Ack=2 Win=31 Len=0
  362 2.799388175 151.101.9.140 → 192.168.1.16 TCP 68 [TCP ACKed unseen segment] 443 → 36298 [ACK] Seq=1 Ack=2 Win=61 Len=0 TSval=2547869650 TSecr=7543632
  363 2.810532680    127.0.0.1 → 127.0.0.1    TCP 68 1080 → 58980 [ACK] Seq=3 Ack=27 Win=43776 Len=0 TSval=7612976 TSecr=7612965
  364 2.810534165    127.0.0.1 → 127.0.0.1    TCP 68 1080 → 58896 [ACK] Seq=11 Ack=2 Win=342 Len=0 TSval=7612976 TSecr=7612965
  365 3.604850879    127.0.0.1 → 127.0.1.1    DNS 83 Standard query 0x93ab A 3.ubuntu.pool.ntp.org
  366 3.604898425 192.168.1.16 → 192.168.1.1  DNS 83 Standard query 0x5254 A 3.ubuntu.pool.ntp.org
  367 3.606940112  10.6.15.144 → 192.168.1.16 SSH 1516 Server: Encrypted packet (len=1448)
  368 3.607524810  10.6.15.144 → 192.168.1.16 SSH 112 Server: Encrypted packet (len=44)
  369 3.607532089 192.168.1.16 → 10.6.15.144  TCP 68 58518 → 22 [ACK] Seq=7673 Ack=30105 Win=2263 Len=0 TSval=7613175 TSecr=7063299
  370 3.607591324    127.0.0.1 → 127.0.0.1    Socks 1516 Version: 5
  371 3.607594549    127.0.0.1 → 127.0.0.1    TCP 68 58886 → 1080 [ACK] Seq=1214 Ack=15939 Win=3411 Len=0 TSval=7613175 TSecr=7613175
  372 3.614725801  10.6.15.144 → 192.168.1.16 SSH 1516 Server: Encrypted packet (len=1448)
