    1 0.000000000  10.6.15.156 → 192.168.1.12 SSH 102 Server: Encrypted packet (len=36)
    2 0.000349356 192.168.1.12 → 10.6.15.156  SSH 158 Client: Encrypted packet (len=92)
    3 0.001979220  10.6.15.156 → 192.168.1.12 TCP 66 22 → 54766 [ACK] Seq=37 Ack=93 Win=1452 Len=0 TSval=14273068 TSecr=7341577
    4 0.014822496  10.6.15.156 → 192.168.1.12 SSH 102 Server: Encrypted packet (len=36)
    5 0.015127010 192.168.1.12 → 10.6.15.156  SSH 158 Client: Encrypted packet (len=92)
    6 0.054523014  10.6.15.156 → 192.168.1.12 TCP 66 22 → 54766 [ACK] Seq=73 Ack=185 Win=1452 Len=0 TSval=14273082 TSecr=7341581
    7 0.107785491  10.6.15.156 → 192.168.1.12 SSH 1198 Server: Encrypted packet (len=1132)
    8 0.108826302 192.168.1.12 → 10.6.15.156  SSH 206 Client: Encrypted packet (len=140)
    9 0.110520823  10.6.15.156 → 192.168.1.12 TCP 66 22 → 54766 [ACK] Seq=1205 Ack=325 Win=1452 Len=0 TSval=14273096 TSecr=7341605
   10 0.118589499  10.6.15.156 → 192.168.1.12 SSH 526 Server: Encrypted packet (len=460)
   11 0.119628925 192.168.1.12 → 10.6.15.156  SSH 206 Client: Encrypted packet (len=140)
   12 0.129247281  10.6.15.156 → 192.168.1.12 SSH 102 Server: Encrypted packet (len=36)
   13 0.129378864  10.6.15.156 → 192.168.1.12 SSH 102 Server: Encrypted packet (len=36)
   14 0.129397604 192.168.1.12 → 10.6.15.156  TCP 66 54766 → 22 [ACK] Seq=465 Ack=1737 Win=2571 Len=0 TSval=7341610 TSecr=14273100
   15 0.129610644 192.168.1.12 → 10.6.15.156  SSH 150 Client: Encrypted packet (len=84)
   16 0.164136380  10.6.15.156 → 192.168.1.12 SSH 138 Server: Encrypted packet (len=72)
   17 0.164162715 192.168.1.12 → 10.6.15.156  SSH 150 Client: Encrypted packet (len=84)
   18 0.184801551  10.6.15.156 → 192.168.1.12 SSH 102 Server: Encrypted packet (len=36)
   19 0.184830701 192.168.1.12 → 10.6.15.156  SSH 234 Client: Encrypted packet (len=168)
   20 0.219936953  10.6.15.156 → 192.168.1.12 SSH 102 Server: Encrypted packet (len=36)
   21 0.219957235 192.168.1.12 → 10.6.15.156  SSH 150 Client: Encrypted packet (len=84)
   22 0.221344441  10.6.15.156 → 192.168.1.12 SSH 102 Server: Encrypted packet (len=36)
   23 0.225648896  10.6.15.156 → 192.168.1.12 SSH 1254 Server: Encrypted packet (len=1188)
   24 0.225669477 192.168.1.12 → 10.6.15.156  SSH 266 Client: Encrypted packet (len=200)
   25 0.226150962  10.6.15.156 → 192.168.1.12 SSH 110 Server: Encrypted packet (len=44)
   26 0.246401319  10.6.15.156 → 192.168.1.12 SSH 102 Server: Encrypted packet (len=36)
   27 0.246422399 192.168.1.12 → 10.6.15.156  SSH 150 Client: Encrypted packet (len=84)
   28 0.254791552  10.6.15.156 → 192.168.1.12 SSH 102 Server: Encrypted packet (len=36)
   29 0.254813445 192.168.1.12 → 10.6.15.156  SSH 150 Client: Encrypted packet (len=84)
   30 0.257500601  10.6.15.156 → 192.168.1.12 SSH 526 Server: Encrypted packet (len=460)
   31 0.257511827 192.168.1.12 → 10.6.15.156  SSH 150 Client: Encrypted packet (len=84)
   32 0.298590061  10.6.15.156 → 192.168.1.12 TCP 66 22 → 54766 [ACK] Seq=3681 Ack=1337 Win=1452 Len=0 TSval=14273143 TSecr=7341642
   33 0.298607522 192.168.1.12 → 10.6.15.156  SSH 206 Client: Encrypted packet (len=140)
   34 0.300275892  10.6.15.156 → 192.168.1.12 TCP 66 22 → 54766 [ACK] Seq=3681 Ack=1477 Win=1452 Len=0 TSval=14273143 TSecr=7341652
   35 0.339026291  10.6.15.156 → 192.168.1.12 SSH 238 Server: Encrypted packet (len=172)
   36 0.339318995 192.168.1.12 → 10.6.15.156  SSH 134 Client: Encrypted packet (len=68)
   37 0.341017926  10.6.15.156 → 192.168.1.12 TCP 66 22 → 54766 [ACK] Seq=3853 Ack=1545 Win=1452 Len=0 TSval=14273153 TSecr=7341662
   38 0.366058418  10.6.15.156 → 192.168.1.12 SSH 174 Server: Encrypted packet (len=108)
   39 0.366359359 192.168.1.12 → 10.6.15.156  SSH 134 Client: Encrypted packet (len=68)
   40 0.406397587  10.6.15.156 → 192.168.1.12 TCP 66 22 → 54766 [ACK] Seq=3961 Ack=1613 Win=1452 Len=0 TSval=14273170 TSecr=7341669
   41 0.509760063  10.6.15.156 → 192.168.1.12 SSH 534 Server: Encrypted packet (len=468)
   42 0.510749725 192.168.1.12 → 10.6.15.156  SSH 206 Client: Encrypted packet (len=140)
   43 0.512480759  10.6.15.156 → 192.168.1.12 TCP 66 22 → 54766 [ACK] Seq=4429 Ack=1753 Win=1452 Len=0 TSval=14273196 TSecr=7341705
   44 0.533436124  10.6.15.156 → 192.168.1.12 SSH 350 Server: Encrypted packet (len=284)
   45 0.534033992 192.168.1.12 → 10.6.15.156  SSH 654 Client: Encrypted packet (len=588)
   46 0.554213272  10.6.15.156 → 192.168.1.12 SSH 350 Server: Encrypted packet (len=284)
   47 0.600067389  10.6.15.156 → 192.168.1.12 SSH 534 Server: Encrypted packet (len=468)
   48 0.600080184 192.168.1.12 → 10.6.15.156  TCP 66 54766 → 22 [ACK] Seq=2341 Ack=5465 Win=2571 Len=0 TSval=7341727 TSecr=14273206
   49 0.601089156 192.168.1.12 → 10.6.15.156  SSH 206 Client: Encrypted packet (len=140)
   50 0.636895691  10.6.15.156 → 192.168.1.12 SSH 1254 Server: Encrypted packet (len=1188)
   51 0.637006057  10.6.15.156 → 192.168.1.12 SSH 462 Server: Encrypted packet (len=396)
   52 0.637013635 192.168.1.12 → 10.6.15.156  TCP 66 54766 → 22 [ACK] Seq=2481 Ack=7049 Win=2571 Len=0 TSval=7341737 TSecr=14273227
   53 0.637959849 192.168.1.12 → 10.6.15.156  SSH 206 Client: Encrypted packet (len=140)
   54 0.678436094  10.6.15.156 → 192.168.1.12 TCP 66 22 → 54766 [ACK] Seq=7049 Ack=2621 Win=1452 Len=0 TSval=14273238 TSecr=7341737
   55 0.689872536  10.6.15.156 → 192.168.1.12 SSH 198 Server: Encrypted packet (len=132)
   56 0.689990033  10.6.15.156 → 192.168.1.12 SSH 462 Server: Encrypted packet (len=396)
   57 0.690025447 192.168.1.12 → 10.6.15.156  TCP 66 54766 → 22 [ACK] Seq=2621 Ack=7577 Win=2571 Len=0 TSval=7341750 TSecr=14273240
   58 0.690911053 192.168.1.12 → 10.6.15.156  SSH 206 Client: Encrypted packet (len=140)
   59 0.692390001  10.6.15.156 → 192.168.1.12 SSH 174 Server: Encrypted packet (len=108)
   60 0.692597465  10.6.15.156 → 192.168.1.12 SSH 486 Server: Encrypted packet (len=420)
   61 0.692626870 192.168.1.12 → 10.6.15.156  TCP 66 54766 → 22 [ACK] Seq=2761 Ack=8105 Win=2571 Len=0 TSval=7341750 TSecr=14273240
   62 0.693576072 192.168.1.12 → 10.6.15.156  SSH 206 Client: Encrypted packet (len=140)
   63 0.694327652  10.6.15.156 → 192.168.1.12 TCP 66 22 → 54766 [ACK] Seq=8105 Ack=2761 Win=1452 Len=0 TSval=14273242 TSecr=7341750
   64 0.695899754  10.6.15.156 → 192.168.1.12 TCP 66 22 → 54766 [ACK] Seq=8105 Ack=2901 Win=1452 Len=0 TSval=14273242 TSecr=7341751
   65 0.747466921  10.6.15.156 → 192.168.1.12 SSH 534 Server: Encrypted packet (len=468)
   66 0.748442580 192.168.1.12 → 10.6.15.156  SSH 206 Client: Encrypted packet (len=140)
   67 0.750302365  10.6.15.156 → 192.168.1.12 TCP 66 22 → 54766 [ACK] Seq=8573 Ack=3041 Win=1452 Len=0 TSval=14273256 TSecr=7341764
   68 0.772075283  10.6.15.156 → 192.168.1.12 SSH 942 Server: Encrypted packet (len=876)
   69 0.772195323  10.6.15.156 → 192.168.1.12 SSH 214 Server: Encrypted packet (len=148)
   70 0.772241388 192.168.1.12 → 10.6.15.156  TCP 66 54766 → 22 [ACK] Seq=3041 Ack=9597 Win=2571 Len=0 TSval=7341770 TSecr=14273261
   71 0.772885656 192.168.1.12 → 10.6.15.156  SSH 422 Client: Encrypted packet (len=356)
   72 0.814425531  10.6.15.156 → 192.168.1.12 TCP 66 22 → 54766 [ACK] Seq=9597 Ack=3397 Win=1452 Len=0 TSval=14273272 TSecr=7341771
   73 0.814447824 192.168.1.12 → 10.6.15.156  SSH 422 Client: Encrypted packet (len=356)
   74 0.816219297  10.6.15.156 → 192.168.1.12 TCP 66 22 → 54766 [ACK] Seq=9597 Ack=3753 Win=1452 Len=0 TSval=14273272 TSecr=7341781
   75 0.817608268  10.6.15.156 → 192.168.1.12 SSH 366 Server: Encrypted packet (len=300)
   76 0.849486903  10.6.15.156 → 192.168.1.12 SSH 198 Server: Encrypted packet (len=132)
   77 0.849504680 192.168.1.12 → 10.6.15.156  TCP 66 54766 → 22 [ACK] Seq=3753 Ack=10029 Win=2571 Len=0 TSval=7341790 TSecr=14273272
   78 0.861955235  10.6.15.156 → 192.168.1.12 SSH 558 Server: Encrypted packet (len=492)
   79 0.862990260 192.168.1.12 → 10.6.15.156  SSH 206 Client: Encrypted packet (len=140)
   80 0.902403468  10.6.15.156 → 192.168.1.12 TCP 66 22 → 54766 [ACK] Seq=10521 Ack=3893 Win=1452 Len=0 TSval=14273294 TSecr=7341793
   81 0.967006047  10.6.15.156 → 192.168.1.12 SSH 534 Server: Encrypted packet (len=468)
   82 0.967096982  10.6.15.156 → 192.168.1.12 SSH 102 Server: Encrypted packet (len=36)
   83 0.967132326 192.168.1.12 → 10.6.15.156  TCP 66 54766 → 22 [ACK] Seq=3893 Ack=11025 Win=2571 Len=0 TSval=7341819 TSecr=14273310
   84 0.968380204 192.168.1.12 → 10.6.15.156  SSH 138 Client: Encrypted packet (len=72)
   85 0.970050750  10.6.15.156 → 192.168.1.12 TCP 66 22 → 54766 [ACK] Seq=11025 Ack=3965 Win=1452 Len=0 TSval=14273310 TSecr=7341819
   86 0.970181274  10.6.15.156 → 192.168.1.12 SSH 102 Server: Encrypted packet (len=36)
   87 1.012860089 192.168.1.12 → 10.6.15.156  TCP 66 54766 → 22 [ACK] Seq=3965 Ack=11061 Win=2571 Len=0 TSval=7341831 TSecr=14273311
   88 1.086824431  10.6.15.156 → 192.168.1.12 SSH 422 Server: Encrypted packet (len=356)
   89 1.086904844 192.168.1.12 → 10.6.15.156  TCP 66 54766 → 22 [ACK] Seq=3965 Ack=11417 Win=2571 Len=0 TSval=7341849 TSecr=14273335
   90 1.107497871  10.6.15.156 → 192.168.1.12 SSH 398 Server: Encrypted packet (len=332)
   91 1.107576285 192.168.1.12 → 10.6.15.156  TCP 66 54766 → 22 [ACK] Seq=3965 Ack=11749 Win=2571 Len=0 TSval=7341854 TSecr=14273345
   92 1.206499481  10.6.15.156 → 192.168.1.12 SSH 414 Server: Encrypted packet (len=348)
   93 1.206574044 192.168.1.12 → 10.6.15.156  TCP 66 54766 → 22 [ACK] Seq=3965 Ack=12097 Win=2571 Len=0 TSval=7341879 TSecr=14273370
   94 1.207045543  10.6.15.156 → 192.168.1.12 SSH 414 Server: Encrypted packet (len=348)
   95 1.207077514 192.168.1.12 → 10.6.15.156  TCP 66 54766 → 22 [ACK] Seq=3965 Ack=12445 Win=2571 Len=0 TSval=7341879 TSecr=14273370
   96 1.211044841  10.6.15.156 → 192.168.1.12 SSH 350 Server: Encrypted packet (len=284)
   97 1.211122298 192.168.1.12 → 10.6.15.156  TCP 66 54766 → 22 [ACK] Seq=3965 Ack=12729 Win=2571 Len=0 TSval=7341880 TSecr=14273371
   98 1.272684237  10.6.15.156 → 192.168.1.12 SSH 398 Server: Encrypted packet (len=332)
   99 1.272762751 192.168.1.12 → 10.6.15.156  TCP 66 54766 → 22 [ACK] Seq=3965 Ack=13061 Win=2571 Len=0 TSval=7341895 TSecr=14273386
  100 1.332456639  10.6.15.156 → 192.168.1.12 SSH 158 Server: Encrypted packet (len=92)
  101 1.332531228 192.168.1.12 → 10.6.15.156  TCP 66 54766 → 22 [ACK] Seq=3965 Ack=13153 Win=2571 Len=0 TSval=7341910 TSecr=14273401
  102 1.333135664 192.168.1.12 → 10.6.15.156  SSH 1126 Client: Encrypted packet (len=1060)
  103 1.374492954  10.6.15.156 → 192.168.1.12 TCP 66 22 → 54766 [ACK] Seq=13153 Ack=5025 Win=1452 Len=0 TSval=14273412 TSecr=7341911
  104 1.377879550  10.6.15.156 → 192.168.1.12 SSH 150 Server: Encrypted packet (len=84)
  105 1.420839486 192.168.1.12 → 10.6.15.156  TCP 66 54766 → 22 [ACK] Seq=5025 Ack=13237 Win=2571 Len=0 TSval=7341933 TSecr=14273412
  106 1.466641817  10.6.15.156 → 192.168.1.12 SSH 414 Server: Encrypted packet (len=348)
  107 1.466714668 192.168.1.12 → 10.6.15.156  TCP 66 54766 → 22 [ACK] Seq=5025 Ack=13585 Win=2571 Len=0 TSval=7341944 TSecr=14273435
  108 1.901291944  10.6.15.156 → 192.168.1.12 SSH 390 Server: Encrypted packet (len=324)
  109 1.901332744 192.168.1.12 → 10.6.15.156  TCP 66 54766 → 22 [ACK] Seq=5025 Ack=13909 Win=2571 Len=0 TSval=7342053 TSecr=14273543
  110 1.901361143  10.6.15.156 → 192.168.1.12 SSH 102 Server: Encrypted packet (len=36)
  111 1.901366933 192.168.1.12 → 10.6.15.156  TCP 66 54766 → 22 [ACK] Seq=5025 Ack=13945 Win=2571 Len=0 TSval=7342053 TSecr=14273543
  112 1.902890089 192.168.1.12 → 10.6.15.156  SSH 138 Client: Encrypted packet (len=72)
  113 1.904415880  10.6.15.156 → 192.168.1.12 TCP 66 22 → 54766 [ACK] Seq=13945 Ack=5097 Win=1452 Len=0 TSval=14273544 TSecr=7342053
  114 1.904545165  10.6.15.156 → 192.168.1.12 SSH 102 Server: Encrypted packet (len=36)
  115 1.944844049 192.168.1.12 → 10.6.15.156  TCP 66 54766 → 22 [ACK] Seq=5097 Ack=13981 Win=2571 Len=0 TSval=7342064 TSecr=14273544
  116 2.580062383  10.6.15.156 → 192.168.1.12 SSH 1206 Server: Encrypted packet (len=1140)
  117 2.580111309 192.168.1.12 → 10.6.15.156  TCP 66 54766 → 22 [ACK] Seq=5097 Ack=15121 Win=2571 Len=0 TSval=7342222 TSecr=14273713
  118 2.582568186 192.168.1.12 → 10.6.15.156  SSH 206 Client: Encrypted packet (len=140)
  119 2.622750204  10.6.15.156 → 192.168.1.12 TCP 66 22 → 54766 [ACK] Seq=15121 Ack=5237 Win=1452 Len=0 TSval=14273724 TSecr=7342223
  120 3.224854909  10.6.15.156 → 192.168.1.12 SSH 222 Server: Encrypted packet (len=156)
  121 3.268832200 192.168.1.12 → 10.6.15.156  TCP 66 54766 → 22 [ACK] Seq=5237 Ack=15277 Win=2571 Len=0 TSval=7342395 TSecr=14273874
  122 3.278516668  10.6.15.156 → 192.168.1.12 SSH 334 Server: Encrypted packet (len=268)
  123 3.278534046 192.168.1.12 → 10.6.15.156  TCP 66 54766 → 22 [ACK] Seq=5237 Ack=15545 Win=2571 Len=0 TSval=7342397 TSecr=14273888
  124 3.800346729  10.6.15.156 → 192.168.1.12 SSH 498 Server: Encrypted packet (len=432)
  125 3.800364468 192.168.1.12 → 10.6.15.156  TCP 66 54766 → 22 [ACK] Seq=5237 Ack=15977 Win=2571 Len=0 TSval=7342527 TSecr=14274018
  126 3.801155421 192.168.1.12 → 10.6.15.156  SSH 422 Client: Encrypted packet (len=356)
  127 3.802797982  10.6.15.156 → 192.168.1.12 TCP 66 22 → 54766 [ACK] Seq=15977 Ack=5593 Win=1452 Len=0 TSval=14274019 TSecr=7342528
  128 3.802831904 192.168.1.12 → 10.6.15.156  SSH 206 Client: Encrypted packet (len=140)
  129 3.804463608  10.6.15.156 → 192.168.1.12 TCP 66 22 → 54766 [ACK] Seq=15977 Ack=5733 Win=1452 Len=0 TSval=14274019 TSecr=7342528
  130 4.354802063  10.6.15.156 → 192.168.1.12 SSH 150 Server: Encrypted packet (len=84)
  131 4.387629937  10.6.15.156 → 192.168.1.12 SSH 398 Server: Encrypted packet (len=332)
  132 4.387648274 192.168.1.12 → 10.6.15.156  TCP 66 54766 → 22 [ACK] Seq=5733 Ack=16393 Win=2571 Len=0 TSval=7342674 TSecr=14274157
  133 8.124958666 192.168.1.12 → 123.108.200.124 NTP 90 NTP Version 4, client
  134 8.125886338 10.22.17.139 → 224.0.0.252  LLMNR 64 Standard query 0x27ff A wpad
  135 8.125956284 10.22.17.139 → 224.0.0.252  LLMNR 64 Standard query 0x987f A wpad
  136 8.441316601 10.22.17.139 → 224.0.0.252  LLMNR 64 Standard query 0x987f A wpad
  137 8.441377903 10.22.17.139 → 224.0.0.252  LLMNR 64 Standard query 0x27ff A wpad
  138 9.920161610 10.22.17.139 → 224.0.0.252  LLMNR 72 Standard query 0x12df A vwhqjbiabkga
  139 9.920227001 10.22.17.139 → 224.0.0.252  LLMNR 67 Standard query 0x72bd A qllctuw
  140 10.276900196 192.168.1.12 → 10.6.15.156  SSH 1514 Client: Encrypted packet (len=1448)
  141 10.277639764  10.6.15.156 → 192.168.1.12 SSH 134 Server: Encrypted packet (len=68)
  142 10.277659871 192.168.1.12 → 10.6.15.156  SSH 342 Client: Encrypted packet (len=276)
  143 10.277775780  10.6.15.156 → 192.168.1.12 SSH 102 Server: Encrypted packet (len=36)
  144 10.277925009  10.6.15.156 → 192.168.1.12 TCP 102 [TCP Retransmission] 22 → 54766 [PSH, ACK] Seq=16461 Ack=5733 Win=1452 Len=36 TSval=14275600 TSecr=7342674
  145 10.277932716 192.168.1.12 → 10.6.15.156  TCP 78 54766 → 22 [ACK] Seq=7457 Ack=16497 Win=2571 Len=0 TSval=7344147 TSecr=14275600 SLE=16461 SRE=16497
  146 10.279521347  10.6.15.156 → 192.168.1.12 TCP 66 22 → 54766 [ACK] Seq=16497 Ack=7181 Win=1452 Len=0 TSval=14275638 TSecr=7344114
  147 10.279623356  10.6.15.156 → 192.168.1.12 TCP 66 22 → 54766 [ACK] Seq=16497 Ack=7457 Win=1451 Len=0 TSval=14275638 TSecr=7344147
  148 10.281464884  10.6.15.156 → 192.168.1.12 SSH 126 Server: Encrypted packet (len=60)
  149 10.281489607 192.168.1.12 → 10.6.15.156  TCP 66 54766 → 22 [ACK] Seq=7457 Ack=16557 Win=2571 Len=0 TSval=7344148 TSecr=14275638
  150 10.282022121  10.6.15.156 → 192.168.1.12 SSH 102 Server: Encrypted packet (len=36)
  151 10.282039107 192.168.1.12 → 10.6.15.156  TCP 66 54766 → 22 [ACK] Seq=7457 Ack=16593 Win=2571 Len=0 TSval=7344148 TSecr=14275638
  152 10.282538191  10.6.15.156 → 192.168.1.12 SSH 142 Server: Encrypted packet (len=76)
  153 10.282555770 192.168.1.12 → 10.6.15.156  TCP 66 54766 → 22 [ACK] Seq=7457 Ack=16669 Win=2571 Len=0 TSval=7344148 TSecr=14275639
  154 10.301446997  10.6.15.156 → 192.168.1.12 SSH 102 Server: Encrypted packet (len=36)
  155 10.301464889 192.168.1.12 → 10.6.15.156  TCP 66 54766 → 22 [ACK] Seq=7457 Ack=16705 Win=2571 Len=0 TSval=7344153 TSecr=14275643
  156 10.330694082 10.22.17.139 → 224.0.0.252  LLMNR 67 Standard query 0x72bd A qllctuw
  157 10.330819119 10.22.17.139 → 224.0.0.252  LLMNR 72 Standard query 0x12df A vwhqjbiabkga
  158 10.395737961  10.6.15.156 → 192.168.1.12 SSH 830 Server: Encrypted packet (len=764)
  159 10.395765436 192.168.1.12 → 10.6.15.156  TCP 66 54766 → 22 [ACK] Seq=7457 Ack=17469 Win=2571 Len=0 TSval=7344176 TSecr=14275667
  160 10.396254598  10.6.15.156 → 192.168.1.12 SSH 726 Server: Encrypted packet (len=660)
  161 10.396262602 192.168.1.12 → 10.6.15.156  TCP 66 54766 → 22 [ACK] Seq=7457 Ack=18129 Win=2571 Len=0 TSval=7344176 TSecr=14275667
  162 10.396727853 192.168.1.12 → 10.6.15.156  SSH 134 Client: Encrypted packet (len=68)
  163 10.438226821  10.6.15.156 → 192.168.1.12 TCP 66 22 → 54766 [ACK] Seq=18129 Ack=7525 Win=1452 Len=0 TSval=14275678 TSecr=7344176
  164 10.498509705  10.6.15.156 → 192.168.1.12 SSH 126 Server: Encrypted packet (len=60)
  165 10.498609194  10.6.15.156 → 192.168.1.12 SSH 102 Server: Encrypted packet (len=36)
  166 10.514805162  10.6.15.156 → 192.168.1.12 SSH 126 Server: Encrypted packet (len=60)
  167 10.514952710  10.6.15.156 → 192.168.1.12 SSH 102 Server: Encrypted packet (len=36)
  168 10.562309109  10.6.15.156 → 192.168.1.12 TCP 102 [TCP Retransmission] 22 → 54766 [PSH, ACK] Seq=18285 Ack=7525 Win=1452 Len=36 TSval=14275709 TSecr=7344176
  169 10.988952480 192.168.1.12 → 10.6.15.156  TCP 66 54766 → 22 [ACK] Seq=7525 Ack=18225 Win=2571 Len=0 TSval=7344202 TSecr=14275693
  170 10.988963679 192.168.1.12 → 10.6.15.156  TCP 66 54766 → 22 [ACK] Seq=7525 Ack=18321 Win=2571 Len=0 TSval=7344206 TSecr=14275697
  171 10.988965616 192.168.1.12 → 10.6.15.156  TCP 78 [TCP Dup ACK 170#1] 54766 → 22 [ACK] Seq=7525 Ack=18321 Win=2571 Len=0 TSval=7344218 TSecr=14275709 SLE=18285 SRE=18321
  172 10.989957007  10.6.15.156 → 192.168.1.12 SSH 102 Server: Encrypted packet (len=36)
  173 10.989983786 192.168.1.12 → 10.6.15.156  TCP 66 54766 → 22 [ACK] Seq=7525 Ack=18357 Win=2571 Len=0 TSval=7344325 TSecr=14275759
  174 10.990033150  10.6.15.156 → 192.168.1.12 SSH 102 Server: Encrypted packet (len=36)
  175 10.990038607 192.168.1.12 → 10.6.15.156  TCP 66 54766 → 22 [ACK] Seq=7525 Ack=18393 Win=2571 Len=0 TSval=7344325 TSecr=14275762
  176 11.930756939 10.22.17.139 → 224.0.0.252  LLMNR 74 Standard query 0x1eb4 A mzqyyinbzhsivr
  177 12.413744272 10.22.17.139 → 224.0.0.252  LLMNR 74 Standard query 0x1eb4 A mzqyyinbzhsivr
  178 15.980914986 192.168.1.12 → 139.59.21.22 NTP 90 NTP Version 4, client
  179 15.981606424 10.22.17.139 → 224.0.0.252  LLMNR 74 Standard query 0x1124 A phdoojfitmeucu
  180 16.098695288 10.22.17.139 → 224.0.0.252  LLMNR 74 Standard query 0x1124 A phdoojfitmeucu
  181 17.697096015 10.22.17.139 → 224.0.0.252  LLMNR 74 Standard query 0xf0b7 A fsfzfidduksgsi
  182 17.697160218 10.22.17.139 → 224.0.0.252  LLMNR 72 Standard query 0xf838 A ctglfjzpuktw
  183 18.266398764 10.22.17.139 → 224.0.0.252  LLMNR 74 Standard query 0xf0b7 A fsfzfidduksgsi
  184 18.266528264 10.22.17.139 → 224.0.0.252  LLMNR 72 Standard query 0xf838 A ctglfjzpuktw
  185 19.463369338 10.22.17.139 → 224.0.0.252  LLMNR 64 Standard query 0x8ea1 A wpad
  186 19.464395558 10.22.17.139 → 224.0.0.252  LLMNR 64 Standard query 0x3826 A wpad
  187 19.879522014 10.22.17.139 → 224.0.0.252  LLMNR 64 Standard query 0x8ea1 A wpad
  188 19.879568584 10.22.17.139 → 224.0.0.252  LLMNR 64 Standard query 0x3826 A wpad
  189 25.782686771 192.168.1.12 → 123.108.200.124 NTP 90 NTP Version 4, client
  190 25.785394487 10.119.73.122 → 192.168.1.12 ICMP 110 Destination unreachable (Communication administratively filtered)
  191 26.501075890 10.22.17.139 → 224.0.0.252  LLMNR 64 Standard query 0x5eb8 A wpad
  192 26.501608012 10.22.17.139 → 224.0.0.252  LLMNR 64 Standard query 0x32b6 A wpad
  193 26.922701796 10.22.17.139 → 224.0.0.252  LLMNR 64 Standard query 0x32b6 A wpad
  194 26.922765701 10.22.17.139 → 224.0.0.252  LLMNR 64 Standard query 0x5eb8 A wpad
  195 30.881434085  10.22.18.63 → 224.0.0.252  LLMNR 64 Standard query 0x9713 ANY VAIO
  196 31.291921410  10.22.18.63 → 224.0.0.252  LLMNR 64 Standard query 0x9713 ANY VAIO
  197 31.700967295 192.168.1.12 → 10.6.15.156  SSH 1398 Client: Encrypted packet (len=1332)
  198 31.706255326  10.6.15.156 → 192.168.1.12 TCP 66 22 → 54766 [ACK] Seq=18393 Ack=8857 Win=1452 Len=0 TSval=14280994 TSecr=7349503
  199 31.708534902  10.6.15.156 → 192.168.1.12 SSH 134 Server: Encrypted packet (len=68)
  200 31.708553302 192.168.1.12 → 10.6.15.156  TCP 66 54766 → 22 [ACK] Seq=8857 Ack=18461 Win=2571 Len=0 TSval=7349504 TSecr=14280995
  201 31.814684842  10.6.15.156 → 192.168.1.12 SSH 830 Server: Encrypted packet (len=764)
  202 31.814703675 192.168.1.12 → 10.6.15.156  TCP 66 54766 → 22 [ACK] Seq=8857 Ack=19225 Win=2571 Len=0 TSval=7349531 TSecr=14281022
  203 31.816190120  10.6.15.156 → 192.168.1.12 SSH 590 Server: Encrypted packet (len=524)
  204 31.816214273 192.168.1.12 → 10.6.15.156  TCP 66 54766 → 22 [ACK] Seq=8857 Ack=19749 Win=2571 Len=0 TSval=7349531 TSecr=14281022
  205 31.816643580 192.168.1.12 → 10.6.15.156  SSH 134 Client: Encrypted packet (len=68)
  206 31.858224061  10.6.15.156 → 192.168.1.12 TCP 66 22 → 54766 [ACK] Seq=19749 Ack=8925 Win=1452 Len=0 TSval=14281033 TSecr=7349531
  207 32.584401474  10.22.18.63 → 224.0.0.252  LLMNR 64 Standard query 0x37b8 ANY VAIO
  208 32.994482309  10.22.18.63 → 224.0.0.252  LLMNR 64 Standard query 0x37b8 ANY VAIO
  209 33.409997137  10.22.18.63 → 224.0.0.252  LLMNR 64 Standard query 0x22e4 ANY VAIO
  210 33.819773076  10.22.18.63 → 224.0.0.252  LLMNR 64 Standard query 0x22e4 ANY VAIO
