    1 0.000000000 192.168.1.12 → 10.6.15.156  SSH 182 Client: Encrypted packet (len=116)
    2 0.038116345  10.6.15.156 → 192.168.1.12 TCP 66 22 → 54766 [ACK] Seq=1 Ack=117 Win=1452 Len=0 TSval=14291015 TSecr=7359514
    3 0.038134496 192.168.1.12 → 10.6.15.156  SSH 1410 Client: Encrypted packet (len=1344)
    4 0.040397504  10.6.15.156 → 192.168.1.12 TCP 66 22 → 54766 [ACK] Seq=1 Ack=1461 Win=1452 Len=0 TSval=14291015 TSecr=7359524
    5 0.048951938  10.6.15.156 → 192.168.1.12 SSH 1514 Server: Encrypted packet (len=1448)
    6 0.049113917  10.6.15.156 → 192.168.1.12 SSH 1514 Server: Encrypted packet (len=1448)
    7 0.049121819 192.168.1.12 → 10.6.15.156  TCP 66 54766 → 22 [ACK] Seq=1461 Ack=2897 Win=2571 Len=0 TSval=7359526 TSecr=14291017
    8 0.049969584  10.6.15.156 → 192.168.1.12 SSH 1514 Server: Encrypted packet (len=1448)
    9 0.050139524  10.6.15.156 → 192.168.1.12 SSH 1514 Server: Encrypted packet (len=1448)
   10 0.050143503 192.168.1.12 → 10.6.15.156  TCP 66 54766 → 22 [ACK] Seq=1461 Ack=5793 Win=2571 Len=0 TSval=7359527 TSecr=14291017
   11 0.050149615  10.6.15.156 → 192.168.1.12 SSH 102 Server: Encrypted packet (len=36)
   12 0.050467558  10.6.15.156 → 192.168.1.12 SSH 1514 Server: Encrypted packet (len=1448)
   13 0.050472971 192.168.1.12 → 10.6.15.156  TCP 66 54766 → 22 [ACK] Seq=1461 Ack=7277 Win=2571 Len=0 TSval=7359527 TSecr=14291017
   14 0.050641526  10.6.15.156 → 192.168.1.12 SSH 1514 Server: Encrypted packet (len=1448)
   15 0.050815275  10.6.15.156 → 192.168.1.12 SSH 1514 Server: Encrypted packet (len=1448)
   16 0.050823047 192.168.1.12 → 10.6.15.156  TCP 66 54766 → 22 [ACK] Seq=1461 Ack=10173 Win=2571 Len=0 TSval=7359527 TSecr=14291017
   17 0.051002247  10.6.15.156 → 192.168.1.12 SSH 1514 Server: Encrypted packet (len=1448)
   18 0.051156704  10.6.15.156 → 192.168.1.12 SSH 1514 Server: Encrypted packet (len=1448)
   19 0.051161459 192.168.1.12 → 10.6.15.156  TCP 66 54766 → 22 [ACK] Seq=1461 Ack=13069 Win=2571 Len=0 TSval=7359527 TSecr=14291017
   20 0.051483698  10.6.15.156 → 192.168.1.12 SSH 1514 Server: Encrypted packet (len=1448)
   21 0.051656658  10.6.15.156 → 192.168.1.12 SSH 1514 Server: Encrypted packet (len=1448)
   22 0.051664789 192.168.1.12 → 10.6.15.156  TCP 66 54766 → 22 [ACK] Seq=1461 Ack=15965 Win=2571 Len=0 TSval=7359527 TSecr=14291017
   23 0.051808555  10.6.15.156 → 192.168.1.12 SSH 1294 Server: Encrypted packet (len=1228)
   24 0.051977167  10.6.15.156 → 192.168.1.12 SSH 1514 Server: Encrypted packet (len=1448)
   25 0.051981180 192.168.1.12 → 10.6.15.156  TCP 66 54766 → 22 [ACK] Seq=1461 Ack=18641 Win=2571 Len=0 TSval=7359527 TSecr=14291017
   26 0.053135347  10.6.15.156 → 192.168.1.12 SSH 1514 Server: Encrypted packet (len=1448)
   27 0.053149053  10.6.15.156 → 192.168.1.12 SSH 110 Server: Encrypted packet (len=44)
   28 0.053157084 192.168.1.12 → 10.6.15.156  TCP 66 54766 → 22 [ACK] Seq=1461 Ack=20133 Win=2571 Len=0 TSval=7359527 TSecr=14291018
   29 0.053317484  10.6.15.156 → 192.168.1.12 SSH 1514 Server: Encrypted packet (len=1448)
   30 0.053488882  10.6.15.156 → 192.168.1.12 SSH 1514 Server: Encrypted packet (len=1448)
   31 0.053493301 192.168.1.12 → 10.6.15.156  TCP 66 54766 → 22 [ACK] Seq=1461 Ack=23029 Win=2571 Len=0 TSval=7359528 TSecr=14291018
   32 0.053661115  10.6.15.156 → 192.168.1.12 SSH 1514 Server: Encrypted packet (len=1448)
   33 0.053849621  10.6.15.156 → 192.168.1.12 SSH 1514 Server: Encrypted packet (len=1448)
   34 0.053852771 192.168.1.12 → 10.6.15.156  TCP 66 54766 → 22 [ACK] Seq=1461 Ack=25925 Win=2571 Len=0 TSval=7359528 TSecr=14291018
   35 0.054020532  10.6.15.156 → 192.168.1.12 SSH 1514 Server: Encrypted packet (len=1448)
   36 0.054341371  10.6.15.156 → 192.168.1.12 SSH 1514 Server: Encrypted packet (len=1448)
   37 0.054344323 192.168.1.12 → 10.6.15.156  TCP 66 54766 → 22 [ACK] Seq=1461 Ack=28821 Win=2571 Len=0 TSval=7359528 TSecr=14291018
   38 0.054349608  10.6.15.156 → 192.168.1.12 SSH 102 Server: Encrypted packet (len=36)
   39 0.055882414  10.6.15.156 → 192.168.1.12 SSH 1514 Server: Encrypted packet (len=1448)
   40 0.055896171 192.168.1.12 → 10.6.15.156  TCP 66 54766 → 22 [ACK] Seq=1461 Ack=30305 Win=2571 Len=0 TSval=7359528 TSecr=14291018
   41 0.056048837  10.6.15.156 → 192.168.1.12 SSH 1514 Server: Encrypted packet (len=1448)
   42 0.056221432  10.6.15.156 → 192.168.1.12 SSH 1514 Server: Encrypted packet (len=1448)
   43 0.056224719 192.168.1.12 → 10.6.15.156  TCP 66 54766 → 22 [ACK] Seq=1461 Ack=33201 Win=2571 Len=0 TSval=7359528 TSecr=14291019
   44 0.056393403  10.6.15.156 → 192.168.1.12 SSH 1514 Server: Encrypted packet (len=1448)
   45 0.056580858  10.6.15.156 → 192.168.1.12 SSH 1514 Server: Encrypted packet (len=1448)
   46 0.056584292 192.168.1.12 → 10.6.15.156  TCP 66 54766 → 22 [ACK] Seq=1461 Ack=36097 Win=2571 Len=0 TSval=7359528 TSecr=14291019
   47 0.056753674  10.6.15.156 → 192.168.1.12 SSH 1514 Server: Encrypted packet (len=1448)
   48 0.056925733  10.6.15.156 → 192.168.1.12 SSH 1514 Server: Encrypted packet (len=1448)
   49 0.056928369 192.168.1.12 → 10.6.15.156  TCP 66 54766 → 22 [ACK] Seq=1461 Ack=38993 Win=2571 Len=0 TSval=7359528 TSecr=14291019
   50 0.057098195  10.6.15.156 → 192.168.1.12 SSH 1514 Server: Encrypted packet (len=1448)
   51 0.057410707  10.6.15.156 → 192.168.1.12 SSH 1514 Server: Encrypted packet (len=1448)
   52 0.057413964 192.168.1.12 → 10.6.15.156  TCP 66 54766 → 22 [ACK] Seq=1461 Ack=41889 Win=2571 Len=0 TSval=7359529 TSecr=14291019
   53 0.057582577  10.6.15.156 → 192.168.1.12 SSH 1514 Server: Encrypted packet (len=1448)
   54 0.057649915  10.6.15.156 → 192.168.1.12 SSH 750 Server: Encrypted packet (len=684)
   55 0.057651825 192.168.1.12 → 10.6.15.156  TCP 66 54766 → 22 [ACK] Seq=1461 Ack=44021 Win=2571 Len=0 TSval=7359529 TSecr=14291019
   56 0.057781498 192.168.1.12 → 10.6.15.156  SSH 102 Client: Encrypted packet (len=36)
   57 0.057850212  10.6.15.156 → 192.168.1.12 SSH 1514 Server: Encrypted packet (len=1448)
   58 0.058019038  10.6.15.156 → 192.168.1.12 SSH 1514 Server: Encrypted packet (len=1448)
   59 0.058024918 192.168.1.12 → 10.6.15.156  TCP 66 54766 → 22 [ACK] Seq=1497 Ack=46917 Win=2571 Len=0 TSval=7359529 TSecr=14291019
   60 0.058192058  10.6.15.156 → 192.168.1.12 SSH 1514 Server: Encrypted packet (len=1448)
   61 0.058363644  10.6.15.156 → 192.168.1.12 SSH 1514 Server: Encrypted packet (len=1448)
   62 0.058369635 192.168.1.12 → 10.6.15.156  TCP 66 54766 → 22 [ACK] Seq=1497 Ack=49813 Win=2571 Len=0 TSval=7359529 TSecr=14291019
   63 0.058539754  10.6.15.156 → 192.168.1.12 SSH 1514 Server: Encrypted packet (len=1448)
   64 0.062918698  10.6.15.156 → 192.168.1.12 SSH 1514 Server: Encrypted packet (len=1448)
   65 0.062935090 192.168.1.12 → 10.6.15.156  TCP 66 54766 → 22 [ACK] Seq=1497 Ack=52709 Win=2571 Len=0 TSval=7359530 TSecr=14291019
   66 0.063104600  10.6.15.156 → 192.168.1.12 SSH 1514 Server: Encrypted packet (len=1448)
   67 0.063261461  10.6.15.156 → 192.168.1.12 SSH 1514 Server: Encrypted packet (len=1448)
   68 0.063264600 192.168.1.12 → 10.6.15.156  TCP 66 54766 → 22 [ACK] Seq=1497 Ack=55605 Win=2571 Len=0 TSval=7359530 TSecr=14291019
   69 0.063447395  10.6.15.156 → 192.168.1.12 SSH 1514 Server: Encrypted packet (len=1448)
   70 0.063605804  10.6.15.156 → 192.168.1.12 SSH 1514 Server: Encrypted packet (len=1448)
   71 0.063608605 192.168.1.12 → 10.6.15.156  TCP 66 54766 → 22 [ACK] Seq=1497 Ack=58501 Win=2571 Len=0 TSval=7359530 TSecr=14291019
   72 0.063746425  10.6.15.156 → 192.168.1.12 SSH 1286 Server: Encrypted packet (len=1220)
   73 0.063928469  10.6.15.156 → 192.168.1.12 SSH 1514 Server: Encrypted packet (len=1448)
   74 0.063932745 192.168.1.12 → 10.6.15.156  TCP 66 54766 → 22 [ACK] Seq=1497 Ack=61169 Win=2571 Len=0 TSval=7359530 TSecr=14291019
   75 0.064101695  10.6.15.156 → 192.168.1.12 SSH 1514 Server: Encrypted packet (len=1448)
   76 0.064273204  10.6.15.156 → 192.168.1.12 SSH 1514 Server: Encrypted packet (len=1448)
   77 0.064279922 192.168.1.12 → 10.6.15.156  TCP 66 54766 → 22 [ACK] Seq=1497 Ack=64065 Win=2571 Len=0 TSval=7359530 TSecr=14291020
   78 0.064598077  10.6.15.156 → 192.168.1.12 SSH 1514 Server: Encrypted packet (len=1448)
   79 0.064769135  10.6.15.156 → 192.168.1.12 SSH 1514 Server: Encrypted packet (len=1448)
   80 0.064777754 192.168.1.12 → 10.6.15.156  TCP 66 54766 → 22 [ACK] Seq=1497 Ack=66961 Win=2571 Len=0 TSval=7359530 TSecr=14291020
   81 0.064942524  10.6.15.156 → 192.168.1.12 SSH 1514 Server: Encrypted packet (len=1448)
   82 0.065113108  10.6.15.156 → 192.168.1.12 SSH 1514 Server: Encrypted packet (len=1448)
   83 0.065120608 192.168.1.12 → 10.6.15.156  TCP 66 54766 → 22 [ACK] Seq=1497 Ack=69857 Win=2571 Len=0 TSval=7359530 TSecr=14291020
   84 0.065287697  10.6.15.156 → 192.168.1.12 SSH 1514 Server: Encrypted packet (len=1448)
   85 0.065459736  10.6.15.156 → 192.168.1.12 SSH 1514 Server: Encrypted packet (len=1448)
   86 0.065468373 192.168.1.12 → 10.6.15.156  TCP 66 54766 → 22 [ACK] Seq=1497 Ack=72753 Win=2571 Len=0 TSval=7359531 TSecr=14291020
   87 0.065631962  10.6.15.156 → 192.168.1.12 SSH 1514 Server: Encrypted packet (len=1448)
   88 0.065803542  10.6.15.156 → 192.168.1.12 SSH 1514 Server: Encrypted packet (len=1448)
   89 0.065809475 192.168.1.12 → 10.6.15.156  TCP 66 54766 → 22 [ACK] Seq=1497 Ack=75649 Win=2571 Len=0 TSval=7359531 TSecr=14291020
   90 0.065846382  10.6.15.156 → 192.168.1.12 SSH 566 Server: Encrypted packet (len=500)
   91 0.067174534  10.6.15.156 → 192.168.1.12 SSH 1514 Server: Encrypted packet (len=1448)
   92 0.067193604 192.168.1.12 → 10.6.15.156  TCP 66 54766 → 22 [ACK] Seq=1497 Ack=77597 Win=2571 Len=0 TSval=7359531 TSecr=14291020
   93 0.067338837  10.6.15.156 → 192.168.1.12 SSH 1514 Server: Encrypted packet (len=1448)
   94 0.067511801  10.6.15.156 → 192.168.1.12 SSH 1514 Server: Encrypted packet (len=1448)
   95 0.067520693 192.168.1.12 → 10.6.15.156  TCP 66 54766 → 22 [ACK] Seq=1497 Ack=80493 Win=2571 Len=0 TSval=7359531 TSecr=14291020
   96 0.067688210  10.6.15.156 → 192.168.1.12 SSH 1514 Server: Encrypted packet (len=1448)
   97 0.067856909  10.6.15.156 → 192.168.1.12 SSH 1514 Server: Encrypted packet (len=1448)
   98 0.067865589 192.168.1.12 → 10.6.15.156  TCP 66 54766 → 22 [ACK] Seq=1497 Ack=83389 Win=2571 Len=0 TSval=7359531 TSecr=14291020
   99 0.068028555  10.6.15.156 → 192.168.1.12 SSH 1514 Server: Encrypted packet (len=1448)
  100 0.068201698  10.6.15.156 → 192.168.1.12 SSH 1514 Server: Encrypted packet (len=1448)
  101 0.068207358 192.168.1.12 → 10.6.15.156  TCP 66 54766 → 22 [ACK] Seq=1497 Ack=86285 Win=2571 Len=0 TSval=7359531 TSecr=14291020
  102 0.068373563  10.6.15.156 → 192.168.1.12 SSH 1514 Server: Encrypted packet (len=1448)
  103 0.068545845  10.6.15.156 → 192.168.1.12 SSH 1514 Server: Encrypted packet (len=1448)
  104 0.068549042 192.168.1.12 → 10.6.15.156  TCP 66 54766 → 22 [ACK] Seq=1497 Ack=89181 Win=2571 Len=0 TSval=7359531 TSecr=14291020
  105 0.068882447  10.6.15.156 → 192.168.1.12 SSH 1514 Server: Encrypted packet (len=1448)
  106 0.069041869  10.6.15.156 → 192.168.1.12 SSH 1514 Server: Encrypted packet (len=1448)
  107 0.069043975 192.168.1.12 → 10.6.15.156  TCP 66 54766 → 22 [ACK] Seq=1497 Ack=92077 Win=2571 Len=0 TSval=7359531 TSecr=14291020
  108 0.069214673  10.6.15.156 → 192.168.1.12 SSH 1514 Server: Encrypted packet (len=1448)
  109 0.069392785  10.6.15.156 → 192.168.1.12 SSH 1514 Server: Encrypted packet (len=1448)
  110 0.069398305 192.168.1.12 → 10.6.15.156  TCP 66 54766 → 22 [ACK] Seq=1497 Ack=94973 Win=2571 Len=0 TSval=7359532 TSecr=14291021
  111 0.069562665  10.6.15.156 → 192.168.1.12 SSH 1514 Server: Encrypted packet (len=1448)
  112 0.069737829  10.6.15.156 → 192.168.1.12 SSH 1514 Server: Encrypted packet (len=1448)
  113 0.069743849 192.168.1.12 → 10.6.15.156  TCP 66 54766 → 22 [ACK] Seq=1497 Ack=97869 Win=2571 Len=0 TSval=7359532 TSecr=14291021
  114 0.069907708  10.6.15.156 → 192.168.1.12 SSH 1514 Server: Encrypted packet (len=1448)
  115 0.070080848  10.6.15.156 → 192.168.1.12 SSH 1514 Server: Encrypted packet (len=1448)
  116 0.070087140 192.168.1.12 → 10.6.15.156  TCP 66 54766 → 22 [ACK] Seq=1497 Ack=100765 Win=2571 Len=0 TSval=7359532 TSecr=14291021
  117 0.070254403  10.6.15.156 → 192.168.1.12 SSH 1514 Server: Encrypted packet (len=1448)
  118 0.071686328  10.6.15.156 → 192.168.1.12 SSH 1514 Server: Encrypted packet (len=1448)
  119 0.071701185 192.168.1.12 → 10.6.15.156  TCP 66 54766 → 22 [ACK] Seq=1497 Ack=103661 Win=2571 Len=0 TSval=7359532 TSecr=14291021
  120 0.071851715  10.6.15.156 → 192.168.1.12 SSH 1514 Server: Encrypted packet (len=1448)
  121 0.072023970  10.6.15.156 → 192.168.1.12 SSH 1514 Server: Encrypted packet (len=1448)
  122 0.072027327 192.168.1.12 → 10.6.15.156  TCP 66 54766 → 22 [ACK] Seq=1497 Ack=106557 Win=2571 Len=0 TSval=7359532 TSecr=14291021
  123 0.072197300  10.6.15.156 → 192.168.1.12 SSH 1514 Server: Encrypted packet (len=1448)
  124 0.072369942  10.6.15.156 → 192.168.1.12 SSH 1514 Server: Encrypted packet (len=1448)
  125 0.072372251 192.168.1.12 → 10.6.15.156  TCP 66 54766 → 22 [ACK] Seq=1497 Ack=109453 Win=2571 Len=0 TSval=7359532 TSecr=14291021
  126 0.072542705  10.6.15.156 → 192.168.1.12 SSH 1514 Server: Encrypted packet (len=1448)
  127 0.072715741  10.6.15.156 → 192.168.1.12 SSH 1514 Server: Encrypted packet (len=1448)
  128 0.072721846 192.168.1.12 → 10.6.15.156  TCP 66 54766 → 22 [ACK] Seq=1497 Ack=112349 Win=2571 Len=0 TSval=7359532 TSecr=14291021
  129 0.072894135  10.6.15.156 → 192.168.1.12 SSH 1514 Server: Encrypted packet (len=1448)
  130 0.073075240  10.6.15.156 → 192.168.1.12 SSH 1514 Server: Encrypted packet (len=1448)
  131 0.073080708 192.168.1.12 → 10.6.15.156  TCP 66 54766 → 22 [ACK] Seq=1497 Ack=115245 Win=2571 Len=0 TSval=7359532 TSecr=14291022
  132 0.073395557  10.6.15.156 → 192.168.1.12 SSH 1514 Server: Encrypted packet (len=1448)
  133 0.073560099  10.6.15.156 → 192.168.1.12 SSH 1514 Server: Encrypted packet (len=1448)
  134 0.073566071 192.168.1.12 → 10.6.15.156  TCP 66 54766 → 22 [ACK] Seq=1497 Ack=118141 Win=2571 Len=0 TSval=7359533 TSecr=14291022
  135 0.073731193  10.6.15.156 → 192.168.1.12 SSH 1514 Server: Encrypted packet (len=1448)
  136 0.073904000  10.6.15.156 → 192.168.1.12 SSH 1514 Server: Encrypted packet (len=1448)
  137 0.073909768 192.168.1.12 → 10.6.15.156  TCP 66 54766 → 22 [ACK] Seq=1497 Ack=121037 Win=2571 Len=0 TSval=7359533 TSecr=14291022
  138 0.074077945  10.6.15.156 → 192.168.1.12 SSH 1514 Server: Encrypted packet (len=1448)
  139 0.074252975  10.6.15.156 → 192.168.1.12 SSH 1514 Server: Encrypted packet (len=1448)
  140 0.074260694 192.168.1.12 → 10.6.15.156  TCP 66 54766 → 22 [ACK] Seq=1497 Ack=123933 Win=2571 Len=0 TSval=7359533 TSecr=14291022
  141 0.074425806  10.6.15.156 → 192.168.1.12 SSH 1514 Server: Encrypted packet (len=1448)
  142 0.074598514  10.6.15.156 → 192.168.1.12 SSH 1514 Server: Encrypted packet (len=1448)
  143 0.074606116 192.168.1.12 → 10.6.15.156  TCP 66 54766 → 22 [ACK] Seq=1497 Ack=126829 Win=2571 Len=0 TSval=7359533 TSecr=14291022
  144 0.074769929  10.6.15.156 → 192.168.1.12 SSH 1514 Server: Encrypted packet (len=1448)
  145 0.075670607  10.6.15.156 → 192.168.1.12 SSH 1514 Server: Encrypted packet (len=1448)
  146 0.075680811 192.168.1.12 → 10.6.15.156  TCP 66 54766 → 22 [ACK] Seq=1497 Ack=129725 Win=2571 Len=0 TSval=7359533 TSecr=14291022
  147 0.075751938  10.6.15.156 → 192.168.1.12 SSH 834 Server: Encrypted packet (len=768)
  148 0.088570341  10.6.15.156 → 192.168.1.12 SSH 1514 Server: Encrypted packet (len=1448)
  149 0.088586593 192.168.1.12 → 10.6.15.156  TCP 66 54766 → 22 [ACK] Seq=1497 Ack=131941 Win=2571 Len=0 TSval=7359536 TSecr=14291022
  150 0.088713514  10.6.15.156 → 192.168.1.12 SSH 1514 Server: Encrypted packet (len=1448)
  151 0.088886250  10.6.15.156 → 192.168.1.12 SSH 1514 Server: Encrypted packet (len=1448)
  152 0.088889916 192.168.1.12 → 10.6.15.156  TCP 66 54766 → 22 [ACK] Seq=1497 Ack=134837 Win=2571 Len=0 TSval=7359536 TSecr=14291027
  153 0.089061360  10.6.15.156 → 192.168.1.12 SSH 1514 Server: Encrypted packet (len=1448)
  154 0.089068936  10.6.15.156 → 192.168.1.12 SSH 110 Server: Encrypted packet (len=44)
  155 0.089073207 192.168.1.12 → 10.6.15.156  TCP 66 54766 → 22 [ACK] Seq=1497 Ack=136329 Win=2571 Len=0 TSval=7359536 TSecr=14291027
  156 0.089401876  10.6.15.156 → 192.168.1.12 SSH 1514 Server: Encrypted packet (len=1448)
  157 0.089572973  10.6.15.156 → 192.168.1.12 SSH 1514 Server: Encrypted packet (len=1448)
  158 0.089582479 192.168.1.12 → 10.6.15.156  TCP 66 54766 → 22 [ACK] Seq=1497 Ack=139225 Win=2571 Len=0 TSval=7359537 TSecr=14291027
  159 0.089898706  10.6.15.156 → 192.168.1.12 SSH 1514 Server: Encrypted packet (len=1448)
  160 0.090069790  10.6.15.156 → 192.168.1.12 SSH 1514 Server: Encrypted packet (len=1448)
  161 0.090077765 192.168.1.12 → 10.6.15.156  TCP 66 54766 → 22 [ACK] Seq=1497 Ack=142121 Win=2571 Len=0 TSval=7359537 TSecr=14291027
  162 0.090242582  10.6.15.156 → 192.168.1.12 SSH 1514 Server: Encrypted packet (len=1448)
  163 0.090417052  10.6.15.156 → 192.168.1.12 SSH 1514 Server: Encrypted packet (len=1448)
  164 0.090425066 192.168.1.12 → 10.6.15.156  TCP 66 54766 → 22 [ACK] Seq=1497 Ack=145017 Win=2571 Len=0 TSval=7359537 TSecr=14291027
  165 0.090739402  10.6.15.156 → 192.168.1.12 SSH 1514 Server: Encrypted packet (len=1448)
  166 0.090912613  10.6.15.156 → 192.168.1.12 SSH 1514 Server: Encrypted packet (len=1448)
  167 0.090916197 192.168.1.12 → 10.6.15.156  TCP 66 54766 → 22 [ACK] Seq=1497 Ack=147913 Win=2571 Len=0 TSval=7359537 TSecr=14291027
  168 0.090924491  10.6.15.156 → 192.168.1.12 SSH 166 Server: Encrypted packet (len=100)
  169 0.091058092 192.168.1.12 → 10.6.15.156  SSH 102 Client: Encrypted packet (len=36)
  170 0.093326217  10.6.15.156 → 192.168.1.12 SSH 1514 Server: Encrypted packet (len=1448)
  171 0.093487709  10.6.15.156 → 192.168.1.12 SSH 1514 Server: Encrypted packet (len=1448)
  172 0.093496781 192.168.1.12 → 10.6.15.156  TCP 66 54766 → 22 [ACK] Seq=1533 Ack=150909 Win=2571 Len=0 TSval=7359538 TSecr=14291028
  173 0.093617715  10.6.15.156 → 192.168.1.12 SSH 110 Server: Encrypted packet (len=44)
  174 0.095110542  10.6.15.156 → 192.168.1.12 SSH 1514 Server: Encrypted packet (len=1448)
  175 0.095126630 192.168.1.12 → 10.6.15.156  TCP 66 54766 → 22 [ACK] Seq=1533 Ack=152401 Win=2571 Len=0 TSval=7359538 TSecr=14291028
  176 0.095288730  10.6.15.156 → 192.168.1.12 SSH 1514 Server: Encrypted packet (len=1448)
  177 0.095447204  10.6.15.156 → 192.168.1.12 SSH 1514 Server: Encrypted packet (len=1448)
  178 0.095450397 192.168.1.12 → 10.6.15.156  TCP 66 54766 → 22 [ACK] Seq=1533 Ack=155297 Win=2571 Len=0 TSval=7359538 TSecr=14291029
  179 0.095619336  10.6.15.156 → 192.168.1.12 SSH 1514 Server: Encrypted packet (len=1448)
  180 0.095791615  10.6.15.156 → 192.168.1.12 SSH 1514 Server: Encrypted packet (len=1448)
  181 0.095794385 192.168.1.12 → 10.6.15.156  TCP 66 54766 → 22 [ACK] Seq=1533 Ack=158193 Win=2571 Len=0 TSval=7359538 TSecr=14291029
  182 0.095966456  10.6.15.156 → 192.168.1.12 SSH 1514 Server: Encrypted packet (len=1448)
  183 0.095972999  10.6.15.156 → 192.168.1.12 SSH 110 Server: Encrypted packet (len=44)
  184 0.095976658 192.168.1.12 → 10.6.15.156  TCP 66 54766 → 22 [ACK] Seq=1533 Ack=159685 Win=2571 Len=0 TSval=7359538 TSecr=14291029
  185 0.096306460  10.6.15.156 → 192.168.1.12 SSH 1514 Server: Encrypted packet (len=1448)
  186 0.096476242  10.6.15.156 → 192.168.1.12 SSH 1514 Server: Encrypted packet (len=1448)
  187 0.096479490 192.168.1.12 → 10.6.15.156  TCP 66 54766 → 22 [ACK] Seq=1533 Ack=162581 Win=2571 Len=0 TSval=7359538 TSecr=14291029
  188 0.096662437  10.6.15.156 → 192.168.1.12 SSH 1514 Server: Encrypted packet (len=1448)
  189 0.096802181  10.6.15.156 → 192.168.1.12 SSH 1358 Server: Encrypted packet (len=1292)
  190 0.096806333 192.168.1.12 → 10.6.15.156  TCP 66 54766 → 22 [ACK] Seq=1533 Ack=165321 Win=2571 Len=0 TSval=7359538 TSecr=14291029
  191 0.097128824  10.6.15.156 → 192.168.1.12 SSH 1514 Server: Encrypted packet (len=1448)
  192 0.097300452  10.6.15.156 → 192.168.1.12 SSH 1514 Server: Encrypted packet (len=1448)
  193 0.097308890 192.168.1.12 → 10.6.15.156  TCP 66 54766 → 22 [ACK] Seq=1533 Ack=168217 Win=2571 Len=0 TSval=7359538 TSecr=14291029
  194 0.097627716  10.6.15.156 → 192.168.1.12 SSH 1514 Server: Encrypted packet (len=1448)
  195 0.097796473  10.6.15.156 → 192.168.1.12 SSH 1514 Server: Encrypted packet (len=1448)
  196 0.097803522 192.168.1.12 → 10.6.15.156  TCP 66 54766 → 22 [ACK] Seq=1533 Ack=171113 Win=2571 Len=0 TSval=7359539 TSecr=14291029
  197 0.097815739  10.6.15.156 → 192.168.1.12 SSH 110 Server: Encrypted packet (len=44)
  198 0.098975928  10.6.15.156 → 192.168.1.12 SSH 1514 Server: Encrypted packet (len=1448)
  199 0.098998110 192.168.1.12 → 10.6.15.156  TCP 66 54766 → 22 [ACK] Seq=1533 Ack=172605 Win=2571 Len=0 TSval=7359539 TSecr=14291029
  200 0.099141146  10.6.15.156 → 192.168.1.12 SSH 1514 Server: Encrypted packet (len=1448)
  201 0.099313751  10.6.15.156 → 192.168.1.12 SSH 1514 Server: Encrypted packet (len=1448)
  202 0.099322784 192.168.1.12 → 10.6.15.156  TCP 66 54766 → 22 [ACK] Seq=1533 Ack=175501 Win=2571 Len=0 TSval=7359539 TSecr=14291029
  203 0.099486479  10.6.15.156 → 192.168.1.12 SSH 1514 Server: Encrypted packet (len=1448)
  204 0.099659114  10.6.15.156 → 192.168.1.12 SSH 1514 Server: Encrypted packet (len=1448)
  205 0.099667068 192.168.1.12 → 10.6.15.156  TCP 66 54766 → 22 [ACK] Seq=1533 Ack=178397 Win=2571 Len=0 TSval=7359539 TSecr=14291029
  206 0.099833040  10.6.15.156 → 192.168.1.12 SSH 1514 Server: Encrypted packet (len=1448)
  207 0.099843887  10.6.15.156 → 192.168.1.12 SSH 110 Server: Encrypted packet (len=44)
  208 0.099848474 192.168.1.12 → 10.6.15.156  TCP 66 54766 → 22 [ACK] Seq=1533 Ack=179889 Win=2571 Len=0 TSval=7359539 TSecr=14291029
  209 0.100019262  10.6.15.156 → 192.168.1.12 SSH 1514 Server: Encrypted packet (len=1448)
  210 0.100152900  10.6.15.156 → 192.168.1.12 SSH 1214 Server: Encrypted packet (len=1148)
  211 0.100159919 192.168.1.12 → 10.6.15.156  TCP 66 54766 → 22 [ACK] Seq=1533 Ack=182485 Win=2571 Len=0 TSval=7359539 TSecr=14291030
  212 0.107187380 192.168.1.12 → 10.6.15.156  SSH 190 Client: Encrypted packet (len=124)
  213 0.114226928  10.6.15.156 → 192.168.1.12 SSH 1514 Server: Encrypted packet (len=1448)
  214 0.114245788 192.168.1.12 → 10.6.15.156  SSH 314 Client: Encrypted packet (len=248)
  215 0.114394377  10.6.15.156 → 192.168.1.12 SSH 1514 Server: Encrypted packet (len=1448)
  216 0.114718565  10.6.15.156 → 192.168.1.12 SSH 1514 Server: Encrypted packet (len=1448)
  217 0.114722701 192.168.1.12 → 10.6.15.156  TCP 66 54766 → 22 [ACK] Seq=1905 Ack=186829 Win=2571 Len=0 TSval=7359543 TSecr=14291033
  218 0.114890854  10.6.15.156 → 192.168.1.12 SSH 1514 Server: Encrypted packet (len=1448)
  219 0.114895863  10.6.15.156 → 192.168.1.12 SSH 110 Server: Encrypted packet (len=44)
  220 0.114898743 192.168.1.12 → 10.6.15.156  TCP 66 54766 → 22 [ACK] Seq=1905 Ack=188321 Win=2571 Len=0 TSval=7359543 TSecr=14291033
  221 0.115085524  10.6.15.156 → 192.168.1.12 SSH 1514 Server: Encrypted packet (len=1448)
  222 0.115403842  10.6.15.156 → 192.168.1.12 SSH 1514 Server: Encrypted packet (len=1448)
  223 0.115407604 192.168.1.12 → 10.6.15.156  TCP 66 54766 → 22 [ACK] Seq=1905 Ack=191217 Win=2571 Len=0 TSval=7359543 TSecr=14291033
  224 0.115413867  10.6.15.156 → 192.168.1.12 SSH 110 Server: Encrypted packet (len=44)
  225 0.115594556  10.6.15.156 → 192.168.1.12 SSH 1514 Server: Encrypted packet (len=1448)
  226 0.115598953 192.168.1.12 → 10.6.15.156  TCP 66 54766 → 22 [ACK] Seq=1905 Ack=192709 Win=2571 Len=0 TSval=7359543 TSecr=14291034
  227 0.115765980  10.6.15.156 → 192.168.1.12 SSH 1514 Server: Encrypted packet (len=1448)
  228 0.115770421  10.6.15.156 → 192.168.1.12 SSH 110 Server: Encrypted packet (len=44)
  229 0.115772323 192.168.1.12 → 10.6.15.156  TCP 66 54766 → 22 [ACK] Seq=1905 Ack=194201 Win=2571 Len=0 TSval=7359543 TSecr=14291034
  230 0.116103130  10.6.15.156 → 192.168.1.12 SSH 1514 Server: Encrypted packet (len=1448)
  231 0.116276452  10.6.15.156 → 192.168.1.12 SSH 1514 Server: Encrypted packet (len=1448)
  232 0.116279964 192.168.1.12 → 10.6.15.156  TCP 66 54766 → 22 [ACK] Seq=1905 Ack=197097 Win=2571 Len=0 TSval=7359543 TSecr=14291034
  233 0.116315953  10.6.15.156 → 192.168.1.12 SSH 630 Server: Encrypted packet (len=564)
  234 0.129748296  10.6.15.156 → 192.168.1.12 SSH 1514 Server: Encrypted packet (len=1448)
  235 0.129766132 192.168.1.12 → 10.6.15.156  TCP 66 54766 → 22 [ACK] Seq=1905 Ack=199109 Win=2571 Len=0 TSval=7359547 TSecr=14291034
  236 0.129913514  10.6.15.156 → 192.168.1.12 SSH 1514 Server: Encrypted packet (len=1448)
  237 0.130083464  10.6.15.156 → 192.168.1.12 SSH 1514 Server: Encrypted packet (len=1448)
  238 0.130087000 192.168.1.12 → 10.6.15.156  TCP 66 54766 → 22 [ACK] Seq=1905 Ack=202005 Win=2571 Len=0 TSval=7359547 TSecr=14291037
  239 0.130255747  10.6.15.156 → 192.168.1.12 SSH 1514 Server: Encrypted packet (len=1448)
  240 0.130260508  10.6.15.156 → 192.168.1.12 SSH 110 Server: Encrypted packet (len=44)
  241 0.130262769 192.168.1.12 → 10.6.15.156  TCP 66 54766 → 22 [ACK] Seq=1905 Ack=203497 Win=2571 Len=0 TSval=7359547 TSecr=14291037
  242 0.131601388  10.6.15.156 → 192.168.1.12 SSH 1514 Server: Encrypted packet (len=1448)
  243 0.131774135  10.6.15.156 → 192.168.1.12 SSH 1514 Server: Encrypted packet (len=1448)
  244 0.131779949 192.168.1.12 → 10.6.15.156  TCP 66 54766 → 22 [ACK] Seq=1905 Ack=206393 Win=2571 Len=0 TSval=7359547 TSecr=14291038
  245 0.131946895  10.6.15.156 → 192.168.1.12 SSH 1514 Server: Encrypted packet (len=1448)
  246 0.132119720  10.6.15.156 → 192.168.1.12 SSH 1514 Server: Encrypted packet (len=1448)
  247 0.132125809 192.168.1.12 → 10.6.15.156  TCP 66 54766 → 22 [ACK] Seq=1905 Ack=209289 Win=2571 Len=0 TSval=7359547 TSecr=14291038
  248 0.132273688  10.6.15.156 → 192.168.1.12 SSH 1514 Server: Encrypted packet (len=1448)
  249 0.132445272  10.6.15.156 → 192.168.1.12 SSH 1514 Server: Encrypted packet (len=1448)
  250 0.132448071 192.168.1.12 → 10.6.15.156  TCP 66 54766 → 22 [ACK] Seq=1905 Ack=212185 Win=2571 Len=0 TSval=7359547 TSecr=14291038
  251 0.132637450  10.6.15.156 → 192.168.1.12 SSH 1514 Server: Encrypted packet (len=1448)
  252 0.132957465  10.6.15.156 → 192.168.1.12 SSH 1514 Server: Encrypted packet (len=1448)
  253 0.132962130 192.168.1.12 → 10.6.15.156  TCP 66 54766 → 22 [ACK] Seq=1905 Ack=215081 Win=2571 Len=0 TSval=7359547 TSecr=14291038
  254 0.133130084  10.6.15.156 → 192.168.1.12 SSH 1514 Server: Encrypted packet (len=1448)
  255 0.133162150  10.6.15.156 → 192.168.1.12 SSH 598 Server: Encrypted packet (len=532)
  256 0.133164786 192.168.1.12 → 10.6.15.156  TCP 66 54766 → 22 [ACK] Seq=1905 Ack=217061 Win=2571 Len=0 TSval=7359547 TSecr=14291038
  257 0.133365444  10.6.15.156 → 192.168.1.12 SSH 1514 Server: Encrypted packet (len=1448)
  258 0.133538395  10.6.15.156 → 192.168.1.12 SSH 1514 Server: Encrypted packet (len=1448)
  259 0.133545438 192.168.1.12 → 10.6.15.156  TCP 66 54766 → 22 [ACK] Seq=1905 Ack=219957 Win=2571 Len=0 TSval=7359548 TSecr=14291038
  260 0.133585712  10.6.15.156 → 192.168.1.12 SSH 630 Server: Encrypted packet (len=564)
  261 0.135911149  10.6.15.156 → 192.168.1.12 SSH 1514 Server: Encrypted packet (len=1448)
  262 0.135930906 192.168.1.12 → 10.6.15.156  TCP 66 54766 → 22 [ACK] Seq=1905 Ack=221969 Win=2571 Len=0 TSval=7359548 TSecr=14291038
  263 0.136074934  10.6.15.156 → 192.168.1.12 SSH 1514 Server: Encrypted packet (len=1448)
  264 0.136245101  10.6.15.156 → 192.168.1.12 SSH 1514 Server: Encrypted packet (len=1448)
  265 0.136247782 192.168.1.12 → 10.6.15.156  TCP 66 54766 → 22 [ACK] Seq=1905 Ack=224865 Win=2571 Len=0 TSval=7359548 TSecr=14291039
  266 0.136253488  10.6.15.156 → 192.168.1.12 SSH 110 Server: Encrypted packet (len=44)
  267 0.137220813  10.6.15.156 → 192.168.1.12 SSH 1514 Server: Encrypted packet (len=1448)
  268 0.137231195 192.168.1.12 → 10.6.15.156  TCP 66 54766 → 22 [ACK] Seq=1905 Ack=226357 Win=2571 Len=0 TSval=7359548 TSecr=14291039
  269 0.137400026  10.6.15.156 → 192.168.1.12 SSH 1514 Server: Encrypted packet (len=1448)
  270 0.137728740  10.6.15.156 → 192.168.1.12 SSH 1514 Server: Encrypted packet (len=1448)
  271 0.137734126 192.168.1.12 → 10.6.15.156  TCP 66 54766 → 22 [ACK] Seq=1905 Ack=229253 Win=2571 Len=0 TSval=7359549 TSecr=14291039
  272 0.137885615  10.6.15.156 → 192.168.1.12 SSH 1514 Server: Encrypted packet (len=1448)
  273 0.138079624  10.6.15.156 → 192.168.1.12 SSH 1514 Server: Encrypted packet (len=1448)
  274 0.138085460 192.168.1.12 → 10.6.15.156  TCP 66 54766 → 22 [ACK] Seq=1905 Ack=232149 Win=2571 Len=0 TSval=7359549 TSecr=14291039
  275 0.138401475  10.6.15.156 → 192.168.1.12 SSH 1514 Server: Encrypted packet (len=1448)
  276 0.138573842  10.6.15.156 → 192.168.1.12 SSH 1514 Server: Encrypted packet (len=1448)
  277 0.138579517 192.168.1.12 → 10.6.15.156  TCP 66 54766 → 22 [ACK] Seq=1905 Ack=235045 Win=2571 Len=0 TSval=7359549 TSecr=14291039
  278 0.138747190  10.6.15.156 → 192.168.1.12 SSH 1514 Server: Encrypted packet (len=1448)
  279 0.138773357  10.6.15.156 → 192.168.1.12 SSH 598 Server: Encrypted packet (len=532)
  280 0.138776647 192.168.1.12 → 10.6.15.156  TCP 66 54766 → 22 [ACK] Seq=1905 Ack=237025 Win=2571 Len=0 TSval=7359549 TSecr=14291039
  281 0.139046010  10.6.15.156 → 192.168.1.12 SSH 910 Server: Encrypted packet (len=844)
  282 0.160900730  10.22.18.63 → 224.0.0.252  LLMNR 72 Standard query 0x68cb A fyhbqcqpqzru
  283 0.161026576  10.22.18.63 → 224.0.0.252  LLMNR 72 Standard query 0xe91e A sxovlrvozyqr
  284 0.161597765  10.22.18.63 → 224.0.0.252  LLMNR 71 Standard query 0x80ed A chpinmnmuil
  285 0.181384928 192.168.1.12 → 10.6.15.156  TCP 66 54766 → 22 [ACK] Seq=1905 Ack=237869 Win=2571 Len=0 TSval=7359560 TSecr=14291039
  286 0.181809895 192.168.1.12 → 10.6.15.156  SSH 662 Client: Encrypted packet (len=596)
  287 0.218891953  10.6.15.156 → 192.168.1.12 SSH 582 Server: Encrypted packet (len=516)
  288 0.218977440 192.168.1.12 → 10.6.15.156  TCP 66 54766 → 22 [ACK] Seq=2501 Ack=238385 Win=2571 Len=0 TSval=7359569 TSecr=14291060
  289 0.265616184 192.168.1.12 → 10.6.15.156  SSH 222 Client: Encrypted packet (len=156)
  290 0.306117749  10.6.15.156 → 192.168.1.12 TCP 66 22 → 54766 [ACK] Seq=238385 Ack=2657 Win=1452 Len=0 TSval=14291082 TSecr=7359581
  291 0.306136169 192.168.1.12 → 10.6.15.156  SSH 182 Client: Encrypted packet (len=116)
  292 0.307845020  10.6.15.156 → 192.168.1.12 TCP 66 22 → 54766 [ACK] Seq=238385 Ack=2773 Win=1452 Len=0 TSval=14291082 TSecr=7359591
  293 0.307861039 192.168.1.12 → 10.6.15.156  SSH 214 Client: Encrypted packet (len=148)
  294 0.309763837  10.6.15.156 → 192.168.1.12 TCP 66 22 → 54766 [ACK] Seq=238385 Ack=2921 Win=1452 Len=0 TSval=14291082 TSecr=7359591
  295 0.310610256 192.168.1.12 → 10.6.15.156  SSH 174 Client: Encrypted packet (len=108)
  296 0.312423417  10.6.15.156 → 192.168.1.12 TCP 66 22 → 54766 [ACK] Seq=238385 Ack=3029 Win=1452 Len=0 TSval=14291083 TSecr=7359592
  297 0.384912395  10.6.15.156 → 192.168.1.12 SSH 150 Server: Encrypted packet (len=84)
  298 0.384969638 192.168.1.12 → 10.6.15.156  TCP 66 54766 → 22 [ACK] Seq=3029 Ack=238469 Win=2571 Len=0 TSval=7359610 TSecr=14291101
  299 0.387852499  10.6.15.156 → 192.168.1.12 SSH 1514 Server: Encrypted packet (len=1448)
  300 0.387980042  10.6.15.156 → 192.168.1.12 SSH 1254 Server: Encrypted packet (len=1188)
  301 0.387990910 192.168.1.12 → 10.6.15.156  TCP 66 54766 → 22 [ACK] Seq=3029 Ack=241105 Win=2571 Len=0 TSval=7359611 TSecr=14291102
  302 0.427353642  10.6.15.156 → 192.168.1.12 SSH 1514 Server: Encrypted packet (len=1448)
  303 0.427520032  10.6.15.156 → 192.168.1.12 SSH 1514 Server: Encrypted packet (len=1448)
  304 0.427528896 192.168.1.12 → 10.6.15.156  TCP 66 54766 → 22 [ACK] Seq=3029 Ack=244001 Win=2571 Len=0 TSval=7359621 TSecr=14291112
  305 0.427730376  10.6.15.156 → 192.168.1.12 SSH 694 Server: Encrypted packet (len=628)
  306 0.427752239 192.168.1.12 → 10.6.15.156  TCP 66 54766 → 22 [ACK] Seq=3029 Ack=244629 Win=2571 Len=0 TSval=7359621 TSecr=14291112
  307 0.431448158  10.6.15.156 → 192.168.1.12 SSH 1514 Server: Encrypted packet (len=1448)
  308 0.431610302  10.6.15.156 → 192.168.1.12 SSH 1514 Server: Encrypted packet (len=1448)
  309 0.431619256 192.168.1.12 → 10.6.15.156  TCP 66 54766 → 22 [ACK] Seq=3029 Ack=247525 Win=2571 Len=0 TSval=7359622 TSecr=14291113
  310 0.431738044  10.6.15.156 → 192.168.1.12 SSH 70 Server: Encrypted packet (len=4)
  311 0.431752120 192.168.1.12 → 10.6.15.156  TCP 66 54766 → 22 [ACK] Seq=3029 Ack=247529 Win=2571 Len=0 TSval=7359622 TSecr=14291113
  312 0.438332305  10.6.15.156 → 192.168.1.12 SSH 150 Server: Encrypted packet (len=84)
  313 0.438383321 192.168.1.12 → 10.6.15.156  TCP 66 54766 → 22 [ACK] Seq=3029 Ack=247613 Win=2571 Len=0 TSval=7359624 TSecr=14291115
  314 0.444566338  10.6.15.156 → 192.168.1.12 SSH 1514 Server: Encrypted packet (len=1448)
  315 0.444734993  10.6.15.156 → 192.168.1.12 SSH 1514 Server: Encrypted packet (len=1448)
  316 0.444743541 192.168.1.12 → 10.6.15.156  TCP 66 54766 → 22 [ACK] Seq=3029 Ack=250509 Win=2571 Len=0 TSval=7359625 TSecr=14291116
  317 0.445055409  10.6.15.156 → 192.168.1.12 SSH 1514 Server: Encrypted packet (len=1448)
  318 0.445061967  10.6.15.156 → 192.168.1.12 SSH 110 Server: Encrypted packet (len=44)
  319 0.445066835 192.168.1.12 → 10.6.15.156  TCP 66 54766 → 22 [ACK] Seq=3029 Ack=252001 Win=2571 Len=0 TSval=7359625 TSecr=14291116
  320 0.446703409  10.6.15.156 → 192.168.1.12 SSH 1514 Server: Encrypted packet (len=1448)
  321 0.446871890  10.6.15.156 → 192.168.1.12 SSH 1514 Server: Encrypted packet (len=1448)
  322 0.446877762 192.168.1.12 → 10.6.15.156  TCP 66 54766 → 22 [ACK] Seq=3029 Ack=254897 Win=2571 Len=0 TSval=7359626 TSecr=14291116
  323 0.447044093  10.6.15.156 → 192.168.1.12 SSH 1514 Server: Encrypted packet (len=1448)
  324 0.447216352  10.6.15.156 → 192.168.1.12 SSH 1514 Server: Encrypted packet (len=1448)
  325 0.447219391 192.168.1.12 → 10.6.15.156  TCP 66 54766 → 22 [ACK] Seq=3029 Ack=257793 Win=2571 Len=0 TSval=7359626 TSecr=14291116
  326 0.447390064  10.6.15.156 → 192.168.1.12 SSH 1514 Server: Encrypted packet (len=1448)
  327 0.447563579  10.6.15.156 → 192.168.1.12 SSH 1514 Server: Encrypted packet (len=1448)
  328 0.447567459 192.168.1.12 → 10.6.15.156  TCP 66 54766 → 22 [ACK] Seq=3029 Ack=260689 Win=2571 Len=0 TSval=7359626 TSecr=14291116
  329 0.447735178  10.6.15.156 → 192.168.1.12 SSH 1514 Server: Encrypted packet (len=1448)
  330 0.448060283  10.6.15.156 → 192.168.1.12 SSH 1514 Server: Encrypted packet (len=1448)
  331 0.448063487 192.168.1.12 → 10.6.15.156  TCP 66 54766 → 22 [ACK] Seq=3029 Ack=263585 Win=2571 Len=0 TSval=7359626 TSecr=14291116
  332 0.448100386  10.6.15.156 → 192.168.1.12 SSH 598 Server: Encrypted packet (len=532)
  333 0.448113430 192.168.1.12 → 10.6.15.156  TCP 66 54766 → 22 [ACK] Seq=3029 Ack=264117 Win=2571 Len=0 TSval=7359626 TSecr=14291117
  334 0.448295002  10.6.15.156 → 192.168.1.12 SSH 1514 Server: Encrypted packet (len=1448)
  335 0.448467252  10.6.15.156 → 192.168.1.12 SSH 1514 Server: Encrypted packet (len=1448)
  336 0.448473380 192.168.1.12 → 10.6.15.156  TCP 66 54766 → 22 [ACK] Seq=3029 Ack=267013 Win=2571 Len=0 TSval=7359626 TSecr=14291117
  337 0.448639927  10.6.15.156 → 192.168.1.12 SSH 1514 Server: Encrypted packet (len=1448)
  338 0.448811324  10.6.15.156 → 192.168.1.12 SSH 1514 Server: Encrypted packet (len=1448)
  339 0.448817230 192.168.1.12 → 10.6.15.156  TCP 66 54766 → 22 [ACK] Seq=3029 Ack=269909 Win=2571 Len=0 TSval=7359626 TSecr=14291117
  340 0.448945936  10.6.15.156 → 192.168.1.12 SSH 110 Server: Encrypted packet (len=44)
  341 0.448965980 192.168.1.12 → 10.6.15.156  TCP 66 54766 → 22 [ACK] Seq=3029 Ack=269953 Win=2571 Len=0 TSval=7359626 TSecr=14291117
  342 0.502510970  10.6.15.156 → 192.168.1.12 SSH 1514 Server: Encrypted packet (len=1448)
  343 0.502531341  10.6.15.156 → 192.168.1.12 SSH 110 Server: Encrypted packet (len=44)
  344 0.502543183 192.168.1.12 → 10.6.15.156  TCP 66 54766 → 22 [ACK] Seq=3029 Ack=271445 Win=2571 Len=0 TSval=7359640 TSecr=14291130
  345 0.502692613  10.6.15.156 → 192.168.1.12 SSH 1514 Server: Encrypted packet (len=1448)
  346 0.502702467  10.6.15.156 → 192.168.1.12 SSH 110 Server: Encrypted packet (len=44)
  347 0.502706129 192.168.1.12 → 10.6.15.156  TCP 66 54766 → 22 [ACK] Seq=3029 Ack=272937 Win=2571 Len=0 TSval=7359640 TSecr=14291130
  348 0.502986468  10.6.15.156 → 192.168.1.12 SSH 1230 Server: Encrypted packet (len=1164)
  349 0.503010270 192.168.1.12 → 10.6.15.156  TCP 66 54766 → 22 [ACK] Seq=3029 Ack=274101 Win=2571 Len=0 TSval=7359640 TSecr=14291131
  350 0.567508061 192.168.1.12 → 10.6.15.156  SSH 238 Client: Encrypted packet (len=172)
  351 0.567723139  10.6.15.156 → 192.168.1.12 SSH 1514 Server: Encrypted packet (len=1448)
  352 0.567888497  10.6.15.156 → 192.168.1.12 SSH 1514 Server: Encrypted packet (len=1448)
  353 0.567896889 192.168.1.12 → 10.6.15.156  TCP 66 54766 → 22 [ACK] Seq=3201 Ack=276997 Win=2571 Len=0 TSval=7359656 TSecr=14291147
  354 0.568019721  10.6.15.156 → 192.168.1.12 SSH 110 Server: Encrypted packet (len=44)
  355 0.568044023 192.168.1.12 → 10.6.15.156  TCP 66 54766 → 22 [ACK] Seq=3201 Ack=277041 Win=2571 Len=0 TSval=7359656 TSecr=14291147
  356 0.569541753  10.6.15.156 → 192.168.1.12 TCP 66 22 → 54766 [ACK] Seq=277041 Ack=3201 Win=1452 Len=0 TSval=14291147 TSecr=7359656
  357 0.574479613  10.6.15.156 → 192.168.1.12 SSH 1514 Server: Encrypted packet (len=1448)
  358 0.574642832  10.6.15.156 → 192.168.1.12 SSH 1514 Server: Encrypted packet (len=1448)
  359 0.574654914 192.168.1.12 → 10.6.15.156  TCP 66 54766 → 22 [ACK] Seq=3201 Ack=279937 Win=2571 Len=0 TSval=7359658 TSecr=14291148
  360 0.574816011  10.6.15.156 → 192.168.1.12 SSH 1514 Server: Encrypted packet (len=1448)
  361 0.574825222  10.6.15.156 → 192.168.1.12 SSH 110 Server: Encrypted packet (len=44)
  362 0.574831287 192.168.1.12 → 10.6.15.156  TCP 66 54766 → 22 [ACK] Seq=3201 Ack=281429 Win=2571 Len=0 TSval=7359658 TSecr=14291148
  363 0.575005332  10.6.15.156 → 192.168.1.12 SSH 1514 Server: Encrypted packet (len=1448)
  364 0.575180360  10.6.15.156 → 192.168.1.12 SSH 1514 Server: Encrypted packet (len=1448)
  365 0.575187899 192.168.1.12 → 10.6.15.156  TCP 66 54766 → 22 [ACK] Seq=3201 Ack=284325 Win=2571 Len=0 TSval=7359658 TSecr=14291148
  366 0.575351938  10.6.15.156 → 192.168.1.12 SSH 1514 Server: Encrypted packet (len=1448)
  367 0.575525067  10.6.15.156 → 192.168.1.12 SSH 1514 Server: Encrypted packet (len=1448)
  368 0.575534559 192.168.1.12 → 10.6.15.156  TCP 66 54766 → 22 [ACK] Seq=3201 Ack=287221 Win=2571 Len=0 TSval=7359658 TSecr=14291148
  369 0.575547880  10.6.15.156 → 192.168.1.12 SSH 446 Server: Encrypted packet (len=380)
  370 0.575575027 192.168.1.12 → 10.6.15.156  TCP 66 54766 → 22 [ACK] Seq=3201 Ack=287601 Win=2571 Len=0 TSval=7359658 TSecr=14291148
  371 0.575708803  10.22.18.63 → 224.0.0.252  LLMNR 72 Standard query 0x68cb A fyhbqcqpqzru
  372 0.575724420  10.22.18.63 → 224.0.0.252  LLMNR 72 Standard query 0xe91e A sxovlrvozyqr
  373 0.575737816  10.22.18.63 → 224.0.0.252  LLMNR 71 Standard query 0x80ed A chpinmnmuil
  374 0.597684776 192.168.1.12 → 10.6.15.156  SSH 198 Client: Encrypted packet (len=132)
  375 0.604478763  10.6.15.156 → 192.168.1.12 SSH 150 Server: Encrypted packet (len=84)
  376 0.645097191 192.168.1.12 → 10.6.15.156  SSH 198 Client: Encrypted packet (len=132)
  377 0.648301232  10.6.15.156 → 192.168.1.12 SSH 1514 Server: Encrypted packet (len=1448)
  378 0.648463164  10.6.15.156 → 192.168.1.12 SSH 1514 Server: Encrypted packet (len=1448)
  379 0.648477700 192.168.1.12 → 10.6.15.156  TCP 66 54766 → 22 [ACK] Seq=3465 Ack=290581 Win=2571 Len=0 TSval=7359676 TSecr=14291167
  380 0.648635493  10.6.15.156 → 192.168.1.12 SSH 1514 Server: Encrypted packet (len=1448)
  381 0.648806939  10.6.15.156 → 192.168.1.12 SSH 1514 Server: Encrypted packet (len=1448)
