    1 0.000000000  10.6.15.156 → 192.168.1.12 SSH 1514 Server: Encrypted packet (len=1448)
    2 0.000167358  10.6.15.156 → 192.168.1.12 SSH 1514 Server: Encrypted packet (len=1448)
    3 0.000177678 192.168.1.12 → 10.6.15.156  TCP 66 54766 → 22 [ACK] Seq=37 Ack=2897 Win=2571 Len=0 TSval=7368537 TSecr=14300025
    4 0.000340108  10.6.15.156 → 192.168.1.12 SSH 1514 Server: Encrypted packet (len=1448)
    5 0.000513688  10.6.15.156 → 192.168.1.12 SSH 1514 Server: Encrypted packet (len=1448)
    6 0.000522620 192.168.1.12 → 10.6.15.156  TCP 66 54766 → 22 [ACK] Seq=37 Ack=5793 Win=2571 Len=0 TSval=7368537 TSecr=14300025
    7 0.000683971  10.6.15.156 → 192.168.1.12 SSH 1514 Server: Encrypted packet (len=1448)
    8 0.000855860  10.6.15.156 → 192.168.1.12 SSH 1514 Server: Encrypted packet (len=1448)
    9 0.000859697 192.168.1.12 → 10.6.15.156  TCP 66 54766 → 22 [ACK] Seq=37 Ack=8689 Win=2571 Len=0 TSval=7368537 TSecr=14300025
   10 0.000969084  10.6.15.156 → 192.168.1.12 SSH 1074 Server: Encrypted packet (len=1008)
   11 0.001155124  10.6.15.156 → 192.168.1.12 SSH 1514 Server: Encrypted packet (len=1448)
   12 0.001159706 192.168.1.12 → 10.6.15.156  TCP 66 54766 → 22 [ACK] Seq=37 Ack=11145 Win=2571 Len=0 TSval=7368537 TSecr=14300025
   13 0.001326550  10.6.15.156 → 192.168.1.12 SSH 1514 Server: Encrypted packet (len=1448)
   14 0.001653683  10.6.15.156 → 192.168.1.12 SSH 1514 Server: Encrypted packet (len=1448)
   15 0.001661320 192.168.1.12 → 10.6.15.156  TCP 66 54766 → 22 [ACK] Seq=37 Ack=14041 Win=2571 Len=0 TSval=7368537 TSecr=14300025
   16 0.001823090  10.6.15.156 → 192.168.1.12 SSH 1514 Server: Encrypted packet (len=1448)
   17 0.001996409  10.6.15.156 → 192.168.1.12 SSH 1514 Server: Encrypted packet (len=1448)
   18 0.002002620 192.168.1.12 → 10.6.15.156  TCP 66 54766 → 22 [ACK] Seq=37 Ack=16937 Win=2571 Len=0 TSval=7368537 TSecr=14300025
   19 0.002168672  10.6.15.156 → 192.168.1.12 SSH 1514 Server: Encrypted packet (len=1448)
   20 0.002340352  10.6.15.156 → 192.168.1.12 SSH 1514 Server: Encrypted packet (len=1448)
   21 0.002345907 192.168.1.12 → 10.6.15.156  TCP 66 54766 → 22 [ACK] Seq=37 Ack=19833 Win=2571 Len=0 TSval=7368537 TSecr=14300025
   22 0.002514381  10.6.15.156 → 192.168.1.12 SSH 1514 Server: Encrypted packet (len=1448)
   23 0.002687278  10.6.15.156 → 192.168.1.12 SSH 1514 Server: Encrypted packet (len=1448)
   24 0.002692756 192.168.1.12 → 10.6.15.156  TCP 66 54766 → 22 [ACK] Seq=37 Ack=22729 Win=2571 Len=0 TSval=7368537 TSecr=14300025
   25 0.002861258  10.6.15.156 → 192.168.1.12 SSH 1514 Server: Encrypted packet (len=1448)
   26 0.003035299  10.6.15.156 → 192.168.1.12 SSH 1514 Server: Encrypted packet (len=1448)
   27 0.003039975 192.168.1.12 → 10.6.15.156  TCP 66 54766 → 22 [ACK] Seq=37 Ack=25625 Win=2571 Len=0 TSval=7368537 TSecr=14300025
   28 0.004564797  10.6.15.156 → 192.168.1.12 SSH 1322 Server: Encrypted packet (len=1256)
   29 0.004739648  10.6.15.156 → 192.168.1.12 SSH 1514 Server: Encrypted packet (len=1448)
   30 0.004747295 192.168.1.12 → 10.6.15.156  TCP 66 54766 → 22 [ACK] Seq=37 Ack=28329 Win=2571 Len=0 TSval=7368538 TSecr=14300025
   31 0.004909609  10.6.15.156 → 192.168.1.12 SSH 1514 Server: Encrypted packet (len=1448)
   32 0.004923735 192.168.1.12 → 10.6.15.156  SSH 102 Client: Encrypted packet (len=36)
   33 0.005083416  10.6.15.156 → 192.168.1.12 SSH 1514 Server: Encrypted packet (len=1448)
   34 0.005254620  10.6.15.156 → 192.168.1.12 SSH 1514 Server: Encrypted packet (len=1448)
   35 0.005259174 192.168.1.12 → 10.6.15.156  TCP 66 54766 → 22 [ACK] Seq=73 Ack=32673 Win=2571 Len=0 TSval=7368538 TSecr=14300026
   36 0.005427186  10.6.15.156 → 192.168.1.12 SSH 1514 Server: Encrypted packet (len=1448)
   37 0.005601236  10.6.15.156 → 192.168.1.12 SSH 1514 Server: Encrypted packet (len=1448)
   38 0.005608942 192.168.1.12 → 10.6.15.156  TCP 66 54766 → 22 [ACK] Seq=73 Ack=35569 Win=2571 Len=0 TSval=7368538 TSecr=14300026
   39 0.005772937  10.6.15.156 → 192.168.1.12 SSH 1514 Server: Encrypted packet (len=1448)
   40 0.005945148  10.6.15.156 → 192.168.1.12 SSH 1514 Server: Encrypted packet (len=1448)
   41 0.005949923 192.168.1.12 → 10.6.15.156  TCP 66 54766 → 22 [ACK] Seq=73 Ack=38465 Win=2571 Len=0 TSval=7368538 TSecr=14300026
   42 0.006269887  10.6.15.156 → 192.168.1.12 SSH 1514 Server: Encrypted packet (len=1448)
   43 0.006442532  10.6.15.156 → 192.168.1.12 SSH 1514 Server: Encrypted packet (len=1448)
   44 0.006446768 192.168.1.12 → 10.6.15.156  TCP 66 54766 → 22 [ACK] Seq=73 Ack=41361 Win=2571 Len=0 TSval=7368538 TSecr=14300026
   45 0.006616038  10.6.15.156 → 192.168.1.12 SSH 1514 Server: Encrypted packet (len=1448)
   46 0.006789587  10.6.15.156 → 192.168.1.12 SSH 1514 Server: Encrypted packet (len=1448)
   47 0.006795377 192.168.1.12 → 10.6.15.156  TCP 66 54766 → 22 [ACK] Seq=73 Ack=44257 Win=2571 Len=0 TSval=7368538 TSecr=14300026
   48 0.006961097  10.6.15.156 → 192.168.1.12 SSH 1514 Server: Encrypted packet (len=1448)
   49 0.007135882  10.6.15.156 → 192.168.1.12 SSH 1514 Server: Encrypted packet (len=1448)
   50 0.007142469 192.168.1.12 → 10.6.15.156  TCP 66 54766 → 22 [ACK] Seq=73 Ack=47153 Win=2571 Len=0 TSval=7368538 TSecr=14300026
   51 0.007307451  10.6.15.156 → 192.168.1.12 SSH 1514 Server: Encrypted packet (len=1448)
   52 0.007480399  10.6.15.156 → 192.168.1.12 SSH 1514 Server: Encrypted packet (len=1448)
   53 0.007485614 192.168.1.12 → 10.6.15.156  TCP 66 54766 → 22 [ACK] Seq=73 Ack=50049 Win=2571 Len=0 TSval=7368538 TSecr=14300026
   54 0.007686560  10.6.15.156 → 192.168.1.12 SSH 1514 Server: Encrypted packet (len=1448)
   55 0.009123617  10.6.15.156 → 192.168.1.12 SSH 1514 Server: Encrypted packet (len=1448)
   56 0.009134470 192.168.1.12 → 10.6.15.156  TCP 66 54766 → 22 [ACK] Seq=73 Ack=52945 Win=2571 Len=0 TSval=7368539 TSecr=14300026
   57 0.009293659  10.6.15.156 → 192.168.1.12 SSH 1514 Server: Encrypted packet (len=1448)
   58 0.009466352  10.6.15.156 → 192.168.1.12 SSH 1514 Server: Encrypted packet (len=1448)
   59 0.009471730 192.168.1.12 → 10.6.15.156  TCP 66 54766 → 22 [ACK] Seq=73 Ack=55841 Win=2571 Len=0 TSval=7368539 TSecr=14300028
   60 0.009638271  10.6.15.156 → 192.168.1.12 SSH 1514 Server: Encrypted packet (len=1448)
   61 0.009813057  10.6.15.156 → 192.168.1.12 SSH 1514 Server: Encrypted packet (len=1448)
   62 0.009818035 192.168.1.12 → 10.6.15.156  TCP 66 54766 → 22 [ACK] Seq=73 Ack=58737 Win=2571 Len=0 TSval=7368539 TSecr=14300028
   63 0.009985435  10.6.15.156 → 192.168.1.12 SSH 1514 Server: Encrypted packet (len=1448)
   64 0.010156952  10.6.15.156 → 192.168.1.12 SSH 1514 Server: Encrypted packet (len=1448)
   65 0.010161152 192.168.1.12 → 10.6.15.156  TCP 66 54766 → 22 [ACK] Seq=73 Ack=61633 Win=2571 Len=0 TSval=7368539 TSecr=14300028
   66 0.010346430  10.6.15.156 → 192.168.1.12 SSH 1514 Server: Encrypted packet (len=1448)
   67 0.010371343 192.168.1.12 → 10.6.15.156  SSH 138 Client: Encrypted packet (len=72)
   68 0.010503041  10.6.15.156 → 192.168.1.12 SSH 1514 Server: Encrypted packet (len=1448)
   69 0.010832271  10.6.15.156 → 192.168.1.12 SSH 1514 Server: Encrypted packet (len=1448)
   70 0.010841762 192.168.1.12 → 10.6.15.156  TCP 66 54766 → 22 [ACK] Seq=145 Ack=65977 Win=2571 Len=0 TSval=7368539 TSecr=14300028
   71 0.011003768  10.6.15.156 → 192.168.1.12 SSH 1514 Server: Encrypted packet (len=1448)
   72 0.011175196  10.6.15.156 → 192.168.1.12 SSH 1514 Server: Encrypted packet (len=1448)
   73 0.011184320 192.168.1.12 → 10.6.15.156  TCP 66 54766 → 22 [ACK] Seq=145 Ack=68873 Win=2571 Len=0 TSval=7368539 TSecr=14300028
   74 0.011346925  10.6.15.156 → 192.168.1.12 SSH 1514 Server: Encrypted packet (len=1448)
   75 0.011519774  10.6.15.156 → 192.168.1.12 SSH 1514 Server: Encrypted packet (len=1448)
   76 0.011526298 192.168.1.12 → 10.6.15.156  TCP 66 54766 → 22 [ACK] Seq=145 Ack=71769 Win=2571 Len=0 TSval=7368539 TSecr=14300028
   77 0.011693184  10.6.15.156 → 192.168.1.12 SSH 1514 Server: Encrypted packet (len=1448)
   78 0.011865742  10.6.15.156 → 192.168.1.12 SSH 1514 Server: Encrypted packet (len=1448)
   79 0.011874097 192.168.1.12 → 10.6.15.156  TCP 66 54766 → 22 [ACK] Seq=145 Ack=74665 Win=2571 Len=0 TSval=7368540 TSecr=14300028
   80 0.012039066  10.6.15.156 → 192.168.1.12 SSH 1514 Server: Encrypted packet (len=1448)
   81 0.012212970  10.6.15.156 → 192.168.1.12 SSH 1514 Server: Encrypted packet (len=1448)
   82 0.012221245 192.168.1.12 → 10.6.15.156  TCP 66 54766 → 22 [ACK] Seq=145 Ack=77561 Win=2571 Len=0 TSval=7368540 TSecr=14300028
   83 0.014186114  10.6.15.156 → 192.168.1.12 SSH 1514 Server: Encrypted packet (len=1448)
   84 0.014351441  10.6.15.156 → 192.168.1.12 SSH 1514 Server: Encrypted packet (len=1448)
   85 0.014363905 192.168.1.12 → 10.6.15.156  TCP 66 54766 → 22 [ACK] Seq=145 Ack=80457 Win=2571 Len=0 TSval=7368540 TSecr=14300029
   86 0.014524117  10.6.15.156 → 192.168.1.12 SSH 1514 Server: Encrypted packet (len=1448)
   87 0.015272006 192.168.1.12 → 10.6.15.156  SSH 662 Client: Encrypted packet (len=596)
   88 0.017836249  10.6.15.156 → 192.168.1.12 SSH 1514 Server: Encrypted packet (len=1448)
   89 0.017854710  10.6.15.156 → 192.168.1.12 SSH 314 Server: Encrypted packet (len=248)
   90 0.017862830 192.168.1.12 → 10.6.15.156  TCP 66 54766 → 22 [ACK] Seq=741 Ack=83601 Win=2571 Len=0 TSval=7368541 TSecr=14300029
   91 0.017875091  10.6.15.156 → 192.168.1.12 SSH 102 Server: Encrypted packet (len=36)
   92 0.018877983  10.6.15.156 → 192.168.1.12 TCP 66 22 → 54766 [ACK] Seq=83637 Ack=741 Win=1452 Len=0 TSval=14300032 TSecr=7368539
   93 0.020777368  10.6.15.156 → 192.168.1.12 SSH 1514 Server: Encrypted packet (len=1448)
   94 0.020798012 192.168.1.12 → 10.6.15.156  TCP 66 54766 → 22 [ACK] Seq=741 Ack=85085 Win=2571 Len=0 TSval=7368542 TSecr=14300030
   95 0.020935579  10.6.15.156 → 192.168.1.12 SSH 1514 Server: Encrypted packet (len=1448)
   96 0.021260322  10.6.15.156 → 192.168.1.12 SSH 1514 Server: Encrypted packet (len=1448)
   97 0.021266888 192.168.1.12 → 10.6.15.156  TCP 66 54766 → 22 [ACK] Seq=741 Ack=87981 Win=2571 Len=0 TSval=7368542 TSecr=14300033
   98 0.021433111  10.6.15.156 → 192.168.1.12 SSH 1514 Server: Encrypted packet (len=1448)
   99 0.021606032  10.6.15.156 → 192.168.1.12 SSH 1514 Server: Encrypted packet (len=1448)
  100 0.021612405 192.168.1.12 → 10.6.15.156  TCP 66 54766 → 22 [ACK] Seq=741 Ack=90877 Win=2571 Len=0 TSval=7368542 TSecr=14300033
  101 0.021631248  10.6.15.156 → 192.168.1.12 SSH 434 Server: Encrypted packet (len=368)
  102 0.021982804  10.6.15.156 → 192.168.1.12 SSH 1514 Server: Encrypted packet (len=1448)
  103 0.021990495 192.168.1.12 → 10.6.15.156  TCP 66 54766 → 22 [ACK] Seq=741 Ack=92693 Win=2571 Len=0 TSval=7368542 TSecr=14300033
  104 0.022154676  10.6.15.156 → 192.168.1.12 SSH 1514 Server: Encrypted packet (len=1448)
  105 0.022164607  10.6.15.156 → 192.168.1.12 SSH 110 Server: Encrypted packet (len=44)
  106 0.022169289 192.168.1.12 → 10.6.15.156  TCP 66 54766 → 22 [ACK] Seq=741 Ack=94185 Win=2571 Len=0 TSval=7368542 TSecr=14300033
  107 0.022345295  10.6.15.156 → 192.168.1.12 SSH 1514 Server: Encrypted packet (len=1448)
  108 0.022511963  10.6.15.156 → 192.168.1.12 SSH 1462 Server: Encrypted packet (len=1396)
  109 0.022520060 192.168.1.12 → 10.6.15.156  TCP 66 54766 → 22 [ACK] Seq=741 Ack=97029 Win=2571 Len=0 TSval=7368542 TSecr=14300033
  110 0.054189068  10.6.15.156 → 192.168.1.12 SSH 582 Server: Encrypted packet (len=516)
  111 0.095628207 192.168.1.12 → 10.6.15.156  TCP 66 54766 → 22 [ACK] Seq=741 Ack=97545 Win=2571 Len=0 TSval=7368561 TSecr=14300041
  112 0.104445431 192.168.1.12 → 10.6.15.156  SSH 214 Client: Encrypted packet (len=148)
  113 0.143915690  10.6.15.156 → 192.168.1.12 TCP 66 22 → 54766 [ACK] Seq=97545 Ack=889 Win=1452 Len=0 TSval=14300064 TSecr=7368563
  114 0.143933802 192.168.1.12 → 10.6.15.156  SSH 182 Client: Encrypted packet (len=116)
  115 0.145594392  10.6.15.156 → 192.168.1.12 TCP 66 22 → 54766 [ACK] Seq=97545 Ack=1005 Win=1452 Len=0 TSval=14300064 TSecr=7368573
  116 0.154000365 192.168.1.12 → 10.6.15.156  SSH 182 Client: Encrypted packet (len=116)
  117 0.154283178 192.168.1.12 → 10.6.15.156  SSH 142 Client: Encrypted packet (len=76)
  118 0.154502584 192.168.1.12 → 10.6.15.156  SSH 174 Client: Encrypted packet (len=108)
  119 0.155654769  10.6.15.156 → 192.168.1.12 TCP 66 22 → 54766 [ACK] Seq=97545 Ack=1197 Win=1452 Len=0 TSval=14300067 TSecr=7368575
  120 0.155668763  10.6.15.156 → 192.168.1.12 TCP 66 22 → 54766 [ACK] Seq=97545 Ack=1305 Win=1452 Len=0 TSval=14300067 TSecr=7368575
  121 0.222720211  10.6.15.156 → 192.168.1.12 SSH 150 Server: Encrypted packet (len=84)
  122 0.222765630 192.168.1.12 → 10.6.15.156  TCP 66 54766 → 22 [ACK] Seq=1305 Ack=97629 Win=2571 Len=0 TSval=7368592 TSecr=14300083
  123 0.225145277  10.6.15.156 → 192.168.1.12 SSH 1514 Server: Encrypted packet (len=1448)
  124 0.225675958  10.6.15.156 → 192.168.1.12 SSH 1246 Server: Encrypted packet (len=1180)
  125 0.225681994 192.168.1.12 → 10.6.15.156  TCP 66 54766 → 22 [ACK] Seq=1305 Ack=100257 Win=2571 Len=0 TSval=7368593 TSecr=14300084
  126 0.266047415  10.6.15.156 → 192.168.1.12 SSH 1514 Server: Encrypted packet (len=1448)
  127 0.266210139  10.6.15.156 → 192.168.1.12 SSH 1514 Server: Encrypted packet (len=1448)
  128 0.266216830 192.168.1.12 → 10.6.15.156  TCP 66 54766 → 22 [ACK] Seq=1305 Ack=103153 Win=2571 Len=0 TSval=7368603 TSecr=14300094
  129 0.266382513  10.6.15.156 → 192.168.1.12 SSH 1514 Server: Encrypted packet (len=1448)
  130 0.266523150  10.6.15.156 → 192.168.1.12 SSH 1278 Server: Encrypted packet (len=1212)
  131 0.266525019 192.168.1.12 → 10.6.15.156  TCP 66 54766 → 22 [ACK] Seq=1305 Ack=105813 Win=2571 Len=0 TSval=7368603 TSecr=14300094
  132 0.266702040  10.6.15.156 → 192.168.1.12 SSH 1514 Server: Encrypted packet (len=1448)
  133 0.267015925  10.6.15.156 → 192.168.1.12 SSH 1422 Server: Encrypted packet (len=1356)
  134 0.267022925 192.168.1.12 → 10.6.15.156  TCP 66 54766 → 22 [ACK] Seq=1305 Ack=108617 Win=2571 Len=0 TSval=7368603 TSecr=14300094
  135 0.284197797  10.6.15.156 → 192.168.1.12 SSH 150 Server: Encrypted packet (len=84)
  136 0.284247425 192.168.1.12 → 10.6.15.156  TCP 66 54766 → 22 [ACK] Seq=1305 Ack=108701 Win=2571 Len=0 TSval=7368608 TSecr=14300099
  137 0.291938530  10.6.15.156 → 192.168.1.12 SSH 1514 Server: Encrypted packet (len=1448)
  138 0.292114445  10.6.15.156 → 192.168.1.12 SSH 1514 Server: Encrypted packet (len=1448)
  139 0.292120132 192.168.1.12 → 10.6.15.156  TCP 66 54766 → 22 [ACK] Seq=1305 Ack=111597 Win=2571 Len=0 TSval=7368610 TSecr=14300100
  140 0.292273788  10.6.15.156 → 192.168.1.12 SSH 1514 Server: Encrypted packet (len=1448)
  141 0.292446137  10.6.15.156 → 192.168.1.12 SSH 1514 Server: Encrypted packet (len=1448)
  142 0.292449024 192.168.1.12 → 10.6.15.156  TCP 66 54766 → 22 [ACK] Seq=1305 Ack=114493 Win=2571 Len=0 TSval=7368610 TSecr=14300100
  143 0.292454674  10.6.15.156 → 192.168.1.12 SSH 110 Server: Encrypted packet (len=44)
  144 0.292471389 192.168.1.12 → 10.6.15.156  TCP 66 54766 → 22 [ACK] Seq=1305 Ack=114537 Win=2571 Len=0 TSval=7368610 TSecr=14300100
  145 0.296315451  10.6.15.156 → 192.168.1.12 SSH 1514 Server: Encrypted packet (len=1448)
  146 0.296478125  10.6.15.156 → 192.168.1.12 SSH 1514 Server: Encrypted packet (len=1448)
  147 0.296485198 192.168.1.12 → 10.6.15.156  TCP 66 54766 → 22 [ACK] Seq=1305 Ack=117433 Win=2571 Len=0 TSval=7368611 TSecr=14300101
  148 0.296650652  10.6.15.156 → 192.168.1.12 SSH 1514 Server: Encrypted packet (len=1448)
  149 0.296828278  10.6.15.156 → 192.168.1.12 SSH 1514 Server: Encrypted packet (len=1448)
  150 0.296834122 192.168.1.12 → 10.6.15.156  TCP 66 54766 → 22 [ACK] Seq=1305 Ack=120329 Win=2571 Len=0 TSval=7368611 TSecr=14300101
  151 0.297000164  10.6.15.156 → 192.168.1.12 SSH 1514 Server: Encrypted packet (len=1448)
  152 0.297170275  10.6.15.156 → 192.168.1.12 SSH 1514 Server: Encrypted packet (len=1448)
  153 0.297175129 192.168.1.12 → 10.6.15.156  TCP 66 54766 → 22 [ACK] Seq=1305 Ack=123225 Win=2571 Len=0 TSval=7368611 TSecr=14300101
  154 0.297498587  10.6.15.156 → 192.168.1.12 SSH 1514 Server: Encrypted packet (len=1448)
  155 0.297669926  10.6.15.156 → 192.168.1.12 SSH 1514 Server: Encrypted packet (len=1448)
  156 0.297679548 192.168.1.12 → 10.6.15.156  TCP 66 54766 → 22 [ACK] Seq=1305 Ack=126121 Win=2571 Len=0 TSval=7368611 TSecr=14300101
  157 0.297717598  10.6.15.156 → 192.168.1.12 SSH 598 Server: Encrypted packet (len=532)
  158 0.297744878 192.168.1.12 → 10.6.15.156  TCP 66 54766 → 22 [ACK] Seq=1305 Ack=126653 Win=2571 Len=0 TSval=7368611 TSecr=14300101
  159 0.297915876  10.6.15.156 → 192.168.1.12 SSH 1514 Server: Encrypted packet (len=1448)
  160 0.298088741  10.6.15.156 → 192.168.1.12 SSH 1514 Server: Encrypted packet (len=1448)
  161 0.298096924 192.168.1.12 → 10.6.15.156  TCP 66 54766 → 22 [ACK] Seq=1305 Ack=129549 Win=2571 Len=0 TSval=7368611 TSecr=14300101
  162 0.298259059  10.6.15.156 → 192.168.1.12 SSH 1514 Server: Encrypted packet (len=1448)
  163 0.298436567  10.6.15.156 → 192.168.1.12 SSH 1514 Server: Encrypted packet (len=1448)
  164 0.298442872 192.168.1.12 → 10.6.15.156  TCP 66 54766 → 22 [ACK] Seq=1305 Ack=132445 Win=2571 Len=0 TSval=7368611 TSecr=14300101
  165 0.298605389  10.6.15.156 → 192.168.1.12 SSH 1514 Server: Encrypted packet (len=1448)
  166 0.298780398  10.6.15.156 → 192.168.1.12 SSH 1514 Server: Encrypted packet (len=1448)
  167 0.298787733 192.168.1.12 → 10.6.15.156  TCP 66 54766 → 22 [ACK] Seq=1305 Ack=135341 Win=2571 Len=0 TSval=7368611 TSecr=14300101
  168 0.300087977  10.6.15.156 → 192.168.1.12 SSH 1514 Server: Encrypted packet (len=1448)
  169 0.300257336  10.6.15.156 → 192.168.1.12 SSH 1514 Server: Encrypted packet (len=1448)
  170 0.300265359 192.168.1.12 → 10.6.15.156  TCP 66 54766 → 22 [ACK] Seq=1305 Ack=138237 Win=2571 Len=0 TSval=7368612 TSecr=14300101
  171 0.300427882  10.6.15.156 → 192.168.1.12 SSH 1514 Server: Encrypted packet (len=1448)
  172 0.300432946  10.6.15.156 → 192.168.1.12 SSH 110 Server: Encrypted packet (len=44)
  173 0.300435594 192.168.1.12 → 10.6.15.156  TCP 66 54766 → 22 [ACK] Seq=1305 Ack=139729 Win=2571 Len=0 TSval=7368612 TSecr=14300101
  174 0.300583415 192.168.1.12 → 10.6.15.156  SSH 102 Client: Encrypted packet (len=36)
  175 0.301980057  10.6.15.156 → 192.168.1.12 TCP 66 22 → 54766 [ACK] Seq=139729 Ack=1341 Win=1452 Len=0 TSval=14300103 TSecr=7368612
  176 0.342335710  10.6.15.156 → 192.168.1.12 SSH 1514 Server: Encrypted packet (len=1448)
  177 0.342493708  10.6.15.156 → 192.168.1.12 SSH 1514 Server: Encrypted packet (len=1448)
  178 0.342504231 192.168.1.12 → 10.6.15.156  TCP 66 54766 → 22 [ACK] Seq=1341 Ack=142625 Win=2571 Len=0 TSval=7368622 TSecr=14300113
  179 0.342629320  10.6.15.156 → 192.168.1.12 SSH 110 Server: Encrypted packet (len=44)
  180 0.342835640  10.6.15.156 → 192.168.1.12 SSH 1514 Server: Encrypted packet (len=1448)
  181 0.342841716 192.168.1.12 → 10.6.15.156  TCP 66 54766 → 22 [ACK] Seq=1341 Ack=144117 Win=2571 Len=0 TSval=7368622 TSecr=14300113
  182 0.343008955  10.6.15.156 → 192.168.1.12 SSH 1514 Server: Encrypted packet (len=1448)
  183 0.343186210  10.6.15.156 → 192.168.1.12 SSH 1514 Server: Encrypted packet (len=1448)
  184 0.343193020 192.168.1.12 → 10.6.15.156  TCP 66 54766 → 22 [ACK] Seq=1341 Ack=147013 Win=2571 Len=0 TSval=7368622 TSecr=14300113
  185 0.343204162  10.6.15.156 → 192.168.1.12 SSH 134 Server: Encrypted packet (len=68)
  186 0.383636797 192.168.1.12 → 10.6.15.156  TCP 66 54766 → 22 [ACK] Seq=1341 Ack=147081 Win=2571 Len=0 TSval=7368633 TSecr=14300113
  187 0.402498831 192.168.1.12 → 10.6.15.156  SSH 238 Client: Encrypted packet (len=172)
  188 0.405367797  10.6.15.156 → 192.168.1.12 TCP 66 22 → 54766 [ACK] Seq=147081 Ack=1513 Win=1452 Len=0 TSval=14300129 TSecr=7368637
  189 0.409546747  10.6.15.156 → 192.168.1.12 SSH 150 Server: Encrypted packet (len=84)
  190 0.409608081 192.168.1.12 → 10.6.15.156  TCP 66 54766 → 22 [ACK] Seq=1513 Ack=147165 Win=2571 Len=0 TSval=7368639 TSecr=14300130
  191 0.416200381  10.6.15.156 → 192.168.1.12 SSH 1514 Server: Encrypted packet (len=1448)
  192 0.416362186  10.6.15.156 → 192.168.1.12 SSH 1514 Server: Encrypted packet (len=1448)
  193 0.416371550 192.168.1.12 → 10.6.15.156  TCP 66 54766 → 22 [ACK] Seq=1513 Ack=150061 Win=2571 Len=0 TSval=7368641 TSecr=14300131
  194 0.416642432  10.6.15.156 → 192.168.1.12 SSH 110 Server: Encrypted packet (len=44)
  195 0.416676757 192.168.1.12 → 10.6.15.156  TCP 66 54766 → 22 [ACK] Seq=1513 Ack=150105 Win=2571 Len=0 TSval=7368641 TSecr=14300131
  196 0.418758509  10.6.15.156 → 192.168.1.12 SSH 1514 Server: Encrypted packet (len=1448)
  197 0.418900071  10.6.15.156 → 192.168.1.12 SSH 430 Server: Encrypted packet (len=364)
  198 0.418910553 192.168.1.12 → 10.6.15.156  TCP 66 54766 → 22 [ACK] Seq=1513 Ack=151917 Win=2571 Len=0 TSval=7368641 TSecr=14300132
  199 0.461095089  10.6.15.156 → 192.168.1.12 SSH 1514 Server: Encrypted packet (len=1448)
  200 0.461255873  10.6.15.156 → 192.168.1.12 SSH 1514 Server: Encrypted packet (len=1448)
  201 0.461266794 192.168.1.12 → 10.6.15.156  TCP 66 54766 → 22 [ACK] Seq=1513 Ack=154813 Win=2571 Len=0 TSval=7368652 TSecr=14300143
  202 0.463820272  10.6.15.156 → 192.168.1.12 SSH 1514 Server: Encrypted packet (len=1448)
  203 0.463979032  10.6.15.156 → 192.168.1.12 SSH 1514 Server: Encrypted packet (len=1448)
  204 0.463991066 192.168.1.12 → 10.6.15.156  TCP 66 54766 → 22 [ACK] Seq=1513 Ack=157709 Win=2571 Len=0 TSval=7368653 TSecr=14300143
  205 0.464153744  10.6.15.156 → 192.168.1.12 SSH 1514 Server: Encrypted packet (len=1448)
  206 0.464162011  10.6.15.156 → 192.168.1.12 SSH 382 Server: Encrypted packet (len=316)
  207 0.464168117 192.168.1.12 → 10.6.15.156  TCP 66 54766 → 22 [ACK] Seq=1513 Ack=159473 Win=2571 Len=0 TSval=7368653 TSecr=14300143
  208 0.465610912  10.6.15.156 → 192.168.1.12 SSH 1514 Server: Encrypted packet (len=1448)
  209 0.465776292  10.6.15.156 → 192.168.1.12 SSH 1514 Server: Encrypted packet (len=1448)
  210 0.465788061 192.168.1.12 → 10.6.15.156  TCP 66 54766 → 22 [ACK] Seq=1513 Ack=162369 Win=2571 Len=0 TSval=7368653 TSecr=14300143
  211 0.465949584  10.6.15.156 → 192.168.1.12 SSH 1514 Server: Encrypted packet (len=1448)
  212 0.466122606  10.6.15.156 → 192.168.1.12 SSH 1514 Server: Encrypted packet (len=1448)
  213 0.466131265 192.168.1.12 → 10.6.15.156  TCP 66 54766 → 22 [ACK] Seq=1513 Ack=165265 Win=2571 Len=0 TSval=7368653 TSecr=14300143
  214 0.466294925  10.6.15.156 → 192.168.1.12 SSH 1514 Server: Encrypted packet (len=1448)
  215 0.466467888  10.6.15.156 → 192.168.1.12 SSH 1514 Server: Encrypted packet (len=1448)
  216 0.466475839 192.168.1.12 → 10.6.15.156  TCP 66 54766 → 22 [ACK] Seq=1513 Ack=168161 Win=2571 Len=0 TSval=7368653 TSecr=14300143
  217 0.466640226  10.6.15.156 → 192.168.1.12 SSH 1514 Server: Encrypted packet (len=1448)
  218 0.466812360  10.6.15.156 → 192.168.1.12 SSH 1514 Server: Encrypted packet (len=1448)
  219 0.466819938 192.168.1.12 → 10.6.15.156  TCP 66 54766 → 22 [ACK] Seq=1513 Ack=171057 Win=2571 Len=0 TSval=7368653 TSecr=14300143
  220 0.466984444  10.6.15.156 → 192.168.1.12 SSH 1514 Server: Encrypted packet (len=1448)
  221 0.471703735  10.6.15.156 → 192.168.1.12 SSH 1514 Server: Encrypted packet (len=1448)
  222 0.471726059 192.168.1.12 → 10.6.15.156  TCP 66 54766 → 22 [ACK] Seq=1513 Ack=173953 Win=2571 Len=0 TSval=7368655 TSecr=14300143
  223 0.471746330  10.6.15.156 → 192.168.1.12 SSH 86 Server: Encrypted packet (len=20)
  224 0.471789114 192.168.1.12 → 10.6.15.156  TCP 66 54766 → 22 [ACK] Seq=1513 Ack=173973 Win=2571 Len=0 TSval=7368655 TSecr=14300143
  225 0.471879492  10.6.15.156 → 192.168.1.12 SSH 1514 Server: Encrypted packet (len=1448)
  226 0.472052874  10.6.15.156 → 192.168.1.12 SSH 1514 Server: Encrypted packet (len=1448)
  227 0.472056722 192.168.1.12 → 10.6.15.156  TCP 66 54766 → 22 [ACK] Seq=1513 Ack=176869 Win=2571 Len=0 TSval=7368655 TSecr=14300144
  228 0.472082840 192.168.1.12 → 10.6.15.156  SSH 102 Client: Encrypted packet (len=36)
  229 0.472228171  10.6.15.156 → 192.168.1.12 SSH 1514 Server: Encrypted packet (len=1448)
  230 0.472399581  10.6.15.156 → 192.168.1.12 SSH 1514 Server: Encrypted packet (len=1448)
  231 0.472406711 192.168.1.12 → 10.6.15.156  TCP 66 54766 → 22 [ACK] Seq=1549 Ack=179765 Win=2571 Len=0 TSval=7368655 TSecr=14300144
  232 0.472571943  10.6.15.156 → 192.168.1.12 SSH 1514 Server: Encrypted packet (len=1448)
  233 0.472744767  10.6.15.156 → 192.168.1.12 SSH 1514 Server: Encrypted packet (len=1448)
  234 0.472753517 192.168.1.12 → 10.6.15.156  TCP 66 54766 → 22 [ACK] Seq=1549 Ack=182661 Win=2571 Len=0 TSval=7368655 TSecr=14300144
  235 0.472916494  10.6.15.156 → 192.168.1.12 SSH 1514 Server: Encrypted packet (len=1448)
  236 0.474225985  10.6.15.156 → 192.168.1.12 SSH 1514 Server: Encrypted packet (len=1448)
  237 0.474245492 192.168.1.12 → 10.6.15.156  TCP 66 54766 → 22 [ACK] Seq=1549 Ack=185557 Win=2571 Len=0 TSval=7368655 TSecr=14300144
  238 0.474389357  10.6.15.156 → 192.168.1.12 SSH 1514 Server: Encrypted packet (len=1448)
  239 0.474559292  10.6.15.156 → 192.168.1.12 SSH 1514 Server: Encrypted packet (len=1448)
  240 0.474563919 192.168.1.12 → 10.6.15.156  TCP 66 54766 → 22 [ACK] Seq=1549 Ack=188453 Win=2571 Len=0 TSval=7368655 TSecr=14300144
  241 0.474734454  10.6.15.156 → 192.168.1.12 SSH 1514 Server: Encrypted packet (len=1448)
  242 0.474770949  10.6.15.156 → 192.168.1.12 SSH 550 Server: Encrypted packet (len=484)
  243 0.474775724 192.168.1.12 → 10.6.15.156  TCP 66 54766 → 22 [ACK] Seq=1549 Ack=190385 Win=2571 Len=0 TSval=7368655 TSecr=14300144
  244 0.474970477  10.6.15.156 → 192.168.1.12 SSH 1514 Server: Encrypted packet (len=1448)
  245 0.475143821  10.6.15.156 → 192.168.1.12 SSH 1514 Server: Encrypted packet (len=1448)
  246 0.475151019 192.168.1.12 → 10.6.15.156  TCP 66 54766 → 22 [ACK] Seq=1549 Ack=193281 Win=2571 Len=0 TSval=7368655 TSecr=14300144
  247 0.475318221  10.6.15.156 → 192.168.1.12 SSH 1514 Server: Encrypted packet (len=1448)
  248 0.478671668  10.6.15.156 → 192.168.1.12 SSH 1514 Server: Encrypted packet (len=1448)
  249 0.478690878 192.168.1.12 → 10.6.15.156  TCP 66 54766 → 22 [ACK] Seq=1549 Ack=196177 Win=2571 Len=0 TSval=7368656 TSecr=14300144
  250 0.478856662  10.6.15.156 → 192.168.1.12 SSH 1514 Server: Encrypted packet (len=1448)
  251 0.479049067  10.6.15.156 → 192.168.1.12 SSH 1514 Server: Encrypted packet (len=1448)
  252 0.479056865 192.168.1.12 → 10.6.15.156  TCP 66 54766 → 22 [ACK] Seq=1549 Ack=199073 Win=2571 Len=0 TSval=7368656 TSecr=14300144
  253 0.479067966  10.6.15.156 → 192.168.1.12 SSH 158 Server: Encrypted packet (len=92)
  254 0.511908277  10.6.15.156 → 192.168.1.12 TCP 66 22 → 54766 [ACK] Seq=199165 Ack=1549 Win=1452 Len=0 TSval=14300156 TSecr=7368655
  255 0.519632432 192.168.1.12 → 10.6.15.156  TCP 66 54766 → 22 [ACK] Seq=1549 Ack=199165 Win=2571 Len=0 TSval=7368667 TSecr=14300144
  256 0.538407936 192.168.1.12 → 10.6.15.156  SSH 198 Client: Encrypted packet (len=132)
  257 0.540420754  10.6.15.156 → 192.168.1.12 TCP 66 22 → 54766 [ACK] Seq=199165 Ack=1681 Win=1452 Len=0 TSval=14300163 TSecr=7368671
  258 0.549176720  10.6.15.156 → 192.168.1.12 SSH 1514 Server: Encrypted packet (len=1448)
  259 0.549356535  10.6.15.156 → 192.168.1.12 SSH 1514 Server: Encrypted packet (len=1448)
  260 0.549365952 192.168.1.12 → 10.6.15.156  TCP 66 54766 → 22 [ACK] Seq=1681 Ack=202061 Win=2571 Len=0 TSval=7368674 TSecr=14300165
  261 0.549549259  10.6.15.156 → 192.168.1.12 SSH 1514 Server: Encrypted packet (len=1448)
  262 0.549738683  10.6.15.156 → 192.168.1.12 SSH 1514 Server: Encrypted packet (len=1448)
  263 0.549745560 192.168.1.12 → 10.6.15.156  TCP 66 54766 → 22 [ACK] Seq=1681 Ack=204957 Win=2571 Len=0 TSval=7368674 TSecr=14300165
  264 0.549761443  10.6.15.156 → 192.168.1.12 SSH 382 Server: Encrypted packet (len=316)
  265 0.549775431 192.168.1.12 → 10.6.15.156  TCP 66 54766 → 22 [ACK] Seq=1681 Ack=205273 Win=2571 Len=0 TSval=7368674 TSecr=14300165
  266 0.551217568  10.6.15.156 → 192.168.1.12 SSH 1514 Server: Encrypted packet (len=1448)
  267 0.551405325  10.6.15.156 → 192.168.1.12 SSH 1514 Server: Encrypted packet (len=1448)
  268 0.551416379 192.168.1.12 → 10.6.15.156  TCP 66 54766 → 22 [ACK] Seq=1681 Ack=208169 Win=2571 Len=0 TSval=7368674 TSecr=14300165
  269 0.551595699  10.6.15.156 → 192.168.1.12 SSH 1514 Server: Encrypted packet (len=1448)
  270 0.551789986  10.6.15.156 → 192.168.1.12 SSH 1514 Server: Encrypted packet (len=1448)
  271 0.551796212 192.168.1.12 → 10.6.15.156  TCP 66 54766 → 22 [ACK] Seq=1681 Ack=211065 Win=2571 Len=0 TSval=7368675 TSecr=14300165
  272 0.552134133  10.6.15.156 → 192.168.1.12 SSH 1514 Server: Encrypted packet (len=1448)
  273 0.552325257  10.6.15.156 → 192.168.1.12 SSH 1514 Server: Encrypted packet (len=1448)
  274 0.552333996 192.168.1.12 → 10.6.15.156  TCP 66 54766 → 22 [ACK] Seq=1681 Ack=213961 Win=2571 Len=0 TSval=7368675 TSecr=14300165
  275 0.552516766  10.6.15.156 → 192.168.1.12 SSH 1514 Server: Encrypted packet (len=1448)
  276 0.552708837  10.6.15.156 → 192.168.1.12 SSH 1514 Server: Encrypted packet (len=1448)
  277 0.552716059 192.168.1.12 → 10.6.15.156  TCP 66 54766 → 22 [ACK] Seq=1681 Ack=216857 Win=2571 Len=0 TSval=7368675 TSecr=14300165
  278 0.553053990  10.6.15.156 → 192.168.1.12 SSH 1514 Server: Encrypted packet (len=1448)
  279 0.553064498  10.6.15.156 → 192.168.1.12 SSH 102 Server: Encrypted packet (len=36)
  280 0.553073429 192.168.1.12 → 10.6.15.156  TCP 66 54766 → 22 [ACK] Seq=1681 Ack=218341 Win=2571 Len=0 TSval=7368675 TSecr=14300165
  281 0.553262777  10.6.15.156 → 192.168.1.12 SSH 1514 Server: Encrypted packet (len=1448)
  282 0.553455415  10.6.15.156 → 192.168.1.12 SSH 1514 Server: Encrypted packet (len=1448)
  283 0.553460934 192.168.1.12 → 10.6.15.156  TCP 66 54766 → 22 [ACK] Seq=1681 Ack=221237 Win=2571 Len=0 TSval=7368675 TSecr=14300165
  284 0.553645381  10.6.15.156 → 192.168.1.12 SSH 1514 Server: Encrypted packet (len=1448)
  285 0.553836164  10.6.15.156 → 192.168.1.12 SSH 1514 Server: Encrypted packet (len=1448)
  286 0.553839696 192.168.1.12 → 10.6.15.156  TCP 66 54766 → 22 [ACK] Seq=1681 Ack=224133 Win=2571 Len=0 TSval=7368675 TSecr=14300165
  287 0.554027731  10.6.15.156 → 192.168.1.12 SSH 1514 Server: Encrypted packet (len=1448)
  288 0.554221681  10.6.15.156 → 192.168.1.12 SSH 1514 Server: Encrypted packet (len=1448)
  289 0.554227104 192.168.1.12 → 10.6.15.156  TCP 66 54766 → 22 [ACK] Seq=1681 Ack=227029 Win=2571 Len=0 TSval=7368675 TSecr=14300165
  290 0.555127982  10.6.15.156 → 192.168.1.12 SSH 1514 Server: Encrypted packet (len=1448)
  291 0.555232368  10.6.15.156 → 192.168.1.12 SSH 974 Server: Encrypted packet (len=908)
  292 0.555239405 192.168.1.12 → 10.6.15.156  TCP 66 54766 → 22 [ACK] Seq=1681 Ack=229385 Win=2571 Len=0 TSval=7368675 TSecr=14300165
  293 1.049566594 192.168.1.12 → 10.6.15.156  SSH 302 Client: Encrypted packet (len=236)
  294 1.087978358  10.6.15.156 → 192.168.1.12 TCP 66 22 → 54766 [ACK] Seq=229385 Ack=1917 Win=1452 Len=0 TSval=14300300 TSecr=7368799
  295 1.087999713 192.168.1.12 → 10.6.15.156  SSH 670 Client: Encrypted packet (len=604)
  296 1.092516980  10.6.15.156 → 192.168.1.12 TCP 66 22 → 54766 [ACK] Seq=229385 Ack=2521 Win=1452 Len=0 TSval=14300300 TSecr=7368809
  297 1.145723787  10.6.15.156 → 192.168.1.12 SSH 1514 Server: Encrypted packet (len=1448)
  298 1.145746286 192.168.1.12 → 10.6.15.156  TCP 66 54766 → 22 [ACK] Seq=2521 Ack=230833 Win=2571 Len=0 TSval=7368823 TSecr=14300314
  299 1.146355366  10.6.15.156 → 192.168.1.12 SSH 1514 Server: Encrypted packet (len=1448)
  300 1.146374332 192.168.1.12 → 10.6.15.156  TCP 66 54766 → 22 [ACK] Seq=2521 Ack=232281 Win=2571 Len=0 TSval=7368823 TSecr=14300314
  301 1.146671756  10.6.15.156 → 192.168.1.12 SSH 1514 Server: Encrypted packet (len=1448)
  302 1.146683390 192.168.1.12 → 10.6.15.156  TCP 66 54766 → 22 [ACK] Seq=2521 Ack=233729 Win=2571 Len=0 TSval=7368823 TSecr=14300314
  303 1.146859876  10.6.15.156 → 192.168.1.12 SSH 1514 Server: Encrypted packet (len=1448)
  304 1.146866664 192.168.1.12 → 10.6.15.156  TCP 66 54766 → 22 [ACK] Seq=2521 Ack=235177 Win=2571 Len=0 TSval=7368823 TSecr=14300314
  305 1.146875943  10.6.15.156 → 192.168.1.12 SSH 374 Server: Encrypted packet (len=308)
  306 1.146881114 192.168.1.12 → 10.6.15.156  TCP 66 54766 → 22 [ACK] Seq=2521 Ack=235485 Win=2571 Len=0 TSval=7368823 TSecr=14300314
  307 1.147256380  10.6.15.156 → 192.168.1.12 SSH 1514 Server: Encrypted packet (len=1448)
  308 1.147265879 192.168.1.12 → 10.6.15.156  TCP 66 54766 → 22 [ACK] Seq=2521 Ack=236933 Win=2571 Len=0 TSval=7368823 TSecr=14300314
  309 1.147575171  10.6.15.156 → 192.168.1.12 SSH 1514 Server: Encrypted packet (len=1448)
  310 1.147582621 192.168.1.12 → 10.6.15.156  TCP 66 54766 → 22 [ACK] Seq=2521 Ack=238381 Win=2571 Len=0 TSval=7368823 TSecr=14300314
  311 1.147767965  10.6.15.156 → 192.168.1.12 SSH 1514 Server: Encrypted packet (len=1448)
  312 1.147774206 192.168.1.12 → 10.6.15.156  TCP 66 54766 → 22 [ACK] Seq=2521 Ack=239829 Win=2571 Len=0 TSval=7368824 TSecr=14300314
  313 1.147959868  10.6.15.156 → 192.168.1.12 SSH 1514 Server: Encrypted packet (len=1448)
  314 1.147965047 192.168.1.12 → 10.6.15.156  TCP 66 54766 → 22 [ACK] Seq=2521 Ack=241277 Win=2571 Len=0 TSval=7368824 TSecr=14300314
  315 1.148307572  10.6.15.156 → 192.168.1.12 SSH 1514 Server: Encrypted packet (len=1448)
  316 1.148318859 192.168.1.12 → 10.6.15.156  TCP 66 54766 → 22 [ACK] Seq=2521 Ack=242725 Win=2571 Len=0 TSval=7368824 TSecr=14300314
  317 1.148496328  10.6.15.156 → 192.168.1.12 SSH 1514 Server: Encrypted packet (len=1448)
  318 1.148503986 192.168.1.12 → 10.6.15.156  TCP 66 54766 → 22 [ACK] Seq=2521 Ack=244173 Win=2571 Len=0 TSval=7368824 TSecr=14300314
  319 1.148688150  10.6.15.156 → 192.168.1.12 SSH 1514 Server: Encrypted packet (len=1448)
  320 1.148693608 192.168.1.12 → 10.6.15.156  TCP 66 54766 → 22 [ACK] Seq=2521 Ack=245621 Win=2571 Len=0 TSval=7368824 TSecr=14300314
  321 1.148878181  10.6.15.156 → 192.168.1.12 SSH 1514 Server: Encrypted packet (len=1448)
  322 1.148883587 192.168.1.12 → 10.6.15.156  TCP 66 54766 → 22 [ACK] Seq=2521 Ack=247069 Win=2571 Len=0 TSval=7368824 TSecr=14300314
  323 1.151545779  10.6.15.156 → 192.168.1.12 SSH 1514 Server: Encrypted packet (len=1448)
  324 1.151566773 192.168.1.12 → 10.6.15.156  TCP 66 54766 → 22 [ACK] Seq=2521 Ack=248517 Win=2571 Len=0 TSval=7368824 TSecr=14300315
  325 1.151725451  10.6.15.156 → 192.168.1.12 SSH 1514 Server: Encrypted packet (len=1448)
  326 1.151730658 192.168.1.12 → 10.6.15.156  TCP 66 54766 → 22 [ACK] Seq=2521 Ack=249965 Win=2571 Len=0 TSval=7368825 TSecr=14300315
  327 1.151916286  10.6.15.156 → 192.168.1.12 SSH 1514 Server: Encrypted packet (len=1448)
  328 1.151922031 192.168.1.12 → 10.6.15.156  TCP 66 54766 → 22 [ACK] Seq=2521 Ack=251413 Win=2571 Len=0 TSval=7368825 TSecr=14300315
  329 1.152108438  10.6.15.156 → 192.168.1.12 SSH 1514 Server: Encrypted packet (len=1448)
  330 1.152300642  10.6.15.156 → 192.168.1.12 SSH 1514 Server: Encrypted packet (len=1448)
  331 1.152306518 192.168.1.12 → 10.6.15.156  TCP 66 54766 → 22 [ACK] Seq=2521 Ack=254309 Win=2571 Len=0 TSval=7368825 TSecr=14300315
  332 1.152493569  10.6.15.156 → 192.168.1.12 SSH 1514 Server: Encrypted packet (len=1448)
  333 1.152685261  10.6.15.156 → 192.168.1.12 SSH 1514 Server: Encrypted packet (len=1448)
  334 1.152694400 192.168.1.12 → 10.6.15.156  TCP 66 54766 → 22 [ACK] Seq=2521 Ack=257205 Win=2571 Len=0 TSval=7368825 TSecr=14300315
  335 1.153033351  10.6.15.156 → 192.168.1.12 SSH 1514 Server: Encrypted packet (len=1448)
  336 1.153222617  10.6.15.156 → 192.168.1.12 SSH 1514 Server: Encrypted packet (len=1448)
  337 1.153233621 192.168.1.12 → 10.6.15.156  TCP 66 54766 → 22 [ACK] Seq=2521 Ack=260101 Win=2571 Len=0 TSval=7368825 TSecr=14300315
  338 1.153414771  10.6.15.156 → 192.168.1.12 SSH 1514 Server: Encrypted packet (len=1448)
  339 1.153607035  10.6.15.156 → 192.168.1.12 SSH 1514 Server: Encrypted packet (len=1448)
  340 1.153613878 192.168.1.12 → 10.6.15.156  TCP 66 54766 → 22 [ACK] Seq=2521 Ack=262997 Win=2571 Len=0 TSval=7368825 TSecr=14300315
  341 1.153800105  10.6.15.156 → 192.168.1.12 SSH 1514 Server: Encrypted packet (len=1448)
  342 1.153991805  10.6.15.156 → 192.168.1.12 SSH 1514 Server: Encrypted packet (len=1448)
  343 1.154001369 192.168.1.12 → 10.6.15.156  TCP 66 54766 → 22 [ACK] Seq=2521 Ack=265893 Win=2571 Len=0 TSval=7368825 TSecr=14300315
  344 1.154184017  10.6.15.156 → 192.168.1.12 SSH 1514 Server: Encrypted packet (len=1448)
  345 1.154377165  10.6.15.156 → 192.168.1.12 SSH 1514 Server: Encrypted packet (len=1448)
  346 1.154384279 192.168.1.12 → 10.6.15.156  TCP 66 54766 → 22 [ACK] Seq=2521 Ack=268789 Win=2571 Len=0 TSval=7368825 TSecr=14300315
  347 1.154564420  10.6.15.156 → 192.168.1.12 SSH 1514 Server: Encrypted packet (len=1448)
  348 1.155623680  10.6.15.156 → 192.168.1.12 SSH 1398 Server: Encrypted packet (len=1332)
  349 1.155642143 192.168.1.12 → 10.6.15.156  TCP 66 54766 → 22 [ACK] Seq=2521 Ack=271569 Win=2571 Len=0 TSval=7368826 TSecr=14300315
  350 1.169431279  10.6.15.156 → 192.168.1.12 SSH 342 Server: Encrypted packet (len=276)
  351 1.169483335 192.168.1.12 → 10.6.15.156  TCP 66 54766 → 22 [ACK] Seq=2521 Ack=271845 Win=2571 Len=0 TSval=7368829 TSecr=14300320
  352 1.183769957 192.168.1.12 → 10.6.15.156  SSH 198 Client: Encrypted packet (len=132)
  353 1.185602588  10.6.15.156 → 192.168.1.12 TCP 66 22 → 54766 [ACK] Seq=271845 Ack=2653 Win=1452 Len=0 TSval=14300324 TSecr=7368833
  354 1.185615726 192.168.1.12 → 10.6.15.156  SSH 594 Client: Encrypted packet (len=528)
  355 1.186129100 192.168.1.12 → 10.6.15.156  SSH 330 Client: Encrypted packet (len=264)
  356 1.187681676  10.6.15.156 → 192.168.1.12 TCP 66 22 → 54766 [ACK] Seq=271845 Ack=3445 Win=1452 Len=0 TSval=14300325 TSecr=7368833
  357 1.188021623 192.168.1.12 → 10.6.15.156  SSH 302 Client: Encrypted packet (len=236)
  358 1.189825540  10.6.15.156 → 192.168.1.12 TCP 66 22 → 54766 [ACK] Seq=271845 Ack=3681 Win=1452 Len=0 TSval=14300325 TSecr=7368834
  359 1.204130825  10.6.15.156 → 192.168.1.12 SSH 1514 Server: Encrypted packet (len=1448)
  360 1.204303209  10.6.15.156 → 192.168.1.12 SSH 1514 Server: Encrypted packet (len=1448)
  361 1.204313955 192.168.1.12 → 10.6.15.156  TCP 66 54766 → 22 [ACK] Seq=3681 Ack=274741 Win=2571 Len=0 TSval=7368838 TSecr=14300328
  362 1.204505806  10.6.15.156 → 192.168.1.12 SSH 1514 Server: Encrypted packet (len=1448)
  363 1.204512614  10.6.15.156 → 192.168.1.12 SSH 110 Server: Encrypted packet (len=44)
  364 1.204515684 192.168.1.12 → 10.6.15.156  TCP 66 54766 → 22 [ACK] Seq=3681 Ack=276233 Win=2571 Len=0 TSval=7368838 TSecr=14300328
  365 1.205720911  10.6.15.156 → 192.168.1.12 SSH 1514 Server: Encrypted packet (len=1448)
  366 1.205917864  10.6.15.156 → 192.168.1.12 SSH 1514 Server: Encrypted packet (len=1448)
  367 1.205925472 192.168.1.12 → 10.6.15.156  TCP 66 54766 → 22 [ACK] Seq=3681 Ack=279129 Win=2571 Len=0 TSval=7368838 TSecr=14300329
  368 1.206103747  10.6.15.156 → 192.168.1.12 SSH 1514 Server: Encrypted packet (len=1448)
  369 1.206295671  10.6.15.156 → 192.168.1.12 SSH 1514 Server: Encrypted packet (len=1448)
  370 1.206299033 192.168.1.12 → 10.6.15.156  TCP 66 54766 → 22 [ACK] Seq=3681 Ack=282025 Win=2571 Len=0 TSval=7368838 TSecr=14300329
  371 1.206640183  10.6.15.156 → 192.168.1.12 SSH 1514 Server: Encrypted packet (len=1448)
  372 1.206831626  10.6.15.156 → 192.168.1.12 SSH 1514 Server: Encrypted packet (len=1448)
  373 1.206834399 192.168.1.12 → 10.6.15.156  TCP 66 54766 → 22 [ACK] Seq=3681 Ack=284921 Win=2571 Len=0 TSval=7368838 TSecr=14300329
  374 1.207023985  10.6.15.156 → 192.168.1.12 SSH 1514 Server: Encrypted packet (len=1448)
  375 1.207216218  10.6.15.156 → 192.168.1.12 SSH 1514 Server: Encrypted packet (len=1448)
  376 1.207219020 192.168.1.12 → 10.6.15.156  TCP 66 54766 → 22 [ACK] Seq=3681 Ack=287817 Win=2571 Len=0 TSval=7368838 TSecr=14300329
  377 1.207282979  10.6.15.156 → 192.168.1.12 SSH 598 Server: Encrypted packet (len=532)
