    1 0.000000000  10.6.15.186 → 192.168.1.16 TCP 78 22 → 43250 [ACK] Seq=1 Ack=1 Win=2127 Len=0 TSval=3607935 TSecr=19299405 SLE=37 SRE=73
    2 0.000016781  10.6.15.186 → 192.168.1.16 TCP 78 [TCP Dup ACK 1#1] 22 → 43250 [ACK] Seq=1 Ack=1 Win=2127 Len=0 TSval=3607936 TSecr=19299405 SLE=37 SRE=597
    3 0.039227620  10.6.15.186 → 192.168.1.16 SSH 114 Server: Encrypted packet (len=36)
    4 0.039542422 192.168.1.16 → 10.6.15.186  SSH 158 Client: Encrypted packet (len=92)
    5 0.040973685  10.6.15.186 → 192.168.1.16 TCP 78 [TCP Dup ACK 1#2] 22 → 43250 [ACK] Seq=37 Ack=1 Win=2127 Len=0 TSval=3607946 TSecr=19299405 SLE=37 SRE=689
    6 0.040993501 192.168.1.16 → 10.6.15.186  SSH 102 Client: [TCP Fast Retransmission] , Encrypted packet (len=36)
    7 0.042346930  10.6.15.186 → 192.168.1.16 TCP 66 22 → 43250 [ACK] Seq=37 Ack=689 Win=2127 Len=0 TSval=3607946 TSecr=19299427
    8 0.044502614  10.6.15.186 → 192.168.1.16 SSH 138 Server: Encrypted packet (len=72)
    9 0.044737674 192.168.1.16 → 10.6.15.186  SSH 102 Client: Encrypted packet (len=36)
   10 0.084083150  10.6.15.186 → 192.168.1.16 TCP 66 22 → 43250 [ACK] Seq=109 Ack=725 Win=2127 Len=0 TSval=3607957 TSecr=19299428
   11 0.084216265  10.6.15.186 → 192.168.1.16 SSH 138 Server: Encrypted packet (len=72)
   12 0.084482129 192.168.1.16 → 10.6.15.186  SSH 102 Client: Encrypted packet (len=36)
   13 0.085676037  10.6.15.186 → 192.168.1.16 TCP 66 22 → 43250 [ACK] Seq=181 Ack=761 Win=2127 Len=0 TSval=3607957 TSecr=19299438
   14 0.183447856  10.6.15.186 → 192.168.1.16 SSH 102 Server: Encrypted packet (len=36)
   15 0.183764151 192.168.1.16 → 10.6.15.186  SSH 134 Client: Encrypted packet (len=68)
   16 0.190480551  10.6.15.186 → 192.168.1.16 TCP 66 22 → 43250 [ACK] Seq=217 Ack=829 Win=2127 Len=0 TSval=3607982 TSecr=19299463
   17 0.232288309  10.6.15.186 → 192.168.1.16 SSH 550 Server: Encrypted packet (len=484)
   18 0.238566336  10.6.15.186 → 192.168.1.16 SSH 1514 Server: Encrypted packet (len=1448)
   19 0.238582743 192.168.1.16 → 10.6.15.186  TCP 66 43250 → 22 [ACK] Seq=829 Ack=2149 Win=6166 Len=0 TSval=19299476 TSecr=3607991
   20 0.414834430 192.168.1.16 → 10.6.15.186  SSH 102 Client: Encrypted packet (len=36)
   21 0.415785802 192.168.1.16 → 10.6.15.186  SSH 102 Client: Encrypted packet (len=36)
   22 0.416541822  10.6.15.186 → 192.168.1.16 SSH 126 Server: [TCP Previous segment not captured] , Encrypted packet (len=60)
   23 0.416550726 192.168.1.16 → 10.6.15.186  TCP 78 [TCP Dup ACK 19#1] 43250 → 22 [ACK] Seq=901 Ack=2149 Win=6166 Len=0 TSval=19299521 TSecr=3607991 SLE=3513 SRE=3573
   24 0.416557213  10.6.15.186 → 192.168.1.16 TCP 126 [TCP Retransmission] 22 → 43250 [PSH, ACK] Seq=3513 Ack=829 Win=2127 Len=60 TSval=3608029 TSecr=19299476
   25 0.416559978 192.168.1.16 → 10.6.15.186  TCP 86 [TCP Dup ACK 19#2] 43250 → 22 [ACK] Seq=901 Ack=2149 Win=6166 Len=0 TSval=19299521 TSecr=3607991 SLE=3513 SRE=3573 SLE=3513 SRE=3573
   26 0.416573508  10.6.15.186 → 192.168.1.16 SSH 138 Server: Encrypted packet (len=72)
   27 0.416576482 192.168.1.16 → 10.6.15.186  TCP 78 [TCP Dup ACK 19#3] 43250 → 22 [ACK] Seq=901 Ack=2149 Win=6166 Len=0 TSval=19299521 TSecr=3607991 SLE=3513 SRE=3645
   28 0.416916916  10.6.15.186 → 192.168.1.16 SSH 182 Server: Encrypted packet (len=116)
   29 0.416924566 192.168.1.16 → 10.6.15.186  TCP 78 [TCP Dup ACK 19#4] 43250 → 22 [ACK] Seq=901 Ack=2149 Win=6166 Len=0 TSval=19299521 TSecr=3607991 SLE=3513 SRE=3761
   30 0.419673083  10.6.15.186 → 192.168.1.16 TCP 66 22 → 43250 [ACK] Seq=3761 Ack=901 Win=2127 Len=0 TSval=3608040 TSecr=19299520
   31 0.419887804  10.6.15.186 → 192.168.1.16 SSH 1430 Server: [TCP Fast Retransmission] , Encrypted packet (len=1364)
   32 0.419898874 192.168.1.16 → 10.6.15.186  TCP 66 43250 → 22 [ACK] Seq=901 Ack=3761 Win=6166 Len=0 TSval=19299522 TSecr=3608040
   33 0.420211921 192.168.1.16 → 10.6.15.186  SSH 102 Client: Encrypted packet (len=36)
   34 0.421437650 192.168.1.16 → 10.6.15.186  SSH 134 Client: Encrypted packet (len=68)
   35 0.423791141  10.6.15.186 → 192.168.1.16 TCP 66 22 → 43250 [ACK] Seq=3761 Ack=1005 Win=2127 Len=0 TSval=3608041 TSecr=19299522
   36 0.447416312 192.168.1.16 → 10.6.15.186  SSH 590 Client: Encrypted packet (len=524)
   37 0.461276740  10.6.15.186 → 192.168.1.16 SSH 502 Server: Encrypted packet (len=436)
   38 0.503644060 192.168.1.16 → 10.6.15.186  TCP 66 43250 → 22 [ACK] Seq=1529 Ack=4197 Win=6166 Len=0 TSval=19299543 TSecr=3608051
   39 0.553231315  10.6.15.186 → 192.168.1.16 SSH 182 Server: Encrypted packet (len=116)
   40 0.553256304 192.168.1.16 → 10.6.15.186  TCP 66 43250 → 22 [ACK] Seq=1529 Ack=4313 Win=6166 Len=0 TSval=19299555 TSecr=3608073
   41 0.553519766 192.168.1.16 → 10.6.15.186  SSH 102 Client: Encrypted packet (len=36)
   42 0.553792094 192.168.1.16 → 10.6.15.186  SSH 198 Client: Encrypted packet (len=132)
   43 0.556540846  10.6.15.186 → 192.168.1.16 TCP 66 22 → 43250 [ACK] Seq=4313 Ack=1697 Win=2127 Len=0 TSval=3608074 TSecr=19299555
   44 0.566810344  10.6.15.186 → 192.168.1.16 SSH 102 Server: Encrypted packet (len=36)
   45 0.567591599 192.168.1.16 → 10.6.15.186  SSH 158 Client: Encrypted packet (len=92)
   46 0.608914920  10.6.15.186 → 192.168.1.16 TCP 66 22 → 43250 [ACK] Seq=4349 Ack=1789 Win=2127 Len=0 TSval=3608088 TSecr=19299558
   47 0.648921034  10.6.15.186 → 192.168.1.16 SSH 102 Server: Encrypted packet (len=36)
   48 0.650041078 192.168.1.16 → 10.6.15.186  SSH 150 Client: Encrypted packet (len=84)
   49 0.652307997  10.6.15.186 → 192.168.1.16 TCP 66 22 → 43250 [ACK] Seq=4385 Ack=1873 Win=2127 Len=0 TSval=3608098 TSecr=19299579
   50 0.660874280 192.168.1.16 → 10.6.15.186  SSH 102 Client: Encrypted packet (len=36)
   51 0.661067110 192.168.1.16 → 10.6.15.186  SSH 102 Client: Encrypted packet (len=36)
   52 0.661249078 192.168.1.16 → 10.6.15.186  SSH 102 Client: Encrypted packet (len=36)
   53 0.661427969 192.168.1.16 → 10.6.15.186  SSH 138 Client: Encrypted packet (len=72)
   54 0.662418362  10.6.15.186 → 192.168.1.16 TCP 66 22 → 43250 [ACK] Seq=4385 Ack=1909 Win=2127 Len=0 TSval=3608101 TSecr=19299582
   55 0.662432755 192.168.1.16 → 10.6.15.186  SSH 246 Client: Encrypted packet (len=180)
   56 0.662448999  10.6.15.186 → 192.168.1.16 TCP 66 22 → 43250 [ACK] Seq=4385 Ack=1945 Win=2127 Len=0 TSval=3608101 TSecr=19299582
   57 0.662454953  10.6.15.186 → 192.168.1.16 TCP 66 22 → 43250 [ACK] Seq=4385 Ack=1981 Win=2127 Len=0 TSval=3608101 TSecr=19299582
   58 0.662609869  10.6.15.186 → 192.168.1.16 TCP 66 22 → 43250 [ACK] Seq=4385 Ack=2053 Win=2127 Len=0 TSval=3608101 TSecr=19299582
   59 0.663116184 192.168.1.16 → 10.6.15.186  SSH 154 Client: Encrypted packet (len=88)
   60 0.663310999 192.168.1.16 → 10.6.15.186  SSH 154 Client: Encrypted packet (len=88)
   61 0.663743084 192.168.1.16 → 10.6.15.186  SSH 110 Client: Encrypted packet (len=44)
   62 0.663929343 192.168.1.16 → 10.6.15.186  SSH 278 Client: Encrypted packet (len=212)
   63 0.664597692  10.6.15.186 → 192.168.1.16 TCP 66 22 → 43250 [ACK] Seq=4385 Ack=2233 Win=2127 Len=0 TSval=3608102 TSecr=19299582
   64 0.664614301  10.6.15.186 → 192.168.1.16 TCP 66 22 → 43250 [ACK] Seq=4385 Ack=2321 Win=2127 Len=0 TSval=3608102 TSecr=19299582
   65 0.664619687  10.6.15.186 → 192.168.1.16 TCP 66 22 → 43250 [ACK] Seq=4385 Ack=2409 Win=2127 Len=0 TSval=3608102 TSecr=19299582
   66 0.665240805  10.6.15.186 → 192.168.1.16 SSH 138 Server: Encrypted packet (len=72)
   67 0.665265218  10.6.15.186 → 192.168.1.16 SSH 210 Server: Encrypted packet (len=144)
   68 0.665318218 192.168.1.16 → 10.6.15.186  TCP 66 43250 → 22 [ACK] Seq=2665 Ack=4601 Win=6166 Len=0 TSval=19299583 TSecr=3608102
   69 0.665699831 192.168.1.16 → 10.6.15.186  SSH 174 Client: Encrypted packet (len=108)
   70 0.666742745  10.6.15.186 → 192.168.1.16 SSH 138 Server: Encrypted packet (len=72)
   71 0.666947603 192.168.1.16 → 10.6.15.186  SSH 102 Client: Encrypted packet (len=36)
   72 0.667872736  10.6.15.186 → 192.168.1.16 SSH 210 Server: Encrypted packet (len=144)
   73 0.668580997 192.168.1.16 → 10.6.15.186  SSH 174 Client: Encrypted packet (len=108)
   74 0.668829457 192.168.1.16 → 10.6.15.186  SSH 150 Client: Encrypted packet (len=84)
   75 0.669021194 192.168.1.16 → 10.6.15.186  SSH 250 Client: Encrypted packet (len=184)
   76 0.670125728  10.6.15.186 → 192.168.1.16 TCP 66 22 → 43250 [ACK] Seq=4817 Ack=3001 Win=2127 Len=0 TSval=3608103 TSecr=19299583
   77 0.690854173  10.6.15.186 → 192.168.1.16 SSH 214 Server: Encrypted packet (len=148)
   78 0.691618312 192.168.1.16 → 10.6.15.186  SSH 134 Client: Encrypted packet (len=68)
   79 0.692788526 192.168.1.16 → 10.6.15.186  SSH 630 Client: Encrypted packet (len=564)
   80 0.694447625  10.6.15.186 → 192.168.1.16 TCP 66 22 → 43250 [ACK] Seq=4965 Ack=3817 Win=2127 Len=0 TSval=3608109 TSecr=19299589
   81 0.698269330  10.6.15.186 → 192.168.1.16 SSH 138 Server: Encrypted packet (len=72)
   82 0.706176351  10.6.15.186 → 192.168.1.16 SSH 182 Server: Encrypted packet (len=116)
   83 0.706249826 192.168.1.16 → 10.6.15.186  TCP 66 43250 → 22 [ACK] Seq=3817 Ack=5153 Win=6166 Len=0 TSval=19299593 TSecr=3608110
   84 0.706593559 192.168.1.16 → 10.6.15.186  SSH 134 Client: Encrypted packet (len=68)
   85 0.708267989  10.6.15.186 → 192.168.1.16 SSH 1514 Server: Encrypted packet (len=1448)
   86 0.708394233  10.6.15.186 → 192.168.1.16 SSH 1158 Server: Encrypted packet (len=1092)
   87 0.708407463 192.168.1.16 → 10.6.15.186  TCP 66 43250 → 22 [ACK] Seq=3885 Ack=7693 Win=6166 Len=0 TSval=19299594 TSecr=3608112
   88 0.709646259  10.6.15.186 → 192.168.1.16 SSH 478 Server: Encrypted packet (len=412)
   89 0.710252915  10.6.15.186 → 192.168.1.16 SSH 478 Server: Encrypted packet (len=412)
   90 0.710290761 192.168.1.16 → 10.6.15.186  TCP 66 43250 → 22 [ACK] Seq=3885 Ack=8517 Win=6166 Len=0 TSval=19299594 TSecr=3608113
   91 0.710453557 192.168.1.16 → 10.6.15.186  SSH 342 Client: Encrypted packet (len=276)
   92 0.711952965 192.168.1.16 → 10.6.15.186  SSH 334 Client: Encrypted packet (len=268)
   93 0.712429561  10.6.15.186 → 192.168.1.16 SSH 1030 Server: Encrypted packet (len=964)
   94 0.713484723 192.168.1.16 → 10.6.15.186  SSH 334 Client: Encrypted packet (len=268)
   95 0.714940683 192.168.1.16 → 10.6.15.186  SSH 334 Client: Encrypted packet (len=268)
   96 0.715273284  10.6.15.186 → 192.168.1.16 TCP 66 22 → 43250 [ACK] Seq=9481 Ack=4697 Win=2127 Len=0 TSval=3608114 TSecr=19299595
   97 0.715471078  10.6.15.186 → 192.168.1.16 SSH 486 Server: Encrypted packet (len=420)
   98 0.716711984 192.168.1.16 → 10.6.15.186  SSH 406 Client: Encrypted packet (len=340)
   99 0.718289614  10.6.15.186 → 192.168.1.16 SSH 714 Server: Encrypted packet (len=648)
  100 0.718317335  10.6.15.186 → 192.168.1.16 SSH 258 Server: Encrypted packet (len=192)
  101 0.718367632 192.168.1.16 → 10.6.15.186  TCP 66 43250 → 22 [ACK] Seq=5305 Ack=10741 Win=6166 Len=0 TSval=19299596 TSecr=3608115
  102 0.756776285  10.6.15.186 → 192.168.1.16 SSH 142 Server: Encrypted packet (len=76)
  103 0.799018285  10.6.15.186 → 192.168.1.16 SSH 138 Server: Encrypted packet (len=72)
  104 0.799035808 192.168.1.16 → 10.6.15.186  TCP 66 43250 → 22 [ACK] Seq=5305 Ack=10889 Win=6166 Len=0 TSval=19299616 TSecr=3608125
  105 0.799245053 192.168.1.16 → 10.6.15.186  SSH 102 Client: Encrypted packet (len=36)
  106 0.802140572  10.6.15.186 → 192.168.1.16 SSH 138 Server: Encrypted packet (len=72)
  107 0.802355628 192.168.1.16 → 10.6.15.186  SSH 102 Client: Encrypted packet (len=36)
  108 0.803431221 192.168.1.16 → 10.6.15.186  SSH 102 Client: Encrypted packet (len=36)
  109 0.803669092 192.168.1.16 → 10.6.15.186  SSH 102 Client: Encrypted packet (len=36)
  110 0.804722211  10.6.15.186 → 192.168.1.16 TCP 66 22 → 43250 [ACK] Seq=10961 Ack=5413 Win=2127 Len=0 TSval=3608137 TSecr=19299617
  111 0.805791206 192.168.1.16 → 10.6.15.186  SSH 126 Client: Encrypted packet (len=60)
  112 0.805984316 192.168.1.16 → 10.6.15.186  SSH 102 Client: Encrypted packet (len=36)
  113 0.807408326  10.6.15.186 → 192.168.1.16 TCP 66 22 → 43250 [ACK] Seq=10961 Ack=5545 Win=2127 Len=0 TSval=3608137 TSecr=19299618
  114 0.810402628  10.6.15.186 → 192.168.1.16 SSH 102 Server: Encrypted packet (len=36)
  115 0.817199422 192.168.1.16 → 10.6.15.186  SSH 222 Client: Encrypted packet (len=156)
  116 0.821020089  10.6.15.186 → 192.168.1.16 SSH 486 Server: Encrypted packet (len=420)
  117 0.821865360 192.168.1.16 → 10.6.15.186  SSH 142 Client: Encrypted packet (len=76)
  118 0.841055160  10.6.15.186 → 192.168.1.16 SSH 138 Server: Encrypted packet (len=72)
  119 0.841077574  10.6.15.186 → 192.168.1.16 SSH 138 Server: Encrypted packet (len=72)
  120 0.841133425 192.168.1.16 → 10.6.15.186  TCP 66 43250 → 22 [ACK] Seq=5777 Ack=11561 Win=6166 Len=0 TSval=19299627 TSecr=3608146
  121 0.841417966 192.168.1.16 → 10.6.15.186  SSH 138 Client: Encrypted packet (len=72)
  122 0.842538454  10.6.15.186 → 192.168.1.16 SSH 182 Server: Encrypted packet (len=116)
  123 0.844390228  10.6.15.186 → 192.168.1.16 SSH 1514 Server: Encrypted packet (len=1448)
  124 0.844405477 192.168.1.16 → 10.6.15.186  TCP 66 43250 → 22 [ACK] Seq=5849 Ack=13125 Win=6166 Len=0 TSval=19299628 TSecr=3608146
  125 0.844576582  10.6.15.186 → 192.168.1.16 SSH 1514 Server: Encrypted packet (len=1448)
  126 0.844920470  10.6.15.186 → 192.168.1.16 SSH 1514 Server: Encrypted packet (len=1448)
  127 0.844927257 192.168.1.16 → 10.6.15.186  TCP 66 43250 → 22 [ACK] Seq=5849 Ack=16021 Win=6166 Len=0 TSval=19299628 TSecr=3608146
  128 0.844937290  10.6.15.186 → 192.168.1.16 SSH 94 Server: Encrypted packet (len=28)
  129 0.846978405  10.6.15.186 → 192.168.1.16 SSH 1514 Server: Encrypted packet (len=1448)
  130 0.846988176 192.168.1.16 → 10.6.15.186  TCP 66 43250 → 22 [ACK] Seq=5849 Ack=17497 Win=6166 Len=0 TSval=19299628 TSecr=3608147
  131 0.847165286  10.6.15.186 → 192.168.1.16 SSH 1514 Server: Encrypted packet (len=1448)
  132 0.847356306  10.6.15.186 → 192.168.1.16 SSH 1514 Server: Encrypted packet (len=1448)
  133 0.847358541 192.168.1.16 → 10.6.15.186  TCP 66 43250 → 22 [ACK] Seq=5849 Ack=20393 Win=6166 Len=0 TSval=19299628 TSecr=3608147
  134 0.847703058  10.6.15.186 → 192.168.1.16 SSH 1514 Server: Encrypted packet (len=1448)
  135 0.849683315  10.6.15.186 → 192.168.1.16 SSH 954 Server: Encrypted packet (len=888)
  136 0.849699451 192.168.1.16 → 10.6.15.186  TCP 66 43250 → 22 [ACK] Seq=5849 Ack=22729 Win=6166 Len=0 TSval=19299629 TSecr=3608147
  137 0.851572848  10.6.15.186 → 192.168.1.16 SSH 102 Server: Encrypted packet (len=36)
  138 0.873655503  10.6.15.186 → 192.168.1.16 SSH 102 Server: Encrypted packet (len=36)
  139 0.873722342 192.168.1.16 → 10.6.15.186  TCP 66 43250 → 22 [ACK] Seq=5849 Ack=22801 Win=6166 Len=0 TSval=19299635 TSecr=3608148
  140 0.874689127  10.6.15.186 → 192.168.1.16 SSH 138 Server: Encrypted packet (len=72)
  141 0.874880172 192.168.1.16 → 10.6.15.186  SSH 102 Client: Encrypted packet (len=36)
  142 0.878189446  10.6.15.186 → 192.168.1.16 SSH 182 Server: Encrypted packet (len=116)
  143 0.878473225 192.168.1.16 → 10.6.15.186  SSH 134 Client: Encrypted packet (len=68)
  144 0.881540430  10.6.15.186 → 192.168.1.16 SSH 138 Server: Encrypted packet (len=72)
  145 0.881663770  10.6.15.186 → 192.168.1.16 SSH 138 Server: Encrypted packet (len=72)
  146 0.881763169 192.168.1.16 → 10.6.15.186  TCP 66 43250 → 22 [ACK] Seq=5953 Ack=23133 Win=6166 Len=0 TSval=19299637 TSecr=3608156
  147 0.881776809 192.168.1.16 → 10.6.15.186  SSH 102 Client: Encrypted packet (len=36)
  148 0.881815008  10.6.15.186 → 192.168.1.16 SSH 110 Server: Encrypted packet (len=44)
  149 0.881942532  10.6.15.186 → 192.168.1.16 SSH 102 Server: Encrypted packet (len=36)
  150 0.882041993 192.168.1.16 → 10.6.15.186  TCP 66 43250 → 22 [ACK] Seq=5989 Ack=23213 Win=6166 Len=0 TSval=19299637 TSecr=3608156
  151 0.882306232 192.168.1.16 → 10.6.15.186  SSH 102 Client: Encrypted packet (len=36)
  152 0.883195429  10.6.15.186 → 192.168.1.16 SSH 138 Server: Encrypted packet (len=72)
  153 0.883336461 192.168.1.16 → 10.6.15.186  SSH 102 Client: Encrypted packet (len=36)
  154 0.883700401  10.6.15.186 → 192.168.1.16 TCP 66 22 → 43250 [ACK] Seq=23285 Ack=6025 Win=2127 Len=0 TSval=3608156 TSecr=19299637
  155 0.887263463  10.6.15.186 → 192.168.1.16 SSH 102 Server: Encrypted packet (len=36)
  156 0.924490366  10.6.15.186 → 192.168.1.16 SSH 454 Server: Encrypted packet (len=388)
  157 0.924503034 192.168.1.16 → 10.6.15.186  TCP 66 43250 → 22 [ACK] Seq=6061 Ack=23709 Win=6166 Len=0 TSval=19299648 TSecr=3608157
  158 0.934272821 192.168.1.16 → 10.6.15.186  SSH 102 Client: Encrypted packet (len=36)
  159 0.934622609 192.168.1.16 → 10.6.15.186  SSH 102 Client: Encrypted packet (len=36)
  160 0.935111420 192.168.1.16 → 10.6.15.186  SSH 118 Client: Encrypted packet (len=52)
  161 0.935304237 192.168.1.16 → 10.6.15.186  SSH 102 Client: Encrypted packet (len=36)
  162 0.936047777  10.6.15.186 → 192.168.1.16 TCP 66 22 → 43250 [ACK] Seq=23709 Ack=6133 Win=2127 Len=0 TSval=3608169 TSecr=19299650
  163 0.936912582  10.6.15.186 → 192.168.1.16 TCP 66 22 → 43250 [ACK] Seq=23709 Ack=6221 Win=2127 Len=0 TSval=3608170 TSecr=19299650
  164 0.940957143 192.168.1.16 → 10.6.15.186  SSH 102 Client: Encrypted packet (len=36)
  165 0.941236331 192.168.1.16 → 10.6.15.186  SSH 118 Client: Encrypted packet (len=52)
  166 0.941248751  10.6.15.186 → 192.168.1.16 SSH 102 Server: Encrypted packet (len=36)
  167 0.941389950  10.6.15.186 → 192.168.1.16 SSH 102 Server: Encrypted packet (len=36)
  168 0.941420496 192.168.1.16 → 10.6.15.186  TCP 66 43250 → 22 [ACK] Seq=6309 Ack=23781 Win=6166 Len=0 TSval=19299652 TSecr=3608171
  169 0.942305914 192.168.1.16 → 10.6.15.186  SSH 102 Client: Encrypted packet (len=36)
  170 0.942618729 192.168.1.16 → 10.6.15.186  SSH 110 Client: Encrypted packet (len=44)
  171 0.943181004  10.6.15.186 → 192.168.1.16 TCP 66 22 → 43250 [ACK] Seq=23781 Ack=6309 Win=2127 Len=0 TSval=3608171 TSecr=19299652
  172 0.943728756 192.168.1.16 → 10.6.15.186  SSH 102 Client: Encrypted packet (len=36)
  173 0.944540472 192.168.1.16 → 10.6.15.186  SSH 102 Client: Encrypted packet (len=36)
  174 0.944566582  10.6.15.186 → 192.168.1.16 TCP 66 22 → 43250 [ACK] Seq=23781 Ack=6389 Win=2127 Len=0 TSval=3608172 TSecr=19299652
  175 0.946353880  10.6.15.186 → 192.168.1.16 TCP 66 22 → 43250 [ACK] Seq=23781 Ack=6461 Win=2127 Len=0 TSval=3608172 TSecr=19299653
  176 0.947673929  10.6.15.186 → 192.168.1.16 SSH 102 Server: Encrypted packet (len=36)
  177 0.947693282  10.6.15.186 → 192.168.1.16 SSH 102 Server: Encrypted packet (len=36)
  178 0.947765049 192.168.1.16 → 10.6.15.186  TCP 66 43250 → 22 [ACK] Seq=6461 Ack=23853 Win=6166 Len=0 TSval=19299654 TSecr=3608172
  179 0.947852937  10.6.15.186 → 192.168.1.16 SSH 138 Server: Encrypted packet (len=72)
  180 0.948122042 192.168.1.16 → 10.6.15.186  SSH 102 Client: Encrypted packet (len=36)
  181 0.948529088  10.6.15.186 → 192.168.1.16 SSH 102 Server: Encrypted packet (len=36)
  182 0.948901030 192.168.1.16 → 10.6.15.186  SSH 390 Client: Encrypted packet (len=324)
  183 0.949361038 192.168.1.16 → 10.6.15.186  SSH 254 Client: Encrypted packet (len=188)
  184 0.949626624 192.168.1.16 → 10.6.15.186  SSH 110 Client: Encrypted packet (len=44)
  185 0.949694748  10.6.15.186 → 192.168.1.16 SSH 138 Server: Encrypted packet (len=72)
  186 0.950000613 192.168.1.16 → 10.6.15.186  SSH 102 Client: Encrypted packet (len=36)
  187 0.951951119  10.6.15.186 → 192.168.1.16 TCP 66 22 → 43250 [ACK] Seq=24033 Ack=6821 Win=2127 Len=0 TSval=3608173 TSecr=19299654
  188 0.951972022  10.6.15.186 → 192.168.1.16 TCP 66 22 → 43250 [ACK] Seq=24033 Ack=7053 Win=2127 Len=0 TSval=3608173 TSecr=19299654
  189 0.954429153 192.168.1.16 → 10.6.15.186  SSH 390 Client: Encrypted packet (len=324)
  190 0.955852696  10.6.15.186 → 192.168.1.16 SSH 246 Server: Encrypted packet (len=180)
  191 0.956409760 192.168.1.16 → 10.6.15.186  SSH 134 Client: Encrypted packet (len=68)
  192 0.957998874  10.6.15.186 → 192.168.1.16 TCP 66 22 → 43250 [ACK] Seq=24213 Ack=7481 Win=2127 Len=0 TSval=3608175 TSecr=19299655
  193 0.959027420 192.168.1.16 → 10.6.15.186  SSH 694 Client: Encrypted packet (len=628)
  194 0.999985432  10.6.15.186 → 192.168.1.16 TCP 66 22 → 43250 [ACK] Seq=24213 Ack=8109 Win=2127 Len=0 TSval=3608186 TSecr=19299656
  195 1.036710041 192.168.1.16 → 10.6.15.186  SSH 102 Client: Encrypted packet (len=36)
  196 1.036991970 192.168.1.16 → 10.6.15.186  SSH 102 Client: Encrypted packet (len=36)
  197 1.038324533  10.6.15.186 → 192.168.1.16 TCP 66 22 → 43250 [ACK] Seq=24213 Ack=8145 Win=2127 Len=0 TSval=3608195 TSecr=19299676
  198 1.038344008  10.6.15.186 → 192.168.1.16 TCP 66 22 → 43250 [ACK] Seq=24213 Ack=8181 Win=2127 Len=0 TSval=3608195 TSecr=19299676
  199 1.056525792  10.6.15.186 → 192.168.1.16 SSH 470 Server: Encrypted packet (len=404)
  200 1.056792530  10.6.15.186 → 192.168.1.16 SSH 110 Server: Encrypted packet (len=44)
  201 1.056818925 192.168.1.16 → 10.6.15.186  TCP 66 43250 → 22 [ACK] Seq=8181 Ack=24661 Win=6166 Len=0 TSval=19299681 TSecr=3608200
  202 1.068189214 192.168.1.16 → 139.59.50.38 NTP 90 NTP Version 4, client
  203 1.077539179  10.6.15.186 → 192.168.1.16 SSH 958 Server: Encrypted packet (len=892)
  204 1.085597136  10.6.15.186 → 192.168.1.16 SSH 766 Server: Encrypted packet (len=700)
  205 1.085615835 192.168.1.16 → 10.6.15.186  TCP 66 43250 → 22 [ACK] Seq=8181 Ack=26253 Win=6166 Len=0 TSval=19299688 TSecr=3608205
  206 1.086381600 192.168.1.16 → 10.6.15.186  SSH 134 Client: Encrypted packet (len=68)
  207 1.089931458 192.168.1.16 → 10.6.15.186  SSH 302 Client: Encrypted packet (len=236)
  208 1.091504986  10.6.15.186 → 192.168.1.16 TCP 66 22 → 43250 [ACK] Seq=26253 Ack=8485 Win=2127 Len=0 TSval=3608208 TSecr=19299688
  209 1.116225674  10.6.15.186 → 192.168.1.16 SSH 1514 Server: Encrypted packet (len=1448)
  210 1.116241945  10.6.15.186 → 192.168.1.16 SSH 134 Server: Encrypted packet (len=68)
  211 1.116253115 192.168.1.16 → 10.6.15.186  TCP 66 43250 → 22 [ACK] Seq=8485 Ack=27769 Win=6166 Len=0 TSval=19299696 TSecr=3608214
  212 1.116371036  10.6.15.186 → 192.168.1.16 SSH 142 Server: Encrypted packet (len=76)
  213 1.116937970  10.6.15.186 → 192.168.1.16 SSH 294 Server: Encrypted packet (len=228)
  214 1.116984173 192.168.1.16 → 10.6.15.186  TCP 66 43250 → 22 [ACK] Seq=8485 Ack=28073 Win=6166 Len=0 TSval=19299696 TSecr=3608215
  215 1.145675687  10.6.15.186 → 192.168.1.16 SSH 138 Server: Encrypted packet (len=72)
  216 1.145901430 192.168.1.16 → 10.6.15.186  SSH 102 Client: Encrypted packet (len=36)
  217 1.153801924  10.6.15.186 → 192.168.1.16 SSH 138 Server: Encrypted packet (len=72)
  218 1.154018946 192.168.1.16 → 10.6.15.186  SSH 102 Client: Encrypted packet (len=36)
  219 1.159675173  10.6.15.186 → 192.168.1.16 SSH 138 Server: Encrypted packet (len=72)
  220 1.159890203 192.168.1.16 → 10.6.15.186  SSH 102 Client: Encrypted packet (len=36)
  221 1.182084266 192.168.1.16 → 10.6.15.186  SSH 686 Client: Encrypted packet (len=620)
  222 1.184277593  10.6.15.186 → 192.168.1.16 TCP 66 22 → 43250 [ACK] Seq=28289 Ack=9213 Win=2127 Len=0 TSval=3608231 TSecr=19299707
  223 1.208665870 192.168.1.16 → 10.6.15.186  SSH 1514 Client: Encrypted packet (len=1448)
  224 1.209221003 192.168.1.16 → 10.6.15.186  SSH 782 Client: Encrypted packet (len=716)
  225 1.211160384  10.6.15.186 → 192.168.1.16 TCP 66 22 → 43250 [ACK] Seq=28289 Ack=11377 Win=2127 Len=0 TSval=3608238 TSecr=19299719
  226 1.257264129  10.6.15.186 → 192.168.1.16 SSH 102 Server: Encrypted packet (len=36)
  227 1.257670566 192.168.1.16 → 10.6.15.186  SSH 158 Client: Encrypted packet (len=92)
  228 1.258201271  10.6.15.186 → 192.168.1.16 SSH 138 Server: Encrypted packet (len=72)
  229 1.258437676 192.168.1.16 → 10.6.15.186  SSH 102 Client: Encrypted packet (len=36)
  230 1.260177307  10.6.15.186 → 192.168.1.16 TCP 66 22 → 43250 [ACK] Seq=28397 Ack=11505 Win=2127 Len=0 TSval=3608250 TSecr=19299731
  231 1.383692914 192.168.1.16 → 10.6.15.186  SSH 102 Client: Encrypted packet (len=36)
  232 1.384648020 192.168.1.16 → 10.6.15.186  SSH 110 Client: Encrypted packet (len=44)
  233 1.385790532  10.6.15.186 → 192.168.1.16 TCP 66 22 → 43250 [ACK] Seq=28397 Ack=11585 Win=2127 Len=0 TSval=3608282 TSecr=19299761
  234 1.387946276  10.6.15.186 → 192.168.1.16 SSH 138 Server: Encrypted packet (len=72)
  235 1.388168125 192.168.1.16 → 10.6.15.186  SSH 102 Client: Encrypted packet (len=36)
  236 1.408234018  10.6.15.186 → 192.168.1.16 SSH 430 Server: Encrypted packet (len=364)
  237 1.451652522 192.168.1.16 → 10.6.15.186  TCP 66 43250 → 22 [ACK] Seq=11621 Ack=28833 Win=6166 Len=0 TSval=19299780 TSecr=3608287
  238 1.500985393  10.6.15.186 → 192.168.1.16 SSH 102 Server: Encrypted packet (len=36)
  239 1.501070329 192.168.1.16 → 10.6.15.186  TCP 66 43250 → 22 [ACK] Seq=11621 Ack=28869 Win=6166 Len=0 TSval=19299792 TSecr=3608311
  240 1.501366829 192.168.1.16 → 10.6.15.186  SSH 198 Client: Encrypted packet (len=132)
  241 1.540402131  10.6.15.186 → 192.168.1.16 TCP 66 22 → 43250 [ACK] Seq=28869 Ack=11753 Win=2127 Len=0 TSval=3608321 TSecr=19299792
  242 1.597770563  10.6.15.186 → 192.168.1.16 SSH 1486 Server: Encrypted packet (len=1420)
  243 1.604546794 192.168.1.16 → 10.6.15.186  SSH 494 Client: Encrypted packet (len=428)
  244 1.606877264  10.6.15.186 → 192.168.1.16 TCP 66 22 → 43250 [ACK] Seq=30289 Ack=12181 Win=2127 Len=0 TSval=3608337 TSecr=19299818
  245 1.618804787  10.6.15.186 → 192.168.1.16 SSH 270 Server: Encrypted packet (len=204)
  246 1.634789141 192.168.1.16 → 10.6.15.186  SSH 102 Client: Encrypted packet (len=36)
  247 1.635043297 192.168.1.16 → 10.6.15.186  SSH 102 Client: Encrypted packet (len=36)
  248 1.636306099  10.6.15.186 → 192.168.1.16 TCP 66 22 → 43250 [ACK] Seq=30493 Ack=12253 Win=2127 Len=0 TSval=3608345 TSecr=19299825
  249 1.640613862 192.168.1.16 → 10.6.15.186  SSH 102 Client: Encrypted packet (len=36)
  250 1.640947047 192.168.1.16 → 10.6.15.186  SSH 102 Client: Encrypted packet (len=36)
  251 1.642199890  10.6.15.186 → 192.168.1.16 TCP 66 22 → 43250 [ACK] Seq=30493 Ack=12325 Win=2127 Len=0 TSval=3608346 TSecr=19299827
  252 1.644153485  10.6.15.186 → 192.168.1.16 SSH 138 Server: Encrypted packet (len=72)
  253 1.644437425 192.168.1.16 → 10.6.15.186  SSH 102 Client: Encrypted packet (len=36)
  254 1.680102427 192.168.1.16 → 10.6.15.186  SSH 102 Client: Encrypted packet (len=36)
  255 1.680350723 192.168.1.16 → 10.6.15.186  SSH 102 Client: Encrypted packet (len=36)
  256 1.683346182  10.6.15.186 → 192.168.1.16 TCP 66 22 → 43250 [ACK] Seq=30565 Ack=12397 Win=2127 Len=0 TSval=3608356 TSecr=19299828
  257 1.688738246  10.6.15.186 → 192.168.1.16 SSH 138 Server: Encrypted packet (len=72)
  258 1.688957676 192.168.1.16 → 10.6.15.186  SSH 102 Client: Encrypted packet (len=36)
  259 1.700139101  10.6.15.186 → 192.168.1.16 SSH 1514 Server: Encrypted packet (len=1448)
  260 1.700324823  10.6.15.186 → 192.168.1.16 SSH 1514 Server: Encrypted packet (len=1448)
  261 1.700336539 192.168.1.16 → 10.6.15.186  TCP 66 43250 → 22 [ACK] Seq=12469 Ack=33533 Win=6166 Len=0 TSval=19299842 TSecr=3608360
  262 1.700523280  10.6.15.186 → 192.168.1.16 SSH 566 Server: Encrypted packet (len=500)
  263 1.701523463 192.168.1.16 → 10.6.15.186  SSH 214 Client: Encrypted packet (len=148)
  264 1.740016881  10.6.15.186 → 192.168.1.16 TCP 66 22 → 43250 [ACK] Seq=34033 Ack=12617 Win=2127 Len=0 TSval=3608371 TSecr=19299842
  265 1.750874662  10.6.15.186 → 192.168.1.16 SSH 138 Server: Encrypted packet (len=72)
  266 1.751156363 192.168.1.16 → 10.6.15.186  SSH 102 Client: Encrypted packet (len=36)
  267 1.752495816  10.6.15.186 → 192.168.1.16 TCP 66 22 → 43250 [ACK] Seq=34105 Ack=12653 Win=2127 Len=0 TSval=3608374 TSecr=19299854
  268 1.756064127  10.6.15.186 → 192.168.1.16 SSH 102 Server: Encrypted packet (len=36)
  269 1.756345342 192.168.1.16 → 10.6.15.186  SSH 166 Client: Encrypted packet (len=100)
  270 1.795922226  10.6.15.186 → 192.168.1.16 TCP 66 22 → 43250 [ACK] Seq=34141 Ack=12753 Win=2127 Len=0 TSval=3608385 TSecr=19299856
  271 1.862375907  10.6.15.186 → 192.168.1.16 SSH 102 Server: Encrypted packet (len=36)
  272 1.862839437 192.168.1.16 → 10.6.15.186  SSH 1110 Client: Encrypted packet (len=1044)
  273 1.866671024  10.6.15.186 → 192.168.1.16 TCP 66 22 → 43250 [ACK] Seq=34177 Ack=13797 Win=2127 Len=0 TSval=3608402 TSecr=19299882
  274 1.877877333  10.6.15.186 → 192.168.1.16 SSH 334 Server: Encrypted packet (len=268)
  275 1.904698988  10.6.15.186 → 192.168.1.16 SSH 102 Server: Encrypted packet (len=36)
  276 1.904774661 192.168.1.16 → 10.6.15.186  TCP 66 43250 → 22 [ACK] Seq=13797 Ack=34481 Win=6166 Len=0 TSval=19299893 TSecr=3608405
  277 1.905223709 192.168.1.16 → 10.6.15.186  SSH 414 Client: Encrypted packet (len=348)
  278 1.923472963  10.6.15.186 → 192.168.1.16 SSH 150 Server: Encrypted packet (len=84)
  279 1.924049474 192.168.1.16 → 10.6.15.186  SSH 566 Client: Encrypted packet (len=500)
  280 1.963893259  10.6.15.186 → 192.168.1.16 TCP 66 22 → 43250 [ACK] Seq=34565 Ack=14645 Win=2127 Len=0 TSval=3608427 TSecr=19299898
  281 1.989131501  10.6.15.186 → 192.168.1.16 SSH 1514 Server: Encrypted packet (len=1448)
  282 1.989290804  10.6.15.186 → 192.168.1.16 SSH 1514 Server: Encrypted packet (len=1448)
  283 1.989300915 192.168.1.16 → 10.6.15.186  TCP 66 43250 → 22 [ACK] Seq=14645 Ack=37461 Win=6166 Len=0 TSval=19299914 TSecr=3608433
  284 1.989473483  10.6.15.186 → 192.168.1.16 SSH 1514 Server: Encrypted packet (len=1448)
  285 1.989607181  10.6.15.186 → 192.168.1.16 SSH 110 Server: Encrypted packet (len=44)
  286 1.989613738 192.168.1.16 → 10.6.15.186  TCP 66 43250 → 22 [ACK] Seq=14645 Ack=38953 Win=6166 Len=0 TSval=19299914 TSecr=3608433
  287 1.989805837  10.6.15.186 → 192.168.1.16 SSH 1514 Server: Encrypted packet (len=1448)
  288 1.991729826  10.6.15.186 → 192.168.1.16 SSH 1514 Server: Encrypted packet (len=1448)
  289 1.991736467 192.168.1.16 → 10.6.15.186  TCP 66 43250 → 22 [ACK] Seq=14645 Ack=41849 Win=6166 Len=0 TSval=19299915 TSecr=3608433
  290 1.991920769  10.6.15.186 → 192.168.1.16 SSH 1514 Server: Encrypted packet (len=1448)
  291 1.992258790  10.6.15.186 → 192.168.1.16 SSH 1402 Server: Encrypted packet (len=1336)
  292 1.992264512 192.168.1.16 → 10.6.15.186  TCP 66 43250 → 22 [ACK] Seq=14645 Ack=44633 Win=6166 Len=0 TSval=19299915 TSecr=3608433
  293 2.068158187 192.168.1.16 → 139.59.21.22 NTP 90 NTP Version 4, client
  294 2.092929727  10.6.15.186 → 192.168.1.16 SSH 374 Server: Encrypted packet (len=308)
  295 2.127551731 ZioncomE_53:dd:d4 → Broadcast    ARP 42 Who has 192.168.1.11? Tell 192.168.1.1
  296 2.135668377 192.168.1.16 → 10.6.15.186  TCP 66 43250 → 22 [ACK] Seq=14645 Ack=44941 Win=6166 Len=0 TSval=19299951 TSecr=3608459
  297 2.155472707  10.6.15.186 → 192.168.1.16 SSH 630 Server: Encrypted packet (len=564)
  298 2.155534950 192.168.1.16 → 10.6.15.186  TCP 66 43250 → 22 [ACK] Seq=14645 Ack=45505 Win=6166 Len=0 TSval=19299955 TSecr=3608473
  299 2.192762883 192.168.1.16 → 10.6.15.186  SSH 958 Client: Encrypted packet (len=892)
  300 2.197587337  10.6.15.186 → 192.168.1.16 TCP 66 22 → 43250 [ACK] Seq=45505 Ack=15537 Win=2127 Len=0 TSval=3608484 TSecr=19299965
  301 2.212745535 192.168.1.16 → 10.6.15.186  SSH 102 Client: Encrypted packet (len=36)
  302 2.213161903 192.168.1.16 → 10.6.15.186  SSH 110 Client: Encrypted packet (len=44)
  303 2.222422163  10.6.15.186 → 192.168.1.16 TCP 66 22 → 43250 [ACK] Seq=45505 Ack=15573 Win=2127 Len=0 TSval=3608489 TSecr=19299970
  304 2.222853028  10.6.15.186 → 192.168.1.16 TCP 66 22 → 43250 [ACK] Seq=45505 Ack=15617 Win=2127 Len=0 TSval=3608489 TSecr=19299970
  305 2.321165981  10.6.15.186 → 192.168.1.16 SSH 1302 Server: Encrypted packet (len=1236)
  306 2.321182785  10.6.15.186 → 192.168.1.16 SSH 214 Server: Encrypted packet (len=148)
  307 2.321241809 192.168.1.16 → 10.6.15.186  TCP 66 43250 → 22 [ACK] Seq=15617 Ack=46889 Win=6166 Len=0 TSval=19299997 TSecr=3608514
  308 2.334988909  10.6.15.186 → 192.168.1.16 SSH 138 Server: Encrypted packet (len=72)
  309 2.335069168 192.168.1.16 → 10.6.15.186  TCP 66 43250 → 22 [ACK] Seq=15617 Ack=46961 Win=6166 Len=0 TSval=19300000 TSecr=3608517
  310 2.335301192 192.168.1.16 → 10.6.15.186  SSH 102 Client: Encrypted packet (len=36)
  311 2.343962678  10.6.15.186 → 192.168.1.16 TCP 66 22 → 43250 [ACK] Seq=46961 Ack=15653 Win=2127 Len=0 TSval=3608520 TSecr=19300000
  312 2.416743931  10.6.15.186 → 192.168.1.16 SSH 374 Server: Encrypted packet (len=308)
  313 2.434432389  10.6.15.186 → 192.168.1.16 SSH 110 Server: Encrypted packet (len=44)
  314 2.434492034 192.168.1.16 → 10.6.15.186  TCP 66 43250 → 22 [ACK] Seq=15653 Ack=47313 Win=6166 Len=0 TSval=19300025 TSecr=3608539
  315 2.434779806 192.168.1.16 → 10.6.15.186  SSH 198 Client: Encrypted packet (len=132)
  316 2.438580014  10.6.15.186 → 192.168.1.16 TCP 66 22 → 43250 [ACK] Seq=47313 Ack=15785 Win=2127 Len=0 TSval=3608545 TSecr=19300025
  317 2.532710490  10.6.15.186 → 192.168.1.16 SSH 614 Server: Encrypted packet (len=548)
  318 2.540481672 192.168.1.16 → 10.6.15.186  SSH 214 Client: Encrypted packet (len=148)
  319 2.543227535  10.6.15.186 → 192.168.1.16 TCP 66 22 → 43250 [ACK] Seq=47861 Ack=15933 Win=2127 Len=0 TSval=3608571 TSecr=19300052
  320 2.545819400 192.168.1.16 → 10.6.15.186  SSH 222 Client: Encrypted packet (len=156)
  321 2.547953184  10.6.15.186 → 192.168.1.16 TCP 66 22 → 43250 [ACK] Seq=47861 Ack=16089 Win=2127 Len=0 TSval=3608573 TSecr=19300053
  322 2.584211303  10.6.15.186 → 192.168.1.16 SSH 142 Server: Encrypted packet (len=76)
  323 2.590452149 192.168.1.16 → 10.6.15.186  SSH 518 Client: Encrypted packet (len=452)
  324 2.617871134  10.6.15.186 → 192.168.1.16 SSH 134 Server: Encrypted packet (len=68)
  325 2.618374839  10.6.15.186 → 192.168.1.16 SSH 278 Server: Encrypted packet (len=212)
  326 2.618398025 192.168.1.16 → 10.6.15.186  TCP 66 43250 → 22 [ACK] Seq=16541 Ack=48217 Win=6166 Len=0 TSval=19300071 TSecr=3608590
  327 2.654283579  10.6.15.186 → 192.168.1.16 SSH 222 Server: Encrypted packet (len=156)
  328 2.654578776 192.168.1.16 → 10.6.15.186  SSH 134 Client: Encrypted packet (len=68)
  329 2.654967915 192.168.1.16 → 10.6.15.186  SSH 1514 Client: Encrypted packet (len=1448)
  330 2.655356280 192.168.1.16 → 10.6.15.186  SSH 158 Client: Encrypted packet (len=92)
  331 2.656920311  10.6.15.186 → 192.168.1.16 TCP 66 22 → 43250 [ACK] Seq=48373 Ack=18149 Win=2127 Len=0 TSval=3608600 TSecr=19300080
  332 2.667114127  10.6.15.186 → 192.168.1.16 SSH 246 Server: Encrypted packet (len=180)
  333 2.707689883 192.168.1.16 → 10.6.15.186  TCP 66 43250 → 22 [ACK] Seq=18149 Ack=48553 Win=6166 Len=0 TSval=19300094 TSecr=3608602
  334 4.159472905  10.6.15.186 → 192.168.1.16 SSH 430 Server: Encrypted packet (len=364)
  335 4.159520085 192.168.1.16 → 10.6.15.186  TCP 66 43250 → 22 [ACK] Seq=18149 Ack=48917 Win=6166 Len=0 TSval=19300456 TSecr=3608655
  336 4.159552324  10.6.15.186 → 192.168.1.16 SSH 182 Server: Encrypted packet (len=116)
  337 4.159564726 192.168.1.16 → 10.6.15.186  TCP 66 43250 → 22 [ACK] Seq=18149 Ack=49033 Win=6166 Len=0 TSval=19300456 TSecr=3608674
  338 4.159577440  10.6.15.186 → 192.168.1.16 SSH 134 Server: Encrypted packet (len=68)
  339 4.159582434 192.168.1.16 → 10.6.15.186  TCP 66 43250 → 22 [ACK] Seq=18149 Ack=49101 Win=6166 Len=0 TSval=19300456 TSecr=3608674
  340 4.159596248  10.6.15.186 → 192.168.1.16 SSH 118 Server: Encrypted packet (len=52)
  341 4.159601042 192.168.1.16 → 10.6.15.186  TCP 66 43250 → 22 [ACK] Seq=18149 Ack=49153 Win=6166 Len=0 TSval=19300456 TSecr=3608674
  342 4.159612673  10.6.15.186 → 192.168.1.16 SSH 118 Server: [TCP Spurious Retransmission] , Encrypted packet (len=52)
  343 4.159619070 192.168.1.16 → 10.6.15.186  TCP 78 [TCP Dup ACK 341#1] 43250 → 22 [ACK] Seq=18149 Ack=49153 Win=6166 Len=0 TSval=19300456 TSecr=3608682 SLE=49101 SRE=49153
  344 4.159812158  10.6.15.186 → 192.168.1.16 SSH 666 Server: [TCP Spurious Retransmission] , Encrypted packet (len=600)
  345 4.159820747  10.6.15.186 → 192.168.1.16 SSH 666 Server: [TCP Spurious Retransmission] , Encrypted packet (len=600)
  346 4.159844803 192.168.1.16 → 10.6.15.186  TCP 78 [TCP Dup ACK 341#2] 43250 → 22 [ACK] Seq=18149 Ack=49153 Win=6166 Len=0 TSval=19300457 TSecr=3608736 SLE=48553 SRE=49153
  347 4.159857833 192.168.1.16 → 10.6.15.186  TCP 78 [TCP Dup ACK 341#3] 43250 → 22 [ACK] Seq=18149 Ack=49153 Win=6166 Len=0 TSval=19300457 TSecr=3608844 SLE=48553 SRE=49153
  348 4.177730241 192.168.1.16 → 10.6.15.186  SSH 182 Client: Encrypted packet (len=116)
  349 4.201821629  192.168.1.1 → 255.255.255.255 DHCP 322 DHCP Offer    - Transaction ID 0x8173cc7b
  350 4.216343872  10.6.15.186 → 192.168.1.16 TCP 66 22 → 43250 [ACK] Seq=49153 Ack=18265 Win=2127 Len=0 TSval=3608990 TSecr=19300461
  351 4.299202816  10.6.15.186 → 192.168.1.16 SSH 238 Server: Encrypted packet (len=172)
  352 4.339655755 192.168.1.16 → 10.6.15.186  TCP 66 43250 → 22 [ACK] Seq=18265 Ack=49325 Win=6166 Len=0 TSval=19300502 TSecr=3609010
  353 4.463677325 192.168.1.16 → 10.6.15.186  SSH 1514 Client: Encrypted packet (len=1448)
  354 4.464436820 192.168.1.16 → 10.6.15.186  SSH 1514 Client: Encrypted packet (len=1448)
  355 4.465118893 192.168.1.16 → 10.6.15.186  SSH 1514 Client: Encrypted packet (len=1448)
  356 4.465127306 192.168.1.16 → 10.6.15.186  SSH 1514 Client: Encrypted packet (len=1448)
  357 4.466030536 192.168.1.16 → 10.6.15.186  SSH 1514 Client: Encrypted packet (len=1448)
  358 4.472017800  10.6.15.186 → 192.168.1.16 TCP 66 22 → 43250 [ACK] Seq=49325 Ack=21161 Win=2127 Len=0 TSval=3609052 TSecr=19300532
  359 4.472038999 192.168.1.16 → 10.6.15.186  SSH 1514 Client: Encrypted packet (len=1448)
  360 4.472050790 192.168.1.16 → 10.6.15.186  SSH 1514 Client: Encrypted packet (len=1448)
  361 4.472876093  10.6.15.186 → 192.168.1.16 TCP 66 22 → 43250 [ACK] Seq=49325 Ack=24057 Win=2127 Len=0 TSval=3609052 TSecr=19300533
  362 4.472897480 192.168.1.16 → 10.6.15.186  SSH 534 Client: Encrypted packet (len=468)
  363 4.473656872  10.6.15.186 → 192.168.1.16 TCP 66 22 → 43250 [ACK] Seq=49325 Ack=25505 Win=2127 Len=0 TSval=3609053 TSecr=19300533
  364 4.479853148  10.6.15.186 → 192.168.1.16 TCP 66 22 → 43250 [ACK] Seq=49325 Ack=28401 Win=2127 Len=0 TSval=3609054 TSecr=19300535
  365 4.479869790  10.6.15.186 → 192.168.1.16 TCP 66 22 → 43250 [ACK] Seq=49325 Ack=28869 Win=2127 Len=0 TSval=3609054 TSecr=19300535
  366 6.141601338  10.6.15.186 → 192.168.1.16 SSH 102 Server: Encrypted packet (len=36)
  367 6.141626638 192.168.1.16 → 10.6.15.186  TCP 66 43250 → 22 [ACK] Seq=28869 Ack=49361 Win=6166 Len=0 TSval=19300952 TSecr=3609109
  368 6.141642139  10.6.15.186 → 192.168.1.16 SSH 382 Server: Encrypted packet (len=316)
  369 6.141647744 192.168.1.16 → 10.6.15.186  TCP 66 43250 → 22 [ACK] Seq=28869 Ack=49677 Win=6166 Len=0 TSval=19300952 TSecr=3609109
  370 6.141653641  10.6.15.186 → 192.168.1.16 SSH 138 Server: Encrypted packet (len=72)
  371 6.141656252 192.168.1.16 → 10.6.15.186  TCP 66 43250 → 22 [ACK] Seq=28869 Ack=49749 Win=6166 Len=0 TSval=19300952 TSecr=3609183
  372 6.141893975 192.168.1.16 → 10.6.15.186  SSH 102 Client: Encrypted packet (len=36)
  373 6.142432251 192.168.1.16 → 10.6.15.186  SSH 190 Client: Encrypted packet (len=124)
  374 6.144428763 192.168.1.16 → 10.6.15.186  SSH 1514 Client: Encrypted packet (len=1448)
  375 6.144444179 192.168.1.16 → 10.6.15.186  SSH 1514 Client: Encrypted packet (len=1448)
  376 6.144842301 192.168.1.16 → 10.6.15.186  SSH 1514 Client: Encrypted packet (len=1448)
  377 6.146362224  10.6.15.186 → 192.168.1.16 TCP 66 22 → 43250 [ACK] Seq=49749 Ack=28905 Win=2127 Len=0 TSval=3609471 TSecr=19300952
  378 6.146384505 192.168.1.16 → 10.6.15.186  SSH 1514 Client: Encrypted packet (len=1448)
  379 6.146396021 192.168.1.16 → 10.6.15.186  SSH 1514 Client: Encrypted packet (len=1448)
  380 6.146468726  10.6.15.186 → 192.168.1.16 TCP 66 22 → 43250 [ACK] Seq=49749 Ack=29029 Win=2127 Len=0 TSval=3609472 TSecr=19300952
  381 6.146891177 192.168.1.16 → 10.6.15.186  SSH 1514 Client: Encrypted packet (len=1448)
  382 6.149249570  10.6.15.186 → 192.168.1.16 TCP 66 22 → 43250 [ACK] Seq=49749 Ack=30477 Win=2127 Len=0 TSval=3609472 TSecr=19300953
  383 6.149270613 192.168.1.16 → 10.6.15.186  SSH 430 Client: Encrypted packet (len=364)
  384 6.149285933  10.6.15.186 → 192.168.1.16 TCP 66 22 → 43250 [ACK] Seq=49749 Ack=31925 Win=2127 Len=0 TSval=3609472 TSecr=19300953
  385 6.150270431  10.6.15.186 → 192.168.1.16 TCP 66 22 → 43250 [ACK] Seq=49749 Ack=33373 Win=2127 Len=0 TSval=3609472 TSecr=19300953
  386 6.151765613  10.6.15.186 → 192.168.1.16 TCP 66 22 → 43250 [ACK] Seq=49749 Ack=34821 Win=2127 Len=0 TSval=3609473 TSecr=19300953
  387 6.154259812  10.6.15.186 → 192.168.1.16 TCP 66 22 → 43250 [ACK] Seq=49749 Ack=37717 Win=2127 Len=0 TSval=3609473 TSecr=19300953
  388 6.154280575  10.6.15.186 → 192.168.1.16 TCP 66 22 → 43250 [ACK] Seq=49749 Ack=38081 Win=2127 Len=0 TSval=3609473 TSecr=19300954
  389 7.134095633  10.6.15.186 → 192.168.1.16 SSH 182 Server: Encrypted packet (len=116)
  390 7.134117947  10.6.15.186 → 192.168.1.16 SSH 374 Server: Encrypted packet (len=308)
  391 7.134180156 192.168.1.16 → 10.6.15.186  TCP 66 43250 → 22 [ACK] Seq=38081 Ack=50173 Win=6166 Len=0 TSval=19301200 TSecr=3609526
  392 7.134436373 192.168.1.16 → 10.6.15.186  SSH 134 Client: Encrypted packet (len=68)
  393 7.143653117  10.6.15.186 → 192.168.1.16 TCP 66 22 → 43250 [ACK] Seq=50173 Ack=38149 Win=2127 Len=0 TSval=3609720 TSecr=19301200
  394 7.168791563 192.168.1.16 → 10.6.15.186  SSH 1126 Client: Encrypted packet (len=1060)
  395 7.174009321  10.6.15.186 → 192.168.1.16 TCP 66 22 → 43250 [ACK] Seq=50173 Ack=39209 Win=2127 Len=0 TSval=3609728 TSecr=19301209
  396 8.157688021  10.6.15.186 → 192.168.1.16 SSH 430 Server: Encrypted packet (len=364)
  397 8.199691125 192.168.1.16 → 10.6.15.186  TCP 66 43250 → 22 [ACK] Seq=39209 Ack=50537 Win=6166 Len=0 TSval=19301467 TSecr=3609783
  398 10.408090266 192.168.1.16 → 10.6.15.186  SSH 1514 Client: Encrypted packet (len=1448)
  399 10.409329382 192.168.1.16 → 10.6.15.186  SSH 310 Client: Encrypted packet (len=244)
  400 10.412502748  10.6.15.186 → 192.168.1.16 TCP 66 22 → 43250 [ACK] Seq=50537 Ack=40901 Win=2127 Len=0 TSval=3610538 TSecr=19302019
  401 10.425939508  10.6.15.186 → 192.168.1.16 SSH 142 Server: Encrypted packet (len=76)
  402 10.425956205 192.168.1.16 → 10.6.15.186  TCP 66 43250 → 22 [ACK] Seq=40901 Ack=50613 Win=6166 Len=0 TSval=19302023 TSecr=3610542
  403 12.162483518  10.6.15.186 → 192.168.1.16 SSH 1278 Server: Encrypted packet (len=1212)
  404 12.162521122 192.168.1.16 → 10.6.15.186  TCP 66 43250 → 22 [ACK] Seq=40901 Ack=51825 Win=6166 Len=0 TSval=19302457 TSecr=3610568
  405 12.162567498  10.6.15.186 → 192.168.1.16 SSH 1278 Server: [TCP Spurious Retransmission] , Encrypted packet (len=1212)
  406 12.162576118 192.168.1.16 → 10.6.15.186  TCP 78 [TCP Dup ACK 404#1] 43250 → 22 [ACK] Seq=40901 Ack=51825 Win=6166 Len=0 TSval=19302457 TSecr=3610833 SLE=50613 SRE=51825
  407 12.164423887 192.168.1.16 → 10.6.15.186  SSH 142 Client: Encrypted packet (len=76)
  408 12.226672336  10.6.15.186 → 192.168.1.16 TCP 66 22 → 43250 [ACK] Seq=51825 Ack=40977 Win=2127 Len=0 TSval=3610991 TSecr=19302458
  409 13.165602673 192.168.1.16 → 10.6.15.186  SSH 102 Client: Encrypted packet (len=36)
  410 13.165783078 192.168.1.16 → 10.6.15.186  SSH 174 Client: Encrypted packet (len=108)
  411 13.166103043 192.168.1.16 → 10.6.15.186  SSH 282 Client: Encrypted packet (len=216)
  412 13.166449857 192.168.1.16 → 10.6.15.186  SSH 102 Client: Encrypted packet (len=36)
  413 13.168995779 192.168.1.16 → 10.6.15.186  SSH 1126 Client: Encrypted packet (len=1060)
  414 13.171726740  10.6.15.186 → 192.168.1.16 TCP 66 22 → 43250 [ACK] Seq=51825 Ack=41013 Win=2127 Len=0 TSval=3611228 TSecr=19302708
  415 13.171748478  10.6.15.186 → 192.168.1.16 TCP 66 22 → 43250 [ACK] Seq=51825 Ack=41121 Win=2127 Len=0 TSval=3611228 TSecr=19302708
  416 13.173171103  10.6.15.186 → 192.168.1.16 TCP 66 22 → 43250 [ACK] Seq=51825 Ack=41337 Win=2127 Len=0 TSval=3611228 TSecr=19302708
  417 13.175378588  10.6.15.186 → 192.168.1.16 TCP 66 22 → 43250 [ACK] Seq=51825 Ack=41373 Win=2127 Len=0 TSval=3611229 TSecr=19302708
  418 13.175944172  10.6.15.186 → 192.168.1.16 SSH 210 Server: Encrypted packet (len=144)
  419 13.176217199 192.168.1.16 → 10.6.15.186  SSH 138 Client: Encrypted packet (len=72)
  420 13.177403481  10.6.15.186 → 192.168.1.16 SSH 138 Server: Encrypted packet (len=72)
  421 13.177609752 192.168.1.16 → 10.6.15.186  SSH 102 Client: Encrypted packet (len=36)
  422 13.180411341  10.6.15.186 → 192.168.1.16 SSH 138 Server: Encrypted packet (len=72)
  423 13.180614322 192.168.1.16 → 10.6.15.186  SSH 102 Client: Encrypted packet (len=36)
  424 13.185501120  10.6.15.186 → 192.168.1.16 TCP 66 22 → 43250 [ACK] Seq=52113 Ack=42541 Win=2127 Len=0 TSval=3611231 TSecr=19302711
  425 13.223992342  10.6.15.186 → 192.168.1.16 TCP 66 22 → 43250 [ACK] Seq=52113 Ack=42577 Win=2127 Len=0 TSval=3611242 TSecr=19302712
  426 13.313376321  10.6.15.186 → 192.168.1.16 SSH 134 Server: Encrypted packet (len=68)
  427 13.313420958  10.6.15.186 → 192.168.1.16 SSH 138 Server: Encrypted packet (len=72)
  428 13.313537081 192.168.1.16 → 10.6.15.186  TCP 66 43250 → 22 [ACK] Seq=42577 Ack=52253 Win=6166 Len=0 TSval=19302745 TSecr=3611264
  429 13.314003670 192.168.1.16 → 10.6.15.186  SSH 102 Client: Encrypted packet (len=36)
  430 13.315214557  10.6.15.186 → 192.168.1.16 SSH 126 Server: Encrypted packet (len=60)
  431 13.315254570  10.6.15.186 → 192.168.1.16 SSH 138 Server: Encrypted packet (len=72)
  432 13.315370897 192.168.1.16 → 10.6.15.186  TCP 66 43250 → 22 [ACK] Seq=42613 Ack=52385 Win=6166 Len=0 TSval=19302745 TSecr=3611264
  433 13.315870710 192.168.1.16 → 10.6.15.186  SSH 102 Client: Encrypted packet (len=36)
  434 13.325225627  10.6.15.186 → 192.168.1.16 TCP 66 22 → 43250 [ACK] Seq=52385 Ack=42613 Win=2127 Len=0 TSval=3611267 TSecr=19302745
  435 13.390865339  10.6.15.186 → 192.168.1.16 SSH 126 Server: Encrypted packet (len=60)
  436 13.390936741  10.6.15.186 → 192.168.1.16 SSH 138 Server: Encrypted packet (len=72)
  437 13.390976922 192.168.1.16 → 10.6.15.186  TCP 66 43250 → 22 [ACK] Seq=42649 Ack=52517 Win=6166 Len=0 TSval=19302764 TSecr=3611283
  438 13.391198037 192.168.1.16 → 10.6.15.186  SSH 102 Client: Encrypted packet (len=36)
  439 13.392911778  10.6.15.186 → 192.168.1.16 TCP 78 [TCP Dup ACK 434#1] 22 → 43250 [ACK] Seq=52517 Ack=42613 Win=2127 Len=0 TSval=3611284 TSecr=19302745 SLE=42649 SRE=42685
  440 13.392936766  10.6.15.186 → 192.168.1.16 SSH 198 Server: Encrypted packet (len=120)
  441 13.392951887  10.6.15.186 → 192.168.1.16 SSH 222 Server: Encrypted packet (len=144)
  442 13.393027715 192.168.1.16 → 10.6.15.186  TCP 66 43250 → 22 [ACK] Seq=42685 Ack=52781 Win=6166 Len=0 TSval=19302765 TSecr=3611284
  443 13.393124028  10.6.15.186 → 192.168.1.16 SSH 442 Server: Encrypted packet (len=364)
  444 13.393352614 192.168.1.16 → 10.6.15.186  SSH 138 Client: Encrypted packet (len=72)
  445 13.393559089  10.6.15.186 → 192.168.1.16 SSH 146 Server: Encrypted packet (len=68)
  446 13.395034323  10.6.15.186 → 192.168.1.16 SSH 282 Server: Encrypted packet (len=204)
  447 13.395060191  10.6.15.186 → 192.168.1.16 TCP 78 [TCP Dup ACK 434#2] 22 → 43250 [ACK] Seq=53417 Ack=42613 Win=2127 Len=0 TSval=3611284 TSecr=19302745 SLE=42649 SRE=42757
  448 13.395126909 192.168.1.16 → 10.6.15.186  TCP 66 43250 → 22 [ACK] Seq=42757 Ack=53417 Win=6166 Len=0 TSval=19302765 TSecr=3611284
  449 13.395425598 192.168.1.16 → 10.6.15.186  SSH 102 Client: Encrypted packet (len=36)
  450 13.395734951 192.168.1.16 → 10.6.15.186  SSH 102 Client: Encrypted packet (len=36)
  451 13.396698228  10.6.15.186 → 192.168.1.16 TCP 78 [TCP Dup ACK 434#3] 22 → 43250 [ACK] Seq=53417 Ack=42613 Win=2127 Len=0 TSval=3611285 TSecr=19302745 SLE=42649 SRE=42793
  452 13.396723889 192.168.1.16 → 10.6.15.186  SSH 102 Client: [TCP Fast Retransmission] , Encrypted packet (len=36)
  453 13.396746409  10.6.15.186 → 192.168.1.16 TCP 78 [TCP Dup ACK 434#4] 22 → 43250 [ACK] Seq=53417 Ack=42613 Win=2127 Len=0 TSval=3611285 TSecr=19302745 SLE=42649 SRE=42829
  454 13.398103715  10.6.15.186 → 192.168.1.16 TCP 66 22 → 43250 [ACK] Seq=53417 Ack=42829 Win=2127 Len=0 TSval=3611285 TSecr=19302766
  455 15.068302965 192.168.1.16 → 139.59.21.22 NTP 90 NTP Version 4, client
  456 16.157718228  10.6.15.186 → 192.168.1.16 SSH 102 Server: Encrypted packet (len=36)
  457 16.199712208 192.168.1.16 → 10.6.15.186  TCP 66 43250 → 22 [ACK] Seq=42829 Ack=53453 Win=6166 Len=0 TSval=19303467 TSecr=3611865
  458 16.227747378 ZioncomE_53:dd:d4 → Broadcast    ARP 42 Who has 192.168.1.11? Tell 192.168.1.1
  459 17.149666055  192.168.1.1 → 224.0.0.1    IGMPv2 42 Membership Query, general
  460 18.224927769  192.168.1.1 → 255.255.255.255 DHCP 322 DHCP Offer    - Transaction ID 0x8173cc7b
  461 19.611690934 192.168.1.16 → 224.0.0.251  IGMPv2 46 Membership Report group 224.0.0.251
  462 26.523707100 192.168.1.16 → 224.0.0.252  IGMPv2 46 Membership Report group 224.0.0.252
  463 28.768225350 192.168.1.16 → 224.0.0.251  MDNS 200 Standard query 0x0000 PTR _ipps._tcp.local, "QM" question PTR _nmea-0183._tcp.local, "QM" question PTR _ftp._tcp.local, "QM" question PTR _webdav._tcp.local, "QM" question PTR _webdavs._tcp.local, "QM" question PTR _sftp-ssh._tcp.local, "QM" question PTR _smb._tcp.local, "QM" question PTR _afpovertcp._tcp.local, "QM" question PTR _nfs._tcp.local, "QM" question PTR _ipp._tcp.local, "QM" question
  464 30.119321622 fe80::820e:b87b:de2a:4286 → ff02::fb     MDNS 220 Standard query 0x0000 PTR _ipps._tcp.local, "QM" question PTR _nmea-0183._tcp.local, "QM" question PTR _ftp._tcp.local, "QM" question PTR _webdav._tcp.local, "QM" question PTR _webdavs._tcp.local, "QM" question PTR _sftp-ssh._tcp.local, "QM" question PTR _smb._tcp.local, "QM" question PTR _afpovertcp._tcp.local, "QM" question PTR _nfs._tcp.local, "QM" question PTR _ipp._tcp.local, "QM" question
  465 32.411695652 192.168.1.16 → 74.125.68.188 TCP 66 40830 → 443 [ACK] Seq=1 Ack=1 Win=346 Len=0 TSval=19307520 TSecr=1071075
  466 32.450123941 74.125.68.188 → 192.168.1.16 TCP 66 [TCP ACKed unseen segment] 443 → 40830 [ACK] Seq=1 Ack=2 Win=179 Len=0 TSval=1116131 TSecr=19262258
  467 34.068246874 192.168.1.16 → 91.189.89.198 NTP 90 NTP Version 4, client
  468 37.211700316 192.168.1.16 → 66.235.139.15 TCP 66 39132 → 443 [ACK] Seq=1 Ack=1 Win=40544 Len=0 TSval=19308720 TSecr=2190920058
  469 38.141738750 66.235.139.15 → 192.168.1.16 TCP 66 [TCP ACKed unseen segment] 443 → 39132 [ACK] Seq=1 Ack=2 Win=5873 Len=0 TSval=2190965817 TSecr=18754821
  470 38.555699143 192.168.1.16 → 54.77.5.47   TCP 66 53566 → 8282 [ACK] Seq=1 Ack=1 Win=328 Len=0 TSval=19309056 TSecr=311776167
