    1 0.000000000  10.6.15.144 → 192.168.1.16 TCP 66 22 → 57328 [ACK] Seq=1 Ack=1 Win=1452 Len=0 TSval=5503717 TSecr=13770573
    2 0.009180339  10.6.15.144 → 192.168.1.16 SSH 254 Server: Encrypted packet (len=188)
    3 0.011834517 192.168.1.16 → 10.6.15.144  SSH 278 Client: Encrypted packet (len=212)
    4 0.013509329  10.6.15.144 → 192.168.1.16 SSH 254 Server: Encrypted packet (len=188)
    5 0.013896381  10.6.15.144 → 192.168.1.16 TCP 66 22 → 57328 [ACK] Seq=377 Ack=213 Win=1452 Len=0 TSval=5503720 TSecr=13770586
    6 0.015937191 192.168.1.16 → 10.6.15.144  SSH 270 Client: Encrypted packet (len=204)
    7 0.017503252  10.6.15.144 → 192.168.1.16 TCP 66 22 → 57328 [ACK] Seq=377 Ack=417 Win=1452 Len=0 TSval=5503721 TSecr=13770587
    8 0.024668105  10.6.15.144 → 192.168.1.16 SSH 254 Server: Encrypted packet (len=188)
    9 0.027306712 192.168.1.16 → 10.6.15.144  SSH 270 Client: Encrypted packet (len=204)
   10 0.029941096  10.6.15.144 → 192.168.1.16 SSH 1374 Server: Encrypted packet (len=1308)
   11 0.032578263 192.168.1.16 → 10.6.15.144  SSH 270 Client: Encrypted packet (len=204)
   12 0.048102769  10.6.15.144 → 192.168.1.16 SSH 486 Server: Encrypted packet (len=420)
   13 0.050364200 192.168.1.16 → 10.6.15.144  SSH 270 Client: Encrypted packet (len=204)
   14 0.091980020  10.6.15.144 → 192.168.1.16 TCP 66 22 → 57328 [ACK] Seq=2293 Ack=1029 Win=1452 Len=0 TSval=5503740 TSecr=13770595
   15 0.675755391 192.168.1.16 → 54.77.5.47   TCP 66 53566 → 8282 [ACK] Seq=1 Ack=1 Win=296 Len=0 TSval=13770752 TSecr=306234881
   16 0.677423867  10.6.15.144 → 192.168.1.16 SSH 174 Server: Encrypted packet (len=108)
   17 0.677448305  10.6.15.144 → 192.168.1.16 SSH 166 Server: Encrypted packet (len=100)
   18 0.677455045  10.6.15.144 → 192.168.1.16 SSH 174 Server: Encrypted packet (len=108)
   19 0.677509230 192.168.1.16 → 10.6.15.144  TCP 66 57328 → 22 [ACK] Seq=1029 Ack=2609 Win=2987 Len=0 TSval=13770752 TSecr=5503776
   20 0.677600315  10.6.15.144 → 192.168.1.16 SSH 166 Server: Encrypted packet (len=100)
   21 0.677624151  10.6.15.144 → 192.168.1.16 SSH 166 Server: Encrypted packet (len=100)
   22 0.677642567 192.168.1.16 → 10.6.15.144  TCP 66 57328 → 22 [ACK] Seq=1029 Ack=2809 Win=2987 Len=0 TSval=13770752 TSecr=5503783
   23 0.677719601  10.6.15.144 → 192.168.1.16 SSH 582 Server: [TCP Spurious Retransmission] , Encrypted packet (len=516)
   24 0.677725466 192.168.1.16 → 10.6.15.144  TCP 78 [TCP Dup ACK 22#1] 57328 → 22 [ACK] Seq=1029 Ack=2809 Win=2987 Len=0 TSval=13770752 TSecr=5503858 SLE=2293 SRE=2809
   25 0.678641298 192.168.1.16 → 10.6.15.144  SSH 1190 Client: Encrypted packet (len=1124)
   26 0.681200985  10.6.15.144 → 192.168.1.16 TCP 66 22 → 57328 [ACK] Seq=2809 Ack=2153 Win=1452 Len=0 TSval=5503887 TSecr=13770752
   27 1.443755395 192.168.1.16 → 172.217.26.170 TCP 66 58344 → 443 [FIN, ACK] Seq=1 Ack=1 Win=262 Len=0 TSval=13770944 TSecr=3849205100
   28 1.445378291   54.77.5.47 → 192.168.1.16 TCP 66 [TCP ACKed unseen segment] 8282 → 53566 [ACK] Seq=1 Ack=2 Win=121 Len=0 TSval=306246425 TSecr=13701688
   29 1.445661318  10.6.15.144 → 192.168.1.16 SSH 1514 Server: Encrypted packet (len=1448)
   30 1.445984546  10.6.15.144 → 192.168.1.16 SSH 1514 Server: Encrypted packet (len=1448)
   31 1.445994733 192.168.1.16 → 10.6.15.144  TCP 66 57328 → 22 [ACK] Seq=2153 Ack=5705 Win=2987 Len=0 TSval=13770944 TSecr=5503949
   32 1.446097095  10.6.15.144 → 192.168.1.16 SSH 134 Server: Encrypted packet (len=68)
   33 1.446453783  10.6.15.144 → 192.168.1.16 SSH 1514 Server: Encrypted packet (len=1448)
   34 1.446463067 192.168.1.16 → 10.6.15.144  TCP 66 57328 → 22 [ACK] Seq=2153 Ack=7221 Win=2987 Len=0 TSval=13770944 TSecr=5503949
   35 1.446786931  10.6.15.144 → 192.168.1.16 SSH 1514 Server: Encrypted packet (len=1448)
   36 1.449479098  10.6.15.144 → 192.168.1.16 SSH 1514 Server: Encrypted packet (len=1448)
   37 1.449495399 192.168.1.16 → 10.6.15.144  TCP 66 57328 → 22 [ACK] Seq=2153 Ack=10117 Win=2987 Len=0 TSval=13770945 TSecr=5503985
   38 1.449619755  10.6.15.144 → 192.168.1.16 SSH 438 Server: Encrypted packet (len=372)
   39 1.453006409 192.168.1.16 → 10.6.15.144  SSH 138 Client: Encrypted packet (len=72)
   40 1.454339341  10.6.15.144 → 192.168.1.16 TCP 66 22 → 57328 [ACK] Seq=10489 Ack=2225 Win=1452 Len=0 TSval=5504080 TSecr=13770946
   41 1.454472921  10.6.15.144 → 192.168.1.16 SSH 102 Server: Encrypted packet (len=36)
   42 1.495717593 192.168.1.16 → 10.6.15.144  TCP 66 57328 → 22 [ACK] Seq=2225 Ack=10525 Win=2987 Len=0 TSval=13770957 TSecr=5504080
   43 1.912867592 192.168.1.16 → 10.6.15.144  SSH 862 Client: Encrypted packet (len=796)
   44 1.957605699  10.6.15.144 → 192.168.1.16 TCP 66 22 → 57328 [ACK] Seq=10525 Ack=3021 Win=1452 Len=0 TSval=5504206 TSecr=13771061
   45 1.989800175  10.6.15.144 → 192.168.1.16 SSH 1514 Server: Encrypted packet (len=1448)
   46 1.989832128 192.168.1.16 → 10.6.15.144  TCP 66 57328 → 22 [ACK] Seq=3021 Ack=11973 Win=2987 Len=0 TSval=13771080 TSecr=5504214
   47 1.990021591  10.6.15.144 → 192.168.1.16 SSH 966 Server: Encrypted packet (len=900)
   48 1.990029022 192.168.1.16 → 10.6.15.144  TCP 66 57328 → 22 [ACK] Seq=3021 Ack=12873 Win=2987 Len=0 TSval=13771080 TSecr=5504214
   49 8.611768739 192.168.1.16 → 172.217.26.170 TCP 66 [TCP Retransmission] 58344 → 443 [FIN, ACK] Seq=1 Ack=1 Win=262 Len=0 TSval=13772736 TSecr=3849205100
   50 8.867761229 192.168.1.16 → 216.58.197.78 TCP 66 32882 → 80 [ACK] Seq=1 Ack=1 Win=251 Len=0 TSval=13772800 TSecr=1034316795
   51 8.873322019  10.6.15.144 → 192.168.1.16 SSH 550 Server: Encrypted packet (len=484)
   52 8.873358111 192.168.1.16 → 10.6.15.144  TCP 66 57328 → 22 [ACK] Seq=3021 Ack=13357 Win=2987 Len=0 TSval=13772801 TSecr=5505916
   53 8.877408737 216.58.197.78 → 192.168.1.16 TCP 66 [TCP ACKed unseen segment] 80 → 32882 [ACK] Seq=1 Ack=2 Win=31 Len=0 TSval=1034321301 TSecr=13716470
   54 9.126014029 192.168.1.16 → 10.6.15.144  SSH 1350 Client: Encrypted packet (len=1284)
   55 9.130515599  10.6.15.144 → 192.168.1.16 TCP 66 22 → 57328 [ACK] Seq=13357 Ack=4305 Win=1452 Len=0 TSval=5505999 TSecr=13772864
   56 9.134784577  10.6.15.144 → 192.168.1.16 SSH 142 Server: Encrypted packet (len=76)
   57 9.134802895 192.168.1.16 → 10.6.15.144  TCP 66 57328 → 22 [ACK] Seq=4305 Ack=13433 Win=2987 Len=0 TSval=13772866 TSecr=5506000
   58 9.354625027 192.168.1.16 → 10.6.15.144  SSH 614 Client: Encrypted packet (len=548)
   59 9.395869181  10.6.15.144 → 192.168.1.16 TCP 66 22 → 57328 [ACK] Seq=13433 Ack=4853 Win=1452 Len=0 TSval=5506066 TSecr=13772921
   60 9.404296772 192.168.1.16 → 91.189.91.157 NTP 90 NTP Version 4, client
   61 9.430769455  10.6.15.144 → 192.168.1.16 SSH 1514 Server: Encrypted packet (len=1448)
   62 9.430796578 192.168.1.16 → 10.6.15.144  TCP 66 57328 → 22 [ACK] Seq=4853 Ack=14881 Win=2987 Len=0 TSval=13772940 TSecr=5506074
   63 9.431148353  10.6.15.144 → 192.168.1.16 SSH 166 Server: Encrypted packet (len=100)
   64 9.431157432 192.168.1.16 → 10.6.15.144  TCP 66 57328 → 22 [ACK] Seq=4853 Ack=14981 Win=2987 Len=0 TSval=13772940 TSecr=5506074
   65 9.431833037  10.6.15.144 → 192.168.1.16 SSH 1514 Server: Encrypted packet (len=1448)
   66 9.431838070 192.168.1.16 → 10.6.15.144  TCP 66 57328 → 22 [ACK] Seq=4853 Ack=16429 Win=2987 Len=0 TSval=13772941 TSecr=5506074
   67 9.432419096  10.6.15.144 → 192.168.1.16 SSH 1514 Server: Encrypted packet (len=1448)
   68 9.432422590 192.168.1.16 → 10.6.15.144  TCP 66 57328 → 22 [ACK] Seq=4853 Ack=17877 Win=2987 Len=0 TSval=13772941 TSecr=5506074
   69 9.433155019  10.6.15.144 → 192.168.1.16 SSH 1514 Server: Encrypted packet (len=1448)
   70 9.433172995 192.168.1.16 → 10.6.15.144  TCP 66 57328 → 22 [ACK] Seq=4853 Ack=19325 Win=2987 Len=0 TSval=13772941 TSecr=5506075
   71 9.433533330  10.6.15.144 → 192.168.1.16 SSH 254 Server: Encrypted packet (len=188)
   72 9.433548863 192.168.1.16 → 10.6.15.144  TCP 66 57328 → 22 [ACK] Seq=4853 Ack=19513 Win=2987 Len=0 TSval=13772941 TSecr=5506075
   73 9.434175787 192.168.1.16 → 10.6.15.144  SSH 134 Client: Encrypted packet (len=68)
   74 9.435482152  10.6.15.144 → 192.168.1.16 TCP 66 22 → 57328 [ACK] Seq=19513 Ack=4921 Win=1452 Len=0 TSval=5506075 TSecr=13772941
   75 9.436104208 192.168.1.16 → 10.6.15.144  SSH 1514 Client: Encrypted packet (len=1448)
   76 9.436981354 192.168.1.16 → 10.6.15.144  SSH 390 Client: Encrypted packet (len=324)
   77 9.438388964  10.6.15.144 → 192.168.1.16 TCP 66 22 → 57328 [ACK] Seq=19513 Ack=6693 Win=1447 Len=0 TSval=5506076 TSecr=13772942
   78 9.451520327  10.6.15.144 → 192.168.1.16 SSH 134 Server: Encrypted packet (len=68)
   79 9.491761787 192.168.1.16 → 10.6.15.144  TCP 66 57328 → 22 [ACK] Seq=6693 Ack=19581 Win=2987 Len=0 TSval=13772956 TSecr=5506079
   80 9.534260178  10.6.15.144 → 192.168.1.16 SSH 134 Server: Encrypted packet (len=68)
   81 9.534283756 192.168.1.16 → 10.6.15.144  TCP 66 57328 → 22 [ACK] Seq=6693 Ack=19649 Win=2987 Len=0 TSval=13772966 TSecr=5506100
   82 9.534567908 192.168.1.16 → 10.6.15.144  SSH 134 Client: Encrypted packet (len=68)
   83 9.575796640  10.6.15.144 → 192.168.1.16 TCP 66 22 → 57328 [ACK] Seq=19649 Ack=6761 Win=1452 Len=0 TSval=5506111 TSecr=13772966
   84 9.601350441  10.6.15.144 → 192.168.1.16 SSH 158 Server: Encrypted packet (len=92)
   85 9.602440624  10.6.15.144 → 192.168.1.16 SSH 838 Server: Encrypted packet (len=772)
   86 9.602514841 192.168.1.16 → 10.6.15.144  TCP 66 57328 → 22 [ACK] Seq=6761 Ack=20513 Win=2987 Len=0 TSval=13772983 TSecr=5506117
   87 9.602994405 192.168.1.16 → 10.6.15.144  SSH 134 Client: Encrypted packet (len=68)
   88 9.604630569  10.6.15.144 → 192.168.1.16 TCP 66 22 → 57328 [ACK] Seq=20513 Ack=6829 Win=1452 Len=0 TSval=5506118 TSecr=13772983
   89 14.501776861  192.168.1.1 → 224.0.0.1    IGMPv2 42 Membership Query, general
   90 16.675622892 192.168.1.16 → 10.6.15.144  SSH 510 Client: Encrypted packet (len=444)
   91 16.678184442  10.6.15.144 → 192.168.1.16 TCP 66 22 → 57328 [ACK] Seq=20513 Ack=7273 Win=1452 Len=0 TSval=5507886 TSecr=13774751
   92 17.477955305  10.6.15.144 → 192.168.1.16 SSH 342 Server: Encrypted packet (len=276)
   93 17.478292490  10.6.15.144 → 192.168.1.16 TCP 342 [TCP Retransmission] 22 → 57328 [PSH, ACK] Seq=20513 Ack=7273 Win=1452 Len=276 TSval=5507991 TSecr=13774751
   94 17.478303378 192.168.1.16 → 10.6.15.144  TCP 78 57328 → 22 [ACK] Seq=7273 Ack=20789 Win=2987 Len=0 TSval=13774952 TSecr=5507991 SLE=20513 SRE=20789
   95 18.676736174 192.168.1.16 → 10.6.15.144  SSH 470 Client: Encrypted packet (len=404)
   96 18.679164744  10.6.15.144 → 192.168.1.16 TCP 66 22 → 57328 [ACK] Seq=20789 Ack=7677 Win=1452 Len=0 TSval=5508386 TSecr=13775252
   97 19.619759838 192.168.1.16 → 224.0.0.251  IGMPv2 46 Membership Report group 224.0.0.251
   98 19.622065879  10.6.15.144 → 192.168.1.16 SSH 294 Server: Encrypted packet (len=228)
   99 19.622090928 192.168.1.16 → 10.6.15.144  TCP 66 57328 → 22 [ACK] Seq=7677 Ack=21017 Win=2987 Len=0 TSval=13775488 TSecr=5508426
  100 19.684851017 192.168.1.16 → 10.6.15.144  SSH 102 Client: Encrypted packet (len=36)
  101 19.685438567 192.168.1.16 → 10.6.15.144  SSH 246 Client: Encrypted packet (len=180)
  102 19.685725205 192.168.1.16 → 10.6.15.144  SSH 118 Client: Encrypted packet (len=52)
  103 19.687021522  10.6.15.144 → 192.168.1.16 TCP 66 22 → 57328 [ACK] Seq=21017 Ack=7713 Win=1452 Len=0 TSval=5508638 TSecr=13775504
  104 19.687385606  10.6.15.144 → 192.168.1.16 TCP 66 22 → 57328 [ACK] Seq=21017 Ack=7893 Win=1452 Len=0 TSval=5508638 TSecr=13775504
  105 19.687771514  10.6.15.144 → 192.168.1.16 TCP 66 22 → 57328 [ACK] Seq=21017 Ack=7945 Win=1452 Len=0 TSval=5508638 TSecr=13775504
  106 19.720919777  10.6.15.144 → 192.168.1.16 SSH 110 Server: Encrypted packet (len=44)
  107 19.720946561 192.168.1.16 → 10.6.15.144  TCP 66 57328 → 22 [ACK] Seq=7945 Ack=21061 Win=2987 Len=0 TSval=13775513 TSecr=5508647
  108 19.721474015 192.168.1.16 → 10.6.15.144  SSH 174 Client: Encrypted packet (len=108)
  109 19.741442574  10.6.15.144 → 192.168.1.16 SSH 138 Server: Encrypted packet (len=72)
  110 19.741649366 192.168.1.16 → 10.6.15.144  SSH 102 Client: Encrypted packet (len=36)
  111 19.767755515 192.168.1.16 → 10.6.15.144  TCP 102 [TCP Retransmission] 57328 → 22 [PSH, ACK] Seq=8053 Ack=21133 Win=2987 Len=36 TSval=13775525 TSecr=5508652
  112 19.800192382  10.6.15.144 → 192.168.1.16 SSH 150 Server: Encrypted packet (len=72)
  113 19.800396079 192.168.1.16 → 10.6.15.144  SSH 102 Client: Encrypted packet (len=36)
  114 19.802466777  10.6.15.144 → 192.168.1.16 TCP 78 [TCP Dup ACK 105#1] 22 → 57328 [ACK] Seq=21205 Ack=7945 Win=1452 Len=0 TSval=5508667 TSecr=13775504 SLE=8053 SRE=8125
  115 19.983763923 192.168.1.16 → 10.6.15.144  TCP 174 [TCP Retransmission] 57328 → 22 [PSH, ACK] Seq=7945 Ack=21205 Win=2987 Len=108 TSval=13775579 TSecr=5508667
  116 19.985889498  10.6.15.144 → 192.168.1.16 SSH 150 Server: Encrypted packet (len=72)
  117 19.985911283  10.6.15.144 → 192.168.1.16 SSH 150 Server: Encrypted packet (len=72)
  118 19.985971445 192.168.1.16 → 10.6.15.144  TCP 66 57328 → 22 [ACK] Seq=8125 Ack=21349 Win=2987 Len=0 TSval=13775579 TSecr=5508694
  119 19.987756960  10.6.15.144 → 192.168.1.16 SSH 150 Server: Encrypted packet (len=72)
  120 19.988188159  10.6.15.144 → 192.168.1.16 TCP 66 22 → 57328 [ACK] Seq=21421 Ack=8125 Win=1452 Len=0 TSval=5508713 TSecr=13775579
  121 19.988210057 192.168.1.16 → 10.6.15.144  SSH 174 Client: Encrypted packet (len=108)
  122 19.988227865  10.6.15.144 → 192.168.1.16 SSH 138 Server: Encrypted packet (len=72)
  123 19.989599757 192.168.1.16 → 10.6.15.144  SSH 102 Client: Encrypted packet (len=36)
  124 19.992856253  10.6.15.144 → 192.168.1.16 TCP 66 22 → 57328 [ACK] Seq=21493 Ack=8269 Win=1452 Len=0 TSval=5508714 TSecr=13775580
  125 20.022280986  10.6.15.144 → 192.168.1.16 SSH 1514 Server: Encrypted packet (len=1448)
  126 20.022304511  10.6.15.144 → 192.168.1.16 SSH 470 Server: Encrypted packet (len=404)
  127 20.022313434 192.168.1.16 → 10.6.15.144  TCP 66 57328 → 22 [ACK] Seq=8269 Ack=23345 Win=2987 Len=0 TSval=13775588 TSecr=5508722
  128 20.022870343  10.6.15.144 → 192.168.1.16 SSH 1190 Server: Encrypted packet (len=1124)
  129 20.024080175 192.168.1.16 → 10.6.15.144  SSH 342 Client: Encrypted packet (len=276)
  130 20.024907947 192.168.1.16 → 10.6.15.144  SSH 198 Client: Encrypted packet (len=132)
  131 20.025715555 192.168.1.16 → 10.6.15.144  SSH 1410 Client: Encrypted packet (len=1344)
  132 20.026417825  10.6.15.144 → 192.168.1.16 TCP 66 22 → 57328 [ACK] Seq=24469 Ack=8677 Win=1452 Len=0 TSval=5508723 TSecr=13775589
  133 20.061770960  10.6.15.144 → 192.168.1.16 SSH 526 Server: Encrypted packet (len=460)
  134 20.062105112 192.168.1.16 → 10.6.15.144  SSH 126 Client: Encrypted packet (len=60)
  135 20.066572037  10.6.15.144 → 192.168.1.16 SSH 1514 Server: Encrypted packet (len=1448)
  136 20.066725905  10.6.15.144 → 192.168.1.16 SSH 1514 Server: Encrypted packet (len=1448)
  137 20.066737086 192.168.1.16 → 10.6.15.144  TCP 66 57328 → 22 [ACK] Seq=10081 Ack=27825 Win=2987 Len=0 TSval=13775599 TSecr=5508732
  138 20.090173844  10.6.15.144 → 192.168.1.16 SSH 134 Server: Encrypted packet (len=68)
  139 20.090907769 192.168.1.16 → 10.6.15.144  SSH 142 Client: Encrypted packet (len=76)
  140 20.092411724  10.6.15.144 → 192.168.1.16 TCP 78 [TCP Dup ACK 133#1] 22 → 57328 [ACK] Seq=27893 Ack=10021 Win=1452 Len=0 TSval=5508740 TSecr=13775589 SLE=10081 SRE=10157
  141 20.108407255 192.168.1.16 → 10.6.15.144  SSH 550 Client: Encrypted packet (len=484)
  142 20.110617888  10.6.15.144 → 192.168.1.16 TCP 78 [TCP Dup ACK 133#2] 22 → 57328 [ACK] Seq=27893 Ack=10021 Win=1452 Len=0 TSval=5508744 TSecr=13775589 SLE=10081 SRE=10641
  143 20.279757021 192.168.1.16 → 10.6.15.144  TCP 126 [TCP Retransmission] 57328 → 22 [PSH, ACK] Seq=10021 Ack=27893 Win=2987 Len=60 TSval=13775653 TSecr=5508744
  144 20.281883908  10.6.15.144 → 192.168.1.16 TCP 66 22 → 57328 [ACK] Seq=27893 Ack=10641 Win=1449 Len=0 TSval=5508787 TSecr=13775653
  145 20.678012908 192.168.1.16 → 10.6.15.144  SSH 110 Client: Encrypted packet (len=44)
  146 20.680246385  10.6.15.144 → 192.168.1.16 TCP 66 22 → 57328 [ACK] Seq=27893 Ack=10685 Win=1452 Len=0 TSval=5508887 TSecr=13775752
  147 20.714920177  10.6.15.144 → 192.168.1.16 SSH 110 Server: Encrypted packet (len=44)
  148 20.715342381 192.168.1.16 → 10.6.15.144  SSH 446 Client: Encrypted packet (len=380)
  149 20.752116699  10.6.15.144 → 192.168.1.16 SSH 230 Server: Encrypted packet (len=164)
  150 20.752372390 192.168.1.16 → 10.6.15.144  SSH 134 Client: Encrypted packet (len=68)
  151 20.753267342 192.168.1.16 → 10.6.15.144  SSH 198 Client: Encrypted packet (len=132)
  152 20.754750422  10.6.15.144 → 192.168.1.16 TCP 66 22 → 57328 [ACK] Seq=28101 Ack=11265 Win=1452 Len=0 TSval=5508905 TSecr=13775771
  153 20.754758471 192.168.1.16 → 10.6.15.144  SSH 1198 Client: Encrypted packet (len=1132)
  154 20.788986312  10.6.15.144 → 192.168.1.16 SSH 166 Server: Encrypted packet (len=100)
  155 20.789059487  10.6.15.144 → 192.168.1.16 SSH 126 Server: Encrypted packet (len=60)
  156 20.789077201 192.168.1.16 → 10.6.15.144  TCP 66 57328 → 22 [ACK] Seq=12397 Ack=28261 Win=2987 Len=0 TSval=13775780 TSecr=5508914
  157 20.789310481 192.168.1.16 → 10.6.15.144  SSH 126 Client: Encrypted packet (len=60)
  158 20.843804526  10.6.15.144 → 192.168.1.16 TCP 66 22 → 57328 [ACK] Seq=28261 Ack=12457 Win=1452 Len=0 TSval=5508926 TSecr=13775780
  159 20.876893828  10.6.15.144 → 192.168.1.16 SSH 902 Server: Encrypted packet (len=836)
  160 20.876917390  10.6.15.144 → 192.168.1.16 SSH 478 Server: Encrypted packet (len=412)
  161 20.876977284 192.168.1.16 → 10.6.15.144  TCP 66 57328 → 22 [ACK] Seq=12457 Ack=29509 Win=2987 Len=0 TSval=13775802 TSecr=5508936
  162 20.877639871 192.168.1.16 → 10.6.15.144  SSH 134 Client: Encrypted packet (len=68)
  163 20.878371075  10.6.15.144 → 192.168.1.16 SSH 1134 Server: Encrypted packet (len=1068)
  164 20.879131369  10.6.15.144 → 192.168.1.16 TCP 66 22 → 57328 [ACK] Seq=30577 Ack=12525 Win=1452 Len=0 TSval=5508936 TSecr=13775802
  165 20.879319491 192.168.1.16 → 10.6.15.144  SSH 134 Client: Encrypted packet (len=68)
  166 20.880671187  10.6.15.144 → 192.168.1.16 TCP 66 22 → 57328 [ACK] Seq=30577 Ack=12593 Win=1452 Len=0 TSval=5508937 TSecr=13775802
  167 22.179756486 192.168.1.16 → 224.0.0.252  IGMPv2 46 Membership Report group 224.0.0.252
  168 22.691764376 192.168.1.16 → 172.217.26.170 TCP 66 [TCP Retransmission] 58344 → 443 [FIN, ACK] Seq=1 Ack=1 Win=262 Len=0 TSval=13776256 TSecr=3849205100
  169 23.828454724 192.168.1.16 → 54.77.5.47   TCP 128 [TCP Previous segment not captured] 53566 → 8282 [PSH, ACK] Seq=2 Ack=1 Win=296 Len=62 TSval=13776540 TSecr=306246425
  170 23.832886247 216.58.197.78 → 192.168.1.16 TCP 66 [TCP ACKed unseen segment] 80 → 32882 [FIN, ACK] Seq=1 Ack=2 Win=31 Len=0 TSval=1034322774 TSecr=13716470
  171 23.875756557 192.168.1.16 → 216.58.197.78 TCP 66 [TCP Previous segment not captured] 32882 → 80 [ACK] Seq=2 Ack=2 Win=251 Len=0 TSval=13776552 TSecr=1034322774
  172 24.995758198 192.168.1.16 → 54.77.5.47   TCP 128 [TCP Retransmission] 53566 → 8282 [PSH, ACK] Seq=2 Ack=1 Win=296 Len=62 TSval=13776832 TSecr=306246425
  173 24.997405799   54.77.5.47 → 192.168.1.16 TCP 66 [TCP ACKed unseen segment] 8282 → 53566 [ACK] Seq=1 Ack=64 Win=121 Len=0 TSval=306252213 TSecr=13776540
  174 25.251767904 192.168.1.16 → 216.58.197.67 TCP 66 59330 → 443 [ACK] Seq=1 Ack=1 Win=317 Len=0 TSval=13776896 TSecr=2367347713
  175 25.253440191   54.77.5.47 → 192.168.1.16 TCP 78 [TCP Dup ACK 173#1] 8282 → 53566 [ACK] Seq=1 Ack=64 Win=121 Len=0 TSval=306252505 TSecr=13776832 SLE=2 SRE=64
  176 34.404278600 192.168.1.16 → 139.59.50.38 NTP 90 NTP Version 4, client
  177 37.404378753 192.168.1.16 → 123.108.200.124 NTP 90 NTP Version 4, client
