    1 0.000000000 192.168.1.16 → 216.58.197.67 TLSv1.2 497 Application Data, Application Data, Application Data, Application Data, Application Data
    2 0.002222965  10.6.15.186 → 192.168.1.16 SSH 102 Server: Encrypted packet (len=36)
    3 0.002248252  10.6.15.186 → 192.168.1.16 TCP 102 [TCP Retransmission] 22 → 43250 [PSH, ACK] Seq=1 Ack=1 Win=2127 Len=36 TSval=3335492 TSecr=19026867
    4 0.002259576 192.168.1.16 → 10.6.15.186  TCP 78 43250 → 22 [ACK] Seq=1 Ack=37 Win=1810 Len=0 TSval=19027016 TSecr=3335492 SLE=1 SRE=37
    5 0.002272115  10.6.15.186 → 192.168.1.16 SSH 138 Server: Encrypted packet (len=72)
    6 0.002276641 192.168.1.16 → 10.6.15.186  TCP 66 43250 → 22 [ACK] Seq=1 Ack=109 Win=1810 Len=0 TSval=19027016 TSecr=3335519
    7 0.002461184 192.168.1.16 → 10.6.15.186  SSH 102 Client: Encrypted packet (len=36)
    8 0.003763935 192.168.1.16 → 10.6.15.186  SSH 158 Client: Encrypted packet (len=92)
    9 0.006796534  10.6.15.186 → 192.168.1.16 TCP 66 22 → 43250 [ACK] Seq=109 Ack=129 Win=2127 Len=0 TSval=3335531 TSecr=19027016
   10 0.054719126  10.6.15.186 → 192.168.1.16 SSH 102 Server: Encrypted packet (len=36)
   11 0.055021477 192.168.1.16 → 10.6.15.186  SSH 150 Client: Encrypted packet (len=84)
   12 0.065533562  10.6.15.186 → 192.168.1.16 SSH 1514 Server: Encrypted packet (len=1448)
   13 0.065686253  10.6.15.186 → 192.168.1.16 SSH 1514 Server: Encrypted packet (len=1448)
   14 0.065697281 192.168.1.16 → 10.6.15.186  TCP 66 43250 → 22 [ACK] Seq=213 Ack=3041 Win=1810 Len=0 TSval=19027032 TSecr=3335546
   15 0.066057176  10.6.15.186 → 192.168.1.16 SSH 1446 Server: Encrypted packet (len=1380)
   16 0.066184356  10.6.15.186 → 192.168.1.16 SSH 1514 Server: Encrypted packet (len=1448)
   17 0.066192750 192.168.1.16 → 10.6.15.186  TCP 66 43250 → 22 [ACK] Seq=213 Ack=5869 Win=1810 Len=0 TSval=19027032 TSecr=3335546
   18 0.066380432  10.6.15.186 → 192.168.1.16 SSH 1446 Server: Encrypted packet (len=1380)
   19 0.068419529  10.6.15.186 → 192.168.1.16 SSH 1514 Server: Encrypted packet (len=1448)
   20 0.068436270 192.168.1.16 → 10.6.15.186  TCP 66 43250 → 22 [ACK] Seq=213 Ack=8697 Win=1810 Len=0 TSval=19027033 TSecr=3335546
   21 0.068605751  10.6.15.186 → 192.168.1.16 SSH 1514 Server: Encrypted packet (len=1448)
   22 0.068796260  10.6.15.186 → 192.168.1.16 SSH 1514 Server: Encrypted packet (len=1448)
   23 0.068805052 192.168.1.16 → 10.6.15.186  TCP 66 43250 → 22 [ACK] Seq=213 Ack=11593 Win=1810 Len=0 TSval=19027033 TSecr=3335547
   24 0.069140470  10.6.15.186 → 192.168.1.16 SSH 1514 Server: Encrypted packet (len=1448)
   25 0.069330839  10.6.15.186 → 192.168.1.16 SSH 1514 Server: Encrypted packet (len=1448)
   26 0.069337105 192.168.1.16 → 10.6.15.186  TCP 66 43250 → 22 [ACK] Seq=213 Ack=14489 Win=1810 Len=0 TSval=19027033 TSecr=3335547
   27 0.071204628  10.6.15.186 → 192.168.1.16 SSH 1514 Server: Encrypted packet (len=1448)
   28 0.071388533  10.6.15.186 → 192.168.1.16 SSH 1514 Server: Encrypted packet (len=1448)
   29 0.071403830 192.168.1.16 → 10.6.15.186  TCP 66 43250 → 22 [ACK] Seq=213 Ack=17385 Win=1810 Len=0 TSval=19027033 TSecr=3335547
   30 0.071735090  10.6.15.186 → 192.168.1.16 SSH 1514 Server: Encrypted packet (len=1448)
   31 0.071923897  10.6.15.186 → 192.168.1.16 SSH 1514 Server: Encrypted packet (len=1448)
   32 0.071937731 192.168.1.16 → 10.6.15.186  TCP 66 43250 → 22 [ACK] Seq=213 Ack=20281 Win=1810 Len=0 TSval=19027033 TSecr=3335547
   33 0.072116606  10.6.15.186 → 192.168.1.16 SSH 1514 Server: Encrypted packet (len=1448)
   34 0.072458198  10.6.15.186 → 192.168.1.16 SSH 1514 Server: Encrypted packet (len=1448)
   35 0.072465609 192.168.1.16 → 10.6.15.186  TCP 66 43250 → 22 [ACK] Seq=213 Ack=23177 Win=1810 Len=0 TSval=19027034 TSecr=3335547
   36 0.077487798  10.6.15.186 → 192.168.1.16 SSH 1514 Server: Encrypted packet (len=1448)
   37 0.077674344  10.6.15.186 → 192.168.1.16 SSH 1514 Server: Encrypted packet (len=1448)
   38 0.077686514 192.168.1.16 → 10.6.15.186  TCP 66 43250 → 22 [ACK] Seq=213 Ack=26073 Win=1810 Len=0 TSval=19027035 TSecr=3335548
   39 0.077865826  10.6.15.186 → 192.168.1.16 SSH 1514 Server: Encrypted packet (len=1448)
   40 0.078057732  10.6.15.186 → 192.168.1.16 SSH 1514 Server: Encrypted packet (len=1448)
   41 0.078066138 192.168.1.16 → 10.6.15.186  TCP 66 43250 → 22 [ACK] Seq=213 Ack=28969 Win=1810 Len=0 TSval=19027035 TSecr=3335548
   42 0.078247985  10.6.15.186 → 192.168.1.16 SSH 1514 Server: Encrypted packet (len=1448)
   43 0.078438677  10.6.15.186 → 192.168.1.16 SSH 1514 Server: Encrypted packet (len=1448)
   44 0.078445650 192.168.1.16 → 10.6.15.186  TCP 66 43250 → 22 [ACK] Seq=213 Ack=31865 Win=1810 Len=0 TSval=19027035 TSecr=3335548
   45 0.078612715 192.168.1.16 → 10.6.15.186  SSH 102 Client: Encrypted packet (len=36)
   46 0.093509583  10.6.15.186 → 192.168.1.16 SSH 1514 Server: Encrypted packet (len=1448)
   47 0.093690232  10.6.15.186 → 192.168.1.16 SSH 1514 Server: Encrypted packet (len=1448)
   48 0.093702336 192.168.1.16 → 10.6.15.186  TCP 66 43250 → 22 [ACK] Seq=249 Ack=34761 Win=1810 Len=0 TSval=19027039 TSecr=3335553
   49 0.093721813  10.6.15.186 → 192.168.1.16 SSH 230 Server: Encrypted packet (len=164)
   50 0.096481180 192.168.1.16 → 10.6.15.186  SSH 334 Client: Encrypted packet (len=268)
   51 0.101708587  10.6.15.186 → 192.168.1.16 SSH 494 Server: Encrypted packet (len=428)
   52 0.143958540 192.168.1.16 → 10.6.15.186  TCP 66 43250 → 22 [ACK] Seq=517 Ack=35353 Win=1810 Len=0 TSval=19027052 TSecr=3335555
   53 0.148075251 192.168.1.16 → 10.6.15.186  SSH 102 Client: Encrypted packet (len=36)
   54 0.187292800  10.6.15.186 → 192.168.1.16 TCP 66 22 → 43250 [ACK] Seq=35353 Ack=553 Win=2127 Len=0 TSval=3335577 TSecr=19027053
   55 0.430321206 192.168.1.16 → 10.6.15.186  SSH 174 Client: Encrypted packet (len=108)
   56 0.431311871 192.168.1.16 → 10.6.15.186  SSH 134 Client: Encrypted packet (len=68)
   57 0.434210885  10.6.15.186 → 192.168.1.16 SSH 1514 Server: Encrypted packet (len=1448)
   58 0.434236160 192.168.1.16 → 10.6.15.186  TCP 66 43250 → 22 [ACK] Seq=729 Ack=36801 Win=1810 Len=0 TSval=19027124 TSecr=3335612
   59 0.434343477  10.6.15.186 → 192.168.1.16 SSH 1158 Server: Encrypted packet (len=1092)
   60 0.434348602 192.168.1.16 → 10.6.15.186  TCP 66 43250 → 22 [ACK] Seq=729 Ack=37893 Win=1810 Len=0 TSval=19027124 TSecr=3335612
   61 0.434356748  10.6.15.186 → 192.168.1.16 SSH 110 Server: Encrypted packet (len=44)
   62 0.434362135 192.168.1.16 → 10.6.15.186  TCP 66 43250 → 22 [ACK] Seq=729 Ack=37937 Win=1810 Len=0 TSval=19027124 TSecr=3335621
   63 0.434366909  10.6.15.186 → 192.168.1.16 SSH 110 Server: [TCP Spurious Retransmission] , Encrypted packet (len=44)
   64 0.434370272 192.168.1.16 → 10.6.15.186  TCP 78 [TCP Dup ACK 62#1] 43250 → 22 [ACK] Seq=729 Ack=37937 Win=1810 Len=0 TSval=19027124 TSecr=3335631 SLE=37893 SRE=37937
   65 0.434374493  10.6.15.186 → 192.168.1.16 TCP 66 22 → 43250 [ACK] Seq=37937 Ack=661 Win=2127 Len=0 TSval=3335638 TSecr=19027123
   66 0.434388128  10.6.15.186 → 192.168.1.16 TCP 66 22 → 43250 [ACK] Seq=37937 Ack=729 Win=2127 Len=0 TSval=3335638 TSecr=19027123
   67 0.435318643 192.168.1.16 → 10.6.15.186  SSH 206 Client: Encrypted packet (len=140)
   68 0.438495283 192.168.1.16 → 10.6.15.186  SSH 158 Client: Encrypted packet (len=92)
   69 0.439503362  10.6.15.186 → 192.168.1.16 TCP 66 22 → 43250 [ACK] Seq=37937 Ack=869 Win=2127 Len=0 TSval=3335640 TSecr=19027124
   70 0.439522724  10.6.15.186 → 192.168.1.16 TCP 66 22 → 43250 [ACK] Seq=37937 Ack=961 Win=2127 Len=0 TSval=3335640 TSecr=19027125
   71 0.801620975 192.168.1.16 → 10.6.15.186  SSH 262 Client: Encrypted packet (len=196)
   72 0.802598671 192.168.1.16 → 10.6.15.186  SSH 894 Client: Encrypted packet (len=828)
   73 0.803437394  10.6.15.186 → 192.168.1.16 SSH 1198 Server: Encrypted packet (len=1132)
   74 0.803452692  10.6.15.186 → 192.168.1.16 SSH 150 Server: Encrypted packet (len=84)
   75 0.803492307 192.168.1.16 → 10.6.15.186  TCP 66 43250 → 22 [ACK] Seq=1985 Ack=39153 Win=1810 Len=0 TSval=19027216 TSecr=3335695
   76 0.803504673  10.6.15.186 → 192.168.1.16 SSH 494 Server: Encrypted packet (len=428)
   77 0.803913273  10.6.15.186 → 192.168.1.16 SSH 350 Server: Encrypted packet (len=284)
   78 0.803919062  10.6.15.186 → 192.168.1.16 TCP 66 22 → 43250 [ACK] Seq=39865 Ack=1157 Win=2127 Len=0 TSval=3335731 TSecr=19027216
   79 0.804066599 192.168.1.16 → 10.6.15.186  TCP 66 43250 → 22 [ACK] Seq=1985 Ack=39865 Win=1810 Len=0 TSval=19027217 TSecr=3335710
   80 0.805023080 192.168.1.16 → 10.6.15.186  SSH 206 Client: Encrypted packet (len=140)
   81 0.805414642  10.6.15.186 → 192.168.1.16 TCP 66 22 → 43250 [ACK] Seq=39865 Ack=1985 Win=2127 Len=0 TSval=3335731 TSecr=19027216
   82 0.806413820  10.6.15.186 → 192.168.1.16 TCP 66 22 → 43250 [ACK] Seq=39865 Ack=2125 Win=2127 Len=0 TSval=3335731 TSecr=19027217
   83 0.811844226 192.168.1.16 → 10.6.15.186  SSH 1110 Client: Encrypted packet (len=1044)
   84 0.813579756  10.6.15.186 → 192.168.1.16 TCP 66 22 → 43250 [ACK] Seq=39865 Ack=3169 Win=2127 Len=0 TSval=3335733 TSecr=19027218
   85 0.823812339 192.168.1.16 → 10.6.15.186  SSH 166 Client: Encrypted packet (len=100)
   86 0.825129195  10.6.15.186 → 192.168.1.16 TCP 66 22 → 43250 [ACK] Seq=39865 Ack=3269 Win=2127 Len=0 TSval=3335736 TSecr=19027221
   87 1.040843143 192.168.1.16 → 10.6.15.186  SSH 182 Client: Encrypted packet (len=116)
   88 1.042485731  10.6.15.186 → 192.168.1.16 SSH 142 Server: Encrypted packet (len=76)
   89 1.043045812  10.6.15.186 → 192.168.1.16 TCP 66 22 → 43250 [ACK] Seq=39941 Ack=3385 Win=2127 Len=0 TSval=3335790 TSecr=19027276
   90 1.083964160 192.168.1.16 → 10.6.15.186  TCP 66 43250 → 22 [ACK] Seq=3385 Ack=39941 Win=1810 Len=0 TSval=19027287 TSecr=3335786
   91 1.088247329  10.6.15.186 → 192.168.1.16 SSH 150 Server: Encrypted packet (len=84)
   92 1.088266723 192.168.1.16 → 10.6.15.186  TCP 66 43250 → 22 [ACK] Seq=3385 Ack=40025 Win=1810 Len=0 TSval=19027288 TSecr=3335802
   93 1.759945589 192.168.1.16 → 23.193.50.79 TCP 66 56290 → 443 [ACK] Seq=1 Ack=1 Win=455 Len=0 TSval=19027456 TSecr=756325310
   94 1.761599280  10.6.15.186 → 192.168.1.16 SSH 214 Server: Encrypted packet (len=148)
   95 1.761611418 192.168.1.16 → 10.6.15.186  TCP 66 43250 → 22 [ACK] Seq=3385 Ack=40173 Win=1810 Len=0 TSval=19027456 TSecr=3335854
   96 1.762116722  10.6.15.186 → 192.168.1.16 SSH 894 Server: Encrypted packet (len=828)
   97 1.762125957 192.168.1.16 → 10.6.15.186  TCP 66 43250 → 22 [ACK] Seq=3385 Ack=41001 Win=1810 Len=0 TSval=19027456 TSecr=3335862
   98 1.762136130  10.6.15.186 → 192.168.1.16 SSH 894 Server: [TCP Spurious Retransmission] , Encrypted packet (len=828)
   99 1.762140237 192.168.1.16 → 10.6.15.186  TCP 78 [TCP Dup ACK 97#1] 43250 → 22 [ACK] Seq=3385 Ack=41001 Win=1810 Len=0 TSval=19027456 TSecr=3335890 SLE=40173 SRE=41001
  100 1.762255567  10.6.15.186 → 192.168.1.16 SSH 214 Server: Encrypted packet (len=148)
  101 1.762261311 192.168.1.16 → 10.6.15.186  TCP 66 43250 → 22 [ACK] Seq=3385 Ack=41149 Win=1810 Len=0 TSval=19027456 TSecr=3335923
  102 1.762289491  10.6.15.186 → 192.168.1.16 SSH 182 Server: Encrypted packet (len=116)
  103 1.762294613 192.168.1.16 → 10.6.15.186  TCP 66 43250 → 22 [ACK] Seq=3385 Ack=41265 Win=1810 Len=0 TSval=19027456 TSecr=3335924
  104 1.779360803 192.168.1.16 → 10.6.15.186  SSH 1046 Client: Encrypted packet (len=980)
  105 1.987950457 192.168.1.16 → 10.6.15.186  TCP 1046 [TCP Retransmission] 43250 → 22 [PSH, ACK] Seq=3385 Ack=41265 Win=1810 Len=980 TSval=19027513 TSecr=3335924
  106 1.989779098  10.6.15.186 → 192.168.1.16 TCP 66 22 → 43250 [ACK] Seq=41265 Ack=4365 Win=2127 Len=0 TSval=3336005 TSecr=19027460
  107 1.991698958  10.6.15.186 → 192.168.1.16 TCP 78 [TCP Dup ACK 106#1] 22 → 43250 [ACK] Seq=41265 Ack=4365 Win=2127 Len=0 TSval=3336027 TSecr=19027513 SLE=3385 SRE=4365
  108 1.994357514 192.168.1.16 → 10.6.15.186  SSH 1514 Client: Encrypted packet (len=1448)
  109 1.994779793 192.168.1.16 → 10.6.15.186  SSH 454 Client: Encrypted packet (len=388)
  110 1.996690219  10.6.15.186 → 192.168.1.16 TCP 66 22 → 43250 [ACK] Seq=41265 Ack=6201 Win=2127 Len=0 TSval=3336029 TSecr=19027514
  111 2.001848650  10.6.15.186 → 192.168.1.16 SSH 110 Server: Encrypted packet (len=44)
  112 2.003668764 192.168.1.16 → 10.6.15.186  SSH 158 Client: Encrypted packet (len=92)
  113 2.003889122 192.168.1.16 → 10.6.15.186  SSH 606 Client: Encrypted packet (len=540)
  114 2.006131109  10.6.15.186 → 192.168.1.16 TCP 66 22 → 43250 [ACK] Seq=41309 Ack=6833 Win=2127 Len=0 TSval=3336031 TSecr=19027516
  115 2.008168354  10.6.15.186 → 192.168.1.16 SSH 222 Server: Encrypted packet (len=156)
  116 2.009478236  10.6.15.186 → 192.168.1.16 SSH 446 Server: Encrypted packet (len=380)
  117 2.009548871 192.168.1.16 → 10.6.15.186  TCP 66 43250 → 22 [ACK] Seq=6833 Ack=41845 Win=1810 Len=0 TSval=19027518 TSecr=3336032
  118 2.009563664 192.168.1.16 → 10.6.15.186  SSH 302 Client: Encrypted packet (len=236)
  119 2.047244004  10.6.15.186 → 192.168.1.16 TCP 66 22 → 43250 [ACK] Seq=41845 Ack=7069 Win=2127 Len=0 TSval=3336042 TSecr=19027518
  120 2.059497829 192.168.1.16 → 10.6.15.186  SSH 110 Client: Encrypted packet (len=44)
  121 2.060805870  10.6.15.186 → 192.168.1.16 TCP 66 22 → 43250 [ACK] Seq=41845 Ack=7113 Win=2127 Len=0 TSval=3336045 TSecr=19027530
  122 2.094673965  10.6.15.186 → 192.168.1.16 SSH 102 Server: Encrypted packet (len=36)
  123 2.095013839 192.168.1.16 → 10.6.15.186  SSH 166 Client: Encrypted packet (len=100)
  124 2.139528787  10.6.15.186 → 192.168.1.16 SSH 1514 Server: Encrypted packet (len=1448)
  125 2.139557891  10.6.15.186 → 192.168.1.16 SSH 558 Server: Encrypted packet (len=492)
  126 2.139567491 192.168.1.16 → 10.6.15.186  TCP 66 43250 → 22 [ACK] Seq=7213 Ack=43821 Win=1810 Len=0 TSval=19027550 TSecr=3336064
  127 2.140612539 192.168.1.16 → 10.6.15.186  SSH 206 Client: Encrypted packet (len=140)
  128 2.177479864  10.6.15.186 → 192.168.1.16 SSH 342 Server: Encrypted packet (len=276)
  129 2.178064675 192.168.1.16 → 10.6.15.186  SSH 734 Client: Encrypted packet (len=668)
  130 2.216356236  10.6.15.186 → 192.168.1.16 SSH 454 Server: Encrypted packet (len=388)
  131 2.216381494  10.6.15.186 → 192.168.1.16 SSH 102 Server: Encrypted packet (len=36)
  132 2.216443068 192.168.1.16 → 10.6.15.186  TCP 66 43250 → 22 [ACK] Seq=8021 Ack=44521 Win=1810 Len=0 TSval=19027570 TSecr=3336084
  133 2.217889445 192.168.1.16 → 10.6.15.186  SSH 138 Client: Encrypted packet (len=72)
  134 2.219706214  10.6.15.186 → 192.168.1.16 SSH 102 Server: Encrypted packet (len=36)
  135 2.259998418 192.168.1.16 → 10.6.15.186  TCP 66 43250 → 22 [ACK] Seq=8093 Ack=44557 Win=1810 Len=0 TSval=19027581 TSecr=3336085
  136 3.552021797 192.168.1.16 → 216.58.197.67 TCP 497 [TCP Retransmission] 43046 → 443 [PSH, ACK] Seq=1 Ack=1 Win=237 Len=431 TSval=19027904 TSecr=3106429147
  137 3.554337512  10.6.15.186 → 192.168.1.16 SSH 206 Server: Encrypted packet (len=140)
  138 3.554382115 192.168.1.16 → 10.6.15.186  TCP 66 43250 → 22 [ACK] Seq=8093 Ack=44697 Win=1810 Len=0 TSval=19027904 TSecr=3336129
  139 3.554409395  10.6.15.186 → 192.168.1.16 SSH 190 Server: Encrypted packet (len=124)
  140 3.554419426 192.168.1.16 → 10.6.15.186  TCP 66 43250 → 22 [ACK] Seq=8093 Ack=44821 Win=1810 Len=0 TSval=19027904 TSecr=3336154
  141 3.554432079  10.6.15.186 → 192.168.1.16 SSH 190 Server: [TCP Spurious Retransmission] , Encrypted packet (len=124)
  142 3.554438951 192.168.1.16 → 10.6.15.186  TCP 78 [TCP Dup ACK 140#1] 43250 → 22 [ACK] Seq=8093 Ack=44821 Win=1810 Len=0 TSval=19027904 TSecr=3336184 SLE=44697 SRE=44821
  143 3.554449969  10.6.15.186 → 192.168.1.16 SSH 330 Server: [TCP Spurious Retransmission] , Encrypted packet (len=264)
  144 3.554455433 192.168.1.16 → 10.6.15.186  TCP 78 [TCP Dup ACK 140#2] 43250 → 22 [ACK] Seq=8093 Ack=44821 Win=1810 Len=0 TSval=19027904 TSecr=3336311 SLE=44557 SRE=44821
  145 3.565785100 192.168.1.16 → 10.6.15.186  SSH 1046 Client: Encrypted packet (len=980)
  146 3.611088789  10.6.15.186 → 192.168.1.16 TCP 66 22 → 43250 [ACK] Seq=44821 Ack=9073 Win=2127 Len=0 TSval=3336432 TSecr=19027907
  147 4.741455097  10.6.15.186 → 192.168.1.16 SSH 206 Server: Encrypted packet (len=140)
  148 4.741517983  10.6.15.186 → 192.168.1.16 TCP 206 [TCP Retransmission] 22 → 43250 [PSH, ACK] Seq=44821 Ack=9073 Win=2127 Len=140 TSval=3336665 TSecr=19027907
  149 4.741534425 192.168.1.16 → 10.6.15.186  TCP 78 43250 → 22 [ACK] Seq=9073 Ack=44961 Win=1810 Len=0 TSval=19028201 TSecr=3336665 SLE=44821 SRE=44961
  150 8.672540240 192.168.1.16 → 91.189.94.4  NTP 90 NTP Version 4, client
  151 9.730921630  10.6.15.186 → 192.168.1.16 SSH 102 Server: Encrypted packet (len=36)
  152 9.730950210 192.168.1.16 → 10.6.15.186  TCP 66 43250 → 22 [ACK] Seq=9073 Ack=44997 Win=1810 Len=0 TSval=19029448 TSecr=3337796
  153 10.464025277 192.168.1.16 → 216.58.197.67 TCP 497 [TCP Retransmission] 43046 → 443 [PSH, ACK] Seq=1 Ack=1 Win=237 Len=431 TSval=19029632 TSecr=3106429147
  154 11.078975314 192.168.1.16 → 10.6.15.186  SSH 1514 Client: Encrypted packet (len=1448)
  155 11.080480189 192.168.1.16 → 10.6.15.186  SSH 294 Client: Encrypted packet (len=228)
  156 11.083512863  10.6.15.186 → 192.168.1.16 TCP 66 22 → 43250 [ACK] Seq=44997 Ack=10521 Win=2127 Len=0 TSval=3338300 TSecr=19029785
  157 11.083548924  10.6.15.186 → 192.168.1.16 TCP 66 22 → 43250 [ACK] Seq=44997 Ack=10749 Win=2127 Len=0 TSval=3338300 TSecr=19029786
  158 11.088203769  10.6.15.186 → 192.168.1.16 SSH 142 Server: Encrypted packet (len=76)
  159 11.088237029 192.168.1.16 → 10.6.15.186  TCP 66 43250 → 22 [ACK] Seq=10749 Ack=45073 Win=1810 Len=0 TSval=19029788 TSecr=3338302
  160 12.738830782  10.6.15.186 → 192.168.1.16 SSH 182 Server: Encrypted packet (len=116)
  161 12.738872515 192.168.1.16 → 10.6.15.186  TCP 66 43250 → 22 [ACK] Seq=10749 Ack=45189 Win=1810 Len=0 TSval=19030200 TSecr=3338330
  162 12.738925690  10.6.15.186 → 192.168.1.16 SSH 1206 Server: Encrypted packet (len=1140)
  163 12.738939029 192.168.1.16 → 10.6.15.186  TCP 66 43250 → 22 [ACK] Seq=10749 Ack=46329 Win=1810 Len=0 TSval=19030200 TSecr=3338331
  164 12.739065290  10.6.15.186 → 192.168.1.16 SSH 1206 Server: [TCP Spurious Retransmission] , Encrypted packet (len=1140)
  165 12.739073513 192.168.1.16 → 10.6.15.186  TCP 78 [TCP Dup ACK 163#1] 43250 → 22 [ACK] Seq=10749 Ack=46329 Win=1810 Len=0 TSval=19030200 TSecr=3338439 SLE=45189 SRE=46329
  166 12.740406045  10.6.15.186 → 192.168.1.16 SSH 102 Server: Encrypted packet (len=36)
  167 12.740422471 192.168.1.16 → 10.6.15.186  TCP 66 43250 → 22 [ACK] Seq=10749 Ack=46365 Win=1810 Len=0 TSval=19030201 TSecr=3338715
  168 12.740639829 192.168.1.16 → 10.6.15.186  SSH 134 Client: Encrypted packet (len=68)
  169 12.779056675  10.6.15.186 → 192.168.1.16 TCP 66 22 → 43250 [ACK] Seq=46365 Ack=10817 Win=2127 Len=0 TSval=3338725 TSecr=19030201
  170 16.095970876 192.168.1.16 → 74.125.68.188 TCP 66 40830 → 443 [ACK] Seq=1 Ack=1 Win=304 Len=0 TSval=19031040 TSecr=4294932451
  171 16.132179926 74.125.68.188 → 192.168.1.16 TCP 66 [TCP ACKed unseen segment] 443 → 40830 [ACK] Seq=1 Ack=2 Win=179 Len=0 TSval=10211 TSecr=18929456
  172 16.267997010 192.168.1.16 → 66.235.139.15 TCP 66 39132 → 443 [ACK] Seq=1 Ack=1 Win=40544 Len=0 TSval=19031083 TSecr=2189810043
  173 17.762021521 66.235.139.15 → 192.168.1.16 TCP 66 [TCP ACKed unseen segment] 443 → 39132 [ACK] Seq=1 Ack=2 Win=5873 Len=0 TSval=2189855271 TSecr=18754821
  174 20.192029441 192.168.1.16 → 63.215.202.75 TCP 54 59606 → 443 [ACK] Seq=1 Ack=1 Win=40880 Len=0
  175 20.946340566 192.168.1.16 → 10.6.15.186  SSH 1514 Client: Encrypted packet (len=1448)
  176 20.948125883 192.168.1.16 → 10.6.15.186  SSH 438 Client: Encrypted packet (len=372)
  177 20.949222328 63.215.202.75 → 192.168.1.16 TCP 60 [TCP ACKed unseen segment] 443 → 59606 [ACK] Seq=1 Ack=2 Win=40958 Len=0
  178 20.950312950  10.6.15.186 → 192.168.1.16 TCP 66 22 → 43250 [ACK] Seq=46365 Ack=12265 Win=2127 Len=0 TSval=3340767 TSecr=19032252
  179 20.950317763  10.6.15.186 → 192.168.1.16 TCP 66 22 → 43250 [ACK] Seq=46365 Ack=12637 Win=2127 Len=0 TSval=3340767 TSecr=19032253
  180 22.785939596  10.6.15.186 → 192.168.1.16 SSH 134 Server: Encrypted packet (len=68)
  181 22.785967659  10.6.15.186 → 192.168.1.16 SSH 206 Server: Encrypted packet (len=140)
  182 22.785975487  10.6.15.186 → 192.168.1.16 TCP 206 [TCP Retransmission] 22 → 43250 [PSH, ACK] Seq=46433 Ack=12637 Win=2127 Len=140 TSval=3341122 TSecr=19032253
  183 22.785987004 192.168.1.16 → 10.6.15.186  TCP 78 43250 → 22 [ACK] Seq=12637 Ack=46573 Win=1810 Len=0 TSval=19032712 TSecr=3340841 SLE=46433 SRE=46573
  184 24.287952783 192.168.1.16 → 216.58.197.67 TCP 497 [TCP Retransmission] 43046 → 443 [PSH, ACK] Seq=1 Ack=1 Win=237 Len=431 TSval=19033088 TSecr=3106429147
  185 26.424026221 192.168.1.16 → 104.244.42.136 TCP 66 51464 → 443 [ACK] Seq=1 Ack=1 Win=410 Len=0 TSval=19033622 TSecr=297760733
  186 27.746045953 104.244.42.136 → 192.168.1.16 TCP 66 [TCP ACKed unseen segment] 443 → 51464 [ACK] Seq=1 Ack=2 Win=144 Len=0 TSval=297805869 TSecr=18815142
  187 28.745966328  192.168.1.1 → 255.255.255.255 DHCP 322 DHCP Offer    - Transaction ID 0x978ab46f
  188 29.762009686  10.6.15.186 → 192.168.1.16 SSH 134 Server: Encrypted packet (len=68)
  189 29.762053231 192.168.1.16 → 10.6.15.186  TCP 66 43250 → 22 [ACK] Seq=12637 Ack=46641 Win=1810 Len=0 TSval=19034456 TSecr=3342797
  190 29.762337943  10.6.15.186 → 192.168.1.16 SSH 102 Server: Encrypted packet (len=36)
  191 29.762345677 192.168.1.16 → 10.6.15.186  TCP 66 43250 → 22 [ACK] Seq=12637 Ack=46677 Win=1810 Len=0 TSval=19034456 TSecr=3342797
  192 29.762861196  10.6.15.186 → 192.168.1.16 SSH 126 Server: Encrypted packet (len=60)
  193 29.762892100 192.168.1.16 → 10.6.15.186  TCP 66 43250 → 22 [ACK] Seq=12637 Ack=46737 Win=1810 Len=0 TSval=19034456 TSecr=3342797
  194 29.763887988  10.6.15.186 → 192.168.1.16 SSH 198 Server: Encrypted packet (len=132)
  195 29.763905621 192.168.1.16 → 10.6.15.186  TCP 66 43250 → 22 [ACK] Seq=12637 Ack=46869 Win=1810 Len=0 TSval=19034456 TSecr=3342971
  196 32.672572997 192.168.1.16 → 139.59.21.22 NTP 90 NTP Version 4, client
  197 32.676846669 10.119.73.122 → 192.168.1.16 ICMP 110 Destination unreachable (Communication administratively filtered)
