    1 0.000000000  10.6.15.144 → 192.168.1.16 SSH 1514 Server: Encrypted packet (len=1448)
    2 0.000184351  10.6.15.144 → 192.168.1.16 SSH 1514 Server: Encrypted packet (len=1448)
    3 0.000198510 192.168.1.16 → 10.6.15.144  TCP 66 57328 → 22 [ACK] Seq=1 Ack=2897 Win=2987 Len=0 TSval=13832088 TSecr=5565222
    4 0.000795376  10.6.15.144 → 192.168.1.16 SSH 110 Server: Encrypted packet (len=44)
    5 0.000828239 192.168.1.16 → 10.6.15.144  TCP 66 57328 → 22 [ACK] Seq=1 Ack=2941 Win=2987 Len=0 TSval=13832088 TSecr=5565222
    6 0.014049970  10.6.15.144 → 192.168.1.16 SSH 1514 Server: Encrypted packet (len=1448)
    7 0.014585794  10.6.15.144 → 192.168.1.16 SSH 1514 Server: Encrypted packet (len=1448)
    8 0.014606486 192.168.1.16 → 10.6.15.144  TCP 66 57328 → 22 [ACK] Seq=1 Ack=5837 Win=2987 Len=0 TSval=13832091 TSecr=5565226
    9 0.014624471  10.6.15.144 → 192.168.1.16 SSH 110 Server: Encrypted packet (len=44)
   10 0.014663418 192.168.1.16 → 10.6.15.144  TCP 66 57328 → 22 [ACK] Seq=1 Ack=5881 Win=2987 Len=0 TSval=13832091 TSecr=5565226
   11 0.027131785  10.6.15.144 → 192.168.1.16 SSH 414 Server: Encrypted packet (len=348)
   12 0.027206584 192.168.1.16 → 10.6.15.144  TCP 66 57328 → 22 [ACK] Seq=1 Ack=6229 Win=2987 Len=0 TSval=13832094 TSecr=5565229
   13 0.532496705 192.168.1.16 → 10.6.15.144  SSH 438 Client: Encrypted packet (len=372)
   14 0.533619838 192.168.1.16 → 10.6.15.144  SSH 134 Client: Encrypted packet (len=68)
   15 0.534312670 192.168.1.16 → 10.6.15.144  SSH 438 Client: Encrypted packet (len=372)
   16 0.534376310  10.6.15.144 → 192.168.1.16 SSH 110 Server: Encrypted packet (len=44)
   17 0.534386965 192.168.1.16 → 10.6.15.144  TCP 66 57328 → 22 [ACK] Seq=813 Ack=6273 Win=2987 Len=0 TSval=13832221 TSecr=5565346
   18 0.534758352 192.168.1.16 → 10.6.15.144  SSH 470 Client: Encrypted packet (len=404)
   19 0.535116754  10.6.15.144 → 192.168.1.16 TCP 66 22 → 57328 [ACK] Seq=6273 Ack=441 Win=1452 Len=0 TSval=5565356 TSecr=13832221
   20 0.536212901  10.6.15.144 → 192.168.1.16 TCP 66 22 → 57328 [ACK] Seq=6273 Ack=1217 Win=1452 Len=0 TSval=5565357 TSecr=13832221
   21 0.538251296  10.6.15.144 → 192.168.1.16 SSH 318 Server: Encrypted packet (len=252)
   22 0.538270371  10.6.15.144 → 192.168.1.16 SSH 142 Server: Encrypted packet (len=76)
   23 0.538324030 192.168.1.16 → 10.6.15.144  TCP 66 57328 → 22 [ACK] Seq=1217 Ack=6601 Win=2987 Len=0 TSval=13832222 TSecr=5565357
   24 0.539098457 192.168.1.16 → 10.6.15.144  SSH 134 Client: Encrypted packet (len=68)
   25 0.539993169  10.6.15.144 → 192.168.1.16 SSH 214 Server: Encrypted packet (len=148)
   26 0.542331888 192.168.1.16 → 10.6.15.144  SSH 230 Client: Encrypted packet (len=164)
   27 0.542557802 192.168.1.16 → 10.6.15.144  SSH 134 Client: Encrypted packet (len=68)
   28 0.543877726  10.6.15.144 → 192.168.1.16 TCP 66 22 → 57328 [ACK] Seq=6749 Ack=1517 Win=1452 Len=0 TSval=5565359 TSecr=13832222
   29 0.546312118 192.168.1.16 → 10.6.15.144  SSH 742 Client: Encrypted packet (len=676)
   30 0.548303072  10.6.15.144 → 192.168.1.16 SSH 142 Server: Encrypted packet (len=76)
   31 0.548925764  10.6.15.144 → 192.168.1.16 SSH 382 Server: Encrypted packet (len=316)
   32 0.548961262 192.168.1.16 → 10.6.15.144  TCP 66 57328 → 22 [ACK] Seq=2193 Ack=7141 Win=2987 Len=0 TSval=13832225 TSecr=5565360
   33 0.549550281 192.168.1.16 → 10.6.15.144  SSH 134 Client: Encrypted packet (len=68)
   34 0.569477047 192.168.1.16 → 10.6.15.144  SSH 102 Client: Encrypted packet (len=36)
   35 0.571013026  10.6.15.144 → 192.168.1.16 TCP 66 22 → 57328 [ACK] Seq=7141 Ack=2297 Win=1452 Len=0 TSval=5565365 TSecr=13832225
   36 0.572477807  10.6.15.144 → 192.168.1.16 SSH 1214 Server: Encrypted packet (len=1148)
   37 0.573221603  10.6.15.144 → 192.168.1.16 SSH 1514 Server: Encrypted packet (len=1448)
   38 0.573231740 192.168.1.16 → 10.6.15.144  TCP 66 57328 → 22 [ACK] Seq=2297 Ack=9737 Win=2987 Len=0 TSval=13832231 TSecr=5565366
   39 0.573247561  10.6.15.144 → 192.168.1.16 SSH 326 Server: Encrypted packet (len=260)
   40 0.574280613 192.168.1.16 → 10.6.15.144  SSH 334 Client: Encrypted packet (len=268)
   41 0.595428606  10.6.15.144 → 192.168.1.16 SSH 390 Server: Encrypted packet (len=324)
   42 0.611152303  10.6.15.144 → 192.168.1.16 SSH 494 Server: Encrypted packet (len=428)
   43 0.611210395 192.168.1.16 → 10.6.15.144  TCP 66 57328 → 22 [ACK] Seq=2565 Ack=10749 Win=2987 Len=0 TSval=13832240 TSecr=5565371
   44 0.664805278 192.168.1.16 → 10.6.15.144  SSH 1110 Client: Encrypted packet (len=1044)
   45 0.701756327  10.6.15.144 → 192.168.1.16 SSH 454 Server: Encrypted packet (len=388)
   46 0.701780964  10.6.15.144 → 192.168.1.16 SSH 102 Server: Encrypted packet (len=36)
   47 0.701846411 192.168.1.16 → 10.6.15.144  TCP 66 57328 → 22 [ACK] Seq=3609 Ack=11173 Win=2987 Len=0 TSval=13832263 TSecr=5565398
   48 0.703168134 192.168.1.16 → 10.6.15.144  SSH 138 Client: Encrypted packet (len=72)
   49 0.704811699  10.6.15.144 → 192.168.1.16 SSH 102 Server: Encrypted packet (len=36)
   50 0.747755861 192.168.1.16 → 10.6.15.144  TCP 66 57328 → 22 [ACK] Seq=3681 Ack=11209 Win=2987 Len=0 TSval=13832275 TSecr=5565399
   51 0.802317955  10.6.15.144 → 192.168.1.16 SSH 110 Server: Encrypted packet (len=44)
   52 0.802390640 192.168.1.16 → 10.6.15.144  TCP 66 57328 → 22 [ACK] Seq=3681 Ack=11253 Win=2987 Len=0 TSval=13832288 TSecr=5565423
   53 0.802703473 192.168.1.16 → 10.6.15.144  SSH 398 Client: Encrypted packet (len=332)
   54 0.845509288  10.6.15.144 → 192.168.1.16 TCP 66 22 → 57328 [ACK] Seq=11253 Ack=4013 Win=1452 Len=0 TSval=5565434 TSecr=13832288
   55 2.466749796  10.6.15.144 → 192.168.1.16 SSH 230 Server: Encrypted packet (len=164)
   56 2.466842452  10.6.15.144 → 192.168.1.16 TCP 230 [TCP Retransmission] 22 → 57328 [PSH, ACK] Seq=11253 Ack=4013 Win=1452 Len=164 TSval=5565536 TSecr=13832288
   57 2.466851196 192.168.1.16 → 10.6.15.144  TCP 78 57328 → 22 [ACK] Seq=4013 Ack=11417 Win=2987 Len=0 TSval=13832704 TSecr=5565536 SLE=11253 SRE=11417
   58 2.467017842  10.6.15.144 → 192.168.1.16 SSH 230 Server: [TCP Spurious Retransmission] , Encrypted packet (len=164)
   59 2.467025216 192.168.1.16 → 10.6.15.144  TCP 78 [TCP Dup ACK 57#1] 57328 → 22 [ACK] Seq=4013 Ack=11417 Win=2987 Len=0 TSval=13832704 TSecr=5565590 SLE=11253 SRE=11417
   60 2.467093239 192.168.1.16 → 10.6.15.144  SSH 134 Client: Encrypted packet (len=68)
   61 2.467176932  10.6.15.144 → 192.168.1.16 SSH 230 Server: [TCP Spurious Retransmission] , Encrypted packet (len=164)
   62 2.467184433 192.168.1.16 → 10.6.15.144  TCP 78 [TCP Dup ACK 57#2] 57328 → 22 [ACK] Seq=4081 Ack=11417 Win=2987 Len=0 TSval=13832704 TSecr=5565698 SLE=11253 SRE=11417
   63 2.467568325 192.168.1.16 → 10.6.15.144  SSH 838 Client: Encrypted packet (len=772)
   64 2.468783676  10.6.15.144 → 192.168.1.16 SSH 342 Server: Encrypted packet (len=276)
   65 2.468849620  10.6.15.144 → 192.168.1.16 TCP 66 22 → 57328 [ACK] Seq=11693 Ack=4081 Win=1452 Len=0 TSval=5565840 TSecr=13832704
   66 2.469254491  10.6.15.144 → 192.168.1.16 TCP 66 22 → 57328 [ACK] Seq=11693 Ack=4853 Win=1452 Len=0 TSval=5565840 TSecr=13832704
   67 2.503367874 192.168.1.16 → 10.6.15.144  SSH 214 Client: Encrypted packet (len=148)
   68 2.504743987  10.6.15.144 → 192.168.1.16 TCP 66 22 → 57328 [ACK] Seq=11693 Ack=5001 Win=1452 Len=0 TSval=5565849 TSecr=13832713
   69 3.384356408 192.168.1.16 → 139.59.21.22 NTP 90 NTP Version 4, client
   70 3.388055993  10.6.15.144 → 192.168.1.16 SSH 150 Server: Encrypted packet (len=84)
   71 3.388155799  10.6.15.144 → 192.168.1.16 SSH 262 Server: Encrypted packet (len=196)
   72 3.388194602 192.168.1.16 → 10.6.15.144  TCP 66 57328 → 22 [ACK] Seq=5001 Ack=11973 Win=2987 Len=0 TSval=13832935 TSecr=5565885
   73 3.388338398  10.6.15.144 → 192.168.1.16 SSH 302 Server: Encrypted packet (len=236)
   74 3.389682648 10.119.73.122 → 192.168.1.16 ICMP 110 Destination unreachable (Communication administratively filtered)
   75 3.390723422 192.168.1.16 → 10.6.15.144  SSH 238 Client: Encrypted packet (len=172)
   76 3.391465802 192.168.1.16 → 10.6.15.144  SSH 142 Client: Encrypted packet (len=76)
   77 3.392167913  10.6.15.144 → 192.168.1.16 TCP 66 22 → 57328 [ACK] Seq=12209 Ack=5173 Win=1452 Len=0 TSval=5566071 TSecr=13832935
   78 3.392927562  10.6.15.144 → 192.168.1.16 TCP 66 22 → 57328 [ACK] Seq=12209 Ack=5249 Win=1452 Len=0 TSval=5566071 TSecr=13832935
   79 3.658211276 192.168.1.16 → 10.6.15.144  SSH 1038 Client: Encrypted packet (len=972)
   80 3.661707259 192.168.1.16 → 10.6.15.144  SSH 230 Client: Encrypted packet (len=164)
   81 3.664239994  10.6.15.144 → 192.168.1.16 TCP 66 22 → 57328 [ACK] Seq=12209 Ack=6221 Win=1452 Len=0 TSval=5566138 TSecr=13833002
   82 3.665289000  10.6.15.144 → 192.168.1.16 TCP 66 22 → 57328 [ACK] Seq=12209 Ack=6385 Win=1452 Len=0 TSval=5566139 TSecr=13833003
   83 4.511794354 192.168.1.16 → 216.58.197.78 TCP 66 32882 → 80 [ACK] Seq=1 Ack=1 Win=251 Len=0 TSval=13833216 TSecr=1034322774
   84 4.514515909  10.6.15.144 → 192.168.1.16 SSH 142 Server: Encrypted packet (len=76)
   85 4.514600943  10.6.15.144 → 192.168.1.16 SSH 206 Server: Encrypted packet (len=140)
   86 4.514653433 192.168.1.16 → 10.6.15.144  TCP 66 57328 → 22 [ACK] Seq=6385 Ack=12425 Win=2987 Len=0 TSval=13833216 TSecr=5566201
   87 4.514757298  10.6.15.144 → 192.168.1.16 SSH 206 Server: [TCP Spurious Retransmission] , Encrypted packet (len=140)
   88 4.514764122 192.168.1.16 → 10.6.15.144  TCP 78 [TCP Dup ACK 86#1] 57328 → 22 [ACK] Seq=6385 Ack=12425 Win=2987 Len=0 TSval=13833216 TSecr=5566324 SLE=12285 SRE=12425
   89 4.515860926 192.168.1.16 → 10.6.15.144  SSH 134 Client: Encrypted packet (len=68)
   90 4.517935340  10.6.15.144 → 192.168.1.16 TCP 66 22 → 57328 [ACK] Seq=12425 Ack=6453 Win=1452 Len=0 TSval=5566352 TSecr=13833217
   91 4.657827177 192.168.1.16 → 10.6.15.144  SSH 118 Client: Encrypted packet (len=52)
   92 4.660237130  10.6.15.144 → 192.168.1.16 TCP 66 22 → 57328 [ACK] Seq=12425 Ack=6505 Win=1452 Len=0 TSval=5566388 TSecr=13833252
   93 6.465795427  10.6.15.144 → 192.168.1.16 SSH 102 Server: Encrypted packet (len=36)
   94 6.465828713  10.6.15.144 → 192.168.1.16 TCP 102 [TCP Retransmission] 22 → 57328 [PSH, ACK] Seq=12425 Ack=6505 Win=1452 Len=36 TSval=5566601 TSecr=13833252
   95 6.465843573 192.168.1.16 → 10.6.15.144  TCP 78 57328 → 22 [ACK] Seq=6505 Ack=12461 Win=2987 Len=0 TSval=13833704 TSecr=5566601 SLE=12425 SRE=12461
   96 6.466339768 192.168.1.16 → 10.6.15.144  SSH 206 Client: Encrypted packet (len=140)
   97 6.468595593  10.6.15.144 → 192.168.1.16 TCP 66 22 → 57328 [ACK] Seq=12461 Ack=6645 Win=1452 Len=0 TSval=5566840 TSecr=13833704
   98 6.665568349 192.168.1.16 → 10.6.15.144  SSH 102 Client: Encrypted packet (len=36)
   99 6.667006876 192.168.1.16 → 10.6.15.144  SSH 102 Client: Encrypted packet (len=36)
  100 6.668746557 192.168.1.16 → 10.6.15.144  SSH 102 Client: Encrypted packet (len=36)
  101 6.669273274 192.168.1.16 → 10.6.15.144  SSH 102 Client: Encrypted packet (len=36)
  102 6.674592082  10.6.15.144 → 192.168.1.16 TCP 66 22 → 57328 [ACK] Seq=12461 Ack=6681 Win=1452 Len=0 TSval=5566890 TSecr=13833754
  103 6.677404787  10.6.15.144 → 192.168.1.16 TCP 66 22 → 57328 [ACK] Seq=12461 Ack=6717 Win=1452 Len=0 TSval=5566890 TSecr=13833754
  104 6.677421968  10.6.15.144 → 192.168.1.16 SSH 138 Server: Encrypted packet (len=72)
  105 6.677639421 192.168.1.16 → 10.6.15.144  SSH 102 Client: Encrypted packet (len=36)
  106 6.677912492  10.6.15.144 → 192.168.1.16 TCP 66 22 → 57328 [ACK] Seq=12533 Ack=6789 Win=1452 Len=0 TSval=5566890 TSecr=13833755
  107 6.701557990  10.6.15.144 → 192.168.1.16 SSH 1514 Server: Encrypted packet (len=1448)
  108 6.701764481  10.6.15.144 → 192.168.1.16 SSH 1510 Server: Encrypted packet (len=1444)
  109 6.701777268 192.168.1.16 → 10.6.15.144  TCP 66 57328 → 22 [ACK] Seq=6825 Ack=15425 Win=2987 Len=0 TSval=13833763 TSecr=5566895
  110 6.715341911  10.6.15.144 → 192.168.1.16 SSH 678 Server: Encrypted packet (len=612)
  111 6.716391956 192.168.1.16 → 10.6.15.144  SSH 206 Client: Encrypted packet (len=140)
  112 6.728860330  10.6.15.144 → 192.168.1.16 SSH 134 Server: Encrypted packet (len=68)
  113 6.728885470  10.6.15.144 → 192.168.1.16 SSH 138 Server: Encrypted packet (len=72)
  114 6.728951040 192.168.1.16 → 10.6.15.144  TCP 66 57328 → 22 [ACK] Seq=6965 Ack=16177 Win=2987 Len=0 TSval=13833770 TSecr=5566903
  115 6.729116076 192.168.1.16 → 10.6.15.144  SSH 102 Client: Encrypted packet (len=36)
  116 6.776242252  10.6.15.144 → 192.168.1.16 TCP 66 22 → 57328 [ACK] Seq=16177 Ack=7001 Win=1452 Len=0 TSval=5566915 TSecr=13833770
  117 8.449723788  10.6.15.144 → 192.168.1.16 SSH 102 Server: Encrypted packet (len=36)
  118 8.449747628  10.6.15.144 → 192.168.1.16 SSH 102 Server: Encrypted packet (len=36)
  119 8.449754510  10.6.15.144 → 192.168.1.16 SSH 142 Server: Encrypted packet (len=76)
  120 8.449760596  10.6.15.144 → 192.168.1.16 TCP 142 [TCP Retransmission] 22 → 57328 [PSH, ACK] Seq=16249 Ack=7001 Win=1452 Len=76 TSval=5567069 TSecr=13833770
  121 8.449770991 192.168.1.16 → 10.6.15.144  TCP 78 57328 → 22 [ACK] Seq=7001 Ack=16325 Win=2987 Len=0 TSval=13834200 TSecr=5566945 SLE=16249 SRE=16325
  122 8.450252813 192.168.1.16 → 10.6.15.144  SSH 158 Client: Encrypted packet (len=92)
  123 8.450440342 192.168.1.16 → 10.6.15.144  SSH 842 Client: Encrypted packet (len=776)
  124 8.451699913  10.6.15.144 → 192.168.1.16 TCP 66 22 → 57328 [ACK] Seq=16325 Ack=7093 Win=1452 Len=0 TSval=5567336 TSecr=13834200
  125 8.452182195  10.6.15.144 → 192.168.1.16 TCP 66 22 → 57328 [ACK] Seq=16325 Ack=7869 Win=1452 Len=0 TSval=5567336 TSecr=13834200
  126 8.607812904 192.168.1.16 → 54.77.5.47   TCP 66 53566 → 8282 [ACK] Seq=1 Ack=1 Win=296 Len=0 TSval=13834240 TSecr=306298360
  127 8.674030300  10.6.15.144 → 192.168.1.16 SSH 222 Server: Encrypted packet (len=156)
  128 8.674051936  10.6.15.144 → 192.168.1.16 SSH 182 Server: Encrypted packet (len=116)
  129 8.674115192 192.168.1.16 → 10.6.15.144  TCP 66 57328 → 22 [ACK] Seq=7869 Ack=16597 Win=2987 Len=0 TSval=13834256 TSecr=5567391
  130 8.674365039 192.168.1.16 → 10.6.15.144  SSH 134 Client: Encrypted packet (len=68)
  131 8.674822161 192.168.1.16 → 10.6.15.144  SSH 650 Client: Encrypted packet (len=584)
  132 8.675124960 192.168.1.16 → 10.6.15.144  SSH 582 Client: Encrypted packet (len=516)
  133 8.676666699  10.6.15.144 → 192.168.1.16 TCP 66 22 → 57328 [ACK] Seq=16597 Ack=7937 Win=1452 Len=0 TSval=5567392 TSecr=13834256
  134 8.676684995  10.6.15.144 → 192.168.1.16 SSH 350 Server: Encrypted packet (len=284)
  135 8.676964667  10.6.15.144 → 192.168.1.16 TCP 66 22 → 57328 [ACK] Seq=16881 Ack=9037 Win=1452 Len=0 TSval=5567392 TSecr=13834256
  136 8.719817032 192.168.1.16 → 10.6.15.144  TCP 66 57328 → 22 [ACK] Seq=9037 Ack=16881 Win=2987 Len=0 TSval=13834268 TSecr=5567392
  137 8.764794753   54.77.5.47 → 192.168.1.16 TCP 66 [TCP ACKed unseen segment] 8282 → 53566 [ACK] Seq=1 Ack=2 Win=121 Len=0 TSval=306309913 TSecr=13776832
  138 10.467361447  10.6.15.144 → 192.168.1.16 SSH 766 Server: Encrypted packet (len=700)
  139 10.467383729 192.168.1.16 → 10.6.15.144  TCP 66 57328 → 22 [ACK] Seq=9037 Ack=17581 Win=2987 Len=0 TSval=13834704 TSecr=5567447
  140 10.467429297  10.6.15.144 → 192.168.1.16 SSH 766 Server: Encrypted packet (len=700)
  141 10.467434601 192.168.1.16 → 10.6.15.144  TCP 66 57328 → 22 [ACK] Seq=9037 Ack=18281 Win=2987 Len=0 TSval=13834704 TSecr=5567447
  142 10.467524898  10.6.15.144 → 192.168.1.16 SSH 766 Server: [TCP Spurious Retransmission] , Encrypted packet (len=700)
  143 10.467528981 192.168.1.16 → 10.6.15.144  TCP 78 [TCP Dup ACK 141#1] 57328 → 22 [ACK] Seq=9037 Ack=18281 Win=2987 Len=0 TSval=13834704 TSecr=5567599 SLE=17581 SRE=18281
  144 10.469175273  10.6.15.144 → 192.168.1.16 SSH 458 Server: Encrypted packet (len=392)
  145 10.469189987 192.168.1.16 → 10.6.15.144  TCP 66 57328 → 22 [ACK] Seq=9037 Ack=18673 Win=2987 Len=0 TSval=13834705 TSecr=5567840
  146 10.859180826 192.168.1.16 → 10.6.15.144  SSH 1514 Client: Encrypted packet (len=1448)
  147 10.861938594 192.168.1.16 → 10.6.15.144  SSH 398 Client: Encrypted packet (len=332)
  148 10.863783731  10.6.15.144 → 192.168.1.16 TCP 66 22 → 57328 [ACK] Seq=18673 Ack=10817 Win=1452 Len=0 TSval=5567939 TSecr=13834802
  149 10.871304902  10.6.15.144 → 192.168.1.16 SSH 142 Server: Encrypted packet (len=76)
  150 10.871322629 192.168.1.16 → 10.6.15.144  TCP 66 57328 → 22 [ACK] Seq=10817 Ack=18749 Win=2987 Len=0 TSval=13834805 TSecr=5567940
  151 12.482225294  10.6.15.144 → 192.168.1.16 SSH 790 Server: Encrypted packet (len=724)
  152 12.482259814 192.168.1.16 → 10.6.15.144  TCP 66 57328 → 22 [ACK] Seq=10817 Ack=19473 Win=2987 Len=0 TSval=13835208 TSecr=5567972
  153 12.482276897  10.6.15.144 → 192.168.1.16 SSH 454 Server: Encrypted packet (len=388)
  154 12.482283109 192.168.1.16 → 10.6.15.144  TCP 66 57328 → 22 [ACK] Seq=10817 Ack=19861 Win=2987 Len=0 TSval=13835208 TSecr=5567972
  155 12.482291110  10.6.15.144 → 192.168.1.16 SSH 454 Server: [TCP Spurious Retransmission] , Encrypted packet (len=388)
  156 12.482295865 192.168.1.16 → 10.6.15.144  TCP 78 [TCP Dup ACK 154#1] 57328 → 22 [ACK] Seq=10817 Ack=19861 Win=2987 Len=0 TSval=13835208 TSecr=5568204 SLE=19473 SRE=19861
  157 12.483473730 192.168.1.16 → 10.6.15.144  SSH 134 Client: Encrypted packet (len=68)
  158 12.523863573  10.6.15.144 → 192.168.1.16 TCP 66 22 → 57328 [ACK] Seq=19861 Ack=10885 Win=1452 Len=0 TSval=5568354 TSecr=13835208
  159 16.658220925 192.168.1.16 → 10.6.15.144  SSH 138 Client: Encrypted packet (len=72)
  160 16.661305319 192.168.1.16 → 10.6.15.144  SSH 426 Client: Encrypted packet (len=360)
  161 16.662473649  10.6.15.144 → 192.168.1.16 TCP 66 22 → 57328 [ACK] Seq=19861 Ack=10957 Win=1452 Len=0 TSval=5569388 TSecr=13836252
  162 16.662850496  10.6.15.144 → 192.168.1.16 TCP 66 22 → 57328 [ACK] Seq=19861 Ack=11317 Win=1452 Len=0 TSval=5569388 TSecr=13836253
  163 16.663239961  10.6.15.144 → 192.168.1.16 SSH 102 Server: Encrypted packet (len=36)
  164 16.663698992  10.6.15.144 → 192.168.1.16 SSH 174 Server: Encrypted packet (len=108)
  165 16.663722503 192.168.1.16 → 10.6.15.144  TCP 66 57328 → 22 [ACK] Seq=11317 Ack=20005 Win=2987 Len=0 TSval=13836253 TSecr=5569388
  166 16.699345808  10.6.15.144 → 192.168.1.16 SSH 138 Server: Encrypted packet (len=72)
  167 16.699540195 192.168.1.16 → 10.6.15.144  SSH 102 Client: Encrypted packet (len=36)
  168 16.708963946  10.6.15.144 → 192.168.1.16 SSH 134 Server: Encrypted packet (len=68)
  169 16.709345051  10.6.15.144 → 192.168.1.16 SSH 138 Server: Encrypted packet (len=72)
  170 16.709369812 192.168.1.16 → 10.6.15.144  TCP 66 57328 → 22 [ACK] Seq=11353 Ack=20217 Win=2987 Len=0 TSval=13836265 TSecr=5569400
  171 16.709466443 192.168.1.16 → 10.6.15.144  SSH 102 Client: Encrypted packet (len=36)
  172 16.709998982  10.6.15.144 → 192.168.1.16 SSH 126 Server: Encrypted packet (len=60)
  173 16.712669811  10.6.15.144 → 192.168.1.16 SSH 138 Server: Encrypted packet (len=72)
  174 16.712740686 192.168.1.16 → 10.6.15.144  TCP 66 57328 → 22 [ACK] Seq=11389 Ack=20349 Win=2987 Len=0 TSval=13836266 TSecr=5569400
  175 16.712866401 192.168.1.16 → 10.6.15.144  SSH 102 Client: Encrypted packet (len=36)
  176 16.714731458  10.6.15.144 → 192.168.1.16 TCP 66 22 → 57328 [ACK] Seq=20349 Ack=11425 Win=1452 Len=0 TSval=5569401 TSecr=13836265
  177 18.465717888  10.6.15.144 → 192.168.1.16 SSH 110 Server: Encrypted packet (len=44)
  178 18.465792735  10.6.15.144 → 192.168.1.16 TCP 110 [TCP Retransmission] 22 → 57328 [PSH, ACK] Seq=20349 Ack=11425 Win=1452 Len=44 TSval=5569651 TSecr=13836265
  179 18.465806340 192.168.1.16 → 10.6.15.144  TCP 78 57328 → 22 [ACK] Seq=11425 Ack=20393 Win=2987 Len=0 TSval=13836704 TSecr=5569651 SLE=20349 SRE=20393
  180 18.466102387 192.168.1.16 → 10.6.15.144  SSH 158 Client: Encrypted packet (len=92)
  181 18.504428343  10.6.15.144 → 192.168.1.16 TCP 66 22 → 57328 [ACK] Seq=20393 Ack=11517 Win=1452 Len=0 TSval=5569849 TSecr=13836704
  182 19.457932072  10.6.15.144 → 192.168.1.16 SSH 1514 Server: Encrypted packet (len=1448)
  183 19.457973631  192.168.1.1 → 224.0.0.1    IGMPv2 42 Membership Query, general
  184 19.458589976  10.6.15.144 → 192.168.1.16 SSH 1238 Server: Encrypted packet (len=1172)
  185 19.458610589 192.168.1.16 → 10.6.15.144  TCP 66 57328 → 22 [ACK] Seq=11517 Ack=23013 Win=2987 Len=0 TSval=13836952 TSecr=5569895
  186 19.459003256  10.6.15.144 → 192.168.1.16 SSH 726 Server: Encrypted packet (len=660)
  187 19.460095018 192.168.1.16 → 10.6.15.144  SSH 206 Client: Encrypted packet (len=140)
  188 19.464313979  10.6.15.144 → 192.168.1.16 TCP 66 22 → 57328 [ACK] Seq=23673 Ack=11657 Win=1452 Len=0 TSval=5570088 TSecr=13836953
  189 20.481757367  10.6.15.144 → 192.168.1.16 SSH 142 Server: Encrypted packet (len=76)
  190 20.482415673 192.168.1.16 → 10.6.15.144  SSH 1514 Client: Encrypted packet (len=1448)
  191 20.482947208 192.168.1.16 → 10.6.15.144  SSH 334 Client: Encrypted packet (len=268)
  192 20.484631178  10.6.15.144 → 192.168.1.16 TCP 66 22 → 57328 [ACK] Seq=23749 Ack=13373 Win=1452 Len=0 TSval=5570344 TSecr=13837208
  193 20.659470246 192.168.1.16 → 10.6.15.144  SSH 582 Client: Encrypted packet (len=516)
  194 20.661183483 192.168.1.16 → 10.6.15.144  SSH 582 Client: Encrypted packet (len=516)
  195 20.662005737  10.6.15.144 → 192.168.1.16 TCP 66 22 → 57328 [ACK] Seq=23749 Ack=13889 Win=1452 Len=0 TSval=5570388 TSecr=13837252
  196 20.662932568  10.6.15.144 → 192.168.1.16 TCP 66 22 → 57328 [ACK] Seq=23749 Ack=14405 Win=1452 Len=0 TSval=5570388 TSecr=13837253
  197 20.713896736  10.6.15.144 → 192.168.1.16 SSH 1038 Server: Encrypted packet (len=972)
  198 20.755816039 192.168.1.16 → 10.6.15.144  TCP 66 57328 → 22 [ACK] Seq=14405 Ack=24721 Win=2987 Len=0 TSval=13837277 TSecr=5570401
  199 20.895814292 192.168.1.16 → 180.149.60.12 TCP 66 38626 → 80 [RST, ACK] Seq=1 Ack=1 Win=319 Len=0 TSval=13837312 TSecr=1034301807
  200 20.898471142  10.6.15.144 → 192.168.1.16 SSH 766 Server: Encrypted packet (len=700)
  201 20.898496601 192.168.1.16 → 10.6.15.144  TCP 66 57328 → 22 [ACK] Seq=14405 Ack=25421 Win=2987 Len=0 TSval=13837312 TSecr=5570443
  202 20.898510807  10.6.15.144 → 192.168.1.16 SSH 766 Server: Encrypted packet (len=700)
  203 20.898517028 192.168.1.16 → 10.6.15.144  TCP 66 57328 → 22 [ACK] Seq=14405 Ack=26121 Win=2987 Len=0 TSval=13837312 TSecr=5570444
  204 21.658262979 192.168.1.16 → 10.6.15.144  SSH 750 Client: Encrypted packet (len=684)
  205 21.660836575  10.6.15.144 → 192.168.1.16 TCP 66 22 → 57328 [ACK] Seq=26121 Ack=15089 Win=1452 Len=0 TSval=5570638 TSecr=13837502
  206 22.431815510 192.168.1.16 → 224.0.0.251  IGMPv2 46 Membership Report group 224.0.0.251
  207 22.436582363  10.6.15.144 → 192.168.1.16 SSH 342 Server: Encrypted packet (len=276)
  208 22.436607659 192.168.1.16 → 10.6.15.144  TCP 66 57328 → 22 [ACK] Seq=15089 Ack=26397 Win=2987 Len=0 TSval=13837697 TSecr=5570693
  209 26.283396818 192.168.1.16 → 10.6.15.144  SSH 102 Client: Encrypted packet (len=36)
  210 26.286844179  10.6.15.144 → 192.168.1.16 TCP 66 22 → 57328 [ACK] Seq=26397 Ack=15125 Win=1452 Len=0 TSval=5571794 TSecr=13838658
  211 26.286865996  10.6.15.144 → 192.168.1.16 SSH 102 Server: Encrypted packet (len=36)
  212 26.286875360 192.168.1.16 → 10.6.15.144  TCP 66 57328 → 22 [ACK] Seq=15125 Ack=26433 Win=2987 Len=0 TSval=13838659 TSecr=5571794
  213 26.384365072 192.168.1.16 → 91.189.94.4  NTP 90 NTP Version 4, client
  214 26.438461777 192.168.1.16 → 10.6.15.144  SSH 102 Client: Encrypted packet (len=36)
  215 26.442345998  10.6.15.144 → 192.168.1.16 SSH 102 Server: Encrypted packet (len=36)
  216 26.442373425 192.168.1.16 → 10.6.15.144  TCP 66 57328 → 22 [ACK] Seq=15161 Ack=26469 Win=2987 Len=0 TSval=13838698 TSecr=5571833
  217 26.613427318 192.168.1.16 → 10.6.15.144  SSH 102 Client: Encrypted packet (len=36)
  218 26.616270147  10.6.15.144 → 192.168.1.16 SSH 102 Server: Encrypted packet (len=36)
  219 26.616297028 192.168.1.16 → 10.6.15.144  TCP 66 57328 → 22 [ACK] Seq=15197 Ack=26505 Win=2987 Len=0 TSval=13838742 TSecr=5571877
  220 26.704684624 192.168.1.16 → 10.6.15.144  SSH 102 Client: Encrypted packet (len=36)
  221 26.706506655  10.6.15.144 → 192.168.1.16 SSH 102 Server: Encrypted packet (len=36)
  222 26.706533791 192.168.1.16 → 10.6.15.144  TCP 66 57328 → 22 [ACK] Seq=15233 Ack=26541 Win=2987 Len=0 TSval=13838764 TSecr=5571899
  223 26.762882636 192.168.1.16 → 10.6.15.144  SSH 102 Client: Encrypted packet (len=36)
  224 26.764719619  10.6.15.144 → 192.168.1.16 SSH 102 Server: Encrypted packet (len=36)
  225 26.764746993 192.168.1.16 → 10.6.15.144  TCP 66 57328 → 22 [ACK] Seq=15269 Ack=26577 Win=2987 Len=0 TSval=13838779 TSecr=5571914
  226 26.862091560 192.168.1.16 → 10.6.15.144  SSH 102 Client: Encrypted packet (len=36)
  227 26.863805709  10.6.15.144 → 192.168.1.16 SSH 102 Server: Encrypted packet (len=36)
  228 26.863821451 192.168.1.16 → 10.6.15.144  TCP 66 57328 → 22 [ACK] Seq=15305 Ack=26613 Win=2987 Len=0 TSval=13838804 TSecr=5571939
  229 27.039816538 192.168.1.16 → 224.0.0.252  IGMPv2 46 Membership Report group 224.0.0.252
  230 27.142160400 192.168.1.16 → 10.6.15.144  SSH 102 Client: Encrypted packet (len=36)
  231 27.147233440  10.6.15.144 → 192.168.1.16 SSH 102 Server: Encrypted packet (len=36)
  232 27.147277299 192.168.1.16 → 10.6.15.144  TCP 66 57328 → 22 [ACK] Seq=15341 Ack=26649 Win=2987 Len=0 TSval=13838874 TSecr=5572009
  233 27.179171777  10.6.15.144 → 192.168.1.16 SSH 230 Server: Encrypted packet (len=164)
  234 27.179188159 192.168.1.16 → 10.6.15.144  TCP 66 57328 → 22 [ACK] Seq=15341 Ack=26813 Win=2987 Len=0 TSval=13838882 TSecr=5572017
  235 27.188815186  10.6.15.144 → 192.168.1.16 SSH 102 Server: Encrypted packet (len=36)
  236 27.188832613 192.168.1.16 → 10.6.15.144  TCP 66 57328 → 22 [ACK] Seq=15341 Ack=26849 Win=2987 Len=0 TSval=13838885 TSecr=5572020
  237 28.222054845 192.168.1.16 → 10.6.15.144  SSH 102 Client: Encrypted packet (len=36)
  238 28.224272811  10.6.15.144 → 192.168.1.16 SSH 102 Server: Encrypted packet (len=36)
  239 28.224293687 192.168.1.16 → 10.6.15.144  TCP 66 57328 → 22 [ACK] Seq=15377 Ack=26885 Win=2987 Len=0 TSval=13839144 TSecr=5572279
  240 28.460044425 192.168.1.16 → 10.6.15.144  SSH 102 Client: Encrypted packet (len=36)
  241 28.465042846  10.6.15.144 → 192.168.1.16 SSH 102 Server: Encrypted packet (len=36)
  242 28.465067691 192.168.1.16 → 10.6.15.144  TCP 66 57328 → 22 [ACK] Seq=15413 Ack=26921 Win=2987 Len=0 TSval=13839204 TSecr=5572338
  243 28.587820351 192.168.1.16 → 10.6.15.144  SSH 102 Client: Encrypted packet (len=36)
  244 28.592561028  10.6.15.144 → 192.168.1.16 SSH 102 Server: Encrypted packet (len=36)
  245 28.592588230 192.168.1.16 → 10.6.15.144  TCP 66 57328 → 22 [ACK] Seq=15449 Ack=26957 Win=2987 Len=0 TSval=13839236 TSecr=5572371
  246 28.647828783 192.168.1.16 → 10.6.15.144  SSH 102 Client: Encrypted packet (len=36)
  247 28.649356574  10.6.15.144 → 192.168.1.16 SSH 102 Server: Encrypted packet (len=36)
  248 28.649383999 192.168.1.16 → 10.6.15.144  TCP 66 57328 → 22 [ACK] Seq=15485 Ack=26993 Win=2987 Len=0 TSval=13839250 TSecr=5572385
  249 28.658372791 192.168.1.16 → 10.6.15.144  SSH 1514 Client: Encrypted packet (len=1448)
  250 28.659240880 192.168.1.16 → 10.6.15.144  SSH 326 Client: Encrypted packet (len=260)
  251 28.660876842  10.6.15.144 → 192.168.1.16 TCP 66 22 → 57328 [ACK] Seq=26993 Ack=17193 Win=1452 Len=0 TSval=5572388 TSecr=13839252
  252 29.081741959 192.168.1.16 → 10.6.15.144  SSH 102 Client: Encrypted packet (len=36)
  253 29.083532435  10.6.15.144 → 192.168.1.16 SSH 1038 Server: Encrypted packet (len=972)
  254 29.084112279  10.6.15.144 → 192.168.1.16 SSH 102 Server: Encrypted packet (len=36)
  255 29.084121842 192.168.1.16 → 10.6.15.144  TCP 66 57328 → 22 [ACK] Seq=17229 Ack=28001 Win=2987 Len=0 TSval=13839359 TSecr=5572445
  256 29.451621241 192.168.1.16 → 10.6.15.144  SSH 102 Client: Encrypted packet (len=36)
  257 29.453956370  10.6.15.144 → 192.168.1.16 SSH 102 Server: Encrypted packet (len=36)
  258 29.495815610 192.168.1.16 → 10.6.15.144  TCP 66 57328 → 22 [ACK] Seq=17265 Ack=28037 Win=2987 Len=0 TSval=13839462 TSecr=5572586
  259 29.811789486 192.168.1.16 → 10.6.15.144  SSH 102 Client: Encrypted packet (len=36)
  260 30.255876334 192.168.1.16 → 10.6.15.144  SSH 102 Client: Encrypted packet (len=36)
  261 30.255891389 192.168.1.16 → 10.6.15.144  SSH 102 Client: Encrypted packet (len=36)
  262 30.371825677 192.168.1.16 → 10.6.15.144  TCP 174 [TCP Retransmission] 57328 → 22 [PSH, ACK] Seq=17265 Ack=28037 Win=2987 Len=108 TSval=13839681 TSecr=5572586
  263 30.783814763 192.168.1.16 → 10.6.15.144  TCP 174 [TCP Retransmission] 57328 → 22 [PSH, ACK] Seq=17265 Ack=28037 Win=2987 Len=108 TSval=13839784 TSecr=5572586
  264 31.615822025 192.168.1.16 → 10.6.15.144  TCP 174 [TCP Retransmission] 57328 → 22 [PSH, ACK] Seq=17265 Ack=28037 Win=2987 Len=108 TSval=13839992 TSecr=5572586
  265 33.279812549 192.168.1.16 → 10.6.15.144  TCP 174 [TCP Retransmission] 57328 → 22 [PSH, ACK] Seq=17265 Ack=28037 Win=2987 Len=108 TSval=13840408 TSecr=5572586
  266 33.763813878  10.6.15.144 → 192.168.1.16 TCP 78 [TCP Previous segment not captured] 22 → 57328 [ACK] Seq=28073 Ack=17373 Win=1452 Len=0 TSval=5573637 TSecr=13840408 SLE=17265 SRE=17373
  267 33.763938774 192.168.1.16 → 10.6.15.144  SSH 1134 Client: Encrypted packet (len=1068)
  268 34.171646870  10.6.15.144 → 192.168.1.16 TCP 66 22 → 57328 [ACK] Seq=28073 Ack=18441 Win=1452 Len=0 TSval=5573765 TSecr=13840529
  269 34.171675193  10.6.15.144 → 192.168.1.16 SSH 102 Server: Encrypted packet (len=36)
  270 34.323902677 192.168.1.16 → 10.6.15.144  TCP 78 [TCP Dup ACK 258#1] 57328 → 22 [ACK] Seq=18441 Ack=28037 Win=2987 Len=0 TSval=13840630 TSecr=5572586 SLE=28073 SRE=28109
  271 34.730569375  10.6.15.144 → 192.168.1.16 SSH 1466 Server: Encrypted packet (len=1400)
  272 34.883926929 192.168.1.16 → 10.6.15.144  TCP 78 [TCP Dup ACK 258#2] 57328 → 22 [ACK] Seq=18441 Ack=28037 Win=2987 Len=0 TSval=13840770 TSecr=5572586 SLE=28073 SRE=29509
  273 36.623755531  10.6.15.144 → 192.168.1.16 TCP 102 [TCP Retransmission] 22 → 57328 [PSH, ACK] Seq=28037 Ack=18441 Win=1452 Len=36 TSval=5574353 TSecr=13840770
  274 36.623775421 192.168.1.16 → 10.6.15.144  TCP 66 57328 → 22 [ACK] Seq=18441 Ack=29509 Win=2987 Len=0 TSval=13841244 TSecr=5574353
