    1 0.000000000  10.6.15.144 → 192.168.1.16 SSH 766 Server: Encrypted packet (len=700)
    2 0.000460102  10.6.15.144 → 192.168.1.16 SSH 766 Server: Encrypted packet (len=700)
    3 0.000470268 192.168.1.16 → 10.6.15.144  TCP 66 57328 → 22 [ACK] Seq=1 Ack=1401 Win=2987 Len=0 TSval=13852952 TSecr=5585702
    4 0.000719297  10.6.15.144 → 192.168.1.16 SSH 1062 Server: Encrypted packet (len=996)
    5 0.000729315  10.6.15.144 → 192.168.1.16 SSH 222 Server: Encrypted packet (len=156)
    6 0.000735995 192.168.1.16 → 10.6.15.144  TCP 66 57328 → 22 [ACK] Seq=1 Ack=2553 Win=2987 Len=0 TSval=13852952 TSecr=5585705
    7 4.031671750  10.6.15.144 → 192.168.1.16 SSH 102 Server: Encrypted packet (len=36)
    8 4.073721206 192.168.1.16 → 10.6.15.144  TCP 66 57328 → 22 [ACK] Seq=1 Ack=2589 Win=2987 Len=0 TSval=13853971 TSecr=5587060
    9 6.200791275 192.168.1.16 → 10.6.15.144  SSH 138 Client: Encrypted packet (len=72)
   10 6.201599614 192.168.1.16 → 10.6.15.144  SSH 1514 Client: Encrypted packet (len=1448)
   11 6.203165543  10.6.15.144 → 192.168.1.16 TCP 66 22 → 57328 [ACK] Seq=2589 Ack=73 Win=1452 Len=0 TSval=5587638 TSecr=13854502
   12 6.203188124 192.168.1.16 → 10.6.15.144  SSH 326 Client: Encrypted packet (len=260)
   13 6.203545403  10.6.15.144 → 192.168.1.16 SSH 102 Server: Encrypted packet (len=36)
   14 6.203556433 192.168.1.16 → 10.6.15.144  TCP 66 57328 → 22 [ACK] Seq=1781 Ack=2625 Win=2987 Len=0 TSval=13854503 TSecr=5587638
   15 6.204627744  10.6.15.144 → 192.168.1.16 TCP 66 22 → 57328 [ACK] Seq=2625 Ack=1781 Win=1452 Len=0 TSval=5587639 TSecr=13854502
   16 7.009141016  10.6.15.144 → 192.168.1.16 SSH 998 Server: Encrypted packet (len=932)
   17 7.009165864 192.168.1.16 → 10.6.15.144  TCP 66 57328 → 22 [ACK] Seq=1781 Ack=3557 Win=2987 Len=0 TSval=13854704 TSecr=5587696
   18 8.928263473 192.168.1.16 → 192.168.1.1  DNS 74 Standard query 0xe3b6 A ntp.ubuntu.com
   19 8.931304583  192.168.1.1 → 192.168.1.16 DNS 138 Standard query response 0xe3b6 A ntp.ubuntu.com A 91.189.89.198 A 91.189.94.4 A 91.189.89.199 A 91.189.91.157
   20 8.931799472 192.168.1.16 → 91.189.89.198 NTP 90 NTP Version 4, client
   21 10.201695494 192.168.1.16 → 10.6.15.144  SSH 582 Client: Encrypted packet (len=516)
   22 10.203439761 192.168.1.16 → 10.6.15.144  SSH 582 Client: Encrypted packet (len=516)
   23 10.205355413  10.6.15.144 → 192.168.1.16 TCP 66 22 → 57328 [ACK] Seq=3557 Ack=2813 Win=1452 Len=0 TSval=5588639 TSecr=13855503
   24 11.018875587 192.168.1.16 → 10.6.15.144  SSH 1514 Client: Encrypted packet (len=1448)
   25 11.020214150 192.168.1.16 → 10.6.15.144  SSH 318 Client: Encrypted packet (len=252)
   26 11.020991880  10.6.15.144 → 192.168.1.16 SSH 766 Server: Encrypted packet (len=700)
   27 11.021038528 192.168.1.16 → 10.6.15.144  TCP 66 57328 → 22 [ACK] Seq=4513 Ack=4257 Win=2987 Len=0 TSval=13855707 TSecr=5588694
   28 11.021720145  10.6.15.144 → 192.168.1.16 SSH 766 Server: Encrypted packet (len=700)
   29 11.021729832 192.168.1.16 → 10.6.15.144  TCP 66 57328 → 22 [ACK] Seq=4513 Ack=4957 Win=2987 Len=0 TSval=13855708 TSecr=5588694
   30 11.022360134  10.6.15.144 → 192.168.1.16 SSH 326 Server: Encrypted packet (len=260)
   31 11.022368916 192.168.1.16 → 10.6.15.144  TCP 66 57328 → 22 [ACK] Seq=4513 Ack=5217 Win=2987 Len=0 TSval=13855708 TSecr=5588813
   32 11.022381810  10.6.15.144 → 192.168.1.16 TCP 66 22 → 57328 [ACK] Seq=5217 Ack=4513 Win=1452 Len=0 TSval=5588843 TSecr=13855707
   33 11.027305416  10.6.15.144 → 192.168.1.16 SSH 134 Server: Encrypted packet (len=68)
   34 11.027319605 192.168.1.16 → 10.6.15.144  TCP 66 57328 → 22 [ACK] Seq=4513 Ack=5285 Win=2987 Len=0 TSval=13855709 TSecr=5588844
   35 11.165663593 192.168.1.16 → 216.58.197.78 TCP 66 32882 → 80 [ACK] Seq=1 Ack=1 Win=251 Len=0 TSval=13855744 TSecr=1034322774
   36 11.168600364  10.6.15.144 → 192.168.1.16 SSH 182 Server: Encrypted packet (len=116)
   37 11.168617524 192.168.1.16 → 10.6.15.144  TCP 66 57328 → 22 [ACK] Seq=4513 Ack=5401 Win=2987 Len=0 TSval=13855744 TSecr=5588875
   38 11.168699893  10.6.15.144 → 192.168.1.16 SSH 910 Server: Encrypted packet (len=844)
   39 11.168706646 192.168.1.16 → 10.6.15.144  TCP 66 57328 → 22 [ACK] Seq=4513 Ack=6245 Win=2987 Len=0 TSval=13855744 TSecr=5588875
   40 11.168779914  10.6.15.144 → 192.168.1.16 SSH 670 Server: Encrypted packet (len=604)
   41 11.168784823 192.168.1.16 → 10.6.15.144  TCP 66 57328 → 22 [ACK] Seq=4513 Ack=6849 Win=2987 Len=0 TSval=13855744 TSecr=5588876
   42 11.169306027 192.168.1.16 → 10.6.15.144  SSH 134 Client: Encrypted packet (len=68)
   43 11.208092730  10.6.15.144 → 192.168.1.16 TCP 66 22 → 57328 [ACK] Seq=6849 Ack=4581 Win=1452 Len=0 TSval=5588890 TSecr=13855744
   44 12.202592837 192.168.1.16 → 10.6.15.144  SSH 1038 Client: Encrypted packet (len=972)
   45 12.206857848  10.6.15.144 → 192.168.1.16 TCP 66 22 → 57328 [ACK] Seq=6849 Ack=5553 Win=1452 Len=0 TSval=5589139 TSecr=13856003
   46 18.055402837 192.168.1.16 → 239.255.255.250 SSDP 213 M-SEARCH * HTTP/1.1 
   47 19.056599077 192.168.1.16 → 239.255.255.250 SSDP 213 M-SEARCH * HTTP/1.1 
   48 20.058111913 192.168.1.16 → 239.255.255.250 SSDP 213 M-SEARCH * HTTP/1.1 
   49 21.059097323 192.168.1.16 → 239.255.255.250 SSDP 213 M-SEARCH * HTTP/1.1 
   50 21.200196746 192.168.1.16 → 10.6.15.144  SSH 582 Client: Encrypted packet (len=516)
   51 21.203524702  10.6.15.144 → 192.168.1.16 TCP 66 22 → 57328 [ACK] Seq=6849 Ack=6069 Win=1452 Len=0 TSval=5591388 TSecr=13858252
   52 21.205273076 192.168.1.16 → 10.6.15.144  SSH 582 Client: Encrypted packet (len=516)
   53 21.206798199  10.6.15.144 → 192.168.1.16 TCP 66 22 → 57328 [ACK] Seq=6849 Ack=6585 Win=1452 Len=0 TSval=5591389 TSecr=13858253
   54 22.975754943  10.6.15.144 → 192.168.1.16 SSH 766 Server: Encrypted packet (len=700)
   55 22.975790624  10.6.15.144 → 192.168.1.16 SSH 766 Server: Encrypted packet (len=700)
   56 22.975801879 192.168.1.16 → 10.6.15.144  TCP 66 57328 → 22 [ACK] Seq=6585 Ack=8249 Win=2987 Len=0 TSval=13858696 TSecr=5591443
   57 22.975883651  10.6.15.144 → 192.168.1.16 SSH 766 Server: [TCP Spurious Retransmission] , Encrypted packet (len=700)
   58 22.975889429 192.168.1.16 → 10.6.15.144  TCP 78 [TCP Dup ACK 56#1] 57328 → 22 [ACK] Seq=6585 Ack=8249 Win=2987 Len=0 TSval=13858696 TSecr=5591604 SLE=7549 SRE=8249
   59 22.975918588  10.6.15.144 → 192.168.1.16 SSH 326 Server: Encrypted packet (len=260)
   60 22.975921351 192.168.1.16 → 10.6.15.144  TCP 66 57328 → 22 [ACK] Seq=6585 Ack=8509 Win=2987 Len=0 TSval=13858696 TSecr=5591693
   61 24.200740569 192.168.1.16 → 10.6.15.144  SSH 1038 Client: Encrypted packet (len=972)
   62 24.203787784  10.6.15.144 → 192.168.1.16 TCP 66 22 → 57328 [ACK] Seq=8509 Ack=7557 Win=1452 Len=0 TSval=5592138 TSecr=13859002
   63 29.024271767  10.6.15.144 → 192.168.1.16 SSH 102 Server: Encrypted packet (len=36)
   64 29.024298480 192.168.1.16 → 10.6.15.144  TCP 66 57328 → 22 [ACK] Seq=7557 Ack=8545 Win=2987 Len=0 TSval=13860208 TSecr=5593187
   65 29.024315707  10.6.15.144 → 192.168.1.16 SSH 102 Server: Encrypted packet (len=36)
   66 29.024322236 192.168.1.16 → 10.6.15.144  TCP 66 57328 → 22 [ACK] Seq=7557 Ack=8581 Win=2987 Len=0 TSval=13860208 TSecr=5593187
   67 31.007616359  10.6.15.144 → 192.168.1.16 SSH 102 Server: Encrypted packet (len=36)
   68 31.007637349 192.168.1.16 → 10.6.15.144  TCP 66 57328 → 22 [ACK] Seq=7557 Ack=8617 Win=2987 Len=0 TSval=13860704 TSecr=5593693
   69 33.206441359 192.168.1.16 → 10.6.15.144  SSH 582 Client: Encrypted packet (len=516)
   70 33.208910609  10.6.15.144 → 192.168.1.16 TCP 66 22 → 57328 [ACK] Seq=8617 Ack=8073 Win=1452 Len=0 TSval=5594390 TSecr=13861254
   71 33.212500125 192.168.1.16 → 10.6.15.144  SSH 582 Client: Encrypted packet (len=516)
   72 33.214285285  10.6.15.144 → 192.168.1.16 TCP 66 22 → 57328 [ACK] Seq=8617 Ack=8589 Win=1452 Len=0 TSval=5594391 TSecr=13861255
   73 34.017540929  10.6.15.144 → 192.168.1.16 SSH 766 Server: Encrypted packet (len=700)
   74 34.017564202 192.168.1.16 → 10.6.15.144  TCP 66 57328 → 22 [ACK] Seq=8589 Ack=9317 Win=2987 Len=0 TSval=13861456 TSecr=5594445
   75 34.017610094  10.6.15.144 → 192.168.1.16 SSH 766 Server: Encrypted packet (len=700)
   76 34.017616315 192.168.1.16 → 10.6.15.144  TCP 66 57328 → 22 [ACK] Seq=8589 Ack=10017 Win=2987 Len=0 TSval=13861456 TSecr=5594446
   77 35.926258117 192.168.1.16 → 123.108.200.124 NTP 90 NTP Version 4, client
   78 36.926260342 192.168.1.16 → 123.108.200.124 NTP 90 NTP Version 4, client
