    1 0.000000000 192.168.1.16 → 74.125.68.188 TCP 66 40830 → 443 [ACK] Seq=1 Ack=1 Win=304 Len=0 TSval=19064832 TSecr=100323
    2 0.005950129  10.6.15.186 → 192.168.1.16 SSH 246 Server: Encrypted packet (len=180)
    3 0.006235104 192.168.1.16 → 10.6.15.186  SSH 134 Client: Encrypted packet (len=68)
    4 0.007017582  10.6.15.186 → 192.168.1.16 SSH 214 Server: Encrypted packet (len=148)
    5 0.007024351  10.6.15.186 → 192.168.1.16 SSH 182 Server: Encrypted packet (len=116)
    6 0.007047180 192.168.1.16 → 10.6.15.186  TCP 66 43250 → 22 [ACK] Seq=69 Ack=445 Win=1810 Len=0 TSval=19064833 TSecr=3373110
    7 0.007055656  10.6.15.186 → 192.168.1.16 SSH 298 Server: Encrypted packet (len=232)
    8 0.007081389  10.6.15.186 → 192.168.1.16 SSH 182 Server: Encrypted packet (len=116)
    9 0.007098976 192.168.1.16 → 10.6.15.186  TCP 66 43250 → 22 [ACK] Seq=69 Ack=793 Win=1810 Len=0 TSval=19064833 TSecr=3373113
   10 0.007108973  10.6.15.186 → 192.168.1.16 SSH 182 Server: Encrypted packet (len=116)
   11 0.007266727  10.6.15.186 → 192.168.1.16 TCP 974 [TCP Retransmission] 22 → 43250 [PSH, ACK] Seq=1 Ack=1 Win=2127 Len=908 TSval=3373311 TSecr=19064538
   12 0.007271046 192.168.1.16 → 10.6.15.186  SSH 146 Client: Encrypted packet (len=68)
   13 0.012654117 192.168.1.16 → 10.6.15.186  SSH 954 Client: Encrypted packet (len=888)
   14 0.039470764 74.125.68.188 → 192.168.1.16 TCP 66 [TCP ACKed unseen segment] 443 → 40830 [ACK] Seq=1 Ack=2 Win=179 Len=0 TSval=145379 TSecr=18929456
   15 0.047995531 192.168.1.16 → 10.6.15.186  TCP 954 [TCP Retransmission] 43250 → 22 [PSH, ACK] Seq=137 Ack=909 Win=1810 Len=888 TSval=19064844 TSecr=3373311
   16 0.137532809  10.6.15.186 → 192.168.1.16 TCP 78 [TCP Dup ACK 2#1] 22 → 43250 [ACK] Seq=909 Ack=1 Win=2127 Len=0 TSval=3373381 TSecr=19064538 SLE=137 SRE=1025
   17 0.137556273  10.6.15.186 → 192.168.1.16 TCP 86 [TCP Dup ACK 2#2] 22 → 43250 [ACK] Seq=909 Ack=1 Win=2127 Len=0 TSval=3373381 TSecr=19064538 SLE=137 SRE=1025 SLE=137 SRE=1025
   18 0.268031640 192.168.1.16 → 10.6.15.186  TCP 202 [TCP Retransmission] 43250 → 22 [PSH, ACK] Seq=1 Ack=909 Win=1810 Len=136 TSval=19064899 TSecr=3373381
   19 0.270982034  10.6.15.186 → 192.168.1.16 TCP 66 22 → 43250 [ACK] Seq=909 Ack=1025 Win=2127 Len=0 TSval=3373414 TSecr=19064899
   20 1.474145786  10.6.15.186 → 192.168.1.16 SSH 1514 Server: Encrypted packet (len=1448)
   21 1.474277726  10.6.15.186 → 192.168.1.16 SSH 1514 Server: Encrypted packet (len=1448)
   22 1.474287704 192.168.1.16 → 10.6.15.186  TCP 66 43250 → 22 [ACK] Seq=1025 Ack=3805 Win=1810 Len=0 TSval=19065200 TSecr=3373475
   23 1.474494061  10.6.15.186 → 192.168.1.16 SSH 1514 Server: Encrypted packet (len=1448)
   24 1.474684795  10.6.15.186 → 192.168.1.16 TCP 1514 [TCP Out-Of-Order] 22 → 43250 [ACK] Seq=909 Ack=1025 Win=2127 Len=1448 TSval=3373686 TSecr=19064899
   25 1.474688927 192.168.1.16 → 10.6.15.186  TCP 78 43250 → 22 [ACK] Seq=1025 Ack=5253 Win=1810 Len=0 TSval=19065200 TSecr=3373515 SLE=909 SRE=2357
   26 1.478936916  10.6.15.186 → 192.168.1.16 SSH 1514 Server: Encrypted packet (len=1448)
   27 1.478953745 192.168.1.16 → 10.6.15.186  TCP 66 43250 → 22 [ACK] Seq=1025 Ack=6701 Win=1810 Len=0 TSval=19065201 TSecr=3373715
   28 1.479053378  10.6.15.186 → 192.168.1.16 SSH 1514 Server: Encrypted packet (len=1448)
   29 1.479056818 192.168.1.16 → 10.6.15.186  TCP 66 43250 → 22 [ACK] Seq=1025 Ack=8149 Win=1810 Len=0 TSval=19065201 TSecr=3373715
   30 1.479946120  10.6.15.186 → 192.168.1.16 SSH 1514 Server: Encrypted packet (len=1448)
   31 1.479953037 192.168.1.16 → 10.6.15.186  TCP 66 43250 → 22 [ACK] Seq=1025 Ack=9597 Win=1810 Len=0 TSval=19065201 TSecr=3373715
   32 1.480517713  10.6.15.186 → 192.168.1.16 SSH 1514 Server: Encrypted packet (len=1448)
   33 1.480535195 192.168.1.16 → 10.6.15.186  TCP 66 43250 → 22 [ACK] Seq=1025 Ack=11045 Win=1810 Len=0 TSval=19065202 TSecr=3373715
   34 1.482583458  10.6.15.186 → 192.168.1.16 SSH 1514 Server: Encrypted packet (len=1448)
   35 1.482598853 192.168.1.16 → 10.6.15.186  TCP 66 43250 → 22 [ACK] Seq=1025 Ack=12493 Win=1810 Len=0 TSval=19065202 TSecr=3373717
   36 1.482755174  10.6.15.186 → 192.168.1.16 SSH 1514 Server: Encrypted packet (len=1448)
   37 1.482762000 192.168.1.16 → 10.6.15.186  TCP 66 43250 → 22 [ACK] Seq=1025 Ack=13941 Win=1810 Len=0 TSval=19065202 TSecr=3373717
   38 1.482946349  10.6.15.186 → 192.168.1.16 SSH 1514 Server: Encrypted packet (len=1448)
   39 1.482953053 192.168.1.16 → 10.6.15.186  TCP 66 43250 → 22 [ACK] Seq=1025 Ack=15389 Win=1810 Len=0 TSval=19065202 TSecr=3373717
   40 1.483293938  10.6.15.186 → 192.168.1.16 SSH 1514 Server: Encrypted packet (len=1448)
   41 1.483300854 192.168.1.16 → 10.6.15.186  TCP 66 43250 → 22 [ACK] Seq=1025 Ack=16837 Win=1810 Len=0 TSval=19065202 TSecr=3373717
   42 1.485450887  10.6.15.186 → 192.168.1.16 SSH 1514 Server: Encrypted packet (len=1448)
   43 1.485467719 192.168.1.16 → 10.6.15.186  TCP 66 43250 → 22 [ACK] Seq=1025 Ack=18285 Win=1810 Len=0 TSval=19065203 TSecr=3373717
   44 1.485634289  10.6.15.186 → 192.168.1.16 SSH 1514 Server: Encrypted packet (len=1448)
   45 1.485639887 192.168.1.16 → 10.6.15.186  TCP 66 43250 → 22 [ACK] Seq=1025 Ack=19733 Win=1810 Len=0 TSval=19065203 TSecr=3373717
   46 1.485825959  10.6.15.186 → 192.168.1.16 SSH 1514 Server: Encrypted packet (len=1448)
   47 1.485831714 192.168.1.16 → 10.6.15.186  TCP 66 43250 → 22 [ACK] Seq=1025 Ack=21181 Win=1810 Len=0 TSval=19065203 TSecr=3373718
   48 1.486171221  10.6.15.186 → 192.168.1.16 SSH 1514 Server: Encrypted packet (len=1448)
   49 1.486181454 192.168.1.16 → 10.6.15.186  TCP 66 43250 → 22 [ACK] Seq=1025 Ack=22629 Win=1810 Len=0 TSval=19065203 TSecr=3373718
   50 1.490607876  10.6.15.186 → 192.168.1.16 SSH 1514 Server: Encrypted packet (len=1448)
   51 1.490622668 192.168.1.16 → 10.6.15.186  TCP 66 43250 → 22 [ACK] Seq=1025 Ack=24077 Win=1810 Len=0 TSval=19065204 TSecr=3373718
   52 1.490926881  10.6.15.186 → 192.168.1.16 SSH 1514 Server: Encrypted packet (len=1448)
   53 1.490931686 192.168.1.16 → 10.6.15.186  TCP 66 43250 → 22 [ACK] Seq=1025 Ack=25525 Win=1810 Len=0 TSval=19065204 TSecr=3373718
   54 1.491121055  10.6.15.186 → 192.168.1.16 SSH 1514 Server: Encrypted packet (len=1448)
   55 1.491128524 192.168.1.16 → 10.6.15.186  TCP 66 43250 → 22 [ACK] Seq=1025 Ack=26973 Win=1810 Len=0 TSval=19065204 TSecr=3373718
   56 1.491310337  10.6.15.186 → 192.168.1.16 SSH 1514 Server: Encrypted packet (len=1448)
   57 1.491502997  10.6.15.186 → 192.168.1.16 SSH 1514 Server: Encrypted packet (len=1448)
   58 1.491508949 192.168.1.16 → 10.6.15.186  TCP 66 43250 → 22 [ACK] Seq=1025 Ack=29869 Win=1810 Len=0 TSval=19065204 TSecr=3373718
   59 1.493355306  10.6.15.186 → 192.168.1.16 SSH 1514 Server: Encrypted packet (len=1448)
   60 1.493538593  10.6.15.186 → 192.168.1.16 SSH 1514 Server: Encrypted packet (len=1448)
   61 1.493548318 192.168.1.16 → 10.6.15.186  TCP 66 43250 → 22 [ACK] Seq=1025 Ack=32765 Win=1810 Len=0 TSval=19065205 TSecr=3373720
   62 1.493730518  10.6.15.186 → 192.168.1.16 SSH 1514 Server: Encrypted packet (len=1448)
   63 1.494077960  10.6.15.186 → 192.168.1.16 SSH 1514 Server: Encrypted packet (len=1448)
   64 1.494088149 192.168.1.16 → 10.6.15.186  TCP 66 43250 → 22 [ACK] Seq=1025 Ack=35661 Win=1810 Len=0 TSval=19065205 TSecr=3373720
   65 1.494267298  10.6.15.186 → 192.168.1.16 SSH 1514 Server: Encrypted packet (len=1448)
   66 1.496170921  10.6.15.186 → 192.168.1.16 SSH 1514 Server: Encrypted packet (len=1448)
   67 1.496188879 192.168.1.16 → 10.6.15.186  TCP 66 43250 → 22 [ACK] Seq=1025 Ack=38557 Win=1810 Len=0 TSval=19065206 TSecr=3373720
   68 1.496207483  10.6.15.186 → 192.168.1.16 SSH 190 Server: Encrypted packet (len=124)
   69 1.496241011 192.168.1.16 → 10.6.15.186  TCP 66 43250 → 22 [ACK] Seq=1025 Ack=38681 Win=1810 Len=0 TSval=19065206 TSecr=3373720
   70 1.721110031 192.168.1.16 → 10.6.15.186  SSH 422 Client: Encrypted packet (len=356)
   71 1.723437563  10.6.15.186 → 192.168.1.16 TCP 66 22 → 43250 [ACK] Seq=38681 Ack=1381 Win=2127 Len=0 TSval=3373777 TSecr=19065262
   72 1.760860418  10.6.15.186 → 192.168.1.16 SSH 358 Server: Encrypted packet (len=292)
   73 1.760876136 192.168.1.16 → 10.6.15.186  TCP 66 43250 → 22 [ACK] Seq=1381 Ack=38973 Win=1810 Len=0 TSval=19065272 TSecr=3373786
   74 1.761428024 192.168.1.16 → 10.6.15.186  SSH 134 Client: Encrypted packet (len=68)
   75 1.800571958  10.6.15.186 → 192.168.1.16 TCP 66 22 → 43250 [ACK] Seq=38973 Ack=1449 Win=2127 Len=0 TSval=3373797 TSecr=19065272
   76 4.511973413 192.168.1.16 → 66.235.139.15 TCP 66 39132 → 443 [ACK] Seq=1 Ack=1 Win=40544 Len=0 TSval=19065960 TSecr=2189948762
   77 8.192029071 192.168.1.16 → 63.215.202.75 TCP 54 59606 → 443 [ACK] Seq=1 Ack=1 Win=40880 Len=0
   78 9.473925253 63.215.202.75 → 192.168.1.16 TCP 60 [TCP ACKed unseen segment] 443 → 59606 [ACK] Seq=1 Ack=2 Win=40958 Len=0
   79 12.491475391 192.168.1.16 → 10.6.15.186  SSH 1514 Client: Encrypted packet (len=1448)
   80 12.492734587 192.168.1.16 → 10.6.15.186  SSH 278 Client: Encrypted packet (len=212)
   81 12.494350872  10.6.15.186 → 192.168.1.16 TCP 66 22 → 43250 [ACK] Seq=38973 Ack=2897 Win=2127 Len=0 TSval=3376470 TSecr=19067954
   82 12.494694350  10.6.15.186 → 192.168.1.16 TCP 66 22 → 43250 [ACK] Seq=38973 Ack=3109 Win=2127 Len=0 TSval=3376470 TSecr=19067955
   83 12.498400668  10.6.15.186 → 192.168.1.16 SSH 142 Server: Encrypted packet (len=76)
   84 12.540029648 192.168.1.16 → 10.6.15.186  TCP 66 43250 → 22 [ACK] Seq=3109 Ack=39049 Win=1810 Len=0 TSval=19067967 TSecr=3376471
   85 12.623992595  10.6.15.186 → 192.168.1.16 SSH 1414 Server: Encrypted packet (len=1348)
   86 12.624019648 192.168.1.16 → 10.6.15.186  TCP 66 43250 → 22 [ACK] Seq=3109 Ack=40397 Win=1810 Len=0 TSval=19067988 TSecr=3376502
   87 12.624289387  10.6.15.186 → 192.168.1.16 SSH 134 Server: Encrypted packet (len=68)
   88 12.624295874 192.168.1.16 → 10.6.15.186  TCP 66 43250 → 22 [ACK] Seq=3109 Ack=40465 Win=1810 Len=0 TSval=19067988 TSecr=3376502
   89 12.625590409 192.168.1.16 → 10.6.15.186  SSH 134 Client: Encrypted packet (len=68)
   90 12.664463550  10.6.15.186 → 192.168.1.16 TCP 66 22 → 43250 [ACK] Seq=40465 Ack=3177 Win=2127 Len=0 TSval=3376513 TSecr=19067988
   91 13.408571437 192.168.1.16 → 123.108.200.124 NTP 90 NTP Version 4, client
   92 13.415060011 10.119.73.122 → 192.168.1.16 ICMP 110 Destination unreachable (Communication administratively filtered)
   93 14.336027538 192.168.1.16 → 216.58.197.67 TCP 66 43046 → 443 [ACK] Seq=1 Ack=1 Win=245 Len=0 TSval=19068416 TSecr=3106553015
   94 14.346140098 216.58.197.67 → 192.168.1.16 TCP 66 [TCP ACKed unseen segment] 443 → 43046 [ACK] Seq=1 Ack=2 Win=175 Len=0 TSval=3106598035 TSecr=19045568
   95 16.552423404  10.6.15.186 → 192.168.1.16 SSH 158 Server: Encrypted packet (len=92)
   96 16.552729069 192.168.1.16 → 10.6.15.186  SSH 102 Client: Encrypted packet (len=36)
   97 16.554232114  10.6.15.186 → 192.168.1.16 TCP 66 22 → 43250 [ACK] Seq=40557 Ack=3213 Win=2127 Len=0 TSval=3377485 TSecr=19068970
   98 16.634406759  10.6.15.186 → 192.168.1.16 SSH 138 Server: Encrypted packet (len=72)
   99 16.634611411 192.168.1.16 → 10.6.15.186  SSH 102 Client: Encrypted packet (len=36)
  100 16.636044257  10.6.15.186 → 192.168.1.16 TCP 66 22 → 43250 [ACK] Seq=40629 Ack=3249 Win=2127 Len=0 TSval=3377505 TSecr=19068990
  101 17.505992038  10.6.15.186 → 192.168.1.16 SSH 158 Server: Encrypted packet (len=92)
  102 17.506304108  10.6.15.186 → 192.168.1.16 SSH 102 Server: Encrypted packet (len=36)
  103 17.506327211 192.168.1.16 → 10.6.15.186  TCP 66 43250 → 22 [ACK] Seq=3249 Ack=40757 Win=1810 Len=0 TSval=19069208 TSecr=3377567
  104 17.506340115 192.168.1.16 → 10.6.15.186  SSH 102 Client: Encrypted packet (len=36)
  105 17.506966036 192.168.1.16 → 10.6.15.186  SSH 102 Client: Encrypted packet (len=36)
  106 17.507329875  10.6.15.186 → 192.168.1.16 SSH 102 Server: [TCP Spurious Retransmission] , Encrypted packet (len=36)
  107 17.507349193 192.168.1.16 → 10.6.15.186  TCP 78 [TCP Dup ACK 103#1] 43250 → 22 [ACK] Seq=3321 Ack=40757 Win=1810 Len=0 TSval=19069208 TSecr=3377575 SLE=40721 SRE=40757
  108 17.507784754  10.6.15.186 → 192.168.1.16 SSH 194 Server: [TCP Spurious Retransmission] , Encrypted packet (len=128)
  109 17.507791230 192.168.1.16 → 10.6.15.186  TCP 78 [TCP Dup ACK 103#2] 43250 → 22 [ACK] Seq=3321 Ack=40757 Win=1810 Len=0 TSval=19069208 TSecr=3377661 SLE=40629 SRE=40757
  110 17.508631617  10.6.15.186 → 192.168.1.16 TCP 66 22 → 43250 [ACK] Seq=40757 Ack=3285 Win=2127 Len=0 TSval=3377723 TSecr=19069208
  111 17.508993674  10.6.15.186 → 192.168.1.16 SSH 102 Server: Encrypted packet (len=36)
  112 17.509021489 192.168.1.16 → 10.6.15.186  TCP 66 43250 → 22 [ACK] Seq=3321 Ack=40793 Win=1810 Len=0 TSval=19069209 TSecr=3377723
  113 17.544526899  10.6.15.186 → 192.168.1.16 TCP 66 22 → 43250 [ACK] Seq=40793 Ack=3321 Win=2127 Len=0 TSval=3377733 TSecr=19069208
  114 18.498216089  10.6.15.186 → 192.168.1.16 SSH 158 Server: Encrypted packet (len=92)
  115 18.498237836 192.168.1.16 → 10.6.15.186  TCP 66 43250 → 22 [ACK] Seq=3321 Ack=40885 Win=1810 Len=0 TSval=19069456 TSecr=3377969
  116 18.498499698 192.168.1.16 → 10.6.15.186  SSH 102 Client: Encrypted packet (len=36)
  117 18.498973690  10.6.15.186 → 192.168.1.16 SSH 102 Server: Encrypted packet (len=36)
  118 18.499282181 192.168.1.16 → 10.6.15.186  SSH 102 Client: Encrypted packet (len=36)
  119 18.501306499  10.6.15.186 → 192.168.1.16 TCP 66 22 → 43250 [ACK] Seq=40921 Ack=3357 Win=2127 Len=0 TSval=3377971 TSecr=19069456
  120 18.501326582  10.6.15.186 → 192.168.1.16 TCP 66 22 → 43250 [ACK] Seq=40921 Ack=3393 Win=2127 Len=0 TSval=3377972 TSecr=19069456
  121 18.501490035  10.6.15.186 → 192.168.1.16 SSH 102 Server: Encrypted packet (len=36)
  122 18.544003645 192.168.1.16 → 10.6.15.186  TCP 66 43250 → 22 [ACK] Seq=3393 Ack=40957 Win=1810 Len=0 TSval=19069468 TSecr=3377972
  123 23.408567120 192.168.1.16 → 13.126.27.131 NTP 90 NTP Version 4, client
  124 24.444372933 192.168.1.16 → 239.255.255.250 SSDP 213 M-SEARCH * HTTP/1.1 
  125 25.408514706 192.168.1.16 → 13.126.37.14 NTP 90 NTP Version 4, client
  126 25.444943480 192.168.1.16 → 239.255.255.250 SSDP 213 M-SEARCH * HTTP/1.1 
  127 26.445109725 192.168.1.16 → 239.255.255.250 SSDP 213 M-SEARCH * HTTP/1.1 
  128 27.445593788 192.168.1.16 → 239.255.255.250 SSDP 213 M-SEARCH * HTTP/1.1 
  129 30.720026069 192.168.1.16 → 54.77.5.47   TCP 66 53566 → 8282 [ACK] Seq=1 Ack=1 Win=328 Len=0 TSval=19072512 TSecr=311539663
  130 32.481955986   54.77.5.47 → 192.168.1.16 TCP 66 [TCP ACKed unseen segment] 8282 → 53566 [ACK] Seq=1 Ack=2 Win=121 Len=0 TSval=311551215 TSecr=19026544
  131 33.473999816  10.6.15.186 → 192.168.1.16 SSH 102 Server: Encrypted packet (len=36)
  132 33.474025852 192.168.1.16 → 10.6.15.186  TCP 66 43250 → 22 [ACK] Seq=3393 Ack=40993 Win=1810 Len=0 TSval=19073200 TSecr=3381613
  133 33.474041450  10.6.15.186 → 192.168.1.16 SSH 102 Server: [TCP Spurious Retransmission] , Encrypted packet (len=36)
  134 33.474046036 192.168.1.16 → 10.6.15.186  TCP 78 [TCP Dup ACK 132#1] 43250 → 22 [ACK] Seq=3393 Ack=40993 Win=1810 Len=0 TSval=19073200 TSecr=3381687 SLE=40957 SRE=40993
  135 37.410012302 192.168.1.16 → 192.168.1.1  DNS 81 Standard query 0x245f A 3.ubuntu.pool.ntp.org
  136 37.413504693  192.168.1.1 → 192.168.1.16 DNS 145 Standard query response 0x245f A 3.ubuntu.pool.ntp.org A 13.126.27.131 A 139.59.50.38 A 139.59.21.22 A 123.108.200.124
  137 37.413949432 192.168.1.16 → 13.126.27.131 NTP 90 NTP Version 4, client
