    1 0.000000000 192.168.1.16 → 10.6.15.144  SSH 134 Client: Encrypted packet (len=68)
    2 0.074318908  10.6.15.144 → 192.168.1.16 TCP 66 22 → 59298 [ACK] Seq=1 Ack=69 Win=1452 Len=0 TSval=4021540 TSecr=3425198
    3 0.124373355 192.168.1.16 → 10.6.15.144  SSH 1166 Client: Encrypted packet (len=1100)
    4 0.134037027 192.168.1.16 → 10.6.15.144  SSH 190 Client: Encrypted packet (len=124)
    5 0.135276141 192.168.1.16 → 10.6.15.144  SSH 238 Client: Encrypted packet (len=172)
    6 0.144886301  10.6.15.144 → 192.168.1.16 TCP 66 22 → 59298 [ACK] Seq=1 Ack=1293 Win=1452 Len=0 TSval=4021557 TSecr=3425231
    7 0.146100222  10.6.15.144 → 192.168.1.16 TCP 66 22 → 59298 [ACK] Seq=1 Ack=1465 Win=1452 Len=0 TSval=4021558 TSecr=3425231
    8 0.150688637  10.6.15.144 → 192.168.1.16 SSH 142 Server: Encrypted packet (len=76)
    9 0.162785371  10.6.15.144 → 192.168.1.16 SSH 1514 Server: Encrypted packet (len=1448)
   10 0.162804241 192.168.1.16 → 10.6.15.144  TCP 66 59298 → 22 [ACK] Seq=1465 Ack=1525 Win=3666 Len=0 TSval=3425238 TSecr=4021559
   11 0.162989544  10.6.15.144 → 192.168.1.16 SSH 1514 Server: Encrypted packet (len=1448)
   12 0.173775610  10.6.15.144 → 192.168.1.16 SSH 1514 Server: Encrypted packet (len=1448)
   13 0.173791438 192.168.1.16 → 10.6.15.144  TCP 66 59298 → 22 [ACK] Seq=1465 Ack=4421 Win=3666 Len=0 TSval=3425241 TSecr=4021562
   14 0.173980990  10.6.15.144 → 192.168.1.16 SSH 1514 Server: Encrypted packet (len=1448)
   15 0.184959896  10.6.15.144 → 192.168.1.16 SSH 1514 Server: Encrypted packet (len=1448)
   16 0.184976616 192.168.1.16 → 10.6.15.144  TCP 66 59298 → 22 [ACK] Seq=1465 Ack=7317 Win=3666 Len=0 TSval=3425244 TSecr=4021564
   17 0.185165456  10.6.15.144 → 192.168.1.16 SSH 1514 Server: Encrypted packet (len=1448)
   18 0.208180616 192.168.1.16 → 10.6.15.144  SSH 174 Client: Encrypted packet (len=108)
   19 0.209443232 192.168.1.16 → 10.6.15.144  SSH 958 Client: Encrypted packet (len=892)
   20 0.248061056  10.6.15.144 → 192.168.1.16 SSH 1514 Server: Encrypted packet (len=1448)
   21 0.248265738  10.6.15.144 → 192.168.1.16 SSH 1514 Server: Encrypted packet (len=1448)
   22 0.248274581 192.168.1.16 → 10.6.15.144  TCP 66 59298 → 22 [ACK] Seq=2465 Ack=11661 Win=3666 Len=0 TSval=3425260 TSecr=4021583
   23 0.248471673  10.6.15.144 → 192.168.1.16 SSH 534 Server: Encrypted packet (len=468)
   24 0.249235373 192.168.1.16 → 10.6.15.144  SSH 134 Client: Encrypted packet (len=68)
   25 0.263111059  10.6.15.144 → 192.168.1.16 TCP 66 22 → 59298 [ACK] Seq=12129 Ack=2533 Win=1452 Len=0 TSval=4021587 TSecr=3425250
   26 0.269270164 192.168.1.16 → 10.6.15.144  SSH 710 Client: Encrypted packet (len=644)
   27 0.285061998 192.168.1.16 → 10.6.15.144  SSH 102 Client: Encrypted packet (len=36)
   28 0.285294134 192.168.1.16 → 10.6.15.144  SSH 138 Client: Encrypted packet (len=72)
   29 0.285516712 192.168.1.16 → 10.6.15.144  SSH 138 Client: Encrypted packet (len=72)
   30 0.285746536 192.168.1.16 → 10.6.15.144  SSH 102 Client: Encrypted packet (len=36)
   31 0.295130144  10.6.15.144 → 192.168.1.16 TCP 66 22 → 59298 [ACK] Seq=12129 Ack=3213 Win=1452 Len=0 TSval=4021595 TSecr=3425265
   32 0.295157457 192.168.1.16 → 10.6.15.144  SSH 1514 Client: Encrypted packet (len=1448)
   33 0.295175335 192.168.1.16 → 10.6.15.144  SSH 570 Client: Encrypted packet (len=504)
   34 0.295184535  10.6.15.144 → 192.168.1.16 TCP 66 22 → 59298 [ACK] Seq=12129 Ack=3393 Win=1452 Len=0 TSval=4021595 TSecr=3425269
   35 0.307413047  10.6.15.144 → 192.168.1.16 TCP 66 22 → 59298 [ACK] Seq=12129 Ack=5345 Win=1452 Len=0 TSval=4021598 TSecr=3425271
   36 0.310275504  10.6.15.144 → 192.168.1.16 SSH 142 Server: Encrypted packet (len=76)
   37 0.310775191  10.6.15.144 → 192.168.1.16 SSH 262 Server: Encrypted packet (len=196)
   38 0.310799618 192.168.1.16 → 10.6.15.144  TCP 66 59298 → 22 [ACK] Seq=5345 Ack=12401 Win=3666 Len=0 TSval=3425275 TSecr=4021599
   39 0.311880626 192.168.1.16 → 10.6.15.144  SSH 134 Client: Encrypted packet (len=68)
   40 0.320914355  10.6.15.144 → 192.168.1.16 SSH 254 Server: Encrypted packet (len=188)
   41 0.320949018  10.6.15.144 → 192.168.1.16 SSH 282 Server: Encrypted packet (len=216)
   42 0.320970423 192.168.1.16 → 10.6.15.144  TCP 66 59298 → 22 [ACK] Seq=5413 Ack=12805 Win=3666 Len=0 TSval=3425278 TSecr=4021601
   43 0.321360377 192.168.1.16 → 10.6.15.144  SSH 174 Client: Encrypted packet (len=108)
   44 0.330583494  10.6.15.144 → 192.168.1.16 TCP 66 22 → 59298 [ACK] Seq=12805 Ack=5521 Win=1452 Len=0 TSval=4021604 TSecr=3425275
   45 0.331812401  10.6.15.144 → 192.168.1.16 SSH 126 Server: Encrypted packet (len=60)
   46 0.331834136  10.6.15.144 → 192.168.1.16 SSH 138 Server: Encrypted packet (len=72)
   47 0.331892628 192.168.1.16 → 10.6.15.144  TCP 66 59298 → 22 [ACK] Seq=5521 Ack=12937 Win=3666 Len=0 TSval=3425280 TSecr=4021604
   48 0.332182018 192.168.1.16 → 10.6.15.144  SSH 102 Client: Encrypted packet (len=36)
   49 0.335497734  10.6.15.144 → 192.168.1.16 SSH 390 Server: Encrypted packet (len=324)
   50 0.355063328  10.6.15.144 → 192.168.1.16 SSH 270 Server: Encrypted packet (len=204)
   51 0.355132441 192.168.1.16 → 10.6.15.144  TCP 66 59298 → 22 [ACK] Seq=5557 Ack=13465 Win=3666 Len=0 TSval=3425286 TSecr=4021605
   52 0.360479957 192.168.1.16 → 10.6.15.144  SSH 102 Client: Encrypted packet (len=36)
   53 0.361742695 192.168.1.16 → 10.6.15.144  SSH 102 Client: Encrypted packet (len=36)
   54 0.363044883 192.168.1.16 → 10.6.15.144  SSH 102 Client: Encrypted packet (len=36)
   55 0.365604739 192.168.1.16 → 10.6.15.144  SSH 218 Client: Encrypted packet (len=152)
   56 0.372694765  10.6.15.144 → 192.168.1.16 TCP 66 22 → 59298 [ACK] Seq=13465 Ack=5629 Win=1452 Len=0 TSval=4021614 TSecr=3425288
   57 0.378634259  10.6.15.144 → 192.168.1.16 SSH 146 Server: Encrypted packet (len=80)
   58 0.379116594 192.168.1.16 → 10.6.15.144  SSH 446 Client: Encrypted packet (len=380)
   59 0.381742621 192.168.1.16 → 10.6.15.144  SSH 158 Client: Encrypted packet (len=92)
   60 0.385293284  10.6.15.144 → 192.168.1.16 SSH 102 Server: Encrypted packet (len=36)
   61 0.385319061  10.6.15.144 → 192.168.1.16 SSH 102 Server: Encrypted packet (len=36)
   62 0.385389142 192.168.1.16 → 10.6.15.144  TCP 66 59298 → 22 [ACK] Seq=6289 Ack=13617 Win=3666 Len=0 TSval=3425294 TSecr=4021616
   63 0.385707104 192.168.1.16 → 10.6.15.144  SSH 158 Client: Encrypted packet (len=92)
   64 0.386406609 192.168.1.16 → 10.6.15.144  SSH 150 Client: Encrypted packet (len=84)
   65 0.406325866  10.6.15.144 → 192.168.1.16 TCP 78 [TCP Dup ACK 56#1] 22 → 59298 [ACK] Seq=13617 Ack=5629 Win=1452 Len=0 TSval=4021623 TSecr=3425288 SLE=5665 SRE=5817
   66 0.406437390  10.6.15.144 → 192.168.1.16 SSH 710 Server: Encrypted packet (len=632)
   67 0.406826947 192.168.1.16 → 10.6.15.144  SSH 102 Client: Encrypted packet (len=36)
   68 0.408242727 192.168.1.16 → 10.6.15.144  SSH 102 Client: Encrypted packet (len=36)
   69 0.436039495  10.6.15.144 → 192.168.1.16 SSH 362 Server: Encrypted packet (len=284)
   70 0.436066262  10.6.15.144 → 192.168.1.16 TCP 86 [TCP Dup ACK 56#2] 22 → 59298 [ACK] Seq=14533 Ack=5629 Win=1452 Len=0 TSval=4021630 TSecr=3425288 SLE=6289 SRE=6381 SLE=5665 SRE=6197
   71 0.436079901 192.168.1.16 → 10.6.15.144  SSH 102 Client: [TCP Fast Retransmission] , Encrypted packet (len=36)
   72 0.437765405  10.6.15.144 → 192.168.1.16 TCP 86 [TCP Dup ACK 56#3] 22 → 59298 [ACK] Seq=14533 Ack=5629 Win=1452 Len=0 TSval=4021630 TSecr=3425288 SLE=6289 SRE=6465 SLE=5665 SRE=6197
   73 0.437779168 192.168.1.16 → 10.6.15.144  TCP 158 [TCP Retransmission] 59298 → 22 [PSH, ACK] Seq=6197 Ack=14533 Win=3666 Len=92 TSval=3425307 TSecr=4021630
   74 0.467557102  10.6.15.144 → 192.168.1.16 TCP 94 [TCP Dup ACK 56#4] 22 → 59298 [ACK] Seq=14533 Ack=5629 Win=1452 Len=0 TSval=4021638 TSecr=3425288 SLE=6501 SRE=6537 SLE=6289 SRE=6465 SLE=5665 SRE=6197
   75 0.467579146 192.168.1.16 → 10.6.15.144  SSH 1362 Client: Encrypted packet (len=1296)
   76 0.467592116  10.6.15.144 → 192.168.1.16 TCP 86 22 → 59298 [ACK] Seq=14533 Ack=6197 Win=1448 Len=0 TSval=4021638 TSecr=3425307 SLE=6501 SRE=6537 SLE=6289 SRE=6465
   77 0.467597745 192.168.1.16 → 10.6.15.144  TCP 102 [TCP Out-Of-Order] 59298 → 22 [PSH, ACK] Seq=6465 Ack=14533 Win=3666 Len=36 TSval=3425314 TSecr=4021638
   78 0.469040484  10.6.15.144 → 192.168.1.16 TCP 78 22 → 59298 [ACK] Seq=14533 Ack=6465 Win=1446 Len=0 TSval=4021638 TSecr=3425307 SLE=6501 SRE=6537
   79 0.479717696  10.6.15.144 → 192.168.1.16 TCP 66 22 → 59298 [ACK] Seq=14533 Ack=6537 Win=1452 Len=0 TSval=4021641 TSecr=3425314
   80 0.483358533  10.6.15.144 → 192.168.1.16 TCP 66 22 → 59298 [ACK] Seq=14533 Ack=7833 Win=1452 Len=0 TSval=4021642 TSecr=3425314
   81 0.560108065  10.6.15.144 → 192.168.1.16 SSH 1514 Server: Encrypted packet (len=1448)
   82 0.560290742  10.6.15.144 → 192.168.1.16 SSH 1514 Server: Encrypted packet (len=1448)
   83 0.560300636 192.168.1.16 → 10.6.15.144  TCP 66 59298 → 22 [ACK] Seq=7833 Ack=17429 Win=3666 Len=0 TSval=3425338 TSecr=4021661
   84 0.560482174  10.6.15.144 → 192.168.1.16 SSH 1514 Server: Encrypted packet (len=1448)
   85 0.560540247 192.168.1.16 → 10.6.15.144  SSH 382 Client: Encrypted packet (len=316)
   86 0.562456887 192.168.1.16 → 10.6.15.144  SSH 582 Client: Encrypted packet (len=516)
   87 0.563052757 192.168.1.16 → 10.6.15.144  SSH 206 Client: Encrypted packet (len=140)
   88 0.572136911  10.6.15.144 → 192.168.1.16 SSH 282 Server: Encrypted packet (len=216)
   89 0.572281745  10.6.15.144 → 192.168.1.16 TCP 66 22 → 59298 [ACK] Seq=19093 Ack=8149 Win=1452 Len=0 TSval=4021664 TSecr=3425338
   90 0.572646204  10.6.15.144 → 192.168.1.16 TCP 66 22 → 59298 [ACK] Seq=19093 Ack=8665 Win=1452 Len=0 TSval=4021664 TSecr=3425338
   91 0.572782229  10.6.15.144 → 192.168.1.16 TCP 66 22 → 59298 [ACK] Seq=19093 Ack=8805 Win=1452 Len=0 TSval=4021664 TSecr=3425338
   92 0.573268000 192.168.1.16 → 10.6.15.144  SSH 206 Client: Encrypted packet (len=140)
   93 0.583998767  10.6.15.144 → 192.168.1.16 TCP 66 22 → 59298 [ACK] Seq=19093 Ack=8945 Win=1452 Len=0 TSval=4021667 TSecr=3425341
   94 0.600719087  10.6.15.144 → 192.168.1.16 SSH 246 Server: Encrypted packet (len=180)
   95 0.600737242  10.6.15.144 → 192.168.1.16 SSH 214 Server: Encrypted packet (len=148)
   96 0.600798204 192.168.1.16 → 10.6.15.144  TCP 66 59298 → 22 [ACK] Seq=8945 Ack=19421 Win=3666 Len=0 TSval=3425348 TSecr=4021671
   97 0.602068565 192.168.1.16 → 10.6.15.144  SSH 134 Client: Encrypted packet (len=68)
   98 0.602806158 192.168.1.16 → 10.6.15.144  SSH 562 Client: Encrypted packet (len=496)
   99 0.606421303 192.168.1.16 → 10.6.15.144  SSH 502 Client: Encrypted packet (len=436)
  100 0.627809241  10.6.15.144 → 192.168.1.16 SSH 102 Server: Encrypted packet (len=36)
  101 0.628180142 192.168.1.16 → 10.6.15.144  SSH 158 Client: Encrypted packet (len=92)
  102 0.668391447  10.6.15.144 → 192.168.1.16 SSH 1514 Server: Encrypted packet (len=1436)
  103 0.668596476  10.6.15.144 → 192.168.1.16 SSH 1514 Server: Encrypted packet (len=1436)
  104 0.668606388 192.168.1.16 → 10.6.15.144  TCP 66 59298 → 22 [ACK] Seq=10037 Ack=22329 Win=3666 Len=0 TSval=3425365 TSecr=4021688
  105 0.668621002  10.6.15.144 → 192.168.1.16 TCP 78 [TCP Dup ACK 93#1] 22 → 59298 [ACK] Seq=22329 Ack=8945 Win=1452 Len=0 TSval=4021688 TSecr=3425341 SLE=9013 SRE=9945
  106 0.668627595  10.6.15.144 → 192.168.1.16 SSH 102 Server: Encrypted packet (len=24)
  107 0.668633508 192.168.1.16 → 10.6.15.144  TCP 134 [TCP Retransmission] 59298 → 22 [PSH, ACK] Seq=8945 Ack=22329 Win=3666 Len=68 TSval=3425365 TSecr=4021688
  108 0.681619558  10.6.15.144 → 192.168.1.16 SSH 1514 Server: Encrypted packet (len=1436)
  109 0.681649955 192.168.1.16 → 10.6.15.144  TCP 66 59298 → 22 [ACK] Seq=10037 Ack=23789 Win=3666 Len=0 TSval=3425368 TSecr=4021688
  110 0.681823734  10.6.15.144 → 192.168.1.16 SSH 1514 Server: Encrypted packet (len=1436)
  111 0.681838930  10.6.15.144 → 192.168.1.16 TCP 66 22 → 59298 [ACK] Seq=25225 Ack=10037 Win=1451 Len=0 TSval=4021691 TSecr=3425365
  112 0.681848453 192.168.1.16 → 10.6.15.144  SSH 414 Client: Encrypted packet (len=348)
  113 0.685993964 192.168.1.16 → 10.6.15.144  SSH 346 Client: Encrypted packet (len=280)
  114 0.749756927  10.6.15.144 → 192.168.1.16 SSH 90 Server: Encrypted packet (len=24)
  115 0.758081293  10.6.15.144 → 192.168.1.16 SSH 1514 Server: Encrypted packet (len=1436)
  116 0.758104964 192.168.1.16 → 10.6.15.144  TCP 66 59298 → 22 [ACK] Seq=10665 Ack=26685 Win=3666 Len=0 TSval=3425387 TSecr=4021709
  117 0.758248409  10.6.15.144 → 192.168.1.16 SSH 1282 Server: Encrypted packet (len=1204)
  118 0.758404868 192.168.1.16 → 10.6.15.144  SSH 102 Client: Encrypted packet (len=36)
  119 0.767482550  10.6.15.144 → 192.168.1.16 TCP 78 [TCP Dup ACK 111#1] 22 → 59298 [ACK] Seq=27889 Ack=10037 Win=1452 Len=0 TSval=4021713 TSecr=3425365 SLE=10385 SRE=10701
  120 0.767507476 192.168.1.16 → 10.6.15.144  SSH 346 Client: Encrypted packet (len=280)
  121 0.776855143  10.6.15.144 → 192.168.1.16 TCP 78 [TCP Dup ACK 111#2] 22 → 59298 [ACK] Seq=27889 Ack=10037 Win=1452 Len=0 TSval=4021716 TSecr=3425365 SLE=10385 SRE=10981
  122 0.776871576 192.168.1.16 → 10.6.15.144  SSH 414 Client: [TCP Fast Retransmission] , Encrypted packet (len=348)
  123 1.011989282 192.168.1.16 → 10.6.15.144  TCP 414 [TCP Retransmission] 59298 → 22 [PSH, ACK] Seq=10037 Ack=27889 Win=3666 Len=348 TSval=3425451 TSecr=4021716
  124 1.015519448  10.6.15.144 → 192.168.1.16 SSH 150 Server: Encrypted packet (len=72)
  125 1.019778243  10.6.15.144 → 192.168.1.16 SSH 530 Server: Encrypted packet (len=452)
  126 1.019814740 192.168.1.16 → 10.6.15.144  TCP 66 59298 → 22 [ACK] Seq=10981 Ack=28413 Win=3666 Len=0 TSval=3425452 TSecr=4021759
  127 1.047453463  10.6.15.144 → 192.168.1.16 TCP 66 22 → 59298 [ACK] Seq=28413 Ack=10981 Win=1446 Len=0 TSval=4021783 TSecr=3425451
  128 1.047474503 192.168.1.16 → 10.6.15.144  SSH 1514 Client: Encrypted packet (len=1448)
  129 1.047486119 192.168.1.16 → 10.6.15.144  SSH 954 Client: Encrypted packet (len=888)
  130 1.062327850  10.6.15.144 → 192.168.1.16 TCP 78 [TCP Window Update] 22 → 59298 [ACK] Seq=28413 Ack=10981 Win=1452 Len=0 TSval=4021787 TSecr=3425452 SLE=12429 SRE=13317
  131 1.067438707  10.6.15.144 → 192.168.1.16 TCP 66 22 → 59298 [ACK] Seq=28413 Ack=13317 Win=1446 Len=0 TSval=4021788 TSecr=3425459
  132 1.117788712  10.6.15.144 → 192.168.1.16 SSH 398 Server: Encrypted packet (len=332)
  133 1.120162783 192.168.1.16 → 10.6.15.144  SSH 630 Client: Encrypted packet (len=564)
  134 1.127282982  10.6.15.144 → 192.168.1.16 SSH 390 Server: Encrypted packet (len=324)
  135 1.127363334  10.6.15.144 → 192.168.1.16 SSH 382 Server: Encrypted packet (len=316)
  136 1.127410938 192.168.1.16 → 10.6.15.144  TCP 66 59298 → 22 [ACK] Seq=13881 Ack=29385 Win=3666 Len=0 TSval=3425479 TSecr=4021801
  137 1.134965047  10.6.15.144 → 192.168.1.16 TCP 66 22 → 59298 [ACK] Seq=29385 Ack=13881 Win=1452 Len=0 TSval=4021805 TSecr=3425478
  138 1.150889392  10.6.15.144 → 192.168.1.16 SSH 610 Server: Encrypted packet (len=544)
  139 1.150924617  10.6.15.144 → 192.168.1.16 SSH 334 Server: Encrypted packet (len=268)
  140 1.150948370 192.168.1.16 → 10.6.15.144  TCP 66 59298 → 22 [ACK] Seq=13881 Ack=30197 Win=3666 Len=0 TSval=3425485 TSecr=4021809
  141 1.170752053  10.6.15.144 → 192.168.1.16 SSH 334 Server: Encrypted packet (len=268)
  142 1.205437363  10.6.15.144 → 192.168.1.16 SSH 1286 Server: Encrypted packet (len=1220)
  143 1.205452927 192.168.1.16 → 10.6.15.144  TCP 66 59298 → 22 [ACK] Seq=13881 Ack=31685 Win=3666 Len=0 TSval=3425499 TSecr=4021814
  144 2.025972593  10.6.15.144 → 192.168.1.16 SSH 470 Server: Encrypted packet (len=404)
  145 2.025997702  10.6.15.144 → 192.168.1.16 TCP 470 [TCP Retransmission] 22 → 59298 [PSH, ACK] Seq=31685 Ack=13881 Win=1452 Len=404 TSval=4021941 TSecr=3425499
  146 2.026008816 192.168.1.16 → 10.6.15.144  TCP 78 59298 → 22 [ACK] Seq=13881 Ack=32089 Win=3666 Len=0 TSval=3425704 TSecr=4021941 SLE=31685 SRE=32089
  147 2.026057000  10.6.15.144 → 192.168.1.16 SSH 470 Server: [TCP Spurious Retransmission] , Encrypted packet (len=404)
  148 2.026060918 192.168.1.16 → 10.6.15.144  TCP 78 [TCP Dup ACK 146#1] 59298 → 22 [ACK] Seq=13881 Ack=32089 Win=3666 Len=0 TSval=3425704 TSecr=4022001 SLE=31685 SRE=32089
  149 2.718123571 192.168.1.16 → 139.59.50.38 NTP 90 NTP Version 4, client
  150 2.736887218  10.6.15.144 → 192.168.1.16 SSH 126 Server: Encrypted packet (len=60)
  151 2.736931047 192.168.1.16 → 10.6.15.144  TCP 66 59298 → 22 [ACK] Seq=13881 Ack=32149 Win=3666 Len=0 TSval=3425882 TSecr=4022072
  152 2.736964333  10.6.15.144 → 192.168.1.16 SSH 102 Server: Encrypted packet (len=36)
  153 2.736978666 192.168.1.16 → 10.6.15.144  TCP 66 59298 → 22 [ACK] Seq=13881 Ack=32185 Win=3666 Len=0 TSval=3425882 TSecr=4022072
  154 2.737109128 10.22.17.255 → 224.0.0.252  LLMNR 68 Standard query 0x25f2 A swaeaksy
  155 2.737217191  10.6.15.144 → 192.168.1.16 SSH 102 Server: [TCP Spurious Retransmission] , Encrypted packet (len=36)
  156 2.737231504 192.168.1.16 → 10.6.15.144  TCP 78 [TCP Dup ACK 153#1] 59298 → 22 [ACK] Seq=13881 Ack=32185 Win=3666 Len=0 TSval=3425882 TSecr=4022110 SLE=32149 SRE=32185
  157 2.744300929 10.22.17.255 → 224.0.0.252  LLMNR 68 Standard query 0x25f2 A swaeaksy
  158 4.010491285  10.6.15.144 → 192.168.1.16 SSH 126 Server: Encrypted packet (len=60)
  159 4.010529895 192.168.1.16 → 10.6.15.144  TCP 66 59298 → 22 [ACK] Seq=13881 Ack=32245 Win=3666 Len=0 TSval=3426200 TSecr=4022464
  160 6.026586764  10.6.15.144 → 192.168.1.16 SSH 102 Server: Encrypted packet (len=36)
  161 6.026615641 192.168.1.16 → 10.6.15.144  TCP 66 59298 → 22 [ACK] Seq=13881 Ack=32281 Win=3666 Len=0 TSval=3426704 TSecr=4022848
  162 6.027682498  10.6.15.144 → 192.168.1.16 SSH 126 Server: Encrypted packet (len=60)
  163 6.027710650 192.168.1.16 → 10.6.15.144  TCP 66 59298 → 22 [ACK] Seq=13881 Ack=32341 Win=3666 Len=0 TSval=3426704 TSecr=4022882
  164 6.028651079  10.6.15.144 → 192.168.1.16 SSH 102 Server: Encrypted packet (len=36)
  165 6.028680675 192.168.1.16 → 10.6.15.144  TCP 66 59298 → 22 [ACK] Seq=13881 Ack=32377 Win=3666 Len=0 TSval=3426705 TSecr=4022883
  166 6.029265602  10.6.15.144 → 192.168.1.16 SSH 126 Server: Encrypted packet (len=60)
  167 6.029295111 192.168.1.16 → 10.6.15.144  TCP 66 59298 → 22 [ACK] Seq=13881 Ack=32437 Win=3666 Len=0 TSval=3426705 TSecr=4022883
  168 6.030384226  10.6.15.144 → 192.168.1.16 SSH 590 Server: Encrypted packet (len=524)
  169 6.030415003 192.168.1.16 → 10.6.15.144  TCP 66 59298 → 22 [ACK] Seq=13881 Ack=32961 Win=3666 Len=0 TSval=3426705 TSecr=4022981
  170 6.718027141 192.168.1.16 → 123.108.200.124 NTP 90 NTP Version 4, client
  171 8.042435690 10.22.18.209 → 224.0.0.252  LLMNR 64 Standard query 0x7b06 A wpad
  172 8.042682152 10.22.18.209 → 224.0.0.252  LLMNR 64 Standard query 0x7b06 A wpad
  173 8.449331353 192.168.1.16 → 10.6.15.144  SSH 138 Client: Encrypted packet (len=72)
  174 8.453960166 192.168.1.16 → 10.6.15.144  SSH 110 Client: Encrypted packet (len=44)
  175 8.464749457 10.22.17.255 → 224.0.0.252  LLMNR 68 Standard query 0xbfc5 A swaeaksy
  176 8.486665263  10.6.15.144 → 192.168.1.16 TCP 78 [TCP Dup ACK 137#1] 22 → 59298 [ACK] Seq=32961 Ack=13881 Win=1452 Len=0 TSval=4023643 TSecr=3426705 SLE=13953 SRE=13997
  177 8.680038207 192.168.1.16 → 10.6.15.144  TCP 138 [TCP Retransmission] 59298 → 22 [PSH, ACK] Seq=13881 Ack=32961 Win=3666 Len=72 TSval=3427368 TSecr=4023643
  178 8.690918759  10.6.15.144 → 192.168.1.16 TCP 66 22 → 59298 [ACK] Seq=32961 Ack=13997 Win=1452 Len=0 TSval=4023694 TSecr=3427368
  179 8.691563033  10.6.15.144 → 192.168.1.16 SSH 102 Server: Encrypted packet (len=36)
  180 8.691581092 192.168.1.16 → 10.6.15.144  TCP 66 59298 → 22 [ACK] Seq=13997 Ack=32997 Win=3666 Len=0 TSval=3427370 TSecr=4023694
  181 8.737743128 10.22.17.255 → 224.0.0.252  LLMNR 68 Standard query 0xbfc5 A swaeaksy
  182 8.837368603  10.6.15.144 → 192.168.1.16 SSH 110 Server: Encrypted packet (len=44)
  183 8.837392935 192.168.1.16 → 10.6.15.144  TCP 66 59298 → 22 [ACK] Seq=13997 Ack=33041 Win=3666 Len=0 TSval=3427407 TSecr=4023730
  184 8.837995209 192.168.1.16 → 10.6.15.144  SSH 382 Client: Encrypted packet (len=316)
  185 8.885833371  10.6.15.144 → 192.168.1.16 TCP 66 22 → 59298 [ACK] Seq=33041 Ack=14313 Win=1452 Len=0 TSval=4023743 TSecr=3427407
  186 8.985545988  10.6.15.144 → 192.168.1.16 SSH 838 Server: Encrypted packet (len=772)
  187 8.987093260  10.6.15.144 → 192.168.1.16 SSH 1318 Server: Encrypted packet (len=1252)
  188 8.987122958 192.168.1.16 → 10.6.15.144  TCP 66 59298 → 22 [ACK] Seq=14313 Ack=35065 Win=3666 Len=0 TSval=3427444 TSecr=4023767
  189 8.989162205 192.168.1.16 → 10.6.15.144  SSH 206 Client: Encrypted packet (len=140)
  190 8.989593077 192.168.1.16 → 10.6.15.144  SSH 230 Client: Encrypted packet (len=164)
  191 8.998892053  10.6.15.144 → 192.168.1.16 TCP 66 22 → 59298 [ACK] Seq=35065 Ack=14453 Win=1452 Len=0 TSval=4023771 TSecr=3427445
  192 8.998916610 192.168.1.16 → 10.6.15.144  SSH 542 Client: Encrypted packet (len=476)
  193 8.999003306  10.6.15.144 → 192.168.1.16 TCP 66 22 → 59298 [ACK] Seq=35065 Ack=14617 Win=1452 Len=0 TSval=4023771 TSecr=3427445
  194 9.009514215  10.6.15.144 → 192.168.1.16 TCP 66 22 → 59298 [ACK] Seq=35065 Ack=15093 Win=1452 Len=0 TSval=4023774 TSecr=3427447
  195 10.026533598  10.6.15.144 → 192.168.1.16 SSH 470 Server: Encrypted packet (len=404)
  196 10.026592199  10.6.15.144 → 192.168.1.16 SSH 534 Server: Encrypted packet (len=468)
  197 10.026660412  10.6.15.144 → 192.168.1.16 TCP 534 [TCP Retransmission] 22 → 59298 [PSH, ACK] Seq=35469 Ack=15093 Win=1452 Len=468 TSval=4023930 TSecr=3427447
  198 10.026679150 192.168.1.16 → 10.6.15.144  TCP 78 59298 → 22 [ACK] Seq=15093 Ack=35937 Win=3666 Len=0 TSval=3427704 TSecr=4023807 SLE=35469 SRE=35937
  199 10.028290928 192.168.1.16 → 10.6.15.144  SSH 126 Client: Encrypted packet (len=60)
  200 10.038162920  10.6.15.144 → 192.168.1.16 TCP 66 22 → 59298 [ACK] Seq=35937 Ack=15153 Win=1452 Len=0 TSval=4024031 TSecr=3427705
  201 10.048253145 192.168.1.16 → 10.6.15.144  SSH 102 Client: Encrypted packet (len=36)
  202 10.049380385 192.168.1.16 → 10.6.15.144  SSH 102 Client: Encrypted packet (len=36)
  203 10.057712953  10.6.15.144 → 192.168.1.16 TCP 66 22 → 59298 [ACK] Seq=35937 Ack=15189 Win=1452 Len=0 TSval=4024036 TSecr=3427710
  204 10.057736657 192.168.1.16 → 10.6.15.144  SSH 406 Client: Encrypted packet (len=340)
  205 10.061836115  10.6.15.144 → 192.168.1.16 TCP 66 22 → 59298 [ACK] Seq=35937 Ack=15225 Win=1452 Len=0 TSval=4024036 TSecr=3427710
  206 10.068591995  10.6.15.144 → 192.168.1.16 TCP 66 22 → 59298 [ACK] Seq=35937 Ack=15565 Win=1452 Len=0 TSval=4024038 TSecr=3427712
  207 10.092500117  10.6.15.144 → 192.168.1.16 SSH 126 Server: Encrypted packet (len=60)
  208 10.092527127  10.6.15.144 → 192.168.1.16 SSH 138 Server: Encrypted packet (len=72)
  209 10.092590349 192.168.1.16 → 10.6.15.144  TCP 66 59298 → 22 [ACK] Seq=15565 Ack=36069 Win=3666 Len=0 TSval=3427721 TSecr=4024044
  210 10.092792841 192.168.1.16 → 10.6.15.144  SSH 102 Client: Encrypted packet (len=36)
  211 10.095667893  10.6.15.144 → 192.168.1.16 SSH 126 Server: Encrypted packet (len=60)
  212 10.095689627  10.6.15.144 → 192.168.1.16 SSH 138 Server: Encrypted packet (len=72)
  213 10.095749702 192.168.1.16 → 10.6.15.144  TCP 66 59298 → 22 [ACK] Seq=15601 Ack=36201 Win=3666 Len=0 TSval=3427721 TSecr=4024045
  214 10.095969949 192.168.1.16 → 10.6.15.144  SSH 102 Client: Encrypted packet (len=36)
  215 10.107610993  10.6.15.144 → 192.168.1.16 TCP 66 22 → 59298 [ACK] Seq=36201 Ack=15637 Win=1452 Len=0 TSval=4024048 TSecr=3427721
  216 10.584832869 192.168.1.16 → 10.6.15.144  SSH 1514 Client: Encrypted packet (len=1448)
  217 10.586546410 192.168.1.16 → 10.6.15.144  SSH 390 Client: Encrypted packet (len=324)
  218 10.587253538  10.6.15.144 → 192.168.1.16 SSH 302 Server: Encrypted packet (len=236)
  219 10.587279744  10.6.15.144 → 192.168.1.16 SSH 138 Server: Encrypted packet (len=72)
  220 10.587342246 192.168.1.16 → 10.6.15.144  TCP 66 59298 → 22 [ACK] Seq=17409 Ack=36509 Win=3666 Len=0 TSval=3427844 TSecr=4024075
  221 10.587537876 192.168.1.16 → 10.6.15.144  SSH 102 Client: Encrypted packet (len=36)
  222 10.596667612  10.6.15.144 → 192.168.1.16 TCP 66 22 → 59298 [ACK] Seq=36509 Ack=17409 Win=1452 Len=0 TSval=4024170 TSecr=3427844
  223 10.596686098 192.168.1.16 → 10.6.15.144  SSH 182 Client: Encrypted packet (len=116)
  224 10.599717121  10.6.15.144 → 192.168.1.16 SSH 142 Server: Encrypted packet (len=76)
  225 10.609885512  10.6.15.144 → 192.168.1.16 SSH 102 Server: Encrypted packet (len=36)
  226 10.609968308 192.168.1.16 → 10.6.15.144  TCP 66 59298 → 22 [ACK] Seq=17561 Ack=36621 Win=3666 Len=0 TSval=3427850 TSecr=4024171
  227 11.031264811 192.168.1.16 → 10.6.15.144  SSH 102 Client: Encrypted packet (len=36)
  228 11.032715134  10.6.15.144 → 192.168.1.16 SSH 878 Server: Encrypted packet (len=812)
  229 11.033193863  10.6.15.144 → 192.168.1.16 SSH 414 Server: Encrypted packet (len=348)
  230 11.033202531  10.6.15.144 → 192.168.1.16 SSH 110 Server: Encrypted packet (len=44)
  231 11.033228190 192.168.1.16 → 10.6.15.144  TCP 66 59298 → 22 [ACK] Seq=17597 Ack=37825 Win=3666 Len=0 TSval=3427956 TSecr=4024199
  232 11.033616804 192.168.1.16 → 10.6.15.144  SSH 134 Client: Encrypted packet (len=68)
  233 11.034447583 192.168.1.16 → 10.6.15.144  SSH 166 Client: Encrypted packet (len=100)
  234 11.043540021  10.6.15.144 → 192.168.1.16 TCP 66 22 → 59298 [ACK] Seq=37825 Ack=17665 Win=1452 Len=0 TSval=4024282 TSecr=3427955
  235 11.082212727  10.6.15.144 → 192.168.1.16 TCP 66 22 → 59298 [ACK] Seq=37825 Ack=17765 Win=1452 Len=0 TSval=4024292 TSecr=3427956
  236 11.209576618 192.168.1.16 → 10.6.15.144  SSH 102 Client: Encrypted packet (len=36)
  237 11.221154980  10.6.15.144 → 192.168.1.16 TCP 66 22 → 59298 [ACK] Seq=37825 Ack=17801 Win=1452 Len=0 TSval=4024326 TSecr=3428000
  238 11.256152960 192.168.1.16 → 10.6.15.144  SSH 102 Client: Encrypted packet (len=36)
  239 11.264319394  10.6.15.144 → 192.168.1.16 TCP 66 22 → 59298 [ACK] Seq=37825 Ack=17837 Win=1452 Len=0 TSval=4024338 TSecr=3428012
  240 11.365490207  10.6.15.144 → 192.168.1.16 SSH 1438 Server: Encrypted packet (len=1372)
  241 11.366536782 192.168.1.16 → 10.6.15.144  SSH 206 Client: Encrypted packet (len=140)
  242 11.368820078 192.168.1.16 → 10.6.15.144  SSH 230 Client: Encrypted packet (len=164)
  243 11.369195521 192.168.1.16 → 10.6.15.144  SSH 1102 Client: Encrypted packet (len=1036)
  244 11.376527405  10.6.15.144 → 192.168.1.16 TCP 66 22 → 59298 [ACK] Seq=39197 Ack=17977 Win=1452 Len=0 TSval=4024365 TSecr=3428039
  245 11.378317329  10.6.15.144 → 192.168.1.16 TCP 66 22 → 59298 [ACK] Seq=39197 Ack=18141 Win=1452 Len=0 TSval=4024366 TSecr=3428040
  246 11.379214100  10.6.15.144 → 192.168.1.16 TCP 66 22 → 59298 [ACK] Seq=39197 Ack=19177 Win=1452 Len=0 TSval=4024366 TSecr=3428040
  247 13.034064810  10.6.15.144 → 192.168.1.16 SSH 230 Server: Encrypted packet (len=164)
  248 13.034309643  10.6.15.144 → 192.168.1.16 SSH 134 Server: Encrypted packet (len=68)
  249 13.034367670 192.168.1.16 → 10.6.15.144  TCP 66 59298 → 22 [ACK] Seq=19177 Ack=39429 Win=3666 Len=0 TSval=3428456 TSecr=4024445
  250 13.034623281 192.168.1.16 → 10.6.15.144  SSH 126 Client: Encrypted packet (len=60)
  251 13.035377840  10.6.15.144 → 192.168.1.16 SSH 430 Server: Encrypted packet (len=364)
  252 13.035391787 10.22.18.209 → 224.0.0.252  LLMNR 64 Standard query 0x2142 A wpad
  253 13.035409473 10.22.18.209 → 224.0.0.252  LLMNR 64 Standard query 0x2142 A wpad
  254 13.035442913  10.6.15.144 → 192.168.1.16 TCP 430 [TCP Retransmission] 22 → 59298 [PSH, ACK] Seq=39429 Ack=19177 Win=1452 Len=364 TSval=4024556 TSecr=3428040
  255 13.035454346 192.168.1.16 → 10.6.15.144  TCP 78 59298 → 22 [ACK] Seq=19237 Ack=39793 Win=3666 Len=0 TSval=3428456 TSecr=4024556 SLE=39429 SRE=39793
  256 13.044246867 192.168.1.16 → 10.6.15.144  SSH 102 Client: Encrypted packet (len=36)
  257 13.049510567 192.168.1.16 → 10.6.15.144  SSH 918 Client: Encrypted packet (len=852)
  258 13.057291976  10.6.15.144 → 192.168.1.16 TCP 66 22 → 59298 [ACK] Seq=39793 Ack=19237 Win=1452 Len=0 TSval=4024783 TSecr=3428456
  259 13.059342814  10.6.15.144 → 192.168.1.16 TCP 66 22 → 59298 [ACK] Seq=39793 Ack=19273 Win=1452 Len=0 TSval=4024786 TSecr=3428459
  260 13.066761120  10.6.15.144 → 192.168.1.16 TCP 66 22 → 59298 [ACK] Seq=39793 Ack=20125 Win=1452 Len=0 TSval=4024788 TSecr=3428460
  261 13.068597971  10.6.15.144 → 192.168.1.16 SSH 282 Server: Encrypted packet (len=216)
  262 13.112039561 192.168.1.16 → 10.6.15.144  TCP 66 59298 → 22 [ACK] Seq=20125 Ack=40009 Win=3666 Len=0 TSval=3428476 TSecr=4024788
  263 13.162652952  10.6.15.144 → 192.168.1.16 SSH 138 Server: Encrypted packet (len=72)
  264 13.162678408 192.168.1.16 → 10.6.15.144  TCP 66 59298 → 22 [ACK] Seq=20125 Ack=40081 Win=3666 Len=0 TSval=3428488 TSecr=4024812
  265 13.162887570 192.168.1.16 → 10.6.15.144  SSH 102 Client: Encrypted packet (len=36)
  266 13.169415536  10.6.15.144 → 192.168.1.16 SSH 210 Server: Encrypted packet (len=144)
  267 13.169699957 192.168.1.16 → 10.6.15.144  SSH 138 Client: Encrypted packet (len=72)
  268 13.173172881  10.6.15.144 → 192.168.1.16 SSH 138 Server: Encrypted packet (len=72)
  269 13.173386488 192.168.1.16 → 10.6.15.144  SSH 102 Client: Encrypted packet (len=36)
  270 13.179994382  10.6.15.144 → 192.168.1.16 TCP 66 22 → 59298 [ACK] Seq=40297 Ack=20233 Win=1452 Len=0 TSval=4024816 TSecr=3428488
  271 13.221042663  10.6.15.144 → 192.168.1.16 TCP 66 22 → 59298 [ACK] Seq=40297 Ack=20269 Win=1452 Len=0 TSval=4024827 TSecr=3428491
  272 15.018096189  10.6.15.144 → 192.168.1.16 SSH 294 Server: Encrypted packet (len=228)
  273 15.018138038  10.6.15.144 → 192.168.1.16 TCP 294 [TCP Retransmission] 22 → 59298 [PSH, ACK] Seq=40297 Ack=20269 Win=1452 Len=228 TSval=4025015 TSecr=3428491
  274 15.018156120 192.168.1.16 → 10.6.15.144  TCP 78 59298 → 22 [ACK] Seq=20269 Ack=40525 Win=3666 Len=0 TSval=3428952 TSecr=4025015 SLE=40297 SRE=40525
  275 15.027779791 192.168.1.16 → 10.6.15.144  SSH 110 Client: Encrypted packet (len=44)
  276 15.036588997  10.6.15.144 → 192.168.1.16 TCP 66 22 → 59298 [ACK] Seq=40525 Ack=20313 Win=1452 Len=0 TSval=4025281 TSecr=3428954
  277 15.064197779  10.6.15.144 → 192.168.1.16 SSH 110 Server: Encrypted packet (len=44)
  278 15.064583235 192.168.1.16 → 10.6.15.144  SSH 382 Client: Encrypted packet (len=316)
  279 15.101618344  10.6.15.144 → 192.168.1.16 SSH 230 Server: Encrypted packet (len=164)
  280 15.101922218 192.168.1.16 → 10.6.15.144  SSH 134 Client: Encrypted packet (len=68)
  281 15.102249603 192.168.1.16 → 10.6.15.144  SSH 734 Client: Encrypted packet (len=668)
  282 15.112704895  10.6.15.144 → 192.168.1.16 TCP 66 22 → 59298 [ACK] Seq=40733 Ack=21365 Win=1452 Len=0 TSval=4025299 TSecr=3428973
  283 15.139918052  10.6.15.144 → 192.168.1.16 SSH 654 Server: Encrypted packet (len=588)
  284 15.147769161 192.168.1.16 → 10.6.15.144  SSH 734 Client: Encrypted packet (len=668)
  285 15.188597022  10.6.15.144 → 192.168.1.16 SSH 654 Server: Encrypted packet (len=588)
  286 15.231987600 192.168.1.16 → 10.6.15.144  TCP 66 59298 → 22 [ACK] Seq=22033 Ack=41909 Win=3666 Len=0 TSval=3429006 TSecr=4025318
  287 16.718096150 192.168.1.16 → 13.126.37.14 NTP 90 NTP Version 4, client
  288 16.720113916  10.6.15.144 → 192.168.1.16 SSH 102 Server: Encrypted packet (len=36)
  289 16.720160223 192.168.1.16 → 10.6.15.144  TCP 66 59298 → 22 [ACK] Seq=22033 Ack=41945 Win=3666 Len=0 TSval=3429378 TSecr=4025472
  290 16.720191808  10.6.15.144 → 192.168.1.16 SSH 102 Server: [TCP Spurious Retransmission] , Encrypted packet (len=36)
  291 16.720200548 192.168.1.16 → 10.6.15.144  TCP 78 [TCP Dup ACK 289#1] 59298 → 22 [ACK] Seq=22033 Ack=41945 Win=3666 Len=0 TSval=3429378 TSecr=4025606 SLE=41909 SRE=41945
  292 18.025974913  10.6.15.144 → 192.168.1.16 SSH 102 Server: Encrypted packet (len=36)
  293 18.026004010 192.168.1.16 → 10.6.15.144  TCP 66 59298 → 22 [ACK] Seq=22033 Ack=41981 Win=3666 Len=0 TSval=3429704 TSecr=4025856
  294 18.026041537  10.6.15.144 → 192.168.1.16 SSH 102 Server: [TCP Spurious Retransmission] , Encrypted packet (len=36)
  295 18.026051378 192.168.1.16 → 10.6.15.144  TCP 78 [TCP Dup ACK 293#1] 59298 → 22 [ACK] Seq=22033 Ack=41981 Win=3666 Len=0 TSval=3429704 TSecr=4026023 SLE=41945 SRE=41981
  296 19.017986031  10.6.15.144 → 192.168.1.16 SSH 138 Server: Encrypted packet (len=72)
  297 19.018014785 192.168.1.16 → 10.6.15.144  TCP 66 59298 → 22 [ACK] Seq=22033 Ack=42053 Win=3666 Len=0 TSval=3429952 TSecr=4026112
  298 19.018052637  10.6.15.144 → 192.168.1.16 SSH 102 Server: Encrypted packet (len=36)
  299 19.018064493 192.168.1.16 → 10.6.15.144  TCP 66 59298 → 22 [ACK] Seq=22033 Ack=42089 Win=3666 Len=0 TSval=3429952 TSecr=4026176
  300 21.034017127 10.22.18.209 → 224.0.0.252  LLMNR 64 Standard query 0x3130 A wpad
  301 21.041416817 10.22.18.209 → 224.0.0.252  LLMNR 64 Standard query 0x3130 A wpad
