    1 0.000000000  10.6.15.144 → 192.168.1.16 SSH 102 Server: Encrypted packet (len=36)
    2 0.000024589 192.168.1.16 → 10.6.15.144  TCP 66 58518 → 22 [ACK] Seq=1 Ack=37 Win=2263 Len=0 TSval=7673952 TSecr=7123970
    3 0.000324514 192.168.1.16 → 10.6.15.144  SSH 118 Client: Encrypted packet (len=52)
    4 0.000413389  10.6.15.144 → 192.168.1.16 SSH 102 Server: Encrypted packet (len=36)
    5 0.000811517  10.22.18.98 → 224.0.0.252  LLMNR 74 Standard query 0x2df7 A dakjemgpujgomn
    6 0.001169157  10.22.18.98 → 224.0.0.252  LLMNR 70 Standard query 0xe759 A aehaunaeaj
    7 0.001559398  10.22.18.98 → 224.0.0.252  LLMNR 68 Standard query 0xb6c0 A ccjfjney
    8 0.001941754  10.6.15.144 → 192.168.1.16 TCP 102 [TCP Retransmission] 22 → 58518 [PSH, ACK] Seq=37 Ack=1 Win=1452 Len=36 TSval=7124024 TSecr=7673617
    9 0.001948894 192.168.1.16 → 10.6.15.144  TCP 78 58518 → 22 [ACK] Seq=53 Ack=73 Win=2263 Len=0 TSval=7673952 TSecr=7124024 SLE=37 SRE=73
   10 0.002427101  10.6.15.144 → 192.168.1.16 TCP 66 22 → 58518 [ACK] Seq=73 Ack=53 Win=1452 Len=0 TSval=7124239 TSecr=7673952
   11 0.014755344 192.168.1.16 → 10.6.15.144  SSH 214 Client: Encrypted packet (len=148)
   12 0.016499262 192.168.1.16 → 10.6.15.144  SSH 1190 Client: Encrypted packet (len=1124)
   13 0.017494448  10.6.15.144 → 192.168.1.16 TCP 66 22 → 58518 [ACK] Seq=73 Ack=201 Win=1452 Len=0 TSval=7124243 TSecr=7673956
   14 0.019422843  10.6.15.144 → 192.168.1.16 TCP 66 22 → 58518 [ACK] Seq=73 Ack=1325 Win=1452 Len=0 TSval=7124243 TSecr=7673956
   15 0.021553676  10.6.15.144 → 192.168.1.16 SSH 134 Server: Encrypted packet (len=68)
   16 0.062023766 192.168.1.16 → 10.6.15.144  TCP 66 58518 → 22 [ACK] Seq=1325 Ack=141 Win=2263 Len=0 TSval=7673968 TSecr=7124244
   17 0.105893745  10.6.15.144 → 192.168.1.16 SSH 358 Server: Encrypted packet (len=292)
   18 0.105922061 192.168.1.16 → 10.6.15.144  TCP 66 58518 → 22 [ACK] Seq=1325 Ack=433 Win=2263 Len=0 TSval=7673978 TSecr=7124265
   19 0.110620830  10.6.15.144 → 192.168.1.16 SSH 1514 Server: Encrypted packet (len=1448)
   20 0.110639575 192.168.1.16 → 10.6.15.144  TCP 66 58518 → 22 [ACK] Seq=1325 Ack=1881 Win=2263 Len=0 TSval=7673980 TSecr=7124265
   21 0.110660959  10.6.15.144 → 192.168.1.16 SSH 118 Server: Encrypted packet (len=52)
   22 0.110668432 192.168.1.16 → 10.6.15.144  TCP 66 58518 → 22 [ACK] Seq=1325 Ack=1933 Win=2263 Len=0 TSval=7673980 TSecr=7124265
   23 0.111176499 192.168.1.16 → 10.6.15.144  SSH 134 Client: Encrypted packet (len=68)
   24 0.112568469 192.168.1.16 → 10.6.15.144  SSH 1390 Client: Encrypted packet (len=1324)
   25 0.138594767  10.6.15.144 → 192.168.1.16 TCP 66 22 → 58518 [ACK] Seq=1933 Ack=2717 Win=1452 Len=0 TSval=7124273 TSecr=7673980
   26 0.225698949  10.6.15.144 → 192.168.1.16 SSH 174 Server: Encrypted packet (len=108)
   27 0.265975306 192.168.1.16 → 10.6.15.144  TCP 66 58518 → 22 [ACK] Seq=2717 Ack=2041 Win=2263 Len=0 TSval=7674019 TSecr=7124293
   28 0.270460734  10.6.15.144 → 192.168.1.16 SSH 718 Server: Encrypted packet (len=652)
   29 0.270479923 192.168.1.16 → 10.6.15.144  TCP 66 58518 → 22 [ACK] Seq=2717 Ack=2693 Win=2263 Len=0 TSval=7674020 TSecr=7124306
   30 0.272525127  10.6.15.144 → 192.168.1.16 SSH 358 Server: Encrypted packet (len=292)
   31 0.272540495 192.168.1.16 → 10.6.15.144  TCP 66 58518 → 22 [ACK] Seq=2717 Ack=2985 Win=2263 Len=0 TSval=7674020 TSecr=7124306
   32 0.272556276  10.6.15.144 → 192.168.1.16 SSH 134 Server: Encrypted packet (len=68)
   33 0.272561888 192.168.1.16 → 10.6.15.144  TCP 66 58518 → 22 [ACK] Seq=2717 Ack=3053 Win=2263 Len=0 TSval=7674020 TSecr=7124306
   34 0.272929274 192.168.1.16 → 10.6.15.144  SSH 134 Client: Encrypted packet (len=68)
   35 0.273775944 192.168.1.16 → 10.6.15.144  SSH 1514 Client: Encrypted packet (len=1448)
   36 0.296979855 192.168.1.16 → 10.6.15.144  SSH 74 Client: Encrypted packet (len=8)
   37 0.337969459 192.168.1.16 → 10.6.15.144  TCP 74 [TCP Retransmission] 58518 → 22 [PSH, ACK] Seq=4233 Ack=3053 Win=2263 Len=8 TSval=7674037 TSecr=7124306
   38 0.356986144  10.6.15.144 → 192.168.1.16 TCP 78 [TCP Dup ACK 25#1] 22 → 58518 [ACK] Seq=3053 Ack=2717 Win=1452 Len=0 TSval=7124328 TSecr=7674020 SLE=4233 SRE=4241
   39 0.428618674 192.168.1.16 → 10.6.15.144  SSH 126 Client: Encrypted packet (len=60)
   40 0.566019365 192.168.1.16 → 10.6.15.144  TCP 134 [TCP Retransmission] 58518 → 22 [PSH, ACK] Seq=2717 Ack=3053 Win=2263 Len=68 TSval=7674094 TSecr=7124328
   41 0.571501725  10.6.15.144 → 192.168.1.16 TCP 78 22 → 58518 [ACK] Seq=3053 Ack=2785 Win=1452 Len=0 TSval=7124380 TSecr=7674094 SLE=4233 SRE=4241
   42 0.571524501 192.168.1.16 → 10.6.15.144  TCP 1514 [TCP Retransmission] 58518 → 22 [ACK] Seq=2785 Ack=3053 Win=2263 Len=1448 TSval=7674095 TSecr=7124380
   43 0.571538062 192.168.1.16 → 10.6.15.144  TCP 126 [TCP Retransmission] 58518 → 22 [PSH, ACK] Seq=4241 Ack=3053 Win=2263 Len=60 TSval=7674095 TSecr=7124380
   44 0.793996933 192.168.1.16 → 10.6.15.144  TCP 1514 [TCP Retransmission] 58518 → 22 [ACK] Seq=2785 Ack=3053 Win=2263 Len=1448 TSval=7674151 TSecr=7124380
   45 0.857497556  10.6.15.144 → 192.168.1.16 TCP 66 22 → 58518 [ACK] Seq=3053 Ack=4241 Win=1451 Len=0 TSval=7124453 TSecr=7674151
   46 0.857520538 192.168.1.16 → 10.6.15.144  TCP 126 [TCP Retransmission] 58518 → 22 [PSH, ACK] Seq=4241 Ack=3053 Win=2263 Len=60 TSval=7674166 TSecr=7124453
   47 0.860155361  10.6.15.144 → 192.168.1.16 TCP 66 22 → 58518 [ACK] Seq=3053 Ack=4301 Win=1452 Len=0 TSval=7124453 TSecr=7674166
   48 2.016560198  10.6.15.144 → 192.168.1.16 SSH 710 Server: Encrypted packet (len=644)
   49 2.016610364  10.6.15.144 → 192.168.1.16 SSH 526 Server: Encrypted packet (len=460)
   50 2.016626431  10.6.15.144 → 192.168.1.16 SSH 182 Server: Encrypted packet (len=116)
   51 2.016731961 192.168.1.16 → 10.6.15.144  TCP 66 58518 → 22 [ACK] Seq=4301 Ack=4273 Win=2263 Len=0 TSval=7674456 TSecr=7124482
   52 2.016952021  10.6.15.144 → 192.168.1.16 SSH 182 Server: [TCP Spurious Retransmission] , Encrypted packet (len=116)
   53 2.016961633 192.168.1.16 → 10.6.15.144  TCP 78 [TCP Dup ACK 51#1] 58518 → 22 [ACK] Seq=4301 Ack=4273 Win=2263 Len=0 TSval=7674456 TSecr=7124567 SLE=4157 SRE=4273
   54 2.016977345 10.22.19.225 → 224.0.0.252  LLMNR 74 Standard query 0x278f ANY Anirrudingdong
   55 2.019680326 192.168.1.16 → 10.6.15.144  SSH 134 Client: Encrypted packet (len=68)
   56 2.021177391  10.6.15.144 → 192.168.1.16 TCP 66 22 → 58518 [ACK] Seq=4273 Ack=4369 Win=1452 Len=0 TSval=7124744 TSecr=7674457
   57 2.037715272 10.22.19.225 → 224.0.0.252  LLMNR 64 Standard query 0x7d14 A wpad
   58 2.037948727 10.22.19.225 → 224.0.0.252  LLMNR 64 Standard query 0xa0aa A wpad
   59 2.039420158 10.22.19.225 → 224.0.0.252  LLMNR 64 Standard query 0x85f3 A wpad
   60 2.040171574 10.22.19.225 → 224.0.0.252  LLMNR 64 Standard query 0xb2cc A wpad
   61 2.158389533 10.22.19.225 → 224.0.0.252  LLMNR 74 Standard query 0x278f ANY Anirrudingdong
   62 4.403534141 ZioncomE_53:dd:d6 → HonHaiPr_1f:71:b9 EAPOL 135 Key (Message 1 of 4)
   63 4.403723141 HonHaiPr_1f:71:b9 → ZioncomE_53:dd:d6 EAPOL 135 Key (Message 2 of 4)
   64 4.410258413 ZioncomE_53:dd:d6 → HonHaiPr_1f:71:b9 EAPOL 169 Key (Message 3 of 4)
   65 4.410371887 HonHaiPr_1f:71:b9 → ZioncomE_53:dd:d6 EAPOL 113 Key (Message 4 of 4)
   66 4.426001047 fe80::820e:b87b:de2a:4286 → ff02::16     ICMPv6 90 Multicast Listener Report Message v2
   67 4.426029388 192.168.1.16 → 224.0.0.252  IGMPv2 46 Membership Report group 224.0.0.252
   68 4.462945121  192.168.1.1 → 192.168.1.255 IAPP 58 Announce Request(0) (version=0)[Malformed Packet]
   69 4.463273898  192.168.1.1 → 224.0.1.178  UDP 58 3517 → 3517 Len=16
   70 4.533498434 fe80::820e:b87b:de2a:4286 → ff02::1:3    LLMNR 93 Standard query 0x0d7e ANY theenterprise
   71 4.533545957 192.168.1.16 → 224.0.0.252  LLMNR 73 Standard query 0x82a7 ANY theenterprise
   72 4.582285346 10.22.19.225 → 224.0.0.252  LLMNR 66 Standard query 0xe65b A isatap
   73 4.783579361 fe80::820e:b87b:de2a:4286 → ff02::1:3    LLMNR 93 Standard query 0x0d7e ANY theenterprise
   74 4.784401849 192.168.1.16 → 224.0.0.252  LLMNR 73 Standard query 0x82a7 ANY theenterprise
   75 4.785724094 10.22.19.225 → 224.0.0.252  LLMNR 74 Standard query 0xa335 ANY Anirrudingdong
   76 4.862034525 fe80::820e:b87b:de2a:4286 → ff02::16     ICMPv6 90 Multicast Listener Report Message v2
   77 5.033488810 fe80::820e:b87b:de2a:4286 → ff02::1:3    LLMNR 93 Standard query 0x0d7e ANY theenterprise
   78 5.034265459 192.168.1.16 → 224.0.0.252  LLMNR 73 Standard query 0x82a7 ANY theenterprise
   79 5.054024555 192.168.1.16 → 10.6.15.144  SSH 138 Client: Encrypted packet (len=72)
   80 5.913443374 192.168.1.16 → 239.255.255.250 SSDP 213 M-SEARCH * HTTP/1.1 
   81 5.915625795 10.22.19.225 → 224.0.0.252  LLMNR 64 Standard query 0x8501 A wpad
   82 5.915647975 10.22.19.225 → 224.0.0.252  LLMNR 64 Standard query 0x3ebe A wpad
   83 5.915652608 10.22.19.225 → 224.0.0.252  LLMNR 64 Standard query 0x70ac A wpad
   84 5.915657624 10.22.19.225 → 224.0.0.252  LLMNR 64 Standard query 0xda43 A wpad
   85 5.915663058 10.22.19.225 → 224.0.0.252  LLMNR 74 Standard query 0xa335 ANY Anirrudingdong
   86 5.915667826 10.22.19.225 → 224.0.0.252  LLMNR 64 Standard query 0x8501 A wpad
   87 5.915672302 10.22.19.225 → 224.0.0.252  LLMNR 64 Standard query 0x3ebe A wpad
   88 5.922063933 10.22.19.225 → 224.0.0.252  LLMNR 64 Standard query 0x70ac A wpad
   89 5.922081673 10.22.19.225 → 224.0.0.252  LLMNR 64 Standard query 0xda43 A wpad
   90 5.922115661 10.22.19.225 → 224.0.0.252  LLMNR 74 Standard query 0x6e7d ANY Anirrudingdong
   91 6.009228384 10.22.19.225 → 224.0.0.252  LLMNR 74 Standard query 0x6e7d ANY Anirrudingdong
   92 6.846043946 192.168.1.16 → 10.6.15.144  TCP 138 [TCP Retransmission] 58518 → 22 [PSH, ACK] Seq=4369 Ack=4273 Win=2263 Len=72 TSval=7675664 TSecr=7124744
   93 6.847966332  10.22.18.98 → 224.0.0.252  LLMNR 65 Standard query 0x0dad ANY Febin
   94 6.848018197  10.22.18.98 → 224.0.0.252  LLMNR 65 Standard query 0x0dad ANY Febin
   95 6.848473838  10.6.15.144 → 192.168.1.16 TCP 66 22 → 58518 [ACK] Seq=4273 Ack=4441 Win=1452 Len=0 TSval=7125951 TSecr=7675664
   96 6.848528485 192.168.1.16 → 10.6.15.144  SSH 230 Client: Encrypted packet (len=164)
   97 6.850252954  10.6.15.144 → 192.168.1.16 TCP 66 22 → 58518 [ACK] Seq=4273 Ack=4605 Win=1452 Len=0 TSval=7125951 TSecr=7675664
   98 6.856483270  10.6.15.144 → 192.168.1.16 SSH 134 Server: Encrypted packet (len=68)
   99 6.887693725  10.6.15.144 → 192.168.1.16 SSH 110 Server: Encrypted packet (len=44)
  100 6.887720676 192.168.1.16 → 10.6.15.144  TCP 66 58518 → 22 [ACK] Seq=4605 Ack=4385 Win=2263 Len=0 TSval=7675674 TSecr=7125952
  101 6.888069888 192.168.1.16 → 10.6.15.144  SSH 158 Client: Encrypted packet (len=92)
  102 6.901022161  10.6.15.144 → 192.168.1.16 SSH 390 Server: Encrypted packet (len=324)
  103 6.901095894  10.6.15.144 → 192.168.1.16 SSH 166 Server: Encrypted packet (len=100)
  104 6.901144669 192.168.1.16 → 10.6.15.144  TCP 66 58518 → 22 [ACK] Seq=4697 Ack=4809 Win=2263 Len=0 TSval=7675677 TSecr=7125963
  105 6.901658643 192.168.1.16 → 10.6.15.144  SSH 134 Client: Encrypted packet (len=68)
  106 6.913960558 192.168.1.16 → 239.255.255.250 SSDP 213 M-SEARCH * HTTP/1.1 
  107 6.927589458  10.6.15.144 → 192.168.1.16 TCP 78 [TCP Dup ACK 97#1] 22 → 58518 [ACK] Seq=4809 Ack=4605 Win=1452 Len=0 TSval=7125970 TSecr=7675674 SLE=4697 SRE=4765
  108 7.106058324 192.168.1.16 → 10.6.15.144  TCP 158 [TCP Retransmission] 58518 → 22 [PSH, ACK] Seq=4605 Ack=4809 Win=2263 Len=92 TSval=7675729 TSecr=7125970
  109 7.108959663  10.6.15.144 → 192.168.1.16 TCP 66 22 → 58518 [ACK] Seq=4809 Ack=4765 Win=1452 Len=0 TSval=7126016 TSecr=7675729
  110 7.121001214  10.6.15.144 → 192.168.1.16 SSH 138 Server: Encrypted packet (len=72)
  111 7.121245472 192.168.1.16 → 10.6.15.144  SSH 102 Client: Encrypted packet (len=36)
  112 7.144800026  10.6.15.144 → 192.168.1.16 SSH 174 Server: Encrypted packet (len=108)
  113 7.145479012 192.168.1.16 → 10.6.15.144  SSH 302 Client: Encrypted packet (len=236)
  114 7.146681938 192.168.1.16 → 10.6.15.144  SSH 318 Client: Encrypted packet (len=252)
  115 7.148620069  10.6.15.144 → 192.168.1.16 TCP 66 22 → 58518 [ACK] Seq=4989 Ack=5289 Win=1452 Len=0 TSval=7126026 TSecr=7675738
  116 7.184403587  10.6.15.144 → 192.168.1.16 SSH 118 Server: Encrypted packet (len=52)
  117 7.186846342  10.6.15.144 → 192.168.1.16 SSH 214 Server: Encrypted packet (len=148)
  118 7.186911069 192.168.1.16 → 10.6.15.144  TCP 66 58518 → 22 [ACK] Seq=5289 Ack=5189 Win=2263 Len=0 TSval=7675749 TSecr=7126035
  119 7.188454443  10.6.15.144 → 192.168.1.16 SSH 230 Server: Encrypted packet (len=164)
  120 7.229981343 192.168.1.16 → 10.6.15.144  TCP 66 58518 → 22 [ACK] Seq=5289 Ack=5353 Win=2263 Len=0 TSval=7675760 TSecr=7126035
  121 7.915062481 192.168.1.16 → 239.255.255.250 SSDP 213 M-SEARCH * HTTP/1.1 
  122 8.830056136 192.168.1.16 → 224.0.0.252  IGMPv2 46 Membership Report group 224.0.0.252
  123 8.914278429 192.168.1.16 → 224.0.0.251  MDNS 82 Standard query 0x0000 PTR _googlecast._tcp.local, "QM" question
  124 8.914336336 fe80::820e:b87b:de2a:4286 → ff02::fb     MDNS 102 Standard query 0x0000 PTR _googlecast._tcp.local, "QM" question
  125 8.914391477 192.168.1.16 → 224.0.0.251  MDNS 82 Standard query 0x0000 PTR _googlecast._tcp.local, "QM" question
  126 8.914413843 fe80::820e:b87b:de2a:4286 → ff02::fb     MDNS 102 Standard query 0x0000 PTR _googlecast._tcp.local, "QM" question
  127 8.915619653 192.168.1.16 → 239.255.255.250 SSDP 213 M-SEARCH * HTTP/1.1 
  128 8.918762406  10.22.18.98 → 224.0.0.252  LLMNR 64 Standard query 0x6272 A wpad
  129 8.918792467 10.22.17.101 → 224.0.0.252  LLMNR 64 Standard query 0x1104 A wpad
  130 8.918799353 10.22.17.101 → 224.0.0.252  LLMNR 64 Standard query 0xa9bc A wpad
  131 8.918931316  10.22.18.98 → 224.0.0.252  LLMNR 64 Standard query 0x6272 A wpad
  132 8.919250662 10.22.19.225 → 224.0.0.252  LLMNR 64 Standard query 0x4839 A wpad
  133 8.919301129 10.22.19.225 → 224.0.0.252  LLMNR 64 Standard query 0xdc05 A wpad
  134 9.054028746 10.22.19.225 → 224.0.0.252  LLMNR 64 Standard query 0x4839 A wpad
  135 9.054056634 10.22.19.225 → 224.0.0.252  LLMNR 64 Standard query 0xdc05 A wpad
  136 9.054061388 10.22.19.225 → 224.0.0.252  LLMNR 64 Standard query 0xab92 A wpad
  137 9.854060162 192.168.1.16 → 52.21.37.23  TCP 66 57254 → 443 [RST, ACK] Seq=1 Ack=1 Win=455 Len=0 TSval=7676416 TSecr=1246193800
  138 9.915226525 192.168.1.16 → 224.0.0.251  MDNS 82 Standard query 0x0000 PTR _googlecast._tcp.local, "QM" question
  139 9.915268207 fe80::820e:b87b:de2a:4286 → ff02::fb     MDNS 102 Standard query 0x0000 PTR _googlecast._tcp.local, "QM" question
  140 9.915315978 192.168.1.16 → 224.0.0.251  MDNS 82 Standard query 0x0000 PTR _googlecast._tcp.local, "QM" question
  141 9.915326638 fe80::820e:b87b:de2a:4286 → ff02::fb     MDNS 102 Standard query 0x0000 PTR _googlecast._tcp.local, "QM" question
  142 11.489347292 ZioncomE_53:dd:d6 → HonHaiPr_1f:71:b9 EAPOL 135 Key (Message 1 of 4)
  143 11.489525213 HonHaiPr_1f:71:b9 → ZioncomE_53:dd:d6 EAPOL 135 Key (Message 2 of 4)
  144 11.530805708 ZioncomE_53:dd:d6 → HonHaiPr_1f:71:b9 EAPOL 169 Key (Message 3 of 4)
  145 11.530892957 HonHaiPr_1f:71:b9 → ZioncomE_53:dd:d6 EAPOL 113 Key (Message 4 of 4)
  146 11.542009849 fe80::820e:b87b:de2a:4286 → ff02::16     ICMPv6 90 Multicast Listener Report Message v2
  147 11.542036997 192.168.1.16 → 224.0.0.252  IGMPv2 46 Membership Report group 224.0.0.252
  148 11.702811904 fe80::820e:b87b:de2a:4286 → ff02::1:3    LLMNR 93 Standard query 0x89c9 ANY theenterprise
  149 11.703590269 192.168.1.16 → 224.0.0.252  LLMNR 73 Standard query 0x9849 ANY theenterprise
  150 11.730033201 fe80::820e:b87b:de2a:4286 → ff02::16     ICMPv6 90 Multicast Listener Report Message v2
  151 12.033457109 fe80::820e:b87b:de2a:4286 → ff02::1:3    LLMNR 93 Standard query 0x89c9 ANY theenterprise
  152 12.034121721 192.168.1.16 → 224.0.0.252  LLMNR 73 Standard query 0x9849 ANY theenterprise
  153 12.062028681 192.168.1.16 → 10.6.15.144  SSH 138 Client: Encrypted packet (len=72)
  154 12.064219061 10.22.19.225 → 224.0.0.252  LLMNR 66 Standard query 0x6e9a A isatap
  155 12.076147585 10.22.19.225 → 224.0.0.252  LLMNR 66 Standard query 0xa312 A isatap
  156 12.283589444 fe80::820e:b87b:de2a:4286 → ff02::1:3    LLMNR 93 Standard query 0x89c9 ANY theenterprise
  157 12.284428143 192.168.1.16 → 224.0.0.252  LLMNR 73 Standard query 0x9849 ANY theenterprise
  158 13.033866408 192.168.1.16 → 239.255.255.250 SSDP 213 M-SEARCH * HTTP/1.1 
  159 13.038072718 10.22.19.225 → 224.0.0.252  LLMNR 66 Standard query 0x6e9a A isatap
  160 13.039143690 10.22.19.225 → 224.0.0.252  LLMNR 66 Standard query 0xa312 A isatap
  161 13.822047048 192.168.1.16 → 10.6.15.144  TCP 138 [TCP Retransmission] 58518 → 22 [PSH, ACK] Seq=5289 Ack=5353 Win=2263 Len=72 TSval=7677408 TSecr=7126035
  162 13.857656653  10.6.15.144 → 192.168.1.16 SSH 102 Server: Encrypted packet (len=36)
  163 13.857716079 192.168.1.16 → 10.6.15.144  SSH 1442 Client: Encrypted packet (len=1376)
  164 13.858648324 192.168.1.16 → 10.6.15.144  SSH 158 Client: Encrypted packet (len=92)
  165 13.860234336  10.6.15.144 → 192.168.1.16 TCP 66 22 → 58518 [ACK] Seq=5389 Ack=6829 Win=1452 Len=0 TSval=7127704 TSecr=7677416
  166 13.864045359  10.6.15.144 → 192.168.1.16 SSH 134 Server: Encrypted packet (len=68)
  167 13.894547718  10.6.15.144 → 192.168.1.16 SSH 174 Server: Encrypted packet (len=108)
  168 13.894573078 192.168.1.16 → 10.6.15.144  TCP 66 58518 → 22 [ACK] Seq=6829 Ack=5565 Win=2263 Len=0 TSval=7677426 TSecr=7127704
  169 13.895262068 192.168.1.16 → 10.6.15.144  SSH 302 Client: Encrypted packet (len=236)
  170 13.896443076 192.168.1.16 → 10.6.15.144  SSH 318 Client: Encrypted packet (len=252)
  171 13.898048936  10.6.15.144 → 192.168.1.16 TCP 66 22 → 58518 [ACK] Seq=5565 Ack=7317 Win=1452 Len=0 TSval=7127713 TSecr=7677426
  172 13.903086444  10.6.15.144 → 192.168.1.16 SSH 382 Server: Encrypted packet (len=316)
  173 13.904016764  10.6.15.144 → 192.168.1.16 SSH 126 Server: Encrypted packet (len=60)
  174 13.904031699  10.6.15.144 → 192.168.1.16 SSH 134 Server: Encrypted packet (len=68)
  175 13.904069136 192.168.1.16 → 10.6.15.144  TCP 66 58518 → 22 [ACK] Seq=7317 Ack=6009 Win=2263 Len=0 TSval=7677428 TSecr=7127714
  176 13.904353192 192.168.1.16 → 10.6.15.144  SSH 134 Client: Encrypted packet (len=68)
  177 13.934277062  10.6.15.144 → 192.168.1.16 SSH 118 Server: Encrypted packet (len=52)
  178 13.940093907  10.6.15.144 → 192.168.1.16 SSH 342 Server: Encrypted packet (len=276)
  179 13.940160011 192.168.1.16 → 10.6.15.144  TCP 66 58518 → 22 [ACK] Seq=7385 Ack=6337 Win=2263 Len=0 TSval=7677437 TSecr=7127722
  180 14.025686906  10.6.15.144 → 192.168.1.16 SSH 182 Server: Encrypted packet (len=116)
  181 14.026726727  10.6.15.144 → 192.168.1.16 SSH 1514 Server: Encrypted packet (len=1448)
  182 14.026745934 192.168.1.16 → 10.6.15.144  TCP 66 58518 → 22 [ACK] Seq=7385 Ack=7901 Win=2263 Len=0 TSval=7677459 TSecr=7127745
  183 14.026767901  10.6.15.144 → 192.168.1.16 SSH 78 Server: Encrypted packet (len=12)
  184 14.028724998  10.6.15.144 → 192.168.1.16 SSH 1514 Server: Encrypted packet (len=1448)
  185 14.028744895 192.168.1.16 → 10.6.15.144  TCP 66 58518 → 22 [ACK] Seq=7385 Ack=9361 Win=2263 Len=0 TSval=7677459 TSecr=7127745
  186 14.028907262  10.6.15.144 → 192.168.1.16 SSH 1514 Server: Encrypted packet (len=1448)
  187 14.030599458  10.6.15.144 → 192.168.1.16 SSH 826 Server: Encrypted packet (len=760)
  188 14.030617915 192.168.1.16 → 10.6.15.144  TCP 66 58518 → 22 [ACK] Seq=7385 Ack=11569 Win=2263 Len=0 TSval=7677460 TSecr=7127745
  189 14.031164254 192.168.1.16 → 10.6.15.144  SSH 134 Client: Encrypted packet (len=68)
  190 14.034323765 192.168.1.16 → 239.255.255.250 SSDP 213 M-SEARCH * HTTP/1.1 
  191 14.072375993  10.6.15.144 → 192.168.1.16 TCP 66 22 → 58518 [ACK] Seq=11569 Ack=7453 Win=1452 Len=0 TSval=7127757 TSecr=7677460
  192 14.121985757  10.6.15.144 → 192.168.1.16 SSH 138 Server: Encrypted packet (len=72)
  193 14.122143876 192.168.1.16 → 10.6.15.144  SSH 102 Client: Encrypted packet (len=36)
  194 14.123576399  10.6.15.144 → 192.168.1.16 TCP 66 22 → 58518 [ACK] Seq=11641 Ack=7489 Win=1452 Len=0 TSval=7127769 TSecr=7677483
  195 16.411483005 ZioncomE_53:dd:d6 → HonHaiPr_1f:71:b9 EAPOL 135 Key (Message 1 of 4)
  196 16.411677893 HonHaiPr_1f:71:b9 → ZioncomE_53:dd:d6 EAPOL 135 Key (Message 2 of 4)
  197 16.416750318 ZioncomE_53:dd:d6 → HonHaiPr_1f:71:b9 EAPOL 169 Key (Message 3 of 4)
  198 16.416902893 HonHaiPr_1f:71:b9 → ZioncomE_53:dd:d6 EAPOL 113 Key (Message 4 of 4)
  199 16.425974658 fe80::820e:b87b:de2a:4286 → ff02::16     ICMPv6 90 Multicast Listener Report Message v2
  200 16.426004962 192.168.1.16 → 224.0.0.252  IGMPv2 46 Membership Report group 224.0.0.252
  201 16.443714177  192.168.1.1 → 192.168.1.255 IAPP 58 Announce Request(0) (version=0)[Malformed Packet]
  202 16.444026989  192.168.1.1 → 224.0.1.178  UDP 58 3517 → 3517 Len=16
  203 16.526996599 fe80::820e:b87b:de2a:4286 → ff02::1:3    LLMNR 93 Standard query 0x9376 ANY theenterprise
  204 16.527045416 192.168.1.16 → 224.0.0.252  LLMNR 73 Standard query 0x5b4c ANY theenterprise
  205 16.783450105 fe80::820e:b87b:de2a:4286 → ff02::1:3    LLMNR 93 Standard query 0x9376 ANY theenterprise
  206 16.784237748 192.168.1.16 → 224.0.0.252  LLMNR 73 Standard query 0x5b4c ANY theenterprise
  207 16.787958316  10.22.17.98 → 224.0.0.252  LLMNR 64 Standard query 0x6e35 A wpad
  208 16.797993547 fe80::820e:b87b:de2a:4286 → ff02::16     ICMPv6 90 Multicast Listener Report Message v2
  209 17.033483059 fe80::820e:b87b:de2a:4286 → ff02::1:3    LLMNR 93 Standard query 0x9376 ANY theenterprise
  210 17.034257343 192.168.1.16 → 224.0.0.252  LLMNR 73 Standard query 0x5b4c ANY theenterprise
  211 17.054025394 192.168.1.16 → 10.6.15.144  SSH 138 Client: Encrypted packet (len=72)
  212 17.057887939  10.6.15.144 → 192.168.1.16 TCP 66 22 → 58518 [ACK] Seq=11641 Ack=7561 Win=1452 Len=0 TSval=7128503 TSecr=7678216
  213 17.057913064 192.168.1.16 → 10.6.15.144  SSH 174 Client: Encrypted packet (len=108)
  214 17.059473653  10.6.15.144 → 192.168.1.16 TCP 66 22 → 58518 [ACK] Seq=11641 Ack=7669 Win=1452 Len=0 TSval=7128503 TSecr=7678216
  215 17.089986796  10.6.15.144 → 192.168.1.16 SSH 102 Server: Encrypted packet (len=36)
  216 17.090305372 192.168.1.16 → 10.6.15.144  SSH 158 Client: Encrypted packet (len=92)
  217 17.126677200  10.6.15.144 → 192.168.1.16 SSH 166 Server: Encrypted packet (len=100)
  218 17.127113813 192.168.1.16 → 10.6.15.144  SSH 294 Client: Encrypted packet (len=228)
  219 17.127879744 192.168.1.16 → 10.6.15.144  SSH 310 Client: Encrypted packet (len=244)
  220 17.129726225  10.6.15.144 → 192.168.1.16 TCP 66 22 → 58518 [ACK] Seq=11777 Ack=8233 Win=1452 Len=0 TSval=7128521 TSecr=7678234
  221 17.211085939  10.6.15.144 → 192.168.1.16 SSH 118 Server: Encrypted packet (len=52)
  222 17.211469179  10.6.15.144 → 192.168.1.16 SSH 214 Server: Encrypted packet (len=148)
  223 17.211494269 192.168.1.16 → 10.6.15.144  TCP 66 58518 → 22 [ACK] Seq=8233 Ack=11977 Win=2263 Len=0 TSval=7678255 TSecr=7128541
  224 17.212772317  10.6.15.144 → 192.168.1.16 SSH 230 Server: Encrypted packet (len=164)
  225 17.231102913 10.22.19.225 → 224.0.0.252  LLMNR 74 Standard query 0x6eee ANY Anirrudingdong
  226 17.254000878 192.168.1.16 → 10.6.15.144  TCP 66 58518 → 22 [ACK] Seq=8233 Ack=12141 Win=2263 Len=0 TSval=7678266 TSecr=7128542
  227 17.274061651  10.6.15.144 → 192.168.1.16 SSH 138 Server: Encrypted packet (len=72)
  228 17.274083303 192.168.1.16 → 10.6.15.144  TCP 66 58518 → 22 [ACK] Seq=8233 Ack=12213 Win=2263 Len=0 TSval=7678271 TSecr=7128557
  229 17.274222363 192.168.1.16 → 10.6.15.144  SSH 102 Client: Encrypted packet (len=36)
  230 17.325223154  10.6.15.144 → 192.168.1.16 SSH 138 Server: Encrypted packet (len=72)
  231 17.325384057 192.168.1.16 → 10.6.15.144  SSH 102 Client: Encrypted packet (len=36)
  232 17.364957375  10.6.15.144 → 192.168.1.16 TCP 66 22 → 58518 [ACK] Seq=12285 Ack=8305 Win=1452 Len=0 TSval=7128580 TSecr=7678283
  233 17.368510143 10.22.17.101 → 224.0.0.252  LLMNR 64 Standard query 0x50a8 A wpad
  234 17.433540467  10.6.15.144 → 192.168.1.16 SSH 102 Server: Encrypted packet (len=36)
  235 17.433992567 192.168.1.16 → 10.6.15.144  SSH 126 Client: Encrypted packet (len=60)
  236 17.435546781  10.6.15.144 → 192.168.1.16 TCP 66 22 → 58518 [ACK] Seq=12321 Ack=8365 Win=1452 Len=0 TSval=7128597 TSecr=7678311
  237 17.454338205  10.6.15.144 → 192.168.1.16 SSH 102 Server: Encrypted packet (len=36)
  238 17.454665465 192.168.1.16 → 10.6.15.144  SSH 126 Client: Encrypted packet (len=60)
  239 17.496224515  10.6.15.144 → 192.168.1.16 TCP 66 22 → 58518 [ACK] Seq=12357 Ack=8425 Win=1452 Len=0 TSval=7128613 TSecr=7678316
  240 17.593147817  10.22.18.98 → 224.0.0.252  LLMNR 65 Standard query 0xab81 ANY Febin
  241 17.642399746 10.22.19.225 → 224.0.0.252  LLMNR 74 Standard query 0x6eee ANY Anirrudingdong
  242 17.726024194 192.168.1.16 → 224.0.0.252  IGMPv2 46 Membership Report group 224.0.0.252
  243 17.775549162 10.22.17.101 → 224.0.0.252  LLMNR 64 Standard query 0x50a8 A wpad
  244 17.810223158  10.6.15.144 → 192.168.1.16 SSH 174 Server: Encrypted packet (len=108)
  245 17.846519174  10.6.15.144 → 192.168.1.16 SSH 1514 Server: Encrypted packet (len=1448)
  246 17.846538351 192.168.1.16 → 10.6.15.144  TCP 66 58518 → 22 [ACK] Seq=8425 Ack=13913 Win=2263 Len=0 TSval=7678414 TSecr=7128691
  247 17.846602221  10.6.15.144 → 192.168.1.16 SSH 1270 Server: Encrypted packet (len=1204)
  248 17.848840206  10.6.15.144 → 192.168.1.16 SSH 1514 Server: Encrypted packet (len=1448)
  249 17.848860891 192.168.1.16 → 10.6.15.144  TCP 66 58518 → 22 [ACK] Seq=8425 Ack=16565 Win=2263 Len=0 TSval=7678414 TSecr=7128700
  250 17.849025110  10.6.15.144 → 192.168.1.16 SSH 1514 Server: Encrypted packet (len=1448)
  251 17.850942206  10.6.15.144 → 192.168.1.16 SSH 1514 Server: Encrypted packet (len=1448)
  252 17.850962674 192.168.1.16 → 10.6.15.144  TCP 66 58518 → 22 [ACK] Seq=8425 Ack=19461 Win=2263 Len=0 TSval=7678415 TSecr=7128701
  253 17.851121777  10.6.15.144 → 192.168.1.16 SSH 1514 Server: Encrypted packet (len=1448)
  254 17.853340960  10.6.15.144 → 192.168.1.16 SSH 1514 Server: Encrypted packet (len=1448)
  255 17.853362110 192.168.1.16 → 10.6.15.144  TCP 66 58518 → 22 [ACK] Seq=8425 Ack=22357 Win=2263 Len=0 TSval=7678415 TSecr=7128701
  256 17.853523686  10.6.15.144 → 192.168.1.16 SSH 1514 Server: Encrypted packet (len=1448)
  257 17.855580833  10.6.15.144 → 192.168.1.16 SSH 1514 Server: Encrypted packet (len=1448)
  258 17.855600625 192.168.1.16 → 10.6.15.144  TCP 66 58518 → 22 [ACK] Seq=8425 Ack=25253 Win=2263 Len=0 TSval=7678416 TSecr=7128702
  259 17.855763742  10.6.15.144 → 192.168.1.16 SSH 1514 Server: Encrypted packet (len=1448)
  260 17.857391845  10.6.15.144 → 192.168.1.16 SSH 154 Server: Encrypted packet (len=88)
  261 17.857410038 192.168.1.16 → 10.6.15.144  TCP 66 58518 → 22 [ACK] Seq=8425 Ack=26789 Win=2263 Len=0 TSval=7678416 TSecr=7128702
  262 17.871861729 192.168.1.16 → 10.6.15.144  SSH 110 Client: Encrypted packet (len=44)
  263 17.872238360 192.168.1.16 → 10.6.15.144  SSH 190 Client: Encrypted packet (len=124)
  264 17.873341690  10.6.15.144 → 192.168.1.16 TCP 66 22 → 58518 [ACK] Seq=26789 Ack=8469 Win=1452 Len=0 TSval=7128707 TSecr=7678420
  265 17.873359635 192.168.1.16 → 10.6.15.144  SSH 118 Client: Encrypted packet (len=52)
  266 17.874024194  10.6.15.144 → 192.168.1.16 TCP 66 22 → 58518 [ACK] Seq=26789 Ack=8593 Win=1452 Len=0 TSval=7128707 TSecr=7678420
  267 17.876412278  10.6.15.144 → 192.168.1.16 TCP 66 22 → 58518 [ACK] Seq=26789 Ack=8645 Win=1452 Len=0 TSval=7128707 TSecr=7678420
  268 17.919125922 192.168.1.16 → 10.6.15.144  SSH 102 Client: Encrypted packet (len=36)
  269 17.919737013 192.168.1.16 → 239.255.255.250 SSDP 213 M-SEARCH * HTTP/1.1 
  270 17.919834428 192.168.1.16 → 10.6.15.144  SSH 102 Client: Encrypted packet (len=36)
  271 17.920829702  10.6.15.144 → 192.168.1.16 TCP 66 22 → 58518 [ACK] Seq=26789 Ack=8681 Win=1452 Len=0 TSval=7128719 TSecr=7678432
  272 17.921032763 192.168.1.16 → 10.6.15.144  SSH 190 Client: Encrypted packet (len=124)
  273 17.921575737  10.6.15.144 → 192.168.1.16 TCP 66 22 → 58518 [ACK] Seq=26789 Ack=8717 Win=1452 Len=0 TSval=7128719 TSecr=7678432
  274 17.922982420  10.6.15.144 → 192.168.1.16 TCP 66 22 → 58518 [ACK] Seq=26789 Ack=8841 Win=1452 Len=0 TSval=7128719 TSecr=7678432
  275 17.939872567 192.168.1.16 → 10.6.15.144  SSH 110 Client: Encrypted packet (len=44)
  276 17.941179674  10.6.15.144 → 192.168.1.16 TCP 66 22 → 58518 [ACK] Seq=26789 Ack=8885 Win=1452 Len=0 TSval=7128724 TSecr=7678437
  277 17.973378449 10.22.18.209 → 224.0.0.252  LLMNR 64 Standard query 0x5959 A wpad
  278 18.037027964  10.22.18.98 → 224.0.0.252  LLMNR 65 Standard query 0xab81 ANY Febin
  279 18.072942823 10.22.18.209 → 224.0.0.252  LLMNR 64 Standard query 0x5959 A wpad
  280 18.302022366 192.168.1.16 → 224.0.0.252  IGMPv2 46 Membership Report group 224.0.0.252
  281 18.304035214 10.22.19.225 → 224.0.0.252  LLMNR 64 Standard query 0xd97a A wpad
  282 18.887993502 192.168.1.16 → 192.168.1.1  DNS 81 Standard query 0x1137 A 1.ubuntu.pool.ntp.org
  283 18.895393901  10.6.15.144 → 192.168.1.16 SSH 1514 Server: Encrypted packet (len=1448)
  284 18.895550789  10.6.15.144 → 192.168.1.16 SSH 1514 Server: Encrypted packet (len=1448)
  285 18.895562281 192.168.1.16 → 10.6.15.144  TCP 66 58518 → 22 [ACK] Seq=8885 Ack=29685 Win=2263 Len=0 TSval=7678676 TSecr=7128898
  286 18.895738117  10.6.15.144 → 192.168.1.16 SSH 1514 Server: Encrypted packet (len=1448)
  287 18.895744906 10.22.19.225 → 224.0.0.252  LLMNR 64 Standard query 0xd97a A wpad
  288 18.895948085  10.6.15.144 → 192.168.1.16 SSH 1514 Server: Encrypted packet (len=1448)
  289 18.895952636 192.168.1.16 → 10.6.15.144  TCP 66 58518 → 22 [ACK] Seq=8885 Ack=32581 Win=2263 Len=0 TSval=7678676 TSecr=7128898
  290 18.895959391  192.168.1.1 → 192.168.1.16 DNS 113 Standard query response 0x1137 A 1.ubuntu.pool.ntp.org A 123.108.200.124 A 52.66.5.185
  291 18.896139664  10.6.15.144 → 192.168.1.16 TCP 1514 [TCP Out-Of-Order] 22 → 58518 [ACK] Seq=26789 Ack=8885 Win=1452 Len=1448 TSval=7128962 TSecr=7678437
  292 18.896144188 192.168.1.16 → 10.6.15.144  TCP 78 [TCP Dup ACK 289#1] 58518 → 22 [ACK] Seq=8885 Ack=32581 Win=2263 Len=0 TSval=7678676 TSecr=7128898 SLE=26789 SRE=28237
  293 18.896371278 192.168.1.16 → 123.108.200.124 NTP 90 NTP Version 4, client
  294 18.904186532  10.6.15.144 → 192.168.1.16 SSH 1514 Server: Encrypted packet (len=1448)
  295 18.904205535 192.168.1.16 → 10.6.15.144  TCP 66 58518 → 22 [ACK] Seq=8885 Ack=34029 Win=2263 Len=0 TSval=7678678 TSecr=7128964
  296 18.904331286  10.6.15.144 → 192.168.1.16 SSH 1514 Server: Encrypted packet (len=1448)
  297 18.904336982 192.168.1.16 → 10.6.15.144  TCP 66 58518 → 22 [ACK] Seq=8885 Ack=35477 Win=2263 Len=0 TSval=7678678 TSecr=7128964
  298 18.904527340  10.6.15.144 → 192.168.1.16 SSH 1514 Server: Encrypted packet (len=1448)
  299 18.904530767 192.168.1.16 → 10.6.15.144  TCP 66 58518 → 22 [ACK] Seq=8885 Ack=36925 Win=2263 Len=0 TSval=7678678 TSecr=7128964
  300 18.909622326  10.6.15.144 → 192.168.1.16 SSH 1514 Server: Encrypted packet (len=1448)
  301 18.909641798 192.168.1.16 → 10.6.15.144  TCP 66 58518 → 22 [ACK] Seq=8885 Ack=38373 Win=2263 Len=0 TSval=7678679 TSecr=7128966
  302 18.909767581  10.6.15.144 → 192.168.1.16 SSH 1514 Server: Encrypted packet (len=1448)
  303 18.909773495 192.168.1.16 → 10.6.15.144  TCP 66 58518 → 22 [ACK] Seq=8885 Ack=39821 Win=2263 Len=0 TSval=7678679 TSecr=7128966
  304 18.909934276  10.6.15.144 → 192.168.1.16 SSH 1514 Server: Encrypted packet (len=1448)
  305 18.909936937 192.168.1.16 → 10.6.15.144  TCP 66 58518 → 22 [ACK] Seq=8885 Ack=41269 Win=2263 Len=0 TSval=7678679 TSecr=7128966
  306 18.917301262  10.6.15.144 → 192.168.1.16 SSH 1514 Server: Encrypted packet (len=1448)
  307 18.917318779 192.168.1.16 → 10.6.15.144  TCP 66 58518 → 22 [ACK] Seq=8885 Ack=42717 Win=2263 Len=0 TSval=7678681 TSecr=7128967
  308 18.917453027  10.6.15.144 → 192.168.1.16 SSH 1514 Server: Encrypted packet (len=1448)
  309 18.917459963 192.168.1.16 → 10.6.15.144  TCP 66 58518 → 22 [ACK] Seq=8885 Ack=44165 Win=2263 Len=0 TSval=7678681 TSecr=7128967
  310 18.917613939  10.6.15.144 → 192.168.1.16 SSH 1514 Server: Encrypted packet (len=1448)
  311 18.917616847 192.168.1.16 → 10.6.15.144  TCP 66 58518 → 22 [ACK] Seq=8885 Ack=45613 Win=2263 Len=0 TSval=7678681 TSecr=7128967
  312 18.917696506 192.168.1.16 → 10.6.15.144  SSH 102 Client: Encrypted packet (len=36)
  313 18.918421247 192.168.1.16 → 10.6.15.144  SSH 158 Client: Encrypted packet (len=92)
  314 18.920751827 192.168.1.16 → 239.255.255.250 SSDP 213 M-SEARCH * HTTP/1.1 
  315 18.928154867  10.6.15.144 → 192.168.1.16 SSH 1514 Server: Encrypted packet (len=1448)
  316 18.928313557  10.6.15.144 → 192.168.1.16 SSH 1514 Server: Encrypted packet (len=1448)
  317 18.928324917 192.168.1.16 → 10.6.15.144  TCP 66 58518 → 22 [ACK] Seq=9013 Ack=48509 Win=2263 Len=0 TSval=7678684 TSecr=7128968
  318 18.928506777  10.6.15.144 → 192.168.1.16 SSH 1514 Server: Encrypted packet (len=1448)
  319 18.928522067  10.6.15.144 → 192.168.1.16 TCP 66 22 → 58518 [ACK] Seq=49957 Ack=8921 Win=1452 Len=0 TSval=7128968 TSecr=7678681
  320 18.929374281  10.6.15.144 → 192.168.1.16 TCP 66 22 → 58518 [ACK] Seq=49957 Ack=9013 Win=1452 Len=0 TSval=7128971 TSecr=7678682
  321 18.932503489  10.6.15.144 → 192.168.1.16 SSH 1514 Server: Encrypted packet (len=1448)
  322 18.932520918 192.168.1.16 → 10.6.15.144  TCP 66 58518 → 22 [ACK] Seq=9013 Ack=51405 Win=2263 Len=0 TSval=7678685 TSecr=7128968
  323 18.932651779  10.6.15.144 → 192.168.1.16 SSH 1514 Server: Encrypted packet (len=1448)
  324 18.932998946  10.6.15.144 → 192.168.1.16 SSH 1514 Server: Encrypted packet (len=1448)
  325 18.933003643 192.168.1.16 → 10.6.15.144  TCP 66 58518 → 22 [ACK] Seq=9013 Ack=54301 Win=2263 Len=0 TSval=7678685 TSecr=7128971
  326 18.946357088  10.6.15.144 → 192.168.1.16 SSH 1514 Server: Encrypted packet (len=1448)
  327 18.946512313  10.6.15.144 → 192.168.1.16 SSH 1514 Server: Encrypted packet (len=1448)
  328 18.946523190 192.168.1.16 → 10.6.15.144  TCP 66 58518 → 22 [ACK] Seq=9013 Ack=57197 Win=2263 Len=0 TSval=7678689 TSecr=7128972
  329 18.946705577  10.6.15.144 → 192.168.1.16 SSH 1514 Server: Encrypted packet (len=1448)
  330 18.946896253  10.6.15.144 → 192.168.1.16 SSH 1514 Server: Encrypted packet (len=1448)
  331 18.946908414 192.168.1.16 → 10.6.15.144  TCP 66 58518 → 22 [ACK] Seq=9013 Ack=60093 Win=2263 Len=0 TSval=7678689 TSecr=7128972
  332 18.949060242  10.6.15.144 → 192.168.1.16 SSH 1514 Server: Encrypted packet (len=1448)
  333 18.949249486  10.6.15.144 → 192.168.1.16 SSH 1514 Server: Encrypted packet (len=1448)
  334 18.949259979 192.168.1.16 → 10.6.15.144  TCP 66 58518 → 22 [ACK] Seq=9013 Ack=62989 Win=2263 Len=0 TSval=7678689 TSecr=7128976
  335 18.953097359  10.6.15.144 → 192.168.1.16 SSH 1514 Server: Encrypted packet (len=1448)
  336 18.953301655  10.6.15.144 → 192.168.1.16 SSH 1514 Server: Encrypted packet (len=1448)
  337 18.953308678 192.168.1.16 → 10.6.15.144  TCP 66 58518 → 22 [ACK] Seq=9013 Ack=65885 Win=2263 Len=0 TSval=7678690 TSecr=7128976
  338 18.978532335  10.6.15.144 → 192.168.1.16 SSH 1514 Server: Encrypted packet (len=1448)
  339 18.978712840  10.6.15.144 → 192.168.1.16 SSH 1514 Server: Encrypted packet (len=1448)
  340 18.978724496 192.168.1.16 → 10.6.15.144  TCP 66 58518 → 22 [ACK] Seq=9013 Ack=68781 Win=2263 Len=0 TSval=7678697 TSecr=7128983
  341 18.978960185  10.6.15.144 → 192.168.1.16 SSH 1514 Server: Encrypted packet (len=1448)
  342 18.979139392  10.6.15.144 → 192.168.1.16 SSH 1514 Server: Encrypted packet (len=1448)
  343 18.979150851 192.168.1.16 → 10.6.15.144  TCP 66 58518 → 22 [ACK] Seq=9013 Ack=71677 Win=2263 Len=0 TSval=7678697 TSecr=7128983
  344 18.984961706  10.6.15.144 → 192.168.1.16 SSH 1514 Server: Encrypted packet (len=1448)
  345 18.985167243  10.6.15.144 → 192.168.1.16 SSH 1514 Server: Encrypted packet (len=1448)
  346 18.985176891 192.168.1.16 → 10.6.15.144  TCP 66 58518 → 22 [ACK] Seq=9013 Ack=74573 Win=2263 Len=0 TSval=7678698 TSecr=7128984
  347 18.985378261  10.6.15.144 → 192.168.1.16 SSH 1514 Server: Encrypted packet (len=1448)
  348 18.985590681  10.6.15.144 → 192.168.1.16 SSH 1514 Server: Encrypted packet (len=1448)
  349 18.985594366 192.168.1.16 → 10.6.15.144  TCP 66 58518 → 22 [ACK] Seq=9013 Ack=77469 Win=2263 Len=0 TSval=7678698 TSecr=7128984
  350 19.000240826  10.6.15.144 → 192.168.1.16 SSH 1514 Server: Encrypted packet (len=1448)
  351 19.032874719  10.6.15.144 → 192.168.1.16 SSH 1514 Server: Encrypted packet (len=1448)
  352 19.032891967 192.168.1.16 → 10.6.15.144  TCP 66 58518 → 22 [ACK] Seq=9013 Ack=80365 Win=2263 Len=0 TSval=7678710 TSecr=7128987
  353 19.033547354 192.168.1.16 → 10.6.15.144  SSH 134 Client: Encrypted packet (len=68)
  354 19.034285859 192.168.1.16 → 10.6.15.144  SSH 294 Client: Encrypted packet (len=228)
  355 19.035368214 192.168.1.16 → 10.6.15.144  SSH 318 Client: Encrypted packet (len=252)
  356 19.061970991 192.168.1.16 → 10.6.15.144  TCP 318 [TCP Retransmission] 58518 → 22 [PSH, ACK] Seq=9309 Ack=80365 Win=2263 Len=252 TSval=7678718 TSecr=7128987
  357 19.066836758 192.168.1.16 → 10.6.15.144  SSH 110 Client: Encrypted packet (len=44)
  358 19.088259413  10.6.15.144 → 192.168.1.16 SSH 1514 Server: Encrypted packet (len=1448)
  359 19.088495226  10.6.15.144 → 192.168.1.16 SSH 1514 Server: Encrypted packet (len=1448)
  360 19.088508499 192.168.1.16 → 10.6.15.144  TCP 66 58518 → 22 [ACK] Seq=9605 Ack=83261 Win=2263 Len=0 TSval=7678724 TSecr=7129010
  361 19.088733917  10.6.15.144 → 192.168.1.16 SSH 1514 Server: Encrypted packet (len=1448)
  362 19.088975019  10.6.15.144 → 192.168.1.16 SSH 1514 Server: Encrypted packet (len=1448)
  363 19.088983858 192.168.1.16 → 10.6.15.144  TCP 66 58518 → 22 [ACK] Seq=9605 Ack=86157 Win=2263 Len=0 TSval=7678724 TSecr=7129010
  364 19.089215224  10.6.15.144 → 192.168.1.16 SSH 1514 Server: Encrypted packet (len=1448)
  365 19.089226309  10.6.15.144 → 192.168.1.16 TCP 66 22 → 58518 [ACK] Seq=87605 Ack=9309 Win=1452 Len=0 TSval=7129010 TSecr=7678710
  366 19.103092883  10.6.15.144 → 192.168.1.16 SSH 1514 Server: Encrypted packet (len=1448)
  367 19.103112237 192.168.1.16 → 10.6.15.144  TCP 66 58518 → 22 [ACK] Seq=9605 Ack=89053 Win=2263 Len=0 TSval=7678728 TSecr=7129010
  368 19.107298308  10.6.15.144 → 192.168.1.16 SSH 1514 Server: Encrypted packet (len=1448)
  369 19.107617053  10.6.15.144 → 192.168.1.16 SSH 1514 Server: Encrypted packet (len=1448)
  370 19.107627783 192.168.1.16 → 10.6.15.144  TCP 66 58518 → 22 [ACK] Seq=9605 Ack=91949 Win=2263 Len=0 TSval=7678729 TSecr=7129012
  371 19.107933855  10.6.15.144 → 192.168.1.16 SSH 1514 Server: Encrypted packet (len=1448)
  372 19.111154548  10.6.15.144 → 192.168.1.16 SSH 1514 Server: Encrypted packet (len=1448)
  373 19.111173906 192.168.1.16 → 10.6.15.144  TCP 66 58518 → 22 [ACK] Seq=9605 Ack=94845 Win=2263 Len=0 TSval=7678730 TSecr=7129012
  374 19.111463479  10.6.15.144 → 192.168.1.16 SSH 1514 Server: Encrypted packet (len=1448)
  375 19.153969852 192.168.1.16 → 10.6.15.144  TCP 66 58518 → 22 [ACK] Seq=9605 Ack=96293 Win=2263 Len=0 TSval=7678741 TSecr=7129016
  376 19.163232239  10.6.15.144 → 192.168.1.16 SSH 1514 Server: Encrypted packet (len=1448)
  377 19.205970093 192.168.1.16 → 10.6.15.144  TCP 66 58518 → 22 [ACK] Seq=9605 Ack=97741 Win=2263 Len=0 TSval=7678754 TSecr=7129028
  378 19.281973080 192.168.1.16 → 10.6.15.144  TCP 362 [TCP Retransmission] 58518 → 22 [PSH, ACK] Seq=9309 Ack=97741 Win=2263 Len=296 TSval=7678773 TSecr=7129028
  379 19.298299869  10.6.15.144 → 192.168.1.16 SSH 1514 Server: Encrypted packet (len=1448)
  380 19.298611185  10.6.15.144 → 192.168.1.16 SSH 1514 Server: Encrypted packet (len=1448)
  381 19.298618475 192.168.1.16 → 10.6.15.144  TCP 66 58518 → 22 [ACK] Seq=9605 Ack=100637 Win=2263 Len=0 TSval=7678777 TSecr=7129063
  382 19.298930781  10.6.15.144 → 192.168.1.16 SSH 1514 Server: Encrypted packet (len=1448)
  383 19.299250919  10.6.15.144 → 192.168.1.16 SSH 1514 Server: Encrypted packet (len=1448)
  384 19.299256846 192.168.1.16 → 10.6.15.144  TCP 66 58518 → 22 [ACK] Seq=9605 Ack=103533 Win=2263 Len=0 TSval=7678777 TSecr=7129063
  385 19.299567672  10.6.15.144 → 192.168.1.16 SSH 1514 Server: Encrypted packet (len=1448)
  386 19.341982108 192.168.1.16 → 10.6.15.144  TCP 66 58518 → 22 [ACK] Seq=9605 Ack=104981 Win=2263 Len=0 TSval=7678788 TSecr=7129063
  387 19.392873263  10.6.15.144 → 192.168.1.16 TCP 66 22 → 58518 [ACK] Seq=104981 Ack=9605 Win=1452 Len=0 TSval=7129073 TSecr=7678773
  388 19.393123791  10.6.15.144 → 192.168.1.16 SSH 1514 Server: Encrypted packet (len=1448)
  389 19.433982444 192.168.1.16 → 10.6.15.144  TCP 66 58518 → 22 [ACK] Seq=9605 Ack=106429 Win=2263 Len=0 TSval=7678811 TSecr=7129087
  390 19.920982423 192.168.1.16 → 239.255.255.250 SSDP 213 M-SEARCH * HTTP/1.1 
  391 19.927033220  10.6.15.144 → 192.168.1.16 SSH 1514 Server: [TCP Spurious Retransmission] , Encrypted packet (len=1448)
  392 19.927051854 192.168.1.16 → 10.6.15.144  TCP 78 [TCP Dup ACK 389#1] 58518 → 22 [ACK] Seq=9605 Ack=106429 Win=2263 Len=0 TSval=7678934 TSecr=7129087 SLE=97741 SRE=99189
  393 19.937744301  10.6.15.144 → 192.168.1.16 SSH 1514 Server: Encrypted packet (len=1448)
  394 19.937769636 192.168.1.16 → 10.6.15.144  TCP 66 58518 → 22 [ACK] Seq=9605 Ack=107877 Win=2263 Len=0 TSval=7678936 TSecr=7129221
  395 19.937866562  10.6.15.144 → 192.168.1.16 SSH 1514 Server: Encrypted packet (len=1448)
  396 19.937871219 192.168.1.16 → 10.6.15.144  TCP 66 58518 → 22 [ACK] Seq=9605 Ack=109325 Win=2263 Len=0 TSval=7678936 TSecr=7129221
  397 19.938063152  10.6.15.144 → 192.168.1.16 SSH 1514 Server: Encrypted packet (len=1448)
  398 19.938070629 192.168.1.16 → 10.6.15.144  TCP 66 58518 → 22 [ACK] Seq=9605 Ack=110773 Win=2263 Len=0 TSval=7678937 TSecr=7129221
  399 19.938254054  10.6.15.144 → 192.168.1.16 SSH 1514 Server: Encrypted packet (len=1448)
  400 19.938261043 192.168.1.16 → 10.6.15.144  TCP 66 58518 → 22 [ACK] Seq=9605 Ack=112221 Win=2263 Len=0 TSval=7678937 TSecr=7129221
  401 19.938454602  10.6.15.144 → 192.168.1.16 SSH 1514 Server: Encrypted packet (len=1448)
  402 19.938462239 192.168.1.16 → 10.6.15.144  TCP 66 58518 → 22 [ACK] Seq=9605 Ack=113669 Win=2263 Len=0 TSval=7678937 TSecr=7129221
  403 19.938564739 192.168.1.16 → 10.6.15.144  SSH 102 Client: Encrypted packet (len=36)
  404 20.094001346 192.168.1.16 → 23.185.0.2   TCP 66 54374 → 443 [ACK] Seq=1 Ack=1 Win=364 Len=0 TSval=7678976 TSecr=2742467961
  405 20.094777795 192.168.1.16 → 151.101.193.69 TCP 66 33220 → 443 [ACK] Seq=1 Ack=1 Win=410 Len=0 TSval=7678976 TSecr=304378599
  406 20.094780740 192.168.1.16 → 151.101.8.223 TCP 66 54978 → 443 [ACK] Seq=1 Ack=1 Win=591 Len=0 TSval=7678976 TSecr=304378599
  407 20.094782274 192.168.1.16 → 54.192.190.228 TCP 66 33568 → 80 [ACK] Seq=1 Ack=1 Win=239 Len=0 TSval=7678976 TSecr=1012072872
  408 20.145067352  10.6.15.144 → 192.168.1.16 SSH 1514 Server: Encrypted packet (len=1448)
  409 20.161502551  10.22.17.98 → 224.0.0.252  LLMNR 64 Standard query 0x9f7d A wpad
  410 20.169997845 192.168.1.16 → 10.6.15.144  TCP 102 [TCP Retransmission] 58518 → 22 [PSH, ACK] Seq=9605 Ack=115117 Win=2263 Len=36 TSval=7678995 TSecr=7129275
  411 20.401995222 192.168.1.16 → 10.6.15.144  TCP 102 [TCP Retransmission] 58518 → 22 [PSH, ACK] Seq=9605 Ack=115117 Win=2263 Len=36 TSval=7679053 TSecr=7129275
  412 20.416634073  10.6.15.144 → 192.168.1.16 SSH 1514 Server: Encrypted packet (len=1448)
  413 20.416794395  10.6.15.144 → 192.168.1.16 SSH 1514 Server: Encrypted packet (len=1448)
  414 20.416802665 192.168.1.16 → 10.6.15.144  TCP 66 58518 → 22 [ACK] Seq=9641 Ack=118013 Win=2263 Len=0 TSval=7679056 TSecr=7129308
  415 20.416973663  10.6.15.144 → 192.168.1.16 SSH 1514 Server: Encrypted packet (len=1448)
  416 20.417166842  10.6.15.144 → 192.168.1.16 SSH 1514 Server: Encrypted packet (len=1448)
  417 20.417175334 192.168.1.16 → 10.6.15.144  TCP 66 58518 → 22 [ACK] Seq=9641 Ack=120909 Win=2263 Len=0 TSval=7679056 TSecr=7129308
  418 20.417356416  10.6.15.144 → 192.168.1.16 SSH 1514 Server: Encrypted packet (len=1448)
  419 20.417367714 151.101.8.223 → 192.168.1.16 TCP 66 [TCP ACKed unseen segment] 443 → 54978 [ACK] Seq=1 Ack=2 Win=61 Len=0 TSval=304389908 TSecr=7543599
  420 20.417376307 151.101.193.69 → 192.168.1.16 TCP 66 [TCP ACKed unseen segment] 443 → 33220 [ACK] Seq=1 Ack=2 Win=61 Len=0 TSval=304389908 TSecr=7543515
  421 20.417381389   23.185.0.2 → 192.168.1.16 TCP 66 [TCP ACKed unseen segment] 443 → 54374 [ACK] Seq=1 Ack=2 Win=61 Len=0 TSval=2742479270 TSecr=7543563
  422 20.417386240  10.6.15.144 → 192.168.1.16 TCP 78 [TCP Dup ACK 412#1] 22 → 58518 [ACK] Seq=122357 Ack=9641 Win=1452 Len=0 TSval=7129340 TSecr=7679053 SLE=9605 SRE=9641
  423 20.420413620  10.6.15.144 → 192.168.1.16 SSH 1514 Server: Encrypted packet (len=1448)
  424 20.420433060 192.168.1.16 → 10.6.15.144  TCP 66 58518 → 22 [ACK] Seq=9641 Ack=123805 Win=2263 Len=0 TSval=7679057 TSecr=7129308
  425 20.420533063  10.6.15.144 → 192.168.1.16 SSH 1514 Server: Encrypted packet (len=1448)
  426 20.424846058  10.6.15.144 → 192.168.1.16 SSH 1514 Server: Encrypted packet (len=1448)
  427 20.424864069 192.168.1.16 → 10.6.15.144  TCP 66 58518 → 22 [ACK] Seq=9641 Ack=126701 Win=2263 Len=0 TSval=7679058 TSecr=7129343
  428 20.424967119  10.6.15.144 → 192.168.1.16 SSH 1514 Server: Encrypted packet (len=1448)
  429 20.425170143  10.6.15.144 → 192.168.1.16 SSH 1514 Server: Encrypted packet (len=1448)
  430 20.425177702 192.168.1.16 → 10.6.15.144  TCP 66 58518 → 22 [ACK] Seq=9641 Ack=129597 Win=2263 Len=0 TSval=7679058 TSecr=7129343
  431 20.425506728  10.6.15.144 → 192.168.1.16 SSH 1514 Server: Encrypted packet (len=1448)
  432 20.431323196  10.6.15.144 → 192.168.1.16 SSH 1514 Server: Encrypted packet (len=1448)
  433 20.431341003 192.168.1.16 → 10.6.15.144  TCP 66 58518 → 22 [ACK] Seq=9641 Ack=132493 Win=2263 Len=0 TSval=7679060 TSecr=7129345
  434 20.431443287  10.6.15.144 → 192.168.1.16 SSH 1514 Server: Encrypted packet (len=1448)
  435 20.432038884 192.168.1.16 → 10.6.15.144  SSH 238 Client: Encrypted packet (len=172)
  436 20.432595640  10.6.15.144 → 192.168.1.16 SSH 1514 Server: Encrypted packet (len=1448)
  437 20.432608401  10.6.15.144 → 192.168.1.16 SSH 1514 Server: Encrypted packet (len=1448)
  438 20.432620788 192.168.1.16 → 10.6.15.144  SSH 198 Client: Encrypted packet (len=132)
  439 20.438594615  10.6.15.144 → 192.168.1.16 SSH 1514 Server: Encrypted packet (len=1448)
  440 20.438751279  10.6.15.144 → 192.168.1.16 SSH 1514 Server: Encrypted packet (len=1448)
  441 20.438758007 192.168.1.16 → 10.6.15.144  TCP 66 58518 → 22 [ACK] Seq=9945 Ack=139733 Win=2263 Len=0 TSval=7679062 TSecr=7129347
  442 20.438769794  10.6.15.144 → 192.168.1.16 TCP 66 22 → 58518 [ACK] Seq=139733 Ack=9813 Win=1452 Len=0 TSval=7129347 TSecr=7679060
  443 20.438983286  10.6.15.144 → 192.168.1.16 SSH 1514 Server: Encrypted packet (len=1448)
  444 20.439183802  10.6.15.144 → 192.168.1.16 SSH 1514 Server: Encrypted packet (len=1448)
  445 20.439191320 192.168.1.16 → 10.6.15.144  TCP 66 58518 → 22 [ACK] Seq=9945 Ack=142629 Win=2263 Len=0 TSval=7679062 TSecr=7129347
  446 20.439397122  10.6.15.144 → 192.168.1.16 SSH 1514 Server: Encrypted packet (len=1448)
  447 20.439636164  10.6.15.144 → 192.168.1.16 SSH 1514 Server: Encrypted packet (len=1448)
  448 20.439641341 192.168.1.16 → 10.6.15.144  TCP 66 58518 → 22 [ACK] Seq=9945 Ack=145525 Win=2263 Len=0 TSval=7679062 TSecr=7129347
  449 20.443607554  10.6.15.144 → 192.168.1.16 SSH 1514 Server: Encrypted packet (len=1448)
  450 20.443806441  10.6.15.144 → 192.168.1.16 SSH 1514 Server: Encrypted packet (len=1448)
  451 20.443816302 192.168.1.16 → 10.6.15.144  TCP 66 58518 → 22 [ACK] Seq=9945 Ack=148421 Win=2263 Len=0 TSval=7679063 TSecr=7129349
  452 20.444018629  10.6.15.144 → 192.168.1.16 SSH 1514 Server: Encrypted packet (len=1448)
  453 20.444232752  10.6.15.144 → 192.168.1.16 SSH 1514 Server: Encrypted packet (len=1448)
  454 20.444237394 192.168.1.16 → 10.6.15.144  TCP 66 58518 → 22 [ACK] Seq=9945 Ack=151317 Win=2263 Len=0 TSval=7679063 TSecr=7129349
  455 20.444448797  10.6.15.144 → 192.168.1.16 SSH 1514 Server: Encrypted packet (len=1448)
  456 20.444659827  10.6.15.144 → 192.168.1.16 SSH 1514 Server: Encrypted packet (len=1448)
  457 20.444665471 192.168.1.16 → 10.6.15.144  TCP 66 58518 → 22 [ACK] Seq=9945 Ack=154213 Win=2263 Len=0 TSval=7679063 TSecr=7129349
  458 20.451857038  10.6.15.144 → 192.168.1.16 SSH 1514 Server: Encrypted packet (len=1448)
  459 20.452035054  10.6.15.144 → 192.168.1.16 SSH 1514 Server: Encrypted packet (len=1448)
  460 20.452046749 192.168.1.16 → 10.6.15.144  TCP 66 58518 → 22 [ACK] Seq=9945 Ack=157109 Win=2263 Len=0 TSval=7679065 TSecr=7129350
  461 20.452287030  10.6.15.144 → 192.168.1.16 SSH 1514 Server: Encrypted packet (len=1448)
  462 20.452427913  10.6.15.144 → 192.168.1.16 SSH 1514 Server: Encrypted packet (len=1448)
  463 20.452437157 192.168.1.16 → 10.6.15.144  TCP 66 58518 → 22 [ACK] Seq=9945 Ack=160005 Win=2263 Len=0 TSval=7679065 TSecr=7129350
  464 20.452709223  10.6.15.144 → 192.168.1.16 SSH 1514 Server: Encrypted packet (len=1448)
  465 20.452891493  10.6.15.144 → 192.168.1.16 SSH 1514 Server: Encrypted packet (len=1448)
  466 20.452903202 192.168.1.16 → 10.6.15.144  TCP 66 58518 → 22 [ACK] Seq=9945 Ack=162901 Win=2263 Len=0 TSval=7679065 TSecr=7129350
  467 20.459668366  10.6.15.144 → 192.168.1.16 SSH 1514 Server: Encrypted packet (len=1448)
  468 20.459813608  10.6.15.144 → 192.168.1.16 SSH 1514 Server: Encrypted packet (len=1448)
  469 20.459822020 192.168.1.16 → 10.6.15.144  TCP 66 58518 → 22 [ACK] Seq=9945 Ack=165797 Win=2263 Len=0 TSval=7679067 TSecr=7129352
  470 20.464211076  10.6.15.144 → 192.168.1.16 SSH 1514 Server: Encrypted packet (len=1448)
  471 20.464378124  10.6.15.144 → 192.168.1.16 SSH 1514 Server: Encrypted packet (len=1448)
  472 20.464386715 192.168.1.16 → 10.6.15.144  TCP 66 58518 → 22 [ACK] Seq=9945 Ack=168693 Win=2263 Len=0 TSval=7679068 TSecr=7129352
  473 20.464594679  10.6.15.144 → 192.168.1.16 SSH 1514 Server: Encrypted packet (len=1448)
  474 20.464792479  10.6.15.144 → 192.168.1.16 SSH 1514 Server: Encrypted packet (len=1448)
  475 20.464795921 192.168.1.16 → 10.6.15.144  TCP 66 58518 → 22 [ACK] Seq=9945 Ack=171589 Win=2263 Len=0 TSval=7679068 TSecr=7129352
  476 20.464993420  10.6.15.144 → 192.168.1.16 SSH 1514 Server: Encrypted packet (len=1448)
  477 20.465236095  10.6.15.144 → 192.168.1.16 SSH 1514 Server: Encrypted packet (len=1448)
  478 20.465241012 192.168.1.16 → 10.6.15.144  TCP 66 58518 → 22 [ACK] Seq=9945 Ack=174485 Win=2263 Len=0 TSval=7679068 TSecr=7129354
  479 20.472290151  10.6.15.144 → 192.168.1.16 SSH 1514 Server: Encrypted packet (len=1448)
  480 20.472634198  10.6.15.144 → 192.168.1.16 SSH 1514 Server: Encrypted packet (len=1448)
  481 20.472644279 192.168.1.16 → 10.6.15.144  TCP 66 58518 → 22 [ACK] Seq=9945 Ack=177381 Win=2263 Len=0 TSval=7679070 TSecr=7129355
  482 20.472978982  10.6.15.144 → 192.168.1.16 SSH 1514 Server: Encrypted packet (len=1448)
  483 20.473180450  10.6.15.144 → 192.168.1.16 SSH 1514 Server: Encrypted packet (len=1448)
  484 20.473189030 192.168.1.16 → 10.6.15.144  TCP 66 58518 → 22 [ACK] Seq=9945 Ack=180277 Win=2263 Len=0 TSval=7679070 TSecr=7129355
  485 20.473393057  10.6.15.144 → 192.168.1.16 SSH 1514 Server: Encrypted packet (len=1448)
  486 20.473614428  10.6.15.144 → 192.168.1.16 SSH 1514 Server: Encrypted packet (len=1448)
  487 20.473621170 192.168.1.16 → 10.6.15.144  TCP 66 58518 → 22 [ACK] Seq=9945 Ack=183173 Win=2263 Len=0 TSval=7679070 TSecr=7129355
  488 20.482891364  10.6.15.144 → 192.168.1.16 SSH 1514 Server: Encrypted packet (len=1448)
  489 20.483029480  10.6.15.144 → 192.168.1.16 SSH 802 Server: Encrypted packet (len=736)
  490 20.483040271 192.168.1.16 → 10.6.15.144  TCP 66 58518 → 22 [ACK] Seq=9945 Ack=185357 Win=2263 Len=0 TSval=7679073 TSecr=7129358
  491 20.573262005  10.22.17.98 → 224.0.0.252  LLMNR 64 Standard query 0x9f7d A wpad
  492 20.697996257 192.168.1.16 → 10.6.15.144  SSH 110 Client: Encrypted packet (len=44)
  493 20.721992441 192.168.1.16 → 10.6.15.144  SSH 146 Client: Encrypted packet (len=80)
  494 20.793963600 192.168.1.16 → 10.6.15.144  SSH 554 Client: Encrypted packet (len=488)
  495 20.808701878  10.6.15.144 → 192.168.1.16 SSH 326 Server: Encrypted packet (len=260)
  496 20.808720125  10.6.15.144 → 192.168.1.16 SSH 102 Server: Encrypted packet (len=36)
  497 20.808765608 192.168.1.16 → 10.6.15.144  TCP 66 58518 → 22 [ACK] Seq=10557 Ack=185653 Win=2263 Len=0 TSval=7679154 TSecr=7129440
  498 20.838173045  10.6.15.144 → 192.168.1.16 SSH 102 Server: [TCP Spurious Retransmission] , Encrypted packet (len=36)
  499 20.838192203 192.168.1.16 → 10.6.15.144  TCP 78 [TCP Dup ACK 497#1] 58518 → 22 [ACK] Seq=10557 Ack=185653 Win=2263 Len=0 TSval=7679162 TSecr=7129448 SLE=185617 SRE=185653
  500 20.920907869 192.168.1.16 → 224.0.0.251  MDNS 82 Standard query 0x0000 PTR _googlecast._tcp.local, "QM" question
  501 20.920952479 fe80::820e:b87b:de2a:4286 → ff02::fb     MDNS 102 Standard query 0x0000 PTR _googlecast._tcp.local, "QM" question
  502 20.920983254 192.168.1.16 → 239.255.255.250 SSDP 213 M-SEARCH * HTTP/1.1 
  503 20.921001557 192.168.1.16 → 224.0.0.251  MDNS 82 Standard query 0x0000 PTR _googlecast._tcp.local, "QM" question
  504 20.921015261 fe80::820e:b87b:de2a:4286 → ff02::fb     MDNS 102 Standard query 0x0000 PTR _googlecast._tcp.local, "QM" question
  505 20.929967196 192.168.1.16 → 10.6.15.144  SSH 174 Client: Encrypted packet (len=108)
  506 21.310022911 192.168.1.16 → 10.6.15.144  TCP 786 [TCP Retransmission] 58518 → 22 [PSH, ACK] Seq=9945 Ack=185653 Win=2263 Len=720 TSval=7679280 TSecr=7129448
  507 21.465998885  10.6.15.144 → 192.168.1.16 TCP 78 [TCP Previous segment not captured] 22 → 58518 [ACK] Seq=185801 Ack=9945 Win=1452 Len=0 TSval=7129528 TSecr=7679073 SLE=10557 SRE=10665
  508 21.887875113 192.168.1.16 → 192.168.1.1  DNS 81 Standard query 0x1978 A 3.ubuntu.pool.ntp.org
  509 21.889838081  10.6.15.144 → 192.168.1.16 TCP 226 [TCP Retransmission] 22 → 58518 [PSH, ACK] Seq=185653 Ack=9945 Win=1452 Len=148 TSval=7129699 TSecr=7679073 SLE=10557 SRE=10665
  510 21.889857079 192.168.1.16 → 10.6.15.144  TCP 66 58518 → 22 [ACK] Seq=10665 Ack=185801 Win=2263 Len=0 TSval=7679424 TSecr=7129699
  511 21.891345964  192.168.1.1 → 192.168.1.16 DNS 113 Standard query response 0x1978 A 3.ubuntu.pool.ntp.org A 123.108.200.124 A 52.66.5.185
  512 21.891962743 192.168.1.16 → 123.108.200.124 NTP 90 NTP Version 4, client
  513 21.921860097 192.168.1.16 → 224.0.0.251  MDNS 82 Standard query 0x0000 PTR _googlecast._tcp.local, "QM" question
  514 21.921898172 fe80::820e:b87b:de2a:4286 → ff02::fb     MDNS 102 Standard query 0x0000 PTR _googlecast._tcp.local, "QM" question
  515 21.921975922 192.168.1.16 → 224.0.0.251  MDNS 82 Standard query 0x0000 PTR _googlecast._tcp.local, "QM" question
  516 21.921993985 fe80::820e:b87b:de2a:4286 → ff02::fb     MDNS 102 Standard query 0x0000 PTR _googlecast._tcp.local, "QM" question
  517 22.046051361 192.168.1.16 → 10.6.15.144  TCP 786 [TCP Retransmission] 58518 → 22 [PSH, ACK] Seq=9945 Ack=185801 Win=2263 Len=720 TSval=7679464 TSecr=7129699
  518 22.049225124  10.6.15.144 → 192.168.1.16 TCP 78 22 → 58518 [ACK] Seq=185801 Ack=10665 Win=1452 Len=0 TSval=7129751 TSecr=7679464 SLE=10557 SRE=10665
  519 22.049249525 192.168.1.16 → 10.6.15.144  SSH 958 Client: Encrypted packet (len=892)
  520 22.049316034  10.6.15.144 → 192.168.1.16 SSH 102 Server: Encrypted packet (len=36)
  521 22.049326297 192.168.1.16 → 10.6.15.144  TCP 66 58518 → 22 [ACK] Seq=11557 Ack=185837 Win=2263 Len=0 TSval=7679464 TSecr=7129751
  522 22.056842806  10.6.15.144 → 192.168.1.16 SSH 310 Server: Encrypted packet (len=244)
  523 22.056867569 192.168.1.16 → 10.6.15.144  TCP 66 58518 → 22 [ACK] Seq=11557 Ack=186081 Win=2263 Len=0 TSval=7679466 TSecr=7129752
  524 22.057511886 192.168.1.16 → 10.6.15.144  SSH 134 Client: Encrypted packet (len=68)
  525 22.069042992  10.6.15.144 → 192.168.1.16 SSH 270 Server: Encrypted packet (len=204)
  526 22.086447383  10.6.15.144 → 192.168.1.16 SSH 142 Server: Encrypted packet (len=76)
  527 22.086516807 192.168.1.16 → 10.6.15.144  TCP 66 58518 → 22 [ACK] Seq=11625 Ack=186361 Win=2263 Len=0 TSval=7679474 TSecr=7129755
  528 22.172301660  10.6.15.144 → 192.168.1.16 SSH 338 Server: Encrypted packet (len=272)
  529 22.173167848 192.168.1.16 → 10.6.15.144  SSH 134 Client: Encrypted packet (len=68)
  530 22.193935343 192.168.1.16 → 10.6.15.144  SSH 102 Client: Encrypted packet (len=36)
  531 22.197771511  10.6.15.144 → 192.168.1.16 TCP 66 22 → 58518 [ACK] Seq=186633 Ack=11729 Win=1452 Len=0 TSval=7129788 TSecr=7679495
  532 23.678021677 192.168.1.16 → 118.214.110.12 TCP 66 54048 → 443 [ACK] Seq=1 Ack=1 Win=387 Len=0 TSval=7679872 TSecr=332848730
  533 23.680315594  10.6.15.144 → 192.168.1.16 SSH 110 Server: Encrypted packet (len=44)
  534 23.680337337  10.6.15.144 → 192.168.1.16 SSH 102 Server: Encrypted packet (len=36)
  535 23.680342676  10.6.15.144 → 192.168.1.16 SSH 102 Server: Encrypted packet (len=36)
  536 23.680345694  10.6.15.144 → 192.168.1.16 SSH 102 Server: Encrypted packet (len=36)
  537 23.680358477  10.6.15.144 → 192.168.1.16 SSH 102 Server: Encrypted packet (len=36)
  538 23.680399908 192.168.1.16 → 10.6.15.144  TCP 66 58518 → 22 [ACK] Seq=11729 Ack=186821 Win=2263 Len=0 TSval=7679872 TSecr=7129843
  539 23.680736427 192.168.1.16 → 10.6.15.144  SSH 166 Client: Encrypted packet (len=100)
  540 23.681642501 192.168.1.16 → 10.6.15.144  SSH 614 Client: Encrypted packet (len=548)
  541 23.685260609  10.6.15.144 → 192.168.1.16 SSH 398 Server: Encrypted packet (len=332)
  542 23.685304874  10.6.15.144 → 192.168.1.16 TCP 586 [TCP Retransmission] 22 → 58518 [PSH, ACK] Seq=186633 Ack=11729 Win=1452 Len=520 TSval=7129959 TSecr=7679495
  543 23.685317561 192.168.1.16 → 10.6.15.144  TCP 78 58518 → 22 [ACK] Seq=12377 Ack=187153 Win=2263 Len=0 TSval=7679873 TSecr=7129959 SLE=186633 SRE=187153
  544 23.685327536  10.6.15.144 → 192.168.1.16 SSH 586 Server: [TCP Spurious Retransmission] , Encrypted packet (len=520)
  545 23.685330075 192.168.1.16 → 10.6.15.144  TCP 78 [TCP Dup ACK 543#1] 58518 → 22 [ACK] Seq=12377 Ack=187153 Win=2263 Len=0 TSval=7679873 TSecr=7130131 SLE=186633 SRE=187153
  546 23.685455887  10.6.15.144 → 192.168.1.16 TCP 66 22 → 58518 [ACK] Seq=187153 Ack=12377 Win=1452 Len=0 TSval=7130160 TSecr=7679872
  547 23.686621637 192.168.1.16 → 10.6.15.144  SSH 158 Client: Encrypted packet (len=92)
  548 23.687038407 192.168.1.16 → 10.6.15.144  SSH 182 Client: Encrypted packet (len=116)
  549 23.687120542  10.6.15.144 → 192.168.1.16 SSH 174 Server: Encrypted packet (len=108)
  550 23.687804322 192.168.1.16 → 10.6.15.144  SSH 158 Client: Encrypted packet (len=92)
  551 23.695298611  10.6.15.144 → 192.168.1.16 TCP 66 22 → 58518 [ACK] Seq=187261 Ack=12585 Win=1452 Len=0 TSval=7130161 TSecr=7679874
  552 23.728812641  10.6.15.144 → 192.168.1.16 TCP 66 22 → 58518 [ACK] Seq=187261 Ack=12677 Win=1452 Len=0 TSval=7130171 TSecr=7679874
  553 23.922407126 192.168.1.16 → 224.0.0.251  MDNS 82 Standard query 0x0000 PTR _googlecast._tcp.local, "QM" question
  554 23.923193291 fe80::820e:b87b:de2a:4286 → ff02::fb     MDNS 102 Standard query 0x0000 PTR _googlecast._tcp.local, "QM" question
  555 23.923199922 192.168.1.16 → 224.0.0.251  MDNS 82 Standard query 0x0000 PTR _googlecast._tcp.local, "QM" question
  556 23.923201832 fe80::820e:b87b:de2a:4286 → ff02::fb     MDNS 102 Standard query 0x0000 PTR _googlecast._tcp.local, "QM" question
  557 23.924527344 10.22.18.209 → 224.0.0.252  LLMNR 64 Standard query 0x5e6f A wpad
  558 23.939403067 10.22.18.209 → 224.0.0.252  LLMNR 64 Standard query 0x5e6f A wpad
  559 24.017140855  10.6.15.144 → 192.168.1.16 SSH 102 Server: Encrypted packet (len=36)
  560 24.053594563  10.6.15.144 → 192.168.1.16 SSH 1514 Server: Encrypted packet (len=1448)
  561 24.053610762 192.168.1.16 → 10.6.15.144  TCP 66 58518 → 22 [ACK] Seq=12677 Ack=188745 Win=2263 Len=0 TSval=7679965 TSecr=7130243
  562 24.056541006  10.6.15.144 → 192.168.1.16 SSH 1350 Server: Encrypted packet (len=1284)
  563 24.058035616 192.168.1.16 → 10.6.15.144  SSH 138 Client: Encrypted packet (len=72)
  564 24.058893374 192.168.1.16 → 10.6.15.144  SSH 138 Client: Encrypted packet (len=72)
  565 24.060020778  10.6.15.144 → 192.168.1.16 TCP 66 22 → 58518 [ACK] Seq=190029 Ack=12749 Win=1452 Len=0 TSval=7130253 TSecr=7679967
  566 24.060042395  10.6.15.144 → 192.168.1.16 SSH 102 Server: Encrypted packet (len=36)
  567 24.060198065  10.6.15.144 → 192.168.1.16 SSH 102 Server: Encrypted packet (len=36)
  568 24.060232415 192.168.1.16 → 10.6.15.144  TCP 66 58518 → 22 [ACK] Seq=12821 Ack=190101 Win=2263 Len=0 TSval=7679967 TSecr=7130253
  569 24.064161715  10.6.15.144 → 192.168.1.16 SSH 1514 Server: Encrypted packet (len=1448)
  570 24.064288726  10.6.15.144 → 192.168.1.16 SSH 1070 Server: Encrypted packet (len=1004)
  571 24.064300421 192.168.1.16 → 10.6.15.144  TCP 66 58518 → 22 [ACK] Seq=12821 Ack=192553 Win=2263 Len=0 TSval=7679968 TSecr=7130254
  572 24.064496373  10.6.15.144 → 192.168.1.16 SSH 510 Server: Encrypted packet (len=444)
  573 24.065271167 192.168.1.16 → 10.6.15.144  SSH 222 Client: Encrypted packet (len=156)
  574 24.065910653 192.168.1.16 → 10.6.15.144  SSH 206 Client: Encrypted packet (len=140)
  575 24.067413119  10.6.15.144 → 192.168.1.16 TCP 66 22 → 58518 [ACK] Seq=192997 Ack=13117 Win=1452 Len=0 TSval=7130255 TSecr=7679968
  576 24.071885638  10.6.15.144 → 192.168.1.16 SSH 214 Server: Encrypted packet (len=148)
  577 24.080196667  10.6.15.144 → 192.168.1.16 SSH 190 Server: Encrypted packet (len=124)
  578 24.080221259  10.6.15.144 → 192.168.1.16 SSH 182 Server: Encrypted packet (len=116)
  579 24.080294729 192.168.1.16 → 10.6.15.144  TCP 66 58518 → 22 [ACK] Seq=13117 Ack=193385 Win=2263 Len=0 TSval=7679972 TSecr=7130256
  580 24.097287529 192.168.1.16 → 10.6.15.144  SSH 138 Client: Encrypted packet (len=72)
  581 24.097483279 192.168.1.16 → 10.6.15.144  SSH 326 Client: Encrypted packet (len=260)
  582 24.098700956  10.6.15.144 → 192.168.1.16 SSH 102 Server: Encrypted packet (len=36)
  583 24.099120092  10.6.15.144 → 192.168.1.16 SSH 138 Server: Encrypted packet (len=72)
  584 24.099140923 192.168.1.16 → 10.6.15.144  TCP 66 58518 → 22 [ACK] Seq=13449 Ack=193493 Win=2263 Len=0 TSval=7679977 TSecr=7130263
  585 24.190009441 192.168.1.16 → 216.58.196.99 TCP 66 53666 → 443 [ACK] Seq=1 Ack=1 Win=317 Len=0 TSval=7680000 TSecr=537837958
  586 24.192591268 216.58.196.99 → 192.168.1.16 TCP 66 [TCP ACKed unseen segment] 443 → 53666 [ACK] Seq=1 Ack=2 Win=170 Len=0 TSval=537929142 TSecr=7657215
  587 24.994074121 10.22.19.225 → 224.0.0.252  LLMNR 68 Standard query 0x948f A qrspaexi
  588 24.994203950 10.22.19.225 → 224.0.0.252  LLMNR 72 Standard query 0x7f14 A fdumpvqggkca
  589 24.994344995 10.22.19.225 → 224.0.0.252  LLMNR 67 Standard query 0x26a5 A fervifc
  590 24.994523622  10.6.15.144 → 192.168.1.16 SSH 366 Server: Encrypted packet (len=300)
  591 24.994642355  10.6.15.144 → 192.168.1.16 SSH 182 Server: Encrypted packet (len=116)
  592 24.994667031 192.168.1.16 → 10.6.15.144  TCP 66 58518 → 22 [ACK] Seq=13449 Ack=193909 Win=2263 Len=0 TSval=7680201 TSecr=7130348
  593 24.994794913  10.6.15.144 → 192.168.1.16 SSH 182 Server: [TCP Spurious Retransmission] , Encrypted packet (len=116)
  594 24.994802330 192.168.1.16 → 10.6.15.144  TCP 78 [TCP Dup ACK 592#1] 58518 → 22 [ACK] Seq=13449 Ack=193909 Win=2263 Len=0 TSval=7680201 TSecr=7130389 SLE=193793 SRE=193909
  595 24.994929401 10.22.19.225 → 224.0.0.252  LLMNR 68 Standard query 0x948f A qrspaexi
  596 24.995066379 10.22.19.225 → 224.0.0.252  LLMNR 72 Standard query 0x7f14 A fdumpvqggkca
  597 24.995204942 10.22.19.225 → 224.0.0.252  LLMNR 67 Standard query 0x26a5 A fervifc
  598 24.996123011 192.168.1.16 → 10.6.15.144  SSH 1350 Client: Encrypted packet (len=1284)
  599 25.014452136 192.168.1.16 → 10.6.15.144  SSH 166 Client: Encrypted packet (len=100)
  600 25.016177742  10.6.15.144 → 192.168.1.16 TCP 66 22 → 58518 [ACK] Seq=193909 Ack=14833 Win=1452 Len=0 TSval=7130493 TSecr=7680201
  601 25.019086938 192.168.1.16 → 10.6.15.144  SSH 118 Client: Encrypted packet (len=52)
  602 25.062626524  10.6.15.144 → 192.168.1.16 TCP 66 22 → 58518 [ACK] Seq=193909 Ack=14885 Win=1452 Len=0 TSval=7130504 TSecr=7680207
  603 25.983929158  10.6.15.144 → 192.168.1.16 SSH 334 Server: Encrypted packet (len=268)
  604 25.983957053  10.6.15.144 → 192.168.1.16 SSH 110 Server: Encrypted packet (len=44)
  605 25.983994857  10.6.15.144 → 192.168.1.16 SSH 814 Server: Encrypted packet (len=748)
  606 25.984041769 192.168.1.16 → 10.6.15.144  TCP 66 58518 → 22 [ACK] Seq=14885 Ack=194969 Win=2263 Len=0 TSval=7680448 TSecr=7130536
  607 25.984144977  10.6.15.144 → 192.168.1.16 SSH 102 Server: Encrypted packet (len=36)
  608 25.984171368  10.6.15.144 → 192.168.1.16 SSH 190 Server: Encrypted packet (len=124)
  609 25.984194880 192.168.1.16 → 10.6.15.144  TCP 66 58518 → 22 [ACK] Seq=14885 Ack=195129 Win=2263 Len=0 TSval=7680448 TSecr=7130581
  610 25.986070404 192.168.1.16 → 10.6.15.144  SSH 174 Client: Encrypted packet (len=108)
  611 25.986333329 192.168.1.16 → 10.6.15.144  SSH 1382 Client: Encrypted packet (len=1316)
  612 25.987511497  10.6.15.144 → 192.168.1.16 TCP 66 22 → 58518 [ACK] Seq=195129 Ack=14993 Win=1452 Len=0 TSval=7130735 TSecr=7680449
  613 25.988642322 192.168.1.16 → 10.6.15.144  SSH 138 Client: Encrypted packet (len=72)
  614 25.988933502  10.6.15.144 → 192.168.1.16 TCP 66 22 → 58518 [ACK] Seq=195129 Ack=16309 Win=1452 Len=0 TSval=7130736 TSecr=7680449
  615 25.989937871  10.6.15.144 → 192.168.1.16 TCP 66 22 → 58518 [ACK] Seq=195129 Ack=16381 Win=1452 Len=0 TSval=7130736 TSecr=7680449
  616 25.989972015  10.6.15.144 → 192.168.1.16 SSH 102 Server: Encrypted packet (len=36)
  617 26.033975810 192.168.1.16 → 10.6.15.144  TCP 66 58518 → 22 [ACK] Seq=16381 Ack=195165 Win=2263 Len=0 TSval=7680461 TSecr=7130736
  618 26.282135369 192.168.1.16 → 10.6.15.144  SSH 102 Client: Encrypted packet (len=36)
  619 26.687738877  10.6.15.144 → 192.168.1.16 SSH 390 Server: Encrypted packet (len=324)
  620 26.687806839  10.6.15.144 → 192.168.1.16 SSH 870 Server: Encrypted packet (len=804)
  621 26.687826698  10.6.15.144 → 192.168.1.16 SSH 102 Server: Encrypted packet (len=36)
  622 26.728016749  10.6.15.144 → 192.168.1.16 TCP 66 22 → 58518 [ACK] Seq=196329 Ack=16417 Win=1452 Len=0 TSval=7130921 TSecr=7680509
  623 26.794111038 192.168.1.16 → 10.6.15.144  SSH 102 Client: [TCP Spurious Retransmission] , Encrypted packet (len=36)
  624 26.794127190 192.168.1.16 → 10.6.15.144  TCP 66 58518 → 22 [ACK] Seq=16417 Ack=195489 Win=2263 Len=0 TSval=7680624 TSecr=7130802
  625 26.794129180 192.168.1.16 → 10.6.15.144  TCP 66 58518 → 22 [ACK] Seq=16417 Ack=196293 Win=2263 Len=0 TSval=7680624 TSecr=7130831
  626 26.794130993 192.168.1.16 → 10.6.15.144  TCP 66 58518 → 22 [ACK] Seq=16417 Ack=196329 Win=2263 Len=0 TSval=7680624 TSecr=7130831
  627 26.794132649 192.168.1.16 → 10.6.15.144  SSH 1034 Client: Encrypted packet (len=968)
  628 27.306031948  10.6.15.144 → 192.168.1.16 TCP 78 [TCP Previous segment not captured] 22 → 58518 [ACK] Seq=196373 Ack=16417 Win=1452 Len=0 TSval=7131039 TSecr=7680624 SLE=16381 SRE=16417
  629 27.306068539  10.6.15.144 → 192.168.1.16 TCP 66 22 → 58518 [ACK] Seq=196373 Ack=17385 Win=1452 Len=0 TSval=7131039 TSecr=7680634
  630 27.306080537  10.6.15.144 → 192.168.1.16 SSH 102 Server: Encrypted packet (len=36)
  631 27.306175357 192.168.1.16 → 10.6.15.144  SSH 102 Client: Encrypted packet (len=36)
  632 27.306195936 192.168.1.16 → 10.6.15.144  TCP 78 [TCP Dup ACK 626#1] 58518 → 22 [ACK] Seq=17421 Ack=196329 Win=2263 Len=0 TSval=7680779 TSecr=7130921 SLE=196373 SRE=196409
  633 27.818023127  10.6.15.144 → 192.168.1.16 SSH 102 Server: [TCP Previous segment not captured] , Encrypted packet (len=36)
  634 27.818141303 192.168.1.16 → 10.6.15.144  SSH 114 Client: [TCP Spurious Retransmission] , Encrypted packet (len=36)
  635 27.818153222 192.168.1.16 → 10.6.15.144  TCP 86 [TCP Dup ACK 626#2] 58518 → 22 [ACK] Seq=17421 Ack=196329 Win=2263 Len=0 TSval=7680907 TSecr=7130921 SLE=196577 SRE=196613 SLE=196373 SRE=196409
  636 27.886627176 192.168.1.16 → 91.189.91.157 NTP 90 NTP Version 4, client
  637 28.425809059  10.6.15.144 → 192.168.1.16 TCP 78 [TCP Dup ACK 633#1] 22 → 58518 [ACK] Seq=196613 Ack=17421 Win=1452 Len=0 TSval=7131345 TSecr=7680888 SLE=17385 SRE=17421
  638 28.425841686  10.6.15.144 → 192.168.1.16 TCP 110 [TCP Retransmission] 22 → 58518 [PSH, ACK] Seq=196329 Ack=17421 Win=1452 Len=44 TSval=7131345 TSecr=7680907
  639 28.530112879 192.168.1.16 → 151.101.8.133 TCP 66 51412 → 443 [ACK] Seq=1 Ack=1 Win=455 Len=0 TSval=7681024 TSecr=324763402
  640 28.530129086 192.168.1.16 → 10.6.15.144  TCP 78 58518 → 22 [ACK] Seq=17421 Ack=196409 Win=2263 Len=0 TSval=7681058 TSecr=7131345 SLE=196577 SRE=196613
  641 29.042066195 192.168.1.16 → 10.6.15.144  SSH 282 Client: Encrypted packet (len=204)
  642 29.554014975  10.6.15.144 → 192.168.1.16 TCP 66 22 → 58518 [ACK] Seq=196613 Ack=17625 Win=1452 Len=0 TSval=7131601 TSecr=7681170
  643 29.554109676 192.168.1.16 → 10.6.15.144  SSH 1270 Client: Encrypted packet (len=1192)
  644 30.066040123  10.6.15.144 → 192.168.1.16 TCP 66 22 → 58518 [ACK] Seq=196613 Ack=18817 Win=1452 Len=0 TSval=7131729 TSecr=7681296
  645 30.362138696 192.168.1.16 → 104.24.28.86 TCP 54 46600 → 443 [ACK] Seq=1 Ack=1 Win=453 Len=0
  646 31.199606782 192.168.1.16 → 10.6.15.144  SSH 218 Client: Encrypted packet (len=140)
  647 31.682017432  10.6.15.144 → 192.168.1.16 TCP 66 22 → 58518 [ACK] Seq=196613 Ack=18957 Win=1452 Len=0 TSval=7132132 TSecr=7681752
  648 32.406790084 192.168.1.16 → 151.101.9.140 TCP 66 36298 → 443 [ACK] Seq=1 Ack=1 Win=364 Len=0 TSval=7682048 TSecr=2547927161
  649 32.886629917 192.168.1.16 → 123.108.200.124 NTP 90 NTP Version 4, client
  650 32.994038412 151.101.9.140 → 192.168.1.16 TCP 66 [TCP ACKed unseen segment] 443 → 36298 [ACK] Seq=1 Ack=2 Win=61 Len=0 TSval=2547938776 TSecr=7543632
  651 36.433268144 ZioncomE_53:dd:d6 → HonHaiPr_1f:71:b9 EAPOL 135 Key (Message 1 of 4)
  652 36.433607774 HonHaiPr_1f:71:b9 → ZioncomE_53:dd:d6 EAPOL 135 Key (Message 2 of 4)
  653 36.438575184 ZioncomE_53:dd:d6 → HonHaiPr_1f:71:b9 EAPOL 169 Key (Message 3 of 4)
  654 36.438675787 HonHaiPr_1f:71:b9 → ZioncomE_53:dd:d6 EAPOL 113 Key (Message 4 of 4)
  655 36.449987727 fe80::820e:b87b:de2a:4286 → ff02::16     ICMPv6 90 Multicast Listener Report Message v2
  656 36.450030207 192.168.1.16 → 224.0.0.252  IGMPv2 46 Membership Report group 224.0.0.252
  657 36.514198723  192.168.1.1 → 192.168.1.255 IAPP 58 Announce Request(0) (version=0)[Malformed Packet]
  658 36.514514645  192.168.1.1 → 224.0.1.178  UDP 58 3517 → 3517 Len=16
  659 36.533488249 192.168.1.16 → 224.0.0.252  LLMNR 73 Standard query 0x0e32 ANY theenterprise
  660 36.533545475 fe80::820e:b87b:de2a:4286 → ff02::1:3    LLMNR 93 Standard query 0x44c1 ANY theenterprise
  661 36.783565110 192.168.1.16 → 224.0.0.252  LLMNR 73 Standard query 0x0e32 ANY theenterprise
  662 36.784414300 fe80::820e:b87b:de2a:4286 → ff02::1:3    LLMNR 93 Standard query 0x44c1 ANY theenterprise
  663 36.990060658 192.168.1.16 → 224.0.0.252  IGMPv2 46 Membership Report group 224.0.0.252
  664 37.033480586 192.168.1.16 → 224.0.0.252  LLMNR 73 Standard query 0x0e32 ANY theenterprise
  665 37.033535868 fe80::820e:b87b:de2a:4286 → ff02::1:3    LLMNR 93 Standard query 0x44c1 ANY theenterprise
  666 37.118027255 fe80::820e:b87b:de2a:4286 → ff02::16     ICMPv6 90 Multicast Listener Report Message v2
  667 37.278028289 192.168.1.16 → 10.6.15.144  SSH 150 Client: Encrypted packet (len=72)
  668 37.790046808 192.168.1.16 → 224.0.0.252  IGMPv2 46 Membership Report group 224.0.0.252
  669 37.940334432 192.168.1.16 → 239.255.255.250 SSDP 213 M-SEARCH * HTTP/1.1 
  670 38.941344856 192.168.1.16 → 239.255.255.250 SSDP 213 M-SEARCH * HTTP/1.1 
