    1 0.000000000 ZioncomE_53:dd:d6 → HonHaiPr_1f:71:b9 EAPOL 135 Key (Message 1 of 4)
    2 0.000152548 HonHaiPr_1f:71:b9 → ZioncomE_53:dd:d6 EAPOL 135 Key (Message 2 of 4)
    3 0.005215724 ZioncomE_53:dd:d6 → HonHaiPr_1f:71:b9 EAPOL 169 Key (Message 3 of 4)
    4 0.005301675 HonHaiPr_1f:71:b9 → ZioncomE_53:dd:d6 EAPOL 113 Key (Message 4 of 4)
    5 0.014051909 fe80::820e:b87b:de2a:4286 → ff02::16     ICMPv6 90 Multicast Listener Report Message v2
    6 0.014081891 192.168.1.16 → 224.0.0.252  IGMPv2 46 Membership Report group 224.0.0.252
    7 0.018553644  192.168.1.1 → 192.168.1.255 IAPP 58 Announce Request(0) (version=0)[Malformed Packet]
    8 0.018826196  192.168.1.1 → 224.0.1.178  UDP 58 3517 → 3517 Len=16
    9 0.037563620 192.168.1.16 → 224.0.0.252  LLMNR 73 Standard query 0x4e91 ANY theenterprise
   10 0.110065840 192.168.1.16 → 10.6.15.144  SSH 246 Client: Encrypted packet (len=180)
   11 0.120597443  10.6.15.144 → 192.168.1.16 TCP 66 22 → 58518 [ACK] Seq=1 Ack=181 Win=1452 Len=0 TSval=7165391 TSecr=7715104
   12 0.120622663 192.168.1.16 → 10.6.15.144  SSH 138 Client: Encrypted packet (len=72)
   13 0.122122426  10.6.15.144 → 192.168.1.16 TCP 66 22 → 58518 [ACK] Seq=1 Ack=253 Win=1452 Len=0 TSval=7165393 TSecr=7715106
   14 0.156868682  10.6.15.144 → 192.168.1.16 SSH 102 Server: Encrypted packet (len=36)
   15 0.157169632 192.168.1.16 → 10.6.15.144  SSH 158 Client: Encrypted packet (len=92)
   16 0.174590902 fe80::820e:b87b:de2a:4286 → ff02::1:3    LLMNR 93 Standard query 0xbf94 ANY theenterprise
   17 0.174636839 192.168.1.16 → 224.0.0.252  LLMNR 73 Standard query 0x4e91 ANY theenterprise
   18 0.192683817  10.6.15.144 → 192.168.1.16 SSH 174 Server: Encrypted packet (len=108)
   19 0.193167481 192.168.1.16 → 10.6.15.144  SSH 294 Client: Encrypted packet (len=228)
   20 0.198595672 192.168.1.16 → 10.6.15.144  SSH 318 Client: Encrypted packet (len=252)
   21 0.200470878  10.6.15.144 → 192.168.1.16 TCP 66 22 → 58518 [ACK] Seq=145 Ack=825 Win=1452 Len=0 TSval=7165413 TSecr=7715124
   22 0.234108518  10.6.15.144 → 192.168.1.16 SSH 118 Server: Encrypted packet (len=52)
   23 0.237769954  10.6.15.144 → 192.168.1.16 SSH 214 Server: Encrypted packet (len=148)
   24 0.237796093 192.168.1.16 → 10.6.15.144  TCP 66 58518 → 22 [ACK] Seq=825 Ack=345 Win=2263 Len=0 TSval=7715135 TSecr=7165421
   25 0.238427401  10.6.15.144 → 192.168.1.16 SSH 230 Server: Encrypted packet (len=164)
   26 0.282060217 192.168.1.16 → 10.6.15.144  TCP 66 58518 → 22 [ACK] Seq=825 Ack=509 Win=2263 Len=0 TSval=7715147 TSecr=7165422
   27 0.287520947 fe80::820e:b87b:de2a:4286 → ff02::1:3    LLMNR 93 Standard query 0xbf94 ANY theenterprise
   28 0.287582128 192.168.1.16 → 224.0.0.252  LLMNR 73 Standard query 0x4e91 ANY theenterprise
   29 0.326497547  10.6.15.144 → 192.168.1.16 SSH 138 Server: Encrypted packet (len=72)
   30 0.326522530 192.168.1.16 → 10.6.15.144  TCP 66 58518 → 22 [ACK] Seq=825 Ack=581 Win=2263 Len=0 TSval=7715158 TSecr=7165445
   31 0.326676070 192.168.1.16 → 10.6.15.144  SSH 102 Client: Encrypted packet (len=36)
   32 0.328478115  10.6.15.144 → 192.168.1.16 SSH 102 Server: Encrypted packet (len=36)
   33 0.329404300  10.6.15.144 → 192.168.1.16 SSH 102 Server: Encrypted packet (len=36)
   34 0.329465701 192.168.1.16 → 10.6.15.144  TCP 66 58518 → 22 [ACK] Seq=861 Ack=653 Win=2263 Len=0 TSval=7715158 TSecr=7165445
   35 0.330335406  10.6.15.144 → 192.168.1.16 SSH 110 Server: Encrypted packet (len=44)
   36 0.364427867  10.6.15.144 → 192.168.1.16 SSH 138 Server: Encrypted packet (len=72)
   37 0.364447637 192.168.1.16 → 10.6.15.144  TCP 66 58518 → 22 [ACK] Seq=861 Ack=769 Win=2263 Len=0 TSval=7715167 TSecr=7165446
   38 0.364598758 192.168.1.16 → 10.6.15.144  SSH 102 Client: Encrypted packet (len=36)
   39 0.389192470  10.6.15.144 → 192.168.1.16 SSH 138 Server: Encrypted packet (len=72)
   40 0.389346260 192.168.1.16 → 10.6.15.144  SSH 102 Client: Encrypted packet (len=36)
   41 0.390653872 192.168.1.16 → 52.66.5.185  NTP 90 NTP Version 4, client
   42 0.446428445  10.6.15.144 → 192.168.1.16 TCP 66 22 → 58518 [ACK] Seq=841 Ack=933 Win=1452 Len=0 TSval=7165475 TSecr=7715173
   43 0.530901613 192.168.1.16 → 10.6.15.144  SSH 102 Client: Encrypted packet (len=36)
   44 0.532574862  10.6.15.144 → 192.168.1.16 TCP 66 22 → 58518 [ACK] Seq=841 Ack=969 Win=1452 Len=0 TSval=7165496 TSecr=7715209
   45 0.537514300 fe80::820e:b87b:de2a:4286 → ff02::1:3    LLMNR 93 Standard query 0xbf94 ANY theenterprise
   46 0.568347003 10.22.18.209 → 224.0.0.252  LLMNR 64 Standard query 0x09e9 A wpad
   47 0.667916078 10.22.18.209 → 224.0.0.252  LLMNR 64 Standard query 0x09e9 A wpad
   48 0.750598036  10.6.15.144 → 192.168.1.16 SSH 110 Server: Encrypted packet (len=44)
   49 0.794097566 192.168.1.16 → 10.6.15.144  TCP 66 58518 → 22 [ACK] Seq=969 Ack=885 Win=2263 Len=0 TSval=7715275 TSecr=7165550
   50 0.846104588 fe80::820e:b87b:de2a:4286 → ff02::16     ICMPv6 90 Multicast Listener Report Message v2
   51 1.006074834 192.168.1.16 → 104.24.28.86 TCP 54 46600 → 443 [ACK] Seq=1 Ack=1 Win=453 Len=0
   52 1.506256900 192.168.1.16 → 10.6.15.144  SSH 102 Client: Encrypted packet (len=36)
   53 1.507313722 192.168.1.16 → 239.255.255.250 SSDP 213 M-SEARCH * HTTP/1.1 
   54 1.511391010 192.168.1.16 → 10.6.15.144  SSH 226 Client: Encrypted packet (len=160)
   55 1.554072097 192.168.1.16 → 10.6.15.144  TCP 226 [TCP Retransmission] 58518 → 22 [PSH, ACK] Seq=1005 Ack=885 Win=2263 Len=160 TSval=7715465 TSecr=7165550
   56 1.641446582  10.6.15.144 → 192.168.1.16 TCP 78 [TCP Dup ACK 44#1] 22 → 58518 [ACK] Seq=885 Ack=969 Win=1452 Len=0 TSval=7165773 TSecr=7715275 SLE=1005 SRE=1165
   57 1.778067849 192.168.1.16 → 10.6.15.144  TCP 102 [TCP Retransmission] 58518 → 22 [PSH, ACK] Seq=969 Ack=885 Win=2263 Len=36 TSval=7715521 TSecr=7165773
   58 2.222127534 192.168.1.16 → 10.6.15.144  TCP 102 [TCP Retransmission] 58518 → 22 [PSH, ACK] Seq=969 Ack=885 Win=2263 Len=36 TSval=7715632 TSecr=7165773
   59 2.224421966  10.6.15.144 → 192.168.1.16 TCP 66 22 → 58518 [ACK] Seq=885 Ack=1165 Win=1452 Len=0 TSval=7165919 TSecr=7715632
   60 2.224457758 192.168.1.16 → 10.6.15.144  SSH 802 Client: Encrypted packet (len=736)
   61 2.228745524  10.6.15.144 → 192.168.1.16 TCP 66 22 → 58518 [ACK] Seq=885 Ack=1901 Win=1452 Len=0 TSval=7165920 TSecr=7715632
   62 2.228865233  10.6.15.144 → 192.168.1.16 SSH 134 Server: Encrypted packet (len=68)
   63 2.228885257 192.168.1.16 → 10.6.15.144  TCP 66 58518 → 22 [ACK] Seq=1901 Ack=953 Win=2263 Len=0 TSval=7715633 TSecr=7165920
   64 2.259953898  10.6.15.144 → 192.168.1.16 SSH 102 Server: Encrypted packet (len=36)
   65 2.259976006 192.168.1.16 → 10.6.15.144  TCP 66 58518 → 22 [ACK] Seq=1901 Ack=989 Win=2263 Len=0 TSval=7715641 TSecr=7165928
   66 2.260323808 192.168.1.16 → 10.6.15.144  SSH 150 Client: Encrypted packet (len=84)
   67 2.268305134  10.6.15.144 → 192.168.1.16 SSH 414 Server: Encrypted packet (len=348)
   68 2.270695656  10.6.15.144 → 192.168.1.16 SSH 134 Server: Encrypted packet (len=68)
   69 2.270757451 192.168.1.16 → 10.6.15.144  TCP 66 58518 → 22 [ACK] Seq=1985 Ack=1405 Win=2263 Len=0 TSval=7715644 TSecr=7165930
   70 2.270954495 192.168.1.16 → 10.6.15.144  SSH 134 Client: Encrypted packet (len=68)
   71 2.295927489  10.6.15.144 → 192.168.1.16 SSH 166 Server: Encrypted packet (len=100)
   72 2.296404611 192.168.1.16 → 10.6.15.144  SSH 294 Client: Encrypted packet (len=228)
   73 2.297227713 192.168.1.16 → 10.6.15.144  SSH 310 Client: Encrypted packet (len=244)
   74 2.298912287  10.6.15.144 → 192.168.1.16 TCP 66 22 → 58518 [ACK] Seq=1505 Ack=2525 Win=1452 Len=0 TSval=7165938 TSecr=7715650
   75 2.315137940  10.6.15.144 → 192.168.1.16 SSH 230 Server: Encrypted packet (len=164)
   76 2.315671252 192.168.1.16 → 10.6.15.144  SSH 134 Client: Encrypted packet (len=68)
   77 2.333071639  10.6.15.144 → 192.168.1.16 SSH 118 Server: Encrypted packet (len=52)
   78 2.335298279  10.6.15.144 → 192.168.1.16 SSH 214 Server: Encrypted packet (len=148)
   79 2.335362880 192.168.1.16 → 10.6.15.144  TCP 66 58518 → 22 [ACK] Seq=2593 Ack=1869 Win=2263 Len=0 TSval=7715660 TSecr=7165946
   80 2.337411098  10.6.15.144 → 192.168.1.16 SSH 230 Server: Encrypted packet (len=164)
   81 2.378099566 192.168.1.16 → 10.6.15.144  TCP 66 58518 → 22 [ACK] Seq=2593 Ack=2033 Win=2263 Len=0 TSval=7715671 TSecr=7165947
   82 2.508223986 192.168.1.16 → 239.255.255.250 SSDP 213 M-SEARCH * HTTP/1.1 
   83 2.510198560  10.6.15.144 → 192.168.1.16 SSH 138 Server: Encrypted packet (len=72)
   84 2.510223282 192.168.1.16 → 10.6.15.144  TCP 66 58518 → 22 [ACK] Seq=2593 Ack=2105 Win=2263 Len=0 TSval=7715704 TSecr=7165986
   85 2.510378786 192.168.1.16 → 10.6.15.144  SSH 102 Client: Encrypted packet (len=36)
   86 2.550625348  10.6.15.144 → 192.168.1.16 TCP 66 22 → 58518 [ACK] Seq=2105 Ack=2629 Win=1452 Len=0 TSval=7166001 TSecr=7715704
   87 3.517499221 192.168.1.16 → 239.255.255.250 SSDP 213 M-SEARCH * HTTP/1.1 
   88 4.507611497 192.168.1.16 → 224.0.0.251  MDNS 82 Standard query 0x0000 PTR _googlecast._tcp.local, "QM" question
   89 4.507679080 fe80::820e:b87b:de2a:4286 → ff02::fb     MDNS 102 Standard query 0x0000 PTR _googlecast._tcp.local, "QM" question
   90 4.507743309 192.168.1.16 → 224.0.0.251  MDNS 82 Standard query 0x0000 PTR _googlecast._tcp.local, "QM" question
   91 4.507768257 fe80::820e:b87b:de2a:4286 → ff02::fb     MDNS 102 Standard query 0x0000 PTR _googlecast._tcp.local, "QM" question
   92 4.518170110 192.168.1.16 → 239.255.255.250 SSDP 213 M-SEARCH * HTTP/1.1 
   93 5.508871500 192.168.1.16 → 224.0.0.251  MDNS 82 Standard query 0x0000 PTR _googlecast._tcp.local, "QM" question
   94 5.509696909 fe80::820e:b87b:de2a:4286 → ff02::fb     MDNS 102 Standard query 0x0000 PTR _googlecast._tcp.local, "QM" question
   95 5.509709727 192.168.1.16 → 224.0.0.251  MDNS 82 Standard query 0x0000 PTR _googlecast._tcp.local, "QM" question
   96 5.509714097 fe80::820e:b87b:de2a:4286 → ff02::fb     MDNS 102 Standard query 0x0000 PTR _googlecast._tcp.local, "QM" question
   97 6.390757365 192.168.1.16 → 123.108.200.124 NTP 90 NTP Version 4, client
   98 6.638101576 192.168.1.16 → 224.0.0.252  IGMPv2 46 Membership Report group 224.0.0.252
   99 7.510081410 192.168.1.16 → 224.0.0.251  MDNS 82 Standard query 0x0000 PTR _googlecast._tcp.local, "QM" question
  100 7.510242152 fe80::820e:b87b:de2a:4286 → ff02::fb     MDNS 102 Standard query 0x0000 PTR _googlecast._tcp.local, "QM" question
  101 7.510409129 192.168.1.16 → 224.0.0.251  MDNS 82 Standard query 0x0000 PTR _googlecast._tcp.local, "QM" question
  102 7.510472837 fe80::820e:b87b:de2a:4286 → ff02::fb     MDNS 102 Standard query 0x0000 PTR _googlecast._tcp.local, "QM" question
  103 7.758098045 192.168.1.16 → 224.0.0.252  IGMPv2 46 Membership Report group 224.0.0.252
  104 9.490887280 10.22.18.209 → 224.0.0.252  LLMNR 64 Standard query 0xe340 A wpad
  105 9.491282733 216.58.196.99 → 192.168.1.16 TLSv1.2 129 Application Data
  106 9.491315681 192.168.1.16 → 216.58.196.99 TCP 66 53666 → 443 [ACK] Seq=1 Ack=64 Win=317 Len=0 TSval=7717449 TSecr=538077958
  107 9.491429481 192.168.1.16 → 216.58.196.99 TCP 66 53666 → 443 [FIN, ACK] Seq=1 Ack=64 Win=317 Len=0 TSval=7717449 TSecr=538077958
  108 9.491774088 216.58.196.99 → 192.168.1.16 TCP 66 443 → 53666 [FIN, ACK] Seq=64 Ack=1 Win=170 Len=0 TSval=538077958 TSecr=7657215
  109 9.491791433 192.168.1.16 → 216.58.196.99 TCP 66 53666 → 443 [ACK] Seq=2 Ack=65 Win=317 Len=0 TSval=7717449 TSecr=538077958
  110 9.492178702 10.22.18.209 → 224.0.0.252  LLMNR 64 Standard query 0xe340 A wpad
  111 9.492550829 216.58.196.99 → 192.168.1.16 TCP 66 [TCP Out-Of-Order] 443 → 53666 [FIN, ACK] Seq=64 Ack=1 Win=170 Len=0 TSval=538078078 TSecr=7657215
  112 9.492572296 192.168.1.16 → 216.58.196.99 TCP 78 [TCP Dup ACK 109#1] 53666 → 443 [ACK] Seq=2 Ack=65 Win=317 Len=0 TSval=7717449 TSecr=538078078 SLE=64 SRE=65
  113 9.492912697 216.58.196.99 → 192.168.1.16 TCP 129 [TCP Out-Of-Order] 443 → 53666 [PSH, ACK] Seq=1 Ack=1 Win=170 Len=63 TSval=538078799 TSecr=7657215
  114 9.492924004 192.168.1.16 → 216.58.196.99 TCP 78 [TCP Dup ACK 109#2] 53666 → 443 [ACK] Seq=2 Ack=65 Win=317 Len=0 TSval=7717449 TSecr=538078078 SLE=1 SRE=64
  115 9.495110363 216.58.196.99 → 192.168.1.16 TCP 66 443 → 53666 [ACK] Seq=65 Ack=2 Win=170 Len=0 TSval=538078940 TSecr=7717449
  116 10.480013344 10.22.17.101 → 224.0.0.252  LLMNR 64 Standard query 0x40a1 A wpad
  117 10.480560886 10.22.17.101 → 224.0.0.252  LLMNR 64 Standard query 0x40a1 A wpad
  118 11.246115550 192.168.1.16 → 151.101.8.133 TCP 66 51412 → 443 [ACK] Seq=1 Ack=1 Win=455 Len=0 TSval=7717888 TSecr=324799834
  119 11.339587795 192.168.1.16 → 10.6.15.144  SSH 222 Client: Encrypted packet (len=156)
  120 11.342291276 192.168.1.16 → 10.6.15.144  SSH 1094 Client: Encrypted packet (len=1028)
  121 11.372193279  10.6.15.144 → 192.168.1.16 TCP 78 [TCP Dup ACK 86#1] 22 → 58518 [ACK] Seq=2105 Ack=2629 Win=1452 Len=0 TSval=7168206 TSecr=7715704 SLE=2785 SRE=3813
  122 11.562100910 192.168.1.16 → 10.6.15.144  TCP 222 [TCP Retransmission] 58518 → 22 [PSH, ACK] Seq=2629 Ack=2105 Win=2263 Len=156 TSval=7717967 TSecr=7168206
  123 11.566136650  10.6.15.144 → 192.168.1.16 TCP 66 22 → 58518 [ACK] Seq=2105 Ack=3813 Win=1451 Len=0 TSval=7168254 TSecr=7717967
  124 11.652293656  10.6.15.144 → 192.168.1.16 SSH 246 Server: Encrypted packet (len=180)
  125 11.655605659  10.6.15.144 → 192.168.1.16 SSH 1510 Server: Encrypted packet (len=1444)
  126 11.655621629 192.168.1.16 → 10.6.15.144  TCP 66 58518 → 22 [ACK] Seq=3813 Ack=3729 Win=2263 Len=0 TSval=7717990 TSecr=7168276
  127 11.656080860 192.168.1.16 → 10.6.15.144  SSH 134 Client: Encrypted packet (len=68)
  128 11.657306671 192.168.1.16 → 10.6.15.144  SSH 222 Client: Encrypted packet (len=156)
  129 11.658455932  10.6.15.144 → 192.168.1.16 TCP 66 22 → 58518 [ACK] Seq=3729 Ack=3881 Win=1452 Len=0 TSval=7168277 TSecr=7717990
  130 11.658466019 192.168.1.16 → 10.6.15.144  SSH 1382 Client: Encrypted packet (len=1316)
  131 11.659574026  10.6.15.144 → 192.168.1.16 TCP 66 22 → 58518 [ACK] Seq=3729 Ack=4037 Win=1452 Len=0 TSval=7168278 TSecr=7717990
  132 11.661525726  10.6.15.144 → 192.168.1.16 TCP 66 22 → 58518 [ACK] Seq=3729 Ack=5353 Win=1452 Len=0 TSval=7168278 TSecr=7717991
  133 12.496173386  10.6.15.144 → 192.168.1.16 SSH 158 Server: Encrypted packet (len=92)
  134 12.496344327  10.6.15.144 → 192.168.1.16 SSH 814 Server: Encrypted packet (len=748)
  135 12.496441572 192.168.1.16 → 10.6.15.144  TCP 66 58518 → 22 [ACK] Seq=5353 Ack=4569 Win=2263 Len=0 TSval=7718200 TSecr=7168307
  136 12.496542642  10.6.15.144 → 192.168.1.16 SSH 598 Server: Encrypted packet (len=532)
  137 12.496779070  10.6.15.144 → 192.168.1.16 TCP 598 [TCP Retransmission] 22 → 58518 [PSH, ACK] Seq=4569 Ack=5353 Win=1452 Len=532 TSval=7168320 TSecr=7717991
  138 12.496803942 192.168.1.16 → 10.6.15.144  TCP 78 58518 → 22 [ACK] Seq=5353 Ack=5101 Win=2263 Len=0 TSval=7718200 TSecr=7168320 SLE=4569 SRE=5101
  139 12.497105040  10.6.15.144 → 192.168.1.16 SSH 1438 Server: [TCP Spurious Retransmission] , Encrypted packet (len=1372)
  140 12.497129572 192.168.1.16 → 10.6.15.144  TCP 78 [TCP Dup ACK 138#1] 58518 → 22 [ACK] Seq=5353 Ack=5101 Win=2263 Len=0 TSval=7718200 TSecr=7168381 SLE=3729 SRE=5101
  141 12.497730760 192.168.1.16 → 10.6.15.144  SSH 134 Client: Encrypted packet (len=68)
  142 12.499750648  10.6.15.144 → 192.168.1.16 TCP 66 22 → 58518 [ACK] Seq=5101 Ack=5421 Win=1452 Len=0 TSval=7168488 TSecr=7718200
  143 16.495988169 10.22.18.209 → 224.0.0.252  LLMNR 64 Standard query 0x366b A wpad
  144 16.496372186 10.22.18.209 → 224.0.0.252  LLMNR 64 Standard query 0x366b A wpad
  145 18.544542949  10.22.17.98 → 224.0.0.252  LLMNR 64 Standard query 0x7d82 A wpad
  146 18.545015934  10.22.17.98 → 224.0.0.252  LLMNR 64 Standard query 0x7d82 A wpad
  147 24.496015953 10.22.18.209 → 224.0.0.252  LLMNR 64 Standard query 0x2bdc A wpad
  148 24.496396677 10.22.18.209 → 224.0.0.252  LLMNR 64 Standard query 0x2bdc A wpad
  149 29.678120137 192.168.1.16 → 52.16.201.221 TCP 128 52032 → 8282 [PSH, ACK] Seq=1 Ack=1 Win=296 Len=62 TSval=7722496 TSecr=589320240
  150 32.496860228 10.22.18.209 → 224.0.0.252  LLMNR 64 Standard query 0x5afd A wpad
  151 32.497234906 10.22.18.209 → 224.0.0.252  LLMNR 64 Standard query 0x5afd A wpad
  152 34.544181111  10.22.17.98 → 224.0.0.252  LLMNR 64 Standard query 0x3717 A wpad
  153 34.544564984  10.22.17.98 → 224.0.0.252  LLMNR 64 Standard query 0x3717 A wpad
