    1 0.000000000 192.168.1.12 → 10.6.15.156  SSH 134 Client: Encrypted packet (len=68)
    2 0.039837623  10.6.15.156 → 192.168.1.12 TCP 66 22 → 54766 [ACK] Seq=1 Ack=69 Win=1452 Len=0 TSval=15064432 TSecr=8132922
    3 0.192524306 192.168.1.12 → 239.255.255.250 SSDP 213 M-SEARCH * HTTP/1.1 
    4 0.199972752  10.6.15.156 → 192.168.1.12 SSH 374 Server: Encrypted packet (len=308)
    5 0.200777630  10.6.15.156 → 192.168.1.12 SSH 238 Server: Encrypted packet (len=172)
    6 0.200786335  10.6.15.156 → 192.168.1.12 SSH 102 Server: Encrypted packet (len=36)
    7 0.200817648 192.168.1.12 → 10.6.15.156  TCP 66 54766 → 22 [ACK] Seq=69 Ack=517 Win=6155 Len=0 TSval=8132972 TSecr=15064472
    8 0.202767813 192.168.1.12 → 10.6.15.156  SSH 138 Client: Encrypted packet (len=72)
    9 0.204507589  10.6.15.156 → 192.168.1.12 TCP 66 22 → 54766 [ACK] Seq=517 Ack=141 Win=1452 Len=0 TSval=15064473 TSecr=8132972
   10 0.204522853  10.6.15.156 → 192.168.1.12 SSH 102 Server: Encrypted packet (len=36)
   11 0.205065492 192.168.1.12 → 10.6.15.156  SSH 558 Client: Encrypted packet (len=492)
   12 0.244664257  10.6.15.156 → 192.168.1.12 TCP 66 22 → 54766 [ACK] Seq=553 Ack=633 Win=1452 Len=0 TSval=15064483 TSecr=8132973
   13 0.271319393  10.6.15.156 → 192.168.1.12 SSH 302 Server: Encrypted packet (len=236)
   14 0.311734754 192.168.1.12 → 10.6.15.156  TCP 66 54766 → 22 [ACK] Seq=633 Ack=789 Win=6155 Len=0 TSval=8133000 TSecr=15064489
   15 0.322878546  10.6.15.156 → 192.168.1.12 SSH 302 Server: Encrypted packet (len=236)
   16 0.322968569 192.168.1.12 → 10.6.15.156  TCP 66 54766 → 22 [ACK] Seq=633 Ack=1025 Win=6155 Len=0 TSval=8133002 TSecr=15064502
   17 0.405561305 192.168.1.12 → 139.59.21.22 NTP 90 NTP Version 4, client
   18 0.428721499  10.6.15.156 → 192.168.1.12 SSH 270 Server: Encrypted packet (len=204)
   19 0.428807684 192.168.1.12 → 10.6.15.156  TCP 66 54766 → 22 [ACK] Seq=633 Ack=1229 Win=6155 Len=0 TSval=8133029 TSecr=15064529
   20 0.457778310  10.6.15.156 → 192.168.1.12 SSH 534 Server: Encrypted packet (len=468)
   21 0.457857832 192.168.1.12 → 10.6.15.156  TCP 66 54766 → 22 [ACK] Seq=633 Ack=1697 Win=6155 Len=0 TSval=8133036 TSecr=15064536
   22 0.460187997 192.168.1.12 → 10.6.15.156  SSH 102 Client: Encrypted packet (len=36)
   23 0.461659648  10.6.15.156 → 192.168.1.12 TCP 66 22 → 54766 [ACK] Seq=1697 Ack=669 Win=1452 Len=0 TSval=15064537 TSecr=8133037
   24 0.461679597 192.168.1.12 → 10.6.15.156  SSH 210 Client: Encrypted packet (len=144)
   25 0.463675684  10.6.15.156 → 192.168.1.12 TCP 66 22 → 54766 [ACK] Seq=1697 Ack=813 Win=1452 Len=0 TSval=15064537 TSecr=8133037
   26 0.650747223  10.6.15.156 → 192.168.1.12 SSH 182 Server: Encrypted packet (len=116)
   27 0.691681750 192.168.1.12 → 10.6.15.156  TCP 66 54766 → 22 [ACK] Seq=813 Ack=1813 Win=6155 Len=0 TSval=8133095 TSecr=15064584
   28 0.699719703  10.6.15.156 → 192.168.1.12 SSH 102 Server: Encrypted packet (len=36)
   29 0.699796151 192.168.1.12 → 10.6.15.156  TCP 66 54766 → 22 [ACK] Seq=813 Ack=1849 Win=6155 Len=0 TSval=8133097 TSecr=15064597
   30 0.700045535 192.168.1.12 → 10.6.15.156  SSH 150 Client: Encrypted packet (len=84)
   31 0.701996902  10.6.15.156 → 192.168.1.12 TCP 66 22 → 54766 [ACK] Seq=1849 Ack=897 Win=1452 Len=0 TSval=15064597 TSecr=8133097
   32 0.707075523  10.6.15.156 → 192.168.1.12 SSH 138 Server: Encrypted packet (len=72)
   33 0.712144870 192.168.1.12 → 10.6.15.156  SSH 150 Client: Encrypted packet (len=84)
   34 0.712443341  10.6.15.156 → 192.168.1.12 SSH 102 Server: Encrypted packet (len=36)
   35 0.712739756 192.168.1.12 → 10.6.15.156  SSH 234 Client: Encrypted packet (len=168)
   36 0.714234970  10.6.15.156 → 192.168.1.12 TCP 66 22 → 54766 [ACK] Seq=1957 Ack=1149 Win=1452 Len=0 TSval=15064600 TSecr=8133100
   37 0.720519492  10.6.15.156 → 192.168.1.12 SSH 102 Server: Encrypted packet (len=36)
   38 0.720873506 192.168.1.12 → 10.6.15.156  SSH 150 Client: Encrypted packet (len=84)
   39 0.722246209  10.6.15.156 → 192.168.1.12 SSH 182 Server: Encrypted packet (len=116)
   40 0.759804909  10.6.15.156 → 192.168.1.12 TCP 66 22 → 54766 [ACK] Seq=2109 Ack=1233 Win=1452 Len=0 TSval=15064612 TSecr=8133102
   41 0.767695300 192.168.1.12 → 10.6.15.156  TCP 66 54766 → 22 [ACK] Seq=1233 Ack=2109 Win=6155 Len=0 TSval=8133114 TSecr=15064602
   42 0.773844496  10.6.15.156 → 192.168.1.12 SSH 238 Server: Encrypted packet (len=172)
   43 0.773941857 192.168.1.12 → 10.6.15.156  TCP 66 54766 → 22 [ACK] Seq=1233 Ack=2281 Win=6155 Len=0 TSval=8133115 TSecr=15064615
   44 0.879955436  10.6.15.156 → 192.168.1.12 SSH 238 Server: Encrypted packet (len=172)
   45 0.880034657 192.168.1.12 → 10.6.15.156  TCP 66 54766 → 22 [ACK] Seq=1233 Ack=2453 Win=6155 Len=0 TSval=8133142 TSecr=15064642
   46 0.940748856  10.6.15.156 → 192.168.1.12 SSH 182 Server: Encrypted packet (len=116)
   47 0.940838853 192.168.1.12 → 10.6.15.156  TCP 66 54766 → 22 [ACK] Seq=1233 Ack=2569 Win=6155 Len=0 TSval=8133157 TSecr=15064657
   48 0.941044680 192.168.1.12 → 10.6.15.156  SSH 134 Client: Encrypted packet (len=68)
   49 0.942618294  10.6.15.156 → 192.168.1.12 TCP 66 22 → 54766 [ACK] Seq=2569 Ack=1301 Win=1452 Len=0 TSval=15064657 TSecr=8133157
   50 0.958868268  10.6.15.156 → 192.168.1.12 SSH 214 Server: Encrypted packet (len=148)
   51 0.959175064 192.168.1.12 → 10.6.15.156  SSH 134 Client: Encrypted packet (len=68)
   52 0.961879577  10.6.15.156 → 192.168.1.12 SSH 214 Server: Encrypted packet (len=148)
   53 0.976333493  10.6.15.156 → 192.168.1.12 SSH 182 Server: Encrypted packet (len=116)
   54 0.976356034 192.168.1.12 → 10.6.15.156  SSH 134 Client: Encrypted packet (len=68)
   55 0.994701549  10.6.15.156 → 192.168.1.12 SSH 182 Server: Encrypted packet (len=116)
   56 0.994723605 192.168.1.12 → 10.6.15.156  SSH 134 Client: Encrypted packet (len=68)
   57 1.035743413  10.6.15.156 → 192.168.1.12 TCP 66 22 → 54766 [ACK] Seq=3097 Ack=1505 Win=1452 Len=0 TSval=15064681 TSecr=8133170
   58 1.035767380 192.168.1.12 → 10.6.15.156  SSH 134 Client: Encrypted packet (len=68)
   59 1.037302712  10.6.15.156 → 192.168.1.12 TCP 66 22 → 54766 [ACK] Seq=3097 Ack=1573 Win=1452 Len=0 TSval=15064681 TSecr=8133181
   60 1.101768522  10.6.15.156 → 192.168.1.12 SSH 198 Server: Encrypted packet (len=132)
   61 1.143710394 192.168.1.12 → 10.6.15.156  TCP 66 54766 → 22 [ACK] Seq=1573 Ack=3229 Win=6155 Len=0 TSval=8133208 TSecr=15064697
   62 1.173271888  10.6.15.156 → 192.168.1.12 SSH 206 Server: Encrypted packet (len=140)
   63 1.173351818 192.168.1.12 → 10.6.15.156  TCP 66 54766 → 22 [ACK] Seq=1573 Ack=3369 Win=6155 Len=0 TSval=8133215 TSecr=15064715
   64 1.193692010 192.168.1.12 → 239.255.255.250 SSDP 213 M-SEARCH * HTTP/1.1 
   65 1.224746229  10.6.15.156 → 192.168.1.12 SSH 198 Server: Encrypted packet (len=132)
   66 1.224843089 192.168.1.12 → 10.6.15.156  TCP 66 54766 → 22 [ACK] Seq=1573 Ack=3501 Win=6155 Len=0 TSval=8133228 TSecr=15064728
   67 1.331144429  10.6.15.156 → 192.168.1.12 SSH 470 Server: Encrypted packet (len=404)
   68 1.331227655 192.168.1.12 → 10.6.15.156  TCP 66 54766 → 22 [ACK] Seq=1573 Ack=3905 Win=6155 Len=0 TSval=8133254 TSecr=15064754
   69 1.552923397  10.6.15.156 → 192.168.1.12 SSH 318 Server: Encrypted packet (len=252)
   70 1.552948069 192.168.1.12 → 10.6.15.156  TCP 66 54766 → 22 [ACK] Seq=1573 Ack=4157 Win=6155 Len=0 TSval=8133310 TSecr=15064810
   71 1.624596671  10.6.15.156 → 192.168.1.12 SSH 502 Server: Encrypted packet (len=436)
   72 1.624613104 192.168.1.12 → 10.6.15.156  TCP 66 54766 → 22 [ACK] Seq=1573 Ack=4593 Win=6155 Len=0 TSval=8133328 TSecr=15064828
   73 1.678858817  10.6.15.156 → 192.168.1.12 SSH 470 Server: Encrypted packet (len=404)
   74 1.678876629 192.168.1.12 → 10.6.15.156  TCP 66 54766 → 22 [ACK] Seq=1573 Ack=4997 Win=6155 Len=0 TSval=8133341 TSecr=15064841
   75 1.781802807  10.6.15.156 → 192.168.1.12 SSH 206 Server: Encrypted packet (len=140)
   76 1.781820889 192.168.1.12 → 10.6.15.156  TCP 66 54766 → 22 [ACK] Seq=1573 Ack=5137 Win=6155 Len=0 TSval=8133367 TSecr=15064867
   77 2.075889517  10.6.15.156 → 192.168.1.12 SSH 238 Server: Encrypted packet (len=172)
   78 2.075908123 192.168.1.12 → 10.6.15.156  TCP 66 54766 → 22 [ACK] Seq=1573 Ack=5309 Win=6155 Len=0 TSval=8133441 TSecr=15064941
   79 2.126966248  10.6.15.156 → 192.168.1.12 SSH 238 Server: Encrypted packet (len=172)
   80 2.126983115 192.168.1.12 → 10.6.15.156  TCP 66 54766 → 22 [ACK] Seq=1573 Ack=5481 Win=6155 Len=0 TSval=8133453 TSecr=15064953
   81 2.194401482 192.168.1.12 → 239.255.255.250 SSDP 213 M-SEARCH * HTTP/1.1 
   82 2.232527131  10.6.15.156 → 192.168.1.12 SSH 238 Server: Encrypted packet (len=172)
   83 2.232544749 192.168.1.12 → 10.6.15.156  TCP 66 54766 → 22 [ACK] Seq=1573 Ack=5653 Win=6155 Len=0 TSval=8133480 TSecr=15064980
   84 2.455123582  10.6.15.156 → 192.168.1.12 SSH 486 Server: Encrypted packet (len=420)
   85 2.455139823 192.168.1.12 → 10.6.15.156  TCP 66 54766 → 22 [ACK] Seq=1573 Ack=6073 Win=6155 Len=0 TSval=8133535 TSecr=15065035
   86 2.527430575  10.6.15.156 → 192.168.1.12 SSH 294 Server: Encrypted packet (len=228)
   87 2.527449314 192.168.1.12 → 10.6.15.156  TCP 66 54766 → 22 [ACK] Seq=1573 Ack=6301 Win=6155 Len=0 TSval=8133553 TSecr=15065053
   88 2.578758601  10.6.15.156 → 192.168.1.12 SSH 254 Server: Encrypted packet (len=188)
   89 2.578781263 192.168.1.12 → 10.6.15.156  TCP 66 54766 → 22 [ACK] Seq=1573 Ack=6489 Win=6155 Len=0 TSval=8133566 TSecr=15065066
   90 2.683670158  10.6.15.156 → 192.168.1.12 SSH 254 Server: Encrypted packet (len=188)
   91 2.683686883 192.168.1.12 → 10.6.15.156  TCP 66 54766 → 22 [ACK] Seq=1573 Ack=6677 Win=6155 Len=0 TSval=8133592 TSecr=15065093
   92 2.907578479  10.6.15.156 → 192.168.1.12 SSH 318 Server: Encrypted packet (len=252)
   93 2.907597895 192.168.1.12 → 10.6.15.156  TCP 66 54766 → 22 [ACK] Seq=1573 Ack=6929 Win=6155 Len=0 TSval=8133648 TSecr=15065148
   94 2.978011508  10.6.15.156 → 192.168.1.12 SSH 406 Server: Encrypted packet (len=340)
   95 2.978029035 192.168.1.12 → 10.6.15.156  TCP 66 54766 → 22 [ACK] Seq=1573 Ack=7269 Win=6155 Len=0 TSval=8133666 TSecr=15065166
   96 3.029064776  10.6.15.156 → 192.168.1.12 SSH 438 Server: Encrypted packet (len=372)
   97 3.029082990 192.168.1.12 → 10.6.15.156  TCP 66 54766 → 22 [ACK] Seq=1573 Ack=7641 Win=6155 Len=0 TSval=8133679 TSecr=15065179
   98 3.135026642  10.6.15.156 → 192.168.1.12 SSH 438 Server: Encrypted packet (len=372)
   99 3.135050336 192.168.1.12 → 10.6.15.156  TCP 66 54766 → 22 [ACK] Seq=1573 Ack=8013 Win=6155 Len=0 TSval=8133705 TSecr=15065205
  100 3.194515853 192.168.1.12 → 239.255.255.250 SSDP 213 M-SEARCH * HTTP/1.1 
  101 3.356933863  10.6.15.156 → 192.168.1.12 SSH 406 Server: Encrypted packet (len=340)
  102 3.356950727 192.168.1.12 → 10.6.15.156  TCP 66 54766 → 22 [ACK] Seq=1573 Ack=8353 Win=6155 Len=0 TSval=8133761 TSecr=15065261
  103 3.428201138  10.6.15.156 → 192.168.1.12 SSH 182 Server: Encrypted packet (len=116)
  104 3.428219053 192.168.1.12 → 10.6.15.156  TCP 66 54766 → 22 [ACK] Seq=1573 Ack=8469 Win=6155 Len=0 TSval=8133779 TSecr=15065279
  105 3.480350380  10.6.15.156 → 192.168.1.12 SSH 214 Server: Encrypted packet (len=148)
  106 3.480368935 192.168.1.12 → 10.6.15.156  TCP 66 54766 → 22 [ACK] Seq=1573 Ack=8617 Win=6155 Len=0 TSval=8133792 TSecr=15065292
  107 3.585596865  10.6.15.156 → 192.168.1.12 SSH 222 Server: Encrypted packet (len=156)
  108 3.585612420 192.168.1.12 → 10.6.15.156  TCP 66 54766 → 22 [ACK] Seq=1573 Ack=8773 Win=6155 Len=0 TSval=8133818 TSecr=15065318
  109 3.880138246  10.6.15.156 → 192.168.1.12 SSH 182 Server: Encrypted packet (len=116)
  110 3.880157112 192.168.1.12 → 10.6.15.156  TCP 66 54766 → 22 [ACK] Seq=1573 Ack=8889 Win=6155 Len=0 TSval=8133892 TSecr=15065391
  111 4.036394129  10.6.15.156 → 192.168.1.12 SSH 182 Server: Encrypted packet (len=116)
  112 4.036412222 192.168.1.12 → 10.6.15.156  TCP 66 54766 → 22 [ACK] Seq=1573 Ack=9005 Win=6155 Len=0 TSval=8133931 TSecr=15065431
  113 4.258958962  10.6.15.156 → 192.168.1.12 SSH 230 Server: Encrypted packet (len=164)
  114 4.258977408 192.168.1.12 → 10.6.15.156  TCP 66 54766 → 22 [ACK] Seq=1573 Ack=9169 Win=6155 Len=0 TSval=8133986 TSecr=15065486
  115 4.330875437  10.6.15.156 → 192.168.1.12 SSH 270 Server: Encrypted packet (len=204)
  116 4.330906062 192.168.1.12 → 10.6.15.156  TCP 66 54766 → 22 [ACK] Seq=1573 Ack=9373 Win=6155 Len=0 TSval=8134004 TSecr=15065504
  117 4.381842973  10.6.15.156 → 192.168.1.12 SSH 270 Server: Encrypted packet (len=204)
  118 4.381861167 192.168.1.12 → 10.6.15.156  TCP 66 54766 → 22 [ACK] Seq=1573 Ack=9577 Win=6155 Len=0 TSval=8134017 TSecr=15065517
  119 4.488220267  10.6.15.156 → 192.168.1.12 SSH 270 Server: Encrypted packet (len=204)
  120 4.488238927 192.168.1.12 → 10.6.15.156  TCP 66 54766 → 22 [ACK] Seq=1573 Ack=9781 Win=6155 Len=0 TSval=8134044 TSecr=15065544
  121 4.709806406  10.6.15.156 → 192.168.1.12 SSH 214 Server: Encrypted packet (len=148)
  122 4.709823312 192.168.1.12 → 10.6.15.156  TCP 66 54766 → 22 [ACK] Seq=1573 Ack=9929 Win=6155 Len=0 TSval=8134099 TSecr=15065599
  123 4.781357785  10.6.15.156 → 192.168.1.12 SSH 222 Server: Encrypted packet (len=156)
  124 4.781376329 192.168.1.12 → 10.6.15.156  TCP 66 54766 → 22 [ACK] Seq=1573 Ack=10085 Win=6155 Len=0 TSval=8134117 TSecr=15065617
  125 4.832949009  10.6.15.156 → 192.168.1.12 SSH 214 Server: Encrypted packet (len=148)
  126 4.832967119 192.168.1.12 → 10.6.15.156  TCP 66 54766 → 22 [ACK] Seq=1573 Ack=10233 Win=6155 Len=0 TSval=8134130 TSecr=15065630
  127 4.938503584  10.6.15.156 → 192.168.1.12 SSH 182 Server: Encrypted packet (len=116)
  128 4.938520790 192.168.1.12 → 10.6.15.156  TCP 66 54766 → 22 [ACK] Seq=1573 Ack=10349 Win=6155 Len=0 TSval=8134156 TSecr=15065656
  129 5.161144495  10.6.15.156 → 192.168.1.12 SSH 238 Server: Encrypted packet (len=172)
  130 5.161162751 192.168.1.12 → 10.6.15.156  TCP 66 54766 → 22 [ACK] Seq=1573 Ack=10521 Win=6155 Len=0 TSval=8134212 TSecr=15065712
  131 5.200642802  192.168.1.1 → 239.255.255.250 SSDP 302 NOTIFY * HTTP/1.1 
  132 5.203949162  192.168.1.1 → 239.255.255.250 SSDP 311 NOTIFY * HTTP/1.1 
  133 5.207307976  192.168.1.1 → 239.255.255.250 SSDP 374 NOTIFY * HTTP/1.1 
  134 5.211253415  192.168.1.1 → 239.255.255.250 SSDP 370 NOTIFY * HTTP/1.1 
  135 5.214003705  192.168.1.1 → 239.255.255.250 SSDP 350 NOTIFY * HTTP/1.1 
  136 5.217472221  192.168.1.1 → 239.255.255.250 SSDP 382 NOTIFY * HTTP/1.1 
  137 5.220858283  192.168.1.1 → 239.255.255.250 SSDP 364 NOTIFY * HTTP/1.1 
  138 5.224189691  192.168.1.1 → 239.255.255.250 SSDP 366 NOTIFY * HTTP/1.1 
  139 5.227066180  192.168.1.1 → 239.255.255.250 SSDP 302 NOTIFY * HTTP/1.1 
  140 5.231144803  192.168.1.1 → 239.255.255.250 SSDP 311 NOTIFY * HTTP/1.1 
  141 5.233501091  192.168.1.1 → 239.255.255.250 SSDP 374 NOTIFY * HTTP/1.1 
  142 5.233771452  10.6.15.156 → 192.168.1.12 SSH 214 Server: Encrypted packet (len=148)
  143 5.233789471 192.168.1.12 → 10.6.15.156  TCP 66 54766 → 22 [ACK] Seq=1573 Ack=10669 Win=6155 Len=0 TSval=8134230 TSecr=15065730
  144 5.237563676  192.168.1.1 → 239.255.255.250 SSDP 370 NOTIFY * HTTP/1.1 
  145 5.241118851  192.168.1.1 → 239.255.255.250 SSDP 350 NOTIFY * HTTP/1.1 
  146 5.244590699  192.168.1.1 → 239.255.255.250 SSDP 382 NOTIFY * HTTP/1.1 
  147 5.248139939  192.168.1.1 → 239.255.255.250 SSDP 364 NOTIFY * HTTP/1.1 
  148 5.251303043  192.168.1.1 → 239.255.255.250 SSDP 366 NOTIFY * HTTP/1.1 
  149 5.284174277  10.6.15.156 → 192.168.1.12 SSH 222 Server: Encrypted packet (len=156)
  150 5.284191671 192.168.1.12 → 10.6.15.156  TCP 66 54766 → 22 [ACK] Seq=1573 Ack=10825 Win=6155 Len=0 TSval=8134243 TSecr=15065743
  151 5.389500372  10.6.15.156 → 192.168.1.12 SSH 254 Server: Encrypted packet (len=188)
  152 5.389518874 192.168.1.12 → 10.6.15.156  TCP 66 54766 → 22 [ACK] Seq=1573 Ack=11013 Win=6155 Len=0 TSval=8134269 TSecr=15065769
  153 5.611870373  10.6.15.156 → 192.168.1.12 SSH 318 Server: Encrypted packet (len=252)
  154 5.611890007 192.168.1.12 → 10.6.15.156  TCP 66 54766 → 22 [ACK] Seq=1573 Ack=11265 Win=6155 Len=0 TSval=8134325 TSecr=15065825
  155 5.651173805  10.6.15.156 → 192.168.1.12 SSH 150 Server: Encrypted packet (len=84)
  156 5.651201721 192.168.1.12 → 10.6.15.156  TCP 66 54766 → 22 [ACK] Seq=1573 Ack=11349 Win=6155 Len=0 TSval=8134334 TSecr=15065834
  157 5.651491564 192.168.1.12 → 10.6.15.156  SSH 150 Client: Encrypted packet (len=84)
  158 5.653354785  10.6.15.156 → 192.168.1.12 TCP 66 22 → 54766 [ACK] Seq=11349 Ack=1657 Win=1452 Len=0 TSval=15065835 TSecr=8134334
  159 5.684162032  10.6.15.156 → 192.168.1.12 SSH 318 Server: Encrypted packet (len=252)
  160 5.727737840 192.168.1.12 → 10.6.15.156  TCP 66 54766 → 22 [ACK] Seq=1657 Ack=11601 Win=6155 Len=0 TSval=8134354 TSecr=15065843
  161 5.735009124  10.6.15.156 → 192.168.1.12 SSH 358 Server: Encrypted packet (len=292)
  162 5.735035009 192.168.1.12 → 10.6.15.156  TCP 66 54766 → 22 [ACK] Seq=1657 Ack=11893 Win=6155 Len=0 TSval=8134355 TSecr=15065855
  163 5.840634138  10.6.15.156 → 192.168.1.12 SSH 302 Server: Encrypted packet (len=236)
  164 5.840651756 192.168.1.12 → 10.6.15.156  TCP 66 54766 → 22 [ACK] Seq=1657 Ack=12129 Win=6155 Len=0 TSval=8134382 TSecr=15065882
  165 6.134221339  10.6.15.156 → 192.168.1.12 SSH 214 Server: Encrypted packet (len=148)
  166 6.134246523 192.168.1.12 → 10.6.15.156  TCP 66 54766 → 22 [ACK] Seq=1657 Ack=12277 Win=6155 Len=0 TSval=8134455 TSecr=15065955
  167 6.177866028  10.6.15.156 → 192.168.1.12 SSH 158 Server: Encrypted packet (len=92)
  168 6.177883643 192.168.1.12 → 10.6.15.156  TCP 66 54766 → 22 [ACK] Seq=1657 Ack=12369 Win=6155 Len=0 TSval=8134466 TSecr=15065966
  169 6.178195537 192.168.1.12 → 10.6.15.156  SSH 150 Client: Encrypted packet (len=84)
  170 6.185735754  10.6.15.156 → 192.168.1.12 SSH 182 Server: Encrypted packet (len=116)
  171 6.227734384 192.168.1.12 → 10.6.15.156  TCP 66 54766 → 22 [ACK] Seq=1741 Ack=12485 Win=6155 Len=0 TSval=8134479 TSecr=15065968
  172 6.291707358  10.6.15.156 → 192.168.1.12 SSH 286 Server: Encrypted packet (len=220)
  173 6.291732891 192.168.1.12 → 10.6.15.156  TCP 66 54766 → 22 [ACK] Seq=1741 Ack=12705 Win=6155 Len=0 TSval=8134495 TSecr=15065995
  174 6.513993469  10.6.15.156 → 192.168.1.12 SSH 422 Server: Encrypted packet (len=356)
  175 6.514018841 192.168.1.12 → 10.6.15.156  TCP 66 54766 → 22 [ACK] Seq=1741 Ack=13061 Win=6155 Len=0 TSval=8134550 TSecr=15066050
  176 6.585374054  10.6.15.156 → 192.168.1.12 SSH 318 Server: Encrypted packet (len=252)
  177 6.585392507 192.168.1.12 → 10.6.15.156  TCP 66 54766 → 22 [ACK] Seq=1741 Ack=13313 Win=6155 Len=0 TSval=8134568 TSecr=15066068
  178 6.636928177  10.6.15.156 → 192.168.1.12 SSH 358 Server: Encrypted packet (len=292)
  179 6.636940870 192.168.1.12 → 10.6.15.156  TCP 66 54766 → 22 [ACK] Seq=1741 Ack=13605 Win=6155 Len=0 TSval=8134581 TSecr=15066081
  180 6.742703335  10.6.15.156 → 192.168.1.12 SSH 238 Server: Encrypted packet (len=172)
  181 6.742720376 192.168.1.12 → 10.6.15.156  TCP 66 54766 → 22 [ACK] Seq=1741 Ack=13777 Win=6155 Len=0 TSval=8134607 TSecr=15066107
  182 6.964712932  10.6.15.156 → 192.168.1.12 SSH 182 Server: Encrypted packet (len=116)
  183 6.964732223 192.168.1.12 → 10.6.15.156  TCP 66 54766 → 22 [ACK] Seq=1741 Ack=13893 Win=6155 Len=0 TSval=8134663 TSecr=15066163
  184 7.036854860  10.6.15.156 → 192.168.1.12 SSH 270 Server: Encrypted packet (len=204)
  185 7.036872611 192.168.1.12 → 10.6.15.156  TCP 66 54766 → 22 [ACK] Seq=1741 Ack=14097 Win=6155 Len=0 TSval=8134681 TSecr=15066181
  186 7.087788128  10.6.15.156 → 192.168.1.12 SSH 182 Server: Encrypted packet (len=116)
  187 7.087807265 192.168.1.12 → 10.6.15.156  TCP 66 54766 → 22 [ACK] Seq=1741 Ack=14213 Win=6155 Len=0 TSval=8134694 TSecr=15066194
  188 7.193623938  10.6.15.156 → 192.168.1.12 SSH 270 Server: Encrypted packet (len=204)
  189 7.193642504 192.168.1.12 → 10.6.15.156  TCP 66 54766 → 22 [ACK] Seq=1741 Ack=14417 Win=6155 Len=0 TSval=8134720 TSecr=15066220
  190 7.415934183  10.6.15.156 → 192.168.1.12 SSH 286 Server: Encrypted packet (len=220)
  191 7.415952397 192.168.1.12 → 10.6.15.156  TCP 66 54766 → 22 [ACK] Seq=1741 Ack=14637 Win=6155 Len=0 TSval=8134776 TSecr=15066276
  192 7.487320526  10.6.15.156 → 192.168.1.12 SSH 286 Server: Encrypted packet (len=220)
  193 7.487337742 192.168.1.12 → 10.6.15.156  TCP 66 54766 → 22 [ACK] Seq=1741 Ack=14857 Win=6155 Len=0 TSval=8134793 TSecr=15066293
  194 7.539221853  10.6.15.156 → 192.168.1.12 SSH 502 Server: Encrypted packet (len=436)
  195 7.539240023 192.168.1.12 → 10.6.15.156  TCP 66 54766 → 22 [ACK] Seq=1741 Ack=15293 Win=6155 Len=0 TSval=8134806 TSecr=15066306
  196 7.644963343  10.6.15.156 → 192.168.1.12 SSH 454 Server: Encrypted packet (len=388)
  197 7.644979623 192.168.1.12 → 10.6.15.156  TCP 66 54766 → 22 [ACK] Seq=1741 Ack=15681 Win=6155 Len=0 TSval=8134833 TSecr=15066333
  198 7.867139766  10.6.15.156 → 192.168.1.12 SSH 614 Server: Encrypted packet (len=548)
  199 7.867158668 192.168.1.12 → 10.6.15.156  TCP 66 54766 → 22 [ACK] Seq=1741 Ack=16229 Win=6155 Len=0 TSval=8134888 TSecr=15066388
  200 7.938691587  10.6.15.156 → 192.168.1.12 SSH 614 Server: Encrypted packet (len=548)
  201 7.938709250 192.168.1.12 → 10.6.15.156  TCP 66 54766 → 22 [ACK] Seq=1741 Ack=16777 Win=6155 Len=0 TSval=8134906 TSecr=15066406
  202 7.990395718  10.6.15.156 → 192.168.1.12 SSH 454 Server: Encrypted packet (len=388)
  203 7.990415454 192.168.1.12 → 10.6.15.156  TCP 66 54766 → 22 [ACK] Seq=1741 Ack=17165 Win=6155 Len=0 TSval=8134919 TSecr=15066419
  204 8.098029087  10.6.15.156 → 192.168.1.12 SSH 486 Server: Encrypted packet (len=420)
  205 8.098047533 192.168.1.12 → 10.6.15.156  TCP 66 54766 → 22 [ACK] Seq=1741 Ack=17585 Win=6155 Len=0 TSval=8134946 TSecr=15066446
  206 8.318280510  10.6.15.156 → 192.168.1.12 SSH 334 Server: Encrypted packet (len=268)
  207 8.318301018 192.168.1.12 → 10.6.15.156  TCP 66 54766 → 22 [ACK] Seq=1741 Ack=17853 Win=6155 Len=0 TSval=8135001 TSecr=15066501
  208 8.390156568  10.6.15.156 → 192.168.1.12 SSH 438 Server: Encrypted packet (len=372)
  209 8.390174360 192.168.1.12 → 10.6.15.156  TCP 66 54766 → 22 [ACK] Seq=1741 Ack=18225 Win=6155 Len=0 TSval=8135019 TSecr=15066519
  210 8.441132501  10.6.15.156 → 192.168.1.12 SSH 438 Server: Encrypted packet (len=372)
  211 8.441151867 192.168.1.12 → 10.6.15.156  TCP 66 54766 → 22 [ACK] Seq=1741 Ack=18597 Win=6155 Len=0 TSval=8135032 TSecr=15066532
  212 8.546699349  10.6.15.156 → 192.168.1.12 SSH 438 Server: Encrypted packet (len=372)
  213 8.546718647 192.168.1.12 → 10.6.15.156  TCP 66 54766 → 22 [ACK] Seq=1741 Ack=18969 Win=6155 Len=0 TSval=8135058 TSecr=15066558
  214 8.768942004  10.6.15.156 → 192.168.1.12 SSH 374 Server: Encrypted packet (len=308)
  215 8.768961115 192.168.1.12 → 10.6.15.156  TCP 66 54766 → 22 [ACK] Seq=1741 Ack=19277 Win=6155 Len=0 TSval=8135114 TSecr=15066614
  216 8.812165067  10.6.15.156 → 192.168.1.12 SSH 150 Server: Encrypted packet (len=84)
  217 8.812183500 192.168.1.12 → 10.6.15.156  TCP 66 54766 → 22 [ACK] Seq=1741 Ack=19361 Win=6155 Len=0 TSval=8135125 TSecr=15066625
  218 8.812491332 192.168.1.12 → 10.6.15.156  SSH 150 Client: Encrypted packet (len=84)
  219 8.840485944  10.6.15.156 → 192.168.1.12 SSH 254 Server: Encrypted packet (len=188)
  220 8.883734414 192.168.1.12 → 10.6.15.156  TCP 66 54766 → 22 [ACK] Seq=1825 Ack=19549 Win=6155 Len=0 TSval=8135143 TSecr=15066632
  221 8.891917142  10.6.15.156 → 192.168.1.12 SSH 214 Server: Encrypted packet (len=148)
  222 8.891941737 192.168.1.12 → 10.6.15.156  TCP 66 54766 → 22 [ACK] Seq=1825 Ack=19697 Win=6155 Len=0 TSval=8135145 TSecr=15066645
  223 8.999968345  10.6.15.156 → 192.168.1.12 SSH 182 Server: Encrypted packet (len=116)
  224 8.999985549 192.168.1.12 → 10.6.15.156  TCP 66 54766 → 22 [ACK] Seq=1825 Ack=19813 Win=6155 Len=0 TSval=8135172 TSecr=15066671
  225 9.219860877  10.6.15.156 → 192.168.1.12 SSH 238 Server: Encrypted packet (len=172)
  226 9.219885840 192.168.1.12 → 10.6.15.156  TCP 66 54766 → 22 [ACK] Seq=1825 Ack=19985 Win=6155 Len=0 TSval=8135227 TSecr=15066727
  227 9.281501022  10.6.15.156 → 192.168.1.12 SSH 150 Server: Encrypted packet (len=84)
  228 9.281519099 192.168.1.12 → 10.6.15.156  TCP 66 54766 → 22 [ACK] Seq=1825 Ack=20069 Win=6155 Len=0 TSval=8135242 TSecr=15066742
  229 9.281814635 192.168.1.12 → 10.6.15.156  SSH 150 Client: Encrypted packet (len=84)
  230 9.291188006  10.6.15.156 → 192.168.1.12 SSH 198 Server: Encrypted packet (len=132)
  231 9.331734569 192.168.1.12 → 10.6.15.156  TCP 66 54766 → 22 [ACK] Seq=1909 Ack=20201 Win=6155 Len=0 TSval=8135255 TSecr=15066744
  232 9.342900792  10.6.15.156 → 192.168.1.12 SSH 270 Server: Encrypted packet (len=204)
  233 9.342926649 192.168.1.12 → 10.6.15.156  TCP 66 54766 → 22 [ACK] Seq=1909 Ack=20405 Win=6155 Len=0 TSval=8135257 TSecr=15066757
  234 9.449521755  10.6.15.156 → 192.168.1.12 SSH 238 Server: Encrypted packet (len=172)
  235 9.449540409 192.168.1.12 → 10.6.15.156  TCP 66 54766 → 22 [ACK] Seq=1909 Ack=20577 Win=6155 Len=0 TSval=8135284 TSecr=15066784
  236 9.670814274  10.6.15.156 → 192.168.1.12 SSH 238 Server: Encrypted packet (len=172)
  237 9.670833033 192.168.1.12 → 10.6.15.156  TCP 66 54766 → 22 [ACK] Seq=1909 Ack=20749 Win=6155 Len=0 TSval=8135339 TSecr=15066839
  238 9.670969540 192.168.1.12 → 10.6.15.156  SSH 102 Client: Encrypted packet (len=36)
  239 9.711980572  10.6.15.156 → 192.168.1.12 TCP 66 22 → 54766 [ACK] Seq=20749 Ack=1945 Win=1452 Len=0 TSval=15066850 TSecr=8135339
  240 9.742221697  10.6.15.156 → 192.168.1.12 SSH 214 Server: Encrypted packet (len=148)
  241 9.783735318 192.168.1.12 → 10.6.15.156  TCP 66 54766 → 22 [ACK] Seq=1945 Ack=20897 Win=6155 Len=0 TSval=8135368 TSecr=15066857
  242 10.121674451  10.6.15.156 → 192.168.1.12 SSH 182 Server: Encrypted packet (len=116)
  243 10.121701883 192.168.1.12 → 10.6.15.156  TCP 66 54766 → 22 [ACK] Seq=1945 Ack=21013 Win=6155 Len=0 TSval=8135452 TSecr=15066952
  244 10.193360694  10.6.15.156 → 192.168.1.12 SSH 238 Server: Encrypted packet (len=172)
  245 10.193378841 192.168.1.12 → 10.6.15.156  TCP 66 54766 → 22 [ACK] Seq=1945 Ack=21185 Win=6155 Len=0 TSval=8135470 TSecr=15066970
  246 10.244849675  10.6.15.156 → 192.168.1.12 SSH 238 Server: Encrypted packet (len=172)
  247 10.244867909 192.168.1.12 → 10.6.15.156  TCP 66 54766 → 22 [ACK] Seq=1945 Ack=21357 Win=6155 Len=0 TSval=8135483 TSecr=15066983
  248 10.350811080  10.6.15.156 → 192.168.1.12 SSH 358 Server: Encrypted packet (len=292)
  249 10.350829041 192.168.1.12 → 10.6.15.156  TCP 66 54766 → 22 [ACK] Seq=1945 Ack=21649 Win=6155 Len=0 TSval=8135509 TSecr=15067009
  250 10.572996110  10.6.15.156 → 192.168.1.12 SSH 374 Server: Encrypted packet (len=308)
  251 10.573014153 192.168.1.12 → 10.6.15.156  TCP 66 54766 → 22 [ACK] Seq=1945 Ack=21957 Win=6155 Len=0 TSval=8135565 TSecr=15067065
  252 10.644755913  10.6.15.156 → 192.168.1.12 SSH 342 Server: Encrypted packet (len=276)
  253 10.644771559 192.168.1.12 → 10.6.15.156  TCP 66 54766 → 22 [ACK] Seq=1945 Ack=22233 Win=6155 Len=0 TSval=8135583 TSecr=15067083
  254 10.668131439  10.6.15.156 → 192.168.1.12 SSH 190 Server: Encrypted packet (len=124)
  255 10.668149928 192.168.1.12 → 10.6.15.156  TCP 66 54766 → 22 [ACK] Seq=1945 Ack=22357 Win=6155 Len=0 TSval=8135589 TSecr=15067089
  256 10.673676221  10.6.15.156 → 192.168.1.12 SSH 190 Server: Encrypted packet (len=124)
  257 10.673693294 192.168.1.12 → 10.6.15.156  TCP 66 54766 → 22 [ACK] Seq=1945 Ack=22481 Win=6155 Len=0 TSval=8135590 TSecr=15067090
  258 10.696032408  10.6.15.156 → 192.168.1.12 SSH 342 Server: Encrypted packet (len=276)
  259 10.696049746 192.168.1.12 → 10.6.15.156  TCP 66 54766 → 22 [ACK] Seq=1945 Ack=22757 Win=6155 Len=0 TSval=8135596 TSecr=15067096
  260 10.801656581  10.6.15.156 → 192.168.1.12 SSH 286 Server: Encrypted packet (len=220)
  261 10.801675237 192.168.1.12 → 10.6.15.156  TCP 66 54766 → 22 [ACK] Seq=1945 Ack=22977 Win=6155 Len=0 TSval=8135622 TSecr=15067122
  262 11.024322856  10.6.15.156 → 192.168.1.12 SSH 598 Server: Encrypted packet (len=532)
  263 11.024341412 192.168.1.12 → 10.6.15.156  TCP 66 54766 → 22 [ACK] Seq=1945 Ack=23509 Win=6155 Len=0 TSval=8135678 TSecr=15067178
  264 11.095730539  10.6.15.156 → 192.168.1.12 SSH 470 Server: Encrypted packet (len=404)
  265 11.095748711 192.168.1.12 → 10.6.15.156  TCP 66 54766 → 22 [ACK] Seq=1945 Ack=23913 Win=6155 Len=0 TSval=8135696 TSecr=15067196
  266 11.147255095  10.6.15.156 → 192.168.1.12 SSH 502 Server: Encrypted packet (len=436)
  267 11.147273688 192.168.1.12 → 10.6.15.156  TCP 66 54766 → 22 [ACK] Seq=1945 Ack=24349 Win=6155 Len=0 TSval=8135708 TSecr=15067208
  268 11.252918634  10.6.15.156 → 192.168.1.12 SSH 502 Server: Encrypted packet (len=436)
  269 11.252937293 192.168.1.12 → 10.6.15.156  TCP 66 54766 → 22 [ACK] Seq=1945 Ack=24785 Win=6155 Len=0 TSval=8135735 TSecr=15067235
  270 11.474707733  10.6.15.156 → 192.168.1.12 SSH 222 Server: Encrypted packet (len=156)
  271 11.474718099 192.168.1.12 → 10.6.15.156  TCP 66 54766 → 22 [ACK] Seq=1945 Ack=24941 Win=6155 Len=0 TSval=8135790 TSecr=15067290
  272 11.474797901 192.168.1.12 → 10.6.15.156  SSH 1514 Client: Encrypted packet (len=1448)
  273 11.479271273 192.168.1.12 → 10.6.15.156  SSH 582 Client: Encrypted packet (len=516)
  274 11.508692618  10.6.15.156 → 192.168.1.12 TCP 66 22 → 54766 [ACK] Seq=24941 Ack=3393 Win=1452 Len=0 TSval=15067299 TSecr=8135790
  275 11.508709746  10.6.15.156 → 192.168.1.12 TCP 66 22 → 54766 [ACK] Seq=24941 Ack=3909 Win=1450 Len=0 TSval=15067299 TSecr=8135791
  276 11.511492794  10.6.15.156 → 192.168.1.12 SSH 142 Server: Encrypted packet (len=76)
  277 11.546433308  10.6.15.156 → 192.168.1.12 SSH 334 Server: Encrypted packet (len=268)
  278 11.546451006 192.168.1.12 → 10.6.15.156  TCP 66 54766 → 22 [ACK] Seq=3909 Ack=25285 Win=6155 Len=0 TSval=8135808 TSecr=15067300
  279 11.597888233  10.6.15.156 → 192.168.1.12 SSH 302 Server: Encrypted packet (len=236)
  280 11.630500905  10.6.15.156 → 192.168.1.12 SSH 878 Server: Encrypted packet (len=812)
  281 11.630519743 192.168.1.12 → 10.6.15.156  TCP 66 54766 → 22 [ACK] Seq=3909 Ack=26333 Win=6155 Len=0 TSval=8135829 TSecr=15067321
  282 11.631318774  10.6.15.156 → 192.168.1.12 SSH 654 Server: Encrypted packet (len=588)
  283 11.631850724 192.168.1.12 → 10.6.15.156  SSH 134 Client: Encrypted packet (len=68)
  284 11.671686036  10.6.15.156 → 192.168.1.12 TCP 66 22 → 54766 [ACK] Seq=26921 Ack=3977 Win=1452 Len=0 TSval=15067340 TSecr=8135830
  285 11.703699116  10.6.15.156 → 192.168.1.12 SSH 230 Server: Encrypted packet (len=164)
  286 11.747735365 192.168.1.12 → 10.6.15.156  TCP 66 54766 → 22 [ACK] Seq=3977 Ack=27085 Win=6155 Len=0 TSval=8135859 TSecr=15067348
  287 11.925644474  10.6.15.156 → 192.168.1.12 SSH 182 Server: Encrypted packet (len=116)
  288 11.925669418 192.168.1.12 → 10.6.15.156  TCP 66 54766 → 22 [ACK] Seq=3977 Ack=27201 Win=6155 Len=0 TSval=8135903 TSecr=15067403
  289 12.405563594 192.168.1.12 → 123.108.200.124 NTP 90 NTP Version 4, client
  290 12.449232882  10.6.15.156 → 192.168.1.12 SSH 182 Server: Encrypted packet (len=116)
  291 12.449248483 192.168.1.12 → 10.6.15.156  TCP 66 54766 → 22 [ACK] Seq=3977 Ack=27317 Win=6155 Len=0 TSval=8136034 TSecr=15067534
  292 12.501189637  10.6.15.156 → 192.168.1.12 SSH 182 Server: Encrypted packet (len=116)
  293 12.501207369 192.168.1.12 → 10.6.15.156  TCP 66 54766 → 22 [ACK] Seq=3977 Ack=27433 Win=6155 Len=0 TSval=8136047 TSecr=15067547
  294 12.605306204  10.6.15.156 → 192.168.1.12 SSH 182 Server: Encrypted packet (len=116)
  295 12.605322558 192.168.1.12 → 10.6.15.156  TCP 66 54766 → 22 [ACK] Seq=3977 Ack=27549 Win=6155 Len=0 TSval=8136073 TSecr=15067573
  296 13.278809258  10.6.15.156 → 192.168.1.12 SSH 214 Server: Encrypted packet (len=148)
  297 13.278825931 192.168.1.12 → 10.6.15.156  TCP 66 54766 → 22 [ACK] Seq=3977 Ack=27697 Win=6155 Len=0 TSval=8136241 TSecr=15067741
  298 13.327276268 192.168.1.12 → 10.6.15.156  SSH 126 Client: Encrypted packet (len=60)
  299 13.328807196  10.6.15.156 → 192.168.1.12 TCP 66 22 → 54766 [ACK] Seq=27697 Ack=4037 Win=1452 Len=0 TSval=15067754 TSecr=8136253
  300 13.351862901  10.6.15.156 → 192.168.1.12 SSH 214 Server: Encrypted packet (len=148)
  301 13.351882069 192.168.1.12 → 10.6.15.156  TCP 66 54766 → 22 [ACK] Seq=4037 Ack=27845 Win=6155 Len=0 TSval=8136260 TSecr=15067759
  302 13.403367848  10.6.15.156 → 192.168.1.12 SSH 222 Server: Encrypted packet (len=156)
  303 13.403386025 192.168.1.12 → 10.6.15.156  TCP 66 54766 → 22 [ACK] Seq=4037 Ack=28001 Win=6155 Len=0 TSval=8136272 TSecr=15067772
  304 13.507979971  10.6.15.156 → 192.168.1.12 SSH 222 Server: Encrypted packet (len=156)
  305 13.507997869 192.168.1.12 → 10.6.15.156  TCP 66 54766 → 22 [ACK] Seq=4037 Ack=28157 Win=6155 Len=0 TSval=8136299 TSecr=15067799
  306 13.541410675  10.6.15.156 → 192.168.1.12 SSH 110 Server: Encrypted packet (len=44)
  307 13.541427842 192.168.1.12 → 10.6.15.156  TCP 66 54766 → 22 [ACK] Seq=4037 Ack=28201 Win=6155 Len=0 TSval=8136307 TSecr=15067807
  308 13.541821853 192.168.1.12 → 10.6.15.156  SSH 390 Client: Encrypted packet (len=324)
  309 13.583685746  10.6.15.156 → 192.168.1.12 TCP 66 22 → 54766 [ACK] Seq=28201 Ack=4361 Win=1452 Len=0 TSval=15067818 TSecr=8136307
  310 13.729997327  10.6.15.156 → 192.168.1.12 SSH 238 Server: Encrypted packet (len=172)
  311 13.758300543  10.6.15.156 → 192.168.1.12 SSH 270 Server: Encrypted packet (len=204)
  312 13.758392615 192.168.1.12 → 10.6.15.156  TCP 66 54766 → 22 [ACK] Seq=4361 Ack=28577 Win=6155 Len=0 TSval=8136361 TSecr=15067854
  313 13.801941787  10.6.15.156 → 192.168.1.12 SSH 238 Server: Encrypted packet (len=172)
  314 13.843738284 192.168.1.12 → 10.6.15.156  TCP 66 54766 → 22 [ACK] Seq=4361 Ack=28749 Win=6155 Len=0 TSval=8136383 TSecr=15067872
  315 13.852755284  10.6.15.156 → 192.168.1.12 SSH 238 Server: Encrypted packet (len=172)
  316 13.852780246 192.168.1.12 → 10.6.15.156  TCP 66 54766 → 22 [ACK] Seq=4361 Ack=28921 Win=6155 Len=0 TSval=8136385 TSecr=15067885
  317 13.958874166  10.6.15.156 → 192.168.1.12 SSH 270 Server: Encrypted packet (len=204)
  318 13.958890453 192.168.1.12 → 10.6.15.156  TCP 66 54766 → 22 [ACK] Seq=4361 Ack=29125 Win=6155 Len=0 TSval=8136411 TSecr=15067911
  319 13.976388458  10.6.15.156 → 192.168.1.12 SSH 150 Server: Encrypted packet (len=84)
  320 13.976406378 192.168.1.12 → 10.6.15.156  TCP 66 54766 → 22 [ACK] Seq=4361 Ack=29209 Win=6155 Len=0 TSval=8136416 TSecr=15067915
  321 13.976703906 192.168.1.12 → 10.6.15.156  SSH 150 Client: Encrypted packet (len=84)
  322 13.978747643  10.6.15.156 → 192.168.1.12 TCP 66 22 → 54766 [ACK] Seq=29209 Ack=4445 Win=1452 Len=0 TSval=15067916 TSecr=8136416
  323 14.017641045  10.6.15.156 → 192.168.1.12 SSH 150 Server: Encrypted packet (len=84)
  324 14.017923104 192.168.1.12 → 10.6.15.156  SSH 150 Client: Encrypted packet (len=84)
  325 14.019548398  10.6.15.156 → 192.168.1.12 TCP 66 22 → 54766 [ACK] Seq=29293 Ack=4529 Win=1452 Len=0 TSval=15067927 TSecr=8136426
  326 14.180753997  10.6.15.156 → 192.168.1.12 SSH 214 Server: Encrypted packet (len=148)
  327 14.223735637 192.168.1.12 → 10.6.15.156  TCP 66 54766 → 22 [ACK] Seq=4529 Ack=29441 Win=6155 Len=0 TSval=8136478 TSecr=15067967
  328 14.252447076  10.6.15.156 → 192.168.1.12 SSH 214 Server: Encrypted packet (len=148)
  329 14.252471654 192.168.1.12 → 10.6.15.156  TCP 66 54766 → 22 [ACK] Seq=4529 Ack=29589 Win=6155 Len=0 TSval=8136485 TSecr=15067985
  330 14.304817441  10.6.15.156 → 192.168.1.12 SSH 182 Server: Encrypted packet (len=116)
  331 14.304905200 192.168.1.12 → 10.6.15.156  TCP 66 54766 → 22 [ACK] Seq=4529 Ack=29705 Win=6155 Len=0 TSval=8136498 TSecr=15067998
  332 14.409470402  10.6.15.156 → 192.168.1.12 SSH 182 Server: Encrypted packet (len=116)
  333 14.409543318 192.168.1.12 → 10.6.15.156  TCP 66 54766 → 22 [ACK] Seq=4529 Ack=29821 Win=6155 Len=0 TSval=8136524 TSecr=15068024
  334 14.631742046  10.6.15.156 → 192.168.1.12 SSH 198 Server: Encrypted packet (len=132)
  335 14.631767422 192.168.1.12 → 10.6.15.156  TCP 66 54766 → 22 [ACK] Seq=4529 Ack=29953 Win=6155 Len=0 TSval=8136580 TSecr=15068080
  336 14.703412203  10.6.15.156 → 192.168.1.12 SSH 238 Server: Encrypted packet (len=172)
  337 14.703431925 192.168.1.12 → 10.6.15.156  TCP 66 54766 → 22 [ACK] Seq=4529 Ack=30125 Win=6155 Len=0 TSval=8136597 TSecr=15068097
  338 14.754964695  10.6.15.156 → 192.168.1.12 SSH 238 Server: Encrypted packet (len=172)
  339 14.754981885 192.168.1.12 → 10.6.15.156  TCP 66 54766 → 22 [ACK] Seq=4529 Ack=30297 Win=6155 Len=0 TSval=8136610 TSecr=15068110
  340 14.861015072  10.6.15.156 → 192.168.1.12 SSH 302 Server: Encrypted packet (len=236)
  341 14.861038744 192.168.1.12 → 10.6.15.156  TCP 66 54766 → 22 [ACK] Seq=4529 Ack=30533 Win=6155 Len=0 TSval=8136637 TSecr=15068137
  342 15.082982300  10.6.15.156 → 192.168.1.12 SSH 374 Server: Encrypted packet (len=308)
  343 15.083000448 192.168.1.12 → 10.6.15.156  TCP 66 54766 → 22 [ACK] Seq=4529 Ack=30841 Win=6155 Len=0 TSval=8136692 TSecr=15068192
  344 15.154947410  10.6.15.156 → 192.168.1.12 SSH 406 Server: Encrypted packet (len=340)
  345 15.154965428 192.168.1.12 → 10.6.15.156  TCP 66 54766 → 22 [ACK] Seq=4529 Ack=31181 Win=6155 Len=0 TSval=8136710 TSecr=15068210
  346 15.206138738  10.6.15.156 → 192.168.1.12 SSH 438 Server: Encrypted packet (len=372)
  347 15.206156292 192.168.1.12 → 10.6.15.156  TCP 66 54766 → 22 [ACK] Seq=4529 Ack=31553 Win=6155 Len=0 TSval=8136723 TSecr=15068223
  348 15.311713822  10.6.15.156 → 192.168.1.12 SSH 342 Server: Encrypted packet (len=276)
  349 15.311731068 192.168.1.12 → 10.6.15.156  TCP 66 54766 → 22 [ACK] Seq=4529 Ack=31829 Win=6155 Len=0 TSval=8136750 TSecr=15068250
  350 15.533883336  10.6.15.156 → 192.168.1.12 SSH 286 Server: Encrypted packet (len=220)
  351 15.533901436 192.168.1.12 → 10.6.15.156  TCP 66 54766 → 22 [ACK] Seq=4529 Ack=32049 Win=6155 Len=0 TSval=8136805 TSecr=15068305
  352 15.605599835  10.6.15.156 → 192.168.1.12 SSH 246 Server: Encrypted packet (len=180)
  353 15.605614267 192.168.1.12 → 10.6.15.156  TCP 66 54766 → 22 [ACK] Seq=4529 Ack=32229 Win=6155 Len=0 TSval=8136823 TSecr=15068323
  354 15.657479961  10.6.15.156 → 192.168.1.12 SSH 182 Server: Encrypted packet (len=116)
  355 15.657492309 192.168.1.12 → 10.6.15.156  TCP 66 54766 → 22 [ACK] Seq=4529 Ack=32345 Win=6155 Len=0 TSval=8136836 TSecr=15068336
  356 15.762729524  10.6.15.156 → 192.168.1.12 SSH 182 Server: Encrypted packet (len=116)
  357 15.762747922 192.168.1.12 → 10.6.15.156  TCP 66 54766 → 22 [ACK] Seq=4529 Ack=32461 Win=6155 Len=0 TSval=8136862 TSecr=15068362
  358 15.771827187  10.6.15.156 → 192.168.1.12 SSH 182 Server: [TCP Spurious Retransmission] , Encrypted packet (len=116)
  359 15.771846557 192.168.1.12 → 10.6.15.156  TCP 78 [TCP Dup ACK 357#1] 54766 → 22 [ACK] Seq=4529 Ack=32461 Win=6155 Len=0 TSval=8136865 TSecr=15068365 SLE=32345 SRE=32461
  360 15.984884454  10.6.15.156 → 192.168.1.12 SSH 222 Server: Encrypted packet (len=156)
  361 15.984901799 192.168.1.12 → 10.6.15.156  TCP 66 54766 → 22 [ACK] Seq=4529 Ack=32617 Win=6155 Len=0 TSval=8136918 TSecr=15068418
  362 16.056438399  10.6.15.156 → 192.168.1.12 SSH 238 Server: Encrypted packet (len=172)
  363 16.056455790 192.168.1.12 → 10.6.15.156  TCP 66 54766 → 22 [ACK] Seq=4529 Ack=32789 Win=6155 Len=0 TSval=8136936 TSecr=15068436
  364 16.107833083  10.6.15.156 → 192.168.1.12 SSH 270 Server: Encrypted packet (len=204)
  365 16.107850791 192.168.1.12 → 10.6.15.156  TCP 66 54766 → 22 [ACK] Seq=4529 Ack=32993 Win=6155 Len=0 TSval=8136949 TSecr=15068449
  366 16.213879581  10.6.15.156 → 192.168.1.12 SSH 270 Server: Encrypted packet (len=204)
  367 16.213897106 192.168.1.12 → 10.6.15.156  TCP 66 54766 → 22 [ACK] Seq=4529 Ack=33197 Win=6155 Len=0 TSval=8136975 TSecr=15068475
  368 16.435748624  10.6.15.156 → 192.168.1.12 SSH 270 Server: Encrypted packet (len=204)
  369 16.435765497 192.168.1.12 → 10.6.15.156  TCP 66 54766 → 22 [ACK] Seq=4529 Ack=33401 Win=6155 Len=0 TSval=8137031 TSecr=15068531
  370 16.507353430  10.6.15.156 → 192.168.1.12 SSH 222 Server: Encrypted packet (len=156)
