    1 0.000000000 192.168.1.16 → 10.6.15.145  SSH 102 Client: Encrypted packet (len=36)
    2 0.002923923  10.6.15.145 → 192.168.1.16 TCP 78 22 → 52104 [ACK] Seq=1 Ack=37 Win=1452 Len=0 TSval=24088725 TSecr=1274192 SLE=1 SRE=37
    3 0.411946883 192.168.1.16 → 224.0.0.252  IGMPv2 46 Membership Report group 224.0.0.252
    4 0.962409505 192.168.1.16 → 239.255.255.250 SSDP 213 M-SEARCH * HTTP/1.1 
    5 0.965831383  10.6.15.145 → 192.168.1.16 SSH 102 Server: Encrypted packet (len=36)
    6 0.965853985  10.6.15.145 → 192.168.1.16 SSH 146 Server: Encrypted packet (len=80)
    7 0.965871167  10.6.15.145 → 192.168.1.16 TCP 146 [TCP Retransmission] 22 → 52104 [PSH, ACK] Seq=37 Ack=37 Win=1452 Len=80 TSval=24088936 TSecr=1274192
    8 0.965881694 192.168.1.16 → 10.6.15.145  TCP 78 52104 → 22 [ACK] Seq=37 Ack=117 Win=1444 Len=0 TSval=1274442 TSecr=24088899 SLE=37 SRE=117
    9 0.966227567 192.168.1.16 → 10.6.15.145  SSH 110 Client: Encrypted packet (len=44)
   10 0.969609723  10.6.15.145 → 192.168.1.16 TCP 66 22 → 52104 [ACK] Seq=117 Ack=81 Win=1452 Len=0 TSval=24088967 TSecr=1274442
   11 1.960950765 192.168.1.16 → 224.0.0.251  MDNS 82 Standard query 0x0000 PTR _googlecast._tcp.local, "QM" question
   12 1.961708627 fe80::60bd:1940:a0d8:49f9 → ff02::fb     MDNS 102 Standard query 0x0000 PTR _googlecast._tcp.local, "QM" question
   13 1.961713797 192.168.1.16 → 224.0.0.251  MDNS 82 Standard query 0x0000 PTR _googlecast._tcp.local, "QM" question
   14 1.961715481 fe80::60bd:1940:a0d8:49f9 → ff02::fb     MDNS 102 Standard query 0x0000 PTR _googlecast._tcp.local, "QM" question
   15 1.963183845 192.168.1.16 → 239.255.255.250 SSDP 213 M-SEARCH * HTTP/1.1 
   16 1.965138006  10.22.18.77 → 224.0.0.252  LLMNR 64 Standard query 0x661f A wpad
   17 1.966903073  10.6.15.145 → 192.168.1.16 SSH 1514 Server: Encrypted packet (len=1448)
   18 1.966972395  10.6.15.145 → 192.168.1.16 SSH 1150 Server: Encrypted packet (len=1084)
   19 1.966990243 192.168.1.16 → 10.6.15.145  TCP 66 52104 → 22 [ACK] Seq=81 Ack=2649 Win=1444 Len=0 TSval=1274692 TSecr=24089216
   20 1.977567177 192.168.1.16 → 10.6.15.145  SSH 270 Client: Encrypted packet (len=204)
   21 1.981953544  10.6.15.145 → 192.168.1.16 TCP 66 22 → 52104 [ACK] Seq=2649 Ack=285 Win=1452 Len=0 TSval=24089219 TSecr=1274695
   22 2.961297296 192.168.1.16 → 224.0.0.251  MDNS 82 Standard query 0x0000 PTR _googlecast._tcp.local, "QM" question
   23 2.962104115 fe80::60bd:1940:a0d8:49f9 → ff02::fb     MDNS 102 Standard query 0x0000 PTR _googlecast._tcp.local, "QM" question
   24 2.962110897 192.168.1.16 → 224.0.0.251  MDNS 82 Standard query 0x0000 PTR _googlecast._tcp.local, "QM" question
   25 2.962113734 fe80::60bd:1940:a0d8:49f9 → ff02::fb     MDNS 102 Standard query 0x0000 PTR _googlecast._tcp.local, "QM" question
   26 2.962983230  10.22.18.77 → 224.0.0.252  LLMNR 64 Standard query 0x661f A wpad
   27 2.963746767  10.6.15.145 → 192.168.1.16 SSH 1514 Server: Encrypted packet (len=1448)
   28 2.963949007  10.6.15.145 → 192.168.1.16 SSH 1514 Server: Encrypted packet (len=1448)
   29 2.963970655 192.168.1.16 → 10.6.15.145  TCP 66 52104 → 22 [ACK] Seq=285 Ack=5545 Win=1444 Len=0 TSval=1274942 TSecr=24089297
   30 2.965036671  10.6.15.145 → 192.168.1.16 SSH 430 Server: Encrypted packet (len=364)
   31 2.965255543  10.6.15.145 → 192.168.1.16 SSH 1514 Server: Encrypted packet (len=1448)
   32 2.965290472 192.168.1.16 → 10.6.15.145  TCP 66 52104 → 22 [ACK] Seq=285 Ack=7357 Win=1444 Len=0 TSval=1274942 TSecr=24089297
   33 2.965451361  10.6.15.145 → 192.168.1.16 TCP 1514 [TCP Out-Of-Order] 22 → 52104 [ACK] Seq=2649 Ack=285 Win=1452 Len=1448 TSval=24089436 TSecr=1274695
   34 2.965460290 192.168.1.16 → 10.6.15.145  TCP 78 [TCP Dup ACK 32#1] 52104 → 22 [ACK] Seq=285 Ack=7357 Win=1444 Len=0 TSval=1274942 TSecr=24089297 SLE=2649 SRE=4097
   35 2.973248658  10.6.15.145 → 192.168.1.16 SSH 1514 Server: Encrypted packet (len=1448)
   36 2.973264166 192.168.1.16 → 10.6.15.145  TCP 66 52104 → 22 [ACK] Seq=285 Ack=8805 Win=1433 Len=0 TSval=1274944 TSecr=24089467
   37 2.973430987  10.6.15.145 → 192.168.1.16 SSH 1514 Server: Encrypted packet (len=1448)
   38 2.973435620 192.168.1.16 → 10.6.15.145  TCP 66 52104 → 22 [ACK] Seq=285 Ack=10253 Win=1422 Len=0 TSval=1274944 TSecr=24089467
   39 2.973624355  10.6.15.145 → 192.168.1.16 SSH 1514 Server: Encrypted packet (len=1448)
   40 2.973627569 192.168.1.16 → 10.6.15.145  TCP 66 52104 → 22 [ACK] Seq=285 Ack=11701 Win=1422 Len=0 TSval=1274944 TSecr=24089467
   41 2.976928028  10.6.15.145 → 192.168.1.16 SSH 1514 Server: Encrypted packet (len=1448)
   42 2.976943884 192.168.1.16 → 10.6.15.145  TCP 66 52104 → 22 [ACK] Seq=285 Ack=13149 Win=1422 Len=0 TSval=1274945 TSecr=24089469
   43 2.977110061  10.6.15.145 → 192.168.1.16 SSH 1514 Server: Encrypted packet (len=1448)
   44 2.977114231 192.168.1.16 → 10.6.15.145  TCP 66 52104 → 22 [ACK] Seq=285 Ack=14597 Win=1422 Len=0 TSval=1274945 TSecr=24089469
   45 2.977455957  10.6.15.145 → 192.168.1.16 SSH 1514 Server: Encrypted packet (len=1448)
   46 2.977459979 192.168.1.16 → 10.6.15.145  TCP 66 52104 → 22 [ACK] Seq=285 Ack=16045 Win=1422 Len=0 TSval=1274945 TSecr=24089469
   47 2.977630488  10.6.15.145 → 192.168.1.16 SSH 1394 Server: Encrypted packet (len=1328)
   48 2.977635556 192.168.1.16 → 10.6.15.145  TCP 66 52104 → 22 [ACK] Seq=285 Ack=17373 Win=1422 Len=0 TSval=1274945 TSecr=24089469
   49 3.073739321 192.168.1.16 → 10.6.15.145  SSH 326 Client: Encrypted packet (len=260)
   50 3.078761312  10.6.15.145 → 192.168.1.16 TCP 66 22 → 52104 [ACK] Seq=17373 Ack=545 Win=1452 Len=0 TSval=24089494 TSecr=1274969
   51 4.030409219  10.6.15.145 → 192.168.1.16 SSH 310 Server: Encrypted packet (len=244)
   52 4.030434539 192.168.1.16 → 10.6.15.145  TCP 66 52104 → 22 [ACK] Seq=545 Ack=17617 Win=1443 Len=0 TSval=1275208 TSecr=24089570
   53 4.030449723  10.6.15.145 → 192.168.1.16 SSH 310 Server: [TCP Spurious Retransmission] , Encrypted packet (len=244)
   54 4.030454988 192.168.1.16 → 10.6.15.145  TCP 78 [TCP Dup ACK 52#1] 52104 → 22 [ACK] Seq=545 Ack=17617 Win=1443 Len=0 TSval=1275208 TSecr=24089653 SLE=17373 SRE=17617
   55 4.032534572 192.168.1.16 → 10.6.15.145  SSH 102 Client: Encrypted packet (len=36)
   56 4.033234850 192.168.1.16 → 10.6.15.145  SSH 290 Client: Encrypted packet (len=224)
   57 4.033995048  10.6.15.145 → 192.168.1.16 TCP 66 22 → 52104 [ACK] Seq=17617 Ack=581 Win=1452 Len=0 TSval=24089733 TSecr=1275209
   58 4.034893937  10.6.15.145 → 192.168.1.16 TCP 66 22 → 52104 [ACK] Seq=17617 Ack=805 Win=1452 Len=0 TSval=24089733 TSecr=1275209
   59 4.035441586  10.6.15.145 → 192.168.1.16 SSH 138 Server: Encrypted packet (len=72)
   60 4.035593512 192.168.1.16 → 10.6.15.145  SSH 102 Client: Encrypted packet (len=36)
   61 4.036988100  10.6.15.145 → 192.168.1.16 SSH 210 Server: Encrypted packet (len=144)
   62 4.037016080  10.6.15.145 → 192.168.1.16 SSH 138 Server: Encrypted packet (len=72)
   63 4.037072740 192.168.1.16 → 10.6.15.145  TCP 66 52104 → 22 [ACK] Seq=841 Ack=17905 Win=1444 Len=0 TSval=1275210 TSecr=24089734
   64 4.037275567 192.168.1.16 → 10.6.15.145  SSH 174 Client: Encrypted packet (len=108)
   65 4.070737092  10.6.15.145 → 192.168.1.16 SSH 138 Server: Encrypted packet (len=72)
   66 4.070915735 192.168.1.16 → 10.6.15.145  SSH 102 Client: Encrypted packet (len=36)
   67 4.080608939  10.6.15.145 → 192.168.1.16 SSH 146 Server: Encrypted packet (len=80)
   68 4.080897164 192.168.1.16 → 10.6.15.145  SSH 158 Client: Encrypted packet (len=92)
   69 4.081091249 192.168.1.16 → 10.6.15.145  SSH 150 Client: Encrypted packet (len=84)
   70 4.082511442  10.6.15.145 → 192.168.1.16 TCP 66 22 → 52104 [ACK] Seq=18057 Ack=1161 Win=1452 Len=0 TSval=24089745 TSecr=1275221
   71 4.131778875  10.6.15.145 → 192.168.1.16 SSH 1514 Server: Encrypted packet (len=1448)
   72 4.131954697  10.6.15.145 → 192.168.1.16 SSH 1326 Server: Encrypted packet (len=1260)
   73 4.131966792  10.6.15.145 → 192.168.1.16 SSH 174 Server: Encrypted packet (len=108)
   74 4.132000361  10.6.15.145 → 192.168.1.16 SSH 454 Server: Encrypted packet (len=388)
   75 4.132015855 192.168.1.16 → 10.6.15.145  TCP 66 52104 → 22 [ACK] Seq=1161 Ack=21261 Win=1444 Len=0 TSval=1275234 TSecr=24089757
   76 4.133371506 192.168.1.16 → 10.6.15.145  SSH 206 Client: Encrypted packet (len=140)
   77 4.136047421 192.168.1.16 → 10.6.15.145  SSH 206 Client: Encrypted packet (len=140)
   78 4.136965975 192.168.1.16 → 10.6.15.145  SSH 102 Client: Encrypted packet (len=36)
   79 4.137416251  10.6.15.145 → 192.168.1.16 TCP 66 22 → 52104 [ACK] Seq=21261 Ack=1441 Win=1452 Len=0 TSval=24089759 TSecr=1275234
   80 4.137427557 192.168.1.16 → 10.6.15.145  SSH 258 Client: Encrypted packet (len=192)
   81 4.137733083 192.168.1.16 → 10.6.15.145  SSH 862 Client: Encrypted packet (len=796)
   82 4.138988618  10.6.15.145 → 192.168.1.16 TCP 66 22 → 52104 [ACK] Seq=21261 Ack=1669 Win=1452 Len=0 TSval=24089759 TSecr=1275235
   83 4.176654253  10.6.15.145 → 192.168.1.16 TCP 66 22 → 52104 [ACK] Seq=21261 Ack=2465 Win=1452 Len=0 TSval=24089769 TSecr=1275235
   84 4.180118689  10.6.15.145 → 192.168.1.16 SSH 342 Server: Encrypted packet (len=276)
   85 4.183030402  10.6.15.145 → 192.168.1.16 SSH 318 Server: Encrypted packet (len=252)
   86 4.183048551  10.6.15.145 → 192.168.1.16 SSH 166 Server: Encrypted packet (len=100)
   87 4.183065213  10.6.15.145 → 192.168.1.16 SSH 138 Server: Encrypted packet (len=72)
   88 4.183089764 192.168.1.16 → 10.6.15.145  TCP 66 52104 → 22 [ACK] Seq=2465 Ack=21961 Win=1444 Len=0 TSval=1275246 TSecr=24089769
   89 4.183267418 192.168.1.16 → 10.6.15.145  SSH 102 Client: Encrypted packet (len=36)
   90 4.184615163  10.6.15.145 → 192.168.1.16 TCP 66 22 → 52104 [ACK] Seq=21961 Ack=2501 Win=1452 Len=0 TSval=24089771 TSecr=1275246
   91 4.203029406 192.168.1.16 → 10.6.15.145  SSH 334 Client: Encrypted packet (len=268)
   92 4.203599406 192.168.1.16 → 10.6.15.145  SSH 286 Client: Encrypted packet (len=220)
   93 4.204455575  10.6.15.145 → 192.168.1.16 TCP 66 22 → 52104 [ACK] Seq=21961 Ack=2769 Win=1452 Len=0 TSval=24089776 TSecr=1275251
   94 4.204591174  10.6.15.145 → 192.168.1.16 TCP 66 22 → 52104 [ACK] Seq=21961 Ack=2989 Win=1452 Len=0 TSval=24089776 TSecr=1275251
   95 4.279797796  10.6.15.145 → 192.168.1.16 SSH 334 Server: Encrypted packet (len=268)
   96 4.279820796  10.6.15.145 → 192.168.1.16 SSH 134 Server: Encrypted packet (len=68)
   97 4.279855933 192.168.1.16 → 10.6.15.145  TCP 66 52104 → 22 [ACK] Seq=2989 Ack=22297 Win=1444 Len=0 TSval=1275270 TSecr=24089794
   98 4.280986002 192.168.1.16 → 10.6.15.145  SSH 134 Client: Encrypted packet (len=68)
   99 4.282349783  10.6.15.145 → 192.168.1.16 TCP 66 22 → 52104 [ACK] Seq=22297 Ack=3057 Win=1452 Len=0 TSval=24089795 TSecr=1275271
  100 4.290566407  10.6.15.145 → 192.168.1.16 SSH 630 Server: Encrypted packet (len=564)
  101 4.291243819 192.168.1.16 → 10.6.15.145  SSH 134 Client: Encrypted packet (len=68)
  102 4.332088141  10.6.15.145 → 192.168.1.16 TCP 66 22 → 52104 [ACK] Seq=22861 Ack=3125 Win=1452 Len=0 TSval=24089808 TSecr=1275273
  103 4.962127430 192.168.1.16 → 224.0.0.251  MDNS 82 Standard query 0x0000 PTR _googlecast._tcp.local, "QM" question
  104 4.962891935 fe80::60bd:1940:a0d8:49f9 → ff02::fb     MDNS 102 Standard query 0x0000 PTR _googlecast._tcp.local, "QM" question
  105 4.962896858 192.168.1.16 → 224.0.0.251  MDNS 82 Standard query 0x0000 PTR _googlecast._tcp.local, "QM" question
  106 4.962898520 fe80::60bd:1940:a0d8:49f9 → ff02::fb     MDNS 102 Standard query 0x0000 PTR _googlecast._tcp.local, "QM" question
  107 4.964279707  10.6.15.145 → 192.168.1.16 SSH 174 Server: Encrypted packet (len=108)
  108 4.964302435  10.6.15.145 → 192.168.1.16 TCP 174 [TCP Retransmission] 22 → 52104 [PSH, ACK] Seq=22861 Ack=3125 Win=1452 Len=108 TSval=24089910 TSecr=1275273
  109 4.964308408 192.168.1.16 → 10.6.15.145  TCP 78 52104 → 22 [ACK] Seq=3125 Ack=22969 Win=1444 Len=0 TSval=1275442 TSecr=24089910 SLE=22861 SRE=22969
  110 4.964524456 192.168.1.16 → 10.6.15.145  SSH 126 Client: Encrypted packet (len=60)
  111 4.967533556  10.6.15.145 → 192.168.1.16 TCP 66 22 → 52104 [ACK] Seq=22969 Ack=3185 Win=1452 Len=0 TSval=24089966 TSecr=1275442
  112 5.746692044 192.168.1.16 → 10.6.15.145  SSH 262 Client: Encrypted packet (len=196)
  113 5.747740705 192.168.1.16 → 10.6.15.145  SSH 1158 Client: Encrypted packet (len=1092)
  114 5.748677907  10.6.15.145 → 192.168.1.16 SSH 1514 Server: Encrypted packet (len=1448)
  115 5.748835298  10.6.15.145 → 192.168.1.16 SSH 1514 Server: Encrypted packet (len=1448)
  116 5.748845395  10.6.15.145 → 192.168.1.16 SSH 102 Server: Encrypted packet (len=36)
  117 5.748871534 192.168.1.16 → 10.6.15.145  TCP 66 52104 → 22 [ACK] Seq=4473 Ack=25901 Win=1444 Len=0 TSval=1275638 TSecr=24090132
  118 5.749176550  10.6.15.145 → 192.168.1.16 SSH 1514 Server: Encrypted packet (len=1448)
  119 5.749185481  10.6.15.145 → 192.168.1.16 TCP 66 22 → 52104 [ACK] Seq=27349 Ack=3381 Win=1452 Len=0 TSval=24090162 TSecr=1275637
  120 5.750136654  10.6.15.145 → 192.168.1.16 TCP 66 22 → 52104 [ACK] Seq=27349 Ack=4473 Win=1452 Len=0 TSval=24090162 TSecr=1275637
  121 5.754119461  10.6.15.145 → 192.168.1.16 SSH 1514 Server: Encrypted packet (len=1448)
  122 5.754168961 192.168.1.16 → 10.6.15.145  TCP 66 52104 → 22 [ACK] Seq=4473 Ack=28797 Win=1444 Len=0 TSval=1275639 TSecr=24090133
  123 5.756514437  10.6.15.145 → 192.168.1.16 SSH 1514 Server: Encrypted packet (len=1448)
  124 5.756699574  10.6.15.145 → 192.168.1.16 SSH 1514 Server: Encrypted packet (len=1448)
  125 5.756737220 192.168.1.16 → 10.6.15.145  TCP 66 52104 → 22 [ACK] Seq=4473 Ack=31693 Win=1444 Len=0 TSval=1275640 TSecr=24090163
  126 5.756891815  10.6.15.145 → 192.168.1.16 SSH 1514 Server: Encrypted packet (len=1448)
  127 5.759085100  10.6.15.145 → 192.168.1.16 SSH 1514 Server: Encrypted packet (len=1448)
  128 5.759147713 192.168.1.16 → 10.6.15.145  TCP 66 52104 → 22 [ACK] Seq=4473 Ack=34589 Win=1444 Len=0 TSval=1275640 TSecr=24090163
  129 5.759263240  10.6.15.145 → 192.168.1.16 SSH 1514 Server: Encrypted packet (len=1448)
  130 5.761292184  10.6.15.145 → 192.168.1.16 SSH 1514 Server: Encrypted packet (len=1448)
  131 5.761357731 192.168.1.16 → 10.6.15.145  TCP 66 52104 → 22 [ACK] Seq=4473 Ack=37485 Win=1444 Len=0 TSval=1275641 TSecr=24090164
  132 5.761472395  10.6.15.145 → 192.168.1.16 SSH 1514 Server: Encrypted packet (len=1448)
  133 5.763594357  10.6.15.145 → 192.168.1.16 SSH 1514 Server: Encrypted packet (len=1448)
  134 5.763662794 192.168.1.16 → 10.6.15.145  TCP 66 52104 → 22 [ACK] Seq=4473 Ack=40381 Win=1444 Len=0 TSval=1275641 TSecr=24090165
  135 5.763776259  10.6.15.145 → 192.168.1.16 SSH 1514 Server: Encrypted packet (len=1448)
  136 5.765705314  10.6.15.145 → 192.168.1.16 SSH 1514 Server: Encrypted packet (len=1448)
  137 5.765768357 192.168.1.16 → 10.6.15.145  TCP 66 52104 → 22 [ACK] Seq=4473 Ack=43277 Win=1444 Len=0 TSval=1275642 TSecr=24090165
  138 5.765887834  10.6.15.145 → 192.168.1.16 SSH 1514 Server: Encrypted packet (len=1448)
  139 5.767782901  10.6.15.145 → 192.168.1.16 SSH 1514 Server: Encrypted packet (len=1448)
  140 5.767846288 192.168.1.16 → 10.6.15.145  TCP 66 52104 → 22 [ACK] Seq=4473 Ack=46173 Win=1444 Len=0 TSval=1275642 TSecr=24090166
  141 5.769817569 192.168.1.16 → 10.6.15.145  SSH 118 Client: Encrypted packet (len=52)
  142 5.770539767  10.6.15.145 → 192.168.1.16 SSH 1514 Server: Encrypted packet (len=1448)
  143 5.772076636  10.6.15.145 → 192.168.1.16 SSH 1514 Server: Encrypted packet (len=1448)
  144 5.772147798 192.168.1.16 → 10.6.15.145  TCP 66 52104 → 22 [ACK] Seq=4525 Ack=49069 Win=1444 Len=0 TSval=1275644 TSecr=24090166
  145 5.772255086  10.6.15.145 → 192.168.1.16 SSH 1514 Server: Encrypted packet (len=1448)
  146 5.774442622  10.6.15.145 → 192.168.1.16 SSH 1514 Server: Encrypted packet (len=1448)
  147 5.774512128 192.168.1.16 → 10.6.15.145  TCP 66 52104 → 22 [ACK] Seq=4525 Ack=51965 Win=1444 Len=0 TSval=1275644 TSecr=24090167
  148 5.774623184  10.6.15.145 → 192.168.1.16 SSH 1514 Server: Encrypted packet (len=1448)
  149 5.776617668  10.6.15.145 → 192.168.1.16 SSH 1514 Server: Encrypted packet (len=1448)
  150 5.776675605 192.168.1.16 → 10.6.15.145  TCP 66 52104 → 22 [ACK] Seq=4525 Ack=54861 Win=1444 Len=0 TSval=1275645 TSecr=24090168
  151 5.776798406  10.6.15.145 → 192.168.1.16 SSH 1514 Server: Encrypted packet (len=1448)
  152 5.778920472  10.6.15.145 → 192.168.1.16 SSH 1514 Server: Encrypted packet (len=1448)
  153 5.778981645 192.168.1.16 → 10.6.15.145  TCP 66 52104 → 22 [ACK] Seq=4525 Ack=57757 Win=1444 Len=0 TSval=1275645 TSecr=24090169
  154 5.779104737  10.6.15.145 → 192.168.1.16 SSH 1514 Server: Encrypted packet (len=1448)
  155 5.781172761  10.6.15.145 → 192.168.1.16 SSH 1514 Server: Encrypted packet (len=1448)
  156 5.781248972 192.168.1.16 → 10.6.15.145  TCP 66 52104 → 22 [ACK] Seq=4525 Ack=60653 Win=1444 Len=0 TSval=1275646 TSecr=24090169
  157 5.781343371  10.6.15.145 → 192.168.1.16 SSH 1514 Server: Encrypted packet (len=1448)
  158 5.784426485  10.6.15.145 → 192.168.1.16 SSH 1514 Server: Encrypted packet (len=1448)
  159 5.784491432 192.168.1.16 → 10.6.15.145  TCP 66 52104 → 22 [ACK] Seq=4525 Ack=63549 Win=1444 Len=0 TSval=1275647 TSecr=24090170
  160 5.784736733  10.6.15.145 → 192.168.1.16 SSH 1514 Server: Encrypted packet (len=1448)
  161 5.787671850  10.6.15.145 → 192.168.1.16 SSH 1514 Server: Encrypted packet (len=1448)
  162 5.787738127 192.168.1.16 → 10.6.15.145  TCP 66 52104 → 22 [ACK] Seq=4525 Ack=66445 Win=1444 Len=0 TSval=1275647 TSecr=24090170
  163 5.787853514  10.6.15.145 → 192.168.1.16 SSH 1514 Server: Encrypted packet (len=1448)
  164 5.787941308 192.168.1.16 → 224.0.0.252  IGMPv2 46 Membership Report group 224.0.0.252
  165 5.790714600  10.6.15.145 → 192.168.1.16 SSH 1514 Server: Encrypted packet (len=1448)
  166 5.790779662 192.168.1.16 → 10.6.15.145  TCP 66 52104 → 22 [ACK] Seq=4525 Ack=69341 Win=1444 Len=0 TSval=1275648 TSecr=24090171
  167 5.790895816  10.6.15.145 → 192.168.1.16 SSH 1514 Server: Encrypted packet (len=1448)
  168 5.793128666  10.6.15.145 → 192.168.1.16 SSH 1514 Server: Encrypted packet (len=1448)
  169 5.793185790 192.168.1.16 → 10.6.15.145  TCP 66 52104 → 22 [ACK] Seq=4525 Ack=72237 Win=1444 Len=0 TSval=1275649 TSecr=24090172
  170 5.793313112  10.6.15.145 → 192.168.1.16 SSH 1514 Server: Encrypted packet (len=1448)
  171 5.795436752  10.6.15.145 → 192.168.1.16 SSH 1514 Server: Encrypted packet (len=1448)
  172 5.795498190 192.168.1.16 → 10.6.15.145  TCP 66 52104 → 22 [ACK] Seq=4525 Ack=75133 Win=1444 Len=0 TSval=1275649 TSecr=24090173
  173 5.795618885  10.6.15.145 → 192.168.1.16 SSH 1514 Server: Encrypted packet (len=1448)
  174 5.796434520 192.168.1.16 → 10.6.15.145  SSH 102 Client: Encrypted packet (len=36)
  175 5.797666829  10.6.15.145 → 192.168.1.16 SSH 1514 Server: Encrypted packet (len=1448)
  176 5.797853032  10.6.15.145 → 192.168.1.16 SSH 1514 Server: Encrypted packet (len=1448)
  177 5.797877030 192.168.1.16 → 10.6.15.145  TCP 66 52104 → 22 [ACK] Seq=4561 Ack=79477 Win=1444 Len=0 TSval=1275650 TSecr=24090174
  178 5.798212489  10.6.15.145 → 192.168.1.16 SSH 1514 Server: Encrypted packet (len=1448)
  179 5.798532823  10.6.15.145 → 192.168.1.16 SSH 1514 Server: Encrypted packet (len=1448)
  180 5.798549400 192.168.1.16 → 10.6.15.145  TCP 66 52104 → 22 [ACK] Seq=4561 Ack=82373 Win=1444 Len=0 TSval=1275650 TSecr=24090174
  181 5.800596574  10.6.15.145 → 192.168.1.16 SSH 1514 Server: Encrypted packet (len=1448)
  182 5.800775291  10.6.15.145 → 192.168.1.16 SSH 1514 Server: Encrypted packet (len=1448)
  183 5.800806023 192.168.1.16 → 10.6.15.145  TCP 66 52104 → 22 [ACK] Seq=4561 Ack=85269 Win=1444 Len=0 TSval=1275651 TSecr=24090175
  184 5.801114297  10.6.15.145 → 192.168.1.16 SSH 1514 Server: Encrypted packet (len=1448)
  185 5.801307383  10.6.15.145 → 192.168.1.16 SSH 1514 Server: Encrypted packet (len=1448)
  186 5.801339876 192.168.1.16 → 10.6.15.145  TCP 66 52104 → 22 [ACK] Seq=4561 Ack=88165 Win=1444 Len=0 TSval=1275651 TSecr=24090175
  187 5.803510818  10.6.15.145 → 192.168.1.16 SSH 578 Server: Encrypted packet (len=512)
  188 5.843942023 192.168.1.16 → 10.6.15.145  TCP 66 52104 → 22 [ACK] Seq=4561 Ack=88677 Win=1444 Len=0 TSval=1275662 TSecr=24090175
  189 7.006565137  10.6.15.145 → 192.168.1.16 SSH 1514 Server: Encrypted packet (len=1448)
  190 7.006591985 192.168.1.16 → 10.6.15.145  TCP 66 52104 → 22 [ACK] Seq=4561 Ack=90125 Win=1433 Len=0 TSval=1275952 TSecr=24090308
  191 7.006726524  10.6.15.145 → 192.168.1.16 SSH 1514 Server: Encrypted packet (len=1448)
  192 7.006735489 192.168.1.16 → 10.6.15.145  TCP 66 52104 → 22 [ACK] Seq=4561 Ack=91573 Win=1422 Len=0 TSval=1275952 TSecr=24090308
  193 7.006917531  10.6.15.145 → 192.168.1.16 SSH 1514 Server: Encrypted packet (len=1448)
  194 7.006930946 192.168.1.16 → 10.6.15.145  TCP 66 52104 → 22 [ACK] Seq=4561 Ack=93021 Win=1422 Len=0 TSval=1275952 TSecr=24090308
  195 7.007108218  10.6.15.145 → 192.168.1.16 SSH 1514 Server: Encrypted packet (len=1448)
  196 7.007118414 192.168.1.16 → 10.6.15.145  TCP 66 52104 → 22 [ACK] Seq=4561 Ack=94469 Win=1422 Len=0 TSval=1275952 TSecr=24090308
  197 7.007279902  10.6.15.145 → 192.168.1.16 SSH 1514 Server: Encrypted packet (len=1448)
  198 7.007287069 192.168.1.16 → 10.6.15.145  TCP 66 52104 → 22 [ACK] Seq=4561 Ack=95917 Win=1422 Len=0 TSval=1275952 TSecr=24090308
  199 7.007465154  10.6.15.145 → 192.168.1.16 SSH 1514 Server: Encrypted packet (len=1448)
  200 7.007468586 192.168.1.16 → 10.6.15.145  TCP 66 52104 → 22 [ACK] Seq=4561 Ack=97365 Win=1422 Len=0 TSval=1275952 TSecr=24090316
  201 7.007657889  10.6.15.145 → 192.168.1.16 TCP 1514 [TCP Out-Of-Order] 22 → 52104 [ACK] Seq=88677 Ack=4561 Win=1452 Len=1448 TSval=24090370 TSecr=1275662
  202 7.007663547 192.168.1.16 → 10.6.15.145  TCP 78 [TCP Window Update] 52104 → 22 [ACK] Seq=4561 Ack=97365 Win=1444 Len=0 TSval=1275952 TSecr=24090316 SLE=88677 SRE=90125
  203 7.010865698  10.6.15.145 → 192.168.1.16 SSH 1514 Server: Encrypted packet (len=1448)
  204 7.010881410 192.168.1.16 → 10.6.15.145  TCP 66 52104 → 22 [ACK] Seq=4561 Ack=98813 Win=1433 Len=0 TSval=1275953 TSecr=24090477
  205 7.011061269  10.6.15.145 → 192.168.1.16 SSH 1514 Server: Encrypted packet (len=1448)
  206 7.011066028 192.168.1.16 → 10.6.15.145  TCP 66 52104 → 22 [ACK] Seq=4561 Ack=100261 Win=1422 Len=0 TSval=1275953 TSecr=24090477
  207 7.011230491  10.6.15.145 → 192.168.1.16 SSH 1514 Server: Encrypted packet (len=1448)
  208 7.011232986 192.168.1.16 → 10.6.15.145  TCP 66 52104 → 22 [ACK] Seq=4561 Ack=101709 Win=1422 Len=0 TSval=1275953 TSecr=24090477
  209 7.011405353  10.6.15.145 → 192.168.1.16 SSH 1402 Server: Encrypted packet (len=1336)
  210 7.011407675 192.168.1.16 → 10.6.15.145  TCP 66 52104 → 22 [ACK] Seq=4561 Ack=103045 Win=1422 Len=0 TSval=1275953 TSecr=24090477
  211 7.012790750 192.168.1.16 → 10.6.15.145  SSH 166 Client: Encrypted packet (len=100)
  212 7.012994390 192.168.1.16 → 10.6.15.145  SSH 226 Client: Encrypted packet (len=160)
  213 7.014357186  10.6.15.145 → 192.168.1.16 TCP 66 22 → 52104 [ACK] Seq=103045 Ack=4821 Win=1452 Len=0 TSval=24090478 TSecr=1275954
  214 7.015351287 192.168.1.16 → 10.6.15.145  SSH 1470 Client: Encrypted packet (len=1404)
  215 7.056371280  10.6.15.145 → 192.168.1.16 TCP 66 22 → 52104 [ACK] Seq=103045 Ack=6225 Win=1452 Len=0 TSval=24090489 TSecr=1275954
  216 7.057118599  10.6.15.145 → 192.168.1.16 SSH 174 Server: Encrypted packet (len=108)
  217 7.057143372  10.6.15.145 → 192.168.1.16 SSH 102 Server: Encrypted packet (len=36)
  218 7.057201215 192.168.1.16 → 10.6.15.145  TCP 66 52104 → 22 [ACK] Seq=6225 Ack=103189 Win=1444 Len=0 TSval=1275965 TSecr=24090489
  219 7.057465041 192.168.1.16 → 10.6.15.145  SSH 138 Client: Encrypted packet (len=72)
  220 7.059124237  10.6.15.145 → 192.168.1.16 TCP 66 22 → 52104 [ACK] Seq=103189 Ack=6297 Win=1452 Len=0 TSval=24090489 TSecr=1275965
  221 7.059253554  10.6.15.145 → 192.168.1.16 SSH 102 Server: Encrypted packet (len=36)
  222 7.062727227  10.6.15.145 → 192.168.1.16 SSH 1514 Server: Encrypted packet (len=1448)
  223 7.062796796 192.168.1.16 → 10.6.15.145  TCP 66 52104 → 22 [ACK] Seq=6297 Ack=104673 Win=1444 Len=0 TSval=1275966 TSecr=24090489
  224 7.062898510  10.6.15.145 → 192.168.1.16 SSH 1514 Server: Encrypted packet (len=1448)
  225 7.063030580  10.6.15.145 → 192.168.1.16 SSH 166 Server: Encrypted packet (len=100)
  226 7.063056289 192.168.1.16 → 10.6.15.145  TCP 66 52104 → 22 [ACK] Seq=6297 Ack=106221 Win=1444 Len=0 TSval=1275966 TSecr=24090490
  227 7.063075184  10.6.15.145 → 192.168.1.16 SSH 526 Server: Encrypted packet (len=460)
  228 7.064029924 192.168.1.16 → 10.6.15.145  SSH 206 Client: Encrypted packet (len=140)
  229 7.065614206 192.168.1.16 → 10.6.15.145  SSH 206 Client: Encrypted packet (len=140)
  230 7.066248338 192.168.1.16 → 10.6.15.145  SSH 102 Client: Encrypted packet (len=36)
  231 7.068717602  10.6.15.145 → 192.168.1.16 TCP 66 22 → 52104 [ACK] Seq=106681 Ack=6577 Win=1452 Len=0 TSval=24090491 TSecr=1275967
  232 7.068741664 192.168.1.16 → 10.6.15.145  SSH 674 Client: Encrypted packet (len=608)
  233 7.095941775 192.168.1.16 → 10.6.15.145  TCP 674 [TCP Retransmission] 52104 → 22 [PSH, ACK] Seq=6613 Ack=106681 Win=1444 Len=608 TSval=1275975 TSecr=24090491
  234 7.101182449  10.6.15.145 → 192.168.1.16 TCP 78 [TCP Dup ACK 231#1] 22 → 52104 [ACK] Seq=106681 Ack=6577 Win=1452 Len=0 TSval=24090499 TSecr=1275967 SLE=6613 SRE=7221
  235 7.101198453  10.6.15.145 → 192.168.1.16 TCP 86 [TCP Dup ACK 231#2] 22 → 52104 [ACK] Seq=106681 Ack=6577 Win=1452 Len=0 TSval=24090499 TSecr=1275967 SLE=6613 SRE=7221 SLE=6613 SRE=7221
  236 7.111421114  10.6.15.145 → 192.168.1.16 SSH 362 Server: Encrypted packet (len=284)
  237 7.112565430  10.6.15.145 → 192.168.1.16 SSH 330 Server: Encrypted packet (len=252)
  238 7.112640082 192.168.1.16 → 10.6.15.145  TCP 66 52104 → 22 [ACK] Seq=7221 Ack=107217 Win=1444 Len=0 TSval=1275979 TSecr=24090502
  239 7.148829520  10.6.15.145 → 192.168.1.16 SSH 786 Server: Encrypted packet (len=708)
  240 7.148853698  10.6.15.145 → 192.168.1.16 SSH 370 Server: Encrypted packet (len=292)
  241 7.148908330 192.168.1.16 → 10.6.15.145  TCP 66 52104 → 22 [ACK] Seq=7221 Ack=108217 Win=1444 Len=0 TSval=1275988 TSecr=24090512
  242 7.165053530  10.6.15.145 → 192.168.1.16 SSH 362 Server: Encrypted packet (len=284)
  243 7.165079497  10.6.15.145 → 192.168.1.16 SSH 154 Server: Encrypted packet (len=76)
  244 7.165134248 192.168.1.16 → 10.6.15.145  TCP 66 52104 → 22 [ACK] Seq=7221 Ack=108577 Win=1444 Len=0 TSval=1275992 TSecr=24090512
  245 7.165550384 192.168.1.16 → 10.6.15.145  SSH 134 Client: Encrypted packet (len=68)
  246 7.311997627 192.168.1.16 → 10.6.15.145  TCP 102 [TCP Retransmission] 52104 → 22 [PSH, ACK] Seq=6577 Ack=108577 Win=1444 Len=36 TSval=1276029 TSecr=24090512
  247 7.380033856  10.6.15.145 → 192.168.1.16 SSH 154 Server: [TCP Spurious Retransmission] , Encrypted packet (len=76)
  248 7.380054066 192.168.1.16 → 10.6.15.145  TCP 78 [TCP Dup ACK 244#1] 52104 → 22 [ACK] Seq=7289 Ack=108577 Win=1444 Len=0 TSval=1276046 TSecr=24090570 SLE=108501 SRE=108577
  249 7.739959558 192.168.1.16 → 10.6.15.145  TCP 102 [TCP Retransmission] 52104 → 22 [PSH, ACK] Seq=6577 Ack=108577 Win=1444 Len=36 TSval=1276136 TSecr=24090570
  250 8.603995404 192.168.1.16 → 10.6.15.145  TCP 102 [TCP Retransmission] 52104 → 22 [PSH, ACK] Seq=6577 Ack=108577 Win=1444 Len=36 TSval=1276352 TSecr=24090570
  251 8.606453672  10.6.15.145 → 192.168.1.16 TCP 66 22 → 52104 [ACK] Seq=108577 Ack=7221 Win=1451 Len=0 TSval=24090697 TSecr=1276136
  252 8.606477843 192.168.1.16 → 10.6.15.145  TCP 134 [TCP Retransmission] 52104 → 22 [PSH, ACK] Seq=7221 Ack=108577 Win=1444 Len=68 TSval=1276352 TSecr=24090697
  253 8.606494560  10.6.15.145 → 192.168.1.16 SSH 166 Server: Encrypted packet (len=100)
  254 8.606507505 192.168.1.16 → 10.6.15.145  TCP 66 52104 → 22 [ACK] Seq=7289 Ack=108677 Win=1444 Len=0 TSval=1276352 TSecr=24090708
  255 8.606513357  10.6.15.145 → 192.168.1.16 SSH 246 Server: Encrypted packet (len=180)
  256 8.606517291 192.168.1.16 → 10.6.15.145  TCP 66 52104 → 22 [ACK] Seq=7289 Ack=108857 Win=1443 Len=0 TSval=1276352 TSecr=24090708
  257 8.606703034  10.6.15.145 → 192.168.1.16 SSH 654 Server: Encrypted packet (len=588)
  258 8.606706747 192.168.1.16 → 10.6.15.145  TCP 66 52104 → 22 [ACK] Seq=7289 Ack=109445 Win=1439 Len=0 TSval=1276352 TSecr=24090708
  259 8.606927792  10.6.15.145 → 192.168.1.16 SSH 1514 Server: Encrypted packet (len=1448)
  260 8.606931668 192.168.1.16 → 10.6.15.145  TCP 66 52104 → 22 [ACK] Seq=7289 Ack=110893 Win=1428 Len=0 TSval=1276352 TSecr=24090709
  261 8.607050128  10.6.15.145 → 192.168.1.16 SSH 110 Server: Encrypted packet (len=44)
  262 8.607058096 192.168.1.16 → 10.6.15.145  TCP 66 52104 → 22 [ACK] Seq=7289 Ack=110937 Win=1428 Len=0 TSval=1276352 TSecr=24090709
  263 8.607281737  10.6.15.145 → 192.168.1.16 SSH 1514 Server: Encrypted packet (len=1448)
  264 8.607290418 192.168.1.16 → 10.6.15.145  TCP 66 52104 → 22 [ACK] Seq=7289 Ack=112385 Win=1422 Len=0 TSval=1276352 TSecr=24090791
  265 8.607302260  10.6.15.145 → 192.168.1.16 TCP 78 [TCP Dup ACK 251#1] 22 → 52104 [ACK] Seq=112385 Ack=7221 Win=1452 Len=0 TSval=24090876 TSecr=1276136 SLE=6577 SRE=6613
  266 8.607309225 192.168.1.16 → 10.6.15.145  SSH 162 Client: Encrypted packet (len=96)
  267 8.610234463  10.6.15.145 → 192.168.1.16 TCP 66 22 → 52104 [ACK] Seq=112385 Ack=7289 Win=1452 Len=0 TSval=24090877 TSecr=1276352
  268 8.610460938  10.6.15.145 → 192.168.1.16 SSH 1514 Server: Encrypted packet (len=1448)
  269 8.610802904  10.6.15.145 → 192.168.1.16 SSH 1514 Server: Encrypted packet (len=1448)
  270 8.610815546 192.168.1.16 → 10.6.15.145  TCP 66 52104 → 22 [ACK] Seq=7385 Ack=115281 Win=1422 Len=0 TSval=1276353 TSecr=24090877
  271 8.610993022  10.6.15.145 → 192.168.1.16 SSH 1514 Server: Encrypted packet (len=1448)
  272 8.611343055  10.6.15.145 → 192.168.1.16 SSH 1514 Server: Encrypted packet (len=1448)
  273 8.611355352 192.168.1.16 → 10.6.15.145  TCP 66 52104 → 22 [ACK] Seq=7385 Ack=118177 Win=1422 Len=0 TSval=1276353 TSecr=24090877
  274 8.611530463  10.6.15.145 → 192.168.1.16 SSH 1514 Server: Encrypted packet (len=1448)
  275 8.613675912 192.168.1.16 → 10.6.15.145  SSH 110 Client: Encrypted packet (len=44)
  276 8.616981842  10.6.15.145 → 192.168.1.16 SSH 1514 Server: Encrypted packet (len=1448)
  277 8.616997053 192.168.1.16 → 10.6.15.145  SSH 206 Client: Encrypted packet (len=140)
  278 8.617157611  10.6.15.145 → 192.168.1.16 SSH 1514 Server: Encrypted packet (len=1448)
  279 8.617350809  10.6.15.145 → 192.168.1.16 SSH 1514 Server: Encrypted packet (len=1448)
  280 8.617389897 192.168.1.16 → 10.6.15.145  TCP 66 52104 → 22 [ACK] Seq=7569 Ack=123969 Win=1444 Len=0 TSval=1276355 TSecr=24090878
  281 8.617541301  10.6.15.145 → 192.168.1.16 SSH 1514 Server: Encrypted packet (len=1448)
  282 8.650050850  10.6.15.145 → 192.168.1.16 SSH 1514 Server: Encrypted packet (len=1436)
  283 8.650080235 192.168.1.16 → 10.6.15.145  TCP 66 52104 → 22 [ACK] Seq=7569 Ack=126853 Win=1422 Len=0 TSval=1276363 TSecr=24090878
  284 8.650333127  10.6.15.145 → 192.168.1.16 SSH 1514 Server: Encrypted packet (len=1436)
  285 8.650342414  10.6.15.145 → 192.168.1.16 SSH 102 Server: Encrypted packet (len=24)
  286 8.650346913 192.168.1.16 → 10.6.15.145  TCP 66 52104 → 22 [ACK] Seq=7569 Ack=128313 Win=1422 Len=0 TSval=1276363 TSecr=24090887
  287 8.663021645  10.6.15.145 → 192.168.1.16 SSH 1514 Server: Encrypted packet (len=1436)
  288 8.663206687  10.6.15.145 → 192.168.1.16 SSH 1514 Server: Encrypted packet (len=1436)
  289 8.663218739 192.168.1.16 → 10.6.15.145  TCP 66 52104 → 22 [ACK] Seq=7569 Ack=131185 Win=1422 Len=0 TSval=1276366 TSecr=24090887
  290 8.663230028  10.6.15.145 → 192.168.1.16 SSH 102 Server: Encrypted packet (len=24)
  291 8.663399557  10.6.15.145 → 192.168.1.16 SSH 1514 Server: Encrypted packet (len=1436)
  292 8.663404883 192.168.1.16 → 10.6.15.145  TCP 66 52104 → 22 [ACK] Seq=7569 Ack=132645 Win=1422 Len=0 TSval=1276366 TSecr=24090888
  293 8.663611777  10.6.15.145 → 192.168.1.16 SSH 1514 Server: Encrypted packet (len=1436)
  294 8.663617515  10.6.15.145 → 192.168.1.16 SSH 102 Server: Encrypted packet (len=24)
  295 8.663620952 192.168.1.16 → 10.6.15.145  TCP 66 52104 → 22 [ACK] Seq=7569 Ack=134105 Win=1422 Len=0 TSval=1276366 TSecr=24090888
  296 8.667688304  10.6.15.145 → 192.168.1.16 SSH 1514 Server: Encrypted packet (len=1436)
  297 8.667849543  10.6.15.145 → 192.168.1.16 SSH 1514 Server: Encrypted packet (len=1436)
  298 8.667857490 192.168.1.16 → 10.6.15.145  TCP 66 52104 → 22 [ACK] Seq=7569 Ack=136977 Win=1422 Len=0 TSval=1276367 TSecr=24090891
  299 8.668014210  10.6.15.145 → 192.168.1.16 SSH 102 Server: Encrypted packet (len=24)
  300 8.668245797  10.6.15.145 → 192.168.1.16 SSH 1514 Server: Encrypted packet (len=1436)
  301 8.668256242 192.168.1.16 → 10.6.15.145  TCP 66 52104 → 22 [ACK] Seq=7569 Ack=138437 Win=1422 Len=0 TSval=1276368 TSecr=24090891
  302 8.668436566  10.6.15.145 → 192.168.1.16 SSH 1514 Server: Encrypted packet (len=1436)
  303 8.668447182  10.6.15.145 → 192.168.1.16 SSH 102 Server: Encrypted packet (len=24)
  304 8.668452188 192.168.1.16 → 10.6.15.145  TCP 66 52104 → 22 [ACK] Seq=7569 Ack=139897 Win=1422 Len=0 TSval=1276368 TSecr=24090891
  305 8.671497697  10.6.15.145 → 192.168.1.16 SSH 1514 Server: Encrypted packet (len=1436)
  306 8.671678945  10.6.15.145 → 192.168.1.16 SSH 1514 Server: Encrypted packet (len=1436)
  307 8.671685349 192.168.1.16 → 10.6.15.145  TCP 66 52104 → 22 [ACK] Seq=7569 Ack=142769 Win=1422 Len=0 TSval=1276368 TSecr=24090892
  308 8.671692644  10.6.15.145 → 192.168.1.16 SSH 102 Server: Encrypted packet (len=24)
  309 8.672050047  10.6.15.145 → 192.168.1.16 SSH 1514 Server: Encrypted packet (len=1436)
  310 8.672060374 192.168.1.16 → 10.6.15.145  TCP 66 52104 → 22 [ACK] Seq=7569 Ack=144229 Win=1422 Len=0 TSval=1276369 TSecr=24090892
  311 8.672242784  10.6.15.145 → 192.168.1.16 SSH 1514 Server: Encrypted packet (len=1436)
  312 8.672253125  10.6.15.145 → 192.168.1.16 SSH 102 Server: Encrypted packet (len=24)
  313 8.672258281 192.168.1.16 → 10.6.15.145  TCP 66 52104 → 22 [ACK] Seq=7569 Ack=145689 Win=1422 Len=0 TSval=1276369 TSecr=24090892
  314 8.694917544  10.6.15.145 → 192.168.1.16 SSH 1514 Server: Encrypted packet (len=1436)
  315 8.695128580  10.6.15.145 → 192.168.1.16 SSH 1514 Server: Encrypted packet (len=1436)
  316 8.695140677 192.168.1.16 → 10.6.15.145  TCP 66 52104 → 22 [ACK] Seq=7569 Ack=148561 Win=1422 Len=0 TSval=1276374 TSecr=24090894
  317 8.695151440  10.6.15.145 → 192.168.1.16 SSH 102 Server: Encrypted packet (len=24)
  318 8.695334249  10.6.15.145 → 192.168.1.16 SSH 1514 Server: Encrypted packet (len=1436)
  319 8.695342489 192.168.1.16 → 10.6.15.145  TCP 66 52104 → 22 [ACK] Seq=7569 Ack=150021 Win=1422 Len=0 TSval=1276374 TSecr=24090894
  320 8.695545416  10.6.15.145 → 192.168.1.16 SSH 1514 Server: Encrypted packet (len=1436)
  321 8.695550686  10.6.15.145 → 192.168.1.16 SSH 102 Server: Encrypted packet (len=24)
  322 8.695553733 192.168.1.16 → 10.6.15.145  TCP 66 52104 → 22 [ACK] Seq=7569 Ack=151481 Win=1422 Len=0 TSval=1276374 TSecr=24090894
  323 8.765254398  10.6.15.145 → 192.168.1.16 SSH 1514 Server: Encrypted packet (len=1436)
  324 8.765354707  10.6.15.145 → 192.168.1.16 SSH 782 Server: Encrypted packet (len=704)
  325 8.765366291 192.168.1.16 → 10.6.15.145  TCP 66 52104 → 22 [ACK] Seq=7569 Ack=153621 Win=1422 Len=0 TSval=1276392 TSecr=24090900
  326 8.791440369 192.168.1.16 → 10.6.15.145  SSH 110 Client: Encrypted packet (len=44)
  327 8.793351912  10.6.15.145 → 192.168.1.16 TCP 78 [TCP Dup ACK 276#1] 22 → 52104 [ACK] Seq=153621 Ack=7385 Win=1452 Len=0 TSval=24090923 TSecr=1276353 SLE=7429 SRE=7613
  328 8.793374312 192.168.1.16 → 10.6.15.145  SSH 442 Client: Encrypted packet (len=376)
  329 8.795526939  10.6.15.145 → 192.168.1.16 TCP 78 [TCP Dup ACK 276#2] 22 → 52104 [ACK] Seq=153621 Ack=7385 Win=1452 Len=0 TSval=24090923 TSecr=1276353 SLE=7429 SRE=7989
  330 8.795544816 192.168.1.16 → 10.6.15.145  SSH 110 Client: [TCP Fast Retransmission] , Encrypted packet (len=44)
  331 8.797730057  10.6.15.145 → 192.168.1.16 TCP 66 22 → 52104 [ACK] Seq=153621 Ack=7989 Win=1449 Len=0 TSval=24090924 TSecr=1276399
  332 8.797757950 192.168.1.16 → 10.6.15.145  SSH 598 Client: Encrypted packet (len=532)
  333 8.799872105  10.6.15.145 → 192.168.1.16 TCP 66 22 → 52104 [ACK] Seq=153621 Ack=8521 Win=1452 Len=0 TSval=24090924 TSecr=1276400
  334 8.801077373 192.168.1.16 → 10.6.15.145  SSH 238 Client: Encrypted packet (len=172)
  335 8.801884314 192.168.1.16 → 10.6.15.145  SSH 246 Client: Encrypted packet (len=180)
  336 8.802591344  10.6.15.145 → 192.168.1.16 TCP 66 22 → 52104 [ACK] Seq=153621 Ack=8693 Win=1452 Len=0 TSval=24090925 TSecr=1276401
  337 8.802611084 192.168.1.16 → 10.6.15.145  SSH 238 Client: Encrypted packet (len=172)
  338 8.804687427  10.6.15.145 → 192.168.1.16 TCP 66 22 → 52104 [ACK] Seq=153621 Ack=8873 Win=1452 Len=0 TSval=24090925 TSecr=1276401
  339 8.804711447 192.168.1.16 → 10.6.15.145  SSH 722 Client: Encrypted packet (len=656)
  340 8.806517158  10.6.15.145 → 192.168.1.16 TCP 66 22 → 52104 [ACK] Seq=153621 Ack=9045 Win=1452 Len=0 TSval=24090926 TSecr=1276401
  341 8.806528210 192.168.1.16 → 10.6.15.145  SSH 102 Client: Encrypted packet (len=36)
  342 8.813841454  10.6.15.145 → 192.168.1.16 TCP 66 22 → 52104 [ACK] Seq=153621 Ack=9701 Win=1447 Len=0 TSval=24090926 TSecr=1276402
  343 8.826184020 192.168.1.16 → 10.6.15.145  SSH 310 Client: Encrypted packet (len=244)
  344 8.849156621  10.6.15.145 → 192.168.1.16 TCP 78 [TCP Dup ACK 342#1] 22 → 52104 [ACK] Seq=153621 Ack=9701 Win=1447 Len=0 TSval=24090937 TSecr=1276402 SLE=9737 SRE=9981
  345 8.849174210 192.168.1.16 → 10.6.15.145  SSH 102 Client: Encrypted packet (len=36)
  346 8.850656959  10.6.15.145 → 192.168.1.16 TCP 78 [TCP Dup ACK 342#2] 22 → 52104 [ACK] Seq=153621 Ack=9701 Win=1447 Len=0 TSval=24090937 TSecr=1276402 SLE=9737 SRE=10017
  347 8.850668555 192.168.1.16 → 10.6.15.145  SSH 102 Client: Encrypted packet (len=36)
  348 8.852059056  10.6.15.145 → 192.168.1.16 TCP 78 [TCP Dup ACK 342#3] 22 → 52104 [ACK] Seq=153621 Ack=9701 Win=1447 Len=0 TSval=24090938 TSecr=1276402 SLE=9737 SRE=10053
  349 8.852069745 192.168.1.16 → 10.6.15.145  SSH 102 Client: [TCP Fast Retransmission] , Encrypted packet (len=36)
  350 8.853491290  10.6.15.145 → 192.168.1.16 TCP 66 22 → 52104 [ACK] Seq=153621 Ack=10053 Win=1445 Len=0 TSval=24090938 TSecr=1276414
  351 8.856359879 192.168.1.16 → 10.6.15.145  SSH 102 Client: Encrypted packet (len=36)
  352 8.857659769  10.6.15.145 → 192.168.1.16 TCP 66 22 → 52104 [ACK] Seq=153621 Ack=10089 Win=1445 Len=0 TSval=24090939 TSecr=1276415
  353 8.989004642 192.168.1.16 → 10.6.15.145  SSH 310 Client: Encrypted packet (len=244)
  354 8.991298760  10.6.15.145 → 192.168.1.16 TCP 66 22 → 52104 [ACK] Seq=153621 Ack=10333 Win=1444 Len=0 TSval=24090972 TSecr=1276448
  355 9.006365046 192.168.1.16 → 10.6.15.145  SSH 134 Client: Encrypted packet (len=68)
  356 9.008324500  10.6.15.145 → 192.168.1.16 TCP 66 22 → 52104 [ACK] Seq=153621 Ack=10401 Win=1444 Len=0 TSval=24090976 TSecr=1276452
  357 10.065890971  10.6.15.145 → 192.168.1.16 SSH 110 Server: Encrypted packet (len=44)
  358 10.066254493 192.168.1.16 → 10.6.15.145  SSH 174 Client: Encrypted packet (len=108)
  359 10.067988559  10.6.15.145 → 192.168.1.16 TCP 66 22 → 52104 [ACK] Seq=153665 Ack=10509 Win=1452 Len=0 TSval=24091241 TSecr=1276717
  360 10.072515747  10.6.15.145 → 192.168.1.16 SSH 1514 Server: Encrypted packet (len=1448)
  361 10.072749222  10.6.15.145 → 192.168.1.16 SSH 814 Server: Encrypted packet (len=748)
  362 10.072815234 192.168.1.16 → 10.6.15.145  TCP 66 52104 → 22 [ACK] Seq=10509 Ack=155861 Win=1444 Len=0 TSval=1276719 TSecr=24091242
  363 10.073926769 192.168.1.16 → 10.6.15.145  SSH 334 Client: Encrypted packet (len=268)
  364 10.078905902  10.6.15.145 → 192.168.1.16 SSH 494 Server: Encrypted packet (len=428)
