    1 0.000000000 192.168.1.16 → 10.6.15.145  SSH 164 Client: Encrypted packet (len=96)
    2 0.002900140  10.6.15.145 → 192.168.1.16 TCP 68 22 → 52104 [ACK] Seq=1 Ack=97 Win=1452 Len=0 TSval=24111980 TSecr=1297456
    3 0.002925888 192.168.1.16 → 10.6.15.145  SSH 1092 Client: Encrypted packet (len=1024)
    4 0.005728752  10.6.15.145 → 192.168.1.16 TCP 68 22 → 52104 [ACK] Seq=1 Ack=1121 Win=1452 Len=0 TSval=24111981 TSecr=1297456
    5 0.009071527  10.6.15.145 → 192.168.1.16 SSH 184 Server: Encrypted packet (len=116)
    6 0.009179262    127.0.0.1 → 127.0.0.1    Socks 78 Version: 5 Connect to server request Command Request - Connect
    7 0.009191045    127.0.0.1 → 127.0.0.1    Socks 78 Version: 5 Connect to server request Command Request - Connect
    8 0.009195225    127.0.0.1 → 127.0.0.1    Socks 78 Version: 5 Connect to server request Command Request - Connect
    9 0.009335848    127.0.0.1 → 127.0.0.1    Socks 286 Version: 5 Connect to server response
   10 0.009345799    127.0.0.1 → 127.0.0.1    TCP 68 1080 → 46964 [ACK] Seq=11 Ack=219 Win=350 Len=0 TSval=1297458 TSecr=1297458
   11 0.009393768    127.0.0.1 → 127.0.0.1    Socks 286 Version: 5 Connect to server response
   12 0.009397554    127.0.0.1 → 127.0.0.1    TCP 68 1080 → 46966 [ACK] Seq=11 Ack=219 Win=350 Len=0 TSval=1297458 TSecr=1297458
   13 0.009428003    127.0.0.1 → 127.0.0.1    Socks 286 Version: 5 Connect to server response
   14 0.009430228 192.168.1.16 → 10.6.15.145  SSH 184 Client: Encrypted packet (len=116)
   15 0.009431553    127.0.0.1 → 127.0.0.1    TCP 68 1080 → 46968 [ACK] Seq=11 Ack=219 Win=350 Len=0 TSval=1297458 TSecr=1297458
   16 0.009653464 192.168.1.16 → 10.6.15.145  SSH 244 Client: Encrypted packet (len=176)
   17 0.010695715  10.6.15.145 → 192.168.1.16 SSH 140 Server: Encrypted packet (len=72)
   18 0.010770314    127.0.0.1 → 127.0.0.1    Socks 78 Version: 5 Connect to server request Command Request - Connect
   19 0.010787029    127.0.0.1 → 127.0.0.1    Socks 78 Version: 5 Connect to server request Command Request - Connect
   20 0.010908870    127.0.0.1 → 127.0.0.1    Socks 281 Version: 5 Connect to server response
   21 0.010917673    127.0.0.1 → 127.0.0.1    TCP 68 1080 → 46970 [ACK] Seq=11 Ack=214 Win=350 Len=0 TSval=1297458 TSecr=1297458
   22 0.011076999    127.0.0.1 → 127.0.0.1    Socks 585 Version: 5 Connect to server response
   23 0.011084927    127.0.0.1 → 127.0.0.1    TCP 68 1080 → 46972 [ACK] Seq=11 Ack=518 Win=350 Len=0 TSval=1297458 TSecr=1297458
   24 0.011291958  10.6.15.145 → 192.168.1.16 TCP 68 22 → 52104 [ACK] Seq=189 Ack=1413 Win=1452 Len=0 TSval=24111983 TSecr=1297458
   25 0.011301967 192.168.1.16 → 10.6.15.145  SSH 564 Client: Encrypted packet (len=496)
   26 0.015320468  10.6.15.145 → 192.168.1.16 SSH 1516 Server: Encrypted packet (len=1448)
   27 0.015346083  10.6.15.145 → 192.168.1.16 SSH 648 Server: Encrypted packet (len=580)
   28 0.015354692 192.168.1.16 → 10.6.15.145  TCP 68 52104 → 22 [ACK] Seq=1909 Ack=2217 Win=6157 Len=0 TSval=1297459 TSecr=24111983
   29 0.015492496    127.0.0.1 → 127.0.0.1    Socks 2851 Version: 5
   30 0.015526542    127.0.0.1 → 127.0.0.1    TCP 68 46964 → 1080 [ACK] Seq=219 Ack=2794 Win=1365 Len=0 TSval=1297459 TSecr=1297459
   31 0.015827736  10.6.15.145 → 192.168.1.16 SSH 492 Server: Encrypted packet (len=424)
   32 0.015908402    127.0.0.1 → 127.0.0.1    Socks 2852 Version: 5
   33 0.015917243    127.0.0.1 → 127.0.0.1    Socks 2852 Version: 5
   34 0.016401769  10.6.15.145 → 192.168.1.16 SSH 208 Server: Encrypted packet (len=140)
   35 0.016430813 192.168.1.16 → 10.6.15.145  TCP 68 52104 → 22 [ACK] Seq=1909 Ack=2781 Win=6157 Len=0 TSval=1297460 TSecr=24111983
   36 0.016467793    127.0.0.1 → 127.0.0.1    Socks 228 Version: 5
   37 0.016513083    127.0.0.1 → 127.0.0.1    Socks 326 Version: 5
   38 0.016661002 192.168.1.16 → 10.6.15.145  SSH 344 Client: Encrypted packet (len=276)
   39 0.017292346    127.0.0.1 → 127.0.0.1    TCP 68 46966 → 1080 [ACK] Seq=219 Ack=2795 Win=1365 Len=0 TSval=1297460 TSecr=1297459
   40 0.017947470    127.0.0.1 → 127.0.0.1    Socks 326 Version: 5
   41 0.018196087 192.168.1.16 → 10.6.15.145  SSH 336 Client: Encrypted packet (len=268)
   42 0.018614417    127.0.0.1 → 127.0.0.1    TCP 68 46968 → 1080 [ACK] Seq=219 Ack=2795 Win=1365 Len=0 TSval=1297460 TSecr=1297459
   43 0.018682830  10.6.15.145 → 192.168.1.16 SSH 1304 Server: Encrypted packet (len=1236)
   44 0.018753881    127.0.0.1 → 127.0.0.1    Socks 3036 Version: 5
   45 0.019292285    127.0.0.1 → 127.0.0.1    Socks 326 Version: 5
   46 0.019835788  10.6.15.145 → 192.168.1.16 TCP 68 22 → 52104 [ACK] Seq=4017 Ack=2453 Win=1452 Len=0 TSval=24111985 TSecr=1297460
   47 0.019844365 192.168.1.16 → 10.6.15.145  SSH 336 Client: Encrypted packet (len=268)
   48 0.020131754    127.0.0.1 → 127.0.0.1    Socks 284 Version: 5
   49 0.020240456 192.168.1.16 → 10.6.15.145  SSH 304 Client: Encrypted packet (len=236)
   50 0.020772386    127.0.0.1 → 127.0.0.1    TCP 68 46970 → 1080 [ACK] Seq=214 Ack=2979 Win=1365 Len=0 TSval=1297461 TSecr=1297460
   51 0.021557292    127.0.0.1 → 127.0.0.1    Socks 326 Version: 5
   52 0.021575850  10.6.15.145 → 192.168.1.16 SSH 488 Server: Encrypted packet (len=420)
   53 0.021733293    127.0.0.1 → 127.0.0.1    Socks 458 Version: 5
   54 0.021743927 192.168.1.16 → 10.6.15.145  SSH 336 Client: Encrypted packet (len=268)
   55 0.023032531  10.6.15.145 → 192.168.1.16 SSH 456 Server: Encrypted packet (len=388)
   56 0.023130367    127.0.0.1 → 127.0.0.1    Socks 458 Version: 5
   57 0.023993890  10.6.15.145 → 192.168.1.16 SSH 456 Server: Encrypted packet (len=388)
   58 0.024052039 192.168.1.16 → 10.6.15.145  TCP 68 52104 → 22 [ACK] Seq=3225 Ack=5213 Win=6157 Len=0 TSval=1297462 TSecr=24111985
   59 0.024094745    127.0.0.1 → 127.0.0.1    Socks 458 Version: 5
   60 0.024417295  10.6.15.145 → 192.168.1.16 SSH 168 Server: Encrypted packet (len=100)
   61 0.024476545    127.0.0.1 → 127.0.0.1    Socks 137 Version: 5
   62 0.026321020  10.6.15.145 → 192.168.1.16 SSH 456 Server: Encrypted packet (len=388)
   63 0.026380872 192.168.1.16 → 10.6.15.145  TCP 68 52104 → 22 [ACK] Seq=3225 Ack=5701 Win=6157 Len=0 TSval=1297462 TSecr=24111986
   64 0.026415993    127.0.0.1 → 127.0.0.1    Socks 458 Version: 5
   65 0.036357385  10.6.15.145 → 192.168.1.16 SSH 104 Server: Encrypted packet (len=36)
   66 0.036494314    127.0.0.1 → 127.0.0.1    Socks 78 Version: 5 Connect to server request Command Request - Connect
   67 0.036630347    127.0.0.1 → 127.0.0.1    Socks 585 Version: 5 Connect to server response
   68 0.036639567    127.0.0.1 → 127.0.0.1    TCP 68 1080 → 46922 [ACK] Seq=11 Ack=518 Win=350 Len=0 TSval=1297465 TSecr=1297465
   69 0.036783928 192.168.1.16 → 10.6.15.145  SSH 456 Client: Encrypted packet (len=388)
   70 0.055563610  10.6.15.145 → 192.168.1.16 SSH 144 Server: Encrypted packet (len=76)
   71 0.055708361    127.0.0.1 → 127.0.0.1    Socks 114 Unknown
   72 0.055718600    127.0.0.1 → 127.0.0.1    TCP 68 46602 → 1080 [ACK] Seq=1 Ack=47 Win=18423 Len=0 TSval=1297469 TSecr=1297469
   73 0.064019380    127.0.0.1 → 127.0.0.1    TCP 68 46964 → 1080 [ACK] Seq=477 Ack=3184 Win=1408 Len=0 TSval=1297472 TSecr=1297461
   74 0.064019378    127.0.0.1 → 127.0.0.1    TCP 68 46966 → 1080 [ACK] Seq=477 Ack=3185 Win=1408 Len=0 TSval=1297472 TSecr=1297461
   75 0.067989905    127.0.0.1 → 127.0.0.1    TCP 68 46970 → 1080 [ACK] Seq=472 Ack=3369 Win=1411 Len=0 TSval=1297473 TSecr=1297462
   76 0.067991682    127.0.0.1 → 127.0.0.1    TCP 68 46972 → 1080 [ACK] Seq=734 Ack=240 Win=350 Len=0 TSval=1297473 TSecr=1297462
   77 0.067993361    127.0.0.1 → 127.0.0.1    TCP 68 46968 → 1080 [ACK] Seq=477 Ack=3185 Win=1408 Len=0 TSval=1297473 TSecr=1297462
   78 0.074262316  10.6.15.145 → 192.168.1.16 SSH 224 Server: Encrypted packet (len=156)
   79 0.074342024 192.168.1.16 → 10.6.15.145  TCP 68 52104 → 22 [ACK] Seq=3613 Ack=5969 Win=6157 Len=0 TSval=1297474 TSecr=24111994
   80 0.074386114    127.0.0.1 → 127.0.0.1    Socks 219 Version: 5
   81 0.074670682    127.0.0.1 → 127.0.0.1    Socks 284 Version: 5
   82 0.074789737 192.168.1.16 → 10.6.15.145  SSH 296 Client: Encrypted packet (len=228)
   83 0.075453879    127.0.0.1 → 127.0.0.1    Socks 283 Version: 5
   84 0.075489547    127.0.0.1 → 127.0.0.1    TCP 68 1080 → 46922 [ACK] Seq=162 Ack=949 Win=367 Len=0 TSval=1297474 TSecr=1297474
   85 0.075572263 192.168.1.16 → 10.6.15.145  SSH 320 Client: Encrypted packet (len=252)
   86 0.077279791  10.6.15.145 → 192.168.1.16 TCP 68 22 → 52104 [ACK] Seq=5969 Ack=4093 Win=1452 Len=0 TSval=24111999 TSecr=1297474
   87 0.083635257 fe80::60bd:1940:a0d8:49f9 → ff02::1:3    LLMNR 95 Standard query 0x95d5 ANY theenterprise
   88 0.083679167 192.168.1.16 → 224.0.0.252  LLMNR 75 Standard query 0xe98c ANY theenterprise
   89 0.083724376 fe80::60bd:1940:a0d8:49f9 → fe80::60bd:1940:a0d8:49f9 LLMNR 123 Standard query response 0x95d5 ANY theenterprise AAAA fe80::60bd:1940:a0d8:49f9
   90 0.083751134 192.168.1.16 → 192.168.1.16 LLMNR 91 Standard query response 0xe98c ANY theenterprise A 192.168.1.16
   91 0.096032754 fe80::60bd:1940:a0d8:49f9 → ff02::16     ICMPv6 92 Multicast Listener Report Message v2
   92 0.111160477  10.6.15.145 → 192.168.1.16 SSH 128 Server: Encrypted packet (len=60)
   93 0.111260254    127.0.0.1 → 127.0.0.1    Socks 98 Version: 5
   94 0.115444972  10.6.15.145 → 192.168.1.16 SSH 216 Server: Encrypted packet (len=148)
   95 0.115518851 192.168.1.16 → 10.6.15.145  TCP 68 52104 → 22 [ACK] Seq=4093 Ack=6177 Win=6157 Len=0 TSval=1297484 TSecr=24112007
   96 0.115563574    127.0.0.1 → 127.0.0.1    Socks 186 Version: 5
   97 0.115614775    127.0.0.1 → 127.0.0.1    TCP 68 46922 → 1080 [ACK] Seq=949 Ack=310 Win=350 Len=0 TSval=1297484 TSecr=1297483
   98 0.117688962  10.6.15.145 → 192.168.1.16 SSH 240 Server: Encrypted packet (len=172)
   99 0.117791047    127.0.0.1 → 127.0.0.1    Socks 202 Version: 5
  100 0.160019340 192.168.1.16 → 10.6.15.145  TCP 68 52104 → 22 [ACK] Seq=4093 Ack=6349 Win=6157 Len=0 TSval=1297496 TSecr=24112009
  101 0.160021235    127.0.0.1 → 127.0.0.1    TCP 68 46922 → 1080 [ACK] Seq=949 Ack=444 Win=359 Len=0 TSval=1297496 TSecr=1297485
  102 0.160582428  10.6.15.145 → 192.168.1.16 SSH 148 Server: Encrypted packet (len=80)
  103 0.160642994 192.168.1.16 → 10.6.15.145  TCP 68 52104 → 22 [ACK] Seq=4093 Ack=6429 Win=6157 Len=0 TSval=1297496 TSecr=24112020
  104 0.160689675    127.0.0.1 → 127.0.0.1    Socks 78 Version: 5 Connect to server request Command Request - Connect
  105 0.160700909    127.0.0.1 → 127.0.0.1    Socks 78 Version: 5 Connect to server request Command Request - Connect
  106 0.160834169    127.0.0.1 → 127.0.0.1    Socks 585 Version: 5 Connect to server response
  107 0.160842823    127.0.0.1 → 127.0.0.1    TCP 68 1080 → 46950 [ACK] Seq=11 Ack=518 Win=350 Len=0 TSval=1297496 TSecr=1297496
  108 0.160892639    127.0.0.1 → 127.0.0.1    Socks 585 Version: 5 Connect to server response
  109 0.160896541    127.0.0.1 → 127.0.0.1    TCP 68 1080 → 46952 [ACK] Seq=11 Ack=518 Win=350 Len=0 TSval=1297496 TSecr=1297496
  110 0.160974801 192.168.1.16 → 10.6.15.145  SSH 392 Client: Encrypted packet (len=324)
  111 0.161246668 192.168.1.16 → 10.6.15.145  SSH 160 Client: Encrypted packet (len=92)
  112 0.161379106  10.6.15.145 → 192.168.1.16 SSH 104 Server: Encrypted packet (len=36)
  113 0.161479172    127.0.0.1 → 127.0.0.1    Socks 78 Version: 5 Connect to server request Command Request - Connect
  114 0.161616127    127.0.0.1 → 127.0.0.1    Socks 585 Version: 5 Connect to server response
  115 0.161624306    127.0.0.1 → 127.0.0.1    TCP 68 1080 → 46948 [ACK] Seq=11 Ack=518 Win=350 Len=0 TSval=1297496 TSecr=1297496
  116 0.161710836 192.168.1.16 → 10.6.15.145  SSH 160 Client: Encrypted packet (len=92)
  117 0.162678868  10.6.15.145 → 192.168.1.16 TCP 68 22 → 52104 [ACK] Seq=6465 Ack=4509 Win=1452 Len=0 TSval=24112020 TSecr=1297496
  118 0.199854010  10.6.15.145 → 192.168.1.16 TCP 68 22 → 52104 [ACK] Seq=6465 Ack=4601 Win=1452 Len=0 TSval=24112030 TSecr=1297496
  119 0.214343317  10.6.15.145 → 192.168.1.16 SSH 104 Server: Encrypted packet (len=36)
  120 0.214454730    127.0.0.1 → 127.0.0.1    Socks 78 Version: 5 Connect to server request Command Request - Connect
  121 0.214597032    127.0.0.1 → 127.0.0.1    Socks 310 Version: 5 Connect to server response
  122 0.214605957    127.0.0.1 → 127.0.0.1    TCP 68 1080 → 46956 [ACK] Seq=11 Ack=243 Win=350 Len=0 TSval=1297509 TSecr=1297509
  123 0.214704453 192.168.1.16 → 10.6.15.145  SSH 216 Client: Encrypted packet (len=148)
  124 0.216208340  10.6.15.145 → 192.168.1.16 TCP 68 22 → 52104 [ACK] Seq=6501 Ack=4749 Win=1452 Len=0 TSval=24112034 TSecr=1297509
  125 0.217158452  10.6.15.145 → 192.168.1.16 SSH 104 Server: Encrypted packet (len=36)
  126 0.217272348    127.0.0.1 → 127.0.0.1    Socks 78 Version: 5 Connect to server request Command Request - Connect
  127 0.217409205    127.0.0.1 → 127.0.0.1    Socks 312 Version: 5 Connect to server response
  128 0.217417872    127.0.0.1 → 127.0.0.1    TCP 68 1080 → 46962 [ACK] Seq=11 Ack=245 Win=350 Len=0 TSval=1297510 TSecr=1297510
  129 0.217503269 192.168.1.16 → 10.6.15.145  SSH 208 Client: Encrypted packet (len=140)
  130 0.220646916  10.6.15.145 → 192.168.1.16 SSH 104 Server: Encrypted packet (len=36)
  131 0.220762260    127.0.0.1 → 127.0.0.1    Socks 78 Version: 5 Connect to server request Command Request - Connect
  132 0.220901105    127.0.0.1 → 127.0.0.1    Socks 310 Version: 5 Connect to server response
  133 0.220909248    127.0.0.1 → 127.0.0.1    TCP 68 1080 → 46954 [ACK] Seq=11 Ack=243 Win=350 Len=0 TSval=1297511 TSecr=1297511
  134 0.220994947 192.168.1.16 → 10.6.15.145  SSH 160 Client: Encrypted packet (len=92)
  135 0.221366891  10.6.15.145 → 192.168.1.16 SSH 104 Server: Encrypted packet (len=36)
  136 0.221480225    127.0.0.1 → 127.0.0.1    Socks 78 Version: 5 Connect to server request Command Request - Connect
  137 0.221617800    127.0.0.1 → 127.0.0.1    Socks 310 Version: 5 Connect to server response
  138 0.221626621    127.0.0.1 → 127.0.0.1    TCP 68 1080 → 46958 [ACK] Seq=11 Ack=243 Win=350 Len=0 TSval=1297511 TSecr=1297511
  139 0.221710053 192.168.1.16 → 10.6.15.145  SSH 152 Client: Encrypted packet (len=84)
  140 0.223008873  10.6.15.145 → 192.168.1.16 TCP 68 22 → 52104 [ACK] Seq=6609 Ack=5065 Win=1452 Len=0 TSval=24112035 TSecr=1297511
  141 0.251306204  10.6.15.145 → 192.168.1.16 SSH 104 Server: Encrypted packet (len=36)
  142 0.251403678    127.0.0.1 → 127.0.0.1    Socks 78 Version: 5 Connect to server request Command Request - Connect
  143 0.251543955    127.0.0.1 → 127.0.0.1    Socks 306 Version: 5 Connect to server response
  144 0.251552957    127.0.0.1 → 127.0.0.1    TCP 68 1080 → 46946 [ACK] Seq=11 Ack=239 Win=350 Len=0 TSval=1297518 TSecr=1297518
  145 0.251638088 192.168.1.16 → 10.6.15.145  SSH 200 Client: Encrypted packet (len=132)
  146 0.263818443  10.6.15.145 → 192.168.1.16 SSH 104 Server: Encrypted packet (len=36)
  147 0.263909763    127.0.0.1 → 127.0.0.1    Socks 78 Version: 5 Connect to server request Command Request - Connect
  148 0.303990974 192.168.1.16 → 10.6.15.145  TCP 68 52104 → 22 [ACK] Seq=5197 Ack=6681 Win=6157 Len=0 TSval=1297532 TSecr=24112046
  149 0.303994432    127.0.0.1 → 127.0.0.1    TCP 68 46944 → 1080 [ACK] Seq=1 Ack=11 Win=342 Len=0 TSval=1297532 TSecr=1297521
  150 0.318102819  10.6.15.145 → 192.168.1.16 SSH 232 Server: Encrypted packet (len=164)
  151 0.318130765  10.6.15.145 → 192.168.1.16 SSH 184 Server: Encrypted packet (len=116)
  152 0.318188054 192.168.1.16 → 10.6.15.145  TCP 68 52104 → 22 [ACK] Seq=5197 Ack=6961 Win=6157 Len=0 TSval=1297535 TSecr=24112059
  153 0.318238369    127.0.0.1 → 127.0.0.1    Socks 205 Version: 5
  154 0.318251115    127.0.0.1 → 127.0.0.1    Socks 205 Version: 5
  155 0.318347430    127.0.0.1 → 127.0.0.1    Socks 119 Version: 5
  156 0.318356831    127.0.0.1 → 127.0.0.1    TCP 68 1080 → 46950 [ACK] Seq=148 Ack=569 Win=350 Len=0 TSval=1297535 TSecr=1297535
  157 0.318422224 192.168.1.16 → 10.6.15.145  SSH 144 Client: Encrypted packet (len=76)
  158 0.318553579    127.0.0.1 → 127.0.0.1    Socks 119 Version: 5
  159 0.318559243    127.0.0.1 → 127.0.0.1    TCP 68 1080 → 46952 [ACK] Seq=148 Ack=569 Win=350 Len=0 TSval=1297535 TSecr=1297535
  160 0.318630427 192.168.1.16 → 10.6.15.145  SSH 136 Client: Encrypted packet (len=68)
  161 0.319692520  10.6.15.145 → 192.168.1.16 SSH 184 Server: Encrypted packet (len=116)
  162 0.319798752    127.0.0.1 → 127.0.0.1    Socks 205 Version: 5
  163 0.319900952    127.0.0.1 → 127.0.0.1    Socks 119 Version: 5
  164 0.319909856    127.0.0.1 → 127.0.0.1    TCP 68 1080 → 46948 [ACK] Seq=148 Ack=569 Win=350 Len=0 TSval=1297535 TSecr=1297535
  165 0.319995466 192.168.1.16 → 10.6.15.145  SSH 136 Client: Encrypted packet (len=68)
  166 0.321440910  10.6.15.145 → 192.168.1.16 TCP 68 22 → 52104 [ACK] Seq=7077 Ack=5409 Win=1452 Len=0 TSval=24112060 TSecr=1297535
  167 1.007519063    127.0.0.1 → 127.0.0.1    TCP 68 46922 → 1080 [FIN, ACK] Seq=949 Ack=444 Win=359 Len=0 TSval=1297707 TSecr=1297485
  168 1.007629478 192.168.1.16 → 10.6.15.145  SSH 104 Client: Encrypted packet (len=36)
  169 1.007666623    127.0.0.1 → 127.0.0.1    TCP 76 47014 → 1080 [SYN] Seq=0 Win=43690 Len=0 MSS=65495 SACK_PERM=1 TSval=1297707 TSecr=0 WS=128
  170 1.007675631    127.0.0.1 → 127.0.0.1    TCP 76 1080 → 47014 [SYN, ACK] Seq=0 Ack=1 Win=43690 Len=0 MSS=65495 SACK_PERM=1 TSval=1297707 TSecr=1297707 WS=128
  171 1.007683608    127.0.0.1 → 127.0.0.1    TCP 68 47014 → 1080 [ACK] Seq=1 Ack=1 Win=43776 Len=0 TSval=1297707 TSecr=1297707
  172 1.007986555    127.0.0.1 → 127.0.0.1    Socks 71 Version: 5 Connect to server request
  173 1.007994196    127.0.0.1 → 127.0.0.1    TCP 68 1080 → 47014 [ACK] Seq=1 Ack=4 Win=43776 Len=0 TSval=1297708 TSecr=1297708
  174 1.008042674    127.0.0.1 → 127.0.0.1    Socks 70 Version: 5 Connect to server response
  175 1.008064021    127.0.0.1 → 127.0.0.1    TCP 68 47014 → 1080 [ACK] Seq=4 Ack=3 Win=43776 Len=0 TSval=1297708 TSecr=1297708
  176 1.008080925    127.0.0.1 → 127.0.0.1    Socks 91 Version: 5 Command Request - Connect
  177 1.008410916 192.168.1.16 → 239.255.255.250 SSDP 215 M-SEARCH * HTTP/1.1 
  178 1.008574535 192.168.1.16 → 10.6.15.145  SSH 104 Client: Encrypted packet (len=36)
  179 1.009002440  10.6.15.145 → 192.168.1.16 SSH 232 Server: Encrypted packet (len=164)
  180 1.009030270  10.6.15.145 → 192.168.1.16 SSH 232 Server: Encrypted packet (len=164)
  181 1.009076754 192.168.1.16 → 10.6.15.145  TCP 68 52104 → 22 [ACK] Seq=5481 Ack=7405 Win=6157 Len=0 TSval=1297708 TSecr=24112086
  182 1.009127387    127.0.0.1 → 127.0.0.1    Socks 198 Version: 5
  183 1.009139792    127.0.0.1 → 127.0.0.1    Socks 211 Version: 5
  184 1.009212991    127.0.0.1 → 127.0.0.1    Socks 119 Version: 5
  185 1.009220178    127.0.0.1 → 127.0.0.1    TCP 68 1080 → 46956 [ACK] Seq=141 Ack=294 Win=350 Len=0 TSval=1297708 TSecr=1297708
  186 1.009271083 192.168.1.16 → 10.6.15.145  SSH 152 Client: Encrypted packet (len=84)
  187 1.009386396    127.0.0.1 → 127.0.0.1    Socks 119 Version: 5
  188 1.009391891    127.0.0.1 → 127.0.0.1    TCP 68 1080 → 46962 [ACK] Seq=154 Ack=296 Win=350 Len=0 TSval=1297708 TSecr=1297708
  189 1.009635562 192.168.1.16 → 10.6.15.145  SSH 136 Client: Encrypted packet (len=68)
  190 1.009638437    127.0.0.1 → 127.0.0.1    TCP 68 46944 → 1080 [FIN, ACK] Seq=1 Ack=11 Win=342 Len=0 TSval=1297708 TSecr=1297521
  191 1.009683603    127.0.0.1 → 127.0.0.1    TCP 76 47016 → 1080 [SYN] Seq=0 Win=43690 Len=0 MSS=65495 SACK_PERM=1 TSval=1297708 TSecr=0 WS=128
  192 1.009688607    127.0.0.1 → 127.0.0.1    TCP 76 1080 → 47016 [SYN, ACK] Seq=0 Ack=1 Win=43690 Len=0 MSS=65495 SACK_PERM=1 TSval=1297708 TSecr=1297708 WS=128
  193 1.009694054    127.0.0.1 → 127.0.0.1    TCP 68 47016 → 1080 [ACK] Seq=1 Ack=1 Win=43776 Len=0 TSval=1297708 TSecr=1297708
  194 1.009752596    127.0.0.1 → 127.0.0.1    Socks 71 Version: 5 Connect to server request
  195 1.009756577    127.0.0.1 → 127.0.0.1    TCP 68 1080 → 47016 [ACK] Seq=1 Ack=4 Win=43776 Len=0 TSval=1297708 TSecr=1297708
  196 1.009786032    127.0.0.1 → 127.0.0.1    Socks 70 Version: 5 Connect to server response
  197 1.009788951    127.0.0.1 → 127.0.0.1    TCP 68 47016 → 1080 [ACK] Seq=4 Ack=3 Win=43776 Len=0 TSval=1297708 TSecr=1297708
  198 1.009840936    127.0.0.1 → 127.0.0.1    Socks 89 Version: 5 Command Request - Connect
  199 1.012371070  10.6.15.145 → 192.168.1.16 SSH 176 Server: Encrypted packet (len=108)
  200 1.012393163  10.6.15.145 → 192.168.1.16 SSH 184 Server: Encrypted packet (len=116)
  201 1.012404113  10.6.15.145 → 192.168.1.16 SSH 104 Server: Encrypted packet (len=36)
  202 1.012445263 192.168.1.16 → 10.6.15.145  TCP 68 52104 → 22 [ACK] Seq=5633 Ack=7665 Win=6157 Len=0 TSval=1297709 TSecr=24112089
  203 1.012496017    127.0.0.1 → 127.0.0.1    Socks 198 Version: 5
  204 1.012507688    127.0.0.1 → 127.0.0.1    Socks 198 Version: 5
  205 1.012514816    127.0.0.1 → 127.0.0.1    Socks 78 Version: 5 Connect to server request Command Request - Connect
  206 1.012620739  10.6.15.145 → 192.168.1.16 SSH 1516 Server: Encrypted packet (len=1448)
  207 1.012625576    127.0.0.1 → 127.0.0.1    Socks 119 Version: 5
  208 1.012629809  10.6.15.145 → 192.168.1.16 SSH 328 Server: Encrypted packet (len=260)
  209 1.012633001    127.0.0.1 → 127.0.0.1    TCP 68 1080 → 46954 [ACK] Seq=141 Ack=294 Win=350 Len=0 TSval=1297709 TSecr=1297709
  210 1.012635001 192.168.1.16 → 10.6.15.145  TCP 68 52104 → 22 [ACK] Seq=5633 Ack=9373 Win=6157 Len=0 TSval=1297709 TSecr=24112104
  211 1.012726560    127.0.0.1 → 127.0.0.1    Socks 2988 Version: 5
  212 1.012793224  10.6.15.145 → 192.168.1.16 SSH 1080 Server: Encrypted packet (len=1012)
  213 1.012816220    127.0.0.1 → 127.0.0.1    Socks 119 Version: 5
  214 1.012820375    127.0.0.1 → 127.0.0.1    TCP 68 1080 → 46958 [ACK] Seq=141 Ack=294 Win=350 Len=0 TSval=1297709 TSecr=1297709
  215 1.012854914    127.0.0.1 → 127.0.0.1    Socks 1465 Version: 5
  216 1.012859757    127.0.0.1 → 127.0.0.1    TCP 68 46946 → 1080 [ACK] Seq=239 Ack=4328 Win=2388 Len=0 TSval=1297709 TSecr=1297709
  217 1.012917167  10.6.15.145 → 192.168.1.16 TCP 1080 [TCP Retransmission] 22 → 52104 [PSH, ACK] Seq=9373 Ack=5409 Win=1452 Len=1012 TSval=24112122 TSecr=1297535
  218 1.012925357 192.168.1.16 → 10.6.15.145  TCP 80 52104 → 22 [ACK] Seq=5633 Ack=10385 Win=6157 Len=0 TSval=1297709 TSecr=24112122 SLE=9373 SRE=10385
  219 1.012950161    127.0.0.1 → 127.0.0.1    Socks 312 Version: 5 Connect to server response
  220 1.012956603    127.0.0.1 → 127.0.0.1    TCP 68 1080 → 46960 [ACK] Seq=11 Ack=245 Win=350 Len=0 TSval=1297709 TSecr=1297709
  221 1.012992646  10.6.15.145 → 192.168.1.16 TCP 656 [TCP Out-Of-Order] 22 → 52104 [PSH, ACK] Seq=7077 Ack=5409 Win=1452 Len=588 TSval=24112221 TSecr=1297535
  222 1.012997213 192.168.1.16 → 10.6.15.145  TCP 80 [TCP Dup ACK 218#1] 52104 → 22 [ACK] Seq=5633 Ack=10385 Win=6157 Len=0 TSval=1297709 TSecr=24112122 SLE=7077 SRE=7665
  223 1.013383305    127.0.0.1 → 127.0.0.1    Socks 410 Version: 5
  224 1.013386079    127.0.0.1 → 127.0.0.1    TCP 68 1080 → 46946 [ACK] Seq=4328 Ack=581 Win=359 Len=0 TSval=1297709 TSecr=1297709
  225 1.015376854  10.6.15.145 → 192.168.1.16 SSH 1516 Server: Encrypted packet (len=1448)
  226 1.015385518 192.168.1.16 → 10.6.15.145  SSH 772 Client: Encrypted packet (len=704)
  227 1.015568380  10.6.15.145 → 192.168.1.16 SSH 1516 Server: Encrypted packet (len=1448)
  228 1.016798349  10.6.15.145 → 192.168.1.16 SSH 1516 Server: Encrypted packet (len=1448)
  229 1.016812185 192.168.1.16 → 10.6.15.145  TCP 68 52104 → 22 [ACK] Seq=6337 Ack=14729 Win=6157 Len=0 TSval=1297710 TSecr=24112233
  230 1.016905096    127.0.0.1 → 127.0.0.1    Socks 2964 Unknown
  231 1.016909962    127.0.0.1 → 127.0.0.1    TCP 68 46602 → 1080 [ACK] Seq=1 Ack=2943 Win=18408 Len=0 TSval=1297710 TSecr=1297710
  232 1.020498019  10.6.15.145 → 192.168.1.16 TCP 68 22 → 52104 [ACK] Seq=14729 Ack=5633 Win=1452 Len=0 TSval=24112233 TSecr=1297708
  233 1.020725352  10.6.15.145 → 192.168.1.16 SSH 1516 Server: Encrypted packet (len=1448)
  234 1.020917859  10.6.15.145 → 192.168.1.16 SSH 1516 Server: Encrypted packet (len=1448)
  235 1.020924275 192.168.1.16 → 10.6.15.145  TCP 68 52104 → 22 [ACK] Seq=6337 Ack=17625 Win=6157 Len=0 TSval=1297711 TSecr=24112234
  236 1.021110644  10.6.15.145 → 192.168.1.16 SSH 1516 Server: Encrypted packet (len=1448)
  237 1.021301492  10.6.15.145 → 192.168.1.16 SSH 1516 Server: Encrypted packet (len=1448)
  238 1.021304210 192.168.1.16 → 10.6.15.145  TCP 68 52104 → 22 [ACK] Seq=6337 Ack=20521 Win=6157 Len=0 TSval=1297711 TSecr=24112234
  239 1.021494602  10.6.15.145 → 192.168.1.16 SSH 1516 Server: Encrypted packet (len=1448)
  240 1.021596421    127.0.0.1 → 127.0.0.1    Socks 7300 Unknown
  241 1.021606266    127.0.0.1 → 127.0.0.1    TCP 68 46602 → 1080 [ACK] Seq=1 Ack=10175 Win=18391 Len=0 TSval=1297711 TSecr=1297711
  242 1.022100926  10.6.15.145 → 192.168.1.16 SSH 1516 Server: Encrypted packet (len=1448)
  243 1.022112374 192.168.1.16 → 10.6.15.145  TCP 68 52104 → 22 [ACK] Seq=6337 Ack=23417 Win=6157 Len=0 TSval=1297711 TSecr=24112234
  244 1.022292061  10.6.15.145 → 192.168.1.16 SSH 1516 Server: Encrypted packet (len=1448)
  245 1.024098119  10.6.15.145 → 192.168.1.16 SSH 1516 Server: Encrypted packet (len=1448)
  246 1.024114917 192.168.1.16 → 10.6.15.145  TCP 68 52104 → 22 [ACK] Seq=6337 Ack=26313 Win=6157 Len=0 TSval=1297712 TSecr=24112235
  247 1.024276470  10.6.15.145 → 192.168.1.16 SSH 1516 Server: Encrypted packet (len=1448)
  248 1.024466795  10.6.15.145 → 192.168.1.16 SSH 1516 Server: Encrypted packet (len=1448)
  249 1.024473812 192.168.1.16 → 10.6.15.145  TCP 68 52104 → 22 [ACK] Seq=6337 Ack=29209 Win=6157 Len=0 TSval=1297712 TSecr=24112235
  250 1.024659775  10.6.15.145 → 192.168.1.16 SSH 1516 Server: Encrypted packet (len=1448)
  251 1.025256408  10.6.15.145 → 192.168.1.16 SSH 1516 Server: Encrypted packet (len=1448)
  252 1.025268331 192.168.1.16 → 10.6.15.145  TCP 68 52104 → 22 [ACK] Seq=6337 Ack=32105 Win=6157 Len=0 TSval=1297712 TSecr=24112235
  253 1.025414820    127.0.0.1 → 127.0.0.1    Socks 10204 Unknown
  254 1.025422649    127.0.0.1 → 127.0.0.1    TCP 68 46602 → 1080 [ACK] Seq=1 Ack=20311 Win=18380 Len=0 TSval=1297712 TSecr=1297712
  255 1.025447783  10.6.15.145 → 192.168.1.16 SSH 1516 Server: Encrypted packet (len=1448)
  256 1.027792539  10.6.15.145 → 192.168.1.16 SSH 1516 Server: Encrypted packet (len=1448)
  257 1.027812463 192.168.1.16 → 10.6.15.145  TCP 68 52104 → 22 [ACK] Seq=6337 Ack=35001 Win=6157 Len=0 TSval=1297712 TSecr=24112236
  258 1.027981089  10.6.15.145 → 192.168.1.16 SSH 1516 Server: Encrypted packet (len=1448)
  259 1.028167232  10.6.15.145 → 192.168.1.16 SSH 1516 Server: Encrypted packet (len=1448)
  260 1.028175986 192.168.1.16 → 10.6.15.145  TCP 68 52104 → 22 [ACK] Seq=6337 Ack=37897 Win=6157 Len=0 TSval=1297713 TSecr=24112236
  261 1.028358883  10.6.15.145 → 192.168.1.16 SSH 1516 Server: Encrypted packet (len=1448)
  262 1.028549422  10.6.15.145 → 192.168.1.16 SSH 1516 Server: Encrypted packet (len=1448)
  263 1.028557750 192.168.1.16 → 10.6.15.145  TCP 68 52104 → 22 [ACK] Seq=6337 Ack=40793 Win=6157 Len=0 TSval=1297713 TSecr=24112236
  264 1.028741699  10.6.15.145 → 192.168.1.16 SSH 1516 Server: Encrypted packet (len=1448)
  265 1.028874458    127.0.0.1 → 127.0.0.1    Socks 10204 Unknown
  266 1.028880704    127.0.0.1 → 127.0.0.1    TCP 68 46602 → 1080 [ACK] Seq=1 Ack=30447 Win=18380 Len=0 TSval=1297713 TSecr=1297713
  267 1.031262348  10.6.15.145 → 192.168.1.16 SSH 1516 Server: Encrypted packet (len=1448)
  268 1.031283019 192.168.1.16 → 10.6.15.145  TCP 68 52104 → 22 [ACK] Seq=6337 Ack=43689 Win=6157 Len=0 TSval=1297713 TSecr=24112236
  269 1.031441632  10.6.15.145 → 192.168.1.16 SSH 1516 Server: Encrypted packet (len=1448)
  270 1.031635968  10.6.15.145 → 192.168.1.16 SSH 1516 Server: Encrypted packet (len=1448)
  271 1.031645860 192.168.1.16 → 10.6.15.145  TCP 68 52104 → 22 [ACK] Seq=6337 Ack=46585 Win=6157 Len=0 TSval=1297713 TSecr=24112237
  272 1.031828257  10.6.15.145 → 192.168.1.16 SSH 1516 Server: Encrypted packet (len=1448)
  273 1.032019885  10.6.15.145 → 192.168.1.16 SSH 1516 Server: Encrypted packet (len=1448)
  274 1.032027641 192.168.1.16 → 10.6.15.145  TCP 68 52104 → 22 [ACK] Seq=6337 Ack=49481 Win=6157 Len=0 TSval=1297714 TSecr=24112237
  275 1.032211960  10.6.15.145 → 192.168.1.16 SSH 1516 Server: Encrypted packet (len=1448)
  276 1.032339978    127.0.0.1 → 127.0.0.1    Socks 9540 Unknown
  277 1.032345516    127.0.0.1 → 127.0.0.1    TCP 68 46602 → 1080 [ACK] Seq=1 Ack=39919 Win=18382 Len=0 TSval=1297714 TSecr=1297714
  278 1.033156929  10.6.15.145 → 192.168.1.16 SSH 1516 Server: Encrypted packet (len=1448)
  279 1.033173542 192.168.1.16 → 10.6.15.145  TCP 68 52104 → 22 [ACK] Seq=6337 Ack=52377 Win=6157 Len=0 TSval=1297714 TSecr=24112237
  280 1.033345435  10.6.15.145 → 192.168.1.16 SSH 1516 Server: Encrypted packet (len=1448)
  281 1.035066915  10.6.15.145 → 192.168.1.16 SSH 1516 Server: Encrypted packet (len=1448)
  282 1.035086619 192.168.1.16 → 10.6.15.145  TCP 68 52104 → 22 [ACK] Seq=6337 Ack=55273 Win=6157 Len=0 TSval=1297714 TSecr=24112237
  283 1.035251598  10.6.15.145 → 192.168.1.16 SSH 1516 Server: Encrypted packet (len=1448)
  284 1.035442753  10.6.15.145 → 192.168.1.16 SSH 1516 Server: Encrypted packet (len=1448)
  285 1.035450087 192.168.1.16 → 10.6.15.145  TCP 68 52104 → 22 [ACK] Seq=6337 Ack=58169 Win=6157 Len=0 TSval=1297714 TSecr=24112238
  286 1.036845556  10.6.15.145 → 192.168.1.16 SSH 1516 Server: Encrypted packet (len=1448)
  287 1.037030449  10.6.15.145 → 192.168.1.16 SSH 1516 Server: Encrypted packet (len=1448)
  288 1.037041568 192.168.1.16 → 10.6.15.145  TCP 68 52104 → 22 [ACK] Seq=6337 Ack=61065 Win=6157 Len=0 TSval=1297715 TSecr=24112238
  289 1.037177945    127.0.0.1 → 127.0.0.1    Socks 10449 Unknown
  290 1.037183761    127.0.0.1 → 127.0.0.1    TCP 68 46602 → 1080 [ACK] Seq=1 Ack=50300 Win=18379 Len=0 TSval=1297715 TSecr=1297715
  291 1.037225321  10.6.15.145 → 192.168.1.16 SSH 1516 Server: Encrypted packet (len=1448)
  292 1.037413380  10.6.15.145 → 192.168.1.16 SSH 1516 Server: Encrypted packet (len=1448)
  293 1.037419323 192.168.1.16 → 10.6.15.145  TCP 68 52104 → 22 [ACK] Seq=6337 Ack=63961 Win=6157 Len=0 TSval=1297715 TSecr=24112238
  294 1.037605560  10.6.15.145 → 192.168.1.16 SSH 1516 Server: Encrypted packet (len=1448)
  295 1.038811023  10.6.15.145 → 192.168.1.16 SSH 1516 Server: Encrypted packet (len=1448)
  296 1.038831366 192.168.1.16 → 10.6.15.145  TCP 68 52104 → 22 [ACK] Seq=6337 Ack=66857 Win=6157 Len=0 TSval=1297715 TSecr=24112239
  297 1.038995394  10.6.15.145 → 192.168.1.16 SSH 1516 Server: Encrypted packet (len=1448)
  298 1.039107174    127.0.0.1 → 127.0.0.1    Socks 7300 Unknown
  299 1.039113889    127.0.0.1 → 127.0.0.1    TCP 68 46602 → 1080 [ACK] Seq=1 Ack=57532 Win=18391 Len=0 TSval=1297715 TSecr=1297715
  300 1.039159536 192.168.1.16 → 10.6.15.145  SSH 104 Client: Encrypted packet (len=36)
  301 1.039186047  10.6.15.145 → 192.168.1.16 SSH 1516 Server: Encrypted packet (len=1448)
  302 1.039376483  10.6.15.145 → 192.168.1.16 SSH 1516 Server: Encrypted packet (len=1448)
  303 1.039382138 192.168.1.16 → 10.6.15.145  TCP 68 52104 → 22 [ACK] Seq=6373 Ack=71201 Win=6157 Len=0 TSval=1297715 TSecr=24112239
  304 1.040437451  10.6.15.145 → 192.168.1.16 SSH 1516 Server: Encrypted packet (len=1448)
  305 1.040576704    127.0.0.1 → 127.0.0.1    Socks 4412 Unknown
  306 1.040582542    127.0.0.1 → 127.0.0.1    TCP 68 46602 → 1080 [ACK] Seq=1 Ack=61876 Win=18402 Len=0 TSval=1297716 TSecr=1297716
  307 1.040619761  10.6.15.145 → 192.168.1.16 SSH 1516 Server: Encrypted packet (len=1448)
  308 1.040625975 192.168.1.16 → 10.6.15.145  TCP 68 52104 → 22 [ACK] Seq=6373 Ack=74097 Win=6157 Len=0 TSval=1297716 TSecr=24112239
  309 1.040810648  10.6.15.145 → 192.168.1.16 SSH 1516 Server: Encrypted packet (len=1448)
  310 1.041002849  10.6.15.145 → 192.168.1.16 SSH 1516 Server: Encrypted packet (len=1448)
  311 1.041009629 192.168.1.16 → 10.6.15.145  TCP 68 52104 → 22 [ACK] Seq=6373 Ack=76993 Win=6157 Len=0 TSval=1297716 TSecr=24112239
  312 1.042131335  10.6.15.145 → 192.168.1.16 SSH 1516 Server: Encrypted packet (len=1448)
  313 1.042270892    127.0.0.1 → 127.0.0.1    Socks 5860 Unknown
  314 1.042277837    127.0.0.1 → 127.0.0.1    TCP 68 46602 → 1080 [ACK] Seq=1 Ack=67668 Win=18397 Len=0 TSval=1297716 TSecr=1297716
  315 1.042314959  10.6.15.145 → 192.168.1.16 SSH 1516 Server: Encrypted packet (len=1448)
  316 1.042322443 192.168.1.16 → 10.6.15.145  TCP 68 52104 → 22 [ACK] Seq=6373 Ack=79889 Win=6157 Len=0 TSval=1297716 TSecr=24112240
  317 1.042507676  10.6.15.145 → 192.168.1.16 SSH 1516 Server: Encrypted packet (len=1448)
  318 1.042699400  10.6.15.145 → 192.168.1.16 SSH 1516 Server: Encrypted packet (len=1448)
  319 1.042706430 192.168.1.16 → 10.6.15.145  TCP 68 52104 → 22 [ACK] Seq=6373 Ack=82785 Win=6157 Len=0 TSval=1297716 TSecr=24112240
  320 1.042891041  10.6.15.145 → 192.168.1.16 SSH 1516 Server: Encrypted packet (len=1448)
  321 1.043083331  10.6.15.145 → 192.168.1.16 SSH 1516 Server: Encrypted packet (len=1448)
  322 1.043090450 192.168.1.16 → 10.6.15.145  TCP 68 52104 → 22 [ACK] Seq=6373 Ack=85681 Win=6157 Len=0 TSval=1297716 TSecr=24112240
  323 1.044281873  10.6.15.145 → 192.168.1.16 SSH 1516 Server: Encrypted packet (len=1448)
  324 1.044301138  10.6.15.145 → 192.168.1.16 SSH 108 Server: Encrypted packet (len=40)
  325 1.044309344 192.168.1.16 → 10.6.15.145  TCP 68 52104 → 22 [ACK] Seq=6373 Ack=87169 Win=6157 Len=0 TSval=1297717 TSecr=24112240
  326 1.044920072    127.0.0.1 → 127.0.0.1    Socks 8702 Unknown
  327 1.044929444    127.0.0.1 → 127.0.0.1    TCP 68 46602 → 1080 [ACK] Seq=1 Ack=76302 Win=18386 Len=0 TSval=1297717 TSecr=1297717
  328 1.044943778    127.0.0.1 → 127.0.0.1    Socks 78 Version: 5, Remote Port: 443 Command Response - Connect
  329 1.047966669    127.0.0.1 → 127.0.0.1    TCP 68 1080 → 46922 [ACK] Seq=444 Ack=950 Win=367 Len=0 TSval=1297718 TSecr=1297707
  330 1.048886812    127.0.0.1 → 127.0.0.1    SSL 585 Client Hello
  331 1.049122701 192.168.1.16 → 10.6.15.145  SSH 456 Client: Encrypted packet (len=388)
  332 1.051968378    127.0.0.1 → 127.0.0.1    TCP 68 1080 → 47014 [ACK] Seq=3 Ack=27 Win=43776 Len=0 TSval=1297719 TSecr=1297708
  333 1.051968370    127.0.0.1 → 127.0.0.1    TCP 68 1080 → 46944 [ACK] Seq=11 Ack=2 Win=342 Len=0 TSval=1297719 TSecr=1297708
  334 1.053923051  10.6.15.145 → 192.168.1.16 SSH 256 Server: Encrypted packet (len=188)
  335 1.054032426    127.0.0.1 → 127.0.0.1    TLSv1.2 228 Server Hello, Change Cipher Spec, Hello Request, Hello Request
  336 1.054483262    127.0.0.1 → 127.0.0.1    TLSv1.2 284 Change Cipher Spec, Hello Request, Hello Request, Hello Request, Hello Request
  337 1.054584108 192.168.1.16 → 10.6.15.145  SSH 296 Client: Encrypted packet (len=228)
  338 1.061297687    127.0.0.1 → 127.0.0.1    TLSv1.2 121 Application Data
  339 1.061323016    127.0.0.1 → 127.0.0.1    TLSv1.2 124 Application Data
  340 1.061333670    127.0.0.1 → 127.0.0.1    TLSv1.2 110 Application Data
  341 1.061357027    127.0.0.1 → 127.0.0.1    TCP 68 1080 → 47016 [ACK] Seq=173 Ack=909 Win=45952 Len=0 TSval=1297721 TSecr=1297719
  342 1.061484078 192.168.1.16 → 10.6.15.145  SSH 232 Client: Encrypted packet (len=164)
  343 1.061662482    127.0.0.1 → 127.0.0.1    TLSv1.2 946 Application Data
  344 1.061940297 192.168.1.16 → 10.6.15.145  SSH 992 Client: Encrypted packet (len=924)
  345 1.063241025  10.6.15.145 → 192.168.1.16 TCP 68 22 → 52104 [ACK] Seq=87357 Ack=7153 Win=1452 Len=0 TSval=24112245 TSecr=1297719
  346 1.067169477  10.6.15.145 → 192.168.1.16 SSH 168 Server: Encrypted packet (len=100)
  347 1.067268128    127.0.0.1 → 127.0.0.1    TLSv1.2 137 Application Data
  348 1.067377172    127.0.0.1 → 127.0.0.1    TLSv1.2 106 Application Data
  349 1.067457328 192.168.1.16 → 10.6.15.145  SSH 128 Client: Encrypted packet (len=60)
  350 1.067747246  10.6.15.145 → 192.168.1.16 SSH 136 Server: Encrypted packet (len=68)
  351 1.067788205    127.0.0.1 → 127.0.0.1    TLSv1.2 106 Application Data
  352 1.107306691  10.6.15.145 → 192.168.1.16 TCP 68 22 → 52104 [ACK] Seq=87525 Ack=8137 Win=1452 Len=0 TSval=24112257 TSecr=1297722
  353 1.107966318 192.168.1.16 → 10.6.15.145  TCP 68 52104 → 22 [ACK] Seq=8137 Ack=87525 Win=6157 Len=0 TSval=1297733 TSecr=24112247
  354 1.107967316    127.0.0.1 → 127.0.0.1    TCP 68 47016 → 1080 [ACK] Seq=1825 Ack=280 Win=44800 Len=0 TSval=1297733 TSecr=1297722
  355 1.109745528  10.6.15.145 → 192.168.1.16 SSH 552 Server: Encrypted packet (len=484)
  356 1.109818902 192.168.1.16 → 10.6.15.145  TCP 68 52104 → 22 [ACK] Seq=8137 Ack=88009 Win=6157 Len=0 TSval=1297733 TSecr=24112257
  357 1.109880689    127.0.0.1 → 127.0.0.1    TLSv1.2 509 Application Data, Application Data
  358 1.109885601    127.0.0.1 → 127.0.0.1    TCP 68 47016 → 1080 [ACK] Seq=1825 Ack=721 Win=45952 Len=0 TSval=1297733 TSecr=1297733
  359 1.110261163  10.6.15.145 → 192.168.1.16 SSH 208 Server: Encrypted packet (len=140)
  360 1.110297703 192.168.1.16 → 10.6.15.145  TCP 68 52104 → 22 [ACK] Seq=8137 Ack=88149 Win=6157 Len=0 TSval=1297733 TSecr=24112257
  361 1.110340253    127.0.0.1 → 127.0.0.1    TLSv1.2 191 Application Data, Application Data, Application Data
  362 1.110343428    127.0.0.1 → 127.0.0.1    TCP 68 47016 → 1080 [ACK] Seq=1825 Ack=844 Win=45952 Len=0 TSval=1297733 TSecr=1297733
  363 1.112302960    127.0.0.1 → 127.0.0.1    TLSv1.2 114 Application Data
  364 1.112425809 192.168.1.16 → 10.6.15.145  SSH 136 Client: Encrypted packet (len=68)
  365 1.114023743  10.6.15.145 → 192.168.1.16 TCP 68 22 → 52104 [ACK] Seq=88149 Ack=8205 Win=1452 Len=0 TSval=24112258 TSecr=1297734
  366 1.119987171 192.168.1.16 → 224.0.0.252  IGMPv2 48 Membership Report group 224.0.0.252
  367 1.155967650    127.0.0.1 → 127.0.0.1    TCP 68 1080 → 47016 [ACK] Seq=844 Ack=1871 Win=47616 Len=0 TSval=1297745 TSecr=1297734
  368 1.227152282    127.0.0.1 → 127.0.0.1    Socks 2025 Unknown
  369 1.227170000    127.0.0.1 → 127.0.0.1    TCP 68 1080 → 46738 [ACK] Seq=1 Ack=1958 Win=3637 Len=0 TSval=1297762 TSecr=1297762
  370 1.244002686 192.168.1.16 → 10.6.15.145  SSH 1516 Client: Encrypted packet (len=1448)
  371 1.245613514 192.168.1.16 → 10.6.15.145  SSH 624 Client: Encrypted packet (len=556)
  372 1.247401626  10.6.15.145 → 192.168.1.16 TCP 68 22 → 52104 [ACK] Seq=88149 Ack=10209 Win=1452 Len=0 TSval=24112292 TSecr=1297762
  373 1.254162005    127.0.0.1 → 127.0.0.1    Socks 215 Unknown
  374 1.254193475    127.0.0.1 → 127.0.0.1    Socks 114 Unknown
  375 1.254222574    127.0.0.1 → 127.0.0.1    Socks 214 Unknown
  376 1.254223882    127.0.0.1 → 127.0.0.1    TCP 68 1080 → 46786 [ACK] Seq=1 Ack=194 Win=534 Len=0 TSval=1297769 TSecr=1297769
  377 1.254249689    127.0.0.1 → 127.0.0.1    Socks 215 Unknown
  378 1.254274817    127.0.0.1 → 127.0.0.1    Socks 215 Unknown
  379 1.254297437    127.0.0.1 → 127.0.0.1    Socks 216 Unknown
  380 1.254300445    127.0.0.1 → 127.0.0.1    TCP 68 1080 → 46786 [ACK] Seq=1 Ack=782 Win=568 Len=0 TSval=1297769 TSecr=1297769
  381 1.254327193    127.0.0.1 → 127.0.0.1    Socks 215 Unknown
  382 1.254369303 192.168.1.16 → 10.6.15.145  SSH 296 Client: Encrypted packet (len=228)
  383 1.254733922 192.168.1.16 → 10.6.15.145  SSH 832 Client: Encrypted packet (len=764)
  384 1.255986069  10.6.15.145 → 192.168.1.16 TCP 68 22 → 52104 [ACK] Seq=88149 Ack=10437 Win=1452 Len=0 TSval=24112294 TSecr=1297769
  385 1.256545877  10.6.15.145 → 192.168.1.16 TCP 68 22 → 52104 [ACK] Seq=88149 Ack=11201 Win=1452 Len=0 TSval=24112294 TSecr=1297769
  386 1.264279771  10.6.15.145 → 192.168.1.16 SSH 176 Server: Encrypted packet (len=108)
  387 1.264400156    127.0.0.1 → 127.0.0.1    Socks 143 Version: 5
  388 1.276123896  10.6.15.145 → 192.168.1.16 SSH 140 Server: Encrypted packet (len=72)
