    1 0.000000000  10.6.15.156 → 192.168.1.12 SSH 138 Server: Encrypted packet (len=72)
    2 0.000205677 192.168.1.12 → 10.6.15.156  SSH 102 Client: Encrypted packet (len=36)
    3 0.041903363  10.6.15.156 → 192.168.1.12 TCP 66 22 → 54766 [ACK] Seq=73 Ack=37 Win=1452 Len=0 TSval=15163554 TSecr=8232042
    4 0.044711758  10.6.15.156 → 192.168.1.12 SSH 138 Server: Encrypted packet (len=72)
    5 0.044926731 192.168.1.12 → 10.6.15.156  SSH 102 Client: Encrypted packet (len=36)
    6 0.046605282  10.6.15.156 → 192.168.1.12 TCP 66 22 → 54766 [ACK] Seq=145 Ack=73 Win=1452 Len=0 TSval=15163555 TSecr=8232053
    7 0.048962735  10.6.15.156 → 192.168.1.12 SSH 102 Server: Encrypted packet (len=36)
    8 0.049292487 192.168.1.12 → 10.6.15.156  SSH 118 Client: Encrypted packet (len=52)
    9 0.089920946  10.6.15.156 → 192.168.1.12 TCP 66 22 → 54766 [ACK] Seq=181 Ack=125 Win=1452 Len=0 TSval=15163566 TSecr=8232054
   10 0.156423584  10.6.15.156 → 192.168.1.12 SSH 138 Server: Encrypted packet (len=72)
   11 0.156660278 192.168.1.12 → 10.6.15.156  SSH 102 Client: Encrypted packet (len=36)
   12 0.158298193  10.6.15.156 → 192.168.1.12 TCP 66 22 → 54766 [ACK] Seq=253 Ack=161 Win=1452 Len=0 TSval=15163583 TSecr=8232081
   13 0.160886490  10.6.15.156 → 192.168.1.12 SSH 102 Server: Encrypted packet (len=36)
   14 0.163437087  10.6.15.156 → 192.168.1.12 SSH 102 Server: Encrypted packet (len=36)
   15 0.163479666 192.168.1.12 → 10.6.15.156  TCP 66 54766 → 22 [ACK] Seq=161 Ack=325 Win=6155 Len=0 TSval=8232083 TSecr=15163583
   16 0.168614914  10.6.15.156 → 192.168.1.12 SSH 138 Server: Encrypted packet (len=72)
   17 0.168826149 192.168.1.12 → 10.6.15.156  SSH 102 Client: Encrypted packet (len=36)
   18 0.204771939  10.6.15.156 → 192.168.1.12 SSH 138 Server: Encrypted packet (len=72)
   19 0.204988625 192.168.1.12 → 10.6.15.156  SSH 102 Client: Encrypted packet (len=36)
   20 0.231945998  10.6.15.156 → 192.168.1.12 SSH 138 Server: Encrypted packet (len=72)
   21 0.232153843 192.168.1.12 → 10.6.15.156  SSH 102 Client: Encrypted packet (len=36)
   22 0.273663876  10.6.15.156 → 192.168.1.12 TCP 66 22 → 54766 [ACK] Seq=541 Ack=269 Win=1452 Len=0 TSval=15163612 TSecr=8232100
   23 0.311650693  10.6.15.156 → 192.168.1.12 SSH 534 Server: Encrypted packet (len=468)
   24 0.354267397 192.168.1.12 → 10.6.15.156  TCP 66 54766 → 22 [ACK] Seq=269 Ack=1009 Win=6155 Len=0 TSval=8232131 TSecr=15163621
   25 0.601783180 192.168.1.12 → 10.6.15.156  SSH 110 Client: Encrypted packet (len=44)
   26 0.602779289  10.6.15.156 → 192.168.1.12 SSH 238 Server: Encrypted packet (len=172)
   27 0.602805239 192.168.1.12 → 10.6.15.156  TCP 66 54766 → 22 [ACK] Seq=313 Ack=1181 Win=6155 Len=0 TSval=8232193 TSecr=15163694
   28 0.603143640  10.6.15.156 → 192.168.1.12 TCP 66 22 → 54766 [ACK] Seq=1181 Ack=313 Win=1452 Len=0 TSval=15163694 TSecr=8232192
   29 0.643926033 192.168.1.12 → 10.6.15.156  SSH 102 Client: Encrypted packet (len=36)
   30 0.645255751  10.6.15.156 → 192.168.1.12 TCP 66 22 → 54766 [ACK] Seq=1181 Ack=349 Win=1452 Len=0 TSval=15163704 TSecr=8232203
   31 0.672033179  10.6.15.156 → 192.168.1.12 SSH 182 Server: Encrypted packet (len=116)
   32 0.672049952 192.168.1.12 → 10.6.15.156  TCP 66 54766 → 22 [ACK] Seq=349 Ack=1297 Win=6155 Len=0 TSval=8232210 TSecr=15163711
   33 0.717050862  10.6.15.156 → 192.168.1.12 SSH 102 Server: Encrypted packet (len=36)
   34 0.717068256 192.168.1.12 → 10.6.15.156  TCP 66 54766 → 22 [ACK] Seq=349 Ack=1333 Win=6155 Len=0 TSval=8232221 TSecr=15163722
   35 0.717393291 192.168.1.12 → 10.6.15.156  SSH 134 Client: Encrypted packet (len=68)
   36 0.729653391  10.6.15.156 → 192.168.1.12 SSH 182 Server: Encrypted packet (len=116)
   37 0.732134110 192.168.1.12 → 10.6.15.156  SSH 118 Client: Encrypted packet (len=52)
   38 0.770210464  10.6.15.156 → 192.168.1.12 SSH 102 Server: Encrypted packet (len=36)
   39 0.770638929 192.168.1.12 → 10.6.15.156  SSH 398 Client: Encrypted packet (len=332)
   40 0.809791865  10.6.15.156 → 192.168.1.12 TCP 66 22 → 54766 [ACK] Seq=1485 Ack=801 Win=1452 Len=0 TSval=15163746 TSecr=8232235
   41 0.832462838  10.6.15.156 → 192.168.1.12 SSH 182 Server: Encrypted packet (len=116)
   42 0.848301562  10.6.15.156 → 192.168.1.12 SSH 366 Server: Encrypted packet (len=300)
   43 0.848370703 192.168.1.12 → 10.6.15.156  TCP 66 54766 → 22 [ACK] Seq=801 Ack=1901 Win=6155 Len=0 TSval=8232254 TSecr=15163751
   44 0.938097911  10.6.15.156 → 192.168.1.12 SSH 214 Server: Encrypted packet (len=148)
   45 0.938403566 192.168.1.12 → 10.6.15.156  SSH 134 Client: Encrypted packet (len=68)
   46 0.940158048  10.6.15.156 → 192.168.1.12 TCP 66 22 → 54766 [ACK] Seq=2049 Ack=869 Win=1452 Len=0 TSval=15163778 TSecr=8232277
   47 0.940179262 192.168.1.12 → 10.6.15.156  SSH 646 Client: Encrypted packet (len=580)
   48 0.942748373  10.6.15.156 → 192.168.1.12 TCP 66 22 → 54766 [ACK] Seq=2049 Ack=1449 Win=1452 Len=0 TSval=15163779 TSecr=8232277
   49 1.107175635  10.6.15.156 → 192.168.1.12 SSH 102 Server: Encrypted packet (len=36)
   50 1.107497699  10.6.15.156 → 192.168.1.12 SSH 174 Server: Encrypted packet (len=108)
   51 1.107562674 192.168.1.12 → 10.6.15.156  TCP 66 54766 → 22 [ACK] Seq=1449 Ack=2193 Win=6155 Len=0 TSval=8232319 TSecr=15163820
   52 1.107575335 192.168.1.12 → 10.6.15.156  SSH 414 Client: Encrypted packet (len=348)
   53 1.107809073 192.168.1.12 → 10.6.15.156  SSH 126 Client: Encrypted packet (len=60)
   54 1.109375409  10.6.15.156 → 192.168.1.12 TCP 66 22 → 54766 [ACK] Seq=2193 Ack=1797 Win=1452 Len=0 TSval=15163820 TSecr=8232319
   55 1.109388019  10.6.15.156 → 192.168.1.12 TCP 66 22 → 54766 [ACK] Seq=2193 Ack=1857 Win=1452 Len=0 TSval=15163820 TSecr=8232319
   56 1.123092096  10.6.15.156 → 192.168.1.12 SSH 230 Server: Encrypted packet (len=164)
   57 1.166263076 192.168.1.12 → 10.6.15.156  TCP 66 54766 → 22 [ACK] Seq=1857 Ack=2357 Win=6155 Len=0 TSval=8232334 TSecr=15163824
   58 1.180800541  10.6.15.156 → 192.168.1.12 SSH 238 Server: Encrypted packet (len=172)
   59 1.180825527 192.168.1.12 → 10.6.15.156  TCP 66 54766 → 22 [ACK] Seq=1857 Ack=2529 Win=6155 Len=0 TSval=8232337 TSecr=15163838
   60 1.283277361  10.6.15.156 → 192.168.1.12 SSH 238 Server: Encrypted packet (len=172)
   61 1.283294973 192.168.1.12 → 10.6.15.156  TCP 66 54766 → 22 [ACK] Seq=1857 Ack=2701 Win=6155 Len=0 TSval=8232363 TSecr=15163864
   62 1.462632534  10.6.15.156 → 192.168.1.12 SSH 1406 Server: Encrypted packet (len=1340)
   63 1.467947996  10.6.15.156 → 192.168.1.12 SSH 150 Server: Encrypted packet (len=84)
   64 1.467968425 192.168.1.12 → 10.6.15.156  TCP 66 54766 → 22 [ACK] Seq=1857 Ack=4125 Win=6155 Len=0 TSval=8232409 TSecr=15163909
   65 1.468506535 192.168.1.12 → 10.6.15.156  SSH 150 Client: Encrypted packet (len=84)
   66 1.485043933  10.6.15.156 → 192.168.1.12 SSH 214 Server: Encrypted packet (len=148)
   67 1.485069227 192.168.1.12 → 10.6.15.156  SSH 198 Client: Encrypted packet (len=132)
   68 1.485344475 192.168.1.12 → 10.6.15.156  SSH 134 Client: Encrypted packet (len=68)
   69 1.486810731  10.6.15.156 → 192.168.1.12 TCP 66 22 → 54766 [ACK] Seq=4273 Ack=2141 Win=1452 Len=0 TSval=15163915 TSecr=8232413
   70 1.486820068 192.168.1.12 → 10.6.15.156  SSH 578 Client: Encrypted packet (len=512)
   71 1.489484792  10.6.15.156 → 192.168.1.12 SSH 138 Server: Encrypted packet (len=72)
   72 1.504869616  10.6.15.156 → 192.168.1.12 SSH 222 Server: Encrypted packet (len=156)
   73 1.504889037 192.168.1.12 → 10.6.15.156  SSH 186 Client: Encrypted packet (len=120)
   74 1.513421404  10.6.15.156 → 192.168.1.12 SSH 1514 Server: Encrypted packet (len=1448)
   75 1.513560137  10.6.15.156 → 192.168.1.12 SSH 1514 Server: Encrypted packet (len=1448)
   76 1.513571435 192.168.1.12 → 10.6.15.156  TCP 66 54766 → 22 [ACK] Seq=2773 Ack=7397 Win=6155 Len=0 TSval=8232420 TSecr=15163921
   77 1.513809072  10.6.15.156 → 192.168.1.12 SSH 806 Server: Encrypted packet (len=740)
   78 1.513990954  10.6.15.156 → 192.168.1.12 SSH 1514 Server: Encrypted packet (len=1448)
   79 1.513994326 192.168.1.12 → 10.6.15.156  TCP 66 54766 → 22 [ACK] Seq=2773 Ack=9585 Win=6155 Len=0 TSval=8232420 TSecr=15163921
   80 1.514184861  10.6.15.156 → 192.168.1.12 SSH 1514 Server: Encrypted packet (len=1448)
   81 1.514381101  10.6.15.156 → 192.168.1.12 SSH 1514 Server: Encrypted packet (len=1448)
   82 1.514390234 192.168.1.12 → 10.6.15.156  TCP 66 54766 → 22 [ACK] Seq=2773 Ack=12481 Win=6155 Len=0 TSval=8232421 TSecr=15163921
   83 1.517771959  10.6.15.156 → 192.168.1.12 SSH 1514 Server: Encrypted packet (len=1448)
   84 1.517787587  10.6.15.156 → 192.168.1.12 SSH 1514 Server: Encrypted packet (len=1448)
   85 1.517797081 192.168.1.12 → 10.6.15.156  TCP 66 54766 → 22 [ACK] Seq=2773 Ack=15377 Win=6155 Len=0 TSval=8232421 TSecr=15163922
   86 1.517808033  10.6.15.156 → 192.168.1.12 SSH 1514 Server: Encrypted packet (len=1448)
   87 1.517810080  10.6.15.156 → 192.168.1.12 SSH 1086 Server: Encrypted packet (len=1020)
   88 1.517812203 192.168.1.12 → 10.6.15.156  TCP 66 54766 → 22 [ACK] Seq=2773 Ack=17845 Win=6155 Len=0 TSval=8232421 TSecr=15163922
   89 1.560194540  10.6.15.156 → 192.168.1.12 SSH 1514 Server: Encrypted packet (len=1448)
   90 1.560409778  10.6.15.156 → 192.168.1.12 SSH 1514 Server: Encrypted packet (len=1448)
   91 1.560420770 192.168.1.12 → 10.6.15.156  TCP 66 54766 → 22 [ACK] Seq=2773 Ack=20741 Win=6155 Len=0 TSval=8232432 TSecr=15163933
   92 1.560598508  10.6.15.156 → 192.168.1.12 SSH 1514 Server: Encrypted packet (len=1448)
   93 1.560685038  10.6.15.156 → 192.168.1.12 SSH 926 Server: Encrypted packet (len=860)
   94 1.560691977 192.168.1.12 → 10.6.15.156  TCP 66 54766 → 22 [ACK] Seq=2773 Ack=23049 Win=6155 Len=0 TSval=8232432 TSecr=15163933
   95 1.561038550  10.6.15.156 → 192.168.1.12 SSH 1514 Server: Encrypted packet (len=1448)
   96 1.561227767  10.6.15.156 → 192.168.1.12 SSH 1514 Server: Encrypted packet (len=1448)
   97 1.561236393 192.168.1.12 → 10.6.15.156  TCP 66 54766 → 22 [ACK] Seq=2773 Ack=25945 Win=6155 Len=0 TSval=8232432 TSecr=15163933
   98 1.563702183  10.6.15.156 → 192.168.1.12 SSH 1514 Server: Encrypted packet (len=1448)
   99 1.563889004  10.6.15.156 → 192.168.1.12 SSH 1514 Server: Encrypted packet (len=1448)
  100 1.563899478 192.168.1.12 → 10.6.15.156  TCP 66 54766 → 22 [ACK] Seq=2773 Ack=28841 Win=6155 Len=0 TSval=8232433 TSecr=15163934
  101 1.564076202  10.6.15.156 → 192.168.1.12 SSH 1514 Server: Encrypted packet (len=1448)
  102 1.564270237  10.6.15.156 → 192.168.1.12 SSH 1514 Server: Encrypted packet (len=1448)
  103 1.564278032 192.168.1.12 → 10.6.15.156  TCP 66 54766 → 22 [ACK] Seq=2773 Ack=31737 Win=6155 Len=0 TSval=8232433 TSecr=15163934
  104 1.564616430  10.6.15.156 → 192.168.1.12 SSH 1514 Server: Encrypted packet (len=1448)
  105 1.564804569  10.6.15.156 → 192.168.1.12 SSH 1514 Server: Encrypted packet (len=1448)
  106 1.564810166 192.168.1.12 → 10.6.15.156  TCP 66 54766 → 22 [ACK] Seq=2773 Ack=34633 Win=6155 Len=0 TSval=8232433 TSecr=15163934
  107 1.566839302  10.6.15.156 → 192.168.1.12 SSH 1514 Server: Encrypted packet (len=1448)
  108 1.566851879  10.6.15.156 → 192.168.1.12 SSH 194 Server: Encrypted packet (len=128)
  109 1.566861865 192.168.1.12 → 10.6.15.156  TCP 66 54766 → 22 [ACK] Seq=2773 Ack=36209 Win=6155 Len=0 TSval=8232434 TSecr=15163935
  110 1.574046179  10.6.15.156 → 192.168.1.12 SSH 230 Server: Encrypted packet (len=164)
  111 1.589144500  10.6.15.156 → 192.168.1.12 SSH 270 Server: Encrypted packet (len=204)
  112 1.589232611 192.168.1.12 → 10.6.15.156  TCP 66 54766 → 22 [ACK] Seq=2773 Ack=36577 Win=6155 Len=0 TSval=8232439 TSecr=15163937
  113 1.631796302  10.6.15.156 → 192.168.1.12 SSH 222 Server: Encrypted packet (len=156)
  114 1.673386896  10.6.15.156 → 192.168.1.12 SSH 158 Server: Encrypted packet (len=92)
  115 1.673404869 192.168.1.12 → 10.6.15.156  TCP 66 54766 → 22 [ACK] Seq=2773 Ack=36825 Win=6155 Len=0 TSval=8232460 TSecr=15163951
  116 1.673701390 192.168.1.12 → 10.6.15.156  SSH 150 Client: Encrypted packet (len=84)
  117 1.713827003  10.6.15.156 → 192.168.1.12 TCP 66 22 → 54766 [ACK] Seq=36825 Ack=2857 Win=1452 Len=0 TSval=15163972 TSecr=8232460
  118 1.734273050  10.6.15.156 → 192.168.1.12 SSH 262 Server: Encrypted packet (len=196)
  119 1.778314283 192.168.1.12 → 10.6.15.156  TCP 66 54766 → 22 [ACK] Seq=2857 Ack=37021 Win=6155 Len=0 TSval=8232487 TSecr=15163977
  120 1.860557626  10.6.15.156 → 192.168.1.12 SSH 174 Server: Encrypted packet (len=108)
  121 1.860666032 192.168.1.12 → 10.6.15.156  TCP 66 54766 → 22 [ACK] Seq=2857 Ack=37129 Win=6155 Len=0 TSval=8232507 TSecr=15164008
  122 1.860886277 192.168.1.12 → 10.6.15.156  SSH 126 Client: Encrypted packet (len=60)
  123 1.862400981  10.6.15.156 → 192.168.1.12 TCP 66 22 → 54766 [ACK] Seq=37129 Ack=2917 Win=1452 Len=0 TSval=15164009 TSecr=8232507
  124 1.863392641  10.6.15.156 → 192.168.1.12 SSH 134 Server: Encrypted packet (len=68)
  125 1.864641372  10.6.15.156 → 192.168.1.12 SSH 486 Server: Encrypted packet (len=420)
  126 1.864718742 192.168.1.12 → 10.6.15.156  TCP 66 54766 → 22 [ACK] Seq=2917 Ack=37617 Win=6155 Len=0 TSval=8232508 TSecr=15164009
  127 1.955785483  10.6.15.156 → 192.168.1.12 SSH 342 Server: Encrypted packet (len=276)
  128 1.998265096 192.168.1.12 → 10.6.15.156  TCP 66 54766 → 22 [ACK] Seq=2917 Ack=37893 Win=6155 Len=0 TSval=8232542 TSecr=15164032
  129 2.025155050  10.6.15.156 → 192.168.1.12 SSH 302 Server: Encrypted packet (len=236)
  130 2.025226582 192.168.1.12 → 10.6.15.156  TCP 66 54766 → 22 [ACK] Seq=2917 Ack=38129 Win=6155 Len=0 TSval=8232548 TSecr=15164049
  131 2.082595622  10.6.15.156 → 192.168.1.12 SSH 302 Server: Encrypted packet (len=236)
  132 2.082671517 192.168.1.12 → 10.6.15.156  TCP 66 54766 → 22 [ACK] Seq=2917 Ack=38365 Win=6155 Len=0 TSval=8232563 TSecr=15164064
  133 2.185460119  10.6.15.156 → 192.168.1.12 SSH 406 Server: Encrypted packet (len=340)
  134 2.185522854 192.168.1.12 → 10.6.15.156  TCP 66 54766 → 22 [ACK] Seq=2917 Ack=38705 Win=6155 Len=0 TSval=8232588 TSecr=15164089
  135 2.406759916  10.6.15.156 → 192.168.1.12 SSH 374 Server: Encrypted packet (len=308)
  136 2.406780716 192.168.1.12 → 10.6.15.156  TCP 66 54766 → 22 [ACK] Seq=2917 Ack=39013 Win=6155 Len=0 TSval=8232644 TSecr=15164145
  137 2.477634122  10.6.15.156 → 192.168.1.12 SSH 374 Server: Encrypted packet (len=308)
  138 2.477652111 192.168.1.12 → 10.6.15.156  TCP 66 54766 → 22 [ACK] Seq=2917 Ack=39321 Win=6155 Len=0 TSval=8232661 TSecr=15164162
  139 2.533714349  10.6.15.156 → 192.168.1.12 SSH 374 Server: Encrypted packet (len=308)
  140 2.533732909 192.168.1.12 → 10.6.15.156  TCP 66 54766 → 22 [ACK] Seq=2917 Ack=39629 Win=6155 Len=0 TSval=8232675 TSecr=15164177
  141 2.636280891  10.6.15.156 → 192.168.1.12 SSH 270 Server: Encrypted packet (len=204)
  142 2.636298421 192.168.1.12 → 10.6.15.156  TCP 66 54766 → 22 [ACK] Seq=2917 Ack=39833 Win=6155 Len=0 TSval=8232701 TSecr=15164202
  143 2.857555861  10.6.15.156 → 192.168.1.12 SSH 190 Server: Encrypted packet (len=124)
  144 2.857573080 192.168.1.12 → 10.6.15.156  TCP 66 54766 → 22 [ACK] Seq=2917 Ack=39957 Win=6155 Len=0 TSval=8232756 TSecr=15164258
  145 2.926962404  10.6.15.156 → 192.168.1.12 SSH 190 Server: Encrypted packet (len=124)
  146 2.926987697 192.168.1.12 → 10.6.15.156  TCP 66 54766 → 22 [ACK] Seq=2917 Ack=40081 Win=6155 Len=0 TSval=8232774 TSecr=15164275
  147 2.984560319  10.6.15.156 → 192.168.1.12 SSH 182 Server: Encrypted packet (len=116)
  148 2.984578412 192.168.1.12 → 10.6.15.156  TCP 66 54766 → 22 [ACK] Seq=2917 Ack=40197 Win=6155 Len=0 TSval=8232788 TSecr=15164289
  149 3.018328023 192.168.1.12 → 224.0.0.252  LLMNR 61 Standard query 0x7e20 A x
  150 3.268240630 192.168.1.12 → 224.0.0.252  LLMNR 61 Standard query 0x7e20 A x
  151 3.308685255  10.6.15.156 → 192.168.1.12 SSH 270 Server: Encrypted packet (len=204)
  152 3.308700173 192.168.1.12 → 10.6.15.156  TCP 66 54766 → 22 [ACK] Seq=2917 Ack=40401 Win=6155 Len=0 TSval=8232869 TSecr=15164370
  153 3.379544764  10.6.15.156 → 192.168.1.12 SSH 270 Server: Encrypted packet (len=204)
  154 3.379562177 192.168.1.12 → 10.6.15.156  TCP 66 54766 → 22 [ACK] Seq=2917 Ack=40605 Win=6155 Len=0 TSval=8232887 TSecr=15164388
  155 3.435707458  10.6.15.156 → 192.168.1.12 SSH 270 Server: Encrypted packet (len=204)
  156 3.435725694 192.168.1.12 → 10.6.15.156  TCP 66 54766 → 22 [ACK] Seq=2917 Ack=40809 Win=6155 Len=0 TSval=8232901 TSecr=15164402
  157 3.518315657 192.168.1.12 → 224.0.0.252  LLMNR 61 Standard query 0x7e20 A x
  158 3.538355415  10.6.15.156 → 192.168.1.12 SSH 270 Server: Encrypted packet (len=204)
  159 3.538371515 192.168.1.12 → 10.6.15.156  TCP 66 54766 → 22 [ACK] Seq=2917 Ack=41013 Win=6155 Len=0 TSval=8232927 TSecr=15164428
  160 3.759985608  10.6.15.156 → 192.168.1.12 SSH 206 Server: Encrypted packet (len=140)
  161 3.760003734 192.168.1.12 → 10.6.15.156  TCP 66 54766 → 22 [ACK] Seq=2917 Ack=41153 Win=6155 Len=0 TSval=8232982 TSecr=15164483
  162 3.829207852  10.6.15.156 → 192.168.1.12 SSH 254 Server: Encrypted packet (len=188)
  163 3.829224981 192.168.1.12 → 10.6.15.156  TCP 66 54766 → 22 [ACK] Seq=2917 Ack=41341 Win=6155 Len=0 TSval=8232999 TSecr=15164500
  164 3.886551290  10.6.15.156 → 192.168.1.12 SSH 206 Server: Encrypted packet (len=140)
  165 3.886568435 192.168.1.12 → 10.6.15.156  TCP 66 54766 → 22 [ACK] Seq=2917 Ack=41481 Win=6155 Len=0 TSval=8233014 TSecr=15164515
  166 3.989264792  10.6.15.156 → 192.168.1.12 SSH 206 Server: Encrypted packet (len=140)
  167 3.989282922 192.168.1.12 → 10.6.15.156  TCP 66 54766 → 22 [ACK] Seq=2917 Ack=41621 Win=6155 Len=0 TSval=8233039 TSecr=15164540
  168 4.325001761  10.6.15.156 → 192.168.1.12 SSH 150 Server: Encrypted packet (len=84)
  169 4.325020027 192.168.1.12 → 10.6.15.156  TCP 66 54766 → 22 [ACK] Seq=2917 Ack=41705 Win=6155 Len=0 TSval=8233123 TSecr=15164624
  170 4.325333970 192.168.1.12 → 10.6.15.156  SSH 150 Client: Encrypted packet (len=84)
  171 4.365792442  10.6.15.156 → 192.168.1.12 TCP 66 22 → 54766 [ACK] Seq=41705 Ack=3001 Win=1452 Len=0 TSval=15164635 TSecr=8233123
  172 4.636701607  192.168.1.1 → 224.0.0.1    IGMPv2 42 Membership Query, general
  173 4.858296512 192.168.1.12 → 224.0.0.252  IGMPv2 46 Membership Report group 224.0.0.252
  174 4.882446172  10.6.15.156 → 192.168.1.12 SSH 150 Server: Encrypted packet (len=84)
  175 4.882730290 192.168.1.12 → 10.6.15.156  SSH 150 Client: Encrypted packet (len=84)
  176 4.884349804  10.6.15.156 → 192.168.1.12 TCP 66 22 → 54766 [ACK] Seq=41789 Ack=3085 Win=1452 Len=0 TSval=15164764 TSecr=8233263
  177 5.112498086  10.6.15.156 → 192.168.1.12 SSH 182 Server: Encrypted packet (len=116)
  178 5.154259385 192.168.1.12 → 10.6.15.156  TCP 66 54766 → 22 [ACK] Seq=3085 Ack=41905 Win=6155 Len=0 TSval=8233331 TSecr=15164821
  179 5.181871818  10.6.15.156 → 192.168.1.12 SSH 182 Server: Encrypted packet (len=116)
  180 5.181898039 192.168.1.12 → 10.6.15.156  TCP 66 54766 → 22 [ACK] Seq=3085 Ack=42021 Win=6155 Len=0 TSval=8233337 TSecr=15164839
  181 5.239568053  10.6.15.156 → 192.168.1.12 SSH 182 Server: Encrypted packet (len=116)
  182 5.239586383 192.168.1.12 → 10.6.15.156  TCP 66 54766 → 22 [ACK] Seq=3085 Ack=42137 Win=6155 Len=0 TSval=8233352 TSecr=15164853
  183 5.342225557  10.6.15.156 → 192.168.1.12 SSH 190 Server: Encrypted packet (len=124)
  184 5.342243530 192.168.1.12 → 10.6.15.156  TCP 66 54766 → 22 [ACK] Seq=3085 Ack=42261 Win=6155 Len=0 TSval=8233377 TSecr=15164879
  185 5.849133282  10.6.15.156 → 192.168.1.12 SSH 102 Server: Encrypted packet (len=36)
  186 5.849154412 192.168.1.12 → 10.6.15.156  TCP 66 54766 → 22 [ACK] Seq=3085 Ack=42297 Win=6155 Len=0 TSval=8233504 TSecr=15165005
  187 5.882388243 192.168.1.12 → 10.6.15.156  SSH 138 Client: Encrypted packet (len=72)
  188 5.884065954  10.6.15.156 → 192.168.1.12 TCP 66 22 → 54766 [ACK] Seq=42297 Ack=3157 Win=1452 Len=0 TSval=15165014 TSecr=8233513
  189 5.884082719 192.168.1.12 → 10.6.15.156  SSH 166 Client: Encrypted packet (len=100)
  190 5.884620199  10.6.15.156 → 192.168.1.12 SSH 102 Server: Encrypted packet (len=36)
  191 5.925552041  10.6.15.156 → 192.168.1.12 TCP 66 22 → 54766 [ACK] Seq=42333 Ack=3257 Win=1452 Len=0 TSval=15165025 TSecr=8233513
  192 5.926268480 192.168.1.12 → 10.6.15.156  TCP 66 54766 → 22 [ACK] Seq=3257 Ack=42333 Win=6155 Len=0 TSval=8233524 TSecr=15165014
  193 5.962289299 192.168.1.12 → 10.6.15.156  SSH 174 Client: Encrypted packet (len=108)
  194 5.963779768  10.6.15.156 → 192.168.1.12 TCP 66 22 → 54766 [ACK] Seq=42333 Ack=3365 Win=1452 Len=0 TSval=15165034 TSecr=8233533
  195 5.963790162 192.168.1.12 → 10.6.15.156  SSH 182 Client: Encrypted packet (len=116)
  196 5.965414610  10.6.15.156 → 192.168.1.12 TCP 66 22 → 54766 [ACK] Seq=42333 Ack=3481 Win=1452 Len=0 TSval=15165035 TSecr=8233533
  197 6.014804459  10.6.15.156 → 192.168.1.12 SSH 1514 Server: Encrypted packet (len=1448)
  198 6.014822839 192.168.1.12 → 10.6.15.156  TCP 66 54766 → 22 [ACK] Seq=3481 Ack=43781 Win=6155 Len=0 TSval=8233546 TSecr=15165047
  199 6.014871301  10.6.15.156 → 192.168.1.12 SSH 270 Server: Encrypted packet (len=204)
  200 6.014878848 192.168.1.12 → 10.6.15.156  TCP 66 54766 → 22 [ACK] Seq=3481 Ack=43985 Win=6155 Len=0 TSval=8233546 TSecr=15165047
  201 6.015549229 192.168.1.12 → 10.6.15.156  SSH 118 Client: Encrypted packet (len=52)
  202 6.016834404  10.6.15.156 → 192.168.1.12 TCP 66 22 → 54766 [ACK] Seq=43985 Ack=3533 Win=1452 Len=0 TSval=15165047 TSecr=8233546
  203 6.016852236 192.168.1.12 → 10.6.15.156  SSH 118 Client: Encrypted packet (len=52)
  204 6.018285661  10.6.15.156 → 192.168.1.12 TCP 66 22 → 54766 [ACK] Seq=43985 Ack=3585 Win=1452 Len=0 TSval=15165048 TSecr=8233546
  205 6.066679306  10.6.15.156 → 192.168.1.12 SSH 438 Server: Encrypted packet (len=372)
  206 6.067082606  10.6.15.156 → 192.168.1.12 SSH 406 Server: Encrypted packet (len=340)
  207 6.067116072 192.168.1.12 → 10.6.15.156  TCP 66 54766 → 22 [ACK] Seq=3585 Ack=44697 Win=6155 Len=0 TSval=8233559 TSecr=15165060
  208 6.072036607 192.168.1.12 → 10.6.15.156  SSH 110 Client: Encrypted packet (len=44)
  209 6.073414075  10.6.15.156 → 192.168.1.12 TCP 66 22 → 54766 [ACK] Seq=44697 Ack=3629 Win=1452 Len=0 TSval=15165062 TSecr=8233560
  210 6.122701428  10.6.15.156 → 192.168.1.12 SSH 110 Server: Encrypted packet (len=44)
  211 6.123091435 192.168.1.12 → 10.6.15.156  SSH 382 Client: Encrypted packet (len=316)
  212 6.124858567  10.6.15.156 → 192.168.1.12 TCP 66 22 → 54766 [ACK] Seq=44741 Ack=3945 Win=1452 Len=0 TSval=15165074 TSecr=8233573
  213 6.174746888  10.6.15.156 → 192.168.1.12 SSH 246 Server: Encrypted packet (len=180)
  214 6.175024073 192.168.1.12 → 10.6.15.156  SSH 134 Client: Encrypted packet (len=68)
  215 6.176572322  10.6.15.156 → 192.168.1.12 TCP 66 22 → 54766 [ACK] Seq=44921 Ack=4013 Win=1452 Len=0 TSval=15165087 TSecr=8233586
  216 6.176579730 192.168.1.12 → 10.6.15.156  SSH 682 Client: Encrypted packet (len=616)
  217 6.178617285  10.6.15.156 → 192.168.1.12 TCP 66 22 → 54766 [ACK] Seq=44921 Ack=4629 Win=1452 Len=0 TSval=15165088 TSecr=8233586
  218 6.228074577  10.6.15.156 → 192.168.1.12 SSH 174 Server: Encrypted packet (len=108)
  219 6.228325848 192.168.1.12 → 10.6.15.156  SSH 126 Client: Encrypted packet (len=60)
  220 6.229581145  10.6.15.156 → 192.168.1.12 SSH 806 Server: Encrypted packet (len=740)
  221 6.230139606  10.6.15.156 → 192.168.1.12 TCP 66 22 → 54766 [ACK] Seq=45769 Ack=4689 Win=1452 Len=0 TSval=15165101 TSecr=8233599
  222 6.260796555  10.6.15.156 → 192.168.1.12 SSH 270 Server: Encrypted packet (len=204)
  223 6.260811910 192.168.1.12 → 10.6.15.156  TCP 66 54766 → 22 [ACK] Seq=4689 Ack=45973 Win=6155 Len=0 TSval=8233607 TSecr=15165100
  224 6.339829504  10.6.15.156 → 192.168.1.12 SSH 110 Server: Encrypted packet (len=44)
  225 6.340238796 192.168.1.12 → 10.6.15.156  SSH 390 Client: Encrypted packet (len=324)
  226 6.381604914  10.6.15.156 → 192.168.1.12 TCP 66 22 → 54766 [ACK] Seq=46017 Ack=5013 Win=1452 Len=0 TSval=15165139 TSecr=8233627
  227 6.465648488  10.6.15.156 → 192.168.1.12 SSH 182 Server: Encrypted packet (len=116)
  228 6.506313286 192.168.1.12 → 10.6.15.156  TCP 66 54766 → 22 [ACK] Seq=5013 Ack=46133 Win=6155 Len=0 TSval=8233669 TSecr=15165160
  229 6.535129569  10.6.15.156 → 192.168.1.12 SSH 238 Server: Encrypted packet (len=172)
  230 6.535210764 192.168.1.12 → 10.6.15.156  TCP 66 54766 → 22 [ACK] Seq=5013 Ack=46305 Win=6155 Len=0 TSval=8233676 TSecr=15165177
  231 6.588935983  10.6.15.156 → 192.168.1.12 SSH 102 Server: Encrypted packet (len=36)
  232 6.589018164 192.168.1.12 → 10.6.15.156  TCP 66 54766 → 22 [ACK] Seq=5013 Ack=46341 Win=6155 Len=0 TSval=8233689 TSecr=15165190
  233 6.592601574  10.6.15.156 → 192.168.1.12 SSH 238 Server: Encrypted packet (len=172)
  234 6.592681009 192.168.1.12 → 10.6.15.156  TCP 66 54766 → 22 [ACK] Seq=5013 Ack=46513 Win=6155 Len=0 TSval=8233690 TSecr=15165191
  235 6.695224220  10.6.15.156 → 192.168.1.12 SSH 238 Server: Encrypted packet (len=172)
  236 6.695305467 192.168.1.12 → 10.6.15.156  TCP 66 54766 → 22 [ACK] Seq=5013 Ack=46685 Win=6155 Len=0 TSval=8233716 TSecr=15165217
  237 6.716820380  10.6.15.156 → 192.168.1.12 SSH 214 Server: Encrypted packet (len=148)
  238 6.716901326 192.168.1.12 → 10.6.15.156  TCP 66 54766 → 22 [ACK] Seq=5013 Ack=46833 Win=6155 Len=0 TSval=8233721 TSecr=15165222
  239 6.717136881 192.168.1.12 → 10.6.15.156  SSH 134 Client: Encrypted packet (len=68)
  240 6.718642274  10.6.15.156 → 192.168.1.12 TCP 66 22 → 54766 [ACK] Seq=46833 Ack=5081 Win=1452 Len=0 TSval=15165223 TSecr=8233721
  241 6.718650785 192.168.1.12 → 10.6.15.156  SSH 666 Client: Encrypted packet (len=600)
  242 6.720584059  10.6.15.156 → 192.168.1.12 TCP 66 22 → 54766 [ACK] Seq=46833 Ack=5681 Win=1452 Len=0 TSval=15165223 TSecr=8233722
  243 6.924137703 192.168.1.12 → 139.59.50.38 NTP 90 NTP Version 4, client
  244 7.043697051  10.6.15.156 → 192.168.1.12 SSH 182 Server: Encrypted packet (len=116)
  245 7.086259399 192.168.1.12 → 10.6.15.156  TCP 66 54766 → 22 [ACK] Seq=5681 Ack=46949 Win=6155 Len=0 TSval=8233814 TSecr=15165304
  246 7.093231303  10.6.15.156 → 192.168.1.12 SSH 166 Server: Encrypted packet (len=100)
  247 7.093259955 192.168.1.12 → 10.6.15.156  TCP 66 54766 → 22 [ACK] Seq=5681 Ack=47049 Win=6155 Len=0 TSval=8233815 TSecr=15165316
  248 7.093537092 192.168.1.12 → 10.6.15.156  SSH 126 Client: Encrypted packet (len=60)
  249 7.094977375  10.6.15.156 → 192.168.1.12 TCP 66 22 → 54766 [ACK] Seq=47049 Ack=5741 Win=1452 Len=0 TSval=15165317 TSecr=8233815
  250 7.095071971  10.6.15.156 → 192.168.1.12 SSH 134 Server: Encrypted packet (len=68)
  251 7.097720311  10.6.15.156 → 192.168.1.12 SSH 398 Server: Encrypted packet (len=332)
  252 7.097801902 192.168.1.12 → 10.6.15.156  TCP 66 54766 → 22 [ACK] Seq=5741 Ack=47449 Win=6155 Len=0 TSval=8233816 TSecr=15165317
  253 7.146309621  10.6.15.156 → 192.168.1.12 SSH 270 Server: Encrypted packet (len=204)
  254 7.190314523 192.168.1.12 → 10.6.15.156  TCP 66 54766 → 22 [ACK] Seq=5741 Ack=47653 Win=6155 Len=0 TSval=8233840 TSecr=15165330
  255 7.367825017  10.6.15.156 → 192.168.1.12 SSH 390 Server: Encrypted packet (len=324)
  256 7.367852213 192.168.1.12 → 10.6.15.156  TCP 66 54766 → 22 [ACK] Seq=5741 Ack=47977 Win=6155 Len=0 TSval=8233884 TSecr=15165385
  257 7.437413070  10.6.15.156 → 192.168.1.12 SSH 302 Server: Encrypted packet (len=236)
  258 7.437431529 192.168.1.12 → 10.6.15.156  TCP 66 54766 → 22 [ACK] Seq=5741 Ack=48213 Win=6155 Len=0 TSval=8233901 TSecr=15165402
  259 7.494667271  10.6.15.156 → 192.168.1.12 SSH 302 Server: Encrypted packet (len=236)
  260 7.494688826 192.168.1.12 → 10.6.15.156  TCP 66 54766 → 22 [ACK] Seq=5741 Ack=48449 Win=6155 Len=0 TSval=8233916 TSecr=15165417
  261 7.597611260  10.6.15.156 → 192.168.1.12 SSH 206 Server: Encrypted packet (len=140)
  262 7.597629494 192.168.1.12 → 10.6.15.156  TCP 66 54766 → 22 [ACK] Seq=5741 Ack=48589 Win=6155 Len=0 TSval=8233941 TSecr=15165442
  263 7.818684029  10.6.15.156 → 192.168.1.12 SSH 222 Server: Encrypted packet (len=156)
  264 7.818702320 192.168.1.12 → 10.6.15.156  TCP 66 54766 → 22 [ACK] Seq=5741 Ack=48745 Win=6155 Len=0 TSval=8233997 TSecr=15165498
  265 7.888449367  10.6.15.156 → 192.168.1.12 SSH 214 Server: Encrypted packet (len=148)
  266 7.888467194 192.168.1.12 → 10.6.15.156  TCP 66 54766 → 22 [ACK] Seq=5741 Ack=48893 Win=6155 Len=0 TSval=8234014 TSecr=15165515
  267 7.945690668  10.6.15.156 → 192.168.1.12 SSH 254 Server: Encrypted packet (len=188)
  268 7.945709550 192.168.1.12 → 10.6.15.156  TCP 66 54766 → 22 [ACK] Seq=5741 Ack=49081 Win=6155 Len=0 TSval=8234028 TSecr=15165530
  269 8.048448935  10.6.15.156 → 192.168.1.12 SSH 294 Server: Encrypted packet (len=228)
  270 8.048466430 192.168.1.12 → 10.6.15.156  TCP 66 54766 → 22 [ACK] Seq=5741 Ack=49309 Win=6155 Len=0 TSval=8234054 TSecr=15165555
  271 8.269778895  10.6.15.156 → 192.168.1.12 SSH 198 Server: Encrypted packet (len=132)
  272 8.269798040 192.168.1.12 → 10.6.15.156  TCP 66 54766 → 22 [ACK] Seq=5741 Ack=49441 Win=6155 Len=0 TSval=8234109 TSecr=15165611
  273 8.339092413  10.6.15.156 → 192.168.1.12 SSH 206 Server: Encrypted packet (len=140)
  274 8.339110717 192.168.1.12 → 10.6.15.156  TCP 66 54766 → 22 [ACK] Seq=5741 Ack=49581 Win=6155 Len=0 TSval=8234127 TSecr=15165628
  275 8.396815158  10.6.15.156 → 192.168.1.12 SSH 182 Server: Encrypted packet (len=116)
  276 8.396832223 192.168.1.12 → 10.6.15.156  TCP 66 54766 → 22 [ACK] Seq=5741 Ack=49697 Win=6155 Len=0 TSval=8234141 TSecr=15165642
  277 8.501074839  10.6.15.156 → 192.168.1.12 SSH 454 Server: Encrypted packet (len=388)
  278 8.501094018 192.168.1.12 → 10.6.15.156  TCP 66 54766 → 22 [ACK] Seq=5741 Ack=50085 Win=6155 Len=0 TSval=8234167 TSecr=15165668
  279 8.720915811  10.6.15.156 → 192.168.1.12 SSH 406 Server: Encrypted packet (len=340)
  280 8.720933899 192.168.1.12 → 10.6.15.156  TCP 66 54766 → 22 [ACK] Seq=5741 Ack=50425 Win=6155 Len=0 TSval=8234222 TSecr=15165723
  281 8.790548151  10.6.15.156 → 192.168.1.12 SSH 486 Server: Encrypted packet (len=420)
  282 8.790567899 192.168.1.12 → 10.6.15.156  TCP 66 54766 → 22 [ACK] Seq=5741 Ack=50845 Win=6155 Len=0 TSval=8234240 TSecr=15165741
  283 8.847877244  10.6.15.156 → 192.168.1.12 SSH 486 Server: Encrypted packet (len=420)
  284 8.847894816 192.168.1.12 → 10.6.15.156  TCP 66 54766 → 22 [ACK] Seq=5741 Ack=51265 Win=6155 Len=0 TSval=8234254 TSecr=15165755
  285 8.950113397  10.6.15.156 → 192.168.1.12 SSH 182 Server: Encrypted packet (len=116)
  286 8.950129577 192.168.1.12 → 10.6.15.156  TCP 66 54766 → 22 [ACK] Seq=5741 Ack=51381 Win=6155 Len=0 TSval=8234279 TSecr=15165781
  287 9.171730228  10.6.15.156 → 192.168.1.12 SSH 406 Server: Encrypted packet (len=340)
  288 9.171745671 192.168.1.12 → 10.6.15.156  TCP 66 54766 → 22 [ACK] Seq=5741 Ack=51721 Win=6155 Len=0 TSval=8234335 TSecr=15165836
  289 9.241218676  10.6.15.156 → 192.168.1.12 SSH 326 Server: Encrypted packet (len=260)
  290 9.241232445 192.168.1.12 → 10.6.15.156  TCP 66 54766 → 22 [ACK] Seq=5741 Ack=51981 Win=6155 Len=0 TSval=8234352 TSecr=15165853
  291 9.298661055  10.6.15.156 → 192.168.1.12 SSH 326 Server: Encrypted packet (len=260)
  292 9.298673466 192.168.1.12 → 10.6.15.156  TCP 66 54766 → 22 [ACK] Seq=5741 Ack=52241 Win=6155 Len=0 TSval=8234367 TSecr=15165868
  293 9.401415905  10.6.15.156 → 192.168.1.12 SSH 318 Server: Encrypted packet (len=252)
  294 9.401433282 192.168.1.12 → 10.6.15.156  TCP 66 54766 → 22 [ACK] Seq=5741 Ack=52493 Win=6155 Len=0 TSval=8234392 TSecr=15165893
  295 9.541035975  10.6.15.156 → 192.168.1.12 SSH 150 Server: Encrypted packet (len=84)
  296 9.541053406 192.168.1.12 → 10.6.15.156  TCP 66 54766 → 22 [ACK] Seq=5741 Ack=52577 Win=6155 Len=0 TSval=8234427 TSecr=15165928
  297 9.541350826 192.168.1.12 → 10.6.15.156  SSH 150 Client: Encrypted packet (len=84)
  298 9.542891773  10.6.15.156 → 192.168.1.12 SSH 150 Server: Encrypted packet (len=84)
  299 9.581603305  10.6.15.156 → 192.168.1.12 TCP 66 22 → 54766 [ACK] Seq=52661 Ack=5825 Win=1452 Len=0 TSval=15165939 TSecr=8234427
  300 9.581624190 192.168.1.12 → 10.6.15.156  SSH 150 Client: Encrypted packet (len=84)
  301 9.583173381  10.6.15.156 → 192.168.1.12 TCP 66 22 → 54766 [ACK] Seq=52661 Ack=5909 Win=1452 Len=0 TSval=15165939 TSecr=8234437
  302 9.692135765  10.6.15.156 → 192.168.1.12 SSH 254 Server: Encrypted packet (len=188)
  303 9.734312367 192.168.1.12 → 10.6.15.156  TCP 66 54766 → 22 [ACK] Seq=5909 Ack=52849 Win=6155 Len=0 TSval=8234476 TSecr=15165966
  304 9.749691981  10.6.15.156 → 192.168.1.12 SSH 254 Server: Encrypted packet (len=188)
  305 9.749717752 192.168.1.12 → 10.6.15.156  TCP 66 54766 → 22 [ACK] Seq=5909 Ack=53037 Win=6155 Len=0 TSval=8234479 TSecr=15165981
  306 9.852411057  10.6.15.156 → 192.168.1.12 SSH 254 Server: Encrypted packet (len=188)
  307 9.852440419 192.168.1.12 → 10.6.15.156  TCP 66 54766 → 22 [ACK] Seq=5909 Ack=53225 Win=6155 Len=0 TSval=8234505 TSecr=15166006
  308 10.073751117  10.6.15.156 → 192.168.1.12 SSH 286 Server: Encrypted packet (len=220)
  309 10.073768577 192.168.1.12 → 10.6.15.156  TCP 66 54766 → 22 [ACK] Seq=5909 Ack=53445 Win=6155 Len=0 TSval=8234560 TSecr=15166062
  310 10.142995392  10.6.15.156 → 192.168.1.12 SSH 182 Server: Encrypted packet (len=116)
  311 10.143012047 192.168.1.12 → 10.6.15.156  TCP 66 54766 → 22 [ACK] Seq=5909 Ack=53561 Win=6155 Len=0 TSval=8234578 TSecr=15166079
  312 10.200497675  10.6.15.156 → 192.168.1.12 SSH 182 Server: Encrypted packet (len=116)
  313 10.200515599 192.168.1.12 → 10.6.15.156  TCP 66 54766 → 22 [ACK] Seq=5909 Ack=53677 Win=6155 Len=0 TSval=8234592 TSecr=15166093
  314 10.303287571  10.6.15.156 → 192.168.1.12 SSH 222 Server: Encrypted packet (len=156)
  315 10.303306615 192.168.1.12 → 10.6.15.156  TCP 66 54766 → 22 [ACK] Seq=5909 Ack=53833 Win=6155 Len=0 TSval=8234618 TSecr=15166119
  316 10.524971268  10.6.15.156 → 192.168.1.12 SSH 422 Server: Encrypted packet (len=356)
  317 10.524988135 192.168.1.12 → 10.6.15.156  TCP 66 54766 → 22 [ACK] Seq=5909 Ack=54189 Win=6155 Len=0 TSval=8234673 TSecr=15166174
  318 10.594263274  10.6.15.156 → 192.168.1.12 SSH 422 Server: Encrypted packet (len=356)
  319 10.594281005 192.168.1.12 → 10.6.15.156  TCP 66 54766 → 22 [ACK] Seq=5909 Ack=54545 Win=6155 Len=0 TSval=8234690 TSecr=15166192
  320 10.651924733  10.6.15.156 → 192.168.1.12 SSH 422 Server: Encrypted packet (len=356)
  321 10.651942467 192.168.1.12 → 10.6.15.156  TCP 66 54766 → 22 [ACK] Seq=5909 Ack=54901 Win=6155 Len=0 TSval=8234705 TSecr=15166206
  322 10.754784526  10.6.15.156 → 192.168.1.12 SSH 390 Server: Encrypted packet (len=324)
  323 10.754800810 192.168.1.12 → 10.6.15.156  TCP 66 54766 → 22 [ACK] Seq=5909 Ack=55225 Win=6155 Len=0 TSval=8234731 TSecr=15166232
  324 11.044956274  10.6.15.156 → 192.168.1.12 SSH 182 Server: Encrypted packet (len=116)
  325 11.044973076 192.168.1.12 → 10.6.15.156  TCP 66 54766 → 22 [ACK] Seq=5909 Ack=55341 Win=6155 Len=0 TSval=8234803 TSecr=15166304
  326 11.103026114  10.6.15.156 → 192.168.1.12 SSH 182 Server: Encrypted packet (len=116)
  327 11.103043918 192.168.1.12 → 10.6.15.156  TCP 66 54766 → 22 [ACK] Seq=5909 Ack=55457 Win=6155 Len=0 TSval=8234818 TSecr=15166319
  328 11.205266834  10.6.15.156 → 192.168.1.12 SSH 182 Server: Encrypted packet (len=116)
  329 11.205284668 192.168.1.12 → 10.6.15.156  TCP 66 54766 → 22 [ACK] Seq=5909 Ack=55573 Win=6155 Len=0 TSval=8234843 TSecr=15166344
  330 11.323865825 192.168.1.12 → 10.6.15.156  SSH 102 Client: Encrypted packet (len=36)
  331 11.325570004  10.6.15.156 → 192.168.1.12 TCP 66 22 → 54766 [ACK] Seq=55573 Ack=5945 Win=1452 Len=0 TSval=15166375 TSecr=8234873
  332 11.325590528 192.168.1.12 → 10.6.15.156  SSH 594 Client: Encrypted packet (len=528)
  333 11.327441821  10.6.15.156 → 192.168.1.12 TCP 66 22 → 54766 [ACK] Seq=55573 Ack=6473 Win=1452 Len=0 TSval=15166375 TSecr=8234873
  334 11.329771505  10.6.15.156 → 192.168.1.12 SSH 102 Server: Encrypted packet (len=36)
  335 11.329788830 192.168.1.12 → 10.6.15.156  TCP 66 54766 → 22 [ACK] Seq=6473 Ack=55609 Win=6155 Len=0 TSval=8234874 TSecr=15166376
  336 11.332043906  10.6.15.156 → 192.168.1.12 SSH 110 Server: Encrypted packet (len=44)
  337 11.332060088 192.168.1.12 → 10.6.15.156  TCP 66 54766 → 22 [ACK] Seq=6473 Ack=55653 Win=6155 Len=0 TSval=8234875 TSecr=15166376
  338 11.332412040 192.168.1.12 → 10.6.15.156  SSH 182 Client: Encrypted packet (len=116)
  339 11.373318551  10.6.15.156 → 192.168.1.12 SSH 1514 Server: Encrypted packet (len=1448)
  340 11.373473475  10.6.15.156 → 192.168.1.12 SSH 1514 Server: Encrypted packet (len=1448)
  341 11.373484351 192.168.1.12 → 10.6.15.156  TCP 66 54766 → 22 [ACK] Seq=6589 Ack=58549 Win=6155 Len=0 TSval=8234885 TSecr=15166386
  342 11.373621798  10.6.15.156 → 192.168.1.12 SSH 206 Server: Encrypted packet (len=140)
  343 11.374613118 192.168.1.12 → 10.6.15.156  SSH 182 Client: Encrypted packet (len=116)
  344 11.374986586  10.6.15.156 → 192.168.1.12 SSH 138 Server: Encrypted packet (len=72)
  345 11.374995881  10.6.15.156 → 192.168.1.12 SSH 138 Server: Encrypted packet (len=72)
  346 11.375021095 192.168.1.12 → 10.6.15.156  TCP 66 54766 → 22 [ACK] Seq=6705 Ack=58833 Win=6155 Len=0 TSval=8234886 TSecr=15166387
  347 11.375323991 192.168.1.12 → 10.6.15.156  SSH 138 Client: Encrypted packet (len=72)
  348 11.375640530 192.168.1.12 → 10.6.15.156  SSH 1514 Client: Encrypted packet (len=1448)
  349 11.376511246 192.168.1.12 → 10.6.15.156  SSH 1010 Client: Encrypted packet (len=944)
  350 11.376610669  10.6.15.156 → 192.168.1.12 SSH 210 Server: Encrypted packet (len=144)
  351 11.376756385  10.6.15.156 → 192.168.1.12 SSH 138 Server: Encrypted packet (len=72)
  352 11.376894425 192.168.1.12 → 10.6.15.156  TCP 66 54766 → 22 [ACK] Seq=9169 Ack=59049 Win=6155 Len=0 TSval=8234886 TSecr=15166387
  353 11.377467630 192.168.1.12 → 10.6.15.156  SSH 174 Client: Encrypted packet (len=108)
  354 11.378594465  10.6.15.156 → 192.168.1.12 TCP 66 22 → 54766 [ACK] Seq=59049 Ack=8225 Win=1452 Len=0 TSval=15166388 TSecr=8234886
  355 11.378705582  10.6.15.156 → 192.168.1.12 TCP 66 22 → 54766 [ACK] Seq=59049 Ack=9277 Win=1452 Len=0 TSval=15166388 TSecr=8234886
  356 11.379534740  10.6.15.156 → 192.168.1.12 SSH 382 Server: Encrypted packet (len=316)
  357 11.380953165  10.6.15.156 → 192.168.1.12 SSH 198 Server: Encrypted packet (len=132)
  358 11.381032133 192.168.1.12 → 10.6.15.156  TCP 66 54766 → 22 [ACK] Seq=9277 Ack=59497 Win=6155 Len=0 TSval=8234887 TSecr=15166388
  359 11.381292079 192.168.1.12 → 10.6.15.156  SSH 126 Client: Encrypted packet (len=60)
  360 11.390481314  10.6.15.156 → 192.168.1.12 SSH 138 Server: Encrypted packet (len=72)
  361 11.390688114 192.168.1.12 → 10.6.15.156  SSH 102 Client: Encrypted packet (len=36)
  362 11.426559524  10.6.15.156 → 192.168.1.12 SSH 270 Server: Encrypted packet (len=204)
  363 11.428884380  10.6.15.156 → 192.168.1.12 SSH 210 Server: Encrypted packet (len=144)
  364 11.428960130 192.168.1.12 → 10.6.15.156  TCP 66 54766 → 22 [ACK] Seq=9373 Ack=59917 Win=6155 Len=0 TSval=8234899 TSecr=15166400
  365 11.429189243 192.168.1.12 → 10.6.15.156  SSH 138 Client: Encrypted packet (len=72)
  366 11.429620917  10.6.15.156 → 192.168.1.12 SSH 138 Server: Encrypted packet (len=72)
  367 11.429629731  10.6.15.156 → 192.168.1.12 SSH 138 Server: Encrypted packet (len=72)
  368 11.429652680 192.168.1.12 → 10.6.15.156  TCP 66 54766 → 22 [ACK] Seq=9445 Ack=60061 Win=6155 Len=0 TSval=8234899 TSecr=15166401
  369 11.429967977 192.168.1.12 → 10.6.15.156  SSH 138 Client: Encrypted packet (len=72)
  370 11.431116440  10.6.15.156 → 192.168.1.12 SSH 138 Server: Encrypted packet (len=72)
  371 11.469848072  10.6.15.156 → 192.168.1.12 TCP 66 22 → 54766 [ACK] Seq=60133 Ack=9517 Win=1452 Len=0 TSval=15166411 TSecr=8234899
  372 11.469868654 192.168.1.12 → 10.6.15.156  SSH 102 Client: Encrypted packet (len=36)
  373 11.471429113  10.6.15.156 → 192.168.1.12 TCP 66 22 → 54766 [ACK] Seq=60133 Ack=9553 Win=1452 Len=0 TSval=15166411 TSecr=8234909
  374 11.495963826  10.6.15.156 → 192.168.1.12 SSH 238 Server: Encrypted packet (len=172)
  375 11.509549000  10.6.15.156 → 192.168.1.12 SSH 1126 Server: Encrypted packet (len=1060)
  376 11.509617942 192.168.1.12 → 10.6.15.156  TCP 66 54766 → 22 [ACK] Seq=9553 Ack=61365 Win=6155 Len=0 TSval=8234919 TSecr=15166417
  377 11.510892610  10.6.15.156 → 192.168.1.12 SSH 510 Server: Encrypted packet (len=444)
  378 11.512873017 192.168.1.12 → 10.6.15.156  SSH 134 Client: Encrypted packet (len=68)
  379 11.553348818  10.6.15.156 → 192.168.1.12 TCP 66 22 → 54766 [ACK] Seq=61809 Ack=9621 Win=1452 Len=0 TSval=15166432 TSecr=8234920
  380 11.553366252  10.6.15.156 → 192.168.1.12 SSH 238 Server: Encrypted packet (len=172)
  381 11.594310487 192.168.1.12 → 10.6.15.156  TCP 66 54766 → 22 [ACK] Seq=9621 Ack=61981 Win=6155 Len=0 TSval=8234941 TSecr=15166432
  382 11.606295899 192.168.1.12 → 224.0.0.251  IGMPv2 46 Membership Report group 224.0.0.251
  383 11.656402695  10.6.15.156 → 192.168.1.12 SSH 270 Server: Encrypted packet (len=204)
  384 11.656469491 192.168.1.12 → 10.6.15.156  TCP 66 54766 → 22 [ACK] Seq=9621 Ack=62185 Win=6155 Len=0 TSval=8234956 TSecr=15166457
  385 11.702753122  10.6.15.156 → 192.168.1.12 SSH 138 Server: Encrypted packet (len=72)
  386 11.702827959 192.168.1.12 → 10.6.15.156  TCP 66 54766 → 22 [ACK] Seq=9621 Ack=62257 Win=6155 Len=0 TSval=8234968 TSecr=15166469
  387 11.702974691 192.168.1.12 → 10.6.15.156  SSH 102 Client: Encrypted packet (len=36)
  388 11.709813158  10.6.15.156 → 192.168.1.12 TCP 66 22 → 54766 [ACK] Seq=62257 Ack=9657 Win=1452 Len=0 TSval=15166470 TSecr=8234968
  389 11.878418969  10.6.15.156 → 192.168.1.12 SSH 182 Server: Encrypted packet (len=116)
  390 11.922288783 192.168.1.12 → 10.6.15.156  TCP 66 54766 → 22 [ACK] Seq=9657 Ack=62373 Win=6155 Len=0 TSval=8235023 TSecr=15166513
  391 11.947249550  10.6.15.156 → 192.168.1.12 SSH 390 Server: Encrypted packet (len=324)
  392 11.947331333 192.168.1.12 → 10.6.15.156  TCP 66 54766 → 22 [ACK] Seq=9657 Ack=62697 Win=6155 Len=0 TSval=8235029 TSecr=15166530
  393 12.004720705  10.6.15.156 → 192.168.1.12 SSH 390 Server: Encrypted packet (len=324)
  394 12.004794567 192.168.1.12 → 10.6.15.156  TCP 66 54766 → 22 [ACK] Seq=9657 Ack=63021 Win=6155 Len=0 TSval=8235043 TSecr=15166544
  395 12.107713952  10.6.15.156 → 192.168.1.12 SSH 470 Server: Encrypted packet (len=404)
  396 12.107780730 192.168.1.12 → 10.6.15.156  TCP 66 54766 → 22 [ACK] Seq=9657 Ack=63425 Win=6155 Len=0 TSval=8235069 TSecr=15166570
  397 12.328873790  10.6.15.156 → 192.168.1.12 SSH 470 Server: Encrypted packet (len=404)
  398 12.328894614 192.168.1.12 → 10.6.15.156  TCP 66 54766 → 22 [ACK] Seq=9657 Ack=63829 Win=6155 Len=0 TSval=8235124 TSecr=15166625
  399 12.398339273  10.6.15.156 → 192.168.1.12 SSH 270 Server: Encrypted packet (len=204)
  400 12.398356893 192.168.1.12 → 10.6.15.156  TCP 66 54766 → 22 [ACK] Seq=9657 Ack=64033 Win=6155 Len=0 TSval=8235142 TSecr=15166643
  401 12.456768396  10.6.15.156 → 192.168.1.12 SSH 270 Server: Encrypted packet (len=204)
  402 12.456786380 192.168.1.12 → 10.6.15.156  TCP 66 54766 → 22 [ACK] Seq=9657 Ack=64237 Win=6155 Len=0 TSval=8235156 TSecr=15166657
  403 13.230762250  10.6.15.156 → 192.168.1.12 SSH 334 Server: Encrypted packet (len=268)
  404 13.230779796 192.168.1.12 → 10.6.15.156  TCP 66 54766 → 22 [ACK] Seq=9657 Ack=64505 Win=6155 Len=0 TSval=8235350 TSecr=15166851
  405 13.300265007  10.6.15.156 → 192.168.1.12 SSH 342 Server: Encrypted packet (len=276)
  406 13.300283939 192.168.1.12 → 10.6.15.156  TCP 66 54766 → 22 [ACK] Seq=9657 Ack=64781 Win=6155 Len=0 TSval=8235367 TSecr=15166868
  407 13.357705000  10.6.15.156 → 192.168.1.12 SSH 342 Server: Encrypted packet (len=276)
  408 13.357724026 192.168.1.12 → 10.6.15.156  TCP 66 54766 → 22 [ACK] Seq=9657 Ack=65057 Win=6155 Len=0 TSval=8235381 TSecr=15166883
  409 13.460581278  10.6.15.156 → 192.168.1.12 SSH 342 Server: Encrypted packet (len=276)
  410 13.460599931 192.168.1.12 → 10.6.15.156  TCP 66 54766 → 22 [ACK] Seq=9657 Ack=65333 Win=6155 Len=0 TSval=8235407 TSecr=15166908
  411 13.751063970  10.6.15.156 → 192.168.1.12 SSH 198 Server: Encrypted packet (len=132)
  412 13.751081676 192.168.1.12 → 10.6.15.156  TCP 66 54766 → 22 [ACK] Seq=9657 Ack=65465 Win=6155 Len=0 TSval=8235480 TSecr=15166981
  413 13.808736491  10.6.15.156 → 192.168.1.12 SSH 206 Server: Encrypted packet (len=140)
  414 13.808754111 192.168.1.12 → 10.6.15.156  TCP 66 54766 → 22 [ACK] Seq=9657 Ack=65605 Win=6155 Len=0 TSval=8235494 TSecr=15166995
  415 13.850898792 192.168.1.12 → 10.6.15.156  SSH 102 Client: Encrypted packet (len=36)
  416 13.852355499  10.6.15.156 → 192.168.1.12 TCP 66 22 → 54766 [ACK] Seq=65605 Ack=9693 Win=1452 Len=0 TSval=15167006 TSecr=8235505
  417 13.911349639  10.6.15.156 → 192.168.1.12 SSH 198 Server: Encrypted packet (len=132)
  418 13.911369773 192.168.1.12 → 10.6.15.156  TCP 66 54766 → 22 [ACK] Seq=9693 Ack=65737 Win=6155 Len=0 TSval=8235520 TSecr=15167021
  419 14.067432221  10.6.15.156 → 192.168.1.12 SSH 102 Server: Encrypted packet (len=36)
  420 14.067449878 192.168.1.12 → 10.6.15.156  TCP 66 54766 → 22 [ACK] Seq=9693 Ack=65773 Win=6155 Len=0 TSval=8235559 TSecr=15167060
  421 14.067774054 192.168.1.12 → 10.6.15.156  SSH 142 Client: Encrypted packet (len=76)
  422 14.069282002  10.6.15.156 → 192.168.1.12 TCP 66 22 → 54766 [ACK] Seq=65773 Ack=9769 Win=1452 Len=0 TSval=15167060 TSecr=8235559
  423 14.123525478 10.22.17.139 → 224.0.0.252  LLMNR 69 Standard query 0x5c01 A ubfriqdll
  424 14.128937885 10.22.17.139 → 224.0.0.252  LLMNR 64 Standard query 0x779a A wpad
  425 14.131673912 10.22.17.139 → 224.0.0.252  LLMNR 64 Standard query 0xacb7 A wpad
  426 14.132477386  10.6.15.156 → 192.168.1.12 SSH 182 Server: Encrypted packet (len=116)
  427 14.174312341 192.168.1.12 → 10.6.15.156  TCP 66 54766 → 22 [ACK] Seq=9769 Ack=65889 Win=6155 Len=0 TSval=8235586 TSecr=15167076
  428 14.202005479  10.6.15.156 → 192.168.1.12 SSH 198 Server: Encrypted packet (len=132)
  429 14.202031858 192.168.1.12 → 10.6.15.156  TCP 66 54766 → 22 [ACK] Seq=9769 Ack=66021 Win=6155 Len=0 TSval=8235592 TSecr=15167094
  430 14.260016115  10.6.15.156 → 192.168.1.12 SSH 198 Server: Encrypted packet (len=132)
  431 14.260034096 192.168.1.12 → 10.6.15.156  TCP 66 54766 → 22 [ACK] Seq=9769 Ack=66153 Win=6155 Len=0 TSval=8235607 TSecr=15167108
  432 14.285615563  10.6.15.156 → 192.168.1.12 SSH 150 Server: Encrypted packet (len=84)
  433 14.285635908 192.168.1.12 → 10.6.15.156  TCP 66 54766 → 22 [ACK] Seq=9769 Ack=66237 Win=6155 Len=0 TSval=8235613 TSecr=15167115
  434 14.362481188  10.6.15.156 → 192.168.1.12 SSH 358 Server: Encrypted packet (len=292)
  435 14.362507881 192.168.1.12 → 10.6.15.156  TCP 66 54766 → 22 [ACK] Seq=9769 Ack=66529 Win=6155 Len=0 TSval=8235633 TSecr=15167134
  436 14.535397210 10.22.17.139 → 224.0.0.252  LLMNR 69 Standard query 0x5c01 A ubfriqdll
  437 14.540801402 10.22.17.139 → 224.0.0.252  LLMNR 64 Standard query 0xacb7 A wpad
  438 14.540933832 10.22.17.139 → 224.0.0.252  LLMNR 64 Standard query 0x779a A wpad
  439 14.583768485  10.6.15.156 → 192.168.1.12 SSH 518 Server: Encrypted packet (len=452)
  440 14.583785684 192.168.1.12 → 10.6.15.156  TCP 66 54766 → 22 [ACK] Seq=9769 Ack=66981 Win=6155 Len=0 TSval=8235688 TSecr=15167189
  441 14.653378612  10.6.15.156 → 192.168.1.12 SSH 454 Server: Encrypted packet (len=388)
  442 14.653403138 192.168.1.12 → 10.6.15.156  TCP 66 54766 → 22 [ACK] Seq=9769 Ack=67369 Win=6155 Len=0 TSval=8235705 TSecr=15167206
  443 14.710815877  10.6.15.156 → 192.168.1.12 SSH 454 Server: Encrypted packet (len=388)
  444 14.710832137 192.168.1.12 → 10.6.15.156  TCP 66 54766 → 22 [ACK] Seq=9769 Ack=67757 Win=6155 Len=0 TSval=8235720 TSecr=15167221
  445 14.813514866  10.6.15.156 → 192.168.1.12 SSH 334 Server: Encrypted packet (len=268)
  446 14.813532869 192.168.1.12 → 10.6.15.156  TCP 66 54766 → 22 [ACK] Seq=9769 Ack=68025 Win=6155 Len=0 TSval=8235745 TSecr=15167247
  447 15.034556467  10.6.15.156 → 192.168.1.12 SSH 182 Server: Encrypted packet (len=116)
  448 15.034572562 192.168.1.12 → 10.6.15.156  TCP 66 54766 → 22 [ACK] Seq=9769 Ack=68141 Win=6155 Len=0 TSval=8235801 TSecr=15167302
  449 15.104259113  10.6.15.156 → 192.168.1.12 SSH 182 Server: Encrypted packet (len=116)
  450 15.104278513 192.168.1.12 → 10.6.15.156  TCP 66 54766 → 22 [ACK] Seq=9769 Ack=68257 Win=6155 Len=0 TSval=8235818 TSecr=15167319
  451 15.161453316  10.6.15.156 → 192.168.1.12 SSH 238 Server: Encrypted packet (len=172)
  452 15.161468960 192.168.1.12 → 10.6.15.156  TCP 66 54766 → 22 [ACK] Seq=9769 Ack=68429 Win=6155 Len=0 TSval=8235832 TSecr=15167334
  453 15.264265848  10.6.15.156 → 192.168.1.12 SSH 238 Server: Encrypted packet (len=172)
  454 15.264280166 192.168.1.12 → 10.6.15.156  TCP 66 54766 → 22 [ACK] Seq=9769 Ack=68601 Win=6155 Len=0 TSval=8235858 TSecr=15167359
  455 15.485560484  10.6.15.156 → 192.168.1.12 SSH 254 Server: Encrypted packet (len=188)
  456 15.485584769 192.168.1.12 → 10.6.15.156  TCP 66 54766 → 22 [ACK] Seq=9769 Ack=68789 Win=6155 Len=0 TSval=8235913 TSecr=15167415
  457 15.555297387  10.6.15.156 → 192.168.1.12 SSH 270 Server: Encrypted packet (len=204)
  458 15.555315336 192.168.1.12 → 10.6.15.156  TCP 66 54766 → 22 [ACK] Seq=9769 Ack=68993 Win=6155 Len=0 TSval=8235931 TSecr=15167432
  459 15.612582456  10.6.15.156 → 192.168.1.12 SSH 222 Server: Encrypted packet (len=156)
  460 15.612601586 192.168.1.12 → 10.6.15.156  TCP 66 54766 → 22 [ACK] Seq=9769 Ack=69149 Win=6155 Len=0 TSval=8235945 TSecr=15167446
  461 15.715285323  10.6.15.156 → 192.168.1.12 SSH 182 Server: Encrypted packet (len=116)
  462 15.715302810 192.168.1.12 → 10.6.15.156  TCP 66 54766 → 22 [ACK] Seq=9769 Ack=69265 Win=6155 Len=0 TSval=8235971 TSecr=15167472
  463 15.936632736  10.6.15.156 → 192.168.1.12 SSH 222 Server: Encrypted packet (len=156)
  464 15.936650382 192.168.1.12 → 10.6.15.156  TCP 66 54766 → 22 [ACK] Seq=9769 Ack=69421 Win=6155 Len=0 TSval=8236026 TSecr=15167527
  465 16.063572056  10.6.15.156 → 192.168.1.12 SSH 182 Server: Encrypted packet (len=116)
  466 16.063590337 192.168.1.12 → 10.6.15.156  TCP 66 54766 → 22 [ACK] Seq=9769 Ack=69537 Win=6155 Len=0 TSval=8236058 TSecr=15167559
  467 16.125000778 10.22.17.139 → 224.0.0.252  LLMNR 70 Standard query 0x9d99 A edtqhlxrqk
  468 16.128606494 10.22.17.139 → 224.0.0.252  LLMNR 75 Standard query 0xc77e A ngpdkukpmpuffnl
  469 16.166712290  10.6.15.156 → 192.168.1.12 SSH 182 Server: Encrypted packet (len=116)
  470 16.166729398 192.168.1.12 → 10.6.15.156  TCP 66 54766 → 22 [ACK] Seq=9769 Ack=69653 Win=6155 Len=0 TSval=8236084 TSecr=15167585
  471 16.387608208  10.6.15.156 → 192.168.1.12 SSH 214 Server: Encrypted packet (len=148)
  472 16.387628341 192.168.1.12 → 10.6.15.156  TCP 66 54766 → 22 [ACK] Seq=9769 Ack=69801 Win=6155 Len=0 TSval=8236139 TSecr=15167640
  473 16.457728865  10.6.15.156 → 192.168.1.12 SSH 254 Server: Encrypted packet (len=188)
  474 16.457747329 192.168.1.12 → 10.6.15.156  TCP 66 54766 → 22 [ACK] Seq=9769 Ack=69989 Win=6155 Len=0 TSval=8236156 TSecr=15167657
  475 16.514591896  10.6.15.156 → 192.168.1.12 SSH 254 Server: Encrypted packet (len=188)
  476 16.514611622 192.168.1.12 → 10.6.15.156  TCP 66 54766 → 22 [ACK] Seq=9769 Ack=70177 Win=6155 Len=0 TSval=8236171 TSecr=15167672
  477 16.537830810 10.22.17.139 → 224.0.0.252  LLMNR 70 Standard query 0x9d99 A edtqhlxrqk
  478 16.538238797 10.22.17.139 → 224.0.0.252  LLMNR 75 Standard query 0xc77e A ngpdkukpmpuffnl
  479 16.617440045  10.6.15.156 → 192.168.1.12 SSH 254 Server: Encrypted packet (len=188)
  480 16.617458439 192.168.1.12 → 10.6.15.156  TCP 66 54766 → 22 [ACK] Seq=9769 Ack=70365 Win=6155 Len=0 TSval=8236196 TSecr=15167698
  481 16.735281972  10.6.15.156 → 192.168.1.12 SSH 150 Server: Encrypted packet (len=84)
  482 16.735300224 192.168.1.12 → 10.6.15.156  TCP 66 54766 → 22 [ACK] Seq=9769 Ack=70449 Win=6155 Len=0 TSval=8236226 TSecr=15167727
  483 16.735583172 192.168.1.12 → 10.6.15.156  SSH 150 Client: Encrypted packet (len=84)
  484 16.737187883  10.6.15.156 → 192.168.1.12 TCP 66 22 → 54766 [ACK] Seq=70449 Ack=9853 Win=1452 Len=0 TSval=15167727 TSecr=8236226
  485 16.777808324  10.6.15.156 → 192.168.1.12 SSH 150 Server: Encrypted packet (len=84)
  486 16.778073372 192.168.1.12 → 10.6.15.156  SSH 150 Client: Encrypted packet (len=84)
  487 16.780020918  10.6.15.156 → 192.168.1.12 TCP 66 22 → 54766 [ACK] Seq=70533 Ack=9937 Win=1452 Len=0 TSval=15167738 TSecr=8236236
  488 16.785890443 192.168.1.12 → 10.6.15.156  SSH 1118 Client: Encrypted packet (len=1052)
  489 16.788169185  10.6.15.156 → 192.168.1.12 TCP 66 22 → 54766 [ACK] Seq=70533 Ack=10989 Win=1452 Len=0 TSval=15167740 TSecr=8236238
  490 16.838695887  10.6.15.156 → 192.168.1.12 SSH 270 Server: Encrypted packet (len=204)
  491 16.882315170 192.168.1.12 → 10.6.15.156  TCP 66 54766 → 22 [ACK] Seq=10989 Ack=70737 Win=6155 Len=0 TSval=8236263 TSecr=15167753
  492 16.886366991  10.6.15.156 → 192.168.1.12 SSH 198 Server: Encrypted packet (len=132)
  493 16.886393669 192.168.1.12 → 10.6.15.156  TCP 66 54766 → 22 [ACK] Seq=10989 Ack=70869 Win=6155 Len=0 TSval=8236264 TSecr=15167765
  494 16.886939965 192.168.1.12 → 10.6.15.156  SSH 134 Client: Encrypted packet (len=68)
  495 16.888451192  10.6.15.156 → 192.168.1.12 TCP 66 22 → 54766 [ACK] Seq=70869 Ack=11057 Win=1452 Len=0 TSval=15167765 TSecr=8236264
  496 16.908165334  10.6.15.156 → 192.168.1.12 SSH 294 Server: Encrypted packet (len=228)
  497 16.950314565 192.168.1.12 → 10.6.15.156  TCP 66 54766 → 22 [ACK] Seq=11057 Ack=71097 Win=6155 Len=0 TSval=8236280 TSecr=15167770
  498 16.966122289  10.6.15.156 → 192.168.1.12 SSH 254 Server: Encrypted packet (len=188)
  499 16.966147631 192.168.1.12 → 10.6.15.156  TCP 66 54766 → 22 [ACK] Seq=11057 Ack=71285 Win=6155 Len=0 TSval=8236283 TSecr=15167785
  500 17.068224573  10.6.15.156 → 192.168.1.12 SSH 254 Server: Encrypted packet (len=188)
  501 17.068242622 192.168.1.12 → 10.6.15.156  TCP 66 54766 → 22 [ACK] Seq=11057 Ack=71473 Win=6155 Len=0 TSval=8236309 TSecr=15167810
  502 17.289628220  10.6.15.156 → 192.168.1.12 SSH 222 Server: Encrypted packet (len=156)
  503 17.289655615 192.168.1.12 → 10.6.15.156  TCP 66 54766 → 22 [ACK] Seq=11057 Ack=71629 Win=6155 Len=0 TSval=8236364 TSecr=15167866
  504 17.359383407  10.6.15.156 → 192.168.1.12 SSH 182 Server: Encrypted packet (len=116)
  505 17.359401559 192.168.1.12 → 10.6.15.156  TCP 66 54766 → 22 [ACK] Seq=11057 Ack=71745 Win=6155 Len=0 TSval=8236382 TSecr=15167883
  506 17.416551399  10.6.15.156 → 192.168.1.12 SSH 214 Server: Encrypted packet (len=148)
  507 17.416567752 192.168.1.12 → 10.6.15.156  TCP 66 54766 → 22 [ACK] Seq=11057 Ack=71893 Win=6155 Len=0 TSval=8236396 TSecr=15167897
  508 17.519545340  10.6.15.156 → 192.168.1.12 SSH 438 Server: Encrypted packet (len=372)
  509 17.519563197 192.168.1.12 → 10.6.15.156  TCP 66 54766 → 22 [ACK] Seq=11057 Ack=72265 Win=6155 Len=0 TSval=8236422 TSecr=15167923
  510 17.740771904  10.6.15.156 → 192.168.1.12 SSH 470 Server: Encrypted packet (len=404)
  511 17.740791479 192.168.1.12 → 10.6.15.156  TCP 66 54766 → 22 [ACK] Seq=11057 Ack=72669 Win=6155 Len=0 TSval=8236477 TSecr=15167978
  512 17.811249656  10.6.15.156 → 192.168.1.12 SSH 566 Server: Encrypted packet (len=500)
  513 17.811268478 192.168.1.12 → 10.6.15.156  TCP 66 54766 → 22 [ACK] Seq=11057 Ack=73169 Win=6155 Len=0 TSval=8236495 TSecr=15167996
  514 17.869462648  10.6.15.156 → 192.168.1.12 SSH 598 Server: Encrypted packet (len=532)
  515 17.869480159 192.168.1.12 → 10.6.15.156  TCP 66 54766 → 22 [ACK] Seq=11057 Ack=73701 Win=6155 Len=0 TSval=8236509 TSecr=15168010
  516 17.971577022  10.6.15.156 → 192.168.1.12 SSH 1158 Server: Encrypted packet (len=1092)
  517 17.971594312 192.168.1.12 → 10.6.15.156  TCP 66 54766 → 22 [ACK] Seq=11057 Ack=74793 Win=6155 Len=0 TSval=8236535 TSecr=15168036
  518 18.192486806  10.6.15.156 → 192.168.1.12 SSH 1030 Server: Encrypted packet (len=964)
  519 18.192502146 192.168.1.12 → 10.6.15.156  TCP 66 54766 → 22 [ACK] Seq=11057 Ack=75757 Win=6155 Len=0 TSval=8236590 TSecr=15168091
  520 18.261789103  10.6.15.156 → 192.168.1.12 SSH 982 Server: Encrypted packet (len=916)
  521 18.261802905 192.168.1.12 → 10.6.15.156  TCP 66 54766 → 22 [ACK] Seq=11057 Ack=76673 Win=6155 Len=0 TSval=8236607 TSecr=15168109
  522 18.261919012 192.168.1.12 → 10.6.15.156  SSH 102 Client: Encrypted packet (len=36)
  523 18.301446523  10.6.15.156 → 192.168.1.12 TCP 66 22 → 54766 [ACK] Seq=76673 Ack=11093 Win=1452 Len=0 TSval=15168119 TSecr=8236607
  524 18.319203978  10.6.15.156 → 192.168.1.12 SSH 950 Server: Encrypted packet (len=884)
  525 18.362313445 192.168.1.12 → 10.6.15.156  TCP 66 54766 → 22 [ACK] Seq=11093 Ack=77557 Win=6155 Len=0 TSval=8236633 TSecr=15168123
  526 18.421470861  10.6.15.156 → 192.168.1.12 SSH 238 Server: Encrypted packet (len=172)
  527 18.421498084 192.168.1.12 → 10.6.15.156  TCP 66 54766 → 22 [ACK] Seq=11093 Ack=77729 Win=6155 Len=0 TSval=8236647 TSecr=15168149
  528 18.642622753  10.6.15.156 → 192.168.1.12 SSH 238 Server: Encrypted packet (len=172)
  529 18.642648472 192.168.1.12 → 10.6.15.156  TCP 66 54766 → 22 [ACK] Seq=11093 Ack=77901 Win=6155 Len=0 TSval=8236703 TSecr=15168204
  530 18.712003555  10.6.15.156 → 192.168.1.12 SSH 270 Server: Encrypted packet (len=204)
  531 18.712022709 192.168.1.12 → 10.6.15.156  TCP 66 54766 → 22 [ACK] Seq=11093 Ack=78105 Win=6155 Len=0 TSval=8236720 TSecr=15168221
  532 18.769629279  10.6.15.156 → 192.168.1.12 SSH 238 Server: Encrypted packet (len=172)
  533 18.769646524 192.168.1.12 → 10.6.15.156  TCP 66 54766 → 22 [ACK] Seq=11093 Ack=78277 Win=6155 Len=0 TSval=8236734 TSecr=15168236
  534 19.093599378  10.6.15.156 → 192.168.1.12 SSH 270 Server: Encrypted packet (len=204)
  535 19.093614517 192.168.1.12 → 10.6.15.156  TCP 66 54766 → 22 [ACK] Seq=11093 Ack=78481 Win=6155 Len=0 TSval=8236815 TSecr=15168317
  536 19.163161446  10.6.15.156 → 192.168.1.12 SSH 406 Server: Encrypted packet (len=340)
  537 19.163180101 192.168.1.12 → 10.6.15.156  TCP 66 54766 → 22 [ACK] Seq=11093 Ack=78821 Win=6155 Len=0 TSval=8236833 TSecr=15168334
  538 19.220859371  10.6.15.156 → 192.168.1.12 SSH 438 Server: Encrypted packet (len=372)
  539 19.220876750 192.168.1.12 → 10.6.15.156  TCP 66 54766 → 22 [ACK] Seq=11093 Ack=79193 Win=6155 Len=0 TSval=8236847 TSecr=15168348
  540 19.323515610  10.6.15.156 → 192.168.1.12 SSH 438 Server: Encrypted packet (len=372)
  541 19.323533915 192.168.1.12 → 10.6.15.156  TCP 66 54766 → 22 [ACK] Seq=11093 Ack=79565 Win=6155 Len=0 TSval=8236873 TSecr=15168374
  542 19.545499446  10.6.15.156 → 192.168.1.12 SSH 534 Server: Encrypted packet (len=468)
  543 19.545519411 192.168.1.12 → 10.6.15.156  TCP 66 54766 → 22 [ACK] Seq=11093 Ack=80033 Win=6155 Len=0 TSval=8236928 TSecr=15168429
  544 19.614665084  10.6.15.156 → 192.168.1.12 SSH 302 Server: Encrypted packet (len=236)
  545 19.614683912 192.168.1.12 → 10.6.15.156  TCP 66 54766 → 22 [ACK] Seq=11093 Ack=80269 Win=6155 Len=0 TSval=8236946 TSecr=15168447
  546 19.671727119  10.6.15.156 → 192.168.1.12 SSH 302 Server: Encrypted packet (len=236)
  547 19.671745462 192.168.1.12 → 10.6.15.156  TCP 66 54766 → 22 [ACK] Seq=11093 Ack=80505 Win=6155 Len=0 TSval=8236960 TSecr=15168461
  548 19.774301481  10.6.15.156 → 192.168.1.12 SSH 342 Server: Encrypted packet (len=276)
  549 19.774317652 192.168.1.12 → 10.6.15.156  TCP 66 54766 → 22 [ACK] Seq=11093 Ack=80781 Win=6155 Len=0 TSval=8236986 TSecr=15168487
  550 19.995621869  10.6.15.156 → 192.168.1.12 SSH 222 Server: Encrypted packet (len=156)
  551 19.995638610 192.168.1.12 → 10.6.15.156  TCP 66 54766 → 22 [ACK] Seq=11093 Ack=80937 Win=6155 Len=0 TSval=8237041 TSecr=15168542
  552 20.065978015  10.6.15.156 → 192.168.1.12 SSH 222 Server: Encrypted packet (len=156)
  553 20.065995877 192.168.1.12 → 10.6.15.156  TCP 66 54766 → 22 [ACK] Seq=11093 Ack=81093 Win=6155 Len=0 TSval=8237058 TSecr=15168560
  554 20.122615742  10.6.15.156 → 192.168.1.12 SSH 182 Server: Encrypted packet (len=116)
  555 20.122633480 192.168.1.12 → 10.6.15.156  TCP 66 54766 → 22 [ACK] Seq=11093 Ack=81209 Win=6155 Len=0 TSval=8237073 TSecr=15168574
  556 20.225718613  10.6.15.156 → 192.168.1.12 SSH 182 Server: Encrypted packet (len=116)
  557 20.225736440 192.168.1.12 → 10.6.15.156  TCP 66 54766 → 22 [ACK] Seq=11093 Ack=81325 Win=6155 Len=0 TSval=8237098 TSecr=15168600
  558 20.446697442  10.6.15.156 → 192.168.1.12 SSH 286 Server: Encrypted packet (len=220)
  559 20.446715261 192.168.1.12 → 10.6.15.156  TCP 66 54766 → 22 [ACK] Seq=11093 Ack=81545 Win=6155 Len=0 TSval=8237154 TSecr=15168655
  560 20.516670661  10.6.15.156 → 192.168.1.12 SSH 318 Server: Encrypted packet (len=252)
  561 20.516687615 192.168.1.12 → 10.6.15.156  TCP 66 54766 → 22 [ACK] Seq=11093 Ack=81797 Win=6155 Len=0 TSval=8237171 TSecr=15168672
  562 20.573770360  10.6.15.156 → 192.168.1.12 SSH 318 Server: Encrypted packet (len=252)
  563 20.573788286 192.168.1.12 → 10.6.15.156  TCP 66 54766 → 22 [ACK] Seq=11093 Ack=82049 Win=6155 Len=0 TSval=8237185 TSecr=15168687
  564 20.676515816  10.6.15.156 → 192.168.1.12 SSH 270 Server: Encrypted packet (len=204)
  565 20.676533974 192.168.1.12 → 10.6.15.156  TCP 66 54766 → 22 [ACK] Seq=11093 Ack=82253 Win=6155 Len=0 TSval=8237211 TSecr=15168712
  566 20.897815534  10.6.15.156 → 192.168.1.12 SSH 374 Server: Encrypted packet (len=308)
  567 20.897833126 192.168.1.12 → 10.6.15.156  TCP 66 54766 → 22 [ACK] Seq=11093 Ack=82561 Win=6155 Len=0 TSval=8237266 TSecr=15168768
  568 20.968252301  10.6.15.156 → 192.168.1.12 SSH 422 Server: Encrypted packet (len=356)
  569 20.968270546 192.168.1.12 → 10.6.15.156  TCP 66 54766 → 22 [ACK] Seq=11093 Ack=82917 Win=6155 Len=0 TSval=8237284 TSecr=15168785
  570 21.024968713  10.6.15.156 → 192.168.1.12 SSH 518 Server: Encrypted packet (len=452)
  571 21.024987506 192.168.1.12 → 10.6.15.156  TCP 66 54766 → 22 [ACK] Seq=11093 Ack=83369 Win=6155 Len=0 TSval=8237298 TSecr=15168799
  572 21.127640407  10.6.15.156 → 192.168.1.12 SSH 630 Server: Encrypted packet (len=564)
  573 21.127657832 192.168.1.12 → 10.6.15.156  TCP 66 54766 → 22 [ACK] Seq=11093 Ack=83933 Win=6155 Len=0 TSval=8237324 TSecr=15168825
  574 21.350734212  10.6.15.156 → 192.168.1.12 SSH 518 Server: Encrypted packet (len=452)
  575 21.350750948 192.168.1.12 → 10.6.15.156  TCP 66 54766 → 22 [ACK] Seq=11093 Ack=84385 Win=6155 Len=0 TSval=8237380 TSecr=15168880
  576 21.418141091  10.6.15.156 → 192.168.1.12 SSH 422 Server: Encrypted packet (len=356)
  577 21.418158520 192.168.1.12 → 10.6.15.156  TCP 66 54766 → 22 [ACK] Seq=11093 Ack=84741 Win=6155 Len=0 TSval=8237396 TSecr=15168898
  578 21.475734821  10.6.15.156 → 192.168.1.12 SSH 342 Server: Encrypted packet (len=276)
  579 21.475752090 192.168.1.12 → 10.6.15.156  TCP 66 54766 → 22 [ACK] Seq=11093 Ack=85017 Win=6155 Len=0 TSval=8237411 TSecr=15168912
  580 21.578497084  10.6.15.156 → 192.168.1.12 SSH 438 Server: Encrypted packet (len=372)
  581 21.578514025 192.168.1.12 → 10.6.15.156  TCP 66 54766 → 22 [ACK] Seq=11093 Ack=85389 Win=6155 Len=0 TSval=8237437 TSecr=15168938
  582 21.799771420  10.6.15.156 → 192.168.1.12 SSH 422 Server: Encrypted packet (len=356)
  583 21.799791094 192.168.1.12 → 10.6.15.156  TCP 66 54766 → 22 [ACK] Seq=11093 Ack=85745 Win=6155 Len=0 TSval=8237492 TSecr=15168993
  584 21.869208587  10.6.15.156 → 192.168.1.12 SSH 406 Server: Encrypted packet (len=340)
  585 21.869226561 192.168.1.12 → 10.6.15.156  TCP 66 54766 → 22 [ACK] Seq=11093 Ack=86085 Win=6155 Len=0 TSval=8237509 TSecr=15169010
  586 21.926726196  10.6.15.156 → 192.168.1.12 SSH 406 Server: Encrypted packet (len=340)
  587 21.926744870 192.168.1.12 → 10.6.15.156  TCP 66 54766 → 22 [ACK] Seq=11093 Ack=86425 Win=6155 Len=0 TSval=8237524 TSecr=15169025
  588 22.029339308  10.6.15.156 → 192.168.1.12 SSH 214 Server: Encrypted packet (len=148)
  589 22.029357230 192.168.1.12 → 10.6.15.156  TCP 66 54766 → 22 [ACK] Seq=11093 Ack=86573 Win=6155 Len=0 TSval=8237549 TSecr=15169050
  590 22.250554430  10.6.15.156 → 192.168.1.12 SSH 206 Server: Encrypted packet (len=140)
  591 22.250572058 192.168.1.12 → 10.6.15.156  TCP 66 54766 → 22 [ACK] Seq=11093 Ack=86713 Win=6155 Len=0 TSval=8237605 TSecr=15169106
  592 22.320123935  10.6.15.156 → 192.168.1.12 SSH 214 Server: Encrypted packet (len=148)
  593 22.320141831 192.168.1.12 → 10.6.15.156  TCP 66 54766 → 22 [ACK] Seq=11093 Ack=86861 Win=6155 Len=0 TSval=8237622 TSecr=15169123
  594 22.377661727  10.6.15.156 → 192.168.1.12 SSH 222 Server: Encrypted packet (len=156)
  595 22.377679297 192.168.1.12 → 10.6.15.156  TCP 66 54766 → 22 [ACK] Seq=11093 Ack=87017 Win=6155 Len=0 TSval=8237636 TSecr=15169138
  596 22.480425329  10.6.15.156 → 192.168.1.12 SSH 302 Server: Encrypted packet (len=236)
  597 22.480443055 192.168.1.12 → 10.6.15.156  TCP 66 54766 → 22 [ACK] Seq=11093 Ack=87253 Win=6155 Len=0 TSval=8237662 TSecr=15169163
  598 22.701579165  10.6.15.156 → 192.168.1.12 SSH 254 Server: Encrypted packet (len=188)
  599 22.701597263 192.168.1.12 → 10.6.15.156  TCP 66 54766 → 22 [ACK] Seq=11093 Ack=87441 Win=6155 Len=0 TSval=8237717 TSecr=15169219
  600 22.765283367 10.22.17.139 → 224.0.0.252  LLMNR 70 Standard query 0x5a70 A rshgqlxygq
  601 22.770196804 10.22.17.139 → 224.0.0.252  LLMNR 75 Standard query 0x51ea A ioiptjtvvbtsyxf
  602 22.771518283  10.6.15.156 → 192.168.1.12 SSH 182 Server: Encrypted packet (len=116)
  603 22.771535619 192.168.1.12 → 10.6.15.156  TCP 66 54766 → 22 [ACK] Seq=11093 Ack=87557 Win=6155 Len=0 TSval=8237735 TSecr=15169236
  604 22.829010035  10.6.15.156 → 192.168.1.12 SSH 334 Server: Encrypted packet (len=268)
  605 22.829026091 192.168.1.12 → 10.6.15.156  TCP 66 54766 → 22 [ACK] Seq=11093 Ack=87825 Win=6155 Len=0 TSval=8237749 TSecr=15169250
  606 22.931258746  10.6.15.156 → 192.168.1.12 SSH 214 Server: Encrypted packet (len=148)
  607 22.931277727 192.168.1.12 → 10.6.15.156  TCP 66 54766 → 22 [ACK] Seq=11093 Ack=87973 Win=6155 Len=0 TSval=8237775 TSecr=15169276
  608 23.152475168  10.6.15.156 → 192.168.1.12 SSH 214 Server: Encrypted packet (len=148)
  609 23.152493112 192.168.1.12 → 10.6.15.156  TCP 66 54766 → 22 [ACK] Seq=11093 Ack=88121 Win=6155 Len=0 TSval=8237830 TSecr=15169331
  610 23.176680156 10.22.17.139 → 224.0.0.252  LLMNR 70 Standard query 0x5a70 A rshgqlxygq
  611 23.178855596 10.22.17.139 → 224.0.0.252  LLMNR 75 Standard query 0x51ea A ioiptjtvvbtsyxf
  612 23.222052458  10.6.15.156 → 192.168.1.12 SSH 270 Server: Encrypted packet (len=204)
  613 23.222071651 192.168.1.12 → 10.6.15.156  TCP 66 54766 → 22 [ACK] Seq=11093 Ack=88325 Win=6155 Len=0 TSval=8237847 TSecr=15169349
  614 23.279650923  10.6.15.156 → 192.168.1.12 SSH 214 Server: Encrypted packet (len=148)
  615 23.279667228 192.168.1.12 → 10.6.15.156  TCP 66 54766 → 22 [ACK] Seq=11093 Ack=88473 Win=6155 Len=0 TSval=8237862 TSecr=15169363
  616 23.382356926  10.6.15.156 → 192.168.1.12 SSH 222 Server: Encrypted packet (len=156)
  617 23.382374049 192.168.1.12 → 10.6.15.156  TCP 66 54766 → 22 [ACK] Seq=11093 Ack=88629 Win=6155 Len=0 TSval=8237888 TSecr=15169389
  618 23.603634596  10.6.15.156 → 192.168.1.12 SSH 230 Server: Encrypted packet (len=164)
  619 23.603652585 192.168.1.12 → 10.6.15.156  TCP 66 54766 → 22 [ACK] Seq=11093 Ack=88793 Win=6155 Len=0 TSval=8237943 TSecr=15169444
  620 23.674415243  10.6.15.156 → 192.168.1.12 SSH 374 Server: Encrypted packet (len=308)
  621 23.674433347 192.168.1.12 → 10.6.15.156  TCP 66 54766 → 22 [ACK] Seq=11093 Ack=89101 Win=6155 Len=0 TSval=8237961 TSecr=15169461
  622 23.730667489  10.6.15.156 → 192.168.1.12 SSH 238 Server: Encrypted packet (len=172)
  623 23.730685204 192.168.1.12 → 10.6.15.156  TCP 66 54766 → 22 [ACK] Seq=11093 Ack=89273 Win=6155 Len=0 TSval=8237975 TSecr=15169476
  624 23.764912663 10.22.17.139 → 224.0.0.252  LLMNR 64 Standard query 0x9d99 A wpad
  625 23.765830847 10.22.17.139 → 224.0.0.252  LLMNR 64 Standard query 0xef0f A wpad
  626 23.833186794  10.6.15.156 → 192.168.1.12 SSH 270 Server: Encrypted packet (len=204)
  627 23.833204565 192.168.1.12 → 10.6.15.156  TCP 66 54766 → 22 [ACK] Seq=11093 Ack=89477 Win=6155 Len=0 TSval=8238000 TSecr=15169501
  628 24.054823545  10.6.15.156 → 192.168.1.12 SSH 470 Server: Encrypted packet (len=404)
  629 24.054840420 192.168.1.12 → 10.6.15.156  TCP 66 54766 → 22 [ACK] Seq=11093 Ack=89881 Win=6155 Len=0 TSval=8238056 TSecr=15169557
  630 24.124357027  10.6.15.156 → 192.168.1.12 SSH 470 Server: Encrypted packet (len=404)
  631 24.124374980 192.168.1.12 → 10.6.15.156  TCP 66 54766 → 22 [ACK] Seq=11093 Ack=90285 Win=6155 Len=0 TSval=8238073 TSecr=15169574
  632 24.175937927 10.22.17.139 → 224.0.0.252  LLMNR 64 Standard query 0x9d99 A wpad
  633 24.177091828 10.22.17.139 → 224.0.0.252  LLMNR 64 Standard query 0xef0f A wpad
  634 24.181795002  10.6.15.156 → 192.168.1.12 SSH 470 Server: Encrypted packet (len=404)
  635 24.181808146 192.168.1.12 → 10.6.15.156  TCP 66 54766 → 22 [ACK] Seq=11093 Ack=90689 Win=6155 Len=0 TSval=8238087 TSecr=15169589
  636 24.284667258  10.6.15.156 → 192.168.1.12 SSH 470 Server: Encrypted packet (len=404)
  637 24.284683961 192.168.1.12 → 10.6.15.156  TCP 66 54766 → 22 [ACK] Seq=11093 Ack=91093 Win=6155 Len=0 TSval=8238113 TSecr=15169614
  638 24.505772186  10.6.15.156 → 192.168.1.12 SSH 326 Server: Encrypted packet (len=260)
  639 24.505789967 192.168.1.12 → 10.6.15.156  TCP 66 54766 → 22 [ACK] Seq=11093 Ack=91353 Win=6155 Len=0 TSval=8238168 TSecr=15169670
  640 24.576024552  10.6.15.156 → 192.168.1.12 SSH 182 Server: Encrypted packet (len=116)
  641 24.576042203 192.168.1.12 → 10.6.15.156  TCP 66 54766 → 22 [ACK] Seq=11093 Ack=91469 Win=6155 Len=0 TSval=8238186 TSecr=15169687
  642 24.632541535  10.6.15.156 → 192.168.1.12 SSH 214 Server: Encrypted packet (len=148)
  643 24.632559625 192.168.1.12 → 10.6.15.156  TCP 66 54766 → 22 [ACK] Seq=11093 Ack=91617 Win=6155 Len=0 TSval=8238200 TSecr=15169701
  644 24.735465509  10.6.15.156 → 192.168.1.12 SSH 302 Server: Encrypted packet (len=236)
  645 24.735482399 192.168.1.12 → 10.6.15.156  TCP 66 54766 → 22 [ACK] Seq=11093 Ack=91853 Win=6155 Len=0 TSval=8238226 TSecr=15169727
  646 24.765627921 10.22.17.139 → 224.0.0.252  LLMNR 70 Standard query 0x1cb6 A nvytonicjc
  647 24.768297504 10.22.17.139 → 224.0.0.252  LLMNR 70 Standard query 0xe944 A nvytonicjc
  648 24.956783725  10.6.15.156 → 192.168.1.12 SSH 334 Server: Encrypted packet (len=268)
  649 24.956802505 192.168.1.12 → 10.6.15.156  TCP 66 54766 → 22 [ACK] Seq=11093 Ack=92121 Win=6155 Len=0 TSval=8238281 TSecr=15169782
  650 25.026159436  10.6.15.156 → 192.168.1.12 SSH 334 Server: Encrypted packet (len=268)
  651 25.026177950 192.168.1.12 → 10.6.15.156  TCP 66 54766 → 22 [ACK] Seq=11093 Ack=92389 Win=6155 Len=0 TSval=8238298 TSecr=15169800
  652 25.083698906  10.6.15.156 → 192.168.1.12 SSH 302 Server: Encrypted packet (len=236)
  653 25.083716693 192.168.1.12 → 10.6.15.156  TCP 66 54766 → 22 [ACK] Seq=11093 Ack=92625 Win=6155 Len=0 TSval=8238313 TSecr=15169814
  654 25.177586600 10.22.17.139 → 224.0.0.252  LLMNR 70 Standard query 0x1cb6 A nvytonicjc
  655 25.179274372 10.22.17.139 → 224.0.0.252  LLMNR 70 Standard query 0xe944 A nvytonicjc
  656 25.186575639  10.6.15.156 → 192.168.1.12 SSH 254 Server: Encrypted packet (len=188)
  657 25.186592039 192.168.1.12 → 10.6.15.156  TCP 66 54766 → 22 [ACK] Seq=11093 Ack=92813 Win=6155 Len=0 TSval=8238339 TSecr=15169840
  658 25.407550299  10.6.15.156 → 192.168.1.12 SSH 222 Server: Encrypted packet (len=156)
  659 25.407569693 192.168.1.12 → 10.6.15.156  TCP 66 54766 → 22 [ACK] Seq=11093 Ack=92969 Win=6155 Len=0 TSval=8238394 TSecr=15169895
  660 25.476862254  10.6.15.156 → 192.168.1.12 SSH 222 Server: Encrypted packet (len=156)
  661 25.476880185 192.168.1.12 → 10.6.15.156  TCP 66 54766 → 22 [ACK] Seq=11093 Ack=93125 Win=6155 Len=0 TSval=8238411 TSecr=15169912
  662 25.535193757  10.6.15.156 → 192.168.1.12 SSH 214 Server: Encrypted packet (len=148)
  663 25.535211554 192.168.1.12 → 10.6.15.156  TCP 66 54766 → 22 [ACK] Seq=11093 Ack=93273 Win=6155 Len=0 TSval=8238426 TSecr=15169927
  664 25.858763170  10.6.15.156 → 192.168.1.12 SSH 302 Server: Encrypted packet (len=236)
  665 25.858782233 192.168.1.12 → 10.6.15.156  TCP 66 54766 → 22 [ACK] Seq=11093 Ack=93509 Win=6155 Len=0 TSval=8238507 TSecr=15170008
  666 25.927947931  10.6.15.156 → 192.168.1.12 SSH 238 Server: Encrypted packet (len=172)
  667 25.927965139 192.168.1.12 → 10.6.15.156  TCP 66 54766 → 22 [ACK] Seq=11093 Ack=93681 Win=6155 Len=0 TSval=8238524 TSecr=15170025
  668 25.985603414  10.6.15.156 → 192.168.1.12 SSH 238 Server: Encrypted packet (len=172)
  669 25.985620729 192.168.1.12 → 10.6.15.156  TCP 66 54766 → 22 [ACK] Seq=11093 Ack=93853 Win=6155 Len=0 TSval=8238538 TSecr=15170040
  670 26.088710557  10.6.15.156 → 192.168.1.12 SSH 238 Server: Encrypted packet (len=172)
  671 26.088729322 192.168.1.12 → 10.6.15.156  TCP 66 54766 → 22 [ACK] Seq=11093 Ack=94025 Win=6155 Len=0 TSval=8238564 TSecr=15170065
  672 26.309682582  10.6.15.156 → 192.168.1.12 SSH 222 Server: Encrypted packet (len=156)
  673 26.309699838 192.168.1.12 → 10.6.15.156  TCP 66 54766 → 22 [ACK] Seq=11093 Ack=94181 Win=6155 Len=0 TSval=8238619 TSecr=15170121
  674 26.379182523  10.6.15.156 → 192.168.1.12 SSH 302 Server: Encrypted packet (len=236)
  675 26.379202006 192.168.1.12 → 10.6.15.156  TCP 66 54766 → 22 [ACK] Seq=11093 Ack=94417 Win=6155 Len=0 TSval=8238637 TSecr=15170138
  676 26.436683561  10.6.15.156 → 192.168.1.12 SSH 302 Server: Encrypted packet (len=236)
  677 26.436701696 192.168.1.12 → 10.6.15.156  TCP 66 54766 → 22 [ACK] Seq=11093 Ack=94653 Win=6155 Len=0 TSval=8238651 TSecr=15170152
  678 26.541790791  10.6.15.156 → 192.168.1.12 SSH 374 Server: Encrypted packet (len=308)
  679 26.541807775 192.168.1.12 → 10.6.15.156  TCP 66 54766 → 22 [ACK] Seq=11093 Ack=94961 Win=6155 Len=0 TSval=8238677 TSecr=15170178
  680 26.549462592  10.6.15.156 → 192.168.1.12 SSH 374 Server: [TCP Spurious Retransmission] , Encrypted packet (len=308)
  681 26.549482359 192.168.1.12 → 10.6.15.156  TCP 78 [TCP Dup ACK 679#1] 54766 → 22 [ACK] Seq=11093 Ack=94961 Win=6155 Len=0 TSval=8238679 TSecr=15170181 SLE=94653 SRE=94961
  682 26.761184357  10.6.15.156 → 192.168.1.12 SSH 238 Server: Encrypted packet (len=172)
  683 26.761202072 192.168.1.12 → 10.6.15.156  TCP 66 54766 → 22 [ACK] Seq=11093 Ack=95133 Win=6155 Len=0 TSval=8238732 TSecr=15170233
  684 26.830114795  10.6.15.156 → 192.168.1.12 SSH 214 Server: Encrypted packet (len=148)
  685 26.830131529 192.168.1.12 → 10.6.15.156  TCP 66 54766 → 22 [ACK] Seq=11093 Ack=95281 Win=6155 Len=0 TSval=8238749 TSecr=15170251
  686 26.846454816 192.168.1.12 → 10.6.15.156  SSH 154 Client: Encrypted packet (len=88)
  687 26.850384438  10.6.15.156 → 192.168.1.12 TCP 66 22 → 54766 [ACK] Seq=95281 Ack=11181 Win=1452 Len=0 TSval=15170256 TSecr=8238754
  688 26.887582516  10.6.15.156 → 192.168.1.12 SSH 214 Server: Encrypted packet (len=148)
  689 26.930312428 192.168.1.12 → 10.6.15.156  TCP 66 54766 → 22 [ACK] Seq=11181 Ack=95429 Win=6155 Len=0 TSval=8238775 TSecr=15170265
  690 26.998513661  10.6.15.156 → 192.168.1.12 SSH 110 Server: Encrypted packet (len=44)
  691 26.998539882 192.168.1.12 → 10.6.15.156  TCP 66 54766 → 22 [ACK] Seq=11181 Ack=95473 Win=6155 Len=0 TSval=8238792 TSecr=15170293
  692 26.998896609 192.168.1.12 → 10.6.15.156  SSH 198 Client: Encrypted packet (len=132)
  693 27.002991550  10.6.15.156 → 192.168.1.12 SSH 102 Server: Encrypted packet (len=36)
  694 27.003361714 192.168.1.12 → 10.6.15.156  SSH 198 Client: Encrypted packet (len=132)
  695 27.043246791  10.6.15.156 → 192.168.1.12 TCP 66 22 → 54766 [ACK] Seq=95509 Ack=11445 Win=1452 Len=0 TSval=15170304 TSecr=8238793
  696 27.151394264  10.6.15.156 → 192.168.1.12 SSH 454 Server: Encrypted packet (len=388)
  697 27.159962051  10.6.15.156 → 192.168.1.12 SSH 198 Server: Encrypted packet (len=132)
  698 27.160035058 192.168.1.12 → 10.6.15.156  TCP 66 54766 → 22 [ACK] Seq=11445 Ack=96029 Win=6155 Len=0 TSval=8238832 TSecr=15170331
  699 27.212157760  10.6.15.156 → 192.168.1.12 SSH 334 Server: Encrypted packet (len=268)
  700 27.254273069 192.168.1.12 → 10.6.15.156  TCP 66 54766 → 22 [ACK] Seq=11445 Ack=96297 Win=6155 Len=0 TSval=8238856 TSecr=15170346
  701 27.281140971  10.6.15.156 → 192.168.1.12 SSH 270 Server: Encrypted packet (len=204)
  702 27.281155644 192.168.1.12 → 10.6.15.156  TCP 66 54766 → 22 [ACK] Seq=11445 Ack=96501 Win=6155 Len=0 TSval=8238862 TSecr=15170363
  703 27.338634039  10.6.15.156 → 192.168.1.12 SSH 270 Server: Encrypted packet (len=204)
  704 27.338646276 192.168.1.12 → 10.6.15.156  TCP 66 54766 → 22 [ACK] Seq=11445 Ack=96705 Win=6155 Len=0 TSval=8238877 TSecr=15170378
  705 27.443300092  10.6.15.156 → 192.168.1.12 SSH 358 Server: Encrypted packet (len=292)
  706 27.443317532 192.168.1.12 → 10.6.15.156  TCP 66 54766 → 22 [ACK] Seq=11445 Ack=96997 Win=6155 Len=0 TSval=8238903 TSecr=15170404
  707 27.728249849 192.168.1.12 → 10.6.15.156  SSH 134 Client: Encrypted packet (len=68)
  708 27.729928839  10.6.15.156 → 192.168.1.12 TCP 66 22 → 54766 [ACK] Seq=96997 Ack=11513 Win=1452 Len=0 TSval=15170476 TSecr=8238974
  709 27.731966669  10.6.15.156 → 192.168.1.12 SSH 222 Server: Encrypted packet (len=156)
  710 27.731985012 192.168.1.12 → 10.6.15.156  TCP 66 54766 → 22 [ACK] Seq=11513 Ack=97153 Win=6155 Len=0 TSval=8238975 TSecr=15170476
  711 27.789905821  10.6.15.156 → 192.168.1.12 SSH 286 Server: Encrypted packet (len=220)
  712 27.789923037 192.168.1.12 → 10.6.15.156  TCP 66 54766 → 22 [ACK] Seq=11513 Ack=97373 Win=6155 Len=0 TSval=8238989 TSecr=15170491
  713 27.892094369  10.6.15.156 → 192.168.1.12 SSH 222 Server: Encrypted packet (len=156)
  714 27.892111447 192.168.1.12 → 10.6.15.156  TCP 66 54766 → 22 [ACK] Seq=11513 Ack=97529 Win=6155 Len=0 TSval=8239015 TSecr=15170516
  715 28.113630336  10.6.15.156 → 192.168.1.12 SSH 222 Server: Encrypted packet (len=156)
  716 28.113656003 192.168.1.12 → 10.6.15.156  TCP 66 54766 → 22 [ACK] Seq=11513 Ack=97685 Win=6155 Len=0 TSval=8239070 TSecr=15170572
  717 28.182881524  10.6.15.156 → 192.168.1.12 SSH 222 Server: Encrypted packet (len=156)
  718 28.182899919 192.168.1.12 → 10.6.15.156  TCP 66 54766 → 22 [ACK] Seq=11513 Ack=97841 Win=6155 Len=0 TSval=8239088 TSecr=15170589
  719 28.240608564  10.6.15.156 → 192.168.1.12 SSH 214 Server: Encrypted packet (len=148)
  720 28.240628601 192.168.1.12 → 10.6.15.156  TCP 66 54766 → 22 [ACK] Seq=11513 Ack=97989 Win=6155 Len=0 TSval=8239102 TSecr=15170603
  721 28.246289371 192.168.1.12 → 216.58.199.131 TCP 66 40290 → 443 [ACK] Seq=1 Ack=1 Win=237 Len=0 TSval=8239104 TSecr=2652236950
  722 28.282477646 216.58.199.131 → 192.168.1.12 TCP 66 [TCP ACKed unseen segment] 443 → 40290 [ACK] Seq=1 Ack=2 Win=175 Len=0 TSval=2652283671 TSecr=8193060
  723 28.343297996  10.6.15.156 → 192.168.1.12 SSH 214 Server: Encrypted packet (len=148)
  724 28.343316188 192.168.1.12 → 10.6.15.156  TCP 66 54766 → 22 [ACK] Seq=11513 Ack=98137 Win=6155 Len=0 TSval=8239128 TSecr=15170629
  725 28.564609204  10.6.15.156 → 192.168.1.12 SSH 230 Server: Encrypted packet (len=164)
  726 28.564626463 192.168.1.12 → 10.6.15.156  TCP 66 54766 → 22 [ACK] Seq=11513 Ack=98301 Win=6155 Len=0 TSval=8239183 TSecr=15170684
  727 28.635370187  10.6.15.156 → 192.168.1.12 SSH 334 Server: Encrypted packet (len=268)
  728 28.635388487 192.168.1.12 → 10.6.15.156  TCP 66 54766 → 22 [ACK] Seq=11513 Ack=98569 Win=6155 Len=0 TSval=8239201 TSecr=15170702
  729 28.692091250  10.6.15.156 → 192.168.1.12 SSH 374 Server: Encrypted packet (len=308)
  730 28.692110870 192.168.1.12 → 10.6.15.156  TCP 66 54766 → 22 [ACK] Seq=11513 Ack=98877 Win=6155 Len=0 TSval=8239215 TSecr=15170716
  731 28.794416750  10.6.15.156 → 192.168.1.12 SSH 374 Server: Encrypted packet (len=308)
  732 28.794435373 192.168.1.12 → 10.6.15.156  TCP 66 54766 → 22 [ACK] Seq=11513 Ack=99185 Win=6155 Len=0 TSval=8239241 TSecr=15170742
  733 29.015774319  10.6.15.156 → 192.168.1.12 SSH 270 Server: Encrypted packet (len=204)
  734 29.015793058 192.168.1.12 → 10.6.15.156  TCP 66 54766 → 22 [ACK] Seq=11513 Ack=99389 Win=6155 Len=0 TSval=8239296 TSecr=15170797
  735 29.084997608  10.6.15.156 → 192.168.1.12 SSH 254 Server: Encrypted packet (len=188)
  736 29.085018169 192.168.1.12 → 10.6.15.156  TCP 66 54766 → 22 [ACK] Seq=11513 Ack=99577 Win=6155 Len=0 TSval=8239313 TSecr=15170814
  737 29.142434809  10.6.15.156 → 192.168.1.12 SSH 214 Server: Encrypted packet (len=148)
  738 29.142452232 192.168.1.12 → 10.6.15.156  TCP 66 54766 → 22 [ACK] Seq=11513 Ack=99725 Win=6155 Len=0 TSval=8239328 TSecr=15170829
  739 29.245638589  10.6.15.156 → 192.168.1.12 SSH 222 Server: Encrypted packet (len=156)
  740 29.245654927 192.168.1.12 → 10.6.15.156  TCP 66 54766 → 22 [ACK] Seq=11513 Ack=99881 Win=6155 Len=0 TSval=8239353 TSecr=15170855
  741 29.466724017  10.6.15.156 → 192.168.1.12 SSH 438 Server: Encrypted packet (len=372)
  742 29.466741419 192.168.1.12 → 10.6.15.156  TCP 66 54766 → 22 [ACK] Seq=11513 Ack=100253 Win=6155 Len=0 TSval=8239409 TSecr=15170910
  743 29.536204738  10.6.15.156 → 192.168.1.12 SSH 302 Server: Encrypted packet (len=236)
  744 29.536223502 192.168.1.12 → 10.6.15.156  TCP 66 54766 → 22 [ACK] Seq=11513 Ack=100489 Win=6155 Len=0 TSval=8239426 TSecr=15170927
  745 29.593641333  10.6.15.156 → 192.168.1.12 SSH 270 Server: Encrypted packet (len=204)
  746 29.593659474 192.168.1.12 → 10.6.15.156  TCP 66 54766 → 22 [ACK] Seq=11513 Ack=100693 Win=6155 Len=0 TSval=8239440 TSecr=15170942
  747 29.696230768  10.6.15.156 → 192.168.1.12 SSH 270 Server: Encrypted packet (len=204)
  748 29.696248179 192.168.1.12 → 10.6.15.156  TCP 66 54766 → 22 [ACK] Seq=11513 Ack=100897 Win=6155 Len=0 TSval=8239466 TSecr=15170967
  749 29.890784498  10.6.15.156 → 192.168.1.12 SSH 190 Server: Encrypted packet (len=124)
  750 29.890803770 192.168.1.12 → 10.6.15.156  TCP 66 54766 → 22 [ACK] Seq=11513 Ack=101021 Win=6155 Len=0 TSval=8239515 TSecr=15171016
  751 29.987113506  10.6.15.156 → 192.168.1.12 SSH 254 Server: Encrypted packet (len=188)
  752 29.987132762 192.168.1.12 → 10.6.15.156  TCP 66 54766 → 22 [ACK] Seq=11513 Ack=101209 Win=6155 Len=0 TSval=8239539 TSecr=15171040
  753 30.044589594  10.6.15.156 → 192.168.1.12 SSH 254 Server: Encrypted packet (len=188)
  754 30.044608579 192.168.1.12 → 10.6.15.156  TCP 66 54766 → 22 [ACK] Seq=11513 Ack=101397 Win=6155 Len=0 TSval=8239553 TSecr=15171054
  755 30.147235212  10.6.15.156 → 192.168.1.12 SSH 254 Server: Encrypted packet (len=188)
  756 30.147252371 192.168.1.12 → 10.6.15.156  TCP 66 54766 → 22 [ACK] Seq=11513 Ack=101585 Win=6155 Len=0 TSval=8239579 TSecr=15171080
  757 30.368743773  10.6.15.156 → 192.168.1.12 SSH 422 Server: Encrypted packet (len=356)
  758 30.368761008 192.168.1.12 → 10.6.15.156  TCP 66 54766 → 22 [ACK] Seq=11513 Ack=101941 Win=6155 Len=0 TSval=8239634 TSecr=15171135
  759 30.439199090  10.6.15.156 → 192.168.1.12 SSH 238 Server: Encrypted packet (len=172)
  760 30.439216963 192.168.1.12 → 10.6.15.156  TCP 66 54766 → 22 [ACK] Seq=11513 Ack=102113 Win=6155 Len=0 TSval=8239652 TSecr=15171153
  761 30.495938235  10.6.15.156 → 192.168.1.12 SSH 238 Server: Encrypted packet (len=172)
  762 30.495956633 192.168.1.12 → 10.6.15.156  TCP 66 54766 → 22 [ACK] Seq=11513 Ack=102285 Win=6155 Len=0 TSval=8239666 TSecr=15171167
  763 30.598254551  10.6.15.156 → 192.168.1.12 SSH 270 Server: Encrypted packet (len=204)
  764 30.598277851 192.168.1.12 → 10.6.15.156  TCP 66 54766 → 22 [ACK] Seq=11513 Ack=102489 Win=6155 Len=0 TSval=8239692 TSecr=15171193
  765 30.758020121 10.22.17.139 → 224.0.0.252  LLMNR 75 Standard query 0xab72 A ioiptjtvvbtsyxf
  766 30.758777753 10.22.17.139 → 224.0.0.252  LLMNR 70 Standard query 0x106c A rshgqlxygq
  767 30.771981865 10.22.17.139 → 224.0.0.252  LLMNR 64 Standard query 0x5a77 A wpad
  768 30.773932584 10.22.17.139 → 224.0.0.252  LLMNR 64 Standard query 0xd577 A wpad
  769 30.819553833  10.6.15.156 → 192.168.1.12 SSH 190 Server: Encrypted packet (len=124)
  770 30.819572241 192.168.1.12 → 10.6.15.156  TCP 66 54766 → 22 [ACK] Seq=11513 Ack=102613 Win=6155 Len=0 TSval=8239747 TSecr=15171248
  771 30.889638630  10.6.15.156 → 192.168.1.12 SSH 182 Server: Encrypted packet (len=116)
  772 30.889655297 192.168.1.12 → 10.6.15.156  TCP 66 54766 → 22 [ACK] Seq=11513 Ack=102729 Win=6155 Len=0 TSval=8239764 TSecr=15171265
  773 30.924099185 192.168.1.12 → 91.189.94.4  NTP 90 NTP Version 4, client
  774 30.946873245  10.6.15.156 → 192.168.1.12 SSH 358 Server: Encrypted packet (len=292)
  775 30.946898096 192.168.1.12 → 10.6.15.156  TCP 66 54766 → 22 [ACK] Seq=11513 Ack=103021 Win=6155 Len=0 TSval=8239779 TSecr=15171280
  776 31.049459029  10.6.15.156 → 192.168.1.12 SSH 334 Server: Encrypted packet (len=268)
  777 31.049477130 192.168.1.12 → 10.6.15.156  TCP 66 54766 → 22 [ACK] Seq=11513 Ack=103289 Win=6155 Len=0 TSval=8239804 TSecr=15171306
  778 31.169485857 10.22.17.139 → 224.0.0.252  LLMNR 75 Standard query 0xab72 A ioiptjtvvbtsyxf
  779 31.170350548 10.22.17.139 → 224.0.0.252  LLMNR 70 Standard query 0x106c A rshgqlxygq
  780 31.183154430 10.22.17.139 → 224.0.0.252  LLMNR 64 Standard query 0x5a77 A wpad
  781 31.184875615 10.22.17.139 → 224.0.0.252  LLMNR 64 Standard query 0xd577 A wpad
  782 31.340057516  10.6.15.156 → 192.168.1.12 SSH 334 Server: Encrypted packet (len=268)
  783 31.340075845 192.168.1.12 → 10.6.15.156  TCP 66 54766 → 22 [ACK] Seq=11513 Ack=103557 Win=6155 Len=0 TSval=8239877 TSecr=15171378
  784 31.397499829  10.6.15.156 → 192.168.1.12 SSH 182 Server: Encrypted packet (len=116)
  785 31.397518203 192.168.1.12 → 10.6.15.156  TCP 66 54766 → 22 [ACK] Seq=11513 Ack=103673 Win=6155 Len=0 TSval=8239891 TSecr=15171393
  786 31.500396298  10.6.15.156 → 192.168.1.12 SSH 302 Server: Encrypted packet (len=236)
  787 31.500415193 192.168.1.12 → 10.6.15.156  TCP 66 54766 → 22 [ACK] Seq=11513 Ack=103909 Win=6155 Len=0 TSval=8239917 TSecr=15171418
  788 31.630234756  10.6.15.156 → 192.168.1.12 SSH 150 Server: Encrypted packet (len=84)
  789 31.630253043 192.168.1.12 → 10.6.15.156  TCP 66 54766 → 22 [ACK] Seq=11513 Ack=103993 Win=6155 Len=0 TSval=8239949 TSecr=15171451
  790 31.630530610 192.168.1.12 → 10.6.15.156  SSH 150 Client: Encrypted packet (len=84)
  791 31.669345611  10.6.15.156 → 192.168.1.12 TCP 66 22 → 54766 [ACK] Seq=103993 Ack=11597 Win=1452 Len=0 TSval=15171461 TSecr=8239950
  792 31.721776342  10.6.15.156 → 192.168.1.12 SSH 302 Server: Encrypted packet (len=236)
  793 31.762291671 192.168.1.12 → 10.6.15.156  TCP 66 54766 → 22 [ACK] Seq=11597 Ack=104229 Win=6155 Len=0 TSval=8239983 TSecr=15171474
  794 31.791085500  10.6.15.156 → 192.168.1.12 SSH 302 Server: Encrypted packet (len=236)
  795 31.791112048 192.168.1.12 → 10.6.15.156  TCP 66 54766 → 22 [ACK] Seq=11597 Ack=104465 Win=6155 Len=0 TSval=8239990 TSecr=15171491
  796 31.824279787  10.6.15.156 → 192.168.1.12 SSH 150 Server: Encrypted packet (len=84)
  797 31.824298219 192.168.1.12 → 10.6.15.156  TCP 66 54766 → 22 [ACK] Seq=11597 Ack=104549 Win=6155 Len=0 TSval=8239998 TSecr=15171499
  798 31.824591455 192.168.1.12 → 10.6.15.156  SSH 150 Client: Encrypted packet (len=84)
  799 31.826378614  10.6.15.156 → 192.168.1.12 TCP 66 22 → 54766 [ACK] Seq=104549 Ack=11681 Win=1452 Len=0 TSval=15171500 TSecr=8239998
  800 31.848765496  10.6.15.156 → 192.168.1.12 SSH 270 Server: Encrypted packet (len=204)
  801 31.890311662 192.168.1.12 → 10.6.15.156  TCP 66 54766 → 22 [ACK] Seq=11681 Ack=104753 Win=6155 Len=0 TSval=8240015 TSecr=15171505
  802 31.951486236  10.6.15.156 → 192.168.1.12 SSH 214 Server: Encrypted packet (len=148)
  803 31.951511563 192.168.1.12 → 10.6.15.156  TCP 66 54766 → 22 [ACK] Seq=11681 Ack=104901 Win=6155 Len=0 TSval=8240030 TSecr=15171531
  804 32.186032027  10.6.15.156 → 192.168.1.12 SSH 254 Server: Encrypted packet (len=188)
  805 32.186057895 192.168.1.12 → 10.6.15.156  TCP 66 54766 → 22 [ACK] Seq=11681 Ack=105089 Win=6155 Len=0 TSval=8240088 TSecr=15171586
  806 32.242059405  10.6.15.156 → 192.168.1.12 SSH 254 Server: Encrypted packet (len=188)
  807 32.242078834 192.168.1.12 → 10.6.15.156  TCP 66 54766 → 22 [ACK] Seq=11681 Ack=105277 Win=6155 Len=0 TSval=8240102 TSecr=15171604
  808 32.299805345  10.6.15.156 → 192.168.1.12 SSH 270 Server: Encrypted packet (len=204)
  809 32.299823434 192.168.1.12 → 10.6.15.156  TCP 66 54766 → 22 [ACK] Seq=11681 Ack=105481 Win=6155 Len=0 TSval=8240117 TSecr=15171618
  810 32.402351666  10.6.15.156 → 192.168.1.12 SSH 238 Server: Encrypted packet (len=172)
  811 32.402370014 192.168.1.12 → 10.6.15.156  TCP 66 54766 → 22 [ACK] Seq=11681 Ack=105653 Win=6155 Len=0 TSval=8240143 TSecr=15171644
  812 32.624371532  10.6.15.156 → 192.168.1.12 SSH 342 Server: Encrypted packet (len=276)
  813 32.624389362 192.168.1.12 → 10.6.15.156  TCP 66 54766 → 22 [ACK] Seq=11681 Ack=105929 Win=6155 Len=0 TSval=8240198 TSecr=15171699
  814 32.675401608  10.6.15.156 → 192.168.1.12 SSH 138 Server: Encrypted packet (len=72)
  815 32.675419234 192.168.1.12 → 10.6.15.156  TCP 66 54766 → 22 [ACK] Seq=11681 Ack=106001 Win=6155 Len=0 TSval=8240211 TSecr=15171712
  816 32.675619554 192.168.1.12 → 10.6.15.156  SSH 102 Client: Encrypted packet (len=36)
  817 32.693123621  10.6.15.156 → 192.168.1.12 SSH 230 Server: Encrypted packet (len=164)
  818 32.734274083 192.168.1.12 → 10.6.15.156  TCP 66 54766 → 22 [ACK] Seq=11717 Ack=106165 Win=6155 Len=0 TSval=8240226 TSecr=15171716
  819 32.750516774  10.6.15.156 → 192.168.1.12 SSH 238 Server: Encrypted packet (len=172)
  820 32.750542536 192.168.1.12 → 10.6.15.156  TCP 66 54766 → 22 [ACK] Seq=11717 Ack=106337 Win=6155 Len=0 TSval=8240230 TSecr=15171731
  821 32.853252384  10.6.15.156 → 192.168.1.12 SSH 238 Server: Encrypted packet (len=172)
  822 32.853270374 192.168.1.12 → 10.6.15.156  TCP 66 54766 → 22 [ACK] Seq=11717 Ack=106509 Win=6155 Len=0 TSval=8240255 TSecr=15171757
  823 33.075222511  10.6.15.156 → 192.168.1.12 SSH 182 Server: Encrypted packet (len=116)
  824 33.075242908 192.168.1.12 → 10.6.15.156  TCP 66 54766 → 22 [ACK] Seq=11717 Ack=106625 Win=6155 Len=0 TSval=8240311 TSecr=15171812
  825 33.143944821  10.6.15.156 → 192.168.1.12 SSH 270 Server: Encrypted packet (len=204)
  826 33.143962813 192.168.1.12 → 10.6.15.156  TCP 66 54766 → 22 [ACK] Seq=11717 Ack=106829 Win=6155 Len=0 TSval=8240328 TSecr=15171829
  827 33.201571374  10.6.15.156 → 192.168.1.12 SSH 270 Server: Encrypted packet (len=204)
  828 33.201587240 192.168.1.12 → 10.6.15.156  TCP 66 54766 → 22 [ACK] Seq=11717 Ack=107033 Win=6155 Len=0 TSval=8240342 TSecr=15171844
  829 33.304324916  10.6.15.156 → 192.168.1.12 SSH 238 Server: Encrypted packet (len=172)
  830 33.304342725 192.168.1.12 → 10.6.15.156  TCP 66 54766 → 22 [ACK] Seq=11717 Ack=107205 Win=6155 Len=0 TSval=8240368 TSecr=15171869
  831 33.499328030  10.6.15.156 → 192.168.1.12 SSH 190 Server: Encrypted packet (len=124)
  832 33.499346014 192.168.1.12 → 10.6.15.156  TCP 66 54766 → 22 [ACK] Seq=11717 Ack=107329 Win=6155 Len=0 TSval=8240417 TSecr=15171918
  833 33.595074794  10.6.15.156 → 192.168.1.12 SSH 222 Server: Encrypted packet (len=156)
  834 33.595091514 192.168.1.12 → 10.6.15.156  TCP 66 54766 → 22 [ACK] Seq=11717 Ack=107485 Win=6155 Len=0 TSval=8240441 TSecr=15171942
  835 33.652969287  10.6.15.156 → 192.168.1.12 SSH 222 Server: Encrypted packet (len=156)
  836 33.652991760 192.168.1.12 → 10.6.15.156  TCP 66 54766 → 22 [ACK] Seq=11717 Ack=107641 Win=6155 Len=0 TSval=8240455 TSecr=15171956
  837 33.755360407  10.6.15.156 → 192.168.1.12 SSH 214 Server: Encrypted packet (len=148)
  838 33.755377393 192.168.1.12 → 10.6.15.156  TCP 66 54766 → 22 [ACK] Seq=11717 Ack=107789 Win=6155 Len=0 TSval=8240481 TSecr=15171982
  839 33.976582410  10.6.15.156 → 192.168.1.12 SSH 222 Server: Encrypted packet (len=156)
  840 33.976600811 192.168.1.12 → 10.6.15.156  TCP 66 54766 → 22 [ACK] Seq=11717 Ack=107945 Win=6155 Len=0 TSval=8240536 TSecr=15172037
