    1 0.000000000 192.168.1.12 → 10.6.15.156  SSH 198 Client: Encrypted packet (len=132)
    2 0.018161466  10.6.15.156 → 192.168.1.12 SSH 374 Server: Encrypted packet (len=308)
    3 0.060024238 192.168.1.12 → 10.6.15.156  TCP 66 54766 → 22 [ACK] Seq=133 Ack=309 Win=4866 Len=0 TSval=7719578 TSecr=14651062
    4 0.177605345  10.6.15.156 → 192.168.1.12 SSH 446 Server: Encrypted packet (len=380)
    5 0.177673047 192.168.1.12 → 10.6.15.156  TCP 66 54766 → 22 [ACK] Seq=133 Ack=689 Win=4866 Len=0 TSval=7719607 TSecr=14651102
    6 0.247039853 192.168.1.12 → 10.6.15.156  SSH 1014 Client: Encrypted packet (len=948)
    7 0.287569917  10.6.15.156 → 192.168.1.12 TCP 66 22 → 54766 [ACK] Seq=689 Ack=1081 Win=1452 Len=0 TSval=14651130 TSecr=7719624
    8 0.363012601 192.168.1.12 → 10.6.15.156  SSH 598 Client: Encrypted packet (len=532)
    9 0.364804746  10.6.15.156 → 192.168.1.12 TCP 66 22 → 54766 [ACK] Seq=689 Ack=1613 Win=1452 Len=0 TSval=14651149 TSecr=7719653
   10 0.408691169 192.168.1.12 → 10.6.15.156  SSH 726 Client: Encrypted packet (len=660)
   11 0.410693174  10.6.15.156 → 192.168.1.12 TCP 66 22 → 54766 [ACK] Seq=689 Ack=2273 Win=1452 Len=0 TSval=14651160 TSecr=7719665
   12 0.411298495 192.168.1.12 → 10.6.15.156  SSH 950 Client: Encrypted packet (len=884)
   13 0.413414398  10.6.15.156 → 192.168.1.12 TCP 66 22 → 54766 [ACK] Seq=689 Ack=3157 Win=1452 Len=0 TSval=14651161 TSecr=7719665
   14 0.417683533  10.6.15.156 → 192.168.1.12 SSH 390 Server: Encrypted packet (len=324)
   15 0.417707966 192.168.1.12 → 10.6.15.156  TCP 66 54766 → 22 [ACK] Seq=3157 Ack=1013 Win=4866 Len=0 TSval=7719667 TSecr=14651162
   16 0.450341278  10.6.15.156 → 192.168.1.12 SSH 1514 Server: Encrypted packet (len=1448)
   17 0.450356494 192.168.1.12 → 10.6.15.156  TCP 66 54766 → 22 [ACK] Seq=3157 Ack=2461 Win=4866 Len=0 TSval=7719675 TSecr=14651170
   18 0.450527774  10.6.15.156 → 192.168.1.12 SSH 1514 Server: Encrypted packet (len=1448)
   19 0.450533478 192.168.1.12 → 10.6.15.156  TCP 66 54766 → 22 [ACK] Seq=3157 Ack=3909 Win=4866 Len=0 TSval=7719675 TSecr=14651170
   20 0.450719640  10.6.15.156 → 192.168.1.12 SSH 1514 Server: Encrypted packet (len=1448)
   21 0.450725856 192.168.1.12 → 10.6.15.156  TCP 66 54766 → 22 [ACK] Seq=3157 Ack=5357 Win=4866 Len=0 TSval=7719675 TSecr=14651170
   22 0.450895978  10.6.15.156 → 192.168.1.12 SSH 1514 Server: Encrypted packet (len=1448)
   23 0.450900481 192.168.1.12 → 10.6.15.156  TCP 66 54766 → 22 [ACK] Seq=3157 Ack=6805 Win=4866 Len=0 TSval=7719675 TSecr=14651170
   24 0.450909138  10.6.15.156 → 192.168.1.12 SSH 110 Server: Encrypted packet (len=44)
   25 0.450913953 192.168.1.12 → 10.6.15.156  TCP 66 54766 → 22 [ACK] Seq=3157 Ack=6849 Win=4866 Len=0 TSval=7719675 TSecr=14651170
   26 0.452219217  10.6.15.156 → 192.168.1.12 SSH 1514 Server: Encrypted packet (len=1448)
   27 0.452226553 192.168.1.12 → 10.6.15.156  TCP 66 54766 → 22 [ACK] Seq=3157 Ack=8297 Win=4866 Len=0 TSval=7719676 TSecr=14651170
   28 0.452407621  10.6.15.156 → 192.168.1.12 SSH 1514 Server: Encrypted packet (len=1448)
   29 0.452410628 192.168.1.12 → 10.6.15.156  TCP 66 54766 → 22 [ACK] Seq=3157 Ack=9745 Win=4866 Len=0 TSval=7719676 TSecr=14651170
   30 0.452598785  10.6.15.156 → 192.168.1.12 SSH 1514 Server: Encrypted packet (len=1448)
   31 0.452601679 192.168.1.12 → 10.6.15.156  TCP 66 54766 → 22 [ACK] Seq=3157 Ack=11193 Win=4866 Len=0 TSval=7719676 TSecr=14651170
   32 0.452776964  10.6.15.156 → 192.168.1.12 SSH 1514 Server: Encrypted packet (len=1448)
   33 0.452779525 192.168.1.12 → 10.6.15.156  TCP 66 54766 → 22 [ACK] Seq=3157 Ack=12641 Win=4866 Len=0 TSval=7719676 TSecr=14651170
   34 0.452968869  10.6.15.156 → 192.168.1.12 SSH 1514 Server: Encrypted packet (len=1448)
   35 0.452972493 192.168.1.12 → 10.6.15.156  TCP 66 54766 → 22 [ACK] Seq=3157 Ack=14089 Win=4866 Len=0 TSval=7719676 TSecr=14651170
   36 0.454577134  10.6.15.156 → 192.168.1.12 SSH 1514 Server: Encrypted packet (len=1448)
   37 0.454586381 192.168.1.12 → 10.6.15.156  TCP 66 54766 → 22 [ACK] Seq=3157 Ack=15537 Win=4866 Len=0 TSval=7719676 TSecr=14651171
   38 0.454597768  10.6.15.156 → 192.168.1.12 SSH 110 Server: Encrypted packet (len=44)
   39 0.454600577 192.168.1.12 → 10.6.15.156  TCP 66 54766 → 22 [ACK] Seq=3157 Ack=15581 Win=4866 Len=0 TSval=7719676 TSecr=14651171
   40 0.484605481  10.6.15.156 → 192.168.1.12 SSH 486 Server: Encrypted packet (len=420)
   41 0.484621556 192.168.1.12 → 10.6.15.156  TCP 66 54766 → 22 [ACK] Seq=3157 Ack=16001 Win=4866 Len=0 TSval=7719684 TSecr=14651179
   42 0.521178532 192.168.1.12 → 10.6.15.156  SSH 614 Client: Encrypted packet (len=548)
   43 0.526548093  10.6.15.156 → 192.168.1.12 SSH 350 Server: Encrypted packet (len=284)
   44 0.526573648 192.168.1.12 → 10.6.15.156  SSH 142 Client: Encrypted packet (len=76)
   45 0.530163720  10.6.15.156 → 192.168.1.12 SSH 142 Server: Encrypted packet (len=76)
   46 0.530189042 192.168.1.12 → 10.6.15.156  SSH 134 Client: Encrypted packet (len=68)
   47 0.544406421  10.6.15.156 → 192.168.1.12 SSH 598 Server: Encrypted packet (len=532)
   48 0.588019769 192.168.1.12 → 10.6.15.156  TCP 66 54766 → 22 [ACK] Seq=3849 Ack=16893 Win=4866 Len=0 TSval=7719710 TSecr=14651194
   49 0.604904877 192.168.1.12 → 10.6.15.156  SSH 102 Client: Encrypted packet (len=36)
   50 0.606638149 192.168.1.12 → 10.6.15.156  SSH 1514 Client: Encrypted packet (len=1448)
   51 0.607456545 192.168.1.12 → 10.6.15.156  SSH 410 Client: Encrypted packet (len=344)
   52 0.609212290  10.6.15.156 → 192.168.1.12 TCP 66 22 → 54766 [ACK] Seq=16893 Ack=5677 Win=1452 Len=0 TSval=14651210 TSecr=7719714
   53 0.638333882  10.6.15.156 → 192.168.1.12 SSH 1514 Server: Encrypted packet (len=1448)
   54 0.638512573  10.6.15.156 → 192.168.1.12 SSH 1514 Server: Encrypted packet (len=1448)
   55 0.638522830 192.168.1.12 → 10.6.15.156  TCP 66 54766 → 22 [ACK] Seq=5677 Ack=19789 Win=4866 Len=0 TSval=7719722 TSecr=14651217
   56 0.639801563  10.6.15.156 → 192.168.1.12 SSH 110 Server: Encrypted packet (len=44)
   57 0.639873344 192.168.1.12 → 10.6.15.156  TCP 66 54766 → 22 [ACK] Seq=5677 Ack=19833 Win=4866 Len=0 TSval=7719722 TSecr=14651217
   58 0.640033554  10.6.15.156 → 192.168.1.12 SSH 1514 Server: Encrypted packet (len=1448)
   59 0.640215583  10.6.15.156 → 192.168.1.12 SSH 1514 Server: Encrypted packet (len=1448)
   60 0.640220200 192.168.1.12 → 10.6.15.156  TCP 66 54766 → 22 [ACK] Seq=5677 Ack=22729 Win=4866 Len=0 TSval=7719723 TSecr=14651217
   61 0.641292048  10.6.15.156 → 192.168.1.12 SSH 1514 Server: Encrypted packet (len=1448)
   62 0.641478814  10.6.15.156 → 192.168.1.12 SSH 1514 Server: Encrypted packet (len=1448)
   63 0.641490667 192.168.1.12 → 10.6.15.156  TCP 66 54766 → 22 [ACK] Seq=5677 Ack=25625 Win=4866 Len=0 TSval=7719723 TSecr=14651217
   64 0.641670015  10.6.15.156 → 192.168.1.12 SSH 1514 Server: Encrypted packet (len=1448)
   65 0.641678443  10.6.15.156 → 192.168.1.12 SSH 110 Server: Encrypted packet (len=44)
   66 0.641682372 192.168.1.12 → 10.6.15.156  TCP 66 54766 → 22 [ACK] Seq=5677 Ack=27117 Win=4866 Len=0 TSval=7719723 TSecr=14651217
   67 0.641880359  10.6.15.156 → 192.168.1.12 SSH 1514 Server: Encrypted packet (len=1448)
   68 0.642072570  10.6.15.156 → 192.168.1.12 SSH 1514 Server: Encrypted packet (len=1448)
   69 0.642079487 192.168.1.12 → 10.6.15.156  TCP 66 54766 → 22 [ACK] Seq=5677 Ack=30013 Win=4866 Len=0 TSval=7719723 TSecr=14651218
   70 0.642263798  10.6.15.156 → 192.168.1.12 SSH 1514 Server: Encrypted packet (len=1448)
   71 0.643434872  10.6.15.156 → 192.168.1.12 SSH 1514 Server: Encrypted packet (len=1448)
   72 0.643454090 192.168.1.12 → 10.6.15.156  TCP 66 54766 → 22 [ACK] Seq=5677 Ack=32909 Win=4866 Len=0 TSval=7719723 TSecr=14651218
   73 0.643617288  10.6.15.156 → 192.168.1.12 SSH 1514 Server: Encrypted packet (len=1448)
   74 0.643809936  10.6.15.156 → 192.168.1.12 SSH 1514 Server: Encrypted packet (len=1448)
   75 0.643817827 192.168.1.12 → 10.6.15.156  TCP 66 54766 → 22 [ACK] Seq=5677 Ack=35805 Win=4866 Len=0 TSval=7719723 TSecr=14651218
   76 0.644997687  10.6.15.156 → 192.168.1.12 SSH 1514 Server: Encrypted packet (len=1448)
   77 0.645178764  10.6.15.156 → 192.168.1.12 SSH 1514 Server: Encrypted packet (len=1448)
   78 0.645186870 192.168.1.12 → 10.6.15.156  TCP 66 54766 → 22 [ACK] Seq=5677 Ack=38701 Win=4866 Len=0 TSval=7719724 TSecr=14651219
   79 0.645371177  10.6.15.156 → 192.168.1.12 SSH 1514 Server: Encrypted packet (len=1448)
   80 0.645562895  10.6.15.156 → 192.168.1.12 SSH 1514 Server: Encrypted packet (len=1448)
   81 0.645568736 192.168.1.12 → 10.6.15.156  TCP 66 54766 → 22 [ACK] Seq=5677 Ack=41597 Win=4866 Len=0 TSval=7719724 TSecr=14651219
   82 0.645754946  10.6.15.156 → 192.168.1.12 SSH 1514 Server: Encrypted packet (len=1448)
   83 0.646101486  10.6.15.156 → 192.168.1.12 SSH 1514 Server: Encrypted packet (len=1448)
   84 0.646110190 192.168.1.12 → 10.6.15.156  TCP 66 54766 → 22 [ACK] Seq=5677 Ack=44493 Win=4866 Len=0 TSval=7719724 TSecr=14651219
   85 0.646290931  10.6.15.156 → 192.168.1.12 SSH 1514 Server: Encrypted packet (len=1448)
   86 0.646297806  10.6.15.156 → 192.168.1.12 SSH 154 Server: Encrypted packet (len=88)
   87 0.646302191 192.168.1.12 → 10.6.15.156  TCP 66 54766 → 22 [ACK] Seq=5677 Ack=46029 Win=4866 Len=0 TSval=7719724 TSecr=14651219
   88 0.759446487 192.168.1.12 → 10.6.15.156  SSH 102 Client: Encrypted packet (len=36)
   89 0.760993925  10.6.15.156 → 192.168.1.12 SSH 710 Server: Encrypted packet (len=644)
   90 0.761008905 192.168.1.12 → 10.6.15.156  SSH 126 Client: Encrypted packet (len=60)
   91 0.764846506  10.6.15.156 → 192.168.1.12 SSH 110 Server: Encrypted packet (len=44)
   92 0.765172833 192.168.1.12 → 10.6.15.156  SSH 190 Client: Encrypted packet (len=124)
   93 0.784778973  10.6.15.156 → 192.168.1.12 SSH 138 Server: Encrypted packet (len=72)
   94 0.785035629 192.168.1.12 → 10.6.15.156  SSH 102 Client: Encrypted packet (len=36)
   95 0.823594146  10.6.15.156 → 192.168.1.12 TCP 66 22 → 54766 [ACK] Seq=46789 Ack=5933 Win=1452 Len=0 TSval=14651264 TSecr=7719759
   96 0.830546772  10.6.15.156 → 192.168.1.12 SSH 1514 Server: Encrypted packet (len=1448)
   97 0.830770567  10.6.15.156 → 192.168.1.12 SSH 1514 Server: Encrypted packet (len=1448)
   98 0.830784057 192.168.1.12 → 10.6.15.156  TCP 66 54766 → 22 [ACK] Seq=5933 Ack=49685 Win=4866 Len=0 TSval=7719770 TSecr=14651265
   99 0.830958567  10.6.15.156 → 192.168.1.12 SSH 1514 Server: Encrypted packet (len=1448)
  100 0.830966953  10.6.15.156 → 192.168.1.12 SSH 110 Server: Encrypted packet (len=44)
  101 0.830972401 192.168.1.12 → 10.6.15.156  TCP 66 54766 → 22 [ACK] Seq=5933 Ack=51177 Win=4866 Len=0 TSval=7719770 TSecr=14651265
  102 0.831371766  10.6.15.156 → 192.168.1.12 SSH 1514 Server: Encrypted packet (len=1448)
  103 0.831490773  10.6.15.156 → 192.168.1.12 SSH 1514 Server: Encrypted packet (len=1448)
  104 0.831499574 192.168.1.12 → 10.6.15.156  TCP 66 54766 → 22 [ACK] Seq=5933 Ack=54073 Win=4866 Len=0 TSval=7719770 TSecr=14651265
  105 0.831699203  10.6.15.156 → 192.168.1.12 SSH 1514 Server: Encrypted packet (len=1448)
  106 0.831890824  10.6.15.156 → 192.168.1.12 SSH 1514 Server: Encrypted packet (len=1448)
  107 0.831893546 192.168.1.12 → 10.6.15.156  TCP 66 54766 → 22 [ACK] Seq=5933 Ack=56969 Win=4866 Len=0 TSval=7719770 TSecr=14651265
  108 0.832120247  10.6.15.156 → 192.168.1.12 SSH 1514 Server: Encrypted packet (len=1448)
  109 0.832129542  10.6.15.156 → 192.168.1.12 SSH 110 Server: Encrypted packet (len=44)
  110 0.832133827 192.168.1.12 → 10.6.15.156  TCP 66 54766 → 22 [ACK] Seq=5933 Ack=58461 Win=4866 Len=0 TSval=7719771 TSecr=14651265
  111 0.833455192  10.6.15.156 → 192.168.1.12 SSH 1514 Server: Encrypted packet (len=1448)
  112 0.833634747  10.6.15.156 → 192.168.1.12 SSH 1514 Server: Encrypted packet (len=1448)
  113 0.833641225 192.168.1.12 → 10.6.15.156  TCP 66 54766 → 22 [ACK] Seq=5933 Ack=61357 Win=4866 Len=0 TSval=7719771 TSecr=14651266
  114 0.833839061  10.6.15.156 → 192.168.1.12 SSH 1514 Server: Encrypted packet (len=1448)
  115 0.834181023  10.6.15.156 → 192.168.1.12 SSH 1514 Server: Encrypted packet (len=1448)
  116 0.834186841 192.168.1.12 → 10.6.15.156  TCP 66 54766 → 22 [ACK] Seq=5933 Ack=64253 Win=4866 Len=0 TSval=7719771 TSecr=14651266
  117 0.834503258  10.6.15.156 → 192.168.1.12 SSH 1514 Server: Encrypted packet (len=1448)
  118 0.834690451  10.6.15.156 → 192.168.1.12 SSH 1514 Server: Encrypted packet (len=1448)
  119 0.834694177 192.168.1.12 → 10.6.15.156  TCP 66 54766 → 22 [ACK] Seq=5933 Ack=67149 Win=4866 Len=0 TSval=7719771 TSecr=14651266
  120 0.834882285  10.6.15.156 → 192.168.1.12 SSH 1514 Server: Encrypted packet (len=1448)
  121 0.835249110  10.6.15.156 → 192.168.1.12 SSH 1514 Server: Encrypted packet (len=1448)
  122 0.835251440 192.168.1.12 → 10.6.15.156  TCP 66 54766 → 22 [ACK] Seq=5933 Ack=70045 Win=4866 Len=0 TSval=7719771 TSecr=14651266
  123 0.835438154  10.6.15.156 → 192.168.1.12 SSH 1514 Server: Encrypted packet (len=1448)
  124 0.835442492  10.6.15.156 → 192.168.1.12 SSH 110 Server: Encrypted packet (len=44)
  125 0.835445537 192.168.1.12 → 10.6.15.156  TCP 66 54766 → 22 [ACK] Seq=5933 Ack=71537 Win=4866 Len=0 TSval=7719771 TSecr=14651266
  126 0.835621566  10.6.15.156 → 192.168.1.12 SSH 1514 Server: Encrypted packet (len=1448)
  127 0.835814503  10.6.15.156 → 192.168.1.12 SSH 1514 Server: Encrypted packet (len=1448)
  128 0.835819165 192.168.1.12 → 10.6.15.156  TCP 66 54766 → 22 [ACK] Seq=5933 Ack=74433 Win=4866 Len=0 TSval=7719771 TSecr=14651266
  129 0.836659787  10.6.15.156 → 192.168.1.12 SSH 1514 Server: Encrypted packet (len=1448)
  130 0.837901255  10.6.15.156 → 192.168.1.12 SSH 1514 Server: Encrypted packet (len=1448)
  131 0.837908155 192.168.1.12 → 10.6.15.156  TCP 66 54766 → 22 [ACK] Seq=5933 Ack=77329 Win=4866 Len=0 TSval=7719772 TSecr=14651266
  132 0.838224045  10.6.15.156 → 192.168.1.12 SSH 1514 Server: Encrypted packet (len=1448)
  133 0.838415846  10.6.15.156 → 192.168.1.12 SSH 1514 Server: Encrypted packet (len=1448)
  134 0.838419375 192.168.1.12 → 10.6.15.156  TCP 66 54766 → 22 [ACK] Seq=5933 Ack=80225 Win=4866 Len=0 TSval=7719772 TSecr=14651267
  135 0.838606929  10.6.15.156 → 192.168.1.12 SSH 1514 Server: Encrypted packet (len=1448)
  136 0.838952427  10.6.15.156 → 192.168.1.12 SSH 1514 Server: Encrypted packet (len=1448)
  137 0.838955530 192.168.1.12 → 10.6.15.156  TCP 66 54766 → 22 [ACK] Seq=5933 Ack=83121 Win=4866 Len=0 TSval=7719772 TSecr=14651267
  138 0.839143853  10.6.15.156 → 192.168.1.12 SSH 1514 Server: Encrypted packet (len=1448)
  139 0.839336786  10.6.15.156 → 192.168.1.12 SSH 1514 Server: Encrypted packet (len=1448)
  140 0.839340010 192.168.1.12 → 10.6.15.156  TCP 66 54766 → 22 [ACK] Seq=5933 Ack=86017 Win=4866 Len=0 TSval=7719772 TSecr=14651267
  141 0.839528810  10.6.15.156 → 192.168.1.12 SSH 1514 Server: Encrypted packet (len=1448)
  142 0.843627474  10.6.15.156 → 192.168.1.12 SSH 1514 Server: Encrypted packet (len=1448)
  143 0.843633151 192.168.1.12 → 10.6.15.156  TCP 66 54766 → 22 [ACK] Seq=5933 Ack=88913 Win=4866 Len=0 TSval=7719773 TSecr=14651267
  144 0.843817911  10.6.15.156 → 192.168.1.12 SSH 1514 Server: Encrypted packet (len=1448)
  145 0.843981242  10.6.15.156 → 192.168.1.12 SSH 1514 Server: Encrypted packet (len=1448)
  146 0.843984899 192.168.1.12 → 10.6.15.156  TCP 66 54766 → 22 [ACK] Seq=5933 Ack=91809 Win=4866 Len=0 TSval=7719773 TSecr=14651267
  147 0.844208412  10.6.15.156 → 192.168.1.12 SSH 1514 Server: Encrypted packet (len=1448)
  148 0.844394432  10.6.15.156 → 192.168.1.12 SSH 1514 Server: Encrypted packet (len=1448)
  149 0.844399416 192.168.1.12 → 10.6.15.156  TCP 66 54766 → 22 [ACK] Seq=5933 Ack=94705 Win=4866 Len=0 TSval=7719774 TSecr=14651267
  150 0.844585421  10.6.15.156 → 192.168.1.12 SSH 1514 Server: Encrypted packet (len=1448)
  151 0.844903229  10.6.15.156 → 192.168.1.12 SSH 1514 Server: Encrypted packet (len=1448)
  152 0.844909198 192.168.1.12 → 10.6.15.156  TCP 66 54766 → 22 [ACK] Seq=5933 Ack=97601 Win=4866 Len=0 TSval=7719774 TSecr=14651267
  153 0.845095593  10.6.15.156 → 192.168.1.12 SSH 1514 Server: Encrypted packet (len=1448)
  154 0.845288001  10.6.15.156 → 192.168.1.12 SSH 1514 Server: Encrypted packet (len=1448)
  155 0.845294286 192.168.1.12 → 10.6.15.156  TCP 66 54766 → 22 [ACK] Seq=5933 Ack=100497 Win=4866 Len=0 TSval=7719774 TSecr=14651269
  156 0.845479637  10.6.15.156 → 192.168.1.12 SSH 1514 Server: Encrypted packet (len=1448)
  157 0.845670395  10.6.15.156 → 192.168.1.12 SSH 1514 Server: Encrypted packet (len=1448)
  158 0.845674846 192.168.1.12 → 10.6.15.156  TCP 66 54766 → 22 [ACK] Seq=5933 Ack=103393 Win=4866 Len=0 TSval=7719774 TSecr=14651269
  159 0.845796085 192.168.1.12 → 10.6.15.156  SSH 102 Client: Encrypted packet (len=36)
  160 0.845865616  10.6.15.156 → 192.168.1.12 SSH 1514 Server: Encrypted packet (len=1448)
  161 0.846649863  10.6.15.156 → 192.168.1.12 SSH 242 Server: Encrypted packet (len=176)
  162 0.846654084 192.168.1.12 → 10.6.15.156  TCP 66 54766 → 22 [ACK] Seq=5969 Ack=105017 Win=4866 Len=0 TSval=7719774 TSecr=14651269
  163 0.847653131  10.6.15.156 → 192.168.1.12 TCP 66 22 → 54766 [ACK] Seq=105017 Ack=5969 Win=1452 Len=0 TSval=14651270 TSecr=7719774
  164 0.920386880  10.6.15.156 → 192.168.1.12 SSH 1514 Server: Encrypted packet (len=1448)
  165 0.920544049  10.6.15.156 → 192.168.1.12 SSH 1514 Server: Encrypted packet (len=1448)
  166 0.920553998 192.168.1.12 → 10.6.15.156  TCP 66 54766 → 22 [ACK] Seq=5969 Ack=107913 Win=4866 Len=0 TSval=7719793 TSecr=14651288
  167 0.920705007  10.6.15.156 → 192.168.1.12 SSH 294 Server: Encrypted packet (len=228)
  168 0.921427316 192.168.1.12 → 10.6.15.156  SSH 446 Client: Encrypted packet (len=380)
  169 0.923404922  10.6.15.156 → 192.168.1.12 TCP 66 22 → 54766 [ACK] Seq=108141 Ack=6349 Win=1452 Len=0 TSval=14651289 TSecr=7719793
  170 0.950537702  10.6.15.156 → 192.168.1.12 SSH 138 Server: Encrypted packet (len=72)
  171 0.950755498 192.168.1.12 → 10.6.15.156  SSH 102 Client: Encrypted packet (len=36)
  172 0.977253981  10.6.15.156 → 192.168.1.12 SSH 110 Server: Encrypted packet (len=44)
  173 0.977597985 192.168.1.12 → 10.6.15.156  SSH 206 Client: Encrypted packet (len=140)
  174 1.015614870  10.6.15.156 → 192.168.1.12 TCP 66 22 → 54766 [ACK] Seq=108257 Ack=6525 Win=1452 Len=0 TSval=14651312 TSecr=7719807
  175 1.020521654  10.6.15.156 → 192.168.1.12 SSH 1514 Server: Encrypted packet (len=1448)
  176 1.020682157  10.6.15.156 → 192.168.1.12 SSH 1514 Server: Encrypted packet (len=1448)
  177 1.020693332 192.168.1.12 → 10.6.15.156  TCP 66 54766 → 22 [ACK] Seq=6525 Ack=111153 Win=4866 Len=0 TSval=7719818 TSecr=14651312
  178 1.021055874  10.6.15.156 → 192.168.1.12 SSH 1514 Server: Encrypted packet (len=1448)
  179 1.021212358  10.6.15.156 → 192.168.1.12 SSH 1514 Server: Encrypted packet (len=1448)
  180 1.021224502 192.168.1.12 → 10.6.15.156  TCP 66 54766 → 22 [ACK] Seq=6525 Ack=114049 Win=4866 Len=0 TSval=7719818 TSecr=14651312
  181 1.021238316  10.6.15.156 → 192.168.1.12 SSH 110 Server: Encrypted packet (len=44)
  182 1.021404842  10.6.15.156 → 192.168.1.12 SSH 1514 Server: Encrypted packet (len=1448)
  183 1.021412066 192.168.1.12 → 10.6.15.156  TCP 66 54766 → 22 [ACK] Seq=6525 Ack=115541 Win=4866 Len=0 TSval=7719818 TSecr=14651312
  184 1.021619665  10.6.15.156 → 192.168.1.12 SSH 1514 Server: Encrypted packet (len=1448)
  185 1.021807688  10.6.15.156 → 192.168.1.12 SSH 1514 Server: Encrypted packet (len=1448)
  186 1.021818890 192.168.1.12 → 10.6.15.156  TCP 66 54766 → 22 [ACK] Seq=6525 Ack=118437 Win=4866 Len=0 TSval=7719818 TSecr=14651313
  187 1.021993484  10.6.15.156 → 192.168.1.12 SSH 1514 Server: Encrypted packet (len=1448)
  188 1.021999645  10.6.15.156 → 192.168.1.12 SSH 110 Server: Encrypted packet (len=44)
  189 1.022004123 192.168.1.12 → 10.6.15.156  TCP 66 54766 → 22 [ACK] Seq=6525 Ack=119929 Win=4866 Len=0 TSval=7719818 TSecr=14651313
  190 1.022323077  10.6.15.156 → 192.168.1.12 SSH 1514 Server: Encrypted packet (len=1448)
  191 1.022516266  10.6.15.156 → 192.168.1.12 SSH 1514 Server: Encrypted packet (len=1448)
  192 1.022520708 192.168.1.12 → 10.6.15.156  TCP 66 54766 → 22 [ACK] Seq=6525 Ack=122825 Win=4866 Len=0 TSval=7719818 TSecr=14651313
  193 1.022783882  10.6.15.156 → 192.168.1.12 SSH 1514 Server: Encrypted packet (len=1448)
  194 1.022926037  10.6.15.156 → 192.168.1.12 SSH 1514 Server: Encrypted packet (len=1448)
  195 1.022935423 192.168.1.12 → 10.6.15.156  TCP 66 54766 → 22 [ACK] Seq=6525 Ack=125721 Win=4866 Len=0 TSval=7719818 TSecr=14651313
  196 1.023134606  10.6.15.156 → 192.168.1.12 SSH 1514 Server: Encrypted packet (len=1448)
  197 1.023317776  10.6.15.156 → 192.168.1.12 SSH 1514 Server: Encrypted packet (len=1448)
  198 1.023329177 192.168.1.12 → 10.6.15.156  TCP 66 54766 → 22 [ACK] Seq=6525 Ack=128617 Win=4866 Len=0 TSval=7719818 TSecr=14651313
  199 1.023343072  10.6.15.156 → 192.168.1.12 SSH 110 Server: Encrypted packet (len=44)
  200 1.023509602  10.6.15.156 → 192.168.1.12 SSH 1514 Server: Encrypted packet (len=1448)
  201 1.023516414 192.168.1.12 → 10.6.15.156  TCP 66 54766 → 22 [ACK] Seq=6525 Ack=130109 Win=4866 Len=0 TSval=7719818 TSecr=14651313
  202 1.023701164  10.6.15.156 → 192.168.1.12 SSH 1514 Server: Encrypted packet (len=1448)
  203 1.024852548  10.6.15.156 → 192.168.1.12 SSH 1514 Server: Encrypted packet (len=1448)
  204 1.024859957 192.168.1.12 → 10.6.15.156  TCP 66 54766 → 22 [ACK] Seq=6525 Ack=133005 Win=4866 Len=0 TSval=7719819 TSecr=14651313
  205 1.025043832  10.6.15.156 → 192.168.1.12 SSH 1514 Server: Encrypted packet (len=1448)
  206 1.027217877  10.6.15.156 → 192.168.1.12 SSH 1514 Server: Encrypted packet (len=1448)
  207 1.027224558 192.168.1.12 → 10.6.15.156  TCP 66 54766 → 22 [ACK] Seq=6525 Ack=135901 Win=4866 Len=0 TSval=7719819 TSecr=14651313
  208 1.027394663  10.6.15.156 → 192.168.1.12 SSH 1514 Server: Encrypted packet (len=1448)
  209 1.027594288  10.6.15.156 → 192.168.1.12 SSH 1514 Server: Encrypted packet (len=1448)
  210 1.027598627 192.168.1.12 → 10.6.15.156  TCP 66 54766 → 22 [ACK] Seq=6525 Ack=138797 Win=4866 Len=0 TSval=7719819 TSecr=14651314
  211 1.027791771  10.6.15.156 → 192.168.1.12 SSH 1514 Server: Encrypted packet (len=1448)
  212 1.027980236  10.6.15.156 → 192.168.1.12 SSH 1514 Server: Encrypted packet (len=1448)
  213 1.027985410 192.168.1.12 → 10.6.15.156  TCP 66 54766 → 22 [ACK] Seq=6525 Ack=141693 Win=4866 Len=0 TSval=7719819 TSecr=14651314
  214 1.028168316  10.6.15.156 → 192.168.1.12 SSH 1514 Server: Encrypted packet (len=1448)
  215 1.028500178  10.6.15.156 → 192.168.1.12 SSH 1514 Server: Encrypted packet (len=1448)
  216 1.028505098 192.168.1.12 → 10.6.15.156  TCP 66 54766 → 22 [ACK] Seq=6525 Ack=144589 Win=4866 Len=0 TSval=7719820 TSecr=14651314
  217 1.028688293  10.6.15.156 → 192.168.1.12 SSH 1514 Server: Encrypted packet (len=1448)
  218 1.028881697  10.6.15.156 → 192.168.1.12 SSH 1514 Server: Encrypted packet (len=1448)
  219 1.028887770 192.168.1.12 → 10.6.15.156  TCP 66 54766 → 22 [ACK] Seq=6525 Ack=147485 Win=4866 Len=0 TSval=7719820 TSecr=14651314
  220 1.028939716  10.6.15.156 → 192.168.1.12 SSH 686 Server: Encrypted packet (len=620)
  221 1.072022001 192.168.1.12 → 10.6.15.156  TCP 66 54766 → 22 [ACK] Seq=6525 Ack=148105 Win=4866 Len=0 TSval=7719831 TSecr=14651314
  222 1.079959439  10.6.15.156 → 192.168.1.12 SSH 182 Server: Encrypted packet (len=116)
  223 1.080056282 192.168.1.12 → 10.6.15.156  TCP 66 54766 → 22 [ACK] Seq=6525 Ack=148221 Win=4866 Len=0 TSval=7719833 TSecr=14651328
  224 1.081330637 192.168.1.12 → 10.6.15.156  SSH 726 Client: Encrypted packet (len=660)
  225 1.084018332  10.6.15.156 → 192.168.1.12 TCP 66 22 → 54766 [ACK] Seq=148221 Ack=7185 Win=1452 Len=0 TSval=14651329 TSecr=7719833
  226 1.099358017 192.168.1.12 → 10.6.15.156  SSH 182 Client: Encrypted packet (len=116)
  227 1.101658756  10.6.15.156 → 192.168.1.12 TCP 66 22 → 54766 [ACK] Seq=148221 Ack=7301 Win=1452 Len=0 TSval=14651333 TSecr=7719837
  228 1.196133909  10.6.15.156 → 192.168.1.12 SSH 1514 Server: Encrypted packet (len=1448)
  229 1.196158492  10.6.15.156 → 192.168.1.12 SSH 654 Server: Encrypted packet (len=588)
  230 1.196168967 192.168.1.12 → 10.6.15.156  TCP 66 54766 → 22 [ACK] Seq=7301 Ack=150257 Win=4866 Len=0 TSval=7719862 TSecr=14651357
  231 1.196364775  10.6.15.156 → 192.168.1.12 SSH 742 Server: Encrypted packet (len=676)
  232 1.200273697  10.6.15.156 → 192.168.1.12 SSH 1062 Server: Encrypted packet (len=996)
  233 1.200291915 192.168.1.12 → 10.6.15.156  TCP 66 54766 → 22 [ACK] Seq=7301 Ack=151929 Win=4866 Len=0 TSval=7719863 TSecr=14651357
  234 1.201351486 192.168.1.12 → 10.6.15.156  SSH 214 Client: Encrypted packet (len=148)
  235 1.203230481  10.6.15.156 → 192.168.1.12 TCP 66 22 → 54766 [ACK] Seq=151929 Ack=7449 Win=1452 Len=0 TSval=14651358 TSecr=7719863
  236 1.246250511  10.6.15.156 → 192.168.1.12 SSH 1174 Server: Encrypted packet (len=1108)
  237 1.288017602 192.168.1.12 → 10.6.15.156  TCP 66 54766 → 22 [ACK] Seq=7449 Ack=153037 Win=4866 Len=0 TSval=7719885 TSecr=14651369
  238 1.313790481 192.168.1.12 → 10.6.15.156  SSH 270 Client: Encrypted packet (len=204)
  239 1.313998390 192.168.1.12 → 10.6.15.156  SSH 1514 Client: Encrypted packet (len=1448)
  240 1.314878099 192.168.1.12 → 10.6.15.156  SSH 598 Client: Encrypted packet (len=532)
  241 1.316538024  10.6.15.156 → 192.168.1.12 TCP 66 22 → 54766 [ACK] Seq=153037 Ack=7653 Win=1452 Len=0 TSval=14651387 TSecr=7719891
  242 1.317215223  10.6.15.156 → 192.168.1.12 TCP 66 22 → 54766 [ACK] Seq=153037 Ack=9633 Win=1452 Len=0 TSval=14651387 TSecr=7719891
  243 1.319246786  10.6.15.156 → 192.168.1.12 SSH 142 Server: Encrypted packet (len=76)
  244 1.319334751 192.168.1.12 → 10.6.15.156  TCP 66 54766 → 22 [ACK] Seq=9633 Ack=153113 Win=4866 Len=0 TSval=7719892 TSecr=14651387
  245 1.419370360  10.6.15.156 → 192.168.1.12 SSH 150 Server: Encrypted packet (len=84)
  246 1.419460871 192.168.1.12 → 10.6.15.156  TCP 66 54766 → 22 [ACK] Seq=9633 Ack=153197 Win=4866 Len=0 TSval=7719917 TSecr=14651412
  247 1.419993840 192.168.1.12 → 10.6.15.156  SSH 862 Client: Encrypted packet (len=796)
  248 1.425195966  10.6.15.156 → 192.168.1.12 SSH 926 Server: Encrypted packet (len=860)
  249 1.425218211  10.6.15.156 → 192.168.1.12 SSH 414 Server: Encrypted packet (len=348)
  250 1.425228338  10.6.15.156 → 192.168.1.12 SSH 134 Server: Encrypted packet (len=68)
  251 1.425286565 192.168.1.12 → 10.6.15.156  TCP 66 54766 → 22 [ACK] Seq=10429 Ack=154473 Win=4866 Len=0 TSval=7719919 TSecr=14651413
  252 1.425882812 192.168.1.12 → 10.6.15.156  SSH 142 Client: Encrypted packet (len=76)
  253 1.467558192  10.6.15.156 → 192.168.1.12 TCP 66 22 → 54766 [ACK] Seq=154473 Ack=10505 Win=1452 Len=0 TSval=14651425 TSecr=7719919
  254 1.514988285  10.6.15.156 → 192.168.1.12 SSH 446 Server: Encrypted packet (len=380)
  255 1.523756618 192.168.1.12 → 10.6.15.156  SSH 102 Client: Encrypted packet (len=36)
  256 1.523996150 192.168.1.12 → 10.6.15.156  SSH 102 Client: Encrypted packet (len=36)
  257 1.526824131  10.6.15.156 → 192.168.1.12 TCP 66 22 → 54766 [ACK] Seq=154853 Ack=10577 Win=1452 Len=0 TSval=14651439 TSecr=7719943
  258 1.526846420 192.168.1.12 → 10.6.15.156  SSH 146 Client: Encrypted packet (len=80)
  259 1.528675121  10.6.15.156 → 192.168.1.12 TCP 66 22 → 54766 [ACK] Seq=154853 Ack=10657 Win=1452 Len=0 TSval=14651440 TSecr=7719944
  260 1.531037424 192.168.1.12 → 10.6.15.156  SSH 198 Client: Encrypted packet (len=132)
  261 1.572066204  10.6.15.156 → 192.168.1.12 TCP 66 22 → 54766 [ACK] Seq=154853 Ack=10789 Win=1452 Len=0 TSval=14651451 TSecr=7719945
  262 1.625111679 192.168.1.12 → 10.6.15.156  SSH 494 Client: Encrypted packet (len=428)
  263 1.664287512  10.6.15.156 → 192.168.1.12 TCP 66 22 → 54766 [ACK] Seq=154853 Ack=11217 Win=1452 Len=0 TSval=14651474 TSecr=7719969
  264 1.742701570  10.6.15.156 → 192.168.1.12 SSH 598 Server: Encrypted packet (len=532)
  265 1.743003306 192.168.1.12 → 10.6.15.156  SSH 138 Client: Encrypted packet (len=72)
  266 1.784742836  10.6.15.156 → 192.168.1.12 TCP 66 22 → 54766 [ACK] Seq=155385 Ack=11289 Win=1452 Len=0 TSval=14651504 TSecr=7719998
  267 1.784763123 192.168.1.12 → 10.6.15.156  SSH 862 Client: Encrypted packet (len=796)
  268 1.786942658  10.6.15.156 → 192.168.1.12 TCP 66 22 → 54766 [ACK] Seq=155385 Ack=12085 Win=1452 Len=0 TSval=14651504 TSecr=7720009
  269 1.800172512  10.6.15.156 → 192.168.1.12 SSH 134 Server: Encrypted packet (len=68)
  270 1.800188935  10.6.15.156 → 192.168.1.12 SSH 102 Server: Encrypted packet (len=36)
  271 1.800233426 192.168.1.12 → 10.6.15.156  TCP 66 54766 → 22 [ACK] Seq=12085 Ack=155489 Win=4866 Len=0 TSval=7720013 TSecr=14651508
  272 1.800445679 192.168.1.12 → 10.6.15.156  SSH 138 Client: Encrypted packet (len=72)
  273 1.804188602  10.6.15.156 → 192.168.1.12 SSH 102 Server: Encrypted packet (len=36)
  274 1.848019548 192.168.1.12 → 10.6.15.156  TCP 66 54766 → 22 [ACK] Seq=12157 Ack=155525 Win=4866 Len=0 TSval=7720025 TSecr=14651508
  275 1.877829373  10.6.15.156 → 192.168.1.12 SSH 110 Server: Encrypted packet (len=44)
  276 1.877860906 192.168.1.12 → 10.6.15.156  TCP 66 54766 → 22 [ACK] Seq=12157 Ack=155569 Win=4866 Len=0 TSval=7720032 TSecr=14651527
  277 1.878175664 192.168.1.12 → 10.6.15.156  SSH 174 Client: Encrypted packet (len=108)
  278 1.889221613  10.6.15.156 → 192.168.1.12 SSH 102 Server: Encrypted packet (len=36)
  279 1.889556669 192.168.1.12 → 10.6.15.156  SSH 150 Client: Encrypted packet (len=84)
  280 1.925048729  10.6.15.156 → 192.168.1.12 SSH 438 Server: Encrypted packet (len=372)
  281 1.968033858 192.168.1.12 → 10.6.15.156  TCP 66 54766 → 22 [ACK] Seq=12349 Ack=155977 Win=4866 Len=0 TSval=7720055 TSecr=14651539
  282 2.006137392  10.6.15.156 → 192.168.1.12 SSH 454 Server: Encrypted packet (len=388)
  283 2.006165759 192.168.1.12 → 10.6.15.156  TCP 66 54766 → 22 [ACK] Seq=12349 Ack=156365 Win=4866 Len=0 TSval=7720064 TSecr=14651558
  284 2.022491498  10.6.15.156 → 192.168.1.12 SSH 1514 Server: Encrypted packet (len=1448)
  285 2.022509680 192.168.1.12 → 10.6.15.156  TCP 66 54766 → 22 [ACK] Seq=12349 Ack=157813 Win=4866 Len=0 TSval=7720068 TSecr=14651562
  286 2.022612507  10.6.15.156 → 192.168.1.12 SSH 1514 Server: Encrypted packet (len=1448)
  287 2.022618073 192.168.1.12 → 10.6.15.156  TCP 66 54766 → 22 [ACK] Seq=12349 Ack=159261 Win=4866 Len=0 TSval=7720068 TSecr=14651562
  288 2.022773165  10.6.15.156 → 192.168.1.12 SSH 102 Server: Encrypted packet (len=36)
  289 2.022776339 192.168.1.12 → 10.6.15.156  TCP 66 54766 → 22 [ACK] Seq=12349 Ack=159297 Win=4866 Len=0 TSval=7720068 TSecr=14651562
  290 2.023511246 192.168.1.12 → 10.6.15.156  SSH 446 Client: Encrypted packet (len=380)
  291 2.048504850  10.6.15.156 → 192.168.1.12 SSH 222 Server: Encrypted packet (len=156)
  292 2.049233035 192.168.1.12 → 10.6.15.156  SSH 446 Client: Encrypted packet (len=380)
  293 2.094461653  10.6.15.156 → 192.168.1.12 TCP 66 22 → 54766 [ACK] Seq=159453 Ack=13109 Win=1452 Len=0 TSval=14651580 TSecr=7720075
  294 2.108307437  10.6.15.156 → 192.168.1.12 SSH 446 Server: Encrypted packet (len=380)
  295 2.152074050 192.168.1.12 → 10.6.15.156  TCP 66 54766 → 22 [ACK] Seq=13109 Ack=159833 Win=4866 Len=0 TSval=7720101 TSecr=14651583
  296 2.165968367  10.6.15.156 → 192.168.1.12 SSH 174 Server: Encrypted packet (len=108)
  297 2.166048149 192.168.1.12 → 10.6.15.156  TCP 66 54766 → 22 [ACK] Seq=13109 Ack=159941 Win=4866 Len=0 TSval=7720104 TSecr=14651599
  298 2.168825985 192.168.1.12 → 10.6.15.156  SSH 790 Client: Encrypted packet (len=724)
  299 2.173127398  10.6.15.156 → 192.168.1.12 TCP 66 22 → 54766 [ACK] Seq=159941 Ack=13833 Win=1452 Len=0 TSval=14651600 TSecr=7720105
  300 2.202227839  10.6.15.156 → 192.168.1.12 SSH 166 Server: Encrypted packet (len=100)
  301 2.244049505 192.168.1.12 → 10.6.15.156  TCP 66 54766 → 22 [ACK] Seq=13833 Ack=160041 Win=4866 Len=0 TSval=7720124 TSecr=14651608
  302 2.319091796  10.6.15.156 → 192.168.1.12 SSH 1494 Server: Encrypted packet (len=1428)
  303 2.319176730 192.168.1.12 → 10.6.15.156  TCP 66 54766 → 22 [ACK] Seq=13833 Ack=161469 Win=4866 Len=0 TSval=7720142 TSecr=14651637
  304 2.841872322 192.168.1.12 → 139.59.21.22 NTP 90 NTP Version 4, client
  305 3.764685025 192.168.1.12 → 10.6.15.156  SSH 862 Client: Encrypted packet (len=796)
  306 3.803840707  10.6.15.156 → 192.168.1.12 TCP 66 22 → 54766 [ACK] Seq=161469 Ack=14629 Win=1452 Len=0 TSval=14652009 TSecr=7720504
  307 3.984383798  10.6.15.156 → 192.168.1.12 SSH 454 Server: Encrypted packet (len=388)
  308 3.984409090 192.168.1.12 → 10.6.15.156  TCP 66 54766 → 22 [ACK] Seq=14629 Ack=161857 Win=4866 Len=0 TSval=7720559 TSecr=14652053
  309 4.762337380 192.168.1.12 → 10.6.15.156  SSH 862 Client: Encrypted packet (len=796)
  310 4.764579689  10.6.15.156 → 192.168.1.12 TCP 66 22 → 54766 [ACK] Seq=161857 Ack=15425 Win=1452 Len=0 TSval=14652249 TSecr=7720753
  311 4.764599251 192.168.1.12 → 10.6.15.156  SSH 102 Client: Encrypted packet (len=36)
  312 4.766016953  10.6.15.156 → 192.168.1.12 TCP 66 22 → 54766 [ACK] Seq=161857 Ack=15461 Win=1452 Len=0 TSval=14652249 TSecr=7720754
  313 4.981551994  10.6.15.156 → 192.168.1.12 SSH 454 Server: Encrypted packet (len=388)
  314 4.981569901 192.168.1.12 → 10.6.15.156  TCP 66 54766 → 22 [ACK] Seq=15461 Ack=162245 Win=4866 Len=0 TSval=7720808 TSecr=14652303
  315 4.981992682  10.6.15.156 → 192.168.1.12 SSH 102 Server: Encrypted packet (len=36)
  316 4.982001315 192.168.1.12 → 10.6.15.156  TCP 66 54766 → 22 [ACK] Seq=15461 Ack=162281 Win=4866 Len=0 TSval=7720808 TSecr=14652303
  317 4.982301824 192.168.1.12 → 10.6.15.156  SSH 190 Client: Encrypted packet (len=124)
  318 4.984759030  10.6.15.156 → 192.168.1.12 TCP 66 22 → 54766 [ACK] Seq=162281 Ack=15585 Win=1452 Len=0 TSval=14652304 TSecr=7720808
  319 4.984771005 192.168.1.12 → 10.6.15.156  SSH 862 Client: Encrypted packet (len=796)
  320 4.989115432  10.6.15.156 → 192.168.1.12 TCP 66 22 → 54766 [ACK] Seq=162281 Ack=16381 Win=1452 Len=0 TSval=14652305 TSecr=7720809
  321 5.200687866  10.6.15.156 → 192.168.1.12 SSH 182 Server: Encrypted packet (len=116)
  322 5.200930651 192.168.1.12 → 10.6.15.156  SSH 134 Client: Encrypted packet (len=68)
  323 5.205458823  10.6.15.156 → 192.168.1.12 TCP 66 22 → 54766 [ACK] Seq=162397 Ack=16449 Win=1452 Len=0 TSval=14652359 TSecr=7720863
  324 5.207416792  10.6.15.156 → 192.168.1.12 SSH 454 Server: Encrypted packet (len=388)
  325 5.248077538 192.168.1.12 → 10.6.15.156  TCP 66 54766 → 22 [ACK] Seq=16449 Ack=162785 Win=4866 Len=0 TSval=7720875 TSecr=14652359
  326 6.765132308 192.168.1.12 → 10.6.15.156  SSH 862 Client: Encrypted packet (len=796)
  327 6.807555014  10.6.15.156 → 192.168.1.12 TCP 66 22 → 54766 [ACK] Seq=162785 Ack=17245 Win=1452 Len=0 TSval=14652760 TSecr=7721254
  328 6.986554759  10.6.15.156 → 192.168.1.12 SSH 454 Server: Encrypted packet (len=388)
  329 6.986580313 192.168.1.12 → 10.6.15.156  TCP 66 54766 → 22 [ACK] Seq=17245 Ack=163173 Win=4866 Len=0 TSval=7721309 TSecr=14652803
  330 7.760800782 192.168.1.12 → 10.6.15.156  SSH 102 Client: Encrypted packet (len=36)
  331 7.762408816  10.6.15.156 → 192.168.1.12 TCP 66 22 → 54766 [ACK] Seq=163173 Ack=17281 Win=1452 Len=0 TSval=14652998 TSecr=7721503
  332 7.762423969 192.168.1.12 → 10.6.15.156  SSH 914 Client: Encrypted packet (len=848)
  333 7.764511442  10.6.15.156 → 192.168.1.12 TCP 66 22 → 54766 [ACK] Seq=163173 Ack=18129 Win=1452 Len=0 TSval=14652999 TSecr=7721503
  334 7.915652636  10.6.15.156 → 192.168.1.12 SSH 102 Server: Encrypted packet (len=36)
  335 7.915667789 192.168.1.12 → 10.6.15.156  TCP 66 54766 → 22 [ACK] Seq=18129 Ack=163209 Win=4866 Len=0 TSval=7721541 TSecr=14653037
  336 7.915976440 192.168.1.12 → 10.6.15.156  SSH 198 Client: Encrypted packet (len=132)
  337 7.917856266  10.6.15.156 → 192.168.1.12 TCP 66 22 → 54766 [ACK] Seq=163209 Ack=18261 Win=1452 Len=0 TSval=14653037 TSecr=7721541
  338 7.977037581  10.6.15.156 → 192.168.1.12 SSH 126 Server: Encrypted packet (len=60)
  339 7.977054704  10.6.15.156 → 192.168.1.12 SSH 138 Server: Encrypted packet (len=72)
  340 7.977112376 192.168.1.12 → 10.6.15.156  TCP 66 54766 → 22 [ACK] Seq=18261 Ack=163341 Win=4866 Len=0 TSval=7721557 TSecr=14653052
  341 7.977274613 192.168.1.12 → 10.6.15.156  SSH 102 Client: Encrypted packet (len=36)
  342 7.981382697  10.6.15.156 → 192.168.1.12 TCP 66 22 → 54766 [ACK] Seq=163341 Ack=18297 Win=1452 Len=0 TSval=14653052 TSecr=7721557
  343 7.981399499  10.6.15.156 → 192.168.1.12 SSH 454 Server: Encrypted packet (len=388)
  344 8.024050084 192.168.1.12 → 10.6.15.156  TCP 66 54766 → 22 [ACK] Seq=18297 Ack=163729 Win=4866 Len=0 TSval=7721569 TSecr=14653053
  345 8.069434659  10.6.15.156 → 192.168.1.12 SSH 246 Server: Encrypted packet (len=180)
  346 8.069461162 192.168.1.12 → 10.6.15.156  TCP 66 54766 → 22 [ACK] Seq=18297 Ack=163909 Win=4866 Len=0 TSval=7721580 TSecr=14653075
  347 8.069743062 192.168.1.12 → 10.6.15.156  SSH 134 Client: Encrypted packet (len=68)
  348 8.070778369 192.168.1.12 → 10.6.15.156  SSH 1514 Client: Encrypted packet (len=1448)
  349 8.071608326 192.168.1.12 → 10.6.15.156  SSH 470 Client: Encrypted packet (len=404)
  350 8.073443548  10.6.15.156 → 192.168.1.12 TCP 66 22 → 54766 [ACK] Seq=163909 Ack=20217 Win=1452 Len=0 TSval=14653076 TSecr=7721580
  351 8.228933395  10.6.15.156 → 192.168.1.12 SSH 502 Server: Encrypted packet (len=436)
  352 8.272074559 192.168.1.12 → 10.6.15.156  TCP 66 54766 → 22 [ACK] Seq=20217 Ack=164345 Win=4866 Len=0 TSval=7721631 TSecr=14653115
  353 9.348555768  10.6.15.156 → 192.168.1.12 SSH 102 Server: Encrypted packet (len=36)
  354 9.348581191 192.168.1.12 → 10.6.15.156  TCP 66 54766 → 22 [ACK] Seq=20217 Ack=164381 Win=4866 Len=0 TSval=7721900 TSecr=14653395
  355 9.684031259 192.168.1.12 → 23.58.43.27  TCP 66 47480 → 80 [ACK] Seq=1 Ack=1 Win=274 Len=0 TSval=7721984 TSecr=2209530966
  356 9.687231663  23.58.43.27 → 192.168.1.12 TCP 66 [TCP ACKed unseen segment] 80 → 47480 [ACK] Seq=1 Ack=2 Win=939 Len=0 TSval=2209576022 TSecr=7665606
  357 9.702439541  10.6.15.156 → 192.168.1.12 SSH 102 Server: Encrypted packet (len=36)
  358 9.702452135 192.168.1.12 → 10.6.15.156  TCP 66 54766 → 22 [ACK] Seq=20217 Ack=164417 Win=4866 Len=0 TSval=7721988 TSecr=14653483
  359 9.765928852 192.168.1.12 → 10.6.15.156  SSH 102 Client: Encrypted packet (len=36)
  360 9.807521430  10.6.15.156 → 192.168.1.12 TCP 66 22 → 54766 [ACK] Seq=164417 Ack=20253 Win=1452 Len=0 TSval=14653510 TSecr=7722004
  361 9.807541753 192.168.1.12 → 10.6.15.156  SSH 1150 Client: Encrypted packet (len=1084)
  362 9.810207896  10.6.15.156 → 192.168.1.12 TCP 66 22 → 54766 [ACK] Seq=164417 Ack=21337 Win=1452 Len=0 TSval=14653510 TSecr=7722014
  363 9.810328484  10.6.15.156 → 192.168.1.12 SSH 138 Server: Encrypted packet (len=72)
  364 9.810345592 192.168.1.12 → 10.6.15.156  TCP 66 54766 → 22 [ACK] Seq=21337 Ack=164489 Win=4866 Len=0 TSval=7722015 TSecr=14653510
  365 9.812085835  10.6.15.156 → 192.168.1.12 SSH 134 Server: Encrypted packet (len=68)
  366 9.812104924 192.168.1.12 → 10.6.15.156  TCP 66 54766 → 22 [ACK] Seq=21337 Ack=164557 Win=4866 Len=0 TSval=7722016 TSecr=14653511
  367 9.812122499  10.6.15.156 → 192.168.1.12 SSH 138 Server: Encrypted packet (len=72)
  368 9.812128260 192.168.1.12 → 10.6.15.156  TCP 66 54766 → 22 [ACK] Seq=21337 Ack=164629 Win=4866 Len=0 TSval=7722016 TSecr=14653511
  369 9.812332288 192.168.1.12 → 10.6.15.156  SSH 102 Client: Encrypted packet (len=36)
  370 9.853128721  10.6.15.156 → 192.168.1.12 TCP 66 22 → 54766 [ACK] Seq=164629 Ack=21373 Win=1452 Len=0 TSval=14653521 TSecr=7722016
  371 9.879948844  10.6.15.156 → 192.168.1.12 SSH 282 Server: Encrypted packet (len=216)
  372 9.880292747 192.168.1.12 → 10.6.15.156  SSH 174 Client: Encrypted packet (len=108)
  373 9.881889026  10.6.15.156 → 192.168.1.12 TCP 66 22 → 54766 [ACK] Seq=164845 Ack=21481 Win=1452 Len=0 TSval=14653528 TSecr=7722033
  374 9.919883800  10.6.15.156 → 192.168.1.12 SSH 138 Server: Encrypted packet (len=72)
  375 9.920097147 192.168.1.12 → 10.6.15.156  SSH 102 Client: Encrypted packet (len=36)
  376 9.924032875  10.6.15.156 → 192.168.1.12 TCP 66 22 → 54766 [ACK] Seq=164917 Ack=21517 Win=1452 Len=0 TSval=14653538 TSecr=7722043
  377 10.026098600  10.6.15.156 → 192.168.1.12 SSH 454 Server: Encrypted packet (len=388)
  378 10.068053257 192.168.1.12 → 10.6.15.156  TCP 66 54766 → 22 [ACK] Seq=21517 Ack=165305 Win=4866 Len=0 TSval=7722080 TSecr=14653564
  379 10.763696393 192.168.1.12 → 10.6.15.156  SSH 102 Client: Encrypted packet (len=36)
  380 10.765157114  10.6.15.156 → 192.168.1.12 TCP 66 22 → 54766 [ACK] Seq=165305 Ack=21553 Win=1452 Len=0 TSval=14653749 TSecr=7722253
  381 10.765167298 192.168.1.12 → 10.6.15.156  SSH 934 Client: Encrypted packet (len=868)
  382 10.767555932  10.6.15.156 → 192.168.1.12 TCP 66 22 → 54766 [ACK] Seq=165305 Ack=22421 Win=1452 Len=0 TSval=14653750 TSecr=7722254
  383 10.944749423  10.6.15.156 → 192.168.1.12 SSH 138 Server: Encrypted packet (len=72)
  384 10.944767772 192.168.1.12 → 10.6.15.156  TCP 66 54766 → 22 [ACK] Seq=22421 Ack=165377 Win=4866 Len=0 TSval=7722299 TSecr=14653794
  385 10.945004459 192.168.1.12 → 10.6.15.156  SSH 102 Client: Encrypted packet (len=36)
  386 10.968285086  10.6.15.156 → 192.168.1.12 SSH 138 Server: Encrypted packet (len=72)
  387 10.968496340 192.168.1.12 → 10.6.15.156  SSH 102 Client: Encrypted packet (len=36)
  388 10.983004479  10.6.15.156 → 192.168.1.12 SSH 454 Server: Encrypted packet (len=388)
  389 10.984750847  10.6.15.156 → 192.168.1.12 SSH 102 Server: Encrypted packet (len=36)
  390 10.984821134 192.168.1.12 → 10.6.15.156  TCP 66 54766 → 22 [ACK] Seq=22493 Ack=165873 Win=4866 Len=0 TSval=7722309 TSecr=14653803
  391 10.985077497 192.168.1.12 → 10.6.15.156  SSH 862 Client: Encrypted packet (len=796)
  392 10.993449579  10.6.15.156 → 192.168.1.12 TCP 78 [TCP Dup ACK 382#1] 22 → 54766 [ACK] Seq=165873 Ack=22421 Win=1452 Len=0 TSval=14653806 TSecr=7722299 SLE=22457 SRE=22493
  393 10.993470240 192.168.1.12 → 10.6.15.156  SSH 150 Client: Encrypted packet (len=84)
  394 10.993484082  10.6.15.156 → 192.168.1.12 TCP 78 [TCP Dup ACK 382#2] 22 → 54766 [ACK] Seq=165873 Ack=22421 Win=1452 Len=0 TSval=14653806 TSecr=7722299 SLE=22457 SRE=23289
  395 10.994961775  10.6.15.156 → 192.168.1.12 TCP 78 [TCP Dup ACK 382#3] 22 → 54766 [ACK] Seq=165873 Ack=22421 Win=1452 Len=0 TSval=14653806 TSecr=7722299 SLE=22457 SRE=23373
  396 10.994981554 192.168.1.12 → 10.6.15.156  SSH 102 Client: [TCP Fast Retransmission] , Encrypted packet (len=36)
  397 10.996348299  10.6.15.156 → 192.168.1.12 TCP 66 22 → 54766 [ACK] Seq=165873 Ack=23373 Win=1450 Len=0 TSval=14653807 TSecr=7722311
  398 11.212264000  10.6.15.156 → 192.168.1.12 SSH 454 Server: Encrypted packet (len=388)
  399 11.214616849  10.6.15.156 → 192.168.1.12 SSH 182 Server: Encrypted packet (len=116)
  400 11.214689002 192.168.1.12 → 10.6.15.156  TCP 66 54766 → 22 [ACK] Seq=23373 Ack=166377 Win=4866 Len=0 TSval=7722366 TSecr=14653861
  401 11.214926437 192.168.1.12 → 10.6.15.156  SSH 134 Client: Encrypted packet (len=68)
  402 11.216448373  10.6.15.156 → 192.168.1.12 TCP 66 22 → 54766 [ACK] Seq=166377 Ack=23441 Win=1452 Len=0 TSval=14653862 TSecr=7722366
  403 11.576014236  10.6.15.156 → 192.168.1.12 SSH 138 Server: Encrypted packet (len=72)
  404 11.576237869 192.168.1.12 → 10.6.15.156  SSH 102 Client: Encrypted packet (len=36)
  405 11.577667849  10.6.15.156 → 192.168.1.12 TCP 66 22 → 54766 [ACK] Seq=166449 Ack=23477 Win=1452 Len=0 TSval=14653952 TSecr=7722457
  406 11.609675029  10.6.15.156 → 192.168.1.12 SSH 102 Server: Encrypted packet (len=36)
  407 11.652077081 192.168.1.12 → 10.6.15.156  TCP 66 54766 → 22 [ACK] Seq=23477 Ack=166485 Win=4866 Len=0 TSval=7722476 TSecr=14653960
  408 11.732047869 192.168.1.12 → 23.58.43.27  TCP 66 47482 → 80 [ACK] Seq=1 Ack=1 Win=319 Len=0 TSval=7722496 TSecr=2209533014
  409 11.737063171  23.58.43.27 → 192.168.1.12 TCP 66 [TCP ACKed unseen segment] 80 → 47482 [ACK] Seq=1 Ack=2 Win=972 Len=0 TSval=2209578070 TSecr=7666041
  410 12.494483238  10.6.15.156 → 192.168.1.12 SSH 102 Server: Encrypted packet (len=36)
  411 12.494503399 192.168.1.12 → 10.6.15.156  TCP 66 54766 → 22 [ACK] Seq=23477 Ack=166521 Win=4866 Len=0 TSval=7722686 TSecr=14654181
  412 12.762673519 192.168.1.12 → 10.6.15.156  SSH 102 Client: Encrypted packet (len=36)
  413 12.763478199 192.168.1.12 → 10.6.15.156  SSH 1514 Client: Encrypted packet (len=1448)
  414 12.764288403 192.168.1.12 → 10.6.15.156  SSH 1410 Client: Encrypted packet (len=1344)
  415 12.766580782  10.6.15.156 → 192.168.1.12 TCP 66 22 → 54766 [ACK] Seq=166521 Ack=24961 Win=1452 Len=0 TSval=14654249 TSecr=7722753
  416 12.766724447  10.6.15.156 → 192.168.1.12 SSH 138 Server: Encrypted packet (len=72)
  417 12.766730078 192.168.1.12 → 10.6.15.156  TCP 66 54766 → 22 [ACK] Seq=26305 Ack=166593 Win=4866 Len=0 TSval=7722754 TSecr=14654249
  418 12.912060492  10.6.15.156 → 192.168.1.12 SSH 138 Server: Encrypted packet (len=72)
  419 12.912086229 192.168.1.12 → 10.6.15.156  TCP 66 54766 → 22 [ACK] Seq=26305 Ack=166665 Win=4866 Len=0 TSval=7722791 TSecr=14654286
  420 12.912307360 192.168.1.12 → 10.6.15.156  SSH 102 Client: Encrypted packet (len=36)
  421 12.921134413  10.6.15.156 → 192.168.1.12 SSH 502 Server: Encrypted packet (len=436)
  422 12.964073889 192.168.1.12 → 10.6.15.156  TCP 66 54766 → 22 [ACK] Seq=26341 Ack=167101 Win=4866 Len=0 TSval=7722804 TSecr=14654288
  423 12.984440708  10.6.15.156 → 192.168.1.12 SSH 454 Server: Encrypted packet (len=388)
  424 12.984464233 192.168.1.12 → 10.6.15.156  TCP 66 54766 → 22 [ACK] Seq=26341 Ack=167489 Win=4866 Len=0 TSval=7722809 TSecr=14654303
  425 13.389608734  10.6.15.156 → 192.168.1.12 SSH 102 Server: Encrypted packet (len=36)
  426 13.389633400 192.168.1.12 → 10.6.15.156  TCP 66 54766 → 22 [ACK] Seq=26341 Ack=167525 Win=4866 Len=0 TSval=7722910 TSecr=14654405
  427 13.767364912 192.168.1.12 → 10.6.15.156  SSH 138 Client: Encrypted packet (len=72)
  428 13.767902001 192.168.1.12 → 10.6.15.156  SSH 1514 Client: Encrypted packet (len=1448)
  429 13.768777829 192.168.1.12 → 10.6.15.156  SSH 1266 Client: Encrypted packet (len=1200)
  430 13.769618141  10.6.15.156 → 192.168.1.12 SSH 102 Server: Encrypted packet (len=36)
  431 13.769646317 192.168.1.12 → 10.6.15.156  TCP 66 54766 → 22 [ACK] Seq=29061 Ack=167561 Win=4866 Len=0 TSval=7723005 TSecr=14654500
  432 13.771299649  10.6.15.156 → 192.168.1.12 TCP 66 22 → 54766 [ACK] Seq=167561 Ack=29061 Win=1452 Len=0 TSval=14654500 TSecr=7723004
  433 13.941128093  10.6.15.156 → 192.168.1.12 SSH 502 Server: Encrypted packet (len=436)
  434 13.941145192 192.168.1.12 → 10.6.15.156  TCP 66 54766 → 22 [ACK] Seq=29061 Ack=167997 Win=4866 Len=0 TSval=7723048 TSecr=14654542
  435 13.991570045  10.6.15.156 → 192.168.1.12 SSH 454 Server: Encrypted packet (len=388)
  436 13.991592433 192.168.1.12 → 10.6.15.156  TCP 66 54766 → 22 [ACK] Seq=29061 Ack=168385 Win=4866 Len=0 TSval=7723060 TSecr=14654554
  437 14.841901631 192.168.1.12 → 52.66.76.135 NTP 90 NTP Version 4, client
  438 15.516917331 192.168.1.12 → 10.6.15.156  SSH 1514 Client: Encrypted packet (len=1448)
  439 15.563322752  10.6.15.156 → 192.168.1.12 TCP 66 22 → 54766 [ACK] Seq=168385 Ack=30509 Win=1452 Len=0 TSval=14654948 TSecr=7723442
  440 15.563351387 192.168.1.12 → 10.6.15.156  SSH 158 Client: Encrypted packet (len=92)
  441 15.564966310  10.6.15.156 → 192.168.1.12 TCP 66 22 → 54766 [ACK] Seq=168385 Ack=30601 Win=1452 Len=0 TSval=14654949 TSecr=7723453
  442 15.715845713  10.6.15.156 → 192.168.1.12 SSH 670 Server: Encrypted packet (len=604)
  443 15.715866145 192.168.1.12 → 10.6.15.156  TCP 66 54766 → 22 [ACK] Seq=30601 Ack=168989 Win=4866 Len=0 TSval=7723491 TSecr=14654987
  444 15.757908651 192.168.1.12 → 10.6.15.156  SSH 862 Client: Encrypted packet (len=796)
  445 15.764037046  10.6.15.156 → 192.168.1.12 TCP 66 22 → 54766 [ACK] Seq=168989 Ack=31397 Win=1452 Len=0 TSval=14654999 TSecr=7723502
  446 15.979934272  10.6.15.156 → 192.168.1.12 SSH 454 Server: Encrypted packet (len=388)
  447 15.979961025 192.168.1.12 → 10.6.15.156  TCP 66 54766 → 22 [ACK] Seq=31397 Ack=169377 Win=4866 Len=0 TSval=7723557 TSecr=14655053
  448 16.761602113 192.168.1.12 → 10.6.15.156  SSH 862 Client: Encrypted packet (len=796)
  449 16.762340638 192.168.1.12 → 10.6.15.156  SSH 1514 Client: Encrypted packet (len=1448)
  450 16.768547133 192.168.1.12 → 10.6.15.156  SSH 1310 Client: Encrypted packet (len=1244)
  451 16.779132629  10.6.15.156 → 192.168.1.12 TCP 66 22 → 54766 [ACK] Seq=169377 Ack=32193 Win=1452 Len=0 TSval=14655250 TSecr=7723753
  452 16.779154332  10.6.15.156 → 192.168.1.12 TCP 66 22 → 54766 [ACK] Seq=169377 Ack=33641 Win=1452 Len=0 TSval=14655250 TSecr=7723753
  453 16.779158537  10.6.15.156 → 192.168.1.12 TCP 66 22 → 54766 [ACK] Seq=169377 Ack=34885 Win=1452 Len=0 TSval=14655251 TSecr=7723755
  454 16.928335650  10.6.15.156 → 192.168.1.12 SSH 502 Server: Encrypted packet (len=436)
  455 16.928352568 192.168.1.12 → 10.6.15.156  TCP 66 54766 → 22 [ACK] Seq=34885 Ack=169813 Win=4866 Len=0 TSval=7723795 TSecr=14655290
  456 16.984734481  10.6.15.156 → 192.168.1.12 SSH 454 Server: Encrypted packet (len=388)
  457 16.984761216 192.168.1.12 → 10.6.15.156  TCP 66 54766 → 22 [ACK] Seq=34885 Ack=170201 Win=4866 Len=0 TSval=7723809 TSecr=14655304
  458 16.991043284  10.6.15.156 → 192.168.1.12 SSH 454 Server: Encrypted packet (len=388)
  459 16.991059664 192.168.1.12 → 10.6.15.156  TCP 66 54766 → 22 [ACK] Seq=34885 Ack=170589 Win=4866 Len=0 TSval=7723810 TSecr=14655305
  460 18.768723453 192.168.1.12 → 10.6.15.156  SSH 862 Client: Encrypted packet (len=796)
  461 18.770889202  10.6.15.156 → 192.168.1.12 TCP 66 22 → 54766 [ACK] Seq=170589 Ack=35681 Win=1452 Len=0 TSval=14655750 TSecr=7724255
  462 18.989792190  10.6.15.156 → 192.168.1.12 SSH 454 Server: Encrypted packet (len=388)
  463 18.989817917 192.168.1.12 → 10.6.15.156  TCP 66 54766 → 22 [ACK] Seq=35681 Ack=170977 Win=4866 Len=0 TSval=7724310 TSecr=14655805
  464 19.759558643 192.168.1.12 → 10.6.15.156  SSH 862 Client: Encrypted packet (len=796)
  465 19.761914815  10.6.15.156 → 192.168.1.12 TCP 66 22 → 54766 [ACK] Seq=170977 Ack=36477 Win=1452 Len=0 TSval=14655998 TSecr=7724502
  466 19.981694531  10.6.15.156 → 192.168.1.12 SSH 454 Server: Encrypted packet (len=388)
  467 19.981717756 192.168.1.12 → 10.6.15.156  TCP 66 54766 → 22 [ACK] Seq=36477 Ack=171365 Win=4866 Len=0 TSval=7724558 TSecr=14656053
  468 21.764521270 192.168.1.12 → 10.6.15.156  SSH 862 Client: Encrypted packet (len=796)
  469 21.767077851  10.6.15.156 → 192.168.1.12 TCP 66 22 → 54766 [ACK] Seq=171365 Ack=37273 Win=1452 Len=0 TSval=14656499 TSecr=7725004
  470 21.841903431 192.168.1.12 → 139.59.50.38 NTP 90 NTP Version 4, client
  471 21.987397518  10.6.15.156 → 192.168.1.12 SSH 454 Server: Encrypted packet (len=388)
  472 21.987422329 192.168.1.12 → 10.6.15.156  TCP 66 54766 → 22 [ACK] Seq=37273 Ack=171753 Win=4866 Len=0 TSval=7725059 TSecr=14656554
  473 22.768374008 192.168.1.12 → 10.6.15.156  SSH 862 Client: Encrypted packet (len=796)
  474 22.770483199  10.6.15.156 → 192.168.1.12 TCP 66 22 → 54766 [ACK] Seq=171753 Ack=38069 Win=1452 Len=0 TSval=14656750 TSecr=7725255
  475 22.770490929 192.168.1.12 → 10.6.15.156  SSH 862 Client: Encrypted packet (len=796)
  476 22.772483083  10.6.15.156 → 192.168.1.12 TCP 66 22 → 54766 [ACK] Seq=171753 Ack=38865 Win=1452 Len=0 TSval=14656751 TSecr=7725255
  477 22.988413219  10.6.15.156 → 192.168.1.12 SSH 454 Server: Encrypted packet (len=388)
  478 22.988445322 192.168.1.12 → 10.6.15.156  TCP 66 54766 → 22 [ACK] Seq=38865 Ack=172141 Win=4866 Len=0 TSval=7725310 TSecr=14656805
  479 22.989423598  10.6.15.156 → 192.168.1.12 SSH 454 Server: Encrypted packet (len=388)
  480 22.989436487 192.168.1.12 → 10.6.15.156  TCP 66 54766 → 22 [ACK] Seq=38865 Ack=172529 Win=4866 Len=0 TSval=7725310 TSecr=14656805
  481 24.760900597 192.168.1.12 → 10.6.15.156  SSH 862 Client: Encrypted packet (len=796)
  482 24.763176115  10.6.15.156 → 192.168.1.12 TCP 66 22 → 54766 [ACK] Seq=172529 Ack=39661 Win=1452 Len=0 TSval=14657249 TSecr=7725753
  483 24.990023851  10.6.15.156 → 192.168.1.12 SSH 454 Server: Encrypted packet (len=388)
  484 24.990047976 192.168.1.12 → 10.6.15.156  TCP 66 54766 → 22 [ACK] Seq=39661 Ack=172917 Win=4866 Len=0 TSval=7725810 TSecr=14657305
  485 25.765502704 192.168.1.12 → 10.6.15.156  SSH 1514 Client: Encrypted packet (len=1448)
  486 25.765827147 192.168.1.12 → 10.6.15.156  SSH 1514 Client: Encrypted packet (len=1448)
  487 25.768430497 192.168.1.12 → 10.6.15.156  SSH 294 Client: Encrypted packet (len=228)
  488 25.769312993  10.6.15.156 → 192.168.1.12 TCP 66 22 → 54766 [ACK] Seq=172917 Ack=41109 Win=1452 Len=0 TSval=14657500 TSecr=7726004
  489 25.770121408  10.6.15.156 → 192.168.1.12 TCP 66 22 → 54766 [ACK] Seq=172917 Ack=42557 Win=1452 Len=0 TSval=14657500 TSecr=7726004
  490 25.770500215  10.6.15.156 → 192.168.1.12 TCP 66 22 → 54766 [ACK] Seq=172917 Ack=42785 Win=1452 Len=0 TSval=14657500 TSecr=7726005
  491 25.930333080  10.6.15.156 → 192.168.1.12 SSH 502 Server: Encrypted packet (len=436)
  492 25.930352655 192.168.1.12 → 10.6.15.156  TCP 66 54766 → 22 [ACK] Seq=42785 Ack=173353 Win=4866 Len=0 TSval=7726045 TSecr=14657540
  493 25.946516931  10.6.15.156 → 192.168.1.12 SSH 142 Server: Encrypted packet (len=76)
  494 25.946535596 192.168.1.12 → 10.6.15.156  TCP 66 54766 → 22 [ACK] Seq=42785 Ack=173429 Win=4866 Len=0 TSval=7726049 TSecr=14657544
  495 25.971103742  10.6.15.156 → 192.168.1.12 SSH 438 Server: Encrypted packet (len=372)
  496 25.971120749 192.168.1.12 → 10.6.15.156  TCP 66 54766 → 22 [ACK] Seq=42785 Ack=173801 Win=4866 Len=0 TSval=7726055 TSecr=14657550
  497 25.989130404  10.6.15.156 → 192.168.1.12 SSH 454 Server: Encrypted packet (len=388)
  498 25.989151252 192.168.1.12 → 10.6.15.156  TCP 66 54766 → 22 [ACK] Seq=42785 Ack=174189 Win=4866 Len=0 TSval=7726060 TSecr=14657555
  499 26.400588470 10.22.19.111 → 224.0.0.252  LLMNR 64 Standard query 0x1e34 A wpad
  500 26.811566496 10.22.19.111 → 224.0.0.252  LLMNR 64 Standard query 0x1e34 A wpad
  501 27.319463249  10.22.17.65 → 224.0.0.252  LLMNR 64 Standard query 0x3580 A wpad
  502 27.319529325  10.22.17.65 → 224.0.0.252  LLMNR 64 Standard query 0x6021 AAAA wpad
  503 27.723270716  10.22.17.65 → 224.0.0.252  LLMNR 64 Standard query 0x6021 AAAA wpad
  504 27.723404037  10.22.17.65 → 224.0.0.252  LLMNR 64 Standard query 0x3580 A wpad
  505 27.761181485 192.168.1.12 → 10.6.15.156  SSH 862 Client: Encrypted packet (len=796)
  506 27.765875395  10.6.15.156 → 192.168.1.12 TCP 66 22 → 54766 [ACK] Seq=174189 Ack=43581 Win=1452 Len=0 TSval=14657999 TSecr=7726503
  507 27.982094756  10.6.15.156 → 192.168.1.12 SSH 454 Server: Encrypted packet (len=388)
  508 27.982118990 192.168.1.12 → 10.6.15.156  TCP 66 54766 → 22 [ACK] Seq=43581 Ack=174577 Win=4866 Len=0 TSval=7726558 TSecr=14658053
  509 28.765601397 192.168.1.12 → 10.6.15.156  SSH 862 Client: Encrypted packet (len=796)
  510 28.768461784  10.6.15.156 → 192.168.1.12 TCP 66 22 → 54766 [ACK] Seq=174577 Ack=44377 Win=1452 Len=0 TSval=14658250 TSecr=7726754
  511 28.768480544 192.168.1.12 → 10.6.15.156  SSH 862 Client: Encrypted packet (len=796)
  512 28.771953237  10.6.15.156 → 192.168.1.12 TCP 66 22 → 54766 [ACK] Seq=174577 Ack=45173 Win=1452 Len=0 TSval=14658251 TSecr=7726755
  513 28.987030629  10.6.15.156 → 192.168.1.12 SSH 454 Server: Encrypted packet (len=388)
  514 28.987053253 192.168.1.12 → 10.6.15.156  TCP 66 54766 → 22 [ACK] Seq=45173 Ack=174965 Win=4866 Len=0 TSval=7726809 TSecr=14658304
  515 28.987620936  10.6.15.156 → 192.168.1.12 SSH 454 Server: Encrypted packet (len=388)
  516 28.987632513 192.168.1.12 → 10.6.15.156  TCP 66 54766 → 22 [ACK] Seq=45173 Ack=175353 Win=4866 Len=0 TSval=7726809 TSecr=14658305
  517 30.763352156 192.168.1.12 → 10.6.15.156  SSH 862 Client: Encrypted packet (len=796)
  518 30.771122472  10.6.15.156 → 192.168.1.12 TCP 66 22 → 54766 [ACK] Seq=175353 Ack=45969 Win=1452 Len=0 TSval=14658751 TSecr=7727253
  519 30.987276508  10.6.15.156 → 192.168.1.12 SSH 454 Server: Encrypted packet (len=388)
  520 30.987303227 192.168.1.12 → 10.6.15.156  TCP 66 54766 → 22 [ACK] Seq=45969 Ack=175741 Win=4866 Len=0 TSval=7727309 TSecr=14658804
  521 31.760560887 192.168.1.12 → 10.6.15.156  SSH 862 Client: Encrypted packet (len=796)
  522 31.762726168  10.6.15.156 → 192.168.1.12 TCP 66 22 → 54766 [ACK] Seq=175741 Ack=46765 Win=1452 Len=0 TSval=14658998 TSecr=7727503
  523 31.978378350  10.6.15.156 → 192.168.1.12 SSH 454 Server: Encrypted packet (len=388)
  524 31.978404271 192.168.1.12 → 10.6.15.156  TCP 66 54766 → 22 [ACK] Seq=46765 Ack=176129 Win=4866 Len=0 TSval=7727557 TSecr=14659052
  525 33.766260743 192.168.1.12 → 10.6.15.156  SSH 862 Client: Encrypted packet (len=796)
  526 33.768303353  10.6.15.156 → 192.168.1.12 TCP 66 22 → 54766 [ACK] Seq=176129 Ack=47561 Win=1452 Len=0 TSval=14659500 TSecr=7728004
  527 33.983814564  10.6.15.156 → 192.168.1.12 SSH 454 Server: Encrypted packet (len=388)
  528 33.983836373 192.168.1.12 → 10.6.15.156  TCP 66 54766 → 22 [ACK] Seq=47561 Ack=176517 Win=4866 Len=0 TSval=7728058 TSecr=14659554
