    1 0.000000000 192.168.1.12 → 10.6.15.156  SSH 126 Client: Encrypted packet (len=60)
    2 0.002199959  10.6.15.156 → 192.168.1.12 TCP 66 22 → 54766 [ACK] Seq=1 Ack=61 Win=1452 Len=0 TSval=14498039 TSecr=7566546
    3 0.061477111  10.6.15.156 → 192.168.1.12 SSH 842 Server: Encrypted packet (len=776)
    4 0.061851946  10.6.15.156 → 192.168.1.12 SSH 334 Server: Encrypted packet (len=268)
    5 0.061891788 192.168.1.12 → 10.6.15.156  TCP 66 54766 → 22 [ACK] Seq=61 Ack=1045 Win=4866 Len=0 TSval=7566561 TSecr=14498054
    6 0.062419380  10.6.15.156 → 192.168.1.12 SSH 454 Server: Encrypted packet (len=388)
    7 0.063374942  10.6.15.156 → 192.168.1.12 SSH 454 Server: Encrypted packet (len=388)
    8 0.063440535 192.168.1.12 → 10.6.15.156  TCP 66 54766 → 22 [ACK] Seq=61 Ack=1821 Win=4866 Len=0 TSval=7566562 TSecr=14498054
    9 0.087588848  10.6.15.156 → 192.168.1.12 SSH 1514 Server: Encrypted packet (len=1448)
   10 0.088473824  10.6.15.156 → 192.168.1.12 SSH 734 Server: Encrypted packet (len=668)
   11 0.088495815 192.168.1.12 → 10.6.15.156  TCP 66 54766 → 22 [ACK] Seq=61 Ack=3937 Win=4866 Len=0 TSval=7566568 TSecr=14498061
   12 0.090017224 192.168.1.12 → 10.6.15.156  SSH 214 Client: Encrypted packet (len=148)
   13 0.091617149  10.6.15.156 → 192.168.1.12 TCP 66 22 → 54766 [ACK] Seq=3937 Ack=209 Win=1452 Len=0 TSval=14498062 TSecr=7566568
   14 0.091840747 192.168.1.12 → 10.6.15.156  SSH 126 Client: Encrypted packet (len=60)
   15 0.093596303  10.6.15.156 → 192.168.1.12 TCP 66 22 → 54766 [ACK] Seq=3937 Ack=269 Win=1452 Len=0 TSval=14498062 TSecr=7566569
   16 0.157790097 192.168.1.12 → 10.6.15.156  SSH 110 Client: Encrypted packet (len=44)
   17 0.159198577  10.6.15.156 → 192.168.1.12 TCP 66 22 → 54766 [ACK] Seq=3937 Ack=313 Win=1452 Len=0 TSval=14498079 TSecr=7566585
   18 0.162500167  10.6.15.156 → 192.168.1.12 SSH 110 Server: Encrypted packet (len=44)
   19 0.163042967 192.168.1.12 → 10.6.15.156  SSH 206 Client: Encrypted packet (len=140)
   20 0.202595527  10.6.15.156 → 192.168.1.12 TCP 66 22 → 54766 [ACK] Seq=3981 Ack=453 Win=1452 Len=0 TSval=14498090 TSecr=7566586
   21 0.218308052  10.6.15.156 → 192.168.1.12 SSH 102 Server: Encrypted packet (len=36)
   22 0.218689285 192.168.1.12 → 10.6.15.156  SSH 414 Client: Encrypted packet (len=348)
   23 0.220639569  10.6.15.156 → 192.168.1.12 TCP 66 22 → 54766 [ACK] Seq=4017 Ack=801 Win=1452 Len=0 TSval=14498094 TSecr=7566600
   24 0.235363933  10.6.15.156 → 192.168.1.12 SSH 1514 Server: Encrypted packet (len=1448)
   25 0.236197969  10.6.15.156 → 192.168.1.12 SSH 1190 Server: Encrypted packet (len=1124)
   26 0.236207721 192.168.1.12 → 10.6.15.156  TCP 66 54766 → 22 [ACK] Seq=801 Ack=6589 Win=4866 Len=0 TSval=7566605 TSecr=14498098
   27 0.236842599 192.168.1.12 → 10.6.15.156  SSH 454 Client: Encrypted packet (len=388)
   28 0.257139218  10.6.15.156 → 192.168.1.12 SSH 102 Server: Encrypted packet (len=36)
   29 0.257164582 192.168.1.12 → 10.6.15.156  SSH 730 Client: Encrypted packet (len=664)
   30 0.257687498 192.168.1.12 → 10.6.15.156  SSH 366 Client: Encrypted packet (len=300)
   31 0.261263022  10.6.15.156 → 192.168.1.12 TCP 66 22 → 54766 [ACK] Seq=6625 Ack=2153 Win=1452 Len=0 TSval=14498104 TSecr=7566610
   32 0.291210283 192.168.1.12 → 10.6.15.156  SSH 526 Client: Encrypted packet (len=460)
   33 0.291652931 192.168.1.12 → 10.6.15.156  SSH 478 Client: Encrypted packet (len=412)
   34 0.292056905 192.168.1.12 → 10.6.15.156  SSH 494 Client: Encrypted packet (len=428)
   35 0.293735659  10.6.15.156 → 192.168.1.12 TCP 66 22 → 54766 [ACK] Seq=6625 Ack=3025 Win=1452 Len=0 TSval=14498112 TSecr=7566618
   36 0.311915898  10.6.15.156 → 192.168.1.12 SSH 174 Server: Encrypted packet (len=108)
   37 0.314727422 192.168.1.12 → 10.6.15.156  SSH 710 Client: Encrypted packet (len=644)
   38 0.354244191  10.6.15.156 → 192.168.1.12 TCP 66 22 → 54766 [ACK] Seq=6733 Ack=4097 Win=1452 Len=0 TSval=14498128 TSecr=7566624
   39 0.356149859  10.6.15.156 → 192.168.1.12 SSH 214 Server: Encrypted packet (len=148)
   40 0.356648785 192.168.1.12 → 10.6.15.156  SSH 134 Client: Encrypted packet (len=68)
   41 0.359241460  10.6.15.156 → 192.168.1.12 TCP 66 22 → 54766 [ACK] Seq=6881 Ack=4165 Win=1452 Len=0 TSval=14498129 TSecr=7566635
   42 0.359255566 192.168.1.12 → 10.6.15.156  SSH 542 Client: Encrypted packet (len=476)
   43 0.363917641  10.6.15.156 → 192.168.1.12 TCP 66 22 → 54766 [ACK] Seq=6881 Ack=4641 Win=1452 Len=0 TSval=14498129 TSecr=7566635
   44 0.365837911  10.6.15.156 → 192.168.1.12 SSH 142 Server: Encrypted packet (len=76)
   45 0.370053619  10.6.15.156 → 192.168.1.12 SSH 334 Server: Encrypted packet (len=268)
   46 0.370120376 192.168.1.12 → 10.6.15.156  TCP 66 54766 → 22 [ACK] Seq=4641 Ack=7225 Win=4866 Len=0 TSval=7566638 TSecr=14498130
   47 0.390152927  10.6.15.156 → 192.168.1.12 SSH 470 Server: Encrypted packet (len=404)
   48 0.398682022  10.6.15.156 → 192.168.1.12 SSH 870 Server: Encrypted packet (len=804)
   49 0.398743610 192.168.1.12 → 10.6.15.156  TCP 66 54766 → 22 [ACK] Seq=4641 Ack=8433 Win=4866 Len=0 TSval=7566645 TSecr=14498136
   50 0.399165296  10.6.15.156 → 192.168.1.12 SSH 326 Server: Encrypted packet (len=260)
   51 0.399189759  10.6.15.156 → 192.168.1.12 SSH 198 Server: Encrypted packet (len=132)
   52 0.399231999 192.168.1.12 → 10.6.15.156  TCP 66 54766 → 22 [ACK] Seq=4641 Ack=8825 Win=4866 Len=0 TSval=7566645 TSecr=14498138
   53 0.399395371 192.168.1.12 → 10.6.15.156  SSH 142 Client: Encrypted packet (len=76)
   54 0.437886573  10.6.15.156 → 192.168.1.12 TCP 66 22 → 54766 [ACK] Seq=8825 Ack=4717 Win=1452 Len=0 TSval=14498149 TSecr=7566646
   55 0.442209375  10.6.15.156 → 192.168.1.12 SSH 1502 Server: Encrypted packet (len=1436)
   56 0.443090051 192.168.1.12 → 10.6.15.156  SSH 206 Client: Encrypted packet (len=140)
   57 0.444809070  10.6.15.156 → 192.168.1.12 TCP 66 22 → 54766 [ACK] Seq=10261 Ack=4857 Win=1452 Len=0 TSval=14498150 TSecr=7566656
   58 0.464289521  10.6.15.156 → 192.168.1.12 SSH 430 Server: Encrypted packet (len=364)
   59 0.470231019 192.168.1.12 → 10.6.15.156  SSH 102 Client: Encrypted packet (len=36)
   60 0.475417992  10.6.15.156 → 192.168.1.12 SSH 266 Server: Encrypted packet (len=200)
   61 0.475438646 192.168.1.12 → 10.6.15.156  SSH 362 Client: Encrypted packet (len=296)
   62 0.475859739 192.168.1.12 → 10.6.15.156  SSH 102 Client: Encrypted packet (len=36)
   63 0.476096207 192.168.1.12 → 10.6.15.156  SSH 430 Client: Encrypted packet (len=364)
   64 0.477928239  10.6.15.156 → 192.168.1.12 TCP 66 22 → 54766 [ACK] Seq=10825 Ack=5225 Win=1452 Len=0 TSval=14498158 TSecr=7566665
   65 0.513285525  10.6.15.156 → 192.168.1.12 SSH 1514 Server: Encrypted packet (len=1448)
   66 0.513451551  10.6.15.156 → 192.168.1.12 SSH 1514 Server: Encrypted packet (len=1448)
   67 0.513458291 192.168.1.12 → 10.6.15.156  TCP 66 54766 → 22 [ACK] Seq=5589 Ack=13721 Win=4866 Len=0 TSval=7566674 TSecr=14498167
   68 0.513470553  10.6.15.156 → 192.168.1.12 SSH 130 Server: Encrypted packet (len=64)
   69 0.513705496  10.6.15.156 → 192.168.1.12 SSH 782 Server: Encrypted packet (len=716)
   70 0.513733434 192.168.1.12 → 10.6.15.156  TCP 66 54766 → 22 [ACK] Seq=5589 Ack=14501 Win=4866 Len=0 TSval=7566674 TSecr=14498167
   71 0.514656582 192.168.1.12 → 10.6.15.156  SSH 142 Client: Encrypted packet (len=76)
   72 0.554141919  10.6.15.156 → 192.168.1.12 TCP 66 22 → 54766 [ACK] Seq=14501 Ack=5665 Win=1452 Len=0 TSval=14498178 TSecr=7566674
   73 0.663304340  10.6.15.156 → 192.168.1.12 SSH 358 Server: Encrypted packet (len=292)
   74 0.664372222 192.168.1.12 → 10.6.15.156  SSH 550 Client: Encrypted packet (len=484)
   75 0.667114765  10.6.15.156 → 192.168.1.12 TCP 66 22 → 54766 [ACK] Seq=14793 Ack=6149 Win=1452 Len=0 TSval=14498206 TSecr=7566712
   76 0.688843209  10.6.15.156 → 192.168.1.12 SSH 126 Server: Encrypted packet (len=60)
   77 0.688865352  10.6.15.156 → 192.168.1.12 SSH 138 Server: Encrypted packet (len=72)
   78 0.688937345 192.168.1.12 → 10.6.15.156  TCP 66 54766 → 22 [ACK] Seq=6149 Ack=14925 Win=4866 Len=0 TSval=7566718 TSecr=14498211
   79 0.689164578 192.168.1.12 → 10.6.15.156  SSH 102 Client: Encrypted packet (len=36)
   80 0.694619137  10.6.15.156 → 192.168.1.12 SSH 238 Server: Encrypted packet (len=172)
   81 0.695032894 192.168.1.12 → 10.6.15.156  SSH 134 Client: Encrypted packet (len=68)
   82 0.695477524 192.168.1.12 → 10.6.15.156  SSH 1230 Client: Encrypted packet (len=1164)
   83 0.697659471  10.6.15.156 → 192.168.1.12 TCP 66 22 → 54766 [ACK] Seq=15097 Ack=7417 Win=1452 Len=0 TSval=14498213 TSecr=7566719
   84 0.705058055  10.6.15.156 → 192.168.1.12 SSH 110 Server: Encrypted packet (len=44)
   85 0.705401712 192.168.1.12 → 10.6.15.156  SSH 198 Client: Encrypted packet (len=132)
   86 0.747610115  10.6.15.156 → 192.168.1.12 TCP 66 22 → 54766 [ACK] Seq=15141 Ack=7549 Win=1452 Len=0 TSval=14498226 TSecr=7566722
   87 0.831253137 192.168.1.12 → 10.6.15.156  SSH 862 Client: Encrypted packet (len=796)
   88 0.835312482  10.6.15.156 → 192.168.1.12 TCP 66 22 → 54766 [ACK] Seq=15141 Ack=8345 Win=1452 Len=0 TSval=14498248 TSecr=7566753
   89 0.911137256 192.168.1.12 → 192.168.1.1  DNS 74 Standard query 0x1949 A ntp.ubuntu.com
   90 0.915102077  192.168.1.1 → 192.168.1.12 DNS 138 Standard query response 0x1949 A ntp.ubuntu.com A 91.189.89.199 A 91.189.89.198 A 91.189.94.4 A 91.189.91.157
   91 0.915113647  10.6.15.156 → 192.168.1.12 SSH 326 Server: Encrypted packet (len=260)
   92 0.915557367 192.168.1.12 → 91.189.89.199 NTP 90 NTP Version 4, client
   93 0.920950925 10.119.73.122 → 192.168.1.12 ICMP 110 Destination unreachable (Communication administratively filtered)
   94 0.937298580  10.6.15.156 → 192.168.1.12 SSH 246 Server: Encrypted packet (len=180)
   95 0.937381061 192.168.1.12 → 10.6.15.156  TCP 66 54766 → 22 [ACK] Seq=8345 Ack=15581 Win=4866 Len=0 TSval=7566780 TSecr=14498268
   96 0.937654231 192.168.1.12 → 10.6.15.156  SSH 174 Client: Encrypted packet (len=108)
   97 0.939490544  10.6.15.156 → 192.168.1.12 TCP 66 22 → 54766 [ACK] Seq=15581 Ack=8453 Win=1452 Len=0 TSval=14498274 TSecr=7566780
   98 0.939505829 192.168.1.12 → 10.6.15.156  SSH 710 Client: Encrypted packet (len=644)
   99 0.941565721  10.6.15.156 → 192.168.1.12 TCP 66 22 → 54766 [ACK] Seq=15581 Ack=9097 Win=1452 Len=0 TSval=14498274 TSecr=7566781
  100 1.051985601  10.6.15.156 → 192.168.1.12 SSH 454 Server: Encrypted packet (len=388)
  101 1.095326220 192.168.1.12 → 10.6.15.156  TCP 66 54766 → 22 [ACK] Seq=9097 Ack=15969 Win=4866 Len=0 TSval=7566820 TSecr=14498302
  102 1.153919726  10.6.15.156 → 192.168.1.12 SSH 542 Server: Encrypted packet (len=476)
  103 1.154005266 192.168.1.12 → 10.6.15.156  TCP 66 54766 → 22 [ACK] Seq=9097 Ack=16445 Win=4866 Len=0 TSval=7566834 TSecr=14498327
  104 1.175929814  10.6.15.156 → 192.168.1.12 SSH 1174 Server: Encrypted packet (len=1108)
  105 1.175987285 192.168.1.12 → 10.6.15.156  TCP 66 54766 → 22 [ACK] Seq=9097 Ack=17553 Win=4866 Len=0 TSval=7566840 TSecr=14498333
  106 1.187833578 192.168.1.12 → 10.6.15.156  SSH 238 Client: Encrypted packet (len=172)
  107 1.189505441  10.6.15.156 → 192.168.1.12 TCP 66 22 → 54766 [ACK] Seq=17553 Ack=9269 Win=1452 Len=0 TSval=14498336 TSecr=7566843
  108 1.189529870 192.168.1.12 → 10.6.15.156  SSH 326 Client: Encrypted packet (len=260)
  109 1.191232064  10.6.15.156 → 192.168.1.12 TCP 66 22 → 54766 [ACK] Seq=17553 Ack=9529 Win=1452 Len=0 TSval=14498337 TSecr=7566843
  110 1.220492627 192.168.1.12 → 10.6.15.156  SSH 102 Client: Encrypted packet (len=36)
  111 1.222595173 192.168.1.12 → 10.6.15.156  SSH 102 Client: Encrypted packet (len=36)
  112 1.223680938  10.6.15.156 → 192.168.1.12 TCP 66 22 → 54766 [ACK] Seq=17553 Ack=9565 Win=1452 Len=0 TSval=14498345 TSecr=7566851
  113 1.223699522 192.168.1.12 → 10.6.15.156  SSH 146 Client: Encrypted packet (len=80)
  114 1.223715861  10.6.15.156 → 192.168.1.12 TCP 66 22 → 54766 [ACK] Seq=17553 Ack=9601 Win=1452 Len=0 TSval=14498345 TSecr=7566851
  115 1.225312896  10.6.15.156 → 192.168.1.12 TCP 66 22 → 54766 [ACK] Seq=17553 Ack=9681 Win=1452 Len=0 TSval=14498345 TSecr=7566852
  116 1.228725364 192.168.1.12 → 10.6.15.156  SSH 286 Client: Encrypted packet (len=220)
  117 1.229034176 192.168.1.12 → 10.6.15.156  SSH 142 Client: Encrypted packet (len=76)
  118 1.230338237  10.6.15.156 → 192.168.1.12 TCP 66 22 → 54766 [ACK] Seq=17553 Ack=9901 Win=1452 Len=0 TSval=14498347 TSecr=7566853
  119 1.230358501  10.6.15.156 → 192.168.1.12 TCP 66 22 → 54766 [ACK] Seq=17553 Ack=9977 Win=1452 Len=0 TSval=14498347 TSecr=7566853
  120 1.230562412 192.168.1.12 → 10.6.15.156  SSH 102 Client: Encrypted packet (len=36)
  121 1.231871255  10.6.15.156 → 192.168.1.12 TCP 66 22 → 54766 [ACK] Seq=17553 Ack=10013 Win=1452 Len=0 TSval=14498347 TSecr=7566853
  122 1.231891522 192.168.1.12 → 10.6.15.156  SSH 110 Client: Encrypted packet (len=44)
  123 1.233213684  10.6.15.156 → 192.168.1.12 TCP 66 22 → 54766 [ACK] Seq=17553 Ack=10057 Win=1452 Len=0 TSval=14498347 TSecr=7566854
  124 1.242669310  10.6.15.156 → 192.168.1.12 SSH 142 Server: Encrypted packet (len=76)
  125 1.283208839  10.6.15.156 → 192.168.1.12 SSH 1398 Server: Encrypted packet (len=1332)
  126 1.283228610 192.168.1.12 → 10.6.15.156  TCP 66 54766 → 22 [ACK] Seq=10057 Ack=18961 Win=4866 Len=0 TSval=7566866 TSecr=14498349
  127 1.283942112 192.168.1.12 → 10.6.15.156  SSH 134 Client: Encrypted packet (len=68)
  128 1.287393005  10.6.15.156 → 192.168.1.12 SSH 174 Server: Encrypted packet (len=108)
  129 1.287699613 192.168.1.12 → 10.6.15.156  SSH 134 Client: Encrypted packet (len=68)
  130 1.290712454  10.6.15.156 → 192.168.1.12 SSH 1514 Server: Encrypted packet (len=1448)
  131 1.290738008  10.6.15.156 → 192.168.1.12 SSH 406 Server: Encrypted packet (len=340)
  132 1.290749421 192.168.1.12 → 10.6.15.156  TCP 66 54766 → 22 [ACK] Seq=10193 Ack=20857 Win=4866 Len=0 TSval=7566868 TSecr=14498362
  133 1.339518267 192.168.1.12 → 10.6.15.156  SSH 534 Client: Encrypted packet (len=468)
  134 1.378139708  10.6.15.156 → 192.168.1.12 TCP 66 22 → 54766 [ACK] Seq=20857 Ack=10661 Win=1452 Len=0 TSval=14498384 TSecr=7566881
  135 1.378162206 192.168.1.12 → 10.6.15.156  SSH 362 Client: Encrypted packet (len=296)
  136 1.379875928  10.6.15.156 → 192.168.1.12 TCP 66 22 → 54766 [ACK] Seq=20857 Ack=10957 Win=1452 Len=0 TSval=14498384 TSecr=7566890
  137 1.403599292 192.168.1.12 → 10.6.15.156  SSH 102 Client: Encrypted packet (len=36)
  138 1.405086203  10.6.15.156 → 192.168.1.12 TCP 66 22 → 54766 [ACK] Seq=20857 Ack=10993 Win=1452 Len=0 TSval=14498390 TSecr=7566897
  139 1.405099733 192.168.1.12 → 10.6.15.156  SSH 110 Client: Encrypted packet (len=44)
  140 1.406839429  10.6.15.156 → 192.168.1.12 TCP 66 22 → 54766 [ACK] Seq=20857 Ack=11037 Win=1452 Len=0 TSval=14498391 TSecr=7566897
  141 1.429211119 192.168.1.12 → 10.6.15.156  SSH 198 Client: Encrypted packet (len=132)
  142 1.471682357  10.6.15.156 → 192.168.1.12 TCP 66 22 → 54766 [ACK] Seq=20857 Ack=11169 Win=1452 Len=0 TSval=14498407 TSecr=7566903
  143 1.471707192 192.168.1.12 → 10.6.15.156  SSH 594 Client: Encrypted packet (len=528)
  144 1.510078235  10.6.15.156 → 192.168.1.12 TCP 66 22 → 54766 [ACK] Seq=20857 Ack=11697 Win=1452 Len=0 TSval=14498417 TSecr=7566914
  145 1.948230366  10.6.15.156 → 192.168.1.12 SSH 1514 Server: Encrypted packet (len=1448)
  146 1.948250576  10.6.15.156 → 192.168.1.12 SSH 566 Server: Encrypted packet (len=500)
  147 1.948259303 192.168.1.12 → 10.6.15.156  TCP 66 54766 → 22 [ACK] Seq=11697 Ack=22805 Win=4866 Len=0 TSval=7567033 TSecr=14498526
  148 1.948447608  10.6.15.156 → 192.168.1.12 SSH 354 Server: Encrypted packet (len=288)
  149 1.948995744 192.168.1.12 → 10.6.15.156  SSH 210 Client: Encrypted packet (len=144)
  150 1.950526385  10.6.15.156 → 192.168.1.12 TCP 66 22 → 54766 [ACK] Seq=23093 Ack=11841 Win=1452 Len=0 TSval=14498527 TSecr=7567033
  151 1.950542692 192.168.1.12 → 10.6.15.156  SSH 682 Client: Encrypted packet (len=616)
  152 1.952748877  10.6.15.156 → 192.168.1.12 TCP 66 22 → 54766 [ACK] Seq=23093 Ack=12457 Win=1452 Len=0 TSval=14498527 TSecr=7567033
  153 1.983933172 192.168.1.12 → 10.6.15.156  SSH 254 Client: Encrypted packet (len=188)
  154 1.985537192  10.6.15.156 → 192.168.1.12 TCP 66 22 → 54766 [ACK] Seq=23093 Ack=12645 Win=1452 Len=0 TSval=14498535 TSecr=7567042
  155 1.990508619  10.6.15.156 → 192.168.1.12 SSH 142 Server: Encrypted packet (len=76)
  156 2.026006308  10.6.15.156 → 192.168.1.12 SSH 1510 Server: Encrypted packet (len=1444)
  157 2.026028680 192.168.1.12 → 10.6.15.156  TCP 66 54766 → 22 [ACK] Seq=12645 Ack=24613 Win=4866 Len=0 TSval=7567052 TSecr=14498536
  158 2.027733362 192.168.1.12 → 10.6.15.156  SSH 134 Client: Encrypted packet (len=68)
  159 2.052246328  10.6.15.156 → 192.168.1.12 SSH 422 Server: Encrypted packet (len=356)
  160 2.095297015 192.168.1.12 → 10.6.15.156  TCP 66 54766 → 22 [ACK] Seq=12713 Ack=24969 Win=4866 Len=0 TSval=7567070 TSecr=14498552
  161 2.160888064  10.6.15.156 → 192.168.1.12 SSH 110 Server: Encrypted packet (len=44)
  162 2.160910336 192.168.1.12 → 10.6.15.156  TCP 66 54766 → 22 [ACK] Seq=12713 Ack=25013 Win=4866 Len=0 TSval=7567086 TSecr=14498579
  163 2.161196420 192.168.1.12 → 10.6.15.156  SSH 166 Client: Encrypted packet (len=100)
  164 2.170902192  10.6.15.156 → 192.168.1.12 SSH 1198 Server: Encrypted packet (len=1132)
  165 2.171634199 192.168.1.12 → 10.6.15.156  SSH 446 Client: Encrypted packet (len=380)
  166 2.210147515  10.6.15.156 → 192.168.1.12 TCP 66 22 → 54766 [ACK] Seq=26145 Ack=13193 Win=1452 Len=0 TSval=14498592 TSecr=7567089
  167 2.246410898 192.168.1.12 → 10.6.15.156  SSH 454 Client: Encrypted packet (len=388)
  168 2.248103582  10.6.15.156 → 192.168.1.12 TCP 66 22 → 54766 [ACK] Seq=26145 Ack=13581 Win=1452 Len=0 TSval=14498601 TSecr=7567107
  169 2.248729065  10.6.15.156 → 192.168.1.12 SSH 230 Server: Encrypted packet (len=164)
  170 2.248972515 192.168.1.12 → 10.6.15.156  SSH 174 Client: Encrypted packet (len=108)
  171 2.252261887  10.6.15.156 → 192.168.1.12 SSH 150 Server: Encrypted packet (len=84)
  172 2.252288430 192.168.1.12 → 10.6.15.156  SSH 806 Client: Encrypted packet (len=740)
  173 2.294111353  10.6.15.156 → 192.168.1.12 TCP 66 22 → 54766 [ACK] Seq=26393 Ack=14429 Win=1452 Len=0 TSval=14498613 TSecr=7567109
  174 2.359860906 192.168.1.12 → 224.0.0.252  LLMNR 61 Standard query 0x3f2e A x
  175 2.374513953  10.6.15.156 → 192.168.1.12 SSH 222 Server: Encrypted packet (len=156)
  176 2.374806540 192.168.1.12 → 10.6.15.156  SSH 134 Client: Encrypted packet (len=68)
  177 2.376348664  10.6.15.156 → 192.168.1.12 TCP 66 22 → 54766 [ACK] Seq=26549 Ack=14497 Win=1452 Len=0 TSval=14498633 TSecr=7567139
  178 2.393640544  10.6.15.156 → 192.168.1.12 SSH 174 Server: Encrypted packet (len=108)
  179 2.435324423 192.168.1.12 → 10.6.15.156  TCP 66 54766 → 22 [ACK] Seq=14497 Ack=26657 Win=4866 Len=0 TSval=7567155 TSecr=14498637
  180 2.458334731  10.6.15.156 → 192.168.1.12 SSH 598 Server: Encrypted packet (len=532)
  181 2.458361098 192.168.1.12 → 10.6.15.156  TCP 66 54766 → 22 [ACK] Seq=14497 Ack=27189 Win=4866 Len=0 TSval=7567160 TSecr=14498653
  182 2.475630623  10.6.15.156 → 192.168.1.12 SSH 1494 Server: Encrypted packet (len=1428)
  183 2.475709935 192.168.1.12 → 10.6.15.156  TCP 66 54766 → 22 [ACK] Seq=14497 Ack=28617 Win=4866 Len=0 TSval=7567165 TSecr=14498658
  184 2.503247085 192.168.1.12 → 224.0.0.252  LLMNR 61 Standard query 0x3f2e A x
  185 2.753308234 192.168.1.12 → 224.0.0.252  LLMNR 61 Standard query 0x3f2e A x
  186 2.796618454  10.6.15.156 → 192.168.1.12 SSH 166 Server: Encrypted packet (len=100)
  187 2.796644896 192.168.1.12 → 10.6.15.156  TCP 66 54766 → 22 [ACK] Seq=14497 Ack=28717 Win=4866 Len=0 TSval=7567245 TSecr=14498738
  188 4.982299716  10.22.18.17 → 224.0.0.252  LLMNR 64 Standard query 0x10e9 A wpad
  189 4.983313796  10.22.18.17 → 224.0.0.252  LLMNR 64 Standard query 0xe71d AAAA wpad
  190 5.315817793 192.168.1.12 → 10.6.15.156  SSH 486 Client: Encrypted packet (len=420)
  191 5.354052337  10.6.15.156 → 192.168.1.12 TCP 66 22 → 54766 [ACK] Seq=28717 Ack=14917 Win=1452 Len=0 TSval=14499378 TSecr=7567875
  192 5.392474129  10.22.18.17 → 224.0.0.252  LLMNR 64 Standard query 0x10e9 A wpad
  193 5.393820296  10.22.18.17 → 224.0.0.252  LLMNR 64 Standard query 0xe71d AAAA wpad
  194 5.428054765  10.6.15.156 → 192.168.1.12 SSH 222 Server: Encrypted packet (len=156)
  195 5.428070585 192.168.1.12 → 10.6.15.156  TCP 66 54766 → 22 [ACK] Seq=14917 Ack=28873 Win=4866 Len=0 TSval=7567903 TSecr=14499395
  196 5.836602493 192.168.1.12 → 10.6.15.156  SSH 102 Client: Encrypted packet (len=36)
  197 5.840266197  10.6.15.156 → 192.168.1.12 TCP 66 22 → 54766 [ACK] Seq=28873 Ack=14953 Win=1452 Len=0 TSval=14499499 TSecr=7568005
  198 5.840282879 192.168.1.12 → 10.6.15.156  SSH 350 Client: Encrypted packet (len=284)
  199 5.843461569  10.6.15.156 → 192.168.1.12 TCP 66 22 → 54766 [ACK] Seq=28873 Ack=15237 Win=1452 Len=0 TSval=14499500 TSecr=7568006
  200 6.057193263  10.6.15.156 → 192.168.1.12 SSH 138 Server: Encrypted packet (len=72)
  201 6.057211674 192.168.1.12 → 10.6.15.156  TCP 66 54766 → 22 [ACK] Seq=15237 Ack=28945 Win=4866 Len=0 TSval=7568060 TSecr=14499552
  202 6.057440820 192.168.1.12 → 10.6.15.156  SSH 102 Client: Encrypted packet (len=36)
  203 6.061060505  10.6.15.156 → 192.168.1.12 SSH 138 Server: Encrypted packet (len=72)
  204 6.064272132  10.6.15.156 → 192.168.1.12 SSH 210 Server: Encrypted packet (len=144)
  205 6.064379979 192.168.1.12 → 10.6.15.156  TCP 66 54766 → 22 [ACK] Seq=15273 Ack=29161 Win=4866 Len=0 TSval=7568062 TSecr=14499553
  206 6.064588056 192.168.1.12 → 10.6.15.156  SSH 138 Client: Encrypted packet (len=72)
  207 6.065337685  10.6.15.156 → 192.168.1.12 TCP 66 22 → 54766 [ACK] Seq=29161 Ack=15273 Win=1452 Len=0 TSval=14499554 TSecr=7568060
  208 6.065352005 192.168.1.12 → 10.6.15.156  SSH 290 Client: Encrypted packet (len=224)
  209 6.065911996  10.6.15.156 → 192.168.1.12 SSH 138 Server: Encrypted packet (len=72)
  210 6.073634309  10.6.15.156 → 192.168.1.12 TCP 66 22 → 54766 [ACK] Seq=29233 Ack=15569 Win=1452 Len=0 TSval=14499556 TSecr=7568062
  211 6.073659747 192.168.1.12 → 10.6.15.156  SSH 242 Client: Encrypted packet (len=176)
  212 6.118047104  10.6.15.156 → 192.168.1.12 TCP 66 22 → 54766 [ACK] Seq=29233 Ack=15745 Win=1452 Len=0 TSval=14499568 TSecr=7568064
  213 6.214182414  10.6.15.156 → 192.168.1.12 SSH 138 Server: Encrypted packet (len=72)
  214 6.214398360 192.168.1.12 → 10.6.15.156  SSH 102 Client: Encrypted packet (len=36)
  215 6.217788302  10.6.15.156 → 192.168.1.12 TCP 66 22 → 54766 [ACK] Seq=29305 Ack=15781 Win=1452 Len=0 TSval=14499593 TSecr=7568099
  216 6.286580447  10.6.15.156 → 192.168.1.12 SSH 1514 Server: Encrypted packet (len=1448)
  217 6.286675581  10.6.15.156 → 192.168.1.12 SSH 1210 Server: Encrypted packet (len=1144)
  218 6.286687678 192.168.1.12 → 10.6.15.156  TCP 66 54766 → 22 [ACK] Seq=15781 Ack=31897 Win=4866 Len=0 TSval=7568117 TSecr=14499610
  219 6.287977391  10.6.15.156 → 192.168.1.12 SSH 1054 Server: Encrypted packet (len=988)
  220 6.287986337  10.6.15.156 → 192.168.1.12 SSH 454 Server: Encrypted packet (len=388)
  221 6.288017584 192.168.1.12 → 10.6.15.156  TCP 66 54766 → 22 [ACK] Seq=15781 Ack=33273 Win=4866 Len=0 TSval=7568118 TSecr=14499610
  222 6.288931631 192.168.1.12 → 10.6.15.156  SSH 206 Client: Encrypted packet (len=140)
  223 6.295272319  10.6.15.156 → 192.168.1.12 TCP 66 22 → 54766 [ACK] Seq=33273 Ack=15921 Win=1452 Len=0 TSval=14499612 TSecr=7568118
  224 6.295302313 192.168.1.12 → 10.6.15.156  SSH 206 Client: Encrypted packet (len=140)
  225 6.296127466  10.6.15.156 → 192.168.1.12 SSH 222 Server: Encrypted packet (len=156)
  226 6.296140023  10.6.15.156 → 192.168.1.12 SSH 190 Server: Encrypted packet (len=124)
  227 6.296144571  10.6.15.156 → 192.168.1.12 SSH 134 Server: Encrypted packet (len=68)
  228 6.296204702 192.168.1.12 → 10.6.15.156  TCP 66 54766 → 22 [ACK] Seq=16061 Ack=33621 Win=4866 Len=0 TSval=7568120 TSecr=14499612
  229 6.298829122  10.6.15.156 → 192.168.1.12 SSH 842 Server: Encrypted packet (len=776)
  230 6.299897785 192.168.1.12 → 10.6.15.156  SSH 206 Client: Encrypted packet (len=140)
  231 6.304701640  10.6.15.156 → 192.168.1.12 TCP 66 22 → 54766 [ACK] Seq=34397 Ack=16201 Win=1452 Len=0 TSval=14499614 TSecr=7568120
  232 6.304725475 192.168.1.12 → 10.6.15.156  SSH 206 Client: Encrypted packet (len=140)
  233 6.349100233  10.6.15.156 → 192.168.1.12 TCP 66 22 → 54766 [ACK] Seq=34397 Ack=16341 Win=1452 Len=0 TSval=14499626 TSecr=7568122
  234 6.509611204  10.6.15.156 → 192.168.1.12 SSH 150 Server: Encrypted packet (len=84)
  235 6.510281510 192.168.1.12 → 10.6.15.156  SSH 862 Client: Encrypted packet (len=796)
  236 6.512924606  10.6.15.156 → 192.168.1.12 TCP 66 22 → 54766 [ACK] Seq=34481 Ack=17137 Win=1452 Len=0 TSval=14499667 TSecr=7568173
  237 6.513606647  10.6.15.156 → 192.168.1.12 SSH 142 Server: Encrypted packet (len=76)
  238 6.514237036 192.168.1.12 → 10.6.15.156  SSH 862 Client: Encrypted packet (len=796)
  239 6.519362011  10.6.15.156 → 192.168.1.12 SSH 142 Server: Encrypted packet (len=76)
  240 6.519972797 192.168.1.12 → 10.6.15.156  SSH 862 Client: Encrypted packet (len=796)
  241 6.531486655  10.6.15.156 → 192.168.1.12 SSH 142 Server: Encrypted packet (len=76)
  242 6.532108693 192.168.1.12 → 10.6.15.156  SSH 862 Client: Encrypted packet (len=796)
  243 6.576332208  10.6.15.156 → 192.168.1.12 TCP 66 22 → 54766 [ACK] Seq=34709 Ack=19525 Win=1452 Len=0 TSval=14499683 TSecr=7568179
  244 6.732030454  10.6.15.156 → 192.168.1.12 SSH 454 Server: Encrypted packet (len=388)
  245 6.733509717  10.6.15.156 → 192.168.1.12 SSH 454 Server: Encrypted packet (len=388)
  246 6.733569279 192.168.1.12 → 10.6.15.156  TCP 66 54766 → 22 [ACK] Seq=19525 Ack=35485 Win=4866 Len=0 TSval=7568229 TSecr=14499722
  247 6.741012081  10.6.15.156 → 192.168.1.12 SSH 454 Server: Encrypted packet (len=388)
  248 6.756470075  10.6.15.156 → 192.168.1.12 SSH 454 Server: Encrypted packet (len=388)
  249 6.756548196 192.168.1.12 → 10.6.15.156  TCP 66 54766 → 22 [ACK] Seq=19525 Ack=36261 Win=4866 Len=0 TSval=7568235 TSecr=14499724
  250 6.769694549  10.6.15.156 → 192.168.1.12 SSH 454 Server: [TCP Spurious Retransmission] , Encrypted packet (len=388)
  251 6.769713730 192.168.1.12 → 10.6.15.156  TCP 78 [TCP Dup ACK 249#1] 54766 → 22 [ACK] Seq=19525 Ack=36261 Win=4866 Len=0 TSval=7568238 TSecr=14499731 SLE=35873 SRE=36261
  252 6.829607567 192.168.1.12 → 10.6.15.156  SSH 862 Client: Encrypted packet (len=796)
  253 6.837265564  10.6.15.156 → 192.168.1.12 TCP 66 22 → 54766 [ACK] Seq=36261 Ack=20321 Win=1452 Len=0 TSval=14499747 TSecr=7568253
  254 7.053269593  10.6.15.156 → 192.168.1.12 SSH 454 Server: Encrypted packet (len=388)
  255 7.053295338 192.168.1.12 → 10.6.15.156  TCP 66 54766 → 22 [ACK] Seq=20321 Ack=36649 Win=4866 Len=0 TSval=7568309 TSecr=14499802
  256 7.909153674 192.168.1.12 → 123.108.200.124 NTP 90 NTP Version 4, client
  257 7.912214515 10.119.73.122 → 192.168.1.12 ICMP 110 Destination unreachable (Communication administratively filtered)
  258 9.292157110  10.6.15.156 → 192.168.1.12 SSH 102 Server: Encrypted packet (len=36)
  259 9.292174977 192.168.1.12 → 10.6.15.156  TCP 66 54766 → 22 [ACK] Seq=20321 Ack=36685 Win=4866 Len=0 TSval=7568869 TSecr=14500361
  260 9.296339912  10.6.15.156 → 192.168.1.12 SSH 102 Server: Encrypted packet (len=36)
  261 9.296357155 192.168.1.12 → 10.6.15.156  TCP 66 54766 → 22 [ACK] Seq=20321 Ack=36721 Win=4866 Len=0 TSval=7568870 TSecr=14500362
  262 9.370662616  10.6.15.156 → 192.168.1.12 SSH 102 Server: Encrypted packet (len=36)
  263 9.370680087 192.168.1.12 → 10.6.15.156  TCP 66 54766 → 22 [ACK] Seq=20321 Ack=36757 Win=4866 Len=0 TSval=7568888 TSecr=14500381
  264 9.386410135  10.6.15.156 → 192.168.1.12 SSH 102 Server: Encrypted packet (len=36)
  265 9.386427456 192.168.1.12 → 10.6.15.156  TCP 66 54766 → 22 [ACK] Seq=20321 Ack=36793 Win=4866 Len=0 TSval=7568892 TSecr=14500384
  266 10.390948881  10.6.15.156 → 192.168.1.12 SSH 102 Server: Encrypted packet (len=36)
  267 10.390966472 192.168.1.12 → 10.6.15.156  TCP 66 54766 → 22 [ACK] Seq=20321 Ack=36829 Win=4866 Len=0 TSval=7569143 TSecr=14500637
  268 10.459379135  10.6.15.156 → 192.168.1.12 SSH 174 Server: Encrypted packet (len=108)
  269 10.459397778 192.168.1.12 → 10.6.15.156  TCP 66 54766 → 22 [ACK] Seq=20321 Ack=36937 Win=4866 Len=0 TSval=7569161 TSecr=14500653
  270 10.459418055  10.6.15.156 → 192.168.1.12 SSH 102 Server: Encrypted packet (len=36)
  271 10.459424323 192.168.1.12 → 10.6.15.156  TCP 66 54766 → 22 [ACK] Seq=20321 Ack=36973 Win=4866 Len=0 TSval=7569161 TSecr=14500653
  272 10.481056122 192.168.1.12 → 10.6.15.156  SSH 1514 Client: Encrypted packet (len=1448)
  273 10.483772615  10.6.15.156 → 192.168.1.12 TCP 66 22 → 54766 [ACK] Seq=36973 Ack=21769 Win=1452 Len=0 TSval=14500660 TSecr=7569166
  274 10.483793494 192.168.1.12 → 10.6.15.156  SSH 478 Client: Encrypted packet (len=412)
  275 10.485584635  10.6.15.156 → 192.168.1.12 TCP 66 22 → 54766 [ACK] Seq=36973 Ack=22181 Win=1452 Len=0 TSval=14500660 TSecr=7569167
  276 10.489723222  10.6.15.156 → 192.168.1.12 SSH 142 Server: Encrypted packet (len=76)
  277 10.531298711 192.168.1.12 → 10.6.15.156  TCP 66 54766 → 22 [ACK] Seq=22181 Ack=37049 Win=4866 Len=0 TSval=7569179 TSecr=14500661
  278 10.614953835  10.6.15.156 → 192.168.1.12 SSH 974 Server: Encrypted packet (len=908)
  279 10.614974802 192.168.1.12 → 10.6.15.156  TCP 66 54766 → 22 [ACK] Seq=22181 Ack=37957 Win=4866 Len=0 TSval=7569199 TSecr=14500692
  280 10.616593265  10.6.15.156 → 192.168.1.12 SSH 342 Server: Encrypted packet (len=276)
  281 10.616601896 192.168.1.12 → 10.6.15.156  TCP 66 54766 → 22 [ACK] Seq=22181 Ack=38233 Win=4866 Len=0 TSval=7569200 TSecr=14500692
  282 10.616614381  10.6.15.156 → 192.168.1.12 SSH 206 Server: Encrypted packet (len=140)
  283 10.616618016 192.168.1.12 → 10.6.15.156  TCP 66 54766 → 22 [ACK] Seq=22181 Ack=38373 Win=4866 Len=0 TSval=7569200 TSecr=14500692
  284 10.617031469 192.168.1.12 → 10.6.15.156  SSH 134 Client: Encrypted packet (len=68)
  285 10.658207134  10.6.15.156 → 192.168.1.12 TCP 66 22 → 54766 [ACK] Seq=38373 Ack=22249 Win=1452 Len=0 TSval=14500704 TSecr=7569200
  286 11.128729257 192.168.1.12 → 10.6.15.156  SSH 486 Client: Encrypted packet (len=420)
  287 11.130659682  10.6.15.156 → 192.168.1.12 TCP 66 22 → 54766 [ACK] Seq=38373 Ack=22669 Win=1452 Len=0 TSval=14500822 TSecr=7569328
  288 11.235417536  10.6.15.156 → 192.168.1.12 SSH 222 Server: Encrypted packet (len=156)
  289 11.279325536 192.168.1.12 → 10.6.15.156  TCP 66 54766 → 22 [ACK] Seq=22669 Ack=38529 Win=4866 Len=0 TSval=7569366 TSecr=14500848
  290 11.834238417 192.168.1.12 → 10.6.15.156  SSH 102 Client: Encrypted packet (len=36)
  291 11.835583177 192.168.1.12 → 10.6.15.156  SSH 1514 Client: Encrypted packet (len=1448)
  292 11.835711422  10.6.15.156 → 192.168.1.12 TCP 66 22 → 54766 [ACK] Seq=38529 Ack=22705 Win=1452 Len=0 TSval=14500998 TSecr=7569504
  293 11.836526664 192.168.1.12 → 10.6.15.156  SSH 1514 Client: Encrypted packet (len=1448)
  294 11.837334059 192.168.1.12 → 10.6.15.156  SSH 786 Client: Encrypted packet (len=720)
  295 11.838148007  10.6.15.156 → 192.168.1.12 TCP 66 22 → 54766 [ACK] Seq=38529 Ack=24153 Win=1452 Len=0 TSval=14500999 TSecr=7569505
  296 11.838819588  10.6.15.156 → 192.168.1.12 TCP 66 22 → 54766 [ACK] Seq=38529 Ack=25601 Win=1452 Len=0 TSval=14500999 TSecr=7569505
  297 11.839215963  10.6.15.156 → 192.168.1.12 TCP 66 22 → 54766 [ACK] Seq=38529 Ack=26321 Win=1450 Len=0 TSval=14500999 TSecr=7569505
  298 11.839646769  10.6.15.156 → 192.168.1.12 SSH 282 Server: Encrypted packet (len=216)
  299 11.839659890 192.168.1.12 → 10.6.15.156  TCP 66 54766 → 22 [ACK] Seq=26321 Ack=38745 Win=4866 Len=0 TSval=7569506 TSecr=14500999
  300 11.884328147  10.6.15.156 → 192.168.1.12 SSH 134 Server: Encrypted packet (len=68)
  301 11.884345559 192.168.1.12 → 10.6.15.156  TCP 66 54766 → 22 [ACK] Seq=26321 Ack=38813 Win=4866 Len=0 TSval=7569517 TSecr=14501010
  302 11.884367767  10.6.15.156 → 192.168.1.12 SSH 138 Server: Encrypted packet (len=72)
  303 11.884374947 192.168.1.12 → 10.6.15.156  TCP 66 54766 → 22 [ACK] Seq=26321 Ack=38885 Win=4866 Len=0 TSval=7569517 TSecr=14501010
  304 11.884610504 192.168.1.12 → 10.6.15.156  SSH 102 Client: Encrypted packet (len=36)
  305 11.926530883  10.6.15.156 → 192.168.1.12 TCP 66 22 → 54766 [ACK] Seq=38885 Ack=26357 Win=1452 Len=0 TSval=14501021 TSecr=7569517
  306 12.031973019  10.6.15.156 → 192.168.1.12 SSH 102 Server: Encrypted packet (len=36)
  307 12.056817127  10.6.15.156 → 192.168.1.12 SSH 842 Server: Encrypted packet (len=776)
  308 12.056895185 192.168.1.12 → 10.6.15.156  TCP 66 54766 → 22 [ACK] Seq=26357 Ack=39697 Win=4866 Len=0 TSval=7569560 TSecr=14501047
  309 12.058000623  10.6.15.156 → 192.168.1.12 SSH 842 Server: Encrypted packet (len=776)
  310 12.099325410 192.168.1.12 → 10.6.15.156  TCP 66 54766 → 22 [ACK] Seq=26357 Ack=40473 Win=4866 Len=0 TSval=7569571 TSecr=14501054
  311 12.832423008 192.168.1.12 → 10.6.15.156  SSH 102 Client: Encrypted packet (len=36)
  312 12.837056896  10.6.15.156 → 192.168.1.12 TCP 66 22 → 54766 [ACK] Seq=40473 Ack=26393 Win=1452 Len=0 TSval=14501248 TSecr=7569754
  313 12.837077970 192.168.1.12 → 10.6.15.156  SSH 934 Client: Encrypted packet (len=868)
  314 12.841953375  10.6.15.156 → 192.168.1.12 TCP 66 22 → 54766 [ACK] Seq=40473 Ack=27261 Win=1452 Len=0 TSval=14501249 TSecr=7569755
  315 12.844938118  10.6.15.156 → 192.168.1.12 SSH 102 Server: Encrypted packet (len=36)
  316 12.844955802 192.168.1.12 → 10.6.15.156  TCP 66 54766 → 22 [ACK] Seq=27261 Ack=40509 Win=4866 Len=0 TSval=7569757 TSecr=14501249
  317 13.058637773  10.6.15.156 → 192.168.1.12 SSH 454 Server: Encrypted packet (len=388)
  318 13.058663316 192.168.1.12 → 10.6.15.156  TCP 66 54766 → 22 [ACK] Seq=27261 Ack=40897 Win=4866 Len=0 TSval=7569810 TSecr=14501304
  319 13.254545385  10.6.15.156 → 192.168.1.12 SSH 138 Server: Encrypted packet (len=72)
  320 13.254562934 192.168.1.12 → 10.6.15.156  TCP 66 54766 → 22 [ACK] Seq=27261 Ack=40969 Win=4866 Len=0 TSval=7569859 TSecr=14501353
  321 13.254746813 192.168.1.12 → 10.6.15.156  SSH 102 Client: Encrypted packet (len=36)
  322 13.297877734  10.6.15.156 → 192.168.1.12 TCP 66 22 → 54766 [ACK] Seq=40969 Ack=27297 Win=1452 Len=0 TSval=14501363 TSecr=7569859
  323 14.372039885  10.6.15.156 → 192.168.1.12 SSH 102 Server: Encrypted packet (len=36)
  324 14.372320368 192.168.1.12 → 10.6.15.156  SSH 138 Client: Encrypted packet (len=72)
  325 14.374597087  10.6.15.156 → 192.168.1.12 TCP 66 22 → 54766 [ACK] Seq=41005 Ack=27369 Win=1452 Len=0 TSval=14501633 TSecr=7570139
  326 14.374727675  10.6.15.156 → 192.168.1.12 SSH 102 Server: Encrypted packet (len=36)
  327 14.377466404 192.168.1.12 → 10.6.15.156  SSH 318 Client: Encrypted packet (len=252)
  328 14.418209128  10.6.15.156 → 192.168.1.12 TCP 66 22 → 54766 [ACK] Seq=41041 Ack=27621 Win=1452 Len=0 TSval=14501644 TSecr=7570140
  329 14.599435182  10.6.15.156 → 192.168.1.12 SSH 342 Server: Encrypted packet (len=276)
  330 14.643272091 192.168.1.12 → 10.6.15.156  TCP 66 54766 → 22 [ACK] Seq=27621 Ack=41317 Win=4866 Len=0 TSval=7570207 TSecr=14501689
  331 16.933214556 192.168.1.12 → 10.6.15.156  SSH 494 Client: Encrypted packet (len=428)
  332 16.938138798  10.6.15.156 → 192.168.1.12 TCP 66 22 → 54766 [ACK] Seq=41317 Ack=28049 Win=1452 Len=0 TSval=14502273 TSecr=7570779
  333 17.043354816  10.6.15.156 → 192.168.1.12 SSH 222 Server: Encrypted packet (len=156)
  334 17.043370731 192.168.1.12 → 10.6.15.156  TCP 66 54766 → 22 [ACK] Seq=28049 Ack=41473 Win=4866 Len=0 TSval=7570807 TSecr=14502299
  335 17.834461039 192.168.1.12 → 10.6.15.156  SSH 862 Client: Encrypted packet (len=796)
  336 17.834660302 192.168.1.12 → 10.6.15.156  SSH 1514 Client: Encrypted packet (len=1448)
  337 17.835690573 192.168.1.12 → 10.6.15.156  SSH 1006 Client: Encrypted packet (len=940)
  338 17.837343755  10.6.15.156 → 192.168.1.12 TCP 66 22 → 54766 [ACK] Seq=41473 Ack=28845 Win=1452 Len=0 TSval=14502498 TSecr=7571004
  339 17.838043776  10.6.15.156 → 192.168.1.12 TCP 66 22 → 54766 [ACK] Seq=41473 Ack=30293 Win=1452 Len=0 TSval=14502498 TSecr=7571004
  340 17.838427499  10.6.15.156 → 192.168.1.12 TCP 66 22 → 54766 [ACK] Seq=41473 Ack=31233 Win=1452 Len=0 TSval=14502499 TSecr=7571005
  341 18.057934131  10.6.15.156 → 192.168.1.12 SSH 850 Server: Encrypted packet (len=784)
  342 18.057955800 192.168.1.12 → 10.6.15.156  TCP 66 54766 → 22 [ACK] Seq=31233 Ack=42257 Win=4866 Len=0 TSval=7571060 TSecr=14502553
  343 18.058373854  10.6.15.156 → 192.168.1.12 SSH 454 Server: Encrypted packet (len=388)
  344 18.058381654 192.168.1.12 → 10.6.15.156  TCP 66 54766 → 22 [ACK] Seq=31233 Ack=42645 Win=4866 Len=0 TSval=7571060 TSecr=14502553
  345 18.058857736  10.6.15.156 → 192.168.1.12 SSH 454 Server: Encrypted packet (len=388)
  346 18.058864850 192.168.1.12 → 10.6.15.156  TCP 66 54766 → 22 [ACK] Seq=31233 Ack=43033 Win=4866 Len=0 TSval=7571060 TSecr=14502553
  347 18.825235460 192.168.1.12 → 10.6.15.156  SSH 862 Client: Encrypted packet (len=796)
  348 18.835069802  10.6.15.156 → 192.168.1.12 TCP 66 22 → 54766 [ACK] Seq=43033 Ack=32029 Win=1452 Len=0 TSval=14502746 TSecr=7571252
  349 19.047687240  10.6.15.156 → 192.168.1.12 SSH 454 Server: Encrypted packet (len=388)
  350 19.047713424 192.168.1.12 → 10.6.15.156  TCP 66 54766 → 22 [ACK] Seq=32029 Ack=43421 Win=4866 Len=0 TSval=7571308 TSecr=14502801
  351 21.365801446  10.6.15.156 → 192.168.1.12 SSH 102 Server: Encrypted packet (len=36)
  352 21.365820219 192.168.1.12 → 10.6.15.156  TCP 66 54766 → 22 [ACK] Seq=32029 Ack=43457 Win=4866 Len=0 TSval=7571887 TSecr=14503380
  353 21.366086452 192.168.1.12 → 10.6.15.156  SSH 138 Client: Encrypted packet (len=72)
  354 21.368099940  10.6.15.156 → 192.168.1.12 TCP 66 22 → 54766 [ACK] Seq=43457 Ack=32101 Win=1452 Len=0 TSval=14503381 TSecr=7571887
  355 21.368486751  10.6.15.156 → 192.168.1.12 SSH 102 Server: Encrypted packet (len=36)
  356 21.411274974 192.168.1.12 → 10.6.15.156  TCP 66 54766 → 22 [ACK] Seq=32101 Ack=43493 Win=4866 Len=0 TSval=7571899 TSecr=14503381
  357 22.746167490 192.168.1.12 → 10.6.15.156  SSH 486 Client: Encrypted packet (len=420)
  358 22.787746482  10.6.15.156 → 192.168.1.12 TCP 66 22 → 54766 [ACK] Seq=43493 Ack=32521 Win=1452 Len=0 TSval=14503736 TSecr=7572232
  359 22.853339886  10.6.15.156 → 192.168.1.12 SSH 222 Server: Encrypted packet (len=156)
  360 22.853361446 192.168.1.12 → 10.6.15.156  TCP 66 54766 → 22 [ACK] Seq=32521 Ack=43649 Win=4866 Len=0 TSval=7572259 TSecr=14503752
  361 22.909150290 192.168.1.12 → 139.59.50.38 NTP 90 NTP Version 4, client
  362 23.830259909 192.168.1.12 → 10.6.15.156  SSH 862 Client: Encrypted packet (len=796)
  363 23.830528560 192.168.1.12 → 10.6.15.156  SSH 1514 Client: Encrypted packet (len=1448)
  364 23.831542003 192.168.1.12 → 10.6.15.156  SSH 1006 Client: Encrypted packet (len=940)
  365 23.833826848  10.6.15.156 → 192.168.1.12 TCP 66 22 → 54766 [ACK] Seq=43649 Ack=33317 Win=1452 Len=0 TSval=14503997 TSecr=7572503
  366 23.834299275  10.6.15.156 → 192.168.1.12 TCP 66 22 → 54766 [ACK] Seq=43649 Ack=34765 Win=1452 Len=0 TSval=14503997 TSecr=7572503
  367 23.834816620  10.6.15.156 → 192.168.1.12 TCP 66 22 → 54766 [ACK] Seq=43649 Ack=35705 Win=1452 Len=0 TSval=14503998 TSecr=7572504
  368 24.051087749  10.6.15.156 → 192.168.1.12 SSH 454 Server: Encrypted packet (len=388)
  369 24.051114718 192.168.1.12 → 10.6.15.156  TCP 66 54766 → 22 [ACK] Seq=35705 Ack=44037 Win=4866 Len=0 TSval=7572558 TSecr=14504052
  370 24.051601431  10.6.15.156 → 192.168.1.12 SSH 454 Server: Encrypted packet (len=388)
  371 24.051611556 192.168.1.12 → 10.6.15.156  TCP 66 54766 → 22 [ACK] Seq=35705 Ack=44425 Win=4866 Len=0 TSval=7572559 TSecr=14504052
  372 24.052024714  10.6.15.156 → 192.168.1.12 SSH 454 Server: Encrypted packet (len=388)
  373 24.052035663 192.168.1.12 → 10.6.15.156  TCP 66 54766 → 22 [ACK] Seq=35705 Ack=44813 Win=4866 Len=0 TSval=7572559 TSecr=14504052
  374 24.057529264  10.6.15.156 → 192.168.1.12 SSH 454 Server: Encrypted packet (len=388)
  375 24.057545616 192.168.1.12 → 10.6.15.156  TCP 66 54766 → 22 [ACK] Seq=35705 Ack=45201 Win=4866 Len=0 TSval=7572560 TSecr=14504052
  376 24.829144021 192.168.1.12 → 10.6.15.156  SSH 862 Client: Encrypted packet (len=796)
  377 24.835658765  10.6.15.156 → 192.168.1.12 TCP 66 22 → 54766 [ACK] Seq=45201 Ack=36501 Win=1452 Len=0 TSval=14504247 TSecr=7572753
  378 25.050365331  10.6.15.156 → 192.168.1.12 SSH 454 Server: Encrypted packet (len=388)
  379 25.050392345 192.168.1.12 → 10.6.15.156  TCP 66 54766 → 22 [ACK] Seq=36501 Ack=45589 Win=4866 Len=0 TSval=7572808 TSecr=14504302
  380 25.502405311 10.22.16.140 → 224.0.0.252  LLMNR 69 Standard query 0xd802 ANY ADITYAROG
  381 25.511522954 10.22.16.140 → 224.0.0.252  LLMNR 64 Standard query 0xbb0b A wpad
  382 25.511809634 10.22.16.140 → 224.0.0.252  LLMNR 64 Standard query 0xbf03 AAAA wpad
  383 25.912550142 10.22.16.140 → 224.0.0.252  LLMNR 69 Standard query 0xd802 ANY ADITYAROG
  384 25.921433988 10.22.16.140 → 224.0.0.252  LLMNR 64 Standard query 0xbf03 AAAA wpad
  385 25.921544597 10.22.16.140 → 224.0.0.252  LLMNR 64 Standard query 0xbb0b A wpad
  386 26.324942074 10.22.16.140 → 224.0.0.252  LLMNR 69 Standard query 0x2c8f ANY ADITYAROG
  387 26.735880535 10.22.16.140 → 224.0.0.252  LLMNR 69 Standard query 0x2c8f ANY ADITYAROG
  388 28.547166596 192.168.1.12 → 10.6.15.156  SSH 486 Client: Encrypted packet (len=420)
  389 28.550533471  10.6.15.156 → 192.168.1.12 TCP 66 22 → 54766 [ACK] Seq=45589 Ack=36921 Win=1452 Len=0 TSval=14505176 TSecr=7573682
  390 28.660828249  10.6.15.156 → 192.168.1.12 SSH 222 Server: Encrypted packet (len=156)
  391 28.660847012 192.168.1.12 → 10.6.15.156  TCP 66 54766 → 22 [ACK] Seq=36921 Ack=45745 Win=4866 Len=0 TSval=7573711 TSecr=14505203
  392 28.694020151 10.22.16.140 → 224.0.0.252  LLMNR 64 Standard query 0xbcb5 A wpad
  393 28.694405719 10.22.16.140 → 224.0.0.252  LLMNR 64 Standard query 0x760d AAAA wpad
  394 29.104353001 10.22.16.140 → 224.0.0.252  LLMNR 64 Standard query 0xbcb5 A wpad
  395 29.104370844 10.22.16.140 → 224.0.0.252  LLMNR 64 Standard query 0x760d AAAA wpad
  396 29.834356097 192.168.1.12 → 10.6.15.156  SSH 862 Client: Encrypted packet (len=796)
  397 29.834694543 192.168.1.12 → 10.6.15.156  SSH 1514 Client: Encrypted packet (len=1448)
  398 29.835704562 192.168.1.12 → 10.6.15.156  SSH 1006 Client: Encrypted packet (len=940)
  399 29.836796621  10.6.15.156 → 192.168.1.12 TCP 66 22 → 54766 [ACK] Seq=45745 Ack=37717 Win=1452 Len=0 TSval=14505498 TSecr=7574004
  400 29.837595709  10.6.15.156 → 192.168.1.12 TCP 66 22 → 54766 [ACK] Seq=45745 Ack=39165 Win=1452 Len=0 TSval=14505498 TSecr=7574004
  401 29.837960661  10.6.15.156 → 192.168.1.12 TCP 66 22 → 54766 [ACK] Seq=45745 Ack=40105 Win=1452 Len=0 TSval=14505499 TSecr=7574005
  402 30.055610891  10.6.15.156 → 192.168.1.12 SSH 1230 Server: Encrypted packet (len=1164)
  403 30.055639829 192.168.1.12 → 10.6.15.156  TCP 66 54766 → 22 [ACK] Seq=40105 Ack=46909 Win=4866 Len=0 TSval=7574060 TSecr=14505553
  404 30.056079190  10.6.15.156 → 192.168.1.12 SSH 454 Server: Encrypted packet (len=388)
  405 30.056086225 192.168.1.12 → 10.6.15.156  TCP 66 54766 → 22 [ACK] Seq=40105 Ack=47297 Win=4866 Len=0 TSval=7574060 TSecr=14505553
  406 30.832204253 192.168.1.12 → 10.6.15.156  SSH 862 Client: Encrypted packet (len=796)
  407 30.843170347  10.6.15.156 → 192.168.1.12 TCP 66 22 → 54766 [ACK] Seq=47297 Ack=40901 Win=1452 Len=0 TSval=14505748 TSecr=7574254
  408 31.061503644  10.6.15.156 → 192.168.1.12 SSH 454 Server: Encrypted packet (len=388)
  409 31.061530525 192.168.1.12 → 10.6.15.156  TCP 66 54766 → 22 [ACK] Seq=40901 Ack=47685 Win=4866 Len=0 TSval=7574311 TSecr=14505802
  410 31.153261176  10.6.15.156 → 192.168.1.12 SSH 134 Server: Encrypted packet (len=68)
  411 31.153279805 192.168.1.12 → 10.6.15.156  TCP 66 54766 → 22 [ACK] Seq=40901 Ack=47753 Win=4866 Len=0 TSval=7574334 TSecr=14505827
  412 31.153300711  10.6.15.156 → 192.168.1.12 SSH 102 Server: Encrypted packet (len=36)
  413 31.153309320 192.168.1.12 → 10.6.15.156  TCP 66 54766 → 22 [ACK] Seq=40901 Ack=47789 Win=4866 Len=0 TSval=7574334 TSecr=14505827
  414 31.909113110 192.168.1.12 → 139.59.50.38 NTP 90 NTP Version 4, client
  415 33.950918638 10.22.16.140 → 224.0.0.252  LLMNR 64 Standard query 0xbf5c A wpad
  416 33.951315219 10.22.16.140 → 224.0.0.252  LLMNR 64 Standard query 0x8045 AAAA wpad
  417 34.361038728 10.22.16.140 → 224.0.0.252  LLMNR 64 Standard query 0xbf5c A wpad
  418 34.361195985 192.168.1.12 → 10.6.15.156  SSH 486 Client: Encrypted packet (len=420)
  419 34.361696674 10.22.16.140 → 224.0.0.252  LLMNR 64 Standard query 0x8045 AAAA wpad
  420 34.363083865  10.6.15.156 → 192.168.1.12 TCP 66 22 → 54766 [ACK] Seq=47789 Ack=41321 Win=1452 Len=0 TSval=14506630 TSecr=7575136
  421 34.471841316  10.6.15.156 → 192.168.1.12 SSH 222 Server: Encrypted packet (len=156)
  422 34.471859981 192.168.1.12 → 10.6.15.156  TCP 66 54766 → 22 [ACK] Seq=41321 Ack=47945 Win=4866 Len=0 TSval=7575164 TSecr=14506656
