    1 0.000000000 192.168.1.16 → 139.59.21.22 NTP 90 NTP Version 4, client
    2 0.000780788 192.168.1.16 → 52.66.5.185  NTP 90 NTP Version 4, client
    3 0.001681754  10.6.15.144 → 192.168.1.16 SSH 382 Server: Encrypted packet (len=316)
    4 0.001719190  10.6.15.144 → 192.168.1.16 TCP 382 [TCP Retransmission] 22 → 59298 [PSH, ACK] Seq=1 Ack=1 Win=1452 Len=316 TSval=5627617 TSecr=5031086
    5 0.001725250 192.168.1.16 → 10.6.15.144  TCP 78 59298 → 22 [ACK] Seq=1 Ack=317 Win=5703 Len=0 TSval=5031377 TSecr=5627617 SLE=1 SRE=317
    6 0.001772029  10.6.15.144 → 192.168.1.16 SSH 382 Server: [TCP Spurious Retransmission] , Encrypted packet (len=316)
    7 0.001774766 192.168.1.16 → 10.6.15.144  TCP 78 [TCP Dup ACK 5#1] 59298 → 22 [ACK] Seq=1 Ack=317 Win=5703 Len=0 TSval=5031377 TSecr=5627688 SLE=1 SRE=317
    8 0.697999773 192.168.1.16 → 224.0.0.252  IGMPv2 46 Membership Report group 224.0.0.252
    9 3.002000304 192.168.1.16 → 224.0.0.251  IGMPv2 46 Membership Report group 224.0.0.251
   10 9.000014837 192.168.1.16 → 123.108.200.124 NTP 90 NTP Version 4, client
   11 9.430001483 192.168.1.16 → 10.6.15.144  SSH 1514 Client: Encrypted packet (len=1448)
   12 9.431451466 192.168.1.16 → 10.6.15.144  SSH 294 Client: Encrypted packet (len=228)
   13 9.441334831  10.6.15.144 → 192.168.1.16 TCP 66 22 → 59298 [ACK] Seq=317 Ack=1449 Win=1452 Len=0 TSval=5630095 TSecr=5033731
   14 9.441717878  10.6.15.144 → 192.168.1.16 TCP 66 22 → 59298 [ACK] Seq=317 Ack=1677 Win=1451 Len=0 TSval=5630095 TSecr=5033735
   15 9.445882204  10.6.15.144 → 192.168.1.16 SSH 134 Server: Encrypted packet (len=68)
   16 9.445903171 192.168.1.16 → 10.6.15.144  TCP 66 59298 → 22 [ACK] Seq=1677 Ack=385 Win=5703 Len=0 TSval=5033738 TSecr=5630096
   17 10.300057584  10.6.15.144 → 192.168.1.16 SSH 918 Server: Encrypted packet (len=852)
   18 10.300084348 192.168.1.16 → 10.6.15.144  TCP 66 59298 → 22 [ACK] Seq=1677 Ack=1237 Win=5703 Len=0 TSval=5033952 TSecr=5630126
   19 10.300417488  10.6.15.144 → 192.168.1.16 SSH 334 Server: Encrypted packet (len=268)
   20 10.300423065 192.168.1.16 → 10.6.15.144  TCP 66 59298 → 22 [ACK] Seq=1677 Ack=1505 Win=5703 Len=0 TSval=5033952 TSecr=5630126
   21 10.300824757  10.6.15.144 → 192.168.1.16 SSH 334 Server: [TCP Spurious Retransmission] , Encrypted packet (len=268)
   22 10.300831227 192.168.1.16 → 10.6.15.144  TCP 78 [TCP Dup ACK 20#1] 59298 → 22 [ACK] Seq=1677 Ack=1505 Win=5703 Len=0 TSval=5033952 TSecr=5630164 SLE=1237 SRE=1505
   23 10.300871166 192.168.1.16 → 10.6.15.144  SSH 134 Client: Encrypted packet (len=68)
   24 10.306974830  10.6.15.144 → 192.168.1.16 SSH 1186 Server: [TCP Spurious Retransmission] , Encrypted packet (len=1120)
   25 10.306996233 192.168.1.16 → 10.6.15.144  TCP 78 [TCP Dup ACK 20#2] 59298 → 22 [ACK] Seq=1745 Ack=1505 Win=5703 Len=0 TSval=5033954 TSecr=5630312 SLE=385 SRE=1505
   26 10.346842022  10.6.15.144 → 192.168.1.16 TCP 66 22 → 59298 [ACK] Seq=1505 Ack=1745 Win=1452 Len=0 TSval=5630322 TSecr=5033952
   27 12.316055238  10.22.18.34 → 224.0.0.252  LLMNR 64 Standard query 0xafa4 A wpad
   28 12.316102476  10.22.18.34 → 224.0.0.252  LLMNR 64 Standard query 0xafa4 A wpad
   29 19.292066929 10.22.19.200 → 224.0.0.252  LLMNR 64 Standard query 0xe54d A wpad
   30 20.315767816 10.22.19.200 → 224.0.0.252  LLMNR 64 Standard query 0xe54d A wpad
   31 27.324049908 10.22.17.220 → 224.0.0.252  LLMNR 64 Standard query 0x5c84 A wpad
   32 27.324430294 10.22.17.220 → 224.0.0.252  LLMNR 64 Standard query 0x5c84 A wpad
   33 28.857997370 192.168.1.16 → 54.76.71.168 TCP 66 42414 → 8282 [ACK] Seq=1 Ack=1 Win=296 Len=0 TSval=5038592 TSecr=609138704
   34 34.001724843 192.168.1.16 → 192.168.1.1  DNS 81 Standard query 0x5154 A 2.ubuntu.pool.ntp.org
   35 34.117999823  192.168.1.1 → 192.168.1.16 DNS 145 Standard query response 0x5154 A 2.ubuntu.pool.ntp.org A 123.108.200.124 A 139.59.21.22 A 52.66.5.185 A 13.126.27.131
   36 34.122088159 192.168.1.16 → 123.108.200.124 NTP 90 NTP Version 4, client
   37 42.999994769 192.168.1.16 → 91.189.94.4  NTP 90 NTP Version 4, client
