    1 0.000000000  10.6.15.144 → 192.168.1.16 SSH 374 Server: Encrypted packet (len=308)
    2 0.000088959  10.6.15.144 → 192.168.1.16 TCP 374 [TCP Retransmission] 22 → 59298 [PSH, ACK] Seq=1 Ack=1 Win=1452 Len=308 TSval=5638980 TSecr=5042469
    3 0.000111018 192.168.1.16 → 10.6.15.144  TCP 78 59298 → 22 [ACK] Seq=1 Ack=309 Win=5703 Len=0 TSval=5042712 TSecr=5638980 SLE=1 SRE=309
    4 0.959875190 10.22.18.100 → 224.0.0.252  LLMNR 64 Standard query 0x470d A wpad
    5 0.959946658 10.22.18.100 → 224.0.0.252  LLMNR 64 Standard query 0xdf78 AAAA wpad
    6 0.960113294 10.22.17.201 → 224.0.0.252  LLMNR 64 Standard query 0xed10 A wpad
    7 0.960246563 10.22.17.201 → 224.0.0.252  LLMNR 64 Standard query 0x7f66 AAAA wpad
    8 1.953306199 10.22.18.100 → 224.0.0.252  LLMNR 64 Standard query 0x470d A wpad
    9 1.953663748 10.22.18.100 → 224.0.0.252  LLMNR 64 Standard query 0xdf78 AAAA wpad
   10 1.954104540 10.22.17.201 → 224.0.0.252  LLMNR 64 Standard query 0xed10 A wpad
   11 1.954485289 10.22.17.201 → 224.0.0.252  LLMNR 64 Standard query 0x7f66 AAAA wpad
   12 2.924759128 192.168.1.16 → 239.255.255.250 SSDP 213 M-SEARCH * HTTP/1.1 
   13 2.932032998  192.168.1.1 → 239.255.255.250 SSDP 302 NOTIFY * HTTP/1.1 
   14 2.935310499  192.168.1.1 → 239.255.255.250 SSDP 311 NOTIFY * HTTP/1.1 
   15 2.938721554  192.168.1.1 → 239.255.255.250 SSDP 374 NOTIFY * HTTP/1.1 
   16 2.942033682  192.168.1.1 → 239.255.255.250 SSDP 370 NOTIFY * HTTP/1.1 
   17 2.945314356  192.168.1.1 → 239.255.255.250 SSDP 350 NOTIFY * HTTP/1.1 
   18 2.948794984  192.168.1.1 → 239.255.255.250 SSDP 382 NOTIFY * HTTP/1.1 
   19 2.952149372  192.168.1.1 → 239.255.255.250 SSDP 364 NOTIFY * HTTP/1.1 
   20 2.957598264  192.168.1.1 → 239.255.255.250 SSDP 366 NOTIFY * HTTP/1.1 
   21 2.960638174  192.168.1.1 → 239.255.255.250 SSDP 302 NOTIFY * HTTP/1.1 
   22 2.963716246  192.168.1.1 → 239.255.255.250 SSDP 311 NOTIFY * HTTP/1.1 
   23 2.981350580  192.168.1.1 → 239.255.255.250 SSDP 374 NOTIFY * HTTP/1.1 
   24 2.981901309  192.168.1.1 → 239.255.255.250 SSDP 370 NOTIFY * HTTP/1.1 
   25 2.982416987  192.168.1.1 → 239.255.255.250 SSDP 350 NOTIFY * HTTP/1.1 
   26 2.982974600  192.168.1.1 → 239.255.255.250 SSDP 382 NOTIFY * HTTP/1.1 
   27 2.983510582  192.168.1.1 → 239.255.255.250 SSDP 364 NOTIFY * HTTP/1.1 
   28 2.984054671  192.168.1.1 → 239.255.255.250 SSDP 366 NOTIFY * HTTP/1.1 
   29 3.925906797 192.168.1.16 → 239.255.255.250 SSDP 213 M-SEARCH * HTTP/1.1 
   30 4.926615171 192.168.1.16 → 239.255.255.250 SSDP 213 M-SEARCH * HTTP/1.1 
   31 5.927428422 192.168.1.16 → 239.255.255.250 SSDP 213 M-SEARCH * HTTP/1.1 
   32 9.619393864 192.168.1.16 → 10.6.15.144  SSH 1514 Client: Encrypted packet (len=1448)
   33 9.626252215 192.168.1.16 → 10.6.15.144  SSH 294 Client: Encrypted packet (len=228)
   34 9.633903195  10.6.15.144 → 192.168.1.16 TCP 66 22 → 59298 [ACK] Seq=309 Ack=1449 Win=1452 Len=0 TSval=5641478 TSecr=5045117
   35 9.636212119  10.6.15.144 → 192.168.1.16 TCP 66 22 → 59298 [ACK] Seq=309 Ack=1677 Win=1452 Len=0 TSval=5641479 TSecr=5045119
   36 9.640894894  10.6.15.144 → 192.168.1.16 SSH 134 Server: Encrypted packet (len=68)
   37 9.640912111 192.168.1.16 → 10.6.15.144  TCP 66 59298 → 22 [ACK] Seq=1677 Ack=377 Win=5703 Len=0 TSval=5045122 TSecr=5641480
   38 10.976001887  10.6.15.144 → 192.168.1.16 SSH 958 Server: Encrypted packet (len=892)
   39 10.976031967 192.168.1.16 → 10.6.15.144  TCP 66 59298 → 22 [ACK] Seq=1677 Ack=1269 Win=5703 Len=0 TSval=5045456 TSecr=5641509
   40 10.976470161  10.6.15.144 → 192.168.1.16 SSH 422 Server: Encrypted packet (len=356)
   41 10.976480299 192.168.1.16 → 10.6.15.144  TCP 66 59298 → 22 [ACK] Seq=1677 Ack=1625 Win=5703 Len=0 TSval=5045456 TSecr=5641509
   42 10.976948994  10.6.15.144 → 192.168.1.16 SSH 422 Server: [TCP Spurious Retransmission] , Encrypted packet (len=356)
   43 10.976959576 192.168.1.16 → 10.6.15.144  TCP 78 [TCP Dup ACK 41#1] 59298 → 22 [ACK] Seq=1677 Ack=1625 Win=5703 Len=0 TSval=5045456 TSecr=5641549 SLE=1269 SRE=1625
   44 10.977196406 192.168.1.16 → 10.6.15.144  SSH 134 Client: Encrypted packet (len=68)
   45 10.977606493  10.6.15.144 → 192.168.1.16 SSH 1314 Server: [TCP Spurious Retransmission] , Encrypted packet (len=1248)
   46 10.977617394 192.168.1.16 → 10.6.15.144  TCP 78 [TCP Dup ACK 41#2] 59298 → 22 [ACK] Seq=1745 Ack=1625 Win=5703 Len=0 TSval=5045456 TSecr=5641701 SLE=377 SRE=1625
   47 11.025921703  10.6.15.144 → 192.168.1.16 TCP 66 22 → 59298 [ACK] Seq=1625 Ack=1745 Win=1452 Len=0 TSval=5641827 TSecr=5045456
   48 18.663120359 192.168.1.16 → 192.168.1.1  DNS 81 Standard query 0x58c2 A 1.ubuntu.pool.ntp.org
   49 18.674877283  192.168.1.1 → 192.168.1.16 DNS 145 Standard query response 0x58c2 A 1.ubuntu.pool.ntp.org A 139.59.21.22 A 139.59.50.38 A 123.108.200.124 A 52.66.5.185
   50 18.675407824 192.168.1.16 → 139.59.21.22 NTP 90 NTP Version 4, client
   51 21.663414265 192.168.1.16 → 192.168.1.1  DNS 81 Standard query 0xe2d6 A 0.ubuntu.pool.ntp.org
   52 21.674183201  192.168.1.1 → 192.168.1.16 DNS 145 Standard query response 0xe2d6 A 0.ubuntu.pool.ntp.org A 139.59.21.22 A 52.66.5.185 A 13.126.27.131 A 123.108.200.124
   53 21.674766009 192.168.1.16 → 139.59.21.22 NTP 90 NTP Version 4, client
   54 28.573904013 192.168.1.16 → 54.76.71.168 TCP 66 42414 → 8282 [ACK] Seq=1 Ack=1 Win=296 Len=0 TSval=5049856 TSecr=609138704
   55 28.575661689 10.22.16.141 → 224.0.0.252  LLMNR 64 Standard query 0xdf08 A wpad
   56 28.662190807 192.168.1.16 → 192.168.1.1  DNS 81 Standard query 0x0cd5 A 3.ubuntu.pool.ntp.org
   57 28.672021770  192.168.1.1 → 192.168.1.16 DNS 145 Standard query response 0x0cd5 A 3.ubuntu.pool.ntp.org A 13.126.27.131 A 139.59.50.38 A 52.66.5.185 A 123.108.200.124
   58 28.672511545 192.168.1.16 → 13.126.27.131 NTP 90 NTP Version 4, client
   59 28.707304921 10.22.16.141 → 224.0.0.252  LLMNR 64 Standard query 0xdf08 A wpad
   60 28.736459573 54.76.71.168 → 192.168.1.16 TCP 66 [TCP ACKed unseen segment] 8282 → 42414 [ACK] Seq=1 Ack=2 Win=121 Len=0 TSval=609161831 TSecr=5026728
   61 29.984279185  10.6.15.144 → 192.168.1.16 SSH 534 Server: Encrypted packet (len=468)
   62 29.984343804 192.168.1.16 → 10.6.15.144  TCP 66 59298 → 22 [ACK] Seq=1745 Ack=2093 Win=5703 Len=0 TSval=5050208 TSecr=5646329
   63 29.984743722  10.6.15.144 → 192.168.1.16 SSH 534 Server: [TCP Spurious Retransmission] , Encrypted packet (len=468)
   64 29.984768650 192.168.1.16 → 10.6.15.144  TCP 78 [TCP Dup ACK 62#1] 59298 → 22 [ACK] Seq=1745 Ack=2093 Win=5703 Len=0 TSval=5050208 TSecr=5646463 SLE=1625 SRE=2093
   65 30.239049172 192.168.1.16 → 10.6.15.144  SSH 1406 Client: Encrypted packet (len=1340)
   66 30.246478233  10.6.15.144 → 192.168.1.16 TCP 66 22 → 59298 [ACK] Seq=2093 Ack=3085 Win=1452 Len=0 TSval=5646633 TSecr=5050272
   67 30.256343568  10.6.15.144 → 192.168.1.16 SSH 134 Server: Encrypted packet (len=68)
   68 30.256360011 192.168.1.16 → 10.6.15.144  TCP 66 59298 → 22 [ACK] Seq=3085 Ack=2161 Win=5703 Len=0 TSval=5050276 TSecr=5646634
   69 30.423146246 192.168.1.16 → 10.6.15.144  SSH 614 Client: Encrypted packet (len=548)
   70 30.437957191  10.6.15.144 → 192.168.1.16 SSH 182 Server: Encrypted packet (len=116)
   71 30.437996204 192.168.1.16 → 10.6.15.144  TCP 66 59298 → 22 [ACK] Seq=3633 Ack=2277 Win=5703 Len=0 TSval=5050322 TSecr=5646680
   72 30.439468805  10.6.15.144 → 192.168.1.16 SSH 1514 Server: Encrypted packet (len=1448)
   73 30.439495650 192.168.1.16 → 10.6.15.144  TCP 66 59298 → 22 [ACK] Seq=3633 Ack=3725 Win=5703 Len=0 TSval=5050322 TSecr=5646680
   74 30.439803623  10.6.15.144 → 192.168.1.16 SSH 78 Server: Encrypted packet (len=12)
   75 30.439817229 192.168.1.16 → 10.6.15.144  TCP 66 59298 → 22 [ACK] Seq=3633 Ack=3737 Win=5703 Len=0 TSval=5050322 TSecr=5646680
   76 30.447241458  10.6.15.144 → 192.168.1.16 SSH 1514 Server: Encrypted packet (len=1448)
   77 30.447261526 192.168.1.16 → 10.6.15.144  TCP 66 59298 → 22 [ACK] Seq=3633 Ack=5185 Win=5703 Len=0 TSval=5050324 TSecr=5646682
   78 30.448427561  10.6.15.144 → 192.168.1.16 SSH 1514 Server: Encrypted packet (len=1448)
   79 30.448447868 192.168.1.16 → 10.6.15.144  TCP 66 59298 → 22 [ACK] Seq=3633 Ack=6633 Win=5703 Len=0 TSval=5050324 TSecr=5646682
   80 30.449163646  10.6.15.144 → 192.168.1.16 SSH 994 Server: Encrypted packet (len=928)
   81 30.449183745 192.168.1.16 → 10.6.15.144  TCP 66 59298 → 22 [ACK] Seq=3633 Ack=7561 Win=5703 Len=0 TSval=5050324 TSecr=5646683
   82 30.449880342 192.168.1.16 → 10.6.15.144  SSH 134 Client: Encrypted packet (len=68)
   83 30.501287885  10.6.15.144 → 192.168.1.16 TCP 66 22 → 59298 [ACK] Seq=7561 Ack=3701 Win=1452 Len=0 TSval=5646696 TSecr=5050325
   84 30.519323537  10.6.15.144 → 192.168.1.16 SSH 174 Server: Encrypted packet (len=108)
   85 30.520510844 192.168.1.16 → 10.6.15.144  SSH 134 Client: Encrypted packet (len=68)
   86 30.527910086  10.6.15.144 → 192.168.1.16 TCP 66 22 → 59298 [ACK] Seq=7669 Ack=3769 Win=1452 Len=0 TSval=5646703 TSecr=5050342
   87 41.983966322  10.22.18.21 → 224.0.0.252  LLMNR 64 Standard query 0x84cf ANY Aman
   88 41.984422796  10.6.15.144 → 192.168.1.16 SSH 550 Server: Encrypted packet (len=484)
   89 41.984761076  10.22.18.21 → 224.0.0.252  LLMNR 64 Standard query 0x84cf ANY Aman
   90 42.025898717 192.168.1.16 → 10.6.15.144  TCP 66 59298 → 22 [ACK] Seq=3769 Ack=8153 Win=5703 Len=0 TSval=5053219 TSecr=5649500
   91 42.167652689 192.168.1.16 → 54.76.71.168 TCP 128 [TCP Previous segment not captured] 42414 → 8282 [PSH, ACK] Seq=2 Ack=1 Win=296 Len=62 TSval=5053254 TSecr=609161831
   92 42.239300704 192.168.1.16 → 10.6.15.144  SSH 254 Client: Encrypted packet (len=188)
   93 42.240699466 192.168.1.16 → 10.6.15.144  SSH 1238 Client: Encrypted packet (len=1172)
   94 42.253660114  10.6.15.144 → 192.168.1.16 TCP 66 22 → 59298 [ACK] Seq=8153 Ack=3957 Win=1452 Len=0 TSval=5649634 TSecr=5053272
   95 42.254042319  10.6.15.144 → 192.168.1.16 TCP 66 22 → 59298 [ACK] Seq=8153 Ack=5129 Win=1452 Len=0 TSval=5649634 TSecr=5053272
   96 42.256514823  10.6.15.144 → 192.168.1.16 SSH 134 Server: Encrypted packet (len=68)
   97 42.256540371 192.168.1.16 → 10.6.15.144  TCP 66 59298 → 22 [ACK] Seq=5129 Ack=8221 Win=5703 Len=0 TSval=5053276 TSecr=5649634
   98 42.330543319 54.76.71.168 → 192.168.1.16 TCP 66 [TCP ACKed unseen segment] 8282 → 42414 [ACK] Seq=1 Ack=64 Win=121 Len=0 TSval=609165230 TSecr=5053254
   99 42.400980845 192.168.1.16 → 10.6.15.144  SSH 622 Client: Encrypted packet (len=556)
  100 42.411552086  10.6.15.144 → 192.168.1.16 SSH 182 Server: Encrypted packet (len=116)
  101 42.411579686 192.168.1.16 → 10.6.15.144  TCP 66 59298 → 22 [ACK] Seq=5685 Ack=8337 Win=5703 Len=0 TSval=5053315 TSecr=5649673
  102 42.412612944  10.6.15.144 → 192.168.1.16 SSH 1514 Server: Encrypted packet (len=1448)
  103 42.412631731 192.168.1.16 → 10.6.15.144  TCP 66 59298 → 22 [ACK] Seq=5685 Ack=9785 Win=5703 Len=0 TSval=5053315 TSecr=5649673
  104 42.413007426  10.6.15.144 → 192.168.1.16 SSH 78 Server: Encrypted packet (len=12)
  105 42.413025085 192.168.1.16 → 10.6.15.144  TCP 66 59298 → 22 [ACK] Seq=5685 Ack=9797 Win=5703 Len=0 TSval=5053315 TSecr=5649673
  106 42.420646004  10.6.15.144 → 192.168.1.16 SSH 1514 Server: Encrypted packet (len=1448)
  107 42.420663855 192.168.1.16 → 10.6.15.144  TCP 66 59298 → 22 [ACK] Seq=5685 Ack=11245 Win=5703 Len=0 TSval=5053317 TSecr=5649676
  108 42.421377896  10.6.15.144 → 192.168.1.16 SSH 1514 Server: Encrypted packet (len=1448)
  109 42.421394728 192.168.1.16 → 10.6.15.144  TCP 66 59298 → 22 [ACK] Seq=5685 Ack=12693 Win=5703 Len=0 TSval=5053317 TSecr=5649676
  110 42.421907466  10.6.15.144 → 192.168.1.16 SSH 1326 Server: Encrypted packet (len=1260)
  111 42.421925258 192.168.1.16 → 10.6.15.144  TCP 66 59298 → 22 [ACK] Seq=5685 Ack=13953 Win=5703 Len=0 TSval=5053318 TSecr=5649676
  112 42.422492520 192.168.1.16 → 10.6.15.144  SSH 134 Client: Encrypted packet (len=68)
  113 42.467503571  10.6.15.144 → 192.168.1.16 TCP 66 22 → 59298 [ACK] Seq=13953 Ack=5753 Win=1452 Len=0 TSval=5649688 TSecr=5053318
  114 42.494330273  10.6.15.144 → 192.168.1.16 SSH 166 Server: Encrypted packet (len=100)
  115 42.494865986 192.168.1.16 → 10.6.15.144  SSH 134 Client: Encrypted packet (len=68)
  116 42.501901159  10.6.15.144 → 192.168.1.16 TCP 66 22 → 59298 [ACK] Seq=14053 Ack=5821 Win=1452 Len=0 TSval=5649696 TSecr=5053336
