    1 0.000000000  10.6.15.156 → 192.168.1.12 SSH 282 Server: Encrypted packet (len=216)
    2 0.000026678 192.168.1.12 → 10.6.15.156  TCP 66 54766 → 22 [ACK] Seq=1 Ack=217 Win=2901 Len=0 TSval=7512466 TSecr=14443959
    3 0.000505045 192.168.1.12 → 10.6.15.156  SSH 174 Client: Encrypted packet (len=108)
    4 0.001187893  10.6.15.156 → 192.168.1.12 SSH 138 Server: Encrypted packet (len=72)
    5 0.001330208  10.6.15.156 → 192.168.1.12 SSH 126 Server: Encrypted packet (len=60)
    6 0.001351179  10.6.15.156 → 192.168.1.12 SSH 138 Server: Encrypted packet (len=72)
    7 0.001374782 192.168.1.12 → 10.6.15.156  TCP 66 54766 → 22 [ACK] Seq=109 Ack=421 Win=2901 Len=0 TSval=7512466 TSecr=14443959
    8 0.001713728 192.168.1.12 → 10.6.15.156  SSH 138 Client: Encrypted packet (len=72)
    9 0.003128348  10.6.15.156 → 192.168.1.12 TCP 66 22 → 54766 [ACK] Seq=421 Ack=181 Win=1452 Len=0 TSval=14443960 TSecr=7512466
   10 0.004635383  10.6.15.156 → 192.168.1.12 SSH 102 Server: Encrypted packet (len=36)
   11 0.005000727 192.168.1.12 → 10.6.15.156  SSH 158 Client: Encrypted packet (len=92)
   12 0.008683006  10.6.15.156 → 192.168.1.12 SSH 138 Server: Encrypted packet (len=72)
   13 0.008929904 192.168.1.12 → 10.6.15.156  SSH 102 Client: Encrypted packet (len=36)
   14 0.015309597  10.6.15.156 → 192.168.1.12 SSH 138 Server: Encrypted packet (len=72)
   15 0.015557309 192.168.1.12 → 10.6.15.156  SSH 102 Client: Encrypted packet (len=36)
   16 0.055369442  10.6.15.156 → 192.168.1.12 TCP 66 22 → 54766 [ACK] Seq=601 Ack=345 Win=1452 Len=0 TSval=14443973 TSecr=7512470
   17 0.145580155 192.168.1.12 → 10.6.15.156  SSH 862 Client: Encrypted packet (len=796)
   18 0.146131723 192.168.1.12 → 10.6.15.156  SSH 162 Client: Encrypted packet (len=96)
   19 0.147674805  10.6.15.156 → 192.168.1.12 TCP 66 22 → 54766 [ACK] Seq=601 Ack=1237 Win=1452 Len=0 TSval=14443996 TSecr=7512502
   20 0.227748482 192.168.1.12 → 139.59.50.38 NTP 90 NTP Version 4, client
   21 0.250475715  10.6.15.156 → 192.168.1.12 SSH 138 Server: Encrypted packet (len=72)
   22 0.250739503 192.168.1.12 → 10.6.15.156  SSH 102 Client: Encrypted packet (len=36)
   23 0.252282815  10.6.15.156 → 192.168.1.12 TCP 66 22 → 54766 [ACK] Seq=673 Ack=1273 Win=1452 Len=0 TSval=14444022 TSecr=7512529
   24 0.256272513  10.6.15.156 → 192.168.1.12 SSH 1514 Server: Encrypted packet (len=1448)
   25 0.256412726  10.6.15.156 → 192.168.1.12 SSH 1514 Server: Encrypted packet (len=1448)
   26 0.256424077 192.168.1.12 → 10.6.15.156  TCP 66 54766 → 22 [ACK] Seq=1273 Ack=3569 Win=2901 Len=0 TSval=7512530 TSecr=14444023
   27 0.256754435  10.6.15.156 → 192.168.1.12 SSH 1390 Server: Encrypted packet (len=1324)
   28 0.258614060  10.6.15.156 → 192.168.1.12 SSH 1514 Server: Encrypted packet (len=1448)
   29 0.258632584 192.168.1.12 → 10.6.15.156  TCP 66 54766 → 22 [ACK] Seq=1273 Ack=6341 Win=2901 Len=0 TSval=7512531 TSecr=14444023
   30 0.258795257  10.6.15.156 → 192.168.1.12 SSH 1514 Server: Encrypted packet (len=1448)
   31 0.258986984  10.6.15.156 → 192.168.1.12 SSH 1514 Server: Encrypted packet (len=1448)
   32 0.258995304 192.168.1.12 → 10.6.15.156  TCP 66 54766 → 22 [ACK] Seq=1273 Ack=9237 Win=2901 Len=0 TSval=7512531 TSecr=14444023
   33 0.259179133  10.6.15.156 → 192.168.1.12 SSH 1514 Server: Encrypted packet (len=1448)
   34 0.259379140  10.6.15.156 → 192.168.1.12 SSH 1514 Server: Encrypted packet (len=1448)
   35 0.259386103 192.168.1.12 → 10.6.15.156  TCP 66 54766 → 22 [ACK] Seq=1273 Ack=12133 Win=2901 Len=0 TSval=7512531 TSecr=14444023
   36 0.259569104  10.6.15.156 → 192.168.1.12 SSH 1514 Server: Encrypted packet (len=1448)
   37 0.259753291  10.6.15.156 → 192.168.1.12 SSH 1514 Server: Encrypted packet (len=1448)
   38 0.259760076 192.168.1.12 → 10.6.15.156  TCP 66 54766 → 22 [ACK] Seq=1273 Ack=15029 Win=2901 Len=0 TSval=7512531 TSecr=14444023
   39 0.259901591  10.6.15.156 → 192.168.1.12 SSH 206 Server: Encrypted packet (len=140)
   40 0.260142345 192.168.1.12 → 10.6.15.156  SSH 102 Client: Encrypted packet (len=36)
   41 0.299454432  10.6.15.156 → 192.168.1.12 TCP 66 22 → 54766 [ACK] Seq=15169 Ack=1309 Win=1452 Len=0 TSval=14444034 TSecr=7512531
   42 0.362572409  10.6.15.156 → 192.168.1.12 SSH 102 Server: Encrypted packet (len=36)
   43 0.362870283 192.168.1.12 → 10.6.15.156  SSH 214 Client: Encrypted packet (len=148)
   44 0.364793020  10.6.15.156 → 192.168.1.12 TCP 66 22 → 54766 [ACK] Seq=15205 Ack=1457 Win=1452 Len=0 TSval=14444050 TSecr=7512557
   45 0.364979428  10.6.15.156 → 192.168.1.12 SSH 454 Server: Encrypted packet (len=388)
   46 0.367810518 192.168.1.12 → 10.6.15.156  SSH 862 Client: Encrypted packet (len=796)
   47 0.407327520  10.6.15.156 → 192.168.1.12 TCP 66 22 → 54766 [ACK] Seq=15593 Ack=2253 Win=1452 Len=0 TSval=14444061 TSecr=7512558
   48 0.472115518  10.6.15.156 → 192.168.1.12 SSH 1514 Server: Encrypted packet (len=1448)
   49 0.472307471  10.6.15.156 → 192.168.1.12 SSH 1514 Server: Encrypted packet (len=1448)
   50 0.472317306 192.168.1.12 → 10.6.15.156  TCP 66 54766 → 22 [ACK] Seq=2253 Ack=18489 Win=2901 Len=0 TSval=7512584 TSecr=14444076
   51 0.473046123  10.6.15.156 → 192.168.1.12 SSH 1514 Server: Encrypted packet (len=1448)
   52 0.473056558  10.6.15.156 → 192.168.1.12 SSH 1514 Server: Encrypted packet (len=1448)
   53 0.473065685 192.168.1.12 → 10.6.15.156  TCP 66 54766 → 22 [ACK] Seq=2253 Ack=21385 Win=2901 Len=0 TSval=7512584 TSecr=14444076
   54 0.473075340  10.6.15.156 → 192.168.1.12 SSH 126 Server: Encrypted packet (len=60)
   55 0.473368849  10.6.15.156 → 192.168.1.12 SSH 1514 Server: Encrypted packet (len=1448)
   56 0.473377030 192.168.1.12 → 10.6.15.156  TCP 66 54766 → 22 [ACK] Seq=2253 Ack=22893 Win=2901 Len=0 TSval=7512584 TSecr=14444077
   57 0.473559054  10.6.15.156 → 192.168.1.12 SSH 1514 Server: Encrypted packet (len=1448)
   58 0.473568322  10.6.15.156 → 192.168.1.12 SSH 118 Server: Encrypted packet (len=52)
   59 0.473573545 192.168.1.12 → 10.6.15.156  TCP 66 54766 → 22 [ACK] Seq=2253 Ack=24393 Win=2901 Len=0 TSval=7512584 TSecr=14444077
   60 0.578853201  10.6.15.156 → 192.168.1.12 SSH 238 Server: Encrypted packet (len=172)
   61 0.579221502 192.168.1.12 → 10.6.15.156  SSH 134 Client: Encrypted packet (len=68)
   62 0.580770169  10.6.15.156 → 192.168.1.12 TCP 66 22 → 54766 [ACK] Seq=24565 Ack=2321 Win=1452 Len=0 TSval=14444104 TSecr=7512611
   63 0.585302080 192.168.1.12 → 10.6.15.156  SSH 102 Client: Encrypted packet (len=36)
   64 0.585534553 192.168.1.12 → 10.6.15.156  SSH 118 Client: Encrypted packet (len=52)
   65 0.586633489  10.6.15.156 → 192.168.1.12 TCP 66 22 → 54766 [ACK] Seq=24565 Ack=2357 Win=1452 Len=0 TSval=14444105 TSecr=7512612
   66 0.586645844  10.6.15.156 → 192.168.1.12 TCP 66 22 → 54766 [ACK] Seq=24565 Ack=2409 Win=1452 Len=0 TSval=14444105 TSecr=7512612
   67 0.586869270  10.6.15.156 → 192.168.1.12 SSH 454 Server: Encrypted packet (len=388)
   68 0.629921740 192.168.1.12 → 10.6.15.156  TCP 66 54766 → 22 [ACK] Seq=2409 Ack=24953 Win=2901 Len=0 TSval=7512624 TSecr=14444105
   69 0.685460473  10.6.15.156 → 192.168.1.12 SSH 206 Server: Encrypted packet (len=140)
   70 0.685542177 192.168.1.12 → 10.6.15.156  TCP 66 54766 → 22 [ACK] Seq=2409 Ack=25093 Win=2901 Len=0 TSval=7512637 TSecr=14444130
   71 0.688907960  10.6.15.156 → 192.168.1.12 SSH 138 Server: Encrypted packet (len=72)
   72 0.688990534 192.168.1.12 → 10.6.15.156  TCP 66 54766 → 22 [ACK] Seq=2409 Ack=25165 Win=2901 Len=0 TSval=7512638 TSecr=14444131
   73 0.689189107 192.168.1.12 → 10.6.15.156  SSH 102 Client: Encrypted packet (len=36)
   74 0.727438658  10.6.15.156 → 192.168.1.12 TCP 66 22 → 54766 [ACK] Seq=25165 Ack=2445 Win=1452 Len=0 TSval=14444141 TSecr=7512638
   75 0.727457045 192.168.1.12 → 10.6.15.156  SSH 146 Client: Encrypted packet (len=80)
   76 0.729491486  10.6.15.156 → 192.168.1.12 TCP 66 22 → 54766 [ACK] Seq=25165 Ack=2525 Win=1452 Len=0 TSval=14444141 TSecr=7512648
   77 0.803815414  10.6.15.156 → 192.168.1.12 SSH 110 Server: Encrypted packet (len=44)
   78 0.804176601 192.168.1.12 → 10.6.15.156  SSH 206 Client: Encrypted packet (len=140)
   79 0.806368915  10.6.15.156 → 192.168.1.12 TCP 66 22 → 54766 [ACK] Seq=25209 Ack=2665 Win=1452 Len=0 TSval=14444160 TSecr=7512667
   80 0.811130581 192.168.1.12 → 10.6.15.156  SSH 102 Client: Encrypted packet (len=36)
   81 0.812642500  10.6.15.156 → 192.168.1.12 TCP 66 22 → 54766 [ACK] Seq=25209 Ack=2701 Win=1452 Len=0 TSval=14444162 TSecr=7512669
   82 0.814459751 192.168.1.12 → 10.6.15.156  SSH 102 Client: Encrypted packet (len=36)
   83 0.815873056  10.6.15.156 → 192.168.1.12 TCP 66 22 → 54766 [ACK] Seq=25209 Ack=2737 Win=1452 Len=0 TSval=14444163 TSecr=7512670
   84 0.835079594  10.6.15.156 → 192.168.1.12 SSH 138 Server: Encrypted packet (len=72)
   85 0.835337546 192.168.1.12 → 10.6.15.156  SSH 102 Client: Encrypted packet (len=36)
   86 0.862433056  10.6.15.156 → 192.168.1.12 SSH 138 Server: Encrypted packet (len=72)
   87 0.862658404 192.168.1.12 → 10.6.15.156  SSH 102 Client: Encrypted packet (len=36)
   88 0.906689780  10.6.15.156 → 192.168.1.12 TCP 66 22 → 54766 [ACK] Seq=25353 Ack=2809 Win=1452 Len=0 TSval=14444185 TSecr=7512682
   89 0.906711825 192.168.1.12 → 10.6.15.156  SSH 766 Client: Encrypted packet (len=700)
   90 0.913853438  10.6.15.156 → 192.168.1.12 TCP 66 22 → 54766 [ACK] Seq=25353 Ack=3509 Win=1452 Len=0 TSval=14444186 TSecr=7512693
   91 0.914144163 192.168.1.12 → 10.6.15.156  SSH 318 Client: Encrypted packet (len=252)
   92 0.918175750  10.6.15.156 → 192.168.1.12 TCP 66 22 → 54766 [ACK] Seq=25353 Ack=3761 Win=1452 Len=0 TSval=14444188 TSecr=7512695
   93 0.922057766  10.6.15.156 → 192.168.1.12 SSH 142 Server: Encrypted packet (len=76)
   94 0.946213580  10.6.15.156 → 192.168.1.12 SSH 102 Server: Encrypted packet (len=36)
   95 0.946293551 192.168.1.12 → 10.6.15.156  TCP 66 54766 → 22 [ACK] Seq=3761 Ack=25465 Win=2901 Len=0 TSval=7512703 TSecr=14444188
   96 0.946769133 192.168.1.12 → 10.6.15.156  SSH 246 Client: Encrypted packet (len=180)
   97 0.990429910  10.6.15.156 → 192.168.1.12 TCP 66 22 → 54766 [ACK] Seq=25465 Ack=3941 Win=1452 Len=0 TSval=14444206 TSecr=7512703
   98 0.999305498  10.6.15.156 → 192.168.1.12 SSH 138 Server: Encrypted packet (len=72)
   99 0.999555727 192.168.1.12 → 10.6.15.156  SSH 102 Client: Encrypted packet (len=36)
  100 1.001760463  10.6.15.156 → 192.168.1.12 TCP 66 22 → 54766 [ACK] Seq=25537 Ack=3977 Win=1452 Len=0 TSval=14444209 TSecr=7512716
  101 1.001953057  10.6.15.156 → 192.168.1.12 SSH 526 Server: Encrypted packet (len=460)
  102 1.002905903 192.168.1.12 → 10.6.15.156  SSH 134 Client: Encrypted packet (len=68)
  103 1.024533077  10.6.15.156 → 192.168.1.12 SSH 238 Server: Encrypted packet (len=172)
  104 1.024551649 192.168.1.12 → 10.6.15.156  SSH 646 Client: Encrypted packet (len=580)
  105 1.029868206  10.6.15.156 → 192.168.1.12 SSH 374 Server: Encrypted packet (len=308)
  106 1.030162139 192.168.1.12 → 10.6.15.156  SSH 102 Client: Encrypted packet (len=36)
  107 1.031745918  10.6.15.156 → 192.168.1.12 SSH 102 Server: Encrypted packet (len=36)
  108 1.032251632 192.168.1.12 → 10.6.15.156  SSH 134 Client: Encrypted packet (len=68)
  109 1.071264601  10.6.15.156 → 192.168.1.12 TCP 66 22 → 54766 [ACK] Seq=26513 Ack=4729 Win=1452 Len=0 TSval=14444227 TSecr=7512724
  110 1.071279186 192.168.1.12 → 10.6.15.156  SSH 514 Client: Encrypted packet (len=448)
  111 1.071905043 192.168.1.12 → 224.0.0.252  LLMNR 61 Standard query 0x21f2 A x
  112 1.073784414  10.6.15.156 → 192.168.1.12 TCP 66 22 → 54766 [ACK] Seq=26513 Ack=5177 Win=1452 Len=0 TSval=14444227 TSecr=7512734
  113 1.075015736  10.6.15.156 → 192.168.1.12 SSH 138 Server: Encrypted packet (len=72)
  114 1.075261474 192.168.1.12 → 10.6.15.156  SSH 102 Client: Encrypted packet (len=36)
  115 1.076013866  10.6.15.156 → 192.168.1.12 SSH 174 Server: Encrypted packet (len=108)
  116 1.115294636  10.6.15.156 → 192.168.1.12 TCP 66 22 → 54766 [ACK] Seq=26693 Ack=5213 Win=1452 Len=0 TSval=14444238 TSecr=7512735
  117 1.115310790 192.168.1.12 → 10.6.15.156  SSH 102 Client: Encrypted packet (len=36)
  118 1.118871723  10.6.15.156 → 192.168.1.12 TCP 66 22 → 54766 [ACK] Seq=26693 Ack=5249 Win=1452 Len=0 TSval=14444238 TSecr=7512745
  119 1.126897721  10.6.15.156 → 192.168.1.12 SSH 178 Server: Encrypted packet (len=112)
  120 1.127321390 192.168.1.12 → 10.6.15.156  SSH 486 Client: Encrypted packet (len=420)
  121 1.136546547  10.6.15.156 → 192.168.1.12 SSH 862 Server: Encrypted packet (len=796)
  122 1.150044392 192.168.1.12 → 10.6.15.156  SSH 102 Client: Encrypted packet (len=36)
  123 1.150275774 192.168.1.12 → 10.6.15.156  SSH 102 Client: Encrypted packet (len=36)
  124 1.152116527  10.6.15.156 → 192.168.1.12 TCP 66 22 → 54766 [ACK] Seq=27601 Ack=5741 Win=1452 Len=0 TSval=14444247 TSecr=7512754
  125 1.154310319  10.6.15.156 → 192.168.1.12 SSH 138 Server: Encrypted packet (len=72)
  126 1.154498756 192.168.1.12 → 10.6.15.156  SSH 102 Client: Encrypted packet (len=36)
  127 1.176684655  10.6.15.156 → 192.168.1.12 SSH 606 Server: Encrypted packet (len=540)
  128 1.184824459 192.168.1.12 → 10.6.15.156  SSH 198 Client: Encrypted packet (len=132)
  129 1.223324360  10.6.15.156 → 192.168.1.12 TCP 66 22 → 54766 [ACK] Seq=28213 Ack=5909 Win=1452 Len=0 TSval=14444265 TSecr=7512762
  130 1.242546009  10.6.15.156 → 192.168.1.12 SSH 102 Server: Encrypted packet (len=36)
  131 1.242843977 192.168.1.12 → 10.6.15.156  SSH 206 Client: Encrypted packet (len=140)
  132 1.244613613  10.6.15.156 → 192.168.1.12 TCP 66 22 → 54766 [ACK] Seq=28249 Ack=6049 Win=1452 Len=0 TSval=14444270 TSecr=7512777
  133 1.251346582  10.6.15.156 → 192.168.1.12 SSH 102 Server: Encrypted packet (len=36)
  134 1.251636425 192.168.1.12 → 10.6.15.156  SSH 182 Client: Encrypted packet (len=116)
  135 1.288816855  10.6.15.156 → 192.168.1.12 SSH 138 Server: Encrypted packet (len=72)
  136 1.289042736 192.168.1.12 → 10.6.15.156  SSH 102 Client: Encrypted packet (len=36)
  137 1.292296087  10.6.15.156 → 192.168.1.12 SSH 110 Server: Encrypted packet (len=44)
  138 1.297921978  10.6.15.156 → 192.168.1.12 SSH 102 Server: Encrypted packet (len=36)
  139 1.298000182 192.168.1.12 → 10.6.15.156  TCP 66 54766 → 22 [ACK] Seq=6201 Ack=28437 Win=2901 Len=0 TSval=7512791 TSecr=14444282
  140 1.298428117 192.168.1.12 → 10.6.15.156  SSH 230 Client: Encrypted packet (len=164)
  141 1.314861930  10.6.15.156 → 192.168.1.12 SSH 174 Server: Encrypted packet (len=108)
  142 1.316280285  10.6.15.156 → 192.168.1.12 SSH 1514 Server: Encrypted packet (len=1448)
  143 1.316301758 192.168.1.12 → 10.6.15.156  TCP 66 54766 → 22 [ACK] Seq=6365 Ack=29993 Win=2901 Len=0 TSval=7512795 TSecr=14444287
  144 1.316322961  10.6.15.156 → 192.168.1.12 SSH 110 Server: Encrypted packet (len=44)
  145 1.316609742  10.6.15.156 → 192.168.1.12 SSH 1374 Server: Encrypted packet (len=1308)
  146 1.316649936 192.168.1.12 → 10.6.15.156  TCP 66 54766 → 22 [ACK] Seq=6365 Ack=31345 Win=2901 Len=0 TSval=7512795 TSecr=14444288
  147 1.321901019 192.168.1.12 → 224.0.0.252  LLMNR 61 Standard query 0x21f2 A x
  148 1.347071848  10.6.15.156 → 192.168.1.12 SSH 326 Server: Encrypted packet (len=260)
  149 1.368067745  10.6.15.156 → 192.168.1.12 SSH 110 Server: Encrypted packet (len=44)
  150 1.368146541 192.168.1.12 → 10.6.15.156  TCP 66 54766 → 22 [ACK] Seq=6365 Ack=31649 Win=2901 Len=0 TSval=7512808 TSecr=14444295
  151 1.431818235  10.6.15.156 → 192.168.1.12 SSH 158 Server: Encrypted packet (len=92)
  152 1.433979309  10.6.15.156 → 192.168.1.12 SSH 1514 Server: Encrypted packet (len=1448)
  153 1.433995322 192.168.1.12 → 10.6.15.156  TCP 66 54766 → 22 [ACK] Seq=6365 Ack=33189 Win=2901 Len=0 TSval=7512825 TSecr=14444317
  154 1.434010270  10.6.15.156 → 192.168.1.12 SSH 118 Server: Encrypted packet (len=52)
  155 1.434740453  10.6.15.156 → 192.168.1.12 SSH 1514 Server: Encrypted packet (len=1448)
  156 1.434749260 192.168.1.12 → 10.6.15.156  TCP 66 54766 → 22 [ACK] Seq=6365 Ack=34689 Win=2901 Len=0 TSval=7512825 TSecr=14444317
  157 1.434929175  10.6.15.156 → 192.168.1.12 SSH 1514 Server: Encrypted packet (len=1448)
  158 1.434933619  10.6.15.156 → 192.168.1.12 SSH 118 Server: Encrypted packet (len=52)
  159 1.434936021 192.168.1.12 → 10.6.15.156  TCP 66 54766 → 22 [ACK] Seq=6365 Ack=36189 Win=2901 Len=0 TSval=7512825 TSecr=14444317
  160 1.435290673  10.6.15.156 → 192.168.1.12 SSH 1514 Server: Encrypted packet (len=1448)
  161 1.435481177  10.6.15.156 → 192.168.1.12 SSH 1514 Server: Encrypted packet (len=1448)
  162 1.435484319 192.168.1.12 → 10.6.15.156  TCP 66 54766 → 22 [ACK] Seq=6365 Ack=39085 Win=2901 Len=0 TSval=7512825 TSecr=14444317
  163 1.435823702  10.6.15.156 → 192.168.1.12 SSH 1502 Server: Encrypted packet (len=1436)
  164 1.455804866 192.168.1.12 → 10.6.15.156  SSH 102 Client: Encrypted packet (len=36)
  165 1.463348850  10.6.15.156 → 192.168.1.12 SSH 190 Server: Encrypted packet (len=124)
  166 1.463375495 192.168.1.12 → 10.6.15.156  SSH 102 Client: Encrypted packet (len=36)
  167 1.481160051  10.6.15.156 → 192.168.1.12 SSH 118 Server: Encrypted packet (len=52)
  168 1.481187216 192.168.1.12 → 10.6.15.156  SSH 502 Client: Encrypted packet (len=436)
  169 1.523306248  10.6.15.156 → 192.168.1.12 TCP 66 22 → 54766 [ACK] Seq=40697 Ack=6873 Win=1452 Len=0 TSval=14444340 TSecr=7512836
  170 1.529793103  10.6.15.156 → 192.168.1.12 SSH 526 Server: Encrypted packet (len=460)
  171 1.569923856 192.168.1.12 → 10.6.15.156  TCP 66 54766 → 22 [ACK] Seq=6873 Ack=41157 Win=2901 Len=0 TSval=7512859 TSecr=14444341
  172 1.571908837 192.168.1.12 → 224.0.0.252  LLMNR 61 Standard query 0x21f2 A x
  173 1.584393203 192.168.1.12 → 10.6.15.156  SSH 102 Client: Encrypted packet (len=36)
  174 1.586402392  10.6.15.156 → 192.168.1.12 TCP 66 22 → 54766 [ACK] Seq=41157 Ack=6909 Win=1452 Len=0 TSval=14444355 TSecr=7512862
  175 1.586419943 192.168.1.12 → 10.6.15.156  SSH 110 Client: Encrypted packet (len=44)
  176 1.587965207  10.6.15.156 → 192.168.1.12 TCP 66 22 → 54766 [ACK] Seq=41157 Ack=6953 Win=1452 Len=0 TSval=14444356 TSecr=7512863
  177 1.674499540  10.6.15.156 → 192.168.1.12 SSH 138 Server: Encrypted packet (len=72)
  178 1.674613945 192.168.1.12 → 10.6.15.156  TCP 66 54766 → 22 [ACK] Seq=6953 Ack=41229 Win=2901 Len=0 TSval=7512885 TSecr=14444377
  179 1.674760863 192.168.1.12 → 10.6.15.156  SSH 102 Client: Encrypted packet (len=36)
  180 1.676554577  10.6.15.156 → 192.168.1.12 TCP 66 22 → 54766 [ACK] Seq=41229 Ack=6989 Win=1452 Len=0 TSval=14444378 TSecr=7512885
  181 1.681650005  10.6.15.156 → 192.168.1.12 SSH 102 Server: Encrypted packet (len=36)
  182 1.701321431  10.6.15.156 → 192.168.1.12 SSH 110 Server: Encrypted packet (len=44)
  183 1.701398862 192.168.1.12 → 10.6.15.156  TCP 66 54766 → 22 [ACK] Seq=6989 Ack=41309 Win=2901 Len=0 TSval=7512891 TSecr=14444379
  184 1.703452169 192.168.1.12 → 10.6.15.156  SSH 270 Client: Encrypted packet (len=204)
  185 1.703665189 192.168.1.12 → 10.6.15.156  SSH 1514 Client: Encrypted packet (len=1448)
  186 1.704483095 192.168.1.12 → 10.6.15.156  SSH 470 Client: Encrypted packet (len=404)
  187 1.706239042  10.6.15.156 → 192.168.1.12 TCP 66 22 → 54766 [ACK] Seq=41309 Ack=9045 Win=1452 Len=0 TSval=14444385 TSecr=7512892
  188 1.709129482  10.6.15.156 → 192.168.1.12 SSH 142 Server: Encrypted packet (len=76)
  189 1.749930155 192.168.1.12 → 10.6.15.156  TCP 66 54766 → 22 [ACK] Seq=9045 Ack=41385 Win=2901 Len=0 TSval=7512904 TSecr=14444386
  190 1.781289369  10.6.15.156 → 192.168.1.12 SSH 158 Server: Encrypted packet (len=92)
  191 1.781372019 192.168.1.12 → 10.6.15.156  TCP 66 54766 → 22 [ACK] Seq=9045 Ack=41477 Win=2901 Len=0 TSval=7512911 TSecr=14444404
  192 1.784722603  10.6.15.156 → 192.168.1.12 SSH 1514 Server: Encrypted packet (len=1448)
  193 1.784886497  10.6.15.156 → 192.168.1.12 SSH 1514 Server: Encrypted packet (len=1448)
  194 1.784895721 192.168.1.12 → 10.6.15.156  TCP 66 54766 → 22 [ACK] Seq=9045 Ack=44373 Win=2901 Len=0 TSval=7512912 TSecr=14444404
  195 1.784981457  10.6.15.156 → 192.168.1.12 SSH 830 Server: Encrypted packet (len=764)
  196 1.785011304 192.168.1.12 → 10.6.15.156  TCP 66 54766 → 22 [ACK] Seq=9045 Ack=45137 Win=2901 Len=0 TSval=7512912 TSecr=14444404
  197 1.803697225  10.6.15.156 → 192.168.1.12 SSH 110 Server: Encrypted packet (len=44)
  198 1.803761959 192.168.1.12 → 10.6.15.156  TCP 66 54766 → 22 [ACK] Seq=9045 Ack=45181 Win=2901 Len=0 TSval=7512917 TSecr=14444410
  199 1.804034755 192.168.1.12 → 10.6.15.156  SSH 414 Client: Encrypted packet (len=348)
  200 1.808337200  10.6.15.156 → 192.168.1.12 SSH 158 Server: Encrypted packet (len=92)
  201 1.810806311  10.6.15.156 → 192.168.1.12 SSH 1514 Server: Encrypted packet (len=1448)
  202 1.810822564 192.168.1.12 → 10.6.15.156  TCP 66 54766 → 22 [ACK] Seq=9393 Ack=46721 Win=2901 Len=0 TSval=7512919 TSecr=14444411
  203 1.810836554  10.6.15.156 → 192.168.1.12 SSH 110 Server: Encrypted packet (len=44)
  204 1.811691413  10.6.15.156 → 192.168.1.12 SSH 1514 Server: Encrypted packet (len=1448)
  205 1.811697670 192.168.1.12 → 10.6.15.156  TCP 66 54766 → 22 [ACK] Seq=9393 Ack=48213 Win=2901 Len=0 TSval=7512919 TSecr=14444411
  206 1.811883368  10.6.15.156 → 192.168.1.12 SSH 1514 Server: Encrypted packet (len=1448)
  207 1.811889349  10.6.15.156 → 192.168.1.12 SSH 118 Server: Encrypted packet (len=52)
  208 1.811892477 192.168.1.12 → 10.6.15.156  TCP 66 54766 → 22 [ACK] Seq=9393 Ack=49713 Win=2901 Len=0 TSval=7512919 TSecr=14444411
  209 1.812252034  10.6.15.156 → 192.168.1.12 SSH 1514 Server: Encrypted packet (len=1448)
  210 1.812572553  10.6.15.156 → 192.168.1.12 SSH 1514 Server: Encrypted packet (len=1448)
  211 1.812578607 192.168.1.12 → 10.6.15.156  TCP 66 54766 → 22 [ACK] Seq=9393 Ack=52609 Win=2901 Len=0 TSval=7512919 TSecr=14444412
  212 1.812764302  10.6.15.156 → 192.168.1.12 SSH 1514 Server: Encrypted packet (len=1448)
  213 1.813092907  10.6.15.156 → 192.168.1.12 SSH 1414 Server: Encrypted packet (len=1348)
  214 1.813096582 192.168.1.12 → 10.6.15.156  TCP 66 54766 → 22 [ACK] Seq=9393 Ack=55405 Win=2901 Len=0 TSval=7512919 TSecr=14444412
  215 1.813299426 192.168.1.12 → 10.6.15.156  SSH 102 Client: Encrypted packet (len=36)
  216 1.827041852  10.6.15.156 → 192.168.1.12 SSH 1094 Server: Encrypted packet (len=1028)
  217 1.827072720  10.6.15.156 → 192.168.1.12 SSH 502 Server: Encrypted packet (len=436)
  218 1.827082867 192.168.1.12 → 10.6.15.156  TCP 66 54766 → 22 [ACK] Seq=9429 Ack=56869 Win=2901 Len=0 TSval=7512923 TSecr=14444415
  219 1.828406844 192.168.1.12 → 10.6.15.156  SSH 142 Client: Encrypted packet (len=76)
  220 1.867233403  10.6.15.156 → 192.168.1.12 TCP 66 22 → 54766 [ACK] Seq=56869 Ack=9505 Win=1452 Len=0 TSval=14444426 TSecr=7512923
  221 1.981144400  10.22.18.61 → 224.0.0.252  LLMNR 64 Standard query 0xa1d1 A wpad
  222 1.981715867  10.22.18.61 → 224.0.0.252  LLMNR 64 Standard query 0xaa7f A wpad
  223 2.027477511  10.6.15.156 → 192.168.1.12 SSH 1514 Server: Encrypted packet (len=1448)
  224 2.027513000  10.6.15.156 → 192.168.1.12 SSH 950 Server: Encrypted packet (len=884)
  225 2.027531146 192.168.1.12 → 10.6.15.156  TCP 66 54766 → 22 [ACK] Seq=9505 Ack=59201 Win=2901 Len=0 TSval=7512973 TSecr=14444465
  226 2.028846040 192.168.1.12 → 10.6.15.156  SSH 214 Client: Encrypted packet (len=148)
  227 2.030714243  10.6.15.156 → 192.168.1.12 TCP 66 22 → 54766 [ACK] Seq=59201 Ack=9653 Win=1452 Len=0 TSval=14444466 TSecr=7512973
  228 2.030735096 192.168.1.12 → 10.6.15.156  SSH 1222 Client: Encrypted packet (len=1156)
  229 2.033209792  10.6.15.156 → 192.168.1.12 TCP 66 22 → 54766 [ACK] Seq=59201 Ack=10809 Win=1452 Len=0 TSval=14444467 TSecr=7512974
  230 2.148428048 192.168.1.12 → 10.6.15.156  SSH 862 Client: Encrypted packet (len=796)
  231 2.150750971  10.6.15.156 → 192.168.1.12 TCP 66 22 → 54766 [ACK] Seq=59201 Ack=11605 Win=1452 Len=0 TSval=14444496 TSecr=7513003
  232 2.246756606  10.6.15.156 → 192.168.1.12 SSH 366 Server: Encrypted packet (len=300)
  233 2.253489657  10.6.15.156 → 192.168.1.12 SSH 1514 Server: Encrypted packet (len=1448)
  234 2.253508871 192.168.1.12 → 10.6.15.156  TCP 66 54766 → 22 [ACK] Seq=11605 Ack=60949 Win=2901 Len=0 TSval=7513029 TSecr=14444520
  235 2.253529229  10.6.15.156 → 192.168.1.12 SSH 110 Server: Encrypted packet (len=44)
  236 2.293978326 192.168.1.12 → 10.6.15.156  TCP 66 54766 → 22 [ACK] Seq=11605 Ack=60993 Win=2901 Len=0 TSval=7513040 TSecr=14444522
  237 2.367580159  10.6.15.156 → 192.168.1.12 SSH 454 Server: Encrypted packet (len=388)
  238 2.367601086 192.168.1.12 → 10.6.15.156  TCP 66 54766 → 22 [ACK] Seq=11605 Ack=61381 Win=2901 Len=0 TSval=7513058 TSecr=14444551
  239 2.393109432  10.22.18.61 → 224.0.0.252  LLMNR 64 Standard query 0xa1d1 A wpad
  240 2.393132909  10.22.18.61 → 224.0.0.252  LLMNR 64 Standard query 0xaa7f A wpad
  241 2.462772477  10.6.15.156 → 192.168.1.12 SSH 1514 Server: Encrypted packet (len=1448)
  242 2.462790343 192.168.1.12 → 10.6.15.156  TCP 66 54766 → 22 [ACK] Seq=11605 Ack=62829 Win=2901 Len=0 TSval=7513082 TSecr=14444574
  243 2.463396718  10.6.15.156 → 192.168.1.12 SSH 1514 Server: Encrypted packet (len=1448)
  244 2.463408145 192.168.1.12 → 10.6.15.156  TCP 66 54766 → 22 [ACK] Seq=11605 Ack=64277 Win=2901 Len=0 TSval=7513082 TSecr=14444574
  245 2.463416792  10.6.15.156 → 192.168.1.12 SSH 118 Server: Encrypted packet (len=52)
  246 2.463421072 192.168.1.12 → 10.6.15.156  TCP 66 54766 → 22 [ACK] Seq=11605 Ack=64329 Win=2901 Len=0 TSval=7513082 TSecr=14444574
  247 2.467776840  10.6.15.156 → 192.168.1.12 SSH 702 Server: Encrypted packet (len=636)
  248 2.467793984 192.168.1.12 → 10.6.15.156  TCP 66 54766 → 22 [ACK] Seq=11605 Ack=64965 Win=2901 Len=0 TSval=7513083 TSecr=14444576
  249 2.509130499 192.168.1.12 → 10.6.15.156  SSH 102 Client: Encrypted packet (len=36)
  250 2.510559870  10.6.15.156 → 192.168.1.12 TCP 66 22 → 54766 [ACK] Seq=64965 Ack=11641 Win=1452 Len=0 TSval=14444586 TSecr=7513093
  251 2.510576212 192.168.1.12 → 10.6.15.156  SSH 982 Client: Encrypted packet (len=916)
  252 2.511235122 192.168.1.12 → 10.6.15.156  SSH 522 Client: Encrypted packet (len=456)
  253 2.512704441  10.6.15.156 → 192.168.1.12 TCP 66 22 → 54766 [ACK] Seq=64965 Ack=12557 Win=1452 Len=0 TSval=14444587 TSecr=7513094
  254 2.512723516  10.6.15.156 → 192.168.1.12 TCP 66 22 → 54766 [ACK] Seq=64965 Ack=13013 Win=1452 Len=0 TSval=14444587 TSecr=7513094
  255 2.536762987 192.168.1.12 → 10.6.15.156  SSH 102 Client: Encrypted packet (len=36)
  256 2.538138015  10.6.15.156 → 192.168.1.12 TCP 66 22 → 54766 [ACK] Seq=64965 Ack=13049 Win=1452 Len=0 TSval=14444593 TSecr=7513100
  257 2.538149982 192.168.1.12 → 10.6.15.156  SSH 110 Client: Encrypted packet (len=44)
  258 2.539545455  10.6.15.156 → 192.168.1.12 TCP 66 22 → 54766 [ACK] Seq=64965 Ack=13093 Win=1452 Len=0 TSval=14444594 TSecr=7513101
  259 2.585651598 192.168.1.12 → 10.6.15.156  SSH 102 Client: Encrypted packet (len=36)
  260 2.587433336  10.6.15.156 → 192.168.1.12 TCP 66 22 → 54766 [ACK] Seq=64965 Ack=13129 Win=1452 Len=0 TSval=14444606 TSecr=7513112
  261 2.587444803 192.168.1.12 → 10.6.15.156  SSH 102 Client: Encrypted packet (len=36)
  262 2.589025516  10.6.15.156 → 192.168.1.12 TCP 66 22 → 54766 [ACK] Seq=64965 Ack=13165 Win=1452 Len=0 TSval=14444606 TSecr=7513113
  263 2.590695641 192.168.1.12 → 10.6.15.156  SSH 102 Client: Encrypted packet (len=36)
  264 2.590928488 192.168.1.12 → 10.6.15.156  SSH 118 Client: Encrypted packet (len=52)
  265 2.592153143  10.6.15.156 → 192.168.1.12 TCP 66 22 → 54766 [ACK] Seq=64965 Ack=13201 Win=1452 Len=0 TSval=14444607 TSecr=7513114
  266 2.592164878 192.168.1.12 → 10.6.15.156  SSH 154 Client: Encrypted packet (len=88)
  267 2.592175587  10.6.15.156 → 192.168.1.12 TCP 66 22 → 54766 [ACK] Seq=64965 Ack=13253 Win=1452 Len=0 TSval=14444607 TSecr=7513114
  268 2.593782185  10.6.15.156 → 192.168.1.12 TCP 66 22 → 54766 [ACK] Seq=64965 Ack=13341 Win=1452 Len=0 TSval=14444607 TSecr=7513114
  269 2.594529232  10.6.15.156 → 192.168.1.12 SSH 110 Server: Encrypted packet (len=44)
  270 2.594608016 192.168.1.12 → 10.6.15.156  TCP 66 54766 → 22 [ACK] Seq=13341 Ack=65009 Win=2901 Len=0 TSval=7513115 TSecr=14444607
  271 2.594939228 192.168.1.12 → 10.6.15.156  SSH 398 Client: Encrypted packet (len=332)
  272 2.633250214  10.6.15.156 → 192.168.1.12 SSH 550 Server: Encrypted packet (len=484)
  273 2.639926268 192.168.1.12 → 10.6.15.156  SSH 102 Client: Encrypted packet (len=36)
  274 2.643524782  10.6.15.156 → 192.168.1.12 SSH 138 Server: Encrypted packet (len=72)
  275 2.643545107 192.168.1.12 → 10.6.15.156  SSH 102 Client: Encrypted packet (len=36)
  276 2.643809508 192.168.1.12 → 10.6.15.156  SSH 102 Client: Encrypted packet (len=36)
  277 2.645552868  10.6.15.156 → 192.168.1.12 TCP 66 22 → 54766 [ACK] Seq=65565 Ack=13781 Win=1452 Len=0 TSval=14444620 TSecr=7513127
  278 2.662562736  10.6.15.156 → 192.168.1.12 SSH 102 Server: Encrypted packet (len=36)
  279 2.662941045 192.168.1.12 → 10.6.15.156  SSH 278 Client: Encrypted packet (len=212)
  280 2.665980687  10.6.15.156 → 192.168.1.12 SSH 102 Server: Encrypted packet (len=36)
  281 2.666366086 192.168.1.12 → 10.6.15.156  SSH 326 Client: Encrypted packet (len=260)
  282 2.707385459  10.6.15.156 → 192.168.1.12 TCP 66 22 → 54766 [ACK] Seq=65637 Ack=14253 Win=1452 Len=0 TSval=14444636 TSecr=7513133
  283 2.716605677  10.6.15.156 → 192.168.1.12 SSH 102 Server: Encrypted packet (len=36)
  284 2.717068142 192.168.1.12 → 10.6.15.156  SSH 142 Client: Encrypted packet (len=76)
  285 2.718873526  10.6.15.156 → 192.168.1.12 TCP 66 22 → 54766 [ACK] Seq=65673 Ack=14329 Win=1452 Len=0 TSval=14444638 TSecr=7513145
  286 2.729034451  10.6.15.156 → 192.168.1.12 SSH 138 Server: Encrypted packet (len=72)
  287 2.729266021 192.168.1.12 → 10.6.15.156  SSH 102 Client: Encrypted packet (len=36)
  288 2.730340861  10.6.15.156 → 192.168.1.12 SSH 150 Server: Encrypted packet (len=84)
  289 2.730990074  10.6.15.156 → 192.168.1.12 SSH 646 Server: Encrypted packet (len=580)
  290 2.731069928 192.168.1.12 → 10.6.15.156  TCP 66 54766 → 22 [ACK] Seq=14365 Ack=66409 Win=2901 Len=0 TSval=7513149 TSecr=14444641
  291 2.731089939  10.6.15.156 → 192.168.1.12 SSH 366 Server: Encrypted packet (len=300)
  292 2.731317979  10.6.15.156 → 192.168.1.12 SSH 622 Server: Encrypted packet (len=556)
  293 2.731347861 192.168.1.12 → 10.6.15.156  TCP 66 54766 → 22 [ACK] Seq=14365 Ack=67265 Win=2901 Len=0 TSval=7513149 TSecr=14444642
  294 2.738942021 192.168.1.12 → 10.6.15.156  SSH 102 Client: Encrypted packet (len=36)
  295 2.742492348  10.6.15.156 → 192.168.1.12 SSH 326 Server: Encrypted packet (len=260)
  296 2.742508669 192.168.1.12 → 10.6.15.156  SSH 246 Client: Encrypted packet (len=180)
  297 2.760298696  10.6.15.156 → 192.168.1.12 SSH 174 Server: Encrypted packet (len=108)
  298 2.760328095 192.168.1.12 → 10.6.15.156  SSH 146 Client: Encrypted packet (len=80)
  299 2.760571912 192.168.1.12 → 10.6.15.156  SSH 102 Client: Encrypted packet (len=36)
  300 2.762211222  10.6.15.156 → 192.168.1.12 TCP 66 22 → 54766 [ACK] Seq=67633 Ack=14697 Win=1452 Len=0 TSval=14444649 TSecr=7513156
  301 2.762232731 192.168.1.12 → 10.6.15.156  SSH 350 Client: Encrypted packet (len=284)
  302 2.801788785  10.6.15.156 → 192.168.1.12 SSH 206 Server: Encrypted packet (len=140)
  303 2.803681846 192.168.1.12 → 10.6.15.156  SSH 134 Client: Encrypted packet (len=68)
  304 2.805166176  10.6.15.156 → 192.168.1.12 SSH 138 Server: Encrypted packet (len=72)
  305 2.810147306  10.6.15.156 → 192.168.1.12 SSH 138 Server: Encrypted packet (len=72)
  306 2.810163526 192.168.1.12 → 10.6.15.156  SSH 102 Client: Encrypted packet (len=36)
  307 2.810479633 192.168.1.12 → 10.6.15.156  SSH 102 Client: Encrypted packet (len=36)
  308 2.812248269  10.6.15.156 → 192.168.1.12 TCP 66 22 → 54766 [ACK] Seq=67917 Ack=15121 Win=1452 Len=0 TSval=14444662 TSecr=7513169
  309 2.817507195  10.6.15.156 → 192.168.1.12 SSH 138 Server: Encrypted packet (len=72)
  310 2.817713468 192.168.1.12 → 10.6.15.156  SSH 102 Client: Encrypted packet (len=36)
  311 2.819012413  10.6.15.156 → 192.168.1.12 SSH 138 Server: Encrypted packet (len=72)
  312 2.819999331  10.6.15.156 → 192.168.1.12 SSH 102 Server: Encrypted packet (len=36)
  313 2.820020475 192.168.1.12 → 10.6.15.156  SSH 250 Client: Encrypted packet (len=184)
  314 2.834437223  10.6.15.156 → 192.168.1.12 SSH 138 Server: Encrypted packet (len=72)
  315 2.834630484 192.168.1.12 → 10.6.15.156  SSH 102 Client: Encrypted packet (len=36)
  316 2.853354459  10.6.15.156 → 192.168.1.12 SSH 102 Server: Encrypted packet (len=36)
  317 2.855755306 192.168.1.12 → 10.6.15.156  SSH 222 Client: Encrypted packet (len=156)
  318 2.895355110  10.6.15.156 → 192.168.1.12 TCP 66 22 → 54766 [ACK] Seq=68205 Ack=15533 Win=1452 Len=0 TSval=14444683 TSecr=7513180
  319 2.913791594  10.6.15.156 → 192.168.1.12 SSH 102 Server: Encrypted packet (len=36)
  320 2.947391986  10.6.15.156 → 192.168.1.12 SSH 102 Server: Encrypted packet (len=36)
  321 2.947408014 192.168.1.12 → 10.6.15.156  TCP 66 54766 → 22 [ACK] Seq=15533 Ack=68277 Win=2901 Len=0 TSval=7513203 TSecr=14444687
  322 2.947495206  10.6.15.156 → 192.168.1.12 SSH 102 Server: Encrypted packet (len=36)
  323 2.956452705  10.6.15.156 → 192.168.1.12 SSH 138 Server: Encrypted packet (len=72)
  324 2.956530960 192.168.1.12 → 10.6.15.156  TCP 66 54766 → 22 [ACK] Seq=15533 Ack=68385 Win=2901 Len=0 TSval=7513205 TSecr=14444696
  325 2.956675378 192.168.1.12 → 10.6.15.156  SSH 102 Client: Encrypted packet (len=36)
  326 2.958146029  10.6.15.156 → 192.168.1.12 TCP 66 22 → 54766 [ACK] Seq=68385 Ack=15569 Win=1452 Len=0 TSval=14444698 TSecr=7513205
  327 2.961862183  10.6.15.156 → 192.168.1.12 SSH 134 Server: Encrypted packet (len=68)
  328 2.961879570  10.6.15.156 → 192.168.1.12 SSH 138 Server: Encrypted packet (len=72)
  329 2.961947332 192.168.1.12 → 10.6.15.156  TCP 66 54766 → 22 [ACK] Seq=15569 Ack=68525 Win=2901 Len=0 TSval=7513207 TSecr=14444699
  330 2.962052964  10.6.15.156 → 192.168.1.12 SSH 102 Server: Encrypted packet (len=36)
  331 2.962116250 192.168.1.12 → 10.6.15.156  SSH 102 Client: Encrypted packet (len=36)
  332 2.963206037  10.6.15.156 → 192.168.1.12 SSH 138 Server: Encrypted packet (len=72)
  333 2.963937004  10.6.15.156 → 192.168.1.12 SSH 110 Server: Encrypted packet (len=44)
  334 2.963950688 192.168.1.12 → 10.6.15.156  SSH 102 Client: Encrypted packet (len=36)
  335 2.964281442 192.168.1.12 → 10.6.15.156  SSH 270 Client: Encrypted packet (len=204)
  336 2.965778032  10.6.15.156 → 192.168.1.12 TCP 66 22 → 54766 [ACK] Seq=68677 Ack=15845 Win=1452 Len=0 TSval=14444700 TSecr=7513207
  337 2.978182320  10.6.15.156 → 192.168.1.12 SSH 102 Server: Encrypted packet (len=36)
  338 2.978534935 192.168.1.12 → 10.6.15.156  SSH 166 Client: Encrypted packet (len=100)
  339 2.983229961  10.6.15.156 → 192.168.1.12 SSH 310 Server: Encrypted packet (len=244)
  340 2.989026632 192.168.1.12 → 10.6.15.156  SSH 102 Client: Encrypted packet (len=36)
  341 2.989254537 192.168.1.12 → 10.6.15.156  SSH 102 Client: Encrypted packet (len=36)
  342 2.990586347  10.6.15.156 → 192.168.1.12 TCP 66 22 → 54766 [ACK] Seq=68957 Ack=16017 Win=1452 Len=0 TSval=14444706 TSecr=7513213
  343 3.096068007  10.6.15.156 → 192.168.1.12 SSH 138 Server: Encrypted packet (len=72)
  344 3.096283176 192.168.1.12 → 10.6.15.156  SSH 102 Client: Encrypted packet (len=36)
  345 3.135952655  10.6.15.156 → 192.168.1.12 TCP 66 22 → 54766 [ACK] Seq=69029 Ack=16053 Win=1452 Len=0 TSval=14444743 TSecr=7513240
  346 3.147461697 192.168.1.12 → 10.6.15.156  SSH 862 Client: Encrypted packet (len=796)
  347 3.149691188  10.6.15.156 → 192.168.1.12 TCP 66 22 → 54766 [ACK] Seq=69029 Ack=16849 Win=1452 Len=0 TSval=14444746 TSecr=7513253
  348 3.199973189  10.6.15.156 → 192.168.1.12 SSH 238 Server: Encrypted packet (len=172)
  349 3.207690487  10.6.15.156 → 192.168.1.12 SSH 102 Server: Encrypted packet (len=36)
  350 3.207758414 192.168.1.12 → 10.6.15.156  TCP 66 54766 → 22 [ACK] Seq=16849 Ack=69237 Win=2901 Len=0 TSval=7513268 TSecr=14444759
  351 3.208036916 192.168.1.12 → 10.6.15.156  SSH 190 Client: Encrypted packet (len=124)
  352 3.209692708  10.6.15.156 → 192.168.1.12 TCP 66 22 → 54766 [ACK] Seq=69237 Ack=16973 Win=1452 Len=0 TSval=14444761 TSecr=7513268
  353 3.366675372  10.6.15.156 → 192.168.1.12 SSH 462 Server: Encrypted packet (len=396)
  354 3.409976282 192.168.1.12 → 10.6.15.156  TCP 66 54766 → 22 [ACK] Seq=16973 Ack=69633 Win=2901 Len=0 TSval=7513319 TSecr=14444800
  355 3.416483736  10.6.15.156 → 192.168.1.12 SSH 134 Server: Encrypted packet (len=68)
  356 3.416599317 192.168.1.12 → 10.6.15.156  TCP 66 54766 → 22 [ACK] Seq=16973 Ack=69701 Win=2901 Len=0 TSval=7513320 TSecr=14444813
  357 3.429435822  10.6.15.156 → 192.168.1.12 SSH 254 Server: Encrypted packet (len=188)
  358 3.429505874 192.168.1.12 → 10.6.15.156  TCP 66 54766 → 22 [ACK] Seq=16973 Ack=69889 Win=2901 Len=0 TSval=7513323 TSecr=14444816
  359 4.167409999 192.168.1.12 → 10.6.15.156  SSH 230 Client: Encrypted packet (len=164)
  360 4.174399452  10.6.15.156 → 192.168.1.12 TCP 66 22 → 54766 [ACK] Seq=69889 Ack=17137 Win=1452 Len=0 TSval=14445002 TSecr=7513508
  361 4.174421704 192.168.1.12 → 10.6.15.156  SSH 182 Client: Encrypted packet (len=116)
  362 4.176028627  10.6.15.156 → 192.168.1.12 TCP 66 22 → 54766 [ACK] Seq=69889 Ack=17253 Win=1452 Len=0 TSval=14445003 TSecr=7513510
  363 4.178498677  10.6.15.156 → 192.168.1.12 SSH 150 Server: Encrypted packet (len=84)
  364 4.178518464 192.168.1.12 → 10.6.15.156  TCP 66 54766 → 22 [ACK] Seq=17253 Ack=69973 Win=2901 Len=0 TSval=7513511 TSecr=14445003
  365 4.185677283  10.6.15.156 → 192.168.1.12 SSH 1514 Server: Encrypted packet (len=1448)
  366 4.185692521 192.168.1.12 → 10.6.15.156  TCP 66 54766 → 22 [ACK] Seq=17253 Ack=71421 Win=2901 Len=0 TSval=7513512 TSecr=14445004
  367 4.185844996  10.6.15.156 → 192.168.1.12 SSH 1514 Server: Encrypted packet (len=1448)
  368 4.185848720 192.168.1.12 → 10.6.15.156  TCP 66 54766 → 22 [ACK] Seq=17253 Ack=72869 Win=2901 Len=0 TSval=7513512 TSecr=14445004
  369 4.186038620  10.6.15.156 → 192.168.1.12 SSH 1514 Server: Encrypted packet (len=1448)
  370 4.186042814 192.168.1.12 → 10.6.15.156  TCP 66 54766 → 22 [ACK] Seq=17253 Ack=74317 Win=2901 Len=0 TSval=7513513 TSecr=14445004
  371 4.186229262  10.6.15.156 → 192.168.1.12 SSH 1514 Server: Encrypted packet (len=1448)
  372 4.186232208 192.168.1.12 → 10.6.15.156  TCP 66 54766 → 22 [ACK] Seq=17253 Ack=75765 Win=2901 Len=0 TSval=7513513 TSecr=14445004
  373 4.186237566  10.6.15.156 → 192.168.1.12 SSH 102 Server: Encrypted packet (len=36)
  374 4.186242015 192.168.1.12 → 10.6.15.156  TCP 66 54766 → 22 [ACK] Seq=17253 Ack=75801 Win=2901 Len=0 TSval=7513513 TSecr=14445004
  375 4.186440592  10.6.15.156 → 192.168.1.12 SSH 1514 Server: Encrypted packet (len=1448)
  376 4.186443805 192.168.1.12 → 10.6.15.156  TCP 66 54766 → 22 [ACK] Seq=17253 Ack=77249 Win=2901 Len=0 TSval=7513513 TSecr=14445005
  377 4.186632495  10.6.15.156 → 192.168.1.12 SSH 1514 Server: Encrypted packet (len=1448)
  378 4.186638031 192.168.1.12 → 10.6.15.156  TCP 66 54766 → 22 [ACK] Seq=17253 Ack=78697 Win=2901 Len=0 TSval=7513513 TSecr=14445005
  379 4.186825076  10.6.15.156 → 192.168.1.12 SSH 1514 Server: Encrypted packet (len=1448)
  380 4.186830934 192.168.1.12 → 10.6.15.156  TCP 66 54766 → 22 [ACK] Seq=17253 Ack=80145 Win=2901 Len=0 TSval=7513513 TSecr=14445005
  381 4.187025891  10.6.15.156 → 192.168.1.12 SSH 1514 Server: Encrypted packet (len=1448)
  382 4.187031350 192.168.1.12 → 10.6.15.156  TCP 66 54766 → 22 [ACK] Seq=17253 Ack=81593 Win=2901 Len=0 TSval=7513513 TSecr=14445005
  383 4.193128882  10.6.15.156 → 192.168.1.12 SSH 1514 Server: Encrypted packet (len=1448)
  384 4.193148578 192.168.1.12 → 10.6.15.156  TCP 66 54766 → 22 [ACK] Seq=17253 Ack=83041 Win=2901 Len=0 TSval=7513514 TSecr=14445005
  385 4.195568365  10.6.15.156 → 192.168.1.12 SSH 1514 Server: Encrypted packet (len=1448)
  386 4.195577908 192.168.1.12 → 10.6.15.156  TCP 66 54766 → 22 [ACK] Seq=17253 Ack=84489 Win=2901 Len=0 TSval=7513515 TSecr=14445007
  387 4.195752221  10.6.15.156 → 192.168.1.12 SSH 1514 Server: Encrypted packet (len=1448)
