    1 0.000000000  10.6.15.156 → 192.168.1.12 SSH 138 Server: Encrypted packet (len=72)
    2 0.000198105 192.168.1.12 → 10.6.15.156  SSH 102 Client: Encrypted packet (len=36)
    3 0.001690059  10.6.15.156 → 192.168.1.12 TCP 66 22 → 54766 [ACK] Seq=73 Ack=37 Win=1452 Len=0 TSval=14434936 TSecr=7503443
    4 0.003217174  10.6.15.156 → 192.168.1.12 SSH 174 Server: Encrypted packet (len=108)
    5 0.003233720  10.6.15.156 → 192.168.1.12 SSH 138 Server: Encrypted packet (len=72)
    6 0.003286499 192.168.1.12 → 10.6.15.156  TCP 66 54766 → 22 [ACK] Seq=37 Ack=253 Win=2901 Len=0 TSval=7503443 TSecr=14434936
    7 0.003453473 192.168.1.12 → 10.6.15.156  SSH 102 Client: Encrypted packet (len=36)
    8 0.011696169  10.6.15.156 → 192.168.1.12 SSH 138 Server: Encrypted packet (len=72)
    9 0.011721361 192.168.1.12 → 10.6.15.156  SSH 158 Client: Encrypted packet (len=92)
   10 0.012052616 192.168.1.12 → 10.6.15.156  SSH 102 Client: Encrypted packet (len=36)
   11 0.012842612  10.6.15.156 → 192.168.1.12 SSH 174 Server: Encrypted packet (len=108)
   12 0.013690596  10.6.15.156 → 192.168.1.12 TCP 66 22 → 54766 [ACK] Seq=433 Ack=201 Win=1452 Len=0 TSval=14434939 TSecr=7503446
   13 0.013711693 192.168.1.12 → 10.6.15.156  SSH 102 Client: Encrypted packet (len=36)
   14 0.053628326  10.6.15.156 → 192.168.1.12 TCP 66 22 → 54766 [ACK] Seq=433 Ack=237 Win=1452 Len=0 TSval=14434949 TSecr=7503446
   15 0.096461447 192.168.1.12 → 239.255.255.250 SSDP 213 M-SEARCH * HTTP/1.1 
   16 0.240228156 192.168.1.12 → 10.6.15.156  SSH 862 Client: Encrypted packet (len=796)
   17 0.242810706  10.6.15.156 → 192.168.1.12 TCP 66 22 → 54766 [ACK] Seq=433 Ack=1033 Win=1452 Len=0 TSval=14434996 TSecr=7503503
   18 0.242830934 192.168.1.12 → 10.6.15.156  SSH 862 Client: Encrypted packet (len=796)
   19 0.246667371  10.6.15.156 → 192.168.1.12 TCP 66 22 → 54766 [ACK] Seq=433 Ack=1829 Win=1452 Len=0 TSval=14434997 TSecr=7503503
   20 0.260659262  10.6.15.156 → 192.168.1.12 SSH 1514 Server: Encrypted packet (len=1448)
   21 0.260822715  10.6.15.156 → 192.168.1.12 SSH 1514 Server: Encrypted packet (len=1448)
   22 0.260832222 192.168.1.12 → 10.6.15.156  TCP 66 54766 → 22 [ACK] Seq=1829 Ack=3329 Win=2901 Len=0 TSval=7503508 TSecr=14435000
   23 0.261153913  10.6.15.156 → 192.168.1.12 SSH 1514 Server: Encrypted packet (len=1448)
   24 0.261340095  10.6.15.156 → 192.168.1.12 SSH 1390 Server: Encrypted packet (len=1324)
   25 0.261347018 192.168.1.12 → 10.6.15.156  TCP 66 54766 → 22 [ACK] Seq=1829 Ack=6101 Win=2901 Len=0 TSval=7503508 TSecr=14435000
   26 0.261664904  10.6.15.156 → 192.168.1.12 SSH 1514 Server: Encrypted packet (len=1448)
   27 0.261842035  10.6.15.156 → 192.168.1.12 SSH 1514 Server: Encrypted packet (len=1448)
   28 0.261849407 192.168.1.12 → 10.6.15.156  TCP 66 54766 → 22 [ACK] Seq=1829 Ack=8997 Win=2901 Len=0 TSval=7503508 TSecr=14435000
   29 0.262032375  10.6.15.156 → 192.168.1.12 SSH 1514 Server: Encrypted packet (len=1448)
   30 0.262226570  10.6.15.156 → 192.168.1.12 SSH 1514 Server: Encrypted packet (len=1448)
   31 0.262236470 192.168.1.12 → 10.6.15.156  TCP 66 54766 → 22 [ACK] Seq=1829 Ack=11893 Win=2901 Len=0 TSval=7503508 TSecr=14435000
   32 0.262571999  10.6.15.156 → 192.168.1.12 SSH 1514 Server: Encrypted packet (len=1448)
   33 0.263621214  10.6.15.156 → 192.168.1.12 SSH 1514 Server: Encrypted packet (len=1448)
   34 0.263634027 192.168.1.12 → 10.6.15.156  TCP 66 54766 → 22 [ACK] Seq=1829 Ack=14789 Win=2901 Len=0 TSval=7503508 TSecr=14435000
   35 0.265861378  10.6.15.156 → 192.168.1.12 SSH 206 Server: Encrypted packet (len=140)
   36 0.266113004 192.168.1.12 → 10.6.15.156  SSH 102 Client: Encrypted packet (len=36)
   37 0.305569717  10.6.15.156 → 192.168.1.12 TCP 66 22 → 54766 [ACK] Seq=14929 Ack=1865 Win=1452 Len=0 TSval=14435012 TSecr=7503509
   38 0.459618843  10.6.15.156 → 192.168.1.12 SSH 842 Server: Encrypted packet (len=776)
   39 0.475942092  10.6.15.156 → 192.168.1.12 SSH 1514 Server: Encrypted packet (len=1448)
   40 0.475958525 192.168.1.12 → 10.6.15.156  TCP 66 54766 → 22 [ACK] Seq=1865 Ack=17153 Win=2901 Len=0 TSval=7503562 TSecr=14435050
   41 0.476123258  10.6.15.156 → 192.168.1.12 SSH 1514 Server: Encrypted packet (len=1448)
   42 0.476466725  10.6.15.156 → 192.168.1.12 SSH 1514 Server: Encrypted packet (len=1448)
   43 0.476470647 192.168.1.12 → 10.6.15.156  TCP 66 54766 → 22 [ACK] Seq=1865 Ack=20049 Win=2901 Len=0 TSval=7503562 TSecr=14435054
   44 0.476643651  10.6.15.156 → 192.168.1.12 SSH 1514 Server: Encrypted packet (len=1448)
   45 0.476647891  10.6.15.156 → 192.168.1.12 SSH 126 Server: Encrypted packet (len=60)
   46 0.476651726 192.168.1.12 → 10.6.15.156  TCP 66 54766 → 22 [ACK] Seq=1865 Ack=21557 Win=2901 Len=0 TSval=7503562 TSecr=14435054
   47 0.476860686  10.6.15.156 → 192.168.1.12 SSH 1514 Server: Encrypted packet (len=1448)
   48 0.476987105  10.6.15.156 → 192.168.1.12 SSH 110 Server: Encrypted packet (len=44)
   49 0.476992654 192.168.1.12 → 10.6.15.156  TCP 66 54766 → 22 [ACK] Seq=1865 Ack=23049 Win=2901 Len=0 TSval=7503562 TSecr=14435054
   50 0.588599048 192.168.1.12 → 10.6.15.156  SSH 102 Client: Encrypted packet (len=36)
   51 0.590093538  10.6.15.156 → 192.168.1.12 TCP 66 22 → 54766 [ACK] Seq=23049 Ack=1901 Win=1452 Len=0 TSval=14435083 TSecr=7503590
   52 0.590110791 192.168.1.12 → 10.6.15.156  SSH 118 Client: Encrypted packet (len=52)
   53 0.591744544  10.6.15.156 → 192.168.1.12 TCP 66 22 → 54766 [ACK] Seq=23049 Ack=1953 Win=1452 Len=0 TSval=14435083 TSecr=7503590
   54 0.690907160  10.6.15.156 → 192.168.1.12 SSH 1514 Server: Encrypted packet (len=1448)
   55 0.690925694  10.6.15.156 → 192.168.1.12 SSH 214 Server: Encrypted packet (len=148)
   56 0.690946545 192.168.1.12 → 10.6.15.156  TCP 66 54766 → 22 [ACK] Seq=1953 Ack=24645 Win=2901 Len=0 TSval=7503615 TSecr=14435108
   57 0.713838270 192.168.1.12 → 10.6.15.156  SSH 102 Client: Encrypted packet (len=36)
   58 0.715616773  10.6.15.156 → 192.168.1.12 TCP 66 22 → 54766 [ACK] Seq=24645 Ack=1989 Win=1452 Len=0 TSval=14435114 TSecr=7503621
   59 0.715638090 192.168.1.12 → 10.6.15.156  SSH 110 Client: Encrypted packet (len=44)
   60 0.717021603  10.6.15.156 → 192.168.1.12 TCP 66 22 → 54766 [ACK] Seq=24645 Ack=2033 Win=1452 Len=0 TSval=14435114 TSecr=7503621
   61 0.806069780  10.6.15.156 → 192.168.1.12 SSH 138 Server: Encrypted packet (len=72)
   62 0.806258561 192.168.1.12 → 10.6.15.156  SSH 102 Client: Encrypted packet (len=36)
   63 0.809002413  10.6.15.156 → 192.168.1.12 TCP 66 22 → 54766 [ACK] Seq=24717 Ack=2069 Win=1452 Len=0 TSval=14435137 TSecr=7503644
   64 0.809017317  10.6.15.156 → 192.168.1.12 SSH 102 Server: Encrypted packet (len=36)
   65 0.809326136 192.168.1.12 → 10.6.15.156  SSH 230 Client: Encrypted packet (len=164)
   66 0.850562603  10.6.15.156 → 192.168.1.12 TCP 66 22 → 54766 [ACK] Seq=24753 Ack=2233 Win=1452 Len=0 TSval=14435148 TSecr=7503645
   67 0.872470614 192.168.1.12 → 10.6.15.156  SSH 102 Client: Encrypted packet (len=36)
   68 0.873758090  10.6.15.156 → 192.168.1.12 TCP 66 22 → 54766 [ACK] Seq=24753 Ack=2269 Win=1452 Len=0 TSval=14435154 TSecr=7503661
   69 0.873771899 192.168.1.12 → 10.6.15.156  SSH 110 Client: Encrypted packet (len=44)
   70 0.875130280  10.6.15.156 → 192.168.1.12 TCP 66 22 → 54766 [ACK] Seq=24753 Ack=2313 Win=1452 Len=0 TSval=14435154 TSecr=7503661
   71 0.903471729 192.168.1.12 → 10.6.15.156  SSH 102 Client: Encrypted packet (len=36)
   72 0.905634802  10.6.15.156 → 192.168.1.12 TCP 66 22 → 54766 [ACK] Seq=24753 Ack=2349 Win=1452 Len=0 TSval=14435161 TSecr=7503668
   73 0.905656401 192.168.1.12 → 10.6.15.156  SSH 102 Client: Encrypted packet (len=36)
   74 0.907390762  10.6.15.156 → 192.168.1.12 TCP 66 22 → 54766 [ACK] Seq=24753 Ack=2385 Win=1452 Len=0 TSval=14435162 TSecr=7503669
   75 0.918655313 192.168.1.12 → 10.6.15.156  SSH 190 Client: Encrypted packet (len=124)
   76 0.918936368 192.168.1.12 → 10.6.15.156  SSH 266 Client: Encrypted packet (len=200)
   77 0.920385483  10.6.15.156 → 192.168.1.12 TCP 66 22 → 54766 [ACK] Seq=24753 Ack=2509 Win=1452 Len=0 TSval=14435165 TSecr=7503672
   78 0.920405612  10.6.15.156 → 192.168.1.12 TCP 66 22 → 54766 [ACK] Seq=24753 Ack=2709 Win=1452 Len=0 TSval=14435165 TSecr=7503672
   79 0.923149882  10.6.15.156 → 192.168.1.12 SSH 150 Server: Encrypted packet (len=84)
   80 0.931533654  10.6.15.156 → 192.168.1.12 SSH 138 Server: Encrypted packet (len=72)
   81 0.931607050 192.168.1.12 → 10.6.15.156  TCP 66 54766 → 22 [ACK] Seq=2709 Ack=24909 Win=2901 Len=0 TSval=7503675 TSecr=14435166
   82 0.931815465 192.168.1.12 → 10.6.15.156  SSH 102 Client: Encrypted packet (len=36)
   83 0.932779207  10.6.15.156 → 192.168.1.12 SSH 102 Server: Encrypted packet (len=36)
   84 0.970371421  10.6.15.156 → 192.168.1.12 TCP 66 22 → 54766 [ACK] Seq=24945 Ack=2745 Win=1452 Len=0 TSval=14435178 TSecr=7503676
   85 0.970396276 192.168.1.12 → 10.6.15.156  SSH 882 Client: Encrypted packet (len=816)
   86 1.005075966  10.6.15.156 → 192.168.1.12 SSH 630 Server: Encrypted packet (len=564)
   87 1.005741480  10.6.15.156 → 192.168.1.12 SSH 138 Server: Encrypted packet (len=72)
   88 1.005813343 192.168.1.12 → 10.6.15.156  TCP 66 54766 → 22 [ACK] Seq=3561 Ack=25581 Win=2901 Len=0 TSval=7503694 TSecr=14435186
   89 1.006061602 192.168.1.12 → 10.6.15.156  SSH 102 Client: Encrypted packet (len=36)
   90 1.030301692  10.6.15.156 → 192.168.1.12 SSH 238 Server: Encrypted packet (len=172)
   91 1.030324330 192.168.1.12 → 10.6.15.156  SSH 294 Client: Encrypted packet (len=228)
   92 1.056545364 192.168.1.12 → 224.0.0.252  LLMNR 61 Standard query 0xcfb3 A x
   93 1.069445918  10.6.15.156 → 192.168.1.12 TCP 66 22 → 54766 [ACK] Seq=25753 Ack=3825 Win=1452 Len=0 TSval=14435203 TSecr=7503700
   94 1.091820466  10.6.15.156 → 192.168.1.12 SSH 102 Server: Encrypted packet (len=36)
   95 1.092244259 192.168.1.12 → 10.6.15.156  SSH 518 Client: Encrypted packet (len=452)
   96 1.094270900  10.6.15.156 → 192.168.1.12 TCP 66 22 → 54766 [ACK] Seq=25789 Ack=4277 Win=1452 Len=0 TSval=14435209 TSecr=7503716
   97 1.097226212 192.168.1.12 → 239.255.255.250 SSDP 213 M-SEARCH * HTTP/1.1 
   98 1.100096194  10.6.15.156 → 192.168.1.12 SSH 138 Server: Encrypted packet (len=72)
   99 1.100345957 192.168.1.12 → 10.6.15.156  SSH 102 Client: Encrypted packet (len=36)
  100 1.131881887  10.6.15.156 → 192.168.1.12 SSH 102 Server: Encrypted packet (len=36)
  101 1.132306343 192.168.1.12 → 10.6.15.156  SSH 238 Client: Encrypted packet (len=172)
  102 1.136429583  10.6.15.156 → 192.168.1.12 SSH 138 Server: Encrypted packet (len=72)
  103 1.136657088 192.168.1.12 → 10.6.15.156  SSH 102 Client: Encrypted packet (len=36)
  104 1.136878044 192.168.1.12 → 10.6.15.156  SSH 206 Client: Encrypted packet (len=140)
  105 1.138369669  10.6.15.156 → 192.168.1.12 TCP 66 22 → 54766 [ACK] Seq=25969 Ack=4661 Win=1452 Len=0 TSval=14435220 TSecr=7503727
  106 1.139260875 192.168.1.12 → 10.6.15.156  SSH 102 Client: Encrypted packet (len=36)
  107 1.165675587 192.168.1.12 → 224.0.0.252  LLMNR 61 Standard query 0xcfb3 A x
  108 1.167709293 192.168.1.12 → 10.6.15.156  SSH 110 Client: Encrypted packet (len=44)
  109 1.170074476  10.6.15.156 → 192.168.1.12 TCP 66 22 → 54766 [ACK] Seq=25969 Ack=4741 Win=1452 Len=0 TSval=14435228 TSecr=7503727
  110 1.190843020  10.6.15.156 → 192.168.1.12 SSH 150 Server: Encrypted packet (len=84)
  111 1.201048344  10.6.15.156 → 192.168.1.12 SSH 646 Server: Encrypted packet (len=580)
  112 1.201124291 192.168.1.12 → 10.6.15.156  TCP 66 54766 → 22 [ACK] Seq=4741 Ack=26633 Win=2901 Len=0 TSval=7503743 TSecr=14435233
  113 1.206229467 192.168.1.12 → 10.6.15.156  SSH 198 Client: Encrypted packet (len=132)
  114 1.208327370  10.6.15.156 → 192.168.1.12 SSH 910 Server: Encrypted packet (len=844)
  115 1.208346544 192.168.1.12 → 10.6.15.156  SSH 518 Client: Encrypted packet (len=452)
  116 1.212650250  10.6.15.156 → 192.168.1.12 SSH 142 Server: Encrypted packet (len=76)
  117 1.247396254  10.6.15.156 → 192.168.1.12 SSH 870 Server: Encrypted packet (len=804)
  118 1.247412554 192.168.1.12 → 10.6.15.156  TCP 66 54766 → 22 [ACK] Seq=5325 Ack=28357 Win=2901 Len=0 TSval=7503754 TSecr=14435238
  119 1.247511235  10.6.15.156 → 192.168.1.12 SSH 174 Server: Encrypted packet (len=108)
  120 1.247714386 192.168.1.12 → 10.6.15.156  SSH 102 Client: Encrypted packet (len=36)
  121 1.248740673  10.6.15.156 → 192.168.1.12 SSH 102 Server: Encrypted packet (len=36)
  122 1.248756487 192.168.1.12 → 10.6.15.156  SSH 274 Client: Encrypted packet (len=208)
  123 1.250878791  10.6.15.156 → 192.168.1.12 TCP 66 22 → 54766 [ACK] Seq=28501 Ack=5569 Win=1452 Len=0 TSval=14435248 TSecr=7503755
  124 1.250895563 192.168.1.12 → 10.6.15.156  SSH 182 Client: Encrypted packet (len=116)
  125 1.289457947  10.6.15.156 → 192.168.1.12 TCP 66 22 → 54766 [ACK] Seq=28501 Ack=5685 Win=1452 Len=0 TSval=14435258 TSecr=7503755
  126 1.289475975 192.168.1.12 → 10.6.15.156  SSH 318 Client: Encrypted packet (len=252)
  127 1.291273494  10.6.15.156 → 192.168.1.12 TCP 66 22 → 54766 [ACK] Seq=28501 Ack=5937 Win=1452 Len=0 TSval=14435258 TSecr=7503765
  128 1.311950101  10.6.15.156 → 192.168.1.12 SSH 318 Server: Encrypted packet (len=252)
  129 1.353068431  10.6.15.156 → 192.168.1.12 SSH 126 Server: Encrypted packet (len=60)
  130 1.353087433 192.168.1.12 → 10.6.15.156  TCP 66 54766 → 22 [ACK] Seq=5937 Ack=28813 Win=2901 Len=0 TSval=7503781 TSecr=14435263
  131 1.353102671  10.6.15.156 → 192.168.1.12 SSH 138 Server: Encrypted packet (len=72)
  132 1.353338355 192.168.1.12 → 10.6.15.156  SSH 102 Client: Encrypted packet (len=36)
  133 1.357587274  10.6.15.156 → 192.168.1.12 SSH 110 Server: Encrypted packet (len=44)
  134 1.385468937  10.6.15.156 → 192.168.1.12 SSH 182 Server: Encrypted packet (len=116)
  135 1.385533437 192.168.1.12 → 10.6.15.156  TCP 66 54766 → 22 [ACK] Seq=5973 Ack=29045 Win=2901 Len=0 TSval=7503789 TSecr=14435275
  136 1.386540602  10.6.15.156 → 192.168.1.12 SSH 1514 Server: Encrypted packet (len=1448)
  137 1.386559092  10.6.15.156 → 192.168.1.12 SSH 118 Server: Encrypted packet (len=52)
  138 1.386567863 192.168.1.12 → 10.6.15.156  TCP 66 54766 → 22 [ACK] Seq=5973 Ack=30545 Win=2901 Len=0 TSval=7503789 TSecr=14435282
  139 1.387210574  10.6.15.156 → 192.168.1.12 SSH 1366 Server: Encrypted packet (len=1300)
  140 1.387221420  10.6.15.156 → 192.168.1.12 SSH 110 Server: Encrypted packet (len=44)
  141 1.387254233 192.168.1.12 → 10.6.15.156  TCP 66 54766 → 22 [ACK] Seq=5973 Ack=31889 Win=2901 Len=0 TSval=7503789 TSecr=14435282
  142 1.389044288 192.168.1.12 → 10.6.15.156  SSH 238 Client: Encrypted packet (len=172)
  143 1.415666603 192.168.1.12 → 224.0.0.252  LLMNR 61 Standard query 0xcfb3 A x
  144 1.429326828  10.6.15.156 → 192.168.1.12 TCP 66 22 → 54766 [ACK] Seq=31889 Ack=6145 Win=1452 Len=0 TSval=14435293 TSecr=7503790
  145 1.448374876  10.6.15.156 → 192.168.1.12 SSH 134 Server: Encrypted packet (len=68)
  146 1.451735727  10.6.15.156 → 192.168.1.12 SSH 1514 Server: Encrypted packet (len=1448)
  147 1.451751244 192.168.1.12 → 10.6.15.156  TCP 66 54766 → 22 [ACK] Seq=6145 Ack=33405 Win=2901 Len=0 TSval=7503806 TSecr=14435297
  148 1.451766347  10.6.15.156 → 192.168.1.12 SSH 118 Server: Encrypted packet (len=52)
  149 1.452797011  10.6.15.156 → 192.168.1.12 SSH 1514 Server: Encrypted packet (len=1448)
  150 1.452809615 192.168.1.12 → 10.6.15.156  TCP 66 54766 → 22 [ACK] Seq=6145 Ack=34905 Win=2901 Len=0 TSval=7503806 TSecr=14435297
  151 1.453683802  10.6.15.156 → 192.168.1.12 SSH 1514 Server: Encrypted packet (len=1448)
  152 1.453874108  10.6.15.156 → 192.168.1.12 SSH 1514 Server: Encrypted packet (len=1448)
  153 1.453881192 192.168.1.12 → 10.6.15.156  TCP 66 54766 → 22 [ACK] Seq=6145 Ack=37801 Win=2901 Len=0 TSval=7503806 TSecr=14435298
  154 1.454213834  10.6.15.156 → 192.168.1.12 SSH 1514 Server: Encrypted packet (len=1448)
  155 1.454219384  10.6.15.156 → 192.168.1.12 SSH 126 Server: Encrypted packet (len=60)
  156 1.454222425 192.168.1.12 → 10.6.15.156  TCP 66 54766 → 22 [ACK] Seq=6145 Ack=39309 Win=2901 Len=0 TSval=7503806 TSecr=14435298
  157 1.454419687  10.6.15.156 → 192.168.1.12 SSH 1514 Server: Encrypted packet (len=1448)
  158 1.454429215  10.6.15.156 → 192.168.1.12 SSH 190 Server: Encrypted packet (len=124)
  159 1.454432934 192.168.1.12 → 10.6.15.156  TCP 66 54766 → 22 [ACK] Seq=6145 Ack=40881 Win=2901 Len=0 TSval=7503806 TSecr=14435298
  160 1.474834220  10.6.15.156 → 192.168.1.12 SSH 190 Server: Encrypted packet (len=124)
  161 1.475812010  10.6.15.156 → 192.168.1.12 SSH 110 Server: Encrypted packet (len=44)
  162 1.475869993 192.168.1.12 → 10.6.15.156  TCP 66 54766 → 22 [ACK] Seq=6145 Ack=41049 Win=2901 Len=0 TSval=7503812 TSecr=14435302
  163 1.480973462 192.168.1.12 → 10.6.15.156  SSH 190 Client: Encrypted packet (len=124)
  164 1.482814537  10.6.15.156 → 192.168.1.12 TCP 66 22 → 54766 [ACK] Seq=41049 Ack=6269 Win=1452 Len=0 TSval=14435306 TSecr=7503813
  165 1.489380409 192.168.1.12 → 10.6.15.156  SSH 246 Client: Encrypted packet (len=180)
  166 1.491137057  10.6.15.156 → 192.168.1.12 TCP 66 22 → 54766 [ACK] Seq=41049 Ack=6449 Win=1452 Len=0 TSval=14435308 TSecr=7503815
  167 1.506222139 192.168.1.12 → 10.6.15.156  SSH 206 Client: Encrypted packet (len=140)
  168 1.508842624  10.6.15.156 → 192.168.1.12 TCP 66 22 → 54766 [ACK] Seq=41049 Ack=6589 Win=1452 Len=0 TSval=14435312 TSecr=7503819
  169 1.610840835  10.6.15.156 → 192.168.1.12 SSH 534 Server: Encrypted packet (len=468)
  170 1.633336133 192.168.1.12 → 10.6.15.156  SSH 102 Client: Encrypted packet (len=36)
  171 1.635040381  10.6.15.156 → 192.168.1.12 TCP 66 22 → 54766 [ACK] Seq=41517 Ack=6625 Win=1452 Len=0 TSval=14435344 TSecr=7503851
  172 1.635055991 192.168.1.12 → 10.6.15.156  SSH 118 Client: Encrypted packet (len=52)
  173 1.636682336  10.6.15.156 → 192.168.1.12 TCP 66 22 → 54766 [ACK] Seq=41517 Ack=6677 Win=1452 Len=0 TSval=14435344 TSecr=7503851
  174 1.702145557  10.6.15.156 → 192.168.1.12 SSH 110 Server: Encrypted packet (len=44)
  175 1.743709579 192.168.1.12 → 10.6.15.156  TCP 66 54766 → 22 [ACK] Seq=6677 Ack=41561 Win=2901 Len=0 TSval=7503879 TSecr=14435361
  176 1.801069227  10.6.15.156 → 192.168.1.12 SSH 158 Server: Encrypted packet (len=92)
  177 1.801153491 192.168.1.12 → 10.6.15.156  TCP 66 54766 → 22 [ACK] Seq=6677 Ack=41653 Win=2901 Len=0 TSval=7503893 TSecr=14435385
  178 1.803032225  10.6.15.156 → 192.168.1.12 SSH 1514 Server: Encrypted packet (len=1448)
  179 1.803211299  10.6.15.156 → 192.168.1.12 SSH 1514 Server: Encrypted packet (len=1448)
  180 1.803220557 192.168.1.12 → 10.6.15.156  TCP 66 54766 → 22 [ACK] Seq=6677 Ack=44549 Win=2901 Len=0 TSval=7503893 TSecr=14435386
  181 1.803554181  10.6.15.156 → 192.168.1.12 SSH 1514 Server: Encrypted packet (len=1448)
  182 1.803560183  10.6.15.156 → 192.168.1.12 SSH 126 Server: Encrypted packet (len=60)
  183 1.803564376 192.168.1.12 → 10.6.15.156  TCP 66 54766 → 22 [ACK] Seq=6677 Ack=46057 Win=2901 Len=0 TSval=7503893 TSecr=14435386
  184 1.804785774  10.6.15.156 → 192.168.1.12 SSH 1514 Server: Encrypted packet (len=1448)
  185 1.804958818  10.6.15.156 → 192.168.1.12 SSH 1514 Server: Encrypted packet (len=1448)
  186 1.804965237 192.168.1.12 → 10.6.15.156  TCP 66 54766 → 22 [ACK] Seq=6677 Ack=48953 Win=2901 Len=0 TSval=7503894 TSecr=14435386
  187 1.805149427  10.6.15.156 → 192.168.1.12 SSH 1514 Server: Encrypted packet (len=1448)
  188 1.805313710  10.6.15.156 → 192.168.1.12 SSH 1318 Server: Encrypted packet (len=1252)
  189 1.805320386 192.168.1.12 → 10.6.15.156  TCP 66 54766 → 22 [ACK] Seq=6677 Ack=51653 Win=2901 Len=0 TSval=7503894 TSecr=14435386
  190 1.812433104  10.6.15.156 → 192.168.1.12 SSH 158 Server: Encrypted packet (len=92)
  191 1.812505323 192.168.1.12 → 10.6.15.156  TCP 66 54766 → 22 [ACK] Seq=6677 Ack=51745 Win=2901 Len=0 TSval=7503896 TSecr=14435388
  192 1.814426302  10.6.15.156 → 192.168.1.12 SSH 1514 Server: Encrypted packet (len=1448)
  193 1.814617195  10.6.15.156 → 192.168.1.12 SSH 1514 Server: Encrypted packet (len=1448)
  194 1.814627705 192.168.1.12 → 10.6.15.156  TCP 66 54766 → 22 [ACK] Seq=6677 Ack=54641 Win=2901 Len=0 TSval=7503896 TSecr=14435389
  195 1.814861034  10.6.15.156 → 192.168.1.12 SSH 870 Server: Encrypted packet (len=804)
  196 1.814892690 192.168.1.12 → 10.6.15.156  TCP 66 54766 → 22 [ACK] Seq=6677 Ack=55445 Win=2901 Len=0 TSval=7503896 TSecr=14435389
  197 1.851500659  10.6.15.156 → 192.168.1.12 SSH 138 Server: Encrypted packet (len=72)
  198 1.851583737 192.168.1.12 → 10.6.15.156  TCP 66 54766 → 22 [ACK] Seq=6677 Ack=55517 Win=2901 Len=0 TSval=7503905 TSecr=14435398
  199 1.851810623 192.168.1.12 → 10.6.15.156  SSH 102 Client: Encrypted packet (len=36)
  200 1.853466803  10.6.15.156 → 192.168.1.12 TCP 66 22 → 54766 [ACK] Seq=55517 Ack=6713 Win=1452 Len=0 TSval=14435398 TSecr=7503906
  201 1.861700082  10.6.15.156 → 192.168.1.12 SSH 110 Server: Encrypted packet (len=44)
  202 1.863154840 192.168.1.12 → 10.6.15.156  SSH 406 Client: Encrypted packet (len=340)
  203 1.902464645  10.6.15.156 → 192.168.1.12 TCP 66 22 → 54766 [ACK] Seq=55561 Ack=7053 Win=1452 Len=0 TSval=14435411 TSecr=7503908
  204 2.090926887  10.6.15.156 → 192.168.1.12 SSH 254 Server: Encrypted packet (len=188)
  205 2.091206215 192.168.1.12 → 10.6.15.156  SSH 134 Client: Encrypted packet (len=68)
  206 2.095384966  192.168.1.1 → 239.255.255.250 SSDP 302 NOTIFY * HTTP/1.1 
  207 2.095573975  10.6.15.156 → 192.168.1.12 TCP 66 22 → 54766 [ACK] Seq=55749 Ack=7121 Win=1452 Len=0 TSval=14435458 TSecr=7503965
  208 2.095590666 192.168.1.12 → 10.6.15.156  SSH 1222 Client: Encrypted packet (len=1156)
  209 2.098739428  192.168.1.1 → 239.255.255.250 SSDP 311 NOTIFY * HTTP/1.1 
  210 2.102479137  192.168.1.1 → 239.255.255.250 SSDP 374 NOTIFY * HTTP/1.1 
  211 2.102594162  10.6.15.156 → 192.168.1.12 TCP 66 22 → 54766 [ACK] Seq=55749 Ack=8277 Win=1452 Len=0 TSval=14435460 TSecr=7503966
  212 2.106090989  192.168.1.1 → 239.255.255.250 SSDP 370 NOTIFY * HTTP/1.1 
  213 2.109306586  192.168.1.1 → 239.255.255.250 SSDP 350 NOTIFY * HTTP/1.1 
  214 2.112704759  192.168.1.1 → 239.255.255.250 SSDP 382 NOTIFY * HTTP/1.1 
  215 2.116106287  192.168.1.1 → 239.255.255.250 SSDP 364 NOTIFY * HTTP/1.1 
  216 2.119465789  192.168.1.1 → 239.255.255.250 SSDP 366 NOTIFY * HTTP/1.1 
  217 2.122427171  192.168.1.1 → 239.255.255.250 SSDP 302 NOTIFY * HTTP/1.1 
  218 2.125501638  192.168.1.1 → 239.255.255.250 SSDP 311 NOTIFY * HTTP/1.1 
  219 2.128871547  192.168.1.1 → 239.255.255.250 SSDP 374 NOTIFY * HTTP/1.1 
  220 2.132569568  192.168.1.1 → 239.255.255.250 SSDP 370 NOTIFY * HTTP/1.1 
  221 2.135861480  192.168.1.1 → 239.255.255.250 SSDP 350 NOTIFY * HTTP/1.1 
  222 2.140667880  192.168.1.1 → 239.255.255.250 SSDP 382 NOTIFY * HTTP/1.1 
  223 2.142661957  192.168.1.1 → 239.255.255.250 SSDP 364 NOTIFY * HTTP/1.1 
  224 2.146207960  192.168.1.1 → 239.255.255.250 SSDP 366 NOTIFY * HTTP/1.1 
  225 2.242535004 192.168.1.12 → 10.6.15.156  SSH 862 Client: Encrypted packet (len=796)
  226 2.244603098  10.6.15.156 → 192.168.1.12 TCP 66 22 → 54766 [ACK] Seq=55749 Ack=9073 Win=1452 Len=0 TSval=14435496 TSecr=7504003
  227 2.330487648  10.6.15.156 → 192.168.1.12 SSH 1514 Server: Encrypted packet (len=1448)
  228 2.330633037  10.6.15.156 → 192.168.1.12 SSH 1514 Server: Encrypted packet (len=1448)
  229 2.330642918 192.168.1.12 → 10.6.15.156  TCP 66 54766 → 22 [ACK] Seq=9073 Ack=58645 Win=2901 Len=0 TSval=7504025 TSecr=14435518
  230 2.331257866  10.6.15.156 → 192.168.1.12 SSH 94 Server: Encrypted packet (len=28)
  231 2.331459631  10.6.15.156 → 192.168.1.12 SSH 1514 Server: Encrypted packet (len=1448)
  232 2.331467622 192.168.1.12 → 10.6.15.156  TCP 66 54766 → 22 [ACK] Seq=9073 Ack=60121 Win=2901 Len=0 TSval=7504025 TSecr=14435518
  233 2.331521627  10.6.15.156 → 192.168.1.12 SSH 670 Server: Encrypted packet (len=604)
  234 2.371756513 192.168.1.12 → 10.6.15.156  TCP 66 54766 → 22 [ACK] Seq=9073 Ack=60725 Win=2901 Len=0 TSval=7504036 TSecr=14435518
  235 2.462133677  10.6.15.156 → 192.168.1.12 SSH 454 Server: Encrypted packet (len=388)
  236 2.462160879 192.168.1.12 → 10.6.15.156  TCP 66 54766 → 22 [ACK] Seq=9073 Ack=61113 Win=2901 Len=0 TSval=7504058 TSecr=14435551
  237 2.951760350 192.168.1.12 → 10.6.15.156  SSH 102 Client: Encrypted packet (len=36)
  238 2.953402668  10.6.15.156 → 192.168.1.12 TCP 66 22 → 54766 [ACK] Seq=61113 Ack=9109 Win=1452 Len=0 TSval=14435673 TSecr=7504181
  239 2.953411656 192.168.1.12 → 10.6.15.156  SSH 102 Client: Encrypted packet (len=36)
  240 2.954842170  10.6.15.156 → 192.168.1.12 TCP 66 22 → 54766 [ACK] Seq=61113 Ack=9145 Win=1452 Len=0 TSval=14435674 TSecr=7504181
  241 3.028542109  10.6.15.156 → 192.168.1.12 SSH 110 Server: Encrypted packet (len=44)
  242 3.028558263 192.168.1.12 → 10.6.15.156  TCP 66 54766 → 22 [ACK] Seq=9145 Ack=61157 Win=2901 Len=0 TSval=7504200 TSecr=14435692
  243 3.028962634 192.168.1.12 → 10.6.15.156  SSH 270 Client: Encrypted packet (len=204)
  244 3.030619534  10.6.15.156 → 192.168.1.12 TCP 66 22 → 54766 [ACK] Seq=61157 Ack=9349 Win=1452 Len=0 TSval=14435693 TSecr=7504200
  245 3.157788399  10.6.15.156 → 192.168.1.12 SSH 262 Server: Encrypted packet (len=196)
  246 3.168682066  10.6.15.156 → 192.168.1.12 SSH 138 Server: Encrypted packet (len=72)
  247 3.168755554 192.168.1.12 → 10.6.15.156  TCP 66 54766 → 22 [ACK] Seq=9349 Ack=61425 Win=2901 Len=0 TSval=7504235 TSecr=14435725
  248 3.168890812 192.168.1.12 → 10.6.15.156  SSH 102 Client: Encrypted packet (len=36)
  249 3.170178447  10.6.15.156 → 192.168.1.12 TCP 66 22 → 54766 [ACK] Seq=61425 Ack=9385 Win=1452 Len=0 TSval=14435728 TSecr=7504235
  250 3.238355810 192.168.1.12 → 10.6.15.156  SSH 862 Client: Encrypted packet (len=796)
  251 3.241116857  10.6.15.156 → 192.168.1.12 TCP 66 22 → 54766 [ACK] Seq=61425 Ack=10181 Win=1452 Len=0 TSval=14435745 TSecr=7504252
  252 3.458102200  10.6.15.156 → 192.168.1.12 SSH 462 Server: Encrypted packet (len=396)
  253 3.499752323 192.168.1.12 → 10.6.15.156  TCP 66 54766 → 22 [ACK] Seq=10181 Ack=61821 Win=2901 Len=0 TSval=7504318 TSecr=14435800
  254 3.616736772  10.22.18.61 → 224.0.0.252  LLMNR 64 Standard query 0x103b A wpad
  255 3.617247081  10.22.18.61 → 224.0.0.252  LLMNR 64 Standard query 0x9fa5 A wpad
  256 3.877027454 192.168.1.12 → 10.6.15.156  SSH 270 Client: Encrypted packet (len=204)
  257 3.877242397 192.168.1.12 → 10.6.15.156  SSH 1514 Client: Encrypted packet (len=1448)
  258 3.878104006 192.168.1.12 → 10.6.15.156  SSH 462 Client: Encrypted packet (len=396)
  259 3.880985165  10.6.15.156 → 192.168.1.12 TCP 66 22 → 54766 [ACK] Seq=61821 Ack=10385 Win=1452 Len=0 TSval=14435905 TSecr=7504412
  260 3.881122074  10.6.15.156 → 192.168.1.12 TCP 66 22 → 54766 [ACK] Seq=61821 Ack=12229 Win=1451 Len=0 TSval=14435905 TSecr=7504412
  261 3.881923400  10.6.15.156 → 192.168.1.12 SSH 150 Server: Encrypted packet (len=84)
  262 3.881937595 192.168.1.12 → 10.6.15.156  TCP 66 54766 → 22 [ACK] Seq=12229 Ack=61905 Win=2901 Len=0 TSval=7504413 TSecr=14435906
  263 3.898757517 192.168.1.12 → 10.6.15.156  SSH 102 Client: Encrypted packet (len=36)
  264 3.938435746  10.6.15.156 → 192.168.1.12 TCP 66 22 → 54766 [ACK] Seq=61905 Ack=12265 Win=1452 Len=0 TSval=14435920 TSecr=7504417
  265 3.938459912 192.168.1.12 → 10.6.15.156  SSH 110 Client: Encrypted packet (len=44)
  266 3.939902916  10.6.15.156 → 192.168.1.12 TCP 66 22 → 54766 [ACK] Seq=61905 Ack=12309 Win=1452 Len=0 TSval=14435920 TSecr=7504427
  267 3.996161435  10.6.15.156 → 192.168.1.12 SSH 910 Server: Encrypted packet (len=844)
  268 3.996304382  10.6.15.156 → 192.168.1.12 SSH 286 Server: Encrypted packet (len=220)
  269 3.996332205 192.168.1.12 → 10.6.15.156  TCP 66 54766 → 22 [ACK] Seq=12309 Ack=62969 Win=2901 Len=0 TSval=7504442 TSecr=14435934
  270 3.996962738  10.6.15.156 → 192.168.1.12 SSH 134 Server: Encrypted packet (len=68)
  271 3.997139859 192.168.1.12 → 10.6.15.156  SSH 142 Client: Encrypted packet (len=76)
  272 3.998617571  10.6.15.156 → 192.168.1.12 TCP 66 22 → 54766 [ACK] Seq=63037 Ack=12385 Win=1452 Len=0 TSval=14435935 TSecr=7504442
  273 4.002660939  10.6.15.156 → 192.168.1.12 SSH 138 Server: Encrypted packet (len=72)
  274 4.002846009 192.168.1.12 → 10.6.15.156  SSH 102 Client: Encrypted packet (len=36)
  275 4.036512967  10.22.18.61 → 224.0.0.252  LLMNR 64 Standard query 0x9fa5 A wpad
  276 4.036574434  10.22.18.61 → 224.0.0.252  LLMNR 64 Standard query 0x103b A wpad
  277 4.041693658  10.6.15.156 → 192.168.1.12 TCP 66 22 → 54766 [ACK] Seq=63109 Ack=12421 Win=1452 Len=0 TSval=14435946 TSecr=7504443
  278 4.156840726  10.6.15.156 → 192.168.1.12 SSH 110 Server: Encrypted packet (len=44)
  279 4.157244506 192.168.1.12 → 10.6.15.156  SSH 294 Client: Encrypted packet (len=228)
  280 4.158971276  10.6.15.156 → 192.168.1.12 TCP 66 22 → 54766 [ACK] Seq=63153 Ack=12649 Win=1452 Len=0 TSval=14435975 TSecr=7504482
  281 4.378080437  10.6.15.156 → 192.168.1.12 SSH 310 Server: Encrypted packet (len=244)
  282 4.385290525 192.168.1.12 → 10.6.15.156  SSH 182 Client: Encrypted packet (len=116)
  283 4.386914197  10.6.15.156 → 192.168.1.12 TCP 66 22 → 54766 [ACK] Seq=63397 Ack=12765 Win=1452 Len=0 TSval=14436032 TSecr=7504539
  284 4.605837399  10.6.15.156 → 192.168.1.12 SSH 118 Server: Encrypted packet (len=52)
  285 4.647722970 192.168.1.12 → 10.6.15.156  TCP 66 54766 → 22 [ACK] Seq=12765 Ack=63449 Win=2901 Len=0 TSval=7504605 TSecr=14436087
  286 4.830204922  10.22.18.61 → 224.0.0.252  LLMNR 64 Standard query 0x3a75 ANY gawd
  287 5.239282170 192.168.1.12 → 10.6.15.156  SSH 102 Client: Encrypted packet (len=36)
  288 5.241598498  10.6.15.156 → 192.168.1.12 TCP 66 22 → 54766 [ACK] Seq=63449 Ack=12801 Win=1452 Len=0 TSval=14436245 TSecr=7504752
  289 5.241619164 192.168.1.12 → 10.6.15.156  SSH 898 Client: Encrypted packet (len=832)
  290 5.243750623  10.6.15.156 → 192.168.1.12 TCP 66 22 → 54766 [ACK] Seq=63449 Ack=13633 Win=1452 Len=0 TSval=14436246 TSecr=7504753
  291 5.246097493  10.22.18.61 → 224.0.0.252  LLMNR 64 Standard query 0x3a75 ANY gawd
  292 5.366058593  10.6.15.156 → 192.168.1.12 SSH 138 Server: Encrypted packet (len=72)
  293 5.366075108 192.168.1.12 → 10.6.15.156  TCP 66 54766 → 22 [ACK] Seq=13633 Ack=63521 Win=2901 Len=0 TSval=7504784 TSecr=14436276
  294 5.366245968 192.168.1.12 → 10.6.15.156  SSH 102 Client: Encrypted packet (len=36)
  295 5.367612104  10.6.15.156 → 192.168.1.12 TCP 66 22 → 54766 [ACK] Seq=63521 Ack=13669 Win=1452 Len=0 TSval=14436277 TSecr=7504784
  296 5.375277902  10.6.15.156 → 192.168.1.12 SSH 138 Server: Encrypted packet (len=72)
  297 5.375452455 192.168.1.12 → 10.6.15.156  SSH 102 Client: Encrypted packet (len=36)
  298 5.417116649  10.6.15.156 → 192.168.1.12 TCP 66 22 → 54766 [ACK] Seq=63593 Ack=13705 Win=1452 Len=0 TSval=14436289 TSecr=7504786
  299 5.462135335  10.6.15.156 → 192.168.1.12 SSH 454 Server: Encrypted packet (len=388)
  300 5.503754394 192.168.1.12 → 10.6.15.156  TCP 66 54766 → 22 [ACK] Seq=13705 Ack=63981 Win=2901 Len=0 TSval=7504819 TSecr=14436300
  301 5.668990681  10.22.18.61 → 224.0.0.252  LLMNR 64 Standard query 0x17cb ANY gawd
  302 6.083099172  10.22.18.61 → 224.0.0.252  LLMNR 64 Standard query 0x17cb ANY gawd
  303 6.241603396 192.168.1.12 → 10.6.15.156  SSH 862 Client: Encrypted packet (len=796)
  304 6.243780255  10.6.15.156 → 192.168.1.12 TCP 66 22 → 54766 [ACK] Seq=63981 Ack=14501 Win=1452 Len=0 TSval=14436496 TSecr=7505003
  305 6.243789749 192.168.1.12 → 10.6.15.156  SSH 126 Client: Encrypted packet (len=60)
  306 6.245423386  10.6.15.156 → 192.168.1.12 TCP 66 22 → 54766 [ACK] Seq=63981 Ack=14561 Win=1452 Len=0 TSval=14436497 TSecr=7505004
  307 6.461532242  10.6.15.156 → 192.168.1.12 SSH 490 Server: Encrypted packet (len=424)
  308 6.461559781 192.168.1.12 → 10.6.15.156  TCP 66 54766 → 22 [ACK] Seq=14561 Ack=64405 Win=2901 Len=0 TSval=7505058 TSecr=14436551
  309 6.462806369 192.168.1.12 → 10.6.15.156  SSH 222 Client: Encrypted packet (len=156)
  310 6.465057609  10.6.15.156 → 192.168.1.12 TCP 66 22 → 54766 [ACK] Seq=64405 Ack=14717 Win=1452 Len=0 TSval=14436551 TSecr=7505058
  311 6.465073029 192.168.1.12 → 10.6.15.156  SSH 862 Client: Encrypted packet (len=796)
  312 6.467605901  10.6.15.156 → 192.168.1.12 TCP 66 22 → 54766 [ACK] Seq=64405 Ack=15513 Win=1452 Len=0 TSval=14436552 TSecr=7505059
  313 6.507201640  10.22.18.61 → 224.0.0.252  LLMNR 64 Standard query 0x97fb ANY gawd
  314 6.632594825  192.168.1.1 → 255.255.255.255 DHCP 298 DHCP NAK      - Transaction ID 0xa0c2f253
  315 6.682302949  10.6.15.156 → 192.168.1.12 SSH 1514 Server: Encrypted packet (len=1448)
  316 6.682869065  10.6.15.156 → 192.168.1.12 SSH 1254 Server: Encrypted packet (len=1188)
  317 6.682882375 192.168.1.12 → 10.6.15.156  TCP 66 54766 → 22 [ACK] Seq=15513 Ack=67041 Win=2901 Len=0 TSval=7505113 TSecr=14436606
  318 6.683823503  10.6.15.156 → 192.168.1.12 SSH 1070 Server: Encrypted packet (len=1004)
  319 6.684383100  10.6.15.156 → 192.168.1.12 SSH 454 Server: Encrypted packet (len=388)
  320 6.684409499 192.168.1.12 → 10.6.15.156  TCP 66 54766 → 22 [ACK] Seq=15513 Ack=68433 Win=2901 Len=0 TSval=7505114 TSecr=14436606
  321 6.684694103 192.168.1.12 → 10.6.15.156  SSH 214 Client: Encrypted packet (len=148)
  322 6.685918893  10.6.15.156 → 192.168.1.12 TCP 66 22 → 54766 [ACK] Seq=68433 Ack=15661 Win=1452 Len=0 TSval=14436607 TSecr=7505114
  323 6.902060686  10.6.15.156 → 192.168.1.12 SSH 150 Server: Encrypted packet (len=84)
  324 6.913118483  10.22.18.61 → 224.0.0.252  LLMNR 64 Standard query 0x97fb ANY gawd
  325 6.943702768 192.168.1.12 → 10.6.15.156  TCP 66 54766 → 22 [ACK] Seq=15661 Ack=68517 Win=2901 Len=0 TSval=7505179 TSecr=14436661
  326 7.799937338  10.22.18.61 → 224.0.0.252  LLMNR 64 Standard query 0x2a5c ANY gawd
  327 8.233374859  10.22.18.61 → 224.0.0.252  LLMNR 64 Standard query 0x2a5c ANY gawd
  328 8.240167337 192.168.1.12 → 10.6.15.156  SSH 862 Client: Encrypted packet (len=796)
  329 8.242405411  10.6.15.156 → 192.168.1.12 TCP 66 22 → 54766 [ACK] Seq=68517 Ack=16457 Win=1452 Len=0 TSval=14436996 TSecr=7505503
  330 8.459488945  10.6.15.156 → 192.168.1.12 SSH 454 Server: Encrypted packet (len=388)
  331 8.459510083 192.168.1.12 → 10.6.15.156  TCP 66 54766 → 22 [ACK] Seq=16457 Ack=68905 Win=2901 Len=0 TSval=7505557 TSecr=14437050
  332 9.134228757  10.22.18.61 → 224.0.0.252  LLMNR 64 Standard query 0xfc9d ANY gawd
  333 9.238921084 192.168.1.12 → 10.6.15.156  SSH 862 Client: Encrypted packet (len=796)
  334 9.241150332  10.6.15.156 → 192.168.1.12 TCP 66 22 → 54766 [ACK] Seq=68905 Ack=17253 Win=1452 Len=0 TSval=14437245 TSecr=7505752
  335 9.270658655  10.22.18.61 → 224.0.0.252  LLMNR 64 Standard query 0xbb91 A wpad
  336 9.271841930  10.22.18.61 → 224.0.0.252  LLMNR 64 Standard query 0x5a0f A wpad
  337 9.458261405  10.6.15.156 → 192.168.1.12 SSH 454 Server: Encrypted packet (len=388)
  338 9.458289786 192.168.1.12 → 10.6.15.156  TCP 66 54766 → 22 [ACK] Seq=17253 Ack=69293 Win=2901 Len=0 TSval=7505807 TSecr=14437300
  339 9.537375204  10.22.18.61 → 224.0.0.252  LLMNR 64 Standard query 0xfc9d ANY gawd
  340 9.698451063  10.22.18.63 → 224.0.0.252  LLMNR 64 Standard query 0x5201 A wpad
  341 9.721665972  10.22.18.61 → 224.0.0.252  LLMNR 64 Standard query 0x5a0f A wpad
  342 9.721690169  10.22.18.61 → 224.0.0.252  LLMNR 64 Standard query 0xbb91 A wpad
  343 10.109360330  10.22.18.63 → 224.0.0.252  LLMNR 64 Standard query 0x5201 A wpad
  344 11.241733319 192.168.1.12 → 10.6.15.156  SSH 862 Client: Encrypted packet (len=796)
  345 11.244031989  10.6.15.156 → 192.168.1.12 TCP 66 22 → 54766 [ACK] Seq=69293 Ack=18049 Win=1452 Len=0 TSval=14437746 TSecr=7506253
  346 11.282687212 192.168.1.12 → 10.6.15.156  SSH 158 Client: Encrypted packet (len=92)
  347 11.282983165 192.168.1.12 → 10.6.15.156  SSH 162 Client: Encrypted packet (len=96)
  348 11.285279301  10.6.15.156 → 192.168.1.12 TCP 66 22 → 54766 [ACK] Seq=69293 Ack=18141 Win=1452 Len=0 TSval=14437756 TSecr=7506263
  349 11.285376854  10.6.15.156 → 192.168.1.12 TCP 66 22 → 54766 [ACK] Seq=69293 Ack=18237 Win=1452 Len=0 TSval=14437756 TSecr=7506263
  350 11.319916510  10.6.15.156 → 192.168.1.12 SSH 110 Server: Encrypted packet (len=44)
  351 11.319934174 192.168.1.12 → 10.6.15.156  TCP 66 54766 → 22 [ACK] Seq=18237 Ack=69337 Win=2901 Len=0 TSval=7506273 TSecr=14437765
  352 11.320338141 192.168.1.12 → 10.6.15.156  SSH 510 Client: Encrypted packet (len=444)
  353 11.357821043  10.6.15.156 → 192.168.1.12 SSH 246 Server: Encrypted packet (len=180)
  354 11.358312437 192.168.1.12 → 10.6.15.156  SSH 302 Client: Encrypted packet (len=236)
  355 11.397472922  10.6.15.156 → 192.168.1.12 TCP 66 22 → 54766 [ACK] Seq=69517 Ack=18917 Win=1452 Len=0 TSval=14437785 TSecr=7506282
  356 11.397493958 192.168.1.12 → 10.6.15.156  SSH 834 Client: Encrypted packet (len=768)
  357 11.400098936  10.6.15.156 → 192.168.1.12 TCP 66 22 → 54766 [ACK] Seq=69517 Ack=19685 Win=1452 Len=0 TSval=14437785 TSecr=7506292
  358 11.435797596  10.6.15.156 → 192.168.1.12 SSH 198 Server: Encrypted packet (len=132)
  359 11.435986493  10.6.15.156 → 192.168.1.12 SSH 526 Server: Encrypted packet (len=460)
  360 11.436055696 192.168.1.12 → 10.6.15.156  TCP 66 54766 → 22 [ACK] Seq=19685 Ack=70109 Win=2901 Len=0 TSval=7506302 TSecr=14437794
  361 11.436149801 192.168.1.12 → 10.6.15.156  SSH 134 Client: Encrypted packet (len=68)
  362 11.461019133  10.6.15.156 → 192.168.1.12 SSH 454 Server: Encrypted packet (len=388)
  363 11.461039169 192.168.1.12 → 10.6.15.156  SSH 142 Client: Encrypted packet (len=76)
  364 11.501383179  10.6.15.156 → 192.168.1.12 TCP 66 22 → 54766 [ACK] Seq=70497 Ack=19829 Win=1452 Len=0 TSval=14437811 TSecr=7506308
  365 11.501408955 192.168.1.12 → 10.6.15.156  SSH 1410 Client: Encrypted packet (len=1344)
  366 11.503973237  10.6.15.156 → 192.168.1.12 TCP 66 22 → 54766 [ACK] Seq=70497 Ack=21173 Win=1452 Len=0 TSval=14437811 TSecr=7506318
  367 11.504965488 192.168.1.12 → 10.6.15.156  SSH 102 Client: Encrypted packet (len=36)
  368 11.506273796  10.6.15.156 → 192.168.1.12 TCP 66 22 → 54766 [ACK] Seq=70497 Ack=21209 Win=1452 Len=0 TSval=14437812 TSecr=7506319
  369 11.506286714 192.168.1.12 → 10.6.15.156  SSH 138 Client: Encrypted packet (len=72)
  370 11.510020972  10.6.15.156 → 192.168.1.12 TCP 66 22 → 54766 [ACK] Seq=70497 Ack=21281 Win=1452 Len=0 TSval=14437812 TSecr=7506319
  371 11.510047979 192.168.1.12 → 10.6.15.156  SSH 102 Client: Encrypted packet (len=36)
  372 11.511430558  10.6.15.156 → 192.168.1.12 TCP 66 22 → 54766 [ACK] Seq=70497 Ack=21317 Win=1452 Len=0 TSval=14437813 TSecr=7506320
  373 11.511451233 192.168.1.12 → 10.6.15.156  SSH 146 Client: Encrypted packet (len=80)
  374 11.511732113 192.168.1.12 → 10.6.15.156  SSH 102 Client: Encrypted packet (len=36)
  375 11.513155158  10.6.15.156 → 192.168.1.12 TCP 66 22 → 54766 [ACK] Seq=70497 Ack=21397 Win=1452 Len=0 TSval=14437813 TSecr=7506320
  376 11.513176116 192.168.1.12 → 10.6.15.156  SSH 118 Client: Encrypted packet (len=52)
  377 11.513283641  10.6.15.156 → 192.168.1.12 TCP 66 22 → 54766 [ACK] Seq=70497 Ack=21433 Win=1452 Len=0 TSval=14437814 TSecr=7506321
  378 11.514796666  10.6.15.156 → 192.168.1.12 TCP 66 22 → 54766 [ACK] Seq=70497 Ack=21485 Win=1452 Len=0 TSval=14437814 TSecr=7506321
  379 11.515237909  10.6.15.156 → 192.168.1.12 SSH 102 Server: Encrypted packet (len=36)
  380 11.515607896 192.168.1.12 → 10.6.15.156  SSH 398 Client: Encrypted packet (len=332)
  381 11.556564545  10.6.15.156 → 192.168.1.12 SSH 518 Server: Encrypted packet (len=452)
  382 11.563589460 192.168.1.12 → 10.6.15.156  SSH 102 Client: Encrypted packet (len=36)
  383 11.563823355 192.168.1.12 → 10.6.15.156  SSH 102 Client: Encrypted packet (len=36)
  384 11.565205943  10.6.15.156 → 192.168.1.12 TCP 66 22 → 54766 [ACK] Seq=70985 Ack=21889 Win=1452 Len=0 TSval=14437827 TSecr=7506333
  385 11.567275386  10.6.15.156 → 192.168.1.12 SSH 138 Server: Encrypted packet (len=72)
  386 11.567452033 192.168.1.12 → 10.6.15.156  SSH 102 Client: Encrypted packet (len=36)
  387 11.579288580  10.6.15.156 → 192.168.1.12 SSH 110 Server: Encrypted packet (len=44)
