    1 0.000000000  10.6.15.156 → 192.168.1.12 SSH 1514 Server: Encrypted packet (len=1448)
    2 0.000179465  10.6.15.156 → 192.168.1.12 SSH 1514 Server: Encrypted packet (len=1448)
    3 0.000190072 192.168.1.12 → 10.6.15.156  TCP 66 54766 → 22 [ACK] Seq=1 Ack=2897 Win=4866 Len=0 TSval=7728466 TSecr=14659961
    4 0.000787689  10.6.15.156 → 192.168.1.12 SSH 1514 Server: Encrypted packet (len=1448)
    5 0.000979201  10.6.15.156 → 192.168.1.12 SSH 1514 Server: Encrypted packet (len=1448)
    6 0.000983783 192.168.1.12 → 10.6.15.156  TCP 66 54766 → 22 [ACK] Seq=1 Ack=5793 Win=4866 Len=0 TSval=7728466 TSecr=14659961
    7 0.000991490  10.6.15.156 → 192.168.1.12 SSH 110 Server: Encrypted packet (len=44)
    8 0.002097151  10.6.15.156 → 192.168.1.12 SSH 1514 Server: Encrypted packet (len=1448)
    9 0.002104111 192.168.1.12 → 10.6.15.156  TCP 66 54766 → 22 [ACK] Seq=1 Ack=7285 Win=4866 Len=0 TSval=7728467 TSecr=14659961
   10 0.002284786  10.6.15.156 → 192.168.1.12 SSH 1514 Server: Encrypted packet (len=1448)
   11 0.002475951  10.6.15.156 → 192.168.1.12 SSH 1514 Server: Encrypted packet (len=1448)
   12 0.002478459 192.168.1.12 → 10.6.15.156  TCP 66 54766 → 22 [ACK] Seq=1 Ack=10181 Win=4866 Len=0 TSval=7728467 TSecr=14659962
   13 0.002668557  10.6.15.156 → 192.168.1.12 SSH 1514 Server: Encrypted packet (len=1448)
   14 0.002859871  10.6.15.156 → 192.168.1.12 SSH 1514 Server: Encrypted packet (len=1448)
   15 0.002861867 192.168.1.12 → 10.6.15.156  TCP 66 54766 → 22 [ACK] Seq=1 Ack=13077 Win=4866 Len=0 TSval=7728467 TSecr=14659962
   16 0.003053429  10.6.15.156 → 192.168.1.12 SSH 1514 Server: Encrypted packet (len=1448)
   17 0.003058270  10.6.15.156 → 192.168.1.12 SSH 110 Server: Encrypted packet (len=44)
   18 0.003060489 192.168.1.12 → 10.6.15.156  TCP 66 54766 → 22 [ACK] Seq=1 Ack=14569 Win=4866 Len=0 TSval=7728467 TSecr=14659962
   19 0.006991037  10.6.15.156 → 192.168.1.12 SSH 390 Server: Encrypted packet (len=324)
   20 0.043028134  10.6.15.156 → 192.168.1.12 SSH 374 Server: Encrypted packet (len=308)
   21 0.043047015 192.168.1.12 → 10.6.15.156  TCP 66 54766 → 22 [ACK] Seq=1 Ack=15201 Win=4866 Len=0 TSval=7728477 TSecr=14659963
   22 0.043074108  10.6.15.156 → 192.168.1.12 SSH 358 Server: Encrypted packet (len=292)
   23 0.043744906  10.6.15.156 → 192.168.1.12 SSH 334 Server: Encrypted packet (len=268)
   24 0.043789794 192.168.1.12 → 10.6.15.156  TCP 66 54766 → 22 [ACK] Seq=1 Ack=15761 Win=4866 Len=0 TSval=7728477 TSecr=14659972
   25 0.126098532  10.6.15.156 → 192.168.1.12 SSH 446 Server: Encrypted packet (len=380)
   26 0.169100761 192.168.1.12 → 10.6.15.156  TCP 66 54766 → 22 [ACK] Seq=1 Ack=16141 Win=4866 Len=0 TSval=7728509 TSecr=14659993
   27 0.176512266  10.6.15.156 → 192.168.1.12 SSH 1514 Server: Encrypted packet (len=1448)
   28 0.176693222  10.6.15.156 → 192.168.1.12 SSH 1514 Server: Encrypted packet (len=1448)
   29 0.176706000 192.168.1.12 → 10.6.15.156  TCP 66 54766 → 22 [ACK] Seq=1 Ack=19037 Win=4866 Len=0 TSval=7728510 TSecr=14660005
   30 0.176881761  10.6.15.156 → 192.168.1.12 SSH 1514 Server: Encrypted packet (len=1448)
   31 0.177072272  10.6.15.156 → 192.168.1.12 SSH 1514 Server: Encrypted packet (len=1448)
   32 0.177089452 192.168.1.12 → 10.6.15.156  TCP 66 54766 → 22 [ACK] Seq=1 Ack=21933 Win=4866 Len=0 TSval=7728510 TSecr=14660005
   33 0.177103604  10.6.15.156 → 192.168.1.12 SSH 110 Server: Encrypted packet (len=44)
   34 0.177155356 192.168.1.12 → 10.6.15.156  TCP 66 54766 → 22 [ACK] Seq=1 Ack=21977 Win=4866 Len=0 TSval=7728511 TSecr=14660005
   35 0.178936915  10.6.15.156 → 192.168.1.12 SSH 1514 Server: Encrypted packet (len=1448)
   36 0.179118067  10.6.15.156 → 192.168.1.12 SSH 1514 Server: Encrypted packet (len=1448)
   37 0.179126044 192.168.1.12 → 10.6.15.156  TCP 66 54766 → 22 [ACK] Seq=1 Ack=24873 Win=4866 Len=0 TSval=7728511 TSecr=14660006
   38 0.179309681  10.6.15.156 → 192.168.1.12 SSH 1514 Server: Encrypted packet (len=1448)
   39 0.179502882  10.6.15.156 → 192.168.1.12 SSH 1514 Server: Encrypted packet (len=1448)
   40 0.179506198 192.168.1.12 → 10.6.15.156  TCP 66 54766 → 22 [ACK] Seq=1 Ack=27769 Win=4866 Len=0 TSval=7728511 TSecr=14660006
   41 0.179730410  10.6.15.156 → 192.168.1.12 SSH 1514 Server: Encrypted packet (len=1448)
   42 0.179898539  10.6.15.156 → 192.168.1.12 SSH 1514 Server: Encrypted packet (len=1448)
   43 0.179902771 192.168.1.12 → 10.6.15.156  TCP 66 54766 → 22 [ACK] Seq=1 Ack=30665 Win=4866 Len=0 TSval=7728511 TSecr=14660006
   44 0.180090739  10.6.15.156 → 192.168.1.12 SSH 1514 Server: Encrypted packet (len=1448)
   45 0.187312663  10.6.15.156 → 192.168.1.12 SSH 1514 Server: Encrypted packet (len=1448)
   46 0.187332582 192.168.1.12 → 10.6.15.156  TCP 66 54766 → 22 [ACK] Seq=1 Ack=33561 Win=4866 Len=0 TSval=7728513 TSecr=14660006
   47 0.187493090  10.6.15.156 → 192.168.1.12 SSH 1514 Server: Encrypted packet (len=1448)
   48 0.187497911  10.6.15.156 → 192.168.1.12 SSH 1514 Server: Encrypted packet (len=1448)
   49 0.187502549 192.168.1.12 → 10.6.15.156  TCP 66 54766 → 22 [ACK] Seq=1 Ack=36457 Win=4866 Len=0 TSval=7728513 TSecr=14660006
   50 0.187507064  10.6.15.156 → 192.168.1.12 SSH 1514 Server: Encrypted packet (len=1448)
   51 0.187509556  10.6.15.156 → 192.168.1.12 SSH 110 Server: Encrypted packet (len=44)
   52 0.187511785 192.168.1.12 → 10.6.15.156  TCP 66 54766 → 22 [ACK] Seq=1 Ack=37949 Win=4866 Len=0 TSval=7728513 TSecr=14660006
   53 0.187514457  10.6.15.156 → 192.168.1.12 SSH 1514 Server: Encrypted packet (len=1448)
   54 0.189396773  10.6.15.156 → 192.168.1.12 SSH 1514 Server: Encrypted packet (len=1448)
   55 0.189411470 192.168.1.12 → 10.6.15.156  TCP 66 54766 → 22 [ACK] Seq=1 Ack=40845 Win=4866 Len=0 TSval=7728514 TSecr=14660006
   56 0.189422960  10.6.15.156 → 192.168.1.12 SSH 1514 Server: Encrypted packet (len=1448)
   57 0.189426478  10.6.15.156 → 192.168.1.12 SSH 1514 Server: Encrypted packet (len=1448)
   58 0.189428844 192.168.1.12 → 10.6.15.156  TCP 66 54766 → 22 [ACK] Seq=1 Ack=43741 Win=4866 Len=0 TSval=7728514 TSecr=14660006
   59 0.190053982  10.6.15.156 → 192.168.1.12 SSH 1514 Server: Encrypted packet (len=1448)
   60 0.190064084  10.6.15.156 → 192.168.1.12 SSH 110 Server: Encrypted packet (len=44)
   61 0.190068408 192.168.1.12 → 10.6.15.156  TCP 66 54766 → 22 [ACK] Seq=1 Ack=45233 Win=4866 Len=0 TSval=7728514 TSecr=14660007
   62 0.304426441 192.168.1.12 → 10.6.15.156  SSH 598 Client: Encrypted packet (len=532)
   63 0.306343096  10.6.15.156 → 192.168.1.12 TCP 66 22 → 54766 [ACK] Seq=45233 Ack=533 Win=1452 Len=0 TSval=14660038 TSecr=7728542
   64 0.347574099 192.168.1.12 → 10.6.15.156  SSH 726 Client: Encrypted packet (len=660)
   65 0.350547804  10.6.15.156 → 192.168.1.12 TCP 66 22 → 54766 [ACK] Seq=45233 Ack=1193 Win=1452 Len=0 TSval=14660049 TSecr=7728553
   66 0.350560196 192.168.1.12 → 10.6.15.156  SSH 950 Client: Encrypted packet (len=884)
   67 0.352628741  10.6.15.156 → 192.168.1.12 SSH 1514 Server: Encrypted packet (len=1448)
   68 0.352836552  10.6.15.156 → 192.168.1.12 SSH 1514 Server: Encrypted packet (len=1448)
   69 0.352849920 192.168.1.12 → 10.6.15.156  TCP 66 54766 → 22 [ACK] Seq=2077 Ack=48129 Win=4866 Len=0 TSval=7728554 TSecr=14660049
   70 0.352868064  10.6.15.156 → 192.168.1.12 SSH 110 Server: Encrypted packet (len=44)
   71 0.352898165 192.168.1.12 → 10.6.15.156  TCP 66 54766 → 22 [ACK] Seq=2077 Ack=48173 Win=4866 Len=0 TSval=7728554 TSecr=14660049
   72 0.353068469  10.6.15.156 → 192.168.1.12 SSH 1514 Server: Encrypted packet (len=1448)
   73 0.353283416  10.6.15.156 → 192.168.1.12 SSH 1514 Server: Encrypted packet (len=1448)
   74 0.353291433 192.168.1.12 → 10.6.15.156  TCP 66 54766 → 22 [ACK] Seq=2077 Ack=51069 Win=4866 Len=0 TSval=7728555 TSecr=14660049
   75 0.353495254  10.6.15.156 → 192.168.1.12 SSH 1514 Server: Encrypted packet (len=1448)
   76 0.353608652  10.6.15.156 → 192.168.1.12 SSH 918 Server: Encrypted packet (len=852)
   77 0.353613699 192.168.1.12 → 10.6.15.156  TCP 66 54766 → 22 [ACK] Seq=2077 Ack=53369 Win=4866 Len=0 TSval=7728555 TSecr=14660049
   78 0.353996115 192.168.1.12 → 10.6.15.156  SSH 102 Client: Encrypted packet (len=36)
   79 0.355233544  10.6.15.156 → 192.168.1.12 TCP 66 22 → 54766 [ACK] Seq=53369 Ack=2113 Win=1452 Len=0 TSval=14660050 TSecr=7728554
   80 0.361786565  10.6.15.156 → 192.168.1.12 SSH 390 Server: Encrypted packet (len=324)
   81 0.405104969 192.168.1.12 → 10.6.15.156  TCP 66 54766 → 22 [ACK] Seq=2113 Ack=53693 Win=4866 Len=0 TSval=7728568 TSecr=14660052
   82 0.423082308  10.6.15.156 → 192.168.1.12 SSH 486 Server: Encrypted packet (len=420)
   83 0.423148679 192.168.1.12 → 10.6.15.156  TCP 66 54766 → 22 [ACK] Seq=2113 Ack=54113 Win=4866 Len=0 TSval=7728572 TSecr=14660067
   84 0.485818137  10.6.15.156 → 192.168.1.12 SSH 598 Server: Encrypted packet (len=532)
   85 0.485897457 192.168.1.12 → 10.6.15.156  TCP 66 54766 → 22 [ACK] Seq=2113 Ack=54645 Win=4866 Len=0 TSval=7728588 TSecr=14660083
   86 0.523655367 192.168.1.12 → 10.6.15.156  SSH 102 Client: Encrypted packet (len=36)
   87 0.525651030 192.168.1.12 → 10.6.15.156  SSH 1514 Client: Encrypted packet (len=1448)
   88 0.526308312 192.168.1.12 → 10.6.15.156  SSH 402 Client: Encrypted packet (len=336)
   89 0.528097634  10.6.15.156 → 192.168.1.12 TCP 66 22 → 54766 [ACK] Seq=54645 Ack=3933 Win=1452 Len=0 TSval=14660094 TSecr=7728597
   90 0.562123271 192.168.1.12 → 10.6.15.156  SSH 678 Client: Encrypted packet (len=612)
   91 0.567124442  10.6.15.156 → 192.168.1.12 SSH 142 Server: Encrypted packet (len=76)
   92 0.600484582  10.6.15.156 → 192.168.1.12 SSH 870 Server: Encrypted packet (len=804)
   93 0.600500525 192.168.1.12 → 10.6.15.156  TCP 66 54766 → 22 [ACK] Seq=4545 Ack=55525 Win=4866 Len=0 TSval=7728616 TSecr=14660103
   94 0.601307102 192.168.1.12 → 10.6.15.156  SSH 142 Client: Encrypted packet (len=76)
   95 0.640191457  10.6.15.156 → 192.168.1.12 TCP 66 22 → 54766 [ACK] Seq=55525 Ack=4621 Win=1452 Len=0 TSval=14660122 TSecr=7728617
   96 0.640208977 192.168.1.12 → 10.6.15.156  SSH 310 Client: Encrypted packet (len=244)
   97 0.641934245  10.6.15.156 → 192.168.1.12 TCP 66 22 → 54766 [ACK] Seq=55525 Ack=4865 Win=1452 Len=0 TSval=14660122 TSecr=7728626
   98 0.670670969  10.6.15.156 → 192.168.1.12 SSH 110 Server: Encrypted packet (len=44)
   99 0.671020879 192.168.1.12 → 10.6.15.156  SSH 198 Client: Encrypted packet (len=132)
  100 0.676654099  10.6.15.156 → 192.168.1.12 SSH 142 Server: Encrypted packet (len=76)
  101 0.678098392  10.6.15.156 → 192.168.1.12 SSH 774 Server: Encrypted packet (len=708)
  102 0.678178021 192.168.1.12 → 10.6.15.156  TCP 66 54766 → 22 [ACK] Seq=4997 Ack=56353 Win=4866 Len=0 TSval=7728636 TSecr=14660131
  103 0.678815480 192.168.1.12 → 10.6.15.156  SSH 134 Client: Encrypted packet (len=68)
  104 0.680138170  10.6.15.156 → 192.168.1.12 SSH 710 Server: Encrypted packet (len=644)
  105 0.702803597  10.6.15.156 → 192.168.1.12 SSH 138 Server: Encrypted packet (len=72)
  106 0.702869428 192.168.1.12 → 10.6.15.156  TCP 66 54766 → 22 [ACK] Seq=5065 Ack=57069 Win=4866 Len=0 TSval=7728642 TSecr=14660131
  107 0.703020227 192.168.1.12 → 10.6.15.156  SSH 102 Client: Encrypted packet (len=36)
  108 0.744203367  10.6.15.156 → 192.168.1.12 TCP 66 22 → 54766 [ACK] Seq=57069 Ack=5101 Win=1452 Len=0 TSval=14660148 TSecr=7728642
  109 0.817959287  10.6.15.156 → 192.168.1.12 SSH 270 Server: Encrypted packet (len=204)
  110 0.818260029 192.168.1.12 → 10.6.15.156  SSH 166 Client: Encrypted packet (len=100)
  111 0.819977212  10.6.15.156 → 192.168.1.12 TCP 66 22 → 54766 [ACK] Seq=57273 Ack=5201 Win=1452 Len=0 TSval=14660167 TSecr=7728671
  112 0.819985182 192.168.1.12 → 10.6.15.156  SSH 726 Client: Encrypted packet (len=660)
  113 0.822014801  10.6.15.156 → 192.168.1.12 TCP 66 22 → 54766 [ACK] Seq=57273 Ack=5861 Win=1452 Len=0 TSval=14660167 TSecr=7728671
  114 0.972836822  10.6.15.156 → 192.168.1.12 SSH 1174 Server: Encrypted packet (len=1108)
  115 0.985438489 192.168.1.12 → 10.6.15.156  SSH 790 Client: Encrypted packet (len=724)
  116 0.987558227  10.6.15.156 → 192.168.1.12 TCP 66 22 → 54766 [ACK] Seq=58381 Ack=6585 Win=1452 Len=0 TSval=14660208 TSecr=7728713
  117 0.988091742 192.168.1.12 → 10.6.15.156  SSH 206 Client: Encrypted packet (len=140)
  118 0.990521417  10.6.15.156 → 192.168.1.12 TCP 66 22 → 54766 [ACK] Seq=58381 Ack=6725 Win=1452 Len=0 TSval=14660209 TSecr=7728713
  119 1.018513577 192.168.1.12 → 10.6.15.156  SSH 182 Client: Encrypted packet (len=116)
  120 1.020190395  10.6.15.156 → 192.168.1.12 TCP 66 22 → 54766 [ACK] Seq=58381 Ack=6841 Win=1452 Len=0 TSval=14660217 TSecr=7728721
  121 1.082750696 192.168.1.12 → 10.6.15.156  SSH 494 Client: Encrypted packet (len=428)
  122 1.084845320  10.6.15.156 → 192.168.1.12 TCP 66 22 → 54766 [ACK] Seq=58381 Ack=7269 Win=1452 Len=0 TSval=14660233 TSecr=7728737
  123 1.144196555 192.168.1.12 → 10.6.15.156  SSH 102 Client: Encrypted packet (len=36)
  124 1.145745868  10.6.15.156 → 192.168.1.12 TCP 66 22 → 54766 [ACK] Seq=58381 Ack=7305 Win=1452 Len=0 TSval=14660248 TSecr=7728752
  125 1.145760310 192.168.1.12 → 10.6.15.156  SSH 126 Client: Encrypted packet (len=60)
  126 1.147371266  10.6.15.156 → 192.168.1.12 TCP 66 22 → 54766 [ACK] Seq=58381 Ack=7365 Win=1452 Len=0 TSval=14660248 TSecr=7728753
  127 1.150435236  10.6.15.156 → 192.168.1.12 SSH 1494 Server: Encrypted packet (len=1428)
  128 1.166270239  10.6.15.156 → 192.168.1.12 SSH 446 Server: Encrypted packet (len=380)
  129 1.166289007 192.168.1.12 → 10.6.15.156  TCP 66 54766 → 22 [ACK] Seq=7365 Ack=60189 Win=4866 Len=0 TSval=7728758 TSecr=14660249
  130 1.304031259  10.6.15.156 → 192.168.1.12 SSH 138 Server: Encrypted packet (len=72)
  131 1.304219837 192.168.1.12 → 10.6.15.156  SSH 102 Client: Encrypted packet (len=36)
  132 1.345132710  10.6.15.156 → 192.168.1.12 TCP 66 22 → 54766 [ACK] Seq=60261 Ack=7401 Win=1452 Len=0 TSval=14660298 TSecr=7728792
  133 1.363094094  10.6.15.156 → 192.168.1.12 SSH 110 Server: Encrypted packet (len=44)
  134 1.363393554 192.168.1.12 → 10.6.15.156  SSH 206 Client: Encrypted packet (len=140)
  135 1.365125456  10.6.15.156 → 192.168.1.12 TCP 66 22 → 54766 [ACK] Seq=60305 Ack=7541 Win=1452 Len=0 TSval=14660303 TSecr=7728807
  136 1.384200557 192.168.1.12 → 10.6.15.156  SSH 1514 Client: Encrypted packet (len=1448)
  137 1.385030175 192.168.1.12 → 10.6.15.156  SSH 774 Client: Encrypted packet (len=708)
  138 1.387476312  10.6.15.156 → 192.168.1.12 TCP 66 22 → 54766 [ACK] Seq=60305 Ack=9697 Win=1452 Len=0 TSval=14660308 TSecr=7728812
  139 1.390580500  10.6.15.156 → 192.168.1.12 SSH 142 Server: Encrypted packet (len=76)
  140 1.433147690 192.168.1.12 → 10.6.15.156  TCP 66 54766 → 22 [ACK] Seq=9697 Ack=60381 Win=4866 Len=0 TSval=7728825 TSecr=14660309
  141 1.449943452  10.6.15.156 → 192.168.1.12 SSH 446 Server: Encrypted packet (len=380)
  142 1.450025432 192.168.1.12 → 10.6.15.156  TCP 66 54766 → 22 [ACK] Seq=9697 Ack=60761 Win=4866 Len=0 TSval=7728829 TSecr=14660324
  143 1.486919940  10.6.15.156 → 192.168.1.12 SSH 918 Server: Encrypted packet (len=852)
  144 1.487004985 192.168.1.12 → 10.6.15.156  TCP 66 54766 → 22 [ACK] Seq=9697 Ack=61613 Win=4866 Len=0 TSval=7728838 TSecr=14660333
  145 1.487620983  10.6.15.156 → 192.168.1.12 SSH 534 Server: Encrypted packet (len=468)
  146 1.487687534 192.168.1.12 → 10.6.15.156  TCP 66 54766 → 22 [ACK] Seq=9697 Ack=62081 Win=4866 Len=0 TSval=7728838 TSecr=14660333
  147 1.488139245 192.168.1.12 → 10.6.15.156  SSH 134 Client: Encrypted packet (len=68)
  148 1.517516324  10.6.15.156 → 192.168.1.12 SSH 446 Server: Encrypted packet (len=380)
  149 1.561148101 192.168.1.12 → 10.6.15.156  TCP 66 54766 → 22 [ACK] Seq=9765 Ack=62461 Win=4866 Len=0 TSval=7728857 TSecr=14660341
  150 1.581175740  10.6.15.156 → 192.168.1.12 SSH 238 Server: Encrypted packet (len=172)
  151 1.581246516 192.168.1.12 → 10.6.15.156  TCP 66 54766 → 22 [ACK] Seq=9765 Ack=62633 Win=4866 Len=0 TSval=7728862 TSecr=14660357
  152 1.581489274 192.168.1.12 → 10.6.15.156  SSH 134 Client: Encrypted packet (len=68)
  153 1.620287331  10.6.15.156 → 192.168.1.12 TCP 66 22 → 54766 [ACK] Seq=62633 Ack=9833 Win=1452 Len=0 TSval=14660367 TSecr=7728862
  154 1.620307320 192.168.1.12 → 10.6.15.156  SSH 862 Client: Encrypted packet (len=796)
  155 1.622433634  10.6.15.156 → 192.168.1.12 TCP 66 22 → 54766 [ACK] Seq=62633 Ack=10629 Win=1452 Len=0 TSval=14660367 TSecr=7728871
  156 1.839801707  10.6.15.156 → 192.168.1.12 SSH 454 Server: Encrypted packet (len=388)
  157 1.881155148 192.168.1.12 → 10.6.15.156  TCP 66 54766 → 22 [ACK] Seq=10629 Ack=63021 Win=4866 Len=0 TSval=7728937 TSecr=14660421
  158 2.121028992  192.168.1.1 → 239.255.255.250 SSDP 302 NOTIFY * HTTP/1.1 
  159 2.124065701  192.168.1.1 → 239.255.255.250 SSDP 311 NOTIFY * HTTP/1.1 
  160 2.127397119  192.168.1.1 → 239.255.255.250 SSDP 374 NOTIFY * HTTP/1.1 
  161 2.132435172  192.168.1.1 → 239.255.255.250 SSDP 370 NOTIFY * HTTP/1.1 
  162 2.134211509  192.168.1.1 → 239.255.255.250 SSDP 350 NOTIFY * HTTP/1.1 
  163 2.137828573  192.168.1.1 → 239.255.255.250 SSDP 382 NOTIFY * HTTP/1.1 
  164 2.142386926  192.168.1.1 → 239.255.255.250 SSDP 364 NOTIFY * HTTP/1.1 
  165 2.144582101  192.168.1.1 → 239.255.255.250 SSDP 366 NOTIFY * HTTP/1.1 
  166 2.147449937  192.168.1.1 → 239.255.255.250 SSDP 302 NOTIFY * HTTP/1.1 
  167 2.149126559 192.168.1.12 → 10.6.15.156  SSH 102 Client: Encrypted packet (len=36)
  168 2.150533478  192.168.1.1 → 239.255.255.250 SSDP 311 NOTIFY * HTTP/1.1 
  169 2.154761217  192.168.1.1 → 239.255.255.250 SSDP 374 NOTIFY * HTTP/1.1 
  170 2.154880858  10.6.15.156 → 192.168.1.12 TCP 66 22 → 54766 [ACK] Seq=63021 Ack=10665 Win=1452 Len=0 TSval=14660499 TSecr=7729004
  171 2.154899141 192.168.1.12 → 10.6.15.156  SSH 198 Client: Encrypted packet (len=132)
  172 2.158353835  192.168.1.1 → 239.255.255.250 SSDP 370 NOTIFY * HTTP/1.1 
  173 2.162161656  192.168.1.1 → 239.255.255.250 SSDP 350 NOTIFY * HTTP/1.1 
  174 2.162347950  10.6.15.156 → 192.168.1.12 TCP 66 22 → 54766 [ACK] Seq=63021 Ack=10797 Win=1452 Len=0 TSval=14660501 TSecr=7729005
  175 2.165946349  192.168.1.1 → 239.255.255.250 SSDP 382 NOTIFY * HTTP/1.1 
  176 2.169216578  192.168.1.1 → 239.255.255.250 SSDP 364 NOTIFY * HTTP/1.1 
  177 2.172661544  192.168.1.1 → 239.255.255.250 SSDP 366 NOTIFY * HTTP/1.1 
  178 2.308523132  10.6.15.156 → 192.168.1.12 SSH 138 Server: Encrypted packet (len=72)
  179 2.308541096 192.168.1.12 → 10.6.15.156  TCP 66 54766 → 22 [ACK] Seq=10797 Ack=63093 Win=4866 Len=0 TSval=7729043 TSecr=14660539
  180 2.308756619 192.168.1.12 → 10.6.15.156  SSH 102 Client: Encrypted packet (len=36)
  181 2.309890890  10.6.15.156 → 192.168.1.12 TCP 66 22 → 54766 [ACK] Seq=63093 Ack=10833 Win=1452 Len=0 TSval=14660539 TSecr=7729043
  182 2.310005881  10.6.15.156 → 192.168.1.12 SSH 110 Server: Encrypted packet (len=44)
  183 2.310332591 192.168.1.12 → 10.6.15.156  SSH 198 Client: Encrypted packet (len=132)
  184 2.348225004  10.6.15.156 → 192.168.1.12 TCP 66 22 → 54766 [ACK] Seq=63137 Ack=10965 Win=1452 Len=0 TSval=14660549 TSecr=7729044
  185 2.367468068  10.6.15.156 → 192.168.1.12 SSH 126 Server: Encrypted packet (len=60)
  186 2.367540031  10.6.15.156 → 192.168.1.12 SSH 138 Server: Encrypted packet (len=72)
  187 2.367563651 192.168.1.12 → 10.6.15.156  TCP 66 54766 → 22 [ACK] Seq=10965 Ack=63269 Win=4866 Len=0 TSval=7729058 TSecr=14660553
  188 2.367724720 192.168.1.12 → 10.6.15.156  SSH 102 Client: Encrypted packet (len=36)
  189 2.369024582  10.6.15.156 → 192.168.1.12 TCP 66 22 → 54766 [ACK] Seq=63269 Ack=11001 Win=1452 Len=0 TSval=14660554 TSecr=7729058
  190 2.374086184  10.6.15.156 → 192.168.1.12 SSH 102 Server: Encrypted packet (len=36)
  191 2.374403286 192.168.1.12 → 10.6.15.156  SSH 158 Client: Encrypted packet (len=92)
  192 2.412193374  10.6.15.156 → 192.168.1.12 TCP 66 22 → 54766 [ACK] Seq=63305 Ack=11093 Win=1452 Len=0 TSval=14660565 TSecr=7729060
  193 2.465817331  10.6.15.156 → 192.168.1.12 SSH 1514 Server: Encrypted packet (len=1448)
  194 2.466147906  10.6.15.156 → 192.168.1.12 SSH 1514 Server: Encrypted packet (len=1448)
  195 2.466165388 192.168.1.12 → 10.6.15.156  TCP 66 54766 → 22 [ACK] Seq=11093 Ack=66201 Win=4866 Len=0 TSval=7729083 TSecr=14660578
  196 2.466346167  10.6.15.156 → 192.168.1.12 SSH 998 Server: Encrypted packet (len=932)
  197 2.467367440 192.168.1.12 → 10.6.15.156  SSH 206 Client: Encrypted packet (len=140)
  198 2.468347468 192.168.1.12 → 10.6.15.156  SSH 1514 Client: Encrypted packet (len=1448)
  199 2.470181148 192.168.1.12 → 10.6.15.156  SSH 862 Client: Encrypted packet (len=796)
  200 2.471540781  10.6.15.156 → 192.168.1.12 TCP 66 22 → 54766 [ACK] Seq=67133 Ack=11233 Win=1452 Len=0 TSval=14660579 TSecr=7729083
  201 2.471643475  10.6.15.156 → 192.168.1.12 TCP 66 22 → 54766 [ACK] Seq=67133 Ack=12681 Win=1452 Len=0 TSval=14660579 TSecr=7729083
  202 2.472641082  10.6.15.156 → 192.168.1.12 TCP 66 22 → 54766 [ACK] Seq=67133 Ack=13477 Win=1452 Len=0 TSval=14660580 TSecr=7729084
  203 2.591027656  10.6.15.156 → 192.168.1.12 SSH 182 Server: Encrypted packet (len=116)
  204 2.591316976 192.168.1.12 → 10.6.15.156  SSH 134 Client: Encrypted packet (len=68)
  205 2.593024767  10.6.15.156 → 192.168.1.12 TCP 66 22 → 54766 [ACK] Seq=67249 Ack=13545 Win=1452 Len=0 TSval=14660610 TSecr=7729114
  206 2.593044727 192.168.1.12 → 10.6.15.156  SSH 862 Client: Encrypted packet (len=796)
  207 2.595199968  10.6.15.156 → 192.168.1.12 TCP 66 22 → 54766 [ACK] Seq=67249 Ack=14341 Win=1452 Len=0 TSval=14660610 TSecr=7729114
  208 2.619788604  10.6.15.156 → 192.168.1.12 SSH 142 Server: Encrypted packet (len=76)
  209 2.627015955  10.6.15.156 → 192.168.1.12 SSH 502 Server: Encrypted packet (len=436)
  210 2.627096907 192.168.1.12 → 10.6.15.156  TCP 66 54766 → 22 [ACK] Seq=14341 Ack=67761 Win=4866 Len=0 TSval=7729123 TSecr=14660616
  211 2.810623166  10.6.15.156 → 192.168.1.12 SSH 454 Server: Encrypted packet (len=388)
  212 2.853150422 192.168.1.12 → 10.6.15.156  TCP 66 54766 → 22 [ACK] Seq=14341 Ack=68149 Win=4866 Len=0 TSval=7729180 TSecr=14660664
  213 4.146078565 192.168.1.12 → 10.6.15.156  SSH 862 Client: Encrypted packet (len=796)
  214 4.189987620  10.6.15.156 → 192.168.1.12 TCP 66 22 → 54766 [ACK] Seq=68149 Ack=15137 Win=1452 Len=0 TSval=14661009 TSecr=7729503
  215 4.363967300  10.6.15.156 → 192.168.1.12 SSH 454 Server: Encrypted packet (len=388)
  216 4.363993527 192.168.1.12 → 10.6.15.156  TCP 66 54766 → 22 [ACK] Seq=15137 Ack=68537 Win=4866 Len=0 TSval=7729557 TSecr=14661052
  217 5.146666962 192.168.1.12 → 10.6.15.156  SSH 862 Client: Encrypted packet (len=796)
  218 5.147595397  10.6.15.156 → 192.168.1.12 SSH 134 Server: Encrypted packet (len=68)
  219 5.147608562 192.168.1.12 → 10.6.15.156  SSH 138 Client: Encrypted packet (len=72)
  220 5.148741243  10.6.15.156 → 192.168.1.12 SSH 102 Server: Encrypted packet (len=36)
  221 5.150183660  10.6.15.156 → 192.168.1.12 TCP 66 22 → 54766 [ACK] Seq=68641 Ack=15933 Win=1452 Len=0 TSval=14661249 TSecr=7729753
  222 5.150965303  10.6.15.156 → 192.168.1.12 TCP 66 22 → 54766 [ACK] Seq=68641 Ack=16005 Win=1452 Len=0 TSval=14661249 TSecr=7729753
  223 5.171948004  10.6.15.156 → 192.168.1.12 SSH 126 Server: Encrypted packet (len=60)
  224 5.171970307  10.6.15.156 → 192.168.1.12 SSH 102 Server: Encrypted packet (len=36)
  225 5.172035925 192.168.1.12 → 10.6.15.156  TCP 66 54766 → 22 [ACK] Seq=16005 Ack=68737 Win=4866 Len=0 TSval=7729759 TSecr=14661248
  226 5.297559713  10.6.15.156 → 192.168.1.12 SSH 138 Server: Encrypted packet (len=72)
  227 5.297775335 192.168.1.12 → 10.6.15.156  SSH 102 Client: Encrypted packet (len=36)
  228 5.336195070  10.6.15.156 → 192.168.1.12 TCP 66 22 → 54766 [ACK] Seq=68809 Ack=16041 Win=1452 Len=0 TSval=14661296 TSecr=7729791
  229 5.364834220  10.6.15.156 → 192.168.1.12 SSH 454 Server: Encrypted packet (len=388)
  230 5.367149600 192.168.1.12 → 10.6.15.156  SSH 862 Client: Encrypted packet (len=796)
  231 5.367792941  10.6.15.156 → 192.168.1.12 SSH 102 Server: Encrypted packet (len=36)
  232 5.368353646 192.168.1.12 → 10.6.15.156  SSH 158 Client: Encrypted packet (len=92)
  233 5.369924929  10.6.15.156 → 192.168.1.12 TCP 66 22 → 54766 [ACK] Seq=69233 Ack=16837 Win=1452 Len=0 TSval=14661304 TSecr=7729808
  234 5.369942950  10.6.15.156 → 192.168.1.12 TCP 66 22 → 54766 [ACK] Seq=69233 Ack=16929 Win=1452 Len=0 TSval=14661304 TSecr=7729808
  235 5.586181139  10.6.15.156 → 192.168.1.12 SSH 454 Server: Encrypted packet (len=388)
  236 5.587481187  10.6.15.156 → 192.168.1.12 SSH 182 Server: Encrypted packet (len=116)
  237 5.587535253 192.168.1.12 → 10.6.15.156  TCP 66 54766 → 22 [ACK] Seq=16929 Ack=69737 Win=4866 Len=0 TSval=7729863 TSecr=14661358
  238 5.588375400 192.168.1.12 → 10.6.15.156  SSH 134 Client: Encrypted packet (len=68)
  239 5.589922832  10.6.15.156 → 192.168.1.12 TCP 66 22 → 54766 [ACK] Seq=69737 Ack=16997 Win=1452 Len=0 TSval=14661359 TSecr=7729863
  240 7.151725981 192.168.1.12 → 10.6.15.156  SSH 138 Client: Encrypted packet (len=72)
  241 7.151913891 192.168.1.12 → 10.6.15.156  SSH 138 Client: Encrypted packet (len=72)
  242 7.152157754 192.168.1.12 → 10.6.15.156  SSH 862 Client: Encrypted packet (len=796)
  243 7.153360395  10.6.15.156 → 192.168.1.12 TCP 66 22 → 54766 [ACK] Seq=69737 Ack=17069 Win=1452 Len=0 TSval=14661750 TSecr=7730254
  244 7.153741342  10.6.15.156 → 192.168.1.12 TCP 66 22 → 54766 [ACK] Seq=69737 Ack=17141 Win=1452 Len=0 TSval=14661750 TSecr=7730254
  245 7.154134686  10.6.15.156 → 192.168.1.12 SSH 138 Server: Encrypted packet (len=72)
  246 7.192163074  10.6.15.156 → 192.168.1.12 TCP 66 22 → 54766 [ACK] Seq=69809 Ack=17937 Win=1452 Len=0 TSval=14661760 TSecr=7730254
  247 7.197146807 192.168.1.12 → 10.6.15.156  TCP 66 54766 → 22 [ACK] Seq=17937 Ack=69809 Win=4866 Len=0 TSval=7730266 TSecr=14661750
  248 7.371900675  10.6.15.156 → 192.168.1.12 SSH 454 Server: Encrypted packet (len=388)
  249 7.371933519 192.168.1.12 → 10.6.15.156  TCP 66 54766 → 22 [ACK] Seq=17937 Ack=70197 Win=4866 Len=0 TSval=7730309 TSecr=14661804
  250 8.145974369 192.168.1.12 → 10.6.15.156  SSH 862 Client: Encrypted packet (len=796)
  251 8.148322202  10.6.15.156 → 192.168.1.12 TCP 66 22 → 54766 [ACK] Seq=70197 Ack=18733 Win=1452 Len=0 TSval=14661999 TSecr=7730503
  252 8.364091430  10.6.15.156 → 192.168.1.12 SSH 454 Server: Encrypted packet (len=388)
  253 8.364111039 192.168.1.12 → 10.6.15.156  TCP 66 54766 → 22 [ACK] Seq=18733 Ack=70585 Win=4866 Len=0 TSval=7730557 TSecr=14662052
  254 9.144548528 192.168.1.12 → 10.6.15.156  SSH 1514 Client: Encrypted packet (len=1448)
  255 9.147144140  10.6.15.156 → 192.168.1.12 TCP 66 22 → 54766 [ACK] Seq=70585 Ack=20181 Win=1452 Len=0 TSval=14662248 TSecr=7730752
  256 9.147162793 192.168.1.12 → 10.6.15.156  SSH 470 Client: Encrypted packet (len=404)
  257 9.149153178  10.6.15.156 → 192.168.1.12 TCP 66 22 → 54766 [ACK] Seq=70585 Ack=20585 Win=1452 Len=0 TSval=14662249 TSecr=7730753
  258 9.317220629  10.6.15.156 → 192.168.1.12 SSH 502 Server: Encrypted packet (len=436)
  259 9.317239426 192.168.1.12 → 10.6.15.156  TCP 66 54766 → 22 [ACK] Seq=20585 Ack=71021 Win=4866 Len=0 TSval=7730796 TSecr=14662291
  260 9.397162309  10.6.15.156 → 192.168.1.12 SSH 102 Server: Encrypted packet (len=36)
  261 9.397189126 192.168.1.12 → 10.6.15.156  TCP 66 54766 → 22 [ACK] Seq=20585 Ack=71057 Win=4866 Len=0 TSval=7730816 TSecr=14662311
  262 9.504902987  10.6.15.156 → 192.168.1.12 SSH 102 Server: Encrypted packet (len=36)
  263 9.504920235 192.168.1.12 → 10.6.15.156  TCP 66 54766 → 22 [ACK] Seq=20585 Ack=71093 Win=4866 Len=0 TSval=7730842 TSecr=14662338
  264 9.989840743  10.6.15.156 → 192.168.1.12 SSH 102 Server: Encrypted packet (len=36)
  265 9.989861910 192.168.1.12 → 10.6.15.156  TCP 66 54766 → 22 [ACK] Seq=20585 Ack=71129 Win=4866 Len=0 TSval=7730964 TSecr=14662459
  266 10.147488181 192.168.1.12 → 10.6.15.156  SSH 138 Client: Encrypted packet (len=72)
  267 10.152144213 192.168.1.12 → 10.6.15.156  SSH 1330 Client: Encrypted packet (len=1264)
  268 10.180610675  10.6.15.156 → 192.168.1.12 TCP 78 [TCP Dup ACK 257#1] 22 → 54766 [ACK] Seq=71129 Ack=20585 Win=1452 Len=0 TSval=14662506 TSecr=7730964 SLE=20657 SRE=21921
  269 10.185146151 192.168.1.12 → 10.6.15.156  TCP 138 [TCP Retransmission] 54766 → 22 [PSH, ACK] Seq=20585 Ack=71129 Win=4866 Len=72 TSval=7731013 TSecr=14662506
  270 10.186822668  10.6.15.156 → 192.168.1.12 TCP 66 22 → 54766 [ACK] Seq=71129 Ack=21921 Win=1452 Len=0 TSval=14662508 TSecr=7731013
  271 10.187763127  10.6.15.156 → 192.168.1.12 SSH 174 Server: Encrypted packet (len=108)
  272 10.187781714 192.168.1.12 → 10.6.15.156  TCP 66 54766 → 22 [ACK] Seq=21921 Ack=71237 Win=4866 Len=0 TSval=7731013 TSecr=14662508
  273 10.256302731  10.6.15.156 → 192.168.1.12 SSH 138 Server: Encrypted packet (len=72)
  274 10.256321142 192.168.1.12 → 10.6.15.156  TCP 66 54766 → 22 [ACK] Seq=21921 Ack=71309 Win=4866 Len=0 TSval=7731030 TSecr=14662526
  275 10.256555979 192.168.1.12 → 10.6.15.156  SSH 102 Client: Encrypted packet (len=36)
  276 10.256950789  10.6.15.156 → 192.168.1.12 SSH 138 Server: Encrypted packet (len=72)
  277 10.257322000  10.6.15.156 → 192.168.1.12 SSH 138 Server: Encrypted packet (len=72)
  278 10.257348865 192.168.1.12 → 10.6.15.156  TCP 66 54766 → 22 [ACK] Seq=21957 Ack=71453 Win=4866 Len=0 TSval=7731031 TSecr=14662526
  279 10.257573347 192.168.1.12 → 10.6.15.156  SSH 138 Client: Encrypted packet (len=72)
  280 10.258039638  10.6.15.156 → 192.168.1.12 SSH 138 Server: Encrypted packet (len=72)
  281 10.259171090  10.6.15.156 → 192.168.1.12 TCP 66 22 → 54766 [ACK] Seq=71525 Ack=22029 Win=1452 Len=0 TSval=14662526 TSecr=7731030
  282 10.259193441 192.168.1.12 → 10.6.15.156  SSH 102 Client: Encrypted packet (len=36)
  283 10.300040217  10.6.15.156 → 192.168.1.12 TCP 66 22 → 54766 [ACK] Seq=71525 Ack=22065 Win=1452 Len=0 TSval=14662537 TSecr=7731031
  284 10.338372014  10.6.15.156 → 192.168.1.12 SSH 138 Server: Encrypted packet (len=72)
  285 10.338588419 192.168.1.12 → 10.6.15.156  SSH 102 Client: Encrypted packet (len=36)
  286 10.340034674  10.6.15.156 → 192.168.1.12 TCP 66 22 → 54766 [ACK] Seq=71597 Ack=22101 Win=1452 Len=0 TSval=14662547 TSecr=7731051
  287 10.364142340  10.6.15.156 → 192.168.1.12 SSH 138 Server: Encrypted packet (len=72)
  288 10.364348520 192.168.1.12 → 10.6.15.156  SSH 102 Client: Encrypted packet (len=36)
  289 10.365719316  10.6.15.156 → 192.168.1.12 SSH 210 Server: Encrypted packet (len=144)
  290 10.365950795 192.168.1.12 → 10.6.15.156  SSH 138 Client: Encrypted packet (len=72)
  291 10.366829571  10.6.15.156 → 192.168.1.12 SSH 138 Server: Encrypted packet (len=72)
  292 10.403052861  10.6.15.156 → 192.168.1.12 SSH 454 Server: Encrypted packet (len=388)
  293 10.403087728 192.168.1.12 → 10.6.15.156  SSH 102 Client: Encrypted packet (len=36)
  294 10.444162218  10.6.15.156 → 192.168.1.12 TCP 66 22 → 54766 [ACK] Seq=72273 Ack=22245 Win=1452 Len=0 TSval=14662573 TSecr=7731067
  295 11.153318759 192.168.1.12 → 10.6.15.156  SSH 1514 Client: Encrypted packet (len=1448)
  296 11.154270923 192.168.1.12 → 10.6.15.156  SSH 1514 Client: Encrypted packet (len=1448)
  297 11.155148328 192.168.1.12 → 10.6.15.156  SSH 614 Client: Encrypted packet (len=548)
  298 11.156256914  10.6.15.156 → 192.168.1.12 TCP 66 22 → 54766 [ACK] Seq=72273 Ack=23693 Win=1452 Len=0 TSval=14662751 TSecr=7731255
  299 11.156998719  10.6.15.156 → 192.168.1.12 TCP 66 22 → 54766 [ACK] Seq=72273 Ack=25689 Win=1450 Len=0 TSval=14662751 TSecr=7731255
  300 11.358082449  10.6.15.156 → 192.168.1.12 SSH 494 Server: Encrypted packet (len=428)
  301 11.372444796  10.6.15.156 → 192.168.1.12 SSH 454 Server: Encrypted packet (len=388)
  302 11.372516921 192.168.1.12 → 10.6.15.156  TCP 66 54766 → 22 [ACK] Seq=25689 Ack=73089 Win=4866 Len=0 TSval=7731309 TSecr=14662800
  303 11.377640747  10.6.15.156 → 192.168.1.12 SSH 454 Server: Encrypted packet (len=388)
  304 11.421149910 192.168.1.12 → 10.6.15.156  TCP 66 54766 → 22 [ACK] Seq=25689 Ack=73477 Win=4866 Len=0 TSval=7731322 TSecr=14662805
  305 12.146638054 192.168.1.12 → 10.6.15.156  SSH 1514 Client: Encrypted packet (len=1448)
  306 12.149528189  10.6.15.156 → 192.168.1.12 TCP 66 22 → 54766 [ACK] Seq=73477 Ack=27137 Win=1452 Len=0 TSval=14662999 TSecr=7731503
  307 12.149546446 192.168.1.12 → 10.6.15.156  SSH 514 Client: Encrypted packet (len=448)
  308 12.154884153  10.6.15.156 → 192.168.1.12 TCP 66 22 → 54766 [ACK] Seq=73477 Ack=27585 Win=1452 Len=0 TSval=14663000 TSecr=7731504
  309 12.226972546 192.168.1.12 → 91.189.89.198 NTP 90 NTP Version 4, client
  310 12.309192383  10.6.15.156 → 192.168.1.12 SSH 502 Server: Encrypted packet (len=436)
  311 12.309210674 192.168.1.12 → 10.6.15.156  TCP 66 54766 → 22 [ACK] Seq=27585 Ack=73913 Win=4866 Len=0 TSval=7731544 TSecr=14663039
  312 13.147950681 192.168.1.12 → 10.6.15.156  SSH 862 Client: Encrypted packet (len=796)
  313 13.152743039  10.6.15.156 → 192.168.1.12 TCP 66 22 → 54766 [ACK] Seq=73913 Ack=28381 Win=1452 Len=0 TSval=14663250 TSecr=7731753
  314 13.371935423  10.6.15.156 → 192.168.1.12 SSH 454 Server: Encrypted packet (len=388)
  315 13.371961083 192.168.1.12 → 10.6.15.156  TCP 66 54766 → 22 [ACK] Seq=28381 Ack=74301 Win=4866 Len=0 TSval=7731809 TSecr=14663304
  316 14.146304460 192.168.1.12 → 10.6.15.156  SSH 862 Client: Encrypted packet (len=796)
  317 14.148516349  10.6.15.156 → 192.168.1.12 TCP 66 22 → 54766 [ACK] Seq=74301 Ack=29177 Win=1452 Len=0 TSval=14663499 TSecr=7732003
  318 14.226975221 192.168.1.12 → 123.108.200.124 NTP 90 NTP Version 4, client
  319 14.367104475  10.6.15.156 → 192.168.1.12 SSH 454 Server: Encrypted packet (len=388)
  320 14.367131665 192.168.1.12 → 10.6.15.156  TCP 66 54766 → 22 [ACK] Seq=29177 Ack=74689 Win=4866 Len=0 TSval=7732058 TSecr=14663553
  321 15.459439024 192.168.1.12 → 10.6.15.156  SSH 1514 Client: Encrypted packet (len=1448)
  322 15.462630081  10.6.15.156 → 192.168.1.12 TCP 66 22 → 54766 [ACK] Seq=74689 Ack=30625 Win=1452 Len=0 TSval=14663827 TSecr=7732331
  323 15.462639341 192.168.1.12 → 10.6.15.156  SSH 150 Client: Encrypted packet (len=84)
  324 15.464195330  10.6.15.156 → 192.168.1.12 TCP 66 22 → 54766 [ACK] Seq=74689 Ack=30709 Win=1452 Len=0 TSval=14663828 TSecr=7732332
  325 15.465901060  10.6.15.156 → 192.168.1.12 SSH 102 Server: Encrypted packet (len=36)
  326 15.465919241 192.168.1.12 → 10.6.15.156  TCP 66 54766 → 22 [ACK] Seq=30709 Ack=74725 Win=4866 Len=0 TSval=7732333 TSecr=14663828
  327 15.615743255  10.6.15.156 → 192.168.1.12 SSH 670 Server: Encrypted packet (len=604)
  328 15.615761271 192.168.1.12 → 10.6.15.156  TCP 66 54766 → 22 [ACK] Seq=30709 Ack=75329 Win=4866 Len=0 TSval=7732370 TSecr=14663865
  329 16.143067969 192.168.1.12 → 10.6.15.156  SSH 138 Client: Encrypted packet (len=72)
  330 16.145040517  10.6.15.156 → 192.168.1.12 SSH 102 Server: Encrypted packet (len=36)
  331 16.145059454 192.168.1.12 → 10.6.15.156  SSH 862 Client: Encrypted packet (len=796)
  332 16.190386222  10.6.15.156 → 192.168.1.12 TCP 66 22 → 54766 [ACK] Seq=75365 Ack=31577 Win=1452 Len=0 TSval=14664009 TSecr=7732502
  333 16.366846145  10.6.15.156 → 192.168.1.12 SSH 454 Server: Encrypted packet (len=388)
  334 16.409148949 192.168.1.12 → 10.6.15.156  TCP 66 54766 → 22 [ACK] Seq=31577 Ack=75753 Win=4866 Len=0 TSval=7732569 TSecr=14664053
  335 17.150673102 192.168.1.12 → 10.6.15.156  SSH 862 Client: Encrypted packet (len=796)
  336 17.152762482  10.6.15.156 → 192.168.1.12 TCP 66 22 → 54766 [ACK] Seq=75753 Ack=32373 Win=1452 Len=0 TSval=14664250 TSecr=7732754
  337 17.152781933 192.168.1.12 → 10.6.15.156  SSH 862 Client: Encrypted packet (len=796)
  338 17.160691185  10.6.15.156 → 192.168.1.12 TCP 66 22 → 54766 [ACK] Seq=75753 Ack=33169 Win=1452 Len=0 TSval=14664250 TSecr=7732754
  339 17.370467121  10.6.15.156 → 192.168.1.12 SSH 454 Server: Encrypted packet (len=388)
  340 17.370490587 192.168.1.12 → 10.6.15.156  TCP 66 54766 → 22 [ACK] Seq=33169 Ack=76141 Win=4866 Len=0 TSval=7732809 TSecr=14664304
  341 17.372584801  10.6.15.156 → 192.168.1.12 SSH 454 Server: Encrypted packet (len=388)
  342 17.372601665 192.168.1.12 → 10.6.15.156  TCP 66 54766 → 22 [ACK] Seq=33169 Ack=76529 Win=4866 Len=0 TSval=7732809 TSecr=14664304
  343 18.358156043  192.168.1.1 → 224.0.0.1    IGMPv2 42 Membership Query, general
  344 19.125102316 192.168.1.12 → 23.58.43.27  TCP 66 47480 → 80 [ACK] Seq=1 Ack=1 Win=274 Len=0 TSval=7733248 TSecr=2209576022
  345 19.127687452  23.58.43.27 → 192.168.1.12 TCP 66 [TCP ACKed unseen segment] 80 → 47480 [ACK] Seq=1 Ack=2 Win=939 Len=0 TSval=2209621079 TSecr=7665606
  346 19.148887947 192.168.1.12 → 10.6.15.156  SSH 862 Client: Encrypted packet (len=796)
  347 19.151348141  10.6.15.156 → 192.168.1.12 TCP 66 22 → 54766 [ACK] Seq=76529 Ack=33965 Win=1452 Len=0 TSval=14664749 TSecr=7733253
  348 19.369568034  10.6.15.156 → 192.168.1.12 SSH 454 Server: Encrypted packet (len=388)
  349 19.369596608 192.168.1.12 → 10.6.15.156  TCP 66 54766 → 22 [ACK] Seq=33965 Ack=76917 Win=4866 Len=0 TSval=7733309 TSecr=14664804
  350 20.573181365 192.168.1.12 → 10.6.15.156  SSH 862 Client: Encrypted packet (len=796)
  351 20.576136415  10.6.15.156 → 192.168.1.12 TCP 66 22 → 54766 [ACK] Seq=76917 Ack=34761 Win=1452 Len=0 TSval=14665106 TSecr=7733502
  352 20.795143080  10.6.15.156 → 192.168.1.12 SSH 454 Server: Encrypted packet (len=388)
  353 21.289162676 192.168.1.12 → 224.0.0.252  IGMPv2 46 Membership Report group 224.0.0.252
  354 21.289171762 192.168.1.12 → 10.6.15.156  TCP 66 54766 → 22 [ACK] Seq=34761 Ack=77305 Win=4866 Len=0 TSval=7733665 TSecr=14665160
  355 21.289175262 192.168.1.12 → 23.58.43.27  TCP 66 47482 → 80 [ACK] Seq=1 Ack=1 Win=319 Len=0 TSval=7733760 TSecr=2209578070
  356 21.291597399  10.6.15.156 → 192.168.1.12 SSH 454 Server: [TCP Spurious Retransmission] , Encrypted packet (len=388)
  357 21.291617915 192.168.1.12 → 10.6.15.156  TCP 78 [TCP Dup ACK 354#1] 54766 → 22 [ACK] Seq=34761 Ack=77305 Win=4866 Len=0 TSval=7733789 TSecr=14665213 SLE=76917 SRE=77305
  358 21.291631625  10.6.15.156 → 192.168.1.12 SSH 454 Server: [TCP Spurious Retransmission] , Encrypted packet (len=388)
  359 21.291633715 192.168.1.12 → 10.6.15.156  TCP 78 [TCP Dup ACK 354#2] 54766 → 22 [ACK] Seq=34761 Ack=77305 Win=4866 Len=0 TSval=7733789 TSecr=14665266 SLE=76917 SRE=77305
  360 21.293927257  23.58.43.27 → 192.168.1.12 TCP 66 [TCP ACKed unseen segment] 80 → 47482 [ACK] Seq=1 Ack=2 Win=972 Len=0 TSval=2209623245 TSecr=7666041
  361 22.148302065 192.168.1.12 → 10.6.15.156  SSH 862 Client: Encrypted packet (len=796)
  362 22.149442716 192.168.1.12 → 10.6.15.156  SSH 1514 Client: Encrypted packet (len=1448)
  363 22.150328956 192.168.1.12 → 10.6.15.156  SSH 470 Client: Encrypted packet (len=404)
  364 22.150819054  10.6.15.156 → 192.168.1.12 TCP 66 22 → 54766 [ACK] Seq=77305 Ack=35557 Win=1452 Len=0 TSval=14665499 TSecr=7734003
  365 22.152137848  10.6.15.156 → 192.168.1.12 TCP 66 22 → 54766 [ACK] Seq=77305 Ack=37409 Win=1451 Len=0 TSval=14665500 TSecr=7734004
  366 22.307465661  10.6.15.156 → 192.168.1.12 SSH 502 Server: Encrypted packet (len=436)
  367 22.369320354  10.6.15.156 → 192.168.1.12 SSH 454 Server: Encrypted packet (len=388)
  368 22.717223783 192.168.1.12 → 10.6.15.156  TCP 66 54766 → 22 [ACK] Seq=37409 Ack=77741 Win=4866 Len=0 TSval=7734043 TSecr=14665538
  369 22.717234352 192.168.1.12 → 10.6.15.156  TCP 66 54766 → 22 [ACK] Seq=37409 Ack=78129 Win=4866 Len=0 TSval=7734059 TSecr=14665554
  370 22.718498354  10.6.15.156 → 192.168.1.12 SSH 454 Server: [TCP Spurious Retransmission] , Encrypted packet (len=388)
  371 22.718517394 192.168.1.12 → 10.6.15.156  TCP 78 [TCP Dup ACK 369#1] 54766 → 22 [ACK] Seq=37409 Ack=78129 Win=4866 Len=0 TSval=7734146 TSecr=14665590 SLE=77741 SRE=78129
  372 23.429224053 192.168.1.12 → 10.6.15.156  SSH 862 Client: Encrypted packet (len=796)
  373 23.434503475  10.6.15.156 → 192.168.1.12 TCP 66 22 → 54766 [ACK] Seq=78129 Ack=38205 Win=1452 Len=0 TSval=14665820 TSecr=7734254
  374 23.434525492 192.168.1.12 → 10.6.15.156  SSH 862 Client: Encrypted packet (len=796)
  375 23.436488702  10.6.15.156 → 192.168.1.12 TCP 66 22 → 54766 [ACK] Seq=78129 Ack=39001 Win=1452 Len=0 TSval=14665821 TSecr=7734325
  376 23.652481571  10.6.15.156 → 192.168.1.12 SSH 454 Server: Encrypted packet (len=388)
  377 23.652510038  10.6.15.156 → 192.168.1.12 SSH 454 Server: Encrypted packet (len=388)
  378 24.149224942 192.168.1.12 → 224.0.0.251  IGMPv2 46 Membership Report group 224.0.0.251
  379 24.149233925 192.168.1.12 → 10.6.15.156  TCP 66 54766 → 22 [ACK] Seq=39001 Ack=78517 Win=4866 Len=0 TSval=7734379 TSecr=14665875
  380 24.149237578 192.168.1.12 → 10.6.15.156  TCP 66 54766 → 22 [ACK] Seq=39001 Ack=78905 Win=4866 Len=0 TSval=7734379 TSecr=14665875
  381 24.149997031  10.6.15.156 → 192.168.1.12 SSH 454 Server: [TCP Spurious Retransmission] , Encrypted packet (len=388)
  382 24.150016410 192.168.1.12 → 10.6.15.156  TCP 78 [TCP Dup ACK 380#1] 54766 → 22 [ACK] Seq=39001 Ack=78905 Win=4866 Len=0 TSval=7734504 TSecr=14665947 SLE=78517 SRE=78905
  383 25.581221997 192.168.1.12 → 10.6.15.156  SSH 862 Client: Encrypted packet (len=796)
  384 25.584456697  10.6.15.156 → 192.168.1.12 TCP 66 22 → 54766 [ACK] Seq=78905 Ack=39797 Win=1452 Len=0 TSval=14666358 TSecr=7734754
  385 25.800353749  10.6.15.156 → 192.168.1.12 SSH 454 Server: Encrypted packet (len=388)
  386 26.297169395 192.168.1.12 → 10.6.15.156  TCP 66 54766 → 22 [ACK] Seq=39797 Ack=79293 Win=4866 Len=0 TSval=7734916 TSecr=14666412
  387 26.297179210 192.168.1.12 → 10.6.15.156  SSH 862 Client: Encrypted packet (len=796)
  388 26.300999747  10.6.15.156 → 192.168.1.12 TCP 66 22 → 54766 [ACK] Seq=79293 Ack=40593 Win=1452 Len=0 TSval=14666537 TSecr=7735003
  389 26.516449508  10.6.15.156 → 192.168.1.12 SSH 454 Server: Encrypted packet (len=388)
  390 27.009227102 192.168.1.12 → 10.6.15.156  TCP 66 54766 → 22 [ACK] Seq=40593 Ack=79681 Win=4866 Len=0 TSval=7735095 TSecr=14666591
  391 28.441168513 192.168.1.12 → 10.6.15.156  SSH 862 Client: Encrypted packet (len=796)
  392 28.443212015  10.6.15.156 → 192.168.1.12 TCP 66 22 → 54766 [ACK] Seq=79681 Ack=41389 Win=1452 Len=0 TSval=14667072 TSecr=7735503
  393 28.658903250  10.6.15.156 → 192.168.1.12 SSH 454 Server: Encrypted packet (len=388)
  394 29.201187707 192.168.1.12 → 10.6.15.156  TCP 66 54766 → 22 [ACK] Seq=41389 Ack=80069 Win=4866 Len=0 TSval=7735631 TSecr=14667126
  395 29.201198354 192.168.1.12 → 10.6.15.156  SSH 862 Client: Encrypted packet (len=796)
  396 29.202570523 192.168.1.12 → 10.6.15.156  SSH 862 Client: Encrypted packet (len=796)
  397 29.208299344  10.6.15.156 → 192.168.1.12 TCP 66 22 → 54766 [ACK] Seq=80069 Ack=42185 Win=1452 Len=0 TSval=14667264 TSecr=7735753
  398 29.208841570  10.6.15.156 → 192.168.1.12 TCP 66 22 → 54766 [ACK] Seq=80069 Ack=42981 Win=1452 Len=0 TSval=14667264 TSecr=7735767
  399 29.424258134  10.6.15.156 → 192.168.1.12 SSH 454 Server: Encrypted packet (len=388)
  400 29.427774506  10.6.15.156 → 192.168.1.12 SSH 454 Server: Encrypted packet (len=388)
  401 29.969222399 192.168.1.12 → 10.6.15.156  TCP 66 54766 → 22 [ACK] Seq=42981 Ack=80457 Win=4866 Len=0 TSval=7735822 TSecr=14667318
  402 29.969232579 192.168.1.12 → 10.6.15.156  TCP 66 54766 → 22 [ACK] Seq=42981 Ack=80845 Win=4866 Len=0 TSval=7735823 TSecr=14667318
  403 31.147275097 192.168.1.12 → 10.6.15.156  SSH 862 Client: Encrypted packet (len=796)
  404 31.151437461  10.6.15.156 → 192.168.1.12 TCP 66 22 → 54766 [ACK] Seq=80845 Ack=43777 Win=1452 Len=0 TSval=14667749 TSecr=7736253
  405 31.371414882  10.6.15.156 → 192.168.1.12 SSH 454 Server: Encrypted packet (len=388)
  406 31.371442336 192.168.1.12 → 10.6.15.156  TCP 66 54766 → 22 [ACK] Seq=43777 Ack=81233 Win=4866 Len=0 TSval=7736309 TSecr=14667804
  407 32.145503065 192.168.1.12 → 10.6.15.156  SSH 862 Client: Encrypted packet (len=796)
  408 32.147478583  10.6.15.156 → 192.168.1.12 TCP 66 22 → 54766 [ACK] Seq=81233 Ack=44573 Win=1452 Len=0 TSval=14667998 TSecr=7736503
  409 32.366247361  10.6.15.156 → 192.168.1.12 SSH 454 Server: Encrypted packet (len=388)
  410 32.366274661 192.168.1.12 → 10.6.15.156  TCP 66 54766 → 22 [ACK] Seq=44573 Ack=81621 Win=4866 Len=0 TSval=7736558 TSecr=14668053
  411 34.147124690 192.168.1.12 → 10.6.15.156  SSH 862 Client: Encrypted packet (len=796)
  412 34.149343041  10.6.15.156 → 192.168.1.12 TCP 66 22 → 54766 [ACK] Seq=81621 Ack=45369 Win=1452 Len=0 TSval=14668499 TSecr=7737003
  413 34.226941945 192.168.1.12 → 139.59.50.38 NTP 90 NTP Version 4, client
  414 34.369544641  10.6.15.156 → 192.168.1.12 SSH 454 Server: Encrypted packet (len=388)
  415 34.369569738 192.168.1.12 → 10.6.15.156  TCP 66 54766 → 22 [ACK] Seq=45369 Ack=82009 Win=4866 Len=0 TSval=7737059 TSecr=14668554
