    1 0.000000000  10.6.15.156 → 192.168.1.12 SSH 334 Server: Encrypted packet (len=268)
    2 0.004153986  10.6.15.156 → 192.168.1.12 SSH 382 Server: Encrypted packet (len=316)
    3 0.004232600 192.168.1.12 → 10.6.15.156  TCP 66 54766 → 22 [ACK] Seq=1 Ack=585 Win=4866 Len=0 TSval=7737480 TSecr=14668975
    4 0.028419114 192.168.1.12 → 10.6.15.156  SSH 222 Client: Encrypted packet (len=156)
    5 0.030196103  10.6.15.156 → 192.168.1.12 TCP 66 22 → 54766 [ACK] Seq=585 Ack=157 Win=1452 Len=0 TSval=14668982 TSecr=7737486
    6 0.042115191  10.6.15.156 → 192.168.1.12 SSH 334 Server: Encrypted packet (len=268)
    7 0.045834112  10.6.15.156 → 192.168.1.12 SSH 374 Server: Encrypted packet (len=308)
    8 0.045905070 192.168.1.12 → 10.6.15.156  TCP 66 54766 → 22 [ACK] Seq=157 Ack=1161 Win=4866 Len=0 TSval=7737491 TSecr=14668985
    9 0.209123956  10.6.15.156 → 192.168.1.12 SSH 1514 Server: Encrypted packet (len=1448)
   10 0.209201105  10.6.15.156 → 192.168.1.12 SSH 830 Server: Encrypted packet (len=764)
   11 0.209215265 192.168.1.12 → 10.6.15.156  TCP 66 54766 → 22 [ACK] Seq=157 Ack=3373 Win=4866 Len=0 TSval=7737531 TSecr=14669026
   12 0.248408184 192.168.1.12 → 10.6.15.156  SSH 198 Client: Encrypted packet (len=132)
   13 0.287958872  10.6.15.156 → 192.168.1.12 TCP 66 22 → 54766 [ACK] Seq=3373 Ack=289 Win=1452 Len=0 TSval=14669047 TSecr=7737541
   14 0.427854330  10.6.15.156 → 192.168.1.12 SSH 446 Server: Encrypted packet (len=380)
   15 0.469259909 192.168.1.12 → 10.6.15.156  TCP 66 54766 → 22 [ACK] Seq=289 Ack=3753 Win=4866 Len=0 TSval=7737597 TSecr=14669081
   16 0.475142936 192.168.1.12 → 10.6.15.156  SSH 102 Client: Encrypted packet (len=36)
   17 0.476479479  10.6.15.156 → 192.168.1.12 TCP 66 22 → 54766 [ACK] Seq=3753 Ack=325 Win=1452 Len=0 TSval=14669094 TSecr=7737598
   18 0.476507937 192.168.1.12 → 10.6.15.156  SSH 110 Client: Encrypted packet (len=44)
   19 0.477812759  10.6.15.156 → 192.168.1.12 TCP 66 22 → 54766 [ACK] Seq=3753 Ack=369 Win=1452 Len=0 TSval=14669094 TSecr=7737598
   20 0.580943805 192.168.1.12 → 10.6.15.156  SSH 598 Client: Encrypted packet (len=532)
   21 0.582841455  10.6.15.156 → 192.168.1.12 TCP 66 22 → 54766 [ACK] Seq=3753 Ack=901 Win=1452 Len=0 TSval=14669120 TSecr=7737624
   22 0.619147279 192.168.1.12 → 10.6.15.156  SSH 726 Client: Encrypted packet (len=660)
   23 0.621691071  10.6.15.156 → 192.168.1.12 TCP 66 22 → 54766 [ACK] Seq=3753 Ack=1561 Win=1452 Len=0 TSval=14669130 TSecr=7737634
   24 0.621713646 192.168.1.12 → 10.6.15.156  SSH 950 Client: Encrypted packet (len=884)
   25 0.623830876  10.6.15.156 → 192.168.1.12 TCP 66 22 → 54766 [ACK] Seq=3753 Ack=2445 Win=1452 Len=0 TSval=14669131 TSecr=7737635
   26 0.630152350  10.6.15.156 → 192.168.1.12 SSH 390 Server: Encrypted packet (len=324)
   27 0.630172502 192.168.1.12 → 10.6.15.156  TCP 66 54766 → 22 [ACK] Seq=2445 Ack=4077 Win=4866 Len=0 TSval=7737637 TSecr=14669132
   28 0.654278183  10.6.15.156 → 192.168.1.12 SSH 138 Server: Encrypted packet (len=72)
   29 0.654297385 192.168.1.12 → 10.6.15.156  TCP 66 54766 → 22 [ACK] Seq=2445 Ack=4149 Win=4866 Len=0 TSval=7737643 TSecr=14669138
   30 0.654558889 192.168.1.12 → 10.6.15.156  SSH 102 Client: Encrypted packet (len=36)
   31 0.679299885  10.6.15.156 → 192.168.1.12 SSH 110 Server: Encrypted packet (len=44)
   32 0.679699450 192.168.1.12 → 10.6.15.156  SSH 382 Client: Encrypted packet (len=316)
   33 0.695159675  10.6.15.156 → 192.168.1.12 SSH 486 Server: Encrypted packet (len=420)
   34 0.737264267 192.168.1.12 → 10.6.15.156  TCP 66 54766 → 22 [ACK] Seq=2797 Ack=4613 Win=4866 Len=0 TSval=7737664 TSecr=14669148
   35 0.762725404  10.6.15.156 → 192.168.1.12 SSH 598 Server: Encrypted packet (len=532)
   36 0.762748986 192.168.1.12 → 10.6.15.156  TCP 66 54766 → 22 [ACK] Seq=2797 Ack=5145 Win=4866 Len=0 TSval=7737670 TSecr=14669165
   37 0.806588624 192.168.1.12 → 10.6.15.156  SSH 1514 Client: Encrypted packet (len=1448)
   38 0.851943651  10.6.15.156 → 192.168.1.12 TCP 66 22 → 54766 [ACK] Seq=5145 Ack=4245 Win=1452 Len=0 TSval=14669188 TSecr=7737681
   39 0.851957359 192.168.1.12 → 10.6.15.156  SSH 1034 Client: Encrypted packet (len=968)
   40 0.855165334  10.6.15.156 → 192.168.1.12 TCP 66 22 → 54766 [ACK] Seq=5145 Ack=5213 Win=1452 Len=0 TSval=14669188 TSecr=7737692
   41 0.857406174  10.6.15.156 → 192.168.1.12 SSH 302 Server: Encrypted packet (len=236)
   42 0.857418217 192.168.1.12 → 10.6.15.156  TCP 66 54766 → 22 [ACK] Seq=5213 Ack=5381 Win=4866 Len=0 TSval=7737694 TSecr=14669189
   43 0.858060047 192.168.1.12 → 10.6.15.156  SSH 142 Client: Encrypted packet (len=76)
   44 0.883294712  10.6.15.156 → 192.168.1.12 SSH 238 Server: Encrypted packet (len=172)
   45 0.883579928 192.168.1.12 → 10.6.15.156  SSH 134 Client: Encrypted packet (len=68)
   46 0.925739633  10.6.15.156 → 192.168.1.12 TCP 66 22 → 54766 [ACK] Seq=5553 Ack=5357 Win=1452 Len=0 TSval=14669206 TSecr=7737700
   47 0.925759377 192.168.1.12 → 10.6.15.156  SSH 1014 Client: Encrypted packet (len=948)
   48 0.928212948  10.6.15.156 → 192.168.1.12 TCP 66 22 → 54766 [ACK] Seq=5553 Ack=6305 Win=1452 Len=0 TSval=14669207 TSecr=7737711
   49 0.999053971  10.6.15.156 → 192.168.1.12 SSH 110 Server: Encrypted packet (len=44)
   50 0.999320754 192.168.1.12 → 10.6.15.156  SSH 198 Client: Encrypted packet (len=132)
   51 1.001324904  10.6.15.156 → 192.168.1.12 TCP 66 22 → 54766 [ACK] Seq=5597 Ack=6437 Win=1452 Len=0 TSval=14669225 TSecr=7737729
   52 1.001334620  10.6.15.156 → 192.168.1.12 SSH 138 Server: Encrypted packet (len=72)
   53 1.001496054 192.168.1.12 → 10.6.15.156  SSH 102 Client: Encrypted packet (len=36)
   54 1.003710122  10.6.15.156 → 192.168.1.12 SSH 718 Server: Encrypted packet (len=652)
   55 1.045264728 192.168.1.12 → 10.6.15.156  TCP 66 54766 → 22 [ACK] Seq=6473 Ack=6321 Win=4866 Len=0 TSval=7737741 TSecr=14669225
   56 1.096728451 192.168.1.12 → 10.6.15.156  SSH 102 Client: Encrypted packet (len=36)
   57 1.136615088  10.6.15.156 → 192.168.1.12 TCP 66 22 → 54766 [ACK] Seq=6321 Ack=6509 Win=1452 Len=0 TSval=14669259 TSecr=7737753
   58 1.136631657 192.168.1.12 → 10.6.15.156  SSH 126 Client: Encrypted packet (len=60)
   59 1.139328125  10.6.15.156 → 192.168.1.12 TCP 66 22 → 54766 [ACK] Seq=6321 Ack=6569 Win=1452 Len=0 TSval=14669259 TSecr=7737763
   60 1.147435266  10.6.15.156 → 192.168.1.12 SSH 1514 Server: Encrypted packet (len=1448)
   61 1.147726733  10.6.15.156 → 192.168.1.12 SSH 1366 Server: Encrypted packet (len=1300)
   62 1.147734362 192.168.1.12 → 10.6.15.156  TCP 66 54766 → 22 [ACK] Seq=6569 Ack=9069 Win=4866 Len=0 TSval=7737766 TSecr=14669261
   63 1.148693182 192.168.1.12 → 10.6.15.156  SSH 438 Client: Encrypted packet (len=372)
   64 1.171367256  10.6.15.156 → 192.168.1.12 SSH 1514 Server: Encrypted packet (len=1448)
   65 1.171556531  10.6.15.156 → 192.168.1.12 SSH 1514 Server: Encrypted packet (len=1448)
   66 1.171565232 192.168.1.12 → 10.6.15.156  TCP 66 54766 → 22 [ACK] Seq=6941 Ack=11965 Win=4866 Len=0 TSval=7737772 TSecr=14669267
   67 1.171750550  10.6.15.156 → 192.168.1.12 SSH 1514 Server: Encrypted packet (len=1448)
   68 1.171940291  10.6.15.156 → 192.168.1.12 SSH 1514 Server: Encrypted packet (len=1448)
   69 1.171947304 192.168.1.12 → 10.6.15.156  TCP 66 54766 → 22 [ACK] Seq=6941 Ack=14861 Win=4866 Len=0 TSval=7737772 TSecr=14669267
   70 1.171957029  10.6.15.156 → 192.168.1.12 SSH 110 Server: Encrypted packet (len=44)
   71 1.173495665  10.6.15.156 → 192.168.1.12 SSH 1514 Server: Encrypted packet (len=1448)
   72 1.173502535 192.168.1.12 → 10.6.15.156  TCP 66 54766 → 22 [ACK] Seq=6941 Ack=16353 Win=4866 Len=0 TSval=7737773 TSecr=14669267
   73 1.173687897  10.6.15.156 → 192.168.1.12 SSH 1514 Server: Encrypted packet (len=1448)
   74 1.173879857  10.6.15.156 → 192.168.1.12 SSH 1514 Server: Encrypted packet (len=1448)
   75 1.173886907 192.168.1.12 → 10.6.15.156  TCP 66 54766 → 22 [ACK] Seq=6941 Ack=19249 Win=4866 Len=0 TSval=7737773 TSecr=14669267
   76 1.174036824  10.6.15.156 → 192.168.1.12 SSH 1514 Server: Encrypted packet (len=1448)
   77 1.174227397  10.6.15.156 → 192.168.1.12 SSH 1514 Server: Encrypted packet (len=1448)
   78 1.174231304 192.168.1.12 → 10.6.15.156  TCP 66 54766 → 22 [ACK] Seq=6941 Ack=22145 Win=4866 Len=0 TSval=7737773 TSecr=14669267
   79 1.175802880  10.6.15.156 → 192.168.1.12 SSH 1514 Server: Encrypted packet (len=1448)
   80 1.175815089  10.6.15.156 → 192.168.1.12 SSH 110 Server: Encrypted packet (len=44)
   81 1.175820183 192.168.1.12 → 10.6.15.156  TCP 66 54766 → 22 [ACK] Seq=6941 Ack=23637 Win=4866 Len=0 TSval=7737773 TSecr=14669268
   82 1.247165541  10.6.15.156 → 192.168.1.12 SSH 138 Server: Encrypted packet (len=72)
   83 1.247398672 192.168.1.12 → 10.6.15.156  SSH 102 Client: Encrypted packet (len=36)
   84 1.287957781  10.6.15.156 → 192.168.1.12 TCP 66 22 → 54766 [ACK] Seq=23709 Ack=6977 Win=1452 Len=0 TSval=14669297 TSecr=7737791
   85 1.300377123 192.168.1.12 → 10.6.15.156  SSH 182 Client: Encrypted packet (len=116)
   86 1.302014274  10.6.15.156 → 192.168.1.12 TCP 66 22 → 54766 [ACK] Seq=23709 Ack=7093 Win=1452 Len=0 TSval=14669300 TSecr=7737804
   87 1.307491754  10.6.15.156 → 192.168.1.12 SSH 174 Server: Encrypted packet (len=108)
   88 1.309000766 192.168.1.12 → 10.6.15.156  SSH 726 Client: Encrypted packet (len=660)
   89 1.347925347  10.6.15.156 → 192.168.1.12 TCP 66 22 → 54766 [ACK] Seq=23817 Ack=7753 Win=1452 Len=0 TSval=14669312 TSecr=7737806
   90 1.355805878  10.6.15.156 → 192.168.1.12 SSH 110 Server: Encrypted packet (len=44)
   91 1.356153845 192.168.1.12 → 10.6.15.156  SSH 198 Client: Encrypted packet (len=132)
   92 1.357908254  10.6.15.156 → 192.168.1.12 TCP 66 22 → 54766 [ACK] Seq=23861 Ack=7885 Win=1452 Len=0 TSval=14669314 TSecr=7737818
   93 1.372189284  10.6.15.156 → 192.168.1.12 SSH 1514 Server: Encrypted packet (len=1448)
   94 1.372386522  10.6.15.156 → 192.168.1.12 SSH 1514 Server: Encrypted packet (len=1448)
   95 1.372396349 192.168.1.12 → 10.6.15.156  TCP 66 54766 → 22 [ACK] Seq=7885 Ack=26757 Win=4866 Len=0 TSval=7737822 TSecr=14669317
   96 1.372579263  10.6.15.156 → 192.168.1.12 SSH 1514 Server: Encrypted packet (len=1448)
   97 1.372771102  10.6.15.156 → 192.168.1.12 SSH 1514 Server: Encrypted packet (len=1448)
   98 1.372779568 192.168.1.12 → 10.6.15.156  TCP 66 54766 → 22 [ACK] Seq=7885 Ack=29653 Win=4866 Len=0 TSval=7737822 TSecr=14669317
   99 1.372790632  10.6.15.156 → 192.168.1.12 SSH 110 Server: Encrypted packet (len=44)
  100 1.374090659  10.6.15.156 → 192.168.1.12 SSH 1514 Server: Encrypted packet (len=1448)
  101 1.374103476 192.168.1.12 → 10.6.15.156  TCP 66 54766 → 22 [ACK] Seq=7885 Ack=31145 Win=4866 Len=0 TSval=7737823 TSecr=14669317
  102 1.374278420  10.6.15.156 → 192.168.1.12 SSH 1514 Server: Encrypted packet (len=1448)
  103 1.374476793  10.6.15.156 → 192.168.1.12 SSH 1514 Server: Encrypted packet (len=1448)
  104 1.374482941 192.168.1.12 → 10.6.15.156  TCP 66 54766 → 22 [ACK] Seq=7885 Ack=34041 Win=4866 Len=0 TSval=7737823 TSecr=14669318
  105 1.374661051  10.6.15.156 → 192.168.1.12 SSH 1514 Server: Encrypted packet (len=1448)
  106 1.374854661  10.6.15.156 → 192.168.1.12 SSH 1514 Server: Encrypted packet (len=1448)
  107 1.374861340 192.168.1.12 → 10.6.15.156  TCP 66 54766 → 22 [ACK] Seq=7885 Ack=36937 Win=4866 Len=0 TSval=7737823 TSecr=14669318
  108 1.375195500  10.6.15.156 → 192.168.1.12 SSH 1514 Server: Encrypted packet (len=1448)
  109 1.375387261  10.6.15.156 → 192.168.1.12 SSH 1514 Server: Encrypted packet (len=1448)
  110 1.375389627 192.168.1.12 → 10.6.15.156  TCP 66 54766 → 22 [ACK] Seq=7885 Ack=39833 Win=4866 Len=0 TSval=7737823 TSecr=14669318
  111 1.375578815  10.6.15.156 → 192.168.1.12 SSH 1514 Server: Encrypted packet (len=1448)
  112 1.375770862  10.6.15.156 → 192.168.1.12 SSH 1514 Server: Encrypted packet (len=1448)
  113 1.375772974 192.168.1.12 → 10.6.15.156  TCP 66 54766 → 22 [ACK] Seq=7885 Ack=42729 Win=4866 Len=0 TSval=7737823 TSecr=14669318
  114 1.375962032  10.6.15.156 → 192.168.1.12 SSH 1514 Server: Encrypted packet (len=1448)
  115 1.375965901  10.6.15.156 → 192.168.1.12 SSH 110 Server: Encrypted packet (len=44)
  116 1.375968364 192.168.1.12 → 10.6.15.156  TCP 66 54766 → 22 [ACK] Seq=7885 Ack=44221 Win=4866 Len=0 TSval=7737823 TSecr=14669318
  117 1.376326807  10.6.15.156 → 192.168.1.12 SSH 1514 Server: Encrypted packet (len=1448)
  118 1.376518117  10.6.15.156 → 192.168.1.12 SSH 1514 Server: Encrypted packet (len=1448)
  119 1.376524935 192.168.1.12 → 10.6.15.156  TCP 66 54766 → 22 [ACK] Seq=7885 Ack=47117 Win=4866 Len=0 TSval=7737823 TSecr=14669318
  120 1.376711290  10.6.15.156 → 192.168.1.12 SSH 1514 Server: Encrypted packet (len=1448)
  121 1.376898684  10.6.15.156 → 192.168.1.12 SSH 1514 Server: Encrypted packet (len=1448)
  122 1.376902375 192.168.1.12 → 10.6.15.156  TCP 66 54766 → 22 [ACK] Seq=7885 Ack=50013 Win=4866 Len=0 TSval=7737823 TSecr=14669318
  123 1.378929202  10.6.15.156 → 192.168.1.12 SSH 1514 Server: Encrypted packet (len=1448)
  124 1.379117413  10.6.15.156 → 192.168.1.12 SSH 1514 Server: Encrypted packet (len=1448)
  125 1.379122290 192.168.1.12 → 10.6.15.156  TCP 66 54766 → 22 [ACK] Seq=7885 Ack=52909 Win=4866 Len=0 TSval=7737824 TSecr=14669319
  126 1.379253038  10.6.15.156 → 192.168.1.12 SSH 110 Server: Encrypted packet (len=44)
  127 1.408286763 192.168.1.12 → 10.6.15.156  SSH 1514 Client: Encrypted packet (len=1448)
  128 1.448374467  10.6.15.156 → 192.168.1.12 TCP 66 22 → 54766 [ACK] Seq=52953 Ack=9333 Win=1452 Len=0 TSval=14669337 TSecr=7737831
  129 1.448395480 192.168.1.12 → 10.6.15.156  SSH 782 Client: Encrypted packet (len=716)
  130 1.450841726  10.6.15.156 → 192.168.1.12 TCP 66 22 → 54766 [ACK] Seq=52953 Ack=10049 Win=1452 Len=0 TSval=14669337 TSecr=7737841
  131 1.453506357  10.6.15.156 → 192.168.1.12 SSH 150 Server: Encrypted packet (len=84)
  132 1.461724800  10.6.15.156 → 192.168.1.12 SSH 1174 Server: Encrypted packet (len=1108)
  133 1.461801249 192.168.1.12 → 10.6.15.156  TCP 66 54766 → 22 [ACK] Seq=10049 Ack=54145 Win=4866 Len=0 TSval=7737845 TSecr=14669338
  134 1.482827742  10.6.15.156 → 192.168.1.12 SSH 446 Server: Encrypted packet (len=380)
  135 1.525312388 192.168.1.12 → 10.6.15.156  TCP 66 54766 → 22 [ACK] Seq=10049 Ack=54525 Win=4866 Len=0 TSval=7737861 TSecr=14669345
  136 1.565321325  10.6.15.156 → 192.168.1.12 SSH 1046 Server: Encrypted packet (len=980)
  137 1.565343584  10.6.15.156 → 192.168.1.12 SSH 422 Server: Encrypted packet (len=356)
  138 1.565401051 192.168.1.12 → 10.6.15.156  TCP 66 54766 → 22 [ACK] Seq=10049 Ack=55861 Win=4866 Len=0 TSval=7737871 TSecr=14669366
  139 1.566062495 192.168.1.12 → 10.6.15.156  SSH 134 Client: Encrypted packet (len=68)
  140 1.573064629  10.6.15.156 → 192.168.1.12 SSH 1514 Server: Encrypted packet (len=1448)
  141 1.573197764  10.6.15.156 → 192.168.1.12 SSH 1514 Server: Encrypted packet (len=1448)
  142 1.573206611 192.168.1.12 → 10.6.15.156  TCP 66 54766 → 22 [ACK] Seq=10117 Ack=58757 Win=4866 Len=0 TSval=7737872 TSecr=14669368
  143 1.573417045  10.6.15.156 → 192.168.1.12 SSH 1514 Server: Encrypted packet (len=1448)
  144 1.573433961  10.6.15.156 → 192.168.1.12 SSH 110 Server: Encrypted packet (len=44)
  145 1.573442187 192.168.1.12 → 10.6.15.156  TCP 66 54766 → 22 [ACK] Seq=10117 Ack=60249 Win=4866 Len=0 TSval=7737873 TSecr=14669368
  146 1.575432076  10.6.15.156 → 192.168.1.12 SSH 1514 Server: Encrypted packet (len=1448)
  147 1.575571874  10.6.15.156 → 192.168.1.12 SSH 1514 Server: Encrypted packet (len=1448)
  148 1.575582986 192.168.1.12 → 10.6.15.156  TCP 66 54766 → 22 [ACK] Seq=10117 Ack=63145 Win=4866 Len=0 TSval=7737873 TSecr=14669368
  149 1.575745177  10.6.15.156 → 192.168.1.12 SSH 1514 Server: Encrypted packet (len=1448)
  150 1.575937064  10.6.15.156 → 192.168.1.12 SSH 1514 Server: Encrypted packet (len=1448)
  151 1.575939917 192.168.1.12 → 10.6.15.156  TCP 66 54766 → 22 [ACK] Seq=10117 Ack=66041 Win=4866 Len=0 TSval=7737873 TSecr=14669368
  152 1.576149679  10.6.15.156 → 192.168.1.12 SSH 1514 Server: Encrypted packet (len=1448)
  153 1.576350455  10.6.15.156 → 192.168.1.12 SSH 1514 Server: Encrypted packet (len=1448)
  154 1.576354961 192.168.1.12 → 10.6.15.156  TCP 66 54766 → 22 [ACK] Seq=10117 Ack=68937 Win=4866 Len=0 TSval=7737873 TSecr=14669368
  155 1.576546488  10.6.15.156 → 192.168.1.12 SSH 1514 Server: Encrypted packet (len=1448)
  156 1.576896877  10.6.15.156 → 192.168.1.12 SSH 1514 Server: Encrypted packet (len=1448)
  157 1.576904383 192.168.1.12 → 10.6.15.156  TCP 66 54766 → 22 [ACK] Seq=10117 Ack=71833 Win=4866 Len=0 TSval=7737873 TSecr=14669368
  158 1.577075953  10.6.15.156 → 192.168.1.12 SSH 1514 Server: Encrypted packet (len=1448)
  159 1.577242978  10.6.15.156 → 192.168.1.12 SSH 1514 Server: Encrypted packet (len=1448)
  160 1.577252653 192.168.1.12 → 10.6.15.156  TCP 66 54766 → 22 [ACK] Seq=10117 Ack=74729 Win=4866 Len=0 TSval=7737874 TSecr=14669368
  161 1.577260221  10.6.15.156 → 192.168.1.12 SSH 110 Server: Encrypted packet (len=44)
  162 1.577455545  10.6.15.156 → 192.168.1.12 SSH 1514 Server: Encrypted packet (len=1448)
  163 1.577460321 192.168.1.12 → 10.6.15.156  TCP 66 54766 → 22 [ACK] Seq=10117 Ack=76221 Win=4866 Len=0 TSval=7737874 TSecr=14669368
  164 1.577646651  10.6.15.156 → 192.168.1.12 SSH 1514 Server: Encrypted packet (len=1448)
  165 1.577838192  10.6.15.156 → 192.168.1.12 SSH 1514 Server: Encrypted packet (len=1448)
  166 1.577843357 192.168.1.12 → 10.6.15.156  TCP 66 54766 → 22 [ACK] Seq=10117 Ack=79117 Win=4866 Len=0 TSval=7737874 TSecr=14669369
  167 1.578033584  10.6.15.156 → 192.168.1.12 SSH 1514 Server: Encrypted packet (len=1448)
  168 1.578226830  10.6.15.156 → 192.168.1.12 SSH 1514 Server: Encrypted packet (len=1448)
  169 1.578235416 192.168.1.12 → 10.6.15.156  TCP 66 54766 → 22 [ACK] Seq=10117 Ack=82013 Win=4866 Len=0 TSval=7737874 TSecr=14669369
  170 1.580457516  10.6.15.156 → 192.168.1.12 SSH 1514 Server: Encrypted packet (len=1448)
  171 1.580680628  10.6.15.156 → 192.168.1.12 SSH 1514 Server: Encrypted packet (len=1448)
  172 1.580687620 192.168.1.12 → 10.6.15.156  TCP 66 54766 → 22 [ACK] Seq=10117 Ack=84909 Win=4866 Len=0 TSval=7737874 TSecr=14669369
  173 1.582148441  10.6.15.156 → 192.168.1.12 SSH 1514 Server: Encrypted packet (len=1448)
  174 1.582355564  10.6.15.156 → 192.168.1.12 SSH 1514 Server: Encrypted packet (len=1448)
  175 1.582365829 192.168.1.12 → 10.6.15.156  TCP 66 54766 → 22 [ACK] Seq=10117 Ack=87805 Win=4866 Len=0 TSval=7737875 TSecr=14669369
  176 1.582546347  10.6.15.156 → 192.168.1.12 SSH 1514 Server: Encrypted packet (len=1448)
  177 1.582745110  10.6.15.156 → 192.168.1.12 SSH 1514 Server: Encrypted packet (len=1448)
  178 1.582751938 192.168.1.12 → 10.6.15.156  TCP 66 54766 → 22 [ACK] Seq=10117 Ack=90701 Win=4866 Len=0 TSval=7737875 TSecr=14669369
  179 1.582928700  10.6.15.156 → 192.168.1.12 SSH 1514 Server: Encrypted packet (len=1448)
  180 1.583244256  10.6.15.156 → 192.168.1.12 SSH 1514 Server: Encrypted packet (len=1448)
  181 1.583250581 192.168.1.12 → 10.6.15.156  TCP 66 54766 → 22 [ACK] Seq=10117 Ack=93597 Win=4866 Len=0 TSval=7737875 TSecr=14669369
  182 1.583435754  10.6.15.156 → 192.168.1.12 SSH 1514 Server: Encrypted packet (len=1448)
  183 1.583629555  10.6.15.156 → 192.168.1.12 SSH 1514 Server: Encrypted packet (len=1448)
  184 1.583634600 192.168.1.12 → 10.6.15.156  TCP 66 54766 → 22 [ACK] Seq=10117 Ack=96493 Win=4866 Len=0 TSval=7737875 TSecr=14669369
  185 1.583825458  10.6.15.156 → 192.168.1.12 SSH 1514 Server: Encrypted packet (len=1448)
  186 1.584022796  10.6.15.156 → 192.168.1.12 SSH 1514 Server: Encrypted packet (len=1448)
  187 1.584028277 192.168.1.12 → 10.6.15.156  TCP 66 54766 → 22 [ACK] Seq=10117 Ack=99389 Win=4866 Len=0 TSval=7737875 TSecr=14669370
  188 1.584213890  10.6.15.156 → 192.168.1.12 SSH 1514 Server: Encrypted packet (len=1448)
  189 1.584404202  10.6.15.156 → 192.168.1.12 SSH 1514 Server: Encrypted packet (len=1448)
  190 1.584406920 192.168.1.12 → 10.6.15.156  TCP 66 54766 → 22 [ACK] Seq=10117 Ack=102285 Win=4866 Len=0 TSval=7737875 TSecr=14669370
  191 1.584602419  10.6.15.156 → 192.168.1.12 SSH 1514 Server: Encrypted packet (len=1448)
  192 1.584788178  10.6.15.156 → 192.168.1.12 SSH 1514 Server: Encrypted packet (len=1448)
  193 1.584792624 192.168.1.12 → 10.6.15.156  TCP 66 54766 → 22 [ACK] Seq=10117 Ack=105181 Win=4866 Len=0 TSval=7737875 TSecr=14669370
  194 1.585958603  10.6.15.156 → 192.168.1.12 SSH 1514 Server: Encrypted packet (len=1448)
  195 1.586127028  10.6.15.156 → 192.168.1.12 SSH 1514 Server: Encrypted packet (len=1448)
  196 1.586131570 192.168.1.12 → 10.6.15.156  TCP 66 54766 → 22 [ACK] Seq=10117 Ack=108077 Win=4866 Len=0 TSval=7737876 TSecr=14669370
  197 1.587375014  10.6.15.156 → 192.168.1.12 SSH 1514 Server: Encrypted packet (len=1448)
  198 1.587554517  10.6.15.156 → 192.168.1.12 SSH 1514 Server: Encrypted packet (len=1448)
  199 1.587560882 192.168.1.12 → 10.6.15.156  TCP 66 54766 → 22 [ACK] Seq=10117 Ack=110973 Win=4866 Len=0 TSval=7737876 TSecr=14669371
  200 1.587748216  10.6.15.156 → 192.168.1.12 SSH 1514 Server: Encrypted packet (len=1448)
  201 1.587938551  10.6.15.156 → 192.168.1.12 SSH 1514 Server: Encrypted packet (len=1448)
  202 1.587942254 192.168.1.12 → 10.6.15.156  TCP 66 54766 → 22 [ACK] Seq=10117 Ack=113869 Win=4866 Len=0 TSval=7737876 TSecr=14669371
  203 1.588283581  10.6.15.156 → 192.168.1.12 SSH 1514 Server: Encrypted packet (len=1448)
  204 1.588475254  10.6.15.156 → 192.168.1.12 SSH 1514 Server: Encrypted packet (len=1448)
  205 1.588477845 192.168.1.12 → 10.6.15.156  TCP 66 54766 → 22 [ACK] Seq=10117 Ack=116765 Win=4866 Len=0 TSval=7737876 TSecr=14669371
  206 1.588584534  10.6.15.156 → 192.168.1.12 SSH 966 Server: Encrypted packet (len=900)
  207 1.588591156 192.168.1.12 → 10.6.15.156  SSH 102 Client: Encrypted packet (len=36)
  208 1.628019150  10.6.15.156 → 192.168.1.12 TCP 66 22 → 54766 [ACK] Seq=117665 Ack=10153 Win=1452 Len=0 TSval=14669382 TSecr=7737876
  209 1.628039410 192.168.1.12 → 10.6.15.156  SSH 206 Client: Encrypted packet (len=140)
  210 1.629812189  10.6.15.156 → 192.168.1.12 TCP 66 22 → 54766 [ACK] Seq=117665 Ack=10293 Win=1452 Len=0 TSval=14669382 TSecr=7737886
  211 1.773935798  10.6.15.156 → 192.168.1.12 SSH 1514 Server: Encrypted packet (len=1448)
  212 1.774057704  10.6.15.156 → 192.168.1.12 SSH 1514 Server: Encrypted packet (len=1448)
  213 1.774066577 192.168.1.12 → 10.6.15.156  TCP 66 54766 → 22 [ACK] Seq=10293 Ack=120561 Win=4866 Len=0 TSval=7737923 TSecr=14669418
  214 1.774433470  10.6.15.156 → 192.168.1.12 SSH 1514 Server: Encrypted packet (len=1448)
  215 1.778072981  10.6.15.156 → 192.168.1.12 SSH 1514 Server: Encrypted packet (len=1448)
  216 1.778092497 192.168.1.12 → 10.6.15.156  TCP 66 54766 → 22 [ACK] Seq=10293 Ack=123457 Win=4866 Len=0 TSval=7737924 TSecr=14669418
  217 1.778113238  10.6.15.156 → 192.168.1.12 SSH 110 Server: Encrypted packet (len=44)
  218 1.778213861  10.6.15.156 → 192.168.1.12 SSH 1514 Server: Encrypted packet (len=1448)
  219 1.778218392 192.168.1.12 → 10.6.15.156  TCP 66 54766 → 22 [ACK] Seq=10293 Ack=124949 Win=4866 Len=0 TSval=7737924 TSecr=14669418
  220 1.778447046  10.6.15.156 → 192.168.1.12 SSH 1514 Server: Encrypted packet (len=1448)
  221 1.778630436  10.6.15.156 → 192.168.1.12 SSH 1514 Server: Encrypted packet (len=1448)
  222 1.778639936 192.168.1.12 → 10.6.15.156  TCP 66 54766 → 22 [ACK] Seq=10293 Ack=127845 Win=4866 Len=0 TSval=7737924 TSecr=14669418
  223 1.778825948  10.6.15.156 → 192.168.1.12 SSH 1514 Server: Encrypted packet (len=1448)
  224 1.779018089  10.6.15.156 → 192.168.1.12 SSH 1514 Server: Encrypted packet (len=1448)
  225 1.779031408 192.168.1.12 → 10.6.15.156  TCP 66 54766 → 22 [ACK] Seq=10293 Ack=130741 Win=4866 Len=0 TSval=7737924 TSecr=14669418
  226 1.779209391  10.6.15.156 → 192.168.1.12 SSH 1514 Server: Encrypted packet (len=1448)
  227 1.779219843  10.6.15.156 → 192.168.1.12 SSH 110 Server: Encrypted packet (len=44)
  228 1.779224766 192.168.1.12 → 10.6.15.156  TCP 66 54766 → 22 [ACK] Seq=10293 Ack=132233 Win=4866 Len=0 TSval=7737924 TSecr=14669418
  229 1.779540794  10.6.15.156 → 192.168.1.12 SSH 1514 Server: Encrypted packet (len=1448)
  230 1.779725954  10.6.15.156 → 192.168.1.12 SSH 1514 Server: Encrypted packet (len=1448)
  231 1.779732824 192.168.1.12 → 10.6.15.156  TCP 66 54766 → 22 [ACK] Seq=10293 Ack=135129 Win=4866 Len=0 TSval=7737924 TSecr=14669419
  232 1.779917607  10.6.15.156 → 192.168.1.12 SSH 1514 Server: Encrypted packet (len=1448)
  233 1.780108326  10.6.15.156 → 192.168.1.12 SSH 1514 Server: Encrypted packet (len=1448)
  234 1.780114996 192.168.1.12 → 10.6.15.156  TCP 66 54766 → 22 [ACK] Seq=10293 Ack=138025 Win=4866 Len=0 TSval=7737924 TSecr=14669419
  235 1.780297866  10.6.15.156 → 192.168.1.12 SSH 1514 Server: Encrypted packet (len=1448)
  236 1.782860329  10.6.15.156 → 192.168.1.12 SSH 1514 Server: Encrypted packet (len=1448)
  237 1.782878847 192.168.1.12 → 10.6.15.156  TCP 66 54766 → 22 [ACK] Seq=10293 Ack=140921 Win=4866 Len=0 TSval=7737925 TSecr=14669419
  238 1.782980814  10.6.15.156 → 192.168.1.12 SSH 1514 Server: Encrypted packet (len=1448)
  239 1.784243236  10.6.15.156 → 192.168.1.12 SSH 1514 Server: Encrypted packet (len=1448)
  240 1.784261947 192.168.1.12 → 10.6.15.156  TCP 66 54766 → 22 [ACK] Seq=10293 Ack=143817 Win=4866 Len=0 TSval=7737925 TSecr=14669420
  241 1.784421113  10.6.15.156 → 192.168.1.12 SSH 1514 Server: Encrypted packet (len=1448)
  242 1.784763764  10.6.15.156 → 192.168.1.12 SSH 1514 Server: Encrypted packet (len=1448)
  243 1.784768421 192.168.1.12 → 10.6.15.156  TCP 66 54766 → 22 [ACK] Seq=10293 Ack=146713 Win=4866 Len=0 TSval=7737925 TSecr=14669420
  244 1.784953214  10.6.15.156 → 192.168.1.12 SSH 1514 Server: Encrypted packet (len=1448)
  245 1.785304203  10.6.15.156 → 192.168.1.12 SSH 1514 Server: Encrypted packet (len=1448)
  246 1.785307556 192.168.1.12 → 10.6.15.156  TCP 66 54766 → 22 [ACK] Seq=10293 Ack=149609 Win=4866 Len=0 TSval=7737926 TSecr=14669420
  247 1.785499603  10.6.15.156 → 192.168.1.12 SSH 1514 Server: Encrypted packet (len=1448)
  248 1.785846191  10.6.15.156 → 192.168.1.12 SSH 1514 Server: Encrypted packet (len=1448)
  249 1.785857510 192.168.1.12 → 10.6.15.156  TCP 66 54766 → 22 [ACK] Seq=10293 Ack=152505 Win=4866 Len=0 TSval=7737926 TSecr=14669420
  250 1.786027791  10.6.15.156 → 192.168.1.12 SSH 1514 Server: Encrypted packet (len=1448)
  251 1.786373209  10.6.15.156 → 192.168.1.12 SSH 1514 Server: Encrypted packet (len=1448)
  252 1.786376769 192.168.1.12 → 10.6.15.156  TCP 66 54766 → 22 [ACK] Seq=10293 Ack=155401 Win=4866 Len=0 TSval=7737926 TSecr=14669420
  253 1.786564526  10.6.15.156 → 192.168.1.12 SSH 1514 Server: Encrypted packet (len=1448)
  254 1.787001909  10.6.15.156 → 192.168.1.12 SSH 674 Server: Encrypted packet (len=608)
  255 1.787005631 192.168.1.12 → 10.6.15.156  TCP 66 54766 → 22 [ACK] Seq=10293 Ack=157457 Win=4866 Len=0 TSval=7737926 TSecr=14669420
  256 1.847461390  10.6.15.156 → 192.168.1.12 SSH 158 Server: Encrypted packet (len=92)
  257 1.848043483 192.168.1.12 → 10.6.15.156  SSH 862 Client: Encrypted packet (len=796)
  258 1.850579280  10.6.15.156 → 192.168.1.12 TCP 66 22 → 54766 [ACK] Seq=157549 Ack=11089 Win=1452 Len=0 TSval=14669437 TSecr=7737941
  259 1.859896500 192.168.1.12 → 10.6.15.156  SSH 102 Client: Encrypted packet (len=36)
  260 1.861209282  10.6.15.156 → 192.168.1.12 TCP 66 22 → 54766 [ACK] Seq=157549 Ack=11125 Win=1452 Len=0 TSval=14669440 TSecr=7737944
  261 1.861574522 192.168.1.12 → 10.6.15.156  SSH 110 Client: Encrypted packet (len=44)
  262 1.862901685  10.6.15.156 → 192.168.1.12 TCP 66 22 → 54766 [ACK] Seq=157549 Ack=11169 Win=1452 Len=0 TSval=14669440 TSecr=7737945
  263 1.863702303 192.168.1.12 → 10.6.15.156  SSH 790 Client: Encrypted packet (len=724)
  264 1.866140797  10.6.15.156 → 192.168.1.12 TCP 66 22 → 54766 [ACK] Seq=157549 Ack=11893 Win=1452 Len=0 TSval=14669441 TSecr=7737945
  265 1.866814953 192.168.1.12 → 10.6.15.156  SSH 206 Client: Encrypted packet (len=140)
  266 1.868348767  10.6.15.156 → 192.168.1.12 TCP 66 22 → 54766 [ACK] Seq=157549 Ack=12033 Win=1452 Len=0 TSval=14669442 TSecr=7737946
  267 1.961847641 192.168.1.12 → 10.6.15.156  SSH 1094 Client: Encrypted packet (len=1028)
  268 1.964051124  10.6.15.156 → 192.168.1.12 TCP 66 22 → 54766 [ACK] Seq=157549 Ack=13061 Win=1452 Len=0 TSval=14669466 TSecr=7737970
  269 2.012667950  10.6.15.156 → 192.168.1.12 SSH 110 Server: Encrypted packet (len=44)
  270 2.013047329 192.168.1.12 → 10.6.15.156  SSH 190 Client: Encrypted packet (len=124)
  271 2.014675639  10.6.15.156 → 192.168.1.12 TCP 66 22 → 54766 [ACK] Seq=157593 Ack=13185 Win=1452 Len=0 TSval=14669478 TSecr=7737982
  272 2.037421722  10.6.15.156 → 192.168.1.12 SSH 1510 Server: Encrypted packet (len=1444)
  273 2.045108433  10.6.15.156 → 192.168.1.12 SSH 446 Server: Encrypted packet (len=380)
  274 2.045129272 192.168.1.12 → 10.6.15.156  TCP 66 54766 → 22 [ACK] Seq=13185 Ack=159417 Win=4866 Len=0 TSval=7737990 TSecr=14669484
  275 2.062375048  10.6.15.156 → 192.168.1.12 SSH 138 Server: Encrypted packet (len=72)
  276 2.062601110 192.168.1.12 → 10.6.15.156  SSH 102 Client: Encrypted packet (len=36)
  277 2.073681588  10.6.15.156 → 192.168.1.12 SSH 454 Server: Encrypted packet (len=388)
  278 2.106117598 192.168.1.12 → 10.6.15.156  SSH 862 Client: Encrypted packet (len=796)
  279 2.147933382  10.6.15.156 → 192.168.1.12 TCP 66 22 → 54766 [ACK] Seq=159877 Ack=14017 Win=1452 Len=0 TSval=14669512 TSecr=7738006
  280 2.165976555  10.6.15.156 → 192.168.1.12 SSH 262 Server: Encrypted packet (len=196)
  281 2.166245741 192.168.1.12 → 10.6.15.156  SSH 174 Client: Encrypted packet (len=108)
  282 2.167826141  10.6.15.156 → 192.168.1.12 TCP 66 22 → 54766 [ACK] Seq=160073 Ack=14125 Win=1452 Len=0 TSval=14669517 TSecr=7738021
  283 2.228208735  10.6.15.156 → 192.168.1.12 SSH 438 Server: Encrypted packet (len=372)
  284 2.269273343 192.168.1.12 → 10.6.15.156  TCP 66 54766 → 22 [ACK] Seq=14125 Ack=160445 Win=4866 Len=0 TSval=7738047 TSecr=14669531
  285 2.331339373  10.6.15.156 → 192.168.1.12 SSH 454 Server: Encrypted packet (len=388)
  286 2.331432074 192.168.1.12 → 10.6.15.156  TCP 66 54766 → 22 [ACK] Seq=14125 Ack=160833 Win=4866 Len=0 TSval=7738062 TSecr=14669556
  287 3.417220052 10.22.17.139 → 224.0.0.252  LLMNR 64 Standard query 0xf9dd A wpad
  288 3.418692864 10.22.17.139 → 224.0.0.252  LLMNR 64 Standard query 0x6b8f A wpad
  289 3.830037623 10.22.17.139 → 224.0.0.252  LLMNR 64 Standard query 0xf9dd A wpad
  290 3.830055246 10.22.17.139 → 224.0.0.252  LLMNR 64 Standard query 0x6b8f A wpad
  291 4.093339703 192.168.1.12 → 10.6.15.156  SSH 862 Client: Encrypted packet (len=796)
  292 4.095663986  10.6.15.156 → 192.168.1.12 TCP 66 22 → 54766 [ACK] Seq=160833 Ack=14921 Win=1452 Len=0 TSval=14669998 TSecr=7738503
  293 4.314476960  10.6.15.156 → 192.168.1.12 SSH 454 Server: Encrypted packet (len=388)
  294 4.314501731 192.168.1.12 → 10.6.15.156  TCP 66 54766 → 22 [ACK] Seq=14921 Ack=161221 Win=4866 Len=0 TSval=7738558 TSecr=14670053
  295 5.098552409 192.168.1.12 → 10.6.15.156  SSH 102 Client: Encrypted packet (len=36)
  296 5.100467988  10.6.15.156 → 192.168.1.12 TCP 66 22 → 54766 [ACK] Seq=161221 Ack=14957 Win=1452 Len=0 TSval=14670250 TSecr=7738754
  297 5.100488517 192.168.1.12 → 10.6.15.156  SSH 898 Client: Encrypted packet (len=832)
  298 5.104562077  10.6.15.156 → 192.168.1.12 TCP 66 22 → 54766 [ACK] Seq=161221 Ack=15789 Win=1452 Len=0 TSval=14670250 TSecr=7738754
  299 5.218491679 10.22.17.139 → 224.0.0.252  LLMNR 69 Standard query 0x8667 A mlaemwzui
  300 5.262273370  10.6.15.156 → 192.168.1.12 SSH 138 Server: Encrypted packet (len=72)
  301 5.262290623 192.168.1.12 → 10.6.15.156  TCP 66 54766 → 22 [ACK] Seq=15789 Ack=161293 Win=4866 Len=0 TSval=7738795 TSecr=14670288
  302 5.262543613 192.168.1.12 → 10.6.15.156  SSH 102 Client: Encrypted packet (len=36)
  303 5.272181416  10.6.15.156 → 192.168.1.12 TCP 66 22 → 54766 [ACK] Seq=161293 Ack=15825 Win=1452 Len=0 TSval=14670291 TSecr=7738795
  304 5.323547746  10.6.15.156 → 192.168.1.12 SSH 102 Server: Encrypted packet (len=36)
  305 5.323870148 192.168.1.12 → 10.6.15.156  SSH 190 Client: Encrypted packet (len=124)
  306 5.335338666  10.6.15.156 → 192.168.1.12 TCP 66 22 → 54766 [ACK] Seq=161329 Ack=15949 Win=1452 Len=0 TSval=14670306 TSecr=7738810
  307 5.540143067  10.6.15.156 → 192.168.1.12 SSH 238 Server: Encrypted packet (len=172)
  308 5.540447710 192.168.1.12 → 10.6.15.156  SSH 134 Client: Encrypted packet (len=68)
  309 5.542133042  10.6.15.156 → 192.168.1.12 TCP 66 22 → 54766 [ACK] Seq=161501 Ack=16017 Win=1452 Len=0 TSval=14670360 TSecr=7738864
  310 5.542153618 192.168.1.12 → 10.6.15.156  SSH 862 Client: Encrypted packet (len=796)
  311 5.544181697  10.6.15.156 → 192.168.1.12 TCP 66 22 → 54766 [ACK] Seq=161501 Ack=16813 Win=1452 Len=0 TSval=14670361 TSecr=7738865
  312 5.621941525 10.22.17.139 → 224.0.0.252  LLMNR 69 Standard query 0x8667 A mlaemwzui
  313 5.759437116  10.6.15.156 → 192.168.1.12 SSH 454 Server: Encrypted packet (len=388)
  314 5.801290504 192.168.1.12 → 10.6.15.156  TCP 66 54766 → 22 [ACK] Seq=16813 Ack=161889 Win=4866 Len=0 TSval=7738930 TSecr=14670414
  315 5.818894414  10.6.15.156 → 192.168.1.12 SSH 454 Server: Encrypted packet (len=388)
  316 5.818919477 192.168.1.12 → 10.6.15.156  TCP 66 54766 → 22 [ACK] Seq=16813 Ack=162277 Win=4866 Len=0 TSval=7738934 TSecr=14670429
  317 7.101305538 192.168.1.12 → 10.6.15.156  SSH 102 Client: Encrypted packet (len=36)
  318 7.103220466  10.6.15.156 → 192.168.1.12 TCP 66 22 → 54766 [ACK] Seq=162277 Ack=16849 Win=1452 Len=0 TSval=14670750 TSecr=7739255
  319 7.103237011 192.168.1.12 → 10.6.15.156  SSH 922 Client: Encrypted packet (len=856)
  320 7.105908176  10.6.15.156 → 192.168.1.12 TCP 66 22 → 54766 [ACK] Seq=162277 Ack=17705 Win=1452 Len=0 TSval=14670751 TSecr=7739255
  321 7.219350972 10.22.17.139 → 224.0.0.252  LLMNR 69 Standard query 0x0c55 A tqqlnzhvw
  322 7.219732620 10.22.17.139 → 224.0.0.252  LLMNR 73 Standard query 0xcfec A qrgazjqkdyahj
  323 7.256654642  10.6.15.156 → 192.168.1.12 SSH 102 Server: Encrypted packet (len=36)
  324 7.256675944 192.168.1.12 → 10.6.15.156  TCP 66 54766 → 22 [ACK] Seq=17705 Ack=162313 Win=4866 Len=0 TSval=7739293 TSecr=14670789
  325 7.257026493 192.168.1.12 → 10.6.15.156  SSH 206 Client: Encrypted packet (len=140)
  326 7.258614277  10.6.15.156 → 192.168.1.12 TCP 66 22 → 54766 [ACK] Seq=162313 Ack=17845 Win=1452 Len=0 TSval=14670789 TSecr=7739293
  327 7.317087106  10.6.15.156 → 192.168.1.12 SSH 126 Server: Encrypted packet (len=60)
  328 7.317472025  10.6.15.156 → 192.168.1.12 SSH 138 Server: Encrypted packet (len=72)
  329 7.317551611 192.168.1.12 → 10.6.15.156  TCP 66 54766 → 22 [ACK] Seq=17845 Ack=162445 Win=4866 Len=0 TSval=7739309 TSecr=14670804
  330 7.317684749 192.168.1.12 → 10.6.15.156  SSH 102 Client: Encrypted packet (len=36)
  331 7.318966695  10.6.15.156 → 192.168.1.12 TCP 66 22 → 54766 [ACK] Seq=162445 Ack=17881 Win=1452 Len=0 TSval=14670804 TSecr=7739309
  332 7.324784189  10.6.15.156 → 192.168.1.12 SSH 454 Server: Encrypted packet (len=388)
  333 7.365313350 192.168.1.12 → 10.6.15.156  TCP 66 54766 → 22 [ACK] Seq=17881 Ack=162833 Win=4866 Len=0 TSval=7739321 TSecr=14670806
  334 7.410768628  10.6.15.156 → 192.168.1.12 SSH 246 Server: Encrypted packet (len=180)
  335 7.410791252 192.168.1.12 → 10.6.15.156  TCP 66 54766 → 22 [ACK] Seq=17881 Ack=163013 Win=4866 Len=0 TSval=7739332 TSecr=14670827
  336 7.411054684 192.168.1.12 → 10.6.15.156  SSH 134 Client: Encrypted packet (len=68)
  337 7.412076651 192.168.1.12 → 10.6.15.156  SSH 1514 Client: Encrypted packet (len=1448)
  338 7.412959692 192.168.1.12 → 10.6.15.156  SSH 470 Client: Encrypted packet (len=404)
  339 7.414677929  10.6.15.156 → 192.168.1.12 TCP 66 22 → 54766 [ACK] Seq=163013 Ack=19801 Win=1452 Len=0 TSval=14670828 TSecr=7739332
  340 7.569635964  10.6.15.156 → 192.168.1.12 SSH 502 Server: Encrypted packet (len=436)
  341 7.613287615 192.168.1.12 → 10.6.15.156  TCP 66 54766 → 22 [ACK] Seq=19801 Ack=163449 Win=4866 Len=0 TSval=7739383 TSecr=14670867
  342 7.633688213 10.22.17.139 → 224.0.0.252  LLMNR 69 Standard query 0x0c55 A tqqlnzhvw
  343 7.634069589 10.22.17.139 → 224.0.0.252  LLMNR 73 Standard query 0xcfec A qrgazjqkdyahj
  344 7.882236367  10.22.18.25 → 224.0.0.252  LLMNR 64 Standard query 0x7184 A wpad
  345 8.095136952 192.168.1.12 → 10.6.15.156  SSH 862 Client: Encrypted packet (len=796)
  346 8.135929199  10.6.15.156 → 192.168.1.12 TCP 66 22 → 54766 [ACK] Seq=163449 Ack=20597 Win=1452 Len=0 TSval=14671009 TSecr=7739503
  347 8.175117642 192.168.1.12 → 123.108.200.124 NTP 90 NTP Version 4, client
  348 8.293733180  10.22.18.25 → 224.0.0.252  LLMNR 64 Standard query 0x7184 A wpad
  349 8.316367512  10.6.15.156 → 192.168.1.12 SSH 454 Server: Encrypted packet (len=388)
  350 8.316394410 192.168.1.12 → 10.6.15.156  TCP 66 54766 → 22 [ACK] Seq=20597 Ack=163837 Win=4866 Len=0 TSval=7739558 TSecr=14671054
  351 9.095056927 192.168.1.12 → 10.6.15.156  SSH 1514 Client: Encrypted packet (len=1448)
  352 9.098131058  10.6.15.156 → 192.168.1.12 TCP 66 22 → 54766 [ACK] Seq=163837 Ack=22045 Win=1452 Len=0 TSval=14671249 TSecr=7739753
  353 9.098146951 192.168.1.12 → 10.6.15.156  SSH 514 Client: Encrypted packet (len=448)
  354 9.100054716  10.6.15.156 → 192.168.1.12 TCP 66 22 → 54766 [ACK] Seq=163837 Ack=22493 Win=1452 Len=0 TSval=14671250 TSecr=7739754
  355 9.254295945  10.6.15.156 → 192.168.1.12 SSH 502 Server: Encrypted packet (len=436)
  356 9.254313799 192.168.1.12 → 10.6.15.156  TCP 66 54766 → 22 [ACK] Seq=22493 Ack=164273 Win=4866 Len=0 TSval=7739793 TSecr=14671288
  357 9.478462999  10.6.15.156 → 192.168.1.12 SSH 102 Server: Encrypted packet (len=36)
  358 9.478489876 192.168.1.12 → 10.6.15.156  TCP 66 54766 → 22 [ACK] Seq=22493 Ack=164309 Win=4866 Len=0 TSval=7739849 TSecr=14671344
  359 10.095550390 192.168.1.12 → 10.6.15.156  SSH 138 Client: Encrypted packet (len=72)
  360 10.097429236  10.6.15.156 → 192.168.1.12 TCP 66 22 → 54766 [ACK] Seq=164309 Ack=22565 Win=1452 Len=0 TSval=14671499 TSecr=7740003
  361 10.097439181 192.168.1.12 → 10.6.15.156  SSH 1330 Client: Encrypted packet (len=1264)
  362 10.097558175  10.6.15.156 → 192.168.1.12 SSH 102 Server: Encrypted packet (len=36)
  363 10.097564277 192.168.1.12 → 10.6.15.156  TCP 66 54766 → 22 [ACK] Seq=23829 Ack=164345 Win=4866 Len=0 TSval=7740004 TSecr=14671499
  364 10.141724508  10.6.15.156 → 192.168.1.12 TCP 66 22 → 54766 [ACK] Seq=164345 Ack=23829 Win=1452 Len=0 TSval=14671510 TSecr=7740004
  365 10.169130815  10.6.15.156 → 192.168.1.12 SSH 210 Server: Encrypted packet (len=144)
  366 10.169149307 192.168.1.12 → 10.6.15.156  TCP 66 54766 → 22 [ACK] Seq=23829 Ack=164489 Win=4866 Len=0 TSval=7740021 TSecr=14671517
  367 10.169469372 192.168.1.12 → 10.6.15.156  SSH 138 Client: Encrypted packet (len=72)
  368 10.169870402  10.6.15.156 → 192.168.1.12 SSH 138 Server: Encrypted packet (len=72)
  369 10.169975542  10.6.15.156 → 192.168.1.12 SSH 138 Server: Encrypted packet (len=72)
  370 10.170089935 192.168.1.12 → 10.6.15.156  TCP 66 54766 → 22 [ACK] Seq=23901 Ack=164633 Win=4866 Len=0 TSval=7740022 TSecr=14671517
  371 10.170331975 192.168.1.12 → 10.6.15.156  SSH 138 Client: Encrypted packet (len=72)
  372 10.173597493  10.6.15.156 → 192.168.1.12 TCP 66 22 → 54766 [ACK] Seq=164633 Ack=23901 Win=1452 Len=0 TSval=14671517 TSecr=7740022
  373 10.173712156  10.6.15.156 → 192.168.1.12 TCP 66 22 → 54766 [ACK] Seq=164633 Ack=23973 Win=1452 Len=0 TSval=14671517 TSecr=7740022
  374 10.173883405  10.6.15.156 → 192.168.1.12 SSH 138 Server: Encrypted packet (len=72)
  375 10.174085621 192.168.1.12 → 10.6.15.156  SSH 102 Client: Encrypted packet (len=36)
  376 10.215862865  10.6.15.156 → 192.168.1.12 TCP 66 22 → 54766 [ACK] Seq=164705 Ack=24009 Win=1452 Len=0 TSval=14671529 TSecr=7740023
  377 10.250369844  10.6.15.156 → 192.168.1.12 SSH 138 Server: Encrypted packet (len=72)
  378 10.250582083 192.168.1.12 → 10.6.15.156  SSH 102 Client: Encrypted packet (len=36)
  379 10.252022081  10.6.15.156 → 192.168.1.12 TCP 66 22 → 54766 [ACK] Seq=164777 Ack=24045 Win=1452 Len=0 TSval=14671538 TSecr=7740042
  380 10.276000799  10.6.15.156 → 192.168.1.12 SSH 138 Server: Encrypted packet (len=72)
  381 10.276112777  10.6.15.156 → 192.168.1.12 SSH 138 Server: Encrypted packet (len=72)
  382 10.276189630 192.168.1.12 → 10.6.15.156  TCP 66 54766 → 22 [ACK] Seq=24045 Ack=164921 Win=4866 Len=0 TSval=7740048 TSecr=14671543
  383 10.276203943 192.168.1.12 → 10.6.15.156  SSH 102 Client: Encrypted packet (len=36)
  384 10.276776328 192.168.1.12 → 10.6.15.156  SSH 102 Client: Encrypted packet (len=36)
  385 10.279318696  10.6.15.156 → 192.168.1.12 TCP 66 22 → 54766 [ACK] Seq=164921 Ack=24117 Win=1452 Len=0 TSval=14671544 TSecr=7740048
  386 10.279439186  10.6.15.156 → 192.168.1.12 SSH 138 Server: Encrypted packet (len=72)
  387 10.279627092 192.168.1.12 → 10.6.15.156  SSH 102 Client: Encrypted packet (len=36)
  388 10.280199419  10.6.15.156 → 192.168.1.12 SSH 210 Server: Encrypted packet (len=144)
  389 10.280703616  10.6.15.156 → 192.168.1.12 SSH 138 Server: Encrypted packet (len=72)
  390 10.280728819 192.168.1.12 → 10.6.15.156  SSH 138 Client: Encrypted packet (len=72)
  391 10.280778357  10.6.15.156 → 192.168.1.12 SSH 138 Server: Encrypted packet (len=72)
  392 10.281172486 192.168.1.12 → 10.6.15.156  SSH 138 Client: Encrypted packet (len=72)
  393 10.282583868  10.6.15.156 → 192.168.1.12 TCP 66 22 → 54766 [ACK] Seq=165281 Ack=24225 Win=1452 Len=0 TSval=14671545 TSecr=7740049
  394 10.319605310  10.6.15.156 → 192.168.1.12 SSH 454 Server: Encrypted packet (len=388)
  395 10.361313880 192.168.1.12 → 10.6.15.156  TCP 66 54766 → 22 [ACK] Seq=24297 Ack=165669 Win=4866 Len=0 TSval=7740070 TSecr=14671554
  396 11.099473026 192.168.1.12 → 10.6.15.156  SSH 862 Client: Encrypted packet (len=796)
  397 11.139929237  10.6.15.156 → 192.168.1.12 TCP 66 22 → 54766 [ACK] Seq=165669 Ack=25093 Win=1452 Len=0 TSval=14671760 TSecr=7740254
  398 11.139950184 192.168.1.12 → 10.6.15.156  SSH 102 Client: Encrypted packet (len=36)
  399 11.141349915  10.6.15.156 → 192.168.1.12 TCP 66 22 → 54766 [ACK] Seq=165669 Ack=25129 Win=1452 Len=0 TSval=14671760 TSecr=7740264
  400 11.320366004  10.6.15.156 → 192.168.1.12 SSH 454 Server: Encrypted packet (len=388)
  401 11.320384099 192.168.1.12 → 10.6.15.156  TCP 66 54766 → 22 [ACK] Seq=25129 Ack=166057 Win=4866 Len=0 TSval=7740309 TSecr=14671805
  402 11.322431725 192.168.1.12 → 10.6.15.156  SSH 862 Client: Encrypted packet (len=796)
  403 11.324473873  10.6.15.156 → 192.168.1.12 TCP 66 22 → 54766 [ACK] Seq=166057 Ack=25925 Win=1452 Len=0 TSval=14671806 TSecr=7740310
  404 11.355854622  10.6.15.156 → 192.168.1.12 SSH 102 Server: Encrypted packet (len=36)
  405 11.356133352 192.168.1.12 → 10.6.15.156  SSH 158 Client: Encrypted packet (len=92)
  406 11.395893895  10.6.15.156 → 192.168.1.12 TCP 66 22 → 54766 [ACK] Seq=166093 Ack=26017 Win=1452 Len=0 TSval=14671824 TSecr=7740318
  407 11.543213073  10.6.15.156 → 192.168.1.12 SSH 454 Server: Encrypted packet (len=388)
  408 11.572231353  10.6.15.156 → 192.168.1.12 SSH 182 Server: Encrypted packet (len=116)
  409 11.572303247 192.168.1.12 → 10.6.15.156  TCP 66 54766 → 22 [ACK] Seq=26017 Ack=166597 Win=4866 Len=0 TSval=7740372 TSecr=14671860
  410 11.572543790 192.168.1.12 → 10.6.15.156  SSH 134 Client: Encrypted packet (len=68)
  411 11.575481919  10.6.15.156 → 192.168.1.12 TCP 66 22 → 54766 [ACK] Seq=166597 Ack=26085 Win=1452 Len=0 TSval=14671868 TSecr=7740372
  412 12.074401529  10.6.15.156 → 192.168.1.12 SSH 102 Server: Encrypted packet (len=36)
  413 12.117314763 192.168.1.12 → 10.6.15.156  TCP 66 54766 → 22 [ACK] Seq=26085 Ack=166633 Win=4866 Len=0 TSval=7740509 TSecr=14671993
  414 12.971992756  10.6.15.156 → 192.168.1.12 SSH 102 Server: Encrypted packet (len=36)
  415 12.972018547 192.168.1.12 → 10.6.15.156  TCP 66 54766 → 22 [ACK] Seq=26085 Ack=166669 Win=4866 Len=0 TSval=7740722 TSecr=14672218
  416 13.097951000 192.168.1.12 → 10.6.15.156  SSH 138 Client: Encrypted packet (len=72)
  417 13.101622936  10.6.15.156 → 192.168.1.12 TCP 66 22 → 54766 [ACK] Seq=166669 Ack=26157 Win=1452 Len=0 TSval=14672250 TSecr=7740754
  418 13.101637268 192.168.1.12 → 10.6.15.156  SSH 934 Client: Encrypted packet (len=868)
  419 13.102367590  10.6.15.156 → 192.168.1.12 SSH 102 Server: Encrypted packet (len=36)
  420 13.102375022 192.168.1.12 → 10.6.15.156  TCP 66 54766 → 22 [ACK] Seq=27025 Ack=166705 Win=4866 Len=0 TSval=7740755 TSecr=14672250
  421 13.103925404  10.6.15.156 → 192.168.1.12 SSH 102 Server: Encrypted packet (len=36)
  422 13.103931283 192.168.1.12 → 10.6.15.156  TCP 66 54766 → 22 [ACK] Seq=27025 Ack=166741 Win=4866 Len=0 TSval=7740755 TSecr=14672251
  423 13.322165046  10.6.15.156 → 192.168.1.12 SSH 454 Server: Encrypted packet (len=388)
  424 13.322187743 192.168.1.12 → 10.6.15.156  TCP 66 54766 → 22 [ACK] Seq=27025 Ack=167129 Win=4866 Len=0 TSval=7740810 TSecr=14672305
  425 13.597792875 10.22.17.139 → 224.0.0.252  LLMNR 75 Standard query 0xa555 A mpjlioavgmaedti
  426 14.011072338 10.22.17.139 → 224.0.0.252  LLMNR 75 Standard query 0xa555 A mpjlioavgmaedti
  427 14.093789213 192.168.1.12 → 10.6.15.156  SSH 862 Client: Encrypted packet (len=796)
  428 14.135833558  10.6.15.156 → 192.168.1.12 TCP 66 22 → 54766 [ACK] Seq=167129 Ack=27821 Win=1452 Len=0 TSval=14672509 TSecr=7741003
  429 14.314640913  10.6.15.156 → 192.168.1.12 SSH 454 Server: Encrypted packet (len=388)
  430 14.314667940 192.168.1.12 → 10.6.15.156  TCP 66 54766 → 22 [ACK] Seq=27821 Ack=167517 Win=4866 Len=0 TSval=7741058 TSecr=14672553
  431 14.374461770 10.22.17.139 → 224.0.0.252  LLMNR 64 Standard query 0xc2e2 A wpad
  432 14.375289322 10.22.17.139 → 224.0.0.252  LLMNR 64 Standard query 0x2fb0 A wpad
  433 14.798811821 10.22.17.139 → 224.0.0.252  LLMNR 64 Standard query 0x2fb0 A wpad
  434 14.799191999 10.22.17.139 → 224.0.0.252  LLMNR 64 Standard query 0xc2e2 A wpad
  435 15.175160024 192.168.1.12 → 139.59.16.133 NTP 90 NTP Version 4, client
  436 15.364174300 10.22.19.111 → 224.0.0.252  LLMNR 64 Standard query 0xf54b A wpad
  437 15.603738930 10.22.17.139 → 224.0.0.252  LLMNR 69 Standard query 0x8be3 A oskzspyby
  438 15.604392833 10.22.17.139 → 224.0.0.252  LLMNR 71 Standard query 0xf9c2 A ydarugjidec
  439 15.604764849 10.22.17.139 → 224.0.0.252  LLMNR 71 Standard query 0x796f A ydarugjidec
  440 15.604788014 10.22.17.139 → 224.0.0.252  LLMNR 69 Standard query 0x9a81 A oskzspyby
  441 15.685119816  10.6.15.156 → 192.168.1.12 SSH 102 Server: Encrypted packet (len=36)
  442 15.685137246 192.168.1.12 → 10.6.15.156  TCP 66 54766 → 22 [ACK] Seq=27821 Ack=167553 Win=4866 Len=0 TSval=7741400 TSecr=14672896
  443 15.706393167 192.168.1.12 → 10.6.15.156  SSH 138 Client: Encrypted packet (len=72)
  444 15.706707054 192.168.1.12 → 10.6.15.156  SSH 1514 Client: Encrypted packet (len=1448)
  445 15.707355423 192.168.1.12 → 10.6.15.156  SSH 150 Client: Encrypted packet (len=84)
  446 15.708087353  10.6.15.156 → 192.168.1.12 TCP 66 22 → 54766 [ACK] Seq=167553 Ack=27893 Win=1452 Len=0 TSval=14672902 TSecr=7741406
  447 15.708614261  10.6.15.156 → 192.168.1.12 SSH 102 Server: Encrypted packet (len=36)
  448 15.709286684  10.6.15.156 → 192.168.1.12 TCP 66 22 → 54766 [ACK] Seq=167589 Ack=29425 Win=1452 Len=0 TSval=14672902 TSecr=7741406
  449 15.749311217 192.168.1.12 → 10.6.15.156  TCP 66 54766 → 22 [ACK] Seq=29425 Ack=167589 Win=4866 Len=0 TSval=7741417 TSecr=14672902
  450 15.779224462 10.22.19.111 → 224.0.0.252  LLMNR 64 Standard query 0xf54b A wpad
  451 15.857074605  10.6.15.156 → 192.168.1.12 SSH 670 Server: Encrypted packet (len=604)
  452 15.857099246 192.168.1.12 → 10.6.15.156  TCP 66 54766 → 22 [ACK] Seq=29425 Ack=168193 Win=4866 Len=0 TSval=7741443 TSecr=14672939
  453 16.019271469 10.22.17.139 → 224.0.0.252  LLMNR 69 Standard query 0x9a81 A oskzspyby
  454 16.019653675 10.22.17.139 → 224.0.0.252  LLMNR 71 Standard query 0x796f A ydarugjidec
  455 16.019661470 10.22.17.139 → 224.0.0.252  LLMNR 71 Standard query 0xf9c2 A ydarugjidec
  456 16.020100829 10.22.17.139 → 224.0.0.252  LLMNR 69 Standard query 0x8be3 A oskzspyby
  457 16.098254867 192.168.1.12 → 10.6.15.156  SSH 862 Client: Encrypted packet (len=796)
  458 16.139774523  10.6.15.156 → 192.168.1.12 TCP 66 22 → 54766 [ACK] Seq=168193 Ack=30221 Win=1452 Len=0 TSval=14673010 TSecr=7741504
  459 16.319090490  10.6.15.156 → 192.168.1.12 SSH 454 Server: Encrypted packet (len=388)
  460 16.319116477 192.168.1.12 → 10.6.15.156  TCP 66 54766 → 22 [ACK] Seq=30221 Ack=168581 Win=4866 Len=0 TSval=7741559 TSecr=14673054
  461 17.098386214 192.168.1.12 → 10.6.15.156  SSH 862 Client: Encrypted packet (len=796)
  462 17.100460556  10.6.15.156 → 192.168.1.12 TCP 66 22 → 54766 [ACK] Seq=168581 Ack=31017 Win=1452 Len=0 TSval=14673250 TSecr=7741754
  463 17.100631686 192.168.1.12 → 10.6.15.156  SSH 862 Client: Encrypted packet (len=796)
  464 17.102682532  10.6.15.156 → 192.168.1.12 TCP 66 22 → 54766 [ACK] Seq=168581 Ack=31813 Win=1452 Len=0 TSval=14673250 TSecr=7741754
  465 17.318417320  10.6.15.156 → 192.168.1.12 SSH 454 Server: Encrypted packet (len=388)
  466 17.318442095 192.168.1.12 → 10.6.15.156  TCP 66 54766 → 22 [ACK] Seq=31813 Ack=168969 Win=4866 Len=0 TSval=7741809 TSecr=14673304
  467 17.319958481  10.6.15.156 → 192.168.1.12 SSH 454 Server: Encrypted packet (len=388)
  468 17.319974771 192.168.1.12 → 10.6.15.156  TCP 66 54766 → 22 [ACK] Seq=31813 Ack=169357 Win=4866 Len=0 TSval=7741809 TSecr=14673305
  469 18.093026904 192.168.1.12 → 10.6.15.156  SSH 1514 Client: Encrypted packet (len=1448)
  470 18.095613484  10.6.15.156 → 192.168.1.12 TCP 66 22 → 54766 [ACK] Seq=169357 Ack=33261 Win=1452 Len=0 TSval=14673499 TSecr=7742002
  471 18.095634333 192.168.1.12 → 10.6.15.156  SSH 470 Client: Encrypted packet (len=404)
  472 18.099804461  10.6.15.156 → 192.168.1.12 TCP 66 22 → 54766 [ACK] Seq=169357 Ack=33665 Win=1452 Len=0 TSval=14673499 TSecr=7742003
  473 18.252283512  10.6.15.156 → 192.168.1.12 SSH 502 Server: Encrypted packet (len=436)
  474 18.252302338 192.168.1.12 → 10.6.15.156  TCP 66 54766 → 22 [ACK] Seq=33665 Ack=169793 Win=4866 Len=0 TSval=7742042 TSecr=14673538
  475 19.093388202 192.168.1.12 → 10.6.15.156  SSH 862 Client: Encrypted packet (len=796)
  476 19.095542387  10.6.15.156 → 192.168.1.12 TCP 66 22 → 54766 [ACK] Seq=169793 Ack=34461 Win=1452 Len=0 TSval=14673749 TSecr=7742253
  477 19.314129930  10.6.15.156 → 192.168.1.12 SSH 454 Server: Encrypted packet (len=388)
  478 19.314155378 192.168.1.12 → 10.6.15.156  TCP 66 54766 → 22 [ACK] Seq=34461 Ack=170181 Win=4866 Len=0 TSval=7742308 TSecr=14673803
  479 20.096638720 192.168.1.12 → 10.6.15.156  SSH 862 Client: Encrypted packet (len=796)
  480 20.098842482  10.6.15.156 → 192.168.1.12 TCP 66 22 → 54766 [ACK] Seq=170181 Ack=35257 Win=1452 Len=0 TSval=14673999 TSecr=7742503
  481 20.317402138  10.6.15.156 → 192.168.1.12 SSH 454 Server: Encrypted packet (len=388)
  482 20.317427092 192.168.1.12 → 10.6.15.156  TCP 66 54766 → 22 [ACK] Seq=35257 Ack=170569 Win=4866 Len=0 TSval=7742559 TSecr=14674054
  483 21.365307575 10.22.17.139 → 224.0.0.252  LLMNR 64 Standard query 0x1436 A wpad
  484 21.366011114 10.22.17.139 → 224.0.0.252  LLMNR 64 Standard query 0x0622 A wpad
  485 21.600348650 10.22.17.139 → 224.0.0.252  LLMNR 75 Standard query 0xcb0b A mpjlioavgmaedti
  486 21.786404049 10.22.17.139 → 224.0.0.252  LLMNR 64 Standard query 0x0622 A wpad
  487 21.786777141 10.22.17.139 → 224.0.0.252  LLMNR 64 Standard query 0x1436 A wpad
  488 21.955445757 192.168.1.12 → 239.255.255.250 SSDP 213 M-SEARCH * HTTP/1.1 
  489 22.015136796 10.22.17.139 → 224.0.0.252  LLMNR 75 Standard query 0xcb0b A mpjlioavgmaedti
  490 22.099563234 192.168.1.12 → 10.6.15.156  SSH 862 Client: Encrypted packet (len=796)
  491 22.102936720  10.6.15.156 → 192.168.1.12 TCP 66 22 → 54766 [ACK] Seq=170569 Ack=36053 Win=1452 Len=0 TSval=14674500 TSecr=7743004
  492 22.198296908 192.168.1.12 → 192.168.1.1  DNS 89 Standard query 0x440e A clientservices.googleapis.com
  493 22.200642134  192.168.1.1 → 192.168.1.12 DNS 105 Standard query response 0x440e A clientservices.googleapis.com A 216.58.196.99
  494 22.201293893 192.168.1.12 → 216.58.196.99 QUIC 1392 Client Hello, PKN: 1, CID: 10168546210970041902
  495 22.231037123 216.58.196.99 → 192.168.1.12 QUIC 77 Payload (Encrypted), PKN: 1, CID: 10168546210970041902
  496 22.237793904 216.58.196.99 → 192.168.1.12 QUIC 1392 Rejection, PKN: 2, CID: 10168546210970041902
  497 22.238368810 216.58.196.99 → 192.168.1.12 QUIC 1392 Payload (Encrypted), PKN: 3, CID: 10168546210970041902
  498 22.239904869 192.168.1.12 → 216.58.196.99 QUIC 1392 Client Hello, PKN: 2, CID: 10168546210970041902
  499 22.240065883 192.168.1.12 → 216.58.196.99 QUIC 279 Payload (Encrypted), PKN: 3, CID: 10168546210970041902
  500 22.250253081 192.168.1.12 → 216.58.196.99 QUIC 1392 Client Hello, PKN: 4, CID: 10168546210970041902
  501 22.253475054 216.58.196.99 → 192.168.1.12 QUIC 83 Payload (Encrypted), PKN: 4, CID: 10168546210970041902
  502 22.253568868 192.168.1.12 → 216.58.196.99 QUIC 279 Payload (Encrypted), PKN: 5, CID: 10168546210970041902
  503 22.275714310 216.58.196.99 → 192.168.1.12 QUIC 1392 Payload (Encrypted), PKN: 5
  504 22.275991657 216.58.196.99 → 192.168.1.12 QUIC 73 Payload (Encrypted), PKN: 6
  505 22.276070858 192.168.1.12 → 216.58.196.99 QUIC 83 Payload (Encrypted), PKN: 6, CID: 10168546210970041902
  506 22.276129078 192.168.1.12 → 216.58.196.99 QUIC 83 Payload (Encrypted), PKN: 7, CID: 10168546210970041902
  507 22.278875122 216.58.196.99 → 192.168.1.12 QUIC 75 Payload (Encrypted), PKN: 7
  508 22.279677183 216.58.196.99 → 192.168.1.12 QUIC 69 Payload (Encrypted), PKN: 8
  509 22.320498603  10.6.15.156 → 192.168.1.12 SSH 454 Server: Encrypted packet (len=388)
  510 22.320526866 192.168.1.12 → 10.6.15.156  TCP 66 54766 → 22 [ACK] Seq=36053 Ack=170957 Win=4866 Len=0 TSval=7743059 TSecr=14674555
  511 22.467832229 216.58.196.99 → 192.168.1.12 QUIC 681 Payload (Encrypted), PKN: 9
  512 22.467851094 216.58.196.99 → 192.168.1.12 QUIC 60 Payload (Encrypted), PKN: 10
  513 22.468002014 192.168.1.12 → 216.58.196.99 QUIC 86 Payload (Encrypted), PKN: 8, CID: 10168546210970041902
  514 22.956342004 192.168.1.12 → 239.255.255.250 SSDP 213 M-SEARCH * HTTP/1.1 
  515 23.096289781 192.168.1.12 → 10.6.15.156  SSH 862 Client: Encrypted packet (len=796)
  516 23.099130796  10.6.15.156 → 192.168.1.12 TCP 66 22 → 54766 [ACK] Seq=170957 Ack=36849 Win=1452 Len=0 TSval=14674749 TSecr=7743253
  517 23.099151081 192.168.1.12 → 10.6.15.156  SSH 862 Client: Encrypted packet (len=796)
  518 23.101565279  10.6.15.156 → 192.168.1.12 TCP 66 22 → 54766 [ACK] Seq=170957 Ack=37645 Win=1452 Len=0 TSval=14674750 TSecr=7743254
  519 23.317077868  10.6.15.156 → 192.168.1.12 SSH 454 Server: Encrypted packet (len=388)
  520 23.317104437 192.168.1.12 → 10.6.15.156  TCP 66 54766 → 22 [ACK] Seq=37645 Ack=171345 Win=4866 Len=0 TSval=7743308 TSecr=14674804
  521 23.317120073  10.6.15.156 → 192.168.1.12 SSH 454 Server: Encrypted packet (len=388)
  522 23.317124051 192.168.1.12 → 10.6.15.156  TCP 66 54766 → 22 [ACK] Seq=37645 Ack=171733 Win=4866 Len=0 TSval=7743308 TSecr=14674804
  523 23.957359813 192.168.1.12 → 239.255.255.250 SSDP 213 M-SEARCH * HTTP/1.1 
  524 24.117850119 192.168.1.12 → 10.6.15.156  SSH 158 Client: Encrypted packet (len=92)
  525 24.119515824  10.6.15.156 → 192.168.1.12 TCP 66 22 → 54766 [ACK] Seq=171733 Ack=37737 Win=1452 Len=0 TSval=14675005 TSecr=7743509
  526 24.958275686 192.168.1.12 → 239.255.255.250 SSDP 213 M-SEARCH * HTTP/1.1 
  527 25.097783431 192.168.1.12 → 10.6.15.156  SSH 862 Client: Encrypted packet (len=796)
  528 25.099805179  10.6.15.156 → 192.168.1.12 TCP 66 22 → 54766 [ACK] Seq=171733 Ack=38533 Win=1452 Len=0 TSval=14675250 TSecr=7743754
  529 25.318389550  10.6.15.156 → 192.168.1.12 SSH 454 Server: Encrypted packet (len=388)
  530 25.318417995 192.168.1.12 → 10.6.15.156  TCP 66 54766 → 22 [ACK] Seq=38533 Ack=172121 Win=4866 Len=0 TSval=7743809 TSecr=14675304
  531 26.094786678 192.168.1.12 → 10.6.15.156  SSH 862 Client: Encrypted packet (len=796)
  532 26.098507298  10.6.15.156 → 192.168.1.12 TCP 66 22 → 54766 [ACK] Seq=172121 Ack=39329 Win=1452 Len=0 TSval=14675499 TSecr=7744003
  533 26.316918765  10.6.15.156 → 192.168.1.12 SSH 454 Server: Encrypted packet (len=388)
  534 26.316946979 192.168.1.12 → 10.6.15.156  TCP 66 54766 → 22 [ACK] Seq=39329 Ack=172509 Win=4866 Len=0 TSval=7744058 TSecr=14675554
  535 28.095453967 192.168.1.12 → 10.6.15.156  SSH 862 Client: Encrypted packet (len=796)
  536 28.098844845  10.6.15.156 → 192.168.1.12 TCP 66 22 → 54766 [ACK] Seq=172509 Ack=40125 Win=1452 Len=0 TSval=14675999 TSecr=7744503
  537 28.129317943 192.168.1.12 → 23.58.43.27  TCP 66 47480 → 80 [ACK] Seq=1 Ack=1 Win=274 Len=0 TSval=7744512 TSecr=2209621079
  538 28.131868157  23.58.43.27 → 192.168.1.12 TCP 66 [TCP ACKed unseen segment] 80 → 47480 [ACK] Seq=1 Ack=2 Win=939 Len=0 TSval=2209666135 TSecr=7665606
  539 28.318690477  10.6.15.156 → 192.168.1.12 SSH 454 Server: Encrypted packet (len=388)
  540 28.318731959 192.168.1.12 → 10.6.15.156  TCP 66 54766 → 22 [ACK] Seq=40125 Ack=172897 Win=4866 Len=0 TSval=7744559 TSecr=14676054
  541 29.097085926 192.168.1.12 → 10.6.15.156  SSH 862 Client: Encrypted packet (len=796)
  542 29.099261433  10.6.15.156 → 192.168.1.12 TCP 66 22 → 54766 [ACK] Seq=172897 Ack=40921 Win=1452 Len=0 TSval=14676249 TSecr=7744753
  543 29.099276650 192.168.1.12 → 10.6.15.156  SSH 862 Client: Encrypted packet (len=796)
  544 29.101313156  10.6.15.156 → 192.168.1.12 TCP 66 22 → 54766 [ACK] Seq=172897 Ack=41717 Win=1452 Len=0 TSval=14676250 TSecr=7744754
  545 29.317198695  10.6.15.156 → 192.168.1.12 SSH 454 Server: Encrypted packet (len=388)
  546 29.317223100 192.168.1.12 → 10.6.15.156  TCP 66 54766 → 22 [ACK] Seq=41717 Ack=173285 Win=4866 Len=0 TSval=7744808 TSecr=14676304
  547 29.317749763  10.6.15.156 → 192.168.1.12 SSH 454 Server: Encrypted packet (len=388)
  548 29.317758837 192.168.1.12 → 10.6.15.156  TCP 66 54766 → 22 [ACK] Seq=41717 Ack=173673 Win=4866 Len=0 TSval=7744809 TSecr=14676304
  549 30.245266216 192.168.1.12 → 23.58.43.27  TCP 66 47482 → 80 [ACK] Seq=1 Ack=1 Win=319 Len=0 TSval=7745041 TSecr=2209623245
  550 30.248221032  23.58.43.27 → 192.168.1.12 TCP 66 [TCP ACKed unseen segment] 80 → 47482 [ACK] Seq=1 Ack=2 Win=972 Len=0 TSval=2209668251 TSecr=7666041
  551 31.095955042 192.168.1.12 → 10.6.15.156  SSH 862 Client: Encrypted packet (len=796)
  552 31.098223206  10.6.15.156 → 192.168.1.12 TCP 66 22 → 54766 [ACK] Seq=173673 Ack=42513 Win=1452 Len=0 TSval=14676749 TSecr=7745253
  553 31.319070849  10.6.15.156 → 192.168.1.12 SSH 454 Server: Encrypted packet (len=388)
  554 31.319096133 192.168.1.12 → 10.6.15.156  TCP 66 54766 → 22 [ACK] Seq=42513 Ack=174061 Win=4866 Len=0 TSval=7745309 TSecr=14676804
  555 32.000640628 10.22.16.140 → 224.0.0.252  LLMNR 64 Standard query 0x51b3 A wpad
  556 32.000990553 10.22.16.140 → 224.0.0.252  LLMNR 64 Standard query 0x9100 AAAA wpad
  557 32.096529497 192.168.1.12 → 10.6.15.156  SSH 862 Client: Encrypted packet (len=796)
  558 32.098975401  10.6.15.156 → 192.168.1.12 TCP 66 22 → 54766 [ACK] Seq=174061 Ack=43309 Win=1452 Len=0 TSval=14676999 TSecr=7745503
  559 32.317403592  10.6.15.156 → 192.168.1.12 SSH 454 Server: Encrypted packet (len=388)
  560 32.317429101 192.168.1.12 → 10.6.15.156  TCP 66 54766 → 22 [ACK] Seq=43309 Ack=174449 Win=4866 Len=0 TSval=7745559 TSecr=14677054
  561 32.410624508 10.22.16.140 → 224.0.0.252  LLMNR 64 Standard query 0x51b3 A wpad
  562 32.411071086 10.22.16.140 → 224.0.0.252  LLMNR 64 Standard query 0x9100 AAAA wpad
  563 34.091648512 192.168.1.12 → 10.6.15.156  SSH 862 Client: Encrypted packet (len=796)
  564 34.097341611  10.6.15.156 → 192.168.1.12 TCP 66 22 → 54766 [ACK] Seq=174449 Ack=44105 Win=1452 Len=0 TSval=14677499 TSecr=7746002
  565 34.315484075  10.6.15.156 → 192.168.1.12 SSH 462 Server: Encrypted packet (len=396)
  566 34.315511471 192.168.1.12 → 10.6.15.156  TCP 66 54766 → 22 [ACK] Seq=44105 Ack=174845 Win=4866 Len=0 TSval=7746058 TSecr=14677553
  567 34.627882134  10.6.15.156 → 192.168.1.12 SSH 138 Server: Encrypted packet (len=72)
  568 34.627898988 192.168.1.12 → 10.6.15.156  TCP 66 54766 → 22 [ACK] Seq=44105 Ack=174917 Win=4866 Len=0 TSval=7746136 TSecr=14677632
  569 34.628112607 192.168.1.12 → 10.6.15.156  SSH 102 Client: Encrypted packet (len=36)
  570 34.629353374  10.6.15.156 → 192.168.1.12 TCP 66 22 → 54766 [ACK] Seq=174917 Ack=44141 Win=1452 Len=0 TSval=14677632 TSecr=7746136
