    1 0.000000000  10.6.15.144 → 192.168.1.16 SSH 582 Server: Encrypted packet (len=516)
    2 0.000026521 192.168.1.16 → 10.6.15.144  TCP 66 59298 → 22 [ACK] Seq=1 Ack=517 Win=3666 Len=0 TSval=3768712 TSecr=4364806
    3 0.000041978  10.6.15.144 → 192.168.1.16 SSH 582 Server: [TCP Spurious Retransmission] , Encrypted packet (len=516)
    4 0.000046584 192.168.1.16 → 10.6.15.144  TCP 78 [TCP Dup ACK 2#1] 59298 → 22 [ACK] Seq=1 Ack=517 Win=3666 Len=0 TSval=3768712 TSecr=4364863 SLE=1 SRE=517
    5 0.000083371  10.6.15.144 → 192.168.1.16 SSH 582 Server: [TCP Spurious Retransmission] , Encrypted packet (len=516)
    6 0.000086441 192.168.1.16 → 10.6.15.144  TCP 78 [TCP Dup ACK 2#2] 59298 → 22 [ACK] Seq=1 Ack=517 Win=3666 Len=0 TSval=3768712 TSecr=4364920 SLE=1 SRE=517
    7 0.000159790  10.6.15.144 → 192.168.1.16 SSH 582 Server: [TCP Spurious Retransmission] , Encrypted packet (len=516)
    8 0.000163408 192.168.1.16 → 10.6.15.144  TCP 78 [TCP Dup ACK 2#3] 59298 → 22 [ACK] Seq=1 Ack=517 Win=3666 Len=0 TSval=3768712 TSecr=4365034 SLE=1 SRE=517
    9 0.002726399 192.168.1.16 → 10.6.15.144  SSH 110 Client: Encrypted packet (len=44)
   10 0.002997732 192.168.1.16 → 10.6.15.144  SSH 102 Client: Encrypted packet (len=36)
   11 0.012754569  10.6.15.144 → 192.168.1.16 TCP 66 22 → 59298 [ACK] Seq=517 Ack=45 Win=1452 Len=0 TSval=4365046 TSecr=3768713
   12 0.023604780  10.6.15.144 → 192.168.1.16 TCP 66 22 → 59298 [ACK] Seq=517 Ack=81 Win=1452 Len=0 TSval=4365049 TSecr=3768713
   13 0.992321841  10.6.15.144 → 192.168.1.16 SSH 102 Server: Encrypted packet (len=36)
   14 0.992438238  10.6.15.144 → 192.168.1.16 SSH 102 Server: Encrypted packet (len=36)
   15 0.992455462 192.168.1.16 → 10.6.15.144  TCP 66 59298 → 22 [ACK] Seq=81 Ack=589 Win=3666 Len=0 TSval=3768960 TSecr=4365087
   16 0.992642832 192.168.1.16 → 10.6.15.144  SSH 174 Client: Encrypted packet (len=108)
   17 0.992741198  10.6.15.144 → 192.168.1.16 SSH 102 Server: [TCP Spurious Retransmission] , Encrypted packet (len=36)
   18 0.992746267 192.168.1.16 → 10.6.15.144  SSH 162 Client: Encrypted packet (len=84)
   19 1.002820397  10.6.15.144 → 192.168.1.16 SSH 170 Server: Encrypted packet (len=104)
   20 1.002839487  10.6.15.144 → 192.168.1.16 TCP 66 22 → 59298 [ACK] Seq=693 Ack=273 Win=1452 Len=0 TSval=4365294 TSecr=3768960
   21 1.045815908 192.168.1.16 → 10.6.15.144  TCP 66 59298 → 22 [ACK] Seq=273 Ack=693 Win=3666 Len=0 TSval=3768974 TSecr=4365294
   22 1.985781631  10.6.15.144 → 192.168.1.16 SSH 1514 Server: Encrypted packet (len=1448)
   23 1.985811720 192.168.1.16 → 10.6.15.144  TCP 66 59298 → 22 [ACK] Seq=273 Ack=2141 Win=3666 Len=0 TSval=3769209 TSecr=4365346
   24 1.985938751  10.6.15.144 → 192.168.1.16 SSH 1318 Server: Encrypted packet (len=1252)
   25 1.985945681 192.168.1.16 → 10.6.15.144  TCP 66 59298 → 22 [ACK] Seq=273 Ack=3393 Win=3666 Len=0 TSval=3769209 TSecr=4365346
   26 1.986974069 192.168.1.16 → 10.6.15.144  SSH 214 Client: Encrypted packet (len=148)
   27 1.997763247  10.6.15.144 → 192.168.1.16 TCP 66 [TCP Previous segment not captured] 22 → 59298 [ACK] Seq=3877 Ack=421 Win=1452 Len=0 TSval=4365542 TSecr=3769209
   28 2.975752663  10.6.15.144 → 192.168.1.16 SSH 150 Server: Encrypted packet (len=84)
   29 2.975771144 192.168.1.16 → 10.6.15.144  TCP 78 [TCP Dup ACK 25#1] 59298 → 22 [ACK] Seq=421 Ack=3393 Win=3666 Len=0 TSval=3769456 TSecr=4365346 SLE=3877 SRE=3961
   30 2.975786518  10.6.15.144 → 192.168.1.16 TCP 150 [TCP Retransmission] 22 → 59298 [PSH, ACK] Seq=3877 Ack=421 Win=1452 Len=84 TSval=4365753 TSecr=3769209
   31 2.975790540 192.168.1.16 → 10.6.15.144  TCP 86 [TCP Dup ACK 25#2] 59298 → 22 [ACK] Seq=421 Ack=3393 Win=3666 Len=0 TSval=3769456 TSecr=4365346 SLE=3877 SRE=3961 SLE=3877 SRE=3961
   32 4.994203743  10.6.15.144 → 192.168.1.16 TCP 550 [TCP Retransmission] 22 → 59298 [PSH, ACK] Seq=3393 Ack=421 Win=1452 Len=484 TSval=4366250 TSecr=3769456
   33 4.994230871 192.168.1.16 → 10.6.15.144  TCP 66 59298 → 22 [ACK] Seq=421 Ack=3961 Win=3666 Len=0 TSval=3769961 TSecr=4366250
   34 4.995342188 192.168.1.16 → 10.6.15.144  SSH 206 Client: Encrypted packet (len=140)
   35 4.998854978 192.168.1.16 → 10.6.15.144  SSH 1514 Client: Encrypted packet (len=1448)
   36 5.000014674 192.168.1.16 → 10.6.15.144  SSH 86 Client: Encrypted packet (len=20)
   37 5.005570523  10.6.15.144 → 192.168.1.16 TCP 66 22 → 59298 [ACK] Seq=3961 Ack=561 Win=1452 Len=0 TSval=4366294 TSecr=3769961
   38 5.010022609  10.6.15.144 → 192.168.1.16 TCP 66 22 → 59298 [ACK] Seq=3961 Ack=2029 Win=1452 Len=0 TSval=4366295 TSecr=3769962
   39 5.983679852  10.6.15.144 → 192.168.1.16 SSH 142 Server: Encrypted packet (len=76)
   40 5.983701026 10.22.18.209 → 224.0.0.252  LLMNR 64 Standard query 0x3440 A wpad
   41 5.983714637 10.22.18.209 → 224.0.0.252  LLMNR 64 Standard query 0x3440 A wpad
   42 5.983718834  10.6.15.144 → 192.168.1.16 TCP 142 [TCP Retransmission] 22 → 59298 [PSH, ACK] Seq=3961 Ack=2029 Win=1452 Len=76 TSval=4366503 TSecr=3769962
   43 5.983729199 192.168.1.16 → 10.6.15.144  TCP 78 59298 → 22 [ACK] Seq=2029 Ack=4037 Win=3666 Len=0 TSval=3770208 TSecr=4366503 SLE=3961 SRE=4037
   44 5.988381174  10.6.15.144 → 192.168.1.16 SSH 1514 Server: Encrypted packet (len=1448)
   45 5.988398474 192.168.1.16 → 10.6.15.144  TCP 66 59298 → 22 [ACK] Seq=2029 Ack=5485 Win=3666 Len=0 TSval=3770209 TSecr=4366507
   46 5.988419252  10.6.15.144 → 192.168.1.16 SSH 798 Server: Encrypted packet (len=732)
   47 5.988425279 192.168.1.16 → 10.6.15.144  TCP 66 59298 → 22 [ACK] Seq=2029 Ack=6217 Win=3666 Len=0 TSval=3770209 TSecr=4366507
   48 5.990703703 192.168.1.16 → 10.6.15.144  SSH 138 Client: Encrypted packet (len=72)
   49 5.993624820 192.168.1.16 → 10.6.15.144  SSH 1514 Client: Encrypted packet (len=1448)
   50 5.995636807 192.168.1.16 → 10.6.15.144  SSH 206 Client: Encrypted packet (len=140)
   51 6.001920300  10.6.15.144 → 192.168.1.16 TCP 66 22 → 59298 [ACK] Seq=6217 Ack=2101 Win=1452 Len=0 TSval=4366543 TSecr=3770210
   52 6.002317477  10.6.15.144 → 192.168.1.16 SSH 102 Server: Encrypted packet (len=36)
   53 6.005895895  10.6.15.144 → 192.168.1.16 TCP 66 22 → 59298 [ACK] Seq=6253 Ack=3689 Win=1452 Len=0 TSval=4366544 TSecr=3770210
   54 6.045839928 192.168.1.16 → 10.6.15.144  TCP 66 59298 → 22 [ACK] Seq=3689 Ack=6253 Win=3666 Len=0 TSval=3770224 TSecr=4366544
   55 6.975971301  10.6.15.144 → 192.168.1.16 SSH 1514 Server: Encrypted packet (len=1448)
   56 6.975993504 192.168.1.16 → 10.6.15.144  TCP 66 59298 → 22 [ACK] Seq=3689 Ack=7701 Win=3666 Len=0 TSval=3770456 TSecr=4366657
   57 6.976495390  10.6.15.144 → 192.168.1.16 SSH 1514 Server: Encrypted packet (len=1448)
   58 6.976499538 192.168.1.16 → 10.6.15.144  TCP 66 59298 → 22 [ACK] Seq=3689 Ack=9149 Win=3666 Len=0 TSval=3770456 TSecr=4366657
   59 7.014725328  10.6.15.144 → 192.168.1.16 SSH 1514 Server: [TCP Previous segment not captured] , Encrypted packet (len=1448)
   60 7.014743747 192.168.1.16 → 10.6.15.144  TCP 78 [TCP Dup ACK 58#1] 59298 → 22 [ACK] Seq=3689 Ack=9149 Win=3666 Len=0 TSval=3770466 TSecr=4366657 SLE=10597 SRE=12045
   61 7.014924312  10.6.15.144 → 192.168.1.16 SSH 1514 Server: Encrypted packet (len=1448)
   62 7.014932616 192.168.1.16 → 10.6.15.144  TCP 78 [TCP Dup ACK 58#2] 59298 → 22 [ACK] Seq=3689 Ack=9149 Win=3666 Len=0 TSval=3770466 TSecr=4366657 SLE=10597 SRE=13493
   63 7.025666816  10.6.15.144 → 192.168.1.16 SSH 1514 Server: Encrypted packet (len=1448)
   64 7.025687703 192.168.1.16 → 10.6.15.144  TCP 78 [TCP Dup ACK 58#3] 59298 → 22 [ACK] Seq=3689 Ack=9149 Win=3666 Len=0 TSval=3770468 TSecr=4366657 SLE=10597 SRE=14941
   65 7.025822451  10.6.15.144 → 192.168.1.16 SSH 1514 Server: Encrypted packet (len=1448)
   66 7.025832314 192.168.1.16 → 10.6.15.144  TCP 78 [TCP Dup ACK 58#4] 59298 → 22 [ACK] Seq=3689 Ack=9149 Win=3666 Len=0 TSval=3770469 TSecr=4366657 SLE=10597 SRE=16389
   67 7.036424724  10.6.15.144 → 192.168.1.16 SSH 1514 Server: [TCP Fast Retransmission] , Encrypted packet (len=1448)
   68 7.036449602 192.168.1.16 → 10.6.15.144  TCP 66 59298 → 22 [ACK] Seq=3689 Ack=16389 Win=3666 Len=0 TSval=3770471 TSecr=4366802
   69 7.036537974  10.6.15.144 → 192.168.1.16 SSH 1514 Server: Encrypted packet (len=1448)
   70 7.036541300 192.168.1.16 → 10.6.15.144  TCP 66 59298 → 22 [ACK] Seq=3689 Ack=17837 Win=3666 Len=0 TSval=3770471 TSecr=4366802
   71 7.037324923 192.168.1.16 → 10.6.15.144  SSH 138 Client: Encrypted packet (len=72)
   72 7.046500381 192.168.1.16 → 10.6.15.144  SSH 1514 Client: Encrypted packet (len=1448)
   73 7.053726281 192.168.1.16 → 10.6.15.144  SSH 222 Client: Encrypted packet (len=156)
   74 7.055444836  10.6.15.144 → 192.168.1.16 SSH 1514 Server: Encrypted packet (len=1448)
   75 7.055626670  10.6.15.144 → 192.168.1.16 SSH 1514 Server: Encrypted packet (len=1448)
   76 7.055639137 192.168.1.16 → 10.6.15.144  TCP 66 59298 → 22 [ACK] Seq=5365 Ack=20733 Win=3666 Len=0 TSval=3770476 TSecr=4366805
   77 7.055818687  10.6.15.144 → 192.168.1.16 SSH 1514 Server: Encrypted packet (len=1448)
   78 7.061578332  10.6.15.144 → 192.168.1.16 TCP 66 22 → 59298 [ACK] Seq=22181 Ack=5209 Win=1452 Len=0 TSval=4366808 TSecr=3770471
   79 7.067305820  10.6.15.144 → 192.168.1.16 SSH 1514 Server: [TCP Previous segment not captured] , Encrypted packet (len=1448)
   80 7.067332570 192.168.1.16 → 10.6.15.144  TCP 78 59298 → 22 [ACK] Seq=5365 Ack=22181 Win=3666 Len=0 TSval=3770479 TSecr=4366805 SLE=23629 SRE=25077
   81 7.078023857  10.6.15.144 → 192.168.1.16 SSH 1514 Server: Encrypted packet (len=1448)
   82 7.078046851 192.168.1.16 → 10.6.15.144  TCP 78 [TCP Dup ACK 80#1] 59298 → 22 [ACK] Seq=5365 Ack=22181 Win=3666 Len=0 TSval=3770482 TSecr=4366805 SLE=23629 SRE=26525
   83 7.078063516  10.6.15.144 → 192.168.1.16 SSH 390 Server: Encrypted packet (len=324)
   84 7.078067405 192.168.1.16 → 10.6.15.144  TCP 78 [TCP Dup ACK 80#2] 59298 → 22 [ACK] Seq=5365 Ack=22181 Win=3666 Len=0 TSval=3770482 TSecr=4366805 SLE=23629 SRE=26849
   85 7.089000019  10.6.15.144 → 192.168.1.16 SSH 1514 Server: [TCP Fast Retransmission] , Encrypted packet (len=1448)
   86 7.089026995 192.168.1.16 → 10.6.15.144  TCP 66 59298 → 22 [ACK] Seq=5365 Ack=26849 Win=3666 Len=0 TSval=3770484 TSecr=4366815
   87 7.228550863 192.168.1.16 → 10.6.15.144  SSH 126 Client: Encrypted packet (len=60)
   88 7.278438964  10.6.15.144 → 192.168.1.16 TCP 66 22 → 59298 [ACK] Seq=26849 Ack=5425 Win=1452 Len=0 TSval=4366863 TSecr=3770519
   89 7.302169412  10.6.15.144 → 192.168.1.16 SSH 102 Server: Encrypted packet (len=36)
   90 7.302184670 192.168.1.16 → 10.6.15.144  TCP 66 59298 → 22 [ACK] Seq=5425 Ack=26885 Win=3666 Len=0 TSval=3770538 TSecr=4366869
   91 7.302478545 192.168.1.16 → 10.6.15.144  SSH 174 Client: Encrypted packet (len=108)
   92 7.313990504  10.6.15.144 → 192.168.1.16 TCP 66 22 → 59298 [ACK] Seq=26885 Ack=5533 Win=1452 Len=0 TSval=4366871 TSecr=3770538
   93 7.341378527  10.6.15.144 → 192.168.1.16 SSH 1514 Server: Encrypted packet (len=1448)
   94 7.341403790  10.6.15.144 → 192.168.1.16 SSH 94 Server: Encrypted packet (len=28)
   95 7.341414732 192.168.1.16 → 10.6.15.144  TCP 66 59298 → 22 [ACK] Seq=5533 Ack=28361 Win=3666 Len=0 TSval=3770547 TSecr=4366878
   96 7.342452566 192.168.1.16 → 10.6.15.144  SSH 206 Client: Encrypted packet (len=140)
   97 7.345748599 192.168.1.16 → 10.6.15.144  SSH 590 Client: Encrypted packet (len=524)
   98 7.356595557  10.6.15.144 → 192.168.1.16 TCP 66 22 → 59298 [ACK] Seq=28361 Ack=6197 Win=1452 Len=0 TSval=4366882 TSecr=3770548
   99 7.378551089  10.6.15.144 → 192.168.1.16 SSH 350 Server: Encrypted packet (len=284)
  100 7.383623644  10.6.15.144 → 192.168.1.16 SSH 1514 Server: Encrypted packet (len=1448)
  101 7.383639335 192.168.1.16 → 10.6.15.144  TCP 66 59298 → 22 [ACK] Seq=6197 Ack=30093 Win=3666 Len=0 TSval=3770558 TSecr=4366888
  102 7.383656588  10.6.15.144 → 192.168.1.16 SSH 110 Server: Encrypted packet (len=44)
  103 7.394628678  10.6.15.144 → 192.168.1.16 SSH 1514 Server: Encrypted packet (len=1448)
  104 7.394645909 192.168.1.16 → 10.6.15.144  TCP 66 59298 → 22 [ACK] Seq=6197 Ack=31585 Win=3666 Len=0 TSval=3770561 TSecr=4366889
  105 7.394774558  10.6.15.144 → 192.168.1.16 SSH 1514 Server: Encrypted packet (len=1448)
  106 7.406341028  10.6.15.144 → 192.168.1.16 SSH 1514 Server: Encrypted packet (len=1448)
  107 7.406358350 192.168.1.16 → 10.6.15.144  TCP 66 59298 → 22 [ACK] Seq=6197 Ack=34481 Win=3666 Len=0 TSval=3770564 TSecr=4366891
  108 7.406488898  10.6.15.144 → 192.168.1.16 SSH 1514 Server: Encrypted packet (len=1448)
  109 7.417673763  10.6.15.144 → 192.168.1.16 SSH 1514 Server: Encrypted packet (len=1448)
  110 7.417690028 192.168.1.16 → 10.6.15.144  TCP 66 59298 → 22 [ACK] Seq=6197 Ack=37377 Win=3666 Len=0 TSval=3770566 TSecr=4366894
  111 7.421320595  10.6.15.144 → 192.168.1.16 SSH 1514 Server: Encrypted packet (len=1448)
  112 7.431231413  10.6.15.144 → 192.168.1.16 SSH 1514 Server: [TCP Previous segment not captured] , Encrypted packet (len=1448)
  113 7.431249463 192.168.1.16 → 10.6.15.144  TCP 78 59298 → 22 [ACK] Seq=6197 Ack=38825 Win=3666 Len=0 TSval=3770570 TSecr=4366897 SLE=40273 SRE=41721
  114 7.442123352  10.6.15.144 → 192.168.1.16 SSH 1514 Server: Encrypted packet (len=1448)
  115 7.442147727 192.168.1.16 → 10.6.15.144  TCP 78 [TCP Dup ACK 113#1] 59298 → 22 [ACK] Seq=6197 Ack=38825 Win=3666 Len=0 TSval=3770573 TSecr=4366897 SLE=40273 SRE=43169
  116 7.442288869  10.6.15.144 → 192.168.1.16 SSH 1514 Server: Encrypted packet (len=1448)
  117 7.442299033 192.168.1.16 → 10.6.15.144  TCP 78 [TCP Dup ACK 113#2] 59298 → 22 [ACK] Seq=6197 Ack=38825 Win=3666 Len=0 TSval=3770573 TSecr=4366897 SLE=40273 SRE=44617
  118 7.453394437  10.6.15.144 → 192.168.1.16 SSH 1514 Server: Encrypted packet (len=1448)
  119 7.453415723 192.168.1.16 → 10.6.15.144  TCP 78 [TCP Dup ACK 113#3] 59298 → 22 [ACK] Seq=6197 Ack=38825 Win=3666 Len=0 TSval=3770575 TSecr=4366897 SLE=40273 SRE=46065
  120 7.453428088  10.6.15.144 → 192.168.1.16 SSH 1514 Server: [TCP Fast Retransmission] , Encrypted packet (len=1448)
  121 7.453439776 192.168.1.16 → 10.6.15.144  TCP 66 59298 → 22 [ACK] Seq=6197 Ack=46065 Win=3666 Len=0 TSval=3770575 TSecr=4366906
  122 7.464256821  10.6.15.144 → 192.168.1.16 SSH 1514 Server: Encrypted packet (len=1448)
  123 7.464282455 192.168.1.16 → 10.6.15.144  TCP 66 59298 → 22 [ACK] Seq=6197 Ack=47513 Win=3666 Len=0 TSval=3770578 TSecr=4366909
  124 7.464298161  10.6.15.144 → 192.168.1.16 SSH 706 Server: Encrypted packet (len=640)
  125 7.464303513 192.168.1.16 → 10.6.15.144  TCP 66 59298 → 22 [ACK] Seq=6197 Ack=48153 Win=3666 Len=0 TSval=3770578 TSecr=4366909
  126 7.473190374 192.168.1.16 → 10.6.15.144  SSH 102 Client: Encrypted packet (len=36)
  127 7.476390937 192.168.1.16 → 10.6.15.144  SSH 1514 Client: Encrypted packet (len=1448)
  128 7.477500075 192.168.1.16 → 10.6.15.144  SSH 746 Client: Encrypted packet (len=680)
  129 7.477632365 192.168.1.16 → 10.6.15.144  SSH 1514 Client: Encrypted packet (len=1448)
  130 7.478140776 192.168.1.16 → 10.6.15.144  SSH 238 Client: Encrypted packet (len=172)
  131 7.486554614 192.168.1.16 → 10.6.15.144  SSH 102 Client: Encrypted packet (len=36)
  132 7.486982089 192.168.1.16 → 10.6.15.144  SSH 110 Client: Encrypted packet (len=44)
  133 7.488518823 192.168.1.16 → 10.6.15.144  SSH 210 Client: Encrypted packet (len=144)
  134 7.489767945  10.6.15.144 → 192.168.1.16 TCP 66 22 → 59298 [ACK] Seq=48153 Ack=7681 Win=1452 Len=0 TSval=4366915 TSecr=3770580
  135 7.493353111  10.6.15.144 → 192.168.1.16 TCP 66 22 → 59298 [ACK] Seq=48153 Ack=9809 Win=1452 Len=0 TSval=4366916 TSecr=3770581
  136 7.496442952  10.6.15.144 → 192.168.1.16 TCP 66 22 → 59298 [ACK] Seq=48153 Ack=10017 Win=1452 Len=0 TSval=4366917 TSecr=3770582
  137 7.509797486  10.6.15.144 → 192.168.1.16 SSH 110 Server: Encrypted packet (len=44)
  138 7.510160950 192.168.1.16 → 10.6.15.144  SSH 382 Client: Encrypted packet (len=316)
  139 7.515109003  10.6.15.144 → 192.168.1.16 SSH 1514 Server: Encrypted packet (len=1448)
  140 7.515291712  10.6.15.144 → 192.168.1.16 SSH 1514 Server: Encrypted packet (len=1448)
  141 7.515300294 192.168.1.16 → 10.6.15.144  TCP 66 59298 → 22 [ACK] Seq=10521 Ack=51093 Win=3666 Len=0 TSval=3770591 TSecr=4366921
  142 7.524063306  10.6.15.144 → 192.168.1.16 TCP 78 [TCP Dup ACK 136#1] 22 → 59298 [ACK] Seq=51093 Ack=10017 Win=1452 Len=0 TSval=4366924 TSecr=3770582 SLE=10061 SRE=10205
  143 7.524684149  10.6.15.144 → 192.168.1.16 SSH 1514 Server: Encrypted packet (len=1436)
  144 7.525840286  10.6.15.144 → 192.168.1.16 SSH 1126 Server: Encrypted packet (len=1048)
  145 7.525851142 192.168.1.16 → 10.6.15.144  TCP 66 59298 → 22 [ACK] Seq=10521 Ack=53577 Win=3666 Len=0 TSval=3770594 TSecr=4366924
  146 7.526450494 192.168.1.16 → 10.6.15.144  SSH 158 Client: Encrypted packet (len=92)
  147 7.528445948 192.168.1.16 → 10.6.15.144  SSH 606 Client: Encrypted packet (len=540)
  148 7.536464733  10.6.15.144 → 192.168.1.16 TCP 78 [TCP Dup ACK 136#2] 22 → 59298 [ACK] Seq=53577 Ack=10017 Win=1452 Len=0 TSval=4366927 TSecr=3770582 SLE=10061 SRE=10613
  149 7.536487514 192.168.1.16 → 10.6.15.144  SSH 110 Client: [TCP Fast Retransmission] , Encrypted packet (len=44)
  150 7.539503022  10.6.15.144 → 192.168.1.16 TCP 78 [TCP Dup ACK 136#3] 22 → 59298 [ACK] Seq=53577 Ack=10017 Win=1452 Len=0 TSval=4366928 TSecr=3770582 SLE=10061 SRE=11153
  151 7.546866310  10.6.15.144 → 192.168.1.16 TCP 66 22 → 59298 [ACK] Seq=53577 Ack=11153 Win=1444 Len=0 TSval=4366930 TSecr=3770596
  152 7.607031144  10.6.15.144 → 192.168.1.16 SSH 174 Server: Encrypted packet (len=108)
  153 7.607050602  10.6.15.144 → 192.168.1.16 SSH 102 Server: Encrypted packet (len=36)
  154 7.607055069  10.6.15.144 → 192.168.1.16 SSH 102 Server: Encrypted packet (len=36)
  155 7.607099294 192.168.1.16 → 10.6.15.144  TCP 66 59298 → 22 [ACK] Seq=11153 Ack=53757 Win=3666 Len=0 TSval=3770614 TSecr=4366945
  156 7.607366863 192.168.1.16 → 10.6.15.144  SSH 166 Client: Encrypted packet (len=100)
  157 7.607699524 192.168.1.16 → 10.6.15.144  SSH 410 Client: Encrypted packet (len=344)
  158 7.617826930  10.6.15.144 → 192.168.1.16 SSH 1514 Server: Encrypted packet (len=1448)
  159 7.617937038  10.6.15.144 → 192.168.1.16 SSH 1514 Server: Encrypted packet (len=1448)
  160 7.617945992 192.168.1.16 → 10.6.15.144  TCP 66 59298 → 22 [ACK] Seq=11597 Ack=56653 Win=3666 Len=0 TSval=3770617 TSecr=4366947
  161 7.618207148  10.6.15.144 → 192.168.1.16 SSH 1514 Server: Encrypted packet (len=1448)
  162 7.618228346  10.6.15.144 → 192.168.1.16 TCP 66 22 → 59298 [ACK] Seq=58101 Ack=11253 Win=1452 Len=0 TSval=4366947 TSecr=3770614
  163 7.618236553  10.6.15.144 → 192.168.1.16 TCP 66 22 → 59298 [ACK] Seq=58101 Ack=11597 Win=1452 Len=0 TSval=4366947 TSecr=3770614
  164 7.628738810  10.6.15.144 → 192.168.1.16 SSH 1514 Server: Encrypted packet (len=1448)
  165 7.628756697 192.168.1.16 → 10.6.15.144  TCP 66 59298 → 22 [ACK] Seq=11597 Ack=59549 Win=3666 Len=0 TSval=3770619 TSecr=4366947
  166 7.628860108  10.6.15.144 → 192.168.1.16 SSH 1514 Server: Encrypted packet (len=1448)
  167 7.639491671  10.6.15.144 → 192.168.1.16 SSH 1514 Server: Encrypted packet (len=1448)
  168 7.639509141 192.168.1.16 → 10.6.15.144  TCP 66 59298 → 22 [ACK] Seq=11597 Ack=62445 Win=3666 Len=0 TSval=3770622 TSecr=4366950
  169 7.639638089  10.6.15.144 → 192.168.1.16 SSH 1514 Server: Encrypted packet (len=1448)
  170 7.650500597  10.6.15.144 → 192.168.1.16 SSH 1514 Server: Encrypted packet (len=1448)
  171 7.650517776 192.168.1.16 → 10.6.15.144  TCP 66 59298 → 22 [ACK] Seq=11597 Ack=65341 Win=3666 Len=0 TSval=3770625 TSecr=4366953
  172 7.650651160  10.6.15.144 → 192.168.1.16 SSH 1514 Server: Encrypted packet (len=1448)
  173 7.659843042 192.168.1.16 → 13.126.27.131 NTP 90 NTP Version 4, client
  174 7.661470689  10.6.15.144 → 192.168.1.16 SSH 1514 Server: Encrypted packet (len=1448)
  175 7.661485039 192.168.1.16 → 10.6.15.144  TCP 66 59298 → 22 [ACK] Seq=11597 Ack=68237 Win=3666 Len=0 TSval=3770627 TSecr=4366955
  176 7.661633580  10.6.15.144 → 192.168.1.16 SSH 1514 Server: Encrypted packet (len=1448)
  177 7.661831345 192.168.1.16 → 10.6.15.144  SSH 134 Client: Encrypted packet (len=68)
  178 7.672261411  10.6.15.144 → 192.168.1.16 SSH 1514 Server: Encrypted packet (len=1448)
  179 7.672380819  10.6.15.144 → 192.168.1.16 SSH 1514 Server: Encrypted packet (len=1448)
  180 7.672389731 192.168.1.16 → 10.6.15.144  TCP 66 59298 → 22 [ACK] Seq=11665 Ack=72581 Win=3666 Len=0 TSval=3770630 TSecr=4366961
  181 7.672727400  10.6.15.144 → 192.168.1.16 SSH 1514 Server: Encrypted packet (len=1448)
  182 7.673039001 192.168.1.16 → 10.6.15.144  SSH 134 Client: Encrypted packet (len=68)
  183 7.676229394 192.168.1.16 → 10.6.15.144  SSH 346 Client: Encrypted packet (len=280)
  184 7.678619889 192.168.1.16 → 10.6.15.144  SSH 102 Client: Encrypted packet (len=36)
  185 7.678868916 192.168.1.16 → 10.6.15.144  SSH 230 Client: Encrypted packet (len=164)
  186 7.679187754 192.168.1.16 → 10.6.15.144  SSH 566 Client: Encrypted packet (len=500)
  187 7.686324905  10.6.15.144 → 192.168.1.16 SSH 1514 Server: Encrypted packet (len=1448)
  188 7.686493773  10.6.15.144 → 192.168.1.16 SSH 1514 Server: Encrypted packet (len=1448)
  189 7.686499452 192.168.1.16 → 10.6.15.144  TCP 66 59298 → 22 [ACK] Seq=12713 Ack=76925 Win=3666 Len=0 TSval=3770634 TSecr=4366964
  190 7.686799463  10.6.15.144 → 192.168.1.16 SSH 1242 Server: Encrypted packet (len=1176)
  191 7.686807797 192.168.1.16 → 10.6.15.144  SSH 430 Client: Encrypted packet (len=364)
  192 7.688544386  10.6.15.144 → 192.168.1.16 TCP 66 22 → 59298 [ACK] Seq=78101 Ack=12049 Win=1452 Len=0 TSval=4366965 TSecr=3770631
  193 7.688554978 192.168.1.16 → 10.6.15.144  SSH 206 Client: Encrypted packet (len=140)
  194 7.689098383 192.168.1.16 → 10.6.15.144  SSH 206 Client: Encrypted packet (len=140)
  195 7.690703788  10.6.15.144 → 192.168.1.16 TCP 66 22 → 59298 [ACK] Seq=78101 Ack=12713 Win=1452 Len=0 TSval=4366965 TSecr=3770632
  196 7.690889312 192.168.1.16 → 10.6.15.144  SSH 206 Client: Encrypted packet (len=140)
  197 7.698799856  10.6.15.144 → 192.168.1.16 TCP 66 22 → 59298 [ACK] Seq=78101 Ack=13217 Win=1452 Len=0 TSval=4366968 TSecr=3770634
  198 7.701350670  10.6.15.144 → 192.168.1.16 TCP 66 22 → 59298 [ACK] Seq=78101 Ack=13497 Win=1452 Len=0 TSval=4366968 TSecr=3770634
  199 7.715183223  10.6.15.144 → 192.168.1.16 SSH 602 Server: Encrypted packet (len=536)
  200 7.715193514  10.6.15.144 → 192.168.1.16 SSH 166 Server: Encrypted packet (len=100)
  201 7.715238267 192.168.1.16 → 10.6.15.144  TCP 66 59298 → 22 [ACK] Seq=13497 Ack=78737 Win=3666 Len=0 TSval=3770641 TSecr=4366971
  202 7.715335159  10.6.15.144 → 192.168.1.16 SSH 138 Server: Encrypted packet (len=72)
  203 7.715442866 192.168.1.16 → 10.6.15.144  SSH 102 Client: Encrypted packet (len=36)
  204 7.727308976  10.6.15.144 → 192.168.1.16 SSH 426 Server: Encrypted packet (len=360)
  205 7.727325531  10.6.15.144 → 192.168.1.16 SSH 318 Server: Encrypted packet (len=252)
  206 7.727373503 192.168.1.16 → 10.6.15.144  TCP 66 59298 → 22 [ACK] Seq=13533 Ack=79421 Win=3666 Len=0 TSval=3770644 TSecr=4366974
  207 7.727609412 192.168.1.16 → 10.6.15.144  SSH 134 Client: Encrypted packet (len=68)
  208 7.755236207  10.6.15.144 → 192.168.1.16 SSH 1514 Server: [TCP Previous segment not captured] , Encrypted packet (len=1448)
  209 7.755261100 192.168.1.16 → 10.6.15.144  TCP 78 [TCP Dup ACK 206#1] 59298 → 22 [ACK] Seq=13601 Ack=79421 Win=3666 Len=0 TSval=3770651 TSecr=4366974 SLE=80869 SRE=82317
  210 7.755391957  10.6.15.144 → 192.168.1.16 SSH 1514 Server: Encrypted packet (len=1448)
  211 7.755402446 192.168.1.16 → 10.6.15.144  TCP 78 [TCP Dup ACK 206#2] 59298 → 22 [ACK] Seq=13601 Ack=79421 Win=3666 Len=0 TSval=3770651 TSecr=4366974 SLE=80869 SRE=83765
  212 7.766083574  10.6.15.144 → 192.168.1.16 SSH 1514 Server: Encrypted packet (len=1448)
  213 7.766103006 192.168.1.16 → 10.6.15.144  TCP 78 [TCP Dup ACK 206#3] 59298 → 22 [ACK] Seq=13601 Ack=79421 Win=3666 Len=0 TSval=3770654 TSecr=4366974 SLE=80869 SRE=85213
  214 7.766273675  10.6.15.144 → 192.168.1.16 SSH 1514 Server: Encrypted packet (len=1448)
  215 7.766292642 192.168.1.16 → 10.6.15.144  TCP 78 [TCP Dup ACK 206#4] 59298 → 22 [ACK] Seq=13601 Ack=79421 Win=3666 Len=0 TSval=3770654 TSecr=4366974 SLE=80869 SRE=86661
  216 7.778407299  10.6.15.144 → 192.168.1.16 SSH 1514 Server: [TCP Fast Retransmission] , Encrypted packet (len=1448)
  217 7.778428747 192.168.1.16 → 10.6.15.144  TCP 66 59298 → 22 [ACK] Seq=13601 Ack=86661 Win=3666 Len=0 TSval=3770657 TSecr=4366987
  218 7.778592279  10.6.15.144 → 192.168.1.16 SSH 1514 Server: Encrypted packet (len=1448)
  219 7.778599766 192.168.1.16 → 10.6.15.144  TCP 66 59298 → 22 [ACK] Seq=13601 Ack=88109 Win=3666 Len=0 TSval=3770657 TSecr=4366987
  220 7.789206765  10.6.15.144 → 192.168.1.16 SSH 1514 Server: [TCP Previous segment not captured] , Encrypted packet (len=1448)
  221 7.789228818 192.168.1.16 → 10.6.15.144  TCP 78 [TCP Dup ACK 219#1] 59298 → 22 [ACK] Seq=13601 Ack=88109 Win=3666 Len=0 TSval=3770659 TSecr=4366987 SLE=89557 SRE=91005
  222 7.789373051  10.6.15.144 → 192.168.1.16 SSH 1514 Server: Encrypted packet (len=1448)
  223 7.789378125 192.168.1.16 → 10.6.15.144  TCP 78 [TCP Dup ACK 219#2] 59298 → 22 [ACK] Seq=13601 Ack=88109 Win=3666 Len=0 TSval=3770659 TSecr=4366987 SLE=89557 SRE=92453
  224 7.799693662  10.6.15.144 → 192.168.1.16 SSH 1514 Server: Encrypted packet (len=1448)
  225 7.799717013 192.168.1.16 → 10.6.15.144  TCP 78 [TCP Dup ACK 219#3] 59298 → 22 [ACK] Seq=13601 Ack=88109 Win=3666 Len=0 TSval=3770662 TSecr=4366987 SLE=89557 SRE=93901
  226 7.799897749  10.6.15.144 → 192.168.1.16 SSH 1514 Server: Encrypted packet (len=1448)
  227 7.799905661 192.168.1.16 → 10.6.15.144  TCP 78 [TCP Dup ACK 219#4] 59298 → 22 [ACK] Seq=13601 Ack=88109 Win=3666 Len=0 TSval=3770662 TSecr=4366987 SLE=89557 SRE=95349
  228 7.812954298  10.6.15.144 → 192.168.1.16 SSH 1514 Server: [TCP Fast Retransmission] , Encrypted packet (len=1448)
  229 7.812987999 192.168.1.16 → 10.6.15.144  TCP 66 59298 → 22 [ACK] Seq=13601 Ack=95349 Win=3666 Len=0 TSval=3770665 TSecr=4366996
  230 7.813119604  10.6.15.144 → 192.168.1.16 SSH 1514 Server: Encrypted packet (len=1448)
  231 7.813125678 192.168.1.16 → 10.6.15.144  TCP 66 59298 → 22 [ACK] Seq=13601 Ack=96797 Win=3666 Len=0 TSval=3770665 TSecr=4366996
  232 7.826424150  10.6.15.144 → 192.168.1.16 SSH 1514 Server: Encrypted packet (len=1448)
  233 7.826443117 192.168.1.16 → 10.6.15.144  TCP 66 59298 → 22 [ACK] Seq=13601 Ack=98245 Win=3666 Len=0 TSval=3770669 TSecr=4366999
  234 7.826546015  10.6.15.144 → 192.168.1.16 SSH 1514 Server: Encrypted packet (len=1448)
  235 7.826550337 192.168.1.16 → 10.6.15.144  TCP 66 59298 → 22 [ACK] Seq=13601 Ack=99693 Win=3666 Len=0 TSval=3770669 TSecr=4366999
  236 7.826767677  10.6.15.144 → 192.168.1.16 SSH 1514 Server: Encrypted packet (len=1448)
  237 7.826774954 192.168.1.16 → 10.6.15.144  TCP 66 59298 → 22 [ACK] Seq=13601 Ack=101141 Win=3666 Len=0 TSval=3770669 TSecr=4366999
  238 7.840421008  10.6.15.144 → 192.168.1.16 SSH 1514 Server: Encrypted packet (len=1448)
  239 7.840442388 192.168.1.16 → 10.6.15.144  TCP 66 59298 → 22 [ACK] Seq=13601 Ack=102589 Win=3666 Len=0 TSval=3770672 TSecr=4367003
  240 7.840540482  10.6.15.144 → 192.168.1.16 SSH 1514 Server: Encrypted packet (len=1448)
  241 7.840545263 192.168.1.16 → 10.6.15.144  TCP 66 59298 → 22 [ACK] Seq=13601 Ack=104037 Win=3666 Len=0 TSval=3770672 TSecr=4367003
  242 7.840746367  10.6.15.144 → 192.168.1.16 SSH 1514 Server: Encrypted packet (len=1448)
  243 7.840751697 192.168.1.16 → 10.6.15.144  TCP 66 59298 → 22 [ACK] Seq=13601 Ack=105485 Win=3666 Len=0 TSval=3770672 TSecr=4367003
  244 7.851237760  10.6.15.144 → 192.168.1.16 SSH 1514 Server: Encrypted packet (len=1448)
  245 7.851255539 192.168.1.16 → 10.6.15.144  TCP 66 59298 → 22 [ACK] Seq=13601 Ack=106933 Win=3666 Len=0 TSval=3770675 TSecr=4367006
  246 7.851545069  10.6.15.144 → 192.168.1.16 SSH 1514 Server: Encrypted packet (len=1448)
  247 7.851550424 192.168.1.16 → 10.6.15.144  TCP 66 59298 → 22 [ACK] Seq=13601 Ack=108381 Win=3666 Len=0 TSval=3770675 TSecr=4367006
  248 7.851740941  10.6.15.144 → 192.168.1.16 SSH 1514 Server: Encrypted packet (len=1448)
  249 7.851744585 192.168.1.16 → 10.6.15.144  TCP 66 59298 → 22 [ACK] Seq=13601 Ack=109829 Win=3666 Len=0 TSval=3770675 TSecr=4367006
  250 7.866935553  10.6.15.144 → 192.168.1.16 SSH 1514 Server: Encrypted packet (len=1448)
  251 7.866953552 192.168.1.16 → 10.6.15.144  TCP 66 59298 → 22 [ACK] Seq=13601 Ack=111277 Win=3666 Len=0 TSval=3770679 TSecr=4367009
  252 7.867086691  10.6.15.144 → 192.168.1.16 SSH 1514 Server: Encrypted packet (len=1448)
  253 7.867091879 192.168.1.16 → 10.6.15.144  TCP 66 59298 → 22 [ACK] Seq=13601 Ack=112725 Win=3666 Len=0 TSval=3770679 TSecr=4367009
  254 7.867291558  10.6.15.144 → 192.168.1.16 SSH 1514 Server: Encrypted packet (len=1448)
  255 7.867309716 192.168.1.16 → 10.6.15.144  TCP 66 59298 → 22 [ACK] Seq=13601 Ack=114173 Win=3666 Len=0 TSval=3770679 TSecr=4367009
  256 7.886305632  10.6.15.144 → 192.168.1.16 SSH 1514 Server: Encrypted packet (len=1448)
  257 7.886323794 192.168.1.16 → 10.6.15.144  TCP 66 59298 → 22 [ACK] Seq=13601 Ack=115621 Win=3666 Len=0 TSval=3770684 TSecr=4367014
  258 7.886455647  10.6.15.144 → 192.168.1.16 SSH 1514 Server: Encrypted packet (len=1448)
  259 7.886708448  10.6.15.144 → 192.168.1.16 SSH 1514 Server: Encrypted packet (len=1448)
  260 7.886727549 192.168.1.16 → 10.6.15.144  TCP 66 59298 → 22 [ACK] Seq=13601 Ack=118517 Win=3666 Len=0 TSval=3770684 TSecr=4367014
  261 7.897316841  10.6.15.144 → 192.168.1.16 SSH 1514 Server: Encrypted packet (len=1448)
  262 7.897465968  10.6.15.144 → 192.168.1.16 SSH 1514 Server: Encrypted packet (len=1448)
  263 7.897475313 192.168.1.16 → 10.6.15.144  TCP 66 59298 → 22 [ACK] Seq=13601 Ack=121413 Win=3666 Len=0 TSval=3770686 TSecr=4367017
  264 7.897819506  10.6.15.144 → 192.168.1.16 SSH 1514 Server: Encrypted packet (len=1448)
  265 7.898010030  10.6.15.144 → 192.168.1.16 SSH 1514 Server: Encrypted packet (len=1448)
  266 7.898022598 192.168.1.16 → 10.6.15.144  TCP 66 59298 → 22 [ACK] Seq=13601 Ack=124309 Win=3666 Len=0 TSval=3770687 TSecr=4367017
  267 7.913282426  10.6.15.144 → 192.168.1.16 SSH 1514 Server: Encrypted packet (len=1448)
  268 7.913443309  10.6.15.144 → 192.168.1.16 SSH 1514 Server: Encrypted packet (len=1448)
  269 7.913453385 192.168.1.16 → 10.6.15.144  TCP 66 59298 → 22 [ACK] Seq=13601 Ack=127205 Win=3666 Len=0 TSval=3770690 TSecr=4367020
  270 7.913630138  10.6.15.144 → 192.168.1.16 SSH 1514 Server: Encrypted packet (len=1448)
  271 7.913867461  10.6.15.144 → 192.168.1.16 SSH 1514 Server: Encrypted packet (len=1448)
  272 7.913885466 192.168.1.16 → 10.6.15.144  TCP 66 59298 → 22 [ACK] Seq=13601 Ack=130101 Win=3666 Len=0 TSval=3770691 TSecr=4367020
  273 7.926306380  10.6.15.144 → 192.168.1.16 SSH 1514 Server: Encrypted packet (len=1448)
  274 7.926493426  10.6.15.144 → 192.168.1.16 SSH 1514 Server: Encrypted packet (len=1448)
  275 7.926506275 192.168.1.16 → 10.6.15.144  TCP 66 59298 → 22 [ACK] Seq=13601 Ack=132997 Win=3666 Len=0 TSval=3770694 TSecr=4367024
  276 7.927840924  10.6.15.144 → 192.168.1.16 SSH 1514 Server: Encrypted packet (len=1448)
  277 7.940590221  10.6.15.144 → 192.168.1.16 SSH 1514 Server: [TCP Previous segment not captured] , Encrypted packet (len=1448)
  278 7.940608976 192.168.1.16 → 10.6.15.144  TCP 78 59298 → 22 [ACK] Seq=13601 Ack=134445 Win=3666 Len=0 TSval=3770697 TSecr=4367024 SLE=135893 SRE=137341
  279 7.940801233  10.6.15.144 → 192.168.1.16 SSH 1514 Server: Encrypted packet (len=1448)
  280 7.940809829 192.168.1.16 → 10.6.15.144  TCP 78 [TCP Dup ACK 278#1] 59298 → 22 [ACK] Seq=13601 Ack=134445 Win=3666 Len=0 TSval=3770697 TSecr=4367024 SLE=135893 SRE=138789
  281 7.951977837  10.6.15.144 → 192.168.1.16 SSH 1514 Server: Encrypted packet (len=1448)
  282 7.951996984 192.168.1.16 → 10.6.15.144  TCP 78 [TCP Dup ACK 278#2] 59298 → 22 [ACK] Seq=13601 Ack=134445 Win=3666 Len=0 TSval=3770700 TSecr=4367024 SLE=135893 SRE=140237
  283 7.952164992  10.6.15.144 → 192.168.1.16 SSH 1514 Server: Encrypted packet (len=1448)
  284 7.952184925 192.168.1.16 → 10.6.15.144  TCP 78 [TCP Dup ACK 278#3] 59298 → 22 [ACK] Seq=13601 Ack=134445 Win=3666 Len=0 TSval=3770700 TSecr=4367024 SLE=135893 SRE=141685
  285 7.952352214  10.6.15.144 → 192.168.1.16 SSH 1514 Server: Encrypted packet (len=1448)
  286 7.952364102 192.168.1.16 → 10.6.15.144  TCP 78 [TCP Dup ACK 278#4] 59298 → 22 [ACK] Seq=13601 Ack=134445 Win=3666 Len=0 TSval=3770700 TSecr=4367024 SLE=135893 SRE=143133
  287 7.952536603  10.6.15.144 → 192.168.1.16 SSH 1514 Server: Encrypted packet (len=1448)
  288 7.952541774 192.168.1.16 → 10.6.15.144  TCP 78 [TCP Dup ACK 278#5] 59298 → 22 [ACK] Seq=13601 Ack=134445 Win=3666 Len=0 TSval=3770700 TSecr=4367024 SLE=135893 SRE=144581
  289 7.964831133  10.6.15.144 → 192.168.1.16 SSH 1514 Server: [TCP Fast Retransmission] , Encrypted packet (len=1448)
  290 7.964853106 192.168.1.16 → 10.6.15.144  TCP 66 59298 → 22 [ACK] Seq=13601 Ack=144581 Win=3658 Len=0 TSval=3770703 TSecr=4367034
  291 7.975309068  10.6.15.144 → 192.168.1.16 SSH 1514 Server: [TCP Previous segment not captured] , Encrypted packet (len=1448)
  292 7.975330707 192.168.1.16 → 10.6.15.144  TCP 78 [TCP Window Update] 59298 → 22 [ACK] Seq=13601 Ack=144581 Win=3666 Len=0 TSval=3770706 TSecr=4367034 SLE=147477 SRE=148925
  293 7.985989817  10.6.15.144 → 192.168.1.16 SSH 1514 Server: Encrypted packet (len=1448)
  294 7.986008331 192.168.1.16 → 10.6.15.144  TCP 78 [TCP Dup ACK 290#1] 59298 → 22 [ACK] Seq=13601 Ack=144581 Win=3666 Len=0 TSval=3770709 TSecr=4367034 SLE=147477 SRE=150373
  295 7.996548480  10.6.15.144 → 192.168.1.16 TCP 1514 [TCP Retransmission] 22 → 59298 [ACK] Seq=144581 Ack=13601 Win=1452 Len=1448 TSval=4367042 TSecr=3770709
  296 7.996568063 192.168.1.16 → 10.6.15.144  TCP 78 59298 → 22 [ACK] Seq=13601 Ack=146029 Win=3666 Len=0 TSval=3770711 TSecr=4367042 SLE=147477 SRE=150373
  297 8.007040190  10.6.15.144 → 192.168.1.16 SSH 1514 Server: Encrypted packet (len=1448)
  298 8.007049845 192.168.1.16 → 10.6.15.144  TCP 78 [TCP Dup ACK 296#1] 59298 → 22 [ACK] Seq=13601 Ack=146029 Win=3666 Len=0 TSval=3770714 TSecr=4367042 SLE=147477 SRE=151821
  299 8.016256561  10.6.15.144 → 192.168.1.16 TCP 1514 [TCP Retransmission] 22 → 59298 [ACK] Seq=146029 Ack=13601 Win=1452 Len=1448 TSval=4367047 TSecr=3770714
  300 8.016267593 192.168.1.16 → 10.6.15.144  TCP 66 59298 → 22 [ACK] Seq=13601 Ack=151821 Win=3666 Len=0 TSval=3770716 TSecr=4367047
  301 8.016416229  10.6.15.144 → 192.168.1.16 SSH 1514 Server: Encrypted packet (len=1448)
  302 8.016419135 192.168.1.16 → 10.6.15.144  TCP 66 59298 → 22 [ACK] Seq=13601 Ack=153269 Win=3666 Len=0 TSval=3770716 TSecr=4367047
  303 8.028201482  10.6.15.144 → 192.168.1.16 SSH 1514 Server: Encrypted packet (len=1448)
  304 8.028217682 192.168.1.16 → 10.6.15.144  TCP 66 59298 → 22 [ACK] Seq=13601 Ack=154717 Win=3666 Len=0 TSval=3770719 TSecr=4367050
  305 8.028383091  10.6.15.144 → 192.168.1.16 SSH 1514 Server: Encrypted packet (len=1448)
  306 8.028387514 192.168.1.16 → 10.6.15.144  TCP 66 59298 → 22 [ACK] Seq=13601 Ack=156165 Win=3666 Len=0 TSval=3770719 TSecr=4367050
  307 8.028574528  10.6.15.144 → 192.168.1.16 SSH 1514 Server: Encrypted packet (len=1448)
  308 8.028578382 192.168.1.16 → 10.6.15.144  TCP 66 59298 → 22 [ACK] Seq=13601 Ack=157613 Win=3666 Len=0 TSval=3770719 TSecr=4367050
  309 8.038518850  10.6.15.144 → 192.168.1.16 SSH 1514 Server: Encrypted packet (len=1448)
  310 8.038537522 192.168.1.16 → 10.6.15.144  TCP 66 59298 → 22 [ACK] Seq=13601 Ack=159061 Win=3666 Len=0 TSval=3770722 TSecr=4367053
  311 8.039197572  10.6.15.144 → 192.168.1.16 SSH 1514 Server: Encrypted packet (len=1448)
  312 8.039215179 192.168.1.16 → 10.6.15.144  TCP 66 59298 → 22 [ACK] Seq=13601 Ack=160509 Win=3666 Len=0 TSval=3770722 TSecr=4367053
  313 8.039319647  10.6.15.144 → 192.168.1.16 SSH 1514 Server: Encrypted packet (len=1448)
  314 8.039323942 192.168.1.16 → 10.6.15.144  TCP 66 59298 → 22 [ACK] Seq=13601 Ack=161957 Win=3666 Len=0 TSval=3770722 TSecr=4367053
  315 8.047623028  10.6.15.144 → 192.168.1.16 SSH 1514 Server: Encrypted packet (len=1448)
  316 8.047639283 192.168.1.16 → 10.6.15.144  TCP 66 59298 → 22 [ACK] Seq=13601 Ack=163405 Win=3666 Len=0 TSval=3770724 TSecr=4367055
  317 8.048847232  10.6.15.144 → 192.168.1.16 SSH 1514 Server: Encrypted packet (len=1448)
  318 8.048853859 192.168.1.16 → 10.6.15.144  TCP 66 59298 → 22 [ACK] Seq=13601 Ack=164853 Win=3666 Len=0 TSval=3770724 TSecr=4367055
  319 8.049046321  10.6.15.144 → 192.168.1.16 SSH 1514 Server: Encrypted packet (len=1448)
  320 8.049052882 192.168.1.16 → 10.6.15.144  TCP 66 59298 → 22 [ACK] Seq=13601 Ack=166301 Win=3666 Len=0 TSval=3770724 TSecr=4367055
  321 8.058004057  10.6.15.144 → 192.168.1.16 SSH 1514 Server: Encrypted packet (len=1448)
  322 8.058021796 192.168.1.16 → 10.6.15.144  TCP 66 59298 → 22 [ACK] Seq=13601 Ack=167749 Win=3666 Len=0 TSval=3770727 TSecr=4367057
  323 8.059489428  10.6.15.144 → 192.168.1.16 SSH 1514 Server: Encrypted packet (len=1448)
  324 8.059497149 192.168.1.16 → 10.6.15.144  TCP 66 59298 → 22 [ACK] Seq=13601 Ack=169197 Win=3666 Len=0 TSval=3770727 TSecr=4367058
  325 8.059680147  10.6.15.144 → 192.168.1.16 SSH 1514 Server: Encrypted packet (len=1448)
  326 8.059686736 192.168.1.16 → 10.6.15.144  TCP 66 59298 → 22 [ACK] Seq=13601 Ack=170645 Win=3666 Len=0 TSval=3770727 TSecr=4367058
  327 8.069193130  10.6.15.144 → 192.168.1.16 SSH 1514 Server: Encrypted packet (len=1448)
  328 8.069209132 192.168.1.16 → 10.6.15.144  TCP 66 59298 → 22 [ACK] Seq=13601 Ack=172093 Win=3666 Len=0 TSval=3770729 TSecr=4367060
  329 8.070364126  10.6.15.144 → 192.168.1.16 SSH 1514 Server: Encrypted packet (len=1448)
  330 8.070555531  10.6.15.144 → 192.168.1.16 SSH 1514 Server: Encrypted packet (len=1448)
  331 8.070562015 192.168.1.16 → 10.6.15.144  TCP 66 59298 → 22 [ACK] Seq=13601 Ack=174989 Win=3666 Len=0 TSval=3770730 TSecr=4367060
  332 8.080298873  10.6.15.144 → 192.168.1.16 SSH 1514 Server: Encrypted packet (len=1448)
  333 8.081844420  10.6.15.144 → 192.168.1.16 SSH 1514 Server: Encrypted packet (len=1448)
  334 8.081858044 192.168.1.16 → 10.6.15.144  TCP 66 59298 → 22 [ACK] Seq=13601 Ack=177885 Win=3666 Len=0 TSval=3770733 TSecr=4367063
  335 8.082013655  10.6.15.144 → 192.168.1.16 SSH 1514 Server: Encrypted packet (len=1448)
  336 8.082114646 192.168.1.16 → 10.6.15.144  SSH 102 Client: Encrypted packet (len=36)
  337 8.092682457  10.6.15.144 → 192.168.1.16 SSH 1514 Server: Encrypted packet (len=1448)
  338 8.092994027  10.6.15.144 → 192.168.1.16 SSH 1514 Server: Encrypted packet (len=1448)
  339 8.093005215 192.168.1.16 → 10.6.15.144  TCP 66 59298 → 22 [ACK] Seq=13637 Ack=182229 Win=3666 Len=0 TSval=3770735 TSecr=4367066
  340 8.093184772  10.6.15.144 → 192.168.1.16 SSH 1514 Server: Encrypted packet (len=1448)
  341 8.093528808  10.6.15.144 → 192.168.1.16 SSH 1514 Server: Encrypted packet (len=1448)
  342 8.093535561 192.168.1.16 → 10.6.15.144  TCP 66 59298 → 22 [ACK] Seq=13637 Ack=185125 Win=3666 Len=0 TSval=3770735 TSecr=4367066
  343 8.105281537  10.6.15.144 → 192.168.1.16 SSH 1514 Server: Encrypted packet (len=1448)
  344 8.105433461  10.6.15.144 → 192.168.1.16 SSH 1514 Server: Encrypted packet (len=1448)
  345 8.105443747 192.168.1.16 → 10.6.15.144  TCP 66 59298 → 22 [ACK] Seq=13637 Ack=188021 Win=3666 Len=0 TSval=3770738 TSecr=4367069
  346 8.105631273  10.6.15.144 → 192.168.1.16 SSH 1514 Server: Encrypted packet (len=1448)
  347 8.105826834  10.6.15.144 → 192.168.1.16 SSH 1514 Server: Encrypted packet (len=1448)
  348 8.105840530 192.168.1.16 → 10.6.15.144  TCP 66 59298 → 22 [ACK] Seq=13637 Ack=190917 Win=3666 Len=0 TSval=3770739 TSecr=4367069
  349 8.117312579  10.6.15.144 → 192.168.1.16 SSH 1514 Server: Encrypted packet (len=1448)
  350 8.117458668  10.6.15.144 → 192.168.1.16 SSH 1514 Server: Encrypted packet (len=1448)
