    1 0.000000000  10.6.15.144 → 192.168.1.16 SSH 574 Server: Encrypted packet (len=508)
    2 0.000022337 192.168.1.16 → 10.6.15.144  TCP 66 59298 → 22 [ACK] Seq=1 Ack=509 Win=3666 Len=0 TSval=3776456 TSecr=4372376
    3 0.000036798  10.6.15.144 → 192.168.1.16 SSH 574 Server: [TCP Spurious Retransmission] , Encrypted packet (len=508)
    4 0.000041880 192.168.1.16 → 10.6.15.144  TCP 78 [TCP Dup ACK 2#1] 59298 → 22 [ACK] Seq=1 Ack=509 Win=3666 Len=0 TSval=3776456 TSecr=4372433 SLE=1 SRE=509
    5 0.000114730  10.6.15.144 → 192.168.1.16 SSH 574 Server: [TCP Spurious Retransmission] , Encrypted packet (len=508)
    6 0.000119339 192.168.1.16 → 10.6.15.144  TCP 78 [TCP Dup ACK 2#2] 59298 → 22 [ACK] Seq=1 Ack=509 Win=3666 Len=0 TSval=3776456 TSecr=4372490 SLE=1 SRE=509
    7 0.000193154  10.6.15.144 → 192.168.1.16 SSH 574 Server: [TCP Spurious Retransmission] , Encrypted packet (len=508)
    8 0.000197096 192.168.1.16 → 10.6.15.144  TCP 78 [TCP Dup ACK 2#3] 59298 → 22 [ACK] Seq=1 Ack=509 Win=3666 Len=0 TSval=3776456 TSecr=4372604 SLE=1 SRE=509
    9 0.002012476 192.168.1.16 → 10.6.15.144  SSH 102 Client: Encrypted packet (len=36)
   10 0.002222154 192.168.1.16 → 10.6.15.144  SSH 102 Client: Encrypted packet (len=36)
   11 0.002568407 192.168.1.16 → 10.6.15.144  SSH 154 Client: Encrypted packet (len=88)
   12 0.002782765 192.168.1.16 → 10.6.15.144  SSH 102 Client: Encrypted packet (len=36)
   13 0.004990751 192.168.1.16 → 10.6.15.144  SSH 1514 Client: Encrypted packet (len=1448)
   14 0.011898522  10.6.15.144 → 192.168.1.16 TCP 66 22 → 59298 [ACK] Seq=509 Ack=37 Win=1452 Len=0 TSval=4372790 TSecr=3776457
   15 0.011919732 192.168.1.16 → 10.6.15.144  SSH 198 Client: Encrypted packet (len=132)
   16 0.011936358  10.6.15.144 → 192.168.1.16 TCP 66 22 → 59298 [ACK] Seq=509 Ack=73 Win=1452 Len=0 TSval=4372790 TSecr=3776457
   17 0.012038839  10.6.15.144 → 192.168.1.16 TCP 66 22 → 59298 [ACK] Seq=509 Ack=161 Win=1452 Len=0 TSval=4372790 TSecr=3776457
   18 0.013288594  10.6.15.144 → 192.168.1.16 TCP 66 22 → 59298 [ACK] Seq=509 Ack=197 Win=1452 Len=0 TSval=4372791 TSecr=3776457
   19 0.015383452  10.6.15.144 → 192.168.1.16 TCP 66 22 → 59298 [ACK] Seq=509 Ack=1645 Win=1452 Len=0 TSval=4372791 TSecr=3776457
   20 0.021708044  10.6.15.144 → 192.168.1.16 TCP 66 22 → 59298 [ACK] Seq=509 Ack=1777 Win=1452 Len=0 TSval=4372793 TSecr=3776459
   21 0.036583491  10.6.15.144 → 192.168.1.16 SSH 126 Server: Encrypted packet (len=60)
   22 0.036602795  10.6.15.144 → 192.168.1.16 SSH 138 Server: Encrypted packet (len=72)
   23 0.036649320 192.168.1.16 → 10.6.15.144  TCP 66 59298 → 22 [ACK] Seq=1777 Ack=641 Win=3666 Len=0 TSval=3776465 TSecr=4372796
   24 0.036785620 192.168.1.16 → 10.6.15.144  SSH 102 Client: Encrypted packet (len=36)
   25 0.047060586  10.6.15.144 → 192.168.1.16 SSH 322 Server: Encrypted packet (len=256)
   26 0.047260661 192.168.1.16 → 10.6.15.144  SSH 102 Client: Encrypted packet (len=36)
   27 0.048213979 192.168.1.16 → 10.6.15.144  SSH 606 Client: Encrypted packet (len=540)
   28 0.057806667  10.6.15.144 → 192.168.1.16 TCP 66 22 → 59298 [ACK] Seq=897 Ack=1849 Win=1452 Len=0 TSval=4372802 TSecr=3776465
   29 0.085421202  10.6.15.144 → 192.168.1.16 SSH 230 Server: Encrypted packet (len=164)
   30 0.085715959 192.168.1.16 → 10.6.15.144  SSH 134 Client: Encrypted packet (len=68)
   31 0.086536507  10.6.15.144 → 192.168.1.16 SSH 182 Server: Encrypted packet (len=116)
   32 0.086803074 192.168.1.16 → 10.6.15.144  SSH 134 Client: Encrypted packet (len=68)
   33 0.129048689 192.168.1.16 → 10.6.15.144  TCP 134 [TCP Retransmission] 59298 → 22 [PSH, ACK] Seq=2457 Ack=1177 Win=3666 Len=68 TSval=3776489 TSecr=4372809
   34 0.149259714  10.6.15.144 → 192.168.1.16 TCP 66 22 → 59298 [ACK] Seq=1177 Ack=2457 Win=1452 Len=0 TSval=4372825 TSecr=3776478
   35 0.166816241  10.6.15.144 → 192.168.1.16 TCP 66 22 → 59298 [ACK] Seq=1177 Ack=2525 Win=1452 Len=0 TSval=4372829 TSecr=3776489
   36 0.991088096  10.22.18.17 → 224.0.0.252  LLMNR 64 Standard query 0x4341 A wpad
   37 0.991111637  10.22.18.17 → 224.0.0.252  LLMNR 64 Standard query 0xc3e3 AAAA wpad
   38 0.991117717  10.6.15.144 → 192.168.1.16 SSH 182 Server: Encrypted packet (len=116)
   39 0.991398406  10.6.15.144 → 192.168.1.16 SSH 1054 Server: Encrypted packet (len=988)
   40 0.991400459 192.168.1.16 → 10.6.15.144  SSH 134 Client: Encrypted packet (len=68)
   41 0.991525461  10.6.15.144 → 192.168.1.16 TCP 1054 [TCP Retransmission] 22 → 59298 [PSH, ACK] Seq=1293 Ack=2525 Win=1452 Len=988 TSval=4372947 TSecr=3776489
   42 0.991532668 192.168.1.16 → 10.6.15.144  TCP 78 59298 → 22 [ACK] Seq=2593 Ack=2281 Win=3666 Len=0 TSval=3776704 TSecr=4372947 SLE=1293 SRE=2281
   43 0.991540136  10.22.18.17 → 224.0.0.252  LLMNR 64 Standard query 0xc3e3 AAAA wpad
   44 0.991677510  10.22.18.17 → 224.0.0.252  LLMNR 64 Standard query 0x4341 A wpad
   45 0.991684346 10.22.19.143 → 224.0.0.252  LLMNR 72 Standard query 0x7db9 ANY Rajat-Laptop
   46 0.991702334  10.22.18.17 → 224.0.0.252  LLMNR 64 Standard query 0xfe24 A wpad
   47 0.997525072 192.168.1.16 → 10.6.15.144  SSH 1514 Client: Encrypted packet (len=1448)
   48 1.000077342 192.168.1.16 → 10.6.15.144  SSH 206 Client: Encrypted packet (len=140)
   49 1.002522945  10.6.15.144 → 192.168.1.16 TCP 66 22 → 59298 [ACK] Seq=2281 Ack=2593 Win=1452 Len=0 TSval=4373038 TSecr=3776704
   50 1.009945158  10.6.15.144 → 192.168.1.16 TCP 66 22 → 59298 [ACK] Seq=2281 Ack=4181 Win=1452 Len=0 TSval=4373040 TSecr=3776706
   51 1.983474102 10.22.19.143 → 224.0.0.252  LLMNR 72 Standard query 0x7db9 ANY Rajat-Laptop
   52 1.983497968  10.22.18.17 → 224.0.0.252  LLMNR 65 Standard query 0x61e1 ANY PCABI
   53 1.983502781  10.22.18.17 → 224.0.0.252  LLMNR 64 Standard query 0xfe24 A wpad
   54 1.985609305 10.22.18.209 → 224.0.0.252  LLMNR 64 Standard query 0x3370 A wpad
   55 1.985797842  10.6.15.144 → 192.168.1.16 SSH 1478 Server: Encrypted packet (len=1412)
   56 1.985960656  10.6.15.144 → 192.168.1.16 SSH 1514 Server: Encrypted packet (len=1448)
   57 1.985969427 192.168.1.16 → 10.6.15.144  TCP 66 59298 → 22 [ACK] Seq=4181 Ack=5141 Win=3666 Len=0 TSval=3776953 TSecr=4373169
   58 1.986153656  10.6.15.144 → 192.168.1.16 SSH 1514 Server: Encrypted packet (len=1448)
   59 1.986162956 10.22.18.209 → 224.0.0.252  LLMNR 64 Standard query 0x3370 A wpad
   60 1.986172143  10.22.18.17 → 224.0.0.252  LLMNR 65 Standard query 0x61e1 ANY PCABI
   61 1.986379030  10.6.15.144 → 192.168.1.16 SSH 1514 Server: Encrypted packet (len=1448)
   62 1.986386841 192.168.1.16 → 10.6.15.144  TCP 66 59298 → 22 [ACK] Seq=4181 Ack=8037 Win=3666 Len=0 TSval=3776953 TSecr=4373169
   63 1.995356524 192.168.1.16 → 10.6.15.144  SSH 1514 Client: Encrypted packet (len=1448)
   64 1.998028280 192.168.1.16 → 10.6.15.144  SSH 222 Client: Encrypted packet (len=156)
   65 1.998780823  10.6.15.144 → 192.168.1.16 SSH 1514 Server: Encrypted packet (len=1448)
   66 1.998966835  10.6.15.144 → 192.168.1.16 SSH 1514 Server: Encrypted packet (len=1448)
   67 1.998974174 192.168.1.16 → 10.6.15.144  TCP 66 59298 → 22 [ACK] Seq=5785 Ack=10933 Win=3666 Len=0 TSval=3776956 TSecr=4373286
   68 1.999158906  10.6.15.144 → 192.168.1.16 SSH 1514 Server: Encrypted packet (len=1448)
   69 2.009253362  10.6.15.144 → 192.168.1.16 TCP 66 22 → 59298 [ACK] Seq=12381 Ack=5785 Win=1452 Len=0 TSval=4373290 TSecr=3776955
   70 2.009922302  10.6.15.144 → 192.168.1.16 SSH 1514 Server: Encrypted packet (len=1448)
   71 2.009940894 192.168.1.16 → 10.6.15.144  TCP 66 59298 → 22 [ACK] Seq=5785 Ack=13829 Win=3666 Len=0 TSval=3776959 TSecr=4373286
   72 2.010109563  10.6.15.144 → 192.168.1.16 SSH 1514 Server: Encrypted packet (len=1448)
   73 2.023557018  10.6.15.144 → 192.168.1.16 SSH 1514 Server: Encrypted packet (len=1448)
   74 2.023576206 192.168.1.16 → 10.6.15.144  TCP 66 59298 → 22 [ACK] Seq=5785 Ack=16725 Win=3666 Len=0 TSval=3776962 TSecr=4373290
   75 2.023868413  10.6.15.144 → 192.168.1.16 SSH 1514 Server: Encrypted packet (len=1448)
   76 2.038061562  10.6.15.144 → 192.168.1.16 SSH 1514 Server: Encrypted packet (len=1448)
   77 2.038081728 192.168.1.16 → 10.6.15.144  TCP 66 59298 → 22 [ACK] Seq=5785 Ack=19621 Win=3666 Len=0 TSval=3776966 TSecr=4373292
   78 2.038242423  10.6.15.144 → 192.168.1.16 SSH 1514 Server: Encrypted packet (len=1448)
   79 2.048892938  10.6.15.144 → 192.168.1.16 SSH 1514 Server: Encrypted packet (len=1448)
   80 2.048913345 192.168.1.16 → 10.6.15.144  TCP 66 59298 → 22 [ACK] Seq=5785 Ack=22517 Win=3666 Len=0 TSval=3776968 TSecr=4373296
   81 2.048945363  10.6.15.144 → 192.168.1.16 SSH 606 Server: Encrypted packet (len=540)
   82 2.089034289 192.168.1.16 → 10.6.15.144  TCP 66 59298 → 22 [ACK] Seq=5785 Ack=23057 Win=3666 Len=0 TSval=3776979 TSecr=4373299
   83 2.176107391  10.6.15.144 → 192.168.1.16 SSH 1414 Server: Encrypted packet (len=1348)
   84 2.176133487 192.168.1.16 → 10.6.15.144  TCP 66 59298 → 22 [ACK] Seq=5785 Ack=24405 Win=3666 Len=0 TSval=3777000 TSecr=4373331
   85 2.195018601 192.168.1.16 → 10.6.15.144  SSH 1514 Client: Encrypted packet (len=1448)
   86 2.195220914 192.168.1.16 → 10.6.15.144  SSH 1514 Client: Encrypted packet (len=1448)
   87 2.214258054 192.168.1.16 → 10.6.15.144  SSH 378 Client: Encrypted packet (len=312)
   88 2.265037212 192.168.1.16 → 10.6.15.144  TCP 378 [TCP Retransmission] 59298 → 22 [PSH, ACK] Seq=8681 Ack=24405 Win=3666 Len=312 TSval=3777023 TSecr=4373331
   89 2.357215670  10.6.15.144 → 192.168.1.16 TCP 78 [TCP Dup ACK 69#1] 22 → 59298 [ACK] Seq=24405 Ack=5785 Win=1452 Len=0 TSval=4373377 TSecr=3777000 SLE=8681 SRE=8993
   90 2.357243078 192.168.1.16 → 10.6.15.144  SSH 1514 Client: Encrypted packet (len=1448)
   91 2.373394001  10.6.15.144 → 192.168.1.16 TCP 78 [TCP Dup ACK 69#2] 22 → 59298 [ACK] Seq=24405 Ack=5785 Win=1452 Len=0 TSval=4373380 TSecr=3777000 SLE=8681 SRE=10441
   92 2.373414413 192.168.1.16 → 10.6.15.144  SSH 1514 Client: [TCP Fast Retransmission] , Encrypted packet (len=1448)
   93 2.394535100  10.6.15.144 → 192.168.1.16 TCP 78 22 → 59298 [ACK] Seq=24405 Ack=7233 Win=1441 Len=0 TSval=4373386 TSecr=3777050 SLE=8681 SRE=10441
   94 2.394556776 192.168.1.16 → 10.6.15.144  TCP 1514 [TCP Retransmission] 59298 → 22 [ACK] Seq=7233 Ack=24405 Win=3666 Len=1448 TSval=3777055 TSecr=4373386
   95 2.394567933 192.168.1.16 → 10.6.15.144  SSH 1514 Client: Encrypted packet (len=1448)
   96 2.413836415  10.6.15.144 → 192.168.1.16 TCP 66 22 → 59298 [ACK] Seq=24405 Ack=10441 Win=1438 Len=0 TSval=4373391 TSecr=3777055
   97 2.413859444 192.168.1.16 → 10.6.15.144  SSH 1514 Client: Encrypted packet (len=1448)
   98 2.422803935  10.6.15.144 → 192.168.1.16 TCP 66 22 → 59298 [ACK] Seq=24405 Ack=11889 Win=1452 Len=0 TSval=4373391 TSecr=3777055
   99 2.422824716 192.168.1.16 → 10.6.15.144  SSH 1514 Client: Encrypted packet (len=1448)
  100 2.432126601  10.6.15.144 → 192.168.1.16 TCP 66 22 → 59298 [ACK] Seq=24405 Ack=13337 Win=1452 Len=0 TSval=4373395 TSecr=3777060
  101 2.432146863 192.168.1.16 → 10.6.15.144  SSH 1514 Client: Encrypted packet (len=1448)
  102 2.467659576  10.6.15.144 → 192.168.1.16 TCP 78 [TCP Dup ACK 100#1] 22 → 59298 [ACK] Seq=24405 Ack=13337 Win=1452 Len=0 TSval=4373404 TSecr=3777060 SLE=14785 SRE=16233
  103 2.467681765 192.168.1.16 → 10.6.15.144  SSH 1514 Client: Encrypted packet (len=1448)
  104 2.649018589 192.168.1.16 → 10.6.15.144  TCP 1514 [TCP Retransmission] 59298 → 22 [ACK] Seq=13337 Ack=24405 Win=3666 Len=1448 TSval=3777119 TSecr=4373404
  105 2.651315337  10.6.15.144 → 192.168.1.16 SSH 1234 Server: Encrypted packet (len=1156)
  106 2.651444879  10.6.15.144 → 192.168.1.16 SSH 1234 Server: Encrypted packet (len=1156)
  107 2.651450176 192.168.1.16 → 10.6.15.144  TCP 66 59298 → 22 [ACK] Seq=17681 Ack=26717 Win=3666 Len=0 TSval=3777119 TSecr=4373432
  108 2.667567665  10.6.15.144 → 192.168.1.16 TCP 66 22 → 59298 [ACK] Seq=26717 Ack=16233 Win=1446 Len=0 TSval=4373452 TSecr=3777119
  109 2.667587103 192.168.1.16 → 10.6.15.144  SSH 1514 Client: Encrypted packet (len=1448)
  110 2.667597891 192.168.1.16 → 10.6.15.144  SSH 1514 Client: Encrypted packet (len=1448)
  111 2.708677136  10.6.15.144 → 192.168.1.16 TCP 78 [TCP Window Update] 22 → 59298 [ACK] Seq=26717 Ack=16233 Win=1447 Len=0 TSval=4373464 TSecr=3777119 SLE=17681 SRE=20577
  112 2.708702203 192.168.1.16 → 10.6.15.144  TCP 1514 [TCP Retransmission] 59298 → 22 [ACK] Seq=16233 Ack=26717 Win=3666 Len=1448 TSval=3777133 TSecr=4373464
  113 2.708718217 192.168.1.16 → 10.6.15.144  SSH 1514 Client: Encrypted packet (len=1448)
  114 2.720262912  10.6.15.144 → 192.168.1.16 TCP 66 22 → 59298 [ACK] Seq=26717 Ack=20577 Win=1438 Len=0 TSval=4373467 TSecr=3777133
  115 2.720284588 192.168.1.16 → 10.6.15.144  SSH 1514 Client: Encrypted packet (len=1448)
  116 2.720298505  10.6.15.144 → 192.168.1.16 TCP 66 22 → 59298 [ACK] Seq=26717 Ack=22025 Win=1452 Len=0 TSval=4373467 TSecr=3777133
  117 2.720301987 192.168.1.16 → 10.6.15.144  SSH 1342 Client: Encrypted packet (len=1276)
  118 2.732729158  10.6.15.144 → 192.168.1.16 TCP 66 22 → 59298 [ACK] Seq=26717 Ack=23473 Win=1452 Len=0 TSval=4373470 TSecr=3777136
  119 2.733294314  10.6.15.144 → 192.168.1.16 TCP 66 22 → 59298 [ACK] Seq=26717 Ack=24749 Win=1452 Len=0 TSval=4373471 TSecr=3777136
  120 2.744382223  10.6.15.144 → 192.168.1.16 SSH 102 Server: Encrypted packet (len=36)
  121 2.744405361  10.6.15.144 → 192.168.1.16 SSH 102 Server: Encrypted packet (len=36)
  122 2.744464532 192.168.1.16 → 10.6.15.144  TCP 66 59298 → 22 [ACK] Seq=24749 Ack=26789 Win=3666 Len=0 TSval=3777142 TSecr=4373473
  123 2.744754762 192.168.1.16 → 10.6.15.144  SSH 182 Client: Encrypted packet (len=116)
  124 2.746370540 192.168.1.16 → 10.6.15.144  SSH 158 Client: Encrypted packet (len=92)
  125 2.757280757  10.6.15.144 → 192.168.1.16 TCP 66 22 → 59298 [ACK] Seq=26789 Ack=24957 Win=1452 Len=0 TSval=4373477 TSecr=3777142
  126 2.783437437  10.6.15.144 → 192.168.1.16 SSH 1514 Server: Encrypted packet (len=1448)
  127 2.784353925  10.6.15.144 → 192.168.1.16 SSH 518 Server: [TCP Previous segment not captured] , Encrypted packet (len=452)
  128 2.784372245 192.168.1.16 → 10.6.15.144  TCP 78 59298 → 22 [ACK] Seq=24957 Ack=28237 Win=3666 Len=0 TSval=3777152 TSecr=4373483 SLE=29593 SRE=30045
  129 2.817407009  10.6.15.144 → 192.168.1.16 SSH 1446 Server: Encrypted packet (len=1380)
  130 2.817426028 192.168.1.16 → 10.6.15.144  TCP 78 [TCP Dup ACK 128#1] 59298 → 22 [ACK] Seq=24957 Ack=28237 Win=3666 Len=0 TSval=3777161 TSecr=4373483 SLE=29593 SRE=31425
  131 2.882526358  10.6.15.144 → 192.168.1.16 SSH 1222 Server: Encrypted packet (len=1156)
  132 2.882546853 192.168.1.16 → 10.6.15.144  TCP 78 [TCP Dup ACK 128#2] 59298 → 22 [ACK] Seq=24957 Ack=28237 Win=3666 Len=0 TSval=3777177 TSecr=4373483 SLE=29593 SRE=32581
  133 2.885308279  10.6.15.144 → 192.168.1.16 SSH 1222 Server: Encrypted packet (len=1156)
  134 2.885327495 192.168.1.16 → 10.6.15.144  TCP 78 [TCP Dup ACK 128#3] 59298 → 22 [ACK] Seq=24957 Ack=28237 Win=3666 Len=0 TSval=3777178 TSecr=4373483 SLE=29593 SRE=33737
  135 2.893257147  10.6.15.144 → 192.168.1.16 SSH 1422 Server: [TCP Fast Retransmission] , Encrypted packet (len=1356)
  136 2.893283217 192.168.1.16 → 10.6.15.144  TCP 66 59298 → 22 [ACK] Seq=24957 Ack=33737 Win=3666 Len=0 TSval=3777180 TSecr=4373510
  137 2.895805402 192.168.1.16 → 10.6.15.144  SSH 214 Client: Encrypted packet (len=148)
  138 2.898058320 192.168.1.16 → 10.6.15.144  SSH 206 Client: Encrypted packet (len=140)
  139 2.900543619 192.168.1.16 → 10.6.15.144  SSH 1514 Client: Encrypted packet (len=1448)
  140 2.900828252 192.168.1.16 → 10.6.15.144  SSH 1514 Client: Encrypted packet (len=1448)
  141 2.908138843  10.6.15.144 → 192.168.1.16 TCP 66 22 → 59298 [ACK] Seq=33737 Ack=25245 Win=1452 Len=0 TSval=4373514 TSecr=3777180
  142 2.908163306 192.168.1.16 → 10.6.15.144  SSH 1514 Client: Encrypted packet (len=1448)
  143 2.908176549 192.168.1.16 → 10.6.15.144  SSH 1514 Client: Encrypted packet (len=1448)
  144 2.929501459  10.6.15.144 → 192.168.1.16 TCP 66 22 → 59298 [ACK] Seq=33737 Ack=28141 Win=1452 Len=0 TSval=4373515 TSecr=3777181
  145 2.929521473 192.168.1.16 → 10.6.15.144  SSH 1514 Client: Encrypted packet (len=1448)
  146 2.929532292 192.168.1.16 → 10.6.15.144  SSH 1514 Client: Encrypted packet (len=1448)
  147 2.932737306  10.6.15.144 → 192.168.1.16 TCP 66 22 → 59298 [ACK] Seq=33737 Ack=31037 Win=1452 Len=0 TSval=4373520 TSecr=3777183
  148 2.932760084 192.168.1.16 → 10.6.15.144  SSH 658 Client: Encrypted packet (len=592)
  149 2.933720270  10.6.15.144 → 192.168.1.16 SSH 350 Server: Encrypted packet (len=284)
  150 2.940681477  10.6.15.144 → 192.168.1.16 TCP 66 22 → 59298 [ACK] Seq=34021 Ack=33933 Win=1452 Len=0 TSval=4373523 TSecr=3777189
  151 2.957978574  10.6.15.144 → 192.168.1.16 SSH 310 Server: Encrypted packet (len=244)
  152 2.958057679 192.168.1.16 → 10.6.15.144  TCP 66 59298 → 22 [ACK] Seq=34525 Ack=34265 Win=3666 Len=0 TSval=3777196 TSecr=4373521
  153 2.975574127  10.6.15.144 → 192.168.1.16 SSH 1222 Server: Encrypted packet (len=1156)
  154 2.977904427 192.168.1.16 → 10.6.15.144  SSH 1514 Client: Encrypted packet (len=1448)
  155 2.990552795 192.168.1.16 → 10.6.15.144  SSH 286 Client: Encrypted packet (len=220)
  156 3.000422651  10.6.15.144 → 192.168.1.16 TCP 66 22 → 59298 [ACK] Seq=35421 Ack=36193 Win=1452 Len=0 TSval=4373537 TSecr=3777201
  157 3.045036776  10.6.15.144 → 192.168.1.16 SSH 1222 Server: Encrypted packet (len=1156)
  158 3.085078831 192.168.1.16 → 10.6.15.144  TCP 66 59298 → 22 [ACK] Seq=36193 Ack=36577 Win=3666 Len=0 TSval=3777228 TSecr=4373548
  159 3.094258596  10.6.15.144 → 192.168.1.16 SSH 1414 Server: Encrypted packet (len=1348)
  160 3.094290627 192.168.1.16 → 10.6.15.144  TCP 66 59298 → 22 [ACK] Seq=36193 Ack=37925 Win=3666 Len=0 TSval=3777230 TSecr=4373561
  161 3.103448638  10.6.15.144 → 192.168.1.16 SSH 1222 Server: Encrypted packet (len=1156)
  162 3.103520666 192.168.1.16 → 10.6.15.144  TCP 66 59298 → 22 [ACK] Seq=36193 Ack=39081 Win=3666 Len=0 TSval=3777232 TSecr=4373562
  163 3.106780325  10.6.15.144 → 192.168.1.16 SSH 1222 Server: Encrypted packet (len=1156)
  164 3.149026635 192.168.1.16 → 10.6.15.144  TCP 66 59298 → 22 [ACK] Seq=36193 Ack=40237 Win=3666 Len=0 TSval=3777244 TSecr=4373564
  165 4.993374091  10.6.15.144 → 192.168.1.16 SSH 1222 Server: [TCP Previous segment not captured] , Encrypted packet (len=1156)
  166 4.993395127 192.168.1.16 → 10.6.15.144  TCP 78 [TCP Dup ACK 164#1] 59298 → 22 [ACK] Seq=36193 Ack=40237 Win=3666 Len=0 TSval=3777705 TSecr=4373564 SLE=41665 SRE=42821
  167 4.993633316  10.6.15.144 → 192.168.1.16 TCP 1222 [TCP Retransmission] 22 → 59298 [PSH, ACK] Seq=41665 Ack=36193 Win=1452 Len=1156 TSval=4373655 TSecr=3777244
  168 4.993656842 192.168.1.16 → 10.6.15.144  TCP 86 [TCP Dup ACK 164#2] 59298 → 22 [ACK] Seq=36193 Ack=40237 Win=3666 Len=0 TSval=3777705 TSecr=4373564 SLE=41665 SRE=42821 SLE=41665 SRE=42821
  169 4.993955677  10.6.15.144 → 192.168.1.16 SSH 1494 Server: [TCP Fast Retransmission] , Encrypted packet (len=1428)
  170 4.993986659 192.168.1.16 → 10.6.15.144  TCP 66 59298 → 22 [ACK] Seq=36193 Ack=42821 Win=3666 Len=0 TSval=3777705 TSecr=4373755
  171 4.994005218  10.22.18.17 → 224.0.0.252  LLMNR 65 Standard query 0xce1f ANY PCABI
  172 4.994022681 10.22.17.201 → 224.0.0.252  LLMNR 64 Standard query 0xb42d A wpad
  173 4.994032858 10.22.17.201 → 224.0.0.252  LLMNR 64 Standard query 0x5468 AAAA wpad
  174 4.994039869  10.22.18.17 → 224.0.0.252  LLMNR 69 Standard query 0xedaf A aegrterwi
  175 4.994044722  10.22.18.17 → 224.0.0.252  LLMNR 71 Standard query 0xe782 A igvuatncprl
  176 4.994049459  10.22.18.17 → 224.0.0.252  LLMNR 64 Standard query 0xaee8 A wpad
  177 5.019057630  10.22.18.17 → 224.0.0.252  LLMNR 73 Standard query 0xf00c A cenziiddbkzyu
  178 5.019083429  10.22.18.17 → 224.0.0.252  LLMNR 64 Standard query 0xdf93 AAAA wpad
  179 5.019088909  10.22.18.17 → 224.0.0.252  LLMNR 65 Standard query 0xce1f ANY PCABI
  180 5.019575108  10.6.15.144 → 192.168.1.16 SSH 1494 Server: [TCP Spurious Retransmission] , Encrypted packet (len=1428)
  181 5.019586985 192.168.1.16 → 10.6.15.144  TCP 78 [TCP Dup ACK 170#1] 59298 → 22 [ACK] Seq=36193 Ack=42821 Win=3666 Len=0 TSval=3777711 TSecr=4373755 SLE=40237 SRE=41665
  182 5.019598189 10.22.17.201 → 224.0.0.252  LLMNR 64 Standard query 0xb42d A wpad
  183 5.019604083 10.22.17.201 → 224.0.0.252  LLMNR 64 Standard query 0x5468 AAAA wpad
  184 5.019623680  10.22.18.17 → 224.0.0.252  LLMNR 64 Standard query 0xaee8 A wpad
  185 5.019660728  10.22.18.17 → 224.0.0.252  LLMNR 69 Standard query 0xedaf A aegrterwi
  186 5.019723403  10.22.18.17 → 224.0.0.252  LLMNR 71 Standard query 0xe782 A igvuatncprl
  187 5.025398715  10.22.18.17 → 224.0.0.252  LLMNR 73 Standard query 0xf00c A cenziiddbkzyu
  188 5.025425787  10.22.18.17 → 224.0.0.252  LLMNR 64 Standard query 0xdf93 AAAA wpad
  189 7.006910070  10.22.18.17 → 224.0.0.252  LLMNR 64 Standard query 0xcc49 A wpad
  190 7.006932745  10.22.18.17 → 224.0.0.252  LLMNR 64 Standard query 0xcc49 A wpad
  191 7.186000239 192.168.1.16 → 54.76.71.168 TCP 128 42414 → 8282 [PSH, ACK] Seq=1 Ack=1 Win=296 Len=62 TSval=3778253 TSecr=607887689
  192 8.221074786 192.168.1.16 → 54.76.71.168 TCP 128 [TCP Retransmission] 42414 → 8282 [PSH, ACK] Seq=1 Ack=1 Win=296 Len=62 TSval=3778512 TSecr=607887689
  193 8.223959158  10.22.18.17 → 224.0.0.252  LLMNR 64 Standard query 0x45ac A wpad
  194 8.224014256  10.22.18.17 → 224.0.0.252  LLMNR 64 Standard query 0xc436 AAAA wpad
  195 8.224020358  10.22.18.17 → 224.0.0.252  LLMNR 75 Standard query 0xe697 A imllkaabaydbyiy
  196 8.224380391  10.22.18.17 → 224.0.0.252  LLMNR 70 Standard query 0x24b8 A ajrwjrdjmd
  197 8.224404830  10.22.18.17 → 224.0.0.252  LLMNR 64 Standard query 0xc436 AAAA wpad
  198 8.224409362  10.22.18.17 → 224.0.0.252  LLMNR 64 Standard query 0x45ac A wpad
  199 8.224413891  10.22.18.17 → 224.0.0.252  LLMNR 75 Standard query 0xe697 A imllkaabaydbyiy
  200 8.224418314  10.22.18.17 → 224.0.0.252  LLMNR 70 Standard query 0x24b8 A ajrwjrdjmd
  201 9.983058208 54.76.71.168 → 192.168.1.16 TCP 66 8282 → 42414 [ACK] Seq=1 Ack=63 Win=121 Len=0 TSval=607890495 TSecr=3778512
  202 9.983443609 10.22.18.209 → 224.0.0.252  LLMNR 64 Standard query 0x0f73 A wpad
  203 9.983828231 10.22.18.209 → 224.0.0.252  LLMNR 64 Standard query 0x0f73 A wpad
  204 11.999006124  192.168.1.1 → 224.0.0.1    IGMPv2 42 Membership Query, general
  205 12.993367504  10.22.18.17 → 224.0.0.252  LLMNR 64 Standard query 0x8b55 A wpad
  206 12.993752473  10.22.18.17 → 224.0.0.252  LLMNR 64 Standard query 0x8b55 A wpad
  207 12.998895803 192.168.1.16 → 10.6.15.144  SSH 1514 Client: Encrypted packet (len=1448)
  208 13.001210236 192.168.1.16 → 10.6.15.144  SSH 382 Client: Encrypted packet (len=316)
  209 13.010901449  10.6.15.144 → 192.168.1.16 TCP 66 22 → 59298 [ACK] Seq=42821 Ack=37957 Win=1452 Len=0 TSval=4376040 TSecr=3779706
  210 13.081577936  10.6.15.144 → 192.168.1.16 SSH 150 Server: Encrypted packet (len=84)
  211 13.081612790 192.168.1.16 → 10.6.15.144  TCP 66 59298 → 22 [ACK] Seq=37957 Ack=42905 Win=3666 Len=0 TSval=3779727 TSecr=4376058
  212 13.206720473  10.6.15.144 → 192.168.1.16 SSH 950 Server: Encrypted packet (len=884)
  213 13.206738069 192.168.1.16 → 10.6.15.144  TCP 66 59298 → 22 [ACK] Seq=37957 Ack=43789 Win=3666 Len=0 TSval=3779758 TSecr=4376084
  214 13.207186136  10.6.15.144 → 192.168.1.16 SSH 582 Server: Encrypted packet (len=516)
  215 13.207193671 192.168.1.16 → 10.6.15.144  TCP 66 59298 → 22 [ACK] Seq=37957 Ack=44305 Win=3666 Len=0 TSval=3779758 TSecr=4376084
  216 13.207765112 192.168.1.16 → 10.6.15.144  SSH 142 Client: Encrypted packet (len=76)
  217 13.245075946 192.168.1.16 → 224.0.0.252  IGMPv2 46 Membership Report group 224.0.0.252
  218 13.256799025  10.6.15.144 → 192.168.1.16 TCP 66 22 → 59298 [ACK] Seq=44305 Ack=38033 Win=1452 Len=0 TSval=4376102 TSecr=3779758
  219 14.683133608 192.168.1.16 → 139.59.21.22 NTP 90 NTP Version 4, client
  220 15.999016770  10.22.18.17 → 224.0.0.252  LLMNR 64 Standard query 0x5a59 A wpad
  221 15.999402777  10.22.18.17 → 224.0.0.252  LLMNR 64 Standard query 0x5a59 A wpad
  222 17.629102337 192.168.1.16 → 224.0.0.251  IGMPv2 46 Membership Report group 224.0.0.251
  223 17.693515261 10.22.18.220 → 224.0.0.252  LLMNR 64 Standard query 0xe71b A wpad
  224 17.696417314 10.22.18.220 → 224.0.0.252  LLMNR 64 Standard query 0x76c3 AAAA wpad
  225 19.007043426 10.22.18.220 → 224.0.0.252  LLMNR 64 Standard query 0x76c3 AAAA wpad
  226 19.007094821 10.22.18.220 → 224.0.0.252  LLMNR 64 Standard query 0xe71b A wpad
  227 23.203995001  10.6.15.144 → 192.168.1.16 SSH 134 Server: Encrypted packet (len=68)
  228 23.204012766  10.6.15.144 → 192.168.1.16 SSH 102 Server: Encrypted packet (len=36)
  229 23.204018352  10.6.15.144 → 192.168.1.16 SSH 126 Server: Encrypted packet (len=60)
  230 23.204064232 192.168.1.16 → 10.6.15.144  TCP 66 59298 → 22 [ACK] Seq=38033 Ack=44469 Win=3666 Len=0 TSval=3782257 TSecr=4377808
  231 23.208215890  10.6.15.144 → 192.168.1.16 SSH 198 Server: Encrypted packet (len=132)
  232 23.208240110  10.6.15.144 → 192.168.1.16 TCP 362 [TCP Retransmission] 22 → 59298 [PSH, ACK] Seq=44305 Ack=38033 Win=1452 Len=296 TSval=4378203 TSecr=3779758
  233 23.208245445 192.168.1.16 → 10.6.15.144  TCP 78 59298 → 22 [ACK] Seq=38033 Ack=44601 Win=3666 Len=0 TSval=3782258 TSecr=4378203 SLE=44305 SRE=44601
  234 23.208253209 10.22.19.172 → 224.0.0.252  LLMNR 67 Standard query 0x12f0 ANY KARANAM
  235 23.208273621 10.22.19.172 → 224.0.0.252  LLMNR 67 Standard query 0x12f0 ANY KARANAM
  236 23.208277144 10.22.19.172 → 224.0.0.252  LLMNR 67 Standard query 0x1662 ANY KARANAM
  237 23.687067000 192.168.1.16 → 192.168.1.1  DNS 74 Standard query 0x56b8 A ntp.ubuntu.com
  238 23.874562389 10.22.19.172 → 224.0.0.252  LLMNR 67 Standard query 0x1662 ANY KARANAM
  239 23.900708647 10.22.17.201 → 224.0.0.252  LLMNR 64 Standard query 0x921c A wpad
  240 23.983467186  192.168.1.1 → 239.255.255.250 SSDP 302 NOTIFY * HTTP/1.1 
  241 23.984095506  192.168.1.1 → 239.255.255.250 SSDP 311 NOTIFY * HTTP/1.1 
  242 23.987611747  192.168.1.1 → 239.255.255.250 SSDP 374 NOTIFY * HTTP/1.1 
  243 23.991335271  192.168.1.1 → 239.255.255.250 SSDP 370 NOTIFY * HTTP/1.1 
  244 23.994406655  192.168.1.1 → 239.255.255.250 SSDP 350 NOTIFY * HTTP/1.1 
  245 23.998280699  192.168.1.1 → 239.255.255.250 SSDP 382 NOTIFY * HTTP/1.1 
  246 24.017719386  192.168.1.1 → 239.255.255.250 SSDP 364 NOTIFY * HTTP/1.1 
  247 24.020996258  192.168.1.1 → 239.255.255.250 SSDP 366 NOTIFY * HTTP/1.1 
  248 24.023908981  192.168.1.1 → 239.255.255.250 SSDP 302 NOTIFY * HTTP/1.1 
  249 24.991200733  10.6.15.144 → 192.168.1.16 SSH 362 Server: [TCP Spurious Retransmission] , Encrypted packet (len=296)
  250 24.991241563 192.168.1.16 → 10.6.15.144  TCP 78 [TCP Dup ACK 233#1] 59298 → 22 [ACK] Seq=38033 Ack=44601 Win=3666 Len=0 TSval=3782704 TSecr=4378846 SLE=44305 SRE=44601
  251 24.991966276 10.22.17.201 → 224.0.0.252  LLMNR 64 Standard query 0x921c A wpad
  252 25.021463065 10.22.19.172 → 224.0.0.252  LLMNR 67 Standard query 0x6367 ANY KARANAM
  253 25.085569580  10.6.15.144 → 192.168.1.16 SSH 258 Server: Encrypted packet (len=192)
  254 25.085605953 192.168.1.16 → 10.6.15.144  TCP 66 59298 → 22 [ACK] Seq=38033 Ack=44793 Win=3666 Len=0 TSval=3782728 TSecr=4379059
  255 25.982988964 10.22.19.172 → 224.0.0.252  LLMNR 67 Standard query 0x6367 ANY KARANAM
  256 25.983020567  10.6.15.144 → 192.168.1.16 SSH 258 Server: [TCP Spurious Retransmission] , Encrypted packet (len=192)
  257 25.983036813 192.168.1.16 → 10.6.15.144  TCP 78 [TCP Dup ACK 254#1] 59298 → 22 [ACK] Seq=38033 Ack=44793 Win=3666 Len=0 TSval=3782952 TSecr=4379196 SLE=44601 SRE=44793
