    1 0.000000000 192.168.1.16 → 10.6.15.144  SSH 426 Client: Encrypted packet (len=360)
    2 0.005311990  10.22.18.17 → 224.0.0.252  LLMNR 64 Standard query 0x5d26 A wpad
    3 0.006511019  10.22.18.17 → 224.0.0.252  LLMNR 64 Standard query 0xad34 AAAA wpad
    4 0.016402312  10.6.15.144 → 192.168.1.16 TCP 66 [TCP ACKed unseen segment] 22 → 59298 [ACK] Seq=1 Ack=1493 Win=1446 Len=0 TSval=4380294 TSecr=3783960
    5 0.016419778  10.6.15.144 → 192.168.1.16 SSH 246 Server: [TCP ACKed unseen segment] , Encrypted packet (len=180)
    6 0.016431110 192.168.1.16 → 10.6.15.144  TCP 66 [TCP Previous segment not captured] 59298 → 22 [ACK] Seq=1493 Ack=181 Win=3666 Len=0 TSval=3783964 TSecr=4380294
    7 0.994122674  10.6.15.144 → 192.168.1.16 SSH 574 Server: [TCP ACKed unseen segment] , Encrypted packet (len=508)
    8 0.994148114 192.168.1.16 → 10.6.15.144  TCP 66 59298 → 22 [ACK] Seq=1493 Ack=689 Win=3666 Len=0 TSval=3784208 TSecr=4380335
    9 0.994163999  10.22.18.17 → 224.0.0.252  LLMNR 64 Standard query 0xad34 AAAA wpad
   10 0.994180031  10.22.18.17 → 224.0.0.252  LLMNR 64 Standard query 0x5d26 A wpad
   11 0.996573776 192.168.1.16 → 10.6.15.144  SSH 102 Client: Encrypted packet (len=36)
   12 0.998498027 192.168.1.16 → 10.6.15.144  SSH 226 Client: Encrypted packet (len=160)
   13 1.038778997  10.6.15.144 → 192.168.1.16 SSH 102 Server: Encrypted packet (len=36)
   14 1.038808433 192.168.1.16 → 10.6.15.144  SSH 1514 Client: Encrypted packet (len=1448)
   15 1.086081555  10.6.15.144 → 192.168.1.16 TCP 78 [TCP Dup ACK 13#1] 22 → 59298 [ACK] Seq=725 Ack=1529 Win=1452 Len=0 TSval=4380562 TSecr=3784209 SLE=1689 SRE=3137
   16 1.086105267 192.168.1.16 → 10.6.15.144  SSH 290 Client: Encrypted packet (len=224)
   17 1.101157879  10.6.15.144 → 192.168.1.16 TCP 78 [TCP Dup ACK 13#2] 22 → 59298 [ACK] Seq=725 Ack=1529 Win=1452 Len=0 TSval=4380566 TSecr=3784209 SLE=1689 SRE=3361
   18 1.203829500 10.22.19.164 → 224.0.0.252  LLMNR 65 Standard query 0x5ec2 A https
   19 1.227974461 192.168.1.16 → 10.6.15.144  TCP 226 [TCP Retransmission] 59298 → 22 [PSH, ACK] Seq=1529 Ack=725 Win=3666 Len=160 TSval=3784267 TSecr=4380566
   20 1.240663632  10.6.15.144 → 192.168.1.16 TCP 66 22 → 59298 [ACK] Seq=725 Ack=3361 Win=1443 Len=0 TSval=4380601 TSecr=3784267
   21 1.271420936  10.6.15.144 → 192.168.1.16 SSH 102 Server: Encrypted packet (len=36)
   22 1.271445709  10.6.15.144 → 192.168.1.16 SSH 102 Server: Encrypted packet (len=36)
   23 1.271505619 192.168.1.16 → 10.6.15.144  TCP 66 59298 → 22 [ACK] Seq=3361 Ack=797 Win=3666 Len=0 TSval=3784277 TSecr=4380608
   24 1.271785523 192.168.1.16 → 10.6.15.144  SSH 158 Client: Encrypted packet (len=92)
   25 1.274728738 192.168.1.16 → 10.6.15.144  SSH 406 Client: Encrypted packet (len=340)
   26 1.331994028 192.168.1.16 → 10.6.15.144  TCP 406 [TCP Retransmission] 59298 → 22 [PSH, ACK] Seq=3453 Ack=797 Win=3666 Len=340 TSval=3784293 TSecr=4380608
   27 1.564008197 192.168.1.16 → 10.6.15.144  TCP 498 [TCP Retransmission] 59298 → 22 [PSH, ACK] Seq=3361 Ack=797 Win=3666 Len=432 TSval=3784351 TSecr=4380608
   28 1.576135655  10.6.15.144 → 192.168.1.16 SSH 246 Server: Encrypted packet (len=180)
   29 1.576536336 192.168.1.16 → 10.6.15.144  SSH 150 Client: Encrypted packet (len=84)
   30 1.577071861 192.168.1.16 → 10.6.15.144  SSH 158 Client: Encrypted packet (len=92)
   31 1.593484840  10.6.15.144 → 192.168.1.16 TCP 66 22 → 59298 [ACK] Seq=977 Ack=3969 Win=1452 Len=0 TSval=4380688 TSecr=3784354
   32 1.613262046  10.6.15.144 → 192.168.1.16 SSH 1054 Server: Encrypted packet (len=988)
   33 1.613348307  10.6.15.144 → 192.168.1.16 SSH 518 Server: Encrypted packet (len=452)
   34 1.613356015 192.168.1.16 → 10.6.15.144  TCP 66 59298 → 22 [ACK] Seq=3969 Ack=2417 Win=3666 Len=0 TSval=3784363 TSecr=4380692
   35 1.613537445  10.6.15.144 → 192.168.1.16 SSH 518 Server: Encrypted packet (len=452)
   36 1.613546286 10.22.19.164 → 224.0.0.252  LLMNR 65 Standard query 0x5ec2 A https
   37 1.615314644 192.168.1.16 → 10.6.15.144  SSH 206 Client: Encrypted packet (len=140)
   38 1.618292546 192.168.1.16 → 10.6.15.144  SSH 206 Client: Encrypted packet (len=140)
   39 1.629327909  10.6.15.144 → 192.168.1.16 SSH 970 Server: Encrypted packet (len=904)
   40 1.629349617  10.6.15.144 → 192.168.1.16 TCP 66 22 → 59298 [ACK] Seq=3773 Ack=4249 Win=1452 Len=0 TSval=4380698 TSecr=3784363
   41 1.629358745 192.168.1.16 → 10.6.15.144  SSH 1514 Client: Encrypted packet (len=1448)
   42 1.629370105 192.168.1.16 → 10.6.15.144  SSH 206 Client: Encrypted packet (len=140)
   43 1.636917778 192.168.1.16 → 10.6.15.144  SSH 346 Client: Encrypted packet (len=280)
   44 1.645991886  10.6.15.144 → 192.168.1.16 TCP 66 22 → 59298 [ACK] Seq=3773 Ack=5837 Win=1452 Len=0 TSval=4380702 TSecr=3784367
   45 1.658523104  10.6.15.144 → 192.168.1.16 SSH 334 Server: Encrypted packet (len=268)
   46 1.659038127  10.6.15.144 → 192.168.1.16 SSH 318 Server: Encrypted packet (len=252)
   47 1.659112700 192.168.1.16 → 10.6.15.144  TCP 66 59298 → 22 [ACK] Seq=6117 Ack=4293 Win=3666 Len=0 TSval=3784374 TSecr=4380705
   48 1.679257310  10.6.15.144 → 192.168.1.16 SSH 570 Server: Encrypted packet (len=504)
   49 1.720006495 192.168.1.16 → 10.6.15.144  TCP 66 59298 → 22 [ACK] Seq=6117 Ack=4797 Win=3666 Len=0 TSval=3784390 TSecr=4380710
   50 1.819153301  10.6.15.144 → 192.168.1.16 SSH 454 Server: Encrypted packet (len=388)
   51 1.819180604 192.168.1.16 → 10.6.15.144  TCP 66 59298 → 22 [ACK] Seq=6117 Ack=5185 Win=3666 Len=0 TSval=3784414 TSecr=4380745
   52 1.820275173 192.168.1.16 → 10.6.15.144  SSH 206 Client: Encrypted packet (len=140)
   53 2.047997397 192.168.1.16 → 10.6.15.144  TCP 206 [TCP Retransmission] 59298 → 22 [PSH, ACK] Seq=6117 Ack=5185 Win=3666 Len=140 TSval=3784472 TSecr=4380745
   54 2.276022735 192.168.1.16 → 10.6.15.144  TCP 206 [TCP Retransmission] 59298 → 22 [PSH, ACK] Seq=6117 Ack=5185 Win=3666 Len=140 TSval=3784529 TSecr=4380745
   55 2.278895505  10.6.15.144 → 192.168.1.16 SSH 1514 Server: Encrypted packet (len=1448)
   56 2.319973166 192.168.1.16 → 10.6.15.144  TCP 66 59298 → 22 [ACK] Seq=6257 Ack=6633 Win=3666 Len=0 TSval=3784540 TSecr=4380822
   57 2.379343881 10.22.19.172 → 224.0.0.252  LLMNR 64 Standard query 0x6b06 A wpad
   58 2.407601041  10.6.15.144 → 192.168.1.16 SSH 1514 Server: Encrypted packet (len=1448)
   59 2.407626693 192.168.1.16 → 10.6.15.144  TCP 66 59298 → 22 [ACK] Seq=6257 Ack=8081 Win=3666 Len=0 TSval=3784561 TSecr=4380892
   60 2.408057410  10.6.15.144 → 192.168.1.16 SSH 1514 Server: Encrypted packet (len=1448)
   61 2.408066370 192.168.1.16 → 10.6.15.144  TCP 66 59298 → 22 [ACK] Seq=6257 Ack=9529 Win=3666 Len=0 TSval=3784562 TSecr=4380892
   62 2.408522115  10.6.15.144 → 192.168.1.16 SSH 1514 Server: Encrypted packet (len=1448)
   63 2.408531436 192.168.1.16 → 10.6.15.144  TCP 66 59298 → 22 [ACK] Seq=6257 Ack=10977 Win=3666 Len=0 TSval=3784562 TSecr=4380892
   64 2.416445594 192.168.1.16 → 10.6.15.144  SSH 1514 Client: Encrypted packet (len=1448)
   65 2.465433594 192.168.1.16 → 10.6.15.144  SSH 222 Client: Encrypted packet (len=156)
   66 2.472327084  10.6.15.144 → 192.168.1.16 SSH 1514 Server: Encrypted packet (len=1448)
   67 2.472800386  10.6.15.144 → 192.168.1.16 SSH 1514 Server: Encrypted packet (len=1448)
   68 2.472811328 192.168.1.16 → 10.6.15.144  TCP 66 59298 → 22 [ACK] Seq=7861 Ack=13873 Win=3666 Len=0 TSval=3784578 TSecr=4380895
   69 2.473275199  10.6.15.144 → 192.168.1.16 SSH 1514 Server: Encrypted packet (len=1448)
   70 2.512017837  10.6.15.144 → 192.168.1.16 TCP 66 22 → 59298 [ACK] Seq=15321 Ack=7861 Win=1452 Len=0 TSval=4380911 TSecr=3784564
   71 2.512370283  10.6.15.144 → 192.168.1.16 SSH 1514 Server: Encrypted packet (len=1448)
   72 2.512379919 192.168.1.16 → 10.6.15.144  TCP 66 59298 → 22 [ACK] Seq=7861 Ack=16769 Win=3666 Len=0 TSval=3784588 TSecr=4380896
   73 2.512684084  10.6.15.144 → 192.168.1.16 SSH 1514 Server: Encrypted packet (len=1448)
   74 2.528132460  10.6.15.144 → 192.168.1.16 SSH 1514 Server: Encrypted packet (len=1448)
   75 2.528149275 192.168.1.16 → 10.6.15.144  TCP 66 59298 → 22 [ACK] Seq=7861 Ack=19665 Win=3666 Len=0 TSval=3784592 TSecr=4380912
   76 2.528447752  10.6.15.144 → 192.168.1.16 SSH 1514 Server: Encrypted packet (len=1448)
   77 2.539654337  10.6.15.144 → 192.168.1.16 SSH 1514 Server: Encrypted packet (len=1448)
   78 2.539669596 192.168.1.16 → 10.6.15.144  TCP 66 59298 → 22 [ACK] Seq=7861 Ack=22561 Win=3666 Len=0 TSval=3784594 TSecr=4380921
   79 2.539950627  10.6.15.144 → 192.168.1.16 SSH 1514 Server: Encrypted packet (len=1448)
   80 2.566923868  10.6.15.144 → 192.168.1.16 SSH 1514 Server: Encrypted packet (len=1448)
   81 2.566941024 192.168.1.16 → 10.6.15.144  TCP 66 59298 → 22 [ACK] Seq=7861 Ack=25457 Win=3666 Len=0 TSval=3784601 TSecr=4380925
   82 2.567111177  10.6.15.144 → 192.168.1.16 SSH 666 Server: Encrypted packet (len=600)
   83 2.611971873 192.168.1.16 → 10.6.15.144  TCP 66 59298 → 22 [ACK] Seq=7861 Ack=26057 Win=3666 Len=0 TSval=3784613 TSecr=4380928
   84 2.643788200  10.6.15.144 → 192.168.1.16 SSH 1414 Server: Encrypted packet (len=1348)
   85 2.643811839 192.168.1.16 → 10.6.15.144  TCP 66 59298 → 22 [ACK] Seq=7861 Ack=27405 Win=3666 Len=0 TSval=3784620 TSecr=4380952
   86 2.649584457 192.168.1.16 → 10.6.15.144  SSH 1514 Client: Encrypted packet (len=1448)
   87 2.651221989 192.168.1.16 → 10.6.15.144  SSH 1514 Client: Encrypted packet (len=1448)
   88 2.662240750  10.6.15.144 → 192.168.1.16 TCP 66 22 → 59298 [ACK] Seq=27405 Ack=10757 Win=1452 Len=0 TSval=4380956 TSecr=3784622
   89 2.662258875 192.168.1.16 → 10.6.15.144  SSH 378 Client: Encrypted packet (len=312)
   90 2.711422888  10.6.15.144 → 192.168.1.16 TCP 66 22 → 59298 [ACK] Seq=27405 Ack=11069 Win=1452 Len=0 TSval=4380969 TSecr=3784625
   91 2.739297275 192.168.1.16 → 10.6.15.144  SSH 1514 Client: Encrypted packet (len=1448)
   92 2.739614865 192.168.1.16 → 10.6.15.144  SSH 1514 Client: Encrypted packet (len=1448)
   93 2.814468325 192.168.1.16 → 10.6.15.144  SSH 1514 Client: Encrypted packet (len=1448)
   94 2.837794287 192.168.1.16 → 10.6.15.144  SSH 1514 Client: Encrypted packet (len=1448)
   95 2.863723849 10.22.19.172 → 224.0.0.252  LLMNR 64 Standard query 0x6b06 A wpad
   96 2.865287368  10.6.15.144 → 192.168.1.16 SSH 1446 Server: Encrypted packet (len=1380)
   97 2.865314259  10.6.15.144 → 192.168.1.16 TCP 78 [TCP Dup ACK 90#1] 22 → 59298 [ACK] Seq=28785 Ack=11069 Win=1452 Len=0 TSval=4381003 TSecr=3784625 SLE=12517 SRE=13965
   98 2.865326125 192.168.1.16 → 10.6.15.144  SSH 1514 Client: Encrypted packet (len=1448)
   99 2.868175780  10.6.15.144 → 192.168.1.16 TCP 86 [TCP Dup ACK 90#2] 22 → 59298 [ACK] Seq=28785 Ack=11069 Win=1452 Len=0 TSval=4381008 TSecr=3784625 SLE=15413 SRE=16861 SLE=12517 SRE=13965
  100 2.868190555 192.168.1.16 → 10.6.15.144  SSH 1514 Client: [TCP Fast Retransmission] , Encrypted packet (len=1448)
  101 2.947909233  10.6.15.144 → 192.168.1.16 TCP 86 [TCP Dup ACK 90#3] 22 → 59298 [ACK] Seq=28785 Ack=11069 Win=1452 Len=0 TSval=4381010 TSecr=3784625 SLE=15413 SRE=18309 SLE=12517 SRE=13965
  102 2.947933185 192.168.1.16 → 10.6.15.144  TCP 1514 [TCP Retransmission] 59298 → 22 [ACK] Seq=13965 Ack=28785 Win=3666 Len=1448 TSval=3784696 TSecr=4381010
  103 2.947953958 10.22.17.201 → 224.0.0.252  LLMNR 64 Standard query 0x5941 A wpad
  104 2.948422444  10.6.15.144 → 192.168.1.16 SSH 1434 Server: Encrypted packet (len=1348)
  105 2.967229915  10.6.15.144 → 192.168.1.16 TCP 78 22 → 59298 [ACK] Seq=30133 Ack=13965 Win=1430 Len=0 TSval=4381029 TSecr=3784677 SLE=15413 SRE=18309
  106 2.967250526 192.168.1.16 → 10.6.15.144  SSH 1514 Client: Encrypted packet (len=1448)
  107 3.232024894 192.168.1.16 → 10.6.15.144  TCP 1514 [TCP Retransmission] 59298 → 22 [ACK] Seq=13965 Ack=30133 Win=3666 Len=1448 TSval=3784768 TSecr=4381014
  108 3.367634539  10.6.15.144 → 192.168.1.16 SSH 1234 Server: Encrypted packet (len=1156)
  109 3.367816346  10.6.15.144 → 192.168.1.16 TCP 1234 [TCP Retransmission] 22 → 59298 [PSH, ACK] Seq=30133 Ack=13965 Win=1447 Len=1156 TSval=4381115 TSecr=3784677 SLE=15413 SRE=18309
  110 3.367836597 192.168.1.16 → 10.6.15.144  TCP 78 59298 → 22 [ACK] Seq=19757 Ack=31289 Win=3666 Len=0 TSval=3784801 TSecr=4381115 SLE=30133 SRE=31289
  111 3.367857401 10.22.17.201 → 224.0.0.252  LLMNR 64 Standard query 0x5941 A wpad
  112 3.776003343 192.168.1.16 → 10.6.15.144  TCP 1514 [TCP Retransmission] 59298 → 22 [ACK] Seq=13965 Ack=31289 Win=3666 Len=1448 TSval=3784904 TSecr=4381115
  113 4.832037571 192.168.1.16 → 10.6.15.144  TCP 1514 [TCP Retransmission] 59298 → 22 [ACK] Seq=13965 Ack=31289 Win=3666 Len=1448 TSval=3785168 TSecr=4381115
  114 4.843464226  10.6.15.144 → 192.168.1.16 SSH 1426 Server: [TCP Spurious Retransmission] , Encrypted packet (len=1348)
  115 4.843505226 192.168.1.16 → 10.6.15.144  TCP 78 [TCP Dup ACK 110#1] 59298 → 22 [ACK] Seq=19757 Ack=31289 Win=3666 Len=0 TSval=3785170 TSecr=4381115 SLE=28785 SRE=30133
  116 4.849987831  10.6.15.144 → 192.168.1.16 TCP 66 22 → 59298 [ACK] Seq=31289 Ack=18309 Win=1438 Len=0 TSval=4381502 TSecr=3785168
  117 4.850013479 192.168.1.16 → 10.6.15.144  SSH 1514 Client: Encrypted packet (len=1448)
  118 4.850028174 192.168.1.16 → 10.6.15.144  SSH 1514 Client: Encrypted packet (len=1448)
  119 5.120029412 192.168.1.16 → 10.6.15.144  TCP 1514 [TCP Retransmission] 59298 → 22 [ACK] Seq=18309 Ack=31289 Win=3666 Len=1448 TSval=3785240 TSecr=4381502
  120 5.122943319  10.6.15.144 → 192.168.1.16 SSH 1222 Server: Encrypted packet (len=1156)
  121 5.122975600 192.168.1.16 → 10.6.15.144  TCP 66 59298 → 22 [ACK] Seq=22653 Ack=32445 Win=3666 Len=0 TSval=3785240 TSecr=4381543
  122 5.187378765  10.6.15.144 → 192.168.1.16 SSH 1222 Server: Encrypted packet (len=1156)
  123 5.187407975 192.168.1.16 → 10.6.15.144  TCP 66 59298 → 22 [ACK] Seq=22653 Ack=33601 Win=3666 Len=0 TSval=3785256 TSecr=4381586
  124 5.187424825  10.6.15.144 → 192.168.1.16 TCP 66 22 → 59298 [ACK] Seq=33601 Ack=19757 Win=1452 Len=0 TSval=4381587 TSecr=3785240
  125 5.187432068 192.168.1.16 → 10.6.15.144  TCP 1514 [TCP Retransmission] 59298 → 22 [ACK] Seq=19757 Ack=33601 Win=3666 Len=1448 TSval=3785256 TSecr=4381587
  126 5.187436136 192.168.1.16 → 10.6.15.144  TCP 1514 [TCP Retransmission] 59298 → 22 [ACK] Seq=21205 Ack=33601 Win=3666 Len=1448 TSval=3785256 TSecr=4381587
  127 5.217517390  10.6.15.144 → 192.168.1.16 TCP 66 22 → 59298 [ACK] Seq=33601 Ack=21205 Win=1452 Len=0 TSval=4381591 TSecr=3785256
  128 5.217539517 192.168.1.16 → 10.6.15.144  SSH 1514 Client: Encrypted packet (len=1448)
  129 5.217556596  10.6.15.144 → 192.168.1.16 TCP 66 22 → 59298 [ACK] Seq=33601 Ack=22653 Win=1452 Len=0 TSval=4381591 TSecr=3785256
  130 5.217562159 192.168.1.16 → 10.6.15.144  SSH 1514 Client: Encrypted packet (len=1448)
  131 5.324022678 192.168.1.16 → 10.6.15.144  SSH 1514 Client: Encrypted packet (len=1448)
  132 5.362393458  10.6.15.144 → 192.168.1.16 SSH 1222 Server: Encrypted packet (len=1156)
  133 5.404023225 192.168.1.16 → 10.6.15.144  TCP 66 59298 → 22 [ACK] Seq=26997 Ack=34757 Win=3666 Len=0 TSval=3785311 TSecr=4381631
  134 5.468022072 192.168.1.16 → 10.6.15.144  SSH 1514 Client: Encrypted packet (len=1448)
  135 5.724030673 192.168.1.16 → 10.6.15.144  TCP 1514 [TCP Retransmission] 59298 → 22 [ACK] Seq=22653 Ack=34757 Win=3666 Len=1448 TSval=3785391 TSecr=4381631
  136 5.800502199  10.6.15.144 → 192.168.1.16 TCP 66 22 → 59298 [ACK] Seq=34757 Ack=24101 Win=1452 Len=0 TSval=4381741 TSecr=3785391
  137 5.800523480 192.168.1.16 → 10.6.15.144  SSH 1514 Client: Encrypted packet (len=1448)
  138 5.800536653 192.168.1.16 → 10.6.15.144  SSH 1514 Client: Encrypted packet (len=1448)
  139 5.830647253  10.6.15.144 → 192.168.1.16 TCP 78 [TCP Dup ACK 136#1] 22 → 59298 [ACK] Seq=34757 Ack=24101 Win=1452 Len=0 TSval=4381748 TSecr=3785391 SLE=28445 SRE=29893
  140 5.830667800 192.168.1.16 → 10.6.15.144  TCP 1514 [TCP Retransmission] 59298 → 22 [ACK] Seq=24101 Ack=34757 Win=3666 Len=1448 TSval=3785417 TSecr=4381748
  141 5.849037458  10.6.15.144 → 192.168.1.16 TCP 78 [TCP Dup ACK 136#2] 22 → 59298 [ACK] Seq=34757 Ack=24101 Win=1452 Len=0 TSval=4381748 TSecr=3785391 SLE=28445 SRE=31341
  142 5.849062356 192.168.1.16 → 10.6.15.144  TCP 1514 [TCP Retransmission] 59298 → 22 [ACK] Seq=25549 Ack=34757 Win=3666 Len=1448 TSval=3785422 TSecr=4381748
  143 6.104047727 192.168.1.16 → 10.6.15.144  TCP 1514 [TCP Retransmission] 59298 → 22 [ACK] Seq=24101 Ack=34757 Win=3666 Len=1448 TSval=3785486 TSecr=4381748
  144 6.114958815 10.22.18.209 → 224.0.0.252  LLMNR 64 Standard query 0xb445 A wpad
  145 6.174404813  10.6.15.144 → 192.168.1.16 TCP 78 [TCP Previous segment not captured] 22 → 59298 [ACK] Seq=35913 Ack=25549 Win=1441 Len=0 TSval=4381834 TSecr=3785486 SLE=28445 SRE=31341
  146 6.174430091 192.168.1.16 → 10.6.15.144  TCP 1514 [TCP Retransmission] 59298 → 22 [ACK] Seq=25549 Ack=34757 Win=3666 Len=1448 TSval=3785503 TSecr=4381748
  147 6.174445431 192.168.1.16 → 10.6.15.144  TCP 1514 [TCP Retransmission] 59298 → 22 [ACK] Seq=26997 Ack=34757 Win=3666 Len=1448 TSval=3785503 TSecr=4381748
  148 6.207756806 10.22.18.209 → 224.0.0.252  LLMNR 64 Standard query 0xb445 A wpad
  149 6.432029984 192.168.1.16 → 10.6.15.144  TCP 1514 [TCP Retransmission] 59298 → 22 [ACK] Seq=25549 Ack=34757 Win=3666 Len=1448 TSval=3785568 TSecr=4381748
  150 6.944027807 192.168.1.16 → 10.6.15.144  TCP 1514 [TCP Retransmission] 59298 → 22 [ACK] Seq=25549 Ack=34757 Win=3666 Len=1448 TSval=3785696 TSecr=4381748
  151 6.957146299  10.6.15.144 → 192.168.1.16 TCP 78 22 → 59298 [ACK] Seq=35913 Ack=26997 Win=1438 Len=0 TSval=4382030 TSecr=3785696 SLE=28445 SRE=31341
  152 6.957170406 192.168.1.16 → 10.6.15.144  SSH 1514 Client: Encrypted packet (len=1448)
  153 6.957184373 192.168.1.16 → 10.6.15.144  SSH 1514 Client: Encrypted packet (len=1448)
  154 7.017295400  10.6.15.144 → 192.168.1.16 TCP 78 [TCP Window Update] 22 → 59298 [ACK] Seq=35913 Ack=26997 Win=1439 Len=0 TSval=4382038 TSecr=3785696 SLE=28445 SRE=32789
  155 7.017316711 192.168.1.16 → 10.6.15.144  TCP 1514 [TCP Retransmission] 59298 → 22 [ACK] Seq=26997 Ack=34757 Win=3666 Len=1448 TSval=3785714 TSecr=4381748
  156 7.043752720  10.6.15.144 → 192.168.1.16 TCP 78 [TCP Dup ACK 151#1] 22 → 59298 [ACK] Seq=35913 Ack=26997 Win=1439 Len=0 TSval=4382047 TSecr=3785696 SLE=28445 SRE=34237
  157 7.043775649 192.168.1.16 → 10.6.15.144  SSH 1514 Client: Encrypted packet (len=1448)
  158 7.051550763  10.6.15.144 → 192.168.1.16 TCP 66 22 → 59298 [ACK] Seq=35913 Ack=34237 Win=1423 Len=0 TSval=4382053 TSecr=3785714
  159 7.051574348 192.168.1.16 → 10.6.15.144  SSH 1514 Client: Encrypted packet (len=1448)
  160 7.063040266  10.6.15.144 → 192.168.1.16 TCP 66 22 → 59298 [ACK] Seq=35913 Ack=35685 Win=1452 Len=0 TSval=4382055 TSecr=3785720
  161 7.063059618 192.168.1.16 → 10.6.15.144  SSH 422 Client: Encrypted packet (len=356)
  162 7.072204479  10.6.15.144 → 192.168.1.16 TCP 66 22 → 59298 [ACK] Seq=35913 Ack=37133 Win=1452 Len=0 TSval=4382059 TSecr=3785722
  163 7.076995413  10.6.15.144 → 192.168.1.16 TCP 66 22 → 59298 [ACK] Seq=35913 Ack=37489 Win=1452 Len=0 TSval=4382059 TSecr=3785725
  164 7.115776388  10.6.15.144 → 192.168.1.16 SSH 1222 Server: Encrypted packet (len=1156)
  165 7.115794670 192.168.1.16 → 10.6.15.144  TCP 78 [TCP Dup ACK 133#1] 59298 → 22 [ACK] Seq=37489 Ack=34757 Win=3666 Len=0 TSval=3785738 TSecr=4381748 SLE=35913 SRE=37069
  166 7.198288177 10.22.19.164 → 224.0.0.252  LLMNR 65 Standard query 0x41ad A https
  167 7.220479316  10.6.15.144 → 192.168.1.16 SSH 1222 Server: Encrypted packet (len=1156)
  168 7.220500419 192.168.1.16 → 10.6.15.144  TCP 78 [TCP Dup ACK 133#2] 59298 → 22 [ACK] Seq=37489 Ack=34757 Win=3666 Len=0 TSval=3785765 TSecr=4381748 SLE=35913 SRE=38225
  169 7.220859731  10.6.15.144 → 192.168.1.16 SSH 1222 Server: Encrypted packet (len=1156)
  170 7.220879269 192.168.1.16 → 10.6.15.144  TCP 78 [TCP Dup ACK 133#3] 59298 → 22 [ACK] Seq=37489 Ack=34757 Win=3666 Len=0 TSval=3785765 TSecr=4381748 SLE=35913 SRE=39381
  171 7.246469922  10.6.15.144 → 192.168.1.16 TCP 1222 [TCP Retransmission] 22 → 59298 [PSH, ACK] Seq=34757 Ack=37489 Win=1452 Len=1156 TSval=4382099 TSecr=3785765
  172 7.246498571 192.168.1.16 → 10.6.15.144  TCP 66 59298 → 22 [ACK] Seq=37489 Ack=39381 Win=3666 Len=0 TSval=3785771 TSecr=4382099
  173 7.246874492  10.6.15.144 → 192.168.1.16 SSH 1486 Server: Encrypted packet (len=1420)
  174 7.246882149 192.168.1.16 → 10.6.15.144  TCP 66 59298 → 22 [ACK] Seq=37489 Ack=40801 Win=3666 Len=0 TSval=3785771 TSecr=4382099
  175 7.259560256  10.6.15.144 → 192.168.1.16 SSH 1222 Server: Encrypted packet (len=1156)
  176 7.259577512 192.168.1.16 → 10.6.15.144  TCP 66 59298 → 22 [ACK] Seq=37489 Ack=41957 Win=3666 Len=0 TSval=3785774 TSecr=4382106
  177 8.997136006 10.22.19.164 → 224.0.0.252  LLMNR 65 Standard query 0x41ad A https
  178 10.362374855 192.168.1.16 → 54.76.71.168 TCP 128 42414 → 8282 [PSH, ACK] Seq=1 Ack=1 Win=296 Len=62 TSval=3786550 TSecr=607890495
  179 10.671679744 192.168.1.16 → 192.168.1.1  DNS 81 Standard query 0x5945 A 0.ubuntu.pool.ntp.org
  180 10.674040503 54.76.71.168 → 192.168.1.16 TCP 66 8282 → 42414 [ACK] Seq=1 Ack=63 Win=121 Len=0 TSval=607898528 TSecr=3786550
  181 10.686254304  192.168.1.1 → 192.168.1.16 DNS 145 Standard query response 0x5945 A 0.ubuntu.pool.ntp.org A 139.59.21.22 A 139.59.50.38 A 123.108.200.124 A 13.126.27.131
  182 10.686720547 192.168.1.16 → 139.59.21.22 NTP 90 NTP Version 4, client
  183 11.995179379 10.22.19.172 → 224.0.0.252  LLMNR 74 Standard query 0xb1d0 A hvvziwbucyytmh
  184 12.003213407 10.22.19.172 → 224.0.0.252  LLMNR 69 Standard query 0x5397 A qfkihuxwp
  185 12.003247621 10.22.19.172 → 224.0.0.252  LLMNR 69 Standard query 0x30ff A jppjbylhj
  186 12.994797339 10.22.19.172 → 224.0.0.252  LLMNR 69 Standard query 0x5397 A qfkihuxwp
  187 12.994836357 10.22.19.172 → 224.0.0.252  LLMNR 74 Standard query 0xb1d0 A hvvziwbucyytmh
  188 12.994851253 10.22.19.172 → 224.0.0.252  LLMNR 69 Standard query 0x30ff A jppjbylhj
  189 13.421222643 192.168.1.16 → 10.6.15.144  SSH 1514 Client: Encrypted packet (len=1448)
  190 13.438450363 192.168.1.16 → 10.6.15.144  SSH 374 Client: Encrypted packet (len=308)
  191 13.446944573 10.22.19.172 → 224.0.0.252  LLMNR 67 Standard query 0x9854 ANY KARANAM
  192 13.474264535  10.6.15.144 → 192.168.1.16 TCP 78 [TCP Dup ACK 163#1] 22 → 59298 [ACK] Seq=41957 Ack=37489 Win=1452 Len=0 TSval=4383659 TSecr=3785774 SLE=38937 SRE=39245
  193 13.664043694 192.168.1.16 → 10.6.15.144  TCP 1514 [TCP Retransmission] 59298 → 22 [ACK] Seq=37489 Ack=41957 Win=3666 Len=1448 TSval=3787376 TSecr=4383659
  194 13.677895591 10.22.19.172 → 224.0.0.252  LLMNR 67 Standard query 0x9854 ANY KARANAM
  195 13.688615965  10.6.15.144 → 192.168.1.16 TCP 66 22 → 59298 [ACK] Seq=41957 Ack=39245 Win=1446 Len=0 TSval=4383713 TSecr=3787376
  196 13.792368142  10.6.15.144 → 192.168.1.16 SSH 150 Server: Encrypted packet (len=84)
  197 13.812059909 192.168.1.16 → 10.6.15.144  TCP 66 59298 → 22 [ACK] Seq=39245 Ack=42041 Win=3666 Len=0 TSval=3787408 TSecr=4383739
  198 13.912346386  10.6.15.144 → 192.168.1.16 SSH 902 Server: Encrypted packet (len=836)
  199 13.912367024 192.168.1.16 → 10.6.15.144  TCP 66 59298 → 22 [ACK] Seq=39245 Ack=42877 Win=3666 Len=0 TSval=3787438 TSecr=4383769
  200 13.912997755  10.6.15.144 → 192.168.1.16 SSH 542 Server: Encrypted packet (len=476)
  201 13.913017789 192.168.1.16 → 10.6.15.144  TCP 66 59298 → 22 [ACK] Seq=39245 Ack=43353 Win=3666 Len=0 TSval=3787438 TSecr=4383769
  202 13.915485726 192.168.1.16 → 10.6.15.144  SSH 142 Client: Encrypted packet (len=76)
  203 13.943973568  10.6.15.144 → 192.168.1.16 TCP 66 22 → 59298 [ACK] Seq=43353 Ack=39321 Win=1452 Len=0 TSval=4383777 TSecr=3787438
  204 13.975474075 10.22.18.209 → 224.0.0.252  LLMNR 64 Standard query 0xe3ec A wpad
  205 14.073983567 10.22.18.209 → 224.0.0.252  LLMNR 64 Standard query 0xe3ec A wpad
  206 14.087128851 10.22.19.172 → 224.0.0.252  LLMNR 67 Standard query 0xb000 ANY KARANAM
  207 14.175619303 10.22.19.164 → 224.0.0.252  LLMNR 64 Standard query 0xe8e5 A wpad
  208 14.978034106 10.22.19.172 → 224.0.0.252  LLMNR 67 Standard query 0xb000 ANY KARANAM
  209 14.978073562 10.22.19.164 → 224.0.0.252  LLMNR 64 Standard query 0xe8e5 A wpad
  210 14.978083231 10.22.19.172 → 224.0.0.252  LLMNR 64 Standard query 0x7dfd A wpad
  211 14.994614071 10.22.19.172 → 224.0.0.252  LLMNR 74 Standard query 0x9512 A hvvziwbucyytmh
  212 14.995658796 10.22.19.172 → 224.0.0.252  LLMNR 69 Standard query 0x4dfe A jppjbylhj
  213 14.995689793 10.22.19.172 → 224.0.0.252  LLMNR 69 Standard query 0xc274 A qfkihuxwp
  214 15.671477892 192.168.1.16 → 192.168.1.1  DNS 81 Standard query 0xf76e A 3.ubuntu.pool.ntp.org
  215 15.674063718 10.22.19.172 → 224.0.0.252  LLMNR 64 Standard query 0x7dfd A wpad
  216 15.675206723 10.22.19.172 → 224.0.0.252  LLMNR 74 Standard query 0x9512 A hvvziwbucyytmh
  217 15.678462840 10.22.19.172 → 224.0.0.252  LLMNR 69 Standard query 0x4dfe A jppjbylhj
  218 15.678843710 10.22.19.172 → 224.0.0.252  LLMNR 69 Standard query 0xc274 A qfkihuxwp
  219 15.684066332  192.168.1.1 → 192.168.1.16 DNS 145 Standard query response 0xf76e A 3.ubuntu.pool.ntp.org A 139.59.50.38 A 13.126.27.131 A 139.59.21.22 A 123.108.200.124
  220 15.684566457 192.168.1.16 → 139.59.50.38 NTP 90 NTP Version 4, client
  221 15.686430633 192.168.1.16 → 192.168.1.1  DNS 81 Standard query 0x4c38 A 1.ubuntu.pool.ntp.org
  222 15.698855275  192.168.1.1 → 192.168.1.16 DNS 145 Standard query response 0x4c38 A 1.ubuntu.pool.ntp.org A 13.126.37.14 A 139.59.21.22 A 123.108.200.124 A 13.126.27.131
  223 15.699337922 192.168.1.16 → 13.126.37.14 NTP 90 NTP Version 4, client
  224 16.963495864  10.6.15.144 → 192.168.1.16 SSH 134 Server: Encrypted packet (len=68)
  225 16.963841403 192.168.1.16 → 10.6.15.144  SSH 102 Client: Encrypted packet (len=36)
  226 16.965969722  10.6.15.144 → 192.168.1.16 SSH 102 Server: Encrypted packet (len=36)
  227 16.966146357 192.168.1.16 → 10.6.15.144  SSH 102 Client: Encrypted packet (len=36)
  228 16.974411074  10.6.15.144 → 192.168.1.16 TCP 66 22 → 59298 [ACK] Seq=43457 Ack=39357 Win=1452 Len=0 TSval=4384534 TSecr=3788200
  229 16.974432242  10.6.15.144 → 192.168.1.16 SSH 102 Server: Encrypted packet (len=36)
  230 17.015567104  10.6.15.144 → 192.168.1.16 TCP 66 22 → 59298 [ACK] Seq=43493 Ack=39393 Win=1452 Len=0 TSval=4384545 TSecr=3788201
  231 17.015994373 192.168.1.16 → 10.6.15.144  TCP 66 59298 → 22 [ACK] Seq=39393 Ack=43493 Win=3666 Len=0 TSval=3788214 TSecr=4384534
  232 17.986621893  10.6.15.144 → 192.168.1.16 SSH 102 Server: [TCP Spurious Retransmission] , Encrypted packet (len=36)
  233 17.986640718 192.168.1.16 → 10.6.15.144  TCP 78 [TCP Dup ACK 231#1] 59298 → 22 [ACK] Seq=39393 Ack=43493 Win=3666 Len=0 TSval=3788456 TSecr=4384633 SLE=43457 SRE=43493
  234 17.986655454  10.6.15.144 → 192.168.1.16 SSH 126 Server: Encrypted packet (len=60)
  235 17.986666177 192.168.1.16 → 10.6.15.144  TCP 66 59298 → 22 [ACK] Seq=39393 Ack=43553 Win=3666 Len=0 TSval=3788456 TSecr=4384721
  236 17.986673411  10.6.15.144 → 192.168.1.16 SSH 102 Server: Encrypted packet (len=36)
  237 17.986678594 192.168.1.16 → 10.6.15.144  TCP 66 59298 → 22 [ACK] Seq=39393 Ack=43589 Win=3666 Len=0 TSval=3788456 TSecr=4384721
  238 20.966738866 10.22.18.209 → 224.0.0.252  LLMNR 64 Standard query 0x642a A wpad
  239 20.966771842 10.22.18.209 → 224.0.0.252  LLMNR 64 Standard query 0x642a A wpad
  240 21.965266903 192.168.1.16 → 239.255.255.250 SSDP 213 M-SEARCH * HTTP/1.1 
  241 21.973361723  10.6.15.144 → 192.168.1.16 SSH 126 Server: Encrypted packet (len=60)
  242 21.973387930 192.168.1.16 → 10.6.15.144  TCP 66 59298 → 22 [ACK] Seq=39393 Ack=43649 Win=3666 Len=0 TSval=3789453 TSecr=4385609
  243 21.973421052  10.6.15.144 → 192.168.1.16 SSH 102 Server: Encrypted packet (len=36)
  244 21.973430271 192.168.1.16 → 10.6.15.144  TCP 66 59298 → 22 [ACK] Seq=39393 Ack=43685 Win=3666 Len=0 TSval=3789453 TSecr=4385609
  245 21.973443576  10.6.15.144 → 192.168.1.16 SSH 126 Server: Encrypted packet (len=60)
  246 21.973449198 192.168.1.16 → 10.6.15.144  TCP 66 59298 → 22 [ACK] Seq=39393 Ack=43745 Win=3666 Len=0 TSval=3789453 TSecr=4385693
  247 21.984120894  10.6.15.144 → 192.168.1.16 SSH 390 Server: Encrypted packet (len=324)
  248 21.984144526 192.168.1.16 → 10.6.15.144  TCP 66 59298 → 22 [ACK] Seq=39393 Ack=44069 Win=3666 Len=0 TSval=3789456 TSecr=4385787
  249 22.088959511 10.22.17.200 → 224.0.0.252  LLMNR 64 Standard query 0xf1e5 A wpad
  250 22.088994509 10.22.17.200 → 224.0.0.252  LLMNR 64 Standard query 0x1a92 AAAA wpad
  251 22.965976694 192.168.1.16 → 239.255.255.250 SSDP 213 M-SEARCH * HTTP/1.1 
  252 22.977268913  10.6.15.144 → 192.168.1.16 SSH 126 Server: Encrypted packet (len=60)
  253 22.977288673 192.168.1.16 → 10.6.15.144  TCP 66 59298 → 22 [ACK] Seq=39393 Ack=44129 Win=3666 Len=0 TSval=3789704 TSecr=4385906
  254 22.979974428  10.6.15.144 → 192.168.1.16 SSH 134 Server: Encrypted packet (len=68)
  255 22.980000661 192.168.1.16 → 10.6.15.144  TCP 66 59298 → 22 [ACK] Seq=39393 Ack=44197 Win=3666 Len=0 TSval=3789705 TSecr=4385908
  256 22.983699479  10.6.15.144 → 192.168.1.16 SSH 138 Server: Encrypted packet (len=72)
  257 22.983718993 192.168.1.16 → 10.6.15.144  TCP 66 59298 → 22 [ACK] Seq=39393 Ack=44269 Win=3666 Len=0 TSval=3789705 TSecr=4385908
  258 22.983744626 10.22.17.200 → 224.0.0.252  LLMNR 64 Standard query 0xf1e5 A wpad
  259 22.983764414 10.22.17.200 → 224.0.0.252  LLMNR 64 Standard query 0x1a92 AAAA wpad
  260 23.966229969 192.168.1.16 → 239.255.255.250 SSDP 213 M-SEARCH * HTTP/1.1 
  261 23.971533070  10.22.17.84 → 224.0.0.252  LLMNR 64 Standard query 0x5ac9 A wpad
  262 24.965746493  10.22.17.84 → 224.0.0.252  LLMNR 64 Standard query 0x5ac9 A wpad
  263 24.967257847 192.168.1.16 → 239.255.255.250 SSDP 213 M-SEARCH * HTTP/1.1 
  264 25.985999666  10.6.15.144 → 192.168.1.16 SSH 102 Server: Encrypted packet (len=36)
  265 25.986018340 192.168.1.16 → 10.6.15.144  TCP 66 59298 → 22 [ACK] Seq=39393 Ack=44305 Win=3666 Len=0 TSval=3790456 TSecr=4386747
  266 25.988340641  10.6.15.144 → 192.168.1.16 SSH 126 Server: Encrypted packet (len=60)
  267 25.988358977 192.168.1.16 → 10.6.15.144  TCP 66 59298 → 22 [ACK] Seq=39393 Ack=44365 Win=3666 Len=0 TSval=3790457 TSecr=4386782
  268 25.992790582  10.6.15.144 → 192.168.1.16 SSH 102 Server: Encrypted packet (len=36)
  269 25.992807877 192.168.1.16 → 10.6.15.144  TCP 66 59298 → 22 [ACK] Seq=39393 Ack=44401 Win=3666 Len=0 TSval=3790458 TSecr=4386782
  270 27.009934772  10.6.15.144 → 192.168.1.16 SSH 102 Server: [TCP Spurious Retransmission] , Encrypted packet (len=36)
  271 27.009954717 192.168.1.16 → 10.6.15.144  TCP 78 [TCP Dup ACK 269#1] 59298 → 22 [ACK] Seq=39393 Ack=44401 Win=3666 Len=0 TSval=3790712 TSecr=4386982 SLE=44365 SRE=44401
