    1 0.000000000  10.6.15.144 → 192.168.1.16 SSH 582 Server: Encrypted packet (len=516)
    2 0.000027491 192.168.1.16 → 10.6.15.144  TCP 66 59298 → 22 [ACK] Seq=1 Ack=517 Win=3666 Len=0 TSval=3791952 TSecr=4387933
    3 0.000255383 10.22.17.245 → 224.0.0.252  LLMNR 67 Standard query 0xdbae ANY Redgaze
    4 0.001023873  10.6.15.144 → 192.168.1.16 SSH 582 Server: [TCP Spurious Retransmission] , Encrypted packet (len=516)
    5 0.001038581 192.168.1.16 → 10.6.15.144  TCP 78 [TCP Dup ACK 2#1] 59298 → 22 [ACK] Seq=1 Ack=517 Win=3666 Len=0 TSval=3791952 TSecr=4388073 SLE=1 SRE=517
    6 0.001052446 10.22.17.245 → 224.0.0.252  LLMNR 67 Standard query 0xdbae ANY Redgaze
    7 0.001077586 10.22.17.245 → 224.0.0.252  LLMNR 67 Standard query 0x07f9 ANY Redgaze
    8 0.002109715 192.168.1.16 → 10.6.15.144  SSH 138 Client: Encrypted packet (len=72)
    9 0.002642836 192.168.1.16 → 10.6.15.144  SSH 158 Client: Encrypted packet (len=92)
   10 0.015396607  10.6.15.144 → 192.168.1.16 SSH 102 Server: Encrypted packet (len=36)
   11 0.015419792 192.168.1.16 → 10.6.15.144  SSH 1514 Client: Encrypted packet (len=1448)
   12 0.028934503  10.6.15.144 → 192.168.1.16 TCP 66 22 → 59298 [ACK] Seq=553 Ack=1613 Win=1452 Len=0 TSval=4388290 TSecr=3791953
   13 0.028943563 192.168.1.16 → 10.6.15.144  SSH 366 Client: Encrypted packet (len=300)
   14 0.043523794  10.6.15.144 → 192.168.1.16 SSH 110 Server: Encrypted packet (len=44)
   15 0.043841671 192.168.1.16 → 10.6.15.144  SSH 278 Client: Encrypted packet (len=212)
   16 0.060345714  10.6.15.144 → 192.168.1.16 SSH 102 Server: Encrypted packet (len=36)
   17 0.060362454  10.6.15.144 → 192.168.1.16 SSH 102 Server: Encrypted packet (len=36)
   18 0.060407188 192.168.1.16 → 10.6.15.144  TCP 66 59298 → 22 [ACK] Seq=2125 Ack=669 Win=3666 Len=0 TSval=3791967 TSecr=4388298
   19 0.060690865 192.168.1.16 → 10.6.15.144  SSH 158 Client: Encrypted packet (len=92)
   20 0.094630593  10.6.15.144 → 192.168.1.16 SSH 138 Server: Encrypted packet (len=72)
   21 0.094652977  10.6.15.144 → 192.168.1.16 TCP 78 [TCP Dup ACK 14#1] 22 → 59298 [ACK] Seq=741 Ack=1913 Win=1452 Len=0 TSval=4388307 TSecr=3791959 SLE=2125 SRE=2217
   22 0.094665764 192.168.1.16 → 10.6.15.144  SSH 398 Client: Encrypted packet (len=332)
   23 0.105265460  10.6.15.144 → 192.168.1.16 TCP 78 [TCP Dup ACK 14#2] 22 → 59298 [ACK] Seq=741 Ack=1913 Win=1452 Len=0 TSval=4388310 TSecr=3791959 SLE=2125 SRE=2549
   24 0.105285034 192.168.1.16 → 10.6.15.144  SSH 474 Client: Encrypted packet (len=408)
   25 0.117297048  10.6.15.144 → 192.168.1.16 TCP 78 [TCP Dup ACK 14#3] 22 → 59298 [ACK] Seq=741 Ack=1913 Win=1452 Len=0 TSval=4388312 TSecr=3791959 SLE=2125 SRE=2957
   26 0.117307326 192.168.1.16 → 10.6.15.144  SSH 278 Client: [TCP Fast Retransmission] , Encrypted packet (len=212)
   27 0.130907346  10.6.15.144 → 192.168.1.16 TCP 66 22 → 59298 [ACK] Seq=741 Ack=2957 Win=1444 Len=0 TSval=4388316 TSecr=3791981
   28 0.164441202  10.6.15.144 → 192.168.1.16 SSH 1514 Server: Encrypted packet (len=1448)
   29 0.164881572  10.6.15.144 → 192.168.1.16 SSH 1422 Server: Encrypted packet (len=1356)
   30 0.164889833 192.168.1.16 → 10.6.15.144  TCP 66 59298 → 22 [ACK] Seq=2957 Ack=3545 Win=3666 Len=0 TSval=3791993 TSecr=4388324
   31 0.165006844  10.6.15.144 → 192.168.1.16 SSH 542 Server: Encrypted packet (len=476)
   32 0.165219190  10.6.15.144 → 192.168.1.16 SSH 626 Server: Encrypted packet (len=560)
   33 0.165237145 192.168.1.16 → 10.6.15.144  TCP 66 59298 → 22 [ACK] Seq=2957 Ack=4581 Win=3666 Len=0 TSval=3791993 TSecr=4388324
   34 0.165885962 192.168.1.16 → 10.6.15.144  SSH 222 Client: Encrypted packet (len=156)
   35 0.167474403 192.168.1.16 → 10.6.15.144  SSH 206 Client: Encrypted packet (len=140)
   36 0.176772243  10.6.15.144 → 192.168.1.16 SSH 446 Server: Encrypted packet (len=380)
   37 0.211846227  10.6.15.144 → 192.168.1.16 TCP 66 22 → 59298 [ACK] Seq=4961 Ack=3113 Win=1452 Len=0 TSval=4388337 TSecr=3791994
   38 0.211867140 192.168.1.16 → 10.6.15.144  SSH 346 Client: Encrypted packet (len=280)
   39 0.221918733  10.6.15.144 → 192.168.1.16 SSH 350 Server: Encrypted packet (len=284)
   40 0.265491657 192.168.1.16 → 10.6.15.144  TCP 66 59298 → 22 [ACK] Seq=3533 Ack=5245 Win=3666 Len=0 TSval=3792019 TSecr=4388339
   41 0.276605699 10.22.17.245 → 224.0.0.252  LLMNR 67 Standard query 0x07f9 ANY Redgaze
   42 0.281446837 192.168.1.16 → 10.6.15.144  TCP 346 [TCP Retransmission] 59298 → 22 [PSH, ACK] Seq=3253 Ack=5245 Win=3666 Len=280 TSval=3792023 TSecr=4388339
   43 0.334414844  10.6.15.144 → 192.168.1.16 TCP 78 [TCP Dup ACK 37#1] 22 → 59298 [ACK] Seq=5245 Ack=3113 Win=1452 Len=0 TSval=4388367 TSecr=3791994 SLE=3253 SRE=3533
   44 0.413664877  10.6.15.144 → 192.168.1.16 SSH 1066 Server: Encrypted packet (len=988)
   45 0.413739371 192.168.1.16 → 10.6.15.144  TCP 66 59298 → 22 [ACK] Seq=3533 Ack=6233 Win=3666 Len=0 TSval=3792056 TSecr=4388387
   46 0.418265656 192.168.1.16 → 10.6.15.144  SSH 1514 Client: Encrypted packet (len=1448)
   47 0.428769240  10.6.15.144 → 192.168.1.16 TCP 78 [TCP Dup ACK 37#2] 22 → 59298 [ACK] Seq=6233 Ack=3113 Win=1452 Len=0 TSval=4388391 TSecr=3791994 SLE=3253 SRE=4981
   48 0.428780631 192.168.1.16 → 10.6.15.144  SSH 206 Client: Encrypted packet (len=140)
   49 0.439968671  10.6.15.144 → 192.168.1.16 TCP 78 [TCP Dup ACK 37#3] 22 → 59298 [ACK] Seq=6233 Ack=3113 Win=1452 Len=0 TSval=4388393 TSecr=3791994 SLE=3253 SRE=5121
   50 0.439989614 192.168.1.16 → 10.6.15.144  SSH 206 Client: [TCP Fast Retransmission] , Encrypted packet (len=140)
   51 0.451362934  10.6.15.144 → 192.168.1.16 TCP 66 22 → 59298 [ACK] Seq=6233 Ack=5121 Win=1441 Len=0 TSval=4388396 TSecr=3792062
   52 0.465117068  10.6.15.144 → 192.168.1.16 SSH 518 Server: Encrypted packet (len=452)
   53 0.466163243 192.168.1.16 → 10.6.15.144  SSH 206 Client: Encrypted packet (len=140)
   54 0.482510688  10.6.15.144 → 192.168.1.16 SSH 318 Server: Encrypted packet (len=252)
   55 0.486034177  10.6.15.144 → 192.168.1.16 SSH 318 Server: Encrypted packet (len=252)
   56 0.486074381  10.6.15.144 → 192.168.1.16 SSH 318 Server: Encrypted packet (len=252)
   57 0.486117821 192.168.1.16 → 10.6.15.144  TCP 66 59298 → 22 [ACK] Seq=5261 Ack=7441 Win=3666 Len=0 TSval=3792074 TSecr=4388404
   58 0.693491061 192.168.1.16 → 10.6.15.144  TCP 206 [TCP Retransmission] 59298 → 22 [PSH, ACK] Seq=5121 Ack=7441 Win=3666 Len=140 TSval=3792126 TSecr=4388404
   59 0.703649823 10.22.17.245 → 224.0.0.252  LLMNR 67 Standard query 0x0481 ANY Redgaze
   60 0.793624408  10.6.15.144 → 192.168.1.16 SSH 318 Server: Encrypted packet (len=252)
   61 0.837465954 192.168.1.16 → 10.6.15.144  TCP 66 59298 → 22 [ACK] Seq=5261 Ack=7693 Win=3666 Len=0 TSval=3792162 TSecr=4388482
   62 0.880446239  10.6.15.144 → 192.168.1.16 SSH 1478 Server: Encrypted packet (len=1412)
   63 0.880470989 192.168.1.16 → 10.6.15.144  TCP 66 59298 → 22 [ACK] Seq=5261 Ack=9105 Win=3666 Len=0 TSval=3792172 TSecr=4388503
   64 0.880861615  10.6.15.144 → 192.168.1.16 SSH 1514 Server: Encrypted packet (len=1448)
   65 0.880869329 192.168.1.16 → 10.6.15.144  TCP 66 59298 → 22 [ACK] Seq=5261 Ack=10553 Win=3666 Len=0 TSval=3792172 TSecr=4388503
   66 0.880881774  10.6.15.144 → 192.168.1.16 SSH 110 Server: Encrypted packet (len=44)
   67 0.880886654 192.168.1.16 → 10.6.15.144  TCP 66 59298 → 22 [ACK] Seq=5261 Ack=10597 Win=3666 Len=0 TSval=3792172 TSecr=4388503
   68 0.881384311  10.6.15.144 → 192.168.1.16 SSH 1514 Server: Encrypted packet (len=1448)
   69 0.881394799 192.168.1.16 → 10.6.15.144  TCP 66 59298 → 22 [ACK] Seq=5261 Ack=12045 Win=3666 Len=0 TSval=3792172 TSecr=4388503
   70 0.890337551 192.168.1.16 → 10.6.15.144  SSH 1514 Client: Encrypted packet (len=1448)
   71 0.895332695 192.168.1.16 → 10.6.15.144  SSH 222 Client: Encrypted packet (len=156)
   72 0.900076402  10.6.15.144 → 192.168.1.16 SSH 1514 Server: Encrypted packet (len=1448)
   73 0.900552753  10.6.15.144 → 192.168.1.16 SSH 1514 Server: Encrypted packet (len=1448)
   74 0.900565970 192.168.1.16 → 10.6.15.144  TCP 66 59298 → 22 [ACK] Seq=6865 Ack=14941 Win=3666 Len=0 TSval=3792177 TSecr=4388507
   75 0.901030787  10.6.15.144 → 192.168.1.16 SSH 1514 Server: Encrypted packet (len=1448)
   76 0.901509264  10.6.15.144 → 192.168.1.16 SSH 1514 Server: Encrypted packet (len=1448)
   77 0.901522635 192.168.1.16 → 10.6.15.144  TCP 66 59298 → 22 [ACK] Seq=6865 Ack=17837 Win=3666 Len=0 TSval=3792178 TSecr=4388507
   78 0.911282147  10.6.15.144 → 192.168.1.16 TCP 66 22 → 59298 [ACK] Seq=17837 Ack=6865 Win=1452 Len=0 TSval=4388511 TSecr=3792175
   79 2.016770578 10.22.17.245 → 224.0.0.252  LLMNR 67 Standard query 0x0481 ANY Redgaze
   80 2.017120405  10.6.15.144 → 192.168.1.16 SSH 1514 Server: Encrypted packet (len=1448)
   81 2.017133794 10.22.19.172 → 224.0.0.252  LLMNR 66 Standard query 0xf4e2 A DELL35
   82 2.026076817 10.22.19.172 → 224.0.0.252  LLMNR 66 Standard query 0xa989 AAAA DELL35
   83 2.026103902 10.22.19.172 → 224.0.0.252  LLMNR 66 Standard query 0xf4e2 A DELL35
   84 2.061435720 192.168.1.16 → 10.6.15.144  TCP 66 59298 → 22 [ACK] Seq=6865 Ack=19285 Win=3666 Len=0 TSval=3792468 TSecr=4388563
   85 2.115921645 10.22.17.245 → 224.0.0.252  LLMNR 67 Standard query 0x36c7 ANY Redgaze
   86 2.124950201  10.6.15.144 → 192.168.1.16 SSH 1514 Server: Encrypted packet (len=1448)
   87 2.124970729 192.168.1.16 → 10.6.15.144  TCP 66 59298 → 22 [ACK] Seq=6865 Ack=20733 Win=3666 Len=0 TSval=3792483 TSecr=4388814
   88 2.125254298  10.6.15.144 → 192.168.1.16 SSH 1514 Server: Encrypted packet (len=1448)
   89 2.125258309 192.168.1.16 → 10.6.15.144  TCP 66 59298 → 22 [ACK] Seq=6865 Ack=22181 Win=3666 Len=0 TSval=3792483 TSecr=4388814
   90 2.141770209  10.6.15.144 → 192.168.1.16 SSH 1514 Server: [TCP Previous segment not captured] , Encrypted packet (len=1448)
   91 2.141787367 192.168.1.16 → 10.6.15.144  TCP 78 [TCP Dup ACK 89#1] 59298 → 22 [ACK] Seq=6865 Ack=22181 Win=3666 Len=0 TSval=3792488 TSecr=4388814 SLE=23629 SRE=25077
   92 2.142079631  10.6.15.144 → 192.168.1.16 SSH 1514 Server: Encrypted packet (len=1448)
   93 2.142087681 192.168.1.16 → 10.6.15.144  TCP 78 [TCP Dup ACK 89#2] 59298 → 22 [ACK] Seq=6865 Ack=22181 Win=3666 Len=0 TSval=3792488 TSecr=4388814 SLE=23629 SRE=26525
   94 2.153757490  10.6.15.144 → 192.168.1.16 SSH 1514 Server: Encrypted packet (len=1448)
   95 2.153776964 192.168.1.16 → 10.6.15.144  TCP 78 [TCP Dup ACK 89#3] 59298 → 22 [ACK] Seq=6865 Ack=22181 Win=3666 Len=0 TSval=3792491 TSecr=4388814 SLE=23629 SRE=27973
   96 2.154036065  10.6.15.144 → 192.168.1.16 SSH 1514 Server: Encrypted packet (len=1448)
   97 2.154042464 192.168.1.16 → 10.6.15.144  TCP 78 [TCP Dup ACK 89#4] 59298 → 22 [ACK] Seq=6865 Ack=22181 Win=3666 Len=0 TSval=3792491 TSecr=4388814 SLE=23629 SRE=29421
   98 2.154149570  10.6.15.144 → 192.168.1.16 SSH 606 Server: Encrypted packet (len=540)
   99 2.154159348 192.168.1.16 → 10.6.15.144  TCP 78 [TCP Dup ACK 89#5] 59298 → 22 [ACK] Seq=6865 Ack=22181 Win=3666 Len=0 TSval=3792491 TSecr=4388814 SLE=23629 SRE=29961
  100 2.166318612  10.6.15.144 → 192.168.1.16 SSH 1514 Server: [TCP Fast Retransmission] , Encrypted packet (len=1448)
  101 2.166343338 192.168.1.16 → 10.6.15.144  TCP 66 59298 → 22 [ACK] Seq=6865 Ack=29961 Win=3666 Len=0 TSval=3792494 TSecr=4388825
  102 2.182149006 192.168.1.16 → 10.6.15.144  SSH 1514 Client: Encrypted packet (len=1448)
  103 2.182489522 192.168.1.16 → 10.6.15.144  SSH 1514 Client: Encrypted packet (len=1448)
  104 2.197330263  10.6.15.144 → 192.168.1.16 TCP 66 22 → 59298 [ACK] Seq=29961 Ack=9761 Win=1452 Len=0 TSval=4388833 TSecr=3792498
  105 2.197355842 192.168.1.16 → 10.6.15.144  SSH 378 Client: Encrypted packet (len=312)
  106 2.246818239  10.6.15.144 → 192.168.1.16 TCP 66 22 → 59298 [ACK] Seq=29961 Ack=10073 Win=1452 Len=0 TSval=4388845 TSecr=3792501
  107 2.283669112 192.168.1.16 → 10.6.15.144  SSH 1514 Client: Encrypted packet (len=1448)
  108 2.285312952 192.168.1.16 → 10.6.15.144  SSH 1514 Client: Encrypted packet (len=1448)
  109 2.310566059 192.168.1.16 → 10.6.15.144  SSH 1514 Client: Encrypted packet (len=1448)
  110 2.310579539 192.168.1.16 → 10.6.15.144  SSH 1514 Client: Encrypted packet (len=1448)
  111 2.372055170  10.6.15.144 → 192.168.1.16 SSH 1446 Server: Encrypted packet (len=1380)
  112 2.383854960  10.6.15.144 → 192.168.1.16 TCP 78 [TCP Dup ACK 106#1] 22 → 59298 [ACK] Seq=31341 Ack=10073 Win=1452 Len=0 TSval=4388879 TSecr=3792501 SLE=12969 SRE=15865
  113 2.383876136 192.168.1.16 → 10.6.15.144  TCP 1514 [TCP Retransmission] 59298 → 22 [ACK] Seq=10073 Ack=31341 Win=3666 Len=1448 TSval=3792548 TSecr=4388876
  114 2.403309342  10.6.15.144 → 192.168.1.16 TCP 78 22 → 59298 [ACK] Seq=31341 Ack=11521 Win=1441 Len=0 TSval=4388884 TSecr=3792548 SLE=12969 SRE=15865
  115 2.403332361 192.168.1.16 → 10.6.15.144  TCP 1514 [TCP Retransmission] 59298 → 22 [ACK] Seq=11521 Ack=31341 Win=3666 Len=1448 TSval=3792553 TSecr=4388884
  116 2.403346145 192.168.1.16 → 10.6.15.144  SSH 1514 Client: Encrypted packet (len=1448)
  117 2.414765755  10.6.15.144 → 192.168.1.16 TCP 66 22 → 59298 [ACK] Seq=31341 Ack=15865 Win=1438 Len=0 TSval=4388887 TSecr=3792553
  118 2.414789507 192.168.1.16 → 10.6.15.144  SSH 1514 Client: Encrypted packet (len=1448)
  119 2.422844118  10.6.15.144 → 192.168.1.16 TCP 66 22 → 59298 [ACK] Seq=31341 Ack=17313 Win=1452 Len=0 TSval=4388887 TSecr=3792553
  120 2.422865649 192.168.1.16 → 10.6.15.144  SSH 1514 Client: Encrypted packet (len=1448)
  121 2.422878540 192.168.1.16 → 10.6.15.144  SSH 1514 Client: Encrypted packet (len=1448)
  122 2.423320049  10.6.15.144 → 192.168.1.16 SSH 1414 Server: Encrypted packet (len=1348)
  123 2.465490364 192.168.1.16 → 10.6.15.144  TCP 66 59298 → 22 [ACK] Seq=21657 Ack=32689 Win=3666 Len=0 TSval=3792569 TSecr=4388888
  124 2.468203294  10.6.15.144 → 192.168.1.16 TCP 66 22 → 59298 [ACK] Seq=32689 Ack=18761 Win=1452 Len=0 TSval=4388901 TSecr=3792556
  125 2.468225423 192.168.1.16 → 10.6.15.144  SSH 1514 Client: Encrypted packet (len=1448)
  126 2.535145482  10.6.15.144 → 192.168.1.16 TCP 78 [TCP Dup ACK 124#1] 22 → 59298 [ACK] Seq=32689 Ack=18761 Win=1452 Len=0 TSval=4388917 TSecr=3792556 SLE=21657 SRE=23105
  127 2.535166975 192.168.1.16 → 10.6.15.144  SSH 1514 Client: Encrypted packet (len=1448)
  128 2.548365465  10.6.15.144 → 192.168.1.16 TCP 78 [TCP Dup ACK 124#2] 22 → 59298 [ACK] Seq=32689 Ack=18761 Win=1452 Len=0 TSval=4388920 TSecr=3792556 SLE=21657 SRE=24553
  129 2.548387372 192.168.1.16 → 10.6.15.144  SSH 1514 Client: [TCP Fast Retransmission] , Encrypted packet (len=1448)
  130 2.569904540  10.6.15.144 → 192.168.1.16 TCP 78 22 → 59298 [ACK] Seq=32689 Ack=20209 Win=1441 Len=0 TSval=4388926 TSecr=3792589 SLE=21657 SRE=24553
  131 2.569927651 192.168.1.16 → 10.6.15.144  TCP 1514 [TCP Retransmission] 59298 → 22 [ACK] Seq=20209 Ack=32689 Win=3666 Len=1448 TSval=3792595 TSecr=4388926
  132 2.569941331 192.168.1.16 → 10.6.15.144  SSH 1138 Client: Encrypted packet (len=1072)
  133 2.578299163  10.6.15.144 → 192.168.1.16 SSH 1234 Server: Encrypted packet (len=1156)
  134 2.578380198 192.168.1.16 → 10.6.15.144  TCP 66 59298 → 22 [ACK] Seq=25625 Ack=33845 Win=3666 Len=0 TSval=3792597 TSecr=4388928
  135 2.591240307  10.6.15.144 → 192.168.1.16 SSH 1234 Server: Encrypted packet (len=1156)
  136 2.591303022  10.6.15.144 → 192.168.1.16 TCP 66 22 → 59298 [ACK] Seq=35001 Ack=24553 Win=1438 Len=0 TSval=4388931 TSecr=3792595
  137 2.591314478 192.168.1.16 → 10.6.15.144  SSH 1514 Client: Encrypted packet (len=1448)
  138 2.594315769  10.6.15.144 → 192.168.1.16 TCP 66 22 → 59298 [ACK] Seq=35001 Ack=25625 Win=1452 Len=0 TSval=4388932 TSecr=3792595
  139 2.594335857 192.168.1.16 → 10.6.15.144  SSH 1514 Client: Encrypted packet (len=1448)
  140 2.604681107  10.6.15.144 → 192.168.1.16 TCP 66 22 → 59298 [ACK] Seq=35001 Ack=27073 Win=1452 Len=0 TSval=4388934 TSecr=3792600
  141 2.604703323 192.168.1.16 → 10.6.15.144  SSH 1514 Client: Encrypted packet (len=1448)
  142 2.610199614  10.6.15.144 → 192.168.1.16 TCP 66 22 → 59298 [ACK] Seq=35001 Ack=28521 Win=1452 Len=0 TSval=4388935 TSecr=3792601
  143 2.610221842 192.168.1.16 → 10.6.15.144  SSH 1514 Client: Encrypted packet (len=1448)
  144 2.629675002  10.6.15.144 → 192.168.1.16 TCP 66 22 → 59298 [ACK] Seq=35001 Ack=29969 Win=1452 Len=0 TSval=4388939 TSecr=3792603
  145 2.629696264 192.168.1.16 → 10.6.15.144  SSH 534 Client: Encrypted packet (len=468)
  146 2.664621694  10.6.15.144 → 192.168.1.16 SSH 1222 Server: Encrypted packet (len=1156)
  147 2.666779147 192.168.1.16 → 10.6.15.144  SSH 1514 Client: Encrypted packet (len=1448)
  148 2.725504772 192.168.1.16 → 10.6.15.144  SSH 1514 Client: Encrypted packet (len=1448)
  149 2.742938177  10.6.15.144 → 192.168.1.16 SSH 1222 Server: Encrypted packet (len=1156)
  150 2.745196878  10.6.15.144 → 192.168.1.16 TCP 78 [TCP Dup ACK 144#1] 22 → 59298 [ACK] Seq=37313 Ack=29969 Win=1452 Len=0 TSval=4388967 TSecr=3792603 SLE=31885 SRE=33333
  151 2.751270389  10.6.15.144 → 192.168.1.16 TCP 78 [TCP Dup ACK 144#2] 22 → 59298 [ACK] Seq=37313 Ack=29969 Win=1452 Len=0 TSval=4388971 TSecr=3792603 SLE=31885 SRE=34781
  152 2.751285686 192.168.1.16 → 10.6.15.144  SSH 1514 Client: [TCP Fast Retransmission] , Encrypted packet (len=1448)
  153 2.763338134  10.6.15.144 → 192.168.1.16 SSH 1234 Server: Encrypted packet (len=1156)
  154 2.763345961 192.168.1.16 → 10.6.15.144  TCP 534 [TCP Retransmission] 59298 → 22 [PSH, ACK] Seq=31417 Ack=37313 Win=3666 Len=468 TSval=3792643 TSecr=4388973
  155 2.766589116  10.6.15.144 → 192.168.1.16 SSH 1234 Server: Encrypted packet (len=1156)
  156 2.766612335 192.168.1.16 → 10.6.15.144  TCP 66 59298 → 22 [ACK] Seq=34781 Ack=39625 Win=3666 Len=0 TSval=3792644 TSecr=4388973
  157 2.772761291  10.6.15.144 → 192.168.1.16 TCP 78 22 → 59298 [ACK] Seq=39625 Ack=31417 Win=1441 Len=0 TSval=4388977 TSecr=3792640 SLE=31885 SRE=34781
  158 2.772782648 192.168.1.16 → 10.6.15.144  SSH 1514 Client: Encrypted packet (len=1448)
  159 2.774350003  10.6.15.144 → 192.168.1.16 TCP 66 22 → 59298 [ACK] Seq=39625 Ack=34781 Win=1438 Len=0 TSval=4388977 TSecr=3792643
  160 2.774360494 192.168.1.16 → 10.6.15.144  SSH 366 Client: Encrypted packet (len=300)
  161 2.783829509  10.6.15.144 → 192.168.1.16 TCP 66 22 → 59298 [ACK] Seq=39625 Ack=36229 Win=1452 Len=0 TSval=4388980 TSecr=3792645
  162 2.785996917  10.6.15.144 → 192.168.1.16 TCP 66 22 → 59298 [ACK] Seq=39625 Ack=36529 Win=1452 Len=0 TSval=4388980 TSecr=3792646
  163 2.788171897  10.6.15.144 → 192.168.1.16 SSH 1222 Server: Encrypted packet (len=1156)
  164 2.829492793 192.168.1.16 → 10.6.15.144  TCP 66 59298 → 22 [ACK] Seq=36529 Ack=40781 Win=3666 Len=0 TSval=3792660 TSecr=4388980
  165 3.999558247  10.6.15.144 → 192.168.1.16 SSH 1222 Server: Encrypted packet (len=1156)
  166 3.999583836 192.168.1.16 → 10.6.15.144  TCP 66 59298 → 22 [ACK] Seq=36529 Ack=41937 Win=3666 Len=0 TSval=3792952 TSecr=4389019
  167 3.999785564  10.6.15.144 → 192.168.1.16 SSH 1222 Server: Encrypted packet (len=1156)
  168 3.999792631 192.168.1.16 → 10.6.15.144  TCP 66 59298 → 22 [ACK] Seq=36529 Ack=43093 Win=3666 Len=0 TSval=3792952 TSecr=4389020
  169 4.000020937 10.22.17.201 → 224.0.0.252  LLMNR 64 Standard query 0x4cf6 A wpad
  170 4.011943601  10.6.15.144 → 192.168.1.16 SSH 1222 Server: [TCP Spurious Retransmission] , Encrypted packet (len=1156)
  171 4.011960685 192.168.1.16 → 10.6.15.144  TCP 78 [TCP Dup ACK 168#1] 59298 → 22 [ACK] Seq=36529 Ack=43093 Win=3666 Len=0 TSval=3792955 TSecr=4389052 SLE=41937 SRE=43093
  172 4.012418494  10.6.15.144 → 192.168.1.16 SSH 1494 Server: Encrypted packet (len=1428)
  173 4.012425549 192.168.1.16 → 10.6.15.144  TCP 66 59298 → 22 [ACK] Seq=36529 Ack=44521 Win=3666 Len=0 TSval=3792955 TSecr=4389070
  174 4.012437731 10.22.17.201 → 224.0.0.252  LLMNR 64 Standard query 0x4cf6 A wpad
  175 4.012447055 10.22.18.209 → 224.0.0.252  LLMNR 64 Standard query 0x7768 A wpad
  176 4.012846915  10.6.15.144 → 192.168.1.16 TCP 1222 [TCP Out-Of-Order] 22 → 59298 [PSH, ACK] Seq=40781 Ack=36529 Win=1452 Len=1156 TSval=4389245 TSecr=3792660
  177 4.012855172 192.168.1.16 → 10.6.15.144  TCP 78 [TCP Dup ACK 173#1] 59298 → 22 [ACK] Seq=36529 Ack=44521 Win=3666 Len=0 TSval=3792955 TSecr=4389070 SLE=40781 SRE=41937
  178 4.012865596 10.22.18.209 → 224.0.0.252  LLMNR 64 Standard query 0x7768 A wpad
  179 4.012879282  10.22.17.84 → 224.0.0.252  LLMNR 64 Standard query 0x6ea1 A wpad
  180 5.023427609  10.22.17.84 → 224.0.0.252  LLMNR 64 Standard query 0x6ea1 A wpad
  181 11.007975422  10.6.15.144 → 192.168.1.16 SSH 174 Server: Encrypted packet (len=108)
  182 11.007989555 192.168.1.16 → 10.6.15.144  TCP 66 59298 → 22 [ACK] Seq=36529 Ack=44629 Win=3666 Len=0 TSval=3794704 TSecr=4390904
  183 11.008000777  10.6.15.144 → 192.168.1.16 SSH 102 Server: Encrypted packet (len=36)
  184 11.008004779 192.168.1.16 → 10.6.15.144  TCP 66 59298 → 22 [ACK] Seq=36529 Ack=44665 Win=3666 Len=0 TSval=3794704 TSecr=4390904
  185 11.889493841 192.168.1.16 → 10.6.15.144  SSH 1514 Client: Encrypted packet (len=1448)
  186 11.900782657 192.168.1.16 → 10.6.15.144  SSH 382 Client: Encrypted packet (len=316)
  187 11.911315659  10.6.15.144 → 192.168.1.16 TCP 66 22 → 59298 [ACK] Seq=44665 Ack=38293 Win=1452 Len=0 TSval=4391261 TSecr=3794925
  188 11.915006720  10.6.15.144 → 192.168.1.16 SSH 142 Server: Encrypted packet (len=76)
  189 11.915024183 192.168.1.16 → 10.6.15.144  TCP 66 59298 → 22 [ACK] Seq=38293 Ack=44741 Win=3666 Len=0 TSval=3794931 TSecr=4391262
  190 13.023496423 10.22.18.209 → 224.0.0.252  LLMNR 64 Standard query 0xfbce A wpad
  191 13.023593490  10.6.15.144 → 192.168.1.16 SSH 934 Server: Encrypted packet (len=868)
  192 13.023614286 192.168.1.16 → 10.6.15.144  TCP 66 59298 → 22 [ACK] Seq=38293 Ack=45609 Win=3666 Len=0 TSval=3795208 TSecr=4391292
  193 13.024585234  10.6.15.144 → 192.168.1.16 SSH 718 Server: Encrypted packet (len=652)
  194 13.024605084 192.168.1.16 → 10.6.15.144  TCP 66 59298 → 22 [ACK] Seq=38293 Ack=46261 Win=3666 Len=0 TSval=3795208 TSecr=4391293
  195 13.025368529 10.22.18.209 → 224.0.0.252  LLMNR 64 Standard query 0xfbce A wpad
  196 13.025482503 192.168.1.16 → 10.6.15.144  SSH 142 Client: Encrypted packet (len=76)
  197 13.027228427  10.6.15.144 → 192.168.1.16 SSH 718 Server: [TCP Spurious Retransmission] , Encrypted packet (len=652)
  198 13.027251358 192.168.1.16 → 10.6.15.144  TCP 78 [TCP Dup ACK 194#1] 59298 → 22 [ACK] Seq=38369 Ack=46261 Win=3666 Len=0 TSval=3795209 TSecr=4391429 SLE=45609 SRE=46261
  199 13.071705320  10.6.15.144 → 192.168.1.16 TCP 66 22 → 59298 [ACK] Seq=46261 Ack=38369 Win=1452 Len=0 TSval=4391552 TSecr=3795209
  200 15.007488087 10.22.19.172 → 224.0.0.252  LLMNR 64 Standard query 0x6544 A wpad
  201 15.007512170 10.22.19.172 → 224.0.0.252  LLMNR 64 Standard query 0x6544 A wpad
  202 18.015611121  10.22.18.17 → 224.0.0.252  LLMNR 64 Standard query 0x8003 A wpad
  203 18.030607628  10.22.18.17 → 224.0.0.252  LLMNR 64 Standard query 0x8003 A wpad
  204 18.701556715 192.168.1.16 → 192.168.1.1  DNS 81 Standard query 0x4163 A 2.ubuntu.pool.ntp.org
  205 20.000084313  192.168.1.1 → 192.168.1.16 DNS 145 Standard query response 0x4163 A 2.ubuntu.pool.ntp.org A 13.126.37.14 A 139.59.50.38 A 13.126.27.131 A 123.108.200.124
  206 20.000123555 10.22.18.209 → 224.0.0.252  LLMNR 64 Standard query 0x04fa A wpad
  207 20.001114935 192.168.1.16 → 13.126.37.14 NTP 90 NTP Version 4, client
  208 20.036452104 10.22.18.209 → 224.0.0.252  LLMNR 64 Standard query 0x04fa A wpad
  209 21.023595467  10.6.15.144 → 192.168.1.16 SSH 314 Server: Encrypted packet (len=248)
  210 21.023638217 192.168.1.16 → 10.6.15.144  TCP 66 59298 → 22 [ACK] Seq=38369 Ack=46509 Win=3666 Len=0 TSval=3797208 TSecr=4393323
  211 21.023666858  10.6.15.144 → 192.168.1.16 SSH 174 Server: Encrypted packet (len=108)
  212 21.023677337 192.168.1.16 → 10.6.15.144  TCP 66 59298 → 22 [ACK] Seq=38369 Ack=46617 Win=3666 Len=0 TSval=3797208 TSecr=4393323
  213 21.023690538  10.6.15.144 → 192.168.1.16 SSH 102 Server: Encrypted packet (len=36)
  214 21.023695266 192.168.1.16 → 10.6.15.144  TCP 66 59298 → 22 [ACK] Seq=38369 Ack=46653 Win=3666 Len=0 TSval=3797208 TSecr=4393330
  215 23.999478853 10.22.17.245 → 224.0.0.252  LLMNR 67 Standard query 0xae78 ANY Redgaze
  216 24.001179741 10.22.17.245 → 224.0.0.252  LLMNR 67 Standard query 0xae78 ANY Redgaze
  217 24.253470055 192.168.1.16 → 54.76.71.168 TCP 66 42414 → 8282 [ACK] Seq=1 Ack=1 Win=296 Len=0 TSval=3798016 TSecr=607898528
  218 24.255325095 10.22.17.245 → 224.0.0.252  LLMNR 67 Standard query 0xa33c ANY Redgaze
  219 26.015527291 54.76.71.168 → 192.168.1.16 TCP 66 [TCP ACKed unseen segment] 8282 → 42414 [ACK] Seq=1 Ack=2 Win=121 Len=0 TSval=607909993 TSecr=3786550
  220 26.015913226 10.22.17.245 → 224.0.0.252  LLMNR 67 Standard query 0xa33c ANY Redgaze
  221 26.016612601 10.22.17.245 → 224.0.0.252  LLMNR 67 Standard query 0x9ab5 ANY Redgaze
  222 26.019373012 10.22.17.245 → 224.0.0.252  LLMNR 67 Standard query 0x9ab5 ANY Redgaze
  223 27.007476611 10.22.17.245 → 224.0.0.252  LLMNR 67 Standard query 0xa2e2 ANY Redgaze
  224 27.009250099 10.22.17.245 → 224.0.0.252  LLMNR 64 Standard query 0xa47c A wpad
  225 27.009300637 10.22.17.245 → 224.0.0.252  LLMNR 64 Standard query 0x4b6d A wpad
  226 27.009311878 10.22.17.245 → 224.0.0.252  LLMNR 67 Standard query 0xa2e2 ANY Redgaze
  227 27.009322708 10.22.17.245 → 224.0.0.252  LLMNR 64 Standard query 0xa47c A wpad
  228 27.009335097 10.22.17.245 → 224.0.0.252  LLMNR 64 Standard query 0x4b6d A wpad
  229 27.999539274 10.22.18.199 → 224.0.0.252  LLMNR 64 Standard query 0x003a A wpad
  230 27.999576168 10.22.18.199 → 224.0.0.252  LLMNR 64 Standard query 0x003a A wpad
  231 28.699566728 192.168.1.16 → 91.189.89.198 NTP 90 NTP Version 4, client
