    1 0.000000000 192.168.1.16 → 10.6.15.144  SSH 426 Client: Encrypted packet (len=360)
    2 0.928005298 192.168.1.16 → 10.6.15.144  TCP 426 [TCP Retransmission] 59298 → 22 [PSH, ACK] Seq=1 Ack=1 Win=3666 Len=360 TSval=3799696 TSecr=4395640
    3 0.929847548  10.22.18.17 → 224.0.0.252  LLMNR 64 Standard query 0x6d7f A wpad
    4 0.930228701  10.22.18.17 → 224.0.0.252  LLMNR 64 Standard query 0x5b85 AAAA wpad
    5 0.930648086  10.22.18.17 → 224.0.0.252  LLMNR 64 Standard query 0x5b85 AAAA wpad
    6 0.931033720  10.22.18.17 → 224.0.0.252  LLMNR 64 Standard query 0x6d7f A wpad
    7 0.938906855  10.6.15.144 → 192.168.1.16 TCP 66 [TCP ACKed unseen segment] 22 → 59298 [ACK] Seq=1 Ack=1493 Win=1446 Len=0 TSval=4396030 TSecr=3799696
    8 0.940063503  10.6.15.144 → 192.168.1.16 SSH 246 Server: [TCP ACKed unseen segment] , Encrypted packet (len=180)
    9 0.940085769 192.168.1.16 → 10.6.15.144  TCP 66 [TCP Previous segment not captured] 59298 → 22 [ACK] Seq=1493 Ack=181 Win=3666 Len=0 TSval=3799699 TSecr=4396030
   10 1.954046937  10.6.15.144 → 192.168.1.16 SSH 582 Server: [TCP ACKed unseen segment] , Encrypted packet (len=516)
   11 1.954063536 192.168.1.16 → 10.6.15.144  TCP 66 59298 → 22 [ACK] Seq=1493 Ack=697 Win=3666 Len=0 TSval=3799952 TSecr=4396073
   12 1.956470638 192.168.1.16 → 10.6.15.144  SSH 158 Client: Encrypted packet (len=92)
   13 1.957783723 192.168.1.16 → 10.6.15.144  SSH 162 Client: Encrypted packet (len=96)
   14 1.988687798  10.6.15.144 → 192.168.1.16 TCP 66 22 → 59298 [ACK] Seq=697 Ack=1681 Win=1452 Len=0 TSval=4396292 TSecr=3799953
   15 1.988708315 192.168.1.16 → 10.6.15.144  SSH 1514 Client: Encrypted packet (len=1448)
   16 1.988722439 192.168.1.16 → 10.6.15.144  SSH 198 Client: Encrypted packet (len=132)
   17 2.009591131  10.6.15.144 → 192.168.1.16 TCP 78 [TCP Dup ACK 14#1] 22 → 59298 [ACK] Seq=697 Ack=1681 Win=1452 Len=0 TSval=4396297 TSecr=3799953 SLE=3129 SRE=3261
   18 2.015671073  10.6.15.144 → 192.168.1.16 TCP 66 22 → 59298 [ACK] Seq=697 Ack=3261 Win=1451 Len=0 TSval=4396299 TSecr=3799961
   19 2.018474065  10.6.15.144 → 192.168.1.16 SSH 146 Server: Encrypted packet (len=80)
   20 2.018769635 192.168.1.16 → 10.6.15.144  SSH 278 Client: Encrypted packet (len=212)
   21 2.023538935  10.6.15.144 → 192.168.1.16 SSH 102 Server: Encrypted packet (len=36)
   22 2.024124018 192.168.1.16 → 10.6.15.144  SSH 714 Client: Encrypted packet (len=648)
   23 2.034400179  10.6.15.144 → 192.168.1.16 TCP 66 22 → 59298 [ACK] Seq=813 Ack=4121 Win=1452 Len=0 TSval=4396304 TSecr=3799968
   24 2.068014695  10.6.15.144 → 192.168.1.16 SSH 1514 Server: Encrypted packet (len=1448)
   25 2.068313344  10.6.15.144 → 192.168.1.16 SSH 1414 Server: Encrypted packet (len=1348)
   26 2.068330858 192.168.1.16 → 10.6.15.144  TCP 66 59298 → 22 [ACK] Seq=4121 Ack=3609 Win=3666 Len=0 TSval=3799981 TSecr=4396312
   27 2.068352408  10.6.15.144 → 192.168.1.16 SSH 626 Server: Encrypted packet (len=560)
   28 2.069394357 192.168.1.16 → 10.6.15.144  SSH 222 Client: Encrypted packet (len=156)
   29 2.072867388 192.168.1.16 → 10.6.15.144  SSH 206 Client: Encrypted packet (len=140)
   30 2.131980476 192.168.1.16 → 10.6.15.144  TCP 206 [TCP Retransmission] 59298 → 22 [PSH, ACK] Seq=4277 Ack=4169 Win=3666 Len=140 TSval=3799997 TSecr=4396312
   31 2.228538331  10.6.15.144 → 192.168.1.16 SSH 474 Server: Encrypted packet (len=396)
   32 2.229524812 192.168.1.16 → 10.6.15.144  SSH 206 Client: Encrypted packet (len=140)
   33 2.239663411  10.6.15.144 → 192.168.1.16 TCP 78 [TCP Dup ACK 23#1] 22 → 59298 [ACK] Seq=4565 Ack=4121 Win=1452 Len=0 TSval=4396355 TSecr=3799968 SLE=4277 SRE=4557
   34 2.364020378 192.168.1.16 → 10.6.15.144  TCP 222 [TCP Retransmission] 59298 → 22 [PSH, ACK] Seq=4121 Ack=4565 Win=3666 Len=156 TSval=3800055 TSecr=4396355
   35 2.366850766  10.6.15.144 → 192.168.1.16 SSH 1066 Server: Encrypted packet (len=988)
   36 2.375172535  10.6.15.144 → 192.168.1.16 TCP 66 22 → 59298 [ACK] Seq=5553 Ack=4557 Win=1452 Len=0 TSval=4396389 TSecr=3800055
   37 2.375192672 192.168.1.16 → 10.6.15.144  SSH 1514 Client: Encrypted packet (len=1448)
   38 2.375203506 192.168.1.16 → 10.6.15.144  SSH 206 Client: Encrypted packet (len=140)
   39 2.385533799  10.6.15.144 → 192.168.1.16 TCP 66 22 → 59298 [ACK] Seq=5553 Ack=6145 Win=1452 Len=0 TSval=4396392 TSecr=3800057
   40 2.407000607  10.6.15.144 → 192.168.1.16 SSH 602 Server: Encrypted packet (len=536)
   41 2.416008837  10.6.15.144 → 192.168.1.16 SSH 318 Server: Encrypted packet (len=252)
   42 2.416064383 192.168.1.16 → 10.6.15.144  TCP 66 59298 → 22 [ACK] Seq=6145 Ack=6341 Win=3666 Len=0 TSval=3800068 TSecr=4396397
   43 3.969978882 10.22.17.245 → 224.0.0.252  LLMNR 64 Standard query 0x6506 A wpad
   44 3.972217379 10.22.17.245 → 224.0.0.252  LLMNR 64 Standard query 0xe1cd A wpad
   45 3.972587795  10.6.15.144 → 192.168.1.16 SSH 1478 Server: Encrypted packet (len=1412)
   46 3.972845181  10.6.15.144 → 192.168.1.16 SSH 1514 Server: Encrypted packet (len=1448)
   47 3.972853421 192.168.1.16 → 10.6.15.144  TCP 66 59298 → 22 [ACK] Seq=6145 Ack=9201 Win=3666 Len=0 TSval=3800457 TSecr=4396505
   48 3.973163017  10.6.15.144 → 192.168.1.16 SSH 1514 Server: Encrypted packet (len=1448)
   49 3.973173142 10.22.17.245 → 224.0.0.252  LLMNR 64 Standard query 0x6506 A wpad
   50 3.973186158 10.22.17.245 → 224.0.0.252  LLMNR 64 Standard query 0xe1cd A wpad
   51 3.973531089  10.6.15.144 → 192.168.1.16 SSH 1514 Server: Encrypted packet (len=1448)
   52 3.973547612 192.168.1.16 → 10.6.15.144  TCP 66 59298 → 22 [ACK] Seq=6145 Ack=12097 Win=3666 Len=0 TSval=3800457 TSecr=4396505
   53 3.973560467 10.22.17.245 → 224.0.0.252  LLMNR 70 Standard query 0x1972 A nnyeltdvly
   54 3.973570074 10.22.17.245 → 224.0.0.252  LLMNR 67 Standard query 0xdf69 A gglhyqm
   55 3.983851693 192.168.1.16 → 10.6.15.144  SSH 1514 Client: Encrypted packet (len=1448)
   56 3.985708404 192.168.1.16 → 10.6.15.144  SSH 222 Client: Encrypted packet (len=156)
   57 3.987199160 10.22.17.245 → 224.0.0.252  LLMNR 74 Standard query 0x3e9e A yhheuaztcgakwx
   58 3.987219648 10.22.17.245 → 224.0.0.252  LLMNR 70 Standard query 0x1972 A nnyeltdvly
   59 3.987241141 10.22.17.245 → 224.0.0.252  LLMNR 67 Standard query 0xdf69 A gglhyqm
   60 3.987261551 10.22.17.245 → 224.0.0.252  LLMNR 74 Standard query 0x3e9e A yhheuaztcgakwx
   61 4.027973956 192.168.1.16 → 10.6.15.144  TCP 222 [TCP Retransmission] 59298 → 22 [PSH, ACK] Seq=7593 Ack=12097 Win=3666 Len=156 TSval=3800471 TSecr=4396505
   62 4.251987532 192.168.1.16 → 10.6.15.144  TCP 1514 [TCP Retransmission] 59298 → 22 [ACK] Seq=6145 Ack=12097 Win=3666 Len=1448 TSval=3800527 TSecr=4396505
   63 4.367994027  10.6.15.144 → 192.168.1.16 TCP 78 [TCP Previous segment not captured] 22 → 59298 [ACK] Seq=16441 Ack=7749 Win=1452 Len=0 TSval=4396861 TSecr=3800471 SLE=6145 SRE=7593
   64 5.957317901  10.6.15.144 → 192.168.1.16 SSH 1514 Server: Encrypted packet (len=1448)
   65 5.957337482 192.168.1.16 → 10.6.15.144  TCP 78 [TCP Dup ACK 52#1] 59298 → 22 [ACK] Seq=7749 Ack=12097 Win=3666 Len=0 TSval=3800953 TSecr=4396505 SLE=16441 SRE=17889
   66 5.957354855 10.22.19.172 → 224.0.0.252  LLMNR 66 Standard query 0xf802 A DELL35
   67 5.957373625 10.22.19.172 → 224.0.0.252  LLMNR 66 Standard query 0x53af AAAA DELL35
   68 5.967885034  10.6.15.144 → 192.168.1.16 TCP 1514 [TCP Retransmission] 22 → 59298 [ACK] Seq=12097 Ack=7749 Win=1452 Len=1448 TSval=4397287 TSecr=3800953
   69 5.967900686 192.168.1.16 → 10.6.15.144  TCP 78 59298 → 22 [ACK] Seq=7749 Ack=13545 Win=3666 Len=0 TSval=3800955 TSecr=4397287 SLE=16441 SRE=17889
   70 7.970448424 10.22.17.245 → 224.0.0.252  LLMNR 64 Standard query 0x89bb A wpad
   71 7.970468809 10.22.17.245 → 224.0.0.252  LLMNR 64 Standard query 0xd71c A wpad
   72 8.962932145 10.22.17.245 → 224.0.0.252  LLMNR 64 Standard query 0x89bb A wpad
   73 8.962951810 10.22.17.245 → 224.0.0.252  LLMNR 64 Standard query 0xd71c A wpad
   74 8.963339980  10.6.15.144 → 192.168.1.16 SSH 1514 Server: [TCP Spurious Retransmission] , Encrypted packet (len=1448)
   75 8.963359482 192.168.1.16 → 10.6.15.144  TCP 86 [TCP Dup ACK 69#1] 59298 → 22 [ACK] Seq=7749 Ack=13545 Win=3666 Len=0 TSval=3801704 TSecr=4397964 SLE=12097 SRE=13545 SLE=16441 SRE=17889
   76 8.963436473 10.22.18.209 → 224.0.0.252  LLMNR 64 Standard query 0xe865 A wpad
   77 8.963456351 10.22.18.209 → 224.0.0.252  LLMNR 64 Standard query 0xe865 A wpad
   78 8.999416921  10.6.15.144 → 192.168.1.16 TCP 1514 [TCP Retransmission] 22 → 59298 [ACK] Seq=13545 Ack=7749 Win=1452 Len=1448 TSval=4398045 TSecr=3801704
   79 8.999443329 192.168.1.16 → 10.6.15.144  TCP 78 59298 → 22 [ACK] Seq=7749 Ack=14993 Win=3666 Len=0 TSval=3801713 TSecr=4398045 SLE=16441 SRE=17889
   80 8.999737483  10.6.15.144 → 192.168.1.16 TCP 1514 [TCP Retransmission] 22 → 59298 [ACK] Seq=14993 Ack=7749 Win=1452 Len=1448 TSval=4398045 TSecr=3801704
   81 8.999765771 192.168.1.16 → 10.6.15.144  TCP 66 59298 → 22 [ACK] Seq=7749 Ack=17889 Win=3666 Len=0 TSval=3801713 TSecr=4398045
   82 9.009475002  10.6.15.144 → 192.168.1.16 SSH 1514 Server: Encrypted packet (len=1448)
   83 9.009491753 192.168.1.16 → 10.6.15.144  TCP 66 59298 → 22 [ACK] Seq=7749 Ack=19337 Win=3666 Len=0 TSval=3801716 TSecr=4398047
   84 9.009784139  10.6.15.144 → 192.168.1.16 SSH 1514 Server: Encrypted packet (len=1448)
   85 9.009788194 192.168.1.16 → 10.6.15.144  TCP 66 59298 → 22 [ACK] Seq=7749 Ack=20785 Win=3666 Len=0 TSval=3801716 TSecr=4398047
   86 9.010104677  10.6.15.144 → 192.168.1.16 SSH 1514 Server: Encrypted packet (len=1448)
   87 9.010111426 192.168.1.16 → 10.6.15.144  TCP 66 59298 → 22 [ACK] Seq=7749 Ack=22233 Win=3666 Len=0 TSval=3801716 TSecr=4398047
   88 9.022356533  10.6.15.144 → 192.168.1.16 SSH 1514 Server: Encrypted packet (len=1448)
   89 9.022374044 192.168.1.16 → 10.6.15.144  TCP 66 59298 → 22 [ACK] Seq=7749 Ack=23681 Win=3666 Len=0 TSval=3801719 TSecr=4398050
   90 9.022672573  10.6.15.144 → 192.168.1.16 SSH 1514 Server: Encrypted packet (len=1448)
   91 9.022691120 192.168.1.16 → 10.6.15.144  TCP 66 59298 → 22 [ACK] Seq=7749 Ack=25129 Win=3666 Len=0 TSval=3801719 TSecr=4398050
   92 9.022958300  10.6.15.144 → 192.168.1.16 SSH 1514 Server: Encrypted packet (len=1448)
   93 9.022966625 192.168.1.16 → 10.6.15.144  TCP 66 59298 → 22 [ACK] Seq=7749 Ack=26577 Win=3666 Len=0 TSval=3801719 TSecr=4398050
   94 9.036061370  10.6.15.144 → 192.168.1.16 SSH 1514 Server: Encrypted packet (len=1448)
   95 9.036078079 192.168.1.16 → 10.6.15.144  TCP 66 59298 → 22 [ACK] Seq=7749 Ack=28025 Win=3666 Len=0 TSval=3801723 TSecr=4398054
   96 9.036093459  10.6.15.144 → 192.168.1.16 SSH 462 Server: Encrypted packet (len=396)
   97 9.036096124 192.168.1.16 → 10.6.15.144  TCP 66 59298 → 22 [ACK] Seq=7749 Ack=28421 Win=3666 Len=0 TSval=3801723 TSecr=4398054
   98 9.051639334 192.168.1.16 → 10.6.15.144  SSH 1514 Client: Encrypted packet (len=1448)
   99 9.053807928 192.168.1.16 → 10.6.15.144  SSH 1514 Client: Encrypted packet (len=1448)
  100 9.175973221 192.168.1.16 → 10.6.15.144  SSH 378 Client: Encrypted packet (len=312)
  101 9.600021995 192.168.1.16 → 10.6.15.144  TCP 1514 [TCP Retransmission] 59298 → 22 [ACK] Seq=7749 Ack=28421 Win=3666 Len=1448 TSval=3801864 TSecr=4398054
  102 9.605972563  10.6.15.144 → 192.168.1.16 TCP 78 [TCP Dup ACK 63#1] 22 → 59298 [ACK] Seq=28421 Ack=7749 Win=1452 Len=0 TSval=4398120 TSecr=3801719 SLE=10645 SRE=10957
  103 9.605994276 10.22.17.245 → 224.0.0.252  LLMNR 67 Standard query 0x25ab A gglhyqm
  104 9.606009756 10.22.17.245 → 224.0.0.252  LLMNR 70 Standard query 0x0fe8 A nnyeltdvly
  105 9.606218509 10.22.17.245 → 224.0.0.252  LLMNR 74 Standard query 0x9d7f A yhheuaztcgakwx
  106 9.614905759  10.6.15.144 → 192.168.1.16 TCP 78 22 → 59298 [ACK] Seq=28421 Ack=9197 Win=1446 Len=0 TSval=4398199 TSecr=3801864 SLE=10645 SRE=10957
  107 9.614927691 192.168.1.16 → 10.6.15.144  SSH 1514 Client: Encrypted packet (len=1448)
  108 10.368027369 192.168.1.16 → 10.6.15.144  TCP 1514 [TCP Retransmission] 59298 → 22 [ACK] Seq=9197 Ack=28421 Win=3666 Len=1448 TSval=3802056 TSecr=4398199
  109 10.370201949 10.22.17.245 → 224.0.0.252  LLMNR 70 Standard query 0x0fe8 A nnyeltdvly
  110 10.370275371 10.22.17.245 → 224.0.0.252  LLMNR 67 Standard query 0x25ab A gglhyqm
  111 10.370455437 10.22.17.245 → 224.0.0.252  LLMNR 74 Standard query 0x9d7f A yhheuaztcgakwx
  112 10.370603598 10.22.19.135 → 224.0.0.252  LLMNR 68 Standard query 0x3545 ANY Aneeshpc
  113 10.408756336  10.6.15.144 → 192.168.1.16 TCP 66 22 → 59298 [ACK] Seq=28421 Ack=10957 Win=1446 Len=0 TSval=4398397 TSecr=3802056
  114 10.408777920 192.168.1.16 → 10.6.15.144  SSH 1514 Client: Encrypted packet (len=1448)
  115 10.408790455 192.168.1.16 → 10.6.15.144  SSH 1514 Client: Encrypted packet (len=1448)
  116 10.418386638  10.6.15.144 → 192.168.1.16 TCP 78 [TCP Window Update] 22 → 59298 [ACK] Seq=28421 Ack=10957 Win=1452 Len=0 TSval=4398400 TSecr=3802056 SLE=12405 SRE=13853
  117 10.418406972 192.168.1.16 → 10.6.15.144  TCP 1514 [TCP Retransmission] 59298 → 22 [ACK] Seq=10957 Ack=28421 Win=3666 Len=1448 TSval=3802068 TSecr=4398400
  118 10.434637638  10.6.15.144 → 192.168.1.16 TCP 78 [TCP Dup ACK 113#1] 22 → 59298 [ACK] Seq=28421 Ack=10957 Win=1452 Len=0 TSval=4398400 TSecr=3802056 SLE=12405 SRE=15301
  119 10.434658551 192.168.1.16 → 10.6.15.144  SSH 1514 Client: Encrypted packet (len=1448)
  120 11.168052065 192.168.1.16 → 10.6.15.144  TCP 1514 [TCP Retransmission] 59298 → 22 [ACK] Seq=10957 Ack=28421 Win=3666 Len=1448 TSval=3802256 TSecr=4398400
  121 11.190182831  10.6.15.144 → 192.168.1.16 SSH 1458 Server: Encrypted packet (len=1380)
  122 11.190467198  10.6.15.144 → 192.168.1.16 SSH 1426 Server: Encrypted packet (len=1348)
  123 11.190485768 192.168.1.16 → 10.6.15.144  TCP 66 59298 → 22 [ACK] Seq=16749 Ack=31149 Win=3666 Len=0 TSval=3802261 TSecr=4398438
  124 11.190767889  10.6.15.144 → 192.168.1.16 SSH 1426 Server: [TCP Spurious Retransmission] , Encrypted packet (len=1348)
  125 11.190782853 192.168.1.16 → 10.6.15.144  TCP 78 [TCP Dup ACK 123#1] 59298 → 22 [ACK] Seq=16749 Ack=31149 Win=3666 Len=0 TSval=3802261 TSecr=4398529 SLE=29801 SRE=31149
  126 12.608044631 192.168.1.16 → 10.6.15.144  TCP 1514 [TCP Retransmission] 59298 → 22 [ACK] Seq=10957 Ack=31149 Win=3666 Len=1448 TSval=3802616 TSecr=4398529
  127 12.612812606 10.22.17.245 → 224.0.0.252  LLMNR 67 Standard query 0x80f6 ANY Redgaze
  128 12.613185709 10.22.17.245 → 224.0.0.252  LLMNR 67 Standard query 0x80f6 ANY Redgaze
  129 12.613571381 10.22.17.245 → 224.0.0.252  LLMNR 67 Standard query 0xb5f2 ANY Redgaze
  130 12.613982527  10.6.15.144 → 192.168.1.16 SSH 178 Server: Encrypted packet (len=100)
  131 12.614016080 192.168.1.16 → 10.6.15.144  TCP 66 59298 → 22 [ACK] Seq=16749 Ack=31249 Win=3666 Len=0 TSval=3802617 TSecr=4398901
  132 12.614629177  10.6.15.144 → 192.168.1.16 SSH 114 Server: Encrypted packet (len=36)
  133 12.614662321 192.168.1.16 → 10.6.15.144  TCP 66 59298 → 22 [ACK] Seq=16749 Ack=31285 Win=3666 Len=0 TSval=3802617 TSecr=4398901
  134 12.615020678 10.22.17.245 → 224.0.0.252  LLMNR 67 Standard query 0xb5f2 ANY Redgaze
  135 13.955545351  10.6.15.144 → 192.168.1.16 TCP 66 22 → 59298 [ACK] Seq=31285 Ack=15301 Win=1438 Len=0 TSval=4398987 TSecr=3802616
  136 13.955589547 192.168.1.16 → 10.6.15.144  SSH 1514 Client: Encrypted packet (len=1448)
  137 13.955614908 192.168.1.16 → 10.6.15.144  SSH 1514 Client: Encrypted packet (len=1448)
  138 14.088018289  10.6.15.144 → 192.168.1.16 SSH 1222 Server: [TCP Previous segment not captured] , Encrypted packet (len=1156)
  139 14.088041904  10.6.15.144 → 192.168.1.16 TCP 1222 [TCP Retransmission] 22 → 59298 [PSH, ACK] Seq=32441 Ack=15301 Win=1452 Len=1156 TSval=4399309 TSecr=3802616
  140 14.100051013 192.168.1.16 → 10.6.15.144  TCP 78 [TCP Dup ACK 133#1] 59298 → 22 [ACK] Seq=19645 Ack=31285 Win=3666 Len=0 TSval=3802986 TSecr=4398987 SLE=32441 SRE=33597
  141 14.100068088 192.168.1.16 → 10.6.15.144  TCP 86 [TCP Dup ACK 133#2] 59298 → 22 [ACK] Seq=19645 Ack=31285 Win=3666 Len=0 TSval=3802986 TSecr=4398987 SLE=32441 SRE=33597 SLE=32441 SRE=33597
  142 14.654021974 192.168.1.16 → 139.59.50.38 NTP 90 NTP Version 4, client
  143 15.744044048 192.168.1.16 → 10.6.15.144  TCP 1514 [TCP Retransmission] 59298 → 22 [ACK] Seq=15301 Ack=31285 Win=3666 Len=1436 TSval=3803400 TSecr=4398987 SLE=32441 SRE=33597
  144 16.961905697 10.22.18.209 → 224.0.0.252  LLMNR 64 Standard query 0x5fde A wpad
  145 16.962291637 10.22.18.209 → 224.0.0.252  LLMNR 64 Standard query 0x5fde A wpad
  146 16.963552484  10.6.15.144 → 192.168.1.16 TCP 1222 [TCP Retransmission] 22 → 59298 [PSH, ACK] Seq=31285 Ack=15301 Win=1452 Len=1156 TSval=4399984 TSecr=3802616
  147 16.963591483 192.168.1.16 → 10.6.15.144  TCP 66 59298 → 22 [ACK] Seq=19645 Ack=33597 Win=3666 Len=0 TSval=3803704 TSecr=4399984
  148 19.552034125 192.168.1.16 → 10.6.15.144  TCP 1514 [TCP Retransmission] 59298 → 22 [ACK] Seq=15301 Ack=33597 Win=3666 Len=1448 TSval=3804352 TSecr=4399984
  149 19.563649166  10.6.15.144 → 192.168.1.16 TCP 66 22 → 59298 [ACK] Seq=33597 Ack=16749 Win=1452 Len=0 TSval=4400686 TSecr=3804352
  150 19.563688219 192.168.1.16 → 10.6.15.144  SSH 1514 Client: Encrypted packet (len=1448)
  151 19.563710528 192.168.1.16 → 10.6.15.144  SSH 1514 Client: Encrypted packet (len=1448)
  152 19.574797611  10.6.15.144 → 192.168.1.16 TCP 78 [TCP Dup ACK 149#1] 22 → 59298 [ACK] Seq=33597 Ack=16749 Win=1452 Len=0 TSval=4400689 TSecr=3804352 SLE=19645 SRE=21093
  153 19.574817725 192.168.1.16 → 10.6.15.144  TCP 1514 [TCP Retransmission] 59298 → 22 [ACK] Seq=16749 Ack=33597 Win=3666 Len=1448 TSval=3804357 TSecr=4400689
  154 19.576130034  10.6.15.144 → 192.168.1.16 TCP 78 [TCP Dup ACK 149#2] 22 → 59298 [ACK] Seq=33597 Ack=16749 Win=1452 Len=0 TSval=4400689 TSecr=3804352 SLE=19645 SRE=22541
  155 19.576150839 192.168.1.16 → 10.6.15.144  TCP 1514 [TCP Retransmission] 59298 → 22 [ACK] Seq=18197 Ack=33597 Win=3666 Len=1448 TSval=3804358 TSecr=4400689
  156 19.586886743  10.6.15.144 → 192.168.1.16 TCP 78 22 → 59298 [ACK] Seq=33597 Ack=18197 Win=1441 Len=0 TSval=4400692 TSecr=3804357 SLE=19645 SRE=22541
  157 19.586909871 192.168.1.16 → 10.6.15.144  SSH 1514 Client: Encrypted packet (len=1448)
  158 19.607805233  10.6.15.144 → 192.168.1.16 TCP 66 22 → 59298 [ACK] Seq=33597 Ack=22541 Win=1438 Len=0 TSval=4400692 TSecr=3804358
  159 19.607827706 192.168.1.16 → 10.6.15.144  SSH 1514 Client: Encrypted packet (len=1448)
  160 19.629780963  10.6.15.144 → 192.168.1.16 SSH 110 Server: Encrypted packet (len=44)
  161 19.629809394 192.168.1.16 → 10.6.15.144  TCP 66 59298 → 22 [ACK] Seq=25437 Ack=33641 Win=3666 Len=0 TSval=3804371 TSecr=4400702
  162 19.654012030 192.168.1.16 → 13.126.27.131 NTP 90 NTP Version 4, client
  163 19.654077110 192.168.1.16 → 139.59.21.22 NTP 90 NTP Version 4, client
  164 19.764716078  10.6.15.144 → 192.168.1.16 SSH 1222 Server: Encrypted packet (len=1156)
  165 19.764743871 192.168.1.16 → 10.6.15.144  TCP 66 59298 → 22 [ACK] Seq=25437 Ack=34797 Win=3666 Len=0 TSval=3804405 TSecr=4400736
  166 19.904024129 192.168.1.16 → 10.6.15.144  SSH 1502 Client: Encrypted packet (len=1436)
  167 20.964902349  10.6.15.144 → 192.168.1.16 TCP 78 [TCP Dup ACK 158#1] 22 → 59298 [ACK] Seq=34797 Ack=22541 Win=1452 Len=0 TSval=4400802 TSecr=3804358 SLE=25437 SRE=26873
  168 20.965258339  10.6.15.144 → 192.168.1.16 SSH 1234 Server: Encrypted packet (len=1156)
  169 20.965317672 192.168.1.16 → 10.6.15.144  TCP 66 59298 → 22 [ACK] Seq=26873 Ack=35953 Win=3666 Len=0 TSval=3804705 TSecr=4400857
  170 21.568028983 192.168.1.16 → 10.6.15.144  TCP 1514 [TCP Retransmission] 59298 → 22 [ACK] Seq=22541 Ack=35953 Win=3666 Len=1448 TSval=3804856 TSecr=4400857
  171 21.580025221  10.6.15.144 → 192.168.1.16 TCP 78 22 → 59298 [ACK] Seq=35953 Ack=23989 Win=1446 Len=0 TSval=4401190 TSecr=3804856 SLE=25437 SRE=26873
  172 21.580046448 192.168.1.16 → 10.6.15.144  SSH 1502 Client: Encrypted packet (len=1436)
  173 21.580060235 192.168.1.16 → 10.6.15.144  SSH 1514 Client: Encrypted packet (len=1448)
  174 21.595836103  10.6.15.144 → 192.168.1.16 TCP 78 [TCP Window Update] 22 → 59298 [ACK] Seq=35953 Ack=23989 Win=1447 Len=0 TSval=4401194 TSecr=3804856 SLE=25437 SRE=28309
  175 21.595856284 192.168.1.16 → 10.6.15.144  TCP 1514 [TCP Retransmission] 59298 → 22 [ACK] Seq=23989 Ack=35953 Win=3666 Len=1448 TSval=3804862 TSecr=4401194
  176 21.597435123  10.6.15.144 → 192.168.1.16 TCP 78 [TCP Dup ACK 171#1] 22 → 59298 [ACK] Seq=35953 Ack=23989 Win=1447 Len=0 TSval=4401195 TSecr=3804856 SLE=25437 SRE=29757
  177 21.597456300 192.168.1.16 → 10.6.15.144  SSH 1514 Client: Encrypted packet (len=1448)
  178 21.606778623  10.6.15.144 → 192.168.1.16 TCP 66 22 → 59298 [ACK] Seq=35953 Ack=29757 Win=1431 Len=0 TSval=4401197 TSecr=3804862
  179 21.606801549 192.168.1.16 → 10.6.15.144  SSH 1514 Client: Encrypted packet (len=1448)
  180 21.609806926  10.6.15.144 → 192.168.1.16 TCP 66 22 → 59298 [ACK] Seq=35953 Ack=31205 Win=1452 Len=0 TSval=4401197 TSecr=3804863
  181 21.609828761 192.168.1.16 → 10.6.15.144  SSH 1514 Client: Encrypted packet (len=1448)
  182 21.609943151  10.6.15.144 → 192.168.1.16 SSH 142 Server: Encrypted packet (len=76)
  183 21.609952042 192.168.1.16 → 10.6.15.144  TCP 66 59298 → 22 [ACK] Seq=34101 Ack=36029 Win=3666 Len=0 TSval=3804866 TSecr=4401198
  184 21.620613898  10.6.15.144 → 192.168.1.16 TCP 66 22 → 59298 [ACK] Seq=36029 Ack=34101 Win=1452 Len=0 TSval=4401200 TSecr=3804865
  185 21.620634572 192.168.1.16 → 10.6.15.144  SSH 1514 Client: Encrypted packet (len=1448)
  186 21.620649105 192.168.1.16 → 10.6.15.144  SSH 1514 Client: Encrypted packet (len=1448)
  187 21.638006981  10.6.15.144 → 192.168.1.16 TCP 66 22 → 59298 [ACK] Seq=36029 Ack=36997 Win=1452 Len=0 TSval=4401205 TSecr=3804869
  188 21.638028134 192.168.1.16 → 10.6.15.144  SSH 1514 Client: Encrypted packet (len=1448)
  189 21.638041267 192.168.1.16 → 10.6.15.144  SSH 990 Client: Encrypted packet (len=924)
  190 21.660601304  10.6.15.144 → 192.168.1.16 TCP 66 22 → 59298 [ACK] Seq=36029 Ack=39369 Win=1452 Len=0 TSval=4401210 TSecr=3804873
  191 21.668906543  10.6.15.144 → 192.168.1.16 SSH 1514 Server: Encrypted packet (len=1448)
  192 21.669136890  10.6.15.144 → 192.168.1.16 SSH 1318 Server: Encrypted packet (len=1252)
  193 21.669147990 192.168.1.16 → 10.6.15.144  TCP 66 59298 → 22 [ACK] Seq=39369 Ack=38729 Win=3666 Len=0 TSval=3804881 TSecr=4401212
  194 21.670157236 192.168.1.16 → 10.6.15.144  SSH 222 Client: Encrypted packet (len=156)
  195 21.713882132  10.6.15.144 → 192.168.1.16 SSH 350 Server: Encrypted packet (len=284)
  196 21.724353747  10.6.15.144 → 192.168.1.16 SSH 1014 Server: Encrypted packet (len=948)
  197 21.724425785 192.168.1.16 → 10.6.15.144  TCP 66 59298 → 22 [ACK] Seq=39525 Ack=39961 Win=3666 Len=0 TSval=3804895 TSecr=4401224
  198 21.728439159  10.6.15.144 → 192.168.1.16 SSH 438 Server: Encrypted packet (len=372)
  199 21.728924962 192.168.1.16 → 10.6.15.144  SSH 142 Client: Encrypted packet (len=76)
  200 21.770143658  10.6.15.144 → 192.168.1.16 SSH 1222 Server: Encrypted packet (len=1156)
  201 21.773549036  10.6.15.144 → 192.168.1.16 SSH 1222 Server: Encrypted packet (len=1156)
  202 21.773569320 192.168.1.16 → 10.6.15.144  TCP 66 59298 → 22 [ACK] Seq=39601 Ack=42645 Win=3666 Len=0 TSval=3804907 TSecr=4401237
  203 21.821732565  10.6.15.144 → 192.168.1.16 SSH 1222 Server: [TCP Previous segment not captured] , Encrypted packet (len=1156)
  204 21.821744786 192.168.1.16 → 10.6.15.144  TCP 78 [TCP Dup ACK 202#1] 59298 → 22 [ACK] Seq=39601 Ack=42645 Win=3666 Len=0 TSval=3804919 TSecr=4401237 SLE=43801 SRE=44957
  205 21.831418015  10.6.15.144 → 192.168.1.16 SSH 1494 Server: Encrypted packet (len=1428)
  206 21.831439155 192.168.1.16 → 10.6.15.144  TCP 78 [TCP Dup ACK 202#2] 59298 → 22 [ACK] Seq=39601 Ack=42645 Win=3666 Len=0 TSval=3804921 TSecr=4401237 SLE=43801 SRE=46385
  207 22.978054968  10.6.15.144 → 192.168.1.16 SSH 194 Server: Encrypted packet (len=128)
  208 22.978084875 192.168.1.16 → 10.6.15.144  TCP 78 [TCP Dup ACK 202#3] 59298 → 22 [ACK] Seq=39601 Ack=42645 Win=3666 Len=0 TSval=3805208 TSecr=4401237 SLE=43801 SRE=46513
  209 22.978110173  10.6.15.144 → 192.168.1.16 SSH 138 Server: Encrypted packet (len=72)
  210 22.978115766 192.168.1.16 → 10.6.15.144  TCP 78 [TCP Dup ACK 202#4] 59298 → 22 [ACK] Seq=39601 Ack=42645 Win=3666 Len=0 TSval=3805208 TSecr=4401237 SLE=43801 SRE=46585
  211 22.990769519  10.6.15.144 → 192.168.1.16 SSH 1222 Server: [TCP Fast Retransmission] , Encrypted packet (len=1156)
  212 22.990802141 192.168.1.16 → 10.6.15.144  TCP 66 59298 → 22 [ACK] Seq=39601 Ack=46585 Win=3666 Len=0 TSval=3805211 TSecr=4401542
  213 22.990958663  10.6.15.144 → 192.168.1.16 SSH 1222 Server: Encrypted packet (len=1156)
  214 22.990962154 192.168.1.16 → 10.6.15.144  TCP 66 59298 → 22 [ACK] Seq=39601 Ack=47741 Win=3666 Len=0 TSval=3805211 TSecr=4401542
  215 23.976561007  10.6.15.144 → 192.168.1.16 SSH 1222 Server: [TCP Spurious Retransmission] , Encrypted packet (len=1156)
  216 23.976594310 192.168.1.16 → 10.6.15.144  TCP 78 [TCP Dup ACK 214#1] 59298 → 22 [ACK] Seq=39601 Ack=47741 Win=3666 Len=0 TSval=3805458 TSecr=4401717 SLE=46585 SRE=47741
  217 24.966737266 10.22.18.209 → 224.0.0.252  LLMNR 64 Standard query 0x8ffe A wpad
  218 24.966777046 10.22.18.209 → 224.0.0.252  LLMNR 64 Standard query 0x8ffe A wpad
  219 24.966785775  10.22.17.84 → 224.0.0.252  LLMNR 64 Standard query 0xf2da A wpad
  220 25.954117673  10.22.17.84 → 224.0.0.252  LLMNR 64 Standard query 0xf2da A wpad
  221 25.954400688  10.6.15.144 → 192.168.1.16 SSH 1222 Server: [TCP Spurious Retransmission] , Encrypted packet (len=1156)
  222 25.954428515 192.168.1.16 → 10.6.15.144  TCP 78 [TCP Dup ACK 214#2] 59298 → 22 [ACK] Seq=39601 Ack=47741 Win=3666 Len=0 TSval=3805952 TSecr=4402234 SLE=46585 SRE=47741
