    1 0.000000000 10.22.19.172 → 224.0.0.252  LLMNR 64 Standard query 0xfa96 A wpad
    2 0.000016850  10.6.15.144 → 192.168.1.16 SSH 138 Server: Encrypted packet (len=72)
    3 0.000027141  10.6.15.144 → 192.168.1.16 SSH 102 Server: Encrypted packet (len=36)
    4 0.000080274 192.168.1.16 → 10.6.15.144  TCP 66 59298 → 22 [ACK] Seq=1 Ack=109 Win=3666 Len=0 TSval=3911952 TSecr=4508143
    5 0.000445868 192.168.1.16 → 10.6.15.144  SSH 470 Client: Encrypted packet (len=404)
    6 0.001671523 192.168.1.16 → 10.6.15.144  SSH 498 Client: Encrypted packet (len=432)
    7 0.002357698 10.22.19.172 → 224.0.0.252  LLMNR 64 Standard query 0xfa96 A wpad
    8 0.002376284  10.6.15.144 → 192.168.1.16 SSH 102 Server: Encrypted packet (len=36)
    9 0.011126028  10.6.15.144 → 192.168.1.16 TCP 66 22 → 59298 [ACK] Seq=145 Ack=405 Win=1452 Len=0 TSval=4508289 TSecr=3911952
   10 0.019522155  10.6.15.144 → 192.168.1.16 TCP 66 22 → 59298 [ACK] Seq=145 Ack=837 Win=1452 Len=0 TSval=4508289 TSecr=3911953
   11 0.019584733  10.6.15.144 → 192.168.1.16 SSH 230 Server: Encrypted packet (len=164)
   12 0.019633145 192.168.1.16 → 10.6.15.144  TCP 66 59298 → 22 [ACK] Seq=837 Ack=309 Win=3666 Len=0 TSval=3911957 TSecr=4508235
   13 0.019648120  10.6.15.144 → 192.168.1.16 SSH 166 Server: Encrypted packet (len=100)
   14 0.020070809 192.168.1.16 → 10.6.15.144  SSH 302 Client: Encrypted packet (len=236)
   15 0.020937147 192.168.1.16 → 10.6.15.144  SSH 294 Client: Encrypted packet (len=228)
   16 0.031260309  10.6.15.144 → 192.168.1.16 TCP 66 22 → 59298 [ACK] Seq=409 Ack=1301 Win=1452 Len=0 TSval=4508294 TSecr=3911957
   17 0.994336337  10.6.15.144 → 192.168.1.16 SSH 1514 Server: Encrypted packet (len=1448)
   18 0.994844097  10.6.15.144 → 192.168.1.16 SSH 262 Server: Encrypted packet (len=196)
   19 0.994854943 192.168.1.16 → 10.6.15.144  TCP 66 59298 → 22 [ACK] Seq=1301 Ack=2053 Win=3666 Len=0 TSval=3912201 TSecr=4508339
   20 0.995485012  10.6.15.144 → 192.168.1.16 SSH 998 Server: Encrypted packet (len=932)
   21 0.996054366  10.6.15.144 → 192.168.1.16 TCP 998 [TCP Retransmission] 22 → 59298 [PSH, ACK] Seq=2053 Ack=1301 Win=1452 Len=932 TSval=4508409 TSecr=3911957
   22 0.996065205 192.168.1.16 → 10.6.15.144  TCP 78 59298 → 22 [ACK] Seq=1301 Ack=2985 Win=3666 Len=0 TSval=3912201 TSecr=4508409 SLE=2053 SRE=2985
   23 0.996487453 10.22.18.209 → 224.0.0.252  LLMNR 64 Standard query 0x513a A wpad
   24 0.996923569 192.168.1.16 → 10.6.15.144  SSH 146 Client: Encrypted packet (len=80)
   25 1.023659646 10.22.18.209 → 224.0.0.252  LLMNR 64 Standard query 0x513a A wpad
   26 1.225222504 192.168.1.16 → 10.6.15.144  TCP 146 [TCP Retransmission] 59298 → 22 [PSH, ACK] Seq=1301 Ack=2985 Win=3666 Len=80 TSval=3912258 TSecr=4508409
   27 1.228606913 10.22.18.169 → 224.0.0.252  LLMNR 64 Standard query 0x1fdf A wpad
   28 1.312661970  10.6.15.144 → 192.168.1.16 TCP 66 22 → 59298 [ACK] Seq=2985 Ack=1381 Win=1452 Len=0 TSval=4508612 TSecr=3912258
   29 1.474059140  10.6.15.144 → 192.168.1.16 SSH 110 Server: Encrypted packet (len=44)
   30 1.474091206  10.6.15.144 → 192.168.1.16 SSH 102 Server: Encrypted packet (len=36)
   31 1.493296548 192.168.1.16 → 10.6.15.144  TCP 66 59298 → 22 [ACK] Seq=1381 Ack=3065 Win=3666 Len=0 TSval=3912321 TSecr=4508654
   32 1.494069331 192.168.1.16 → 10.6.15.144  SSH 174 Client: Encrypted packet (len=108)
   33 1.497827235 192.168.1.16 → 10.6.15.144  SSH 158 Client: Encrypted packet (len=92)
   34 1.522462301  10.6.15.144 → 192.168.1.16 TCP 78 [TCP Dup ACK 28#1] 22 → 59298 [ACK] Seq=3065 Ack=1381 Win=1452 Len=0 TSval=4508665 TSecr=3912258 SLE=1489 SRE=1581
   35 1.605699657 10.22.18.169 → 224.0.0.252  LLMNR 64 Standard query 0x1fdf A wpad
   36 1.699202295 192.168.1.16 → 52.66.5.185  NTP 90 NTP Version 4, client
   37 1.709227431 192.168.1.16 → 10.6.15.144  TCP 174 [TCP Retransmission] 59298 → 22 [PSH, ACK] Seq=1381 Ack=3065 Win=3666 Len=108 TSval=3912380 TSecr=4508665
   38 1.722792261 10.119.73.122 → 192.168.1.16 ICMP 110 Destination unreachable (Communication administratively filtered)
   39 2.205249521 192.168.1.16 → 10.6.15.144  TCP 174 [TCP Retransmission] 59298 → 22 [PSH, ACK] Seq=1381 Ack=3065 Win=3666 Len=108 TSval=3912504 TSecr=4508665
   40 2.252624321  10.6.15.144 → 192.168.1.16 TCP 66 22 → 59298 [ACK] Seq=3065 Ack=1581 Win=1452 Len=0 TSval=4508847 TSecr=3912504
   41 4.013963196  10.6.15.144 → 192.168.1.16 SSH 1514 Server: Encrypted packet (len=1448)
   42 4.014209952  10.6.15.144 → 192.168.1.16 SSH 1334 Server: Encrypted packet (len=1268)
   43 4.014226326 192.168.1.16 → 10.6.15.144  TCP 66 59298 → 22 [ACK] Seq=1581 Ack=5781 Win=3666 Len=0 TSval=3912956 TSecr=4508900
   44 4.014480862  10.6.15.144 → 192.168.1.16 SSH 1394 Server: Encrypted packet (len=1328)
   45 4.015449691 192.168.1.16 → 10.6.15.144  SSH 214 Client: Encrypted packet (len=148)
   46 4.018742161 192.168.1.16 → 10.6.15.144  SSH 206 Client: Encrypted packet (len=140)
   47 4.054453881  10.6.15.144 → 192.168.1.16 TCP 78 [TCP Dup ACK 40#1] 22 → 59298 [ACK] Seq=7109 Ack=1581 Win=1452 Len=0 TSval=4509300 TSecr=3912956 SLE=1729 SRE=1869
   48 4.054475301 192.168.1.16 → 10.6.15.144  SSH 626 Client: Encrypted packet (len=560)
   49 4.069890151  10.6.15.144 → 192.168.1.16 TCP 78 [TCP Dup ACK 40#2] 22 → 59298 [ACK] Seq=7109 Ack=1581 Win=1452 Len=0 TSval=4509304 TSecr=3912956 SLE=1729 SRE=2429
   50 4.253253666 192.168.1.16 → 10.6.15.144  TCP 214 [TCP Retransmission] 59298 → 22 [PSH, ACK] Seq=1581 Ack=7109 Win=3666 Len=148 TSval=3913016 TSecr=4509304
   51 4.266262822  10.6.15.144 → 192.168.1.16 TCP 66 22 → 59298 [ACK] Seq=7109 Ack=2429 Win=1448 Len=0 TSval=4509352 TSecr=3913016
   52 4.279743717  10.22.18.77 → 224.0.0.252  LLMNR 64 Standard query 0xc164 A wpad
   53 4.991272221  10.6.15.144 → 192.168.1.16 SSH 374 Server: Encrypted packet (len=308)
   54 4.991893047  10.6.15.144 → 192.168.1.16 SSH 138 Server: Encrypted packet (len=72)
   55 4.991960156 192.168.1.16 → 10.6.15.144  TCP 66 59298 → 22 [ACK] Seq=2429 Ack=7489 Win=3666 Len=0 TSval=3913200 TSecr=4509401
   56 4.992081663 192.168.1.16 → 10.6.15.144  SSH 102 Client: Encrypted packet (len=36)
   57 4.998464851  10.6.15.144 → 192.168.1.16 SSH 350 Server: Encrypted packet (len=284)
   58 5.002541563  10.22.18.77 → 224.0.0.252  LLMNR 64 Standard query 0xc164 A wpad
   59 5.002565792   10.22.18.1 → 224.0.0.252  LLMNR 64 Standard query 0xb1ca A wpad
   60 5.041225945 192.168.1.16 → 10.6.15.144  TCP 66 59298 → 22 [ACK] Seq=2465 Ack=7773 Win=3666 Len=0 TSval=3913213 TSecr=4509401
   61 5.105346363   10.22.18.1 → 224.0.0.252  LLMNR 64 Standard query 0xb1ca A wpad
   62 5.111390698  10.6.15.144 → 192.168.1.16 SSH 1514 Server: Encrypted packet (len=1448)
   63 5.111415084 192.168.1.16 → 10.6.15.144  TCP 66 59298 → 22 [ACK] Seq=2465 Ack=9221 Win=3666 Len=0 TSval=3913230 TSecr=4509562
   64 5.111595140  10.6.15.144 → 192.168.1.16 SSH 1514 Server: Encrypted packet (len=1448)
   65 5.111601066 192.168.1.16 → 10.6.15.144  TCP 66 59298 → 22 [ACK] Seq=2465 Ack=10669 Win=3666 Len=0 TSval=3913230 TSecr=4509562
   66 5.111678452 192.168.1.16 → 10.6.15.144  SSH 134 Client: Encrypted packet (len=68)
   67 5.111861149  10.6.15.144 → 192.168.1.16 SSH 1514 Server: Encrypted packet (len=1448)
   68 5.122946369  10.6.15.144 → 192.168.1.16 SSH 1514 Server: Encrypted packet (len=1448)
   69 5.122962527 192.168.1.16 → 10.6.15.144  TCP 66 59298 → 22 [ACK] Seq=2533 Ack=13565 Win=3666 Len=0 TSval=3913233 TSecr=4509562
   70 5.123175076  10.6.15.144 → 192.168.1.16 SSH 1514 Server: Encrypted packet (len=1448)
   71 5.123183258  10.6.15.144 → 192.168.1.16 TCP 78 [TCP Dup ACK 51#1] 22 → 59298 [ACK] Seq=15013 Ack=2429 Win=1452 Len=0 TSval=4509567 TSecr=3913016 SLE=2465 SRE=2533
   72 5.165225674 192.168.1.16 → 10.6.15.144  TCP 66 59298 → 22 [ACK] Seq=2533 Ack=15013 Win=3666 Len=0 TSval=3913244 TSecr=4509567
   73 5.206384450  10.6.15.144 → 192.168.1.16 SSH 1514 Server: Encrypted packet (len=1436)
   74 5.206407766 192.168.1.16 → 10.6.15.144  TCP 66 59298 → 22 [ACK] Seq=2533 Ack=16449 Win=3666 Len=0 TSval=3913254 TSecr=4509587
   75 5.206426545  10.6.15.144 → 192.168.1.16 SSH 90 Server: Encrypted packet (len=12)
   76 5.206434228 192.168.1.16 → 10.6.15.144  TCP 66 59298 → 22 [ACK] Seq=2533 Ack=16461 Win=3666 Len=0 TSval=3913254 TSecr=4509587
   77 5.206635931  10.6.15.144 → 192.168.1.16 SSH 1514 Server: Encrypted packet (len=1436)
   78 5.206643843 192.168.1.16 → 10.6.15.144  TCP 66 59298 → 22 [ACK] Seq=2533 Ack=17897 Win=3666 Len=0 TSval=3913254 TSecr=4509587
   79 5.219542208  10.6.15.144 → 192.168.1.16 SSH 1514 Server: Encrypted packet (len=1436)
   80 5.219566044 192.168.1.16 → 10.6.15.144  TCP 66 59298 → 22 [ACK] Seq=2533 Ack=19333 Win=3666 Len=0 TSval=3913257 TSecr=4509591
   81 5.219582178  10.6.15.144 → 192.168.1.16 SSH 102 Server: Encrypted packet (len=24)
   82 5.219587975 192.168.1.16 → 10.6.15.144  TCP 66 59298 → 22 [ACK] Seq=2533 Ack=19357 Win=3666 Len=0 TSval=3913257 TSecr=4509591
   83 5.219799230  10.6.15.144 → 192.168.1.16 SSH 1514 Server: Encrypted packet (len=1436)
   84 5.219810214 192.168.1.16 → 10.6.15.144  TCP 66 59298 → 22 [ACK] Seq=2533 Ack=20793 Win=3666 Len=0 TSval=3913257 TSecr=4509591
   85 5.225226641 192.168.1.16 → 10.6.15.144  TCP 102 [TCP Retransmission] 59298 → 22 [PSH, ACK] Seq=2429 Ack=20793 Win=3666 Len=36 TSval=3913259 TSecr=4509591
   86 5.233348579  10.6.15.144 → 192.168.1.16 SSH 1514 Server: Encrypted packet (len=1436)
   87 5.233371217  10.6.15.144 → 192.168.1.16 SSH 102 Server: Encrypted packet (len=24)
   88 5.233382713 192.168.1.16 → 10.6.15.144  TCP 66 59298 → 22 [ACK] Seq=2533 Ack=22253 Win=3666 Len=0 TSval=3913261 TSecr=4509594
   89 5.243606883  10.6.15.144 → 192.168.1.16 SSH 1514 Server: Encrypted packet (len=1436)
   90 5.244045558  10.6.15.144 → 192.168.1.16 TCP 66 22 → 59298 [ACK] Seq=23689 Ack=2533 Win=1452 Len=0 TSval=4509595 TSecr=3913259
   91 5.285234397 192.168.1.16 → 10.6.15.144  TCP 66 59298 → 22 [ACK] Seq=2533 Ack=23689 Win=3666 Len=0 TSval=3913274 TSecr=4509594
   92 5.298872348 192.168.1.16 → 10.6.15.144  SSH 110 Client: Encrypted packet (len=44)
   93 5.306351752 192.168.1.16 → 10.6.15.144  SSH 174 Client: Encrypted packet (len=108)
   94 5.323809383  10.6.15.144 → 192.168.1.16 SSH 1514 Server: Encrypted packet (len=1448)
   95 5.323831517  10.6.15.144 → 192.168.1.16 SSH 78 Server: Encrypted packet (len=12)
   96 5.323841040 192.168.1.16 → 10.6.15.144  TCP 66 59298 → 22 [ACK] Seq=2685 Ack=25149 Win=3666 Len=0 TSval=3913283 TSecr=4509617
   97 5.324144911  10.6.15.144 → 192.168.1.16 SSH 1514 Server: Encrypted packet (len=1448)
   98 5.324188853  10.6.15.144 → 192.168.1.16 SSH 362 Server: Encrypted packet (len=296)
   99 5.324195932 192.168.1.16 → 10.6.15.144  TCP 66 59298 → 22 [ACK] Seq=2685 Ack=26893 Win=3666 Len=0 TSval=3913283 TSecr=4509617
  100 5.381235575 192.168.1.16 → 10.6.15.144  TCP 174 [TCP Retransmission] 59298 → 22 [PSH, ACK] Seq=2577 Ack=26893 Win=3666 Len=108 TSval=3913298 TSecr=4509617
  101 5.395140370  10.6.15.144 → 192.168.1.16 TCP 78 [TCP Dup ACK 90#1] 22 → 59298 [ACK] Seq=26893 Ack=2533 Win=1452 Len=0 TSval=4509634 TSecr=3913274 SLE=2577 SRE=2685
  102 5.613221508 192.168.1.16 → 10.6.15.144  TCP 110 [TCP Retransmission] 59298 → 22 [PSH, ACK] Seq=2533 Ack=26893 Win=3666 Len=44 TSval=3913356 TSecr=4509634
  103 6.077240408 192.168.1.16 → 10.6.15.144  TCP 110 [TCP Retransmission] 59298 → 22 [PSH, ACK] Seq=2533 Ack=26893 Win=3666 Len=44 TSval=3913472 TSecr=4509634
  104 6.114971279  10.6.15.144 → 192.168.1.16 TCP 66 22 → 59298 [ACK] Seq=26893 Ack=2685 Win=1452 Len=0 TSval=4509815 TSecr=3913472
  105 6.180072158 10.22.18.169 → 224.0.0.252  LLMNR 64 Standard query 0x0526 A wpad
  106 7.101224451 192.168.1.16 → 54.76.71.168 TCP 66 42414 → 8282 [ACK] Seq=1 Ack=1 Win=296 Len=0 TSval=3913728 TSecr=608014250
  107 7.104967136  10.22.18.46 → 224.0.0.252  LLMNR 64 Standard query 0x6648 A wpad
  108 7.104980656 10.22.18.169 → 224.0.0.252  LLMNR 64 Standard query 0x0526 A wpad
  109 7.104984153  10.6.15.144 → 192.168.1.16 SSH 110 Server: Encrypted packet (len=44)
  110 7.104992708 192.168.1.16 → 10.6.15.144  TCP 66 59298 → 22 [ACK] Seq=2685 Ack=26937 Win=3666 Len=0 TSval=3913728 TSecr=4509991
  111 7.105168443  10.6.15.144 → 192.168.1.16 SSH 102 Server: Encrypted packet (len=36)
  112 7.105173809 192.168.1.16 → 10.6.15.144  TCP 66 59298 → 22 [ACK] Seq=2685 Ack=26973 Win=3666 Len=0 TSval=3913728 TSecr=4509991
  113 7.105199445  10.6.15.144 → 192.168.1.16 SSH 102 Server: Encrypted packet (len=36)
  114 7.105204400 192.168.1.16 → 10.6.15.144  TCP 66 59298 → 22 [ACK] Seq=2685 Ack=27009 Win=3666 Len=0 TSval=3913728 TSecr=4509991
  115 7.105325317 192.168.1.16 → 10.6.15.144  SSH 166 Client: Encrypted packet (len=100)
  116 7.105377757  10.6.15.144 → 192.168.1.16 SSH 102 Server: Encrypted packet (len=36)
  117 7.105395172  10.22.18.46 → 224.0.0.252  LLMNR 64 Standard query 0x6648 A wpad
  118 7.105422286  10.6.15.144 → 192.168.1.16 TCP 102 [TCP Retransmission] 22 → 59298 [PSH, ACK] Seq=27009 Ack=2685 Win=1452 Len=36 TSval=4510054 TSecr=3913472
  119 7.105428979 192.168.1.16 → 10.6.15.144  TCP 78 59298 → 22 [ACK] Seq=2785 Ack=27045 Win=3666 Len=0 TSval=3913729 TSecr=4510054 SLE=27009 SRE=27045
  120 7.106080786 192.168.1.16 → 10.6.15.144  SSH 334 Client: Encrypted packet (len=268)
  121 7.115695488  10.6.15.144 → 192.168.1.16 TCP 66 22 → 59298 [ACK] Seq=27045 Ack=2785 Win=1452 Len=0 TSval=4510065 TSecr=3913729
  122 7.115826463  10.6.15.144 → 192.168.1.16 TCP 66 22 → 59298 [ACK] Seq=27045 Ack=3053 Win=1452 Len=0 TSval=4510065 TSecr=3913729
  123 8.004094545 54.76.71.168 → 192.168.1.16 TCP 66 [TCP ACKed unseen segment] 8282 → 42414 [ACK] Seq=1 Ack=2 Win=121 Len=0 TSval=608025705 TSecr=3902272
  124 8.009177016  10.6.15.144 → 192.168.1.16 SSH 174 Server: Encrypted packet (len=108)
  125 8.009195042  10.6.15.144 → 192.168.1.16 SSH 118 Server: Encrypted packet (len=52)
  126 8.009267634 192.168.1.16 → 10.6.15.144  TCP 66 59298 → 22 [ACK] Seq=3053 Ack=27205 Win=3666 Len=0 TSval=3913955 TSecr=4510116
  127 8.009303905  10.6.15.144 → 192.168.1.16 SSH 446 Server: Encrypted packet (len=380)
  128 8.009336105  10.6.15.144 → 192.168.1.16 SSH 174 Server: Encrypted packet (len=108)
  129 8.009354806 192.168.1.16 → 10.6.15.144  TCP 66 59298 → 22 [ACK] Seq=3053 Ack=27693 Win=3666 Len=0 TSval=3913955 TSecr=4510116
  130 8.009707550  10.6.15.144 → 192.168.1.16 SSH 1514 Server: Encrypted packet (len=1448)
  131 8.009716387 10.22.18.209 → 224.0.0.252  LLMNR 64 Standard query 0xf064 A wpad
  132 8.009729569 10.22.18.209 → 224.0.0.252  LLMNR 64 Standard query 0xf064 A wpad
  133 8.010260291 192.168.1.16 → 10.6.15.144  SSH 206 Client: Encrypted packet (len=140)
  134 8.013781640 192.168.1.16 → 10.6.15.144  SSH 346 Client: Encrypted packet (len=280)
  135 8.065234678 192.168.1.16 → 10.6.15.144  SSH 930 Client: Encrypted packet (len=864)
  136 8.085119928  10.6.15.144 → 192.168.1.16 SSH 158 Server: Encrypted packet (len=80)
  137 8.125250040 192.168.1.16 → 10.6.15.144  TCP 66 59298 → 22 [ACK] Seq=4337 Ack=29221 Win=3666 Len=0 TSval=3913984 TSecr=4510307
  138 8.293276452 192.168.1.16 → 10.6.15.144  TCP 206 [TCP Retransmission] 59298 → 22 [PSH, ACK] Seq=3053 Ack=29221 Win=3666 Len=140 TSval=3914026 TSecr=4510307
  139 8.304170759  10.6.15.144 → 192.168.1.16 TCP 66 22 → 59298 [ACK] Seq=29221 Ack=3473 Win=1451 Len=0 TSval=4510362 TSecr=3914026
  140 8.304193089 192.168.1.16 → 10.6.15.144  SSH 206 Client: Encrypted packet (len=140)
  141 8.533278980 192.168.1.16 → 10.6.15.144  TCP 1070 [TCP Retransmission] 59298 → 22 [PSH, ACK] Seq=3473 Ack=29221 Win=3666 Len=1004 TSval=3914086 TSecr=4510362
  142 8.535498057  10.6.15.144 → 192.168.1.16 SSH 462 Server: Encrypted packet (len=396)
  143 8.535526797 192.168.1.16 → 10.6.15.144  TCP 66 59298 → 22 [ACK] Seq=4477 Ack=29617 Win=3666 Len=0 TSval=3914086 TSecr=4510413
  144 8.535543165  10.6.15.144 → 192.168.1.16 SSH 430 Server: Encrypted packet (len=364)
  145 8.535550157 192.168.1.16 → 10.6.15.144  TCP 66 59298 → 22 [ACK] Seq=4477 Ack=29981 Win=3666 Len=0 TSval=3914086 TSecr=4510413
  146 8.535618302  10.6.15.144 → 192.168.1.16 SSH 430 Server: Encrypted packet (len=364)
  147 8.535621840 192.168.1.16 → 10.6.15.144  TCP 66 59298 → 22 [ACK] Seq=4477 Ack=30345 Win=3666 Len=0 TSval=3914086 TSecr=4510414
  148 8.567045939  10.6.15.144 → 192.168.1.16 TCP 66 22 → 59298 [ACK] Seq=30345 Ack=4477 Win=1452 Len=0 TSval=4510427 TSecr=3914086
  149 8.567067266 192.168.1.16 → 10.6.15.144  SSH 126 Client: Encrypted packet (len=60)
  150 8.576814402  10.6.15.144 → 192.168.1.16 TCP 66 22 → 59298 [ACK] Seq=30345 Ack=4537 Win=1452 Len=0 TSval=4510430 TSecr=3914094
  151 8.700595014 192.168.1.16 → 192.168.1.1  DNS 74 Standard query 0x7505 A ntp.ubuntu.com
  152 8.745213533  192.168.1.1 → 192.168.1.16 DNS 138 Standard query response 0x7505 A ntp.ubuntu.com A 91.189.89.198 A 91.189.94.4 A 91.189.89.199 A 91.189.91.157
  153 8.745680705 192.168.1.16 → 91.189.89.198 NTP 90 NTP Version 4, client
  154 8.768828827  10.6.15.144 → 192.168.1.16 SSH 134 Server: Encrypted packet (len=68)
  155 8.776565598  10.6.15.144 → 192.168.1.16 SSH 1514 Server: Encrypted packet (len=1448)
  156 8.776583228 192.168.1.16 → 10.6.15.144  TCP 66 59298 → 22 [ACK] Seq=4537 Ack=31861 Win=3666 Len=0 TSval=3914146 TSecr=4510478
  157 8.776657001  10.6.15.144 → 192.168.1.16 SSH 830 Server: Encrypted packet (len=764)
  158 8.787607022  10.6.15.144 → 192.168.1.16 SSH 1514 Server: [TCP Previous segment not captured] , Encrypted packet (len=1448)
  159 8.787625628 192.168.1.16 → 10.6.15.144  TCP 78 59298 → 22 [ACK] Seq=4537 Ack=32625 Win=3666 Len=0 TSval=3914149 TSecr=4510479 SLE=34073 SRE=35521
  160 9.292806233 192.168.1.16 → 10.6.15.144  SSH 1306 Client: Encrypted packet (len=1228)
  161 9.521221181 192.168.1.16 → 10.6.15.144  TCP 1306 [TCP Retransmission] 59298 → 22 [PSH, ACK] Seq=4537 Ack=32625 Win=3666 Len=1228 TSval=3914333 TSecr=4510479 SLE=34073 SRE=35521
  162 9.524692533  10.6.15.144 → 192.168.1.16 SSH 1514 Server: Encrypted packet (len=1448)
  163 9.524713957 192.168.1.16 → 10.6.15.144  TCP 78 [TCP Dup ACK 159#1] 59298 → 22 [ACK] Seq=5765 Ack=32625 Win=3666 Len=0 TSval=3914333 TSecr=4510479 SLE=34073 SRE=36969
  164 9.586240017  10.6.15.144 → 192.168.1.16 SSH 1514 Server: Encrypted packet (len=1448)
  165 9.586262939 192.168.1.16 → 10.6.15.144  TCP 78 [TCP Dup ACK 159#2] 59298 → 22 [ACK] Seq=5765 Ack=32625 Win=3666 Len=0 TSval=3914349 TSecr=4510479 SLE=34073 SRE=38417
  166 9.586555564  10.6.15.144 → 192.168.1.16 SSH 1514 Server: Encrypted packet (len=1448)
  167 9.586575746 192.168.1.16 → 10.6.15.144  TCP 78 [TCP Dup ACK 159#3] 59298 → 22 [ACK] Seq=5765 Ack=32625 Win=3666 Len=0 TSval=3914349 TSecr=4510479 SLE=34073 SRE=39865
  168 9.596073177  10.6.15.144 → 192.168.1.16 SSH 1514 Server: [TCP Fast Retransmission] , Encrypted packet (len=1448)
  169 9.596099849 192.168.1.16 → 10.6.15.144  TCP 66 59298 → 22 [ACK] Seq=5765 Ack=39865 Win=3666 Len=0 TSval=3914351 TSecr=4510685
  170 9.596197318  10.6.15.144 → 192.168.1.16 SSH 1514 Server: Encrypted packet (len=1448)
  171 9.596202270 192.168.1.16 → 10.6.15.144  TCP 66 59298 → 22 [ACK] Seq=5765 Ack=41313 Win=3666 Len=0 TSval=3914351 TSecr=4510685
  172 9.604067865  10.6.15.144 → 192.168.1.16 SSH 1514 Server: Encrypted packet (len=1448)
  173 9.604085600 192.168.1.16 → 10.6.15.144  TCP 66 59298 → 22 [ACK] Seq=5765 Ack=42761 Win=3666 Len=0 TSval=3914353 TSecr=4510688
  174 9.604188882  10.6.15.144 → 192.168.1.16 SSH 1514 Server: Encrypted packet (len=1448)
  175 9.604193646 192.168.1.16 → 10.6.15.144  TCP 66 59298 → 22 [ACK] Seq=5765 Ack=44209 Win=3666 Len=0 TSval=3914353 TSecr=4510688
  176 9.604420826 192.168.1.16 → 10.6.15.144  SSH 138 Client: Encrypted packet (len=72)
  177 9.612084591 192.168.1.16 → 10.6.15.144  SSH 174 Client: Encrypted packet (len=108)
  178 9.617465935  10.6.15.144 → 192.168.1.16 SSH 1514 Server: Encrypted packet (len=1448)
  179 9.661279251 192.168.1.16 → 10.6.15.144  TCP 66 59298 → 22 [ACK] Seq=5945 Ack=45657 Win=3666 Len=0 TSval=3914368 TSecr=4510688
  180 9.685276768 192.168.1.16 → 10.6.15.144  SSH 290 Client: Encrypted packet (len=224)
  181 9.703691206  10.6.15.144 → 192.168.1.16 SSH 1514 Server: Encrypted packet (len=1436)
  182 9.703715522 192.168.1.16 → 10.6.15.144  TCP 66 59298 → 22 [ACK] Seq=6169 Ack=47093 Win=3666 Len=0 TSval=3914378 TSecr=4510712
  183 9.703727461  10.6.15.144 → 192.168.1.16 SSH 90 Server: Encrypted packet (len=12)
  184 9.703731907 192.168.1.16 → 10.6.15.144  TCP 66 59298 → 22 [ACK] Seq=6169 Ack=47105 Win=3666 Len=0 TSval=3914378 TSecr=4510712
  185 9.730995315  10.6.15.144 → 192.168.1.16 SSH 1514 Server: Encrypted packet (len=1436)
  186 9.731022864 192.168.1.16 → 10.6.15.144  TCP 66 59298 → 22 [ACK] Seq=6169 Ack=48541 Win=3666 Len=0 TSval=3914385 TSecr=4510712
  187 9.921224532 192.168.1.16 → 10.6.15.144  TCP 138 [TCP Retransmission] 59298 → 22 [PSH, ACK] Seq=5765 Ack=48541 Win=3666 Len=72 TSval=3914433 TSecr=4510712
  188 9.933569280  10.6.15.144 → 192.168.1.16 SSH 1514 Server: Encrypted packet (len=1448)
  189 9.933592806 192.168.1.16 → 10.6.15.144  TCP 290 [TCP Retransmission] 59298 → 22 [PSH, ACK] Seq=5945 Ack=48541 Win=3666 Len=224 TSval=3914436 TSecr=4510769
  190 9.933613305 192.168.1.16 → 10.6.15.144  TCP 66 59298 → 22 [ACK] Seq=6169 Ack=49989 Win=3666 Len=0 TSval=3914436 TSecr=4510769
  191 9.933621786  10.6.15.144 → 192.168.1.16 SSH 78 Server: Encrypted packet (len=12)
  192 9.933626144 192.168.1.16 → 10.6.15.144  TCP 66 59298 → 22 [ACK] Seq=6169 Ack=50001 Win=3666 Len=0 TSval=3914436 TSecr=4510769
  193 9.933927871  10.6.15.144 → 192.168.1.16 SSH 1514 Server: Encrypted packet (len=1448)
  194 9.933946739 192.168.1.16 → 10.6.15.144  TCP 66 59298 → 22 [ACK] Seq=6169 Ack=51449 Win=3666 Len=0 TSval=3914436 TSecr=4510769
  195 9.944271872  10.6.15.144 → 192.168.1.16 SSH 1514 Server: Encrypted packet (len=1448)
  196 9.955781657  10.6.15.144 → 192.168.1.16 SSH 1514 Server: Encrypted packet (len=1448)
  197 9.955799816 192.168.1.16 → 10.6.15.144  TCP 66 59298 → 22 [ACK] Seq=6169 Ack=54345 Win=3666 Len=0 TSval=3914441 TSecr=4510772
  198 9.958846581  10.6.15.144 → 192.168.1.16 SSH 1514 Server: Encrypted packet (len=1448)
  199 9.976243934 192.168.1.16 → 10.6.15.144  SSH 286 Client: Encrypted packet (len=220)
  200 9.977091614 192.168.1.16 → 10.6.15.144  SSH 198 Client: Encrypted packet (len=132)
  201 10.015405397  10.6.15.144 → 192.168.1.16 SSH 1058 Server: Encrypted packet (len=992)
  202 10.015435747 192.168.1.16 → 10.6.15.144  SSH 1338 Client: Encrypted packet (len=1272)
  203 10.053039503  10.6.15.144 → 192.168.1.16 TCP 66 22 → 59298 [ACK] Seq=56785 Ack=6521 Win=1452 Len=0 TSval=4510800 TSecr=3914446
  204 10.053062185 192.168.1.16 → 10.6.15.144  SSH 1514 Client: Encrypted packet (len=1448)
  205 10.065423304  10.6.15.144 → 192.168.1.16 TCP 78 [TCP Dup ACK 203#1] 22 → 59298 [ACK] Seq=56785 Ack=6521 Win=1452 Len=0 TSval=4510802 TSecr=3914446 SLE=7793 SRE=9241
  206 10.065449578 192.168.1.16 → 10.6.15.144  SSH 326 Client: Encrypted packet (len=260)
  207 10.135645282  10.6.15.144 → 192.168.1.16 SSH 1514 Server: Encrypted packet (len=1436)
  208 10.135864549  10.6.15.144 → 192.168.1.16 SSH 1514 Server: Encrypted packet (len=1436)
  209 10.135881199 192.168.1.16 → 10.6.15.144  TCP 66 59298 → 22 [ACK] Seq=9501 Ack=59657 Win=3666 Len=0 TSval=3914486 TSecr=4510820
  210 10.136005434  10.6.15.144 → 192.168.1.16 SSH 258 Server: Encrypted packet (len=180)
  211 10.175406678  10.6.15.144 → 192.168.1.16 SSH 470 Server: [TCP Previous segment not captured] , Encrypted packet (len=392)
  212 10.175426792 192.168.1.16 → 10.6.15.144  TCP 78 59298 → 22 [ACK] Seq=9501 Ack=59837 Win=3666 Len=0 TSval=3914496 TSecr=4510820 SLE=61273 SRE=61665
  213 10.183957135  10.6.15.144 → 192.168.1.16 SSH 178 Server: Encrypted packet (len=100)
  214 10.183978706 192.168.1.16 → 10.6.15.144  TCP 78 [TCP Dup ACK 212#1] 59298 → 22 [ACK] Seq=9501 Ack=59837 Win=3666 Len=0 TSval=3914498 TSecr=4510820 SLE=61273 SRE=61765
  215 10.187435421  10.6.15.144 → 192.168.1.16 SSH 114 Server: Encrypted packet (len=36)
  216 10.187457033 192.168.1.16 → 10.6.15.144  TCP 78 [TCP Dup ACK 212#2] 59298 → 22 [ACK] Seq=9501 Ack=59837 Win=3666 Len=0 TSval=3914499 TSecr=4510820 SLE=61273 SRE=61801
  217 10.193992315  10.6.15.144 → 192.168.1.16 SSH 170 Server: Encrypted packet (len=92)
  218 10.194014724 192.168.1.16 → 10.6.15.144  TCP 78 [TCP Dup ACK 212#3] 59298 → 22 [ACK] Seq=9501 Ack=59837 Win=3666 Len=0 TSval=3914501 TSecr=4510820 SLE=61273 SRE=61893
  219 10.225472268  10.6.15.144 → 192.168.1.16 TCP 1514 [TCP Retransmission] 22 → 59298 [ACK] Seq=59837 Ack=6521 Win=1452 Len=1436 TSval=4510842 TSecr=3914446 SLE=7793 SRE=9241
  220 10.225506412 192.168.1.16 → 10.6.15.144  TCP 66 59298 → 22 [ACK] Seq=9501 Ack=61893 Win=3666 Len=0 TSval=3914509 TSecr=4510842
  221 10.225606637  10.6.15.144 → 192.168.1.16 SSH 1514 Server: Encrypted packet (len=1436)
  222 10.225613403 192.168.1.16 → 10.6.15.144  TCP 66 59298 → 22 [ACK] Seq=9501 Ack=63329 Win=3666 Len=0 TSval=3914509 TSecr=4510842
  223 10.237374400  10.6.15.144 → 192.168.1.16 SSH 1514 Server: Encrypted packet (len=1436)
  224 10.237391558 192.168.1.16 → 10.6.15.144  TCP 66 59298 → 22 [ACK] Seq=9501 Ack=64765 Win=3666 Len=0 TSval=3914512 TSecr=4510845
  225 10.237575039  10.6.15.144 → 192.168.1.16 SSH 1514 Server: Encrypted packet (len=1436)
  226 10.237583671 192.168.1.16 → 10.6.15.144  TCP 66 59298 → 22 [ACK] Seq=9501 Ack=66201 Win=3666 Len=0 TSval=3914512 TSecr=4510845
  227 10.237791468  10.6.15.144 → 192.168.1.16 SSH 1514 Server: Encrypted packet (len=1436)
  228 10.237802899 192.168.1.16 → 10.6.15.144  TCP 66 59298 → 22 [ACK] Seq=9501 Ack=67637 Win=3666 Len=0 TSval=3914512 TSecr=4510845
  229 10.253751443  10.6.15.144 → 192.168.1.16 SSH 1514 Server: Encrypted packet (len=1436)
  230 10.253783971 192.168.1.16 → 10.6.15.144  TCP 66 59298 → 22 [ACK] Seq=9501 Ack=69073 Win=3666 Len=0 TSval=3914516 TSecr=4510849
  231 10.253954792  10.6.15.144 → 192.168.1.16 SSH 1514 Server: Encrypted packet (len=1436)
  232 10.253969439 192.168.1.16 → 10.6.15.144  TCP 66 59298 → 22 [ACK] Seq=9501 Ack=70509 Win=3666 Len=0 TSval=3914516 TSecr=4510849
  233 10.257229031 192.168.1.16 → 10.6.15.144  TCP 1338 [TCP Retransmission] 59298 → 22 [PSH, ACK] Seq=6521 Ack=70509 Win=3666 Len=1272 TSval=3914517 TSecr=4510849
  234 10.260296269  10.6.15.144 → 192.168.1.16 SSH 1514 Server: Encrypted packet (len=1436)
  235 10.260476036  10.6.15.144 → 192.168.1.16 SSH 1202 Server: Encrypted packet (len=1124)
  236 10.260487656 192.168.1.16 → 10.6.15.144  TCP 66 59298 → 22 [ACK] Seq=9501 Ack=73069 Win=3666 Len=0 TSval=3914517 TSecr=4510849
  237 10.272435298  10.6.15.144 → 192.168.1.16 TCP 66 22 → 59298 [ACK] Seq=73069 Ack=9241 Win=1452 Len=0 TSval=4510854 TSecr=3914517
  238 10.272459401 192.168.1.16 → 10.6.15.144  SSH 326 Client: Encrypted packet (len=260)
  239 10.282580582  10.6.15.144 → 192.168.1.16 TCP 78 [TCP Dup ACK 237#1] 22 → 59298 [ACK] Seq=73069 Ack=9241 Win=1452 Len=0 TSval=4510857 TSecr=3914517 SLE=9501 SRE=9761
  240 10.282604902 192.168.1.16 → 10.6.15.144  TCP 326 [TCP Retransmission] 59298 → 22 [PSH, ACK] Seq=9241 Ack=73069 Win=3666 Len=260 TSval=3914523 TSecr=4510857
  241 10.285388853 192.168.1.16 → 10.6.15.144  SSH 262 Client: Encrypted packet (len=196)
  242 10.295818576  10.6.15.144 → 192.168.1.16 TCP 66 22 → 59298 [ACK] Seq=73069 Ack=9761 Win=1448 Len=0 TSval=4510860 TSecr=3914523
  243 10.295845073 192.168.1.16 → 10.6.15.144  SSH 198 Client: Encrypted packet (len=132)
  244 10.295864447  10.6.15.144 → 192.168.1.16 TCP 66 22 → 59298 [ACK] Seq=73069 Ack=9957 Win=1447 Len=0 TSval=4510860 TSecr=3914524
  245 10.307373515  10.6.15.144 → 192.168.1.16 TCP 66 22 → 59298 [ACK] Seq=73069 Ack=10089 Win=1446 Len=0 TSval=4510863 TSecr=3914526
  246 10.314079423 192.168.1.16 → 10.6.15.144  SSH 190 Client: Encrypted packet (len=124)
  247 10.314352275 192.168.1.16 → 10.6.15.144  SSH 642 Client: Encrypted packet (len=576)
  248 10.324019998  10.6.15.144 → 192.168.1.16 TCP 66 22 → 59298 [ACK] Seq=73069 Ack=10213 Win=1446 Len=0 TSval=4510867 TSecr=3914531
  249 10.324043195 192.168.1.16 → 10.6.15.144  SSH 198 Client: Encrypted packet (len=132)
  250 10.325464949  10.6.15.144 → 192.168.1.16 TCP 66 22 → 59298 [ACK] Seq=73069 Ack=10789 Win=1446 Len=0 TSval=4510867 TSecr=3914531
  251 10.334326048  10.6.15.144 → 192.168.1.16 TCP 66 22 → 59298 [ACK] Seq=73069 Ack=10921 Win=1446 Len=0 TSval=4510870 TSecr=3914533
  252 10.585085623 192.168.1.16 → 10.6.15.144  SSH 102 Client: Encrypted packet (len=36)
  253 10.589413363 192.168.1.16 → 10.6.15.144  SSH 110 Client: Encrypted packet (len=44)
  254 10.592210700 192.168.1.16 → 10.6.15.144  SSH 198 Client: Encrypted packet (len=132)
  255 10.595696561  10.6.15.144 → 192.168.1.16 TCP 66 22 → 59298 [ACK] Seq=73069 Ack=10957 Win=1446 Len=0 TSval=4510935 TSecr=3914598
  256 10.595721698 192.168.1.16 → 10.6.15.144  SSH 102 Client: Encrypted packet (len=36)
  257 10.599880722  10.6.15.144 → 192.168.1.16 TCP 66 22 → 59298 [ACK] Seq=73069 Ack=11001 Win=1446 Len=0 TSval=4510936 TSecr=3914600
  258 10.603237564  10.6.15.144 → 192.168.1.16 TCP 66 22 → 59298 [ACK] Seq=73069 Ack=11133 Win=1445 Len=0 TSval=4510937 TSecr=3914600
  259 10.607317668  10.6.15.144 → 192.168.1.16 TCP 66 22 → 59298 [ACK] Seq=73069 Ack=11169 Win=1445 Len=0 TSval=4510938 TSecr=3914601
  260 11.999738088  10.6.15.144 → 192.168.1.16 SSH 362 Server: Encrypted packet (len=296)
  261 11.999937902  10.6.15.144 → 192.168.1.16 SSH 1514 Server: Encrypted packet (len=1448)
  262 11.999947412 192.168.1.16 → 10.6.15.144  TCP 66 59298 → 22 [ACK] Seq=11169 Ack=74813 Win=3666 Len=0 TSval=3914952 TSecr=4511038
  263 12.000114765  10.6.15.144 → 192.168.1.16 SSH 1514 Server: Encrypted packet (len=1448)
  264 12.000226154 192.168.1.16 → 10.6.15.144  SSH 174 Client: Encrypted packet (len=108)
  265 12.000488824  10.6.15.144 → 192.168.1.16 SSH 1514 Server: [TCP Previous segment not captured] , Encrypted packet (len=1448)
  266 12.000496269 192.168.1.16 → 10.6.15.144  SSH 514 Client: Encrypted packet (len=436)
  267 12.000505051  10.6.15.144 → 192.168.1.16 TCP 362 [TCP Out-Of-Order] 22 → 59298 [PSH, ACK] Seq=73069 Ack=11169 Win=1452 Len=296 TSval=4511271 TSecr=3914601
  268 12.000507432 192.168.1.16 → 10.6.15.144  TCP 86 [TCP Dup ACK 264#1] 59298 → 22 [ACK] Seq=11713 Ack=76261 Win=3666 Len=0 TSval=3914952 TSecr=4511141 SLE=73069 SRE=73365 SLE=77709 SRE=79157
  269 12.011719010  10.6.15.144 → 192.168.1.16 SSH 1514 Server: Encrypted packet (len=1448)
  270 12.011741220 192.168.1.16 → 10.6.15.144  TCP 78 [TCP Dup ACK 264#2] 59298 → 22 [ACK] Seq=11713 Ack=76261 Win=3666 Len=0 TSval=3914955 TSecr=4511141 SLE=77709 SRE=80605
  271 12.011757036  10.6.15.144 → 192.168.1.16 TCP 66 22 → 59298 [ACK] Seq=80605 Ack=11277 Win=1452 Len=0 TSval=4511289 TSecr=3914952
  272 12.012067436  10.6.15.144 → 192.168.1.16 SSH 1514 Server: Encrypted packet (len=1448)
  273 12.012092500 192.168.1.16 → 10.6.15.144  TCP 78 [TCP Dup ACK 264#3] 59298 → 22 [ACK] Seq=11713 Ack=76261 Win=3666 Len=0 TSval=3914955 TSecr=4511141 SLE=77709 SRE=82053
  274 12.012225689  10.6.15.144 → 192.168.1.16 SSH 1514 Server: Encrypted packet (len=1448)
  275 12.012238303 192.168.1.16 → 10.6.15.144  TCP 78 [TCP Dup ACK 264#4] 59298 → 22 [ACK] Seq=11713 Ack=76261 Win=3666 Len=0 TSval=3914955 TSecr=4511141 SLE=77709 SRE=83501
  276 12.022335509  10.6.15.144 → 192.168.1.16 SSH 1514 Server: Encrypted packet (len=1448)
  277 12.022354072 192.168.1.16 → 10.6.15.144  TCP 78 [TCP Dup ACK 264#5] 59298 → 22 [ACK] Seq=11713 Ack=76261 Win=3666 Len=0 TSval=3914958 TSecr=4511141 SLE=77709 SRE=84949
  278 12.022519073  10.6.15.144 → 192.168.1.16 SSH 1514 Server: [TCP Fast Retransmission] , Encrypted packet (len=1448)
  279 12.022538168 192.168.1.16 → 10.6.15.144  TCP 66 59298 → 22 [ACK] Seq=11713 Ack=84949 Win=3666 Len=0 TSval=3914958 TSecr=4511292
  280 12.034310902  10.6.15.144 → 192.168.1.16 SSH 1514 Server: Encrypted packet (len=1448)
  281 12.034329236 192.168.1.16 → 10.6.15.144  TCP 66 59298 → 22 [ACK] Seq=11713 Ack=86397 Win=3666 Len=0 TSval=3914961 TSecr=4511295
  282 12.034471731  10.6.15.144 → 192.168.1.16 SSH 1514 Server: Encrypted packet (len=1448)
  283 12.034479902 192.168.1.16 → 10.6.15.144  TCP 66 59298 → 22 [ACK] Seq=11713 Ack=87845 Win=3666 Len=0 TSval=3914961 TSecr=4511295
  284 12.045540546  10.6.15.144 → 192.168.1.16 SSH 1514 Server: Encrypted packet (len=1448)
  285 12.045565508 192.168.1.16 → 10.6.15.144  TCP 66 59298 → 22 [ACK] Seq=11713 Ack=89293 Win=3666 Len=0 TSval=3914964 TSecr=4511297
  286 12.045699107  10.6.15.144 → 192.168.1.16 SSH 1514 Server: Encrypted packet (len=1448)
  287 12.045707863 192.168.1.16 → 10.6.15.144  TCP 66 59298 → 22 [ACK] Seq=11713 Ack=90741 Win=3666 Len=0 TSval=3914964 TSecr=4511297
  288 12.045868046  10.6.15.144 → 192.168.1.16 SSH 1514 Server: Encrypted packet (len=1448)
  289 12.045874818 192.168.1.16 → 10.6.15.144  TCP 66 59298 → 22 [ACK] Seq=11713 Ack=92189 Win=3666 Len=0 TSval=3914964 TSecr=4511297
  290 12.046080422 192.168.1.16 → 10.6.15.144  SSH 102 Client: Encrypted packet (len=36)
  291 12.048428888 192.168.1.16 → 10.6.15.144  SSH 418 Client: Encrypted packet (len=352)
  292 12.058536395  10.6.15.144 → 192.168.1.16 SSH 1514 Server: Encrypted packet (len=1448)
  293 12.058712882  10.6.15.144 → 192.168.1.16 SSH 1514 Server: Encrypted packet (len=1448)
  294 12.058720878 192.168.1.16 → 10.6.15.144  TCP 66 59298 → 22 [ACK] Seq=12101 Ack=95085 Win=3666 Len=0 TSval=3914967 TSecr=4511301
  295 12.059059558  10.6.15.144 → 192.168.1.16 SSH 1514 Server: Encrypted packet (len=1448)
  296 12.059147084  10.6.15.144 → 192.168.1.16 TCP 66 [TCP Previous segment not captured] 22 → 59298 [ACK] Seq=97981 Ack=12101 Win=1452 Len=0 TSval=4511301 TSecr=3914964
  297 12.069675176  10.6.15.144 → 192.168.1.16 SSH 1514 Server: Encrypted packet (len=1448)
  298 12.069697102 192.168.1.16 → 10.6.15.144  TCP 78 59298 → 22 [ACK] Seq=12101 Ack=96533 Win=3666 Len=0 TSval=3914970 TSecr=4511301 SLE=97981 SRE=99429
  299 12.069825374  10.6.15.144 → 192.168.1.16 SSH 1514 Server: Encrypted packet (len=1448)
  300 12.069835883 192.168.1.16 → 10.6.15.144  TCP 78 [TCP Dup ACK 298#1] 59298 → 22 [ACK] Seq=12101 Ack=96533 Win=3666 Len=0 TSval=3914970 TSecr=4511301 SLE=97981 SRE=100877
  301 12.093603363  10.6.15.144 → 192.168.1.16 SSH 1514 Server: Encrypted packet (len=1448)
  302 12.093624780 192.168.1.16 → 10.6.15.144  TCP 78 [TCP Dup ACK 298#2] 59298 → 22 [ACK] Seq=12101 Ack=96533 Win=3666 Len=0 TSval=3914976 TSecr=4511301 SLE=97981 SRE=102325
  303 12.093758013  10.6.15.144 → 192.168.1.16 SSH 1514 Server: Encrypted packet (len=1448)
  304 12.093768448 192.168.1.16 → 10.6.15.144  TCP 78 [TCP Dup ACK 298#3] 59298 → 22 [ACK] Seq=12101 Ack=96533 Win=3666 Len=0 TSval=3914976 TSecr=4511301 SLE=97981 SRE=103773
  305 12.093944098  10.6.15.144 → 192.168.1.16 SSH 1514 Server: Encrypted packet (len=1448)
  306 12.093947625 192.168.1.16 → 10.6.15.144  TCP 78 [TCP Dup ACK 298#4] 59298 → 22 [ACK] Seq=12101 Ack=96533 Win=3666 Len=0 TSval=3914976 TSecr=4511301 SLE=97981 SRE=105221
  307 12.107857536  10.6.15.144 → 192.168.1.16 SSH 1514 Server: [TCP Fast Retransmission] , Encrypted packet (len=1448)
  308 12.107884881 192.168.1.16 → 10.6.15.144  TCP 66 59298 → 22 [ACK] Seq=12101 Ack=105221 Win=3666 Len=0 TSval=3914979 TSecr=4511312
  309 12.118535366  10.6.15.144 → 192.168.1.16 SSH 1514 Server: [TCP Previous segment not captured] , Encrypted packet (len=1448)
  310 12.118552479 192.168.1.16 → 10.6.15.144  TCP 78 [TCP Dup ACK 308#1] 59298 → 22 [ACK] Seq=12101 Ack=105221 Win=3666 Len=0 TSval=3914982 TSecr=4511312 SLE=106669 SRE=108117
  311 12.131968077  10.6.15.144 → 192.168.1.16 SSH 1514 Server: Encrypted packet (len=1448)
  312 12.131988042 192.168.1.16 → 10.6.15.144  TCP 78 [TCP Dup ACK 308#2] 59298 → 22 [ACK] Seq=12101 Ack=105221 Win=3666 Len=0 TSval=3914985 TSecr=4511312 SLE=106669 SRE=109565
  313 12.143974091  10.6.15.144 → 192.168.1.16 SSH 1514 Server: Encrypted packet (len=1448)
  314 12.143993220 192.168.1.16 → 10.6.15.144  TCP 78 [TCP Dup ACK 308#3] 59298 → 22 [ACK] Seq=12101 Ack=105221 Win=3666 Len=0 TSval=3914988 TSecr=4511312 SLE=106669 SRE=111013
  315 13.025188191  10.6.15.144 → 192.168.1.16 TCP 1514 [TCP Retransmission] 22 → 59298 [ACK] Seq=105221 Ack=12101 Win=1452 Len=1448 TSval=4511500 TSecr=3914985
  316 13.025217237 192.168.1.16 → 10.6.15.144  TCP 66 59298 → 22 [ACK] Seq=12101 Ack=111013 Win=3666 Len=0 TSval=3915208 TSecr=4511500
  317 13.032471760 192.168.1.16 → 10.6.15.144  SSH 138 Client: Encrypted packet (len=72)
  318 13.033502174 192.168.1.16 → 10.6.15.144  SSH 138 Client: Encrypted packet (len=72)
  319 13.065135485  10.6.15.144 → 192.168.1.16 SSH 1514 Server: Encrypted packet (len=1448)
  320 13.065315156  10.6.15.144 → 192.168.1.16 SSH 1514 Server: Encrypted packet (len=1448)
  321 13.065325227 192.168.1.16 → 10.6.15.144  TCP 66 59298 → 22 [ACK] Seq=12245 Ack=113909 Win=3666 Len=0 TSval=3915219 TSecr=4511552
  322 13.068090253  10.6.15.144 → 192.168.1.16 SSH 1514 Server: Encrypted packet (len=1448)
  323 13.068110309  10.6.15.144 → 192.168.1.16 TCP 66 22 → 59298 [ACK] Seq=115357 Ack=12245 Win=1452 Len=0 TSval=4511552 TSecr=3915210
  324 13.075945126  10.6.15.144 → 192.168.1.16 SSH 1514 Server: Encrypted packet (len=1448)
  325 13.075956226 192.168.1.16 → 10.6.15.144  TCP 66 59298 → 22 [ACK] Seq=12245 Ack=116805 Win=3666 Len=0 TSval=3915221 TSecr=4511552
  326 13.076128791  10.6.15.144 → 192.168.1.16 SSH 1514 Server: Encrypted packet (len=1448)
  327 13.086860263  10.6.15.144 → 192.168.1.16 SSH 1514 Server: Encrypted packet (len=1448)
  328 13.086876552 192.168.1.16 → 10.6.15.144  TCP 66 59298 → 22 [ACK] Seq=12245 Ack=119701 Win=3666 Len=0 TSval=3915224 TSecr=4511555
  329 13.097580221  10.6.15.144 → 192.168.1.16 SSH 1514 Server: [TCP Previous segment not captured] , Encrypted packet (len=1448)
  330 13.097597522 192.168.1.16 → 10.6.15.144  TCP 78 [TCP Dup ACK 328#1] 59298 → 22 [ACK] Seq=12245 Ack=119701 Win=3666 Len=0 TSval=3915227 TSecr=4511555 SLE=121149 SRE=122597
  331 13.097774917  10.6.15.144 → 192.168.1.16 SSH 1514 Server: Encrypted packet (len=1448)
  332 13.097794548 192.168.1.16 → 10.6.15.144  TCP 78 [TCP Dup ACK 328#2] 59298 → 22 [ACK] Seq=12245 Ack=119701 Win=3666 Len=0 TSval=3915227 TSecr=4511555 SLE=121149 SRE=124045
  333 13.109163757  10.6.15.144 → 192.168.1.16 SSH 1514 Server: Encrypted packet (len=1448)
  334 13.109184196 192.168.1.16 → 10.6.15.144  TCP 78 [TCP Dup ACK 328#3] 59298 → 22 [ACK] Seq=12245 Ack=119701 Win=3666 Len=0 TSval=3915229 TSecr=4511555 SLE=121149 SRE=125493
  335 13.109301025  10.6.15.144 → 192.168.1.16 SSH 1514 Server: Encrypted packet (len=1448)
  336 13.109310856 192.168.1.16 → 10.6.15.144  TCP 78 [TCP Dup ACK 328#4] 59298 → 22 [ACK] Seq=12245 Ack=119701 Win=3666 Len=0 TSval=3915230 TSecr=4511555 SLE=121149 SRE=126941
  337 13.123999835  10.6.15.144 → 192.168.1.16 SSH 1514 Server: [TCP Fast Retransmission] , Encrypted packet (len=1448)
  338 13.124026710 192.168.1.16 → 10.6.15.144  TCP 66 59298 → 22 [ACK] Seq=12245 Ack=126941 Win=3666 Len=0 TSval=3915233 TSecr=4511566
  339 13.134810856  10.6.15.144 → 192.168.1.16 SSH 1514 Server: [TCP Previous segment not captured] , Encrypted packet (len=1448)
  340 13.134827749 192.168.1.16 → 10.6.15.144  TCP 78 [TCP Dup ACK 338#1] 59298 → 22 [ACK] Seq=12245 Ack=126941 Win=3666 Len=0 TSval=3915236 TSecr=4511566 SLE=128389 SRE=129837
  341 13.145800797  10.6.15.144 → 192.168.1.16 SSH 1514 Server: Encrypted packet (len=1448)
  342 13.145820297 192.168.1.16 → 10.6.15.144  TCP 78 [TCP Dup ACK 338#2] 59298 → 22 [ACK] Seq=12245 Ack=126941 Win=3666 Len=0 TSval=3915239 TSecr=4511566 SLE=128389 SRE=131285
  343 13.156306843  10.6.15.144 → 192.168.1.16 SSH 1514 Server: Encrypted packet (len=1448)
  344 13.156326911 192.168.1.16 → 10.6.15.144  TCP 78 [TCP Dup ACK 338#3] 59298 → 22 [ACK] Seq=12245 Ack=126941 Win=3666 Len=0 TSval=3915241 TSecr=4511566 SLE=128389 SRE=132733
  345 13.167018280  10.6.15.144 → 192.168.1.16 SSH 1514 Server: [TCP Fast Retransmission] , Encrypted packet (len=1448)
  346 13.167047802 192.168.1.16 → 10.6.15.144  TCP 66 59298 → 22 [ACK] Seq=12245 Ack=132733 Win=3666 Len=0 TSval=3915244 TSecr=4511578
  347 13.167140307  10.6.15.144 → 192.168.1.16 SSH 1514 Server: Encrypted packet (len=1448)
  348 13.167144075 192.168.1.16 → 10.6.15.144  TCP 66 59298 → 22 [ACK] Seq=12245 Ack=134181 Win=3666 Len=0 TSval=3915244 TSecr=4511578
  349 13.178093800  10.6.15.144 → 192.168.1.16 SSH 1514 Server: Encrypted packet (len=1448)
  350 13.178110532 192.168.1.16 → 10.6.15.144  TCP 66 59298 → 22 [ACK] Seq=12245 Ack=135629 Win=3666 Len=0 TSval=3915247 TSecr=4511581
  351 13.178276898  10.6.15.144 → 192.168.1.16 SSH 1514 Server: Encrypted packet (len=1448)
  352 13.178293492 192.168.1.16 → 10.6.15.144  TCP 66 59298 → 22 [ACK] Seq=12245 Ack=137077 Win=3666 Len=0 TSval=3915247 TSecr=4511581
  353 13.178619543  10.6.15.144 → 192.168.1.16 SSH 1514 Server: Encrypted packet (len=1448)
  354 13.178625695 192.168.1.16 → 10.6.15.144  TCP 66 59298 → 22 [ACK] Seq=12245 Ack=138525 Win=3666 Len=0 TSval=3915247 TSecr=4511581
  355 13.189163150  10.6.15.144 → 192.168.1.16 SSH 1514 Server: Encrypted packet (len=1448)
  356 13.189180729 192.168.1.16 → 10.6.15.144  TCP 66 59298 → 22 [ACK] Seq=12245 Ack=139973 Win=3666 Len=0 TSval=3915249 TSecr=4511583
  357 13.189302130  10.6.15.144 → 192.168.1.16 SSH 1514 Server: Encrypted packet (len=1448)
  358 13.189310673 192.168.1.16 → 10.6.15.144  TCP 66 59298 → 22 [ACK] Seq=12245 Ack=141421 Win=3666 Len=0 TSval=3915250 TSecr=4511583
  359 13.189428352 192.168.1.16 → 10.6.15.144  SSH 102 Client: Encrypted packet (len=36)
  360 13.189969930  10.6.15.144 → 192.168.1.16 SSH 1514 Server: Encrypted packet (len=1448)
  361 13.202022343  10.6.15.144 → 192.168.1.16 SSH 1514 Server: Encrypted packet (len=1448)
  362 13.202040202 192.168.1.16 → 10.6.15.144  TCP 66 59298 → 22 [ACK] Seq=12281 Ack=144317 Win=3666 Len=0 TSval=3915253 TSecr=4511583
  363 13.202164124  10.6.15.144 → 192.168.1.16 SSH 1514 Server: Encrypted packet (len=1448)
  364 13.212708057  10.6.15.144 → 192.168.1.16 SSH 1514 Server: Encrypted packet (len=1448)
  365 13.212730638 192.168.1.16 → 10.6.15.144  TCP 66 59298 → 22 [ACK] Seq=12281 Ack=147213 Win=3666 Len=0 TSval=3915255 TSecr=4511586
  366 13.212869866  10.6.15.144 → 192.168.1.16 SSH 1514 Server: Encrypted packet (len=1448)
  367 13.226692776  10.6.15.144 → 192.168.1.16 SSH 1514 Server: Encrypted packet (len=1448)
  368 13.226710599 192.168.1.16 → 10.6.15.144  TCP 66 59298 → 22 [ACK] Seq=12281 Ack=150109 Win=3666 Len=0 TSval=3915259 TSecr=4511589
  369 13.226891162  10.6.15.144 → 192.168.1.16 SSH 1514 Server: Encrypted packet (len=1448)
  370 13.227081575  10.6.15.144 → 192.168.1.16 SSH 1514 Server: Encrypted packet (len=1448)
  371 13.227089626 192.168.1.16 → 10.6.15.144  TCP 66 59298 → 22 [ACK] Seq=12281 Ack=153005 Win=3666 Len=0 TSval=3915259 TSecr=4511592
  372 13.249545006  10.6.15.144 → 192.168.1.16 SSH 1514 Server: Encrypted packet (len=1448)
  373 13.249682307  10.6.15.144 → 192.168.1.16 SSH 1514 Server: Encrypted packet (len=1448)
  374 13.249693310 192.168.1.16 → 10.6.15.144  TCP 66 59298 → 22 [ACK] Seq=12281 Ack=155901 Win=3666 Len=0 TSval=3915265 TSecr=4511595
  375 13.249859054  10.6.15.144 → 192.168.1.16 SSH 1514 Server: Encrypted packet (len=1448)
  376 13.252883230 192.168.1.16 → 10.6.15.144  SSH 134 Client: Encrypted packet (len=68)
  377 13.253125763 192.168.1.16 → 10.6.15.144  SSH 150 Client: Encrypted packet (len=84)
  378 13.260152484  10.6.15.144 → 192.168.1.16 SSH 1514 Server: [TCP Previous segment not captured] , Encrypted packet (len=1448)
  379 13.260177361 192.168.1.16 → 10.6.15.144  TCP 78 [TCP Dup ACK 376#1] 59298 → 22 [ACK] Seq=12433 Ack=157349 Win=3666 Len=0 TSval=3915267 TSecr=4511595 SLE=158797 SRE=160245
  380 13.260327107  10.6.15.144 → 192.168.1.16 SSH 1514 Server: Encrypted packet (len=1448)
  381 13.260337034 192.168.1.16 → 10.6.15.144  TCP 78 [TCP Dup ACK 376#2] 59298 → 22 [ACK] Seq=12433 Ack=157349 Win=3666 Len=0 TSval=3915267 TSecr=4511595 SLE=158797 SRE=161693
  382 13.263037097  10.6.15.144 → 192.168.1.16 TCP 66 22 → 59298 [ACK] Seq=161693 Ack=12433 Win=1452 Len=0 TSval=4511602 TSecr=3915265
  383 13.271533824  10.6.15.144 → 192.168.1.16 SSH 1514 Server: Encrypted packet (len=1448)
  384 13.271557246 192.168.1.16 → 10.6.15.144  TCP 78 [TCP Dup ACK 376#3] 59298 → 22 [ACK] Seq=12433 Ack=157349 Win=3666 Len=0 TSval=3915270 TSecr=4511595 SLE=158797 SRE=163141
  385 13.271718055  10.6.15.144 → 192.168.1.16 SSH 1514 Server: Encrypted packet (len=1448)
  386 13.271728129 192.168.1.16 → 10.6.15.144  TCP 78 [TCP Dup ACK 376#4] 59298 → 22 [ACK] Seq=12433 Ack=157349 Win=3666 Len=0 TSval=3915270 TSecr=4511595 SLE=158797 SRE=164589
  387 13.271906321  10.6.15.144 → 192.168.1.16 SSH 1514 Server: Encrypted packet (len=1448)
  388 13.271913652 192.168.1.16 → 10.6.15.144  TCP 78 [TCP Dup ACK 376#5] 59298 → 22 [ACK] Seq=12433 Ack=157349 Win=3666 Len=0 TSval=3915270 TSecr=4511595 SLE=158797 SRE=166037
  389 13.283161488  10.6.15.144 → 192.168.1.16 SSH 1514 Server: [TCP Fast Retransmission] , Encrypted packet (len=1448)
  390 13.283185445 192.168.1.16 → 10.6.15.144  TCP 66 59298 → 22 [ACK] Seq=12433 Ack=166037 Win=3666 Len=0 TSval=3915273 TSecr=4511607
  391 13.293712980  10.6.15.144 → 192.168.1.16 SSH 1514 Server: [TCP Previous segment not captured] , Encrypted packet (len=1448)
  392 13.293736040 192.168.1.16 → 10.6.15.144  TCP 78 [TCP Dup ACK 390#1] 59298 → 22 [ACK] Seq=12433 Ack=166037 Win=3666 Len=0 TSval=3915276 TSecr=4511607 SLE=167485 SRE=168933
  393 13.298297442 192.168.1.16 → 10.6.15.144  SSH 274 Client: Encrypted packet (len=196)
  394 13.304428220  10.6.15.144 → 192.168.1.16 SSH 1514 Server: Encrypted packet (len=1448)
  395 13.304447230 192.168.1.16 → 10.6.15.144  TCP 78 [TCP Dup ACK 390#2] 59298 → 22 [ACK] Seq=12629 Ack=166037 Win=3666 Len=0 TSval=3915278 TSecr=4511607 SLE=167485 SRE=170381
  396 13.311970653 192.168.1.16 → 10.6.15.144  SSH 122 Client: Encrypted packet (len=44)
  397 13.313202668 192.168.1.16 → 10.6.15.144  SSH 378 Client: Encrypted packet (len=300)
  398 13.315020694  10.6.15.144 → 192.168.1.16 SSH 1514 Server: Encrypted packet (len=1448)
  399 13.315042652 192.168.1.16 → 10.6.15.144  TCP 78 [TCP Dup ACK 390#3] 59298 → 22 [ACK] Seq=12973 Ack=166037 Win=3666 Len=0 TSval=3915281 TSecr=4511607 SLE=167485 SRE=171829
  400 13.325775877  10.6.15.144 → 192.168.1.16 SSH 1514 Server: [TCP Fast Retransmission] , Encrypted packet (len=1448)
  401 13.325805104 192.168.1.16 → 10.6.15.144  TCP 66 59298 → 22 [ACK] Seq=12973 Ack=171829 Win=3666 Len=0 TSval=3915284 TSecr=4511618
  402 13.325957262  10.6.15.144 → 192.168.1.16 SSH 1514 Server: Encrypted packet (len=1448)
  403 13.325963114 192.168.1.16 → 10.6.15.144  TCP 66 59298 → 22 [ACK] Seq=12973 Ack=173277 Win=3666 Len=0 TSval=3915284 TSecr=4511618
  404 13.329553702 192.168.1.16 → 10.6.15.144  SSH 158 Client: Encrypted packet (len=92)
  405 13.339935232  10.6.15.144 → 192.168.1.16 SSH 1514 Server: Encrypted packet (len=1448)
  406 13.340116799  10.6.15.144 → 192.168.1.16 SSH 1514 Server: Encrypted packet (len=1448)
  407 13.340129782 192.168.1.16 → 10.6.15.144  TCP 66 59298 → 22 [ACK] Seq=13065 Ack=176173 Win=3666 Len=0 TSval=3915287 TSecr=4511621
  408 13.340308088  10.6.15.144 → 192.168.1.16 SSH 1514 Server: Encrypted packet (len=1448)
  409 13.354039022  10.6.15.144 → 192.168.1.16 SSH 1514 Server: Encrypted packet (len=1448)
  410 13.354067160 192.168.1.16 → 10.6.15.144  TCP 66 59298 → 22 [ACK] Seq=13065 Ack=179069 Win=3666 Len=0 TSval=3915291 TSecr=4511621
  411 13.354219463  10.6.15.144 → 192.168.1.16 SSH 1514 Server: Encrypted packet (len=1448)
  412 13.365166607  10.6.15.144 → 192.168.1.16 SSH 1514 Server: [TCP Previous segment not captured] , Encrypted packet (len=1448)
  413 13.365184784 192.168.1.16 → 10.6.15.144  TCP 78 59298 → 22 [ACK] Seq=13065 Ack=180517 Win=3666 Len=0 TSval=3915293 TSecr=4511624 SLE=181965 SRE=183413
  414 13.376486072  10.6.15.144 → 192.168.1.16 SSH 1514 Server: Encrypted packet (len=1448)
  415 13.376503791 192.168.1.16 → 10.6.15.144  TCP 78 [TCP Dup ACK 413#1] 59298 → 22 [ACK] Seq=13065 Ack=180517 Win=3666 Len=0 TSval=3915296 TSecr=4511624 SLE=181965 SRE=184861
  416 13.376661737  10.6.15.144 → 192.168.1.16 SSH 1514 Server: Encrypted packet (len=1448)
  417 13.376665023 192.168.1.16 → 10.6.15.144  TCP 78 [TCP Dup ACK 413#2] 59298 → 22 [ACK] Seq=13065 Ack=180517 Win=3666 Len=0 TSval=3915296 TSecr=4511624 SLE=181965 SRE=186309
  418 14.726994046 192.168.1.16 → 10.6.15.144  SSH 114 Client: Encrypted packet (len=36)
  419 14.728820968 192.168.1.16 → 10.6.15.144  SSH 122 Client: Encrypted packet (len=44)
  420 14.734993590  10.6.15.144 → 192.168.1.16 SSH 1514 Server: [TCP Fast Retransmission] , Encrypted packet (len=1448)
  421 14.735019517 192.168.1.16 → 10.6.15.144  TCP 66 59298 → 22 [ACK] Seq=13145 Ack=186309 Win=3666 Len=0 TSval=3915636 TSecr=4511690
  422 14.735619812  10.6.15.144 → 192.168.1.16 SSH 1514 Server: [TCP Spurious Retransmission] , Encrypted packet (len=1448)
  423 14.735624483 192.168.1.16 → 10.6.15.144  TCP 78 [TCP Dup ACK 421#1] 59298 → 22 [ACK] Seq=13145 Ack=186309 Win=3666 Len=0 TSval=3915636 TSecr=4511690 SLE=180517 SRE=181965
  424 14.736105654 192.168.1.16 → 10.6.15.144  SSH 206 Client: Encrypted packet (len=140)
  425 14.737591917 192.168.1.16 → 10.6.15.144  SSH 206 Client: Encrypted packet (len=140)
  426 14.740929042  10.6.15.144 → 192.168.1.16 TCP 66 [TCP Previous segment not captured] 22 → 59298 [ACK] Seq=187757 Ack=13145 Win=1452 Len=0 TSval=4511971 TSecr=3915634
  427 14.740947681 192.168.1.16 → 10.6.15.144  SSH 346 Client: Encrypted packet (len=280)
  428 14.746739818  10.6.15.144 → 192.168.1.16 SSH 1514 Server: Encrypted packet (len=1448)
  429 14.746763913 192.168.1.16 → 10.6.15.144  TCP 78 [TCP Dup ACK 421#2] 59298 → 22 [ACK] Seq=13705 Ack=186309 Win=3666 Len=0 TSval=3915639 TSecr=4511690 SLE=187757 SRE=189205
  430 14.746923727  10.6.15.144 → 192.168.1.16 SSH 1514 Server: Encrypted packet (len=1448)
  431 14.746935959 192.168.1.16 → 10.6.15.144  TCP 78 [TCP Dup ACK 421#3] 59298 → 22 [ACK] Seq=13705 Ack=186309 Win=3666 Len=0 TSval=3915639 TSecr=4511690 SLE=187757 SRE=190653
  432 14.747111898  10.6.15.144 → 192.168.1.16 SSH 1514 Server: Encrypted packet (len=1448)
  433 14.747122146 192.168.1.16 → 10.6.15.144  TCP 78 [TCP Dup ACK 421#4] 59298 → 22 [ACK] Seq=13705 Ack=186309 Win=3666 Len=0 TSval=3915639 TSecr=4511690 SLE=187757 SRE=192101
  434 14.749014570  10.6.15.144 → 192.168.1.16 TCP 66 22 → 59298 [ACK] Seq=192101 Ack=13425 Win=1452 Len=0 TSval=4511973 TSecr=3915636
  435 14.753155118 192.168.1.16 → 10.6.15.144  SSH 114 Client: Encrypted packet (len=36)
  436 14.753428701 192.168.1.16 → 10.6.15.144  SSH 150 Client: Encrypted packet (len=72)
  437 14.753700927 192.168.1.16 → 10.6.15.144  SSH 270 Client: Encrypted packet (len=192)
  438 14.758738114  10.6.15.144 → 192.168.1.16 SSH 1514 Server: [TCP Fast Retransmission] , Encrypted packet (len=1448)
  439 14.758764816 192.168.1.16 → 10.6.15.144  SSH 1194 Client: Encrypted packet (len=1128)
  440 14.758924388  10.6.15.144 → 192.168.1.16 SSH 1514 Server: Encrypted packet (len=1448)
  441 14.759184548  10.6.15.144 → 192.168.1.16 SSH 962 Server: Encrypted packet (len=896)
  442 14.759193171 192.168.1.16 → 10.6.15.144  TCP 66 59298 → 22 [ACK] Seq=15133 Ack=194445 Win=3666 Len=0 TSval=3915642 TSecr=4511976
  443 14.763420055  10.6.15.144 → 192.168.1.16 TCP 66 22 → 59298 [ACK] Seq=194445 Ack=13813 Win=1452 Len=0 TSval=4511977 TSecr=3915640
  444 14.763434195 192.168.1.16 → 10.6.15.144  SSH 298 Client: Encrypted packet (len=232)
  445 14.766995790 192.168.1.16 → 10.6.15.144  SSH 290 Client: Encrypted packet (len=224)
  446 14.770333278  10.6.15.144 → 192.168.1.16 TCP 66 22 → 59298 [ACK] Seq=194445 Ack=15133 Win=1452 Len=0 TSval=4511979 TSecr=3915641
  447 14.770348658 192.168.1.16 → 10.6.15.144  SSH 206 Client: Encrypted packet (len=140)
  448 14.770735713 192.168.1.16 → 10.6.15.144  SSH 206 Client: Encrypted packet (len=140)
  449 14.771472347 192.168.1.16 → 10.6.15.144  SSH 206 Client: Encrypted packet (len=140)
  450 14.777396558  10.6.15.144 → 192.168.1.16 TCP 66 22 → 59298 [ACK] Seq=194445 Ack=15589 Win=1452 Len=0 TSval=4511980 TSecr=3915643
  451 14.777421294 192.168.1.16 → 10.6.15.144  SSH 678 Client: Encrypted packet (len=612)
  452 14.781145993  10.6.15.144 → 192.168.1.16 TCP 66 22 → 59298 [ACK] Seq=194445 Ack=15869 Win=1452 Len=0 TSval=4511981 TSecr=3915645
  453 14.783859530 192.168.1.16 → 10.6.15.144  SSH 166 Client: Encrypted packet (len=100)
  454 14.788830831  10.6.15.144 → 192.168.1.16 TCP 66 22 → 59298 [ACK] Seq=194445 Ack=16621 Win=1452 Len=0 TSval=4511983 TSecr=3915645
  455 14.789431721 192.168.1.16 → 10.6.15.144  SSH 102 Client: Encrypted packet (len=36)
  456 14.789980357 192.168.1.16 → 10.6.15.144  SSH 330 Client: Encrypted packet (len=264)
  457 14.795055819 192.168.1.16 → 10.6.15.144  SSH 230 Client: Encrypted packet (len=164)
  458 14.795716206 192.168.1.16 → 10.6.15.144  SSH 414 Client: Encrypted packet (len=348)
  459 14.798903653  10.6.15.144 → 192.168.1.16 SSH 246 Server: Encrypted packet (len=180)
  460 14.801536236  10.6.15.144 → 192.168.1.16 TCP 66 22 → 59298 [ACK] Seq=194625 Ack=17021 Win=1452 Len=0 TSval=4511987 TSecr=3915650
  461 14.805997903 192.168.1.16 → 10.6.15.144  SSH 302 Client: Encrypted packet (len=236)
  462 14.808250104  10.6.15.144 → 192.168.1.16 TCP 66 22 → 59298 [ACK] Seq=194625 Ack=17533 Win=1452 Len=0 TSval=4511988 TSecr=3915651
  463 14.809021554 192.168.1.16 → 10.6.15.144  SSH 222 Client: Encrypted packet (len=156)
  464 14.811259649 192.168.1.16 → 10.6.15.144  SSH 1514 Client: Encrypted packet (len=1448)
  465 14.812205345 192.168.1.16 → 10.6.15.144  SSH 1514 Client: Encrypted packet (len=1448)
  466 14.815860425 192.168.1.16 → 10.6.15.144  SSH 822 Client: Encrypted packet (len=756)
  467 14.819584512  10.6.15.144 → 192.168.1.16 TCP 66 22 → 59298 [ACK] Seq=194625 Ack=17925 Win=1452 Len=0 TSval=4511991 TSecr=3915654
  468 14.825804139  10.6.15.144 → 192.168.1.16 TCP 66 22 → 59298 [ACK] Seq=194625 Ack=20821 Win=1452 Len=0 TSval=4511993 TSecr=3915655
  469 14.826999628 10.22.18.209 → 224.0.0.252  LLMNR 64 Standard query 0x7685 A wpad
  470 14.828009523  10.6.15.144 → 192.168.1.16 SSH 166 Server: Encrypted packet (len=100)
  471 14.828285836 192.168.1.16 → 10.6.15.144  SSH 134 Client: Encrypted packet (len=68)
  472 14.829114657  10.6.15.144 → 192.168.1.16 SSH 134 Server: Encrypted packet (len=68)
  473 14.834558161 192.168.1.16 → 10.6.15.144  SSH 110 Client: Encrypted packet (len=44)
  474 14.844702643  10.6.15.144 → 192.168.1.16 TCP 66 22 → 59298 [ACK] Seq=194793 Ack=21689 Win=1452 Len=0 TSval=4511997 TSecr=3915659
  475 14.926590882 10.22.18.209 → 224.0.0.252  LLMNR 64 Standard query 0x7685 A wpad
  476 16.004886263  10.6.15.144 → 192.168.1.16 SSH 1514 Server: Encrypted packet (len=1448)
  477 16.005062823  10.6.15.144 → 192.168.1.16 SSH 1514 Server: Encrypted packet (len=1448)
  478 16.005067997 192.168.1.16 → 10.6.15.144  TCP 66 59298 → 22 [ACK] Seq=21689 Ack=197689 Win=3666 Len=0 TSval=3915953 TSecr=4512102
  479 16.005290709  10.6.15.144 → 192.168.1.16 SSH 1514 Server: Encrypted packet (len=1448)
  480 16.005504707  10.6.15.144 → 192.168.1.16 SSH 1514 Server: Encrypted packet (len=1448)
  481 16.005511215 192.168.1.16 → 10.6.15.144  TCP 66 59298 → 22 [ACK] Seq=21689 Ack=200585 Win=3666 Len=0 TSval=3915954 TSecr=4512102
  482 16.006034443 192.168.1.16 → 10.6.15.144  SSH 206 Client: Encrypted packet (len=140)
  483 16.007761091 192.168.1.16 → 10.6.15.144  SSH 206 Client: Encrypted packet (len=140)
  484 16.009538956 192.168.1.16 → 10.6.15.144  SSH 206 Client: Encrypted packet (len=140)
  485 16.010965623 192.168.1.16 → 10.6.15.144  SSH 126 Client: Encrypted packet (len=60)
  486 16.014516800 192.168.1.16 → 10.6.15.144  SSH 142 Client: Encrypted packet (len=76)
  487 16.014715878 192.168.1.16 → 10.6.15.144  SSH 218 Client: Encrypted packet (len=152)
  488 16.015126657 192.168.1.16 → 10.6.15.144  SSH 390 Client: Encrypted packet (len=324)
  489 16.016617059  10.6.15.144 → 192.168.1.16 SSH 1514 Server: Encrypted packet (len=1448)
  490 16.016823103  10.6.15.144 → 192.168.1.16 SSH 1514 Server: Encrypted packet (len=1448)
  491 16.016837335 192.168.1.16 → 10.6.15.144  TCP 66 59298 → 22 [ACK] Seq=22721 Ack=203481 Win=3666 Len=0 TSval=3915956 TSecr=4512290
  492 16.017037041  10.6.15.144 → 192.168.1.16 SSH 1514 Server: Encrypted packet (len=1448)
  493 16.018462349  10.6.15.144 → 192.168.1.16 TCP 66 22 → 59298 [ACK] Seq=204929 Ack=21969 Win=1452 Len=0 TSval=4512291 TSecr=3915954
  494 16.018479769 192.168.1.16 → 10.6.15.144  SSH 446 Client: Encrypted packet (len=380)
  495 16.018817229 192.168.1.16 → 10.6.15.144  SSH 254 Client: Encrypted packet (len=188)
  496 16.021187534  10.6.15.144 → 192.168.1.16 TCP 66 22 → 59298 [ACK] Seq=204929 Ack=22169 Win=1452 Len=0 TSval=4512291 TSecr=3915955
  497 16.024485191  10.6.15.144 → 192.168.1.16 TCP 66 22 → 59298 [ACK] Seq=204929 Ack=22397 Win=1452 Len=0 TSval=4512292 TSecr=3915956
  498 16.028142412  10.6.15.144 → 192.168.1.16 SSH 1514 Server: Encrypted packet (len=1448)
  499 16.028343170  10.6.15.144 → 192.168.1.16 SSH 1514 Server: Encrypted packet (len=1448)
  500 16.028353724 192.168.1.16 → 10.6.15.144  TCP 66 59298 → 22 [ACK] Seq=23289 Ack=207825 Win=3666 Len=0 TSval=3915959 TSecr=4512293
  501 16.030001303  10.6.15.144 → 192.168.1.16 SSH 1514 Server: Encrypted packet (len=1448)
  502 16.042872781  10.6.15.144 → 192.168.1.16 SSH 1514 Server: [TCP Previous segment not captured] , Encrypted packet (len=1448)
  503 16.042892174 192.168.1.16 → 10.6.15.144  TCP 78 59298 → 22 [ACK] Seq=23289 Ack=209273 Win=3666 Len=0 TSval=3915963 TSecr=4512293 SLE=210721 SRE=212169
  504 16.223449571 192.168.1.16 → 10.6.15.144  SSH 146 Client: Encrypted packet (len=68)
  505 16.255559039  10.6.15.144 → 192.168.1.16 SSH 1514 Server: Encrypted packet (len=1448)
  506 16.255584527 192.168.1.16 → 10.6.15.144  TCP 78 [TCP Dup ACK 503#1] 59298 → 22 [ACK] Seq=23357 Ack=209273 Win=3666 Len=0 TSval=3916016 TSecr=4512293 SLE=210721 SRE=213617
  507 16.255869372  10.6.15.144 → 192.168.1.16 SSH 1514 Server: Encrypted packet (len=1448)
  508 16.255878412 192.168.1.16 → 10.6.15.144  TCP 78 [TCP Dup ACK 503#2] 59298 → 22 [ACK] Seq=23357 Ack=209273 Win=3666 Len=0 TSval=3916016 TSecr=4512293 SLE=210721 SRE=215065
  509 16.256199073  10.6.15.144 → 192.168.1.16 SSH 1514 Server: Encrypted packet (len=1448)
  510 16.256207547 192.168.1.16 → 10.6.15.144  TCP 78 [TCP Dup ACK 503#3] 59298 → 22 [ACK] Seq=23357 Ack=209273 Win=3666 Len=0 TSval=3916016 TSecr=4512293 SLE=210721 SRE=216513
  511 16.267247522  10.6.15.144 → 192.168.1.16 SSH 1514 Server: Encrypted packet (len=1448)
  512 16.267256833 192.168.1.16 → 10.6.15.144  TCP 78 [TCP Dup ACK 503#4] 59298 → 22 [ACK] Seq=23357 Ack=209273 Win=3666 Len=0 TSval=3916019 TSecr=4512293 SLE=210721 SRE=217961
  513 16.267620689  10.6.15.144 → 192.168.1.16 SSH 1514 Server: [TCP Fast Retransmission] , Encrypted packet (len=1448)
  514 16.267630807 192.168.1.16 → 10.6.15.144  TCP 66 59298 → 22 [ACK] Seq=23357 Ack=217961 Win=3666 Len=0 TSval=3916019 TSecr=4512353
  515 16.278190003  10.6.15.144 → 192.168.1.16 SSH 1514 Server: Encrypted packet (len=1448)
  516 16.278207569 192.168.1.16 → 10.6.15.144  TCP 66 59298 → 22 [ACK] Seq=23357 Ack=219409 Win=3666 Len=0 TSval=3916022 TSecr=4512356
  517 16.278364934  10.6.15.144 → 192.168.1.16 SSH 1514 Server: Encrypted packet (len=1448)
  518 16.278373927 192.168.1.16 → 10.6.15.144  TCP 66 59298 → 22 [ACK] Seq=23357 Ack=220857 Win=3666 Len=0 TSval=3916022 TSecr=4512356
  519 16.280091944 192.168.1.16 → 10.6.15.144  SSH 126 Client: Encrypted packet (len=60)
  520 16.289455571  10.6.15.144 → 192.168.1.16 SSH 1514 Server: Encrypted packet (len=1448)
  521 16.289656532  10.6.15.144 → 192.168.1.16 SSH 1514 Server: Encrypted packet (len=1448)
  522 16.289668660 192.168.1.16 → 10.6.15.144  TCP 66 59298 → 22 [ACK] Seq=23417 Ack=223753 Win=3666 Len=0 TSval=3916025 TSecr=4512358
  523 16.289726031 192.168.1.16 → 10.6.15.144  SSH 102 Client: Encrypted packet (len=36)
  524 16.289867159  10.6.15.144 → 192.168.1.16 SSH 1514 Server: Encrypted packet (len=1448)
  525 16.290802948 192.168.1.16 → 10.6.15.144  SSH 206 Client: Encrypted packet (len=140)
  526 16.300436839  10.6.15.144 → 192.168.1.16 SSH 1514 Server: Encrypted packet (len=1448)
  527 16.300640172  10.6.15.144 → 192.168.1.16 SSH 1514 Server: Encrypted packet (len=1448)
  528 16.300647792 192.168.1.16 → 10.6.15.144  TCP 66 59298 → 22 [ACK] Seq=23593 Ack=228097 Win=3666 Len=0 TSval=3916027 TSecr=4512361
  529 16.301002188  10.6.15.144 → 192.168.1.16 SSH 1514 Server: Encrypted packet (len=1448)
  530 16.301345701  10.6.15.144 → 192.168.1.16 SSH 1514 Server: Encrypted packet (len=1448)
  531 16.301351732 192.168.1.16 → 10.6.15.144  TCP 66 59298 → 22 [ACK] Seq=23593 Ack=230993 Win=3666 Len=0 TSval=3916028 TSecr=4512361
  532 16.314132469  10.6.15.144 → 192.168.1.16 SSH 1514 Server: Encrypted packet (len=1448)
  533 16.314329717  10.6.15.144 → 192.168.1.16 SSH 1514 Server: Encrypted packet (len=1448)
  534 16.314341331 192.168.1.16 → 10.6.15.144  TCP 66 59298 → 22 [ACK] Seq=23593 Ack=233889 Win=3666 Len=0 TSval=3916031 TSecr=4512364
  535 16.314545714  10.6.15.144 → 192.168.1.16 SSH 1514 Server: Encrypted packet (len=1448)
  536 16.314754357  10.6.15.144 → 192.168.1.16 SSH 1514 Server: Encrypted packet (len=1448)
  537 16.314758221 192.168.1.16 → 10.6.15.144  TCP 66 59298 → 22 [ACK] Seq=23593 Ack=236785 Win=3666 Len=0 TSval=3916031 TSecr=4512364
  538 16.326072545  10.6.15.144 → 192.168.1.16 SSH 1514 Server: Encrypted packet (len=1448)
  539 16.326277833  10.6.15.144 → 192.168.1.16 SSH 1514 Server: Encrypted packet (len=1448)
  540 16.326287788 192.168.1.16 → 10.6.15.144  TCP 66 59298 → 22 [ACK] Seq=23593 Ack=239681 Win=3666 Len=0 TSval=3916034 TSecr=4512367
  541 16.326477309  10.6.15.144 → 192.168.1.16 SSH 1514 Server: Encrypted packet (len=1448)
  542 16.326702393  10.6.15.144 → 192.168.1.16 SSH 1514 Server: Encrypted packet (len=1448)
  543 16.326709138 192.168.1.16 → 10.6.15.144  TCP 66 59298 → 22 [ACK] Seq=23593 Ack=242577 Win=3666 Len=0 TSval=3916034 TSecr=4512367
  544 16.328133711 192.168.1.16 → 10.6.15.144  SSH 126 Client: Encrypted packet (len=60)
  545 16.330356044 192.168.1.16 → 10.6.15.144  SSH 142 Client: Encrypted packet (len=76)
  546 16.337590451  10.6.15.144 → 192.168.1.16 SSH 1514 Server: [TCP Previous segment not captured] , Encrypted packet (len=1448)
  547 16.337609608 192.168.1.16 → 10.6.15.144  TCP 78 [TCP Dup ACK 543#1] 59298 → 22 [ACK] Seq=23729 Ack=242577 Win=3666 Len=0 TSval=3916037 TSecr=4512367 SLE=244025 SRE=245473
  548 16.337793172  10.6.15.144 → 192.168.1.16 SSH 1514 Server: Encrypted packet (len=1448)
  549 16.337798397 192.168.1.16 → 10.6.15.144  TCP 78 [TCP Dup ACK 543#2] 59298 → 22 [ACK] Seq=23729 Ack=242577 Win=3666 Len=0 TSval=3916037 TSecr=4512367 SLE=244025 SRE=246921
  550 16.340286111  10.6.15.144 → 192.168.1.16 TCP 66 [TCP Previous segment not captured] 22 → 59298 [ACK] Seq=248369 Ack=23729 Win=1452 Len=0 TSval=4512371 TSecr=3916034
  551 16.349237462  10.6.15.144 → 192.168.1.16 SSH 1514 Server: Encrypted packet (len=1448)
  552 16.349255330 192.168.1.16 → 10.6.15.144  TCP 86 [TCP Dup ACK 543#3] 59298 → 22 [ACK] Seq=23729 Ack=242577 Win=3666 Len=0 TSval=3916040 TSecr=4512367 SLE=248369 SRE=249817 SLE=244025 SRE=246921
  553 16.349444744  10.6.15.144 → 192.168.1.16 SSH 1514 Server: Encrypted packet (len=1448)
  554 16.349448454 192.168.1.16 → 10.6.15.144  TCP 86 [TCP Dup ACK 543#4] 59298 → 22 [ACK] Seq=23729 Ack=242577 Win=3666 Len=0 TSval=3916040 TSecr=4512367 SLE=248369 SRE=251265 SLE=244025 SRE=246921
  555 16.360401628  10.6.15.144 → 192.168.1.16 SSH 1514 Server: [TCP Fast Retransmission] , Encrypted packet (len=1448)
  556 16.360425737 192.168.1.16 → 10.6.15.144  TCP 78 59298 → 22 [ACK] Seq=23729 Ack=246921 Win=3666 Len=0 TSval=3916042 TSecr=4512376 SLE=248369 SRE=251265
  557 16.371074648  10.6.15.144 → 192.168.1.16 SSH 1514 Server: Encrypted packet (len=1448)
  558 16.371096842 192.168.1.16 → 10.6.15.144  TCP 78 [TCP Dup ACK 556#1] 59298 → 22 [ACK] Seq=23729 Ack=246921 Win=3666 Len=0 TSval=3916045 TSecr=4512376 SLE=248369 SRE=252713
  559 16.381806819  10.6.15.144 → 192.168.1.16 TCP 1514 [TCP Retransmission] 22 → 59298 [ACK] Seq=246921 Ack=23729 Win=1452 Len=1448 TSval=4512381 TSecr=3916045
  560 16.381836073 192.168.1.16 → 10.6.15.144  TCP 66 59298 → 22 [ACK] Seq=23729 Ack=252713 Win=3666 Len=0 TSval=3916048 TSecr=4512381
  561 16.382008086  10.6.15.144 → 192.168.1.16 SSH 1514 Server: Encrypted packet (len=1448)
  562 16.382012260 192.168.1.16 → 10.6.15.144  TCP 66 59298 → 22 [ACK] Seq=23729 Ack=254161 Win=3666 Len=0 TSval=3916048 TSecr=4512381
  563 16.382222279 192.168.1.16 → 10.6.15.144  SSH 174 Client: Encrypted packet (len=108)
  564 16.393010524  10.6.15.144 → 192.168.1.16 SSH 1514 Server: Encrypted packet (len=1448)
  565 16.393220186  10.6.15.144 → 192.168.1.16 SSH 1514 Server: Encrypted packet (len=1448)
  566 16.393232880 192.168.1.16 → 10.6.15.144  TCP 66 59298 → 22 [ACK] Seq=23837 Ack=257057 Win=3666 Len=0 TSval=3916051 TSecr=4512384
  567 16.393576091  10.6.15.144 → 192.168.1.16 SSH 1514 Server: Encrypted packet (len=1448)
  568 16.394143279 192.168.1.16 → 10.6.15.144  SSH 138 Client: Encrypted packet (len=72)
  569 16.404051539  10.6.15.144 → 192.168.1.16 SSH 1514 Server: Encrypted packet (len=1448)
  570 16.404254942  10.6.15.144 → 192.168.1.16 SSH 1514 Server: Encrypted packet (len=1448)
  571 16.404270747 192.168.1.16 → 10.6.15.144  TCP 66 59298 → 22 [ACK] Seq=23909 Ack=261401 Win=3666 Len=0 TSval=3916053 TSecr=4512387
  572 16.414612176  10.6.15.144 → 192.168.1.16 SSH 1514 Server: [TCP Previous segment not captured] , Encrypted packet (len=1448)
  573 16.414638893 192.168.1.16 → 10.6.15.144  TCP 78 [TCP Dup ACK 571#1] 59298 → 22 [ACK] Seq=23909 Ack=261401 Win=3666 Len=0 TSval=3916056 TSecr=4512387 SLE=262849 SRE=264297
  574 16.414813432  10.6.15.144 → 192.168.1.16 SSH 1514 Server: Encrypted packet (len=1448)
  575 16.414824491 192.168.1.16 → 10.6.15.144  TCP 78 [TCP Dup ACK 571#2] 59298 → 22 [ACK] Seq=23909 Ack=261401 Win=3666 Len=0 TSval=3916056 TSecr=4512387 SLE=262849 SRE=265745
  576 16.425265589  10.6.15.144 → 192.168.1.16 SSH 1514 Server: Encrypted packet (len=1448)
  577 16.425289695 192.168.1.16 → 10.6.15.144  TCP 78 [TCP Dup ACK 571#3] 59298 → 22 [ACK] Seq=23909 Ack=261401 Win=3666 Len=0 TSval=3916059 TSecr=4512387 SLE=262849 SRE=267193
  578 16.425468762  10.6.15.144 → 192.168.1.16 SSH 1514 Server: Encrypted packet (len=1448)
  579 16.425481267 192.168.1.16 → 10.6.15.144  TCP 78 [TCP Dup ACK 571#4] 59298 → 22 [ACK] Seq=23909 Ack=261401 Win=3666 Len=0 TSval=3916059 TSecr=4512387 SLE=262849 SRE=268641
  580 16.425830204  10.6.15.144 → 192.168.1.16 SSH 1514 Server: Encrypted packet (len=1448)
  581 16.425842874 192.168.1.16 → 10.6.15.144  TCP 78 [TCP Dup ACK 571#5] 59298 → 22 [ACK] Seq=23909 Ack=261401 Win=3666 Len=0 TSval=3916059 TSecr=4512387 SLE=262849 SRE=270089
  582 16.436413282  10.6.15.144 → 192.168.1.16 SSH 1514 Server: [TCP Fast Retransmission] , Encrypted packet (len=1448)
  583 16.436435605 192.168.1.16 → 10.6.15.144  TCP 66 59298 → 22 [ACK] Seq=23909 Ack=270089 Win=3666 Len=0 TSval=3916061 TSecr=4512395
  584 16.436601802  10.6.15.144 → 192.168.1.16 SSH 1514 Server: Encrypted packet (len=1448)
  585 16.436606826 192.168.1.16 → 10.6.15.144  TCP 66 59298 → 22 [ACK] Seq=23909 Ack=271537 Win=3666 Len=0 TSval=3916061 TSecr=4512395
  586 16.447436799  10.6.15.144 → 192.168.1.16 SSH 1514 Server: [TCP Previous segment not captured] , Encrypted packet (len=1448)
  587 16.447455711 192.168.1.16 → 10.6.15.144  TCP 78 [TCP Dup ACK 585#1] 59298 → 22 [ACK] Seq=23909 Ack=271537 Win=3666 Len=0 TSval=3916064 TSecr=4512395 SLE=274433 SRE=275881
  588 16.458736471  10.6.15.144 → 192.168.1.16 SSH 1514 Server: Encrypted packet (len=1448)
  589 16.458754647 192.168.1.16 → 10.6.15.144  TCP 78 [TCP Dup ACK 585#2] 59298 → 22 [ACK] Seq=23909 Ack=271537 Win=3666 Len=0 TSval=3916067 TSecr=4512395 SLE=274433 SRE=277329
  590 16.469269504  10.6.15.144 → 192.168.1.16 SSH 1514 Server: [TCP Fast Retransmission] , Encrypted packet (len=1448)
  591 16.469293403 192.168.1.16 → 10.6.15.144  TCP 78 59298 → 22 [ACK] Seq=23909 Ack=272985 Win=3666 Len=0 TSval=3916070 TSecr=4512403 SLE=274433 SRE=277329
  592 16.479811934  10.6.15.144 → 192.168.1.16 SSH 1514 Server: Encrypted packet (len=1448)
  593 16.479829260 192.168.1.16 → 10.6.15.144  TCP 78 [TCP Dup ACK 591#1] 59298 → 22 [ACK] Seq=23909 Ack=272985 Win=3666 Len=0 TSval=3916072 TSecr=4512403 SLE=274433 SRE=278777
  594 16.490233370  10.6.15.144 → 192.168.1.16 TCP 1514 [TCP Retransmission] 22 → 59298 [ACK] Seq=272985 Ack=23909 Win=1452 Len=1448 TSval=4512409 TSecr=3916072
  595 16.490255618 192.168.1.16 → 10.6.15.144  TCP 66 59298 → 22 [ACK] Seq=23909 Ack=278777 Win=3666 Len=0 TSval=3916075 TSecr=4512409
  596 16.490547648  10.6.15.144 → 192.168.1.16 SSH 1514 Server: Encrypted packet (len=1448)
  597 16.490556039 192.168.1.16 → 10.6.15.144  TCP 66 59298 → 22 [ACK] Seq=23909 Ack=280225 Win=3666 Len=0 TSval=3916075 TSecr=4512409
  598 16.503035581  10.6.15.144 → 192.168.1.16 SSH 1514 Server: Encrypted packet (len=1448)
  599 16.503052821 192.168.1.16 → 10.6.15.144  TCP 66 59298 → 22 [ACK] Seq=23909 Ack=281673 Win=3666 Len=0 TSval=3916078 TSecr=4512411
  600 16.503352105  10.6.15.144 → 192.168.1.16 SSH 1514 Server: Encrypted packet (len=1448)
  601 16.503358139 192.168.1.16 → 10.6.15.144  TCP 66 59298 → 22 [ACK] Seq=23909 Ack=283121 Win=3666 Len=0 TSval=3916078 TSecr=4512411
  602 16.503596745 192.168.1.16 → 10.6.15.144  SSH 102 Client: Encrypted packet (len=36)
  603 16.503675191  10.6.15.144 → 192.168.1.16 SSH 1514 Server: Encrypted packet (len=1448)
  604 16.504532612 192.168.1.16 → 10.6.15.144  SSH 166 Client: Encrypted packet (len=100)
  605 16.504886242 192.168.1.16 → 10.6.15.144  SSH 126 Client: Encrypted packet (len=60)
  606 16.514041406  10.6.15.144 → 192.168.1.16 SSH 1514 Server: Encrypted packet (len=1448)
  607 16.514354890  10.6.15.144 → 192.168.1.16 SSH 1514 Server: Encrypted packet (len=1448)
  608 16.514381555 192.168.1.16 → 10.6.15.144  TCP 66 59298 → 22 [ACK] Seq=24105 Ack=287465 Win=3666 Len=0 TSval=3916081 TSecr=4512415
  609 16.515764540  10.6.15.144 → 192.168.1.16 SSH 1514 Server: Encrypted packet (len=1448)
  610 16.525744990  10.6.15.144 → 192.168.1.16 SSH 1514 Server: Encrypted packet (len=1448)
  611 16.525770062 192.168.1.16 → 10.6.15.144  TCP 66 59298 → 22 [ACK] Seq=24105 Ack=290361 Win=3666 Len=0 TSval=3916084 TSecr=4512415
  612 16.526314289  10.6.15.144 → 192.168.1.16 SSH 1514 Server: Encrypted packet (len=1448)
  613 16.536608795  10.6.15.144 → 192.168.1.16 SSH 450 Server: Encrypted packet (len=384)
  614 16.536627390 192.168.1.16 → 10.6.15.144  TCP 66 59298 → 22 [ACK] Seq=24105 Ack=292193 Win=3666 Len=0 TSval=3916086 TSecr=4512417
  615 18.015449065  10.6.15.144 → 192.168.1.16 SSH 1514 Server: Encrypted packet (len=1448)
  616 18.015556346  10.6.15.144 → 192.168.1.16 SSH 1382 Server: Encrypted packet (len=1316)
  617 18.015566172 192.168.1.16 → 10.6.15.144  TCP 66 59298 → 22 [ACK] Seq=24105 Ack=294957 Win=3666 Len=0 TSval=3916456 TSecr=4512466
  618 18.015648457  10.6.15.144 → 192.168.1.16 SSH 854 Server: Encrypted packet (len=788)
  619 18.015773004  10.6.15.144 → 192.168.1.16 TCP 854 [TCP Retransmission] 22 → 59298 [PSH, ACK] Seq=294957 Ack=24105 Win=1452 Len=788 TSval=4512475 TSecr=3916086
  620 18.015780647 192.168.1.16 → 10.6.15.144  TCP 78 59298 → 22 [ACK] Seq=24105 Ack=295745 Win=3666 Len=0 TSval=3916456 TSecr=4512475 SLE=294957 SRE=295745
  621 18.016122472  10.6.15.144 → 192.168.1.16 TCP 1514 [TCP Out-Of-Order] 22 → 59298 [ACK] Seq=292193 Ack=24105 Win=1452 Len=1448 TSval=4512532 TSecr=3916086
  622 18.016126788 192.168.1.16 → 10.6.15.144  TCP 78 [TCP Dup ACK 620#1] 59298 → 22 [ACK] Seq=24105 Ack=295745 Win=3666 Len=0 TSval=3916456 TSecr=4512475 SLE=292193 SRE=293641
  623 18.016583732 192.168.1.16 → 10.6.15.144  SSH 206 Client: Encrypted packet (len=140)
  624 18.019562373 192.168.1.16 → 10.6.15.144  SSH 142 Client: Encrypted packet (len=76)
  625 18.020897144 192.168.1.16 → 10.6.15.144  SSH 1022 Client: Encrypted packet (len=956)
  626 18.030599856  10.6.15.144 → 192.168.1.16 TCP 66 22 → 59298 [ACK] Seq=295745 Ack=24321 Win=1452 Len=0 TSval=4512794 TSecr=3916456
  627 18.069220742  10.6.15.144 → 192.168.1.16 TCP 66 22 → 59298 [ACK] Seq=295745 Ack=25277 Win=1452 Len=0 TSval=4512804 TSecr=3916457
  628 19.007288730  10.6.15.144 → 192.168.1.16 SSH 430 Server: Encrypted packet (len=364)
  629 19.007314624  10.6.15.144 → 192.168.1.16 SSH 134 Server: Encrypted packet (len=68)
  630 19.007358399  10.6.15.144 → 192.168.1.16 SSH 822 Server: Encrypted packet (len=756)
  631 19.007389707 192.168.1.16 → 10.6.15.144  TCP 66 59298 → 22 [ACK] Seq=25277 Ack=296933 Win=3666 Len=0 TSval=3916704 TSecr=4512843
  632 19.007617392  10.6.15.144 → 192.168.1.16 SSH 822 Server: [TCP Spurious Retransmission] , Encrypted packet (len=756)
  633 19.007625514 192.168.1.16 → 10.6.15.144  TCP 78 [TCP Dup ACK 631#1] 59298 → 22 [ACK] Seq=25277 Ack=296933 Win=3666 Len=0 TSval=3916704 TSecr=4513008 SLE=296177 SRE=296933
  634 19.008683519 192.168.1.16 → 10.6.15.144  SSH 126 Client: Encrypted packet (len=60)
  635 19.022665411  10.6.15.144 → 192.168.1.16 TCP 66 22 → 59298 [ACK] Seq=296933 Ack=25337 Win=1452 Len=0 TSval=4513042 TSecr=3916704
  636 19.702167165 192.168.1.16 → 192.168.1.1  DNS 81 Standard query 0x603d A 0.ubuntu.pool.ntp.org
  637 19.713073151  192.168.1.1 → 192.168.1.16 DNS 145 Standard query response 0x603d A 0.ubuntu.pool.ntp.org A 52.66.5.185 A 123.108.200.124 A 139.59.50.38 A 139.59.21.22
  638 19.713624722 192.168.1.16 → 52.66.5.185  NTP 90 NTP Version 4, client
  639 22.015302250 10.22.18.209 → 224.0.0.252  LLMNR 64 Standard query 0xde83 A wpad
  640 22.022848244  192.168.1.1 → 239.255.255.250 SSDP 302 NOTIFY * HTTP/1.1 
  641 22.025343821  192.168.1.1 → 239.255.255.250 SSDP 311 NOTIFY * HTTP/1.1 
  642 22.028101525  192.168.1.1 → 239.255.255.250 SSDP 374 NOTIFY * HTTP/1.1 
  643 22.032960266  192.168.1.1 → 239.255.255.250 SSDP 370 NOTIFY * HTTP/1.1 
  644 22.033473865  192.168.1.1 → 239.255.255.250 SSDP 350 NOTIFY * HTTP/1.1 
  645 22.036350151  192.168.1.1 → 239.255.255.250 SSDP 382 NOTIFY * HTTP/1.1 
  646 22.039100002  192.168.1.1 → 239.255.255.250 SSDP 364 NOTIFY * HTTP/1.1 
  647 22.041865571  192.168.1.1 → 239.255.255.250 SSDP 366 NOTIFY * HTTP/1.1 
  648 22.044149946  192.168.1.1 → 239.255.255.250 SSDP 302 NOTIFY * HTTP/1.1 
  649 22.046593717  192.168.1.1 → 239.255.255.250 SSDP 311 NOTIFY * HTTP/1.1 
  650 22.049408004  192.168.1.1 → 239.255.255.250 SSDP 374 NOTIFY * HTTP/1.1 
  651 22.052090459  192.168.1.1 → 239.255.255.250 SSDP 370 NOTIFY * HTTP/1.1 
  652 22.054779058  192.168.1.1 → 239.255.255.250 SSDP 350 NOTIFY * HTTP/1.1 
  653 22.057640549  192.168.1.1 → 239.255.255.250 SSDP 382 NOTIFY * HTTP/1.1 
  654 22.060332308  192.168.1.1 → 239.255.255.250 SSDP 364 NOTIFY * HTTP/1.1 
  655 22.063135932  192.168.1.1 → 239.255.255.250 SSDP 366 NOTIFY * HTTP/1.1 
  656 22.063355742 10.22.18.209 → 224.0.0.252  LLMNR 64 Standard query 0xde83 A wpad
  657 27.700926041 192.168.1.16 → 192.168.1.1  DNS 81 Standard query 0xd3b1 A 3.ubuntu.pool.ntp.org
  658 27.711978673  192.168.1.1 → 192.168.1.16 DNS 145 Standard query response 0xd3b1 A 3.ubuntu.pool.ntp.org A 139.59.21.22 A 123.108.200.124 A 13.126.27.131 A 139.59.50.38
  659 27.712477419 192.168.1.16 → 139.59.21.22 NTP 90 NTP Version 4, client
  660 27.714552554 192.168.1.16 → 192.168.1.1  DNS 81 Standard query 0xb965 A 1.ubuntu.pool.ntp.org
  661 27.725677249  192.168.1.1 → 192.168.1.16 DNS 145 Standard query response 0xb965 A 1.ubuntu.pool.ntp.org A 139.59.21.22 A 52.66.5.185 A 123.108.200.124 A 139.59.50.38
  662 27.726156197 192.168.1.16 → 139.59.21.22 NTP 90 NTP Version 4, client
