    1 0.000000000  10.6.15.144 → 192.168.1.16 SSH 1514 Server: Encrypted packet (len=1448)
    2 0.000145869  10.6.15.144 → 192.168.1.16 SSH 1446 Server: Encrypted packet (len=1380)
    3 0.000156369 192.168.1.16 → 10.6.15.144  TCP 66 59298 → 22 [ACK] Seq=1 Ack=2829 Win=5703 Len=0 TSval=4792457 TSecr=5388522
    4 0.000306321  10.6.15.144 → 192.168.1.16 SSH 1514 Server: Encrypted packet (len=1448)
    5 0.000488119  10.6.15.144 → 192.168.1.16 SSH 1446 Server: Encrypted packet (len=1380)
    6 0.000494266 192.168.1.16 → 10.6.15.144  TCP 66 59298 → 22 [ACK] Seq=1 Ack=5657 Win=5703 Len=0 TSval=4792457 TSecr=5388522
    7 0.000682799  10.6.15.144 → 192.168.1.16 SSH 1514 Server: Encrypted packet (len=1448)
    8 0.000875119  10.6.15.144 → 192.168.1.16 SSH 1514 Server: Encrypted packet (len=1448)
    9 0.000882895 192.168.1.16 → 10.6.15.144  TCP 66 59298 → 22 [ACK] Seq=1 Ack=8553 Win=5703 Len=0 TSval=4792457 TSecr=5388523
   10 0.001540000  10.6.15.144 → 192.168.1.16 SSH 1514 Server: Encrypted packet (len=1448)
   11 0.014189858  10.6.15.144 → 192.168.1.16 SSH 1514 Server: Encrypted packet (len=1448)
   12 0.014207828 192.168.1.16 → 10.6.15.144  TCP 66 59298 → 22 [ACK] Seq=1 Ack=11449 Win=5703 Len=0 TSval=4792460 TSecr=5388629
   13 0.014407864  10.6.15.144 → 192.168.1.16 SSH 1514 Server: Encrypted packet (len=1448)
   14 0.014576473  10.6.15.144 → 192.168.1.16 SSH 1514 Server: Encrypted packet (len=1448)
   15 0.014583301 192.168.1.16 → 10.6.15.144  TCP 66 59298 → 22 [ACK] Seq=1 Ack=14345 Win=5703 Len=0 TSval=4792461 TSecr=5388813
   16 0.014974640  10.6.15.144 → 192.168.1.16 SSH 1514 Server: Encrypted packet (len=1448)
   17 0.015100150  10.6.15.144 → 192.168.1.16 SSH 1514 Server: Encrypted packet (len=1448)
   18 0.015106940 192.168.1.16 → 10.6.15.144  TCP 66 59298 → 22 [ACK] Seq=1 Ack=17241 Win=5703 Len=0 TSval=4792461 TSecr=5388813
   19 0.015324775  10.6.15.144 → 192.168.1.16 SSH 1514 Server: Encrypted packet (len=1448)
   20 0.015433560  10.6.15.144 → 192.168.1.16 SSH 1154 Server: Encrypted packet (len=1088)
   21 0.015438828 192.168.1.16 → 10.6.15.144  TCP 66 59298 → 22 [ACK] Seq=1 Ack=19777 Win=5703 Len=0 TSval=4792461 TSecr=5388813
   22 0.016732401 192.168.1.16 → 10.6.15.144  SSH 390 Client: Encrypted packet (len=324)
   23 0.019137842 192.168.1.16 → 10.6.15.144  SSH 102 Client: Encrypted packet (len=36)
   24 0.019369270 192.168.1.16 → 10.6.15.144  SSH 138 Client: Encrypted packet (len=72)
   25 0.019597886 192.168.1.16 → 10.6.15.144  SSH 102 Client: Encrypted packet (len=36)
   26 0.019812271 192.168.1.16 → 10.6.15.144  SSH 138 Client: Encrypted packet (len=72)
   27 0.026873801  10.6.15.144 → 192.168.1.16 TCP 66 22 → 59298 [ACK] Seq=19777 Ack=325 Win=1452 Len=0 TSval=5388816 TSecr=4792461
   28 0.026893368 192.168.1.16 → 10.6.15.144  SSH 1122 Client: Encrypted packet (len=1056)
   29 0.029082969  10.6.15.144 → 192.168.1.16 TCP 66 22 → 59298 [ACK] Seq=19777 Ack=433 Win=1452 Len=0 TSval=5388817 TSecr=4792462
   30 0.029096817  10.6.15.144 → 192.168.1.16 TCP 66 22 → 59298 [ACK] Seq=19777 Ack=469 Win=1452 Len=0 TSval=5388817 TSecr=4792462
   31 0.029600680  10.6.15.144 → 192.168.1.16 TCP 66 22 → 59298 [ACK] Seq=19777 Ack=541 Win=1452 Len=0 TSval=5388817 TSecr=4792462
   32 0.037681794  10.6.15.144 → 192.168.1.16 TCP 66 22 → 59298 [ACK] Seq=19777 Ack=1597 Win=1452 Len=0 TSval=5388819 TSecr=4792464
   33 0.047794188  192.168.1.1 → 255.255.255.255 DHCP 298 DHCP NAK      - Transaction ID 0xa98db91e
   34 0.068643805  10.6.15.144 → 192.168.1.16 SSH 134 Server: Encrypted packet (len=68)
   35 0.068666521  10.6.15.144 → 192.168.1.16 SSH 138 Server: Encrypted packet (len=72)
   36 0.068672575  10.6.15.144 → 192.168.1.16 SSH 126 Server: Encrypted packet (len=60)
   37 0.068678432  10.6.15.144 → 192.168.1.16 SSH 138 Server: Encrypted packet (len=72)
   38 0.068721654 192.168.1.16 → 10.6.15.144  TCP 66 59298 → 22 [ACK] Seq=1597 Ack=20049 Win=5703 Len=0 TSval=4792474 TSecr=5388827
   39 0.069005423 192.168.1.16 → 10.6.15.144  SSH 138 Client: Encrypted packet (len=72)
   40 0.077506616  10.6.15.144 → 192.168.1.16 SSH 126 Server: Encrypted packet (len=60)
   41 0.077525825  10.6.15.144 → 192.168.1.16 SSH 138 Server: Encrypted packet (len=72)
   42 0.077568763 192.168.1.16 → 10.6.15.144  TCP 66 59298 → 22 [ACK] Seq=1669 Ack=20181 Win=5703 Len=0 TSval=4792476 TSecr=5388829
   43 0.077763792 192.168.1.16 → 10.6.15.144  SSH 102 Client: Encrypted packet (len=36)
   44 0.085986176  10.6.15.144 → 192.168.1.16 SSH 194 Server: Encrypted packet (len=128)
   45 0.086012398  10.6.15.144 → 192.168.1.16 SSH 138 Server: Encrypted packet (len=72)
   46 0.086067062 192.168.1.16 → 10.6.15.144  TCP 66 59298 → 22 [ACK] Seq=1705 Ack=20381 Win=5703 Len=0 TSval=4792478 TSecr=5388831
   47 0.086273414 192.168.1.16 → 10.6.15.144  SSH 102 Client: Encrypted packet (len=36)
   48 0.086310163  10.6.15.144 → 192.168.1.16 SSH 126 Server: Encrypted packet (len=60)
   49 0.086320420  10.6.15.144 → 192.168.1.16 SSH 138 Server: Encrypted packet (len=72)
   50 0.086326529 192.168.1.16 → 10.6.15.144  TCP 66 59298 → 22 [ACK] Seq=1741 Ack=20513 Win=5703 Len=0 TSval=4792479 TSecr=5388831
   51 0.086500409  10.6.15.144 → 192.168.1.16 SSH 186 Server: Encrypted packet (len=120)
   52 0.086652783  10.6.15.144 → 192.168.1.16 SSH 210 Server: Encrypted packet (len=144)
   53 0.086708426 192.168.1.16 → 10.6.15.144  TCP 66 59298 → 22 [ACK] Seq=1741 Ack=20777 Win=5703 Len=0 TSval=4792479 TSecr=5388831
   54 0.087570396 192.168.1.16 → 10.6.15.144  SSH 174 Client: Encrypted packet (len=108)
   55 0.087650271  10.6.15.144 → 192.168.1.16 SSH 198 Server: Encrypted packet (len=132)
   56 0.087666356  10.6.15.144 → 192.168.1.16 SSH 102 Server: Encrypted packet (len=36)
   57 0.087715679 192.168.1.16 → 10.6.15.144  TCP 66 59298 → 22 [ACK] Seq=1849 Ack=20945 Win=5703 Len=0 TSval=4792479 TSecr=5388831
   58 0.088091415 192.168.1.16 → 10.6.15.144  SSH 418 Client: Encrypted packet (len=352)
   59 0.096998628  10.6.15.144 → 192.168.1.16 SSH 234 Server: Encrypted packet (len=168)
   60 0.097339953 192.168.1.16 → 10.6.15.144  SSH 102 Client: Encrypted packet (len=36)
   61 0.097598430 192.168.1.16 → 10.6.15.144  SSH 366 Client: Encrypted packet (len=300)
   62 0.097952477  10.6.15.144 → 192.168.1.16 TCP 66 22 → 59298 [ACK] Seq=21113 Ack=1849 Win=1452 Len=0 TSval=5388834 TSecr=4792478
   63 0.097962412  10.6.15.144 → 192.168.1.16 SSH 102 Server: Encrypted packet (len=36)
   64 0.098528555 192.168.1.16 → 10.6.15.144  SSH 158 Client: Encrypted packet (len=92)
   65 0.101084472  10.6.15.144 → 192.168.1.16 SSH 138 Server: Encrypted packet (len=72)
   66 0.101337228 192.168.1.16 → 10.6.15.144  SSH 102 Client: Encrypted packet (len=36)
   67 0.102288761  10.6.15.144 → 192.168.1.16 SSH 102 Server: Encrypted packet (len=36)
   68 0.102553674 192.168.1.16 → 10.6.15.144  SSH 158 Client: Encrypted packet (len=92)
   69 0.103142273  10.6.15.144 → 192.168.1.16 SSH 102 Server: Encrypted packet (len=36)
   70 0.107551505  10.6.15.144 → 192.168.1.16 SSH 102 Server: Encrypted packet (len=36)
   71 0.107573201  10.6.15.144 → 192.168.1.16 SSH 198 Server: Encrypted packet (len=132)
   72 0.107630363 192.168.1.16 → 10.6.15.144  TCP 66 59298 → 22 [ACK] Seq=2757 Ack=21461 Win=5703 Len=0 TSval=4792484 TSecr=5388835
   73 0.108983607  10.6.15.144 → 192.168.1.16 TCP 66 22 → 59298 [ACK] Seq=21461 Ack=2537 Win=1452 Len=0 TSval=5388837 TSecr=4792481
   74 0.109007703 192.168.1.16 → 10.6.15.144  SSH 526 Client: Encrypted packet (len=460)
   75 0.109025587  10.6.15.144 → 192.168.1.16 SSH 126 Server: Encrypted packet (len=60)
   76 0.109040099  10.6.15.144 → 192.168.1.16 SSH 138 Server: Encrypted packet (len=72)
   77 0.109093300 192.168.1.16 → 10.6.15.144  TCP 66 59298 → 22 [ACK] Seq=3217 Ack=21593 Win=5703 Len=0 TSval=4792484 TSecr=5388837
   78 0.109566729 192.168.1.16 → 10.6.15.144  SSH 102 Client: Encrypted packet (len=36)
   79 0.110304091  10.6.15.144 → 192.168.1.16 SSH 102 Server: Encrypted packet (len=36)
   80 0.110594403 192.168.1.16 → 10.6.15.144  SSH 182 Client: Encrypted packet (len=116)
   81 0.112170829  10.6.15.144 → 192.168.1.16 SSH 138 Server: Encrypted packet (len=72)
   82 0.112484204 192.168.1.16 → 10.6.15.144  SSH 150 Client: Encrypted packet (len=84)
   83 0.114001634  10.6.15.144 → 192.168.1.16 SSH 102 Server: Encrypted packet (len=36)
   84 0.114016196 192.168.1.16 → 10.6.15.144  SSH 422 Client: Encrypted packet (len=356)
   85 0.117464778  10.6.15.144 → 192.168.1.16 SSH 102 Server: Encrypted packet (len=36)
   86 0.119708339  10.6.15.144 → 192.168.1.16 TCP 66 22 → 59298 [ACK] Seq=21773 Ack=3253 Win=1452 Len=0 TSval=5388840 TSecr=4792484
   87 0.119718254 192.168.1.16 → 10.6.15.144  SSH 242 Client: Encrypted packet (len=176)
   88 0.122744754  10.6.15.144 → 192.168.1.16 TCP 66 22 → 59298 [ACK] Seq=21773 Ack=3453 Win=1452 Len=0 TSval=5388840 TSecr=4792485
   89 0.123158794  10.6.15.144 → 192.168.1.16 SSH 102 Server: Encrypted packet (len=36)
   90 0.123182654  10.6.15.144 → 192.168.1.16 SSH 102 Server: Encrypted packet (len=36)
   91 0.123239283 192.168.1.16 → 10.6.15.144  TCP 66 59298 → 22 [ACK] Seq=3985 Ack=21845 Win=5703 Len=0 TSval=4792488 TSecr=5388840
   92 0.123548922 192.168.1.16 → 10.6.15.144  SSH 158 Client: Encrypted packet (len=92)
   93 0.123822997 192.168.1.16 → 10.6.15.144  SSH 390 Client: Encrypted packet (len=324)
   94 0.129812226  10.6.15.144 → 192.168.1.16 TCP 66 22 → 59298 [ACK] Seq=21845 Ack=3985 Win=1452 Len=0 TSval=5388842 TSecr=4792485
   95 0.133810383  10.6.15.144 → 192.168.1.16 TCP 66 22 → 59298 [ACK] Seq=21845 Ack=4401 Win=1452 Len=0 TSval=5388843 TSecr=4792488
   96 0.135948210  10.6.15.144 → 192.168.1.16 SSH 102 Server: Encrypted packet (len=36)
   97 0.136223655 192.168.1.16 → 10.6.15.144  SSH 158 Client: Encrypted packet (len=92)
   98 0.144061799  10.6.15.144 → 192.168.1.16 SSH 238 Server: Encrypted packet (len=172)
   99 0.144370089 192.168.1.16 → 10.6.15.144  SSH 134 Client: Encrypted packet (len=68)
  100 0.149192265  10.6.15.144 → 192.168.1.16 SSH 214 Server: Encrypted packet (len=148)
  101 0.149488599 192.168.1.16 → 10.6.15.144  SSH 134 Client: Encrypted packet (len=68)
  102 0.153978821  10.6.15.144 → 192.168.1.16 SSH 102 Server: Encrypted packet (len=36)
  103 0.154272058 192.168.1.16 → 10.6.15.144  SSH 158 Client: Encrypted packet (len=92)
  104 0.158372117  10.6.15.144 → 192.168.1.16 SSH 214 Server: Encrypted packet (len=148)
  105 0.158678186 192.168.1.16 → 10.6.15.144  SSH 134 Client: Encrypted packet (len=68)
  106 0.160287945  10.6.15.144 → 192.168.1.16 SSH 182 Server: Encrypted packet (len=116)
  107 0.160604096 192.168.1.16 → 10.6.15.144  SSH 134 Client: Encrypted packet (len=68)
  108 0.164289410  10.6.15.144 → 192.168.1.16 SSH 182 Server: Encrypted packet (len=116)
  109 0.164600418 192.168.1.16 → 10.6.15.144  SSH 134 Client: Encrypted packet (len=68)
  110 0.167714389  10.6.15.144 → 192.168.1.16 SSH 182 Server: Encrypted packet (len=116)
  111 0.168025538 192.168.1.16 → 10.6.15.144  SSH 134 Client: Encrypted packet (len=68)
  112 0.171800956  10.6.15.144 → 192.168.1.16 TCP 66 22 → 59298 [ACK] Seq=22733 Ack=4925 Win=1452 Len=0 TSval=5388853 TSecr=4792497
  113 0.176237655  10.6.15.144 → 192.168.1.16 SSH 182 Server: Encrypted packet (len=116)
  114 0.187693101  10.6.15.144 → 192.168.1.16 SSH 214 Server: Encrypted packet (len=148)
  115 0.187802028 192.168.1.16 → 10.6.15.144  TCP 66 59298 → 22 [ACK] Seq=4993 Ack=22997 Win=5703 Len=0 TSval=4792504 TSecr=5388854
  116 0.188019972 192.168.1.16 → 10.6.15.144  SSH 134 Client: Encrypted packet (len=68)
  117 0.188471157 192.168.1.16 → 10.6.15.144  SSH 1478 Client: Encrypted packet (len=1412)
  118 0.193828028  10.6.15.144 → 192.168.1.16 SSH 1310 Server: Encrypted packet (len=1244)
  119 0.193864425  10.6.15.144 → 192.168.1.16 SSH 878 Server: Encrypted packet (len=812)
  120 0.193873667 192.168.1.16 → 10.6.15.144  TCP 66 59298 → 22 [ACK] Seq=6473 Ack=25053 Win=5703 Len=0 TSval=4792505 TSecr=5388859
  121 0.194245882  10.6.15.144 → 192.168.1.16 SSH 1514 Server: Encrypted packet (len=1448)
  122 0.194251198  10.6.15.144 → 192.168.1.16 SSH 254 Server: Encrypted packet (len=188)
  123 0.194253341 192.168.1.16 → 10.6.15.144  TCP 66 59298 → 22 [ACK] Seq=6473 Ack=26689 Win=5703 Len=0 TSval=4792505 TSecr=5388859
  124 0.195177642 192.168.1.16 → 10.6.15.144  SSH 214 Client: Encrypted packet (len=148)
  125 0.195548747  10.6.15.144 → 192.168.1.16 TCP 66 22 → 59298 [ACK] Seq=26689 Ack=6473 Win=1452 Len=0 TSval=5388859 TSecr=4792504
  126 0.195578196  10.6.15.144 → 192.168.1.16 SSH 230 Server: Encrypted packet (len=164)
  127 0.195860037 192.168.1.16 → 10.6.15.144  SSH 134 Client: Encrypted packet (len=68)
  128 0.197532250  10.6.15.144 → 192.168.1.16 SSH 158 Server: Encrypted packet (len=92)
  129 0.197545625  10.6.15.144 → 192.168.1.16 SSH 118 Server: Encrypted packet (len=52)
  130 0.197588236 192.168.1.16 → 10.6.15.144  TCP 66 59298 → 22 [ACK] Seq=6689 Ack=26997 Win=5703 Len=0 TSval=4792506 TSecr=5388860
  131 0.197739158  10.6.15.144 → 192.168.1.16 SSH 470 Server: Encrypted packet (len=404)
  132 0.198961552 192.168.1.16 → 10.6.15.144  SSH 206 Client: Encrypted packet (len=140)
  133 0.199978149  10.6.15.144 → 192.168.1.16 SSH 182 Server: Encrypted packet (len=116)
  134 0.200180268 192.168.1.16 → 10.6.15.144  SSH 134 Client: Encrypted packet (len=68)
  135 0.203361863  10.6.15.144 → 192.168.1.16 TCP 66 22 → 59298 [ACK] Seq=27517 Ack=6689 Win=1452 Len=0 TSval=5388861 TSecr=4792506
  136 0.205071781  10.6.15.144 → 192.168.1.16 TCP 66 22 → 59298 [ACK] Seq=27517 Ack=6897 Win=1452 Len=0 TSval=5388862 TSecr=4792507
  137 0.222010356  10.6.15.144 → 192.168.1.16 SSH 174 Server: Encrypted packet (len=108)
  138 0.222031517  10.6.15.144 → 192.168.1.16 SSH 118 Server: Encrypted packet (len=52)
  139 0.222094876 192.168.1.16 → 10.6.15.144  TCP 66 59298 → 22 [ACK] Seq=6897 Ack=27677 Win=5703 Len=0 TSval=4792512 TSecr=5388866
  140 0.222399151  10.6.15.144 → 192.168.1.16 SSH 454 Server: Encrypted packet (len=388)
  141 0.223375754 192.168.1.16 → 10.6.15.144  SSH 206 Client: Encrypted packet (len=140)
  142 0.235556046  10.6.15.144 → 192.168.1.16 SSH 182 Server: Encrypted packet (len=116)
  143 0.235857065 192.168.1.16 → 10.6.15.144  SSH 134 Client: Encrypted packet (len=68)
  144 0.244664050  10.6.15.144 → 192.168.1.16 SSH 110 Server: Encrypted packet (len=44)
  145 0.245124298 192.168.1.16 → 10.6.15.144  SSH 398 Client: Encrypted packet (len=332)
  146 0.278006052  10.6.15.144 → 192.168.1.16 SSH 414 Server: Encrypted packet (len=348)
  147 0.279351243  10.6.15.144 → 192.168.1.16 SSH 102 Server: Encrypted packet (len=36)
  148 0.279430856 192.168.1.16 → 10.6.15.144  TCP 66 59298 → 22 [ACK] Seq=7437 Ack=28609 Win=5703 Len=0 TSval=4792527 TSecr=5388879
  149 0.279719226 192.168.1.16 → 10.6.15.144  SSH 150 Client: Encrypted packet (len=84)
  150 0.283839016  10.6.15.144 → 192.168.1.16 SSH 382 Server: Encrypted packet (len=316)
  151 0.287433721  10.6.15.144 → 192.168.1.16 SSH 102 Server: Encrypted packet (len=36)
  152 0.287497087 192.168.1.16 → 10.6.15.144  TCP 66 59298 → 22 [ACK] Seq=7521 Ack=28961 Win=5703 Len=0 TSval=4792529 TSecr=5388881
  153 0.287769986 192.168.1.16 → 10.6.15.144  SSH 158 Client: Encrypted packet (len=92)
  154 0.297554117  10.6.15.144 → 192.168.1.16 TCP 66 22 → 59298 [ACK] Seq=28961 Ack=7613 Win=1452 Len=0 TSval=5388884 TSecr=4792527
  155 0.305906383  10.6.15.144 → 192.168.1.16 SSH 382 Server: Encrypted packet (len=316)
  156 0.305978202  10.6.15.144 → 192.168.1.16 SSH 182 Server: Encrypted packet (len=116)
  157 0.306035458 192.168.1.16 → 10.6.15.144  TCP 66 59298 → 22 [ACK] Seq=7613 Ack=29393 Win=5703 Len=0 TSval=4792533 TSecr=5388885
  158 0.306128488  10.6.15.144 → 192.168.1.16 SSH 182 Server: Encrypted packet (len=116)
  159 0.306460298 192.168.1.16 → 10.6.15.144  SSH 134 Client: Encrypted packet (len=68)
  160 0.307559240 192.168.1.16 → 10.6.15.144  SSH 134 Client: Encrypted packet (len=68)
  161 0.317135086  10.6.15.144 → 192.168.1.16 TCP 66 22 → 59298 [ACK] Seq=29509 Ack=7749 Win=1452 Len=0 TSval=5388889 TSecr=4792534
  162 1.980842460  10.6.15.144 → 192.168.1.16 SSH 230 Server: Encrypted packet (len=164)
  163 1.980869899  10.6.15.144 → 192.168.1.16 SSH 110 Server: Encrypted packet (len=44)
  164 1.980881696  10.6.15.144 → 192.168.1.16 SSH 182 Server: Encrypted packet (len=116)
  165 1.980928621 192.168.1.16 → 10.6.15.144  TCP 66 59298 → 22 [ACK] Seq=7749 Ack=29833 Win=5703 Len=0 TSval=4792952 TSecr=5388926
  166 1.981005047  10.6.15.144 → 192.168.1.16 SSH 182 Server: Encrypted packet (len=116)
  167 1.981027936  10.6.15.144 → 192.168.1.16 TCP 182 [TCP Retransmission] 22 → 59298 [PSH, ACK] Seq=29833 Ack=7749 Win=1452 Len=116 TSval=5388947 TSecr=4792534
  168 1.981033779 192.168.1.16 → 10.6.15.144  TCP 78 59298 → 22 [ACK] Seq=7749 Ack=29949 Win=5703 Len=0 TSval=4792952 TSecr=5388947 SLE=29833 SRE=29949
  169 1.981042817  10.22.18.98 → 224.0.0.252  LLMNR 65 Standard query 0x818d ANY Febin
  170 1.981079069  10.6.15.144 → 192.168.1.16 SSH 214 Server: Encrypted packet (len=148)
  171 1.981082758 192.168.1.16 → 10.6.15.144  TCP 66 59298 → 22 [ACK] Seq=7749 Ack=30097 Win=5703 Len=0 TSval=4792952 TSecr=5389012
  172 1.981273618 192.168.1.16 → 10.6.15.144  SSH 134 Client: Encrypted packet (len=68)
  173 1.981459095  10.6.15.144 → 192.168.1.16 SSH 1514 Server: Encrypted packet (len=1448)
  174 1.981468050  10.6.15.144 → 192.168.1.16 SSH 238 Server: Encrypted packet (len=172)
  175 1.981473026 192.168.1.16 → 10.6.15.144  TCP 66 59298 → 22 [ACK] Seq=7817 Ack=31717 Win=5703 Len=0 TSval=4792952 TSecr=5389012
  176 1.981562410  10.6.15.144 → 192.168.1.16 SSH 702 Server: Encrypted packet (len=636)
  177 1.981797310  10.6.15.144 → 192.168.1.16 TCP 654 [TCP Out-Of-Order] 22 → 59298 [PSH, ACK] Seq=29509 Ack=7749 Win=1452 Len=588 TSval=5389098 TSecr=4792534
  178 1.981803255 192.168.1.16 → 10.6.15.144  TCP 78 59298 → 22 [ACK] Seq=7817 Ack=32353 Win=5703 Len=0 TSval=4792952 TSecr=5389022 SLE=29509 SRE=30097
  179 1.981813182  10.22.18.98 → 224.0.0.252  LLMNR 65 Standard query 0x818d ANY Febin
  180 1.981821689  10.22.18.98 → 224.0.0.252  LLMNR 64 Standard query 0x2ff7 A wpad
  181 1.981833919  10.22.18.98 → 224.0.0.252  LLMNR 64 Standard query 0x7a17 A wpad
  182 1.981935367  10.6.15.144 → 192.168.1.16 TCP 654 [TCP Out-Of-Order] 22 → 59298 [PSH, ACK] Seq=29509 Ack=7749 Win=1452 Len=588 TSval=5389238 TSecr=4792534
  183 1.981940146 192.168.1.16 → 10.6.15.144  TCP 78 [TCP Dup ACK 178#1] 59298 → 22 [ACK] Seq=7817 Ack=32353 Win=5703 Len=0 TSval=4792952 TSecr=5389022 SLE=29509 SRE=30097
  184 1.981946877  10.22.18.98 → 224.0.0.252  LLMNR 64 Standard query 0x2ff7 A wpad
  185 1.982101482  10.22.18.98 → 224.0.0.252  LLMNR 64 Standard query 0x7a17 A wpad
  186 1.982719823 192.168.1.16 → 10.6.15.144  SSH 362 Client: Encrypted packet (len=296)
  187 1.992726447  10.6.15.144 → 192.168.1.16 SSH 1514 Server: [TCP Spurious Retransmission] , Encrypted packet (len=1448)
  188 1.992748199 192.168.1.16 → 10.6.15.144  TCP 78 [TCP Dup ACK 178#2] 59298 → 22 [ACK] Seq=8113 Ack=32353 Win=5703 Len=0 TSval=4792955 TSecr=5389022 SLE=30097 SRE=31545
  189 1.992766331  10.6.15.144 → 192.168.1.16 SSH 238 Server: [TCP Spurious Retransmission] , Encrypted packet (len=172)
  190 1.992769168 192.168.1.16 → 10.6.15.144  TCP 78 [TCP Dup ACK 178#3] 59298 → 22 [ACK] Seq=8113 Ack=32353 Win=5703 Len=0 TSval=4792955 TSecr=5389022 SLE=31545 SRE=31717
  191 1.993090667  10.6.15.144 → 192.168.1.16 SSH 1514 Server: [TCP Previous segment not captured] , Encrypted packet (len=1448)
  192 1.993104135 192.168.1.16 → 10.6.15.144  TCP 78 [TCP Dup ACK 178#4] 59298 → 22 [ACK] Seq=8113 Ack=32353 Win=5703 Len=0 TSval=4792955 TSecr=5389022 SLE=33801 SRE=35249
  193 1.993283168  10.6.15.144 → 192.168.1.16 SSH 1514 Server: Encrypted packet (len=1448)
  194 1.993292848 192.168.1.16 → 10.6.15.144  TCP 78 [TCP Dup ACK 178#5] 59298 → 22 [ACK] Seq=8113 Ack=32353 Win=5703 Len=0 TSval=4792955 TSecr=5389022 SLE=33801 SRE=36697
  195 1.993626680  10.6.15.144 → 192.168.1.16 SSH 1514 Server: Encrypted packet (len=1448)
  196 1.993636668 192.168.1.16 → 10.6.15.144  TCP 78 [TCP Dup ACK 178#6] 59298 → 22 [ACK] Seq=8113 Ack=32353 Win=5703 Len=0 TSval=4792955 TSecr=5389022 SLE=33801 SRE=38145
  197 2.004024064  10.6.15.144 → 192.168.1.16 SSH 1514 Server: Encrypted packet (len=1448)
  198 2.004049077 192.168.1.16 → 10.6.15.144  TCP 78 [TCP Dup ACK 178#7] 59298 → 22 [ACK] Seq=8113 Ack=32353 Win=5703 Len=0 TSval=4792958 TSecr=5389022 SLE=33801 SRE=39593
  199 2.004203755  10.6.15.144 → 192.168.1.16 SSH 1514 Server: Encrypted packet (len=1448)
  200 2.004212238 192.168.1.16 → 10.6.15.144  TCP 78 [TCP Dup ACK 178#8] 59298 → 22 [ACK] Seq=8113 Ack=32353 Win=5703 Len=0 TSval=4792958 TSecr=5389022 SLE=33801 SRE=41041
  201 2.004391885  10.6.15.144 → 192.168.1.16 SSH 1514 Server: Encrypted packet (len=1448)
  202 2.004396804 192.168.1.16 → 10.6.15.144  TCP 78 [TCP Dup ACK 178#9] 59298 → 22 [ACK] Seq=8113 Ack=32353 Win=5703 Len=0 TSval=4792958 TSecr=5389022 SLE=33801 SRE=42489
  203 2.004739625  10.6.15.144 → 192.168.1.16 SSH 1514 Server: [TCP Fast Retransmission] , Encrypted packet (len=1448)
  204 2.004751632 192.168.1.16 → 10.6.15.144  TCP 66 59298 → 22 [ACK] Seq=8113 Ack=42489 Win=5703 Len=0 TSval=4792958 TSecr=5389311
  205 2.015189632  10.6.15.144 → 192.168.1.16 SSH 1514 Server: Encrypted packet (len=1448)
  206 2.015206868 192.168.1.16 → 10.6.15.144  TCP 66 59298 → 22 [ACK] Seq=8113 Ack=43937 Win=5703 Len=0 TSval=4792961 TSecr=5389313
  207 2.015370723  10.6.15.144 → 192.168.1.16 SSH 1514 Server: Encrypted packet (len=1448)
  208 2.015377175 192.168.1.16 → 10.6.15.144  TCP 66 59298 → 22 [ACK] Seq=8113 Ack=45385 Win=5703 Len=0 TSval=4792961 TSecr=5389313
  209 2.015713109  10.6.15.144 → 192.168.1.16 SSH 1514 Server: Encrypted packet (len=1448)
  210 2.015720216 192.168.1.16 → 10.6.15.144  TCP 66 59298 → 22 [ACK] Seq=8113 Ack=46833 Win=5703 Len=0 TSval=4792961 TSecr=5389313
  211 2.026908859  10.6.15.144 → 192.168.1.16 SSH 1514 Server: Encrypted packet (len=1448)
  212 2.026929432 192.168.1.16 → 10.6.15.144  TCP 66 59298 → 22 [ACK] Seq=8113 Ack=48281 Win=5703 Len=0 TSval=4792964 TSecr=5389316
  213 2.027094219  10.6.15.144 → 192.168.1.16 SSH 1514 Server: Encrypted packet (len=1448)
  214 2.027099948 192.168.1.16 → 10.6.15.144  TCP 66 59298 → 22 [ACK] Seq=8113 Ack=49729 Win=5703 Len=0 TSval=4792964 TSecr=5389316
  215 2.027437576  10.6.15.144 → 192.168.1.16 SSH 1514 Server: Encrypted packet (len=1448)
  216 2.027443866 192.168.1.16 → 10.6.15.144  TCP 66 59298 → 22 [ACK] Seq=8113 Ack=51177 Win=5703 Len=0 TSval=4792964 TSecr=5389316
  217 2.027632607  10.6.15.144 → 192.168.1.16 SSH 1514 Server: Encrypted packet (len=1448)
  218 2.027636640 192.168.1.16 → 10.6.15.144  TCP 66 59298 → 22 [ACK] Seq=8113 Ack=52625 Win=5703 Len=0 TSval=4792964 TSecr=5389316
  219 2.038169797  10.6.15.144 → 192.168.1.16 SSH 1514 Server: Encrypted packet (len=1448)
  220 2.038192063 192.168.1.16 → 10.6.15.144  TCP 66 59298 → 22 [ACK] Seq=8113 Ack=54073 Win=5703 Len=0 TSval=4792966 TSecr=5389319
  221 2.038347355  10.6.15.144 → 192.168.1.16 SSH 1514 Server: Encrypted packet (len=1448)
  222 2.038355922 192.168.1.16 → 10.6.15.144  TCP 66 59298 → 22 [ACK] Seq=8113 Ack=55521 Win=5703 Len=0 TSval=4792967 TSecr=5389319
  223 2.038538169  10.6.15.144 → 192.168.1.16 SSH 1514 Server: Encrypted packet (len=1448)
  224 2.038543634 192.168.1.16 → 10.6.15.144  TCP 66 59298 → 22 [ACK] Seq=8113 Ack=56969 Win=5703 Len=0 TSval=4792967 TSecr=5389319
  225 2.038882030  10.6.15.144 → 192.168.1.16 SSH 1514 Server: Encrypted packet (len=1448)
  226 2.038886192 192.168.1.16 → 10.6.15.144  TCP 66 59298 → 22 [ACK] Seq=8113 Ack=58417 Win=5703 Len=0 TSval=4792967 TSecr=5389319
  227 2.049376427  10.6.15.144 → 192.168.1.16 SSH 1514 Server: Encrypted packet (len=1448)
  228 2.049392742 192.168.1.16 → 10.6.15.144  TCP 66 59298 → 22 [ACK] Seq=8113 Ack=59865 Win=5703 Len=0 TSval=4792969 TSecr=5389322
  229 2.052133583  10.6.15.144 → 192.168.1.16 SSH 1514 Server: Encrypted packet (len=1448)
  230 2.052147383 192.168.1.16 → 10.6.15.144  TCP 66 59298 → 22 [ACK] Seq=8113 Ack=61313 Win=5703 Len=0 TSval=4792970 TSecr=5389322
  231 2.052306504  10.6.15.144 → 192.168.1.16 SSH 1514 Server: Encrypted packet (len=1448)
  232 2.052312259 192.168.1.16 → 10.6.15.144  TCP 66 59298 → 22 [ACK] Seq=8113 Ack=62761 Win=5703 Len=0 TSval=4792970 TSecr=5389322
  233 2.052517091  10.6.15.144 → 192.168.1.16 SSH 1514 Server: Encrypted packet (len=1448)
  234 2.060761585  10.6.15.144 → 192.168.1.16 SSH 1514 Server: Encrypted packet (len=1448)
  235 2.060784989 192.168.1.16 → 10.6.15.144  TCP 66 59298 → 22 [ACK] Seq=8113 Ack=65657 Win=5703 Len=0 TSval=4792972 TSecr=5389322
  236 2.060937629  10.6.15.144 → 192.168.1.16 SSH 1514 Server: Encrypted packet (len=1448)
  237 2.061681608  10.6.15.144 → 192.168.1.16 SSH 1514 Server: Encrypted packet (len=1448)
  238 2.061700695 192.168.1.16 → 10.6.15.144  TCP 66 59298 → 22 [ACK] Seq=8113 Ack=68553 Win=5703 Len=0 TSval=4792972 TSecr=5389325
  239 2.061864358  10.6.15.144 → 192.168.1.16 SSH 1514 Server: Encrypted packet (len=1448)
  240 2.068783998  10.6.15.144 → 192.168.1.16 SSH 734 Server: Encrypted packet (len=668)
  241 2.068799416 192.168.1.16 → 10.6.15.144  TCP 66 59298 → 22 [ACK] Seq=8113 Ack=70669 Win=5703 Len=0 TSval=4792974 TSecr=5389325
  242 2.069047335 192.168.1.16 → 10.6.15.144  SSH 134 Client: Encrypted packet (len=68)
  243 2.115530012  10.6.15.144 → 192.168.1.16 TCP 66 22 → 59298 [ACK] Seq=70669 Ack=8181 Win=1452 Len=0 TSval=5389339 TSecr=4792974
  244 2.265554452 192.168.1.16 → 10.6.15.144  SSH 526 Client: Encrypted packet (len=460)
  245 2.267483852 192.168.1.16 → 10.6.15.144  SSH 526 Client: Encrypted packet (len=460)
  246 2.267881040 192.168.1.16 → 10.6.15.144  SSH 526 Client: Encrypted packet (len=460)
  247 2.268371759 192.168.1.16 → 10.6.15.144  SSH 562 Client: Encrypted packet (len=496)
  248 2.269294902 192.168.1.16 → 10.6.15.144  SSH 174 Client: Encrypted packet (len=108)
  249 2.272763760  10.6.15.144 → 192.168.1.16 TCP 66 22 → 59298 [ACK] Seq=70669 Ack=8641 Win=1452 Len=0 TSval=5389379 TSecr=4793023
  250 2.274232567  10.6.15.144 → 192.168.1.16 TCP 66 22 → 59298 [ACK] Seq=70669 Ack=9101 Win=1452 Len=0 TSval=5389379 TSecr=4793024
  251 2.274845446  10.6.15.144 → 192.168.1.16 TCP 66 22 → 59298 [ACK] Seq=70669 Ack=9561 Win=1452 Len=0 TSval=5389379 TSecr=4793024
  252 2.274863009  10.6.15.144 → 192.168.1.16 TCP 66 22 → 59298 [ACK] Seq=70669 Ack=10057 Win=1452 Len=0 TSval=5389379 TSecr=4793024
  253 2.275479677  10.6.15.144 → 192.168.1.16 TCP 66 22 → 59298 [ACK] Seq=70669 Ack=10165 Win=1452 Len=0 TSval=5389379 TSecr=4793024
  254 2.298301077  10.6.15.144 → 192.168.1.16 SSH 174 Server: Encrypted packet (len=108)
  255 2.298325116  10.6.15.144 → 192.168.1.16 SSH 138 Server: Encrypted packet (len=72)
  256 2.298382746 192.168.1.16 → 10.6.15.144  TCP 66 59298 → 22 [ACK] Seq=10165 Ack=70849 Win=5703 Len=0 TSval=4793032 TSecr=5389385
  257 2.298567207 192.168.1.16 → 10.6.15.144  SSH 102 Client: Encrypted packet (len=36)
  258 2.309400959  10.6.15.144 → 192.168.1.16 SSH 502 Server: Encrypted packet (len=436)
  259 2.309419341  10.6.15.144 → 192.168.1.16 SSH 750 Server: Encrypted packet (len=684)
  260 2.309464166 192.168.1.16 → 10.6.15.144  TCP 66 59298 → 22 [ACK] Seq=10201 Ack=71969 Win=5703 Len=0 TSval=4793034 TSecr=5389388
  261 2.310191634  10.6.15.144 → 192.168.1.16 SSH 1514 Server: Encrypted packet (len=1448)
  262 2.310207191  10.6.15.144 → 192.168.1.16 SSH 110 Server: Encrypted packet (len=44)
  263 2.310213816 192.168.1.16 → 10.6.15.144  TCP 66 59298 → 22 [ACK] Seq=10201 Ack=73461 Win=5703 Len=0 TSval=4793034 TSecr=5389388
  264 2.310538017  10.6.15.144 → 192.168.1.16 SSH 1446 Server: Encrypted packet (len=1380)
  265 2.316176448  10.6.15.144 → 192.168.1.16 SSH 1514 Server: Encrypted packet (len=1448)
  266 2.316189754 192.168.1.16 → 10.6.15.144  TCP 66 59298 → 22 [ACK] Seq=10201 Ack=76289 Win=5703 Len=0 TSval=4793036 TSecr=5389388
  267 2.316365751  10.6.15.144 → 192.168.1.16 SSH 1514 Server: Encrypted packet (len=1448)
  268 2.317084012  10.6.15.144 → 192.168.1.16 SSH 1514 Server: Encrypted packet (len=1448)
  269 2.317092905 192.168.1.16 → 10.6.15.144  TCP 66 59298 → 22 [ACK] Seq=10201 Ack=79185 Win=5703 Len=0 TSval=4793036 TSecr=5389390
  270 2.317400359  10.6.15.144 → 192.168.1.16 SSH 1514 Server: Encrypted packet (len=1448)
  271 2.324941876  10.6.15.144 → 192.168.1.16 SSH 1514 Server: Encrypted packet (len=1448)
  272 2.324953938 192.168.1.16 → 10.6.15.144  TCP 66 59298 → 22 [ACK] Seq=10201 Ack=82081 Win=5703 Len=0 TSval=4793038 TSecr=5389390
  273 2.325127065  10.6.15.144 → 192.168.1.16 SSH 1514 Server: Encrypted packet (len=1448)
  274 2.325345573 192.168.1.16 → 10.6.15.144  SSH 158 Client: Encrypted packet (len=92)
  275 2.326504487  10.6.15.144 → 192.168.1.16 SSH 1514 Server: Encrypted packet (len=1448)
  276 2.326694475  10.6.15.144 → 192.168.1.16 SSH 1514 Server: Encrypted packet (len=1448)
  277 2.326697995 192.168.1.16 → 10.6.15.144  TCP 66 59298 → 22 [ACK] Seq=10293 Ack=86425 Win=5703 Len=0 TSval=4793039 TSecr=5389391
  278 2.335501011  10.6.15.144 → 192.168.1.16 SSH 1514 Server: Encrypted packet (len=1448)
  279 2.335686931  10.6.15.144 → 192.168.1.16 SSH 1514 Server: Encrypted packet (len=1448)
  280 2.335691421 192.168.1.16 → 10.6.15.144  TCP 66 59298 → 22 [ACK] Seq=10293 Ack=89321 Win=5703 Len=0 TSval=4793041 TSecr=5389393
  281 2.337548501  10.6.15.144 → 192.168.1.16 SSH 1514 Server: [TCP Previous segment not captured] , Encrypted packet (len=1448)
  282 2.337563588 192.168.1.16 → 10.6.15.144  TCP 78 [TCP Dup ACK 280#1] 59298 → 22 [ACK] Seq=10293 Ack=89321 Win=5703 Len=0 TSval=4793041 TSecr=5389393 SLE=90769 SRE=92217
  283 2.346194182  10.6.15.144 → 192.168.1.16 SSH 1514 Server: Encrypted packet (len=1448)
  284 2.346211569 192.168.1.16 → 10.6.15.144  TCP 78 [TCP Dup ACK 280#2] 59298 → 22 [ACK] Seq=10293 Ack=89321 Win=5703 Len=0 TSval=4793043 TSecr=5389393 SLE=90769 SRE=93665
  285 2.346376739  10.6.15.144 → 192.168.1.16 SSH 1514 Server: Encrypted packet (len=1448)
  286 2.346381356 192.168.1.16 → 10.6.15.144  TCP 78 [TCP Dup ACK 280#3] 59298 → 22 [ACK] Seq=10293 Ack=89321 Win=5703 Len=0 TSval=4793044 TSecr=5389393 SLE=90769 SRE=95113
  287 2.348203434  10.6.15.144 → 192.168.1.16 SSH 1514 Server: Encrypted packet (len=1448)
  288 2.348211084 192.168.1.16 → 10.6.15.144  TCP 78 [TCP Dup ACK 280#4] 59298 → 22 [ACK] Seq=10293 Ack=89321 Win=5703 Len=0 TSval=4793044 TSecr=5389393 SLE=90769 SRE=96561
  289 2.348390411  10.6.15.144 → 192.168.1.16 SSH 1514 Server: Encrypted packet (len=1448)
  290 2.348393382 192.168.1.16 → 10.6.15.144  TCP 78 [TCP Dup ACK 280#5] 59298 → 22 [ACK] Seq=10293 Ack=89321 Win=5703 Len=0 TSval=4793044 TSecr=5389393 SLE=90769 SRE=98009
  291 2.356628329  10.6.15.144 → 192.168.1.16 SSH 1514 Server: Encrypted packet (len=1448)
  292 2.356649407 192.168.1.16 → 10.6.15.144  TCP 78 [TCP Dup ACK 280#6] 59298 → 22 [ACK] Seq=10293 Ack=89321 Win=5703 Len=0 TSval=4793046 TSecr=5389393 SLE=90769 SRE=99457
  293 2.359411862  10.6.15.144 → 192.168.1.16 SSH 1514 Server: [TCP Fast Retransmission] , Encrypted packet (len=1448)
  294 2.359438183 192.168.1.16 → 10.6.15.144  TCP 66 59298 → 22 [ACK] Seq=10293 Ack=99457 Win=5703 Len=0 TSval=4793047 TSecr=5389399
  295 2.359607359  10.6.15.144 → 192.168.1.16 SSH 1514 Server: Encrypted packet (len=1448)
  296 2.359614729 192.168.1.16 → 10.6.15.144  TCP 66 59298 → 22 [ACK] Seq=10293 Ack=100905 Win=5703 Len=0 TSval=4793047 TSecr=5389399
  297 2.366465221  10.22.18.98 → 224.0.0.252  LLMNR 75 Standard query 0x70b7 A cyhntrvxxttnpwa
  298 2.367162826  10.22.18.98 → 224.0.0.252  LLMNR 67 Standard query 0x2141 A qjhjcra
  299 2.371470917  10.6.15.144 → 192.168.1.16 SSH 1514 Server: Encrypted packet (len=1448)
  300 2.371487587 192.168.1.16 → 10.6.15.144  TCP 66 59298 → 22 [ACK] Seq=10293 Ack=102353 Win=5703 Len=0 TSval=4793050 TSecr=5389402
  301 2.371569392  10.22.18.98 → 224.0.0.252  LLMNR 68 Standard query 0x8092 A dplqipaq
  302 2.371801857 192.168.1.16 → 10.6.15.144  SSH 158 Client: Encrypted packet (len=92)
  303 2.371803724  10.6.15.144 → 192.168.1.16 SSH 1514 Server: Encrypted packet (len=1448)
  304 2.371998741  10.6.15.144 → 192.168.1.16 SSH 1514 Server: Encrypted packet (len=1448)
  305 2.372005644 192.168.1.16 → 10.6.15.144  TCP 66 59298 → 22 [ACK] Seq=10385 Ack=105249 Win=5703 Len=0 TSval=4793050 TSecr=5389402
  306 2.372186711  10.6.15.144 → 192.168.1.16 SSH 1514 Server: Encrypted packet (len=1448)
  307 2.384321786  10.6.15.144 → 192.168.1.16 SSH 1514 Server: Encrypted packet (len=1448)
  308 2.384340755 192.168.1.16 → 10.6.15.144  TCP 66 59298 → 22 [ACK] Seq=10385 Ack=108145 Win=5703 Len=0 TSval=4793053 TSecr=5389402
  309 2.384622892  10.6.15.144 → 192.168.1.16 SSH 1514 Server: Encrypted packet (len=1448)
  310 2.394224892  10.6.15.144 → 192.168.1.16 SSH 1514 Server: Encrypted packet (len=1448)
  311 2.394242091 192.168.1.16 → 10.6.15.144  TCP 66 59298 → 22 [ACK] Seq=10385 Ack=111041 Win=5703 Len=0 TSval=4793055 TSecr=5389406
  312 2.399881103  10.6.15.144 → 192.168.1.16 SSH 1514 Server: Encrypted packet (len=1448)
  313 2.400045466  10.6.15.144 → 192.168.1.16 SSH 1514 Server: Encrypted packet (len=1448)
  314 2.400054019 192.168.1.16 → 10.6.15.144  TCP 66 59298 → 22 [ACK] Seq=10385 Ack=113937 Win=5703 Len=0 TSval=4793057 TSecr=5389409
  315 2.400237138  10.6.15.144 → 192.168.1.16 SSH 1514 Server: Encrypted packet (len=1448)
  316 2.411550994  10.6.15.144 → 192.168.1.16 SSH 1514 Server: Encrypted packet (len=1448)
  317 2.411566398 192.168.1.16 → 10.6.15.144  TCP 66 59298 → 22 [ACK] Seq=10385 Ack=116833 Win=5703 Len=0 TSval=4793060 TSecr=5389409
  318 2.411722684  10.6.15.144 → 192.168.1.16 SSH 1514 Server: Encrypted packet (len=1448)
  319 2.412639698 192.168.1.16 → 10.6.15.144  SSH 526 Client: Encrypted packet (len=460)
  320 2.415611159  10.6.15.144 → 192.168.1.16 SSH 1514 Server: Encrypted packet (len=1448)
  321 2.415798481  10.6.15.144 → 192.168.1.16 SSH 1514 Server: Encrypted packet (len=1448)
  322 2.415804340 192.168.1.16 → 10.6.15.144  TCP 66 59298 → 22 [ACK] Seq=10845 Ack=121177 Win=5703 Len=0 TSval=4793061 TSecr=5389413
  323 2.415952350 192.168.1.16 → 10.6.15.144  SSH 102 Client: Encrypted packet (len=36)
  324 2.422174080  10.6.15.144 → 192.168.1.16 SSH 1514 Server: Encrypted packet (len=1448)
  325 2.422349251  10.6.15.144 → 192.168.1.16 SSH 1514 Server: Encrypted packet (len=1448)
  326 2.422357637 192.168.1.16 → 10.6.15.144  TCP 66 59298 → 22 [ACK] Seq=10881 Ack=124073 Win=5703 Len=0 TSval=4793063 TSecr=5389415
  327 2.426373845  10.6.15.144 → 192.168.1.16 SSH 1514 Server: [TCP Previous segment not captured] , Encrypted packet (len=1448)
  328 2.426388120 192.168.1.16 → 10.6.15.144  TCP 78 [TCP Dup ACK 326#1] 59298 → 22 [ACK] Seq=10881 Ack=124073 Win=5703 Len=0 TSval=4793064 TSecr=5389415 SLE=125521 SRE=126969
  329 2.432661976  10.6.15.144 → 192.168.1.16 SSH 1514 Server: Encrypted packet (len=1448)
  330 2.432686758 192.168.1.16 → 10.6.15.144  TCP 78 [TCP Dup ACK 326#2] 59298 → 22 [ACK] Seq=10881 Ack=124073 Win=5703 Len=0 TSval=4793065 TSecr=5389415 SLE=125521 SRE=128417
  331 2.432845172  10.6.15.144 → 192.168.1.16 SSH 1514 Server: Encrypted packet (len=1448)
  332 2.432856506 192.168.1.16 → 10.6.15.144  TCP 78 [TCP Dup ACK 326#3] 59298 → 22 [ACK] Seq=10881 Ack=124073 Win=5703 Len=0 TSval=4793065 TSecr=5389415 SLE=125521 SRE=129865
  333 2.436597159  10.6.15.144 → 192.168.1.16 SSH 1514 Server: Encrypted packet (len=1448)
  334 2.436621433 192.168.1.16 → 10.6.15.144  TCP 78 [TCP Dup ACK 326#4] 59298 → 22 [ACK] Seq=10881 Ack=124073 Win=5703 Len=0 TSval=4793066 TSecr=5389415 SLE=125521 SRE=131313
  335 2.436781594  10.6.15.144 → 192.168.1.16 SSH 1514 Server: Encrypted packet (len=1448)
  336 2.436794324 192.168.1.16 → 10.6.15.144  TCP 78 [TCP Dup ACK 326#5] 59298 → 22 [ACK] Seq=10881 Ack=124073 Win=5703 Len=0 TSval=4793066 TSecr=5389415 SLE=125521 SRE=132761
  337 2.443123881  10.6.15.144 → 192.168.1.16 SSH 1514 Server: Encrypted packet (len=1448)
  338 2.443140307 192.168.1.16 → 10.6.15.144  TCP 78 [TCP Dup ACK 326#6] 59298 → 22 [ACK] Seq=10881 Ack=124073 Win=5703 Len=0 TSval=4793068 TSecr=5389415 SLE=125521 SRE=134209
  339 2.443307198  10.6.15.144 → 192.168.1.16 SSH 1514 Server: [TCP Fast Retransmission] , Encrypted packet (len=1448)
  340 2.443318346 192.168.1.16 → 10.6.15.144  TCP 66 59298 → 22 [ACK] Seq=10881 Ack=134209 Win=5703 Len=0 TSval=4793068 TSecr=5389420
  341 2.447058164  10.6.15.144 → 192.168.1.16 SSH 1514 Server: Encrypted packet (len=1448)
  342 2.447073892 192.168.1.16 → 10.6.15.144  TCP 66 59298 → 22 [ACK] Seq=10881 Ack=135657 Win=5703 Len=0 TSval=4793069 TSecr=5389421
  343 2.453409310  10.6.15.144 → 192.168.1.16 SSH 1514 Server: Encrypted packet (len=1448)
  344 2.453423982 192.168.1.16 → 10.6.15.144  TCP 66 59298 → 22 [ACK] Seq=10881 Ack=137105 Win=5703 Len=0 TSval=4793070 TSecr=5389423
  345 2.456657653  10.6.15.144 → 192.168.1.16 SSH 1514 Server: Encrypted packet (len=1448)
  346 2.456672560 192.168.1.16 → 10.6.15.144  TCP 66 59298 → 22 [ACK] Seq=10881 Ack=138553 Win=5703 Len=0 TSval=4793071 TSecr=5389423
  347 2.456967133  10.6.15.144 → 192.168.1.16 SSH 1514 Server: Encrypted packet (len=1448)
  348 2.456978847 192.168.1.16 → 10.6.15.144  TCP 66 59298 → 22 [ACK] Seq=10881 Ack=140001 Win=5703 Len=0 TSval=4793071 TSecr=5389424
  349 2.457166646  10.6.15.144 → 192.168.1.16 SSH 1514 Server: Encrypted packet (len=1448)
  350 2.457173972 192.168.1.16 → 10.6.15.144  TCP 66 59298 → 22 [ACK] Seq=10881 Ack=141449 Win=5703 Len=0 TSval=4793071 TSecr=5389424
  351 2.467222675  10.6.15.144 → 192.168.1.16 SSH 1514 Server: Encrypted packet (len=1448)
  352 2.467248498 192.168.1.16 → 10.6.15.144  TCP 66 59298 → 22 [ACK] Seq=10881 Ack=142897 Win=5703 Len=0 TSval=4793074 TSecr=5389426
  353 2.467404180  10.6.15.144 → 192.168.1.16 SSH 1514 Server: Encrypted packet (len=1448)
  354 2.467412302 192.168.1.16 → 10.6.15.144  TCP 66 59298 → 22 [ACK] Seq=10881 Ack=144345 Win=5703 Len=0 TSval=4793074 TSecr=5389426
  355 2.467745729  10.6.15.144 → 192.168.1.16 SSH 1514 Server: Encrypted packet (len=1448)
  356 2.467751706 192.168.1.16 → 10.6.15.144  TCP 66 59298 → 22 [ACK] Seq=10881 Ack=145793 Win=5703 Len=0 TSval=4793074 TSecr=5389426
  357 2.467938889  10.6.15.144 → 192.168.1.16 SSH 1514 Server: Encrypted packet (len=1448)
  358 2.467944592 192.168.1.16 → 10.6.15.144  TCP 66 59298 → 22 [ACK] Seq=10881 Ack=147241 Win=5703 Len=0 TSval=4793074 TSecr=5389426
  359 2.478457813  10.6.15.144 → 192.168.1.16 SSH 1514 Server: Encrypted packet (len=1448)
  360 2.478477827 192.168.1.16 → 10.6.15.144  TCP 66 59298 → 22 [ACK] Seq=10881 Ack=148689 Win=5703 Len=0 TSval=4793077 TSecr=5389429
  361 2.478637417  10.6.15.144 → 192.168.1.16 SSH 1514 Server: Encrypted packet (len=1448)
  362 2.478646740 192.168.1.16 → 10.6.15.144  TCP 66 59298 → 22 [ACK] Seq=10881 Ack=150137 Win=5703 Len=0 TSval=4793077 TSecr=5389429
  363 2.478829756  10.6.15.144 → 192.168.1.16 SSH 1514 Server: Encrypted packet (len=1448)
  364 2.478840470 192.168.1.16 → 10.6.15.144  TCP 66 59298 → 22 [ACK] Seq=10881 Ack=151585 Win=5703 Len=0 TSval=4793077 TSecr=5389429
  365 2.481260404 192.168.1.16 → 10.6.15.144  SSH 526 Client: Encrypted packet (len=460)
  366 2.489276331  10.6.15.144 → 192.168.1.16 SSH 1514 Server: [TCP Previous segment not captured] , Encrypted packet (len=1448)
  367 2.489294650 192.168.1.16 → 10.6.15.144  TCP 78 [TCP Dup ACK 364#1] 59298 → 22 [ACK] Seq=11341 Ack=151585 Win=5703 Len=0 TSval=4793079 TSecr=5389429 SLE=153033 SRE=154481
  368 2.489459325  10.6.15.144 → 192.168.1.16 SSH 1514 Server: Encrypted packet (len=1448)
  369 2.489466699 192.168.1.16 → 10.6.15.144  TCP 78 [TCP Dup ACK 364#2] 59298 → 22 [ACK] Seq=11341 Ack=151585 Win=5703 Len=0 TSval=4793079 TSecr=5389429 SLE=153033 SRE=155929
  370 2.489800801  10.6.15.144 → 192.168.1.16 SSH 1514 Server: Encrypted packet (len=1448)
