    1 0.000000000 192.168.1.16 → 10.6.15.145  SSH 142 Client: Encrypted packet (len=76)
    2 0.001019964 192.168.1.16 → 10.6.15.145  SSH 134 Client: Encrypted packet (len=68)
    3 0.002091809  10.6.15.145 → 192.168.1.16 TCP 66 22 → 52104 [ACK] Seq=1 Ack=77 Win=1452 Len=0 TSval=24455615 TSecr=1641087
    4 0.002505004  10.6.15.145 → 192.168.1.16 TCP 66 22 → 52104 [ACK] Seq=1 Ack=145 Win=1452 Len=0 TSval=24455615 TSecr=1641087
    5 0.004183006  10.6.15.145 → 192.168.1.16 SSH 142 Server: Encrypted packet (len=76)
    6 0.049535943 192.168.1.16 → 10.6.15.145  TCP 66 52104 → 22 [ACK] Seq=145 Ack=77 Win=6157 Len=0 TSval=1641100 TSecr=24455615
    7 1.443417778  10.6.15.145 → 192.168.1.16 SSH 102 Server: Encrypted packet (len=36)
    8 1.443437929 192.168.1.16 → 10.6.15.145  TCP 66 52104 → 22 [ACK] Seq=145 Ack=113 Win=6157 Len=0 TSval=1641448 TSecr=24455656
    9 1.443780103 192.168.1.16 → 10.6.15.145  SSH 718 Client: Encrypted packet (len=652)
   10 1.443856756  10.6.15.145 → 192.168.1.16 SSH 102 Server: Encrypted packet (len=36)
   11 1.444518765  10.6.15.145 → 192.168.1.16 TCP 102 [TCP Retransmission] 22 → 52104 [PSH, ACK] Seq=113 Ack=145 Win=1452 Len=36 TSval=24455676 TSecr=1641100
   12 1.444526318 192.168.1.16 → 10.6.15.145  TCP 78 52104 → 22 [ACK] Seq=797 Ack=149 Win=6157 Len=0 TSval=1641448 TSecr=24455676 SLE=113 SRE=149
   13 1.445132038  10.6.15.145 → 192.168.1.16 SSH 138 Server: [TCP Spurious Retransmission] , Encrypted packet (len=72)
   14 1.445139459 192.168.1.16 → 10.6.15.145  TCP 78 [TCP Dup ACK 12#1] 52104 → 22 [ACK] Seq=797 Ack=149 Win=6157 Len=0 TSval=1641448 TSecr=24455789 SLE=77 SRE=149
   15 1.484493683  10.6.15.145 → 192.168.1.16 TCP 66 22 → 52104 [ACK] Seq=149 Ack=797 Win=1452 Len=0 TSval=24455986 TSecr=1641448
   16 2.499409130  10.6.15.145 → 192.168.1.16 SSH 494 Server: Encrypted packet (len=428)
   17 2.499429781 192.168.1.16 → 10.6.15.145  TCP 66 52104 → 22 [ACK] Seq=797 Ack=577 Win=6157 Len=0 TSval=1641712 TSecr=24456169
   18 2.502545824 192.168.1.16 → 10.6.15.145  SSH 110 Client: Encrypted packet (len=44)
   19 2.502742818 192.168.1.16 → 10.6.15.145  SSH 102 Client: Encrypted packet (len=36)
   20 2.503987062  10.6.15.145 → 192.168.1.16 TCP 66 22 → 52104 [ACK] Seq=577 Ack=841 Win=1452 Len=0 TSval=24456240 TSecr=1641713
   21 2.504002762  10.6.15.145 → 192.168.1.16 TCP 66 22 → 52104 [ACK] Seq=577 Ack=877 Win=1452 Len=0 TSval=24456240 TSecr=1641713
   22 2.711107019 192.168.1.16 → 10.6.15.145  SSH 222 Client: Encrypted packet (len=156)
   23 2.712527564 192.168.1.16 → 10.6.15.145  SSH 1158 Client: Encrypted packet (len=1092)
   24 2.712661916  10.6.15.145 → 192.168.1.16 SSH 102 Server: Encrypted packet (len=36)
   25 2.712675979  10.6.15.145 → 192.168.1.16 SSH 102 Server: Encrypted packet (len=36)
   26 2.712700900 192.168.1.16 → 10.6.15.145  TCP 66 52104 → 22 [ACK] Seq=2125 Ack=649 Win=6157 Len=0 TSval=1641765 TSecr=24456281
   27 2.713168594 192.168.1.16 → 10.6.15.145  SSH 182 Client: Encrypted packet (len=116)
   28 2.713358465 192.168.1.16 → 10.6.15.145  SSH 158 Client: Encrypted packet (len=92)
   29 2.715098673  10.6.15.145 → 192.168.1.16 TCP 66 22 → 52104 [ACK] Seq=649 Ack=1033 Win=1452 Len=0 TSval=24456293 TSecr=1641765
   30 2.715760947  10.6.15.145 → 192.168.1.16 TCP 66 22 → 52104 [ACK] Seq=649 Ack=2125 Win=1452 Len=0 TSval=24456293 TSecr=1641765
   31 2.715769986  10.6.15.145 → 192.168.1.16 TCP 66 22 → 52104 [ACK] Seq=649 Ack=2241 Win=1452 Len=0 TSval=24456293 TSecr=1641765
   32 2.715791940  10.6.15.145 → 192.168.1.16 TCP 66 22 → 52104 [ACK] Seq=649 Ack=2333 Win=1452 Len=0 TSval=24456293 TSecr=1641765
   33 2.718505149  10.6.15.145 → 192.168.1.16 SSH 142 Server: Encrypted packet (len=76)
   34 2.761509724 192.168.1.16 → 10.6.15.145  TCP 66 52104 → 22 [ACK] Seq=2333 Ack=725 Win=6157 Len=0 TSval=1641778 TSecr=24456294
   35 2.833832441  10.6.15.145 → 192.168.1.16 SSH 182 Server: Encrypted packet (len=116)
   36 2.833859031 192.168.1.16 → 10.6.15.145  TCP 66 52104 → 22 [ACK] Seq=2333 Ack=841 Win=6157 Len=0 TSval=1641796 TSecr=24456323
   37 2.834623014  10.6.15.145 → 192.168.1.16 SSH 1022 Server: Encrypted packet (len=956)
   38 2.834632208 192.168.1.16 → 10.6.15.145  TCP 66 52104 → 22 [ACK] Seq=2333 Ack=1797 Win=6157 Len=0 TSval=1641796 TSecr=24456323
   39 2.835295403 192.168.1.16 → 10.6.15.145  SSH 134 Client: Encrypted packet (len=68)
   40 2.880150571  10.6.15.145 → 192.168.1.16 SSH 926 Server: Encrypted packet (len=860)
   41 2.880717174  10.6.15.145 → 192.168.1.16 SSH 1514 Server: Encrypted packet (len=1448)
   42 2.880730041 192.168.1.16 → 10.6.15.145  TCP 66 52104 → 22 [ACK] Seq=2401 Ack=4105 Win=6157 Len=0 TSval=1641807 TSecr=24456334
   43 2.880749876  10.6.15.145 → 192.168.1.16 SSH 190 Server: Encrypted packet (len=124)
   44 2.880758452  10.6.15.145 → 192.168.1.16 SSH 158 Server: Encrypted packet (len=92)
   45 2.880776068 192.168.1.16 → 10.6.15.145  TCP 66 52104 → 22 [ACK] Seq=2401 Ack=4321 Win=6157 Len=0 TSval=1641807 TSecr=24456334
   46 2.882373752 192.168.1.16 → 10.6.15.145  SSH 206 Client: Encrypted packet (len=140)
   47 2.887395896 192.168.1.16 → 10.6.15.145  SSH 950 Client: Encrypted packet (len=884)
   48 2.905510699 192.168.1.16 → 10.6.15.145  TCP 950 [TCP Retransmission] 52104 → 22 [PSH, ACK] Seq=2541 Ack=4321 Win=6157 Len=884 TSval=1641814 TSecr=24456334
   49 2.937274904  10.6.15.145 → 192.168.1.16 SSH 314 Server: Encrypted packet (len=248)
   50 2.937295473  10.6.15.145 → 192.168.1.16 TCP 78 [TCP Dup ACK 32#1] 22 → 52104 [ACK] Seq=4569 Ack=2333 Win=1452 Len=0 TSval=24456349 TSecr=1641796 SLE=2401 SRE=2541
   51 2.938004710  10.6.15.145 → 192.168.1.16 TCP 78 [TCP Dup ACK 32#2] 22 → 52104 [ACK] Seq=4569 Ack=2333 Win=1452 Len=0 TSval=24456349 TSecr=1641796 SLE=2401 SRE=3425
   52 2.938014932  10.6.15.145 → 192.168.1.16 TCP 86 [TCP Dup ACK 32#3] 22 → 52104 [ACK] Seq=4569 Ack=2333 Win=1452 Len=0 TSval=24456349 TSecr=1641796 SLE=2541 SRE=3425 SLE=2401 SRE=3425
   53 2.938600477 192.168.1.16 → 10.6.15.145  SSH 206 Client: Encrypted packet (len=140)
   54 2.939926060  10.6.15.145 → 192.168.1.16 TCP 78 [TCP Dup ACK 32#4] 22 → 52104 [ACK] Seq=4569 Ack=2333 Win=1452 Len=0 TSval=24456349 TSecr=1641796 SLE=2401 SRE=3565
   55 2.939944472 192.168.1.16 → 10.6.15.145  SSH 134 Client: [TCP Fast Retransmission] , Encrypted packet (len=68)
   56 2.941270552  10.6.15.145 → 192.168.1.16 TCP 66 22 → 52104 [ACK] Seq=4569 Ack=3565 Win=1446 Len=0 TSval=24456350 TSecr=1641822
   57 3.585519387 192.168.1.16 → 216.58.197.35 TCP 66 54040 → 443 [ACK] Seq=1 Ack=1 Win=229 Len=0 TSval=1641984 TSecr=2850863602
   58 3.587227382  10.6.15.145 → 192.168.1.16 SSH 342 Server: Encrypted packet (len=276)
   59 3.587241281  10.6.15.145 → 192.168.1.16 SSH 318 Server: Encrypted packet (len=252)
   60 3.587291212 192.168.1.16 → 10.6.15.145  TCP 66 52104 → 22 [ACK] Seq=3565 Ack=5097 Win=6157 Len=0 TSval=1641984 TSecr=24456391
   61 3.587487536  10.6.15.145 → 192.168.1.16 SSH 1514 Server: Encrypted packet (len=1448)
   62 3.588189051  10.6.15.145 → 192.168.1.16 SSH 1514 Server: Encrypted packet (len=1448)
   63 3.588206546 192.168.1.16 → 10.6.15.145  TCP 66 52104 → 22 [ACK] Seq=3565 Ack=7993 Win=6157 Len=0 TSval=1641984 TSecr=24456423
   64 3.588225928  10.6.15.145 → 192.168.1.16 SSH 294 Server: Encrypted packet (len=228)
   65 3.588355276  10.6.15.145 → 192.168.1.16 SSH 1514 Server: Encrypted packet (len=1448)
   66 3.588358787 192.168.1.16 → 10.6.15.145  TCP 66 52104 → 22 [ACK] Seq=3565 Ack=9669 Win=6157 Len=0 TSval=1641984 TSecr=24456423
   67 3.589527486  10.6.15.145 → 192.168.1.16 SSH 1514 Server: Encrypted packet (len=1448)
   68 3.590190349  10.6.15.145 → 192.168.1.16 SSH 1514 Server: Encrypted packet (len=1448)
   69 3.590204488 192.168.1.16 → 10.6.15.145  TCP 66 52104 → 22 [ACK] Seq=3565 Ack=12565 Win=6157 Len=0 TSval=1641985 TSecr=24456512
   70 3.590377339  10.6.15.145 → 192.168.1.16 SSH 1514 Server: Encrypted packet (len=1448)
   71 3.590567862  10.6.15.145 → 192.168.1.16 SSH 1514 Server: Encrypted packet (len=1448)
   72 3.590574210 192.168.1.16 → 10.6.15.145  TCP 66 52104 → 22 [ACK] Seq=3565 Ack=15461 Win=6157 Len=0 TSval=1641985 TSecr=24456512
   73 3.591240768  10.6.15.145 → 192.168.1.16 SSH 1514 Server: Encrypted packet (len=1448)
   74 3.592530299  10.6.15.145 → 192.168.1.16 SSH 1514 Server: Encrypted packet (len=1448)
   75 3.592547931 192.168.1.16 → 10.6.15.145  TCP 66 52104 → 22 [ACK] Seq=3565 Ack=18357 Win=6157 Len=0 TSval=1641985 TSecr=24456512
   76 3.592715274  10.6.15.145 → 192.168.1.16 SSH 1514 Server: Encrypted packet (len=1448)
   77 3.592907097  10.6.15.145 → 192.168.1.16 SSH 1514 Server: Encrypted packet (len=1448)
   78 3.592914158 192.168.1.16 → 10.6.15.145  TCP 66 52104 → 22 [ACK] Seq=3565 Ack=21253 Win=6157 Len=0 TSval=1641985 TSecr=24456512
   79 3.593506295  10.6.15.145 → 192.168.1.16 SSH 1514 Server: Encrypted packet (len=1448)
   80 3.594805202  10.6.15.145 → 192.168.1.16 SSH 1514 Server: Encrypted packet (len=1448)
   81 3.594824905 192.168.1.16 → 10.6.15.145  TCP 66 52104 → 22 [ACK] Seq=3565 Ack=24149 Win=6157 Len=0 TSval=1641986 TSecr=24456512
   82 3.594983472  10.6.15.145 → 192.168.1.16 SSH 1514 Server: Encrypted packet (len=1448)
   83 3.595177903  10.6.15.145 → 192.168.1.16 SSH 1514 Server: Encrypted packet (len=1448)
   84 3.595185030 192.168.1.16 → 10.6.15.145  TCP 66 52104 → 22 [ACK] Seq=3565 Ack=27045 Win=6157 Len=0 TSval=1641986 TSecr=24456513
   85 3.595819419  10.6.15.145 → 192.168.1.16 SSH 1514 Server: Encrypted packet (len=1448)
   86 3.597268107  10.6.15.145 → 192.168.1.16 SSH 1514 Server: Encrypted packet (len=1448)
   87 3.597285886 192.168.1.16 → 10.6.15.145  TCP 66 52104 → 22 [ACK] Seq=3565 Ack=29941 Win=6157 Len=0 TSval=1641986 TSecr=24456513
   88 3.597448869  10.6.15.145 → 192.168.1.16 SSH 1514 Server: Encrypted packet (len=1448)
   89 3.597641698  10.6.15.145 → 192.168.1.16 SSH 1514 Server: Encrypted packet (len=1448)
   90 3.597649043 192.168.1.16 → 10.6.15.145  TCP 66 52104 → 22 [ACK] Seq=3565 Ack=32837 Win=6157 Len=0 TSval=1641987 TSecr=24456514
   91 3.598217949  10.6.15.145 → 192.168.1.16 SSH 1514 Server: Encrypted packet (len=1448)
   92 3.599765185  10.6.15.145 → 192.168.1.16 SSH 1514 Server: Encrypted packet (len=1448)
   93 3.599785195 192.168.1.16 → 10.6.15.145  TCP 66 52104 → 22 [ACK] Seq=3565 Ack=35733 Win=6157 Len=0 TSval=1641987 TSecr=24456514
   94 3.599945460  10.6.15.145 → 192.168.1.16 SSH 1514 Server: Encrypted packet (len=1448)
   95 3.600136488  10.6.15.145 → 192.168.1.16 SSH 1514 Server: Encrypted packet (len=1448)
   96 3.600142141 192.168.1.16 → 10.6.15.145  TCP 66 52104 → 22 [ACK] Seq=3565 Ack=38629 Win=6157 Len=0 TSval=1641987 TSecr=24456514
   97 3.600715473  10.6.15.145 → 192.168.1.16 SSH 1514 Server: Encrypted packet (len=1448)
   98 3.602127409  10.6.15.145 → 192.168.1.16 SSH 1514 Server: Encrypted packet (len=1448)
   99 3.602138643 192.168.1.16 → 10.6.15.145  TCP 66 52104 → 22 [ACK] Seq=3565 Ack=41525 Win=6157 Len=0 TSval=1641988 TSecr=24456514
  100 3.602314255  10.6.15.145 → 192.168.1.16 SSH 1514 Server: Encrypted packet (len=1448)
  101 3.602505904  10.6.15.145 → 192.168.1.16 SSH 1514 Server: Encrypted packet (len=1448)
  102 3.602512959 192.168.1.16 → 10.6.15.145  TCP 66 52104 → 22 [ACK] Seq=3565 Ack=44421 Win=6157 Len=0 TSval=1641988 TSecr=24456515
  103 3.604419353 192.168.1.16 → 10.6.15.145  SSH 102 Client: Encrypted packet (len=36)
  104 3.605022311  10.6.15.145 → 192.168.1.16 SSH 1514 Server: Encrypted packet (len=1448)
  105 3.606067520  10.6.15.145 → 192.168.1.16 SSH 1514 Server: Encrypted packet (len=1448)
  106 3.606084837 192.168.1.16 → 10.6.15.145  TCP 66 52104 → 22 [ACK] Seq=3601 Ack=47317 Win=6157 Len=0 TSval=1641989 TSecr=24456515
  107 3.606252634  10.6.15.145 → 192.168.1.16 SSH 1514 Server: Encrypted packet (len=1448)
  108 3.606442927  10.6.15.145 → 192.168.1.16 SSH 1514 Server: Encrypted packet (len=1448)
  109 3.606453898 192.168.1.16 → 10.6.15.145  TCP 66 52104 → 22 [ACK] Seq=3601 Ack=50213 Win=6157 Len=0 TSval=1641989 TSecr=24456516
  110 3.607020114  10.6.15.145 → 192.168.1.16 SSH 1514 Server: Encrypted packet (len=1448)
  111 3.607034148  10.6.15.145 → 192.168.1.16 TCP 66 22 → 52104 [ACK] Seq=51661 Ack=3601 Win=1452 Len=0 TSval=24456516 TSecr=1641988
  112 3.607637318 192.168.1.16 → 10.6.15.145  SSH 118 Client: Encrypted packet (len=52)
  113 3.608431783  10.6.15.145 → 192.168.1.16 SSH 1514 Server: Encrypted packet (len=1448)
  114 3.608620317  10.6.15.145 → 192.168.1.16 SSH 1514 Server: Encrypted packet (len=1448)
  115 3.608632431 192.168.1.16 → 10.6.15.145  TCP 66 52104 → 22 [ACK] Seq=3653 Ack=54557 Win=6157 Len=0 TSval=1641989 TSecr=24456516
  116 3.608808858  10.6.15.145 → 192.168.1.16 SSH 1514 Server: Encrypted packet (len=1448)
  117 3.609385274  10.6.15.145 → 192.168.1.16 SSH 1514 Server: Encrypted packet (len=1448)
  118 3.609396173 192.168.1.16 → 10.6.15.145  TCP 66 52104 → 22 [ACK] Seq=3653 Ack=57453 Win=6157 Len=0 TSval=1641989 TSecr=24456516
  119 3.610728696  10.6.15.145 → 192.168.1.16 SSH 1514 Server: Encrypted packet (len=1448)
  120 3.610873304  10.6.15.145 → 192.168.1.16 SSH 1514 Server: Encrypted packet (len=1448)
  121 3.610886334 192.168.1.16 → 10.6.15.145  TCP 66 52104 → 22 [ACK] Seq=3653 Ack=60349 Win=6157 Len=0 TSval=1641990 TSecr=24456517
  122 3.611063397  10.6.15.145 → 192.168.1.16 SSH 1514 Server: Encrypted packet (len=1448)
  123 3.611254936  10.6.15.145 → 192.168.1.16 SSH 1514 Server: Encrypted packet (len=1448)
  124 3.611262247 192.168.1.16 → 10.6.15.145  TCP 66 52104 → 22 [ACK] Seq=3653 Ack=63245 Win=6157 Len=0 TSval=1641990 TSecr=24456517
  125 3.614957582  10.6.15.145 → 192.168.1.16 SSH 1514 Server: Encrypted packet (len=1448)
  126 3.615147151  10.6.15.145 → 192.168.1.16 SSH 1514 Server: Encrypted packet (len=1448)
  127 3.615160738 192.168.1.16 → 10.6.15.145  TCP 66 52104 → 22 [ACK] Seq=3653 Ack=66141 Win=6157 Len=0 TSval=1641991 TSecr=24456517
  128 3.615338380  10.6.15.145 → 192.168.1.16 SSH 1514 Server: Encrypted packet (len=1448)
  129 3.615530774  10.6.15.145 → 192.168.1.16 SSH 1514 Server: Encrypted packet (len=1448)
  130 3.615539385 192.168.1.16 → 10.6.15.145  TCP 66 52104 → 22 [ACK] Seq=3653 Ack=69037 Win=6157 Len=0 TSval=1641991 TSecr=24456518
  131 3.615723820  10.6.15.145 → 192.168.1.16 SSH 1514 Server: Encrypted packet (len=1448)
  132 3.615915043  10.6.15.145 → 192.168.1.16 SSH 1514 Server: Encrypted packet (len=1448)
  133 3.615922935 192.168.1.16 → 10.6.15.145  TCP 66 52104 → 22 [ACK] Seq=3653 Ack=71933 Win=6157 Len=0 TSval=1641991 TSecr=24456518
  134 3.617578602 192.168.1.16 → 10.6.15.145  SSH 102 Client: Encrypted packet (len=36)
  135 3.617839572  10.6.15.145 → 192.168.1.16 SSH 1514 Server: Encrypted packet (len=1448)
  136 3.618453803  10.6.15.145 → 192.168.1.16 SSH 1514 Server: Encrypted packet (len=1448)
  137 3.618467075 192.168.1.16 → 10.6.15.145  TCP 66 52104 → 22 [ACK] Seq=3689 Ack=74829 Win=6157 Len=0 TSval=1641992 TSecr=24456519
  138 3.618642306  10.6.15.145 → 192.168.1.16 SSH 1514 Server: Encrypted packet (len=1448)
  139 3.618833619  10.6.15.145 → 192.168.1.16 SSH 1514 Server: Encrypted packet (len=1448)
  140 3.618842909 192.168.1.16 → 10.6.15.145  TCP 66 52104 → 22 [ACK] Seq=3689 Ack=77725 Win=6157 Len=0 TSval=1641992 TSecr=24456519
  141 3.619025499  10.6.15.145 → 192.168.1.16 SSH 1514 Server: Encrypted packet (len=1448)
  142 3.619217609  10.6.15.145 → 192.168.1.16 SSH 1514 Server: Encrypted packet (len=1448)
  143 3.619225592 192.168.1.16 → 10.6.15.145  TCP 66 52104 → 22 [ACK] Seq=3689 Ack=80621 Win=6157 Len=0 TSval=1641992 TSecr=24456519
  144 3.623386808  10.6.15.145 → 192.168.1.16 SSH 1514 Server: Encrypted packet (len=1448)
  145 3.623573724  10.6.15.145 → 192.168.1.16 SSH 1514 Server: Encrypted packet (len=1448)
  146 3.623582984 192.168.1.16 → 10.6.15.145  TCP 66 52104 → 22 [ACK] Seq=3689 Ack=83517 Win=6157 Len=0 TSval=1641993 TSecr=24456520
  147 3.623765417  10.6.15.145 → 192.168.1.16 SSH 1514 Server: Encrypted packet (len=1448)
  148 3.623955421  10.6.15.145 → 192.168.1.16 SSH 1514 Server: Encrypted packet (len=1448)
  149 3.623961785 192.168.1.16 → 10.6.15.145  TCP 66 52104 → 22 [ACK] Seq=3689 Ack=86413 Win=6157 Len=0 TSval=1641993 TSecr=24456520
  150 3.624147727  10.6.15.145 → 192.168.1.16 SSH 1514 Server: Encrypted packet (len=1448)
  151 3.624273282  10.6.15.145 → 192.168.1.16 SSH 1090 Server: Encrypted packet (len=1024)
  152 3.624278956 192.168.1.16 → 10.6.15.145  TCP 66 52104 → 22 [ACK] Seq=3689 Ack=88885 Win=6157 Len=0 TSval=1641993 TSecr=24456520
  153 3.862598002 192.168.1.16 → 10.6.15.145  SSH 102 Client: Encrypted packet (len=36)
  154 3.864629956 192.168.1.16 → 10.6.15.145  SSH 102 Client: Encrypted packet (len=36)
  155 3.864959203 192.168.1.16 → 10.6.15.145  SSH 118 Client: Encrypted packet (len=52)
  156 3.866420113  10.6.15.145 → 192.168.1.16 SSH 138 Server: Encrypted packet (len=72)
  157 3.866690334  10.6.15.145 → 192.168.1.16 TCP 66 22 → 52104 [ACK] Seq=88957 Ack=3761 Win=1452 Len=0 TSval=24456581 TSecr=1642053
  158 3.866727351 192.168.1.16 → 10.6.15.145  SSH 102 Client: Encrypted packet (len=36)
  159 3.874936993 192.168.1.16 → 10.6.15.145  SSH 110 Client: Encrypted packet (len=44)
  160 3.893511335 192.168.1.16 → 10.6.15.145  SSH 138 Client: Encrypted packet (len=72)
  161 3.904218738  10.6.15.145 → 192.168.1.16 TCP 66 22 → 52104 [ACK] Seq=88957 Ack=3849 Win=1452 Len=0 TSval=24456591 TSecr=1642053
  162 3.925405096  10.6.15.145 → 192.168.1.16 TCP 78 [TCP Dup ACK 161#1] 22 → 52104 [ACK] Seq=88957 Ack=3849 Win=1452 Len=0 TSval=24456594 TSecr=1642053 SLE=3893 SRE=3965
  163 3.970680759 192.168.1.16 → 10.6.15.145  SSH 102 Client: Encrypted packet (len=36)
  164 3.970887235 192.168.1.16 → 10.6.15.145  SSH 102 Client: Encrypted packet (len=36)
  165 3.971866854  10.6.15.145 → 192.168.1.16 TCP 78 [TCP Dup ACK 161#2] 22 → 52104 [ACK] Seq=88957 Ack=3849 Win=1452 Len=0 TSval=24456607 TSecr=1642053 SLE=3893 SRE=4001
  166 3.971882880  10.6.15.145 → 192.168.1.16 TCP 78 [TCP Dup ACK 161#3] 22 → 52104 [ACK] Seq=88957 Ack=3849 Win=1452 Len=0 TSval=24456607 TSecr=1642053 SLE=3893 SRE=4037
  167 3.971891824 192.168.1.16 → 10.6.15.145  SSH 110 Client: [TCP Fast Retransmission] , Encrypted packet (len=44)
  168 3.973200366  10.6.15.145 → 192.168.1.16 TCP 66 22 → 52104 [ACK] Seq=88957 Ack=4037 Win=1452 Len=0 TSval=24456608 TSecr=1642080
  169 3.975402213 192.168.1.16 → 10.6.15.145  SSH 102 Client: Encrypted packet (len=36)
  170 3.975737326 192.168.1.16 → 10.6.15.145  SSH 102 Client: Encrypted packet (len=36)
  171 3.976566758  10.6.15.145 → 192.168.1.16 TCP 66 22 → 52104 [ACK] Seq=88957 Ack=4073 Win=1452 Len=0 TSval=24456609 TSecr=1642081
  172 3.977300296  10.6.15.145 → 192.168.1.16 TCP 66 22 → 52104 [ACK] Seq=88957 Ack=4109 Win=1452 Len=0 TSval=24456609 TSecr=1642081
  173 5.476653173  10.6.15.145 → 192.168.1.16 SSH 254 Server: Encrypted packet (len=188)
  174 5.477081581 192.168.1.16 → 10.6.15.145  SSH 182 Client: Encrypted packet (len=116)
  175 5.477201628  10.6.15.145 → 192.168.1.16 SSH 102 Server: Encrypted packet (len=36)
  176 5.477208867 192.168.1.16 → 10.6.15.145  SSH 158 Client: Encrypted packet (len=92)
  177 5.477338565  10.6.15.145 → 192.168.1.16 SSH 138 Server: Encrypted packet (len=72)
  178 5.477348851  10.6.15.145 → 192.168.1.16 SSH 102 Server: Encrypted packet (len=36)
  179 5.477364930  10.6.15.145 → 192.168.1.16 SSH 102 Server: Encrypted packet (len=36)
  180 5.477389034  10.6.15.145 → 192.168.1.16 SSH 102 Server: Encrypted packet (len=36)
  181 5.477401849 192.168.1.16 → 10.6.15.145  TCP 66 52104 → 22 [ACK] Seq=4317 Ack=89361 Win=6157 Len=0 TSval=1642456 TSecr=24456810
  182 5.477414172  10.6.15.145 → 192.168.1.16 SSH 138 Server: Encrypted packet (len=72)
  183 5.477434195  10.6.15.145 → 192.168.1.16 TCP 138 [TCP Retransmission] 22 → 52104 [PSH, ACK] Seq=89361 Ack=4109 Win=1452 Len=72 TSval=24456824 TSecr=1642081
  184 5.477439237 192.168.1.16 → 10.6.15.145  TCP 78 52104 → 22 [ACK] Seq=4317 Ack=89433 Win=6157 Len=0 TSval=1642456 TSecr=24456824 SLE=89361 SRE=89433
  185 5.477523120  10.6.15.145 → 192.168.1.16 SSH 542 Server: [TCP Spurious Retransmission] , Encrypted packet (len=476)
  186 5.477529472 192.168.1.16 → 10.6.15.145  TCP 78 [TCP Dup ACK 184#1] 52104 → 22 [ACK] Seq=4317 Ack=89433 Win=6157 Len=0 TSval=1642457 TSecr=24456894 SLE=88957 SRE=89433
  187 5.481400662 192.168.1.16 → 10.6.15.145  SSH 922 Client: Encrypted packet (len=856)
  188 5.482591937  10.6.15.145 → 192.168.1.16 TCP 66 22 → 52104 [ACK] Seq=89433 Ack=4225 Win=1452 Len=0 TSval=24456985 TSecr=1642456
  189 5.482605273  10.6.15.145 → 192.168.1.16 TCP 66 22 → 52104 [ACK] Seq=89433 Ack=4317 Win=1452 Len=0 TSval=24456985 TSecr=1642456
  190 5.485935748  10.6.15.145 → 192.168.1.16 TCP 66 22 → 52104 [ACK] Seq=89433 Ack=5173 Win=1452 Len=0 TSval=24456986 TSecr=1642457
  191 6.467632198  10.6.15.145 → 192.168.1.16 SSH 1038 Server: Encrypted packet (len=972)
  192 6.467715891  10.6.15.145 → 192.168.1.16 SSH 982 Server: Encrypted packet (len=916)
  193 6.467724227 192.168.1.16 → 10.6.15.145  TCP 66 52104 → 22 [ACK] Seq=5173 Ack=91321 Win=6157 Len=0 TSval=1642704 TSecr=24457026
  194 6.467826958  10.6.15.145 → 192.168.1.16 SSH 870 Server: Encrypted packet (len=804)
  195 6.468451537  10.6.15.145 → 192.168.1.16 SSH 1126 Server: Encrypted packet (len=1060)
  196 6.468456216 192.168.1.16 → 10.6.15.145  TCP 66 52104 → 22 [ACK] Seq=5173 Ack=93185 Win=6157 Len=0 TSval=1642704 TSecr=24457026
  197 6.468491129  10.6.15.145 → 192.168.1.16 SSH 614 Server: Encrypted packet (len=548)
  198 6.468496322  10.6.15.145 → 192.168.1.16 SSH 158 Server: Encrypted packet (len=92)
  199 6.468506293 192.168.1.16 → 10.6.15.145  TCP 66 52104 → 22 [ACK] Seq=5173 Ack=93825 Win=6157 Len=0 TSval=1642704 TSecr=24457026
  200 6.468518622  10.6.15.145 → 192.168.1.16 SSH 118 Server: Encrypted packet (len=52)
  201 6.468753814  10.6.15.145 → 192.168.1.16 SSH 1514 Server: Encrypted packet (len=1448)
  202 6.468761868 192.168.1.16 → 10.6.15.145  TCP 66 52104 → 22 [ACK] Seq=5173 Ack=95325 Win=6157 Len=0 TSval=1642704 TSecr=24457027
  203 6.469563190 192.168.1.16 → 10.6.15.145  SSH 206 Client: Encrypted packet (len=140)
  204 6.469680907  10.6.15.145 → 192.168.1.16 SSH 1514 Server: Encrypted packet (len=1448)
  205 6.470741844  10.6.15.145 → 192.168.1.16 SSH 1514 Server: Encrypted packet (len=1448)
  206 6.470751310 192.168.1.16 → 10.6.15.145  TCP 66 52104 → 22 [ACK] Seq=5313 Ack=98221 Win=6157 Len=0 TSval=1642705 TSecr=24457232
  207 6.470927374  10.6.15.145 → 192.168.1.16 SSH 1514 Server: Encrypted packet (len=1448)
  208 6.471120562  10.6.15.145 → 192.168.1.16 SSH 1514 Server: Encrypted packet (len=1448)
  209 6.471124975 192.168.1.16 → 10.6.15.145  TCP 66 52104 → 22 [ACK] Seq=5313 Ack=101117 Win=6157 Len=0 TSval=1642705 TSecr=24457232
  210 6.471448764 192.168.1.16 → 10.6.15.145  SSH 206 Client: Encrypted packet (len=140)
  211 6.471819464  10.6.15.145 → 192.168.1.16 SSH 154 Server: Encrypted packet (len=88)
  212 6.471829505  10.6.15.145 → 192.168.1.16 TCP 66 22 → 52104 [ACK] Seq=101205 Ack=5313 Win=1452 Len=0 TSval=24457232 TSecr=1642705
  213 6.472274902 192.168.1.16 → 10.6.15.145  SSH 206 Client: Encrypted packet (len=140)
  214 6.472890236  10.6.15.145 → 192.168.1.16 TCP 66 22 → 52104 [ACK] Seq=101205 Ack=5453 Win=1452 Len=0 TSval=24457233 TSecr=1642705
  215 6.473115074 192.168.1.16 → 10.6.15.145  SSH 206 Client: Encrypted packet (len=140)
  216 6.473594058  10.6.15.145 → 192.168.1.16 TCP 66 22 → 52104 [ACK] Seq=101205 Ack=5593 Win=1452 Len=0 TSval=24457233 TSecr=1642705
  217 6.473913450 192.168.1.16 → 10.6.15.145  SSH 206 Client: Encrypted packet (len=140)
  218 6.474489288  10.6.15.145 → 192.168.1.16 TCP 66 22 → 52104 [ACK] Seq=101205 Ack=5733 Win=1452 Len=0 TSval=24457233 TSecr=1642705
  219 6.475015192 192.168.1.16 → 10.6.15.145  SSH 206 Client: Encrypted packet (len=140)
  220 6.475577890  10.6.15.145 → 192.168.1.16 TCP 66 22 → 52104 [ACK] Seq=101205 Ack=5873 Win=1452 Len=0 TSval=24457233 TSecr=1642706
  221 6.476145567 192.168.1.16 → 10.6.15.145  SSH 206 Client: Encrypted packet (len=140)
  222 6.476438645  10.6.15.145 → 192.168.1.16 TCP 66 22 → 52104 [ACK] Seq=101205 Ack=6013 Win=1452 Len=0 TSval=24457234 TSecr=1642706
  223 6.477374254  10.6.15.145 → 192.168.1.16 TCP 66 22 → 52104 [ACK] Seq=101205 Ack=6153 Win=1452 Len=0 TSval=24457234 TSecr=1642706
  224 6.477580925 192.168.1.16 → 10.6.15.145  SSH 206 Client: Encrypted packet (len=140)
  225 6.478451279 192.168.1.16 → 10.6.15.145  SSH 206 Client: Encrypted packet (len=140)
  226 6.478905766  10.6.15.145 → 192.168.1.16 TCP 66 22 → 52104 [ACK] Seq=101205 Ack=6293 Win=1452 Len=0 TSval=24457234 TSecr=1642707
  227 6.479232248 192.168.1.16 → 10.6.15.145  SSH 206 Client: Encrypted packet (len=140)
  228 6.479643777  10.6.15.145 → 192.168.1.16 TCP 66 22 → 52104 [ACK] Seq=101205 Ack=6433 Win=1452 Len=0 TSval=24457234 TSecr=1642707
  229 6.480069005 192.168.1.16 → 10.6.15.145  SSH 206 Client: Encrypted packet (len=140)
  230 6.480439848  10.6.15.145 → 192.168.1.16 TCP 66 22 → 52104 [ACK] Seq=101205 Ack=6573 Win=1452 Len=0 TSval=24457235 TSecr=1642707
  231 6.481375610  10.6.15.145 → 192.168.1.16 TCP 66 22 → 52104 [ACK] Seq=101205 Ack=6713 Win=1452 Len=0 TSval=24457235 TSecr=1642707
  232 6.481952124 192.168.1.16 → 10.6.15.145  SSH 1174 Client: Encrypted packet (len=1108)
  233 6.482392019 192.168.1.16 → 10.6.15.145  SSH 454 Client: Encrypted packet (len=388)
  234 6.482656889 192.168.1.16 → 10.6.15.145  SSH 486 Client: Encrypted packet (len=420)
  235 6.483645665  10.6.15.145 → 192.168.1.16 TCP 66 22 → 52104 [ACK] Seq=101205 Ack=7821 Win=1452 Len=0 TSval=24457235 TSecr=1642708
  236 6.483656953 192.168.1.16 → 10.6.15.145  SSH 1514 Client: Encrypted packet (len=1448)
  237 6.483667523  10.6.15.145 → 192.168.1.16 TCP 66 22 → 52104 [ACK] Seq=101205 Ack=8209 Win=1452 Len=0 TSval=24457235 TSecr=1642708
  238 6.483671831 192.168.1.16 → 10.6.15.145  SSH 1514 Client: Encrypted packet (len=1448)
  239 6.484739512  10.6.15.145 → 192.168.1.16 TCP 66 22 → 52104 [ACK] Seq=101205 Ack=8629 Win=1452 Len=0 TSval=24457235 TSecr=1642708
  240 6.484748901 192.168.1.16 → 10.6.15.145  SSH 246 Client: Encrypted packet (len=180)
  241 6.485959639  10.6.15.145 → 192.168.1.16 TCP 66 22 → 52104 [ACK] Seq=101205 Ack=11705 Win=1452 Len=0 TSval=24457236 TSecr=1642708
  242 6.486030152 192.168.1.16 → 10.6.15.145  SSH 526 Client: Encrypted packet (len=460)
  243 6.487411175  10.6.15.145 → 192.168.1.16 TCP 66 22 → 52104 [ACK] Seq=101205 Ack=12165 Win=1452 Len=0 TSval=24457236 TSecr=1642709
  244 7.460065806  10.6.15.145 → 192.168.1.16 SSH 366 Server: Encrypted packet (len=300)
  245 7.460083775  10.6.15.145 → 192.168.1.16 SSH 334 Server: Encrypted packet (len=268)
  246 7.460145206 192.168.1.16 → 10.6.15.145  TCP 66 52104 → 22 [ACK] Seq=12165 Ack=101773 Win=6157 Len=0 TSval=1642952 TSecr=24457273
  247 7.460180312  10.6.15.145 → 192.168.1.16 SSH 602 Server: Encrypted packet (len=536)
  248 7.460671985  10.6.15.145 → 192.168.1.16 SSH 358 Server: Encrypted packet (len=292)
  249 7.460706038 192.168.1.16 → 10.6.15.145  TCP 66 52104 → 22 [ACK] Seq=12165 Ack=102601 Win=6157 Len=0 TSval=1642952 TSecr=24457274
  250 7.463315853  10.6.15.145 → 192.168.1.16 SSH 334 Server: Encrypted packet (len=268)
  251 7.463325841  10.6.15.145 → 192.168.1.16 SSH 334 Server: Encrypted packet (len=268)
  252 7.463358755 192.168.1.16 → 10.6.15.145  TCP 66 52104 → 22 [ACK] Seq=12165 Ack=103137 Win=6157 Len=0 TSval=1642953 TSecr=24457275
  253 7.463571180  10.6.15.145 → 192.168.1.16 SSH 1470 Server: Encrypted packet (len=1404)
  254 7.463763283  10.6.15.145 → 192.168.1.16 SSH 1514 Server: Encrypted packet (len=1448)
  255 7.463766651 192.168.1.16 → 10.6.15.145  TCP 66 52104 → 22 [ACK] Seq=12165 Ack=105989 Win=6157 Len=0 TSval=1642953 TSecr=24457277
  256 7.463959076  10.6.15.145 → 192.168.1.16 SSH 1514 Server: Encrypted packet (len=1448)
  257 7.470839685  10.6.15.145 → 192.168.1.16 SSH 1514 Server: Encrypted packet (len=1448)
  258 7.470857304 192.168.1.16 → 10.6.15.145  TCP 66 52104 → 22 [ACK] Seq=12165 Ack=108885 Win=6157 Len=0 TSval=1642955 TSecr=24457480
  259 7.470961863  10.6.15.145 → 192.168.1.16 SSH 1514 Server: Encrypted packet (len=1448)
  260 7.513569107 192.168.1.16 → 10.6.15.145  TCP 66 52104 → 22 [ACK] Seq=12165 Ack=110333 Win=6157 Len=0 TSval=1642966 TSecr=24457480
  261 7.527738040  10.6.15.145 → 192.168.1.16 SSH 1514 Server: Encrypted packet (len=1448)
  262 7.527758768 192.168.1.16 → 10.6.15.145  TCP 66 52104 → 22 [ACK] Seq=12165 Ack=111781 Win=6157 Len=0 TSval=1642969 TSecr=24457496
  263 7.527889963  10.6.15.145 → 192.168.1.16 SSH 1514 Server: Encrypted packet (len=1448)
  264 7.527893892 192.168.1.16 → 10.6.15.145  TCP 66 52104 → 22 [ACK] Seq=12165 Ack=113229 Win=6157 Len=0 TSval=1642969 TSecr=24457496
  265 7.528111985  10.6.15.145 → 192.168.1.16 SSH 1514 Server: Encrypted packet (len=1448)
  266 7.528116272 192.168.1.16 → 10.6.15.145  TCP 66 52104 → 22 [ACK] Seq=12165 Ack=114677 Win=6157 Len=0 TSval=1642969 TSecr=24457496
  267 7.528774397  10.6.15.145 → 192.168.1.16 SSH 1514 Server: Encrypted packet (len=1448)
  268 7.528778100 192.168.1.16 → 10.6.15.145  TCP 66 52104 → 22 [ACK] Seq=12165 Ack=116125 Win=6157 Len=0 TSval=1642969 TSecr=24457496
  269 7.528967352  10.6.15.145 → 192.168.1.16 SSH 1514 Server: Encrypted packet (len=1448)
  270 7.528972384 192.168.1.16 → 10.6.15.145  TCP 66 52104 → 22 [ACK] Seq=12165 Ack=117573 Win=6157 Len=0 TSval=1642969 TSecr=24457496
  271 7.529133612  10.6.15.145 → 192.168.1.16 SSH 1514 Server: Encrypted packet (len=1448)
  272 7.529139986 192.168.1.16 → 10.6.15.145  TCP 66 52104 → 22 [ACK] Seq=12165 Ack=119021 Win=6157 Len=0 TSval=1642969 TSecr=24457496
  273 7.529323854  10.6.15.145 → 192.168.1.16 SSH 1514 Server: Encrypted packet (len=1448)
  274 7.529329816 192.168.1.16 → 10.6.15.145  TCP 66 52104 → 22 [ACK] Seq=12165 Ack=120469 Win=6157 Len=0 TSval=1642969 TSecr=24457496
  275 7.529522782  10.6.15.145 → 192.168.1.16 SSH 1514 Server: Encrypted packet (len=1448)
  276 7.529529422 192.168.1.16 → 10.6.15.145  TCP 66 52104 → 22 [ACK] Seq=12165 Ack=121917 Win=6157 Len=0 TSval=1642970 TSecr=24457496
  277 7.530152568  10.6.15.145 → 192.168.1.16 SSH 1514 Server: Encrypted packet (len=1448)
  278 7.530163721 192.168.1.16 → 10.6.15.145  TCP 66 52104 → 22 [ACK] Seq=12165 Ack=123365 Win=6157 Len=0 TSval=1642970 TSecr=24457497
  279 7.530341197  10.6.15.145 → 192.168.1.16 SSH 1514 Server: Encrypted packet (len=1448)
  280 7.530346987 192.168.1.16 → 10.6.15.145  TCP 66 52104 → 22 [ACK] Seq=12165 Ack=124813 Win=6157 Len=0 TSval=1642970 TSecr=24457497
  281 7.531517157  10.6.15.145 → 192.168.1.16 SSH 1514 Server: Encrypted packet (len=1448)
  282 7.532781191 192.168.1.16 → 10.6.15.145  SSH 502 Client: Encrypted packet (len=436)
  283 7.536938781 192.168.1.16 → 10.6.15.145  SSH 906 Client: Encrypted packet (len=840)
  284 7.539513966  10.6.15.145 → 192.168.1.16 SSH 1514 Server: Encrypted packet (len=1448)
  285 7.539721087  10.6.15.145 → 192.168.1.16 SSH 1514 Server: Encrypted packet (len=1448)
  286 7.539726724 192.168.1.16 → 10.6.15.145  TCP 66 52104 → 22 [ACK] Seq=13441 Ack=129157 Win=6157 Len=0 TSval=1642972 TSecr=24457497
  287 7.539921898  10.6.15.145 → 192.168.1.16 SSH 1514 Server: Encrypted packet (len=1448)
  288 7.540111405  10.6.15.145 → 192.168.1.16 SSH 1514 Server: Encrypted packet (len=1448)
  289 7.540114752 192.168.1.16 → 10.6.15.145  TCP 66 52104 → 22 [ACK] Seq=13441 Ack=132053 Win=6157 Len=0 TSval=1642972 TSecr=24457497
  290 7.540302879  10.6.15.145 → 192.168.1.16 SSH 1514 Server: Encrypted packet (len=1448)
  291 7.540491276  10.6.15.145 → 192.168.1.16 SSH 1514 Server: Encrypted packet (len=1448)
  292 7.540494365 192.168.1.16 → 10.6.15.145  TCP 66 52104 → 22 [ACK] Seq=13441 Ack=134949 Win=6157 Len=0 TSval=1642972 TSecr=24457497
  293 7.540683368  10.6.15.145 → 192.168.1.16 SSH 1514 Server: Encrypted packet (len=1448)
  294 7.540875409  10.6.15.145 → 192.168.1.16 SSH 1514 Server: Encrypted packet (len=1448)
  295 7.540880670 192.168.1.16 → 10.6.15.145  TCP 66 52104 → 22 [ACK] Seq=13441 Ack=137845 Win=6157 Len=0 TSval=1642972 TSecr=24457497
  296 7.541046402  10.6.15.145 → 192.168.1.16 SSH 1514 Server: Encrypted packet (len=1448)
  297 7.542880170  10.6.15.145 → 192.168.1.16 SSH 1514 Server: Encrypted packet (len=1448)
  298 7.542885620 192.168.1.16 → 10.6.15.145  TCP 66 52104 → 22 [ACK] Seq=13441 Ack=140741 Win=6157 Len=0 TSval=1642973 TSecr=24457499
  299 7.543087510  10.6.15.145 → 192.168.1.16 SSH 1514 Server: Encrypted packet (len=1448)
  300 7.543279357  10.6.15.145 → 192.168.1.16 SSH 1514 Server: Encrypted packet (len=1448)
  301 7.543283280 192.168.1.16 → 10.6.15.145  TCP 66 52104 → 22 [ACK] Seq=13441 Ack=143637 Win=6157 Len=0 TSval=1642973 TSecr=24457500
  302 7.543930377  10.6.15.145 → 192.168.1.16 SSH 1514 Server: Encrypted packet (len=1448)
  303 7.544119533  10.6.15.145 → 192.168.1.16 SSH 1514 Server: Encrypted packet (len=1448)
  304 7.544125202 192.168.1.16 → 10.6.15.145  TCP 66 52104 → 22 [ACK] Seq=13441 Ack=146533 Win=6157 Len=0 TSval=1642973 TSecr=24457500
  305 7.544310609  10.6.15.145 → 192.168.1.16 SSH 1514 Server: Encrypted packet (len=1448)
  306 7.544507766  10.6.15.145 → 192.168.1.16 SSH 1514 Server: Encrypted packet (len=1448)
  307 7.544511863 192.168.1.16 → 10.6.15.145  TCP 66 52104 → 22 [ACK] Seq=13441 Ack=149429 Win=6157 Len=0 TSval=1642973 TSecr=24457500
  308 7.544669682  10.6.15.145 → 192.168.1.16 SSH 1514 Server: Encrypted packet (len=1448)
  309 7.545310734  10.6.15.145 → 192.168.1.16 SSH 1514 Server: Encrypted packet (len=1448)
  310 7.545314292 192.168.1.16 → 10.6.15.145  TCP 66 52104 → 22 [ACK] Seq=13441 Ack=152325 Win=6157 Len=0 TSval=1642973 TSecr=24457500
  311 7.545489826  10.6.15.145 → 192.168.1.16 SSH 1514 Server: Encrypted packet (len=1448)
  312 7.545713019  10.6.15.145 → 192.168.1.16 SSH 1514 Server: Encrypted packet (len=1448)
  313 7.545717038 192.168.1.16 → 10.6.15.145  TCP 66 52104 → 22 [ACK] Seq=13441 Ack=155221 Win=6157 Len=0 TSval=1642974 TSecr=24457501
  314 7.546255685  10.6.15.145 → 192.168.1.16 SSH 1514 Server: Encrypted packet (len=1448)
  315 7.546873218  10.6.15.145 → 192.168.1.16 SSH 1514 Server: Encrypted packet (len=1448)
  316 7.546883216 192.168.1.16 → 10.6.15.145  TCP 66 52104 → 22 [ACK] Seq=13441 Ack=158117 Win=6157 Len=0 TSval=1642974 TSecr=24457501
  317 7.547061907  10.6.15.145 → 192.168.1.16 SSH 1514 Server: Encrypted packet (len=1448)
  318 7.547251657  10.6.15.145 → 192.168.1.16 SSH 1514 Server: Encrypted packet (len=1448)
  319 7.547257941 192.168.1.16 → 10.6.15.145  TCP 66 52104 → 22 [ACK] Seq=13441 Ack=161013 Win=6157 Len=0 TSval=1642974 TSecr=24457501
  320 7.547979695  10.6.15.145 → 192.168.1.16 SSH 1514 Server: Encrypted packet (len=1448)
  321 7.548170655  10.6.15.145 → 192.168.1.16 SSH 1514 Server: Encrypted packet (len=1448)
  322 7.548177857 192.168.1.16 → 10.6.15.145  TCP 66 52104 → 22 [ACK] Seq=13441 Ack=163909 Win=6157 Len=0 TSval=1642974 TSecr=24457501
  323 7.548360718  10.6.15.145 → 192.168.1.16 SSH 1514 Server: Encrypted packet (len=1448)
  324 7.548552955  10.6.15.145 → 192.168.1.16 SSH 1514 Server: Encrypted packet (len=1448)
  325 7.548559265 192.168.1.16 → 10.6.15.145  TCP 66 52104 → 22 [ACK] Seq=13441 Ack=166805 Win=6157 Len=0 TSval=1642974 TSecr=24457501
  326 7.548746821  10.6.15.145 → 192.168.1.16 SSH 1514 Server: Encrypted packet (len=1448)
  327 7.549559109  10.6.15.145 → 192.168.1.16 SSH 1514 Server: Encrypted packet (len=1448)
  328 7.549571370 192.168.1.16 → 10.6.15.145  TCP 66 52104 → 22 [ACK] Seq=13441 Ack=169701 Win=6157 Len=0 TSval=1642975 TSecr=24457501
  329 7.549746644  10.6.15.145 → 192.168.1.16 SSH 1514 Server: Encrypted packet (len=1448)
  330 7.549951237  10.6.15.145 → 192.168.1.16 SSH 1514 Server: Encrypted packet (len=1448)
  331 7.549955239 192.168.1.16 → 10.6.15.145  TCP 66 52104 → 22 [ACK] Seq=13441 Ack=172597 Win=6157 Len=0 TSval=1642975 TSecr=24457502
  332 7.550585488  10.6.15.145 → 192.168.1.16 SSH 1514 Server: Encrypted packet (len=1448)
  333 7.551275455  10.6.15.145 → 192.168.1.16 SSH 1514 Server: Encrypted packet (len=1448)
  334 7.551279586 192.168.1.16 → 10.6.15.145  TCP 66 52104 → 22 [ACK] Seq=13441 Ack=175493 Win=6157 Len=0 TSval=1642975 TSecr=24457502
  335 7.551451680  10.6.15.145 → 192.168.1.16 SSH 1514 Server: Encrypted packet (len=1448)
  336 7.551643200  10.6.15.145 → 192.168.1.16 SSH 1514 Server: Encrypted packet (len=1448)
  337 7.551648511 192.168.1.16 → 10.6.15.145  TCP 66 52104 → 22 [ACK] Seq=13441 Ack=178389 Win=6157 Len=0 TSval=1642975 TSecr=24457502
  338 7.552271026  10.6.15.145 → 192.168.1.16 SSH 1514 Server: Encrypted packet (len=1448)
  339 7.552449426  10.6.15.145 → 192.168.1.16 SSH 1514 Server: Encrypted packet (len=1448)
  340 7.552452344 192.168.1.16 → 10.6.15.145  TCP 66 52104 → 22 [ACK] Seq=13441 Ack=181285 Win=6157 Len=0 TSval=1642975 TSecr=24457502
  341 7.552655358  10.6.15.145 → 192.168.1.16 SSH 1514 Server: Encrypted packet (len=1448)
  342 7.552845733  10.6.15.145 → 192.168.1.16 SSH 1514 Server: Encrypted packet (len=1448)
  343 7.552849894 192.168.1.16 → 10.6.15.145  TCP 66 52104 → 22 [ACK] Seq=13441 Ack=184181 Win=6157 Len=0 TSval=1642975 TSecr=24457502
  344 7.553030562  10.6.15.145 → 192.168.1.16 SSH 1514 Server: Encrypted packet (len=1448)
  345 7.553751174  10.6.15.145 → 192.168.1.16 SSH 1514 Server: Encrypted packet (len=1448)
  346 7.553761171 192.168.1.16 → 10.6.15.145  TCP 66 52104 → 22 [ACK] Seq=13441 Ack=187077 Win=6157 Len=0 TSval=1642976 TSecr=24457502
  347 7.553941728  10.6.15.145 → 192.168.1.16 SSH 1514 Server: Encrypted packet (len=1448)
  348 7.554134055  10.6.15.145 → 192.168.1.16 SSH 1514 Server: Encrypted packet (len=1448)
  349 7.554141485 192.168.1.16 → 10.6.15.145  TCP 66 52104 → 22 [ACK] Seq=13441 Ack=189973 Win=6157 Len=0 TSval=1642976 TSecr=24457503
  350 7.554749730  10.6.15.145 → 192.168.1.16 SSH 1514 Server: Encrypted packet (len=1448)
  351 7.554935572  10.6.15.145 → 192.168.1.16 SSH 1514 Server: Encrypted packet (len=1448)
  352 7.554940061 192.168.1.16 → 10.6.15.145  TCP 66 52104 → 22 [ACK] Seq=13441 Ack=192869 Win=6157 Len=0 TSval=1642976 TSecr=24457503
  353 7.555131842  10.6.15.145 → 192.168.1.16 SSH 1514 Server: Encrypted packet (len=1448)
  354 7.555734642  10.6.15.145 → 192.168.1.16 SSH 1514 Server: Encrypted packet (len=1448)
  355 7.555739382 192.168.1.16 → 10.6.15.145  TCP 66 52104 → 22 [ACK] Seq=13441 Ack=195765 Win=6157 Len=0 TSval=1642976 TSecr=24457503
  356 7.555923813  10.6.15.145 → 192.168.1.16 SSH 1514 Server: Encrypted packet (len=1448)
  357 7.556090805  10.6.15.145 → 192.168.1.16 SSH 1514 Server: Encrypted packet (len=1448)
  358 7.556094917 192.168.1.16 → 10.6.15.145  TCP 66 52104 → 22 [ACK] Seq=13441 Ack=198661 Win=6157 Len=0 TSval=1642976 TSecr=24457503
  359 7.556675720  10.6.15.145 → 192.168.1.16 SSH 1514 Server: Encrypted packet (len=1448)
  360 7.556867353  10.6.15.145 → 192.168.1.16 SSH 1514 Server: Encrypted packet (len=1448)
  361 7.556874383 192.168.1.16 → 10.6.15.145  TCP 66 52104 → 22 [ACK] Seq=13441 Ack=201557 Win=6157 Len=0 TSval=1642976 TSecr=24457503
  362 7.557057980  10.6.15.145 → 192.168.1.16 SSH 1514 Server: Encrypted packet (len=1448)
  363 7.557250054  10.6.15.145 → 192.168.1.16 SSH 1514 Server: Encrypted packet (len=1448)
  364 7.557258557 192.168.1.16 → 10.6.15.145  TCP 66 52104 → 22 [ACK] Seq=13441 Ack=204453 Win=6157 Len=0 TSval=1642976 TSecr=24457503
  365 7.557441843  10.6.15.145 → 192.168.1.16 SSH 1514 Server: Encrypted packet (len=1448)
  366 7.558067834  10.6.15.145 → 192.168.1.16 SSH 1514 Server: Encrypted packet (len=1448)
  367 7.558077116 192.168.1.16 → 10.6.15.145  TCP 66 52104 → 22 [ACK] Seq=13441 Ack=207349 Win=6157 Len=0 TSval=1642977 TSecr=24457503
  368 7.558259595  10.6.15.145 → 192.168.1.16 SSH 1514 Server: Encrypted packet (len=1448)
  369 7.558449138  10.6.15.145 → 192.168.1.16 SSH 1514 Server: Encrypted packet (len=1448)
