    1 0.000000000  10.6.15.145 → 192.168.1.16 SSH 986 Server: Encrypted packet (len=920)
    2 0.000027383  10.6.15.145 → 192.168.1.16 SSH 138 Server: Encrypted packet (len=72)
    3 0.000034892  10.6.15.145 → 192.168.1.16 SSH 138 Server: Encrypted packet (len=72)
    4 0.048096284 192.168.1.16 → 10.6.15.145  SSH 102 Client: Encrypted packet (len=36)
    5 0.048113225 192.168.1.16 → 10.6.15.145  TCP 78 [TCP Dup ACK 4#1] 52104 → 22 [ACK] Seq=73 Ack=4294966589 Win=6157 Len=0 TSval=1648551 TSecr=24462927 SLE=1 SRE=921
    6 0.048114903 192.168.1.16 → 10.6.15.145  TCP 78 [TCP Dup ACK 4#2] 52104 → 22 [ACK] Seq=73 Ack=4294966589 Win=6157 Len=0 TSval=1648551 TSecr=24462927 SLE=1 SRE=993
    7 0.048116418 192.168.1.16 → 10.6.15.145  TCP 78 [TCP Dup ACK 4#3] 52104 → 22 [ACK] Seq=73 Ack=4294966589 Win=6157 Len=0 TSval=1648551 TSecr=24462927 SLE=1 SRE=1065
    8 0.563975509  10.6.15.145 → 192.168.1.16 TCP 774 [TCP Retransmission] 22 → 52104 [PSH, ACK] Seq=4294966589 Ack=73 Win=1452 Len=708 TSval=24463192 TSecr=1648524
    9 0.564006538  10.6.15.145 → 192.168.1.16 SSH 562 Server: [TCP Previous segment not captured] , Encrypted packet (len=496)
   10 0.612094955 192.168.1.16 → 10.6.15.145  SSH 114 Client: [TCP Spurious Retransmission] , Encrypted packet (len=36)
   11 0.612110536 192.168.1.16 → 10.6.15.145  TCP 66 52104 → 22 [ACK] Seq=73 Ack=1065 Win=6157 Len=0 TSval=1648692 TSecr=24463192
   12 0.612112466 192.168.1.16 → 10.6.15.145  TCP 78 [TCP Dup ACK 11#1] 52104 → 22 [ACK] Seq=73 Ack=1065 Win=6157 Len=0 TSval=1648692 TSecr=24463192 SLE=1425 SRE=1921
   13 0.612114148 192.168.1.16 → 10.6.15.145  SSH 258 Client: Encrypted packet (len=180)
   14 1.017882036  10.6.15.145 → 192.168.1.16 TCP 78 [TCP Dup ACK 8#1] 22 → 52104 [ACK] Seq=1921 Ack=73 Win=1452 Len=0 TSval=24463332 TSecr=1648680 SLE=37 SRE=73
   15 1.017939615  10.6.15.145 → 192.168.1.16 TCP 426 [TCP Retransmission] 22 → 52104 [PSH, ACK] Seq=1065 Ack=73 Win=1452 Len=360 TSval=24463332 TSecr=1648692
   16 1.018310059  10.6.15.145 → 192.168.1.16 TCP 66 22 → 52104 [ACK] Seq=1921 Ack=253 Win=1452 Len=0 TSval=24463332 TSecr=1648692
   17 1.176819785 192.168.1.16 → 10.6.15.145  SSH 1514 Client: Encrypted packet (len=1436)
   18 1.176840505 192.168.1.16 → 10.6.15.145  SSH 818 Client: Encrypted packet (len=740)
   19 1.176844926 192.168.1.16 → 10.6.15.145  TCP 66 52104 → 22 [ACK] Seq=2429 Ack=1921 Win=6157 Len=0 TSval=1648805 TSecr=24463332
   20 1.177266245 192.168.1.16 → 10.6.15.145  SSH 454 Client: Encrypted packet (len=388)
   21 1.178637693  10.6.15.145 → 192.168.1.16 TCP 66 22 → 52104 [ACK] Seq=1921 Ack=1689 Win=1452 Len=0 TSval=24463373 TSecr=1648805
   22 1.179510105  10.6.15.145 → 192.168.1.16 TCP 66 22 → 52104 [ACK] Seq=1921 Ack=2429 Win=1452 Len=0 TSval=24463373 TSecr=1648805
   23 1.179528188  10.6.15.145 → 192.168.1.16 TCP 66 22 → 52104 [ACK] Seq=1921 Ack=2817 Win=1452 Len=0 TSval=24463373 TSecr=1648845
   24 2.603326156  10.6.15.145 → 192.168.1.16 SSH 182 Server: Encrypted packet (len=116)
   25 2.603341504 192.168.1.16 → 10.6.15.145  TCP 66 52104 → 22 [ACK] Seq=2817 Ack=2037 Win=6157 Len=0 TSval=1649201 TSecr=24463409
   26 2.603355492  10.6.15.145 → 192.168.1.16 SSH 182 Server: Encrypted packet (len=116)
   27 2.603360076 192.168.1.16 → 10.6.15.145  TCP 66 52104 → 22 [ACK] Seq=2817 Ack=2153 Win=6157 Len=0 TSval=1649201 TSecr=24463410
   28 2.603380310  10.6.15.145 → 192.168.1.16 SSH 182 Server: Encrypted packet (len=116)
   29 2.603382589 192.168.1.16 → 10.6.15.145  TCP 66 52104 → 22 [ACK] Seq=2817 Ack=2269 Win=6157 Len=0 TSval=1649201 TSecr=24463412
   30 2.603406421  10.6.15.145 → 192.168.1.16 SSH 182 Server: Encrypted packet (len=116)
   31 2.603407849 192.168.1.16 → 10.6.15.145  TCP 66 52104 → 22 [ACK] Seq=2817 Ack=2385 Win=6157 Len=0 TSval=1649201 TSecr=24463412
   32 2.603590210  10.6.15.145 → 192.168.1.16 SSH 230 Server: Encrypted packet (len=164)
   33 2.603593275 192.168.1.16 → 10.6.15.145  TCP 66 52104 → 22 [ACK] Seq=2817 Ack=2549 Win=6157 Len=0 TSval=1649201 TSecr=24463413
   34 2.603621683  10.6.15.145 → 192.168.1.16 SSH 222 Server: Encrypted packet (len=156)
   35 2.603624418 192.168.1.16 → 10.6.15.145  TCP 66 52104 → 22 [ACK] Seq=2817 Ack=2705 Win=6157 Len=0 TSval=1649201 TSecr=24463418
   36 2.603653366  10.6.15.145 → 192.168.1.16 SSH 214 Server: Encrypted packet (len=148)
   37 2.603657526 192.168.1.16 → 10.6.15.145  SSH 134 Client: Encrypted packet (len=68)
   38 2.603882208  10.6.15.145 → 192.168.1.16 SSH 1514 Server: Encrypted packet (len=1448)
   39 2.603885318 192.168.1.16 → 10.6.15.145  TCP 66 52104 → 22 [ACK] Seq=2885 Ack=4301 Win=6157 Len=0 TSval=1649201 TSecr=24463418
   40 2.604076384  10.6.15.145 → 192.168.1.16 SSH 1514 Server: Encrypted packet (len=1448)
   41 2.604623438 192.168.1.16 → 10.6.15.145  SSH 1514 Client: Encrypted packet (len=1448)
   42 2.607321644 192.168.1.16 → 10.6.15.145  SSH 1514 Client: Encrypted packet (len=1448)
   43 2.607328615 192.168.1.16 → 10.6.15.145  SSH 146 Client: Encrypted packet (len=80)
   44 2.608384358  10.6.15.145 → 192.168.1.16 SSH 1514 Server: Encrypted packet (len=1448)
   45 2.608652786  10.6.15.145 → 192.168.1.16 SSH 1514 Server: Encrypted packet (len=1448)
   46 2.608661507 192.168.1.16 → 10.6.15.145  TCP 66 52104 → 22 [ACK] Seq=5861 Ack=8645 Win=6157 Len=0 TSval=1649203 TSecr=24463730
   47 2.608973848  10.6.15.145 → 192.168.1.16 SSH 1514 Server: Encrypted packet (len=1448)
   48 2.609018419  10.6.15.145 → 192.168.1.16 SSH 650 Server: Encrypted packet (len=584)
   49 2.609022596 192.168.1.16 → 10.6.15.145  TCP 66 52104 → 22 [ACK] Seq=5861 Ack=10677 Win=6157 Len=0 TSval=1649203 TSecr=24463730
   50 2.609179012  10.6.15.145 → 192.168.1.16 TCP 66 22 → 52104 [ACK] Seq=10677 Ack=2885 Win=1452 Len=0 TSval=24463730 TSecr=1649201
   51 2.609185287  10.6.15.145 → 192.168.1.16 TCP 66 22 → 52104 [ACK] Seq=10677 Ack=5861 Win=1452 Len=0 TSval=24463730 TSecr=1649202
   52 2.609396055 192.168.1.16 → 10.6.15.145  SSH 214 Client: Encrypted packet (len=148)
   53 2.611715349 192.168.1.16 → 10.6.15.145  SSH 414 Client: Encrypted packet (len=348)
   54 2.613677806 192.168.1.16 → 10.6.15.145  SSH 414 Client: Encrypted packet (len=348)
   55 2.613808870  10.6.15.145 → 192.168.1.16 TCP 66 22 → 52104 [ACK] Seq=10677 Ack=6009 Win=1452 Len=0 TSval=24463731 TSecr=1649203
   56 2.614818779  10.6.15.145 → 192.168.1.16 TCP 66 22 → 52104 [ACK] Seq=10677 Ack=6357 Win=1452 Len=0 TSval=24463732 TSecr=1649203
   57 2.615239383  10.6.15.145 → 192.168.1.16 TCP 66 22 → 52104 [ACK] Seq=10677 Ack=6705 Win=1452 Len=0 TSval=24463732 TSecr=1649204
   58 3.622028874  10.6.15.145 → 192.168.1.16 SSH 662 Server: Encrypted packet (len=596)
   59 3.622049635  10.6.15.145 → 192.168.1.16 SSH 382 Server: Encrypted packet (len=316)
   60 3.622086782  10.6.15.145 → 192.168.1.16 SSH 366 Server: Encrypted packet (len=300)
   61 3.622121176 192.168.1.16 → 10.6.15.145  TCP 66 52104 → 22 [ACK] Seq=6705 Ack=11889 Win=6157 Len=0 TSval=1649456 TSecr=24463770
   62 3.625335354  10.6.15.145 → 192.168.1.16 SSH 366 Server: Encrypted packet (len=300)
   63 3.625374899  10.6.15.145 → 192.168.1.16 SSH 350 Server: Encrypted packet (len=284)
   64 3.625406499 192.168.1.16 → 10.6.15.145  TCP 66 52104 → 22 [ACK] Seq=6705 Ack=12473 Win=6157 Len=0 TSval=1649457 TSecr=24463777
   65 3.625430639  10.6.15.145 → 192.168.1.16 SSH 366 Server: Encrypted packet (len=300)
   66 3.625649919  10.6.15.145 → 192.168.1.16 SSH 1514 Server: Encrypted packet (len=1448)
   67 3.625655339 192.168.1.16 → 10.6.15.145  TCP 66 52104 → 22 [ACK] Seq=6705 Ack=14221 Win=6157 Len=0 TSval=1649457 TSecr=24463778
   68 3.625840091  10.6.15.145 → 192.168.1.16 SSH 1514 Server: Encrypted packet (len=1448)
   69 3.625852730  10.6.15.145 → 192.168.1.16 SSH 310 Server: Encrypted packet (len=244)
   70 3.625855226 192.168.1.16 → 10.6.15.145  TCP 66 52104 → 22 [ACK] Seq=6705 Ack=15913 Win=6157 Len=0 TSval=1649457 TSecr=24463810
   71 3.626075934  10.6.15.145 → 192.168.1.16 SSH 1514 Server: Encrypted packet (len=1448)
   72 3.626261155  10.6.15.145 → 192.168.1.16 SSH 1470 Server: Encrypted packet (len=1404)
   73 3.626266341 192.168.1.16 → 10.6.15.145  TCP 66 52104 → 22 [ACK] Seq=6705 Ack=18765 Win=6157 Len=0 TSval=1649457 TSecr=24463811
   74 3.654610365  10.6.15.145 → 192.168.1.16 SSH 1514 Server: Encrypted packet (len=1448)
   75 3.654788752  10.6.15.145 → 192.168.1.16 SSH 1514 Server: Encrypted packet (len=1448)
   76 3.654797726 192.168.1.16 → 10.6.15.145  TCP 66 52104 → 22 [ACK] Seq=6705 Ack=21661 Win=6157 Len=0 TSval=1649464 TSecr=24463991
   77 3.655131432  10.6.15.145 → 192.168.1.16 SSH 1514 Server: Encrypted packet (len=1448)
   78 3.655322664  10.6.15.145 → 192.168.1.16 SSH 1514 Server: Encrypted packet (len=1448)
   79 3.655326484 192.168.1.16 → 10.6.15.145  TCP 66 52104 → 22 [ACK] Seq=6705 Ack=24557 Win=6157 Len=0 TSval=1649464 TSecr=24463991
   80 3.655516767  10.6.15.145 → 192.168.1.16 SSH 1514 Server: Encrypted packet (len=1448)
   81 3.655710234  10.6.15.145 → 192.168.1.16 SSH 1514 Server: Encrypted packet (len=1448)
   82 3.655716110 192.168.1.16 → 10.6.15.145  TCP 66 52104 → 22 [ACK] Seq=6705 Ack=27453 Win=6157 Len=0 TSval=1649464 TSecr=24463991
   83 3.655900305  10.6.15.145 → 192.168.1.16 SSH 1514 Server: Encrypted packet (len=1448)
   84 3.656092565  10.6.15.145 → 192.168.1.16 SSH 1514 Server: Encrypted packet (len=1448)
   85 3.656096270 192.168.1.16 → 10.6.15.145  TCP 66 52104 → 22 [ACK] Seq=6705 Ack=30349 Win=6157 Len=0 TSval=1649465 TSecr=24463991
   86 3.656436188  10.6.15.145 → 192.168.1.16 SSH 1514 Server: Encrypted packet (len=1448)
   87 3.656631422  10.6.15.145 → 192.168.1.16 SSH 1514 Server: Encrypted packet (len=1448)
   88 3.656638351 192.168.1.16 → 10.6.15.145  TCP 66 52104 → 22 [ACK] Seq=6705 Ack=33245 Win=6157 Len=0 TSval=1649465 TSecr=24463991
   89 3.659532941  10.6.15.145 → 192.168.1.16 SSH 1514 Server: Encrypted packet (len=1448)
   90 3.659718748  10.6.15.145 → 192.168.1.16 SSH 1514 Server: Encrypted packet (len=1448)
   91 3.659725377 192.168.1.16 → 10.6.15.145  TCP 66 52104 → 22 [ACK] Seq=6705 Ack=36141 Win=6157 Len=0 TSval=1649465 TSecr=24463993
   92 3.660062975  10.6.15.145 → 192.168.1.16 SSH 1406 Server: Encrypted packet (len=1340)
   93 3.703955425 192.168.1.16 → 10.6.15.145  TCP 66 52104 → 22 [ACK] Seq=6705 Ack=37481 Win=6157 Len=0 TSval=1649477 TSecr=24463993
   94 3.753858699 192.168.1.16 → 10.6.15.145  SSH 526 Client: Encrypted packet (len=460)
   95 3.755444988  10.6.15.145 → 192.168.1.16 TCP 66 22 → 52104 [ACK] Seq=37481 Ack=7165 Win=1452 Len=0 TSval=24464017 TSecr=1649489
   96 3.887269938 192.168.1.16 → 10.6.15.145  SSH 110 Client: Encrypted packet (len=44)
   97 3.889239444  10.6.15.145 → 192.168.1.16 TCP 66 22 → 52104 [ACK] Seq=37481 Ack=7209 Win=1452 Len=0 TSval=24464050 TSecr=1649522
   98 3.939132864  10.6.15.145 → 192.168.1.16 SSH 1510 Server: Encrypted packet (len=1444)
   99 3.939196321 192.168.1.16 → 10.6.15.145  TCP 66 52104 → 22 [ACK] Seq=7209 Ack=38925 Win=6157 Len=0 TSval=1649535 TSecr=24464063
  100 3.939299095  10.6.15.145 → 192.168.1.16 SSH 1514 Server: Encrypted packet (len=1448)
  101 3.939650797  10.6.15.145 → 192.168.1.16 SSH 1454 Server: Encrypted packet (len=1388)
  102 3.939655498 192.168.1.16 → 10.6.15.145  TCP 66 52104 → 22 [ACK] Seq=7209 Ack=41761 Win=6157 Len=0 TSval=1649535 TSecr=24464063
  103 3.939829112  10.6.15.145 → 192.168.1.16 SSH 1510 Server: Encrypted packet (len=1444)
  104 3.939842295 192.168.1.16 → 10.6.15.145  TCP 66 52104 → 22 [ACK] Seq=7209 Ack=43205 Win=6157 Len=0 TSval=1649535 TSecr=24464063
  105 3.940035133  10.6.15.145 → 192.168.1.16 SSH 1510 Server: Encrypted packet (len=1444)
  106 3.940223214  10.6.15.145 → 192.168.1.16 SSH 1510 Server: Encrypted packet (len=1444)
  107 3.940228405 192.168.1.16 → 10.6.15.145  TCP 66 52104 → 22 [ACK] Seq=7209 Ack=46093 Win=6157 Len=0 TSval=1649536 TSecr=24464063
  108 3.940561960  10.6.15.145 → 192.168.1.16 SSH 1514 Server: Encrypted packet (len=1448)
  109 3.940745353  10.6.15.145 → 192.168.1.16 SSH 1454 Server: Encrypted packet (len=1388)
  110 3.940751751 192.168.1.16 → 10.6.15.145  TCP 66 52104 → 22 [ACK] Seq=7209 Ack=48929 Win=6157 Len=0 TSval=1649536 TSecr=24464063
  111 3.940938852  10.6.15.145 → 192.168.1.16 SSH 1510 Server: Encrypted packet (len=1444)
  112 3.940951417 192.168.1.16 → 10.6.15.145  TCP 66 52104 → 22 [ACK] Seq=7209 Ack=50373 Win=6157 Len=0 TSval=1649536 TSecr=24464063
  113 3.941129949  10.6.15.145 → 192.168.1.16 SSH 1510 Server: Encrypted packet (len=1444)
  114 3.983971629 192.168.1.16 → 10.6.15.145  TCP 66 52104 → 22 [ACK] Seq=7209 Ack=51817 Win=6157 Len=0 TSval=1649547 TSecr=24464063
  115 4.057693428  10.6.15.145 → 192.168.1.16 SSH 110 Server: Encrypted packet (len=44)
  116 4.057758003 192.168.1.16 → 10.6.15.145  TCP 66 52104 → 22 [ACK] Seq=7209 Ack=51861 Win=6157 Len=0 TSval=1649565 TSecr=24464092
  117 4.058290978 192.168.1.16 → 10.6.15.145  SSH 382 Client: Encrypted packet (len=316)
  118 4.059725973  10.6.15.145 → 192.168.1.16 TCP 66 22 → 52104 [ACK] Seq=51861 Ack=7525 Win=1452 Len=0 TSval=24464093 TSecr=1649565
  119 4.121687803  10.6.15.145 → 192.168.1.16 SSH 1510 Server: Encrypted packet (len=1444)
  120 4.121861376  10.6.15.145 → 192.168.1.16 SSH 1514 Server: Encrypted packet (len=1448)
  121 4.121867557 192.168.1.16 → 10.6.15.145  TCP 66 52104 → 22 [ACK] Seq=7525 Ack=54753 Win=6157 Len=0 TSval=1649581 TSecr=24464108
  122 4.122208374  10.6.15.145 → 192.168.1.16 SSH 1454 Server: Encrypted packet (len=1388)
  123 4.122395229  10.6.15.145 → 192.168.1.16 SSH 1514 Server: Encrypted packet (len=1448)
  124 4.122404321 192.168.1.16 → 10.6.15.145  TCP 66 52104 → 22 [ACK] Seq=7525 Ack=57589 Win=6157 Len=0 TSval=1649581 TSecr=24464108
  125 4.122443215  10.6.15.145 → 192.168.1.16 SSH 582 Server: Encrypted packet (len=516)
  126 4.167955155 192.168.1.16 → 10.6.15.145  TCP 66 52104 → 22 [ACK] Seq=7525 Ack=58105 Win=6157 Len=0 TSval=1649593 TSecr=24464108
  127 4.228499708  10.6.15.145 → 192.168.1.16 SSH 262 Server: Encrypted packet (len=196)
  128 4.228566604 192.168.1.16 → 10.6.15.145  TCP 66 52104 → 22 [ACK] Seq=7525 Ack=58301 Win=6157 Len=0 TSval=1649608 TSecr=24464135
  129 4.228774512 192.168.1.16 → 10.6.15.145  SSH 134 Client: Encrypted packet (len=68)
  130 4.229135161 192.168.1.16 → 10.6.15.145  SSH 1286 Client: Encrypted packet (len=1220)
  131 4.230256577  10.6.15.145 → 192.168.1.16 TCP 66 22 → 52104 [ACK] Seq=58301 Ack=7593 Win=1452 Len=0 TSval=24464135 TSecr=1649608
  132 4.230990463  10.6.15.145 → 192.168.1.16 TCP 66 22 → 52104 [ACK] Seq=58301 Ack=8813 Win=1452 Len=0 TSval=24464136 TSecr=1649608
  133 4.292678408 192.168.1.16 → 10.6.15.145  SSH 1514 Client: Encrypted packet (len=1448)
  134 4.293804241 192.168.1.16 → 10.6.15.145  SSH 206 Client: Encrypted packet (len=140)
  135 4.295193029  10.6.15.145 → 192.168.1.16 TCP 66 22 → 52104 [ACK] Seq=58301 Ack=10401 Win=1452 Len=0 TSval=24464152 TSecr=1649624
  136 4.295354035 192.168.1.16 → 10.6.15.145  SSH 126 Client: Encrypted packet (len=60)
  137 4.296570493  10.6.15.145 → 192.168.1.16 TCP 66 22 → 52104 [ACK] Seq=58301 Ack=10461 Win=1452 Len=0 TSval=24464152 TSecr=1649624
  138 4.306768377 192.168.1.16 → 10.6.15.145  SSH 1014 Client: Encrypted packet (len=948)
  139 4.308442405  10.6.15.145 → 192.168.1.16 TCP 66 22 → 52104 [ACK] Seq=58301 Ack=11409 Win=1452 Len=0 TSval=24464155 TSecr=1649627
  140 4.340165231 192.168.1.16 → 10.6.15.145  SSH 1486 Client: Encrypted packet (len=1420)
  141 4.342042881  10.6.15.145 → 192.168.1.16 TCP 66 22 → 52104 [ACK] Seq=58301 Ack=12829 Win=1452 Len=0 TSval=24464163 TSecr=1649636
  142 4.403204508  10.6.15.145 → 192.168.1.16 SSH 582 Server: Encrypted packet (len=516)
  143 4.443950578 192.168.1.16 → 10.6.15.145  TCP 66 52104 → 22 [ACK] Seq=12829 Ack=58817 Win=6157 Len=0 TSval=1649662 TSecr=24464179
  144 4.489795724  10.6.15.145 → 192.168.1.16 SSH 350 Server: Encrypted packet (len=284)
  145 4.489851219 192.168.1.16 → 10.6.15.145  TCP 66 52104 → 22 [ACK] Seq=12829 Ack=59101 Win=6157 Len=0 TSval=1649673 TSecr=24464200
  146 4.504563978  10.6.15.145 → 192.168.1.16 SSH 478 Server: Encrypted packet (len=412)
  147 4.504618325 192.168.1.16 → 10.6.15.145  TCP 66 52104 → 22 [ACK] Seq=12829 Ack=59513 Win=6157 Len=0 TSval=1649677 TSecr=24464204
  148 4.532472130 192.168.1.16 → 139.59.21.22 NTP 90 NTP Version 4, client
  149 4.569252230  10.6.15.145 → 192.168.1.16 SSH 110 Server: Encrypted packet (len=44)
  150 4.569318141 192.168.1.16 → 10.6.15.145  TCP 66 52104 → 22 [ACK] Seq=12829 Ack=59557 Win=6157 Len=0 TSval=1649693 TSecr=24464220
  151 4.569644342 192.168.1.16 → 10.6.15.145  SSH 406 Client: Encrypted packet (len=340)
  152 4.570997287  10.6.15.145 → 192.168.1.16 TCP 66 22 → 52104 [ACK] Seq=59557 Ack=13169 Win=1452 Len=0 TSval=24464221 TSecr=1649693
  153 5.606030827  10.6.15.145 → 192.168.1.16 SSH 1302 Server: Encrypted packet (len=1236)
  154 5.606094921  10.6.15.145 → 192.168.1.16 SSH 862 Server: Encrypted packet (len=796)
  155 5.606105263 192.168.1.16 → 10.6.15.145  TCP 66 52104 → 22 [ACK] Seq=13169 Ack=61589 Win=6157 Len=0 TSval=1649952 TSecr=24464288
  156 5.606203332  10.6.15.145 → 192.168.1.16 SSH 862 Server: [TCP Spurious Retransmission] , Encrypted packet (len=796)
  157 5.606206241 192.168.1.16 → 10.6.15.145  TCP 78 [TCP Dup ACK 155#1] 52104 → 22 [ACK] Seq=13169 Ack=61589 Win=6157 Len=0 TSval=1649952 TSecr=24464312 SLE=60793 SRE=61589
  158 5.606454316  10.6.15.145 → 192.168.1.16 SSH 798 Server: Encrypted packet (len=732)
  159 5.606459093 192.168.1.16 → 10.6.15.145  TCP 66 52104 → 22 [ACK] Seq=13169 Ack=62321 Win=6157 Len=0 TSval=1649952 TSecr=24464346
  160 5.606837631 192.168.1.16 → 10.6.15.145  SSH 446 Client: Encrypted packet (len=380)
  161 5.608234480  10.6.15.145 → 192.168.1.16 TCP 66 22 → 52104 [ACK] Seq=62321 Ack=13549 Win=1452 Len=0 TSval=24464480 TSecr=1649952
  162 6.367551558 192.168.1.16 → 10.6.15.145  SSH 838 Client: Encrypted packet (len=772)
  163 6.370830276  10.6.15.145 → 192.168.1.16 SSH 390 Server: Encrypted packet (len=324)
  164 6.370874441  10.6.15.145 → 192.168.1.16 TCP 390 [TCP Retransmission] 22 → 52104 [PSH, ACK] Seq=62321 Ack=13549 Win=1452 Len=324 TSval=24464654 TSecr=1649952
  165 6.370885464 192.168.1.16 → 10.6.15.145  TCP 78 52104 → 22 [ACK] Seq=14321 Ack=62645 Win=6157 Len=0 TSval=1650143 TSecr=24464654 SLE=62321 SRE=62645
  166 6.371363107 192.168.1.16 → 10.6.15.145  SSH 614 Client: Encrypted packet (len=548)
  167 6.371765454  10.6.15.145 → 192.168.1.16 TCP 66 22 → 52104 [ACK] Seq=62645 Ack=14321 Win=1452 Len=0 TSval=24464671 TSecr=1650142
  168 6.372959229  10.6.15.145 → 192.168.1.16 TCP 66 22 → 52104 [ACK] Seq=62645 Ack=14869 Win=1452 Len=0 TSval=24464671 TSecr=1650143
  169 7.621992164  10.6.15.145 → 192.168.1.16 SSH 598 Server: Encrypted packet (len=532)
  170 7.622128862  10.6.15.145 → 192.168.1.16 SSH 502 Server: Encrypted packet (len=436)
  171 7.622149727 192.168.1.16 → 10.6.15.145  TCP 66 52104 → 22 [ACK] Seq=14869 Ack=63613 Win=6157 Len=0 TSval=1650456 TSecr=24464716
  172 8.152610318 192.168.1.16 → 10.6.15.145  SSH 1514 Client: Encrypted packet (len=1448)
  173 8.154498021 192.168.1.16 → 10.6.15.145  SSH 214 Client: Encrypted packet (len=148)
  174 8.155992477  10.6.15.145 → 192.168.1.16 TCP 66 22 → 52104 [ACK] Seq=63613 Ack=16465 Win=1452 Len=0 TSval=24465117 TSecr=1650589
  175 8.532547688 192.168.1.16 → 139.59.21.22 NTP 90 NTP Version 4, client
  176 8.535245236  10.6.15.145 → 192.168.1.16 SSH 382 Server: Encrypted packet (len=316)
  177 8.548004364 192.168.1.16 → 216.58.197.35 TCP 66 54042 → 443 [ACK] Seq=1 Ack=1 Win=245 Len=0 TSval=1650688 TSecr=3355335402
  178 8.550271216 216.58.197.35 → 192.168.1.16 TCP 66 [TCP ACKed unseen segment] 443 → 54042 [ACK] Seq=1 Ack=2 Win=175 Len=0 TSval=3355380457 TSecr=1594275
  179 8.576007539 192.168.1.16 → 10.6.15.145  TCP 66 52104 → 22 [ACK] Seq=16465 Ack=63929 Win=6157 Len=0 TSval=1650695 TSecr=24465157
  180 9.152535019 192.168.1.16 → 10.6.15.145  SSH 118 Client: Encrypted packet (len=52)
  181 9.156814046  10.6.15.145 → 192.168.1.16 TCP 66 22 → 52104 [ACK] Seq=63929 Ack=16517 Win=1452 Len=0 TSval=24465367 TSecr=1650839
  182 10.597836522  10.6.15.145 → 192.168.1.16 SSH 102 Server: Encrypted packet (len=36)
  183 10.597869476 192.168.1.16 → 10.6.15.145  TCP 66 52104 → 22 [ACK] Seq=16517 Ack=63965 Win=6157 Len=0 TSval=1651200 TSecr=24465409
  184 10.597885643  10.6.15.145 → 192.168.1.16 SSH 102 Server: [TCP Spurious Retransmission] , Encrypted packet (len=36)
  185 10.597890347 192.168.1.16 → 10.6.15.145  TCP 78 [TCP Dup ACK 183#1] 52104 → 22 [ACK] Seq=16517 Ack=63965 Win=6157 Len=0 TSval=1651200 TSecr=24465565 SLE=63929 SRE=63965
  186 10.598191908 192.168.1.16 → 10.6.15.145  SSH 398 Client: Encrypted packet (len=332)
  187 10.602281989  10.6.15.145 → 192.168.1.16 TCP 66 22 → 52104 [ACK] Seq=63965 Ack=16849 Win=1452 Len=0 TSval=24465728 TSecr=1651200
  188 11.625885643  10.6.15.145 → 192.168.1.16 SSH 214 Server: Encrypted packet (len=148)
  189 11.625902105  10.6.15.145 → 192.168.1.16 TCP 214 [TCP Retransmission] 22 → 52104 [PSH, ACK] Seq=63965 Ack=16849 Win=1452 Len=148 TSval=24465975 TSecr=1651200
  190 11.625909572 192.168.1.16 → 10.6.15.145  TCP 78 52104 → 22 [ACK] Seq=16849 Ack=64113 Win=6157 Len=0 TSval=1651457 TSecr=24465975 SLE=63965 SRE=64113
  191 11.626173600 192.168.1.16 → 10.6.15.145  SSH 134 Client: Encrypted packet (len=68)
  192 11.626455063 192.168.1.16 → 10.6.15.145  SSH 470 Client: Encrypted packet (len=404)
  193 11.627650921  10.6.15.145 → 192.168.1.16 TCP 66 22 → 52104 [ACK] Seq=64113 Ack=16917 Win=1452 Len=0 TSval=24465985 TSecr=1651457
  194 11.627659337  10.6.15.145 → 192.168.1.16 TCP 66 22 → 52104 [ACK] Seq=64113 Ack=17321 Win=1452 Len=0 TSval=24465985 TSecr=1651457
  195 12.646055128  10.6.15.145 → 192.168.1.16 SSH 1514 Server: Encrypted packet (len=1448)
  196 12.646074302  10.6.15.145 → 192.168.1.16 SSH 398 Server: Encrypted packet (len=332)
  197 12.646082429 192.168.1.16 → 10.6.15.145  TCP 66 52104 → 22 [ACK] Seq=17321 Ack=65893 Win=6157 Len=0 TSval=1651712 TSecr=24466067
  198 14.296558056 192.168.1.16 → 10.6.15.145  SSH 102 Client: Encrypted packet (len=36)
  199 14.297318611 192.168.1.16 → 10.6.15.145  SSH 1514 Client: Encrypted packet (len=1448)
  200 14.297530281 192.168.1.16 → 10.6.15.145  SSH 454 Client: Encrypted packet (len=388)
  201 14.298633347  10.6.15.145 → 192.168.1.16 TCP 66 22 → 52104 [ACK] Seq=65893 Ack=17357 Win=1452 Len=0 TSval=24466653 TSecr=1652125
  202 14.299206524  10.6.15.145 → 192.168.1.16 TCP 66 22 → 52104 [ACK] Seq=65893 Ack=18805 Win=1452 Len=0 TSval=24466653 TSecr=1652125
  203 14.299590017  10.6.15.145 → 192.168.1.16 TCP 66 22 → 52104 [ACK] Seq=65893 Ack=19193 Win=1452 Len=0 TSval=24466653 TSecr=1652125
  204 14.863546530 192.168.1.16 → 10.6.15.145  SSH 126 Client: Encrypted packet (len=60)
  205 14.865530498  10.6.15.145 → 192.168.1.16 SSH 138 Server: Encrypted packet (len=72)
  206 14.865680911 192.168.1.16 → 10.6.15.145  SSH 102 Client: Encrypted packet (len=36)
  207 14.865961951  10.6.15.145 → 192.168.1.16 SSH 138 Server: Encrypted packet (len=72)
  208 14.866041118 192.168.1.16 → 10.6.15.145  SSH 102 Client: Encrypted packet (len=36)
  209 14.866485374  10.6.15.145 → 192.168.1.16 SSH 662 Server: Encrypted packet (len=596)
  210 14.866842931  10.6.15.145 → 192.168.1.16 SSH 138 Server: Encrypted packet (len=72)
  211 14.866879711 192.168.1.16 → 10.6.15.145  TCP 66 52104 → 22 [ACK] Seq=19325 Ack=66705 Win=6157 Len=0 TSval=1652267 TSecr=24466692
  212 14.866993000 192.168.1.16 → 10.6.15.145  SSH 102 Client: Encrypted packet (len=36)
  213 14.867400788  10.6.15.145 → 192.168.1.16 SSH 138 Server: Encrypted packet (len=72)
  214 14.867767837  10.6.15.145 → 192.168.1.16 SSH 138 Server: Encrypted packet (len=72)
  215 14.867799903 192.168.1.16 → 10.6.15.145  TCP 66 52104 → 22 [ACK] Seq=19361 Ack=66849 Win=6157 Len=0 TSval=1652267 TSecr=24466698
  216 14.868153325  10.6.15.145 → 192.168.1.16 SSH 138 Server: Encrypted packet (len=72)
  217 14.868528884  10.6.15.145 → 192.168.1.16 TCP 66 22 → 52104 [ACK] Seq=66921 Ack=19253 Win=1452 Len=0 TSval=24466794 TSecr=1652266
  218 14.868539867 192.168.1.16 → 10.6.15.145  SSH 174 Client: Encrypted packet (len=108)
  219 14.869110741  10.6.15.145 → 192.168.1.16 SSH 282 Server: Encrypted packet (len=216)
  220 14.869471442 192.168.1.16 → 10.6.15.145  SSH 174 Client: Encrypted packet (len=108)
  221 14.869498060  10.6.15.145 → 192.168.1.16 SSH 110 Server: Encrypted packet (len=44)
  222 14.869783979 192.168.1.16 → 10.6.15.145  SSH 430 Client: Encrypted packet (len=364)
  223 14.870155514  10.6.15.145 → 192.168.1.16 TCP 66 22 → 52104 [ACK] Seq=67181 Ack=19469 Win=1452 Len=0 TSval=24466795 TSecr=1652267
  224 14.871262126  10.6.15.145 → 192.168.1.16 TCP 66 22 → 52104 [ACK] Seq=67181 Ack=19941 Win=1452 Len=0 TSval=24466796 TSecr=1652268
  225 14.873296510  10.6.15.145 → 192.168.1.16 SSH 230 Server: Encrypted packet (len=164)
  226 14.873575554 192.168.1.16 → 10.6.15.145  SSH 134 Client: Encrypted packet (len=68)
  227 14.876500160 192.168.1.16 → 10.6.15.145  SSH 238 Client: Encrypted packet (len=172)
  228 14.876574990  10.6.15.145 → 192.168.1.16 SSH 166 Server: Encrypted packet (len=100)
  229 14.876768395 192.168.1.16 → 10.6.15.145  SSH 1514 Client: Encrypted packet (len=1448)
  230 14.876821833 192.168.1.16 → 10.6.15.145  SSH 550 Client: Encrypted packet (len=484)
  231 14.877298383 192.168.1.16 → 10.6.15.145  SSH 134 Client: Encrypted packet (len=68)
  232 14.878792021  10.6.15.145 → 192.168.1.16 TCP 66 22 → 52104 [ACK] Seq=67445 Ack=22181 Win=1452 Len=0 TSval=24466798 TSecr=1652270
  233 14.888282301  10.6.15.145 → 192.168.1.16 SSH 134 Server: Encrypted packet (len=68)
  234 14.931981391 192.168.1.16 → 10.6.15.145  TCP 66 52104 → 22 [ACK] Seq=22181 Ack=67513 Win=6157 Len=0 TSval=1652284 TSecr=24466800
  235 14.998329168  10.6.15.145 → 192.168.1.16 SSH 462 Server: Encrypted packet (len=396)
  236 14.998349382 192.168.1.16 → 10.6.15.145  TCP 66 52104 → 22 [ACK] Seq=22181 Ack=67909 Win=6157 Len=0 TSval=1652300 TSecr=24466827
  237 14.998397456  10.6.15.145 → 192.168.1.16 SSH 822 Server: Encrypted packet (len=756)
  238 14.998401132 192.168.1.16 → 10.6.15.145  TCP 66 52104 → 22 [ACK] Seq=22181 Ack=68665 Win=6157 Len=0 TSval=1652300 TSecr=24466827
  239 14.999635022  10.6.15.145 → 192.168.1.16 SSH 526 Server: Encrypted packet (len=460)
  240 14.999703932 192.168.1.16 → 10.6.15.145  TCP 66 52104 → 22 [ACK] Seq=22181 Ack=69125 Win=6157 Len=0 TSval=1652300 TSecr=24466828
  241 15.000162419 192.168.1.16 → 10.6.15.145  SSH 142 Client: Encrypted packet (len=76)
  242 15.042621106  10.6.15.145 → 192.168.1.16 TCP 66 22 → 52104 [ACK] Seq=69125 Ack=22257 Win=1452 Len=0 TSval=24466839 TSecr=1652301
  243 15.669262375 192.168.1.16 → 10.6.15.145  SSH 302 Client: Encrypted packet (len=236)
  244 15.670683272 192.168.1.16 → 10.6.15.145  SSH 134 Client: Encrypted packet (len=68)
  245 15.671992158  10.6.15.145 → 192.168.1.16 TCP 66 22 → 52104 [ACK] Seq=69125 Ack=22493 Win=1452 Len=0 TSval=24466996 TSecr=1652468
  246 15.672007385  10.6.15.145 → 192.168.1.16 TCP 66 22 → 52104 [ACK] Seq=69125 Ack=22561 Win=1452 Len=0 TSval=24466996 TSecr=1652468
  247 15.675243212  10.6.15.145 → 192.168.1.16 SSH 142 Server: Encrypted packet (len=76)
  248 15.715955664 192.168.1.16 → 10.6.15.145  TCP 66 52104 → 22 [ACK] Seq=22561 Ack=69201 Win=6157 Len=0 TSval=1652480 TSecr=24466997
  249 15.735015091  10.6.15.145 → 192.168.1.16 SSH 174 Server: Encrypted packet (len=108)
  250 15.735036390 192.168.1.16 → 10.6.15.145  TCP 66 52104 → 22 [ACK] Seq=22561 Ack=69309 Win=6157 Len=0 TSval=1652484 TSecr=24467012
  251 15.735094014  10.6.15.145 → 192.168.1.16 SSH 582 Server: Encrypted packet (len=516)
  252 15.735099753 192.168.1.16 → 10.6.15.145  TCP 66 52104 → 22 [ACK] Seq=22561 Ack=69825 Win=6157 Len=0 TSval=1652484 TSecr=24467012
  253 15.735463685 192.168.1.16 → 10.6.15.145  SSH 134 Client: Encrypted packet (len=68)
  254 15.774326910  10.6.15.145 → 192.168.1.16 TCP 66 22 → 52104 [ACK] Seq=69825 Ack=22629 Win=1452 Len=0 TSval=24467022 TSecr=1652484
  255 18.788007727 192.168.1.16 → 216.58.197.35 TCP 66 54040 → 443 [ACK] Seq=1 Ack=1 Win=229 Len=0 TSval=1653248 TSecr=2850863602
  256 22.630124685 216.58.197.35 → 192.168.1.16 TLSv1.2 129 [TCP ACKed unseen segment] , Application Data
  257 22.630249095 192.168.1.16 → 216.58.197.35 TCP 66 [TCP Previous segment not captured] 54042 → 443 [FIN, ACK] Seq=2 Ack=64 Win=245 Len=0 TSval=1654208 TSecr=3355394252
  258 22.630951933 216.58.197.35 → 192.168.1.16 TCP 66 [TCP ACKed unseen segment] 443 → 54042 [FIN, ACK] Seq=64 Ack=2 Win=175 Len=0 TSval=3355394252 TSecr=1594275
  259 22.630970993 192.168.1.16 → 216.58.197.35 TCP 66 54042 → 443 [ACK] Seq=3 Ack=65 Win=245 Len=0 TSval=1654208 TSecr=3355394252
  260 22.679739038 216.58.197.35 → 192.168.1.16 TCP 66 [TCP Spurious Retransmission] 443 → 54042 [FIN, ACK] Seq=64 Ack=2 Win=175 Len=0 TSval=3355394533 TSecr=1594275
  261 22.679758053 192.168.1.16 → 216.58.197.35 TCP 78 [TCP Dup ACK 259#1] 54042 → 443 [ACK] Seq=3 Ack=65 Win=245 Len=0 TSval=1654220 TSecr=3355394533 SLE=64 SRE=65
  262 22.680623773 216.58.197.35 → 192.168.1.16 TCP 66 443 → 54042 [ACK] Seq=65 Ack=3 Win=175 Len=0 TSval=3355394587 TSecr=1654208
  263 27.621946954  10.6.15.145 → 192.168.1.16 SSH 126 Server: Encrypted packet (len=60)
  264 27.624409549  10.6.15.145 → 192.168.1.16 SSH 102 Server: Encrypted packet (len=36)
  265 27.624477248 192.168.1.16 → 10.6.15.145  TCP 66 52104 → 22 [ACK] Seq=22629 Ack=69921 Win=6157 Len=0 TSval=1655457 TSecr=24469778
  266 27.624785485  10.6.15.145 → 192.168.1.16 SSH 102 Server: [TCP Spurious Retransmission] , Encrypted packet (len=36)
  267 27.624804242 192.168.1.16 → 10.6.15.145  TCP 78 [TCP Dup ACK 265#1] 52104 → 22 [ACK] Seq=22629 Ack=69921 Win=6157 Len=0 TSval=1655457 TSecr=24469830 SLE=69885 SRE=69921
