    1 0.000000000 192.168.1.16 → 10.6.15.145  SSH 526 Client: Encrypted packet (len=460)
    2 0.002470546  10.6.15.145 → 192.168.1.16 TCP 66 22 → 52104 [ACK] Seq=1 Ack=461 Win=1452 Len=0 TSval=24470746 TSecr=1656218
    3 0.002903555 192.168.1.16 → 10.6.15.145  SSH 1286 Client: Encrypted packet (len=1220)
    4 0.004656033  10.6.15.145 → 192.168.1.16 TCP 66 22 → 52104 [ACK] Seq=1 Ack=1681 Win=1452 Len=0 TSval=24470746 TSecr=1656218
    5 0.410566877 192.168.1.16 → 10.6.15.145  SSH 1514 Client: Encrypted packet (len=1448)
    6 0.411884592 192.168.1.16 → 10.6.15.145  SSH 222 Client: Encrypted packet (len=156)
    7 0.413304975  10.6.15.145 → 192.168.1.16 SSH 582 Server: Encrypted packet (len=516)
    8 0.413329798 192.168.1.16 → 10.6.15.145  TCP 66 52104 → 22 [ACK] Seq=3285 Ack=517 Win=6157 Len=0 TSval=1656321 TSecr=24470789
    9 0.413521040  10.6.15.145 → 192.168.1.16 SSH 1514 Server: Encrypted packet (len=1448)
   10 0.413528736 192.168.1.16 → 10.6.15.145  TCP 66 52104 → 22 [ACK] Seq=3285 Ack=1965 Win=6157 Len=0 TSval=1656321 TSecr=24470791
   11 0.413694475  10.6.15.145 → 192.168.1.16 SSH 1454 Server: Encrypted packet (len=1388)
   12 0.413701854 192.168.1.16 → 10.6.15.145  TCP 66 52104 → 22 [ACK] Seq=3285 Ack=3353 Win=6157 Len=0 TSval=1656321 TSecr=24470791
   13 0.414278203  10.6.15.145 → 192.168.1.16 SSH 1514 Server: Encrypted packet (len=1448)
   14 0.414295470 192.168.1.16 → 10.6.15.145  TCP 66 52104 → 22 [ACK] Seq=3285 Ack=4801 Win=6157 Len=0 TSval=1656321 TSecr=24470791
   15 0.414464080  10.6.15.145 → 192.168.1.16 SSH 1514 Server: Encrypted packet (len=1448)
   16 0.414472627 192.168.1.16 → 10.6.15.145  TCP 66 52104 → 22 [ACK] Seq=3285 Ack=6249 Win=6157 Len=0 TSval=1656321 TSecr=24470791
   17 0.414639037  10.6.15.145 → 192.168.1.16 SSH 1406 Server: Encrypted packet (len=1340)
   18 0.414646577 192.168.1.16 → 10.6.15.145  TCP 66 52104 → 22 [ACK] Seq=3285 Ack=7589 Win=6157 Len=0 TSval=1656321 TSecr=24470791
   19 0.414833757  10.6.15.145 → 192.168.1.16 SSH 1510 Server: Encrypted packet (len=1444)
   20 0.414840068 192.168.1.16 → 10.6.15.145  TCP 66 52104 → 22 [ACK] Seq=3285 Ack=9033 Win=6157 Len=0 TSval=1656321 TSecr=24470791
   21 0.415027280  10.6.15.145 → 192.168.1.16 SSH 1514 Server: Encrypted packet (len=1448)
   22 0.415033966 192.168.1.16 → 10.6.15.145  TCP 66 52104 → 22 [ACK] Seq=3285 Ack=10481 Win=6157 Len=0 TSval=1656321 TSecr=24470792
   23 0.415217776  10.6.15.145 → 192.168.1.16 SSH 1514 Server: Encrypted packet (len=1448)
   24 0.415225300 192.168.1.16 → 10.6.15.145  TCP 66 52104 → 22 [ACK] Seq=3285 Ack=11929 Win=6157 Len=0 TSval=1656321 TSecr=24470798
   25 0.415236143  10.6.15.145 → 192.168.1.16 TCP 66 22 → 52104 [ACK] Seq=11929 Ack=3129 Win=1452 Len=0 TSval=24470848 TSecr=1656320
   26 0.415678932  10.6.15.145 → 192.168.1.16 TCP 66 22 → 52104 [ACK] Seq=11929 Ack=3285 Win=1452 Len=0 TSval=24470849 TSecr=1656321
   27 0.415909830  10.6.15.145 → 192.168.1.16 SSH 1514 Server: Encrypted packet (len=1448)
   28 0.415922311 192.168.1.16 → 10.6.15.145  TCP 66 52104 → 22 [ACK] Seq=3285 Ack=13377 Win=6157 Len=0 TSval=1656322 TSecr=24470849
   29 0.416101747  10.6.15.145 → 192.168.1.16 SSH 1514 Server: Encrypted packet (len=1448)
   30 0.416111442 192.168.1.16 → 10.6.15.145  TCP 66 52104 → 22 [ACK] Seq=3285 Ack=14825 Win=6157 Len=0 TSval=1656322 TSecr=24470849
   31 0.417299578  10.6.15.145 → 192.168.1.16 SSH 1514 Server: Encrypted packet (len=1448)
   32 0.417316627 192.168.1.16 → 10.6.15.145  TCP 66 52104 → 22 [ACK] Seq=3285 Ack=16273 Win=6157 Len=0 TSval=1656322 TSecr=24470849
   33 0.417481612  10.6.15.145 → 192.168.1.16 SSH 1514 Server: Encrypted packet (len=1448)
   34 0.417489789 192.168.1.16 → 10.6.15.145  TCP 66 52104 → 22 [ACK] Seq=3285 Ack=17721 Win=6157 Len=0 TSval=1656322 TSecr=24470849
   35 0.417663350  10.6.15.145 → 192.168.1.16 SSH 1514 Server: Encrypted packet (len=1448)
   36 0.417669995 192.168.1.16 → 10.6.15.145  TCP 66 52104 → 22 [ACK] Seq=3285 Ack=19169 Win=6157 Len=0 TSval=1656322 TSecr=24470849
   37 0.418345269  10.6.15.145 → 192.168.1.16 SSH 1514 Server: Encrypted packet (len=1448)
   38 0.418361547 192.168.1.16 → 10.6.15.145  TCP 66 52104 → 22 [ACK] Seq=3285 Ack=20617 Win=6157 Len=0 TSval=1656322 TSecr=24470849
   39 0.418380683  10.6.15.145 → 192.168.1.16 SSH 438 Server: Encrypted packet (len=372)
   40 0.418385091 192.168.1.16 → 10.6.15.145  TCP 66 52104 → 22 [ACK] Seq=3285 Ack=20989 Win=6157 Len=0 TSval=1656322 TSecr=24470849
   41 0.425471313 192.168.1.16 → 10.6.15.145  SSH 614 Client: Encrypted packet (len=548)
   42 0.436618413 192.168.1.16 → 10.6.15.145  SSH 1014 Client: Encrypted packet (len=948)
   43 0.438381754  10.6.15.145 → 192.168.1.16 TCP 66 22 → 52104 [ACK] Seq=20989 Ack=4781 Win=1452 Len=0 TSval=24470855 TSecr=1656324
   44 0.467061456 192.168.1.16 → 10.6.15.145  SSH 1486 Client: Encrypted packet (len=1420)
   45 0.513648519  10.6.15.145 → 192.168.1.16 TCP 66 22 → 52104 [ACK] Seq=20989 Ack=6201 Win=1452 Len=0 TSval=24470874 TSecr=1656334
   46 0.576893028  10.6.15.145 → 192.168.1.16 SSH 798 Server: Encrypted packet (len=732)
   47 0.612864618  10.6.15.145 → 192.168.1.16 SSH 598 Server: Encrypted packet (len=532)
   48 0.612885184 192.168.1.16 → 10.6.15.145  TCP 66 52104 → 22 [ACK] Seq=6201 Ack=22253 Win=6157 Len=0 TSval=1656371 TSecr=24470889
   49 0.628343604  10.6.15.145 → 192.168.1.16 SSH 350 Server: Encrypted packet (len=284)
   50 0.639412659  10.6.15.145 → 192.168.1.16 SSH 478 Server: Encrypted packet (len=412)
   51 0.639463188 192.168.1.16 → 10.6.15.145  TCP 66 52104 → 22 [ACK] Seq=6201 Ack=22949 Win=6157 Len=0 TSval=1656378 TSecr=24470902
   52 1.370329976 192.168.1.16 → 10.6.15.145  SSH 230 Client: Encrypted packet (len=164)
   53 1.371094619 192.168.1.16 → 10.6.15.145  SSH 1514 Client: Encrypted packet (len=1448)
   54 1.371294836 192.168.1.16 → 10.6.15.145  SSH 478 Client: Encrypted packet (len=412)
   55 1.372625485  10.6.15.145 → 192.168.1.16 TCP 66 22 → 52104 [ACK] Seq=22949 Ack=6365 Win=1452 Len=0 TSval=24471088 TSecr=1656560
   56 1.373607792  10.6.15.145 → 192.168.1.16 TCP 66 22 → 52104 [ACK] Seq=22949 Ack=8225 Win=1447 Len=0 TSval=24471089 TSecr=1656560
   57 1.395865456  10.6.15.145 → 192.168.1.16 SSH 142 Server: Encrypted packet (len=76)
   58 1.439389240 192.168.1.16 → 10.6.15.145  TCP 66 52104 → 22 [ACK] Seq=8225 Ack=23025 Win=6157 Len=0 TSval=1656578 TSecr=24471094
   59 1.524990224  10.6.15.145 → 192.168.1.16 SSH 182 Server: Encrypted packet (len=116)
   60 1.525010250 192.168.1.16 → 10.6.15.145  TCP 66 52104 → 22 [ACK] Seq=8225 Ack=23141 Win=6157 Len=0 TSval=1656599 TSecr=24471126
   61 1.525203775  10.6.15.145 → 192.168.1.16 SSH 934 Server: Encrypted packet (len=868)
   62 1.525209321 192.168.1.16 → 10.6.15.145  TCP 66 52104 → 22 [ACK] Seq=8225 Ack=24009 Win=6157 Len=0 TSval=1656599 TSecr=24471126
   63 1.525356756  10.6.15.145 → 192.168.1.16 SSH 334 Server: Encrypted packet (len=268)
   64 1.525362295 192.168.1.16 → 10.6.15.145  TCP 66 52104 → 22 [ACK] Seq=8225 Ack=24277 Win=6157 Len=0 TSval=1656599 TSecr=24471126
   65 1.525493866  10.6.15.145 → 192.168.1.16 SSH 134 Server: Encrypted packet (len=68)
   66 1.525499660 192.168.1.16 → 10.6.15.145  TCP 66 52104 → 22 [ACK] Seq=8225 Ack=24345 Win=6157 Len=0 TSval=1656599 TSecr=24471126
   67 1.525727186 192.168.1.16 → 10.6.15.145  SSH 134 Client: Encrypted packet (len=68)
   68 1.565709058  10.6.15.145 → 192.168.1.16 TCP 66 22 → 52104 [ACK] Seq=24345 Ack=8293 Win=1452 Len=0 TSval=24471137 TSecr=1656599
   69 2.490178363 192.168.1.16 → 10.6.15.145  SSH 838 Client: Encrypted packet (len=772)
   70 2.494803815  10.6.15.145 → 192.168.1.16 TCP 66 22 → 52104 [ACK] Seq=24345 Ack=9065 Win=1452 Len=0 TSval=24471369 TSecr=1656840
   71 3.929451190  10.6.15.145 → 192.168.1.16 SSH 502 Server: Encrypted packet (len=436)
   72 3.929568662  10.6.15.145 → 192.168.1.16 TCP 502 [TCP Retransmission] 22 → 52104 [PSH, ACK] Seq=24345 Ack=9065 Win=1452 Len=436 TSval=24471477 TSecr=1656840
   73 3.929576013 192.168.1.16 → 10.6.15.145  TCP 78 52104 → 22 [ACK] Seq=9065 Ack=24781 Win=6157 Len=0 TSval=1657200 TSecr=24471477 SLE=24345 SRE=24781
   74 3.929759389  10.6.15.145 → 192.168.1.16 SSH 502 Server: [TCP Spurious Retransmission] , Encrypted packet (len=436)
   75 3.929768538 192.168.1.16 → 10.6.15.145  TCP 78 [TCP Dup ACK 73#1] 52104 → 22 [ACK] Seq=9065 Ack=24781 Win=6157 Len=0 TSval=1657200 TSecr=24471567 SLE=24345 SRE=24781
   76 4.254764464 192.168.1.16 → 10.6.15.145  SSH 1514 Client: Encrypted packet (len=1448)
   77 4.256054485 192.168.1.16 → 10.6.15.145  SSH 182 Client: Encrypted packet (len=116)
   78 4.257586228  10.6.15.145 → 192.168.1.16 TCP 66 22 → 52104 [ACK] Seq=24781 Ack=10513 Win=1452 Len=0 TSval=24471809 TSecr=1657281
   79 4.257689623  10.6.15.145 → 192.168.1.16 TCP 66 22 → 52104 [ACK] Seq=24781 Ack=10629 Win=1452 Len=0 TSval=24471809 TSecr=1657282
   80 5.254678965 192.168.1.16 → 10.6.15.145  SSH 470 Client: Encrypted packet (len=404)
   81 5.258245183  10.6.15.145 → 192.168.1.16 SSH 382 Server: Encrypted packet (len=316)
   82 5.258268772 192.168.1.16 → 10.6.15.145  TCP 66 52104 → 22 [ACK] Seq=11033 Ack=25097 Win=6157 Len=0 TSval=1657532 TSecr=24471850
   83 5.258634623  10.6.15.145 → 192.168.1.16 SSH 382 Server: [TCP Spurious Retransmission] , Encrypted packet (len=316)
   84 5.258643592 192.168.1.16 → 10.6.15.145  TCP 78 [TCP Dup ACK 82#1] 52104 → 22 [ACK] Seq=11033 Ack=25097 Win=6157 Len=0 TSval=1657532 TSecr=24471958 SLE=24781 SRE=25097
   85 5.258995211  10.6.15.145 → 192.168.1.16 TCP 66 22 → 52104 [ACK] Seq=25097 Ack=11033 Win=1452 Len=0 TSval=24472059 TSecr=1657531
   86 6.937599274  10.6.15.145 → 192.168.1.16 SSH 1514 Server: Encrypted packet (len=1448)
   87 6.937624229 192.168.1.16 → 10.6.15.145  TCP 66 52104 → 22 [ACK] Seq=11033 Ack=26545 Win=6157 Len=0 TSval=1657952 TSecr=24472101
   88 6.938057253  10.6.15.145 → 192.168.1.16 SSH 398 Server: Encrypted packet (len=332)
   89 6.938074697 192.168.1.16 → 10.6.15.145  TCP 66 52104 → 22 [ACK] Seq=11033 Ack=26877 Win=6157 Len=0 TSval=1657952 TSecr=24472101
   90 6.938416221  10.6.15.145 → 192.168.1.16 SSH 398 Server: [TCP Spurious Retransmission] , Encrypted packet (len=332)
   91 6.938423854 192.168.1.16 → 10.6.15.145  TCP 78 [TCP Dup ACK 89#1] 52104 → 22 [ACK] Seq=11033 Ack=26877 Win=6157 Len=0 TSval=1657952 TSecr=24472223 SLE=26545 SRE=26877
   92 10.418086102 192.168.1.16 → 10.6.15.145  SSH 102 Client: Encrypted packet (len=36)
   93 10.418842948 192.168.1.16 → 10.6.15.145  SSH 1514 Client: Encrypted packet (len=1448)
   94 10.419023593 192.168.1.16 → 10.6.15.145  SSH 670 Client: Encrypted packet (len=604)
   95 10.420198846  10.6.15.145 → 192.168.1.16 TCP 66 22 → 52104 [ACK] Seq=26877 Ack=11069 Win=1452 Len=0 TSval=24473350 TSecr=1658822
   96 10.420677090  10.6.15.145 → 192.168.1.16 TCP 66 22 → 52104 [ACK] Seq=26877 Ack=12517 Win=1452 Len=0 TSval=24473350 TSecr=1658822
   97 10.421061675  10.6.15.145 → 192.168.1.16 TCP 66 22 → 52104 [ACK] Seq=26877 Ack=13121 Win=1452 Len=0 TSval=24473350 TSecr=1658822
   98 11.961363620  10.6.15.145 → 192.168.1.16 SSH 138 Server: Encrypted packet (len=72)
   99 11.961382642 192.168.1.16 → 10.6.15.145  TCP 66 52104 → 22 [ACK] Seq=13121 Ack=26949 Win=6157 Len=0 TSval=1659208 TSecr=24473387
  100 11.961576692 192.168.1.16 → 10.6.15.145  SSH 102 Client: Encrypted packet (len=36)
  101 11.962384686  10.6.15.145 → 192.168.1.16 SSH 138 Server: Encrypted packet (len=72)
  102 11.962585368 192.168.1.16 → 10.6.15.145  SSH 102 Client: Encrypted packet (len=36)
  103 11.962815067  10.6.15.145 → 192.168.1.16 SSH 662 Server: Encrypted packet (len=596)
  104 11.965472772  10.6.15.145 → 192.168.1.16 SSH 134 Server: Encrypted packet (len=68)
  105 11.965485289  10.6.15.145 → 192.168.1.16 SSH 138 Server: Encrypted packet (len=72)
  106 11.965491072  10.6.15.145 → 192.168.1.16 SSH 138 Server: Encrypted packet (len=72)
  107 11.965531575 192.168.1.16 → 10.6.15.145  TCP 66 52104 → 22 [ACK] Seq=13193 Ack=27829 Win=6157 Len=0 TSval=1659209 TSecr=24473390
  108 11.965541939  10.6.15.145 → 192.168.1.16 SSH 342 Server: Encrypted packet (len=276)
  109 11.965561815  10.6.15.145 → 192.168.1.16 SSH 138 Server: Encrypted packet (len=72)
  110 11.965578773  10.6.15.145 → 192.168.1.16 SSH 138 Server: Encrypted packet (len=72)
  111 11.965664852  10.6.15.145 → 192.168.1.16 SSH 558 Server: Encrypted packet (len=492)
  112 11.965668993  10.6.15.145 → 192.168.1.16 TCP 66 22 → 52104 [ACK] Seq=28741 Ack=13157 Win=1452 Len=0 TSval=24473736 TSecr=1659208
  113 11.965742190 192.168.1.16 → 10.6.15.145  TCP 66 52104 → 22 [ACK] Seq=13193 Ack=28741 Win=6157 Len=0 TSval=1659209 TSecr=24473392
  114 11.965749040 192.168.1.16 → 10.6.15.145  SSH 102 Client: Encrypted packet (len=36)
  115 11.966286483 192.168.1.16 → 10.6.15.145  SSH 426 Client: Encrypted packet (len=360)
  116 11.966552725 192.168.1.16 → 10.6.15.145  SSH 138 Client: Encrypted packet (len=72)
  117 11.970678012  10.6.15.145 → 192.168.1.16 TCP 66 22 → 52104 [ACK] Seq=28741 Ack=13193 Win=1452 Len=0 TSval=24473737 TSecr=1659208
  118 11.971419324  10.6.15.145 → 192.168.1.16 TCP 66 22 → 52104 [ACK] Seq=28741 Ack=13229 Win=1452 Len=0 TSval=24473737 TSecr=1659209
  119 11.971426358  10.6.15.145 → 192.168.1.16 TCP 66 22 → 52104 [ACK] Seq=28741 Ack=13589 Win=1452 Len=0 TSval=24473737 TSecr=1659209
  120 12.183447634 192.168.1.16 → 10.6.15.145  TCP 138 [TCP Retransmission] 52104 → 22 [PSH, ACK] Seq=13589 Ack=28741 Win=6157 Len=72 TSval=1659264 TSecr=24473737
  121 12.215340709  10.6.15.145 → 192.168.1.16 TCP 66 22 → 52104 [ACK] Seq=28741 Ack=13661 Win=1452 Len=0 TSval=24473799 TSecr=1659264
  122 19.865623004 192.168.1.16 → 192.168.1.1  DNS 81 Standard query 0x5b0b A 1.ubuntu.pool.ntp.org
  123 19.868754625  192.168.1.1 → 192.168.1.16 DNS 129 Standard query response 0x5b0b A 1.ubuntu.pool.ntp.org A 139.59.21.22 A 123.108.200.124 A 13.126.27.131
  124 19.869226032 192.168.1.16 → 139.59.21.22 NTP 90 NTP Version 4, client
  125 20.953418637  10.6.15.145 → 192.168.1.16 SSH 126 Server: Encrypted packet (len=60)
  126 20.953441806  10.6.15.145 → 192.168.1.16 SSH 102 Server: Encrypted packet (len=36)
  127 20.953502214 192.168.1.16 → 10.6.15.145  TCP 66 52104 → 22 [ACK] Seq=13661 Ack=28837 Win=6157 Len=0 TSval=1661456 TSecr=24475850
