    1 0.000000000  10.6.15.144 → 192.168.1.16 SSH 190 Server: Encrypted packet (len=124)
    2 0.003654355 192.168.1.16 → 10.6.15.144  SSH 110 Client: Encrypted packet (len=44)
    3 0.013733682  10.6.15.144 → 192.168.1.16 TCP 66 22 → 59298 [ACK] Seq=125 Ack=45 Win=1452 Len=0 TSval=6169568 TSecr=5573197
    4 0.222263630 192.168.1.16 → 10.6.15.144  SSH 110 Client: Encrypted packet (len=44)
    5 0.270064268  10.6.15.144 → 192.168.1.16 TCP 66 22 → 59298 [ACK] Seq=125 Ack=89 Win=1452 Len=0 TSval=6169633 TSecr=5573252
    6 0.725773652 192.168.1.16 → 192.168.1.1  DNS 81 Standard query 0xeb9f A 1.ubuntu.pool.ntp.org
    7 0.734484349  192.168.1.1 → 192.168.1.16 DNS 145 Standard query response 0xeb9f A 1.ubuntu.pool.ntp.org A 123.108.200.124 A 139.59.50.38 A 139.59.21.22 A 52.66.5.185
    8 0.734963681 192.168.1.16 → 123.108.200.124 NTP 90 NTP Version 4, client
    9 1.363557098 192.168.1.16 → 10.6.15.144  SSH 102 Client: Encrypted packet (len=36)
   10 1.364520251 192.168.1.16 → 10.6.15.144  SSH 118 Client: Encrypted packet (len=52)
   11 1.374190986  10.6.15.144 → 192.168.1.16 TCP 66 22 → 59298 [ACK] Seq=125 Ack=125 Win=1452 Len=0 TSval=6169909 TSecr=5573537
   12 1.374207694  10.6.15.144 → 192.168.1.16 TCP 66 22 → 59298 [ACK] Seq=125 Ack=177 Win=1452 Len=0 TSval=6169909 TSecr=5573537
   13 3.025859771  10.6.15.144 → 192.168.1.16 SSH 1514 Server: Encrypted packet (len=1448)
   14 3.025995338  10.6.15.144 → 192.168.1.16 SSH 1514 Server: Encrypted packet (len=1448)
   15 3.026003652 192.168.1.16 → 10.6.15.144  TCP 66 59298 → 22 [ACK] Seq=177 Ack=3021 Win=5703 Len=0 TSval=5573952 TSecr=6169980
   16 3.026151729 192.168.1.16 → 10.6.15.144  SSH 102 Client: Encrypted packet (len=36)
   17 3.026190095  10.6.15.144 → 192.168.1.16 SSH 1514 Server: [TCP Previous segment not captured] , Encrypted packet (len=1448)
   18 3.026199451 192.168.1.16 → 10.6.15.144  TCP 78 [TCP Dup ACK 15#1] 59298 → 22 [ACK] Seq=213 Ack=3021 Win=5703 Len=0 TSval=5573953 TSecr=6169980 SLE=4469 SRE=5917
   19 3.026371246  10.6.15.144 → 192.168.1.16 SSH 1514 Server: Encrypted packet (len=1448)
   20 3.026378830 192.168.1.16 → 10.6.15.144  TCP 78 [TCP Dup ACK 15#2] 59298 → 22 [ACK] Seq=213 Ack=3021 Win=5703 Len=0 TSval=5573953 TSecr=6169980 SLE=4469 SRE=7365
   21 3.026628966  10.6.15.144 → 192.168.1.16 SSH 930 Server: Encrypted packet (len=864)
   22 3.026638514 192.168.1.16 → 10.6.15.144  TCP 78 [TCP Dup ACK 15#3] 59298 → 22 [ACK] Seq=213 Ack=3021 Win=5703 Len=0 TSval=5573953 TSecr=6169980 SLE=4469 SRE=8229
   23 3.026647208  10.6.15.144 → 192.168.1.16 SSH 218 Server: Encrypted packet (len=152)
   24 3.026651145 192.168.1.16 → 10.6.15.144  TCP 78 [TCP Dup ACK 15#4] 59298 → 22 [ACK] Seq=213 Ack=3021 Win=5703 Len=0 TSval=5573953 TSecr=6169980 SLE=4469 SRE=8381
   25 3.026869893  10.6.15.144 → 192.168.1.16 TCP 1514 [TCP Out-Of-Order] 22 → 59298 [ACK] Seq=125 Ack=177 Win=1452 Len=1448 TSval=6170195 TSecr=5573537
   26 3.026878161 192.168.1.16 → 10.6.15.144  TCP 86 [TCP Dup ACK 15#5] 59298 → 22 [ACK] Seq=213 Ack=3021 Win=5703 Len=0 TSval=5573953 TSecr=6169980 SLE=125 SRE=1573 SLE=4469 SRE=8381
   27 3.027585372 192.168.1.16 → 10.6.15.144  SSH 262 Client: Encrypted packet (len=184)
   28 3.038335125  10.6.15.144 → 192.168.1.16 TCP 66 22 → 59298 [ACK] Seq=8381 Ack=213 Win=1452 Len=0 TSval=6170324 TSecr=5573953
   29 3.038680063  10.6.15.144 → 192.168.1.16 SSH 1514 Server: Encrypted packet (len=1448)
   30 3.038698468 192.168.1.16 → 10.6.15.144  TCP 78 [TCP Dup ACK 15#6] 59298 → 22 [ACK] Seq=397 Ack=3021 Win=5703 Len=0 TSval=5573956 TSecr=6169980 SLE=4469 SRE=9829
   31 3.038871567  10.6.15.144 → 192.168.1.16 SSH 1514 Server: Encrypted packet (len=1448)
   32 3.038882658 192.168.1.16 → 10.6.15.144  TCP 78 [TCP Dup ACK 15#7] 59298 → 22 [ACK] Seq=397 Ack=3021 Win=5703 Len=0 TSval=5573956 TSecr=6169980 SLE=4469 SRE=11277
   33 3.038892729  10.6.15.144 → 192.168.1.16 SSH 326 Server: Encrypted packet (len=260)
   34 3.038898363 192.168.1.16 → 10.6.15.144  TCP 78 [TCP Dup ACK 15#8] 59298 → 22 [ACK] Seq=397 Ack=3021 Win=5703 Len=0 TSval=5573956 TSecr=6169980 SLE=4469 SRE=11537
   35 3.039106256  10.6.15.144 → 192.168.1.16 SSH 1514 Server: [TCP Fast Retransmission] , Encrypted packet (len=1448)
   36 3.039122437 192.168.1.16 → 10.6.15.144  TCP 66 59298 → 22 [ACK] Seq=397 Ack=11537 Win=5703 Len=0 TSval=5573956 TSecr=6170325
   37 3.040218222 192.168.1.16 → 10.6.15.144  SSH 102 Client: Encrypted packet (len=36)
   38 3.046045838 192.168.1.16 → 10.6.15.144  SSH 626 Client: Encrypted packet (len=560)
   39 3.046525332 192.168.1.16 → 10.6.15.144  SSH 406 Client: Encrypted packet (len=340)
   40 3.048226026 192.168.1.16 → 10.6.15.144  SSH 1094 Client: Encrypted packet (len=1028)
   41 3.048314228  10.6.15.144 → 192.168.1.16 TCP 66 22 → 59298 [ACK] Seq=11537 Ack=433 Win=1452 Len=0 TSval=6170328 TSecr=5573953
   42 3.050334092 192.168.1.16 → 10.6.15.144  SSH 158 Client: Encrypted packet (len=92)
   43 3.050961387 192.168.1.16 → 10.6.15.144  SSH 402 Client: Encrypted packet (len=336)
   44 3.052566433 192.168.1.16 → 10.6.15.144  SSH 118 Client: Encrypted packet (len=52)
   45 3.054429197  10.6.15.144 → 192.168.1.16 TCP 66 22 → 59298 [ACK] Seq=11537 Ack=1333 Win=1452 Len=0 TSval=6170329 TSecr=5573958
   46 3.059059268  10.6.15.144 → 192.168.1.16 TCP 66 22 → 59298 [ACK] Seq=11537 Ack=2453 Win=1452 Len=0 TSval=6170330 TSecr=5573958
   47 3.061102105  10.6.15.144 → 192.168.1.16 TCP 66 22 → 59298 [ACK] Seq=11537 Ack=2841 Win=1452 Len=0 TSval=6170331 TSecr=5573959
   48 3.061250312  10.6.15.144 → 192.168.1.16 SSH 246 Server: Encrypted packet (len=180)
   49 3.061642189 192.168.1.16 → 10.6.15.144  SSH 134 Client: Encrypted packet (len=68)
   50 3.063679828 192.168.1.16 → 10.6.15.144  SSH 238 Client: Encrypted packet (len=172)
   51 3.064064821 192.168.1.16 → 10.6.15.144  SSH 1514 Client: Encrypted packet (len=1448)
   52 3.064363221 192.168.1.16 → 10.6.15.144  SSH 258 Client: Encrypted packet (len=192)
   53 3.075187370  10.6.15.144 → 192.168.1.16 TCP 66 22 → 59298 [ACK] Seq=11717 Ack=4721 Win=1452 Len=0 TSval=6170334 TSecr=5573962
   54 3.075327263  10.6.15.144 → 192.168.1.16 SSH 166 Server: Encrypted packet (len=100)
   55 3.075706838 192.168.1.16 → 10.6.15.144  SSH 134 Client: Encrypted packet (len=68)
   56 3.080668803  10.6.15.144 → 192.168.1.16 SSH 134 Server: Encrypted packet (len=68)
   57 3.109755583  10.6.15.144 → 192.168.1.16 SSH 230 Server: Encrypted packet (len=164)
   58 3.109838761 192.168.1.16 → 10.6.15.144  TCP 66 59298 → 22 [ACK] Seq=4789 Ack=12049 Win=5703 Len=0 TSval=5573973 TSecr=6170334
   59 3.109889190  10.6.15.144 → 192.168.1.16 SSH 138 Server: Encrypted packet (len=72)
   60 3.110250860 192.168.1.16 → 10.6.15.144  SSH 102 Client: Encrypted packet (len=36)
   61 3.111300309 192.168.1.16 → 10.6.15.144  SSH 134 Client: Encrypted packet (len=68)
   62 3.114205622 192.168.1.16 → 10.6.15.144  SSH 826 Client: Encrypted packet (len=760)
   63 3.149764545  10.6.15.144 → 192.168.1.16 TCP 78 [TCP Dup ACK 53#1] 22 → 59298 [ACK] Seq=12121 Ack=4721 Win=1452 Len=0 TSval=6170352 TSecr=5573962 SLE=4789 SRE=4825
   64 3.149784660  10.6.15.144 → 192.168.1.16 TCP 78 [TCP Dup ACK 53#2] 22 → 59298 [ACK] Seq=12121 Ack=4721 Win=1452 Len=0 TSval=6170352 TSecr=5573962 SLE=4789 SRE=4893
   65 3.149789387  10.6.15.144 → 192.168.1.16 TCP 78 [TCP Dup ACK 53#3] 22 → 59298 [ACK] Seq=12121 Ack=4721 Win=1452 Len=0 TSval=6170352 TSecr=5573962 SLE=4789 SRE=5653
   66 3.149799918 192.168.1.16 → 10.6.15.144  SSH 134 Client: [TCP Fast Retransmission] , Encrypted packet (len=68)
   67 3.160175634  10.6.15.144 → 192.168.1.16 TCP 66 22 → 59298 [ACK] Seq=12121 Ack=5653 Win=1447 Len=0 TSval=6170355 TSecr=5573983
   68 3.178034134 192.168.1.16 → 10.6.15.144  SSH 102 Client: Encrypted packet (len=36)
   69 3.178473609 192.168.1.16 → 10.6.15.144  SSH 110 Client: Encrypted packet (len=44)
   70 3.191822441  10.6.15.144 → 192.168.1.16 TCP 66 22 → 59298 [ACK] Seq=12121 Ack=5689 Win=1452 Len=0 TSval=6170362 TSecr=5573990
   71 3.192125531  10.6.15.144 → 192.168.1.16 TCP 66 22 → 59298 [ACK] Seq=12121 Ack=5733 Win=1452 Len=0 TSval=6170362 TSecr=5573991
   72 3.203121203  10.6.15.144 → 192.168.1.16 SSH 926 Server: Encrypted packet (len=860)
   73 3.203296902  10.6.15.144 → 192.168.1.16 SSH 486 Server: Encrypted packet (len=420)
   74 3.203303892  10.6.15.144 → 192.168.1.16 SSH 142 Server: Encrypted packet (len=76)
   75 3.203315112 192.168.1.16 → 10.6.15.144  TCP 66 59298 → 22 [ACK] Seq=5733 Ack=13477 Win=5703 Len=0 TSval=5573997 TSecr=6170366
   76 3.204655985 192.168.1.16 → 10.6.15.144  SSH 142 Client: Encrypted packet (len=76)
   77 3.205163809 192.168.1.16 → 10.6.15.144  SSH 222 Client: Encrypted packet (len=156)
   78 3.205355857 192.168.1.16 → 10.6.15.144  SSH 1514 Client: Encrypted packet (len=1448)
   79 3.205442547 192.168.1.16 → 10.6.15.144  SSH 94 Client: Encrypted packet (len=28)
   80 3.207088402  10.6.15.144 → 192.168.1.16 SSH 174 Server: Encrypted packet (len=108)
   81 3.207350540 192.168.1.16 → 10.6.15.144  SSH 134 Client: Encrypted packet (len=68)
   82 3.209832161  10.6.15.144 → 192.168.1.16 SSH 1514 Server: Encrypted packet (len=1448)
   83 3.210438198  10.6.15.144 → 192.168.1.16 SSH 1514 Server: Encrypted packet (len=1448)
   84 3.210449113 192.168.1.16 → 10.6.15.144  TCP 66 59298 → 22 [ACK] Seq=7509 Ack=16481 Win=5703 Len=0 TSval=5573999 TSecr=6170368
   85 3.210629190  10.6.15.144 → 192.168.1.16 SSH 1514 Server: Encrypted packet (len=1448)
   86 3.212147968  10.6.15.144 → 192.168.1.16 TCP 66 22 → 59298 [ACK] Seq=17929 Ack=5965 Win=1452 Len=0 TSval=6170369 TSecr=5573997
   87 3.213491313  10.6.15.144 → 192.168.1.16 TCP 66 22 → 59298 [ACK] Seq=17929 Ack=7441 Win=1452 Len=0 TSval=6170369 TSecr=5573997
   88 3.214602039  10.6.15.144 → 192.168.1.16 SSH 1514 Server: Encrypted packet (len=1448)
   89 3.214623362 192.168.1.16 → 10.6.15.144  TCP 66 59298 → 22 [ACK] Seq=7509 Ack=19377 Win=5703 Len=0 TSval=5574000 TSecr=6170368
   90 3.214785616  10.6.15.144 → 192.168.1.16 SSH 1514 Server: Encrypted packet (len=1448)
   91 3.218652839  10.6.15.144 → 192.168.1.16 SSH 1514 Server: Encrypted packet (len=1448)
   92 3.218668171 192.168.1.16 → 10.6.15.144  TCP 66 59298 → 22 [ACK] Seq=7509 Ack=22273 Win=5703 Len=0 TSval=5574001 TSecr=6170369
   93 3.218685584  10.6.15.144 → 192.168.1.16 SSH 1514 Server: Encrypted packet (len=1448)
   94 3.222732380  10.6.15.144 → 192.168.1.16 SSH 1514 Server: Encrypted packet (len=1448)
   95 3.222750162 192.168.1.16 → 10.6.15.144  TCP 66 59298 → 22 [ACK] Seq=7509 Ack=25169 Win=5703 Len=0 TSval=5574002 TSecr=6170370
   96 3.222913553  10.6.15.144 → 192.168.1.16 SSH 1514 Server: Encrypted packet (len=1448)
   97 3.226842065  10.6.15.144 → 192.168.1.16 SSH 566 Server: Encrypted packet (len=500)
   98 3.226865890 192.168.1.16 → 10.6.15.144  TCP 66 59298 → 22 [ACK] Seq=7509 Ack=27117 Win=5703 Len=0 TSval=5574003 TSecr=6170371
   99 3.228394070 192.168.1.16 → 10.6.15.144  SSH 138 Client: Encrypted packet (len=72)
  100 3.234594358  10.6.15.144 → 192.168.1.16 SSH 138 Server: Encrypted packet (len=72)
  101 3.235020793 192.168.1.16 → 10.6.15.144  SSH 102 Client: Encrypted packet (len=36)
  102 3.235766982  10.6.15.144 → 192.168.1.16 SSH 102 Server: Encrypted packet (len=36)
  103 3.238877474 192.168.1.16 → 10.6.15.144  SSH 102 Client: Encrypted packet (len=36)
  104 3.242157338 192.168.1.16 → 10.6.15.144  SSH 138 Client: Encrypted packet (len=72)
  105 3.251638924  10.6.15.144 → 192.168.1.16 TCP 66 22 → 59298 [ACK] Seq=27225 Ack=7653 Win=1452 Len=0 TSval=6170378 TSecr=5574005
  106 3.258637231  10.6.15.144 → 192.168.1.16 SSH 1514 Server: Encrypted packet (len=1448)
  107 3.258662448  10.6.15.144 → 192.168.1.16 SSH 118 Server: Encrypted packet (len=52)
  108 3.258672333 192.168.1.16 → 10.6.15.144  TCP 66 59298 → 22 [ACK] Seq=7725 Ack=28725 Win=5703 Len=0 TSval=5574011 TSecr=6170380
  109 3.258988925  10.6.15.144 → 192.168.1.16 SSH 1514 Server: Encrypted packet (len=1448)
  110 3.259000557  10.6.15.144 → 192.168.1.16 SSH 118 Server: Encrypted packet (len=52)
  111 3.259005259 192.168.1.16 → 10.6.15.144  TCP 66 59298 → 22 [ACK] Seq=7725 Ack=30225 Win=5703 Len=0 TSval=5574011 TSecr=6170380
  112 3.259351524  10.6.15.144 → 192.168.1.16 SSH 1514 Server: Encrypted packet (len=1448)
  113 3.259365980  10.6.15.144 → 192.168.1.16 SSH 398 Server: Encrypted packet (len=332)
  114 3.259371970 192.168.1.16 → 10.6.15.144  TCP 66 59298 → 22 [ACK] Seq=7725 Ack=32005 Win=5703 Len=0 TSval=5574011 TSecr=6170380
  115 3.302256863  10.6.15.144 → 192.168.1.16 SSH 138 Server: Encrypted packet (len=72)
  116 3.302533886 192.168.1.16 → 10.6.15.144  SSH 102 Client: Encrypted packet (len=36)
  117 3.334992318  10.6.15.144 → 192.168.1.16 SSH 894 Server: Encrypted packet (len=828)
  118 3.336204332  10.6.15.144 → 192.168.1.16 SSH 454 Server: Encrypted packet (len=388)
  119 3.336219568  10.6.15.144 → 192.168.1.16 SSH 134 Server: Encrypted packet (len=68)
  120 3.336276861 192.168.1.16 → 10.6.15.144  TCP 66 59298 → 22 [ACK] Seq=7761 Ack=33361 Win=5703 Len=0 TSval=5574030 TSecr=6170399
  121 3.336784699 192.168.1.16 → 10.6.15.144  SSH 134 Client: Encrypted packet (len=68)
  122 3.401874959  10.6.15.144 → 192.168.1.16 TCP 66 22 → 59298 [ACK] Seq=33361 Ack=7829 Win=1452 Len=0 TSval=6170416 TSecr=5574030
  123 3.411259712  10.6.15.144 → 192.168.1.16 SSH 110 Server: Encrypted packet (len=44)
  124 3.411619404 192.168.1.16 → 10.6.15.144  SSH 198 Client: Encrypted packet (len=132)
  125 3.425972253  10.6.15.144 → 192.168.1.16 TCP 66 22 → 59298 [ACK] Seq=33405 Ack=7961 Win=1452 Len=0 TSval=6170422 TSecr=5574049
  126 3.466591260  10.6.15.144 → 192.168.1.16 SSH 102 Server: Encrypted packet (len=36)
  127 3.466974534 192.168.1.16 → 10.6.15.144  SSH 374 Client: Encrypted packet (len=308)
  128 3.471607298  10.6.15.144 → 192.168.1.16 SSH 102 Server: Encrypted packet (len=36)
  129 3.472156145 192.168.1.16 → 10.6.15.144  SSH 158 Client: Encrypted packet (len=92)
  130 3.482572799  10.6.15.144 → 192.168.1.16 TCP 66 22 → 59298 [ACK] Seq=33477 Ack=8361 Win=1452 Len=0 TSval=6170436 TSecr=5574063
  131 3.519299244  10.6.15.144 → 192.168.1.16 SSH 214 Server: Encrypted packet (len=148)
  132 3.520069024 192.168.1.16 → 10.6.15.144  SSH 414 Client: Encrypted packet (len=348)
  133 3.521336378  10.6.15.144 → 192.168.1.16 SSH 350 Server: Encrypted packet (len=284)
  134 3.525138638  10.6.15.144 → 192.168.1.16 SSH 318 Server: Encrypted packet (len=252)
  135 3.525224889 192.168.1.16 → 10.6.15.144  TCP 66 59298 → 22 [ACK] Seq=8709 Ack=34161 Win=5703 Len=0 TSval=5574077 TSecr=6170445
  136 3.526627881  10.6.15.144 → 192.168.1.16 SSH 230 Server: Encrypted packet (len=164)
  137 3.526669531  10.6.15.144 → 192.168.1.16 SSH 318 Server: Encrypted packet (len=252)
  138 3.526713599 192.168.1.16 → 10.6.15.144  TCP 66 59298 → 22 [ACK] Seq=8709 Ack=34577 Win=5703 Len=0 TSval=5574078 TSecr=6170447
  139 3.527122245 192.168.1.16 → 10.6.15.144  SSH 134 Client: Encrypted packet (len=68)
  140 3.529265356  10.6.15.144 → 192.168.1.16 SSH 318 Server: Encrypted packet (len=252)
  141 3.535503081  10.6.15.144 → 192.168.1.16 SSH 334 Server: Encrypted packet (len=268)
  142 3.535585285 192.168.1.16 → 10.6.15.144  TCP 66 59298 → 22 [ACK] Seq=8777 Ack=35097 Win=5703 Len=0 TSval=5574080 TSecr=6170447
  143 3.544573701  10.6.15.144 → 192.168.1.16 SSH 158 Server: Encrypted packet (len=92)
  144 3.544600570  10.6.15.144 → 192.168.1.16 SSH 118 Server: Encrypted packet (len=52)
  145 3.544675329 192.168.1.16 → 10.6.15.144  TCP 66 59298 → 22 [ACK] Seq=8777 Ack=35241 Win=5703 Len=0 TSval=5574082 TSecr=6170451
  146 3.544691398  10.6.15.144 → 192.168.1.16 SSH 126 Server: Encrypted packet (len=60)
  147 3.545427749 192.168.1.16 → 10.6.15.144  SSH 406 Client: Encrypted packet (len=340)
  148 3.554805317  10.6.15.144 → 192.168.1.16 SSH 334 Server: Encrypted packet (len=268)
  149 3.598056085 192.168.1.16 → 10.6.15.144  TCP 66 59298 → 22 [ACK] Seq=9117 Ack=35569 Win=5703 Len=0 TSval=5574096 TSecr=6170454
  150 3.660599214  10.6.15.144 → 192.168.1.16 SSH 110 Server: Encrypted packet (len=44)
  151 3.660688581 192.168.1.16 → 10.6.15.144  TCP 66 59298 → 22 [ACK] Seq=9117 Ack=35613 Win=5703 Len=0 TSval=5574111 TSecr=6170480
  152 3.660983255 192.168.1.16 → 10.6.15.144  SSH 158 Client: Encrypted packet (len=92)
  153 3.693520622  10.6.15.144 → 192.168.1.16 SSH 1014 Server: Encrypted packet (len=948)
  154 3.693845035  10.6.15.144 → 192.168.1.16 SSH 1502 Server: Encrypted packet (len=1436)
  155 3.693853671 192.168.1.16 → 10.6.15.144  TCP 66 59298 → 22 [ACK] Seq=9209 Ack=37997 Win=5703 Len=0 TSval=5574119 TSecr=6170489
  156 3.694833098 192.168.1.16 → 10.6.15.144  SSH 222 Client: Encrypted packet (len=156)
  157 3.699132189  10.6.15.144 → 192.168.1.16 SSH 158 Server: Encrypted packet (len=92)
  158 3.699558881  10.6.15.144 → 192.168.1.16 SSH 462 Server: Encrypted packet (len=396)
  159 3.699591730 192.168.1.16 → 10.6.15.144  TCP 66 59298 → 22 [ACK] Seq=9365 Ack=38485 Win=5703 Len=0 TSval=5574121 TSecr=6170490
  160 3.700490001 192.168.1.16 → 10.6.15.144  SSH 222 Client: Encrypted packet (len=156)
  161 3.709360876  10.6.15.144 → 192.168.1.16 TCP 66 22 → 59298 [ACK] Seq=38485 Ack=9521 Win=1452 Len=0 TSval=6170493 TSecr=5574120
  162 3.725748549 192.168.1.16 → 192.168.1.1  DNS 81 Standard query 0xa1b7 A 3.ubuntu.pool.ntp.org
  163 3.737346110  192.168.1.1 → 192.168.1.16 DNS 145 Standard query response 0xa1b7 A 3.ubuntu.pool.ntp.org A 123.108.200.124 A 139.59.50.38 A 139.59.21.22 A 52.66.5.185
  164 3.737762948 192.168.1.16 → 123.108.200.124 NTP 90 NTP Version 4, client
  165 3.774221705  10.6.15.144 → 192.168.1.16 SSH 294 Server: Encrypted packet (len=228)
  166 3.774241935  10.6.15.144 → 192.168.1.16 SSH 102 Server: Encrypted packet (len=36)
  167 3.774318805 192.168.1.16 → 10.6.15.144  TCP 66 59298 → 22 [ACK] Seq=9521 Ack=38749 Win=5703 Len=0 TSval=5574140 TSecr=6170508
  168 3.775921812 192.168.1.16 → 10.6.15.144  SSH 138 Client: Encrypted packet (len=72)
  169 3.788763103  10.6.15.144 → 192.168.1.16 SSH 102 Server: Encrypted packet (len=36)
  170 3.794377780 192.168.1.16 → 10.6.15.144  SSH 102 Client: Encrypted packet (len=36)
  171 3.794669537 192.168.1.16 → 10.6.15.144  SSH 102 Client: Encrypted packet (len=36)
  172 3.795402732 192.168.1.16 → 10.6.15.144  SSH 102 Client: Encrypted packet (len=36)
  173 3.795620199 192.168.1.16 → 10.6.15.144  SSH 102 Client: Encrypted packet (len=36)
  174 3.795834785 192.168.1.16 → 10.6.15.144  SSH 110 Client: Encrypted packet (len=44)
  175 3.796053994 192.168.1.16 → 10.6.15.144  SSH 102 Client: Encrypted packet (len=36)
  176 3.804216610  10.6.15.144 → 192.168.1.16 TCP 66 22 → 59298 [ACK] Seq=38785 Ack=9665 Win=1452 Len=0 TSval=6170516 TSecr=5574145
  177 3.804241097 192.168.1.16 → 10.6.15.144  SSH 254 Client: Encrypted packet (len=188)
  178 3.805076821  10.6.15.144 → 192.168.1.16 TCP 66 22 → 59298 [ACK] Seq=38785 Ack=9737 Win=1452 Len=0 TSval=6170516 TSecr=5574145
  179 3.805459685  10.6.15.144 → 192.168.1.16 TCP 66 22 → 59298 [ACK] Seq=38785 Ack=9817 Win=1452 Len=0 TSval=6170516 TSecr=5574145
  180 3.810265229 192.168.1.16 → 10.6.15.144  SSH 102 Client: Encrypted packet (len=36)
  181 3.810494669 192.168.1.16 → 10.6.15.144  SSH 102 Client: Encrypted packet (len=36)
  182 3.812242499 192.168.1.16 → 10.6.15.144  SSH 110 Client: Encrypted packet (len=44)
  183 3.812471217 192.168.1.16 → 10.6.15.144  SSH 102 Client: Encrypted packet (len=36)
  184 3.820216693  10.6.15.144 → 192.168.1.16 TCP 66 22 → 59298 [ACK] Seq=38785 Ack=10041 Win=1452 Len=0 TSval=6170520 TSecr=5574147
  185 3.822007406  10.6.15.144 → 192.168.1.16 TCP 66 22 → 59298 [ACK] Seq=38785 Ack=10121 Win=1452 Len=0 TSval=6170521 TSecr=5574149
  186 3.852193839  10.6.15.144 → 192.168.1.16 SSH 138 Server: Encrypted packet (len=72)
  187 3.852671216 192.168.1.16 → 10.6.15.144  SSH 102 Client: Encrypted packet (len=36)
  188 3.853371366  10.6.15.144 → 192.168.1.16 SSH 138 Server: Encrypted packet (len=72)
  189 3.853802195 192.168.1.16 → 10.6.15.144  SSH 102 Client: Encrypted packet (len=36)
  190 3.857249533 192.168.1.16 → 10.6.15.144  SSH 102 Client: Encrypted packet (len=36)
  191 3.858009334 192.168.1.16 → 10.6.15.144  SSH 110 Client: Encrypted packet (len=44)
  192 3.861907169  10.6.15.144 → 192.168.1.16 TCP 66 22 → 59298 [ACK] Seq=38929 Ack=10229 Win=1452 Len=0 TSval=6170531 TSecr=5574159
  193 3.863011078  10.6.15.144 → 192.168.1.16 SSH 138 Server: Encrypted packet (len=72)
  194 3.863028295  10.6.15.144 → 192.168.1.16 SSH 138 Server: Encrypted packet (len=72)
  195 3.863105372 192.168.1.16 → 10.6.15.144  TCP 66 59298 → 22 [ACK] Seq=10309 Ack=39073 Win=5703 Len=0 TSval=5574162 TSecr=6170531
  196 3.863793545 192.168.1.16 → 10.6.15.144  SSH 138 Client: Encrypted packet (len=72)
  197 3.866687736  10.6.15.144 → 192.168.1.16 SSH 102 Server: Encrypted packet (len=36)
  198 3.866709596  10.6.15.144 → 192.168.1.16 SSH 102 Server: Encrypted packet (len=36)
  199 3.866791106 192.168.1.16 → 10.6.15.144  TCP 66 59298 → 22 [ACK] Seq=10381 Ack=39145 Win=5703 Len=0 TSval=5574163 TSecr=6170532
  200 3.867831932 192.168.1.16 → 10.6.15.144  SSH 166 Client: Encrypted packet (len=100)
  201 3.868080104 192.168.1.16 → 10.6.15.144  SSH 158 Client: Encrypted packet (len=92)
  202 3.868373210 192.168.1.16 → 10.6.15.144  SSH 102 Client: Encrypted packet (len=36)
  203 3.868773721 192.168.1.16 → 10.6.15.144  SSH 118 Client: Encrypted packet (len=52)
  204 3.870410057  10.6.15.144 → 192.168.1.16 SSH 138 Server: Encrypted packet (len=72)
  205 3.870749560 192.168.1.16 → 10.6.15.144  SSH 102 Client: Encrypted packet (len=36)
  206 3.877880895  10.6.15.144 → 192.168.1.16 TCP 66 22 → 59298 [ACK] Seq=39217 Ack=10481 Win=1452 Len=0 TSval=6170535 TSecr=5574162
  207 3.877898810  10.6.15.144 → 192.168.1.16 TCP 66 22 → 59298 [ACK] Seq=39217 Ack=10609 Win=1452 Len=0 TSval=6170535 TSecr=5574163
  208 3.880559823  10.6.15.144 → 192.168.1.16 TCP 66 22 → 59298 [ACK] Seq=39217 Ack=10697 Win=1452 Len=0 TSval=6170535 TSecr=5574163
  209 3.887108479  10.6.15.144 → 192.168.1.16 SSH 174 Server: Encrypted packet (len=108)
  210 3.887512256 192.168.1.16 → 10.6.15.144  SSH 102 Client: Encrypted packet (len=36)
  211 3.887751861 192.168.1.16 → 10.6.15.144  SSH 158 Client: Encrypted packet (len=92)
  212 3.897818185  10.6.15.144 → 192.168.1.16 TCP 66 22 → 59298 [ACK] Seq=39325 Ack=10825 Win=1452 Len=0 TSval=6170539 TSecr=5574168
  213 3.922181888  10.6.15.144 → 192.168.1.16 SSH 350 Server: Encrypted packet (len=284)
  214 3.929644994  10.6.15.144 → 192.168.1.16 SSH 342 Server: Encrypted packet (len=276)
  215 3.929714120 192.168.1.16 → 10.6.15.144  TCP 66 59298 → 22 [ACK] Seq=10825 Ack=39885 Win=5703 Len=0 TSval=5574178 TSecr=6170546
  216 4.007453036  10.6.15.144 → 192.168.1.16 SSH 318 Server: Encrypted packet (len=252)
  217 4.014245030  10.6.15.144 → 192.168.1.16 SSH 138 Server: Encrypted packet (len=72)
  218 4.014342750 192.168.1.16 → 10.6.15.144  TCP 66 59298 → 22 [ACK] Seq=10825 Ack=40209 Win=5703 Len=0 TSval=5574200 TSecr=6170568
  219 4.014788018 192.168.1.16 → 10.6.15.144  SSH 102 Client: Encrypted packet (len=36)
  220 4.036026979  10.6.15.144 → 192.168.1.16 SSH 334 Server: Encrypted packet (len=268)
  221 4.078043548 192.168.1.16 → 10.6.15.144  TCP 66 59298 → 22 [ACK] Seq=10861 Ack=40477 Win=5703 Len=0 TSval=5574216 TSecr=6170575
  222 4.128756587  10.6.15.144 → 192.168.1.16 SSH 286 Server: Encrypted packet (len=220)
  223 4.128837161 192.168.1.16 → 10.6.15.144  TCP 66 59298 → 22 [ACK] Seq=10861 Ack=40697 Win=5703 Len=0 TSval=5574228 TSecr=6170597
  224 4.129398885 192.168.1.16 → 10.6.15.144  SSH 142 Client: Encrypted packet (len=76)
  225 4.173214893 192.168.1.16 → 10.6.15.144  SSH 1030 Client: Encrypted packet (len=964)
  226 4.177461795  10.6.15.144 → 192.168.1.16 TCP 66 22 → 59298 [ACK] Seq=40697 Ack=10937 Win=1452 Len=0 TSval=6170610 TSecr=5574228
  227 4.183841753  10.6.15.144 → 192.168.1.16 TCP 66 22 → 59298 [ACK] Seq=40697 Ack=11901 Win=1452 Len=0 TSval=6170611 TSecr=5574239
  228 4.219608960 192.168.1.16 → 10.6.15.144  SSH 134 Client: Encrypted packet (len=68)
  229 4.226013336  10.6.15.144 → 192.168.1.16 TCP 66 22 → 59298 [ACK] Seq=40697 Ack=11969 Win=1452 Len=0 TSval=6170622 TSecr=5574251
  230 4.253180430 192.168.1.16 → 10.6.15.144  SSH 230 Client: Encrypted packet (len=164)
  231 4.260734190  10.6.15.144 → 192.168.1.16 TCP 66 22 → 59298 [ACK] Seq=40697 Ack=12133 Win=1452 Len=0 TSval=6170631 TSecr=5574259
  232 4.260753416  10.6.15.144 → 192.168.1.16 SSH 110 Server: Encrypted packet (len=44)
  233 4.261131807 192.168.1.16 → 10.6.15.144  SSH 406 Client: Encrypted packet (len=340)
  234 4.275514019  10.6.15.144 → 192.168.1.16 SSH 102 Server: Encrypted packet (len=36)
  235 4.286657322  10.6.15.144 → 192.168.1.16 SSH 102 Server: Encrypted packet (len=36)
  236 4.286749834 192.168.1.16 → 10.6.15.144  TCP 66 59298 → 22 [ACK] Seq=12473 Ack=40813 Win=5703 Len=0 TSval=5574268 TSecr=6170634
  237 4.287176623 192.168.1.16 → 10.6.15.144  SSH 150 Client: Encrypted packet (len=84)
  238 4.313615062  10.6.15.144 → 192.168.1.16 SSH 1514 Server: Encrypted packet (len=1448)
  239 4.313786067  10.6.15.144 → 192.168.1.16 SSH 1454 Server: Encrypted packet (len=1388)
  240 4.313796564 192.168.1.16 → 10.6.15.144  TCP 66 59298 → 22 [ACK] Seq=12557 Ack=43649 Win=5703 Len=0 TSval=5574274 TSecr=6170643
  241 4.314133330  10.6.15.144 → 192.168.1.16 SSH 1514 Server: Encrypted packet (len=1448)
  242 4.314324570  10.6.15.144 → 192.168.1.16 SSH 1514 Server: Encrypted packet (len=1448)
  243 4.314331341 192.168.1.16 → 10.6.15.144  TCP 66 59298 → 22 [ACK] Seq=12557 Ack=46545 Win=5703 Len=0 TSval=5574275 TSecr=6170643
  244 4.314518808  10.6.15.144 → 192.168.1.16 SSH 1514 Server: [TCP Previous segment not captured] , Encrypted packet (len=1448)
  245 4.314529474 192.168.1.16 → 10.6.15.144  TCP 78 [TCP Dup ACK 243#1] 59298 → 22 [ACK] Seq=12557 Ack=46545 Win=5703 Len=0 TSval=5574275 TSecr=6170643 SLE=47981 SRE=49429
  246 4.324628012  10.6.15.144 → 192.168.1.16 SSH 1514 Server: Encrypted packet (len=1448)
  247 4.324649531 192.168.1.16 → 10.6.15.144  TCP 78 [TCP Dup ACK 243#2] 59298 → 22 [ACK] Seq=12557 Ack=46545 Win=5703 Len=0 TSval=5574277 TSecr=6170643 SLE=47981 SRE=50877
  248 4.324662369  10.6.15.144 → 192.168.1.16 SSH 186 Server: Encrypted packet (len=120)
  249 4.324664619 192.168.1.16 → 10.6.15.144  TCP 78 [TCP Dup ACK 243#3] 59298 → 22 [ACK] Seq=12557 Ack=46545 Win=5703 Len=0 TSval=5574277 TSecr=6170643 SLE=47981 SRE=50997
  250 4.335271325  10.6.15.144 → 192.168.1.16 SSH 1502 Server: [TCP Fast Retransmission] , Encrypted packet (len=1436)
  251 4.335294887 192.168.1.16 → 10.6.15.144  TCP 66 59298 → 22 [ACK] Seq=12557 Ack=50997 Win=5703 Len=0 TSval=5574280 TSecr=6170649
  252 4.336787525 192.168.1.16 → 10.6.15.144  SSH 166 Client: Encrypted packet (len=100)
  253 4.356408884  10.6.15.144 → 192.168.1.16 SSH 102 Server: Encrypted packet (len=36)
  254 4.356498389  10.6.15.144 → 192.168.1.16 SSH 206 Server: Encrypted packet (len=140)
  255 4.356556067 192.168.1.16 → 10.6.15.144  TCP 66 59298 → 22 [ACK] Seq=12657 Ack=51173 Win=5703 Len=0 TSval=5574285 TSecr=6170654
  256 4.356646321  10.6.15.144 → 192.168.1.16 SSH 138 Server: Encrypted packet (len=72)
  257 4.356903719 192.168.1.16 → 10.6.15.144  SSH 102 Client: Encrypted packet (len=36)
  258 4.358093818 192.168.1.16 → 10.6.15.144  SSH 166 Client: Encrypted packet (len=100)
  259 4.367616765  10.6.15.144 → 192.168.1.16 TCP 66 22 → 59298 [ACK] Seq=51245 Ack=12793 Win=1452 Len=0 TSval=6170657 TSecr=5574285
  260 4.370071610  10.6.15.144 → 192.168.1.16 SSH 102 Server: Encrypted packet (len=36)
  261 4.370084252  10.6.15.144 → 192.168.1.16 SSH 138 Server: Encrypted packet (len=72)
  262 4.370140758 192.168.1.16 → 10.6.15.144  TCP 66 59298 → 22 [ACK] Seq=12793 Ack=51353 Win=5703 Len=0 TSval=5574289 TSecr=6170658
  263 4.370414104 192.168.1.16 → 10.6.15.144  SSH 102 Client: Encrypted packet (len=36)
  264 4.417777822  10.6.15.144 → 192.168.1.16 TCP 66 22 → 59298 [ACK] Seq=51353 Ack=12829 Win=1452 Len=0 TSval=6170670 TSecr=5574289
  265 5.950069927 192.168.1.16 → 54.76.71.168 TCP 66 42414 → 8282 [ACK] Seq=1 Ack=1 Win=296 Len=0 TSval=5574684 TSecr=609675368
  266 5.951714177  10.6.15.144 → 192.168.1.16 SSH 166 Server: Encrypted packet (len=100)
  267 5.951758114  10.6.15.144 → 192.168.1.16 SSH 310 Server: Encrypted packet (len=244)
  268 5.951773812  10.6.15.144 → 192.168.1.16 SSH 142 Server: Encrypted packet (len=76)
  269 5.951796220 192.168.1.16 → 10.6.15.144  TCP 66 59298 → 22 [ACK] Seq=12829 Ack=51773 Win=5703 Len=0 TSval=5574684 TSecr=6170724
  270 5.951959338  10.6.15.144 → 192.168.1.16 SSH 142 Server: [TCP Spurious Retransmission] , Encrypted packet (len=76)
  271 5.951967074 192.168.1.16 → 10.6.15.144  TCP 78 [TCP Dup ACK 269#1] 59298 → 22 [ACK] Seq=12829 Ack=51773 Win=5703 Len=0 TSval=5574684 TSecr=6170741 SLE=51697 SRE=51773
  272 5.951974427  10.6.15.144 → 192.168.1.16 SSH 142 Server: Encrypted packet (len=76)
  273 5.951976681 192.168.1.16 → 10.6.15.144  TCP 66 59298 → 22 [ACK] Seq=12829 Ack=51849 Win=5703 Len=0 TSval=5574684 TSecr=6170747
  274 5.952027296  10.6.15.144 → 192.168.1.16 SSH 318 Server: Encrypted packet (len=252)
  275 5.952032256 192.168.1.16 → 10.6.15.144  TCP 66 59298 → 22 [ACK] Seq=12829 Ack=52101 Win=5703 Len=0 TSval=5574684 TSecr=6170753
  276 5.952294360  10.6.15.144 → 192.168.1.16 SSH 814 Server: [TCP Spurious Retransmission] , Encrypted packet (len=748)
  277 5.952302337 192.168.1.16 → 10.6.15.144  TCP 78 [TCP Dup ACK 275#1] 59298 → 22 [ACK] Seq=12829 Ack=52101 Win=5703 Len=0 TSval=5574684 TSecr=6170815 SLE=51353 SRE=52101
  278 5.952394042  10.6.15.144 → 192.168.1.16 SSH 814 Server: [TCP Spurious Retransmission] , Encrypted packet (len=748)
  279 5.952396642 192.168.1.16 → 10.6.15.144  TCP 78 [TCP Dup ACK 275#2] 59298 → 22 [ACK] Seq=12829 Ack=52101 Win=5703 Len=0 TSval=5574684 TSecr=6170923 SLE=51353 SRE=52101
  280 5.960916628 192.168.1.16 → 10.6.15.144  SSH 1030 Client: Encrypted packet (len=964)
  281 5.962879132  10.6.15.144 → 192.168.1.16 SSH 738 Server: Encrypted packet (len=672)
  282 5.963011243 192.168.1.16 → 10.6.15.144  SSH 1022 Client: Encrypted packet (len=956)
  283 5.964946602 192.168.1.16 → 10.6.15.144  SSH 1030 Client: Encrypted packet (len=964)
  284 5.965570167 192.168.1.16 → 10.6.15.144  SSH 150 Client: Encrypted packet (len=84)
  285 5.971257697  10.6.15.144 → 192.168.1.16 TCP 66 22 → 59298 [ACK] Seq=52773 Ack=13793 Win=1452 Len=0 TSval=6171058 TSecr=5574686
  286 5.973052948  10.6.15.144 → 192.168.1.16 TCP 66 22 → 59298 [ACK] Seq=52773 Ack=14749 Win=1452 Len=0 TSval=6171058 TSecr=5574687
  287 5.975322979  10.6.15.144 → 192.168.1.16 TCP 66 22 → 59298 [ACK] Seq=52773 Ack=15713 Win=1452 Len=0 TSval=6171059 TSecr=5574687
  288 5.975339902  10.6.15.144 → 192.168.1.16 TCP 66 22 → 59298 [ACK] Seq=52773 Ack=15797 Win=1452 Len=0 TSval=6171059 TSecr=5574687
  289 6.011988017 192.168.1.16 → 10.6.15.144  SSH 1030 Client: Encrypted packet (len=964)
  290 6.022328524  10.6.15.144 → 192.168.1.16 TCP 66 22 → 59298 [ACK] Seq=52773 Ack=16761 Win=1452 Len=0 TSval=6171071 TSecr=5574699
  291 6.030705479 192.168.1.16 → 10.6.15.144  SSH 1030 Client: Encrypted packet (len=964)
  292 6.031392778 192.168.1.16 → 10.6.15.144  SSH 102 Client: Encrypted packet (len=36)
  293 6.031604212 192.168.1.16 → 10.6.15.144  SSH 110 Client: Encrypted packet (len=44)
  294 6.041564880  10.6.15.144 → 192.168.1.16 TCP 66 22 → 59298 [ACK] Seq=52773 Ack=17725 Win=1452 Len=0 TSval=6171075 TSecr=5574704
  295 6.041579740  10.6.15.144 → 192.168.1.16 TCP 66 22 → 59298 [ACK] Seq=52773 Ack=17761 Win=1452 Len=0 TSval=6171075 TSecr=5574704
  296 6.041598598  10.6.15.144 → 192.168.1.16 TCP 66 22 → 59298 [ACK] Seq=52773 Ack=17805 Win=1452 Len=0 TSval=6171075 TSecr=5574704
  297 6.112857996 54.76.71.168 → 192.168.1.16 TCP 66 [TCP ACKed unseen segment] 8282 → 42414 [ACK] Seq=1 Ack=2 Win=121 Len=0 TSval=609686659 TSecr=5551729
  298 6.122385282 192.168.1.16 → 10.6.15.144  SSH 102 Client: Encrypted packet (len=36)
  299 6.123494385 192.168.1.16 → 10.6.15.144  SSH 118 Client: Encrypted packet (len=52)
  300 6.132125465  10.6.15.144 → 192.168.1.16 TCP 66 22 → 59298 [ACK] Seq=52773 Ack=17841 Win=1452 Len=0 TSval=6171098 TSecr=5574727
  301 6.132796568 192.168.1.16 → 10.6.15.144  SSH 102 Client: Encrypted packet (len=36)
  302 6.133148456 192.168.1.16 → 10.6.15.144  SSH 118 Client: Encrypted packet (len=52)
  303 6.133179003  10.6.15.144 → 192.168.1.16 TCP 66 22 → 59298 [ACK] Seq=52773 Ack=17893 Win=1452 Len=0 TSval=6171098 TSecr=5574727
  304 6.144362594  10.6.15.144 → 192.168.1.16 TCP 66 22 → 59298 [ACK] Seq=52773 Ack=17929 Win=1452 Len=0 TSval=6171101 TSecr=5574729
  305 6.144382771  10.6.15.144 → 192.168.1.16 TCP 66 22 → 59298 [ACK] Seq=52773 Ack=17981 Win=1452 Len=0 TSval=6171101 TSecr=5574729
  306 6.244733547 192.168.1.16 → 10.6.15.144  SSH 902 Client: Encrypted packet (len=836)
  307 6.256575895  10.6.15.144 → 192.168.1.16 TCP 66 22 → 59298 [ACK] Seq=52773 Ack=18817 Win=1450 Len=0 TSval=6171129 TSecr=5574757
  308 6.378106056 192.168.1.16 → 10.6.15.144  SSH 102 Client: Encrypted packet (len=36)
  309 6.379097030 192.168.1.16 → 10.6.15.144  SSH 110 Client: Encrypted packet (len=44)
  310 6.388893418  10.6.15.144 → 192.168.1.16 TCP 66 22 → 59298 [ACK] Seq=52773 Ack=18853 Win=1450 Len=0 TSval=6171162 TSecr=5574789
  311 6.388908554  10.6.15.144 → 192.168.1.16 TCP 66 22 → 59298 [ACK] Seq=52773 Ack=18897 Win=1450 Len=0 TSval=6171162 TSecr=5574791
  312 8.050743688  10.6.15.144 → 192.168.1.16 SSH 1514 Server: Encrypted packet (len=1448)
  313 8.050971557 192.168.1.16 → 10.6.15.144  SSH 138 Client: Encrypted packet (len=72)
  314 8.051002012  10.6.15.144 → 192.168.1.16 SSH 1514 Server: Encrypted packet (len=1448)
  315 8.051191514  10.6.15.144 → 192.168.1.16 SSH 1514 Server: Encrypted packet (len=1448)
  316 8.051198447 192.168.1.16 → 10.6.15.144  TCP 66 59298 → 22 [ACK] Seq=18969 Ack=57117 Win=5703 Len=0 TSval=5575209 TSecr=6171330
  317 8.051562622 192.168.1.16 → 10.6.15.144  SSH 382 Client: Encrypted packet (len=316)
  318 8.056244780 192.168.1.16 → 10.6.15.144  SSH 138 Client: Encrypted packet (len=72)
  319 8.056994977 192.168.1.16 → 10.6.15.144  SSH 118 Client: Encrypted packet (len=52)
  320 8.060231944  10.6.15.144 → 192.168.1.16 SSH 1514 Server: Encrypted packet (len=1448)
  321 8.060407216  10.6.15.144 → 192.168.1.16 SSH 1514 Server: Encrypted packet (len=1448)
  322 8.060416254 192.168.1.16 → 10.6.15.144  TCP 66 59298 → 22 [ACK] Seq=19409 Ack=60013 Win=5703 Len=0 TSval=5575211 TSecr=6171580
  323 8.060588247  10.6.15.144 → 192.168.1.16 SSH 1514 Server: Encrypted packet (len=1448)
  324 8.062879886 192.168.1.16 → 10.6.15.144  SSH 102 Client: Encrypted packet (len=36)
  325 8.064899216  10.6.15.144 → 192.168.1.16 TCP 66 22 → 59298 [ACK] Seq=61461 Ack=19357 Win=1452 Len=0 TSval=6171582 TSecr=5575209
  326 8.065846778  10.6.15.144 → 192.168.1.16 SSH 1514 Server: Encrypted packet (len=1448)
  327 8.066755236 192.168.1.16 → 10.6.15.144  SSH 110 Client: Encrypted packet (len=44)
  328 8.069235111 192.168.1.16 → 10.6.15.144  SSH 1030 Client: Encrypted packet (len=964)
  329 8.071028816  10.6.15.144 → 192.168.1.16 SSH 1514 Server: Encrypted packet (len=1448)
  330 8.073426483 192.168.1.16 → 10.6.15.144  SSH 1030 Client: Encrypted packet (len=964)
  331 8.075127334  10.6.15.144 → 192.168.1.16 SSH 1514 Server: Encrypted packet (len=1448)
  332 8.075276660  10.6.15.144 → 192.168.1.16 SSH 1302 Server: Encrypted packet (len=1236)
  333 8.075284514 192.168.1.16 → 10.6.15.144  TCP 66 59298 → 22 [ACK] Seq=21417 Ack=67041 Win=5703 Len=0 TSval=5575215 TSecr=6171583
  334 8.076034617 192.168.1.16 → 10.6.15.144  SSH 174 Client: Encrypted packet (len=108)
  335 8.076994564  10.6.15.144 → 192.168.1.16 SSH 102 Server: Encrypted packet (len=36)
  336 8.082834633 192.168.1.16 → 10.6.15.144  SSH 158 Client: Encrypted packet (len=92)
  337 8.083155117 192.168.1.16 → 10.6.15.144  SSH 198 Client: Encrypted packet (len=132)
  338 8.083410317 192.168.1.16 → 10.6.15.144  SSH 198 Client: Encrypted packet (len=132)
  339 8.085886054  10.6.15.144 → 192.168.1.16 TCP 66 22 → 59298 [ACK] Seq=67077 Ack=21417 Win=1452 Len=0 TSval=6171587 TSecr=5575213
  340 8.085903170 192.168.1.16 → 10.6.15.144  SSH 1066 Client: Encrypted packet (len=1000)
  341 8.086832361 192.168.1.16 → 10.6.15.144  SSH 118 Client: Encrypted packet (len=52)
  342 8.092801804  10.6.15.144 → 192.168.1.16 TCP 66 22 → 59298 [ACK] Seq=67077 Ack=21617 Win=1452 Len=0 TSval=6171588 TSecr=5575215
  343 8.092827125 192.168.1.16 → 10.6.15.144  SSH 1030 Client: Encrypted packet (len=964)
  344 8.093648188  10.6.15.144 → 192.168.1.16 TCP 66 22 → 59298 [ACK] Seq=67077 Ack=21881 Win=1452 Len=0 TSval=6171588 TSecr=5575217
  345 8.096613480  10.6.15.144 → 192.168.1.16 TCP 66 22 → 59298 [ACK] Seq=67077 Ack=22933 Win=1452 Len=0 TSval=6171589 TSecr=5575217
  346 8.140538688  10.6.15.144 → 192.168.1.16 TCP 66 22 → 59298 [ACK] Seq=67077 Ack=23897 Win=1452 Len=0 TSval=6171601 TSecr=5575219
  347 8.142785444 192.168.1.16 → 10.6.15.144  SSH 102 Client: Encrypted packet (len=36)
  348 8.143034365 192.168.1.16 → 10.6.15.144  SSH 102 Client: Encrypted packet (len=36)
  349 8.143370987 192.168.1.16 → 10.6.15.144  SSH 102 Client: Encrypted packet (len=36)
  350 8.143583224 192.168.1.16 → 10.6.15.144  SSH 102 Client: Encrypted packet (len=36)
  351 8.144290172  10.6.15.144 → 192.168.1.16 SSH 102 Server: Encrypted packet (len=36)
  352 8.146604891  10.6.15.144 → 192.168.1.16 SSH 138 Server: Encrypted packet (len=72)
  353 8.146695563 192.168.1.16 → 10.6.15.144  TCP 66 59298 → 22 [ACK] Seq=24041 Ack=67185 Win=5703 Len=0 TSval=5575233 TSecr=6171602
  354 8.147117964 192.168.1.16 → 10.6.15.144  SSH 102 Client: Encrypted packet (len=36)
  355 8.148566129 192.168.1.16 → 10.6.15.144  SSH 102 Client: Encrypted packet (len=36)
  356 8.148802100 192.168.1.16 → 10.6.15.144  SSH 102 Client: Encrypted packet (len=36)
  357 8.151619919  10.6.15.144 → 192.168.1.16 TCP 66 22 → 59298 [ACK] Seq=67185 Ack=23933 Win=1452 Len=0 TSval=6171603 TSecr=5575232
  358 8.151635194  10.6.15.144 → 192.168.1.16 TCP 66 22 → 59298 [ACK] Seq=67185 Ack=23969 Win=1452 Len=0 TSval=6171603 TSecr=5575232
  359 8.151638351 192.168.1.16 → 10.6.15.144  SSH 126 Client: Encrypted packet (len=60)
  360 8.152175502  10.6.15.144 → 192.168.1.16 TCP 66 22 → 59298 [ACK] Seq=67185 Ack=24005 Win=1452 Len=0 TSval=6171603 TSecr=5575232
  361 8.152233966 192.168.1.16 → 10.6.15.144  SSH 102 Client: Encrypted packet (len=36)
  362 8.152505646 192.168.1.16 → 10.6.15.144  SSH 134 Client: Encrypted packet (len=68)
  363 8.152938190  10.6.15.144 → 192.168.1.16 TCP 66 22 → 59298 [ACK] Seq=67185 Ack=24041 Win=1452 Len=0 TSval=6171603 TSecr=5575232
  364 8.156510577  10.6.15.144 → 192.168.1.16 TCP 66 22 → 59298 [ACK] Seq=67185 Ack=24077 Win=1452 Len=0 TSval=6171604 TSecr=5575233
  365 8.158186887  10.6.15.144 → 192.168.1.16 TCP 66 22 → 59298 [ACK] Seq=67185 Ack=24113 Win=1452 Len=0 TSval=6171605 TSecr=5575233
  366 8.158313834  10.6.15.144 → 192.168.1.16 TCP 66 22 → 59298 [ACK] Seq=67185 Ack=24149 Win=1452 Len=0 TSval=6171605 TSecr=5575233
  367 8.162709225  10.6.15.144 → 192.168.1.16 TCP 66 22 → 59298 [ACK] Seq=67185 Ack=24209 Win=1452 Len=0 TSval=6171605 TSecr=5575234
  368 8.162842577  10.6.15.144 → 192.168.1.16 TCP 66 22 → 59298 [ACK] Seq=67185 Ack=24245 Win=1452 Len=0 TSval=6171606 TSecr=5575234
  369 8.162853960  10.6.15.144 → 192.168.1.16 TCP 66 22 → 59298 [ACK] Seq=67185 Ack=24313 Win=1452 Len=0 TSval=6171606 TSecr=5575234
  370 8.169259065  10.6.15.144 → 192.168.1.16 SSH 102 Server: Encrypted packet (len=36)
  371 8.203525965  10.6.15.144 → 192.168.1.16 SSH 102 Server: Encrypted packet (len=36)
  372 8.203541394 192.168.1.16 → 10.6.15.144  TCP 66 59298 → 22 [ACK] Seq=24313 Ack=67257 Win=5703 Len=0 TSval=5575247 TSecr=6171606
  373 8.203961635 192.168.1.16 → 10.6.15.144  SSH 158 Client: Encrypted packet (len=92)
  374 8.229191408  10.6.15.144 → 192.168.1.16 SSH 102 Server: Encrypted packet (len=36)
