    1 0.000000000  10.6.15.144 → 192.168.1.16 SSH 414 Server: Encrypted packet (len=336)
    2 0.000027656  10.6.15.144 → 192.168.1.16 TCP 78 [TCP Dup ACK 1#1] 22 → 59298 [ACK] Seq=337 Ack=1 Win=1452 Len=0 TSval=3622688 TSecr=3026339 SLE=685 SRE=2325
    3 0.000038143 192.168.1.16 → 10.6.15.144  SSH 750 Client: Encrypted packet (len=684)
    4 0.005129382  10.6.15.144 → 192.168.1.16 TCP 66 [TCP ACKed unseen segment] 22 → 59298 [ACK] Seq=337 Ack=2325 Win=1441 Len=0 TSval=3622689 TSecr=3026372
    5 0.005151109 192.168.1.16 → 10.6.15.144  SSH 174 Client: [TCP Previous segment not captured] , Encrypted packet (len=108)
    6 0.015871175  10.6.15.144 → 192.168.1.16 SSH 238 Server: [TCP ACKed unseen segment] , Encrypted packet (len=172)
    7 0.016138103 192.168.1.16 → 10.6.15.144  SSH 134 Client: Encrypted packet (len=68)
    8 0.028558670  10.6.15.144 → 192.168.1.16 SSH 182 Server: Encrypted packet (len=116)
    9 0.028585744  10.6.15.144 → 192.168.1.16 SSH 330 Server: Encrypted packet (len=264)
   10 0.028647119 192.168.1.16 → 10.6.15.144  TCP 66 59298 → 22 [ACK] Seq=2501 Ack=889 Win=1494 Len=0 TSval=3026379 TSecr=3622691
   11 0.028889329 192.168.1.16 → 10.6.15.144  SSH 134 Client: Encrypted packet (len=68)
   12 0.030443194  10.6.15.144 → 192.168.1.16 SSH 182 Server: Encrypted packet (len=116)
   13 0.030452893 192.168.1.16 → 10.6.15.144  SSH 202 Client: Encrypted packet (len=136)
   14 0.063443211 192.168.1.16 → 10.6.15.144  SSH 134 Client: Encrypted packet (len=68)
   15 0.154725506  10.6.15.144 → 192.168.1.16 TCP 78 [TCP Dup ACK 12#1] 22 → 59298 [ACK] Seq=1005 Ack=2501 Win=1452 Len=0 TSval=3622726 TSecr=3026376 SLE=2705 SRE=2773
   16 0.169057352  10.6.15.144 → 192.168.1.16 SSH 242 Server: Encrypted packet (len=164)
   17 0.169171385  10.6.15.144 → 192.168.1.16 SSH 194 Server: Encrypted packet (len=116)
   18 0.169192004 192.168.1.16 → 10.6.15.144  TCP 66 59298 → 22 [ACK] Seq=2773 Ack=1285 Win=1494 Len=0 TSval=3026414 TSecr=3622729
   19 0.169697963  10.6.15.144 → 192.168.1.16 SSH 194 Server: Encrypted packet (len=116)
   20 0.211439562 192.168.1.16 → 10.6.15.144  TCP 66 59298 → 22 [ACK] Seq=2773 Ack=1401 Win=1494 Len=0 TSval=3026425 TSecr=3622730
   21 0.225652700  10.6.15.144 → 192.168.1.16 SSH 1514 Server: Encrypted packet (len=1436)
   22 0.225737458 192.168.1.16 → 10.6.15.144  TCP 66 59298 → 22 [ACK] Seq=2773 Ack=2837 Win=1494 Len=0 TSval=3026428 TSecr=3622745
   23 0.225834150  10.6.15.144 → 192.168.1.16 SSH 1514 Server: Encrypted packet (len=1436)
   24 0.226107741  10.6.15.144 → 192.168.1.16 SSH 1018 Server: Encrypted packet (len=940)
   25 0.226119142 192.168.1.16 → 10.6.15.144  TCP 66 59298 → 22 [ACK] Seq=2773 Ack=5213 Win=1494 Len=0 TSval=3026428 TSecr=3622745
   26 0.229536889  10.6.15.144 → 192.168.1.16 SSH 622 Server: Encrypted packet (len=544)
   27 0.229618969 192.168.1.16 → 10.6.15.144  TCP 66 59298 → 22 [ACK] Seq=2773 Ack=5757 Win=1494 Len=0 TSval=3026429 TSecr=3622746
   28 0.283469524 192.168.1.16 → 10.6.15.144  TCP 270 [TCP Retransmission] 59298 → 22 [PSH, ACK] Seq=2501 Ack=5757 Win=1494 Len=204 TSval=3026443 TSecr=3622746
   29 0.285860452  10.6.15.144 → 192.168.1.16 TCP 66 22 → 59298 [ACK] Seq=5757 Ack=2773 Win=1451 Len=0 TSval=3622760 TSecr=3026443
   30 0.285881825 192.168.1.16 → 10.6.15.144  SSH 558 Client: Encrypted packet (len=492)
   31 0.288686119  10.6.15.144 → 192.168.1.16 TCP 66 22 → 59298 [ACK] Seq=5757 Ack=3265 Win=1452 Len=0 TSval=3622761 TSecr=3026443
   32 1.331533044  10.6.15.144 → 192.168.1.16 SSH 142 Server: Encrypted packet (len=76)
   33 1.331553663 192.168.1.16 → 10.6.15.144  TCP 66 59298 → 22 [ACK] Seq=3265 Ack=5833 Win=1494 Len=0 TSval=3026705 TSecr=3622816
   34 1.331649247  10.6.15.144 → 192.168.1.16 SSH 142 Server: Encrypted packet (len=76)
   35 1.331652768 192.168.1.16 → 10.6.15.144  TCP 66 59298 → 22 [ACK] Seq=3265 Ack=5909 Win=1494 Len=0 TSval=3026705 TSecr=3622816
   36 1.331678455  10.6.15.144 → 192.168.1.16 SSH 142 Server: [TCP Spurious Retransmission] , Encrypted packet (len=76)
   37 1.331681342 192.168.1.16 → 10.6.15.144  TCP 78 [TCP Dup ACK 35#1] 59298 → 22 [ACK] Seq=3265 Ack=5909 Win=1494 Len=0 TSval=3026705 TSecr=3622848 SLE=5833 SRE=5909
   38 1.331695041  10.6.15.144 → 192.168.1.16 SSH 102 Server: Encrypted packet (len=36)
   39 1.331697911 192.168.1.16 → 10.6.15.144  TCP 66 59298 → 22 [ACK] Seq=3265 Ack=5945 Win=1494 Len=0 TSval=3026705 TSecr=3622877
   40 1.337728462  10.6.15.144 → 192.168.1.16 SSH 1514 Server: Encrypted packet (len=1448)
   41 1.337747288 192.168.1.16 → 10.6.15.144  TCP 66 59298 → 22 [ACK] Seq=3265 Ack=7393 Win=1494 Len=0 TSval=3026706 TSecr=3623022
   42 1.337909884  10.6.15.144 → 192.168.1.16 SSH 1514 Server: Encrypted packet (len=1448)
   43 1.337919519 192.168.1.16 → 10.6.15.144  TCP 66 59298 → 22 [ACK] Seq=3265 Ack=8841 Win=1494 Len=0 TSval=3026706 TSecr=3623022
   44 1.338142568  10.6.15.144 → 192.168.1.16 SSH 1514 Server: Encrypted packet (len=1448)
   45 1.338162273 192.168.1.16 → 10.6.15.144  TCP 66 59298 → 22 [ACK] Seq=3265 Ack=10289 Win=1494 Len=0 TSval=3026706 TSecr=3623022
   46 1.342872835  10.6.15.144 → 192.168.1.16 SSH 1514 Server: Encrypted packet (len=1448)
   47 1.342889316 192.168.1.16 → 10.6.15.144  TCP 66 59298 → 22 [ACK] Seq=3265 Ack=11737 Win=1494 Len=0 TSval=3026707 TSecr=3623024
   48 1.343077290  10.6.15.144 → 192.168.1.16 SSH 1514 Server: Encrypted packet (len=1448)
   49 1.343084808 192.168.1.16 → 10.6.15.144  TCP 66 59298 → 22 [ACK] Seq=3265 Ack=13185 Win=1494 Len=0 TSval=3026707 TSecr=3623024
   50 1.343439771  10.6.15.144 → 192.168.1.16 SSH 1514 Server: Encrypted packet (len=1448)
   51 1.343447838 192.168.1.16 → 10.6.15.144  TCP 66 59298 → 22 [ACK] Seq=3265 Ack=14633 Win=1494 Len=0 TSval=3026708 TSecr=3623024
   52 1.347098525  10.6.15.144 → 192.168.1.16 SSH 1514 Server: Encrypted packet (len=1448)
   53 1.347120961 192.168.1.16 → 10.6.15.144  TCP 66 59298 → 22 [ACK] Seq=3265 Ack=16081 Win=1494 Len=0 TSval=3026708 TSecr=3623025
   54 1.347425578  10.6.15.144 → 192.168.1.16 SSH 1514 Server: Encrypted packet (len=1448)
   55 1.347434023 192.168.1.16 → 10.6.15.144  TCP 66 59298 → 22 [ACK] Seq=3265 Ack=17529 Win=1494 Len=0 TSval=3026709 TSecr=3623025
   56 1.347638368  10.6.15.144 → 192.168.1.16 SSH 1514 Server: Encrypted packet (len=1448)
   57 1.347645456 192.168.1.16 → 10.6.15.144  TCP 66 59298 → 22 [ACK] Seq=3265 Ack=18977 Win=1494 Len=0 TSval=3026709 TSecr=3623025
   58 1.350332113  10.6.15.144 → 192.168.1.16 SSH 1514 Server: Encrypted packet (len=1448)
   59 1.350354839 192.168.1.16 → 10.6.15.144  TCP 66 59298 → 22 [ACK] Seq=3265 Ack=20425 Win=1494 Len=0 TSval=3026709 TSecr=3623026
   60 1.350532016  10.6.15.144 → 192.168.1.16 SSH 1514 Server: Encrypted packet (len=1448)
   61 1.350537420 192.168.1.16 → 10.6.15.144  TCP 66 59298 → 22 [ACK] Seq=3265 Ack=21873 Win=1494 Len=0 TSval=3026709 TSecr=3623026
   62 1.350898754  10.6.15.144 → 192.168.1.16 SSH 1514 Server: Encrypted packet (len=1448)
   63 1.350906036 192.168.1.16 → 10.6.15.144  TCP 66 59298 → 22 [ACK] Seq=3265 Ack=23321 Win=1494 Len=0 TSval=3026709 TSecr=3623026
   64 1.354680379  10.6.15.144 → 192.168.1.16 SSH 1514 Server: Encrypted packet (len=1448)
   65 1.354697958 192.168.1.16 → 10.6.15.144  TCP 66 59298 → 22 [ACK] Seq=3265 Ack=24769 Win=1494 Len=0 TSval=3026710 TSecr=3623027
   66 1.354884556  10.6.15.144 → 192.168.1.16 SSH 1514 Server: Encrypted packet (len=1448)
   67 1.354889597 192.168.1.16 → 10.6.15.144  TCP 66 59298 → 22 [ACK] Seq=3265 Ack=26217 Win=1494 Len=0 TSval=3026710 TSecr=3623027
   68 1.355248786  10.6.15.144 → 192.168.1.16 SSH 1514 Server: Encrypted packet (len=1448)
   69 1.359448510  10.6.15.144 → 192.168.1.16 SSH 1514 Server: Encrypted packet (len=1448)
   70 1.359464714 192.168.1.16 → 10.6.15.144  TCP 66 59298 → 22 [ACK] Seq=3265 Ack=29113 Win=1494 Len=0 TSval=3026712 TSecr=3623027
   71 1.359652920  10.6.15.144 → 192.168.1.16 SSH 1514 Server: Encrypted packet (len=1448)
   72 1.364347170  10.6.15.144 → 192.168.1.16 SSH 1514 Server: Encrypted packet (len=1448)
   73 1.364368439 192.168.1.16 → 10.6.15.144  TCP 66 59298 → 22 [ACK] Seq=3265 Ack=32009 Win=1494 Len=0 TSval=3026713 TSecr=3623028
   74 1.364549494  10.6.15.144 → 192.168.1.16 SSH 1514 Server: Encrypted packet (len=1448)
   75 1.370294797  10.6.15.144 → 192.168.1.16 SSH 1514 Server: Encrypted packet (len=1448)
   76 1.370312503 192.168.1.16 → 10.6.15.144  TCP 66 59298 → 22 [ACK] Seq=3265 Ack=34905 Win=1494 Len=0 TSval=3026714 TSecr=3623029
   77 1.370500129  10.6.15.144 → 192.168.1.16 SSH 1514 Server: Encrypted packet (len=1448)
   78 1.376408115  10.6.15.144 → 192.168.1.16 SSH 1514 Server: Encrypted packet (len=1448)
   79 1.376428404 192.168.1.16 → 10.6.15.144  TCP 66 59298 → 22 [ACK] Seq=3265 Ack=37801 Win=1494 Len=0 TSval=3026716 TSecr=3623030
   80 1.376610119  10.6.15.144 → 192.168.1.16 SSH 1514 Server: Encrypted packet (len=1448)
   81 1.376822780  10.6.15.144 → 192.168.1.16 SSH 1514 Server: Encrypted packet (len=1448)
   82 1.376827901 192.168.1.16 → 10.6.15.144  TCP 66 59298 → 22 [ACK] Seq=3265 Ack=40697 Win=1494 Len=0 TSval=3026716 TSecr=3623032
   83 1.383607205  10.6.15.144 → 192.168.1.16 SSH 1502 Server: Encrypted packet (len=1436)
   84 1.383706711 192.168.1.16 → 10.6.15.144  TCP 66 59298 → 22 [ACK] Seq=3265 Ack=42133 Win=1494 Len=0 TSval=3026718 TSecr=3623033
   85 1.478045053 192.168.1.16 → 10.6.15.144  SSH 646 Client: Encrypted packet (len=580)
   86 1.480174239  10.6.15.144 → 192.168.1.16 TCP 66 22 → 59298 [ACK] Seq=42133 Ack=3845 Win=1452 Len=0 TSval=3623059 TSecr=3026741
   87 1.486027555  10.6.15.144 → 192.168.1.16 SSH 510 Server: Encrypted packet (len=444)
   88 1.486093708 192.168.1.16 → 10.6.15.144  TCP 66 59298 → 22 [ACK] Seq=3845 Ack=42577 Win=1494 Len=0 TSval=3026743 TSecr=3623060
   89 1.501784448 192.168.1.16 → 10.6.15.144  SSH 646 Client: Encrypted packet (len=580)
   90 1.513259037  10.6.15.144 → 192.168.1.16 SSH 510 Server: Encrypted packet (len=444)
   91 1.555415282 192.168.1.16 → 10.6.15.144  TCP 66 59298 → 22 [ACK] Seq=4425 Ack=43021 Win=1494 Len=0 TSval=3026761 TSecr=3623066
   92 1.569191990 192.168.1.16 → 10.6.15.144  SSH 646 Client: Encrypted packet (len=580)
   93 1.576143470  10.6.15.144 → 192.168.1.16 SSH 510 Server: Encrypted packet (len=444)
   94 1.576213350 192.168.1.16 → 10.6.15.144  TCP 66 59298 → 22 [ACK] Seq=5005 Ack=43465 Win=1494 Len=0 TSval=3026766 TSecr=3623083
   95 1.595926026 192.168.1.16 → 10.6.15.144  SSH 166 Client: Encrypted packet (len=100)
   96 1.635352999  10.6.15.144 → 192.168.1.16 TCP 66 22 → 59298 [ACK] Seq=43465 Ack=5105 Win=1452 Len=0 TSval=3623098 TSecr=3026771
   97 1.700802335 192.168.1.16 → 10.6.15.144  SSH 606 Client: Encrypted packet (len=540)
   98 1.702703000  10.6.15.144 → 192.168.1.16 TCP 66 22 → 59298 [ACK] Seq=43465 Ack=5645 Win=1452 Len=0 TSval=3623114 TSecr=3026797
   99 1.706423637 192.168.1.16 → 10.6.15.144  SSH 574 Client: Encrypted packet (len=508)
  100 1.707137607 192.168.1.16 → 10.6.15.144  SSH 606 Client: Encrypted packet (len=540)
  101 1.708427937  10.6.15.144 → 192.168.1.16 TCP 66 22 → 59298 [ACK] Seq=43465 Ack=6153 Win=1452 Len=0 TSval=3623116 TSecr=3026798
  102 1.708446841 192.168.1.16 → 10.6.15.144  SSH 102 Client: Encrypted packet (len=36)
  103 1.710503008  10.6.15.144 → 192.168.1.16 SSH 1514 Server: Encrypted packet (len=1448)
  104 1.710815536  10.6.15.144 → 192.168.1.16 SSH 1514 Server: Encrypted packet (len=1448)
  105 1.710829601 192.168.1.16 → 10.6.15.144  TCP 66 59298 → 22 [ACK] Seq=6729 Ack=46361 Win=1494 Len=0 TSval=3026799 TSecr=3623116
  106 1.710925444  10.6.15.144 → 192.168.1.16 SSH 110 Server: Encrypted packet (len=44)
  107 1.711449555  10.6.15.144 → 192.168.1.16 SSH 1514 Server: Encrypted packet (len=1448)
  108 1.711461867 192.168.1.16 → 10.6.15.144  TCP 66 59298 → 22 [ACK] Seq=6729 Ack=47853 Win=1494 Len=0 TSval=3026800 TSecr=3623116
  109 1.711659255  10.6.15.144 → 192.168.1.16 SSH 1514 Server: Encrypted packet (len=1448)
  110 1.711668486  10.6.15.144 → 192.168.1.16 TCP 66 22 → 59298 [ACK] Seq=49301 Ack=6729 Win=1452 Len=0 TSval=3623116 TSecr=3026798
  111 1.711675937 192.168.1.16 → 10.6.15.144  SSH 102 Client: Encrypted packet (len=36)
  112 1.713914464  10.6.15.144 → 192.168.1.16 SSH 1514 Server: Encrypted packet (len=1448)
  113 1.714117860  10.6.15.144 → 192.168.1.16 SSH 1514 Server: Encrypted packet (len=1448)
  114 1.714124815 192.168.1.16 → 10.6.15.144  TCP 66 59298 → 22 [ACK] Seq=6765 Ack=52197 Win=1494 Len=0 TSval=3026800 TSecr=3623117
  115 1.714272227  10.6.15.144 → 192.168.1.16 SSH 230 Server: Encrypted packet (len=164)
  116 1.714649256  10.6.15.144 → 192.168.1.16 SSH 1514 Server: Encrypted packet (len=1448)
  117 1.714664598 192.168.1.16 → 10.6.15.144  TCP 66 59298 → 22 [ACK] Seq=6765 Ack=53809 Win=1494 Len=0 TSval=3026800 TSecr=3623117
  118 1.714981583  10.6.15.144 → 192.168.1.16 SSH 1514 Server: Encrypted packet (len=1448)
  119 1.717785855  10.6.15.144 → 192.168.1.16 SSH 1514 Server: Encrypted packet (len=1448)
  120 1.717800921 192.168.1.16 → 10.6.15.144  TCP 66 59298 → 22 [ACK] Seq=6765 Ack=56705 Win=1494 Len=0 TSval=3026801 TSecr=3623117
  121 1.717823314 192.168.1.16 → 10.6.15.144  SSH 606 Client: Encrypted packet (len=540)
  122 1.717989641  10.6.15.144 → 192.168.1.16 SSH 1514 Server: Encrypted packet (len=1448)
  123 1.718204914  10.6.15.144 → 192.168.1.16 SSH 1514 Server: Encrypted packet (len=1448)
  124 1.718213473 192.168.1.16 → 10.6.15.144  TCP 66 59298 → 22 [ACK] Seq=7305 Ack=59601 Win=1494 Len=0 TSval=3026801 TSecr=3623118
  125 1.718333220  10.6.15.144 → 192.168.1.16 SSH 1022 Server: Encrypted packet (len=956)
  126 1.721211826  10.6.15.144 → 192.168.1.16 SSH 1514 Server: Encrypted packet (len=1448)
  127 1.721235374 192.168.1.16 → 10.6.15.144  TCP 66 59298 → 22 [ACK] Seq=7305 Ack=62005 Win=1494 Len=0 TSval=3026802 TSecr=3623118
  128 1.721416075  10.6.15.144 → 192.168.1.16 SSH 1514 Server: Encrypted packet (len=1448)
  129 1.721628660  10.6.15.144 → 192.168.1.16 SSH 1514 Server: Encrypted packet (len=1448)
  130 1.721643331 192.168.1.16 → 10.6.15.144  TCP 66 59298 → 22 [ACK] Seq=7305 Ack=64901 Win=1494 Len=0 TSval=3026802 TSecr=3623119
  131 1.721840518  10.6.15.144 → 192.168.1.16 SSH 1514 Server: Encrypted packet (len=1448)
  132 1.725566147  10.6.15.144 → 192.168.1.16 SSH 1514 Server: Encrypted packet (len=1448)
  133 1.725588178 192.168.1.16 → 10.6.15.144  TCP 66 59298 → 22 [ACK] Seq=7305 Ack=67797 Win=1494 Len=0 TSval=3026803 TSecr=3623119
  134 1.725766939  10.6.15.144 → 192.168.1.16 SSH 1514 Server: Encrypted packet (len=1448)
  135 1.725901122  10.6.15.144 → 192.168.1.16 SSH 122 Server: Encrypted packet (len=56)
  136 1.725905895 192.168.1.16 → 10.6.15.144  TCP 66 59298 → 22 [ACK] Seq=7305 Ack=69301 Win=1494 Len=0 TSval=3026803 TSecr=3623120
  137 1.727868585 192.168.1.16 → 10.6.15.144  SSH 158 Client: Encrypted packet (len=92)
  138 1.728022786  10.6.15.144 → 192.168.1.16 SSH 1514 Server: Encrypted packet (len=1448)
  139 1.728353657  10.6.15.144 → 192.168.1.16 SSH 1514 Server: Encrypted packet (len=1448)
  140 1.728363427 192.168.1.16 → 10.6.15.144  TCP 66 59298 → 22 [ACK] Seq=7397 Ack=72197 Win=1494 Len=0 TSval=3026804 TSecr=3623120
  141 1.729059707  10.6.15.144 → 192.168.1.16 SSH 1514 Server: Encrypted packet (len=1448)
  142 1.729272804  10.6.15.144 → 192.168.1.16 SSH 1514 Server: Encrypted packet (len=1448)
  143 1.729281846 192.168.1.16 → 10.6.15.144  TCP 66 59298 → 22 [ACK] Seq=7397 Ack=75093 Win=1494 Len=0 TSval=3026804 TSecr=3623121
  144 1.729298103  10.6.15.144 → 192.168.1.16 SSH 154 Server: Encrypted packet (len=88)
  145 1.732092220  10.6.15.144 → 192.168.1.16 SSH 1514 Server: Encrypted packet (len=1448)
  146 1.732114969 192.168.1.16 → 10.6.15.144  TCP 66 59298 → 22 [ACK] Seq=7397 Ack=76629 Win=1494 Len=0 TSval=3026805 TSecr=3623121
  147 1.732295117  10.6.15.144 → 192.168.1.16 SSH 1514 Server: Encrypted packet (len=1448)
  148 1.732428038  10.6.15.144 → 192.168.1.16 SSH 110 Server: Encrypted packet (len=44)
  149 1.732434825 192.168.1.16 → 10.6.15.144  TCP 66 59298 → 22 [ACK] Seq=7397 Ack=78121 Win=1494 Len=0 TSval=3026805 TSecr=3623122
  150 1.735215122  10.6.15.144 → 192.168.1.16 SSH 262 Server: Encrypted packet (len=196)
  151 1.735921248 192.168.1.16 → 10.6.15.144  SSH 134 Client: Encrypted packet (len=68)
  152 1.736952018  10.6.15.144 → 192.168.1.16 SSH 1514 Server: Encrypted packet (len=1448)
  153 1.737160290  10.6.15.144 → 192.168.1.16 SSH 1514 Server: Encrypted packet (len=1448)
  154 1.737173243 192.168.1.16 → 10.6.15.144  TCP 66 59298 → 22 [ACK] Seq=7465 Ack=81213 Win=1494 Len=0 TSval=3026806 TSecr=3623123
  155 1.737293088  10.6.15.144 → 192.168.1.16 SSH 110 Server: Encrypted packet (len=44)
  156 1.739204828  10.6.15.144 → 192.168.1.16 SSH 422 Server: Encrypted packet (len=356)
  157 1.739269766 192.168.1.16 → 10.6.15.144  TCP 66 59298 → 22 [ACK] Seq=7465 Ack=81613 Win=1494 Len=0 TSval=3026806 TSecr=3623123
  158 1.820034791  10.6.15.144 → 192.168.1.16 SSH 374 Server: Encrypted packet (len=308)
  159 1.831452034 192.168.1.16 → 10.6.15.144  SSH 134 Client: Encrypted packet (len=68)
  160 1.878830934  10.6.15.144 → 192.168.1.16 TCP 66 22 → 59298 [ACK] Seq=81921 Ack=7533 Win=1452 Len=0 TSval=3623157 TSecr=3026830
  161 1.940298634 192.168.1.16 → 10.6.15.144  SSH 1046 Client: Encrypted packet (len=980)
  162 1.949476627 192.168.1.16 → 10.6.15.144  SSH 102 Client: Encrypted packet (len=36)
  163 1.952002143  10.6.15.144 → 192.168.1.16 TCP 66 22 → 59298 [ACK] Seq=81921 Ack=8549 Win=1452 Len=0 TSval=3623177 TSecr=3026857
  164 1.952020438 192.168.1.16 → 10.6.15.144  SSH 758 Client: Encrypted packet (len=692)
  165 1.954224872  10.6.15.144 → 192.168.1.16 TCP 66 22 → 59298 [ACK] Seq=81921 Ack=9241 Win=1452 Len=0 TSval=3623177 TSecr=3026860
  166 1.979156015  10.6.15.144 → 192.168.1.16 SSH 110 Server: Encrypted packet (len=44)
  167 1.979536189 192.168.1.16 → 10.6.15.144  SSH 406 Client: Encrypted packet (len=340)
  168 1.991790400  10.6.15.144 → 192.168.1.16 SSH 282 Server: Encrypted packet (len=216)
  169 1.992107935 192.168.1.16 → 10.6.15.144  SSH 174 Client: Encrypted packet (len=108)
  170 2.006506969  10.6.15.144 → 192.168.1.16 SSH 238 Server: Encrypted packet (len=172)
  171 2.006780731 192.168.1.16 → 10.6.15.144  SSH 134 Client: Encrypted packet (len=68)
  172 2.023124425  10.6.15.144 → 192.168.1.16 SSH 102 Server: Encrypted packet (len=36)
  173 2.023595258  10.6.15.144 → 192.168.1.16 SSH 102 Server: Encrypted packet (len=36)
  174 2.023637222 192.168.1.16 → 10.6.15.144  TCP 66 59298 → 22 [ACK] Seq=9757 Ack=82425 Win=1494 Len=0 TSval=3026878 TSecr=3623195
  175 2.024363703  10.6.15.144 → 192.168.1.16 SSH 102 Server: Encrypted packet (len=36)
  176 2.025646873  10.6.15.144 → 192.168.1.16 SSH 102 Server: Encrypted packet (len=36)
  177 2.025699735 192.168.1.16 → 10.6.15.144  TCP 66 59298 → 22 [ACK] Seq=9757 Ack=82497 Win=1494 Len=0 TSval=3026878 TSecr=3623195
  178 2.033730942  10.6.15.144 → 192.168.1.16 SSH 182 Server: Encrypted packet (len=116)
  179 2.055543700  10.6.15.144 → 192.168.1.16 SSH 126 Server: Encrypted packet (len=60)
  180 2.055604255 192.168.1.16 → 10.6.15.144  TCP 66 59298 → 22 [ACK] Seq=9757 Ack=82673 Win=1494 Len=0 TSval=3026886 TSecr=3623197
  181 2.055981436  10.6.15.144 → 192.168.1.16 SSH 102 Server: Encrypted packet (len=36)
  182 2.057589553  10.6.15.144 → 192.168.1.16 SSH 102 Server: Encrypted packet (len=36)
  183 2.057658179 192.168.1.16 → 10.6.15.144  TCP 66 59298 → 22 [ACK] Seq=9757 Ack=82745 Win=1494 Len=0 TSval=3026886 TSecr=3623203
  184 2.057983798 192.168.1.16 → 10.6.15.144  SSH 382 Client: Encrypted packet (len=316)
  185 2.098394479  10.6.15.144 → 192.168.1.16 SSH 102 Server: Encrypted packet (len=36)
  186 2.098766117 192.168.1.16 → 10.6.15.144  SSH 174 Client: Encrypted packet (len=108)
  187 2.110180795  10.6.15.144 → 192.168.1.16 SSH 138 Server: Encrypted packet (len=72)
  188 2.110370217 192.168.1.16 → 10.6.15.144  SSH 102 Client: Encrypted packet (len=36)
  189 2.112660814  10.6.15.144 → 192.168.1.16 SSH 138 Server: Encrypted packet (len=72)
  190 2.112828069 192.168.1.16 → 10.6.15.144  SSH 102 Client: Encrypted packet (len=36)
  191 2.140186200  10.6.15.144 → 192.168.1.16 SSH 1514 Server: Encrypted packet (len=1448)
  192 2.140352848  10.6.15.144 → 192.168.1.16 SSH 1270 Server: Encrypted packet (len=1204)
  193 2.140364076 192.168.1.16 → 10.6.15.144  TCP 66 59298 → 22 [ACK] Seq=10253 Ack=85577 Win=1494 Len=0 TSval=3026907 TSecr=3623224
  194 2.141853035 192.168.1.16 → 10.6.15.144  SSH 206 Client: Encrypted packet (len=140)
  195 2.164857576  10.6.15.144 → 192.168.1.16 SSH 1422 Server: Encrypted packet (len=1356)
  196 2.165160448  10.6.15.144 → 192.168.1.16 SSH 1486 Server: Encrypted packet (len=1420)
  197 2.165166605 192.168.1.16 → 10.6.15.144  TCP 66 59298 → 22 [ACK] Seq=10393 Ack=88353 Win=1494 Len=0 TSval=3026913 TSecr=3623230
  198 2.166538293 192.168.1.16 → 10.6.15.144  SSH 206 Client: Encrypted packet (len=140)
  199 2.168257930  10.6.15.144 → 192.168.1.16 SSH 638 Server: Encrypted packet (len=572)
  200 2.171577970  10.6.15.144 → 192.168.1.16 SSH 138 Server: Encrypted packet (len=72)
  201 2.171662475 192.168.1.16 → 10.6.15.144  TCP 66 59298 → 22 [ACK] Seq=10533 Ack=88997 Win=1494 Len=0 TSval=3026915 TSecr=3623231
  202 2.171773247  10.6.15.144 → 192.168.1.16 SSH 518 Server: Encrypted packet (len=452)
  203 2.171913446 192.168.1.16 → 10.6.15.144  SSH 102 Client: Encrypted packet (len=36)
  204 2.172260776 192.168.1.16 → 10.6.15.144  SSH 102 Client: Encrypted packet (len=36)
  205 2.172382314  10.6.15.144 → 192.168.1.16 SSH 138 Server: Encrypted packet (len=72)
  206 2.172848988 192.168.1.16 → 10.6.15.144  SSH 102 Client: Encrypted packet (len=36)
  207 2.174809181  10.6.15.144 → 192.168.1.16 SSH 138 Server: Encrypted packet (len=72)
  208 2.175018480 192.168.1.16 → 10.6.15.144  SSH 102 Client: Encrypted packet (len=36)
  209 2.175946573  10.6.15.144 → 192.168.1.16 TCP 66 22 → 59298 [ACK] Seq=89593 Ack=10605 Win=1452 Len=0 TSval=3623232 TSecr=3026915
  210 2.178572007  10.6.15.144 → 192.168.1.16 TCP 66 22 → 59298 [ACK] Seq=89593 Ack=10677 Win=1452 Len=0 TSval=3623233 TSecr=3026915
  211 2.261450961 192.168.1.16 → 10.6.15.144  SSH 102 Client: Encrypted packet (len=36)
  212 2.261730209 192.168.1.16 → 10.6.15.144  SSH 102 Client: Encrypted packet (len=36)
  213 2.263168626 192.168.1.16 → 10.6.15.144  SSH 1006 Client: Encrypted packet (len=940)
  214 2.263810429  10.6.15.144 → 192.168.1.16 TCP 66 22 → 59298 [ACK] Seq=89593 Ack=10749 Win=1452 Len=0 TSval=3623255 TSecr=3026937
  215 2.271075046  10.6.15.144 → 192.168.1.16 SSH 342 Server: Encrypted packet (len=276)
  216 2.285674961 192.168.1.16 → 10.6.15.144  SSH 326 Client: Encrypted packet (len=260)
  217 2.298903194 192.168.1.16 → 10.6.15.144  SSH 102 Client: Encrypted packet (len=36)
  218 2.299257701 192.168.1.16 → 10.6.15.144  SSH 422 Client: Encrypted packet (len=356)
  219 2.299550236 192.168.1.16 → 10.6.15.144  SSH 102 Client: Encrypted packet (len=36)
  220 2.303089682  10.6.15.144 → 192.168.1.16 TCP 66 22 → 59298 [ACK] Seq=89869 Ack=11985 Win=1452 Len=0 TSval=3623264 TSecr=3026943
  221 2.303107448  10.6.15.144 → 192.168.1.16 SSH 110 Server: Encrypted packet (len=44)
  222 2.303272092  10.6.15.144 → 192.168.1.16 TCP 66 22 → 59298 [ACK] Seq=89913 Ack=12377 Win=1452 Len=0 TSval=3623264 TSecr=3026946
  223 2.303379088 192.168.1.16 → 10.6.15.144  SSH 302 Client: Encrypted packet (len=236)
  224 2.337211537  10.6.15.144 → 192.168.1.16 SSH 102 Server: Encrypted packet (len=36)
  225 2.337596129 192.168.1.16 → 10.6.15.144  SSH 398 Client: Encrypted packet (len=332)
  226 2.351146115  10.6.15.144 → 192.168.1.16 SSH 246 Server: Encrypted packet (len=180)
  227 2.391417145 192.168.1.16 → 10.6.15.144  TCP 66 59298 → 22 [ACK] Seq=12945 Ack=90129 Win=1494 Len=0 TSval=3026970 TSecr=3623275
  228 2.396122131 192.168.1.16 → 10.6.15.144  SSH 1214 Client: Encrypted packet (len=1148)
  229 2.396682471 192.168.1.16 → 10.6.15.144  SSH 102 Client: Encrypted packet (len=36)
  230 2.396864594 192.168.1.16 → 10.6.15.144  SSH 102 Client: Encrypted packet (len=36)
  231 2.403570778  10.6.15.144 → 192.168.1.16 TCP 66 22 → 59298 [ACK] Seq=90129 Ack=14129 Win=1452 Len=0 TSval=3623288 TSecr=3026971
  232 2.440528269  10.6.15.144 → 192.168.1.16 TCP 66 22 → 59298 [ACK] Seq=90129 Ack=14165 Win=1452 Len=0 TSval=3623298 TSecr=3026971
  233 2.441018475  10.6.15.144 → 192.168.1.16 SSH 138 Server: Encrypted packet (len=72)
  234 2.441071854 192.168.1.16 → 10.6.15.144  TCP 66 59298 → 22 [ACK] Seq=14165 Ack=90201 Win=1494 Len=0 TSval=3026982 TSecr=3623298
  235 2.441207524 192.168.1.16 → 10.6.15.144  SSH 102 Client: Encrypted packet (len=36)
  236 2.448462488  10.6.15.144 → 192.168.1.16 TCP 66 22 → 59298 [ACK] Seq=90201 Ack=14201 Win=1452 Len=0 TSval=3623299 TSecr=3026982
  237 2.464120327 10.22.18.209 → 224.0.0.252  LLMNR 64 Standard query 0x72dd A wpad
  238 2.483756900  10.6.15.144 → 192.168.1.16 SSH 138 Server: Encrypted packet (len=72)
  239 2.483968586 192.168.1.16 → 10.6.15.144  SSH 102 Client: Encrypted packet (len=36)
  240 2.486897612  10.6.15.144 → 192.168.1.16 TCP 66 22 → 59298 [ACK] Seq=90273 Ack=14237 Win=1452 Len=0 TSval=3623310 TSecr=3026993
  241 2.490817323  10.6.15.144 → 192.168.1.16 SSH 694 Server: Encrypted packet (len=628)
  242 2.516993263  10.6.15.144 → 192.168.1.16 SSH 102 Server: Encrypted packet (len=36)
  243 2.517065047 192.168.1.16 → 10.6.15.144  TCP 66 59298 → 22 [ACK] Seq=14237 Ack=90937 Win=1494 Len=0 TSval=3027001 TSecr=3623311
  244 2.517393767 192.168.1.16 → 10.6.15.144  SSH 118 Client: Encrypted packet (len=52)
  245 2.517589712 192.168.1.16 → 10.6.15.144  SSH 110 Client: Encrypted packet (len=44)
  246 2.521170654  10.6.15.144 → 192.168.1.16 TCP 66 22 → 59298 [ACK] Seq=90937 Ack=14333 Win=1452 Len=0 TSval=3623319 TSecr=3027001
  247 2.525061649  10.6.15.144 → 192.168.1.16 SSH 822 Server: Encrypted packet (len=756)
  248 2.525079456  10.6.15.144 → 192.168.1.16 SSH 222 Server: Encrypted packet (len=156)
  249 2.525141740 192.168.1.16 → 10.6.15.144  TCP 66 59298 → 22 [ACK] Seq=14333 Ack=91849 Win=1494 Len=0 TSval=3027003 TSecr=3623320
  250 2.542847993  10.6.15.144 → 192.168.1.16 SSH 1514 Server: Encrypted packet (len=1448)
  251 2.543004695  10.6.15.144 → 192.168.1.16 SSH 1246 Server: Encrypted packet (len=1180)
  252 2.543014973 192.168.1.16 → 10.6.15.144  TCP 66 59298 → 22 [ACK] Seq=14333 Ack=94477 Win=1494 Len=0 TSval=3027007 TSecr=3623324
  253 2.565107974 10.22.18.209 → 224.0.0.252  LLMNR 64 Standard query 0x72dd A wpad
  254 2.619962566  10.6.15.144 → 192.168.1.16 SSH 110 Server: Encrypted packet (len=44)
  255 2.620338716 192.168.1.16 → 10.6.15.144  SSH 150 Client: Encrypted packet (len=84)
  256 2.624047557  10.6.15.144 → 192.168.1.16 SSH 638 Server: Encrypted packet (len=572)
  257 2.667437867 192.168.1.16 → 10.6.15.144  TCP 66 59298 → 22 [ACK] Seq=14417 Ack=95093 Win=1494 Len=0 TSval=3027039 TSecr=3623344
  258 2.712723120  10.6.15.144 → 192.168.1.16 SSH 230 Server: Encrypted packet (len=164)
  259 2.712809208 192.168.1.16 → 10.6.15.144  TCP 66 59298 → 22 [ACK] Seq=14417 Ack=95257 Win=1494 Len=0 TSval=3027050 TSecr=3623367
  260 2.713085533 192.168.1.16 → 10.6.15.144  SSH 134 Client: Encrypted packet (len=68)
  261 2.751246997  10.6.15.144 → 192.168.1.16 TCP 66 22 → 59298 [ACK] Seq=95257 Ack=14485 Win=1452 Len=0 TSval=3623377 TSecr=3027050
  262 2.760415932  10.6.15.144 → 192.168.1.16 SSH 1514 Server: Encrypted packet (len=1448)
  263 2.760534715  10.6.15.144 → 192.168.1.16 SSH 1014 Server: Encrypted packet (len=948)
  264 2.760543893 192.168.1.16 → 10.6.15.144  TCP 66 59298 → 22 [ACK] Seq=14485 Ack=97653 Win=1494 Len=0 TSval=3027062 TSecr=3623379
  265 2.766697244 192.168.1.16 → 10.6.15.144  SSH 158 Client: Encrypted packet (len=92)
  266 2.770403812 192.168.1.16 → 10.6.15.144  SSH 150 Client: Encrypted packet (len=84)
  267 2.771698075  10.6.15.144 → 192.168.1.16 TCP 66 22 → 59298 [ACK] Seq=97653 Ack=14577 Win=1452 Len=0 TSval=3623381 TSecr=3027063
  268 2.775347294  10.6.15.144 → 192.168.1.16 TCP 66 22 → 59298 [ACK] Seq=97653 Ack=14661 Win=1452 Len=0 TSval=3623382 TSecr=3027064
  269 2.867289223 192.168.1.16 → 10.6.15.144  SSH 398 Client: Encrypted packet (len=332)
  270 2.876372394  10.6.15.144 → 192.168.1.16 TCP 66 22 → 59298 [ACK] Seq=97653 Ack=14993 Win=1452 Len=0 TSval=3623406 TSecr=3027088
  271 2.880907698  10.6.15.144 → 192.168.1.16 SSH 138 Server: Encrypted packet (len=72)
  272 2.881197053 192.168.1.16 → 10.6.15.144  SSH 102 Client: Encrypted packet (len=36)
  273 2.916734414  10.6.15.144 → 192.168.1.16 SSH 150 Server: Encrypted packet (len=84)
  274 2.928858367  10.6.15.144 → 192.168.1.16 SSH 142 Server: Encrypted packet (len=76)
  275 2.928925102 192.168.1.16 → 10.6.15.144  TCP 66 59298 → 22 [ACK] Seq=15029 Ack=97885 Win=1494 Len=0 TSval=3027104 TSecr=3623416
  276 2.994449875 192.168.1.16 → 10.6.15.144  SSH 142 Client: Encrypted packet (len=76)
  277 2.997822379  10.6.15.144 → 192.168.1.16 SSH 342 Server: Encrypted packet (len=276)
  278 3.015239346  10.6.15.144 → 192.168.1.16 SSH 222 Server: Encrypted packet (len=156)
  279 3.015321414 192.168.1.16 → 10.6.15.144  TCP 66 59298 → 22 [ACK] Seq=15105 Ack=98317 Win=1494 Len=0 TSval=3027125 TSecr=3623436
  280 3.084767754  10.6.15.144 → 192.168.1.16 SSH 326 Server: Encrypted packet (len=260)
  281 3.109803790 192.168.1.16 → 10.6.15.144  SSH 910 Client: Encrypted packet (len=844)
  282 3.154512868  10.6.15.144 → 192.168.1.16 TCP 66 22 → 59298 [ACK] Seq=98577 Ack=15949 Win=1452 Len=0 TSval=3623477 TSecr=3027149
  283 3.232552724  10.6.15.144 → 192.168.1.16 SSH 126 Server: Encrypted packet (len=60)
  284 3.237848876 192.168.1.16 → 10.6.15.144  SSH 150 Client: Encrypted packet (len=84)
  285 3.247316987  10.6.15.144 → 192.168.1.16 TCP 66 22 → 59298 [ACK] Seq=98637 Ack=16033 Win=1452 Len=0 TSval=3623499 TSecr=3027181
  286 3.347315080  10.6.15.144 → 192.168.1.16 SSH 646 Server: Encrypted packet (len=580)
  287 3.387465026 192.168.1.16 → 10.6.15.144  TCP 66 59298 → 22 [ACK] Seq=16033 Ack=99217 Win=1494 Len=0 TSval=3027219 TSecr=3623523
  288 3.471994385  10.6.15.144 → 192.168.1.16 SSH 126 Server: Encrypted packet (len=60)
  289 3.472078732 192.168.1.16 → 10.6.15.144  TCP 66 59298 → 22 [ACK] Seq=16033 Ack=99277 Win=1494 Len=0 TSval=3027240 TSecr=3623556
  290 3.477477450 192.168.1.16 → 10.6.15.144  SSH 158 Client: Encrypted packet (len=92)
  291 3.482847985  10.6.15.144 → 192.168.1.16 TCP 66 22 → 59298 [ACK] Seq=99277 Ack=16125 Win=1452 Len=0 TSval=3623559 TSecr=3027241
  292 3.527231907  10.6.15.144 → 192.168.1.16 SSH 138 Server: Encrypted packet (len=72)
  293 3.527555193 192.168.1.16 → 10.6.15.144  SSH 102 Client: Encrypted packet (len=36)
  294 3.537676973  10.6.15.144 → 192.168.1.16 TCP 66 22 → 59298 [ACK] Seq=99349 Ack=16161 Win=1452 Len=0 TSval=3623571 TSecr=3027254
  295 3.551732961 192.168.1.16 → 10.6.15.144  SSH 262 Client: Encrypted packet (len=196)
  296 3.557304449  10.6.15.144 → 192.168.1.16 TCP 66 22 → 59298 [ACK] Seq=99349 Ack=16357 Win=1452 Len=0 TSval=3623577 TSecr=3027260
  297 3.580656765  10.6.15.144 → 192.168.1.16 SSH 190 Server: Encrypted packet (len=124)
  298 3.623421197 192.168.1.16 → 10.6.15.144  TCP 66 59298 → 22 [ACK] Seq=16357 Ack=99473 Win=1494 Len=0 TSval=3027278 TSecr=3623583
  299 3.716516173  10.6.15.144 → 192.168.1.16 SSH 126 Server: Encrypted packet (len=60)
  300 3.716605665 192.168.1.16 → 10.6.15.144  TCP 66 59298 → 22 [ACK] Seq=16357 Ack=99533 Win=1494 Len=0 TSval=3027301 TSecr=3623617
  301 3.746272859  10.6.15.144 → 192.168.1.16 SSH 310 Server: Encrypted packet (len=244)
  302 3.746345199 192.168.1.16 → 10.6.15.144  TCP 66 59298 → 22 [ACK] Seq=16357 Ack=99777 Win=1494 Len=0 TSval=3027308 TSecr=3623624
  303 3.777451956 192.168.1.16 → 10.6.15.144  SSH 118 Client: Encrypted packet (len=52)
  304 3.827250591  10.6.15.144 → 192.168.1.16 TCP 66 22 → 59298 [ACK] Seq=99777 Ack=16409 Win=1452 Len=0 TSval=3623644 TSecr=3027316
  305 4.609584997 192.168.1.16 → 10.6.15.144  SSH 214 Client: Encrypted packet (len=148)
  306 4.610767372 192.168.1.16 → 10.6.15.144  SSH 334 Client: Encrypted packet (len=268)
  307 4.613642410  10.6.15.144 → 192.168.1.16 SSH 126 Server: Encrypted packet (len=60)
  308 4.613666667  10.6.15.144 → 192.168.1.16 TCP 126 [TCP Retransmission] 22 → 59298 [PSH, ACK] Seq=99777 Ack=16409 Win=1452 Len=60 TSval=3623751 TSecr=3027316
  309 4.613680694 192.168.1.16 → 10.6.15.144  TCP 78 59298 → 22 [ACK] Seq=16825 Ack=99837 Win=1494 Len=0 TSval=3027525 TSecr=3623751 SLE=99777 SRE=99837
  310 4.613693500  10.6.15.144 → 192.168.1.16 SSH 126 Server: [TCP Spurious Retransmission] , Encrypted packet (len=60)
  311 4.613698025 192.168.1.16 → 10.6.15.144  TCP 78 [TCP Dup ACK 309#1] 59298 → 22 [ACK] Seq=16825 Ack=99837 Win=1494 Len=0 TSval=3027525 TSecr=3623806 SLE=99777 SRE=99837
  312 4.613703189  10.6.15.144 → 192.168.1.16 TCP 66 22 → 59298 [ACK] Seq=99837 Ack=16557 Win=1452 Len=0 TSval=3623842 TSecr=3027524
  313 4.616571629  10.6.15.144 → 192.168.1.16 TCP 66 22 → 59298 [ACK] Seq=99837 Ack=16825 Win=1452 Len=0 TSval=3623842 TSecr=3027524
  314 4.617842737 192.168.1.16 → 10.6.15.144  SSH 174 Client: Encrypted packet (len=108)
  315 4.618155452 192.168.1.16 → 10.6.15.144  SSH 502 Client: Encrypted packet (len=436)
  316 4.622626790  10.6.15.144 → 192.168.1.16 TCP 66 22 → 59298 [ACK] Seq=99837 Ack=16933 Win=1452 Len=0 TSval=3623844 TSecr=3027526
  317 4.622751728  10.6.15.144 → 192.168.1.16 TCP 66 22 → 59298 [ACK] Seq=99837 Ack=17369 Win=1452 Len=0 TSval=3623844 TSecr=3027526
  318 4.639956969 192.168.1.16 → 10.6.15.144  SSH 134 Client: Encrypted packet (len=68)
  319 4.645111846  10.6.15.144 → 192.168.1.16 TCP 66 22 → 59298 [ACK] Seq=99837 Ack=17437 Win=1452 Len=0 TSval=3623849 TSecr=3027532
  320 4.648494344  10.6.15.144 → 192.168.1.16 SSH 134 Server: Encrypted packet (len=68)
  321 4.691415073 192.168.1.16 → 10.6.15.144  TCP 66 59298 → 22 [ACK] Seq=17437 Ack=99905 Win=1494 Len=0 TSval=3027545 TSecr=3623850
  322 5.021397745 192.168.1.16 → 13.126.37.14 NTP 90 NTP Version 4, client
  323 5.024353525  10.6.15.144 → 192.168.1.16 SSH 1514 Server: Encrypted packet (len=1448)
  324 5.024372725 192.168.1.16 → 10.6.15.144  TCP 66 59298 → 22 [ACK] Seq=17437 Ack=101353 Win=1494 Len=0 TSval=3027628 TSecr=3623911
  325 5.024538787  10.6.15.144 → 192.168.1.16 SSH 1514 Server: Encrypted packet (len=1448)
  326 5.024545592 192.168.1.16 → 10.6.15.144  TCP 66 59298 → 22 [ACK] Seq=17437 Ack=102801 Win=1494 Len=0 TSval=3027628 TSecr=3623911
  327 5.024717554  10.6.15.144 → 192.168.1.16 SSH 1302 Server: Encrypted packet (len=1236)
  328 5.024724320 192.168.1.16 → 10.6.15.144  TCP 66 59298 → 22 [ACK] Seq=17437 Ack=104037 Win=1494 Len=0 TSval=3027628 TSecr=3623911
  329 5.024925043  10.6.15.144 → 192.168.1.16 SSH 1514 Server: Encrypted packet (len=1448)
  330 5.024931511 192.168.1.16 → 10.6.15.144  TCP 66 59298 → 22 [ACK] Seq=17437 Ack=105485 Win=1494 Len=0 TSval=3027628 TSecr=3623912
  331 5.025144979  10.6.15.144 → 192.168.1.16 SSH 1514 Server: Encrypted packet (len=1448)
  332 5.025152301 192.168.1.16 → 10.6.15.144  TCP 66 59298 → 22 [ACK] Seq=17437 Ack=106933 Win=1494 Len=0 TSval=3027628 TSecr=3623912
  333 5.025351520  10.6.15.144 → 192.168.1.16 SSH 1514 Server: Encrypted packet (len=1448)
  334 5.025359207 192.168.1.16 → 10.6.15.144  TCP 66 59298 → 22 [ACK] Seq=17437 Ack=108381 Win=1494 Len=0 TSval=3027628 TSecr=3623912
  335 5.025567565  10.6.15.144 → 192.168.1.16 SSH 1514 Server: Encrypted packet (len=1448)
  336 5.025575994 192.168.1.16 → 10.6.15.144  TCP 66 59298 → 22 [ACK] Seq=17437 Ack=109829 Win=1494 Len=0 TSval=3027628 TSecr=3623942
  337 5.031975581  10.6.15.144 → 192.168.1.16 SSH 1514 Server: Encrypted packet (len=1448)
  338 5.031991731 192.168.1.16 → 10.6.15.144  TCP 66 59298 → 22 [ACK] Seq=17437 Ack=111277 Win=1494 Len=0 TSval=3027630 TSecr=3623946
  339 5.032173681  10.6.15.144 → 192.168.1.16 SSH 1514 Server: Encrypted packet (len=1448)
  340 5.032179149 192.168.1.16 → 10.6.15.144  TCP 66 59298 → 22 [ACK] Seq=17437 Ack=112725 Win=1494 Len=0 TSval=3027630 TSecr=3623946
  341 5.032384943  10.6.15.144 → 192.168.1.16 SSH 1514 Server: Encrypted packet (len=1448)
  342 5.032390374 192.168.1.16 → 10.6.15.144  TCP 66 59298 → 22 [ACK] Seq=17437 Ack=114173 Win=1494 Len=0 TSval=3027630 TSecr=3623946
  343 5.032598207  10.6.15.144 → 192.168.1.16 SSH 1514 Server: Encrypted packet (len=1448)
  344 5.032603344 192.168.1.16 → 10.6.15.144  TCP 66 59298 → 22 [ACK] Seq=17437 Ack=115621 Win=1494 Len=0 TSval=3027630 TSecr=3623946
  345 5.032810223  10.6.15.144 → 192.168.1.16 SSH 1514 Server: Encrypted packet (len=1448)
  346 5.032813272 192.168.1.16 → 10.6.15.144  TCP 66 59298 → 22 [ACK] Seq=17437 Ack=117069 Win=1494 Len=0 TSval=3027630 TSecr=3623946
  347 5.040741026  10.6.15.144 → 192.168.1.16 SSH 1514 Server: Encrypted packet (len=1448)
  348 5.040761979 192.168.1.16 → 10.6.15.144  TCP 66 59298 → 22 [ACK] Seq=17437 Ack=118517 Win=1494 Len=0 TSval=3027632 TSecr=3623947
  349 5.040942204  10.6.15.144 → 192.168.1.16 SSH 1514 Server: Encrypted packet (len=1448)
  350 5.040950292 192.168.1.16 → 10.6.15.144  TCP 66 59298 → 22 [ACK] Seq=17437 Ack=119965 Win=1494 Len=0 TSval=3027632 TSecr=3623947
  351 5.041156728  10.6.15.144 → 192.168.1.16 SSH 1514 Server: Encrypted packet (len=1448)
  352 5.041165181 192.168.1.16 → 10.6.15.144  TCP 66 59298 → 22 [ACK] Seq=17437 Ack=121413 Win=1494 Len=0 TSval=3027632 TSecr=3623947
  353 5.041368784  10.6.15.144 → 192.168.1.16 SSH 1514 Server: Encrypted packet (len=1448)
  354 5.041376186 192.168.1.16 → 10.6.15.144  TCP 66 59298 → 22 [ACK] Seq=17437 Ack=122861 Win=1494 Len=0 TSval=3027632 TSecr=3623947
  355 5.041580538  10.6.15.144 → 192.168.1.16 SSH 1514 Server: Encrypted packet (len=1448)
  356 5.041794746  10.6.15.144 → 192.168.1.16 SSH 1514 Server: Encrypted packet (len=1448)
  357 5.041801221 192.168.1.16 → 10.6.15.144  TCP 66 59298 → 22 [ACK] Seq=17437 Ack=125757 Win=1494 Len=0 TSval=3027632 TSecr=3623947
  358 5.051653658  10.6.15.144 → 192.168.1.16 SSH 1514 Server: Encrypted packet (len=1448)
  359 5.051858481  10.6.15.144 → 192.168.1.16 SSH 1514 Server: Encrypted packet (len=1448)
  360 5.051870999 192.168.1.16 → 10.6.15.144  TCP 66 59298 → 22 [ACK] Seq=17437 Ack=128653 Win=1494 Len=0 TSval=3027635 TSecr=3623950
  361 5.052222048  10.6.15.144 → 192.168.1.16 SSH 1514 Server: Encrypted packet (len=1448)
  362 5.052433969  10.6.15.144 → 192.168.1.16 SSH 1514 Server: Encrypted packet (len=1448)
  363 5.052443214 192.168.1.16 → 10.6.15.144  TCP 66 59298 → 22 [ACK] Seq=17437 Ack=131549 Win=1494 Len=0 TSval=3027635 TSecr=3623950
  364 5.052646864  10.6.15.144 → 192.168.1.16 SSH 1514 Server: Encrypted packet (len=1448)
  365 5.052858993  10.6.15.144 → 192.168.1.16 SSH 1514 Server: Encrypted packet (len=1448)
  366 5.052868088 192.168.1.16 → 10.6.15.144  TCP 66 59298 → 22 [ACK] Seq=17437 Ack=134445 Win=1494 Len=0 TSval=3027635 TSecr=3623950
  367 5.063492935  10.6.15.144 → 192.168.1.16 SSH 1514 Server: Encrypted packet (len=1448)
  368 5.063698304  10.6.15.144 → 192.168.1.16 SSH 1514 Server: Encrypted packet (len=1448)
  369 5.063712447 192.168.1.16 → 10.6.15.144  TCP 66 59298 → 22 [ACK] Seq=17437 Ack=137341 Win=1494 Len=0 TSval=3027638 TSecr=3623952
  370 5.063909645  10.6.15.144 → 192.168.1.16 SSH 1514 Server: Encrypted packet (len=1448)
  371 5.064122393  10.6.15.144 → 192.168.1.16 SSH 1514 Server: Encrypted packet (len=1448)
  372 5.064133829 192.168.1.16 → 10.6.15.144  TCP 66 59298 → 22 [ACK] Seq=17437 Ack=140237 Win=1494 Len=0 TSval=3027638 TSecr=3623952
  373 5.064336579  10.6.15.144 → 192.168.1.16 SSH 1514 Server: Encrypted packet (len=1448)
  374 5.064549660  10.6.15.144 → 192.168.1.16 SSH 1514 Server: Encrypted packet (len=1448)
  375 5.064561900 192.168.1.16 → 10.6.15.144  TCP 66 59298 → 22 [ACK] Seq=17437 Ack=143133 Win=1494 Len=0 TSval=3027638 TSecr=3623952
  376 5.074979018  10.6.15.144 → 192.168.1.16 SSH 1514 Server: Encrypted packet (len=1448)
  377 5.075186276  10.6.15.144 → 192.168.1.16 SSH 1514 Server: Encrypted packet (len=1448)
  378 5.075200695 192.168.1.16 → 10.6.15.144  TCP 66 59298 → 22 [ACK] Seq=17437 Ack=146029 Win=1494 Len=0 TSval=3027640 TSecr=3623955
  379 5.075406679  10.6.15.144 → 192.168.1.16 SSH 1514 Server: Encrypted packet (len=1448)
  380 5.075610505  10.6.15.144 → 192.168.1.16 SSH 1514 Server: Encrypted packet (len=1448)
  381 5.075620601 192.168.1.16 → 10.6.15.144  TCP 66 59298 → 22 [ACK] Seq=17437 Ack=148925 Win=1494 Len=0 TSval=3027641 TSecr=3623955
  382 5.075821711  10.6.15.144 → 192.168.1.16 SSH 1514 Server: Encrypted packet (len=1448)
  383 5.076038848  10.6.15.144 → 192.168.1.16 SSH 1514 Server: Encrypted packet (len=1448)
  384 5.076052141 192.168.1.16 → 10.6.15.144  TCP 66 59298 → 22 [ACK] Seq=17437 Ack=151821 Win=1494 Len=0 TSval=3027641 TSecr=3623955
  385 5.080375905  10.6.15.144 → 192.168.1.16 SSH 1514 Server: Encrypted packet (len=1448)
  386 5.080479680  10.6.15.144 → 192.168.1.16 SSH 886 Server: Encrypted packet (len=820)
  387 5.080493372 192.168.1.16 → 10.6.15.144  TCP 66 59298 → 22 [ACK] Seq=17437 Ack=154089 Win=1494 Len=0 TSval=3027642 TSecr=3623955
  388 5.080899252 192.168.1.16 → 10.6.15.144  SSH 102 Client: Encrypted packet (len=36)
  389 5.096302865 192.168.1.16 → 10.6.15.144  SSH 134 Client: Encrypted packet (len=68)
  390 5.096539899 192.168.1.16 → 10.6.15.144  SSH 202 Client: Encrypted packet (len=136)
  391 5.096789688 192.168.1.16 → 10.6.15.144  SSH 202 Client: Encrypted packet (len=136)
  392 5.105147071  10.6.15.144 → 192.168.1.16 TCP 66 22 → 59298 [ACK] Seq=154089 Ack=17541 Win=1452 Len=0 TSval=3623963 TSecr=3027642
  393 5.105168601  10.6.15.144 → 192.168.1.16 TCP 66 22 → 59298 [ACK] Seq=154089 Ack=17813 Win=1452 Len=0 TSval=3623963 TSecr=3027646
  394 5.126142966 192.168.1.16 → 10.6.15.144  SSH 286 Client: Encrypted packet (len=220)
  395 5.133257059 192.168.1.16 → 10.6.15.144  SSH 254 Client: Encrypted packet (len=188)
  396 5.137978549  10.6.15.144 → 192.168.1.16 TCP 66 22 → 59298 [ACK] Seq=154089 Ack=18221 Win=1452 Len=0 TSval=3623973 TSecr=3027653
  397 5.151107883 192.168.1.16 → 10.6.15.144  SSH 126 Client: Encrypted packet (len=60)
  398 5.158891818  10.6.15.144 → 192.168.1.16 SSH 182 Server: Encrypted packet (len=116)
  399 5.170014562  10.6.15.144 → 192.168.1.16 SSH 134 Server: Encrypted packet (len=68)
  400 5.170073636 192.168.1.16 → 10.6.15.144  TCP 66 59298 → 22 [ACK] Seq=18281 Ack=154273 Win=1494 Len=0 TSval=3027664 TSecr=3623977
  401 5.170344399  10.6.15.144 → 192.168.1.16 SSH 1270 Server: Encrypted packet (len=1204)
  402 5.211416814 192.168.1.16 → 10.6.15.144  TCP 66 59298 → 22 [ACK] Seq=18281 Ack=155477 Win=1494 Len=0 TSval=3027675 TSecr=3623979
  403 5.335489286 192.168.1.16 → 10.6.15.144  SSH 934 Client: Encrypted packet (len=868)
  404 5.345024192  10.6.15.144 → 192.168.1.16 SSH 1514 Server: Encrypted packet (len=1448)
  405 5.345058705  10.6.15.144 → 192.168.1.16 SSH 438 Server: Encrypted packet (len=372)
  406 5.345068915 192.168.1.16 → 10.6.15.144  TCP 66 59298 → 22 [ACK] Seq=19149 Ack=157297 Win=1494 Len=0 TSval=3027708 TSecr=3624025
  407 5.371592175  10.6.15.144 → 192.168.1.16 SSH 134 Server: Encrypted packet (len=68)
  408 5.371661255 192.168.1.16 → 10.6.15.144  TCP 66 59298 → 22 [ACK] Seq=19149 Ack=157365 Win=1494 Len=0 TSval=3027715 TSecr=3624030
  409 5.386626453  10.6.15.144 → 192.168.1.16 SSH 118 Server: Encrypted packet (len=52)
  410 5.386703469 192.168.1.16 → 10.6.15.144  TCP 66 59298 → 22 [ACK] Seq=19149 Ack=157417 Win=1494 Len=0 TSval=3027718 TSecr=3624033
  411 5.391984110 192.168.1.16 → 10.6.15.144  SSH 126 Client: Encrypted packet (len=60)
  412 5.437884026  10.6.15.144 → 192.168.1.16 TCP 66 22 → 59298 [ACK] Seq=157417 Ack=19209 Win=1452 Len=0 TSval=3624047 TSecr=3027720
  413 6.321559266  10.6.15.144 → 192.168.1.16 SSH 870 Server: Encrypted packet (len=804)
  414 6.321618770  10.6.15.144 → 192.168.1.16 SSH 126 Server: Encrypted packet (len=60)
  415 6.321652902 192.168.1.16 → 10.6.15.144  TCP 66 59298 → 22 [ACK] Seq=19209 Ack=158281 Win=1494 Len=0 TSval=3027952 TSecr=3624081
  416 6.321783016  10.6.15.144 → 192.168.1.16 SSH 126 Server: [TCP Spurious Retransmission] , Encrypted packet (len=60)
  417 6.321790385 192.168.1.16 → 10.6.15.144  TCP 78 [TCP Dup ACK 415#1] 59298 → 22 [ACK] Seq=19209 Ack=158281 Win=1494 Len=0 TSval=3027952 TSecr=3624104 SLE=158221 SRE=158281
  418 6.322042133  10.6.15.144 → 192.168.1.16 SSH 930 Server: [TCP Spurious Retransmission] , Encrypted packet (len=864)
  419 6.322051109 192.168.1.16 → 10.6.15.144  TCP 78 [TCP Dup ACK 415#2] 59298 → 22 [ACK] Seq=19209 Ack=158281 Win=1494 Len=0 TSval=3027952 TSecr=3624163 SLE=157417 SRE=158281
  420 6.328212003 192.168.1.16 → 10.6.15.144  SSH 142 Client: Encrypted packet (len=76)
  421 6.336352120  10.6.15.144 → 192.168.1.16 TCP 66 22 → 59298 [ACK] Seq=158281 Ack=19285 Win=1452 Len=0 TSval=3624271 TSecr=3027954
  422 7.313446159  10.6.15.144 → 192.168.1.16 SSH 134 Server: Encrypted packet (len=68)
  423 7.313517266  10.6.15.144 → 192.168.1.16 TCP 134 [TCP Retransmission] 22 → 59298 [PSH, ACK] Seq=158281 Ack=19285 Win=1452 Len=68 TSval=3624433 TSecr=3027954
  424 7.313528494 192.168.1.16 → 10.6.15.144  TCP 78 59298 → 22 [ACK] Seq=19285 Ack=158349 Win=1494 Len=0 TSval=3028200 TSecr=3624433 SLE=158281 SRE=158349
  425 7.318978011 192.168.1.16 → 10.6.15.144  SSH 126 Client: Encrypted packet (len=60)
  426 7.326515821  10.6.15.144 → 192.168.1.16 TCP 66 22 → 59298 [ACK] Seq=158349 Ack=19345 Win=1452 Len=0 TSval=3624519 TSecr=3028201
  427 7.522338087 192.168.1.16 → 54.76.71.168 TCP 128 42414 → 8282 [PSH, ACK] Seq=1 Ack=1 Win=296 Len=62 TSval=3028252 TSecr=607136463
  428 7.599012584  10.6.15.144 → 192.168.1.16 SSH 134 Server: Encrypted packet (len=68)
  429 7.603604381 192.168.1.16 → 10.6.15.144  SSH 142 Client: Encrypted packet (len=76)
  430 7.615995846  10.6.15.144 → 192.168.1.16 TCP 66 22 → 59298 [ACK] Seq=158417 Ack=19421 Win=1452 Len=0 TSval=3624590 TSecr=3028273
  431 7.685256407 54.76.71.168 → 192.168.1.16 TCP 66 8282 → 42414 [ACK] Seq=1 Ack=63 Win=121 Len=0 TSval=607140229 TSecr=3028252
  432 8.517113920 192.168.1.16 → 10.6.15.144  SSH 958 Client: Encrypted packet (len=892)
  433 8.519136801  10.6.15.144 → 192.168.1.16 SSH 126 Server: Encrypted packet (len=60)
  434 8.519278935  10.6.15.144 → 192.168.1.16 TCP 126 [TCP Retransmission] 22 → 59298 [PSH, ACK] Seq=158417 Ack=19421 Win=1452 Len=60 TSval=3624769 TSecr=3028273
  435 8.519286488 192.168.1.16 → 10.6.15.144  TCP 78 59298 → 22 [ACK] Seq=20313 Ack=158477 Win=1494 Len=0 TSval=3028501 TSecr=3624769 SLE=158417 SRE=158477
  436 8.523361850  10.6.15.144 → 192.168.1.16 TCP 66 22 → 59298 [ACK] Seq=158477 Ack=20313 Win=1452 Len=0 TSval=3624819 TSecr=3028501
  437 8.537218922 192.168.1.16 → 10.6.15.144  SSH 126 Client: Encrypted packet (len=60)
  438 8.541245615  10.6.15.144 → 192.168.1.16 TCP 66 22 → 59298 [ACK] Seq=158477 Ack=20373 Win=1452 Len=0 TSval=3624823 TSecr=3028506
  439 9.517834013 192.168.1.16 → 10.6.15.144  SSH 1514 Client: Encrypted packet (len=1448)
  440 9.519467397 192.168.1.16 → 10.6.15.144  SSH 134 Client: Encrypted packet (len=68)
  441 9.520196493  10.6.15.144 → 192.168.1.16 SSH 326 Server: Encrypted packet (len=260)
  442 9.520266754  10.6.15.144 → 192.168.1.16 SSH 134 Server: Encrypted packet (len=68)
  443 9.520294896 192.168.1.16 → 10.6.15.144  TCP 66 59298 → 22 [ACK] Seq=21889 Ack=158805 Win=1494 Len=0 TSval=3028752 TSecr=3624873
  444 9.524676888  10.6.15.144 → 192.168.1.16 TCP 66 22 → 59298 [ACK] Seq=158805 Ack=21821 Win=1452 Len=0 TSval=3625069 TSecr=3028751
  445 9.524802607  10.6.15.144 → 192.168.1.16 TCP 66 22 → 59298 [ACK] Seq=158805 Ack=21889 Win=1452 Len=0 TSval=3625069 TSecr=3028752
  446 9.525960003 192.168.1.16 → 10.6.15.144  SSH 126 Client: Encrypted packet (len=60)
  447 9.532637261  10.6.15.144 → 192.168.1.16 TCP 66 22 → 59298 [ACK] Seq=158805 Ack=21949 Win=1452 Len=0 TSval=3625071 TSecr=3028753
  448 9.550316571  10.6.15.144 → 192.168.1.16 SSH 134 Server: Encrypted packet (len=68)
  449 9.591486920 192.168.1.16 → 10.6.15.144  TCP 66 59298 → 22 [ACK] Seq=21949 Ack=158873 Win=1494 Len=0 TSval=3028770 TSecr=3625075
  450 11.346407756  192.168.1.1 → 224.0.0.1    IGMPv2 42 Membership Query, general
  451 11.348370323  10.6.15.144 → 192.168.1.16 SSH 374 Server: Encrypted packet (len=308)
  452 11.348423702 192.168.1.16 → 10.6.15.144  TCP 66 59298 → 22 [ACK] Seq=21949 Ack=159181 Win=1494 Len=0 TSval=3029209 TSecr=3625116
  453 11.348662876  10.6.15.144 → 192.168.1.16 SSH 134 Server: Encrypted packet (len=68)
  454 11.348679119 192.168.1.16 → 10.6.15.144  TCP 66 59298 → 22 [ACK] Seq=21949 Ack=159249 Win=1494 Len=0 TSval=3029209 TSecr=3625128
  455 11.348696284  10.6.15.144 → 192.168.1.16 SSH 134 Server: [TCP Spurious Retransmission] , Encrypted packet (len=68)
  456 11.348705014 192.168.1.16 → 10.6.15.144  TCP 78 [TCP Dup ACK 454#1] 59298 → 22 [ACK] Seq=21949 Ack=159249 Win=1494 Len=0 TSval=3029209 TSecr=3625226 SLE=159181 SRE=159249
  457 11.348715428 10.22.18.209 → 224.0.0.252  LLMNR 64 Standard query 0x104f A wpad
  458 11.348746901 10.22.18.209 → 224.0.0.252  LLMNR 64 Standard query 0x104f A wpad
  459 11.366330759 192.168.1.16 → 10.6.15.144  SSH 102 Client: Encrypted packet (len=36)
  460 11.366579317 192.168.1.16 → 10.6.15.144  SSH 126 Client: Encrypted packet (len=60)
  461 11.371575727  10.6.15.144 → 192.168.1.16 TCP 66 22 → 59298 [ACK] Seq=159249 Ack=22045 Win=1452 Len=0 TSval=3625531 TSecr=3029213
  462 12.337354144  10.6.15.144 → 192.168.1.16 SSH 138 Server: Encrypted packet (len=72)
  463 12.337381604  10.6.15.144 → 192.168.1.16 SSH 134 Server: Encrypted packet (len=68)
  464 12.337453660 192.168.1.16 → 10.6.15.144  TCP 66 59298 → 22 [ACK] Seq=22045 Ack=159389 Win=1494 Len=0 TSval=3029456 TSecr=3625623
  465 12.337735505 192.168.1.16 → 10.6.15.144  SSH 102 Client: Encrypted packet (len=36)
  466 12.346277097 192.168.1.16 → 10.6.15.144  SSH 102 Client: Encrypted packet (len=36)
  467 12.348111736 192.168.1.16 → 10.6.15.144  SSH 286 Client: Encrypted packet (len=220)
  468 12.351939502 192.168.1.16 → 10.6.15.144  SSH 1514 Client: Encrypted packet (len=1448)
  469 12.355022675  10.6.15.144 → 192.168.1.16 TCP 66 22 → 59298 [ACK] Seq=159389 Ack=22117 Win=1452 Len=0 TSval=3625776 TSecr=3029456
  470 12.355046707 192.168.1.16 → 10.6.15.144  SSH 374 Client: Encrypted packet (len=308)
  471 12.360552759  10.6.15.144 → 192.168.1.16 TCP 66 22 → 59298 [ACK] Seq=159389 Ack=23785 Win=1452 Len=0 TSval=3625777 TSecr=3029459
  472 12.364243421  10.6.15.144 → 192.168.1.16 SSH 142 Server: Encrypted packet (len=76)
  473 12.407469727 192.168.1.16 → 10.6.15.144  TCP 66 59298 → 22 [ACK] Seq=24093 Ack=159465 Win=1494 Len=0 TSval=3029474 TSecr=3625779
  474 12.426680348  10.6.15.144 → 192.168.1.16 SSH 138 Server: Encrypted packet (len=72)
  475 12.426707351 192.168.1.16 → 10.6.15.144  TCP 66 59298 → 22 [ACK] Seq=24093 Ack=159537 Win=1494 Len=0 TSval=3029478 TSecr=3625793
  476 12.426927933 192.168.1.16 → 10.6.15.144  SSH 102 Client: Encrypted packet (len=36)
  477 12.428179796  10.6.15.144 → 192.168.1.16 SSH 138 Server: Encrypted packet (len=72)
  478 12.428387550 192.168.1.16 → 10.6.15.144  SSH 102 Client: Encrypted packet (len=36)
  479 12.430191893  10.6.15.144 → 192.168.1.16 SSH 138 Server: Encrypted packet (len=72)
  480 12.430400540 192.168.1.16 → 10.6.15.144  SSH 102 Client: Encrypted packet (len=36)
  481 12.438566955  10.6.15.144 → 192.168.1.16 TCP 66 22 → 59298 [ACK] Seq=159681 Ack=24165 Win=1452 Len=0 TSval=3625796 TSecr=3029478
  482 12.446545440  10.6.15.144 → 192.168.1.16 SSH 138 Server: Encrypted packet (len=72)
  483 12.446751293 192.168.1.16 → 10.6.15.144  SSH 102 Client: Encrypted packet (len=36)
  484 12.458162461  10.6.15.144 → 192.168.1.16 SSH 138 Server: Encrypted packet (len=72)
  485 12.458366699 192.168.1.16 → 10.6.15.144  SSH 102 Client: Encrypted packet (len=36)
  486 12.481957525  10.6.15.144 → 192.168.1.16 SSH 910 Server: Encrypted packet (len=844)
  487 12.482925400  10.6.15.144 → 192.168.1.16 SSH 542 Server: Encrypted packet (len=476)
  488 12.483000390 192.168.1.16 → 10.6.15.144  TCP 66 59298 → 22 [ACK] Seq=24273 Ack=161145 Win=1494 Len=0 TSval=3029492 TSecr=3625808
  489 12.483463436 192.168.1.16 → 10.6.15.144  SSH 142 Client: Encrypted packet (len=76)
  490 12.526702428  10.6.15.144 → 192.168.1.16 TCP 66 22 → 59298 [ACK] Seq=161145 Ack=24349 Win=1452 Len=0 TSval=3625821 TSecr=3029493
  491 14.323970419  10.6.15.144 → 192.168.1.16 SSH 134 Server: Encrypted packet (len=68)
  492 14.324005664  10.6.15.144 → 192.168.1.16 TCP 134 [TCP Retransmission] 22 → 59298 [PSH, ACK] Seq=161145 Ack=24349 Win=1452 Len=68 TSval=3625983 TSecr=3029493
  493 14.324021690 192.168.1.16 → 10.6.15.144  TCP 78 59298 → 22 [ACK] Seq=24349 Ack=161213 Win=1494 Len=0 TSval=3029953 TSecr=3625983 SLE=161145 SRE=161213
  494 14.331221615 192.168.1.16 → 10.6.15.144  SSH 134 Client: Encrypted packet (len=68)
  495 14.341178051  10.6.15.144 → 192.168.1.16 TCP 66 22 → 59298 [ACK] Seq=161213 Ack=24417 Win=1452 Len=0 TSval=3626272 TSecr=3029954
  496 14.575466998 192.168.1.16 → 224.0.0.252  IGMPv2 46 Membership Report group 224.0.0.252
  497 15.515602942 192.168.1.16 → 10.6.15.144  SSH 1514 Client: Encrypted packet (len=1448)
  498 15.519499941 192.168.1.16 → 10.6.15.144  SSH 686 Client: Encrypted packet (len=620)
  499 15.524249289  10.6.15.144 → 192.168.1.16 SSH 134 Server: Encrypted packet (len=68)
  500 15.529177147 192.168.1.16 → 10.6.15.144  SSH 134 Client: Encrypted packet (len=68)
  501 15.532366402  10.6.15.144 → 192.168.1.16 TCP 66 22 → 59298 [ACK] Seq=161281 Ack=26485 Win=1452 Len=0 TSval=3626570 TSecr=3030251
  502 15.535025192  10.6.15.144 → 192.168.1.16 TCP 66 22 → 59298 [ACK] Seq=161281 Ack=26553 Win=1452 Len=0 TSval=3626572 TSecr=3030254
  503 16.343033143  10.6.15.144 → 192.168.1.16 SSH 326 Server: Encrypted packet (len=260)
  504 16.343062649  10.6.15.144 → 192.168.1.16 SSH 126 Server: Encrypted packet (len=60)
  505 16.343124798 192.168.1.16 → 10.6.15.144  TCP 66 59298 → 22 [ACK] Seq=26553 Ack=161601 Win=1494 Len=0 TSval=3030457 TSecr=3626625
  506 16.348207199 192.168.1.16 → 10.6.15.144  SSH 126 Client: Encrypted packet (len=60)
  507 16.359125190  10.6.15.144 → 192.168.1.16 TCP 66 22 → 59298 [ACK] Seq=161601 Ack=26613 Win=1452 Len=0 TSval=3626777 TSecr=3030459
  508 17.329484452  10.6.15.144 → 192.168.1.16 SSH 134 Server: Encrypted packet (len=68)
  509 17.335923093 192.168.1.16 → 10.6.15.144  SSH 134 Client: Encrypted packet (len=68)
  510 17.345462491  10.6.15.144 → 192.168.1.16 TCP 66 22 → 59298 [ACK] Seq=161669 Ack=26681 Win=1452 Len=0 TSval=3627023 TSecr=3030706
  511 18.321740879  10.6.15.144 → 192.168.1.16 SSH 118 Server: Encrypted packet (len=52)
  512 18.321768277 10.22.18.209 → 224.0.0.252  LLMNR 64 Standard query 0x7472 A wpad
  513 18.327012651 192.168.1.16 → 10.6.15.144  SSH 118 Client: Encrypted packet (len=52)
  514 18.332316138  10.6.15.144 → 192.168.1.16 TCP 66 22 → 59298 [ACK] Seq=161721 Ack=26733 Win=1452 Len=0 TSval=3627271 TSecr=3030953
  515 18.372892463 10.22.18.209 → 224.0.0.252  LLMNR 64 Standard query 0x7472 A wpad
  516 18.927493649 192.168.1.16 → 224.0.0.251  IGMPv2 46 Membership Report group 224.0.0.251
  517 18.929336192  10.6.15.144 → 192.168.1.16 SSH 134 Server: Encrypted packet (len=68)
  518 18.937707466 192.168.1.16 → 10.6.15.144  SSH 158 Client: Encrypted packet (len=92)
  519 18.949179297  10.6.15.144 → 192.168.1.16 TCP 66 22 → 59298 [ACK] Seq=161789 Ack=26825 Win=1452 Len=0 TSval=3627424 TSecr=3031106
  520 20.337487357  10.6.15.144 → 192.168.1.16 SSH 126 Server: Encrypted packet (len=60)
  521 20.337849465  10.6.15.144 → 192.168.1.16 TCP 126 [TCP Retransmission] 22 → 59298 [PSH, ACK] Seq=161789 Ack=26825 Win=1452 Len=60 TSval=3627720 TSecr=3031106
  522 20.337863021 192.168.1.16 → 10.6.15.144  TCP 78 59298 → 22 [ACK] Seq=26825 Ack=161849 Win=1494 Len=0 TSval=3031456 TSecr=3627720 SLE=161789 SRE=161849
  523 20.342860953 192.168.1.16 → 10.6.15.144  SSH 134 Client: Encrypted packet (len=68)
  524 20.559464697 192.168.1.16 → 10.6.15.144  TCP 134 [TCP Retransmission] 59298 → 22 [PSH, ACK] Seq=26825 Ack=161849 Win=1494 Len=68 TSval=3031512 TSecr=3627720
  525 20.593120849  10.6.15.144 → 192.168.1.16 TCP 66 22 → 59298 [ACK] Seq=161849 Ack=26893 Win=1452 Len=0 TSval=3627836 TSecr=3031512
  526 22.321424527  10.6.15.144 → 192.168.1.16 SSH 134 Server: Encrypted packet (len=68)
  527 22.327243593 192.168.1.16 → 10.6.15.144  SSH 118 Client: Encrypted packet (len=52)
  528 22.338288164  10.6.15.144 → 192.168.1.16 TCP 66 22 → 59298 [ACK] Seq=161917 Ack=26945 Win=1452 Len=0 TSval=3628271 TSecr=3031953
  529 23.345499710  10.6.15.144 → 192.168.1.16 SSH 134 Server: Encrypted packet (len=68)
  530 23.354105591 192.168.1.16 → 10.6.15.144  SSH 142 Client: Encrypted packet (len=76)
  531 23.571490910 192.168.1.16 → 10.6.15.144  TCP 142 [TCP Retransmission] 59298 → 22 [PSH, ACK] Seq=26945 Ack=161985 Win=1494 Len=76 TSval=3032265 TSecr=3628327
  532 23.605131101  10.6.15.144 → 192.168.1.16 TCP 66 22 → 59298 [ACK] Seq=161985 Ack=27021 Win=1452 Len=0 TSval=3628588 TSecr=3032265
  533 25.329911458  10.6.15.144 → 192.168.1.16 SSH 134 Server: Encrypted packet (len=68)
  534 25.330439413  10.6.15.144 → 192.168.1.16 TCP 134 [TCP Retransmission] 22 → 59298 [PSH, ACK] Seq=161985 Ack=27021 Win=1452 Len=68 TSval=3628963 TSecr=3032265
  535 25.330450984 192.168.1.16 → 10.6.15.144  TCP 78 59298 → 22 [ACK] Seq=27021 Ack=162053 Win=1494 Len=0 TSval=3032704 TSecr=3628963 SLE=161985 SRE=162053
  536 25.334762573 192.168.1.16 → 10.6.15.144  SSH 142 Client: Encrypted packet (len=76)
  537 25.340620997  10.6.15.144 → 192.168.1.16 TCP 66 22 → 59298 [ACK] Seq=162053 Ack=27097 Win=1452 Len=0 TSval=3629023 TSecr=3032705
  538 26.021477165 192.168.1.16 → 91.189.94.4  NTP 90 NTP Version 4, client
  539 26.023434656  10.6.15.144 → 192.168.1.16 SSH 150 Server: Encrypted packet (len=84)
  540 26.026525735 10.119.73.122 → 192.168.1.16 ICMP 110 Destination unreachable (Communication administratively filtered)
  541 26.027991650 192.168.1.16 → 10.6.15.144  SSH 134 Client: Encrypted packet (len=68)
  542 26.030651492  10.6.15.144 → 192.168.1.16 TCP 66 22 → 59298 [ACK] Seq=162137 Ack=27165 Win=1452 Len=0 TSval=3629196 TSecr=3032879
  543 27.021502288 192.168.1.16 → 13.126.37.14 NTP 90 NTP Version 4, client
  544 27.023106261 10.22.18.209 → 224.0.0.252  LLMNR 64 Standard query 0x26a0 A wpad
  545 27.023137382 10.22.17.200 → 224.0.0.252  LLMNR 64 Standard query 0x710c A wpad
  546 27.023544776 10.22.17.200 → 224.0.0.252  LLMNR 64 Standard query 0x11a3 AAAA wpad
  547 27.023565639  10.6.15.144 → 192.168.1.16 SSH 118 Server: Encrypted packet (len=52)
  548 27.023582533 10.22.18.209 → 224.0.0.252  LLMNR 64 Standard query 0x26a0 A wpad
  549 27.023588750 10.22.17.200 → 224.0.0.252  LLMNR 64 Standard query 0x710c A wpad
  550 27.023594183 10.22.17.200 → 224.0.0.252  LLMNR 64 Standard query 0x11a3 AAAA wpad
  551 27.030301250 192.168.1.16 → 10.6.15.144  SSH 134 Client: Encrypted packet (len=68)
  552 27.040371964  10.6.15.144 → 192.168.1.16 TCP 66 22 → 59298 [ACK] Seq=162189 Ack=27233 Win=1452 Len=0 TSval=3629447 TSecr=3033129
  553 28.337413392  10.6.15.144 → 192.168.1.16 SSH 134 Server: Encrypted packet (len=68)
  554 28.337437280 10.22.17.249 → 224.0.0.252  LLMNR 64 Standard query 0xfcac A wpad
  555 28.343212122 192.168.1.16 → 10.6.15.144  SSH 126 Client: Encrypted packet (len=60)
  556 28.352344048  10.6.15.144 → 192.168.1.16 TCP 66 22 → 59298 [ACK] Seq=162257 Ack=27293 Win=1452 Len=0 TSval=3629775 TSecr=3033457
  557 29.329443166  10.6.15.144 → 192.168.1.16 SSH 134 Server: Encrypted packet (len=68)
  558 29.329467721 10.22.17.249 → 224.0.0.252  LLMNR 64 Standard query 0xfcac A wpad
  559 29.334803174 192.168.1.16 → 10.6.15.144  SSH 142 Client: Encrypted packet (len=76)
  560 29.347427988  10.6.15.144 → 192.168.1.16 TCP 66 22 → 59298 [ACK] Seq=162325 Ack=27369 Win=1452 Len=0 TSval=3630023 TSecr=3033705
