    1 0.000000000  10.6.15.144 → 192.168.1.16 SSH 102 Server: Encrypted packet (len=36)
    2 0.000024795 192.168.1.16 → 10.6.15.144  TCP 66 59298 → 22 [ACK] Seq=1 Ack=37 Win=5703 Len=0 TSval=5089960 TSecr=5686021
    3 0.000345660  10.6.15.144 → 192.168.1.16 SSH 102 Server: Encrypted packet (len=36)
    4 0.000353155 192.168.1.16 → 10.6.15.144  TCP 66 59298 → 22 [ACK] Seq=1 Ack=73 Win=5703 Len=0 TSval=5089960 TSecr=5686075
    5 0.000700057  10.6.15.144 → 192.168.1.16 SSH 102 Server: Encrypted packet (len=36)
    6 0.000706555 192.168.1.16 → 10.6.15.144  TCP 66 59298 → 22 [ACK] Seq=1 Ack=109 Win=5703 Len=0 TSval=5089960 TSecr=5686075
    7 0.000728462 192.168.1.16 → 10.6.15.144  SSH 398 Client: Encrypted packet (len=332)
    8 0.001189549 10.22.19.143 → 224.0.0.252  LLMNR 64 Standard query 0xcdd2 A wpad
    9 0.001725935 10.22.19.143 → 224.0.0.252  LLMNR 64 Standard query 0x7810 A wpad
   10 0.002131866 10.22.19.143 → 224.0.0.252  LLMNR 64 Standard query 0x7810 A wpad
   11 0.002522025 10.22.19.143 → 224.0.0.252  LLMNR 64 Standard query 0xcdd2 A wpad
   12 0.010174915  10.6.15.144 → 192.168.1.16 TCP 66 22 → 59298 [ACK] Seq=109 Ack=333 Win=1452 Len=0 TSval=5686322 TSecr=5089960
   13 0.347852316 192.168.1.16 → 10.6.15.144  SSH 318 Client: Encrypted packet (len=252)
   14 0.348901790 192.168.1.16 → 10.6.15.144  SSH 134 Client: Encrypted packet (len=68)
   15 0.349748605  10.6.15.144 → 192.168.1.16 SSH 430 Server: Encrypted packet (len=364)
   16 0.350957082 192.168.1.16 → 10.6.15.144  SSH 134 Client: Encrypted packet (len=68)
   17 0.352669644 192.168.1.16 → 10.6.15.144  SSH 110 Client: Encrypted packet (len=44)
   18 0.353983722 192.168.1.16 → 10.6.15.144  SSH 102 Client: Encrypted packet (len=36)
   19 0.357187676  10.6.15.144 → 192.168.1.16 TCP 66 22 → 59298 [ACK] Seq=473 Ack=585 Win=1452 Len=0 TSval=5686409 TSecr=5090047
   20 0.357565408  10.6.15.144 → 192.168.1.16 TCP 66 22 → 59298 [ACK] Seq=473 Ack=653 Win=1452 Len=0 TSval=5686409 TSecr=5090047
   21 0.358916488  10.6.15.144 → 192.168.1.16 TCP 66 22 → 59298 [ACK] Seq=473 Ack=721 Win=1452 Len=0 TSval=5686409 TSecr=5090048
   22 0.359301330  10.6.15.144 → 192.168.1.16 SSH 134 Server: Encrypted packet (len=68)
   23 0.394119020 192.168.1.16 → 10.6.15.144  TCP 102 [TCP Retransmission] 59298 → 22 [PSH, ACK] Seq=765 Ack=541 Win=5703 Len=36 TSval=5090059 TSecr=5686409
   24 0.401312006  10.6.15.144 → 192.168.1.16 TCP 66 22 → 59298 [ACK] Seq=541 Ack=801 Win=1452 Len=0 TSval=5686420 TSecr=5090048
   25 0.405456211  10.6.15.144 → 192.168.1.16 TCP 78 [TCP Dup ACK 24#1] 22 → 59298 [ACK] Seq=541 Ack=801 Win=1452 Len=0 TSval=5686420 TSecr=5090059 SLE=765 SRE=801
   26 0.668058522 192.168.1.16 → 13.126.27.131 NTP 90 NTP Version 4, client
   27 1.109279925 192.168.1.16 → 10.6.15.144  SSH 302 Client: Encrypted packet (len=236)
   28 1.115114155 192.168.1.16 → 10.6.15.144  SSH 134 Client: Encrypted packet (len=68)
   29 1.122783060  10.6.15.144 → 192.168.1.16 TCP 66 22 → 59298 [ACK] Seq=541 Ack=1037 Win=1452 Len=0 TSval=5686599 TSecr=5090237
   30 1.124834789  10.6.15.144 → 192.168.1.16 TCP 66 22 → 59298 [ACK] Seq=541 Ack=1105 Win=1452 Len=0 TSval=5686600 TSecr=5090239
   31 1.951969411  10.6.15.144 → 192.168.1.16 SSH 138 Server: Encrypted packet (len=72)
   32 1.952300271 192.168.1.16 → 10.6.15.144  SSH 134 Client: Encrypted packet (len=68)
   33 1.958560617  10.6.15.144 → 192.168.1.16 TCP 66 22 → 59298 [ACK] Seq=613 Ack=1173 Win=1452 Len=0 TSval=5686809 TSecr=5090448
   34 1.999740914  10.6.15.144 → 192.168.1.16 SSH 1514 Server: Encrypted packet (len=1448)
   35 1.999889275  10.6.15.144 → 192.168.1.16 SSH 1514 Server: Encrypted packet (len=1448)
   36 1.999900141 192.168.1.16 → 10.6.15.144  TCP 66 59298 → 22 [ACK] Seq=1173 Ack=3509 Win=5703 Len=0 TSval=5090460 TSecr=5686820
   37 2.000578047  10.6.15.144 → 192.168.1.16 SSH 1406 Server: Encrypted packet (len=1340)
   38 2.006783361  10.6.15.144 → 192.168.1.16 SSH 1514 Server: Encrypted packet (len=1448)
   39 2.006805673 192.168.1.16 → 10.6.15.144  TCP 66 59298 → 22 [ACK] Seq=1173 Ack=6297 Win=5703 Len=0 TSval=5090462 TSecr=5686820
   40 2.006964898  10.6.15.144 → 192.168.1.16 SSH 1514 Server: Encrypted packet (len=1448)
   41 2.015136574  10.6.15.144 → 192.168.1.16 SSH 1514 Server: Encrypted packet (len=1448)
   42 2.015155839 192.168.1.16 → 10.6.15.144  TCP 66 59298 → 22 [ACK] Seq=1173 Ack=9193 Win=5703 Len=0 TSval=5090464 TSecr=5686821
   43 2.015316267  10.6.15.144 → 192.168.1.16 SSH 1514 Server: Encrypted packet (len=1448)
   44 2.022479917 192.168.1.16 → 10.6.15.144  SSH 118 Client: Encrypted packet (len=52)
   45 2.022694842 192.168.1.16 → 10.6.15.144  SSH 102 Client: Encrypted packet (len=36)
   46 2.023418846  10.6.15.144 → 192.168.1.16 SSH 1514 Server: Encrypted packet (len=1448)
   47 2.023608603  10.6.15.144 → 192.168.1.16 SSH 1514 Server: Encrypted packet (len=1448)
   48 2.023620818 192.168.1.16 → 10.6.15.144  TCP 66 59298 → 22 [ACK] Seq=1261 Ack=13537 Win=5703 Len=0 TSval=5090466 TSecr=5686825
   49 2.033214467  10.6.15.144 → 192.168.1.16 SSH 1514 Server: Encrypted packet (len=1448)
   50 2.033401287  10.6.15.144 → 192.168.1.16 SSH 1514 Server: Encrypted packet (len=1448)
   51 2.033416714 192.168.1.16 → 10.6.15.144  TCP 66 59298 → 22 [ACK] Seq=1261 Ack=16433 Win=5703 Len=0 TSval=5090468 TSecr=5686827
   52 2.033592498  10.6.15.144 → 192.168.1.16 SSH 1514 Server: Encrypted packet (len=1448)
   53 2.044041994  10.6.15.144 → 192.168.1.16 SSH 1514 Server: Encrypted packet (len=1448)
   54 2.044062080 192.168.1.16 → 10.6.15.144  TCP 66 59298 → 22 [ACK] Seq=1261 Ack=19329 Win=5703 Len=0 TSval=5090471 TSecr=5686827
   55 2.044224515  10.6.15.144 → 192.168.1.16 SSH 1514 Server: Encrypted packet (len=1448)
   56 2.086104778 192.168.1.16 → 10.6.15.144  TCP 66 59298 → 22 [ACK] Seq=1261 Ack=20777 Win=5703 Len=0 TSval=5090482 TSecr=5686830
   57 2.094166707  10.6.15.144 → 192.168.1.16 SSH 1514 Server: [TCP Previous segment not captured] , Encrypted packet (len=1448)
   58 2.094182901 192.168.1.16 → 10.6.15.144  TCP 78 [TCP Dup ACK 56#1] 59298 → 22 [ACK] Seq=1261 Ack=20777 Win=5703 Len=0 TSval=5090484 TSecr=5686830 SLE=23673 SRE=25121
   59 2.102379100  10.6.15.144 → 192.168.1.16 SSH 1514 Server: Encrypted packet (len=1448)
   60 2.102395386 192.168.1.16 → 10.6.15.144  TCP 78 [TCP Dup ACK 56#2] 59298 → 22 [ACK] Seq=1261 Ack=20777 Win=5703 Len=0 TSval=5090486 TSecr=5686830 SLE=23673 SRE=26569
   61 2.102566235  10.6.15.144 → 192.168.1.16 SSH 1514 Server: Encrypted packet (len=1448)
   62 2.102574625 192.168.1.16 → 10.6.15.144  TCP 78 [TCP Dup ACK 56#3] 59298 → 22 [ACK] Seq=1261 Ack=20777 Win=5703 Len=0 TSval=5090486 TSecr=5686830 SLE=23673 SRE=28017
   63 2.111101979  10.6.15.144 → 192.168.1.16 SSH 1514 Server: [TCP Fast Retransmission] , Encrypted packet (len=1448)
   64 2.111123589 192.168.1.16 → 10.6.15.144  TCP 78 59298 → 22 [ACK] Seq=1261 Ack=22225 Win=5703 Len=0 TSval=5090488 TSecr=5686847 SLE=23673 SRE=28017
   65 2.111288300  10.6.15.144 → 192.168.1.16 TCP 1514 [TCP Retransmission] 22 → 59298 [ACK] Seq=22225 Ack=1261 Win=1452 Len=1448 TSval=5686847 TSecr=5090486
   66 2.111301712 192.168.1.16 → 10.6.15.144  TCP 66 59298 → 22 [ACK] Seq=1261 Ack=28017 Win=5703 Len=0 TSval=5090488 TSecr=5686847
   67 2.120868548  10.6.15.144 → 192.168.1.16 SSH 1514 Server: Encrypted packet (len=1448)
   68 2.120893605 192.168.1.16 → 10.6.15.144  TCP 66 59298 → 22 [ACK] Seq=1261 Ack=29465 Win=5703 Len=0 TSval=5090490 TSecr=5686849
   69 2.120919190  10.6.15.144 → 192.168.1.16 SSH 154 Server: Encrypted packet (len=88)
   70 2.120924888 192.168.1.16 → 10.6.15.144  TCP 66 59298 → 22 [ACK] Seq=1261 Ack=29553 Win=5703 Len=0 TSval=5090490 TSecr=5686849
   71 3.670036180 192.168.1.16 → 192.168.1.1  DNS 74 Standard query 0xf8c8 A ntp.ubuntu.com
   72 3.683044240  192.168.1.1 → 192.168.1.16 DNS 138 Standard query response 0xf8c8 A ntp.ubuntu.com A 91.189.89.198 A 91.189.89.199 A 91.189.91.157 A 91.189.94.4
   73 3.683516762 192.168.1.16 → 91.189.89.198 NTP 90 NTP Version 4, client
   74 7.969373876  10.6.15.144 → 192.168.1.16 SSH 1514 Server: Encrypted packet (len=1448)
   75 7.969393980 192.168.1.16 → 10.6.15.144  TCP 66 59298 → 22 [ACK] Seq=1261 Ack=31001 Win=5703 Len=0 TSval=5091952 TSecr=5688190
   76 7.969531685  10.6.15.144 → 192.168.1.16 SSH 1514 Server: Encrypted packet (len=1448)
   77 7.969535545 192.168.1.16 → 10.6.15.144  TCP 66 59298 → 22 [ACK] Seq=1261 Ack=32449 Win=5703 Len=0 TSval=5091952 TSecr=5688190
   78 7.969724872  10.6.15.144 → 192.168.1.16 SSH 1514 Server: Encrypted packet (len=1448)
   79 7.969728604 192.168.1.16 → 10.6.15.144  TCP 66 59298 → 22 [ACK] Seq=1261 Ack=33897 Win=5703 Len=0 TSval=5091952 TSecr=5688190
   80 7.969916173  10.6.15.144 → 192.168.1.16 SSH 1514 Server: Encrypted packet (len=1448)
   81 7.969919681 192.168.1.16 → 10.6.15.144  TCP 66 59298 → 22 [ACK] Seq=1261 Ack=35345 Win=5703 Len=0 TSval=5091952 TSecr=5688228
   82 7.986218883  10.6.15.144 → 192.168.1.16 SSH 1514 Server: Encrypted packet (len=1448)
   83 7.986235362 192.168.1.16 → 10.6.15.144  TCP 66 59298 → 22 [ACK] Seq=1261 Ack=36793 Win=5703 Len=0 TSval=5091957 TSecr=5688315
   84 7.986406379  10.6.15.144 → 192.168.1.16 SSH 1514 Server: Encrypted packet (len=1448)
   85 7.986419669 192.168.1.16 → 10.6.15.144  TCP 66 59298 → 22 [ACK] Seq=1261 Ack=38241 Win=5703 Len=0 TSval=5091957 TSecr=5688315
   86 7.986592085  10.6.15.144 → 192.168.1.16 SSH 1514 Server: Encrypted packet (len=1448)
   87 7.986599146 192.168.1.16 → 10.6.15.144  TCP 66 59298 → 22 [ACK] Seq=1261 Ack=39689 Win=5703 Len=0 TSval=5091957 TSecr=5688315
   88 7.998999576  10.6.15.144 → 192.168.1.16 SSH 1514 Server: Encrypted packet (len=1448)
   89 7.999016326 192.168.1.16 → 10.6.15.144  TCP 66 59298 → 22 [ACK] Seq=1261 Ack=41137 Win=5703 Len=0 TSval=5091960 TSecr=5688319
   90 7.999181048  10.6.15.144 → 192.168.1.16 SSH 1514 Server: Encrypted packet (len=1448)
   91 7.999186714 192.168.1.16 → 10.6.15.144  TCP 66 59298 → 22 [ACK] Seq=1261 Ack=42585 Win=5703 Len=0 TSval=5091960 TSecr=5688319
   92 8.000072470  10.6.15.144 → 192.168.1.16 SSH 1514 Server: Encrypted packet (len=1448)
   93 8.000077248 192.168.1.16 → 10.6.15.144  TCP 66 59298 → 22 [ACK] Seq=1261 Ack=44033 Win=5703 Len=0 TSval=5091960 TSecr=5688319
   94 8.000680104  10.6.15.144 → 192.168.1.16 SSH 1514 Server: Encrypted packet (len=1448)
   95 8.000684607 192.168.1.16 → 10.6.15.144  TCP 66 59298 → 22 [ACK] Seq=1261 Ack=45481 Win=5703 Len=0 TSval=5091960 TSecr=5688319
   96 8.011472573  10.6.15.144 → 192.168.1.16 SSH 1514 Server: Encrypted packet (len=1448)
   97 8.011491877 192.168.1.16 → 10.6.15.144  TCP 66 59298 → 22 [ACK] Seq=1261 Ack=46929 Win=5703 Len=0 TSval=5091963 TSecr=5688322
   98 8.011617998  10.6.15.144 → 192.168.1.16 SSH 1514 Server: Encrypted packet (len=1448)
   99 8.011622628 192.168.1.16 → 10.6.15.144  TCP 66 59298 → 22 [ACK] Seq=1261 Ack=48377 Win=5703 Len=0 TSval=5091963 TSecr=5688322
  100 8.012205061  10.6.15.144 → 192.168.1.16 SSH 1514 Server: Encrypted packet (len=1448)
  101 8.012213965 192.168.1.16 → 10.6.15.144  TCP 66 59298 → 22 [ACK] Seq=1261 Ack=49825 Win=5703 Len=0 TSval=5091963 TSecr=5688322
  102 8.012391126  10.6.15.144 → 192.168.1.16 SSH 1498 Server: Encrypted packet (len=1432)
  103 8.012396317 192.168.1.16 → 10.6.15.144  TCP 66 59298 → 22 [ACK] Seq=1261 Ack=51257 Win=5703 Len=0 TSval=5091963 TSecr=5688322
  104 8.013310749 192.168.1.16 → 10.6.15.144  SSH 174 Client: Encrypted packet (len=108)
  105 8.013531321 192.168.1.16 → 10.6.15.144  SSH 134 Client: Encrypted packet (len=68)
  106 8.024319547  10.6.15.144 → 192.168.1.16 TCP 66 22 → 59298 [ACK] Seq=51257 Ack=1437 Win=1452 Len=0 TSval=5688325 TSecr=5091963
  107 8.095511725  10.6.15.144 → 192.168.1.16 SSH 470 Server: Encrypted packet (len=404)
  108 8.096074438  10.6.15.144 → 192.168.1.16 SSH 1514 Server: Encrypted packet (len=1448)
  109 8.096087632 192.168.1.16 → 10.6.15.144  TCP 66 59298 → 22 [ACK] Seq=1437 Ack=53109 Win=5703 Len=0 TSval=5091984 TSecr=5688343
  110 8.096260759  10.6.15.144 → 192.168.1.16 SSH 1514 Server: Encrypted packet (len=1448)
  111 8.096267950  10.6.15.144 → 192.168.1.16 SSH 110 Server: Encrypted packet (len=44)
  112 8.096276740 192.168.1.16 → 10.6.15.144  TCP 66 59298 → 22 [ACK] Seq=1437 Ack=54601 Win=5703 Len=0 TSval=5091984 TSecr=5688343
  113 8.106668588  10.6.15.144 → 192.168.1.16 SSH 1514 Server: Encrypted packet (len=1448)
  114 8.106849387  10.6.15.144 → 192.168.1.16 SSH 1514 Server: Encrypted packet (len=1448)
  115 8.106857157 192.168.1.16 → 10.6.15.144  TCP 66 59298 → 22 [ACK] Seq=1437 Ack=57497 Win=5703 Len=0 TSval=5091987 TSecr=5688345
  116 8.107042372  10.6.15.144 → 192.168.1.16 SSH 1514 Server: Encrypted packet (len=1448)
  117 8.107643860  10.6.15.144 → 192.168.1.16 SSH 1514 Server: Encrypted packet (len=1448)
  118 8.107661438 192.168.1.16 → 10.6.15.144  TCP 66 59298 → 22 [ACK] Seq=1437 Ack=60393 Win=5703 Len=0 TSval=5091987 TSecr=5688345
  119 8.117035893  10.6.15.144 → 192.168.1.16 SSH 1514 Server: Encrypted packet (len=1448)
  120 8.117219425  10.6.15.144 → 192.168.1.16 SSH 1514 Server: Encrypted packet (len=1448)
  121 8.117225823 192.168.1.16 → 10.6.15.144  TCP 66 59298 → 22 [ACK] Seq=1437 Ack=63289 Win=5703 Len=0 TSval=5091989 TSecr=5688348
  122 8.117416062  10.6.15.144 → 192.168.1.16 SSH 1514 Server: Encrypted packet (len=1448)
  123 8.117987129  10.6.15.144 → 192.168.1.16 SSH 1514 Server: Encrypted packet (len=1448)
  124 8.117993676 192.168.1.16 → 10.6.15.144  TCP 66 59298 → 22 [ACK] Seq=1437 Ack=66185 Win=5703 Len=0 TSval=5091989 TSecr=5688348
  125 8.126534818  10.6.15.144 → 192.168.1.16 SSH 1514 Server: Encrypted packet (len=1448)
  126 8.126550949  10.6.15.144 → 192.168.1.16 SSH 158 Server: Encrypted packet (len=92)
  127 8.126560836 192.168.1.16 → 10.6.15.144  TCP 66 59298 → 22 [ACK] Seq=1437 Ack=67725 Win=5703 Len=0 TSval=5091992 TSecr=5688351
  128 8.134637862 192.168.1.16 → 10.6.15.144  SSH 110 Client: Encrypted packet (len=44)
  129 8.144706323 192.168.1.16 → 10.6.15.144  SSH 126 Client: Encrypted packet (len=60)
  130 8.144927049 192.168.1.16 → 10.6.15.144  SSH 154 Client: Encrypted packet (len=88)
  131 8.145329445 192.168.1.16 → 10.6.15.144  SSH 126 Client: Encrypted packet (len=60)
  132 8.145845623 192.168.1.16 → 10.6.15.144  SSH 102 Client: Encrypted packet (len=36)
  133 8.147642606 192.168.1.16 → 10.6.15.144  SSH 110 Client: Encrypted packet (len=44)
  134 8.148980172 192.168.1.16 → 10.6.15.144  SSH 102 Client: Encrypted packet (len=36)
  135 8.150609950 192.168.1.16 → 10.6.15.144  SSH 102 Client: Encrypted packet (len=36)
  136 8.182261556  10.6.15.144 → 192.168.1.16 TCP 66 22 → 59298 [ACK] Seq=67725 Ack=1841 Win=1449 Len=0 TSval=5688365 TSecr=5091994
  137 8.182284027 192.168.1.16 → 10.6.15.144  SSH 102 Client: Encrypted packet (len=36)
  138 8.230127030  10.6.15.144 → 192.168.1.16 TCP 66 22 → 59298 [ACK] Seq=67725 Ack=1877 Win=1449 Len=0 TSval=5688377 TSecr=5092006
  139 8.436178757 192.168.1.16 → 10.6.15.144  SSH 110 Client: Encrypted packet (len=44)
  140 8.484315840  10.6.15.144 → 192.168.1.16 TCP 66 22 → 59298 [ACK] Seq=67725 Ack=1921 Win=1449 Len=0 TSval=5688441 TSecr=5092069
  141 8.606134555 192.168.1.16 → 10.6.15.144  SSH 102 Client: Encrypted packet (len=36)
  142 8.607100334 192.168.1.16 → 10.6.15.144  SSH 182 Client: Encrypted packet (len=116)
  143 8.654197699  10.6.15.144 → 192.168.1.16 TCP 66 22 → 59298 [ACK] Seq=67725 Ack=2073 Win=1448 Len=0 TSval=5688483 TSecr=5092110
  144 8.668988758  192.168.1.1 → 224.0.0.1    IGMPv2 42 Membership Query, general
  145 11.559747113 192.168.1.16 → 10.6.15.144  SSH 1514 Client: Encrypted packet (len=1448)
  146 11.561396766 192.168.1.16 → 10.6.15.144  SSH 302 Client: Encrypted packet (len=236)
  147 11.570781448  10.6.15.144 → 192.168.1.16 TCP 66 22 → 59298 [ACK] Seq=67725 Ack=3757 Win=1447 Len=0 TSval=5689212 TSecr=5092850
  148 13.406142426 192.168.1.16 → 224.0.0.251  IGMPv2 46 Membership Report group 224.0.0.251
  149 17.067343863 192.168.1.16 → 54.76.71.168 TCP 128 42414 → 8282 [PSH, ACK] Seq=1 Ack=1 Win=296 Len=62 TSval=5094227 TSecr=609199454
  150 17.984690080 54.76.71.168 → 192.168.1.16 TCP 66 8282 → 42414 [ACK] Seq=1 Ack=63 Win=121 Len=0 TSval=609206203 TSecr=5094227
  151 17.985122547  10.6.15.144 → 192.168.1.16 SSH 470 Server: Encrypted packet (len=404)
  152 17.985491326  10.6.15.144 → 192.168.1.16 SSH 142 Server: Encrypted packet (len=76)
  153 17.985534828 192.168.1.16 → 10.6.15.144  TCP 66 59298 → 22 [ACK] Seq=3757 Ack=68205 Win=5703 Len=0 TSval=5094456 TSecr=5690682
  154 17.985643583 192.168.1.16 → 10.6.15.144  SSH 118 Client: Encrypted packet (len=52)
  155 17.985917529 192.168.1.16 → 10.6.15.144  SSH 542 Client: Encrypted packet (len=476)
  156 17.986094804  10.6.15.144 → 192.168.1.16 SSH 142 Server: [TCP Spurious Retransmission] , Encrypted packet (len=76)
  157 17.986101436 192.168.1.16 → 10.6.15.144  SSH 290 Client: Encrypted packet (len=212)
  158 17.987382661  10.6.15.144 → 192.168.1.16 SSH 242 Server: Encrypted packet (len=176)
  159 17.989335894 192.168.1.16 → 10.6.15.144  SSH 126 Client: Encrypted packet (len=60)
  160 17.989905047  10.6.15.144 → 192.168.1.16 SSH 1514 Server: [TCP Previous segment not captured] , Encrypted packet (len=1448)
  161 17.989918743 192.168.1.16 → 10.6.15.144  TCP 78 [TCP Dup ACK 159#1] 59298 → 22 [ACK] Seq=4557 Ack=68381 Win=5703 Len=0 TSval=5094457 TSecr=5690699 SLE=69829 SRE=71277
  162 17.990100047  10.6.15.144 → 192.168.1.16 SSH 1514 Server: Encrypted packet (len=1448)
  163 17.990106490 192.168.1.16 → 10.6.15.144  TCP 78 [TCP Dup ACK 159#2] 59298 → 22 [ACK] Seq=4557 Ack=68381 Win=5703 Len=0 TSval=5094458 TSecr=5690699 SLE=69829 SRE=72725
  164 17.995555101  10.6.15.144 → 192.168.1.16 SSH 1514 Server: Encrypted packet (len=1448)
  165 17.995576119 192.168.1.16 → 10.6.15.144  TCP 78 [TCP Dup ACK 159#3] 59298 → 22 [ACK] Seq=4557 Ack=68381 Win=5703 Len=0 TSval=5094459 TSecr=5690699 SLE=69829 SRE=74173
  166 17.995591827  10.6.15.144 → 192.168.1.16 TCP 66 22 → 59298 [ACK] Seq=74173 Ack=3809 Win=1452 Len=0 TSval=5690818 TSecr=5094456
  167 17.995962351  10.6.15.144 → 192.168.1.16 TCP 66 22 → 59298 [ACK] Seq=74173 Ack=4285 Win=1452 Len=0 TSval=5690818 TSecr=5094456
  168 17.997701166  10.6.15.144 → 192.168.1.16 TCP 66 22 → 59298 [ACK] Seq=74173 Ack=4497 Win=1452 Len=0 TSval=5690819 TSecr=5094457
  169 17.998134749  10.6.15.144 → 192.168.1.16 TCP 66 22 → 59298 [ACK] Seq=74173 Ack=4557 Win=1452 Len=0 TSval=5690819 TSecr=5094457
  170 17.999586199  10.6.15.144 → 192.168.1.16 SSH 1514 Server: Encrypted packet (len=1448)
  171 17.999607570 192.168.1.16 → 10.6.15.144  TCP 78 [TCP Dup ACK 159#4] 59298 → 22 [ACK] Seq=4557 Ack=68381 Win=5703 Len=0 TSval=5094460 TSecr=5690699 SLE=69829 SRE=75621
  172 17.999777895  10.6.15.144 → 192.168.1.16 SSH 1514 Server: Encrypted packet (len=1448)
  173 17.999799274 192.168.1.16 → 10.6.15.144  TCP 78 [TCP Dup ACK 159#5] 59298 → 22 [ACK] Seq=4557 Ack=68381 Win=5703 Len=0 TSval=5094460 TSecr=5690699 SLE=69829 SRE=77069
  174 18.005254627  10.6.15.144 → 192.168.1.16 SSH 1514 Server: [TCP Fast Retransmission] , Encrypted packet (len=1448)
  175 18.005277236 192.168.1.16 → 10.6.15.144  TCP 66 59298 → 22 [ACK] Seq=4557 Ack=77069 Win=5703 Len=0 TSval=5094461 TSecr=5690820
  176 18.009515466  10.6.15.144 → 192.168.1.16 SSH 1514 Server: Encrypted packet (len=1448)
  177 18.009530889 192.168.1.16 → 10.6.15.144  TCP 66 59298 → 22 [ACK] Seq=4557 Ack=78517 Win=5703 Len=0 TSval=5094462 TSecr=5690821
  178 18.014147653 192.168.1.16 → 224.0.0.252  IGMPv2 46 Membership Report group 224.0.0.252
  179 18.018703886  10.6.15.144 → 192.168.1.16 SSH 1514 Server: Encrypted packet (len=1448)
  180 18.018721108 192.168.1.16 → 10.6.15.144  TCP 66 59298 → 22 [ACK] Seq=4557 Ack=79965 Win=5703 Len=0 TSval=5094465 TSecr=5690823
  181 18.019255288  10.6.15.144 → 192.168.1.16 SSH 1514 Server: Encrypted packet (len=1448)
  182 18.019260933 192.168.1.16 → 10.6.15.144  TCP 66 59298 → 22 [ACK] Seq=4557 Ack=81413 Win=5703 Len=0 TSval=5094465 TSecr=5690824
  183 18.019440695  10.6.15.144 → 192.168.1.16 SSH 1514 Server: Encrypted packet (len=1448)
  184 18.019448917 192.168.1.16 → 10.6.15.144  TCP 66 59298 → 22 [ACK] Seq=4557 Ack=82861 Win=5703 Len=0 TSval=5094465 TSecr=5690824
  185 18.027860799  10.6.15.144 → 192.168.1.16 SSH 1514 Server: Encrypted packet (len=1448)
  186 18.027873013 192.168.1.16 → 10.6.15.144  TCP 66 59298 → 22 [ACK] Seq=4557 Ack=84309 Win=5703 Len=0 TSval=5094467 TSecr=5690826
  187 18.028751426  10.6.15.144 → 192.168.1.16 SSH 1514 Server: Encrypted packet (len=1448)
  188 18.028759171 192.168.1.16 → 10.6.15.144  TCP 66 59298 → 22 [ACK] Seq=4557 Ack=85757 Win=5703 Len=0 TSval=5094467 TSecr=5690826
  189 18.028930387  10.6.15.144 → 192.168.1.16 SSH 1514 Server: Encrypted packet (len=1448)
  190 18.028936425 192.168.1.16 → 10.6.15.144  TCP 66 59298 → 22 [ACK] Seq=4557 Ack=87205 Win=5703 Len=0 TSval=5094467 TSecr=5690826
  191 18.037445361  10.6.15.144 → 192.168.1.16 SSH 1514 Server: Encrypted packet (len=1448)
  192 18.037468132 192.168.1.16 → 10.6.15.144  TCP 66 59298 → 22 [ACK] Seq=4557 Ack=88653 Win=5703 Len=0 TSval=5094469 TSecr=5690829
  193 18.039454825  10.6.15.144 → 192.168.1.16 SSH 1514 Server: Encrypted packet (len=1448)
  194 18.039461570 192.168.1.16 → 10.6.15.144  TCP 66 59298 → 22 [ACK] Seq=4557 Ack=90101 Win=5703 Len=0 TSval=5094470 TSecr=5690829
  195 18.040117367  10.6.15.144 → 192.168.1.16 SSH 1514 Server: Encrypted packet (len=1448)
  196 18.040123392 192.168.1.16 → 10.6.15.144  TCP 66 59298 → 22 [ACK] Seq=4557 Ack=91549 Win=5703 Len=0 TSval=5094470 TSecr=5690829
  197 18.047971084  10.6.15.144 → 192.168.1.16 SSH 1514 Server: Encrypted packet (len=1448)
  198 18.047990545 192.168.1.16 → 10.6.15.144  TCP 66 59298 → 22 [ACK] Seq=4557 Ack=92997 Win=5703 Len=0 TSval=5094472 TSecr=5690831
  199 18.049844610  10.6.15.144 → 192.168.1.16 SSH 1514 Server: Encrypted packet (len=1448)
  200 18.049851123 192.168.1.16 → 10.6.15.144  TCP 66 59298 → 22 [ACK] Seq=4557 Ack=94445 Win=5703 Len=0 TSval=5094472 TSecr=5690831
  201 18.052999508  10.6.15.144 → 192.168.1.16 SSH 1514 Server: Encrypted packet (len=1448)
  202 18.053017013 192.168.1.16 → 10.6.15.144  TCP 66 59298 → 22 [ACK] Seq=4557 Ack=95893 Win=5703 Len=0 TSval=5094473 TSecr=5690831
  203 18.059116653  10.6.15.144 → 192.168.1.16 SSH 1514 Server: Encrypted packet (len=1448)
  204 18.059140699 192.168.1.16 → 10.6.15.144  TCP 66 59298 → 22 [ACK] Seq=4557 Ack=97341 Win=5703 Len=0 TSval=5094475 TSecr=5690833
  205 18.059274618  10.6.15.144 → 192.168.1.16 SSH 1514 Server: Encrypted packet (len=1448)
  206 18.059466609  10.6.15.144 → 192.168.1.16 SSH 1514 Server: Encrypted packet (len=1448)
  207 18.059474497 192.168.1.16 → 10.6.15.144  TCP 66 59298 → 22 [ACK] Seq=4557 Ack=100237 Win=5703 Len=0 TSval=5094475 TSecr=5690834
  208 18.068013163  10.6.15.144 → 192.168.1.16 SSH 1514 Server: Encrypted packet (len=1448)
  209 18.072515287  10.6.15.144 → 192.168.1.16 SSH 1514 Server: Encrypted packet (len=1448)
  210 18.072533614 192.168.1.16 → 10.6.15.144  TCP 66 59298 → 22 [ACK] Seq=4557 Ack=103133 Win=5703 Len=0 TSval=5094478 TSecr=5690837
  211 18.072636892  10.6.15.144 → 192.168.1.16 SSH 1514 Server: Encrypted packet (len=1448)
  212 18.073216769  10.6.15.144 → 192.168.1.16 SSH 1514 Server: Encrypted packet (len=1448)
  213 18.073225638 192.168.1.16 → 10.6.15.144  TCP 66 59298 → 22 [ACK] Seq=4557 Ack=106029 Win=5703 Len=0 TSval=5094478 TSecr=5690838
  214 18.075175975 192.168.1.16 → 10.6.15.144  SSH 118 Client: Encrypted packet (len=52)
  215 18.077687235 192.168.1.16 → 10.6.15.144  SSH 102 Client: Encrypted packet (len=36)
  216 18.077927661 192.168.1.16 → 10.6.15.144  SSH 102 Client: Encrypted packet (len=36)
  217 18.078985521 192.168.1.16 → 10.6.15.144  SSH 102 Client: Encrypted packet (len=36)
  218 18.079264160 192.168.1.16 → 10.6.15.144  SSH 102 Client: Encrypted packet (len=36)
  219 18.081862863  10.6.15.144 → 192.168.1.16 SSH 1514 Server: Encrypted packet (len=1448)
  220 18.082049106  10.6.15.144 → 192.168.1.16 SSH 1514 Server: Encrypted packet (len=1448)
  221 18.082056557 192.168.1.16 → 10.6.15.144  TCP 66 59298 → 22 [ACK] Seq=4753 Ack=108925 Win=5703 Len=0 TSval=5094480 TSecr=5690840
  222 18.082678071  10.6.15.144 → 192.168.1.16 SSH 1514 Server: Encrypted packet (len=1448)
  223 18.082867334  10.6.15.144 → 192.168.1.16 SSH 1514 Server: Encrypted packet (len=1448)
  224 18.082877210 192.168.1.16 → 10.6.15.144  TCP 66 59298 → 22 [ACK] Seq=4753 Ack=111821 Win=5703 Len=0 TSval=5094481 TSecr=5690840
  225 18.084986247 192.168.1.16 → 10.6.15.144  SSH 134 Client: Encrypted packet (len=68)
  226 18.085826906 192.168.1.16 → 10.6.15.144  SSH 118 Client: Encrypted packet (len=52)
  227 18.085902236  10.6.15.144 → 192.168.1.16 TCP 66 22 → 59298 [ACK] Seq=111821 Ack=4645 Win=1452 Len=0 TSval=5690841 TSecr=5094479
  228 18.087474604  10.6.15.144 → 192.168.1.16 TCP 66 22 → 59298 [ACK] Seq=111821 Ack=4717 Win=1452 Len=0 TSval=5690841 TSecr=5094479
  229 18.087545255 192.168.1.16 → 10.6.15.144  SSH 150 Client: Encrypted packet (len=84)
  230 18.089664687 192.168.1.16 → 10.6.15.144  SSH 110 Client: Encrypted packet (len=44)
  231 18.090543578  10.6.15.144 → 192.168.1.16 SSH 1514 Server: Encrypted packet (len=1448)
  232 18.090732539  10.6.15.144 → 192.168.1.16 SSH 1514 Server: Encrypted packet (len=1448)
  233 18.090741888 192.168.1.16 → 10.6.15.144  TCP 66 59298 → 22 [ACK] Seq=5001 Ack=114717 Win=5703 Len=0 TSval=5094483 TSecr=5690842
  234 18.091338010  10.6.15.144 → 192.168.1.16 SSH 1514 Server: Encrypted packet (len=1448)
  235 18.092103464  10.6.15.144 → 192.168.1.16 SSH 1514 Server: Encrypted packet (len=1448)
  236 18.092111408 192.168.1.16 → 10.6.15.144  TCP 66 59298 → 22 [ACK] Seq=5001 Ack=117613 Win=5703 Len=0 TSval=5094483 TSecr=5690842
  237 18.094253667  10.6.15.144 → 192.168.1.16 TCP 66 22 → 59298 [ACK] Seq=117613 Ack=4873 Win=1452 Len=0 TSval=5690843 TSecr=5094481
  238 18.098644095  10.6.15.144 → 192.168.1.16 TCP 66 22 → 59298 [ACK] Seq=117613 Ack=5001 Win=1452 Len=0 TSval=5690844 TSecr=5094482
  239 18.099910432  10.6.15.144 → 192.168.1.16 SSH 1514 Server: Encrypted packet (len=1448)
  240 18.100099018  10.6.15.144 → 192.168.1.16 SSH 1514 Server: Encrypted packet (len=1448)
  241 18.100110143 192.168.1.16 → 10.6.15.144  TCP 66 59298 → 22 [ACK] Seq=5001 Ack=120509 Win=5703 Len=0 TSval=5094485 TSecr=5690844
  242 18.100803846  10.6.15.144 → 192.168.1.16 SSH 1514 Server: Encrypted packet (len=1448)
  243 18.101440676  10.6.15.144 → 192.168.1.16 SSH 1514 Server: Encrypted packet (len=1448)
  244 18.101451049 192.168.1.16 → 10.6.15.144  TCP 66 59298 → 22 [ACK] Seq=5001 Ack=123405 Win=5703 Len=0 TSval=5094485 TSecr=5690844
  245 18.111071059  10.6.15.144 → 192.168.1.16 SSH 1514 Server: Encrypted packet (len=1448)
  246 18.111192742  10.6.15.144 → 192.168.1.16 SSH 1514 Server: Encrypted packet (len=1448)
  247 18.111201210 192.168.1.16 → 10.6.15.144  TCP 66 59298 → 22 [ACK] Seq=5001 Ack=126301 Win=5703 Len=0 TSval=5094488 TSecr=5690847
  248 18.112016827  10.6.15.144 → 192.168.1.16 SSH 1514 Server: Encrypted packet (len=1448)
  249 18.112176021  10.6.15.144 → 192.168.1.16 SSH 1514 Server: Encrypted packet (len=1448)
  250 18.112181591 192.168.1.16 → 10.6.15.144  TCP 66 59298 → 22 [ACK] Seq=5001 Ack=129197 Win=5703 Len=0 TSval=5094488 TSecr=5690847
  251 18.113757132 192.168.1.16 → 10.6.15.144  SSH 134 Client: Encrypted packet (len=68)
  252 18.121093926  10.6.15.144 → 192.168.1.16 SSH 1514 Server: Encrypted packet (len=1448)
  253 18.121276899  10.6.15.144 → 192.168.1.16 SSH 1514 Server: Encrypted packet (len=1448)
  254 18.121290124 192.168.1.16 → 10.6.15.144  TCP 66 59298 → 22 [ACK] Seq=5069 Ack=132093 Win=5703 Len=0 TSval=5094490 TSecr=5690849
  255 18.121467160  10.6.15.144 → 192.168.1.16 SSH 1514 Server: Encrypted packet (len=1448)
  256 18.121658755  10.6.15.144 → 192.168.1.16 SSH 1514 Server: Encrypted packet (len=1448)
  257 18.121665524 192.168.1.16 → 10.6.15.144  TCP 66 59298 → 22 [ACK] Seq=5069 Ack=134989 Win=5703 Len=0 TSval=5094490 TSecr=5690849
  258 18.122280984  10.6.15.144 → 192.168.1.16 SSH 1514 Server: Encrypted packet (len=1448)
  259 18.122463103  10.6.15.144 → 192.168.1.16 SSH 1514 Server: Encrypted packet (len=1448)
  260 18.122468618 192.168.1.16 → 10.6.15.144  TCP 66 59298 → 22 [ACK] Seq=5069 Ack=137885 Win=5703 Len=0 TSval=5094491 TSecr=5690850
  261 18.125201948 192.168.1.16 → 10.6.15.144  SSH 126 Client: Encrypted packet (len=60)
  262 18.131399798  10.6.15.144 → 192.168.1.16 SSH 1514 Server: Encrypted packet (len=1448)
  263 18.131585054  10.6.15.144 → 192.168.1.16 SSH 1514 Server: Encrypted packet (len=1448)
  264 18.131590877 192.168.1.16 → 10.6.15.144  TCP 66 59298 → 22 [ACK] Seq=5129 Ack=140781 Win=5703 Len=0 TSval=5094493 TSecr=5690852
  265 18.131785940  10.6.15.144 → 192.168.1.16 SSH 1514 Server: Encrypted packet (len=1448)
  266 18.132406110  10.6.15.144 → 192.168.1.16 SSH 1514 Server: Encrypted packet (len=1448)
  267 18.132418018 192.168.1.16 → 10.6.15.144  TCP 66 59298 → 22 [ACK] Seq=5129 Ack=143677 Win=5703 Len=0 TSval=5094493 TSecr=5690852
  268 18.132594027  10.6.15.144 → 192.168.1.16 SSH 1514 Server: Encrypted packet (len=1448)
  269 18.132617719 192.168.1.16 → 10.6.15.144  SSH 110 Client: Encrypted packet (len=44)
  270 18.132787326  10.6.15.144 → 192.168.1.16 SSH 1514 Server: Encrypted packet (len=1448)
  271 18.135771944 192.168.1.16 → 10.6.15.144  SSH 118 Client: Encrypted packet (len=52)
  272 18.141767655  10.6.15.144 → 192.168.1.16 SSH 1514 Server: Encrypted packet (len=1448)
  273 18.141948493  10.6.15.144 → 192.168.1.16 SSH 1514 Server: Encrypted packet (len=1448)
  274 18.141954745 192.168.1.16 → 10.6.15.144  TCP 66 59298 → 22 [ACK] Seq=5225 Ack=149469 Win=5703 Len=0 TSval=5094495 TSecr=5690854
  275 18.142851262  10.6.15.144 → 192.168.1.16 SSH 1514 Server: Encrypted packet (len=1448)
  276 18.143393844  10.6.15.144 → 192.168.1.16 SSH 1514 Server: Encrypted packet (len=1448)
  277 18.143406404 192.168.1.16 → 10.6.15.144  TCP 66 59298 → 22 [ACK] Seq=5225 Ack=152365 Win=5703 Len=0 TSval=5094496 TSecr=5690855
  278 18.146704693  10.6.15.144 → 192.168.1.16 SSH 1514 Server: Encrypted packet (len=1448)
  279 18.146891557  10.6.15.144 → 192.168.1.16 SSH 1514 Server: Encrypted packet (len=1448)
  280 18.146902389 192.168.1.16 → 10.6.15.144  TCP 66 59298 → 22 [ACK] Seq=5225 Ack=155261 Win=5703 Len=0 TSval=5094497 TSecr=5690855
  281 18.151531874  10.6.15.144 → 192.168.1.16 SSH 1514 Server: Encrypted packet (len=1448)
  282 18.151679758  10.6.15.144 → 192.168.1.16 SSH 1514 Server: Encrypted packet (len=1448)
  283 18.151685442 192.168.1.16 → 10.6.15.144  TCP 66 59298 → 22 [ACK] Seq=5225 Ack=158157 Win=5703 Len=0 TSval=5094498 TSecr=5690857
  284 18.153015139  10.6.15.144 → 192.168.1.16 SSH 1514 Server: Encrypted packet (len=1448)
  285 18.153194330  10.6.15.144 → 192.168.1.16 SSH 1514 Server: Encrypted packet (len=1448)
  286 18.153202693 192.168.1.16 → 10.6.15.144  TCP 66 59298 → 22 [ACK] Seq=5225 Ack=161053 Win=5703 Len=0 TSval=5094498 TSecr=5690857
  287 18.156701266  10.6.15.144 → 192.168.1.16 SSH 1514 Server: Encrypted packet (len=1448)
  288 18.157273827  10.6.15.144 → 192.168.1.16 SSH 1514 Server: Encrypted packet (len=1448)
  289 18.157280266 192.168.1.16 → 10.6.15.144  TCP 66 59298 → 22 [ACK] Seq=5225 Ack=163949 Win=5703 Len=0 TSval=5094499 TSecr=5690858
  290 18.161665475  10.6.15.144 → 192.168.1.16 SSH 1514 Server: Encrypted packet (len=1448)
  291 18.161855995  10.6.15.144 → 192.168.1.16 SSH 1514 Server: Encrypted packet (len=1448)
  292 18.161865157 192.168.1.16 → 10.6.15.144  TCP 66 59298 → 22 [ACK] Seq=5225 Ack=166845 Win=5703 Len=0 TSval=5094500 TSecr=5690859
  293 18.163008107  10.6.15.144 → 192.168.1.16 SSH 1514 Server: Encrypted packet (len=1448)
  294 18.163167165  10.6.15.144 → 192.168.1.16 SSH 1514 Server: Encrypted packet (len=1448)
  295 18.163173391 192.168.1.16 → 10.6.15.144  TCP 66 59298 → 22 [ACK] Seq=5225 Ack=169741 Win=5703 Len=0 TSval=5094501 TSecr=5690860
  296 18.167239633  10.6.15.144 → 192.168.1.16 SSH 1514 Server: Encrypted packet (len=1448)
  297 18.167778484  10.6.15.144 → 192.168.1.16 SSH 1514 Server: Encrypted packet (len=1448)
  298 18.167790122 192.168.1.16 → 10.6.15.144  TCP 66 59298 → 22 [ACK] Seq=5225 Ack=172637 Win=5703 Len=0 TSval=5094502 TSecr=5690861
  299 18.169622058 192.168.1.16 → 10.6.15.144  SSH 126 Client: Encrypted packet (len=60)
  300 18.170297082 10.22.19.143 → 224.0.0.252  LLMNR 72 Standard query 0xd042 ANY Rajat-Laptop
  301 18.172328195  10.6.15.144 → 192.168.1.16 SSH 1514 Server: Encrypted packet (len=1448)
  302 18.172516071  10.6.15.144 → 192.168.1.16 SSH 1514 Server: Encrypted packet (len=1448)
  303 18.172526015 192.168.1.16 → 10.6.15.144  TCP 66 59298 → 22 [ACK] Seq=5285 Ack=175533 Win=5703 Len=0 TSval=5094503 TSecr=5690862
  304 18.173732380  10.6.15.144 → 192.168.1.16 SSH 1514 Server: Encrypted packet (len=1448)
  305 18.173923005  10.6.15.144 → 192.168.1.16 SSH 1514 Server: Encrypted packet (len=1448)
  306 18.173930498 192.168.1.16 → 10.6.15.144  TCP 66 59298 → 22 [ACK] Seq=5285 Ack=178429 Win=5703 Len=0 TSval=5094503 TSecr=5690862
  307 18.178278552  10.6.15.144 → 192.168.1.16 SSH 1514 Server: Encrypted packet (len=1448)
  308 18.178463267  10.6.15.144 → 192.168.1.16 SSH 1514 Server: Encrypted packet (len=1448)
  309 18.178471032 192.168.1.16 → 10.6.15.144  TCP 66 59298 → 22 [ACK] Seq=5285 Ack=181325 Win=5703 Len=0 TSval=5094505 TSecr=5690863
  310 18.182793564  10.6.15.144 → 192.168.1.16 SSH 1514 Server: Encrypted packet (len=1448)
  311 18.182941388  10.6.15.144 → 192.168.1.16 SSH 1514 Server: Encrypted packet (len=1448)
  312 18.182956585 192.168.1.16 → 10.6.15.144  TCP 66 59298 → 22 [ACK] Seq=5285 Ack=184221 Win=5703 Len=0 TSval=5094506 TSecr=5690865
  313 18.183631177  10.6.15.144 → 192.168.1.16 SSH 1514 Server: Encrypted packet (len=1448)
  314 18.183798121  10.6.15.144 → 192.168.1.16 SSH 1514 Server: Encrypted packet (len=1448)
  315 18.183803996 192.168.1.16 → 10.6.15.144  TCP 66 59298 → 22 [ACK] Seq=5285 Ack=187117 Win=5703 Len=0 TSval=5094506 TSecr=5690865
  316 18.187849115  10.6.15.144 → 192.168.1.16 SSH 1514 Server: Encrypted packet (len=1448)
  317 18.188032219  10.6.15.144 → 192.168.1.16 SSH 1514 Server: Encrypted packet (len=1448)
  318 18.188039765 192.168.1.16 → 10.6.15.144  TCP 66 59298 → 22 [ACK] Seq=5285 Ack=190013 Win=5703 Len=0 TSval=5094507 TSecr=5690866
  319 18.197702166  10.6.15.144 → 192.168.1.16 SSH 1514 Server: Encrypted packet (len=1448)
  320 18.197887916  10.6.15.144 → 192.168.1.16 SSH 1514 Server: Encrypted packet (len=1448)
  321 18.197897766 192.168.1.16 → 10.6.15.144  TCP 66 59298 → 22 [ACK] Seq=5285 Ack=192909 Win=5703 Len=0 TSval=5094509 TSecr=5690868
  322 18.198088515  10.6.15.144 → 192.168.1.16 SSH 1514 Server: Encrypted packet (len=1448)
  323 18.198766044  10.6.15.144 → 192.168.1.16 SSH 1514 Server: Encrypted packet (len=1448)
  324 18.198778045 192.168.1.16 → 10.6.15.144  TCP 66 59298 → 22 [ACK] Seq=5285 Ack=195805 Win=5703 Len=0 TSval=5094510 TSecr=5690868
  325 18.198955378  10.6.15.144 → 192.168.1.16 SSH 1514 Server: Encrypted packet (len=1448)
  326 18.199143833  10.6.15.144 → 192.168.1.16 SSH 1514 Server: Encrypted packet (len=1448)
  327 18.199150830 192.168.1.16 → 10.6.15.144  TCP 66 59298 → 22 [ACK] Seq=5285 Ack=198701 Win=5703 Len=0 TSval=5094510 TSecr=5690868
  328 18.199337966  10.6.15.144 → 192.168.1.16 SSH 1514 Server: Encrypted packet (len=1448)
  329 18.199531378  10.6.15.144 → 192.168.1.16 SSH 1514 Server: Encrypted packet (len=1448)
  330 18.199540117 192.168.1.16 → 10.6.15.144  TCP 66 59298 → 22 [ACK] Seq=5285 Ack=201597 Win=5703 Len=0 TSval=5094510 TSecr=5690869
  331 18.200814458 192.168.1.16 → 10.6.15.144  SSH 110 Client: Encrypted packet (len=44)
  332 18.208389122  10.6.15.144 → 192.168.1.16 SSH 1514 Server: Encrypted packet (len=1448)
  333 18.208542715  10.6.15.144 → 192.168.1.16 SSH 1514 Server: Encrypted packet (len=1448)
  334 18.208548605 192.168.1.16 → 10.6.15.144  TCP 66 59298 → 22 [ACK] Seq=5329 Ack=204493 Win=5703 Len=0 TSval=5094512 TSecr=5690871
  335 18.209369809  10.6.15.144 → 192.168.1.16 SSH 1514 Server: Encrypted packet (len=1448)
  336 18.209537262  10.6.15.144 → 192.168.1.16 SSH 1514 Server: Encrypted packet (len=1448)
  337 18.209545349 192.168.1.16 → 10.6.15.144  TCP 66 59298 → 22 [ACK] Seq=5329 Ack=207389 Win=5703 Len=0 TSval=5094512 TSecr=5690871
  338 18.209735678  10.6.15.144 → 192.168.1.16 SSH 1514 Server: Encrypted packet (len=1448)
  339 18.210643161 192.168.1.16 → 10.6.15.144  SSH 118 Client: Encrypted packet (len=52)
  340 18.212539603  10.6.15.144 → 192.168.1.16 SSH 386 Server: Encrypted packet (len=320)
  341 18.216931883 192.168.1.16 → 10.6.15.144  SSH 118 Client: Encrypted packet (len=52)
  342 18.249200943  10.6.15.144 → 192.168.1.16 TCP 66 22 → 59298 [ACK] Seq=209157 Ack=5433 Win=1451 Len=0 TSval=5690882 TSecr=5094510
  343 19.968246632  10.6.15.144 → 192.168.1.16 SSH 1514 Server: Encrypted packet (len=1448)
  344 19.968419948  10.6.15.144 → 192.168.1.16 SSH 1514 Server: [TCP Previous segment not captured] , Encrypted packet (len=1448)
  345 19.968427193 192.168.1.16 → 10.6.15.144  TCP 78 59298 → 22 [ACK] Seq=5433 Ack=210605 Win=5703 Len=0 TSval=5094952 TSecr=5690919 SLE=212053 SRE=213501
  346 19.968495542 192.168.1.16 → 10.6.15.144  SSH 150 Client: Encrypted packet (len=72)
  347 19.968626225  10.6.15.144 → 192.168.1.16 SSH 1514 Server: Encrypted packet (len=1448)
  348 19.968636116 192.168.1.16 → 10.6.15.144  TCP 78 [TCP Dup ACK 345#1] 59298 → 22 [ACK] Seq=5505 Ack=210605 Win=5703 Len=0 TSval=5094952 TSecr=5690919 SLE=212053 SRE=214949
  349 19.968805918  10.6.15.144 → 192.168.1.16 SSH 1514 Server: Encrypted packet (len=1448)
  350 19.968817670 192.168.1.16 → 10.6.15.144  TCP 78 [TCP Dup ACK 345#2] 59298 → 22 [ACK] Seq=5505 Ack=210605 Win=5703 Len=0 TSval=5094952 TSecr=5690919 SLE=212053 SRE=216397
  351 19.969150153  10.6.15.144 → 192.168.1.16 SSH 1514 Server: Encrypted packet (len=1448)
  352 19.969168898 192.168.1.16 → 10.6.15.144  TCP 78 [TCP Dup ACK 345#3] 59298 → 22 [ACK] Seq=5505 Ack=210605 Win=5703 Len=0 TSval=5094952 TSecr=5690919 SLE=212053 SRE=217845
  353 19.969339680  10.6.15.144 → 192.168.1.16 SSH 1514 Server: Encrypted packet (len=1448)
  354 19.969346212 192.168.1.16 → 10.6.15.144  TCP 78 [TCP Dup ACK 345#4] 59298 → 22 [ACK] Seq=5505 Ack=210605 Win=5703 Len=0 TSval=5094952 TSecr=5690919 SLE=212053 SRE=219293
  355 19.969534937  10.6.15.144 → 192.168.1.16 SSH 1514 Server: Encrypted packet (len=1448)
  356 19.969543535 192.168.1.16 → 10.6.15.144  TCP 78 [TCP Dup ACK 345#5] 59298 → 22 [ACK] Seq=5505 Ack=210605 Win=5703 Len=0 TSval=5094952 TSecr=5690919 SLE=212053 SRE=220741
  357 19.969726252  10.6.15.144 → 192.168.1.16 SSH 1514 Server: Encrypted packet (len=1448)
  358 19.969735712 192.168.1.16 → 10.6.15.144  TCP 78 [TCP Dup ACK 345#6] 59298 → 22 [ACK] Seq=5505 Ack=210605 Win=5703 Len=0 TSval=5094952 TSecr=5690919 SLE=212053 SRE=222189
  359 19.969744960 10.22.19.143 → 224.0.0.252  LLMNR 72 Standard query 0xd042 ANY Rajat-Laptop
  360 19.969934123  10.6.15.144 → 192.168.1.16 TCP 1514 [TCP Out-Of-Order] 22 → 59298 [ACK] Seq=209157 Ack=5433 Win=1452 Len=1448 TSval=5690982 TSecr=5094510
  361 19.969942522 192.168.1.16 → 10.6.15.144  TCP 86 [TCP Dup ACK 345#7] 59298 → 22 [ACK] Seq=5505 Ack=210605 Win=5703 Len=0 TSval=5094952 TSecr=5690982 SLE=209157 SRE=210605 SLE=212053 SRE=222189
  362 19.970128238  10.6.15.144 → 192.168.1.16 TCP 1514 [TCP Out-Of-Order] 22 → 59298 [ACK] Seq=209157 Ack=5433 Win=1452 Len=1448 TSval=5691092 TSecr=5094510
  363 19.970137224 192.168.1.16 → 10.6.15.144  TCP 86 [TCP Dup ACK 345#8] 59298 → 22 [ACK] Seq=5505 Ack=210605 Win=5703 Len=0 TSval=5094953 TSecr=5691092 SLE=209157 SRE=210605 SLE=212053 SRE=222189
  364 19.970471156  10.6.15.144 → 192.168.1.16 TCP 1514 [TCP Out-Of-Order] 22 → 59298 [ACK] Seq=209157 Ack=5433 Win=1452 Len=1448 TSval=5691312 TSecr=5094510
