    1 0.000000000 10.22.19.143 → 224.0.0.252  LLMNR 72 Standard query 0xf2f0 ANY Rajat-Laptop
    2 0.000419434 10.22.19.143 → 224.0.0.252  LLMNR 72 Standard query 0xf2f0 ANY Rajat-Laptop
    3 0.405607370 192.168.1.16 → 10.6.15.144  SSH 1414 Client: Encrypted packet (len=1348)
    4 0.416134165  10.6.15.144 → 192.168.1.16 TCP 66 22 → 59298 [ACK] Seq=1 Ack=1349 Win=1452 Len=0 TSval=5697919 TSecr=5101557
    5 1.089252220 192.168.1.16 → 54.76.71.168 TCP 128 42414 → 8282 [PSH, ACK] Seq=1 Ack=1 Win=296 Len=62 TSval=5101728 TSecr=609206203
    6 1.091228783  10.6.15.144 → 192.168.1.16 SSH 1514 Server: Encrypted packet (len=1448)
    7 1.091492885 192.168.1.16 → 10.6.15.144  SSH 246 Client: Encrypted packet (len=180)
    8 1.091706682  10.6.15.144 → 192.168.1.16 SSH 1514 Server: Encrypted packet (len=1448)
    9 1.092348449 192.168.1.16 → 10.6.15.144  SSH 126 Client: Encrypted packet (len=60)
   10 1.092778430  10.6.15.144 → 192.168.1.16 SSH 1514 Server: Encrypted packet (len=1448)
   11 1.093015864 192.168.1.16 → 10.6.15.144  SSH 126 Client: Encrypted packet (len=60)
   12 1.093628199  10.6.15.144 → 192.168.1.16 SSH 1514 Server: Encrypted packet (len=1448)
   13 1.093816214  10.6.15.144 → 192.168.1.16 SSH 1514 Server: Encrypted packet (len=1448)
   14 1.093827880 192.168.1.16 → 10.6.15.144  TCP 66 59298 → 22 [ACK] Seq=1649 Ack=7241 Win=5703 Len=0 TSval=5101729 TSecr=5697974
   15 1.094008314  10.6.15.144 → 192.168.1.16 SSH 1514 Server: Encrypted packet (len=1448)
   16 1.094114498  10.6.15.144 → 192.168.1.16 SSH 942 Server: Encrypted packet (len=876)
   17 1.094123777 192.168.1.16 → 10.6.15.144  TCP 66 59298 → 22 [ACK] Seq=1649 Ack=9565 Win=5703 Len=0 TSval=5101730 TSecr=5697974
   18 1.094322077  10.6.15.144 → 192.168.1.16 SSH 1514 Server: Encrypted packet (len=1448)
   19 1.096392769 192.168.1.16 → 10.6.15.144  SSH 390 Client: Encrypted packet (len=324)
   20 1.096735725 192.168.1.16 → 10.6.15.144  SSH 630 Client: Encrypted packet (len=564)
   21 1.097176018 192.168.1.16 → 10.6.15.144  SSH 182 Client: Encrypted packet (len=116)
   22 1.100609946  10.6.15.144 → 192.168.1.16 SSH 858 Server: Encrypted packet (len=792)
   23 1.101047122 192.168.1.16 → 10.6.15.144  SSH 138 Client: Encrypted packet (len=72)
   24 1.101382459  10.6.15.144 → 192.168.1.16 TCP 66 22 → 59298 [ACK] Seq=11805 Ack=1649 Win=1452 Len=0 TSval=5698091 TSecr=5101729
   25 1.101795265 192.168.1.16 → 10.6.15.144  SSH 142 Client: Encrypted packet (len=76)
   26 1.105320324  10.6.15.144 → 192.168.1.16 TCP 66 22 → 59298 [ACK] Seq=11805 Ack=2537 Win=1452 Len=0 TSval=5698092 TSecr=5101730
   27 1.109165813  10.6.15.144 → 192.168.1.16 TCP 66 22 → 59298 [ACK] Seq=11805 Ack=2725 Win=1452 Len=0 TSval=5698093 TSecr=5101730
   28 1.112395055  10.6.15.144 → 192.168.1.16 SSH 102 Server: Encrypted packet (len=36)
   29 1.133680218  10.6.15.144 → 192.168.1.16 SSH 102 Server: Encrypted packet (len=36)
   30 1.133743760 192.168.1.16 → 10.6.15.144  TCP 66 59298 → 22 [ACK] Seq=2801 Ack=11877 Win=5703 Len=0 TSval=5101739 TSecr=5698094
   31 1.134045006 192.168.1.16 → 10.6.15.144  SSH 190 Client: Encrypted packet (len=124)
   32 1.139368128  10.6.15.144 → 192.168.1.16 SSH 102 Server: Encrypted packet (len=36)
   33 1.144268565  10.6.15.144 → 192.168.1.16 SSH 102 Server: Encrypted packet (len=36)
   34 1.144355755 192.168.1.16 → 10.6.15.144  TCP 66 59298 → 22 [ACK] Seq=2925 Ack=11949 Win=5703 Len=0 TSval=5101742 TSecr=5698101
   35 1.156740019  10.6.15.144 → 192.168.1.16 SSH 1514 Server: Encrypted packet (len=1448)
   36 1.156760779  10.6.15.144 → 192.168.1.16 SSH 390 Server: Encrypted packet (len=324)
   37 1.156765653 192.168.1.16 → 10.6.15.144  TCP 66 59298 → 22 [ACK] Seq=2925 Ack=13721 Win=5703 Len=0 TSval=5101745 TSecr=5698104
   38 1.156984719  10.6.15.144 → 192.168.1.16 SSH 1514 Server: Encrypted packet (len=1448)
   39 1.156990618  10.6.15.144 → 192.168.1.16 SSH 110 Server: Encrypted packet (len=44)
   40 1.156993602 192.168.1.16 → 10.6.15.144  TCP 66 59298 → 22 [ACK] Seq=2925 Ack=15213 Win=5703 Len=0 TSval=5101745 TSecr=5698104
   41 1.157194781  10.6.15.144 → 192.168.1.16 SSH 1514 Server: Encrypted packet (len=1448)
   42 1.157330674  10.6.15.144 → 192.168.1.16 SSH 110 Server: Encrypted packet (len=44)
   43 1.157337334 192.168.1.16 → 10.6.15.144  TCP 66 59298 → 22 [ACK] Seq=2925 Ack=16705 Win=5703 Len=0 TSval=5101745 TSecr=5698104
   44 1.157561236  10.6.15.144 → 192.168.1.16 SSH 1514 Server: Encrypted packet (len=1448)
   45 1.157570419  10.6.15.144 → 192.168.1.16 SSH 110 Server: Encrypted packet (len=44)
   46 1.157575331 192.168.1.16 → 10.6.15.144  TCP 66 59298 → 22 [ACK] Seq=2925 Ack=18197 Win=5703 Len=0 TSval=5101745 TSecr=5698104
   47 1.167685548  10.6.15.144 → 192.168.1.16 SSH 1514 Server: Encrypted packet (len=1448)
   48 1.167866519  10.6.15.144 → 192.168.1.16 SSH 1514 Server: Encrypted packet (len=1448)
   49 1.167878870 192.168.1.16 → 10.6.15.144  TCP 66 59298 → 22 [ACK] Seq=2925 Ack=21093 Win=5703 Len=0 TSval=5101748 TSecr=5698107
   50 1.168057164  10.6.15.144 → 192.168.1.16 SSH 1514 Server: Encrypted packet (len=1448)
   51 1.168406031  10.6.15.144 → 192.168.1.16 SSH 1514 Server: Encrypted packet (len=1448)
   52 1.168416070 192.168.1.16 → 10.6.15.144  TCP 66 59298 → 22 [ACK] Seq=2925 Ack=23989 Win=5703 Len=0 TSval=5101748 TSecr=5698107
   53 1.168596156  10.6.15.144 → 192.168.1.16 SSH 1514 Server: Encrypted packet (len=1448)
   54 1.168786526  10.6.15.144 → 192.168.1.16 SSH 1514 Server: Encrypted packet (len=1448)
   55 1.168793773 192.168.1.16 → 10.6.15.144  TCP 66 59298 → 22 [ACK] Seq=2925 Ack=26885 Win=5703 Len=0 TSval=5101748 TSecr=5698107
   56 1.169134490  10.6.15.144 → 192.168.1.16 SSH 1514 Server: Encrypted packet (len=1448)
   57 1.169323564  10.6.15.144 → 192.168.1.16 SSH 1514 Server: Encrypted packet (len=1448)
   58 1.169330877 192.168.1.16 → 10.6.15.144  TCP 66 59298 → 22 [ACK] Seq=2925 Ack=29781 Win=5703 Len=0 TSval=5101748 TSecr=5698107
   59 1.179814229  10.6.15.144 → 192.168.1.16 SSH 1514 Server: Encrypted packet (len=1448)
   60 1.179994609  10.6.15.144 → 192.168.1.16 SSH 1514 Server: Encrypted packet (len=1448)
   61 1.180002167 192.168.1.16 → 10.6.15.144  TCP 66 59298 → 22 [ACK] Seq=2925 Ack=32677 Win=5703 Len=0 TSval=5101751 TSecr=5698110
   62 1.180342655  10.6.15.144 → 192.168.1.16 SSH 1514 Server: Encrypted packet (len=1448)
   63 1.180531599  10.6.15.144 → 192.168.1.16 SSH 1514 Server: Encrypted packet (len=1448)
   64 1.180539393 192.168.1.16 → 10.6.15.144  TCP 66 59298 → 22 [ACK] Seq=2925 Ack=35573 Win=5703 Len=0 TSval=5101751 TSecr=5698110
   65 1.180722308  10.6.15.144 → 192.168.1.16 SSH 1514 Server: Encrypted packet (len=1448)
   66 1.180916052  10.6.15.144 → 192.168.1.16 SSH 1514 Server: Encrypted packet (len=1448)
   67 1.180923685 192.168.1.16 → 10.6.15.144  TCP 66 59298 → 22 [ACK] Seq=2925 Ack=38469 Win=5703 Len=0 TSval=5101751 TSecr=5698110
   68 1.181261877  10.6.15.144 → 192.168.1.16 SSH 1514 Server: [TCP Previous segment not captured] , Encrypted packet (len=1448)
   69 1.181273822 192.168.1.16 → 10.6.15.144  TCP 78 [TCP Dup ACK 67#1] 59298 → 22 [ACK] Seq=2925 Ack=38469 Win=5703 Len=0 TSval=5101751 TSecr=5698110 SLE=39917 SRE=41365
   70 1.191490294  10.6.15.144 → 192.168.1.16 SSH 1514 Server: Encrypted packet (len=1448)
   71 1.191513867 192.168.1.16 → 10.6.15.144  TCP 78 [TCP Dup ACK 67#2] 59298 → 22 [ACK] Seq=2925 Ack=38469 Win=5703 Len=0 TSval=5101754 TSecr=5698110 SLE=39917 SRE=42813
   72 1.191808058  10.6.15.144 → 192.168.1.16 SSH 1514 Server: Encrypted packet (len=1448)
   73 1.191822671 192.168.1.16 → 10.6.15.144  TCP 78 [TCP Dup ACK 67#3] 59298 → 22 [ACK] Seq=2925 Ack=38469 Win=5703 Len=0 TSval=5101754 TSecr=5698110 SLE=39917 SRE=44261
   74 1.191995415  10.6.15.144 → 192.168.1.16 SSH 1514 Server: Encrypted packet (len=1448)
   75 1.192003920 192.168.1.16 → 10.6.15.144  TCP 78 [TCP Dup ACK 67#4] 59298 → 22 [ACK] Seq=2925 Ack=38469 Win=5703 Len=0 TSval=5101754 TSecr=5698110 SLE=39917 SRE=45709
   76 1.192220036  10.6.15.144 → 192.168.1.16 SSH 710 Server: Encrypted packet (len=644)
   77 1.192229256 192.168.1.16 → 10.6.15.144  TCP 78 [TCP Dup ACK 67#5] 59298 → 22 [ACK] Seq=2925 Ack=38469 Win=5703 Len=0 TSval=5101754 TSecr=5698110 SLE=39917 SRE=46353
   78 1.194238362  10.6.15.144 → 192.168.1.16 SSH 1514 Server: Encrypted packet (len=1448)
   79 1.194252008 192.168.1.16 → 10.6.15.144  TCP 78 [TCP Dup ACK 67#6] 59298 → 22 [ACK] Seq=2925 Ack=38469 Win=5703 Len=0 TSval=5101755 TSecr=5698110 SLE=39917 SRE=47801
   80 1.194264537  10.6.15.144 → 192.168.1.16 SSH 110 Server: Encrypted packet (len=44)
   81 1.194269246 192.168.1.16 → 10.6.15.144  TCP 78 [TCP Dup ACK 67#7] 59298 → 22 [ACK] Seq=2925 Ack=38469 Win=5703 Len=0 TSval=5101755 TSecr=5698110 SLE=39917 SRE=47845
   82 1.194591300  10.6.15.144 → 192.168.1.16 SSH 1514 Server: Encrypted packet (len=1448)
   83 1.194598864 192.168.1.16 → 10.6.15.144  TCP 78 [TCP Dup ACK 67#8] 59298 → 22 [ACK] Seq=2925 Ack=38469 Win=5703 Len=0 TSval=5101755 TSecr=5698110 SLE=39917 SRE=49293
   84 1.202337363  10.6.15.144 → 192.168.1.16 SSH 1514 Server: Encrypted packet (len=1448)
   85 1.202356287 192.168.1.16 → 10.6.15.144  TCP 78 [TCP Dup ACK 67#9] 59298 → 22 [ACK] Seq=2925 Ack=38469 Win=5703 Len=0 TSval=5101757 TSecr=5698110 SLE=39917 SRE=50741
   86 1.202520120  10.6.15.144 → 192.168.1.16 SSH 1514 Server: [TCP Fast Retransmission] , Encrypted packet (len=1448)
   87 1.202531714 192.168.1.16 → 10.6.15.144  TCP 66 59298 → 22 [ACK] Seq=2925 Ack=50741 Win=5703 Len=0 TSval=5101757 TSecr=5698116
   88 1.202864951  10.6.15.144 → 192.168.1.16 SSH 1514 Server: Encrypted packet (len=1448)
   89 1.202871829 192.168.1.16 → 10.6.15.144  TCP 66 59298 → 22 [ACK] Seq=2925 Ack=52189 Win=5703 Len=0 TSval=5101757 TSecr=5698116
   90 1.204962357  10.6.15.144 → 192.168.1.16 SSH 1514 Server: Encrypted packet (len=1448)
   91 1.204978282 192.168.1.16 → 10.6.15.144  TCP 66 59298 → 22 [ACK] Seq=2925 Ack=53637 Win=5703 Len=0 TSval=5101757 TSecr=5698116
   92 1.205149436  10.6.15.144 → 192.168.1.16 SSH 1514 Server: Encrypted packet (len=1448)
   93 1.205159996 192.168.1.16 → 10.6.15.144  TCP 66 59298 → 22 [ACK] Seq=2925 Ack=55085 Win=5703 Len=0 TSval=5101757 TSecr=5698116
   94 1.213127213  10.6.15.144 → 192.168.1.16 SSH 1514 Server: Encrypted packet (len=1448)
   95 1.213149554 192.168.1.16 → 10.6.15.144  TCP 66 59298 → 22 [ACK] Seq=2925 Ack=56533 Win=5703 Len=0 TSval=5101759 TSecr=5698118
   96 1.213307531  10.6.15.144 → 192.168.1.16 SSH 1514 Server: Encrypted packet (len=1448)
   97 1.213317150 192.168.1.16 → 10.6.15.144  TCP 66 59298 → 22 [ACK] Seq=2925 Ack=57981 Win=5703 Len=0 TSval=5101759 TSecr=5698118
   98 1.213499098  10.6.15.144 → 192.168.1.16 SSH 1514 Server: Encrypted packet (len=1448)
   99 1.213506570 192.168.1.16 → 10.6.15.144  TCP 66 59298 → 22 [ACK] Seq=2925 Ack=59429 Win=5703 Len=0 TSval=5101759 TSecr=5698118
  100 1.213844608  10.6.15.144 → 192.168.1.16 SSH 1514 Server: Encrypted packet (len=1448)
  101 1.213853618 192.168.1.16 → 10.6.15.144  TCP 66 59298 → 22 [ACK] Seq=2925 Ack=60877 Win=5703 Len=0 TSval=5101759 TSecr=5698118
  102 1.217478450  10.6.15.144 → 192.168.1.16 SSH 1514 Server: Encrypted packet (len=1448)
  103 1.217502082 192.168.1.16 → 10.6.15.144  TCP 66 59298 → 22 [ACK] Seq=2925 Ack=62325 Win=5703 Len=0 TSval=5101760 TSecr=5698119
  104 1.217792921  10.6.15.144 → 192.168.1.16 SSH 1514 Server: Encrypted packet (len=1448)
  105 1.217805113 192.168.1.16 → 10.6.15.144  TCP 66 59298 → 22 [ACK] Seq=2925 Ack=63773 Win=5703 Len=0 TSval=5101760 TSecr=5698119
  106 1.225995956  10.6.15.144 → 192.168.1.16 SSH 1514 Server: Encrypted packet (len=1448)
  107 1.226025618 192.168.1.16 → 10.6.15.144  TCP 66 59298 → 22 [ACK] Seq=2925 Ack=65221 Win=5703 Len=0 TSval=5101762 TSecr=5698121
  108 1.226177937  10.6.15.144 → 192.168.1.16 SSH 1514 Server: Encrypted packet (len=1448)
  109 1.226188348 192.168.1.16 → 10.6.15.144  TCP 66 59298 → 22 [ACK] Seq=2925 Ack=66669 Win=5703 Len=0 TSval=5101763 TSecr=5698121
  110 1.226372548  10.6.15.144 → 192.168.1.16 SSH 1514 Server: Encrypted packet (len=1448)
  111 1.226379756 192.168.1.16 → 10.6.15.144  TCP 66 59298 → 22 [ACK] Seq=2925 Ack=68117 Win=5703 Len=0 TSval=5101763 TSecr=5698121
  112 1.226417509  10.6.15.144 → 192.168.1.16 SSH 518 Server: Encrypted packet (len=452)
  113 1.226423919 192.168.1.16 → 10.6.15.144  TCP 66 59298 → 22 [ACK] Seq=2925 Ack=68569 Win=5703 Len=0 TSval=5101763 TSecr=5698121
  114 1.233342545 192.168.1.16 → 10.6.15.144  SSH 102 Client: Encrypted packet (len=36)
  115 1.233856663 192.168.1.16 → 10.6.15.144  SSH 110 Client: Encrypted packet (len=44)
  116 1.241272686  10.6.15.144 → 192.168.1.16 TCP 66 22 → 59298 [ACK] Seq=68569 Ack=3005 Win=1452 Len=0 TSval=5698126 TSecr=5101764
  117 1.249868779 54.76.71.168 → 192.168.1.16 TCP 66 8282 → 42414 [ACK] Seq=1 Ack=63 Win=121 Len=0 TSval=609213704 TSecr=5101728
  118 1.342213320 192.168.1.16 → 10.6.15.144  SSH 102 Client: Encrypted packet (len=36)
  119 1.344499899 192.168.1.16 → 10.6.15.144  SSH 110 Client: Encrypted packet (len=44)
  120 1.370074633 192.168.1.16 → 10.6.15.144  TCP 110 [TCP Retransmission] 59298 → 22 [PSH, ACK] Seq=3041 Ack=68569 Win=5703 Len=44 TSval=5101799 TSecr=5698126
  121 1.379663628  10.6.15.144 → 192.168.1.16 TCP 78 22 → 59298 [ACK] Seq=68569 Ack=3085 Win=1452 Len=0 TSval=5698160 TSecr=5101792 SLE=3041 SRE=3085
  122 1.580340218 192.168.1.16 → 10.6.15.144  SSH 102 Client: Encrypted packet (len=36)
  123 1.582619476 192.168.1.16 → 10.6.15.144  SSH 110 Client: Encrypted packet (len=44)
  124 1.591021979  10.6.15.144 → 192.168.1.16 TCP 66 22 → 59298 [ACK] Seq=68569 Ack=3121 Win=1452 Len=0 TSval=5698213 TSecr=5101851
  125 1.592397659  10.6.15.144 → 192.168.1.16 TCP 66 22 → 59298 [ACK] Seq=68569 Ack=3165 Win=1452 Len=0 TSval=5698213 TSecr=5101852
  126 1.599194801 192.168.1.16 → 10.6.15.144  SSH 102 Client: Encrypted packet (len=36)
  127 1.600707129 192.168.1.16 → 10.6.15.144  SSH 102 Client: Encrypted packet (len=36)
  128 1.608859331  10.6.15.144 → 192.168.1.16 TCP 66 22 → 59298 [ACK] Seq=68569 Ack=3201 Win=1452 Len=0 TSval=5698217 TSecr=5101856
  129 1.610391233  10.6.15.144 → 192.168.1.16 TCP 66 22 → 59298 [ACK] Seq=68569 Ack=3237 Win=1452 Len=0 TSval=5698218 TSecr=5101856
  130 1.794384204 192.168.1.16 → 10.6.15.144  SSH 102 Client: Encrypted packet (len=36)
  131 1.796341403 192.168.1.16 → 10.6.15.144  SSH 102 Client: Encrypted packet (len=36)
  132 1.796639740 192.168.1.16 → 10.6.15.144  SSH 102 Client: Encrypted packet (len=36)
  133 1.797221640 192.168.1.16 → 10.6.15.144  SSH 102 Client: Encrypted packet (len=36)
  134 1.802572161  10.6.15.144 → 192.168.1.16 TCP 66 22 → 59298 [ACK] Seq=68569 Ack=3273 Win=1452 Len=0 TSval=5698266 TSecr=5101905
  135 1.803497275  10.6.15.144 → 192.168.1.16 TCP 66 22 → 59298 [ACK] Seq=68569 Ack=3309 Win=1452 Len=0 TSval=5698267 TSecr=5101905
  136 1.803625497  10.6.15.144 → 192.168.1.16 TCP 66 22 → 59298 [ACK] Seq=68569 Ack=3345 Win=1452 Len=0 TSval=5698267 TSecr=5101905
  137 1.804554764  10.6.15.144 → 192.168.1.16 TCP 66 22 → 59298 [ACK] Seq=68569 Ack=3381 Win=1452 Len=0 TSval=5698267 TSecr=5101905
  138 1.831225885 192.168.1.16 → 10.6.15.144  SSH 102 Client: Encrypted packet (len=36)
  139 1.833534650 192.168.1.16 → 10.6.15.144  SSH 102 Client: Encrypted packet (len=36)
  140 1.842959996  10.6.15.144 → 192.168.1.16 TCP 66 22 → 59298 [ACK] Seq=68569 Ack=3417 Win=1452 Len=0 TSval=5698276 TSecr=5101914
  141 1.843084256  10.6.15.144 → 192.168.1.16 TCP 66 22 → 59298 [ACK] Seq=68569 Ack=3453 Win=1452 Len=0 TSval=5698276 TSecr=5101914
  142 7.008149272  10.6.15.144 → 192.168.1.16 SSH 730 Server: Encrypted packet (len=664)
  143 7.008419953 192.168.1.16 → 10.6.15.144  SSH 102 Client: Encrypted packet (len=36)
  144 7.008462978  10.6.15.144 → 192.168.1.16 SSH 174 Server: Encrypted packet (len=108)
  145 7.008731978 192.168.1.16 → 10.6.15.144  SSH 102 Client: Encrypted packet (len=36)
  146 7.008846655  10.6.15.144 → 192.168.1.16 SSH 174 Server: [TCP Spurious Retransmission] , Encrypted packet (len=108)
  147 7.008856883 192.168.1.16 → 10.6.15.144  TCP 78 [TCP Dup ACK 145#1] 59298 → 22 [ACK] Seq=3525 Ack=69341 Win=5703 Len=0 TSval=5103208 TSecr=5699350 SLE=69233 SRE=69341
  148 7.009272139 192.168.1.16 → 10.6.15.144  SSH 150 Client: Encrypted packet (len=84)
  149 7.009368209  10.6.15.144 → 192.168.1.16 SSH 102 Server: Encrypted packet (len=36)
  150 7.009798462  10.6.15.144 → 192.168.1.16 SSH 102 Server: Encrypted packet (len=36)
  151 7.009842102 192.168.1.16 → 10.6.15.144  TCP 66 59298 → 22 [ACK] Seq=3609 Ack=69413 Win=5703 Len=0 TSval=5103208 TSecr=5699359
  152 7.010493171  10.6.15.144 → 192.168.1.16 SSH 102 Server: Encrypted packet (len=36)
  153 7.010544477 192.168.1.16 → 10.6.15.144  SSH 138 Client: Encrypted packet (len=72)
  154 7.010942398  10.6.15.144 → 192.168.1.16 SSH 102 Server: Encrypted packet (len=36)
  155 7.010957003  10.6.15.144 → 192.168.1.16 SSH 138 Server: Encrypted packet (len=72)
  156 7.010979833  10.6.15.144 → 192.168.1.16 SSH 138 Server: Encrypted packet (len=72)
  157 7.011012075 192.168.1.16 → 10.6.15.144  TCP 66 59298 → 22 [ACK] Seq=3681 Ack=69629 Win=5703 Len=0 TSval=5103209 TSecr=5699360
  158 7.011153718  10.6.15.144 → 192.168.1.16 SSH 1126 Server: [TCP Spurious Retransmission] , Encrypted packet (len=1060)
  159 7.011162036 192.168.1.16 → 10.6.15.144  TCP 78 [TCP Dup ACK 157#1] 59298 → 22 [ACK] Seq=3681 Ack=69629 Win=5703 Len=0 TSval=5103209 TSecr=5699558 SLE=68569 SRE=69629
  160 7.011398968 192.168.1.16 → 10.6.15.144  SSH 138 Client: Encrypted packet (len=72)
  161 7.012342526 192.168.1.16 → 10.6.15.144  SSH 118 Client: Encrypted packet (len=52)
  162 7.012576464 192.168.1.16 → 10.6.15.144  SSH 230 Client: Encrypted packet (len=164)
  163 7.016791016  10.6.15.144 → 192.168.1.16 SSH 246 Server: Encrypted packet (len=180)
  164 7.017245886 192.168.1.16 → 10.6.15.144  SSH 138 Client: Encrypted packet (len=72)
  165 7.017570811 192.168.1.16 → 10.6.15.144  SSH 134 Client: Encrypted packet (len=68)
  166 7.017619051  10.6.15.144 → 192.168.1.16 TCP 66 22 → 59298 [ACK] Seq=69809 Ack=3609 Win=1452 Len=0 TSval=5699570 TSecr=5103208
  167 7.018718180  10.6.15.144 → 192.168.1.16 SSH 102 Server: Encrypted packet (len=36)
  168 7.020217525 192.168.1.16 → 10.6.15.144  SSH 110 Client: Encrypted packet (len=44)
  169 7.020247804  10.6.15.144 → 192.168.1.16 TCP 66 22 → 59298 [ACK] Seq=69845 Ack=3805 Win=1452 Len=0 TSval=5699571 TSecr=5103209
  170 7.025028224  10.6.15.144 → 192.168.1.16 TCP 66 22 → 59298 [ACK] Seq=69845 Ack=4041 Win=1452 Len=0 TSval=5699572 TSecr=5103209
  171 7.027704632  10.6.15.144 → 192.168.1.16 TCP 66 22 → 59298 [ACK] Seq=69845 Ack=4153 Win=1452 Len=0 TSval=5699573 TSecr=5103210
  172 7.950951233 192.168.1.16 → 239.255.255.250 SSDP 213 M-SEARCH * HTTP/1.1 
  173 8.081236233  10.6.15.144 → 192.168.1.16 SSH 1514 Server: Encrypted packet (len=1448)
  174 8.081380465  10.6.15.144 → 192.168.1.16 SSH 1514 Server: Encrypted packet (len=1448)
  175 8.081390151 192.168.1.16 → 10.6.15.144  TCP 66 59298 → 22 [ACK] Seq=4153 Ack=72741 Win=5703 Len=0 TSval=5103476 TSecr=5699835
  176 8.081614651  10.6.15.144 → 192.168.1.16 SSH 930 Server: Encrypted packet (len=864)
  177 8.105426190 192.168.1.16 → 10.6.15.144  SSH 134 Client: Encrypted packet (len=68)
  178 8.106207146 192.168.1.16 → 10.6.15.144  SSH 118 Client: Encrypted packet (len=52)
  179 8.117310807  10.6.15.144 → 192.168.1.16 TCP 66 22 → 59298 [ACK] Seq=73605 Ack=4273 Win=1452 Len=0 TSval=5699845 TSecr=5103482
  180 8.182885048  10.6.15.144 → 192.168.1.16 SSH 102 Server: Encrypted packet (len=36)
  181 8.183418672 192.168.1.16 → 10.6.15.144  SSH 254 Client: Encrypted packet (len=188)
  182 8.192970978  10.6.15.144 → 192.168.1.16 SSH 974 Server: Encrypted packet (len=908)
  183 8.230916353  10.6.15.144 → 192.168.1.16 TCP 66 22 → 59298 [ACK] Seq=74549 Ack=4461 Win=1452 Len=0 TSval=5699874 TSecr=5103502
  184 8.234068022 192.168.1.16 → 10.6.15.144  TCP 66 59298 → 22 [ACK] Seq=4461 Ack=74549 Win=5703 Len=0 TSval=5103515 TSecr=5699863
  185 8.305011019 192.168.1.16 → 10.6.15.144  SSH 102 Client: Encrypted packet (len=36)
  186 8.307457162 192.168.1.16 → 10.6.15.144  SSH 102 Client: Encrypted packet (len=36)
  187 8.313599838  10.6.15.144 → 192.168.1.16 TCP 66 22 → 59298 [ACK] Seq=74549 Ack=4497 Win=1452 Len=0 TSval=5699894 TSecr=5103532
  188 8.315842472  10.6.15.144 → 192.168.1.16 TCP 66 22 → 59298 [ACK] Seq=74549 Ack=4533 Win=1452 Len=0 TSval=5699895 TSecr=5103533
  189 8.341248261 192.168.1.16 → 10.6.15.144  SSH 126 Client: Encrypted packet (len=60)
  190 8.341895402 192.168.1.16 → 10.6.15.144  SSH 102 Client: Encrypted packet (len=36)
  191 8.342715240 192.168.1.16 → 10.6.15.144  SSH 102 Client: Encrypted packet (len=36)
  192 8.344067701 192.168.1.16 → 10.6.15.144  SSH 102 Client: Encrypted packet (len=36)
  193 8.344533220 192.168.1.16 → 10.6.15.144  SSH 102 Client: Encrypted packet (len=36)
  194 8.344907862 192.168.1.16 → 10.6.15.144  SSH 102 Client: Encrypted packet (len=36)
  195 8.346545366 192.168.1.16 → 10.6.15.144  SSH 102 Client: Encrypted packet (len=36)
  196 8.348612081 192.168.1.16 → 10.6.15.144  SSH 102 Client: Encrypted packet (len=36)
  197 8.349609966 192.168.1.16 → 10.6.15.144  SSH 102 Client: Encrypted packet (len=36)
  198 8.351038810  10.6.15.144 → 192.168.1.16 TCP 66 22 → 59298 [ACK] Seq=74549 Ack=4593 Win=1452 Len=0 TSval=5699903 TSecr=5103541
  199 8.351418071  10.6.15.144 → 192.168.1.16 TCP 66 22 → 59298 [ACK] Seq=74549 Ack=4629 Win=1452 Len=0 TSval=5699903 TSecr=5103541
  200 8.352159062  10.6.15.144 → 192.168.1.16 TCP 66 22 → 59298 [ACK] Seq=74549 Ack=4665 Win=1452 Len=0 TSval=5699903 TSecr=5103542
  201 8.353659710  10.6.15.144 → 192.168.1.16 TCP 66 22 → 59298 [ACK] Seq=74549 Ack=4701 Win=1452 Len=0 TSval=5699904 TSecr=5103542
  202 8.354267550  10.6.15.144 → 192.168.1.16 TCP 66 22 → 59298 [ACK] Seq=74549 Ack=4737 Win=1452 Len=0 TSval=5699904 TSecr=5103542
  203 8.354397514  10.6.15.144 → 192.168.1.16 TCP 66 22 → 59298 [ACK] Seq=74549 Ack=4773 Win=1452 Len=0 TSval=5699904 TSecr=5103542
  204 8.356061052  10.6.15.144 → 192.168.1.16 TCP 66 22 → 59298 [ACK] Seq=74549 Ack=4809 Win=1452 Len=0 TSval=5699904 TSecr=5103543
  205 8.356980843 192.168.1.16 → 10.6.15.144  SSH 102 Client: Encrypted packet (len=36)
  206 8.357800203 192.168.1.16 → 10.6.15.144  SSH 102 Client: Encrypted packet (len=36)
  207 8.358167325  10.6.15.144 → 192.168.1.16 TCP 66 22 → 59298 [ACK] Seq=74549 Ack=4845 Win=1452 Len=0 TSval=5699905 TSecr=5103543
  208 8.358873221  10.6.15.144 → 192.168.1.16 TCP 66 22 → 59298 [ACK] Seq=74549 Ack=4881 Win=1452 Len=0 TSval=5699905 TSecr=5103543
  209 8.360214898 192.168.1.16 → 10.6.15.144  SSH 102 Client: Encrypted packet (len=36)
  210 8.361132110 192.168.1.16 → 10.6.15.144  SSH 102 Client: Encrypted packet (len=36)
  211 8.366300336  10.6.15.144 → 192.168.1.16 TCP 66 22 → 59298 [ACK] Seq=74549 Ack=4917 Win=1452 Len=0 TSval=5699907 TSecr=5103545
  212 8.366774556  10.6.15.144 → 192.168.1.16 TCP 66 22 → 59298 [ACK] Seq=74549 Ack=4953 Win=1452 Len=0 TSval=5699907 TSecr=5103545
  213 8.368699428  10.6.15.144 → 192.168.1.16 TCP 66 22 → 59298 [ACK] Seq=74549 Ack=4989 Win=1452 Len=0 TSval=5699908 TSecr=5103546
  214 8.369464434  10.6.15.144 → 192.168.1.16 TCP 66 22 → 59298 [ACK] Seq=74549 Ack=5025 Win=1452 Len=0 TSval=5699908 TSecr=5103546
  215 8.420518201  10.6.15.144 → 192.168.1.16 SSH 138 Server: Encrypted packet (len=72)
  216 8.420534245 192.168.1.16 → 10.6.15.144  TCP 66 59298 → 22 [ACK] Seq=5025 Ack=74621 Win=5703 Len=0 TSval=5103561 TSecr=5699921
  217 8.420793919 192.168.1.16 → 10.6.15.144  SSH 102 Client: Encrypted packet (len=36)
  218 8.422404536  10.6.15.144 → 192.168.1.16 SSH 138 Server: Encrypted packet (len=72)
  219 8.422656825 192.168.1.16 → 10.6.15.144  SSH 102 Client: Encrypted packet (len=36)
  220 8.422979824  10.6.15.144 → 192.168.1.16 SSH 138 Server: Encrypted packet (len=72)
  221 8.423133201 192.168.1.16 → 10.6.15.144  SSH 102 Client: Encrypted packet (len=36)
  222 8.426946651  10.6.15.144 → 192.168.1.16 SSH 102 Server: Encrypted packet (len=36)
  223 8.426962573  10.6.15.144 → 192.168.1.16 SSH 102 Server: Encrypted packet (len=36)
  224 8.426990977  10.6.15.144 → 192.168.1.16 SSH 182 Server: Encrypted packet (len=116)
  225 8.427011559 192.168.1.16 → 10.6.15.144  TCP 66 59298 → 22 [ACK] Seq=5133 Ack=74953 Win=5703 Len=0 TSval=5103563 TSecr=5699922
  226 8.427220223  10.6.15.144 → 192.168.1.16 SSH 1514 Server: Encrypted packet (len=1448)
  227 8.427597894 192.168.1.16 → 10.6.15.144  SSH 118 Client: Encrypted packet (len=52)
  228 8.427812256 192.168.1.16 → 10.6.15.144  SSH 126 Client: Encrypted packet (len=60)
  229 8.429564087  10.6.15.144 → 192.168.1.16 TCP 66 22 → 59298 [ACK] Seq=76401 Ack=5061 Win=1452 Len=0 TSval=5699923 TSecr=5103561
  230 8.432466167  10.6.15.144 → 192.168.1.16 SSH 1514 Server: Encrypted packet (len=1448)
  231 8.432649070  10.6.15.144 → 192.168.1.16 SSH 1514 Server: Encrypted packet (len=1448)
  232 8.432655562 192.168.1.16 → 10.6.15.144  TCP 66 59298 → 22 [ACK] Seq=5245 Ack=79297 Win=5703 Len=0 TSval=5103564 TSecr=5699923
  233 8.437176307  10.6.15.144 → 192.168.1.16 SSH 1514 Server: Encrypted packet (len=1448)
  234 8.437356829  10.6.15.144 → 192.168.1.16 SSH 1514 Server: Encrypted packet (len=1448)
  235 8.437364526 192.168.1.16 → 10.6.15.144  TCP 66 59298 → 22 [ACK] Seq=5245 Ack=82193 Win=5703 Len=0 TSval=5103565 TSecr=5699924
  236 8.437549668  10.6.15.144 → 192.168.1.16 SSH 1514 Server: Encrypted packet (len=1448)
  237 8.437893423  10.6.15.144 → 192.168.1.16 SSH 1514 Server: Encrypted packet (len=1448)
  238 8.437901046 192.168.1.16 → 10.6.15.144  TCP 66 59298 → 22 [ACK] Seq=5245 Ack=85089 Win=5703 Len=0 TSval=5103565 TSecr=5699924
  239 8.437913846  10.6.15.144 → 192.168.1.16 TCP 66 22 → 59298 [ACK] Seq=85089 Ack=5245 Win=1452 Len=0 TSval=5699925 TSecr=5103563
  240 8.443033498  10.6.15.144 → 192.168.1.16 SSH 1514 Server: Encrypted packet (len=1448)
  241 8.443213525  10.6.15.144 → 192.168.1.16 SSH 1514 Server: Encrypted packet (len=1448)
  242 8.443222609 192.168.1.16 → 10.6.15.144  TCP 66 59298 → 22 [ACK] Seq=5245 Ack=87985 Win=5703 Len=0 TSval=5103567 TSecr=5699926
  243 8.448150843  10.6.15.144 → 192.168.1.16 SSH 1514 Server: Encrypted packet (len=1448)
  244 8.448463360  10.6.15.144 → 192.168.1.16 SSH 1514 Server: Encrypted packet (len=1448)
  245 8.448472173 192.168.1.16 → 10.6.15.144  TCP 66 59298 → 22 [ACK] Seq=5245 Ack=90881 Win=5703 Len=0 TSval=5103568 TSecr=5699927
  246 8.448652930  10.6.15.144 → 192.168.1.16 SSH 1514 Server: Encrypted packet (len=1448)
  247 8.449001606  10.6.15.144 → 192.168.1.16 SSH 1514 Server: Encrypted packet (len=1448)
  248 8.449011837 192.168.1.16 → 10.6.15.144  TCP 66 59298 → 22 [ACK] Seq=5245 Ack=93777 Win=5703 Len=0 TSval=5103568 TSecr=5699927
  249 8.449191524  10.6.15.144 → 192.168.1.16 SSH 1514 Server: Encrypted packet (len=1448)
  250 8.449384364  10.6.15.144 → 192.168.1.16 SSH 1514 Server: Encrypted packet (len=1448)
  251 8.449392532 192.168.1.16 → 10.6.15.144  TCP 66 59298 → 22 [ACK] Seq=5245 Ack=96673 Win=5703 Len=0 TSval=5103568 TSecr=5699927
  252 8.453875133 192.168.1.16 → 10.6.15.144  SSH 126 Client: Encrypted packet (len=60)
  253 8.453998278  10.6.15.144 → 192.168.1.16 SSH 1514 Server: Encrypted packet (len=1448)
  254 8.454183195  10.6.15.144 → 192.168.1.16 SSH 1514 Server: Encrypted packet (len=1448)
  255 8.454191036 192.168.1.16 → 10.6.15.144  TCP 66 59298 → 22 [ACK] Seq=5305 Ack=99569 Win=5703 Len=0 TSval=5103570 TSecr=5699929
  256 8.459896788  10.6.15.144 → 192.168.1.16 SSH 1514 Server: Encrypted packet (len=1448)
  257 8.460077831  10.6.15.144 → 192.168.1.16 SSH 1514 Server: Encrypted packet (len=1448)
  258 8.460086251 192.168.1.16 → 10.6.15.144  TCP 66 59298 → 22 [ACK] Seq=5305 Ack=102465 Win=5703 Len=0 TSval=5103571 TSecr=5699930
  259 8.460269927  10.6.15.144 → 192.168.1.16 SSH 1514 Server: Encrypted packet (len=1448)
  260 8.460577029  10.6.15.144 → 192.168.1.16 SSH 1258 Server: Encrypted packet (len=1192)
  261 8.460586139 192.168.1.16 → 10.6.15.144  TCP 66 59298 → 22 [ACK] Seq=5305 Ack=105105 Win=5703 Len=0 TSval=5103571 TSecr=5699930
  262 8.461109152 192.168.1.16 → 10.6.15.144  SSH 174 Client: Encrypted packet (len=108)
  263 8.461545817 192.168.1.16 → 10.6.15.144  SSH 126 Client: Encrypted packet (len=60)
  264 8.461766689 192.168.1.16 → 10.6.15.144  SSH 102 Client: Encrypted packet (len=36)
  265 8.470850907 192.168.1.16 → 10.6.15.144  SSH 126 Client: Encrypted packet (len=60)
  266 8.470906451  10.6.15.144 → 192.168.1.16 TCP 66 22 → 59298 [ACK] Seq=105105 Ack=5413 Win=1452 Len=0 TSval=5699933 TSecr=5103569
  267 8.471447226  10.6.15.144 → 192.168.1.16 TCP 66 22 → 59298 [ACK] Seq=105105 Ack=5509 Win=1452 Len=0 TSval=5699933 TSecr=5103571
  268 8.507591547  10.6.15.144 → 192.168.1.16 SSH 110 Server: Encrypted packet (len=44)
  269 8.511345235  10.6.15.144 → 192.168.1.16 SSH 718 Server: Encrypted packet (len=652)
  270 8.511427793 192.168.1.16 → 10.6.15.144  TCP 66 59298 → 22 [ACK] Seq=5569 Ack=105801 Win=5703 Len=0 TSval=5103584 TSecr=5699942
  271 8.519906051 192.168.1.16 → 10.6.15.144  SSH 102 Client: Encrypted packet (len=36)
  272 8.520409503 192.168.1.16 → 10.6.15.144  SSH 102 Client: Encrypted packet (len=36)
  273 8.525244809 192.168.1.16 → 10.6.15.144  SSH 102 Client: Encrypted packet (len=36)
  274 8.525791016 192.168.1.16 → 10.6.15.144  SSH 102 Client: Encrypted packet (len=36)
  275 8.529920703  10.6.15.144 → 192.168.1.16 TCP 66 22 → 59298 [ACK] Seq=105801 Ack=5641 Win=1452 Len=0 TSval=5699948 TSecr=5103586
  276 8.534468201  10.6.15.144 → 192.168.1.16 TCP 66 22 → 59298 [ACK] Seq=105801 Ack=5713 Win=1452 Len=0 TSval=5699949 TSecr=5103587
  277 8.540743819  10.6.15.144 → 192.168.1.16 SSH 102 Server: Encrypted packet (len=36)
  278 8.549571380 192.168.1.16 → 10.6.15.144  SSH 102 Client: Encrypted packet (len=36)
  279 8.549874173 192.168.1.16 → 10.6.15.144  SSH 102 Client: Encrypted packet (len=36)
  280 8.552855920  10.6.15.144 → 192.168.1.16 SSH 238 Server: Encrypted packet (len=172)
  281 8.558722205  10.6.15.144 → 192.168.1.16 TCP 66 22 → 59298 [ACK] Seq=106009 Ack=5785 Win=1452 Len=0 TSval=5699955 TSecr=5103593
  282 8.568975194 192.168.1.16 → 10.6.15.144  SSH 126 Client: Encrypted packet (len=60)
  283 8.575103668 192.168.1.16 → 10.6.15.144  SSH 174 Client: Encrypted packet (len=108)
  284 8.578158208 192.168.1.16 → 10.6.15.144  SSH 126 Client: Encrypted packet (len=60)
  285 8.584245263  10.6.15.144 → 192.168.1.16 TCP 66 22 → 59298 [ACK] Seq=106009 Ack=5953 Win=1452 Len=0 TSval=5699961 TSecr=5103598
  286 8.594155334  10.6.15.144 → 192.168.1.16 SSH 102 Server: Encrypted packet (len=36)
  287 8.594292609  10.6.15.144 → 192.168.1.16 SSH 1006 Server: Encrypted packet (len=940)
  288 8.594316070 192.168.1.16 → 10.6.15.144  TCP 66 59298 → 22 [ACK] Seq=6013 Ack=106985 Win=5703 Len=0 TSval=5103605 TSecr=5699964
  289 8.594431685 192.168.1.16 → 10.6.15.144  SSH 118 Client: Encrypted packet (len=52)
  290 8.595761383 192.168.1.16 → 10.6.15.144  SSH 102 Client: Encrypted packet (len=36)
  291 8.604274327  10.6.15.144 → 192.168.1.16 SSH 138 Server: Encrypted packet (len=72)
  292 8.604540173 192.168.1.16 → 10.6.15.144  SSH 102 Client: Encrypted packet (len=36)
  293 8.605628966  10.6.15.144 → 192.168.1.16 TCP 66 22 → 59298 [ACK] Seq=107057 Ack=6101 Win=1452 Len=0 TSval=5699967 TSecr=5103605
  294 8.606980723  10.6.15.144 → 192.168.1.16 SSH 110 Server: Encrypted packet (len=44)
  295 8.607376516 192.168.1.16 → 10.6.15.144  SSH 150 Client: Encrypted packet (len=84)
  296 8.608719626 192.168.1.16 → 10.6.15.144  SSH 102 Client: Encrypted packet (len=36)
  297 8.609383518 192.168.1.16 → 10.6.15.144  SSH 102 Client: Encrypted packet (len=36)
  298 8.609705683  10.6.15.144 → 192.168.1.16 SSH 138 Server: Encrypted packet (len=72)
  299 8.609706816 192.168.1.16 → 10.6.15.144  SSH 102 Client: Encrypted packet (len=36)
  300 8.610516382 192.168.1.16 → 10.6.15.144  SSH 174 Client: Encrypted packet (len=108)
  301 8.617245638  10.6.15.144 → 192.168.1.16 TCP 66 22 → 59298 [ACK] Seq=107173 Ack=6221 Win=1452 Len=0 TSval=5699970 TSecr=5103607
  302 8.619282747  10.6.15.144 → 192.168.1.16 TCP 66 22 → 59298 [ACK] Seq=107173 Ack=6293 Win=1452 Len=0 TSval=5699970 TSecr=5103608
  303 8.620280363  10.6.15.144 → 192.168.1.16 TCP 66 22 → 59298 [ACK] Seq=107173 Ack=6437 Win=1452 Len=0 TSval=5699970 TSecr=5103608
  304 8.622254221  10.6.15.144 → 192.168.1.16 SSH 574 Server: Encrypted packet (len=508)
  305 8.629002565  10.6.15.144 → 192.168.1.16 SSH 138 Server: Encrypted packet (len=72)
  306 8.629076163 192.168.1.16 → 10.6.15.144  TCP 66 59298 → 22 [ACK] Seq=6437 Ack=107753 Win=5703 Len=0 TSval=5103613 TSecr=5699971
  307 8.629355071 192.168.1.16 → 10.6.15.144  SSH 102 Client: Encrypted packet (len=36)
  308 8.631986346  10.6.15.144 → 192.168.1.16 SSH 110 Server: Encrypted packet (len=44)
  309 8.632173795 192.168.1.16 → 10.6.15.144  SSH 102 Client: Encrypted packet (len=36)
  310 8.632509000 192.168.1.16 → 10.6.15.144  SSH 134 Client: Encrypted packet (len=68)
  311 8.632707526 192.168.1.16 → 10.6.15.144  SSH 102 Client: Encrypted packet (len=36)
  312 8.641791738  10.6.15.144 → 192.168.1.16 TCP 66 22 → 59298 [ACK] Seq=107797 Ack=6509 Win=1452 Len=0 TSval=5699976 TSecr=5103613
  313 8.642232363  10.6.15.144 → 192.168.1.16 TCP 66 22 → 59298 [ACK] Seq=107797 Ack=6613 Win=1452 Len=0 TSval=5699976 TSecr=5103614
  314 8.694299782  10.6.15.144 → 192.168.1.16 SSH 102 Server: Encrypted packet (len=36)
  315 8.694694798 192.168.1.16 → 10.6.15.144  SSH 310 Client: Encrypted packet (len=244)
  316 8.698630977  10.6.15.144 → 192.168.1.16 SSH 138 Server: Encrypted packet (len=72)
  317 8.698838475 192.168.1.16 → 10.6.15.144  SSH 102 Client: Encrypted packet (len=36)
  318 8.700799204  10.6.15.144 → 192.168.1.16 SSH 102 Server: Encrypted packet (len=36)
  319 8.703110071 192.168.1.16 → 10.6.15.144  SSH 142 Client: Encrypted packet (len=76)
  320 8.705779003 192.168.1.16 → 10.6.15.144  SSH 102 Client: Encrypted packet (len=36)
  321 8.706181696 192.168.1.16 → 10.6.15.144  SSH 102 Client: Encrypted packet (len=36)
  322 8.708571127  10.6.15.144 → 192.168.1.16 TCP 66 22 → 59298 [ACK] Seq=107941 Ack=6893 Win=1452 Len=0 TSval=5699992 TSecr=5103630
  323 8.711650353  10.6.15.144 → 192.168.1.16 SSH 138 Server: Encrypted packet (len=72)
  324 8.711848577 192.168.1.16 → 10.6.15.144  SSH 102 Client: Encrypted packet (len=36)
  325 8.712976082  10.6.15.144 → 192.168.1.16 SSH 174 Server: Encrypted packet (len=108)
  326 8.713110924 192.168.1.16 → 10.6.15.144  SSH 102 Client: Encrypted packet (len=36)
  327 8.713323390 192.168.1.16 → 10.6.15.144  SSH 126 Client: Encrypted packet (len=60)
  328 8.715575273  10.6.15.144 → 192.168.1.16 TCP 66 22 → 59298 [ACK] Seq=108121 Ack=7041 Win=1452 Len=0 TSval=5699994 TSecr=5103632
  329 8.718562511  10.6.15.144 → 192.168.1.16 SSH 102 Server: Encrypted packet (len=36)
  330 8.718939867 192.168.1.16 → 10.6.15.144  SSH 126 Client: Encrypted packet (len=60)
  331 8.722556192  10.6.15.144 → 192.168.1.16 TCP 66 22 → 59298 [ACK] Seq=108157 Ack=7173 Win=1452 Len=0 TSval=5699996 TSecr=5103634
  332 8.750774187  10.6.15.144 → 192.168.1.16 SSH 138 Server: Encrypted packet (len=72)
  333 8.750990665 192.168.1.16 → 10.6.15.144  SSH 102 Client: Encrypted packet (len=36)
  334 8.751299311  10.6.15.144 → 192.168.1.16 SSH 102 Server: Encrypted packet (len=36)
  335 8.776176302  10.6.15.144 → 192.168.1.16 SSH 102 Server: Encrypted packet (len=36)
  336 8.776260346 192.168.1.16 → 10.6.15.144  TCP 66 59298 → 22 [ACK] Seq=7269 Ack=108301 Win=5703 Len=0 TSval=5103650 TSecr=5700003
  337 8.776537013 192.168.1.16 → 10.6.15.144  SSH 150 Client: Encrypted packet (len=84)
  338 8.778170780  10.6.15.144 → 192.168.1.16 SSH 102 Server: Encrypted packet (len=36)
  339 8.782178849  10.6.15.144 → 192.168.1.16 SSH 102 Server: Encrypted packet (len=36)
  340 8.782244984 192.168.1.16 → 10.6.15.144  TCP 66 59298 → 22 [ACK] Seq=7353 Ack=108373 Win=5703 Len=0 TSval=5103652 TSecr=5700010
  341 8.785997281  10.6.15.144 → 192.168.1.16 SSH 138 Server: Encrypted packet (len=72)
  342 8.786223046 192.168.1.16 → 10.6.15.144  SSH 102 Client: Encrypted packet (len=36)
  343 8.792659069  10.6.15.144 → 192.168.1.16 SSH 1514 Server: Encrypted packet (len=1448)
  344 8.792683310  10.6.15.144 → 192.168.1.16 SSH 382 Server: Encrypted packet (len=316)
  345 8.792692738 192.168.1.16 → 10.6.15.144  TCP 66 59298 → 22 [ACK] Seq=7389 Ack=110209 Win=5703 Len=0 TSval=5103654 TSecr=5700014
  346 8.828309320  10.6.15.144 → 192.168.1.16 SSH 102 Server: Encrypted packet (len=36)
  347 8.832109765  10.6.15.144 → 192.168.1.16 SSH 174 Server: Encrypted packet (len=108)
  348 8.832171824 192.168.1.16 → 10.6.15.144  TCP 66 59298 → 22 [ACK] Seq=7389 Ack=110353 Win=5703 Len=0 TSval=5103664 TSecr=5700023
  349 8.888274923  10.6.15.144 → 192.168.1.16 SSH 138 Server: Encrypted packet (len=72)
  350 8.888476147 192.168.1.16 → 10.6.15.144  SSH 102 Client: Encrypted packet (len=36)
  351 8.889416748  10.6.15.144 → 192.168.1.16 SSH 110 Server: Encrypted packet (len=44)
  352 8.889675861 192.168.1.16 → 10.6.15.144  SSH 166 Client: Encrypted packet (len=100)
  353 8.897747748  10.6.15.144 → 192.168.1.16 TCP 66 22 → 59298 [ACK] Seq=110469 Ack=7525 Win=1452 Len=0 TSval=5700040 TSecr=5103678
  354 8.934483933  10.6.15.144 → 192.168.1.16 SSH 102 Server: Encrypted packet (len=36)
  355 8.934807787 192.168.1.16 → 10.6.15.144  SSH 134 Client: Encrypted packet (len=68)
  356 8.951835829 192.168.1.16 → 239.255.255.250 SSDP 213 M-SEARCH * HTTP/1.1 
  357 8.981126223  10.6.15.144 → 192.168.1.16 TCP 66 22 → 59298 [ACK] Seq=110505 Ack=7593 Win=1452 Len=0 TSval=5700061 TSecr=5103690
  358 8.982751533  10.6.15.144 → 192.168.1.16 SSH 102 Server: Encrypted packet (len=36)
  359 8.995018617  10.6.15.144 → 192.168.1.16 SSH 174 Server: Encrypted packet (len=108)
  360 8.995096200 192.168.1.16 → 10.6.15.144  TCP 66 59298 → 22 [ACK] Seq=7593 Ack=110649 Win=5703 Len=0 TSval=5103705 TSecr=5700061
  361 9.072378512  10.6.15.144 → 192.168.1.16 SSH 238 Server: Encrypted packet (len=172)
  362 9.114097540 192.168.1.16 → 10.6.15.144  TCP 66 59298 → 22 [ACK] Seq=7593 Ack=110821 Win=5703 Len=0 TSval=5103735 TSecr=5700083
  363 9.177194299 192.168.1.16 → 10.6.15.144  SSH 102 Client: Encrypted packet (len=36)
  364 9.177527192 192.168.1.16 → 10.6.15.144  SSH 110 Client: Encrypted packet (len=44)
  365 9.181277512 192.168.1.16 → 10.6.15.144  SSH 126 Client: Encrypted packet (len=60)
  366 9.187164078  10.6.15.144 → 192.168.1.16 TCP 66 22 → 59298 [ACK] Seq=110821 Ack=7629 Win=1452 Len=0 TSval=5700112 TSecr=5103750
  367 9.187184946  10.6.15.144 → 192.168.1.16 TCP 66 22 → 59298 [ACK] Seq=110821 Ack=7673 Win=1452 Len=0 TSval=5700112 TSecr=5103750
  368 9.190782701  10.6.15.144 → 192.168.1.16 TCP 66 22 → 59298 [ACK] Seq=110821 Ack=7733 Win=1452 Len=0 TSval=5700113 TSecr=5103751
  369 9.952379498 192.168.1.16 → 239.255.255.250 SSDP 213 M-SEARCH * HTTP/1.1 
  370 10.953238842 192.168.1.16 → 239.255.255.250 SSDP 213 M-SEARCH * HTTP/1.1 
  371 12.000280199  10.6.15.144 → 192.168.1.16 SSH 1514 Server: Encrypted packet (len=1448)
  372 12.000306901 192.168.1.16 → 10.6.15.144  TCP 66 59298 → 22 [ACK] Seq=7733 Ack=112269 Win=5703 Len=0 TSval=5104456 TSecr=5700659
  373 12.000405108  10.6.15.144 → 192.168.1.16 SSH 1514 Server: Encrypted packet (len=1448)
  374 12.000410473 192.168.1.16 → 10.6.15.144  TCP 66 59298 → 22 [ACK] Seq=7733 Ack=113717 Win=5703 Len=0 TSval=5104456 TSecr=5700659
  375 12.000613463  10.6.15.144 → 192.168.1.16 SSH 1514 Server: Encrypted packet (len=1448)
  376 12.000621058 192.168.1.16 → 10.6.15.144  TCP 66 59298 → 22 [ACK] Seq=7733 Ack=115165 Win=5703 Len=0 TSval=5104456 TSecr=5700659
  377 12.000706405 192.168.1.16 → 10.6.15.144  SSH 126 Client: Encrypted packet (len=60)
  378 12.000818700  10.6.15.144 → 192.168.1.16 SSH 1514 Server: Encrypted packet (len=1448)
  379 12.001529377  10.6.15.144 → 192.168.1.16 SSH 1514 Server: Encrypted packet (len=1448)
