    1 0.000000000  10.6.15.156 → 192.168.1.12 SSH 454 Server: Encrypted packet (len=388)
    2 0.000022619  10.6.15.156 → 192.168.1.12 SSH 454 Server: Encrypted packet (len=388)
    3 0.000052153  10.6.15.156 → 192.168.1.12 SSH 454 Server: Encrypted packet (len=388)
    4 0.000101495 192.168.1.12 → 10.6.15.156  TCP 66 54766 → 22 [ACK] Seq=1 Ack=1165 Win=4866 Len=0 TSval=7575560 TSecr=14507053
    5 0.000117179  10.6.15.156 → 192.168.1.12 SSH 454 Server: Encrypted packet (len=388)
    6 0.041417989 192.168.1.12 → 10.6.15.156  TCP 66 54766 → 22 [ACK] Seq=1 Ack=1553 Win=4866 Len=0 TSval=7575571 TSecr=14507053
    7 0.333490155  10.6.15.156 → 192.168.1.12 SSH 430 Server: Encrypted packet (len=364)
    8 0.333513401 192.168.1.12 → 10.6.15.156  TCP 66 54766 → 22 [ACK] Seq=1 Ack=1917 Win=4866 Len=0 TSval=7575644 TSecr=14507137
    9 0.333529226  10.6.15.156 → 192.168.1.12 SSH 102 Server: Encrypted packet (len=36)
   10 0.333534514 192.168.1.12 → 10.6.15.156  TCP 66 54766 → 22 [ACK] Seq=1 Ack=1953 Win=4866 Len=0 TSval=7575644 TSecr=14507137
   11 0.335829719 192.168.1.12 → 10.6.15.156  SSH 146 Client: Encrypted packet (len=80)
   12 0.339051733  10.6.15.156 → 192.168.1.12 TCP 66 22 → 54766 [ACK] Seq=1953 Ack=81 Win=1452 Len=0 TSval=14507138 TSecr=7575644
   13 0.339070659 192.168.1.12 → 10.6.15.156  SSH 138 Client: Encrypted packet (len=72)
   14 0.341006119  10.6.15.156 → 192.168.1.12 TCP 66 22 → 54766 [ACK] Seq=1953 Ack=153 Win=1452 Len=0 TSval=14507139 TSecr=7575645
   15 0.341395068  10.6.15.156 → 192.168.1.12 SSH 102 Server: Encrypted packet (len=36)
   16 0.385443143 192.168.1.12 → 10.6.15.156  TCP 66 54766 → 22 [ACK] Seq=153 Ack=1989 Win=4866 Len=0 TSval=7575657 TSecr=14507139
   17 0.436763120  10.6.15.156 → 192.168.1.12 SSH 138 Server: Encrypted packet (len=72)
   18 0.436787764 192.168.1.12 → 10.6.15.156  TCP 66 54766 → 22 [ACK] Seq=153 Ack=2061 Win=4866 Len=0 TSval=7575669 TSecr=14507161
   19 0.437121222 192.168.1.12 → 10.6.15.156  SSH 182 Client: Encrypted packet (len=116)
   20 0.484463983  10.6.15.156 → 192.168.1.12 TCP 66 22 → 54766 [ACK] Seq=2061 Ack=269 Win=1452 Len=0 TSval=14507173 TSecr=7575669
   21 0.484483661 192.168.1.12 → 10.6.15.156  SSH 158 Client: Encrypted packet (len=92)
   22 0.494436068  10.6.15.156 → 192.168.1.12 TCP 66 22 → 54766 [ACK] Seq=2061 Ack=361 Win=1452 Len=0 TSval=14507175 TSecr=7575681
   23 0.531734778  10.6.15.156 → 192.168.1.12 SSH 1514 Server: Encrypted packet (len=1448)
   24 0.531989824  10.6.15.156 → 192.168.1.12 SSH 1118 Server: Encrypted packet (len=1052)
   25 0.531999424 192.168.1.12 → 10.6.15.156  TCP 66 54766 → 22 [ACK] Seq=361 Ack=4561 Win=4866 Len=0 TSval=7575693 TSecr=14507186
   26 0.533497646 192.168.1.12 → 10.6.15.156  SSH 206 Client: Encrypted packet (len=140)
   27 0.535024751  10.6.15.156 → 192.168.1.12 TCP 66 22 → 54766 [ACK] Seq=4561 Ack=501 Win=1452 Len=0 TSval=14507187 TSecr=7575694
   28 0.537506477 192.168.1.12 → 10.6.15.156  SSH 1514 Client: Encrypted packet (len=1448)
   29 0.538328752 192.168.1.12 → 10.6.15.156  SSH 422 Client: Encrypted packet (len=356)
   30 0.543857224  10.6.15.156 → 192.168.1.12 TCP 66 22 → 54766 [ACK] Seq=4561 Ack=2305 Win=1451 Len=0 TSval=14507189 TSecr=7575695
   31 0.579444246  10.6.15.156 → 192.168.1.12 SSH 518 Server: Encrypted packet (len=452)
   32 0.580708875 192.168.1.12 → 10.6.15.156  SSH 206 Client: Encrypted packet (len=140)
   33 0.622258556  10.6.15.156 → 192.168.1.12 TCP 66 22 → 54766 [ACK] Seq=5013 Ack=2445 Win=1452 Len=0 TSval=14507209 TSecr=7575705
   34 0.625797372  10.6.15.156 → 192.168.1.12 SSH 350 Server: Encrypted packet (len=284)
   35 0.669448776 192.168.1.12 → 10.6.15.156  TCP 66 54766 → 22 [ACK] Seq=2445 Ack=5297 Win=4866 Len=0 TSval=7575728 TSecr=14507209
   36 0.673250061  10.6.15.156 → 192.168.1.12 SSH 318 Server: Encrypted packet (len=252)
   37 0.673275028 192.168.1.12 → 10.6.15.156  TCP 66 54766 → 22 [ACK] Seq=2445 Ack=5549 Win=4866 Len=0 TSval=7575728 TSecr=14507222
   38 0.770339172 192.168.1.12 → 10.6.15.156  SSH 862 Client: Encrypted packet (len=796)
   39 0.772850043  10.6.15.156 → 192.168.1.12 TCP 66 22 → 54766 [ACK] Seq=5549 Ack=3241 Win=1452 Len=0 TSval=14507247 TSecr=7575753
   40 0.991239680  10.6.15.156 → 192.168.1.12 SSH 454 Server: Encrypted packet (len=388)
   41 0.991266465 192.168.1.12 → 10.6.15.156  TCP 66 54766 → 22 [ACK] Seq=3241 Ack=5937 Win=4866 Len=0 TSval=7575808 TSecr=14507301
   42 1.041522892  10.22.17.65 → 224.0.0.252  LLMNR 64 Standard query 0xe53a A wpad
   43 1.041586470  10.22.17.65 → 224.0.0.252  LLMNR 64 Standard query 0x8272 AAAA wpad
   44 1.057136457  10.6.15.156 → 192.168.1.12 SSH 1514 Server: Encrypted packet (len=1448)
   45 1.057155102 192.168.1.12 → 10.6.15.156  TCP 66 54766 → 22 [ACK] Seq=3241 Ack=7385 Win=4866 Len=0 TSval=7575824 TSecr=14507318
   46 1.057174591  10.6.15.156 → 192.168.1.12 SSH 638 Server: Encrypted packet (len=572)
   47 1.057181577 192.168.1.12 → 10.6.15.156  TCP 66 54766 → 22 [ACK] Seq=3241 Ack=7957 Win=4866 Len=0 TSval=7575824 TSecr=14507318
   48 1.057895986  10.6.15.156 → 192.168.1.12 SSH 1514 Server: Encrypted packet (len=1448)
   49 1.057907215 192.168.1.12 → 10.6.15.156  TCP 66 54766 → 22 [ACK] Seq=3241 Ack=9405 Win=4866 Len=0 TSval=7575825 TSecr=14507318
   50 1.058083997  10.6.15.156 → 192.168.1.12 SSH 1514 Server: Encrypted packet (len=1448)
   51 1.058091868 192.168.1.12 → 10.6.15.156  TCP 66 54766 → 22 [ACK] Seq=3241 Ack=10853 Win=4866 Len=0 TSval=7575825 TSecr=14507318
   52 1.058437383  10.6.15.156 → 192.168.1.12 SSH 1514 Server: Encrypted packet (len=1448)
   53 1.058444010 192.168.1.12 → 10.6.15.156  TCP 66 54766 → 22 [ACK] Seq=3241 Ack=12301 Win=4866 Len=0 TSval=7575825 TSecr=14507318
   54 1.058453171  10.6.15.156 → 192.168.1.12 SSH 118 Server: Encrypted packet (len=52)
   55 1.058455505 192.168.1.12 → 10.6.15.156  TCP 66 54766 → 22 [ACK] Seq=3241 Ack=12353 Win=4866 Len=0 TSval=7575825 TSecr=14507318
   56 1.082220998  10.6.15.156 → 192.168.1.12 SSH 222 Server: Encrypted packet (len=156)
   57 1.082241275 192.168.1.12 → 10.6.15.156  TCP 66 54766 → 22 [ACK] Seq=3241 Ack=12509 Win=4866 Len=0 TSval=7575831 TSecr=14507324
   58 1.083052142  10.6.15.156 → 192.168.1.12 SSH 502 Server: Encrypted packet (len=436)
   59 1.083062698 192.168.1.12 → 10.6.15.156  TCP 66 54766 → 22 [ACK] Seq=3241 Ack=12945 Win=4866 Len=0 TSval=7575831 TSecr=14507324
   60 1.083074561  10.6.15.156 → 192.168.1.12 SSH 230 Server: Encrypted packet (len=164)
   61 1.083078612 192.168.1.12 → 10.6.15.156  TCP 66 54766 → 22 [ACK] Seq=3241 Ack=13109 Win=4866 Len=0 TSval=7575831 TSecr=14507324
   62 1.084457722  10.6.15.156 → 192.168.1.12 SSH 1514 Server: Encrypted packet (len=1448)
   63 1.084476036 192.168.1.12 → 10.6.15.156  TCP 66 54766 → 22 [ACK] Seq=3241 Ack=14557 Win=4866 Len=0 TSval=7575831 TSecr=14507325
   64 1.084643467  10.6.15.156 → 192.168.1.12 SSH 1514 Server: Encrypted packet (len=1448)
   65 1.084650044 192.168.1.12 → 10.6.15.156  TCP 66 54766 → 22 [ACK] Seq=3241 Ack=16005 Win=4866 Len=0 TSval=7575831 TSecr=14507325
   66 1.085238449  10.6.15.156 → 192.168.1.12 SSH 110 Server: Encrypted packet (len=44)
   67 1.085247978 192.168.1.12 → 10.6.15.156  TCP 66 54766 → 22 [ACK] Seq=3241 Ack=16049 Win=4866 Len=0 TSval=7575831 TSecr=14507325
   68 1.085465038  10.6.15.156 → 192.168.1.12 SSH 1514 Server: Encrypted packet (len=1448)
   69 1.085472300 192.168.1.12 → 10.6.15.156  TCP 66 54766 → 22 [ACK] Seq=3241 Ack=17497 Win=4866 Len=0 TSval=7575832 TSecr=14507325
   70 1.085493152  10.6.15.156 → 192.168.1.12 SSH 134 Server: Encrypted packet (len=68)
   71 1.085496692 192.168.1.12 → 10.6.15.156  TCP 66 54766 → 22 [ACK] Seq=3241 Ack=17565 Win=4866 Len=0 TSval=7575832 TSecr=14507325
   72 1.101097816  10.6.15.156 → 192.168.1.12 SSH 230 Server: Encrypted packet (len=164)
   73 1.101114095 192.168.1.12 → 10.6.15.156  TCP 66 54766 → 22 [ACK] Seq=3241 Ack=17729 Win=4866 Len=0 TSval=7575835 TSecr=14507329
   74 1.158891216  10.6.15.156 → 192.168.1.12 SSH 1514 Server: Encrypted packet (len=1448)
   75 1.159078575  10.6.15.156 → 192.168.1.12 SSH 1514 Server: Encrypted packet (len=1448)
   76 1.159089220 192.168.1.12 → 10.6.15.156  TCP 66 54766 → 22 [ACK] Seq=3241 Ack=20625 Win=4866 Len=0 TSval=7575850 TSecr=14507343
   77 1.159270700  10.6.15.156 → 192.168.1.12 SSH 1514 Server: Encrypted packet (len=1448)
   78 1.159462417  10.6.15.156 → 192.168.1.12 SSH 1514 Server: Encrypted packet (len=1448)
   79 1.159468346 192.168.1.12 → 10.6.15.156  TCP 66 54766 → 22 [ACK] Seq=3241 Ack=23521 Win=4866 Len=0 TSval=7575850 TSecr=14507343
   80 1.159476804  10.6.15.156 → 192.168.1.12 SSH 110 Server: Encrypted packet (len=44)
   81 1.159513968 192.168.1.12 → 10.6.15.156  TCP 66 54766 → 22 [ACK] Seq=3241 Ack=23565 Win=4866 Len=0 TSval=7575850 TSecr=14507343
   82 1.159822824  10.6.15.156 → 192.168.1.12 SSH 1514 Server: Encrypted packet (len=1448)
   83 1.160014578  10.6.15.156 → 192.168.1.12 SSH 1514 Server: Encrypted packet (len=1448)
   84 1.160020836 192.168.1.12 → 10.6.15.156  TCP 66 54766 → 22 [ACK] Seq=3241 Ack=26461 Win=4866 Len=0 TSval=7575850 TSecr=14507343
   85 1.160205308  10.6.15.156 → 192.168.1.12 SSH 1514 Server: Encrypted packet (len=1448)
   86 1.160397815  10.6.15.156 → 192.168.1.12 SSH 1514 Server: Encrypted packet (len=1448)
   87 1.160401906 192.168.1.12 → 10.6.15.156  TCP 66 54766 → 22 [ACK] Seq=3241 Ack=29357 Win=4866 Len=0 TSval=7575850 TSecr=14507343
   88 1.160589809  10.6.15.156 → 192.168.1.12 SSH 1514 Server: Encrypted packet (len=1448)
   89 1.160783667  10.6.15.156 → 192.168.1.12 SSH 1514 Server: Encrypted packet (len=1448)
   90 1.160789506 192.168.1.12 → 10.6.15.156  TCP 66 54766 → 22 [ACK] Seq=3241 Ack=32253 Win=4866 Len=0 TSval=7575850 TSecr=14507343
   91 1.161126569  10.6.15.156 → 192.168.1.12 SSH 1514 Server: Encrypted packet (len=1448)
   92 1.163171299  10.6.15.156 → 192.168.1.12 SSH 1514 Server: Encrypted packet (len=1448)
   93 1.163178816 192.168.1.12 → 10.6.15.156  TCP 66 54766 → 22 [ACK] Seq=3241 Ack=35149 Win=4866 Len=0 TSval=7575851 TSecr=14507343
   94 1.163187708  10.6.15.156 → 192.168.1.12 SSH 102 Server: Encrypted packet (len=36)
   95 1.163225275 192.168.1.12 → 10.6.15.156  TCP 66 54766 → 22 [ACK] Seq=3241 Ack=35185 Win=4866 Len=0 TSval=7575851 TSecr=14507344
   96 1.181772729  10.6.15.156 → 192.168.1.12 SSH 1514 Server: Encrypted packet (len=1448)
   97 1.181956459  10.6.15.156 → 192.168.1.12 SSH 1514 Server: Encrypted packet (len=1448)
   98 1.181966101 192.168.1.12 → 10.6.15.156  TCP 66 54766 → 22 [ACK] Seq=3241 Ack=38081 Win=4866 Len=0 TSval=7575856 TSecr=14507349
   99 1.182068825  10.6.15.156 → 192.168.1.12 SSH 974 Server: Encrypted packet (len=908)
  100 1.182100211 192.168.1.12 → 10.6.15.156  TCP 66 54766 → 22 [ACK] Seq=3241 Ack=38989 Win=4866 Len=0 TSval=7575856 TSecr=14507349
  101 1.209144996 192.168.1.12 → 10.6.15.156  SSH 126 Client: Encrypted packet (len=60)
  102 1.212139519  10.6.15.156 → 192.168.1.12 TCP 66 22 → 54766 [ACK] Seq=38989 Ack=3301 Win=1452 Len=0 TSval=14507357 TSecr=7575862
  103 1.212156091 192.168.1.12 → 10.6.15.156  SSH 102 Client: Encrypted packet (len=36)
  104 1.213613104  10.6.15.156 → 192.168.1.12 TCP 66 22 → 54766 [ACK] Seq=38989 Ack=3337 Win=1452 Len=0 TSval=14507357 TSecr=7575863
  105 1.248487249 192.168.1.12 → 10.6.15.156  SSH 102 Client: Encrypted packet (len=36)
  106 1.249834612  10.6.15.156 → 192.168.1.12 TCP 66 22 → 54766 [ACK] Seq=38989 Ack=3373 Win=1452 Len=0 TSval=14507366 TSecr=7575872
  107 1.422056989  10.6.15.156 → 192.168.1.12 SSH 1514 Server: Encrypted packet (len=1448)
  108 1.422194513  10.6.15.156 → 192.168.1.12 SSH 1514 Server: Encrypted packet (len=1448)
  109 1.422204742 192.168.1.12 → 10.6.15.156  TCP 66 54766 → 22 [ACK] Seq=3373 Ack=41885 Win=4866 Len=0 TSval=7575916 TSecr=14507409
  110 1.422362266  10.6.15.156 → 192.168.1.12 SSH 246 Server: Encrypted packet (len=180)
  111 1.423175687  10.6.15.156 → 192.168.1.12 SSH 1514 Server: Encrypted packet (len=1448)
  112 1.423194225 192.168.1.12 → 10.6.15.156  TCP 66 54766 → 22 [ACK] Seq=3373 Ack=43513 Win=4866 Len=0 TSval=7575916 TSecr=14507409
  113 1.423316779  10.6.15.156 → 192.168.1.12 SSH 1514 Server: Encrypted packet (len=1448)
  114 1.423708113  10.6.15.156 → 192.168.1.12 SSH 1514 Server: Encrypted packet (len=1448)
  115 1.423725807 192.168.1.12 → 10.6.15.156  TCP 66 54766 → 22 [ACK] Seq=3373 Ack=46409 Win=4866 Len=0 TSval=7575916 TSecr=14507409
  116 1.424008768  10.6.15.156 → 192.168.1.12 SSH 1514 Server: Encrypted packet (len=1448)
  117 1.424180967  10.6.15.156 → 192.168.1.12 SSH 1514 Server: Encrypted packet (len=1448)
  118 1.424188751 192.168.1.12 → 10.6.15.156  TCP 66 54766 → 22 [ACK] Seq=3373 Ack=49305 Win=4866 Len=0 TSval=7575916 TSecr=14507409
  119 1.424312729  10.6.15.156 → 192.168.1.12 SSH 110 Server: Encrypted packet (len=44)
  120 1.426242658  10.6.15.156 → 192.168.1.12 SSH 1514 Server: Encrypted packet (len=1448)
  121 1.426249470 192.168.1.12 → 10.6.15.156  TCP 66 54766 → 22 [ACK] Seq=3373 Ack=50797 Win=4866 Len=0 TSval=7575917 TSecr=14507409
  122 1.426430696  10.6.15.156 → 192.168.1.12 SSH 1514 Server: Encrypted packet (len=1448)
  123 1.426624093  10.6.15.156 → 192.168.1.12 SSH 1514 Server: Encrypted packet (len=1448)
  124 1.426630869 192.168.1.12 → 10.6.15.156  TCP 66 54766 → 22 [ACK] Seq=3373 Ack=53693 Win=4866 Len=0 TSval=7575917 TSecr=14507410
  125 1.426798209  10.6.15.156 → 192.168.1.12 SSH 1514 Server: Encrypted packet (len=1448)
  126 1.426990614  10.6.15.156 → 192.168.1.12 SSH 1514 Server: Encrypted packet (len=1448)
  127 1.426997352 192.168.1.12 → 10.6.15.156  TCP 66 54766 → 22 [ACK] Seq=3373 Ack=56589 Win=4866 Len=0 TSval=7575917 TSecr=14507410
  128 1.427175884  10.6.15.156 → 192.168.1.12 SSH 1514 Server: Encrypted packet (len=1448)
  129 1.427387160  10.6.15.156 → 192.168.1.12 SSH 1514 Server: Encrypted packet (len=1448)
  130 1.427390202 192.168.1.12 → 10.6.15.156  TCP 66 54766 → 22 [ACK] Seq=3373 Ack=59485 Win=4866 Len=0 TSval=7575917 TSecr=14507410
  131 1.427731819  10.6.15.156 → 192.168.1.12 SSH 1514 Server: Encrypted packet (len=1448)
  132 1.427923548  10.6.15.156 → 192.168.1.12 SSH 1514 Server: Encrypted packet (len=1448)
  133 1.427926562 192.168.1.12 → 10.6.15.156  TCP 66 54766 → 22 [ACK] Seq=3373 Ack=62381 Win=4866 Len=0 TSval=7575917 TSecr=14507410
  134 1.428119165  10.6.15.156 → 192.168.1.12 SSH 1514 Server: Encrypted packet (len=1448)
  135 1.428307738  10.6.15.156 → 192.168.1.12 SSH 1514 Server: Encrypted packet (len=1448)
  136 1.428310400 192.168.1.12 → 10.6.15.156  TCP 66 54766 → 22 [ACK] Seq=3373 Ack=65277 Win=4866 Len=0 TSval=7575917 TSecr=14507410
  137 1.428499646  10.6.15.156 → 192.168.1.12 SSH 1514 Server: Encrypted packet (len=1448)
  138 1.428504098  10.6.15.156 → 192.168.1.12 SSH 194 Server: Encrypted packet (len=128)
  139 1.428508010 192.168.1.12 → 10.6.15.156  TCP 66 54766 → 22 [ACK] Seq=3373 Ack=66853 Win=4866 Len=0 TSval=7575917 TSecr=14507410
  140 1.459769962  10.22.17.65 → 224.0.0.252  LLMNR 64 Standard query 0x8272 AAAA wpad
  141 1.459790485  10.22.17.65 → 224.0.0.252  LLMNR 64 Standard query 0xe53a A wpad
  142 1.465713192  10.6.15.156 → 192.168.1.12 SSH 1514 Server: Encrypted packet (len=1448)
  143 1.465737312  10.6.15.156 → 192.168.1.12 SSH 366 Server: Encrypted packet (len=300)
  144 1.465748516 192.168.1.12 → 10.6.15.156  TCP 66 54766 → 22 [ACK] Seq=3373 Ack=68601 Win=4866 Len=0 TSval=7575927 TSecr=14507420
  145 1.467037344  10.6.15.156 → 192.168.1.12 SSH 1514 Server: Encrypted packet (len=1448)
  146 1.467227098  10.6.15.156 → 192.168.1.12 SSH 1514 Server: Encrypted packet (len=1448)
  147 1.467235560 192.168.1.12 → 10.6.15.156  TCP 66 54766 → 22 [ACK] Seq=3373 Ack=71497 Win=4866 Len=0 TSval=7575927 TSecr=14507420
  148 1.467419663  10.6.15.156 → 192.168.1.12 SSH 1514 Server: Encrypted packet (len=1448)
  149 1.467640824  10.6.15.156 → 192.168.1.12 SSH 1514 Server: Encrypted packet (len=1448)
  150 1.467647595 192.168.1.12 → 10.6.15.156  TCP 66 54766 → 22 [ACK] Seq=3373 Ack=74393 Win=4866 Len=0 TSval=7575927 TSecr=14507420
  151 1.467986441  10.6.15.156 → 192.168.1.12 SSH 1514 Server: Encrypted packet (len=1448)
  152 1.468159438  10.6.15.156 → 192.168.1.12 SSH 1514 Server: Encrypted packet (len=1448)
  153 1.468166665 192.168.1.12 → 10.6.15.156  TCP 66 54766 → 22 [ACK] Seq=3373 Ack=77289 Win=4866 Len=0 TSval=7575927 TSecr=14507420
  154 1.468176949  10.6.15.156 → 192.168.1.12 SSH 226 Server: Encrypted packet (len=160)
  155 1.468372615  10.6.15.156 → 192.168.1.12 SSH 1514 Server: Encrypted packet (len=1448)
  156 1.468378557 192.168.1.12 → 10.6.15.156  TCP 66 54766 → 22 [ACK] Seq=3373 Ack=78897 Win=4866 Len=0 TSval=7575927 TSecr=14507420
  157 1.468437126 192.168.1.12 → 10.6.15.156  SSH 174 Client: Encrypted packet (len=108)
  158 1.468563652  10.6.15.156 → 192.168.1.12 SSH 1514 Server: Encrypted packet (len=1448)
  159 1.468648214  10.6.15.156 → 192.168.1.12 SSH 670 Server: Encrypted packet (len=604)
  160 1.468652417 192.168.1.12 → 10.6.15.156  TCP 66 54766 → 22 [ACK] Seq=3481 Ack=80949 Win=4866 Len=0 TSval=7575927 TSecr=14507420
  161 1.469243381 192.168.1.12 → 10.6.15.156  SSH 242 Client: Encrypted packet (len=176)
  162 1.470353522  10.6.15.156 → 192.168.1.12 TCP 66 22 → 54766 [ACK] Seq=80949 Ack=3481 Win=1452 Len=0 TSval=14507421 TSecr=7575927
  163 1.470367233  10.6.15.156 → 192.168.1.12 TCP 66 22 → 54766 [ACK] Seq=80949 Ack=3657 Win=1452 Len=0 TSval=14507421 TSecr=7575927
  164 1.573129343  10.6.15.156 → 192.168.1.12 SSH 1514 Server: Encrypted packet (len=1448)
  165 1.573241613  10.6.15.156 → 192.168.1.12 SSH 1346 Server: Encrypted packet (len=1280)
  166 1.573253222 192.168.1.12 → 10.6.15.156  TCP 66 54766 → 22 [ACK] Seq=3657 Ack=83677 Win=4866 Len=0 TSval=7575953 TSecr=14507447
  167 1.573478875  10.6.15.156 → 192.168.1.12 SSH 906 Server: Encrypted packet (len=840)
  168 1.574265776 192.168.1.12 → 10.6.15.156  SSH 206 Client: Encrypted packet (len=140)
  169 1.575694172  10.6.15.156 → 192.168.1.12 TCP 66 22 → 54766 [ACK] Seq=84517 Ack=3797 Win=1452 Len=0 TSval=14507448 TSecr=7575954
  170 1.575701182 192.168.1.12 → 10.6.15.156  SSH 206 Client: Encrypted packet (len=140)
  171 1.577706560  10.6.15.156 → 192.168.1.12 TCP 66 22 → 54766 [ACK] Seq=84517 Ack=3937 Win=1452 Len=0 TSval=14507448 TSecr=7575954
  172 1.577713759 192.168.1.12 → 10.6.15.156  SSH 206 Client: Encrypted packet (len=140)
  173 1.578401742 192.168.1.12 → 10.6.15.156  SSH 1514 Client: Encrypted packet (len=1448)
  174 1.579275038 192.168.1.12 → 10.6.15.156  SSH 518 Client: Encrypted packet (len=452)
  175 1.579370878  10.6.15.156 → 192.168.1.12 TCP 66 22 → 54766 [ACK] Seq=84517 Ack=4077 Win=1452 Len=0 TSval=14507448 TSecr=7575955
  176 1.580848964  10.6.15.156 → 192.168.1.12 TCP 66 22 → 54766 [ACK] Seq=84517 Ack=5525 Win=1452 Len=0 TSval=14507449 TSecr=7575955
  177 1.580868249  10.6.15.156 → 192.168.1.12 TCP 66 22 → 54766 [ACK] Seq=84517 Ack=5977 Win=1452 Len=0 TSval=14507449 TSecr=7575955
  178 1.674111694  10.6.15.156 → 192.168.1.12 SSH 366 Server: Encrypted packet (len=300)
  179 1.676921065  10.6.15.156 → 192.168.1.12 SSH 334 Server: Encrypted packet (len=268)
  180 1.676996319 192.168.1.12 → 10.6.15.156  TCP 66 54766 → 22 [ACK] Seq=5977 Ack=85085 Win=4866 Len=0 TSval=7575979 TSecr=14507472
  181 1.679900599  10.6.15.156 → 192.168.1.12 SSH 334 Server: Encrypted packet (len=268)
  182 1.681833271  10.6.15.156 → 192.168.1.12 SSH 1514 Server: Encrypted packet (len=1448)
  183 1.681849167 192.168.1.12 → 10.6.15.156  TCP 66 54766 → 22 [ACK] Seq=5977 Ack=86801 Win=4866 Len=0 TSval=7575981 TSecr=14507474
  184 1.682012912  10.6.15.156 → 192.168.1.12 SSH 1514 Server: Encrypted packet (len=1448)
  185 1.682205310  10.6.15.156 → 192.168.1.12 SSH 1514 Server: Encrypted packet (len=1448)
  186 1.682208917 192.168.1.12 → 10.6.15.156  TCP 66 54766 → 22 [ACK] Seq=5977 Ack=89697 Win=4866 Len=0 TSval=7575981 TSecr=14507474
  187 1.682216299  10.6.15.156 → 192.168.1.12 SSH 110 Server: Encrypted packet (len=44)
  188 1.683376952  10.6.15.156 → 192.168.1.12 SSH 1514 Server: Encrypted packet (len=1448)
  189 1.683386641 192.168.1.12 → 10.6.15.156  TCP 66 54766 → 22 [ACK] Seq=5977 Ack=91189 Win=4866 Len=0 TSval=7575981 TSecr=14507474
  190 1.683564280  10.6.15.156 → 192.168.1.12 SSH 1514 Server: Encrypted packet (len=1448)
  191 1.683756178  10.6.15.156 → 192.168.1.12 SSH 1514 Server: Encrypted packet (len=1448)
  192 1.683760056 192.168.1.12 → 10.6.15.156  TCP 66 54766 → 22 [ACK] Seq=5977 Ack=94085 Win=4866 Len=0 TSval=7575981 TSecr=14507474
  193 1.683947688  10.6.15.156 → 192.168.1.12 SSH 1514 Server: Encrypted packet (len=1448)
  194 1.684140759  10.6.15.156 → 192.168.1.12 SSH 1514 Server: Encrypted packet (len=1448)
  195 1.684142988 192.168.1.12 → 10.6.15.156  TCP 66 54766 → 22 [ACK] Seq=5977 Ack=96981 Win=4866 Len=0 TSval=7575981 TSecr=14507474
  196 1.684332092  10.6.15.156 → 192.168.1.12 SSH 1514 Server: Encrypted packet (len=1448)
  197 1.684524441  10.6.15.156 → 192.168.1.12 SSH 1514 Server: Encrypted packet (len=1448)
  198 1.684527112 192.168.1.12 → 10.6.15.156  TCP 66 54766 → 22 [ACK] Seq=5977 Ack=99877 Win=4866 Len=0 TSval=7575981 TSecr=14507474
  199 1.684660476  10.6.15.156 → 192.168.1.12 SSH 110 Server: Encrypted packet (len=44)
  200 1.686152212  10.6.15.156 → 192.168.1.12 SSH 1514 Server: Encrypted packet (len=1448)
  201 1.686165638 192.168.1.12 → 10.6.15.156  TCP 66 54766 → 22 [ACK] Seq=5977 Ack=101369 Win=4866 Len=0 TSval=7575982 TSecr=14507474
  202 1.686335545  10.6.15.156 → 192.168.1.12 SSH 1514 Server: Encrypted packet (len=1448)
  203 1.686681956  10.6.15.156 → 192.168.1.12 SSH 1514 Server: Encrypted packet (len=1448)
  204 1.686684986 192.168.1.12 → 10.6.15.156  TCP 66 54766 → 22 [ACK] Seq=5977 Ack=104265 Win=4866 Len=0 TSval=7575982 TSecr=14507475
  205 1.686872594  10.6.15.156 → 192.168.1.12 SSH 1514 Server: Encrypted packet (len=1448)
  206 1.687063681  10.6.15.156 → 192.168.1.12 SSH 1514 Server: Encrypted packet (len=1448)
  207 1.687066108 192.168.1.12 → 10.6.15.156  TCP 66 54766 → 22 [ACK] Seq=5977 Ack=107161 Win=4866 Len=0 TSval=7575982 TSecr=14507475
  208 1.687257809  10.6.15.156 → 192.168.1.12 SSH 1514 Server: Encrypted packet (len=1448)
  209 1.687451304  10.6.15.156 → 192.168.1.12 SSH 1514 Server: Encrypted packet (len=1448)
  210 1.687456730 192.168.1.12 → 10.6.15.156  TCP 66 54766 → 22 [ACK] Seq=5977 Ack=110057 Win=4866 Len=0 TSval=7575982 TSecr=14507475
  211 1.687642758  10.6.15.156 → 192.168.1.12 SSH 1514 Server: Encrypted packet (len=1448)
  212 1.687989731  10.6.15.156 → 192.168.1.12 SSH 1514 Server: Encrypted packet (len=1448)
  213 1.687996351 192.168.1.12 → 10.6.15.156  TCP 66 54766 → 22 [ACK] Seq=5977 Ack=112953 Win=4866 Len=0 TSval=7575982 TSecr=14507475
  214 1.688177576  10.6.15.156 → 192.168.1.12 SSH 1514 Server: Encrypted packet (len=1448)
  215 1.688374003  10.6.15.156 → 192.168.1.12 SSH 1514 Server: Encrypted packet (len=1448)
  216 1.688380915 192.168.1.12 → 10.6.15.156  TCP 66 54766 → 22 [ACK] Seq=5977 Ack=115849 Win=4866 Len=0 TSval=7575982 TSecr=14507475
  217 1.688565044  10.6.15.156 → 192.168.1.12 SSH 1514 Server: Encrypted packet (len=1448)
  218 1.688583910  10.6.15.156 → 192.168.1.12 SSH 374 Server: Encrypted packet (len=308)
  219 1.688588439 192.168.1.12 → 10.6.15.156  TCP 66 54766 → 22 [ACK] Seq=5977 Ack=117605 Win=4866 Len=0 TSval=7575982 TSecr=14507475
  220 1.688807891  10.6.15.156 → 192.168.1.12 SSH 1514 Server: Encrypted packet (len=1448)
  221 1.689000954  10.6.15.156 → 192.168.1.12 SSH 1514 Server: Encrypted packet (len=1448)
  222 1.689009485 192.168.1.12 → 10.6.15.156  TCP 66 54766 → 22 [ACK] Seq=5977 Ack=120501 Win=4866 Len=0 TSval=7575982 TSecr=14507475
  223 1.689191991  10.6.15.156 → 192.168.1.12 SSH 1514 Server: Encrypted packet (len=1448)
  224 1.690551887  10.6.15.156 → 192.168.1.12 SSH 1514 Server: Encrypted packet (len=1448)
  225 1.690573411 192.168.1.12 → 10.6.15.156  TCP 66 54766 → 22 [ACK] Seq=5977 Ack=123397 Win=4866 Len=0 TSval=7575983 TSecr=14507475
  226 1.690735047  10.6.15.156 → 192.168.1.12 SSH 1514 Server: Encrypted packet (len=1448)
  227 1.690927514  10.6.15.156 → 192.168.1.12 SSH 1514 Server: Encrypted packet (len=1448)
  228 1.690936301 192.168.1.12 → 10.6.15.156  TCP 66 54766 → 22 [ACK] Seq=5977 Ack=126293 Win=4866 Len=0 TSval=7575983 TSecr=14507475
  229 1.691115396  10.6.15.156 → 192.168.1.12 SSH 1514 Server: Encrypted packet (len=1448)
  230 1.691306441  10.6.15.156 → 192.168.1.12 SSH 1514 Server: Encrypted packet (len=1448)
  231 1.691311243 192.168.1.12 → 10.6.15.156  TCP 66 54766 → 22 [ACK] Seq=5977 Ack=129189 Win=4866 Len=0 TSval=7575983 TSecr=14507475
  232 1.691497664  10.6.15.156 → 192.168.1.12 SSH 1514 Server: Encrypted packet (len=1448)
  233 1.691690351  10.6.15.156 → 192.168.1.12 SSH 1514 Server: Encrypted packet (len=1448)
  234 1.691692852 192.168.1.12 → 10.6.15.156  TCP 66 54766 → 22 [ACK] Seq=5977 Ack=132085 Win=4866 Len=0 TSval=7575983 TSecr=14507475
  235 1.692036818  10.6.15.156 → 192.168.1.12 SSH 1514 Server: Encrypted packet (len=1448)
  236 1.692227408  10.6.15.156 → 192.168.1.12 SSH 1514 Server: Encrypted packet (len=1448)
  237 1.692232821 192.168.1.12 → 10.6.15.156  TCP 66 54766 → 22 [ACK] Seq=5977 Ack=134981 Win=4866 Len=0 TSval=7575983 TSecr=14507476
  238 1.692242283  10.6.15.156 → 192.168.1.12 SSH 154 Server: Encrypted packet (len=88)
  239 1.733442853 192.168.1.12 → 10.6.15.156  TCP 66 54766 → 22 [ACK] Seq=5977 Ack=135069 Win=4866 Len=0 TSval=7575994 TSecr=14507476
  240 1.778248720  10.6.15.156 → 192.168.1.12 SSH 1514 Server: Encrypted packet (len=1448)
  241 1.778530183  10.6.15.156 → 192.168.1.12 SSH 1514 Server: Encrypted packet (len=1448)
  242 1.778539725 192.168.1.12 → 10.6.15.156  TCP 66 54766 → 22 [ACK] Seq=5977 Ack=137965 Win=4866 Len=0 TSval=7576005 TSecr=14507498
  243 1.778847344  10.6.15.156 → 192.168.1.12 SSH 1514 Server: Encrypted packet (len=1448)
  244 1.779156311  10.6.15.156 → 192.168.1.12 SSH 1514 Server: Encrypted packet (len=1448)
  245 1.779165653 192.168.1.12 → 10.6.15.156  TCP 66 54766 → 22 [ACK] Seq=5977 Ack=140861 Win=4866 Len=0 TSval=7576005 TSecr=14507498
  246 1.779267241  10.6.15.156 → 192.168.1.12 SSH 110 Server: Encrypted packet (len=44)
  247 1.779297150 192.168.1.12 → 10.6.15.156  TCP 66 54766 → 22 [ACK] Seq=5977 Ack=140905 Win=4866 Len=0 TSval=7576005 TSecr=14507498
  248 1.779609222  10.6.15.156 → 192.168.1.12 SSH 1514 Server: Encrypted packet (len=1448)
  249 1.779958843  10.6.15.156 → 192.168.1.12 SSH 1514 Server: Encrypted packet (len=1448)
  250 1.779967932 192.168.1.12 → 10.6.15.156  TCP 66 54766 → 22 [ACK] Seq=5977 Ack=143801 Win=4866 Len=0 TSval=7576005 TSecr=14507498
  251 1.780154386  10.6.15.156 → 192.168.1.12 SSH 902 Server: Encrypted packet (len=836)
  252 1.780171658 192.168.1.12 → 10.6.15.156  TCP 66 54766 → 22 [ACK] Seq=5977 Ack=144637 Win=4866 Len=0 TSval=7576005 TSecr=14507498
  253 1.780489397  10.6.15.156 → 192.168.1.12 SSH 1514 Server: Encrypted packet (len=1448)
  254 1.780780077  10.6.15.156 → 192.168.1.12 SSH 1294 Server: Encrypted packet (len=1228)
  255 1.780790695 192.168.1.12 → 10.6.15.156  TCP 66 54766 → 22 [ACK] Seq=5977 Ack=147313 Win=4866 Len=0 TSval=7576005 TSecr=14507498
  256 1.784685303 192.168.1.12 → 10.6.15.156  SSH 574 Client: Encrypted packet (len=508)
  257 1.787143573  10.6.15.156 → 192.168.1.12 TCP 66 22 → 54766 [ACK] Seq=147313 Ack=6485 Win=1452 Len=0 TSval=14507500 TSecr=7576006
  258 1.811042516 192.168.1.12 → 10.6.15.156  SSH 566 Client: Encrypted packet (len=500)
  259 1.815405060  10.6.15.156 → 192.168.1.12 TCP 66 22 → 54766 [ACK] Seq=147313 Ack=6985 Win=1452 Len=0 TSval=14507507 TSecr=7576013
  260 1.815424965 192.168.1.12 → 10.6.15.156  SSH 762 Client: Encrypted packet (len=696)
  261 1.815984771 192.168.1.12 → 10.6.15.156  SSH 102 Client: Encrypted packet (len=36)
  262 1.819704249  10.6.15.156 → 192.168.1.12 TCP 66 22 → 54766 [ACK] Seq=147313 Ack=7717 Win=1452 Len=0 TSval=14507508 TSecr=7576014
  263 1.851042416 192.168.1.12 → 10.6.15.156  SSH 118 Client: Encrypted packet (len=52)
  264 1.891648018  10.6.15.156 → 192.168.1.12 TCP 66 22 → 54766 [ACK] Seq=147313 Ack=7769 Win=1452 Len=0 TSval=14507527 TSecr=7576023
  265 1.891665159 192.168.1.12 → 10.6.15.156  SSH 138 Client: Encrypted packet (len=72)
  266 1.931744789  10.6.15.156 → 192.168.1.12 TCP 66 22 → 54766 [ACK] Seq=147313 Ack=7841 Win=1452 Len=0 TSval=14507537 TSecr=7576033
  267 1.955278529 192.168.1.12 → 10.6.15.156  SSH 102 Client: Encrypted packet (len=36)
  268 2.001041847  10.6.15.156 → 192.168.1.12 TCP 66 22 → 54766 [ACK] Seq=147313 Ack=7877 Win=1452 Len=0 TSval=14507553 TSecr=7576049
  269 2.001062128 192.168.1.12 → 10.6.15.156  SSH 102 Client: Encrypted packet (len=36)
  270 2.017782019  10.6.15.156 → 192.168.1.12 TCP 66 22 → 54766 [ACK] Seq=147313 Ack=7913 Win=1452 Len=0 TSval=14507556 TSecr=7576060
  271 2.024363013  10.6.15.156 → 192.168.1.12 SSH 1514 Server: Encrypted packet (len=1448)
  272 2.024523322  10.6.15.156 → 192.168.1.12 SSH 1514 Server: Encrypted packet (len=1448)
  273 2.024534117 192.168.1.12 → 10.6.15.156  TCP 66 54766 → 22 [ACK] Seq=7913 Ack=150209 Win=4866 Len=0 TSval=7576066 TSecr=14507557
  274 2.026047929  10.6.15.156 → 192.168.1.12 SSH 1514 Server: Encrypted packet (len=1448)
  275 2.026214499  10.6.15.156 → 192.168.1.12 SSH 1514 Server: Encrypted packet (len=1448)
  276 2.026225199 192.168.1.12 → 10.6.15.156  TCP 66 54766 → 22 [ACK] Seq=7913 Ack=153105 Win=4866 Len=0 TSval=7576067 TSecr=14507557
  277 2.029499109  10.6.15.156 → 192.168.1.12 SSH 1514 Server: Encrypted packet (len=1448)
  278 2.029680578  10.6.15.156 → 192.168.1.12 SSH 1514 Server: Encrypted packet (len=1448)
  279 2.029688596 192.168.1.12 → 10.6.15.156  TCP 66 54766 → 22 [ACK] Seq=7913 Ack=156001 Win=4866 Len=0 TSval=7576068 TSecr=14507557
  280 2.029876768  10.6.15.156 → 192.168.1.12 SSH 1514 Server: Encrypted packet (len=1448)
  281 2.030192885  10.6.15.156 → 192.168.1.12 SSH 1514 Server: Encrypted packet (len=1448)
  282 2.030197927 192.168.1.12 → 10.6.15.156  TCP 66 54766 → 22 [ACK] Seq=7913 Ack=158897 Win=4866 Len=0 TSval=7576068 TSecr=14507557
  283 2.030421791  10.6.15.156 → 192.168.1.12 SSH 1514 Server: Encrypted packet (len=1448)
  284 2.030612017  10.6.15.156 → 192.168.1.12 SSH 1514 Server: Encrypted packet (len=1448)
  285 2.030623782 192.168.1.12 → 10.6.15.156  TCP 66 54766 → 22 [ACK] Seq=7913 Ack=161793 Win=4866 Len=0 TSval=7576068 TSecr=14507557
  286 2.030823529  10.6.15.156 → 192.168.1.12 SSH 1514 Server: Encrypted packet (len=1448)
  287 2.030961734  10.6.15.156 → 192.168.1.12 SSH 1514 Server: Encrypted packet (len=1448)
  288 2.030971660 192.168.1.12 → 10.6.15.156  TCP 66 54766 → 22 [ACK] Seq=7913 Ack=164689 Win=4866 Len=0 TSval=7576068 TSecr=14507557
  289 2.036041414  10.6.15.156 → 192.168.1.12 SSH 1514 Server: Encrypted packet (len=1448)
  290 2.036192970  10.6.15.156 → 192.168.1.12 SSH 1514 Server: Encrypted packet (len=1448)
  291 2.036204571 192.168.1.12 → 10.6.15.156  TCP 66 54766 → 22 [ACK] Seq=7913 Ack=167585 Win=4866 Len=0 TSval=7576069 TSecr=14507560
  292 2.036532110  10.6.15.156 → 192.168.1.12 SSH 1514 Server: Encrypted packet (len=1448)
  293 2.039462482  10.6.15.156 → 192.168.1.12 SSH 1514 Server: [TCP Previous segment not captured] , Encrypted packet (len=1448)
  294 2.039482381 192.168.1.12 → 10.6.15.156  TCP 78 54766 → 22 [ACK] Seq=7913 Ack=169033 Win=4866 Len=0 TSval=7576070 TSecr=14507560 SLE=170481 SRE=171929
  295 2.039651384  10.6.15.156 → 192.168.1.12 SSH 1514 Server: Encrypted packet (len=1448)
  296 2.039672240 192.168.1.12 → 10.6.15.156  TCP 78 [TCP Dup ACK 294#1] 54766 → 22 [ACK] Seq=7913 Ack=169033 Win=4866 Len=0 TSval=7576070 TSecr=14507560 SLE=170481 SRE=173377
  297 2.039813587  10.6.15.156 → 192.168.1.12 SSH 1514 Server: Encrypted packet (len=1448)
  298 2.039825828 192.168.1.12 → 10.6.15.156  TCP 78 [TCP Dup ACK 294#2] 54766 → 22 [ACK] Seq=7913 Ack=169033 Win=4866 Len=0 TSval=7576070 TSecr=14507560 SLE=170481 SRE=174825
  299 2.039997830  10.6.15.156 → 192.168.1.12 SSH 1514 Server: Encrypted packet (len=1448)
  300 2.040004116 192.168.1.12 → 10.6.15.156  TCP 78 [TCP Dup ACK 294#3] 54766 → 22 [ACK] Seq=7913 Ack=169033 Win=4866 Len=0 TSval=7576070 TSecr=14507560 SLE=170481 SRE=176273
  301 2.042795515  10.6.15.156 → 192.168.1.12 SSH 1514 Server: Encrypted packet (len=1448)
  302 2.042816272 192.168.1.12 → 10.6.15.156  TCP 78 [TCP Dup ACK 294#4] 54766 → 22 [ACK] Seq=7913 Ack=169033 Win=4866 Len=0 TSval=7576071 TSecr=14507560 SLE=170481 SRE=177721
  303 2.042984783  10.6.15.156 → 192.168.1.12 SSH 1514 Server: Encrypted packet (len=1448)
  304 2.043005183 192.168.1.12 → 10.6.15.156  TCP 78 [TCP Dup ACK 294#5] 54766 → 22 [ACK] Seq=7913 Ack=169033 Win=4866 Len=0 TSval=7576071 TSecr=14507560 SLE=170481 SRE=179169
  305 2.043146062  10.6.15.156 → 192.168.1.12 SSH 1514 Server: Encrypted packet (len=1448)
  306 2.043158441 192.168.1.12 → 10.6.15.156  TCP 78 [TCP Dup ACK 294#6] 54766 → 22 [ACK] Seq=7913 Ack=169033 Win=4866 Len=0 TSval=7576071 TSecr=14507560 SLE=170481 SRE=180617
  307 2.043336758  10.6.15.156 → 192.168.1.12 SSH 1514 Server: Encrypted packet (len=1448)
  308 2.043349074 192.168.1.12 → 10.6.15.156  TCP 78 [TCP Dup ACK 294#7] 54766 → 22 [ACK] Seq=7913 Ack=169033 Win=4866 Len=0 TSval=7576071 TSecr=14507560 SLE=170481 SRE=182065
  309 2.043523933  10.6.15.156 → 192.168.1.12 SSH 1514 Server: Encrypted packet (len=1448)
  310 2.043531382 192.168.1.12 → 10.6.15.156  TCP 78 [TCP Dup ACK 294#8] 54766 → 22 [ACK] Seq=7913 Ack=169033 Win=4866 Len=0 TSval=7576071 TSecr=14507560 SLE=170481 SRE=183513
  311 2.043712067  10.6.15.156 → 192.168.1.12 SSH 1514 Server: Encrypted packet (len=1448)
  312 2.043716835 192.168.1.12 → 10.6.15.156  TCP 78 [TCP Dup ACK 294#9] 54766 → 22 [ACK] Seq=7913 Ack=169033 Win=4866 Len=0 TSval=7576071 TSecr=14507560 SLE=170481 SRE=184961
  313 2.043903456  10.6.15.156 → 192.168.1.12 SSH 1514 Server: Encrypted packet (len=1448)
  314 2.043907958 192.168.1.12 → 10.6.15.156  TCP 78 [TCP Dup ACK 294#10] 54766 → 22 [ACK] Seq=7913 Ack=169033 Win=4866 Len=0 TSval=7576071 TSecr=14507560 SLE=170481 SRE=186409
  315 2.045297319  10.6.15.156 → 192.168.1.12 SSH 1514 Server: Encrypted packet (len=1448)
  316 2.045317756 192.168.1.12 → 10.6.15.156  TCP 78 [TCP Dup ACK 294#11] 54766 → 22 [ACK] Seq=7913 Ack=169033 Win=4866 Len=0 TSval=7576071 TSecr=14507560 SLE=170481 SRE=187857
  317 2.045426166  10.6.15.156 → 192.168.1.12 SSH 1514 Server: Encrypted packet (len=1448)
  318 2.045431006 192.168.1.12 → 10.6.15.156  TCP 78 [TCP Dup ACK 294#12] 54766 → 22 [ACK] Seq=7913 Ack=169033 Win=4866 Len=0 TSval=7576072 TSecr=14507560 SLE=170481 SRE=189305
  319 2.045681673  10.6.15.156 → 192.168.1.12 SSH 1514 Server: Encrypted packet (len=1448)
  320 2.045702361 192.168.1.12 → 10.6.15.156  TCP 78 [TCP Dup ACK 294#13] 54766 → 22 [ACK] Seq=7913 Ack=169033 Win=4866 Len=0 TSval=7576072 TSecr=14507560 SLE=170481 SRE=190753
  321 2.045842498  10.6.15.156 → 192.168.1.12 SSH 1514 Server: Encrypted packet (len=1448)
  322 2.045854841 192.168.1.12 → 10.6.15.156  TCP 78 [TCP Dup ACK 294#14] 54766 → 22 [ACK] Seq=7913 Ack=169033 Win=4866 Len=0 TSval=7576072 TSecr=14507560 SLE=170481 SRE=192201
  323 2.046026068  10.6.15.156 → 192.168.1.12 SSH 1514 Server: Encrypted packet (len=1448)
  324 2.046032847 192.168.1.12 → 10.6.15.156  TCP 78 [TCP Dup ACK 294#15] 54766 → 22 [ACK] Seq=7913 Ack=169033 Win=4866 Len=0 TSval=7576072 TSecr=14507560 SLE=170481 SRE=193649
  325 2.046217332  10.6.15.156 → 192.168.1.12 SSH 1514 Server: Encrypted packet (len=1448)
  326 2.046223564 192.168.1.12 → 10.6.15.156  TCP 78 [TCP Dup ACK 294#16] 54766 → 22 [ACK] Seq=7913 Ack=169033 Win=4866 Len=0 TSval=7576072 TSecr=14507560 SLE=170481 SRE=195097
  327 2.046409078  10.6.15.156 → 192.168.1.12 SSH 1514 Server: Encrypted packet (len=1448)
  328 2.046414935 192.168.1.12 → 10.6.15.156  TCP 78 [TCP Dup ACK 294#17] 54766 → 22 [ACK] Seq=7913 Ack=169033 Win=4866 Len=0 TSval=7576072 TSecr=14507560 SLE=170481 SRE=196545
  329 2.046600672  10.6.15.156 → 192.168.1.12 SSH 1514 Server: Encrypted packet (len=1448)
  330 2.046605747 192.168.1.12 → 10.6.15.156  TCP 78 [TCP Dup ACK 294#18] 54766 → 22 [ACK] Seq=7913 Ack=169033 Win=4866 Len=0 TSval=7576072 TSecr=14507560 SLE=170481 SRE=197993
  331 2.046792555  10.6.15.156 → 192.168.1.12 SSH 1514 Server: Encrypted packet (len=1448)
  332 2.046797617 192.168.1.12 → 10.6.15.156  TCP 78 [TCP Dup ACK 294#19] 54766 → 22 [ACK] Seq=7913 Ack=169033 Win=4866 Len=0 TSval=7576072 TSecr=14507560 SLE=170481 SRE=199441
  333 2.047136384  10.6.15.156 → 192.168.1.12 SSH 1514 Server: Encrypted packet (len=1448)
  334 2.047140348 192.168.1.12 → 10.6.15.156  TCP 78 [TCP Dup ACK 294#20] 54766 → 22 [ACK] Seq=7913 Ack=169033 Win=4866 Len=0 TSval=7576072 TSecr=14507560 SLE=170481 SRE=200889
  335 2.047329923  10.6.15.156 → 192.168.1.12 SSH 1514 Server: Encrypted packet (len=1448)
  336 2.047334651 192.168.1.12 → 10.6.15.156  TCP 78 [TCP Dup ACK 294#21] 54766 → 22 [ACK] Seq=7913 Ack=169033 Win=4866 Len=0 TSval=7576072 TSecr=14507560 SLE=170481 SRE=202337
  337 2.047522717  10.6.15.156 → 192.168.1.12 SSH 1514 Server: Encrypted packet (len=1448)
  338 2.047527628 192.168.1.12 → 10.6.15.156  TCP 78 [TCP Dup ACK 294#22] 54766 → 22 [ACK] Seq=7913 Ack=169033 Win=4866 Len=0 TSval=7576072 TSecr=14507560 SLE=170481 SRE=203785
  339 2.049589627  10.6.15.156 → 192.168.1.12 SSH 1514 Server: Encrypted packet (len=1448)
  340 2.049597469 192.168.1.12 → 10.6.15.156  TCP 78 [TCP Dup ACK 294#23] 54766 → 22 [ACK] Seq=7913 Ack=169033 Win=4866 Len=0 TSval=7576073 TSecr=14507560 SLE=170481 SRE=205233
  341 2.049778642  10.6.15.156 → 192.168.1.12 SSH 1514 Server: Encrypted packet (len=1448)
  342 2.049783558 192.168.1.12 → 10.6.15.156  TCP 78 [TCP Dup ACK 294#24] 54766 → 22 [ACK] Seq=7913 Ack=169033 Win=4866 Len=0 TSval=7576073 TSecr=14507560 SLE=170481 SRE=206681
  343 2.049970597  10.6.15.156 → 192.168.1.12 SSH 1514 Server: [TCP Fast Retransmission] , Encrypted packet (len=1448)
  344 2.049982977 192.168.1.12 → 10.6.15.156  TCP 66 54766 → 22 [ACK] Seq=7913 Ack=206681 Win=4788 Len=0 TSval=7576073 TSecr=14507564
  345 2.050141323  10.6.15.156 → 192.168.1.12 SSH 1514 Server: Encrypted packet (len=1448)
  346 2.050148499 192.168.1.12 → 10.6.15.156  TCP 66 54766 → 22 [ACK] Seq=7913 Ack=208129 Win=4854 Len=0 TSval=7576073 TSecr=14507564
  347 2.050327998  10.6.15.156 → 192.168.1.12 SSH 1514 Server: Encrypted packet (len=1448)
  348 2.050334256 192.168.1.12 → 10.6.15.156  TCP 66 54766 → 22 [ACK] Seq=7913 Ack=209577 Win=4866 Len=0 TSval=7576073 TSecr=14507565
  349 2.050518928  10.6.15.156 → 192.168.1.12 SSH 1514 Server: Encrypted packet (len=1448)
  350 2.050524100 192.168.1.12 → 10.6.15.156  TCP 66 54766 → 22 [ACK] Seq=7913 Ack=211025 Win=4866 Len=0 TSval=7576073 TSecr=14507565
  351 2.050868173  10.6.15.156 → 192.168.1.12 SSH 1514 Server: Encrypted packet (len=1448)
  352 2.050877449 192.168.1.12 → 10.6.15.156  TCP 66 54766 → 22 [ACK] Seq=7913 Ack=212473 Win=4866 Len=0 TSval=7576073 TSecr=14507565
  353 2.051056999  10.6.15.156 → 192.168.1.12 SSH 1514 Server: Encrypted packet (len=1448)
  354 2.051063635 192.168.1.12 → 10.6.15.156  TCP 66 54766 → 22 [ACK] Seq=7913 Ack=213921 Win=4866 Len=0 TSval=7576073 TSecr=14507565
  355 2.052487114  10.6.15.156 → 192.168.1.12 SSH 1514 Server: Encrypted packet (len=1448)
  356 2.052502055 192.168.1.12 → 10.6.15.156  TCP 66 54766 → 22 [ACK] Seq=7913 Ack=215369 Win=4866 Len=0 TSval=7576073 TSecr=14507566
  357 2.052673754  10.6.15.156 → 192.168.1.12 SSH 1514 Server: Encrypted packet (len=1448)
  358 2.052680333 192.168.1.12 → 10.6.15.156  TCP 66 54766 → 22 [ACK] Seq=7913 Ack=216817 Win=4866 Len=0 TSval=7576073 TSecr=14507566
  359 2.052881168  10.6.15.156 → 192.168.1.12 SSH 1514 Server: Encrypted packet (len=1448)
  360 2.052886252 192.168.1.12 → 10.6.15.156  TCP 66 54766 → 22 [ACK] Seq=7913 Ack=218265 Win=4866 Len=0 TSval=7576073 TSecr=14507566
  361 2.053056923  10.6.15.156 → 192.168.1.12 SSH 1514 Server: Encrypted packet (len=1448)
