    1 0.000000000  10.6.15.144 → 192.168.1.16 SSH 1514 Server: Encrypted packet (len=1448)
    2 0.000017569 192.168.1.16 → 10.6.15.144  TCP 66 59298 → 22 [ACK] Seq=1 Ack=1449 Win=3666 Len=0 TSval=3713695 TSecr=4310021
    3 0.000204573  10.6.15.144 → 192.168.1.16 SSH 1514 Server: Encrypted packet (len=1448)
    4 0.012986284  10.6.15.144 → 192.168.1.16 SSH 1514 Server: Encrypted packet (len=1448)
    5 0.013005292 192.168.1.16 → 10.6.15.144  TCP 66 59298 → 22 [ACK] Seq=1 Ack=4345 Win=3666 Len=0 TSval=3713698 TSecr=4310024
    6 0.013156830 192.168.1.16 → 10.6.15.144  SSH 102 Client: Encrypted packet (len=36)
    7 0.013188749  10.6.15.144 → 192.168.1.16 SSH 1514 Server: Encrypted packet (len=1448)
    8 0.024750713  10.6.15.144 → 192.168.1.16 SSH 1514 Server: Encrypted packet (len=1448)
    9 0.024770019 192.168.1.16 → 10.6.15.144  TCP 66 59298 → 22 [ACK] Seq=37 Ack=7241 Win=3666 Len=0 TSval=3713701 TSecr=4310027
   10 0.024950999  10.6.15.144 → 192.168.1.16 SSH 1514 Server: Encrypted packet (len=1448)
   11 0.035694475  10.6.15.144 → 192.168.1.16 SSH 1514 Server: [TCP Previous segment not captured] , Encrypted packet (len=1448)
   12 0.035719770 192.168.1.16 → 10.6.15.144  TCP 78 59298 → 22 [ACK] Seq=37 Ack=8689 Win=3666 Len=0 TSval=3713704 TSecr=4310030 SLE=10137 SRE=11585
   13 0.047151970  10.6.15.144 → 192.168.1.16 SSH 1514 Server: Encrypted packet (len=1448)
   14 0.047169099 192.168.1.16 → 10.6.15.144  TCP 78 [TCP Dup ACK 12#1] 59298 → 22 [ACK] Seq=37 Ack=8689 Win=3666 Len=0 TSval=3713706 TSecr=4310030 SLE=10137 SRE=13033
   15 0.047353905  10.6.15.144 → 192.168.1.16 SSH 1514 Server: Encrypted packet (len=1448)
   16 0.047357788 192.168.1.16 → 10.6.15.144  TCP 78 [TCP Dup ACK 12#2] 59298 → 22 [ACK] Seq=37 Ack=8689 Win=3666 Len=0 TSval=3713707 TSecr=4310030 SLE=10137 SRE=14481
   17 0.047567771  10.6.15.144 → 192.168.1.16 SSH 1514 Server: Encrypted packet (len=1448)
   18 0.047571779 192.168.1.16 → 10.6.15.144  TCP 78 [TCP Dup ACK 12#3] 59298 → 22 [ACK] Seq=37 Ack=8689 Win=3666 Len=0 TSval=3713707 TSecr=4310030 SLE=10137 SRE=15929
   19 0.058582537  10.6.15.144 → 192.168.1.16 SSH 1514 Server: [TCP Fast Retransmission] , Encrypted packet (len=1448)
   20 0.058612572 192.168.1.16 → 10.6.15.144  TCP 66 59298 → 22 [ACK] Seq=37 Ack=15929 Win=3666 Len=0 TSval=3713709 TSecr=4310039
   21 0.069078394  10.6.15.144 → 192.168.1.16 SSH 1514 Server: [TCP Previous segment not captured] , Encrypted packet (len=1448)
   22 0.069096064 192.168.1.16 → 10.6.15.144  TCP 78 [TCP Dup ACK 20#1] 59298 → 22 [ACK] Seq=37 Ack=15929 Win=3666 Len=0 TSval=3713712 TSecr=4310039 SLE=17377 SRE=18825
   23 0.079618373  10.6.15.144 → 192.168.1.16 TCP 1514 [TCP Retransmission] 22 → 59298 [ACK] Seq=15929 Ack=37 Win=1452 Len=1448 TSval=4310044 TSecr=3713712
   24 0.079648792 192.168.1.16 → 10.6.15.144  TCP 66 59298 → 22 [ACK] Seq=37 Ack=18825 Win=3666 Len=0 TSval=3713715 TSecr=4310044
   25 0.079931792  10.6.15.144 → 192.168.1.16 SSH 1514 Server: Encrypted packet (len=1448)
   26 0.079935721 192.168.1.16 → 10.6.15.144  TCP 66 59298 → 22 [ACK] Seq=37 Ack=20273 Win=3666 Len=0 TSval=3713715 TSecr=4310044
   27 0.090655187  10.6.15.144 → 192.168.1.16 SSH 1514 Server: Encrypted packet (len=1448)
   28 0.090670306 192.168.1.16 → 10.6.15.144  TCP 66 59298 → 22 [ACK] Seq=37 Ack=21721 Win=3666 Len=0 TSval=3713717 TSecr=4310047
   29 0.090956462  10.6.15.144 → 192.168.1.16 SSH 1514 Server: Encrypted packet (len=1448)
   30 0.090959860 192.168.1.16 → 10.6.15.144  TCP 66 59298 → 22 [ACK] Seq=37 Ack=23169 Win=3666 Len=0 TSval=3713717 TSecr=4310047
   31 0.091278840  10.6.15.144 → 192.168.1.16 SSH 1514 Server: Encrypted packet (len=1448)
   32 0.091282298 192.168.1.16 → 10.6.15.144  TCP 66 59298 → 22 [ACK] Seq=37 Ack=24617 Win=3666 Len=0 TSval=3713718 TSecr=4310047
   33 0.103196543  10.6.15.144 → 192.168.1.16 SSH 1514 Server: Encrypted packet (len=1448)
   34 0.103216085 192.168.1.16 → 10.6.15.144  TCP 66 59298 → 22 [ACK] Seq=37 Ack=26065 Win=3666 Len=0 TSval=3713720 TSecr=4310050
   35 0.103528345  10.6.15.144 → 192.168.1.16 SSH 1514 Server: Encrypted packet (len=1448)
   36 0.103535010 192.168.1.16 → 10.6.15.144  TCP 66 59298 → 22 [ACK] Seq=37 Ack=27513 Win=3666 Len=0 TSval=3713721 TSecr=4310050
   37 0.103739240  10.6.15.144 → 192.168.1.16 SSH 1514 Server: Encrypted packet (len=1448)
   38 0.103742912 192.168.1.16 → 10.6.15.144  TCP 66 59298 → 22 [ACK] Seq=37 Ack=28961 Win=3666 Len=0 TSval=3713721 TSecr=4310050
   39 0.115731797  10.6.15.144 → 192.168.1.16 SSH 1514 Server: Encrypted packet (len=1448)
   40 0.115747822 192.168.1.16 → 10.6.15.144  TCP 66 59298 → 22 [ACK] Seq=37 Ack=30409 Win=3666 Len=0 TSval=3713724 TSecr=4310053
   41 0.115937062  10.6.15.144 → 192.168.1.16 SSH 1514 Server: Encrypted packet (len=1448)
   42 0.115951430 192.168.1.16 → 10.6.15.144  TCP 66 59298 → 22 [ACK] Seq=37 Ack=31857 Win=3666 Len=0 TSval=3713724 TSecr=4310053
   43 0.116149306  10.6.15.144 → 192.168.1.16 SSH 1514 Server: Encrypted packet (len=1448)
   44 0.116153779 192.168.1.16 → 10.6.15.144  TCP 66 59298 → 22 [ACK] Seq=37 Ack=33305 Win=3666 Len=0 TSval=3713724 TSecr=4310053
   45 0.116361510  10.6.15.144 → 192.168.1.16 SSH 1514 Server: Encrypted packet (len=1448)
   46 0.116365593 192.168.1.16 → 10.6.15.144  TCP 66 59298 → 22 [ACK] Seq=37 Ack=34753 Win=3666 Len=0 TSval=3713724 TSecr=4310053
   47 0.145194288  10.6.15.144 → 192.168.1.16 SSH 1514 Server: Encrypted packet (len=1448)
   48 0.145209928 192.168.1.16 → 10.6.15.144  TCP 66 59298 → 22 [ACK] Seq=37 Ack=36201 Win=3666 Len=0 TSval=3713731 TSecr=4310061
   49 0.169821771 192.168.1.16 → 10.6.15.144  SSH 102 Client: Encrypted packet (len=36)
   50 0.171037935 192.168.1.16 → 10.6.15.144  SSH 118 Client: Encrypted packet (len=52)
   51 0.176605763 192.168.1.16 → 10.6.15.144  SSH 542 Client: Encrypted packet (len=476)
   52 0.202657511 192.168.1.16 → 10.6.15.144  SSH 102 Client: Encrypted packet (len=36)
   53 0.203730666 192.168.1.16 → 10.6.15.144  SSH 126 Client: Encrypted packet (len=60)
   54 0.247242758 192.168.1.16 → 10.6.15.144  TCP 126 [TCP Retransmission] 59298 → 22 [PSH, ACK] Seq=637 Ack=36201 Win=3666 Len=60 TSval=3713757 TSecr=4310061
   55 0.272673606 192.168.1.16 → 10.6.15.144  SSH 1514 Client: Encrypted packet (len=1448)
   56 0.272694216 192.168.1.16 → 10.6.15.144  SSH 1514 Client: Encrypted packet (len=1448)
   57 0.272843871  10.6.15.144 → 192.168.1.16 SSH 1514 Server: Encrypted packet (len=1448)
   58 0.272986856  10.6.15.144 → 192.168.1.16 SSH 1514 Server: Encrypted packet (len=1448)
   59 0.272992186 192.168.1.16 → 10.6.15.144  TCP 66 59298 → 22 [ACK] Seq=3593 Ack=39097 Win=3666 Len=0 TSval=3713763 TSecr=4310092
   60 0.273345830  10.6.15.144 → 192.168.1.16 SSH 1514 Server: Encrypted packet (len=1448)
   61 0.273350837  10.6.15.144 → 192.168.1.16 TCP 78 22 → 59298 [ACK] Seq=40545 Ack=697 Win=1447 Len=0 TSval=4310092 TSecr=3713737 SLE=637 SRE=697
   62 0.274141725 192.168.1.16 → 10.6.15.144  SSH 1182 Client: Encrypted packet (len=1116)
   63 0.283974773  10.6.15.144 → 192.168.1.16 TCP 66 22 → 59298 [ACK] Seq=40545 Ack=2145 Win=1452 Len=0 TSval=4310095 TSecr=3713763
   64 0.283990779  10.6.15.144 → 192.168.1.16 TCP 66 22 → 59298 [ACK] Seq=40545 Ack=3593 Win=1452 Len=0 TSval=4310095 TSecr=3713763
   65 0.284759451  10.6.15.144 → 192.168.1.16 SSH 1514 Server: Encrypted packet (len=1448)
   66 0.284970291  10.6.15.144 → 192.168.1.16 SSH 1514 Server: Encrypted packet (len=1448)
   67 0.284979814 192.168.1.16 → 10.6.15.144  TCP 66 59298 → 22 [ACK] Seq=4709 Ack=43441 Win=3666 Len=0 TSval=3713766 TSecr=4310095
   68 0.285330982  10.6.15.144 → 192.168.1.16 SSH 1514 Server: Encrypted packet (len=1448)
   69 0.285531397  10.6.15.144 → 192.168.1.16 SSH 1514 Server: Encrypted packet (len=1448)
   70 0.285537717 192.168.1.16 → 10.6.15.144  TCP 66 59298 → 22 [ACK] Seq=4709 Ack=46337 Win=3666 Len=0 TSval=3713766 TSecr=4310096
   71 0.296157648 192.168.1.16 → 10.6.15.144  SSH 678 Client: Encrypted packet (len=612)
   72 0.299269164  10.6.15.144 → 192.168.1.16 SSH 1514 Server: Encrypted packet (len=1448)
   73 0.299486905  10.6.15.144 → 192.168.1.16 SSH 1514 Server: Encrypted packet (len=1448)
   74 0.299493768 192.168.1.16 → 10.6.15.144  TCP 66 59298 → 22 [ACK] Seq=5321 Ack=49233 Win=3666 Len=0 TSval=3713770 TSecr=4310098
   75 0.299701142  10.6.15.144 → 192.168.1.16 SSH 1514 Server: Encrypted packet (len=1448)
   76 0.299913614  10.6.15.144 → 192.168.1.16 SSH 1514 Server: Encrypted packet (len=1448)
   77 0.299920171 192.168.1.16 → 10.6.15.144  TCP 66 59298 → 22 [ACK] Seq=5321 Ack=52129 Win=3666 Len=0 TSval=3713770 TSecr=4310098
   78 0.310346866  10.6.15.144 → 192.168.1.16 SSH 1514 Server: Encrypted packet (len=1448)
   79 0.310554224  10.6.15.144 → 192.168.1.16 SSH 1514 Server: Encrypted packet (len=1448)
   80 0.310560975 192.168.1.16 → 10.6.15.144  TCP 66 59298 → 22 [ACK] Seq=5321 Ack=55025 Win=3666 Len=0 TSval=3713772 TSecr=4310102
   81 0.310764597  10.6.15.144 → 192.168.1.16 SSH 1514 Server: Encrypted packet (len=1448)
   82 0.311129750  10.6.15.144 → 192.168.1.16 SSH 1514 Server: Encrypted packet (len=1448)
   83 0.311133384 192.168.1.16 → 10.6.15.144  TCP 66 59298 → 22 [ACK] Seq=5321 Ack=57921 Win=3666 Len=0 TSval=3713772 TSecr=4310102
   84 0.321743620  10.6.15.144 → 192.168.1.16 SSH 1514 Server: Encrypted packet (len=1448)
   85 0.321946220  10.6.15.144 → 192.168.1.16 SSH 1514 Server: [TCP Previous segment not captured] , Encrypted packet (len=1448)
   86 0.321956188 192.168.1.16 → 10.6.15.144  TCP 78 59298 → 22 [ACK] Seq=5321 Ack=59369 Win=3666 Len=0 TSval=3713775 TSecr=4310105 SLE=60817 SRE=62265
   87 0.322313284  10.6.15.144 → 192.168.1.16 SSH 1514 Server: Encrypted packet (len=1448)
   88 0.322325498 192.168.1.16 → 10.6.15.144  TCP 78 [TCP Dup ACK 86#1] 59298 → 22 [ACK] Seq=5321 Ack=59369 Win=3666 Len=0 TSval=3713775 TSecr=4310105 SLE=60817 SRE=63713
   89 0.329868016 192.168.1.16 → 10.6.15.144  SSH 226 Client: Encrypted packet (len=148)
   90 0.332528277  10.6.15.144 → 192.168.1.16 SSH 1514 Server: Encrypted packet (len=1448)
   91 0.332551613 192.168.1.16 → 10.6.15.144  TCP 78 [TCP Dup ACK 86#2] 59298 → 22 [ACK] Seq=5469 Ack=59369 Win=3666 Len=0 TSval=3713778 TSecr=4310105 SLE=60817 SRE=65161
   92 0.332856856  10.6.15.144 → 192.168.1.16 SSH 1514 Server: Encrypted packet (len=1448)
   93 0.332868816 192.168.1.16 → 10.6.15.144  TCP 78 [TCP Dup ACK 86#3] 59298 → 22 [ACK] Seq=5469 Ack=59369 Win=3666 Len=0 TSval=3713778 TSecr=4310105 SLE=60817 SRE=66609
   94 0.333068990  10.6.15.144 → 192.168.1.16 SSH 1514 Server: Encrypted packet (len=1448)
   95 0.333079365 192.168.1.16 → 10.6.15.144  TCP 78 [TCP Dup ACK 86#4] 59298 → 22 [ACK] Seq=5469 Ack=59369 Win=3666 Len=0 TSval=3713778 TSecr=4310105 SLE=60817 SRE=68057
   96 0.344910310  10.6.15.144 → 192.168.1.16 SSH 1514 Server: [TCP Fast Retransmission] , Encrypted packet (len=1448)
   97 0.344939891 192.168.1.16 → 10.6.15.144  TCP 66 59298 → 22 [ACK] Seq=5469 Ack=68057 Win=3666 Len=0 TSval=3713781 TSecr=4310110
   98 0.345115209  10.6.15.144 → 192.168.1.16 SSH 1514 Server: Encrypted packet (len=1448)
   99 0.345122379 192.168.1.16 → 10.6.15.144  TCP 66 59298 → 22 [ACK] Seq=5469 Ack=69505 Win=3666 Len=0 TSval=3713781 TSecr=4310111
  100 0.355739973  10.6.15.144 → 192.168.1.16 SSH 1514 Server: Encrypted packet (len=1448)
  101 0.355754820 192.168.1.16 → 10.6.15.144  TCP 66 59298 → 22 [ACK] Seq=5469 Ack=70953 Win=3666 Len=0 TSval=3713784 TSecr=4310113
  102 0.356054282  10.6.15.144 → 192.168.1.16 SSH 1514 Server: [TCP Previous segment not captured] , Encrypted packet (len=1448)
  103 0.356064685 192.168.1.16 → 10.6.15.144  TCP 78 [TCP Dup ACK 101#1] 59298 → 22 [ACK] Seq=5469 Ack=70953 Win=3666 Len=0 TSval=3713784 TSecr=4310113 SLE=72401 SRE=73849
  104 0.366562679  10.6.15.144 → 192.168.1.16 SSH 1514 Server: Encrypted packet (len=1448)
  105 0.366580863 192.168.1.16 → 10.6.15.144  TCP 78 [TCP Dup ACK 101#2] 59298 → 22 [ACK] Seq=5469 Ack=70953 Win=3666 Len=0 TSval=3713786 TSecr=4310113 SLE=72401 SRE=75297
  106 0.366877198  10.6.15.144 → 192.168.1.16 SSH 1514 Server: Encrypted packet (len=1448)
  107 0.366884117 192.168.1.16 → 10.6.15.144  TCP 78 [TCP Dup ACK 101#3] 59298 → 22 [ACK] Seq=5469 Ack=70953 Win=3666 Len=0 TSval=3713786 TSecr=4310113 SLE=72401 SRE=76745
  108 0.377308003  10.6.15.144 → 192.168.1.16 SSH 1514 Server: Encrypted packet (len=1448)
  109 0.377328396 192.168.1.16 → 10.6.15.144  TCP 78 [TCP Dup ACK 101#4] 59298 → 22 [ACK] Seq=5469 Ack=70953 Win=3666 Len=0 TSval=3713789 TSecr=4310113 SLE=72401 SRE=78193
  110 0.377621737  10.6.15.144 → 192.168.1.16 SSH 1514 Server: [TCP Fast Retransmission] , Encrypted packet (len=1448)
  111 0.377640327 192.168.1.16 → 10.6.15.144  TCP 66 59298 → 22 [ACK] Seq=5469 Ack=78193 Win=3666 Len=0 TSval=3713789 TSecr=4310119
  112 0.388354493  10.6.15.144 → 192.168.1.16 SSH 1514 Server: [TCP Previous segment not captured] , Encrypted packet (len=1448)
  113 0.388372896 192.168.1.16 → 10.6.15.144  TCP 78 [TCP Dup ACK 111#1] 59298 → 22 [ACK] Seq=5469 Ack=78193 Win=3666 Len=0 TSval=3713792 TSecr=4310119 SLE=79641 SRE=81089
  114 0.398958638  10.6.15.144 → 192.168.1.16 SSH 1514 Server: Encrypted packet (len=1448)
  115 0.398980702 192.168.1.16 → 10.6.15.144  TCP 78 [TCP Dup ACK 111#2] 59298 → 22 [ACK] Seq=5469 Ack=78193 Win=3666 Len=0 TSval=3713794 TSecr=4310119 SLE=79641 SRE=82537
  116 0.409404214  10.6.15.144 → 192.168.1.16 SSH 1514 Server: Encrypted packet (len=1448)
  117 0.409427100 192.168.1.16 → 10.6.15.144  TCP 78 [TCP Dup ACK 111#3] 59298 → 22 [ACK] Seq=5469 Ack=78193 Win=3666 Len=0 TSval=3713797 TSecr=4310119 SLE=79641 SRE=83985
  118 0.420375621  10.6.15.144 → 192.168.1.16 SSH 1514 Server: [TCP Fast Retransmission] , Encrypted packet (len=1448)
  119 0.420408130 192.168.1.16 → 10.6.15.144  TCP 66 59298 → 22 [ACK] Seq=5469 Ack=83985 Win=3666 Len=0 TSval=3713800 TSecr=4310129
  120 0.420670673  10.6.15.144 → 192.168.1.16 SSH 1514 Server: Encrypted packet (len=1448)
  121 0.420678368 192.168.1.16 → 10.6.15.144  TCP 66 59298 → 22 [ACK] Seq=5469 Ack=85433 Win=3666 Len=0 TSval=3713800 TSecr=4310129
  122 0.431254739  10.6.15.144 → 192.168.1.16 SSH 1514 Server: Encrypted packet (len=1448)
  123 0.431271951 192.168.1.16 → 10.6.15.144  TCP 66 59298 → 22 [ACK] Seq=5469 Ack=86881 Win=3666 Len=0 TSval=3713803 TSecr=4310132
  124 0.431545288  10.6.15.144 → 192.168.1.16 SSH 1514 Server: Encrypted packet (len=1448)
  125 0.431551578 192.168.1.16 → 10.6.15.144  TCP 66 59298 → 22 [ACK] Seq=5469 Ack=88329 Win=3666 Len=0 TSval=3713803 TSecr=4310132
  126 0.431887036  10.6.15.144 → 192.168.1.16 SSH 1514 Server: Encrypted packet (len=1448)
  127 0.431890798 192.168.1.16 → 10.6.15.144  TCP 66 59298 → 22 [ACK] Seq=5469 Ack=89777 Win=3666 Len=0 TSval=3713803 TSecr=4310132
  128 0.445976235  10.6.15.144 → 192.168.1.16 SSH 1514 Server: Encrypted packet (len=1448)
  129 0.446014619 192.168.1.16 → 10.6.15.144  TCP 66 59298 → 22 [ACK] Seq=5469 Ack=91225 Win=3666 Len=0 TSval=3713806 TSecr=4310135
  130 0.446287026  10.6.15.144 → 192.168.1.16 SSH 1514 Server: Encrypted packet (len=1448)
  131 0.446310394 192.168.1.16 → 10.6.15.144  TCP 66 59298 → 22 [ACK] Seq=5469 Ack=92673 Win=3666 Len=0 TSval=3713806 TSecr=4310135
  132 0.446316977 192.168.1.16 → 10.6.15.144  SSH 138 Client: Encrypted packet (len=72)
  133 0.446606081  10.6.15.144 → 192.168.1.16 SSH 1514 Server: Encrypted packet (len=1448)
  134 0.447167559 192.168.1.16 → 10.6.15.144  SSH 274 Client: Encrypted packet (len=208)
  135 0.457139479  10.6.15.144 → 192.168.1.16 SSH 1514 Server: Encrypted packet (len=1448)
  136 0.457442858  10.6.15.144 → 192.168.1.16 SSH 1514 Server: Encrypted packet (len=1448)
  137 0.457461379 192.168.1.16 → 10.6.15.144  TCP 66 59298 → 22 [ACK] Seq=5749 Ack=97017 Win=3666 Len=0 TSval=3713809 TSecr=4310139
  138 0.458095380  10.6.15.144 → 192.168.1.16 SSH 1514 Server: Encrypted packet (len=1448)
  139 0.468498706  10.6.15.144 → 192.168.1.16 SSH 1514 Server: Encrypted packet (len=1448)
  140 0.468514924 192.168.1.16 → 10.6.15.144  TCP 66 59298 → 22 [ACK] Seq=5749 Ack=99913 Win=3666 Len=0 TSval=3713812 TSecr=4310139
  141 0.468685258  10.6.15.144 → 192.168.1.16 SSH 1514 Server: Encrypted packet (len=1448)
  142 0.479335105  10.6.15.144 → 192.168.1.16 SSH 1514 Server: Encrypted packet (len=1448)
  143 0.479353325 192.168.1.16 → 10.6.15.144  TCP 66 59298 → 22 [ACK] Seq=5749 Ack=102809 Win=3666 Len=0 TSval=3713815 TSecr=4310141
  144 0.479513574  10.6.15.144 → 192.168.1.16 SSH 1514 Server: Encrypted packet (len=1448)
  145 0.490137750  10.6.15.144 → 192.168.1.16 SSH 1514 Server: Encrypted packet (len=1448)
  146 0.490154235 192.168.1.16 → 10.6.15.144  TCP 66 59298 → 22 [ACK] Seq=5749 Ack=105705 Win=3666 Len=0 TSval=3713817 TSecr=4310144
  147 0.490342197  10.6.15.144 → 192.168.1.16 SSH 1514 Server: Encrypted packet (len=1448)
  148 0.498236586  10.6.15.144 → 192.168.1.16 SSH 1514 Server: Encrypted packet (len=1448)
  149 0.498253274 192.168.1.16 → 10.6.15.144  TCP 66 59298 → 22 [ACK] Seq=5749 Ack=108601 Win=3666 Len=0 TSval=3713819 TSecr=4310147
  150 0.502047517  10.6.15.144 → 192.168.1.16 SSH 1514 Server: Encrypted packet (len=1448)
  151 0.508794230  10.6.15.144 → 192.168.1.16 SSH 1514 Server: Encrypted packet (len=1448)
  152 0.508811491 192.168.1.16 → 10.6.15.144  TCP 66 59298 → 22 [ACK] Seq=5749 Ack=111497 Win=3666 Len=0 TSval=3713822 TSecr=4310149
  153 0.508997776  10.6.15.144 → 192.168.1.16 SSH 1514 Server: Encrypted packet (len=1448)
  154 0.520914761  10.6.15.144 → 192.168.1.16 SSH 1514 Server: [TCP Previous segment not captured] , Encrypted packet (len=1448)
  155 0.520931139 192.168.1.16 → 10.6.15.144  TCP 78 59298 → 22 [ACK] Seq=5749 Ack=112945 Win=3666 Len=0 TSval=3713825 TSecr=4310151 SLE=114393 SRE=115841
  156 0.531871430  10.6.15.144 → 192.168.1.16 SSH 1514 Server: Encrypted packet (len=1448)
  157 0.531896321 192.168.1.16 → 10.6.15.144  TCP 78 [TCP Dup ACK 155#1] 59298 → 22 [ACK] Seq=5749 Ack=112945 Win=3666 Len=0 TSval=3713828 TSecr=4310151 SLE=114393 SRE=117289
  158 0.532059399  10.6.15.144 → 192.168.1.16 SSH 1514 Server: Encrypted packet (len=1448)
  159 0.532068172 192.168.1.16 → 10.6.15.144  TCP 78 [TCP Dup ACK 155#2] 59298 → 22 [ACK] Seq=5749 Ack=112945 Win=3666 Len=0 TSval=3713828 TSecr=4310151 SLE=114393 SRE=118737
  160 0.532274872  10.6.15.144 → 192.168.1.16 SSH 1514 Server: Encrypted packet (len=1448)
  161 0.532282803 192.168.1.16 → 10.6.15.144  TCP 78 [TCP Dup ACK 155#3] 59298 → 22 [ACK] Seq=5749 Ack=112945 Win=3666 Len=0 TSval=3713828 TSecr=4310151 SLE=114393 SRE=120185
  162 0.532638477  10.6.15.144 → 192.168.1.16 SSH 1514 Server: Encrypted packet (len=1448)
  163 0.532648099 192.168.1.16 → 10.6.15.144  TCP 78 [TCP Dup ACK 155#4] 59298 → 22 [ACK] Seq=5749 Ack=112945 Win=3666 Len=0 TSval=3713828 TSecr=4310151 SLE=114393 SRE=121633
  164 0.543192564  10.6.15.144 → 192.168.1.16 SSH 1514 Server: Encrypted packet (len=1448)
  165 0.543217107 192.168.1.16 → 10.6.15.144  TCP 78 [TCP Dup ACK 155#5] 59298 → 22 [ACK] Seq=5749 Ack=112945 Win=3666 Len=0 TSval=3713830 TSecr=4310151 SLE=114393 SRE=123081
  166 0.543385297  10.6.15.144 → 192.168.1.16 SSH 1514 Server: [TCP Fast Retransmission] , Encrypted packet (len=1448)
  167 0.543398208 192.168.1.16 → 10.6.15.144  TCP 66 59298 → 22 [ACK] Seq=5749 Ack=123081 Win=3658 Len=0 TSval=3713831 TSecr=4310160
  168 0.543598267  10.6.15.144 → 192.168.1.16 SSH 1514 Server: Encrypted packet (len=1448)
  169 0.543602647 192.168.1.16 → 10.6.15.144  TCP 66 59298 → 22 [ACK] Seq=5749 Ack=124529 Win=3666 Len=0 TSval=3713831 TSecr=4310160
  170 0.554237602  10.6.15.144 → 192.168.1.16 SSH 1514 Server: Encrypted packet (len=1448)
  171 0.554263199 192.168.1.16 → 10.6.15.144  TCP 66 59298 → 22 [ACK] Seq=5749 Ack=125977 Win=3666 Len=0 TSval=3713833 TSecr=4310163
  172 0.554424626  10.6.15.144 → 192.168.1.16 SSH 1514 Server: Encrypted packet (len=1448)
  173 0.554427689 192.168.1.16 → 10.6.15.144  TCP 66 59298 → 22 [ACK] Seq=5749 Ack=127425 Win=3666 Len=0 TSval=3713833 TSecr=4310163
  174 0.554652021  10.6.15.144 → 192.168.1.16 SSH 1514 Server: Encrypted packet (len=1448)
  175 0.554657373 192.168.1.16 → 10.6.15.144  TCP 66 59298 → 22 [ACK] Seq=5749 Ack=128873 Win=3666 Len=0 TSval=3713833 TSecr=4310163
  176 0.555011922  10.6.15.144 → 192.168.1.16 SSH 1514 Server: Encrypted packet (len=1448)
  177 0.555015390 192.168.1.16 → 10.6.15.144  TCP 66 59298 → 22 [ACK] Seq=5749 Ack=130321 Win=3666 Len=0 TSval=3713833 TSecr=4310163
  178 0.565610150  10.6.15.144 → 192.168.1.16 SSH 1514 Server: Encrypted packet (len=1448)
  179 0.565627829 192.168.1.16 → 10.6.15.144  TCP 66 59298 → 22 [ACK] Seq=5749 Ack=131769 Win=3666 Len=0 TSval=3713836 TSecr=4310166
  180 0.565786052  10.6.15.144 → 192.168.1.16 SSH 1514 Server: Encrypted packet (len=1448)
  181 0.565794597 192.168.1.16 → 10.6.15.144  TCP 66 59298 → 22 [ACK] Seq=5749 Ack=133217 Win=3666 Len=0 TSval=3713836 TSecr=4310166
  182 0.588730099  10.6.15.144 → 192.168.1.16 SSH 1514 Server: [TCP Previous segment not captured] , Encrypted packet (len=1448)
  183 0.588748412 192.168.1.16 → 10.6.15.144  TCP 78 [TCP Dup ACK 181#1] 59298 → 22 [ACK] Seq=5749 Ack=133217 Win=3666 Len=0 TSval=3713842 TSecr=4310166 SLE=139009 SRE=140457
  184 0.600696942  10.6.15.144 → 192.168.1.16 TCP 1514 [TCP Retransmission] 22 → 59298 [ACK] Seq=133217 Ack=5749 Win=1452 Len=1448 TSval=4310174 TSecr=3713842
  185 0.600717448 192.168.1.16 → 10.6.15.144  TCP 78 59298 → 22 [ACK] Seq=5749 Ack=134665 Win=3666 Len=0 TSval=3713845 TSecr=4310174 SLE=139009 SRE=140457
  186 0.600728791 10.22.18.209 → 224.0.0.252  LLMNR 64 Standard query 0xfd20 A wpad
  187 0.611469781  10.6.15.144 → 192.168.1.16 TCP 1514 [TCP Retransmission] 22 → 59298 [ACK] Seq=134665 Ack=5749 Win=1452 Len=1448 TSval=4310177 TSecr=3713845
  188 0.611489674 192.168.1.16 → 10.6.15.144  TCP 78 59298 → 22 [ACK] Seq=5749 Ack=136113 Win=3666 Len=0 TSval=3713848 TSecr=4310177 SLE=139009 SRE=140457
  189 0.626869652  10.6.15.144 → 192.168.1.16 SSH 1514 Server: Encrypted packet (len=1448)
  190 0.626891675 192.168.1.16 → 10.6.15.144  TCP 78 [TCP Dup ACK 188#1] 59298 → 22 [ACK] Seq=5749 Ack=136113 Win=3666 Len=0 TSval=3713851 TSecr=4310177 SLE=139009 SRE=141905
  191 0.700158189 10.22.18.209 → 224.0.0.252  LLMNR 64 Standard query 0xfd20 A wpad
  192 2.055334645  10.6.15.144 → 192.168.1.16 TCP 1514 [TCP Retransmission] 22 → 59298 [ACK] Seq=136113 Ack=5749 Win=1452 Len=1448 TSval=4310342 TSecr=3713848
  193 2.055358691 192.168.1.16 → 10.6.15.144  TCP 78 59298 → 22 [ACK] Seq=5749 Ack=137561 Win=3666 Len=0 TSval=3714209 TSecr=4310342 SLE=139009 SRE=141905
  194 2.094270627  10.6.15.144 → 192.168.1.16 SSH 1514 Server: Encrypted packet (len=1448)
  195 2.094289350 192.168.1.16 → 10.6.15.144  TCP 78 [TCP Dup ACK 193#1] 59298 → 22 [ACK] Seq=5749 Ack=137561 Win=3666 Len=0 TSval=3714218 TSecr=4310342 SLE=139009 SRE=143353
  196 2.094488465  10.6.15.144 → 192.168.1.16 SSH 1514 Server: Encrypted packet (len=1448)
  197 2.094496506 192.168.1.16 → 10.6.15.144  TCP 78 [TCP Dup ACK 193#2] 59298 → 22 [ACK] Seq=5749 Ack=137561 Win=3666 Len=0 TSval=3714218 TSecr=4310342 SLE=139009 SRE=144801
  198 2.094689255  10.6.15.144 → 192.168.1.16 SSH 1514 Server: Encrypted packet (len=1448)
  199 2.094697271 192.168.1.16 → 10.6.15.144  TCP 78 [TCP Dup ACK 193#3] 59298 → 22 [ACK] Seq=5749 Ack=137561 Win=3666 Len=0 TSval=3714218 TSecr=4310342 SLE=139009 SRE=146249
  200 2.106680086  10.6.15.144 → 192.168.1.16 SSH 1514 Server: [TCP Fast Retransmission] , Encrypted packet (len=1448)
  201 2.106706341 192.168.1.16 → 10.6.15.144  TCP 66 59298 → 22 [ACK] Seq=5749 Ack=146249 Win=3666 Len=0 TSval=3714221 TSecr=4310551
  202 2.106839642  10.6.15.144 → 192.168.1.16 SSH 1514 Server: [TCP Previous segment not captured] , Encrypted packet (len=1448)
  203 2.106849364 192.168.1.16 → 10.6.15.144  TCP 78 [TCP Dup ACK 201#1] 59298 → 22 [ACK] Seq=5749 Ack=146249 Win=3666 Len=0 TSval=3714221 TSecr=4310551 SLE=147697 SRE=149145
  204 2.117654660  10.6.15.144 → 192.168.1.16 SSH 1514 Server: Encrypted packet (len=1448)
  205 2.117675757 192.168.1.16 → 10.6.15.144  TCP 78 [TCP Dup ACK 201#2] 59298 → 22 [ACK] Seq=5749 Ack=146249 Win=3666 Len=0 TSval=3714224 TSecr=4310551 SLE=147697 SRE=150593
  206 2.117864002  10.6.15.144 → 192.168.1.16 SSH 1514 Server: [TCP Fast Retransmission] , Encrypted packet (len=1448)
  207 2.117888409 192.168.1.16 → 10.6.15.144  TCP 66 59298 → 22 [ACK] Seq=5749 Ack=150593 Win=3666 Len=0 TSval=3714224 TSecr=4310554
  208 2.118067952  10.6.15.144 → 192.168.1.16 SSH 1514 Server: Encrypted packet (len=1448)
  209 2.118077263 192.168.1.16 → 10.6.15.144  TCP 66 59298 → 22 [ACK] Seq=5749 Ack=152041 Win=3666 Len=0 TSval=3714224 TSecr=4310554
  210 2.128426118  10.6.15.144 → 192.168.1.16 SSH 1514 Server: Encrypted packet (len=1448)
  211 2.128446968 192.168.1.16 → 10.6.15.144  TCP 66 59298 → 22 [ACK] Seq=5749 Ack=153489 Win=3666 Len=0 TSval=3714227 TSecr=4310556
  212 2.128607232  10.6.15.144 → 192.168.1.16 SSH 1514 Server: Encrypted packet (len=1448)
  213 2.128612111 192.168.1.16 → 10.6.15.144  TCP 66 59298 → 22 [ACK] Seq=5749 Ack=154937 Win=3666 Len=0 TSval=3714227 TSecr=4310556
  214 2.128969880  10.6.15.144 → 192.168.1.16 SSH 1514 Server: Encrypted packet (len=1448)
  215 2.128976415 192.168.1.16 → 10.6.15.144  TCP 66 59298 → 22 [ACK] Seq=5749 Ack=156385 Win=3666 Len=0 TSval=3714227 TSecr=4310556
  216 2.139599501  10.6.15.144 → 192.168.1.16 SSH 1514 Server: Encrypted packet (len=1448)
  217 2.139616866 192.168.1.16 → 10.6.15.144  TCP 66 59298 → 22 [ACK] Seq=5749 Ack=157833 Win=3666 Len=0 TSval=3714230 TSecr=4310559
  218 2.139778420  10.6.15.144 → 192.168.1.16 SSH 1514 Server: Encrypted packet (len=1448)
  219 2.139787311 192.168.1.16 → 10.6.15.144  TCP 66 59298 → 22 [ACK] Seq=5749 Ack=159281 Win=3666 Len=0 TSval=3714230 TSecr=4310559
  220 2.140521213  10.6.15.144 → 192.168.1.16 SSH 1514 Server: [TCP Previous segment not captured] , Encrypted packet (len=1448)
  221 2.140528868 192.168.1.16 → 10.6.15.144  TCP 78 [TCP Dup ACK 219#1] 59298 → 22 [ACK] Seq=5749 Ack=159281 Win=3666 Len=0 TSval=3714230 TSecr=4310559 SLE=160729 SRE=162177
  222 2.150574777  10.6.15.144 → 192.168.1.16 SSH 1514 Server: Encrypted packet (len=1448)
  223 2.150595874 192.168.1.16 → 10.6.15.144  TCP 78 [TCP Dup ACK 219#2] 59298 → 22 [ACK] Seq=5749 Ack=159281 Win=3666 Len=0 TSval=3714232 TSecr=4310559 SLE=160729 SRE=163625
  224 2.150746561  10.6.15.144 → 192.168.1.16 SSH 1514 Server: Encrypted packet (len=1448)
  225 2.150752179 192.168.1.16 → 10.6.15.144  TCP 78 [TCP Dup ACK 219#3] 59298 → 22 [ACK] Seq=5749 Ack=159281 Win=3666 Len=0 TSval=3714232 TSecr=4310559 SLE=160729 SRE=165073
  226 2.151108516  10.6.15.144 → 192.168.1.16 SSH 1514 Server: Encrypted packet (len=1448)
  227 2.151113869 192.168.1.16 → 10.6.15.144  TCP 78 [TCP Dup ACK 219#4] 59298 → 22 [ACK] Seq=5749 Ack=159281 Win=3666 Len=0 TSval=3714232 TSecr=4310559 SLE=160729 SRE=166521
  228 2.151329374  10.6.15.144 → 192.168.1.16 SSH 1514 Server: Encrypted packet (len=1448)
  229 2.151340667 192.168.1.16 → 10.6.15.144  TCP 78 [TCP Dup ACK 219#5] 59298 → 22 [ACK] Seq=5749 Ack=159281 Win=3666 Len=0 TSval=3714233 TSecr=4310559 SLE=160729 SRE=167969
  230 2.161981377  10.6.15.144 → 192.168.1.16 SSH 1514 Server: Encrypted packet (len=1448)
  231 2.162000997 192.168.1.16 → 10.6.15.144  TCP 78 [TCP Dup ACK 219#6] 59298 → 22 [ACK] Seq=5749 Ack=159281 Win=3666 Len=0 TSval=3714235 TSecr=4310559 SLE=160729 SRE=169417
  232 2.162204303  10.6.15.144 → 192.168.1.16 SSH 1514 Server: [TCP Fast Retransmission] , Encrypted packet (len=1448)
  233 2.162212999 192.168.1.16 → 10.6.15.144  TCP 66 59298 → 22 [ACK] Seq=5749 Ack=169417 Win=3658 Len=0 TSval=3714235 TSecr=4310565
  234 2.162412464  10.6.15.144 → 192.168.1.16 SSH 1514 Server: Encrypted packet (len=1448)
  235 2.162415726 192.168.1.16 → 10.6.15.144  TCP 66 59298 → 22 [ACK] Seq=5749 Ack=170865 Win=3666 Len=0 TSval=3714235 TSecr=4310565
  236 2.172879914  10.6.15.144 → 192.168.1.16 SSH 1514 Server: Encrypted packet (len=1448)
  237 2.172898816 192.168.1.16 → 10.6.15.144  TCP 66 59298 → 22 [ACK] Seq=5749 Ack=172313 Win=3666 Len=0 TSval=3714238 TSecr=4310567
  238 2.173038306  10.6.15.144 → 192.168.1.16 SSH 1514 Server: Encrypted packet (len=1448)
  239 2.173047495 192.168.1.16 → 10.6.15.144  TCP 66 59298 → 22 [ACK] Seq=5749 Ack=173761 Win=3666 Len=0 TSval=3714238 TSecr=4310567
  240 2.173453823  10.6.15.144 → 192.168.1.16 SSH 1514 Server: Encrypted packet (len=1448)
  241 2.173470968 192.168.1.16 → 10.6.15.144  TCP 66 59298 → 22 [ACK] Seq=5749 Ack=175209 Win=3666 Len=0 TSval=3714238 TSecr=4310567
  242 2.173614626  10.6.15.144 → 192.168.1.16 SSH 1514 Server: Encrypted packet (len=1448)
  243 2.173624674 192.168.1.16 → 10.6.15.144  TCP 66 59298 → 22 [ACK] Seq=5749 Ack=176657 Win=3666 Len=0 TSval=3714238 TSecr=4310567
  244 2.173817571 192.168.1.16 → 10.6.15.144  SSH 102 Client: Encrypted packet (len=36)
  245 2.184312711  10.6.15.144 → 192.168.1.16 SSH 1514 Server: Encrypted packet (len=1448)
  246 2.184514518  10.6.15.144 → 192.168.1.16 SSH 1514 Server: Encrypted packet (len=1448)
  247 2.184524775 192.168.1.16 → 10.6.15.144  TCP 66 59298 → 22 [ACK] Seq=5785 Ack=179553 Win=3666 Len=0 TSval=3714241 TSecr=4310570
  248 2.184727008  10.6.15.144 → 192.168.1.16 SSH 1514 Server: Encrypted packet (len=1448)
  249 2.185093053  10.6.15.144 → 192.168.1.16 SSH 1514 Server: Encrypted packet (len=1448)
  250 2.185100999 192.168.1.16 → 10.6.15.144  TCP 66 59298 → 22 [ACK] Seq=5785 Ack=182449 Win=3666 Len=0 TSval=3714241 TSecr=4310570
  251 2.196761810  10.6.15.144 → 192.168.1.16 SSH 1514 Server: Encrypted packet (len=1448)
  252 2.196966185  10.6.15.144 → 192.168.1.16 SSH 1514 Server: Encrypted packet (len=1448)
  253 2.196978272 192.168.1.16 → 10.6.15.144  TCP 66 59298 → 22 [ACK] Seq=5785 Ack=185345 Win=3666 Len=0 TSval=3714244 TSecr=4310573
  254 2.197178619  10.6.15.144 → 192.168.1.16 SSH 1514 Server: Encrypted packet (len=1448)
  255 2.197391203  10.6.15.144 → 192.168.1.16 SSH 1514 Server: Encrypted packet (len=1448)
  256 2.197399003 192.168.1.16 → 10.6.15.144  TCP 66 59298 → 22 [ACK] Seq=5785 Ack=188241 Win=3666 Len=0 TSval=3714244 TSecr=4310573
  257 2.209014567  10.6.15.144 → 192.168.1.16 SSH 1514 Server: Encrypted packet (len=1448)
  258 2.209226640  10.6.15.144 → 192.168.1.16 SSH 1514 Server: Encrypted packet (len=1448)
  259 2.209238236 192.168.1.16 → 10.6.15.144  TCP 66 59298 → 22 [ACK] Seq=5785 Ack=191137 Win=3666 Len=0 TSval=3714247 TSecr=4310576
  260 2.209440007  10.6.15.144 → 192.168.1.16 SSH 1514 Server: Encrypted packet (len=1448)
  261 2.209654053  10.6.15.144 → 192.168.1.16 SSH 1514 Server: Encrypted packet (len=1448)
  262 2.209662539 192.168.1.16 → 10.6.15.144  TCP 66 59298 → 22 [ACK] Seq=5785 Ack=194033 Win=3666 Len=0 TSval=3714247 TSecr=4310576
  263 2.217845129 192.168.1.16 → 10.6.15.144  SSH 1446 Client: Encrypted packet (len=1380)
  264 2.218307080 192.168.1.16 → 10.6.15.144  SSH 102 Client: Encrypted packet (len=36)
  265 2.219511765 192.168.1.16 → 10.6.15.144  SSH 126 Client: Encrypted packet (len=60)
  266 2.219683242 192.168.1.16 → 10.6.15.144  SSH 1514 Client: Encrypted packet (len=1448)
  267 2.220137790 192.168.1.16 → 10.6.15.144  SSH 558 Client: Encrypted packet (len=492)
  268 2.220475273  10.6.15.144 → 192.168.1.16 SSH 1514 Server: Encrypted packet (len=1448)
  269 2.220691614  10.6.15.144 → 192.168.1.16 SSH 1514 Server: Encrypted packet (len=1448)
  270 2.220697950 192.168.1.16 → 10.6.15.144  TCP 66 59298 → 22 [ACK] Seq=9201 Ack=196929 Win=3666 Len=0 TSval=3714250 TSecr=4310579
  271 2.220898683  10.6.15.144 → 192.168.1.16 SSH 1514 Server: Encrypted packet (len=1448)
  272 2.221108289  10.6.15.144 → 192.168.1.16 SSH 1514 Server: Encrypted packet (len=1448)
  273 2.221111489 192.168.1.16 → 10.6.15.144  TCP 66 59298 → 22 [ACK] Seq=9201 Ack=199825 Win=3666 Len=0 TSval=3714250 TSecr=4310579
  274 2.229133764  10.6.15.144 → 192.168.1.16 SSH 1514 Server: Encrypted packet (len=1448)
  275 2.230187738  10.6.15.144 → 192.168.1.16 TCP 66 22 → 59298 [ACK] Seq=201273 Ack=7261 Win=1452 Len=0 TSval=4310582 TSecr=3714249
  276 2.231976434  10.6.15.144 → 192.168.1.16 SSH 1514 Server: Encrypted packet (len=1448)
  277 2.231993345 192.168.1.16 → 10.6.15.144  TCP 66 59298 → 22 [ACK] Seq=9201 Ack=202721 Win=3666 Len=0 TSval=3714253 TSecr=4310582
  278 2.232159383  10.6.15.144 → 192.168.1.16 SSH 1514 Server: Encrypted packet (len=1448)
  279 2.232374772  10.6.15.144 → 192.168.1.16 SSH 1514 Server: Encrypted packet (len=1448)
  280 2.232383062 192.168.1.16 → 10.6.15.144  TCP 66 59298 → 22 [ACK] Seq=9201 Ack=205617 Win=3666 Len=0 TSval=3714253 TSecr=4310582
  281 2.242993086  10.6.15.144 → 192.168.1.16 SSH 1514 Server: Encrypted packet (len=1448)
  282 2.243133487  10.6.15.144 → 192.168.1.16 SSH 1514 Server: Encrypted packet (len=1448)
  283 2.243142546 192.168.1.16 → 10.6.15.144  TCP 66 59298 → 22 [ACK] Seq=9201 Ack=208513 Win=3666 Len=0 TSval=3714255 TSecr=4310585
  284 2.243500585  10.6.15.144 → 192.168.1.16 SSH 1514 Server: Encrypted packet (len=1448)
  285 2.243710274  10.6.15.144 → 192.168.1.16 SSH 1514 Server: Encrypted packet (len=1448)
  286 2.243715474 192.168.1.16 → 10.6.15.144  TCP 66 59298 → 22 [ACK] Seq=9201 Ack=211409 Win=3666 Len=0 TSval=3714256 TSecr=4310585
  287 2.244252350 192.168.1.16 → 10.6.15.144  SSH 350 Client: Encrypted packet (len=284)
  288 2.246928647 192.168.1.16 → 10.6.15.144  SSH 278 Client: Encrypted packet (len=212)
  289 2.254353262  10.6.15.144 → 192.168.1.16 SSH 1514 Server: Encrypted packet (len=1448)
  290 2.254558892  10.6.15.144 → 192.168.1.16 SSH 1514 Server: Encrypted packet (len=1448)
  291 2.254564737 192.168.1.16 → 10.6.15.144  TCP 66 59298 → 22 [ACK] Seq=9697 Ack=214305 Win=3666 Len=0 TSval=3714258 TSecr=4310588
  292 2.254919835  10.6.15.144 → 192.168.1.16 SSH 1514 Server: Encrypted packet (len=1448)
  293 2.255134236  10.6.15.144 → 192.168.1.16 SSH 1514 Server: Encrypted packet (len=1448)
  294 2.255138018 192.168.1.16 → 10.6.15.144  TCP 66 59298 → 22 [ACK] Seq=9697 Ack=217201 Win=3666 Len=0 TSval=3714258 TSecr=4310588
  295 2.255387364 192.168.1.16 → 10.6.15.144  SSH 174 Client: Encrypted packet (len=108)
  296 2.256872175  10.6.15.144 → 192.168.1.16 TCP 66 22 → 59298 [ACK] Seq=217201 Ack=9697 Win=1452 Len=0 TSval=4310589 TSecr=3714256
  297 2.266034857  10.6.15.144 → 192.168.1.16 SSH 1514 Server: Encrypted packet (len=1448)
  298 2.266239026  10.6.15.144 → 192.168.1.16 SSH 1514 Server: Encrypted packet (len=1448)
  299 2.266249437 192.168.1.16 → 10.6.15.144  TCP 66 59298 → 22 [ACK] Seq=9805 Ack=220097 Win=3666 Len=0 TSval=3714261 TSecr=4310591
  300 2.266451644  10.6.15.144 → 192.168.1.16 SSH 1514 Server: Encrypted packet (len=1448)
  301 2.266663948  10.6.15.144 → 192.168.1.16 SSH 1514 Server: Encrypted packet (len=1448)
  302 2.266672157 192.168.1.16 → 10.6.15.144  TCP 66 59298 → 22 [ACK] Seq=9805 Ack=222993 Win=3666 Len=0 TSval=3714261 TSecr=4310591
  303 2.274016695 192.168.1.16 → 10.6.15.144  SSH 102 Client: Encrypted packet (len=36)
  304 2.274543491 192.168.1.16 → 10.6.15.144  SSH 102 Client: Encrypted packet (len=36)
  305 2.276667093 192.168.1.16 → 10.6.15.144  SSH 1494 Client: Encrypted packet (len=1428)
  306 2.277471994  10.6.15.144 → 192.168.1.16 SSH 1514 Server: Encrypted packet (len=1448)
  307 2.277679693  10.6.15.144 → 192.168.1.16 SSH 1514 Server: Encrypted packet (len=1448)
  308 2.277686061 192.168.1.16 → 10.6.15.144  TCP 66 59298 → 22 [ACK] Seq=11305 Ack=225889 Win=3666 Len=0 TSval=3714264 TSecr=4310594
  309 2.277886173  10.6.15.144 → 192.168.1.16 SSH 1514 Server: Encrypted packet (len=1448)
  310 2.278109396  10.6.15.144 → 192.168.1.16 SSH 1514 Server: Encrypted packet (len=1448)
  311 2.278112594 192.168.1.16 → 10.6.15.144  TCP 66 59298 → 22 [ACK] Seq=11305 Ack=228785 Win=3666 Len=0 TSval=3714264 TSecr=4310594
  312 2.278222486 192.168.1.16 → 10.6.15.144  SSH 102 Client: Encrypted packet (len=36)
  313 2.284712964  10.6.15.144 → 192.168.1.16 TCP 66 22 → 59298 [ACK] Seq=228785 Ack=9877 Win=1452 Len=0 TSval=4310596 TSecr=3714263
  314 2.288443601  10.6.15.144 → 192.168.1.16 SSH 1514 Server: Encrypted packet (len=1448)
  315 2.288647492  10.6.15.144 → 192.168.1.16 SSH 1514 Server: Encrypted packet (len=1448)
  316 2.288656040 192.168.1.16 → 10.6.15.144  TCP 66 59298 → 22 [ACK] Seq=11341 Ack=231681 Win=3666 Len=0 TSval=3714267 TSecr=4310596
  317 2.288860914  10.6.15.144 → 192.168.1.16 SSH 1514 Server: Encrypted packet (len=1448)
  318 2.289116855 192.168.1.16 → 10.6.15.144  SSH 118 Client: Encrypted packet (len=52)
  319 2.289227673  10.6.15.144 → 192.168.1.16 SSH 1514 Server: Encrypted packet (len=1448)
  320 2.289441766  10.6.15.144 → 192.168.1.16 SSH 1514 Server: Encrypted packet (len=1448)
  321 2.289450781 192.168.1.16 → 10.6.15.144  TCP 66 59298 → 22 [ACK] Seq=11393 Ack=236025 Win=3666 Len=0 TSval=3714267 TSecr=4310596
  322 2.289654188  10.6.15.144 → 192.168.1.16 SSH 1514 Server: Encrypted packet (len=1448)
  323 2.290726476 192.168.1.16 → 10.6.15.144  SSH 118 Client: Encrypted packet (len=52)
  324 2.300337989  10.6.15.144 → 192.168.1.16 SSH 1514 Server: Encrypted packet (len=1448)
  325 2.300542223  10.6.15.144 → 192.168.1.16 SSH 1514 Server: Encrypted packet (len=1448)
  326 2.300550205 192.168.1.16 → 10.6.15.144  TCP 66 59298 → 22 [ACK] Seq=11445 Ack=240369 Win=3666 Len=0 TSval=3714270 TSecr=4310599
  327 2.300757209  10.6.15.144 → 192.168.1.16 SSH 1514 Server: Encrypted packet (len=1448)
  328 2.301123061  10.6.15.144 → 192.168.1.16 SSH 1514 Server: Encrypted packet (len=1448)
  329 2.301129728 192.168.1.16 → 10.6.15.144  TCP 66 59298 → 22 [ACK] Seq=11445 Ack=243265 Win=3666 Len=0 TSval=3714270 TSecr=4310599
  330 2.301335003  10.6.15.144 → 192.168.1.16 SSH 1514 Server: Encrypted packet (len=1448)
  331 2.301549405  10.6.15.144 → 192.168.1.16 SSH 1514 Server: Encrypted packet (len=1448)
  332 2.301555717 192.168.1.16 → 10.6.15.144  TCP 66 59298 → 22 [ACK] Seq=11445 Ack=246161 Win=3666 Len=0 TSval=3714270 TSecr=4310600
  333 2.312818643  10.6.15.144 → 192.168.1.16 SSH 1514 Server: Encrypted packet (len=1448)
  334 2.313023798  10.6.15.144 → 192.168.1.16 SSH 1514 Server: Encrypted packet (len=1448)
  335 2.313034569 192.168.1.16 → 10.6.15.144  TCP 66 59298 → 22 [ACK] Seq=11445 Ack=249057 Win=3666 Len=0 TSval=3714273 TSecr=4310602
  336 2.313236993  10.6.15.144 → 192.168.1.16 SSH 1514 Server: Encrypted packet (len=1448)
  337 2.313606593  10.6.15.144 → 192.168.1.16 SSH 1514 Server: Encrypted packet (len=1448)
  338 2.313614859 192.168.1.16 → 10.6.15.144  TCP 66 59298 → 22 [ACK] Seq=11445 Ack=251953 Win=3666 Len=0 TSval=3714273 TSecr=4310602
  339 2.313817120  10.6.15.144 → 192.168.1.16 SSH 1514 Server: Encrypted packet (len=1448)
  340 2.314029687  10.6.15.144 → 192.168.1.16 SSH 1514 Server: Encrypted packet (len=1448)
  341 2.314034033 192.168.1.16 → 10.6.15.144  TCP 66 59298 → 22 [ACK] Seq=11445 Ack=254849 Win=3666 Len=0 TSval=3714273 TSecr=4310602
  342 2.325208790  10.6.15.144 → 192.168.1.16 SSH 1514 Server: Encrypted packet (len=1448)
  343 2.325410708  10.6.15.144 → 192.168.1.16 SSH 1514 Server: Encrypted packet (len=1448)
  344 2.325417763 192.168.1.16 → 10.6.15.144  TCP 66 59298 → 22 [ACK] Seq=11445 Ack=257745 Win=3666 Len=0 TSval=3714276 TSecr=4310605
  345 2.325621691  10.6.15.144 → 192.168.1.16 SSH 1514 Server: Encrypted packet (len=1448)
  346 2.325987418  10.6.15.144 → 192.168.1.16 SSH 1514 Server: Encrypted packet (len=1448)
  347 2.325992529 192.168.1.16 → 10.6.15.144  TCP 66 59298 → 22 [ACK] Seq=11445 Ack=260641 Win=3666 Len=0 TSval=3714276 TSecr=4310605
  348 2.326200029  10.6.15.144 → 192.168.1.16 SSH 1514 Server: Encrypted packet (len=1448)
  349 2.326413244  10.6.15.144 → 192.168.1.16 SSH 1514 Server: Encrypted packet (len=1448)
  350 2.326418123 192.168.1.16 → 10.6.15.144  TCP 66 59298 → 22 [ACK] Seq=11445 Ack=263537 Win=3666 Len=0 TSval=3714276 TSecr=4310605
  351 2.332696576  10.6.15.144 → 192.168.1.16 SSH 1514 Server: Encrypted packet (len=1448)
