    1 0.000000000 192.168.1.16 → 10.6.15.144  SSH 1514 Client: Encrypted packet (len=1448)
    2 0.000016186 192.168.1.16 → 10.6.15.144  SSH 1514 Client: Encrypted packet (len=1448)
    3 0.000018596 192.168.1.16 → 10.6.15.144  TCP 1514 [TCP Out-Of-Order] 59298 → 22 [ACK] Seq=4294964401 Ack=1 Win=3666 Len=1448 TSval=3721528 TSecr=4317710
    4 0.527949573  10.6.15.144 → 192.168.1.16 TCP 66 22 → 59298 [ACK] Seq=4829 Ack=2897 Win=1452 Len=0 TSval=4317966 TSecr=3721507
    5 0.527978100 192.168.1.16 → 10.6.15.144  SSH 1514 Client: Encrypted packet (len=1448)
    6 0.527997824 192.168.1.16 → 10.6.15.144  SSH 1514 Client: Encrypted packet (len=1448)
    7 0.528003382  10.6.15.144 → 192.168.1.16 TCP 78 [TCP Dup ACK 4#1] 22 → 59298 [ACK] Seq=4829 Ack=2897 Win=1452 Len=0 TSval=4317967 TSecr=3721507 SLE=4294964401 SRE=4294965849
    8 1.024065935 192.168.1.16 → 10.6.15.144  SSH 1514 Client: Encrypted packet (len=1448)
    9 1.024082753 192.168.1.16 → 10.6.15.144  SSH 1514 Client: Encrypted packet (len=1448)
   10 1.035951264  10.6.15.144 → 192.168.1.16 TCP 66 22 → 59298 [ACK] Seq=4829 Ack=4345 Win=1452 Len=0 TSval=4318094 TSecr=3721664
   11 1.035966791  10.6.15.144 → 192.168.1.16 TCP 66 22 → 59298 [ACK] Seq=4829 Ack=5793 Win=1452 Len=0 TSval=4318094 TSecr=3721664
   12 1.441577430  10.6.15.144 → 192.168.1.16 TCP 66 22 → 59298 [ACK] Seq=4829 Ack=7241 Win=1452 Len=0 TSval=4318222 TSecr=3721762
   13 1.442189749  10.22.18.77 → 224.0.0.252  LLMNR 67 Standard query 0x151f ANY Gintoki
   14 1.443171646  10.6.15.144 → 192.168.1.16 TCP 66 22 → 59298 [ACK] Seq=4829 Ack=8689 Win=1452 Len=0 TSval=4318222 TSecr=3721762
   15 1.536070266 192.168.1.16 → 192.168.1.1  DNS 81 Standard query 0x9e09 A 0.ubuntu.pool.ntp.org
   16 1.536085614 192.168.1.16 → 10.6.15.144  SSH 1514 Client: Encrypted packet (len=1448)
   17 1.536088880 192.168.1.16 → 10.6.15.144  SSH 1514 Client: Encrypted packet (len=1448)
   18 2.048026054 192.168.1.16 → 10.6.15.144  SSH 1514 Client: Encrypted packet (len=1448)
   19 2.048041667 192.168.1.16 → 10.6.15.144  SSH 1514 Client: Encrypted packet (len=1448)
   20 2.059921108  192.168.1.1 → 192.168.1.16 DNS 145 Standard query response 0x9e09 A 0.ubuntu.pool.ntp.org A 139.59.50.38 A 13.126.37.14 A 123.108.200.124 A 13.126.27.131
   21 2.059936876  10.6.15.144 → 192.168.1.16 TCP 66 22 → 59298 [ACK] Seq=4829 Ack=10137 Win=1452 Len=0 TSval=4318350 TSecr=3721890
   22 2.059948612  10.6.15.144 → 192.168.1.16 TCP 66 22 → 59298 [ACK] Seq=4829 Ack=11585 Win=1452 Len=0 TSval=4318350 TSecr=3721890
   23 2.060526167 192.168.1.16 → 139.59.50.38 NTP 90 NTP Version 4, client
   24 2.668293625  10.6.15.144 → 192.168.1.16 TCP 66 22 → 59298 [ACK] Seq=4829 Ack=13033 Win=1452 Len=0 TSval=4318528 TSecr=3722017
   25 2.668397044  10.6.15.144 → 192.168.1.16 TCP 66 22 → 59298 [ACK] Seq=4829 Ack=14481 Win=1452 Len=0 TSval=4318529 TSecr=3722017
   26 2.760034583 192.168.1.16 → 10.6.15.144  SSH 1514 Client: Encrypted packet (len=1448)
   27 2.760050801 192.168.1.16 → 10.6.15.144  SSH 1286 Client: Encrypted packet (len=1220)
   28 3.283974072 10.22.18.209 → 224.0.0.252  LLMNR 64 Standard query 0x87da A wpad
   29 3.283993715  10.6.15.144 → 192.168.1.16 TCP 66 22 → 59298 [ACK] Seq=4829 Ack=15929 Win=1452 Len=0 TSval=4318657 TSecr=3722196
   30 3.284003403  10.6.15.144 → 192.168.1.16 TCP 66 22 → 59298 [ACK] Seq=4829 Ack=17149 Win=1452 Len=0 TSval=4318657 TSecr=3722196
   31 3.383471751 192.168.1.16 → 192.168.1.1  DNS 81 Standard query 0x459a A 3.ubuntu.pool.ntp.org
   32 3.791954498  192.168.1.1 → 192.168.1.16 DNS 145 Standard query response 0x459a A 3.ubuntu.pool.ntp.org A 139.59.21.22 A 123.108.200.124 A 13.126.27.131 A 139.59.50.38
   33 3.792467757 192.168.1.16 → 139.59.21.22 NTP 90 NTP Version 4, client
   34 3.794277263 192.168.1.16 → 192.168.1.1  DNS 81 Standard query 0x53f6 A 1.ubuntu.pool.ntp.org
   35 4.507949069  192.168.1.1 → 192.168.1.16 DNS 145 Standard query response 0x53f6 A 1.ubuntu.pool.ntp.org A 139.59.21.22 A 123.108.200.124 A 13.126.37.14 A 13.126.27.131
   36 4.508426373 192.168.1.16 → 139.59.21.22 NTP 90 NTP Version 4, client
   37 6.927955952 192.168.1.16 → 54.76.71.168 TCP 66 42414 → 8282 [ACK] Seq=1 Ack=1 Win=296 Len=0 TSval=3723264 TSecr=607823527
   38 8.691515829  10.22.18.77 → 224.0.0.252  LLMNR 64 Standard query 0x2dae A wpad
   39 8.691540379  10.22.18.77 → 224.0.0.252  LLMNR 64 Standard query 0xa4c8 A wpad
   40 8.691544614  10.22.18.77 → 224.0.0.252  LLMNR 64 Standard query 0x2807 A wpad
   41 8.691550255  10.22.18.77 → 224.0.0.252  LLMNR 64 Standard query 0x9aac A wpad
   42 8.691764853  10.22.18.77 → 224.0.0.252  LLMNR 64 Standard query 0xdd36 A wpad
   43 8.691772493  10.22.18.77 → 224.0.0.252  LLMNR 64 Standard query 0xf4d3 A wpad
   44 8.691775968  10.22.18.77 → 224.0.0.252  LLMNR 73 Standard query 0xcef1 A ztapupfyncxfk
   45 8.691788102  10.22.18.77 → 224.0.0.252  LLMNR 71 Standard query 0xaa7d A tpofunfijtc
   46 8.691804228  10.22.18.77 → 224.0.0.252  LLMNR 70 Standard query 0x12e7 A oquzboghrs
   47 8.691822221  10.22.18.77 → 224.0.0.252  LLMNR 64 Standard query 0x2dae A wpad
   48 8.691840191  10.22.18.77 → 224.0.0.252  LLMNR 64 Standard query 0xa4c8 A wpad
   49 8.691858614  10.22.18.77 → 224.0.0.252  LLMNR 64 Standard query 0x2807 A wpad
   50 8.691875038  10.22.18.77 → 224.0.0.252  LLMNR 64 Standard query 0x9aac A wpad
   51 8.693904804  10.22.18.77 → 224.0.0.252  LLMNR 64 Standard query 0xdd36 A wpad
   52 8.693916270  10.22.18.77 → 224.0.0.252  LLMNR 64 Standard query 0xf4d3 A wpad
   53 8.693937430  10.22.18.77 → 224.0.0.252  LLMNR 68 Standard query 0x6dc1 A tbwmtlet
   54 8.693951923  10.22.18.77 → 224.0.0.252  LLMNR 72 Standard query 0x382d A evosoirvqngu
   55 8.693972277  10.22.18.77 → 224.0.0.252  LLMNR 74 Standard query 0x67f2 A cvfjsmtpksjxgh
   56 8.693991419  10.22.18.77 → 224.0.0.252  LLMNR 73 Standard query 0xcef1 A ztapupfyncxfk
   57 8.694008130  10.22.18.77 → 224.0.0.252  LLMNR 71 Standard query 0xaa7d A tpofunfijtc
   58 8.694025419  10.22.18.77 → 224.0.0.252  LLMNR 70 Standard query 0x12e7 A oquzboghrs
   59 8.694055486  10.22.18.77 → 224.0.0.252  LLMNR 74 Standard query 0x67f2 A cvfjsmtpksjxgh
   60 8.694453014  10.22.18.77 → 224.0.0.252  LLMNR 72 Standard query 0x382d A evosoirvqngu
   61 8.694468074  10.22.18.77 → 224.0.0.252  LLMNR 68 Standard query 0x6dc1 A tbwmtlet
   62 8.694557870  10.6.15.144 → 192.168.1.16 TCP 550 [TCP Retransmission] 22 → 59298 [PSH, ACK] Seq=1 Ack=17149 Win=1452 Len=484 TSval=4319884 TSecr=3722196
   63 8.735923473 192.168.1.16 → 10.6.15.144  TCP 66 59298 → 22 [ACK] Seq=17149 Ack=485 Win=3666 Len=0 TSval=3723716 TSecr=4319884
   64 10.705818948 10.22.18.209 → 224.0.0.252  LLMNR 64 Standard query 0x6693 A wpad
   65 10.705840590 10.22.18.209 → 224.0.0.252  LLMNR 64 Standard query 0x6693 A wpad
   66 16.722395486  10.6.15.144 → 192.168.1.16 SSH 550 Server: [TCP Spurious Retransmission] , Encrypted packet (len=484)
   67 16.722414700 192.168.1.16 → 10.6.15.144  TCP 78 [TCP Dup ACK 63#1] 59298 → 22 [ACK] Seq=17149 Ack=485 Win=3666 Len=0 TSval=3725712 TSecr=4321968 SLE=1 SRE=485
   68 16.787991034  10.6.15.144 → 192.168.1.16 SSH 1514 Server: Encrypted packet (len=1448)
   69 16.788011537 192.168.1.16 → 10.6.15.144  TCP 78 [TCP Dup ACK 63#2] 59298 → 22 [ACK] Seq=17149 Ack=485 Win=3666 Len=0 TSval=3725729 TSecr=4321968 SLE=4829 SRE=6277
   70 16.788551835  10.6.15.144 → 192.168.1.16 SSH 1514 Server: Encrypted packet (len=1448)
   71 16.788564189 192.168.1.16 → 10.6.15.144  TCP 78 [TCP Dup ACK 63#3] 59298 → 22 [ACK] Seq=17149 Ack=485 Win=3666 Len=0 TSval=3725729 TSecr=4321968 SLE=4829 SRE=7725
   72 16.798153872  10.6.15.144 → 192.168.1.16 SSH 1514 Server: [TCP Fast Retransmission] , Encrypted packet (len=1448)
   73 16.798182802 192.168.1.16 → 10.6.15.144  TCP 78 59298 → 22 [ACK] Seq=17149 Ack=1933 Win=3666 Len=0 TSval=3725731 TSecr=4322061 SLE=4829 SRE=7725
   74 16.798988172  10.6.15.144 → 192.168.1.16 TCP 1514 [TCP Retransmission] 22 → 59298 [ACK] Seq=1933 Ack=17149 Win=1452 Len=1448 TSval=4322061 TSecr=3725729
   75 16.799013778 192.168.1.16 → 10.6.15.144  TCP 78 59298 → 22 [ACK] Seq=17149 Ack=3381 Win=3666 Len=0 TSval=3725731 TSecr=4322061 SLE=4829 SRE=7725
   76 16.810605455  10.6.15.144 → 192.168.1.16 TCP 1514 [TCP Retransmission] 22 → 59298 [ACK] Seq=3381 Ack=17149 Win=1452 Len=1448 TSval=4322064 TSecr=3725731
   77 16.810634779 192.168.1.16 → 10.6.15.144  TCP 66 59298 → 22 [ACK] Seq=17149 Ack=7725 Win=3666 Len=0 TSval=3725734 TSecr=4322064
   78 16.811565931  10.6.15.144 → 192.168.1.16 SSH 1514 Server: Encrypted packet (len=1448)
   79 16.811583575 192.168.1.16 → 10.6.15.144  TCP 66 59298 → 22 [ACK] Seq=17149 Ack=9173 Win=3666 Len=0 TSval=3725734 TSecr=4322064
   80 16.812386136  10.6.15.144 → 192.168.1.16 SSH 1514 Server: Encrypted packet (len=1448)
   81 16.812403849 192.168.1.16 → 10.6.15.144  TCP 66 59298 → 22 [ACK] Seq=17149 Ack=10621 Win=3666 Len=0 TSval=3725735 TSecr=4322064
   82 16.821925863  10.6.15.144 → 192.168.1.16 SSH 1514 Server: Encrypted packet (len=1448)
   83 16.821942291 192.168.1.16 → 10.6.15.144  TCP 66 59298 → 22 [ACK] Seq=17149 Ack=12069 Win=3666 Len=0 TSval=3725737 TSecr=4322067
   84 16.824415324  10.6.15.144 → 192.168.1.16 SSH 1514 Server: Encrypted packet (len=1448)
   85 16.824432542 192.168.1.16 → 10.6.15.144  TCP 66 59298 → 22 [ACK] Seq=17149 Ack=13517 Win=3666 Len=0 TSval=3725738 TSecr=4322067
   86 16.834144193  10.6.15.144 → 192.168.1.16 SSH 1514 Server: [TCP Previous segment not captured] , Encrypted packet (len=1448)
   87 16.834161035 192.168.1.16 → 10.6.15.144  TCP 78 [TCP Dup ACK 85#1] 59298 → 22 [ACK] Seq=17149 Ack=13517 Win=3666 Len=0 TSval=3725740 TSecr=4322067 SLE=14965 SRE=16413
   88 16.835106814  10.6.15.144 → 192.168.1.16 SSH 1514 Server: Encrypted packet (len=1448)
   89 16.835115258 192.168.1.16 → 10.6.15.144  TCP 78 [TCP Dup ACK 85#2] 59298 → 22 [ACK] Seq=17149 Ack=13517 Win=3666 Len=0 TSval=3725740 TSecr=4322067 SLE=14965 SRE=17861
   90 16.844936174  10.6.15.144 → 192.168.1.16 SSH 1514 Server: Encrypted packet (len=1448)
   91 16.844956956 192.168.1.16 → 10.6.15.144  TCP 78 [TCP Dup ACK 85#3] 59298 → 22 [ACK] Seq=17149 Ack=13517 Win=3666 Len=0 TSval=3725743 TSecr=4322067 SLE=14965 SRE=19309
   92 16.845898397  10.6.15.144 → 192.168.1.16 SSH 1514 Server: Encrypted packet (len=1448)
   93 16.845918458 192.168.1.16 → 10.6.15.144  TCP 78 [TCP Dup ACK 85#4] 59298 → 22 [ACK] Seq=17149 Ack=13517 Win=3666 Len=0 TSval=3725743 TSecr=4322067 SLE=14965 SRE=20757
   94 16.855819632  10.6.15.144 → 192.168.1.16 SSH 1514 Server: [TCP Fast Retransmission] , Encrypted packet (len=1448)
   95 16.855842599 192.168.1.16 → 10.6.15.144  TCP 66 59298 → 22 [ACK] Seq=17149 Ack=20757 Win=3666 Len=0 TSval=3725745 TSecr=4322075
   96 16.857591323  10.6.15.144 → 192.168.1.16 SSH 1514 Server: Encrypted packet (len=1448)
   97 16.857610064 192.168.1.16 → 10.6.15.144  TCP 66 59298 → 22 [ACK] Seq=17149 Ack=22205 Win=3666 Len=0 TSval=3725746 TSecr=4322075
   98 16.868461149  10.6.15.144 → 192.168.1.16 SSH 1514 Server: [TCP Previous segment not captured] , Encrypted packet (len=1448)
   99 16.868478590 192.168.1.16 → 10.6.15.144  TCP 78 [TCP Dup ACK 97#1] 59298 → 22 [ACK] Seq=17149 Ack=22205 Win=3666 Len=0 TSval=3725749 TSecr=4322075 SLE=23653 SRE=25101
  100 16.868641295  10.6.15.144 → 192.168.1.16 SSH 1514 Server: Encrypted packet (len=1448)
  101 16.868645262 192.168.1.16 → 10.6.15.144  TCP 78 [TCP Dup ACK 97#2] 59298 → 22 [ACK] Seq=17149 Ack=22205 Win=3666 Len=0 TSval=3725749 TSecr=4322075 SLE=23653 SRE=26549
  102 16.879816137  10.6.15.144 → 192.168.1.16 SSH 1514 Server: Encrypted packet (len=1448)
  103 16.879834499 192.168.1.16 → 10.6.15.144  TCP 78 [TCP Dup ACK 97#3] 59298 → 22 [ACK] Seq=17149 Ack=22205 Win=3666 Len=0 TSval=3725751 TSecr=4322075 SLE=23653 SRE=27997
  104 16.879995846  10.6.15.144 → 192.168.1.16 SSH 1514 Server: Encrypted packet (len=1448)
  105 16.879999868 192.168.1.16 → 10.6.15.144  TCP 78 [TCP Dup ACK 97#4] 59298 → 22 [ACK] Seq=17149 Ack=22205 Win=3666 Len=0 TSval=3725752 TSecr=4322075 SLE=23653 SRE=29445
  106 16.890691261  10.6.15.144 → 192.168.1.16 SSH 1514 Server: [TCP Fast Retransmission] , Encrypted packet (len=1448)
  107 16.890720782 192.168.1.16 → 10.6.15.144  TCP 66 59298 → 22 [ACK] Seq=17149 Ack=29445 Win=3666 Len=0 TSval=3725754 TSecr=4322084
  108 16.890810048  10.6.15.144 → 192.168.1.16 SSH 1514 Server: Encrypted packet (len=1448)
  109 16.890814716 192.168.1.16 → 10.6.15.144  TCP 66 59298 → 22 [ACK] Seq=17149 Ack=30893 Win=3666 Len=0 TSval=3725754 TSecr=4322084
  110 16.892208331 192.168.1.16 → 10.6.15.144  SSH 498 Client: Encrypted packet (len=432)
  111 16.893932440 192.168.1.16 → 10.6.15.144  SSH 1514 Client: Encrypted packet (len=1448)
  112 16.893992253 192.168.1.16 → 10.6.15.144  SSH 70 Client: Encrypted packet (len=4)
  113 16.894586505 192.168.1.16 → 10.6.15.144  SSH 1514 Client: Encrypted packet (len=1448)
  114 16.894966593 192.168.1.16 → 10.6.15.144  SSH 594 Client: Encrypted packet (len=528)
  115 16.901429303  10.6.15.144 → 192.168.1.16 SSH 1502 Server: Encrypted packet (len=1436)
  116 16.903222619  10.6.15.144 → 192.168.1.16 TCP 66 22 → 59298 [ACK] Seq=32329 Ack=17581 Win=1452 Len=0 TSval=4322087 TSecr=3725755
  117 16.903236418 192.168.1.16 → 10.6.15.144  SSH 686 Client: Encrypted packet (len=620)
  118 16.904531897  10.6.15.144 → 192.168.1.16 TCP 66 22 → 59298 [ACK] Seq=32329 Ack=19033 Win=1452 Len=0 TSval=4322088 TSecr=3725755
  119 16.904550918 192.168.1.16 → 10.6.15.144  SSH 406 Client: Encrypted packet (len=340)
  120 16.905006676  10.6.15.144 → 192.168.1.16 TCP 66 22 → 59298 [ACK] Seq=32329 Ack=21009 Win=1437 Len=0 TSval=4322088 TSecr=3725755
  121 16.913272974  10.6.15.144 → 192.168.1.16 TCP 66 22 → 59298 [ACK] Seq=32329 Ack=21629 Win=1452 Len=0 TSval=4322090 TSecr=3725757
  122 16.914478872  10.6.15.144 → 192.168.1.16 TCP 66 22 → 59298 [ACK] Seq=32329 Ack=21969 Win=1452 Len=0 TSval=4322090 TSecr=3725758
  123 16.934010328  10.6.15.144 → 192.168.1.16 SSH 1514 Server: Encrypted packet (len=1448)
  124 16.934027343  10.6.15.144 → 192.168.1.16 SSH 190 Server: Encrypted packet (len=124)
  125 16.934034634 192.168.1.16 → 10.6.15.144  TCP 66 59298 → 22 [ACK] Seq=21969 Ack=33901 Win=3666 Len=0 TSval=3725765 TSecr=4322095
  126 16.935426889  10.6.15.144 → 192.168.1.16 SSH 1514 Server: Encrypted packet (len=1448)
  127 16.944133371  10.6.15.144 → 192.168.1.16 SSH 1514 Server: Encrypted packet (len=1448)
  128 16.944143179 192.168.1.16 → 10.6.15.144  TCP 66 59298 → 22 [ACK] Seq=21969 Ack=36797 Win=3666 Len=0 TSval=3725768 TSecr=4322095
  129 16.944322584  10.6.15.144 → 192.168.1.16 SSH 1514 Server: Encrypted packet (len=1448)
  130 16.944664511 192.168.1.16 → 10.6.15.144  SSH 150 Client: Encrypted packet (len=84)
  131 16.945529099 192.168.1.16 → 10.6.15.144  SSH 1514 Client: Encrypted packet (len=1448)
  132 16.947831210 192.168.1.16 → 10.6.15.144  SSH 1514 Client: Encrypted packet (len=1448)
  133 16.947845340 192.168.1.16 → 10.6.15.144  SSH 666 Client: Encrypted packet (len=600)
  134 16.956488842  10.6.15.144 → 192.168.1.16 SSH 1514 Server: Encrypted packet (len=1448)
  135 16.956608999  10.6.15.144 → 192.168.1.16 SSH 1514 Server: Encrypted packet (len=1448)
  136 16.956617345 192.168.1.16 → 10.6.15.144  TCP 66 59298 → 22 [ACK] Seq=25549 Ack=41141 Win=3666 Len=0 TSval=3725771 TSecr=4322100
  137 16.956802641  10.6.15.144 → 192.168.1.16 SSH 1514 Server: Encrypted packet (len=1448)
  138 16.956861050 192.168.1.16 → 10.6.15.144  SSH 134 Client: Encrypted packet (len=68)
  139 16.957199394 192.168.1.16 → 10.6.15.144  SSH 134 Client: Encrypted packet (len=68)
  140 16.958506258  10.6.15.144 → 192.168.1.16 TCP 66 22 → 59298 [ACK] Seq=42589 Ack=25549 Win=1452 Len=0 TSval=4322101 TSecr=3725768
  141 16.958524860 192.168.1.16 → 10.6.15.144  SSH 610 Client: Encrypted packet (len=544)
  142 16.967283274  10.6.15.144 → 192.168.1.16 SSH 1514 Server: Encrypted packet (len=1448)
  143 16.967429247  10.6.15.144 → 192.168.1.16 SSH 1514 Server: Encrypted packet (len=1448)
  144 16.967441082 192.168.1.16 → 10.6.15.144  TCP 66 59298 → 22 [ACK] Seq=26229 Ack=45485 Win=3666 Len=0 TSval=3725773 TSecr=4322103
  145 16.968631689  10.6.15.144 → 192.168.1.16 SSH 934 Server: Encrypted packet (len=868)
  146 16.968721059 192.168.1.16 → 10.6.15.144  SSH 182 Client: Encrypted packet (len=116)
  147 16.970067285  10.6.15.144 → 192.168.1.16 TCP 66 22 → 59298 [ACK] Seq=46353 Ack=26229 Win=1452 Len=0 TSval=4322104 TSecr=3725771
  148 16.971818349 192.168.1.16 → 10.6.15.144  SSH 282 Client: Encrypted packet (len=216)
  149 16.972297290 192.168.1.16 → 10.6.15.144  SSH 238 Client: Encrypted packet (len=172)
  150 16.972819102 192.168.1.16 → 10.6.15.144  SSH 1334 Client: Encrypted packet (len=1268)
  151 16.977368964  10.6.15.144 → 192.168.1.16 SSH 514 Server: Encrypted packet (len=448)
  152 16.978490906 192.168.1.16 → 10.6.15.144  SSH 206 Client: Encrypted packet (len=140)
  153 16.982099111  10.6.15.144 → 192.168.1.16 TCP 66 22 → 59298 [ACK] Seq=46801 Ack=26561 Win=1452 Len=0 TSval=4322107 TSecr=3725774
  154 16.985323737  10.6.15.144 → 192.168.1.16 TCP 66 22 → 59298 [ACK] Seq=46801 Ack=28001 Win=1452 Len=0 TSval=4322108 TSecr=3725775
  155 17.009096948  10.6.15.144 → 192.168.1.16 SSH 414 Server: Encrypted packet (len=348)
  156 17.015526408  10.6.15.144 → 192.168.1.16 SSH 206 Server: Encrypted packet (len=140)
  157 17.015604970 192.168.1.16 → 10.6.15.144  TCP 66 59298 → 22 [ACK] Seq=28141 Ack=47289 Win=3666 Len=0 TSval=3725785 TSecr=4322114
  158 17.015871535 192.168.1.16 → 10.6.15.144  SSH 134 Client: Encrypted packet (len=68)
  159 17.017630827  10.6.15.144 → 192.168.1.16 SSH 382 Server: Encrypted packet (len=316)
  160 17.026274109  10.6.15.144 → 192.168.1.16 SSH 134 Server: Encrypted packet (len=68)
  161 17.026351453 192.168.1.16 → 10.6.15.144  TCP 66 59298 → 22 [ACK] Seq=28209 Ack=47673 Win=3666 Len=0 TSval=3725788 TSecr=4322116
  162 17.034015965  10.6.15.144 → 192.168.1.16 SSH 1514 Server: Encrypted packet (len=1448)
  163 17.037098895  10.6.15.144 → 192.168.1.16 SSH 1514 Server: Encrypted packet (len=1448)
  164 17.037117036 192.168.1.16 → 10.6.15.144  TCP 66 59298 → 22 [ACK] Seq=28209 Ack=50569 Win=3666 Len=0 TSval=3725791 TSecr=4322120
  165 17.037247441  10.6.15.144 → 192.168.1.16 SSH 1514 Server: Encrypted packet (len=1448)
  166 17.039886841 192.168.1.16 → 10.6.15.144  SSH 278 Client: Encrypted packet (len=212)
  167 17.048395551  10.6.15.144 → 192.168.1.16 SSH 1514 Server: Encrypted packet (len=1448)
  168 17.048414278  10.6.15.144 → 192.168.1.16 SSH 530 Server: Encrypted packet (len=464)
  169 17.048421432 192.168.1.16 → 10.6.15.144  TCP 66 59298 → 22 [ACK] Seq=28421 Ack=53929 Win=3666 Len=0 TSval=3725794 TSecr=4322123
  170 17.051271346 192.168.1.16 → 10.6.15.144  SSH 270 Client: Encrypted packet (len=204)
  171 17.053012546 192.168.1.16 → 10.6.15.144  SSH 270 Client: Encrypted packet (len=204)
  172 17.054948498 192.168.1.16 → 10.6.15.144  SSH 270 Client: Encrypted packet (len=204)
  173 17.062291306  10.6.15.144 → 192.168.1.16 TCP 66 22 → 59298 [ACK] Seq=53929 Ack=28625 Win=1452 Len=0 TSval=4322127 TSecr=3725791
  174 17.065538947  10.6.15.144 → 192.168.1.16 TCP 66 22 → 59298 [ACK] Seq=53929 Ack=29033 Win=1452 Len=0 TSval=4322128 TSecr=3725795
  175 18.705798300  10.6.15.144 → 192.168.1.16 SSH 174 Server: Encrypted packet (len=108)
  176 18.705816636  10.6.15.144 → 192.168.1.16 SSH 166 Server: Encrypted packet (len=100)
  177 18.705842764  10.6.15.144 → 192.168.1.16 SSH 166 Server: Encrypted packet (len=100)
  178 18.705869581 192.168.1.16 → 10.6.15.144  TCP 66 59298 → 22 [ACK] Seq=29033 Ack=54237 Win=3666 Len=0 TSval=3726208 TSecr=4322154
  179 18.705871201  10.6.15.144 → 192.168.1.16 SSH 166 Server: Encrypted packet (len=100)
  180 18.706050206  10.6.15.144 → 192.168.1.16 TCP 166 [TCP Retransmission] 22 → 59298 [PSH, ACK] Seq=54237 Ack=29033 Win=1452 Len=100 TSval=4322171 TSecr=3725795
  181 18.706057470 192.168.1.16 → 10.6.15.144  TCP 78 59298 → 22 [ACK] Seq=29033 Ack=54337 Win=3666 Len=0 TSval=3726208 TSecr=4322171 SLE=54237 SRE=54337
  182 18.706120879  10.6.15.144 → 192.168.1.16 SSH 474 Server: [TCP Spurious Retransmission] , Encrypted packet (len=408)
  183 18.706126211 192.168.1.16 → 10.6.15.144  TCP 78 [TCP Dup ACK 181#1] 59298 → 22 [ACK] Seq=29033 Ack=54337 Win=3666 Len=0 TSval=3726208 TSecr=4322226 SLE=53929 SRE=54337
  184 18.706184406  10.6.15.144 → 192.168.1.16 SSH 474 Server: [TCP Spurious Retransmission] , Encrypted packet (len=408)
  185 18.706188769 192.168.1.16 → 10.6.15.144  TCP 78 [TCP Dup ACK 181#2] 59298 → 22 [ACK] Seq=29033 Ack=54337 Win=3666 Len=0 TSval=3726208 TSecr=4322336 SLE=53929 SRE=54337
  186 18.710262466  10.22.18.77 → 224.0.0.252  LLMNR 64 Standard query 0xec01 A wpad
  187 18.710548452  10.22.18.77 → 224.0.0.252  LLMNR 64 Standard query 0x8007 A wpad
  188 18.710750535 10.22.18.209 → 224.0.0.252  LLMNR 64 Standard query 0x85fd A wpad
  189 18.720004037  10.6.15.144 → 192.168.1.16 SSH 1514 Server: Encrypted packet (len=1448)
  190 18.720021104 192.168.1.16 → 10.6.15.144  TCP 66 59298 → 22 [ACK] Seq=29033 Ack=55785 Win=3666 Len=0 TSval=3726212 TSecr=4322541
  191 18.720039190  10.6.15.144 → 192.168.1.16 SSH 426 Server: Encrypted packet (len=360)
  192 18.720042095 192.168.1.16 → 10.6.15.144  TCP 66 59298 → 22 [ACK] Seq=29033 Ack=56145 Win=3666 Len=0 TSval=3726212 TSecr=4322541
  193 18.726675961 192.168.1.16 → 10.6.15.144  SSH 110 Client: Encrypted packet (len=44)
  194 18.728666994 192.168.1.16 → 10.6.15.144  SSH 110 Client: Encrypted packet (len=44)
  195 18.730999071 192.168.1.16 → 10.6.15.144  SSH 230 Client: Encrypted packet (len=164)
  196 18.755512387 10.22.18.209 → 224.0.0.252  LLMNR 64 Standard query 0x85fd A wpad
  197 18.763808332  10.6.15.144 → 192.168.1.16 TCP 78 [TCP Dup ACK 174#1] 22 → 59298 [ACK] Seq=56145 Ack=29033 Win=1452 Len=0 TSval=4322553 TSecr=3726212 SLE=29077 SRE=29121
  198 18.763826765  10.6.15.144 → 192.168.1.16 TCP 78 [TCP Dup ACK 174#2] 22 → 59298 [ACK] Seq=56145 Ack=29033 Win=1452 Len=0 TSval=4322553 TSecr=3726212 SLE=29077 SRE=29285
  199 19.663960628 192.168.1.16 → 10.6.15.144  TCP 110 [TCP Retransmission] 59298 → 22 [PSH, ACK] Seq=29033 Ack=56145 Win=3666 Len=44 TSval=3726448 TSecr=4322553
  200 19.665948357  10.22.18.77 → 224.0.0.252  LLMNR 64 Standard query 0xec01 A wpad
  201 19.665967795  10.22.18.77 → 224.0.0.252  LLMNR 64 Standard query 0x8007 A wpad
  202 19.665973261 10.22.17.245 → 224.0.0.252  LLMNR 64 Standard query 0x4355 A wpad
  203 19.674776435  10.6.15.144 → 192.168.1.16 TCP 66 22 → 59298 [ACK] Seq=56145 Ack=29285 Win=1452 Len=0 TSval=4322780 TSecr=3726448
  204 19.706994774  10.6.15.144 → 192.168.1.16 SSH 110 Server: Encrypted packet (len=44)
  205 19.707354179 192.168.1.16 → 10.6.15.144  SSH 166 Client: Encrypted packet (len=100)
  206 19.717553306  10.6.15.144 → 192.168.1.16 SSH 102 Server: Encrypted packet (len=36)
  207 19.717950247 192.168.1.16 → 10.6.15.144  SSH 166 Client: Encrypted packet (len=100)
  208 19.730902205  10.6.15.144 → 192.168.1.16 TCP 66 22 → 59298 [ACK] Seq=56225 Ack=29485 Win=1452 Len=0 TSval=4322794 TSecr=3726458
  209 19.747960176  10.6.15.144 → 192.168.1.16 SSH 246 Server: Encrypted packet (len=180)
  210 19.748246077 192.168.1.16 → 10.6.15.144  SSH 134 Client: Encrypted packet (len=68)
  211 19.758359088  10.6.15.144 → 192.168.1.16 SSH 214 Server: Encrypted packet (len=148)
  212 19.758643266 192.168.1.16 → 10.6.15.144  SSH 134 Client: Encrypted packet (len=68)
  213 19.812218754  10.6.15.144 → 192.168.1.16 TCP 66 22 → 59298 [ACK] Seq=56553 Ack=29621 Win=1452 Len=0 TSval=4322815 TSecr=3726471
  214 19.916786056  10.6.15.144 → 192.168.1.16 SSH 1514 Server: [TCP Previous segment not captured] , Encrypted packet (len=1448)
  215 19.916809456  10.6.15.144 → 192.168.1.16 SSH 574 Server: Encrypted packet (len=508)
  216 19.936024528 192.168.1.16 → 10.6.15.144  TCP 78 [TCP Dup ACK 212#1] 59298 → 22 [ACK] Seq=29621 Ack=56553 Win=3666 Len=0 TSval=3726511 TSecr=4322815 SLE=58001 SRE=59449
  217 19.936805155 192.168.1.16 → 10.6.15.144  TCP 78 [TCP Dup ACK 212#2] 59298 → 22 [ACK] Seq=29621 Ack=56553 Win=3666 Len=0 TSval=3726511 TSecr=4322815 SLE=58001 SRE=59957
  218 19.947284648  10.6.15.144 → 192.168.1.16 SSH 1514 Server: Encrypted packet (len=1448)
  219 19.947304297 192.168.1.16 → 10.6.15.144  TCP 78 [TCP Dup ACK 212#3] 59298 → 22 [ACK] Seq=29621 Ack=56553 Win=3666 Len=0 TSval=3726518 TSecr=4322815 SLE=58001 SRE=61405
  220 19.947473828  10.6.15.144 → 192.168.1.16 SSH 1514 Server: Encrypted packet (len=1448)
  221 19.947494334 192.168.1.16 → 10.6.15.144  TCP 78 [TCP Dup ACK 212#4] 59298 → 22 [ACK] Seq=29621 Ack=56553 Win=3666 Len=0 TSval=3726518 TSecr=4322815 SLE=58001 SRE=62853
  222 19.958973922  10.6.15.144 → 192.168.1.16 SSH 1514 Server: [TCP Fast Retransmission] , Encrypted packet (len=1448)
  223 19.959004197 192.168.1.16 → 10.6.15.144  TCP 66 59298 → 22 [ACK] Seq=29621 Ack=62853 Win=3666 Len=0 TSval=3726521 TSecr=4322851
  224 19.959151039  10.6.15.144 → 192.168.1.16 SSH 1514 Server: Encrypted packet (len=1448)
  225 19.959158648 192.168.1.16 → 10.6.15.144  TCP 66 59298 → 22 [ACK] Seq=29621 Ack=64301 Win=3666 Len=0 TSval=3726521 TSecr=4322851
  226 19.970233675  10.6.15.144 → 192.168.1.16 SSH 1514 Server: Encrypted packet (len=1448)
  227 19.970256893 192.168.1.16 → 10.6.15.144  TCP 66 59298 → 22 [ACK] Seq=29621 Ack=65749 Win=3666 Len=0 TSval=3726524 TSecr=4322854
  228 19.972968000  10.6.15.144 → 192.168.1.16 SSH 1514 Server: Encrypted packet (len=1448)
  229 19.972988493 192.168.1.16 → 10.6.15.144  TCP 66 59298 → 22 [ACK] Seq=29621 Ack=67197 Win=3666 Len=0 TSval=3726525 TSecr=4322855
  230 19.973146809  10.6.15.144 → 192.168.1.16 SSH 1514 Server: Encrypted packet (len=1448)
  231 19.973154055 192.168.1.16 → 10.6.15.144  TCP 66 59298 → 22 [ACK] Seq=29621 Ack=68645 Win=3666 Len=0 TSval=3726525 TSecr=4322855
  232 19.981309774  10.6.15.144 → 192.168.1.16 SSH 1514 Server: Encrypted packet (len=1448)
  233 19.981332555 192.168.1.16 → 10.6.15.144  TCP 66 59298 → 22 [ACK] Seq=29621 Ack=70093 Win=3666 Len=0 TSval=3726527 TSecr=4322857
  234 19.984636326  10.6.15.144 → 192.168.1.16 SSH 1514 Server: Encrypted packet (len=1448)
  235 19.984656648 192.168.1.16 → 10.6.15.144  TCP 66 59298 → 22 [ACK] Seq=29621 Ack=71541 Win=3666 Len=0 TSval=3726528 TSecr=4322857
  236 19.984814891  10.6.15.144 → 192.168.1.16 SSH 1514 Server: Encrypted packet (len=1448)
  237 19.984820680 192.168.1.16 → 10.6.15.144  TCP 66 59298 → 22 [ACK] Seq=29621 Ack=72989 Win=3666 Len=0 TSval=3726528 TSecr=4322857
  238 19.992439548  10.6.15.144 → 192.168.1.16 SSH 1514 Server: Encrypted packet (len=1448)
  239 19.992460210 192.168.1.16 → 10.6.15.144  TCP 66 59298 → 22 [ACK] Seq=29621 Ack=74437 Win=3666 Len=0 TSval=3726530 TSecr=4322859
  240 19.998259147  10.6.15.144 → 192.168.1.16 SSH 1514 Server: Encrypted packet (len=1448)
  241 19.998281143 192.168.1.16 → 10.6.15.144  TCP 66 59298 → 22 [ACK] Seq=29621 Ack=75885 Win=3666 Len=0 TSval=3726531 TSecr=4322861
  242 20.003296604  10.6.15.144 → 192.168.1.16 SSH 1514 Server: [TCP Previous segment not captured] , Encrypted packet (len=1448)
  243 20.003318452 192.168.1.16 → 10.6.15.144  TCP 78 [TCP Dup ACK 241#1] 59298 → 22 [ACK] Seq=29621 Ack=75885 Win=3666 Len=0 TSval=3726532 TSecr=4322861 SLE=77333 SRE=78781
  244 20.008856599  10.6.15.144 → 192.168.1.16 SSH 1514 Server: Encrypted packet (len=1448)
  245 20.008879634 192.168.1.16 → 10.6.15.144  TCP 78 [TCP Dup ACK 241#2] 59298 → 22 [ACK] Seq=29621 Ack=75885 Win=3666 Len=0 TSval=3726534 TSecr=4322861 SLE=77333 SRE=80229
  246 20.013873855  10.6.15.144 → 192.168.1.16 SSH 1514 Server: Encrypted packet (len=1448)
  247 20.013894559 192.168.1.16 → 10.6.15.144  TCP 78 [TCP Dup ACK 241#3] 59298 → 22 [ACK] Seq=29621 Ack=75885 Win=3666 Len=0 TSval=3726535 TSecr=4322861 SLE=77333 SRE=81677
  248 20.019973333  10.6.15.144 → 192.168.1.16 SSH 1514 Server: Encrypted packet (len=1448)
  249 20.019990424 192.168.1.16 → 10.6.15.144  TCP 78 [TCP Dup ACK 241#4] 59298 → 22 [ACK] Seq=29621 Ack=75885 Win=3666 Len=0 TSval=3726537 TSecr=4322861 SLE=77333 SRE=83125
  250 20.024477714  10.6.15.144 → 192.168.1.16 SSH 1514 Server: [TCP Fast Retransmission] , Encrypted packet (len=1448)
  251 20.024520631 192.168.1.16 → 10.6.15.144  TCP 66 59298 → 22 [ACK] Seq=29621 Ack=83125 Win=3666 Len=0 TSval=3726538 TSecr=4322867
  252 20.030458073  10.6.15.144 → 192.168.1.16 SSH 1514 Server: Encrypted packet (len=1448)
  253 20.030476234 192.168.1.16 → 10.6.15.144  TCP 66 59298 → 22 [ACK] Seq=29621 Ack=84573 Win=3666 Len=0 TSval=3726539 TSecr=4322869
  254 20.039774612 10.22.17.245 → 224.0.0.252  LLMNR 64 Standard query 0x4355 A wpad
  255 20.041590315  10.6.15.144 → 192.168.1.16 SSH 1514 Server: [TCP Previous segment not captured] , Encrypted packet (len=1448)
  256 20.041605612 192.168.1.16 → 10.6.15.144  TCP 78 [TCP Dup ACK 253#1] 59298 → 22 [ACK] Seq=29621 Ack=84573 Win=3666 Len=0 TSval=3726542 TSecr=4322869 SLE=86021 SRE=87469
  257 20.041776531  10.6.15.144 → 192.168.1.16 SSH 1514 Server: Encrypted packet (len=1448)
  258 20.041783533 192.168.1.16 → 10.6.15.144  TCP 78 [TCP Dup ACK 253#2] 59298 → 22 [ACK] Seq=29621 Ack=84573 Win=3666 Len=0 TSval=3726542 TSecr=4322869 SLE=86021 SRE=88917
  259 20.053042340  10.6.15.144 → 192.168.1.16 SSH 1514 Server: Encrypted packet (len=1448)
  260 20.053060129 192.168.1.16 → 10.6.15.144  TCP 78 [TCP Dup ACK 253#3] 59298 → 22 [ACK] Seq=29621 Ack=84573 Win=3666 Len=0 TSval=3726545 TSecr=4322869 SLE=86021 SRE=90365
  261 20.053228692  10.6.15.144 → 192.168.1.16 SSH 1514 Server: Encrypted packet (len=1448)
  262 20.053239320 192.168.1.16 → 10.6.15.144  TCP 78 [TCP Dup ACK 253#4] 59298 → 22 [ACK] Seq=29621 Ack=84573 Win=3666 Len=0 TSval=3726545 TSecr=4322869 SLE=86021 SRE=91813
  263 20.065021802  10.6.15.144 → 192.168.1.16 SSH 1514 Server: [TCP Fast Retransmission] , Encrypted packet (len=1448)
  264 20.065043974 192.168.1.16 → 10.6.15.144  TCP 66 59298 → 22 [ACK] Seq=29621 Ack=91813 Win=3666 Len=0 TSval=3726548 TSecr=4322877
  265 20.065190867  10.6.15.144 → 192.168.1.16 SSH 1514 Server: Encrypted packet (len=1448)
  266 20.065194664 192.168.1.16 → 10.6.15.144  TCP 66 59298 → 22 [ACK] Seq=29621 Ack=93261 Win=3666 Len=0 TSval=3726548 TSecr=4322877
  267 20.076731044  10.6.15.144 → 192.168.1.16 SSH 1514 Server: Encrypted packet (len=1448)
  268 20.076752772 192.168.1.16 → 10.6.15.144  TCP 66 59298 → 22 [ACK] Seq=29621 Ack=94709 Win=3666 Len=0 TSval=3726551 TSecr=4322881
  269 20.076917371  10.6.15.144 → 192.168.1.16 SSH 1514 Server: Encrypted packet (len=1448)
  270 20.076927159 192.168.1.16 → 10.6.15.144  TCP 66 59298 → 22 [ACK] Seq=29621 Ack=96157 Win=3666 Len=0 TSval=3726551 TSecr=4322881
  271 20.087526188  10.6.15.144 → 192.168.1.16 SSH 1514 Server: [TCP Previous segment not captured] , Encrypted packet (len=1448)
  272 20.087544052 192.168.1.16 → 10.6.15.144  TCP 78 [TCP Dup ACK 270#1] 59298 → 22 [ACK] Seq=29621 Ack=96157 Win=3666 Len=0 TSval=3726553 TSecr=4322881 SLE=97605 SRE=99053
  273 20.087707562  10.6.15.144 → 192.168.1.16 SSH 1514 Server: Encrypted packet (len=1448)
  274 20.087713557 192.168.1.16 → 10.6.15.144  TCP 78 [TCP Dup ACK 270#2] 59298 → 22 [ACK] Seq=29621 Ack=96157 Win=3666 Len=0 TSval=3726553 TSecr=4322881 SLE=97605 SRE=100501
  275 20.101242339  10.6.15.144 → 192.168.1.16 SSH 1514 Server: Encrypted packet (len=1448)
  276 20.101259522 192.168.1.16 → 10.6.15.144  TCP 78 [TCP Dup ACK 270#3] 59298 → 22 [ACK] Seq=29621 Ack=96157 Win=3666 Len=0 TSval=3726557 TSecr=4322881 SLE=97605 SRE=101949
  277 20.101432144  10.6.15.144 → 192.168.1.16 SSH 1514 Server: Encrypted packet (len=1448)
  278 20.101436578 192.168.1.16 → 10.6.15.144  TCP 78 [TCP Dup ACK 270#4] 59298 → 22 [ACK] Seq=29621 Ack=96157 Win=3666 Len=0 TSval=3726557 TSecr=4322881 SLE=97605 SRE=103397
  279 20.149722471 192.168.1.16 → 10.6.15.144  SSH 130 Client: Encrypted packet (len=52)
  280 20.180604952 192.168.1.16 → 10.6.15.144  SSH 138 Client: Encrypted packet (len=60)
  281 20.198170965 192.168.1.16 → 10.6.15.144  SSH 114 Client: Encrypted packet (len=36)
  282 20.198595208 192.168.1.16 → 10.6.15.144  SSH 162 Client: Encrypted packet (len=84)
  283 20.215952370  10.6.15.144 → 192.168.1.16 SSH 1514 Server: [TCP Fast Retransmission] , Encrypted packet (len=1448)
  284 20.215992888 192.168.1.16 → 10.6.15.144  TCP 66 59298 → 22 [ACK] Seq=29853 Ack=103397 Win=3666 Len=0 TSval=3726586 TSecr=4322915
  285 20.219250655  10.6.15.144 → 192.168.1.16 SSH 1514 Server: Encrypted packet (len=1448)
  286 20.219273911 192.168.1.16 → 10.6.15.144  SSH 254 Client: Encrypted packet (len=188)
  287 20.219295346  10.6.15.144 → 192.168.1.16 TCP 66 22 → 59298 [ACK] Seq=104845 Ack=29853 Win=1452 Len=0 TSval=4322915 TSecr=3726577
  288 20.228409281  10.6.15.144 → 192.168.1.16 SSH 1514 Server: Encrypted packet (len=1448)
  289 20.230801167  10.6.15.144 → 192.168.1.16 SSH 1514 Server: Encrypted packet (len=1448)
  290 20.230827639 192.168.1.16 → 10.6.15.144  TCP 66 59298 → 22 [ACK] Seq=30041 Ack=107741 Win=3666 Len=0 TSval=3726589 TSecr=4322919
  291 20.230986707  10.6.15.144 → 192.168.1.16 SSH 1514 Server: Encrypted packet (len=1448)
  292 20.242355632  10.6.15.144 → 192.168.1.16 SSH 1514 Server: Encrypted packet (len=1448)
  293 20.242367038 192.168.1.16 → 10.6.15.144  TCP 66 59298 → 22 [ACK] Seq=30041 Ack=110637 Win=3666 Len=0 TSval=3726592 TSecr=4322919
  294 20.242521668  10.6.15.144 → 192.168.1.16 SSH 1514 Server: Encrypted packet (len=1448)
  295 20.252978242  10.6.15.144 → 192.168.1.16 SSH 1514 Server: Encrypted packet (len=1448)
  296 20.252996237 192.168.1.16 → 10.6.15.144  TCP 66 59298 → 22 [ACK] Seq=30041 Ack=113533 Win=3666 Len=0 TSval=3726595 TSecr=4322922
  297 20.263001213  10.6.15.144 → 192.168.1.16 SSH 1514 Server: [TCP Previous segment not captured] , Encrypted packet (len=1448)
  298 20.263019446 192.168.1.16 → 10.6.15.144  TCP 78 [TCP Dup ACK 296#1] 59298 → 22 [ACK] Seq=30041 Ack=113533 Win=3666 Len=0 TSval=3726597 TSecr=4322922 SLE=114981 SRE=116429
  299 20.263183189  10.6.15.144 → 192.168.1.16 SSH 1514 Server: Encrypted packet (len=1448)
  300 20.263190320 192.168.1.16 → 10.6.15.144  TCP 78 [TCP Dup ACK 296#2] 59298 → 22 [ACK] Seq=30041 Ack=113533 Win=3666 Len=0 TSval=3726597 TSecr=4322922 SLE=114981 SRE=117877
  301 20.274197662  10.6.15.144 → 192.168.1.16 SSH 1514 Server: Encrypted packet (len=1448)
  302 20.274218789 192.168.1.16 → 10.6.15.144  TCP 78 [TCP Dup ACK 296#3] 59298 → 22 [ACK] Seq=30041 Ack=113533 Win=3666 Len=0 TSval=3726600 TSecr=4322922 SLE=114981 SRE=119325
  303 20.274384732  10.6.15.144 → 192.168.1.16 SSH 1514 Server: Encrypted packet (len=1448)
  304 20.274405811 192.168.1.16 → 10.6.15.144  TCP 78 [TCP Dup ACK 296#4] 59298 → 22 [ACK] Seq=30041 Ack=113533 Win=3666 Len=0 TSval=3726600 TSecr=4322922 SLE=114981 SRE=120773
  305 20.284501311  10.6.15.144 → 192.168.1.16 SSH 1514 Server: [TCP Fast Retransmission] , Encrypted packet (len=1448)
  306 20.284534768 192.168.1.16 → 10.6.15.144  TCP 66 59298 → 22 [ACK] Seq=30041 Ack=120773 Win=3666 Len=0 TSval=3726603 TSecr=4322933
  307 20.284624477  10.6.15.144 → 192.168.1.16 SSH 1514 Server: Encrypted packet (len=1448)
  308 20.284639479 192.168.1.16 → 10.6.15.144  TCP 66 59298 → 22 [ACK] Seq=30041 Ack=122221 Win=3666 Len=0 TSval=3726603 TSecr=4322933
  309 20.294900402  10.6.15.144 → 192.168.1.16 SSH 1514 Server: Encrypted packet (len=1448)
  310 20.294918380 192.168.1.16 → 10.6.15.144  TCP 66 59298 → 22 [ACK] Seq=30041 Ack=123669 Win=3666 Len=0 TSval=3726605 TSecr=4322935
  311 20.295078537  10.6.15.144 → 192.168.1.16 SSH 1514 Server: Encrypted packet (len=1448)
  312 20.295083222 192.168.1.16 → 10.6.15.144  TCP 66 59298 → 22 [ACK] Seq=30041 Ack=125117 Win=3666 Len=0 TSval=3726605 TSecr=4322935
  313 20.295396883  10.6.15.144 → 192.168.1.16 SSH 1514 Server: Encrypted packet (len=1448)
  314 20.295401642 192.168.1.16 → 10.6.15.144  TCP 66 59298 → 22 [ACK] Seq=30041 Ack=126565 Win=3666 Len=0 TSval=3726605 TSecr=4322935
  315 20.306277702  10.6.15.144 → 192.168.1.16 SSH 1514 Server: Encrypted packet (len=1448)
  316 20.306295222 192.168.1.16 → 10.6.15.144  TCP 66 59298 → 22 [ACK] Seq=30041 Ack=128013 Win=3666 Len=0 TSval=3726608 TSecr=4322938
  317 20.306424724  10.6.15.144 → 192.168.1.16 SSH 1514 Server: Encrypted packet (len=1448)
  318 20.306430270 192.168.1.16 → 10.6.15.144  TCP 66 59298 → 22 [ACK] Seq=30041 Ack=129461 Win=3666 Len=0 TSval=3726608 TSecr=4322938
  319 20.317076804  10.6.15.144 → 192.168.1.16 SSH 1514 Server: [TCP Previous segment not captured] , Encrypted packet (len=1448)
  320 20.317094766 192.168.1.16 → 10.6.15.144  TCP 78 [TCP Dup ACK 318#1] 59298 → 22 [ACK] Seq=30041 Ack=129461 Win=3666 Len=0 TSval=3726611 TSecr=4322938 SLE=130909 SRE=132357
  321 20.317266280  10.6.15.144 → 192.168.1.16 SSH 1514 Server: Encrypted packet (len=1448)
  322 20.317287366 192.168.1.16 → 10.6.15.144  TCP 78 [TCP Dup ACK 318#2] 59298 → 22 [ACK] Seq=30041 Ack=129461 Win=3666 Len=0 TSval=3726611 TSecr=4322938 SLE=130909 SRE=133805
  323 20.327650015  10.6.15.144 → 192.168.1.16 SSH 1514 Server: Encrypted packet (len=1448)
  324 20.327668945 192.168.1.16 → 10.6.15.144  TCP 78 [TCP Dup ACK 318#3] 59298 → 22 [ACK] Seq=30041 Ack=129461 Win=3666 Len=0 TSval=3726613 TSecr=4322938 SLE=130909 SRE=135253
  325 20.327820955  10.6.15.144 → 192.168.1.16 SSH 1514 Server: Encrypted packet (len=1448)
  326 20.327825505 192.168.1.16 → 10.6.15.144  TCP 78 [TCP Dup ACK 318#4] 59298 → 22 [ACK] Seq=30041 Ack=129461 Win=3666 Len=0 TSval=3726613 TSecr=4322938 SLE=130909 SRE=136701
  327 20.338423676  10.6.15.144 → 192.168.1.16 SSH 1514 Server: [TCP Fast Retransmission] , Encrypted packet (len=1448)
  328 20.338439325 192.168.1.16 → 10.6.15.144  TCP 66 59298 → 22 [ACK] Seq=30041 Ack=136701 Win=3666 Len=0 TSval=3726616 TSecr=4322946
  329 20.338572971  10.6.15.144 → 192.168.1.16 SSH 1514 Server: Encrypted packet (len=1448)
  330 20.338576329 192.168.1.16 → 10.6.15.144  TCP 66 59298 → 22 [ACK] Seq=30041 Ack=138149 Win=3666 Len=0 TSval=3726616 TSecr=4322946
  331 20.349078572  10.6.15.144 → 192.168.1.16 SSH 1514 Server: Encrypted packet (len=1448)
  332 20.349094877 192.168.1.16 → 10.6.15.144  TCP 66 59298 → 22 [ACK] Seq=30041 Ack=139597 Win=3666 Len=0 TSval=3726619 TSecr=4322949
  333 20.349393724  10.6.15.144 → 192.168.1.16 SSH 1514 Server: Encrypted packet (len=1448)
  334 20.349400668 192.168.1.16 → 10.6.15.144  TCP 66 59298 → 22 [ACK] Seq=30041 Ack=141045 Win=3666 Len=0 TSval=3726619 TSecr=4322949
  335 20.349584104  10.6.15.144 → 192.168.1.16 SSH 1514 Server: Encrypted packet (len=1448)
  336 20.349589756 192.168.1.16 → 10.6.15.144  TCP 66 59298 → 22 [ACK] Seq=30041 Ack=142493 Win=3666 Len=0 TSval=3726619 TSecr=4322949
  337 20.360665460  10.6.15.144 → 192.168.1.16 SSH 1514 Server: Encrypted packet (len=1448)
  338 20.360683683 192.168.1.16 → 10.6.15.144  TCP 66 59298 → 22 [ACK] Seq=30041 Ack=143941 Win=3666 Len=0 TSval=3726622 TSecr=4322951
  339 20.360859505  10.6.15.144 → 192.168.1.16 SSH 1514 Server: Encrypted packet (len=1448)
  340 20.360867702 192.168.1.16 → 10.6.15.144  TCP 66 59298 → 22 [ACK] Seq=30041 Ack=145389 Win=3666 Len=0 TSval=3726622 TSecr=4322951
  341 20.361045173  10.6.15.144 → 192.168.1.16 SSH 1514 Server: Encrypted packet (len=1448)
  342 20.361050698 192.168.1.16 → 10.6.15.144  TCP 66 59298 → 22 [ACK] Seq=30041 Ack=146837 Win=3666 Len=0 TSval=3726622 TSecr=4322951
  343 20.372862248  10.6.15.144 → 192.168.1.16 SSH 1514 Server: Encrypted packet (len=1448)
  344 20.372880857 192.168.1.16 → 10.6.15.144  TCP 66 59298 → 22 [ACK] Seq=30041 Ack=148285 Win=3666 Len=0 TSval=3726625 TSecr=4322954
  345 20.372982568  10.6.15.144 → 192.168.1.16 SSH 1514 Server: Encrypted packet (len=1448)
  346 20.372987184 192.168.1.16 → 10.6.15.144  TCP 66 59298 → 22 [ACK] Seq=30041 Ack=149733 Win=3666 Len=0 TSval=3726625 TSecr=4322954
  347 20.373199340  10.6.15.144 → 192.168.1.16 SSH 1514 Server: Encrypted packet (len=1448)
