    1 0.000000000  10.6.15.144 → 192.168.1.16 SSH 1514 Server: Encrypted packet (len=1448)
    2 0.000097742  10.6.15.144 → 192.168.1.16 SSH 1214 Server: Encrypted packet (len=1148)
    3 0.000109468 192.168.1.16 → 10.6.15.144  TCP 66 59298 → 22 [ACK] Seq=1 Ack=2597 Win=3666 Len=0 TSval=3729188 TSecr=4325517
    4 0.000467388  10.6.15.144 → 192.168.1.16 SSH 1514 Server: Encrypted packet (len=1448)
    5 0.010830182  10.6.15.144 → 192.168.1.16 SSH 1514 Server: Encrypted packet (len=1448)
    6 0.010847443 192.168.1.16 → 10.6.15.144  TCP 66 59298 → 22 [ACK] Seq=1 Ack=5493 Win=3666 Len=0 TSval=3729190 TSecr=4325518
    7 0.011032990  10.6.15.144 → 192.168.1.16 SSH 1514 Server: Encrypted packet (len=1448)
    8 0.023467844  10.6.15.144 → 192.168.1.16 SSH 1514 Server: Encrypted packet (len=1448)
    9 0.023491080 192.168.1.16 → 10.6.15.144  TCP 66 59298 → 22 [ACK] Seq=1 Ack=8389 Win=3666 Len=0 TSval=3729194 TSecr=4325520
   10 0.023669555  10.6.15.144 → 192.168.1.16 SSH 1514 Server: Encrypted packet (len=1448)
   11 0.033513460  10.6.15.144 → 192.168.1.16 SSH 1514 Server: Encrypted packet (len=1448)
   12 0.033531304 192.168.1.16 → 10.6.15.144  TCP 66 59298 → 22 [ACK] Seq=1 Ack=11285 Win=3666 Len=0 TSval=3729196 TSecr=4325523
   13 0.033715131  10.6.15.144 → 192.168.1.16 SSH 1514 Server: Encrypted packet (len=1448)
   14 0.044003063  10.6.15.144 → 192.168.1.16 SSH 1514 Server: Encrypted packet (len=1448)
   15 0.044019865 192.168.1.16 → 10.6.15.144  TCP 66 59298 → 22 [ACK] Seq=1 Ack=14181 Win=3666 Len=0 TSval=3729199 TSecr=4325526
   16 0.044207280  10.6.15.144 → 192.168.1.16 SSH 1514 Server: Encrypted packet (len=1448)
   17 0.054085459  10.6.15.144 → 192.168.1.16 SSH 1514 Server: Encrypted packet (len=1448)
   18 0.054102764 192.168.1.16 → 10.6.15.144  TCP 66 59298 → 22 [ACK] Seq=1 Ack=17077 Win=3666 Len=0 TSval=3729201 TSecr=4325529
   19 0.054416160  10.6.15.144 → 192.168.1.16 SSH 1514 Server: Encrypted packet (len=1448)
   20 0.054598219 192.168.1.16 → 10.6.15.144  SSH 102 Client: Encrypted packet (len=36)
   21 0.066569381  10.6.15.144 → 192.168.1.16 SSH 1514 Server: Encrypted packet (len=1448)
   22 0.066769356  10.6.15.144 → 192.168.1.16 SSH 1514 Server: Encrypted packet (len=1448)
   23 0.066784353 192.168.1.16 → 10.6.15.144  TCP 66 59298 → 22 [ACK] Seq=37 Ack=21421 Win=3666 Len=0 TSval=3729204 TSecr=4325534
   24 0.066998510  10.6.15.144 → 192.168.1.16 SSH 1514 Server: Encrypted packet (len=1448)
   25 0.077780876  10.6.15.144 → 192.168.1.16 SSH 1514 Server: Encrypted packet (len=1448)
   26 0.077797324 192.168.1.16 → 10.6.15.144  TCP 66 59298 → 22 [ACK] Seq=37 Ack=24317 Win=3666 Len=0 TSval=3729207 TSecr=4325534
   27 0.077969297  10.6.15.144 → 192.168.1.16 SSH 1514 Server: Encrypted packet (len=1448)
   28 0.089840827  10.6.15.144 → 192.168.1.16 SSH 1514 Server: Encrypted packet (len=1448)
   29 0.089856240 192.168.1.16 → 10.6.15.144  TCP 66 59298 → 22 [ACK] Seq=37 Ack=27213 Win=3666 Len=0 TSval=3729210 TSecr=4325537
   30 0.090052652  10.6.15.144 → 192.168.1.16 SSH 1514 Server: Encrypted packet (len=1448)
   31 0.100971179  10.6.15.144 → 192.168.1.16 SSH 1514 Server: Encrypted packet (len=1448)
   32 0.100986555 192.168.1.16 → 10.6.15.144  TCP 66 59298 → 22 [ACK] Seq=37 Ack=30109 Win=3666 Len=0 TSval=3729213 TSecr=4325540
   33 0.101174425  10.6.15.144 → 192.168.1.16 SSH 1514 Server: Encrypted packet (len=1448)
   34 0.112054530  10.6.15.144 → 192.168.1.16 SSH 1514 Server: [TCP Previous segment not captured] , Encrypted packet (len=1448)
   35 0.112074886 192.168.1.16 → 10.6.15.144  TCP 78 59298 → 22 [ACK] Seq=37 Ack=31557 Win=3666 Len=0 TSval=3729216 TSecr=4325543 SLE=33005 SRE=34453
   36 0.112263191  10.6.15.144 → 192.168.1.16 SSH 1514 Server: Encrypted packet (len=1448)
   37 0.112275645 192.168.1.16 → 10.6.15.144  TCP 78 [TCP Dup ACK 35#1] 59298 → 22 [ACK] Seq=37 Ack=31557 Win=3666 Len=0 TSval=3729216 TSecr=4325543 SLE=33005 SRE=35901
   38 0.122709705  10.6.15.144 → 192.168.1.16 SSH 1514 Server: Encrypted packet (len=1448)
   39 0.122729124 192.168.1.16 → 10.6.15.144  TCP 78 [TCP Dup ACK 35#2] 59298 → 22 [ACK] Seq=37 Ack=31557 Win=3666 Len=0 TSval=3729218 TSecr=4325543 SLE=33005 SRE=37349
   40 0.122911000  10.6.15.144 → 192.168.1.16 SSH 1514 Server: Encrypted packet (len=1448)
   41 0.122917380 192.168.1.16 → 10.6.15.144  TCP 78 [TCP Dup ACK 35#3] 59298 → 22 [ACK] Seq=37 Ack=31557 Win=3666 Len=0 TSval=3729218 TSecr=4325543 SLE=33005 SRE=38797
   42 0.123272226  10.6.15.144 → 192.168.1.16 SSH 1514 Server: Encrypted packet (len=1448)
   43 0.123278497 192.168.1.16 → 10.6.15.144  TCP 78 [TCP Dup ACK 35#4] 59298 → 22 [ACK] Seq=37 Ack=31557 Win=3666 Len=0 TSval=3729218 TSecr=4325543 SLE=33005 SRE=40245
   44 0.134777212  10.6.15.144 → 192.168.1.16 SSH 1514 Server: [TCP Fast Retransmission] , Encrypted packet (len=1448)
   45 0.134802340 192.168.1.16 → 10.6.15.144  TCP 66 59298 → 22 [ACK] Seq=37 Ack=40245 Win=3666 Len=0 TSval=3729221 TSecr=4325551
   46 0.134960418  10.6.15.144 → 192.168.1.16 SSH 1514 Server: Encrypted packet (len=1448)
   47 0.134965291 192.168.1.16 → 10.6.15.144  TCP 66 59298 → 22 [ACK] Seq=37 Ack=41693 Win=3666 Len=0 TSval=3729221 TSecr=4325551
   48 0.146033312  10.6.15.144 → 192.168.1.16 SSH 1514 Server: Encrypted packet (len=1448)
   49 0.146058403 192.168.1.16 → 10.6.15.144  TCP 66 59298 → 22 [ACK] Seq=37 Ack=43141 Win=3666 Len=0 TSval=3729224 TSecr=4325554
   50 0.146222027  10.6.15.144 → 192.168.1.16 SSH 1514 Server: Encrypted packet (len=1448)
   51 0.146226773 192.168.1.16 → 10.6.15.144  TCP 66 59298 → 22 [ACK] Seq=37 Ack=44589 Win=3666 Len=0 TSval=3729224 TSecr=4325554
   52 0.146472146  10.6.15.144 → 192.168.1.16 SSH 1514 Server: Encrypted packet (len=1448)
   53 0.146478572 192.168.1.16 → 10.6.15.144  TCP 66 59298 → 22 [ACK] Seq=37 Ack=46037 Win=3666 Len=0 TSval=3729224 TSecr=4325554
   54 0.157109963  10.6.15.144 → 192.168.1.16 SSH 1514 Server: Encrypted packet (len=1448)
   55 0.157126977 192.168.1.16 → 10.6.15.144  TCP 66 59298 → 22 [ACK] Seq=37 Ack=47485 Win=3666 Len=0 TSval=3729227 TSecr=4325557
   56 0.157316361  10.6.15.144 → 192.168.1.16 SSH 1514 Server: Encrypted packet (len=1448)
   57 0.157325195 192.168.1.16 → 10.6.15.144  TCP 66 59298 → 22 [ACK] Seq=37 Ack=48933 Win=3666 Len=0 TSval=3729227 TSecr=4325557
   58 0.157678241  10.6.15.144 → 192.168.1.16 SSH 1514 Server: Encrypted packet (len=1448)
   59 0.157686894 192.168.1.16 → 10.6.15.144  TCP 66 59298 → 22 [ACK] Seq=37 Ack=50381 Win=3666 Len=0 TSval=3729227 TSecr=4325557
   60 0.168788461  10.6.15.144 → 192.168.1.16 SSH 1514 Server: Encrypted packet (len=1448)
   61 0.168806347 192.168.1.16 → 10.6.15.144  TCP 66 59298 → 22 [ACK] Seq=37 Ack=51829 Win=3666 Len=0 TSval=3729230 TSecr=4325560
   62 0.168974712  10.6.15.144 → 192.168.1.16 SSH 1514 Server: Encrypted packet (len=1448)
   63 0.168979291 192.168.1.16 → 10.6.15.144  TCP 66 59298 → 22 [ACK] Seq=37 Ack=53277 Win=3666 Len=0 TSval=3729230 TSecr=4325560
   64 0.169192850  10.6.15.144 → 192.168.1.16 SSH 1514 Server: Encrypted packet (len=1448)
   65 0.169202585 192.168.1.16 → 10.6.15.144  TCP 66 59298 → 22 [ACK] Seq=37 Ack=54725 Win=3666 Len=0 TSval=3729230 TSecr=4325560
   66 0.169403937  10.6.15.144 → 192.168.1.16 SSH 1514 Server: Encrypted packet (len=1448)
   67 0.169412700 192.168.1.16 → 10.6.15.144  TCP 66 59298 → 22 [ACK] Seq=37 Ack=56173 Win=3666 Len=0 TSval=3729230 TSecr=4325560
   68 0.180212776  10.6.15.144 → 192.168.1.16 SSH 1514 Server: Encrypted packet (len=1448)
   69 0.180230399 192.168.1.16 → 10.6.15.144  TCP 66 59298 → 22 [ACK] Seq=37 Ack=57621 Win=3666 Len=0 TSval=3729233 TSecr=4325563
   70 0.180416528  10.6.15.144 → 192.168.1.16 SSH 1514 Server: Encrypted packet (len=1448)
   71 0.180424537 192.168.1.16 → 10.6.15.144  TCP 66 59298 → 22 [ACK] Seq=37 Ack=59069 Win=3666 Len=0 TSval=3729233 TSecr=4325563
   72 0.180774128  10.6.15.144 → 192.168.1.16 SSH 1514 Server: Encrypted packet (len=1448)
   73 0.180780212 192.168.1.16 → 10.6.15.144  TCP 66 59298 → 22 [ACK] Seq=37 Ack=60517 Win=3666 Len=0 TSval=3729233 TSecr=4325563
   74 0.180985952  10.6.15.144 → 192.168.1.16 SSH 1514 Server: Encrypted packet (len=1448)
   75 0.192234525  10.6.15.144 → 192.168.1.16 SSH 1514 Server: Encrypted packet (len=1448)
   76 0.192250991 192.168.1.16 → 10.6.15.144  TCP 66 59298 → 22 [ACK] Seq=37 Ack=63413 Win=3666 Len=0 TSval=3729236 TSecr=4325563
   77 0.192540870  10.6.15.144 → 192.168.1.16 SSH 1514 Server: Encrypted packet (len=1448)
   78 0.203486656  10.6.15.144 → 192.168.1.16 SSH 1514 Server: Encrypted packet (len=1448)
   79 0.203508929 192.168.1.16 → 10.6.15.144  TCP 66 59298 → 22 [ACK] Seq=37 Ack=66309 Win=3666 Len=0 TSval=3729239 TSecr=4325565
   80 0.203803292  10.6.15.144 → 192.168.1.16 SSH 1514 Server: Encrypted packet (len=1448)
   81 0.214419414  10.6.15.144 → 192.168.1.16 SSH 1514 Server: Encrypted packet (len=1448)
   82 0.214441730 192.168.1.16 → 10.6.15.144  TCP 66 59298 → 22 [ACK] Seq=37 Ack=69205 Win=3666 Len=0 TSval=3729241 TSecr=4325568
   83 0.214732208  10.6.15.144 → 192.168.1.16 SSH 1514 Server: Encrypted packet (len=1448)
   84 0.214918728 192.168.1.16 → 10.6.15.144  SSH 102 Client: Encrypted packet (len=36)
   85 0.217988957 192.168.1.16 → 10.6.15.144  SSH 102 Client: Encrypted packet (len=36)
   86 0.225044658  10.6.15.144 → 192.168.1.16 SSH 1514 Server: Encrypted packet (len=1448)
   87 0.225357638  10.6.15.144 → 192.168.1.16 SSH 1514 Server: Encrypted packet (len=1448)
   88 0.225373794 192.168.1.16 → 10.6.15.144  TCP 66 59298 → 22 [ACK] Seq=109 Ack=73549 Win=3666 Len=0 TSval=3729244 TSecr=4325574
   89 0.225677492  10.6.15.144 → 192.168.1.16 SSH 1514 Server: Encrypted packet (len=1448)
   90 0.225999402  10.6.15.144 → 192.168.1.16 SSH 1514 Server: Encrypted packet (len=1448)
   91 0.226012545 192.168.1.16 → 10.6.15.144  TCP 66 59298 → 22 [ACK] Seq=109 Ack=76445 Win=3666 Len=0 TSval=3729244 TSecr=4325574
   92 0.227836129  10.6.15.144 → 192.168.1.16 TCP 66 22 → 59298 [ACK] Seq=76445 Ack=109 Win=1452 Len=0 TSval=4325575 TSecr=3729241
   93 0.229780890 192.168.1.16 → 10.6.15.144  SSH 110 Client: Encrypted packet (len=44)
   94 0.231054601 192.168.1.16 → 10.6.15.144  SSH 126 Client: Encrypted packet (len=60)
   95 0.236660422  10.6.15.144 → 192.168.1.16 SSH 1514 Server: Encrypted packet (len=1448)
   96 0.236972292  10.6.15.144 → 192.168.1.16 SSH 1514 Server: Encrypted packet (len=1448)
   97 0.236989115 192.168.1.16 → 10.6.15.144  TCP 66 59298 → 22 [ACK] Seq=213 Ack=79341 Win=3666 Len=0 TSval=3729247 TSecr=4325577
   98 0.237295511  10.6.15.144 → 192.168.1.16 SSH 1514 Server: Encrypted packet (len=1448)
   99 0.237487109  10.6.15.144 → 192.168.1.16 SSH 1514 Server: Encrypted packet (len=1448)
  100 0.237496953 192.168.1.16 → 10.6.15.144  TCP 66 59298 → 22 [ACK] Seq=213 Ack=82237 Win=3666 Len=0 TSval=3729247 TSecr=4325577
  101 0.237596376 192.168.1.16 → 10.6.15.144  SSH 102 Client: Encrypted packet (len=36)
  102 0.237948825 192.168.1.16 → 10.6.15.144  SSH 102 Client: Encrypted packet (len=36)
  103 0.238273396 192.168.1.16 → 10.6.15.144  SSH 102 Client: Encrypted packet (len=36)
  104 0.239838102 192.168.1.16 → 10.6.15.144  SSH 142 Client: Encrypted packet (len=76)
  105 0.240045369 192.168.1.16 → 10.6.15.144  SSH 138 Client: Encrypted packet (len=72)
  106 0.243420071  10.6.15.144 → 192.168.1.16 TCP 66 22 → 59298 [ACK] Seq=82237 Ack=213 Win=1452 Len=0 TSval=4325578 TSecr=3729245
  107 0.246194247  10.6.15.144 → 192.168.1.16 SSH 1514 Server: Encrypted packet (len=1448)
  108 0.247958291  10.6.15.144 → 192.168.1.16 SSH 1514 Server: Encrypted packet (len=1448)
  109 0.247980229 192.168.1.16 → 10.6.15.144  TCP 66 59298 → 22 [ACK] Seq=469 Ack=85133 Win=3666 Len=0 TSval=3729250 TSecr=4325579
  110 0.248139576  10.6.15.144 → 192.168.1.16 SSH 1514 Server: Encrypted packet (len=1448)
  111 0.248178548 192.168.1.16 → 10.6.15.144  SSH 102 Client: Encrypted packet (len=36)
  112 0.248484619  10.6.15.144 → 192.168.1.16 SSH 1514 Server: Encrypted packet (len=1448)
  113 0.248497535  10.6.15.144 → 192.168.1.16 TCP 66 22 → 59298 [ACK] Seq=88029 Ack=285 Win=1452 Len=0 TSval=4325580 TSecr=3729247
  114 0.249753544  10.6.15.144 → 192.168.1.16 TCP 66 22 → 59298 [ACK] Seq=88029 Ack=397 Win=1452 Len=0 TSval=4325580 TSecr=3729247
  115 0.251145842 192.168.1.16 → 10.6.15.144  SSH 102 Client: Encrypted packet (len=36)
  116 0.257914401 192.168.1.16 → 10.6.15.144  SSH 102 Client: Encrypted packet (len=36)
  117 0.259504054  10.6.15.144 → 192.168.1.16 SSH 1514 Server: Encrypted packet (len=1448)
  118 0.259635335 192.168.1.16 → 10.6.15.144  SSH 102 Client: Encrypted packet (len=36)
  119 0.259693071  10.6.15.144 → 192.168.1.16 SSH 1514 Server: Encrypted packet (len=1448)
  120 0.259880000  10.6.15.144 → 192.168.1.16 SSH 1514 Server: Encrypted packet (len=1448)
  121 0.259892602 192.168.1.16 → 10.6.15.144  TCP 66 59298 → 22 [ACK] Seq=613 Ack=92373 Win=3666 Len=0 TSval=3729253 TSecr=4325582
  122 0.260311157 192.168.1.16 → 10.6.15.144  SSH 102 Client: Encrypted packet (len=36)
  123 0.261449534  10.6.15.144 → 192.168.1.16 SSH 1262 Server: [TCP Previous segment not captured] , Encrypted packet (len=1196)
  124 0.261467301 192.168.1.16 → 10.6.15.144  TCP 78 [TCP Dup ACK 121#1] 59298 → 22 [ACK] Seq=649 Ack=92373 Win=3666 Len=0 TSval=3729253 TSecr=4325582 SLE=93821 SRE=95017
  125 0.262312031 192.168.1.16 → 10.6.15.144  SSH 162 Client: Encrypted packet (len=84)
  126 0.264735863 192.168.1.16 → 10.6.15.144  SSH 234 Client: Encrypted packet (len=156)
  127 0.269724144  10.6.15.144 → 192.168.1.16 TCP 66 22 → 59298 [ACK] Seq=95017 Ack=613 Win=1452 Len=0 TSval=4325585 TSecr=3729252
  128 0.273232179  10.6.15.144 → 192.168.1.16 TCP 66 22 → 59298 [ACK] Seq=95017 Ack=733 Win=1452 Len=0 TSval=4325586 TSecr=3729253
  129 0.274619097  10.6.15.144 → 192.168.1.16 SSH 102 Server: Encrypted packet (len=36)
  130 0.274635995 192.168.1.16 → 10.6.15.144  TCP 78 [TCP Dup ACK 121#2] 59298 → 22 [ACK] Seq=889 Ack=92373 Win=3666 Len=0 TSval=3729256 TSecr=4325582 SLE=93821 SRE=95053
  131 0.274649637  10.6.15.144 → 192.168.1.16 SSH 138 Server: Encrypted packet (len=72)
  132 0.274655078 192.168.1.16 → 10.6.15.144  TCP 78 [TCP Dup ACK 121#3] 59298 → 22 [ACK] Seq=889 Ack=92373 Win=3666 Len=0 TSval=3729256 TSecr=4325582 SLE=93821 SRE=95125
  133 0.277410059  10.6.15.144 → 192.168.1.16 SSH 138 Server: Encrypted packet (len=72)
  134 0.277427150 192.168.1.16 → 10.6.15.144  TCP 78 [TCP Dup ACK 121#4] 59298 → 22 [ACK] Seq=889 Ack=92373 Win=3666 Len=0 TSval=3729257 TSecr=4325582 SLE=93821 SRE=95197
  135 0.278603633  10.6.15.144 → 192.168.1.16 SSH 138 Server: Encrypted packet (len=72)
  136 0.278617866 192.168.1.16 → 10.6.15.144  TCP 78 [TCP Dup ACK 121#5] 59298 → 22 [ACK] Seq=889 Ack=92373 Win=3666 Len=0 TSval=3729257 TSecr=4325582 SLE=93821 SRE=95269
  137 0.285041734  10.6.15.144 → 192.168.1.16 SSH 1514 Server: [TCP Fast Retransmission] , Encrypted packet (len=1448)
  138 0.285063709 192.168.1.16 → 10.6.15.144  TCP 66 59298 → 22 [ACK] Seq=889 Ack=95269 Win=3666 Len=0 TSval=3729259 TSecr=4325589
  139 0.285406743 192.168.1.16 → 10.6.15.144  SSH 138 Client: Encrypted packet (len=72)
  140 0.285626316 192.168.1.16 → 10.6.15.144  SSH 166 Client: Encrypted packet (len=100)
  141 0.286101405 192.168.1.16 → 10.6.15.144  SSH 398 Client: Encrypted packet (len=332)
  142 0.286353562 192.168.1.16 → 10.6.15.144  SSH 250 Client: Encrypted packet (len=184)
  143 0.291275091  10.6.15.144 → 192.168.1.16 SSH 102 Server: Encrypted packet (len=36)
  144 0.291623958 192.168.1.16 → 10.6.15.144  SSH 158 Client: Encrypted packet (len=92)
  145 0.294398060  10.6.15.144 → 192.168.1.16 SSH 102 Server: Encrypted packet (len=36)
  146 0.294899552 192.168.1.16 → 10.6.15.144  SSH 158 Client: Encrypted packet (len=92)
  147 0.294997821  10.6.15.144 → 192.168.1.16 TCP 66 22 → 59298 [ACK] Seq=95341 Ack=1061 Win=1452 Len=0 TSval=4325592 TSecr=3729259
  148 0.295575224  10.6.15.144 → 192.168.1.16 TCP 66 22 → 59298 [ACK] Seq=95341 Ack=1577 Win=1452 Len=0 TSval=4325592 TSecr=3729259
  149 0.297102715  10.6.15.144 → 192.168.1.16 SSH 138 Server: Encrypted packet (len=72)
  150 0.297360799 192.168.1.16 → 10.6.15.144  SSH 102 Client: Encrypted packet (len=36)
  151 0.301423625  10.6.15.144 → 192.168.1.16 SSH 138 Server: Encrypted packet (len=72)
  152 0.301631302 192.168.1.16 → 10.6.15.144  SSH 102 Client: Encrypted packet (len=36)
  153 0.302572650  10.6.15.144 → 192.168.1.16 SSH 102 Server: Encrypted packet (len=36)
  154 0.302831015 192.168.1.16 → 10.6.15.144  SSH 166 Client: Encrypted packet (len=100)
  155 0.307386604  10.6.15.144 → 192.168.1.16 TCP 66 22 → 59298 [ACK] Seq=95521 Ack=1797 Win=1452 Len=0 TSval=4325595 TSecr=3729261
  156 0.307829716  10.6.15.144 → 192.168.1.16 SSH 102 Server: Encrypted packet (len=36)
  157 0.308141577 192.168.1.16 → 10.6.15.144  SSH 430 Client: Encrypted packet (len=364)
  158 0.309188936  10.6.15.144 → 192.168.1.16 SSH 138 Server: Encrypted packet (len=72)
  159 0.309431236 192.168.1.16 → 10.6.15.144  SSH 102 Client: Encrypted packet (len=36)
  160 0.312988681  10.6.15.144 → 192.168.1.16 TCP 66 22 → 59298 [ACK] Seq=95629 Ack=1933 Win=1452 Len=0 TSval=4325596 TSecr=3729263
  161 0.319285351  10.6.15.144 → 192.168.1.16 TCP 66 22 → 59298 [ACK] Seq=95629 Ack=2333 Win=1452 Len=0 TSval=4325598 TSecr=3729265
  162 0.321683375  10.6.15.144 → 192.168.1.16 SSH 478 Server: Encrypted packet (len=412)
  163 0.321974797 192.168.1.16 → 10.6.15.144  SSH 134 Client: Encrypted packet (len=68)
  164 0.322905293 192.168.1.16 → 10.6.15.144  SSH 134 Client: Encrypted packet (len=68)
  165 0.323750596 192.168.1.16 → 10.6.15.144  SSH 134 Client: Encrypted packet (len=68)
  166 0.324410612 192.168.1.16 → 10.6.15.144  SSH 198 Client: Encrypted packet (len=132)
  167 0.324602493 192.168.1.16 → 10.6.15.144  SSH 134 Client: Encrypted packet (len=68)
  168 0.324879948 192.168.1.16 → 10.6.15.144  SSH 374 Client: Encrypted packet (len=308)
  169 0.325113052 192.168.1.16 → 10.6.15.144  SSH 590 Client: Encrypted packet (len=524)
  170 0.327047212  10.6.15.144 → 192.168.1.16 SSH 138 Server: Encrypted packet (len=72)
  171 0.327238889 192.168.1.16 → 10.6.15.144  SSH 102 Client: Encrypted packet (len=36)
  172 0.331765647  10.6.15.144 → 192.168.1.16 TCP 66 22 → 59298 [ACK] Seq=96113 Ack=2469 Win=1452 Len=0 TSval=4325601 TSecr=3729268
  173 0.332420520  10.6.15.144 → 192.168.1.16 SSH 182 Server: Encrypted packet (len=116)
  174 0.332714156 192.168.1.16 → 10.6.15.144  SSH 134 Client: Encrypted packet (len=68)
  175 0.337232034  10.6.15.144 → 192.168.1.16 TCP 66 22 → 59298 [ACK] Seq=96229 Ack=2737 Win=1452 Len=0 TSval=4325601 TSecr=3729269
  176 0.337251005  10.6.15.144 → 192.168.1.16 TCP 66 22 → 59298 [ACK] Seq=96229 Ack=3569 Win=1452 Len=0 TSval=4325601 TSecr=3729269
  177 0.337412713  10.6.15.144 → 192.168.1.16 SSH 1342 Server: Encrypted packet (len=1276)
  178 0.337563347  10.6.15.144 → 192.168.1.16 SSH 1450 Server: Encrypted packet (len=1384)
  179 0.337570421 192.168.1.16 → 10.6.15.144  TCP 66 59298 → 22 [ACK] Seq=3673 Ack=98889 Win=3666 Len=0 TSval=3729272 TSecr=4325602
  180 0.338654766 192.168.1.16 → 10.6.15.144  SSH 342 Client: Encrypted packet (len=276)
  181 0.339398373 192.168.1.16 → 10.6.15.144  SSH 134 Client: Encrypted packet (len=68)
  182 0.345835711 192.168.1.16 → 10.6.15.144  SSH 102 Client: Encrypted packet (len=36)
  183 0.346171600 192.168.1.16 → 10.6.15.144  SSH 118 Client: Encrypted packet (len=52)
  184 0.358379177  10.6.15.144 → 192.168.1.16 SSH 1514 Server: Encrypted packet (len=1448)
  185 0.358653172 192.168.1.16 → 10.6.15.144  SSH 102 Client: Encrypted packet (len=36)
  186 0.358826851 192.168.1.16 → 10.6.15.144  SSH 134 Client: Encrypted packet (len=68)
  187 0.359625441 192.168.1.16 → 10.6.15.144  SSH 1514 Client: Encrypted packet (len=1448)
  188 0.359640798 192.168.1.16 → 10.6.15.144  SSH 1514 Client: Encrypted packet (len=1448)
  189 0.387306620 192.168.1.16 → 10.6.15.144  SSH 1310 Client: Encrypted packet (len=1244)
  190 0.401513015  10.6.15.144 → 192.168.1.16 SSH 1514 Server: Encrypted packet (len=1448)
  191 0.401653432  10.6.15.144 → 192.168.1.16 SSH 1514 Server: Encrypted packet (len=1448)
  192 0.401665978 192.168.1.16 → 10.6.15.144  TCP 66 59298 → 22 [ACK] Seq=8349 Ack=103233 Win=3666 Len=0 TSval=3729288 TSecr=4325618
  193 0.401854194  10.6.15.144 → 192.168.1.16 SSH 1514 Server: Encrypted packet (len=1448)
  194 0.401863006  10.6.15.144 → 192.168.1.16 TCP 78 [TCP Dup ACK 176#1] 22 → 59298 [ACK] Seq=104681 Ack=3569 Win=1452 Len=0 TSval=4325618 TSecr=3729269 SLE=3673 SRE=3949
  195 0.401870641  10.6.15.144 → 192.168.1.16 TCP 78 [TCP Dup ACK 176#2] 22 → 59298 [ACK] Seq=104681 Ack=3569 Win=1452 Len=0 TSval=4325618 TSecr=3729269 SLE=3673 SRE=4017
  196 0.401877630 192.168.1.16 → 10.6.15.144  SSH 170 Client: [TCP Fast Retransmission] , Encrypted packet (len=104)
  197 0.401886563  10.6.15.144 → 192.168.1.16 TCP 78 [TCP Dup ACK 176#3] 22 → 59298 [ACK] Seq=104681 Ack=3569 Win=1452 Len=0 TSval=4325618 TSecr=3729269 SLE=3673 SRE=4053
  198 0.401890988  10.6.15.144 → 192.168.1.16 TCP 78 [TCP Dup ACK 176#4] 22 → 59298 [ACK] Seq=104681 Ack=3569 Win=1452 Len=0 TSval=4325618 TSecr=3729269 SLE=3673 SRE=4105
  199 0.402240095  10.6.15.144 → 192.168.1.16 SSH 1514 Server: Encrypted packet (len=1436)
  200 0.402438484  10.6.15.144 → 192.168.1.16 SSH 1514 Server: Encrypted packet (len=1436)
  201 0.402446992 192.168.1.16 → 10.6.15.144  TCP 66 59298 → 22 [ACK] Seq=8349 Ack=107553 Win=3666 Len=0 TSval=3729288 TSecr=4325618
  202 0.402455983  10.6.15.144 → 192.168.1.16 TCP 78 [TCP Dup ACK 176#5] 22 → 59298 [ACK] Seq=107553 Ack=3569 Win=1452 Len=0 TSval=4325618 TSecr=3729269 SLE=3673 SRE=4209
  203 0.402462011  10.6.15.144 → 192.168.1.16 TCP 78 [TCP Dup ACK 176#6] 22 → 59298 [ACK] Seq=107553 Ack=3569 Win=1452 Len=0 TSval=4325618 TSecr=3729269 SLE=3673 SRE=5657
  204 0.402466500  10.6.15.144 → 192.168.1.16 TCP 78 [TCP Dup ACK 176#7] 22 → 59298 [ACK] Seq=107553 Ack=3569 Win=1452 Len=0 TSval=4325618 TSecr=3729269 SLE=3673 SRE=7105
  205 0.402470973  10.6.15.144 → 192.168.1.16 TCP 78 [TCP Dup ACK 176#8] 22 → 59298 [ACK] Seq=107553 Ack=3569 Win=1452 Len=0 TSval=4325618 TSecr=3729269 SLE=3673 SRE=8349
  206 0.402948547 192.168.1.16 → 10.6.15.144  SSH 174 Client: Encrypted packet (len=108)
  207 0.412482880  10.6.15.144 → 192.168.1.16 SSH 102 Server: Encrypted packet (len=24)
  208 0.412699401  10.6.15.144 → 192.168.1.16 SSH 1514 Server: Encrypted packet (len=1448)
  209 0.412720121 192.168.1.16 → 10.6.15.144  SSH 134 Client: Encrypted packet (len=68)
  210 0.413021153  10.6.15.144 → 192.168.1.16 SSH 1514 Server: Encrypted packet (len=1448)
  211 0.413340111  10.6.15.144 → 192.168.1.16 SSH 1514 Server: Encrypted packet (len=1448)
  212 0.413355614 192.168.1.16 → 10.6.15.144  TCP 66 59298 → 22 [ACK] Seq=8525 Ack=111921 Win=3666 Len=0 TSval=3729291 TSecr=4325621
  213 0.413654161  10.6.15.144 → 192.168.1.16 SSH 1514 Server: Encrypted packet (len=1448)
  214 0.424150522  10.6.15.144 → 192.168.1.16 SSH 1514 Server: Encrypted packet (len=1448)
  215 0.424176739 192.168.1.16 → 10.6.15.144  TCP 66 59298 → 22 [ACK] Seq=8525 Ack=114817 Win=3666 Len=0 TSval=3729294 TSecr=4325621
  216 0.424330390  10.6.15.144 → 192.168.1.16 SSH 1514 Server: Encrypted packet (len=1448)
  217 0.424677016  10.6.15.144 → 192.168.1.16 SSH 1514 Server: Encrypted packet (len=1448)
  218 0.424688475 192.168.1.16 → 10.6.15.144  TCP 66 59298 → 22 [ACK] Seq=8525 Ack=117713 Win=3666 Len=0 TSval=3729294 TSecr=4325624
  219 0.424873529  10.6.15.144 → 192.168.1.16 SSH 1514 Server: Encrypted packet (len=1448)
  220 0.438750929  10.6.15.144 → 192.168.1.16 SSH 1514 Server: Encrypted packet (len=1448)
  221 0.438767731 192.168.1.16 → 10.6.15.144  TCP 66 59298 → 22 [ACK] Seq=8525 Ack=120609 Win=3666 Len=0 TSval=3729297 TSecr=4325624
  222 0.438910581  10.6.15.144 → 192.168.1.16 SSH 1514 Server: Encrypted packet (len=1448)
  223 0.439109925  10.6.15.144 → 192.168.1.16 SSH 1514 Server: Encrypted packet (len=1448)
  224 0.439117204 192.168.1.16 → 10.6.15.144  TCP 66 59298 → 22 [ACK] Seq=8525 Ack=123505 Win=3666 Len=0 TSval=3729297 TSecr=4325626
  225 0.439289849  10.6.15.144 → 192.168.1.16 SSH 1514 Server: Encrypted packet (len=1448)
  226 0.449390895  10.6.15.144 → 192.168.1.16 SSH 1514 Server: Encrypted packet (len=1448)
  227 0.449408166 192.168.1.16 → 10.6.15.144  TCP 66 59298 → 22 [ACK] Seq=8525 Ack=126401 Win=3666 Len=0 TSval=3729300 TSecr=4325626
  228 0.449581005  10.6.15.144 → 192.168.1.16 SSH 1514 Server: Encrypted packet (len=1448)
  229 0.449923391  10.6.15.144 → 192.168.1.16 SSH 1514 Server: Encrypted packet (len=1448)
  230 0.449931933 192.168.1.16 → 10.6.15.144  TCP 66 59298 → 22 [ACK] Seq=8525 Ack=129297 Win=3666 Len=0 TSval=3729300 TSecr=4325630
  231 0.450115454  10.6.15.144 → 192.168.1.16 SSH 1514 Server: Encrypted packet (len=1448)
  232 0.460746375  10.6.15.144 → 192.168.1.16 SSH 1514 Server: Encrypted packet (len=1448)
  233 0.460763929 192.168.1.16 → 10.6.15.144  TCP 66 59298 → 22 [ACK] Seq=8525 Ack=132193 Win=3666 Len=0 TSval=3729303 TSecr=4325630
  234 0.460868346  10.6.15.144 → 192.168.1.16 SSH 1514 Server: Encrypted packet (len=1448)
  235 0.461093240  10.6.15.144 → 192.168.1.16 SSH 1514 Server: Encrypted packet (len=1448)
  236 0.461101883 192.168.1.16 → 10.6.15.144  TCP 66 59298 → 22 [ACK] Seq=8525 Ack=135089 Win=3666 Len=0 TSval=3729303 TSecr=4325633
  237 0.461113190  10.6.15.144 → 192.168.1.16 SSH 462 Server: Encrypted packet (len=396)
  238 0.461387388 192.168.1.16 → 10.6.15.144  SSH 138 Client: Encrypted packet (len=72)
  239 0.462281266 192.168.1.16 → 10.6.15.144  SSH 430 Client: Encrypted packet (len=364)
  240 0.471191866  10.6.15.144 → 192.168.1.16 TCP 66 22 → 59298 [ACK] Seq=135485 Ack=8961 Win=1452 Len=0 TSval=4325636 TSecr=3729303
  241 0.475694592  10.6.15.144 → 192.168.1.16 SSH 238 Server: Encrypted packet (len=172)
  242 0.475994842 192.168.1.16 → 10.6.15.144  SSH 134 Client: Encrypted packet (len=68)
  243 0.476902606 192.168.1.16 → 10.6.15.144  SSH 230 Client: Encrypted packet (len=164)
  244 0.477192145 192.168.1.16 → 10.6.15.144  SSH 1514 Client: Encrypted packet (len=1448)
  245 0.477589301 192.168.1.16 → 10.6.15.144  SSH 958 Client: Encrypted packet (len=892)
  246 0.486996031  10.6.15.144 → 192.168.1.16 TCP 66 22 → 59298 [ACK] Seq=135657 Ack=9193 Win=1452 Len=0 TSval=4325639 TSecr=3729307
  247 0.488629334  10.6.15.144 → 192.168.1.16 TCP 66 22 → 59298 [ACK] Seq=135657 Ack=11533 Win=1452 Len=0 TSval=4325640 TSecr=3729307
  248 0.489046896  10.6.15.144 → 192.168.1.16 SSH 158 Server: Encrypted packet (len=92)
  249 0.489361870 192.168.1.16 → 10.6.15.144  SSH 126 Client: Encrypted packet (len=60)
  250 0.489821845  10.6.15.144 → 192.168.1.16 SSH 134 Server: Encrypted packet (len=68)
  251 0.531365058 192.168.1.16 → 10.6.15.144  TCP 66 59298 → 22 [ACK] Seq=11593 Ack=135817 Win=3666 Len=0 TSval=3729321 TSecr=4325640
  252 0.539394827  10.6.15.144 → 192.168.1.16 TCP 66 22 → 59298 [ACK] Seq=135817 Ack=11593 Win=1452 Len=0 TSval=4325653 TSecr=3729310
  253 0.608579018  10.6.15.144 → 192.168.1.16 SSH 1182 Server: Encrypted packet (len=1116)
  254 0.608679169 192.168.1.16 → 10.6.15.144  TCP 66 59298 → 22 [ACK] Seq=11593 Ack=136933 Win=3666 Len=0 TSval=3729340 TSecr=4325670
  255 0.610192086  10.6.15.144 → 192.168.1.16 SSH 374 Server: Encrypted packet (len=308)
  256 0.610203812  10.6.15.144 → 192.168.1.16 SSH 142 Server: Encrypted packet (len=76)
  257 0.610238762 192.168.1.16 → 10.6.15.144  TCP 66 59298 → 22 [ACK] Seq=11593 Ack=137317 Win=3666 Len=0 TSval=3729340 TSecr=4325670
  258 0.610998561 192.168.1.16 → 10.6.15.144  SSH 142 Client: Encrypted packet (len=76)
  259 0.621588183  10.6.15.144 → 192.168.1.16 TCP 66 22 → 59298 [ACK] Seq=137317 Ack=11669 Win=1452 Len=0 TSval=4325673 TSecr=3729340
  260 0.698259170  10.6.15.144 → 192.168.1.16 SSH 1514 Server: Encrypted packet (len=1448)
  261 0.698278377  10.6.15.144 → 192.168.1.16 SSH 294 Server: Encrypted packet (len=228)
  262 0.698289133 192.168.1.16 → 10.6.15.144  TCP 66 59298 → 22 [ACK] Seq=11669 Ack=138993 Win=3666 Len=0 TSval=3729362 TSecr=4325692
  263 1.050711314 192.168.1.16 → 239.255.255.250 SSDP 213 M-SEARCH * HTTP/1.1 
  264 1.055357262  10.6.15.144 → 192.168.1.16 SSH 1514 Server: Encrypted packet (len=1448)
  265 1.055442203  10.6.15.144 → 192.168.1.16 SSH 1158 Server: Encrypted packet (len=1092)
  266 1.055452729 192.168.1.16 → 10.6.15.144  TCP 66 59298 → 22 [ACK] Seq=11669 Ack=141533 Win=3666 Len=0 TSval=3729452 TSecr=4325724
  267 1.055656823  10.6.15.144 → 192.168.1.16 SSH 1514 Server: Encrypted packet (len=1448)
  268 1.055665831  10.6.15.144 → 192.168.1.16 SSH 270 Server: Encrypted packet (len=204)
  269 1.055672741 192.168.1.16 → 10.6.15.144  TCP 66 59298 → 22 [ACK] Seq=11669 Ack=143185 Win=3666 Len=0 TSval=3729452 TSecr=4325724
  270 1.055717435  10.6.15.144 → 192.168.1.16 SSH 470 Server: Encrypted packet (len=404)
  271 1.055780668  10.6.15.144 → 192.168.1.16 TCP 470 [TCP Retransmission] 22 → 59298 [PSH, ACK] Seq=143185 Ack=11669 Win=1452 Len=404 TSval=4325734 TSecr=3729362
  272 1.055785398 192.168.1.16 → 10.6.15.144  TCP 78 59298 → 22 [ACK] Seq=11669 Ack=143589 Win=3666 Len=0 TSval=3729452 TSecr=4325734 SLE=143185 SRE=143589
  273 1.065716094  10.6.15.144 → 192.168.1.16 SSH 1514 Server: Encrypted packet (len=1448)
  274 1.065737099 192.168.1.16 → 10.6.15.144  TCP 66 59298 → 22 [ACK] Seq=11669 Ack=145037 Win=3666 Len=0 TSval=3729454 TSecr=4325784
  275 1.065896589  10.6.15.144 → 192.168.1.16 SSH 1514 Server: Encrypted packet (len=1448)
  276 1.065904300 192.168.1.16 → 10.6.15.144  TCP 66 59298 → 22 [ACK] Seq=11669 Ack=146485 Win=3666 Len=0 TSval=3729454 TSecr=4325784
  277 1.066089261  10.6.15.144 → 192.168.1.16 SSH 1514 Server: Encrypted packet (len=1448)
  278 1.066097063 192.168.1.16 → 10.6.15.144  TCP 66 59298 → 22 [ACK] Seq=11669 Ack=147933 Win=3666 Len=0 TSval=3729454 TSecr=4325784
  279 1.066284216  10.6.15.144 → 192.168.1.16 SSH 1514 Server: Encrypted packet (len=1448)
  280 1.066291847 192.168.1.16 → 10.6.15.144  TCP 66 59298 → 22 [ACK] Seq=11669 Ack=149381 Win=3666 Len=0 TSval=3729454 TSecr=4325784
  281 1.073228915 192.168.1.16 → 10.6.15.144  SSH 102 Client: Encrypted packet (len=36)
  282 1.073464328 192.168.1.16 → 10.6.15.144  SSH 102 Client: Encrypted packet (len=36)
  283 1.075003020 192.168.1.16 → 10.6.15.144  SSH 110 Client: Encrypted packet (len=44)
  284 1.075195803 192.168.1.16 → 10.6.15.144  SSH 110 Client: Encrypted packet (len=44)
  285 1.078179367  10.6.15.144 → 192.168.1.16 SSH 1514 Server: Encrypted packet (len=1448)
  286 1.078361309  10.6.15.144 → 192.168.1.16 SSH 1514 Server: Encrypted packet (len=1448)
  287 1.078368656 192.168.1.16 → 10.6.15.144  TCP 66 59298 → 22 [ACK] Seq=11829 Ack=152277 Win=3666 Len=0 TSval=3729457 TSecr=4325787
  288 1.078552181  10.6.15.144 → 192.168.1.16 SSH 1514 Server: Encrypted packet (len=1448)
  289 1.078727177  10.6.15.144 → 192.168.1.16 SSH 1398 Server: Encrypted packet (len=1332)
  290 1.078733825 192.168.1.16 → 10.6.15.144  TCP 66 59298 → 22 [ACK] Seq=11829 Ack=155057 Win=3666 Len=0 TSval=3729457 TSecr=4325787
  291 1.081854404  10.6.15.144 → 192.168.1.16 TCP 66 22 → 59298 [ACK] Seq=155057 Ack=11741 Win=1452 Len=0 TSval=4325789 TSecr=3729456
  292 1.083741875  10.6.15.144 → 192.168.1.16 TCP 66 22 → 59298 [ACK] Seq=155057 Ack=11829 Win=1452 Len=0 TSval=4325789 TSecr=3729456
  293 1.111288271  10.6.15.144 → 192.168.1.16 SSH 210 Server: Encrypted packet (len=144)
  294 1.111593586 192.168.1.16 → 10.6.15.144  SSH 138 Client: Encrypted packet (len=72)
  295 1.116635167  10.6.15.144 → 192.168.1.16 SSH 110 Server: Encrypted packet (len=44)
  296 1.116653568  10.6.15.144 → 192.168.1.16 SSH 102 Server: Encrypted packet (len=36)
  297 1.116706639 192.168.1.16 → 10.6.15.144  TCP 66 59298 → 22 [ACK] Seq=11901 Ack=155281 Win=3666 Len=0 TSval=3729467 TSecr=4325796
  298 1.117083020 192.168.1.16 → 10.6.15.144  SSH 422 Client: Encrypted packet (len=356)
  299 1.117504997 192.168.1.16 → 10.6.15.144  SSH 166 Client: Encrypted packet (len=100)
  300 1.125915232  10.6.15.144 → 192.168.1.16 TCP 66 22 → 59298 [ACK] Seq=155281 Ack=12257 Win=1452 Len=0 TSval=4325799 TSecr=3729466
  301 1.134365879  10.6.15.144 → 192.168.1.16 SSH 1142 Server: Encrypted packet (len=1076)
  302 1.134418465  10.6.15.144 → 192.168.1.16 SSH 598 Server: Encrypted packet (len=532)
  303 1.134428666 192.168.1.16 → 10.6.15.144  TCP 66 59298 → 22 [ACK] Seq=12357 Ack=156889 Win=3666 Len=0 TSval=3729471 TSecr=4325801
  304 1.135362476  10.6.15.144 → 192.168.1.16 SSH 262 Server: Encrypted packet (len=196)
  305 1.135584162  10.6.15.144 → 192.168.1.16 SSH 1514 Server: Encrypted packet (len=1448)
  306 1.135593646 192.168.1.16 → 10.6.15.144  TCP 66 59298 → 22 [ACK] Seq=12357 Ack=158533 Win=3666 Len=0 TSval=3729472 TSecr=4325801
  307 1.135799665  10.6.15.144 → 192.168.1.16 SSH 702 Server: Encrypted packet (len=636)
  308 1.145188063  10.6.15.144 → 192.168.1.16 SSH 1514 Server: Encrypted packet (len=1448)
  309 1.145205187 192.168.1.16 → 10.6.15.144  TCP 66 59298 → 22 [ACK] Seq=12357 Ack=160617 Win=3666 Len=0 TSval=3729474 TSecr=4325801
  310 1.145220827  10.6.15.144 → 192.168.1.16 SSH 630 Server: Encrypted packet (len=564)
  311 1.145395992 192.168.1.16 → 10.6.15.144  SSH 102 Client: Encrypted packet (len=36)
  312 1.167338809  10.6.15.144 → 192.168.1.16 SSH 1514 Server: Encrypted packet (len=1448)
  313 1.167449864  10.6.15.144 → 192.168.1.16 SSH 206 Server: Encrypted packet (len=140)
  314 1.167459098 192.168.1.16 → 10.6.15.144  TCP 66 59298 → 22 [ACK] Seq=12393 Ack=162769 Win=3666 Len=0 TSval=3729480 TSecr=4325807
  315 1.167678053  10.6.15.144 → 192.168.1.16 SSH 1514 Server: Encrypted packet (len=1448)
  316 1.167869305  10.6.15.144 → 192.168.1.16 SSH 1514 Server: Encrypted packet (len=1448)
  317 1.167876104 192.168.1.16 → 10.6.15.144  TCP 66 59298 → 22 [ACK] Seq=12393 Ack=165665 Win=3666 Len=0 TSval=3729480 TSecr=4325807
  318 1.167966865  10.6.15.144 → 192.168.1.16 SSH 902 Server: Encrypted packet (len=836)
  319 1.178121335  10.6.15.144 → 192.168.1.16 SSH 786 Server: Encrypted packet (len=720)
  320 1.178141261 192.168.1.16 → 10.6.15.144  TCP 66 59298 → 22 [ACK] Seq=12393 Ack=167221 Win=3666 Len=0 TSval=3729482 TSecr=4325807
  321 1.178478072 192.168.1.16 → 10.6.15.144  SSH 134 Client: Encrypted packet (len=68)
  322 1.184483341  10.6.15.144 → 192.168.1.16 SSH 1514 Server: Encrypted packet (len=1448)
  323 1.184500121  10.6.15.144 → 192.168.1.16 SSH 134 Server: Encrypted packet (len=68)
  324 1.184507675 192.168.1.16 → 10.6.15.144  TCP 66 59298 → 22 [ACK] Seq=12461 Ack=168737 Win=3666 Len=0 TSval=3729484 TSecr=4325814
  325 1.184669565  10.6.15.144 → 192.168.1.16 SSH 510 Server: Encrypted packet (len=444)
  326 1.185528766 192.168.1.16 → 10.6.15.144  SSH 206 Client: Encrypted packet (len=140)
  327 1.195850680  10.6.15.144 → 192.168.1.16 TCP 66 22 → 59298 [ACK] Seq=169181 Ack=12601 Win=1452 Len=0 TSval=4325817 TSecr=3729482
  328 1.223543522  10.6.15.144 → 192.168.1.16 SSH 390 Server: Encrypted packet (len=324)
  329 1.246955703 10.22.18.209 → 224.0.0.252  LLMNR 64 Standard query 0x8450 A wpad
  330 1.250961234  10.6.15.144 → 192.168.1.16 SSH 718 Server: Encrypted packet (len=652)
  331 1.251027393 192.168.1.16 → 10.6.15.144  TCP 66 59298 → 22 [ACK] Seq=12601 Ack=170157 Win=3666 Len=0 TSval=3729500 TSecr=4325824
  332 1.252005716  10.6.15.144 → 192.168.1.16 SSH 1514 Server: Encrypted packet (len=1448)
  333 1.252130204  10.6.15.144 → 192.168.1.16 SSH 1086 Server: Encrypted packet (len=1020)
  334 1.252135406 192.168.1.16 → 10.6.15.144  TCP 66 59298 → 22 [ACK] Seq=12601 Ack=172625 Win=3666 Len=0 TSval=3729501 TSecr=4325831
  335 1.252238022  10.6.15.144 → 192.168.1.16 SSH 886 Server: Encrypted packet (len=820)
  336 1.295325220 192.168.1.16 → 10.6.15.144  TCP 66 59298 → 22 [ACK] Seq=12601 Ack=173445 Win=3666 Len=0 TSval=3729512 TSecr=4325831
  337 1.322425662 192.168.1.16 → 10.6.15.144  SSH 102 Client: Encrypted packet (len=36)
  338 1.322624628 192.168.1.16 → 10.6.15.144  SSH 174 Client: Encrypted packet (len=108)
  339 1.322814665 192.168.1.16 → 10.6.15.144  SSH 138 Client: Encrypted packet (len=72)
  340 1.322991523 192.168.1.16 → 10.6.15.144  SSH 102 Client: Encrypted packet (len=36)
  341 1.323162762 192.168.1.16 → 10.6.15.144  SSH 102 Client: Encrypted packet (len=36)
  342 1.323342833 192.168.1.16 → 10.6.15.144  SSH 138 Client: Encrypted packet (len=72)
  343 1.326746655 192.168.1.16 → 10.6.15.144  SSH 126 Client: Encrypted packet (len=60)
  344 1.332403370  10.6.15.144 → 192.168.1.16 SSH 430 Server: Encrypted packet (len=364)
  345 1.332418623 192.168.1.16 → 10.6.15.144  SSH 458 Client: Encrypted packet (len=392)
  346 1.332524882  10.6.15.144 → 192.168.1.16 TCP 66 22 → 59298 [ACK] Seq=173809 Ack=12817 Win=1452 Len=0 TSval=4325851 TSecr=3729518
  347 1.332534408 192.168.1.16 → 10.6.15.144  SSH 102 Client: Encrypted packet (len=36)
  348 1.332661506  10.6.15.144 → 192.168.1.16 TCP 66 22 → 59298 [ACK] Seq=173809 Ack=12889 Win=1452 Len=0 TSval=4325851 TSecr=3729518
  349 1.333490188  10.6.15.144 → 192.168.1.16 SSH 1514 Server: Encrypted packet (len=1448)
  350 1.333549124  10.6.15.144 → 192.168.1.16 SSH 678 Server: Encrypted packet (len=612)
  351 1.333556690 192.168.1.16 → 10.6.15.144  TCP 66 59298 → 22 [ACK] Seq=13449 Ack=175869 Win=3666 Len=0 TSval=3729521 TSecr=4325851
  352 1.334093167 192.168.1.16 → 10.6.15.144  SSH 1514 Client: Encrypted packet (len=1448)
  353 1.334107768 192.168.1.16 → 10.6.15.144  SSH 1514 Client: Encrypted packet (len=1448)
  354 1.334603118 192.168.1.16 → 10.6.15.144  SSH 690 Client: Encrypted packet (len=624)
  355 1.336538313  10.6.15.144 → 192.168.1.16 SSH 462 Server: Encrypted packet (len=396)
  356 1.336561747 192.168.1.16 → 10.6.15.144  SSH 138 Client: Encrypted packet (len=72)
  357 1.336588559  10.6.15.144 → 192.168.1.16 SSH 414 Server: Encrypted packet (len=348)
  358 1.343027642  10.6.15.144 → 192.168.1.16 SSH 854 Server: Encrypted packet (len=788)
  359 1.343104013 192.168.1.16 → 10.6.15.144  TCP 66 59298 → 22 [ACK] Seq=17041 Ack=177401 Win=3666 Len=0 TSval=3729523 TSecr=4325852
  360 1.344412364  10.6.15.144 → 192.168.1.16 TCP 66 22 → 59298 [ACK] Seq=177401 Ack=14897 Win=1452 Len=0 TSval=4325854 TSecr=3729521
  361 1.344820225  10.6.15.144 → 192.168.1.16 TCP 66 22 → 59298 [ACK] Seq=177401 Ack=16969 Win=1452 Len=0 TSval=4325854 TSecr=3729521
  362 1.345848270 10.22.18.209 → 224.0.0.252  LLMNR 64 Standard query 0x8450 A wpad
  363 1.358055685  10.6.15.144 → 192.168.1.16 SSH 138 Server: Encrypted packet (len=72)
  364 1.358154832  10.6.15.144 → 192.168.1.16 SSH 654 Server: Encrypted packet (len=588)
  365 1.358339471 192.168.1.16 → 10.6.15.144  TCP 66 59298 → 22 [ACK] Seq=17041 Ack=178061 Win=3666 Len=0 TSval=3729527 TSecr=4325857
  366 1.358360317 192.168.1.16 → 10.6.15.144  SSH 102 Client: Encrypted packet (len=36)
  367 1.360761432  10.6.15.144 → 192.168.1.16 SSH 138 Server: Encrypted packet (len=72)
  368 1.360933590 192.168.1.16 → 10.6.15.144  SSH 102 Client: Encrypted packet (len=36)
  369 1.361006717  10.6.15.144 → 192.168.1.16 SSH 1514 Server: Encrypted packet (len=1448)
  370 1.361016033  10.6.15.144 → 192.168.1.16 SSH 366 Server: Encrypted packet (len=300)
  371 1.361021428 192.168.1.16 → 10.6.15.144  TCP 66 59298 → 22 [ACK] Seq=17113 Ack=179881 Win=3666 Len=0 TSval=3729528 TSecr=4325857
  372 1.367303208 192.168.1.16 → 10.6.15.144  SSH 102 Client: Encrypted packet (len=36)
  373 1.370039075 192.168.1.16 → 10.6.15.144  SSH 134 Client: Encrypted packet (len=68)
  374 1.370359561  10.6.15.144 → 192.168.1.16 SSH 1514 Server: Encrypted packet (len=1448)
  375 1.370549423  10.6.15.144 → 192.168.1.16 SSH 1514 Server: Encrypted packet (len=1448)
  376 1.370558822 192.168.1.16 → 10.6.15.144  TCP 66 59298 → 22 [ACK] Seq=17217 Ack=182777 Win=3666 Len=0 TSval=3729530 TSecr=4325860
  377 1.371410421 192.168.1.16 → 10.6.15.144  SSH 174 Client: Encrypted packet (len=108)
  378 1.371708464  10.6.15.144 → 192.168.1.16 SSH 1514 Server: Encrypted packet (len=1448)
