    1 0.000000000  10.6.15.144 → 192.168.1.16 SSH 174 Server: Encrypted packet (len=108)
    2 0.000022888  10.6.15.144 → 192.168.1.16 SSH 166 Server: Encrypted packet (len=100)
    3 0.000038914  10.6.15.144 → 192.168.1.16 SSH 174 Server: Encrypted packet (len=108)
    4 0.000095644 192.168.1.16 → 10.6.15.144  TCP 66 59298 → 22 [ACK] Seq=1 Ack=317 Win=3666 Len=0 TSval=3737200 TSecr=4333258
    5 0.000228470  10.6.15.144 → 192.168.1.16 SSH 174 Server: [TCP Spurious Retransmission] , Encrypted packet (len=108)
    6 0.000235994 192.168.1.16 → 10.6.15.144  TCP 78 [TCP Dup ACK 4#1] 59298 → 22 [ACK] Seq=1 Ack=317 Win=3666 Len=0 TSval=3737200 TSecr=4333285 SLE=209 SRE=317
    7 0.000294257  10.6.15.144 → 192.168.1.16 SSH 382 Server: [TCP Spurious Retransmission] , Encrypted packet (len=316)
    8 0.000301312 192.168.1.16 → 10.6.15.144  TCP 78 [TCP Dup ACK 4#2] 59298 → 22 [ACK] Seq=1 Ack=317 Win=3666 Len=0 TSval=3737200 TSecr=4333429 SLE=1 SRE=317
    9 0.011988957  10.6.15.144 → 192.168.1.16 SSH 1514 Server: Encrypted packet (len=1448)
   10 0.012006022 192.168.1.16 → 10.6.15.144  TCP 66 59298 → 22 [ACK] Seq=1 Ack=1765 Win=3666 Len=0 TSval=3737203 TSecr=4333533
   11 0.012155657  10.6.15.144 → 192.168.1.16 SSH 1514 Server: Encrypted packet (len=1448)
   12 0.012160521 192.168.1.16 → 10.6.15.144  TCP 66 59298 → 22 [ACK] Seq=1 Ack=3213 Win=3666 Len=0 TSval=3737203 TSecr=4333533
   13 0.012346090  10.6.15.144 → 192.168.1.16 SSH 1514 Server: Encrypted packet (len=1448)
   14 0.012349423 192.168.1.16 → 10.6.15.144  TCP 66 59298 → 22 [ACK] Seq=1 Ack=4661 Win=3666 Len=0 TSval=3737203 TSecr=4333533
   15 0.025723628  10.6.15.144 → 192.168.1.16 SSH 1514 Server: Encrypted packet (len=1448)
   16 0.025744215 192.168.1.16 → 10.6.15.144  TCP 66 59298 → 22 [ACK] Seq=1 Ack=6109 Win=3666 Len=0 TSval=3737206 TSecr=4333536
   17 0.036362205  10.6.15.144 → 192.168.1.16 SSH 1514 Server: [TCP Previous segment not captured] , Encrypted packet (len=1448)
   18 0.036385975 192.168.1.16 → 10.6.15.144  TCP 78 [TCP Dup ACK 16#1] 59298 → 22 [ACK] Seq=1 Ack=6109 Win=3666 Len=0 TSval=3737209 TSecr=4333536 SLE=9005 SRE=10453
   19 0.047146311  10.6.15.144 → 192.168.1.16 SSH 1514 Server: Encrypted packet (len=1448)
   20 0.047168228 192.168.1.16 → 10.6.15.144  TCP 78 [TCP Dup ACK 16#2] 59298 → 22 [ACK] Seq=1 Ack=6109 Win=3666 Len=0 TSval=3737212 TSecr=4333536 SLE=9005 SRE=11901
   21 0.057646988  10.6.15.144 → 192.168.1.16 SSH 1514 Server: [TCP Fast Retransmission] , Encrypted packet (len=1448)
   22 0.057675693 192.168.1.16 → 10.6.15.144  TCP 78 59298 → 22 [ACK] Seq=1 Ack=7557 Win=3666 Len=0 TSval=3737214 TSecr=4333544 SLE=9005 SRE=11901
   23 0.068394875  10.6.15.144 → 192.168.1.16 SSH 1514 Server: Encrypted packet (len=1448)
   24 0.068415935 192.168.1.16 → 10.6.15.144  TCP 78 [TCP Dup ACK 22#1] 59298 → 22 [ACK] Seq=1 Ack=7557 Win=3666 Len=0 TSval=3737217 TSecr=4333544 SLE=9005 SRE=13349
   25 0.078893943  10.6.15.144 → 192.168.1.16 TCP 1514 [TCP Retransmission] 22 → 59298 [ACK] Seq=7557 Ack=1 Win=1452 Len=1448 TSval=4333550 TSecr=3737217
   26 0.078920056 192.168.1.16 → 10.6.15.144  TCP 66 59298 → 22 [ACK] Seq=1 Ack=13349 Win=3666 Len=0 TSval=3737220 TSecr=4333550
   27 0.079071085  10.6.15.144 → 192.168.1.16 SSH 1514 Server: Encrypted packet (len=1448)
   28 0.079076121 192.168.1.16 → 10.6.15.144  TCP 66 59298 → 22 [ACK] Seq=1 Ack=14797 Win=3666 Len=0 TSval=3737220 TSecr=4333550
   29 0.092293588  10.6.15.144 → 192.168.1.16 SSH 1514 Server: Encrypted packet (len=1448)
   30 0.092313333 192.168.1.16 → 10.6.15.144  TCP 66 59298 → 22 [ACK] Seq=1 Ack=16245 Win=3666 Len=0 TSval=3737223 TSecr=4333552
   31 0.092478331  10.6.15.144 → 192.168.1.16 SSH 1514 Server: Encrypted packet (len=1448)
   32 0.092483958 192.168.1.16 → 10.6.15.144  TCP 66 59298 → 22 [ACK] Seq=1 Ack=17693 Win=3666 Len=0 TSval=3737223 TSecr=4333552
   33 0.092671992  10.6.15.144 → 192.168.1.16 SSH 1514 Server: Encrypted packet (len=1448)
   34 0.092678410 192.168.1.16 → 10.6.15.144  TCP 66 59298 → 22 [ACK] Seq=1 Ack=19141 Win=3666 Len=0 TSval=3737223 TSecr=4333552
   35 0.104493227  10.6.15.144 → 192.168.1.16 SSH 1514 Server: Encrypted packet (len=1448)
   36 0.104514350 192.168.1.16 → 10.6.15.144  TCP 66 59298 → 22 [ACK] Seq=1 Ack=20589 Win=3666 Len=0 TSval=3737226 TSecr=4333556
   37 0.104673866  10.6.15.144 → 192.168.1.16 SSH 1514 Server: Encrypted packet (len=1448)
   38 0.104679165 192.168.1.16 → 10.6.15.144  TCP 66 59298 → 22 [ACK] Seq=1 Ack=22037 Win=3666 Len=0 TSval=3737226 TSecr=4333556
   39 0.104865790  10.6.15.144 → 192.168.1.16 SSH 1514 Server: Encrypted packet (len=1448)
   40 0.104873693 192.168.1.16 → 10.6.15.144  TCP 66 59298 → 22 [ACK] Seq=1 Ack=23485 Win=3666 Len=0 TSval=3737226 TSecr=4333556
   41 0.116208174  10.6.15.144 → 192.168.1.16 SSH 1514 Server: Encrypted packet (len=1448)
   42 0.116227056 192.168.1.16 → 10.6.15.144  TCP 66 59298 → 22 [ACK] Seq=1 Ack=24933 Win=3666 Len=0 TSval=3737229 TSecr=4333559
   43 0.116382132  10.6.15.144 → 192.168.1.16 SSH 1514 Server: Encrypted packet (len=1448)
   44 0.116387616 192.168.1.16 → 10.6.15.144  TCP 66 59298 → 22 [ACK] Seq=1 Ack=26381 Win=3666 Len=0 TSval=3737229 TSecr=4333559
   45 0.116571800  10.6.15.144 → 192.168.1.16 SSH 1514 Server: Encrypted packet (len=1448)
   46 0.116576748 192.168.1.16 → 10.6.15.144  TCP 66 59298 → 22 [ACK] Seq=1 Ack=27829 Win=3666 Len=0 TSval=3737229 TSecr=4333559
   47 0.129021741  10.6.15.144 → 192.168.1.16 SSH 1514 Server: Encrypted packet (len=1448)
   48 0.129041066 192.168.1.16 → 10.6.15.144  TCP 66 59298 → 22 [ACK] Seq=1 Ack=29277 Win=3666 Len=0 TSval=3737232 TSecr=4333562
   49 0.129199460  10.6.15.144 → 192.168.1.16 SSH 1514 Server: Encrypted packet (len=1448)
   50 0.129203589 192.168.1.16 → 10.6.15.144  TCP 66 59298 → 22 [ACK] Seq=1 Ack=30725 Win=3666 Len=0 TSval=3737232 TSecr=4333562
   51 0.129390796  10.6.15.144 → 192.168.1.16 SSH 1514 Server: Encrypted packet (len=1448)
   52 0.129395227 192.168.1.16 → 10.6.15.144  TCP 66 59298 → 22 [ACK] Seq=1 Ack=32173 Win=3666 Len=0 TSval=3737232 TSecr=4333562
   53 0.140014176  10.6.15.144 → 192.168.1.16 SSH 1514 Server: Encrypted packet (len=1448)
   54 0.140033414 192.168.1.16 → 10.6.15.144  TCP 66 59298 → 22 [ACK] Seq=1 Ack=33621 Win=3666 Len=0 TSval=3737235 TSecr=4333565
   55 0.140192556  10.6.15.144 → 192.168.1.16 SSH 1514 Server: Encrypted packet (len=1448)
   56 0.140537151  10.6.15.144 → 192.168.1.16 SSH 1514 Server: Encrypted packet (len=1448)
   57 0.140544196 192.168.1.16 → 10.6.15.144  TCP 66 59298 → 22 [ACK] Seq=1 Ack=36517 Win=3666 Len=0 TSval=3737235 TSecr=4333565
   58 0.140763211 192.168.1.16 → 10.6.15.144  SSH 102 Client: Encrypted packet (len=36)
   59 0.148359989  10.6.15.144 → 192.168.1.16 SSH 1514 Server: Encrypted packet (len=1448)
   60 0.156587572  10.6.15.144 → 192.168.1.16 SSH 1514 Server: Encrypted packet (len=1448)
   61 0.156606228 192.168.1.16 → 10.6.15.144  TCP 66 59298 → 22 [ACK] Seq=37 Ack=39413 Win=3666 Len=0 TSval=3737239 TSecr=4333565
   62 0.167182488  10.6.15.144 → 192.168.1.16 SSH 1514 Server: [TCP Previous segment not captured] , Encrypted packet (len=1448)
   63 0.167208164 192.168.1.16 → 10.6.15.144  TCP 78 [TCP Dup ACK 61#1] 59298 → 22 [ACK] Seq=37 Ack=39413 Win=3666 Len=0 TSval=3737242 TSecr=4333565 SLE=40861 SRE=42309
   64 0.167362255  10.6.15.144 → 192.168.1.16 SSH 1514 Server: Encrypted packet (len=1448)
   65 0.167371220 192.168.1.16 → 10.6.15.144  TCP 78 [TCP Dup ACK 61#2] 59298 → 22 [ACK] Seq=37 Ack=39413 Win=3666 Len=0 TSval=3737242 TSecr=4333565 SLE=40861 SRE=43757
   66 0.178281167  10.6.15.144 → 192.168.1.16 SSH 1514 Server: Encrypted packet (len=1448)
   67 0.178303373 192.168.1.16 → 10.6.15.144  TCP 78 [TCP Dup ACK 61#3] 59298 → 22 [ACK] Seq=37 Ack=39413 Win=3666 Len=0 TSval=3737245 TSecr=4333565 SLE=40861 SRE=45205
   68 0.178463247  10.6.15.144 → 192.168.1.16 SSH 1514 Server: Encrypted packet (len=1448)
   69 0.178471010 192.168.1.16 → 10.6.15.144  TCP 78 [TCP Dup ACK 61#4] 59298 → 22 [ACK] Seq=37 Ack=39413 Win=3666 Len=0 TSval=3737245 TSecr=4333565 SLE=40861 SRE=46653
   70 0.178653781  10.6.15.144 → 192.168.1.16 SSH 1514 Server: Encrypted packet (len=1448)
   71 0.178660450 192.168.1.16 → 10.6.15.144  TCP 78 [TCP Dup ACK 61#5] 59298 → 22 [ACK] Seq=37 Ack=39413 Win=3666 Len=0 TSval=3737245 TSecr=4333565 SLE=40861 SRE=48101
   72 0.189357349  10.6.15.144 → 192.168.1.16 SSH 1514 Server: [TCP Fast Retransmission] , Encrypted packet (len=1448)
   73 0.189393038 192.168.1.16 → 10.6.15.144  TCP 66 59298 → 22 [ACK] Seq=37 Ack=48101 Win=3666 Len=0 TSval=3737247 TSecr=4333577
   74 0.189542674  10.6.15.144 → 192.168.1.16 SSH 1514 Server: Encrypted packet (len=1448)
   75 0.189552732 192.168.1.16 → 10.6.15.144  TCP 66 59298 → 22 [ACK] Seq=37 Ack=49549 Win=3666 Len=0 TSval=3737247 TSecr=4333577
   76 0.199852484  10.6.15.144 → 192.168.1.16 SSH 1514 Server: Encrypted packet (len=1448)
   77 0.199881391 192.168.1.16 → 10.6.15.144  TCP 66 59298 → 22 [ACK] Seq=37 Ack=50997 Win=3666 Len=0 TSval=3737250 TSecr=4333580
   78 0.200032883  10.6.15.144 → 192.168.1.16 SSH 1514 Server: Encrypted packet (len=1448)
   79 0.200038589 192.168.1.16 → 10.6.15.144  TCP 66 59298 → 22 [ACK] Seq=37 Ack=52445 Win=3666 Len=0 TSval=3737250 TSecr=4333580
   80 0.200378184  10.6.15.144 → 192.168.1.16 SSH 1514 Server: Encrypted packet (len=1448)
   81 0.200385654 192.168.1.16 → 10.6.15.144  TCP 66 59298 → 22 [ACK] Seq=37 Ack=53893 Win=3666 Len=0 TSval=3737250 TSecr=4333580
   82 0.202512519 192.168.1.16 → 10.6.15.144  SSH 102 Client: Encrypted packet (len=36)
   83 0.204447898 192.168.1.16 → 10.6.15.144  SSH 118 Client: Encrypted packet (len=52)
   84 0.211431356  10.6.15.144 → 192.168.1.16 SSH 1514 Server: Encrypted packet (len=1448)
   85 0.211611689  10.6.15.144 → 192.168.1.16 SSH 1514 Server: Encrypted packet (len=1448)
   86 0.211620884 192.168.1.16 → 10.6.15.144  TCP 66 59298 → 22 [ACK] Seq=125 Ack=56789 Win=3666 Len=0 TSval=3737253 TSecr=4333583
   87 0.211805773  10.6.15.144 → 192.168.1.16 SSH 1514 Server: Encrypted packet (len=1448)
   88 0.233768207 192.168.1.16 → 10.6.15.144  SSH 102 Client: Encrypted packet (len=36)
   89 0.236392797 192.168.1.16 → 10.6.15.144  SSH 126 Client: Encrypted packet (len=60)
   90 0.241643699  10.6.15.144 → 192.168.1.16 SSH 1514 Server: Encrypted packet (len=1436)
   91 0.241825510  10.6.15.144 → 192.168.1.16 SSH 1514 Server: Encrypted packet (len=1436)
   92 0.241841250 192.168.1.16 → 10.6.15.144  TCP 66 59298 → 22 [ACK] Seq=221 Ack=61109 Win=3666 Len=0 TSval=3737260 TSecr=4333591
   93 0.242958274  10.6.15.144 → 192.168.1.16 SSH 102 Server: Encrypted packet (len=24)
   94 0.246867709  10.6.15.144 → 192.168.1.16 TCP 86 [TCP Dup ACK 62#1] 22 → 59298 [ACK] Seq=61133 Ack=37 Win=1452 Len=0 TSval=4333592 TSecr=3737250 SLE=161 SRE=221 SLE=73 SRE=125
   95 0.246884981 192.168.1.16 → 10.6.15.144  TCP 102 [TCP Retransmission] 59298 → 22 [PSH, ACK] Seq=37 Ack=61133 Win=3666 Len=36 TSval=3737262 TSecr=4333591
   96 0.252338037  10.6.15.144 → 192.168.1.16 SSH 1514 Server: Encrypted packet (len=1428)
   97 0.252364434 192.168.1.16 → 10.6.15.144  TCP 102 [TCP Retransmission] 59298 → 22 [PSH, ACK] Seq=125 Ack=61133 Win=3666 Len=36 TSval=3737263 TSecr=4333593
   98 0.252512981  10.6.15.144 → 192.168.1.16 SSH 1514 Server: Encrypted packet (len=1428)
   99 0.252525123 192.168.1.16 → 10.6.15.144  TCP 66 59298 → 22 [ACK] Seq=221 Ack=63989 Win=3666 Len=0 TSval=3737263 TSecr=4333593
  100 0.252648399  10.6.15.144 → 192.168.1.16 SSH 126 Server: Encrypted packet (len=40)
  101 0.256820682  10.6.15.144 → 192.168.1.16 TCP 78 22 → 59298 [ACK] Seq=64029 Ack=125 Win=1452 Len=0 TSval=4333594 TSecr=3737262 SLE=161 SRE=221
  102 0.256847935 192.168.1.16 → 10.6.15.144  SSH 186 Client: Encrypted packet (len=120)
  103 0.260763559 192.168.1.16 → 10.6.15.144  SSH 222 Client: Encrypted packet (len=156)
  104 0.263428020  10.6.15.144 → 192.168.1.16 SSH 1514 Server: Encrypted packet (len=1448)
  105 0.267373958  10.6.15.144 → 192.168.1.16 SSH 1514 Server: [TCP Previous segment not captured] , Encrypted packet (len=1448)
  106 0.267399101 192.168.1.16 → 10.6.15.144  TCP 78 59298 → 22 [ACK] Seq=497 Ack=65477 Win=3666 Len=0 TSval=3737267 TSecr=4333596 SLE=66925 SRE=68373
  107 0.267554523  10.6.15.144 → 192.168.1.16 SSH 1514 Server: Encrypted packet (len=1448)
  108 0.267563804 192.168.1.16 → 10.6.15.144  TCP 78 [TCP Dup ACK 106#1] 59298 → 22 [ACK] Seq=497 Ack=65477 Win=3666 Len=0 TSval=3737267 TSecr=4333596 SLE=66925 SRE=69821
  109 0.278578769  10.6.15.144 → 192.168.1.16 SSH 1514 Server: Encrypted packet (len=1448)
  110 0.278592139 192.168.1.16 → 10.6.15.144  TCP 78 [TCP Dup ACK 106#2] 59298 → 22 [ACK] Seq=497 Ack=65477 Win=3666 Len=0 TSval=3737270 TSecr=4333596 SLE=66925 SRE=71269
  111 0.278750198  10.6.15.144 → 192.168.1.16 SSH 1514 Server: Encrypted packet (len=1448)
  112 0.278755566 192.168.1.16 → 10.6.15.144  TCP 78 [TCP Dup ACK 106#3] 59298 → 22 [ACK] Seq=497 Ack=65477 Win=3666 Len=0 TSval=3737270 TSecr=4333596 SLE=66925 SRE=72717
  113 0.278942342  10.6.15.144 → 192.168.1.16 SSH 1514 Server: Encrypted packet (len=1448)
  114 0.278948120 192.168.1.16 → 10.6.15.144  TCP 78 [TCP Dup ACK 106#4] 59298 → 22 [ACK] Seq=497 Ack=65477 Win=3666 Len=0 TSval=3737270 TSecr=4333596 SLE=66925 SRE=74165
  115 0.288183318  10.22.18.77 → 224.0.0.252  LLMNR 64 Standard query 0x4647 A wpad
  116 0.290382825  10.6.15.144 → 192.168.1.16 SSH 1514 Server: [TCP Fast Retransmission] , Encrypted packet (len=1448)
  117 0.290396322 192.168.1.16 → 10.6.15.144  TCP 66 59298 → 22 [ACK] Seq=497 Ack=74165 Win=3666 Len=0 TSval=3737273 TSecr=4333603
  118 0.290557158  10.6.15.144 → 192.168.1.16 SSH 1514 Server: Encrypted packet (len=1448)
  119 0.290560925 192.168.1.16 → 10.6.15.144  TCP 66 59298 → 22 [ACK] Seq=497 Ack=75613 Win=3666 Len=0 TSval=3737273 TSecr=4333603
  120 0.300903352  10.6.15.144 → 192.168.1.16 SSH 1514 Server: Encrypted packet (len=1448)
  121 0.300919726 192.168.1.16 → 10.6.15.144  TCP 66 59298 → 22 [ACK] Seq=497 Ack=77061 Win=3666 Len=0 TSval=3737275 TSecr=4333605
  122 0.301218546  10.6.15.144 → 192.168.1.16 SSH 1514 Server: Encrypted packet (len=1448)
  123 0.301226228 192.168.1.16 → 10.6.15.144  TCP 66 59298 → 22 [ACK] Seq=497 Ack=78509 Win=3666 Len=0 TSval=3737275 TSecr=4333605
  124 0.301410697  10.6.15.144 → 192.168.1.16 SSH 1514 Server: Encrypted packet (len=1448)
  125 0.301418036 192.168.1.16 → 10.6.15.144  TCP 66 59298 → 22 [ACK] Seq=497 Ack=79957 Win=3666 Len=0 TSval=3737275 TSecr=4333605
  126 0.311526513  10.6.15.144 → 192.168.1.16 SSH 1514 Server: Encrypted packet (len=1448)
  127 0.311553668 192.168.1.16 → 10.6.15.144  TCP 66 59298 → 22 [ACK] Seq=497 Ack=81405 Win=3666 Len=0 TSval=3737278 TSecr=4333608
  128 0.311673452  10.6.15.144 → 192.168.1.16 SSH 1514 Server: Encrypted packet (len=1448)
  129 0.311678483 192.168.1.16 → 10.6.15.144  TCP 66 59298 → 22 [ACK] Seq=497 Ack=82853 Win=3666 Len=0 TSval=3737278 TSecr=4333608
  130 0.312012823  10.6.15.144 → 192.168.1.16 SSH 1514 Server: Encrypted packet (len=1448)
  131 0.312016648 192.168.1.16 → 10.6.15.144  TCP 66 59298 → 22 [ACK] Seq=497 Ack=84301 Win=3666 Len=0 TSval=3737278 TSecr=4333608
  132 0.323628042  10.6.15.144 → 192.168.1.16 SSH 1514 Server: Encrypted packet (len=1448)
  133 0.323643752 192.168.1.16 → 10.6.15.144  TCP 66 59298 → 22 [ACK] Seq=497 Ack=85749 Win=3666 Len=0 TSval=3737281 TSecr=4333611
  134 0.323792716  10.6.15.144 → 192.168.1.16 SSH 1514 Server: Encrypted packet (len=1448)
  135 0.323796862 192.168.1.16 → 10.6.15.144  TCP 66 59298 → 22 [ACK] Seq=497 Ack=87197 Win=3666 Len=0 TSval=3737281 TSecr=4333611
  136 0.323984601  10.6.15.144 → 192.168.1.16 SSH 1514 Server: Encrypted packet (len=1448)
  137 0.323988025 192.168.1.16 → 10.6.15.144  TCP 66 59298 → 22 [ACK] Seq=497 Ack=88645 Win=3666 Len=0 TSval=3737281 TSecr=4333611
  138 0.324175987  10.6.15.144 → 192.168.1.16 SSH 1514 Server: Encrypted packet (len=1448)
  139 0.324179362 192.168.1.16 → 10.6.15.144  TCP 66 59298 → 22 [ACK] Seq=497 Ack=90093 Win=3666 Len=0 TSval=3737281 TSecr=4333611
  140 0.334726631  10.6.15.144 → 192.168.1.16 SSH 1514 Server: Encrypted packet (len=1448)
  141 0.334743900 192.168.1.16 → 10.6.15.144  TCP 66 59298 → 22 [ACK] Seq=497 Ack=91541 Win=3666 Len=0 TSval=3737284 TSecr=4333614
  142 0.334904168  10.6.15.144 → 192.168.1.16 SSH 1514 Server: Encrypted packet (len=1448)
  143 0.334908602 192.168.1.16 → 10.6.15.144  TCP 66 59298 → 22 [ACK] Seq=497 Ack=92989 Win=3666 Len=0 TSval=3737284 TSecr=4333614
  144 0.340409583  10.6.15.144 → 192.168.1.16 SSH 1514 Server: Encrypted packet (len=1448)
  145 0.340426055 192.168.1.16 → 10.6.15.144  TCP 66 59298 → 22 [ACK] Seq=497 Ack=94437 Win=3666 Len=0 TSval=3737285 TSecr=4333614
  146 0.340505983  10.6.15.144 → 192.168.1.16 SSH 998 Server: Encrypted packet (len=932)
  147 0.340522940 192.168.1.16 → 10.6.15.144  TCP 66 59298 → 22 [ACK] Seq=497 Ack=95369 Win=3666 Len=0 TSval=3737285 TSecr=4333614
  148 0.340765793 192.168.1.16 → 10.6.15.144  SSH 102 Client: Encrypted packet (len=36)
  149 0.344553729 192.168.1.16 → 10.6.15.144  SSH 638 Client: Encrypted packet (len=572)
  150 0.365607935  10.6.15.144 → 192.168.1.16 SSH 998 Server: [TCP Spurious Retransmission] , Encrypted packet (len=932)
  151 0.365628265 192.168.1.16 → 10.6.15.144  TCP 78 [TCP Dup ACK 147#1] 59298 → 22 [ACK] Seq=1105 Ack=95369 Win=3666 Len=0 TSval=3737291 TSecr=4333622 SLE=94437 SRE=95369
  152 0.398081892 192.168.1.16 → 10.6.15.144  TCP 638 [TCP Retransmission] 59298 → 22 [PSH, ACK] Seq=533 Ack=95369 Win=3666 Len=572 TSval=3737300 TSecr=4333622
  153 0.411845940  10.6.15.144 → 192.168.1.16 SSH 138 Server: Encrypted packet (len=72)
  154 0.411872255 192.168.1.16 → 10.6.15.144  TCP 66 59298 → 22 [ACK] Seq=1105 Ack=95441 Win=3666 Len=0 TSval=3737303 TSecr=4333633
  155 0.411889210  10.6.15.144 → 192.168.1.16 TCP 66 22 → 59298 [ACK] Seq=95441 Ack=1105 Win=1452 Len=0 TSval=4333633 TSecr=3737285
  156 0.411898416  10.6.15.144 → 192.168.1.16 TCP 78 [TCP Dup ACK 155#1] 22 → 59298 [ACK] Seq=95441 Ack=1105 Win=1452 Len=0 TSval=4333633 TSecr=3737300 SLE=533 SRE=1105
  157 0.412184865 192.168.1.16 → 10.6.15.144  SSH 102 Client: Encrypted packet (len=36)
  158 0.424891098  10.6.15.144 → 192.168.1.16 TCP 66 22 → 59298 [ACK] Seq=95441 Ack=1141 Win=1452 Len=0 TSval=4333636 TSecr=3737303
  159 0.440136166  10.6.15.144 → 192.168.1.16 SSH 254 Server: Encrypted packet (len=188)
  160 0.440454437 192.168.1.16 → 10.6.15.144  SSH 134 Client: Encrypted packet (len=68)
  161 0.441015724 192.168.1.16 → 10.6.15.144  SSH 1514 Client: Encrypted packet (len=1448)
  162 0.441022691 192.168.1.16 → 10.6.15.144  SSH 1514 Client: Encrypted packet (len=1448)
  163 0.441699614 192.168.1.16 → 10.6.15.144  SSH 1310 Client: Encrypted packet (len=1244)
  164 0.451335726  10.6.15.144 → 192.168.1.16 SSH 1514 Server: Encrypted packet (len=1448)
  165 0.451393240  10.6.15.144 → 192.168.1.16 SSH 1102 Server: Encrypted packet (len=1036)
  166 0.451403633 192.168.1.16 → 10.6.15.144  TCP 66 59298 → 22 [ACK] Seq=5349 Ack=98113 Win=3666 Len=0 TSval=3737313 TSecr=4333643
  167 0.452763971 192.168.1.16 → 10.6.15.144  SSH 350 Client: Encrypted packet (len=284)
  168 0.456535568  10.6.15.144 → 192.168.1.16 TCP 66 22 → 59298 [ACK] Seq=98113 Ack=4105 Win=1452 Len=0 TSval=4333644 TSecr=3737310
  169 0.463392157  10.6.15.144 → 192.168.1.16 SSH 1514 Server: Encrypted packet (len=1448)
  170 0.463512345  10.6.15.144 → 192.168.1.16 SSH 1514 Server: Encrypted packet (len=1448)
  171 0.463520869 192.168.1.16 → 10.6.15.144  TCP 66 59298 → 22 [ACK] Seq=5633 Ack=101009 Win=3666 Len=0 TSval=3737316 TSecr=4333646
  172 0.463735164  10.6.15.144 → 192.168.1.16 SSH 1514 Server: Encrypted packet (len=1448)
  173 0.490760499  10.6.15.144 → 192.168.1.16 SSH 138 Server: [TCP Previous segment not captured] , Encrypted packet (len=72)
  174 0.490781024 192.168.1.16 → 10.6.15.144  TCP 78 59298 → 22 [ACK] Seq=5633 Ack=102457 Win=3666 Len=0 TSval=3737323 TSecr=4333646 SLE=103181 SRE=103253
  175 1.109568267 192.168.1.16 → 54.76.71.168 TCP 128 42414 → 8282 [PSH, ACK] Seq=1 Ack=1 Win=296 Len=62 TSval=3737477 TSecr=607846505
  176 1.147146571  192.168.1.1 → 239.255.255.250 SSDP 382 NOTIFY * HTTP/1.1 
  177 1.147657517  192.168.1.1 → 239.255.255.250 SSDP 364 NOTIFY * HTTP/1.1 
  178 1.148235513  192.168.1.1 → 239.255.255.250 SSDP 366 NOTIFY * HTTP/1.1 
  179 1.148723966  192.168.1.1 → 239.255.255.250 SSDP 302 NOTIFY * HTTP/1.1 
  180 1.149219693  192.168.1.1 → 239.255.255.250 SSDP 311 NOTIFY * HTTP/1.1 
  181 1.151361078  192.168.1.1 → 239.255.255.250 SSDP 382 NOTIFY * HTTP/1.1 
  182 1.151950598  192.168.1.1 → 239.255.255.250 SSDP 364 NOTIFY * HTTP/1.1 
  183 1.152505934  192.168.1.1 → 239.255.255.250 SSDP 366 NOTIFY * HTTP/1.1 
  184 1.152573176 10.22.18.209 → 224.0.0.252  LLMNR 64 Standard query 0x44e8 A wpad
  185 1.152593401  10.22.18.77 → 224.0.0.252  LLMNR 64 Standard query 0x4647 A wpad
  186 1.152718780  10.6.15.144 → 192.168.1.16 TCP 790 [TCP Retransmission] 22 → 59298 [PSH, ACK] Seq=102457 Ack=5633 Win=1452 Len=724 TSval=4333713 TSecr=3737323
  187 1.152737365 192.168.1.16 → 10.6.15.144  TCP 66 59298 → 22 [ACK] Seq=5633 Ack=103253 Win=3666 Len=0 TSval=3737488 TSecr=4333713
  188 1.152748367 10.22.18.209 → 224.0.0.252  LLMNR 64 Standard query 0x44e8 A wpad
  189 1.153045953 192.168.1.16 → 10.6.15.144  SSH 102 Client: Encrypted packet (len=36)
  190 1.153880479 192.168.1.16 → 10.6.15.144  SSH 174 Client: Encrypted packet (len=108)
  191 1.163910595  10.6.15.144 → 192.168.1.16 SSH 1514 Server: Encrypted packet (len=1448)
  192 1.164076557  10.6.15.144 → 192.168.1.16 SSH 1514 Server: Encrypted packet (len=1448)
  193 1.164087527 192.168.1.16 → 10.6.15.144  TCP 66 59298 → 22 [ACK] Seq=5777 Ack=106149 Win=3666 Len=0 TSval=3737491 TSecr=4333821
  194 1.164225358  10.6.15.144 → 192.168.1.16 SSH 1514 Server: Encrypted packet (len=1448)
  195 1.201462198  10.6.15.144 → 192.168.1.16 TCP 66 22 → 59298 [ACK] Seq=107597 Ack=5669 Win=1452 Len=0 TSval=4333831 TSecr=3737488
  196 1.201808283  10.6.15.144 → 192.168.1.16 SSH 1514 Server: Encrypted packet (len=1448)
  197 1.201823886 192.168.1.16 → 10.6.15.144  TCP 66 59298 → 22 [ACK] Seq=5777 Ack=109045 Win=3666 Len=0 TSval=3737500 TSecr=4333821
  198 1.202125315  10.6.15.144 → 192.168.1.16 SSH 1514 Server: Encrypted packet (len=1448)
  199 1.206532641 192.168.1.16 → 10.6.15.144  SSH 1514 Client: Encrypted packet (len=1448)
  200 1.206553591 192.168.1.16 → 10.6.15.144  SSH 1514 Client: Encrypted packet (len=1448)
  201 1.207242806 192.168.1.16 → 10.6.15.144  SSH 598 Client: Encrypted packet (len=532)
  202 1.213459299  10.6.15.144 → 192.168.1.16 SSH 1514 Server: Encrypted packet (len=1448)
  203 1.213638230  10.6.15.144 → 192.168.1.16 SSH 1514 Server: Encrypted packet (len=1448)
  204 1.213647265 192.168.1.16 → 10.6.15.144  TCP 66 59298 → 22 [ACK] Seq=9205 Ack=113389 Win=3666 Len=0 TSval=3737503 TSecr=4333833
  205 1.221304414 192.168.1.16 → 10.6.15.144  SSH 102 Client: Encrypted packet (len=36)
  206 1.224250863  10.6.15.144 → 192.168.1.16 SSH 1514 Server: Encrypted packet (len=1436)
  207 1.224279929  10.6.15.144 → 192.168.1.16 TCP 78 [TCP Dup ACK 195#1] 22 → 59298 [ACK] Seq=114825 Ack=5669 Win=1452 Len=0 TSval=4333836 TSecr=3737488 SLE=5777 SRE=8673
  208 1.224285927  10.6.15.144 → 192.168.1.16 TCP 78 [TCP Dup ACK 195#2] 22 → 59298 [ACK] Seq=114825 Ack=5669 Win=1452 Len=0 TSval=4333836 TSecr=3737488 SLE=5777 SRE=9205
  209 1.224297403 192.168.1.16 → 10.6.15.144  SSH 174 Client: [TCP Fast Retransmission] , Encrypted packet (len=108)
  210 1.224315641  10.6.15.144 → 192.168.1.16 SSH 90 Server: Encrypted packet (len=12)
  211 1.224486151  10.6.15.144 → 192.168.1.16 SSH 1514 Server: Encrypted packet (len=1436)
  212 1.224521115 192.168.1.16 → 10.6.15.144  TCP 66 59298 → 22 [ACK] Seq=9241 Ack=116273 Win=3666 Len=0 TSval=3737506 TSecr=4333836
  213 1.232060502  10.6.15.144 → 192.168.1.16 TCP 78 [TCP Dup ACK 195#3] 22 → 59298 [ACK] Seq=116273 Ack=5669 Win=1452 Len=0 TSval=4333838 TSecr=3737488 SLE=5777 SRE=9241
  214 1.232089193 192.168.1.16 → 10.6.15.144  SSH 118 Client: Encrypted packet (len=52)
  215 1.237198229  10.6.15.144 → 192.168.1.16 SSH 1514 Server: Encrypted packet (len=1448)
  216 1.237229331  10.6.15.144 → 192.168.1.16 SSH 78 Server: Encrypted packet (len=12)
  217 1.237240259 192.168.1.16 → 10.6.15.144  TCP 66 59298 → 22 [ACK] Seq=9293 Ack=117733 Win=3666 Len=0 TSval=3737509 TSecr=4333839
  218 1.237550368  10.6.15.144 → 192.168.1.16 SSH 1514 Server: Encrypted packet (len=1448)
  219 1.248142988  10.6.15.144 → 192.168.1.16 SSH 1514 Server: Encrypted packet (len=1448)
  220 1.248171541 192.168.1.16 → 10.6.15.144  TCP 66 59298 → 22 [ACK] Seq=9293 Ack=120629 Win=3666 Len=0 TSval=3737512 TSecr=4333839
  221 1.248188910  10.6.15.144 → 192.168.1.16 SSH 606 Server: Encrypted packet (len=540)
  222 1.262954837  10.6.15.144 → 192.168.1.16 SSH 138 Server: Encrypted packet (len=72)
  223 1.263023770 192.168.1.16 → 10.6.15.144  TCP 66 59298 → 22 [ACK] Seq=9293 Ack=121241 Win=3666 Len=0 TSval=3737516 TSecr=4333842
  224 1.263256487 192.168.1.16 → 10.6.15.144  SSH 102 Client: Encrypted packet (len=36)
  225 1.271195652  10.6.15.144 → 192.168.1.16 SSH 110 Server: Encrypted packet (len=44)
  226 1.272708135 192.168.1.16 → 10.6.15.144  SSH 166 Client: Encrypted packet (len=100)
  227 1.273940823  10.6.15.144 → 192.168.1.16 SSH 198 Server: Encrypted packet (len=132)
  228 1.283438327  10.6.15.144 → 192.168.1.16 TCP 66 22 → 59298 [ACK] Seq=121417 Ack=9429 Win=1452 Len=0 TSval=4333851 TSecr=3737516
  229 1.300359088  10.6.15.144 → 192.168.1.16 SSH 1514 Server: Encrypted packet (len=1448)
  230 1.300380728 192.168.1.16 → 10.6.15.144  TCP 66 59298 → 22 [ACK] Seq=9429 Ack=122865 Win=3666 Len=0 TSval=3737525 TSecr=4333849
  231 1.300406038  10.6.15.144 → 192.168.1.16 SSH 190 Server: Encrypted packet (len=124)
  232 1.311262079 54.76.71.168 → 192.168.1.16 TCP 66 8282 → 42414 [ACK] Seq=1 Ack=63 Win=121 Len=0 TSval=607849464 TSecr=3737477
  233 1.311481536  10.6.15.144 → 192.168.1.16 SSH 1514 Server: Encrypted packet (len=1448)
  234 1.311492461 192.168.1.16 → 10.6.15.144  TCP 66 59298 → 22 [ACK] Seq=9429 Ack=124437 Win=3666 Len=0 TSval=3737528 TSecr=4333855
  235 1.311674141  10.6.15.144 → 192.168.1.16 SSH 1514 Server: Encrypted packet (len=1448)
  236 1.323933663  10.6.15.144 → 192.168.1.16 SSH 1514 Server: Encrypted packet (len=1448)
  237 1.323952794 192.168.1.16 → 10.6.15.144  TCP 66 59298 → 22 [ACK] Seq=9429 Ack=127333 Win=3666 Len=0 TSval=3737531 TSecr=4333858
  238 1.324110848  10.6.15.144 → 192.168.1.16 SSH 1514 Server: Encrypted packet (len=1448)
  239 1.335182612  10.6.15.144 → 192.168.1.16 SSH 1514 Server: Encrypted packet (len=1448)
  240 1.335202779 192.168.1.16 → 10.6.15.144  TCP 66 59298 → 22 [ACK] Seq=9429 Ack=130229 Win=3666 Len=0 TSval=3737534 TSecr=4333861
  241 1.343183642  10.6.15.144 → 192.168.1.16 SSH 1514 Server: [TCP Previous segment not captured] , Encrypted packet (len=1448)
  242 1.343205485 192.168.1.16 → 10.6.15.144  TCP 78 [TCP Dup ACK 240#1] 59298 → 22 [ACK] Seq=9429 Ack=130229 Win=3666 Len=0 TSval=3737536 TSecr=4333861 SLE=131677 SRE=133125
  243 1.345627586  10.6.15.144 → 192.168.1.16 SSH 1514 Server: Encrypted packet (len=1448)
  244 1.345649842 192.168.1.16 → 10.6.15.144  TCP 78 [TCP Dup ACK 240#2] 59298 → 22 [ACK] Seq=9429 Ack=130229 Win=3666 Len=0 TSval=3737536 TSecr=4333861 SLE=131677 SRE=134573
  245 1.353681773  10.6.15.144 → 192.168.1.16 SSH 1514 Server: Encrypted packet (len=1448)
  246 1.353702592 192.168.1.16 → 10.6.15.144  TCP 78 [TCP Dup ACK 240#3] 59298 → 22 [ACK] Seq=9429 Ack=130229 Win=3666 Len=0 TSval=3737538 TSecr=4333861 SLE=131677 SRE=136021
  247 1.353859642  10.6.15.144 → 192.168.1.16 SSH 1514 Server: Encrypted packet (len=1448)
  248 1.353866752 192.168.1.16 → 10.6.15.144  TCP 78 [TCP Dup ACK 240#4] 59298 → 22 [ACK] Seq=9429 Ack=130229 Win=3666 Len=0 TSval=3737538 TSecr=4333861 SLE=131677 SRE=137469
  249 1.357546143  10.6.15.144 → 192.168.1.16 SSH 1514 Server: Encrypted packet (len=1448)
  250 1.357557345 192.168.1.16 → 10.6.15.144  TCP 78 [TCP Dup ACK 240#5] 59298 → 22 [ACK] Seq=9429 Ack=130229 Win=3666 Len=0 TSval=3737539 TSecr=4333861 SLE=131677 SRE=138917
  251 1.368009330  10.6.15.144 → 192.168.1.16 SSH 1514 Server: [TCP Fast Retransmission] , Encrypted packet (len=1448)
  252 1.368044609 192.168.1.16 → 10.6.15.144  TCP 66 59298 → 22 [ACK] Seq=9429 Ack=138917 Win=3666 Len=0 TSval=3737542 TSecr=4333872
  253 1.368181780  10.6.15.144 → 192.168.1.16 SSH 622 Server: Encrypted packet (len=556)
  254 1.368189445 192.168.1.16 → 10.6.15.144  TCP 66 59298 → 22 [ACK] Seq=9429 Ack=139473 Win=3666 Len=0 TSval=3737542 TSecr=4333872
  255 1.369505194 192.168.1.16 → 10.6.15.144  SSH 206 Client: Encrypted packet (len=140)
  256 1.411108264  10.6.15.144 → 192.168.1.16 SSH 398 Server: Encrypted packet (len=332)
  257 1.454058125 192.168.1.16 → 10.6.15.144  TCP 66 59298 → 22 [ACK] Seq=9569 Ack=139805 Win=3666 Len=0 TSval=3737564 TSecr=4333883
  258 1.454414597  10.6.15.144 → 192.168.1.16 SSH 590 Server: Encrypted packet (len=524)
  259 1.454431837 192.168.1.16 → 10.6.15.144  TCP 66 59298 → 22 [ACK] Seq=9569 Ack=140329 Win=3666 Len=0 TSval=3737564 TSecr=4333894
  260 1.454553637  10.6.15.144 → 192.168.1.16 SSH 982 Server: Encrypted packet (len=916)
  261 1.454558866 192.168.1.16 → 10.6.15.144  TCP 66 59298 → 22 [ACK] Seq=9569 Ack=141245 Win=3666 Len=0 TSval=3737564 TSecr=4333894
  262 1.465179505  10.6.15.144 → 192.168.1.16 SSH 1514 Server: [TCP Previous segment not captured] , Encrypted packet (len=1448)
  263 1.465201197 192.168.1.16 → 10.6.15.144  TCP 78 [TCP Dup ACK 261#1] 59298 → 22 [ACK] Seq=9569 Ack=141245 Win=3666 Len=0 TSval=3737566 TSecr=4333894 SLE=142693 SRE=144141
  264 1.465360270  10.6.15.144 → 192.168.1.16 SSH 1514 Server: Encrypted packet (len=1448)
  265 1.465369084 192.168.1.16 → 10.6.15.144  TCP 78 [TCP Dup ACK 261#2] 59298 → 22 [ACK] Seq=9569 Ack=141245 Win=3666 Len=0 TSval=3737566 TSecr=4333894 SLE=142693 SRE=145589
  266 1.466958577 192.168.1.16 → 10.6.15.144  SSH 114 Client: Encrypted packet (len=36)
  267 1.467152949 192.168.1.16 → 10.6.15.144  SSH 114 Client: Encrypted packet (len=36)
  268 1.467842222 192.168.1.16 → 10.6.15.144  SSH 294 Client: Encrypted packet (len=216)
  269 1.476688776  10.6.15.144 → 192.168.1.16 SSH 1514 Server: Encrypted packet (len=1448)
  270 1.476714934 192.168.1.16 → 10.6.15.144  TCP 78 [TCP Dup ACK 261#3] 59298 → 22 [ACK] Seq=9857 Ack=141245 Win=3666 Len=0 TSval=3737569 TSecr=4333894 SLE=142693 SRE=147037
  271 1.476869547  10.6.15.144 → 192.168.1.16 SSH 1514 Server: Encrypted packet (len=1448)
  272 1.476880378 192.168.1.16 → 10.6.15.144  TCP 78 [TCP Dup ACK 261#4] 59298 → 22 [ACK] Seq=9857 Ack=141245 Win=3666 Len=0 TSval=3737569 TSecr=4333894 SLE=142693 SRE=148485
  273 1.476995545  10.6.15.144 → 192.168.1.16 TCP 66 22 → 59298 [ACK] Seq=148485 Ack=9641 Win=1452 Len=0 TSval=4333900 TSecr=3737567
  274 1.477003870 192.168.1.16 → 10.6.15.144  SSH 478 Client: Encrypted packet (len=400)
  275 1.477984669 192.168.1.16 → 10.6.15.144  SSH 1514 Client: Encrypted packet (len=1436)
  276 1.478283951 192.168.1.16 → 10.6.15.144  SSH 1514 Client: Encrypted packet (len=1436)
  277 1.488091306  10.6.15.144 → 192.168.1.16 SSH 1514 Server: [TCP Fast Retransmission] , Encrypted packet (len=1448)
  278 1.488114955 192.168.1.16 → 10.6.15.144  SSH 786 Client: Encrypted packet (len=720)
  279 1.488257545  10.6.15.144 → 192.168.1.16 SSH 1514 Server: Encrypted packet (len=1448)
  280 1.490646860  10.6.15.144 → 192.168.1.16 TCP 66 22 → 59298 [ACK] Seq=149933 Ack=11693 Win=1452 Len=0 TSval=4333903 TSecr=3737569
  281 1.530053192 192.168.1.16 → 10.6.15.144  TCP 66 59298 → 22 [ACK] Seq=13849 Ack=149933 Win=3666 Len=0 TSval=3737583 TSecr=4333902
  282 1.534055297 192.168.1.16 → 10.6.15.144  TCP 786 [TCP Retransmission] 59298 → 22 [PSH, ACK] Seq=13129 Ack=149933 Win=3666 Len=720 TSval=3737584 TSecr=4333902
  283 1.537128994  10.6.15.144 → 192.168.1.16 SSH 1514 Server: [TCP Previous segment not captured] , Encrypted packet (len=1448)
  284 1.537148862 192.168.1.16 → 10.6.15.144  TCP 78 [TCP Dup ACK 281#1] 59298 → 22 [ACK] Seq=13849 Ack=149933 Win=3666 Len=0 TSval=3737584 TSecr=4333902 SLE=151381 SRE=152829
  285 1.538936867  10.6.15.144 → 192.168.1.16 SSH 262 Server: Encrypted packet (len=196)
  286 1.538951843 192.168.1.16 → 10.6.15.144  TCP 78 [TCP Dup ACK 281#2] 59298 → 22 [ACK] Seq=13849 Ack=149933 Win=3666 Len=0 TSval=3737585 TSecr=4333902 SLE=151381 SRE=153025
  287 1.543133080  10.6.15.144 → 192.168.1.16 TCP 78 [TCP Dup ACK 283#1] 22 → 59298 [ACK] Seq=153025 Ack=13849 Win=1452 Len=0 TSval=4333916 TSecr=3737584 SLE=13129 SRE=13849
  288 1.610071001  10.6.15.144 → 192.168.1.16 SSH 678 Server: Encrypted packet (len=612)
  289 1.610091176 192.168.1.16 → 10.6.15.144  TCP 78 [TCP Dup ACK 281#3] 59298 → 22 [ACK] Seq=13849 Ack=149933 Win=3666 Len=0 TSval=3737603 TSecr=4333902 SLE=151381 SRE=153637
  290 1.611356881  10.6.15.144 → 192.168.1.16 SSH 1430 Server: Encrypted packet (len=1364)
  291 1.611373832 192.168.1.16 → 10.6.15.144  TCP 78 [TCP Dup ACK 281#4] 59298 → 22 [ACK] Seq=13849 Ack=149933 Win=3666 Len=0 TSval=3737603 TSecr=4333902 SLE=151381 SRE=155001
  292 1.621031508  10.6.15.144 → 192.168.1.16 SSH 1514 Server: [TCP Fast Retransmission] , Encrypted packet (len=1448)
  293 1.621054087 192.168.1.16 → 10.6.15.144  TCP 66 59298 → 22 [ACK] Seq=13849 Ack=155001 Win=3666 Len=0 TSval=3737605 TSecr=4333935
  294 1.621941728  10.6.15.144 → 192.168.1.16 SSH 1514 Server: Encrypted packet (len=1448)
  295 1.621950749 192.168.1.16 → 10.6.15.144  TCP 66 59298 → 22 [ACK] Seq=13849 Ack=156449 Win=3666 Len=0 TSval=3737605 TSecr=4333936
  296 1.622110936 192.168.1.16 → 10.6.15.144  SSH 462 Client: Encrypted packet (len=396)
  297 1.624358050 192.168.1.16 → 10.6.15.144  SSH 1490 Client: Encrypted packet (len=1424)
  298 1.633132165  10.6.15.144 → 192.168.1.16 SSH 1514 Server: Encrypted packet (len=1448)
  299 1.633315799  10.6.15.144 → 192.168.1.16 SSH 1514 Server: Encrypted packet (len=1448)
  300 1.633325323 192.168.1.16 → 10.6.15.144  TCP 66 59298 → 22 [ACK] Seq=15669 Ack=159345 Win=3666 Len=0 TSval=3737608 TSecr=4333938
  301 1.633507499  10.6.15.144 → 192.168.1.16 SSH 1514 Server: Encrypted packet (len=1448)
  302 1.633634944  10.6.15.144 → 192.168.1.16 TCP 66 22 → 59298 [ACK] Seq=160793 Ack=14245 Win=1452 Len=0 TSval=4333939 TSecr=3737606
  303 1.634417298  10.6.15.144 → 192.168.1.16 TCP 66 22 → 59298 [ACK] Seq=160793 Ack=15669 Win=1452 Len=0 TSval=4333939 TSecr=3737606
  304 1.644560231  10.6.15.144 → 192.168.1.16 SSH 1514 Server: [TCP Previous segment not captured] , Encrypted packet (len=1448)
  305 1.644583465 192.168.1.16 → 10.6.15.144  TCP 78 59298 → 22 [ACK] Seq=15669 Ack=160793 Win=3666 Len=0 TSval=3737611 TSecr=4333938 SLE=162241 SRE=163689
  306 1.655249507  10.6.15.144 → 192.168.1.16 SSH 1514 Server: Encrypted packet (len=1448)
  307 1.655272587 192.168.1.16 → 10.6.15.144  TCP 78 [TCP Dup ACK 305#1] 59298 → 22 [ACK] Seq=15669 Ack=160793 Win=3666 Len=0 TSval=3737614 TSecr=4333938 SLE=162241 SRE=165137
  308 1.655416071  10.6.15.144 → 192.168.1.16 SSH 1438 Server: Encrypted packet (len=1372)
  309 1.655425899 192.168.1.16 → 10.6.15.144  TCP 78 [TCP Dup ACK 305#2] 59298 → 22 [ACK] Seq=15669 Ack=160793 Win=3666 Len=0 TSval=3737614 TSecr=4333938 SLE=162241 SRE=166509
  310 1.665803459  10.6.15.144 → 192.168.1.16 SSH 866 Server: Encrypted packet (len=800)
  311 1.665821503 192.168.1.16 → 10.6.15.144  TCP 78 [TCP Dup ACK 305#3] 59298 → 22 [ACK] Seq=15669 Ack=160793 Win=3666 Len=0 TSval=3737616 TSecr=4333938 SLE=162241 SRE=167309
  312 1.666001861  10.6.15.144 → 192.168.1.16 SSH 1514 Server: [TCP Fast Retransmission] , Encrypted packet (len=1448)
  313 1.666010920 192.168.1.16 → 10.6.15.144  TCP 66 59298 → 22 [ACK] Seq=15669 Ack=167309 Win=3666 Len=0 TSval=3737616 TSecr=4333947
  314 1.666501160 192.168.1.16 → 10.6.15.144  SSH 134 Client: Encrypted packet (len=68)
  315 1.667534387 192.168.1.16 → 10.6.15.144  SSH 202 Client: Encrypted packet (len=136)
  316 1.668929428 192.168.1.16 → 10.6.15.144  SSH 1514 Client: Encrypted packet (len=1448)
  317 1.673509571 192.168.1.16 → 10.6.15.144  SSH 1514 Client: Encrypted packet (len=1448)
  318 1.673521698 192.168.1.16 → 10.6.15.144  SSH 402 Client: Encrypted packet (len=336)
  319 1.676164023  10.6.15.144 → 192.168.1.16 SSH 446 Server: Encrypted packet (len=380)
  320 1.682200443  10.6.15.144 → 192.168.1.16 TCP 66 22 → 59298 [ACK] Seq=167689 Ack=15873 Win=1452 Len=0 TSval=4333951 TSecr=3737617
  321 1.682234081 192.168.1.16 → 10.6.15.144  SSH 270 Client: Encrypted packet (len=204)
  322 1.684435165  10.6.15.144 → 192.168.1.16 TCP 66 22 → 59298 [ACK] Seq=167689 Ack=19105 Win=1452 Len=0 TSval=4333951 TSecr=3737617
  323 1.734349154  10.6.15.144 → 192.168.1.16 TCP 66 22 → 59298 [ACK] Seq=167689 Ack=19309 Win=1452 Len=0 TSval=4333964 TSecr=3737621
  324 1.755138897  10.6.15.144 → 192.168.1.16 SSH 814 Server: Encrypted packet (len=748)
  325 1.766611376  10.6.15.144 → 192.168.1.16 SSH 270 Server: Encrypted packet (len=204)
  326 1.766687666 192.168.1.16 → 10.6.15.144  TCP 66 59298 → 22 [ACK] Seq=19309 Ack=168641 Win=3666 Len=0 TSval=3737642 TSecr=4333969
  327 1.766895634  10.6.15.144 → 192.168.1.16 SSH 1150 Server: Encrypted packet (len=1084)
  328 1.782594312  10.6.15.144 → 192.168.1.16 SSH 1514 Server: Encrypted packet (len=1448)
  329 1.782610635 192.168.1.16 → 10.6.15.144  TCP 66 59298 → 22 [ACK] Seq=19309 Ack=171173 Win=3666 Len=0 TSval=3737646 TSecr=4333972
  330 1.782783656  10.6.15.144 → 192.168.1.16 SSH 1514 Server: Encrypted packet (len=1448)
  331 1.794785043  10.6.15.144 → 192.168.1.16 SSH 1514 Server: Encrypted packet (len=1448)
  332 1.794800916 192.168.1.16 → 10.6.15.144  TCP 66 59298 → 22 [ACK] Seq=19309 Ack=174069 Win=3666 Len=0 TSval=3737649 TSecr=4333974
  333 1.794968988  10.6.15.144 → 192.168.1.16 SSH 1514 Server: Encrypted packet (len=1448)
  334 1.806445166  10.6.15.144 → 192.168.1.16 SSH 1514 Server: Encrypted packet (len=1448)
  335 1.806459777 192.168.1.16 → 10.6.15.144  TCP 66 59298 → 22 [ACK] Seq=19309 Ack=176965 Win=3666 Len=0 TSval=3737652 TSecr=4333979
  336 1.806633527  10.6.15.144 → 192.168.1.16 SSH 1514 Server: Encrypted packet (len=1448)
  337 1.818221561  10.6.15.144 → 192.168.1.16 SSH 1514 Server: Encrypted packet (len=1448)
  338 1.818236421 192.168.1.16 → 10.6.15.144  TCP 66 59298 → 22 [ACK] Seq=19309 Ack=179861 Win=3666 Len=0 TSval=3737655 TSecr=4333982
  339 1.818406967  10.6.15.144 → 192.168.1.16 SSH 1514 Server: Encrypted packet (len=1448)
  340 1.828820197  10.6.15.144 → 192.168.1.16 SSH 1514 Server: Encrypted packet (len=1448)
  341 1.828842183 192.168.1.16 → 10.6.15.144  TCP 66 59298 → 22 [ACK] Seq=19309 Ack=182757 Win=3666 Len=0 TSval=3737657 TSecr=4333985
  342 1.829000554  10.6.15.144 → 192.168.1.16 SSH 1514 Server: Encrypted packet (len=1448)
  343 1.831225091 192.168.1.16 → 10.6.15.144  SSH 102 Client: Encrypted packet (len=36)
  344 1.832566987 192.168.1.16 → 10.6.15.144  SSH 110 Client: Encrypted packet (len=44)
  345 1.839536747  10.6.15.144 → 192.168.1.16 SSH 1514 Server: Encrypted packet (len=1448)
  346 1.839594027  10.6.15.144 → 192.168.1.16 SSH 694 Server: Encrypted packet (len=628)
  347 1.839609022 192.168.1.16 → 10.6.15.144  TCP 66 59298 → 22 [ACK] Seq=19389 Ack=186281 Win=3666 Len=0 TSval=3737660 TSecr=4333990
  348 1.842569649  10.6.15.144 → 192.168.1.16 TCP 66 22 → 59298 [ACK] Seq=186281 Ack=19389 Win=1452 Len=0 TSval=4333991 TSecr=3737658
  349 1.869276038  10.6.15.144 → 192.168.1.16 SSH 110 Server: Encrypted packet (len=44)
  350 1.869587242 192.168.1.16 → 10.6.15.144  SSH 158 Client: Encrypted packet (len=92)
  351 1.871422400  10.6.15.144 → 192.168.1.16 SSH 138 Server: Encrypted packet (len=72)
  352 1.871613604 192.168.1.16 → 10.6.15.144  SSH 102 Client: Encrypted packet (len=36)
  353 1.883863316  10.6.15.144 → 192.168.1.16 TCP 66 22 → 59298 [ACK] Seq=186397 Ack=19517 Win=1452 Len=0 TSval=4334001 TSecr=3737667
