    1 0.000000000 192.168.1.16 → 10.6.15.144  SSH 102 Client: Encrypted packet (len=36)
    2 0.479974178 192.168.1.16 → 10.6.15.144  TCP 102 [TCP Retransmission] 59298 → 22 [PSH, ACK] Seq=1 Ack=1 Win=5703 Len=36 TSval=5880848 TSecr=6476960
    3 0.530568427  10.6.15.144 → 192.168.1.16 TCP 66 22 → 59298 [ACK] Seq=1 Ack=37 Win=1452 Len=0 TSval=6477236 TSecr=5880848
    4 1.922221646  10.6.15.144 → 192.168.1.16 SSH 126 Server: Encrypted packet (len=60)
    5 1.922244615  10.6.15.144 → 192.168.1.16 TCP 126 [TCP Retransmission] 22 → 59298 [PSH, ACK] Seq=1 Ack=37 Win=1452 Len=60 TSval=6477426 TSecr=5880848
    6 1.922253504 192.168.1.16 → 10.6.15.144  TCP 78 59298 → 22 [ACK] Seq=37 Ack=61 Win=5703 Len=0 TSval=5881208 TSecr=6477426 SLE=1 SRE=61
    7 2.597978211 192.168.1.16 → 139.59.21.22 NTP 90 NTP Version 4, client
    8 3.488051317 192.168.1.16 → 54.76.71.168 TCP 128 42414 → 8282 [PSH, ACK] Seq=1 Ack=1 Win=296 Len=62 TSval=5881600 TSecr=609986663
    9 3.818364222  10.22.17.72 → 224.0.0.252  LLMNR 66 Standard query 0x193e A DELL35
   10 3.818424076  10.22.17.72 → 224.0.0.252  LLMNR 66 Standard query 0x9fad AAAA DELL35
   11 12.900810511 10.22.16.141 → 224.0.0.252  LLMNR 66 Standard query 0x140c A DELL35
   12 12.900859224 10.22.16.141 → 224.0.0.252  LLMNR 66 Standard query 0x1cf6 AAAA DELL35
   13 12.930269373 192.168.1.16 → 10.6.15.144  SSH 1514 Client: Encrypted packet (len=1448)
   14 12.945105771 192.168.1.16 → 10.6.15.144  SSH 294 Client: Encrypted packet (len=228)
   15 13.018082200  10.6.15.144 → 192.168.1.16 TCP 78 [TCP Dup ACK 3#1] 22 → 59298 [ACK] Seq=61 Ack=37 Win=1452 Len=0 TSval=6480357 TSecr=5881208 SLE=1485 SRE=1713
   16 13.168032670 192.168.1.16 → 10.6.15.144  TCP 1514 [TCP Retransmission] 59298 → 22 [ACK] Seq=37 Ack=61 Win=5703 Len=1448 TSval=5884020 TSecr=6480357
   17 13.180674136  10.6.15.144 → 192.168.1.16 TCP 66 22 → 59298 [ACK] Seq=61 Ack=1713 Win=1446 Len=0 TSval=6480398 TSecr=5884020
   18 13.182893311  10.6.15.144 → 192.168.1.16 SSH 134 Server: Encrypted packet (len=68)
   19 13.182920004 192.168.1.16 → 10.6.15.144  TCP 66 59298 → 22 [ACK] Seq=1713 Ack=129 Win=5703 Len=0 TSval=5884023 TSecr=6480399
   20 13.327698038  10.6.15.144 → 192.168.1.16 SSH 1030 Server: Encrypted packet (len=964)
   21 13.327724596 192.168.1.16 → 10.6.15.144  TCP 66 59298 → 22 [ACK] Seq=1713 Ack=1093 Win=5703 Len=0 TSval=5884059 TSecr=6480429
   22 13.327770955  10.6.15.144 → 192.168.1.16 SSH 598 Server: Encrypted packet (len=532)
   23 13.327781917 192.168.1.16 → 10.6.15.144  TCP 66 59298 → 22 [ACK] Seq=1713 Ack=1625 Win=5703 Len=0 TSval=5884059 TSecr=6480430
   24 13.328904384 192.168.1.16 → 10.6.15.144  SSH 134 Client: Encrypted packet (len=68)
   25 13.377608428  10.6.15.144 → 192.168.1.16 TCP 66 22 → 59298 [ACK] Seq=1625 Ack=1781 Win=1452 Len=0 TSval=6480448 TSecr=5884060
   26 16.544059271 192.168.1.16 → 54.76.71.168 TCP 128 [TCP Retransmission] 42414 → 8282 [PSH, ACK] Seq=1 Ack=1 Win=296 Len=62 TSval=5884864 TSecr=609986663
   27 16.598020351 192.168.1.16 → 139.59.50.38 NTP 90 NTP Version 4, client
   28 17.890085050 54.76.71.168 → 192.168.1.16 TCP 78 8282 → 42414 [ACK] Seq=1 Ack=63 Win=121 Len=0 TSval=609996839 TSecr=5884864 SLE=1 SRE=63
   29 19.905954390  10.22.18.52 → 224.0.0.252  LLMNR 66 Standard query 0xa266 A DELL35
   30 19.905990098  10.22.18.52 → 224.0.0.252  LLMNR 66 Standard query 0x6ef3 AAAA DELL35
   31 21.889919654  10.22.18.99 → 224.0.0.252  LLMNR 64 Standard query 0x8cd2 A wpad
   32 21.889945454  10.22.18.99 → 224.0.0.252  LLMNR 64 Standard query 0x8cd2 A wpad
   33 23.299310152 192.168.1.16 → 54.76.71.168 TCP 128 42414 → 8282 [PSH, ACK] Seq=63 Ack=1 Win=296 Len=62 TSval=5886552 TSecr=609996839
   34 24.898110273 54.76.71.168 → 192.168.1.16 TCP 66 8282 → 42414 [ACK] Seq=1 Ack=125 Win=121 Len=0 TSval=609998527 TSecr=5886552
   35 29.922060863  10.6.15.144 → 192.168.1.16 SSH 102 Server: Encrypted packet (len=36)
   36 29.964030687 192.168.1.16 → 10.6.15.144  TCP 66 59298 → 22 [ACK] Seq=1781 Ack=1661 Win=5703 Len=0 TSval=5888219 TSecr=6484501
   37 30.913997152  10.6.15.144 → 192.168.1.16 SSH 102 Server: Encrypted packet (len=36)
   38 30.914036042 192.168.1.16 → 10.6.15.144  TCP 66 59298 → 22 [ACK] Seq=1781 Ack=1697 Win=5703 Len=0 TSval=5888456 TSecr=6484773
   39 31.906996546   10.22.18.1 → 224.0.0.252  LLMNR 64 Standard query 0x37dc A wpad
   40 32.901879527   10.22.18.1 → 224.0.0.252  LLMNR 64 Standard query 0x37dc A wpad
