    1 0.000000000 192.168.1.16 → 91.189.89.198 NTP 90 NTP Version 4, client
    2 0.003547325  10.6.15.145 → 192.168.1.16 SSH 1514 Server: Encrypted packet (len=1448)
    3 0.003566348 192.168.1.16 → 10.6.15.145  TCP 66 52104 → 22 [ACK] Seq=1 Ack=1449 Win=6157 Len=0 TSval=1697185 TSecr=24511704
    4 0.003731464  10.6.15.145 → 192.168.1.16 SSH 1514 Server: Encrypted packet (len=1448)
    5 0.003735611 192.168.1.16 → 10.6.15.145  TCP 66 52104 → 22 [ACK] Seq=1 Ack=2897 Win=6157 Len=0 TSval=1697185 TSecr=24511704
    6 0.003917197  10.6.15.145 → 192.168.1.16 SSH 1470 Server: Encrypted packet (len=1404)
    7 0.003921724 192.168.1.16 → 10.6.15.145  TCP 66 52104 → 22 [ACK] Seq=1 Ack=4301 Win=6157 Len=0 TSval=1697185 TSecr=24511704
    8 0.004264592  10.6.15.145 → 192.168.1.16 SSH 1514 Server: Encrypted packet (len=1448)
    9 0.004271521 192.168.1.16 → 10.6.15.145  TCP 66 52104 → 22 [ACK] Seq=1 Ack=5749 Win=6157 Len=0 TSval=1697185 TSecr=24511705
   10 0.004455666  10.6.15.145 → 192.168.1.16 SSH 1514 Server: Encrypted packet (len=1448)
   11 0.004461631 192.168.1.16 → 10.6.15.145  TCP 66 52104 → 22 [ACK] Seq=1 Ack=7197 Win=6157 Len=0 TSval=1697185 TSecr=24511705
   12 0.004646084  10.6.15.145 → 192.168.1.16 SSH 1514 Server: Encrypted packet (len=1448)
   13 0.004651230 192.168.1.16 → 10.6.15.145  TCP 66 52104 → 22 [ACK] Seq=1 Ack=8645 Win=6157 Len=0 TSval=1697185 TSecr=24511705
   14 0.004839265  10.6.15.145 → 192.168.1.16 SSH 1514 Server: Encrypted packet (len=1448)
   15 0.004845967 192.168.1.16 → 10.6.15.145  TCP 66 52104 → 22 [ACK] Seq=1 Ack=10093 Win=6157 Len=0 TSval=1697185 TSecr=24511705
   16 0.005057412  10.6.15.145 → 192.168.1.16 SSH 1514 Server: Encrypted packet (len=1448)
   17 0.005061321 192.168.1.16 → 10.6.15.145  TCP 66 52104 → 22 [ACK] Seq=1 Ack=11541 Win=6157 Len=0 TSval=1697185 TSecr=24511705
   18 0.005309023 10.119.73.122 → 192.168.1.16 ICMP 110 Destination unreachable (Communication administratively filtered)
   19 0.007487123  10.6.15.145 → 192.168.1.16 SSH 1514 Server: Encrypted packet (len=1448)
   20 0.007512827 192.168.1.16 → 10.6.15.145  TCP 66 52104 → 22 [ACK] Seq=1 Ack=12989 Win=6157 Len=0 TSval=1697186 TSecr=24511713
   21 0.008203145  10.6.15.145 → 192.168.1.16 SSH 1514 Server: Encrypted packet (len=1448)
   22 0.008221142 192.168.1.16 → 10.6.15.145  TCP 66 52104 → 22 [ACK] Seq=1 Ack=14437 Win=6157 Len=0 TSval=1697186 TSecr=24511713
   23 0.008238582  10.6.15.145 → 192.168.1.16 SSH 1514 Server: Encrypted packet (len=1448)
   24 0.008246077 192.168.1.16 → 10.6.15.145  TCP 66 52104 → 22 [ACK] Seq=1 Ack=15885 Win=6157 Len=0 TSval=1697186 TSecr=24511713
   25 0.008521482  10.6.15.145 → 192.168.1.16 SSH 1514 Server: Encrypted packet (len=1448)
   26 0.008530901 192.168.1.16 → 10.6.15.145  TCP 66 52104 → 22 [ACK] Seq=1 Ack=17333 Win=6157 Len=0 TSval=1697186 TSecr=24511713
   27 0.008707338  10.6.15.145 → 192.168.1.16 SSH 1514 Server: Encrypted packet (len=1448)
   28 0.008713433 192.168.1.16 → 10.6.15.145  TCP 66 52104 → 22 [ACK] Seq=1 Ack=18781 Win=6157 Len=0 TSval=1697186 TSecr=24511713
   29 0.008901062  10.6.15.145 → 192.168.1.16 SSH 1514 Server: Encrypted packet (len=1448)
   30 0.008909137 192.168.1.16 → 10.6.15.145  TCP 66 52104 → 22 [ACK] Seq=1 Ack=20229 Win=6157 Len=0 TSval=1697186 TSecr=24511713
   31 0.009092548  10.6.15.145 → 192.168.1.16 SSH 1514 Server: Encrypted packet (len=1448)
   32 0.009100379 192.168.1.16 → 10.6.15.145  TCP 66 52104 → 22 [ACK] Seq=1 Ack=21677 Win=6157 Len=0 TSval=1697186 TSecr=24511713
   33 0.009283927  10.6.15.145 → 192.168.1.16 SSH 1514 Server: Encrypted packet (len=1448)
   34 0.009292089 192.168.1.16 → 10.6.15.145  TCP 66 52104 → 22 [ACK] Seq=1 Ack=23125 Win=6157 Len=0 TSval=1697186 TSecr=24511713
   35 0.013607962 192.168.1.16 → 10.6.15.145  SSH 262 Client: Encrypted packet (len=196)
   36 0.014309836 192.168.1.16 → 10.6.15.145  SSH 134 Client: Encrypted packet (len=68)
   37 0.014947954  10.6.15.145 → 192.168.1.16 SSH 1514 Server: Encrypted packet (len=1448)
   38 0.015135549  10.6.15.145 → 192.168.1.16 SSH 1514 Server: Encrypted packet (len=1448)
   39 0.015146670 192.168.1.16 → 10.6.15.145  TCP 66 52104 → 22 [ACK] Seq=265 Ack=26021 Win=6157 Len=0 TSval=1697187 TSecr=24511714
   40 0.015326665  10.6.15.145 → 192.168.1.16 SSH 1514 Server: Encrypted packet (len=1448)
   41 0.015519328  10.6.15.145 → 192.168.1.16 SSH 1514 Server: Encrypted packet (len=1448)
   42 0.015528164 192.168.1.16 → 10.6.15.145  TCP 66 52104 → 22 [ACK] Seq=265 Ack=28917 Win=6157 Len=0 TSval=1697188 TSecr=24511714
   43 0.015711703  10.6.15.145 → 192.168.1.16 SSH 1514 Server: Encrypted packet (len=1448)
   44 0.015902350  10.6.15.145 → 192.168.1.16 SSH 1514 Server: Encrypted packet (len=1448)
   45 0.015911275 192.168.1.16 → 10.6.15.145  TCP 66 52104 → 22 [ACK] Seq=265 Ack=31813 Win=6157 Len=0 TSval=1697188 TSecr=24511714
   46 0.016094580  10.6.15.145 → 192.168.1.16 SSH 1514 Server: Encrypted packet (len=1448)
   47 0.016286247  10.6.15.145 → 192.168.1.16 SSH 1514 Server: Encrypted packet (len=1448)
   48 0.016293768 192.168.1.16 → 10.6.15.145  TCP 66 52104 → 22 [ACK] Seq=265 Ack=34709 Win=6157 Len=0 TSval=1697188 TSecr=24511714
   49 0.016827908  10.6.15.145 → 192.168.1.16 TCP 66 22 → 52104 [ACK] Seq=34709 Ack=265 Win=1452 Len=0 TSval=24511715 TSecr=1697187
   50 0.018679449  10.6.15.145 → 192.168.1.16 SSH 1514 Server: Encrypted packet (len=1448)
   51 0.018858185  10.6.15.145 → 192.168.1.16 SSH 1514 Server: Encrypted packet (len=1448)
   52 0.018869071 192.168.1.16 → 10.6.15.145  TCP 66 52104 → 22 [ACK] Seq=265 Ack=37605 Win=6157 Len=0 TSval=1697188 TSecr=24511716
   53 0.019049169  10.6.15.145 → 192.168.1.16 SSH 1514 Server: Encrypted packet (len=1448)
   54 0.019242060  10.6.15.145 → 192.168.1.16 SSH 1510 Server: Encrypted packet (len=1444)
   55 0.019251054 192.168.1.16 → 10.6.15.145  TCP 66 52104 → 22 [ACK] Seq=265 Ack=40497 Win=6157 Len=0 TSval=1697188 TSecr=24511716
   56 0.020308000 192.168.1.16 → 10.6.15.145  SSH 262 Client: Encrypted packet (len=196)
   57 0.025618442 192.168.1.16 → 10.6.15.145  SSH 134 Client: Encrypted packet (len=68)
   58 0.026917776 192.168.1.16 → 10.6.15.145  SSH 246 Client: Encrypted packet (len=180)
   59 0.027242342 192.168.1.16 → 10.6.15.145  SSH 246 Client: Encrypted packet (len=180)
   60 0.028425172 192.168.1.16 → 10.6.15.145  SSH 254 Client: Encrypted packet (len=188)
   61 0.028878375  10.6.15.145 → 192.168.1.16 SSH 134 Server: Encrypted packet (len=68)
   62 0.029102951  10.6.15.145 → 192.168.1.16 SSH 1514 Server: Encrypted packet (len=1448)
   63 0.029110639 192.168.1.16 → 10.6.15.145  TCP 66 52104 → 22 [ACK] Seq=1077 Ack=42013 Win=6157 Len=0 TSval=1697191 TSecr=24511716
   64 0.029294371  10.6.15.145 → 192.168.1.16 SSH 1514 Server: Encrypted packet (len=1448)
   65 0.029304186  10.6.15.145 → 192.168.1.16 SSH 158 Server: Encrypted packet (len=92)
   66 0.029312167 192.168.1.16 → 10.6.15.145  TCP 66 52104 → 22 [ACK] Seq=1077 Ack=43553 Win=6157 Len=0 TSval=1697191 TSecr=24511717
   67 0.029510407  10.6.15.145 → 192.168.1.16 SSH 1514 Server: Encrypted packet (len=1448)
   68 0.030796109  10.6.15.145 → 192.168.1.16 SSH 1514 Server: Encrypted packet (len=1448)
   69 0.030813438 192.168.1.16 → 10.6.15.145  TCP 66 52104 → 22 [ACK] Seq=1077 Ack=46449 Win=6157 Len=0 TSval=1697191 TSecr=24511717
   70 0.030980683  10.6.15.145 → 192.168.1.16 SSH 1514 Server: Encrypted packet (len=1448)
   71 0.031173113  10.6.15.145 → 192.168.1.16 SSH 1514 Server: Encrypted packet (len=1448)
   72 0.031180957 192.168.1.16 → 10.6.15.145  TCP 66 52104 → 22 [ACK] Seq=1077 Ack=49345 Win=6157 Len=0 TSval=1697191 TSecr=24511718
   73 0.031364607  10.6.15.145 → 192.168.1.16 SSH 1514 Server: Encrypted packet (len=1448)
   74 0.031373518  10.6.15.145 → 192.168.1.16 TCP 66 22 → 52104 [ACK] Seq=50793 Ack=709 Win=1452 Len=0 TSval=24511719 TSecr=1697189
   75 0.031382689  10.6.15.145 → 192.168.1.16 TCP 66 22 → 52104 [ACK] Seq=50793 Ack=1077 Win=1452 Len=0 TSval=24511719 TSecr=1697190
   76 0.034164812  10.6.15.145 → 192.168.1.16 SSH 1514 Server: Encrypted packet (len=1448)
   77 0.034184466 192.168.1.16 → 10.6.15.145  TCP 66 52104 → 22 [ACK] Seq=1077 Ack=52241 Win=6157 Len=0 TSval=1697192 TSecr=24511718
   78 0.034269587  10.6.15.145 → 192.168.1.16 SSH 1010 Server: Encrypted packet (len=944)
   79 0.035893255 192.168.1.16 → 10.6.15.145  SSH 134 Client: Encrypted packet (len=68)
   80 0.038664227  10.6.15.145 → 192.168.1.16 SSH 198 Server: Encrypted packet (len=132)
   81 0.045370209  10.6.15.145 → 192.168.1.16 SSH 1514 Server: Encrypted packet (len=1448)
   82 0.045385139 192.168.1.16 → 10.6.15.145  TCP 66 52104 → 22 [ACK] Seq=1145 Ack=54765 Win=6157 Len=0 TSval=1697195 TSecr=24511721
   83 0.045550036  10.6.15.145 → 192.168.1.16 SSH 1502 Server: Encrypted packet (len=1436)
   84 0.045741137  10.6.15.145 → 192.168.1.16 SSH 1514 Server: Encrypted packet (len=1448)
   85 0.045745717 192.168.1.16 → 10.6.15.145  TCP 66 52104 → 22 [ACK] Seq=1145 Ack=57649 Win=6157 Len=0 TSval=1697195 TSecr=24511721
   86 0.045929199  10.6.15.145 → 192.168.1.16 SSH 1514 Server: Encrypted packet (len=1448)
   87 0.046120881  10.6.15.145 → 192.168.1.16 SSH 1514 Server: Encrypted packet (len=1448)
   88 0.046123728 192.168.1.16 → 10.6.15.145  TCP 66 52104 → 22 [ACK] Seq=1145 Ack=60545 Win=6157 Len=0 TSval=1697195 TSecr=24511721
   89 0.046312908  10.6.15.145 → 192.168.1.16 SSH 1514 Server: Encrypted packet (len=1448)
   90 0.046487601  10.6.15.145 → 192.168.1.16 SSH 1390 Server: Encrypted packet (len=1324)
   91 0.046490515 192.168.1.16 → 10.6.15.145  TCP 66 52104 → 22 [ACK] Seq=1145 Ack=63317 Win=6157 Len=0 TSval=1697195 TSecr=24511721
   92 0.046672726  10.6.15.145 → 192.168.1.16 SSH 1514 Server: Encrypted packet (len=1448)
   93 0.048760150  10.6.15.145 → 192.168.1.16 SSH 1514 Server: Encrypted packet (len=1448)
   94 0.048766060 192.168.1.16 → 10.6.15.145  TCP 66 52104 → 22 [ACK] Seq=1145 Ack=66213 Win=6157 Len=0 TSval=1697196 TSecr=24511721
   95 0.048939554  10.6.15.145 → 192.168.1.16 SSH 1514 Server: Encrypted packet (len=1448)
   96 0.049154922  10.6.15.145 → 192.168.1.16 SSH 590 Server: Encrypted packet (len=524)
   97 0.049160131 192.168.1.16 → 10.6.15.145  TCP 66 52104 → 22 [ACK] Seq=1145 Ack=68185 Win=6157 Len=0 TSval=1697196 TSecr=24511723
   98 0.122399410  10.6.15.145 → 192.168.1.16 SSH 222 Server: Encrypted packet (len=156)
   99 0.123057985  10.6.15.145 → 192.168.1.16 SSH 1514 Server: Encrypted packet (len=1448)
  100 0.123070801 192.168.1.16 → 10.6.15.145  TCP 66 52104 → 22 [ACK] Seq=1145 Ack=69789 Win=6157 Len=0 TSval=1697214 TSecr=24511742
  101 0.123242470  10.6.15.145 → 192.168.1.16 SSH 1502 Server: Encrypted packet (len=1436)
  102 0.124111168  10.6.15.145 → 192.168.1.16 SSH 1514 Server: Encrypted packet (len=1448)
  103 0.124124034 192.168.1.16 → 10.6.15.145  TCP 66 52104 → 22 [ACK] Seq=1145 Ack=72673 Win=6157 Len=0 TSval=1697215 TSecr=24511742
  104 0.124311648  10.6.15.145 → 192.168.1.16 SSH 1514 Server: Encrypted packet (len=1448)
  105 0.124658795  10.6.15.145 → 192.168.1.16 SSH 1514 Server: Encrypted packet (len=1448)
  106 0.124668200 192.168.1.16 → 10.6.15.145  TCP 66 52104 → 22 [ACK] Seq=1145 Ack=75569 Win=6157 Len=0 TSval=1697215 TSecr=24511742
  107 0.124849496  10.6.15.145 → 192.168.1.16 SSH 1514 Server: Encrypted packet (len=1448)
  108 0.125040675  10.6.15.145 → 192.168.1.16 SSH 1514 Server: Encrypted packet (len=1448)
  109 0.125048146 192.168.1.16 → 10.6.15.145  TCP 66 52104 → 22 [ACK] Seq=1145 Ack=78465 Win=6157 Len=0 TSval=1697215 TSecr=24511742
  110 0.125077811  10.6.15.145 → 192.168.1.16 SSH 566 Server: Encrypted packet (len=500)
  111 0.125220587 192.168.1.16 → 10.6.15.145  SSH 102 Client: Encrypted packet (len=36)
  112 0.125966982  10.6.15.145 → 192.168.1.16 SSH 1514 Server: Encrypted packet (len=1448)
  113 0.126077606 192.168.1.16 → 10.6.15.145  SSH 134 Client: Encrypted packet (len=68)
  114 0.126152796  10.6.15.145 → 192.168.1.16 SSH 1514 Server: Encrypted packet (len=1448)
  115 0.127985519  10.6.15.145 → 192.168.1.16 SSH 1514 Server: Encrypted packet (len=1448)
  116 0.128002230 192.168.1.16 → 10.6.15.145  TCP 66 52104 → 22 [ACK] Seq=1249 Ack=83309 Win=6157 Len=0 TSval=1697216 TSecr=24511743
  117 0.128170765  10.6.15.145 → 192.168.1.16 SSH 1514 Server: Encrypted packet (len=1448)
  118 0.129090913  10.6.15.145 → 192.168.1.16 SSH 1514 Server: Encrypted packet (len=1448)
  119 0.129106948 192.168.1.16 → 10.6.15.145  TCP 66 52104 → 22 [ACK] Seq=1249 Ack=86205 Win=6157 Len=0 TSval=1697216 TSecr=24511743
  120 0.129283010  10.6.15.145 → 192.168.1.16 SSH 1514 Server: Encrypted packet (len=1448)
  121 0.129620794  10.6.15.145 → 192.168.1.16 SSH 1514 Server: Encrypted packet (len=1448)
  122 0.129630439 192.168.1.16 → 10.6.15.145  TCP 66 52104 → 22 [ACK] Seq=1249 Ack=89101 Win=6157 Len=0 TSval=1697216 TSecr=24511743
  123 0.129817705  10.6.15.145 → 192.168.1.16 SSH 1514 Server: Encrypted packet (len=1448)
  124 0.130004062  10.6.15.145 → 192.168.1.16 SSH 1514 Server: Encrypted packet (len=1448)
  125 0.130015525 192.168.1.16 → 10.6.15.145  TCP 66 52104 → 22 [ACK] Seq=1249 Ack=91997 Win=6157 Len=0 TSval=1697216 TSecr=24511743
  126 0.130201284  10.6.15.145 → 192.168.1.16 SSH 1514 Server: Encrypted packet (len=1448)
  127 0.130545435  10.6.15.145 → 192.168.1.16 SSH 1514 Server: Encrypted packet (len=1448)
  128 0.130550735 192.168.1.16 → 10.6.15.145  TCP 66 52104 → 22 [ACK] Seq=1249 Ack=94893 Win=6157 Len=0 TSval=1697216 TSecr=24511743
  129 0.130729701  10.6.15.145 → 192.168.1.16 SSH 1514 Server: Encrypted packet (len=1448)
  130 0.132919301  10.6.15.145 → 192.168.1.16 SSH 1514 Server: Encrypted packet (len=1448)
  131 0.132936904 192.168.1.16 → 10.6.15.145  TCP 66 52104 → 22 [ACK] Seq=1249 Ack=97789 Win=6157 Len=0 TSval=1697217 TSecr=24511744
  132 0.133099892  10.6.15.145 → 192.168.1.16 SSH 1514 Server: Encrypted packet (len=1448)
  133 0.133445615  10.6.15.145 → 192.168.1.16 SSH 1514 Server: Encrypted packet (len=1448)
  134 0.133455683 192.168.1.16 → 10.6.15.145  TCP 66 52104 → 22 [ACK] Seq=1249 Ack=100685 Win=6157 Len=0 TSval=1697217 TSecr=24511745
  135 0.133638057  10.6.15.145 → 192.168.1.16 SSH 1514 Server: Encrypted packet (len=1448)
  136 0.133826698  10.6.15.145 → 192.168.1.16 SSH 1514 Server: Encrypted packet (len=1448)
  137 0.133832610 192.168.1.16 → 10.6.15.145  TCP 66 52104 → 22 [ACK] Seq=1249 Ack=103581 Win=6157 Len=0 TSval=1697217 TSecr=24511745
  138 0.134017987  10.6.15.145 → 192.168.1.16 SSH 1514 Server: Encrypted packet (len=1448)
  139 0.134366387  10.6.15.145 → 192.168.1.16 SSH 1514 Server: Encrypted packet (len=1448)
  140 0.134372595 192.168.1.16 → 10.6.15.145  TCP 66 52104 → 22 [ACK] Seq=1249 Ack=106477 Win=6157 Len=0 TSval=1697217 TSecr=24511745
  141 0.134557361  10.6.15.145 → 192.168.1.16 SSH 1514 Server: Encrypted packet (len=1448)
  142 0.136686268  10.6.15.145 → 192.168.1.16 SSH 1514 Server: Encrypted packet (len=1448)
  143 0.136696647 192.168.1.16 → 10.6.15.145  TCP 66 52104 → 22 [ACK] Seq=1249 Ack=109373 Win=6157 Len=0 TSval=1697218 TSecr=24511745
  144 0.136872465  10.6.15.145 → 192.168.1.16 SSH 1514 Server: Encrypted packet (len=1448)
  145 0.137075468  10.6.15.145 → 192.168.1.16 SSH 1514 Server: Encrypted packet (len=1448)
  146 0.137082833 192.168.1.16 → 10.6.15.145  TCP 66 52104 → 22 [ACK] Seq=1249 Ack=112269 Win=6157 Len=0 TSval=1697218 TSecr=24511745
  147 0.137418512  10.6.15.145 → 192.168.1.16 SSH 1514 Server: Encrypted packet (len=1448)
  148 0.150957534 192.168.1.16 → 10.6.15.145  SSH 718 Client: Encrypted packet (len=652)
  149 0.192319245  10.6.15.145 → 192.168.1.16 TCP 66 22 → 52104 [ACK] Seq=113717 Ack=1901 Win=1452 Len=0 TSval=24511760 TSecr=1697221
  150 0.409817439 192.168.1.16 → 10.6.15.145  SSH 814 Client: Encrypted packet (len=748)
  151 0.412317850  10.6.15.145 → 192.168.1.16 TCP 66 22 → 52104 [ACK] Seq=113717 Ack=2649 Win=1452 Len=0 TSval=24511815 TSecr=1697286
  152 0.442992404  10.6.15.145 → 192.168.1.16 SSH 174 Server: Encrypted packet (len=108)
  153 0.443016258  10.6.15.145 → 192.168.1.16 SSH 142 Server: Encrypted packet (len=76)
  154 0.443078566 192.168.1.16 → 10.6.15.145  TCP 66 52104 → 22 [ACK] Seq=2649 Ack=113901 Win=6157 Len=0 TSval=1697294 TSecr=24511822
  155 0.443735479 192.168.1.16 → 10.6.15.145  SSH 134 Client: Encrypted packet (len=68)
  156 0.484386313  10.6.15.145 → 192.168.1.16 TCP 66 22 → 52104 [ACK] Seq=113901 Ack=2717 Win=1452 Len=0 TSval=24511833 TSecr=1697295
  157 0.557737611  10.6.15.145 → 192.168.1.16 SSH 1030 Server: Encrypted packet (len=964)
  158 0.558601171 192.168.1.16 → 10.6.15.145  SSH 134 Client: Encrypted packet (len=68)
  159 0.559968018  10.6.15.145 → 192.168.1.16 TCP 66 22 → 52104 [ACK] Seq=114865 Ack=2785 Win=1452 Len=0 TSval=24511851 TSecr=1697323
  160 0.800572784 192.168.1.16 → 10.6.15.145  SSH 254 Client: Encrypted packet (len=188)
  161 0.802817548  10.6.15.145 → 192.168.1.16 TCP 66 22 → 52104 [ACK] Seq=114865 Ack=2973 Win=1452 Len=0 TSval=24511912 TSecr=1697384
  162 0.803755751 192.168.1.16 → 10.6.15.145  SSH 246 Client: Encrypted packet (len=180)
  163 0.805278235  10.6.15.145 → 192.168.1.16 TCP 66 22 → 52104 [ACK] Seq=114865 Ack=3153 Win=1452 Len=0 TSval=24511913 TSecr=1697385
  164 0.809171375  10.6.15.145 → 192.168.1.16 SSH 222 Server: Encrypted packet (len=156)
  165 0.810487947  10.6.15.145 → 192.168.1.16 SSH 1514 Server: Encrypted packet (len=1448)
  166 0.810508778 192.168.1.16 → 10.6.15.145  TCP 66 52104 → 22 [ACK] Seq=3153 Ack=116469 Win=6157 Len=0 TSval=1697386 TSecr=24511914
  167 0.810664520  10.6.15.145 → 192.168.1.16 SSH 1494 Server: Encrypted packet (len=1428)
  168 0.812946557  10.6.15.145 → 192.168.1.16 SSH 1514 Server: Encrypted packet (len=1448)
  169 0.812961837 192.168.1.16 → 10.6.15.145  TCP 66 52104 → 22 [ACK] Seq=3153 Ack=119345 Win=6157 Len=0 TSval=1697387 TSecr=24511914
  170 0.813130520  10.6.15.145 → 192.168.1.16 SSH 1514 Server: Encrypted packet (len=1448)
  171 0.813321551  10.6.15.145 → 192.168.1.16 SSH 1514 Server: Encrypted packet (len=1448)
  172 0.813326703 192.168.1.16 → 10.6.15.145  TCP 66 52104 → 22 [ACK] Seq=3153 Ack=122241 Win=6157 Len=0 TSval=1697387 TSecr=24511914
  173 0.813666424  10.6.15.145 → 192.168.1.16 SSH 1514 Server: Encrypted packet (len=1448)
  174 0.813855388  10.6.15.145 → 192.168.1.16 SSH 1514 Server: Encrypted packet (len=1448)
  175 0.813858706 192.168.1.16 → 10.6.15.145  TCP 66 52104 → 22 [ACK] Seq=3153 Ack=125137 Win=6157 Len=0 TSval=1697387 TSecr=24511914
  176 0.814064244  10.6.15.145 → 192.168.1.16 SSH 1514 Server: Encrypted packet (len=1448)
  177 0.814227650  10.6.15.145 → 192.168.1.16 SSH 1422 Server: Encrypted packet (len=1356)
  178 0.814230877 192.168.1.16 → 10.6.15.145  TCP 66 52104 → 22 [ACK] Seq=3153 Ack=127941 Win=6157 Len=0 TSval=1697387 TSecr=24511914
  179 0.815046490 192.168.1.16 → 10.6.15.145  SSH 134 Client: Encrypted packet (len=68)
  180 0.854335880  10.6.15.145 → 192.168.1.16 SSH 1514 Server: Encrypted packet (len=1448)
  181 0.854363988  10.6.15.145 → 192.168.1.16 SSH 182 Server: Encrypted packet (len=116)
  182 0.854377198 192.168.1.16 → 10.6.15.145  TCP 66 52104 → 22 [ACK] Seq=3221 Ack=129505 Win=6157 Len=0 TSval=1697397 TSecr=24511924
  183 0.854694678  10.6.15.145 → 192.168.1.16 SSH 1514 Server: Encrypted packet (len=1448)
  184 0.854884940  10.6.15.145 → 192.168.1.16 SSH 1514 Server: Encrypted packet (len=1448)
  185 0.854895154 192.168.1.16 → 10.6.15.145  TCP 66 52104 → 22 [ACK] Seq=3221 Ack=132401 Win=6157 Len=0 TSval=1697397 TSecr=24511925
  186 0.855077047  10.6.15.145 → 192.168.1.16 SSH 1514 Server: Encrypted packet (len=1448)
  187 0.855270023  10.6.15.145 → 192.168.1.16 SSH 1514 Server: Encrypted packet (len=1448)
  188 0.855278062 192.168.1.16 → 10.6.15.145  TCP 66 52104 → 22 [ACK] Seq=3221 Ack=135297 Win=6157 Len=0 TSval=1697397 TSecr=24511925
  189 0.855444729  10.6.15.145 → 192.168.1.16 SSH 1398 Server: Encrypted packet (len=1332)
  190 0.855637345  10.6.15.145 → 192.168.1.16 SSH 1514 Server: Encrypted packet (len=1448)
  191 0.855643146 192.168.1.16 → 10.6.15.145  TCP 66 52104 → 22 [ACK] Seq=3221 Ack=138077 Win=6157 Len=0 TSval=1697398 TSecr=24511925
  192 0.855828891  10.6.15.145 → 192.168.1.16 SSH 1514 Server: Encrypted packet (len=1448)
  193 0.856019509  10.6.15.145 → 192.168.1.16 SSH 1514 Server: Encrypted packet (len=1448)
  194 0.856027232 192.168.1.16 → 10.6.15.145  TCP 66 52104 → 22 [ACK] Seq=3221 Ack=140973 Win=6157 Len=0 TSval=1697398 TSecr=24511925
  195 0.858065637  10.6.15.145 → 192.168.1.16 SSH 1514 Server: Encrypted packet (len=1448)
  196 0.858254346  10.6.15.145 → 192.168.1.16 SSH 1514 Server: Encrypted packet (len=1448)
  197 0.858263939 192.168.1.16 → 10.6.15.145  TCP 66 52104 → 22 [ACK] Seq=3221 Ack=143869 Win=6157 Len=0 TSval=1697398 TSecr=24511926
  198 0.858567778  10.6.15.145 → 192.168.1.16 SSH 1318 Server: Encrypted packet (len=1252)
  199 0.859608606 192.168.1.16 → 10.6.15.145  SSH 134 Client: Encrypted packet (len=68)
  200 0.900322063  10.6.15.145 → 192.168.1.16 TCP 66 22 → 52104 [ACK] Seq=145121 Ack=3289 Win=1452 Len=0 TSval=24511937 TSecr=1697399
  201 4.479468992 192.168.1.16 → 216.58.197.35 TCP 66 54040 → 443 [ACK] Seq=1 Ack=1 Win=229 Len=0 TSval=1698304 TSecr=2850863602
  202 8.272095860 192.168.1.16 → 10.6.15.145  SSH 718 Client: Encrypted packet (len=652)
  203 8.274533965  10.6.15.145 → 192.168.1.16 TCP 66 22 → 52104 [ACK] Seq=145121 Ack=3941 Win=1452 Len=0 TSval=24513780 TSecr=1699252
  204 8.321019886  10.6.15.145 → 192.168.1.16 SSH 174 Server: Encrypted packet (len=108)
  205 8.321781782  10.6.15.145 → 192.168.1.16 SSH 582 Server: Encrypted packet (len=516)
  206 8.321831486 192.168.1.16 → 10.6.15.145  TCP 66 52104 → 22 [ACK] Seq=3941 Ack=145745 Win=6157 Len=0 TSval=1699264 TSecr=24513792
  207 8.322024284 192.168.1.16 → 10.6.15.145  SSH 134 Client: Encrypted packet (len=68)
  208 8.323419448  10.6.15.145 → 192.168.1.16 TCP 66 22 → 52104 [ACK] Seq=145745 Ack=4009 Win=1452 Len=0 TSval=24513792 TSecr=1699264
  209 8.999996899 192.168.1.16 → 139.59.21.22 NTP 90 NTP Version 4, client
  210 9.357158890 192.168.1.16 → 10.6.15.145  SSH 262 Client: Encrypted packet (len=196)
  211 9.357933827 192.168.1.16 → 10.6.15.145  SSH 1514 Client: Encrypted packet (len=1448)
  212 9.358206602 192.168.1.16 → 10.6.15.145  SSH 126 Client: Encrypted packet (len=60)
  213 9.359915240  10.6.15.145 → 192.168.1.16 TCP 66 22 → 52104 [ACK] Seq=145745 Ack=4205 Win=1452 Len=0 TSval=24514051 TSecr=1699523
  214 9.360268943  10.6.15.145 → 192.168.1.16 TCP 66 22 → 52104 [ACK] Seq=145745 Ack=5713 Win=1452 Len=0 TSval=24514052 TSecr=1699523
  215 9.362007208  10.6.15.145 → 192.168.1.16 SSH 142 Server: Encrypted packet (len=76)
  216 9.403459226 192.168.1.16 → 10.6.15.145  TCP 66 52104 → 22 [ACK] Seq=5713 Ack=145821 Win=6157 Len=0 TSval=1699535 TSecr=24514052
  217 9.477979347  10.6.15.145 → 192.168.1.16 SSH 774 Server: Encrypted packet (len=708)
  218 9.478005432 192.168.1.16 → 10.6.15.145  TCP 66 52104 → 22 [ACK] Seq=5713 Ack=146529 Win=6157 Len=0 TSval=1699553 TSecr=24514081
  219 9.478095468  10.6.15.145 → 192.168.1.16 SSH 542 Server: Encrypted packet (len=476)
  220 9.478100170 192.168.1.16 → 10.6.15.145  TCP 66 52104 → 22 [ACK] Seq=5713 Ack=147005 Win=6157 Len=0 TSval=1699553 TSecr=24514081
  221 9.478705152  10.6.15.145 → 192.168.1.16 SSH 134 Server: Encrypted packet (len=68)
  222 9.478712531 192.168.1.16 → 10.6.15.145  TCP 66 52104 → 22 [ACK] Seq=5713 Ack=147073 Win=6157 Len=0 TSval=1699553 TSecr=24514081
  223 9.478887913 192.168.1.16 → 10.6.15.145  SSH 134 Client: Encrypted packet (len=68)
  224 9.516226856  10.6.15.145 → 192.168.1.16 TCP 66 22 → 52104 [ACK] Seq=147073 Ack=5781 Win=1452 Len=0 TSval=24514091 TSecr=1699553
  225 9.999951436 192.168.1.16 → 139.59.21.22 NTP 90 NTP Version 4, client
  226 10.803143650 192.168.1.16 → 10.6.15.145  SSH 1514 Client: Encrypted packet (len=1448)
  227 10.803811447 192.168.1.16 → 10.6.15.145  SSH 1514 Client: Encrypted packet (len=1448)
  228 10.804237054 192.168.1.16 → 10.6.15.145  SSH 1514 Client: Encrypted packet (len=1448)
  229 10.805083051 192.168.1.16 → 10.6.15.145  SSH 1514 Client: Encrypted packet (len=1448)
  230 10.805097795 192.168.1.16 → 10.6.15.145  SSH 1514 Client: Encrypted packet (len=1448)
  231 10.805501705 192.168.1.16 → 10.6.15.145  SSH 1514 Client: Encrypted packet (len=1448)
  232 10.805800701 192.168.1.16 → 10.6.15.145  SSH 482 Client: Encrypted packet (len=416)
  233 10.806892323  10.6.15.145 → 192.168.1.16 TCP 66 22 → 52104 [ACK] Seq=147073 Ack=7229 Win=1452 Len=0 TSval=24514413 TSecr=1699884
  234 10.806906499  10.6.15.145 → 192.168.1.16 TCP 66 22 → 52104 [ACK] Seq=147073 Ack=8677 Win=1452 Len=0 TSval=24514413 TSecr=1699884
  235 10.807025293 192.168.1.16 → 10.6.15.145  SSH 654 Client: Encrypted packet (len=588)
  236 10.807080212  10.6.15.145 → 192.168.1.16 TCP 66 22 → 52104 [ACK] Seq=147073 Ack=10125 Win=1452 Len=0 TSval=24514413 TSecr=1699885
  237 10.807088354  10.6.15.145 → 192.168.1.16 TCP 66 22 → 52104 [ACK] Seq=147073 Ack=11573 Win=1452 Len=0 TSval=24514413 TSecr=1699885
  238 10.807104600  10.6.15.145 → 192.168.1.16 TCP 66 22 → 52104 [ACK] Seq=147073 Ack=13021 Win=1452 Len=0 TSval=24514413 TSecr=1699885
  239 10.807266332  10.6.15.145 → 192.168.1.16 TCP 66 22 → 52104 [ACK] Seq=147073 Ack=14469 Win=1452 Len=0 TSval=24514413 TSecr=1699885
  240 10.808150815  10.6.15.145 → 192.168.1.16 TCP 66 22 → 52104 [ACK] Seq=147073 Ack=14885 Win=1452 Len=0 TSval=24514413 TSecr=1699885
  241 10.809108254  10.6.15.145 → 192.168.1.16 TCP 66 22 → 52104 [ACK] Seq=147073 Ack=15473 Win=1452 Len=0 TSval=24514414 TSecr=1699885
  242 10.852936735  10.6.15.145 → 192.168.1.16 SSH 166 Server: Encrypted packet (len=100)
  243 10.853327850  10.6.15.145 → 192.168.1.16 SSH 390 Server: Encrypted packet (len=324)
  244 10.853336723  10.6.15.145 → 192.168.1.16 SSH 134 Server: Encrypted packet (len=68)
  245 10.853361741 192.168.1.16 → 10.6.15.145  TCP 66 52104 → 22 [ACK] Seq=15473 Ack=147565 Win=6157 Len=0 TSval=1699897 TSecr=24514425
  246 10.853918304 192.168.1.16 → 10.6.15.145  SSH 134 Client: Encrypted packet (len=68)
  247 10.855064507  10.6.15.145 → 192.168.1.16 TCP 66 22 → 52104 [ACK] Seq=147565 Ack=15541 Win=1452 Len=0 TSval=24514425 TSecr=1699897
  248 10.944166064  10.6.15.145 → 192.168.1.16 SSH 150 Server: Encrypted packet (len=84)
  249 10.944918057  10.6.15.145 → 192.168.1.16 SSH 1166 Server: Encrypted packet (len=1100)
  250 10.944959498 192.168.1.16 → 10.6.15.145  TCP 66 52104 → 22 [ACK] Seq=15541 Ack=148749 Win=6157 Len=0 TSval=1699920 TSecr=24514447
  251 10.945235306 192.168.1.16 → 10.6.15.145  SSH 134 Client: Encrypted packet (len=68)
  252 10.946518529  10.6.15.145 → 192.168.1.16 TCP 66 22 → 52104 [ACK] Seq=148749 Ack=15609 Win=1452 Len=0 TSval=24514448 TSecr=1699920
