    1 0.000000000  10.6.15.145 → 192.168.1.16 SSH 1514 Server: Encrypted packet (len=1448)
    2 0.000025248 192.168.1.16 → 10.6.15.145  TCP 66 52104 → 22 [ACK] Seq=1 Ack=1449 Win=6157 Len=0 TSval=1704952 TSecr=24519442
    3 0.000158445  10.6.15.145 → 192.168.1.16 SSH 1502 Server: Encrypted packet (len=1436)
    4 0.000169465 192.168.1.16 → 10.6.15.145  TCP 66 52104 → 22 [ACK] Seq=1 Ack=2885 Win=6157 Len=0 TSval=1704952 TSecr=24519442
    5 0.000325631  10.6.15.145 → 192.168.1.16 SSH 1514 Server: Encrypted packet (len=1448)
    6 0.000332548 192.168.1.16 → 10.6.15.145  TCP 66 52104 → 22 [ACK] Seq=1 Ack=4333 Win=6157 Len=0 TSval=1704952 TSecr=24519442
    7 0.004532244  10.6.15.145 → 192.168.1.16 SSH 1514 Server: Encrypted packet (len=1448)
    8 0.004548367 192.168.1.16 → 10.6.15.145  TCP 66 52104 → 22 [ACK] Seq=1 Ack=5781 Win=6157 Len=0 TSval=1704953 TSecr=24519442
    9 0.004704463  10.6.15.145 → 192.168.1.16 SSH 1470 Server: Encrypted packet (len=1404)
   10 0.004707713 192.168.1.16 → 10.6.15.145  TCP 66 52104 → 22 [ACK] Seq=1 Ack=7185 Win=6157 Len=0 TSval=1704953 TSecr=24519442
   11 0.004917346  10.6.15.145 → 192.168.1.16 SSH 1514 Server: Encrypted packet (len=1448)
   12 0.004923541 192.168.1.16 → 10.6.15.145  TCP 66 52104 → 22 [ACK] Seq=1 Ack=8633 Win=6157 Len=0 TSval=1704953 TSecr=24519442
   13 0.004931943  10.6.15.145 → 192.168.1.16 SSH 78 Server: Encrypted packet (len=12)
   14 0.004935404 192.168.1.16 → 10.6.15.145  TCP 66 52104 → 22 [ACK] Seq=1 Ack=8645 Win=6157 Len=0 TSval=1704953 TSecr=24519442
   15 0.005125486  10.6.15.145 → 192.168.1.16 SSH 1514 Server: Encrypted packet (len=1448)
   16 0.005131879 192.168.1.16 → 10.6.15.145  TCP 66 52104 → 22 [ACK] Seq=1 Ack=10093 Win=6157 Len=0 TSval=1704953 TSecr=24519442
   17 0.005300948  10.6.15.145 → 192.168.1.16 SSH 1514 Server: Encrypted packet (len=1448)
   18 0.005308422 192.168.1.16 → 10.6.15.145  TCP 66 52104 → 22 [ACK] Seq=1 Ack=11541 Win=6157 Len=0 TSval=1704953 TSecr=24519442
   19 0.005486284  10.6.15.145 → 192.168.1.16 SSH 1470 Server: Encrypted packet (len=1404)
   20 0.005493071 192.168.1.16 → 10.6.15.145  TCP 66 52104 → 22 [ACK] Seq=1 Ack=12945 Win=6157 Len=0 TSval=1704953 TSecr=24519442
   21 0.005679126  10.6.15.145 → 192.168.1.16 SSH 1514 Server: Encrypted packet (len=1448)
   22 0.005684499 192.168.1.16 → 10.6.15.145  TCP 66 52104 → 22 [ACK] Seq=1 Ack=14393 Win=6157 Len=0 TSval=1704953 TSecr=24519450
   23 0.006442186  10.6.15.145 → 192.168.1.16 SSH 1514 Server: Encrypted packet (len=1448)
   24 0.006456415 192.168.1.16 → 10.6.15.145  TCP 66 52104 → 22 [ACK] Seq=1 Ack=15841 Win=6157 Len=0 TSval=1704954 TSecr=24519480
   25 0.006630812  10.6.15.145 → 192.168.1.16 SSH 1514 Server: Encrypted packet (len=1448)
   26 0.006639757 192.168.1.16 → 10.6.15.145  TCP 66 52104 → 22 [ACK] Seq=1 Ack=17289 Win=6157 Len=0 TSval=1704954 TSecr=24519480
   27 0.006821685  10.6.15.145 → 192.168.1.16 SSH 1514 Server: Encrypted packet (len=1448)
   28 0.006828970 192.168.1.16 → 10.6.15.145  TCP 66 52104 → 22 [ACK] Seq=1 Ack=18737 Win=6157 Len=0 TSval=1704954 TSecr=24519480
   29 0.008460388  10.6.15.145 → 192.168.1.16 SSH 1514 Server: Encrypted packet (len=1448)
   30 0.008478726 192.168.1.16 → 10.6.15.145  TCP 66 52104 → 22 [ACK] Seq=1 Ack=20185 Win=6157 Len=0 TSval=1704954 TSecr=24519482
   31 0.009026944  10.6.15.145 → 192.168.1.16 SSH 1514 Server: Encrypted packet (len=1448)
   32 0.009040373 192.168.1.16 → 10.6.15.145  TCP 66 52104 → 22 [ACK] Seq=1 Ack=21633 Win=6157 Len=0 TSval=1704954 TSecr=24519482
   33 0.009212856  10.6.15.145 → 192.168.1.16 SSH 1514 Server: Encrypted packet (len=1448)
   34 0.009404707  10.6.15.145 → 192.168.1.16 SSH 1514 Server: Encrypted packet (len=1448)
   35 0.009417594 192.168.1.16 → 10.6.15.145  TCP 66 52104 → 22 [ACK] Seq=1 Ack=24529 Win=6157 Len=0 TSval=1704954 TSecr=24519482
   36 0.009597196  10.6.15.145 → 192.168.1.16 SSH 1514 Server: Encrypted packet (len=1448)
   37 0.009789334  10.6.15.145 → 192.168.1.16 SSH 1514 Server: Encrypted packet (len=1448)
   38 0.009796814 192.168.1.16 → 10.6.15.145  TCP 66 52104 → 22 [ACK] Seq=1 Ack=27425 Win=6157 Len=0 TSval=1704955 TSecr=24519482
   39 0.009981591  10.6.15.145 → 192.168.1.16 SSH 1514 Server: Encrypted packet (len=1448)
   40 0.010173272  10.6.15.145 → 192.168.1.16 SSH 1514 Server: Encrypted packet (len=1448)
   41 0.010182418 192.168.1.16 → 10.6.15.145  TCP 66 52104 → 22 [ACK] Seq=1 Ack=30321 Win=6157 Len=0 TSval=1704955 TSecr=24519482
   42 0.010365971  10.6.15.145 → 192.168.1.16 SSH 1514 Server: Encrypted packet (len=1448)
   43 0.010555330  10.6.15.145 → 192.168.1.16 SSH 1514 Server: Encrypted packet (len=1448)
   44 0.010561740 192.168.1.16 → 10.6.15.145  TCP 66 52104 → 22 [ACK] Seq=1 Ack=33217 Win=6157 Len=0 TSval=1704955 TSecr=24519482
   45 0.011327551  10.6.15.145 → 192.168.1.16 SSH 1514 Server: Encrypted packet (len=1448)
   46 0.011518364  10.6.15.145 → 192.168.1.16 SSH 1514 Server: Encrypted packet (len=1448)
   47 0.011528899 192.168.1.16 → 10.6.15.145  TCP 66 52104 → 22 [ACK] Seq=1 Ack=36113 Win=6157 Len=0 TSval=1704955 TSecr=24519482
   48 0.011709913  10.6.15.145 → 192.168.1.16 SSH 1514 Server: Encrypted packet (len=1448)
   49 0.011900634  10.6.15.145 → 192.168.1.16 SSH 1514 Server: Encrypted packet (len=1448)
   50 0.011907905 192.168.1.16 → 10.6.15.145  TCP 66 52104 → 22 [ACK] Seq=1 Ack=39009 Win=6157 Len=0 TSval=1704955 TSecr=24519482
   51 0.012092666  10.6.15.145 → 192.168.1.16 SSH 1514 Server: Encrypted packet (len=1448)
   52 0.012121542  10.6.15.145 → 192.168.1.16 SSH 434 Server: Encrypted packet (len=368)
   53 0.012127200 192.168.1.16 → 10.6.15.145  TCP 66 52104 → 22 [ACK] Seq=1 Ack=40825 Win=6157 Len=0 TSval=1704955 TSecr=24519482
   54 0.013850465 192.168.1.16 → 10.6.15.145  SSH 134 Client: Encrypted packet (len=68)
   55 0.026693339 192.168.1.16 → 10.6.15.145  SSH 286 Client: Encrypted packet (len=220)
   56 0.026904452 192.168.1.16 → 10.6.15.145  SSH 550 Client: Encrypted packet (len=484)
   57 0.028201438  10.6.15.145 → 192.168.1.16 TCP 66 22 → 52104 [ACK] Seq=40825 Ack=289 Win=1452 Len=0 TSval=24519487 TSecr=1704956
   58 0.028215309 192.168.1.16 → 10.6.15.145  SSH 254 Client: Encrypted packet (len=188)
   59 0.029480684  10.6.15.145 → 192.168.1.16 TCP 66 22 → 52104 [ACK] Seq=40825 Ack=961 Win=1452 Len=0 TSval=24519487 TSecr=1704959
   60 0.030067028  10.6.15.145 → 192.168.1.16 SSH 142 Server: Encrypted packet (len=76)
   61 0.035137340  10.6.15.145 → 192.168.1.16 SSH 214 Server: Encrypted packet (len=148)
   62 0.035188494 192.168.1.16 → 10.6.15.145  TCP 66 52104 → 22 [ACK] Seq=961 Ack=41049 Win=6157 Len=0 TSval=1704961 TSecr=24519487
   63 0.036134692  10.6.15.145 → 192.168.1.16 SSH 1514 Server: Encrypted packet (len=1448)
   64 0.036315533  10.6.15.145 → 192.168.1.16 SSH 1514 Server: Encrypted packet (len=1448)
   65 0.036326761 192.168.1.16 → 10.6.15.145  TCP 66 52104 → 22 [ACK] Seq=961 Ack=43945 Win=6157 Len=0 TSval=1704961 TSecr=24519489
   66 0.036900537  10.6.15.145 → 192.168.1.16 SSH 1470 Server: Encrypted packet (len=1404)
   67 0.037080144  10.6.15.145 → 192.168.1.16 SSH 1514 Server: Encrypted packet (len=1448)
   68 0.037087675 192.168.1.16 → 10.6.15.145  TCP 66 52104 → 22 [ACK] Seq=961 Ack=46797 Win=6157 Len=0 TSval=1704961 TSecr=24519489
   69 0.037101291  10.6.15.145 → 192.168.1.16 SSH 78 Server: Encrypted packet (len=12)
   70 0.037288648  10.6.15.145 → 192.168.1.16 SSH 1514 Server: Encrypted packet (len=1448)
   71 0.037293528 192.168.1.16 → 10.6.15.145  TCP 66 52104 → 22 [ACK] Seq=961 Ack=48257 Win=6157 Len=0 TSval=1704961 TSecr=24519489
   72 0.037301857  10.6.15.145 → 192.168.1.16 SSH 78 Server: Encrypted packet (len=12)
   73 0.038086552  10.6.15.145 → 192.168.1.16 SSH 1514 Server: Encrypted packet (len=1448)
   74 0.038094164 192.168.1.16 → 10.6.15.145  TCP 66 52104 → 22 [ACK] Seq=961 Ack=49717 Win=6157 Len=0 TSval=1704962 TSecr=24519489
   75 0.038104053  10.6.15.145 → 192.168.1.16 SSH 78 Server: Encrypted packet (len=12)
   76 0.038294528  10.6.15.145 → 192.168.1.16 SSH 1514 Server: Encrypted packet (len=1448)
   77 0.038298701 192.168.1.16 → 10.6.15.145  TCP 66 52104 → 22 [ACK] Seq=961 Ack=51177 Win=6157 Len=0 TSval=1704962 TSecr=24519489
   78 0.038306026  10.6.15.145 → 192.168.1.16 SSH 78 Server: Encrypted packet (len=12)
   79 0.038504302  10.6.15.145 → 192.168.1.16 SSH 1514 Server: Encrypted packet (len=1448)
   80 0.038508898 192.168.1.16 → 10.6.15.145  TCP 66 52104 → 22 [ACK] Seq=961 Ack=52637 Win=6157 Len=0 TSval=1704962 TSecr=24519489
   81 0.038516472  10.6.15.145 → 192.168.1.16 SSH 78 Server: Encrypted packet (len=12)
   82 0.038714300  10.6.15.145 → 192.168.1.16 SSH 1514 Server: Encrypted packet (len=1448)
   83 0.038718144 192.168.1.16 → 10.6.15.145  TCP 66 52104 → 22 [ACK] Seq=961 Ack=54097 Win=6157 Len=0 TSval=1704962 TSecr=24519489
   84 0.038725176  10.6.15.145 → 192.168.1.16 SSH 78 Server: Encrypted packet (len=12)
   85 0.039453845  10.6.15.145 → 192.168.1.16 SSH 1514 Server: Encrypted packet (len=1448)
   86 0.039463165 192.168.1.16 → 10.6.15.145  TCP 66 52104 → 22 [ACK] Seq=961 Ack=55557 Win=6157 Len=0 TSval=1704962 TSecr=24519489
   87 0.039642453  10.6.15.145 → 192.168.1.16 SSH 1514 Server: Encrypted packet (len=1448)
   88 0.039836071  10.6.15.145 → 192.168.1.16 SSH 1514 Server: Encrypted packet (len=1448)
   89 0.039841998 192.168.1.16 → 10.6.15.145  TCP 66 52104 → 22 [ACK] Seq=961 Ack=58453 Win=6157 Len=0 TSval=1704962 TSecr=24519490
   90 0.040413578  10.6.15.145 → 192.168.1.16 SSH 1514 Server: Encrypted packet (len=1448)
   91 0.040582456 192.168.1.16 → 10.6.15.145  SSH 134 Client: Encrypted packet (len=68)
   92 0.040604842  10.6.15.145 → 192.168.1.16 SSH 1514 Server: Encrypted packet (len=1448)
   93 0.040797153  10.6.15.145 → 192.168.1.16 SSH 1514 Server: Encrypted packet (len=1448)
   94 0.040802864 192.168.1.16 → 10.6.15.145  TCP 66 52104 → 22 [ACK] Seq=1029 Ack=62797 Win=6157 Len=0 TSval=1704962 TSecr=24519490
   95 0.040994318  10.6.15.145 → 192.168.1.16 SSH 1514 Server: Encrypted packet (len=1448)
   96 0.041595946  10.6.15.145 → 192.168.1.16 SSH 1514 Server: Encrypted packet (len=1448)
   97 0.041609233 192.168.1.16 → 10.6.15.145  TCP 66 52104 → 22 [ACK] Seq=1029 Ack=65693 Win=6157 Len=0 TSval=1704962 TSecr=24519490
   98 0.041788921  10.6.15.145 → 192.168.1.16 SSH 1514 Server: Encrypted packet (len=1448)
   99 0.041976545  10.6.15.145 → 192.168.1.16 SSH 1514 Server: Encrypted packet (len=1448)
  100 0.041982979 192.168.1.16 → 10.6.15.145  TCP 66 52104 → 22 [ACK] Seq=1029 Ack=68589 Win=6157 Len=0 TSval=1704963 TSecr=24519490
  101 0.042137861  10.6.15.145 → 192.168.1.16 SSH 1318 Server: Encrypted packet (len=1252)
  102 0.071845054  10.6.15.145 → 192.168.1.16 SSH 214 Server: Encrypted packet (len=148)
  103 0.071902253 192.168.1.16 → 10.6.15.145  TCP 66 52104 → 22 [ACK] Seq=1029 Ack=69989 Win=6157 Len=0 TSval=1704970 TSecr=24519490
  104 0.072512116 192.168.1.16 → 10.6.15.145  SSH 134 Client: Encrypted packet (len=68)
  105 0.072622756  10.6.15.145 → 192.168.1.16 SSH 134 Server: Encrypted packet (len=68)
  106 0.072646154  10.6.15.145 → 192.168.1.16 SSH 198 Server: Encrypted packet (len=132)
  107 0.072654730 192.168.1.16 → 10.6.15.145  TCP 66 52104 → 22 [ACK] Seq=1097 Ack=70189 Win=6157 Len=0 TSval=1704970 TSecr=24519498
  108 0.073543255 192.168.1.16 → 10.6.15.145  SSH 134 Client: Encrypted packet (len=68)
  109 0.074236478  10.6.15.145 → 192.168.1.16 SSH 1514 Server: Encrypted packet (len=1448)
  110 0.074256430  10.6.15.145 → 192.168.1.16 SSH 78 Server: Encrypted packet (len=12)
  111 0.074265818 192.168.1.16 → 10.6.15.145  TCP 66 52104 → 22 [ACK] Seq=1165 Ack=71649 Win=6157 Len=0 TSval=1704971 TSecr=24519498
  112 0.074896051  10.6.15.145 → 192.168.1.16 SSH 1514 Server: Encrypted packet (len=1448)
  113 0.074911127  10.6.15.145 → 192.168.1.16 SSH 78 Server: Encrypted packet (len=12)
  114 0.074918445 192.168.1.16 → 10.6.15.145  TCP 66 52104 → 22 [ACK] Seq=1165 Ack=73109 Win=6157 Len=0 TSval=1704971 TSecr=24519498
  115 0.075102567  10.6.15.145 → 192.168.1.16 SSH 1514 Server: Encrypted packet (len=1448)
  116 0.075115118  10.6.15.145 → 192.168.1.16 SSH 78 Server: Encrypted packet (len=12)
  117 0.075120915 192.168.1.16 → 10.6.15.145  TCP 66 52104 → 22 [ACK] Seq=1165 Ack=74569 Win=6157 Len=0 TSval=1704971 TSecr=24519498
  118 0.075310863  10.6.15.145 → 192.168.1.16 SSH 1514 Server: Encrypted packet (len=1448)
  119 0.076089505  10.6.15.145 → 192.168.1.16 SSH 78 Server: Encrypted packet (len=12)
  120 0.076099629 192.168.1.16 → 10.6.15.145  TCP 66 52104 → 22 [ACK] Seq=1165 Ack=76029 Win=6157 Len=0 TSval=1704971 TSecr=24519498
  121 0.076210331 192.168.1.16 → 10.6.15.145  SSH 102 Client: Encrypted packet (len=36)
  122 0.076318651  10.6.15.145 → 192.168.1.16 SSH 1514 Server: Encrypted packet (len=1448)
  123 0.076328268  10.6.15.145 → 192.168.1.16 SSH 78 Server: Encrypted packet (len=12)
  124 0.076333293 192.168.1.16 → 10.6.15.145  TCP 66 52104 → 22 [ACK] Seq=1201 Ack=77489 Win=6157 Len=0 TSval=1704971 TSecr=24519498
  125 0.077129171  10.6.15.145 → 192.168.1.16 SSH 1514 Server: Encrypted packet (len=1448)
  126 0.077317954  10.6.15.145 → 192.168.1.16 SSH 1494 Server: Encrypted packet (len=1428)
  127 0.077325538 192.168.1.16 → 10.6.15.145  TCP 66 52104 → 22 [ACK] Seq=1201 Ack=80365 Win=6157 Len=0 TSval=1704971 TSecr=24519499
  128 0.077510518  10.6.15.145 → 192.168.1.16 SSH 1514 Server: Encrypted packet (len=1448)
  129 0.077695790  10.6.15.145 → 192.168.1.16 SSH 1494 Server: Encrypted packet (len=1428)
  130 0.077700589 192.168.1.16 → 10.6.15.145  TCP 66 52104 → 22 [ACK] Seq=1201 Ack=83241 Win=6157 Len=0 TSval=1704971 TSecr=24519499
  131 0.078328918  10.6.15.145 → 192.168.1.16 SSH 1514 Server: Encrypted packet (len=1448)
  132 0.078515234  10.6.15.145 → 192.168.1.16 SSH 1494 Server: Encrypted packet (len=1428)
  133 0.078521153 192.168.1.16 → 10.6.15.145  TCP 66 52104 → 22 [ACK] Seq=1201 Ack=86117 Win=6157 Len=0 TSval=1704972 TSecr=24519499
  134 0.079100908  10.6.15.145 → 192.168.1.16 SSH 1514 Server: Encrypted packet (len=1448)
  135 0.079288960  10.6.15.145 → 192.168.1.16 SSH 1494 Server: Encrypted packet (len=1428)
  136 0.079295133 192.168.1.16 → 10.6.15.145  TCP 66 52104 → 22 [ACK] Seq=1201 Ack=88993 Win=6157 Len=0 TSval=1704972 TSecr=24519499
  137 0.080162435  10.6.15.145 → 192.168.1.16 SSH 1514 Server: Encrypted packet (len=1448)
  138 0.080346326  10.6.15.145 → 192.168.1.16 SSH 1494 Server: Encrypted packet (len=1428)
  139 0.080359128 192.168.1.16 → 10.6.15.145  TCP 66 52104 → 22 [ACK] Seq=1201 Ack=91869 Win=6157 Len=0 TSval=1704972 TSecr=24519500
  140 0.081177127  10.6.15.145 → 192.168.1.16 SSH 1514 Server: Encrypted packet (len=1448)
  141 0.081362303  10.6.15.145 → 192.168.1.16 SSH 1494 Server: Encrypted packet (len=1428)
  142 0.081374253 192.168.1.16 → 10.6.15.145  TCP 66 52104 → 22 [ACK] Seq=1201 Ack=94745 Win=6157 Len=0 TSval=1704972 TSecr=24519500
  143 0.082952022  10.6.15.145 → 192.168.1.16 SSH 1514 Server: Encrypted packet (len=1448)
  144 0.083138055  10.6.15.145 → 192.168.1.16 SSH 1494 Server: Encrypted packet (len=1428)
  145 0.083146833 192.168.1.16 → 10.6.15.145  TCP 66 52104 → 22 [ACK] Seq=1201 Ack=97621 Win=6157 Len=0 TSval=1704973 TSecr=24519500
  146 0.083247191  10.6.15.145 → 192.168.1.16 SSH 966 Server: Encrypted packet (len=900)
  147 0.125783120 192.168.1.16 → 10.6.15.145  TCP 66 52104 → 22 [ACK] Seq=1201 Ack=98521 Win=6157 Len=0 TSval=1704984 TSecr=24519500
  148 0.308401226 192.168.1.16 → 10.6.15.145  SSH 878 Client: Encrypted packet (len=812)
  149 0.350318959  10.6.15.145 → 192.168.1.16 TCP 66 22 → 52104 [ACK] Seq=98521 Ack=2013 Win=1452 Len=0 TSval=24519568 TSecr=1705029
  150 0.452737244  10.6.15.145 → 192.168.1.16 SSH 182 Server: Encrypted packet (len=116)
  151 0.452757640 192.168.1.16 → 10.6.15.145  TCP 66 52104 → 22 [ACK] Seq=2013 Ack=98637 Win=6157 Len=0 TSval=1705065 TSecr=24519593
  152 0.453211334  10.6.15.145 → 192.168.1.16 SSH 950 Server: Encrypted packet (len=884)
  153 0.453220344 192.168.1.16 → 10.6.15.145  TCP 66 52104 → 22 [ACK] Seq=2013 Ack=99521 Win=6157 Len=0 TSval=1705065 TSecr=24519593
  154 0.453436895 192.168.1.16 → 10.6.15.145  SSH 134 Client: Encrypted packet (len=68)
  155 0.454731991  10.6.15.145 → 192.168.1.16 TCP 66 22 → 52104 [ACK] Seq=99521 Ack=2081 Win=1452 Len=0 TSval=24519594 TSecr=1705065
  156 0.711397014 192.168.1.16 → 10.6.15.145  SSH 246 Client: Encrypted packet (len=180)
  157 0.712834868 192.168.1.16 → 10.6.15.145  SSH 878 Client: Encrypted packet (len=812)
  158 0.714382300  10.6.15.145 → 192.168.1.16 TCP 66 22 → 52104 [ACK] Seq=99521 Ack=2261 Win=1452 Len=0 TSval=24519658 TSecr=1705130
  159 0.714507534  10.6.15.145 → 192.168.1.16 TCP 66 22 → 52104 [ACK] Seq=99521 Ack=3073 Win=1452 Len=0 TSval=24519659 TSecr=1705130
  160 0.767434242  10.6.15.145 → 192.168.1.16 SSH 1514 Server: Encrypted packet (len=1448)
  161 0.767457919  10.6.15.145 → 192.168.1.16 SSH 198 Server: Encrypted packet (len=132)
  162 0.767473426 192.168.1.16 → 10.6.15.145  TCP 66 52104 → 22 [ACK] Seq=3073 Ack=101101 Win=6157 Len=0 TSval=1705144 TSecr=24519672
  163 0.768169360  10.6.15.145 → 192.168.1.16 SSH 1514 Server: Encrypted packet (len=1448)
  164 0.768184770  10.6.15.145 → 192.168.1.16 SSH 78 Server: Encrypted packet (len=12)
  165 0.768191535 192.168.1.16 → 10.6.15.145  TCP 66 52104 → 22 [ACK] Seq=3073 Ack=102561 Win=6157 Len=0 TSval=1705144 TSecr=24519672
  166 0.768531489  10.6.15.145 → 192.168.1.16 SSH 1514 Server: Encrypted packet (len=1448)
  167 0.768542153  10.6.15.145 → 192.168.1.16 SSH 78 Server: Encrypted packet (len=12)
  168 0.768547622 192.168.1.16 → 10.6.15.145  TCP 66 52104 → 22 [ACK] Seq=3073 Ack=104021 Win=6157 Len=0 TSval=1705144 TSecr=24519672
  169 0.769304752  10.6.15.145 → 192.168.1.16 SSH 1514 Server: Encrypted packet (len=1448)
  170 0.769487826  10.6.15.145 → 192.168.1.16 SSH 1494 Server: Encrypted packet (len=1428)
  171 0.769500093 192.168.1.16 → 10.6.15.145  TCP 66 52104 → 22 [ACK] Seq=3073 Ack=106897 Win=6157 Len=0 TSval=1705144 TSecr=24519672
  172 0.769680877  10.6.15.145 → 192.168.1.16 SSH 1514 Server: Encrypted packet (len=1448)
  173 0.770016256  10.6.15.145 → 192.168.1.16 SSH 1494 Server: Encrypted packet (len=1428)
  174 0.770028558 192.168.1.16 → 10.6.15.145  TCP 66 52104 → 22 [ACK] Seq=3073 Ack=109773 Win=6157 Len=0 TSval=1705145 TSecr=24519672
  175 0.770203710  10.6.15.145 → 192.168.1.16 SSH 1514 Server: Encrypted packet (len=1448)
  176 0.770212066  10.6.15.145 → 192.168.1.16 SSH 78 Server: Encrypted packet (len=12)
  177 0.770216687 192.168.1.16 → 10.6.15.145  TCP 66 52104 → 22 [ACK] Seq=3073 Ack=111233 Win=6157 Len=0 TSval=1705145 TSecr=24519672
  178 0.770413853  10.6.15.145 → 192.168.1.16 SSH 1514 Server: Encrypted packet (len=1448)
  179 0.770756615  10.6.15.145 → 192.168.1.16 SSH 1494 Server: Encrypted packet (len=1428)
  180 0.770762611 192.168.1.16 → 10.6.15.145  TCP 66 52104 → 22 [ACK] Seq=3073 Ack=114109 Win=6157 Len=0 TSval=1705145 TSecr=24519672
  181 0.771518180  10.6.15.145 → 192.168.1.16 SSH 1514 Server: Encrypted packet (len=1448)
  182 0.771637698  10.6.15.145 → 192.168.1.16 SSH 1054 Server: Encrypted packet (len=988)
  183 0.771643002 192.168.1.16 → 10.6.15.145  TCP 66 52104 → 22 [ACK] Seq=3073 Ack=116545 Win=6157 Len=0 TSval=1705145 TSecr=24519673
  184 0.773701941 192.168.1.16 → 10.6.15.145  SSH 134 Client: Encrypted packet (len=68)
  185 0.775031565  10.6.15.145 → 192.168.1.16 TCP 66 22 → 52104 [ACK] Seq=116545 Ack=3141 Win=1452 Len=0 TSval=24519674 TSecr=1705145
  186 2.016124739  10.6.15.145 → 192.168.1.16 SSH 190 Server: Encrypted packet (len=124)
  187 2.016376407  10.6.15.145 → 192.168.1.16 TCP 190 [TCP Retransmission] 22 → 52104 [PSH, ACK] Seq=116545 Ack=3141 Win=1452 Len=124 TSval=24519783 TSecr=1705145
  188 2.016385631 192.168.1.16 → 10.6.15.145  TCP 78 52104 → 22 [ACK] Seq=3141 Ack=116669 Win=6157 Len=0 TSval=1705456 TSecr=24519783 SLE=116545 SRE=116669
  189 2.016724821  10.6.15.145 → 192.168.1.16 SSH 190 Server: [TCP Spurious Retransmission] , Encrypted packet (len=124)
  190 2.016732793 192.168.1.16 → 10.6.15.145  TCP 78 [TCP Dup ACK 188#1] 52104 → 22 [ACK] Seq=3141 Ack=116669 Win=6157 Len=0 TSval=1705456 TSecr=24519837 SLE=116545 SRE=116669
  191 2.016759415  10.6.15.145 → 192.168.1.16 SSH 190 Server: [TCP Spurious Retransmission] , Encrypted packet (len=124)
  192 2.016762040 192.168.1.16 → 10.6.15.145  TCP 78 [TCP Dup ACK 188#2] 52104 → 22 [ACK] Seq=3141 Ack=116669 Win=6157 Len=0 TSval=1705456 TSecr=24519945 SLE=116545 SRE=116669
  193 2.016983382 192.168.1.16 → 10.6.15.145  SSH 134 Client: Encrypted packet (len=68)
  194 2.018799682  10.6.15.145 → 192.168.1.16 TCP 66 22 → 52104 [ACK] Seq=116669 Ack=3209 Win=1452 Len=0 TSval=24519984 TSecr=1705456
  195 9.198269253 192.168.1.16 → 10.6.15.145  SSH 1214 Client: Encrypted packet (len=1148)
  196 9.205272756  10.6.15.145 → 192.168.1.16 TCP 66 22 → 52104 [ACK] Seq=116669 Ack=4357 Win=1452 Len=0 TSval=24521781 TSecr=1707252
  197 9.249776504  10.6.15.145 → 192.168.1.16 SSH 174 Server: Encrypted packet (len=108)
  198 9.249811817  10.6.15.145 → 192.168.1.16 SSH 526 Server: Encrypted packet (len=460)
  199 9.249889700 192.168.1.16 → 10.6.15.145  TCP 66 52104 → 22 [ACK] Seq=4357 Ack=117237 Win=6157 Len=0 TSval=1707265 TSecr=24521792
  200 9.251678860  10.6.15.145 → 192.168.1.16 SSH 142 Server: Encrypted packet (len=76)
  201 9.252761030 192.168.1.16 → 10.6.15.145  SSH 134 Client: Encrypted packet (len=68)
  202 9.254184223  10.6.15.145 → 192.168.1.16 TCP 66 22 → 52104 [ACK] Seq=117313 Ack=4425 Win=1452 Len=0 TSval=24521793 TSecr=1707265
  203 9.503261358 192.168.1.16 → 10.6.15.145  SSH 262 Client: Encrypted packet (len=196)
  204 9.504020595 192.168.1.16 → 10.6.15.145  SSH 1514 Client: Encrypted packet (len=1448)
  205 9.504257416 192.168.1.16 → 10.6.15.145  SSH 134 Client: Encrypted packet (len=68)
  206 9.505623200  10.6.15.145 → 192.168.1.16 TCP 66 22 → 52104 [ACK] Seq=117313 Ack=4621 Win=1452 Len=0 TSval=24521856 TSecr=1707328
  207 9.506015852  10.6.15.145 → 192.168.1.16 TCP 66 22 → 52104 [ACK] Seq=117313 Ack=6137 Win=1452 Len=0 TSval=24521856 TSecr=1707328
  208 9.508824806  10.6.15.145 → 192.168.1.16 SSH 142 Server: Encrypted packet (len=76)
  209 9.549793866 192.168.1.16 → 10.6.15.145  TCP 66 52104 → 22 [ACK] Seq=6137 Ack=117389 Win=6157 Len=0 TSval=1707340 TSecr=24521857
  210 9.637419664  10.6.15.145 → 192.168.1.16 SSH 1070 Server: Encrypted packet (len=1004)
  211 9.637463135 192.168.1.16 → 10.6.15.145  TCP 66 52104 → 22 [ACK] Seq=6137 Ack=118393 Win=6157 Len=0 TSval=1707361 TSecr=24521889
  212 9.638647130 192.168.1.16 → 10.6.15.145  SSH 134 Client: Encrypted packet (len=68)
  213 9.678372021  10.6.15.145 → 192.168.1.16 TCP 66 22 → 52104 [ACK] Seq=118393 Ack=6205 Win=1452 Len=0 TSval=24521900 TSecr=1707362
  214 11.267884022 192.168.1.16 → 10.6.15.145  SSH 1514 Client: Encrypted packet (len=1448)
  215 11.267904787 192.168.1.16 → 10.6.15.145  SSH 1514 Client: Encrypted packet (len=1448)
  216 11.572922618  10.6.15.145 → 192.168.1.16 TCP 66 22 → 52104 [ACK] Seq=118393 Ack=7653 Win=1452 Len=0 TSval=24522373 TSecr=1707769
  217 11.572939955  10.6.15.145 → 192.168.1.16 TCP 66 22 → 52104 [ACK] Seq=118393 Ack=9101 Win=1452 Len=0 TSval=24522373 TSecr=1707769
  218 11.677930596 192.168.1.16 → 10.6.15.145  SSH 1514 Client: Encrypted packet (len=1448)
  219 11.677947546 192.168.1.16 → 10.6.15.145  SSH 1514 Client: Encrypted packet (len=1448)
  220 12.084924991  10.6.15.145 → 192.168.1.16 TCP 66 22 → 52104 [ACK] Seq=118393 Ack=10549 Win=1452 Len=0 TSval=24522501 TSecr=1707845
  221 12.085285690  10.6.15.145 → 192.168.1.16 TCP 66 22 → 52104 [ACK] Seq=118393 Ack=11997 Win=1452 Len=0 TSval=24522501 TSecr=1707845
  222 12.189919044 192.168.1.16 → 10.6.15.145  SSH 1514 Client: Encrypted packet (len=1448)
  223 12.189935926 192.168.1.16 → 10.6.15.145  SSH 1514 Client: Encrypted packet (len=1448)
  224 12.596558875  10.6.15.145 → 192.168.1.16 TCP 66 22 → 52104 [ACK] Seq=118393 Ack=13445 Win=1452 Len=0 TSval=24522629 TSecr=1707973
  225 12.597700336  10.6.15.145 → 192.168.1.16 TCP 66 22 → 52104 [ACK] Seq=118393 Ack=14893 Win=1452 Len=0 TSval=24522629 TSecr=1707973
  226 12.705917030 192.168.1.16 → 10.6.15.145  SSH 1006 Client: Encrypted packet (len=940)
  227 13.112491293  10.6.15.145 → 192.168.1.16 TCP 66 22 → 52104 [ACK] Seq=118393 Ack=15833 Win=1452 Len=0 TSval=24522758 TSecr=1708101
  228 16.105784928  10.6.15.145 → 192.168.1.16 SSH 854 Server: Encrypted packet (len=788)
  229 16.121817849 192.168.1.16 → 10.6.15.145  SSH 134 Client: Encrypted packet (len=68)
  230 16.124295393  10.6.15.145 → 192.168.1.16 SSH 1046 Server: Encrypted packet (len=980)
  231 16.158723106  10.6.15.145 → 192.168.1.16 SSH 162 Server: Encrypted packet (len=96)
  232 16.158740434 192.168.1.16 → 10.6.15.145  TCP 66 52104 → 22 [ACK] Seq=15901 Ack=120257 Win=6157 Len=0 TSval=1708992 TSecr=24523511
  233 18.461822604 192.168.1.16 → 216.58.197.35 TCP 66 54040 → 443 [RST, ACK] Seq=1 Ack=1 Win=229 Len=0 TSval=1709568 TSecr=2850863602
  234 20.928011744 192.168.1.16 → 192.168.1.1  DNS 81 Standard query 0x1edf A 1.ubuntu.pool.ntp.org
  235 20.931078927  192.168.1.1 → 192.168.1.16 DNS 113 Standard query response 0x1edf A 1.ubuntu.pool.ntp.org A 139.59.21.22 A 123.108.200.124
  236 20.931399600 192.168.1.16 → 139.59.21.22 NTP 90 NTP Version 4, client
