    1 0.000000000  10.6.15.156 → 192.168.1.12 SSH 246 Server: Encrypted packet (len=180)
    2 0.000079526 192.168.1.12 → 10.6.15.156  TCP 66 54766 → 22 [ACK] Seq=1 Ack=181 Win=6155 Len=0 TSval=7988967 TSecr=14920460
    3 0.000350536 192.168.1.12 → 10.6.15.156  SSH 134 Client: Encrypted packet (len=68)
    4 0.000427481  10.6.15.156 → 192.168.1.12 SSH 182 Server: Encrypted packet (len=116)
    5 0.003845038  10.6.15.156 → 192.168.1.12 TCP 66 22 → 54766 [ACK] Seq=297 Ack=69 Win=1452 Len=0 TSval=14920466 TSecr=7988967
    6 0.003864172 192.168.1.12 → 10.6.15.156  SSH 942 Client: Encrypted packet (len=876)
    7 0.006148940  10.6.15.156 → 192.168.1.12 TCP 66 22 → 54766 [ACK] Seq=297 Ack=945 Win=1452 Len=0 TSval=14920467 TSecr=7988968
    8 0.012036423  10.6.15.156 → 192.168.1.12 SSH 1514 Server: Encrypted packet (len=1448)
    9 0.012157223  10.6.15.156 → 192.168.1.12 SSH 1514 Server: Encrypted packet (len=1448)
   10 0.012168114 192.168.1.12 → 10.6.15.156  TCP 66 54766 → 22 [ACK] Seq=945 Ack=3193 Win=6155 Len=0 TSval=7988970 TSecr=14920468
   11 0.012341984  10.6.15.156 → 192.168.1.12 SSH 1514 Server: Encrypted packet (len=1448)
   12 0.012514866  10.6.15.156 → 192.168.1.12 SSH 1514 Server: Encrypted packet (len=1448)
   13 0.012522079 192.168.1.12 → 10.6.15.156  TCP 66 54766 → 22 [ACK] Seq=945 Ack=6089 Win=6155 Len=0 TSval=7988970 TSecr=14920468
   14 0.012687754  10.6.15.156 → 192.168.1.12 SSH 1510 Server: Encrypted packet (len=1444)
   15 0.022549805  10.6.15.156 → 192.168.1.12 SSH 182 Server: Encrypted packet (len=116)
   16 0.022565069 192.168.1.12 → 10.6.15.156  TCP 66 54766 → 22 [ACK] Seq=945 Ack=7649 Win=6155 Len=0 TSval=7988973 TSecr=14920468
   17 0.022924976 192.168.1.12 → 10.6.15.156  SSH 134 Client: Encrypted packet (len=68)
   18 0.062792759  10.6.15.156 → 192.168.1.12 TCP 66 22 → 54766 [ACK] Seq=7649 Ack=1013 Win=1452 Len=0 TSval=14920481 TSecr=7988973
   19 0.064976666  10.6.15.156 → 192.168.1.12 SSH 894 Server: Encrypted packet (len=828)
   20 0.067340146  10.6.15.156 → 192.168.1.12 SSH 1514 Server: Encrypted packet (len=1448)
   21 0.067363424 192.168.1.12 → 10.6.15.156  TCP 66 54766 → 22 [ACK] Seq=1013 Ack=9925 Win=6155 Len=0 TSval=7988984 TSecr=14920481
   22 0.067450092  10.6.15.156 → 192.168.1.12 SSH 1118 Server: Encrypted packet (len=1052)
   23 0.068585892 192.168.1.12 → 10.6.15.156  SSH 206 Client: Encrypted packet (len=140)
   24 0.070343344  10.6.15.156 → 192.168.1.12 TCP 66 22 → 54766 [ACK] Seq=10977 Ack=1153 Win=1452 Len=0 TSval=14920483 TSecr=7988984
   25 0.070363984 192.168.1.12 → 10.6.15.156  SSH 602 Client: Encrypted packet (len=536)
   26 0.072730484  10.6.15.156 → 192.168.1.12 TCP 66 22 → 54766 [ACK] Seq=10977 Ack=1689 Win=1452 Len=0 TSval=14920483 TSecr=7988985
   27 0.072738886 192.168.1.12 → 10.6.15.156  SSH 1286 Client: Encrypted packet (len=1220)
   28 0.075069133  10.6.15.156 → 192.168.1.12 TCP 66 22 → 54766 [ACK] Seq=10977 Ack=2909 Win=1452 Len=0 TSval=14920484 TSecr=7988985
   29 0.090611347  10.6.15.156 → 192.168.1.12 SSH 190 Server: Encrypted packet (len=124)
   30 0.099942150  10.6.15.156 → 192.168.1.12 SSH 1514 Server: Encrypted packet (len=1448)
   31 0.099960672 192.168.1.12 → 10.6.15.156  TCP 66 54766 → 22 [ACK] Seq=2909 Ack=12549 Win=6155 Len=0 TSval=7988992 TSecr=14920488
   32 0.100055102  10.6.15.156 → 192.168.1.12 SSH 1514 Server: Encrypted packet (len=1448)
   33 0.100255014  10.6.15.156 → 192.168.1.12 SSH 1514 Server: Encrypted packet (len=1448)
   34 0.100267764 192.168.1.12 → 10.6.15.156  TCP 66 54766 → 22 [ACK] Seq=2909 Ack=15445 Win=6155 Len=0 TSval=7988992 TSecr=14920490
   35 0.100430408  10.6.15.156 → 192.168.1.12 SSH 1514 Server: Encrypted packet (len=1448)
   36 0.100441523  10.6.15.156 → 192.168.1.12 SSH 526 Server: Encrypted packet (len=460)
   37 0.100446609 192.168.1.12 → 10.6.15.156  TCP 66 54766 → 22 [ACK] Seq=2909 Ack=17353 Win=6155 Len=0 TSval=7988992 TSecr=14920490
   38 0.132127764  10.6.15.156 → 192.168.1.12 SSH 166 Server: Encrypted packet (len=100)
   39 0.132468630 192.168.1.12 → 10.6.15.156  SSH 126 Client: Encrypted packet (len=60)
   40 0.136240332  10.6.15.156 → 192.168.1.12 SSH 134 Server: Encrypted packet (len=68)
   41 0.136372350  10.6.15.156 → 192.168.1.12 SSH 166 Server: Encrypted packet (len=100)
   42 0.136430973 192.168.1.12 → 10.6.15.156  TCP 66 54766 → 22 [ACK] Seq=2969 Ack=17621 Win=6155 Len=0 TSval=7989001 TSecr=14920499
   43 0.138896724  10.6.15.156 → 192.168.1.12 SSH 1514 Server: Encrypted packet (len=1448)
   44 0.139058130  10.6.15.156 → 192.168.1.12 SSH 1514 Server: Encrypted packet (len=1448)
   45 0.139071840 192.168.1.12 → 10.6.15.156  TCP 66 54766 → 22 [ACK] Seq=2969 Ack=20517 Win=6155 Len=0 TSval=7989002 TSecr=14920500
   46 0.139340026  10.6.15.156 → 192.168.1.12 SSH 1198 Server: Encrypted packet (len=1132)
   47 0.139518899  10.6.15.156 → 192.168.1.12 SSH 1514 Server: Encrypted packet (len=1448)
   48 0.139526776 192.168.1.12 → 10.6.15.156  TCP 66 54766 → 22 [ACK] Seq=2969 Ack=23097 Win=6155 Len=0 TSval=7989002 TSecr=14920500
   49 0.139692890  10.6.15.156 → 192.168.1.12 SSH 1514 Server: Encrypted packet (len=1448)
   50 0.140562886  10.6.15.156 → 192.168.1.12 SSH 1514 Server: Encrypted packet (len=1448)
   51 0.140584608 192.168.1.12 → 10.6.15.156  TCP 66 54766 → 22 [ACK] Seq=2969 Ack=25993 Win=6155 Len=0 TSval=7989002 TSecr=14920500
   52 0.140671791  10.6.15.156 → 192.168.1.12 SSH 1134 Server: Encrypted packet (len=1068)
   53 0.142512390  10.6.15.156 → 192.168.1.12 SSH 1514 Server: Encrypted packet (len=1448)
   54 0.142537012 192.168.1.12 → 10.6.15.156  TCP 66 54766 → 22 [ACK] Seq=2969 Ack=28509 Win=6155 Len=0 TSval=7989003 TSecr=14920500
   55 0.142670998  10.6.15.156 → 192.168.1.12 SSH 1514 Server: Encrypted packet (len=1448)
   56 0.142843746  10.6.15.156 → 192.168.1.12 SSH 1514 Server: Encrypted packet (len=1448)
   57 0.142853125 192.168.1.12 → 10.6.15.156  TCP 66 54766 → 22 [ACK] Seq=2969 Ack=31405 Win=6155 Len=0 TSval=7989003 TSecr=14920501
   58 0.143017785  10.6.15.156 → 192.168.1.12 SSH 1514 Server: Encrypted packet (len=1448)
   59 0.143029458  10.6.15.156 → 192.168.1.12 SSH 102 Server: Encrypted packet (len=36)
   60 0.143035241 192.168.1.12 → 10.6.15.156  TCP 66 54766 → 22 [ACK] Seq=2969 Ack=32889 Win=6155 Len=0 TSval=7989003 TSecr=14920501
   61 0.143357782  10.6.15.156 → 192.168.1.12 SSH 1514 Server: Encrypted packet (len=1448)
   62 0.160573084  10.6.15.156 → 192.168.1.12 SSH 1514 Server: Encrypted packet (len=1448)
   63 0.160595489 192.168.1.12 → 10.6.15.156  TCP 66 54766 → 22 [ACK] Seq=2969 Ack=35785 Win=6155 Len=0 TSval=7989007 TSecr=14920501
   64 0.247324215  10.6.15.156 → 192.168.1.12 SSH 1514 Server: Encrypted packet (len=1448)
   65 0.247485860  10.6.15.156 → 192.168.1.12 SSH 1514 Server: Encrypted packet (len=1448)
   66 0.247494743 192.168.1.12 → 10.6.15.156  TCP 66 54766 → 22 [ACK] Seq=2969 Ack=38681 Win=6155 Len=0 TSval=7989029 TSecr=14920527
   67 0.247652564  10.6.15.156 → 192.168.1.12 SSH 1514 Server: Encrypted packet (len=1448)
   68 0.247830754  10.6.15.156 → 192.168.1.12 SSH 1514 Server: Encrypted packet (len=1448)
   69 0.247836958 192.168.1.12 → 10.6.15.156  TCP 66 54766 → 22 [ACK] Seq=2969 Ack=41577 Win=6155 Len=0 TSval=7989029 TSecr=14920527
   70 0.247986654  10.6.15.156 → 192.168.1.12 SSH 1514 Server: Encrypted packet (len=1448)
   71 0.248003981 192.168.1.12 → 10.6.15.156  SSH 102 Client: Encrypted packet (len=36)
   72 0.248160131  10.6.15.156 → 192.168.1.12 SSH 1514 Server: Encrypted packet (len=1448)
   73 0.248501670  10.6.15.156 → 192.168.1.12 SSH 1514 Server: Encrypted packet (len=1448)
   74 0.248511335 192.168.1.12 → 10.6.15.156  SSH 126 Client: Encrypted packet (len=60)
   75 0.248675799  10.6.15.156 → 192.168.1.12 SSH 1514 Server: Encrypted packet (len=1448)
   76 0.250507134  10.6.15.156 → 192.168.1.12 SSH 1514 Server: Encrypted packet (len=1448)
   77 0.250523179 192.168.1.12 → 10.6.15.156  TCP 66 54766 → 22 [ACK] Seq=3065 Ack=48817 Win=6155 Len=0 TSval=7989030 TSecr=14920527
   78 0.250598152  10.6.15.156 → 192.168.1.12 SSH 970 Server: Encrypted packet (len=904)
   79 0.250736125  10.6.15.156 → 192.168.1.12 TCP 66 22 → 54766 [ACK] Seq=49721 Ack=3065 Win=1452 Len=0 TSval=14920528 TSecr=7989029
   80 0.267770689  10.6.15.156 → 192.168.1.12 SSH 1514 Server: Encrypted packet (len=1448)
   81 0.267786471 192.168.1.12 → 10.6.15.156  TCP 66 54766 → 22 [ACK] Seq=3065 Ack=51169 Win=6155 Len=0 TSval=7989034 TSecr=14920528
   82 0.267940077  10.6.15.156 → 192.168.1.12 SSH 1514 Server: Encrypted packet (len=1448)
   83 0.268017073  10.6.15.156 → 192.168.1.12 SSH 750 Server: Encrypted packet (len=684)
   84 0.268021740 192.168.1.12 → 10.6.15.156  TCP 66 54766 → 22 [ACK] Seq=3065 Ack=53301 Win=6155 Len=0 TSval=7989034 TSecr=14920532
   85 0.272681273  10.6.15.156 → 192.168.1.12 SSH 1514 Server: Encrypted packet (len=1448)
   86 0.272846170  10.6.15.156 → 192.168.1.12 SSH 1514 Server: Encrypted packet (len=1448)
   87 0.272856587 192.168.1.12 → 10.6.15.156  TCP 66 54766 → 22 [ACK] Seq=3065 Ack=56197 Win=6155 Len=0 TSval=7989035 TSecr=14920533
   88 0.273021339  10.6.15.156 → 192.168.1.12 SSH 1514 Server: Encrypted packet (len=1448)
   89 0.273191570  10.6.15.156 → 192.168.1.12 SSH 1514 Server: Encrypted packet (len=1448)
   90 0.273199125 192.168.1.12 → 10.6.15.156  TCP 66 54766 → 22 [ACK] Seq=3065 Ack=59093 Win=6155 Len=0 TSval=7989035 TSecr=14920533
   91 0.273350976  10.6.15.156 → 192.168.1.12 SSH 1406 Server: Encrypted packet (len=1340)
   92 0.273528905  10.6.15.156 → 192.168.1.12 SSH 1514 Server: Encrypted packet (len=1448)
   93 0.273534541 192.168.1.12 → 10.6.15.156  TCP 66 54766 → 22 [ACK] Seq=3065 Ack=61881 Win=6155 Len=0 TSval=7989035 TSecr=14920533
   94 0.273845702  10.6.15.156 → 192.168.1.12 SSH 1514 Server: Encrypted packet (len=1448)
   95 0.273994962  10.6.15.156 → 192.168.1.12 SSH 1334 Server: Encrypted packet (len=1268)
   96 0.274000888 192.168.1.12 → 10.6.15.156  TCP 66 54766 → 22 [ACK] Seq=3065 Ack=64597 Win=6155 Len=0 TSval=7989035 TSecr=14920533
   97 0.356433118  10.6.15.156 → 192.168.1.12 SSH 1514 Server: Encrypted packet (len=1448)
   98 0.356594780  10.6.15.156 → 192.168.1.12 SSH 1514 Server: Encrypted packet (len=1448)
   99 0.356607468 192.168.1.12 → 10.6.15.156  TCP 66 54766 → 22 [ACK] Seq=3065 Ack=67493 Win=6155 Len=0 TSval=7989056 TSecr=14920554
  100 0.356917264  10.6.15.156 → 192.168.1.12 SSH 1514 Server: Encrypted packet (len=1448)
  101 0.357085770  10.6.15.156 → 192.168.1.12 SSH 1514 Server: Encrypted packet (len=1448)
  102 0.357091979 192.168.1.12 → 10.6.15.156  TCP 66 54766 → 22 [ACK] Seq=3065 Ack=70389 Win=6155 Len=0 TSval=7989056 TSecr=14920554
  103 0.357102748  10.6.15.156 → 192.168.1.12 SSH 158 Server: Encrypted packet (len=92)
  104 0.362922929  10.6.15.156 → 192.168.1.12 SSH 1514 Server: Encrypted packet (len=1448)
  105 0.362942360 192.168.1.12 → 10.6.15.156  TCP 66 54766 → 22 [ACK] Seq=3065 Ack=71929 Win=6155 Len=0 TSval=7989058 TSecr=14920554
  106 0.363088239  10.6.15.156 → 192.168.1.12 SSH 1514 Server: Encrypted packet (len=1448)
  107 0.363259934  10.6.15.156 → 192.168.1.12 SSH 1514 Server: Encrypted packet (len=1448)
  108 0.363267087 192.168.1.12 → 10.6.15.156  TCP 66 54766 → 22 [ACK] Seq=3065 Ack=74825 Win=6155 Len=0 TSval=7989058 TSecr=14920556
  109 0.363430153  10.6.15.156 → 192.168.1.12 SSH 1514 Server: Encrypted packet (len=1448)
  110 0.363436341  10.6.15.156 → 192.168.1.12 SSH 158 Server: Encrypted packet (len=92)
  111 0.363440481 192.168.1.12 → 10.6.15.156  TCP 66 54766 → 22 [ACK] Seq=3065 Ack=76365 Win=6155 Len=0 TSval=7989058 TSecr=14920556
  112 0.452838123 192.168.1.12 → 10.6.15.156  SSH 390 Client: Encrypted packet (len=324)
  113 0.467797790  10.6.15.156 → 192.168.1.12 SSH 1514 Server: Encrypted packet (len=1448)
  114 0.467826393  10.6.15.156 → 192.168.1.12 SSH 174 Server: Encrypted packet (len=108)
  115 0.467839448 192.168.1.12 → 10.6.15.156  TCP 66 54766 → 22 [ACK] Seq=3389 Ack=77921 Win=6155 Len=0 TSval=7989084 TSecr=14920582
  116 0.494092119  10.6.15.156 → 192.168.1.12 SSH 1514 Server: Encrypted packet (len=1448)
  117 0.494252193  10.6.15.156 → 192.168.1.12 SSH 1514 Server: Encrypted packet (len=1448)
  118 0.494259835 192.168.1.12 → 10.6.15.156  TCP 66 54766 → 22 [ACK] Seq=3389 Ack=80817 Win=6155 Len=0 TSval=7989091 TSecr=14920589
  119 0.494427352  10.6.15.156 → 192.168.1.12 SSH 1514 Server: Encrypted packet (len=1448)
  120 0.494599041  10.6.15.156 → 192.168.1.12 SSH 1514 Server: Encrypted packet (len=1448)
  121 0.494606232 192.168.1.12 → 10.6.15.156  TCP 66 54766 → 22 [ACK] Seq=3389 Ack=83713 Win=6155 Len=0 TSval=7989091 TSecr=14920589
  122 0.494617572  10.6.15.156 → 192.168.1.12 SSH 158 Server: Encrypted packet (len=92)
  123 0.503402676  10.6.15.156 → 192.168.1.12 SSH 1514 Server: Encrypted packet (len=1448)
  124 0.503423032 192.168.1.12 → 10.6.15.156  TCP 66 54766 → 22 [ACK] Seq=3389 Ack=85253 Win=6155 Len=0 TSval=7989093 TSecr=14920589
  125 0.503564067  10.6.15.156 → 192.168.1.12 SSH 1514 Server: Encrypted packet (len=1448)
  126 0.503739488  10.6.15.156 → 192.168.1.12 SSH 1514 Server: Encrypted packet (len=1448)
  127 0.503747526 192.168.1.12 → 10.6.15.156  TCP 66 54766 → 22 [ACK] Seq=3389 Ack=88149 Win=6155 Len=0 TSval=7989093 TSecr=14920591
  128 0.503910960  10.6.15.156 → 192.168.1.12 SSH 1514 Server: Encrypted packet (len=1448)
  129 0.504082481  10.6.15.156 → 192.168.1.12 SSH 1514 Server: Encrypted packet (len=1448)
  130 0.504089278 192.168.1.12 → 10.6.15.156  TCP 66 54766 → 22 [ACK] Seq=3389 Ack=91045 Win=6155 Len=0 TSval=7989093 TSecr=14920591
  131 0.504099470  10.6.15.156 → 192.168.1.12 SSH 166 Server: Encrypted packet (len=100)
  132 0.504430835  10.6.15.156 → 192.168.1.12 SSH 1514 Server: Encrypted packet (len=1448)
  133 0.504439672 192.168.1.12 → 10.6.15.156  TCP 66 54766 → 22 [ACK] Seq=3389 Ack=92593 Win=6155 Len=0 TSval=7989093 TSecr=14920591
  134 0.506190968  10.6.15.156 → 192.168.1.12 SSH 366 Server: Encrypted packet (len=300)
  135 0.543216400  10.6.15.156 → 192.168.1.12 SSH 742 Server: Encrypted packet (len=676)
  136 0.543236688 192.168.1.12 → 10.6.15.156  TCP 66 54766 → 22 [ACK] Seq=3389 Ack=93569 Win=6155 Len=0 TSval=7989103 TSecr=14920592
  137 0.585998105  10.6.15.156 → 192.168.1.12 SSH 342 Server: Encrypted packet (len=276)
  138 0.611228050  10.6.15.156 → 192.168.1.12 SSH 222 Server: Encrypted packet (len=156)
  139 0.611428557 192.168.1.12 → 10.6.15.156  TCP 66 54766 → 22 [ACK] Seq=3389 Ack=94001 Win=6155 Len=0 TSval=7989120 TSecr=14920612
  140 0.649771575  10.6.15.156 → 192.168.1.12 SSH 566 Server: Encrypted packet (len=500)
  141 0.666495268  10.6.15.156 → 192.168.1.12 SSH 222 Server: Encrypted packet (len=156)
  142 0.666578282 192.168.1.12 → 10.6.15.156  TCP 66 54766 → 22 [ACK] Seq=3389 Ack=94657 Win=6155 Len=0 TSval=7989134 TSecr=14920628
  143 0.765825628  10.6.15.156 → 192.168.1.12 SSH 222 Server: Encrypted packet (len=156)
  144 0.806052742 192.168.1.12 → 10.6.15.156  TCP 66 54766 → 22 [ACK] Seq=3389 Ack=94813 Win=6155 Len=0 TSval=7989169 TSecr=14920656
  145 0.840908051 192.168.1.12 → 10.6.15.156  SSH 358 Client: Encrypted packet (len=292)
  146 0.881977577  10.6.15.156 → 192.168.1.12 TCP 66 22 → 54766 [ACK] Seq=94813 Ack=3681 Win=1452 Len=0 TSval=14920686 TSecr=7989177
  147 0.917932036  10.6.15.156 → 192.168.1.12 SSH 1514 Server: Encrypted packet (len=1448)
  148 0.918094772  10.6.15.156 → 192.168.1.12 SSH 1514 Server: Encrypted packet (len=1448)
  149 0.918106615 192.168.1.12 → 10.6.15.156  TCP 66 54766 → 22 [ACK] Seq=3681 Ack=97709 Win=6155 Len=0 TSval=7989197 TSecr=14920695
  150 0.918267719  10.6.15.156 → 192.168.1.12 SSH 1514 Server: Encrypted packet (len=1448)
  151 0.918439372  10.6.15.156 → 192.168.1.12 SSH 1514 Server: Encrypted packet (len=1448)
  152 0.918446828 192.168.1.12 → 10.6.15.156  TCP 66 54766 → 22 [ACK] Seq=3681 Ack=100605 Win=6155 Len=0 TSval=7989197 TSecr=14920695
  153 0.918458602  10.6.15.156 → 192.168.1.12 SSH 110 Server: Encrypted packet (len=44)
  154 0.918490319 192.168.1.12 → 10.6.15.156  TCP 66 54766 → 22 [ACK] Seq=3681 Ack=100649 Win=6155 Len=0 TSval=7989197 TSecr=14920695
  155 0.918783548  10.6.15.156 → 192.168.1.12 SSH 1514 Server: Encrypted packet (len=1448)
  156 0.918951798  10.6.15.156 → 192.168.1.12 SSH 1514 Server: Encrypted packet (len=1448)
  157 0.918959237 192.168.1.12 → 10.6.15.156  TCP 66 54766 → 22 [ACK] Seq=3681 Ack=103545 Win=6155 Len=0 TSval=7989197 TSecr=14920695
  158 0.919124202  10.6.15.156 → 192.168.1.12 SSH 1514 Server: Encrypted packet (len=1448)
  159 0.921295509  10.6.15.156 → 192.168.1.12 SSH 1514 Server: Encrypted packet (len=1448)
  160 0.921316813 192.168.1.12 → 10.6.15.156  TCP 66 54766 → 22 [ACK] Seq=3681 Ack=106441 Win=6155 Len=0 TSval=7989197 TSecr=14920695
  161 0.921455574  10.6.15.156 → 192.168.1.12 SSH 1514 Server: Encrypted packet (len=1448)
  162 0.921592635  10.6.15.156 → 192.168.1.12 SSH 142 Server: Encrypted packet (len=76)
  163 0.921598725 192.168.1.12 → 10.6.15.156  TCP 66 54766 → 22 [ACK] Seq=3681 Ack=107965 Win=6155 Len=0 TSval=7989197 TSecr=14920695
  164 0.973884899  10.6.15.156 → 192.168.1.12 SSH 334 Server: Encrypted packet (len=268)
  165 0.973959539 192.168.1.12 → 10.6.15.156  TCP 66 54766 → 22 [ACK] Seq=3681 Ack=108233 Win=6155 Len=0 TSval=7989210 TSecr=14920709
  166 0.985805309  10.6.15.156 → 192.168.1.12 SSH 1514 Server: Encrypted packet (len=1448)
  167 0.985826009  10.6.15.156 → 192.168.1.12 SSH 142 Server: Encrypted packet (len=76)
  168 0.985837230 192.168.1.12 → 10.6.15.156  TCP 66 54766 → 22 [ACK] Seq=3681 Ack=109757 Win=6155 Len=0 TSval=7989213 TSecr=14920712
  169 0.992441798  10.6.15.156 → 192.168.1.12 SSH 190 Server: Encrypted packet (len=124)
  170 0.992521709 192.168.1.12 → 10.6.15.156  TCP 66 54766 → 22 [ACK] Seq=3681 Ack=109881 Win=6155 Len=0 TSval=7989215 TSecr=14920713
  171 1.012597986 192.168.1.12 → 10.6.15.156  SSH 110 Client: Encrypted packet (len=44)
  172 1.014761792  10.6.15.156 → 192.168.1.12 TCP 66 22 → 54766 [ACK] Seq=109881 Ack=3725 Win=1452 Len=0 TSval=14920719 TSecr=7989220
  173 1.015065412 192.168.1.12 → 10.6.15.156  SSH 294 Client: Encrypted packet (len=228)
  174 1.016808145  10.6.15.156 → 192.168.1.12 TCP 66 22 → 54766 [ACK] Seq=109881 Ack=3953 Win=1452 Len=0 TSval=14920720 TSecr=7989221
  175 1.016828865 192.168.1.12 → 10.6.15.156  SSH 314 Client: Encrypted packet (len=248)
  176 1.017169114 192.168.1.12 → 10.6.15.156  SSH 190 Client: Encrypted packet (len=124)
  177 1.017396040 192.168.1.12 → 10.6.15.156  SSH 190 Client: Encrypted packet (len=124)
  178 1.018952285  10.6.15.156 → 192.168.1.12 TCP 66 22 → 54766 [ACK] Seq=109881 Ack=4449 Win=1452 Len=0 TSval=14920720 TSecr=7989221
  179 1.018967273 192.168.1.12 → 10.6.15.156  SSH 190 Client: Encrypted packet (len=124)
  180 1.019285935 192.168.1.12 → 10.6.15.156  SSH 190 Client: Encrypted packet (len=124)
  181 1.021540097  10.6.15.156 → 192.168.1.12 TCP 66 22 → 54766 [ACK] Seq=109881 Ack=4697 Win=1452 Len=0 TSval=14920721 TSecr=7989222
  182 1.061909432  10.6.15.156 → 192.168.1.12 SSH 206 Server: Encrypted packet (len=140)
  183 1.100741880  10.6.15.156 → 192.168.1.12 SSH 1514 Server: Encrypted packet (len=1448)
  184 1.100761378 192.168.1.12 → 10.6.15.156  TCP 66 54766 → 22 [ACK] Seq=4697 Ack=111469 Win=6155 Len=0 TSval=7989242 TSecr=14920731
  185 1.100844261  10.6.15.156 → 192.168.1.12 SSH 1514 Server: Encrypted packet (len=1448)
  186 1.101060440  10.6.15.156 → 192.168.1.12 SSH 1514 Server: Encrypted packet (len=1448)
  187 1.101077943 192.168.1.12 → 10.6.15.156  TCP 66 54766 → 22 [ACK] Seq=4697 Ack=114365 Win=6155 Len=0 TSval=7989242 TSecr=14920740
  188 1.101193046  10.6.15.156 → 192.168.1.12 SSH 1514 Server: Encrypted packet (len=1448)
  189 1.101200220  10.6.15.156 → 192.168.1.12 SSH 110 Server: Encrypted packet (len=44)
  190 1.101205828 192.168.1.12 → 10.6.15.156  TCP 66 54766 → 22 [ACK] Seq=4697 Ack=115857 Win=6155 Len=0 TSval=7989242 TSecr=14920740
  191 1.101887673  10.6.15.156 → 192.168.1.12 SSH 1514 Server: Encrypted packet (len=1448)
  192 1.102029704  10.6.15.156 → 192.168.1.12 SSH 1514 Server: Encrypted packet (len=1448)
  193 1.102039821 192.168.1.12 → 10.6.15.156  TCP 66 54766 → 22 [ACK] Seq=4697 Ack=118753 Win=6155 Len=0 TSval=7989242 TSecr=14920741
  194 1.103686807  10.6.15.156 → 192.168.1.12 SSH 1514 Server: Encrypted packet (len=1448)
  195 1.103787987  10.6.15.156 → 192.168.1.12 SSH 1514 Server: Encrypted packet (len=1448)
  196 1.103795855 192.168.1.12 → 10.6.15.156  TCP 66 54766 → 22 [ACK] Seq=4697 Ack=121649 Win=6155 Len=0 TSval=7989243 TSecr=14920741
  197 1.104003537  10.6.15.156 → 192.168.1.12 SSH 1514 Server: Encrypted packet (len=1448)
  198 1.104163575  10.6.15.156 → 192.168.1.12 SSH 1514 Server: Encrypted packet (len=1448)
  199 1.104175042 192.168.1.12 → 10.6.15.156  TCP 66 54766 → 22 [ACK] Seq=4697 Ack=124545 Win=6155 Len=0 TSval=7989243 TSecr=14920741
  200 1.104334910  10.6.15.156 → 192.168.1.12 SSH 1514 Server: Encrypted packet (len=1448)
  201 1.104507184  10.6.15.156 → 192.168.1.12 SSH 1514 Server: Encrypted packet (len=1448)
  202 1.104510557 192.168.1.12 → 10.6.15.156  TCP 66 54766 → 22 [ACK] Seq=4697 Ack=127441 Win=6155 Len=0 TSval=7989243 TSecr=14920741
  203 1.104832613  10.6.15.156 → 192.168.1.12 SSH 1514 Server: Encrypted packet (len=1448)
  204 1.104979047  10.6.15.156 → 192.168.1.12 SSH 1514 Server: Encrypted packet (len=1448)
  205 1.104982259 192.168.1.12 → 10.6.15.156  TCP 66 54766 → 22 [ACK] Seq=4697 Ack=130337 Win=6155 Len=0 TSval=7989243 TSecr=14920741
  206 1.107523525  10.6.15.156 → 192.168.1.12 SSH 1514 Server: Encrypted packet (len=1448)
  207 1.107628246  10.6.15.156 → 192.168.1.12 SSH 1514 Server: Encrypted packet (len=1448)
  208 1.107636587 192.168.1.12 → 10.6.15.156  TCP 66 54766 → 22 [ACK] Seq=4697 Ack=133233 Win=6155 Len=0 TSval=7989244 TSecr=14920742
  209 1.107836173  10.6.15.156 → 192.168.1.12 SSH 1514 Server: Encrypted packet (len=1448)
  210 1.108008378  10.6.15.156 → 192.168.1.12 SSH 1514 Server: Encrypted packet (len=1448)
  211 1.108015370 192.168.1.12 → 10.6.15.156  TCP 66 54766 → 22 [ACK] Seq=4697 Ack=136129 Win=6155 Len=0 TSval=7989244 TSecr=14920742
  212 1.108174297  10.6.15.156 → 192.168.1.12 SSH 1514 Server: Encrypted packet (len=1448)
  213 1.108348210  10.6.15.156 → 192.168.1.12 SSH 1514 Server: Encrypted packet (len=1448)
  214 1.108352683 192.168.1.12 → 10.6.15.156  TCP 66 54766 → 22 [ACK] Seq=4697 Ack=139025 Win=6155 Len=0 TSval=7989244 TSecr=14920742
  215 1.108637408  10.6.15.156 → 192.168.1.12 SSH 154 Server: Encrypted packet (len=88)
  216 1.118250905  10.6.15.156 → 192.168.1.12 SSH 646 Server: Encrypted packet (len=580)
  217 1.118331109 192.168.1.12 → 10.6.15.156  TCP 66 54766 → 22 [ACK] Seq=4697 Ack=139693 Win=6155 Len=0 TSval=7989247 TSecr=14920742
  218 1.144848664  10.6.15.156 → 192.168.1.12 SSH 110 Server: Encrypted packet (len=44)
  219 1.145303315 192.168.1.12 → 10.6.15.156  SSH 406 Client: Encrypted packet (len=340)
  220 1.147306582  10.6.15.156 → 192.168.1.12 TCP 66 22 → 54766 [ACK] Seq=139737 Ack=5037 Win=1452 Len=0 TSval=14920752 TSecr=7989253
  221 1.167767417  10.6.15.156 → 192.168.1.12 SSH 166 Server: Encrypted packet (len=100)
  222 1.194894207 192.168.1.12 → 10.6.15.156  SSH 342 Client: Encrypted packet (len=276)
  223 1.202638152  10.6.15.156 → 192.168.1.12 SSH 1514 Server: Encrypted packet (len=1448)
  224 1.202663738  10.6.15.156 → 192.168.1.12 SSH 382 Server: Encrypted packet (len=316)
  225 1.202674757 192.168.1.12 → 10.6.15.156  TCP 66 54766 → 22 [ACK] Seq=5313 Ack=141601 Win=6155 Len=0 TSval=7989268 TSecr=14920766
  226 1.204363501  10.6.15.156 → 192.168.1.12 SSH 1514 Server: Encrypted packet (len=1448)
  227 1.204526246  10.6.15.156 → 192.168.1.12 SSH 1514 Server: Encrypted packet (len=1448)
  228 1.204537835 192.168.1.12 → 10.6.15.156  TCP 66 54766 → 22 [ACK] Seq=5313 Ack=144497 Win=6155 Len=0 TSval=7989268 TSecr=14920766
  229 1.204698317  10.6.15.156 → 192.168.1.12 SSH 1514 Server: Encrypted packet (len=1448)
  230 1.204868603  10.6.15.156 → 192.168.1.12 SSH 1514 Server: Encrypted packet (len=1448)
  231 1.204873314 192.168.1.12 → 10.6.15.156  TCP 66 54766 → 22 [ACK] Seq=5313 Ack=147393 Win=6155 Len=0 TSval=7989268 TSecr=14920766
  232 1.205041649  10.6.15.156 → 192.168.1.12 SSH 1514 Server: Encrypted packet (len=1448)
  233 1.205214357  10.6.15.156 → 192.168.1.12 SSH 1514 Server: Encrypted packet (len=1448)
  234 1.205218018 192.168.1.12 → 10.6.15.156  TCP 66 54766 → 22 [ACK] Seq=5313 Ack=150289 Win=6155 Len=0 TSval=7989268 TSecr=14920766
  235 1.205226006  10.6.15.156 → 192.168.1.12 SSH 94 Server: Encrypted packet (len=28)
  236 1.205555731  10.6.15.156 → 192.168.1.12 SSH 1514 Server: Encrypted packet (len=1448)
  237 1.205562148 192.168.1.12 → 10.6.15.156  TCP 66 54766 → 22 [ACK] Seq=5313 Ack=151765 Win=6155 Len=0 TSval=7989268 TSecr=14920766
  238 1.205730277  10.6.15.156 → 192.168.1.12 SSH 1514 Server: Encrypted packet (len=1448)
  239 1.209740958  10.6.15.156 → 192.168.1.12 SSH 1514 Server: Encrypted packet (len=1448)
  240 1.209762404 192.168.1.12 → 10.6.15.156  TCP 66 54766 → 22 [ACK] Seq=5313 Ack=154661 Win=6155 Len=0 TSval=7989269 TSecr=14920767
  241 1.209901833  10.6.15.156 → 192.168.1.12 SSH 1514 Server: Encrypted packet (len=1448)
  242 1.210074920  10.6.15.156 → 192.168.1.12 SSH 1514 Server: Encrypted packet (len=1448)
  243 1.210081363 192.168.1.12 → 10.6.15.156  TCP 66 54766 → 22 [ACK] Seq=5313 Ack=157557 Win=6155 Len=0 TSval=7989270 TSecr=14920768
  244 1.210247599  10.6.15.156 → 192.168.1.12 SSH 1514 Server: Encrypted packet (len=1448)
  245 1.210420595  10.6.15.156 → 192.168.1.12 SSH 1514 Server: Encrypted packet (len=1448)
  246 1.210427405 192.168.1.12 → 10.6.15.156  TCP 66 54766 → 22 [ACK] Seq=5313 Ack=160453 Win=6155 Len=0 TSval=7989270 TSecr=14920768
  247 1.210594712  10.6.15.156 → 192.168.1.12 SSH 1514 Server: Encrypted packet (len=1448)
  248 1.210920756  10.6.15.156 → 192.168.1.12 SSH 1514 Server: Encrypted packet (len=1448)
  249 1.210928438 192.168.1.12 → 10.6.15.156  TCP 66 54766 → 22 [ACK] Seq=5313 Ack=163349 Win=6155 Len=0 TSval=7989270 TSecr=14920768
  250 1.211089836  10.6.15.156 → 192.168.1.12 SSH 1514 Server: Encrypted packet (len=1448)
  251 1.214903544  10.6.15.156 → 192.168.1.12 SSH 1514 Server: Encrypted packet (len=1448)
  252 1.214919962 192.168.1.12 → 10.6.15.156  TCP 66 54766 → 22 [ACK] Seq=5313 Ack=166245 Win=6155 Len=0 TSval=7989271 TSecr=14920768
  253 1.215065398  10.6.15.156 → 192.168.1.12 SSH 1514 Server: Encrypted packet (len=1448)
  254 1.215237926  10.6.15.156 → 192.168.1.12 SSH 1514 Server: Encrypted packet (len=1448)
  255 1.215241244 192.168.1.12 → 10.6.15.156  TCP 66 54766 → 22 [ACK] Seq=5313 Ack=169141 Win=6155 Len=0 TSval=7989271 TSecr=14920769
  256 1.215424105  10.6.15.156 → 192.168.1.12 SSH 1514 Server: Encrypted packet (len=1448)
  257 1.215583879  10.6.15.156 → 192.168.1.12 SSH 1514 Server: Encrypted packet (len=1448)
  258 1.215586992 192.168.1.12 → 10.6.15.156  TCP 66 54766 → 22 [ACK] Seq=5313 Ack=172037 Win=6155 Len=0 TSval=7989271 TSecr=14920769
  259 1.215756417  10.6.15.156 → 192.168.1.12 SSH 1514 Server: Encrypted packet (len=1448)
  260 1.216081265  10.6.15.156 → 192.168.1.12 SSH 1514 Server: Encrypted packet (len=1448)
  261 1.216085593 192.168.1.12 → 10.6.15.156  TCP 66 54766 → 22 [ACK] Seq=5313 Ack=174933 Win=6155 Len=0 TSval=7989271 TSecr=14920769
  262 1.216244244  10.6.15.156 → 192.168.1.12 SSH 1514 Server: Encrypted packet (len=1448)
  263 1.219446722  10.6.15.156 → 192.168.1.12 SSH 1514 Server: Encrypted packet (len=1448)
  264 1.219463777 192.168.1.12 → 10.6.15.156  TCP 66 54766 → 22 [ACK] Seq=5313 Ack=177829 Win=6155 Len=0 TSval=7989272 TSecr=14920769
  265 1.219609419  10.6.15.156 → 192.168.1.12 SSH 1514 Server: Encrypted packet (len=1448)
  266 1.219781452  10.6.15.156 → 192.168.1.12 SSH 1514 Server: Encrypted packet (len=1448)
  267 1.219785196 192.168.1.12 → 10.6.15.156  TCP 66 54766 → 22 [ACK] Seq=5313 Ack=180725 Win=6155 Len=0 TSval=7989272 TSecr=14920770
  268 1.219954649  10.6.15.156 → 192.168.1.12 SSH 1514 Server: Encrypted packet (len=1448)
  269 1.220126467  10.6.15.156 → 192.168.1.12 SSH 1514 Server: Encrypted packet (len=1448)
  270 1.220129459 192.168.1.12 → 10.6.15.156  TCP 66 54766 → 22 [ACK] Seq=5313 Ack=183621 Win=6155 Len=0 TSval=7989272 TSecr=14920770
  271 1.220285325  10.6.15.156 → 192.168.1.12 SSH 1514 Server: Encrypted packet (len=1448)
  272 1.220611838  10.6.15.156 → 192.168.1.12 SSH 1514 Server: Encrypted packet (len=1448)
  273 1.220614663 192.168.1.12 → 10.6.15.156  TCP 66 54766 → 22 [ACK] Seq=5313 Ack=186517 Win=6155 Len=0 TSval=7989272 TSecr=14920770
  274 1.220784421  10.6.15.156 → 192.168.1.12 SSH 1514 Server: Encrypted packet (len=1448)
  275 1.223347014  10.6.15.156 → 192.168.1.12 SSH 1514 Server: Encrypted packet (len=1448)
  276 1.223361207 192.168.1.12 → 10.6.15.156  TCP 66 54766 → 22 [ACK] Seq=5313 Ack=189413 Win=6155 Len=0 TSval=7989273 TSecr=14920770
  277 1.223518273  10.6.15.156 → 192.168.1.12 SSH 1514 Server: Encrypted packet (len=1448)
  278 1.223674607  10.6.15.156 → 192.168.1.12 SSH 1514 Server: Encrypted packet (len=1448)
  279 1.223678959 192.168.1.12 → 10.6.15.156  TCP 66 54766 → 22 [ACK] Seq=5313 Ack=192309 Win=6155 Len=0 TSval=7989273 TSecr=14920771
  280 1.223848067  10.6.15.156 → 192.168.1.12 SSH 1514 Server: Encrypted packet (len=1448)
  281 1.224020757  10.6.15.156 → 192.168.1.12 SSH 1514 Server: Encrypted packet (len=1448)
  282 1.224028817 192.168.1.12 → 10.6.15.156  TCP 66 54766 → 22 [ACK] Seq=5313 Ack=195205 Win=6155 Len=0 TSval=7989273 TSecr=14920771
  283 1.224194801  10.6.15.156 → 192.168.1.12 SSH 1514 Server: Encrypted packet (len=1448)
  284 1.224366525  10.6.15.156 → 192.168.1.12 SSH 1514 Server: Encrypted packet (len=1448)
  285 1.224375119 192.168.1.12 → 10.6.15.156  TCP 66 54766 → 22 [ACK] Seq=5313 Ack=198101 Win=6155 Len=0 TSval=7989273 TSecr=14920771
  286 1.224995133  10.6.15.156 → 192.168.1.12 SSH 1514 Server: Encrypted packet (len=1448)
  287 1.227537963  10.6.15.156 → 192.168.1.12 SSH 1514 Server: Encrypted packet (len=1448)
  288 1.227561846 192.168.1.12 → 10.6.15.156  TCP 66 54766 → 22 [ACK] Seq=5313 Ack=200997 Win=6155 Len=0 TSval=7989274 TSecr=14920771
  289 1.227694861  10.6.15.156 → 192.168.1.12 SSH 1514 Server: Encrypted packet (len=1448)
  290 1.227868476  10.6.15.156 → 192.168.1.12 SSH 1514 Server: Encrypted packet (len=1448)
  291 1.227876366 192.168.1.12 → 10.6.15.156  TCP 66 54766 → 22 [ACK] Seq=5313 Ack=203893 Win=6155 Len=0 TSval=7989274 TSecr=14920772
  292 1.228041398  10.6.15.156 → 192.168.1.12 SSH 1514 Server: Encrypted packet (len=1448)
  293 1.228215251  10.6.15.156 → 192.168.1.12 SSH 1514 Server: Encrypted packet (len=1448)
  294 1.228222511 192.168.1.12 → 10.6.15.156  TCP 66 54766 → 22 [ACK] Seq=5313 Ack=206789 Win=6155 Len=0 TSval=7989274 TSecr=14920772
  295 1.228385760  10.6.15.156 → 192.168.1.12 SSH 1514 Server: Encrypted packet (len=1448)
  296 1.228557634  10.6.15.156 → 192.168.1.12 SSH 1514 Server: Encrypted packet (len=1448)
  297 1.228565523 192.168.1.12 → 10.6.15.156  TCP 66 54766 → 22 [ACK] Seq=5313 Ack=209685 Win=6155 Len=0 TSval=7989274 TSecr=14920772
  298 1.228888002  10.6.15.156 → 192.168.1.12 SSH 1514 Server: Encrypted packet (len=1448)
  299 1.231438032  10.6.15.156 → 192.168.1.12 SSH 1514 Server: Encrypted packet (len=1448)
  300 1.231459837 192.168.1.12 → 10.6.15.156  TCP 66 54766 → 22 [ACK] Seq=5313 Ack=212581 Win=6155 Len=0 TSval=7989275 TSecr=14920772
  301 1.231597138  10.6.15.156 → 192.168.1.12 SSH 1514 Server: Encrypted packet (len=1448)
  302 1.231772811  10.6.15.156 → 192.168.1.12 SSH 1514 Server: Encrypted packet (len=1448)
  303 1.231780732 192.168.1.12 → 10.6.15.156  TCP 66 54766 → 22 [ACK] Seq=5313 Ack=215477 Win=6155 Len=0 TSval=7989275 TSecr=14920773
  304 1.231943415  10.6.15.156 → 192.168.1.12 SSH 1514 Server: Encrypted packet (len=1448)
  305 1.232117309  10.6.15.156 → 192.168.1.12 SSH 1514 Server: Encrypted packet (len=1448)
  306 1.232125506 192.168.1.12 → 10.6.15.156  TCP 66 54766 → 22 [ACK] Seq=5313 Ack=218373 Win=6155 Len=0 TSval=7989275 TSecr=14920773
  307 1.232288436  10.6.15.156 → 192.168.1.12 SSH 1514 Server: Encrypted packet (len=1448)
  308 1.232462531  10.6.15.156 → 192.168.1.12 SSH 1514 Server: Encrypted packet (len=1448)
  309 1.232471573 192.168.1.12 → 10.6.15.156  TCP 66 54766 → 22 [ACK] Seq=5313 Ack=221269 Win=6155 Len=0 TSval=7989275 TSecr=14920773
  310 1.232788088  10.6.15.156 → 192.168.1.12 SSH 1514 Server: Encrypted packet (len=1448)
  311 1.235245993  10.6.15.156 → 192.168.1.12 SSH 1514 Server: Encrypted packet (len=1448)
  312 1.235269137 192.168.1.12 → 10.6.15.156  TCP 66 54766 → 22 [ACK] Seq=5313 Ack=224165 Win=6155 Len=0 TSval=7989276 TSecr=14920773
  313 1.235406670  10.6.15.156 → 192.168.1.12 SSH 1514 Server: Encrypted packet (len=1448)
  314 1.235579884  10.6.15.156 → 192.168.1.12 SSH 1514 Server: Encrypted packet (len=1448)
  315 1.235587350 192.168.1.12 → 10.6.15.156  TCP 66 54766 → 22 [ACK] Seq=5313 Ack=227061 Win=6155 Len=0 TSval=7989276 TSecr=14920774
  316 1.235752747  10.6.15.156 → 192.168.1.12 SSH 1514 Server: Encrypted packet (len=1448)
  317 1.235924259  10.6.15.156 → 192.168.1.12 SSH 1514 Server: Encrypted packet (len=1448)
  318 1.235933293 192.168.1.12 → 10.6.15.156  TCP 66 54766 → 22 [ACK] Seq=5313 Ack=229957 Win=6155 Len=0 TSval=7989276 TSecr=14920774
  319 1.236097032  10.6.15.156 → 192.168.1.12 SSH 1514 Server: Encrypted packet (len=1448)
  320 1.236423353  10.6.15.156 → 192.168.1.12 SSH 1514 Server: Encrypted packet (len=1448)
  321 1.236433195 192.168.1.12 → 10.6.15.156  TCP 66 54766 → 22 [ACK] Seq=5313 Ack=232853 Win=6155 Len=0 TSval=7989276 TSecr=14920774
  322 1.236595282  10.6.15.156 → 192.168.1.12 SSH 1514 Server: Encrypted packet (len=1448)
  323 1.240784496  10.6.15.156 → 192.168.1.12 SSH 1514 Server: Encrypted packet (len=1448)
  324 1.240806422 192.168.1.12 → 10.6.15.156  TCP 66 54766 → 22 [ACK] Seq=5313 Ack=235749 Win=6155 Len=0 TSval=7989277 TSecr=14920774
  325 1.240946517  10.6.15.156 → 192.168.1.12 SSH 1514 Server: Encrypted packet (len=1448)
  326 1.241119820  10.6.15.156 → 192.168.1.12 SSH 1514 Server: Encrypted packet (len=1448)
  327 1.241126299 192.168.1.12 → 10.6.15.156  TCP 66 54766 → 22 [ACK] Seq=5313 Ack=238645 Win=6155 Len=0 TSval=7989277 TSecr=14920775
  328 1.241291677  10.6.15.156 → 192.168.1.12 SSH 1514 Server: Encrypted packet (len=1448)
  329 1.241464250  10.6.15.156 → 192.168.1.12 SSH 1514 Server: Encrypted packet (len=1448)
  330 1.241468610 192.168.1.12 → 10.6.15.156  TCP 66 54766 → 22 [ACK] Seq=5313 Ack=241541 Win=6155 Len=0 TSval=7989277 TSecr=14920775
  331 1.241506944 192.168.1.12 → 10.6.15.156  SSH 102 Client: Encrypted packet (len=36)
  332 1.241638147  10.6.15.156 → 192.168.1.12 SSH 1514 Server: Encrypted packet (len=1448)
  333 1.241811194  10.6.15.156 → 192.168.1.12 SSH 1514 Server: Encrypted packet (len=1448)
  334 1.241819781 192.168.1.12 → 10.6.15.156  TCP 66 54766 → 22 [ACK] Seq=5349 Ack=244437 Win=6155 Len=0 TSval=7989277 TSecr=14920775
  335 1.241983701  10.6.15.156 → 192.168.1.12 SSH 1514 Server: Encrypted packet (len=1448)
  336 1.244079784  10.6.15.156 → 192.168.1.12 SSH 1514 Server: Encrypted packet (len=1448)
  337 1.244102604 192.168.1.12 → 10.6.15.156  TCP 66 54766 → 22 [ACK] Seq=5349 Ack=247333 Win=6155 Len=0 TSval=7989278 TSecr=14920775
  338 1.244372497  10.6.15.156 → 192.168.1.12 SSH 1514 Server: Encrypted packet (len=1448)
  339 1.244543606  10.6.15.156 → 192.168.1.12 SSH 1514 Server: Encrypted packet (len=1448)
  340 1.244553915 192.168.1.12 → 10.6.15.156  TCP 66 54766 → 22 [ACK] Seq=5349 Ack=250229 Win=6155 Len=0 TSval=7989278 TSecr=14920776
  341 1.244715019  10.6.15.156 → 192.168.1.12 SSH 1514 Server: Encrypted packet (len=1448)
  342 1.245041415  10.6.15.156 → 192.168.1.12 SSH 1514 Server: Encrypted packet (len=1448)
  343 1.245050924 192.168.1.12 → 10.6.15.156  TCP 66 54766 → 22 [ACK] Seq=5349 Ack=253125 Win=6155 Len=0 TSval=7989278 TSecr=14920776
  344 1.245213162  10.6.15.156 → 192.168.1.12 SSH 1514 Server: Encrypted packet (len=1448)
  345 1.245388138  10.6.15.156 → 192.168.1.12 SSH 1514 Server: Encrypted packet (len=1448)
  346 1.245400661 192.168.1.12 → 10.6.15.156  TCP 66 54766 → 22 [ACK] Seq=5349 Ack=256021 Win=6155 Len=0 TSval=7989278 TSecr=14920776
  347 1.245557888  10.6.15.156 → 192.168.1.12 SSH 1514 Server: Encrypted packet (len=1448)
  348 1.248213601  10.6.15.156 → 192.168.1.12 SSH 1514 Server: Encrypted packet (len=1448)
  349 1.248236585 192.168.1.12 → 10.6.15.156  TCP 66 54766 → 22 [ACK] Seq=5349 Ack=258917 Win=6155 Len=0 TSval=7989279 TSecr=14920776
  350 1.248374508  10.6.15.156 → 192.168.1.12 SSH 1514 Server: Encrypted packet (len=1448)
  351 1.248547140  10.6.15.156 → 192.168.1.12 SSH 1514 Server: Encrypted packet (len=1448)
  352 1.248554918 192.168.1.12 → 10.6.15.156  TCP 66 54766 → 22 [ACK] Seq=5349 Ack=261813 Win=6155 Len=0 TSval=7989279 TSecr=14920777
  353 1.248719425  10.6.15.156 → 192.168.1.12 SSH 1514 Server: Encrypted packet (len=1448)
  354 1.248893627  10.6.15.156 → 192.168.1.12 SSH 1514 Server: Encrypted packet (len=1448)
  355 1.248902222 192.168.1.12 → 10.6.15.156  TCP 66 54766 → 22 [ACK] Seq=5349 Ack=264709 Win=6155 Len=0 TSval=7989279 TSecr=14920777
  356 1.249064798  10.6.15.156 → 192.168.1.12 SSH 1514 Server: Encrypted packet (len=1448)
  357 1.249237001  10.6.15.156 → 192.168.1.12 SSH 1514 Server: Encrypted packet (len=1448)
  358 1.249244192 192.168.1.12 → 10.6.15.156  TCP 66 54766 → 22 [ACK] Seq=5349 Ack=267605 Win=6155 Len=0 TSval=7989279 TSecr=14920777
  359 1.249410384  10.6.15.156 → 192.168.1.12 SSH 1514 Server: Encrypted packet (len=1448)
  360 1.249735972  10.6.15.156 → 192.168.1.12 SSH 1514 Server: Encrypted packet (len=1448)
  361 1.249745734 192.168.1.12 → 10.6.15.156  TCP 66 54766 → 22 [ACK] Seq=5349 Ack=270501 Win=6155 Len=0 TSval=7989279 TSecr=14920777
  362 1.252207883  10.6.15.156 → 192.168.1.12 SSH 1514 Server: Encrypted packet (len=1448)
  363 1.252366902  10.6.15.156 → 192.168.1.12 SSH 1514 Server: Encrypted packet (len=1448)
  364 1.252377260 192.168.1.12 → 10.6.15.156  TCP 66 54766 → 22 [ACK] Seq=5349 Ack=273397 Win=6155 Len=0 TSval=7989280 TSecr=14920778
  365 1.252537941  10.6.15.156 → 192.168.1.12 SSH 1514 Server: Encrypted packet (len=1448)
  366 1.252713440  10.6.15.156 → 192.168.1.12 SSH 1514 Server: Encrypted packet (len=1448)
  367 1.252721948 192.168.1.12 → 10.6.15.156  TCP 66 54766 → 22 [ACK] Seq=5349 Ack=276293 Win=6155 Len=0 TSval=7989280 TSecr=14920778
  368 1.252885435  10.6.15.156 → 192.168.1.12 SSH 1514 Server: Encrypted packet (len=1448)
  369 1.253057618  10.6.15.156 → 192.168.1.12 SSH 1514 Server: Encrypted packet (len=1448)
  370 1.253065311 192.168.1.12 → 10.6.15.156  TCP 66 54766 → 22 [ACK] Seq=5349 Ack=279189 Win=6155 Len=0 TSval=7989280 TSecr=14920778
  371 1.253386023  10.6.15.156 → 192.168.1.12 SSH 1514 Server: Encrypted packet (len=1448)
  372 1.253554118  10.6.15.156 → 192.168.1.12 SSH 1514 Server: Encrypted packet (len=1448)
  373 1.253564047 192.168.1.12 → 10.6.15.156  TCP 66 54766 → 22 [ACK] Seq=5349 Ack=282085 Win=6155 Len=0 TSval=7989280 TSecr=14920778
  374 1.253726771  10.6.15.156 → 192.168.1.12 SSH 1514 Server: Encrypted packet (len=1448)
  375 1.253901968  10.6.15.156 → 192.168.1.12 SSH 1514 Server: Encrypted packet (len=1448)
  376 1.253909637 192.168.1.12 → 10.6.15.156  TCP 66 54766 → 22 [ACK] Seq=5349 Ack=284981 Win=6155 Len=0 TSval=7989280 TSecr=14920778
  377 1.254072486  10.6.15.156 → 192.168.1.12 SSH 1514 Server: Encrypted packet (len=1448)
  378 1.256587078  10.6.15.156 → 192.168.1.12 SSH 1514 Server: Encrypted packet (len=1448)
  379 1.256606953 192.168.1.12 → 10.6.15.156  TCP 66 54766 → 22 [ACK] Seq=5349 Ack=287877 Win=6155 Len=0 TSval=7989281 TSecr=14920778
  380 1.256759480  10.6.15.156 → 192.168.1.12 SSH 1514 Server: Encrypted packet (len=1448)
  381 1.256923356  10.6.15.156 → 192.168.1.12 SSH 1514 Server: Encrypted packet (len=1448)
