    1 0.000000000  10.6.15.156 → 192.168.1.12 SSH 110 Server: Encrypted packet (len=44)
    2 0.000380373 192.168.1.12 → 10.6.15.156  SSH 190 Client: Encrypted packet (len=124)
    3 0.002264531  10.6.15.156 → 192.168.1.12 TCP 66 22 → 54766 [ACK] Seq=45 Ack=125 Win=1452 Len=0 TSval=14929496 TSecr=7997997
    4 0.031014755  10.6.15.156 → 192.168.1.12 SSH 102 Server: Encrypted packet (len=36)
    5 0.031540044 192.168.1.12 → 10.6.15.156  SSH 190 Client: Encrypted packet (len=124)
    6 0.041307191  10.6.15.156 → 192.168.1.12 SSH 230 Server: Encrypted packet (len=164)
    7 0.041334860 192.168.1.12 → 10.6.15.156  SSH 886 Client: Encrypted packet (len=820)
    8 0.042117785 192.168.1.12 → 10.6.15.156  SSH 134 Client: Encrypted packet (len=68)
    9 0.043679603  10.6.15.156 → 192.168.1.12 TCP 66 22 → 54766 [ACK] Seq=245 Ack=1137 Win=1452 Len=0 TSval=14929506 TSecr=7998007
   10 0.047323133  10.6.15.156 → 192.168.1.12 SSH 302 Server: Encrypted packet (len=236)
   11 0.048091132 192.168.1.12 → 10.6.15.156  SSH 142 Client: Encrypted packet (len=76)
   12 0.052369354  10.6.15.156 → 192.168.1.12 SSH 358 Server: Encrypted packet (len=292)
   13 0.060690498  10.6.15.156 → 192.168.1.12 SSH 350 Server: Encrypted packet (len=284)
   14 0.060709414  10.6.15.156 → 192.168.1.12 SSH 138 Server: Encrypted packet (len=72)
   15 0.060780282 192.168.1.12 → 10.6.15.156  TCP 66 54766 → 22 [ACK] Seq=1213 Ack=1129 Win=6155 Len=0 TSval=7998012 TSecr=14929508
   16 0.060984563 192.168.1.12 → 10.6.15.156  SSH 102 Client: Encrypted packet (len=36)
   17 0.078078849  10.6.15.156 → 192.168.1.12 SSH 110 Server: Encrypted packet (len=44)
   18 0.078493746 192.168.1.12 → 10.6.15.156  SSH 486 Client: Encrypted packet (len=420)
   19 0.102496061  10.6.15.156 → 192.168.1.12 SSH 342 Server: Encrypted packet (len=276)
   20 0.102523857  10.6.15.156 → 192.168.1.12 SSH 138 Server: Encrypted packet (len=72)
   21 0.102595181 192.168.1.12 → 10.6.15.156  TCP 66 54766 → 22 [ACK] Seq=1669 Ack=1521 Win=6155 Len=0 TSval=7998022 TSecr=14929521
   22 0.102812814 192.168.1.12 → 10.6.15.156  SSH 102 Client: Encrypted packet (len=36)
   23 0.106097867  10.6.15.156 → 192.168.1.12 SSH 566 Server: Encrypted packet (len=500)
   24 0.107139561 192.168.1.12 → 10.6.15.156  SSH 206 Client: Encrypted packet (len=140)
   25 0.114896398  10.6.15.156 → 192.168.1.12 SSH 230 Server: Encrypted packet (len=164)
   26 0.115439580 192.168.1.12 → 10.6.15.156  SSH 302 Client: Encrypted packet (len=236)
   27 0.121597755  10.6.15.156 → 192.168.1.12 SSH 342 Server: Encrypted packet (len=276)
   28 0.121617741 192.168.1.12 → 10.6.15.156  SSH 906 Client: Encrypted packet (len=840)
   29 0.158404880  10.6.15.156 → 192.168.1.12 SSH 166 Server: Encrypted packet (len=100)
   30 0.158696569 192.168.1.12 → 10.6.15.156  SSH 126 Client: Encrypted packet (len=60)
   31 0.159000043  10.6.15.156 → 192.168.1.12 SSH 134 Server: Encrypted packet (len=68)
   32 0.160963801  10.6.15.156 → 192.168.1.12 SSH 974 Server: Encrypted packet (len=908)
   33 0.160997310 192.168.1.12 → 10.6.15.156  TCP 66 54766 → 22 [ACK] Seq=2981 Ack=3537 Win=6155 Len=0 TSval=7998037 TSecr=14929535
   34 0.161625123 192.168.1.12 → 10.6.15.156  SSH 134 Client: Encrypted packet (len=68)
   35 0.164510464  10.6.15.156 → 192.168.1.12 TCP 66 22 → 54766 [ACK] Seq=3537 Ack=3049 Win=1452 Len=0 TSval=14929536 TSecr=7998036
   36 0.177359378  10.6.15.156 → 192.168.1.12 SSH 222 Server: Encrypted packet (len=156)
   37 0.180430949  10.6.15.156 → 192.168.1.12 SSH 142 Server: Encrypted packet (len=76)
   38 0.180468771 192.168.1.12 → 10.6.15.156  TCP 66 54766 → 22 [ACK] Seq=3049 Ack=3769 Win=6155 Len=0 TSval=7998042 TSecr=14929539
   39 0.194097457  10.6.15.156 → 192.168.1.12 SSH 342 Server: Encrypted packet (len=276)
   40 0.194113725  10.6.15.156 → 192.168.1.12 SSH 138 Server: Encrypted packet (len=72)
   41 0.194165716 192.168.1.12 → 10.6.15.156  TCP 66 54766 → 22 [ACK] Seq=3049 Ack=4117 Win=6155 Len=0 TSval=7998045 TSecr=14929543
   42 0.194339021 192.168.1.12 → 10.6.15.156  SSH 102 Client: Encrypted packet (len=36)
   43 0.234124465  10.6.15.156 → 192.168.1.12 TCP 66 22 → 54766 [ACK] Seq=4117 Ack=3085 Win=1452 Len=0 TSval=14929554 TSecr=7998045
   44 0.502055523  10.6.15.156 → 192.168.1.12 SSH 1514 Server: Encrypted packet (len=1448)
   45 0.502082684  10.6.15.156 → 192.168.1.12 SSH 174 Server: Encrypted packet (len=108)
   46 0.502098148 192.168.1.12 → 10.6.15.156  TCP 66 54766 → 22 [ACK] Seq=3085 Ack=5673 Win=6155 Len=0 TSval=7998122 TSecr=14929620
   47 0.572728266  10.6.15.156 → 192.168.1.12 SSH 254 Server: Encrypted packet (len=188)
   48 0.589519846  10.6.15.156 → 192.168.1.12 SSH 190 Server: Encrypted packet (len=124)
   49 0.589604428 192.168.1.12 → 10.6.15.156  TCP 66 54766 → 22 [ACK] Seq=3085 Ack=5985 Win=6155 Len=0 TSval=7998144 TSecr=14929638
   50 0.593742154  10.6.15.156 → 192.168.1.12 SSH 190 Server: Encrypted packet (len=124)
   51 0.627960254  10.6.15.156 → 192.168.1.12 SSH 254 Server: Encrypted packet (len=188)
   52 0.627976733 192.168.1.12 → 10.6.15.156  TCP 66 54766 → 22 [ACK] Seq=3085 Ack=6297 Win=6155 Len=0 TSval=7998154 TSecr=14929643
   53 0.701602056  10.6.15.156 → 192.168.1.12 SSH 566 Server: Encrypted packet (len=500)
   54 0.725906534  10.6.15.156 → 192.168.1.12 SSH 254 Server: Encrypted packet (len=188)
   55 0.726025612 192.168.1.12 → 10.6.15.156  TCP 66 54766 → 22 [ACK] Seq=3085 Ack=6985 Win=6155 Len=0 TSval=7998178 TSecr=14929670
   56 0.891615932  10.6.15.156 → 192.168.1.12 SSH 1514 Server: Encrypted packet (len=1448)
   57 0.891736537  10.6.15.156 → 192.168.1.12 SSH 1514 Server: Encrypted packet (len=1448)
   58 0.891748120 192.168.1.12 → 10.6.15.156  TCP 66 54766 → 22 [ACK] Seq=3085 Ack=9881 Win=6155 Len=0 TSval=7998220 TSecr=14929718
   59 0.891928835  10.6.15.156 → 192.168.1.12 SSH 1514 Server: Encrypted packet (len=1448)
   60 0.891945643  10.6.15.156 → 192.168.1.12 SSH 110 Server: Encrypted packet (len=44)
   61 0.891957881 192.168.1.12 → 10.6.15.156  TCP 66 54766 → 22 [ACK] Seq=3085 Ack=11373 Win=6155 Len=0 TSval=7998220 TSecr=14929718
   62 0.892235144  10.6.15.156 → 192.168.1.12 SSH 1514 Server: Encrypted packet (len=1448)
   63 0.892433907  10.6.15.156 → 192.168.1.12 SSH 1514 Server: Encrypted packet (len=1448)
   64 0.892441367 192.168.1.12 → 10.6.15.156  TCP 66 54766 → 22 [ACK] Seq=3085 Ack=14269 Win=6155 Len=0 TSval=7998220 TSecr=14929718
   65 0.892795158  10.6.15.156 → 192.168.1.12 SSH 1514 Server: Encrypted packet (len=1448)
   66 0.892917413  10.6.15.156 → 192.168.1.12 SSH 1514 Server: Encrypted packet (len=1448)
   67 0.892928644 192.168.1.12 → 10.6.15.156  TCP 66 54766 → 22 [ACK] Seq=3085 Ack=17165 Win=6155 Len=0 TSval=7998220 TSecr=14929718
   68 0.895042627  10.6.15.156 → 192.168.1.12 SSH 1514 Server: Encrypted packet (len=1448)
   69 0.895155402  10.6.15.156 → 192.168.1.12 SSH 1514 Server: Encrypted packet (len=1448)
   70 0.895164629 192.168.1.12 → 10.6.15.156  TCP 66 54766 → 22 [ACK] Seq=3085 Ack=20061 Win=6155 Len=0 TSval=7998220 TSecr=14929719
   71 0.895309532  10.6.15.156 → 192.168.1.12 SSH 142 Server: Encrypted packet (len=76)
   72 0.935726682 192.168.1.12 → 10.6.15.156  TCP 66 54766 → 22 [ACK] Seq=3085 Ack=20137 Win=6155 Len=0 TSval=7998231 TSecr=14929719
   73 0.954292449  10.6.15.156 → 192.168.1.12 SSH 254 Server: Encrypted packet (len=188)
   74 0.954317931 192.168.1.12 → 10.6.15.156  TCP 66 54766 → 22 [ACK] Seq=3085 Ack=20325 Win=6155 Len=0 TSval=7998235 TSecr=14929734
   75 1.055296432  10.6.15.156 → 192.168.1.12 SSH 1514 Server: Encrypted packet (len=1448)
   76 1.055314470 192.168.1.12 → 10.6.15.156  TCP 66 54766 → 22 [ACK] Seq=3085 Ack=21773 Win=6155 Len=0 TSval=7998260 TSecr=14929759
   77 1.055412090  10.6.15.156 → 192.168.1.12 SSH 1514 Server: Encrypted packet (len=1448)
   78 1.055420184 192.168.1.12 → 10.6.15.156  TCP 66 54766 → 22 [ACK] Seq=3085 Ack=23221 Win=6155 Len=0 TSval=7998260 TSecr=14929759
   79 1.056504753  10.6.15.156 → 192.168.1.12 SSH 1514 Server: Encrypted packet (len=1448)
   80 1.056527582 192.168.1.12 → 10.6.15.156  TCP 66 54766 → 22 [ACK] Seq=3085 Ack=24669 Win=6155 Len=0 TSval=7998261 TSecr=14929759
   81 1.056621792  10.6.15.156 → 192.168.1.12 SSH 1514 Server: Encrypted packet (len=1448)
   82 1.056632444 192.168.1.12 → 10.6.15.156  TCP 66 54766 → 22 [ACK] Seq=3085 Ack=26117 Win=6155 Len=0 TSval=7998261 TSecr=14929759
   83 1.056640621  10.6.15.156 → 192.168.1.12 SSH 110 Server: Encrypted packet (len=44)
   84 1.056642512 192.168.1.12 → 10.6.15.156  TCP 66 54766 → 22 [ACK] Seq=3085 Ack=26161 Win=6155 Len=0 TSval=7998261 TSecr=14929759
   85 1.057061301  10.6.15.156 → 192.168.1.12 SSH 1514 Server: Encrypted packet (len=1448)
   86 1.057187502  10.6.15.156 → 192.168.1.12 SSH 1514 Server: Encrypted packet (len=1448)
   87 1.057198436 192.168.1.12 → 10.6.15.156  TCP 66 54766 → 22 [ACK] Seq=3085 Ack=29057 Win=6155 Len=0 TSval=7998261 TSecr=14929759
   88 1.057372260  10.6.15.156 → 192.168.1.12 SSH 1514 Server: Encrypted packet (len=1448)
   89 1.057729850  10.6.15.156 → 192.168.1.12 SSH 1514 Server: Encrypted packet (len=1448)
   90 1.057748039 192.168.1.12 → 10.6.15.156  TCP 66 54766 → 22 [ACK] Seq=3085 Ack=31953 Win=6155 Len=0 TSval=7998261 TSecr=14929759
   91 1.057995779  10.6.15.156 → 192.168.1.12 SSH 1514 Server: Encrypted packet (len=1448)
   92 1.059147059  10.6.15.156 → 192.168.1.12 SSH 1514 Server: Encrypted packet (len=1448)
   93 1.059156019 192.168.1.12 → 10.6.15.156  TCP 66 54766 → 22 [ACK] Seq=3085 Ack=34849 Win=6155 Len=0 TSval=7998261 TSecr=14929759
   94 1.060088573  10.6.15.156 → 192.168.1.12 SSH 1514 Server: Encrypted packet (len=1448)
   95 1.060262159  10.6.15.156 → 192.168.1.12 SSH 1514 Server: Encrypted packet (len=1448)
   96 1.060268965 192.168.1.12 → 10.6.15.156  TCP 66 54766 → 22 [ACK] Seq=3085 Ack=37745 Win=6155 Len=0 TSval=7998262 TSecr=14929760
   97 1.060374208  10.6.15.156 → 192.168.1.12 SSH 110 Server: Encrypted packet (len=44)
   98 1.060391303 192.168.1.12 → 10.6.15.156  TCP 66 54766 → 22 [ACK] Seq=3085 Ack=37789 Win=6155 Len=0 TSval=7998262 TSecr=14929760
   99 1.079052263  10.6.15.156 → 192.168.1.12 SSH 190 Server: Encrypted packet (len=124)
  100 1.079177827 192.168.1.12 → 10.6.15.156  TCP 66 54766 → 22 [ACK] Seq=3085 Ack=37913 Win=6155 Len=0 TSval=7998266 TSecr=14929765
  101 1.122207743  10.6.15.156 → 192.168.1.12 SSH 1514 Server: Encrypted packet (len=1448)
  102 1.122328203  10.6.15.156 → 192.168.1.12 SSH 1514 Server: Encrypted packet (len=1448)
  103 1.122340168 192.168.1.12 → 10.6.15.156  TCP 66 54766 → 22 [ACK] Seq=3085 Ack=40809 Win=6155 Len=0 TSval=7998277 TSecr=14929775
  104 1.122519888  10.6.15.156 → 192.168.1.12 SSH 1514 Server: Encrypted packet (len=1448)
  105 1.122699028  10.6.15.156 → 192.168.1.12 SSH 1514 Server: Encrypted packet (len=1448)
  106 1.122711311 192.168.1.12 → 10.6.15.156  TCP 66 54766 → 22 [ACK] Seq=3085 Ack=43705 Win=6155 Len=0 TSval=7998277 TSecr=14929775
  107 1.122724282  10.6.15.156 → 192.168.1.12 SSH 110 Server: Encrypted packet (len=44)
  108 1.122751784 192.168.1.12 → 10.6.15.156  TCP 66 54766 → 22 [ACK] Seq=3085 Ack=43749 Win=6155 Len=0 TSval=7998277 TSecr=14929775
  109 1.122850513  10.6.15.156 → 192.168.1.12 SSH 1514 Server: Encrypted packet (len=1448)
  110 1.123195375  10.6.15.156 → 192.168.1.12 SSH 1514 Server: Encrypted packet (len=1448)
  111 1.123200407 192.168.1.12 → 10.6.15.156  TCP 66 54766 → 22 [ACK] Seq=3085 Ack=46645 Win=6155 Len=0 TSval=7998277 TSecr=14929775
  112 1.123208734  10.6.15.156 → 192.168.1.12 SSH 166 Server: Encrypted packet (len=100)
  113 1.123232709 192.168.1.12 → 10.6.15.156  TCP 66 54766 → 22 [ACK] Seq=3085 Ack=46745 Win=6155 Len=0 TSval=7998277 TSecr=14929775
  114 1.176478580  10.6.15.156 → 192.168.1.12 SSH 190 Server: Encrypted packet (len=124)
  115 1.176545027 192.168.1.12 → 10.6.15.156  TCP 66 54766 → 22 [ACK] Seq=3085 Ack=46869 Win=6155 Len=0 TSval=7998291 TSecr=14929789
  116 1.218708118  10.6.15.156 → 192.168.1.12 SSH 1514 Server: Encrypted packet (len=1448)
  117 1.218863670  10.6.15.156 → 192.168.1.12 SSH 1514 Server: Encrypted packet (len=1448)
  118 1.218876979 192.168.1.12 → 10.6.15.156  TCP 66 54766 → 22 [ACK] Seq=3085 Ack=49765 Win=6155 Len=0 TSval=7998301 TSecr=14929799
  119 1.219034624  10.6.15.156 → 192.168.1.12 SSH 1514 Server: Encrypted packet (len=1448)
  120 1.219217940  10.6.15.156 → 192.168.1.12 SSH 1514 Server: Encrypted packet (len=1448)
  121 1.219224553 192.168.1.12 → 10.6.15.156  TCP 66 54766 → 22 [ACK] Seq=3085 Ack=52661 Win=6155 Len=0 TSval=7998301 TSecr=14929799
  122 1.219234075  10.6.15.156 → 192.168.1.12 SSH 110 Server: Encrypted packet (len=44)
  123 1.219252481 192.168.1.12 → 10.6.15.156  TCP 66 54766 → 22 [ACK] Seq=3085 Ack=52705 Win=6155 Len=0 TSval=7998301 TSecr=14929799
  124 1.219547348  10.6.15.156 → 192.168.1.12 SSH 1514 Server: Encrypted packet (len=1448)
  125 1.219733871  10.6.15.156 → 192.168.1.12 SSH 1514 Server: Encrypted packet (len=1448)
  126 1.219738168 192.168.1.12 → 10.6.15.156  TCP 66 54766 → 22 [ACK] Seq=3085 Ack=55601 Win=6155 Len=0 TSval=7998302 TSecr=14929800
  127 1.220062940  10.6.15.156 → 192.168.1.12 SSH 1514 Server: Encrypted packet (len=1448)
  128 1.223567036  10.6.15.156 → 192.168.1.12 SSH 1514 Server: Encrypted packet (len=1448)
  129 1.223584839 192.168.1.12 → 10.6.15.156  TCP 66 54766 → 22 [ACK] Seq=3085 Ack=58497 Win=6155 Len=0 TSval=7998302 TSecr=14929800
  130 1.223698034  10.6.15.156 → 192.168.1.12 SSH 1514 Server: Encrypted packet (len=1448)
  131 1.223901861  10.6.15.156 → 192.168.1.12 SSH 1514 Server: Encrypted packet (len=1448)
  132 1.223906392 192.168.1.12 → 10.6.15.156  TCP 66 54766 → 22 [ACK] Seq=3085 Ack=61393 Win=6155 Len=0 TSval=7998303 TSecr=14929800
  133 1.224072535  10.6.15.156 → 192.168.1.12 SSH 1514 Server: Encrypted packet (len=1448)
  134 1.224216700  10.6.15.156 → 192.168.1.12 SSH 1514 Server: Encrypted packet (len=1448)
  135 1.224219934 192.168.1.12 → 10.6.15.156  TCP 66 54766 → 22 [ACK] Seq=3085 Ack=64289 Win=6155 Len=0 TSval=7998303 TSecr=14929800
  136 1.224390154  10.6.15.156 → 192.168.1.12 SSH 1514 Server: Encrypted packet (len=1448)
  137 1.224715248  10.6.15.156 → 192.168.1.12 SSH 1514 Server: Encrypted packet (len=1448)
  138 1.224721241 192.168.1.12 → 10.6.15.156  TCP 66 54766 → 22 [ACK] Seq=3085 Ack=67185 Win=6155 Len=0 TSval=7998303 TSecr=14929800
  139 1.227180921  10.6.15.156 → 192.168.1.12 SSH 1514 Server: Encrypted packet (len=1448)
  140 1.227346207  10.6.15.156 → 192.168.1.12 SSH 1514 Server: Encrypted packet (len=1448)
  141 1.227353468 192.168.1.12 → 10.6.15.156  TCP 66 54766 → 22 [ACK] Seq=3085 Ack=70081 Win=6155 Len=0 TSval=7998303 TSecr=14929802
  142 1.227518590  10.6.15.156 → 192.168.1.12 SSH 1514 Server: Encrypted packet (len=1448)
  143 1.227678087  10.6.15.156 → 192.168.1.12 SSH 1514 Server: Encrypted packet (len=1448)
  144 1.227681144 192.168.1.12 → 10.6.15.156  TCP 66 54766 → 22 [ACK] Seq=3085 Ack=72977 Win=6155 Len=0 TSval=7998303 TSecr=14929802
  145 1.227861588  10.6.15.156 → 192.168.1.12 SSH 1514 Server: Encrypted packet (len=1448)
  146 1.228033539  10.6.15.156 → 192.168.1.12 SSH 1514 Server: Encrypted packet (len=1448)
  147 1.228037215 192.168.1.12 → 10.6.15.156  TCP 66 54766 → 22 [ACK] Seq=3085 Ack=75873 Win=6155 Len=0 TSval=7998304 TSecr=14929802
  148 1.228349757  10.6.15.156 → 192.168.1.12 SSH 1514 Server: Encrypted packet (len=1448)
  149 1.228522290  10.6.15.156 → 192.168.1.12 SSH 1514 Server: Encrypted packet (len=1448)
  150 1.228528487 192.168.1.12 → 10.6.15.156  TCP 66 54766 → 22 [ACK] Seq=3085 Ack=78769 Win=6155 Len=0 TSval=7998304 TSecr=14929802
  151 1.231076081  10.6.15.156 → 192.168.1.12 SSH 1514 Server: Encrypted packet (len=1448)
  152 1.231240213  10.6.15.156 → 192.168.1.12 SSH 1514 Server: Encrypted packet (len=1448)
  153 1.231250735 192.168.1.12 → 10.6.15.156  TCP 66 54766 → 22 [ACK] Seq=3085 Ack=81665 Win=6155 Len=0 TSval=7998304 TSecr=14929803
  154 1.231423644  10.6.15.156 → 192.168.1.12 SSH 1514 Server: Encrypted packet (len=1448)
  155 1.231584548  10.6.15.156 → 192.168.1.12 SSH 1514 Server: Encrypted packet (len=1448)
  156 1.231592055 192.168.1.12 → 10.6.15.156  TCP 66 54766 → 22 [ACK] Seq=3085 Ack=84561 Win=6155 Len=0 TSval=7998304 TSecr=14929803
  157 1.231757642  10.6.15.156 → 192.168.1.12 SSH 1514 Server: Encrypted packet (len=1448)
  158 1.231931061  10.6.15.156 → 192.168.1.12 SSH 1514 Server: Encrypted packet (len=1448)
  159 1.231938802 192.168.1.12 → 10.6.15.156  TCP 66 54766 → 22 [ACK] Seq=3085 Ack=87457 Win=6155 Len=0 TSval=7998305 TSecr=14929803
  160 1.232257511  10.6.15.156 → 192.168.1.12 SSH 1514 Server: Encrypted packet (len=1448)
  161 1.232429547  10.6.15.156 → 192.168.1.12 SSH 1514 Server: Encrypted packet (len=1448)
  162 1.232438135 192.168.1.12 → 10.6.15.156  TCP 66 54766 → 22 [ACK] Seq=3085 Ack=90353 Win=6155 Len=0 TSval=7998305 TSecr=14929803
  163 1.232602514  10.6.15.156 → 192.168.1.12 SSH 1514 Server: Encrypted packet (len=1448)
  164 1.234663661  10.6.15.156 → 192.168.1.12 SSH 1514 Server: Encrypted packet (len=1448)
  165 1.234685394 192.168.1.12 → 10.6.15.156  TCP 66 54766 → 22 [ACK] Seq=3085 Ack=93249 Win=6155 Len=0 TSval=7998305 TSecr=14929803
  166 1.234705126  10.6.15.156 → 192.168.1.12 SSH 198 Server: Encrypted packet (len=132)
  167 1.234764262 192.168.1.12 → 10.6.15.156  TCP 66 54766 → 22 [ACK] Seq=3085 Ack=93381 Win=6155 Len=0 TSval=7998305 TSecr=14929804
  168 1.285439986  10.6.15.156 → 192.168.1.12 SSH 1514 Server: Encrypted packet (len=1448)
  169 1.285547387  10.6.15.156 → 192.168.1.12 SSH 1514 Server: Encrypted packet (len=1448)
  170 1.285558797 192.168.1.12 → 10.6.15.156  TCP 66 54766 → 22 [ACK] Seq=3085 Ack=96277 Win=6155 Len=0 TSval=7998318 TSecr=14929816
  171 1.285743098  10.6.15.156 → 192.168.1.12 SSH 1514 Server: Encrypted packet (len=1448)
  172 1.285887978  10.6.15.156 → 192.168.1.12 SSH 1514 Server: Encrypted packet (len=1448)
  173 1.285892037 192.168.1.12 → 10.6.15.156  TCP 66 54766 → 22 [ACK] Seq=3085 Ack=99173 Win=6155 Len=0 TSval=7998318 TSecr=14929816
  174 1.285900232  10.6.15.156 → 192.168.1.12 SSH 222 Server: Encrypted packet (len=156)
  175 1.285920860 192.168.1.12 → 10.6.15.156  TCP 66 54766 → 22 [ACK] Seq=3085 Ack=99329 Win=6155 Len=0 TSval=7998318 TSecr=14929816
  176 1.286029064 192.168.1.12 → 10.6.15.156  SSH 102 Client: Encrypted packet (len=36)
  177 1.289032271  10.6.15.156 → 192.168.1.12 TCP 66 22 → 54766 [ACK] Seq=99329 Ack=3121 Win=1452 Len=0 TSval=14929817 TSecr=7998318
  178 1.381330323  10.6.15.156 → 192.168.1.12 SSH 1514 Server: Encrypted packet (len=1448)
  179 1.381495827  10.6.15.156 → 192.168.1.12 SSH 1514 Server: Encrypted packet (len=1448)
  180 1.381504515 192.168.1.12 → 10.6.15.156  TCP 66 54766 → 22 [ACK] Seq=3121 Ack=102225 Win=6155 Len=0 TSval=7998342 TSecr=14929840
  181 1.381667640  10.6.15.156 → 192.168.1.12 SSH 1514 Server: Encrypted packet (len=1448)
  182 1.381840857  10.6.15.156 → 192.168.1.12 SSH 1514 Server: Encrypted packet (len=1448)
  183 1.381847239 192.168.1.12 → 10.6.15.156  TCP 66 54766 → 22 [ACK] Seq=3121 Ack=105121 Win=6155 Len=0 TSval=7998342 TSecr=14929840
  184 1.381856195  10.6.15.156 → 192.168.1.12 SSH 110 Server: Encrypted packet (len=44)
  185 1.382180565  10.6.15.156 → 192.168.1.12 SSH 1514 Server: Encrypted packet (len=1448)
  186 1.382186860 192.168.1.12 → 10.6.15.156  TCP 66 54766 → 22 [ACK] Seq=3121 Ack=106613 Win=6155 Len=0 TSval=7998342 TSecr=14929840
  187 1.382352583  10.6.15.156 → 192.168.1.12 SSH 1514 Server: Encrypted packet (len=1448)
  188 1.382507032  10.6.15.156 → 192.168.1.12 SSH 1514 Server: Encrypted packet (len=1448)
  189 1.382511714 192.168.1.12 → 10.6.15.156  TCP 66 54766 → 22 [ACK] Seq=3121 Ack=109509 Win=6155 Len=0 TSval=7998342 TSecr=14929840
  190 1.382679713  10.6.15.156 → 192.168.1.12 SSH 1514 Server: Encrypted packet (len=1448)
  191 1.384814187  10.6.15.156 → 192.168.1.12 SSH 1514 Server: Encrypted packet (len=1448)
  192 1.384820621 192.168.1.12 → 10.6.15.156  TCP 66 54766 → 22 [ACK] Seq=3121 Ack=112405 Win=6155 Len=0 TSval=7998343 TSecr=14929840
  193 1.384985496  10.6.15.156 → 192.168.1.12 SSH 1514 Server: Encrypted packet (len=1448)
  194 1.385387143  10.6.15.156 → 192.168.1.12 SSH 654 Server: Encrypted packet (len=588)
  195 1.385391341 192.168.1.12 → 10.6.15.156  TCP 66 54766 → 22 [ACK] Seq=3121 Ack=114441 Win=6155 Len=0 TSval=7998343 TSecr=14929841
  196 1.405055267  10.6.15.156 → 192.168.1.12 SSH 198 Server: Encrypted packet (len=132)
  197 1.447735295 192.168.1.12 → 10.6.15.156  TCP 66 54766 → 22 [ACK] Seq=3121 Ack=114573 Win=6155 Len=0 TSval=7998359 TSecr=14929846
  198 1.474476212  10.6.15.156 → 192.168.1.12 SSH 190 Server: Encrypted packet (len=124)
  199 1.474559703 192.168.1.12 → 10.6.15.156  TCP 66 54766 → 22 [ACK] Seq=3121 Ack=114697 Win=6155 Len=0 TSval=7998365 TSecr=14929864
  200 1.628130954  10.6.15.156 → 192.168.1.12 SSH 262 Server: Encrypted packet (len=196)
  201 1.628206453 192.168.1.12 → 10.6.15.156  TCP 66 54766 → 22 [ACK] Seq=3121 Ack=114893 Win=6155 Len=0 TSval=7998404 TSecr=14929902
  202 1.856328758  10.6.15.156 → 192.168.1.12 SSH 254 Server: Encrypted packet (len=188)
  203 1.856350381 192.168.1.12 → 10.6.15.156  TCP 66 54766 → 22 [ACK] Seq=3121 Ack=115081 Win=6155 Len=0 TSval=7998461 TSecr=14929959
  204 1.925898620  10.6.15.156 → 192.168.1.12 SSH 254 Server: Encrypted packet (len=188)
  205 1.925918028 192.168.1.12 → 10.6.15.156  TCP 66 54766 → 22 [ACK] Seq=3121 Ack=115269 Win=6155 Len=0 TSval=7998478 TSecr=14929976
  206 1.973066438 192.168.1.12 → 10.6.15.156  SSH 190 Client: Encrypted packet (len=124)
  207 1.974878656  10.6.15.156 → 192.168.1.12 TCP 66 22 → 54766 [ACK] Seq=115269 Ack=3245 Win=1452 Len=0 TSval=14929989 TSecr=7998490
  208 1.974896552 192.168.1.12 → 10.6.15.156  SSH 402 Client: Encrypted packet (len=336)
  209 1.977372983  10.6.15.156 → 192.168.1.12 TCP 66 22 → 54766 [ACK] Seq=115269 Ack=3581 Win=1452 Len=0 TSval=14929989 TSecr=7998490
  210 1.979273907  10.6.15.156 → 192.168.1.12 SSH 142 Server: Encrypted packet (len=76)
  211 1.979288539 192.168.1.12 → 10.6.15.156  TCP 66 54766 → 22 [ACK] Seq=3581 Ack=115345 Win=6155 Len=0 TSval=7998491 TSecr=14929990
  212 1.981202586  10.6.15.156 → 192.168.1.12 SSH 254 Server: Encrypted packet (len=188)
  213 1.981217621 192.168.1.12 → 10.6.15.156  TCP 66 54766 → 22 [ACK] Seq=3581 Ack=115533 Win=6155 Len=0 TSval=7998492 TSecr=14929990
  214 2.061424778  10.6.15.156 → 192.168.1.12 SSH 742 Server: Encrypted packet (len=676)
  215 2.061441394 192.168.1.12 → 10.6.15.156  TCP 66 54766 → 22 [ACK] Seq=3581 Ack=116209 Win=6155 Len=0 TSval=7998512 TSecr=14930010
  216 2.062426255 192.168.1.12 → 10.6.15.156  SSH 134 Client: Encrypted packet (len=68)
  217 2.078483571  10.6.15.156 → 192.168.1.12 SSH 182 Server: Encrypted packet (len=116)
  218 2.106123113 192.168.1.12 → 10.6.15.156  SSH 1302 Client: Encrypted packet (len=1236)
  219 2.150111980  10.6.15.156 → 192.168.1.12 TCP 66 22 → 54766 [ACK] Seq=116325 Ack=4885 Win=1452 Len=0 TSval=14930033 TSecr=7998523
  220 2.216695783 192.168.1.12 → 10.6.15.156  SSH 902 Client: Encrypted packet (len=836)
  221 2.219013334  10.6.15.156 → 192.168.1.12 TCP 66 22 → 54766 [ACK] Seq=116325 Ack=5721 Win=1452 Len=0 TSval=14930050 TSecr=7998551
  222 2.222302521  10.6.15.156 → 192.168.1.12 SSH 262 Server: Encrypted packet (len=196)
  223 2.223214127 192.168.1.12 → 10.6.15.156  SSH 134 Client: Encrypted packet (len=68)
  224 2.262119007  10.6.15.156 → 192.168.1.12 TCP 66 22 → 54766 [ACK] Seq=116521 Ack=5789 Win=1452 Len=0 TSval=14930061 TSecr=7998552
  225 2.307093805  10.6.15.156 → 192.168.1.12 SSH 222 Server: Encrypted packet (len=156)
  226 2.330730809  10.6.15.156 → 192.168.1.12 SSH 158 Server: Encrypted packet (len=92)
  227 2.330797611 192.168.1.12 → 10.6.15.156  TCP 66 54766 → 22 [ACK] Seq=5789 Ack=116769 Win=6155 Len=0 TSval=7998579 TSecr=14930072
  228 2.330981767 192.168.1.12 → 10.6.15.156  SSH 150 Client: Encrypted packet (len=84)
  229 2.332253334  10.6.15.156 → 192.168.1.12 TCP 66 22 → 54766 [ACK] Seq=116769 Ack=5873 Win=1452 Len=0 TSval=14930078 TSecr=7998579
  230 2.350516249  10.6.15.156 → 192.168.1.12 SSH 462 Server: Encrypted packet (len=396)
  231 2.367390117 192.168.1.12 → 10.6.15.156  SSH 1514 Client: Encrypted packet (len=1448)
  232 2.368503089 192.168.1.12 → 10.6.15.156  SSH 1350 Client: Encrypted packet (len=1284)
  233 2.371353506  10.6.15.156 → 192.168.1.12 TCP 66 22 → 54766 [ACK] Seq=117165 Ack=8605 Win=1452 Len=0 TSval=14930088 TSecr=7998588
  234 2.376713673  10.6.15.156 → 192.168.1.12 SSH 222 Server: Encrypted packet (len=156)
  235 2.384739486 192.168.1.12 → 10.6.15.156  SSH 318 Client: Encrypted packet (len=252)
  236 2.390343279  10.6.15.156 → 192.168.1.12 SSH 142 Server: Encrypted packet (len=76)
  237 2.415471499 192.168.1.12 → 10.6.15.156  SSH 182 Client: Encrypted packet (len=116)
  238 2.415783426 192.168.1.12 → 10.6.15.156  SSH 182 Client: Encrypted packet (len=116)
  239 2.417678826  10.6.15.156 → 192.168.1.12 TCP 66 22 → 54766 [ACK] Seq=117397 Ack=9089 Win=1452 Len=0 TSval=14930099 TSecr=7998600
  240 2.428813178  10.6.15.156 → 192.168.1.12 SSH 390 Server: Encrypted packet (len=324)
  241 2.429825170 192.168.1.12 → 10.6.15.156  SSH 134 Client: Encrypted packet (len=68)
  242 2.432973703  10.6.15.156 → 192.168.1.12 SSH 238 Server: Encrypted packet (len=172)
  243 2.439909939 192.168.1.12 → 10.6.15.156  SSH 294 Client: Encrypted packet (len=228)
  244 2.478082241  10.6.15.156 → 192.168.1.12 TCP 66 22 → 54766 [ACK] Seq=117893 Ack=9385 Win=1452 Len=0 TSval=14930115 TSecr=7998607
  245 2.489604993 192.168.1.12 → 10.6.15.156  SSH 102 Client: Encrypted packet (len=36)
  246 2.491276124  10.6.15.156 → 192.168.1.12 TCP 66 22 → 54766 [ACK] Seq=117893 Ack=9421 Win=1452 Len=0 TSval=14930118 TSecr=7998619
  247 2.491290265 192.168.1.12 → 10.6.15.156  SSH 174 Client: Encrypted packet (len=108)
  248 2.491701748 192.168.1.12 → 10.6.15.156  SSH 102 Client: Encrypted packet (len=36)
  249 2.493059039  10.6.15.156 → 192.168.1.12 TCP 66 22 → 54766 [ACK] Seq=117893 Ack=9565 Win=1452 Len=0 TSval=14930118 TSecr=7998619
  250 2.494919081 192.168.1.12 → 10.6.15.156  SSH 118 Client: Encrypted packet (len=52)
  251 2.495525702 192.168.1.12 → 10.6.15.156  SSH 154 Client: Encrypted packet (len=88)
  252 2.497819478  10.6.15.156 → 192.168.1.12 TCP 66 22 → 54766 [ACK] Seq=117893 Ack=9617 Win=1452 Len=0 TSval=14930119 TSecr=7998620
  253 2.498215179 192.168.1.12 → 10.6.15.156  SSH 154 Client: Encrypted packet (len=88)
  254 2.499588017  10.6.15.156 → 192.168.1.12 TCP 66 22 → 54766 [ACK] Seq=117893 Ack=9793 Win=1452 Len=0 TSval=14930120 TSecr=7998620
  255 2.500759907  10.6.15.156 → 192.168.1.12 SSH 702 Server: Encrypted packet (len=636)
  256 2.502262823 192.168.1.12 → 10.6.15.156  SSH 134 Client: Encrypted packet (len=68)
  257 2.503032602  10.6.15.156 → 192.168.1.12 SSH 110 Server: Encrypted packet (len=44)
  258 2.513494469 192.168.1.12 → 10.6.15.156  SSH 1514 Client: Encrypted packet (len=1448)
  259 2.518084513  10.6.15.156 → 192.168.1.12 TCP 66 22 → 54766 [ACK] Seq=118573 Ack=11309 Win=1452 Len=0 TSval=14930124 TSecr=7998622
  260 2.518101280 192.168.1.12 → 10.6.15.156  SSH 230 Client: Encrypted packet (len=164)
  261 2.518315258  10.6.15.156 → 192.168.1.12 SSH 838 Server: Encrypted packet (len=772)
  262 2.518328955  10.6.15.156 → 192.168.1.12 SSH 166 Server: Encrypted packet (len=100)
  263 2.518336034  10.6.15.156 → 192.168.1.12 SSH 138 Server: Encrypted packet (len=72)
  264 2.518364362 192.168.1.12 → 10.6.15.156  TCP 66 54766 → 22 [ACK] Seq=11473 Ack=119517 Win=6155 Len=0 TSval=7998626 TSecr=14930124
  265 2.518862256 192.168.1.12 → 10.6.15.156  SSH 266 Client: Encrypted packet (len=200)
  266 2.519398845  10.6.15.156 → 192.168.1.12 SSH 138 Server: Encrypted packet (len=72)
  267 2.519894800  10.6.15.156 → 192.168.1.12 SSH 254 Server: Encrypted packet (len=188)
  268 2.519938277 192.168.1.12 → 10.6.15.156  TCP 66 54766 → 22 [ACK] Seq=11673 Ack=119777 Win=6155 Len=0 TSval=7998627 TSecr=14930125
  269 2.520231353 192.168.1.12 → 10.6.15.156  SSH 170 Client: Encrypted packet (len=104)
  270 2.520762207  10.6.15.156 → 192.168.1.12 TCP 66 22 → 54766 [ACK] Seq=119777 Ack=11673 Win=1452 Len=0 TSval=14930125 TSecr=7998626
  271 2.520773747 192.168.1.12 → 10.6.15.156  SSH 302 Client: Encrypted packet (len=236)
  272 2.523070600  10.6.15.156 → 192.168.1.12 TCP 66 22 → 54766 [ACK] Seq=119777 Ack=12013 Win=1452 Len=0 TSval=14930126 TSecr=7998627
  273 2.529594075  10.6.15.156 → 192.168.1.12 SSH 238 Server: Encrypted packet (len=172)
  274 2.530774598 192.168.1.12 → 10.6.15.156  SSH 1030 Client: Encrypted packet (len=964)
  275 2.532323806  10.6.15.156 → 192.168.1.12 SSH 110 Server: Encrypted packet (len=44)
  276 2.535422738  10.6.15.156 → 192.168.1.12 SSH 102 Server: Encrypted packet (len=36)
  277 2.535441260 192.168.1.12 → 10.6.15.156  SSH 398 Client: Encrypted packet (len=332)
  278 2.535956332 192.168.1.12 → 10.6.15.156  SSH 158 Client: Encrypted packet (len=92)
  279 2.537505811  10.6.15.156 → 192.168.1.12 TCP 66 22 → 54766 [ACK] Seq=120029 Ack=13401 Win=1452 Len=0 TSval=14930129 TSecr=7998630
  280 2.539435457  10.6.15.156 → 192.168.1.12 SSH 138 Server: Encrypted packet (len=72)
  281 2.539881023 192.168.1.12 → 10.6.15.156  SSH 166 Client: Encrypted packet (len=100)
  282 2.540172676 192.168.1.12 → 10.6.15.156  SSH 150 Client: Encrypted packet (len=84)
  283 2.541285118  10.6.15.156 → 192.168.1.12 SSH 342 Server: Encrypted packet (len=276)
  284 2.541410576  10.6.15.156 → 192.168.1.12 TCP 66 22 → 54766 [ACK] Seq=120377 Ack=13585 Win=1452 Len=0 TSval=14930130 TSecr=7998632
  285 2.546476921  10.6.15.156 → 192.168.1.12 SSH 142 Server: Encrypted packet (len=76)
  286 2.546550344 192.168.1.12 → 10.6.15.156  TCP 66 54766 → 22 [ACK] Seq=13585 Ack=120453 Win=6155 Len=0 TSval=7998633 TSecr=14930130
  287 2.557687109  10.6.15.156 → 192.168.1.12 SSH 478 Server: Encrypted packet (len=412)
  288 2.558967928 192.168.1.12 → 10.6.15.156  SSH 134 Client: Encrypted packet (len=68)
  289 2.559526144  10.6.15.156 → 192.168.1.12 SSH 142 Server: Encrypted packet (len=76)
  290 2.561087517  10.6.15.156 → 192.168.1.12 SSH 138 Server: Encrypted packet (len=72)
  291 2.561173876 192.168.1.12 → 10.6.15.156  TCP 66 54766 → 22 [ACK] Seq=13653 Ack=121013 Win=6155 Len=0 TSval=7998637 TSecr=14930135
  292 2.561419807 192.168.1.12 → 10.6.15.156  SSH 102 Client: Encrypted packet (len=36)
  293 2.564460325  10.6.15.156 → 192.168.1.12 SSH 210 Server: Encrypted packet (len=144)
  294 2.564471436 192.168.1.12 → 10.6.15.156  SSH 382 Client: Encrypted packet (len=316)
  295 2.564970380 192.168.1.12 → 10.6.15.156  SSH 138 Client: Encrypted packet (len=72)
  296 2.568099510  10.6.15.156 → 192.168.1.12 TCP 66 22 → 54766 [ACK] Seq=121157 Ack=14077 Win=1452 Len=0 TSval=14930137 TSecr=7998638
  297 2.568961478  10.6.15.156 → 192.168.1.12 SSH 542 Server: Encrypted packet (len=476)
  298 2.579077627  10.6.15.156 → 192.168.1.12 SSH 338 Server: Encrypted packet (len=272)
  299 2.579146166 192.168.1.12 → 10.6.15.156  TCP 66 54766 → 22 [ACK] Seq=14077 Ack=121905 Win=6155 Len=0 TSval=7998641 TSecr=14930137
  300 2.579449780 192.168.1.12 → 10.6.15.156  SSH 134 Client: Encrypted packet (len=68)
  301 2.583853698  10.6.15.156 → 192.168.1.12 SSH 1514 Server: Encrypted packet (len=1448)
  302 2.583868010 192.168.1.12 → 10.6.15.156  SSH 134 Client: Encrypted packet (len=68)
  303 2.584130662  10.6.15.156 → 192.168.1.12 SSH 1362 Server: Encrypted packet (len=1296)
  304 2.589421059  10.6.15.156 → 192.168.1.12 SSH 406 Server: Encrypted packet (len=340)
  305 2.589435830 192.168.1.12 → 10.6.15.156  SSH 346 Client: Encrypted packet (len=280)
  306 2.610682146  10.6.15.156 → 192.168.1.12 SSH 1174 Server: Encrypted packet (len=1108)
  307 2.610706457 192.168.1.12 → 10.6.15.156  SSH 370 Client: Encrypted packet (len=304)
  308 2.631444250  10.6.15.156 → 192.168.1.12 SSH 422 Server: Encrypted packet (len=356)
  309 2.631471714 192.168.1.12 → 10.6.15.156  SSH 210 Client: Encrypted packet (len=144)
  310 2.631487732  10.6.15.156 → 192.168.1.12 SSH 398 Server: Encrypted packet (len=332)
  311 2.636465380  10.6.15.156 → 192.168.1.12 SSH 246 Server: Encrypted packet (len=180)
  312 2.636510281 192.168.1.12 → 10.6.15.156  TCP 66 54766 → 22 [ACK] Seq=14941 Ack=126965 Win=6155 Len=0 TSval=7998656 TSecr=14930153
  313 2.652511289  10.6.15.156 → 192.168.1.12 SSH 1254 Server: Encrypted packet (len=1188)
  314 2.652570604  10.6.15.156 → 192.168.1.12 SSH 686 Server: Encrypted packet (len=620)
  315 2.652580805 192.168.1.12 → 10.6.15.156  TCP 66 54766 → 22 [ACK] Seq=14941 Ack=128773 Win=6155 Len=0 TSval=7998660 TSecr=14930157
  316 2.653812217 192.168.1.12 → 10.6.15.156  SSH 134 Client: Encrypted packet (len=68)
  317 2.663626654 192.168.1.12 → 10.6.15.156  SSH 1514 Client: Encrypted packet (len=1448)
  318 2.664756410 192.168.1.12 → 10.6.15.156  SSH 1358 Client: Encrypted packet (len=1292)
  319 2.666462123  10.6.15.156 → 192.168.1.12 TCP 66 22 → 54766 [ACK] Seq=128773 Ack=16457 Win=1452 Len=0 TSval=14930162 TSecr=7998660
  320 2.668718025  10.6.15.156 → 192.168.1.12 SSH 210 Server: Encrypted packet (len=144)
  321 2.669178340 192.168.1.12 → 10.6.15.156  SSH 138 Client: Encrypted packet (len=72)
  322 2.673170473  10.6.15.156 → 192.168.1.12 SSH 134 Server: Encrypted packet (len=68)
  323 2.673187196  10.6.15.156 → 192.168.1.12 SSH 138 Server: Encrypted packet (len=72)
  324 2.673242363 192.168.1.12 → 10.6.15.156  TCP 66 54766 → 22 [ACK] Seq=17821 Ack=129057 Win=6155 Len=0 TSval=7998665 TSecr=14930163
  325 2.673418306 192.168.1.12 → 10.6.15.156  SSH 102 Client: Encrypted packet (len=36)
  326 2.675335134  10.6.15.156 → 192.168.1.12 SSH 126 Server: Encrypted packet (len=60)
  327 2.675353440  10.6.15.156 → 192.168.1.12 SSH 138 Server: Encrypted packet (len=72)
  328 2.675416118 192.168.1.12 → 10.6.15.156  TCP 66 54766 → 22 [ACK] Seq=17857 Ack=129189 Win=6155 Len=0 TSval=7998665 TSecr=14930164
  329 2.675667919 192.168.1.12 → 10.6.15.156  SSH 102 Client: Encrypted packet (len=36)
  330 2.692250934  10.6.15.156 → 192.168.1.12 SSH 590 Server: Encrypted packet (len=524)
  331 2.693364130 192.168.1.12 → 10.6.15.156  SSH 134 Client: Encrypted packet (len=68)
  332 2.702661157  10.6.15.156 → 192.168.1.12 SSH 110 Server: Encrypted packet (len=44)
  333 2.702802205  10.6.15.156 → 192.168.1.12 SSH 102 Server: Encrypted packet (len=36)
  334 2.702831283 192.168.1.12 → 10.6.15.156  TCP 66 54766 → 22 [ACK] Seq=17961 Ack=129793 Win=6155 Len=0 TSval=7998672 TSecr=14930171
  335 2.703735105 192.168.1.12 → 10.6.15.156  SSH 182 Client: Encrypted packet (len=116)
  336 2.705518868  10.6.15.156 → 192.168.1.12 SSH 102 Server: Encrypted packet (len=36)
  337 2.705541108 192.168.1.12 → 10.6.15.156  SSH 150 Client: Encrypted packet (len=84)
  338 2.712742040  10.6.15.156 → 192.168.1.12 SSH 102 Server: Encrypted packet (len=36)
  339 2.712764285 192.168.1.12 → 10.6.15.156  SSH 158 Client: Encrypted packet (len=92)
  340 2.754501865  10.6.15.156 → 192.168.1.12 TCP 66 22 → 54766 [ACK] Seq=129865 Ack=18253 Win=1452 Len=0 TSval=14930184 TSecr=7998675
  341 2.754519714 192.168.1.12 → 10.6.15.156  SSH 158 Client: Encrypted packet (len=92)
  342 2.756313484  10.6.15.156 → 192.168.1.12 TCP 66 22 → 54766 [ACK] Seq=129865 Ack=18345 Win=1452 Len=0 TSval=14930184 TSecr=7998685
  343 2.758670599  10.6.15.156 → 192.168.1.12 SSH 902 Server: Encrypted packet (len=836)
  344 2.775621291  10.6.15.156 → 192.168.1.12 SSH 1514 Server: Encrypted packet (len=1448)
  345 2.775637407 192.168.1.12 → 10.6.15.156  TCP 66 54766 → 22 [ACK] Seq=18345 Ack=132149 Win=6155 Len=0 TSval=7998690 TSecr=14930185
  346 2.775743120  10.6.15.156 → 192.168.1.12 SSH 1206 Server: Encrypted packet (len=1140)
  347 2.776625055 192.168.1.12 → 10.6.15.156  SSH 438 Client: Encrypted packet (len=372)
  348 2.778330242  10.6.15.156 → 192.168.1.12 SSH 222 Server: Encrypted packet (len=156)
  349 2.818082480  10.6.15.156 → 192.168.1.12 TCP 66 22 → 54766 [ACK] Seq=133445 Ack=18717 Win=1452 Len=0 TSval=14930200 TSecr=7998691
  350 2.818105742 192.168.1.12 → 10.6.15.156  SSH 438 Client: Encrypted packet (len=372)
  351 2.820123444  10.6.15.156 → 192.168.1.12 TCP 66 22 → 54766 [ACK] Seq=133445 Ack=19089 Win=1452 Len=0 TSval=14930200 TSecr=7998701
  352 2.832446993  10.6.15.156 → 192.168.1.12 SSH 982 Server: Encrypted packet (len=916)
  353 2.850896862  10.6.15.156 → 192.168.1.12 SSH 174 Server: Encrypted packet (len=108)
  354 2.850978340 192.168.1.12 → 10.6.15.156  TCP 66 54766 → 22 [ACK] Seq=19089 Ack=134469 Win=6155 Len=0 TSval=7998709 TSecr=14930203
  355 2.853244344 192.168.1.12 → 10.6.15.156  SSH 790 Client: Encrypted packet (len=724)
  356 2.884869983  10.6.15.156 → 192.168.1.12 SSH 1014 Server: Encrypted packet (len=948)
  357 2.892338335  10.6.15.156 → 192.168.1.12 SSH 166 Server: Encrypted packet (len=100)
  358 2.892473702 192.168.1.12 → 10.6.15.156  TCP 66 54766 → 22 [ACK] Seq=19813 Ack=135517 Win=6155 Len=0 TSval=7998720 TSecr=14930216
  359 2.905205339  10.6.15.156 → 192.168.1.12 SSH 238 Server: Encrypted packet (len=172)
  360 2.905625774 192.168.1.12 → 10.6.15.156  SSH 134 Client: Encrypted packet (len=68)
  361 2.945319117  10.6.15.156 → 192.168.1.12 SSH 1514 Server: Encrypted packet (len=1448)
  362 2.945344169 192.168.1.12 → 10.6.15.156  SSH 750 Client: Encrypted packet (len=684)
  363 2.945369473  10.6.15.156 → 192.168.1.12 SSH 158 Server: Encrypted packet (len=92)
  364 2.952499739  10.6.15.156 → 192.168.1.12 SSH 686 Server: Encrypted packet (len=620)
  365 2.952570242 192.168.1.12 → 10.6.15.156  TCP 66 54766 → 22 [ACK] Seq=20565 Ack=137849 Win=6155 Len=0 TSval=7998735 TSecr=14930231
  366 2.953740480  10.6.15.156 → 192.168.1.12 SSH 182 Server: Encrypted packet (len=116)
  367 2.954009034 192.168.1.12 → 10.6.15.156  SSH 134 Client: Encrypted packet (len=68)
  368 2.981260943  10.6.15.156 → 192.168.1.12 SSH 1014 Server: Encrypted packet (len=948)
  369 2.981294510 192.168.1.12 → 10.6.15.156  SSH 894 Client: Encrypted packet (len=828)
  370 3.012457941  10.6.15.156 → 192.168.1.12 SSH 358 Server: Encrypted packet (len=292)
  371 3.055730295 192.168.1.12 → 10.6.15.156  TCP 66 54766 → 22 [ACK] Seq=21461 Ack=139205 Win=6155 Len=0 TSval=7998761 TSecr=14930248
  372 3.065328412 192.168.1.12 → 10.6.15.156  SSH 190 Client: Encrypted packet (len=124)
  373 3.106119242  10.6.15.156 → 192.168.1.12 TCP 66 22 → 54766 [ACK] Seq=139205 Ack=21585 Win=1452 Len=0 TSval=14930272 TSecr=7998763
  374 3.108802958  10.6.15.156 → 192.168.1.12 SSH 534 Server: Encrypted packet (len=468)
  375 3.108899051 192.168.1.12 → 10.6.15.156  TCP 66 54766 → 22 [ACK] Seq=21585 Ack=139673 Win=6155 Len=0 TSval=7998774 TSecr=14930272
  376 3.149867243  10.6.15.156 → 192.168.1.12 SSH 158 Server: Encrypted packet (len=92)
  377 3.149973363 192.168.1.12 → 10.6.15.156  TCP 66 54766 → 22 [ACK] Seq=21585 Ack=139765 Win=6155 Len=0 TSval=7998784 TSecr=14930282
  378 3.150332756 192.168.1.12 → 10.6.15.156  SSH 158 Client: Encrypted packet (len=92)
  379 3.152513080  10.6.15.156 → 192.168.1.12 TCP 66 22 → 54766 [ACK] Seq=139765 Ack=21677 Win=1452 Len=0 TSval=14930283 TSecr=7998784
  380 3.209313774  10.6.15.156 → 192.168.1.12 SSH 342 Server: Encrypted packet (len=276)
  381 3.251724371 192.168.1.12 → 10.6.15.156  TCP 66 54766 → 22 [ACK] Seq=21677 Ack=140041 Win=6155 Len=0 TSval=7998810 TSecr=14930297
  382 3.279008757  10.6.15.156 → 192.168.1.12 SSH 310 Server: Encrypted packet (len=244)
  383 3.279087504 192.168.1.12 → 10.6.15.156  TCP 66 54766 → 22 [ACK] Seq=21677 Ack=140285 Win=6155 Len=0 TSval=7998816 TSecr=14930315
  384 3.334235551  10.6.15.156 → 192.168.1.12 SSH 278 Server: Encrypted packet (len=212)
  385 3.334310934 192.168.1.12 → 10.6.15.156  TCP 66 54766 → 22 [ACK] Seq=21677 Ack=140497 Win=6155 Len=0 TSval=7998830 TSecr=14930329
  386 3.377483466  10.6.15.156 → 192.168.1.12 SSH 614 Server: Encrypted packet (len=548)
  387 3.377557584 192.168.1.12 → 10.6.15.156  TCP 66 54766 → 22 [ACK] Seq=21677 Ack=141045 Win=6155 Len=0 TSval=7998841 TSecr=14930339
