    1 0.000000000  10.6.15.156 → 192.168.1.12 TCP 66 22 → 54766 [ACK] Seq=1 Ack=1 Win=1452 Len=0 TSval=14902757 TSecr=7971249
    2 0.000017713 192.168.1.12 → 10.6.15.156  SSH 554 Client: Encrypted packet (len=488)
    3 0.003464605  10.6.15.156 → 192.168.1.12 TCP 66 22 → 54766 [ACK] Seq=1 Ack=489 Win=1452 Len=0 TSval=14902757 TSecr=7971259
    4 0.005244082  10.6.15.156 → 192.168.1.12 SSH 142 Server: Encrypted packet (len=76)
    5 0.047265919 192.168.1.12 → 10.6.15.156  TCP 66 54766 → 22 [ACK] Seq=489 Ack=77 Win=6155 Len=0 TSval=7971271 TSecr=14902758
    6 0.068524677  10.6.15.156 → 192.168.1.12 SSH 1110 Server: Encrypted packet (len=1044)
    7 0.068618677 192.168.1.12 → 10.6.15.156  TCP 66 54766 → 22 [ACK] Seq=489 Ack=1121 Win=6155 Len=0 TSval=7971276 TSecr=14902774
    8 0.069479241 192.168.1.12 → 10.6.15.156  SSH 134 Client: Encrypted packet (len=68)
    9 0.111183392  10.6.15.156 → 192.168.1.12 TCP 66 22 → 54766 [ACK] Seq=1121 Ack=557 Win=1452 Len=0 TSval=14902785 TSecr=7971276
   10 0.111204255 192.168.1.12 → 10.6.15.156  SSH 174 Client: Encrypted packet (len=108)
   11 0.113519965  10.6.15.156 → 192.168.1.12 TCP 66 22 → 54766 [ACK] Seq=1121 Ack=665 Win=1452 Len=0 TSval=14902785 TSecr=7971286
   12 0.117216511  10.6.15.156 → 192.168.1.12 SSH 190 Server: Encrypted packet (len=124)
   13 0.159247484 192.168.1.12 → 10.6.15.156  TCP 66 54766 → 22 [ACK] Seq=665 Ack=1245 Win=6155 Len=0 TSval=7971299 TSecr=14902786
   14 0.221230732  10.6.15.156 → 192.168.1.12 SSH 230 Server: Encrypted packet (len=164)
   15 0.221315983 192.168.1.12 → 10.6.15.156  TCP 66 54766 → 22 [ACK] Seq=665 Ack=1409 Win=6155 Len=0 TSval=7971314 TSecr=14902812
   16 0.636228252  10.6.15.156 → 192.168.1.12 SSH 222 Server: Encrypted packet (len=156)
   17 0.636254245 192.168.1.12 → 10.6.15.156  TCP 66 54766 → 22 [ACK] Seq=665 Ack=1565 Win=6155 Len=0 TSval=7971418 TSecr=14902916
   18 0.693189739  10.6.15.156 → 192.168.1.12 SSH 222 Server: Encrypted packet (len=156)
   19 0.693209192 192.168.1.12 → 10.6.15.156  TCP 66 54766 → 22 [ACK] Seq=665 Ack=1721 Win=6155 Len=0 TSval=7971432 TSecr=14902930
   20 0.790310432  10.6.15.156 → 192.168.1.12 SSH 222 Server: Encrypted packet (len=156)
   21 0.790329481 192.168.1.12 → 10.6.15.156  TCP 66 54766 → 22 [ACK] Seq=665 Ack=1877 Win=6155 Len=0 TSval=7971456 TSecr=14902954
   22 0.906676824  10.6.15.156 → 192.168.1.12 SSH 726 Server: Encrypted packet (len=660)
   23 0.906694649 192.168.1.12 → 10.6.15.156  TCP 66 54766 → 22 [ACK] Seq=665 Ack=2537 Win=6155 Len=0 TSval=7971485 TSecr=14902983
   24 0.907691466 192.168.1.12 → 10.6.15.156  SSH 134 Client: Encrypted packet (len=68)
   25 0.948717741  10.6.15.156 → 192.168.1.12 TCP 66 22 → 54766 [ACK] Seq=2537 Ack=733 Win=1452 Len=0 TSval=14902994 TSecr=7971486
   26 0.948738325 192.168.1.12 → 10.6.15.156  SSH 182 Client: Encrypted packet (len=116)
   27 0.951028950  10.6.15.156 → 192.168.1.12 TCP 66 22 → 54766 [ACK] Seq=2537 Ack=849 Win=1452 Len=0 TSval=14902994 TSecr=7971496
   28 0.985864921  10.6.15.156 → 192.168.1.12 SSH 262 Server: Encrypted packet (len=196)
   29 0.987405015 192.168.1.12 → 10.6.15.156  SSH 174 Client: Encrypted packet (len=108)
   30 1.018988753  10.6.15.156 → 192.168.1.12 SSH 222 Server: Encrypted packet (len=156)
   31 1.019017948 192.168.1.12 → 10.6.15.156  SSH 190 Client: Encrypted packet (len=124)
   32 1.059113179  10.6.15.156 → 192.168.1.12 SSH 214 Server: Encrypted packet (len=148)
   33 1.061702740 192.168.1.12 → 10.6.15.156  SSH 166 Client: Encrypted packet (len=100)
   34 1.102842840  10.6.15.156 → 192.168.1.12 TCP 66 22 → 54766 [ACK] Seq=3037 Ack=1181 Win=1452 Len=0 TSval=14903033 TSecr=7971524
   35 1.147341570 192.168.1.12 → 10.6.15.156  SSH 182 Client: Encrypted packet (len=116)
   36 1.149558104  10.6.15.156 → 192.168.1.12 TCP 66 22 → 54766 [ACK] Seq=3037 Ack=1297 Win=1452 Len=0 TSval=14903044 TSecr=7971546
   37 1.185610943  10.6.15.156 → 192.168.1.12 SSH 206 Server: Encrypted packet (len=140)
   38 1.186152906 192.168.1.12 → 10.6.15.156  SSH 166 Client: Encrypted packet (len=100)
   39 1.226839310  10.6.15.156 → 192.168.1.12 TCP 66 22 → 54766 [ACK] Seq=3177 Ack=1397 Win=1452 Len=0 TSval=14903064 TSecr=7971555
   40 1.241226002  10.6.15.156 → 192.168.1.12 SSH 190 Server: Encrypted packet (len=124)
   41 1.283215837 192.168.1.12 → 10.6.15.156  TCP 66 54766 → 22 [ACK] Seq=1397 Ack=3301 Win=6155 Len=0 TSval=7971580 TSecr=14903067
   42 1.299694485 192.168.1.12 → 10.6.15.156  SSH 302 Client: Encrypted packet (len=236)
   43 1.301997406  10.6.15.156 → 192.168.1.12 TCP 66 22 → 54766 [ACK] Seq=3301 Ack=1633 Win=1452 Len=0 TSval=14903082 TSecr=7971584
   44 1.302007361 192.168.1.12 → 10.6.15.156  SSH 182 Client: Encrypted packet (len=116)
   45 1.303882289  10.6.15.156 → 192.168.1.12 TCP 66 22 → 54766 [ACK] Seq=3301 Ack=1749 Win=1452 Len=0 TSval=14903083 TSecr=7971584
   46 1.337994924  10.6.15.156 → 192.168.1.12 SSH 214 Server: Encrypted packet (len=148)
   47 1.338014739 192.168.1.12 → 10.6.15.156  TCP 66 54766 → 22 [ACK] Seq=1749 Ack=3449 Win=6155 Len=0 TSval=7971593 TSecr=14903091
   48 1.338896430 192.168.1.12 → 10.6.15.156  SSH 206 Client: Encrypted packet (len=140)
   49 1.339464588  10.6.15.156 → 192.168.1.12 SSH 166 Server: Encrypted packet (len=100)
   50 1.378871931  10.6.15.156 → 192.168.1.12 TCP 66 22 → 54766 [ACK] Seq=3549 Ack=1889 Win=1452 Len=0 TSval=14903102 TSecr=7971593
   51 1.378897853 192.168.1.12 → 10.6.15.156  SSH 134 Client: Encrypted packet (len=68)
   52 1.380472718  10.6.15.156 → 192.168.1.12 TCP 66 22 → 54766 [ACK] Seq=3549 Ack=1957 Win=1452 Len=0 TSval=14903102 TSecr=7971603
   53 1.410116147 192.168.1.12 → 10.6.15.156  SSH 510 Client: Encrypted packet (len=444)
   54 1.412019449  10.6.15.156 → 192.168.1.12 TCP 66 22 → 54766 [ACK] Seq=3549 Ack=2401 Win=1452 Len=0 TSval=14903110 TSecr=7971611
   55 1.417273992  10.6.15.156 → 192.168.1.12 SSH 142 Server: Encrypted packet (len=76)
   56 1.448470534  10.6.15.156 → 192.168.1.12 SSH 302 Server: Encrypted packet (len=236)
   57 1.448486860 192.168.1.12 → 10.6.15.156  TCP 66 54766 → 22 [ACK] Seq=2401 Ack=3861 Win=6155 Len=0 TSval=7971621 TSecr=14903110
   58 1.449142222 192.168.1.12 → 10.6.15.156  SSH 134 Client: Encrypted packet (len=68)
   59 1.469956203  10.6.15.156 → 192.168.1.12 SSH 238 Server: Encrypted packet (len=172)
   60 1.469977776 192.168.1.12 → 10.6.15.156  SSH 182 Client: Encrypted packet (len=116)
   61 1.506981616  10.6.15.156 → 192.168.1.12 SSH 206 Server: Encrypted packet (len=140)
   62 1.507727081 192.168.1.12 → 10.6.15.156  SSH 166 Client: Encrypted packet (len=100)
   63 1.539491242  10.6.15.156 → 192.168.1.12 SSH 190 Server: Encrypted packet (len=124)
   64 1.539509768 192.168.1.12 → 10.6.15.156  SSH 182 Client: Encrypted packet (len=116)
   65 1.577228069  10.6.15.156 → 192.168.1.12 SSH 206 Server: Encrypted packet (len=140)
   66 1.577952247 192.168.1.12 → 10.6.15.156  SSH 166 Client: Encrypted packet (len=100)
   67 1.594626266  10.6.15.156 → 192.168.1.12 SSH 182 Server: Encrypted packet (len=116)
   68 1.594646987 192.168.1.12 → 10.6.15.156  SSH 182 Client: Encrypted packet (len=116)
   69 1.631639757  10.6.15.156 → 192.168.1.12 SSH 206 Server: Encrypted packet (len=140)
   70 1.632269706 192.168.1.12 → 10.6.15.156  SSH 166 Client: Encrypted packet (len=100)
   71 1.673821219  10.6.15.156 → 192.168.1.12 TCP 66 22 → 54766 [ACK] Seq=4693 Ack=3117 Win=1452 Len=0 TSval=14903175 TSecr=7971667
   72 1.673842261 192.168.1.12 → 10.6.15.156  SSH 190 Client: Encrypted packet (len=124)
   73 1.675954266  10.6.15.156 → 192.168.1.12 TCP 66 22 → 54766 [ACK] Seq=4693 Ack=3241 Win=1452 Len=0 TSval=14903176 TSecr=7971677
   74 1.712008873  10.6.15.156 → 192.168.1.12 SSH 206 Server: Encrypted packet (len=140)
   75 1.712713219 192.168.1.12 → 10.6.15.156  SSH 174 Client: Encrypted packet (len=108)
   76 1.750981125  10.6.15.156 → 192.168.1.12 TCP 66 22 → 54766 [ACK] Seq=4833 Ack=3349 Win=1452 Len=0 TSval=14903195 TSecr=7971687
   77 1.989271133  10.6.15.156 → 192.168.1.12 SSH 286 Server: Encrypted packet (len=220)
   78 2.035211122 192.168.1.12 → 10.6.15.156  TCP 66 54766 → 22 [ACK] Seq=3349 Ack=5053 Win=6155 Len=0 TSval=7971768 TSecr=14903254
   79 2.046888031  10.6.15.156 → 192.168.1.12 SSH 238 Server: Encrypted packet (len=172)
   80 2.046916607 192.168.1.12 → 10.6.15.156  TCP 66 54766 → 22 [ACK] Seq=3349 Ack=5225 Win=6155 Len=0 TSval=7971770 TSecr=14903268
   81 2.143146259  10.6.15.156 → 192.168.1.12 SSH 238 Server: Encrypted packet (len=172)
   82 2.143164023 192.168.1.12 → 10.6.15.156  TCP 66 54766 → 22 [ACK] Seq=3349 Ack=5397 Win=6155 Len=0 TSval=7971794 TSecr=14903293
   83 2.371812186  10.6.15.156 → 192.168.1.12 SSH 182 Server: Encrypted packet (len=116)
   84 2.371831123 192.168.1.12 → 10.6.15.156  TCP 66 54766 → 22 [ACK] Seq=3349 Ack=5513 Win=6155 Len=0 TSval=7971852 TSecr=14903350
   85 2.493204945  10.6.15.156 → 192.168.1.12 SSH 158 Server: Encrypted packet (len=92)
   86 2.493222060 192.168.1.12 → 10.6.15.156  TCP 66 54766 → 22 [ACK] Seq=3349 Ack=5605 Win=6155 Len=0 TSval=7971882 TSecr=14903380
   87 2.493458471 192.168.1.12 → 10.6.15.156  SSH 150 Client: Encrypted packet (len=84)
   88 2.495599976  10.6.15.156 → 192.168.1.12 TCP 66 22 → 54766 [ACK] Seq=5605 Ack=3433 Win=1452 Len=0 TSval=14903381 TSecr=7971882
   89 2.685632303  10.6.15.156 → 192.168.1.12 SSH 150 Server: Encrypted packet (len=84)
   90 2.685879344 192.168.1.12 → 10.6.15.156  SSH 150 Client: Encrypted packet (len=84)
   91 2.687435853  10.6.15.156 → 192.168.1.12 TCP 66 22 → 54766 [ACK] Seq=5689 Ack=3517 Win=1452 Len=0 TSval=14903429 TSecr=7971930
   92 3.045439392  10.6.15.156 → 192.168.1.12 SSH 182 Server: Encrypted packet (len=116)
   93 3.087237651 192.168.1.12 → 10.6.15.156  TCP 66 54766 → 22 [ACK] Seq=3517 Ack=5805 Win=6155 Len=0 TSval=7972031 TSecr=14903518
   94 3.274076108  10.6.15.156 → 192.168.1.12 SSH 358 Server: Encrypted packet (len=292)
   95 3.274106372 192.168.1.12 → 10.6.15.156  TCP 66 54766 → 22 [ACK] Seq=3517 Ack=6097 Win=6155 Len=0 TSval=7972077 TSecr=14903575
   96 3.343255219  10.6.15.156 → 192.168.1.12 SSH 286 Server: Encrypted packet (len=220)
   97 3.343270814 192.168.1.12 → 10.6.15.156  TCP 66 54766 → 22 [ACK] Seq=3517 Ack=6317 Win=6155 Len=0 TSval=7972095 TSecr=14903592
   98 3.400610727  10.6.15.156 → 192.168.1.12 SSH 286 Server: Encrypted packet (len=220)
   99 3.400629192 192.168.1.12 → 10.6.15.156  TCP 66 54766 → 22 [ACK] Seq=3517 Ack=6537 Win=6155 Len=0 TSval=7972109 TSecr=14903607
  100 3.496565395  10.6.15.156 → 192.168.1.12 SSH 326 Server: Encrypted packet (len=260)
  101 3.496584375 192.168.1.12 → 10.6.15.156  TCP 66 54766 → 22 [ACK] Seq=3517 Ack=6797 Win=6155 Len=0 TSval=7972133 TSecr=14903631
  102 3.724964069  10.6.15.156 → 192.168.1.12 SSH 214 Server: Encrypted packet (len=148)
  103 3.724982018 192.168.1.12 → 10.6.15.156  TCP 66 54766 → 22 [ACK] Seq=3517 Ack=6945 Win=6155 Len=0 TSval=7972190 TSecr=14903688
  104 3.793701727  10.6.15.156 → 192.168.1.12 SSH 238 Server: Encrypted packet (len=172)
  105 3.793720221 192.168.1.12 → 10.6.15.156  TCP 66 54766 → 22 [ACK] Seq=3517 Ack=7117 Win=6155 Len=0 TSval=7972207 TSecr=14903705
  106 3.849704824  10.6.15.156 → 192.168.1.12 SSH 238 Server: Encrypted packet (len=172)
  107 3.849722481 192.168.1.12 → 10.6.15.156  TCP 66 54766 → 22 [ACK] Seq=3517 Ack=7289 Win=6155 Len=0 TSval=7972221 TSecr=14903719
  108 3.947415456  10.6.15.156 → 192.168.1.12 SSH 310 Server: Encrypted packet (len=244)
  109 3.947434446 192.168.1.12 → 10.6.15.156  TCP 66 54766 → 22 [ACK] Seq=3517 Ack=7533 Win=6155 Len=0 TSval=7972246 TSecr=14903744
  110 4.176017456  10.6.15.156 → 192.168.1.12 SSH 206 Server: Encrypted packet (len=140)
  111 4.176035306 192.168.1.12 → 10.6.15.156  TCP 66 54766 → 22 [ACK] Seq=3517 Ack=7673 Win=6155 Len=0 TSval=7972303 TSecr=14903801
  112 4.245224587  10.6.15.156 → 192.168.1.12 SSH 238 Server: Encrypted packet (len=172)
  113 4.245242353 192.168.1.12 → 10.6.15.156  TCP 66 54766 → 22 [ACK] Seq=3517 Ack=7845 Win=6155 Len=0 TSval=7972320 TSecr=14903818
  114 4.300749049  10.6.15.156 → 192.168.1.12 SSH 230 Server: Encrypted packet (len=164)
  115 4.300772604 192.168.1.12 → 10.6.15.156  TCP 66 54766 → 22 [ACK] Seq=3517 Ack=8009 Win=6155 Len=0 TSval=7972334 TSecr=14903832
  116 4.628951623  10.6.15.156 → 192.168.1.12 SSH 350 Server: Encrypted packet (len=284)
  117 4.628969460 192.168.1.12 → 10.6.15.156  TCP 66 54766 → 22 [ACK] Seq=3517 Ack=8293 Win=6155 Len=0 TSval=7972416 TSecr=14903914
  118 4.695291803  10.6.15.156 → 192.168.1.12 SSH 358 Server: Encrypted packet (len=292)
  119 4.695308786 192.168.1.12 → 10.6.15.156  TCP 66 54766 → 22 [ACK] Seq=3517 Ack=8585 Win=6155 Len=0 TSval=7972433 TSecr=14903931
  120 4.751903437  10.6.15.156 → 192.168.1.12 SSH 358 Server: Encrypted packet (len=292)
  121 4.751921346 192.168.1.12 → 10.6.15.156  TCP 66 54766 → 22 [ACK] Seq=3517 Ack=8877 Win=6155 Len=0 TSval=7972447 TSecr=14903945
  122 4.849419240  10.6.15.156 → 192.168.1.12 SSH 358 Server: Encrypted packet (len=292)
  123 4.849436235 192.168.1.12 → 10.6.15.156  TCP 66 54766 → 22 [ACK] Seq=3517 Ack=9169 Win=6155 Len=0 TSval=7972471 TSecr=14903969
  124 5.077886316  10.6.15.156 → 192.168.1.12 SSH 182 Server: Encrypted packet (len=116)
  125 5.077903497 192.168.1.12 → 10.6.15.156  TCP 66 54766 → 22 [ACK] Seq=3517 Ack=9285 Win=6155 Len=0 TSval=7972528 TSecr=14904026
  126 5.206938731  10.6.15.156 → 192.168.1.12 SSH 182 Server: Encrypted packet (len=116)
  127 5.206953873 192.168.1.12 → 10.6.15.156  TCP 66 54766 → 22 [ACK] Seq=3517 Ack=9401 Win=6155 Len=0 TSval=7972560 TSecr=14904058
  128 5.529124092  10.6.15.156 → 192.168.1.12 SSH 406 Server: Encrypted packet (len=340)
  129 5.529142070 192.168.1.12 → 10.6.15.156  TCP 66 54766 → 22 [ACK] Seq=3517 Ack=9741 Win=6155 Len=0 TSval=7972641 TSecr=14904139
  130 5.597229542  10.6.15.156 → 192.168.1.12 SSH 270 Server: Encrypted packet (len=204)
  131 5.597246595 192.168.1.12 → 10.6.15.156  TCP 66 54766 → 22 [ACK] Seq=3517 Ack=9945 Win=6155 Len=0 TSval=7972658 TSecr=14904156
  132 5.655829821  10.6.15.156 → 192.168.1.12 SSH 318 Server: Encrypted packet (len=252)
  133 5.655847226 192.168.1.12 → 10.6.15.156  TCP 66 54766 → 22 [ACK] Seq=3517 Ack=10197 Win=6155 Len=0 TSval=7972673 TSecr=14904171
  134 5.751419226  10.6.15.156 → 192.168.1.12 SSH 318 Server: Encrypted packet (len=252)
  135 5.751435794 192.168.1.12 → 10.6.15.156  TCP 66 54766 → 22 [ACK] Seq=3517 Ack=10449 Win=6155 Len=0 TSval=7972697 TSecr=14904195
  136 5.979960173  10.6.15.156 → 192.168.1.12 SSH 286 Server: Encrypted packet (len=220)
  137 5.979979960 192.168.1.12 → 10.6.15.156  TCP 66 54766 → 22 [ACK] Seq=3517 Ack=10669 Win=6155 Len=0 TSval=7972754 TSecr=14904252
  138 6.049266565  10.6.15.156 → 192.168.1.12 SSH 302 Server: Encrypted packet (len=236)
  139 6.049284753 192.168.1.12 → 10.6.15.156  TCP 66 54766 → 22 [ACK] Seq=3517 Ack=10905 Win=6155 Len=0 TSval=7972771 TSecr=14904269
  140 6.104851989  10.6.15.156 → 192.168.1.12 SSH 270 Server: Encrypted packet (len=204)
  141 6.104875695 192.168.1.12 → 10.6.15.156  TCP 66 54766 → 22 [ACK] Seq=3517 Ack=11109 Win=6155 Len=0 TSval=7972785 TSecr=14904283
  142 6.202484369  10.6.15.156 → 192.168.1.12 SSH 318 Server: Encrypted packet (len=252)
  143 6.202502890 192.168.1.12 → 10.6.15.156  TCP 66 54766 → 22 [ACK] Seq=3517 Ack=11361 Win=6155 Len=0 TSval=7972809 TSecr=14904307
  144 6.499091619  10.6.15.156 → 192.168.1.12 SSH 182 Server: Encrypted packet (len=116)
  145 6.499107169 192.168.1.12 → 10.6.15.156  TCP 66 54766 → 22 [ACK] Seq=3517 Ack=11477 Win=6155 Len=0 TSval=7972883 TSecr=14904382
  146 6.555639004  10.6.15.156 → 192.168.1.12 SSH 182 Server: Encrypted packet (len=116)
  147 6.555656853 192.168.1.12 → 10.6.15.156  TCP 66 54766 → 22 [ACK] Seq=3517 Ack=11593 Win=6155 Len=0 TSval=7972898 TSecr=14904396
  148 6.653249043  10.6.15.156 → 192.168.1.12 SSH 182 Server: Encrypted packet (len=116)
  149 6.653266544 192.168.1.12 → 10.6.15.156  TCP 66 54766 → 22 [ACK] Seq=3517 Ack=11709 Win=6155 Len=0 TSval=7972922 TSecr=14904420
  150 6.882558008  10.6.15.156 → 192.168.1.12 SSH 230 Server: Encrypted packet (len=164)
  151 6.882576983 192.168.1.12 → 10.6.15.156  TCP 66 54766 → 22 [ACK] Seq=3517 Ack=11873 Win=6155 Len=0 TSval=7972979 TSecr=14904477
  152 6.950117498  10.6.15.156 → 192.168.1.12 SSH 182 Server: Encrypted packet (len=116)
  153 6.950134073 192.168.1.12 → 10.6.15.156  TCP 66 54766 → 22 [ACK] Seq=3517 Ack=11989 Win=6155 Len=0 TSval=7972996 TSecr=14904494
  154 7.006753836  10.6.15.156 → 192.168.1.12 SSH 182 Server: Encrypted packet (len=116)
  155 7.006773005 192.168.1.12 → 10.6.15.156  TCP 66 54766 → 22 [ACK] Seq=3517 Ack=12105 Win=6155 Len=0 TSval=7973010 TSecr=14904508
  156 7.104386578  10.6.15.156 → 192.168.1.12 SSH 182 Server: Encrypted packet (len=116)
  157 7.104402614 192.168.1.12 → 10.6.15.156  TCP 66 54766 → 22 [ACK] Seq=3517 Ack=12221 Win=6155 Len=0 TSval=7973035 TSecr=14904533
  158 7.401161153  10.6.15.156 → 192.168.1.12 SSH 222 Server: Encrypted packet (len=156)
  159 7.401179190 192.168.1.12 → 10.6.15.156  TCP 66 54766 → 22 [ACK] Seq=3517 Ack=12377 Win=6155 Len=0 TSval=7973109 TSecr=14904607
  160 7.458884667  10.6.15.156 → 192.168.1.12 SSH 222 Server: Encrypted packet (len=156)
  161 7.458900810 192.168.1.12 → 10.6.15.156  TCP 66 54766 → 22 [ACK] Seq=3517 Ack=12533 Win=6155 Len=0 TSval=7973123 TSecr=14904621
  162 7.555273539  10.6.15.156 → 192.168.1.12 SSH 214 Server: Encrypted packet (len=148)
  163 7.555291672 192.168.1.12 → 10.6.15.156  TCP 66 54766 → 22 [ACK] Seq=3517 Ack=12681 Win=6155 Len=0 TSval=7973148 TSecr=14904646
  164 7.852338256  10.6.15.156 → 192.168.1.12 SSH 286 Server: Encrypted packet (len=220)
  165 7.852356994 192.168.1.12 → 10.6.15.156  TCP 66 54766 → 22 [ACK] Seq=3517 Ack=12901 Win=6155 Len=0 TSval=7973222 TSecr=14904720
  166 7.909354300  10.6.15.156 → 192.168.1.12 SSH 318 Server: Encrypted packet (len=252)
  167 7.909370611 192.168.1.12 → 10.6.15.156  TCP 66 54766 → 22 [ACK] Seq=3517 Ack=13153 Win=6155 Len=0 TSval=7973236 TSecr=14904734
  168 8.010441449  10.6.15.156 → 192.168.1.12 SSH 318 Server: Encrypted packet (len=252)
  169 8.010462016 192.168.1.12 → 10.6.15.156  TCP 66 54766 → 22 [ACK] Seq=3517 Ack=13405 Win=6155 Len=0 TSval=7973261 TSecr=14904758
  170 8.224435556 192.168.1.12 → 10.6.15.156  SSH 1514 Client: Encrypted packet (len=1448)
  171 8.227645358  10.6.15.156 → 192.168.1.12 TCP 66 22 → 54766 [ACK] Seq=13405 Ack=4965 Win=1452 Len=0 TSval=14904814 TSecr=7973315
  172 8.227656898 192.168.1.12 → 10.6.15.156  SSH 822 Client: Encrypted packet (len=756)
  173 8.230899987  10.6.15.156 → 192.168.1.12 TCP 66 22 → 54766 [ACK] Seq=13405 Ack=5721 Win=1452 Len=0 TSval=14904815 TSecr=7973316
  174 8.234792769  10.6.15.156 → 192.168.1.12 SSH 426 Server: Encrypted packet (len=360)
  175 8.234800313 192.168.1.12 → 10.6.15.156  TCP 66 54766 → 22 [ACK] Seq=5721 Ack=13765 Win=6155 Len=0 TSval=7973317 TSecr=14904816
  176 8.303176488  10.6.15.156 → 192.168.1.12 SSH 222 Server: Encrypted packet (len=156)
  177 8.303193646 192.168.1.12 → 10.6.15.156  TCP 66 54766 → 22 [ACK] Seq=5721 Ack=13921 Win=6155 Len=0 TSval=7973334 TSecr=14904833
  178 8.344696089  10.6.15.156 → 192.168.1.12 SSH 966 Server: Encrypted packet (len=900)
  179 8.344713998 192.168.1.12 → 10.6.15.156  TCP 66 54766 → 22 [ACK] Seq=5721 Ack=14821 Win=6155 Len=0 TSval=7973345 TSecr=14904843
  180 8.346359717  10.6.15.156 → 192.168.1.12 SSH 486 Server: Encrypted packet (len=420)
  181 8.346376315 192.168.1.12 → 10.6.15.156  TCP 66 54766 → 22 [ACK] Seq=5721 Ack=15241 Win=6155 Len=0 TSval=7973345 TSecr=14904843
  182 8.348243964 192.168.1.12 → 10.6.15.156  SSH 134 Client: Encrypted packet (len=68)
  183 8.359659690  10.6.15.156 → 192.168.1.12 SSH 182 Server: Encrypted packet (len=116)
  184 8.403263745 192.168.1.12 → 10.6.15.156  TCP 66 54766 → 22 [ACK] Seq=5789 Ack=15357 Win=6155 Len=0 TSval=7973360 TSecr=14904847
  185 8.457155191  10.6.15.156 → 192.168.1.12 SSH 182 Server: Encrypted packet (len=116)
  186 8.457183567 192.168.1.12 → 10.6.15.156  TCP 66 54766 → 22 [ACK] Seq=5789 Ack=15473 Win=6155 Len=0 TSval=7973373 TSecr=14904871
  187 8.688816083  10.6.15.156 → 192.168.1.12 SSH 182 Server: Encrypted packet (len=116)
  188 8.688839428 192.168.1.12 → 10.6.15.156  TCP 66 54766 → 22 [ACK] Seq=5789 Ack=15589 Win=6155 Len=0 TSval=7973431 TSecr=14904928
  189 8.754019513  10.6.15.156 → 192.168.1.12 SSH 182 Server: Encrypted packet (len=116)
  190 8.754037164 192.168.1.12 → 10.6.15.156  TCP 66 54766 → 22 [ACK] Seq=5789 Ack=15705 Win=6155 Len=0 TSval=7973447 TSecr=14904945
  191 8.810694234  10.6.15.156 → 192.168.1.12 SSH 182 Server: Encrypted packet (len=116)
  192 8.810711524 192.168.1.12 → 10.6.15.156  TCP 66 54766 → 22 [ACK] Seq=5789 Ack=15821 Win=6155 Len=0 TSval=7973461 TSecr=14904960
  193 8.908633440  10.6.15.156 → 192.168.1.12 SSH 270 Server: Encrypted packet (len=204)
  194 8.908650182 192.168.1.12 → 10.6.15.156  TCP 66 54766 → 22 [ACK] Seq=5789 Ack=16025 Win=6155 Len=0 TSval=7973486 TSecr=14904984
  195 9.136787547  10.6.15.156 → 192.168.1.12 SSH 238 Server: Encrypted packet (len=172)
  196 9.403327972 192.168.1.12 → 10.6.15.156  TCP 66 54766 → 22 [ACK] Seq=5789 Ack=16197 Win=6155 Len=0 TSval=7973543 TSecr=14905041
  197 9.405935697  10.6.15.156 → 192.168.1.12 SSH 238 Server: Encrypted packet (len=172)
  198 9.405954096 192.168.1.12 → 10.6.15.156  TCP 66 54766 → 22 [ACK] Seq=5789 Ack=16369 Win=6155 Len=0 TSval=7973610 TSecr=14905058
  199 9.405968856  10.6.15.156 → 192.168.1.12 SSH 238 Server: [TCP Spurious Retransmission] , Encrypted packet (len=172)
  200 9.405974040 192.168.1.12 → 10.6.15.156  TCP 78 [TCP Dup ACK 198#1] 54766 → 22 [ACK] Seq=5789 Ack=16369 Win=6155 Len=0 TSval=7973610 TSecr=14905062 SLE=16197 SRE=16369
  201 9.405978958  10.6.15.156 → 192.168.1.12 SSH 302 Server: Encrypted packet (len=236)
  202 9.405983213 192.168.1.12 → 10.6.15.156  TCP 66 54766 → 22 [ACK] Seq=5789 Ack=16605 Win=6155 Len=0 TSval=7973610 TSecr=14905072
  203 9.406154455  10.6.15.156 → 192.168.1.12 SSH 206 Server: Encrypted packet (len=140)
  204 9.406160126 192.168.1.12 → 10.6.15.156  TCP 66 54766 → 22 [ACK] Seq=5789 Ack=16745 Win=6155 Len=0 TSval=7973610 TSecr=14905097
  205 9.508323031  10.6.15.156 → 192.168.1.12 SSH 102 Server: Encrypted packet (len=36)
  206 9.508339775 192.168.1.12 → 10.6.15.156  TCP 66 54766 → 22 [ACK] Seq=5789 Ack=16781 Win=6155 Len=0 TSval=7973636 TSecr=14905134
  207 10.489987255  10.6.15.156 → 192.168.1.12 SSH 182 Server: Encrypted packet (len=116)
  208 10.839343252 192.168.1.12 → 10.6.15.156  TCP 66 54766 → 22 [ACK] Seq=5789 Ack=16897 Win=6155 Len=0 TSval=7973881 TSecr=14905379
  209 10.840633165  10.6.15.156 → 192.168.1.12 SSH 270 Server: Encrypted packet (len=204)
  210 10.840649404 192.168.1.12 → 10.6.15.156  TCP 66 54766 → 22 [ACK] Seq=5789 Ack=17101 Win=6155 Len=0 TSval=7973969 TSecr=14905396
  211 10.840665938  10.6.15.156 → 192.168.1.12 SSH 206 Server: Encrypted packet (len=140)
  212 10.840672151 192.168.1.12 → 10.6.15.156  TCP 66 54766 → 22 [ACK] Seq=5789 Ack=17241 Win=6155 Len=0 TSval=7973969 TSecr=14905411
  213 10.840677251  10.6.15.156 → 192.168.1.12 SSH 198 Server: Encrypted packet (len=132)
  214 10.840679942 192.168.1.12 → 10.6.15.156  TCP 66 54766 → 22 [ACK] Seq=5789 Ack=17373 Win=6155 Len=0 TSval=7973969 TSecr=14905435
  215 10.841182387  10.6.15.156 → 192.168.1.12 SSH 198 Server: [TCP Spurious Retransmission] , Encrypted packet (len=132)
  216 10.841191519 192.168.1.12 → 10.6.15.156  TCP 78 [TCP Dup ACK 214#1] 54766 → 22 [ACK] Seq=5789 Ack=17373 Win=6155 Len=0 TSval=7973969 TSecr=14905465 SLE=17241 SRE=17373
  217 10.941681349  10.6.15.156 → 192.168.1.12 SSH 230 Server: Encrypted packet (len=164)
  218 10.941697526 192.168.1.12 → 10.6.15.156  TCP 66 54766 → 22 [ACK] Seq=5789 Ack=17537 Win=6155 Len=0 TSval=7973994 TSecr=14905492
  219 11.009650823  10.6.15.156 → 192.168.1.12 SSH 222 Server: Encrypted packet (len=156)
  220 11.009671775 192.168.1.12 → 10.6.15.156  TCP 66 54766 → 22 [ACK] Seq=5789 Ack=17693 Win=6155 Len=0 TSval=7974011 TSecr=14905509
  221 11.065750667  10.6.15.156 → 192.168.1.12 SSH 214 Server: Encrypted packet (len=148)
  222 11.165073923  10.6.15.156 → 192.168.1.12 SSH 222 Server: Encrypted packet (len=156)
  223 11.559285840 192.168.1.12 → 10.6.15.156  TCP 66 54766 → 22 [ACK] Seq=5789 Ack=17841 Win=6155 Len=0 TSval=7974025 TSecr=14905523
  224 11.559296808 192.168.1.12 → 10.6.15.156  TCP 66 54766 → 22 [ACK] Seq=5789 Ack=17997 Win=6155 Len=0 TSval=7974050 TSecr=14905548
  225 11.560656223  10.6.15.156 → 192.168.1.12 SSH 222 Server: [TCP Spurious Retransmission] , Encrypted packet (len=156)
  226 11.560670838 192.168.1.12 → 10.6.15.156  TCP 78 [TCP Dup ACK 224#1] 54766 → 22 [ACK] Seq=5789 Ack=17997 Win=6155 Len=0 TSval=7974149 TSecr=14905600 SLE=17841 SRE=17997
  227 11.560678262  10.6.15.156 → 192.168.1.12 SSH 214 Server: Encrypted packet (len=148)
  228 11.560680542 192.168.1.12 → 10.6.15.156  TCP 66 54766 → 22 [ACK] Seq=5789 Ack=18145 Win=6155 Len=0 TSval=7974149 TSecr=14905605
  229 11.614383910  10.6.15.156 → 192.168.1.12 SSH 270 Server: Encrypted packet (len=204)
  230 11.614401347 192.168.1.12 → 10.6.15.156  TCP 66 54766 → 22 [ACK] Seq=5789 Ack=18349 Win=6155 Len=0 TSval=7974162 TSecr=14905660
  231 11.842830506  10.6.15.156 → 192.168.1.12 SSH 270 Server: Encrypted packet (len=204)
  232 11.911087950  10.6.15.156 → 192.168.1.12 SSH 270 Server: Encrypted packet (len=204)
  233 12.271342108 192.168.1.12 → 10.6.15.156  TCP 66 54766 → 22 [ACK] Seq=5789 Ack=18553 Win=6155 Len=0 TSval=7974219 TSecr=14905718
  234 12.271352877 192.168.1.12 → 10.6.15.156  TCP 66 54766 → 22 [ACK] Seq=5789 Ack=18757 Win=6155 Len=0 TSval=7974236 TSecr=14905735
  235 12.272400174  10.6.15.156 → 192.168.1.12 SSH 270 Server: Encrypted packet (len=204)
  236 12.272416993 192.168.1.12 → 10.6.15.156  TCP 66 54766 → 22 [ACK] Seq=5789 Ack=18961 Win=6155 Len=0 TSval=7974327 TSecr=14905749
  237 12.272440003  10.6.15.156 → 192.168.1.12 SSH 182 Server: Encrypted packet (len=116)
  238 12.272448012 192.168.1.12 → 10.6.15.156  TCP 66 54766 → 22 [ACK] Seq=5789 Ack=19077 Win=6155 Len=0 TSval=7974327 TSecr=14905773
  239 12.293785383  10.6.15.156 → 192.168.1.12 SSH 182 Server: Encrypted packet (len=116)
  240 12.293803318 192.168.1.12 → 10.6.15.156  TCP 66 54766 → 22 [ACK] Seq=5789 Ack=19193 Win=6155 Len=0 TSval=7974332 TSecr=14905830
  241 12.362051641  10.6.15.156 → 192.168.1.12 SSH 182 Server: Encrypted packet (len=116)
  242 12.362069997 192.168.1.12 → 10.6.15.156  TCP 66 54766 → 22 [ACK] Seq=5789 Ack=19309 Win=6155 Len=0 TSval=7974349 TSecr=14905847
  243 12.418757551  10.6.15.156 → 192.168.1.12 SSH 182 Server: Encrypted packet (len=116)
  244 12.418776910 192.168.1.12 → 10.6.15.156  TCP 66 54766 → 22 [ACK] Seq=5789 Ack=19425 Win=6155 Len=0 TSval=7974363 TSecr=14905862
  245 12.516356892  10.6.15.156 → 192.168.1.12 SSH 182 Server: Encrypted packet (len=116)
  246 12.983343269 192.168.1.12 → 10.6.15.156  TCP 66 54766 → 22 [ACK] Seq=5789 Ack=19541 Win=6155 Len=0 TSval=7974388 TSecr=14905886
  247 12.984190262  10.6.15.156 → 192.168.1.12 SSH 342 Server: Encrypted packet (len=276)
  248 12.984209282 192.168.1.12 → 10.6.15.156  TCP 66 54766 → 22 [ACK] Seq=5789 Ack=19817 Win=6155 Len=0 TSval=7974505 TSecr=14905943
  249 12.984232568  10.6.15.156 → 192.168.1.12 SSH 342 Server: Encrypted packet (len=276)
  250 12.984239905 192.168.1.12 → 10.6.15.156  TCP 66 54766 → 22 [ACK] Seq=5789 Ack=20093 Win=6155 Len=0 TSval=7974505 TSecr=14905960
  251 12.984245954  10.6.15.156 → 192.168.1.12 SSH 334 Server: Encrypted packet (len=268)
  252 12.984248221 192.168.1.12 → 10.6.15.156  TCP 66 54766 → 22 [ACK] Seq=5789 Ack=20361 Win=6155 Len=0 TSval=7974505 TSecr=14905974
  253 12.984401707  10.6.15.156 → 192.168.1.12 SSH 302 Server: Encrypted packet (len=236)
  254 12.984404377 192.168.1.12 → 10.6.15.156  TCP 66 54766 → 22 [ACK] Seq=5789 Ack=20597 Win=6155 Len=0 TSval=7974505 TSecr=14905999
  255 13.696199506  10.6.15.156 → 192.168.1.12 SSH 406 Server: Encrypted packet (len=340)
  256 13.696217497 192.168.1.12 → 10.6.15.156  TCP 66 54766 → 22 [ACK] Seq=5789 Ack=20937 Win=6155 Len=0 TSval=7974683 TSecr=14906111
  257 13.696239477  10.6.15.156 → 192.168.1.12 SSH 502 Server: Encrypted packet (len=436)
  258 13.696246482 192.168.1.12 → 10.6.15.156  TCP 66 54766 → 22 [ACK] Seq=5789 Ack=21373 Win=6155 Len=0 TSval=7974683 TSecr=14906169
  259 13.715289674  10.6.15.156 → 192.168.1.12 SSH 502 Server: Encrypted packet (len=436)
  260 13.715307724 192.168.1.12 → 10.6.15.156  TCP 66 54766 → 22 [ACK] Seq=5789 Ack=21809 Win=6155 Len=0 TSval=7974688 TSecr=14906186
  261 13.771862229  10.6.15.156 → 192.168.1.12 SSH 502 Server: Encrypted packet (len=436)
  262 13.771879905 192.168.1.12 → 10.6.15.156  TCP 66 54766 → 22 [ACK] Seq=5789 Ack=22245 Win=6155 Len=0 TSval=7974702 TSecr=14906200
  263 13.869592482  10.6.15.156 → 192.168.1.12 SSH 318 Server: Encrypted packet (len=252)
  264 13.869611805 192.168.1.12 → 10.6.15.156  TCP 66 54766 → 22 [ACK] Seq=5789 Ack=22497 Win=6155 Len=0 TSval=7974726 TSecr=14906224
  265 14.097855207  10.6.15.156 → 192.168.1.12 SSH 230 Server: Encrypted packet (len=164)
  266 14.415288629 192.168.1.12 → 10.6.15.156  TCP 66 54766 → 22 [ACK] Seq=5789 Ack=22661 Win=6155 Len=0 TSval=7974783 TSecr=14906281
  267 14.416081122  10.6.15.156 → 192.168.1.12 SSH 238 Server: Encrypted packet (len=172)
  268 14.416096027 192.168.1.12 → 10.6.15.156  TCP 66 54766 → 22 [ACK] Seq=5789 Ack=22833 Win=6155 Len=0 TSval=7974863 TSecr=14906298
  269 14.416109118  10.6.15.156 → 192.168.1.12 SSH 302 Server: Encrypted packet (len=236)
  270 14.416113135 192.168.1.12 → 10.6.15.156  TCP 66 54766 → 22 [ACK] Seq=5789 Ack=23069 Win=6155 Len=0 TSval=7974863 TSecr=14906313
  271 14.416124879  10.6.15.156 → 192.168.1.12 SSH 238 Server: Encrypted packet (len=172)
  272 14.416126921 192.168.1.12 → 10.6.15.156  TCP 66 54766 → 22 [ACK] Seq=5789 Ack=23241 Win=6155 Len=0 TSval=7974863 TSecr=14906337
  273 14.548961681  10.6.15.156 → 192.168.1.12 SSH 310 Server: Encrypted packet (len=244)
  274 14.548979946 192.168.1.12 → 10.6.15.156  TCP 66 54766 → 22 [ACK] Seq=5789 Ack=23485 Win=6155 Len=0 TSval=7974896 TSecr=14906394
  275 14.618292769  10.6.15.156 → 192.168.1.12 SSH 302 Server: Encrypted packet (len=236)
  276 14.618310680 192.168.1.12 → 10.6.15.156  TCP 66 54766 → 22 [ACK] Seq=5789 Ack=23721 Win=6155 Len=0 TSval=7974913 TSecr=14906411
  277 14.675128935  10.6.15.156 → 192.168.1.12 SSH 302 Server: Encrypted packet (len=236)
  278 14.771733519  10.6.15.156 → 192.168.1.12 SSH 486 Server: Encrypted packet (len=420)
  279 15.127346037 192.168.1.12 → 10.6.15.156  TCP 66 54766 → 22 [ACK] Seq=5789 Ack=23957 Win=6155 Len=0 TSval=7974927 TSecr=14906425
  280 15.127356243 192.168.1.12 → 10.6.15.156  TCP 66 54766 → 22 [ACK] Seq=5789 Ack=24377 Win=6155 Len=0 TSval=7974952 TSecr=14906450
  281 15.128126140  10.6.15.156 → 192.168.1.12 SSH 334 Server: Encrypted packet (len=268)
  282 15.128141662 192.168.1.12 → 10.6.15.156  TCP 66 54766 → 22 [ACK] Seq=5789 Ack=24645 Win=6155 Len=0 TSval=7975041 TSecr=14906507
  283 15.128170569  10.6.15.156 → 192.168.1.12 SSH 342 Server: Encrypted packet (len=276)
  284 15.128177250 192.168.1.12 → 10.6.15.156  TCP 66 54766 → 22 [ACK] Seq=5789 Ack=24921 Win=6155 Len=0 TSval=7975041 TSecr=14906524
  285 15.128211158  10.6.15.156 → 192.168.1.12 SSH 334 Server: Encrypted packet (len=268)
  286 15.128214655 192.168.1.12 → 10.6.15.156  TCP 66 54766 → 22 [ACK] Seq=5789 Ack=25189 Win=6155 Len=0 TSval=7975041 TSecr=14906538
  287 15.521461943  10.6.15.156 → 192.168.1.12 SSH 374 Server: Encrypted packet (len=308)
  288 15.843340166 192.168.1.12 → 10.6.15.156  TCP 66 54766 → 22 [ACK] Seq=5789 Ack=25497 Win=6155 Len=0 TSval=7975139 TSecr=14906637
  289 15.844166034  10.6.15.156 → 192.168.1.12 SSH 182 Server: Encrypted packet (len=116)
  290 15.844185481 192.168.1.12 → 10.6.15.156  TCP 66 54766 → 22 [ACK] Seq=5789 Ack=25613 Win=6155 Len=0 TSval=7975220 TSecr=14906651
  291 15.844623328  10.6.15.156 → 192.168.1.12 SSH 302 Server: Encrypted packet (len=236)
  292 15.844630755 192.168.1.12 → 10.6.15.156  TCP 66 54766 → 22 [ACK] Seq=5789 Ack=25849 Win=6155 Len=0 TSval=7975220 TSecr=14906675
  293 15.902010387  10.6.15.156 → 192.168.1.12 SSH 302 Server: Encrypted packet (len=236)
  294 15.902028909 192.168.1.12 → 10.6.15.156  TCP 66 54766 → 22 [ACK] Seq=5789 Ack=26085 Win=6155 Len=0 TSval=7975234 TSecr=14906732
  295 15.970097238  10.6.15.156 → 192.168.1.12 SSH 182 Server: Encrypted packet (len=116)
  296 15.970120562 192.168.1.12 → 10.6.15.156  TCP 66 54766 → 22 [ACK] Seq=5789 Ack=26201 Win=6155 Len=0 TSval=7975251 TSecr=14906749
  297 16.027024024  10.6.15.156 → 192.168.1.12 SSH 454 Server: Encrypted packet (len=388)
  298 16.027042733 192.168.1.12 → 10.6.15.156  TCP 66 54766 → 22 [ACK] Seq=5789 Ack=26589 Win=6155 Len=0 TSval=7975265 TSecr=14906764
  299 16.124870881  10.6.15.156 → 192.168.1.12 SSH 342 Server: Encrypted packet (len=276)
  300 16.559274984 192.168.1.12 → 10.6.15.156  TCP 66 54766 → 22 [ACK] Seq=5789 Ack=26865 Win=6155 Len=0 TSval=7975290 TSecr=14906788
  301 16.560129656  10.6.15.156 → 192.168.1.12 SSH 374 Server: Encrypted packet (len=308)
  302 16.560146836 192.168.1.12 → 10.6.15.156  TCP 66 54766 → 22 [ACK] Seq=5789 Ack=27173 Win=6155 Len=0 TSval=7975399 TSecr=14906845
  303 16.560229877  10.6.15.156 → 192.168.1.12 SSH 334 Server: Encrypted packet (len=268)
  304 16.560238174 192.168.1.12 → 10.6.15.156  TCP 66 54766 → 22 [ACK] Seq=5789 Ack=27441 Win=6155 Len=0 TSval=7975399 TSecr=14906862
  305 16.803846813  10.6.15.156 → 192.168.1.12 SSH 182 Server: Encrypted packet (len=116)
  306 16.928625433  10.6.15.156 → 192.168.1.12 SSH 182 Server: Encrypted packet (len=116)
  307 17.028050816  10.6.15.156 → 192.168.1.12 SSH 198 Server: Encrypted packet (len=132)
  308 17.271287076 192.168.1.12 → 10.6.15.156  TCP 66 54766 → 22 [ACK] Seq=5789 Ack=27557 Win=6155 Len=0 TSval=7975460 TSecr=14906958
  309 17.271297517 192.168.1.12 → 10.6.15.156  TCP 66 54766 → 22 [ACK] Seq=5789 Ack=27673 Win=6155 Len=0 TSval=7975491 TSecr=14906989
  310 17.271299659 192.168.1.12 → 10.6.15.156  TCP 66 54766 → 22 [ACK] Seq=5789 Ack=27805 Win=6155 Len=0 TSval=7975516 TSecr=14907014
  311 17.324151075  10.6.15.156 → 192.168.1.12 SSH 206 Server: Encrypted packet (len=140)
  312 17.324170049 192.168.1.12 → 10.6.15.156  TCP 66 54766 → 22 [ACK] Seq=5789 Ack=27945 Win=6155 Len=0 TSval=7975590 TSecr=14907088
  313 17.380000175  10.6.15.156 → 192.168.1.12 SSH 350 Server: Encrypted packet (len=284)
  314 17.380018573 192.168.1.12 → 10.6.15.156  TCP 66 54766 → 22 [ACK] Seq=5789 Ack=28229 Win=6155 Len=0 TSval=7975604 TSecr=14907102
  315 17.477839581  10.6.15.156 → 192.168.1.12 SSH 870 Server: Encrypted packet (len=804)
  316 18.035276107 192.168.1.12 → 10.6.15.156  TCP 66 54766 → 22 [ACK] Seq=5789 Ack=29033 Win=6155 Len=0 TSval=7975628 TSecr=14907126
  317 18.036124851  10.6.15.156 → 192.168.1.12 SSH 902 Server: Encrypted packet (len=836)
  318 18.036138363 192.168.1.12 → 10.6.15.156  TCP 66 54766 → 22 [ACK] Seq=5789 Ack=29869 Win=6155 Len=0 TSval=7975768 TSecr=14907184
  319 18.036348117  10.6.15.156 → 192.168.1.12 SSH 870 Server: Encrypted packet (len=804)
  320 18.036357193 192.168.1.12 → 10.6.15.156  TCP 66 54766 → 22 [ACK] Seq=5789 Ack=30673 Win=6155 Len=0 TSval=7975768 TSecr=14907200
  321 18.036573394  10.6.15.156 → 192.168.1.12 SSH 710 Server: Encrypted packet (len=644)
  322 18.036580723 192.168.1.12 → 10.6.15.156  TCP 66 54766 → 22 [ACK] Seq=5789 Ack=31317 Win=6155 Len=0 TSval=7975768 TSecr=14907215
  323 18.157388256  10.6.15.156 → 192.168.1.12 SSH 182 Server: Encrypted packet (len=116)
  324 18.157405355 192.168.1.12 → 10.6.15.156  TCP 66 54766 → 22 [ACK] Seq=5789 Ack=31433 Win=6155 Len=0 TSval=7975798 TSecr=14907296
  325 18.379376190  10.6.15.156 → 192.168.1.12 SSH 222 Server: Encrypted packet (len=156)
  326 18.795278102 192.168.1.12 → 10.6.15.156  TCP 66 54766 → 22 [ACK] Seq=5789 Ack=31589 Win=6155 Len=0 TSval=7975854 TSecr=14907352
  327 18.795953348  10.6.15.156 → 192.168.1.12 SSH 222 Server: Encrypted packet (len=156)
  328 18.795970317 192.168.1.12 → 10.6.15.156  TCP 66 54766 → 22 [ACK] Seq=5789 Ack=31745 Win=6155 Len=0 TSval=7975958 TSecr=14907409
  329 18.796120255  10.6.15.156 → 192.168.1.12 SSH 222 Server: Encrypted packet (len=156)
  330 18.796125983 192.168.1.12 → 10.6.15.156  TCP 66 54766 → 22 [ACK] Seq=5789 Ack=31901 Win=6155 Len=0 TSval=7975958 TSecr=14907426
  331 18.796253154  10.6.15.156 → 192.168.1.12 SSH 150 Server: Encrypted packet (len=84)
  332 18.796256568 192.168.1.12 → 10.6.15.156  TCP 66 54766 → 22 [ACK] Seq=5789 Ack=31985 Win=6155 Len=0 TSval=7975958 TSecr=14907434
  333 18.796420469  10.6.15.156 → 192.168.1.12 SSH 222 Server: Encrypted packet (len=156)
  334 18.796425957 192.168.1.12 → 10.6.15.156  TCP 66 54766 → 22 [ACK] Seq=5789 Ack=32141 Win=6155 Len=0 TSval=7975958 TSecr=14907440
  335 18.796436079 192.168.1.12 → 10.6.15.156  SSH 150 Client: Encrypted packet (len=84)
  336 18.830273810  10.6.15.156 → 192.168.1.12 SSH 254 Server: Encrypted packet (len=188)
  337 18.871211952 192.168.1.12 → 10.6.15.156  TCP 66 54766 → 22 [ACK] Seq=5873 Ack=32329 Win=6155 Len=0 TSval=7975977 TSecr=14907464
  338 19.059378528  10.6.15.156 → 192.168.1.12 SSH 254 Server: Encrypted packet (len=188)
  339 19.134001417  10.6.15.156 → 192.168.1.12 SSH 254 Server: Encrypted packet (len=188)
  340 19.183956978  10.6.15.156 → 192.168.1.12 SSH 390 Server: Encrypted packet (len=324)
  341 19.559297798 192.168.1.12 → 91.189.89.198 NTP 90 NTP Version 4, client
  342 19.559310520 192.168.1.12 → 10.6.15.156  TCP 66 54766 → 22 [ACK] Seq=5873 Ack=32517 Win=6155 Len=0 TSval=7976024 TSecr=14907522
  343 19.559315420 192.168.1.12 → 10.6.15.156  TCP 66 54766 → 22 [ACK] Seq=5873 Ack=32705 Win=6155 Len=0 TSval=7976042 TSecr=14907539
  344 19.559317956 192.168.1.12 → 10.6.15.156  TCP 66 54766 → 22 [ACK] Seq=5873 Ack=33029 Win=6155 Len=0 TSval=7976055 TSecr=14907553
  345 19.561306443  10.6.15.156 → 192.168.1.12 SSH 254 Server: Encrypted packet (len=188)
  346 19.561321759 192.168.1.12 → 10.6.15.156  TCP 66 54766 → 22 [ACK] Seq=5873 Ack=33217 Win=6155 Len=0 TSval=7976149 TSecr=14907577
  347 19.561442603  10.6.15.156 → 192.168.1.12 SSH 150 Server: Encrypted packet (len=84)
  348 19.561446549 192.168.1.12 → 10.6.15.156  TCP 66 54766 → 22 [ACK] Seq=5873 Ack=33301 Win=6155 Len=0 TSval=7976149 TSecr=14907617
  349 19.561598197  10.6.15.156 → 192.168.1.12 SSH 182 Server: Encrypted packet (len=116)
  350 19.561605620 192.168.1.12 → 10.6.15.156  TCP 66 54766 → 22 [ACK] Seq=5873 Ack=33417 Win=6155 Len=0 TSval=7976149 TSecr=14907634
  351 19.561813556 192.168.1.12 → 10.6.15.156  SSH 150 Client: Encrypted packet (len=84)
  352 19.567851742 10.119.73.122 → 192.168.1.12 ICMP 110 Destination unreachable (Communication administratively filtered)
  353 19.578774751  10.6.15.156 → 192.168.1.12 SSH 238 Server: Encrypted packet (len=172)
  354 19.619216389 192.168.1.12 → 10.6.15.156  TCP 66 54766 → 22 [ACK] Seq=5957 Ack=33589 Win=6155 Len=0 TSval=7976164 TSecr=14907651
  355 19.732264230  10.6.15.156 → 192.168.1.12 SSH 182 Server: Encrypted packet (len=116)
  356 19.732289707 192.168.1.12 → 10.6.15.156  TCP 66 54766 → 22 [ACK] Seq=5957 Ack=33705 Win=6155 Len=0 TSval=7976192 TSecr=14907690
  357 19.960977094  10.6.15.156 → 192.168.1.12 SSH 254 Server: Encrypted packet (len=188)
  358 19.961003461 192.168.1.12 → 10.6.15.156  TCP 66 54766 → 22 [ACK] Seq=5957 Ack=33893 Win=6155 Len=0 TSval=7976249 TSecr=14907747
  359 20.029252422  10.6.15.156 → 192.168.1.12 SSH 286 Server: Encrypted packet (len=220)
  360 20.029269709 192.168.1.12 → 10.6.15.156  TCP 66 54766 → 22 [ACK] Seq=5957 Ack=34113 Win=6155 Len=0 TSval=7976266 TSecr=14907764
  361 20.085679242  10.6.15.156 → 192.168.1.12 SSH 318 Server: Encrypted packet (len=252)
  362 20.085694823 192.168.1.12 → 10.6.15.156  TCP 66 54766 → 22 [ACK] Seq=5957 Ack=34365 Win=6155 Len=0 TSval=7976280 TSecr=14907778
