    1 0.000000000  10.6.15.156 → 192.168.1.12 SSH 254 Server: Encrypted packet (len=188)
    2 0.000088280 192.168.1.12 → 10.6.15.156  TCP 66 54766 → 22 [ACK] Seq=1 Ack=189 Win=6155 Len=0 TSval=8088002 TSecr=15019502
    3 0.026155556 192.168.1.12 → 10.6.15.156  SSH 102 Client: Encrypted packet (len=36)
    4 0.027588698  10.6.15.156 → 192.168.1.12 TCP 66 22 → 54766 [ACK] Seq=189 Ack=37 Win=1452 Len=0 TSval=15019509 TSecr=8088009
    5 0.027610040 192.168.1.12 → 10.6.15.156  SSH 102 Client: Encrypted packet (len=36)
    6 0.028994975  10.6.15.156 → 192.168.1.12 TCP 66 22 → 54766 [ACK] Seq=189 Ack=73 Win=1452 Len=0 TSval=15019509 TSecr=8088009
    7 0.029014455 192.168.1.12 → 10.6.15.156  SSH 178 Client: Encrypted packet (len=112)
    8 0.030947576  10.6.15.156 → 192.168.1.12 TCP 66 22 → 54766 [ACK] Seq=189 Ack=185 Win=1452 Len=0 TSval=15019510 TSecr=8088010
    9 0.030961631 192.168.1.12 → 10.6.15.156  SSH 102 Client: Encrypted packet (len=36)
   10 0.032290425  10.6.15.156 → 192.168.1.12 TCP 66 22 → 54766 [ACK] Seq=189 Ack=221 Win=1452 Len=0 TSval=15019510 TSecr=8088010
   11 0.032311739 192.168.1.12 → 10.6.15.156  SSH 126 Client: Encrypted packet (len=60)
   12 0.032808088  10.6.15.156 → 192.168.1.12 SSH 154 Server: Encrypted packet (len=88)
   13 0.044239269  10.6.15.156 → 192.168.1.12 SSH 138 Server: Encrypted packet (len=72)
   14 0.044267996 192.168.1.12 → 10.6.15.156  SSH 290 Client: Encrypted packet (len=224)
   15 0.044562471 192.168.1.12 → 10.6.15.156  SSH 102 Client: Encrypted packet (len=36)
   16 0.045550942  10.6.15.156 → 192.168.1.12 SSH 138 Server: Encrypted packet (len=72)
   17 0.045573368  10.6.15.156 → 192.168.1.12 TCP 66 22 → 54766 [ACK] Seq=421 Ack=541 Win=1452 Len=0 TSval=15019513 TSecr=8088013
   18 0.045809641 192.168.1.12 → 10.6.15.156  SSH 102 Client: Encrypted packet (len=36)
   19 0.050535163  10.6.15.156 → 192.168.1.12 SSH 1514 Server: Encrypted packet (len=1448)
   20 0.050700557  10.6.15.156 → 192.168.1.12 SSH 1514 Server: Encrypted packet (len=1448)
   21 0.050710021 192.168.1.12 → 10.6.15.156  TCP 66 54766 → 22 [ACK] Seq=577 Ack=3317 Win=6155 Len=0 TSval=8088015 TSecr=15019514
   22 0.050933998  10.6.15.156 → 192.168.1.12 SSH 850 Server: Encrypted packet (len=784)
   23 0.050956734  10.6.15.156 → 192.168.1.12 SSH 310 Server: Encrypted packet (len=244)
   24 0.050964237 192.168.1.12 → 10.6.15.156  TCP 66 54766 → 22 [ACK] Seq=577 Ack=4345 Win=6155 Len=0 TSval=8088015 TSecr=15019514
   25 0.051206003 192.168.1.12 → 10.6.15.156  SSH 102 Client: Encrypted packet (len=36)
   26 0.051575657  10.6.15.156 → 192.168.1.12 SSH 254 Server: Encrypted packet (len=188)
   27 0.063803657  10.6.15.156 → 192.168.1.12 SSH 110 Server: Encrypted packet (len=44)
   28 0.063827624 192.168.1.12 → 10.6.15.156  SSH 610 Client: Encrypted packet (len=544)
   29 0.069033568  10.6.15.156 → 192.168.1.12 SSH 818 Server: Encrypted packet (len=752)
   30 0.069057551 192.168.1.12 → 10.6.15.156  SSH 430 Client: Encrypted packet (len=364)
   31 0.100538758  10.6.15.156 → 192.168.1.12 SSH 230 Server: Encrypted packet (len=164)
   32 0.100853533 192.168.1.12 → 10.6.15.156  SSH 134 Client: Encrypted packet (len=68)
   33 0.132144845  10.6.15.156 → 192.168.1.12 SSH 182 Server: Encrypted packet (len=116)
   34 0.156122337  10.6.15.156 → 192.168.1.12 SSH 254 Server: Encrypted packet (len=188)
   35 0.156192858 192.168.1.12 → 10.6.15.156  TCP 66 54766 → 22 [ACK] Seq=1589 Ack=5797 Win=6155 Len=0 TSval=8088041 TSecr=15019535
   36 0.215603085 192.168.1.12 → 10.6.15.156  SSH 334 Client: Encrypted packet (len=268)
   37 0.224966637  10.6.15.156 → 192.168.1.12 SSH 950 Server: Encrypted packet (len=884)
   38 0.224989197 192.168.1.12 → 10.6.15.156  SSH 230 Client: Encrypted packet (len=164)
   39 0.229100032  10.6.15.156 → 192.168.1.12 SSH 142 Server: Encrypted packet (len=76)
   40 0.247602211  10.6.15.156 → 192.168.1.12 SSH 182 Server: Encrypted packet (len=116)
   41 0.247676736 192.168.1.12 → 10.6.15.156  TCP 66 54766 → 22 [ACK] Seq=2021 Ack=6873 Win=6155 Len=0 TSval=8088064 TSecr=15019559
   42 0.346410404  10.6.15.156 → 192.168.1.12 SSH 1514 Server: Encrypted packet (len=1448)
   43 0.346571628  10.6.15.156 → 192.168.1.12 SSH 1514 Server: Encrypted packet (len=1448)
   44 0.346581473 192.168.1.12 → 10.6.15.156  TCP 66 54766 → 22 [ACK] Seq=2021 Ack=9769 Win=6155 Len=0 TSval=8088089 TSecr=15019588
   45 0.346706483  10.6.15.156 → 192.168.1.12 SSH 118 Server: Encrypted packet (len=52)
   46 0.347947145  10.6.15.156 → 192.168.1.12 SSH 1514 Server: Encrypted packet (len=1448)
   47 0.347967028 192.168.1.12 → 10.6.15.156  TCP 66 54766 → 22 [ACK] Seq=2021 Ack=11269 Win=6155 Len=0 TSval=8088089 TSecr=15019588
   48 0.348110453  10.6.15.156 → 192.168.1.12 SSH 1514 Server: Encrypted packet (len=1448)
   49 0.348438977  10.6.15.156 → 192.168.1.12 SSH 1514 Server: Encrypted packet (len=1448)
   50 0.348452650 192.168.1.12 → 10.6.15.156  TCP 66 54766 → 22 [ACK] Seq=2021 Ack=14165 Win=6155 Len=0 TSval=8088089 TSecr=15019589
   51 0.348606668  10.6.15.156 → 192.168.1.12 SSH 1514 Server: Encrypted packet (len=1448)
   52 0.348780126  10.6.15.156 → 192.168.1.12 SSH 1514 Server: Encrypted packet (len=1448)
   53 0.348788615 192.168.1.12 → 10.6.15.156  TCP 66 54766 → 22 [ACK] Seq=2021 Ack=17061 Win=6155 Len=0 TSval=8088089 TSecr=15019589
   54 0.349105392  10.6.15.156 → 192.168.1.12 SSH 1514 Server: Encrypted packet (len=1448)
   55 0.351113586  10.6.15.156 → 192.168.1.12 SSH 1514 Server: Encrypted packet (len=1448)
   56 0.351134678 192.168.1.12 → 10.6.15.156  TCP 66 54766 → 22 [ACK] Seq=2021 Ack=19957 Win=6155 Len=0 TSval=8088090 TSecr=15019589
   57 0.351276450  10.6.15.156 → 192.168.1.12 SSH 1514 Server: Encrypted packet (len=1448)
   58 0.351537869  10.6.15.156 → 192.168.1.12 SSH 1042 Server: Encrypted packet (len=976)
   59 0.351545949 192.168.1.12 → 10.6.15.156  TCP 66 54766 → 22 [ACK] Seq=2021 Ack=22381 Win=6155 Len=0 TSval=8088090 TSecr=15019589
   60 0.354004290  10.6.15.156 → 192.168.1.12 SSH 174 Server: Encrypted packet (len=108)
   61 0.355454747 192.168.1.12 → 10.6.15.156  SSH 134 Client: Encrypted packet (len=68)
   62 0.379556717  10.6.15.156 → 192.168.1.12 SSH 278 Server: Encrypted packet (len=212)
   63 0.379593874 192.168.1.12 → 10.6.15.156  SSH 190 Client: Encrypted packet (len=124)
   64 0.411533458  10.6.15.156 → 192.168.1.12 SSH 134 Server: Encrypted packet (len=68)
   65 0.412166609 192.168.1.12 → 10.6.15.156  SSH 366 Client: Encrypted packet (len=300)
   66 0.414963836 192.168.1.12 → 10.6.15.156  SSH 134 Client: Encrypted packet (len=68)
   67 0.416485949  10.6.15.156 → 192.168.1.12 TCP 66 22 → 54766 [ACK] Seq=22769 Ack=2581 Win=1452 Len=0 TSval=15019606 TSecr=8088105
   68 0.418586147 192.168.1.12 → 10.6.15.156  SSH 630 Client: Encrypted packet (len=564)
   69 0.419342075  10.6.15.156 → 192.168.1.12 SSH 142 Server: Encrypted packet (len=76)
   70 0.451131188  10.6.15.156 → 192.168.1.12 SSH 486 Server: Encrypted packet (len=420)
   71 0.451151714 192.168.1.12 → 10.6.15.156  TCP 66 54766 → 22 [ACK] Seq=3145 Ack=23265 Win=6155 Len=0 TSval=8088115 TSecr=15019607
   72 0.479958345 192.168.1.12 → 10.6.15.156  SSH 326 Client: Encrypted packet (len=260)
   73 0.503371389  10.6.15.156 → 192.168.1.12 SSH 438 Server: Encrypted packet (len=372)
   74 0.517041053  10.6.15.156 → 192.168.1.12 SSH 142 Server: Encrypted packet (len=76)
   75 0.517121889 192.168.1.12 → 10.6.15.156  TCP 66 54766 → 22 [ACK] Seq=3405 Ack=23713 Win=6155 Len=0 TSval=8088132 TSecr=15019627
   76 0.518397965  10.6.15.156 → 192.168.1.12 SSH 774 Server: Encrypted packet (len=708)
   77 0.519398987 192.168.1.12 → 10.6.15.156  SSH 134 Client: Encrypted packet (len=68)
   78 0.529197639  10.6.15.156 → 192.168.1.12 SSH 1514 Server: Encrypted packet (len=1448)
   79 0.529359772  10.6.15.156 → 192.168.1.12 SSH 1514 Server: Encrypted packet (len=1448)
   80 0.529372758 192.168.1.12 → 10.6.15.156  TCP 66 54766 → 22 [ACK] Seq=3473 Ack=27317 Win=6155 Len=0 TSval=8088135 TSecr=15019634
   81 0.529512024  10.6.15.156 → 192.168.1.12 SSH 262 Server: Encrypted packet (len=196)
   82 0.530789274  10.6.15.156 → 192.168.1.12 SSH 1514 Server: Encrypted packet (len=1448)
   83 0.530807948 192.168.1.12 → 10.6.15.156  TCP 66 54766 → 22 [ACK] Seq=3473 Ack=28961 Win=6155 Len=0 TSval=8088135 TSecr=15019634
   84 0.530953622  10.6.15.156 → 192.168.1.12 SSH 1514 Server: Encrypted packet (len=1448)
   85 0.531130251  10.6.15.156 → 192.168.1.12 SSH 1514 Server: Encrypted packet (len=1448)
   86 0.531140920 192.168.1.12 → 10.6.15.156  TCP 66 54766 → 22 [ACK] Seq=3473 Ack=31857 Win=6155 Len=0 TSval=8088135 TSecr=15019634
   87 0.531300999  10.6.15.156 → 192.168.1.12 SSH 1514 Server: Encrypted packet (len=1448)
   88 0.531626038  10.6.15.156 → 192.168.1.12 SSH 1514 Server: Encrypted packet (len=1448)
   89 0.531636017 192.168.1.12 → 10.6.15.156  TCP 66 54766 → 22 [ACK] Seq=3473 Ack=34753 Win=6155 Len=0 TSval=8088135 TSecr=15019634
   90 0.531799337  10.6.15.156 → 192.168.1.12 SSH 582 Server: Encrypted packet (len=516)
   91 0.532541294 192.168.1.12 → 10.6.15.156  SSH 134 Client: Encrypted packet (len=68)
   92 0.540329603  10.6.15.156 → 192.168.1.12 SSH 334 Server: Encrypted packet (len=268)
   93 0.552706586  10.6.15.156 → 192.168.1.12 SSH 1514 Server: Encrypted packet (len=1448)
   94 0.552728705 192.168.1.12 → 10.6.15.156  TCP 66 54766 → 22 [ACK] Seq=3541 Ack=36985 Win=6155 Len=0 TSval=8088140 TSecr=15019637
   95 0.552864152  10.6.15.156 → 192.168.1.12 SSH 1514 Server: Encrypted packet (len=1448)
   96 0.553037105  10.6.15.156 → 192.168.1.12 SSH 1514 Server: Encrypted packet (len=1448)
   97 0.553044332 192.168.1.12 → 10.6.15.156  TCP 66 54766 → 22 [ACK] Seq=3541 Ack=39881 Win=6155 Len=0 TSval=8088141 TSecr=15019640
   98 0.553056943  10.6.15.156 → 192.168.1.12 SSH 446 Server: Encrypted packet (len=380)
   99 0.553416536  10.6.15.156 → 192.168.1.12 SSH 1514 Server: Encrypted packet (len=1448)
  100 0.553425917 192.168.1.12 → 10.6.15.156  TCP 66 54766 → 22 [ACK] Seq=3541 Ack=41709 Win=6155 Len=0 TSval=8088141 TSecr=15019640
  101 0.553585321  10.6.15.156 → 192.168.1.12 SSH 1514 Server: Encrypted packet (len=1448)
  102 0.556103888  10.6.15.156 → 192.168.1.12 SSH 1514 Server: Encrypted packet (len=1448)
  103 0.556124383 192.168.1.12 → 10.6.15.156  TCP 66 54766 → 22 [ACK] Seq=3541 Ack=44605 Win=6155 Len=0 TSval=8088141 TSecr=15019640
  104 0.556264840  10.6.15.156 → 192.168.1.12 SSH 1514 Server: Encrypted packet (len=1448)
  105 0.556437321  10.6.15.156 → 192.168.1.12 SSH 1514 Server: Encrypted packet (len=1448)
  106 0.556442607 192.168.1.12 → 10.6.15.156  TCP 66 54766 → 22 [ACK] Seq=3541 Ack=47501 Win=6155 Len=0 TSval=8088141 TSecr=15019641
  107 0.556450213  10.6.15.156 → 192.168.1.12 SSH 190 Server: Encrypted packet (len=124)
  108 0.556536230 192.168.1.12 → 10.6.15.156  SSH 462 Client: Encrypted packet (len=396)
  109 0.561470861  10.6.15.156 → 192.168.1.12 SSH 262 Server: Encrypted packet (len=196)
  110 0.561494657 192.168.1.12 → 10.6.15.156  SSH 142 Client: Encrypted packet (len=76)
  111 0.565583557  10.6.15.156 → 192.168.1.12 SSH 142 Server: Encrypted packet (len=76)
  112 0.565605750 192.168.1.12 → 10.6.15.156  SSH 134 Client: Encrypted packet (len=68)
  113 0.607079744  10.6.15.156 → 192.168.1.12 TCP 66 22 → 54766 [ACK] Seq=47897 Ack=4081 Win=1452 Len=0 TSval=15019654 TSecr=8088144
  114 0.607674304  10.6.15.156 → 192.168.1.12 SSH 454 Server: Encrypted packet (len=388)
  115 0.648956883 192.168.1.12 → 10.6.15.156  TCP 66 54766 → 22 [ACK] Seq=4081 Ack=48285 Win=6155 Len=0 TSval=8088165 TSecr=15019654
  116 0.677756047  10.6.15.156 → 192.168.1.12 SSH 310 Server: Encrypted packet (len=244)
  117 0.677844372 192.168.1.12 → 10.6.15.156  TCP 66 54766 → 22 [ACK] Seq=4081 Ack=48529 Win=6155 Len=0 TSval=8088172 TSecr=15019671
  118 0.786673683  10.6.15.156 → 192.168.1.12 SSH 190 Server: Encrypted packet (len=124)
  119 0.786754674 192.168.1.12 → 10.6.15.156  TCP 66 54766 → 22 [ACK] Seq=4081 Ack=48653 Win=6155 Len=0 TSval=8088199 TSecr=15019698
  120 0.815143023 192.168.1.12 → 10.6.15.156  SSH 318 Client: Encrypted packet (len=252)
  121 0.816826728  10.6.15.156 → 192.168.1.12 TCP 66 22 → 54766 [ACK] Seq=48653 Ack=4333 Win=1452 Len=0 TSval=15019706 TSecr=8088206
  122 0.819110053  10.6.15.156 → 192.168.1.12 SSH 134 Server: Encrypted packet (len=68)
  123 0.831189295  10.6.15.156 → 192.168.1.12 SSH 566 Server: Encrypted packet (len=500)
  124 0.831281531 192.168.1.12 → 10.6.15.156  TCP 66 54766 → 22 [ACK] Seq=4333 Ack=49221 Win=6155 Len=0 TSval=8088210 TSecr=15019707
  125 0.903126222  10.6.15.156 → 192.168.1.12 SSH 534 Server: Encrypted packet (len=468)
  126 0.903160006  10.6.15.156 → 192.168.1.12 SSH 374 Server: Encrypted packet (len=308)
  127 0.903206493 192.168.1.12 → 10.6.15.156  TCP 66 54766 → 22 [ACK] Seq=4333 Ack=49997 Win=6155 Len=0 TSval=8088228 TSecr=15019727
  128 0.904107368 192.168.1.12 → 10.6.15.156  SSH 134 Client: Encrypted packet (len=68)
  129 0.943139074  10.6.15.156 → 192.168.1.12 TCP 66 22 → 54766 [ACK] Seq=49997 Ack=4401 Win=1452 Len=0 TSval=15019738 TSecr=8088228
  130 0.953620263  10.6.15.156 → 192.168.1.12 SSH 422 Server: Encrypted packet (len=356)
  131 0.978804658 192.168.1.12 → 10.6.15.156  SSH 318 Client: Encrypted packet (len=252)
  132 0.980802611  10.6.15.156 → 192.168.1.12 TCP 66 22 → 54766 [ACK] Seq=50353 Ack=4653 Win=1452 Len=0 TSval=15019747 TSecr=8088247
  133 1.058489105  10.6.15.156 → 192.168.1.12 SSH 438 Server: Encrypted packet (len=372)
  134 1.080196012  10.6.15.156 → 192.168.1.12 SSH 1514 Server: Encrypted packet (len=1448)
  135 1.080216265 192.168.1.12 → 10.6.15.156  TCP 66 54766 → 22 [ACK] Seq=4653 Ack=52173 Win=6155 Len=0 TSval=8088272 TSecr=15019766
  136 1.080235108  10.6.15.156 → 192.168.1.12 SSH 598 Server: Encrypted packet (len=532)
  137 1.082352571 192.168.1.12 → 10.6.15.156  SSH 134 Client: Encrypted packet (len=68)
  138 1.083940081  10.6.15.156 → 192.168.1.12 TCP 66 22 → 54766 [ACK] Seq=52705 Ack=4721 Win=1452 Len=0 TSval=15019773 TSecr=8088273
  139 1.281656187  10.6.15.156 → 192.168.1.12 SSH 206 Server: Encrypted packet (len=140)
  140 1.324964089 192.168.1.12 → 10.6.15.156  TCP 66 54766 → 22 [ACK] Seq=4721 Ack=52845 Win=6155 Len=0 TSval=8088334 TSecr=15019822
  141 1.352918906  10.6.15.156 → 192.168.1.12 SSH 182 Server: Encrypted packet (len=116)
  142 1.353012825 192.168.1.12 → 10.6.15.156  TCP 66 54766 → 22 [ACK] Seq=4721 Ack=52961 Win=6155 Len=0 TSval=8088341 TSecr=15019840
  143 1.404404646  10.6.15.156 → 192.168.1.12 SSH 190 Server: Encrypted packet (len=124)
  144 1.404484657 192.168.1.12 → 10.6.15.156  TCP 66 54766 → 22 [ACK] Seq=4721 Ack=53085 Win=6155 Len=0 TSval=8088353 TSecr=15019853
  145 1.425146812 192.168.1.12 → 10.6.15.156  SSH 1514 Client: Encrypted packet (len=1448)
  146 1.427454417  10.6.15.156 → 192.168.1.12 TCP 66 22 → 54766 [ACK] Seq=53085 Ack=6169 Win=1452 Len=0 TSval=15019859 TSecr=8088359
  147 1.427468936 192.168.1.12 → 10.6.15.156  SSH 798 Client: Encrypted packet (len=732)
  148 1.429317091  10.6.15.156 → 192.168.1.12 TCP 66 22 → 54766 [ACK] Seq=53085 Ack=6901 Win=1452 Len=0 TSval=15019859 TSecr=8088359
  149 1.432075626  10.6.15.156 → 192.168.1.12 SSH 142 Server: Encrypted packet (len=76)
  150 1.472963069 192.168.1.12 → 10.6.15.156  TCP 66 54766 → 22 [ACK] Seq=6901 Ack=53161 Win=6155 Len=0 TSval=8088371 TSecr=15019860
  151 1.506582215 192.168.1.12 → 10.6.15.156  SSH 1038 Client: Encrypted packet (len=972)
  152 1.519668401  10.6.15.156 → 192.168.1.12 SSH 670 Server: Encrypted packet (len=604)
  153 1.519701114 192.168.1.12 → 10.6.15.156  SSH 190 Client: Encrypted packet (len=124)
  154 1.538152348  10.6.15.156 → 192.168.1.12 SSH 110 Server: Encrypted packet (len=44)
  155 1.538421840 192.168.1.12 → 10.6.15.156  SSH 238 Client: Encrypted packet (len=172)
  156 1.547745023  10.6.15.156 → 192.168.1.12 SSH 138 Server: Encrypted packet (len=72)
  157 1.547972483 192.168.1.12 → 10.6.15.156  SSH 102 Client: Encrypted packet (len=36)
  158 1.549393730  10.6.15.156 → 192.168.1.12 SSH 918 Server: Encrypted packet (len=852)
  159 1.550019930  10.6.15.156 → 192.168.1.12 SSH 542 Server: Encrypted packet (len=476)
  160 1.550081622 192.168.1.12 → 10.6.15.156  TCP 66 54766 → 22 [ACK] Seq=8205 Ack=55209 Win=6155 Len=0 TSval=8088390 TSecr=15019889
  161 1.551143371 192.168.1.12 → 10.6.15.156  SSH 142 Client: Encrypted packet (len=76)
  162 1.558589113  10.6.15.156 → 192.168.1.12 SSH 198 Server: Encrypted packet (len=132)
  163 1.558607844 192.168.1.12 → 10.6.15.156  SSH 1390 Client: Encrypted packet (len=1324)
  164 1.572893300 192.168.1.12 → 10.6.15.156  SSH 1514 Client: Encrypted packet (len=1448)
  165 1.573939327 192.168.1.12 → 10.6.15.156  SSH 222 Client: Encrypted packet (len=156)
  166 1.574331632 192.168.1.12 → 10.6.15.156  SSH 1514 Client: Encrypted packet (len=1448)
  167 1.574863189 192.168.1.12 → 10.6.15.156  SSH 198 Client: Encrypted packet (len=132)
  168 1.575578096  10.6.15.156 → 192.168.1.12 TCP 66 22 → 54766 [ACK] Seq=55341 Ack=11053 Win=1452 Len=0 TSval=15019896 TSecr=8088392
  169 1.576412109  10.6.15.156 → 192.168.1.12 TCP 66 22 → 54766 [ACK] Seq=55341 Ack=12789 Win=1452 Len=0 TSval=15019896 TSecr=8088396
  170 1.715440411  10.6.15.156 → 192.168.1.12 SSH 670 Server: Encrypted packet (len=604)
  171 1.730057342  10.6.15.156 → 192.168.1.12 SSH 694 Server: Encrypted packet (len=628)
  172 1.730144205 192.168.1.12 → 10.6.15.156  TCP 66 54766 → 22 [ACK] Seq=12789 Ack=56573 Win=6155 Len=0 TSval=8088435 TSecr=15019931
  173 1.732460260  10.6.15.156 → 192.168.1.12 SSH 190 Server: Encrypted packet (len=124)
  174 1.738075910  10.6.15.156 → 192.168.1.12 SSH 710 Server: Encrypted packet (len=644)
  175 1.738156038 192.168.1.12 → 10.6.15.156  TCP 66 54766 → 22 [ACK] Seq=12789 Ack=57341 Win=6155 Len=0 TSval=8088437 TSecr=15019935
  176 1.739901329  10.6.15.156 → 192.168.1.12 SSH 246 Server: Encrypted packet (len=180)
  177 1.772352304 192.168.1.12 → 10.6.15.156  SSH 1318 Client: Encrypted packet (len=1252)
  178 1.773122886 192.168.1.12 → 10.6.15.156  SSH 1514 Client: Encrypted packet (len=1448)
  179 1.773660967 192.168.1.12 → 10.6.15.156  SSH 1514 Client: Encrypted packet (len=1448)
  180 1.774193648 192.168.1.12 → 10.6.15.156  SSH 1514 Client: Encrypted packet (len=1448)
  181 1.774763717 192.168.1.12 → 10.6.15.156  SSH 1514 Client: Encrypted packet (len=1448)
  182 1.775300087 192.168.1.12 → 10.6.15.156  SSH 1514 Client: Encrypted packet (len=1448)
  183 1.775489250  10.6.15.156 → 192.168.1.12 TCP 66 22 → 54766 [ACK] Seq=57521 Ack=15489 Win=1452 Len=0 TSval=15019946 TSecr=8088445
  184 1.776090295 192.168.1.12 → 10.6.15.156  SSH 1514 Client: Encrypted packet (len=1448)
  185 1.776655568 192.168.1.12 → 10.6.15.156  SSH 1514 Client: Encrypted packet (len=1448)
  186 1.776745862  10.6.15.156 → 192.168.1.12 TCP 66 22 → 54766 [ACK] Seq=57521 Ack=18385 Win=1452 Len=0 TSval=15019946 TSecr=8088446
  187 1.778304553 192.168.1.12 → 10.6.15.156  SSH 1514 Client: Encrypted packet (len=1448)
  188 1.778407438  10.6.15.156 → 192.168.1.12 TCP 66 22 → 54766 [ACK] Seq=57521 Ack=21281 Win=1452 Len=0 TSval=15019946 TSecr=8088446
  189 1.779006770 192.168.1.12 → 10.6.15.156  SSH 1514 Client: Encrypted packet (len=1448)
  190 1.779558522 192.168.1.12 → 10.6.15.156  SSH 1514 Client: Encrypted packet (len=1448)
  191 1.779660611  10.6.15.156 → 192.168.1.12 TCP 66 22 → 54766 [ACK] Seq=57521 Ack=24177 Win=1452 Len=0 TSval=15019947 TSecr=8088446
  192 1.780207436 192.168.1.12 → 10.6.15.156  SSH 1514 Client: Encrypted packet (len=1448)
  193 1.780731255 192.168.1.12 → 10.6.15.156  SSH 1514 Client: Encrypted packet (len=1448)
  194 1.781299736 192.168.1.12 → 10.6.15.156  SSH 1514 Client: Encrypted packet (len=1448)
  195 1.781395245  10.6.15.156 → 192.168.1.12 TCP 66 22 → 54766 [ACK] Seq=57521 Ack=27073 Win=1452 Len=0 TSval=15019947 TSecr=8088447
  196 1.781988416 192.168.1.12 → 10.6.15.156  SSH 1514 Client: Encrypted packet (len=1448)
  197 1.783466706 192.168.1.12 → 10.6.15.156  SSH 1514 Client: Encrypted packet (len=1448)
  198 1.783575207  10.6.15.156 → 192.168.1.12 TCP 66 22 → 54766 [ACK] Seq=57521 Ack=29969 Win=1452 Len=0 TSval=15019947 TSecr=8088447
  199 1.784157914 192.168.1.12 → 10.6.15.156  SSH 1514 Client: Encrypted packet (len=1448)
  200 1.784727969 192.168.1.12 → 10.6.15.156  SSH 1514 Client: Encrypted packet (len=1448)
  201 1.784824086  10.6.15.156 → 192.168.1.12 TCP 66 22 → 54766 [ACK] Seq=57521 Ack=32865 Win=1452 Len=0 TSval=15019948 TSecr=8088447
  202 1.784831859  10.6.15.156 → 192.168.1.12 SSH 102 Server: Encrypted packet (len=36)
  203 1.785465349 192.168.1.12 → 10.6.15.156  SSH 1514 Client: Encrypted packet (len=1448)
  204 1.786326946  10.6.15.156 → 192.168.1.12 TCP 66 22 → 54766 [ACK] Seq=57557 Ack=37209 Win=1452 Len=0 TSval=15019948 TSecr=8088448
  205 1.787128186 192.168.1.12 → 10.6.15.156  SSH 1514 Client: Encrypted packet (len=1448)
  206 1.787699774 192.168.1.12 → 10.6.15.156  SSH 1514 Client: Encrypted packet (len=1448)
  207 1.787790610  10.6.15.156 → 192.168.1.12 TCP 66 22 → 54766 [ACK] Seq=57557 Ack=40105 Win=1452 Len=0 TSval=15019949 TSecr=8088448
  208 1.788382234 192.168.1.12 → 10.6.15.156  SSH 1514 Client: Encrypted packet (len=1448)
  209 1.788948175 192.168.1.12 → 10.6.15.156  SSH 1514 Client: Encrypted packet (len=1448)
  210 1.789504108 192.168.1.12 → 10.6.15.156  SSH 1514 Client: Encrypted packet (len=1448)
  211 1.790065291 192.168.1.12 → 10.6.15.156  SSH 1514 Client: Encrypted packet (len=1448)
  212 1.790144114  10.6.15.156 → 192.168.1.12 TCP 66 22 → 54766 [ACK] Seq=57557 Ack=43001 Win=1452 Len=0 TSval=15019949 TSecr=8088449
  213 1.790817320 192.168.1.12 → 10.6.15.156  SSH 1514 Client: Encrypted packet (len=1448)
  214 1.791430827 192.168.1.12 → 10.6.15.156  SSH 1514 Client: Encrypted packet (len=1448)
  215 1.791456233  10.6.15.156 → 192.168.1.12 TCP 66 22 → 54766 [ACK] Seq=57557 Ack=45897 Win=1452 Len=0 TSval=15019950 TSecr=8088449
  216 1.792088872 192.168.1.12 → 10.6.15.156  SSH 1514 Client: Encrypted packet (len=1448)
  217 1.792638640 192.168.1.12 → 10.6.15.156  SSH 1514 Client: Encrypted packet (len=1448)
  218 1.792762535  10.6.15.156 → 192.168.1.12 TCP 66 22 → 54766 [ACK] Seq=57557 Ack=48793 Win=1452 Len=0 TSval=15019950 TSecr=8088450
  219 1.793321394 192.168.1.12 → 10.6.15.156  SSH 1514 Client: Encrypted packet (len=1448)
  220 1.793932762 192.168.1.12 → 10.6.15.156  SSH 1514 Client: Encrypted packet (len=1448)
  221 1.794019119  10.6.15.156 → 192.168.1.12 TCP 66 22 → 54766 [ACK] Seq=57557 Ack=51689 Win=1452 Len=0 TSval=15019950 TSecr=8088450
  222 1.794652704 192.168.1.12 → 10.6.15.156  SSH 1514 Client: Encrypted packet (len=1448)
  223 1.797891129 192.168.1.12 → 10.6.15.156  SSH 1514 Client: Encrypted packet (len=1448)
  224 1.798013008  10.6.15.156 → 192.168.1.12 TCP 66 22 → 54766 [ACK] Seq=57557 Ack=54585 Win=1452 Len=0 TSval=15019951 TSecr=8088450
  225 1.798027338  10.6.15.156 → 192.168.1.12 TCP 66 22 → 54766 [ACK] Seq=57557 Ack=57481 Win=1452 Len=0 TSval=15019951 TSecr=8088451
  226 1.798668331 192.168.1.12 → 10.6.15.156  SSH 1514 Client: Encrypted packet (len=1448)
  227 1.799867816 192.168.1.12 → 10.6.15.156  SSH 1514 Client: Encrypted packet (len=1448)
  228 1.799936754  10.6.15.156 → 192.168.1.12 SSH 138 Server: Encrypted packet (len=72)
  229 1.800529087 192.168.1.12 → 10.6.15.156  SSH 1514 Client: Encrypted packet (len=1448)
  230 1.801090894 192.168.1.12 → 10.6.15.156  SSH 1514 Client: Encrypted packet (len=1448)
  231 1.802140994 192.168.1.12 → 10.6.15.156  SSH 1514 Client: Encrypted packet (len=1448)
  232 1.802253981  10.6.15.156 → 192.168.1.12 TCP 66 22 → 54766 [ACK] Seq=57629 Ack=61825 Win=1452 Len=0 TSval=15019952 TSecr=8088452
  233 1.802857290 192.168.1.12 → 10.6.15.156  SSH 1514 Client: Encrypted packet (len=1448)
  234 1.802946714  10.6.15.156 → 192.168.1.12 TCP 66 22 → 54766 [ACK] Seq=57629 Ack=64721 Win=1452 Len=0 TSval=15019952 TSecr=8088452
  235 1.803557897 192.168.1.12 → 10.6.15.156  SSH 1514 Client: Encrypted packet (len=1448)
  236 1.804760895 192.168.1.12 → 10.6.15.156  SSH 1514 Client: Encrypted packet (len=1448)
  237 1.805950586 192.168.1.12 → 10.6.15.156  SSH 1514 Client: Encrypted packet (len=1448)
  238 1.806544761 192.168.1.12 → 10.6.15.156  SSH 1514 Client: Encrypted packet (len=1448)
  239 1.807130772 192.168.1.12 → 10.6.15.156  SSH 1514 Client: Encrypted packet (len=1448)
  240 1.825007313 192.168.1.12 → 10.6.15.156  SSH 1514 Client: Encrypted packet (len=1448)
  241 1.834368202  10.6.15.156 → 192.168.1.12 TCP 66 22 → 54766 [ACK] Seq=57629 Ack=77753 Win=1452 Len=0 TSval=15019960 TSecr=8088453
  242 1.834393524 192.168.1.12 → 10.6.15.156  SSH 1514 Client: Encrypted packet (len=1448)
  243 1.834867990  10.6.15.156 → 192.168.1.12 SSH 222 Server: Encrypted packet (len=156)
  244 1.835434483 192.168.1.12 → 10.6.15.156  SSH 1514 Client: Encrypted packet (len=1448)
  245 1.836042654 192.168.1.12 → 10.6.15.156  SSH 1514 Client: Encrypted packet (len=1448)
  246 1.836659448 192.168.1.12 → 10.6.15.156  SSH 1514 Client: Encrypted packet (len=1448)
  247 1.837243291 192.168.1.12 → 10.6.15.156  SSH 1514 Client: Encrypted packet (len=1448)
  248 1.838307104  10.6.15.156 → 192.168.1.12 TCP 66 22 → 54766 [ACK] Seq=57785 Ack=80649 Win=1452 Len=0 TSval=15019961 TSecr=8088461
  249 1.839051435 192.168.1.12 → 10.6.15.156  SSH 1514 Client: Encrypted packet (len=1448)
  250 1.839162855  10.6.15.156 → 192.168.1.12 TCP 66 22 → 54766 [ACK] Seq=57785 Ack=83545 Win=1452 Len=0 TSval=15019962 TSecr=8088461
  251 1.839762591 192.168.1.12 → 10.6.15.156  SSH 1514 Client: Encrypted packet (len=1448)
  252 1.840322734 192.168.1.12 → 10.6.15.156  SSH 1514 Client: Encrypted packet (len=1448)
  253 1.843362651 192.168.1.12 → 10.6.15.156  SSH 446 Client: Encrypted packet (len=380)
  254 1.844113007  10.6.15.156 → 192.168.1.12 TCP 66 22 → 54766 [ACK] Seq=57785 Ack=86441 Win=1452 Len=0 TSval=15019962 TSecr=8088462
  255 1.844924767  10.6.15.156 → 192.168.1.12 TCP 66 22 → 54766 [ACK] Seq=57785 Ack=89337 Win=1452 Len=0 TSval=15019963 TSecr=8088462
  256 1.855573172  10.6.15.156 → 192.168.1.12 SSH 238 Server: Encrypted packet (len=172)
  257 1.897004621 192.168.1.12 → 10.6.15.156  TCP 66 54766 → 22 [ACK] Seq=89717 Ack=57957 Win=6155 Len=0 TSval=8088477 TSecr=15019966
  258 1.960072514  10.6.15.156 → 192.168.1.12 SSH 238 Server: Encrypted packet (len=172)
  259 1.960153352 192.168.1.12 → 10.6.15.156  TCP 66 54766 → 22 [ACK] Seq=89717 Ack=58129 Win=6155 Len=0 TSval=8088492 TSecr=15019992
  260 1.972746882  10.6.15.156 → 192.168.1.12 SSH 110 Server: Encrypted packet (len=44)
  261 1.972820016 192.168.1.12 → 10.6.15.156  TCP 66 54766 → 22 [ACK] Seq=89717 Ack=58173 Win=6155 Len=0 TSval=8088495 TSecr=15019995
  262 1.973142875 192.168.1.12 → 10.6.15.156  SSH 366 Client: Encrypted packet (len=300)
  263 2.011153812  10.6.15.156 → 192.168.1.12 TCP 66 22 → 54766 [ACK] Seq=58173 Ack=90017 Win=1452 Len=0 TSval=15020005 TSecr=8088496
  264 2.114627907  10.6.15.156 → 192.168.1.12 SSH 358 Server: Encrypted packet (len=292)
  265 2.156979469 192.168.1.12 → 10.6.15.156  TCP 66 54766 → 22 [ACK] Seq=90017 Ack=58465 Win=6155 Len=0 TSval=8088542 TSecr=15020030
  266 2.183440011  10.6.15.156 → 192.168.1.12 SSH 278 Server: Encrypted packet (len=212)
  267 2.183512201 192.168.1.12 → 10.6.15.156  TCP 66 54766 → 22 [ACK] Seq=90017 Ack=58677 Win=6155 Len=0 TSval=8088548 TSecr=15020048
  268 2.255089641  10.6.15.156 → 192.168.1.12 SSH 214 Server: Encrypted packet (len=148)
  269 2.255177521 192.168.1.12 → 10.6.15.156  TCP 66 54766 → 22 [ACK] Seq=90017 Ack=58825 Win=6155 Len=0 TSval=8088566 TSecr=15020065
  270 2.269239728  10.6.15.156 → 192.168.1.12 SSH 670 Server: Encrypted packet (len=604)
  271 2.269338676 192.168.1.12 → 10.6.15.156  TCP 66 54766 → 22 [ACK] Seq=90017 Ack=59429 Win=6155 Len=0 TSval=8088570 TSecr=15020069
  272 2.306604967  10.6.15.156 → 192.168.1.12 SSH 182 Server: Encrypted packet (len=116)
  273 2.306708933 192.168.1.12 → 10.6.15.156  TCP 66 54766 → 22 [ACK] Seq=90017 Ack=59545 Win=6155 Len=0 TSval=8088579 TSecr=15020078
  274 2.411238324  10.6.15.156 → 192.168.1.12 SSH 182 Server: Encrypted packet (len=116)
  275 2.411359379 192.168.1.12 → 10.6.15.156  TCP 66 54766 → 22 [ACK] Seq=90017 Ack=59661 Win=6155 Len=0 TSval=8088605 TSecr=15020105
  276 2.635949749  10.6.15.156 → 192.168.1.12 SSH 222 Server: Encrypted packet (len=156)
  277 2.635975697 192.168.1.12 → 10.6.15.156  TCP 66 54766 → 22 [ACK] Seq=90017 Ack=59817 Win=6155 Len=0 TSval=8088661 TSecr=15020160
  278 2.705969537  10.6.15.156 → 192.168.1.12 SSH 182 Server: Encrypted packet (len=116)
  279 2.705987129 192.168.1.12 → 10.6.15.156  TCP 66 54766 → 22 [ACK] Seq=90017 Ack=59933 Win=6155 Len=0 TSval=8088679 TSecr=15020178
  280 2.862286278  10.6.15.156 → 192.168.1.12 SSH 406 Server: Encrypted packet (len=340)
  281 2.862304551 192.168.1.12 → 10.6.15.156  TCP 66 54766 → 22 [ACK] Seq=90017 Ack=60273 Win=6155 Len=0 TSval=8088718 TSecr=15020217
  282 3.085721037  10.6.15.156 → 192.168.1.12 SSH 270 Server: Encrypted packet (len=204)
  283 3.085740035 192.168.1.12 → 10.6.15.156  TCP 66 54766 → 22 [ACK] Seq=90017 Ack=60477 Win=6155 Len=0 TSval=8088774 TSecr=15020273
  284 3.157186172  10.6.15.156 → 192.168.1.12 SSH 310 Server: Encrypted packet (len=244)
  285 3.157203662 192.168.1.12 → 10.6.15.156  TCP 66 54766 → 22 [ACK] Seq=90017 Ack=60721 Win=6155 Len=0 TSval=8088792 TSecr=15020291
  286 3.208592742  10.6.15.156 → 192.168.1.12 SSH 406 Server: Encrypted packet (len=340)
  287 3.208611358 192.168.1.12 → 10.6.15.156  TCP 66 54766 → 22 [ACK] Seq=90017 Ack=61061 Win=6155 Len=0 TSval=8088804 TSecr=15020304
  288 3.659918651  10.6.15.156 → 192.168.1.12 SSH 182 Server: Encrypted packet (len=116)
  289 3.659936372 192.168.1.12 → 10.6.15.156  TCP 66 54766 → 22 [ACK] Seq=90017 Ack=61177 Win=6155 Len=0 TSval=8088917 TSecr=15020417
  290 3.764046850  10.6.15.156 → 192.168.1.12 SSH 182 Server: Encrypted packet (len=116)
  291 3.764064537 192.168.1.12 → 10.6.15.156  TCP 66 54766 → 22 [ACK] Seq=90017 Ack=61293 Win=6155 Len=0 TSval=8088943 TSecr=15020443
  292 3.987822534  10.6.15.156 → 192.168.1.12 SSH 182 Server: Encrypted packet (len=116)
  293 3.987840765 192.168.1.12 → 10.6.15.156  TCP 66 54766 → 22 [ACK] Seq=90017 Ack=61409 Win=6155 Len=0 TSval=8088999 TSecr=15020499
  294 4.059073843  10.6.15.156 → 192.168.1.12 SSH 254 Server: Encrypted packet (len=188)
  295 4.059092001 192.168.1.12 → 10.6.15.156  TCP 66 54766 → 22 [ACK] Seq=90017 Ack=61597 Win=6155 Len=0 TSval=8089017 TSecr=15020517
  296 4.110421426  10.6.15.156 → 192.168.1.12 SSH 182 Server: Encrypted packet (len=116)
  297 4.110438709 192.168.1.12 → 10.6.15.156  TCP 66 54766 → 22 [ACK] Seq=90017 Ack=61713 Win=6155 Len=0 TSval=8089030 TSecr=15020529
  298 4.215291036  10.6.15.156 → 192.168.1.12 SSH 294 Server: Encrypted packet (len=228)
  299 4.215308611 192.168.1.12 → 10.6.15.156  TCP 66 54766 → 22 [ACK] Seq=90017 Ack=61941 Win=6155 Len=0 TSval=8089056 TSecr=15020556
  300 4.356839890  10.6.15.156 → 192.168.1.12 SSH 158 Server: Encrypted packet (len=92)
  301 4.356856041 192.168.1.12 → 10.6.15.156  TCP 66 54766 → 22 [ACK] Seq=90017 Ack=62033 Win=6155 Len=0 TSval=8089091 TSecr=15020591
  302 4.357164974 192.168.1.12 → 10.6.15.156  SSH 158 Client: Encrypted packet (len=92)
  303 4.358975926  10.6.15.156 → 192.168.1.12 TCP 66 22 → 54766 [ACK] Seq=62033 Ack=90109 Win=1452 Len=0 TSval=15020592 TSecr=8089092
  304 4.392560122  10.6.15.156 → 192.168.1.12 SSH 190 Server: Encrypted packet (len=124)
  305 4.432979505 192.168.1.12 → 10.6.15.156  TCP 66 54766 → 22 [ACK] Seq=90109 Ack=62157 Win=6155 Len=0 TSval=8089111 TSecr=15020600
  306 4.438594427  10.6.15.156 → 192.168.1.12 SSH 422 Server: Encrypted packet (len=356)
  307 4.438620699 192.168.1.12 → 10.6.15.156  TCP 66 54766 → 22 [ACK] Seq=90109 Ack=62513 Win=6155 Len=0 TSval=8089112 TSecr=15020611
  308 4.510781674  10.6.15.156 → 192.168.1.12 SSH 358 Server: Encrypted packet (len=292)
  309 4.510800070 192.168.1.12 → 10.6.15.156  TCP 66 54766 → 22 [ACK] Seq=90109 Ack=62805 Win=6155 Len=0 TSval=8089130 TSecr=15020629
  310 4.565395719  10.6.15.156 → 192.168.1.12 SSH 326 Server: Encrypted packet (len=260)
  311 4.565413240 192.168.1.12 → 10.6.15.156  TCP 66 54766 → 22 [ACK] Seq=90109 Ack=63065 Win=6155 Len=0 TSval=8089144 TSecr=15020642
  312 4.667870687  10.6.15.156 → 192.168.1.12 SSH 342 Server: Encrypted packet (len=276)
  313 4.667894103 192.168.1.12 → 10.6.15.156  TCP 66 54766 → 22 [ACK] Seq=90109 Ack=63341 Win=6155 Len=0 TSval=8089169 TSecr=15020668
  314 4.869227167  192.168.1.1 → 239.255.255.250 SSDP 302 NOTIFY * HTTP/1.1 
  315 4.872404329  192.168.1.1 → 239.255.255.250 SSDP 311 NOTIFY * HTTP/1.1 
  316 4.874453193  192.168.1.1 → 239.255.255.250 SSDP 374 NOTIFY * HTTP/1.1 
  317 4.877950419  192.168.1.1 → 239.255.255.250 SSDP 370 NOTIFY * HTTP/1.1 
  318 4.881406677  192.168.1.1 → 239.255.255.250 SSDP 350 NOTIFY * HTTP/1.1 
  319 4.884954808  192.168.1.1 → 239.255.255.250 SSDP 382 NOTIFY * HTTP/1.1 
  320 4.889147468  192.168.1.1 → 239.255.255.250 SSDP 364 NOTIFY * HTTP/1.1 
  321 4.891605065  192.168.1.1 → 239.255.255.250 SSDP 366 NOTIFY * HTTP/1.1 
  322 4.891887123  10.6.15.156 → 192.168.1.12 SSH 406 Server: Encrypted packet (len=340)
  323 4.891904756 192.168.1.12 → 10.6.15.156  TCP 66 54766 → 22 [ACK] Seq=90109 Ack=63681 Win=6155 Len=0 TSval=8089225 TSecr=15020724
  324 4.894939963  192.168.1.1 → 239.255.255.250 SSDP 302 NOTIFY * HTTP/1.1 
  325 4.898483581  192.168.1.1 → 239.255.255.250 SSDP 311 NOTIFY * HTTP/1.1 
  326 4.901730379  192.168.1.1 → 239.255.255.250 SSDP 374 NOTIFY * HTTP/1.1 
  327 4.905032246  192.168.1.1 → 239.255.255.250 SSDP 370 NOTIFY * HTTP/1.1 
  328 4.908327120  192.168.1.1 → 239.255.255.250 SSDP 350 NOTIFY * HTTP/1.1 
  329 4.912174180  192.168.1.1 → 239.255.255.250 SSDP 382 NOTIFY * HTTP/1.1 
  330 4.915535751  192.168.1.1 → 239.255.255.250 SSDP 364 NOTIFY * HTTP/1.1 
  331 4.920745532  192.168.1.1 → 239.255.255.250 SSDP 366 NOTIFY * HTTP/1.1 
  332 4.944299712  10.6.15.156 → 192.168.1.12 SSH 150 Server: Encrypted packet (len=84)
  333 4.944318228 192.168.1.12 → 10.6.15.156  TCP 66 54766 → 22 [ACK] Seq=90109 Ack=63765 Win=6155 Len=0 TSval=8089238 TSecr=15020738
  334 4.944645170 192.168.1.12 → 10.6.15.156  SSH 150 Client: Encrypted packet (len=84)
  335 4.961427290  10.6.15.156 → 192.168.1.12 SSH 438 Server: Encrypted packet (len=372)
  336 5.004968751 192.168.1.12 → 10.6.15.156  TCP 66 54766 → 22 [ACK] Seq=90193 Ack=64137 Win=6155 Len=0 TSval=8089254 TSecr=15020742
  337 5.012681069  10.6.15.156 → 192.168.1.12 SSH 302 Server: Encrypted packet (len=236)
  338 5.012704161 192.168.1.12 → 10.6.15.156  TCP 66 54766 → 22 [ACK] Seq=90193 Ack=64373 Win=6155 Len=0 TSval=8089255 TSecr=15020755
  339 5.117296418  10.6.15.156 → 192.168.1.12 SSH 406 Server: Encrypted packet (len=340)
  340 5.117314476 192.168.1.12 → 10.6.15.156  TCP 66 54766 → 22 [ACK] Seq=90193 Ack=64713 Win=6155 Len=0 TSval=8089282 TSecr=15020781
  341 5.340620880  10.6.15.156 → 192.168.1.12 SSH 390 Server: Encrypted packet (len=324)
  342 5.340646523 192.168.1.12 → 10.6.15.156  TCP 66 54766 → 22 [ACK] Seq=90193 Ack=65037 Win=6155 Len=0 TSval=8089337 TSecr=15020837
  343 5.412047814  10.6.15.156 → 192.168.1.12 SSH 438 Server: Encrypted packet (len=372)
  344 5.412065407 192.168.1.12 → 10.6.15.156  TCP 66 54766 → 22 [ACK] Seq=90193 Ack=65409 Win=6155 Len=0 TSval=8089355 TSecr=15020855
  345 5.463827816  10.6.15.156 → 192.168.1.12 SSH 550 Server: Encrypted packet (len=484)
  346 5.463844749 192.168.1.12 → 10.6.15.156  TCP 66 54766 → 22 [ACK] Seq=90193 Ack=65893 Win=6155 Len=0 TSval=8089368 TSecr=15020868
  347 5.568195717  10.6.15.156 → 192.168.1.12 SSH 342 Server: Encrypted packet (len=276)
  348 5.568212947 192.168.1.12 → 10.6.15.156  TCP 66 54766 → 22 [ACK] Seq=90193 Ack=66169 Win=6155 Len=0 TSval=8089394 TSecr=15020894
  349 5.793277952  10.6.15.156 → 192.168.1.12 SSH 238 Server: Encrypted packet (len=172)
  350 5.793295410 192.168.1.12 → 10.6.15.156  TCP 66 54766 → 22 [ACK] Seq=90193 Ack=66341 Win=6155 Len=0 TSval=8089451 TSecr=15020950
  351 5.863242643  10.6.15.156 → 192.168.1.12 SSH 438 Server: Encrypted packet (len=372)
  352 5.863259620 192.168.1.12 → 10.6.15.156  TCP 66 54766 → 22 [ACK] Seq=90193 Ack=66713 Win=6155 Len=0 TSval=8089468 TSecr=15020968
  353 5.914712215  10.6.15.156 → 192.168.1.12 SSH 470 Server: Encrypted packet (len=404)
  354 5.914729604 192.168.1.12 → 10.6.15.156  TCP 66 54766 → 22 [ACK] Seq=90193 Ack=67117 Win=6155 Len=0 TSval=8089481 TSecr=15020980
  355 6.019404272  10.6.15.156 → 192.168.1.12 SSH 502 Server: Encrypted packet (len=436)
  356 6.019419808 192.168.1.12 → 10.6.15.156  TCP 66 54766 → 22 [ACK] Seq=90193 Ack=67553 Win=6155 Len=0 TSval=8089507 TSecr=15021007
  357 6.242690707  10.6.15.156 → 192.168.1.12 SSH 502 Server: Encrypted packet (len=436)
  358 6.242709590 192.168.1.12 → 10.6.15.156  TCP 66 54766 → 22 [ACK] Seq=90193 Ack=67989 Win=6155 Len=0 TSval=8089563 TSecr=15021062
  359 6.314128758  10.6.15.156 → 192.168.1.12 SSH 406 Server: Encrypted packet (len=340)
  360 6.314146784 192.168.1.12 → 10.6.15.156  TCP 66 54766 → 22 [ACK] Seq=90193 Ack=68329 Win=6155 Len=0 TSval=8089581 TSecr=15021080
  361 6.365707607  10.6.15.156 → 192.168.1.12 SSH 374 Server: Encrypted packet (len=308)
  362 6.365725490 192.168.1.12 → 10.6.15.156  TCP 66 54766 → 22 [ACK] Seq=90193 Ack=68637 Win=6155 Len=0 TSval=8089594 TSecr=15021093
  363 6.470180727  10.6.15.156 → 192.168.1.12 SSH 342 Server: Encrypted packet (len=276)
  364 6.470198519 192.168.1.12 → 10.6.15.156  TCP 66 54766 → 22 [ACK] Seq=90193 Ack=68913 Win=6155 Len=0 TSval=8089620 TSecr=15021119
  365 6.693860271  10.6.15.156 → 192.168.1.12 SSH 582 Server: Encrypted packet (len=516)
  366 6.693877736 192.168.1.12 → 10.6.15.156  TCP 66 54766 → 22 [ACK] Seq=90193 Ack=69429 Win=6155 Len=0 TSval=8089676 TSecr=15021175
  367 6.765179858  10.6.15.156 → 192.168.1.12 SSH 486 Server: Encrypted packet (len=420)
  368 6.765197479 192.168.1.12 → 10.6.15.156  TCP 66 54766 → 22 [ACK] Seq=90193 Ack=69849 Win=6155 Len=0 TSval=8089694 TSecr=15021193
  369 6.817288157  10.6.15.156 → 192.168.1.12 SSH 486 Server: Encrypted packet (len=420)
  370 6.817306643 192.168.1.12 → 10.6.15.156  TCP 66 54766 → 22 [ACK] Seq=90193 Ack=70269 Win=6155 Len=0 TSval=8089707 TSecr=15021206
  371 6.921335776  10.6.15.156 → 192.168.1.12 SSH 486 Server: Encrypted packet (len=420)
  372 6.921352734 192.168.1.12 → 10.6.15.156  TCP 66 54766 → 22 [ACK] Seq=90193 Ack=70689 Win=6155 Len=0 TSval=8089733 TSecr=15021232
  373 7.372333596  10.6.15.156 → 192.168.1.12 SSH 374 Server: Encrypted packet (len=308)
  374 7.372350836 192.168.1.12 → 10.6.15.156  TCP 66 54766 → 22 [ACK] Seq=90193 Ack=70997 Win=6155 Len=0 TSval=8089845 TSecr=15021345
  375 7.568909752  10.6.15.156 → 192.168.1.12 SSH 150 Server: Encrypted packet (len=84)
  376 7.568927928 192.168.1.12 → 10.6.15.156  TCP 66 54766 → 22 [ACK] Seq=90193 Ack=71081 Win=6155 Len=0 TSval=8089894 TSecr=15021394
  377 7.569213094 192.168.1.12 → 10.6.15.156  SSH 150 Client: Encrypted packet (len=84)
  378 7.601906971  10.6.15.156 → 192.168.1.12 SSH 406 Server: Encrypted packet (len=340)
  379 7.645003843 192.168.1.12 → 10.6.15.156  TCP 66 54766 → 22 [ACK] Seq=90277 Ack=71421 Win=6155 Len=0 TSval=8089914 TSecr=15021401
  380 7.673139803  10.6.15.156 → 192.168.1.12 SSH 374 Server: Encrypted packet (len=308)
  381 7.673167380 192.168.1.12 → 10.6.15.156  TCP 66 54766 → 22 [ACK] Seq=90277 Ack=71729 Win=6155 Len=0 TSval=8089921 TSecr=15021419
  382 7.724875373  10.6.15.156 → 192.168.1.12 SSH 374 Server: Encrypted packet (len=308)
  383 7.724894284 192.168.1.12 → 10.6.15.156  TCP 66 54766 → 22 [ACK] Seq=90277 Ack=72037 Win=6155 Len=0 TSval=8089933 TSecr=15021431
  384 7.823095526  10.6.15.156 → 192.168.1.12 SSH 206 Server: Encrypted packet (len=140)
  385 7.823123117 192.168.1.12 → 10.6.15.156  TCP 66 54766 → 22 [ACK] Seq=90277 Ack=72177 Win=6155 Len=0 TSval=8089958 TSecr=15021458
  386 7.987522334  10.6.15.156 → 192.168.1.12 SSH 150 Server: Encrypted packet (len=84)
  387 7.987539720 192.168.1.12 → 10.6.15.156  TCP 66 54766 → 22 [ACK] Seq=90277 Ack=72261 Win=6155 Len=0 TSval=8089999 TSecr=15021499
  388 7.987833734 192.168.1.12 → 10.6.15.156  SSH 150 Client: Encrypted packet (len=84)
  389 8.027109187  10.6.15.156 → 192.168.1.12 TCP 66 22 → 54766 [ACK] Seq=72261 Ack=90361 Win=1452 Len=0 TSval=15021509 TSecr=8089999
  390 8.027130401 192.168.1.12 → 10.6.15.156  SSH 162 Client: Encrypted packet (len=96)
  391 8.028705592  10.6.15.156 → 192.168.1.12 TCP 66 22 → 54766 [ACK] Seq=72261 Ack=90457 Win=1452 Len=0 TSval=15021509 TSecr=8090009
  392 8.046971012  10.6.15.156 → 192.168.1.12 SSH 270 Server: Encrypted packet (len=204)
  393 8.089006087 192.168.1.12 → 10.6.15.156  TCP 66 54766 → 22 [ACK] Seq=90457 Ack=72465 Win=6155 Len=0 TSval=8090025 TSecr=15021513
  394 8.117950175  10.6.15.156 → 192.168.1.12 SSH 270 Server: Encrypted packet (len=204)
  395 8.117977666 192.168.1.12 → 10.6.15.156  TCP 66 54766 → 22 [ACK] Seq=90457 Ack=72669 Win=6155 Len=0 TSval=8090032 TSecr=15021531
  396 8.169674125  10.6.15.156 → 192.168.1.12 SSH 358 Server: Encrypted packet (len=292)
  397 8.169691880 192.168.1.12 → 10.6.15.156  TCP 66 54766 → 22 [ACK] Seq=90457 Ack=72961 Win=6155 Len=0 TSval=8090045 TSecr=15021544
  398 8.173731493  10.6.15.156 → 192.168.1.12 SSH 138 Server: Encrypted packet (len=72)
  399 8.173755679 192.168.1.12 → 10.6.15.156  TCP 66 54766 → 22 [ACK] Seq=90457 Ack=73033 Win=6155 Len=0 TSval=8090046 TSecr=15021545
  400 8.174020326 192.168.1.12 → 10.6.15.156  SSH 102 Client: Encrypted packet (len=36)
  401 8.215074573  10.6.15.156 → 192.168.1.12 TCP 66 22 → 54766 [ACK] Seq=73033 Ack=90493 Win=1452 Len=0 TSval=15021556 TSecr=8090046
  402 8.248041866  10.6.15.156 → 192.168.1.12 SSH 102 Server: Encrypted packet (len=36)
  403 8.248420431 192.168.1.12 → 10.6.15.156  SSH 350 Client: Encrypted packet (len=284)
  404 8.250310444  10.6.15.156 → 192.168.1.12 TCP 66 22 → 54766 [ACK] Seq=73069 Ack=90777 Win=1452 Len=0 TSval=15021564 TSecr=8090064
  405 8.274386540  10.6.15.156 → 192.168.1.12 SSH 302 Server: Encrypted packet (len=236)
  406 8.317004628 192.168.1.12 → 10.6.15.156  TCP 66 54766 → 22 [ACK] Seq=90777 Ack=73305 Win=6155 Len=0 TSval=8090082 TSecr=15021570
  407 8.472744990  10.6.15.156 → 192.168.1.12 SSH 182 Server: Encrypted packet (len=116)
  408 8.472835122 192.168.1.12 → 10.6.15.156  TCP 66 54766 → 22 [ACK] Seq=90777 Ack=73421 Win=6155 Len=0 TSval=8090120 TSecr=15021619
  409 8.568849931  10.6.15.156 → 192.168.1.12 SSH 182 Server: Encrypted packet (len=116)
  410 8.568947959 192.168.1.12 → 10.6.15.156  TCP 66 54766 → 22 [ACK] Seq=90777 Ack=73537 Win=6155 Len=0 TSval=8090144 TSecr=15021644
  411 8.620336343  10.6.15.156 → 192.168.1.12 SSH 182 Server: Encrypted packet (len=116)
  412 8.620425540 192.168.1.12 → 10.6.15.156  TCP 66 54766 → 22 [ACK] Seq=90777 Ack=73653 Win=6155 Len=0 TSval=8090157 TSecr=15021657
  413 8.725843807  10.6.15.156 → 192.168.1.12 SSH 182 Server: Encrypted packet (len=116)
  414 8.725935406 192.168.1.12 → 10.6.15.156  TCP 66 54766 → 22 [ACK] Seq=90777 Ack=73769 Win=6155 Len=0 TSval=8090184 TSecr=15021683
  415 8.948531106  10.6.15.156 → 192.168.1.12 SSH 182 Server: Encrypted packet (len=116)
  416 8.948624130 192.168.1.12 → 10.6.15.156  TCP 66 54766 → 22 [ACK] Seq=90777 Ack=73885 Win=6155 Len=0 TSval=8090239 TSecr=15021739
  417 9.020058448  10.6.15.156 → 192.168.1.12 SSH 270 Server: Encrypted packet (len=204)
  418 9.020148826 192.168.1.12 → 10.6.15.156  TCP 66 54766 → 22 [ACK] Seq=90777 Ack=74089 Win=6155 Len=0 TSval=8090257 TSecr=15021757
  419 9.850580948  10.6.15.156 → 192.168.1.12 SSH 302 Server: Encrypted packet (len=236)
  420 9.850604287 192.168.1.12 → 10.6.15.156  TCP 66 54766 → 22 [ACK] Seq=90777 Ack=74325 Win=6155 Len=0 TSval=8090465 TSecr=15021964
  421 9.924241731  10.6.15.156 → 192.168.1.12 SSH 270 Server: Encrypted packet (len=204)
  422 9.924260294 192.168.1.12 → 10.6.15.156  TCP 66 54766 → 22 [ACK] Seq=90777 Ack=74529 Win=6155 Len=0 TSval=8090483 TSecr=15021982
  423 9.973839389  10.6.15.156 → 192.168.1.12 SSH 270 Server: Encrypted packet (len=204)
  424 9.973858255 192.168.1.12 → 10.6.15.156  TCP 66 54766 → 22 [ACK] Seq=90777 Ack=74733 Win=6155 Len=0 TSval=8090496 TSecr=15021995
  425 10.063816638  10.6.15.156 → 192.168.1.12 SSH 102 Server: Encrypted packet (len=36)
  426 10.063835485 192.168.1.12 → 10.6.15.156  TCP 66 54766 → 22 [ACK] Seq=90777 Ack=74769 Win=6155 Len=0 TSval=8090518 TSecr=15022016
  427 10.084221717  10.6.15.156 → 192.168.1.12 SSH 270 Server: Encrypted packet (len=204)
  428 10.084240757 192.168.1.12 → 10.6.15.156  TCP 66 54766 → 22 [ACK] Seq=90777 Ack=74973 Win=6155 Len=0 TSval=8090523 TSecr=15022021
  429 10.098651454  10.6.15.156 → 192.168.1.12 SSH 102 Server: Encrypted packet (len=36)
  430 10.098670295 192.168.1.12 → 10.6.15.156  TCP 66 54766 → 22 [ACK] Seq=90777 Ack=75009 Win=6155 Len=0 TSval=8090527 TSecr=15022025
  431 10.301829714  10.6.15.156 → 192.168.1.12 SSH 502 Server: Encrypted packet (len=436)
  432 10.301849350 192.168.1.12 → 10.6.15.156  TCP 66 54766 → 22 [ACK] Seq=90777 Ack=75445 Win=6155 Len=0 TSval=8090578 TSecr=15022077
  433 10.373092892  10.6.15.156 → 192.168.1.12 SSH 438 Server: Encrypted packet (len=372)
  434 10.373109226 192.168.1.12 → 10.6.15.156  TCP 66 54766 → 22 [ACK] Seq=90777 Ack=75817 Win=6155 Len=0 TSval=8090596 TSecr=15022095
  435 10.424869611  10.6.15.156 → 192.168.1.12 SSH 438 Server: Encrypted packet (len=372)
  436 10.424886873 192.168.1.12 → 10.6.15.156  TCP 66 54766 → 22 [ACK] Seq=90777 Ack=76189 Win=6155 Len=0 TSval=8090608 TSecr=15022108
  437 10.529446900  10.6.15.156 → 192.168.1.12 SSH 438 Server: Encrypted packet (len=372)
  438 10.529463548 192.168.1.12 → 10.6.15.156  TCP 66 54766 → 22 [ACK] Seq=90777 Ack=76561 Win=6155 Len=0 TSval=8090635 TSecr=15022134
  439 10.752465727  10.6.15.156 → 192.168.1.12 SSH 182 Server: Encrypted packet (len=116)
  440 10.752482391 192.168.1.12 → 10.6.15.156  TCP 66 54766 → 22 [ACK] Seq=90777 Ack=76677 Win=6155 Len=0 TSval=8090690 TSecr=15022190
  441 11.203382344  10.6.15.156 → 192.168.1.12 SSH 214 Server: Encrypted packet (len=148)
  442 11.203399407 192.168.1.12 → 10.6.15.156  TCP 66 54766 → 22 [ACK] Seq=90777 Ack=76825 Win=6155 Len=0 TSval=8090803 TSecr=15022303
  443 11.385991475 192.168.1.12 → 10.6.15.156  SSH 1514 Client: Encrypted packet (len=1448)
  444 11.427220001  10.6.15.156 → 192.168.1.12 TCP 66 22 → 54766 [ACK] Seq=76825 Ack=92225 Win=1452 Len=0 TSval=15022359 TSecr=8090849
  445 11.427240347 192.168.1.12 → 10.6.15.156  SSH 834 Client: Encrypted packet (len=768)
  446 11.429900396  10.6.15.156 → 192.168.1.12 TCP 66 22 → 54766 [ACK] Seq=76825 Ack=92993 Win=1452 Len=0 TSval=15022359 TSecr=8090859
  447 11.430992854  10.6.15.156 → 192.168.1.12 SSH 182 Server: Encrypted packet (len=116)
  448 11.431010221 192.168.1.12 → 10.6.15.156  TCP 66 54766 → 22 [ACK] Seq=92993 Ack=76941 Win=6155 Len=0 TSval=8090860 TSecr=15022360
  449 11.433328300  10.6.15.156 → 192.168.1.12 SSH 142 Server: Encrypted packet (len=76)
  450 11.433344002 192.168.1.12 → 10.6.15.156  TCP 66 54766 → 22 [ACK] Seq=92993 Ack=77017 Win=6155 Len=0 TSval=8090861 TSecr=15022360
  451 11.474433664  10.6.15.156 → 192.168.1.12 SSH 766 Server: Encrypted packet (len=700)
  452 11.474451203 192.168.1.12 → 10.6.15.156  TCP 66 54766 → 22 [ACK] Seq=92993 Ack=77717 Win=6155 Len=0 TSval=8090871 TSecr=15022370
  453 11.475157822 192.168.1.12 → 10.6.15.156  SSH 142 Client: Encrypted packet (len=76)
  454 11.515046312  10.6.15.156 → 192.168.1.12 TCP 66 22 → 54766 [ACK] Seq=77717 Ack=93069 Win=1452 Len=0 TSval=15022381 TSecr=8090871
  455 11.525397433  10.6.15.156 → 192.168.1.12 SSH 894 Server: Encrypted packet (len=828)
  456 11.526147466 192.168.1.12 → 10.6.15.156  SSH 134 Client: Encrypted packet (len=68)
  457 11.527933800  10.6.15.156 → 192.168.1.12 TCP 66 22 → 54766 [ACK] Seq=78545 Ack=93137 Win=1452 Len=0 TSval=15022384 TSecr=8090884
  458 11.654434193  10.6.15.156 → 192.168.1.12 SSH 238 Server: Encrypted packet (len=172)
  459 11.697005688 192.168.1.12 → 10.6.15.156  TCP 66 54766 → 22 [ACK] Seq=93137 Ack=78717 Win=6155 Len=0 TSval=8090927 TSecr=15022415
  460 11.726148143  10.6.15.156 → 192.168.1.12 SSH 326 Server: Encrypted packet (len=260)
  461 11.726175506 192.168.1.12 → 10.6.15.156  TCP 66 54766 → 22 [ACK] Seq=93137 Ack=78977 Win=6155 Len=0 TSval=8090934 TSecr=15022433
  462 11.777607572  10.6.15.156 → 192.168.1.12 SSH 318 Server: Encrypted packet (len=252)
  463 11.777630709 192.168.1.12 → 10.6.15.156  TCP 66 54766 → 22 [ACK] Seq=93137 Ack=79229 Win=6155 Len=0 TSval=8090947 TSecr=15022446
  464 11.883503381  10.6.15.156 → 192.168.1.12 SSH 326 Server: Encrypted packet (len=260)
  465 11.883520985 192.168.1.12 → 10.6.15.156  TCP 66 54766 → 22 [ACK] Seq=93137 Ack=79489 Win=6155 Len=0 TSval=8090973 TSecr=15022472
  466 12.105686110  10.6.15.156 → 192.168.1.12 SSH 182 Server: Encrypted packet (len=116)
  467 12.105704036 192.168.1.12 → 10.6.15.156  TCP 66 54766 → 22 [ACK] Seq=93137 Ack=79605 Win=6155 Len=0 TSval=8091029 TSecr=15022528
  468 12.177255905  10.6.15.156 → 192.168.1.12 SSH 182 Server: Encrypted packet (len=116)
  469 12.177273308 192.168.1.12 → 10.6.15.156  TCP 66 54766 → 22 [ACK] Seq=93137 Ack=79721 Win=6155 Len=0 TSval=8091047 TSecr=15022546
  470 12.229212139  10.6.15.156 → 192.168.1.12 SSH 342 Server: Encrypted packet (len=276)
  471 12.229229042 192.168.1.12 → 10.6.15.156  TCP 66 54766 → 22 [ACK] Seq=93137 Ack=79997 Win=6155 Len=0 TSval=8091060 TSecr=15022559
  472 12.333171539  10.6.15.156 → 192.168.1.12 SSH 302 Server: Encrypted packet (len=236)
  473 12.333186884 192.168.1.12 → 10.6.15.156  TCP 66 54766 → 22 [ACK] Seq=93137 Ack=80233 Win=6155 Len=0 TSval=8091086 TSecr=15022585
  474 12.556939553  10.6.15.156 → 192.168.1.12 SSH 342 Server: Encrypted packet (len=276)
  475 12.556955855 192.168.1.12 → 10.6.15.156  TCP 66 54766 → 22 [ACK] Seq=93137 Ack=80509 Win=6155 Len=0 TSval=8091141 TSecr=15022641
  476 12.627914721  10.6.15.156 → 192.168.1.12 SSH 342 Server: Encrypted packet (len=276)
  477 12.627932841 192.168.1.12 → 10.6.15.156  TCP 66 54766 → 22 [ACK] Seq=93137 Ack=80785 Win=6155 Len=0 TSval=8091159 TSecr=15022659
  478 12.745053392  10.6.15.156 → 192.168.1.12 SSH 150 Server: Encrypted packet (len=84)
  479 12.745071698 192.168.1.12 → 10.6.15.156  TCP 66 54766 → 22 [ACK] Seq=93137 Ack=80869 Win=6155 Len=0 TSval=8091189 TSecr=15022688
  480 12.745334685 192.168.1.12 → 10.6.15.156  SSH 150 Client: Encrypted packet (len=84)
  481 12.747460485  10.6.15.156 → 192.168.1.12 TCP 66 22 → 54766 [ACK] Seq=80869 Ack=93221 Win=1452 Len=0 TSval=15022689 TSecr=8091189
  482 12.784309232  10.6.15.156 → 192.168.1.12 SSH 222 Server: Encrypted packet (len=156)
  483 12.787290513  10.6.15.156 → 192.168.1.12 SSH 150 Server: Encrypted packet (len=84)
  484 12.787379325 192.168.1.12 → 10.6.15.156  TCP 66 54766 → 22 [ACK] Seq=93221 Ack=81109 Win=6155 Len=0 TSval=8091199 TSecr=15022698
  485 12.787622878 192.168.1.12 → 10.6.15.156  SSH 150 Client: Encrypted packet (len=84)
  486 12.830990499  10.6.15.156 → 192.168.1.12 TCP 66 22 → 54766 [ACK] Seq=81109 Ack=93305 Win=1452 Len=0 TSval=15022710 TSecr=8091199
  487 13.130555605  10.6.15.156 → 192.168.1.12 SSH 238 Server: Encrypted packet (len=172)
  488 13.172989683 192.168.1.12 → 10.6.15.156  TCP 66 54766 → 22 [ACK] Seq=93305 Ack=81281 Win=6155 Len=0 TSval=8091296 TSecr=15022784
  489 14.084550437 192.168.1.12 → 192.168.1.1  DNS 74 Standard query 0x5241 A ntp.ubuntu.com
  490 14.086968666  192.168.1.1 → 192.168.1.12 DNS 138 Standard query response 0x5241 A ntp.ubuntu.com A 91.189.89.198 A 91.189.94.4 A 91.189.91.157 A 91.189.89.199
  491 14.087308031 192.168.1.12 → 91.189.89.198 NTP 90 NTP Version 4, client
  492 14.360848628  10.6.15.156 → 192.168.1.12 SSH 214 Server: Encrypted packet (len=148)
  493 14.360869626 192.168.1.12 → 10.6.15.156  TCP 66 54766 → 22 [ACK] Seq=93305 Ack=81429 Win=6155 Len=0 TSval=8091592 TSecr=15023092
  494 14.588088650  10.6.15.156 → 192.168.1.12 SSH 214 Server: Encrypted packet (len=148)
  495 14.588106926 192.168.1.12 → 10.6.15.156  TCP 66 54766 → 22 [ACK] Seq=93305 Ack=81577 Win=6155 Len=0 TSval=8091649 TSecr=15023149
  496 14.811450574  10.6.15.156 → 192.168.1.12 SSH 182 Server: Encrypted packet (len=116)
  497 14.811467615 192.168.1.12 → 10.6.15.156  TCP 66 54766 → 22 [ACK] Seq=93305 Ack=81693 Win=6155 Len=0 TSval=8091705 TSecr=15023205
  498 14.883633546  10.6.15.156 → 192.168.1.12 SSH 270 Server: Encrypted packet (len=204)
  499 14.883651155 192.168.1.12 → 10.6.15.156  TCP 66 54766 → 22 [ACK] Seq=93305 Ack=81897 Win=6155 Len=0 TSval=8091723 TSecr=15023223
  500 14.933227669  10.6.15.156 → 192.168.1.12 SSH 102 Server: Encrypted packet (len=36)
  501 14.933245377 192.168.1.12 → 10.6.15.156  TCP 66 54766 → 22 [ACK] Seq=93305 Ack=81933 Win=6155 Len=0 TSval=8091736 TSecr=15023235
  502 14.934426929  10.6.15.156 → 192.168.1.12 SSH 270 Server: Encrypted packet (len=204)
  503 14.934444009 192.168.1.12 → 10.6.15.156  TCP 66 54766 → 22 [ACK] Seq=93305 Ack=82137 Win=6155 Len=0 TSval=8091736 TSecr=15023235
  504 15.039414622  10.6.15.156 → 192.168.1.12 SSH 214 Server: Encrypted packet (len=148)
  505 15.039431767 192.168.1.12 → 10.6.15.156  TCP 66 54766 → 22 [ACK] Seq=93305 Ack=82285 Win=6155 Len=0 TSval=8091762 TSecr=15023262
  506 15.263004103  10.6.15.156 → 192.168.1.12 SSH 254 Server: Encrypted packet (len=188)
  507 15.263022723 192.168.1.12 → 10.6.15.156  TCP 66 54766 → 22 [ACK] Seq=93305 Ack=82473 Win=6155 Len=0 TSval=8091818 TSecr=15023317
  508 15.490469661  10.6.15.156 → 192.168.1.12 SSH 182 Server: Encrypted packet (len=116)
  509 15.490485849 192.168.1.12 → 10.6.15.156  TCP 66 54766 → 22 [ACK] Seq=93305 Ack=82589 Win=6155 Len=0 TSval=8091875 TSecr=15023374
  510 15.713399866  10.6.15.156 → 192.168.1.12 SSH 182 Server: Encrypted packet (len=116)
  511 15.713419262 192.168.1.12 → 10.6.15.156  TCP 66 54766 → 22 [ACK] Seq=93305 Ack=82705 Win=6155 Len=0 TSval=8091931 TSecr=15023430
  512 15.784878162  10.6.15.156 → 192.168.1.12 SSH 238 Server: Encrypted packet (len=172)
  513 15.784893617 192.168.1.12 → 10.6.15.156  TCP 66 54766 → 22 [ACK] Seq=93305 Ack=82877 Win=6155 Len=0 TSval=8091948 TSecr=15023448
  514 15.836508321  10.6.15.156 → 192.168.1.12 SSH 230 Server: Encrypted packet (len=164)
  515 15.836525376 192.168.1.12 → 10.6.15.156  TCP 66 54766 → 22 [ACK] Seq=93305 Ack=83041 Win=6155 Len=0 TSval=8091961 TSecr=15023461
  516 15.943366904  10.6.15.156 → 192.168.1.12 SSH 334 Server: Encrypted packet (len=268)
  517 15.943384492 192.168.1.12 → 10.6.15.156  TCP 66 54766 → 22 [ACK] Seq=93305 Ack=83309 Win=6155 Len=0 TSval=8091988 TSecr=15023487
  518 16.164553354  10.6.15.156 → 192.168.1.12 SSH 334 Server: Encrypted packet (len=268)
  519 16.164570953 192.168.1.12 → 10.6.15.156  TCP 66 54766 → 22 [ACK] Seq=93305 Ack=83577 Win=6155 Len=0 TSval=8092043 TSecr=15023543
  520 16.238160486  10.6.15.156 → 192.168.1.12 SSH 334 Server: Encrypted packet (len=268)
  521 16.238177556 192.168.1.12 → 10.6.15.156  TCP 66 54766 → 22 [ACK] Seq=93305 Ack=83845 Win=6155 Len=0 TSval=8092062 TSecr=15023561
  522 16.287591454  10.6.15.156 → 192.168.1.12 SSH 334 Server: Encrypted packet (len=268)
  523 16.287609156 192.168.1.12 → 10.6.15.156  TCP 66 54766 → 22 [ACK] Seq=93305 Ack=84113 Win=6155 Len=0 TSval=8092074 TSecr=15023574
  524 16.392023013  10.6.15.156 → 192.168.1.12 SSH 214 Server: Encrypted packet (len=148)
  525 16.392040765 192.168.1.12 → 10.6.15.156  TCP 66 54766 → 22 [ACK] Seq=93305 Ack=84261 Win=6155 Len=0 TSval=8092100 TSecr=15023600
  526 16.616059839  10.6.15.156 → 192.168.1.12 SSH 390 Server: Encrypted packet (len=324)
  527 16.616077250 192.168.1.12 → 10.6.15.156  TCP 66 54766 → 22 [ACK] Seq=93305 Ack=84585 Win=6155 Len=0 TSval=8092156 TSecr=15023656
  528 16.687795629  10.6.15.156 → 192.168.1.12 SSH 270 Server: Encrypted packet (len=204)
  529 16.687812298 192.168.1.12 → 10.6.15.156  TCP 66 54766 → 22 [ACK] Seq=93305 Ack=84789 Win=6155 Len=0 TSval=8092174 TSecr=15023674
  530 16.738704766  10.6.15.156 → 192.168.1.12 SSH 390 Server: Encrypted packet (len=324)
  531 16.738724498 192.168.1.12 → 10.6.15.156  TCP 66 54766 → 22 [ACK] Seq=93305 Ack=85113 Win=6155 Len=0 TSval=8092187 TSecr=15023686
  532 16.843248534  10.6.15.156 → 192.168.1.12 SSH 390 Server: Encrypted packet (len=324)
  533 16.843265707 192.168.1.12 → 10.6.15.156  TCP 66 54766 → 22 [ACK] Seq=93305 Ack=85437 Win=6155 Len=0 TSval=8092213 TSecr=15023713
  534 17.067145409  10.6.15.156 → 192.168.1.12 SSH 222 Server: Encrypted packet (len=156)
  535 17.067163470 192.168.1.12 → 10.6.15.156  TCP 66 54766 → 22 [ACK] Seq=93305 Ack=85593 Win=6155 Len=0 TSval=8092269 TSecr=15023768
  536 17.137968135  10.6.15.156 → 192.168.1.12 SSH 318 Server: Encrypted packet (len=252)
  537 17.137990029 192.168.1.12 → 10.6.15.156  TCP 66 54766 → 22 [ACK] Seq=93305 Ack=85845 Win=6155 Len=0 TSval=8092287 TSecr=15023786
  538 17.189399023  10.6.15.156 → 192.168.1.12 SSH 206 Server: Encrypted packet (len=140)
  539 17.189415937 192.168.1.12 → 10.6.15.156  TCP 66 54766 → 22 [ACK] Seq=93305 Ack=85985 Win=6155 Len=0 TSval=8092300 TSecr=15023799
  540 17.293955275  10.6.15.156 → 192.168.1.12 SSH 198 Server: Encrypted packet (len=132)
  541 17.293971933 192.168.1.12 → 10.6.15.156  TCP 66 54766 → 22 [ACK] Seq=93305 Ack=86117 Win=6155 Len=0 TSval=8092326 TSecr=15023825
  542 17.517565620  10.6.15.156 → 192.168.1.12 SSH 454 Server: Encrypted packet (len=388)
  543 17.517585417 192.168.1.12 → 10.6.15.156  TCP 66 54766 → 22 [ACK] Seq=93305 Ack=86505 Win=6155 Len=0 TSval=8092382 TSecr=15023881
  544 17.640533080  10.6.15.156 → 192.168.1.12 SSH 270 Server: Encrypted packet (len=204)
  545 17.640551649 192.168.1.12 → 10.6.15.156  TCP 66 54766 → 22 [ACK] Seq=93305 Ack=86709 Win=6155 Len=0 TSval=8092412 TSecr=15023912
  546 17.745095895  10.6.15.156 → 192.168.1.12 SSH 302 Server: Encrypted packet (len=236)
  547 17.745112981 192.168.1.12 → 10.6.15.156  TCP 66 54766 → 22 [ACK] Seq=93305 Ack=86945 Win=6155 Len=0 TSval=8092439 TSecr=15023938
  548 17.968553798  10.6.15.156 → 192.168.1.12 SSH 270 Server: Encrypted packet (len=204)
  549 17.968570173 192.168.1.12 → 10.6.15.156  TCP 66 54766 → 22 [ACK] Seq=93305 Ack=87149 Win=6155 Len=0 TSval=8092494 TSecr=15023994
  550 17.988561716  10.6.15.156 → 192.168.1.12 SSH 150 Server: Encrypted packet (len=84)
  551 17.988580882 192.168.1.12 → 10.6.15.156  TCP 66 54766 → 22 [ACK] Seq=93305 Ack=87233 Win=6155 Len=0 TSval=8092499 TSecr=15023999
  552 17.988879774 192.168.1.12 → 10.6.15.156  SSH 150 Client: Encrypted packet (len=84)
  553 17.990380364  10.6.15.156 → 192.168.1.12 TCP 66 22 → 54766 [ACK] Seq=87233 Ack=93389 Win=1452 Len=0 TSval=15023999 TSecr=8092499
  554 18.040166518  10.6.15.156 → 192.168.1.12 SSH 534 Server: Encrypted packet (len=468)
  555 18.080968117 192.168.1.12 → 10.6.15.156  TCP 66 54766 → 22 [ACK] Seq=93389 Ack=87701 Win=6155 Len=0 TSval=8092523 TSecr=15024012
  556 18.091873887  10.6.15.156 → 192.168.1.12 SSH 486 Server: Encrypted packet (len=420)
  557 18.091895893 192.168.1.12 → 10.6.15.156  TCP 66 54766 → 22 [ACK] Seq=93389 Ack=88121 Win=6155 Len=0 TSval=8092525 TSecr=15024025
  558 18.196445709  10.6.15.156 → 192.168.1.12 SSH 486 Server: Encrypted packet (len=420)
  559 18.196463457 192.168.1.12 → 10.6.15.156  TCP 66 54766 → 22 [ACK] Seq=93389 Ack=88541 Win=6155 Len=0 TSval=8092551 TSecr=15024051
  560 18.419599630  10.6.15.156 → 192.168.1.12 SSH 238 Server: Encrypted packet (len=172)
  561 18.419622326 192.168.1.12 → 10.6.15.156  TCP 66 54766 → 22 [ACK] Seq=93389 Ack=88713 Win=6155 Len=0 TSval=8092607 TSecr=15024107
  562 18.491056716  10.6.15.156 → 192.168.1.12 SSH 238 Server: Encrypted packet (len=172)
  563 18.491074086 192.168.1.12 → 10.6.15.156  TCP 66 54766 → 22 [ACK] Seq=93389 Ack=88885 Win=6155 Len=0 TSval=8092625 TSecr=15024125
  564 18.542520441  10.6.15.156 → 192.168.1.12 SSH 182 Server: Encrypted packet (len=116)
  565 18.542542837 192.168.1.12 → 10.6.15.156  TCP 66 54766 → 22 [ACK] Seq=93389 Ack=89001 Win=6155 Len=0 TSval=8092638 TSecr=15024137
  566 18.647257088  10.6.15.156 → 192.168.1.12 SSH 214 Server: Encrypted packet (len=148)
  567 18.647274628 192.168.1.12 → 10.6.15.156  TCP 66 54766 → 22 [ACK] Seq=93389 Ack=89149 Win=6155 Len=0 TSval=8092664 TSecr=15024164
  568 18.856084176  10.6.15.156 → 192.168.1.12 SSH 150 Server: Encrypted packet (len=84)
  569 18.856100531 192.168.1.12 → 10.6.15.156  TCP 66 54766 → 22 [ACK] Seq=93389 Ack=89233 Win=6155 Len=0 TSval=8092716 TSecr=15024216
  570 18.856387694 192.168.1.12 → 10.6.15.156  SSH 150 Client: Encrypted packet (len=84)
  571 18.857989483  10.6.15.156 → 192.168.1.12 TCP 66 22 → 54766 [ACK] Seq=89233 Ack=93473 Win=1452 Len=0 TSval=15024216 TSecr=8092716
  572 18.870689332  10.6.15.156 → 192.168.1.12 SSH 518 Server: Encrypted packet (len=452)
  573 18.912962563 192.168.1.12 → 10.6.15.156  TCP 66 54766 → 22 [ACK] Seq=93473 Ack=89685 Win=6155 Len=0 TSval=8092731 TSecr=15024219
  574 18.942198114  10.6.15.156 → 192.168.1.12 SSH 406 Server: Encrypted packet (len=340)
  575 18.942218847 192.168.1.12 → 10.6.15.156  TCP 66 54766 → 22 [ACK] Seq=93473 Ack=90025 Win=6155 Len=0 TSval=8092738 TSecr=15024237
  576 18.993728507  10.6.15.156 → 192.168.1.12 SSH 438 Server: Encrypted packet (len=372)
  577 18.993749527 192.168.1.12 → 10.6.15.156  TCP 66 54766 → 22 [ACK] Seq=93473 Ack=90397 Win=6155 Len=0 TSval=8092751 TSecr=15024250
  578 19.098315475  10.6.15.156 → 192.168.1.12 SSH 470 Server: Encrypted packet (len=404)
  579 19.098335378 192.168.1.12 → 10.6.15.156  TCP 66 54766 → 22 [ACK] Seq=93473 Ack=90801 Win=6155 Len=0 TSval=8092777 TSecr=15024276
  580 19.322068234  10.6.15.156 → 192.168.1.12 SSH 214 Server: Encrypted packet (len=148)
  581 19.322087112 192.168.1.12 → 10.6.15.156  TCP 66 54766 → 22 [ACK] Seq=93473 Ack=90949 Win=6155 Len=0 TSval=8092833 TSecr=15024332
  582 19.392880966  10.6.15.156 → 192.168.1.12 SSH 238 Server: Encrypted packet (len=172)
  583 19.392898659 192.168.1.12 → 10.6.15.156  TCP 66 54766 → 22 [ACK] Seq=93473 Ack=91121 Win=6155 Len=0 TSval=8092850 TSecr=15024350
  584 19.445781829  10.6.15.156 → 192.168.1.12 SSH 302 Server: Encrypted packet (len=236)
  585 19.445798161 192.168.1.12 → 10.6.15.156  TCP 66 54766 → 22 [ACK] Seq=93473 Ack=91357 Win=6155 Len=0 TSval=8092864 TSecr=15024363
  586 19.550605418  10.6.15.156 → 192.168.1.12 SSH 374 Server: Encrypted packet (len=308)
  587 19.550622871 192.168.1.12 → 10.6.15.156  TCP 66 54766 → 22 [ACK] Seq=93473 Ack=91665 Win=6155 Len=0 TSval=8092890 TSecr=15024389
  588 19.772612730  10.6.15.156 → 192.168.1.12 SSH 302 Server: Encrypted packet (len=236)
  589 19.772629999 192.168.1.12 → 10.6.15.156  TCP 66 54766 → 22 [ACK] Seq=93473 Ack=91901 Win=6155 Len=0 TSval=8092945 TSecr=15024445
  590 19.844209567  10.6.15.156 → 192.168.1.12 SSH 374 Server: Encrypted packet (len=308)
  591 19.844227787 192.168.1.12 → 10.6.15.156  TCP 66 54766 → 22 [ACK] Seq=93473 Ack=92209 Win=6155 Len=0 TSval=8092963 TSecr=15024463
  592 19.896517485  10.6.15.156 → 192.168.1.12 SSH 302 Server: Encrypted packet (len=236)
  593 19.896535840 192.168.1.12 → 10.6.15.156  TCP 66 54766 → 22 [ACK] Seq=93473 Ack=92445 Win=6155 Len=0 TSval=8092976 TSecr=15024476
  594 20.001698329  10.6.15.156 → 192.168.1.12 SSH 214 Server: Encrypted packet (len=148)
  595 20.001720544 192.168.1.12 → 10.6.15.156  TCP 66 54766 → 22 [ACK] Seq=93473 Ack=92593 Win=6155 Len=0 TSval=8093003 TSecr=15024502
  596 20.223888204  10.6.15.156 → 192.168.1.12 SSH 374 Server: Encrypted packet (len=308)
  597 20.223907404 192.168.1.12 → 10.6.15.156  TCP 66 54766 → 22 [ACK] Seq=93473 Ack=92901 Win=6155 Len=0 TSval=8093058 TSecr=15024558
  598 20.295989278  10.6.15.156 → 192.168.1.12 SSH 374 Server: Encrypted packet (len=308)
  599 20.296010125 192.168.1.12 → 10.6.15.156  TCP 66 54766 → 22 [ACK] Seq=93473 Ack=93209 Win=6155 Len=0 TSval=8093076 TSecr=15024576
  600 20.346688056  10.6.15.156 → 192.168.1.12 SSH 342 Server: Encrypted packet (len=276)
  601 20.346703077 192.168.1.12 → 10.6.15.156  TCP 66 54766 → 22 [ACK] Seq=93473 Ack=93485 Win=6155 Len=0 TSval=8093089 TSecr=15024588
  602 20.453525562  10.6.15.156 → 192.168.1.12 SSH 302 Server: Encrypted packet (len=236)
  603 20.453542978 192.168.1.12 → 10.6.15.156  TCP 66 54766 → 22 [ACK] Seq=93473 Ack=93721 Win=6155 Len=0 TSval=8093116 TSecr=15024615
  604 20.674812913  10.6.15.156 → 192.168.1.12 SSH 182 Server: Encrypted packet (len=116)
  605 20.674832372 192.168.1.12 → 10.6.15.156  TCP 66 54766 → 22 [ACK] Seq=93473 Ack=93837 Win=6155 Len=0 TSval=8093171 TSecr=15024670
  606 20.745605739  10.6.15.156 → 192.168.1.12 SSH 182 Server: Encrypted packet (len=116)
  607 20.745621943 192.168.1.12 → 10.6.15.156  TCP 66 54766 → 22 [ACK] Seq=93473 Ack=93953 Win=6155 Len=0 TSval=8093189 TSecr=15024688
  608 20.797367164  10.6.15.156 → 192.168.1.12 SSH 182 Server: Encrypted packet (len=116)
  609 20.797385741 192.168.1.12 → 10.6.15.156  TCP 66 54766 → 22 [ACK] Seq=93473 Ack=94069 Win=6155 Len=0 TSval=8093202 TSecr=15024701
  610 20.902965494  10.6.15.156 → 192.168.1.12 SSH 182 Server: Encrypted packet (len=116)
  611 20.902982924 192.168.1.12 → 10.6.15.156  TCP 66 54766 → 22 [ACK] Seq=93473 Ack=94185 Win=6155 Len=0 TSval=8093228 TSecr=15024728
  612 21.126554222  10.6.15.156 → 192.168.1.12 SSH 214 Server: Encrypted packet (len=148)
  613 21.126572662 192.168.1.12 → 10.6.15.156  TCP 66 54766 → 22 [ACK] Seq=93473 Ack=94333 Win=6155 Len=0 TSval=8093284 TSecr=15024783
  614 21.700013787  10.6.15.156 → 192.168.1.12 SSH 270 Server: Encrypted packet (len=204)
  615 21.700030998 192.168.1.12 → 10.6.15.156  TCP 66 54766 → 22 [ACK] Seq=93473 Ack=94537 Win=6155 Len=0 TSval=8093427 TSecr=15024927
  616 21.805030017  10.6.15.156 → 192.168.1.12 SSH 270 Server: Encrypted packet (len=204)
  617 21.805046000 192.168.1.12 → 10.6.15.156  TCP 66 54766 → 22 [ACK] Seq=93473 Ack=94741 Win=6155 Len=0 TSval=8093454 TSecr=15024953
  618 22.029696795  10.6.15.156 → 192.168.1.12 SSH 206 Server: Encrypted packet (len=140)
  619 22.100205046  10.6.15.156 → 192.168.1.12 SSH 270 Server: Encrypted packet (len=204)
  620 22.110943503  10.6.15.156 → 192.168.1.12 TCP 270 [TCP Retransmission] 22 → 54766 [PSH, ACK] Seq=94881 Ack=93473 Win=1452 Len=204 TSval=15025030 TSecr=8093454
  621 22.429082032 192.168.1.12 → 10.6.15.156  TCP 66 54766 → 22 [ACK] Seq=93473 Ack=94881 Win=6155 Len=0 TSval=8093510 TSecr=15025009
  622 22.429092113 192.168.1.12 → 10.6.15.156  TCP 66 54766 → 22 [ACK] Seq=93473 Ack=95085 Win=6155 Len=0 TSval=8093527 TSecr=15025027
  623 22.429093763 192.168.1.12 → 10.6.15.156  TCP 78 [TCP Dup ACK 622#1] 54766 → 22 [ACK] Seq=93473 Ack=95085 Win=6155 Len=0 TSval=8093530 TSecr=15025030 SLE=94881 SRE=95085
  624 22.432410142  10.6.15.156 → 192.168.1.12 SSH 222 Server: Encrypted packet (len=156)
  625 22.432425794 192.168.1.12 → 10.6.15.156  TCP 66 54766 → 22 [ACK] Seq=93473 Ack=95241 Win=6155 Len=0 TSval=8093610 TSecr=15025066
  626 22.478524735  10.6.15.156 → 192.168.1.12 SSH 214 Server: Encrypted packet (len=148)
  627 22.478539868 192.168.1.12 → 10.6.15.156  TCP 66 54766 → 22 [ACK] Seq=93473 Ack=95389 Win=6155 Len=0 TSval=8093622 TSecr=15025121
  628 22.549954869  10.6.15.156 → 192.168.1.12 SSH 254 Server: Encrypted packet (len=188)
  629 22.549971406 192.168.1.12 → 10.6.15.156  TCP 66 54766 → 22 [ACK] Seq=93473 Ack=95577 Win=6155 Len=0 TSval=8093640 TSecr=15025139
  630 22.603964085  10.6.15.156 → 192.168.1.12 SSH 254 Server: Encrypted packet (len=188)
  631 22.603982815 192.168.1.12 → 10.6.15.156  TCP 66 54766 → 22 [ACK] Seq=93473 Ack=95765 Win=6155 Len=0 TSval=8093653 TSecr=15025152
  632 22.707421178  10.6.15.156 → 192.168.1.12 SSH 270 Server: Encrypted packet (len=204)
  633 23.141035432 192.168.1.12 → 10.6.15.156  TCP 66 54766 → 22 [ACK] Seq=93473 Ack=95969 Win=6155 Len=0 TSval=8093679 TSecr=15025179
  634 23.141921571  10.6.15.156 → 192.168.1.12 SSH 270 Server: Encrypted packet (len=204)
  635 23.141939712 192.168.1.12 → 10.6.15.156  TCP 66 54766 → 22 [ACK] Seq=93473 Ack=96173 Win=6155 Len=0 TSval=8093788 TSecr=15025234
  636 23.141960504  10.6.15.156 → 192.168.1.12 SSH 238 Server: Encrypted packet (len=172)
  637 23.141966783 192.168.1.12 → 10.6.15.156  TCP 66 54766 → 22 [ACK] Seq=93473 Ack=96345 Win=6155 Len=0 TSval=8093788 TSecr=15025252
  638 23.141973526  10.6.15.156 → 192.168.1.12 SSH 302 Server: Encrypted packet (len=236)
  639 23.141976423 192.168.1.12 → 10.6.15.156  TCP 66 54766 → 22 [ACK] Seq=93473 Ack=96581 Win=6155 Len=0 TSval=8093788 TSecr=15025265
  640 23.158107180  10.6.15.156 → 192.168.1.12 SSH 214 Server: Encrypted packet (len=148)
  641 23.158124600 192.168.1.12 → 10.6.15.156  TCP 66 54766 → 22 [ACK] Seq=93473 Ack=96729 Win=6155 Len=0 TSval=8093792 TSecr=15025291
  642 23.380438593  10.6.15.156 → 192.168.1.12 SSH 182 Server: Encrypted packet (len=116)
  643 23.853087446 192.168.1.12 → 10.6.15.156  TCP 66 54766 → 22 [ACK] Seq=93473 Ack=96845 Win=6155 Len=0 TSval=8093847 TSecr=15025347
  644 23.853942109  10.6.15.156 → 192.168.1.12 SSH 182 Server: [TCP Spurious Retransmission] , Encrypted packet (len=116)
  645 23.853962502 192.168.1.12 → 10.6.15.156  TCP 78 [TCP Dup ACK 643#1] 54766 → 22 [ACK] Seq=93473 Ack=96845 Win=6155 Len=0 TSval=8093966 TSecr=15025439 SLE=96729 SRE=96845
  646 23.853975284  10.6.15.156 → 192.168.1.12 SSH 230 Server: Encrypted packet (len=164)
  647 23.853979412 192.168.1.12 → 10.6.15.156  TCP 66 54766 → 22 [ACK] Seq=93473 Ack=97009 Win=6155 Len=0 TSval=8093966 TSecr=15025460
  648 23.902984706  10.6.15.156 → 192.168.1.12 SSH 302 Server: Encrypted packet (len=236)
  649 23.903003753 192.168.1.12 → 10.6.15.156  TCP 66 54766 → 22 [ACK] Seq=93473 Ack=97245 Win=6155 Len=0 TSval=8093978 TSecr=15025478
  650 23.954721402  10.6.15.156 → 192.168.1.12 SSH 270 Server: Encrypted packet (len=204)
  651 23.954738680 192.168.1.12 → 10.6.15.156  TCP 66 54766 → 22 [ACK] Seq=93473 Ack=97449 Win=6155 Len=0 TSval=8093991 TSecr=15025490
  652 24.060094405  10.6.15.156 → 192.168.1.12 SSH 238 Server: Encrypted packet (len=172)
  653 24.565054458 192.168.1.12 → 10.6.15.156  TCP 66 54766 → 22 [ACK] Seq=93473 Ack=97621 Win=6155 Len=0 TSval=8094017 TSecr=15025517
  654 24.567309289  10.6.15.156 → 192.168.1.12 SSH 182 Server: Encrypted packet (len=116)
  655 24.567326714 192.168.1.12 → 10.6.15.156  TCP 66 54766 → 22 [ACK] Seq=93473 Ack=97737 Win=6155 Len=0 TSval=8094144 TSecr=15025590
  656 24.567347467  10.6.15.156 → 192.168.1.12 SSH 182 Server: Encrypted packet (len=116)
  657 24.567354339 192.168.1.12 → 10.6.15.156  TCP 66 54766 → 22 [ACK] Seq=93473 Ack=97853 Win=6155 Len=0 TSval=8094144 TSecr=15025630
  658 24.734463967  10.6.15.156 → 192.168.1.12 SSH 238 Server: Encrypted packet (len=172)
  659 24.734481668 192.168.1.12 → 10.6.15.156  TCP 66 54766 → 22 [ACK] Seq=93473 Ack=98025 Win=6155 Len=0 TSval=8094186 TSecr=15025685
  660 25.277890340  10.6.15.156 → 192.168.1.12 SSH 270 Server: Encrypted packet (len=204)
  661 25.277907999 192.168.1.12 → 10.6.15.156  TCP 66 54766 → 22 [ACK] Seq=93473 Ack=98229 Win=6155 Len=0 TSval=8094322 TSecr=15025798
  662 25.277929139  10.6.15.156 → 192.168.1.12 SSH 270 Server: Encrypted packet (len=204)
  663 25.277935833 192.168.1.12 → 10.6.15.156  TCP 66 54766 → 22 [ACK] Seq=93473 Ack=98433 Win=6155 Len=0 TSval=8094322 TSecr=15025816
  664 25.277942637  10.6.15.156 → 192.168.1.12 SSH 190 Server: Encrypted packet (len=124)
  665 25.277945726 192.168.1.12 → 10.6.15.156  TCP 66 54766 → 22 [ACK] Seq=93473 Ack=98557 Win=6155 Len=0 TSval=8094322 TSecr=15025821
  666 25.281727190  10.6.15.156 → 192.168.1.12 SSH 190 Server: Encrypted packet (len=124)
  667 25.281747910 192.168.1.12 → 10.6.15.156  TCP 66 54766 → 22 [ACK] Seq=93473 Ack=98681 Win=6155 Len=0 TSval=8094323 TSecr=15025822
  668 25.307594367  10.6.15.156 → 192.168.1.12 SSH 270 Server: Encrypted packet (len=204)
  669 25.307611106 192.168.1.12 → 10.6.15.156  TCP 66 54766 → 22 [ACK] Seq=93473 Ack=98885 Win=6155 Len=0 TSval=8094329 TSecr=15025829
  670 25.413197340  10.6.15.156 → 192.168.1.12 SSH 334 Server: Encrypted packet (len=268)
  671 25.413215870 192.168.1.12 → 10.6.15.156  TCP 66 54766 → 22 [ACK] Seq=93473 Ack=99153 Win=6155 Len=0 TSval=8094356 TSecr=15025855
  672 25.635537590  10.6.15.156 → 192.168.1.12 SSH 230 Server: Encrypted packet (len=164)
  673 25.707852695  10.6.15.156 → 192.168.1.12 SSH 302 Server: Encrypted packet (len=236)
  674 25.758466416  10.6.15.156 → 192.168.1.12 SSH 302 Server: Encrypted packet (len=236)
  675 25.865888214  10.6.15.156 → 192.168.1.12 SSH 302 Server: Encrypted packet (len=236)
  676 26.001062479 192.168.1.12 → 10.6.15.156  TCP 66 54766 → 22 [ACK] Seq=93473 Ack=99317 Win=6155 Len=0 TSval=8094411 TSecr=15025911
  677 26.001076683 192.168.1.12 → 10.6.15.156  TCP 66 54766 → 22 [ACK] Seq=93473 Ack=99553 Win=6155 Len=0 TSval=8094429 TSecr=15025929
  678 26.001078994 192.168.1.12 → 10.6.15.156  TCP 66 54766 → 22 [ACK] Seq=93473 Ack=99789 Win=6155 Len=0 TSval=8094442 TSecr=15025941
  679 26.001080743 192.168.1.12 → 10.6.15.156  TCP 66 54766 → 22 [ACK] Seq=93473 Ack=100025 Win=6155 Len=0 TSval=8094469 TSecr=15025968
  680 26.001853795  10.6.15.156 → 192.168.1.12 SSH 302 Server: [TCP Spurious Retransmission] , Encrypted packet (len=236)
  681 26.001876086 192.168.1.12 → 10.6.15.156  TCP 78 [TCP Dup ACK 679#1] 54766 → 22 [ACK] Seq=93473 Ack=100025 Win=6155 Len=0 TSval=8094503 TSecr=15026002 SLE=99789 SRE=100025
  682 26.086534772  10.6.15.156 → 192.168.1.12 SSH 254 Server: Encrypted packet (len=188)
  683 26.086552740 192.168.1.12 → 10.6.15.156  TCP 66 54766 → 22 [ACK] Seq=93473 Ack=100213 Win=6155 Len=0 TSval=8094524 TSecr=15026023
  684 26.158260979  10.6.15.156 → 192.168.1.12 SSH 222 Server: Encrypted packet (len=156)
  685 26.158278370 192.168.1.12 → 10.6.15.156  TCP 66 54766 → 22 [ACK] Seq=93473 Ack=100369 Win=6155 Len=0 TSval=8094542 TSecr=15026041
  686 26.209664420  10.6.15.156 → 192.168.1.12 SSH 254 Server: Encrypted packet (len=188)
  687 26.315002032  10.6.15.156 → 192.168.1.12 SSH 182 Server: Encrypted packet (len=116)
  688 26.721057938 192.168.1.12 → 10.6.15.156  TCP 66 54766 → 22 [ACK] Seq=93473 Ack=100557 Win=6155 Len=0 TSval=8094555 TSecr=15026054
  689 26.721068422 192.168.1.12 → 10.6.15.156  TCP 66 54766 → 22 [ACK] Seq=93473 Ack=100673 Win=6155 Len=0 TSval=8094581 TSecr=15026081
  690 26.721814526  10.6.15.156 → 192.168.1.12 SSH 182 Server: Encrypted packet (len=116)
  691 26.721832989 192.168.1.12 → 10.6.15.156  TCP 66 54766 → 22 [ACK] Seq=93473 Ack=100789 Win=6155 Len=0 TSval=8094683 TSecr=15026136
  692 26.721855406  10.6.15.156 → 192.168.1.12 SSH 182 Server: Encrypted packet (len=116)
  693 26.721862624 192.168.1.12 → 10.6.15.156  TCP 66 54766 → 22 [ACK] Seq=93473 Ack=100905 Win=6155 Len=0 TSval=8094683 TSecr=15026154
  694 26.721869235  10.6.15.156 → 192.168.1.12 SSH 222 Server: Encrypted packet (len=156)
  695 26.721872223 192.168.1.12 → 10.6.15.156  TCP 66 54766 → 22 [ACK] Seq=93473 Ack=101061 Win=6155 Len=0 TSval=8094683 TSecr=15026167
  696 26.766118359  10.6.15.156 → 192.168.1.12 SSH 294 Server: Encrypted packet (len=228)
  697 26.766136195 192.168.1.12 → 10.6.15.156  TCP 66 54766 → 22 [ACK] Seq=93473 Ack=101289 Win=6155 Len=0 TSval=8094694 TSecr=15026193
  698 26.988949348  10.6.15.156 → 192.168.1.12 SSH 334 Server: Encrypted packet (len=268)
  699 27.061758854  10.6.15.156 → 192.168.1.12 SSH 318 Server: Encrypted packet (len=252)
  700 27.111920403  10.6.15.156 → 192.168.1.12 SSH 254 Server: Encrypted packet (len=188)
  701 27.433048304 192.168.1.12 → 139.59.16.133 NTP 90 NTP Version 4, client
  702 27.433058050 192.168.1.12 → 10.6.15.156  TCP 66 54766 → 22 [ACK] Seq=93473 Ack=101557 Win=6155 Len=0 TSval=8094750 TSecr=15026249
  703 27.433062013 192.168.1.12 → 10.6.15.156  TCP 66 54766 → 22 [ACK] Seq=93473 Ack=101809 Win=6155 Len=0 TSval=8094768 TSecr=15026267
  704 27.433063809 192.168.1.12 → 10.6.15.156  TCP 66 54766 → 22 [ACK] Seq=93473 Ack=101997 Win=6155 Len=0 TSval=8094780 TSecr=15026280
  705 27.434260719  10.6.15.156 → 192.168.1.12 SSH 286 Server: Encrypted packet (len=220)
  706 27.434277589 192.168.1.12 → 10.6.15.156  TCP 66 54766 → 22 [ACK] Seq=93473 Ack=102217 Win=6155 Len=0 TSval=8094861 TSecr=15026306
  707 27.439399141  10.6.15.156 → 192.168.1.12 SSH 286 Server: Encrypted packet (len=220)
  708 27.439416458 192.168.1.12 → 10.6.15.156  TCP 66 54766 → 22 [ACK] Seq=93473 Ack=102437 Win=6155 Len=0 TSval=8094862 TSecr=15026362
  709 27.511366636  10.6.15.156 → 192.168.1.12 SSH 238 Server: Encrypted packet (len=172)
  710 27.511385842 192.168.1.12 → 10.6.15.156  TCP 66 54766 → 22 [ACK] Seq=93473 Ack=102609 Win=6155 Len=0 TSval=8094880 TSecr=15026380
  711 27.562355708  10.6.15.156 → 192.168.1.12 SSH 238 Server: Encrypted packet (len=172)
  712 27.562372775 192.168.1.12 → 10.6.15.156  TCP 66 54766 → 22 [ACK] Seq=93473 Ack=102781 Win=6155 Len=0 TSval=8094893 TSecr=15026392
  713 27.667952381  10.6.15.156 → 192.168.1.12 SSH 182 Server: Encrypted packet (len=116)
  714 28.153084103 192.168.1.12 → 123.108.200.124 NTP 90 NTP Version 4, client
  715 28.153093745 192.168.1.12 → 10.6.15.156  TCP 66 54766 → 22 [ACK] Seq=93473 Ack=102897 Win=6155 Len=0 TSval=8094919 TSecr=15026419
  716 28.153784709  10.6.15.156 → 192.168.1.12 SSH 182 Server: Encrypted packet (len=116)
  717 28.153799498 192.168.1.12 → 10.6.15.156  TCP 66 54766 → 22 [ACK] Seq=93473 Ack=103013 Win=6155 Len=0 TSval=8095041 TSecr=15026474
  718 28.153813271  10.6.15.156 → 192.168.1.12 SSH 302 Server: Encrypted packet (len=236)
  719 28.153817795 192.168.1.12 → 10.6.15.156  TCP 66 54766 → 22 [ACK] Seq=93473 Ack=103249 Win=6155 Len=0 TSval=8095041 TSecr=15026492
  720 28.153990334  10.6.15.156 → 192.168.1.12 SSH 406 Server: Encrypted packet (len=340)
  721 28.153996915 192.168.1.12 → 10.6.15.156  TCP 66 54766 → 22 [ACK] Seq=93473 Ack=103589 Win=6155 Len=0 TSval=8095041 TSecr=15026505
  722 28.154031344  10.6.15.156 → 192.168.1.12 SSH 374 Server: Encrypted packet (len=308)
  723 28.154035393 192.168.1.12 → 10.6.15.156  TCP 66 54766 → 22 [ACK] Seq=93473 Ack=103897 Win=6155 Len=0 TSval=8095041 TSecr=15026532
  724 28.157004101 10.119.73.122 → 192.168.1.12 ICMP 110 Destination unreachable (Communication administratively filtered)
  725 28.341576619  10.6.15.156 → 192.168.1.12 SSH 302 Server: Encrypted packet (len=236)
  726 28.341596510 192.168.1.12 → 10.6.15.156  TCP 66 54766 → 22 [ACK] Seq=93473 Ack=104133 Win=6155 Len=0 TSval=8095088 TSecr=15026587
  727 28.412896838  10.6.15.156 → 192.168.1.12 SSH 230 Server: Encrypted packet (len=164)
  728 28.464393690  10.6.15.156 → 192.168.1.12 SSH 182 Server: Encrypted packet (len=116)
  729 28.865082774 192.168.1.12 → 10.6.15.156  TCP 66 54766 → 22 [ACK] Seq=93473 Ack=104297 Win=6155 Len=0 TSval=8095105 TSecr=15026605
  730 28.865093066 192.168.1.12 → 10.6.15.156  TCP 66 54766 → 22 [ACK] Seq=93473 Ack=104413 Win=6155 Len=0 TSval=8095118 TSecr=15026618
  731 28.866292000  10.6.15.156 → 192.168.1.12 SSH 182 Server: Encrypted packet (len=116)
  732 28.866310169 192.168.1.12 → 10.6.15.156  TCP 66 54766 → 22 [ACK] Seq=93473 Ack=104529 Win=6155 Len=0 TSval=8095219 TSecr=15026644
  733 28.866330695  10.6.15.156 → 192.168.1.12 SSH 182 Server: Encrypted packet (len=116)
  734 28.866337491 192.168.1.12 → 10.6.15.156  TCP 66 54766 → 22 [ACK] Seq=93473 Ack=104645 Win=6155 Len=0 TSval=8095219 TSecr=15026700
  735 28.866344309  10.6.15.156 → 192.168.1.12 SSH 182 Server: Encrypted packet (len=116)
  736 28.866347431 192.168.1.12 → 10.6.15.156  TCP 66 54766 → 22 [ACK] Seq=93473 Ack=104761 Win=6155 Len=0 TSval=8095219 TSecr=15026718
  737 28.915550508  10.6.15.156 → 192.168.1.12 SSH 214 Server: Encrypted packet (len=148)
  738 28.915568138 192.168.1.12 → 10.6.15.156  TCP 66 54766 → 22 [ACK] Seq=93473 Ack=104909 Win=6155 Len=0 TSval=8095231 TSecr=15026731
  739 29.021023499  10.6.15.156 → 192.168.1.12 SSH 214 Server: Encrypted packet (len=148)
  740 29.021042067 192.168.1.12 → 10.6.15.156  TCP 66 54766 → 22 [ACK] Seq=93473 Ack=105057 Win=6155 Len=0 TSval=8095258 TSecr=15026757
  741 29.244036066  10.6.15.156 → 192.168.1.12 SSH 182 Server: Encrypted packet (len=116)
  742 29.581084370 192.168.1.12 → 10.6.15.156  TCP 66 54766 → 22 [ACK] Seq=93473 Ack=105173 Win=6155 Len=0 TSval=8095313 TSecr=15026813
  743 29.581893651  10.6.15.156 → 192.168.1.12 SSH 270 Server: Encrypted packet (len=204)
  744 29.581911238 192.168.1.12 → 10.6.15.156  TCP 66 54766 → 22 [ACK] Seq=93473 Ack=105377 Win=6155 Len=0 TSval=8095398 TSecr=15026831
  745 29.581933020  10.6.15.156 → 192.168.1.12 SSH 182 Server: Encrypted packet (len=116)
  746 29.581939190 192.168.1.12 → 10.6.15.156  TCP 66 54766 → 22 [ACK] Seq=93473 Ack=105493 Win=6155 Len=0 TSval=8095398 TSecr=15026843
  747 29.581945766  10.6.15.156 → 192.168.1.12 SSH 134 Server: Encrypted packet (len=68)
  748 29.581948528 192.168.1.12 → 10.6.15.156  TCP 66 54766 → 22 [ACK] Seq=93473 Ack=105561 Win=6155 Len=0 TSval=8095398 TSecr=15026867
  749 29.582031697  10.6.15.156 → 192.168.1.12 SSH 102 Server: Encrypted packet (len=36)
  750 29.582034176 192.168.1.12 → 10.6.15.156  TCP 66 54766 → 22 [ACK] Seq=93473 Ack=105597 Win=6155 Len=0 TSval=8095398 TSecr=15026867
  751 29.582058936  10.6.15.156 → 192.168.1.12 SSH 126 Server: Encrypted packet (len=60)
  752 29.582060698 192.168.1.12 → 10.6.15.156  TCP 66 54766 → 22 [ACK] Seq=93473 Ack=105657 Win=6155 Len=0 TSval=8095398 TSecr=15026869
  753 29.582064939  10.6.15.156 → 192.168.1.12 SSH 102 Server: Encrypted packet (len=36)
  754 29.582066286 192.168.1.12 → 10.6.15.156  TCP 66 54766 → 22 [ACK] Seq=93473 Ack=105693 Win=6155 Len=0 TSval=8095398 TSecr=15026869
  755 29.583731433  10.6.15.156 → 192.168.1.12 SSH 374 Server: Encrypted packet (len=308)
  756 29.583749113 192.168.1.12 → 10.6.15.156  TCP 66 54766 → 22 [ACK] Seq=93473 Ack=106001 Win=6155 Len=0 TSval=8095398 TSecr=15026898
  757 29.694846163  10.6.15.156 → 192.168.1.12 SSH 454 Server: Encrypted packet (len=388)
  758 29.694864272 192.168.1.12 → 10.6.15.156  TCP 66 54766 → 22 [ACK] Seq=93473 Ack=106389 Win=6155 Len=0 TSval=8095426 TSecr=15026926
  759 29.766101106  10.6.15.156 → 192.168.1.12 SSH 358 Server: Encrypted packet (len=292)
  760 29.766124507 192.168.1.12 → 10.6.15.156  TCP 66 54766 → 22 [ACK] Seq=93473 Ack=106681 Win=6155 Len=0 TSval=8095444 TSecr=15026943
  761 29.817650065  10.6.15.156 → 192.168.1.12 SSH 358 Server: Encrypted packet (len=292)
  762 29.923095456  10.6.15.156 → 192.168.1.12 SSH 358 Server: Encrypted packet (len=292)
  763 30.301020938 192.168.1.12 → 10.6.15.156  TCP 66 54766 → 22 [ACK] Seq=93473 Ack=106973 Win=6155 Len=0 TSval=8095457 TSecr=15026956
  764 30.301032827 192.168.1.12 → 10.6.15.156  TCP 66 54766 → 22 [ACK] Seq=93473 Ack=107265 Win=6155 Len=0 TSval=8095483 TSecr=15026983
  765 30.301035024 192.168.1.12 → 10.6.15.156  SSH 138 Client: Encrypted packet (len=72)
  766 30.301039294 192.168.1.12 → 10.6.15.156  SSH 1514 Client: Encrypted packet (len=1448)
  767 30.301970908 192.168.1.12 → 10.6.15.156  SSH 374 Client: Encrypted packet (len=308)
  768 30.302102772  10.6.15.156 → 192.168.1.12 SSH 358 Server: [TCP Spurious Retransmission] , Encrypted packet (len=292)
  769 30.302116362 192.168.1.12 → 10.6.15.156  TCP 78 [TCP Dup ACK 764#1] 54766 → 22 [ACK] Seq=95301 Ack=107265 Win=6155 Len=0 TSval=8095578 TSecr=15027037 SLE=106973 SRE=107265
  770 30.302123379  10.6.15.156 → 192.168.1.12 SSH 182 Server: Encrypted packet (len=116)
  771 30.302132095 192.168.1.12 → 10.6.15.156  TCP 66 54766 → 22 [ACK] Seq=95301 Ack=107381 Win=6155 Len=0 TSval=8095578 TSecr=15027056
  772 30.303377689  10.6.15.156 → 192.168.1.12 SSH 102 Server: Encrypted packet (len=36)
  773 30.303396248 192.168.1.12 → 10.6.15.156  TCP 66 54766 → 22 [ACK] Seq=95301 Ack=107417 Win=6155 Len=0 TSval=8095578 TSecr=15027078
  774 30.303816381  10.6.15.156 → 192.168.1.12 TCP 66 22 → 54766 [ACK] Seq=107417 Ack=95301 Win=1452 Len=0 TSval=15027078 TSecr=8095504
  775 30.304931175  10.6.15.156 → 192.168.1.12 SSH 246 Server: Encrypted packet (len=180)
  776 30.304949427 192.168.1.12 → 10.6.15.156  TCP 66 54766 → 22 [ACK] Seq=95301 Ack=107597 Win=6155 Len=0 TSval=8095579 TSecr=15027078
  777 30.333028331  10.6.15.156 → 192.168.1.12 SSH 174 Server: Encrypted packet (len=108)
  778 30.333047282 192.168.1.12 → 10.6.15.156  TCP 66 54766 → 22 [ACK] Seq=95301 Ack=107705 Win=6155 Len=0 TSval=8095586 TSecr=15027085
  779 30.333065665  10.6.15.156 → 192.168.1.12 SSH 138 Server: Encrypted packet (len=72)
  780 30.333068911 192.168.1.12 → 10.6.15.156  TCP 66 54766 → 22 [ACK] Seq=95301 Ack=107777 Win=6155 Len=0 TSval=8095586 TSecr=15027085
  781 30.333328860 192.168.1.12 → 10.6.15.156  SSH 102 Client: Encrypted packet (len=36)
  782 30.373891502  10.6.15.156 → 192.168.1.12 SSH 238 Server: Encrypted packet (len=172)
  783 30.436951380 192.168.1.12 → 10.6.15.156  TCP 66 54766 → 22 [ACK] Seq=95337 Ack=107949 Win=6155 Len=0 TSval=8095612 TSecr=15027095
  784 30.456385733  10.6.15.156 → 192.168.1.12 SSH 138 Server: Encrypted packet (len=72)
  785 30.456406148 192.168.1.12 → 10.6.15.156  TCP 66 54766 → 22 [ACK] Seq=95337 Ack=108021 Win=6155 Len=0 TSval=8095616 TSecr=15027116
  786 30.456602059 192.168.1.12 → 10.6.15.156  SSH 102 Client: Encrypted packet (len=36)
  787 30.466660581  10.6.15.156 → 192.168.1.12 SSH 662 Server: Encrypted packet (len=596)
  788 30.596546435  10.6.15.156 → 192.168.1.12 SSH 182 Server: Encrypted packet (len=116)
  789 30.668115572  10.6.15.156 → 192.168.1.12 SSH 302 Server: Encrypted packet (len=236)
  790 31.065081818 192.168.1.12 → 10.6.15.156  TCP 66 54766 → 22 [ACK] Seq=95373 Ack=108617 Win=6155 Len=0 TSval=8095631 TSecr=15027118
  791 31.065092324 192.168.1.12 → 10.6.15.156  TCP 66 54766 → 22 [ACK] Seq=95373 Ack=108733 Win=6155 Len=0 TSval=8095651 TSecr=15027151
  792 31.065093917 192.168.1.12 → 10.6.15.156  TCP 66 54766 → 22 [ACK] Seq=95373 Ack=108969 Win=6155 Len=0 TSval=8095669 TSecr=15027169
  793 31.065804051  10.6.15.156 → 192.168.1.12 SSH 302 Server: Encrypted packet (len=236)
  794 31.065827651 192.168.1.12 → 10.6.15.156  TCP 66 54766 → 22 [ACK] Seq=95373 Ack=109205 Win=6155 Len=0 TSval=8095769 TSecr=15027182
  795 31.065844537  10.6.15.156 → 192.168.1.12 SSH 270 Server: Encrypted packet (len=204)
  796 31.065851417 192.168.1.12 → 10.6.15.156  TCP 66 54766 → 22 [ACK] Seq=95373 Ack=109409 Win=6155 Len=0 TSval=8095769 TSecr=15027208
  797 31.065857817  10.6.15.156 → 192.168.1.12 SSH 270 Server: [TCP Spurious Retransmission] , Encrypted packet (len=204)
  798 31.065862027 192.168.1.12 → 10.6.15.156  TCP 78 [TCP Dup ACK 796#1] 54766 → 22 [ACK] Seq=95373 Ack=109409 Win=6155 Len=0 TSval=8095769 TSecr=15027250 SLE=109205 SRE=109409
  799 31.067310589  10.6.15.156 → 192.168.1.12 SSH 182 Server: Encrypted packet (len=116)
  800 31.067328103 192.168.1.12 → 10.6.15.156  TCP 66 54766 → 22 [ACK] Seq=95373 Ack=109525 Win=6155 Len=0 TSval=8095769 TSecr=15027269
  801 31.118756225  10.6.15.156 → 192.168.1.12 SSH 254 Server: Encrypted packet (len=188)
  802 31.118775633 192.168.1.12 → 10.6.15.156  TCP 66 54766 → 22 [ACK] Seq=95373 Ack=109713 Win=6155 Len=0 TSval=8095782 TSecr=15027282
  803 31.170503879  10.6.15.156 → 192.168.1.12 SSH 286 Server: Encrypted packet (len=220)
  804 31.170522571 192.168.1.12 → 10.6.15.156  TCP 66 54766 → 22 [ACK] Seq=95373 Ack=109933 Win=6155 Len=0 TSval=8095795 TSecr=15027294
  805 31.275969117  10.6.15.156 → 192.168.1.12 SSH 238 Server: Encrypted packet (len=172)
  806 31.833094809 192.168.1.12 → 10.6.15.156  TCP 66 54766 → 22 [ACK] Seq=95373 Ack=110105 Win=6155 Len=0 TSval=8095821 TSecr=15027321
  807 31.833104856 192.168.1.12 → 10.6.15.156  SSH 1406 Client: Encrypted packet (len=1340)
  808 31.834027343  10.6.15.156 → 192.168.1.12 SSH 374 Server: Encrypted packet (len=308)
  809 31.834045358 192.168.1.12 → 10.6.15.156  TCP 66 54766 → 22 [ACK] Seq=96713 Ack=110413 Win=6155 Len=0 TSval=8095961 TSecr=15027376
  810 31.834070825  10.6.15.156 → 192.168.1.12 SSH 286 Server: Encrypted packet (len=220)
  811 31.834079610 192.168.1.12 → 10.6.15.156  TCP 66 54766 → 22 [ACK] Seq=96713 Ack=110633 Win=6155 Len=0 TSval=8095961 TSecr=15027394
  812 31.834084864  10.6.15.156 → 192.168.1.12 SSH 182 Server: Encrypted packet (len=116)
  813 31.834086713 192.168.1.12 → 10.6.15.156  TCP 66 54766 → 22 [ACK] Seq=96713 Ack=110749 Win=6155 Len=0 TSval=8095961 TSecr=15027407
  814 31.834090890  10.6.15.156 → 192.168.1.12 SSH 230 Server: Encrypted packet (len=164)
  815 31.834092337 192.168.1.12 → 10.6.15.156  TCP 66 54766 → 22 [ACK] Seq=96713 Ack=110913 Win=6155 Len=0 TSval=8095961 TSecr=15027434
  816 31.875403803  10.6.15.156 → 192.168.1.12 TCP 66 22 → 54766 [ACK] Seq=110913 Ack=96713 Win=1452 Len=0 TSval=15027471 TSecr=8095940
  817 31.949485644  10.6.15.156 → 192.168.1.12 SSH 198 Server: Encrypted packet (len=132)
  818 31.949502250 192.168.1.12 → 10.6.15.156  TCP 66 54766 → 22 [ACK] Seq=96713 Ack=111045 Win=6155 Len=0 TSval=8095990 TSecr=15027489
  819 31.997964184  10.6.15.156 → 192.168.1.12 SSH 670 Server: Encrypted packet (len=604)
  820 31.997987143 192.168.1.12 → 10.6.15.156  TCP 66 54766 → 22 [ACK] Seq=96713 Ack=111649 Win=6155 Len=0 TSval=8096002 TSecr=15027501
  821 32.020977345  10.6.15.156 → 192.168.1.12 SSH 286 Server: Encrypted packet (len=220)
  822 32.020996455 192.168.1.12 → 10.6.15.156  TCP 66 54766 → 22 [ACK] Seq=96713 Ack=111869 Win=6155 Len=0 TSval=8096008 TSecr=15027507
  823 32.072699924  10.6.15.156 → 192.168.1.12 SSH 358 Server: Encrypted packet (len=292)
  824 32.178091426  10.6.15.156 → 192.168.1.12 SSH 286 Server: Encrypted packet (len=220)
  825 32.597017908 192.168.1.12 → 10.6.15.156  TCP 66 54766 → 22 [ACK] Seq=96713 Ack=112161 Win=6155 Len=0 TSval=8096020 TSecr=15027520
  826 32.597027196 192.168.1.12 → 10.6.15.156  TCP 66 54766 → 22 [ACK] Seq=96713 Ack=112381 Win=6155 Len=0 TSval=8096047 TSecr=15027546
  827 32.598744847  10.6.15.156 → 192.168.1.12 SSH 286 Server: [TCP Spurious Retransmission] , Encrypted packet (len=220)
  828 32.598766402 192.168.1.12 → 10.6.15.156  TCP 78 [TCP Dup ACK 826#1] 54766 → 22 [ACK] Seq=96713 Ack=112381 Win=6155 Len=0 TSval=8096152 TSecr=15027618 SLE=112161 SRE=112381
  829 32.851744095  10.6.15.156 → 192.168.1.12 SSH 438 Server: Encrypted packet (len=372)
  830 32.851771730 192.168.1.12 → 10.6.15.156  TCP 66 54766 → 22 [ACK] Seq=96713 Ack=112753 Win=6155 Len=0 TSval=8096215 TSecr=15027715
  831 32.923015765  10.6.15.156 → 192.168.1.12 SSH 270 Server: Encrypted packet (len=204)
  832 32.923033866 192.168.1.12 → 10.6.15.156  TCP 66 54766 → 22 [ACK] Seq=96713 Ack=112957 Win=6155 Len=0 TSval=8096233 TSecr=15027733
  833 32.974914466  10.6.15.156 → 192.168.1.12 SSH 438 Server: Encrypted packet (len=372)
  834 32.974933433 192.168.1.12 → 10.6.15.156  TCP 66 54766 → 22 [ACK] Seq=96713 Ack=113329 Win=6155 Len=0 TSval=8096246 TSecr=15027746
  835 33.080291952  10.6.15.156 → 192.168.1.12 SSH 406 Server: Encrypted packet (len=340)
  836 33.080310770 192.168.1.12 → 10.6.15.156  TCP 66 54766 → 22 [ACK] Seq=96713 Ack=113669 Win=6155 Len=0 TSval=8096272 TSecr=15027772
  837 33.302454440  10.6.15.156 → 192.168.1.12 SSH 270 Server: Encrypted packet (len=204)
  838 33.302468988 192.168.1.12 → 10.6.15.156  TCP 66 54766 → 22 [ACK] Seq=96713 Ack=113873 Win=6155 Len=0 TSval=8096328 TSecr=15027827
  839 33.373901886  10.6.15.156 → 192.168.1.12 SSH 270 Server: Encrypted packet (len=204)
  840 33.373927170 192.168.1.12 → 10.6.15.156  TCP 66 54766 → 22 [ACK] Seq=96713 Ack=114077 Win=6155 Len=0 TSval=8096346 TSecr=15027845
  841 33.425429422  10.6.15.156 → 192.168.1.12 SSH 270 Server: Encrypted packet (len=204)
  842 33.425447652 192.168.1.12 → 10.6.15.156  TCP 66 54766 → 22 [ACK] Seq=96713 Ack=114281 Win=6155 Len=0 TSval=8096359 TSecr=15027858
  843 33.531164093  10.6.15.156 → 192.168.1.12 SSH 438 Server: Encrypted packet (len=372)
  844 33.531181498 192.168.1.12 → 10.6.15.156  TCP 66 54766 → 22 [ACK] Seq=96713 Ack=114653 Win=6155 Len=0 TSval=8096385 TSecr=15027885
  845 33.753949742  10.6.15.156 → 192.168.1.12 SSH 422 Server: Encrypted packet (len=356)
  846 33.753967553 192.168.1.12 → 10.6.15.156  TCP 66 54766 → 22 [ACK] Seq=96713 Ack=115009 Win=6155 Len=0 TSval=8096441 TSecr=15027940
  847 33.825367120  10.6.15.156 → 192.168.1.12 SSH 374 Server: Encrypted packet (len=308)
  848 33.825385085 192.168.1.12 → 10.6.15.156  TCP 66 54766 → 22 [ACK] Seq=96713 Ack=115317 Win=6155 Len=0 TSval=8096459 TSecr=15027958
  849 33.876629962  10.6.15.156 → 192.168.1.12 SSH 374 Server: Encrypted packet (len=308)
  850 33.876646791 192.168.1.12 → 10.6.15.156  TCP 66 54766 → 22 [ACK] Seq=96713 Ack=115625 Win=6155 Len=0 TSval=8096471 TSecr=15027971
  851 33.982871078  10.6.15.156 → 192.168.1.12 SSH 254 Server: Encrypted packet (len=188)
  852 33.982888685 192.168.1.12 → 10.6.15.156  TCP 66 54766 → 22 [ACK] Seq=96713 Ack=115813 Win=6155 Len=0 TSval=8096498 TSecr=15027997
  853 34.275975560  10.6.15.156 → 192.168.1.12 SSH 270 Server: Encrypted packet (len=204)
  854 34.275993557 192.168.1.12 → 10.6.15.156  TCP 66 54766 → 22 [ACK] Seq=96713 Ack=116017 Win=6155 Len=0 TSval=8096571 TSecr=15028071
  855 34.433375360  10.6.15.156 → 192.168.1.12 SSH 222 Server: Encrypted packet (len=156)
  856 34.433393026 192.168.1.12 → 10.6.15.156  TCP 66 54766 → 22 [ACK] Seq=96713 Ack=116173 Win=6155 Len=0 TSval=8096611 TSecr=15028110
  857 34.518763830  10.6.15.156 → 192.168.1.12 SSH 150 Server: Encrypted packet (len=84)
  858 34.518782098 192.168.1.12 → 10.6.15.156  TCP 66 54766 → 22 [ACK] Seq=96713 Ack=116257 Win=6155 Len=0 TSval=8096632 TSecr=15028132
  859 34.519040158 192.168.1.12 → 10.6.15.156  SSH 150 Client: Encrypted packet (len=84)
  860 34.521140970  10.6.15.156 → 192.168.1.12 TCP 66 22 → 54766 [ACK] Seq=116257 Ack=96797 Win=1452 Len=0 TSval=15028132 TSecr=8096632
  861 34.655533854  10.6.15.156 → 192.168.1.12 SSH 302 Server: Encrypted packet (len=236)
  862 34.697006684 192.168.1.12 → 10.6.15.156  TCP 66 54766 → 22 [ACK] Seq=96797 Ack=116493 Win=6155 Len=0 TSval=8096677 TSecr=15028166
  863 34.727074910  10.6.15.156 → 192.168.1.12 SSH 222 Server: Encrypted packet (len=156)
  864 34.727163908 192.168.1.12 → 10.6.15.156  TCP 66 54766 → 22 [ACK] Seq=96797 Ack=116649 Win=6155 Len=0 TSval=8096684 TSecr=15028184
  865 34.778306308  10.6.15.156 → 192.168.1.12 SSH 222 Server: Encrypted packet (len=156)
  866 34.778391285 192.168.1.12 → 10.6.15.156  TCP 66 54766 → 22 [ACK] Seq=96797 Ack=116805 Win=6155 Len=0 TSval=8096697 TSecr=15028196
