    1 0.000000000  10.6.15.145 → 192.168.1.16 SSH 180 Server: Encrypted packet (len=112)
    2 0.000144447    127.0.0.1 → 127.0.0.1    Socks 297 Unknown
    3 0.000156162    127.0.0.1 → 127.0.0.1    Socks 119 Unknown
    4 0.040059016 192.168.1.16 → 10.6.15.145  TCP 68 52104 → 22 [ACK] Seq=89 Ack=113 Win=6157 Len=0 TSval=1469708 TSecr=24284156
    5 0.048053954    127.0.0.1 → 127.0.0.1    TCP 68 49230 → 1080 [ACK] Seq=1 Ack=52 Win=2388 Len=0 TSval=1469709 TSecr=1469698
    6 0.048057303    127.0.0.1 → 127.0.0.1    TCP 68 49242 → 1080 [ACK] Seq=1 Ack=230 Win=350 Len=0 TSval=1469710 TSecr=1469698
    7 0.094100153  10.6.15.145 → 192.168.1.16 SSH 236 Server: Encrypted packet (len=168)
    8 0.094126325 192.168.1.16 → 10.6.15.145  TCP 68 52104 → 22 [ACK] Seq=89 Ack=281 Win=6157 Len=0 TSval=1469721 TSecr=24284247
    9 0.094208846    127.0.0.1 → 127.0.0.1    TCP 68 1080 → 49228 [FIN, ACK] Seq=1 Ack=1 Win=350 Len=0 TSval=1469721 TSecr=1469523
   10 0.094216803    127.0.0.1 → 127.0.0.1    TCP 68 49228 → 1080 [ACK] Seq=1 Ack=2 Win=351 Len=0 TSval=1469721 TSecr=1469721
   11 0.094228247    127.0.0.1 → 127.0.0.1    TCP 68 1080 → 49236 [FIN, ACK] Seq=1 Ack=1 Win=352 Len=0 TSval=1469721 TSecr=1469523
   12 0.094230060    127.0.0.1 → 127.0.0.1    TCP 68 49236 → 1080 [ACK] Seq=1 Ack=2 Win=350 Len=0 TSval=1469721 TSecr=1469721
   13 0.094236292    127.0.0.1 → 127.0.0.1    TCP 68 1080 → 49234 [FIN, ACK] Seq=1 Ack=1 Win=1365 Len=0 TSval=1469721 TSecr=1469523
   14 0.094237927    127.0.0.1 → 127.0.0.1    TCP 68 49234 → 1080 [ACK] Seq=1 Ack=2 Win=350 Len=0 TSval=1469721 TSecr=1469721
   15 0.094282904    127.0.0.1 → 127.0.0.1    Socks 99 Unknown
   16 0.115738502 192.168.1.16 → 224.0.0.252  LLMNR 75 Standard query 0x0ab1 ANY theenterprise
   17 0.115793343 fe80::820e:b87b:de2a:4286 → ff02::1:3    LLMNR 95 Standard query 0x8e0f ANY theenterprise
   18 0.115829219 192.168.1.16 → 192.168.1.16 LLMNR 91 Standard query response 0x0ab1 ANY theenterprise A 192.168.1.16
   19 0.115850862 fe80::820e:b87b:de2a:4286 → fe80::820e:b87b:de2a:4286 LLMNR 123 Standard query response 0x8e0f ANY theenterprise AAAA fe80::820e:b87b:de2a:4286
   20 0.120075316 192.168.1.16 → 10.6.15.145  TCP 156 [TCP Retransmission] 52104 → 22 [PSH, ACK] Seq=1 Ack=281 Win=6157 Len=88 TSval=1469728 TSecr=24284247
   21 0.122099525  10.6.15.145 → 192.168.1.16 TCP 68 22 → 52104 [ACK] Seq=281 Ack=89 Win=1452 Len=0 TSval=24284254 TSecr=1469728
   22 0.122121440 192.168.1.16 → 10.6.15.145  SSH 944 Client: Encrypted packet (len=876)
   23 0.124979212  10.6.15.145 → 192.168.1.16 TCP 68 22 → 52104 [ACK] Seq=281 Ack=965 Win=1452 Len=0 TSval=24284254 TSecr=1469728
   24 0.126242720  10.6.15.145 → 192.168.1.16 SSH 176 Server: Encrypted packet (len=108)
   25 0.136067494    127.0.0.1 → 127.0.0.1    TCP 68 49238 → 1080 [ACK] Seq=1 Ack=32 Win=350 Len=0 TSval=1469732 TSecr=1469721
   26 0.168077821 192.168.1.16 → 10.6.15.145  TCP 68 52104 → 22 [ACK] Seq=965 Ack=389 Win=6157 Len=0 TSval=1469740 TSecr=24284255
   27 0.826458165    127.0.0.1 → 127.0.0.1    Socks 110 Unknown
   28 0.826465980    127.0.0.1 → 127.0.0.1    TCP 68 1080 → 48426 [ACK] Seq=1 Ack=43 Win=620 Len=0 TSval=1469904 TSecr=1469904
   29 0.826483946    127.0.0.1 → 127.0.0.1    Socks 110 Unknown
   30 0.826487090    127.0.0.1 → 127.0.0.1    TCP 68 1080 → 48426 [ACK] Seq=1 Ack=85 Win=620 Len=0 TSval=1469904 TSecr=1469904
   31 0.826604969 192.168.1.16 → 10.6.15.145  SSH 176 Client: Encrypted packet (len=108)
   32 0.828345399  10.6.15.145 → 192.168.1.16 SSH 104 Server: Encrypted packet (len=36)
   33 0.828354252 192.168.1.16 → 10.6.15.145  TCP 68 52104 → 22 [ACK] Seq=1073 Ack=425 Win=6157 Len=0 TSval=1469905 TSecr=24284305
   34 0.828361284  10.6.15.145 → 192.168.1.16 SSH 104 Server: Encrypted packet (len=36)
   35 0.828363826 192.168.1.16 → 10.6.15.145  TCP 68 52104 → 22 [ACK] Seq=1073 Ack=461 Win=6157 Len=0 TSval=1469905 TSecr=24284309
   36 0.828415418    127.0.0.1 → 127.0.0.1    Socks 78 Version: 5 Connect to server request Command Request - Connect
   37 0.828425619    127.0.0.1 → 127.0.0.1    Socks 78 Version: 5 Connect to server request Command Request - Connect
   38 0.828541817    127.0.0.1 → 127.0.0.1    Socks 585 Version: 5 Connect to server response
   39 0.828545850  10.6.15.145 → 192.168.1.16 SSH 1128 Server: Encrypted packet (len=1060)
   40 0.828551078    127.0.0.1 → 127.0.0.1    TCP 68 1080 → 49244 [ACK] Seq=11 Ack=518 Win=350 Len=0 TSval=1469905 TSecr=1469905
   41 0.828552972 192.168.1.16 → 10.6.15.145  TCP 68 52104 → 22 [ACK] Seq=1073 Ack=1521 Win=6157 Len=0 TSval=1469905 TSecr=24284345
   42 0.828594074    127.0.0.1 → 127.0.0.1    TCP 68 1080 → 49084 [FIN, ACK] Seq=1 Ack=1 Win=367 Len=0 TSval=1469905 TSecr=1469335
   43 0.828600280    127.0.0.1 → 127.0.0.1    TCP 68 49084 → 1080 [ACK] Seq=1 Ack=2 Win=359 Len=0 TSval=1469905 TSecr=1469905
   44 0.828634388    127.0.0.1 → 127.0.0.1    TCP 68 1080 → 49226 [FIN, ACK] Seq=1 Ack=1 Win=350 Len=0 TSval=1469905 TSecr=1469523
   45 0.828636325    127.0.0.1 → 127.0.0.1    TCP 68 49226 → 1080 [ACK] Seq=1 Ack=2 Win=350 Len=0 TSval=1469905 TSecr=1469905
   46 0.828873608    127.0.0.1 → 127.0.0.1    Socks 831 Unknown
   47 0.828882908    127.0.0.1 → 127.0.0.1    Socks 78 Version: 5 Connect to server request Command Request - Connect
   48 0.828888356    127.0.0.1 → 127.0.0.1    Socks 78 Version: 5 Connect to server request Command Request - Connect
   49 0.828892909    127.0.0.1 → 127.0.0.1    Socks 78 Version: 5 Connect to server request Command Request - Connect
   50 0.828898288 192.168.1.16 → 10.6.15.145  SSH 560 Client: Encrypted packet (len=492)
   51 0.829022504    127.0.0.1 → 127.0.0.1    Socks 114 Unknown
   52 0.829096595    127.0.0.1 → 127.0.0.1    Socks 1723 Version: 5 Connect to server response
   53 0.829101298    127.0.0.1 → 127.0.0.1    TCP 68 1080 → 49266 [ACK] Seq=11 Ack=1656 Win=1365 Len=0 TSval=1469905 TSecr=1469905
   54 0.830832501  10.6.15.145 → 192.168.1.16 TCP 68 22 → 52104 [ACK] Seq=1521 Ack=1565 Win=1452 Len=0 TSval=24284431 TSecr=1469904
   55 0.830853052 192.168.1.16 → 10.6.15.145  SSH 292 Client: Encrypted packet (len=224)
   56 0.867506067  10.6.15.145 → 192.168.1.16 SSH 240 Server: Encrypted packet (len=172)
   57 0.867596969    127.0.0.1 → 127.0.0.1    Socks 219 Version: 5
   58 0.867871024    127.0.0.1 → 127.0.0.1    Socks 284 Version: 5
   59 0.867984641 192.168.1.16 → 10.6.15.145  SSH 304 Client: Encrypted packet (len=236)
   60 0.868669511    127.0.0.1 → 127.0.0.1    Socks 283 Version: 5
   61 0.868698997    127.0.0.1 → 127.0.0.1    TCP 68 1080 → 49244 [ACK] Seq=162 Ack=949 Win=367 Len=0 TSval=1469915 TSecr=1469914
   62 0.868788215 192.168.1.16 → 10.6.15.145  SSH 320 Client: Encrypted packet (len=252)
   63 0.870551511  10.6.15.145 → 192.168.1.16 TCP 68 22 → 52104 [ACK] Seq=1693 Ack=2277 Win=1452 Len=0 TSval=24284441 TSecr=1469914
   64 0.872054957    127.0.0.1 → 127.0.0.1    TCP 68 1080 → 48426 [ACK] Seq=764 Ack=131 Win=620 Len=0 TSval=1469916 TSecr=1469905
   65 0.872061322    127.0.0.1 → 127.0.0.1    TCP 68 49272 → 1080 [ACK] Seq=1 Ack=11 Win=342 Len=0 TSval=1469916 TSecr=1469905
   66 0.872063110    127.0.0.1 → 127.0.0.1    TCP 68 49268 → 1080 [ACK] Seq=1 Ack=11 Win=342 Len=0 TSval=1469916 TSecr=1469905
   67 0.872065350    127.0.0.1 → 127.0.0.1    TCP 68 49270 → 1080 [ACK] Seq=1 Ack=11 Win=342 Len=0 TSval=1469916 TSecr=1469905
   68 0.905884296  10.6.15.145 → 192.168.1.16 SSH 128 Server: Encrypted packet (len=60)
   69 0.905991548    127.0.0.1 → 127.0.0.1    Socks 98 Version: 5
   70 0.907529162  10.6.15.145 → 192.168.1.16 SSH 216 Server: Encrypted packet (len=148)
   71 0.907560442 192.168.1.16 → 10.6.15.145  TCP 68 52104 → 22 [ACK] Seq=2277 Ack=1901 Win=6157 Len=0 TSval=1469924 TSecr=24284450
   72 0.907592895    127.0.0.1 → 127.0.0.1    Socks 186 Version: 5
   73 0.907618197    127.0.0.1 → 127.0.0.1    TCP 68 49244 → 1080 [ACK] Seq=949 Ack=310 Win=350 Len=0 TSval=1469924 TSecr=1469924
   74 0.909359166  10.6.15.145 → 192.168.1.16 SSH 240 Server: Encrypted packet (len=172)
   75 0.909466901    127.0.0.1 → 127.0.0.1    Socks 202 Version: 5
   76 0.956120914 192.168.1.16 → 10.6.15.145  TCP 68 52104 → 22 [ACK] Seq=2277 Ack=2073 Win=6157 Len=0 TSval=1469937 TSecr=24284451
   77 0.956111234    127.0.0.1 → 127.0.0.1    TCP 68 49244 → 1080 [ACK] Seq=949 Ack=444 Win=359 Len=0 TSval=1469937 TSecr=1469925
   78 1.037421909    127.0.0.1 → 127.0.0.1    TCP 68 49244 → 1080 [FIN, ACK] Seq=949 Ack=444 Win=359 Len=0 TSval=1469957 TSecr=1469925
   79 1.037540089 192.168.1.16 → 10.6.15.145  SSH 104 Client: Encrypted packet (len=36)
   80 1.037549023    127.0.0.1 → 127.0.0.1    TCP 76 49314 → 1080 [SYN] Seq=0 Win=43690 Len=0 MSS=65495 SACK_PERM=1 TSval=1469957 TSecr=0 WS=128
   81 1.037555356    127.0.0.1 → 127.0.0.1    TCP 76 1080 → 49314 [SYN, ACK] Seq=0 Ack=1 Win=43690 Len=0 MSS=65495 SACK_PERM=1 TSval=1469957 TSecr=1469957 WS=128
   82 1.037562863    127.0.0.1 → 127.0.0.1    TCP 68 49314 → 1080 [ACK] Seq=1 Ack=1 Win=43776 Len=0 TSval=1469957 TSecr=1469957
   83 1.038508823    127.0.0.1 → 127.0.0.1    Socks 71 Version: 5 Connect to server request
   84 1.038520936    127.0.0.1 → 127.0.0.1    TCP 68 1080 → 49314 [ACK] Seq=1 Ack=4 Win=43776 Len=0 TSval=1469957 TSecr=1469957
   85 1.038574635    127.0.0.1 → 127.0.0.1    Socks 70 Version: 5 Connect to server response
   86 1.038579411 192.168.1.16 → 239.255.255.250 SSDP 215 M-SEARCH * HTTP/1.1 
   87 1.038578868    127.0.0.1 → 127.0.0.1    TCP 68 49314 → 1080 [ACK] Seq=4 Ack=3 Win=43776 Len=0 TSval=1469957 TSecr=1469957
   88 1.038604873    127.0.0.1 → 127.0.0.1    Socks 91 Version: 5 Command Request - Connect
   89 1.038658544 192.168.1.16 → 10.6.15.145  SSH 104 Client: Encrypted packet (len=36)
   90 1.039516376    127.0.0.1 → 127.0.0.1    Socks 165 Unknown
   91 1.039527392    127.0.0.1 → 127.0.0.1    TCP 68 1080 → 47680 [ACK] Seq=1 Ack=98 Win=372 Len=0 TSval=1469957 TSecr=1469957
   92 1.039541802    127.0.0.1 → 127.0.0.1    Socks 114 Unknown
   93 1.039544278    127.0.0.1 → 127.0.0.1    TCP 68 1080 → 47680 [ACK] Seq=1 Ack=144 Win=372 Len=0 TSval=1469957 TSecr=1469957
   94 1.039626258 192.168.1.16 → 10.6.15.145  SSH 240 Client: Encrypted packet (len=172)
   95 1.042199663  10.6.15.145 → 192.168.1.16 TCP 68 22 → 52104 [ACK] Seq=2073 Ack=2521 Win=1452 Len=0 TSval=24284484 TSecr=1469957
   96 1.076126809  10.6.15.145 → 192.168.1.16 SSH 104 Server: Encrypted packet (len=36)
   97 1.076143066 192.168.1.16 → 10.6.15.145  TCP 68 52104 → 22 [ACK] Seq=2521 Ack=2109 Win=6157 Len=0 TSval=1469967 TSecr=24284492
   98 1.076229093    127.0.0.1 → 127.0.0.1    Socks 78 Version: 5, Remote Port: 5228 Command Response - Connect
   99 1.076346062    127.0.0.1 → 127.0.0.1    Socks 585 Version: 5, Remote Port: 5228
  100 1.076454693 192.168.1.16 → 10.6.15.145  SSH 160 Client: Encrypted packet (len=92)
  101 1.080075801    127.0.0.1 → 127.0.0.1    TCP 68 1080 → 49244 [ACK] Seq=444 Ack=950 Win=367 Len=0 TSval=1469968 TSecr=1469957
  102 1.112663204  10.6.15.145 → 192.168.1.16 SSH 168 Server: Encrypted packet (len=100)
  103 1.112765281    127.0.0.1 → 127.0.0.1    Socks 219 Version: 5, Remote Port: 5228
  104 1.113069037    127.0.0.1 → 127.0.0.1    Socks 284 Version: 5, Remote Port: 5228
  105 1.113206196 192.168.1.16 → 10.6.15.145  SSH 304 Client: Encrypted packet (len=236)
  106 1.113939805    127.0.0.1 → 127.0.0.1    Socks 283 Version: 5, Remote Port: 5228
  107 1.113972017    127.0.0.1 → 127.0.0.1    TCP 68 1080 → 49314 [ACK] Seq=164 Ack=975 Win=46976 Len=0 TSval=1469976 TSecr=1469976
  108 1.114061476 192.168.1.16 → 10.6.15.145  SSH 312 Client: Encrypted packet (len=244)
  109 1.115682022  10.6.15.145 → 192.168.1.16 TCP 68 22 → 52104 [ACK] Seq=2209 Ack=3093 Win=1452 Len=0 TSval=24284502 TSecr=1469976
  110 1.150981469  10.6.15.145 → 192.168.1.16 SSH 120 Server: Encrypted packet (len=52)
  111 1.151084997    127.0.0.1 → 127.0.0.1    Socks 98 Version: 5, Remote Port: 5228
  112 1.154170150  10.6.15.145 → 192.168.1.16 SSH 216 Server: Encrypted packet (len=148)
  113 1.154191552  10.6.15.145 → 192.168.1.16 SSH 232 Server: Encrypted packet (len=164)
  114 1.154226632 192.168.1.16 → 10.6.15.145  TCP 68 52104 → 22 [ACK] Seq=3093 Ack=2573 Win=6157 Len=0 TSval=1469986 TSecr=24284511
  115 1.154265624    127.0.0.1 → 127.0.0.1    Socks 320 Version: 5, Remote Port: 5228
  116 1.154290491    127.0.0.1 → 127.0.0.1    TCP 68 49314 → 1080 [ACK] Seq=975 Ack=446 Win=45952 Len=0 TSval=1469986 TSecr=1469985
  117 1.162075077  10.6.15.145 → 192.168.1.16 SSH 504 Server: Encrypted packet (len=436)
  118 1.162184499    127.0.0.1 → 127.0.0.1    Socks 486 Unknown
  119 1.162786304    127.0.0.1 → 127.0.0.1    Socks 114 Unknown
  120 1.162798589    127.0.0.1 → 127.0.0.1    TCP 68 1080 → 47680 [ACK] Seq=419 Ack=190 Win=372 Len=0 TSval=1469988 TSecr=1469988
  121 1.162875443 192.168.1.16 → 10.6.15.145  SSH 144 Client: Encrypted packet (len=76)
  122 1.233181706  10.6.15.145 → 192.168.1.16 TCP 68 22 → 52104 [ACK] Seq=3009 Ack=3169 Win=1452 Len=0 TSval=24284532 TSecr=1469988
  123 1.992165140    127.0.0.1 → 127.0.0.1    Socks 196 Unknown
  124 1.992177946    127.0.0.1 → 127.0.0.1    TCP 68 1080 → 47632 [ACK] Seq=1 Ack=129 Win=3637 Len=0 TSval=1470196 TSecr=1470196
  125 1.992205922    127.0.0.1 → 127.0.0.1    Socks 114 Unknown
  126 1.992209579    127.0.0.1 → 127.0.0.1    TCP 68 1080 → 47632 [ACK] Seq=1 Ack=175 Win=3637 Len=0 TSval=1470196 TSecr=1470196
  127 1.992221063    127.0.0.1 → 127.0.0.1    Socks 1111 Unknown
  128 1.992223435    127.0.0.1 → 127.0.0.1    TCP 68 1080 → 47632 [ACK] Seq=1 Ack=1218 Win=3637 Len=0 TSval=1470196 TSecr=1470196
  129 1.992429215 192.168.1.16 → 10.6.15.145  SSH 1328 Client: Encrypted packet (len=1260)
  130 1.994788238  10.6.15.145 → 192.168.1.16 SSH 140 Server: Encrypted packet (len=72)
  131 1.994799012  10.6.15.145 → 192.168.1.16 TCP 140 [TCP Retransmission] 22 → 52104 [PSH, ACK] Seq=3009 Ack=3169 Win=1452 Len=72 TSval=24284685 TSecr=1469988
  132 1.994804069 192.168.1.16 → 10.6.15.145  TCP 80 52104 → 22 [ACK] Seq=4429 Ack=3081 Win=6157 Len=0 TSval=1470196 TSecr=24284685 SLE=3009 SRE=3081
  133 1.994839715  10.6.15.145 → 192.168.1.16 SSH 456 Server: Encrypted packet (len=388)
  134 1.994842409 192.168.1.16 → 10.6.15.145  TCP 68 52104 → 22 [ACK] Seq=4429 Ack=3469 Win=6157 Len=0 TSval=1470196 TSecr=24284689
  135 1.994854323    127.0.0.1 → 127.0.0.1    TCP 68 1080 → 49244 [FIN, ACK] Seq=444 Ack=950 Win=367 Len=0 TSval=1470196 TSecr=1469957
  136 1.994861288    127.0.0.1 → 127.0.0.1    TCP 68 49244 → 1080 [ACK] Seq=950 Ack=445 Win=359 Len=0 TSval=1470196 TSecr=1470196
  137 1.994955086 192.168.1.16 → 10.6.15.145  SSH 104 Client: Encrypted packet (len=36)
  138 1.994995171    127.0.0.1 → 127.0.0.1    Socks 922 Version: 5
  139 1.995633650  10.6.15.145 → 192.168.1.16 TCP 68 22 → 52104 [ACK] Seq=3469 Ack=4429 Win=1452 Len=0 TSval=24284722 TSecr=1470196
  140 1.996411189  10.6.15.145 → 192.168.1.16 TCP 68 22 → 52104 [ACK] Seq=3469 Ack=4465 Win=1452 Len=0 TSval=24284722 TSecr=1470196
  141 1.997385271    127.0.0.1 → 127.0.0.1    TCP 68 49240 → 1080 [FIN, ACK] Seq=1 Ack=1 Win=350 Len=0 TSval=1470197 TSecr=1468943
  142 1.997473379    127.0.0.1 → 127.0.0.1    TCP 76 49316 → 1080 [SYN] Seq=0 Win=43690 Len=0 MSS=65495 SACK_PERM=1 TSval=1470197 TSecr=0 WS=128
  143 1.997481849    127.0.0.1 → 127.0.0.1    TCP 76 1080 → 49316 [SYN, ACK] Seq=0 Ack=1 Win=43690 Len=0 MSS=65495 SACK_PERM=1 TSval=1470197 TSecr=1470197 WS=128
  144 1.997486368 192.168.1.16 → 10.6.15.145  SSH 104 Client: Encrypted packet (len=36)
  145 1.997491405    127.0.0.1 → 127.0.0.1    TCP 68 49316 → 1080 [ACK] Seq=1 Ack=1 Win=43776 Len=0 TSval=1470197 TSecr=1470197
  146 1.997516100    127.0.0.1 → 127.0.0.1    TCP 68 49242 → 1080 [FIN, ACK] Seq=1 Ack=230 Win=350 Len=0 TSval=1470197 TSecr=1469698
  147 1.997555804    127.0.0.1 → 127.0.0.1    TCP 76 49318 → 1080 [SYN] Seq=0 Win=43690 Len=0 MSS=65495 SACK_PERM=1 TSval=1470197 TSecr=0 WS=128
  148 1.997561162    127.0.0.1 → 127.0.0.1    TCP 76 1080 → 49318 [SYN, ACK] Seq=0 Ack=1 Win=43690 Len=0 MSS=65495 SACK_PERM=1 TSval=1470197 TSecr=1470197 WS=128
  149 1.997566347    127.0.0.1 → 127.0.0.1    TCP 68 49318 → 1080 [ACK] Seq=1 Ack=1 Win=43776 Len=0 TSval=1470197 TSecr=1470197
  150 1.997583798    127.0.0.1 → 127.0.0.1    TCP 68 49270 → 1080 [FIN, ACK] Seq=1 Ack=11 Win=342 Len=0 TSval=1470197 TSecr=1469905
  151 1.997622283    127.0.0.1 → 127.0.0.1    TCP 76 49320 → 1080 [SYN] Seq=0 Win=43690 Len=0 MSS=65495 SACK_PERM=1 TSval=1470197 TSecr=0 WS=128
  152 1.997626524    127.0.0.1 → 127.0.0.1    TCP 76 1080 → 49320 [SYN, ACK] Seq=0 Ack=1 Win=43690 Len=0 MSS=65495 SACK_PERM=1 TSval=1470197 TSecr=1470197 WS=128
  153 1.997631478    127.0.0.1 → 127.0.0.1    TCP 68 49320 → 1080 [ACK] Seq=1 Ack=1 Win=43776 Len=0 TSval=1470197 TSecr=1470197
  154 1.997716784    127.0.0.1 → 127.0.0.1    TCP 68 49268 → 1080 [FIN, ACK] Seq=1 Ack=11 Win=342 Len=0 TSval=1470197 TSecr=1469905
  155 1.997745532 192.168.1.16 → 10.6.15.145  SSH 140 Client: Encrypted packet (len=72)
  156 1.997760253    127.0.0.1 → 127.0.0.1    TCP 76 49322 → 1080 [SYN] Seq=0 Win=43690 Len=0 MSS=65495 SACK_PERM=1 TSval=1470197 TSecr=0 WS=128
  157 1.997764636    127.0.0.1 → 127.0.0.1    TCP 76 1080 → 49322 [SYN, ACK] Seq=0 Ack=1 Win=43690 Len=0 MSS=65495 SACK_PERM=1 TSval=1470197 TSecr=1470197 WS=128
  158 1.997769899    127.0.0.1 → 127.0.0.1    TCP 68 49322 → 1080 [ACK] Seq=1 Ack=1 Win=43776 Len=0 TSval=1470197 TSecr=1470197
  159 1.997785996    127.0.0.1 → 127.0.0.1    TCP 68 49272 → 1080 [FIN, ACK] Seq=1 Ack=11 Win=342 Len=0 TSval=1470197 TSecr=1469905
  160 1.997820151    127.0.0.1 → 127.0.0.1    TCP 76 49324 → 1080 [SYN] Seq=0 Win=43690 Len=0 MSS=65495 SACK_PERM=1 TSval=1470197 TSecr=0 WS=128
  161 1.997824465    127.0.0.1 → 127.0.0.1    TCP 76 1080 → 49324 [SYN, ACK] Seq=0 Ack=1 Win=43690 Len=0 MSS=65495 SACK_PERM=1 TSval=1470197 TSecr=1470197 WS=128
  162 1.997829022    127.0.0.1 → 127.0.0.1    TCP 68 49324 → 1080 [ACK] Seq=1 Ack=1 Win=43776 Len=0 TSval=1470197 TSecr=1470197
  163 1.998003549 192.168.1.16 → 10.6.15.145  SSH 140 Client: Encrypted packet (len=72)
  164 1.998078894    127.0.0.1 → 127.0.0.1    TCP 68 49162 → 1080 [RST, ACK] Seq=1 Ack=1 Win=1408 Len=0 TSval=1470197 TSecr=1466807
  165 1.998138139    127.0.0.1 → 127.0.0.1    TCP 68 49164 → 1080 [RST, ACK] Seq=1 Ack=1 Win=1408 Len=0 TSval=1470197 TSecr=1466807
  166 1.998177585    127.0.0.1 → 127.0.0.1    TCP 68 49166 → 1080 [RST, ACK] Seq=1 Ack=1 Win=1408 Len=0 TSval=1470197 TSecr=1466812
  167 1.998245459    127.0.0.1 → 127.0.0.1    TCP 76 49326 → 1080 [SYN] Seq=0 Win=43690 Len=0 MSS=65495 SACK_PERM=1 TSval=1470197 TSecr=0 WS=128
  168 1.998250931    127.0.0.1 → 127.0.0.1    TCP 76 1080 → 49326 [SYN, ACK] Seq=0 Ack=1 Win=43690 Len=0 MSS=65495 SACK_PERM=1 TSval=1470197 TSecr=1470197 WS=128
  169 1.998256625    127.0.0.1 → 127.0.0.1    TCP 68 49326 → 1080 [ACK] Seq=1 Ack=1 Win=43776 Len=0 TSval=1470197 TSecr=1470197
  170 1.998257279 192.168.1.16 → 10.6.15.145  SSH 176 Client: Encrypted packet (len=108)
  171 1.998369630    127.0.0.1 → 127.0.0.1    TCP 76 49328 → 1080 [SYN] Seq=0 Win=43690 Len=0 MSS=65495 SACK_PERM=1 TSval=1470197 TSecr=0 WS=128
  172 1.998374820    127.0.0.1 → 127.0.0.1    TCP 76 1080 → 49328 [SYN, ACK] Seq=0 Ack=1 Win=43690 Len=0 MSS=65495 SACK_PERM=1 TSval=1470197 TSecr=1470197 WS=128
  173 1.998380775    127.0.0.1 → 127.0.0.1    TCP 68 49328 → 1080 [ACK] Seq=1 Ack=1 Win=43776 Len=0 TSval=1470197 TSecr=1470197
  174 1.998419722    127.0.0.1 → 127.0.0.1    TCP 76 49330 → 1080 [SYN] Seq=0 Win=43690 Len=0 MSS=65495 SACK_PERM=1 TSval=1470197 TSecr=0 WS=128
  175 1.998423703    127.0.0.1 → 127.0.0.1    TCP 76 1080 → 49330 [SYN, ACK] Seq=0 Ack=1 Win=43690 Len=0 MSS=65495 SACK_PERM=1 TSval=1470197 TSecr=1470197 WS=128
  176 1.998428772    127.0.0.1 → 127.0.0.1    TCP 68 49330 → 1080 [ACK] Seq=1 Ack=1 Win=43776 Len=0 TSval=1470197 TSecr=1470197
  177 1.998687548  10.6.15.145 → 192.168.1.16 SSH 144 Server: Encrypted packet (len=76)
  178 1.998731938    127.0.0.1 → 127.0.0.1    TCP 68 49216 → 1080 [FIN, ACK] Seq=1 Ack=1 Win=359 Len=0 TSval=1470197 TSecr=1468528
  179 1.998749539    127.0.0.1 → 127.0.0.1    Socks 114 Unknown
  180 1.998780522    127.0.0.1 → 127.0.0.1    TCP 76 49332 → 1080 [SYN] Seq=0 Win=43690 Len=0 MSS=65495 SACK_PERM=1 TSval=1470197 TSecr=0 WS=128
  181 1.998786554    127.0.0.1 → 127.0.0.1    TCP 76 1080 → 49332 [SYN, ACK] Seq=0 Ack=1 Win=43690 Len=0 MSS=65495 SACK_PERM=1 TSval=1470197 TSecr=1470197 WS=128
  182 1.998792680    127.0.0.1 → 127.0.0.1    TCP 68 49332 → 1080 [ACK] Seq=1 Ack=1 Win=43776 Len=0 TSval=1470197 TSecr=1470197
  183 1.998904224    127.0.0.1 → 127.0.0.1    Socks 71 Version: 5 Connect to server request
  184 1.998914475    127.0.0.1 → 127.0.0.1    TCP 68 1080 → 49316 [ACK] Seq=1 Ack=4 Win=43776 Len=0 TSval=1470197 TSecr=1470197
  185 1.998963454    127.0.0.1 → 127.0.0.1    Socks 70 Version: 5 Connect to server response
  186 1.998986262    127.0.0.1 → 127.0.0.1    TCP 68 49316 → 1080 [ACK] Seq=4 Ack=3 Win=43776 Len=0 TSval=1470197 TSecr=1470197
  187 1.999000493    127.0.0.1 → 127.0.0.1    Socks 90 Version: 5 Command Request - Connect
  188 1.999037972    127.0.0.1 → 127.0.0.1    Socks 71 Version: 5 Connect to server request
  189 1.999041424    127.0.0.1 → 127.0.0.1    TCP 68 1080 → 49318 [ACK] Seq=1 Ack=4 Win=43776 Len=0 TSval=1470197 TSecr=1470197
  190 1.999056114    127.0.0.1 → 127.0.0.1    Socks 71 Version: 5 Connect to server request
  191 1.999058517    127.0.0.1 → 127.0.0.1    TCP 68 1080 → 49320 [ACK] Seq=1 Ack=4 Win=43776 Len=0 TSval=1470197 TSecr=1470197
  192 1.999062832    127.0.0.1 → 127.0.0.1    Socks 70 Version: 5 Connect to server response
  193 1.999066033    127.0.0.1 → 127.0.0.1    TCP 68 49318 → 1080 [ACK] Seq=4 Ack=3 Win=43776 Len=0 TSval=1470197 TSecr=1470197
  194 1.999071154    127.0.0.1 → 127.0.0.1    Socks 71 Version: 5 Connect to server request
  195 1.999073364    127.0.0.1 → 127.0.0.1    TCP 68 1080 → 49322 [ACK] Seq=1 Ack=4 Win=43776 Len=0 TSval=1470197 TSecr=1470197
  196 1.999087845    127.0.0.1 → 127.0.0.1    Socks 90 Version: 5 Command Request - Connect
  197 1.999089848    127.0.0.1 → 127.0.0.1    Socks 70 Version: 5 Connect to server response
  198 1.999091200    127.0.0.1 → 127.0.0.1    TCP 68 49320 → 1080 [ACK] Seq=4 Ack=3 Win=43776 Len=0 TSval=1470197 TSecr=1470197
  199 1.999094718    127.0.0.1 → 127.0.0.1    Socks 70 Version: 5 Connect to server response
  200 1.999095853    127.0.0.1 → 127.0.0.1    TCP 68 49322 → 1080 [ACK] Seq=4 Ack=3 Win=43776 Len=0 TSval=1470197 TSecr=1470197
  201 1.999099899    127.0.0.1 → 127.0.0.1    Socks 90 Version: 5 Command Request - Connect
  202 1.999111217    127.0.0.1 → 127.0.0.1    Socks 91 Version: 5 Command Request - Connect
  203 1.999123387    127.0.0.1 → 127.0.0.1    Socks 71 Version: 5 Connect to server request
  204 1.999125928    127.0.0.1 → 127.0.0.1    TCP 68 1080 → 49324 [ACK] Seq=1 Ack=4 Win=43776 Len=0 TSval=1470197 TSecr=1470197
  205 1.999140171    127.0.0.1 → 127.0.0.1    Socks 71 Version: 5 Connect to server request
  206 1.999142527    127.0.0.1 → 127.0.0.1    TCP 68 1080 → 49326 [ACK] Seq=1 Ack=4 Win=43776 Len=0 TSval=1470197 TSecr=1470197
  207 1.999154359    127.0.0.1 → 127.0.0.1    Socks 70 Version: 5 Connect to server response
  208 1.999154903    127.0.0.1 → 127.0.0.1    Socks 71 Version: 5 Connect to server request
  209 1.999156210    127.0.0.1 → 127.0.0.1    TCP 68 49324 → 1080 [ACK] Seq=4 Ack=3 Win=43776 Len=0 TSval=1470197 TSecr=1470197
  210 1.999157373    127.0.0.1 → 127.0.0.1    TCP 68 1080 → 49328 [ACK] Seq=1 Ack=4 Win=43776 Len=0 TSval=1470197 TSecr=1470197
  211 1.999170202    127.0.0.1 → 127.0.0.1    Socks 91 Version: 5 Command Request - Connect
  212 1.999171711    127.0.0.1 → 127.0.0.1    Socks 70 Version: 5 Connect to server response
  213 1.999173035    127.0.0.1 → 127.0.0.1    TCP 68 49326 → 1080 [ACK] Seq=4 Ack=3 Win=43776 Len=0 TSval=1470197 TSecr=1470197
  214 1.999181310    127.0.0.1 → 127.0.0.1    Socks 100 Version: 5 Command Request - Connect
  215 1.999186069    127.0.0.1 → 127.0.0.1    Socks 70 Version: 5 Connect to server response
  216 1.999187294    127.0.0.1 → 127.0.0.1    TCP 68 49328 → 1080 [ACK] Seq=4 Ack=3 Win=43776 Len=0 TSval=1470197 TSecr=1470197
  217 1.999192218    127.0.0.1 → 127.0.0.1    Socks 71 Version: 5 Connect to server request
  218 1.999194554    127.0.0.1 → 127.0.0.1    TCP 68 1080 → 49330 [ACK] Seq=1 Ack=4 Win=43776 Len=0 TSval=1470197 TSecr=1470197
  219 1.999207475    127.0.0.1 → 127.0.0.1    Socks 94 Version: 5 Command Request - Connect
  220 1.999220688    127.0.0.1 → 127.0.0.1    Socks 71 Version: 5 Connect to server request
  221 1.999222976    127.0.0.1 → 127.0.0.1    TCP 68 1080 → 49332 [ACK] Seq=1 Ack=4 Win=43776 Len=0 TSval=1470197 TSecr=1470197
  222 1.999235053    127.0.0.1 → 127.0.0.1    Socks 70 Version: 5 Connect to server response
  223 1.999236451    127.0.0.1 → 127.0.0.1    TCP 68 49330 → 1080 [ACK] Seq=4 Ack=3 Win=43776 Len=0 TSval=1470197 TSecr=1470197
  224 1.999257932    127.0.0.1 → 127.0.0.1    Socks 70 Version: 5 Connect to server response
  225 1.999259319    127.0.0.1 → 127.0.0.1    TCP 68 49332 → 1080 [ACK] Seq=4 Ack=3 Win=43776 Len=0 TSval=1470197 TSecr=1470197
  226 1.999450188  10.6.15.145 → 192.168.1.16 TCP 68 22 → 52104 [ACK] Seq=3545 Ack=4573 Win=1452 Len=0 TSval=24284723 TSecr=1470197
  227 1.999459608 192.168.1.16 → 10.6.15.145  SSH 372 Client: Encrypted packet (len=304)
  228 1.999785185    127.0.0.1 → 127.0.0.1    Socks 94 Version: 5 Command Request - Connect
  229 1.999809687    127.0.0.1 → 127.0.0.1    Socks 94 Version: 5 Command Request - Connect
  230 1.999976799 192.168.1.16 → 10.6.15.145  SSH 140 Client: Encrypted packet (len=72)
  231 2.000419621  10.6.15.145 → 192.168.1.16 TCP 68 22 → 52104 [ACK] Seq=3545 Ack=4753 Win=1452 Len=0 TSval=24284723 TSecr=1470197
  232 2.001868289    127.0.0.1 → 127.0.0.1    TCP 68 49266 → 1080 [FIN, ACK] Seq=1656 Ack=865 Win=355 Len=0 TSval=1470198 TSecr=1470196
  233 2.001943654    127.0.0.1 → 127.0.0.1    TCP 76 49334 → 1080 [SYN] Seq=0 Win=43690 Len=0 MSS=65495 SACK_PERM=1 TSval=1470198 TSecr=0 WS=128
  234 2.001949281 192.168.1.16 → 10.6.15.145  SSH 104 Client: Encrypted packet (len=36)
  235 2.001949660    127.0.0.1 → 127.0.0.1    TCP 76 1080 → 49334 [SYN, ACK] Seq=0 Ack=1 Win=43690 Len=0 MSS=65495 SACK_PERM=1 TSval=1470198 TSecr=1470198 WS=128
  236 2.001956248    127.0.0.1 → 127.0.0.1    TCP 68 49334 → 1080 [ACK] Seq=1 Ack=1 Win=43776 Len=0 TSval=1470198 TSecr=1470198
  237 2.001989987    127.0.0.1 → 127.0.0.1    Socks 71 Version: 5 Connect to server request
  238 2.001994127    127.0.0.1 → 127.0.0.1    TCP 68 1080 → 49334 [ACK] Seq=1 Ack=4 Win=43776 Len=0 TSval=1470198 TSecr=1470198
  239 2.002016945    127.0.0.1 → 127.0.0.1    Socks 70 Version: 5 Connect to server response
  240 2.002020567    127.0.0.1 → 127.0.0.1    TCP 68 49334 → 1080 [ACK] Seq=4 Ack=3 Win=43776 Len=0 TSval=1470198 TSecr=1470198
  241 2.002054062    127.0.0.1 → 127.0.0.1    Socks 88 Version: 5 Command Request - Connect
  242 2.002198662 192.168.1.16 → 10.6.15.145  SSH 104 Client: Encrypted packet (len=36)
  243 2.002325533  10.6.15.145 → 192.168.1.16 TCP 68 22 → 52104 [ACK] Seq=3545 Ack=5129 Win=1452 Len=0 TSval=24284724 TSecr=1470197
  244 2.003632888  10.6.15.145 → 192.168.1.16 TCP 68 22 → 52104 [ACK] Seq=3545 Ack=5201 Win=1452 Len=0 TSval=24284724 TSecr=1470198
  245 2.010256676  10.6.15.145 → 192.168.1.16 SSH 140 Server: Encrypted packet (len=72)
  246 2.010437498 192.168.1.16 → 10.6.15.145  SSH 104 Client: Encrypted packet (len=36)
  247 2.015877023  10.6.15.145 → 192.168.1.16 SSH 140 Server: Encrypted packet (len=72)
  248 2.016104854 192.168.1.16 → 10.6.15.145  SSH 104 Client: Encrypted packet (len=36)
  249 2.022074368  10.6.15.145 → 192.168.1.16 SSH 140 Server: Encrypted packet (len=72)
  250 2.022263604 192.168.1.16 → 10.6.15.145  SSH 104 Client: Encrypted packet (len=36)
  251 2.038898824 192.168.1.16 → 239.255.255.250 SSDP 215 M-SEARCH * HTTP/1.1 
  252 2.040064462    127.0.0.1 → 127.0.0.1    TCP 68 47632 → 1080 [ACK] Seq=1218 Ack=47 Win=3637 Len=0 TSval=1470208 TSecr=1470197
  253 2.044104185    127.0.0.1 → 127.0.0.1    TCP 68 1080 → 49332 [ACK] Seq=3 Ack=30 Win=43776 Len=0 TSval=1470209 TSecr=1470197
  254 2.044107599    127.0.0.1 → 127.0.0.1    TCP 68 1080 → 49330 [ACK] Seq=3 Ack=30 Win=43776 Len=0 TSval=1470209 TSecr=1470197
  255 2.044109052    127.0.0.1 → 127.0.0.1    TCP 68 1080 → 49328 [ACK] Seq=3 Ack=30 Win=43776 Len=0 TSval=1470209 TSecr=1470197
  256 2.044110449    127.0.0.1 → 127.0.0.1    TCP 68 1080 → 49326 [ACK] Seq=3 Ack=36 Win=43776 Len=0 TSval=1470209 TSecr=1470197
  257 2.044112936    127.0.0.1 → 127.0.0.1    TCP 68 1080 → 49324 [ACK] Seq=3 Ack=27 Win=43776 Len=0 TSval=1470209 TSecr=1470197
  258 2.044114079    127.0.0.1 → 127.0.0.1    TCP 68 1080 → 49322 [ACK] Seq=3 Ack=27 Win=43776 Len=0 TSval=1470209 TSecr=1470197
  259 2.044115321    127.0.0.1 → 127.0.0.1    TCP 68 1080 → 49320 [ACK] Seq=3 Ack=26 Win=43776 Len=0 TSval=1470209 TSecr=1470197
  260 2.044116621    127.0.0.1 → 127.0.0.1    TCP 68 1080 → 49318 [ACK] Seq=3 Ack=26 Win=43776 Len=0 TSval=1470209 TSecr=1470197
  261 2.044118020    127.0.0.1 → 127.0.0.1    TCP 68 1080 → 49316 [ACK] Seq=3 Ack=26 Win=43776 Len=0 TSval=1470209 TSecr=1470197
  262 2.044122400    127.0.0.1 → 127.0.0.1    TCP 68 1080 → 49216 [ACK] Seq=1 Ack=2 Win=1373 Len=0 TSval=1470209 TSecr=1470197
  263 2.044123824    127.0.0.1 → 127.0.0.1    TCP 68 1080 → 49272 [ACK] Seq=11 Ack=2 Win=342 Len=0 TSval=1470209 TSecr=1470197
  264 2.044124974    127.0.0.1 → 127.0.0.1    TCP 68 1080 → 49268 [ACK] Seq=11 Ack=2 Win=342 Len=0 TSval=1470209 TSecr=1470197
  265 2.044126228    127.0.0.1 → 127.0.0.1    TCP 68 1080 → 49270 [ACK] Seq=11 Ack=2 Win=342 Len=0 TSval=1470209 TSecr=1470197
  266 2.044127859    127.0.0.1 → 127.0.0.1    TCP 68 1080 → 49242 [ACK] Seq=230 Ack=2 Win=355 Len=0 TSval=1470209 TSecr=1470197
  267 2.044129740    127.0.0.1 → 127.0.0.1    TCP 68 1080 → 49240 [ACK] Seq=1 Ack=2 Win=355 Len=0 TSval=1470209 TSecr=1470197
  268 2.044131193    127.0.0.1 → 127.0.0.1    TCP 68 1080 → 49334 [ACK] Seq=3 Ack=24 Win=43776 Len=0 TSval=1470209 TSecr=1470198
  269 2.044132774    127.0.0.1 → 127.0.0.1    TCP 68 1080 → 49266 [ACK] Seq=865 Ack=1657 Win=1365 Len=0 TSval=1470209 TSecr=1470198
  270 2.048064661 192.168.1.16 → 10.6.15.145  TCP 104 [TCP Retransmission] 52104 → 22 [PSH, ACK] Seq=5273 Ack=3761 Win=6157 Len=36 TSval=1470210 TSecr=24284728
  271 2.054622396  10.6.15.145 → 192.168.1.16 TCP 80 [TCP Dup ACK 247#1] 22 → 52104 [ACK] Seq=3761 Ack=5237 Win=1452 Len=0 TSval=24284737 TSecr=1470200 SLE=5273 SRE=5309
  272 2.054640886  10.6.15.145 → 192.168.1.16 TCP 88 [TCP Dup ACK 247#2] 22 → 52104 [ACK] Seq=3761 Ack=5237 Win=1452 Len=0 TSval=24284737 TSecr=1470200 SLE=5273 SRE=5309 SLE=5273 SRE=5309
  273 2.154787794  10.6.15.145 → 192.168.1.16 SSH 152 Server: Encrypted packet (len=72)
  274 2.154878346    127.0.0.1 → 127.0.0.1    TCP 68 1080 → 49266 [FIN, ACK] Seq=865 Ack=1657 Win=1365 Len=0 TSval=1470236 TSecr=1470198
  275 2.154888012    127.0.0.1 → 127.0.0.1    TCP 68 49266 → 1080 [ACK] Seq=1657 Ack=866 Win=355 Len=0 TSval=1470236 TSecr=1470236
  276 2.155000134 192.168.1.16 → 10.6.15.145  SSH 104 Client: Encrypted packet (len=36)
  277 2.156637391  10.6.15.145 → 192.168.1.16 TCP 80 [TCP Dup ACK 247#3] 22 → 52104 [ACK] Seq=3833 Ack=5237 Win=1452 Len=0 TSval=24284762 TSecr=1470200 SLE=5273 SRE=5345
  278 2.178196795  10.6.15.145 → 192.168.1.16 SSH 196 Server: Encrypted packet (len=116)
  279 2.178301690    127.0.0.1 → 127.0.0.1    Socks 155 Unknown
  280 2.178305885    127.0.0.1 → 127.0.0.1    TCP 68 47632 → 1080 [ACK] Seq=1218 Ack=134 Win=3637 Len=0 TSval=1470242 TSecr=1470242
  281 2.178403710  10.6.15.145 → 192.168.1.16 SSH 1516 Server: Encrypted packet (len=1436)
  282 2.178415329 192.168.1.16 → 10.6.15.145  TCP 68 52104 → 22 [ACK] Seq=5345 Ack=5385 Win=6157 Len=0 TSval=1470242 TSecr=24284767
  283 2.178426159  10.6.15.145 → 192.168.1.16 SSH 104 Server: Encrypted packet (len=24)
  284 2.178479125    127.0.0.1 → 127.0.0.1    Socks 1486 Unknown
  285 2.178482301    127.0.0.1 → 127.0.0.1    TCP 68 47632 → 1080 [ACK] Seq=1218 Ack=1552 Win=3637 Len=0 TSval=1470242 TSecr=1470242
  286 2.180495012  10.6.15.145 → 192.168.1.16 SSH 1516 Server: Encrypted packet (len=1436)
  287 2.180505321 192.168.1.16 → 10.6.15.145  TCP 68 52104 → 22 [ACK] Seq=5345 Ack=6845 Win=6157 Len=0 TSval=1470243 TSecr=24284768
  288 2.180589930  10.6.15.145 → 192.168.1.16 SSH 868 Server: Encrypted packet (len=788)
  289 2.180641540    127.0.0.1 → 127.0.0.1    Socks 78 Version: 5, Remote Port: 80 Command Response - Connect
  290 2.180650197    127.0.0.1 → 127.0.0.1    Socks 2215 Unknown
  291 2.180652072    127.0.0.1 → 127.0.0.1    TCP 68 47632 → 1080 [ACK] Seq=1218 Ack=3699 Win=3637 Len=0 TSval=1470243 TSecr=1470243
  292 2.180722143  10.6.15.145 → 192.168.1.16 SSH 116 Server: Encrypted packet (len=36)
  293 2.180750343 192.168.1.16 → 10.6.15.145  TCP 68 52104 → 22 [ACK] Seq=5345 Ack=7669 Win=6157 Len=0 TSval=1470243 TSecr=24284768
  294 2.180776504    127.0.0.1 → 127.0.0.1    Socks 78 Version: 5, Remote Port: 80 Command Response - Connect
  295 2.182626698  10.6.15.145 → 192.168.1.16 SSH 588 Server: Encrypted packet (len=508)
  296 2.182689790  10.6.15.145 → 192.168.1.16 SSH 116 Server: Encrypted packet (len=36)
  297 2.182716391 192.168.1.16 → 10.6.15.145  TCP 68 52104 → 22 [ACK] Seq=5345 Ack=8213 Win=6157 Len=0 TSval=1470243 TSecr=24284769
  298 2.182771990    127.0.0.1 → 127.0.0.1    Socks 537 Unknown
  299 2.182775889    127.0.0.1 → 127.0.0.1    TCP 68 47632 → 1080 [ACK] Seq=1218 Ack=4168 Win=3637 Len=0 TSval=1470243 TSecr=1470243
  300 2.182785968    127.0.0.1 → 127.0.0.1    Socks 78 Version: 5, Remote Port: 443 Command Response - Connect
  301 2.183128753    127.0.0.1 → 127.0.0.1    Socks 114 Unknown
  302 2.183213710 192.168.1.16 → 10.6.15.145  SSH 144 Client: Encrypted packet (len=76)
  303 2.183293072    127.0.0.1 → 127.0.0.1    SSL 281 Client Hello
  304 2.183301924    127.0.0.1 → 127.0.0.1    TCP 68 1080 → 49326 [ACK] Seq=13 Ack=249 Win=44800 Len=0 TSval=1470243 TSecr=1470243
  305 2.183438813 192.168.1.16 → 10.6.15.145  SSH 184 Client: Encrypted packet (len=116)
  306 2.184618232  10.6.15.145 → 192.168.1.16 TCP 80 [TCP Dup ACK 247#4] 22 → 52104 [ACK] Seq=8213 Ack=5237 Win=1452 Len=0 TSval=24284769 TSecr=1470200 SLE=5273 SRE=5421
  307 2.184633809 192.168.1.16 → 10.6.15.145  SSH 104 Client: [TCP Fast Retransmission] , Encrypted packet (len=36)
  308 2.184646738  10.6.15.145 → 192.168.1.16 TCP 80 [TCP Dup ACK 247#5] 22 → 52104 [ACK] Seq=8213 Ack=5237 Win=1452 Len=0 TSval=24284769 TSecr=1470200 SLE=5273 SRE=5537
  309 2.184679018    127.0.0.1 → 127.0.0.1    Socks 196 Unknown
  310 2.184709676    127.0.0.1 → 127.0.0.1    Socks 2533 Unknown
  311 2.184723621    127.0.0.1 → 127.0.0.1    TCP 68 1080 → 47632 [ACK] Seq=4168 Ack=3857 Win=3637 Len=0 TSval=1470244 TSecr=1470243
  312 2.184988980 192.168.1.16 → 10.6.15.145  SSH 1516 Client: Encrypted packet (len=1448)
  313 2.186169590  10.6.15.145 → 192.168.1.16 TCP 68 22 → 52104 [ACK] Seq=8213 Ack=5537 Win=1450 Len=0 TSval=24284770 TSecr=1470244
  314 2.186193866 192.168.1.16 → 10.6.15.145  SSH 1256 Client: Encrypted packet (len=1188)
  315 2.187574800  10.6.15.145 → 192.168.1.16 TCP 68 22 → 52104 [ACK] Seq=8213 Ack=6985 Win=1452 Len=0 TSval=24284770 TSecr=1470244
  316 2.188504585  10.6.15.145 → 192.168.1.16 TCP 68 22 → 52104 [ACK] Seq=8213 Ack=8173 Win=1452 Len=0 TSval=24284770 TSecr=1470244
  317 2.214663093  10.6.15.145 → 192.168.1.16 SSH 140 Server: Encrypted packet (len=72)
  318 2.214685141  10.6.15.145 → 192.168.1.16 SSH 140 Server: Encrypted packet (len=72)
  319 2.214691322  10.6.15.145 → 192.168.1.16 SSH 140 Server: Encrypted packet (len=72)
  320 2.214750652 192.168.1.16 → 10.6.15.145  TCP 68 52104 → 22 [ACK] Seq=8173 Ack=8429 Win=6157 Len=0 TSval=1470251 TSecr=24284777
  321 2.214778287    127.0.0.1 → 127.0.0.1    TCP 68 1080 → 49242 [FIN, ACK] Seq=230 Ack=2 Win=355 Len=0 TSval=1470251 TSecr=1470197
  322 2.214788694    127.0.0.1 → 127.0.0.1    TCP 68 49242 → 1080 [ACK] Seq=2 Ack=231 Win=350 Len=0 TSval=1470251 TSecr=1470251
  323 2.214801972    127.0.0.1 → 127.0.0.1    TCP 68 1080 → 49268 [FIN, ACK] Seq=11 Ack=2 Win=342 Len=0 TSval=1470251 TSecr=1470197
  324 2.214804014    127.0.0.1 → 127.0.0.1    TCP 68 49268 → 1080 [ACK] Seq=2 Ack=12 Win=342 Len=0 TSval=1470251 TSecr=1470251
  325 2.214811829    127.0.0.1 → 127.0.0.1    TCP 68 1080 → 49270 [FIN, ACK] Seq=11 Ack=2 Win=342 Len=0 TSval=1470251 TSecr=1470197
  326 2.214813171    127.0.0.1 → 127.0.0.1    TCP 68 49270 → 1080 [ACK] Seq=2 Ack=12 Win=342 Len=0 TSval=1470251 TSecr=1470251
  327 2.215040779 192.168.1.16 → 10.6.15.145  SSH 176 Client: Encrypted packet (len=108)
  328 2.215534410  10.6.15.145 → 192.168.1.16 SSH 272 Server: Encrypted packet (len=204)
  329 2.215569322    127.0.0.1 → 127.0.0.1    TCP 68 1080 → 49240 [FIN, ACK] Seq=1 Ack=2 Win=355 Len=0 TSval=1470251 TSecr=1470197
  330 2.215574013    127.0.0.1 → 127.0.0.1    TCP 68 49240 → 1080 [ACK] Seq=2 Ack=2 Win=350 Len=0 TSval=1470251 TSecr=1470251
  331 2.215582955    127.0.0.1 → 127.0.0.1    TCP 68 1080 → 49272 [FIN, ACK] Seq=11 Ack=2 Win=342 Len=0 TSval=1470251 TSecr=1470197
  332 2.215584767    127.0.0.1 → 127.0.0.1    TCP 68 49272 → 1080 [ACK] Seq=2 Ack=12 Win=342 Len=0 TSval=1470251 TSecr=1470251
  333 2.215714702    127.0.0.1 → 127.0.0.1    Socks 99 Unknown
  334 2.215717699    127.0.0.1 → 127.0.0.1    TCP 56 49216 → 1080 [RST] Seq=2 Win=0 Len=0
  335 2.215724935 192.168.1.16 → 10.6.15.145  SSH 140 Client: Encrypted packet (len=72)
  336 2.216901659  10.6.15.145 → 192.168.1.16 SSH 140 Server: Encrypted packet (len=72)
  337 2.217071058 192.168.1.16 → 10.6.15.145  SSH 104 Client: Encrypted packet (len=36)
  338 2.217454906  10.6.15.145 → 192.168.1.16 SSH 104 Server: Encrypted packet (len=36)
  339 2.217509020    127.0.0.1 → 127.0.0.1    Socks 78 Version: 5, Remote Port: 443 Command Response - Connect
  340 2.217604673  10.6.15.145 → 192.168.1.16 SSH 140 Server: Encrypted packet (len=72)
  341 2.217621508 192.168.1.16 → 10.6.15.145  TCP 68 52104 → 22 [ACK] Seq=8389 Ack=8813 Win=6157 Len=0 TSval=1470252 TSecr=24284777
  342 2.217623087    127.0.0.1 → 127.0.0.1    SSL 275 Client Hello
  343 2.217629689    127.0.0.1 → 127.0.0.1    TCP 68 1080 → 49328 [ACK] Seq=13 Ack=237 Win=44800 Len=0 TSval=1470252 TSecr=1470252
  344 2.217649893    127.0.0.1 → 127.0.0.1    Socks 78 Version: 5, Remote Port: 443 Command Response - Connect
  345 2.217659242    127.0.0.1 → 127.0.0.1    Socks 78 Version: 5, Remote Port: 80 Command Response - Connect
  346 2.217717627 192.168.1.16 → 10.6.15.145  SSH 168 Client: Encrypted packet (len=100)
  347 2.217913698    127.0.0.1 → 127.0.0.1    SSL 275 Client Hello
  348 2.217923369    127.0.0.1 → 127.0.0.1    TCP 68 1080 → 49332 [ACK] Seq=13 Ack=237 Win=44800 Len=0 TSval=1470252 TSecr=1470252
  349 2.218027915    127.0.0.1 → 127.0.0.1    HTTP 1808 GET / HTTP/1.1 
  350 2.218034409    127.0.0.1 → 127.0.0.1    TCP 68 1080 → 49334 [ACK] Seq=13 Ack=1764 Win=174720 Len=0 TSval=1470252 TSecr=1470252
  351 2.218109178 192.168.1.16 → 10.6.15.145  SSH 160 Client: Encrypted packet (len=92)
  352 2.220316414  10.6.15.145 → 192.168.1.16 TCP 68 22 → 52104 [ACK] Seq=8813 Ack=8489 Win=1452 Len=0 TSval=24284778 TSecr=1470252
  353 2.220332066 192.168.1.16 → 10.6.15.145  SSH 136 Client: Encrypted packet (len=68)
  354 2.224074862    127.0.0.1 → 127.0.0.1    TCP 68 49322 → 1080 [ACK] Seq=27 Ack=13 Win=43776 Len=0 TSval=1470254 TSecr=1470243
  355 2.224076870    127.0.0.1 → 127.0.0.1    TCP 68 49324 → 1080 [ACK] Seq=27 Ack=13 Win=43776 Len=0 TSval=1470254 TSecr=1470243
  356 2.224263179  10.6.15.145 → 192.168.1.16 TCP 68 22 → 52104 [ACK] Seq=8813 Ack=8649 Win=1452 Len=0 TSval=24284779 TSecr=1470252
  357 2.231679356  10.6.15.145 → 192.168.1.16 SSH 104 Server: Encrypted packet (len=36)
