    1 0.000000000 192.168.1.12 → 10.6.15.156  SSH 126 Client: Encrypted packet (len=60)
    2 0.040973937  10.6.15.156 → 192.168.1.12 TCP 66 22 → 54766 [ACK] Seq=1 Ack=61 Win=1452 Len=0 TSval=14479972 TSecr=7548468
    3 0.138156056 192.168.1.12 → 10.6.15.156  SSH 862 Client: Encrypted packet (len=796)
    4 0.140042677 192.168.1.12 → 10.6.15.156  SSH 1514 Client: Encrypted packet (len=1448)
    5 0.140867183 192.168.1.12 → 10.6.15.156  SSH 210 Client: Encrypted packet (len=144)
    6 0.140950589  10.6.15.156 → 192.168.1.12 TCP 66 22 → 54766 [ACK] Seq=1 Ack=857 Win=1452 Len=0 TSval=14479997 TSecr=7548503
    7 0.142689972  10.6.15.156 → 192.168.1.12 TCP 66 22 → 54766 [ACK] Seq=1 Ack=2305 Win=1452 Len=0 TSval=14479997 TSecr=7548503
    8 0.142706637 192.168.1.12 → 10.6.15.156  SSH 862 Client: Encrypted packet (len=796)
    9 0.142718724  10.6.15.156 → 192.168.1.12 TCP 66 22 → 54766 [ACK] Seq=1 Ack=2449 Win=1452 Len=0 TSval=14479997 TSecr=7548504
   10 0.145411899  10.6.15.156 → 192.168.1.12 TCP 66 22 → 54766 [ACK] Seq=1 Ack=3245 Win=1452 Len=0 TSval=14479998 TSecr=7548504
   11 0.152003699 192.168.1.12 → 10.6.15.156  SSH 838 Client: Encrypted packet (len=772)
   12 0.152537771 192.168.1.12 → 10.6.15.156  SSH 142 Client: Encrypted packet (len=76)
   13 0.154179029  10.6.15.156 → 192.168.1.12 TCP 66 22 → 54766 [ACK] Seq=1 Ack=4017 Win=1452 Len=0 TSval=14480000 TSecr=7548506
   14 0.154198846  10.6.15.156 → 192.168.1.12 TCP 66 22 → 54766 [ACK] Seq=1 Ack=4093 Win=1452 Len=0 TSval=14480000 TSecr=7548507
   15 0.162692919  10.6.15.156 → 192.168.1.12 SSH 1514 Server: Encrypted packet (len=1448)
   16 0.162708685 192.168.1.12 → 10.6.15.156  TCP 66 54766 → 22 [ACK] Seq=4093 Ack=1449 Win=4866 Len=0 TSval=7548509 TSecr=14480001
   17 0.162797803  10.6.15.156 → 192.168.1.12 SSH 958 Server: Encrypted packet (len=892)
   18 0.162800918 192.168.1.12 → 10.6.15.156  TCP 66 54766 → 22 [ACK] Seq=4093 Ack=2341 Win=4866 Len=0 TSval=7548509 TSecr=14480001
   19 0.163643415 192.168.1.12 → 10.6.15.156  SSH 206 Client: Encrypted packet (len=140)
   20 0.204044296  10.6.15.156 → 192.168.1.12 TCP 66 22 → 54766 [ACK] Seq=2341 Ack=4233 Win=1452 Len=0 TSval=14480013 TSecr=7548509
   21 0.211960075 192.168.1.12 → 10.6.15.156  SSH 110 Client: Encrypted packet (len=44)
   22 0.214177500  10.6.15.156 → 192.168.1.12 TCP 66 22 → 54766 [ACK] Seq=2341 Ack=4277 Win=1452 Len=0 TSval=14480015 TSecr=7548521
   23 0.217990687  10.6.15.156 → 192.168.1.12 SSH 110 Server: Encrypted packet (len=44)
   24 0.218859461 192.168.1.12 → 10.6.15.156  SSH 414 Client: Encrypted packet (len=348)
   25 0.260034906  10.6.15.156 → 192.168.1.12 TCP 66 22 → 54766 [ACK] Seq=2385 Ack=4625 Win=1452 Len=0 TSval=14480027 TSecr=7548523
   26 0.294438259 192.168.1.12 → 10.6.15.156  SSH 430 Client: Encrypted packet (len=364)
   27 0.296193577  10.6.15.156 → 192.168.1.12 TCP 66 22 → 54766 [ACK] Seq=2385 Ack=4989 Win=1452 Len=0 TSval=14480036 TSecr=7548542
   28 0.299511097 192.168.1.12 → 10.6.15.156  SSH 118 Client: Encrypted packet (len=52)
   29 0.300867114  10.6.15.156 → 192.168.1.12 TCP 66 22 → 54766 [ACK] Seq=2385 Ack=5041 Win=1452 Len=0 TSval=14480037 TSecr=7548543
   30 0.301005671 192.168.1.12 → 10.6.15.156  SSH 286 Client: Encrypted packet (len=220)
   31 0.302460054  10.6.15.156 → 192.168.1.12 TCP 66 22 → 54766 [ACK] Seq=2385 Ack=5261 Win=1452 Len=0 TSval=14480037 TSecr=7548544
   32 0.312400474  10.6.15.156 → 192.168.1.12 SSH 102 Server: Encrypted packet (len=36)
   33 0.312738869 192.168.1.12 → 10.6.15.156  SSH 374 Client: Encrypted packet (len=308)
   34 0.352323479  10.6.15.156 → 192.168.1.12 TCP 66 22 → 54766 [ACK] Seq=2421 Ack=5569 Win=1452 Len=0 TSval=14480050 TSecr=7548547
   35 0.352355917 192.168.1.12 → 10.6.15.156  SSH 1326 Client: Encrypted packet (len=1260)
   36 0.354849969  10.6.15.156 → 192.168.1.12 TCP 66 22 → 54766 [ACK] Seq=2421 Ack=6829 Win=1452 Len=0 TSval=14480050 TSecr=7548556
   37 0.355618606 192.168.1.12 → 10.6.15.156  SSH 126 Client: Encrypted packet (len=60)
   38 0.357535727  10.6.15.156 → 192.168.1.12 TCP 66 22 → 54766 [ACK] Seq=2421 Ack=6889 Win=1452 Len=0 TSval=14480051 TSecr=7548557
   39 0.357719462  10.6.15.156 → 192.168.1.12 SSH 454 Server: Encrypted packet (len=388)
   40 0.357905005  10.6.15.156 → 192.168.1.12 SSH 454 Server: Encrypted packet (len=388)
   41 0.357937558 192.168.1.12 → 10.6.15.156  TCP 66 54766 → 22 [ACK] Seq=6889 Ack=3197 Win=4866 Len=0 TSval=7548558 TSecr=14480051
   42 0.358741004  10.6.15.156 → 192.168.1.12 SSH 454 Server: Encrypted packet (len=388)
   43 0.359736608  10.6.15.156 → 192.168.1.12 SSH 454 Server: Encrypted packet (len=388)
   44 0.359801473 192.168.1.12 → 10.6.15.156  TCP 66 54766 → 22 [ACK] Seq=6889 Ack=3973 Win=4866 Len=0 TSval=7548558 TSecr=14480051
   45 0.370634204  10.6.15.156 → 192.168.1.12 SSH 334 Server: Encrypted packet (len=268)
   46 0.410361606  10.6.15.156 → 192.168.1.12 SSH 214 Server: Encrypted packet (len=148)
   47 0.410381995 192.168.1.12 → 10.6.15.156  TCP 66 54766 → 22 [ACK] Seq=6889 Ack=4389 Win=4866 Len=0 TSval=7548571 TSecr=14480054
   48 0.410734391 192.168.1.12 → 10.6.15.156  SSH 134 Client: Encrypted packet (len=68)
   49 0.411716867  10.6.15.156 → 192.168.1.12 SSH 334 Server: Encrypted packet (len=268)
   50 0.428938663  10.6.15.156 → 192.168.1.12 SSH 110 Server: Encrypted packet (len=44)
   51 0.429016845 192.168.1.12 → 10.6.15.156  TCP 66 54766 → 22 [ACK] Seq=6957 Ack=4701 Win=4866 Len=0 TSval=7548576 TSecr=14480064
   52 0.429719318 192.168.1.12 → 10.6.15.156  SSH 206 Client: Encrypted packet (len=140)
   53 0.437017942  10.6.15.156 → 192.168.1.12 SSH 230 Server: Encrypted packet (len=164)
   54 0.437282464 192.168.1.12 → 10.6.15.156  SSH 134 Client: Encrypted packet (len=68)
   55 0.459867156  10.6.15.156 → 192.168.1.12 SSH 422 Server: Encrypted packet (len=356)
   56 0.459889571 192.168.1.12 → 10.6.15.156  SSH 550 Client: Encrypted packet (len=484)
   57 0.500006992  10.6.15.156 → 192.168.1.12 TCP 66 22 → 54766 [ACK] Seq=5221 Ack=7649 Win=1452 Len=0 TSval=14480087 TSecr=7548583
   58 0.505019580  10.6.15.156 → 192.168.1.12 SSH 1514 Server: Encrypted packet (len=1448)
   59 0.505154215  10.6.15.156 → 192.168.1.12 SSH 1198 Server: Encrypted packet (len=1132)
   60 0.505165099 192.168.1.12 → 10.6.15.156  TCP 66 54766 → 22 [ACK] Seq=7649 Ack=7801 Win=4866 Len=0 TSval=7548595 TSecr=14480088
   61 0.505847446 192.168.1.12 → 10.6.15.156  SSH 454 Client: Encrypted packet (len=388)
   62 0.507683022  10.6.15.156 → 192.168.1.12 TCP 66 22 → 54766 [ACK] Seq=7801 Ack=8037 Win=1452 Len=0 TSval=14480088 TSecr=7548595
   63 0.512082753  10.6.15.156 → 192.168.1.12 SSH 150 Server: Encrypted packet (len=84)
   64 0.517685262  10.6.15.156 → 192.168.1.12 SSH 102 Server: Encrypted packet (len=36)
   65 0.517753647 192.168.1.12 → 10.6.15.156  TCP 66 54766 → 22 [ACK] Seq=8037 Ack=7921 Win=4866 Len=0 TSval=7548598 TSecr=14480090
   66 0.518107262 192.168.1.12 → 10.6.15.156  SSH 430 Client: Encrypted packet (len=364)
   67 0.554752157  10.6.15.156 → 192.168.1.12 SSH 1514 Server: Encrypted packet (len=1448)
   68 0.554921402  10.6.15.156 → 192.168.1.12 SSH 1478 Server: Encrypted packet (len=1412)
   69 0.554933688 192.168.1.12 → 10.6.15.156  TCP 66 54766 → 22 [ACK] Seq=8401 Ack=10781 Win=4866 Len=0 TSval=7548607 TSecr=14480100
   70 0.555100698  10.6.15.156 → 192.168.1.12 SSH 430 Server: Encrypted packet (len=364)
   71 0.582165142  10.6.15.156 → 192.168.1.12 SSH 174 Server: Encrypted packet (len=108)
   72 0.582242591 192.168.1.12 → 10.6.15.156  TCP 66 54766 → 22 [ACK] Seq=8401 Ack=11253 Win=4866 Len=0 TSval=7548614 TSecr=14480100
   73 0.583158001 192.168.1.12 → 10.6.15.156  SSH 710 Client: Encrypted packet (len=644)
   74 0.624002501  10.6.15.156 → 192.168.1.12 TCP 66 22 → 54766 [ACK] Seq=11253 Ack=9045 Win=1452 Len=0 TSval=14480118 TSecr=7548614
   75 0.624025821 192.168.1.12 → 10.6.15.156  SSH 570 Client: Encrypted packet (len=504)
   76 0.626454002  10.6.15.156 → 192.168.1.12 TCP 66 22 → 54766 [ACK] Seq=11253 Ack=9549 Win=1452 Len=0 TSval=14480118 TSecr=7548624
   77 0.628329088  10.6.15.156 → 192.168.1.12 SSH 142 Server: Encrypted packet (len=76)
   78 0.660762968  10.6.15.156 → 192.168.1.12 SSH 470 Server: Encrypted packet (len=404)
   79 0.660779731 192.168.1.12 → 10.6.15.156  TCP 66 54766 → 22 [ACK] Seq=9549 Ack=11733 Win=4866 Len=0 TSval=7548634 TSecr=14480119
   80 0.662620907  10.6.15.156 → 192.168.1.12 SSH 918 Server: Encrypted packet (len=852)
   81 0.663616208 192.168.1.12 → 10.6.15.156  SSH 134 Client: Encrypted packet (len=68)
   82 0.703985345  10.6.15.156 → 192.168.1.12 TCP 66 22 → 54766 [ACK] Seq=12585 Ack=9617 Win=1452 Len=0 TSval=14480138 TSecr=7548634
   83 0.704006095 192.168.1.12 → 10.6.15.156  SSH 242 Client: Encrypted packet (len=176)
   84 0.706038315  10.6.15.156 → 192.168.1.12 TCP 66 22 → 54766 [ACK] Seq=12585 Ack=9793 Win=1452 Len=0 TSval=14480138 TSecr=7548644
   85 0.739796356  10.6.15.156 → 192.168.1.12 SSH 238 Server: Encrypted packet (len=172)
   86 0.740048103 192.168.1.12 → 10.6.15.156  SSH 134 Client: Encrypted packet (len=68)
   87 0.740574965  10.6.15.156 → 192.168.1.12 SSH 110 Server: Encrypted packet (len=44)
   88 0.740802133 192.168.1.12 → 10.6.15.156  SSH 1514 Client: Encrypted packet (len=1448)
   89 0.741616635 192.168.1.12 → 10.6.15.156  SSH 210 Client: Encrypted packet (len=144)
   90 0.743644643  10.6.15.156 → 192.168.1.12 TCP 66 22 → 54766 [ACK] Seq=12801 Ack=11453 Win=1452 Len=0 TSval=14480147 TSecr=7548653
   91 0.780845831  10.6.15.156 → 192.168.1.12 SSH 206 Server: Encrypted packet (len=140)
   92 0.781362099 192.168.1.12 → 10.6.15.156  SSH 302 Client: Encrypted packet (len=236)
   93 0.820128240  10.6.15.156 → 192.168.1.12 TCP 66 22 → 54766 [ACK] Seq=12941 Ack=11689 Win=1452 Len=0 TSval=14480167 TSecr=7548664
   94 0.820148279 192.168.1.12 → 10.6.15.156  SSH 834 Client: Encrypted packet (len=768)
   95 0.822719789  10.6.15.156 → 192.168.1.12 TCP 66 22 → 54766 [ACK] Seq=12941 Ack=12457 Win=1452 Len=0 TSval=14480167 TSecr=7548673
   96 0.857200560  10.6.15.156 → 192.168.1.12 SSH 198 Server: Encrypted packet (len=132)
   97 0.857496967 192.168.1.12 → 10.6.15.156  SSH 134 Client: Encrypted packet (len=68)
   98 0.858024310  10.6.15.156 → 192.168.1.12 SSH 974 Server: Encrypted packet (len=908)
   99 0.896002072  10.6.15.156 → 192.168.1.12 TCP 66 22 → 54766 [ACK] Seq=13981 Ack=12525 Win=1452 Len=0 TSval=14480186 TSecr=7548683
  100 0.896021127 192.168.1.12 → 10.6.15.156  SSH 134 Client: Encrypted packet (len=68)
  101 0.898212874  10.6.15.156 → 192.168.1.12 TCP 66 22 → 54766 [ACK] Seq=13981 Ack=12593 Win=1452 Len=0 TSval=14480186 TSecr=7548692
  102 0.919857817  10.6.15.156 → 192.168.1.12 SSH 126 Server: Encrypted packet (len=60)
  103 0.919876503  10.6.15.156 → 192.168.1.12 SSH 138 Server: Encrypted packet (len=72)
  104 0.919924250 192.168.1.12 → 10.6.15.156  TCP 66 54766 → 22 [ACK] Seq=12593 Ack=14113 Win=4866 Len=0 TSval=7548698 TSecr=14480191
  105 0.920070902 192.168.1.12 → 10.6.15.156  SSH 102 Client: Encrypted packet (len=36)
  106 0.921341715  10.6.15.156 → 192.168.1.12 SSH 138 Server: Encrypted packet (len=72)
  107 0.923907294  10.6.15.156 → 192.168.1.12 SSH 110 Server: Encrypted packet (len=44)
  108 0.923921896 192.168.1.12 → 10.6.15.156  SSH 102 Client: Encrypted packet (len=36)
  109 0.924245932 192.168.1.12 → 10.6.15.156  SSH 198 Client: Encrypted packet (len=132)
  110 0.925685185  10.6.15.156 → 192.168.1.12 TCP 66 22 → 54766 [ACK] Seq=14229 Ack=12797 Win=1452 Len=0 TSval=14480193 TSecr=7548699
  111 0.946205904  10.6.15.156 → 192.168.1.12 SSH 542 Server: Encrypted packet (len=476)
  112 0.961382473  10.6.15.156 → 192.168.1.12 SSH 326 Server: Encrypted packet (len=260)
  113 0.961442439 192.168.1.12 → 10.6.15.156  TCP 66 54766 → 22 [ACK] Seq=12797 Ack=14965 Win=4866 Len=0 TSval=7548709 TSecr=14480198
  114 1.140182621 192.168.1.12 → 10.6.15.156  SSH 862 Client: Encrypted packet (len=796)
  115 1.145745233  10.6.15.156 → 192.168.1.12 SSH 1246 Server: Encrypted packet (len=1180)
  116 1.146508901 192.168.1.12 → 10.6.15.156  SSH 446 Client: Encrypted packet (len=380)
  117 1.188031176  10.6.15.156 → 192.168.1.12 TCP 66 22 → 54766 [ACK] Seq=16145 Ack=13973 Win=1452 Len=0 TSval=14480259 TSecr=7548755
  118 1.359450700  10.6.15.156 → 192.168.1.12 SSH 462 Server: Encrypted packet (len=396)
  119 1.370193919  10.6.15.156 → 192.168.1.12 SSH 174 Server: Encrypted packet (len=108)
  120 1.370259470 192.168.1.12 → 10.6.15.156  TCP 66 54766 → 22 [ACK] Seq=13973 Ack=16649 Win=4866 Len=0 TSval=7548811 TSecr=14480301
  121 1.371740156 192.168.1.12 → 10.6.15.156  SSH 710 Client: Encrypted packet (len=644)
  122 1.373724947  10.6.15.156 → 192.168.1.12 TCP 66 22 → 54766 [ACK] Seq=16649 Ack=14617 Win=1452 Len=0 TSval=14480305 TSecr=7548811
  123 1.601932695  10.6.15.156 → 192.168.1.12 SSH 1174 Server: Encrypted packet (len=1108)
  124 1.644369170 192.168.1.12 → 10.6.15.156  TCP 66 54766 → 22 [ACK] Seq=14617 Ack=17757 Win=4866 Len=0 TSval=7548880 TSecr=14480362
  125 1.644769210 192.168.1.12 → 10.6.15.156  SSH 102 Client: Encrypted packet (len=36)
  126 1.646680591 192.168.1.12 → 10.6.15.156  SSH 182 Client: Encrypted packet (len=116)
  127 1.647900238  10.6.15.156 → 192.168.1.12 TCP 66 22 → 54766 [ACK] Seq=17757 Ack=14653 Win=1452 Len=0 TSval=14480374 TSecr=7548880
  128 1.647913332  10.6.15.156 → 192.168.1.12 TCP 66 22 → 54766 [ACK] Seq=17757 Ack=14769 Win=1452 Len=0 TSval=14480374 TSecr=7548880
  129 1.651509109 192.168.1.12 → 10.6.15.156  SSH 286 Client: Encrypted packet (len=220)
  130 1.651817032 192.168.1.12 → 10.6.15.156  SSH 142 Client: Encrypted packet (len=76)
  131 1.653092082  10.6.15.156 → 192.168.1.12 TCP 66 22 → 54766 [ACK] Seq=17757 Ack=14989 Win=1452 Len=0 TSval=14480375 TSecr=7548881
  132 1.653109385  10.6.15.156 → 192.168.1.12 TCP 66 22 → 54766 [ACK] Seq=17757 Ack=15065 Win=1452 Len=0 TSval=14480375 TSecr=7548881
  133 1.656298454  10.6.15.156 → 192.168.1.12 SSH 142 Server: Encrypted packet (len=76)
  134 1.656314629 192.168.1.12 → 10.6.15.156  TCP 66 54766 → 22 [ACK] Seq=15065 Ack=17833 Win=4866 Len=0 TSval=7548882 TSecr=14480376
  135 1.690608318 192.168.1.12 → 10.6.15.156  SSH 102 Client: Encrypted packet (len=36)
  136 1.703431893  10.6.15.156 → 192.168.1.12 SSH 1382 Server: Encrypted packet (len=1316)
  137 1.703460924 192.168.1.12 → 10.6.15.156  SSH 270 Client: Encrypted packet (len=204)
  138 1.744036664  10.6.15.156 → 192.168.1.12 TCP 66 22 → 54766 [ACK] Seq=19149 Ack=15305 Win=1452 Len=0 TSval=14480398 TSecr=7548894
  139 1.744061012 192.168.1.12 → 10.6.15.156  SSH 134 Client: Encrypted packet (len=68)
  140 1.745606094  10.6.15.156 → 192.168.1.12 TCP 66 22 → 54766 [ACK] Seq=19149 Ack=15373 Win=1452 Len=0 TSval=14480398 TSecr=7548904
  141 1.781833970 192.168.1.12 → 10.6.15.156  SSH 582 Client: Encrypted packet (len=516)
  142 1.783683028  10.6.15.156 → 192.168.1.12 TCP 66 22 → 54766 [ACK] Seq=19149 Ack=15889 Win=1452 Len=0 TSval=14480407 TSecr=7548914
  143 1.783698013 192.168.1.12 → 10.6.15.156  SSH 294 Client: Encrypted packet (len=228)
  144 1.785780506  10.6.15.156 → 192.168.1.12 TCP 66 22 → 54766 [ACK] Seq=19149 Ack=16117 Win=1452 Len=0 TSval=14480408 TSecr=7548914
  145 1.833604600  10.6.15.156 → 192.168.1.12 SSH 1514 Server: Encrypted packet (len=1448)
  146 1.833620721  10.6.15.156 → 192.168.1.12 SSH 142 Server: Encrypted packet (len=76)
  147 1.833629726 192.168.1.12 → 10.6.15.156  TCP 66 54766 → 22 [ACK] Seq=16117 Ack=20673 Win=4866 Len=0 TSval=7548927 TSecr=14480420
  148 1.834286325 192.168.1.12 → 10.6.15.156  SSH 134 Client: Encrypted packet (len=68)
  149 1.835775272  10.6.15.156 → 192.168.1.12 TCP 66 22 → 54766 [ACK] Seq=20673 Ack=16185 Win=1452 Len=0 TSval=14480421 TSecr=7548927
  150 1.859086616  10.6.15.156 → 192.168.1.12 SSH 102 Server: Encrypted packet (len=36)
  151 1.859817168  10.6.15.156 → 192.168.1.12 SSH 126 Server: Encrypted packet (len=60)
  152 1.859828577  10.6.15.156 → 192.168.1.12 SSH 138 Server: Encrypted packet (len=72)
  153 1.859940733 192.168.1.12 → 10.6.15.156  TCP 66 54766 → 22 [ACK] Seq=16185 Ack=20841 Win=4866 Len=0 TSval=7548933 TSecr=14480426
  154 1.859959786 192.168.1.12 → 10.6.15.156  SSH 190 Client: Encrypted packet (len=124)
  155 1.860278420 192.168.1.12 → 10.6.15.156  SSH 102 Client: Encrypted packet (len=36)
  156 1.861698023  10.6.15.156 → 192.168.1.12 TCP 66 22 → 54766 [ACK] Seq=20841 Ack=16345 Win=1452 Len=0 TSval=14480427 TSecr=7548933
  157 1.861712744 192.168.1.12 → 10.6.15.156  SSH 102 Client: Encrypted packet (len=36)
  158 1.862014778 192.168.1.12 → 10.6.15.156  SSH 110 Client: Encrypted packet (len=44)
  159 1.863236065  10.6.15.156 → 192.168.1.12 TCP 66 22 → 54766 [ACK] Seq=20841 Ack=16425 Win=1452 Len=0 TSval=14480427 TSecr=7548934
  160 1.907232130 192.168.1.12 → 10.6.15.156  SSH 246 Client: Encrypted packet (len=180)
  161 1.947971956  10.6.15.156 → 192.168.1.12 TCP 66 22 → 54766 [ACK] Seq=20841 Ack=16605 Win=1452 Len=0 TSval=14480449 TSecr=7548945
  162 1.991725872  192.168.1.1 → 239.255.255.250 SSDP 302 NOTIFY * HTTP/1.1 
  163 1.994849094  192.168.1.1 → 239.255.255.250 SSDP 311 NOTIFY * HTTP/1.1 
  164 1.998446477  192.168.1.1 → 239.255.255.250 SSDP 374 NOTIFY * HTTP/1.1 
  165 2.001815951  192.168.1.1 → 239.255.255.250 SSDP 370 NOTIFY * HTTP/1.1 
  166 2.005550742  192.168.1.1 → 239.255.255.250 SSDP 350 NOTIFY * HTTP/1.1 
  167 2.008555736  192.168.1.1 → 239.255.255.250 SSDP 382 NOTIFY * HTTP/1.1 
  168 2.011863609  192.168.1.1 → 239.255.255.250 SSDP 364 NOTIFY * HTTP/1.1 
  169 2.015332241  192.168.1.1 → 239.255.255.250 SSDP 366 NOTIFY * HTTP/1.1 
  170 2.018159414  192.168.1.1 → 239.255.255.250 SSDP 302 NOTIFY * HTTP/1.1 
  171 2.021208530  192.168.1.1 → 239.255.255.250 SSDP 311 NOTIFY * HTTP/1.1 
  172 2.024665766  192.168.1.1 → 239.255.255.250 SSDP 374 NOTIFY * HTTP/1.1 
  173 2.027946977  192.168.1.1 → 239.255.255.250 SSDP 370 NOTIFY * HTTP/1.1 
  174 2.031187869  192.168.1.1 → 239.255.255.250 SSDP 350 NOTIFY * HTTP/1.1 
  175 2.034823362  192.168.1.1 → 239.255.255.250 SSDP 382 NOTIFY * HTTP/1.1 
  176 2.038140824  192.168.1.1 → 239.255.255.250 SSDP 364 NOTIFY * HTTP/1.1 
  177 2.041467454  192.168.1.1 → 239.255.255.250 SSDP 366 NOTIFY * HTTP/1.1 
  178 2.449838263  10.6.15.156 → 192.168.1.12 SSH 998 Server: Encrypted packet (len=932)
  179 2.449855795  10.6.15.156 → 192.168.1.12 SSH 282 Server: Encrypted packet (len=216)
  180 2.449907206 192.168.1.12 → 10.6.15.156  TCP 66 54766 → 22 [ACK] Seq=16605 Ack=21989 Win=4866 Len=0 TSval=7549081 TSecr=14480574
  181 2.450252546 192.168.1.12 → 10.6.15.156  SSH 138 Client: Encrypted packet (len=72)
  182 2.452172950  10.6.15.156 → 192.168.1.12 SSH 142 Server: Encrypted packet (len=76)
  183 2.452296470  10.6.15.156 → 192.168.1.12 TCP 66 22 → 54766 [ACK] Seq=22065 Ack=16677 Win=1452 Len=0 TSval=14480574 TSecr=7549081
  184 2.452307220 192.168.1.12 → 10.6.15.156  SSH 1426 Client: Encrypted packet (len=1360)
  185 2.455068787  10.6.15.156 → 192.168.1.12 TCP 66 22 → 54766 [ACK] Seq=22065 Ack=18037 Win=1452 Len=0 TSval=14480575 TSecr=7549081
  186 2.489752608  10.6.15.156 → 192.168.1.12 SSH 1262 Server: Encrypted packet (len=1196)
  187 2.490458351 192.168.1.12 → 10.6.15.156  SSH 134 Client: Encrypted packet (len=68)
  188 2.533341219 ZioncomE_53:dd:d4 → Broadcast    ARP 42 Who has 192.168.1.12? Tell 192.168.1.1
  189 2.533354716 HonHaiPr_1f:71:b9 → ZioncomE_53:dd:d4 ARP 42 192.168.1.12 is at 9c:d2:1e:1f:71:b9
  190 2.534357992  10.6.15.156 → 192.168.1.12 TCP 66 22 → 54766 [ACK] Seq=23261 Ack=18105 Win=1452 Len=0 TSval=14480595 TSecr=7549091
  191 2.582955304  10.6.15.156 → 192.168.1.12 SSH 102 Server: Encrypted packet (len=36)
  192 2.583316028 192.168.1.12 → 10.6.15.156  SSH 166 Client: Encrypted packet (len=100)
  193 2.584929115  10.6.15.156 → 192.168.1.12 TCP 66 22 → 54766 [ACK] Seq=23297 Ack=18205 Win=1452 Len=0 TSval=14480608 TSecr=7549114
  194 2.645415446 192.168.1.12 → 10.6.15.156  SSH 454 Client: Encrypted packet (len=388)
  195 2.647204929  10.6.15.156 → 192.168.1.12 TCP 66 22 → 54766 [ACK] Seq=23297 Ack=18593 Win=1452 Len=0 TSval=14480623 TSecr=7549130
  196 2.650998383  10.6.15.156 → 192.168.1.12 SSH 150 Server: Encrypted packet (len=84)
  197 2.670538447  10.6.15.156 → 192.168.1.12 SSH 174 Server: Encrypted packet (len=108)
  198 2.670616062 192.168.1.12 → 10.6.15.156  TCP 66 54766 → 22 [ACK] Seq=18593 Ack=23489 Win=4866 Len=0 TSval=7549136 TSecr=14480624
  199 2.671995322 192.168.1.12 → 10.6.15.156  SSH 806 Client: Encrypted packet (len=740)
  200 2.678899737  10.6.15.156 → 192.168.1.12 SSH 198 Server: Encrypted packet (len=132)
  201 2.679629646 192.168.1.12 → 10.6.15.156  SSH 446 Client: Encrypted packet (len=380)
  202 2.721988997  10.6.15.156 → 192.168.1.12 TCP 66 22 → 54766 [ACK] Seq=23621 Ack=19713 Win=1452 Len=0 TSval=14480642 TSecr=7549138
  203 2.812391126 192.168.1.12 → 224.0.0.252  LLMNR 61 Standard query 0x5549 A x
  204 2.856143415  10.6.15.156 → 192.168.1.12 SSH 606 Server: Encrypted packet (len=540)
  205 2.870868484  10.6.15.156 → 192.168.1.12 SSH 222 Server: Encrypted packet (len=156)
  206 2.870946217 192.168.1.12 → 10.6.15.156  TCP 66 54766 → 22 [ACK] Seq=19713 Ack=24317 Win=4866 Len=0 TSval=7549186 TSecr=14480675
  207 2.871208915 192.168.1.12 → 10.6.15.156  SSH 134 Client: Encrypted packet (len=68)
  208 2.872727151  10.6.15.156 → 192.168.1.12 TCP 66 22 → 54766 [ACK] Seq=24317 Ack=19781 Win=1452 Len=0 TSval=14480680 TSecr=7549186
  209 2.897123948  10.6.15.156 → 192.168.1.12 SSH 1494 Server: Encrypted packet (len=1428)
  210 2.907440644  10.6.15.156 → 192.168.1.12 SSH 174 Server: Encrypted packet (len=108)
  211 2.907458165 192.168.1.12 → 10.6.15.156  TCP 66 54766 → 22 [ACK] Seq=19781 Ack=25853 Win=4866 Len=0 TSval=7549195 TSecr=14480686
  212 2.929760844  10.6.15.156 → 192.168.1.12 SSH 1142 Server: Encrypted packet (len=1076)
  213 2.930865164  10.6.15.156 → 192.168.1.12 SSH 190 Server: Encrypted packet (len=124)
  214 2.930924785 192.168.1.12 → 10.6.15.156  TCP 66 54766 → 22 [ACK] Seq=19781 Ack=27053 Win=4866 Len=0 TSval=7549201 TSecr=14480693
  215 2.936054229  10.6.15.156 → 192.168.1.12 SSH 582 Server: Encrypted packet (len=516)
  216 2.936994334 192.168.1.12 → 10.6.15.156  SSH 206 Client: Encrypted packet (len=140)
  217 2.941308924  10.6.15.156 → 192.168.1.12 SSH 446 Server: Encrypted packet (len=380)
  218 2.942791383 192.168.1.12 → 10.6.15.156  SSH 206 Client: Encrypted packet (len=140)
  219 2.984560079  10.6.15.156 → 192.168.1.12 TCP 66 22 → 54766 [ACK] Seq=27949 Ack=20061 Win=1452 Len=0 TSval=14480708 TSecr=7549204
  220 3.038570748  10.6.15.156 → 192.168.1.12 SSH 1110 Server: Encrypted packet (len=1044)
  221 3.038833233  10.6.15.156 → 192.168.1.12 SSH 1174 Server: Encrypted packet (len=1108)
  222 3.038839122 192.168.1.12 → 10.6.15.156  TCP 66 54766 → 22 [ACK] Seq=20061 Ack=30101 Win=4866 Len=0 TSval=7549228 TSecr=14480721
  223 3.039615656 192.168.1.12 → 10.6.15.156  SSH 206 Client: Encrypted packet (len=140)
  224 3.041284905  10.6.15.156 → 192.168.1.12 TCP 66 22 → 54766 [ACK] Seq=30101 Ack=20201 Win=1452 Len=0 TSval=14480722 TSecr=7549228
  225 3.041294191 192.168.1.12 → 10.6.15.156  SSH 530 Client: Encrypted packet (len=464)
  226 3.043375328  10.6.15.156 → 192.168.1.12 TCP 66 22 → 54766 [ACK] Seq=30101 Ack=20665 Win=1452 Len=0 TSval=14480722 TSecr=7549229
  227 3.062344792 192.168.1.12 → 224.0.0.252  LLMNR 61 Standard query 0x5549 A x
  228 3.287244599  10.6.15.156 → 192.168.1.12 SSH 166 Server: Encrypted packet (len=100)
  229 3.312331446 192.168.1.12 → 224.0.0.252  LLMNR 61 Standard query 0x5549 A x
  230 3.328363095 192.168.1.12 → 10.6.15.156  TCP 66 54766 → 22 [ACK] Seq=20665 Ack=30201 Win=4866 Len=0 TSval=7549301 TSecr=14480783
  231 3.336408522  10.6.15.156 → 192.168.1.12 SSH 430 Server: Encrypted packet (len=364)
  232 3.336434645 192.168.1.12 → 10.6.15.156  TCP 66 54766 → 22 [ACK] Seq=20665 Ack=30565 Win=4866 Len=0 TSval=7549303 TSecr=14480795
  233 3.336747523 192.168.1.12 → 10.6.15.156  SSH 126 Client: Encrypted packet (len=60)
  234 3.337746356  10.6.15.156 → 192.168.1.12 SSH 430 Server: Encrypted packet (len=364)
  235 3.338591421  10.6.15.156 → 192.168.1.12 TCP 66 22 → 54766 [ACK] Seq=30929 Ack=20725 Win=1452 Len=0 TSval=14480796 TSecr=7549303
  236 3.343420270 192.168.1.12 → 10.6.15.156  SSH 286 Client: Encrypted packet (len=220)
  237 3.345212734  10.6.15.156 → 192.168.1.12 TCP 66 22 → 54766 [ACK] Seq=30929 Ack=20945 Win=1452 Len=0 TSval=14480798 TSecr=7549304
  238 3.406764926  10.6.15.156 → 192.168.1.12 SSH 350 Server: Encrypted packet (len=284)
  239 3.418509776  10.6.15.156 → 192.168.1.12 SSH 350 Server: Encrypted packet (len=284)
  240 3.418578170 192.168.1.12 → 10.6.15.156  TCP 66 54766 → 22 [ACK] Seq=20945 Ack=31497 Win=4866 Len=0 TSval=7549323 TSecr=14480813
  241 3.562823167  10.6.15.156 → 192.168.1.12 SSH 294 Server: Encrypted packet (len=228)
  242 3.604396119 192.168.1.12 → 10.6.15.156  TCP 66 54766 → 22 [ACK] Seq=20945 Ack=31725 Win=4866 Len=0 TSval=7549370 TSecr=14480852
  243 4.514911416 10.22.18.100 → 224.0.0.252  LLMNR 64 Standard query 0x291b A wpad
  244 4.514976057 10.22.18.100 → 224.0.0.252  LLMNR 64 Standard query 0x994b AAAA wpad
  245 4.924767700 10.22.18.100 → 224.0.0.252  LLMNR 64 Standard query 0x291b A wpad
  246 4.925626363 10.22.18.100 → 224.0.0.252  LLMNR 64 Standard query 0x994b AAAA wpad
  247 5.385162752 192.168.1.12 → 10.6.15.156  SSH 526 Client: Encrypted packet (len=460)
  248 5.391204351  10.6.15.156 → 192.168.1.12 TCP 66 22 → 54766 [ACK] Seq=31725 Ack=21405 Win=1452 Len=0 TSval=14481308 TSecr=7549815
  249 5.474256665  10.6.15.156 → 192.168.1.12 SSH 158 Server: Encrypted packet (len=92)
  250 5.474272975 192.168.1.12 → 10.6.15.156  TCP 66 54766 → 22 [ACK] Seq=21405 Ack=31817 Win=4866 Len=0 TSval=7549837 TSecr=14481330
  251 5.474389047  10.6.15.156 → 192.168.1.12 SSH 102 Server: Encrypted packet (len=36)
  252 5.474391948 192.168.1.12 → 10.6.15.156  TCP 66 54766 → 22 [ACK] Seq=21405 Ack=31853 Win=4866 Len=0 TSval=7549837 TSecr=14481330
  253 5.491497160  10.6.15.156 → 192.168.1.12 SSH 230 Server: Encrypted packet (len=164)
  254 5.491513839 192.168.1.12 → 10.6.15.156  TCP 66 54766 → 22 [ACK] Seq=21405 Ack=32017 Win=4866 Len=0 TSval=7549841 TSecr=14481334
  255 6.138699467 192.168.1.12 → 10.6.15.156  SSH 138 Client: Encrypted packet (len=72)
  256 6.140387069  10.6.15.156 → 192.168.1.12 TCP 66 22 → 54766 [ACK] Seq=32017 Ack=21477 Win=1452 Len=0 TSval=14481497 TSecr=7550003
  257 6.140397649 192.168.1.12 → 10.6.15.156  SSH 342 Client: Encrypted packet (len=276)
  258 6.140553777  10.6.15.156 → 192.168.1.12 SSH 102 Server: Encrypted packet (len=36)
  259 6.140561061 192.168.1.12 → 10.6.15.156  TCP 66 54766 → 22 [ACK] Seq=21753 Ack=32053 Win=4866 Len=0 TSval=7550004 TSecr=14481497
  260 6.179944259  10.6.15.156 → 192.168.1.12 TCP 66 22 → 54766 [ACK] Seq=32053 Ack=21753 Win=1452 Len=0 TSval=14481507 TSecr=7550004
  261 6.190766147  10.6.15.156 → 192.168.1.12 SSH 134 Server: Encrypted packet (len=68)
  262 6.190784356 192.168.1.12 → 10.6.15.156  TCP 66 54766 → 22 [ACK] Seq=21753 Ack=32121 Win=4866 Len=0 TSval=7550016 TSecr=14481509
  263 6.190865829  10.6.15.156 → 192.168.1.12 SSH 138 Server: Encrypted packet (len=72)
  264 6.190870252 192.168.1.12 → 10.6.15.156  TCP 66 54766 → 22 [ACK] Seq=21753 Ack=32193 Win=4866 Len=0 TSval=7550016 TSecr=14481509
  265 6.191032337 192.168.1.12 → 10.6.15.156  SSH 102 Client: Encrypted packet (len=36)
  266 6.192401779  10.6.15.156 → 192.168.1.12 TCP 66 22 → 54766 [ACK] Seq=32193 Ack=21789 Win=1452 Len=0 TSval=14481510 TSecr=7550016
  267 6.353321272  10.6.15.156 → 192.168.1.12 SSH 138 Server: Encrypted packet (len=72)
  268 6.353538125 192.168.1.12 → 10.6.15.156  SSH 102 Client: Encrypted packet (len=36)
  269 6.357260836  10.6.15.156 → 192.168.1.12 TCP 66 22 → 54766 [ACK] Seq=32265 Ack=21825 Win=1452 Len=0 TSval=14481550 TSecr=7550057
  270 6.357378722  10.6.15.156 → 192.168.1.12 SSH 110 Server: Encrypted packet (len=44)
  271 6.357479213  10.6.15.156 → 192.168.1.12 SSH 102 Server: Encrypted packet (len=36)
  272 6.357519822 192.168.1.12 → 10.6.15.156  TCP 66 54766 → 22 [ACK] Seq=21825 Ack=32345 Win=4866 Len=0 TSval=7550058 TSecr=14481550
  273 6.357639671  10.6.15.156 → 192.168.1.12 SSH 102 Server: Encrypted packet (len=36)
  274 6.357755252 192.168.1.12 → 10.6.15.156  SSH 206 Client: Encrypted packet (len=140)
  275 6.358089790 192.168.1.12 → 10.6.15.156  SSH 250 Client: Encrypted packet (len=184)
  276 6.359962291  10.6.15.156 → 192.168.1.12 TCP 66 22 → 54766 [ACK] Seq=32381 Ack=22149 Win=1452 Len=0 TSval=14481552 TSecr=7550058
  277 6.360103198  10.6.15.156 → 192.168.1.12 SSH 102 Server: Encrypted packet (len=36)
  278 6.360434221 192.168.1.12 → 10.6.15.156  SSH 158 Client: Encrypted packet (len=92)
  279 6.365866722  10.6.15.156 → 192.168.1.12 SSH 138 Server: Encrypted packet (len=72)
  280 6.366080688 192.168.1.12 → 10.6.15.156  SSH 102 Client: Encrypted packet (len=36)
  281 6.408359078  10.6.15.156 → 192.168.1.12 TCP 66 22 → 54766 [ACK] Seq=32489 Ack=22277 Win=1452 Len=0 TSval=14481564 TSecr=7550060
  282 6.575365364  10.6.15.156 → 192.168.1.12 SSH 230 Server: Encrypted packet (len=164)
  283 6.575679423 192.168.1.12 → 10.6.15.156  SSH 134 Client: Encrypted packet (len=68)
  284 6.576365557  10.6.15.156 → 192.168.1.12 SSH 182 Server: Encrypted packet (len=116)
  285 6.576378261 192.168.1.12 → 10.6.15.156  SSH 862 Client: Encrypted packet (len=796)
  286 6.576491433  10.6.15.156 → 192.168.1.12 SSH 182 Server: Encrypted packet (len=116)
  287 6.577087173 192.168.1.12 → 10.6.15.156  SSH 998 Client: Encrypted packet (len=932)
  288 6.577686397 192.168.1.12 → 10.6.15.156  SSH 862 Client: Encrypted packet (len=796)
  289 6.579036784  10.6.15.156 → 192.168.1.12 TCP 66 22 → 54766 [ACK] Seq=32885 Ack=22345 Win=1452 Len=0 TSval=14481606 TSecr=7550112
  290 6.579141106  10.6.15.156 → 192.168.1.12 TCP 66 22 → 54766 [ACK] Seq=32885 Ack=23141 Win=1452 Len=0 TSval=14481606 TSecr=7550113
  291 6.579607579  10.6.15.156 → 192.168.1.12 TCP 66 22 → 54766 [ACK] Seq=32885 Ack=24073 Win=1452 Len=0 TSval=14481606 TSecr=7550113
  292 6.580085943  10.6.15.156 → 192.168.1.12 TCP 66 22 → 54766 [ACK] Seq=32885 Ack=24869 Win=1452 Len=0 TSval=14481606 TSecr=7550113
  293 6.580237790  10.6.15.156 → 192.168.1.12 SSH 182 Server: Encrypted packet (len=116)
  294 6.580545385 192.168.1.12 → 10.6.15.156  SSH 134 Client: Encrypted packet (len=68)
  295 6.620166417  10.6.15.156 → 192.168.1.12 TCP 66 22 → 54766 [ACK] Seq=33001 Ack=24937 Win=1452 Len=0 TSval=14481617 TSecr=7550114
  296 6.620186753 192.168.1.12 → 10.6.15.156  SSH 862 Client: Encrypted packet (len=796)
  297 6.622561607  10.6.15.156 → 192.168.1.12 TCP 66 22 → 54766 [ACK] Seq=33001 Ack=25733 Win=1452 Len=0 TSval=14481617 TSecr=7550123
  298 6.792472921  10.6.15.156 → 192.168.1.12 SSH 454 Server: Encrypted packet (len=388)
  299 6.794301078  10.6.15.156 → 192.168.1.12 SSH 454 Server: Encrypted packet (len=388)
  300 6.794377098 192.168.1.12 → 10.6.15.156  TCP 66 54766 → 22 [ACK] Seq=25733 Ack=33777 Win=4866 Len=0 TSval=7550167 TSecr=14481660
  301 6.795739369  10.6.15.156 → 192.168.1.12 SSH 454 Server: Encrypted packet (len=388)
  302 6.836417854 192.168.1.12 → 10.6.15.156  TCP 66 54766 → 22 [ACK] Seq=25733 Ack=34165 Win=4866 Len=0 TSval=7550178 TSecr=14481660
  303 6.841111403  10.6.15.156 → 192.168.1.12 SSH 454 Server: Encrypted packet (len=388)
  304 6.841137303 192.168.1.12 → 10.6.15.156  TCP 66 54766 → 22 [ACK] Seq=25733 Ack=34553 Win=4866 Len=0 TSval=7550179 TSecr=14481672
  305 7.135440205 192.168.1.12 → 10.6.15.156  SSH 862 Client: Encrypted packet (len=796)
  306 7.137690347  10.6.15.156 → 192.168.1.12 TCP 66 22 → 54766 [ACK] Seq=34553 Ack=26529 Win=1452 Len=0 TSval=14481746 TSecr=7550252
  307 7.356149960  10.6.15.156 → 192.168.1.12 SSH 454 Server: Encrypted packet (len=388)
  308 7.356178710 192.168.1.12 → 10.6.15.156  TCP 66 54766 → 22 [ACK] Seq=26529 Ack=34941 Win=4866 Len=0 TSval=7550307 TSecr=14481801
  309 9.218241878 192.168.1.12 → 91.189.89.199 NTP 90 NTP Version 4, client
  310 9.388740554  10.6.15.156 → 192.168.1.12 SSH 102 Server: Encrypted packet (len=36)
  311 9.388759120 192.168.1.12 → 10.6.15.156  TCP 66 54766 → 22 [ACK] Seq=26529 Ack=34977 Win=4866 Len=0 TSval=7550816 TSecr=14482308
  312 9.404524535  10.6.15.156 → 192.168.1.12 SSH 102 Server: Encrypted packet (len=36)
  313 9.404542169 192.168.1.12 → 10.6.15.156  TCP 66 54766 → 22 [ACK] Seq=26529 Ack=35013 Win=4866 Len=0 TSval=7550820 TSecr=14482313
  314 10.512123507  10.6.15.156 → 192.168.1.12 SSH 174 Server: Encrypted packet (len=108)
  315 10.512141507 192.168.1.12 → 10.6.15.156  TCP 66 54766 → 22 [ACK] Seq=26529 Ack=35121 Win=4866 Len=0 TSval=7551096 TSecr=14482590
  316 10.512156747  10.6.15.156 → 192.168.1.12 SSH 102 Server: Encrypted packet (len=36)
  317 10.512162849 192.168.1.12 → 10.6.15.156  TCP 66 54766 → 22 [ACK] Seq=26529 Ack=35157 Win=4866 Len=0 TSval=7551096 TSecr=14482590
  318 10.528584522 192.168.1.12 → 10.6.15.156  SSH 1514 Client: Encrypted packet (len=1448)
  319 10.531123038  10.6.15.156 → 192.168.1.12 TCP 66 22 → 54766 [ACK] Seq=35157 Ack=27977 Win=1452 Len=0 TSval=14482594 TSecr=7551101
  320 10.531142258 192.168.1.12 → 10.6.15.156  SSH 462 Client: Encrypted packet (len=396)
  321 10.534111700  10.6.15.156 → 192.168.1.12 TCP 66 22 → 54766 [ACK] Seq=35157 Ack=28373 Win=1452 Len=0 TSval=14482595 TSecr=7551101
  322 10.537298707  10.6.15.156 → 192.168.1.12 SSH 142 Server: Encrypted packet (len=76)
  323 10.580413478 192.168.1.12 → 10.6.15.156  TCP 66 54766 → 22 [ACK] Seq=28373 Ack=35233 Win=4866 Len=0 TSval=7551114 TSecr=14482596
  324 10.657935578  10.6.15.156 → 192.168.1.12 SSH 998 Server: Encrypted packet (len=932)
  325 10.657968925 192.168.1.12 → 10.6.15.156  TCP 66 54766 → 22 [ACK] Seq=28373 Ack=36165 Win=4866 Len=0 TSval=7551133 TSecr=14482626
  326 10.658259624  10.6.15.156 → 192.168.1.12 SSH 582 Server: Encrypted packet (len=516)
  327 10.658268076 192.168.1.12 → 10.6.15.156  TCP 66 54766 → 22 [ACK] Seq=28373 Ack=36681 Win=4866 Len=0 TSval=7551133 TSecr=14482626
  328 10.658827511 192.168.1.12 → 10.6.15.156  SSH 134 Client: Encrypted packet (len=68)
  329 10.701217799  10.6.15.156 → 192.168.1.12 TCP 66 22 → 54766 [ACK] Seq=36681 Ack=28441 Win=1452 Len=0 TSval=14482637 TSecr=7551133
  330 11.185163249 192.168.1.12 → 10.6.15.156  SSH 486 Client: Encrypted packet (len=420)
  331 11.186983111  10.6.15.156 → 192.168.1.12 TCP 66 22 → 54766 [ACK] Seq=36681 Ack=28861 Win=1452 Len=0 TSval=14482758 TSecr=7551265
  332 11.291656331  10.6.15.156 → 192.168.1.12 SSH 222 Server: Encrypted packet (len=156)
  333 11.332413696 192.168.1.12 → 10.6.15.156  TCP 66 54766 → 22 [ACK] Seq=28861 Ack=36837 Win=4866 Len=0 TSval=7551302 TSecr=14482784
  334 12.140291794 192.168.1.12 → 10.6.15.156  SSH 138 Client: Encrypted packet (len=72)
  335 12.141183943 192.168.1.12 → 10.6.15.156  SSH 1514 Client: Encrypted packet (len=1448)
  336 12.143699521 192.168.1.12 → 10.6.15.156  SSH 1514 Client: Encrypted packet (len=1448)
  337 12.144578191 192.168.1.12 → 10.6.15.156  SSH 498 Client: Encrypted packet (len=432)
  338 12.145120296  10.6.15.156 → 192.168.1.12 TCP 66 22 → 54766 [ACK] Seq=36837 Ack=28933 Win=1452 Len=0 TSval=14482998 TSecr=7551503
  339 12.145258840  10.6.15.156 → 192.168.1.12 SSH 102 Server: Encrypted packet (len=36)
  340 12.145266228 192.168.1.12 → 10.6.15.156  TCP 66 54766 → 22 [ACK] Seq=32261 Ack=36873 Win=4866 Len=0 TSval=7551505 TSecr=14482998
  341 12.145830282  10.6.15.156 → 192.168.1.12 SSH 138 Server: Encrypted packet (len=72)
  342 12.145839072 192.168.1.12 → 10.6.15.156  TCP 66 54766 → 22 [ACK] Seq=32261 Ack=36945 Win=4866 Len=0 TSval=7551505 TSecr=14482998
  343 12.146879176  10.6.15.156 → 192.168.1.12 TCP 66 22 → 54766 [ACK] Seq=36945 Ack=32261 Win=1452 Len=0 TSval=14482998 TSecr=7551504
  344 12.223655786  10.6.15.156 → 192.168.1.12 SSH 102 Server: Encrypted packet (len=36)
  345 12.223672582 192.168.1.12 → 10.6.15.156  TCP 66 54766 → 22 [ACK] Seq=32261 Ack=36981 Win=4866 Len=0 TSval=7551524 TSecr=14483017
  346 12.361185166  10.6.15.156 → 192.168.1.12 SSH 454 Server: Encrypted packet (len=388)
  347 12.361212028 192.168.1.12 → 10.6.15.156  TCP 66 54766 → 22 [ACK] Seq=32261 Ack=37369 Win=4866 Len=0 TSval=7551559 TSecr=14483052
  348 12.363965671  10.6.15.156 → 192.168.1.12 SSH 454 Server: Encrypted packet (len=388)
  349 12.363982210 192.168.1.12 → 10.6.15.156  TCP 66 54766 → 22 [ACK] Seq=32261 Ack=37757 Win=4866 Len=0 TSval=7551559 TSecr=14483052
  350 12.364141541  10.6.15.156 → 192.168.1.12 SSH 454 Server: Encrypted packet (len=388)
  351 12.364145940 192.168.1.12 → 10.6.15.156  TCP 66 54766 → 22 [ACK] Seq=32261 Ack=38145 Win=4866 Len=0 TSval=7551559 TSecr=14483052
  352 12.365457404  10.6.15.156 → 192.168.1.12 SSH 454 Server: Encrypted packet (len=388)
  353 12.365471925 192.168.1.12 → 10.6.15.156  TCP 66 54766 → 22 [ACK] Seq=32261 Ack=38533 Win=4866 Len=0 TSval=7551560 TSecr=14483053
  354 13.141449986 192.168.1.12 → 10.6.15.156  SSH 102 Client: Encrypted packet (len=36)
  355 13.179912788  10.6.15.156 → 192.168.1.12 TCP 66 22 → 54766 [ACK] Seq=38533 Ack=32297 Win=1452 Len=0 TSval=14483257 TSecr=7551754
  356 13.179932127 192.168.1.12 → 10.6.15.156  SSH 1006 Client: Encrypted packet (len=940)
  357 13.182244376  10.6.15.156 → 192.168.1.12 TCP 66 22 → 54766 [ACK] Seq=38533 Ack=33237 Win=1452 Len=0 TSval=14483257 TSecr=7551763
  358 13.182696707  10.6.15.156 → 192.168.1.12 SSH 102 Server: Encrypted packet (len=36)
  359 13.182704983 192.168.1.12 → 10.6.15.156  TCP 66 54766 → 22 [ACK] Seq=33237 Ack=38569 Win=4866 Len=0 TSval=7551764 TSecr=14483257
  360 13.219777288 192.168.1.12 → 192.168.1.1  DNS 81 Standard query 0xd307 A 2.ubuntu.pool.ntp.org
  361 13.222190651  192.168.1.1 → 192.168.1.12 DNS 145 Standard query response 0xd307 A 2.ubuntu.pool.ntp.org A 139.59.50.38 A 123.108.200.124 A 139.59.16.133 A 139.59.21.22
  362 13.222678140 192.168.1.12 → 139.59.50.38 NTP 90 NTP Version 4, client
  363 13.400861343  10.6.15.156 → 192.168.1.12 SSH 454 Server: Encrypted packet (len=388)
  364 13.400889117 192.168.1.12 → 10.6.15.156  TCP 66 54766 → 22 [ACK] Seq=33237 Ack=38957 Win=4866 Len=0 TSval=7551819 TSecr=14483312
  365 13.557297843  10.6.15.156 → 192.168.1.12 SSH 138 Server: Encrypted packet (len=72)
  366 13.557314752 192.168.1.12 → 10.6.15.156  TCP 66 54766 → 22 [ACK] Seq=33237 Ack=39029 Win=4866 Len=0 TSval=7551858 TSecr=14483351
  367 13.557542259 192.168.1.12 → 10.6.15.156  SSH 102 Client: Encrypted packet (len=36)
  368 13.596449113  10.6.15.156 → 192.168.1.12 TCP 66 22 → 54766 [ACK] Seq=39029 Ack=33273 Win=1452 Len=0 TSval=14483361 TSecr=7551858
  369 13.659948323  10.6.15.156 → 192.168.1.12 SSH 138 Server: Encrypted packet (len=72)
  370 13.660140371 192.168.1.12 → 10.6.15.156  SSH 102 Client: Encrypted packet (len=36)
  371 13.661752204  10.6.15.156 → 192.168.1.12 TCP 66 22 → 54766 [ACK] Seq=39101 Ack=33309 Win=1452 Len=0 TSval=14483377 TSecr=7551883
  372 13.664977778  10.6.15.156 → 192.168.1.12 SSH 138 Server: Encrypted packet (len=72)
  373 13.665161121 192.168.1.12 → 10.6.15.156  SSH 102 Client: Encrypted packet (len=36)
  374 13.706661315  10.6.15.156 → 192.168.1.12 TCP 66 22 → 54766 [ACK] Seq=39173 Ack=33345 Win=1452 Len=0 TSval=14483388 TSecr=7551885
  375 14.860555800  10.6.15.156 → 192.168.1.12 SSH 102 Server: Encrypted packet (len=36)
  376 14.904389763 192.168.1.12 → 10.6.15.156  TCP 66 54766 → 22 [ACK] Seq=33345 Ack=39209 Win=4866 Len=0 TSval=7552195 TSecr=14483677
  377 16.992054334 192.168.1.12 → 10.6.15.156  SSH 494 Client: Encrypted packet (len=428)
  378 16.994023854  10.6.15.156 → 192.168.1.12 TCP 66 22 → 54766 [ACK] Seq=39209 Ack=33773 Win=1452 Len=0 TSval=14484210 TSecr=7552716
  379 17.098936795  10.6.15.156 → 192.168.1.12 SSH 222 Server: Encrypted packet (len=156)
  380 17.098955335 192.168.1.12 → 10.6.15.156  TCP 66 54766 → 22 [ACK] Seq=33773 Ack=39365 Win=4866 Len=0 TSval=7552743 TSecr=14484236
  381 18.143423920 192.168.1.12 → 10.6.15.156  SSH 138 Client: Encrypted packet (len=72)
  382 18.144301332 192.168.1.12 → 10.6.15.156  SSH 1514 Client: Encrypted packet (len=1448)
  383 18.146101773 192.168.1.12 → 10.6.15.156  SSH 1514 Client: Encrypted packet (len=1448)
  384 18.146237268  10.6.15.156 → 192.168.1.12 TCP 66 22 → 54766 [ACK] Seq=39365 Ack=33845 Win=1452 Len=0 TSval=14484498 TSecr=7553004
  385 18.147037848 192.168.1.12 → 10.6.15.156  SSH 354 Client: Encrypted packet (len=288)
  386 18.147508580  10.6.15.156 → 192.168.1.12 SSH 102 Server: Encrypted packet (len=36)
  387 18.147515143 192.168.1.12 → 10.6.15.156  TCP 66 54766 → 22 [ACK] Seq=37029 Ack=39401 Win=4866 Len=0 TSval=7553005 TSecr=14484498
  388 18.148992960  10.6.15.156 → 192.168.1.12 TCP 66 22 → 54766 [ACK] Seq=39401 Ack=36741 Win=1452 Len=0 TSval=14484499 TSecr=7553004
  389 18.187786359  10.6.15.156 → 192.168.1.12 TCP 66 22 → 54766 [ACK] Seq=39401 Ack=37029 Win=1452 Len=0 TSval=14484509 TSecr=7553005
  390 18.363130651  10.6.15.156 → 192.168.1.12 SSH 454 Server: Encrypted packet (len=388)
  391 18.363148285 192.168.1.12 → 10.6.15.156  TCP 66 54766 → 22 [ACK] Seq=37029 Ack=39789 Win=4866 Len=0 TSval=7553059 TSecr=14484552
  392 18.363520777  10.6.15.156 → 192.168.1.12 SSH 454 Server: Encrypted packet (len=388)
  393 18.363527041 192.168.1.12 → 10.6.15.156  TCP 66 54766 → 22 [ACK] Seq=37029 Ack=40177 Win=4866 Len=0 TSval=7553059 TSecr=14484552
  394 18.364841320  10.6.15.156 → 192.168.1.12 SSH 454 Server: Encrypted packet (len=388)
  395 18.364862173 192.168.1.12 → 10.6.15.156  TCP 66 54766 → 22 [ACK] Seq=37029 Ack=40565 Win=4866 Len=0 TSval=7553060 TSecr=14484553
  396 18.366047475  10.6.15.156 → 192.168.1.12 SSH 454 Server: Encrypted packet (len=388)
  397 18.366064226 192.168.1.12 → 10.6.15.156  TCP 66 54766 → 22 [ACK] Seq=37029 Ack=40953 Win=4866 Len=0 TSval=7553060 TSecr=14484553
  398 19.135770033 192.168.1.12 → 10.6.15.156  SSH 862 Client: Encrypted packet (len=796)
  399 19.137992255  10.6.15.156 → 192.168.1.12 TCP 66 22 → 54766 [ACK] Seq=40953 Ack=37825 Win=1452 Len=0 TSval=14484746 TSecr=7553252
  400 19.357724715  10.6.15.156 → 192.168.1.12 SSH 454 Server: Encrypted packet (len=388)
  401 19.357751700 192.168.1.12 → 10.6.15.156  TCP 66 54766 → 22 [ACK] Seq=37825 Ack=41341 Win=4866 Len=0 TSval=7553308 TSecr=14484801
  402 22.794128097 192.168.1.12 → 10.6.15.156  SSH 486 Client: Encrypted packet (len=420)
  403 22.795975735  10.6.15.156 → 192.168.1.12 TCP 66 22 → 54766 [ACK] Seq=41341 Ack=38245 Win=1452 Len=0 TSval=14485661 TSecr=7554167
  404 22.900634169  10.6.15.156 → 192.168.1.12 SSH 222 Server: Encrypted packet (len=156)
  405 22.900651885 192.168.1.12 → 10.6.15.156  TCP 66 54766 → 22 [ACK] Seq=38245 Ack=41497 Win=4866 Len=0 TSval=7554194 TSecr=14485687
  406 24.144843553 192.168.1.12 → 10.6.15.156  SSH 862 Client: Encrypted packet (len=796)
  407 24.145142840 192.168.1.12 → 10.6.15.156  SSH 1514 Client: Encrypted packet (len=1448)
  408 24.146087190 192.168.1.12 → 10.6.15.156  SSH 1006 Client: Encrypted packet (len=940)
  409 24.147540082  10.6.15.156 → 192.168.1.12 TCP 66 22 → 54766 [ACK] Seq=41497 Ack=39041 Win=1452 Len=0 TSval=14485998 TSecr=7554505
  410 24.147559373  10.6.15.156 → 192.168.1.12 TCP 66 22 → 54766 [ACK] Seq=41497 Ack=40489 Win=1452 Len=0 TSval=14485999 TSecr=7554505
  411 24.148899370  10.6.15.156 → 192.168.1.12 TCP 66 22 → 54766 [ACK] Seq=41497 Ack=41429 Win=1452 Len=0 TSval=14485999 TSecr=7554505
  412 24.363250005  10.6.15.156 → 192.168.1.12 SSH 454 Server: Encrypted packet (len=388)
  413 24.364932346  10.6.15.156 → 192.168.1.12 SSH 454 Server: Encrypted packet (len=388)
  414 24.365506067  10.6.15.156 → 192.168.1.12 SSH 454 Server: Encrypted packet (len=388)
  415 24.365918992  10.6.15.156 → 192.168.1.12 SSH 454 Server: Encrypted packet (len=388)
  416 24.379833845  10.6.15.156 → 192.168.1.12 TCP 454 [TCP Retransmission] 22 → 54766 [PSH, ACK] Seq=42661 Ack=41429 Win=1452 Len=388 TSval=14486057 TSecr=7554505
  417 24.848490906 192.168.1.12 → 10.6.15.156  TCP 66 54766 → 22 [ACK] Seq=41429 Ack=41885 Win=4866 Len=0 TSval=7554559 TSecr=14486052
  418 24.848500764 192.168.1.12 → 10.6.15.156  TCP 66 54766 → 22 [ACK] Seq=41429 Ack=42273 Win=4866 Len=0 TSval=7554560 TSecr=14486053
  419 24.848502567 192.168.1.12 → 10.6.15.156  TCP 66 54766 → 22 [ACK] Seq=41429 Ack=42661 Win=4866 Len=0 TSval=7554560 TSecr=14486053
  420 24.848504172 192.168.1.12 → 10.6.15.156  TCP 66 54766 → 22 [ACK] Seq=41429 Ack=43049 Win=4866 Len=0 TSval=7554560 TSecr=14486053
  421 24.848505697 192.168.1.12 → 10.6.15.156  TCP 78 [TCP Dup ACK 420#1] 54766 → 22 [ACK] Seq=41429 Ack=43049 Win=4866 Len=0 TSval=7554563 TSecr=14486057 SLE=42661 SRE=43049
  422 24.849894338  10.6.15.156 → 192.168.1.12 SSH 1230 Server: [TCP Spurious Retransmission] , Encrypted packet (len=1164)
  423 24.849912680 192.168.1.12 → 10.6.15.156  TCP 78 [TCP Dup ACK 420#2] 54766 → 22 [ACK] Seq=41429 Ack=43049 Win=4866 Len=0 TSval=7554681 TSecr=14486057 SLE=41497 SRE=42661
  424 25.560466114 192.168.1.12 → 10.6.15.156  SSH 862 Client: Encrypted packet (len=796)
  425 25.566310023  10.6.15.156 → 192.168.1.12 TCP 66 22 → 54766 [ACK] Seq=43049 Ack=42225 Win=1452 Len=0 TSval=14486352 TSecr=7554754
  426 25.782003734  10.6.15.156 → 192.168.1.12 SSH 454 Server: Encrypted packet (len=388)
  427 26.272463442 192.168.1.12 → 10.6.15.156  TCP 66 54766 → 22 [ACK] Seq=42225 Ack=43437 Win=4866 Len=0 TSval=7554914 TSecr=14486407
  428 26.274655542  10.6.15.156 → 192.168.1.12 SSH 454 Server: [TCP Spurious Retransmission] , Encrypted packet (len=388)
  429 26.274675525 192.168.1.12 → 10.6.15.156  TCP 78 [TCP Dup ACK 427#1] 54766 → 22 [ACK] Seq=42225 Ack=43437 Win=4866 Len=0 TSval=7555037 TSecr=14486502 SLE=43049 SRE=43437
  430 26.358394969  10.6.15.156 → 192.168.1.12 SSH 134 Server: Encrypted packet (len=68)
  431 26.358412990 192.168.1.12 → 10.6.15.156  TCP 66 54766 → 22 [ACK] Seq=42225 Ack=43505 Win=4866 Len=0 TSval=7555058 TSecr=14486551
  432 26.358677985 192.168.1.12 → 10.6.15.156  SSH 102 Client: Encrypted packet (len=36)
  433 26.358786953  10.6.15.156 → 192.168.1.12 SSH 102 Server: Encrypted packet (len=36)
  434 26.360678606  10.6.15.156 → 192.168.1.12 TCP 66 22 → 54766 [ACK] Seq=43541 Ack=42261 Win=1452 Len=0 TSval=14486552 TSecr=7555058
  435 26.360701252 192.168.1.12 → 10.6.15.156  SSH 102 Client: Encrypted packet (len=36)
  436 26.361388343  10.6.15.156 → 192.168.1.12 SSH 102 Server: Encrypted packet (len=36)
  437 26.399725344  10.6.15.156 → 192.168.1.12 TCP 66 22 → 54766 [ACK] Seq=43577 Ack=42297 Win=1452 Len=0 TSval=14486562 TSecr=7555059
  438 26.404386369 192.168.1.12 → 10.6.15.156  TCP 66 54766 → 22 [ACK] Seq=42297 Ack=43577 Win=4866 Len=0 TSval=7555070 TSecr=14486552
  439 28.593650505 192.168.1.12 → 10.6.15.156  SSH 486 Client: Encrypted packet (len=420)
  440 28.597175017  10.6.15.156 → 192.168.1.12 TCP 66 22 → 54766 [ACK] Seq=43577 Ack=42717 Win=1452 Len=0 TSval=14487111 TSecr=7555617
  441 28.700095181  10.6.15.156 → 192.168.1.12 SSH 222 Server: Encrypted packet (len=156)
  442 29.184453379 192.168.1.12 → 10.6.15.156  TCP 66 54766 → 22 [ACK] Seq=42717 Ack=43733 Win=4866 Len=0 TSval=7555643 TSecr=14487137
  443 29.185154856  10.6.15.156 → 192.168.1.12 SSH 222 Server: [TCP Spurious Retransmission] , Encrypted packet (len=156)
  444 29.185169508 192.168.1.12 → 10.6.15.156  TCP 78 [TCP Dup ACK 442#1] 54766 → 22 [ACK] Seq=42717 Ack=43733 Win=4866 Len=0 TSval=7555765 TSecr=14487232 SLE=43577 SRE=43733
  445 29.219757692 192.168.1.12 → 192.168.1.1  DNS 81 Standard query 0xeac6 A 0.ubuntu.pool.ntp.org
  446 29.222386605  192.168.1.1 → 192.168.1.12 DNS 145 Standard query response 0xeac6 A 0.ubuntu.pool.ntp.org A 123.108.200.124 A 139.59.50.38 A 139.59.21.22 A 139.59.16.133
  447 29.222883158 192.168.1.12 → 123.108.200.124 NTP 90 NTP Version 4, client
  448 30.139988810 192.168.1.12 → 10.6.15.156  SSH 862 Client: Encrypted packet (len=796)
  449 30.140872579 192.168.1.12 → 10.6.15.156  SSH 1514 Client: Encrypted packet (len=1448)
  450 30.141743131 192.168.1.12 → 10.6.15.156  SSH 1006 Client: Encrypted packet (len=940)
  451 30.143111613  10.6.15.156 → 192.168.1.12 TCP 66 22 → 54766 [ACK] Seq=43733 Ack=43513 Win=1452 Len=0 TSval=14487497 TSecr=7556003
  452 30.144202003  10.6.15.156 → 192.168.1.12 TCP 66 22 → 54766 [ACK] Seq=43733 Ack=44961 Win=1452 Len=0 TSval=14487497 TSecr=7556004
  453 30.144222882  10.6.15.156 → 192.168.1.12 TCP 66 22 → 54766 [ACK] Seq=43733 Ack=45901 Win=1452 Len=0 TSval=14487498 TSecr=7556004
  454 30.712229424  10.6.15.156 → 192.168.1.12 SSH 454 Server: Encrypted packet (len=388)
  455 30.712257020 192.168.1.12 → 10.6.15.156  TCP 66 54766 → 22 [ACK] Seq=45901 Ack=44121 Win=4866 Len=0 TSval=7556146 TSecr=14487551
  456 30.712272272  10.6.15.156 → 192.168.1.12 SSH 454 Server: Encrypted packet (len=388)
  457 30.712277734 192.168.1.12 → 10.6.15.156  TCP 66 54766 → 22 [ACK] Seq=45901 Ack=44509 Win=4866 Len=0 TSval=7556146 TSecr=14487551
  458 30.712337344  10.6.15.156 → 192.168.1.12 SSH 454 Server: Encrypted packet (len=388)
  459 30.712342473 192.168.1.12 → 10.6.15.156  TCP 66 54766 → 22 [ACK] Seq=45901 Ack=44897 Win=4866 Len=0 TSval=7556146 TSecr=14487551
  460 30.712399341  10.6.15.156 → 192.168.1.12 SSH 454 Server: Encrypted packet (len=388)
  461 30.712403693 192.168.1.12 → 10.6.15.156  TCP 66 54766 → 22 [ACK] Seq=45901 Ack=45285 Win=4866 Len=0 TSval=7556147 TSecr=14487552
  462 30.712459580  10.6.15.156 → 192.168.1.12 SSH 454 Server: [TCP Spurious Retransmission] , Encrypted packet (len=388)
  463 30.712464671 192.168.1.12 → 10.6.15.156  TCP 78 [TCP Dup ACK 461#1] 54766 → 22 [ACK] Seq=45901 Ack=45285 Win=4866 Len=0 TSval=7556147 TSecr=14487634 SLE=44897 SRE=45285
  464 30.946037072  10.6.15.156 → 192.168.1.12 SSH 134 Server: Encrypted packet (len=68)
  465 30.946052997 192.168.1.12 → 10.6.15.156  TCP 66 54766 → 22 [ACK] Seq=45901 Ack=45353 Win=4866 Len=0 TSval=7556205 TSecr=14487698
  466 30.946168588  10.6.15.156 → 192.168.1.12 SSH 102 Server: Encrypted packet (len=36)
  467 30.946173648 192.168.1.12 → 10.6.15.156  TCP 66 54766 → 22 [ACK] Seq=45901 Ack=45389 Win=4866 Len=0 TSval=7556205 TSecr=14487698
  468 31.132529017 192.168.1.12 → 10.6.15.156  SSH 138 Client: Encrypted packet (len=72)
  469 31.134217602  10.6.15.156 → 192.168.1.12 TCP 66 22 → 54766 [ACK] Seq=45389 Ack=45973 Win=1452 Len=0 TSval=14487745 TSecr=7556252
  470 31.134239919 192.168.1.12 → 10.6.15.156  SSH 862 Client: Encrypted packet (len=796)
  471 31.135042375  10.6.15.156 → 192.168.1.12 SSH 102 Server: Encrypted packet (len=36)
  472 31.135061230 192.168.1.12 → 10.6.15.156  TCP 66 54766 → 22 [ACK] Seq=46769 Ack=45425 Win=4866 Len=0 TSval=7556252 TSecr=14487745
  473 31.175656874  10.6.15.156 → 192.168.1.12 TCP 66 22 → 54766 [ACK] Seq=45425 Ack=46769 Win=1452 Len=0 TSval=14487756 TSecr=7556252
  474 31.354563048  10.6.15.156 → 192.168.1.12 SSH 454 Server: Encrypted packet (len=388)
  475 31.354579024 192.168.1.12 → 10.6.15.156  TCP 66 54766 → 22 [ACK] Seq=46769 Ack=45813 Win=4866 Len=0 TSval=7556307 TSecr=14487800
  476 32.721424181 10.22.17.139 → 224.0.0.252  LLMNR 67 Standard query 0x27c8 A ysjruij
  477 32.834227054 10.22.17.139 → 224.0.0.252  LLMNR 64 Standard query 0xf731 A wpad
  478 32.834794870 10.22.17.139 → 224.0.0.252  LLMNR 64 Standard query 0x3d9a A wpad
  479 33.134768833 10.22.17.139 → 224.0.0.252  LLMNR 67 Standard query 0x27c8 A ysjruij
  480 33.250187105 10.22.17.139 → 224.0.0.252  LLMNR 64 Standard query 0x3d9a A wpad
  481 33.250569137 10.22.17.139 → 224.0.0.252  LLMNR 64 Standard query 0xf731 A wpad
  482 34.395378876 192.168.1.12 → 10.6.15.156  SSH 486 Client: Encrypted packet (len=420)
  483 34.398504280  10.6.15.156 → 192.168.1.12 TCP 66 22 → 54766 [ACK] Seq=45813 Ack=47189 Win=1452 Len=0 TSval=14488561 TSecr=7557067
  484 34.501929817  10.6.15.156 → 192.168.1.12 SSH 222 Server: Encrypted packet (len=156)
  485 34.501951004 192.168.1.12 → 10.6.15.156  TCP 66 54766 → 22 [ACK] Seq=47189 Ack=45969 Win=4866 Len=0 TSval=7557094 TSecr=14488587
  486 34.719202291 10.22.17.139 → 224.0.0.252  LLMNR 72 Standard query 0x05f1 A lteuxwajgqev
  487 34.721741472 10.22.17.139 → 224.0.0.252  LLMNR 71 Standard query 0x53c5 A qpoydbijxbc
