    1 0.000000000  10.6.15.156 → 192.168.1.12 SSH 102 Server: Encrypted packet (len=36)
    2 0.006479518  10.6.15.156 → 192.168.1.12 SSH 102 Server: Encrypted packet (len=36)
    3 0.006531265 192.168.1.12 → 10.6.15.156  TCP 66 54766 → 22 [ACK] Seq=1 Ack=73 Win=6155 Len=0 TSval=8186979 TSecr=15118478
    4 0.008703142  10.6.15.156 → 192.168.1.12 SSH 246 Server: Encrypted packet (len=180)
    5 0.029108472  10.6.15.156 → 192.168.1.12 SSH 102 Server: Encrypted packet (len=36)
    6 0.029174341 192.168.1.12 → 10.6.15.156  TCP 66 54766 → 22 [ACK] Seq=1 Ack=289 Win=6155 Len=0 TSval=8186985 TSecr=15118480
    7 0.079432327  10.6.15.156 → 192.168.1.12 SSH 278 Server: Encrypted packet (len=212)
    8 0.119884832 192.168.1.12 → 10.6.15.156  SSH 102 Client: Encrypted packet (len=36)
    9 0.121469887  10.6.15.156 → 192.168.1.12 TCP 66 22 → 54766 [ACK] Seq=501 Ack=37 Win=1452 Len=0 TSval=15118508 TSecr=8187007
   10 0.121488331 192.168.1.12 → 10.6.15.156  SSH 110 Client: Encrypted packet (len=44)
   11 0.122871640  10.6.15.156 → 192.168.1.12 TCP 66 22 → 54766 [ACK] Seq=501 Ack=81 Win=1452 Len=0 TSval=15118509 TSecr=8187008
   12 0.137645158  10.6.15.156 → 192.168.1.12 SSH 190 Server: Encrypted packet (len=124)
   13 0.137674029  10.6.15.156 → 192.168.1.12 SSH 138 Server: Encrypted packet (len=72)
   14 0.137747322 192.168.1.12 → 10.6.15.156  TCP 66 54766 → 22 [ACK] Seq=81 Ack=697 Win=6155 Len=0 TSval=8187012 TSecr=15118512
   15 0.137911548 192.168.1.12 → 10.6.15.156  SSH 102 Client: Encrypted packet (len=36)
   16 0.161118323  10.6.15.156 → 192.168.1.12 SSH 102 Server: Encrypted packet (len=36)
   17 0.161130487 192.168.1.12 → 10.6.15.156  SSH 398 Client: Encrypted packet (len=332)
   18 0.161582894 192.168.1.12 → 10.6.15.156  SSH 1078 Client: Encrypted packet (len=1012)
   19 0.163675619  10.6.15.156 → 192.168.1.12 TCP 66 22 → 54766 [ACK] Seq=733 Ack=1461 Win=1452 Len=0 TSval=15118519 TSecr=8187018
   20 0.190196773 192.168.1.12 → 10.6.15.156  SSH 102 Client: Encrypted packet (len=36)
   21 0.190918861 192.168.1.12 → 10.6.15.156  SSH 110 Client: Encrypted packet (len=44)
   22 0.192251012  10.6.15.156 → 192.168.1.12 TCP 66 22 → 54766 [ACK] Seq=733 Ack=1541 Win=1452 Len=0 TSval=15118526 TSecr=8187025
   23 0.193332140 192.168.1.12 → 10.6.15.156  SSH 294 Client: Encrypted packet (len=228)
   24 0.208853424  10.6.15.156 → 192.168.1.12 SSH 138 Server: Encrypted packet (len=72)
   25 0.209080904 192.168.1.12 → 10.6.15.156  SSH 102 Client: Encrypted packet (len=36)
   26 0.212038122  10.6.15.156 → 192.168.1.12 SSH 470 Server: Encrypted packet (len=404)
   27 0.239434737  10.6.15.156 → 192.168.1.12 SSH 222 Server: Encrypted packet (len=156)
   28 0.239511065 192.168.1.12 → 10.6.15.156  TCP 66 54766 → 22 [ACK] Seq=1805 Ack=1365 Win=6155 Len=0 TSval=8187037 TSecr=15118531
   29 0.313616181  10.6.15.156 → 192.168.1.12 SSH 438 Server: Encrypted packet (len=372)
   30 0.319423335  10.6.15.156 → 192.168.1.12 SSH 222 Server: Encrypted packet (len=156)
   31 0.319488123 192.168.1.12 → 10.6.15.156  TCP 66 54766 → 22 [ACK] Seq=1805 Ack=1893 Win=6155 Len=0 TSval=8187057 TSecr=15118556
   32 0.375545372  10.6.15.156 → 192.168.1.12 SSH 278 Server: Encrypted packet (len=212)
   33 0.416993772 192.168.1.12 → 10.6.15.156  TCP 66 54766 → 22 [ACK] Seq=1805 Ack=2105 Win=6155 Len=0 TSval=8187082 TSecr=15118572
   34 0.433285795  10.6.15.156 → 192.168.1.12 SSH 110 Server: Encrypted packet (len=44)
   35 0.433364333 192.168.1.12 → 10.6.15.156  TCP 66 54766 → 22 [ACK] Seq=1805 Ack=2149 Win=6155 Len=0 TSval=8187086 TSecr=15118586
   36 0.433747527 192.168.1.12 → 10.6.15.156  SSH 630 Client: Encrypted packet (len=564)
   37 0.459932415  10.6.15.156 → 192.168.1.12 SSH 502 Server: Encrypted packet (len=436)
   38 0.500993623 192.168.1.12 → 10.6.15.156  TCP 66 54766 → 22 [ACK] Seq=2369 Ack=2585 Win=6155 Len=0 TSval=8187103 TSecr=15118593
   39 0.530318122  10.6.15.156 → 192.168.1.12 SSH 406 Server: Encrypted packet (len=340)
   40 0.530400846 192.168.1.12 → 10.6.15.156  TCP 66 54766 → 22 [ACK] Seq=2369 Ack=2925 Win=6155 Len=0 TSval=8187110 TSecr=15118610
   41 0.584106922 192.168.1.12 → 10.6.15.156  SSH 102 Client: Encrypted packet (len=36)
   42 0.588807383  10.6.15.156 → 192.168.1.12 SSH 342 Server: Encrypted packet (len=276)
   43 0.588832527 192.168.1.12 → 10.6.15.156  SSH 174 Client: Encrypted packet (len=108)
   44 0.593254700  10.6.15.156 → 192.168.1.12 SSH 138 Server: Encrypted packet (len=72)
   45 0.595467453 192.168.1.12 → 10.6.15.156  SSH 158 Client: Encrypted packet (len=92)
   46 0.595714382 192.168.1.12 → 10.6.15.156  SSH 206 Client: Encrypted packet (len=140)
   47 0.599709123  10.6.15.156 → 192.168.1.12 TCP 66 22 → 54766 [ACK] Seq=3273 Ack=2745 Win=1452 Len=0 TSval=15118628 TSecr=8187126
   48 0.607021718  10.6.15.156 → 192.168.1.12 SSH 414 Server: Encrypted packet (len=348)
   49 0.607038060  10.6.15.156 → 192.168.1.12 SSH 138 Server: Encrypted packet (len=72)
   50 0.607090956 192.168.1.12 → 10.6.15.156  TCP 66 54766 → 22 [ACK] Seq=2745 Ack=3693 Win=6155 Len=0 TSval=8187129 TSecr=15118630
   51 0.607266412 192.168.1.12 → 10.6.15.156  SSH 102 Client: Encrypted packet (len=36)
   52 0.609134975  10.6.15.156 → 192.168.1.12 SSH 214 Server: Encrypted packet (len=148)
   53 0.623465839  10.6.15.156 → 192.168.1.12 SSH 138 Server: Encrypted packet (len=72)
   54 0.623544834 192.168.1.12 → 10.6.15.156  TCP 66 54766 → 22 [ACK] Seq=2781 Ack=3913 Win=6155 Len=0 TSval=8187133 TSecr=15118630
   55 0.623764327 192.168.1.12 → 10.6.15.156  SSH 102 Client: Encrypted packet (len=36)
   56 0.662490766  10.6.15.156 → 192.168.1.12 TCP 66 22 → 54766 [ACK] Seq=3913 Ack=2817 Win=1452 Len=0 TSval=15118644 TSecr=8187133
   57 0.662502399 192.168.1.12 → 10.6.15.156  SSH 466 Client: Encrypted packet (len=400)
   58 0.664401130  10.6.15.156 → 192.168.1.12 TCP 66 22 → 54766 [ACK] Seq=3913 Ack=3217 Win=1452 Len=0 TSval=15118644 TSecr=8187143
   59 0.680826714  10.6.15.156 → 192.168.1.12 SSH 470 Server: Encrypted packet (len=404)
   60 0.690844378  10.6.15.156 → 192.168.1.12 SSH 514 Server: Encrypted packet (len=448)
   61 0.690869673  10.6.15.156 → 192.168.1.12 SSH 294 Server: Encrypted packet (len=228)
   62 0.690932030 192.168.1.12 → 10.6.15.156  TCP 66 54766 → 22 [ACK] Seq=3217 Ack=4993 Win=6155 Len=0 TSval=8187150 TSecr=15118648
   63 0.759785221  10.6.15.156 → 192.168.1.12 SSH 158 Server: Encrypted packet (len=92)
   64 0.760039813 192.168.1.12 → 10.6.15.156  SSH 150 Client: Encrypted packet (len=84)
   65 0.798525811  10.6.15.156 → 192.168.1.12 TCP 66 22 → 54766 [ACK] Seq=5085 Ack=3301 Win=1452 Len=0 TSval=15118678 TSecr=8187167
   66 0.838706818 192.168.1.12 → 10.6.15.156  SSH 102 Client: Encrypted packet (len=36)
   67 0.840414152  10.6.15.156 → 192.168.1.12 TCP 66 22 → 54766 [ACK] Seq=5085 Ack=3337 Win=1452 Len=0 TSval=15118688 TSecr=8187187
   68 0.840432702 192.168.1.12 → 10.6.15.156  SSH 126 Client: Encrypted packet (len=60)
   69 0.842172298  10.6.15.156 → 192.168.1.12 TCP 66 22 → 54766 [ACK] Seq=5085 Ack=3397 Win=1452 Len=0 TSval=15118688 TSecr=8187187
   70 0.846636049 192.168.1.12 → 10.6.15.156  SSH 582 Client: Encrypted packet (len=516)
   71 0.847088540 192.168.1.12 → 10.6.15.156  SSH 142 Client: Encrypted packet (len=76)
   72 0.848669867  10.6.15.156 → 192.168.1.12 TCP 66 22 → 54766 [ACK] Seq=5085 Ack=3989 Win=1452 Len=0 TSval=15118690 TSecr=8187189
   73 0.851424941  10.6.15.156 → 192.168.1.12 SSH 302 Server: Encrypted packet (len=236)
   74 0.852816991 192.168.1.12 → 10.6.15.156  SSH 134 Client: Encrypted packet (len=68)
   75 0.856743331  10.6.15.156 → 192.168.1.12 SSH 138 Server: Encrypted packet (len=72)
   76 0.857057976 192.168.1.12 → 10.6.15.156  SSH 102 Client: Encrypted packet (len=36)
   77 0.858905559  10.6.15.156 → 192.168.1.12 SSH 102 Server: Encrypted packet (len=36)
   78 0.859167228 192.168.1.12 → 10.6.15.156  SSH 222 Client: Encrypted packet (len=156)
   79 0.879758028  10.6.15.156 → 192.168.1.12 SSH 158 Server: Encrypted packet (len=92)
   80 0.885817258  10.6.15.156 → 192.168.1.12 SSH 1514 Server: Encrypted packet (len=1448)
   81 0.885837733 192.168.1.12 → 10.6.15.156  TCP 66 54766 → 22 [ACK] Seq=4249 Ack=6969 Win=6155 Len=0 TSval=8187199 TSecr=15118698
   82 0.885867516  10.6.15.156 → 192.168.1.12 SSH 318 Server: Encrypted packet (len=252)
   83 0.887324122  10.6.15.156 → 192.168.1.12 SSH 1514 Server: Encrypted packet (len=1448)
   84 0.887342148 192.168.1.12 → 10.6.15.156  TCP 66 54766 → 22 [ACK] Seq=4249 Ack=8669 Win=6155 Len=0 TSval=8187199 TSecr=15118699
   85 0.887480901  10.6.15.156 → 192.168.1.12 SSH 1390 Server: Encrypted packet (len=1324)
   86 0.887784344  10.6.15.156 → 192.168.1.12 SSH 1230 Server: Encrypted packet (len=1164)
   87 0.887790867 192.168.1.12 → 10.6.15.156  TCP 66 54766 → 22 [ACK] Seq=4249 Ack=11157 Win=6155 Len=0 TSval=8187199 TSecr=15118700
   88 0.910641224  10.6.15.156 → 192.168.1.12 SSH 190 Server: Encrypted packet (len=124)
   89 0.952999905 192.168.1.12 → 10.6.15.156  TCP 66 54766 → 22 [ACK] Seq=4249 Ack=11281 Win=6155 Len=0 TSval=8187216 TSecr=15118706
   90 0.981336932  10.6.15.156 → 192.168.1.12 SSH 470 Server: Encrypted packet (len=404)
   91 0.981429311 192.168.1.12 → 10.6.15.156  TCP 66 54766 → 22 [ACK] Seq=4249 Ack=11685 Win=6155 Len=0 TSval=8187223 TSecr=15118723
   92 1.017420593  10.6.15.156 → 192.168.1.12 SSH 150 Server: Encrypted packet (len=84)
   93 1.017502907 192.168.1.12 → 10.6.15.156  TCP 66 54766 → 22 [ACK] Seq=4249 Ack=11769 Win=6155 Len=0 TSval=8187232 TSecr=15118732
   94 1.017716716 192.168.1.12 → 10.6.15.156  SSH 150 Client: Encrypted packet (len=84)
   95 1.040149086  10.6.15.156 → 192.168.1.12 SSH 438 Server: Encrypted packet (len=372)
   96 1.080996837 192.168.1.12 → 10.6.15.156  TCP 66 54766 → 22 [ACK] Seq=4333 Ack=12141 Win=6155 Len=0 TSval=8187248 TSecr=15118738
   97 1.108108623 192.168.1.12 → 10.6.15.156  SSH 190 Client: Encrypted packet (len=124)
   98 1.121127475  10.6.15.156 → 192.168.1.12 SSH 118 Server: Encrypted packet (len=52)
   99 1.121202730 192.168.1.12 → 10.6.15.156  TCP 66 54766 → 22 [ACK] Seq=4457 Ack=12193 Win=6155 Len=0 TSval=8187258 TSecr=15118758
  100 1.141537147  10.6.15.156 → 192.168.1.12 SSH 310 Server: Encrypted packet (len=244)
  101 1.141629125 192.168.1.12 → 10.6.15.156  TCP 66 54766 → 22 [ACK] Seq=4457 Ack=12437 Win=6155 Len=0 TSval=8187263 TSecr=15118763
  102 1.150225454 192.168.1.12 → 10.6.15.156  SSH 102 Client: Encrypted packet (len=36)
  103 1.168330932  10.6.15.156 → 192.168.1.12 SSH 138 Server: Encrypted packet (len=72)
  104 1.168360760 192.168.1.12 → 10.6.15.156  SSH 110 Client: Encrypted packet (len=44)
  105 1.168663991 192.168.1.12 → 10.6.15.156  SSH 102 Client: Encrypted packet (len=36)
  106 1.169951398  10.6.15.156 → 192.168.1.12 TCP 66 22 → 54766 [ACK] Seq=12509 Ack=4573 Win=1452 Len=0 TSval=15118770 TSecr=8187269
  107 1.175411913 192.168.1.12 → 10.6.15.156  SSH 230 Client: Encrypted packet (len=164)
  108 1.186627594  10.6.15.156 → 192.168.1.12 SSH 110 Server: Encrypted packet (len=44)
  109 1.187879596 192.168.1.12 → 10.6.15.156  SSH 134 Client: Encrypted packet (len=68)
  110 1.208164167  10.6.15.156 → 192.168.1.12 SSH 1198 Server: Encrypted packet (len=1132)
  111 1.208397470  10.6.15.156 → 192.168.1.12 SSH 774 Server: Encrypted packet (len=708)
  112 1.208406199 192.168.1.12 → 10.6.15.156  TCP 66 54766 → 22 [ACK] Seq=4805 Ack=14393 Win=6155 Len=0 TSval=8187279 TSecr=15118780
  113 1.362096451  10.6.15.156 → 192.168.1.12 SSH 406 Server: Encrypted packet (len=340)
  114 1.386501129  10.6.15.156 → 192.168.1.12 SSH 134 Server: Encrypted packet (len=68)
  115 1.386589996 192.168.1.12 → 10.6.15.156  TCP 66 54766 → 22 [ACK] Seq=4805 Ack=14801 Win=6155 Len=0 TSval=8187324 TSecr=15118818
  116 1.392097885 192.168.1.12 → 10.6.15.156  SSH 102 Client: Encrypted packet (len=36)
  117 1.410116814  10.6.15.156 → 192.168.1.12 SSH 138 Server: Encrypted packet (len=72)
  118 1.410140048 192.168.1.12 → 10.6.15.156  SSH 726 Client: Encrypted packet (len=660)
  119 1.410693946 192.168.1.12 → 10.6.15.156  SSH 102 Client: Encrypted packet (len=36)
  120 1.412468556  10.6.15.156 → 192.168.1.12 TCP 66 22 → 54766 [ACK] Seq=14873 Ack=5537 Win=1452 Len=0 TSval=15118831 TSecr=8187330
  121 1.414594377  10.6.15.156 → 192.168.1.12 SSH 138 Server: Encrypted packet (len=72)
  122 1.414606278  10.6.15.156 → 192.168.1.12 SSH 138 Server: Encrypted packet (len=72)
  123 1.414662713 192.168.1.12 → 10.6.15.156  TCP 66 54766 → 22 [ACK] Seq=5537 Ack=15017 Win=6155 Len=0 TSval=8187331 TSecr=15118832
  124 1.414880447 192.168.1.12 → 10.6.15.156  SSH 102 Client: Encrypted packet (len=36)
  125 1.429146599  10.6.15.156 → 192.168.1.12 SSH 498 Server: Encrypted packet (len=432)
  126 1.429848131 192.168.1.12 → 10.6.15.156  SSH 282 Client: Encrypted packet (len=216)
  127 1.433281139  10.6.15.156 → 192.168.1.12 SSH 278 Server: Encrypted packet (len=212)
  128 1.442092068 192.168.1.12 → 10.6.15.156  SSH 222 Client: Encrypted packet (len=156)
  129 1.450442065  10.6.15.156 → 192.168.1.12 SSH 174 Server: Encrypted packet (len=108)
  130 1.450859226 192.168.1.12 → 10.6.15.156  SSH 222 Client: Encrypted packet (len=156)
  131 1.452220797  10.6.15.156 → 192.168.1.12 SSH 138 Server: Encrypted packet (len=72)
  132 1.470174069  10.6.15.156 → 192.168.1.12 SSH 134 Server: Encrypted packet (len=68)
  133 1.470259630 192.168.1.12 → 10.6.15.156  TCP 66 54766 → 22 [ACK] Seq=6101 Ack=15909 Win=6155 Len=0 TSval=8187345 TSecr=15118841
  134 1.491150750  10.6.15.156 → 192.168.1.12 SSH 374 Server: Encrypted packet (len=308)
  135 1.511609200  10.6.15.156 → 192.168.1.12 SSH 1514 Server: Encrypted packet (len=1448)
  136 1.511624397 192.168.1.12 → 10.6.15.156  TCP 66 54766 → 22 [ACK] Seq=6101 Ack=17665 Win=6155 Len=0 TSval=8187355 TSecr=15118851
  137 1.511639729  10.6.15.156 → 192.168.1.12 SSH 414 Server: Encrypted packet (len=348)
  138 1.553001813 192.168.1.12 → 10.6.15.156  TCP 66 54766 → 22 [ACK] Seq=6101 Ack=18013 Win=6155 Len=0 TSval=8187366 TSecr=15118856
  139 1.590566372  10.6.15.156 → 192.168.1.12 SSH 138 Server: Encrypted packet (len=72)
  140 1.590651356 192.168.1.12 → 10.6.15.156  TCP 66 54766 → 22 [ACK] Seq=6101 Ack=18085 Win=6155 Len=0 TSval=8187375 TSecr=15118875
  141 1.590877007 192.168.1.12 → 10.6.15.156  SSH 102 Client: Encrypted packet (len=36)
  142 1.592937030  10.6.15.156 → 192.168.1.12 SSH 374 Server: Encrypted packet (len=308)
  143 1.626665577  10.6.15.156 → 192.168.1.12 SSH 146 Server: Encrypted packet (len=80)
  144 1.626685699 192.168.1.12 → 10.6.15.156  TCP 66 54766 → 22 [ACK] Seq=6137 Ack=18473 Win=6155 Len=0 TSval=8187384 TSecr=15118876
  145 1.648830595  10.22.18.83 → 224.0.0.252  LLMNR 72 Standard query 0xb5eb ANY LenovoPranav
  146 1.672893374 192.168.1.12 → 10.6.15.156  SSH 1230 Client: Encrypted packet (len=1164)
  147 1.714409349  10.6.15.156 → 192.168.1.12 TCP 66 22 → 54766 [ACK] Seq=18473 Ack=7301 Win=1452 Len=0 TSval=15118907 TSecr=8187395
  148 1.715617527  10.6.15.156 → 192.168.1.12 SSH 254 Server: Encrypted packet (len=188)
  149 1.738607629  10.6.15.156 → 192.168.1.12 SSH 318 Server: Encrypted packet (len=252)
  150 1.738679717 192.168.1.12 → 10.6.15.156  TCP 66 54766 → 22 [ACK] Seq=7301 Ack=18913 Win=6155 Len=0 TSval=8187412 TSecr=15118907
  151 1.808785779 192.168.1.12 → 10.6.15.156  SSH 742 Client: Encrypted packet (len=676)
  152 1.812906534  10.6.15.156 → 192.168.1.12 TCP 66 22 → 54766 [ACK] Seq=18913 Ack=7977 Win=1452 Len=0 TSval=15118931 TSecr=8187429
  153 1.812923063  10.6.15.156 → 192.168.1.12 SSH 254 Server: Encrypted packet (len=188)
  154 1.816419393  10.6.15.156 → 192.168.1.12 SSH 1514 Server: Encrypted packet (len=1448)
  155 1.816436159 192.168.1.12 → 10.6.15.156  TCP 66 54766 → 22 [ACK] Seq=7977 Ack=20549 Win=6155 Len=0 TSval=8187431 TSecr=15118931
  156 1.816584499  10.6.15.156 → 192.168.1.12 SSH 1514 Server: Encrypted packet (len=1448)
  157 1.816790914  10.6.15.156 → 192.168.1.12 SSH 1514 Server: Encrypted packet (len=1448)
  158 1.816796609 192.168.1.12 → 10.6.15.156  TCP 66 54766 → 22 [ACK] Seq=7977 Ack=23445 Win=6155 Len=0 TSval=8187431 TSecr=15118932
  159 1.816804725  10.6.15.156 → 192.168.1.12 SSH 110 Server: Encrypted packet (len=44)
  160 1.817135832  10.6.15.156 → 192.168.1.12 SSH 1514 Server: Encrypted packet (len=1448)
  161 1.817140183 192.168.1.12 → 10.6.15.156  TCP 66 54766 → 22 [ACK] Seq=7977 Ack=24937 Win=6155 Len=0 TSval=8187432 TSecr=15118932
  162 1.817472444  10.6.15.156 → 192.168.1.12 SSH 1514 Server: Encrypted packet (len=1448)
  163 1.817663610  10.6.15.156 → 192.168.1.12 SSH 1514 Server: Encrypted packet (len=1448)
  164 1.817666802 192.168.1.12 → 10.6.15.156  TCP 66 54766 → 22 [ACK] Seq=7977 Ack=27833 Win=6155 Len=0 TSval=8187432 TSecr=15118932
  165 1.819994469  10.6.15.156 → 192.168.1.12 SSH 1514 Server: Encrypted packet (len=1448)
  166 1.820173166  10.6.15.156 → 192.168.1.12 SSH 1514 Server: Encrypted packet (len=1448)
  167 1.820179059 192.168.1.12 → 10.6.15.156  TCP 66 54766 → 22 [ACK] Seq=7977 Ack=30729 Win=6155 Len=0 TSval=8187432 TSecr=15118932
  168 1.820368393  10.6.15.156 → 192.168.1.12 SSH 1514 Server: Encrypted packet (len=1448)
  169 1.820570202  10.6.15.156 → 192.168.1.12 SSH 1514 Server: Encrypted packet (len=1448)
  170 1.820575831 192.168.1.12 → 10.6.15.156  TCP 66 54766 → 22 [ACK] Seq=7977 Ack=33625 Win=6155 Len=0 TSval=8187432 TSecr=15118932
  171 1.820900904  10.6.15.156 → 192.168.1.12 SSH 1514 Server: Encrypted packet (len=1448)
  172 1.820905467  10.6.15.156 → 192.168.1.12 SSH 110 Server: Encrypted packet (len=44)
  173 1.820908352 192.168.1.12 → 10.6.15.156  TCP 66 54766 → 22 [ACK] Seq=7977 Ack=35117 Win=6155 Len=0 TSval=8187432 TSecr=15118932
  174 1.821116275  10.6.15.156 → 192.168.1.12 SSH 1514 Server: Encrypted packet (len=1448)
  175 1.821228906  10.6.15.156 → 192.168.1.12 SSH 918 Server: Encrypted packet (len=852)
  176 1.821233903 192.168.1.12 → 10.6.15.156  TCP 66 54766 → 22 [ACK] Seq=7977 Ack=37417 Win=6155 Len=0 TSval=8187433 TSecr=15118932
  177 1.871519889 10.22.18.100 → 224.0.0.252  LLMNR 64 Standard query 0x8745 A wpad
  178 1.871927738 10.22.18.100 → 224.0.0.252  LLMNR 64 Standard query 0xd76f AAAA wpad
  179 1.883323664  10.6.15.156 → 192.168.1.12 SSH 222 Server: Encrypted packet (len=156)
  180 1.924997732 192.168.1.12 → 10.6.15.156  TCP 66 54766 → 22 [ACK] Seq=7977 Ack=37573 Win=6155 Len=0 TSval=8187459 TSecr=15118949
  181 1.941749544  10.6.15.156 → 192.168.1.12 SSH 222 Server: Encrypted packet (len=156)
  182 1.941834491 192.168.1.12 → 10.6.15.156  TCP 66 54766 → 22 [ACK] Seq=7977 Ack=37729 Win=6155 Len=0 TSval=8187463 TSecr=15118963
  183 2.043439084  10.6.15.156 → 192.168.1.12 SSH 222 Server: Encrypted packet (len=156)
  184 2.043529392 192.168.1.12 → 10.6.15.156  TCP 66 54766 → 22 [ACK] Seq=7977 Ack=37885 Win=6155 Len=0 TSval=8187488 TSecr=15118989
  185 2.263722399  10.6.15.156 → 192.168.1.12 SSH 294 Server: Encrypted packet (len=228)
  186 2.263742765 192.168.1.12 → 10.6.15.156  TCP 66 54766 → 22 [ACK] Seq=7977 Ack=38113 Win=6155 Len=0 TSval=8187543 TSecr=15119044
  187 2.281880293 10.22.18.100 → 224.0.0.252  LLMNR 64 Standard query 0x8745 A wpad
  188 2.281946153 10.22.18.100 → 224.0.0.252  LLMNR 64 Standard query 0xd76f AAAA wpad
  189 2.334268203  10.6.15.156 → 192.168.1.12 SSH 190 Server: Encrypted packet (len=124)
  190 2.334286184 192.168.1.12 → 10.6.15.156  TCP 66 54766 → 22 [ACK] Seq=7977 Ack=38237 Win=6155 Len=0 TSval=8187561 TSecr=15119061
  191 2.392718120  10.6.15.156 → 192.168.1.12 SSH 190 Server: Encrypted packet (len=124)
  192 2.392734194 192.168.1.12 → 10.6.15.156  TCP 66 54766 → 22 [ACK] Seq=7977 Ack=38361 Win=6155 Len=0 TSval=8187575 TSecr=15119076
  193 2.495732305  10.6.15.156 → 192.168.1.12 SSH 270 Server: Encrypted packet (len=204)
  194 2.495750388 192.168.1.12 → 10.6.15.156  TCP 66 54766 → 22 [ACK] Seq=7977 Ack=38565 Win=6155 Len=0 TSval=8187601 TSecr=15119102
  195 2.717049097  10.6.15.156 → 192.168.1.12 SSH 270 Server: Encrypted packet (len=204)
  196 2.717076443 192.168.1.12 → 10.6.15.156  TCP 66 54766 → 22 [ACK] Seq=7977 Ack=38769 Win=6155 Len=0 TSval=8187657 TSecr=15119157
  197 2.785164480  10.6.15.156 → 192.168.1.12 SSH 214 Server: Encrypted packet (len=148)
  198 2.785183327 192.168.1.12 → 10.6.15.156  TCP 66 54766 → 22 [ACK] Seq=7977 Ack=38917 Win=6155 Len=0 TSval=8187674 TSecr=15119174
  199 2.843906330  10.6.15.156 → 192.168.1.12 SSH 270 Server: Encrypted packet (len=204)
  200 2.843923951 192.168.1.12 → 10.6.15.156  TCP 66 54766 → 22 [ACK] Seq=7977 Ack=39121 Win=6155 Len=0 TSval=8187688 TSecr=15119189
  201 2.924823749 192.168.1.12 → 10.6.15.156  SSH 934 Client: Encrypted packet (len=868)
  202 2.945557618  10.6.15.156 → 192.168.1.12 SSH 270 Server: Encrypted packet (len=204)
  203 2.945587284 192.168.1.12 → 10.6.15.156  TCP 66 54766 → 22 [ACK] Seq=8845 Ack=39325 Win=6155 Len=0 TSval=8187714 TSecr=15119214
  204 3.237243320  10.6.15.156 → 192.168.1.12 SSH 238 Server: Encrypted packet (len=172)
  205 3.237268918 192.168.1.12 → 10.6.15.156  TCP 66 54766 → 22 [ACK] Seq=8845 Ack=39497 Win=6155 Len=0 TSval=8187787 TSecr=15119287
  206 3.294770590  10.6.15.156 → 192.168.1.12 SSH 238 Server: Encrypted packet (len=172)
  207 3.294787934 192.168.1.12 → 10.6.15.156  TCP 66 54766 → 22 [ACK] Seq=8845 Ack=39669 Win=6155 Len=0 TSval=8187801 TSecr=15119302
  208 3.341635001  10.6.15.156 → 192.168.1.12 SSH 534 Server: Encrypted packet (len=468)
  209 3.341653011 192.168.1.12 → 10.6.15.156  TCP 66 54766 → 22 [ACK] Seq=8845 Ack=40137 Win=6155 Len=0 TSval=8187813 TSecr=15119313
  210 3.618681805  10.6.15.156 → 192.168.1.12 SSH 406 Server: Encrypted packet (len=340)
  211 3.618702343 192.168.1.12 → 10.6.15.156  TCP 66 54766 → 22 [ACK] Seq=8845 Ack=40477 Win=6155 Len=0 TSval=8187882 TSecr=15119382
  212 3.666329197  10.6.15.156 → 192.168.1.12 SSH 158 Server: Encrypted packet (len=92)
  213 3.666349598 192.168.1.12 → 10.6.15.156  TCP 66 54766 → 22 [ACK] Seq=8845 Ack=40569 Win=6155 Len=0 TSval=8187894 TSecr=15119394
  214 3.666649536 192.168.1.12 → 10.6.15.156  SSH 158 Client: Encrypted packet (len=92)
  215 3.687548300  10.6.15.156 → 192.168.1.12 SSH 518 Server: Encrypted packet (len=452)
  216 3.729010485 192.168.1.12 → 10.6.15.156  TCP 66 54766 → 22 [ACK] Seq=8937 Ack=41021 Win=6155 Len=0 TSval=8187910 TSecr=15119400
  217 3.746017202  10.6.15.156 → 192.168.1.12 SSH 406 Server: Encrypted packet (len=340)
  218 3.746041816 192.168.1.12 → 10.6.15.156  TCP 66 54766 → 22 [ACK] Seq=8937 Ack=41361 Win=6155 Len=0 TSval=8187914 TSecr=15119414
  219 3.848806397  10.6.15.156 → 192.168.1.12 SSH 310 Server: Encrypted packet (len=244)
  220 3.848824422 192.168.1.12 → 10.6.15.156  TCP 66 54766 → 22 [ACK] Seq=8937 Ack=41605 Win=6155 Len=0 TSval=8187939 TSecr=15119440
  221 4.068800474  10.6.15.156 → 192.168.1.12 SSH 358 Server: Encrypted packet (len=292)
  222 4.068826592 192.168.1.12 → 10.6.15.156  TCP 66 54766 → 22 [ACK] Seq=8937 Ack=41897 Win=6155 Len=0 TSval=8187994 TSecr=15119495
  223 4.139120090  10.6.15.156 → 192.168.1.12 SSH 286 Server: Encrypted packet (len=220)
  224 4.139138058 192.168.1.12 → 10.6.15.156  TCP 66 54766 → 22 [ACK] Seq=8937 Ack=42117 Win=6155 Len=0 TSval=8188012 TSecr=15119512
  225 4.171869664  10.22.18.83 → 224.0.0.252  LLMNR 72 Standard query 0x71a4 ANY LenovoPranav
  226 4.182090230  10.6.15.156 → 192.168.1.12 SSH 150 Server: Encrypted packet (len=84)
  227 4.182107692 192.168.1.12 → 10.6.15.156  TCP 66 54766 → 22 [ACK] Seq=8937 Ack=42201 Win=6155 Len=0 TSval=8188023 TSecr=15119523
  228 4.182430754 192.168.1.12 → 10.6.15.156  SSH 150 Client: Encrypted packet (len=84)
  229 4.196893630  10.6.15.156 → 192.168.1.12 SSH 326 Server: Encrypted packet (len=260)
  230 4.237024713 192.168.1.12 → 10.6.15.156  TCP 66 54766 → 22 [ACK] Seq=9021 Ack=42461 Win=6155 Len=0 TSval=8188037 TSecr=15119527
  231 4.299092590  10.6.15.156 → 192.168.1.12 SSH 454 Server: Encrypted packet (len=388)
  232 4.299120389 192.168.1.12 → 10.6.15.156  TCP 66 54766 → 22 [ACK] Seq=9021 Ack=42849 Win=6155 Len=0 TSval=8188052 TSecr=15119553
  233 4.519255262  10.6.15.156 → 192.168.1.12 SSH 270 Server: Encrypted packet (len=204)
  234 4.519283728 192.168.1.12 → 10.6.15.156  TCP 66 54766 → 22 [ACK] Seq=9021 Ack=43053 Win=6155 Len=0 TSval=8188107 TSecr=15119608
  235 4.592720240  10.6.15.156 → 192.168.1.12 SSH 254 Server: Encrypted packet (len=188)
  236 4.592737135 192.168.1.12 → 10.6.15.156  TCP 66 54766 → 22 [ACK] Seq=9021 Ack=43241 Win=6155 Len=0 TSval=8188125 TSecr=15119625
  237 4.649033682  10.6.15.156 → 192.168.1.12 SSH 222 Server: Encrypted packet (len=156)
  238 4.649051520 192.168.1.12 → 10.6.15.156  TCP 66 54766 → 22 [ACK] Seq=9021 Ack=43397 Win=6155 Len=0 TSval=8188140 TSecr=15119640
  239 4.749485429  10.6.15.156 → 192.168.1.12 SSH 190 Server: Encrypted packet (len=124)
  240 4.749502738 192.168.1.12 → 10.6.15.156  TCP 66 54766 → 22 [ACK] Seq=9021 Ack=43521 Win=6155 Len=0 TSval=8188165 TSecr=15119665
  241 4.970273445  10.6.15.156 → 192.168.1.12 SSH 374 Server: Encrypted packet (len=308)
  242 4.970290837 192.168.1.12 → 10.6.15.156  TCP 66 54766 → 22 [ACK] Seq=9021 Ack=43829 Win=6155 Len=0 TSval=8188220 TSecr=15119720
  243 5.099063931  10.6.15.156 → 192.168.1.12 SSH 222 Server: Encrypted packet (len=156)
  244 5.099087071 192.168.1.12 → 10.6.15.156  TCP 66 54766 → 22 [ACK] Seq=9021 Ack=43985 Win=6155 Len=0 TSval=8188252 TSecr=15119753
  245 5.200793659  10.6.15.156 → 192.168.1.12 SSH 326 Server: Encrypted packet (len=260)
  246 5.200810713 192.168.1.12 → 10.6.15.156  TCP 66 54766 → 22 [ACK] Seq=9021 Ack=44245 Win=6155 Len=0 TSval=8188277 TSecr=15119778
  247 5.421468412  10.6.15.156 → 192.168.1.12 SSH 646 Server: Encrypted packet (len=580)
  248 5.421486125 192.168.1.12 → 10.6.15.156  TCP 66 54766 → 22 [ACK] Seq=9021 Ack=44825 Win=6155 Len=0 TSval=8188333 TSecr=15119833
  249 5.491905633  10.6.15.156 → 192.168.1.12 SSH 550 Server: Encrypted packet (len=484)
  250 5.491923734 192.168.1.12 → 10.6.15.156  TCP 66 54766 → 22 [ACK] Seq=9021 Ack=45309 Win=6155 Len=0 TSval=8188350 TSecr=15119851
  251 5.550330424  10.6.15.156 → 192.168.1.12 SSH 726 Server: Encrypted packet (len=660)
  252 5.550348321 192.168.1.12 → 10.6.15.156  TCP 66 54766 → 22 [ACK] Seq=9021 Ack=45969 Win=6155 Len=0 TSval=8188365 TSecr=15119865
  253 5.651851791  10.6.15.156 → 192.168.1.12 SSH 630 Server: Encrypted packet (len=564)
  254 5.651870206 192.168.1.12 → 10.6.15.156  TCP 66 54766 → 22 [ACK] Seq=9021 Ack=46533 Win=6155 Len=0 TSval=8188390 TSecr=15119891
  255 5.652033652 192.168.1.12 → 10.6.15.156  SSH 102 Client: Encrypted packet (len=36)
  256 5.690554640  10.6.15.156 → 192.168.1.12 TCP 66 22 → 54766 [ACK] Seq=46533 Ack=9057 Win=1452 Len=0 TSval=15119901 TSecr=8188390
  257 5.942511178  10.6.15.156 → 192.168.1.12 SSH 438 Server: Encrypted packet (len=372)
  258 5.985047755 192.168.1.12 → 10.6.15.156  TCP 66 54766 → 22 [ACK] Seq=9057 Ack=46905 Win=6155 Len=0 TSval=8188474 TSecr=15119964
  259 6.000781955  10.6.15.156 → 192.168.1.12 SSH 182 Server: Encrypted packet (len=116)
  260 6.000808318 192.168.1.12 → 10.6.15.156  TCP 66 54766 → 22 [ACK] Seq=9057 Ack=47021 Win=6155 Len=0 TSval=8188477 TSecr=15119978
  261 6.104213293  10.6.15.156 → 192.168.1.12 SSH 182 Server: Encrypted packet (len=116)
  262 6.104235727 192.168.1.12 → 10.6.15.156  TCP 66 54766 → 22 [ACK] Seq=9057 Ack=47137 Win=6155 Len=0 TSval=8188503 TSecr=15120004
  263 6.322708833  10.6.15.156 → 192.168.1.12 SSH 222 Server: Encrypted packet (len=156)
  264 6.322727082 192.168.1.12 → 10.6.15.156  TCP 66 54766 → 22 [ACK] Seq=9057 Ack=47293 Win=6155 Len=0 TSval=8188558 TSecr=15120059
  265 6.451825657  10.6.15.156 → 192.168.1.12 SSH 270 Server: Encrypted packet (len=204)
  266 6.451840323 192.168.1.12 → 10.6.15.156  TCP 66 54766 → 22 [ACK] Seq=9057 Ack=47497 Win=6155 Len=0 TSval=8188590 TSecr=15120091
  267 6.553531577  10.6.15.156 → 192.168.1.12 SSH 302 Server: Encrypted packet (len=236)
  268 6.553549181 192.168.1.12 → 10.6.15.156  TCP 66 54766 → 22 [ACK] Seq=9057 Ack=47733 Win=6155 Len=0 TSval=8188616 TSecr=15120116
  269 6.775002512  10.6.15.156 → 192.168.1.12 SSH 374 Server: Encrypted packet (len=308)
  270 6.775020695 192.168.1.12 → 10.6.15.156  TCP 66 54766 → 22 [ACK] Seq=9057 Ack=48041 Win=6155 Len=0 TSval=8188671 TSecr=15120171
  271 6.844574905  10.6.15.156 → 192.168.1.12 SSH 422 Server: Encrypted packet (len=356)
  272 6.844592626 192.168.1.12 → 10.6.15.156  TCP 66 54766 → 22 [ACK] Seq=9057 Ack=48397 Win=6155 Len=0 TSval=8188688 TSecr=15120189
  273 6.902946830  10.6.15.156 → 192.168.1.12 SSH 374 Server: Encrypted packet (len=308)
  274 6.902966956 192.168.1.12 → 10.6.15.156  TCP 66 54766 → 22 [ACK] Seq=9057 Ack=48705 Win=6155 Len=0 TSval=8188703 TSecr=15120204
  275 7.004768150  10.6.15.156 → 192.168.1.12 SSH 342 Server: Encrypted packet (len=276)
  276 7.004785647 192.168.1.12 → 10.6.15.156  TCP 66 54766 → 22 [ACK] Seq=9057 Ack=48981 Win=6155 Len=0 TSval=8188728 TSecr=15120229
  277 7.224625876  10.6.15.156 → 192.168.1.12 SSH 206 Server: Encrypted packet (len=140)
  278 7.224642104 192.168.1.12 → 10.6.15.156  TCP 66 54766 → 22 [ACK] Seq=9057 Ack=49121 Win=6155 Len=0 TSval=8188783 TSecr=15120284
  279 7.307027650  10.6.15.156 → 192.168.1.12 SSH 214 Server: Encrypted packet (len=148)
  280 7.307046973 192.168.1.12 → 10.6.15.156  TCP 66 54766 → 22 [ACK] Seq=9057 Ack=49269 Win=6155 Len=0 TSval=8188804 TSecr=15120302
  281 7.455477905  10.6.15.156 → 192.168.1.12 SSH 254 Server: Encrypted packet (len=188)
  282 7.455495574 192.168.1.12 → 10.6.15.156  TCP 66 54766 → 22 [ACK] Seq=9057 Ack=49457 Win=6155 Len=0 TSval=8188841 TSecr=15120342
  283 7.675830699  10.6.15.156 → 192.168.1.12 SSH 270 Server: Encrypted packet (len=204)
  284 7.675848651 192.168.1.12 → 10.6.15.156  TCP 66 54766 → 22 [ACK] Seq=9057 Ack=49661 Win=6155 Len=0 TSval=8188896 TSecr=15120397
  285 7.746197540  10.6.15.156 → 192.168.1.12 SSH 254 Server: Encrypted packet (len=188)
  286 7.746214916 192.168.1.12 → 10.6.15.156  TCP 66 54766 → 22 [ACK] Seq=9057 Ack=49849 Win=6155 Len=0 TSval=8188914 TSecr=15120414
  287 7.804959675  10.6.15.156 → 192.168.1.12 SSH 310 Server: Encrypted packet (len=244)
  288 7.804978298 192.168.1.12 → 10.6.15.156  TCP 66 54766 → 22 [ACK] Seq=9057 Ack=50093 Win=6155 Len=0 TSval=8188928 TSecr=15120429
  289 7.906415751  10.6.15.156 → 192.168.1.12 SSH 214 Server: Encrypted packet (len=148)
  290 7.906504368 192.168.1.12 → 10.6.15.156  TCP 66 54766 → 22 [ACK] Seq=9057 Ack=50241 Win=6155 Len=0 TSval=8188954 TSecr=15120455
  291 8.126702610  10.6.15.156 → 192.168.1.12 SSH 190 Server: Encrypted packet (len=124)
  292 8.126792393 192.168.1.12 → 10.6.15.156  TCP 66 54766 → 22 [ACK] Seq=9057 Ack=50365 Win=6155 Len=0 TSval=8189009 TSecr=15120510
  293 8.197332717  10.6.15.156 → 192.168.1.12 SSH 222 Server: Encrypted packet (len=156)
  294 8.197422109 192.168.1.12 → 10.6.15.156  TCP 66 54766 → 22 [ACK] Seq=9057 Ack=50521 Win=6155 Len=0 TSval=8189027 TSecr=15120527
  295 8.256131662  10.6.15.156 → 192.168.1.12 SSH 214 Server: Encrypted packet (len=148)
  296 8.256226564 192.168.1.12 → 10.6.15.156  TCP 66 54766 → 22 [ACK] Seq=9057 Ack=50669 Win=6155 Len=0 TSval=8189041 TSecr=15120542
  297 8.357456284  10.6.15.156 → 192.168.1.12 SSH 222 Server: Encrypted packet (len=156)
  298 8.357547902 192.168.1.12 → 10.6.15.156  TCP 66 54766 → 22 [ACK] Seq=9057 Ack=50825 Win=6155 Len=0 TSval=8189067 TSecr=15120567
  299 8.577816094  10.6.15.156 → 192.168.1.12 SSH 342 Server: Encrypted packet (len=276)
  300 8.577906401 192.168.1.12 → 10.6.15.156  TCP 66 54766 → 22 [ACK] Seq=9057 Ack=51101 Win=6155 Len=0 TSval=8189122 TSecr=15120622
  301 8.648278569  10.6.15.156 → 192.168.1.12 SSH 270 Server: Encrypted packet (len=204)
  302 8.648371134 192.168.1.12 → 10.6.15.156  TCP 66 54766 → 22 [ACK] Seq=9057 Ack=51305 Win=6155 Len=0 TSval=8189139 TSecr=15120640
  303 8.706768336  10.6.15.156 → 192.168.1.12 SSH 214 Server: Encrypted packet (len=148)
  304 8.706857668 192.168.1.12 → 10.6.15.156  TCP 66 54766 → 22 [ACK] Seq=9057 Ack=51453 Win=6155 Len=0 TSval=8189154 TSecr=15120655
  305 8.808497094  10.6.15.156 → 192.168.1.12 SSH 222 Server: Encrypted packet (len=156)
  306 8.808585040 192.168.1.12 → 10.6.15.156  TCP 66 54766 → 22 [ACK] Seq=9057 Ack=51609 Win=6155 Len=0 TSval=8189179 TSecr=15120680
  307 8.812005982  10.6.15.156 → 192.168.1.12 SSH 150 Server: Encrypted packet (len=84)
  308 8.812095030 192.168.1.12 → 10.6.15.156  TCP 66 54766 → 22 [ACK] Seq=9057 Ack=51693 Win=6155 Len=0 TSval=8189180 TSecr=15120681
  309 8.812321934 192.168.1.12 → 10.6.15.156  SSH 150 Client: Encrypted packet (len=84)
  310 8.814074124  10.6.15.156 → 192.168.1.12 TCP 66 22 → 54766 [ACK] Seq=51693 Ack=9141 Win=1452 Len=0 TSval=15120681 TSecr=8189180
  311 8.828700081  10.22.18.83 → 224.0.0.252  LLMNR 69 Standard query 0xe037 A ofsuoqwlu
  312 8.831311285  10.22.18.83 → 224.0.0.252  LLMNR 68 Standard query 0x4c5e A qhdqouwu
  313 8.834011901  10.22.18.83 → 224.0.0.252  LLMNR 75 Standard query 0xf7df A rpsbmvmjknezcgu
  314 8.860998162  10.6.15.156 → 192.168.1.12 SSH 150 Server: Encrypted packet (len=84)
  315 8.861291390 192.168.1.12 → 10.6.15.156  SSH 150 Client: Encrypted packet (len=84)
  316 8.863016710  10.6.15.156 → 192.168.1.12 TCP 66 22 → 54766 [ACK] Seq=51777 Ack=9225 Win=1452 Len=0 TSval=15120694 TSecr=8189193
  317 9.028971815  10.6.15.156 → 192.168.1.12 SSH 406 Server: Encrypted packet (len=340)
  318 9.069051750 192.168.1.12 → 10.6.15.156  TCP 66 54766 → 22 [ACK] Seq=9225 Ack=52117 Win=6155 Len=0 TSval=8189245 TSecr=15120735
  319 9.099319914  10.6.15.156 → 192.168.1.12 SSH 214 Server: Encrypted packet (len=148)
  320 9.099413667 192.168.1.12 → 10.6.15.156  TCP 66 54766 → 22 [ACK] Seq=9225 Ack=52265 Win=6155 Len=0 TSval=8189252 TSecr=15120753
  321 9.157813054  10.6.15.156 → 192.168.1.12 SSH 222 Server: Encrypted packet (len=156)
  322 9.157902814 192.168.1.12 → 10.6.15.156  TCP 66 54766 → 22 [ACK] Seq=9225 Ack=52421 Win=6155 Len=0 TSval=8189267 TSecr=15120767
  323 9.239587151  10.22.18.83 → 224.0.0.252  LLMNR 69 Standard query 0xe037 A ofsuoqwlu
  324 9.242524591  10.22.18.83 → 224.0.0.252  LLMNR 68 Standard query 0x4c5e A qhdqouwu
  325 9.244314250  10.22.18.83 → 224.0.0.252  LLMNR 75 Standard query 0xf7df A rpsbmvmjknezcgu
  326 9.259444222  10.6.15.156 → 192.168.1.12 SSH 214 Server: Encrypted packet (len=148)
  327 9.259531567 192.168.1.12 → 10.6.15.156  TCP 66 54766 → 22 [ACK] Seq=9225 Ack=52569 Win=6155 Len=0 TSval=8189292 TSecr=15120793
  328 9.479754945  10.6.15.156 → 192.168.1.12 SSH 270 Server: Encrypted packet (len=204)
  329 9.479774457 192.168.1.12 → 10.6.15.156  TCP 66 54766 → 22 [ACK] Seq=9225 Ack=52773 Win=6155 Len=0 TSval=8189347 TSecr=15120848
  330 9.550721146  10.6.15.156 → 192.168.1.12 SSH 534 Server: Encrypted packet (len=468)
  331 9.550739525 192.168.1.12 → 10.6.15.156  TCP 66 54766 → 22 [ACK] Seq=9225 Ack=53241 Win=6155 Len=0 TSval=8189365 TSecr=15120866
  332 9.555649890  10.6.15.156 → 192.168.1.12 SSH 102 Server: Encrypted packet (len=36)
  333 9.555668034 192.168.1.12 → 10.6.15.156  TCP 66 54766 → 22 [ACK] Seq=9225 Ack=53277 Win=6155 Len=0 TSval=8189366 TSecr=15120867
  334 9.609387964  10.6.15.156 → 192.168.1.12 SSH 566 Server: Encrypted packet (len=500)
  335 9.609407599 192.168.1.12 → 10.6.15.156  TCP 66 54766 → 22 [ACK] Seq=9225 Ack=53777 Win=6155 Len=0 TSval=8189380 TSecr=15120880
  336 9.711753652  10.6.15.156 → 192.168.1.12 SSH 566 Server: Encrypted packet (len=500)
  337 9.711770517 192.168.1.12 → 10.6.15.156  TCP 66 54766 → 22 [ACK] Seq=9225 Ack=54277 Win=6155 Len=0 TSval=8189405 TSecr=15120906
  338 9.930972190  10.6.15.156 → 192.168.1.12 SSH 502 Server: Encrypted packet (len=436)
  339 9.930990099 192.168.1.12 → 10.6.15.156  TCP 66 54766 → 22 [ACK] Seq=9225 Ack=54713 Win=6155 Len=0 TSval=8189460 TSecr=15120961
  340 9.931409541  10.22.18.25 → 224.0.0.252  LLMNR 64 Standard query 0x4f47 A wpad
  341 10.002160687  10.6.15.156 → 192.168.1.12 SSH 358 Server: Encrypted packet (len=292)
  342 10.002178200 192.168.1.12 → 10.6.15.156  TCP 66 54766 → 22 [ACK] Seq=9225 Ack=55005 Win=6155 Len=0 TSval=8189478 TSecr=15120978
  343 10.060278305  10.6.15.156 → 192.168.1.12 SSH 318 Server: Encrypted packet (len=252)
  344 10.060295673 192.168.1.12 → 10.6.15.156  TCP 66 54766 → 22 [ACK] Seq=9225 Ack=55257 Win=6155 Len=0 TSval=8189492 TSecr=15120993
  345 10.070435303  10.6.15.156 → 192.168.1.12 SSH 318 Server: [TCP Spurious Retransmission] , Encrypted packet (len=252)
  346 10.070458822 192.168.1.12 → 10.6.15.156  TCP 78 [TCP Dup ACK 344#1] 54766 → 22 [ACK] Seq=9225 Ack=55257 Win=6155 Len=0 TSval=8189495 TSecr=15120996 SLE=55005 SRE=55257
  347 10.161737664  10.6.15.156 → 192.168.1.12 SSH 358 Server: Encrypted packet (len=292)
  348 10.161755249 192.168.1.12 → 10.6.15.156  TCP 66 54766 → 22 [ACK] Seq=9225 Ack=55549 Win=6155 Len=0 TSval=8189518 TSecr=15121018
  349 10.230895543  10.22.18.83 → 224.0.0.252  LLMNR 64 Standard query 0xe495 A wpad
  350 10.239581498  10.22.18.83 → 224.0.0.252  LLMNR 64 Standard query 0x8842 A wpad
  351 10.342529331  10.22.18.25 → 224.0.0.252  LLMNR 64 Standard query 0x4f47 A wpad
  352 10.382806263  10.6.15.156 → 192.168.1.12 SSH 358 Server: Encrypted packet (len=292)
  353 10.382824382 192.168.1.12 → 10.6.15.156  TCP 66 54766 → 22 [ACK] Seq=9225 Ack=55841 Win=6155 Len=0 TSval=8189573 TSecr=15121073
  354 10.452438259  10.6.15.156 → 192.168.1.12 SSH 470 Server: Encrypted packet (len=404)
  355 10.452456175 192.168.1.12 → 10.6.15.156  TCP 66 54766 → 22 [ACK] Seq=9225 Ack=56245 Win=6155 Len=0 TSval=8189590 TSecr=15121091
  356 10.511030341  10.6.15.156 → 192.168.1.12 SSH 470 Server: Encrypted packet (len=404)
  357 10.511048174 192.168.1.12 → 10.6.15.156  TCP 66 54766 → 22 [ACK] Seq=9225 Ack=56649 Win=6155 Len=0 TSval=8189605 TSecr=15121106
  358 10.612596560  10.6.15.156 → 192.168.1.12 SSH 438 Server: Encrypted packet (len=372)
  359 10.612614226 192.168.1.12 → 10.6.15.156  TCP 66 54766 → 22 [ACK] Seq=9225 Ack=57021 Win=6155 Len=0 TSval=8189630 TSecr=15121131
  360 10.626848106  10.22.18.83 → 224.0.0.252  LLMNR 72 Standard query 0x7a56 ANY LenovoPranav
  361 10.643546125  10.22.18.83 → 224.0.0.252  LLMNR 64 Standard query 0xe495 A wpad
  362 10.652764225  10.22.18.83 → 224.0.0.252  LLMNR 64 Standard query 0x8842 A wpad
  363 10.665758116  10.22.18.83 → 224.0.0.252  LLMNR 70 Standard query 0xa398 A denjleomuq
  364 10.671677580  10.22.18.83 → 224.0.0.252  LLMNR 74 Standard query 0x3003 A gauqjcdyiswvzj
  365 10.672859010  10.22.18.83 → 224.0.0.252  LLMNR 69 Standard query 0xd21d A iembeandk
  366 10.762392192 192.168.1.12 → 10.6.15.156  SSH 1514 Client: Encrypted packet (len=1448)
  367 10.764965757  10.6.15.156 → 192.168.1.12 TCP 66 22 → 54766 [ACK] Seq=57021 Ack=10673 Win=1452 Len=0 TSval=15121169 TSecr=8189668
  368 10.765001008 192.168.1.12 → 10.6.15.156  SSH 870 Client: Encrypted packet (len=804)
  369 10.767035277  10.6.15.156 → 192.168.1.12 TCP 66 22 → 54766 [ACK] Seq=57021 Ack=11477 Win=1452 Len=0 TSval=15121170 TSecr=8189669
  370 10.769894301  10.6.15.156 → 192.168.1.12 SSH 142 Server: Encrypted packet (len=76)
  371 10.769911909 192.168.1.12 → 10.6.15.156  TCP 66 54766 → 22 [ACK] Seq=11477 Ack=57097 Win=6155 Len=0 TSval=8189670 TSecr=15121170
  372 10.832862932  10.6.15.156 → 192.168.1.12 SSH 302 Server: Encrypted packet (len=236)
  373 10.832882820 192.168.1.12 → 10.6.15.156  TCP 66 54766 → 22 [ACK] Seq=11477 Ack=57333 Win=6155 Len=0 TSval=8189685 TSecr=15121186
  374 10.891362834  10.6.15.156 → 192.168.1.12 SSH 774 Server: Encrypted packet (len=708)
  375 10.891381046 192.168.1.12 → 10.6.15.156  TCP 66 54766 → 22 [ACK] Seq=11477 Ack=58041 Win=6155 Len=0 TSval=8189700 TSecr=15121201
  376 10.891944943  10.6.15.156 → 192.168.1.12 SSH 382 Server: Encrypted packet (len=316)
  377 10.891957974 192.168.1.12 → 10.6.15.156  TCP 66 54766 → 22 [ACK] Seq=11477 Ack=58357 Win=6155 Len=0 TSval=8189700 TSecr=15121201
  378 10.894423743 192.168.1.12 → 10.6.15.156  SSH 142 Client: Encrypted packet (len=76)
  379 10.903281760  10.6.15.156 → 192.168.1.12 SSH 182 Server: Encrypted packet (len=116)
  380 10.945020292 192.168.1.12 → 10.6.15.156  TCP 66 54766 → 22 [ACK] Seq=11553 Ack=58473 Win=6155 Len=0 TSval=8189714 TSecr=15121204
  381 10.961645081  10.6.15.156 → 192.168.1.12 SSH 182 Server: Encrypted packet (len=116)
  382 10.961670650 192.168.1.12 → 10.6.15.156  TCP 66 54766 → 22 [ACK] Seq=11553 Ack=58589 Win=6155 Len=0 TSval=8189718 TSecr=15121218
  383 11.037473001  10.22.18.83 → 224.0.0.252  LLMNR 72 Standard query 0x7a56 ANY LenovoPranav
  384 11.051866559  10.22.18.83 → 224.0.0.252  LLMNR 64 Standard query 0x509a A wpad
  385 11.052731293  10.22.18.83 → 224.0.0.252  LLMNR 64 Standard query 0x8209 A wpad
  386 11.063670939  10.6.15.156 → 192.168.1.12 SSH 182 Server: Encrypted packet (len=116)
  387 11.063687451 192.168.1.12 → 10.6.15.156  TCP 66 54766 → 22 [ACK] Seq=11553 Ack=58705 Win=6155 Len=0 TSval=8189743 TSecr=15121244
  388 11.075487778  10.22.18.83 → 224.0.0.252  LLMNR 70 Standard query 0xa398 A denjleomuq
  389 11.081908006  10.22.18.83 → 224.0.0.252  LLMNR 74 Standard query 0x3003 A gauqjcdyiswvzj
  390 11.082460964  10.22.18.83 → 224.0.0.252  LLMNR 69 Standard query 0xd21d A iembeandk
  391 11.283713481  10.6.15.156 → 192.168.1.12 SSH 198 Server: Encrypted packet (len=132)
  392 11.283734107 192.168.1.12 → 10.6.15.156  TCP 66 54766 → 22 [ACK] Seq=11553 Ack=58837 Win=6155 Len=0 TSval=8189798 TSecr=15121299
  393 11.354298271  10.6.15.156 → 192.168.1.12 SSH 254 Server: Encrypted packet (len=188)
  394 11.354316773 192.168.1.12 → 10.6.15.156  TCP 66 54766 → 22 [ACK] Seq=11553 Ack=59025 Win=6155 Len=0 TSval=8189816 TSecr=15121316
  395 11.412897651  10.6.15.156 → 192.168.1.12 SSH 326 Server: Encrypted packet (len=260)
  396 11.412915789 192.168.1.12 → 10.6.15.156  TCP 66 54766 → 22 [ACK] Seq=11553 Ack=59285 Win=6155 Len=0 TSval=8189830 TSecr=15121331
  397 11.462844873  10.22.18.83 → 224.0.0.252  LLMNR 64 Standard query 0x509a A wpad
  398 11.463769484  10.22.18.83 → 224.0.0.252  LLMNR 64 Standard query 0x8209 A wpad
  399 11.515684856  10.6.15.156 → 192.168.1.12 SSH 486 Server: Encrypted packet (len=420)
  400 11.515702809 192.168.1.12 → 10.6.15.156  TCP 66 54766 → 22 [ACK] Seq=11553 Ack=59705 Win=6155 Len=0 TSval=8189856 TSecr=15121357
  401 11.653356971  10.22.18.83 → 224.0.0.252  LLMNR 72 Standard query 0xefb4 ANY LenovoPranav
  402 11.670241372  10.6.15.156 → 192.168.1.12 SSH 102 Server: Encrypted packet (len=36)
  403 11.670258726 192.168.1.12 → 10.6.15.156  TCP 66 54766 → 22 [ACK] Seq=11553 Ack=59741 Win=6155 Len=0 TSval=8189895 TSecr=15121395
  404 11.734986973  10.6.15.156 → 192.168.1.12 SSH 566 Server: Encrypted packet (len=500)
  405 11.735005887 192.168.1.12 → 10.6.15.156  TCP 66 54766 → 22 [ACK] Seq=11553 Ack=60241 Win=6155 Len=0 TSval=8189911 TSecr=15121412
  406 11.759974370  10.22.18.83 → 224.0.0.252  LLMNR 69 Standard query 0xde24 A riqiaewtz
  407 11.759993921  10.22.18.83 → 224.0.0.252  LLMNR 75 Standard query 0x9874 A tvgleiyauxmpilj
  408 11.759998676  10.22.18.83 → 224.0.0.252  LLMNR 70 Standard query 0x9027 A yagptrhngq
  409 11.806336103  10.6.15.156 → 192.168.1.12 SSH 470 Server: Encrypted packet (len=404)
  410 11.806353843 192.168.1.12 → 10.6.15.156  TCP 66 54766 → 22 [ACK] Seq=11553 Ack=60645 Win=6155 Len=0 TSval=8189929 TSecr=15121429
  411 11.864031130  10.6.15.156 → 192.168.1.12 SSH 502 Server: Encrypted packet (len=436)
  412 11.864048479 192.168.1.12 → 10.6.15.156  TCP 66 54766 → 22 [ACK] Seq=11553 Ack=61081 Win=6155 Len=0 TSval=8189943 TSecr=15121444
  413 11.965636204  10.6.15.156 → 192.168.1.12 SSH 334 Server: Encrypted packet (len=268)
  414 11.965654310 192.168.1.12 → 10.6.15.156  TCP 66 54766 → 22 [ACK] Seq=11553 Ack=61349 Win=6155 Len=0 TSval=8189969 TSecr=15121469
  415 12.064032429  10.22.18.83 → 224.0.0.252  LLMNR 72 Standard query 0xefb4 ANY LenovoPranav
  416 12.169470459  10.22.18.83 → 224.0.0.252  LLMNR 75 Standard query 0x9874 A tvgleiyauxmpilj
  417 12.169535857  10.22.18.83 → 224.0.0.252  LLMNR 69 Standard query 0xde24 A riqiaewtz
  418 12.171306336  10.22.18.83 → 224.0.0.252  LLMNR 70 Standard query 0x9027 A yagptrhngq
  419 12.182874157 192.168.1.12 → 91.189.89.198 NTP 90 NTP Version 4, client
  420 12.186027779  10.6.15.156 → 192.168.1.12 SSH 598 Server: Encrypted packet (len=532)
  421 12.186045890 192.168.1.12 → 10.6.15.156  TCP 66 54766 → 22 [ACK] Seq=11553 Ack=61881 Win=6155 Len=0 TSval=8190024 TSecr=15121524
  422 12.257794068  10.6.15.156 → 192.168.1.12 SSH 374 Server: Encrypted packet (len=308)
  423 12.257811867 192.168.1.12 → 10.6.15.156  TCP 66 54766 → 22 [ACK] Seq=11553 Ack=62189 Win=6155 Len=0 TSval=8190042 TSecr=15121542
  424 12.314814626  10.6.15.156 → 192.168.1.12 SSH 302 Server: Encrypted packet (len=236)
  425 12.314832298 192.168.1.12 → 10.6.15.156  TCP 66 54766 → 22 [ACK] Seq=11553 Ack=62425 Win=6155 Len=0 TSval=8190056 TSecr=15121557
  426 12.416819505  10.6.15.156 → 192.168.1.12 SSH 406 Server: Encrypted packet (len=340)
  427 12.416839044 192.168.1.12 → 10.6.15.156  TCP 66 54766 → 22 [ACK] Seq=11553 Ack=62765 Win=6155 Len=0 TSval=8190081 TSecr=15121582
  428 12.636716253  10.6.15.156 → 192.168.1.12 SSH 182 Server: Encrypted packet (len=116)
  429 12.636734009 192.168.1.12 → 10.6.15.156  TCP 66 54766 → 22 [ACK] Seq=11553 Ack=62881 Win=6155 Len=0 TSval=8190136 TSecr=15121637
  430 12.708814247  10.6.15.156 → 192.168.1.12 SSH 406 Server: Encrypted packet (len=340)
  431 12.708833056 192.168.1.12 → 10.6.15.156  TCP 66 54766 → 22 [ACK] Seq=11553 Ack=63221 Win=6155 Len=0 TSval=8190154 TSecr=15121655
  432 12.770001779  10.6.15.156 → 192.168.1.12 SSH 662 Server: Encrypted packet (len=596)
  433 12.770019348 192.168.1.12 → 10.6.15.156  TCP 66 54766 → 22 [ACK] Seq=11553 Ack=63817 Win=6155 Len=0 TSval=8190170 TSecr=15121670
  434 12.867855296  10.6.15.156 → 192.168.1.12 SSH 614 Server: Encrypted packet (len=548)
  435 12.867873623 192.168.1.12 → 10.6.15.156  TCP 66 54766 → 22 [ACK] Seq=11553 Ack=64365 Win=6155 Len=0 TSval=8190194 TSecr=15121695
  436 13.087749018  10.6.15.156 → 192.168.1.12 SSH 334 Server: Encrypted packet (len=268)
  437 13.087766895 192.168.1.12 → 10.6.15.156  TCP 66 54766 → 22 [ACK] Seq=11553 Ack=64633 Win=6155 Len=0 TSval=8190249 TSecr=15121750
  438 13.158405031  10.6.15.156 → 192.168.1.12 SSH 422 Server: Encrypted packet (len=356)
  439 13.158420949 192.168.1.12 → 10.6.15.156  TCP 66 54766 → 22 [ACK] Seq=11553 Ack=64989 Win=6155 Len=0 TSval=8190267 TSecr=15121768
  440 13.216750766  10.6.15.156 → 192.168.1.12 SSH 182 Server: Encrypted packet (len=116)
  441 13.216768289 192.168.1.12 → 10.6.15.156  TCP 66 54766 → 22 [ACK] Seq=11553 Ack=65105 Win=6155 Len=0 TSval=8190281 TSecr=15121782
  442 13.318601652  10.6.15.156 → 192.168.1.12 SSH 238 Server: Encrypted packet (len=172)
  443 13.318618444 192.168.1.12 → 10.6.15.156  TCP 66 54766 → 22 [ACK] Seq=11553 Ack=65277 Win=6155 Len=0 TSval=8190307 TSecr=15121808
  444 13.538674975  10.6.15.156 → 192.168.1.12 SSH 222 Server: Encrypted packet (len=156)
  445 13.538692973 192.168.1.12 → 10.6.15.156  TCP 66 54766 → 22 [ACK] Seq=11553 Ack=65433 Win=6155 Len=0 TSval=8190362 TSecr=15121863
  446 13.609548182  10.6.15.156 → 192.168.1.12 SSH 238 Server: Encrypted packet (len=172)
  447 13.609566873 192.168.1.12 → 10.6.15.156  TCP 66 54766 → 22 [ACK] Seq=11553 Ack=65605 Win=6155 Len=0 TSval=8190380 TSecr=15121880
  448 13.667913672  10.6.15.156 → 192.168.1.12 SSH 366 Server: Encrypted packet (len=300)
  449 13.667931268 192.168.1.12 → 10.6.15.156  TCP 66 54766 → 22 [ACK] Seq=11553 Ack=65905 Win=6155 Len=0 TSval=8190394 TSecr=15121895
  450 13.770045396  10.6.15.156 → 192.168.1.12 SSH 302 Server: Encrypted packet (len=236)
  451 13.770062986 192.168.1.12 → 10.6.15.156  TCP 66 54766 → 22 [ACK] Seq=11553 Ack=66141 Win=6155 Len=0 TSval=8190420 TSecr=15121920
  452 13.989912747  10.6.15.156 → 192.168.1.12 SSH 254 Server: Encrypted packet (len=188)
  453 13.989930122 192.168.1.12 → 10.6.15.156  TCP 66 54766 → 22 [ACK] Seq=11553 Ack=66329 Win=6155 Len=0 TSval=8190475 TSecr=15121975
  454 14.052386035  10.22.18.83 → 224.0.0.252  LLMNR 64 Standard query 0x327c A wpad
  455 14.053552761  10.22.18.83 → 224.0.0.252  LLMNR 64 Standard query 0x99d5 A wpad
  456 14.060322726  10.6.15.156 → 192.168.1.12 SSH 310 Server: Encrypted packet (len=244)
  457 14.060340252 192.168.1.12 → 10.6.15.156  TCP 66 54766 → 22 [ACK] Seq=11553 Ack=66573 Win=6155 Len=0 TSval=8190492 TSecr=15121993
  458 14.440662736  10.6.15.156 → 192.168.1.12 SSH 182 Server: Encrypted packet (len=116)
  459 14.440680480 192.168.1.12 → 10.6.15.156  TCP 66 54766 → 22 [ACK] Seq=11553 Ack=66689 Win=6155 Len=0 TSval=8190587 TSecr=15122088
  460 14.464050046  10.22.18.83 → 224.0.0.252  LLMNR 64 Standard query 0x99d5 A wpad
  461 14.464075239  10.22.18.83 → 224.0.0.252  LLMNR 64 Standard query 0x327c A wpad
  462 14.536452497  10.6.15.156 → 192.168.1.12 SSH 190 Server: Encrypted packet (len=124)
  463 14.536469111 192.168.1.12 → 10.6.15.156  TCP 66 54766 → 22 [ACK] Seq=11553 Ack=66813 Win=6155 Len=0 TSval=8190611 TSecr=15122112
  464 14.544660638  10.6.15.156 → 192.168.1.12 SSH 190 Server: Encrypted packet (len=124)
  465 14.544677411 192.168.1.12 → 10.6.15.156  TCP 66 54766 → 22 [ACK] Seq=11553 Ack=66937 Win=6155 Len=0 TSval=8190613 TSecr=15122114
  466 14.671429549  10.6.15.156 → 192.168.1.12 SSH 206 Server: Encrypted packet (len=140)
  467 14.671446961 192.168.1.12 → 10.6.15.156  TCP 66 54766 → 22 [ACK] Seq=11553 Ack=67077 Win=6155 Len=0 TSval=8190645 TSecr=15122146
  468 14.866859146  10.6.15.156 → 192.168.1.12 SSH 150 Server: Encrypted packet (len=84)
  469 14.866877382 192.168.1.12 → 10.6.15.156  TCP 66 54766 → 22 [ACK] Seq=11553 Ack=67161 Win=6155 Len=0 TSval=8190694 TSecr=15122195
  470 14.867200985 192.168.1.12 → 10.6.15.156  SSH 150 Client: Encrypted packet (len=84)
  471 14.891712349  10.6.15.156 → 192.168.1.12 SSH 302 Server: Encrypted packet (len=236)
  472 14.933046519 192.168.1.12 → 10.6.15.156  TCP 66 54766 → 22 [ACK] Seq=11637 Ack=67397 Win=6155 Len=0 TSval=8190711 TSecr=15122201
  473 14.949714833  10.6.15.156 → 192.168.1.12 SSH 150 Server: Encrypted packet (len=84)
  474 14.949741187 192.168.1.12 → 10.6.15.156  TCP 66 54766 → 22 [ACK] Seq=11637 Ack=67481 Win=6155 Len=0 TSval=8190715 TSecr=15122215
  475 14.950054242 192.168.1.12 → 10.6.15.156  SSH 150 Client: Encrypted packet (len=84)
  476 14.962326355  10.6.15.156 → 192.168.1.12 SSH 406 Server: Encrypted packet (len=340)
  477 15.005025051 192.168.1.12 → 10.6.15.156  TCP 66 54766 → 22 [ACK] Seq=11721 Ack=67821 Win=6155 Len=0 TSval=8190729 TSecr=15122218
  478 15.020921963  10.6.15.156 → 192.168.1.12 SSH 406 Server: Encrypted packet (len=340)
  479 15.020943160 192.168.1.12 → 10.6.15.156  TCP 66 54766 → 22 [ACK] Seq=11721 Ack=68161 Win=6155 Len=0 TSval=8190732 TSecr=15122233
  480 15.124935073  10.6.15.156 → 192.168.1.12 SSH 334 Server: Encrypted packet (len=268)
  481 15.124955406 192.168.1.12 → 10.6.15.156  TCP 66 54766 → 22 [ACK] Seq=11721 Ack=68429 Win=6155 Len=0 TSval=8190758 TSecr=15122259
  482 15.343785664  10.6.15.156 → 192.168.1.12 SSH 438 Server: Encrypted packet (len=372)
  483 15.343812834 192.168.1.12 → 10.6.15.156  TCP 66 54766 → 22 [ACK] Seq=11721 Ack=68801 Win=6155 Len=0 TSval=8190813 TSecr=15122314
  484 15.414609105  10.6.15.156 → 192.168.1.12 SSH 326 Server: Encrypted packet (len=260)
  485 15.414624721 192.168.1.12 → 10.6.15.156  TCP 66 54766 → 22 [ACK] Seq=11721 Ack=69061 Win=6155 Len=0 TSval=8190831 TSecr=15122331
  486 15.471858154  10.6.15.156 → 192.168.1.12 SSH 318 Server: Encrypted packet (len=252)
  487 15.471871619 192.168.1.12 → 10.6.15.156  TCP 66 54766 → 22 [ACK] Seq=11721 Ack=69313 Win=6155 Len=0 TSval=8190845 TSecr=15122346
  488 15.574047446  10.6.15.156 → 192.168.1.12 SSH 374 Server: Encrypted packet (len=308)
  489 15.574065186 192.168.1.12 → 10.6.15.156  TCP 66 54766 → 22 [ACK] Seq=11721 Ack=69621 Win=6155 Len=0 TSval=8190871 TSecr=15122371
  490 15.793724786  10.6.15.156 → 192.168.1.12 SSH 238 Server: Encrypted packet (len=172)
  491 15.793748429 192.168.1.12 → 10.6.15.156  TCP 66 54766 → 22 [ACK] Seq=11721 Ack=69793 Win=6155 Len=0 TSval=8190926 TSecr=15122426
  492 15.864121878  10.6.15.156 → 192.168.1.12 SSH 238 Server: Encrypted packet (len=172)
  493 15.864139393 192.168.1.12 → 10.6.15.156  TCP 66 54766 → 22 [ACK] Seq=11721 Ack=69965 Win=6155 Len=0 TSval=8190943 TSecr=15122444
  494 15.922716099  10.6.15.156 → 192.168.1.12 SSH 238 Server: Encrypted packet (len=172)
  495 15.922733844 192.168.1.12 → 10.6.15.156  TCP 66 54766 → 22 [ACK] Seq=11721 Ack=70137 Win=6155 Len=0 TSval=8190958 TSecr=15122459
  496 16.024455122  10.6.15.156 → 192.168.1.12 SSH 286 Server: Encrypted packet (len=220)
  497 16.024471484 192.168.1.12 → 10.6.15.156  TCP 66 54766 → 22 [ACK] Seq=11721 Ack=70357 Win=6155 Len=0 TSval=8190983 TSecr=15122484
  498 16.057043186  10.22.18.83 → 224.0.0.252  LLMNR 74 Standard query 0x292b A uwbceejwzrobxr
  499 16.057156155  10.22.18.83 → 224.0.0.252  LLMNR 73 Standard query 0xc3d5 A qkdvffrcrdajt
  500 16.057695032  10.22.18.83 → 224.0.0.252  LLMNR 70 Standard query 0x8597 A hqkorodtxk
  501 16.244746283  10.6.15.156 → 192.168.1.12 SSH 302 Server: Encrypted packet (len=236)
  502 16.244761807 192.168.1.12 → 10.6.15.156  TCP 66 54766 → 22 [ACK] Seq=11721 Ack=70593 Win=6155 Len=0 TSval=8191038 TSecr=15122539
  503 16.322765879  10.6.15.156 → 192.168.1.12 SSH 614 Server: Encrypted packet (len=548)
  504 16.322783603 192.168.1.12 → 10.6.15.156  TCP 66 54766 → 22 [ACK] Seq=11721 Ack=71141 Win=6155 Len=0 TSval=8191058 TSecr=15122557
  505 16.374066994  10.6.15.156 → 192.168.1.12 SSH 614 Server: Encrypted packet (len=548)
  506 16.374084444 192.168.1.12 → 10.6.15.156  TCP 66 54766 → 22 [ACK] Seq=11721 Ack=71689 Win=6155 Len=0 TSval=8191071 TSecr=15122571
  507 16.470083608  10.22.18.83 → 224.0.0.252  LLMNR 74 Standard query 0x292b A uwbceejwzrobxr
  508 16.470215639  10.22.18.83 → 224.0.0.252  LLMNR 70 Standard query 0x8597 A hqkorodtxk
  509 16.470360594  10.22.18.83 → 224.0.0.252  LLMNR 73 Standard query 0xc3d5 A qkdvffrcrdajt
  510 16.476011400  10.6.15.156 → 192.168.1.12 SSH 598 Server: Encrypted packet (len=532)
  511 16.476028787 192.168.1.12 → 10.6.15.156  TCP 66 54766 → 22 [ACK] Seq=11721 Ack=72221 Win=6155 Len=0 TSval=8191096 TSecr=15122597
  512 16.695701555  10.6.15.156 → 192.168.1.12 SSH 238 Server: Encrypted packet (len=172)
  513 16.695718842 192.168.1.12 → 10.6.15.156  TCP 66 54766 → 22 [ACK] Seq=11721 Ack=72393 Win=6155 Len=0 TSval=8191151 TSecr=15122652
  514 16.766542165  10.6.15.156 → 192.168.1.12 SSH 270 Server: Encrypted packet (len=204)
  515 16.766559065 192.168.1.12 → 10.6.15.156  TCP 66 54766 → 22 [ACK] Seq=11721 Ack=72597 Win=6155 Len=0 TSval=8191169 TSecr=15122669
  516 16.824601771  10.6.15.156 → 192.168.1.12 SSH 270 Server: Encrypted packet (len=204)
  517 16.824619306 192.168.1.12 → 10.6.15.156  TCP 66 54766 → 22 [ACK] Seq=11721 Ack=72801 Win=6155 Len=0 TSval=8191183 TSecr=15122684
  518 16.926542989  10.6.15.156 → 192.168.1.12 SSH 182 Server: Encrypted packet (len=116)
  519 16.926560250 192.168.1.12 → 10.6.15.156  TCP 66 54766 → 22 [ACK] Seq=11721 Ack=72917 Win=6155 Len=0 TSval=8191209 TSecr=15122710
  520 17.146892653  10.6.15.156 → 192.168.1.12 SSH 374 Server: Encrypted packet (len=308)
  521 17.146910507 192.168.1.12 → 10.6.15.156  TCP 66 54766 → 22 [ACK] Seq=11721 Ack=73225 Win=6155 Len=0 TSval=8191264 TSecr=15122765
  522 17.217238423  10.6.15.156 → 192.168.1.12 SSH 214 Server: Encrypted packet (len=148)
  523 17.217255674 192.168.1.12 → 10.6.15.156  TCP 66 54766 → 22 [ACK] Seq=11721 Ack=73373 Win=6155 Len=0 TSval=8191282 TSecr=15122782
  524 17.276235495  10.6.15.156 → 192.168.1.12 SSH 534 Server: Encrypted packet (len=468)
  525 17.276256672 192.168.1.12 → 10.6.15.156  TCP 66 54766 → 22 [ACK] Seq=11721 Ack=73841 Win=6155 Len=0 TSval=8191296 TSecr=15122797
  526 17.377851749  10.6.15.156 → 192.168.1.12 SSH 710 Server: Encrypted packet (len=644)
  527 17.377869581 192.168.1.12 → 10.6.15.156  TCP 66 54766 → 22 [ACK] Seq=11721 Ack=74485 Win=6155 Len=0 TSval=8191322 TSecr=15122822
  528 17.598124139  10.6.15.156 → 192.168.1.12 SSH 726 Server: Encrypted packet (len=660)
  529 17.598141709 192.168.1.12 → 10.6.15.156  TCP 66 54766 → 22 [ACK] Seq=11721 Ack=75145 Win=6155 Len=0 TSval=8191377 TSecr=15122877
  530 17.668607090  10.6.15.156 → 192.168.1.12 SSH 646 Server: Encrypted packet (len=580)
  531 17.668624433 192.168.1.12 → 10.6.15.156  TCP 66 54766 → 22 [ACK] Seq=11721 Ack=75725 Win=6155 Len=0 TSval=8191394 TSecr=15122895
  532 17.728101782  10.6.15.156 → 192.168.1.12 SSH 342 Server: Encrypted packet (len=276)
  533 17.728119973 192.168.1.12 → 10.6.15.156  TCP 66 54766 → 22 [ACK] Seq=11721 Ack=76001 Win=6155 Len=0 TSval=8191409 TSecr=15122910
  534 17.828367733  10.6.15.156 → 192.168.1.12 SSH 182 Server: Encrypted packet (len=116)
  535 17.828384685 192.168.1.12 → 10.6.15.156  TCP 66 54766 → 22 [ACK] Seq=11721 Ack=76117 Win=6155 Len=0 TSval=8191434 TSecr=15122935
  536 18.048593214  10.6.15.156 → 192.168.1.12 SSH 182 Server: Encrypted packet (len=116)
  537 18.048611615 192.168.1.12 → 10.6.15.156  TCP 66 54766 → 22 [ACK] Seq=11721 Ack=76233 Win=6155 Len=0 TSval=8191489 TSecr=15122990
  538 18.119056362  10.6.15.156 → 192.168.1.12 SSH 182 Server: Encrypted packet (len=116)
  539 18.119074219 192.168.1.12 → 10.6.15.156  TCP 66 54766 → 22 [ACK] Seq=11721 Ack=76349 Win=6155 Len=0 TSval=8191507 TSecr=15123008
  540 18.177679179  10.6.15.156 → 192.168.1.12 SSH 182 Server: Encrypted packet (len=116)
  541 18.177697248 192.168.1.12 → 10.6.15.156  TCP 66 54766 → 22 [ACK] Seq=11721 Ack=76465 Win=6155 Len=0 TSval=8191522 TSecr=15123022
  542 18.499624258  10.6.15.156 → 192.168.1.12 SSH 254 Server: Encrypted packet (len=188)
  543 18.499639952 192.168.1.12 → 10.6.15.156  TCP 66 54766 → 22 [ACK] Seq=11721 Ack=76653 Win=6155 Len=0 TSval=8191602 TSecr=15123103
  544 18.570516618  10.6.15.156 → 192.168.1.12 SSH 214 Server: Encrypted packet (len=148)
  545 18.570535563 192.168.1.12 → 10.6.15.156  TCP 66 54766 → 22 [ACK] Seq=11721 Ack=76801 Win=6155 Len=0 TSval=8191620 TSecr=15123121
  546 18.628848306  10.6.15.156 → 192.168.1.12 SSH 334 Server: Encrypted packet (len=268)
  547 18.628869826 192.168.1.12 → 10.6.15.156  TCP 66 54766 → 22 [ACK] Seq=11721 Ack=77069 Win=6155 Len=0 TSval=8191634 TSecr=15123135
  548 18.731590354  10.6.15.156 → 192.168.1.12 SSH 270 Server: Encrypted packet (len=204)
  549 18.731609923 192.168.1.12 → 10.6.15.156  TCP 66 54766 → 22 [ACK] Seq=11721 Ack=77273 Win=6155 Len=0 TSval=8191660 TSecr=15123161
  550 18.950617724  10.6.15.156 → 192.168.1.12 SSH 238 Server: Encrypted packet (len=172)
  551 18.950635522 192.168.1.12 → 10.6.15.156  TCP 66 54766 → 22 [ACK] Seq=11721 Ack=77445 Win=6155 Len=0 TSval=8191715 TSecr=15123216
  552 19.021214167  10.6.15.156 → 192.168.1.12 SSH 270 Server: Encrypted packet (len=204)
  553 19.021232020 192.168.1.12 → 10.6.15.156  TCP 66 54766 → 22 [ACK] Seq=11721 Ack=77649 Win=6155 Len=0 TSval=8191733 TSecr=15123233
  554 19.183968264  10.6.15.156 → 192.168.1.12 SSH 238 Server: Encrypted packet (len=172)
  555 19.183986390 192.168.1.12 → 10.6.15.156  TCP 66 54766 → 22 [ACK] Seq=11721 Ack=77821 Win=6155 Len=0 TSval=8191773 TSecr=15123274
  556 19.401587993  10.6.15.156 → 192.168.1.12 SSH 182 Server: Encrypted packet (len=116)
  557 19.401605329 192.168.1.12 → 10.6.15.156  TCP 66 54766 → 22 [ACK] Seq=11721 Ack=77937 Win=6155 Len=0 TSval=8191828 TSecr=15123328
  558 19.453355858  10.6.15.156 → 192.168.1.12 SSH 134 Server: Encrypted packet (len=68)
  559 19.453373273 192.168.1.12 → 10.6.15.156  TCP 66 54766 → 22 [ACK] Seq=11721 Ack=78005 Win=6155 Len=0 TSval=8191841 TSecr=15123341
  560 19.453423057  10.6.15.156 → 192.168.1.12 SSH 102 Server: Encrypted packet (len=36)
  561 19.453429460 192.168.1.12 → 10.6.15.156  TCP 66 54766 → 22 [ACK] Seq=11721 Ack=78041 Win=6155 Len=0 TSval=8191841 TSecr=15123341
  562 19.472122094  10.6.15.156 → 192.168.1.12 SSH 254 Server: Encrypted packet (len=188)
  563 19.472139139 192.168.1.12 → 10.6.15.156  TCP 66 54766 → 22 [ACK] Seq=11721 Ack=78229 Win=6155 Len=0 TSval=8191845 TSecr=15123346
  564 19.530801192  10.6.15.156 → 192.168.1.12 SSH 206 Server: Encrypted packet (len=140)
  565 19.530818632 192.168.1.12 → 10.6.15.156  TCP 66 54766 → 22 [ACK] Seq=11721 Ack=78369 Win=6155 Len=0 TSval=8191860 TSecr=15123361
  566 19.633360699  10.6.15.156 → 192.168.1.12 SSH 182 Server: Encrypted packet (len=116)
  567 19.633377972 192.168.1.12 → 10.6.15.156  TCP 66 54766 → 22 [ACK] Seq=11721 Ack=78485 Win=6155 Len=0 TSval=8191886 TSecr=15123386
  568 19.852598154  10.6.15.156 → 192.168.1.12 SSH 222 Server: Encrypted packet (len=156)
  569 19.852616188 192.168.1.12 → 10.6.15.156  TCP 66 54766 → 22 [ACK] Seq=11721 Ack=78641 Win=6155 Len=0 TSval=8191940 TSecr=15123441
  570 19.923185162  10.6.15.156 → 192.168.1.12 SSH 182 Server: Encrypted packet (len=116)
  571 19.923202505 192.168.1.12 → 10.6.15.156  TCP 66 54766 → 22 [ACK] Seq=11721 Ack=78757 Win=6155 Len=0 TSval=8191958 TSecr=15123459
  572 19.981748846  10.6.15.156 → 192.168.1.12 SSH 182 Server: Encrypted packet (len=116)
  573 19.981768225 192.168.1.12 → 10.6.15.156  TCP 66 54766 → 22 [ACK] Seq=11721 Ack=78873 Win=6155 Len=0 TSval=8191973 TSecr=15123473
  574 20.084283867  10.6.15.156 → 192.168.1.12 SSH 254 Server: Encrypted packet (len=188)
  575 20.084301533 192.168.1.12 → 10.6.15.156  TCP 66 54766 → 22 [ACK] Seq=11721 Ack=79061 Win=6155 Len=0 TSval=8191998 TSecr=15123499
  576 20.303739456  10.6.15.156 → 192.168.1.12 SSH 254 Server: Encrypted packet (len=188)
  577 20.303756248 192.168.1.12 → 10.6.15.156  TCP 66 54766 → 22 [ACK] Seq=11721 Ack=79249 Win=6155 Len=0 TSval=8192053 TSecr=15123554
  578 20.374203764  10.6.15.156 → 192.168.1.12 SSH 254 Server: Encrypted packet (len=188)
  579 20.374221184 192.168.1.12 → 10.6.15.156  TCP 66 54766 → 22 [ACK] Seq=11721 Ack=79437 Win=6155 Len=0 TSval=8192071 TSecr=15123572
  580 20.432839646  10.6.15.156 → 192.168.1.12 SSH 318 Server: Encrypted packet (len=252)
  581 20.432857558 192.168.1.12 → 10.6.15.156  TCP 66 54766 → 22 [ACK] Seq=11721 Ack=79689 Win=6155 Len=0 TSval=8192085 TSecr=15123586
  582 20.535387443  10.6.15.156 → 192.168.1.12 SSH 254 Server: Encrypted packet (len=188)
  583 20.535404830 192.168.1.12 → 10.6.15.156  TCP 66 54766 → 22 [ACK] Seq=11721 Ack=79877 Win=6155 Len=0 TSval=8192111 TSecr=15123612
  584 20.756999652  10.6.15.156 → 192.168.1.12 SSH 406 Server: Encrypted packet (len=340)
  585 20.757018380 192.168.1.12 → 10.6.15.156  TCP 66 54766 → 22 [ACK] Seq=11721 Ack=80217 Win=6155 Len=0 TSval=8192166 TSecr=15123667
  586 20.825809504  10.6.15.156 → 192.168.1.12 SSH 406 Server: Encrypted packet (len=340)
  587 20.825827317 192.168.1.12 → 10.6.15.156  TCP 66 54766 → 22 [ACK] Seq=11721 Ack=80557 Win=6155 Len=0 TSval=8192184 TSecr=15123684
  588 20.883947641  10.6.15.156 → 192.168.1.12 SSH 358 Server: Encrypted packet (len=292)
  589 20.883966035 192.168.1.12 → 10.6.15.156  TCP 66 54766 → 22 [ACK] Seq=11721 Ack=80849 Win=6155 Len=0 TSval=8192198 TSecr=15123699
  590 20.986571422  10.6.15.156 → 192.168.1.12 SSH 358 Server: Encrypted packet (len=292)
  591 20.986588682 192.168.1.12 → 10.6.15.156  TCP 66 54766 → 22 [ACK] Seq=11721 Ack=81141 Win=6155 Len=0 TSval=8192224 TSecr=15123725
  592 21.334690910  10.6.15.156 → 192.168.1.12 SSH 182 Server: Encrypted packet (len=116)
  593 21.334708677 192.168.1.12 → 10.6.15.156  TCP 66 54766 → 22 [ACK] Seq=11721 Ack=81257 Win=6155 Len=0 TSval=8192311 TSecr=15123812
  594 21.437195220  10.6.15.156 → 192.168.1.12 SSH 182 Server: Encrypted packet (len=116)
  595 21.437209792 192.168.1.12 → 10.6.15.156  TCP 66 54766 → 22 [ACK] Seq=11721 Ack=81373 Win=6155 Len=0 TSval=8192337 TSecr=15123837
  596 21.656827436  10.6.15.156 → 192.168.1.12 SSH 254 Server: Encrypted packet (len=188)
  597 21.656845501 192.168.1.12 → 10.6.15.156  TCP 66 54766 → 22 [ACK] Seq=11721 Ack=81561 Win=6155 Len=0 TSval=8192391 TSecr=15123892
  598 21.727047462  10.6.15.156 → 192.168.1.12 SSH 206 Server: Encrypted packet (len=140)
  599 21.727064673 192.168.1.12 → 10.6.15.156  TCP 66 54766 → 22 [ACK] Seq=11721 Ack=81701 Win=6155 Len=0 TSval=8192409 TSecr=15123910
  600 21.785687006  10.6.15.156 → 192.168.1.12 SSH 214 Server: Encrypted packet (len=148)
  601 21.785705064 192.168.1.12 → 10.6.15.156  TCP 66 54766 → 22 [ACK] Seq=11721 Ack=81849 Win=6155 Len=0 TSval=8192424 TSecr=15123924
  602 21.888417576  10.6.15.156 → 192.168.1.12 SSH 238 Server: Encrypted packet (len=172)
  603 21.888434224 192.168.1.12 → 10.6.15.156  TCP 66 54766 → 22 [ACK] Seq=11721 Ack=82021 Win=6155 Len=0 TSval=8192449 TSecr=15123950
  604 22.107641043  10.6.15.156 → 192.168.1.12 SSH 254 Server: Encrypted packet (len=188)
  605 22.107659186 192.168.1.12 → 10.6.15.156  TCP 66 54766 → 22 [ACK] Seq=11721 Ack=82209 Win=6155 Len=0 TSval=8192504 TSecr=15124005
  606 22.178265495  10.6.15.156 → 192.168.1.12 SSH 254 Server: Encrypted packet (len=188)
  607 22.178283765 192.168.1.12 → 10.6.15.156  TCP 66 54766 → 22 [ACK] Seq=11721 Ack=82397 Win=6155 Len=0 TSval=8192522 TSecr=15124023
  608 22.236731948  10.6.15.156 → 192.168.1.12 SSH 254 Server: Encrypted packet (len=188)
  609 22.236747888 192.168.1.12 → 10.6.15.156  TCP 66 54766 → 22 [ACK] Seq=11721 Ack=82585 Win=6155 Len=0 TSval=8192536 TSecr=15124037
  610 22.339414307  10.6.15.156 → 192.168.1.12 SSH 254 Server: Encrypted packet (len=188)
  611 22.339439933 192.168.1.12 → 10.6.15.156  TCP 66 54766 → 22 [ACK] Seq=11721 Ack=82773 Win=6155 Len=0 TSval=8192562 TSecr=15124063
  612 22.558883896  10.6.15.156 → 192.168.1.12 SSH 302 Server: Encrypted packet (len=236)
  613 22.558901978 192.168.1.12 → 10.6.15.156  TCP 66 54766 → 22 [ACK] Seq=11721 Ack=83009 Win=6155 Len=0 TSval=8192617 TSecr=15124118
  614 22.629121260  10.6.15.156 → 192.168.1.12 SSH 302 Server: Encrypted packet (len=236)
  615 22.629138840 192.168.1.12 → 10.6.15.156  TCP 66 54766 → 22 [ACK] Seq=11721 Ack=83245 Win=6155 Len=0 TSval=8192635 TSecr=15124135
  616 22.687942364  10.6.15.156 → 192.168.1.12 SSH 358 Server: Encrypted packet (len=292)
  617 22.687960074 192.168.1.12 → 10.6.15.156  TCP 66 54766 → 22 [ACK] Seq=11721 Ack=83537 Win=6155 Len=0 TSval=8192649 TSecr=15124150
  618 22.790464730  10.6.15.156 → 192.168.1.12 SSH 326 Server: Encrypted packet (len=260)
  619 22.790482102 192.168.1.12 → 10.6.15.156  TCP 66 54766 → 22 [ACK] Seq=11721 Ack=83797 Win=6155 Len=0 TSval=8192675 TSecr=15124176
  620 23.009935236  10.6.15.156 → 192.168.1.12 SSH 182 Server: Encrypted packet (len=116)
  621 23.009953898 192.168.1.12 → 10.6.15.156  TCP 66 54766 → 22 [ACK] Seq=11721 Ack=83913 Win=6155 Len=0 TSval=8192730 TSecr=15124230
  622 23.080340025  10.6.15.156 → 192.168.1.12 SSH 222 Server: Encrypted packet (len=156)
  623 23.080358294 192.168.1.12 → 10.6.15.156  TCP 66 54766 → 22 [ACK] Seq=11721 Ack=84069 Win=6155 Len=0 TSval=8192747 TSecr=15124248
  624 23.130846014 10.22.18.100 → 224.0.0.252  LLMNR 64 Standard query 0x365b A wpad
  625 23.130912392 10.22.18.100 → 224.0.0.252  LLMNR 64 Standard query 0x4e12 AAAA wpad
  626 23.138520888  10.6.15.156 → 192.168.1.12 SSH 222 Server: Encrypted packet (len=156)
  627 23.138538607 192.168.1.12 → 10.6.15.156  TCP 66 54766 → 22 [ACK] Seq=11721 Ack=84225 Win=6155 Len=0 TSval=8192762 TSecr=15124263
  628 23.182874469 192.168.1.12 → 139.59.16.133 NTP 90 NTP Version 4, client
  629 23.241559032  10.6.15.156 → 192.168.1.12 SSH 222 Server: Encrypted packet (len=156)
  630 23.241576517 192.168.1.12 → 10.6.15.156  TCP 66 54766 → 22 [ACK] Seq=11721 Ack=84381 Win=6155 Len=0 TSval=8192788 TSecr=15124288
  631 23.460630792  10.6.15.156 → 192.168.1.12 SSH 238 Server: Encrypted packet (len=172)
  632 23.460649867 192.168.1.12 → 10.6.15.156  TCP 66 54766 → 22 [ACK] Seq=11721 Ack=84553 Win=6155 Len=0 TSval=8192842 TSecr=15124343
  633 23.531095453  10.6.15.156 → 192.168.1.12 SSH 214 Server: Encrypted packet (len=148)
  634 23.531114532 192.168.1.12 → 10.6.15.156  TCP 66 54766 → 22 [ACK] Seq=11721 Ack=84701 Win=6155 Len=0 TSval=8192860 TSecr=15124361
  635 23.541187733 10.22.18.100 → 224.0.0.252  LLMNR 64 Standard query 0x4e12 AAAA wpad
  636 23.541309496 10.22.18.100 → 224.0.0.252  LLMNR 64 Standard query 0x365b A wpad
  637 23.589619678  10.6.15.156 → 192.168.1.12 SSH 214 Server: Encrypted packet (len=148)
  638 23.589638630 192.168.1.12 → 10.6.15.156  TCP 66 54766 → 22 [ACK] Seq=11721 Ack=84849 Win=6155 Len=0 TSval=8192875 TSecr=15124375
  639 23.692344277  10.6.15.156 → 192.168.1.12 SSH 238 Server: Encrypted packet (len=172)
  640 23.692362591 192.168.1.12 → 10.6.15.156  TCP 66 54766 → 22 [ACK] Seq=11721 Ack=85021 Win=6155 Len=0 TSval=8192900 TSecr=15124401
  641 23.913858961  10.6.15.156 → 192.168.1.12 SSH 302 Server: Encrypted packet (len=236)
  642 23.913876510 192.168.1.12 → 10.6.15.156  TCP 66 54766 → 22 [ACK] Seq=11721 Ack=85257 Win=6155 Len=0 TSval=8192956 TSecr=15124456
  643 23.970526093 192.168.1.12 → 239.255.255.250 SSDP 213 M-SEARCH * HTTP/1.1 
  644 23.982272610  10.6.15.156 → 192.168.1.12 SSH 318 Server: Encrypted packet (len=252)
  645 23.982291972 192.168.1.12 → 10.6.15.156  TCP 66 54766 → 22 [ACK] Seq=11721 Ack=85509 Win=6155 Len=0 TSval=8192973 TSecr=15124474
  646 24.040795347  10.6.15.156 → 192.168.1.12 SSH 270 Server: Encrypted packet (len=204)
  647 24.040813246 192.168.1.12 → 10.6.15.156  TCP 66 54766 → 22 [ACK] Seq=11721 Ack=85713 Win=6155 Len=0 TSval=8192987 TSecr=15124488
  648 24.143459178  10.6.15.156 → 192.168.1.12 SSH 334 Server: Encrypted packet (len=268)
  649 24.143476245 192.168.1.12 → 10.6.15.156  TCP 66 54766 → 22 [ACK] Seq=11721 Ack=85981 Win=6155 Len=0 TSval=8193013 TSecr=15124514
  650 24.207063918 192.168.1.12 → 192.168.1.1  DNS 89 Standard query 0x406d A clientservices.googleapis.com
  651 24.209202281  192.168.1.1 → 192.168.1.12 DNS 105 Standard query response 0x406d A clientservices.googleapis.com A 216.58.199.131
  652 24.211039774 192.168.1.12 → 216.58.199.131 TCP 74 40290 → 443 [SYN] Seq=0 Win=29200 Len=0 MSS=1460 SACK_PERM=1 TSval=8193030 TSecr=0 WS=128
  653 24.212534199 192.168.1.12 → 216.58.199.131 QUIC 1392 Client Hello, PKN: 1, CID: 1851188136769842599
  654 24.212651596 192.168.1.12 → 216.58.199.131 QUIC 282 Payload (Encrypted), PKN: 2, CID: 1851188136769842599
  655 24.227772775 192.168.1.12 → 216.58.199.131 QUIC 1392 Client Hello, PKN: 3, CID: 1851188136769842599
  656 24.248035043 216.58.199.131 → 192.168.1.12 TCP 74 443 → 40290 [SYN, ACK] Seq=0 Ack=1 Win=42408 Len=0 MSS=1380 SACK_PERM=1 TSval=2652099377 TSecr=8193030 WS=256
  657 24.248069137 192.168.1.12 → 216.58.199.131 TCP 66 40290 → 443 [ACK] Seq=1 Ack=1 Win=29312 Len=0 TSval=8193039 TSecr=2652099377
  658 24.248199746 192.168.1.12 → 216.58.199.131 SSL 583 Client Hello
  659 24.258357544 192.168.1.12 → 216.58.199.131 QUIC 1392 Client Hello, PKN: 4, CID: 1851188136769842599
  660 24.264035856 216.58.199.131 → 192.168.1.12 QUIC 83 Payload (Encrypted), PKN: 1, CID: 1851188136769842599
  661 24.284995356 216.58.199.131 → 192.168.1.12 TCP 66 443 → 40290 [ACK] Seq=1 Ack=518 Win=43520 Len=0 TSval=2652099414 TSecr=8193039
  662 24.285560221 216.58.199.131 → 192.168.1.12 TLSv1.2 222 Server Hello, Change Cipher Spec, Hello Request, Hello Request
  663 24.285588934 192.168.1.12 → 216.58.199.131 TCP 66 40290 → 443 [ACK] Seq=518 Ack=157 Win=30336 Len=0 TSval=8193049 TSecr=2652099414
  664 24.285688696 192.168.1.12 → 216.58.199.131 TLSv1.2 117 Change Cipher Spec, Hello Request, Hello Request
  665 24.294596864 216.58.199.131 → 192.168.1.12 QUIC 80 Payload (Encrypted), PKN: 2, CID: 1851188136769842599
  666 24.294693055 192.168.1.12 → 216.58.199.131 QUIC 278 Payload (Encrypted), PKN: 5, CID: 1851188136769842599
  667 24.295073493 192.168.1.12 → 216.58.199.131 TLSv1.2 217 Application Data, Application Data, Application Data
  668 24.315958408 216.58.199.131 → 192.168.1.12 QUIC 1392 Rejection, PKN: 3, CID: 1851188136769842599
  669 24.316206220 216.58.199.131 → 192.168.1.12 QUIC 1392 Payload (Encrypted), PKN: 4, CID: 1851188136769842599
  670 24.317345362 192.168.1.12 → 216.58.199.131 QUIC 86 Payload (Encrypted), PKN: 6, CID: 1851188136769842599
  671 24.318804682 192.168.1.12 → 216.58.199.131 QUIC 1392 Client Hello, PKN: 7, CID: 1851188136769842599
  672 24.318824794 192.168.1.12 → 216.58.199.131 QUIC 278 Payload (Encrypted), PKN: 8, CID: 1851188136769842599
  673 24.331686625 216.58.199.131 → 192.168.1.12 TLSv1.2 104 [TCP Previous segment not captured] , Application Data
  674 24.331709181 192.168.1.12 → 216.58.199.131 TCP 78 [TCP Dup ACK 663#1] 40290 → 443 [ACK] Seq=720 Ack=157 Win=30336 Len=0 TSval=8193060 TSecr=2652099414 SLE=226 SRE=264
  675 24.331795923 216.58.199.131 → 192.168.1.12 TCP 135 [TCP Out-Of-Order] 443 → 40290 [PSH, ACK] Seq=157 Ack=720 Win=44800 Len=69 TSval=2652099460 TSecr=8193049
  676 24.331816087 192.168.1.12 → 216.58.199.131 TCP 66 40290 → 443 [ACK] Seq=720 Ack=264 Win=30336 Len=0 TSval=8193060 TSecr=2652099460
  677 24.331920776 192.168.1.12 → 216.58.199.131 TLSv1.2 104 Application Data
  678 24.355026187 216.58.199.131 → 192.168.1.12 QUIC 82 Payload (Encrypted), PKN: 5, CID: 1851188136769842599
  679 24.362552647  10.6.15.156 → 192.168.1.12 SSH 254 Server: Encrypted packet (len=188)
  680 24.362570911 192.168.1.12 → 10.6.15.156  TCP 66 54766 → 22 [ACK] Seq=11721 Ack=86169 Win=6155 Len=0 TSval=8193068 TSecr=15124569
  681 24.407451852 216.58.199.131 → 192.168.1.12 TCP 66 443 → 40290 [ACK] Seq=264 Ack=758 Win=44800 Len=0 TSval=2652099497 TSecr=8193060
  682 24.414512578 216.58.199.131 → 192.168.1.12 QUIC 1392 Payload (Encrypted), PKN: 6
  683 24.414618173 216.58.199.131 → 192.168.1.12 QUIC 73 Payload (Encrypted), PKN: 7
  684 24.414967630 192.168.1.12 → 216.58.199.131 QUIC 83 Payload (Encrypted), PKN: 9, CID: 1851188136769842599
  685 24.415035409 192.168.1.12 → 216.58.199.131 QUIC 83 Payload (Encrypted), PKN: 10, CID: 1851188136769842599
  686 24.429489496 216.58.199.131 → 192.168.1.12 QUIC 1392 Payload (Encrypted), PKN: 8
  687 24.433073041  10.6.15.156 → 192.168.1.12 SSH 238 Server: Encrypted packet (len=172)
  688 24.433081158 192.168.1.12 → 10.6.15.156  TCP 66 54766 → 22 [ACK] Seq=11721 Ack=86341 Win=6155 Len=0 TSval=8193086 TSecr=15124586
  689 24.450335463 216.58.199.131 → 192.168.1.12 QUIC 76 Payload (Encrypted), PKN: 9
  690 24.450408183 192.168.1.12 → 216.58.199.131 QUIC 278 Payload (Encrypted), PKN: 11, CID: 1851188136769842599
  691 24.455518128 192.168.1.12 → 216.58.199.131 QUIC 80 Payload (Encrypted), PKN: 12, CID: 1851188136769842599
  692 24.486147250 216.58.199.131 → 192.168.1.12 QUIC 72 Payload (Encrypted), PKN: 10
  693 24.491895049  10.6.15.156 → 192.168.1.12 SSH 238 Server: Encrypted packet (len=172)
  694 24.491908152 192.168.1.12 → 10.6.15.156  TCP 66 54766 → 22 [ACK] Seq=11721 Ack=86513 Win=6155 Len=0 TSval=8193100 TSecr=15124601
  695 24.694964875 216.58.199.131 → 192.168.1.12 QUIC 207 Payload (Encrypted), PKN: 11
  696 24.695040579 216.58.199.131 → 192.168.1.12 QUIC 60 Payload (Encrypted), PKN: 12
  697 24.695126222 192.168.1.12 → 216.58.199.131 QUIC 83 Payload (Encrypted), PKN: 13, CID: 1851188136769842599
  698 24.970772872 192.168.1.12 → 239.255.255.250 SSDP 213 M-SEARCH * HTTP/1.1 
  699 25.266980285  10.6.15.156 → 192.168.1.12 SSH 302 Server: Encrypted packet (len=236)
  700 25.266999172 192.168.1.12 → 10.6.15.156  TCP 66 54766 → 22 [ACK] Seq=11721 Ack=86749 Win=6155 Len=0 TSval=8193294 TSecr=15124794
  701 25.335149434  10.6.15.156 → 192.168.1.12 SSH 270 Server: Encrypted packet (len=204)
  702 25.335168162 192.168.1.12 → 10.6.15.156  TCP 66 54766 → 22 [ACK] Seq=11721 Ack=86953 Win=6155 Len=0 TSval=8193311 TSecr=15124812
  703 25.393763005  10.6.15.156 → 192.168.1.12 SSH 270 Server: Encrypted packet (len=204)
  704 25.393781196 192.168.1.12 → 10.6.15.156  TCP 66 54766 → 22 [ACK] Seq=11721 Ack=87157 Win=6155 Len=0 TSval=8193326 TSecr=15124826
  705 25.496353477  10.6.15.156 → 192.168.1.12 SSH 302 Server: Encrypted packet (len=236)
  706 25.496371575 192.168.1.12 → 10.6.15.156  TCP 66 54766 → 22 [ACK] Seq=11721 Ack=87393 Win=6155 Len=0 TSval=8193351 TSecr=15124852
  707 25.715665471  10.6.15.156 → 192.168.1.12 SSH 182 Server: Encrypted packet (len=116)
  708 25.715682768 192.168.1.12 → 10.6.15.156  TCP 66 54766 → 22 [ACK] Seq=11721 Ack=87509 Win=6155 Len=0 TSval=8193406 TSecr=15124907
  709 25.788528840  10.6.15.156 → 192.168.1.12 SSH 318 Server: Encrypted packet (len=252)
  710 25.788546471 192.168.1.12 → 10.6.15.156  TCP 66 54766 → 22 [ACK] Seq=11721 Ack=87761 Win=6155 Len=0 TSval=8193424 TSecr=15124925
  711 25.844667721  10.6.15.156 → 192.168.1.12 SSH 222 Server: Encrypted packet (len=156)
  712 25.844684139 192.168.1.12 → 10.6.15.156  TCP 66 54766 → 22 [ACK] Seq=11721 Ack=87917 Win=6155 Len=0 TSval=8193438 TSecr=15124939
  713 25.947554371  10.6.15.156 → 192.168.1.12 SSH 334 Server: Encrypted packet (len=268)
  714 25.947571640 192.168.1.12 → 10.6.15.156  TCP 66 54766 → 22 [ACK] Seq=11721 Ack=88185 Win=6155 Len=0 TSval=8193464 TSecr=15124965
  715 25.970930621 192.168.1.12 → 239.255.255.250 SSDP 213 M-SEARCH * HTTP/1.1 
  716 26.126752919 192.168.1.12 → 10.6.15.156  SSH 158 Client: Encrypted packet (len=92)
  717 26.166277833  10.6.15.156 → 192.168.1.12 TCP 66 22 → 54766 [ACK] Seq=88185 Ack=11813 Win=1452 Len=0 TSval=15125020 TSecr=8193509
  718 26.166817319  10.6.15.156 → 192.168.1.12 SSH 318 Server: Encrypted packet (len=252)
  719 26.166834844 192.168.1.12 → 10.6.15.156  TCP 66 54766 → 22 [ACK] Seq=11813 Ack=88437 Win=6155 Len=0 TSval=8193519 TSecr=15125020
  720 26.182874730 192.168.1.12 → 139.59.50.38 NTP 90 NTP Version 4, client
  721 26.237085925  10.6.15.156 → 192.168.1.12 SSH 222 Server: Encrypted packet (len=156)
  722 26.237104475 192.168.1.12 → 10.6.15.156  TCP 66 54766 → 22 [ACK] Seq=11813 Ack=88593 Win=6155 Len=0 TSval=8193537 TSecr=15125037
  723 26.295971369  10.6.15.156 → 192.168.1.12 SSH 318 Server: Encrypted packet (len=252)
  724 26.295989129 192.168.1.12 → 10.6.15.156  TCP 66 54766 → 22 [ACK] Seq=11813 Ack=88845 Win=6155 Len=0 TSval=8193551 TSecr=15125052
  725 26.400146195  10.6.15.156 → 192.168.1.12 SSH 214 Server: Encrypted packet (len=148)
  726 26.400171897 192.168.1.12 → 10.6.15.156  TCP 66 54766 → 22 [ACK] Seq=11813 Ack=88993 Win=6155 Len=0 TSval=8193577 TSecr=15125078
  727 26.617763090  10.6.15.156 → 192.168.1.12 SSH 318 Server: Encrypted packet (len=252)
  728 26.617780675 192.168.1.12 → 10.6.15.156  TCP 66 54766 → 22 [ACK] Seq=11813 Ack=89245 Win=6155 Len=0 TSval=8193632 TSecr=15125132
  729 26.688454897  10.6.15.156 → 192.168.1.12 SSH 318 Server: Encrypted packet (len=252)
  730 26.688470518 192.168.1.12 → 10.6.15.156  TCP 66 54766 → 22 [ACK] Seq=11813 Ack=89497 Win=6155 Len=0 TSval=8193649 TSecr=15125150
  731 26.746690494  10.6.15.156 → 192.168.1.12 SSH 318 Server: Encrypted packet (len=252)
  732 26.746708653 192.168.1.12 → 10.6.15.156  TCP 66 54766 → 22 [ACK] Seq=11813 Ack=89749 Win=6155 Len=0 TSval=8193664 TSecr=15125165
  733 26.849436770  10.6.15.156 → 192.168.1.12 SSH 270 Server: Encrypted packet (len=204)
  734 26.849454668 192.168.1.12 → 10.6.15.156  TCP 66 54766 → 22 [ACK] Seq=11813 Ack=89953 Win=6155 Len=0 TSval=8193690 TSecr=15125190
  735 26.971917744 192.168.1.12 → 239.255.255.250 SSDP 213 M-SEARCH * HTTP/1.1 
  736 27.139057637  10.6.15.156 → 192.168.1.12 SSH 182 Server: Encrypted packet (len=116)
  737 27.139075454 192.168.1.12 → 10.6.15.156  TCP 66 54766 → 22 [ACK] Seq=11813 Ack=90069 Win=6155 Len=0 TSval=8193762 TSecr=15125263
  738 27.197680612  10.6.15.156 → 192.168.1.12 SSH 182 Server: Encrypted packet (len=116)
  739 27.197699228 192.168.1.12 → 10.6.15.156  TCP 66 54766 → 22 [ACK] Seq=11813 Ack=90185 Win=6155 Len=0 TSval=8193777 TSecr=15125277
  740 27.300177166  10.6.15.156 → 192.168.1.12 SSH 182 Server: Encrypted packet (len=116)
  741 27.300194556 192.168.1.12 → 10.6.15.156  TCP 66 54766 → 22 [ACK] Seq=11813 Ack=90301 Win=6155 Len=0 TSval=8193802 TSecr=15125303
  742 27.519575340  10.6.15.156 → 192.168.1.12 SSH 182 Server: Encrypted packet (len=116)
  743 27.519591661 192.168.1.12 → 10.6.15.156  TCP 66 54766 → 22 [ACK] Seq=11813 Ack=90417 Win=6155 Len=0 TSval=8193857 TSecr=15125358
  744 27.751424927  10.6.15.156 → 192.168.1.12 SSH 254 Server: Encrypted packet (len=188)
  745 27.751442417 192.168.1.12 → 10.6.15.156  TCP 66 54766 → 22 [ACK] Seq=11813 Ack=90605 Win=6155 Len=0 TSval=8193915 TSecr=15125416
  746 27.970628811  10.6.15.156 → 192.168.1.12 SSH 302 Server: Encrypted packet (len=236)
  747 27.970646162 192.168.1.12 → 10.6.15.156  TCP 66 54766 → 22 [ACK] Seq=11813 Ack=90841 Win=6155 Len=0 TSval=8193970 TSecr=15125471
  748 28.041311914  10.6.15.156 → 192.168.1.12 SSH 238 Server: Encrypted packet (len=172)
  749 28.041328972 192.168.1.12 → 10.6.15.156  TCP 66 54766 → 22 [ACK] Seq=11813 Ack=91013 Win=6155 Len=0 TSval=8193988 TSecr=15125488
  750 28.100305076  10.6.15.156 → 192.168.1.12 SSH 342 Server: Encrypted packet (len=276)
  751 28.100328453 192.168.1.12 → 10.6.15.156  TCP 66 54766 → 22 [ACK] Seq=11813 Ack=91289 Win=6155 Len=0 TSval=8194002 TSecr=15125503
  752 28.210144960  10.6.15.156 → 192.168.1.12 SSH 302 Server: Encrypted packet (len=236)
  753 28.210162323 192.168.1.12 → 10.6.15.156  TCP 66 54766 → 22 [ACK] Seq=11813 Ack=91525 Win=6155 Len=0 TSval=8194030 TSecr=15125529
  754 28.421922823  10.6.15.156 → 192.168.1.12 SSH 438 Server: Encrypted packet (len=372)
  755 28.421941981 192.168.1.12 → 10.6.15.156  TCP 66 54766 → 22 [ACK] Seq=11813 Ack=91897 Win=6155 Len=0 TSval=8194083 TSecr=15125583
  756 28.492996463  10.6.15.156 → 192.168.1.12 SSH 454 Server: Encrypted packet (len=388)
  757 28.493014078 192.168.1.12 → 10.6.15.156  TCP 66 54766 → 22 [ACK] Seq=11813 Ack=92285 Win=6155 Len=0 TSval=8194100 TSecr=15125601
  758 28.553351353  10.6.15.156 → 192.168.1.12 SSH 374 Server: Encrypted packet (len=308)
  759 28.553370258 192.168.1.12 → 10.6.15.156  TCP 66 54766 → 22 [ACK] Seq=11813 Ack=92593 Win=6155 Len=0 TSval=8194116 TSecr=15125616
  760 28.656867460  10.6.15.156 → 192.168.1.12 SSH 438 Server: Encrypted packet (len=372)
  761 28.656885585 192.168.1.12 → 10.6.15.156  TCP 66 54766 → 22 [ACK] Seq=11813 Ack=92965 Win=6155 Len=0 TSval=8194141 TSecr=15125642
  762 28.872538578  10.6.15.156 → 192.168.1.12 SSH 206 Server: Encrypted packet (len=140)
  763 28.872556532 192.168.1.12 → 10.6.15.156  TCP 66 54766 → 22 [ACK] Seq=11813 Ack=93105 Win=6155 Len=0 TSval=8194195 TSecr=15125696
  764 28.943149942  10.6.15.156 → 192.168.1.12 SSH 238 Server: Encrypted packet (len=172)
  765 28.943169962 192.168.1.12 → 10.6.15.156  TCP 66 54766 → 22 [ACK] Seq=11813 Ack=93277 Win=6155 Len=0 TSval=8194213 TSecr=15125714
  766 29.001667339  10.6.15.156 → 192.168.1.12 SSH 238 Server: Encrypted packet (len=172)
  767 29.001685016 192.168.1.12 → 10.6.15.156  TCP 66 54766 → 22 [ACK] Seq=11813 Ack=93449 Win=6155 Len=0 TSval=8194228 TSecr=15125728
  768 29.323582273  10.6.15.156 → 192.168.1.12 SSH 222 Server: Encrypted packet (len=156)
  769 29.323600267 192.168.1.12 → 10.6.15.156  TCP 66 54766 → 22 [ACK] Seq=11813 Ack=93605 Win=6155 Len=0 TSval=8194308 TSecr=15125809
  770 29.329130059  10.22.18.83 → 224.0.0.252  LLMNR 64 Standard query 0x3ad5 A wpad
  771 29.330093189  10.22.18.83 → 224.0.0.252  LLMNR 64 Standard query 0xe825 A wpad
  772 29.452766217  10.6.15.156 → 192.168.1.12 SSH 222 Server: Encrypted packet (len=156)
  773 29.452784005 192.168.1.12 → 10.6.15.156  TCP 66 54766 → 22 [ACK] Seq=11813 Ack=93761 Win=6155 Len=0 TSval=8194340 TSecr=15125841
  774 29.738727978  10.22.18.83 → 224.0.0.252  LLMNR 64 Standard query 0x3ad5 A wpad
  775 29.739651655  10.22.18.83 → 224.0.0.252  LLMNR 64 Standard query 0xe825 A wpad
  776 29.774680821  10.6.15.156 → 192.168.1.12 SSH 182 Server: Encrypted packet (len=116)
  777 29.774699481 192.168.1.12 → 10.6.15.156  TCP 66 54766 → 22 [ACK] Seq=11813 Ack=93877 Win=6155 Len=0 TSval=8194421 TSecr=15125922
  778 29.845301340  10.6.15.156 → 192.168.1.12 SSH 238 Server: Encrypted packet (len=172)
  779 29.845325242 192.168.1.12 → 10.6.15.156  TCP 66 54766 → 22 [ACK] Seq=11813 Ack=94049 Win=6155 Len=0 TSval=8194439 TSecr=15125939
  780 29.903958880  10.6.15.156 → 192.168.1.12 SSH 182 Server: Encrypted packet (len=116)
  781 29.903976146 192.168.1.12 → 10.6.15.156  TCP 66 54766 → 22 [ACK] Seq=11813 Ack=94165 Win=6155 Len=0 TSval=8194453 TSecr=15125954
  782 30.006365888  10.6.15.156 → 192.168.1.12 SSH 238 Server: Encrypted packet (len=172)
  783 30.006384180 192.168.1.12 → 10.6.15.156  TCP 66 54766 → 22 [ACK] Seq=11813 Ack=94337 Win=6155 Len=0 TSval=8194479 TSecr=15125980
  784 30.174967124 192.168.1.12 → 10.6.15.156  SSH 102 Client: Encrypted packet (len=36)
  785 30.177105073  10.6.15.156 → 192.168.1.12 TCP 66 22 → 54766 [ACK] Seq=94337 Ack=11849 Win=1452 Len=0 TSval=15126022 TSecr=8194521
  786 30.177116930 192.168.1.12 → 10.6.15.156  SSH 678 Client: Encrypted packet (len=612)
  787 30.181017807  10.6.15.156 → 192.168.1.12 TCP 66 22 → 54766 [ACK] Seq=94337 Ack=12461 Win=1452 Len=0 TSval=15126023 TSecr=8194522
  788 30.181398053  10.6.15.156 → 192.168.1.12 SSH 210 Server: Encrypted packet (len=144)
  789 30.181416678 192.168.1.12 → 10.6.15.156  TCP 66 54766 → 22 [ACK] Seq=12461 Ack=94481 Win=6155 Len=0 TSval=8194523 TSecr=15126023
  790 30.181767621  10.6.15.156 → 192.168.1.12 SSH 138 Server: Encrypted packet (len=72)
  791 30.181772416 192.168.1.12 → 10.6.15.156  TCP 66 54766 → 22 [ACK] Seq=12461 Ack=94553 Win=6155 Len=0 TSval=8194523 TSecr=15126023
  792 30.181792238 192.168.1.12 → 10.6.15.156  SSH 102 Client: Encrypted packet (len=36)
  793 30.195986671  10.6.15.156 → 192.168.1.12 SSH 138 Server: Encrypted packet (len=72)
  794 30.196014287 192.168.1.12 → 10.6.15.156  SSH 102 Client: Encrypted packet (len=36)
  795 30.216804909  10.6.15.156 → 192.168.1.12 SSH 210 Server: Encrypted packet (len=144)
  796 30.216829857 192.168.1.12 → 10.6.15.156  SSH 102 Client: Encrypted packet (len=36)
  797 30.218780127  10.6.15.156 → 192.168.1.12 SSH 138 Server: Encrypted packet (len=72)
  798 30.218800871 192.168.1.12 → 10.6.15.156  SSH 138 Client: Encrypted packet (len=72)
  799 30.218820208  10.6.15.156 → 192.168.1.12 SSH 138 Server: Encrypted packet (len=72)
  800 30.258343056  10.6.15.156 → 192.168.1.12 TCP 66 22 → 54766 [ACK] Seq=94913 Ack=12641 Win=1452 Len=0 TSval=15126043 TSecr=8194532
  801 30.258363040 192.168.1.12 → 10.6.15.156  SSH 138 Client: Encrypted packet (len=72)
  802 30.259942531  10.6.15.156 → 192.168.1.12 TCP 66 22 → 54766 [ACK] Seq=94913 Ack=12713 Win=1452 Len=0 TSval=15126043 TSecr=8194542
  803 30.296192567  10.6.15.156 → 192.168.1.12 SSH 238 Server: Encrypted packet (len=172)
  804 30.331186604  10.6.15.156 → 192.168.1.12 SSH 510 Server: Encrypted packet (len=444)
  805 30.331204868 192.168.1.12 → 10.6.15.156  TCP 66 54766 → 22 [ACK] Seq=12713 Ack=95529 Win=6155 Len=0 TSval=8194560 TSecr=15126052
  806 30.333458284  10.6.15.156 → 192.168.1.12 SSH 110 Server: Encrypted packet (len=44)
  807 30.333931915 192.168.1.12 → 10.6.15.156  SSH 142 Client: Encrypted packet (len=76)
  808 30.354934115  10.6.15.156 → 192.168.1.12 SSH 366 Server: Encrypted packet (len=300)
  809 30.393280898  10.6.15.156 → 192.168.1.12 SSH 210 Server: Encrypted packet (len=144)
  810 30.393296826 192.168.1.12 → 10.6.15.156  TCP 66 54766 → 22 [ACK] Seq=12789 Ack=96017 Win=6155 Len=0 TSval=8194576 TSecr=15126067
  811 30.393567721 192.168.1.12 → 10.6.15.156  SSH 138 Client: Encrypted packet (len=72)
  812 30.434162808  10.6.15.156 → 192.168.1.12 TCP 66 22 → 54766 [ACK] Seq=96017 Ack=12861 Win=1452 Len=0 TSval=15126087 TSecr=8194576
  813 30.457616772  10.6.15.156 → 192.168.1.12 SSH 374 Server: Encrypted packet (len=308)
  814 30.498877072  10.6.15.156 → 192.168.1.12 SSH 198 Server: Encrypted packet (len=132)
  815 30.498890571 192.168.1.12 → 10.6.15.156  TCP 66 54766 → 22 [ACK] Seq=12861 Ack=96457 Win=6155 Len=0 TSval=8194602 TSecr=15126092
  816 30.676863778  10.6.15.156 → 192.168.1.12 SSH 406 Server: Encrypted packet (len=340)
  817 30.717046917 192.168.1.12 → 10.6.15.156  TCP 66 54766 → 22 [ACK] Seq=12861 Ack=96797 Win=6155 Len=0 TSval=8194657 TSecr=15126147
  818 30.747309834  10.6.15.156 → 192.168.1.12 SSH 318 Server: Encrypted packet (len=252)
  819 30.747395745 192.168.1.12 → 10.6.15.156  TCP 66 54766 → 22 [ACK] Seq=12861 Ack=97049 Win=6155 Len=0 TSval=8194664 TSecr=15126165
  820 30.806117935  10.6.15.156 → 192.168.1.12 SSH 222 Server: Encrypted packet (len=156)
  821 30.806202978 192.168.1.12 → 10.6.15.156  TCP 66 54766 → 22 [ACK] Seq=12861 Ack=97205 Win=6155 Len=0 TSval=8194679 TSecr=15126179
  822 30.908510528  10.6.15.156 → 192.168.1.12 SSH 214 Server: Encrypted packet (len=148)
  823 30.908592295 192.168.1.12 → 10.6.15.156  TCP 66 54766 → 22 [ACK] Seq=12861 Ack=97353 Win=6155 Len=0 TSval=8194704 TSecr=15126205
  824 30.920828618  10.6.15.156 → 192.168.1.12 SSH 150 Server: Encrypted packet (len=84)
  825 30.920913533 192.168.1.12 → 10.6.15.156  TCP 66 54766 → 22 [ACK] Seq=12861 Ack=97437 Win=6155 Len=0 TSval=8194707 TSecr=15126208
  826 30.921168397 192.168.1.12 → 10.6.15.156  SSH 150 Client: Encrypted packet (len=84)
  827 30.922695301  10.6.15.156 → 192.168.1.12 TCP 66 22 → 54766 [ACK] Seq=97437 Ack=12945 Win=1452 Len=0 TSval=15126209 TSecr=8194708
  828 31.127545719  10.6.15.156 → 192.168.1.12 SSH 182 Server: Encrypted packet (len=116)
  829 31.169047495 192.168.1.12 → 10.6.15.156  TCP 66 54766 → 22 [ACK] Seq=12945 Ack=97553 Win=6155 Len=0 TSval=8194770 TSecr=15126260
  830 31.170828634  10.6.15.156 → 192.168.1.12 SSH 150 Server: Encrypted packet (len=84)
  831 31.170913924 192.168.1.12 → 10.6.15.156  TCP 66 54766 → 22 [ACK] Seq=12945 Ack=97637 Win=6155 Len=0 TSval=8194770 TSecr=15126271
  832 31.171156382 192.168.1.12 → 10.6.15.156  SSH 150 Client: Encrypted packet (len=84)
  833 31.172939878  10.6.15.156 → 192.168.1.12 TCP 66 22 → 54766 [ACK] Seq=97637 Ack=13029 Win=1452 Len=0 TSval=15126271 TSecr=8194770
  834 31.198245069  10.6.15.156 → 192.168.1.12 SSH 254 Server: Encrypted packet (len=188)
  835 31.241051435 192.168.1.12 → 10.6.15.156  TCP 66 54766 → 22 [ACK] Seq=13029 Ack=97825 Win=6155 Len=0 TSval=8194788 TSecr=15126278
  836 31.359421092  10.6.15.156 → 192.168.1.12 SSH 222 Server: Encrypted packet (len=156)
  837 31.359506061 192.168.1.12 → 10.6.15.156  TCP 66 54766 → 22 [ACK] Seq=13029 Ack=97981 Win=6155 Len=0 TSval=8194817 TSecr=15126318
  838 31.580504315  10.6.15.156 → 192.168.1.12 SSH 302 Server: Encrypted packet (len=236)
  839 31.580530270 192.168.1.12 → 10.6.15.156  TCP 66 54766 → 22 [ACK] Seq=13029 Ack=98217 Win=6155 Len=0 TSval=8194872 TSecr=15126373
  840 31.649125020  10.6.15.156 → 192.168.1.12 SSH 238 Server: Encrypted packet (len=172)
  841 31.649143680 192.168.1.12 → 10.6.15.156  TCP 66 54766 → 22 [ACK] Seq=13029 Ack=98389 Win=6155 Len=0 TSval=8194890 TSecr=15126390
  842 31.707940278  10.6.15.156 → 192.168.1.12 SSH 518 Server: Encrypted packet (len=452)
  843 31.707958146 192.168.1.12 → 10.6.15.156  TCP 66 54766 → 22 [ACK] Seq=13029 Ack=98841 Win=6155 Len=0 TSval=8194904 TSecr=15126405
  844 31.810641226  10.6.15.156 → 192.168.1.12 SSH 374 Server: Encrypted packet (len=308)
  845 31.810658476 192.168.1.12 → 10.6.15.156  TCP 66 54766 → 22 [ACK] Seq=13029 Ack=99149 Win=6155 Len=0 TSval=8194930 TSecr=15126431
  846 32.029868349  10.6.15.156 → 192.168.1.12 SSH 486 Server: Encrypted packet (len=420)
  847 32.029888807 192.168.1.12 → 10.6.15.156  TCP 66 54766 → 22 [ACK] Seq=13029 Ack=99569 Win=6155 Len=0 TSval=8194985 TSecr=15126485
  848 32.100434091  10.6.15.156 → 192.168.1.12 SSH 518 Server: Encrypted packet (len=452)
  849 32.100455769 192.168.1.12 → 10.6.15.156  TCP 66 54766 → 22 [ACK] Seq=13029 Ack=100021 Win=6155 Len=0 TSval=8195002 TSecr=15126503
  850 32.158906793  10.6.15.156 → 192.168.1.12 SSH 302 Server: Encrypted packet (len=236)
  851 32.158922588 192.168.1.12 → 10.6.15.156  TCP 66 54766 → 22 [ACK] Seq=13029 Ack=100257 Win=6155 Len=0 TSval=8195017 TSecr=15126518
  852 32.261667323  10.6.15.156 → 192.168.1.12 SSH 486 Server: Encrypted packet (len=420)
  853 32.261684754 192.168.1.12 → 10.6.15.156  TCP 66 54766 → 22 [ACK] Seq=13029 Ack=100677 Win=6155 Len=0 TSval=8195043 TSecr=15126543
  854 32.480882018  10.6.15.156 → 192.168.1.12 SSH 358 Server: Encrypted packet (len=292)
  855 32.480903992 192.168.1.12 → 10.6.15.156  TCP 66 54766 → 22 [ACK] Seq=13029 Ack=100969 Win=6155 Len=0 TSval=8195097 TSecr=15126598
  856 32.551217979  10.6.15.156 → 192.168.1.12 SSH 342 Server: Encrypted packet (len=276)
  857 32.551237381 192.168.1.12 → 10.6.15.156  TCP 66 54766 → 22 [ACK] Seq=13029 Ack=101245 Win=6155 Len=0 TSval=8195115 TSecr=15126616
  858 32.612077881  10.6.15.156 → 192.168.1.12 SSH 334 Server: Encrypted packet (len=268)
  859 32.612096228 192.168.1.12 → 10.6.15.156  TCP 66 54766 → 22 [ACK] Seq=13029 Ack=101513 Win=6155 Len=0 TSval=8195130 TSecr=15126631
  860 32.712382570  10.6.15.156 → 192.168.1.12 SSH 238 Server: Encrypted packet (len=172)
  861 32.712399764 192.168.1.12 → 10.6.15.156  TCP 66 54766 → 22 [ACK] Seq=13029 Ack=101685 Win=6155 Len=0 TSval=8195155 TSecr=15126656
  862 33.199016146  10.22.18.83 → 224.0.0.252  LLMNR 64 Standard query 0xfa3e A wpad
  863 33.199758121  10.22.18.83 → 224.0.0.252  LLMNR 64 Standard query 0x072e A wpad
  864 33.382758911  10.6.15.156 → 192.168.1.12 SSH 278 Server: Encrypted packet (len=212)
  865 33.382776834 192.168.1.12 → 10.6.15.156  TCP 66 54766 → 22 [ACK] Seq=13029 Ack=101897 Win=6155 Len=0 TSval=8195323 TSecr=15126824
  866 33.454513922  10.6.15.156 → 192.168.1.12 SSH 270 Server: Encrypted packet (len=204)
  867 33.454529209 192.168.1.12 → 10.6.15.156  TCP 66 54766 → 22 [ACK] Seq=13029 Ack=102101 Win=6155 Len=0 TSval=8195341 TSecr=15126841
  868 33.511934754  10.6.15.156 → 192.168.1.12 SSH 438 Server: Encrypted packet (len=372)
  869 33.511948623 192.168.1.12 → 10.6.15.156  TCP 66 54766 → 22 [ACK] Seq=13029 Ack=102473 Win=6155 Len=0 TSval=8195355 TSecr=15126856
  870 33.609000512  10.22.18.83 → 224.0.0.252  LLMNR 64 Standard query 0xfa3e A wpad
  871 33.609798303  10.22.18.83 → 224.0.0.252  LLMNR 64 Standard query 0x072e A wpad
  872 33.614491485  10.6.15.156 → 192.168.1.12 SSH 438 Server: Encrypted packet (len=372)
  873 33.614508763 192.168.1.12 → 10.6.15.156  TCP 66 54766 → 22 [ACK] Seq=13029 Ack=102845 Win=6155 Len=0 TSval=8195381 TSecr=15126882
  874 33.818813668  10.6.15.156 → 192.168.1.12 SSH 150 Server: Encrypted packet (len=84)
  875 33.818831453 192.168.1.12 → 10.6.15.156  TCP 66 54766 → 22 [ACK] Seq=13029 Ack=102929 Win=6155 Len=0 TSval=8195432 TSecr=15126933
  876 33.819110825 192.168.1.12 → 10.6.15.156  SSH 150 Client: Encrypted packet (len=84)
  877 33.834123908  10.6.15.156 → 192.168.1.12 SSH 470 Server: Encrypted packet (len=404)
  878 33.877045954 192.168.1.12 → 10.6.15.156  TCP 66 54766 → 22 [ACK] Seq=13113 Ack=103333 Win=6155 Len=0 TSval=8195447 TSecr=15126936
  879 33.905101377  10.6.15.156 → 192.168.1.12 SSH 470 Server: Encrypted packet (len=404)
  880 33.905129517 192.168.1.12 → 10.6.15.156  TCP 66 54766 → 22 [ACK] Seq=13113 Ack=103737 Win=6155 Len=0 TSval=8195454 TSecr=15126954
  881 33.962791194  10.6.15.156 → 192.168.1.12 SSH 294 Server: Encrypted packet (len=228)
  882 33.962808567 192.168.1.12 → 10.6.15.156  TCP 66 54766 → 22 [ACK] Seq=13113 Ack=103965 Win=6155 Len=0 TSval=8195468 TSecr=15126969
  883 34.065410550  10.6.15.156 → 192.168.1.12 SSH 334 Server: Encrypted packet (len=268)
  884 34.065432085 192.168.1.12 → 10.6.15.156  TCP 66 54766 → 22 [ACK] Seq=13113 Ack=104233 Win=6155 Len=0 TSval=8195494 TSecr=15126994
  885 34.236903227  10.22.18.83 → 224.0.0.252  LLMNR 74 Standard query 0x4d73 A yjxwuzjmafnobp
  886 34.237235979  10.22.18.83 → 224.0.0.252  LLMNR 67 Standard query 0xa593 A qraliif
  887 34.237616772  10.22.18.83 → 224.0.0.252  LLMNR 69 Standard query 0x23de A jpqkzjqej
  888 34.284886446  10.6.15.156 → 192.168.1.12 SSH 582 Server: Encrypted packet (len=516)
  889 34.284903068 192.168.1.12 → 10.6.15.156  TCP 66 54766 → 22 [ACK] Seq=13113 Ack=104749 Win=6155 Len=0 TSval=8195548 TSecr=15127049
  890 34.341555701  10.6.15.156 → 192.168.1.12 SSH 150 Server: Encrypted packet (len=84)
  891 34.341572898 192.168.1.12 → 10.6.15.156  TCP 66 54766 → 22 [ACK] Seq=13113 Ack=104833 Win=6155 Len=0 TSval=8195563 TSecr=15127063
  892 34.341866681 192.168.1.12 → 10.6.15.156  SSH 150 Client: Encrypted packet (len=84)
  893 34.355667909  10.6.15.156 → 192.168.1.12 SSH 566 Server: Encrypted packet (len=500)
  894 34.397046739 192.168.1.12 → 10.6.15.156  TCP 66 54766 → 22 [ACK] Seq=13197 Ack=105333 Win=6155 Len=0 TSval=8195577 TSecr=15127067
  895 34.414174051  10.6.15.156 → 192.168.1.12 SSH 662 Server: Encrypted packet (len=596)
  896 34.414200065 192.168.1.12 → 10.6.15.156  TCP 66 54766 → 22 [ACK] Seq=13197 Ack=105929 Win=6155 Len=0 TSval=8195581 TSecr=15127081
  897 34.516803868  10.6.15.156 → 192.168.1.12 SSH 614 Server: Encrypted packet (len=548)
  898 34.516821876 192.168.1.12 → 10.6.15.156  TCP 66 54766 → 22 [ACK] Seq=13197 Ack=106477 Win=6155 Len=0 TSval=8195606 TSecr=15127107
  899 34.645834429  10.22.18.83 → 224.0.0.252  LLMNR 69 Standard query 0x23de A jpqkzjqej
  900 34.646279357  10.22.18.83 → 224.0.0.252  LLMNR 67 Standard query 0xa593 A qraliif
  901 34.646619208  10.22.18.83 → 224.0.0.252  LLMNR 74 Standard query 0x4d73 A yjxwuzjmafnobp
  902 34.736018746  10.6.15.156 → 192.168.1.12 SSH 318 Server: Encrypted packet (len=252)
  903 34.736043245 192.168.1.12 → 10.6.15.156  TCP 66 54766 → 22 [ACK] Seq=13197 Ack=106729 Win=6155 Len=0 TSval=8195661 TSecr=15127162
  904 34.806381941  10.6.15.156 → 192.168.1.12 SSH 302 Server: Encrypted packet (len=236)
  905 34.806399782 192.168.1.12 → 10.6.15.156  TCP 66 54766 → 22 [ACK] Seq=13197 Ack=106965 Win=6155 Len=0 TSval=8195679 TSecr=15127180
