    1 0.000000000  10.6.15.156 → 192.168.1.12 SSH 182 Server: Encrypted packet (len=116)
    2 0.000025299 192.168.1.12 → 10.6.15.156  TCP 66 54766 → 22 [ACK] Seq=1 Ack=117 Win=6155 Len=0 TSval=8060981 TSecr=14992480
    3 0.162157023  10.6.15.156 → 192.168.1.12 SSH 286 Server: Encrypted packet (len=220)
    4 0.162173568 192.168.1.12 → 10.6.15.156  TCP 66 54766 → 22 [ACK] Seq=1 Ack=337 Win=6155 Len=0 TSval=8061021 TSecr=14992520
    5 0.167643838 192.168.1.12 → 10.6.15.156  SSH 102 Client: Encrypted packet (len=36)
    6 0.168973901  10.6.15.156 → 192.168.1.12 TCP 66 22 → 54766 [ACK] Seq=337 Ack=37 Win=1452 Len=0 TSval=14992522 TSecr=8061022
    7 0.168989887 192.168.1.12 → 10.6.15.156  SSH 598 Client: Encrypted packet (len=532)
    8 0.170871692  10.6.15.156 → 192.168.1.12 TCP 66 22 → 54766 [ACK] Seq=337 Ack=569 Win=1452 Len=0 TSval=14992523 TSecr=8061023
    9 0.170883289 192.168.1.12 → 10.6.15.156  SSH 190 Client: Encrypted packet (len=124)
   10 0.172422887  10.6.15.156 → 192.168.1.12 TCP 66 22 → 54766 [ACK] Seq=337 Ack=693 Win=1452 Len=0 TSval=14992523 TSecr=8061023
   11 0.218837006  10.6.15.156 → 192.168.1.12 SSH 102 Server: Encrypted packet (len=36)
   12 0.219752421  10.6.15.156 → 192.168.1.12 SSH 102 Server: Encrypted packet (len=36)
   13 0.219799069 192.168.1.12 → 10.6.15.156  TCP 66 54766 → 22 [ACK] Seq=693 Ack=409 Win=6155 Len=0 TSval=8061036 TSecr=14992534
   14 0.225683761  10.6.15.156 → 192.168.1.12 SSH 150 Server: Encrypted packet (len=84)
   15 0.225963381 192.168.1.12 → 10.6.15.156  SSH 158 Client: Encrypted packet (len=92)
   16 0.226316102  10.6.15.156 → 192.168.1.12 SSH 182 Server: Encrypted packet (len=116)
   17 0.227525488  10.6.15.156 → 192.168.1.12 TCP 66 22 → 54766 [ACK] Seq=609 Ack=785 Win=1452 Len=0 TSval=14992537 TSecr=8061037
   18 0.228946068  10.6.15.156 → 192.168.1.12 SSH 150 Server: Encrypted packet (len=84)
   19 0.228977992 192.168.1.12 → 10.6.15.156  TCP 66 54766 → 22 [ACK] Seq=785 Ack=693 Win=6155 Len=0 TSval=8061038 TSecr=14992536
   20 0.229148119 192.168.1.12 → 10.6.15.156  SSH 150 Client: Encrypted packet (len=84)
   21 0.243282770  10.6.15.156 → 192.168.1.12 SSH 138 Server: Encrypted packet (len=72)
   22 0.283681881 192.168.1.12 → 10.6.15.156  TCP 66 54766 → 22 [ACK] Seq=869 Ack=765 Win=6155 Len=0 TSval=8061052 TSecr=14992541
   23 0.294854075  10.6.15.156 → 192.168.1.12 SSH 182 Server: Encrypted packet (len=116)
   24 0.294916256 192.168.1.12 → 10.6.15.156  TCP 66 54766 → 22 [ACK] Seq=869 Ack=881 Win=6155 Len=0 TSval=8061054 TSecr=14992553
   25 0.540815213  10.6.15.156 → 192.168.1.12 SSH 102 Server: Encrypted packet (len=36)
   26 0.540840486 192.168.1.12 → 10.6.15.156  TCP 66 54766 → 22 [ACK] Seq=869 Ack=917 Win=6155 Len=0 TSval=8061116 TSecr=14992615
   27 0.554699810  10.6.15.156 → 192.168.1.12 SSH 102 Server: Encrypted packet (len=36)
   28 0.554718310 192.168.1.12 → 10.6.15.156  TCP 66 54766 → 22 [ACK] Seq=869 Ack=953 Win=6155 Len=0 TSval=8061119 TSecr=14992618
   29 0.558042398  10.6.15.156 → 192.168.1.12 SSH 102 Server: Encrypted packet (len=36)
   30 0.558059913 192.168.1.12 → 10.6.15.156  TCP 66 54766 → 22 [ACK] Seq=869 Ack=989 Win=6155 Len=0 TSval=8061120 TSecr=14992619
   31 0.558470009 192.168.1.12 → 10.6.15.156  SSH 518 Client: Encrypted packet (len=452)
   32 0.560871280  10.6.15.156 → 192.168.1.12 SSH 294 Server: Encrypted packet (len=228)
   33 0.562064284  10.6.15.156 → 192.168.1.12 SSH 1514 Server: Encrypted packet (len=1448)
   34 0.562079154 192.168.1.12 → 10.6.15.156  TCP 66 54766 → 22 [ACK] Seq=1321 Ack=2665 Win=6155 Len=0 TSval=8061121 TSecr=14992620
   35 0.562229577  10.6.15.156 → 192.168.1.12 SSH 1514 Server: Encrypted packet (len=1448)
   36 0.562434421  10.6.15.156 → 192.168.1.12 SSH 638 Server: Encrypted packet (len=572)
   37 0.562441776 192.168.1.12 → 10.6.15.156  TCP 66 54766 → 22 [ACK] Seq=1321 Ack=4685 Win=6155 Len=0 TSval=8061121 TSecr=14992620
   38 0.565781184  10.6.15.156 → 192.168.1.12 SSH 110 Server: Encrypted packet (len=44)
   39 0.571705101  10.6.15.156 → 192.168.1.12 SSH 138 Server: Encrypted packet (len=72)
   40 0.571784846 192.168.1.12 → 10.6.15.156  TCP 66 54766 → 22 [ACK] Seq=1321 Ack=4801 Win=6155 Len=0 TSval=8061124 TSecr=14992621
   41 0.573042128  10.6.15.156 → 192.168.1.12 SSH 102 Server: Encrypted packet (len=36)
   42 0.573454092  10.6.15.156 → 192.168.1.12 SSH 102 Server: Encrypted packet (len=36)
   43 0.573502688 192.168.1.12 → 10.6.15.156  TCP 66 54766 → 22 [ACK] Seq=1321 Ack=4873 Win=6155 Len=0 TSval=8061124 TSecr=14992623
   44 0.574682159  10.6.15.156 → 192.168.1.12 SSH 102 Server: Encrypted packet (len=36)
   45 0.584051218 192.168.1.12 → 10.6.15.156  SSH 142 Client: Encrypted packet (len=76)
   46 0.591421371  10.6.15.156 → 192.168.1.12 SSH 138 Server: Encrypted packet (len=72)
   47 0.591454498 192.168.1.12 → 10.6.15.156  SSH 186 Client: Encrypted packet (len=120)
   48 0.591797700 192.168.1.12 → 10.6.15.156  SSH 102 Client: Encrypted packet (len=36)
   49 0.593133903  10.6.15.156 → 192.168.1.12 TCP 66 22 → 54766 [ACK] Seq=4981 Ack=1553 Win=1452 Len=0 TSval=14992628 TSecr=8061128
   50 0.594442628 192.168.1.12 → 10.6.15.156  SSH 118 Client: Encrypted packet (len=52)
   51 0.595173708 192.168.1.12 → 10.6.15.156  SSH 118 Client: Encrypted packet (len=52)
   52 0.596654697  10.6.15.156 → 192.168.1.12 TCP 66 22 → 54766 [ACK] Seq=4981 Ack=1657 Win=1452 Len=0 TSval=14992629 TSecr=8061129
   53 0.596675100 192.168.1.12 → 10.6.15.156  SSH 142 Client: Encrypted packet (len=76)
   54 0.635123509  10.6.15.156 → 192.168.1.12 TCP 66 22 → 54766 [ACK] Seq=4981 Ack=1733 Win=1452 Len=0 TSval=14992639 TSecr=8061130
   55 0.677632628  10.6.15.156 → 192.168.1.12 SSH 358 Server: Encrypted packet (len=292)
   56 0.719669107 192.168.1.12 → 10.6.15.156  TCP 66 54766 → 22 [ACK] Seq=1733 Ack=5273 Win=6155 Len=0 TSval=8061161 TSecr=14992649
   57 0.745920821  10.6.15.156 → 192.168.1.12 SSH 182 Server: Encrypted packet (len=116)
   58 0.745942644 192.168.1.12 → 10.6.15.156  TCP 66 54766 → 22 [ACK] Seq=1733 Ack=5389 Win=6155 Len=0 TSval=8061167 TSecr=14992666
   59 0.800511796  10.6.15.156 → 192.168.1.12 SSH 254 Server: Encrypted packet (len=188)
   60 0.800599139 192.168.1.12 → 10.6.15.156  TCP 66 54766 → 22 [ACK] Seq=1733 Ack=5577 Win=6155 Len=0 TSval=8061181 TSecr=14992680
   61 0.901926126  10.6.15.156 → 192.168.1.12 SSH 222 Server: Encrypted packet (len=156)
   62 0.902010063 192.168.1.12 → 10.6.15.156  TCP 66 54766 → 22 [ACK] Seq=1733 Ack=5733 Win=6155 Len=0 TSval=8061206 TSecr=14992705
   63 0.947200350  10.6.15.156 → 192.168.1.12 SSH 246 Server: Encrypted packet (len=180)
   64 0.947288737 192.168.1.12 → 10.6.15.156  TCP 66 54766 → 22 [ACK] Seq=1733 Ack=5913 Win=6155 Len=0 TSval=8061217 TSecr=14992717
   65 0.947542800 192.168.1.12 → 10.6.15.156  SSH 150 Client: Encrypted packet (len=84)
   66 0.949844172  10.6.15.156 → 192.168.1.12 TCP 66 22 → 54766 [ACK] Seq=5913 Ack=1817 Win=1452 Len=0 TSval=14992717 TSecr=8061217
   67 0.974277652  10.6.15.156 → 192.168.1.12 SSH 750 Server: Encrypted packet (len=684)
   68 0.981529257  10.6.15.156 → 192.168.1.12 SSH 1294 Server: Encrypted packet (len=1228)
   69 0.981548894 192.168.1.12 → 10.6.15.156  TCP 66 54766 → 22 [ACK] Seq=1817 Ack=7825 Win=6155 Len=0 TSval=8061226 TSecr=14992723
   70 0.981636260  10.6.15.156 → 192.168.1.12 SSH 1514 Server: Encrypted packet (len=1448)
   71 0.981962231  10.6.15.156 → 192.168.1.12 SSH 1514 Server: Encrypted packet (len=1448)
   72 0.981971517 192.168.1.12 → 10.6.15.156  TCP 66 54766 → 22 [ACK] Seq=1817 Ack=10721 Win=6155 Len=0 TSval=8061226 TSecr=14992725
   73 0.982109104  10.6.15.156 → 192.168.1.12 SSH 1342 Server: Encrypted packet (len=1276)
   74 0.982118553  10.6.15.156 → 192.168.1.12 SSH 158 Server: Encrypted packet (len=92)
   75 0.982154893 192.168.1.12 → 10.6.15.156  TCP 66 54766 → 22 [ACK] Seq=1817 Ack=12089 Win=6155 Len=0 TSval=8061226 TSecr=14992725
   76 0.983175985  10.6.15.156 → 192.168.1.12 SSH 1514 Server: Encrypted packet (len=1448)
   77 0.983305543  10.6.15.156 → 192.168.1.12 SSH 1222 Server: Encrypted packet (len=1156)
   78 0.983315853 192.168.1.12 → 10.6.15.156  TCP 66 54766 → 22 [ACK] Seq=1817 Ack=14693 Win=6155 Len=0 TSval=8061226 TSecr=14992725
   79 0.987155934  10.6.15.156 → 192.168.1.12 SSH 1514 Server: Encrypted packet (len=1448)
   80 0.987317980  10.6.15.156 → 192.168.1.12 SSH 1514 Server: Encrypted packet (len=1448)
   81 0.987330627 192.168.1.12 → 10.6.15.156  TCP 66 54766 → 22 [ACK] Seq=1817 Ack=17589 Win=6155 Len=0 TSval=8061227 TSecr=14992726
   82 0.987490215  10.6.15.156 → 192.168.1.12 SSH 1514 Server: Encrypted packet (len=1448)
   83 0.987679812  10.6.15.156 → 192.168.1.12 SSH 1514 Server: Encrypted packet (len=1448)
   84 0.987687357 192.168.1.12 → 10.6.15.156  TCP 66 54766 → 22 [ACK] Seq=1817 Ack=20485 Win=6155 Len=0 TSval=8061228 TSecr=14992726
   85 0.987835962  10.6.15.156 → 192.168.1.12 SSH 1514 Server: Encrypted packet (len=1448)
   86 0.988007667  10.6.15.156 → 192.168.1.12 SSH 1514 Server: Encrypted packet (len=1448)
   87 0.988014505 192.168.1.12 → 10.6.15.156  TCP 66 54766 → 22 [ACK] Seq=1817 Ack=23381 Win=6155 Len=0 TSval=8061228 TSecr=14992726
   88 0.988181499  10.6.15.156 → 192.168.1.12 SSH 1514 Server: Encrypted packet (len=1448)
   89 0.988509053  10.6.15.156 → 192.168.1.12 SSH 1514 Server: Encrypted packet (len=1448)
   90 0.988520994 192.168.1.12 → 10.6.15.156  TCP 66 54766 → 22 [ACK] Seq=1817 Ack=26277 Win=6155 Len=0 TSval=8061228 TSecr=14992726
   91 0.990994181  10.6.15.156 → 192.168.1.12 SSH 1514 Server: Encrypted packet (len=1448)
   92 0.991155798  10.6.15.156 → 192.168.1.12 SSH 1514 Server: Encrypted packet (len=1448)
   93 0.991167570 192.168.1.12 → 10.6.15.156  TCP 66 54766 → 22 [ACK] Seq=1817 Ack=29173 Win=6155 Len=0 TSval=8061228 TSecr=14992727
   94 0.991328737  10.6.15.156 → 192.168.1.12 SSH 1514 Server: Encrypted packet (len=1448)
   95 0.991503270  10.6.15.156 → 192.168.1.12 SSH 1514 Server: Encrypted packet (len=1448)
   96 0.991510382 192.168.1.12 → 10.6.15.156  TCP 66 54766 → 22 [ACK] Seq=1817 Ack=32069 Win=6155 Len=0 TSval=8061228 TSecr=14992727
   97 0.991676222  10.6.15.156 → 192.168.1.12 SSH 1514 Server: Encrypted packet (len=1448)
   98 0.991846558  10.6.15.156 → 192.168.1.12 SSH 1514 Server: Encrypted packet (len=1448)
   99 0.991855702 192.168.1.12 → 10.6.15.156  TCP 66 54766 → 22 [ACK] Seq=1817 Ack=34965 Win=6155 Len=0 TSval=8061229 TSecr=14992727
  100 0.992176253  10.6.15.156 → 192.168.1.12 SSH 1514 Server: Encrypted packet (len=1448)
  101 0.992360654  10.6.15.156 → 192.168.1.12 SSH 1514 Server: Encrypted packet (len=1448)
  102 0.992373486 192.168.1.12 → 10.6.15.156  TCP 66 54766 → 22 [ACK] Seq=1817 Ack=37861 Win=6155 Len=0 TSval=8061229 TSecr=14992727
  103 0.994897941  10.6.15.156 → 192.168.1.12 SSH 1514 Server: Encrypted packet (len=1448)
  104 0.995060421  10.6.15.156 → 192.168.1.12 SSH 1514 Server: Encrypted packet (len=1448)
  105 0.995071553 192.168.1.12 → 10.6.15.156  TCP 66 54766 → 22 [ACK] Seq=1817 Ack=40757 Win=6155 Len=0 TSval=8061229 TSecr=14992728
  106 0.995232693  10.6.15.156 → 192.168.1.12 SSH 1514 Server: Encrypted packet (len=1448)
  107 0.995406166  10.6.15.156 → 192.168.1.12 SSH 1514 Server: Encrypted packet (len=1448)
  108 0.995412150 192.168.1.12 → 10.6.15.156  TCP 66 54766 → 22 [ACK] Seq=1817 Ack=43653 Win=6155 Len=0 TSval=8061229 TSecr=14992728
  109 0.995577631  10.6.15.156 → 192.168.1.12 SSH 1514 Server: Encrypted packet (len=1448)
  110 0.995752490  10.6.15.156 → 192.168.1.12 SSH 1514 Server: Encrypted packet (len=1448)
  111 0.995759684 192.168.1.12 → 10.6.15.156  TCP 66 54766 → 22 [ACK] Seq=1817 Ack=46549 Win=6155 Len=0 TSval=8061230 TSecr=14992728
  112 0.996079599  10.6.15.156 → 192.168.1.12 SSH 1514 Server: Encrypted packet (len=1448)
  113 0.996249301  10.6.15.156 → 192.168.1.12 SSH 1514 Server: Encrypted packet (len=1448)
  114 0.996256397 192.168.1.12 → 10.6.15.156  TCP 66 54766 → 22 [ACK] Seq=1817 Ack=49445 Win=6155 Len=0 TSval=8061230 TSecr=14992728
  115 0.998802342  10.6.15.156 → 192.168.1.12 SSH 1514 Server: Encrypted packet (len=1448)
  116 0.998964203  10.6.15.156 → 192.168.1.12 SSH 1514 Server: Encrypted packet (len=1448)
  117 0.998973585 192.168.1.12 → 10.6.15.156  TCP 66 54766 → 22 [ACK] Seq=1817 Ack=52341 Win=6155 Len=0 TSval=8061230 TSecr=14992729
  118 0.999136755  10.6.15.156 → 192.168.1.12 SSH 1514 Server: Encrypted packet (len=1448)
  119 0.999309493  10.6.15.156 → 192.168.1.12 SSH 1514 Server: Encrypted packet (len=1448)
  120 0.999313976 192.168.1.12 → 10.6.15.156  TCP 66 54766 → 22 [ACK] Seq=1817 Ack=55237 Win=6155 Len=0 TSval=8061230 TSecr=14992729
  121 0.999482434  10.6.15.156 → 192.168.1.12 SSH 1514 Server: Encrypted packet (len=1448)
  122 0.999660185  10.6.15.156 → 192.168.1.12 SSH 1514 Server: Encrypted packet (len=1448)
  123 0.999664681 192.168.1.12 → 10.6.15.156  TCP 66 54766 → 22 [ACK] Seq=1817 Ack=58133 Win=6155 Len=0 TSval=8061231 TSecr=14992729
  124 0.999979763  10.6.15.156 → 192.168.1.12 SSH 1514 Server: Encrypted packet (len=1448)
  125 1.000153260  10.6.15.156 → 192.168.1.12 SSH 1514 Server: Encrypted packet (len=1448)
  126 1.000157752 192.168.1.12 → 10.6.15.156  TCP 66 54766 → 22 [ACK] Seq=1817 Ack=61029 Win=6155 Len=0 TSval=8061231 TSecr=14992729
  127 1.002708688  10.6.15.156 → 192.168.1.12 SSH 1514 Server: Encrypted packet (len=1448)
  128 1.002869184  10.6.15.156 → 192.168.1.12 SSH 1514 Server: Encrypted packet (len=1448)
  129 1.002879624 192.168.1.12 → 10.6.15.156  TCP 66 54766 → 22 [ACK] Seq=1817 Ack=63925 Win=6155 Len=0 TSval=8061231 TSecr=14992730
  130 1.003040824  10.6.15.156 → 192.168.1.12 SSH 1514 Server: Encrypted packet (len=1448)
  131 1.003213193  10.6.15.156 → 192.168.1.12 SSH 1514 Server: Encrypted packet (len=1448)
  132 1.003218283 192.168.1.12 → 10.6.15.156  TCP 66 54766 → 22 [ACK] Seq=1817 Ack=66821 Win=6155 Len=0 TSval=8061231 TSecr=14992730
  133 1.003386521  10.6.15.156 → 192.168.1.12 SSH 1514 Server: Encrypted packet (len=1448)
  134 1.003558176  10.6.15.156 → 192.168.1.12 SSH 1514 Server: Encrypted packet (len=1448)
  135 1.003562697 192.168.1.12 → 10.6.15.156  TCP 66 54766 → 22 [ACK] Seq=1817 Ack=69717 Win=6155 Len=0 TSval=8061231 TSecr=14992730
  136 1.003884791  10.6.15.156 → 192.168.1.12 SSH 1514 Server: Encrypted packet (len=1448)
  137 1.004056868  10.6.15.156 → 192.168.1.12 SSH 1514 Server: Encrypted packet (len=1448)
  138 1.004062777 192.168.1.12 → 10.6.15.156  TCP 66 54766 → 22 [ACK] Seq=1817 Ack=72613 Win=6155 Len=0 TSval=8061232 TSecr=14992730
  139 1.006353244  10.6.15.156 → 192.168.1.12 SSH 1514 Server: Encrypted packet (len=1448)
  140 1.006648013  10.6.15.156 → 192.168.1.12 SSH 1514 Server: Encrypted packet (len=1448)
  141 1.006656305 192.168.1.12 → 10.6.15.156  TCP 66 54766 → 22 [ACK] Seq=1817 Ack=75509 Win=6155 Len=0 TSval=8061232 TSecr=14992731
  142 1.006820584  10.6.15.156 → 192.168.1.12 SSH 1514 Server: Encrypted packet (len=1448)
  143 1.006993534  10.6.15.156 → 192.168.1.12 SSH 1514 Server: Encrypted packet (len=1448)
  144 1.006997927 192.168.1.12 → 10.6.15.156  TCP 66 54766 → 22 [ACK] Seq=1817 Ack=78405 Win=6155 Len=0 TSval=8061232 TSecr=14992731
  145 1.007320293  10.6.15.156 → 192.168.1.12 SSH 1514 Server: Encrypted packet (len=1448)
  146 1.007360566  10.6.15.156 → 192.168.1.12 SSH 590 Server: Encrypted packet (len=524)
  147 1.007365068 192.168.1.12 → 10.6.15.156  TCP 66 54766 → 22 [ACK] Seq=1817 Ack=80377 Win=6155 Len=0 TSval=8061232 TSecr=14992731
  148 1.055034762 192.168.1.12 → 10.6.15.156  SSH 470 Client: Encrypted packet (len=404)
  149 1.095825836  10.6.15.156 → 192.168.1.12 TCP 66 22 → 54766 [ACK] Seq=80377 Ack=2221 Win=1452 Len=0 TSval=14992754 TSecr=8061244
  150 1.095843188 192.168.1.12 → 10.6.15.156  SSH 366 Client: Encrypted packet (len=300)
  151 1.097720680  10.6.15.156 → 192.168.1.12 TCP 66 22 → 54766 [ACK] Seq=80377 Ack=2521 Win=1452 Len=0 TSval=14992754 TSecr=8061255
  152 1.098228296  10.6.15.156 → 192.168.1.12 SSH 102 Server: Encrypted packet (len=36)
  153 1.128742645  10.6.15.156 → 192.168.1.12 SSH 230 Server: Encrypted packet (len=164)
  154 1.128760791 192.168.1.12 → 10.6.15.156  TCP 66 54766 → 22 [ACK] Seq=2521 Ack=80577 Win=6155 Len=0 TSval=8061263 TSecr=14992754
  155 1.159614277  10.6.15.156 → 192.168.1.12 SSH 366 Server: Encrypted packet (len=300)
  156 1.196979643  10.6.15.156 → 192.168.1.12 SSH 358 Server: Encrypted packet (len=292)
  157 1.196996029 192.168.1.12 → 10.6.15.156  TCP 66 54766 → 22 [ACK] Seq=2521 Ack=81169 Win=6155 Len=0 TSval=8061280 TSecr=14992770
  158 1.209836102 192.168.1.12 → 10.6.15.156  SSH 678 Client: Encrypted packet (len=612)
  159 1.251090955  10.6.15.156 → 192.168.1.12 TCP 66 22 → 54766 [ACK] Seq=81169 Ack=3133 Win=1452 Len=0 TSval=14992793 TSecr=8061283
  160 1.251115725 192.168.1.12 → 10.6.15.156  SSH 302 Client: Encrypted packet (len=236)
  161 1.251668086  10.6.15.156 → 192.168.1.12 SSH 358 Server: Encrypted packet (len=292)
  162 1.252943928  10.6.15.156 → 192.168.1.12 TCP 66 22 → 54766 [ACK] Seq=81461 Ack=3369 Win=1452 Len=0 TSval=14992793 TSecr=8061293
  163 1.262518308 192.168.1.12 → 10.6.15.156  SSH 166 Client: Encrypted packet (len=100)
  164 1.264169233  10.6.15.156 → 192.168.1.12 TCP 66 22 → 54766 [ACK] Seq=81461 Ack=3469 Win=1452 Len=0 TSval=14992796 TSecr=8061296
  165 1.264179300 192.168.1.12 → 10.6.15.156  SSH 234 Client: Encrypted packet (len=168)
  166 1.265859085  10.6.15.156 → 192.168.1.12 TCP 66 22 → 54766 [ACK] Seq=81461 Ack=3637 Win=1452 Len=0 TSval=14992796 TSecr=8061297
  167 1.266283174  10.6.15.156 → 192.168.1.12 SSH 102 Server: Encrypted packet (len=36)
  168 1.307682555 192.168.1.12 → 10.6.15.156  TCP 66 54766 → 22 [ACK] Seq=3637 Ack=81497 Win=6155 Len=0 TSval=8061308 TSecr=14992796
  169 1.335481281  10.6.15.156 → 192.168.1.12 SSH 174 Server: Encrypted packet (len=108)
  170 1.335594668 192.168.1.12 → 10.6.15.156  TCP 66 54766 → 22 [ACK] Seq=3637 Ack=81605 Win=6155 Len=0 TSval=8061314 TSecr=14992814
  171 1.353262849  10.6.15.156 → 192.168.1.12 SSH 438 Server: Encrypted packet (len=372)
  172 1.353337286 192.168.1.12 → 10.6.15.156  TCP 66 54766 → 22 [ACK] Seq=3637 Ack=81977 Win=6155 Len=0 TSval=8061319 TSecr=14992818
  173 1.408267036 192.168.1.12 → 10.6.15.156  SSH 1514 Client: Encrypted packet (len=1448)
  174 1.447426732  10.6.15.156 → 192.168.1.12 TCP 66 22 → 54766 [ACK] Seq=81977 Ack=5085 Win=1452 Len=0 TSval=14992842 TSecr=8061333
  175 1.447447867 192.168.1.12 → 10.6.15.156  SSH 814 Client: Encrypted packet (len=748)
  176 1.449618215  10.6.15.156 → 192.168.1.12 TCP 66 22 → 54766 [ACK] Seq=81977 Ack=5833 Win=1452 Len=0 TSval=14992842 TSecr=8061342
  177 1.452263402  10.6.15.156 → 192.168.1.12 SSH 142 Server: Encrypted packet (len=76)
  178 1.452335215 192.168.1.12 → 10.6.15.156  TCP 66 54766 → 22 [ACK] Seq=5833 Ack=82053 Win=6155 Len=0 TSval=8061344 TSecr=14992843
  179 1.475725645  10.6.15.156 → 192.168.1.12 SSH 966 Server: Encrypted packet (len=900)
  180 1.475799251 192.168.1.12 → 10.6.15.156  TCP 66 54766 → 22 [ACK] Seq=5833 Ack=82953 Win=6155 Len=0 TSval=8061350 TSecr=14992849
  181 1.477653577 192.168.1.12 → 10.6.15.156  SSH 150 Client: Encrypted packet (len=84)
  182 1.479983552  10.6.15.156 → 192.168.1.12 SSH 142 Server: Encrypted packet (len=76)
  183 1.483310586  10.6.15.156 → 192.168.1.12 SSH 1514 Server: Encrypted packet (len=1448)
  184 1.483325527 192.168.1.12 → 10.6.15.156  TCP 66 54766 → 22 [ACK] Seq=5917 Ack=84477 Win=6155 Len=0 TSval=8061351 TSecr=14992850
  185 1.483470198  10.6.15.156 → 192.168.1.12 SSH 1514 Server: Encrypted packet (len=1448)
  186 1.483624185  10.6.15.156 → 192.168.1.12 SSH 462 Server: Encrypted packet (len=396)
  187 1.483627312 192.168.1.12 → 10.6.15.156  TCP 66 54766 → 22 [ACK] Seq=5917 Ack=86321 Win=6155 Len=0 TSval=8061351 TSecr=14992850
  188 1.483951596  10.6.15.156 → 192.168.1.12 SSH 1514 Server: Encrypted packet (len=1448)
  189 1.484280388  10.6.15.156 → 192.168.1.12 SSH 1514 Server: Encrypted packet (len=1448)
  190 1.484285955 192.168.1.12 → 10.6.15.156  TCP 66 54766 → 22 [ACK] Seq=5917 Ack=89217 Win=6155 Len=0 TSval=8061352 TSecr=14992851
  191 1.484447251  10.6.15.156 → 192.168.1.12 SSH 1514 Server: Encrypted packet (len=1448)
  192 1.484632327  10.6.15.156 → 192.168.1.12 SSH 478 Server: Encrypted packet (len=412)
  193 1.484634931 192.168.1.12 → 10.6.15.156  TCP 66 54766 → 22 [ACK] Seq=5917 Ack=91077 Win=6155 Len=0 TSval=8061352 TSecr=14992851
  194 1.488798519  10.6.15.156 → 192.168.1.12 SSH 1514 Server: Encrypted packet (len=1448)
  195 1.488958405  10.6.15.156 → 192.168.1.12 SSH 1514 Server: Encrypted packet (len=1448)
  196 1.488969922 192.168.1.12 → 10.6.15.156  TCP 66 54766 → 22 [ACK] Seq=5917 Ack=93973 Win=6155 Len=0 TSval=8061353 TSecr=14992852
  197 1.489132437  10.6.15.156 → 192.168.1.12 SSH 1514 Server: Encrypted packet (len=1448)
  198 1.489294227  10.6.15.156 → 192.168.1.12 SSH 1514 Server: Encrypted packet (len=1448)
  199 1.489301232 192.168.1.12 → 10.6.15.156  TCP 66 54766 → 22 [ACK] Seq=5917 Ack=96869 Win=6155 Len=0 TSval=8061353 TSecr=14992852
  200 1.489466843  10.6.15.156 → 192.168.1.12 SSH 1514 Server: Encrypted packet (len=1448)
  201 1.489638114  10.6.15.156 → 192.168.1.12 SSH 1514 Server: Encrypted packet (len=1448)
  202 1.489644128 192.168.1.12 → 10.6.15.156  TCP 66 54766 → 22 [ACK] Seq=5917 Ack=99765 Win=6155 Len=0 TSval=8061353 TSecr=14992852
  203 1.496592649  10.6.15.156 → 192.168.1.12 SSH 1514 Server: Encrypted packet (len=1448)
  204 1.496915651  10.6.15.156 → 192.168.1.12 SSH 1514 Server: Encrypted packet (len=1448)
  205 1.496934695 192.168.1.12 → 10.6.15.156  TCP 66 54766 → 22 [ACK] Seq=5917 Ack=102661 Win=6155 Len=0 TSval=8061355 TSecr=14992852
  206 1.497024736  10.6.15.156 → 192.168.1.12 SSH 1514 Server: Encrypted packet (len=1448)
  207 1.497274301  10.6.15.156 → 192.168.1.12 SSH 1514 Server: Encrypted packet (len=1448)
  208 1.497292569 192.168.1.12 → 10.6.15.156  TCP 66 54766 → 22 [ACK] Seq=5917 Ack=105557 Win=6155 Len=0 TSval=8061355 TSecr=14992853
  209 1.497369132  10.6.15.156 → 192.168.1.12 SSH 1514 Server: Encrypted packet (len=1448)
  210 1.497540534  10.6.15.156 → 192.168.1.12 SSH 1514 Server: Encrypted packet (len=1448)
  211 1.497547958 192.168.1.12 → 10.6.15.156  TCP 66 54766 → 22 [ACK] Seq=5917 Ack=108453 Win=6155 Len=0 TSval=8061355 TSecr=14992853
  212 1.497711851  10.6.15.156 → 192.168.1.12 SSH 1514 Server: Encrypted packet (len=1448)
  213 1.497910452  10.6.15.156 → 192.168.1.12 SSH 1514 Server: Encrypted packet (len=1448)
  214 1.497915475 192.168.1.12 → 10.6.15.156  TCP 66 54766 → 22 [ACK] Seq=5917 Ack=111349 Win=6155 Len=0 TSval=8061355 TSecr=14992853
  215 1.498083804  10.6.15.156 → 192.168.1.12 SSH 1514 Server: Encrypted packet (len=1448)
  216 1.500515701  10.6.15.156 → 192.168.1.12 SSH 1514 Server: Encrypted packet (len=1448)
  217 1.500522029 192.168.1.12 → 10.6.15.156  TCP 66 54766 → 22 [ACK] Seq=5917 Ack=114245 Win=6155 Len=0 TSval=8061356 TSecr=14992853
  218 1.500686997  10.6.15.156 → 192.168.1.12 SSH 1514 Server: Encrypted packet (len=1448)
  219 1.500860829  10.6.15.156 → 192.168.1.12 SSH 1514 Server: Encrypted packet (len=1448)
  220 1.500864166 192.168.1.12 → 10.6.15.156  TCP 66 54766 → 22 [ACK] Seq=5917 Ack=117141 Win=6155 Len=0 TSval=8061356 TSecr=14992855
  221 1.501035643  10.6.15.156 → 192.168.1.12 SSH 1514 Server: Encrypted packet (len=1448)
  222 1.501178656  10.6.15.156 → 192.168.1.12 SSH 1514 Server: Encrypted packet (len=1448)
  223 1.501185648 192.168.1.12 → 10.6.15.156  TCP 66 54766 → 22 [ACK] Seq=5917 Ack=120037 Win=6155 Len=0 TSval=8061356 TSecr=14992855
  224 1.501350767  10.6.15.156 → 192.168.1.12 SSH 1514 Server: Encrypted packet (len=1448)
  225 1.501680722  10.6.15.156 → 192.168.1.12 SSH 1514 Server: Encrypted packet (len=1448)
  226 1.501690963 192.168.1.12 → 10.6.15.156  TCP 66 54766 → 22 [ACK] Seq=5917 Ack=122933 Win=6155 Len=0 TSval=8061356 TSecr=14992855
  227 1.501852722  10.6.15.156 → 192.168.1.12 SSH 1514 Server: Encrypted packet (len=1448)
  228 1.504385310  10.6.15.156 → 192.168.1.12 SSH 1514 Server: Encrypted packet (len=1448)
  229 1.504403705 192.168.1.12 → 10.6.15.156  TCP 66 54766 → 22 [ACK] Seq=5917 Ack=125829 Win=6155 Len=0 TSval=8061357 TSecr=14992855
  230 1.504533439  10.6.15.156 → 192.168.1.12 SSH 1514 Server: Encrypted packet (len=1448)
  231 1.504715763  10.6.15.156 → 192.168.1.12 SSH 1514 Server: Encrypted packet (len=1448)
  232 1.504723394 192.168.1.12 → 10.6.15.156  TCP 66 54766 → 22 [ACK] Seq=5917 Ack=128725 Win=6155 Len=0 TSval=8061357 TSecr=14992856
  233 1.504733670  10.6.15.156 → 192.168.1.12 SSH 302 Server: Encrypted packet (len=236)
  234 1.504892260 192.168.1.12 → 10.6.15.156  SSH 102 Client: Encrypted packet (len=36)
  235 1.544276145  10.6.15.156 → 192.168.1.12 TCP 66 22 → 54766 [ACK] Seq=128961 Ack=5953 Win=1452 Len=0 TSval=14992866 TSecr=8061357
  236 1.544294040 192.168.1.12 → 10.6.15.156  SSH 150 Client: Encrypted packet (len=84)
  237 1.573330215  10.6.15.156 → 192.168.1.12 SSH 1038 Server: Encrypted packet (len=972)
  238 1.573350609  10.6.15.156 → 192.168.1.12 SSH 398 Server: Encrypted packet (len=332)
  239 1.573413629 192.168.1.12 → 10.6.15.156  TCP 66 54766 → 22 [ACK] Seq=6037 Ack=130265 Win=6155 Len=0 TSval=8061374 TSecr=14992873
  240 1.574717404 192.168.1.12 → 10.6.15.156  SSH 142 Client: Encrypted packet (len=76)
  241 1.582227087  10.6.15.156 → 192.168.1.12 SSH 406 Server: Encrypted packet (len=340)
  242 1.596248727  10.6.15.156 → 192.168.1.12 TCP 406 [TCP Retransmission] 22 → 54766 [PSH, ACK] Seq=130265 Ack=5953 Win=1452 Len=340 TSval=14992879 TSecr=8061357
  243 1.596269213 192.168.1.12 → 10.6.15.156  TCP 78 54766 → 22 [ACK] Seq=6113 Ack=130605 Win=6155 Len=0 TSval=8061380 TSecr=14992879 SLE=130265 SRE=130605
  244 1.603749799  10.6.15.156 → 192.168.1.12 TCP 78 [TCP Dup ACK 235#1] 22 → 54766 [ACK] Seq=130605 Ack=5953 Win=1452 Len=0 TSval=14992880 TSecr=8061357 SLE=6037 SRE=6113
  245 1.615691895 192.168.1.12 → 10.6.15.156  TCP 150 [TCP Retransmission] 54766 → 22 [PSH, ACK] Seq=5953 Ack=130605 Win=6155 Len=84 TSval=8061385 TSecr=14992880
  246 1.617319030  10.6.15.156 → 192.168.1.12 TCP 66 22 → 54766 [ACK] Seq=130605 Ack=6113 Win=1452 Len=0 TSval=14992884 TSecr=8061385
  247 1.624629865  10.6.15.156 → 192.168.1.12 SSH 326 Server: Encrypted packet (len=260)
  248 1.624654542  10.6.15.156 → 192.168.1.12 SSH 102 Server: Encrypted packet (len=36)
  249 1.624718236 192.168.1.12 → 10.6.15.156  TCP 66 54766 → 22 [ACK] Seq=6113 Ack=130901 Win=6155 Len=0 TSval=8061387 TSecr=14992886
  250 1.626186784 192.168.1.12 → 10.6.15.156  SSH 138 Client: Encrypted packet (len=72)
  251 1.628080785  10.6.15.156 → 192.168.1.12 SSH 102 Server: Encrypted packet (len=36)
  252 1.635227498  10.6.15.156 → 192.168.1.12 SSH 206 Server: Encrypted packet (len=140)
  253 1.635249220  10.6.15.156 → 192.168.1.12 SSH 102 Server: Encrypted packet (len=36)
  254 1.635320793 192.168.1.12 → 10.6.15.156  TCP 66 54766 → 22 [ACK] Seq=6185 Ack=131113 Win=6155 Len=0 TSval=8061389 TSecr=14992887
  255 1.636642164 192.168.1.12 → 10.6.15.156  SSH 138 Client: Encrypted packet (len=72)
  256 1.638958754  10.6.15.156 → 192.168.1.12 SSH 102 Server: Encrypted packet (len=36)
  257 1.646702802  10.6.15.156 → 192.168.1.12 SSH 158 Server: Encrypted packet (len=92)
  258 1.646806175 192.168.1.12 → 10.6.15.156  TCP 66 54766 → 22 [ACK] Seq=6257 Ack=131241 Win=6155 Len=0 TSval=8061392 TSecr=14992890
  259 1.648543260  10.6.15.156 → 192.168.1.12 SSH 1514 Server: Encrypted packet (len=1448)
  260 1.648647323  10.6.15.156 → 192.168.1.12 SSH 1142 Server: Encrypted packet (len=1076)
  261 1.648655797 192.168.1.12 → 10.6.15.156  TCP 66 54766 → 22 [ACK] Seq=6257 Ack=133765 Win=6155 Len=0 TSval=8061393 TSecr=14992892
  262 1.650234623  10.6.15.156 → 192.168.1.12 SSH 1514 Server: Encrypted packet (len=1448)
  263 1.650392720  10.6.15.156 → 192.168.1.12 SSH 1514 Server: Encrypted packet (len=1448)
  264 1.650404219 192.168.1.12 → 10.6.15.156  TCP 66 54766 → 22 [ACK] Seq=6257 Ack=136661 Win=6155 Len=0 TSval=8061393 TSecr=14992892
  265 1.652681030  10.6.15.156 → 192.168.1.12 SSH 1514 Server: Encrypted packet (len=1448)
  266 1.652846502  10.6.15.156 → 192.168.1.12 SSH 1514 Server: Encrypted packet (len=1448)
  267 1.652854320 192.168.1.12 → 10.6.15.156  TCP 66 54766 → 22 [ACK] Seq=6257 Ack=139557 Win=6155 Len=0 TSval=8061394 TSecr=14992893
  268 1.653015009  10.6.15.156 → 192.168.1.12 SSH 1514 Server: Encrypted packet (len=1448)
  269 1.653192134  10.6.15.156 → 192.168.1.12 SSH 1514 Server: Encrypted packet (len=1448)
  270 1.653195530 192.168.1.12 → 10.6.15.156  TCP 66 54766 → 22 [ACK] Seq=6257 Ack=142453 Win=6155 Len=0 TSval=8061394 TSecr=14992893
  271 1.653349647  10.6.15.156 → 192.168.1.12 SSH 1398 Server: Encrypted packet (len=1332)
  272 1.653530683 192.168.1.12 → 10.6.15.156  SSH 102 Client: Encrypted packet (len=36)
  273 1.656494128  10.6.15.156 → 192.168.1.12 SSH 1514 Server: Encrypted packet (len=1448)
  274 1.656594290  10.6.15.156 → 192.168.1.12 SSH 1514 Server: Encrypted packet (len=1448)
  275 1.656603333 192.168.1.12 → 10.6.15.156  TCP 66 54766 → 22 [ACK] Seq=6293 Ack=146681 Win=6155 Len=0 TSval=8061395 TSecr=14992894
  276 1.656807414  10.6.15.156 → 192.168.1.12 SSH 1514 Server: Encrypted packet (len=1448)
  277 1.656942255  10.6.15.156 → 192.168.1.12 SSH 1514 Server: Encrypted packet (len=1448)
  278 1.656952342 192.168.1.12 → 10.6.15.156  TCP 66 54766 → 22 [ACK] Seq=6293 Ack=149577 Win=6155 Len=0 TSval=8061395 TSecr=14992894
  279 1.657142870  10.6.15.156 → 192.168.1.12 SSH 1514 Server: Encrypted packet (len=1448)
  280 1.657313917  10.6.15.156 → 192.168.1.12 SSH 1514 Server: Encrypted packet (len=1448)
  281 1.657317284 192.168.1.12 → 10.6.15.156  TCP 66 54766 → 22 [ACK] Seq=6293 Ack=152473 Win=6155 Len=0 TSval=8061395 TSecr=14992894
  282 1.657639117  10.6.15.156 → 192.168.1.12 SSH 1514 Server: Encrypted packet (len=1448)
  283 1.657814426  10.6.15.156 → 192.168.1.12 SSH 1514 Server: Encrypted packet (len=1448)
  284 1.657820076 192.168.1.12 → 10.6.15.156  TCP 66 54766 → 22 [ACK] Seq=6293 Ack=155369 Win=6155 Len=0 TSval=8061395 TSecr=14992894
  285 1.661582482  10.6.15.156 → 192.168.1.12 SSH 1514 Server: Encrypted packet (len=1448)
  286 1.661685755  10.6.15.156 → 192.168.1.12 SSH 1514 Server: Encrypted packet (len=1448)
  287 1.661694492 192.168.1.12 → 10.6.15.156  TCP 66 54766 → 22 [ACK] Seq=6293 Ack=158265 Win=6155 Len=0 TSval=8061396 TSecr=14992895
  288 1.662039147  10.6.15.156 → 192.168.1.12 SSH 1514 Server: Encrypted packet (len=1448)
  289 1.662218952  10.6.15.156 → 192.168.1.12 SSH 1514 Server: Encrypted packet (len=1448)
  290 1.662232765 192.168.1.12 → 10.6.15.156  TCP 66 54766 → 22 [ACK] Seq=6293 Ack=161161 Win=6155 Len=0 TSval=8061396 TSecr=14992895
  291 1.662355704  10.6.15.156 → 192.168.1.12 SSH 1514 Server: Encrypted packet (len=1448)
  292 1.662684899  10.6.15.156 → 192.168.1.12 SSH 1514 Server: Encrypted packet (len=1448)
  293 1.662692439 192.168.1.12 → 10.6.15.156  TCP 66 54766 → 22 [ACK] Seq=6293 Ack=164057 Win=6155 Len=0 TSval=8061396 TSecr=14992895
  294 1.662856897  10.6.15.156 → 192.168.1.12 SSH 1514 Server: Encrypted packet (len=1448)
  295 1.663028740  10.6.15.156 → 192.168.1.12 SSH 1514 Server: Encrypted packet (len=1448)
  296 1.663037709 192.168.1.12 → 10.6.15.156  TCP 66 54766 → 22 [ACK] Seq=6293 Ack=166953 Win=6155 Len=0 TSval=8061396 TSecr=14992895
  297 1.665723658  10.6.15.156 → 192.168.1.12 SSH 1514 Server: Encrypted packet (len=1448)
  298 1.665885484  10.6.15.156 → 192.168.1.12 SSH 1514 Server: Encrypted packet (len=1448)
  299 1.665897045 192.168.1.12 → 10.6.15.156  TCP 66 54766 → 22 [ACK] Seq=6293 Ack=169849 Win=6155 Len=0 TSval=8061397 TSecr=14992896
  300 1.666055656  10.6.15.156 → 192.168.1.12 SSH 1514 Server: Encrypted packet (len=1448)
  301 1.666229722  10.6.15.156 → 192.168.1.12 SSH 1514 Server: Encrypted packet (len=1448)
  302 1.666236992 192.168.1.12 → 10.6.15.156  TCP 66 54766 → 22 [ACK] Seq=6293 Ack=172745 Win=6155 Len=0 TSval=8061397 TSecr=14992896
  303 1.666401046  10.6.15.156 → 192.168.1.12 SSH 1514 Server: Encrypted packet (len=1448)
  304 1.666574015  10.6.15.156 → 192.168.1.12 SSH 1514 Server: Encrypted packet (len=1448)
  305 1.666579032 192.168.1.12 → 10.6.15.156  TCP 66 54766 → 22 [ACK] Seq=6293 Ack=175641 Win=6155 Len=0 TSval=8061397 TSecr=14992896
  306 1.666746991  10.6.15.156 → 192.168.1.12 SSH 1514 Server: Encrypted packet (len=1448)
  307 1.667071283  10.6.15.156 → 192.168.1.12 SSH 1514 Server: Encrypted packet (len=1448)
  308 1.667078394 192.168.1.12 → 10.6.15.156  TCP 66 54766 → 22 [ACK] Seq=6293 Ack=178537 Win=6155 Len=0 TSval=8061397 TSecr=14992896
  309 1.668999395  10.6.15.156 → 192.168.1.12 SSH 1514 Server: Encrypted packet (len=1448)
  310 1.669141691  10.6.15.156 → 192.168.1.12 SSH 1514 Server: Encrypted packet (len=1448)
  311 1.669146492 192.168.1.12 → 10.6.15.156  TCP 66 54766 → 22 [ACK] Seq=6293 Ack=181433 Win=6155 Len=0 TSval=8061398 TSecr=14992897
  312 1.669497191  10.6.15.156 → 192.168.1.12 SSH 1514 Server: Encrypted packet (len=1448)
  313 1.669662303  10.6.15.156 → 192.168.1.12 SSH 1514 Server: Encrypted packet (len=1448)
  314 1.669666821 192.168.1.12 → 10.6.15.156  TCP 66 54766 → 22 [ACK] Seq=6293 Ack=184329 Win=6155 Len=0 TSval=8061398 TSecr=14992897
  315 1.669842184  10.6.15.156 → 192.168.1.12 SSH 1514 Server: Encrypted packet (len=1448)
  316 1.670164593  10.6.15.156 → 192.168.1.12 SSH 1514 Server: Encrypted packet (len=1448)
  317 1.670175723 192.168.1.12 → 10.6.15.156  TCP 66 54766 → 22 [ACK] Seq=6293 Ack=187225 Win=6155 Len=0 TSval=8061398 TSecr=14992897
  318 1.670338339  10.6.15.156 → 192.168.1.12 SSH 1514 Server: Encrypted packet (len=1448)
  319 1.670505936  10.6.15.156 → 192.168.1.12 SSH 1514 Server: Encrypted packet (len=1448)
  320 1.670508821 192.168.1.12 → 10.6.15.156  TCP 66 54766 → 22 [ACK] Seq=6293 Ack=190121 Win=6155 Len=0 TSval=8061398 TSecr=14992897
  321 1.673101270  10.6.15.156 → 192.168.1.12 SSH 1514 Server: Encrypted packet (len=1448)
  322 1.673221527  10.6.15.156 → 192.168.1.12 SSH 1514 Server: Encrypted packet (len=1448)
  323 1.673233109 192.168.1.12 → 10.6.15.156  TCP 66 54766 → 22 [ACK] Seq=6293 Ack=193017 Win=6155 Len=0 TSval=8061399 TSecr=14992898
  324 1.673385518  10.6.15.156 → 192.168.1.12 SSH 1514 Server: Encrypted packet (len=1448)
  325 1.673451026 192.168.1.12 → 10.6.15.156  SSH 102 Client: Encrypted packet (len=36)
  326 1.673548340  10.6.15.156 → 192.168.1.12 SSH 1514 Server: Encrypted packet (len=1448)
  327 1.673725240  10.6.15.156 → 192.168.1.12 SSH 1514 Server: Encrypted packet (len=1448)
  328 1.673732562 192.168.1.12 → 10.6.15.156  TCP 66 54766 → 22 [ACK] Seq=6329 Ack=197361 Win=6155 Len=0 TSval=8061399 TSecr=14992898
  329 1.673919750  10.6.15.156 → 192.168.1.12 SSH 1514 Server: Encrypted packet (len=1448)
  330 1.674218288  10.6.15.156 → 192.168.1.12 SSH 1514 Server: Encrypted packet (len=1448)
  331 1.674222045 192.168.1.12 → 10.6.15.156  TCP 66 54766 → 22 [ACK] Seq=6329 Ack=200257 Win=6155 Len=0 TSval=8061399 TSecr=14992898
  332 1.674390857  10.6.15.156 → 192.168.1.12 SSH 1514 Server: Encrypted packet (len=1448)
  333 1.676814441  10.6.15.156 → 192.168.1.12 SSH 1514 Server: Encrypted packet (len=1448)
  334 1.676826448 192.168.1.12 → 10.6.15.156  TCP 66 54766 → 22 [ACK] Seq=6329 Ack=203153 Win=6155 Len=0 TSval=8061400 TSecr=14992898
  335 1.676980486  10.6.15.156 → 192.168.1.12 SSH 1514 Server: Encrypted packet (len=1448)
  336 1.677154917  10.6.15.156 → 192.168.1.12 SSH 1514 Server: Encrypted packet (len=1448)
  337 1.677164025 192.168.1.12 → 10.6.15.156  TCP 66 54766 → 22 [ACK] Seq=6329 Ack=206049 Win=6155 Len=0 TSval=8061400 TSecr=14992899
  338 1.677326574  10.6.15.156 → 192.168.1.12 SSH 1514 Server: Encrypted packet (len=1448)
  339 1.677501759  10.6.15.156 → 192.168.1.12 SSH 1514 Server: Encrypted packet (len=1448)
  340 1.677508570 192.168.1.12 → 10.6.15.156  TCP 66 54766 → 22 [ACK] Seq=6329 Ack=208945 Win=6155 Len=0 TSval=8061400 TSecr=14992899
  341 1.677671167  10.6.15.156 → 192.168.1.12 SSH 1514 Server: Encrypted packet (len=1448)
  342 1.677998549  10.6.15.156 → 192.168.1.12 SSH 1514 Server: Encrypted packet (len=1448)
  343 1.678006092 192.168.1.12 → 10.6.15.156  TCP 66 54766 → 22 [ACK] Seq=6329 Ack=211841 Win=6155 Len=0 TSval=8061400 TSecr=14992899
  344 1.680469932  10.6.15.156 → 192.168.1.12 SSH 1514 Server: Encrypted packet (len=1448)
  345 1.680635190  10.6.15.156 → 192.168.1.12 SSH 1514 Server: Encrypted packet (len=1448)
  346 1.680651337 192.168.1.12 → 10.6.15.156  TCP 66 54766 → 22 [ACK] Seq=6329 Ack=214737 Win=6155 Len=0 TSval=8061401 TSecr=14992900
  347 1.680805773  10.6.15.156 → 192.168.1.12 SSH 1514 Server: Encrypted packet (len=1448)
  348 1.680978550  10.6.15.156 → 192.168.1.12 SSH 1514 Server: Encrypted packet (len=1448)
  349 1.680991851 192.168.1.12 → 10.6.15.156  TCP 66 54766 → 22 [ACK] Seq=6329 Ack=217633 Win=6155 Len=0 TSval=8061401 TSecr=14992900
  350 1.681147459  10.6.15.156 → 192.168.1.12 SSH 1514 Server: Encrypted packet (len=1448)
  351 1.681322344  10.6.15.156 → 192.168.1.12 SSH 1514 Server: Encrypted packet (len=1448)
  352 1.681331036 192.168.1.12 → 10.6.15.156  TCP 66 54766 → 22 [ACK] Seq=6329 Ack=220529 Win=6155 Len=0 TSval=8061401 TSecr=14992900
  353 1.681646568  10.6.15.156 → 192.168.1.12 SSH 1514 Server: Encrypted packet (len=1448)
  354 1.681817194  10.6.15.156 → 192.168.1.12 SSH 1514 Server: Encrypted packet (len=1448)
  355 1.681824462 192.168.1.12 → 10.6.15.156  TCP 66 54766 → 22 [ACK] Seq=6329 Ack=223425 Win=6155 Len=0 TSval=8061401 TSecr=14992900
  356 1.685093648  10.6.15.156 → 192.168.1.12 SSH 1514 Server: Encrypted packet (len=1448)
  357 1.685238390  10.6.15.156 → 192.168.1.12 SSH 1514 Server: Encrypted packet (len=1448)
  358 1.685246472 192.168.1.12 → 10.6.15.156  TCP 66 54766 → 22 [ACK] Seq=6329 Ack=226321 Win=6155 Len=0 TSval=8061402 TSecr=14992901
  359 1.685410768  10.6.15.156 → 192.168.1.12 SSH 1514 Server: Encrypted packet (len=1448)
  360 1.685584135  10.6.15.156 → 192.168.1.12 SSH 1514 Server: Encrypted packet (len=1448)
  361 1.685588043 192.168.1.12 → 10.6.15.156  TCP 66 54766 → 22 [ACK] Seq=6329 Ack=229217 Win=6155 Len=0 TSval=8061402 TSecr=14992901
  362 1.685748626  10.6.15.156 → 192.168.1.12 SSH 1514 Server: Encrypted packet (len=1448)
  363 1.685922498  10.6.15.156 → 192.168.1.12 SSH 1514 Server: Encrypted packet (len=1448)
  364 1.685928967 192.168.1.12 → 10.6.15.156  TCP 66 54766 → 22 [ACK] Seq=6329 Ack=232113 Win=6155 Len=0 TSval=8061402 TSecr=14992901
  365 1.686103620  10.6.15.156 → 192.168.1.12 SSH 1514 Server: Encrypted packet (len=1448)
  366 1.686275453  10.6.15.156 → 192.168.1.12 SSH 1514 Server: Encrypted packet (len=1448)
  367 1.686278981 192.168.1.12 → 10.6.15.156  TCP 66 54766 → 22 [ACK] Seq=6329 Ack=235009 Win=6155 Len=0 TSval=8061402 TSecr=14992901
  368 1.688804118  10.6.15.156 → 192.168.1.12 SSH 1514 Server: Encrypted packet (len=1448)
  369 1.688956156  10.6.15.156 → 192.168.1.12 SSH 1514 Server: Encrypted packet (len=1448)
  370 1.688960428 192.168.1.12 → 10.6.15.156  TCP 66 54766 → 22 [ACK] Seq=6329 Ack=237905 Win=6155 Len=0 TSval=8061403 TSecr=14992902
  371 1.689121640  10.6.15.156 → 192.168.1.12 SSH 1514 Server: Encrypted packet (len=1448)
  372 1.689293873  10.6.15.156 → 192.168.1.12 SSH 1514 Server: Encrypted packet (len=1448)
  373 1.689300541 192.168.1.12 → 10.6.15.156  TCP 66 54766 → 22 [ACK] Seq=6329 Ack=240801 Win=6155 Len=0 TSval=8061403 TSecr=14992902
  374 1.689466813  10.6.15.156 → 192.168.1.12 SSH 1514 Server: Encrypted packet (len=1448)
  375 1.689791236  10.6.15.156 → 192.168.1.12 SSH 1514 Server: Encrypted packet (len=1448)
  376 1.689797858 192.168.1.12 → 10.6.15.156  TCP 66 54766 → 22 [ACK] Seq=6329 Ack=243697 Win=6155 Len=0 TSval=8061403 TSecr=14992902
  377 1.689967039  10.6.15.156 → 192.168.1.12 SSH 1514 Server: Encrypted packet (len=1448)
  378 1.690139146  10.6.15.156 → 192.168.1.12 SSH 1514 Server: Encrypted packet (len=1448)
