    1 0.000000000 192.168.1.16 → 10.6.15.144  SSH 166 Client: Encrypted packet (len=100)
    2 0.219485910 192.168.1.16 → 10.6.15.144  TCP 166 [TCP Retransmission] 59298 → 22 [PSH, ACK] Seq=1 Ack=1 Win=6155 Len=100 TSval=5971666 TSecr=6567844
    3 0.439485602 192.168.1.16 → 10.6.15.144  TCP 166 [TCP Retransmission] 59298 → 22 [PSH, ACK] Seq=1 Ack=1 Win=6155 Len=100 TSval=5971721 TSecr=6567844
    4 0.502856683  10.6.15.144 → 192.168.1.16 TCP 66 22 → 59298 [ACK] Seq=1 Ack=101 Win=1451 Len=0 TSval=6568114 TSecr=5971721
    5 1.365438825  10.6.15.144 → 192.168.1.16 SSH 142 Server: Encrypted packet (len=76)
    6 1.365461115 192.168.1.16 → 10.6.15.144  TCP 66 59298 → 22 [ACK] Seq=101 Ack=77 Win=6155 Len=0 TSval=5971952 TSecr=6568196
    7 1.365472173  10.6.15.144 → 192.168.1.16 SSH 102 Server: Encrypted packet (len=36)
    8 1.365475919 192.168.1.16 → 10.6.15.144  TCP 66 59298 → 22 [ACK] Seq=101 Ack=113 Win=6155 Len=0 TSval=5971952 TSecr=6568273
    9 1.365480009  10.6.15.144 → 192.168.1.16 SSH 102 Server: Encrypted packet (len=36)
   10 1.365481410 192.168.1.16 → 10.6.15.144  TCP 66 59298 → 22 [ACK] Seq=101 Ack=149 Win=6155 Len=0 TSval=5971952 TSecr=6568274
   11 1.365905461 192.168.1.16 → 10.6.15.144  SSH 534 Client: Encrypted packet (len=468)
   12 1.376004855  10.6.15.144 → 192.168.1.16 TCP 66 22 → 59298 [ACK] Seq=149 Ack=569 Win=1452 Len=0 TSval=6568332 TSecr=5971952
   13 2.389744885  10.6.15.144 → 192.168.1.16 SSH 150 Server: Encrypted packet (len=84)
   14 2.389768336  10.6.15.144 → 192.168.1.16 SSH 102 Server: Encrypted packet (len=36)
   15 2.389774770  10.6.15.144 → 192.168.1.16 TCP 102 [TCP Retransmission] 22 → 59298 [PSH, ACK] Seq=233 Ack=569 Win=1452 Len=36 TSval=6568577 TSecr=5971952
   16 2.389783190 192.168.1.16 → 10.6.15.144  TCP 78 59298 → 22 [ACK] Seq=569 Ack=269 Win=6155 Len=0 TSval=5972208 TSecr=6568462 SLE=233 SRE=269
   17 2.391561548 192.168.1.16 → 10.6.15.144  SSH 110 Client: Encrypted packet (len=44)
   18 2.391783887 192.168.1.16 → 10.6.15.144  SSH 102 Client: Encrypted packet (len=36)
   19 2.404448066  10.6.15.144 → 192.168.1.16 TCP 66 22 → 59298 [ACK] Seq=269 Ack=613 Win=1452 Len=0 TSval=6568588 TSecr=5972209
   20 2.404467773 192.168.1.16 → 10.6.15.144  SSH 138 Client: Encrypted packet (len=72)
   21 2.404481752  10.6.15.144 → 192.168.1.16 TCP 66 22 → 59298 [ACK] Seq=269 Ack=649 Win=1452 Len=0 TSval=6568588 TSecr=5972209
   22 2.414441712  10.6.15.144 → 192.168.1.16 TCP 66 22 → 59298 [ACK] Seq=269 Ack=721 Win=1452 Len=0 TSval=6568592 TSecr=5972212
   23 3.453351841  10.6.15.144 → 192.168.1.16 SSH 222 Server: Encrypted packet (len=156)
   24 3.453369214  10.6.15.144 → 192.168.1.16 SSH 138 Server: Encrypted packet (len=72)
   25 3.453422230 192.168.1.16 → 10.6.15.144  TCP 66 59298 → 22 [ACK] Seq=721 Ack=497 Win=6155 Len=0 TSval=5972474 TSecr=6568852
   26 4.373335684  10.6.15.144 → 192.168.1.16 SSH 102 Server: Encrypted packet (len=36)
   27 4.373701465 192.168.1.16 → 10.6.15.144  SSH 118 Client: Encrypted packet (len=52)
   28 4.383446263  10.6.15.144 → 192.168.1.16 TCP 66 22 → 59298 [ACK] Seq=533 Ack=773 Win=1452 Len=0 TSval=6569084 TSecr=5972704
   29 5.065489812 192.168.1.16 → 91.189.89.199 NTP 90 NTP Version 4, client
   30 5.067988310  10.6.15.144 → 192.168.1.16 SSH 1514 Server: Encrypted packet (len=1448)
   31 5.068173543  10.6.15.144 → 192.168.1.16 SSH 1514 Server: Encrypted packet (len=1448)
   32 5.068181401 192.168.1.16 → 10.6.15.144  TCP 66 59298 → 22 [ACK] Seq=773 Ack=3429 Win=6155 Len=0 TSval=5972878 TSecr=6569220
   33 5.076234187  10.6.15.144 → 192.168.1.16 SSH 902 Server: Encrypted packet (len=836)
   34 5.080894438 192.168.1.16 → 10.6.15.144  SSH 138 Client: Encrypted packet (len=72)
   35 5.089880630  10.6.15.144 → 192.168.1.16 TCP 66 22 → 59298 [ACK] Seq=4265 Ack=845 Win=1452 Len=0 TSval=6569261 TSecr=5972881
   36 5.090291076  10.6.15.144 → 192.168.1.16 SSH 102 Server: Encrypted packet (len=36)
   37 5.095364946 192.168.1.16 → 10.6.15.144  SSH 118 Client: Encrypted packet (len=52)
   38 5.095645568 192.168.1.16 → 10.6.15.144  SSH 102 Client: Encrypted packet (len=36)
   39 5.105079293  10.6.15.144 → 192.168.1.16 TCP 66 22 → 59298 [ACK] Seq=4301 Ack=933 Win=1452 Len=0 TSval=6569264 TSecr=5972884
   40 5.523483150 192.168.1.16 → 54.76.71.168 TCP 66 42414 → 8282 [ACK] Seq=1 Ack=1 Win=296 Len=0 TSval=5972992 TSecr=610073528
   41 6.530327157 192.168.1.16 → 10.6.15.144  SSH 1514 Client: Encrypted packet (len=1448)
   42 6.531648397 192.168.1.16 → 10.6.15.144  SSH 326 Client: Encrypted packet (len=260)
   43 6.532441741  10.22.18.24 → 224.0.0.252  LLMNR 64 Standard query 0x8357 A wpad
   44 6.532567415 54.76.71.168 → 192.168.1.16 TCP 66 [TCP ACKed unseen segment] 8282 → 42414 [ACK] Seq=1 Ack=2 Win=121 Len=0 TSval=610084967 TSecr=5961552
   45 6.532701606  10.22.18.24 → 224.0.0.252  LLMNR 64 Standard query 0x8357 A wpad
   46 6.567485364 192.168.1.16 → 10.6.15.144  TCP 326 [TCP Retransmission] 59298 → 22 [PSH, ACK] Seq=2381 Ack=4301 Win=6155 Len=260 TSval=5973253 TSecr=6569264
   47 6.576157860  10.6.15.144 → 192.168.1.16 TCP 78 22 → 59298 [ACK] Seq=4301 Ack=2641 Win=1447 Len=0 TSval=6569632 TSecr=5973243 SLE=2381 SRE=2641
   48 8.373474441  10.6.15.144 → 192.168.1.16 SSH 134 Server: Encrypted packet (len=68)
   49 8.373982961  10.6.15.144 → 192.168.1.16 SSH 974 Server: Encrypted packet (len=908)
   50 8.374059123 192.168.1.16 → 10.6.15.144  TCP 66 59298 → 22 [ACK] Seq=2641 Ack=5277 Win=6155 Len=0 TSval=5973704 TSecr=6569963
   51 8.374407525  10.6.15.144 → 192.168.1.16 SSH 654 Server: Encrypted packet (len=588)
   52 8.374836151 192.168.1.16 → 10.6.15.144  SSH 134 Client: Encrypted packet (len=68)
   53 8.383140454  10.6.15.144 → 192.168.1.16 SSH 330 Server: Encrypted packet (len=264)
   54 8.383545794 192.168.1.16 → 10.6.15.144  SSH 206 Client: Encrypted packet (len=140)
   55 8.383769073 192.168.1.16 → 10.6.15.144  SSH 142 Client: Encrypted packet (len=76)
   56 8.383865430  10.6.15.144 → 192.168.1.16 TCP 66 22 → 59298 [ACK] Seq=6129 Ack=2709 Win=1452 Len=0 TSval=6570084 TSecr=5973704
   57 8.393903051  10.6.15.144 → 192.168.1.16 TCP 66 22 → 59298 [ACK] Seq=6129 Ack=2849 Win=1452 Len=0 TSval=6570086 TSecr=5973707
   58 8.394297568  10.6.15.144 → 192.168.1.16 TCP 66 22 → 59298 [ACK] Seq=6129 Ack=2925 Win=1452 Len=0 TSval=6570086 TSecr=5973707
   59 9.368203372  10.6.15.144 → 192.168.1.16 SSH 1514 Server: Encrypted packet (len=1448)
   60 9.368652410  10.6.15.144 → 192.168.1.16 SSH 406 Server: Encrypted packet (len=340)
   61 9.368670712 192.168.1.16 → 10.6.15.144  TCP 66 59298 → 22 [ACK] Seq=2925 Ack=7917 Win=6155 Len=0 TSval=5973953 TSecr=6570129
   62 9.369168885  10.6.15.144 → 192.168.1.16 SSH 1514 Server: Encrypted packet (len=1448)
   63 9.369716779  10.6.15.144 → 192.168.1.16 SSH 1514 Server: Encrypted packet (len=1448)
   64 9.369727426 192.168.1.16 → 10.6.15.144  TCP 66 59298 → 22 [ACK] Seq=2925 Ack=10813 Win=6155 Len=0 TSval=5973953 TSecr=6570135
   65 9.373489041 192.168.1.16 → 10.6.15.144  SSH 110 Client: Encrypted packet (len=44)
   66 9.378773203  10.6.15.144 → 192.168.1.16 SSH 1514 Server: Encrypted packet (len=1448)
   67 9.379501296  10.6.15.144 → 192.168.1.16 SSH 786 Server: Encrypted packet (len=720)
   68 9.379510264 192.168.1.16 → 10.6.15.144  TCP 66 59298 → 22 [ACK] Seq=2969 Ack=12981 Win=6155 Len=0 TSval=5973956 TSecr=6570333
   69 9.385211168  10.6.15.144 → 192.168.1.16 TCP 66 22 → 59298 [ACK] Seq=12981 Ack=2969 Win=1452 Len=0 TSval=6570334 TSecr=5973954
   70 9.386858281 192.168.1.16 → 10.6.15.144  SSH 118 Client: Encrypted packet (len=52)
   71 9.389585116 192.168.1.16 → 10.6.15.144  SSH 102 Client: Encrypted packet (len=36)
   72 9.396813344  10.6.15.144 → 192.168.1.16 TCP 66 22 → 59298 [ACK] Seq=12981 Ack=3021 Win=1452 Len=0 TSval=6570337 TSecr=5973957
   73 9.399483252  10.6.15.144 → 192.168.1.16 TCP 66 22 → 59298 [ACK] Seq=12981 Ack=3057 Win=1452 Len=0 TSval=6570338 TSecr=5973958
   74 9.412910974 192.168.1.16 → 10.6.15.144  SSH 102 Client: Encrypted packet (len=36)
   75 9.413093348 192.168.1.16 → 10.6.15.144  SSH 102 Client: Encrypted packet (len=36)
   76 9.420133590  10.6.15.144 → 192.168.1.16 TCP 66 22 → 59298 [ACK] Seq=12981 Ack=3093 Win=1452 Len=0 TSval=6570344 TSecr=5973964
   77 9.420155723  10.6.15.144 → 192.168.1.16 TCP 66 22 → 59298 [ACK] Seq=12981 Ack=3129 Win=1452 Len=0 TSval=6570344 TSecr=5973964
   78 9.436347923 192.168.1.16 → 10.6.15.144  SSH 126 Client: Encrypted packet (len=60)
   79 9.436634389 192.168.1.16 → 10.6.15.144  SSH 102 Client: Encrypted packet (len=36)
   80 9.443722496  10.6.15.144 → 192.168.1.16 TCP 66 22 → 59298 [ACK] Seq=12981 Ack=3189 Win=1452 Len=0 TSval=6570350 TSecr=5973970
   81 9.443741701  10.6.15.144 → 192.168.1.16 TCP 66 22 → 59298 [ACK] Seq=12981 Ack=3225 Win=1452 Len=0 TSval=6570350 TSecr=5973970
   82 9.444978636 192.168.1.16 → 10.6.15.144  SSH 102 Client: Encrypted packet (len=36)
   83 9.446210812 192.168.1.16 → 10.6.15.144  SSH 102 Client: Encrypted packet (len=36)
   84 9.471515812 192.168.1.16 → 10.6.15.144  TCP 102 [TCP Retransmission] 59298 → 22 [PSH, ACK] Seq=3261 Ack=12981 Win=6155 Len=36 TSval=5973979 TSecr=6570350
   85 9.478479134  10.6.15.144 → 192.168.1.16 TCP 78 22 → 59298 [ACK] Seq=12981 Ack=3297 Win=1452 Len=0 TSval=6570358 TSecr=5973972 SLE=3261 SRE=3297
   86 10.065460374 192.168.1.16 → 139.59.50.38 NTP 90 NTP Version 4, client
   87 14.465470963  10.6.15.144 → 192.168.1.16 SSH 1514 Server: Encrypted packet (len=1448)
   88 14.465600267  10.6.15.144 → 192.168.1.16 SSH 1514 Server: Encrypted packet (len=1448)
   89 14.465610068 192.168.1.16 → 10.6.15.144  TCP 66 59298 → 22 [ACK] Seq=3297 Ack=15877 Win=6155 Len=0 TSval=5975227 TSecr=6571605
   90 14.466168722 192.168.1.16 → 10.6.15.144  SSH 102 Client: Encrypted packet (len=36)
   91 14.466190038  10.6.15.144 → 192.168.1.16 SSH 1514 Server: Encrypted packet (len=1448)
   92 14.466630340 192.168.1.16 → 10.6.15.144  SSH 158 Client: Encrypted packet (len=92)
   93 14.466827265 192.168.1.16 → 10.6.15.144  SSH 202 Client: Encrypted packet (len=136)
   94 14.467737478 192.168.1.16 → 10.6.15.144  SSH 126 Client: Encrypted packet (len=60)
   95 14.474407008  10.6.15.144 → 192.168.1.16 SSH 1514 Server: Encrypted packet (len=1448)
   96 14.474582544  10.6.15.144 → 192.168.1.16 SSH 1514 Server: Encrypted packet (len=1448)
   97 14.474590581 192.168.1.16 → 10.6.15.144  TCP 66 59298 → 22 [ACK] Seq=3621 Ack=20221 Win=6155 Len=0 TSval=5975229 TSecr=6571607
   98 14.474922219  10.6.15.144 → 192.168.1.16 TCP 66 22 → 59298 [ACK] Seq=20221 Ack=3333 Win=1452 Len=0 TSval=6571607 TSecr=5975227
   99 14.475520820  10.6.15.144 → 192.168.1.16 SSH 1514 Server: Encrypted packet (len=1448)
  100 14.476559161  10.6.15.144 → 192.168.1.16 TCP 66 22 → 59298 [ACK] Seq=21669 Ack=3621 Win=1452 Len=0 TSval=6571607 TSecr=5975227
  101 14.486901658  10.6.15.144 → 192.168.1.16 SSH 1514 Server: Encrypted packet (len=1448)
  102 14.486918057 192.168.1.16 → 10.6.15.144  TCP 66 59298 → 22 [ACK] Seq=3621 Ack=23117 Win=6155 Len=0 TSval=5975232 TSecr=6571607
  103 14.487087903  10.6.15.144 → 192.168.1.16 SSH 1514 Server: Encrypted packet (len=1448)
  104 14.487279897  10.6.15.144 → 192.168.1.16 SSH 1514 Server: Encrypted packet (len=1448)
  105 14.487284775 192.168.1.16 → 10.6.15.144  TCP 66 59298 → 22 [ACK] Seq=3621 Ack=26013 Win=6155 Len=0 TSval=5975232 TSecr=6571609
  106 14.498126783  10.6.15.144 → 192.168.1.16 SSH 1514 Server: Encrypted packet (len=1448)
  107 14.498317775  10.6.15.144 → 192.168.1.16 SSH 1514 Server: Encrypted packet (len=1448)
  108 14.498327710 192.168.1.16 → 10.6.15.144  TCP 66 59298 → 22 [ACK] Seq=3621 Ack=28909 Win=6155 Len=0 TSval=5975235 TSecr=6571612
  109 14.498511126  10.6.15.144 → 192.168.1.16 SSH 1514 Server: Encrypted packet (len=1448)
  110 14.498840331 192.168.1.16 → 10.6.15.144  SSH 102 Client: Encrypted packet (len=36)
  111 14.499082573  10.6.15.144 → 192.168.1.16 SSH 1514 Server: Encrypted packet (len=1448)
  112 14.508866864  10.6.15.144 → 192.168.1.16 SSH 1514 Server: Encrypted packet (len=1448)
  113 14.508886155 192.168.1.16 → 10.6.15.144  TCP 66 59298 → 22 [ACK] Seq=3657 Ack=33253 Win=6155 Len=0 TSval=5975238 TSecr=6571612
  114 14.509434416  10.6.15.144 → 192.168.1.16 SSH 1514 Server: Encrypted packet (len=1448)
  115 14.509986289  10.6.15.144 → 192.168.1.16 SSH 1514 Server: Encrypted packet (len=1448)
  116 14.510006631 192.168.1.16 → 10.6.15.144  TCP 66 59298 → 22 [ACK] Seq=3657 Ack=36149 Win=6155 Len=0 TSval=5975238 TSecr=6571615
  117 14.510553745  10.6.15.144 → 192.168.1.16 SSH 1514 Server: Encrypted packet (len=1448)
  118 14.519590667  10.6.15.144 → 192.168.1.16 SSH 1514 Server: [TCP Previous segment not captured] , Encrypted packet (len=1448)
  119 14.519608991 192.168.1.16 → 10.6.15.144  TCP 78 59298 → 22 [ACK] Seq=3657 Ack=37597 Win=6155 Len=0 TSval=5975241 TSecr=6571615 SLE=39045 SRE=40493
  120 14.521434776  10.6.15.144 → 192.168.1.16 SSH 1514 Server: Encrypted packet (len=1448)
  121 14.521455280 192.168.1.16 → 10.6.15.144  TCP 78 [TCP Dup ACK 119#1] 59298 → 22 [ACK] Seq=3657 Ack=37597 Win=6155 Len=0 TSval=5975241 TSecr=6571615 SLE=39045 SRE=41941
  122 14.521596218  10.6.15.144 → 192.168.1.16 SSH 1514 Server: [TCP Previous segment not captured] , Encrypted packet (len=1448)
  123 14.521611823 192.168.1.16 → 10.6.15.144  TCP 86 [TCP Dup ACK 119#2] 59298 → 22 [ACK] Seq=3657 Ack=37597 Win=6155 Len=0 TSval=5975241 TSecr=6571615 SLE=43389 SRE=44837 SLE=39045 SRE=41941
  124 14.522253950  10.6.15.144 → 192.168.1.16 SSH 1514 Server: Encrypted packet (len=1448)
  125 14.522260491 192.168.1.16 → 10.6.15.144  TCP 86 [TCP Dup ACK 119#3] 59298 → 22 [ACK] Seq=3657 Ack=37597 Win=6155 Len=0 TSval=5975241 TSecr=6571615 SLE=43389 SRE=46285 SLE=39045 SRE=41941
  126 14.529894418  10.6.15.144 → 192.168.1.16 SSH 1514 Server: Encrypted packet (len=1448)
  127 14.529913953 192.168.1.16 → 10.6.15.144  TCP 86 [TCP Dup ACK 119#4] 59298 → 22 [ACK] Seq=3657 Ack=37597 Win=6155 Len=0 TSval=5975243 TSecr=6571615 SLE=43389 SRE=47733 SLE=39045 SRE=41941
  128 14.530082010  10.6.15.144 → 192.168.1.16 SSH 1514 Server: Encrypted packet (len=1448)
  129 14.530101894 192.168.1.16 → 10.6.15.144  TCP 86 [TCP Dup ACK 119#5] 59298 → 22 [ACK] Seq=3657 Ack=37597 Win=6155 Len=0 TSval=5975243 TSecr=6571615 SLE=43389 SRE=49181 SLE=39045 SRE=41941
  130 14.532101480  10.6.15.144 → 192.168.1.16 SSH 1514 Server: Encrypted packet (len=1448)
  131 14.532121668 192.168.1.16 → 10.6.15.144  TCP 86 [TCP Dup ACK 119#6] 59298 → 22 [ACK] Seq=3657 Ack=37597 Win=6155 Len=0 TSval=5975244 TSecr=6571615 SLE=43389 SRE=50629 SLE=39045 SRE=41941
  132 14.532259628  10.6.15.144 → 192.168.1.16 SSH 1514 Server: [TCP Fast Retransmission] , Encrypted packet (len=1448)
  133 14.532278987 192.168.1.16 → 10.6.15.144  TCP 78 59298 → 22 [ACK] Seq=3657 Ack=41941 Win=6155 Len=0 TSval=5975244 TSecr=6571621 SLE=43389 SRE=50629
  134 14.532829704  10.6.15.144 → 192.168.1.16 SSH 1514 Server: Encrypted packet (len=1448)
  135 14.532836738 192.168.1.16 → 10.6.15.144  TCP 78 [TCP Dup ACK 133#1] 59298 → 22 [ACK] Seq=3657 Ack=41941 Win=6155 Len=0 TSval=5975244 TSecr=6571621 SLE=43389 SRE=52077
  136 14.540470537  10.6.15.144 → 192.168.1.16 TCP 1514 [TCP Retransmission] 22 → 59298 [ACK] Seq=41941 Ack=3657 Win=1452 Len=1448 TSval=6571623 TSecr=5975243
  137 14.540503117 192.168.1.16 → 10.6.15.144  TCP 66 59298 → 22 [ACK] Seq=3657 Ack=52077 Win=6155 Len=0 TSval=5975246 TSecr=6571623
  138 14.542716992  10.6.15.144 → 192.168.1.16 SSH 1514 Server: Encrypted packet (len=1448)
  139 14.542726472 192.168.1.16 → 10.6.15.144  TCP 66 59298 → 22 [ACK] Seq=3657 Ack=53525 Win=6155 Len=0 TSval=5975246 TSecr=6571624
  140 14.545765838  10.6.15.144 → 192.168.1.16 SSH 1514 Server: Encrypted packet (len=1448)
  141 14.545784707 192.168.1.16 → 10.6.15.144  TCP 66 59298 → 22 [ACK] Seq=3657 Ack=54973 Win=6155 Len=0 TSval=5975247 TSecr=6571624
  142 14.545886587  10.6.15.144 → 192.168.1.16 SSH 1514 Server: Encrypted packet (len=1448)
  143 14.545890809 192.168.1.16 → 10.6.15.144  TCP 66 59298 → 22 [ACK] Seq=3657 Ack=56421 Win=6155 Len=0 TSval=5975247 TSecr=6571624
  144 14.550797822  10.6.15.144 → 192.168.1.16 SSH 1514 Server: Encrypted packet (len=1448)
  145 14.550811505 192.168.1.16 → 10.6.15.144  TCP 66 59298 → 22 [ACK] Seq=3657 Ack=57869 Win=6155 Len=0 TSval=5975248 TSecr=6571626
  146 14.554984409  10.6.15.144 → 192.168.1.16 SSH 1514 Server: Encrypted packet (len=1448)
  147 14.555008531 192.168.1.16 → 10.6.15.144  TCP 66 59298 → 22 [ACK] Seq=3657 Ack=59317 Win=6155 Len=0 TSval=5975249 TSecr=6571627
  148 14.555166194  10.6.15.144 → 192.168.1.16 SSH 1514 Server: Encrypted packet (len=1448)
  149 14.555173170 192.168.1.16 → 10.6.15.144  TCP 66 59298 → 22 [ACK] Seq=3657 Ack=60765 Win=6155 Len=0 TSval=5975249 TSecr=6571627
  150 14.556441778  10.6.15.144 → 192.168.1.16 SSH 1514 Server: Encrypted packet (len=1448)
  151 14.556459133 192.168.1.16 → 10.6.15.144  TCP 66 59298 → 22 [ACK] Seq=3657 Ack=62213 Win=6155 Len=0 TSval=5975250 TSecr=6571627
  152 14.556620763  10.6.15.144 → 192.168.1.16 SSH 1514 Server: Encrypted packet (len=1448)
  153 14.556627511 192.168.1.16 → 10.6.15.144  TCP 66 59298 → 22 [ACK] Seq=3657 Ack=63661 Win=6155 Len=0 TSval=5975250 TSecr=6571627
  154 14.561291685  10.6.15.144 → 192.168.1.16 SSH 1514 Server: Encrypted packet (len=1448)
  155 14.561313859 192.168.1.16 → 10.6.15.144  TCP 66 59298 → 22 [ACK] Seq=3657 Ack=65109 Win=6155 Len=0 TSval=5975251 TSecr=6571628
  156 14.561473916  10.6.15.144 → 192.168.1.16 SSH 1514 Server: Encrypted packet (len=1448)
  157 14.561485040 192.168.1.16 → 10.6.15.144  TCP 66 59298 → 22 [ACK] Seq=3657 Ack=66557 Win=6155 Len=0 TSval=5975251 TSecr=6571628
  158 14.565613252  10.6.15.144 → 192.168.1.16 SSH 1514 Server: Encrypted packet (len=1448)
  159 14.565632742 192.168.1.16 → 10.6.15.144  TCP 66 59298 → 22 [ACK] Seq=3657 Ack=68005 Win=6155 Len=0 TSval=5975252 TSecr=6571629
  160 14.565793813  10.6.15.144 → 192.168.1.16 SSH 1514 Server: Encrypted packet (len=1448)
  161 14.565799736 192.168.1.16 → 10.6.15.144  TCP 66 59298 → 22 [ACK] Seq=3657 Ack=69453 Win=6155 Len=0 TSval=5975252 TSecr=6571629
  162 14.566625997  10.6.15.144 → 192.168.1.16 SSH 1514 Server: Encrypted packet (len=1448)
  163 14.566634484 192.168.1.16 → 10.6.15.144  TCP 66 59298 → 22 [ACK] Seq=3657 Ack=70901 Win=6155 Len=0 TSval=5975252 TSecr=6571630
  164 14.567261958  10.6.15.144 → 192.168.1.16 SSH 1514 Server: Encrypted packet (len=1448)
  165 14.567268389 192.168.1.16 → 10.6.15.144  TCP 66 59298 → 22 [ACK] Seq=3657 Ack=72349 Win=6155 Len=0 TSval=5975252 TSecr=6571630
  166 14.570856490  10.6.15.144 → 192.168.1.16 SSH 1514 Server: Encrypted packet (len=1448)
  167 14.571022181  10.6.15.144 → 192.168.1.16 SSH 1374 Server: Encrypted packet (len=1308)
  168 14.571030248 192.168.1.16 → 10.6.15.144  TCP 66 59298 → 22 [ACK] Seq=3657 Ack=75105 Win=6155 Len=0 TSval=5975253 TSecr=6571631
  169 14.584306849 192.168.1.16 → 10.6.15.144  SSH 102 Client: Encrypted packet (len=36)
  170 14.585464921 192.168.1.16 → 10.6.15.144  SSH 118 Client: Encrypted packet (len=52)
  171 14.591446457  10.6.15.144 → 192.168.1.16 TCP 66 22 → 59298 [ACK] Seq=75105 Ack=3745 Win=1452 Len=0 TSval=6571637 TSecr=5975257
  172 19.398418616  10.6.15.144 → 192.168.1.16 SSH 1514 Server: Encrypted packet (len=1448)
  173 19.398540932  10.6.15.144 → 192.168.1.16 SSH 1514 Server: Encrypted packet (len=1448)
  174 19.398549582 192.168.1.16 → 10.6.15.144  TCP 66 59298 → 22 [ACK] Seq=3745 Ack=78001 Win=6155 Len=0 TSval=5976460 TSecr=6572838
  175 19.398748197  10.6.15.144 → 192.168.1.16 SSH 1514 Server: Encrypted packet (len=1448)
  176 19.398849300 192.168.1.16 → 10.6.15.144  SSH 222 Client: Encrypted packet (len=156)
  177 19.402459074  10.6.15.144 → 192.168.1.16 SSH 1514 Server: Encrypted packet (len=1448)
  178 19.402641929  10.6.15.144 → 192.168.1.16 SSH 1514 Server: Encrypted packet (len=1448)
  179 19.402651938 192.168.1.16 → 10.6.15.144  TCP 66 59298 → 22 [ACK] Seq=3901 Ack=82345 Win=6155 Len=0 TSval=5976461 TSecr=6572838
  180 19.402828895  10.6.15.144 → 192.168.1.16 SSH 1514 Server: Encrypted packet (len=1448)
  181 19.405303500  10.6.15.144 → 192.168.1.16 SSH 1514 Server: Encrypted packet (len=1448)
  182 19.405319997 192.168.1.16 → 10.6.15.144  TCP 66 59298 → 22 [ACK] Seq=3901 Ack=85241 Win=6155 Len=0 TSval=5976462 TSecr=6572838
  183 19.405485519  10.6.15.144 → 192.168.1.16 SSH 1514 Server: Encrypted packet (len=1448)
  184 19.409587931  10.6.15.144 → 192.168.1.16 SSH 1514 Server: Encrypted packet (len=1448)
  185 19.409608860 192.168.1.16 → 10.6.15.144  TCP 66 59298 → 22 [ACK] Seq=3901 Ack=88137 Win=6155 Len=0 TSval=5976463 TSecr=6572840
  186 19.410473037  10.6.15.144 → 192.168.1.16 SSH 1514 Server: Encrypted packet (len=1448)
  187 19.412726437  10.6.15.144 → 192.168.1.16 SSH 1514 Server: Encrypted packet (len=1448)
  188 19.412733104 192.168.1.16 → 10.6.15.144  TCP 66 59298 → 22 [ACK] Seq=3901 Ack=91033 Win=6155 Len=0 TSval=5976464 TSecr=6572841
  189 19.412891483  10.6.15.144 → 192.168.1.16 SSH 1514 Server: Encrypted packet (len=1448)
  190 19.413245048 192.168.1.16 → 10.6.15.144  SSH 102 Client: Encrypted packet (len=36)
  191 19.418265607  10.6.15.144 → 192.168.1.16 SSH 1514 Server: Encrypted packet (len=1448)
  192 19.418435600  10.6.15.144 → 192.168.1.16 SSH 1514 Server: Encrypted packet (len=1448)
  193 19.418443531 192.168.1.16 → 10.6.15.144  TCP 66 59298 → 22 [ACK] Seq=3937 Ack=95377 Win=6155 Len=0 TSval=5976465 TSecr=6572843
  194 19.418630722  10.6.15.144 → 192.168.1.16 SSH 1514 Server: Encrypted packet (len=1448)
  195 19.419801060  10.6.15.144 → 192.168.1.16 SSH 1514 Server: Encrypted packet (len=1448)
  196 19.419819116 192.168.1.16 → 10.6.15.144  TCP 66 59298 → 22 [ACK] Seq=3937 Ack=98273 Win=6155 Len=0 TSval=5976466 TSecr=6572843
  197 19.421370668  10.6.15.144 → 192.168.1.16 SSH 1514 Server: Encrypted packet (len=1448)
  198 19.421551389  10.6.15.144 → 192.168.1.16 SSH 1514 Server: Encrypted packet (len=1448)
  199 19.421560537 192.168.1.16 → 10.6.15.144  TCP 66 59298 → 22 [ACK] Seq=3937 Ack=101169 Win=6155 Len=0 TSval=5976466 TSecr=6572844
  200 19.422189411  10.6.15.144 → 192.168.1.16 SSH 1514 Server: Encrypted packet (len=1448)
  201 19.422380722  10.6.15.144 → 192.168.1.16 SSH 1514 Server: Encrypted packet (len=1448)
  202 19.422393267 192.168.1.16 → 10.6.15.144  TCP 66 59298 → 22 [ACK] Seq=3937 Ack=104065 Win=6155 Len=0 TSval=5976466 TSecr=6572844
  203 19.440826495  10.6.15.144 → 192.168.1.16 SSH 1514 Server: Encrypted packet (len=1448)
  204 19.441007590  10.6.15.144 → 192.168.1.16 SSH 1514 Server: Encrypted packet (len=1448)
  205 19.441021184 192.168.1.16 → 10.6.15.144  TCP 66 59298 → 22 [ACK] Seq=3937 Ack=106961 Win=6155 Len=0 TSval=5976471 TSecr=6572845
  206 19.441200001  10.6.15.144 → 192.168.1.16 SSH 1514 Server: Encrypted packet (len=1448)
  207 19.441394129  10.6.15.144 → 192.168.1.16 SSH 1514 Server: Encrypted packet (len=1448)
  208 19.441406175 192.168.1.16 → 10.6.15.144  TCP 66 59298 → 22 [ACK] Seq=3937 Ack=109857 Win=6155 Len=0 TSval=5976471 TSecr=6572846
  209 19.441582849  10.6.15.144 → 192.168.1.16 SSH 1514 Server: Encrypted packet (len=1448)
  210 19.441714623  10.6.15.144 → 192.168.1.16 SSH 1118 Server: Encrypted packet (len=1052)
  211 19.441721852 192.168.1.16 → 10.6.15.144  TCP 66 59298 → 22 [ACK] Seq=3937 Ack=112357 Win=6155 Len=0 TSval=5976471 TSecr=6572846
  212 19.442065934 192.168.1.16 → 10.6.15.144  SSH 102 Client: Encrypted packet (len=36)
  213 19.493125999  10.6.15.144 → 192.168.1.16 TCP 66 22 → 59298 [ACK] Seq=112357 Ack=3973 Win=1452 Len=0 TSval=6572862 TSecr=5976471
  214 20.375834267  10.6.15.144 → 192.168.1.16 SSH 1110 Server: Encrypted packet (len=1044)
  215 20.375854446  10.6.15.144 → 192.168.1.16 SSH 110 Server: Encrypted packet (len=44)
  216 20.375859632  10.6.15.144 → 192.168.1.16 TCP 110 [TCP Retransmission] 22 → 59298 [PSH, ACK] Seq=113401 Ack=3973 Win=1452 Len=44 TSval=6572982 TSecr=5976471
  217 20.375867868 192.168.1.16 → 10.6.15.144  TCP 78 59298 → 22 [ACK] Seq=3973 Ack=113445 Win=6155 Len=0 TSval=5976705 TSecr=6572972 SLE=113401 SRE=113445
  218 20.376163636  10.6.15.144 → 192.168.1.16 SSH 1154 Server: [TCP Spurious Retransmission] , Encrypted packet (len=1088)
  219 20.376170087 192.168.1.16 → 10.6.15.144  TCP 78 [TCP Dup ACK 217#1] 59298 → 22 [ACK] Seq=3973 Ack=113445 Win=6155 Len=0 TSval=5976705 TSecr=6573056 SLE=112357 SRE=113445
  220 20.378521020 192.168.1.16 → 10.6.15.144  SSH 158 Client: Encrypted packet (len=92)
  221 20.393631043 192.168.1.16 → 10.6.15.144  SSH 102 Client: Encrypted packet (len=36)
  222 20.394177622 192.168.1.16 → 10.6.15.144  SSH 150 Client: Encrypted packet (len=84)
  223 20.426157003  10.6.15.144 → 192.168.1.16 TCP 78 [TCP Dup ACK 213#1] 22 → 59298 [ACK] Seq=113445 Ack=3973 Win=1452 Len=0 TSval=6573094 TSecr=5976705 SLE=4065 SRE=4101
  224 20.426174113  10.6.15.144 → 192.168.1.16 TCP 78 [TCP Dup ACK 213#2] 22 → 59298 [ACK] Seq=113445 Ack=3973 Win=1452 Len=0 TSval=6573094 TSecr=5976705 SLE=4065 SRE=4185
  225 20.599490081 192.168.1.16 → 10.6.15.144  TCP 158 [TCP Retransmission] 59298 → 22 [PSH, ACK] Seq=3973 Ack=113445 Win=6155 Len=92 TSval=5976761 TSecr=6573094
  226 20.610783714  10.6.15.144 → 192.168.1.16 TCP 66 22 → 59298 [ACK] Seq=113445 Ack=4185 Win=1452 Len=0 TSval=6573141 TSecr=5976761
  227 22.389991409  10.6.15.144 → 192.168.1.16 SSH 102 Server: Encrypted packet (len=36)
  228 22.390011270  10.6.15.144 → 192.168.1.16 SSH 138 Server: Encrypted packet (len=72)
  229 22.390071228 192.168.1.16 → 10.6.15.144  TCP 66 59298 → 22 [ACK] Seq=4185 Ack=113553 Win=6155 Len=0 TSval=5977208 TSecr=6573270
  230 22.390221920  10.6.15.144 → 192.168.1.16 SSH 1514 Server: Encrypted packet (len=1448)
  231 22.390272594 192.168.1.16 → 10.6.15.144  SSH 102 Client: Encrypted packet (len=36)
  232 22.390410128  10.6.15.144 → 192.168.1.16 SSH 1414 Server: Encrypted packet (len=1348)
  233 22.390429678  10.6.15.144 → 192.168.1.16 SSH 206 Server: Encrypted packet (len=140)
  234 22.390432679 192.168.1.16 → 10.6.15.144  TCP 66 59298 → 22 [ACK] Seq=4221 Ack=116489 Win=6155 Len=0 TSval=5977208 TSecr=6573273
  235 22.390581836  10.6.15.144 → 192.168.1.16 SSH 206 Server: [TCP Spurious Retransmission] , Encrypted packet (len=140)
  236 22.390587638 192.168.1.16 → 10.6.15.144  TCP 78 [TCP Dup ACK 234#1] 59298 → 22 [ACK] Seq=4221 Ack=116489 Win=6155 Len=0 TSval=5977208 TSecr=6573315 SLE=116349 SRE=116489
  237 22.390806922  10.6.15.144 → 192.168.1.16 SSH 1514 Server: Encrypted packet (len=1448)
  238 22.390812270 192.168.1.16 → 10.6.15.144  TCP 66 59298 → 22 [ACK] Seq=4221 Ack=117937 Win=6155 Len=0 TSval=5977208 TSecr=6573400
  239 22.390999924  10.6.15.144 → 192.168.1.16 SSH 1514 Server: Encrypted packet (len=1448)
  240 22.391006118 192.168.1.16 → 10.6.15.144  TCP 66 59298 → 22 [ACK] Seq=4221 Ack=119385 Win=6155 Len=0 TSval=5977208 TSecr=6573400
  241 22.391063924  10.6.15.144 → 192.168.1.16 SSH 670 Server: Encrypted packet (len=604)
  242 22.391069103 192.168.1.16 → 10.6.15.144  TCP 66 59298 → 22 [ACK] Seq=4221 Ack=119989 Win=6155 Len=0 TSval=5977208 TSecr=6573400
  243 22.391078912  10.6.15.144 → 192.168.1.16 TCP 174 [TCP Out-Of-Order] 22 → 59298 [PSH, ACK] Seq=113445 Ack=4185 Win=1452 Len=108 TSval=6573536 TSecr=5976761
  244 22.391082252 192.168.1.16 → 10.6.15.144  TCP 78 [TCP Dup ACK 242#1] 59298 → 22 [ACK] Seq=4221 Ack=119989 Win=6155 Len=0 TSval=5977208 TSecr=6573400 SLE=113445 SRE=113553
  245 22.401034984  10.6.15.144 → 192.168.1.16 TCP 66 22 → 59298 [ACK] Seq=119989 Ack=4221 Win=1452 Len=0 TSval=6573588 TSecr=5977208
  246 22.402458190 192.168.1.16 → 10.6.15.144  SSH 134 Client: Encrypted packet (len=68)
  247 22.412362256  10.6.15.144 → 192.168.1.16 TCP 66 22 → 59298 [ACK] Seq=119989 Ack=4289 Win=1452 Len=0 TSval=6573591 TSecr=5977211
  248 22.414986737 192.168.1.16 → 10.6.15.144  SSH 158 Client: Encrypted packet (len=92)
  249 22.424938653  10.6.15.144 → 192.168.1.16 TCP 66 22 → 59298 [ACK] Seq=119989 Ack=4381 Win=1452 Len=0 TSval=6573594 TSecr=5977214
  250 22.427250178 192.168.1.16 → 10.6.15.144  SSH 102 Client: Encrypted packet (len=36)
  251 22.428825198 192.168.1.16 → 10.6.15.144  SSH 102 Client: Encrypted packet (len=36)
  252 22.463489165 192.168.1.16 → 10.6.15.144  SSH 306 Client: Encrypted packet (len=240)
  253 22.465676397  10.6.15.144 → 192.168.1.16 TCP 78 [TCP Dup ACK 249#1] 22 → 59298 [ACK] Seq=119989 Ack=4381 Win=1452 Len=0 TSval=6573604 TSecr=5977214 SLE=4417 SRE=4453
  254 22.473667263  10.6.15.144 → 192.168.1.16 TCP 78 [TCP Dup ACK 249#2] 22 → 59298 [ACK] Seq=119989 Ack=4381 Win=1452 Len=0 TSval=6573606 TSecr=5977214 SLE=4417 SRE=4693
  255 22.473685375 192.168.1.16 → 10.6.15.144  SSH 518 Client: Encrypted packet (len=452)
  256 22.484073080  10.6.15.144 → 192.168.1.16 TCP 78 [TCP Dup ACK 249#3] 22 → 59298 [ACK] Seq=119989 Ack=4381 Win=1452 Len=0 TSval=6573609 TSecr=5977214 SLE=4417 SRE=5145
  257 22.484092023 192.168.1.16 → 10.6.15.144  SSH 102 Client: [TCP Fast Retransmission] , Encrypted packet (len=36)
  258 22.494573333  10.6.15.144 → 192.168.1.16 TCP 66 22 → 59298 [ACK] Seq=119989 Ack=5145 Win=1447 Len=0 TSval=6573612 TSecr=5977232
  259 22.699640658 192.168.1.16 → 10.6.15.144  SSH 326 Client: Encrypted packet (len=260)
  260 22.700610124 192.168.1.16 → 10.6.15.144  SSH 362 Client: Encrypted packet (len=296)
  261 22.709453329  10.6.15.144 → 192.168.1.16 TCP 66 22 → 59298 [ACK] Seq=119989 Ack=5405 Win=1452 Len=0 TSval=6573666 TSecr=5977286
  262 22.709474122  10.6.15.144 → 192.168.1.16 TCP 66 22 → 59298 [ACK] Seq=119989 Ack=5701 Win=1452 Len=0 TSval=6573666 TSecr=5977286
  263 24.198785708 192.168.1.16 → 10.6.15.144  SSH 134 Client: Encrypted packet (len=68)
  264 24.199864204 192.168.1.16 → 10.6.15.144  SSH 134 Client: Encrypted packet (len=68)
  265 24.200479060  10.6.15.144 → 192.168.1.16 SSH 362 Server: Encrypted packet (len=296)
  266 24.200684561  10.6.15.144 → 192.168.1.16 SSH 1514 Server: Encrypted packet (len=1448)
  267 24.200689698 192.168.1.16 → 10.6.15.144  TCP 66 59298 → 22 [ACK] Seq=5837 Ack=121733 Win=6155 Len=0 TSval=5977661 TSecr=6573876
  268 24.200876257  10.6.15.144 → 192.168.1.16 SSH 1514 Server: Encrypted packet (len=1448)
  269 24.201144476  10.6.15.144 → 192.168.1.16 SSH 990 Server: Encrypted packet (len=924)
  270 24.201150446 192.168.1.16 → 10.6.15.144  TCP 66 59298 → 22 [ACK] Seq=5837 Ack=124105 Win=6155 Len=0 TSval=5977661 TSecr=6573876
  271 24.201160810  10.6.15.144 → 192.168.1.16 SSH 138 Server: Encrypted packet (len=72)
  272 24.201167516  10.6.15.144 → 192.168.1.16 SSH 150 Server: Encrypted packet (len=84)
  273 24.201205104 192.168.1.16 → 10.6.15.144  TCP 66 59298 → 22 [ACK] Seq=5837 Ack=124261 Win=6155 Len=0 TSval=5977661 TSecr=6573876
  274 24.201229704  10.6.15.144 → 192.168.1.16 SSH 374 Server: Encrypted packet (len=308)
  275 24.201283185  10.6.15.144 → 192.168.1.16 SSH 438 Server: Encrypted packet (len=372)
  276 24.201506458  10.6.15.144 → 192.168.1.16 SSH 1514 Server: Encrypted packet (len=1448)
  277 24.201514026 192.168.1.16 → 10.6.15.144  TCP 66 59298 → 22 [ACK] Seq=5837 Ack=126389 Win=6155 Len=0 TSval=5977661 TSecr=6573890
  278 24.201698198  10.6.15.144 → 192.168.1.16 SSH 1514 Server: Encrypted packet (len=1448)
  279 24.206030984  10.6.15.144 → 192.168.1.16 TCP 66 22 → 59298 [ACK] Seq=127837 Ack=5769 Win=1452 Len=0 TSval=6574040 TSecr=5977660
  280 24.206050285 192.168.1.16 → 10.6.15.144  SSH 614 Client: Encrypted packet (len=548)
  281 24.207276082  10.6.15.144 → 192.168.1.16 TCP 66 22 → 59298 [ACK] Seq=127837 Ack=5837 Win=1452 Len=0 TSval=6574041 TSecr=5977661
  282 24.209310715  10.6.15.144 → 192.168.1.16 SSH 1442 Server: Encrypted packet (len=1376)
  283 24.209850897 192.168.1.16 → 10.6.15.144  SSH 142 Client: Encrypted packet (len=76)
  284 24.210144459 192.168.1.16 → 10.6.15.144  SSH 126 Client: Encrypted packet (len=60)
  285 24.216665636  10.6.15.144 → 192.168.1.16 TCP 66 22 → 59298 [ACK] Seq=129213 Ack=6521 Win=1452 Len=0 TSval=6574043 TSecr=5977662
  286 24.225762117  10.6.15.144 → 192.168.1.16 SSH 1514 Server: Encrypted packet (len=1448)
  287 24.225883833  10.6.15.144 → 192.168.1.16 SSH 1514 Server: Encrypted packet (len=1448)
  288 24.225893391 192.168.1.16 → 10.6.15.144  TCP 66 59298 → 22 [ACK] Seq=6521 Ack=132109 Win=6155 Len=0 TSval=5977667 TSecr=6574045
  289 24.226177876  10.6.15.144 → 192.168.1.16 SSH 950 Server: Encrypted packet (len=884)
  290 24.227215629 192.168.1.16 → 10.6.15.144  SSH 214 Client: Encrypted packet (len=148)
  291 24.233799522 192.168.1.16 → 10.6.15.144  SSH 1022 Client: Encrypted packet (len=956)
  292 24.241749368  10.6.15.144 → 192.168.1.16 SSH 366 Server: Encrypted packet (len=300)
  293 24.249616917  10.6.15.144 → 192.168.1.16 SSH 670 Server: Encrypted packet (len=604)
  294 24.249688183 192.168.1.16 → 10.6.15.144  TCP 66 59298 → 22 [ACK] Seq=7625 Ack=133897 Win=6155 Len=0 TSval=5977673 TSecr=6574049
  295 24.329511883  10.6.15.144 → 192.168.1.16 SSH 1514 Server: Encrypted packet (len=1448)
  296 24.329688297  10.6.15.144 → 192.168.1.16 SSH 1514 Server: Encrypted packet (len=1448)
  297 24.329697669 192.168.1.16 → 10.6.15.144  TCP 66 59298 → 22 [ACK] Seq=7625 Ack=136793 Win=6155 Len=0 TSval=5977693 TSecr=6574070
  298 24.329819024  10.6.15.144 → 192.168.1.16 SSH 238 Server: Encrypted packet (len=172)
  299 24.340272731 192.168.1.16 → 10.6.15.144  SSH 118 Client: Encrypted packet (len=52)
  300 24.340932227 192.168.1.16 → 10.6.15.144  SSH 102 Client: Encrypted packet (len=36)
  301 24.375493062 192.168.1.16 → 10.6.15.144  TCP 102 [TCP Retransmission] 59298 → 22 [PSH, ACK] Seq=7677 Ack=136965 Win=6155 Len=36 TSval=5977705 TSecr=6574070
  302 24.383083358  10.6.15.144 → 192.168.1.16 TCP 78 22 → 59298 [ACK] Seq=136965 Ack=7713 Win=1452 Len=0 TSval=6574084 TSecr=5977696 SLE=7677 SRE=7713
  303 26.431538108 10.22.17.102 → 224.0.0.252  LLMNR 64 Standard query 0x7b84 A wpad
  304 27.065458320 192.168.1.16 → 52.66.5.185  NTP 90 NTP Version 4, client
  305 27.067687799  10.6.15.144 → 192.168.1.16 SSH 1514 Server: Encrypted packet (len=1448)
  306 27.067985478  10.6.15.144 → 192.168.1.16 SSH 1514 Server: Encrypted packet (len=1448)
  307 27.067992254 192.168.1.16 → 10.6.15.144  TCP 66 59298 → 22 [ACK] Seq=7713 Ack=139861 Win=6155 Len=0 TSval=5978378 TSecr=6574685
  308 27.068556266  10.6.15.144 → 192.168.1.16 SSH 1514 Server: Encrypted packet (len=1448)
  309 27.068879369  10.6.15.144 → 192.168.1.16 SSH 1514 Server: Encrypted packet (len=1448)
  310 27.068888289 192.168.1.16 → 10.6.15.144  TCP 66 59298 → 22 [ACK] Seq=7713 Ack=142757 Win=6155 Len=0 TSval=5978378 TSecr=6574685
  311 27.069067660  10.6.15.144 → 192.168.1.16 SSH 1514 Server: Encrypted packet (len=1448)
  312 27.069262425  10.6.15.144 → 192.168.1.16 SSH 1514 Server: Encrypted packet (len=1448)
  313 27.069270149 192.168.1.16 → 10.6.15.144  TCP 66 59298 → 22 [ACK] Seq=7713 Ack=145653 Win=6155 Len=0 TSval=5978378 TSecr=6574685
  314 27.069460425  10.6.15.144 → 192.168.1.16 SSH 1514 Server: Encrypted packet (len=1448)
  315 27.069644627  10.6.15.144 → 192.168.1.16 SSH 1514 Server: Encrypted packet (len=1448)
  316 27.069652950 192.168.1.16 → 10.6.15.144  TCP 66 59298 → 22 [ACK] Seq=7713 Ack=148549 Win=6155 Len=0 TSval=5978378 TSecr=6574685
  317 27.069825949  10.6.15.144 → 192.168.1.16 SSH 1454 Server: Encrypted packet (len=1388)
  318 27.069834350 10.22.17.102 → 224.0.0.252  LLMNR 64 Standard query 0x7b84 A wpad
  319 27.069849627  10.6.15.144 → 192.168.1.16 SSH 110 Server: Encrypted packet (len=44)
  320 27.070041004 192.168.1.16 → 10.6.15.144  TCP 66 59298 → 22 [ACK] Seq=7713 Ack=149981 Win=6155 Len=0 TSval=5978378 TSecr=6574685
  321 27.073651004 192.168.1.16 → 10.6.15.144  SSH 262 Client: Encrypted packet (len=196)
  322 27.078234806  10.6.15.144 → 192.168.1.16 SSH 102 Server: Encrypted packet (len=36)
  323 27.078582123 192.168.1.16 → 10.6.15.144  SSH 182 Client: Encrypted packet (len=116)
  324 27.081450321 192.168.1.16 → 10.6.15.144  SSH 158 Client: Encrypted packet (len=92)
  325 27.083278069  10.6.15.144 → 192.168.1.16 TCP 66 22 → 59298 [ACK] Seq=150017 Ack=7909 Win=1452 Len=0 TSval=6574759 TSecr=5978379
  326 27.088576549  10.6.15.144 → 192.168.1.16 TCP 66 22 → 59298 [ACK] Seq=150017 Ack=8025 Win=1452 Len=0 TSval=6574760 TSecr=5978380
  327 27.090995229  10.6.15.144 → 192.168.1.16 TCP 66 22 → 59298 [ACK] Seq=150017 Ack=8117 Win=1452 Len=0 TSval=6574761 TSecr=5978381
  328 27.123333406 192.168.1.16 → 10.6.15.144  SSH 302 Client: Encrypted packet (len=236)
  329 27.133142252  10.6.15.144 → 192.168.1.16 TCP 66 22 → 59298 [ACK] Seq=150017 Ack=8353 Win=1452 Len=0 TSval=6574771 TSecr=5978391
  330 28.405394530  10.6.15.144 → 192.168.1.16 SSH 198 Server: Encrypted packet (len=132)
  331 28.405413535  10.6.15.144 → 192.168.1.16 SSH 102 Server: Encrypted packet (len=36)
  332 28.405419729  10.6.15.144 → 192.168.1.16 TCP 102 [TCP Retransmission] 22 → 59298 [PSH, ACK] Seq=150149 Ack=8353 Win=1452 Len=36 TSval=6574947 TSecr=5978391
  333 28.405429039 192.168.1.16 → 10.6.15.144  TCP 78 59298 → 22 [ACK] Seq=8353 Ack=150185 Win=6155 Len=0 TSval=5978712 TSecr=6574808 SLE=150149 SRE=150185
  334 28.405585645  10.6.15.144 → 192.168.1.16 SSH 134 Server: Encrypted packet (len=68)
  335 28.405591391 192.168.1.16 → 10.6.15.144  TCP 66 59298 → 22 [ACK] Seq=8353 Ack=150253 Win=6155 Len=0 TSval=5978712 TSecr=6574948
  336 28.405600603  10.6.15.144 → 192.168.1.16 SSH 110 Server: Encrypted packet (len=44)
  337 28.405603602 192.168.1.16 → 10.6.15.144  TCP 66 59298 → 22 [ACK] Seq=8353 Ack=150297 Win=6155 Len=0 TSval=5978712 TSecr=6574950
  338 28.406151619 192.168.1.16 → 10.6.15.144  SSH 118 Client: Encrypted packet (len=52)
  339 28.416152508  10.6.15.144 → 192.168.1.16 TCP 66 22 → 59298 [ACK] Seq=150297 Ack=8405 Win=1452 Len=0 TSval=6575092 TSecr=5978712
  340 29.401439635  10.6.15.144 → 192.168.1.16 SSH 326 Server: Encrypted packet (len=260)
  341 29.401457826  10.6.15.144 → 192.168.1.16 SSH 174 Server: Encrypted packet (len=108)
  342 29.401462306  10.6.15.144 → 192.168.1.16 SSH 102 Server: Encrypted packet (len=36)
  343 29.401521499 192.168.1.16 → 10.6.15.144  TCP 66 59298 → 22 [ACK] Seq=8405 Ack=150701 Win=6155 Len=0 TSval=5978961 TSecr=6575173
  344 29.402082931 192.168.1.16 → 10.6.15.144  SSH 138 Client: Encrypted packet (len=72)
  345 29.408223879  10.6.15.144 → 192.168.1.16 TCP 66 22 → 59298 [ACK] Seq=150701 Ack=8477 Win=1452 Len=0 TSval=6575341 TSecr=5978961
  346 29.408669430  10.6.15.144 → 192.168.1.16 SSH 102 Server: Encrypted packet (len=36)
  347 29.451497392 192.168.1.16 → 10.6.15.144  TCP 66 59298 → 22 [ACK] Seq=8477 Ack=150737 Win=6155 Len=0 TSval=5978974 TSecr=6575341
  348 29.909097668 192.168.1.16 → 10.6.15.144  SSH 102 Client: Encrypted packet (len=36)
  349 29.910073035 192.168.1.16 → 10.6.15.144  SSH 214 Client: Encrypted packet (len=148)
  350 29.910776229  10.6.15.144 → 192.168.1.16 SSH 102 Server: Encrypted packet (len=36)
  351 29.910786573 192.168.1.16 → 10.6.15.144  TCP 66 59298 → 22 [ACK] Seq=8661 Ack=150773 Win=6155 Len=0 TSval=5979088 TSecr=6575430
  352 29.910847870 192.168.1.16 → 10.6.15.144  SSH 102 Client: Encrypted packet (len=36)
  353 29.914657543  10.6.15.144 → 192.168.1.16 TCP 66 22 → 59298 [ACK] Seq=150773 Ack=8661 Win=1452 Len=0 TSval=6575468 TSecr=5979088
  354 29.914676985  10.6.15.144 → 192.168.1.16 SSH 102 Server: Encrypted packet (len=36)
  355 29.953635173  10.6.15.144 → 192.168.1.16 TCP 66 22 → 59298 [ACK] Seq=150809 Ack=8697 Win=1452 Len=0 TSval=6575478 TSecr=5979088
  356 29.955513303 192.168.1.16 → 10.6.15.144  TCP 66 59298 → 22 [ACK] Seq=8697 Ack=150809 Win=6155 Len=0 TSval=5979100 TSecr=6575468
  357 31.384148427  10.6.15.144 → 192.168.1.16 SSH 102 Server: Encrypted packet (len=36)
  358 31.384194574 192.168.1.16 → 10.6.15.144  TCP 66 59298 → 22 [ACK] Seq=8697 Ack=150845 Win=6155 Len=0 TSval=5979457 TSecr=6575505
  359 31.384223120  10.6.15.144 → 192.168.1.16 SSH 102 Server: [TCP Spurious Retransmission] , Encrypted packet (len=36)
  360 31.384231279 192.168.1.16 → 10.6.15.144  TCP 78 [TCP Dup ACK 358#1] 59298 → 22 [ACK] Seq=8697 Ack=150845 Win=6155 Len=0 TSval=5979457 TSecr=6575676 SLE=150809 SRE=150845
