    1 0.000000000  10.6.15.144 → 192.168.1.16 SSH 174 Server: Encrypted packet (len=108)
    2 0.000308558  10.6.15.144 → 192.168.1.16 SSH 102 Server: Encrypted packet (len=36)
    3 0.000370023 192.168.1.16 → 10.6.15.144  TCP 66 59298 → 22 [ACK] Seq=1 Ack=145 Win=6155 Len=0 TSval=5998414 TSecr=6594765
    4 0.000383451 192.168.1.16 → 10.6.15.144  SSH 118 Client: Encrypted packet (len=52)
    5 0.000687789 192.168.1.16 → 10.6.15.144  SSH 150 Client: Encrypted packet (len=84)
    6 0.001047622  10.6.15.144 → 192.168.1.16 SSH 102 Server: Encrypted packet (len=36)
    7 0.001275432 192.168.1.16 → 10.6.15.144  SSH 382 Client: Encrypted packet (len=316)
    8 0.009807085  10.6.15.144 → 192.168.1.16 SSH 246 Server: Encrypted packet (len=180)
    9 0.010095897  10.6.15.144 → 192.168.1.16 TCP 66 22 → 59298 [ACK] Seq=361 Ack=53 Win=1452 Len=0 TSval=6594794 TSecr=5998414
   10 0.010178745 192.168.1.16 → 10.6.15.144  SSH 158 Client: Encrypted packet (len=92)
   11 0.010520381  10.6.15.144 → 192.168.1.16 TCP 66 22 → 59298 [ACK] Seq=361 Ack=137 Win=1452 Len=0 TSval=6594794 TSecr=5998414
   12 0.010887811  10.6.15.144 → 192.168.1.16 TCP 66 22 → 59298 [ACK] Seq=361 Ack=453 Win=1452 Len=0 TSval=6594794 TSecr=5998414
   13 0.018902925  10.6.15.144 → 192.168.1.16 SSH 542 Server: Encrypted packet (len=476)
   14 0.020033410 192.168.1.16 → 10.6.15.144  SSH 206 Client: Encrypted packet (len=140)
   15 0.021813496  10.6.15.144 → 192.168.1.16 SSH 526 Server: Encrypted packet (len=460)
   16 0.023080423 192.168.1.16 → 10.6.15.144  SSH 206 Client: Encrypted packet (len=140)
   17 0.028280235  10.6.15.144 → 192.168.1.16 SSH 534 Server: Encrypted packet (len=468)
   18 0.029304961 192.168.1.16 → 10.6.15.144  SSH 206 Client: Encrypted packet (len=140)
   19 0.033267578  10.6.15.144 → 192.168.1.16 TCP 66 22 → 59298 [ACK] Seq=1765 Ack=825 Win=1452 Len=0 TSval=6594800 TSecr=5998419
   20 0.034806540  10.6.15.144 → 192.168.1.16 SSH 334 Server: Encrypted packet (len=268)
   21 0.037974338  10.6.15.144 → 192.168.1.16 SSH 334 Server: Encrypted packet (len=268)
   22 0.038050491 192.168.1.16 → 10.6.15.144  TCP 66 59298 → 22 [ACK] Seq=965 Ack=2301 Win=6155 Len=0 TSval=5998423 TSecr=6594800
   23 0.039001379  10.6.15.144 → 192.168.1.16 SSH 146 Server: Encrypted packet (len=80)
   24 0.048776640  10.6.15.144 → 192.168.1.16 SSH 450 Server: Encrypted packet (len=384)
   25 0.048846761 192.168.1.16 → 10.6.15.144  TCP 66 59298 → 22 [ACK] Seq=965 Ack=2765 Win=6155 Len=0 TSval=5998426 TSecr=6594801
   26 0.051301500  10.6.15.144 → 192.168.1.16 SSH 102 Server: Encrypted packet (len=36)
   27 0.063637772  10.6.15.144 → 192.168.1.16 SSH 102 Server: Encrypted packet (len=36)
   28 0.063711891 192.168.1.16 → 10.6.15.144  TCP 66 59298 → 22 [ACK] Seq=965 Ack=2837 Win=6155 Len=0 TSval=5998430 TSecr=6594805
   29 0.100156685  10.6.15.144 → 192.168.1.16 SSH 102 Server: Encrypted packet (len=36)
   30 0.143060027 192.168.1.16 → 10.6.15.144  TCP 66 59298 → 22 [ACK] Seq=965 Ack=2873 Win=6155 Len=0 TSval=5998450 TSecr=6594818
   31 0.395888323  10.6.15.144 → 192.168.1.16 SSH 102 Server: Encrypted packet (len=36)
   32 0.395914345 192.168.1.16 → 10.6.15.144  TCP 66 59298 → 22 [ACK] Seq=965 Ack=2909 Win=6155 Len=0 TSval=5998513 TSecr=6594890
   33 0.395930578  10.6.15.144 → 192.168.1.16 SSH 102 Server: Encrypted packet (len=36)
   34 0.395936134 192.168.1.16 → 10.6.15.144  TCP 66 59298 → 22 [ACK] Seq=965 Ack=2945 Win=6155 Len=0 TSval=5998513 TSecr=6594890
   35 0.395941462  10.6.15.144 → 192.168.1.16 SSH 102 Server: Encrypted packet (len=36)
   36 0.395943589 192.168.1.16 → 10.6.15.144  TCP 66 59298 → 22 [ACK] Seq=965 Ack=2981 Win=6155 Len=0 TSval=5998513 TSecr=6594891
   37 0.402902119  10.6.15.144 → 192.168.1.16 SSH 102 Server: Encrypted packet (len=36)
   38 0.402919632 192.168.1.16 → 10.6.15.144  TCP 66 59298 → 22 [ACK] Seq=965 Ack=3017 Win=6155 Len=0 TSval=5998514 TSecr=6594893
   39 0.627904529  10.6.15.144 → 192.168.1.16 SSH 158 Server: Encrypted packet (len=92)
   40 0.627920656 192.168.1.16 → 10.6.15.144  TCP 66 59298 → 22 [ACK] Seq=965 Ack=3109 Win=6155 Len=0 TSval=5998571 TSecr=6594932
   41 0.627939415  10.6.15.144 → 192.168.1.16 SSH 102 Server: Encrypted packet (len=36)
   42 0.627944982 192.168.1.16 → 10.6.15.144  TCP 66 59298 → 22 [ACK] Seq=965 Ack=3145 Win=6155 Len=0 TSval=5998571 TSecr=6594932
   43 0.627950747  10.22.18.21 → 224.0.0.252  LLMNR 64 Standard query 0x727e ANY Aman
   44 0.631718469 192.168.1.16 → 10.6.15.144  SSH 138 Client: Encrypted packet (len=72)
   45 0.642016504  10.6.15.144 → 192.168.1.16 SSH 102 Server: Encrypted packet (len=36)
   46 0.683057227 192.168.1.16 → 10.6.15.144  TCP 66 59298 → 22 [ACK] Seq=1037 Ack=3181 Win=6155 Len=0 TSval=5998585 TSecr=6594952
   47 0.943114125 192.168.1.16 → 10.6.15.144  SSH 102 Client: Encrypted packet (len=36)
   48 0.943370118 192.168.1.16 → 10.6.15.144  SSH 110 Client: Encrypted packet (len=44)
   49 0.954040905  10.6.15.144 → 192.168.1.16 TCP 66 22 → 59298 [ACK] Seq=3181 Ack=1117 Win=1452 Len=0 TSval=6595030 TSecr=5998637
   50 0.959858514 192.168.1.16 → 10.6.15.144  SSH 134 Client: Encrypted packet (len=68)
   51 0.968369621 192.168.1.16 → 10.6.15.144  SSH 126 Client: Encrypted packet (len=60)
   52 0.970331469 192.168.1.16 → 10.6.15.144  SSH 110 Client: Encrypted packet (len=44)
   53 0.972077360 192.168.1.16 → 10.6.15.144  SSH 102 Client: Encrypted packet (len=36)
   54 0.979878897  10.6.15.144 → 192.168.1.16 TCP 66 22 → 59298 [ACK] Seq=3181 Ack=1289 Win=1452 Len=0 TSval=6595037 TSecr=5998654
   55 0.979900880 192.168.1.16 → 10.6.15.144  SSH 110 Client: Encrypted packet (len=44)
   56 0.987690547  10.22.18.21 → 224.0.0.252  LLMNR 64 Standard query 0x727e ANY Aman
   57 0.990134751  10.6.15.144 → 192.168.1.16 TCP 66 22 → 59298 [ACK] Seq=3181 Ack=1369 Win=1452 Len=0 TSval=6595039 TSecr=5998657
   58 1.027285362 192.168.1.16 → 10.6.15.144  SSH 1058 Client: Encrypted packet (len=992)
   59 1.042740355  10.6.15.144 → 192.168.1.16 SSH 670 Server: Encrypted packet (len=604)
   60 1.042758347 192.168.1.16 → 10.6.15.144  TCP 66 59298 → 22 [ACK] Seq=2361 Ack=3785 Win=6155 Len=0 TSval=5998674 TSecr=6595053
   61 1.255852486  10.6.15.144 → 192.168.1.16 SSH 110 Server: Encrypted packet (len=44)
   62 1.255871029 192.168.1.16 → 10.6.15.144  TCP 66 59298 → 22 [ACK] Seq=2361 Ack=3829 Win=6155 Len=0 TSval=5998728 TSecr=6595078
   63 1.255880836  10.6.15.144 → 192.168.1.16 SSH 150 Server: Encrypted packet (len=84)
   64 1.255885459 192.168.1.16 → 10.6.15.144  TCP 66 59298 → 22 [ACK] Seq=2361 Ack=3913 Win=6155 Len=0 TSval=5998728 TSecr=6595106
   65 1.263232321 192.168.1.16 → 10.6.15.144  SSH 150 Client: Encrypted packet (len=84)
   66 1.273528258 192.168.1.16 → 10.6.15.144  SSH 126 Client: Encrypted packet (len=60)
   67 1.283575661  10.6.15.144 → 192.168.1.16 TCP 66 22 → 59298 [ACK] Seq=3913 Ack=2505 Win=1452 Len=0 TSval=6595113 TSecr=5998730
   68 1.305118387  192.168.1.1 → 224.0.0.1    IGMPv2 42 Membership Query, general
   69 1.567964693  10.6.15.144 → 192.168.1.16 SSH 118 Server: Encrypted packet (len=52)
   70 1.567987987  10.6.15.144 → 192.168.1.16 SSH 110 Server: Encrypted packet (len=44)
   71 1.567994768  10.6.15.144 → 192.168.1.16 SSH 102 Server: Encrypted packet (len=36)
   72 1.568054594 192.168.1.16 → 10.6.15.144  TCP 66 59298 → 22 [ACK] Seq=2505 Ack=4045 Win=6155 Len=0 TSval=5998806 TSecr=6595149
   73 1.568133464  10.6.15.144 → 192.168.1.16 SSH 298 Server: Encrypted packet (len=232)
   74 1.569519573 192.168.1.16 → 10.6.15.144  SSH 110 Client: Encrypted packet (len=44)
   75 1.615451479  10.6.15.144 → 192.168.1.16 TCP 66 22 → 59298 [ACK] Seq=4277 Ack=2549 Win=1452 Len=0 TSval=6595196 TSecr=5998806
   76 1.883849958  10.6.15.144 → 192.168.1.16 SSH 134 Server: Encrypted packet (len=68)
   77 1.883872726  10.6.15.144 → 192.168.1.16 SSH 206 Server: Encrypted packet (len=140)
   78 1.883948293 192.168.1.16 → 10.6.15.144  TCP 66 59298 → 22 [ACK] Seq=2549 Ack=4485 Win=6155 Len=0 TSval=5998885 TSecr=6595237
   79 1.894095119 192.168.1.16 → 10.6.15.144  SSH 142 Client: Encrypted packet (len=76)
   80 1.904102681  10.6.15.144 → 192.168.1.16 TCP 66 22 → 59298 [ACK] Seq=4485 Ack=2625 Win=1452 Len=0 TSval=6595268 TSecr=5998887
   81 2.828190364  10.6.15.144 → 192.168.1.16 SSH 118 Server: Encrypted packet (len=52)
   82 2.871055063 192.168.1.16 → 10.6.15.144  TCP 66 59298 → 22 [ACK] Seq=2625 Ack=4537 Win=6155 Len=0 TSval=5999132 TSecr=6595462
   83 3.188000728  10.6.15.144 → 192.168.1.16 SSH 118 Server: [TCP Spurious Retransmission] , Encrypted packet (len=52)
   84 3.188020094 192.168.1.16 → 10.6.15.144  TCP 78 [TCP Dup ACK 82#1] 59298 → 22 [ACK] Seq=2625 Ack=4537 Win=6155 Len=0 TSval=5999211 TSecr=6595537 SLE=4485 SRE=4537
   85 3.337901501 192.168.1.16 → 10.6.15.144  SSH 150 Client: Encrypted packet (len=84)
   86 3.345658086  10.6.15.144 → 192.168.1.16 TCP 66 22 → 59298 [ACK] Seq=4537 Ack=2709 Win=1452 Len=0 TSval=6595629 TSecr=5999248
   87 3.908458368  10.6.15.144 → 192.168.1.16 SSH 102 Server: Encrypted packet (len=36)
   88 3.908483539 192.168.1.16 → 10.6.15.144  TCP 66 59298 → 22 [ACK] Seq=2709 Ack=4573 Win=6155 Len=0 TSval=5999391 TSecr=6595735
   89 5.575122556 192.168.1.16 → 224.0.0.252  IGMPv2 46 Membership Report group 224.0.0.252
   90 7.179468439  10.22.17.45 → 224.0.0.252  LLMNR 64 Standard query 0x0c2e A wpad
   91 7.179852540  10.22.17.45 → 224.0.0.252  LLMNR 64 Standard query 0xa3b4 A wpad
   92 7.180233888  10.22.17.45 → 224.0.0.252  LLMNR 64 Standard query 0x0c2e A wpad
   93 7.180617348  10.22.17.45 → 224.0.0.252  LLMNR 64 Standard query 0xa3b4 A wpad
   94 7.853095662 192.168.1.16 → 139.59.50.38 NTP 90 NTP Version 4, client
   95 8.647111499 192.168.1.16 → 224.0.0.251  IGMPv2 46 Membership Report group 224.0.0.251
   96 10.153140325 10.22.18.220 → 224.0.0.252  LLMNR 64 Standard query 0x9a90 A wpad
   97 10.153504939 10.22.18.220 → 224.0.0.252  LLMNR 64 Standard query 0xeeab AAAA wpad
   98 10.153890148 10.22.18.220 → 224.0.0.252  LLMNR 64 Standard query 0xeeab AAAA wpad
   99 10.154256430 10.22.18.220 → 224.0.0.252  LLMNR 64 Standard query 0x9a90 A wpad
  100 11.637765728 192.168.1.16 → 10.6.15.144  SSH 1514 Client: Encrypted packet (len=1448)
  101 11.639477357 192.168.1.16 → 10.6.15.144  SSH 326 Client: Encrypted packet (len=260)
  102 11.649619698  10.6.15.144 → 192.168.1.16 TCP 66 22 → 59298 [ACK] Seq=4573 Ack=4157 Win=1452 Len=0 TSval=6597704 TSecr=6001323
  103 11.650002244  10.6.15.144 → 192.168.1.16 TCP 66 22 → 59298 [ACK] Seq=4573 Ack=4417 Win=1450 Len=0 TSval=6597704 TSecr=6001324
  104 11.652350204  10.6.15.144 → 192.168.1.16 SSH 134 Server: Encrypted packet (len=68)
  105 11.652375465 192.168.1.16 → 10.6.15.144  TCP 66 59298 → 22 [ACK] Seq=4417 Ack=4641 Win=6155 Len=0 TSval=6001327 TSecr=6597705
  106 13.162048794  10.6.15.144 → 192.168.1.16 SSH 806 Server: Encrypted packet (len=740)
  107 13.162090637 192.168.1.16 → 10.6.15.144  TCP 66 59298 → 22 [ACK] Seq=4417 Ack=5381 Win=6155 Len=0 TSval=6001704 TSecr=6597733
  108 13.162426631  10.6.15.144 → 192.168.1.16 SSH 438 Server: Encrypted packet (len=372)
  109 13.162441709 192.168.1.16 → 10.6.15.144  TCP 66 59298 → 22 [ACK] Seq=4417 Ack=5753 Win=6155 Len=0 TSval=6001704 TSecr=6597733
  110 13.163629347 192.168.1.16 → 10.6.15.144  SSH 134 Client: Encrypted packet (len=68)
  111 13.164110419  10.6.15.144 → 192.168.1.16 SSH 438 Server: [TCP Spurious Retransmission] , Encrypted packet (len=372)
  112 13.164128450 192.168.1.16 → 10.6.15.144  TCP 78 [TCP Dup ACK 109#1] 59298 → 22 [ACK] Seq=4485 Ack=5753 Win=6155 Len=0 TSval=6001705 TSecr=6597775 SLE=5381 SRE=5753
  113 13.164275752  10.6.15.144 → 192.168.1.16 SSH 1178 Server: [TCP Spurious Retransmission] , Encrypted packet (len=1112)
  114 13.164281766 192.168.1.16 → 10.6.15.144  TCP 78 [TCP Dup ACK 109#2] 59298 → 22 [ACK] Seq=4485 Ack=5753 Win=6155 Len=0 TSval=6001705 TSecr=6597877 SLE=4641 SRE=5753
  115 13.164427755  10.6.15.144 → 192.168.1.16 SSH 1178 Server: [TCP Spurious Retransmission] , Encrypted packet (len=1112)
  116 13.164434615 192.168.1.16 → 10.6.15.144  TCP 78 [TCP Dup ACK 109#3] 59298 → 22 [ACK] Seq=4485 Ack=5753 Win=6155 Len=0 TSval=6001705 TSecr=6598081 SLE=4641 SRE=5753
  117 13.211368099  10.6.15.144 → 192.168.1.16 TCP 66 22 → 59298 [ACK] Seq=5753 Ack=4485 Win=1452 Len=0 TSval=6598095 TSecr=6001705
  118 13.261310705 192.168.1.16 → 54.76.71.168 TCP 128 42414 → 8282 [PSH, ACK] Seq=1 Ack=1 Win=296 Len=62 TSval=6001729 TSecr=610106203
  119 14.153035361 54.76.71.168 → 192.168.1.16 TCP 66 8282 → 42414 [ACK] Seq=1 Ack=63 Win=121 Len=0 TSval=610113704 TSecr=6001729
  120 14.153065396  10.6.15.144 → 192.168.1.16 SSH 102 Server: Encrypted packet (len=36)
  121 14.153090374 192.168.1.16 → 10.6.15.144  TCP 66 59298 → 22 [ACK] Seq=4485 Ack=5789 Win=6155 Len=0 TSval=6001952 TSecr=6598235
  122 15.189800136  10.6.15.144 → 192.168.1.16 SSH 102 Server: Encrypted packet (len=36)
  123 15.189817652 192.168.1.16 → 10.6.15.144  TCP 66 59298 → 22 [ACK] Seq=4485 Ack=5825 Win=6155 Len=0 TSval=6002211 TSecr=6598589
  124 15.196998550  10.6.15.144 → 192.168.1.16 SSH 102 Server: Encrypted packet (len=36)
  125 15.197016564 192.168.1.16 → 10.6.15.144  TCP 66 59298 → 22 [ACK] Seq=4485 Ack=5861 Win=6155 Len=0 TSval=6002213 TSecr=6598591
  126 15.199878094  10.6.15.144 → 192.168.1.16 SSH 102 Server: Encrypted packet (len=36)
  127 15.199895395 192.168.1.16 → 10.6.15.144  TCP 66 59298 → 22 [ACK] Seq=4485 Ack=5897 Win=6155 Len=0 TSval=6002214 TSecr=6598592
  128 15.203977876  10.6.15.144 → 192.168.1.16 SSH 102 Server: Encrypted packet (len=36)
  129 15.203993670 192.168.1.16 → 10.6.15.144  TCP 66 59298 → 22 [ACK] Seq=4485 Ack=5933 Win=6155 Len=0 TSval=6002215 TSecr=6598593
  130 15.210787658  10.6.15.144 → 192.168.1.16 SSH 102 Server: Encrypted packet (len=36)
  131 15.210805376 192.168.1.16 → 10.6.15.144  TCP 66 59298 → 22 [ACK] Seq=4485 Ack=5969 Win=6155 Len=0 TSval=6002216 TSecr=6598595
  132 15.212770758  10.6.15.144 → 192.168.1.16 SSH 102 Server: Encrypted packet (len=36)
  133 15.212789257 192.168.1.16 → 10.6.15.144  TCP 66 59298 → 22 [ACK] Seq=4485 Ack=6005 Win=6155 Len=0 TSval=6002217 TSecr=6598595
  134 21.248394056  10.22.18.21 → 224.0.0.252  LLMNR 64 Standard query 0x56fc ANY Aman
  135 22.153024291  10.22.18.21 → 224.0.0.252  LLMNR 64 Standard query 0x56fc ANY Aman
  136 28.853154502 192.168.1.16 → 91.189.89.198 NTP 90 NTP Version 4, client
  137 30.155815793  10.6.15.144 → 192.168.1.16 SSH 126 Server: Encrypted packet (len=60)
  138 30.155837791 192.168.1.16 → 10.6.15.144  TCP 66 59298 → 22 [ACK] Seq=4485 Ack=6065 Win=6155 Len=0 TSval=6005953 TSecr=6602296
  139 30.156376473  10.6.15.144 → 192.168.1.16 SSH 102 Server: Encrypted packet (len=36)
  140 30.156398855 192.168.1.16 → 10.6.15.144  TCP 66 59298 → 22 [ACK] Seq=4485 Ack=6101 Win=6155 Len=0 TSval=6005953 TSecr=6602296
  141 30.157805582  10.6.15.144 → 192.168.1.16 SSH 126 Server: Encrypted packet (len=60)
  142 30.157828997 192.168.1.16 → 10.6.15.144  TCP 66 59298 → 22 [ACK] Seq=4485 Ack=6161 Win=6155 Len=0 TSval=6005953 TSecr=6602297
  143 30.163324387  10.6.15.144 → 192.168.1.16 SSH 198 Server: Encrypted packet (len=132)
  144 30.163342210 192.168.1.16 → 10.6.15.144  TCP 66 59298 → 22 [ACK] Seq=4485 Ack=6293 Win=6155 Len=0 TSval=6005955 TSecr=6602333
  145 32.169096331  10.6.15.144 → 192.168.1.16 SSH 102 Server: Encrypted packet (len=36)
  146 32.169125413 192.168.1.16 → 10.6.15.144  TCP 66 59298 → 22 [ACK] Seq=4485 Ack=6329 Win=6155 Len=0 TSval=6006456 TSecr=6602661
  147 32.169747364  10.6.15.144 → 192.168.1.16 SSH 138 Server: Encrypted packet (len=72)
  148 32.169775597 192.168.1.16 → 10.6.15.144  TCP 66 59298 → 22 [ACK] Seq=4485 Ack=6401 Win=6155 Len=0 TSval=6006456 TSecr=6602663
  149 32.170622492  10.6.15.144 → 192.168.1.16 SSH 138 Server: [TCP Spurious Retransmission] , Encrypted packet (len=72)
  150 32.170653954 192.168.1.16 → 10.6.15.144  TCP 78 [TCP Dup ACK 148#1] 59298 → 22 [ACK] Seq=4485 Ack=6401 Win=6155 Len=0 TSval=6006456 TSecr=6602723 SLE=6329 SRE=6401
  151 33.179718326  10.6.15.144 → 192.168.1.16 SSH 138 Server: Encrypted packet (len=72)
  152 33.179738569 192.168.1.16 → 10.6.15.144  TCP 66 59298 → 22 [ACK] Seq=4485 Ack=6473 Win=6155 Len=0 TSval=6006709 TSecr=6602880
  153 33.179765494 10.22.18.107 → 224.0.0.252  LLMNR 64 Standard query 0x7bac A wpad
  154 33.179784392  10.6.15.144 → 192.168.1.16 SSH 138 Server: [TCP Spurious Retransmission] , Encrypted packet (len=72)
  155 33.179791691 192.168.1.16 → 10.6.15.144  TCP 78 [TCP Dup ACK 152#1] 59298 → 22 [ACK] Seq=4485 Ack=6473 Win=6155 Len=0 TSval=6006709 TSecr=6603026 SLE=6401 SRE=6473
  156 33.180055913 192.168.1.16 → 10.6.15.144  SSH 102 Client: Encrypted packet (len=36)
  157 33.181562614 10.22.18.107 → 224.0.0.252  LLMNR 64 Standard query 0x7bac A wpad
  158 33.187768045  10.6.15.144 → 192.168.1.16 TCP 66 22 → 59298 [ACK] Seq=6473 Ack=4521 Win=1452 Len=0 TSval=6603089 TSecr=6006709
