    1 0.000000000 192.168.1.16 → 10.6.15.144  SSH 1238 Client: Encrypted packet (len=1172)
    2 0.011790923  10.6.15.144 → 192.168.1.16 TCP 66 22 → 59298 [ACK] Seq=1 Ack=1173 Win=1447 Len=0 TSval=3544095 TSecr=2947779
    3 0.649745458 192.168.1.16 → 10.6.15.144  SSH 166 Client: Encrypted packet (len=100)
    4 0.651424741 10.22.18.209 → 224.0.0.252  LLMNR 64 Standard query 0x4c0e A wpad
    5 0.651439257 10.22.18.209 → 224.0.0.252  LLMNR 64 Standard query 0x4c0e A wpad
    6 0.653503922  10.6.15.144 → 192.168.1.16 TCP 66 22 → 59298 [ACK] Seq=1 Ack=1273 Win=1447 Len=0 TSval=3544258 TSecr=2947942
    7 1.265019497 192.168.1.16 → 104.18.58.29 TCP 66 42716 → 80 [ACK] Seq=1 Ack=1 Win=625 Len=0 TSval=2948096 TSecr=1019056593
    8 2.707549728  10.6.15.144 → 192.168.1.16 SSH 174 Server: Encrypted packet (len=108)
    9 2.707574444  10.6.15.144 → 192.168.1.16 SSH 210 Server: Encrypted packet (len=144)
   10 2.707581815  10.6.15.144 → 192.168.1.16 SSH 142 Server: Encrypted packet (len=76)
   11 2.707624047 192.168.1.16 → 10.6.15.144  TCP 66 59298 → 22 [ACK] Seq=1273 Ack=329 Win=1494 Len=0 TSval=2948456 TSecr=3544532
   12 2.707832035 192.168.1.16 → 10.6.15.144  SSH 138 Client: Encrypted packet (len=72)
   13 2.711194620  10.6.15.144 → 192.168.1.16 SSH 430 Server: Encrypted packet (len=364)
   14 2.711394048  10.6.15.144 → 192.168.1.16 TCP 758 [TCP Retransmission] 22 → 59298 [PSH, ACK] Seq=1 Ack=1273 Win=1452 Len=692 TSval=3544647 TSecr=2947942
   15 2.711404654 192.168.1.16 → 10.6.15.144  TCP 78 59298 → 22 [ACK] Seq=1345 Ack=693 Win=1494 Len=0 TSval=2948457 TSecr=3544647 SLE=1 SRE=693
   16 2.719479946  10.6.15.144 → 192.168.1.16 SSH 1514 Server: Encrypted packet (len=1448)
   17 2.719499534 192.168.1.16 → 10.6.15.144  TCP 66 59298 → 22 [ACK] Seq=1345 Ack=2141 Win=1494 Len=0 TSval=2948459 TSecr=3544772
   18 2.719521648  10.6.15.144 → 192.168.1.16 TCP 66 22 → 59298 [ACK] Seq=2141 Ack=1345 Win=1452 Len=0 TSval=3544772 TSecr=2948456
   19 2.720066632 192.168.1.16 → 10.6.15.144  SSH 134 Client: Encrypted packet (len=68)
   20 2.720092048  10.6.15.144 → 192.168.1.16 SSH 78 Server: Encrypted packet (len=12)
   21 2.720372065 192.168.1.16 → 10.6.15.144  SSH 270 Client: Encrypted packet (len=204)
   22 2.721678913 192.168.1.16 → 10.6.15.144  SSH 1238 Client: Encrypted packet (len=1172)
   23 2.730265979  10.6.15.144 → 192.168.1.16 TCP 66 22 → 59298 [ACK] Seq=2153 Ack=1617 Win=1452 Len=0 TSval=3544775 TSecr=2948459
   24 2.772047740  10.6.15.144 → 192.168.1.16 TCP 66 22 → 59298 [ACK] Seq=2153 Ack=2789 Win=1452 Len=0 TSval=3544786 TSecr=2948460
   25 2.835019112  10.6.15.144 → 192.168.1.16 SSH 726 Server: Encrypted packet (len=660)
   26 2.835045257  10.6.15.144 → 192.168.1.16 SSH 230 Server: Encrypted packet (len=164)
   27 2.835050739  10.6.15.144 → 192.168.1.16 SSH 134 Server: Encrypted packet (len=68)
   28 2.835098461 192.168.1.16 → 10.6.15.144  TCP 66 59298 → 22 [ACK] Seq=2789 Ack=3045 Win=1494 Len=0 TSval=2948488 TSecr=3544802
   29 2.836045067 192.168.1.16 → 10.6.15.144  SSH 134 Client: Encrypted packet (len=68)
   30 2.869986463  10.6.15.144 → 192.168.1.16 TCP 66 22 → 59298 [ACK] Seq=3045 Ack=2857 Win=1452 Len=0 TSval=3544811 TSecr=2948488
   31 2.936904105  10.6.15.144 → 192.168.1.16 SSH 174 Server: Encrypted packet (len=108)
   32 2.938819044 192.168.1.16 → 10.6.15.144  SSH 110 Client: Encrypted packet (len=44)
   33 2.939620096 192.168.1.16 → 10.6.15.144  SSH 102 Client: Encrypted packet (len=36)
   34 2.944381856  10.6.15.144 → 192.168.1.16 TCP 66 22 → 59298 [ACK] Seq=3153 Ack=2901 Win=1452 Len=0 TSval=3544830 TSecr=2948514
   35 2.944398596  10.6.15.144 → 192.168.1.16 TCP 66 22 → 59298 [ACK] Seq=3153 Ack=2937 Win=1452 Len=0 TSval=3544830 TSecr=2948514
   36 4.692983192  10.6.15.144 → 192.168.1.16 SSH 102 Server: Encrypted packet (len=36)
   37 4.693016987  10.6.15.144 → 192.168.1.16 SSH 102 Server: Encrypted packet (len=36)
   38 4.693023840  10.6.15.144 → 192.168.1.16 TCP 102 [TCP Retransmission] 22 → 59298 [PSH, ACK] Seq=3189 Ack=2937 Win=1452 Len=36 TSval=3545265 TSecr=2948514
   39 4.693032858 192.168.1.16 → 10.6.15.144  TCP 78 59298 → 22 [ACK] Seq=2937 Ack=3225 Win=1494 Len=0 TSval=2948953 TSecr=3545230 SLE=3189 SRE=3225
   40 4.693343399 192.168.1.16 → 10.6.15.144  SSH 118 Client: Encrypted packet (len=52)
   41 4.697083847  10.6.15.144 → 192.168.1.16 TCP 66 22 → 59298 [ACK] Seq=3225 Ack=2989 Win=1452 Len=0 TSval=3545269 TSecr=2948953
   42 5.714977858  10.6.15.144 → 192.168.1.16 SSH 270 Server: Encrypted packet (len=204)
   43 5.717361127 192.168.1.16 → 10.6.15.144  SSH 110 Client: Encrypted packet (len=44)
   44 5.730151414 192.168.1.16 → 10.6.15.144  SSH 102 Client: Encrypted packet (len=36)
   45 5.731278944  10.6.15.144 → 192.168.1.16 TCP 66 22 → 59298 [ACK] Seq=3429 Ack=3033 Win=1452 Len=0 TSval=3545528 TSecr=2949209
   46 5.731293211  10.6.15.144 → 192.168.1.16 TCP 66 22 → 59298 [ACK] Seq=3429 Ack=3069 Win=1452 Len=0 TSval=3545528 TSecr=2949212
   47 5.807183059  10.6.15.144 → 192.168.1.16 SSH 102 Server: Encrypted packet (len=36)
   48 5.807500206 192.168.1.16 → 10.6.15.144  SSH 182 Client: Encrypted packet (len=116)
   49 5.808263384  10.6.15.144 → 192.168.1.16 SSH 102 Server: Encrypted packet (len=36)
   50 5.808464582 192.168.1.16 → 10.6.15.144  SSH 158 Client: Encrypted packet (len=92)
   51 5.814597498  10.6.15.144 → 192.168.1.16 TCP 66 22 → 59298 [ACK] Seq=3501 Ack=3185 Win=1452 Len=0 TSval=3545547 TSecr=2949231
   52 5.817924267  10.6.15.144 → 192.168.1.16 TCP 66 22 → 59298 [ACK] Seq=3501 Ack=3277 Win=1452 Len=0 TSval=3545548 TSecr=2949231
   53 5.884052913  10.6.15.144 → 192.168.1.16 SSH 158 Server: Encrypted packet (len=92)
   54 5.884556188  10.6.15.144 → 192.168.1.16 SSH 998 Server: Encrypted packet (len=932)
   55 5.884583208 192.168.1.16 → 10.6.15.144  TCP 66 59298 → 22 [ACK] Seq=3277 Ack=4525 Win=1494 Len=0 TSval=2949250 TSecr=3545564
   56 5.885902487  10.6.15.144 → 192.168.1.16 SSH 1514 Server: Encrypted packet (len=1448)
   57 5.893940231  10.6.15.144 → 192.168.1.16 SSH 834 Server: Encrypted packet (len=768)
   58 5.893958693 192.168.1.16 → 10.6.15.144  TCP 66 59298 → 22 [ACK] Seq=3277 Ack=6741 Win=1494 Len=0 TSval=2949253 TSecr=3545564
   59 5.893980627  10.6.15.144 → 192.168.1.16 SSH 446 Server: Encrypted packet (len=380)
   60 5.895206541 192.168.1.16 → 10.6.15.144  SSH 214 Client: Encrypted packet (len=148)
   61 5.896857268 192.168.1.16 → 10.6.15.144  SSH 206 Client: Encrypted packet (len=140)
   62 5.900175438 192.168.1.16 → 10.6.15.144  SSH 766 Client: Encrypted packet (len=700)
   63 5.905159970  10.6.15.144 → 192.168.1.16 TCP 66 22 → 59298 [ACK] Seq=7121 Ack=3425 Win=1452 Len=0 TSval=3545569 TSecr=2949253
   64 5.906626522  10.6.15.144 → 192.168.1.16 TCP 66 22 → 59298 [ACK] Seq=7121 Ack=3565 Win=1452 Len=0 TSval=3545569 TSecr=2949253
   65 5.915885337  10.6.15.144 → 192.168.1.16 TCP 66 22 → 59298 [ACK] Seq=7121 Ack=4265 Win=1452 Len=0 TSval=3545570 TSecr=2949254
   66 5.972542814  10.6.15.144 → 192.168.1.16 SSH 254 Server: Encrypted packet (len=188)
   67 5.974484836  10.6.15.144 → 192.168.1.16 SSH 246 Server: Encrypted packet (len=180)
   68 5.974549979 192.168.1.16 → 10.6.15.144  TCP 66 59298 → 22 [ACK] Seq=4265 Ack=7489 Win=1494 Len=0 TSval=2949273 TSecr=3545586
   69 7.701066950  10.6.15.144 → 192.168.1.16 SSH 1514 Server: Encrypted packet (len=1448)
   70 7.701084838  10.6.15.144 → 192.168.1.16 SSH 118 Server: Encrypted packet (len=52)
   71 7.701095132 192.168.1.16 → 10.6.15.144  TCP 66 59298 → 22 [ACK] Seq=4265 Ack=8989 Win=1494 Len=0 TSval=2949705 TSecr=3545663
   72 7.701105535  10.6.15.144 → 192.168.1.16 SSH 1514 Server: Encrypted packet (len=1448)
   73 7.704013623  10.6.15.144 → 192.168.1.16 SSH 1514 Server: Encrypted packet (len=1448)
   74 7.704032864 192.168.1.16 → 10.6.15.144  TCP 66 59298 → 22 [ACK] Seq=4265 Ack=11885 Win=1494 Len=0 TSval=2949705 TSecr=3545663
   75 7.704154738  10.6.15.144 → 192.168.1.16 TCP 1514 [TCP Out-Of-Order] 22 → 59298 [ACK] Seq=7489 Ack=4265 Win=1452 Len=1448 TSval=3545930 TSecr=2949273
   76 7.704164037 192.168.1.16 → 10.6.15.144  TCP 78 [TCP Dup ACK 74#1] 59298 → 22 [ACK] Seq=4265 Ack=11885 Win=1494 Len=0 TSval=2949705 TSecr=3545663 SLE=7489 SRE=8937
   77 7.704172777 10.22.18.209 → 224.0.0.252  LLMNR 64 Standard query 0xab4f A wpad
   78 7.704185783 10.22.18.209 → 224.0.0.252  LLMNR 64 Standard query 0xab4f A wpad
   79 7.704843209  10.6.15.144 → 192.168.1.16 SSH 1514 Server: Encrypted packet (len=1448)
   80 7.704851245 192.168.1.16 → 10.6.15.144  TCP 66 59298 → 22 [ACK] Seq=4265 Ack=13333 Win=1494 Len=0 TSval=2949705 TSecr=3546021
   81 7.709090894  10.6.15.144 → 192.168.1.16 SSH 1514 Server: Encrypted packet (len=1448)
   82 7.709109180 192.168.1.16 → 10.6.15.144  TCP 66 59298 → 22 [ACK] Seq=4265 Ack=14781 Win=1494 Len=0 TSval=2949707 TSecr=3546021
   83 7.709338547  10.6.15.144 → 192.168.1.16 SSH 1514 Server: Encrypted packet (len=1448)
   84 7.709345945 192.168.1.16 → 10.6.15.144  TCP 66 59298 → 22 [ACK] Seq=4265 Ack=16229 Win=1494 Len=0 TSval=2949707 TSecr=3546021
   85 7.709528176  10.6.15.144 → 192.168.1.16 SSH 1514 Server: Encrypted packet (len=1448)
   86 7.709534956 192.168.1.16 → 10.6.15.144  TCP 66 59298 → 22 [ACK] Seq=4265 Ack=17677 Win=1494 Len=0 TSval=2949707 TSecr=3546021
   87 7.711559900  10.6.15.144 → 192.168.1.16 SSH 1514 Server: Encrypted packet (len=1448)
   88 7.711579462 192.168.1.16 → 10.6.15.144  TCP 66 59298 → 22 [ACK] Seq=4265 Ack=19125 Win=1494 Len=0 TSval=2949707 TSecr=3546022
   89 7.712458646  10.6.15.144 → 192.168.1.16 SSH 1514 Server: Encrypted packet (len=1448)
   90 7.712470004 192.168.1.16 → 10.6.15.144  TCP 66 59298 → 22 [ACK] Seq=4265 Ack=20573 Win=1494 Len=0 TSval=2949707 TSecr=3546022
   91 7.712636437  10.6.15.144 → 192.168.1.16 SSH 1514 Server: Encrypted packet (len=1448)
   92 7.712641637 192.168.1.16 → 10.6.15.144  TCP 66 59298 → 22 [ACK] Seq=4265 Ack=22021 Win=1494 Len=0 TSval=2949707 TSecr=3546022
   93 7.714020206  10.6.15.144 → 192.168.1.16 SSH 1514 Server: Encrypted packet (len=1448)
   94 7.714038060 192.168.1.16 → 10.6.15.144  TCP 66 59298 → 22 [ACK] Seq=4265 Ack=23469 Win=1494 Len=0 TSval=2949708 TSecr=3546023
   95 7.714686945  10.6.15.144 → 192.168.1.16 SSH 1514 Server: Encrypted packet (len=1448)
   96 7.714696683 192.168.1.16 → 10.6.15.144  TCP 66 59298 → 22 [ACK] Seq=4265 Ack=24917 Win=1494 Len=0 TSval=2949708 TSecr=3546023
   97 7.714877435  10.6.15.144 → 192.168.1.16 SSH 1514 Server: Encrypted packet (len=1448)
   98 7.714884251 192.168.1.16 → 10.6.15.144  TCP 66 59298 → 22 [ACK] Seq=4265 Ack=26365 Win=1494 Len=0 TSval=2949708 TSecr=3546023
   99 7.716157134  10.6.15.144 → 192.168.1.16 SSH 1514 Server: Encrypted packet (len=1448)
  100 7.716168078 192.168.1.16 → 10.6.15.144  TCP 66 59298 → 22 [ACK] Seq=4265 Ack=27813 Win=1494 Len=0 TSval=2949708 TSecr=3546024
  101 7.717196101  10.6.15.144 → 192.168.1.16 SSH 1514 Server: Encrypted packet (len=1448)
  102 7.717208230 192.168.1.16 → 10.6.15.144  TCP 66 59298 → 22 [ACK] Seq=4265 Ack=29261 Win=1494 Len=0 TSval=2949709 TSecr=3546024
  103 7.717518551  10.6.15.144 → 192.168.1.16 SSH 1514 Server: Encrypted packet (len=1448)
  104 7.717527532 192.168.1.16 → 10.6.15.144  TCP 66 59298 → 22 [ACK] Seq=4265 Ack=30709 Win=1494 Len=0 TSval=2949709 TSecr=3546024
  105 7.718338080  10.6.15.144 → 192.168.1.16 SSH 1514 Server: Encrypted packet (len=1448)
  106 7.718354994 192.168.1.16 → 10.6.15.144  TCP 66 59298 → 22 [ACK] Seq=4265 Ack=32157 Win=1494 Len=0 TSval=2949709 TSecr=3546024
  107 7.718525949  10.6.15.144 → 192.168.1.16 SSH 1514 Server: Encrypted packet (len=1448)
  108 7.718534096 192.168.1.16 → 10.6.15.144  TCP 66 59298 → 22 [ACK] Seq=4265 Ack=33605 Win=1494 Len=0 TSval=2949709 TSecr=3546024
  109 7.720035594  10.6.15.144 → 192.168.1.16 SSH 1514 Server: Encrypted packet (len=1448)
  110 7.720225179  10.6.15.144 → 192.168.1.16 SSH 1514 Server: Encrypted packet (len=1448)
  111 7.720235449 192.168.1.16 → 10.6.15.144  TCP 66 59298 → 22 [ACK] Seq=4265 Ack=36501 Win=1494 Len=0 TSval=2949709 TSecr=3546025
  112 7.720575619  10.6.15.144 → 192.168.1.16 SSH 1514 Server: Encrypted packet (len=1448)
  113 7.721211902  10.6.15.144 → 192.168.1.16 SSH 1514 Server: Encrypted packet (len=1448)
  114 7.721221397 192.168.1.16 → 10.6.15.144  TCP 66 59298 → 22 [ACK] Seq=4265 Ack=39397 Win=1494 Len=0 TSval=2949710 TSecr=3546025
  115 7.723620243  10.6.15.144 → 192.168.1.16 SSH 1514 Server: Encrypted packet (len=1448)
  116 7.723809887  10.6.15.144 → 192.168.1.16 SSH 1514 Server: Encrypted packet (len=1448)
  117 7.723825460 192.168.1.16 → 10.6.15.144  TCP 66 59298 → 22 [ACK] Seq=4265 Ack=42293 Win=1494 Len=0 TSval=2949710 TSecr=3546025
  118 7.723998306  10.6.15.144 → 192.168.1.16 SSH 1514 Server: Encrypted packet (len=1448)
  119 7.724346767  10.6.15.144 → 192.168.1.16 SSH 1514 Server: Encrypted packet (len=1448)
  120 7.724358635 192.168.1.16 → 10.6.15.144  TCP 66 59298 → 22 [ACK] Seq=4265 Ack=45189 Win=1494 Len=0 TSval=2949710 TSecr=3546025
  121 7.728879697  10.6.15.144 → 192.168.1.16 SSH 1514 Server: Encrypted packet (len=1448)
  122 7.729063311  10.6.15.144 → 192.168.1.16 SSH 1514 Server: Encrypted packet (len=1448)
  123 7.729076497 192.168.1.16 → 10.6.15.144  TCP 66 59298 → 22 [ACK] Seq=4265 Ack=48085 Win=1494 Len=0 TSval=2949712 TSecr=3546026
  124 7.729255005  10.6.15.144 → 192.168.1.16 SSH 1514 Server: Encrypted packet (len=1448)
  125 7.729600031  10.6.15.144 → 192.168.1.16 SSH 1514 Server: Encrypted packet (len=1448)
  126 7.729609623 192.168.1.16 → 10.6.15.144  TCP 66 59298 → 22 [ACK] Seq=4265 Ack=50981 Win=1494 Len=0 TSval=2949712 TSecr=3546026
  127 7.733656880  10.6.15.144 → 192.168.1.16 SSH 1514 Server: Encrypted packet (len=1448)
  128 7.738090794  10.6.15.144 → 192.168.1.16 SSH 1514 Server: Encrypted packet (len=1448)
  129 7.738113664 192.168.1.16 → 10.6.15.144  TCP 66 59298 → 22 [ACK] Seq=4265 Ack=53877 Win=1494 Len=0 TSval=2949714 TSecr=3546028
  130 7.738298921  10.6.15.144 → 192.168.1.16 SSH 1514 Server: Encrypted packet (len=1448)
  131 7.738513062  10.6.15.144 → 192.168.1.16 SSH 1514 Server: Encrypted packet (len=1448)
  132 7.738521290 192.168.1.16 → 10.6.15.144  TCP 66 59298 → 22 [ACK] Seq=4265 Ack=56773 Win=1494 Len=0 TSval=2949714 TSecr=3546028
  133 7.741216159  10.6.15.144 → 192.168.1.16 SSH 1514 Server: Encrypted packet (len=1448)
  134 7.743090285  10.6.15.144 → 192.168.1.16 SSH 1514 Server: Encrypted packet (len=1448)
  135 7.743103871 192.168.1.16 → 10.6.15.144  TCP 66 59298 → 22 [ACK] Seq=4265 Ack=59669 Win=1494 Len=0 TSval=2949715 TSecr=3546030
  136 7.743293728  10.6.15.144 → 192.168.1.16 SSH 1514 Server: Encrypted packet (len=1448)
  137 7.743513579  10.6.15.144 → 192.168.1.16 SSH 1514 Server: Encrypted packet (len=1448)
  138 7.743520333 192.168.1.16 → 10.6.15.144  TCP 66 59298 → 22 [ACK] Seq=4265 Ack=62565 Win=1494 Len=0 TSval=2949715 TSecr=3546030
  139 7.747901146  10.6.15.144 → 192.168.1.16 SSH 1514 Server: Encrypted packet (len=1448)
  140 7.748106972  10.6.15.144 → 192.168.1.16 SSH 1514 Server: Encrypted packet (len=1448)
  141 7.748116269 192.168.1.16 → 10.6.15.144  TCP 66 59298 → 22 [ACK] Seq=4265 Ack=65461 Win=1494 Len=0 TSval=2949716 TSecr=3546032
  142 7.748320665  10.6.15.144 → 192.168.1.16 SSH 1514 Server: Encrypted packet (len=1448)
  143 7.748684010  10.6.15.144 → 192.168.1.16 SSH 1514 Server: Encrypted packet (len=1448)
  144 7.748691251 192.168.1.16 → 10.6.15.144  TCP 66 59298 → 22 [ACK] Seq=4265 Ack=68357 Win=1494 Len=0 TSval=2949716 TSecr=3546032
  145 7.751262913  10.6.15.144 → 192.168.1.16 SSH 1514 Server: Encrypted packet (len=1448)
  146 7.751466181  10.6.15.144 → 192.168.1.16 SSH 1514 Server: Encrypted packet (len=1448)
  147 7.751476343 192.168.1.16 → 10.6.15.144  TCP 66 59298 → 22 [ACK] Seq=4265 Ack=71253 Win=1494 Len=0 TSval=2949717 TSecr=3546032
  148 7.751831454  10.6.15.144 → 192.168.1.16 SSH 1514 Server: Encrypted packet (len=1448)
  149 7.752039975  10.6.15.144 → 192.168.1.16 SSH 1514 Server: Encrypted packet (len=1448)
  150 7.752048125 192.168.1.16 → 10.6.15.144  TCP 66 59298 → 22 [ACK] Seq=4265 Ack=74149 Win=1494 Len=0 TSval=2949717 TSecr=3546032
  151 7.755104938  10.6.15.144 → 192.168.1.16 SSH 1514 Server: Encrypted packet (len=1448)
  152 7.755309174  10.6.15.144 → 192.168.1.16 SSH 1514 Server: Encrypted packet (len=1448)
  153 7.755323171 192.168.1.16 → 10.6.15.144  TCP 66 59298 → 22 [ACK] Seq=4265 Ack=77045 Win=1494 Len=0 TSval=2949718 TSecr=3546033
  154 7.755518625  10.6.15.144 → 192.168.1.16 SSH 1514 Server: Encrypted packet (len=1448)
  155 7.755883336  10.6.15.144 → 192.168.1.16 SSH 1514 Server: Encrypted packet (len=1448)
  156 7.755890689 192.168.1.16 → 10.6.15.144  TCP 66 59298 → 22 [ACK] Seq=4265 Ack=79941 Win=1494 Len=0 TSval=2949718 TSecr=3546033
  157 7.758910176  10.6.15.144 → 192.168.1.16 SSH 1514 Server: Encrypted packet (len=1448)
  158 7.759115273  10.6.15.144 → 192.168.1.16 SSH 1514 Server: Encrypted packet (len=1448)
  159 7.759128552 192.168.1.16 → 10.6.15.144  TCP 66 59298 → 22 [ACK] Seq=4265 Ack=82837 Win=1494 Len=0 TSval=2949719 TSecr=3546034
  160 7.759327454  10.6.15.144 → 192.168.1.16 SSH 1514 Server: Encrypted packet (len=1448)
  161 7.759694178  10.6.15.144 → 192.168.1.16 SSH 1514 Server: Encrypted packet (len=1448)
  162 7.759706567 192.168.1.16 → 10.6.15.144  TCP 66 59298 → 22 [ACK] Seq=4265 Ack=85733 Win=1494 Len=0 TSval=2949719 TSecr=3546034
  163 7.762435593  10.6.15.144 → 192.168.1.16 SSH 1514 Server: Encrypted packet (len=1448)
  164 7.762636643  10.6.15.144 → 192.168.1.16 SSH 1514 Server: Encrypted packet (len=1448)
  165 7.762650519 192.168.1.16 → 10.6.15.144  TCP 66 59298 → 22 [ACK] Seq=4265 Ack=88629 Win=1494 Len=0 TSval=2949720 TSecr=3546035
  166 7.762849743  10.6.15.144 → 192.168.1.16 SSH 1514 Server: Encrypted packet (len=1448)
  167 7.763213970  10.6.15.144 → 192.168.1.16 SSH 1514 Server: Encrypted packet (len=1448)
  168 7.763223634 192.168.1.16 → 10.6.15.144  TCP 66 59298 → 22 [ACK] Seq=4265 Ack=91525 Win=1494 Len=0 TSval=2949720 TSecr=3546035
  169 7.763436098  10.6.15.144 → 192.168.1.16 SSH 1514 Server: Encrypted packet (len=1448)
  170 7.763642939  10.6.15.144 → 192.168.1.16 SSH 1514 Server: Encrypted packet (len=1448)
  171 7.763650818 192.168.1.16 → 10.6.15.144  TCP 66 59298 → 22 [ACK] Seq=4265 Ack=94421 Win=1494 Len=0 TSval=2949720 TSecr=3546035
  172 7.769473462  10.6.15.144 → 192.168.1.16 SSH 1514 Server: Encrypted packet (len=1448)
  173 7.769685789  10.6.15.144 → 192.168.1.16 SSH 1514 Server: Encrypted packet (len=1448)
  174 7.769693050 192.168.1.16 → 10.6.15.144  TCP 66 59298 → 22 [ACK] Seq=4265 Ack=97317 Win=1494 Len=0 TSval=2949722 TSecr=3546037
  175 7.770046174  10.6.15.144 → 192.168.1.16 SSH 1514 Server: Encrypted packet (len=1448)
  176 7.770258759  10.6.15.144 → 192.168.1.16 SSH 1514 Server: Encrypted packet (len=1448)
  177 7.770262731 192.168.1.16 → 10.6.15.144  TCP 66 59298 → 22 [ACK] Seq=4265 Ack=100213 Win=1494 Len=0 TSval=2949722 TSecr=3546037
  178 7.770462388  10.6.15.144 → 192.168.1.16 SSH 1514 Server: Encrypted packet (len=1448)
  179 7.770685548  10.6.15.144 → 192.168.1.16 SSH 1514 Server: Encrypted packet (len=1448)
  180 7.770690909 192.168.1.16 → 10.6.15.144  TCP 66 59298 → 22 [ACK] Seq=4265 Ack=103109 Win=1494 Len=0 TSval=2949722 TSecr=3546037
  181 7.773753525  10.6.15.144 → 192.168.1.16 SSH 1514 Server: Encrypted packet (len=1448)
  182 7.773883515 192.168.1.16 → 10.6.15.144  SSH 102 Client: Encrypted packet (len=36)
  183 7.773966437  10.6.15.144 → 192.168.1.16 SSH 1514 Server: Encrypted packet (len=1448)
  184 7.774174115  10.6.15.144 → 192.168.1.16 SSH 1514 Server: Encrypted packet (len=1448)
  185 7.774181608 192.168.1.16 → 10.6.15.144  TCP 66 59298 → 22 [ACK] Seq=4301 Ack=107453 Win=1494 Len=0 TSval=2949723 TSecr=3546038
  186 7.774536883  10.6.15.144 → 192.168.1.16 SSH 1514 Server: Encrypted packet (len=1448)
  187 7.774757332  10.6.15.144 → 192.168.1.16 SSH 1514 Server: Encrypted packet (len=1448)
  188 7.774766157 192.168.1.16 → 10.6.15.144  TCP 66 59298 → 22 [ACK] Seq=4301 Ack=110349 Win=1494 Len=0 TSval=2949723 TSecr=3546038
  189 7.774967675  10.6.15.144 → 192.168.1.16 SSH 1514 Server: Encrypted packet (len=1448)
  190 7.776844427  10.6.15.144 → 192.168.1.16 TCP 66 22 → 59298 [ACK] Seq=111797 Ack=4301 Win=1452 Len=0 TSval=3546039 TSecr=2949723
  191 7.777210261  10.6.15.144 → 192.168.1.16 SSH 1514 Server: Encrypted packet (len=1448)
  192 7.777220987 192.168.1.16 → 10.6.15.144  TCP 66 59298 → 22 [ACK] Seq=4301 Ack=113245 Win=1494 Len=0 TSval=2949724 TSecr=3546038
  193 7.777548108  10.6.15.144 → 192.168.1.16 SSH 1514 Server: Encrypted packet (len=1448)
  194 7.777763333  10.6.15.144 → 192.168.1.16 SSH 1514 Server: Encrypted packet (len=1448)
  195 7.777772139 192.168.1.16 → 10.6.15.144  TCP 66 59298 → 22 [ACK] Seq=4301 Ack=116141 Win=1494 Len=0 TSval=2949724 TSecr=3546039
  196 7.778008194  10.6.15.144 → 192.168.1.16 SSH 1514 Server: Encrypted packet (len=1448)
  197 7.780350507  10.6.15.144 → 192.168.1.16 SSH 1514 Server: Encrypted packet (len=1448)
  198 7.780371357 192.168.1.16 → 10.6.15.144  TCP 66 59298 → 22 [ACK] Seq=4301 Ack=119037 Win=1494 Len=0 TSval=2949724 TSecr=3546039
  199 7.780554738  10.6.15.144 → 192.168.1.16 SSH 1514 Server: Encrypted packet (len=1448)
  200 7.780921943  10.6.15.144 → 192.168.1.16 SSH 1514 Server: Encrypted packet (len=1448)
  201 7.780937898 192.168.1.16 → 10.6.15.144  TCP 66 59298 → 22 [ACK] Seq=4301 Ack=121933 Win=1494 Len=0 TSval=2949724 TSecr=3546040
  202 7.781130683  10.6.15.144 → 192.168.1.16 SSH 1514 Server: Encrypted packet (len=1448)
  203 7.781344523  10.6.15.144 → 192.168.1.16 SSH 1514 Server: Encrypted packet (len=1448)
  204 7.781353527 192.168.1.16 → 10.6.15.144  TCP 66 59298 → 22 [ACK] Seq=4301 Ack=124829 Win=1494 Len=0 TSval=2949725 TSecr=3546040
  205 7.781709063  10.6.15.144 → 192.168.1.16 SSH 1514 Server: Encrypted packet (len=1448)
  206 7.785404304  10.6.15.144 → 192.168.1.16 SSH 1514 Server: Encrypted packet (len=1448)
  207 7.785423072 192.168.1.16 → 10.6.15.144  TCP 66 59298 → 22 [ACK] Seq=4301 Ack=127725 Win=1494 Len=0 TSval=2949726 TSecr=3546040
  208 7.785609042  10.6.15.144 → 192.168.1.16 SSH 1514 Server: Encrypted packet (len=1448)
  209 7.785822285  10.6.15.144 → 192.168.1.16 SSH 1514 Server: Encrypted packet (len=1448)
  210 7.785829533 192.168.1.16 → 10.6.15.144  TCP 66 59298 → 22 [ACK] Seq=4301 Ack=130621 Win=1494 Len=0 TSval=2949726 TSecr=3546041
  211 7.788872726  10.6.15.144 → 192.168.1.16 SSH 1514 Server: Encrypted packet (len=1448)
  212 7.789019374  10.6.15.144 → 192.168.1.16 SSH 1098 Server: Encrypted packet (len=1032)
  213 7.789029596 192.168.1.16 → 10.6.15.144  TCP 66 59298 → 22 [ACK] Seq=4301 Ack=133101 Win=1494 Len=0 TSval=2949727 TSecr=3546041
  214 7.791867070 192.168.1.16 → 10.6.15.144  SSH 118 Client: Encrypted packet (len=52)
  215 7.832434967  10.6.15.144 → 192.168.1.16 TCP 66 22 → 59298 [ACK] Seq=133101 Ack=4353 Win=1452 Len=0 TSval=3546053 TSecr=2949727
  216 7.931316002 192.168.1.16 → 10.6.15.144  SSH 110 Client: Encrypted packet (len=44)
  217 7.941850535 192.168.1.16 → 10.6.15.144  SSH 110 Client: Encrypted packet (len=44)
  218 7.943296922 192.168.1.16 → 10.6.15.144  SSH 334 Client: Encrypted packet (len=268)
  219 7.974194022  10.6.15.144 → 192.168.1.16 TCP 66 22 → 59298 [ACK] Seq=133101 Ack=4709 Win=1450 Len=0 TSval=3546088 TSecr=2949762
  220 8.049994004 192.168.1.16 → 10.6.15.144  SSH 102 Client: Encrypted packet (len=36)
  221 8.050769822 192.168.1.16 → 10.6.15.144  SSH 102 Client: Encrypted packet (len=36)
  222 8.064227707 192.168.1.16 → 10.6.15.144  SSH 102 Client: Encrypted packet (len=36)
  223 8.091595850  10.6.15.144 → 192.168.1.16 TCP 66 22 → 59298 [ACK] Seq=133101 Ack=4817 Win=1450 Len=0 TSval=3546118 TSecr=2949792
  224 8.300200914 192.168.1.16 → 10.6.15.144  SSH 102 Client: Encrypted packet (len=36)
  225 8.304307891  10.6.15.144 → 192.168.1.16 TCP 66 22 → 59298 [ACK] Seq=133101 Ack=4853 Win=1450 Len=0 TSval=3546170 TSecr=2949854
  226 8.306594080 192.168.1.16 → 10.6.15.144  SSH 102 Client: Encrypted packet (len=36)
  227 8.309509274 192.168.1.16 → 10.6.15.144  SSH 174 Client: Encrypted packet (len=108)
  228 8.313532349 192.168.1.16 → 10.6.15.144  SSH 102 Client: Encrypted packet (len=36)
  229 8.314388557  10.6.15.144 → 192.168.1.16 TCP 66 22 → 59298 [ACK] Seq=133101 Ack=4889 Win=1450 Len=0 TSval=3546173 TSecr=2949856
  230 8.314409739  10.6.15.144 → 192.168.1.16 TCP 66 22 → 59298 [ACK] Seq=133101 Ack=4997 Win=1450 Len=0 TSval=3546173 TSecr=2949857
  231 8.315701340  10.6.15.144 → 192.168.1.16 TCP 66 22 → 59298 [ACK] Seq=133101 Ack=5033 Win=1450 Len=0 TSval=3546173 TSecr=2949858
  232 8.721014715 192.168.1.16 → 54.76.71.168 TCP 66 42414 → 8282 [ACK] Seq=1 Ack=1 Win=296 Len=0 TSval=2949960 TSecr=607050345
  233 9.714966529 54.76.71.168 → 192.168.1.16 TCP 66 [TCP ACKed unseen segment] 8282 → 42414 [ACK] Seq=1 Ack=2 Win=121 Len=0 TSval=607061937 TSecr=2926726
  234 11.505066825 192.168.1.16 → 23.47.235.27 TCP 66 45742 → 80 [RST, ACK] Seq=1 Ack=1 Win=274 Len=0 TSval=2950656 TSecr=1019053136
  235 12.391048641 192.168.1.16 → 91.189.89.198 NTP 90 NTP Version 4, client
  236 12.391826294 192.168.1.16 → 139.59.21.22 NTP 90 NTP Version 4, client
  237 12.396677238 10.119.73.122 → 192.168.1.16 ICMP 110 Destination unreachable (Communication administratively filtered)
  238 12.463809847 10.22.18.209 → 224.0.0.252  LLMNR 64 Standard query 0x5b60 A wpad
  239 12.563173290 10.22.18.209 → 224.0.0.252  LLMNR 64 Standard query 0x5b60 A wpad
  240 13.715161398  10.6.15.144 → 192.168.1.16 SSH 290 Server: Encrypted packet (len=224)
  241 13.715187677  10.6.15.144 → 192.168.1.16 TCP 290 [TCP Retransmission] 22 → 59298 [PSH, ACK] Seq=133101 Ack=5033 Win=1452 Len=224 TSval=3547430 TSecr=2949858
  242 13.715196935 192.168.1.16 → 10.6.15.144  TCP 78 59298 → 22 [ACK] Seq=5033 Ack=133325 Win=1494 Len=0 TSval=2951208 TSecr=3547430 SLE=133101 SRE=133325
  243 13.715210530  10.6.15.144 → 192.168.1.16 SSH 290 Server: [TCP Spurious Retransmission] , Encrypted packet (len=224)
  244 13.715213772 192.168.1.16 → 10.6.15.144  TCP 78 [TCP Dup ACK 242#1] 59298 → 22 [ACK] Seq=5033 Ack=133325 Win=1494 Len=0 TSval=2951208 TSecr=3547487 SLE=133101 SRE=133325
  245 13.715573804 192.168.1.16 → 10.6.15.144  SSH 166 Client: Encrypted packet (len=100)
  246 13.716210232 192.168.1.16 → 10.6.15.144  SSH 526 Client: Encrypted packet (len=460)
  247 13.716795800  10.6.15.144 → 192.168.1.16 SSH 318 Server: Encrypted packet (len=252)
  248 13.719043883 192.168.1.16 → 10.6.15.144  SSH 670 Client: Encrypted packet (len=604)
  249 13.720105279  10.6.15.144 → 192.168.1.16 TCP 66 22 → 59298 [ACK] Seq=133577 Ack=5133 Win=1452 Len=0 TSval=3547524 TSecr=2951208
  250 13.720118111  10.6.15.144 → 192.168.1.16 TCP 66 22 → 59298 [ACK] Seq=133577 Ack=5593 Win=1452 Len=0 TSval=3547524 TSecr=2951208
  251 13.721358865  10.6.15.144 → 192.168.1.16 TCP 66 22 → 59298 [ACK] Seq=133577 Ack=6197 Win=1452 Len=0 TSval=3547525 TSecr=2951209
  252 13.789121784  10.6.15.144 → 192.168.1.16 SSH 166 Server: Encrypted packet (len=100)
  253 13.793146342  10.6.15.144 → 192.168.1.16 SSH 1514 Server: Encrypted packet (len=1448)
  254 13.793163803 192.168.1.16 → 10.6.15.144  TCP 66 59298 → 22 [ACK] Seq=6197 Ack=135125 Win=1494 Len=0 TSval=2951228 TSecr=3547542
  255 13.793310066  10.6.15.144 → 192.168.1.16 SSH 1310 Server: Encrypted packet (len=1244)
  256 13.796002193  10.6.15.144 → 192.168.1.16 SSH 454 Server: Encrypted packet (len=388)
  257 13.796012363 192.168.1.16 → 10.6.15.144  TCP 66 59298 → 22 [ACK] Seq=6197 Ack=136757 Win=1494 Len=0 TSval=2951228 TSecr=3547542
  258 13.796905586 192.168.1.16 → 10.6.15.144  SSH 206 Client: Encrypted packet (len=140)
  259 13.800702744 192.168.1.16 → 10.6.15.144  SSH 622 Client: Encrypted packet (len=556)
  260 13.800798541  10.6.15.144 → 192.168.1.16 TCP 66 22 → 59298 [ACK] Seq=136757 Ack=6337 Win=1452 Len=0 TSval=3547544 TSecr=2951228
  261 13.805442392  10.6.15.144 → 192.168.1.16 TCP 66 22 → 59298 [ACK] Seq=136757 Ack=6893 Win=1452 Len=0 TSval=3547545 TSecr=2951229
  262 13.873203443  10.6.15.144 → 192.168.1.16 SSH 262 Server: Encrypted packet (len=196)
  263 13.915558935  10.6.15.144 → 192.168.1.16 SSH 110 Server: Encrypted packet (len=44)
  264 13.915575532 192.168.1.16 → 10.6.15.144  TCP 66 59298 → 22 [ACK] Seq=6893 Ack=136997 Win=1494 Len=0 TSval=2951258 TSecr=3547562
  265 13.915826417 192.168.1.16 → 10.6.15.144  SSH 150 Client: Encrypted packet (len=84)
  266 13.925018153  10.6.15.144 → 192.168.1.16 TCP 66 22 → 59298 [ACK] Seq=136997 Ack=6977 Win=1452 Len=0 TSval=3547574 TSecr=2951258
  267 13.980220309  10.6.15.144 → 192.168.1.16 SSH 950 Server: Encrypted packet (len=884)
  268 13.984729913 192.168.1.16 → 10.6.15.144  SSH 102 Client: Encrypted packet (len=36)
  269 13.987315404 192.168.1.16 → 10.6.15.144  SSH 110 Client: Encrypted packet (len=44)
  270 13.989147124  10.6.15.144 → 192.168.1.16 TCP 66 22 → 59298 [ACK] Seq=137881 Ack=7013 Win=1452 Len=0 TSval=3547591 TSecr=2951275
  271 13.991393521  10.6.15.144 → 192.168.1.16 TCP 66 22 → 59298 [ACK] Seq=137881 Ack=7057 Win=1452 Len=0 TSval=3547592 TSecr=2951276
  272 15.391002028 192.168.1.16 → 123.108.200.124 NTP 90 NTP Version 4, client
  273 15.392842496  10.6.15.144 → 192.168.1.16 SSH 910 Server: Encrypted packet (len=844)
  274 15.392878596  10.6.15.144 → 192.168.1.16 SSH 462 Server: Encrypted packet (len=396)
  275 15.392900265  10.6.15.144 → 192.168.1.16 SSH 182 Server: Encrypted packet (len=116)
  276 15.392917029 192.168.1.16 → 10.6.15.144  TCP 66 59298 → 22 [ACK] Seq=7057 Ack=139237 Win=1494 Len=0 TSval=2951627 TSecr=3547653
  277 15.392967814  10.6.15.144 → 192.168.1.16 SSH 454 Server: Encrypted packet (len=388)
  278 15.393873065 192.168.1.16 → 10.6.15.144  SSH 206 Client: Encrypted packet (len=140)
  279 15.395399820  10.6.15.144 → 192.168.1.16 SSH 526 Server: Encrypted packet (len=460)
  280 15.395415988  10.6.15.144 → 192.168.1.16 SSH 158 Server: Encrypted packet (len=92)
  281 15.395461643 192.168.1.16 → 10.6.15.144  TCP 66 59298 → 22 [ACK] Seq=7197 Ack=140177 Win=1494 Len=0 TSval=2951628 TSecr=3547656
  282 15.395478625  10.6.15.144 → 192.168.1.16 SSH 478 Server: Encrypted packet (len=412)
  283 15.395702037  10.6.15.144 → 192.168.1.16 SSH 1514 Server: Encrypted packet (len=1448)
  284 15.395709327 192.168.1.16 → 10.6.15.144  TCP 66 59298 → 22 [ACK] Seq=7197 Ack=142037 Win=1494 Len=0 TSval=2951628 TSecr=3547657
  285 15.395877656  10.6.15.144 → 192.168.1.16 TCP 1422 [TCP Out-Of-Order] 22 → 59298 [PSH, ACK] Seq=137881 Ack=7057 Win=1452 Len=1356 TSval=3547759 TSecr=2951276
  286 15.395883485 192.168.1.16 → 10.6.15.144  TCP 78 [TCP Dup ACK 284#1] 59298 → 22 [ACK] Seq=7197 Ack=142037 Win=1494 Len=0 TSval=2951628 TSecr=3547657 SLE=137881 SRE=139237
  287 15.396253901 192.168.1.16 → 10.6.15.144  SSH 206 Client: Encrypted packet (len=140)
  288 15.397588672  10.6.15.144 → 192.168.1.16 TCP 1422 [TCP Out-Of-Order] 22 → 59298 [PSH, ACK] Seq=137881 Ack=7057 Win=1452 Len=1356 TSval=3547923 TSecr=2951276
  289 15.397604036 192.168.1.16 → 10.6.15.144  TCP 78 [TCP Dup ACK 284#2] 59298 → 22 [ACK] Seq=7337 Ack=142037 Win=1494 Len=0 TSval=2951629 TSecr=3547657 SLE=137881 SRE=139237
  290 15.397777397  10.6.15.144 → 192.168.1.16 SSH 1514 Server: Encrypted packet (len=1448)
  291 15.397783435 192.168.1.16 → 10.6.15.144  TCP 66 59298 → 22 [ACK] Seq=7337 Ack=143485 Win=1494 Len=0 TSval=2951629 TSecr=3547944
  292 15.397967555  10.6.15.144 → 192.168.1.16 SSH 1514 Server: Encrypted packet (len=1448)
  293 15.397972339 192.168.1.16 → 10.6.15.144  TCP 66 59298 → 22 [ACK] Seq=7337 Ack=144933 Win=1494 Len=0 TSval=2951629 TSecr=3547944
  294 15.397978714  10.6.15.144 → 192.168.1.16 SSH 78 Server: Encrypted packet (len=12)
  295 15.397983852 192.168.1.16 → 10.6.15.144  SSH 206 Client: Encrypted packet (len=140)
  296 15.398617094 192.168.1.16 → 10.6.15.144  SSH 206 Client: Encrypted packet (len=140)
  297 15.398846866 192.168.1.16 → 10.6.15.144  SSH 206 Client: Encrypted packet (len=140)
  298 15.400072055  10.6.15.144 → 192.168.1.16 TCP 66 22 → 59298 [ACK] Seq=144945 Ack=7477 Win=1452 Len=0 TSval=3547945 TSecr=2951628
  299 15.400079074 192.168.1.16 → 10.6.15.144  SSH 206 Client: Encrypted packet (len=140)
  300 15.400525184  10.6.15.144 → 192.168.1.16 TCP 66 22 → 59298 [ACK] Seq=144945 Ack=7757 Win=1452 Len=0 TSval=3547945 TSecr=2951629
  301 15.400533278 192.168.1.16 → 10.6.15.144  SSH 206 Client: Encrypted packet (len=140)
  302 15.402225701 192.168.1.16 → 10.6.15.144  SSH 206 Client: Encrypted packet (len=140)
  303 15.403003910 192.168.1.16 → 10.6.15.144  SSH 206 Client: Encrypted packet (len=140)
  304 15.403102075  10.6.15.144 → 192.168.1.16 TCP 66 22 → 59298 [ACK] Seq=144945 Ack=8037 Win=1452 Len=0 TSval=3547945 TSecr=2951629
  305 15.404003834 192.168.1.16 → 10.6.15.144  SSH 206 Client: Encrypted packet (len=140)
  306 15.404773984 192.168.1.16 → 10.6.15.144  SSH 346 Client: Encrypted packet (len=280)
  307 15.406153511  10.6.15.144 → 192.168.1.16 TCP 66 22 → 59298 [ACK] Seq=144945 Ack=8317 Win=1452 Len=0 TSval=3547946 TSecr=2951630
  308 15.406161287 192.168.1.16 → 10.6.15.144  SSH 206 Client: Encrypted packet (len=140)
  309 15.407138477  10.6.15.144 → 192.168.1.16 TCP 66 22 → 59298 [ACK] Seq=144945 Ack=8737 Win=1452 Len=0 TSval=3547946 TSecr=2951630
  310 15.417510062 192.168.1.16 → 10.6.15.144  SSH 174 Client: Encrypted packet (len=108)
  311 15.417719049 192.168.1.16 → 10.6.15.144  SSH 150 Client: Encrypted packet (len=84)
  312 15.417918772 192.168.1.16 → 10.6.15.144  SSH 478 Client: Encrypted packet (len=412)
  313 15.421032925  10.6.15.144 → 192.168.1.16 TCP 66 22 → 59298 [ACK] Seq=144945 Ack=8985 Win=1452 Len=0 TSval=3547950 TSecr=2951631
  314 15.421057111 192.168.1.16 → 10.6.15.144  SSH 1514 Client: Encrypted packet (len=1448)
  315 15.421072415 192.168.1.16 → 10.6.15.144  SSH 1514 Client: Encrypted packet (len=1448)
  316 15.421169424  10.6.15.144 → 192.168.1.16 TCP 66 22 → 59298 [ACK] Seq=144945 Ack=9481 Win=1452 Len=0 TSval=3547950 TSecr=2951634
  317 15.422361098 192.168.1.16 → 10.6.15.144  SSH 1514 Client: Encrypted packet (len=1448)
  318 15.422883972 192.168.1.16 → 10.6.15.144  SSH 1314 Client: Encrypted packet (len=1248)
  319 15.427135162  10.6.15.144 → 192.168.1.16 TCP 66 22 → 59298 [ACK] Seq=144945 Ack=12377 Win=1452 Len=0 TSval=3547951 TSecr=2951635
  320 15.428554965  10.6.15.144 → 192.168.1.16 TCP 66 22 → 59298 [ACK] Seq=144945 Ack=15073 Win=1452 Len=0 TSval=3547951 TSecr=2951635
  321 15.493124104  10.6.15.144 → 192.168.1.16 SSH 150 Server: Encrypted packet (len=84)
  322 15.493503622  10.6.15.144 → 192.168.1.16 SSH 878 Server: Encrypted packet (len=812)
  323 15.493530577 192.168.1.16 → 10.6.15.144  TCP 66 59298 → 22 [ACK] Seq=15073 Ack=145841 Win=1494 Len=0 TSval=2951653 TSecr=3547967
  324 15.511150692  10.6.15.144 → 192.168.1.16 SSH 446 Server: Encrypted packet (len=380)
  325 15.512114358 192.168.1.16 → 10.6.15.144  SSH 206 Client: Encrypted packet (len=140)
  326 15.515251928 192.168.1.16 → 10.6.15.144  SSH 806 Client: Encrypted packet (len=740)
  327 15.533059363 192.168.1.16 → 10.6.15.144  TCP 806 [TCP Retransmission] 59298 → 22 [PSH, ACK] Seq=15213 Ack=146221 Win=1494 Len=740 TSval=2951663 TSecr=3547969
  328 15.601064805 192.168.1.16 → 216.58.197.34 TCP 66 33712 → 80 [ACK] Seq=1 Ack=1 Win=229 Len=0 TSval=2951680 TSecr=1019075974
  329 15.601082677 192.168.1.16 → 216.58.197.34 TCP 66 33710 → 80 [ACK] Seq=1 Ack=1 Win=229 Len=0 TSval=2951680 TSecr=1019075974
  330 15.601085467 192.168.1.16 → 104.18.58.29 TCP 66 43030 → 80 [RST, ACK] Seq=1 Ack=1 Win=229 Len=0 TSval=2951680 TSecr=1019053507
  331 15.601087052 192.168.1.16 → 104.18.58.29 TCP 66 43028 → 80 [RST, ACK] Seq=1 Ack=1 Win=229 Len=0 TSval=2951680 TSecr=1019053503
  332 15.601088537 192.168.1.16 → 104.28.26.124 TCP 66 47168 → 80 [RST, ACK] Seq=1 Ack=1 Win=229 Len=0 TSval=2951680 TSecr=1019053503
  333 15.629307920  10.6.15.144 → 192.168.1.16 TCP 78 [TCP Dup ACK 320#1] 22 → 59298 [ACK] Seq=146221 Ack=15073 Win=1452 Len=0 TSval=3548001 TSecr=2951635 SLE=15213 SRE=15953
  334 15.709051450  10.6.15.144 → 192.168.1.16 SSH 122 Server: Encrypted packet (len=44)
  335 15.709371658 192.168.1.16 → 10.6.15.144  SSH 150 Client: Encrypted packet (len=84)
  336 15.721209765  10.6.15.144 → 192.168.1.16 TCP 78 [TCP Dup ACK 320#2] 22 → 59298 [ACK] Seq=146265 Ack=15073 Win=1452 Len=0 TSval=3548023 TSecr=2951635 SLE=15213 SRE=16037
  337 15.745046975 192.168.1.16 → 10.6.15.144  TCP 206 [TCP Retransmission] 59298 → 22 [PSH, ACK] Seq=15073 Ack=146265 Win=1494 Len=140 TSval=2951716 TSecr=3548023
  338 16.177021039 192.168.1.16 → 10.6.15.144  TCP 206 [TCP Retransmission] 59298 → 22 [PSH, ACK] Seq=15073 Ack=146265 Win=1494 Len=140 TSval=2951824 TSecr=3548023
  339 16.178712930  10.6.15.144 → 192.168.1.16 SSH 362 Server: Encrypted packet (len=284)
  340 16.178741851  10.6.15.144 → 192.168.1.16 SSH 330 Server: Encrypted packet (len=252)
  341 16.178783898  10.6.15.144 → 192.168.1.16 SSH 330 Server: Encrypted packet (len=252)
  342 16.178792308 192.168.1.16 → 10.6.15.144  TCP 66 59298 → 22 [ACK] Seq=16037 Ack=146801 Win=1494 Len=0 TSval=2951824 TSecr=3548072
  343 16.186341060  10.6.15.144 → 192.168.1.16 SSH 582 Server: Encrypted packet (len=504)
  344 16.186416940 192.168.1.16 → 10.6.15.144  TCP 66 59298 → 22 [ACK] Seq=16037 Ack=147557 Win=1494 Len=0 TSval=2951826 TSecr=3548076
  345 16.186604130  10.6.15.144 → 192.168.1.16 SSH 1514 Server: Encrypted packet (len=1436)
  346 16.186821115  10.6.15.144 → 192.168.1.16 SSH 1414 Server: Encrypted packet (len=1336)
  347 16.186833061 192.168.1.16 → 10.6.15.144  TCP 66 59298 → 22 [ACK] Seq=16037 Ack=150329 Win=1494 Len=0 TSval=2951826 TSecr=3548078
  348 16.187058667  10.6.15.144 → 192.168.1.16 SSH 1490 Server: Encrypted packet (len=1412)
  349 16.206698188  10.6.15.144 → 192.168.1.16 TCP 66 22 → 59298 [ACK] Seq=151741 Ack=16037 Win=1451 Len=0 TSval=3548146 TSecr=2951824
  350 16.207040761  10.6.15.144 → 192.168.1.16 SSH 1514 Server: Encrypted packet (len=1448)
  351 16.207050470 192.168.1.16 → 10.6.15.144  TCP 66 59298 → 22 [ACK] Seq=16037 Ack=153189 Win=1494 Len=0 TSval=2951831 TSecr=3548079
  352 16.207868320  10.6.15.144 → 192.168.1.16 SSH 1490 Server: Encrypted packet (len=1424)
  353 16.208028355 192.168.1.16 → 10.6.15.144  SSH 558 Client: Encrypted packet (len=492)
  354 16.208061279  10.6.15.144 → 192.168.1.16 SSH 1514 Server: Encrypted packet (len=1448)
  355 16.208392907  10.6.15.144 → 192.168.1.16 SSH 1490 Server: Encrypted packet (len=1424)
  356 16.208403013 192.168.1.16 → 10.6.15.144  TCP 66 59298 → 22 [ACK] Seq=16529 Ack=157485 Win=1494 Len=0 TSval=2951831 TSecr=3548146
  357 16.208583383  10.6.15.144 → 192.168.1.16 SSH 1514 Server: Encrypted packet (len=1448)
  358 16.208770611  10.6.15.144 → 192.168.1.16 SSH 1490 Server: Encrypted packet (len=1424)
  359 16.208777771 192.168.1.16 → 10.6.15.144  TCP 66 59298 → 22 [ACK] Seq=16529 Ack=160357 Win=1494 Len=0 TSval=2951831 TSecr=3548146
  360 16.209863465  10.6.15.144 → 192.168.1.16 SSH 1514 Server: Encrypted packet (len=1448)
  361 16.210042005  10.6.15.144 → 192.168.1.16 SSH 1490 Server: Encrypted packet (len=1424)
  362 16.210050079 192.168.1.16 → 10.6.15.144  TCP 66 59298 → 22 [ACK] Seq=16529 Ack=163229 Win=1494 Len=0 TSval=2951832 TSecr=3548147
  363 16.212035031  10.6.15.144 → 192.168.1.16 SSH 1514 Server: Encrypted packet (len=1448)
  364 16.212210955  10.6.15.144 → 192.168.1.16 SSH 1490 Server: Encrypted packet (len=1424)
  365 16.212217352 192.168.1.16 → 10.6.15.144  TCP 66 59298 → 22 [ACK] Seq=16529 Ack=166101 Win=1494 Len=0 TSval=2951832 TSecr=3548147
  366 16.212437230 192.168.1.16 → 10.6.15.144  SSH 206 Client: Encrypted packet (len=140)
  367 16.215713167  10.6.15.144 → 192.168.1.16 SSH 1514 Server: Encrypted packet (len=1448)
  368 16.215897326  10.6.15.144 → 192.168.1.16 SSH 1490 Server: Encrypted packet (len=1424)
  369 16.215912535 192.168.1.16 → 10.6.15.144  TCP 66 59298 → 22 [ACK] Seq=16669 Ack=168973 Win=1494 Len=0 TSval=2951833 TSecr=3548147
