    1 0.000000000 192.168.1.16 → 192.168.1.1  DNS 81 Standard query 0x632f A 2.ubuntu.pool.ntp.org
    2 0.001668652  10.6.15.144 → 192.168.1.16 SSH 102 Server: Encrypted packet (len=36)
    3 0.001704836  10.6.15.144 → 192.168.1.16 SSH 102 Server: Encrypted packet (len=36)
    4 0.001715934  10.6.15.144 → 192.168.1.16 SSH 102 Server: Encrypted packet (len=36)
    5 0.001725187  10.6.15.144 → 192.168.1.16 SSH 102 Server: Encrypted packet (len=36)
    6 0.001759099 192.168.1.16 → 10.6.15.144  TCP 66 59298 → 22 [ACK] Seq=1 Ack=145 Win=1494 Len=0 TSval=2978628 TSecr=3574749
    7 0.001834333  10.6.15.144 → 192.168.1.16 SSH 102 Server: [TCP Spurious Retransmission] , Encrypted packet (len=36)
    8 0.001841094 192.168.1.16 → 10.6.15.144  TCP 78 [TCP Dup ACK 6#1] 59298 → 22 [ACK] Seq=1 Ack=145 Win=1494 Len=0 TSval=2978628 TSecr=3574790 SLE=109 SRE=145
    9 0.001862719  10.6.15.144 → 192.168.1.16 SSH 138 Server: Encrypted packet (len=72)
   10 0.001867185 192.168.1.16 → 10.6.15.144  TCP 66 59298 → 22 [ACK] Seq=1 Ack=217 Win=1494 Len=0 TSval=2978628 TSecr=3574831
   11 0.001880895  10.6.15.144 → 192.168.1.16 SSH 138 Server: Encrypted packet (len=72)
   12 0.001883065 192.168.1.16 → 10.6.15.144  TCP 66 59298 → 22 [ACK] Seq=1 Ack=289 Win=1494 Len=0 TSval=2978628 TSecr=3574831
   13 0.002107846 192.168.1.16 → 10.6.15.144  SSH 138 Client: Encrypted packet (len=72)
   14 0.002210803  10.6.15.144 → 192.168.1.16 SSH 1126 Server: Encrypted packet (len=1060)
   15 0.002663639 192.168.1.16 → 10.6.15.144  SSH 482 Client: Encrypted packet (len=416)
   16 0.002961930 192.168.1.16 → 10.6.15.144  SSH 954 Client: Encrypted packet (len=888)
   17 0.005810365 192.168.1.16 → 10.6.15.144  SSH 1302 Client: Encrypted packet (len=1236)
   18 0.005899041  192.168.1.1 → 192.168.1.16 DNS 145 Standard query response 0x632f A 2.ubuntu.pool.ntp.org A 139.59.21.22 A 139.59.50.38 A 123.108.200.124 A 13.126.37.14
   19 0.005917317  10.6.15.144 → 192.168.1.16 TCP 66 22 → 59298 [ACK] Seq=1349 Ack=489 Win=1452 Len=0 TSval=3574945 TSecr=2978628
   20 0.006349078 192.168.1.16 → 139.59.21.22 NTP 90 NTP Version 4, client
   21 0.009139325  10.6.15.144 → 192.168.1.16 TCP 66 22 → 59298 [ACK] Seq=1349 Ack=2613 Win=1452 Len=0 TSval=3574946 TSecr=2978628
   22 0.737082639 192.168.1.16 → 10.6.15.144  SSH 1414 Client: Encrypted packet (len=1348)
   23 0.739380740  10.6.15.144 → 192.168.1.16 SSH 1514 Server: Encrypted packet (len=1448)
   24 0.739960152  10.6.15.144 → 192.168.1.16 SSH 1318 Server: Encrypted packet (len=1252)
   25 0.739970626 192.168.1.16 → 10.6.15.144  TCP 66 59298 → 22 [ACK] Seq=3961 Ack=4049 Win=1494 Len=0 TSval=2978812 TSecr=3574997
   26 0.740149917  10.6.15.144 → 192.168.1.16 SSH 518 Server: Encrypted packet (len=452)
   27 0.740222068  10.6.15.144 → 192.168.1.16 SSH 510 Server: Encrypted packet (len=444)
   28 0.740245192  10.6.15.144 → 192.168.1.16 SSH 206 Server: Encrypted packet (len=140)
   29 0.740272759  10.6.15.144 → 192.168.1.16 SSH 166 Server: Encrypted packet (len=100)
   30 0.740273195 192.168.1.16 → 10.6.15.144  TCP 66 59298 → 22 [ACK] Seq=3961 Ack=5085 Win=1494 Len=0 TSval=2978813 TSecr=3574998
   31 0.740439754  10.6.15.144 → 192.168.1.16 SSH 910 Server: Encrypted packet (len=844)
   32 0.740468642 192.168.1.16 → 10.6.15.144  TCP 66 59298 → 22 [ACK] Seq=3961 Ack=6029 Win=1494 Len=0 TSval=2978813 TSecr=3575072
   33 0.741133161 192.168.1.16 → 10.6.15.144  SSH 238 Client: Encrypted packet (len=172)
   34 0.742158564 192.168.1.16 → 10.6.15.144  SSH 222 Client: Encrypted packet (len=156)
   35 0.743117689 192.168.1.16 → 10.6.15.144  SSH 222 Client: Encrypted packet (len=156)
   36 0.744303075  10.6.15.144 → 192.168.1.16 SSH 1514 Server: Encrypted packet (len=1448)
   37 0.744458976  10.6.15.144 → 192.168.1.16 SSH 1210 Server: Encrypted packet (len=1144)
   38 0.744467253 192.168.1.16 → 10.6.15.144  TCP 66 59298 → 22 [ACK] Seq=4445 Ack=8621 Win=1494 Len=0 TSval=2978814 TSecr=3575129
   39 0.744595225  10.6.15.144 → 192.168.1.16 TCP 66 22 → 59298 [ACK] Seq=8621 Ack=4289 Win=1452 Len=0 TSval=3575129 TSecr=2978813
   40 0.744792102 192.168.1.16 → 10.6.15.144  SSH 102 Client: Encrypted packet (len=36)
   41 0.745531133 192.168.1.16 → 10.6.15.144  SSH 134 Client: Encrypted packet (len=68)
   42 0.746971913 192.168.1.16 → 10.6.15.144  SSH 134 Client: Encrypted packet (len=68)
   43 0.748289249  10.6.15.144 → 192.168.1.16 TCP 66 22 → 59298 [ACK] Seq=8621 Ack=4481 Win=1452 Len=0 TSval=3575130 TSecr=2978813
   44 0.748298322 192.168.1.16 → 10.6.15.144  SSH 134 Client: Encrypted packet (len=68)
   45 0.748935058  10.6.15.144 → 192.168.1.16 TCP 66 22 → 59298 [ACK] Seq=8621 Ack=4617 Win=1452 Len=0 TSval=3575131 TSecr=2978814
   46 0.750168163 192.168.1.16 → 10.6.15.144  SSH 206 Client: Encrypted packet (len=140)
   47 0.752354821  10.6.15.144 → 192.168.1.16 TCP 66 22 → 59298 [ACK] Seq=8621 Ack=4825 Win=1452 Len=0 TSval=3575131 TSecr=2978815
   48 0.752602586 192.168.1.16 → 10.6.15.144  SSH 198 Client: Encrypted packet (len=132)
   49 0.797408724  10.6.15.144 → 192.168.1.16 TCP 66 22 → 59298 [ACK] Seq=8621 Ack=4957 Win=1452 Len=0 TSval=3575142 TSecr=2978816
   50 0.844705170 10.22.18.209 → 224.0.0.252  LLMNR 64 Standard query 0x614d A wpad
   51 0.847932240  10.6.15.144 → 192.168.1.16 SSH 838 Server: Encrypted packet (len=772)
   52 0.849498240  10.6.15.144 → 192.168.1.16 SSH 398 Server: Encrypted packet (len=332)
   53 0.849508536  10.6.15.144 → 192.168.1.16 SSH 134 Server: Encrypted packet (len=68)
   54 0.849538311 192.168.1.16 → 10.6.15.144  TCP 66 59298 → 22 [ACK] Seq=4957 Ack=9793 Win=1494 Len=0 TSval=2978840 TSecr=3575155
   55 0.849882772 192.168.1.16 → 10.6.15.144  SSH 134 Client: Encrypted packet (len=68)
   56 0.852249890  10.6.15.144 → 192.168.1.16 TCP 66 22 → 59298 [ACK] Seq=9793 Ack=5025 Win=1452 Len=0 TSval=3575156 TSecr=2978840
   57 0.917893552  10.6.15.144 → 192.168.1.16 SSH 286 Server: Encrypted packet (len=220)
   58 0.920125096 192.168.1.16 → 10.6.15.144  SSH 102 Client: Encrypted packet (len=36)
   59 0.922762722 192.168.1.16 → 10.6.15.144  SSH 1514 Client: Encrypted packet (len=1448)
   60 0.923988323 192.168.1.16 → 10.6.15.144  SSH 374 Client: Encrypted packet (len=308)
   61 0.925231980 192.168.1.16 → 10.6.15.144  SSH 102 Client: Encrypted packet (len=36)
   62 0.926940542  10.6.15.144 → 192.168.1.16 TCP 66 22 → 59298 [ACK] Seq=10013 Ack=5061 Win=1452 Len=0 TSval=3575175 TSecr=2978857
   63 0.926953373 192.168.1.16 → 10.6.15.144  SSH 110 Client: Encrypted packet (len=44)
   64 0.926964663  10.6.15.144 → 192.168.1.16 TCP 66 22 → 59298 [ACK] Seq=10013 Ack=6817 Win=1452 Len=0 TSval=3575175 TSecr=2978858
   65 0.928267895  10.6.15.144 → 192.168.1.16 SSH 166 Server: Encrypted packet (len=100)
   66 0.928276086  10.6.15.144 → 192.168.1.16 TCP 66 22 → 59298 [ACK] Seq=10113 Ack=6897 Win=1452 Len=0 TSval=3575176 TSecr=2978859
   67 0.928455556  10.6.15.144 → 192.168.1.16 SSH 138 Server: Encrypted packet (len=72)
   68 0.928481907 192.168.1.16 → 10.6.15.144  TCP 66 59298 → 22 [ACK] Seq=6897 Ack=10185 Win=1494 Len=0 TSval=2978860 TSecr=3575176
   69 0.928612562 192.168.1.16 → 10.6.15.144  SSH 102 Client: Encrypted packet (len=36)
   70 0.929037158  10.6.15.144 → 192.168.1.16 SSH 138 Server: Encrypted packet (len=72)
   71 0.929212246 192.168.1.16 → 10.6.15.144  SSH 102 Client: Encrypted packet (len=36)
   72 0.934021519  10.6.15.144 → 192.168.1.16 TCP 66 22 → 59298 [ACK] Seq=10257 Ack=6969 Win=1452 Len=0 TSval=3575176 TSecr=2978860
   73 0.934133742  10.6.15.144 → 192.168.1.16 SSH 158 Server: Encrypted packet (len=92)
   74 0.945567894 10.22.18.209 → 224.0.0.252  LLMNR 64 Standard query 0x614d A wpad
   75 0.950615947  10.6.15.144 → 192.168.1.16 SSH 358 Server: Encrypted packet (len=292)
   76 0.950673598 192.168.1.16 → 10.6.15.144  TCP 66 59298 → 22 [ACK] Seq=6969 Ack=10641 Win=1494 Len=0 TSval=2978865 TSecr=3575176
   77 0.953324433  10.6.15.144 → 192.168.1.16 SSH 138 Server: Encrypted packet (len=72)
   78 0.953557613 192.168.1.16 → 10.6.15.144  SSH 102 Client: Encrypted packet (len=36)
   79 0.957585997  10.6.15.144 → 192.168.1.16 SSH 342 Server: Encrypted packet (len=276)
   80 0.957628128  10.6.15.144 → 192.168.1.16 SSH 342 Server: Encrypted packet (len=276)
   81 0.957642830 192.168.1.16 → 10.6.15.144  TCP 66 59298 → 22 [ACK] Seq=7005 Ack=11265 Win=1494 Len=0 TSval=2978867 TSecr=3575182
   82 0.992426062  10.6.15.144 → 192.168.1.16 SSH 110 Server: Encrypted packet (len=44)
   83 0.992769235 192.168.1.16 → 10.6.15.144  SSH 310 Client: Encrypted packet (len=244)
   84 0.995909267  10.6.15.144 → 192.168.1.16 SSH 126 Server: Encrypted packet (len=60)
   85 0.995932901  10.6.15.144 → 192.168.1.16 SSH 174 Server: Encrypted packet (len=108)
   86 0.995979684 192.168.1.16 → 10.6.15.144  TCP 66 59298 → 22 [ACK] Seq=7249 Ack=11477 Win=1494 Len=0 TSval=2978876 TSecr=3575192
   87 0.996040847  10.6.15.144 → 192.168.1.16 SSH 126 Server: Encrypted packet (len=60)
   88 0.996064627  10.6.15.144 → 192.168.1.16 SSH 138 Server: Encrypted packet (len=72)
   89 0.996136980  10.6.15.144 → 192.168.1.16 SSH 434 Server: Encrypted packet (len=368)
   90 0.996210367  10.6.15.144 → 192.168.1.16 SSH 466 Server: Encrypted packet (len=400)
   91 0.996211581 192.168.1.16 → 10.6.15.144  TCP 66 59298 → 22 [ACK] Seq=7249 Ack=11977 Win=1494 Len=0 TSval=2978877 TSecr=3575192
   92 0.996222317 192.168.1.16 → 10.6.15.144  SSH 102 Client: Encrypted packet (len=36)
   93 0.996246872  10.6.15.144 → 192.168.1.16 SSH 210 Server: Encrypted packet (len=144)
   94 0.996776866 192.168.1.16 → 10.6.15.144  SSH 498 Client: Encrypted packet (len=432)
   95 0.997458692 192.168.1.16 → 10.6.15.144  SSH 506 Client: Encrypted packet (len=440)
   96 0.997925506  10.6.15.144 → 192.168.1.16 SSH 174 Server: Encrypted packet (len=108)
   97 0.998048827 192.168.1.16 → 10.6.15.144  SSH 102 Client: Encrypted packet (len=36)
   98 0.998266244 192.168.1.16 → 10.6.15.144  SSH 310 Client: Encrypted packet (len=244)
   99 0.999479866  10.6.15.144 → 192.168.1.16 TCP 66 22 → 59298 [ACK] Seq=12629 Ack=7717 Win=1452 Len=0 TSval=3575193 TSecr=2978877
  100 0.999614523  10.6.15.144 → 192.168.1.16 TCP 66 22 → 59298 [ACK] Seq=12629 Ack=8193 Win=1452 Len=0 TSval=3575193 TSecr=2978877
  101 1.031093613  10.6.15.144 → 192.168.1.16 SSH 118 Server: Encrypted packet (len=52)
  102 1.031120704  10.6.15.144 → 192.168.1.16 SSH 138 Server: Encrypted packet (len=72)
  103 1.031176417 192.168.1.16 → 10.6.15.144  TCP 66 59298 → 22 [ACK] Seq=8437 Ack=12753 Win=1494 Len=0 TSval=2978885 TSecr=3575201
  104 1.031355460 192.168.1.16 → 10.6.15.144  SSH 102 Client: Encrypted packet (len=36)
  105 1.072671225  10.6.15.144 → 192.168.1.16 SSH 222 Server: Encrypted packet (len=156)
  106 1.072696742  10.6.15.144 → 192.168.1.16 SSH 166 Server: Encrypted packet (len=100)
  107 1.072753820 192.168.1.16 → 10.6.15.144  TCP 66 59298 → 22 [ACK] Seq=8473 Ack=13009 Win=1494 Len=0 TSval=2978896 TSecr=3575211
  108 1.072974511  10.6.15.144 → 192.168.1.16 SSH 166 Server: Encrypted packet (len=100)
  109 1.072995019  10.6.15.144 → 192.168.1.16 SSH 134 Server: Encrypted packet (len=68)
  110 1.073021182 192.168.1.16 → 10.6.15.144  TCP 66 59298 → 22 [ACK] Seq=8473 Ack=13177 Win=1494 Len=0 TSval=2978896 TSecr=3575211
  111 1.073029690 192.168.1.16 → 10.6.15.144  SSH 134 Client: Encrypted packet (len=68)
  112 1.074378429 192.168.1.16 → 10.6.15.144  SSH 134 Client: Encrypted packet (len=68)
  113 1.075624507 192.168.1.16 → 10.6.15.144  SSH 134 Client: Encrypted packet (len=68)
  114 1.078235652 192.168.1.16 → 10.6.15.144  SSH 894 Client: Encrypted packet (len=828)
  115 1.085516818  10.6.15.144 → 192.168.1.16 TCP 66 22 → 59298 [ACK] Seq=13177 Ack=8609 Win=1452 Len=0 TSval=3575212 TSecr=2978896
  116 1.088448156  10.6.15.144 → 192.168.1.16 SSH 166 Server: Encrypted packet (len=100)
  117 1.088742429 192.168.1.16 → 10.6.15.144  SSH 134 Client: Encrypted packet (len=68)
  118 1.095649891  10.6.15.144 → 192.168.1.16 TCP 66 22 → 59298 [ACK] Seq=13277 Ack=9573 Win=1452 Len=0 TSval=3575216 TSecr=2978897
  119 1.136025762  10.6.15.144 → 192.168.1.16 SSH 206 Server: Encrypted packet (len=140)
  120 1.136341585 192.168.1.16 → 10.6.15.144  SSH 134 Client: Encrypted packet (len=68)
  121 1.142958463  10.6.15.144 → 192.168.1.16 SSH 138 Server: Encrypted packet (len=72)
  122 1.143164223 192.168.1.16 → 10.6.15.144  SSH 102 Client: Encrypted packet (len=36)
  123 1.145014953  10.6.15.144 → 192.168.1.16 SSH 166 Server: Encrypted packet (len=100)
  124 1.145290298 192.168.1.16 → 10.6.15.144  SSH 134 Client: Encrypted packet (len=68)
  125 1.152426338  10.6.15.144 → 192.168.1.16 TCP 66 22 → 59298 [ACK] Seq=13589 Ack=9745 Win=1452 Len=0 TSval=3575230 TSecr=2978913
  126 1.211769667  10.6.15.144 → 192.168.1.16 SSH 166 Server: Encrypted packet (len=100)
  127 1.212046881 192.168.1.16 → 10.6.15.144  SSH 134 Client: Encrypted packet (len=68)
  128 1.257832277  10.6.15.144 → 192.168.1.16 TCP 66 22 → 59298 [ACK] Seq=13689 Ack=9813 Win=1452 Len=0 TSval=3575257 TSecr=2978930
  129 2.322852261  10.6.15.144 → 192.168.1.16 SSH 1514 Server: Encrypted packet (len=1448)
  130 2.323086191  10.6.15.144 → 192.168.1.16 SSH 1514 Server: Encrypted packet (len=1448)
  131 2.323094640 192.168.1.16 → 10.6.15.144  TCP 66 59298 → 22 [ACK] Seq=9813 Ack=16585 Win=1494 Len=0 TSval=2979208 TSecr=3575285
  132 2.323327998  10.6.15.144 → 192.168.1.16 SSH 1514 Server: Encrypted packet (len=1448)
  133 2.323342098  10.6.15.144 → 192.168.1.16 SSH 414 Server: Encrypted packet (len=348)
  134 2.323346478 192.168.1.16 → 10.6.15.144  TCP 66 59298 → 22 [ACK] Seq=9813 Ack=18381 Win=1494 Len=0 TSval=2979208 TSecr=3575285
  135 2.323624839  10.6.15.144 → 192.168.1.16 SSH 1514 Server: Encrypted packet (len=1448)
  136 2.323851951  10.6.15.144 → 192.168.1.16 SSH 1514 Server: Encrypted packet (len=1448)
  137 2.323859344 192.168.1.16 → 10.6.15.144  TCP 66 59298 → 22 [ACK] Seq=9813 Ack=21277 Win=1494 Len=0 TSval=2979208 TSecr=3575285
  138 2.324093672  10.6.15.144 → 192.168.1.16 SSH 1514 Server: Encrypted packet (len=1448)
  139 2.324332135  10.6.15.144 → 192.168.1.16 TCP 1514 [TCP Out-Of-Order] 22 → 59298 [ACK] Seq=13689 Ack=9813 Win=1452 Len=1448 TSval=3575380 TSecr=2978930
  140 2.324343873 192.168.1.16 → 10.6.15.144  TCP 78 59298 → 22 [ACK] Seq=9813 Ack=22725 Win=1494 Len=0 TSval=2979209 TSecr=3575297 SLE=13689 SRE=15137
  141 2.331085617  10.6.15.144 → 192.168.1.16 SSH 1514 Server: Encrypted packet (len=1448)
  142 2.331106049 192.168.1.16 → 10.6.15.144  TCP 66 59298 → 22 [ACK] Seq=9813 Ack=24173 Win=1494 Len=0 TSval=2979210 TSecr=3575525
  143 2.331441859  10.6.15.144 → 192.168.1.16 SSH 1514 Server: Encrypted packet (len=1448)
  144 2.331452897 192.168.1.16 → 10.6.15.144  TCP 66 59298 → 22 [ACK] Seq=9813 Ack=25621 Win=1494 Len=0 TSval=2979210 TSecr=3575525
  145 2.331679243  10.6.15.144 → 192.168.1.16 SSH 1514 Server: Encrypted packet (len=1448)
  146 2.331686291 192.168.1.16 → 10.6.15.144  TCP 66 59298 → 22 [ACK] Seq=9813 Ack=27069 Win=1494 Len=0 TSval=2979210 TSecr=3575525
  147 2.331918089  10.6.15.144 → 192.168.1.16 SSH 1514 Server: Encrypted packet (len=1448)
  148 2.331924080 192.168.1.16 → 10.6.15.144  TCP 66 59298 → 22 [ACK] Seq=9813 Ack=28517 Win=1494 Len=0 TSval=2979210 TSecr=3575525
  149 2.332319928  10.6.15.144 → 192.168.1.16 SSH 1514 Server: Encrypted packet (len=1448)
  150 2.332326503 192.168.1.16 → 10.6.15.144  TCP 66 59298 → 22 [ACK] Seq=9813 Ack=29965 Win=1494 Len=0 TSval=2979211 TSecr=3575525
  151 2.332552498  10.6.15.144 → 192.168.1.16 SSH 1514 Server: Encrypted packet (len=1448)
  152 2.332560756 192.168.1.16 → 10.6.15.144  TCP 66 59298 → 22 [ACK] Seq=9813 Ack=31413 Win=1494 Len=0 TSval=2979211 TSecr=3575525
  153 2.340399118  10.6.15.144 → 192.168.1.16 SSH 1514 Server: Encrypted packet (len=1448)
  154 2.340418496 192.168.1.16 → 10.6.15.144  TCP 66 59298 → 22 [ACK] Seq=9813 Ack=32861 Win=1494 Len=0 TSval=2979213 TSecr=3575527
  155 2.340629699  10.6.15.144 → 192.168.1.16 SSH 1514 Server: Encrypted packet (len=1448)
  156 2.340638506 192.168.1.16 → 10.6.15.144  TCP 66 59298 → 22 [ACK] Seq=9813 Ack=34309 Win=1494 Len=0 TSval=2979213 TSecr=3575527
  157 2.340868775  10.6.15.144 → 192.168.1.16 SSH 1514 Server: Encrypted packet (len=1448)
  158 2.340876910 192.168.1.16 → 10.6.15.144  TCP 66 59298 → 22 [ACK] Seq=9813 Ack=35757 Win=1494 Len=0 TSval=2979213 TSecr=3575527
  159 2.341109055  10.6.15.144 → 192.168.1.16 SSH 1514 Server: Encrypted packet (len=1448)
  160 2.341116647 192.168.1.16 → 10.6.15.144  TCP 66 59298 → 22 [ACK] Seq=9813 Ack=37205 Win=1494 Len=0 TSval=2979213 TSecr=3575527
  161 2.341347932  10.6.15.144 → 192.168.1.16 SSH 1514 Server: Encrypted packet (len=1448)
  162 2.341355079 192.168.1.16 → 10.6.15.144  TCP 66 59298 → 22 [ACK] Seq=9813 Ack=38653 Win=1494 Len=0 TSval=2979213 TSecr=3575527
  163 2.341591434  10.6.15.144 → 192.168.1.16 SSH 1514 Server: Encrypted packet (len=1448)
  164 2.341600717 192.168.1.16 → 10.6.15.144  TCP 66 59298 → 22 [ACK] Seq=9813 Ack=40101 Win=1494 Len=0 TSval=2979213 TSecr=3575527
  165 2.341831168 192.168.1.16 → 10.6.15.144  SSH 102 Client: Encrypted packet (len=36)
  166 2.352012123  10.6.15.144 → 192.168.1.16 SSH 1514 Server: Encrypted packet (len=1448)
  167 2.352242822  10.6.15.144 → 192.168.1.16 SSH 1514 Server: Encrypted packet (len=1448)
  168 2.352251668 192.168.1.16 → 10.6.15.144  TCP 66 59298 → 22 [ACK] Seq=9849 Ack=42997 Win=1494 Len=0 TSval=2979216 TSecr=3575529
  169 2.352482532  10.6.15.144 → 192.168.1.16 SSH 1514 Server: Encrypted packet (len=1448)
  170 2.352723177  10.6.15.144 → 192.168.1.16 SSH 1514 Server: Encrypted packet (len=1448)
  171 2.352729281 192.168.1.16 → 10.6.15.144  TCP 66 59298 → 22 [ACK] Seq=9849 Ack=45893 Win=1494 Len=0 TSval=2979216 TSecr=3575529
  172 2.352963554  10.6.15.144 → 192.168.1.16 SSH 1514 Server: Encrypted packet (len=1448)
  173 2.353202873  10.6.15.144 → 192.168.1.16 SSH 1514 Server: Encrypted packet (len=1448)
  174 2.353210584 192.168.1.16 → 10.6.15.144  TCP 66 59298 → 22 [ACK] Seq=9849 Ack=48789 Win=1494 Len=0 TSval=2979216 TSecr=3575529
  175 2.353335507 192.168.1.16 → 10.6.15.144  SSH 174 Client: Encrypted packet (len=108)
  176 2.353597275  10.6.15.144 → 192.168.1.16 SSH 1514 Server: Encrypted packet (len=1448)
  177 2.353835730  10.6.15.144 → 192.168.1.16 SSH 1514 Server: Encrypted packet (len=1448)
  178 2.353841440 192.168.1.16 → 10.6.15.144  TCP 66 59298 → 22 [ACK] Seq=9957 Ack=51685 Win=1494 Len=0 TSval=2979216 TSecr=3575529
  179 2.353850487  10.6.15.144 → 192.168.1.16 TCP 66 22 → 59298 [ACK] Seq=51685 Ack=9849 Win=1452 Len=0 TSval=3575529 TSecr=2979213
  180 2.354316059 192.168.1.16 → 10.6.15.144  SSH 994 Client: Encrypted packet (len=928)
  181 2.354799105 192.168.1.16 → 10.6.15.144  SSH 1126 Client: Encrypted packet (len=1060)
  182 2.366017283  10.6.15.144 → 192.168.1.16 SSH 1514 Server: Encrypted packet (len=1448)
  183 2.366248919  10.6.15.144 → 192.168.1.16 SSH 1514 Server: Encrypted packet (len=1448)
  184 2.366261647 192.168.1.16 → 10.6.15.144  TCP 66 59298 → 22 [ACK] Seq=11945 Ack=54581 Win=1494 Len=0 TSval=2979219 TSecr=3575532
  185 2.366492470  10.6.15.144 → 192.168.1.16 SSH 1514 Server: Encrypted packet (len=1448)
  186 2.366729672  10.6.15.144 → 192.168.1.16 SSH 1514 Server: Encrypted packet (len=1448)
  187 2.366738715 192.168.1.16 → 10.6.15.144  TCP 66 59298 → 22 [ACK] Seq=11945 Ack=57477 Win=1494 Len=0 TSval=2979219 TSecr=3575532
  188 2.366969969  10.6.15.144 → 192.168.1.16 SSH 1514 Server: Encrypted packet (len=1448)
  189 2.367208956  10.6.15.144 → 192.168.1.16 SSH 1514 Server: Encrypted packet (len=1448)
  190 2.367218718 192.168.1.16 → 10.6.15.144  TCP 66 59298 → 22 [ACK] Seq=11945 Ack=60373 Win=1494 Len=0 TSval=2979219 TSecr=3575532
  191 2.367450632  10.6.15.144 → 192.168.1.16 SSH 1514 Server: Encrypted packet (len=1448)
  192 2.367690294  10.6.15.144 → 192.168.1.16 SSH 1514 Server: Encrypted packet (len=1448)
  193 2.367699515 192.168.1.16 → 10.6.15.144  TCP 66 59298 → 22 [ACK] Seq=11945 Ack=63269 Win=1494 Len=0 TSval=2979219 TSecr=3575532
  194 2.367715088  10.6.15.144 → 192.168.1.16 TCP 66 22 → 59298 [ACK] Seq=63269 Ack=11945 Win=1452 Len=0 TSval=3575533 TSecr=2979216
  195 2.377612833  10.6.15.144 → 192.168.1.16 SSH 1514 Server: Encrypted packet (len=1448)
  196 2.377844520  10.6.15.144 → 192.168.1.16 SSH 1514 Server: Encrypted packet (len=1448)
  197 2.377855604 192.168.1.16 → 10.6.15.144  TCP 66 59298 → 22 [ACK] Seq=11945 Ack=66165 Win=1494 Len=0 TSval=2979222 TSecr=3575536
  198 2.378084426  10.6.15.144 → 192.168.1.16 SSH 1514 Server: Encrypted packet (len=1448)
  199 2.378325727  10.6.15.144 → 192.168.1.16 SSH 1514 Server: Encrypted packet (len=1448)
  200 2.378332938 192.168.1.16 → 10.6.15.144  TCP 66 59298 → 22 [ACK] Seq=11945 Ack=69061 Win=1494 Len=0 TSval=2979222 TSecr=3575536
  201 2.378561632  10.6.15.144 → 192.168.1.16 SSH 1514 Server: Encrypted packet (len=1448)
  202 2.378801322  10.6.15.144 → 192.168.1.16 SSH 1514 Server: Encrypted packet (len=1448)
  203 2.378806667 192.168.1.16 → 10.6.15.144  TCP 66 59298 → 22 [ACK] Seq=11945 Ack=71957 Win=1494 Len=0 TSval=2979222 TSecr=3575536
  204 2.379194427  10.6.15.144 → 192.168.1.16 SSH 1514 Server: Encrypted packet (len=1448)
  205 2.379435300  10.6.15.144 → 192.168.1.16 SSH 1514 Server: Encrypted packet (len=1448)
  206 2.379441191 192.168.1.16 → 10.6.15.144  TCP 66 59298 → 22 [ACK] Seq=11945 Ack=74853 Win=1494 Len=0 TSval=2979222 TSecr=3575536
  207 2.388653408  10.6.15.144 → 192.168.1.16 SSH 1514 Server: Encrypted packet (len=1448)
  208 2.388882692  10.6.15.144 → 192.168.1.16 SSH 1514 Server: Encrypted packet (len=1448)
  209 2.388891294 192.168.1.16 → 10.6.15.144  TCP 66 59298 → 22 [ACK] Seq=11945 Ack=77749 Win=1494 Len=0 TSval=2979225 TSecr=3575539
  210 2.389120855  10.6.15.144 → 192.168.1.16 SSH 1514 Server: Encrypted packet (len=1448)
  211 2.389361510  10.6.15.144 → 192.168.1.16 SSH 1514 Server: Encrypted packet (len=1448)
  212 2.389365574 192.168.1.16 → 10.6.15.144  TCP 66 59298 → 22 [ACK] Seq=11945 Ack=80645 Win=1494 Len=0 TSval=2979225 TSecr=3575539
  213 2.389756440  10.6.15.144 → 192.168.1.16 SSH 1514 Server: Encrypted packet (len=1448)
  214 2.389995204  10.6.15.144 → 192.168.1.16 SSH 1514 Server: Encrypted packet (len=1448)
  215 2.389999530 192.168.1.16 → 10.6.15.144  TCP 66 59298 → 22 [ACK] Seq=11945 Ack=83541 Win=1494 Len=0 TSval=2979225 TSecr=3575539
  216 2.390234192  10.6.15.144 → 192.168.1.16 SSH 1514 Server: Encrypted packet (len=1448)
  217 2.390474467  10.6.15.144 → 192.168.1.16 SSH 1514 Server: Encrypted packet (len=1448)
  218 2.390477160 192.168.1.16 → 10.6.15.144  TCP 66 59298 → 22 [ACK] Seq=11945 Ack=86437 Win=1494 Len=0 TSval=2979225 TSecr=3575539
  219 2.398768721  10.6.15.144 → 192.168.1.16 SSH 1514 Server: Encrypted packet (len=1448)
  220 2.398998704  10.6.15.144 → 192.168.1.16 SSH 1514 Server: Encrypted packet (len=1448)
  221 2.399012385 192.168.1.16 → 10.6.15.144  TCP 66 59298 → 22 [ACK] Seq=11945 Ack=89333 Win=1494 Len=0 TSval=2979227 TSecr=3575542
  222 2.399241644  10.6.15.144 → 192.168.1.16 SSH 1514 Server: Encrypted packet (len=1448)
  223 2.399631750  10.6.15.144 → 192.168.1.16 SSH 1514 Server: Encrypted packet (len=1448)
  224 2.399644293 192.168.1.16 → 10.6.15.144  TCP 66 59298 → 22 [ACK] Seq=11945 Ack=92229 Win=1494 Len=0 TSval=2979227 TSecr=3575542
  225 2.399871313  10.6.15.144 → 192.168.1.16 SSH 1514 Server: Encrypted packet (len=1448)
  226 2.400110772  10.6.15.144 → 192.168.1.16 SSH 1514 Server: Encrypted packet (len=1448)
  227 2.400120915 192.168.1.16 → 10.6.15.144  TCP 66 59298 → 22 [ACK] Seq=11945 Ack=95125 Win=1494 Len=0 TSval=2979227 TSecr=3575542
  228 2.400351077  10.6.15.144 → 192.168.1.16 SSH 1514 Server: Encrypted packet (len=1448)
  229 2.400589107  10.6.15.144 → 192.168.1.16 SSH 1514 Server: Encrypted packet (len=1448)
  230 2.400597850 192.168.1.16 → 10.6.15.144  TCP 66 59298 → 22 [ACK] Seq=11945 Ack=98021 Win=1494 Len=0 TSval=2979228 TSecr=3575542
  231 2.408303766  10.6.15.144 → 192.168.1.16 SSH 1514 Server: Encrypted packet (len=1448)
  232 2.408536349  10.6.15.144 → 192.168.1.16 SSH 1514 Server: Encrypted packet (len=1448)
  233 2.408550924 192.168.1.16 → 10.6.15.144  TCP 66 59298 → 22 [ACK] Seq=11945 Ack=100917 Win=1494 Len=0 TSval=2979230 TSecr=3575544
  234 2.408775252  10.6.15.144 → 192.168.1.16 SSH 1514 Server: Encrypted packet (len=1448)
  235 2.409014290  10.6.15.144 → 192.168.1.16 SSH 1514 Server: Encrypted packet (len=1448)
  236 2.409023874 192.168.1.16 → 10.6.15.144  TCP 66 59298 → 22 [ACK] Seq=11945 Ack=103813 Win=1494 Len=0 TSval=2979230 TSecr=3575544
  237 2.409253988  10.6.15.144 → 192.168.1.16 SSH 1514 Server: Encrypted packet (len=1448)
  238 2.419610271  10.6.15.144 → 192.168.1.16 SSH 1514 Server: Encrypted packet (len=1448)
  239 2.419631578 192.168.1.16 → 10.6.15.144  TCP 66 59298 → 22 [ACK] Seq=11945 Ack=106709 Win=1494 Len=0 TSval=2979232 TSecr=3575544
  240 2.419969932  10.6.15.144 → 192.168.1.16 SSH 1514 Server: Encrypted packet (len=1448)
  241 2.420208818  10.6.15.144 → 192.168.1.16 SSH 1514 Server: Encrypted packet (len=1448)
  242 2.420219494 192.168.1.16 → 10.6.15.144  TCP 66 59298 → 22 [ACK] Seq=11945 Ack=109605 Win=1494 Len=0 TSval=2979233 TSecr=3575544
  243 2.465566527  10.6.15.144 → 192.168.1.16 SSH 1514 Server: Encrypted packet (len=1448)
  244 2.478364705  10.6.15.144 → 192.168.1.16 SSH 1514 Server: Encrypted packet (len=1448)
  245 2.478380864 192.168.1.16 → 10.6.15.144  TCP 66 59298 → 22 [ACK] Seq=11945 Ack=112501 Win=1494 Len=0 TSval=2979247 TSecr=3575558
  246 2.478599291  10.6.15.144 → 192.168.1.16 SSH 1514 Server: Encrypted packet (len=1448)
  247 2.478823246  10.6.15.144 → 192.168.1.16 SSH 1514 Server: Encrypted packet (len=1448)
  248 2.478832886 192.168.1.16 → 10.6.15.144  TCP 66 59298 → 22 [ACK] Seq=11945 Ack=115397 Win=1494 Len=0 TSval=2979247 TSecr=3575562
  249 2.479073195  10.6.15.144 → 192.168.1.16 SSH 1514 Server: Encrypted packet (len=1448)
  250 2.479311927  10.6.15.144 → 192.168.1.16 SSH 1514 Server: Encrypted packet (len=1448)
  251 2.479316221 192.168.1.16 → 10.6.15.144  TCP 66 59298 → 22 [ACK] Seq=11945 Ack=118293 Win=1494 Len=0 TSval=2979247 TSecr=3575562
  252 2.479552655  10.6.15.144 → 192.168.1.16 SSH 1514 Server: Encrypted packet (len=1448)
  253 2.479672553 192.168.1.16 → 10.6.15.144  SSH 102 Client: Encrypted packet (len=36)
  254 2.479945132  10.6.15.144 → 192.168.1.16 SSH 1514 Server: Encrypted packet (len=1448)
  255 2.480171601  10.6.15.144 → 192.168.1.16 SSH 1514 Server: Encrypted packet (len=1448)
  256 2.480176090 192.168.1.16 → 10.6.15.144  TCP 66 59298 → 22 [ACK] Seq=11981 Ack=122637 Win=1494 Len=0 TSval=2979248 TSecr=3575562
  257 2.480410707  10.6.15.144 → 192.168.1.16 SSH 1514 Server: Encrypted packet (len=1448)
  258 2.486988107  10.6.15.144 → 192.168.1.16 SSH 1514 Server: Encrypted packet (len=1448)
  259 2.487003275 192.168.1.16 → 10.6.15.144  TCP 66 59298 → 22 [ACK] Seq=11981 Ack=125533 Win=1494 Len=0 TSval=2979249 TSecr=3575562
  260 2.487218148  10.6.15.144 → 192.168.1.16 SSH 1514 Server: Encrypted packet (len=1448)
  261 2.487459304  10.6.15.144 → 192.168.1.16 SSH 1514 Server: Encrypted packet (len=1448)
  262 2.487464146 192.168.1.16 → 10.6.15.144  TCP 66 59298 → 22 [ACK] Seq=11981 Ack=128429 Win=1494 Len=0 TSval=2979249 TSecr=3575564
  263 2.487698253  10.6.15.144 → 192.168.1.16 SSH 1514 Server: Encrypted packet (len=1448)
  264 2.487937907  10.6.15.144 → 192.168.1.16 SSH 1514 Server: Encrypted packet (len=1448)
  265 2.487942644 192.168.1.16 → 10.6.15.144  TCP 66 59298 → 22 [ACK] Seq=11981 Ack=131325 Win=1494 Len=0 TSval=2979249 TSecr=3575564
  266 2.488334287  10.6.15.144 → 192.168.1.16 SSH 1514 Server: Encrypted packet (len=1448)
  267 2.488574181  10.6.15.144 → 192.168.1.16 SSH 1514 Server: Encrypted packet (len=1448)
  268 2.488587275 192.168.1.16 → 10.6.15.144  TCP 66 59298 → 22 [ACK] Seq=11981 Ack=134221 Win=1494 Len=0 TSval=2979250 TSecr=3575564
  269 2.488812250  10.6.15.144 → 192.168.1.16 SSH 1514 Server: Encrypted packet (len=1448)
  270 2.495100952  10.6.15.144 → 192.168.1.16 SSH 1514 Server: Encrypted packet (len=1448)
  271 2.495118765 192.168.1.16 → 10.6.15.144  TCP 66 59298 → 22 [ACK] Seq=11981 Ack=137117 Win=1494 Len=0 TSval=2979251 TSecr=3575564
  272 2.495335219  10.6.15.144 → 192.168.1.16 SSH 1514 Server: Encrypted packet (len=1448)
  273 2.495456242  10.6.15.144 → 192.168.1.16 SSH 890 Server: Encrypted packet (len=824)
  274 2.495463825 192.168.1.16 → 10.6.15.144  TCP 66 59298 → 22 [ACK] Seq=11981 Ack=139389 Win=1494 Len=0 TSval=2979251 TSecr=3575566
  275 2.495797004 192.168.1.16 → 10.6.15.144  SSH 134 Client: Encrypted packet (len=68)
  276 2.497141928 192.168.1.16 → 10.6.15.144  SSH 158 Client: Encrypted packet (len=92)
  277 2.501913047  10.6.15.144 → 192.168.1.16 TCP 66 22 → 59298 [ACK] Seq=139389 Ack=12141 Win=1452 Len=0 TSval=3575568 TSecr=2979251
  278 2.531952818 192.168.1.16 → 10.6.15.144  SSH 670 Client: Encrypted packet (len=604)
  279 2.558106332  10.6.15.144 → 192.168.1.16 SSH 138 Server: Encrypted packet (len=72)
  280 2.558391079 192.168.1.16 → 10.6.15.144  SSH 102 Client: Encrypted packet (len=36)
  281 2.568697403  10.6.15.144 → 192.168.1.16 SSH 138 Server: Encrypted packet (len=72)
  282 2.568975118 192.168.1.16 → 10.6.15.144  SSH 102 Client: Encrypted packet (len=36)
  283 2.616954078  10.6.15.144 → 192.168.1.16 TCP 66 22 → 59298 [ACK] Seq=139533 Ack=12817 Win=1452 Len=0 TSval=3575596 TSecr=2979270
  284 2.678525716  10.6.15.144 → 192.168.1.16 SSH 950 Server: Encrypted packet (len=884)
  285 2.682866736  10.6.15.144 → 192.168.1.16 SSH 102 Server: Encrypted packet (len=36)
  286 2.682937842 192.168.1.16 → 10.6.15.144  TCP 66 59298 → 22 [ACK] Seq=12817 Ack=140453 Win=1494 Len=0 TSval=2979298 TSecr=3575613
  287 2.683603591 192.168.1.16 → 10.6.15.144  SSH 158 Client: Encrypted packet (len=92)
  288 2.685133678  10.6.15.144 → 192.168.1.16 TCP 66 22 → 59298 [ACK] Seq=140453 Ack=12909 Win=1452 Len=0 TSval=3575615 TSecr=2979298
  289 2.749503423 192.168.1.16 → 10.6.15.144  SSH 102 Client: Encrypted packet (len=36)
  290 2.749721732 192.168.1.16 → 10.6.15.144  SSH 118 Client: Encrypted packet (len=52)
  291 2.753675461  10.6.15.144 → 192.168.1.16 TCP 66 22 → 59298 [ACK] Seq=140453 Ack=12997 Win=1452 Len=0 TSval=3575631 TSecr=2979315
  292 2.823717232  10.6.15.144 → 192.168.1.16 SSH 102 Server: Encrypted packet (len=36)
  293 2.824201375 192.168.1.16 → 10.6.15.144  SSH 310 Client: Encrypted packet (len=244)
  294 2.830223265  10.6.15.144 → 192.168.1.16 TCP 66 22 → 59298 [ACK] Seq=140489 Ack=13241 Win=1452 Len=0 TSval=3575650 TSecr=2979334
  295 2.895177879  10.6.15.144 → 192.168.1.16 SSH 214 Server: Encrypted packet (len=148)
  296 2.895675103 192.168.1.16 → 10.6.15.144  SSH 134 Client: Encrypted packet (len=68)
  297 2.896678359  10.6.15.144 → 192.168.1.16 SSH 222 Server: Encrypted packet (len=156)
  298 2.897280710  10.6.15.144 → 192.168.1.16 SSH 214 Server: Encrypted packet (len=148)
  299 2.897320116 192.168.1.16 → 10.6.15.144  TCP 66 59298 → 22 [ACK] Seq=13309 Ack=140941 Win=1494 Len=0 TSval=2979352 TSecr=3575667
  300 2.897774224 192.168.1.16 → 10.6.15.144  SSH 134 Client: Encrypted packet (len=68)
  301 2.898310558  10.6.15.144 → 192.168.1.16 TCP 66 22 → 59298 [ACK] Seq=140941 Ack=13309 Win=1452 Len=0 TSval=3575668 TSecr=2979351
  302 2.899048001 192.168.1.16 → 10.6.15.144  SSH 134 Client: Encrypted packet (len=68)
  303 2.901507383  10.6.15.144 → 192.168.1.16 TCP 66 22 → 59298 [ACK] Seq=140941 Ack=13377 Win=1452 Len=0 TSval=3575668 TSecr=2979352
  304 2.902359019  10.6.15.144 → 192.168.1.16 TCP 66 22 → 59298 [ACK] Seq=140941 Ack=13445 Win=1452 Len=0 TSval=3575669 TSecr=2979352
  305 2.903597919 192.168.1.16 → 10.6.15.144  SSH 534 Client: Encrypted packet (len=468)
  306 2.904291199 192.168.1.16 → 10.6.15.144  SSH 918 Client: Encrypted packet (len=852)
  307 2.907023226  10.6.15.144 → 192.168.1.16 TCP 66 22 → 59298 [ACK] Seq=140941 Ack=13913 Win=1452 Len=0 TSval=3575670 TSecr=2979353
  308 2.907462307  10.6.15.144 → 192.168.1.16 TCP 66 22 → 59298 [ACK] Seq=140941 Ack=14765 Win=1452 Len=0 TSval=3575670 TSecr=2979354
  309 2.908480823  10.6.15.144 → 192.168.1.16 SSH 182 Server: Encrypted packet (len=116)
  310 2.909565293 192.168.1.16 → 10.6.15.144  SSH 134 Client: Encrypted packet (len=68)
  311 2.914591801  10.6.15.144 → 192.168.1.16 SSH 150 Server: Encrypted packet (len=84)
  312 2.914782293  10.6.15.144 → 192.168.1.16 SSH 1110 Server: Encrypted packet (len=1044)
  313 2.914810778 192.168.1.16 → 10.6.15.144  TCP 66 59298 → 22 [ACK] Seq=14833 Ack=142185 Win=1494 Len=0 TSval=2979356 TSecr=3575672
  314 2.915920590  10.6.15.144 → 192.168.1.16 SSH 1514 Server: Encrypted packet (len=1448)
  315 2.916000995  10.6.15.144 → 192.168.1.16 SSH 686 Server: Encrypted packet (len=620)
  316 2.916009335 192.168.1.16 → 10.6.15.144  TCP 66 59298 → 22 [ACK] Seq=14833 Ack=144253 Win=1494 Len=0 TSval=2979356 TSecr=3575672
  317 2.916391963  10.6.15.144 → 192.168.1.16 SSH 338 Server: Encrypted packet (len=272)
  318 2.918240804  10.6.15.144 → 192.168.1.16 SSH 182 Server: Encrypted packet (len=116)
  319 2.918311539 192.168.1.16 → 10.6.15.144  TCP 66 59298 → 22 [ACK] Seq=14833 Ack=144641 Win=1494 Len=0 TSval=2979357 TSecr=3575672
  320 2.918774294 192.168.1.16 → 10.6.15.144  SSH 206 Client: Encrypted packet (len=140)
  321 2.921169424 192.168.1.16 → 10.6.15.144  SSH 134 Client: Encrypted packet (len=68)
  322 2.923531982 192.168.1.16 → 10.6.15.144  SSH 134 Client: Encrypted packet (len=68)
  323 2.923826581  10.6.15.144 → 192.168.1.16 SSH 182 Server: Encrypted packet (len=116)
  324 2.923842207  10.6.15.144 → 192.168.1.16 TCP 66 22 → 59298 [ACK] Seq=144757 Ack=15041 Win=1452 Len=0 TSval=3575674 TSecr=2979357
  325 2.925955377 192.168.1.16 → 10.6.15.144  SSH 134 Client: Encrypted packet (len=68)
  326 2.927925338 192.168.1.16 → 10.6.15.144  SSH 134 Client: Encrypted packet (len=68)
  327 2.928875264  10.6.15.144 → 192.168.1.16 SSH 182 Server: Encrypted packet (len=116)
  328 2.928903028  10.6.15.144 → 192.168.1.16 SSH 182 Server: Encrypted packet (len=116)
  329 2.928939464 192.168.1.16 → 10.6.15.144  TCP 66 59298 → 22 [ACK] Seq=15245 Ack=144989 Win=1494 Len=0 TSval=2979360 TSecr=3575675
  330 2.929652473 192.168.1.16 → 10.6.15.144  SSH 134 Client: Encrypted packet (len=68)
  331 2.930815939 192.168.1.16 → 10.6.15.144  SSH 134 Client: Encrypted packet (len=68)
  332 2.931250346  10.6.15.144 → 192.168.1.16 SSH 134 Server: Encrypted packet (len=68)
  333 2.931269135  10.6.15.144 → 192.168.1.16 SSH 118 Server: Encrypted packet (len=52)
  334 2.931293137 192.168.1.16 → 10.6.15.144  TCP 66 59298 → 22 [ACK] Seq=15381 Ack=145109 Win=1494 Len=0 TSval=2979360 TSecr=3575676
  335 2.932564693  10.6.15.144 → 192.168.1.16 SSH 126 Server: Encrypted packet (len=60)
  336 2.934291272  10.6.15.144 → 192.168.1.16 SSH 446 Server: Encrypted packet (len=380)
  337 2.934301355 192.168.1.16 → 10.6.15.144  SSH 622 Client: Encrypted packet (len=556)
  338 2.948186504  10.6.15.144 → 192.168.1.16 TCP 446 [TCP Retransmission] 22 → 59298 [PSH, ACK] Seq=145169 Ack=15041 Win=1452 Len=380 TSval=3575680 TSecr=2979357
  339 2.948211631 192.168.1.16 → 10.6.15.144  TCP 78 59298 → 22 [ACK] Seq=15937 Ack=145549 Win=1494 Len=0 TSval=2979365 TSecr=3575680 SLE=145169 SRE=145549
  340 2.955218638  10.6.15.144 → 192.168.1.16 TCP 78 [TCP Dup ACK 324#1] 22 → 59298 [ACK] Seq=145549 Ack=15041 Win=1452 Len=0 TSval=3575682 TSecr=2979357 SLE=15109 SRE=15177
  341 2.955244114 192.168.1.16 → 10.6.15.144  SSH 1514 Client: Encrypted packet (len=1448)
  342 2.955263530  10.6.15.144 → 192.168.1.16 TCP 78 [TCP Dup ACK 324#2] 22 → 59298 [ACK] Seq=145549 Ack=15041 Win=1452 Len=0 TSval=3575682 TSecr=2979357 SLE=15109 SRE=15245
  343 2.955271263 192.168.1.16 → 10.6.15.144  SSH 862 Client: Encrypted packet (len=796)
  344 2.955278634  10.6.15.144 → 192.168.1.16 TCP 78 [TCP Dup ACK 324#3] 22 → 59298 [ACK] Seq=145549 Ack=15041 Win=1452 Len=0 TSval=3575682 TSecr=2979357 SLE=15109 SRE=15313
  345 2.955284685 192.168.1.16 → 10.6.15.144  SSH 134 Client: [TCP Fast Retransmission] , Encrypted packet (len=68)
  346 2.955417243  10.6.15.144 → 192.168.1.16 TCP 78 [TCP Dup ACK 324#4] 22 → 59298 [ACK] Seq=145549 Ack=15041 Win=1452 Len=0 TSval=3575682 TSecr=2979357 SLE=15109 SRE=15381
  347 2.955427964  10.6.15.144 → 192.168.1.16 TCP 78 [TCP Dup ACK 324#5] 22 → 59298 [ACK] Seq=145549 Ack=15041 Win=1452 Len=0 TSval=3575682 TSecr=2979357 SLE=15109 SRE=15937
  348 2.958226909  10.6.15.144 → 192.168.1.16 TCP 78 [TCP Dup ACK 324#6] 22 → 59298 [ACK] Seq=145549 Ack=15041 Win=1452 Len=0 TSval=3575683 TSecr=2979357 SLE=15109 SRE=18181
  349 2.958250206  10.6.15.144 → 192.168.1.16 TCP 66 22 → 59298 [ACK] Seq=145549 Ack=18181 Win=1428 Len=0 TSval=3575683 TSecr=2979366
  350 2.958773374 192.168.1.16 → 10.6.15.144  SSH 630 Client: Encrypted packet (len=564)
  351 2.961719135  10.6.15.144 → 192.168.1.16 TCP 66 22 → 59298 [ACK] Seq=145549 Ack=18745 Win=1452 Len=0 TSval=3575684 TSecr=2979367
  352 2.971551250  10.6.15.144 → 192.168.1.16 SSH 138 Server: Encrypted packet (len=72)
  353 2.971834143 192.168.1.16 → 10.6.15.144  SSH 102 Client: Encrypted packet (len=36)
  354 2.983372403 192.168.1.16 → 10.6.15.144  SSH 862 Client: Encrypted packet (len=796)
  355 2.986601788  10.6.15.144 → 192.168.1.16 TCP 66 22 → 59298 [ACK] Seq=145621 Ack=19577 Win=1452 Len=0 TSval=3575690 TSecr=2979370
  356 3.002596436 192.168.1.16 → 10.6.15.144  SSH 102 Client: Encrypted packet (len=36)
  357 3.004765933 192.168.1.16 → 10.6.15.144  SSH 110 Client: Encrypted packet (len=44)
  358 3.009513437 192.168.1.16 → 10.6.15.144  SSH 102 Client: Encrypted packet (len=36)
  359 3.013732670 192.168.1.16 → 10.6.15.144  SSH 318 Client: Encrypted packet (len=252)
  360 3.042295281  10.6.15.144 → 192.168.1.16 SSH 138 Server: Encrypted packet (len=72)
  361 3.046594363  10.6.15.144 → 192.168.1.16 SSH 182 Server: Encrypted packet (len=116)
  362 3.046653049 192.168.1.16 → 10.6.15.144  TCP 66 59298 → 22 [ACK] Seq=19945 Ack=145809 Win=1494 Len=0 TSval=2979389 TSecr=3575702
  363 3.076187832 192.168.1.16 → 10.6.15.144  SSH 170 Client: Encrypted packet (len=104)
  364 3.184182915  10.6.15.144 → 192.168.1.16 SSH 1514 Server: [TCP Previous segment not captured] , Encrypted packet (len=1448)
  365 3.184212942  10.6.15.144 → 192.168.1.16 SSH 1094 Server: Encrypted packet (len=1028)
  366 3.184221505  10.6.15.144 → 192.168.1.16 TCP 1094 [TCP Retransmission] 22 → 59298 [PSH, ACK] Seq=148229 Ack=19577 Win=1452 Len=1028 TSval=3575717 TSecr=2979370
  367 3.184227701  10.6.15.144 → 192.168.1.16 TCP 78 [TCP Dup ACK 355#1] 22 → 59298 [ACK] Seq=149257 Ack=19577 Win=1452 Len=0 TSval=3575720 TSecr=2979370 SLE=19693 SRE=19945
  368 3.184242054  10.6.15.144 → 192.168.1.16 TCP 78 [TCP Dup ACK 355#2] 22 → 59298 [ACK] Seq=149257 Ack=19577 Win=1452 Len=0 TSval=3575727 TSecr=2979370 SLE=19693 SRE=20049
  369 3.184246100  10.6.15.144 → 192.168.1.16 SSH 1042 Server: Encrypted packet (len=964)
  370 3.200222290 192.168.1.16 → 10.6.15.144  TCP 78 [TCP Dup ACK 362#1] 59298 → 22 [ACK] Seq=20049 Ack=145809 Win=1494 Len=0 TSval=2979424 TSecr=3575702 SLE=146781 SRE=148229
  371 3.200987040 192.168.1.16 → 10.6.15.144  TCP 78 [TCP Dup ACK 362#2] 59298 → 22 [ACK] Seq=20049 Ack=145809 Win=1494 Len=0 TSval=2979424 TSecr=3575702 SLE=146781 SRE=149257
  372 3.200993115 192.168.1.16 → 10.6.15.144  TCP 86 [TCP Dup ACK 362#3] 59298 → 22 [ACK] Seq=20049 Ack=145809 Win=1494 Len=0 TSval=2979424 TSecr=3575702 SLE=148229 SRE=149257 SLE=146781 SRE=149257
  373 3.200995634 192.168.1.16 → 10.6.15.144  SSH 194 Client: [TCP Fast Retransmission] , Encrypted packet (len=116)
  374 3.200998899 192.168.1.16 → 10.6.15.144  SSH 158 Client: Encrypted packet (len=80)
  375 3.201001972 192.168.1.16 → 10.6.15.144  TCP 78 [TCP Dup ACK 362#4] 59298 → 22 [ACK] Seq=20129 Ack=145809 Win=1494 Len=0 TSval=2979424 TSecr=3575702 SLE=146781 SRE=150221
  376 3.202638227  10.6.15.144 → 192.168.1.16 TCP 66 22 → 59298 [ACK] Seq=150221 Ack=20049 Win=1451 Len=0 TSval=3575744 TSecr=2979424
