    1 0.000000000  10.6.15.145 → 192.168.1.16 SSH 214 Server: Encrypted packet (len=148)
    2 0.000134518  10.6.15.145 → 192.168.1.16 SSH 182 Server: Encrypted packet (len=116)
    3 0.000167910 192.168.1.16 → 10.6.15.145  TCP 66 52104 → 22 [ACK] Seq=1 Ack=265 Win=6157 Len=0 TSval=1411456 TSecr=24225776
    4 0.000277477  10.6.15.145 → 192.168.1.16 SSH 182 Server: Encrypted packet (len=116)
    5 0.000325569 192.168.1.16 → 10.6.15.145  SSH 134 Client: Encrypted packet (len=68)
    6 0.000627857  10.6.15.145 → 192.168.1.16 SSH 1514 Server: Encrypted packet (len=1448)
    7 0.000635921 192.168.1.16 → 10.6.15.145  SSH 202 Client: Encrypted packet (len=136)
    8 0.000958424  10.6.15.145 → 192.168.1.16 SSH 1514 Server: Encrypted packet (len=1448)
    9 0.001070739  10.6.15.145 → 192.168.1.16 SSH 110 Server: Encrypted packet (len=44)
   10 0.001075199 192.168.1.16 → 10.6.15.145  TCP 66 52104 → 22 [ACK] Seq=205 Ack=3321 Win=6157 Len=0 TSval=1411456 TSecr=24225795
   11 0.001425308  10.6.15.145 → 192.168.1.16 SSH 1514 Server: Encrypted packet (len=1448)
   12 0.001763626  10.6.15.145 → 192.168.1.16 SSH 1514 Server: Encrypted packet (len=1448)
   13 0.001767584 192.168.1.16 → 10.6.15.145  TCP 66 52104 → 22 [ACK] Seq=205 Ack=6217 Win=6157 Len=0 TSval=1411456 TSecr=24225796
   14 0.002069505  10.6.15.145 → 192.168.1.16 SSH 1514 Server: Encrypted packet (len=1448)
   15 0.002410426  10.6.15.145 → 192.168.1.16 SSH 1514 Server: Encrypted packet (len=1448)
   16 0.002417225 192.168.1.16 → 10.6.15.145  TCP 66 52104 → 22 [ACK] Seq=205 Ack=9113 Win=6157 Len=0 TSval=1411457 TSecr=24225796
   17 0.002730409  10.6.15.145 → 192.168.1.16 SSH 1514 Server: Encrypted packet (len=1448)
   18 0.004803881  10.6.15.145 → 192.168.1.16 SSH 1514 Server: Encrypted packet (len=1448)
   19 0.004810329 192.168.1.16 → 10.6.15.145  TCP 66 52104 → 22 [ACK] Seq=205 Ack=12009 Win=6157 Len=0 TSval=1411457 TSecr=24225928
   20 0.005119103  10.6.15.145 → 192.168.1.16 SSH 1514 Server: Encrypted packet (len=1448)
   21 0.005416558  10.6.15.145 → 192.168.1.16 SSH 1514 Server: Encrypted packet (len=1448)
   22 0.005423287 192.168.1.16 → 10.6.15.145  TCP 66 52104 → 22 [ACK] Seq=205 Ack=14905 Win=6157 Len=0 TSval=1411457 TSecr=24225982
   23 0.005606481  10.6.15.145 → 192.168.1.16 SSH 1514 Server: Encrypted packet (len=1448)
   24 0.005800074  10.6.15.145 → 192.168.1.16 SSH 1514 Server: Encrypted packet (len=1448)
   25 0.005807596 192.168.1.16 → 10.6.15.145  TCP 66 52104 → 22 [ACK] Seq=205 Ack=17801 Win=6157 Len=0 TSval=1411457 TSecr=24225982
   26 0.005991642  10.6.15.145 → 192.168.1.16 SSH 1514 Server: Encrypted packet (len=1448)
   27 0.006183787  10.6.15.145 → 192.168.1.16 SSH 1514 Server: Encrypted packet (len=1448)
   28 0.006191237 192.168.1.16 → 10.6.15.145  TCP 66 52104 → 22 [ACK] Seq=205 Ack=20697 Win=6157 Len=0 TSval=1411458 TSecr=24225982
   29 0.006528253  10.6.15.145 → 192.168.1.16 SSH 1514 Server: Encrypted packet (len=1448)
   30 0.006717909  10.6.15.145 → 192.168.1.16 SSH 1514 Server: Encrypted packet (len=1448)
   31 0.006725264 192.168.1.16 → 10.6.15.145  TCP 66 52104 → 22 [ACK] Seq=205 Ack=23593 Win=6157 Len=0 TSval=1411458 TSecr=24225982
   32 0.009455042  10.6.15.145 → 192.168.1.16 SSH 1514 Server: Encrypted packet (len=1448)
   33 0.009633236  10.6.15.145 → 192.168.1.16 SSH 1514 Server: Encrypted packet (len=1448)
   34 0.009639827 192.168.1.16 → 10.6.15.145  TCP 66 52104 → 22 [ACK] Seq=205 Ack=26489 Win=6157 Len=0 TSval=1411458 TSecr=24225983
   35 0.009827218  10.6.15.145 → 192.168.1.16 SSH 1514 Server: Encrypted packet (len=1448)
   36 0.010018825  10.6.15.145 → 192.168.1.16 SSH 1514 Server: Encrypted packet (len=1448)
   37 0.010027248 192.168.1.16 → 10.6.15.145  TCP 66 52104 → 22 [ACK] Seq=205 Ack=29385 Win=6157 Len=0 TSval=1411458 TSecr=24225983
   38 0.010210245  10.6.15.145 → 192.168.1.16 SSH 1514 Server: Encrypted packet (len=1448)
   39 0.010401896  10.6.15.145 → 192.168.1.16 SSH 1514 Server: Encrypted packet (len=1448)
   40 0.010410503 192.168.1.16 → 10.6.15.145  TCP 66 52104 → 22 [ACK] Seq=205 Ack=32281 Win=6157 Len=0 TSval=1411459 TSecr=24225983
   41 0.010747775  10.6.15.145 → 192.168.1.16 SSH 1514 Server: Encrypted packet (len=1448)
   42 0.010939578  10.6.15.145 → 192.168.1.16 SSH 1514 Server: Encrypted packet (len=1448)
   43 0.010949523 192.168.1.16 → 10.6.15.145  TCP 66 52104 → 22 [ACK] Seq=205 Ack=35177 Win=6157 Len=0 TSval=1411459 TSecr=24225983
   44 0.011130819  10.6.15.145 → 192.168.1.16 SSH 1514 Server: Encrypted packet (len=1448)
   45 0.011315168  10.6.15.145 → 192.168.1.16 SSH 1462 Server: Encrypted packet (len=1396)
   46 0.011324635 192.168.1.16 → 10.6.15.145  TCP 66 52104 → 22 [ACK] Seq=205 Ack=38021 Win=6157 Len=0 TSval=1411459 TSecr=24225983
   47 0.297839615 192.168.1.16 → 10.6.15.145  SSH 398 Client: Encrypted packet (len=332)
   48 0.340310944  10.6.15.145 → 192.168.1.16 TCP 66 22 → 52104 [ACK] Seq=38021 Ack=537 Win=1452 Len=0 TSval=24226066 TSecr=1411530
   49 2.020583970  10.6.15.145 → 192.168.1.16 SSH 358 Server: Encrypted packet (len=292)
   50 2.021189442  10.6.15.145 → 192.168.1.16 TCP 358 [TCP Retransmission] 22 → 52104 [PSH, ACK] Seq=38021 Ack=537 Win=1452 Len=292 TSval=24226226 TSecr=1411530
   51 2.021200581 192.168.1.16 → 10.6.15.145  TCP 78 52104 → 22 [ACK] Seq=537 Ack=38313 Win=6157 Len=0 TSval=1411961 TSecr=24226226 SLE=38021 SRE=38313
   52 2.021299297 192.168.1.16 → 10.6.15.145  SSH 134 Client: Encrypted packet (len=68)
   53 2.022716844  10.6.15.145 → 192.168.1.16 TCP 66 22 → 52104 [ACK] Seq=38313 Ack=605 Win=1452 Len=0 TSval=24226487 TSecr=1411961
   54 5.005071208 192.168.1.16 → 10.6.15.145  SSH 262 Client: Encrypted packet (len=196)
   55 5.005339346 192.168.1.16 → 10.6.15.145  SSH 1514 Client: Encrypted packet (len=1448)
   56 5.006118902 192.168.1.16 → 10.6.15.145  SSH 1478 Client: Encrypted packet (len=1412)
   57 5.006817116  10.6.15.145 → 192.168.1.16 TCP 66 22 → 52104 [ACK] Seq=38313 Ack=801 Win=1452 Len=0 TSval=24227233 TSecr=1412707
   58 5.007867830  10.6.15.145 → 192.168.1.16 TCP 66 22 → 52104 [ACK] Seq=38313 Ack=2249 Win=1452 Len=0 TSval=24227233 TSecr=1412707
   59 5.009008517  10.6.15.145 → 192.168.1.16 TCP 66 22 → 52104 [ACK] Seq=38313 Ack=3661 Win=1452 Len=0 TSval=24227233 TSecr=1412708
   60 5.009964904  10.6.15.145 → 192.168.1.16 SSH 142 Server: Encrypted packet (len=76)
   61 5.050122623 192.168.1.16 → 10.6.15.145  TCP 66 52104 → 22 [ACK] Seq=3661 Ack=38389 Win=6157 Len=0 TSval=1412719 TSecr=24227234
   62 5.124958065  10.6.15.145 → 192.168.1.16 SSH 1358 Server: Encrypted packet (len=1292)
   63 5.124982873 192.168.1.16 → 10.6.15.145  TCP 66 52104 → 22 [ACK] Seq=3661 Ack=39681 Win=6157 Len=0 TSval=1412737 TSecr=24227262
   64 5.125642736 192.168.1.16 → 10.6.15.145  SSH 134 Client: Encrypted packet (len=68)
   65 5.166117740  10.6.15.145 → 192.168.1.16 TCP 66 22 → 52104 [ACK] Seq=39681 Ack=3729 Win=1452 Len=0 TSval=24227273 TSecr=1412737
   66 8.997295795  10.6.15.145 → 192.168.1.16 SSH 102 Server: Encrypted packet (len=36)
   67 8.997317980  10.6.15.145 → 192.168.1.16 TCP 102 [TCP Retransmission] 22 → 52104 [PSH, ACK] Seq=39681 Ack=3729 Win=1452 Len=36 TSval=24228230 TSecr=1412737
   68 8.997327745 192.168.1.16 → 10.6.15.145  TCP 78 52104 → 22 [ACK] Seq=3729 Ack=39717 Win=6157 Len=0 TSval=1413705 TSecr=24228230 SLE=39681 SRE=39717
   69 12.994625031  192.168.1.1 → 224.0.0.1    IGMPv2 42 Membership Query, general
   70 13.342152039 192.168.1.16 → 224.0.0.252  IGMPv2 46 Membership Report group 224.0.0.252
   71 18.912450086 192.168.1.16 → 192.168.1.1  DNS 81 Standard query 0x1124 A 1.ubuntu.pool.ntp.org
   72 18.918169476  192.168.1.1 → 192.168.1.16 DNS 129 Standard query response 0x1124 A 1.ubuntu.pool.ntp.org A 123.108.200.124 A 139.59.21.22 A 13.126.27.131
   73 18.918954465 192.168.1.16 → 123.108.200.124 NTP 90 NTP Version 4, client
   74 19.783755264 192.168.1.16 → 10.6.15.145  SSH 310 Client: Encrypted packet (len=244)
   75 19.784779674 192.168.1.16 → 10.6.15.145  SSH 134 Client: Encrypted packet (len=68)
   76 19.786289879  10.6.15.145 → 192.168.1.16 TCP 66 22 → 52104 [ACK] Seq=39717 Ack=3973 Win=1452 Len=0 TSval=24230928 TSecr=1416402
   77 19.786309456  10.6.15.145 → 192.168.1.16 TCP 66 22 → 52104 [ACK] Seq=39717 Ack=4041 Win=1452 Len=0 TSval=24230928 TSecr=1416402
   78 19.796391181  10.6.15.145 → 192.168.1.16 SSH 142 Server: Encrypted packet (len=76)
   79 19.796406417 192.168.1.16 → 10.6.15.145  TCP 66 52104 → 22 [ACK] Seq=4041 Ack=39793 Win=6157 Len=0 TSval=1416405 TSecr=24230930
   80 19.859537647  10.6.15.145 → 192.168.1.16 SSH 638 Server: Encrypted packet (len=572)
   81 19.859552973 192.168.1.16 → 10.6.15.145  TCP 66 52104 → 22 [ACK] Seq=4041 Ack=40365 Win=6157 Len=0 TSval=1416421 TSecr=24230946
   82 19.860271925 192.168.1.16 → 10.6.15.145  SSH 134 Client: Encrypted packet (len=68)
   83 19.901184477  10.6.15.145 → 192.168.1.16 TCP 66 22 → 52104 [ACK] Seq=40365 Ack=4109 Win=1452 Len=0 TSval=24230957 TSecr=1416421
   84 20.910693523 192.168.1.16 → 91.189.91.157 NTP 90 NTP Version 4, client
   85 22.014112339 192.168.1.16 → 224.0.0.251  IGMPv2 46 Membership Report group 224.0.0.251
   86 25.984095866  10.6.15.145 → 192.168.1.16 SSH 102 Server: Encrypted packet (len=36)
   87 25.984117766  10.6.15.145 → 192.168.1.16 SSH 102 Server: Encrypted packet (len=36)
   88 25.984123809  10.6.15.145 → 192.168.1.16 SSH 138 Server: Encrypted packet (len=72)
   89 25.984175808 192.168.1.16 → 10.6.15.145  TCP 66 52104 → 22 [ACK] Seq=4109 Ack=40509 Win=6157 Len=0 TSval=1417952 TSecr=24232358
   90 25.988928854  10.6.15.145 → 192.168.1.16 SSH 102 Server: Encrypted packet (len=36)
   91 26.030154409 192.168.1.16 → 10.6.15.145  TCP 66 52104 → 22 [ACK] Seq=4109 Ack=40545 Win=6157 Len=0 TSval=1417964 TSecr=24232478
   92 27.912288765 192.168.1.16 → 192.168.1.1  DNS 81 Standard query 0xe537 A 0.ubuntu.pool.ntp.org
   93 27.915818845  192.168.1.1 → 192.168.1.16 DNS 129 Standard query response 0xe537 A 0.ubuntu.pool.ntp.org A 123.108.200.124 A 13.126.27.131 A 139.59.21.22
   94 27.916292957 192.168.1.16 → 123.108.200.124 NTP 90 NTP Version 4, client
