    1 0.000000000  10.6.15.156 → 192.168.1.12 SSH 1514 Server: Encrypted packet (len=1448)
    2 0.000331712  10.6.15.156 → 192.168.1.12 SSH 538 Server: Encrypted packet (len=472)
    3 0.000340258 192.168.1.12 → 10.6.15.156  TCP 66 54766 → 22 [ACK] Seq=1 Ack=1921 Win=6155 Len=0 TSval=8205224 TSecr=15136725
    4 0.153114183  10.6.15.156 → 192.168.1.12 SSH 182 Server: Encrypted packet (len=116)
    5 0.193154614 192.168.1.12 → 10.6.15.156  TCP 66 54766 → 22 [ACK] Seq=1 Ack=2037 Win=6155 Len=0 TSval=8205273 TSecr=15136763
    6 0.211841773  10.6.15.156 → 192.168.1.12 SSH 182 Server: Encrypted packet (len=116)
    7 0.211867091 192.168.1.12 → 10.6.15.156  TCP 66 54766 → 22 [ACK] Seq=1 Ack=2153 Win=6155 Len=0 TSval=8205277 TSecr=15136778
    8 0.314330905  10.6.15.156 → 192.168.1.12 SSH 182 Server: Encrypted packet (len=116)
    9 0.314349005 192.168.1.12 → 10.6.15.156  TCP 66 54766 → 22 [ACK] Seq=1 Ack=2269 Win=6155 Len=0 TSval=8205303 TSecr=15136804
   10 0.359632801  10.6.15.156 → 192.168.1.12 SSH 110 Server: Encrypted packet (len=44)
   11 0.359651418 192.168.1.12 → 10.6.15.156  TCP 66 54766 → 22 [ACK] Seq=1 Ack=2313 Win=6155 Len=0 TSval=8205314 TSecr=15136815
   12 0.360011237 192.168.1.12 → 10.6.15.156  SSH 126 Client: Encrypted packet (len=60)
   13 0.361495520  10.6.15.156 → 192.168.1.12 TCP 66 22 → 54766 [ACK] Seq=2313 Ack=61 Win=1452 Len=0 TSval=15136815 TSecr=8205314
   14 0.369487051  10.6.15.156 → 192.168.1.12 SSH 102 Server: Encrypted packet (len=36)
   15 0.372887260 10.22.17.139 → 224.0.0.252  LLMNR 64 Standard query 0x248c A wpad
   16 0.373513033 10.22.17.139 → 224.0.0.252  LLMNR 64 Standard query 0xb753 A wpad
   17 0.413192992 192.168.1.12 → 10.6.15.156  TCP 66 54766 → 22 [ACK] Seq=61 Ack=2349 Win=6155 Len=0 TSval=8205328 TSecr=15136817
   18 0.534586291  10.6.15.156 → 192.168.1.12 SSH 182 Server: Encrypted packet (len=116)
   19 0.534612044 192.168.1.12 → 10.6.15.156  TCP 66 54766 → 22 [ACK] Seq=61 Ack=2465 Win=6155 Len=0 TSval=8205358 TSecr=15136859
   20 0.723996586  10.6.15.156 → 192.168.1.12 SSH 414 Server: Encrypted packet (len=348)
   21 0.724021654 192.168.1.12 → 10.6.15.156  TCP 66 54766 → 22 [ACK] Seq=61 Ack=2813 Win=6155 Len=0 TSval=8205405 TSecr=15136906
   22 0.725780645 192.168.1.12 → 10.6.15.156  SSH 138 Client: Encrypted packet (len=72)
   23 0.728383978  10.6.15.156 → 192.168.1.12 SSH 102 Server: Encrypted packet (len=36)
   24 0.728405959 192.168.1.12 → 10.6.15.156  SSH 434 Client: Encrypted packet (len=368)
   25 0.730706165  10.6.15.156 → 192.168.1.12 SSH 102 Server: Encrypted packet (len=36)
   26 0.757858164  10.6.15.156 → 192.168.1.12 SSH 174 Server: Encrypted packet (len=108)
   27 0.757928357 192.168.1.12 → 10.6.15.156  TCP 66 54766 → 22 [ACK] Seq=501 Ack=2993 Win=6155 Len=0 TSval=8205414 TSecr=15136908
   28 0.758010440 192.168.1.12 → 10.6.15.156  SSH 102 Client: Encrypted packet (len=36)
   29 0.758490971  10.6.15.156 → 192.168.1.12 SSH 138 Server: Encrypted packet (len=72)
   30 0.765658964  10.6.15.156 → 192.168.1.12 SSH 182 Server: Encrypted packet (len=116)
   31 0.765743302 192.168.1.12 → 10.6.15.156  TCP 66 54766 → 22 [ACK] Seq=537 Ack=3181 Win=6155 Len=0 TSval=8205416 TSecr=15136915
   32 0.767441590  10.6.15.156 → 192.168.1.12 SSH 138 Server: Encrypted packet (len=72)
   33 0.767655006 192.168.1.12 → 10.6.15.156  SSH 102 Client: Encrypted packet (len=36)
   34 0.769715101  10.6.15.156 → 192.168.1.12 SSH 138 Server: Encrypted packet (len=72)
   35 0.769931623 192.168.1.12 → 10.6.15.156  SSH 102 Client: Encrypted packet (len=36)
   36 0.770061856  10.6.15.156 → 192.168.1.12 SSH 138 Server: Encrypted packet (len=72)
   37 0.770320661 192.168.1.12 → 10.6.15.156  SSH 102 Client: Encrypted packet (len=36)
   38 0.771687698  10.6.15.156 → 192.168.1.12 TCP 66 22 → 54766 [ACK] Seq=3397 Ack=645 Win=1452 Len=0 TSval=15136918 TSecr=8205417
   39 0.784233653 10.22.17.139 → 224.0.0.252  LLMNR 64 Standard query 0x248c A wpad
   40 0.784556536 10.22.17.139 → 224.0.0.252  LLMNR 64 Standard query 0xb753 A wpad
   41 0.911445258  10.6.15.156 → 192.168.1.12 SSH 134 Server: Encrypted packet (len=68)
   42 0.911825943  10.6.15.156 → 192.168.1.12 SSH 138 Server: Encrypted packet (len=72)
   43 0.911910852 192.168.1.12 → 10.6.15.156  TCP 66 54766 → 22 [ACK] Seq=645 Ack=3537 Win=6155 Len=0 TSval=8205452 TSecr=15136953
   44 0.912051589 192.168.1.12 → 10.6.15.156  SSH 102 Client: Encrypted packet (len=36)
   45 0.912687908  10.6.15.156 → 192.168.1.12 SSH 126 Server: Encrypted packet (len=60)
   46 0.913016241  10.6.15.156 → 192.168.1.12 SSH 138 Server: Encrypted packet (len=72)
   47 0.913040903 192.168.1.12 → 10.6.15.156  TCP 66 54766 → 22 [ACK] Seq=681 Ack=3669 Win=6155 Len=0 TSval=8205452 TSecr=15136953
   48 0.913295405 192.168.1.12 → 10.6.15.156  SSH 102 Client: Encrypted packet (len=36)
   49 0.914708782  10.6.15.156 → 192.168.1.12 TCP 66 22 → 54766 [ACK] Seq=3669 Ack=717 Win=1452 Len=0 TSval=15136954 TSecr=8205452
   50 0.985726819  10.6.15.156 → 192.168.1.12 SSH 182 Server: Encrypted packet (len=116)
   51 1.029164697 192.168.1.12 → 10.6.15.156  TCP 66 54766 → 22 [ACK] Seq=717 Ack=3785 Win=6155 Len=0 TSval=8205482 TSecr=15136972
   52 1.055106753  10.6.15.156 → 192.168.1.12 SSH 238 Server: Encrypted packet (len=172)
   53 1.055196415 192.168.1.12 → 10.6.15.156  TCP 66 54766 → 22 [ACK] Seq=717 Ack=3957 Win=6155 Len=0 TSval=8205488 TSecr=15136989
   54 1.093300477  10.6.15.156 → 192.168.1.12 SSH 110 Server: Encrypted packet (len=44)
   55 1.093389604 192.168.1.12 → 10.6.15.156  TCP 66 54766 → 22 [ACK] Seq=717 Ack=4001 Win=6155 Len=0 TSval=8205498 TSecr=15136998
   56 1.093679996 192.168.1.12 → 10.6.15.156  SSH 158 Client: Encrypted packet (len=92)
   57 1.102010640  10.6.15.156 → 192.168.1.12 SSH 102 Server: Encrypted packet (len=36)
   58 1.102358453 192.168.1.12 → 10.6.15.156  SSH 158 Client: Encrypted packet (len=92)
   59 1.113699420  10.6.15.156 → 192.168.1.12 SSH 182 Server: Encrypted packet (len=116)
   60 1.124710893 192.168.1.12 → 10.6.15.156  SSH 174 Client: Encrypted packet (len=108)
   61 1.125003374 192.168.1.12 → 10.6.15.156  SSH 134 Client: Encrypted packet (len=68)
   62 1.126537970  10.6.15.156 → 192.168.1.12 TCP 66 22 → 54766 [ACK] Seq=4153 Ack=1077 Win=1452 Len=0 TSval=15137007 TSecr=8205505
   63 1.277078501  10.6.15.156 → 192.168.1.12 SSH 242 Server: Encrypted packet (len=176)
   64 1.317167668 192.168.1.12 → 10.6.15.156  TCP 66 54766 → 22 [ACK] Seq=1077 Ack=4329 Win=6155 Len=0 TSval=8205554 TSecr=15137044
   65 1.436985267  10.6.15.156 → 192.168.1.12 SSH 182 Server: Encrypted packet (len=116)
   66 1.437071586 192.168.1.12 → 10.6.15.156  TCP 66 54766 → 22 [ACK] Seq=1077 Ack=4445 Win=6155 Len=0 TSval=8205583 TSecr=15137084
   67 1.483184202  10.6.15.156 → 192.168.1.12 SSH 1514 Server: Encrypted packet (len=1448)
   68 1.483632312  10.6.15.156 → 192.168.1.12 SSH 926 Server: Encrypted packet (len=860)
   69 1.483642192 192.168.1.12 → 10.6.15.156  TCP 66 54766 → 22 [ACK] Seq=1077 Ack=6753 Win=6155 Len=0 TSval=8205595 TSecr=15137096
   70 1.484498267 192.168.1.12 → 10.6.15.156  SSH 206 Client: Encrypted packet (len=140)
   71 1.500337233  10.6.15.156 → 192.168.1.12 SSH 318 Server: Encrypted packet (len=252)
   72 1.500355657 192.168.1.12 → 10.6.15.156  SSH 538 Client: Encrypted packet (len=472)
   73 1.501427521 192.168.1.12 → 10.6.15.156  SSH 206 Client: Encrypted packet (len=140)
   74 1.502960504  10.6.15.156 → 192.168.1.12 TCP 66 22 → 54766 [ACK] Seq=7005 Ack=1829 Win=1452 Len=0 TSval=15137101 TSecr=8205599
   75 1.506245980  10.6.15.156 → 192.168.1.12 SSH 182 Server: Encrypted packet (len=116)
   76 1.549171667 192.168.1.12 → 10.6.15.156  TCP 66 54766 → 22 [ACK] Seq=1829 Ack=7121 Win=6155 Len=0 TSval=8205612 TSecr=15137102
   77 1.850599570  10.6.15.156 → 192.168.1.12 SSH 350 Server: Encrypted packet (len=284)
   78 1.850627235 192.168.1.12 → 10.6.15.156  TCP 66 54766 → 22 [ACK] Seq=1829 Ack=7405 Win=6155 Len=0 TSval=8205687 TSecr=15137187
   79 1.866278764  10.6.15.156 → 192.168.1.12 SSH 694 Server: Encrypted packet (len=628)
   80 1.866298775 192.168.1.12 → 10.6.15.156  TCP 66 54766 → 22 [ACK] Seq=1829 Ack=8033 Win=6155 Len=0 TSval=8205691 TSecr=15137192
   81 1.867122957 192.168.1.12 → 10.6.15.156  SSH 134 Client: Encrypted packet (len=68)
   82 1.875026657  10.6.15.156 → 192.168.1.12 SSH 318 Server: Encrypted packet (len=252)
   83 1.875054581 192.168.1.12 → 10.6.15.156  SSH 154 Client: Encrypted packet (len=88)
   84 1.914349249  10.6.15.156 → 192.168.1.12 TCP 66 22 → 54766 [ACK] Seq=8285 Ack=1985 Win=1452 Len=0 TSval=15137204 TSecr=8205693
   85 2.456946482 10.22.17.139 → 224.0.0.252  LLMNR 70 Standard query 0xffd8 A ebhlohouvn
   86 2.457958838 10.22.17.139 → 224.0.0.252  LLMNR 68 Standard query 0xbca2 A beyqvhzd
   87 2.459478630 10.22.17.139 → 224.0.0.252  LLMNR 70 Standard query 0xbbb6 A msgywgxjpv
   88 2.867883008 10.22.17.139 → 224.0.0.252  LLMNR 70 Standard query 0xffd8 A ebhlohouvn
   89 2.868717965 10.22.17.139 → 224.0.0.252  LLMNR 68 Standard query 0xbca2 A beyqvhzd
   90 2.868782643 10.22.17.139 → 224.0.0.252  LLMNR 70 Standard query 0xbbb6 A msgywgxjpv
   91 3.277508341  10.6.15.156 → 192.168.1.12 SSH 894 Server: Encrypted packet (len=828)
   92 3.277995986 192.168.1.12 → 10.6.15.156  SSH 150 Client: Encrypted packet (len=84)
   93 3.278257083 192.168.1.12 → 10.6.15.156  SSH 150 Client: Encrypted packet (len=84)
   94 3.279628056  10.6.15.156 → 192.168.1.12 TCP 66 22 → 54766 [ACK] Seq=9113 Ack=2069 Win=1452 Len=0 TSval=15137545 TSecr=8206044
   95 3.279731589  10.6.15.156 → 192.168.1.12 TCP 66 22 → 54766 [ACK] Seq=9113 Ack=2153 Win=1452 Len=0 TSval=15137545 TSecr=8206044
   96 3.348465660  10.6.15.156 → 192.168.1.12 SSH 110 Server: Encrypted packet (len=44)
   97 3.348817179 192.168.1.12 → 10.6.15.156  SSH 158 Client: Encrypted packet (len=92)
   98 3.348903597  10.6.15.156 → 192.168.1.12 SSH 102 Server: Encrypted packet (len=36)
   99 3.349279916 192.168.1.12 → 10.6.15.156  SSH 158 Client: Encrypted packet (len=92)
  100 3.350631841  10.6.15.156 → 192.168.1.12 TCP 66 22 → 54766 [ACK] Seq=9193 Ack=2245 Win=1452 Len=0 TSval=15137563 TSecr=8206061
  101 3.350741200  10.6.15.156 → 192.168.1.12 TCP 66 22 → 54766 [ACK] Seq=9193 Ack=2337 Win=1452 Len=0 TSval=15137563 TSecr=8206062
  102 3.478483493  10.6.15.156 → 192.168.1.12 SSH 1214 Server: Encrypted packet (len=1148)
  103 3.479172288  10.6.15.156 → 192.168.1.12 SSH 254 Server: Encrypted packet (len=188)
  104 3.479257895 192.168.1.12 → 10.6.15.156  TCP 66 54766 → 22 [ACK] Seq=2337 Ack=10529 Win=6155 Len=0 TSval=8206094 TSecr=15137595
  105 3.480180536 192.168.1.12 → 10.6.15.156  SSH 206 Client: Encrypted packet (len=140)
  106 3.481752075  10.6.15.156 → 192.168.1.12 TCP 66 22 → 54766 [ACK] Seq=10529 Ack=2477 Win=1452 Len=0 TSval=15137596 TSecr=8206094
  107 3.484257813 192.168.1.12 → 10.6.15.156  SSH 222 Client: Encrypted packet (len=156)
  108 3.484577573 192.168.1.12 → 10.6.15.156  SSH 414 Client: Encrypted packet (len=348)
  109 3.485643326  10.6.15.156 → 192.168.1.12 TCP 66 22 → 54766 [ACK] Seq=10529 Ack=2633 Win=1452 Len=0 TSval=15137597 TSecr=8206095
  110 3.488920490  10.6.15.156 → 192.168.1.12 TCP 66 22 → 54766 [ACK] Seq=10529 Ack=2981 Win=1452 Len=0 TSval=15137597 TSecr=8206095
  111 3.490103103  10.6.15.156 → 192.168.1.12 SSH 182 Server: Encrypted packet (len=116)
  112 3.492579252  10.6.15.156 → 192.168.1.12 SSH 246 Server: Encrypted packet (len=180)
  113 3.492664117 192.168.1.12 → 10.6.15.156  TCP 66 54766 → 22 [ACK] Seq=2981 Ack=10825 Win=6155 Len=0 TSval=8206097 TSecr=15137598
  114 3.493620097 192.168.1.12 → 10.6.15.156  SSH 206 Client: Encrypted packet (len=140)
  115 3.533833881  10.6.15.156 → 192.168.1.12 TCP 66 22 → 54766 [ACK] Seq=10825 Ack=3121 Win=1452 Len=0 TSval=15137609 TSecr=8206098
  116 3.583008475  10.6.15.156 → 192.168.1.12 SSH 430 Server: Encrypted packet (len=364)
  117 3.583362725 192.168.1.12 → 10.6.15.156  SSH 126 Client: Encrypted packet (len=60)
  118 3.585516083  10.6.15.156 → 192.168.1.12 TCP 66 22 → 54766 [ACK] Seq=11189 Ack=3181 Win=1452 Len=0 TSval=15137621 TSecr=8206120
  119 3.585915093  10.6.15.156 → 192.168.1.12 SSH 134 Server: Encrypted packet (len=68)
  120 3.591791988  10.6.15.156 → 192.168.1.12 SSH 862 Server: Encrypted packet (len=796)
  121 3.591875129 192.168.1.12 → 10.6.15.156  TCP 66 54766 → 22 [ACK] Seq=3181 Ack=12053 Win=6155 Len=0 TSval=8206122 TSecr=15137622
  122 3.594163685 192.168.1.12 → 10.6.15.156  SSH 110 Client: Encrypted packet (len=44)
  123 3.633705714  10.6.15.156 → 192.168.1.12 TCP 66 22 → 54766 [ACK] Seq=12053 Ack=3225 Win=1452 Len=0 TSval=15137634 TSecr=8206123
  124 3.633726716 192.168.1.12 → 10.6.15.156  SSH 102 Client: Encrypted packet (len=36)
  125 3.673840159  10.6.15.156 → 192.168.1.12 TCP 66 22 → 54766 [ACK] Seq=12053 Ack=3261 Win=1452 Len=0 TSval=15137644 TSecr=8206133
  126 5.089606983  10.6.15.156 → 192.168.1.12 SSH 1514 Server: Encrypted packet (len=1448)
  127 5.090009493  10.6.15.156 → 192.168.1.12 SSH 1006 Server: Encrypted packet (len=940)
  128 5.090020037 192.168.1.12 → 10.6.15.156  TCP 66 54766 → 22 [ACK] Seq=3261 Ack=14441 Win=6155 Len=0 TSval=8206497 TSecr=15137997
  129 5.114213413  10.6.15.156 → 192.168.1.12 SSH 182 Server: Encrypted packet (len=116)
  130 5.157189977 192.168.1.12 → 10.6.15.156  TCP 66 54766 → 22 [ACK] Seq=3261 Ack=14557 Win=6155 Len=0 TSval=8206514 TSecr=15138004
  131 5.164218660  10.6.15.156 → 192.168.1.12 SSH 110 Server: Encrypted packet (len=44)
  132 5.164244597 192.168.1.12 → 10.6.15.156  TCP 66 54766 → 22 [ACK] Seq=3261 Ack=14601 Win=6155 Len=0 TSval=8206515 TSecr=15138014
  133 5.164574537 192.168.1.12 → 10.6.15.156  SSH 174 Client: Encrypted packet (len=108)
  134 5.164647094  10.6.15.156 → 192.168.1.12 SSH 102 Server: Encrypted packet (len=36)
  135 5.166228025  10.6.15.156 → 192.168.1.12 TCP 66 22 → 54766 [ACK] Seq=14637 Ack=3369 Win=1452 Len=0 TSval=15138017 TSecr=8206515
  136 5.166234762 192.168.1.12 → 10.6.15.156  SSH 150 Client: Encrypted packet (len=84)
  137 5.167787801  10.6.15.156 → 192.168.1.12 TCP 66 22 → 54766 [ACK] Seq=14637 Ack=3453 Win=1452 Len=0 TSval=15138017 TSecr=8206516
  138 5.172772399  10.6.15.156 → 192.168.1.12 SSH 182 Server: Encrypted packet (len=116)
  139 5.213191916 192.168.1.12 → 10.6.15.156  TCP 66 54766 → 22 [ACK] Seq=3453 Ack=14753 Win=6155 Len=0 TSval=8206528 TSecr=15138018
  140 5.275465513  10.6.15.156 → 192.168.1.12 SSH 222 Server: Encrypted packet (len=156)
  141 5.275490379 192.168.1.12 → 10.6.15.156  TCP 66 54766 → 22 [ACK] Seq=3453 Ack=14909 Win=6155 Len=0 TSval=8206543 TSecr=15138044
  142 5.292041054  10.6.15.156 → 192.168.1.12 SSH 1138 Server: Encrypted packet (len=1072)
  143 5.292058671 192.168.1.12 → 10.6.15.156  TCP 66 54766 → 22 [ACK] Seq=3453 Ack=15981 Win=6155 Len=0 TSval=8206547 TSecr=15138048
  144 5.293079722 192.168.1.12 → 10.6.15.156  SSH 206 Client: Encrypted packet (len=140)
  145 5.337963475  10.6.15.156 → 192.168.1.12 TCP 66 22 → 54766 [ACK] Seq=15981 Ack=3593 Win=1452 Len=0 TSval=15138060 TSecr=8206547
  146 5.337983552 192.168.1.12 → 10.6.15.156  SSH 902 Client: Encrypted packet (len=836)
  147 5.340074475  10.6.15.156 → 192.168.1.12 TCP 66 22 → 54766 [ACK] Seq=15981 Ack=4429 Win=1452 Len=0 TSval=15138060 TSecr=8206559
  148 5.399933323  10.6.15.156 → 192.168.1.12 SSH 398 Server: Encrypted packet (len=332)
  149 5.400254730 192.168.1.12 → 10.6.15.156  SSH 126 Client: Encrypted packet (len=60)
  150 5.406059401  10.6.15.156 → 192.168.1.12 TCP 66 22 → 54766 [ACK] Seq=16313 Ack=4489 Win=1452 Len=0 TSval=15138076 TSecr=8206574
  151 5.441129203  10.6.15.156 → 192.168.1.12 SSH 134 Server: Encrypted packet (len=68)
  152 5.441533478  10.6.15.156 → 192.168.1.12 SSH 334 Server: Encrypted packet (len=268)
  153 5.441560925 192.168.1.12 → 10.6.15.156  TCP 66 54766 → 22 [ACK] Seq=4489 Ack=16649 Win=6155 Len=0 TSval=8206585 TSecr=15138085
  154 5.441920403  10.6.15.156 → 192.168.1.12 SSH 138 Server: Encrypted packet (len=72)
  155 5.442043737 192.168.1.12 → 10.6.15.156  SSH 102 Client: Encrypted packet (len=36)
  156 5.450701144  10.6.15.156 → 192.168.1.12 SSH 430 Server: Encrypted packet (len=364)
  157 5.457714360 192.168.1.12 → 10.6.15.156  SSH 238 Client: Encrypted packet (len=172)
  158 5.497565997  10.6.15.156 → 192.168.1.12 TCP 66 22 → 54766 [ACK] Seq=17085 Ack=4697 Win=1452 Len=0 TSval=15138100 TSecr=8206589
  159 5.497963382  10.6.15.156 → 192.168.1.12 SSH 238 Server: Encrypted packet (len=172)
  160 5.541173515 192.168.1.12 → 10.6.15.156  TCP 66 54766 → 22 [ACK] Seq=4697 Ack=17257 Win=6155 Len=0 TSval=8206610 TSecr=15138100
  161 5.625125696  10.6.15.156 → 192.168.1.12 SSH 222 Server: Encrypted packet (len=156)
  162 5.625150242 192.168.1.12 → 10.6.15.156  TCP 66 54766 → 22 [ACK] Seq=4697 Ack=17413 Win=6155 Len=0 TSval=8206630 TSecr=15138131
  163 5.675133223  10.22.18.83 → 224.0.0.252  LLMNR 72 Standard query 0x1f61 ANY LenovoPranav
  164 5.727543302  10.6.15.156 → 192.168.1.12 SSH 342 Server: Encrypted packet (len=276)
  165 5.727631183 192.168.1.12 → 10.6.15.156  TCP 66 54766 → 22 [ACK] Seq=4697 Ack=17689 Win=6155 Len=0 TSval=8206656 TSecr=15138157
  166 5.822078241  10.6.15.156 → 192.168.1.12 SSH 510 Server: Encrypted packet (len=444)
  167 5.822161906 192.168.1.12 → 10.6.15.156  TCP 66 54766 → 22 [ACK] Seq=4697 Ack=18133 Win=6155 Len=0 TSval=8206680 TSecr=15138181
  168 5.826675019 192.168.1.12 → 10.6.15.156  SSH 150 Client: Encrypted packet (len=84)
  169 5.829870604  10.6.15.156 → 192.168.1.12 TCP 66 22 → 54766 [ACK] Seq=18133 Ack=4781 Win=1452 Len=0 TSval=15138182 TSecr=8206681
  170 5.947887553  10.6.15.156 → 192.168.1.12 SSH 310 Server: Encrypted packet (len=244)
  171 5.989190830 192.168.1.12 → 10.6.15.156  TCP 66 54766 → 22 [ACK] Seq=4781 Ack=18377 Win=6155 Len=0 TSval=8206722 TSecr=15138212
  172 6.017209820  10.6.15.156 → 192.168.1.12 SSH 438 Server: Encrypted packet (len=372)
  173 6.017298979 192.168.1.12 → 10.6.15.156  TCP 66 54766 → 22 [ACK] Seq=4781 Ack=18749 Win=6155 Len=0 TSval=8206729 TSecr=15138229
  174 6.075396543  10.6.15.156 → 192.168.1.12 SSH 342 Server: Encrypted packet (len=276)
  175 6.075485947 192.168.1.12 → 10.6.15.156  TCP 66 54766 → 22 [ACK] Seq=4781 Ack=19025 Win=6155 Len=0 TSval=8206743 TSecr=15138244
  176 6.085453001  10.22.18.83 → 224.0.0.252  LLMNR 72 Standard query 0x1f61 ANY LenovoPranav
  177 6.177382185  10.6.15.156 → 192.168.1.12 SSH 206 Server: Encrypted packet (len=140)
  178 6.177465939 192.168.1.12 → 10.6.15.156  TCP 66 54766 → 22 [ACK] Seq=4781 Ack=19165 Win=6155 Len=0 TSval=8206769 TSecr=15138269
  179 6.194989468 192.168.1.12 → 91.189.89.199 NTP 90 NTP Version 4, client
  180 6.220272416  10.6.15.156 → 192.168.1.12 SSH 726 Server: Encrypted packet (len=660)
  181 6.220344855 192.168.1.12 → 10.6.15.156  TCP 66 54766 → 22 [ACK] Seq=4781 Ack=19825 Win=6155 Len=0 TSval=8206779 TSecr=15138279
  182 6.222426042 192.168.1.12 → 10.6.15.156  SSH 110 Client: Encrypted packet (len=44)
  183 6.228575791  10.6.15.156 → 192.168.1.12 TCP 66 22 → 54766 [ACK] Seq=19825 Ack=4825 Win=1452 Len=0 TSval=15138281 TSecr=8206780
  184 6.228594864 192.168.1.12 → 10.6.15.156  SSH 102 Client: Encrypted packet (len=36)
  185 6.229928783  10.6.15.156 → 192.168.1.12 TCP 66 22 → 54766 [ACK] Seq=19825 Ack=4861 Win=1452 Len=0 TSval=15138283 TSecr=8206781
  186 7.479769211 10.22.17.139 → 224.0.0.252  LLMNR 64 Standard query 0x8527 A wpad
  187 7.482800953 10.22.17.139 → 224.0.0.252  LLMNR 64 Standard query 0xd349 A wpad
  188 7.645817846  10.6.15.156 → 192.168.1.12 SSH 1514 Server: Encrypted packet (len=1448)
  189 7.645887714  10.6.15.156 → 192.168.1.12 SSH 1210 Server: Encrypted packet (len=1144)
  190 7.645897420 192.168.1.12 → 10.6.15.156  TCP 66 54766 → 22 [ACK] Seq=4861 Ack=22417 Win=6155 Len=0 TSval=8207136 TSecr=15138636
  191 7.752230035  10.6.15.156 → 192.168.1.12 SSH 902 Server: Encrypted packet (len=836)
  192 7.793180673 192.168.1.12 → 10.6.15.156  TCP 66 54766 → 22 [ACK] Seq=4861 Ack=23253 Win=6155 Len=0 TSval=8207173 TSecr=15138663
  193 7.820609573  10.6.15.156 → 192.168.1.12 SSH 854 Server: Encrypted packet (len=788)
  194 7.820634888 192.168.1.12 → 10.6.15.156  TCP 66 54766 → 22 [ACK] Seq=4861 Ack=24041 Win=6155 Len=0 TSval=8207179 TSecr=15138680
  195 7.879220853  10.6.15.156 → 192.168.1.12 SSH 854 Server: Encrypted packet (len=788)
  196 7.879238663 192.168.1.12 → 10.6.15.156  TCP 66 54766 → 22 [ACK] Seq=4861 Ack=24829 Win=6155 Len=0 TSval=8207194 TSecr=15138695
  197 7.893214374 10.22.17.139 → 224.0.0.252  LLMNR 64 Standard query 0xd349 A wpad
  198 7.893238481 10.22.17.139 → 224.0.0.252  LLMNR 64 Standard query 0x8527 A wpad
  199 7.900467355  10.6.15.156 → 192.168.1.12 SSH 110 Server: Encrypted packet (len=44)
  200 7.900485639 192.168.1.12 → 10.6.15.156  TCP 66 54766 → 22 [ACK] Seq=4861 Ack=24873 Win=6155 Len=0 TSval=8207199 TSecr=15138700
  201 7.900845540 192.168.1.12 → 10.6.15.156  SSH 222 Client: Encrypted packet (len=156)
  202 7.905950413  10.6.15.156 → 192.168.1.12 TCP 66 22 → 54766 [ACK] Seq=24873 Ack=5017 Win=1452 Len=0 TSval=15138701 TSecr=8207199
  203 7.914390387  10.6.15.156 → 192.168.1.12 SSH 102 Server: Encrypted packet (len=36)
  204 7.957197979 192.168.1.12 → 10.6.15.156  TCP 66 54766 → 22 [ACK] Seq=5017 Ack=24909 Win=6155 Len=0 TSval=8207214 TSecr=15138704
  205 7.983229118  10.6.15.156 → 192.168.1.12 SSH 270 Server: Encrypted packet (len=204)
  206 7.983257729 192.168.1.12 → 10.6.15.156  TCP 66 54766 → 22 [ACK] Seq=5017 Ack=25113 Win=6155 Len=0 TSval=8207220 TSecr=15138720
  207 8.202589946  10.6.15.156 → 192.168.1.12 SSH 190 Server: Encrypted packet (len=124)
  208 8.202615838 192.168.1.12 → 10.6.15.156  TCP 66 54766 → 22 [ACK] Seq=5017 Ack=25237 Win=6155 Len=0 TSval=8207275 TSecr=15138776
  209 8.271279355  10.6.15.156 → 192.168.1.12 SSH 270 Server: Encrypted packet (len=204)
  210 8.271297020 192.168.1.12 → 10.6.15.156  TCP 66 54766 → 22 [ACK] Seq=5017 Ack=25441 Win=6155 Len=0 TSval=8207292 TSecr=15138793
  211 8.329940727  10.6.15.156 → 192.168.1.12 SSH 334 Server: Encrypted packet (len=268)
  212 8.329959142 192.168.1.12 → 10.6.15.156  TCP 66 54766 → 22 [ACK] Seq=5017 Ack=25709 Win=6155 Len=0 TSval=8207307 TSecr=15138808
  213 8.432754852  10.6.15.156 → 192.168.1.12 SSH 182 Server: Encrypted packet (len=116)
  214 8.432770848 192.168.1.12 → 10.6.15.156  TCP 66 54766 → 22 [ACK] Seq=5017 Ack=25825 Win=6155 Len=0 TSval=8207332 TSecr=15138833
  215 8.483550794 10.22.17.139 → 224.0.0.252  LLMNR 68 Standard query 0xc53c A gjkevyjc
  216 8.653907516  10.6.15.156 → 192.168.1.12 SSH 326 Server: Encrypted packet (len=260)
  217 8.653925397 192.168.1.12 → 10.6.15.156  TCP 66 54766 → 22 [ACK] Seq=5017 Ack=26085 Win=6155 Len=0 TSval=8207388 TSecr=15138889
  218 8.699286281  10.22.18.83 → 224.0.0.252  LLMNR 64 Standard query 0x827f A wpad
  219 8.700173021  10.22.18.83 → 224.0.0.252  LLMNR 64 Standard query 0x2e68 A wpad
  220 8.722327707  10.6.15.156 → 192.168.1.12 SSH 342 Server: Encrypted packet (len=276)
  221 8.722346461 192.168.1.12 → 10.6.15.156  TCP 66 54766 → 22 [ACK] Seq=5017 Ack=26361 Win=6155 Len=0 TSval=8207405 TSecr=15138906
  222 8.781982381  10.6.15.156 → 192.168.1.12 SSH 270 Server: Encrypted packet (len=204)
  223 8.782000811 192.168.1.12 → 10.6.15.156  TCP 66 54766 → 22 [ACK] Seq=5017 Ack=26565 Win=6155 Len=0 TSval=8207420 TSecr=15138920
  224 8.884451994  10.6.15.156 → 192.168.1.12 SSH 358 Server: Encrypted packet (len=292)
  225 8.884469859 192.168.1.12 → 10.6.15.156  TCP 66 54766 → 22 [ACK] Seq=5017 Ack=26857 Win=6155 Len=0 TSval=8207445 TSecr=15138946
  226 8.893903189 10.22.17.139 → 224.0.0.252  LLMNR 68 Standard query 0xc53c A gjkevyjc
  227 9.107189763  10.6.15.156 → 192.168.1.12 SSH 342 Server: Encrypted packet (len=276)
  228 9.107210932 192.168.1.12 → 10.6.15.156  TCP 66 54766 → 22 [ACK] Seq=5017 Ack=27133 Win=6155 Len=0 TSval=8207501 TSecr=15139001
  229 9.109174361  10.22.18.83 → 224.0.0.252  LLMNR 64 Standard query 0x827f A wpad
  230 9.110165266  10.22.18.83 → 224.0.0.252  LLMNR 64 Standard query 0x2e68 A wpad
  231 9.173382580  10.6.15.156 → 192.168.1.12 SSH 454 Server: Encrypted packet (len=388)
  232 9.173400391 192.168.1.12 → 10.6.15.156  TCP 66 54766 → 22 [ACK] Seq=5017 Ack=27521 Win=6155 Len=0 TSval=8207518 TSecr=15139018
  233 9.195462559  10.6.15.156 → 192.168.1.12 SSH 1514 Server: Encrypted packet (len=1448)
  234 9.195480921 192.168.1.12 → 10.6.15.156  TCP 66 54766 → 22 [ACK] Seq=5017 Ack=28969 Win=6155 Len=0 TSval=8207523 TSecr=15139024
  235 9.195582847  10.6.15.156 → 192.168.1.12 SSH 1514 Server: Encrypted packet (len=1448)
  236 9.195587113 192.168.1.12 → 10.6.15.156  TCP 66 54766 → 22 [ACK] Seq=5017 Ack=30417 Win=6155 Len=0 TSval=8207523 TSecr=15139024
  237 9.195996145  10.6.15.156 → 192.168.1.12 SSH 1514 Server: Encrypted packet (len=1448)
  238 9.196014203 192.168.1.12 → 10.6.15.156  TCP 66 54766 → 22 [ACK] Seq=5017 Ack=31865 Win=6155 Len=0 TSval=8207523 TSecr=15139024
  239 9.196119548  10.6.15.156 → 192.168.1.12 SSH 1514 Server: Encrypted packet (len=1448)
  240 9.196123915 192.168.1.12 → 10.6.15.156  TCP 66 54766 → 22 [ACK] Seq=5017 Ack=33313 Win=6155 Len=0 TSval=8207523 TSecr=15139024
  241 9.196239947  10.6.15.156 → 192.168.1.12 SSH 814 Server: Encrypted packet (len=748)
  242 9.196247261 192.168.1.12 → 10.6.15.156  TCP 66 54766 → 22 [ACK] Seq=5017 Ack=34061 Win=6155 Len=0 TSval=8207523 TSecr=15139024
  243 9.204883669 192.168.1.12 → 10.6.15.156  SSH 118 Client: Encrypted packet (len=52)
  244 9.231999302  10.6.15.156 → 192.168.1.12 SSH 518 Server: Encrypted packet (len=452)
  245 9.232022142 192.168.1.12 → 10.6.15.156  SSH 174 Client: Encrypted packet (len=108)
  246 9.257989275  10.6.15.156 → 192.168.1.12 SSH 102 Server: Encrypted packet (len=36)
  247 9.258451115 192.168.1.12 → 10.6.15.156  SSH 190 Client: Encrypted packet (len=124)
  248 9.271611708  10.6.15.156 → 192.168.1.12 SSH 138 Server: Encrypted packet (len=72)
  249 9.271948313 192.168.1.12 → 10.6.15.156  SSH 102 Client: Encrypted packet (len=36)
  250 9.281695888  10.6.15.156 → 192.168.1.12 SSH 138 Server: Encrypted packet (len=72)
  251 9.282080750 192.168.1.12 → 10.6.15.156  SSH 238 Client: Encrypted packet (len=172)
  252 9.282361809 192.168.1.12 → 10.6.15.156  SSH 126 Client: Encrypted packet (len=60)
  253 9.283790090  10.6.15.156 → 192.168.1.12 TCP 66 22 → 54766 [ACK] Seq=34693 Ack=5569 Win=1452 Len=0 TSval=15139046 TSecr=8207545
  254 9.333144084  10.6.15.156 → 192.168.1.12 SSH 414 Server: Encrypted packet (len=348)
  255 9.334482462  10.6.15.156 → 192.168.1.12 SSH 502 Server: Encrypted packet (len=436)
  256 9.334553662 192.168.1.12 → 10.6.15.156  TCP 66 54766 → 22 [ACK] Seq=5569 Ack=35477 Win=6155 Len=0 TSval=8207558 TSecr=15139058
  257 9.555572645  10.6.15.156 → 192.168.1.12 SSH 222 Server: Encrypted packet (len=156)
  258 9.597190837 192.168.1.12 → 10.6.15.156  TCP 66 54766 → 22 [ACK] Seq=5569 Ack=35633 Win=6155 Len=0 TSval=8207624 TSecr=15139114
  259 9.624437352  10.6.15.156 → 192.168.1.12 SSH 334 Server: Encrypted packet (len=268)
  260 9.624463988 192.168.1.12 → 10.6.15.156  TCP 66 54766 → 22 [ACK] Seq=5569 Ack=35901 Win=6155 Len=0 TSval=8207630 TSecr=15139131
  261 9.653924839  10.6.15.156 → 192.168.1.12 SSH 1514 Server: Encrypted packet (len=1448)
  262 9.653942428 192.168.1.12 → 10.6.15.156  TCP 66 54766 → 22 [ACK] Seq=5569 Ack=37349 Win=6155 Len=0 TSval=8207638 TSecr=15139138
  263 9.654046737  10.6.15.156 → 192.168.1.12 SSH 1514 Server: Encrypted packet (len=1448)
  264 9.654050949 192.168.1.12 → 10.6.15.156  TCP 66 54766 → 22 [ACK] Seq=5569 Ack=38797 Win=6155 Len=0 TSval=8207638 TSecr=15139138
  265 9.654357880  10.6.15.156 → 192.168.1.12 SSH 1030 Server: Encrypted packet (len=964)
  266 9.654366513 192.168.1.12 → 10.6.15.156  TCP 66 54766 → 22 [ACK] Seq=5569 Ack=39761 Win=6155 Len=0 TSval=8207638 TSecr=15139138
  267 9.657461806  10.6.15.156 → 192.168.1.12 SSH 1494 Server: Encrypted packet (len=1428)
  268 9.657478033 192.168.1.12 → 10.6.15.156  TCP 66 54766 → 22 [ACK] Seq=5569 Ack=41189 Win=6155 Len=0 TSval=8207639 TSecr=15139139
  269 9.658882895  10.6.15.156 → 192.168.1.12 SSH 1514 Server: Encrypted packet (len=1448)
  270 9.658902005 192.168.1.12 → 10.6.15.156  TCP 66 54766 → 22 [ACK] Seq=5569 Ack=42637 Win=6155 Len=0 TSval=8207639 TSecr=15139140
  271 9.659005547  10.6.15.156 → 192.168.1.12 SSH 1514 Server: Encrypted packet (len=1448)
  272 9.659009856 192.168.1.12 → 10.6.15.156  TCP 66 54766 → 22 [ACK] Seq=5569 Ack=44085 Win=6155 Len=0 TSval=8207639 TSecr=15139140
  273 9.659266392  10.6.15.156 → 192.168.1.12 SSH 1514 Server: Encrypted packet (len=1448)
  274 9.659284111 192.168.1.12 → 10.6.15.156  TCP 66 54766 → 22 [ACK] Seq=5569 Ack=45533 Win=6155 Len=0 TSval=8207639 TSecr=15139140
  275 9.659363777  10.6.15.156 → 192.168.1.12 SSH 1358 Server: Encrypted packet (len=1292)
  276 9.659370259 192.168.1.12 → 10.6.15.156  TCP 66 54766 → 22 [ACK] Seq=5569 Ack=46825 Win=6155 Len=0 TSval=8207639 TSecr=15139140
  277 9.684087530  10.6.15.156 → 192.168.1.12 SSH 374 Server: Encrypted packet (len=308)
  278 9.684106869 192.168.1.12 → 10.6.15.156  TCP 66 54766 → 22 [ACK] Seq=5569 Ack=47133 Win=6155 Len=0 TSval=8207645 TSecr=15139146
  279 9.703803665  10.6.15.156 → 192.168.1.12 SSH 1514 Server: Encrypted packet (len=1448)
  280 9.703822396 192.168.1.12 → 10.6.15.156  TCP 66 54766 → 22 [ACK] Seq=5569 Ack=48581 Win=6155 Len=0 TSval=8207650 TSecr=15139151
  281 9.704051449  10.6.15.156 → 192.168.1.12 SSH 1390 Server: Encrypted packet (len=1324)
  282 9.704061198 192.168.1.12 → 10.6.15.156  TCP 66 54766 → 22 [ACK] Seq=5569 Ack=49905 Win=6155 Len=0 TSval=8207650 TSecr=15139151
  283 9.735465988  10.22.18.83 → 224.0.0.252  LLMNR 68 Standard query 0xa92b A pdwoismi
  284 9.735530333  10.22.18.83 → 224.0.0.252  LLMNR 73 Standard query 0xa720 A voyrwprqfivno
  285 9.735696372  10.22.18.83 → 224.0.0.252  LLMNR 70 Standard query 0xfcfd A jxxsijjprc
  286 9.753468701  10.6.15.156 → 192.168.1.12 SSH 1514 Server: Encrypted packet (len=1448)
  287 9.753486970 192.168.1.12 → 10.6.15.156  TCP 66 54766 → 22 [ACK] Seq=5569 Ack=51353 Win=6155 Len=0 TSval=8207663 TSecr=15139163
  288 9.753768766  10.6.15.156 → 192.168.1.12 SSH 1514 Server: Encrypted packet (len=1448)
  289 9.753787252 192.168.1.12 → 10.6.15.156  TCP 66 54766 → 22 [ACK] Seq=5569 Ack=52801 Win=6155 Len=0 TSval=8207663 TSecr=15139163
  290 9.753951036  10.6.15.156 → 192.168.1.12 SSH 1514 Server: Encrypted packet (len=1448)
  291 9.753960862 192.168.1.12 → 10.6.15.156  TCP 66 54766 → 22 [ACK] Seq=5569 Ack=54249 Win=6155 Len=0 TSval=8207663 TSecr=15139163
  292 9.754073401  10.6.15.156 → 192.168.1.12 SSH 1078 Server: Encrypted packet (len=1012)
  293 9.754106090 192.168.1.12 → 10.6.15.156  TCP 66 54766 → 22 [ACK] Seq=5569 Ack=55261 Win=6155 Len=0 TSval=8207663 TSecr=15139163
  294 9.754247491  10.6.15.156 → 192.168.1.12 SSH 1514 Server: Encrypted packet (len=1448)
  295 9.754417031  10.6.15.156 → 192.168.1.12 SSH 1326 Server: Encrypted packet (len=1260)
  296 9.754420684 192.168.1.12 → 10.6.15.156  TCP 66 54766 → 22 [ACK] Seq=5569 Ack=57969 Win=6155 Len=0 TSval=8207663 TSecr=15139163
  297 9.786216488  10.6.15.156 → 192.168.1.12 SSH 406 Server: Encrypted packet (len=340)
  298 9.786306285 192.168.1.12 → 10.6.15.156  TCP 66 54766 → 22 [ACK] Seq=5569 Ack=58309 Win=6155 Len=0 TSval=8207671 TSecr=15139171
  299 9.833288300  10.6.15.156 → 192.168.1.12 SSH 1514 Server: Encrypted packet (len=1448)
  300 9.833407942  10.6.15.156 → 192.168.1.12 SSH 1514 Server: Encrypted packet (len=1448)
  301 9.833416932 192.168.1.12 → 10.6.15.156  TCP 66 54766 → 22 [ACK] Seq=5569 Ack=61205 Win=6155 Len=0 TSval=8207683 TSecr=15139183
  302 9.833783949  10.6.15.156 → 192.168.1.12 SSH 1514 Server: Encrypted packet (len=1448)
  303 9.833972690  10.6.15.156 → 192.168.1.12 SSH 1514 Server: Encrypted packet (len=1448)
  304 9.833979522 192.168.1.12 → 10.6.15.156  TCP 66 54766 → 22 [ACK] Seq=5569 Ack=64101 Win=6155 Len=0 TSval=8207683 TSecr=15139183
  305 9.833988668  10.6.15.156 → 192.168.1.12 SSH 158 Server: Encrypted packet (len=92)
  306 9.834015479 192.168.1.12 → 10.6.15.156  TCP 66 54766 → 22 [ACK] Seq=5569 Ack=64193 Win=6155 Len=0 TSval=8207683 TSecr=15139183
  307 9.834949940  10.6.15.156 → 192.168.1.12 SSH 1514 Server: Encrypted packet (len=1448)
  308 9.838317396  10.6.15.156 → 192.168.1.12 SSH 1514 Server: Encrypted packet (len=1448)
  309 9.838335922 192.168.1.12 → 10.6.15.156  TCP 66 54766 → 22 [ACK] Seq=5569 Ack=67089 Win=6155 Len=0 TSval=8207684 TSecr=15139184
  310 9.838440289  10.6.15.156 → 192.168.1.12 SSH 1514 Server: Encrypted packet (len=1448)
  311 9.838681340  10.6.15.156 → 192.168.1.12 SSH 1514 Server: Encrypted packet (len=1448)
  312 9.838700044 192.168.1.12 → 10.6.15.156  TCP 66 54766 → 22 [ACK] Seq=5569 Ack=69985 Win=6155 Len=0 TSval=8207684 TSecr=15139184
  313 9.838857693  10.6.15.156 → 192.168.1.12 SSH 1514 Server: Encrypted packet (len=1448)
  314 9.839057855  10.6.15.156 → 192.168.1.12 SSH 1514 Server: Encrypted packet (len=1448)
  315 9.839076160 192.168.1.12 → 10.6.15.156  TCP 66 54766 → 22 [ACK] Seq=5569 Ack=72881 Win=6155 Len=0 TSval=8207684 TSecr=15139184
  316 9.839223821  10.6.15.156 → 192.168.1.12 SSH 1514 Server: Encrypted packet (len=1448)
  317 9.839234297  10.6.15.156 → 192.168.1.12 SSH 190 Server: Encrypted packet (len=124)
  318 9.839239624 192.168.1.12 → 10.6.15.156  TCP 66 54766 → 22 [ACK] Seq=5569 Ack=74453 Win=6155 Len=0 TSval=8207684 TSecr=15139184
  319 9.881287895  10.6.15.156 → 192.168.1.12 SSH 1514 Server: Encrypted packet (len=1448)
  320 9.881473581  10.6.15.156 → 192.168.1.12 SSH 1514 Server: Encrypted packet (len=1448)
  321 9.881484055 192.168.1.12 → 10.6.15.156  TCP 66 54766 → 22 [ACK] Seq=5569 Ack=77349 Win=6155 Len=0 TSval=8207695 TSecr=15139195
  322 9.881854821  10.6.15.156 → 192.168.1.12 SSH 1514 Server: Encrypted packet (len=1448)
  323 9.881982388  10.6.15.156 → 192.168.1.12 SSH 1514 Server: Encrypted packet (len=1448)
  324 9.881991085 192.168.1.12 → 10.6.15.156  TCP 66 54766 → 22 [ACK] Seq=5569 Ack=80245 Win=6155 Len=0 TSval=8207695 TSecr=15139195
  325 9.882032448  10.6.15.156 → 192.168.1.12 SSH 614 Server: Encrypted packet (len=548)
  326 9.882048946 192.168.1.12 → 10.6.15.156  TCP 66 54766 → 22 [ACK] Seq=5569 Ack=80793 Win=6155 Len=0 TSval=8207695 TSecr=15139195
  327 10.006653325  10.6.15.156 → 192.168.1.12 SSH 342 Server: Encrypted packet (len=276)
  328 10.006751087 192.168.1.12 → 10.6.15.156  TCP 66 54766 → 22 [ACK] Seq=5569 Ack=81069 Win=6155 Len=0 TSval=8207726 TSecr=15139227
  329 10.015527022  10.6.15.156 → 192.168.1.12 SSH 1514 Server: Encrypted packet (len=1448)
  330 10.015677405  10.6.15.156 → 192.168.1.12 SSH 1514 Server: Encrypted packet (len=1448)
  331 10.015686936 192.168.1.12 → 10.6.15.156  TCP 66 54766 → 22 [ACK] Seq=5569 Ack=83965 Win=6155 Len=0 TSval=8207728 TSecr=15139229
  332 10.016062039  10.6.15.156 → 192.168.1.12 SSH 1514 Server: Encrypted packet (len=1448)
  333 10.016223002  10.6.15.156 → 192.168.1.12 SSH 1514 Server: Encrypted packet (len=1448)
  334 10.016232732 192.168.1.12 → 10.6.15.156  TCP 66 54766 → 22 [ACK] Seq=5569 Ack=86861 Win=6155 Len=0 TSval=8207728 TSecr=15139229
  335 10.016244917  10.6.15.156 → 192.168.1.12 SSH 150 Server: Encrypted packet (len=84)
  336 10.016268370 192.168.1.12 → 10.6.15.156  TCP 66 54766 → 22 [ACK] Seq=5569 Ack=86945 Win=6155 Len=0 TSval=8207728 TSecr=15139229
  337 10.016555346  10.6.15.156 → 192.168.1.12 SSH 1514 Server: Encrypted packet (len=1448)
  338 10.016877583  10.6.15.156 → 192.168.1.12 SSH 1514 Server: Encrypted packet (len=1448)
  339 10.016885136 192.168.1.12 → 10.6.15.156  TCP 66 54766 → 22 [ACK] Seq=5569 Ack=89841 Win=6155 Len=0 TSval=8207728 TSecr=15139229
  340 10.017068638  10.6.15.156 → 192.168.1.12 SSH 1514 Server: Encrypted packet (len=1448)
  341 10.017413820  10.6.15.156 → 192.168.1.12 SSH 1514 Server: Encrypted packet (len=1448)
  342 10.017420458 192.168.1.12 → 10.6.15.156  TCP 66 54766 → 22 [ACK] Seq=5569 Ack=92737 Win=6155 Len=0 TSval=8207729 TSecr=15139229
  343 10.017603557  10.6.15.156 → 192.168.1.12 SSH 1514 Server: Encrypted packet (len=1448)
  344 10.017795203  10.6.15.156 → 192.168.1.12 SSH 1514 Server: Encrypted packet (len=1448)
  345 10.017798716 192.168.1.12 → 10.6.15.156  TCP 66 54766 → 22 [ACK] Seq=5569 Ack=95633 Win=6155 Len=0 TSval=8207729 TSecr=15139229
  346 10.017966009  10.6.15.156 → 192.168.1.12 SSH 1310 Server: Encrypted packet (len=1244)
  347 10.017991943 192.168.1.12 → 10.6.15.156  TCP 66 54766 → 22 [ACK] Seq=5569 Ack=96877 Win=6155 Len=0 TSval=8207729 TSecr=15139229
  348 10.062633033 192.168.1.12 → 10.6.15.156  SSH 166 Client: Encrypted packet (len=100)
  349 10.075115446  10.6.15.156 → 192.168.1.12 SSH 230 Server: Encrypted packet (len=164)
  350 10.075142638 192.168.1.12 → 10.6.15.156  SSH 226 Client: Encrypted packet (len=160)
  351 10.113652915  10.6.15.156 → 192.168.1.12 TCP 66 22 → 54766 [ACK] Seq=97041 Ack=5829 Win=1452 Len=0 TSval=15139254 TSecr=8207743
  352 10.113678049 192.168.1.12 → 10.6.15.156  SSH 146 Client: Encrypted packet (len=80)
  353 10.115669220  10.6.15.156 → 192.168.1.12 TCP 66 22 → 54766 [ACK] Seq=97041 Ack=5909 Win=1452 Len=0 TSval=15139254 TSecr=8207753
  354 10.117272684 192.168.1.12 → 10.6.15.156  SSH 102 Client: Encrypted packet (len=36)
  355 10.118582202  10.6.15.156 → 192.168.1.12 TCP 66 22 → 54766 [ACK] Seq=97041 Ack=5945 Win=1452 Len=0 TSval=15139255 TSecr=8207754
  356 10.120243588 192.168.1.12 → 10.6.15.156  SSH 110 Client: Encrypted packet (len=44)
  357 10.121362349  10.6.15.156 → 192.168.1.12 TCP 66 22 → 54766 [ACK] Seq=97041 Ack=5989 Win=1452 Len=0 TSval=15139256 TSecr=8207754
  358 10.124670521 192.168.1.12 → 10.6.15.156  SSH 102 Client: Encrypted packet (len=36)
  359 10.125363588 192.168.1.12 → 10.6.15.156  SSH 102 Client: Encrypted packet (len=36)
  360 10.126574987  10.6.15.156 → 192.168.1.12 TCP 66 22 → 54766 [ACK] Seq=97041 Ack=6025 Win=1452 Len=0 TSval=15139257 TSecr=8207755
  361 10.126587385  10.6.15.156 → 192.168.1.12 TCP 66 22 → 54766 [ACK] Seq=97041 Ack=6061 Win=1452 Len=0 TSval=15139257 TSecr=8207756
  362 10.136061761 192.168.1.12 → 10.6.15.156  SSH 126 Client: Encrypted packet (len=60)
  363 10.137781184  10.6.15.156 → 192.168.1.12 TCP 66 22 → 54766 [ACK] Seq=97041 Ack=6121 Win=1452 Len=0 TSval=15139260 TSecr=8207758
  364 10.145079139  10.22.18.83 → 224.0.0.252  LLMNR 70 Standard query 0xfcfd A jxxsijjprc
  365 10.145202091  10.22.18.83 → 224.0.0.252  LLMNR 73 Standard query 0xa720 A voyrwprqfivno
  366 10.145647376  10.22.18.83 → 224.0.0.252  LLMNR 68 Standard query 0xa92b A pdwoismi
  367 10.147877062 192.168.1.12 → 10.6.15.156  SSH 102 Client: Encrypted packet (len=36)
  368 10.149469918  10.6.15.156 → 192.168.1.12 TCP 66 22 → 54766 [ACK] Seq=97041 Ack=6157 Win=1452 Len=0 TSval=15139263 TSecr=8207761
  369 10.149480455 192.168.1.12 → 10.6.15.156  SSH 102 Client: Encrypted packet (len=36)
  370 10.150837655  10.6.15.156 → 192.168.1.12 TCP 66 22 → 54766 [ACK] Seq=97041 Ack=6193 Win=1452 Len=0 TSval=15139263 TSecr=8207762
  371 10.490833905 10.22.17.139 → 224.0.0.252  LLMNR 68 Standard query 0x79b6 A cjdbaqsz
  372 10.490856593 10.22.17.139 → 224.0.0.252  LLMNR 69 Standard query 0x5762 A ptgafdiav
  373 10.490861558 10.22.17.139 → 224.0.0.252  LLMNR 69 Standard query 0xf08c A ptgafdiav
  374 10.490867259 10.22.17.139 → 224.0.0.252  LLMNR 68 Standard query 0x7569 A cjdbaqsz
  375 10.895257657 10.22.17.139 → 224.0.0.252  LLMNR 68 Standard query 0x79b6 A cjdbaqsz
  376 10.895283228 10.22.17.139 → 224.0.0.252  LLMNR 69 Standard query 0x5762 A ptgafdiav
  377 10.927271244 10.22.17.139 → 224.0.0.252  LLMNR 69 Standard query 0xf08c A ptgafdiav
  378 10.927290713 10.22.17.139 → 224.0.0.252  LLMNR 68 Standard query 0x7569 A cjdbaqsz
  379 13.141810217 192.168.1.12 → 10.6.15.156  SSH 102 Client: Encrypted packet (len=36)
  380 13.142963052  10.6.15.156 → 192.168.1.12 TCP 66 22 → 54766 [ACK] Seq=97041 Ack=6229 Win=1452 Len=0 TSval=15140011 TSecr=8208510
  381 13.142977133 192.168.1.12 → 10.6.15.156  SSH 110 Client: Encrypted packet (len=44)
