    1 0.000000000  10.6.15.156 → 192.168.1.12 SSH 286 Server: Encrypted packet (len=220)
    2 0.069000291  10.6.15.156 → 192.168.1.12 SSH 358 Server: Encrypted packet (len=292)
    3 0.091663909  10.6.15.156 → 192.168.1.12 SSH 150 Server: Encrypted packet (len=84)
    4 0.127230079  10.6.15.156 → 192.168.1.12 SSH 358 Server: Encrypted packet (len=292)
    5 0.139340384  10.6.15.156 → 192.168.1.12 SSH 630 Server: Encrypted packet (len=564)
    6 0.450531241 192.168.1.12 → 10.6.15.156  TCP 66 54766 → 22 [ACK] Seq=1 Ack=221 Win=6155 Len=0 TSval=8214040 TSecr=15145541
    7 0.450541962 192.168.1.12 → 10.6.15.156  TCP 66 54766 → 22 [ACK] Seq=1 Ack=513 Win=6155 Len=0 TSval=8214057 TSecr=15145558
    8 0.450544217 192.168.1.12 → 10.6.15.156  TCP 66 54766 → 22 [ACK] Seq=1 Ack=597 Win=6155 Len=0 TSval=8214063 TSecr=15145564
    9 0.450545774 192.168.1.12 → 10.6.15.156  TCP 66 54766 → 22 [ACK] Seq=1 Ack=889 Win=6155 Len=0 TSval=8214072 TSecr=15145573
   10 0.450547357 192.168.1.12 → 10.6.15.156  TCP 66 54766 → 22 [ACK] Seq=1 Ack=1453 Win=6155 Len=0 TSval=8214075 TSecr=15145576
   11 0.450549201 192.168.1.12 → 10.6.15.156  SSH 102 Client: Encrypted packet (len=36)
   12 0.451990248  10.6.15.156 → 192.168.1.12 SSH 350 Server: Encrypted packet (len=284)
   13 0.452015528 192.168.1.12 → 10.6.15.156  SSH 966 Client: Encrypted packet (len=900)
   14 0.452034863  10.6.15.156 → 192.168.1.12 SSH 342 Server: Encrypted packet (len=276)
   15 0.453122372  10.6.15.156 → 192.168.1.12 TCP 66 22 → 54766 [ACK] Seq=2013 Ack=37 Win=1452 Len=0 TSval=15145654 TSecr=8214075
   16 0.457177851  10.6.15.156 → 192.168.1.12 TCP 66 22 → 54766 [ACK] Seq=2013 Ack=937 Win=1452 Len=0 TSval=15145655 TSecr=8214153
   17 0.457195195  10.6.15.156 → 192.168.1.12 SSH 354 Server: Encrypted packet (len=288)
   18 0.457257089 192.168.1.12 → 10.6.15.156  TCP 66 54766 → 22 [ACK] Seq=937 Ack=2301 Win=6155 Len=0 TSval=8214154 TSecr=15145654
   19 0.457659382  10.6.15.156 → 192.168.1.12 SSH 214 Server: Encrypted packet (len=148)
   20 0.457684976  10.6.15.156 → 192.168.1.12 SSH 174 Server: Encrypted packet (len=108)
   21 0.457706177 192.168.1.12 → 10.6.15.156  TCP 66 54766 → 22 [ACK] Seq=937 Ack=2557 Win=6155 Len=0 TSval=8214154 TSecr=15145655
   22 0.457714155 192.168.1.12 → 10.6.15.156  SSH 210 Client: Encrypted packet (len=144)
   23 0.498758402  10.6.15.156 → 192.168.1.12 TCP 66 22 → 54766 [ACK] Seq=2557 Ack=1081 Win=1452 Len=0 TSval=15145666 TSecr=8214154
   24 0.498779994 192.168.1.12 → 10.6.15.156  SSH 102 Client: Encrypted packet (len=36)
   25 0.500231894  10.6.15.156 → 192.168.1.12 TCP 66 22 → 54766 [ACK] Seq=2557 Ack=1117 Win=1452 Len=0 TSval=15145666 TSecr=8214165
   26 0.502099735  10.6.15.156 → 192.168.1.12 SSH 210 Server: Encrypted packet (len=144)
   27 0.502367393 192.168.1.12 → 10.6.15.156  SSH 102 Client: Encrypted packet (len=36)
   28 0.502757364  10.6.15.156 → 192.168.1.12 SSH 102 Server: Encrypted packet (len=36)
   29 0.504333353  10.6.15.156 → 192.168.1.12 SSH 174 Server: Encrypted packet (len=108)
   30 0.504417489 192.168.1.12 → 10.6.15.156  TCP 66 54766 → 22 [ACK] Seq=1153 Ack=2845 Win=6155 Len=0 TSval=8214166 TSecr=15145666
   31 0.519229869  10.6.15.156 → 192.168.1.12 SSH 254 Server: Encrypted packet (len=188)
   32 0.527174898  10.6.15.156 → 192.168.1.12 SSH 102 Server: Encrypted packet (len=36)
   33 0.527190260  10.6.15.156 → 192.168.1.12 SSH 138 Server: Encrypted packet (len=72)
   34 0.527248906 192.168.1.12 → 10.6.15.156  TCP 66 54766 → 22 [ACK] Seq=1153 Ack=3141 Win=6155 Len=0 TSval=8214172 TSecr=15145671
   35 0.578106593  10.6.15.156 → 192.168.1.12 SSH 342 Server: Encrypted packet (len=276)
   36 0.602385179  10.6.15.156 → 192.168.1.12 SSH 138 Server: Encrypted packet (len=72)
   37 0.602504840 192.168.1.12 → 10.6.15.156  TCP 66 54766 → 22 [ACK] Seq=1153 Ack=3489 Win=6155 Len=0 TSval=8214191 TSecr=15145685
   38 0.602681292 192.168.1.12 → 10.6.15.156  SSH 102 Client: Encrypted packet (len=36)
   39 0.642863836  10.6.15.156 → 192.168.1.12 TCP 66 22 → 54766 [ACK] Seq=3489 Ack=1189 Win=1452 Len=0 TSval=15145702 TSecr=8214191
   40 0.669706373  10.6.15.156 → 192.168.1.12 SSH 138 Server: Encrypted packet (len=72)
   41 0.681133746  10.6.15.156 → 192.168.1.12 SSH 342 Server: Encrypted packet (len=276)
   42 0.719756411  10.6.15.156 → 192.168.1.12 SSH 138 Server: Encrypted packet (len=72)
   43 0.721376934  10.6.15.156 → 192.168.1.12 SSH 138 Server: Encrypted packet (len=72)
   44 0.723015694  10.6.15.156 → 192.168.1.12 SSH 102 Server: Encrypted packet (len=36)
   45 0.724394196  10.6.15.156 → 192.168.1.12 SSH 138 Server: Encrypted packet (len=72)
   46 1.166589271 192.168.1.12 → 10.6.15.156  SSH 102 Client: Encrypted packet (len=36)
   47 1.166600807 192.168.1.12 → 10.6.15.156  TCP 66 54766 → 22 [ACK] Seq=1225 Ack=3909 Win=6155 Len=0 TSval=8214220 TSecr=15145711
   48 1.166602686 192.168.1.12 → 10.6.15.156  TCP 66 54766 → 22 [ACK] Seq=1225 Ack=4017 Win=6155 Len=0 TSval=8214221 TSecr=15145721
   49 1.166604251 192.168.1.12 → 10.6.15.156  TCP 66 54766 → 22 [ACK] Seq=1225 Ack=4089 Win=6155 Len=0 TSval=8214232 TSecr=15145722
   50 1.166606110 192.168.1.12 → 192.168.1.1  DNS 81 Standard query 0xca06 A 3.ubuntu.pool.ntp.org
   51 1.167793870 192.168.1.12 → 10.6.15.156  SSH 322 Client: Encrypted packet (len=256)
   52 1.168814843  10.6.15.156 → 192.168.1.12 SSH 138 Server: Encrypted packet (len=72)
   53 1.168840002  10.6.15.156 → 192.168.1.12 SSH 138 Server: Encrypted packet (len=72)
   54 1.168914310 192.168.1.12 → 10.6.15.156  TCP 66 54766 → 22 [ACK] Seq=1481 Ack=4233 Win=6155 Len=0 TSval=8214332 TSecr=15145759
   55 1.168969215  10.6.15.156 → 192.168.1.12 SSH 1226 Server: Encrypted packet (len=1160)
   56 1.169148767 192.168.1.12 → 10.6.15.156  TCP 66 54766 → 22 [ACK] Seq=1481 Ack=5393 Win=6155 Len=0 TSval=8214332 TSecr=15145824
   57 1.169231667 192.168.1.12 → 10.6.15.156  SSH 138 Client: Encrypted packet (len=72)
   58 1.169955177  10.6.15.156 → 192.168.1.12 SSH 982 Server: Encrypted packet (len=916)
   59 1.170765435  192.168.1.1 → 192.168.1.12 DNS 145 Standard query response 0xca06 A 3.ubuntu.pool.ntp.org A 123.108.200.124 A 139.59.21.22 A 52.66.76.135 A 139.59.50.38
   60 1.171239159 192.168.1.12 → 123.108.200.124 NTP 90 NTP Version 4, client
   61 1.171937021  10.6.15.156 → 192.168.1.12 TCP 66 22 → 54766 [ACK] Seq=6309 Ack=1553 Win=1452 Len=0 TSval=15145834 TSecr=8214332
   62 1.210513860 192.168.1.12 → 10.6.15.156  TCP 66 54766 → 22 [ACK] Seq=1553 Ack=6309 Win=6155 Len=0 TSval=8214343 TSecr=15145833
   63 1.259195777  10.6.15.156 → 192.168.1.12 SSH 282 Server: Encrypted packet (len=216)
   64 1.259281733 192.168.1.12 → 10.6.15.156  TCP 66 54766 → 22 [ACK] Seq=1553 Ack=6525 Win=6155 Len=0 TSval=8214355 TSecr=15145856
   65 1.259607310 192.168.1.12 → 10.6.15.156  SSH 174 Client: Encrypted packet (len=108)
   66 1.298785116  10.6.15.156 → 192.168.1.12 TCP 66 22 → 54766 [ACK] Seq=6525 Ack=1661 Win=1452 Len=0 TSval=15145866 TSecr=8214355
   67 1.353087492  10.6.15.156 → 192.168.1.12 SSH 214 Server: Encrypted packet (len=148)
   68 1.421427662  10.6.15.156 → 192.168.1.12 SSH 206 Server: Encrypted packet (len=140)
   69 1.439302153  10.6.15.156 → 192.168.1.12 SSH 542 Server: Encrypted packet (len=476)
   70 1.480824867  10.6.15.156 → 192.168.1.12 SSH 1046 Server: Encrypted packet (len=980)
   71 1.890530800 192.168.1.12 → 10.6.15.156  TCP 66 54766 → 22 [ACK] Seq=1661 Ack=6673 Win=6155 Len=0 TSval=8214389 TSecr=15145879
   72 1.890540774 192.168.1.12 → 10.6.15.156  TCP 66 54766 → 22 [ACK] Seq=1661 Ack=6813 Win=6155 Len=0 TSval=8214395 TSecr=15145896
   73 1.890542710 192.168.1.12 → 10.6.15.156  TCP 66 54766 → 22 [ACK] Seq=1661 Ack=7289 Win=6155 Len=0 TSval=8214400 TSecr=15145901
   74 1.890544244 192.168.1.12 → 10.6.15.156  TCP 66 54766 → 22 [ACK] Seq=1661 Ack=8269 Win=6155 Len=0 TSval=8214410 TSecr=15145911
   75 1.890546138 192.168.1.12 → 10.6.15.156  SSH 102 Client: Encrypted packet (len=36)
   76 1.891014762 192.168.1.12 → 10.6.15.156  SSH 562 Client: Encrypted packet (len=496)
   77 1.891547951  10.6.15.156 → 192.168.1.12 SSH 206 Server: Encrypted packet (len=140)
   78 1.891584287  10.6.15.156 → 192.168.1.12 SSH 334 Server: Encrypted packet (len=268)
   79 1.891610429  10.6.15.156 → 192.168.1.12 SSH 222 Server: Encrypted packet (len=156)
   80 1.891623222 192.168.1.12 → 10.6.15.156  TCP 66 54766 → 22 [ACK] Seq=2193 Ack=8833 Win=6155 Len=0 TSval=8214513 TSecr=15145937
   81 1.892620185  10.6.15.156 → 192.168.1.12 TCP 66 22 → 54766 [ACK] Seq=8833 Ack=1697 Win=1452 Len=0 TSval=15146014 TSecr=8214457
   82 1.892738072  10.6.15.156 → 192.168.1.12 TCP 66 22 → 54766 [ACK] Seq=8833 Ack=2193 Win=1452 Len=0 TSval=15146014 TSecr=8214513
   83 1.931250012  10.6.15.156 → 192.168.1.12 SSH 182 Server: Encrypted packet (len=116)
   84 1.931338911 192.168.1.12 → 10.6.15.156  TCP 66 54766 → 22 [ACK] Seq=2193 Ack=8949 Win=6155 Len=0 TSval=8214523 TSecr=15146024
   85 1.967044482  10.6.15.156 → 192.168.1.12 SSH 102 Server: Encrypted packet (len=36)
   86 1.967069118  10.6.15.156 → 192.168.1.12 SSH 102 Server: Encrypted packet (len=36)
   87 1.967136146 192.168.1.12 → 10.6.15.156  TCP 66 54766 → 22 [ACK] Seq=2193 Ack=9021 Win=6155 Len=0 TSval=8214532 TSecr=15146032
   88 1.967474433 192.168.1.12 → 10.6.15.156  SSH 214 Client: Encrypted packet (len=148)
   89 1.969120095  10.6.15.156 → 192.168.1.12 TCP 66 22 → 54766 [ACK] Seq=9021 Ack=2341 Win=1452 Len=0 TSval=15146033 TSecr=8214532
   90 1.969142008 192.168.1.12 → 10.6.15.156  SSH 142 Client: Encrypted packet (len=76)
   91 1.970816995  10.6.15.156 → 192.168.1.12 TCP 66 22 → 54766 [ACK] Seq=9021 Ack=2417 Win=1452 Len=0 TSval=15146034 TSecr=8214532
   92 1.992650932  10.6.15.156 → 192.168.1.12 SSH 138 Server: Encrypted packet (len=72)
   93 1.992885065 192.168.1.12 → 10.6.15.156  SSH 102 Client: Encrypted packet (len=36)
   94 1.994954526  10.6.15.156 → 192.168.1.12 SSH 138 Server: Encrypted packet (len=72)
   95 1.995187562 192.168.1.12 → 10.6.15.156  SSH 102 Client: Encrypted packet (len=36)
   96 2.033654142  10.6.15.156 → 192.168.1.12 SSH 222 Server: Encrypted packet (len=156)
   97 2.069356604  10.6.15.156 → 192.168.1.12 SSH 150 Server: Encrypted packet (len=84)
   98 2.069442497 192.168.1.12 → 10.6.15.156  TCP 66 54766 → 22 [ACK] Seq=2489 Ack=9405 Win=6155 Len=0 TSval=8214557 TSecr=15146049
   99 2.097068854  10.6.15.156 → 192.168.1.12 SSH 374 Server: Encrypted packet (len=308)
  100 2.098637123  10.6.15.156 → 192.168.1.12 SSH 110 Server: Encrypted packet (len=44)
  101 2.254971715  10.6.15.156 → 192.168.1.12 SSH 254 Server: Encrypted packet (len=188)
  102 2.274038798  10.6.15.156 → 192.168.1.12 SSH 150 Server: Encrypted packet (len=84)
  103 2.274575341  10.6.15.156 → 192.168.1.12 SSH 398 Server: Encrypted packet (len=332)
  104 2.614538108 192.168.1.12 → 10.6.15.156  TCP 66 54766 → 22 [ACK] Seq=2489 Ack=9757 Win=6155 Len=0 TSval=8214565 TSecr=15146065
  105 2.614547859 192.168.1.12 → 10.6.15.156  TCP 66 54766 → 22 [ACK] Seq=2489 Ack=10029 Win=6155 Len=0 TSval=8214608 TSecr=15146105
  106 2.614550148 192.168.1.12 → 10.6.15.156  TCP 66 54766 → 22 [ACK] Seq=2489 Ack=10361 Win=6155 Len=0 TSval=8214620 TSecr=15146109
  107 2.615299379  10.6.15.156 → 192.168.1.12 SSH 318 Server: Encrypted packet (len=252)
  108 2.615354203  10.6.15.156 → 192.168.1.12 SSH 406 Server: Encrypted packet (len=340)
  109 2.615373125 192.168.1.12 → 10.6.15.156  TCP 66 54766 → 22 [ACK] Seq=2489 Ack=10953 Win=6155 Len=0 TSval=8214694 TSecr=15146122
  110 2.615528774  10.6.15.156 → 192.168.1.12 SSH 1174 Server: Encrypted packet (len=1108)
  111 2.615564400 192.168.1.12 → 10.6.15.156  TCP 66 54766 → 22 [ACK] Seq=2489 Ack=12061 Win=6155 Len=0 TSval=8214694 TSecr=15146141
  112 2.615724101  10.6.15.156 → 192.168.1.12 SSH 406 Server: Encrypted packet (len=340)
  113 2.615757491 192.168.1.12 → 10.6.15.156  TCP 66 54766 → 22 [ACK] Seq=2489 Ack=12401 Win=6155 Len=0 TSval=8214694 TSecr=15146162
  114 2.629019078 192.168.1.12 → 10.6.15.156  SSH 126 Client: Encrypted packet (len=60)
  115 2.670704578  10.6.15.156 → 192.168.1.12 TCP 66 22 → 54766 [ACK] Seq=12401 Ack=2549 Win=1452 Len=0 TSval=15146209 TSecr=8214697
  116 2.670726126 192.168.1.12 → 10.6.15.156  SSH 318 Client: Encrypted packet (len=252)
  117 2.672545550  10.6.15.156 → 192.168.1.12 TCP 66 22 → 54766 [ACK] Seq=12401 Ack=2801 Win=1452 Len=0 TSval=15146209 TSecr=8214708
  118 2.675527036  10.6.15.156 → 192.168.1.12 SSH 102 Server: Encrypted packet (len=36)
  119 2.675860896 192.168.1.12 → 10.6.15.156  SSH 126 Client: Encrypted packet (len=60)
  120 2.679444926  10.6.15.156 → 192.168.1.12 SSH 1514 Server: Encrypted packet (len=1448)
  121 2.679599706  10.6.15.156 → 192.168.1.12 SSH 1514 Server: Encrypted packet (len=1448)
  122 2.679609706 192.168.1.12 → 10.6.15.156  TCP 66 54766 → 22 [ACK] Seq=2861 Ack=15333 Win=6155 Len=0 TSval=8214710 TSecr=15146210
  123 2.679872730  10.6.15.156 → 192.168.1.12 SSH 798 Server: Encrypted packet (len=732)
  124 2.681340534  10.6.15.156 → 192.168.1.12 SSH 1514 Server: Encrypted packet (len=1448)
  125 2.681360420 192.168.1.12 → 10.6.15.156  TCP 66 54766 → 22 [ACK] Seq=2861 Ack=17513 Win=6155 Len=0 TSval=8214710 TSecr=15146210
  126 2.684491217  10.6.15.156 → 192.168.1.12 SSH 1514 Server: Encrypted packet (len=1448)
  127 2.684671859  10.6.15.156 → 192.168.1.12 SSH 1514 Server: Encrypted packet (len=1448)
  128 2.684679075 192.168.1.12 → 10.6.15.156  TCP 66 54766 → 22 [ACK] Seq=2861 Ack=20409 Win=6155 Len=0 TSval=8214711 TSecr=15146211
  129 2.684863070  10.6.15.156 → 192.168.1.12 SSH 1514 Server: Encrypted packet (len=1448)
  130 2.685055357  10.6.15.156 → 192.168.1.12 SSH 1514 Server: Encrypted packet (len=1448)
  131 2.685063326 192.168.1.12 → 10.6.15.156  TCP 66 54766 → 22 [ACK] Seq=2861 Ack=23305 Win=6155 Len=0 TSval=8214711 TSecr=15146211
  132 2.685254860  10.6.15.156 → 192.168.1.12 SSH 1514 Server: Encrypted packet (len=1448)
  133 2.685435989  10.6.15.156 → 192.168.1.12 SSH 1514 Server: Encrypted packet (len=1448)
  134 2.685441633 192.168.1.12 → 10.6.15.156  TCP 66 54766 → 22 [ACK] Seq=2861 Ack=26201 Win=6155 Len=0 TSval=8214711 TSecr=15146211
  135 2.685631798  10.6.15.156 → 192.168.1.12 SSH 1514 Server: Encrypted packet (len=1448)
  136 2.685974946  10.6.15.156 → 192.168.1.12 SSH 1514 Server: Encrypted packet (len=1448)
  137 2.685982441 192.168.1.12 → 10.6.15.156  TCP 66 54766 → 22 [ACK] Seq=2861 Ack=29097 Win=6155 Len=0 TSval=8214711 TSecr=15146211
  138 2.686162772  10.6.15.156 → 192.168.1.12 SSH 1514 Server: Encrypted packet (len=1448)
  139 2.689230295  10.6.15.156 → 192.168.1.12 SSH 1514 Server: Encrypted packet (len=1448)
  140 2.689246934 192.168.1.12 → 10.6.15.156  TCP 66 54766 → 22 [ACK] Seq=2861 Ack=31993 Win=6155 Len=0 TSval=8214712 TSecr=15146212
  141 2.689412572  10.6.15.156 → 192.168.1.12 SSH 1514 Server: Encrypted packet (len=1448)
  142 2.689593986  10.6.15.156 → 192.168.1.12 SSH 1514 Server: Encrypted packet (len=1448)
  143 2.689598180 192.168.1.12 → 10.6.15.156  TCP 66 54766 → 22 [ACK] Seq=2861 Ack=34889 Win=6155 Len=0 TSval=8214712 TSecr=15146213
  144 2.689796196  10.6.15.156 → 192.168.1.12 SSH 1514 Server: Encrypted packet (len=1448)
  145 2.689980707  10.6.15.156 → 192.168.1.12 SSH 1514 Server: Encrypted packet (len=1448)
  146 2.689986485 192.168.1.12 → 10.6.15.156  TCP 66 54766 → 22 [ACK] Seq=2861 Ack=37785 Win=6155 Len=0 TSval=8214712 TSecr=15146213
  147 2.690171805  10.6.15.156 → 192.168.1.12 SSH 1514 Server: Encrypted packet (len=1448)
  148 2.690365516  10.6.15.156 → 192.168.1.12 SSH 1514 Server: Encrypted packet (len=1448)
  149 2.690371336 192.168.1.12 → 10.6.15.156  TCP 66 54766 → 22 [ACK] Seq=2861 Ack=40681 Win=6155 Len=0 TSval=8214712 TSecr=15146213
  150 2.690555264  10.6.15.156 → 192.168.1.12 SSH 1514 Server: Encrypted packet (len=1448)
  151 2.693172867  10.6.15.156 → 192.168.1.12 SSH 1514 Server: Encrypted packet (len=1448)
  152 2.693188424 192.168.1.12 → 10.6.15.156  TCP 66 54766 → 22 [ACK] Seq=2861 Ack=43577 Win=6155 Len=0 TSval=8214713 TSecr=15146213
  153 2.693337943  10.6.15.156 → 192.168.1.12 SSH 1514 Server: Encrypted packet (len=1448)
  154 2.693529348  10.6.15.156 → 192.168.1.12 SSH 1514 Server: Encrypted packet (len=1448)
  155 2.693533194 192.168.1.12 → 10.6.15.156  TCP 66 54766 → 22 [ACK] Seq=2861 Ack=46473 Win=6155 Len=0 TSval=8214713 TSecr=15146214
  156 2.693722201  10.6.15.156 → 192.168.1.12 SSH 1514 Server: Encrypted packet (len=1448)
  157 2.693904975  10.6.15.156 → 192.168.1.12 SSH 1514 Server: Encrypted packet (len=1448)
  158 2.693909226 192.168.1.12 → 10.6.15.156  TCP 66 54766 → 22 [ACK] Seq=2861 Ack=49369 Win=6155 Len=0 TSval=8214713 TSecr=15146214
  159 2.694100171  10.6.15.156 → 192.168.1.12 SSH 1514 Server: Encrypted packet (len=1448)
  160 2.694450780  10.6.15.156 → 192.168.1.12 SSH 1514 Server: Encrypted packet (len=1448)
  161 2.694458616 192.168.1.12 → 10.6.15.156  TCP 66 54766 → 22 [ACK] Seq=2861 Ack=52265 Win=6155 Len=0 TSval=8214714 TSecr=15146214
  162 2.694650637  10.6.15.156 → 192.168.1.12 SSH 1514 Server: Encrypted packet (len=1448)
  163 2.694828014  10.6.15.156 → 192.168.1.12 SSH 1514 Server: Encrypted packet (len=1448)
  164 2.694835067 192.168.1.12 → 10.6.15.156  TCP 66 54766 → 22 [ACK] Seq=2861 Ack=55161 Win=6155 Len=0 TSval=8214714 TSecr=15146214
  165 2.697424733  10.6.15.156 → 192.168.1.12 SSH 1514 Server: Encrypted packet (len=1448)
  166 2.697593947  10.6.15.156 → 192.168.1.12 SSH 1514 Server: Encrypted packet (len=1448)
  167 2.697601305 192.168.1.12 → 10.6.15.156  TCP 66 54766 → 22 [ACK] Seq=2861 Ack=58057 Win=6155 Len=0 TSval=8214714 TSecr=15146215
  168 2.697785428  10.6.15.156 → 192.168.1.12 SSH 1514 Server: Encrypted packet (len=1448)
  169 2.697978263  10.6.15.156 → 192.168.1.12 SSH 1514 Server: Encrypted packet (len=1448)
  170 2.697981208 192.168.1.12 → 10.6.15.156  TCP 66 54766 → 22 [ACK] Seq=2861 Ack=60953 Win=6155 Len=0 TSval=8214714 TSecr=15146215
  171 2.698169232  10.6.15.156 → 192.168.1.12 SSH 1514 Server: Encrypted packet (len=1448)
  172 2.698356328  10.6.15.156 → 192.168.1.12 SSH 1514 Server: Encrypted packet (len=1448)
  173 2.698361044 192.168.1.12 → 10.6.15.156  TCP 66 54766 → 22 [ACK] Seq=2861 Ack=63849 Win=6155 Len=0 TSval=8214714 TSecr=15146215
  174 2.698701102  10.6.15.156 → 192.168.1.12 SSH 1514 Server: Encrypted packet (len=1448)
  175 2.698893750  10.6.15.156 → 192.168.1.12 SSH 1514 Server: Encrypted packet (len=1448)
  176 2.698902311 192.168.1.12 → 10.6.15.156  TCP 66 54766 → 22 [ACK] Seq=2861 Ack=66745 Win=6155 Len=0 TSval=8214715 TSecr=15146215
  177 2.699086092  10.6.15.156 → 192.168.1.12 SSH 1514 Server: Encrypted packet (len=1448)
  178 2.699277112  10.6.15.156 → 192.168.1.12 SSH 1514 Server: Encrypted packet (len=1448)
  179 2.699283649 192.168.1.12 → 10.6.15.156  TCP 66 54766 → 22 [ACK] Seq=2861 Ack=69641 Win=6155 Len=0 TSval=8214715 TSecr=15146215
  180 2.703968013  10.6.15.156 → 192.168.1.12 SSH 1514 Server: Encrypted packet (len=1448)
  181 2.704151064  10.6.15.156 → 192.168.1.12 SSH 1514 Server: Encrypted packet (len=1448)
  182 2.704157887 192.168.1.12 → 10.6.15.156  TCP 66 54766 → 22 [ACK] Seq=2861 Ack=72537 Win=6155 Len=0 TSval=8214716 TSecr=15146216
  183 2.704343901  10.6.15.156 → 192.168.1.12 SSH 1514 Server: Encrypted packet (len=1448)
  184 2.704545650  10.6.15.156 → 192.168.1.12 SSH 1514 Server: Encrypted packet (len=1448)
  185 2.704552471 192.168.1.12 → 10.6.15.156  TCP 66 54766 → 22 [ACK] Seq=2861 Ack=75433 Win=6155 Len=0 TSval=8214716 TSecr=15146216
  186 2.704738163  10.6.15.156 → 192.168.1.12 SSH 1514 Server: Encrypted packet (len=1448)
  187 2.704924239  10.6.15.156 → 192.168.1.12 SSH 1514 Server: Encrypted packet (len=1448)
  188 2.704928715 192.168.1.12 → 10.6.15.156  TCP 66 54766 → 22 [ACK] Seq=2861 Ack=78329 Win=6155 Len=0 TSval=8214716 TSecr=15146216
  189 2.705096293  10.6.15.156 → 192.168.1.12 SSH 1514 Server: Encrypted packet (len=1448)
  190 2.705279550  10.6.15.156 → 192.168.1.12 SSH 1514 Server: Encrypted packet (len=1448)
  191 2.705283336 192.168.1.12 → 10.6.15.156  TCP 66 54766 → 22 [ACK] Seq=2861 Ack=81225 Win=6155 Len=0 TSval=8214716 TSecr=15146216
  192 2.705471994  10.6.15.156 → 192.168.1.12 SSH 1514 Server: Encrypted packet (len=1448)
  193 2.705793658  10.6.15.156 → 192.168.1.12 SSH 1182 Server: Encrypted packet (len=1116)
  194 2.705797960 192.168.1.12 → 10.6.15.156  TCP 66 54766 → 22 [ACK] Seq=2861 Ack=83789 Win=6155 Len=0 TSval=8214716 TSecr=15146216
  195 2.707384957  10.6.15.156 → 192.168.1.12 SSH 358 Server: Encrypted packet (len=292)
  196 2.731722602  10.6.15.156 → 192.168.1.12 SSH 358 Server: Encrypted packet (len=292)
  197 2.731838413 192.168.1.12 → 10.6.15.156  TCP 66 54766 → 22 [ACK] Seq=2861 Ack=84373 Win=6155 Len=0 TSval=8214723 TSecr=15146218
  198 2.759257512  10.6.15.156 → 192.168.1.12 SSH 1514 Server: Encrypted packet (len=1448)
  199 2.759419833  10.6.15.156 → 192.168.1.12 SSH 1514 Server: Encrypted packet (len=1448)
  200 2.759431112 192.168.1.12 → 10.6.15.156  TCP 66 54766 → 22 [ACK] Seq=2861 Ack=87269 Win=6155 Len=0 TSval=8214730 TSecr=15146231
  201 2.759794594  10.6.15.156 → 192.168.1.12 SSH 1514 Server: Encrypted packet (len=1448)
  202 2.759926320  10.6.15.156 → 192.168.1.12 SSH 1446 Server: Encrypted packet (len=1380)
  203 2.759938671 192.168.1.12 → 10.6.15.156  TCP 66 54766 → 22 [ACK] Seq=2861 Ack=90097 Win=6155 Len=0 TSval=8214730 TSecr=15146231
  204 2.760116323  10.6.15.156 → 192.168.1.12 SSH 1514 Server: Encrypted packet (len=1448)
  205 2.760291500  10.6.15.156 → 192.168.1.12 SSH 1406 Server: Encrypted packet (len=1340)
  206 2.760299546 192.168.1.12 → 10.6.15.156  TCP 66 54766 → 22 [ACK] Seq=2861 Ack=92885 Win=6155 Len=0 TSval=8214730 TSecr=15146231
  207 2.761565853  10.6.15.156 → 192.168.1.12 SSH 1514 Server: Encrypted packet (len=1448)
  208 2.761759729  10.6.15.156 → 192.168.1.12 SSH 1514 Server: Encrypted packet (len=1448)
  209 2.761769585 192.168.1.12 → 10.6.15.156  TCP 66 54766 → 22 [ACK] Seq=2861 Ack=95781 Win=6155 Len=0 TSval=8214730 TSecr=15146231
  210 2.761941024  10.6.15.156 → 192.168.1.12 SSH 1514 Server: Encrypted packet (len=1448)
  211 2.762132265  10.6.15.156 → 192.168.1.12 SSH 1514 Server: Encrypted packet (len=1448)
  212 2.762137129 192.168.1.12 → 10.6.15.156  TCP 66 54766 → 22 [ACK] Seq=2861 Ack=98677 Win=6155 Len=0 TSval=8214730 TSecr=15146231
  213 2.762480836  10.6.15.156 → 192.168.1.12 SSH 1514 Server: Encrypted packet (len=1448)
  214 2.762669919  10.6.15.156 → 192.168.1.12 SSH 1514 Server: Encrypted packet (len=1448)
  215 2.762677029 192.168.1.12 → 10.6.15.156  TCP 66 54766 → 22 [ACK] Seq=2861 Ack=101573 Win=6155 Len=0 TSval=8214731 TSecr=15146231
  216 2.762868754  10.6.15.156 → 192.168.1.12 SSH 1514 Server: Encrypted packet (len=1448)
  217 2.763230297  10.6.15.156 → 192.168.1.12 SSH 1514 Server: Encrypted packet (len=1448)
  218 2.763241094 192.168.1.12 → 10.6.15.156  TCP 66 54766 → 22 [ACK] Seq=2861 Ack=104469 Win=6155 Len=0 TSval=8214731 TSecr=15146231
  219 2.763397275  10.6.15.156 → 192.168.1.12 SSH 1514 Server: Encrypted packet (len=1448)
  220 2.763405382  10.6.15.156 → 192.168.1.12 SSH 154 Server: Encrypted packet (len=88)
  221 2.763412744 192.168.1.12 → 10.6.15.156  TCP 66 54766 → 22 [ACK] Seq=2861 Ack=106005 Win=6155 Len=0 TSval=8214731 TSecr=15146231
  222 2.765990517  10.6.15.156 → 192.168.1.12 SSH 1514 Server: Encrypted packet (len=1448)
  223 2.766194945  10.6.15.156 → 192.168.1.12 SSH 1514 Server: Encrypted packet (len=1448)
  224 2.766203177 192.168.1.12 → 10.6.15.156  TCP 66 54766 → 22 [ACK] Seq=2861 Ack=108901 Win=6155 Len=0 TSval=8214731 TSecr=15146232
  225 2.766361031  10.6.15.156 → 192.168.1.12 SSH 1514 Server: Encrypted packet (len=1448)
  226 2.766565583  10.6.15.156 → 192.168.1.12 SSH 1454 Server: Encrypted packet (len=1388)
  227 2.766569230 192.168.1.12 → 10.6.15.156  TCP 66 54766 → 22 [ACK] Seq=2861 Ack=111737 Win=6155 Len=0 TSval=8214732 TSecr=15146232
  228 2.774849195  10.6.15.156 → 192.168.1.12 SSH 246 Server: Encrypted packet (len=180)
  229 2.818459780 192.168.1.12 → 10.6.15.156  TCP 66 54766 → 22 [ACK] Seq=2861 Ack=111917 Win=6155 Len=0 TSval=8214745 TSecr=15146235
  230 2.832828844  10.6.15.156 → 192.168.1.12 SSH 190 Server: Encrypted packet (len=124)
  231 2.935920346  10.6.15.156 → 192.168.1.12 SSH 222 Server: Encrypted packet (len=156)
  232 2.940139843  10.6.15.156 → 192.168.1.12 SSH 138 Server: Encrypted packet (len=72)
  233 2.962643803  10.6.15.156 → 192.168.1.12 TCP 138 [TCP Retransmission] 22 → 54766 [PSH, ACK] Seq=112197 Ack=2861 Win=1452 Len=72 TSval=15146282 TSecr=8214745
  234 3.330517483 192.168.1.12 → 10.6.15.156  TCP 66 54766 → 22 [ACK] Seq=2861 Ack=112041 Win=6155 Len=0 TSval=8214748 TSecr=15146249
  235 3.330526652 192.168.1.12 → 10.6.15.156  TCP 66 54766 → 22 [ACK] Seq=2861 Ack=112197 Win=6155 Len=0 TSval=8214774 TSecr=15146275
  236 3.330528409 192.168.1.12 → 10.6.15.156  TCP 66 54766 → 22 [ACK] Seq=2861 Ack=112269 Win=6155 Len=0 TSval=8214775 TSecr=15146276
  237 3.330529918 192.168.1.12 → 10.6.15.156  SSH 102 Client: Encrypted packet (len=36)
  238 3.330532403 192.168.1.12 → 10.6.15.156  TCP 78 [TCP Dup ACK 236#1] 54766 → 22 [ACK] Seq=2897 Ack=112269 Win=6155 Len=0 TSval=8214781 TSecr=15146282 SLE=112197 SRE=112269
  239 3.331274927  10.6.15.156 → 192.168.1.12 SSH 374 Server: Encrypted packet (len=308)
  240 3.331293016 192.168.1.12 → 10.6.15.156  TCP 66 54766 → 22 [ACK] Seq=2897 Ack=112577 Win=6155 Len=0 TSval=8214873 TSecr=15146331
  241 3.331450193  10.6.15.156 → 192.168.1.12 SSH 374 Server: Encrypted packet (len=308)
  242 3.331453939 192.168.1.12 → 10.6.15.156  TCP 66 54766 → 22 [ACK] Seq=2897 Ack=112885 Win=6155 Len=0 TSval=8214873 TSecr=15146347
  243 3.331627365  10.6.15.156 → 192.168.1.12 SSH 374 Server: Encrypted packet (len=308)
  244 3.331632803 192.168.1.12 → 10.6.15.156  TCP 66 54766 → 22 [ACK] Seq=2897 Ack=113193 Win=6155 Len=0 TSval=8214873 TSecr=15146362
  245 3.331778973  10.6.15.156 → 192.168.1.12 SSH 210 Server: Encrypted packet (len=144)
  246 3.331784322 192.168.1.12 → 10.6.15.156  TCP 66 54766 → 22 [ACK] Seq=2897 Ack=113337 Win=6155 Len=0 TSval=8214873 TSecr=15146368
  247 3.332075475 192.168.1.12 → 10.6.15.156  SSH 138 Client: Encrypted packet (len=72)
  248 3.335259834  10.6.15.156 → 192.168.1.12 TCP 66 22 → 54766 [ACK] Seq=113337 Ack=2969 Win=1452 Len=0 TSval=15146374 TSecr=8214775
  249 3.386979193  10.6.15.156 → 192.168.1.12 SSH 350 Server: Encrypted packet (len=284)
  250 3.430512170 192.168.1.12 → 10.6.15.156  TCP 66 54766 → 22 [ACK] Seq=2969 Ack=113621 Win=6155 Len=0 TSval=8214898 TSecr=15146388
  251 3.608035296  10.6.15.156 → 192.168.1.12 SSH 294 Server: Encrypted packet (len=228)
  252 3.676625717  10.6.15.156 → 192.168.1.12 SSH 406 Server: Encrypted packet (len=340)
  253 4.050587688 192.168.1.12 → 10.6.15.156  TCP 66 54766 → 22 [ACK] Seq=2969 Ack=113849 Win=6155 Len=0 TSval=8214942 TSecr=15146443
  254 4.050597918 192.168.1.12 → 10.6.15.156  TCP 66 54766 → 22 [ACK] Seq=2969 Ack=114189 Win=6155 Len=0 TSval=8214959 TSecr=15146460
  255 4.050599973 192.168.1.12 → 224.0.0.252  LLMNR 61 Standard query 0xf663 A x
  256 4.052529114  10.6.15.156 → 192.168.1.12 SSH 406 Server: Encrypted packet (len=340)
  257 4.052557092 192.168.1.12 → 10.6.15.156  TCP 66 54766 → 22 [ACK] Seq=2969 Ack=114529 Win=6155 Len=0 TSval=8215053 TSecr=15146475
  258 4.052662060  10.6.15.156 → 192.168.1.12 SSH 222 Server: Encrypted packet (len=156)
  259 4.052667413 192.168.1.12 → 10.6.15.156  TCP 66 54766 → 22 [ACK] Seq=2969 Ack=114685 Win=6155 Len=0 TSval=8215053 TSecr=15146500
  260 4.059219139  10.6.15.156 → 192.168.1.12 SSH 238 Server: Encrypted packet (len=172)
  261 4.059237001 192.168.1.12 → 10.6.15.156  TCP 66 54766 → 22 [ACK] Seq=2969 Ack=114857 Win=6155 Len=0 TSval=8215055 TSecr=15146556
  262 4.127455290  10.6.15.156 → 192.168.1.12 SSH 310 Server: Encrypted packet (len=244)
  263 4.127482834 192.168.1.12 → 10.6.15.156  TCP 66 54766 → 22 [ACK] Seq=2969 Ack=115101 Win=6155 Len=0 TSval=8215072 TSecr=15146573
  264 4.186030553  10.6.15.156 → 192.168.1.12 SSH 374 Server: Encrypted packet (len=308)
  265 4.186049097 192.168.1.12 → 10.6.15.156  TCP 66 54766 → 22 [ACK] Seq=2969 Ack=115409 Win=6155 Len=0 TSval=8215086 TSecr=15146587
  266 4.289264785  10.6.15.156 → 192.168.1.12 SSH 598 Server: Encrypted packet (len=532)
  267 4.766639610 192.168.1.12 → 224.0.0.252  LLMNR 61 Standard query 0xf663 A x
  268 4.766650201 192.168.1.12 → 10.6.15.156  TCP 66 54766 → 22 [ACK] Seq=2969 Ack=115941 Win=6155 Len=0 TSval=8215112 TSecr=15146613
  269 4.766652206 192.168.1.12 → 224.0.0.252  LLMNR 61 Standard query 0xf663 A x
  270 4.772281554  10.6.15.156 → 192.168.1.12 SSH 502 Server: Encrypted packet (len=436)
  271 4.772299794 192.168.1.12 → 10.6.15.156  TCP 66 54766 → 22 [ACK] Seq=2969 Ack=116377 Win=6155 Len=0 TSval=8215233 TSecr=15146668
  272 4.772321510  10.6.15.156 → 192.168.1.12 SSH 438 Server: Encrypted packet (len=372)
  273 4.772337950  10.6.15.156 → 192.168.1.12 SSH 470 Server: Encrypted packet (len=404)
  274 4.772392409 192.168.1.12 → 10.6.15.156  TCP 66 54766 → 22 [ACK] Seq=2969 Ack=117153 Win=6155 Len=0 TSval=8215233 TSecr=15146686
  275 4.772543740  10.6.15.156 → 192.168.1.12 SSH 374 Server: Encrypted packet (len=308)
  276 4.772582768 192.168.1.12 → 10.6.15.156  TCP 66 54766 → 22 [ACK] Seq=2969 Ack=117461 Win=6155 Len=0 TSval=8215233 TSecr=15146726
  277 4.961268790  10.6.15.156 → 192.168.1.12 SSH 190 Server: Encrypted packet (len=124)
  278 4.961347029 192.168.1.12 → 10.6.15.156  TCP 66 54766 → 22 [ACK] Seq=2969 Ack=117585 Win=6155 Len=0 TSval=8215280 TSecr=15146781
  279 5.029733544  10.6.15.156 → 192.168.1.12 SSH 182 Server: Encrypted packet (len=116)
  280 5.089977669  10.6.15.156 → 192.168.1.12 SSH 182 Server: Encrypted packet (len=116)
  281 5.192823493  10.6.15.156 → 192.168.1.12 SSH 206 Server: Encrypted packet (len=140)
  282 5.355054054  10.6.15.156 → 192.168.1.12 SSH 138 Server: Encrypted packet (len=72)
  283 5.486537309 192.168.1.12 → 10.6.15.156  TCP 66 54766 → 22 [ACK] Seq=2969 Ack=117701 Win=6155 Len=0 TSval=8215297 TSecr=15146798
  284 5.486547475 192.168.1.12 → 10.6.15.156  TCP 66 54766 → 22 [ACK] Seq=2969 Ack=117817 Win=6155 Len=0 TSval=8215312 TSecr=15146813
  285 5.486549211 192.168.1.12 → 10.6.15.156  TCP 66 54766 → 22 [ACK] Seq=2969 Ack=117957 Win=6155 Len=0 TSval=8215338 TSecr=15146839
  286 5.486551417 192.168.1.12 → 10.6.15.156  TCP 66 54766 → 22 [ACK] Seq=2969 Ack=118029 Win=6155 Len=0 TSval=8215379 TSecr=15146880
  287 5.486553482 192.168.1.12 → 10.6.15.156  SSH 102 Client: Encrypted packet (len=36)
  288 5.594504455  10.6.15.156 → 192.168.1.12 SSH 182 Server: [TCP Previous segment not captured] , Encrypted packet (len=116)
  289 5.594528421 192.168.1.12 → 10.6.15.156  TCP 78 [TCP Dup ACK 286#1] 54766 → 22 [ACK] Seq=3005 Ack=118029 Win=6155 Len=0 TSval=8215439 TSecr=15146880 SLE=118201 SRE=118317
  290 5.594541348  10.6.15.156 → 192.168.1.12 TCP 66 22 → 54766 [ACK] Seq=118317 Ack=3005 Win=1452 Len=0 TSval=15146923 TSecr=8215379
  291 5.594546934  10.6.15.156 → 192.168.1.12 SSH 182 Server: Encrypted packet (len=116)
  292 5.594550525 192.168.1.12 → 10.6.15.156  TCP 78 [TCP Dup ACK 286#2] 54766 → 22 [ACK] Seq=3005 Ack=118029 Win=6155 Len=0 TSval=8215439 TSecr=15146880 SLE=118201 SRE=118433
  293 5.642781875  10.6.15.156 → 192.168.1.12 TCP 238 [TCP Retransmission] 22 → 54766 [PSH, ACK] Seq=118029 Ack=3005 Win=1452 Len=172 TSval=15146952 TSecr=8215439
  294 5.642811417 192.168.1.12 → 10.6.15.156  TCP 66 54766 → 22 [ACK] Seq=3005 Ack=118433 Win=6155 Len=0 TSval=8215451 TSecr=15146952
  295 6.966546383 192.168.1.12 → 10.6.15.156  SSH 102 Client: Encrypted packet (len=36)
  296 6.967330343  10.6.15.156 → 192.168.1.12 SSH 270 Server: Encrypted packet (len=204)
  297 6.967350298 192.168.1.12 → 10.6.15.156  SSH 606 Client: Encrypted packet (len=540)
  298 6.967359410  10.6.15.156 → 192.168.1.12 SSH 206 Server: Encrypted packet (len=140)
  299 6.967364712  10.6.15.156 → 192.168.1.12 SSH 238 Server: Encrypted packet (len=172)
  300 6.967425884 192.168.1.12 → 10.6.15.156  TCP 66 54766 → 22 [ACK] Seq=3581 Ack=118949 Win=6155 Len=0 TSval=8215782 TSecr=15147038
  301 6.968024247  10.6.15.156 → 192.168.1.12 SSH 342 Server: Encrypted packet (len=276)
  302 6.968034267  10.6.15.156 → 192.168.1.12 SSH 182 Server: Encrypted packet (len=116)
  303 6.968038290  10.6.15.156 → 192.168.1.12 SSH 182 Server: Encrypted packet (len=116)
  304 6.968073747 192.168.1.12 → 10.6.15.156  TCP 66 54766 → 22 [ACK] Seq=3581 Ack=119457 Win=6155 Len=0 TSval=8215782 TSecr=15147119
  305 6.969023297  10.6.15.156 → 192.168.1.12 TCP 66 22 → 54766 [ACK] Seq=119457 Ack=3041 Win=1452 Len=0 TSval=15147283 TSecr=8215736
  306 6.969032058  10.6.15.156 → 192.168.1.12 TCP 66 22 → 54766 [ACK] Seq=119457 Ack=3581 Win=1452 Len=0 TSval=15147283 TSecr=8215782
  307 7.731610378  10.6.15.156 → 192.168.1.12 SSH 986 Server: Encrypted packet (len=920)
  308 7.731634942  10.6.15.156 → 192.168.1.12 SSH 302 Server: Encrypted packet (len=236)
  309 7.731643557  10.6.15.156 → 192.168.1.12 SSH 254 Server: Encrypted packet (len=188)
  310 7.731647464  10.6.15.156 → 192.168.1.12 SSH 210 Server: Encrypted packet (len=144)
  311 7.731654092 192.168.1.12 → 10.6.15.156  TCP 66 54766 → 22 [ACK] Seq=3581 Ack=120945 Win=6155 Len=0 TSval=8215973 TSecr=15147398
  312 7.732053359  10.6.15.156 → 192.168.1.12 SSH 238 Server: Encrypted packet (len=172)
  313 7.732173377 192.168.1.12 → 10.6.15.156  SSH 210 Client: Encrypted packet (len=144)
  314 7.733700222  10.6.15.156 → 192.168.1.12 TCP 66 22 → 54766 [ACK] Seq=121117 Ack=3725 Win=1452 Len=0 TSval=15147474 TSecr=8215973
  315 7.733721898 192.168.1.12 → 10.6.15.156  SSH 334 Client: Encrypted packet (len=268)
  316 7.735170981  10.6.15.156 → 192.168.1.12 TCP 66 22 → 54766 [ACK] Seq=121117 Ack=3993 Win=1452 Len=0 TSval=15147475 TSecr=8215973
  317 7.735608581  10.6.15.156 → 192.168.1.12 SSH 438 Server: Encrypted packet (len=372)
  318 7.778500956 192.168.1.12 → 10.6.15.156  TCP 66 54766 → 22 [ACK] Seq=3993 Ack=121489 Win=6155 Len=0 TSval=8215985 TSecr=15147475
  319 7.784391521  10.6.15.156 → 192.168.1.12 SSH 534 Server: Encrypted packet (len=468)
  320 7.784416229 192.168.1.12 → 10.6.15.156  TCP 66 54766 → 22 [ACK] Seq=3993 Ack=121957 Win=6155 Len=0 TSval=8215986 TSecr=15147487
  321 7.785015095  10.6.15.156 → 192.168.1.12 SSH 630 Server: Encrypted packet (len=564)
  322 7.785025067 192.168.1.12 → 10.6.15.156  TCP 66 54766 → 22 [ACK] Seq=3993 Ack=122521 Win=6155 Len=0 TSval=8215986 TSecr=15147487
  323 7.785959247  10.6.15.156 → 192.168.1.12 SSH 1350 Server: Encrypted packet (len=1284)
  324 7.785975179 192.168.1.12 → 10.6.15.156  TCP 66 54766 → 22 [ACK] Seq=3993 Ack=123805 Win=6155 Len=0 TSval=8215986 TSecr=15147487
  325 7.793167545 192.168.1.12 → 10.6.15.156  SSH 318 Client: Encrypted packet (len=252)
  326 7.794243688  10.6.15.156 → 192.168.1.12 SSH 438 Server: Encrypted packet (len=372)
  327 7.798611930  10.6.15.156 → 192.168.1.12 SSH 110 Server: Encrypted packet (len=44)
  328 7.798703402 192.168.1.12 → 10.6.15.156  TCP 66 54766 → 22 [ACK] Seq=4245 Ack=124221 Win=6155 Len=0 TSval=8215990 TSecr=15147489
  329 7.800134465 192.168.1.12 → 10.6.15.156  SSH 230 Client: Encrypted packet (len=164)
  330 7.841237979  10.6.15.156 → 192.168.1.12 TCP 66 22 → 54766 [ACK] Seq=124221 Ack=4409 Win=1452 Len=0 TSval=15147501 TSecr=8215990
  331 7.841252063  10.6.15.156 → 192.168.1.12 SSH 150 Server: Encrypted packet (len=84)
  332 7.843373189  10.6.15.156 → 192.168.1.12 SSH 302 Server: Encrypted packet (len=236)
  333 7.843824656  10.6.15.156 → 192.168.1.12 SSH 142 Server: Encrypted packet (len=76)
  334 7.845170958 192.168.1.12 → 10.6.15.156  TCP 66 54766 → 22 [ACK] Seq=4409 Ack=124617 Win=6155 Len=0 TSval=8216001 TSecr=15147501
  335 7.896848368  10.6.15.156 → 192.168.1.12 SSH 366 Server: Encrypted packet (len=300)
  336 8.117983936  10.6.15.156 → 192.168.1.12 SSH 270 Server: Encrypted packet (len=204)
  337 8.490541478 192.168.1.12 → 10.6.15.156  TCP 66 54766 → 22 [ACK] Seq=4409 Ack=124917 Win=6155 Len=0 TSval=8216025 TSecr=15147515
  338 8.490554525 192.168.1.12 → 216.58.199.131 TCP 66 40290 → 443 [ACK] Seq=1 Ack=1 Win=237 Len=0 TSval=8216064 TSecr=2652146454
  339 8.490556924 192.168.1.12 → 10.6.15.156  TCP 66 54766 → 22 [ACK] Seq=4409 Ack=125121 Win=6155 Len=0 TSval=8216069 TSecr=15147570
  340 8.491850731  10.6.15.156 → 192.168.1.12 SSH 270 Server: Encrypted packet (len=204)
  341 8.491875924 192.168.1.12 → 10.6.15.156  TCP 66 54766 → 22 [ACK] Seq=4409 Ack=125325 Win=6155 Len=0 TSval=8216163 TSecr=15147585
  342 8.491892125  10.6.15.156 → 192.168.1.12 SSH 206 Server: Encrypted packet (len=140)
  343 8.491898271 192.168.1.12 → 10.6.15.156  TCP 66 54766 → 22 [ACK] Seq=4409 Ack=125465 Win=6155 Len=0 TSval=8216163 TSecr=15147587
  344 8.491924997  10.6.15.156 → 192.168.1.12 SSH 326 Server: Encrypted packet (len=260)
  345 8.491929152 192.168.1.12 → 10.6.15.156  TCP 66 54766 → 22 [ACK] Seq=4409 Ack=125725 Win=6155 Len=0 TSval=8216163 TSecr=15147602
  346 8.491957644  10.6.15.156 → 192.168.1.12 SSH 230 Server: Encrypted packet (len=164)
  347 8.492000245 192.168.1.12 → 10.6.15.156  TCP 66 54766 → 22 [ACK] Seq=4409 Ack=125889 Win=6155 Len=0 TSval=8216163 TSecr=15147628
  348 8.528424085 216.58.199.131 → 192.168.1.12 TCP 66 [TCP ACKed unseen segment] 443 → 40290 [ACK] Seq=1 Ack=2 Win=175 Len=0 TSval=2652191908 TSecr=8193060
  349 8.569264623  10.6.15.156 → 192.168.1.12 SSH 582 Server: Encrypted packet (len=516)
  350 8.569351907 192.168.1.12 → 10.6.15.156  TCP 66 54766 → 22 [ACK] Seq=4409 Ack=126405 Win=6155 Len=0 TSval=8216182 TSecr=15147683
  351 8.637529933  10.6.15.156 → 192.168.1.12 SSH 390 Server: Encrypted packet (len=324)
  352 8.637617175 192.168.1.12 → 10.6.15.156  TCP 66 54766 → 22 [ACK] Seq=4409 Ack=126729 Win=6155 Len=0 TSval=8216199 TSecr=15147700
  353 8.696070136  10.6.15.156 → 192.168.1.12 SSH 270 Server: Encrypted packet (len=204)
  354 8.696160017 192.168.1.12 → 10.6.15.156  TCP 66 54766 → 22 [ACK] Seq=4409 Ack=126933 Win=6155 Len=0 TSval=8216214 TSecr=15147715
  355 8.799013003  10.6.15.156 → 192.168.1.12 SSH 518 Server: Encrypted packet (len=452)
  356 8.799103121 192.168.1.12 → 10.6.15.156  TCP 66 54766 → 22 [ACK] Seq=4409 Ack=127385 Win=6155 Len=0 TSval=8216240 TSecr=15147741
  357 8.856155864 192.168.1.12 → 10.6.15.156  SSH 138 Client: Encrypted packet (len=72)
  358 8.857709668  10.6.15.156 → 192.168.1.12 TCP 66 22 → 54766 [ACK] Seq=127385 Ack=4481 Win=1452 Len=0 TSval=15147755 TSecr=8216254
  359 8.857721437 192.168.1.12 → 10.6.15.156  SSH 234 Client: Encrypted packet (len=168)
  360 8.858146435  10.6.15.156 → 192.168.1.12 SSH 102 Server: Encrypted packet (len=36)
  361 8.858175332 192.168.1.12 → 10.6.15.156  TCP 66 54766 → 22 [ACK] Seq=4649 Ack=127421 Win=6155 Len=0 TSval=8216254 TSecr=15147755
  362 8.859785904  10.6.15.156 → 192.168.1.12 SSH 102 Server: Encrypted packet (len=36)
  363 8.859872828 192.168.1.12 → 10.6.15.156  TCP 66 54766 → 22 [ACK] Seq=4649 Ack=127457 Win=6155 Len=0 TSval=8216255 TSecr=15147756
  364 8.873848182  10.6.15.156 → 192.168.1.12 SSH 630 Server: Encrypted packet (len=564)
  365 8.873932649 192.168.1.12 → 10.6.15.156  TCP 66 54766 → 22 [ACK] Seq=4649 Ack=128021 Win=6155 Len=0 TSval=8216258 TSecr=15147759
  366 9.009133504  10.6.15.156 → 192.168.1.12 SSH 138 Server: Encrypted packet (len=72)
  367 9.009224293 192.168.1.12 → 10.6.15.156  TCP 66 54766 → 22 [ACK] Seq=4649 Ack=128093 Win=6155 Len=0 TSval=8216292 TSecr=15147793
  368 9.009653856 192.168.1.12 → 10.6.15.156  SSH 710 Client: Encrypted packet (len=644)
  369 9.020650196  10.6.15.156 → 192.168.1.12 SSH 334 Server: Encrypted packet (len=268)
  370 9.020676890 192.168.1.12 → 10.6.15.156  SSH 198 Client: Encrypted packet (len=132)
  371 9.058765308  10.6.15.156 → 192.168.1.12 TCP 66 22 → 54766 [ACK] Seq=128361 Ack=5425 Win=1452 Len=0 TSval=15147806 TSecr=8216295
  372 9.088668908  10.6.15.156 → 192.168.1.12 SSH 438 Server: Encrypted packet (len=372)
  373 9.130491009 192.168.1.12 → 10.6.15.156  TCP 66 54766 → 22 [ACK] Seq=5425 Ack=128733 Win=6155 Len=0 TSval=8216323 TSecr=15147813
  374 9.148059725  10.6.15.156 → 192.168.1.12 SSH 438 Server: Encrypted packet (len=372)
  375 9.148148112 192.168.1.12 → 10.6.15.156  TCP 66 54766 → 22 [ACK] Seq=5425 Ack=129105 Win=6155 Len=0 TSval=8216327 TSecr=15147828
  376 9.165016968  10.6.15.156 → 192.168.1.12 SSH 382 Server: Encrypted packet (len=316)
  377 9.165091788 192.168.1.12 → 10.6.15.156  TCP 66 54766 → 22 [ACK] Seq=5425 Ack=129421 Win=6155 Len=0 TSval=8216331 TSecr=15147832
  378 9.176905593  10.6.15.156 → 192.168.1.12 SSH 198 Server: Encrypted packet (len=132)
  379 9.176971752 192.168.1.12 → 10.6.15.156  TCP 66 54766 → 22 [ACK] Seq=5425 Ack=129553 Win=6155 Len=0 TSval=8216334 TSecr=15147835
  380 9.249831973  10.6.15.156 → 192.168.1.12 SSH 406 Server: Encrypted packet (len=340)
  381 9.249898611 192.168.1.12 → 10.6.15.156  TCP 66 54766 → 22 [ACK] Seq=5425 Ack=129893 Win=6155 Len=0 TSval=8216352 TSecr=15147853
  382 9.471196067  10.6.15.156 → 192.168.1.12 SSH 182 Server: Encrypted packet (len=116)
  383 9.471283232 192.168.1.12 → 10.6.15.156  TCP 66 54766 → 22 [ACK] Seq=5425 Ack=130009 Win=6155 Len=0 TSval=8216408 TSecr=15147909
  384 9.539483414  10.6.15.156 → 192.168.1.12 SSH 222 Server: Encrypted packet (len=156)
  385 9.539571419 192.168.1.12 → 10.6.15.156  TCP 66 54766 → 22 [ACK] Seq=5425 Ack=130165 Win=6155 Len=0 TSval=8216425 TSecr=15147926
  386 9.598213658  10.6.15.156 → 192.168.1.12 SSH 286 Server: Encrypted packet (len=220)
  387 9.598302863 192.168.1.12 → 10.6.15.156  TCP 66 54766 → 22 [ACK] Seq=5425 Ack=130385 Win=6155 Len=0 TSval=8216439 TSecr=15147940
  388 9.922132017  10.6.15.156 → 192.168.1.12 SSH 374 Server: Encrypted packet (len=308)
  389 9.922222811 192.168.1.12 → 10.6.15.156  TCP 66 54766 → 22 [ACK] Seq=5425 Ack=130693 Win=6155 Len=0 TSval=8216520 TSecr=15148021
  390 9.991270879  10.6.15.156 → 192.168.1.12 SSH 326 Server: Encrypted packet (len=260)
  391 9.991360854 192.168.1.12 → 10.6.15.156  TCP 66 54766 → 22 [ACK] Seq=5425 Ack=130953 Win=6155 Len=0 TSval=8216538 TSecr=15148039
  392 10.049193230  10.6.15.156 → 192.168.1.12 SSH 318 Server: Encrypted packet (len=252)
  393 10.049281869 192.168.1.12 → 10.6.15.156  TCP 66 54766 → 22 [ACK] Seq=5425 Ack=131205 Win=6155 Len=0 TSval=8216552 TSecr=15148053
  394 10.151945574  10.6.15.156 → 192.168.1.12 SSH 326 Server: Encrypted packet (len=260)
  395 10.152035362 192.168.1.12 → 10.6.15.156  TCP 66 54766 → 22 [ACK] Seq=5425 Ack=131465 Win=6155 Len=0 TSval=8216578 TSecr=15148079
  396 10.373235140  10.6.15.156 → 192.168.1.12 SSH 222 Server: Encrypted packet (len=156)
  397 10.373324777 192.168.1.12 → 10.6.15.156  TCP 66 54766 → 22 [ACK] Seq=5425 Ack=131621 Win=6155 Len=0 TSval=8216633 TSecr=15148134
  398 10.441377872  10.6.15.156 → 192.168.1.12 SSH 238 Server: Encrypted packet (len=172)
  399 10.441466721 192.168.1.12 → 10.6.15.156  TCP 66 54766 → 22 [ACK] Seq=5425 Ack=131793 Win=6155 Len=0 TSval=8216650 TSecr=15148151
  400 10.500170943  10.6.15.156 → 192.168.1.12 SSH 302 Server: Encrypted packet (len=236)
  401 10.500261569 192.168.1.12 → 10.6.15.156  TCP 66 54766 → 22 [ACK] Seq=5425 Ack=132029 Win=6155 Len=0 TSval=8216665 TSecr=15148166
  402 10.602868045  10.6.15.156 → 192.168.1.12 SSH 406 Server: Encrypted packet (len=340)
  403 10.602960505 192.168.1.12 → 10.6.15.156  TCP 66 54766 → 22 [ACK] Seq=5425 Ack=132369 Win=6155 Len=0 TSval=8216691 TSecr=15148192
  404 10.824514437  10.6.15.156 → 192.168.1.12 SSH 406 Server: Encrypted packet (len=340)
  405 10.824602821 192.168.1.12 → 10.6.15.156  TCP 66 54766 → 22 [ACK] Seq=5425 Ack=132709 Win=6155 Len=0 TSval=8216746 TSecr=15148247
  406 10.895402685  10.6.15.156 → 192.168.1.12 SSH 374 Server: Encrypted packet (len=308)
  407 10.895491610 192.168.1.12 → 10.6.15.156  TCP 66 54766 → 22 [ACK] Seq=5425 Ack=133017 Win=6155 Len=0 TSval=8216764 TSecr=15148264
  408 10.951091445  10.6.15.156 → 192.168.1.12 SSH 374 Server: Encrypted packet (len=308)
  409 10.951183583 192.168.1.12 → 10.6.15.156  TCP 66 54766 → 22 [ACK] Seq=5425 Ack=133325 Win=6155 Len=0 TSval=8216778 TSecr=15148279
  410 11.054716243  10.6.15.156 → 192.168.1.12 SSH 270 Server: Encrypted packet (len=204)
  411 11.054807092 192.168.1.12 → 10.6.15.156  TCP 66 54766 → 22 [ACK] Seq=5425 Ack=133529 Win=6155 Len=0 TSval=8216804 TSecr=15148304
  412 11.274884934  10.6.15.156 → 192.168.1.12 SSH 270 Server: Encrypted packet (len=204)
  413 11.274976166 192.168.1.12 → 10.6.15.156  TCP 66 54766 → 22 [ACK] Seq=5425 Ack=133733 Win=6155 Len=0 TSval=8216859 TSecr=15148360
  414 11.343535201  10.6.15.156 → 192.168.1.12 SSH 334 Server: Encrypted packet (len=268)
  415 11.343625530 192.168.1.12 → 10.6.15.156  TCP 66 54766 → 22 [ACK] Seq=5425 Ack=134001 Win=6155 Len=0 TSval=8216876 TSecr=15148377
  416 11.402082716  10.6.15.156 → 192.168.1.12 SSH 270 Server: Encrypted packet (len=204)
  417 11.402171400 192.168.1.12 → 10.6.15.156  TCP 66 54766 → 22 [ACK] Seq=5425 Ack=134205 Win=6155 Len=0 TSval=8216890 TSecr=15148391
  418 11.504639457  10.6.15.156 → 192.168.1.12 SSH 270 Server: Encrypted packet (len=204)
  419 11.504733371 192.168.1.12 → 10.6.15.156  TCP 66 54766 → 22 [ACK] Seq=5425 Ack=134409 Win=6155 Len=0 TSval=8216916 TSecr=15148417
  420 11.852939978  10.6.15.156 → 192.168.1.12 SSH 182 Server: Encrypted packet (len=116)
  421 11.853017522 192.168.1.12 → 10.6.15.156  TCP 66 54766 → 22 [ACK] Seq=5425 Ack=134525 Win=6155 Len=0 TSval=8217003 TSecr=15148504
  422 11.955644061  10.6.15.156 → 192.168.1.12 SSH 238 Server: Encrypted packet (len=172)
  423 11.955723532 192.168.1.12 → 10.6.15.156  TCP 66 54766 → 22 [ACK] Seq=5425 Ack=134697 Win=6155 Len=0 TSval=8217029 TSecr=15148530
  424 12.177105514  10.6.15.156 → 192.168.1.12 SSH 334 Server: Encrypted packet (len=268)
  425 12.177180064 192.168.1.12 → 10.6.15.156  TCP 66 54766 → 22 [ACK] Seq=5425 Ack=134965 Win=6155 Len=0 TSval=8217084 TSecr=15148585
  426 12.245516344  10.6.15.156 → 192.168.1.12 SSH 302 Server: Encrypted packet (len=236)
  427 12.245589848 192.168.1.12 → 10.6.15.156  TCP 66 54766 → 22 [ACK] Seq=5425 Ack=135201 Win=6155 Len=0 TSval=8217101 TSecr=15148602
  428 12.303975729  10.6.15.156 → 192.168.1.12 SSH 302 Server: Encrypted packet (len=236)
  429 12.304063486 192.168.1.12 → 10.6.15.156  TCP 66 54766 → 22 [ACK] Seq=5425 Ack=135437 Win=6155 Len=0 TSval=8217116 TSecr=15148617
  430 12.406727293  10.6.15.156 → 192.168.1.12 SSH 254 Server: Encrypted packet (len=188)
  431 12.406818494 192.168.1.12 → 10.6.15.156  TCP 66 54766 → 22 [ACK] Seq=5425 Ack=135625 Win=6155 Len=0 TSval=8217142 TSecr=15148643
  432 12.453340302 192.168.1.12 → 10.6.15.156  SSH 1514 Client: Encrypted packet (len=1448)
  433 12.455782563  10.6.15.156 → 192.168.1.12 TCP 66 22 → 54766 [ACK] Seq=135625 Ack=6873 Win=1452 Len=0 TSval=15148655 TSecr=8217153
  434 12.455804009 192.168.1.12 → 10.6.15.156  SSH 606 Client: Encrypted packet (len=540)
  435 12.457577070  10.6.15.156 → 192.168.1.12 TCP 66 22 → 54766 [ACK] Seq=135625 Ack=7413 Win=1452 Len=0 TSval=15148655 TSecr=8217154
  436 12.460338874  10.6.15.156 → 192.168.1.12 SSH 142 Server: Encrypted packet (len=76)
  437 12.460428663 192.168.1.12 → 10.6.15.156  TCP 66 54766 → 22 [ACK] Seq=7413 Ack=135701 Win=6155 Len=0 TSval=8217155 TSecr=15148656
  438 12.566148163  10.6.15.156 → 192.168.1.12 SSH 918 Server: Encrypted packet (len=852)
  439 12.566241066 192.168.1.12 → 10.6.15.156  TCP 66 54766 → 22 [ACK] Seq=7413 Ack=136553 Win=6155 Len=0 TSval=8217181 TSecr=15148682
  440 12.566772400  10.6.15.156 → 192.168.1.12 SSH 606 Server: Encrypted packet (len=540)
  441 12.566844783 192.168.1.12 → 10.6.15.156  TCP 66 54766 → 22 [ACK] Seq=7413 Ack=137093 Win=6155 Len=0 TSval=8217182 TSecr=15148683
  442 12.569147698 192.168.1.12 → 10.6.15.156  SSH 134 Client: Encrypted packet (len=68)
  443 12.610700761  10.6.15.156 → 192.168.1.12 TCP 66 22 → 54766 [ACK] Seq=137093 Ack=7481 Win=1452 Len=0 TSval=15148694 TSecr=8217182
  444 12.628012185  10.6.15.156 → 192.168.1.12 SSH 326 Server: Encrypted packet (len=260)
  445 12.670512662 192.168.1.12 → 10.6.15.156  TCP 66 54766 → 22 [ACK] Seq=7481 Ack=137353 Win=6155 Len=0 TSval=8217208 TSecr=15148698
  446 12.696568343  10.6.15.156 → 192.168.1.12 SSH 182 Server: Encrypted packet (len=116)
  447 12.696657496 192.168.1.12 → 10.6.15.156  TCP 66 54766 → 22 [ACK] Seq=7481 Ack=137469 Win=6155 Len=0 TSval=8217214 TSecr=15148715
  448 12.858431327  10.6.15.156 → 192.168.1.12 SSH 254 Server: Encrypted packet (len=188)
  449 12.858506706 192.168.1.12 → 10.6.15.156  TCP 66 54766 → 22 [ACK] Seq=7481 Ack=137657 Win=6155 Len=0 TSval=8217255 TSecr=15148755
  450 13.078937739  10.6.15.156 → 192.168.1.12 SSH 182 Server: Encrypted packet (len=116)
  451 13.079027779 192.168.1.12 → 10.6.15.156  TCP 66 54766 → 22 [ACK] Seq=7481 Ack=137773 Win=6155 Len=0 TSval=8217310 TSecr=15148811
  452 13.148247863  10.6.15.156 → 192.168.1.12 SSH 286 Server: Encrypted packet (len=220)
  453 13.148338420 192.168.1.12 → 10.6.15.156  TCP 66 54766 → 22 [ACK] Seq=7481 Ack=137993 Win=6155 Len=0 TSval=8217327 TSecr=15148828
  454 13.154196975  10.6.15.156 → 192.168.1.12 SSH 158 Server: Encrypted packet (len=92)
  455 13.154283359 192.168.1.12 → 10.6.15.156  TCP 66 54766 → 22 [ACK] Seq=7481 Ack=138085 Win=6155 Len=0 TSval=8217328 TSecr=15148829
  456 13.154522867 192.168.1.12 → 10.6.15.156  SSH 150 Client: Encrypted packet (len=84)
  457 13.156069780  10.6.15.156 → 192.168.1.12 TCP 66 22 → 54766 [ACK] Seq=138085 Ack=7565 Win=1452 Len=0 TSval=15148830 TSecr=8217329
  458 13.206054630  10.6.15.156 → 192.168.1.12 SSH 286 Server: Encrypted packet (len=220)
  459 13.246509193 192.168.1.12 → 10.6.15.156  TCP 66 54766 → 22 [ACK] Seq=7565 Ack=138305 Win=6155 Len=0 TSval=8217352 TSecr=15148842
  460 13.308670986  10.6.15.156 → 192.168.1.12 SSH 190 Server: Encrypted packet (len=124)
  461 13.308750492 192.168.1.12 → 10.6.15.156  TCP 66 54766 → 22 [ACK] Seq=7565 Ack=138429 Win=6155 Len=0 TSval=8217367 TSecr=15148868
  462 13.379383961  10.6.15.156 → 192.168.1.12 SSH 150 Server: Encrypted packet (len=84)
  463 13.379471992 192.168.1.12 → 10.6.15.156  TCP 66 54766 → 22 [ACK] Seq=7565 Ack=138513 Win=6155 Len=0 TSval=8217385 TSecr=15148886
  464 13.379730981 192.168.1.12 → 10.6.15.156  SSH 150 Client: Encrypted packet (len=84)
  465 13.381445967  10.6.15.156 → 192.168.1.12 TCP 66 22 → 54766 [ACK] Seq=138513 Ack=7649 Win=1452 Len=0 TSval=15148886 TSecr=8217385
  466 13.759551691  10.6.15.156 → 192.168.1.12 SSH 182 Server: Encrypted packet (len=116)
  467 13.802508916 192.168.1.12 → 10.6.15.156  TCP 66 54766 → 22 [ACK] Seq=7649 Ack=138629 Win=6155 Len=0 TSval=8217491 TSecr=15148981
  468 13.858163367 192.168.1.12 → 10.6.15.156  SSH 102 Client: Encrypted packet (len=36)
  469 13.859564433  10.6.15.156 → 192.168.1.12 TCP 66 22 → 54766 [ACK] Seq=138629 Ack=7685 Win=1452 Len=0 TSval=15149006 TSecr=8217504
  470 13.859581457 192.168.1.12 → 10.6.15.156  SSH 190 Client: Encrypted packet (len=124)
  471 13.861159186  10.6.15.156 → 192.168.1.12 TCP 66 22 → 54766 [ACK] Seq=138629 Ack=7809 Win=1452 Len=0 TSval=15149006 TSecr=8217505
  472 13.908701791  10.6.15.156 → 192.168.1.12 SSH 138 Server: Encrypted packet (len=72)
  473 13.908720670 192.168.1.12 → 10.6.15.156  TCP 66 54766 → 22 [ACK] Seq=7809 Ack=138701 Win=6155 Len=0 TSval=8217517 TSecr=15149018
  474 13.908972723 192.168.1.12 → 10.6.15.156  SSH 102 Client: Encrypted packet (len=36)
  475 13.910236341  10.6.15.156 → 192.168.1.12 SSH 210 Server: Encrypted packet (len=144)
  476 13.910263550  10.6.15.156 → 192.168.1.12 TCP 66 22 → 54766 [ACK] Seq=138845 Ack=7845 Win=1452 Len=0 TSval=15149018 TSecr=8217517
  477 13.910565921 192.168.1.12 → 10.6.15.156  SSH 138 Client: Encrypted packet (len=72)
  478 13.912070457  10.6.15.156 → 192.168.1.12 TCP 66 22 → 54766 [ACK] Seq=138845 Ack=7917 Win=1452 Len=0 TSval=15149019 TSecr=8217518
  479 13.933963106 192.168.1.12 → 192.168.1.1  DNS 81 Standard query 0xc413 A 1.ubuntu.pool.ntp.org
  480 13.936497441  192.168.1.1 → 192.168.1.12 DNS 145 Standard query response 0xc413 A 1.ubuntu.pool.ntp.org A 13.126.27.131 A 139.59.50.38 A 123.108.200.124 A 139.59.21.22
  481 13.936948150 192.168.1.12 → 13.126.27.131 NTP 90 NTP Version 4, client
  482 13.980937543  10.6.15.156 → 192.168.1.12 SSH 222 Server: Encrypted packet (len=156)
  483 14.022510967 192.168.1.12 → 10.6.15.156  TCP 66 54766 → 22 [ACK] Seq=7917 Ack=139001 Win=6155 Len=0 TSval=8217546 TSecr=15149036
  484 14.049793923  10.6.15.156 → 192.168.1.12 SSH 222 Server: Encrypted packet (len=156)
  485 14.049819852 192.168.1.12 → 10.6.15.156  TCP 66 54766 → 22 [ACK] Seq=7917 Ack=139157 Win=6155 Len=0 TSval=8217552 TSecr=15149053
  486 14.075215474  10.6.15.156 → 192.168.1.12 SSH 110 Server: Encrypted packet (len=44)
  487 14.075233335 192.168.1.12 → 10.6.15.156  TCP 66 54766 → 22 [ACK] Seq=7917 Ack=139201 Win=6155 Len=0 TSval=8217559 TSecr=15149060
  488 14.075662320 192.168.1.12 → 10.6.15.156  SSH 358 Client: Encrypted packet (len=292)
  489 14.077318891  10.6.15.156 → 192.168.1.12 TCP 66 22 → 54766 [ACK] Seq=139201 Ack=8209 Win=1452 Len=0 TSval=15149060 TSecr=8217559
  490 14.108098549  10.6.15.156 → 192.168.1.12 SSH 222 Server: Encrypted packet (len=156)
  491 14.150487602 192.168.1.12 → 10.6.15.156  TCP 66 54766 → 22 [ACK] Seq=8209 Ack=139357 Win=6155 Len=0 TSval=8217578 TSecr=15149068
  492 14.210757365  10.6.15.156 → 192.168.1.12 SSH 182 Server: Encrypted packet (len=116)
  493 14.210783169 192.168.1.12 → 10.6.15.156  TCP 66 54766 → 22 [ACK] Seq=8209 Ack=139473 Win=6155 Len=0 TSval=8217593 TSecr=15149094
  494 14.293172094  10.6.15.156 → 192.168.1.12 SSH 198 Server: Encrypted packet (len=132)
  495 14.293190376 192.168.1.12 → 10.6.15.156  TCP 66 54766 → 22 [ACK] Seq=8209 Ack=139605 Win=6155 Len=0 TSval=8217613 TSecr=15149114
  496 14.432032046  10.6.15.156 → 192.168.1.12 SSH 222 Server: Encrypted packet (len=156)
  497 14.432061189 192.168.1.12 → 10.6.15.156  TCP 66 54766 → 22 [ACK] Seq=8209 Ack=139761 Win=6155 Len=0 TSval=8217648 TSecr=15149149
  498 14.500286981  10.6.15.156 → 192.168.1.12 SSH 222 Server: Encrypted packet (len=156)
  499 14.500305176 192.168.1.12 → 10.6.15.156  TCP 66 54766 → 22 [ACK] Seq=8209 Ack=139917 Win=6155 Len=0 TSval=8217665 TSecr=15149166
  500 14.559046558  10.6.15.156 → 192.168.1.12 SSH 270 Server: Encrypted packet (len=204)
  501 14.559064193 192.168.1.12 → 10.6.15.156  TCP 66 54766 → 22 [ACK] Seq=8209 Ack=140121 Win=6155 Len=0 TSval=8217680 TSecr=15149181
  502 14.661670091  10.6.15.156 → 192.168.1.12 SSH 270 Server: Encrypted packet (len=204)
  503 14.661762043 192.168.1.12 → 10.6.15.156  TCP 66 54766 → 22 [ACK] Seq=8209 Ack=140325 Win=6155 Len=0 TSval=8217705 TSecr=15149206
  504 14.883021807  10.6.15.156 → 192.168.1.12 SSH 310 Server: Encrypted packet (len=244)
  505 14.883112195 192.168.1.12 → 10.6.15.156  TCP 66 54766 → 22 [ACK] Seq=8209 Ack=140569 Win=6155 Len=0 TSval=8217761 TSecr=15149262
  506 14.951499899  10.6.15.156 → 192.168.1.12 SSH 302 Server: Encrypted packet (len=236)
  507 14.951589220 192.168.1.12 → 10.6.15.156  TCP 66 54766 → 22 [ACK] Seq=8209 Ack=140805 Win=6155 Len=0 TSval=8217778 TSecr=15149279
  508 15.010180388  10.6.15.156 → 192.168.1.12 SSH 270 Server: Encrypted packet (len=204)
  509 15.010273043 192.168.1.12 → 10.6.15.156  TCP 66 54766 → 22 [ACK] Seq=8209 Ack=141009 Win=6155 Len=0 TSval=8217792 TSecr=15149293
  510 15.112968205  10.6.15.156 → 192.168.1.12 SSH 270 Server: Encrypted packet (len=204)
  511 15.113057649 192.168.1.12 → 10.6.15.156  TCP 66 54766 → 22 [ACK] Seq=8209 Ack=141213 Win=6155 Len=0 TSval=8217818 TSecr=15149319
  512 15.563800258  10.6.15.156 → 192.168.1.12 SSH 182 Server: Encrypted packet (len=116)
  513 15.563828163 192.168.1.12 → 10.6.15.156  TCP 66 54766 → 22 [ACK] Seq=8209 Ack=141329 Win=6155 Len=0 TSval=8217931 TSecr=15149432
  514 15.785082013  10.6.15.156 → 192.168.1.12 SSH 182 Server: Encrypted packet (len=116)
  515 15.785099300 192.168.1.12 → 10.6.15.156  TCP 66 54766 → 22 [ACK] Seq=8209 Ack=141445 Win=6155 Len=0 TSval=8217986 TSecr=15149487
  516 15.853364475  10.6.15.156 → 192.168.1.12 SSH 270 Server: Encrypted packet (len=204)
  517 15.853380269 192.168.1.12 → 10.6.15.156  TCP 66 54766 → 22 [ACK] Seq=8209 Ack=141649 Win=6155 Len=0 TSval=8218003 TSecr=15149504
  518 15.912971754  10.6.15.156 → 192.168.1.12 SSH 182 Server: Encrypted packet (len=116)
  519 15.912989606 192.168.1.12 → 10.6.15.156  TCP 66 54766 → 22 [ACK] Seq=8209 Ack=141765 Win=6155 Len=0 TSval=8218018 TSecr=15149519
  520 16.015376252  10.6.15.156 → 192.168.1.12 SSH 238 Server: Encrypted packet (len=172)
  521 16.015393939 192.168.1.12 → 10.6.15.156  TCP 66 54766 → 22 [ACK] Seq=8209 Ack=141937 Win=6155 Len=0 TSval=8218044 TSecr=15149545
  522 16.027130867  10.6.15.156 → 192.168.1.12 SSH 150 Server: Encrypted packet (len=84)
  523 16.027148865 192.168.1.12 → 10.6.15.156  TCP 66 54766 → 22 [ACK] Seq=8209 Ack=142021 Win=6155 Len=0 TSval=8218047 TSecr=15149548
  524 16.027423843 192.168.1.12 → 10.6.15.156  SSH 150 Client: Encrypted packet (len=84)
  525 16.066600112  10.6.15.156 → 192.168.1.12 TCP 66 22 → 54766 [ACK] Seq=142021 Ack=8293 Win=1452 Len=0 TSval=15149558 TSecr=8218047
  526 16.237652764  10.6.15.156 → 192.168.1.12 SSH 238 Server: Encrypted packet (len=172)
  527 16.278510623 192.168.1.12 → 10.6.15.156  TCP 66 54766 → 22 [ACK] Seq=8293 Ack=142193 Win=6155 Len=0 TSval=8218110 TSecr=15149600
  528 16.305357461  10.6.15.156 → 192.168.1.12 SSH 302 Server: Encrypted packet (len=236)
  529 16.305381556 192.168.1.12 → 10.6.15.156  TCP 66 54766 → 22 [ACK] Seq=8293 Ack=142429 Win=6155 Len=0 TSval=8218116 TSecr=15149617
  530 16.331321696  10.6.15.156 → 192.168.1.12 SSH 190 Server: Encrypted packet (len=124)
  531 16.331338144 192.168.1.12 → 10.6.15.156  TCP 66 54766 → 22 [ACK] Seq=8293 Ack=142553 Win=6155 Len=0 TSval=8218123 TSecr=15149624
  532 16.340567554  10.6.15.156 → 192.168.1.12 SSH 190 Server: Encrypted packet (len=124)
  533 16.340585981 192.168.1.12 → 10.6.15.156  TCP 66 54766 → 22 [ACK] Seq=8293 Ack=142677 Win=6155 Len=0 TSval=8218125 TSecr=15149626
  534 16.363155447  10.6.15.156 → 192.168.1.12 SSH 406 Server: Encrypted packet (len=340)
  535 16.363173709 192.168.1.12 → 10.6.15.156  TCP 66 54766 → 22 [ACK] Seq=8293 Ack=143017 Win=6155 Len=0 TSval=8218131 TSecr=15149632
  536 16.465669428  10.6.15.156 → 192.168.1.12 SSH 302 Server: Encrypted packet (len=236)
  537 16.465687154 192.168.1.12 → 10.6.15.156  TCP 66 54766 → 22 [ACK] Seq=8293 Ack=143253 Win=6155 Len=0 TSval=8218156 TSecr=15149657
  538 16.570737304  10.6.15.156 → 192.168.1.12 SSH 150 Server: Encrypted packet (len=84)
  539 16.570754504 192.168.1.12 → 10.6.15.156  TCP 66 54766 → 22 [ACK] Seq=8293 Ack=143337 Win=6155 Len=0 TSval=8218183 TSecr=15149684
  540 16.571058273 192.168.1.12 → 10.6.15.156  SSH 150 Client: Encrypted packet (len=84)
  541 16.572498502  10.6.15.156 → 192.168.1.12 TCP 66 22 → 54766 [ACK] Seq=143337 Ack=8377 Win=1452 Len=0 TSval=15149684 TSecr=8218183
  542 16.687021578  10.6.15.156 → 192.168.1.12 SSH 334 Server: Encrypted packet (len=268)
  543 16.730508480 192.168.1.12 → 10.6.15.156  TCP 66 54766 → 22 [ACK] Seq=8377 Ack=143605 Win=6155 Len=0 TSval=8218223 TSecr=15149713
  544 16.814563004  10.6.15.156 → 192.168.1.12 SSH 254 Server: Encrypted packet (len=188)
  545 16.814642561 192.168.1.12 → 10.6.15.156  TCP 66 54766 → 22 [ACK] Seq=8377 Ack=143793 Win=6155 Len=0 TSval=8218244 TSecr=15149744
  546 16.916999043  10.6.15.156 → 192.168.1.12 SSH 286 Server: Encrypted packet (len=220)
  547 16.917085833 192.168.1.12 → 10.6.15.156  TCP 66 54766 → 22 [ACK] Seq=8377 Ack=144013 Win=6155 Len=0 TSval=8218269 TSecr=15149770
  548 17.137946930  10.6.15.156 → 192.168.1.12 SSH 214 Server: Encrypted packet (len=148)
  549 17.138035610 192.168.1.12 → 10.6.15.156  TCP 66 54766 → 22 [ACK] Seq=8377 Ack=144161 Win=6155 Len=0 TSval=8218324 TSecr=15149825
  550 17.207495906  10.6.15.156 → 192.168.1.12 SSH 286 Server: Encrypted packet (len=220)
  551 17.207586549 192.168.1.12 → 10.6.15.156  TCP 66 54766 → 22 [ACK] Seq=8377 Ack=144381 Win=6155 Len=0 TSval=8218342 TSecr=15149843
  552 17.264830304  10.6.15.156 → 192.168.1.12 SSH 182 Server: Encrypted packet (len=116)
  553 17.264908233 192.168.1.12 → 10.6.15.156  TCP 66 54766 → 22 [ACK] Seq=8377 Ack=144497 Win=6155 Len=0 TSval=8218356 TSecr=15149857
  554 17.589005868  10.6.15.156 → 192.168.1.12 SSH 206 Server: Encrypted packet (len=140)
  555 17.589029024 192.168.1.12 → 10.6.15.156  TCP 66 54766 → 22 [ACK] Seq=8377 Ack=144637 Win=6155 Len=0 TSval=8218437 TSecr=15149938
  556 18.039962506  10.6.15.156 → 192.168.1.12 SSH 214 Server: Encrypted packet (len=148)
  557 18.039981322 192.168.1.12 → 10.6.15.156  TCP 66 54766 → 22 [ACK] Seq=8377 Ack=144785 Win=6155 Len=0 TSval=8218550 TSecr=15150051
  558 18.109896295  10.6.15.156 → 192.168.1.12 SSH 270 Server: Encrypted packet (len=204)
  559 18.109914371 192.168.1.12 → 10.6.15.156  TCP 66 54766 → 22 [ACK] Seq=8377 Ack=144989 Win=6155 Len=0 TSval=8218567 TSecr=15150068
  560 18.166869691  10.6.15.156 → 192.168.1.12 SSH 270 Server: Encrypted packet (len=204)
  561 18.166884810 192.168.1.12 → 10.6.15.156  TCP 66 54766 → 22 [ACK] Seq=8377 Ack=145193 Win=6155 Len=0 TSval=8218582 TSecr=15150083
  562 18.269925375  10.6.15.156 → 192.168.1.12 SSH 270 Server: Encrypted packet (len=204)
  563 18.269941428 192.168.1.12 → 10.6.15.156  TCP 66 54766 → 22 [ACK] Seq=8377 Ack=145397 Win=6155 Len=0 TSval=8218607 TSecr=15150108
  564 18.490797786  10.6.15.156 → 192.168.1.12 SSH 198 Server: Encrypted packet (len=132)
  565 18.490815104 192.168.1.12 → 10.6.15.156  TCP 66 54766 → 22 [ACK] Seq=8377 Ack=145529 Win=6155 Len=0 TSval=8218663 TSecr=15150164
  566 18.942166084  10.6.15.156 → 192.168.1.12 SSH 238 Server: Encrypted packet (len=172)
  567 18.942183135 192.168.1.12 → 10.6.15.156  TCP 66 54766 → 22 [ACK] Seq=8377 Ack=145701 Win=6155 Len=0 TSval=8218775 TSecr=15150276
  568 19.011423443  10.6.15.156 → 192.168.1.12 SSH 238 Server: Encrypted packet (len=172)
  569 19.011441574 192.168.1.12 → 10.6.15.156  TCP 66 54766 → 22 [ACK] Seq=8377 Ack=145873 Win=6155 Len=0 TSval=8218793 TSecr=15150294
  570 19.068958175  10.6.15.156 → 192.168.1.12 SSH 238 Server: Encrypted packet (len=172)
  571 19.068975829 192.168.1.12 → 10.6.15.156  TCP 66 54766 → 22 [ACK] Seq=8377 Ack=146045 Win=6155 Len=0 TSval=8218807 TSecr=15150308
  572 19.172848705  10.6.15.156 → 192.168.1.12 SSH 302 Server: Encrypted packet (len=236)
  573 19.172866118 192.168.1.12 → 10.6.15.156  TCP 66 54766 → 22 [ACK] Seq=8377 Ack=146281 Win=6155 Len=0 TSval=8218833 TSecr=15150334
  574 19.394952168  10.6.15.156 → 192.168.1.12 SSH 182 Server: Encrypted packet (len=116)
  575 19.394970824 192.168.1.12 → 10.6.15.156  TCP 66 54766 → 22 [ACK] Seq=8377 Ack=146397 Win=6155 Len=0 TSval=8218889 TSecr=15150389
  576 19.462249600  10.6.15.156 → 192.168.1.12 SSH 238 Server: Encrypted packet (len=172)
  577 19.462265796 192.168.1.12 → 10.6.15.156  TCP 66 54766 → 22 [ACK] Seq=8377 Ack=146569 Win=6155 Len=0 TSval=8218905 TSecr=15150406
  578 19.520169927  10.6.15.156 → 192.168.1.12 SSH 270 Server: Encrypted packet (len=204)
  579 19.520187497 192.168.1.12 → 10.6.15.156  TCP 66 54766 → 22 [ACK] Seq=8377 Ack=146773 Win=6155 Len=0 TSval=8218920 TSecr=15150421
  580 19.622756226  10.6.15.156 → 192.168.1.12 SSH 254 Server: Encrypted packet (len=188)
  581 19.622774177 192.168.1.12 → 10.6.15.156  TCP 66 54766 → 22 [ACK] Seq=8377 Ack=146961 Win=6155 Len=0 TSval=8218946 TSecr=15150447
  582 19.843815187  10.6.15.156 → 192.168.1.12 SSH 182 Server: Encrypted packet (len=116)
  583 19.843838750 192.168.1.12 → 10.6.15.156  TCP 66 54766 → 22 [ACK] Seq=8377 Ack=147077 Win=6155 Len=0 TSval=8219001 TSecr=15150502
  584 19.913392379  10.6.15.156 → 192.168.1.12 SSH 182 Server: Encrypted packet (len=116)
  585 19.913410668 192.168.1.12 → 10.6.15.156  TCP 66 54766 → 22 [ACK] Seq=8377 Ack=147193 Win=6155 Len=0 TSval=8219018 TSecr=15150519
  586 19.971492254  10.6.15.156 → 192.168.1.12 SSH 254 Server: Encrypted packet (len=188)
  587 19.971510450 192.168.1.12 → 10.6.15.156  TCP 66 54766 → 22 [ACK] Seq=8377 Ack=147381 Win=6155 Len=0 TSval=8219033 TSecr=15150534
  588 20.073724615  10.6.15.156 → 192.168.1.12 SSH 198 Server: Encrypted packet (len=132)
  589 20.073742395 192.168.1.12 → 10.6.15.156  TCP 66 54766 → 22 [ACK] Seq=8377 Ack=147513 Win=6155 Len=0 TSval=8219058 TSecr=15150559
  590 20.296187043  10.6.15.156 → 192.168.1.12 SSH 198 Server: Encrypted packet (len=132)
  591 20.296203574 192.168.1.12 → 10.6.15.156  TCP 66 54766 → 22 [ACK] Seq=8377 Ack=147645 Win=6155 Len=0 TSval=8219114 TSecr=15150615
  592 20.364316892  10.6.15.156 → 192.168.1.12 SSH 198 Server: Encrypted packet (len=132)
  593 20.364334805 192.168.1.12 → 10.6.15.156  TCP 66 54766 → 22 [ACK] Seq=8377 Ack=147777 Win=6155 Len=0 TSval=8219131 TSecr=15150632
  594 20.396241202  10.6.15.156 → 192.168.1.12 SSH 102 Server: Encrypted packet (len=36)
  595 20.396259237 192.168.1.12 → 10.6.15.156  TCP 66 54766 → 22 [ACK] Seq=8377 Ack=147813 Win=6155 Len=0 TSval=8219139 TSecr=15150640
  596 20.524837919  10.6.15.156 → 192.168.1.12 SSH 222 Server: Encrypted packet (len=156)
  597 20.524864322 192.168.1.12 → 10.6.15.156  TCP 66 54766 → 22 [ACK] Seq=8377 Ack=147969 Win=6155 Len=0 TSval=8219171 TSecr=15150672
  598 20.746053690  10.6.15.156 → 192.168.1.12 SSH 238 Server: Encrypted packet (len=172)
  599 20.746072353 192.168.1.12 → 10.6.15.156  TCP 66 54766 → 22 [ACK] Seq=8377 Ack=148141 Win=6155 Len=0 TSval=8219226 TSecr=15150727
  600 20.815796724  10.6.15.156 → 192.168.1.12 SSH 254 Server: Encrypted packet (len=188)
  601 20.815812588 192.168.1.12 → 10.6.15.156  TCP 66 54766 → 22 [ACK] Seq=8377 Ack=148329 Win=6155 Len=0 TSval=8219244 TSecr=15150745
  602 20.872993476  10.6.15.156 → 192.168.1.12 SSH 214 Server: Encrypted packet (len=148)
  603 20.873012527 192.168.1.12 → 10.6.15.156  TCP 66 54766 → 22 [ACK] Seq=8377 Ack=148477 Win=6155 Len=0 TSval=8219258 TSecr=15150759
  604 21.197040556  10.6.15.156 → 192.168.1.12 SSH 286 Server: Encrypted packet (len=220)
  605 21.197057940 192.168.1.12 → 10.6.15.156  TCP 66 54766 → 22 [ACK] Seq=8377 Ack=148697 Win=6155 Len=0 TSval=8219339 TSecr=15150840
  606 21.247834059  10.6.15.156 → 192.168.1.12 SSH 150 Server: Encrypted packet (len=84)
  607 21.247849430 192.168.1.12 → 10.6.15.156  TCP 66 54766 → 22 [ACK] Seq=8377 Ack=148781 Win=6155 Len=0 TSval=8219352 TSecr=15150853
  608 21.248157882 192.168.1.12 → 10.6.15.156  SSH 150 Client: Encrypted packet (len=84)
  609 21.249301213  10.6.15.156 → 192.168.1.12 SSH 150 Server: Encrypted packet (len=84)
  610 21.249312207  10.6.15.156 → 192.168.1.12 TCP 66 22 → 54766 [ACK] Seq=148865 Ack=8461 Win=1452 Len=0 TSval=15150853 TSecr=8219352
  611 21.249492428 192.168.1.12 → 10.6.15.156  SSH 150 Client: Encrypted packet (len=84)
  612 21.250983446  10.6.15.156 → 192.168.1.12 TCP 66 22 → 54766 [ACK] Seq=148865 Ack=8545 Win=1452 Len=0 TSval=15150854 TSecr=8219352
  613 21.266139349  10.6.15.156 → 192.168.1.12 SSH 182 Server: Encrypted packet (len=116)
  614 21.306465785 192.168.1.12 → 10.6.15.156  TCP 66 54766 → 22 [ACK] Seq=8545 Ack=148981 Win=6155 Len=0 TSval=8219367 TSecr=15150857
  615 21.324070676  10.6.15.156 → 192.168.1.12 SSH 286 Server: Encrypted packet (len=220)
  616 21.324082173 192.168.1.12 → 10.6.15.156  TCP 66 54766 → 22 [ACK] Seq=8545 Ack=149201 Win=6155 Len=0 TSval=8219371 TSecr=15150872
  617 21.426792685  10.6.15.156 → 192.168.1.12 SSH 286 Server: Encrypted packet (len=220)
  618 21.426809980 192.168.1.12 → 10.6.15.156  TCP 66 54766 → 22 [ACK] Seq=8545 Ack=149421 Win=6155 Len=0 TSval=8219397 TSecr=15150898
  619 21.648050984  10.6.15.156 → 192.168.1.12 SSH 334 Server: Encrypted packet (len=268)
  620 21.648077336 192.168.1.12 → 10.6.15.156  TCP 66 54766 → 22 [ACK] Seq=8545 Ack=149689 Win=6155 Len=0 TSval=8219452 TSecr=15150953
  621 21.717553513  10.6.15.156 → 192.168.1.12 SSH 422 Server: Encrypted packet (len=356)
  622 21.717570522 192.168.1.12 → 10.6.15.156  TCP 66 54766 → 22 [ACK] Seq=8545 Ack=150045 Win=6155 Len=0 TSval=8219469 TSecr=15150970
  623 21.775177891  10.6.15.156 → 192.168.1.12 SSH 270 Server: Encrypted packet (len=204)
  624 21.775194834 192.168.1.12 → 10.6.15.156  TCP 66 54766 → 22 [ACK] Seq=8545 Ack=150249 Win=6155 Len=0 TSval=8219484 TSecr=15150985
  625 21.877800443  10.6.15.156 → 192.168.1.12 SSH 270 Server: Encrypted packet (len=204)
  626 21.877819487 192.168.1.12 → 10.6.15.156  TCP 66 54766 → 22 [ACK] Seq=8545 Ack=150453 Win=6155 Len=0 TSval=8219509 TSecr=15151010
  627 22.098878820  10.6.15.156 → 192.168.1.12 SSH 214 Server: Encrypted packet (len=148)
  628 22.098896560 192.168.1.12 → 10.6.15.156  TCP 66 54766 → 22 [ACK] Seq=8545 Ack=150601 Win=6155 Len=0 TSval=8219565 TSecr=15151066
  629 22.168866053  10.6.15.156 → 192.168.1.12 SSH 222 Server: Encrypted packet (len=156)
  630 22.168883755 192.168.1.12 → 10.6.15.156  TCP 66 54766 → 22 [ACK] Seq=8545 Ack=150757 Win=6155 Len=0 TSval=8219582 TSecr=15151083
  631 22.225953813  10.6.15.156 → 192.168.1.12 SSH 222 Server: Encrypted packet (len=156)
  632 22.225972733 192.168.1.12 → 10.6.15.156  TCP 66 54766 → 22 [ACK] Seq=8545 Ack=150913 Win=6155 Len=0 TSval=8219596 TSecr=15151097
  633 22.328983424  10.6.15.156 → 192.168.1.12 SSH 270 Server: Encrypted packet (len=204)
  634 22.329007396 192.168.1.12 → 10.6.15.156  TCP 66 54766 → 22 [ACK] Seq=8545 Ack=151117 Win=6155 Len=0 TSval=8219622 TSecr=15151123
  635 22.619272817  10.6.15.156 → 192.168.1.12 SSH 214 Server: Encrypted packet (len=148)
  636 22.619289425 192.168.1.12 → 10.6.15.156  TCP 66 54766 → 22 [ACK] Seq=8545 Ack=151265 Win=6155 Len=0 TSval=8219695 TSecr=15151196
  637 22.677057942  10.6.15.156 → 192.168.1.12 SSH 222 Server: Encrypted packet (len=156)
  638 22.677075621 192.168.1.12 → 10.6.15.156  TCP 66 54766 → 22 [ACK] Seq=8545 Ack=151421 Win=6155 Len=0 TSval=8219709 TSecr=15151210
  639 23.452194303  10.6.15.156 → 192.168.1.12 SSH 454 Server: Encrypted packet (len=388)
  640 23.452212821 192.168.1.12 → 10.6.15.156  TCP 66 54766 → 22 [ACK] Seq=8545 Ack=151809 Win=6155 Len=0 TSval=8219903 TSecr=15151404
  641 23.522783754  10.6.15.156 → 192.168.1.12 SSH 406 Server: Encrypted packet (len=340)
  642 23.522801041 192.168.1.12 → 10.6.15.156  TCP 66 54766 → 22 [ACK] Seq=8545 Ack=152149 Win=6155 Len=0 TSval=8219921 TSecr=15151422
  643 23.580699096  10.6.15.156 → 192.168.1.12 SSH 774 Server: Encrypted packet (len=708)
  644 23.580716865 192.168.1.12 → 10.6.15.156  TCP 66 54766 → 22 [ACK] Seq=8545 Ack=152857 Win=6155 Len=0 TSval=8219935 TSecr=15151436
  645 23.683106079  10.6.15.156 → 192.168.1.12 SSH 790 Server: Encrypted packet (len=724)
  646 23.683123577 192.168.1.12 → 10.6.15.156  TCP 66 54766 → 22 [ACK] Seq=8545 Ack=153581 Win=6155 Len=0 TSval=8219961 TSecr=15151461
  647 23.903502914  10.6.15.156 → 192.168.1.12 SSH 726 Server: Encrypted packet (len=660)
  648 23.903521278 192.168.1.12 → 10.6.15.156  TCP 66 54766 → 22 [ACK] Seq=8545 Ack=154241 Win=6155 Len=0 TSval=8220016 TSecr=15151517
  649 23.972972541  10.6.15.156 → 192.168.1.12 SSH 726 Server: Encrypted packet (len=660)
  650 23.972990504 192.168.1.12 → 10.6.15.156  TCP 66 54766 → 22 [ACK] Seq=8545 Ack=154901 Win=6155 Len=0 TSval=8220033 TSecr=15151534
  651 24.030451692  10.6.15.156 → 192.168.1.12 SSH 566 Server: Encrypted packet (len=500)
  652 24.030470066 192.168.1.12 → 10.6.15.156  TCP 66 54766 → 22 [ACK] Seq=8545 Ack=155401 Win=6155 Len=0 TSval=8220047 TSecr=15151548
  653 24.132623768  10.6.15.156 → 192.168.1.12 SSH 182 Server: Encrypted packet (len=116)
  654 24.132640708 192.168.1.12 → 10.6.15.156  TCP 66 54766 → 22 [ACK] Seq=8545 Ack=155517 Win=6155 Len=0 TSval=8220073 TSecr=15151574
  655 24.354092794  10.6.15.156 → 192.168.1.12 SSH 406 Server: Encrypted packet (len=340)
  656 24.354110626 192.168.1.12 → 10.6.15.156  TCP 66 54766 → 22 [ACK] Seq=8545 Ack=155857 Win=6155 Len=0 TSval=8220128 TSecr=15151629
  657 24.423559457  10.6.15.156 → 192.168.1.12 SSH 238 Server: Encrypted packet (len=172)
  658 24.423576679 192.168.1.12 → 10.6.15.156  TCP 66 54766 → 22 [ACK] Seq=8545 Ack=156029 Win=6155 Len=0 TSval=8220146 TSecr=15151647
  659 24.481007830  10.6.15.156 → 192.168.1.12 SSH 318 Server: Encrypted packet (len=252)
  660 24.481025519 192.168.1.12 → 10.6.15.156  TCP 66 54766 → 22 [ACK] Seq=8545 Ack=156281 Win=6155 Len=0 TSval=8220160 TSecr=15151661
  661 24.583702313  10.6.15.156 → 192.168.1.12 SSH 358 Server: Encrypted packet (len=292)
  662 24.583719611 192.168.1.12 → 10.6.15.156  TCP 66 54766 → 22 [ACK] Seq=8545 Ack=156573 Win=6155 Len=0 TSval=8220186 TSecr=15151687
  663 24.805169721  10.6.15.156 → 192.168.1.12 SSH 334 Server: Encrypted packet (len=268)
  664 24.805187215 192.168.1.12 → 10.6.15.156  TCP 66 54766 → 22 [ACK] Seq=8545 Ack=156841 Win=6155 Len=0 TSval=8220241 TSecr=15151742
  665 24.874709307  10.6.15.156 → 192.168.1.12 SSH 318 Server: Encrypted packet (len=252)
  666 24.874725032 192.168.1.12 → 10.6.15.156  TCP 66 54766 → 22 [ACK] Seq=8545 Ack=157093 Win=6155 Len=0 TSval=8220259 TSecr=15151760
  667 24.932046812  10.6.15.156 → 192.168.1.12 SSH 286 Server: Encrypted packet (len=220)
  668 24.932064616 192.168.1.12 → 10.6.15.156  TCP 66 54766 → 22 [ACK] Seq=8545 Ack=157313 Win=6155 Len=0 TSval=8220273 TSecr=15151774
  669 25.034639651  10.6.15.156 → 192.168.1.12 SSH 286 Server: Encrypted packet (len=220)
  670 25.034656211 192.168.1.12 → 10.6.15.156  TCP 66 54766 → 22 [ACK] Seq=8545 Ack=157533 Win=6155 Len=0 TSval=8220299 TSecr=15151800
  671 25.256001947  10.6.15.156 → 192.168.1.12 SSH 222 Server: Encrypted packet (len=156)
  672 25.256020063 192.168.1.12 → 10.6.15.156  TCP 66 54766 → 22 [ACK] Seq=8545 Ack=157689 Win=6155 Len=0 TSval=8220354 TSecr=15151855
  673 25.325417052  10.6.15.156 → 192.168.1.12 SSH 270 Server: Encrypted packet (len=204)
  674 25.325435150 192.168.1.12 → 10.6.15.156  TCP 66 54766 → 22 [ACK] Seq=8545 Ack=157893 Win=6155 Len=0 TSval=8220371 TSecr=15151872
  675 25.383092353  10.6.15.156 → 192.168.1.12 SSH 342 Server: Encrypted packet (len=276)
  676 25.383110078 192.168.1.12 → 10.6.15.156  TCP 66 54766 → 22 [ACK] Seq=8545 Ack=158169 Win=6155 Len=0 TSval=8220386 TSecr=15151887
  677 25.485844676  10.6.15.156 → 192.168.1.12 SSH 342 Server: Encrypted packet (len=276)
  678 25.485862601 192.168.1.12 → 10.6.15.156  TCP 66 54766 → 22 [ACK] Seq=8545 Ack=158445 Win=6155 Len=0 TSval=8220411 TSecr=15151912
  679 25.776486083  10.6.15.156 → 192.168.1.12 SSH 254 Server: Encrypted packet (len=188)
  680 25.776505662 192.168.1.12 → 10.6.15.156  TCP 66 54766 → 22 [ACK] Seq=8545 Ack=158633 Win=6155 Len=0 TSval=8220484 TSecr=15151985
  681 25.834179816  10.6.15.156 → 192.168.1.12 SSH 214 Server: Encrypted packet (len=148)
  682 25.834197577 192.168.1.12 → 10.6.15.156  TCP 66 54766 → 22 [ACK] Seq=8545 Ack=158781 Win=6155 Len=0 TSval=8220498 TSecr=15151999
  683 25.937024862  10.6.15.156 → 192.168.1.12 SSH 222 Server: Encrypted packet (len=156)
  684 25.937041995 192.168.1.12 → 10.6.15.156  TCP 66 54766 → 22 [ACK] Seq=8545 Ack=158937 Win=6155 Len=0 TSval=8220524 TSecr=15152025
  685 26.142376417 10.22.19.111 → 224.0.0.252  LLMNR 64 Standard query 0x2696 A wpad
  686 26.157923377  10.6.15.156 → 192.168.1.12 SSH 214 Server: Encrypted packet (len=148)
  687 26.157950060 192.168.1.12 → 10.6.15.156  TCP 66 54766 → 22 [ACK] Seq=8545 Ack=159085 Win=6155 Len=0 TSval=8220579 TSecr=15152080
  688 26.227264492  10.6.15.156 → 192.168.1.12 SSH 182 Server: Encrypted packet (len=116)
  689 26.227280611 192.168.1.12 → 10.6.15.156  TCP 66 54766 → 22 [ACK] Seq=8545 Ack=159201 Win=6155 Len=0 TSval=8220597 TSecr=15152098
  690 26.287097543  10.6.15.156 → 192.168.1.12 SSH 182 Server: Encrypted packet (len=116)
  691 26.287115561 192.168.1.12 → 10.6.15.156  TCP 66 54766 → 22 [ACK] Seq=8545 Ack=159317 Win=6155 Len=0 TSval=8220612 TSecr=15152112
  692 26.389216206  10.6.15.156 → 192.168.1.12 SSH 182 Server: Encrypted packet (len=116)
  693 26.389232992 192.168.1.12 → 10.6.15.156  TCP 66 54766 → 22 [ACK] Seq=8545 Ack=159433 Win=6155 Len=0 TSval=8220637 TSecr=15152138
  694 26.556948753 10.22.19.111 → 224.0.0.252  LLMNR 64 Standard query 0x2696 A wpad
  695 26.609540231  10.6.15.156 → 192.168.1.12 SSH 222 Server: Encrypted packet (len=156)
  696 26.609557886 192.168.1.12 → 10.6.15.156  TCP 66 54766 → 22 [ACK] Seq=8545 Ack=159589 Win=6155 Len=0 TSval=8220692 TSecr=15152193
  697 27.129266499  10.6.15.156 → 192.168.1.12 SSH 182 Server: Encrypted packet (len=116)
  698 27.129285331 192.168.1.12 → 10.6.15.156  TCP 66 54766 → 22 [ACK] Seq=8545 Ack=159705 Win=6155 Len=0 TSval=8220822 TSecr=15152323
  699 27.186826383  10.6.15.156 → 192.168.1.12 SSH 182 Server: Encrypted packet (len=116)
  700 27.186842374 192.168.1.12 → 10.6.15.156  TCP 66 54766 → 22 [ACK] Seq=8545 Ack=159821 Win=6155 Len=0 TSval=8220837 TSecr=15152338
  701 27.289733768  10.6.15.156 → 192.168.1.12 SSH 238 Server: Encrypted packet (len=172)
  702 27.289751826 192.168.1.12 → 10.6.15.156  TCP 66 54766 → 22 [ACK] Seq=8545 Ack=159993 Win=6155 Len=0 TSval=8220862 TSecr=15152363
  703 27.511110831  10.6.15.156 → 192.168.1.12 SSH 406 Server: Encrypted packet (len=340)
  704 27.511131418 192.168.1.12 → 10.6.15.156  TCP 66 54766 → 22 [ACK] Seq=8545 Ack=160333 Win=6155 Len=0 TSval=8220918 TSecr=15152419
  705 27.581225091  10.6.15.156 → 192.168.1.12 SSH 470 Server: Encrypted packet (len=404)
  706 27.581242686 192.168.1.12 → 10.6.15.156  TCP 66 54766 → 22 [ACK] Seq=8545 Ack=160737 Win=6155 Len=0 TSval=8220935 TSecr=15152436
  707 27.638233607  10.6.15.156 → 192.168.1.12 SSH 374 Server: Encrypted packet (len=308)
  708 27.638251896 192.168.1.12 → 10.6.15.156  TCP 66 54766 → 22 [ACK] Seq=8545 Ack=161045 Win=6155 Len=0 TSval=8220949 TSecr=15152450
  709 27.740730229  10.6.15.156 → 192.168.1.12 SSH 334 Server: Encrypted packet (len=268)
  710 27.740747921 192.168.1.12 → 10.6.15.156  TCP 66 54766 → 22 [ACK] Seq=8545 Ack=161313 Win=6155 Len=0 TSval=8220975 TSecr=15152476
  711 28.031445738  10.6.15.156 → 192.168.1.12 SSH 214 Server: Encrypted packet (len=148)
  712 28.031462779 192.168.1.12 → 10.6.15.156  TCP 66 54766 → 22 [ACK] Seq=8545 Ack=161461 Win=6155 Len=0 TSval=8221048 TSecr=15152549
  713 28.089135290  10.6.15.156 → 192.168.1.12 SSH 302 Server: Encrypted packet (len=236)
  714 28.089153467 192.168.1.12 → 10.6.15.156  TCP 66 54766 → 22 [ACK] Seq=8545 Ack=161697 Win=6155 Len=0 TSval=8221062 TSecr=15152563
  715 28.192394380  10.6.15.156 → 192.168.1.12 SSH 270 Server: Encrypted packet (len=204)
  716 28.192411633 192.168.1.12 → 10.6.15.156  TCP 66 54766 → 22 [ACK] Seq=8545 Ack=161901 Win=6155 Len=0 TSval=8221088 TSecr=15152589
  717 28.413117775  10.6.15.156 → 192.168.1.12 SSH 374 Server: Encrypted packet (len=308)
  718 28.413135554 192.168.1.12 → 10.6.15.156  TCP 66 54766 → 22 [ACK] Seq=8545 Ack=162209 Win=6155 Len=0 TSval=8221143 TSecr=15152644
  719 28.437266392  10.6.15.156 → 192.168.1.12 SSH 150 Server: Encrypted packet (len=84)
  720 28.437284403 192.168.1.12 → 10.6.15.156  TCP 66 54766 → 22 [ACK] Seq=8545 Ack=162293 Win=6155 Len=0 TSval=8221149 TSecr=15152650
  721 28.437305029  10.6.15.156 → 192.168.1.12 SSH 150 Server: Encrypted packet (len=84)
  722 28.437311423 192.168.1.12 → 10.6.15.156  TCP 66 54766 → 22 [ACK] Seq=8545 Ack=162377 Win=6155 Len=0 TSval=8221149 TSecr=15152650
  723 28.437618879 192.168.1.12 → 10.6.15.156  SSH 150 Client: Encrypted packet (len=84)
  724 28.478478792  10.6.15.156 → 192.168.1.12 TCP 66 22 → 54766 [ACK] Seq=162377 Ack=8629 Win=1452 Len=0 TSval=15152661 TSecr=8221149
  725 28.478498760 192.168.1.12 → 10.6.15.156  SSH 150 Client: Encrypted packet (len=84)
  726 28.480045876  10.6.15.156 → 192.168.1.12 TCP 66 22 → 54766 [ACK] Seq=162377 Ack=8713 Win=1452 Len=0 TSval=15152661 TSecr=8221160
  727 28.482212683  10.6.15.156 → 192.168.1.12 SSH 214 Server: Encrypted packet (len=148)
  728 28.522510249 192.168.1.12 → 10.6.15.156  TCP 66 54766 → 22 [ACK] Seq=8713 Ack=162525 Win=6155 Len=0 TSval=8221171 TSecr=15152661
  729 28.539969791  10.6.15.156 → 192.168.1.12 SSH 214 Server: Encrypted packet (len=148)
  730 28.539991336 192.168.1.12 → 10.6.15.156  TCP 66 54766 → 22 [ACK] Seq=8713 Ack=162673 Win=6155 Len=0 TSval=8221175 TSecr=15152676
  731 28.642635701  10.6.15.156 → 192.168.1.12 SSH 254 Server: Encrypted packet (len=188)
  732 28.642654397 192.168.1.12 → 10.6.15.156  TCP 66 54766 → 22 [ACK] Seq=8713 Ack=162861 Win=6155 Len=0 TSval=8221201 TSecr=15152702
  733 28.863814570  10.6.15.156 → 192.168.1.12 SSH 182 Server: Encrypted packet (len=116)
  734 28.863835735 192.168.1.12 → 10.6.15.156  TCP 66 54766 → 22 [ACK] Seq=8713 Ack=162977 Win=6155 Len=0 TSval=8221256 TSecr=15152757
  735 28.935269861  10.6.15.156 → 192.168.1.12 SSH 318 Server: Encrypted packet (len=252)
  736 28.935288182 192.168.1.12 → 10.6.15.156  TCP 66 54766 → 22 [ACK] Seq=8713 Ack=163229 Win=6155 Len=0 TSval=8221274 TSecr=15152774
  737 28.991717506  10.6.15.156 → 192.168.1.12 SSH 358 Server: Encrypted packet (len=292)
  738 28.991735358 192.168.1.12 → 10.6.15.156  TCP 66 54766 → 22 [ACK] Seq=8713 Ack=163521 Win=6155 Len=0 TSval=8221288 TSecr=15152789
  739 29.094742933  10.6.15.156 → 192.168.1.12 SSH 438 Server: Encrypted packet (len=372)
  740 29.094758866 192.168.1.12 → 10.6.15.156  TCP 66 54766 → 22 [ACK] Seq=8713 Ack=163893 Win=6155 Len=0 TSval=8221314 TSecr=15152815
  741 29.315252706  10.6.15.156 → 192.168.1.12 SSH 422 Server: Encrypted packet (len=356)
  742 29.315270848 192.168.1.12 → 10.6.15.156  TCP 66 54766 → 22 [ACK] Seq=8713 Ack=164249 Win=6155 Len=0 TSval=8221369 TSecr=15152870
  743 29.384519065  10.6.15.156 → 192.168.1.12 SSH 422 Server: Encrypted packet (len=356)
  744 29.384538258 192.168.1.12 → 10.6.15.156  TCP 66 54766 → 22 [ACK] Seq=8713 Ack=164605 Win=6155 Len=0 TSval=8221386 TSecr=15152887
  745 29.442208302  10.6.15.156 → 192.168.1.12 SSH 390 Server: Encrypted packet (len=324)
  746 29.442227119 192.168.1.12 → 10.6.15.156  TCP 66 54766 → 22 [ACK] Seq=8713 Ack=164929 Win=6155 Len=0 TSval=8221400 TSecr=15152901
  747 29.544757756  10.6.15.156 → 192.168.1.12 SSH 334 Server: Encrypted packet (len=268)
  748 29.544776432 192.168.1.12 → 10.6.15.156  TCP 66 54766 → 22 [ACK] Seq=8713 Ack=165197 Win=6155 Len=0 TSval=8221426 TSecr=15152927
  749 29.765996710  10.6.15.156 → 192.168.1.12 SSH 270 Server: Encrypted packet (len=204)
  750 29.766015774 192.168.1.12 → 10.6.15.156  TCP 66 54766 → 22 [ACK] Seq=8713 Ack=165401 Win=6155 Len=0 TSval=8221481 TSecr=15152982
  751 29.892927224  10.6.15.156 → 192.168.1.12 SSH 182 Server: Encrypted packet (len=116)
  752 29.892944629 192.168.1.12 → 10.6.15.156  TCP 66 54766 → 22 [ACK] Seq=8713 Ack=165517 Win=6155 Len=0 TSval=8221513 TSecr=15153014
  753 29.995622159  10.6.15.156 → 192.168.1.12 SSH 238 Server: Encrypted packet (len=172)
  754 29.995640515 192.168.1.12 → 10.6.15.156  TCP 66 54766 → 22 [ACK] Seq=8713 Ack=165689 Win=6155 Len=0 TSval=8221539 TSecr=15153040
  755 30.216955103  10.6.15.156 → 192.168.1.12 SSH 270 Server: Encrypted packet (len=204)
  756 30.216971730 192.168.1.12 → 10.6.15.156  TCP 66 54766 → 22 [ACK] Seq=8713 Ack=165893 Win=6155 Len=0 TSval=8221594 TSecr=15153095
  757 30.286519135  10.6.15.156 → 192.168.1.12 SSH 318 Server: Encrypted packet (len=252)
  758 30.286533416 192.168.1.12 → 10.6.15.156  TCP 66 54766 → 22 [ACK] Seq=8713 Ack=166145 Win=6155 Len=0 TSval=8221612 TSecr=15153113
  759 30.344083483  10.6.15.156 → 192.168.1.12 SSH 318 Server: Encrypted packet (len=252)
  760 30.344101160 192.168.1.12 → 10.6.15.156  TCP 66 54766 → 22 [ACK] Seq=8713 Ack=166397 Win=6155 Len=0 TSval=8221626 TSecr=15153127
  761 30.446537739  10.6.15.156 → 192.168.1.12 SSH 214 Server: Encrypted packet (len=148)
  762 30.446555279 192.168.1.12 → 10.6.15.156  TCP 66 54766 → 22 [ACK] Seq=8713 Ack=166545 Win=6155 Len=0 TSval=8221652 TSecr=15153153
  763 30.668000692  10.6.15.156 → 192.168.1.12 SSH 182 Server: Encrypted packet (len=116)
  764 30.668018748 192.168.1.12 → 10.6.15.156  TCP 66 54766 → 22 [ACK] Seq=8713 Ack=166661 Win=6155 Len=0 TSval=8221707 TSecr=15153208
  765 30.737463655  10.6.15.156 → 192.168.1.12 SSH 270 Server: Encrypted packet (len=204)
  766 30.737481550 192.168.1.12 → 10.6.15.156  TCP 66 54766 → 22 [ACK] Seq=8713 Ack=166865 Win=6155 Len=0 TSval=8221724 TSecr=15153225
  767 30.795010996  10.6.15.156 → 192.168.1.12 SSH 206 Server: Encrypted packet (len=140)
  768 30.795028439 192.168.1.12 → 10.6.15.156  TCP 66 54766 → 22 [ACK] Seq=8713 Ack=167005 Win=6155 Len=0 TSval=8221739 TSecr=15153240
  769 30.897737799  10.6.15.156 → 192.168.1.12 SSH 254 Server: Encrypted packet (len=188)
  770 30.897755854 192.168.1.12 → 10.6.15.156  TCP 66 54766 → 22 [ACK] Seq=8713 Ack=167193 Win=6155 Len=0 TSval=8221764 TSecr=15153265
  771 31.118861653  10.6.15.156 → 192.168.1.12 SSH 254 Server: Encrypted packet (len=188)
  772 31.118877966 192.168.1.12 → 10.6.15.156  TCP 66 54766 → 22 [ACK] Seq=8713 Ack=167381 Win=6155 Len=0 TSval=8221820 TSecr=15153321
  773 31.188515892  10.6.15.156 → 192.168.1.12 SSH 422 Server: Encrypted packet (len=356)
  774 31.188534478 192.168.1.12 → 10.6.15.156  TCP 66 54766 → 22 [ACK] Seq=8713 Ack=167737 Win=6155 Len=0 TSval=8221837 TSecr=15153338
  775 31.246217325  10.6.15.156 → 192.168.1.12 SSH 454 Server: Encrypted packet (len=388)
  776 31.246234932 192.168.1.12 → 10.6.15.156  TCP 66 54766 → 22 [ACK] Seq=8713 Ack=168125 Win=6155 Len=0 TSval=8221851 TSecr=15153352
  777 31.348990404  10.6.15.156 → 192.168.1.12 SSH 406 Server: Encrypted packet (len=340)
  778 31.349008114 192.168.1.12 → 10.6.15.156  TCP 66 54766 → 22 [ACK] Seq=8713 Ack=168465 Win=6155 Len=0 TSval=8221877 TSecr=15153378
  779 31.570248572  10.6.15.156 → 192.168.1.12 SSH 470 Server: Encrypted packet (len=404)
  780 31.570265196 192.168.1.12 → 10.6.15.156  TCP 66 54766 → 22 [ACK] Seq=8713 Ack=168869 Win=6155 Len=0 TSval=8221932 TSecr=15153433
  781 31.639283314  10.6.15.156 → 192.168.1.12 SSH 182 Server: Encrypted packet (len=116)
  782 31.639302084 192.168.1.12 → 10.6.15.156  TCP 66 54766 → 22 [ACK] Seq=8713 Ack=168985 Win=6155 Len=0 TSval=8221950 TSecr=15153451
  783 32.021658083  10.6.15.156 → 192.168.1.12 SSH 182 Server: Encrypted packet (len=116)
  784 32.021680445 192.168.1.12 → 10.6.15.156  TCP 66 54766 → 22 [ACK] Seq=8713 Ack=169101 Win=6155 Len=0 TSval=8222045 TSecr=15153546
  785 32.092208384  10.6.15.156 → 192.168.1.12 SSH 182 Server: Encrypted packet (len=116)
  786 32.092225522 192.168.1.12 → 10.6.15.156  TCP 66 54766 → 22 [ACK] Seq=8713 Ack=169217 Win=6155 Len=0 TSval=8222063 TSecr=15153564
  787 32.147892726  10.6.15.156 → 192.168.1.12 SSH 270 Server: Encrypted packet (len=204)
  788 32.147910806 192.168.1.12 → 10.6.15.156  TCP 66 54766 → 22 [ACK] Seq=8713 Ack=169421 Win=6155 Len=0 TSval=8222077 TSecr=15153578
  789 32.250803917  10.6.15.156 → 192.168.1.12 SSH 334 Server: Encrypted packet (len=268)
  790 32.250822915 192.168.1.12 → 10.6.15.156  TCP 66 54766 → 22 [ACK] Seq=8713 Ack=169689 Win=6155 Len=0 TSval=8222103 TSecr=15153604
  791 32.442429215  10.6.15.156 → 192.168.1.12 SSH 158 Server: Encrypted packet (len=92)
  792 32.442446502 192.168.1.12 → 10.6.15.156  TCP 66 54766 → 22 [ACK] Seq=8713 Ack=169781 Win=6155 Len=0 TSval=8222150 TSecr=15153652
  793 32.442759366 192.168.1.12 → 10.6.15.156  SSH 102 Client: Encrypted packet (len=36)
  794 32.442797654  10.6.15.156 → 192.168.1.12 SSH 102 Server: Encrypted packet (len=36)
  795 32.444373583  10.6.15.156 → 192.168.1.12 SSH 102 Server: Encrypted packet (len=36)
  796 32.444393705 192.168.1.12 → 10.6.15.156  SSH 102 Client: Encrypted packet (len=36)
  797 32.471993434  10.6.15.156 → 192.168.1.12 SSH 334 Server: Encrypted packet (len=268)
  798 32.514509155 192.168.1.12 → 10.6.15.156  TCP 66 54766 → 22 [ACK] Seq=8785 Ack=170121 Win=6155 Len=0 TSval=8222169 TSecr=15153659
  799 32.541531881  10.6.15.156 → 192.168.1.12 SSH 374 Server: Encrypted packet (len=308)
  800 32.541558508 192.168.1.12 → 10.6.15.156  TCP 66 54766 → 22 [ACK] Seq=8785 Ack=170429 Win=6155 Len=0 TSval=8222175 TSecr=15153676
  801 32.599015471  10.6.15.156 → 192.168.1.12 SSH 222 Server: Encrypted packet (len=156)
  802 32.599033053 192.168.1.12 → 10.6.15.156  TCP 66 54766 → 22 [ACK] Seq=8785 Ack=170585 Win=6155 Len=0 TSval=8222190 TSecr=15153691
  803 32.701570613  10.6.15.156 → 192.168.1.12 SSH 198 Server: Encrypted packet (len=132)
  804 32.701594470 192.168.1.12 → 10.6.15.156  TCP 66 54766 → 22 [ACK] Seq=8785 Ack=170717 Win=6155 Len=0 TSval=8222215 TSecr=15153716
  805 32.862369577 192.168.1.12 → 10.6.15.156  SSH 138 Client: Encrypted packet (len=72)
  806 32.864425844  10.6.15.156 → 192.168.1.12 SSH 102 Server: Encrypted packet (len=36)
  807 32.864445156 192.168.1.12 → 10.6.15.156  SSH 246 Client: Encrypted packet (len=180)
  808 32.902320049  10.6.15.156 → 192.168.1.12 TCP 66 22 → 54766 [ACK] Seq=170753 Ack=9037 Win=1452 Len=0 TSval=15153767 TSecr=8222256
  809 32.922972919  10.6.15.156 → 192.168.1.12 SSH 302 Server: Encrypted packet (len=236)
  810 32.966492345 192.168.1.12 → 10.6.15.156  TCP 66 54766 → 22 [ACK] Seq=9037 Ack=170989 Win=6155 Len=0 TSval=8222282 TSecr=15153772
  811 32.993793067  10.6.15.156 → 192.168.1.12 SSH 182 Server: Encrypted packet (len=116)
  812 32.993816648 192.168.1.12 → 10.6.15.156  TCP 66 54766 → 22 [ACK] Seq=9037 Ack=171105 Win=6155 Len=0 TSval=8222288 TSecr=15153789
  813 33.016091166  10.6.15.156 → 192.168.1.12 SSH 110 Server: Encrypted packet (len=44)
  814 33.016108572 192.168.1.12 → 10.6.15.156  TCP 66 54766 → 22 [ACK] Seq=9037 Ack=171149 Win=6155 Len=0 TSval=8222294 TSecr=15153795
  815 33.016475704 192.168.1.12 → 10.6.15.156  SSH 134 Client: Encrypted packet (len=68)
  816 33.017999166  10.6.15.156 → 192.168.1.12 TCP 66 22 → 54766 [ACK] Seq=171149 Ack=9105 Win=1452 Len=0 TSval=15153795 TSecr=8222294
  817 33.018746730  10.6.15.156 → 192.168.1.12 SSH 462 Server: Encrypted packet (len=396)
  818 33.049933024  10.6.15.156 → 192.168.1.12 SSH 254 Server: Encrypted packet (len=188)
  819 33.050018962 192.168.1.12 → 10.6.15.156  TCP 66 54766 → 22 [ACK] Seq=9105 Ack=171733 Win=6155 Len=0 TSval=8222302 TSecr=15153796
  820 33.152788483  10.6.15.156 → 192.168.1.12 SSH 326 Server: Encrypted packet (len=260)
  821 33.170504137  10.6.15.156 → 192.168.1.12 SSH 198 Server: Encrypted packet (len=132)
  822 33.170571235 192.168.1.12 → 10.6.15.156  TCP 66 54766 → 22 [ACK] Seq=9105 Ack=172125 Win=6155 Len=0 TSval=8222333 TSecr=15153829
  823 33.373957302  10.6.15.156 → 192.168.1.12 SSH 214 Server: Encrypted packet (len=148)
  824 33.414493492 192.168.1.12 → 10.6.15.156  TCP 66 54766 → 22 [ACK] Seq=9105 Ack=172273 Win=6155 Len=0 TSval=8222394 TSecr=15153884
  825 33.443409586  10.6.15.156 → 192.168.1.12 SSH 294 Server: Encrypted packet (len=228)
  826 33.443498721 192.168.1.12 → 10.6.15.156  TCP 66 54766 → 22 [ACK] Seq=9105 Ack=172501 Win=6155 Len=0 TSval=8222401 TSecr=15153902
  827 33.501060292  10.6.15.156 → 192.168.1.12 SSH 358 Server: Encrypted packet (len=292)
  828 33.501155447 192.168.1.12 → 10.6.15.156  TCP 66 54766 → 22 [ACK] Seq=9105 Ack=172793 Win=6155 Len=0 TSval=8222415 TSecr=15153916
  829 33.603525576  10.6.15.156 → 192.168.1.12 SSH 198 Server: Encrypted packet (len=132)
  830 33.603607951 192.168.1.12 → 10.6.15.156  TCP 66 54766 → 22 [ACK] Seq=9105 Ack=172925 Win=6155 Len=0 TSval=8222441 TSecr=15153942
  831 33.825159592  10.6.15.156 → 192.168.1.12 SSH 438 Server: Encrypted packet (len=372)
  832 33.825188110 192.168.1.12 → 10.6.15.156  TCP 66 54766 → 22 [ACK] Seq=9105 Ack=173297 Win=6155 Len=0 TSval=8222496 TSecr=15153997
  833 33.894607849  10.6.15.156 → 192.168.1.12 SSH 486 Server: Encrypted packet (len=420)
  834 33.894626803 192.168.1.12 → 10.6.15.156  TCP 66 54766 → 22 [ACK] Seq=9105 Ack=173717 Win=6155 Len=0 TSval=8222514 TSecr=15154015
  835 33.952889393  10.6.15.156 → 192.168.1.12 SSH 438 Server: Encrypted packet (len=372)
  836 33.952907373 192.168.1.12 → 10.6.15.156  TCP 66 54766 → 22 [ACK] Seq=9105 Ack=174089 Win=6155 Len=0 TSval=8222528 TSecr=15154029
  837 34.055305552  10.6.15.156 → 192.168.1.12 SSH 550 Server: Encrypted packet (len=484)
  838 34.055323195 192.168.1.12 → 10.6.15.156  TCP 66 54766 → 22 [ACK] Seq=9105 Ack=174573 Win=6155 Len=0 TSval=8222554 TSecr=15154055
  839 34.276382865  10.6.15.156 → 192.168.1.12 SSH 374 Server: Encrypted packet (len=308)
  840 34.276401146 192.168.1.12 → 10.6.15.156  TCP 66 54766 → 22 [ACK] Seq=9105 Ack=174881 Win=6155 Len=0 TSval=8222609 TSecr=15154110
  841 34.345493775  10.6.15.156 → 192.168.1.12 SSH 318 Server: Encrypted packet (len=252)
  842 34.345511742 192.168.1.12 → 10.6.15.156  TCP 66 54766 → 22 [ACK] Seq=9105 Ack=175133 Win=6155 Len=0 TSval=8222626 TSecr=15154127
  843 34.404903075  10.6.15.156 → 192.168.1.12 SSH 318 Server: Encrypted packet (len=252)
  844 34.404920945 192.168.1.12 → 10.6.15.156  TCP 66 54766 → 22 [ACK] Seq=9105 Ack=175385 Win=6155 Len=0 TSval=8222641 TSecr=15154142
  845 34.505686296  10.6.15.156 → 192.168.1.12 SSH 286 Server: Encrypted packet (len=220)
  846 34.505704140 192.168.1.12 → 10.6.15.156  TCP 66 54766 → 22 [ACK] Seq=9105 Ack=175605 Win=6155 Len=0 TSval=8222666 TSecr=15154167
  847 34.518714987  10.6.15.156 → 192.168.1.12 SSH 286 Server: [TCP Spurious Retransmission] , Encrypted packet (len=220)
  848 34.518734886 192.168.1.12 → 10.6.15.156  TCP 78 [TCP Dup ACK 846#1] 54766 → 22 [ACK] Seq=9105 Ack=175605 Win=6155 Len=0 TSval=8222670 TSecr=15154171 SLE=175385 SRE=175605
