    1 0.000000000  10.6.15.156 → 192.168.1.12 SSH 134 Server: Encrypted packet (len=68)
    2 0.000033041  10.6.15.156 → 192.168.1.12 SSH 138 Server: Encrypted packet (len=72)
    3 0.000122684 192.168.1.12 → 10.6.15.156  TCP 66 54766 → 22 [ACK] Seq=1 Ack=141 Win=6155 Len=0 TSval=8223020 TSecr=15154521
    4 0.000352480 192.168.1.12 → 10.6.15.156  SSH 102 Client: Encrypted packet (len=36)
    5 0.041570852  10.6.15.156 → 192.168.1.12 TCP 66 22 → 54766 [ACK] Seq=141 Ack=37 Win=1452 Len=0 TSval=15154532 TSecr=8223020
    6 0.045166173  10.6.15.156 → 192.168.1.12 SSH 138 Server: Encrypted packet (len=72)
    7 0.045395693 192.168.1.12 → 10.6.15.156  SSH 102 Client: Encrypted packet (len=36)
    8 0.046947121  10.6.15.156 → 192.168.1.12 TCP 66 22 → 54766 [ACK] Seq=213 Ack=73 Win=1452 Len=0 TSval=15154533 TSecr=8223032
    9 0.088572563  10.6.15.156 → 192.168.1.12 SSH 138 Server: Encrypted packet (len=72)
   10 0.088817974 192.168.1.12 → 10.6.15.156  SSH 102 Client: Encrypted packet (len=36)
   11 0.090371082  10.6.15.156 → 192.168.1.12 TCP 66 22 → 54766 [ACK] Seq=285 Ack=109 Win=1452 Len=0 TSval=15154544 TSecr=8223043
   12 0.093018154  10.6.15.156 → 192.168.1.12 SSH 102 Server: Encrypted packet (len=36)
   13 0.093037384  10.6.15.156 → 192.168.1.12 SSH 138 Server: Encrypted packet (len=72)
   14 0.093103924 192.168.1.12 → 10.6.15.156  TCP 66 54766 → 22 [ACK] Seq=109 Ack=393 Win=6155 Len=0 TSval=8223044 TSecr=15154544
   15 0.093272742 192.168.1.12 → 10.6.15.156  SSH 102 Client: Encrypted packet (len=36)
   16 0.132508234  10.6.15.156 → 192.168.1.12 TCP 66 22 → 54766 [ACK] Seq=393 Ack=145 Win=1452 Len=0 TSval=15154555 TSecr=8223044
   17 0.132532654 192.168.1.12 → 10.6.15.156  SSH 118 Client: Encrypted packet (len=52)
   18 0.133997434  10.6.15.156 → 192.168.1.12 TCP 66 22 → 54766 [ACK] Seq=393 Ack=197 Win=1452 Len=0 TSval=15154555 TSecr=8223053
   19 0.202413875  10.6.15.156 → 192.168.1.12 SSH 138 Server: Encrypted packet (len=72)
   20 0.202641981 192.168.1.12 → 10.6.15.156  SSH 102 Client: Encrypted packet (len=36)
   21 0.204170209  10.6.15.156 → 192.168.1.12 TCP 66 22 → 54766 [ACK] Seq=465 Ack=233 Win=1452 Len=0 TSval=15154572 TSecr=8223071
   22 0.210415130  10.6.15.156 → 192.168.1.12 SSH 102 Server: Encrypted packet (len=36)
   23 0.212431777  10.6.15.156 → 192.168.1.12 SSH 102 Server: Encrypted packet (len=36)
   24 0.212512999 192.168.1.12 → 10.6.15.156  TCP 66 54766 → 22 [ACK] Seq=233 Ack=537 Win=6155 Len=0 TSval=8223073 TSecr=15154574
   25 0.254260346  10.6.15.156 → 192.168.1.12 SSH 102 Server: Encrypted packet (len=36)
   26 0.296666724 192.168.1.12 → 10.6.15.156  TCP 66 54766 → 22 [ACK] Seq=233 Ack=573 Win=6155 Len=0 TSval=8223095 TSecr=15154584
   27 0.388340864  10.6.15.156 → 192.168.1.12 SSH 254 Server: Encrypted packet (len=188)
   28 0.388415362 192.168.1.12 → 10.6.15.156  TCP 66 54766 → 22 [ACK] Seq=233 Ack=761 Win=6155 Len=0 TSval=8223117 TSecr=15154618
   29 0.392252569  10.6.15.156 → 192.168.1.12 SSH 470 Server: Encrypted packet (len=404)
   30 0.392299456 192.168.1.12 → 10.6.15.156  TCP 66 54766 → 22 [ACK] Seq=233 Ack=1165 Win=6155 Len=0 TSval=8223118 TSecr=15154619
   31 0.609264703  10.6.15.156 → 192.168.1.12 SSH 342 Server: Encrypted packet (len=276)
   32 0.609300427 192.168.1.12 → 10.6.15.156  TCP 66 54766 → 22 [ACK] Seq=233 Ack=1441 Win=6155 Len=0 TSval=8223173 TSecr=15154674
   33 0.678766410  10.6.15.156 → 192.168.1.12 SSH 486 Server: Encrypted packet (len=420)
   34 0.678786863 192.168.1.12 → 10.6.15.156  TCP 66 54766 → 22 [ACK] Seq=233 Ack=1861 Win=6155 Len=0 TSval=8223190 TSecr=15154691
   35 0.686188329 192.168.1.12 → 10.6.15.156  SSH 254 Client: Encrypted packet (len=188)
   36 0.724490766  10.6.15.156 → 192.168.1.12 TCP 66 22 → 54766 [ACK] Seq=1861 Ack=421 Win=1452 Len=0 TSval=15154703 TSecr=8223192
   37 0.733425901 192.168.1.12 → 10.6.15.156  SSH 102 Client: Encrypted packet (len=36)
   38 0.733672433 192.168.1.12 → 10.6.15.156  SSH 102 Client: Encrypted packet (len=36)
   39 0.734799859  10.6.15.156 → 192.168.1.12 TCP 66 22 → 54766 [ACK] Seq=1861 Ack=457 Win=1452 Len=0 TSval=15154705 TSecr=8223204
   40 0.734808707  10.6.15.156 → 192.168.1.12 TCP 66 22 → 54766 [ACK] Seq=1861 Ack=493 Win=1452 Len=0 TSval=15154705 TSecr=8223204
   41 0.736297293  10.6.15.156 → 192.168.1.12 SSH 486 Server: Encrypted packet (len=420)
   42 0.776666197 192.168.1.12 → 10.6.15.156  TCP 66 54766 → 22 [ACK] Seq=493 Ack=2281 Win=6155 Len=0 TSval=8223215 TSecr=15154705
   43 0.799467232 192.168.1.12 → 239.255.255.250 SSDP 213 M-SEARCH * HTTP/1.1 
   44 0.807314563  10.6.15.156 → 192.168.1.12 SSH 102 Server: Encrypted packet (len=36)
   45 0.807343406 192.168.1.12 → 10.6.15.156  TCP 66 54766 → 22 [ACK] Seq=493 Ack=2317 Win=6155 Len=0 TSval=8223222 TSecr=15154723
   46 0.807684862 192.168.1.12 → 10.6.15.156  SSH 134 Client: Encrypted packet (len=68)
   47 0.835329407  10.6.15.156 → 192.168.1.12 SSH 138 Server: Encrypted packet (len=72)
   48 0.835352316 192.168.1.12 → 10.6.15.156  SSH 222 Client: Encrypted packet (len=156)
   49 0.835665783 192.168.1.12 → 10.6.15.156  SSH 102 Client: Encrypted packet (len=36)
   50 0.837214157  10.6.15.156 → 192.168.1.12 TCP 66 22 → 54766 [ACK] Seq=2389 Ack=753 Win=1452 Len=0 TSval=15154731 TSecr=8223229
   51 0.838837297  10.6.15.156 → 192.168.1.12 SSH 406 Server: Encrypted packet (len=340)
   52 0.862386802  10.6.15.156 → 192.168.1.12 SSH 150 Server: Encrypted packet (len=84)
   53 0.862475265 192.168.1.12 → 10.6.15.156  TCP 66 54766 → 22 [ACK] Seq=753 Ack=2813 Win=6155 Len=0 TSval=8223236 TSecr=15154731
   54 0.941139149  10.6.15.156 → 192.168.1.12 SSH 350 Server: Encrypted packet (len=284)
   55 0.984684876 192.168.1.12 → 10.6.15.156  TCP 66 54766 → 22 [ACK] Seq=753 Ack=3097 Win=6155 Len=0 TSval=8223267 TSecr=15154757
   56 1.012216567 192.168.1.12 → 192.168.1.1  DNS 74 Standard query 0xeb7e A ntp.ubuntu.com
   57 1.016782449  192.168.1.1 → 192.168.1.12 DNS 138 Standard query response 0xeb7e A ntp.ubuntu.com A 91.189.91.157 A 91.189.94.4 A 91.189.89.199 A 91.189.89.198
   58 1.017202407 192.168.1.12 → 91.189.91.157 NTP 90 NTP Version 4, client
   59 1.060352007  10.6.15.156 → 192.168.1.12 SSH 390 Server: Encrypted packet (len=324)
   60 1.060377499 192.168.1.12 → 10.6.15.156  TCP 66 54766 → 22 [ACK] Seq=753 Ack=3421 Win=6155 Len=0 TSval=8223285 TSecr=15154786
   61 1.129524954  10.6.15.156 → 192.168.1.12 SSH 182 Server: Encrypted packet (len=116)
   62 1.129542361 192.168.1.12 → 10.6.15.156  TCP 66 54766 → 22 [ACK] Seq=753 Ack=3537 Win=6155 Len=0 TSval=8223303 TSecr=15154804
   63 1.176817655  10.6.15.156 → 192.168.1.12 SSH 138 Server: Encrypted packet (len=72)
   64 1.176835888 192.168.1.12 → 10.6.15.156  TCP 66 54766 → 22 [ACK] Seq=753 Ack=3609 Win=6155 Len=0 TSval=8223315 TSecr=15154816
   65 1.177071644 192.168.1.12 → 10.6.15.156  SSH 102 Client: Encrypted packet (len=36)
   66 1.189454628  10.6.15.156 → 192.168.1.12 SSH 182 Server: Encrypted packet (len=116)
   67 1.215284198  10.6.15.156 → 192.168.1.12 SSH 142 Server: Encrypted packet (len=76)
   68 1.215403856 192.168.1.12 → 10.6.15.156  TCP 66 54766 → 22 [ACK] Seq=789 Ack=3801 Win=6155 Len=0 TSval=8223324 TSecr=15154818
   69 1.216253696  10.6.15.156 → 192.168.1.12 SSH 398 Server: Encrypted packet (len=332)
   70 1.248986996  10.6.15.156 → 192.168.1.12 SSH 1198 Server: Encrypted packet (len=1132)
   71 1.249001671 192.168.1.12 → 10.6.15.156  TCP 66 54766 → 22 [ACK] Seq=789 Ack=5265 Win=6155 Len=0 TSval=8223333 TSecr=15154825
   72 1.264258962 192.168.1.12 → 10.6.15.156  SSH 102 Client: Encrypted packet (len=36)
   73 1.303328004  10.6.15.156 → 192.168.1.12 SSH 182 Server: Encrypted packet (len=116)
   74 1.303356393 192.168.1.12 → 10.6.15.156  SSH 430 Client: Encrypted packet (len=364)
   75 1.309198427  10.6.15.156 → 192.168.1.12 SSH 138 Server: Encrypted packet (len=72)
   76 1.309588411 192.168.1.12 → 10.6.15.156  SSH 126 Client: Encrypted packet (len=60)
   77 1.309833568 192.168.1.12 → 10.6.15.156  SSH 126 Client: Encrypted packet (len=60)
   78 1.311330153  10.6.15.156 → 192.168.1.12 TCP 66 22 → 54766 [ACK] Seq=5453 Ack=1309 Win=1452 Len=0 TSval=15154849 TSecr=8223348
   79 1.317061684  10.6.15.156 → 192.168.1.12 SSH 1514 Server: Encrypted packet (len=1448)
   80 1.317269500  10.6.15.156 → 192.168.1.12 SSH 1514 Server: Encrypted packet (len=1448)
   81 1.317279538 192.168.1.12 → 10.6.15.156  TCP 66 54766 → 22 [ACK] Seq=1309 Ack=8349 Win=6155 Len=0 TSval=8223350 TSecr=15154851
   82 1.317505375  10.6.15.156 → 192.168.1.12 SSH 718 Server: Encrypted packet (len=652)
   83 1.319199236  10.6.15.156 → 192.168.1.12 SSH 1514 Server: Encrypted packet (len=1448)
   84 1.319214323 192.168.1.12 → 10.6.15.156  TCP 66 54766 → 22 [ACK] Seq=1309 Ack=10449 Win=6155 Len=0 TSval=8223350 TSecr=15154851
   85 1.319383233  10.6.15.156 → 192.168.1.12 SSH 1514 Server: Encrypted packet (len=1448)
   86 1.323934079  10.6.15.156 → 192.168.1.12 SSH 1514 Server: Encrypted packet (len=1448)
   87 1.323951515 192.168.1.12 → 10.6.15.156  TCP 66 54766 → 22 [ACK] Seq=1309 Ack=13345 Win=6155 Len=0 TSval=8223351 TSecr=15154851
   88 1.324121130  10.6.15.156 → 192.168.1.12 SSH 1514 Server: Encrypted packet (len=1448)
   89 1.324312428  10.6.15.156 → 192.168.1.12 SSH 1514 Server: Encrypted packet (len=1448)
   90 1.324317253 192.168.1.12 → 10.6.15.156  TCP 66 54766 → 22 [ACK] Seq=1309 Ack=16241 Win=6155 Len=0 TSval=8223351 TSecr=15154851
   91 1.324506820  10.6.15.156 → 192.168.1.12 SSH 1514 Server: Encrypted packet (len=1448)
   92 1.324671190  10.6.15.156 → 192.168.1.12 SSH 1514 Server: Encrypted packet (len=1448)
   93 1.324676780 192.168.1.12 → 10.6.15.156  TCP 66 54766 → 22 [ACK] Seq=1309 Ack=19137 Win=6155 Len=0 TSval=8223352 TSecr=15154851
   94 1.325081828  10.6.15.156 → 192.168.1.12 SSH 1514 Server: Encrypted packet (len=1448)
   95 1.325104392  10.6.15.156 → 192.168.1.12 SSH 750 Server: Encrypted packet (len=684)
   96 1.325113135 192.168.1.12 → 10.6.15.156  TCP 66 54766 → 22 [ACK] Seq=1309 Ack=21269 Win=6155 Len=0 TSval=8223352 TSecr=15154852
   97 1.374585025  10.6.15.156 → 192.168.1.12 SSH 1514 Server: Encrypted packet (len=1448)
   98 1.374736560  10.6.15.156 → 192.168.1.12 SSH 1514 Server: Encrypted packet (len=1448)
   99 1.374745562 192.168.1.12 → 10.6.15.156  TCP 66 54766 → 22 [ACK] Seq=1309 Ack=24165 Win=6155 Len=0 TSval=8223364 TSecr=15154865
  100 1.374936225  10.6.15.156 → 192.168.1.12 SSH 1514 Server: Encrypted packet (len=1448)
  101 1.375127689  10.6.15.156 → 192.168.1.12 SSH 1514 Server: Encrypted packet (len=1448)
  102 1.375138838 192.168.1.12 → 10.6.15.156  TCP 66 54766 → 22 [ACK] Seq=1309 Ack=27061 Win=6155 Len=0 TSval=8223364 TSecr=15154865
  103 1.375170223  10.6.15.156 → 192.168.1.12 SSH 758 Server: Encrypted packet (len=692)
  104 1.375547260  10.6.15.156 → 192.168.1.12 SSH 1514 Server: Encrypted packet (len=1448)
  105 1.375554369 192.168.1.12 → 10.6.15.156  TCP 66 54766 → 22 [ACK] Seq=1309 Ack=29201 Win=6155 Len=0 TSval=8223364 TSecr=15154865
  106 1.375728146  10.6.15.156 → 192.168.1.12 SSH 1514 Server: Encrypted packet (len=1448)
  107 1.375931272  10.6.15.156 → 192.168.1.12 SSH 1514 Server: Encrypted packet (len=1448)
  108 1.375938654 192.168.1.12 → 10.6.15.156  TCP 66 54766 → 22 [ACK] Seq=1309 Ack=32097 Win=6155 Len=0 TSval=8223364 TSecr=15154865
  109 1.378135404  10.6.15.156 → 192.168.1.12 SSH 1514 Server: Encrypted packet (len=1448)
  110 1.378318621  10.6.15.156 → 192.168.1.12 SSH 1514 Server: Encrypted packet (len=1448)
  111 1.378331414 192.168.1.12 → 10.6.15.156  TCP 66 54766 → 22 [ACK] Seq=1309 Ack=34993 Win=6155 Len=0 TSval=8223365 TSecr=15154866
  112 1.378598922  10.6.15.156 → 192.168.1.12 SSH 1110 Server: Encrypted packet (len=1044)
  113 1.411973964  10.6.15.156 → 192.168.1.12 SSH 306 Server: Encrypted packet (len=240)
  114 1.411992249 192.168.1.12 → 10.6.15.156  TCP 66 54766 → 22 [ACK] Seq=1309 Ack=36277 Win=6155 Len=0 TSval=8223373 TSecr=15154866
  115 1.420842407  10.6.15.156 → 192.168.1.12 SSH 306 Server: [TCP Spurious Retransmission] , Encrypted packet (len=240)
  116 1.420858084 192.168.1.12 → 10.6.15.156  TCP 78 [TCP Dup ACK 114#1] 54766 → 22 [ACK] Seq=1309 Ack=36277 Win=6155 Len=0 TSval=8223376 TSecr=15154877 SLE=36037 SRE=36277
  117 1.512613388  10.6.15.156 → 192.168.1.12 SSH 278 Server: Encrypted packet (len=212)
  118 1.512635541 192.168.1.12 → 10.6.15.156  TCP 66 54766 → 22 [ACK] Seq=1309 Ack=36489 Win=6155 Len=0 TSval=8223398 TSecr=15154899
  119 1.581084513  10.6.15.156 → 192.168.1.12 SSH 342 Server: Encrypted packet (len=276)
  120 1.581107635 192.168.1.12 → 10.6.15.156  TCP 66 54766 → 22 [ACK] Seq=1309 Ack=36765 Win=6155 Len=0 TSval=8223416 TSecr=15154917
  121 1.638349203  10.6.15.156 → 192.168.1.12 SSH 342 Server: Encrypted packet (len=276)
  122 1.638367970 192.168.1.12 → 10.6.15.156  TCP 66 54766 → 22 [ACK] Seq=1309 Ack=37041 Win=6155 Len=0 TSval=8223430 TSecr=15154931
  123 1.644473287  10.6.15.156 → 192.168.1.12 SSH 138 Server: Encrypted packet (len=72)
  124 1.644492294 192.168.1.12 → 10.6.15.156  TCP 66 54766 → 22 [ACK] Seq=1309 Ack=37113 Win=6155 Len=0 TSval=8223431 TSecr=15154933
  125 1.644735021 192.168.1.12 → 10.6.15.156  SSH 102 Client: Encrypted packet (len=36)
  126 1.684461515  10.6.15.156 → 192.168.1.12 TCP 66 22 → 54766 [ACK] Seq=37113 Ack=1345 Win=1452 Len=0 TSval=15154943 TSecr=8223432
  127 1.688086740  10.6.15.156 → 192.168.1.12 SSH 138 Server: Encrypted packet (len=72)
  128 1.688315600 192.168.1.12 → 10.6.15.156  SSH 102 Client: Encrypted packet (len=36)
  129 1.689773922  10.6.15.156 → 192.168.1.12 TCP 66 22 → 54766 [ACK] Seq=37185 Ack=1381 Win=1452 Len=0 TSval=15154944 TSecr=8223442
  130 1.740909517  10.6.15.156 → 192.168.1.12 SSH 342 Server: Encrypted packet (len=276)
  131 1.784678468 192.168.1.12 → 10.6.15.156  TCP 66 54766 → 22 [ACK] Seq=1381 Ack=37461 Win=6155 Len=0 TSval=8223467 TSecr=15154957
  132 1.800418434 192.168.1.12 → 239.255.255.250 SSDP 213 M-SEARCH * HTTP/1.1 
  133 2.093625084  10.6.15.156 → 192.168.1.12 SSH 190 Server: Encrypted packet (len=124)
  134 2.093650939 192.168.1.12 → 10.6.15.156  TCP 66 54766 → 22 [ACK] Seq=1381 Ack=37585 Win=6155 Len=0 TSval=8223544 TSecr=15155044
  135 2.199945508  10.6.15.156 → 192.168.1.12 SSH 182 Server: Encrypted packet (len=116)
  136 2.199962922 192.168.1.12 → 10.6.15.156  TCP 66 54766 → 22 [ACK] Seq=1381 Ack=37701 Win=6155 Len=0 TSval=8223570 TSecr=15155069
  137 2.413081904  10.6.15.156 → 192.168.1.12 SSH 190 Server: Encrypted packet (len=124)
  138 2.413099790 192.168.1.12 → 10.6.15.156  TCP 66 54766 → 22 [ACK] Seq=1381 Ack=37825 Win=6155 Len=0 TSval=8223624 TSecr=15155125
  139 2.482710134  10.6.15.156 → 192.168.1.12 SSH 182 Server: Encrypted packet (len=116)
  140 2.482727339 192.168.1.12 → 10.6.15.156  TCP 66 54766 → 22 [ACK] Seq=1381 Ack=37941 Win=6155 Len=0 TSval=8223641 TSecr=15155142
  141 2.604716683 192.168.1.12 → 224.0.0.252  LLMNR 61 Standard query 0xe219 A x
  142 2.643253626  10.6.15.156 → 192.168.1.12 SSH 182 Server: Encrypted packet (len=116)
  143 2.643273291 192.168.1.12 → 10.6.15.156  TCP 66 54766 → 22 [ACK] Seq=1381 Ack=38057 Win=6155 Len=0 TSval=8223681 TSecr=15155182
  144 2.800789564 192.168.1.12 → 239.255.255.250 SSDP 213 M-SEARCH * HTTP/1.1 
  145 2.854682283 192.168.1.12 → 224.0.0.252  LLMNR 61 Standard query 0xe219 A x
  146 2.863956214  10.6.15.156 → 192.168.1.12 SSH 182 Server: Encrypted packet (len=116)
  147 2.863973485 192.168.1.12 → 10.6.15.156  TCP 66 54766 → 22 [ACK] Seq=1381 Ack=38173 Win=6155 Len=0 TSval=8223736 TSecr=15155237
  148 2.933400654  10.6.15.156 → 192.168.1.12 SSH 182 Server: Encrypted packet (len=116)
  149 2.933418699 192.168.1.12 → 10.6.15.156  TCP 66 54766 → 22 [ACK] Seq=1381 Ack=38289 Win=6155 Len=0 TSval=8223754 TSecr=15155255
  150 2.990966096  10.6.15.156 → 192.168.1.12 SSH 182 Server: Encrypted packet (len=116)
  151 2.990985233 192.168.1.12 → 10.6.15.156  TCP 66 54766 → 22 [ACK] Seq=1381 Ack=38405 Win=6155 Len=0 TSval=8223768 TSecr=15155269
  152 3.093790630  10.6.15.156 → 192.168.1.12 SSH 270 Server: Encrypted packet (len=204)
  153 3.093808826 192.168.1.12 → 10.6.15.156  TCP 66 54766 → 22 [ACK] Seq=1381 Ack=38609 Win=6155 Len=0 TSval=8223794 TSecr=15155295
  154 3.104642201 192.168.1.12 → 224.0.0.252  LLMNR 61 Standard query 0xe219 A x
  155 3.170020252  10.22.18.34 → 224.0.0.252  LLMNR 68 Standard query 0x6c08 ANY DELL-15R
  156 3.315194305  10.6.15.156 → 192.168.1.12 SSH 310 Server: Encrypted packet (len=244)
  157 3.315208610 192.168.1.12 → 10.6.15.156  TCP 66 54766 → 22 [ACK] Seq=1381 Ack=38853 Win=6155 Len=0 TSval=8223849 TSecr=15155350
  158 3.384582064  10.6.15.156 → 192.168.1.12 SSH 302 Server: Encrypted packet (len=236)
  159 3.384596751 192.168.1.12 → 10.6.15.156  TCP 66 54766 → 22 [ACK] Seq=1381 Ack=39089 Win=6155 Len=0 TSval=8223866 TSecr=15155368
  160 3.442456106  10.6.15.156 → 192.168.1.12 SSH 406 Server: Encrypted packet (len=340)
  161 3.442474201 192.168.1.12 → 10.6.15.156  TCP 66 54766 → 22 [ACK] Seq=1381 Ack=39429 Win=6155 Len=0 TSval=8223881 TSecr=15155382
  162 3.545011465  10.6.15.156 → 192.168.1.12 SSH 390 Server: Encrypted packet (len=324)
  163 3.545029037 192.168.1.12 → 10.6.15.156  TCP 66 54766 → 22 [ACK] Seq=1381 Ack=39753 Win=6155 Len=0 TSval=8223907 TSecr=15155408
  164 3.581000125  10.22.18.34 → 224.0.0.252  LLMNR 68 Standard query 0x6c08 ANY DELL-15R
  165 3.766258713  10.6.15.156 → 192.168.1.12 SSH 374 Server: Encrypted packet (len=308)
  166 3.766276418 192.168.1.12 → 10.6.15.156  TCP 66 54766 → 22 [ACK] Seq=1381 Ack=40061 Win=6155 Len=0 TSval=8223962 TSecr=15155463
  167 3.838783715  10.6.15.156 → 192.168.1.12 SSH 374 Server: Encrypted packet (len=308)
  168 3.838801523 192.168.1.12 → 10.6.15.156  TCP 66 54766 → 22 [ACK] Seq=1381 Ack=40369 Win=6155 Len=0 TSval=8223980 TSecr=15155480
  169 3.893232800  10.6.15.156 → 192.168.1.12 SSH 374 Server: Encrypted packet (len=308)
  170 3.893252385 192.168.1.12 → 10.6.15.156  TCP 66 54766 → 22 [ACK] Seq=1381 Ack=40677 Win=6155 Len=0 TSval=8223994 TSecr=15155495
  171 3.995808886  10.6.15.156 → 192.168.1.12 SSH 270 Server: Encrypted packet (len=204)
  172 3.995826897 192.168.1.12 → 10.6.15.156  TCP 66 54766 → 22 [ACK] Seq=1381 Ack=40881 Win=6155 Len=0 TSval=8224019 TSecr=15155520
  173 4.217049235  10.6.15.156 → 192.168.1.12 SSH 182 Server: Encrypted packet (len=116)
  174 4.217067150 192.168.1.12 → 10.6.15.156  TCP 66 54766 → 22 [ACK] Seq=1381 Ack=40997 Win=6155 Len=0 TSval=8224075 TSecr=15155576
  175 4.292629998  10.6.15.156 → 192.168.1.12 SSH 182 Server: Encrypted packet (len=116)
  176 4.292647572 192.168.1.12 → 10.6.15.156  TCP 66 54766 → 22 [ACK] Seq=1381 Ack=41113 Win=6155 Len=0 TSval=8224093 TSecr=15155593
  177 4.350461196  10.6.15.156 → 192.168.1.12 SSH 206 Server: Encrypted packet (len=140)
  178 4.350479350 192.168.1.12 → 10.6.15.156  TCP 66 54766 → 22 [ACK] Seq=1381 Ack=41253 Win=6155 Len=0 TSval=8224108 TSecr=15155607
  179 4.446778811  10.6.15.156 → 192.168.1.12 SSH 206 Server: Encrypted packet (len=140)
  180 4.446797005 192.168.1.12 → 10.6.15.156  TCP 66 54766 → 22 [ACK] Seq=1381 Ack=41393 Win=6155 Len=0 TSval=8224132 TSecr=15155633
  181 4.669929065  10.6.15.156 → 192.168.1.12 SSH 222 Server: Encrypted packet (len=156)
  182 4.669947252 192.168.1.12 → 10.6.15.156  TCP 66 54766 → 22 [ACK] Seq=1381 Ack=41549 Win=6155 Len=0 TSval=8224188 TSecr=15155688
  183 4.743701824  10.6.15.156 → 192.168.1.12 SSH 254 Server: Encrypted packet (len=188)
  184 4.743718286 192.168.1.12 → 10.6.15.156  TCP 66 54766 → 22 [ACK] Seq=1381 Ack=41737 Win=6155 Len=0 TSval=8224206 TSecr=15155706
  185 4.803414801  10.6.15.156 → 192.168.1.12 SSH 182 Server: Encrypted packet (len=116)
  186 4.803431682 192.168.1.12 → 10.6.15.156  TCP 66 54766 → 22 [ACK] Seq=1381 Ack=41853 Win=6155 Len=0 TSval=8224221 TSecr=15155720
  187 4.805944271  192.168.1.1 → 239.255.255.250 SSDP 302 NOTIFY * HTTP/1.1 
  188 4.809312042  192.168.1.1 → 239.255.255.250 SSDP 311 NOTIFY * HTTP/1.1 
  189 4.812660984  192.168.1.1 → 239.255.255.250 SSDP 374 NOTIFY * HTTP/1.1 
  190 4.816122936  192.168.1.1 → 239.255.255.250 SSDP 370 NOTIFY * HTTP/1.1 
  191 4.819323547  192.168.1.1 → 239.255.255.250 SSDP 350 NOTIFY * HTTP/1.1 
  192 4.822801699  192.168.1.1 → 239.255.255.250 SSDP 382 NOTIFY * HTTP/1.1 
  193 4.826120662  192.168.1.1 → 239.255.255.250 SSDP 364 NOTIFY * HTTP/1.1 
  194 4.829524838  192.168.1.1 → 239.255.255.250 SSDP 366 NOTIFY * HTTP/1.1 
  195 4.832392847  192.168.1.1 → 239.255.255.250 SSDP 302 NOTIFY * HTTP/1.1 
  196 4.835429043  192.168.1.1 → 239.255.255.250 SSDP 311 NOTIFY * HTTP/1.1 
  197 4.838827968  192.168.1.1 → 239.255.255.250 SSDP 374 NOTIFY * HTTP/1.1 
  198 4.842144590  192.168.1.1 → 239.255.255.250 SSDP 370 NOTIFY * HTTP/1.1 
  199 4.845775036  192.168.1.1 → 239.255.255.250 SSDP 350 NOTIFY * HTTP/1.1 
  200 4.849272175  192.168.1.1 → 239.255.255.250 SSDP 382 NOTIFY * HTTP/1.1 
  201 4.852621745  192.168.1.1 → 239.255.255.250 SSDP 364 NOTIFY * HTTP/1.1 
  202 4.855983753  192.168.1.1 → 239.255.255.250 SSDP 366 NOTIFY * HTTP/1.1 
  203 4.897657158  10.6.15.156 → 192.168.1.12 SSH 182 Server: Encrypted packet (len=116)
  204 4.897676069 192.168.1.12 → 10.6.15.156  TCP 66 54766 → 22 [ACK] Seq=1381 Ack=41969 Win=6155 Len=0 TSval=8224245 TSecr=15155746
  205 5.427474039 192.168.1.12 → 10.6.15.156  SSH 182 Client: Encrypted packet (len=116)
  206 5.429097027  10.6.15.156 → 192.168.1.12 TCP 66 22 → 54766 [ACK] Seq=41969 Ack=1497 Win=1452 Len=0 TSval=15155879 TSecr=8224377
  207 5.504192612 192.168.1.12 → 10.6.15.156  SSH 174 Client: Encrypted packet (len=108)
  208 5.506529545 192.168.1.12 → 10.6.15.156  SSH 434 Client: Encrypted packet (len=368)
  209 5.507778319  10.6.15.156 → 192.168.1.12 TCP 66 22 → 54766 [ACK] Seq=41969 Ack=1605 Win=1452 Len=0 TSval=15155898 TSecr=8224396
  210 5.508258377  10.6.15.156 → 192.168.1.12 TCP 66 22 → 54766 [ACK] Seq=41969 Ack=1973 Win=1452 Len=0 TSval=15155899 TSecr=8224397
  211 5.555789107  10.6.15.156 → 192.168.1.12 SSH 110 Server: Encrypted packet (len=44)
  212 5.555807137 192.168.1.12 → 10.6.15.156  TCP 66 54766 → 22 [ACK] Seq=1973 Ack=42013 Win=6155 Len=0 TSval=8224409 TSecr=15155910
  213 5.556163084 192.168.1.12 → 10.6.15.156  SSH 174 Client: Encrypted packet (len=108)
  214 5.557700802  10.6.15.156 → 192.168.1.12 TCP 66 22 → 54766 [ACK] Seq=42013 Ack=2081 Win=1452 Len=0 TSval=15155911 TSecr=8224409
  215 5.571195974  10.6.15.156 → 192.168.1.12 SSH 214 Server: Encrypted packet (len=148)
  216 5.609706185  10.6.15.156 → 192.168.1.12 SSH 526 Server: Encrypted packet (len=460)
  217 5.609724323 192.168.1.12 → 10.6.15.156  TCP 66 54766 → 22 [ACK] Seq=2081 Ack=42621 Win=6155 Len=0 TSval=8224423 TSecr=15155914
  218 5.610006365 192.168.1.12 → 10.6.15.156  SSH 102 Client: Encrypted packet (len=36)
  219 5.639928906  10.6.15.156 → 192.168.1.12 SSH 182 Server: Encrypted packet (len=116)
  220 5.639956420 192.168.1.12 → 10.6.15.156  SSH 318 Client: Encrypted packet (len=252)
  221 5.681395033  10.6.15.156 → 192.168.1.12 TCP 66 22 → 54766 [ACK] Seq=42737 Ack=2369 Win=1452 Len=0 TSval=15155942 TSecr=8224430
  222 5.690833300  10.6.15.156 → 192.168.1.12 SSH 150 Server: Encrypted packet (len=84)
  223 5.693622706  10.6.15.156 → 192.168.1.12 SSH 494 Server: Encrypted packet (len=428)
  224 5.693714653 192.168.1.12 → 10.6.15.156  TCP 66 54766 → 22 [ACK] Seq=2369 Ack=43249 Win=6155 Len=0 TSval=8224444 TSecr=15155944
  225 5.696955143  10.6.15.156 → 192.168.1.12 SSH 182 Server: Encrypted packet (len=116)
  226 5.740710713 192.168.1.12 → 10.6.15.156  TCP 66 54766 → 22 [ACK] Seq=2369 Ack=43365 Win=6155 Len=0 TSval=8224456 TSecr=15155946
  227 5.799671564  10.6.15.156 → 192.168.1.12 SSH 182 Server: Encrypted packet (len=116)
  228 5.799696094 192.168.1.12 → 10.6.15.156  TCP 66 54766 → 22 [ACK] Seq=2369 Ack=43481 Win=6155 Len=0 TSval=8224470 TSecr=15155971
  229 5.852428204  10.6.15.156 → 192.168.1.12 SSH 326 Server: Encrypted packet (len=260)
  230 5.852443962 192.168.1.12 → 10.6.15.156  TCP 66 54766 → 22 [ACK] Seq=2369 Ack=43741 Win=6155 Len=0 TSval=8224483 TSecr=15155985
  231 5.923388524  10.6.15.156 → 192.168.1.12 SSH 150 Server: Encrypted packet (len=84)
  232 5.923417731 192.168.1.12 → 10.6.15.156  TCP 66 54766 → 22 [ACK] Seq=2369 Ack=43825 Win=6155 Len=0 TSval=8224501 TSecr=15156002
  233 5.925199619  10.6.15.156 → 192.168.1.12 SSH 294 Server: Encrypted packet (len=228)
  234 5.925219603 192.168.1.12 → 10.6.15.156  TCP 66 54766 → 22 [ACK] Seq=2369 Ack=44053 Win=6155 Len=0 TSval=8224502 TSecr=15156003
  235 5.940505662  10.6.15.156 → 192.168.1.12 SSH 102 Server: Encrypted packet (len=36)
  236 5.940520718 192.168.1.12 → 10.6.15.156  TCP 66 54766 → 22 [ACK] Seq=2369 Ack=44089 Win=6155 Len=0 TSval=8224505 TSecr=15156007
  237 6.407130585  10.6.15.156 → 192.168.1.12 SSH 102 Server: Encrypted packet (len=36)
  238 6.407151144 192.168.1.12 → 10.6.15.156  TCP 66 54766 → 22 [ACK] Seq=2369 Ack=44125 Win=6155 Len=0 TSval=8224622 TSecr=15156123
  239 6.472152643  10.6.15.156 → 192.168.1.12 SSH 302 Server: Encrypted packet (len=236)
  240 6.472169261 192.168.1.12 → 10.6.15.156  TCP 66 54766 → 22 [ACK] Seq=2369 Ack=44361 Win=6155 Len=0 TSval=8224638 TSecr=15156139
  241 6.532568091  10.6.15.156 → 192.168.1.12 SSH 614 Server: Encrypted packet (len=548)
  242 6.532586334 192.168.1.12 → 10.6.15.156  TCP 66 54766 → 22 [ACK] Seq=2369 Ack=44909 Win=6155 Len=0 TSval=8224653 TSecr=15156155
  243 6.541361440  10.6.15.156 → 192.168.1.12 SSH 182 Server: Encrypted packet (len=116)
  244 6.541376496 192.168.1.12 → 10.6.15.156  TCP 66 54766 → 22 [ACK] Seq=2369 Ack=45025 Win=6155 Len=0 TSval=8224656 TSecr=15156157
  245 6.599103765  10.6.15.156 → 192.168.1.12 SSH 238 Server: Encrypted packet (len=172)
  246 6.599121693 192.168.1.12 → 10.6.15.156  TCP 66 54766 → 22 [ACK] Seq=2369 Ack=45197 Win=6155 Len=0 TSval=8224670 TSecr=15156171
  247 6.663618067  10.6.15.156 → 192.168.1.12 SSH 1326 Server: Encrypted packet (len=1260)
  248 6.663636000 192.168.1.12 → 10.6.15.156  TCP 66 54766 → 22 [ACK] Seq=2369 Ack=46457 Win=6155 Len=0 TSval=8224686 TSecr=15156187
  249 6.701870166  10.6.15.156 → 192.168.1.12 SSH 238 Server: Encrypted packet (len=172)
  250 6.701896661 192.168.1.12 → 10.6.15.156  TCP 66 54766 → 22 [ACK] Seq=2369 Ack=46629 Win=6155 Len=0 TSval=8224696 TSecr=15156197
  251 6.922975364  10.6.15.156 → 192.168.1.12 SSH 182 Server: Encrypted packet (len=116)
  252 6.922995926 192.168.1.12 → 10.6.15.156  TCP 66 54766 → 22 [ACK] Seq=2369 Ack=46745 Win=6155 Len=0 TSval=8224751 TSecr=15156252
  253 6.992694440  10.6.15.156 → 192.168.1.12 SSH 334 Server: Encrypted packet (len=268)
  254 6.992711362 192.168.1.12 → 10.6.15.156  TCP 66 54766 → 22 [ACK] Seq=2369 Ack=47013 Win=6155 Len=0 TSval=8224769 TSecr=15156270
  255 7.050179627  10.6.15.156 → 192.168.1.12 SSH 270 Server: Encrypted packet (len=204)
  256 7.050197985 192.168.1.12 → 10.6.15.156  TCP 66 54766 → 22 [ACK] Seq=2369 Ack=47217 Win=6155 Len=0 TSval=8224783 TSecr=15156284
  257 7.152948447  10.6.15.156 → 192.168.1.12 SSH 358 Server: Encrypted packet (len=292)
  258 7.152965867 192.168.1.12 → 10.6.15.156  TCP 66 54766 → 22 [ACK] Seq=2369 Ack=47509 Win=6155 Len=0 TSval=8224809 TSecr=15156310
  259 7.374469677  10.6.15.156 → 192.168.1.12 SSH 326 Server: Encrypted packet (len=260)
  260 7.374488992 192.168.1.12 → 10.6.15.156  TCP 66 54766 → 22 [ACK] Seq=2369 Ack=47769 Win=6155 Len=0 TSval=8224864 TSecr=15156365
  261 7.393443622  10.6.15.156 → 192.168.1.12 SSH 158 Server: Encrypted packet (len=92)
  262 7.393459055 192.168.1.12 → 10.6.15.156  TCP 66 54766 → 22 [ACK] Seq=2369 Ack=47861 Win=6155 Len=0 TSval=8224869 TSecr=15156370
  263 7.393758323 192.168.1.12 → 10.6.15.156  SSH 150 Client: Encrypted packet (len=84)
  264 7.395302341  10.6.15.156 → 192.168.1.12 TCP 66 22 → 54766 [ACK] Seq=47861 Ack=2453 Win=1452 Len=0 TSval=15156370 TSecr=8224869
  265 7.444425314  10.6.15.156 → 192.168.1.12 SSH 286 Server: Encrypted packet (len=220)
  266 7.484703684 192.168.1.12 → 10.6.15.156  TCP 66 54766 → 22 [ACK] Seq=2453 Ack=48081 Win=6155 Len=0 TSval=8224892 TSecr=15156382
  267 7.501040346  10.6.15.156 → 192.168.1.12 SSH 222 Server: Encrypted packet (len=156)
  268 7.501062873 192.168.1.12 → 10.6.15.156  TCP 66 54766 → 22 [ACK] Seq=2453 Ack=48237 Win=6155 Len=0 TSval=8224896 TSecr=15156397
  269 7.603770196  10.6.15.156 → 192.168.1.12 SSH 198 Server: Encrypted packet (len=132)
  270 7.603789264 192.168.1.12 → 10.6.15.156  TCP 66 54766 → 22 [ACK] Seq=2453 Ack=48369 Win=6155 Len=0 TSval=8224921 TSecr=15156422
  271 7.608722095  10.6.15.156 → 192.168.1.12 SSH 150 Server: Encrypted packet (len=84)
  272 7.608739393 192.168.1.12 → 10.6.15.156  TCP 66 54766 → 22 [ACK] Seq=2453 Ack=48453 Win=6155 Len=0 TSval=8224923 TSecr=15156424
  273 7.609005703 192.168.1.12 → 10.6.15.156  SSH 150 Client: Encrypted packet (len=84)
  274 7.610215310  10.6.15.156 → 192.168.1.12 TCP 66 22 → 54766 [ACK] Seq=48453 Ack=2537 Win=1452 Len=0 TSval=15156424 TSecr=8224923
  275 7.825148432  10.6.15.156 → 192.168.1.12 SSH 214 Server: Encrypted packet (len=148)
  276 7.868707229 192.168.1.12 → 10.6.15.156  TCP 66 54766 → 22 [ACK] Seq=2537 Ack=48601 Win=6155 Len=0 TSval=8224988 TSecr=15156478
  277 7.952375714  10.6.15.156 → 192.168.1.12 SSH 270 Server: Encrypted packet (len=204)
  278 7.952405096 192.168.1.12 → 10.6.15.156  TCP 66 54766 → 22 [ACK] Seq=2537 Ack=48805 Win=6155 Len=0 TSval=8225008 TSecr=15156509
  279 8.054910598  10.6.15.156 → 192.168.1.12 SSH 222 Server: Encrypted packet (len=156)
  280 8.054927357 192.168.1.12 → 10.6.15.156  TCP 66 54766 → 22 [ACK] Seq=2537 Ack=48961 Win=6155 Len=0 TSval=8225034 TSecr=15156535
  281 8.276062290  10.6.15.156 → 192.168.1.12 SSH 222 Server: Encrypted packet (len=156)
  282 8.276080231 192.168.1.12 → 10.6.15.156  TCP 66 54766 → 22 [ACK] Seq=2537 Ack=49117 Win=6155 Len=0 TSval=8225089 TSecr=15156590
  283 8.345477045  10.6.15.156 → 192.168.1.12 SSH 270 Server: Encrypted packet (len=204)
  284 8.345494701 192.168.1.12 → 10.6.15.156  TCP 66 54766 → 22 [ACK] Seq=2537 Ack=49321 Win=6155 Len=0 TSval=8225107 TSecr=15156608
  285 8.403177980  10.6.15.156 → 192.168.1.12 SSH 302 Server: Encrypted packet (len=236)
  286 8.403196262 192.168.1.12 → 10.6.15.156  TCP 66 54766 → 22 [ACK] Seq=2537 Ack=49557 Win=6155 Len=0 TSval=8225121 TSecr=15156622
  287 8.505948514  10.6.15.156 → 192.168.1.12 SSH 406 Server: Encrypted packet (len=340)
  288 8.505965571 192.168.1.12 → 10.6.15.156  TCP 66 54766 → 22 [ACK] Seq=2537 Ack=49897 Win=6155 Len=0 TSval=8225147 TSecr=15156648
  289 8.727184041  10.6.15.156 → 192.168.1.12 SSH 342 Server: Encrypted packet (len=276)
  290 8.727201874 192.168.1.12 → 10.6.15.156  TCP 66 54766 → 22 [ACK] Seq=2537 Ack=50173 Win=6155 Len=0 TSval=8225202 TSecr=15156703
  291 8.797046686  10.6.15.156 → 192.168.1.12 SSH 366 Server: Encrypted packet (len=300)
  292 8.797063087 192.168.1.12 → 10.6.15.156  TCP 66 54766 → 22 [ACK] Seq=2537 Ack=50473 Win=6155 Len=0 TSval=8225220 TSecr=15156721
  293 8.854377123  10.6.15.156 → 192.168.1.12 SSH 302 Server: Encrypted packet (len=236)
  294 8.854395665 192.168.1.12 → 10.6.15.156  TCP 66 54766 → 22 [ACK] Seq=2537 Ack=50709 Win=6155 Len=0 TSval=8225234 TSecr=15156735
  295 8.958215957  10.6.15.156 → 192.168.1.12 SSH 198 Server: Encrypted packet (len=132)
  296 8.958236876 192.168.1.12 → 10.6.15.156  TCP 66 54766 → 22 [ACK] Seq=2537 Ack=50841 Win=6155 Len=0 TSval=8225260 TSecr=15156761
  297 9.178240863  10.6.15.156 → 192.168.1.12 SSH 238 Server: Encrypted packet (len=172)
  298 9.178260329 192.168.1.12 → 10.6.15.156  TCP 66 54766 → 22 [ACK] Seq=2537 Ack=51013 Win=6155 Len=0 TSval=8225315 TSecr=15156816
  299 9.247466511  10.6.15.156 → 192.168.1.12 SSH 270 Server: Encrypted packet (len=204)
  300 9.247494238 192.168.1.12 → 10.6.15.156  TCP 66 54766 → 22 [ACK] Seq=2537 Ack=51217 Win=6155 Len=0 TSval=8225332 TSecr=15156833
  301 9.305126906  10.6.15.156 → 192.168.1.12 SSH 270 Server: Encrypted packet (len=204)
  302 9.305145220 192.168.1.12 → 10.6.15.156  TCP 66 54766 → 22 [ACK] Seq=2537 Ack=51421 Win=6155 Len=0 TSval=8225347 TSecr=15156848
  303 9.408201638  10.6.15.156 → 192.168.1.12 SSH 270 Server: Encrypted packet (len=204)
  304 9.408220201 192.168.1.12 → 10.6.15.156  TCP 66 54766 → 22 [ACK] Seq=2537 Ack=51625 Win=6155 Len=0 TSval=8225372 TSecr=15156873
  305 9.629178638  10.6.15.156 → 192.168.1.12 SSH 374 Server: Encrypted packet (len=308)
  306 9.629197491 192.168.1.12 → 10.6.15.156  TCP 66 54766 → 22 [ACK] Seq=2537 Ack=51933 Win=6155 Len=0 TSval=8225428 TSecr=15156929
  307 9.698731044  10.6.15.156 → 192.168.1.12 SSH 302 Server: Encrypted packet (len=236)
  308 9.698748934 192.168.1.12 → 10.6.15.156  TCP 66 54766 → 22 [ACK] Seq=2537 Ack=52169 Win=6155 Len=0 TSval=8225445 TSecr=15156946
  309 9.756728484  10.6.15.156 → 192.168.1.12 SSH 270 Server: Encrypted packet (len=204)
  310 9.756746072 192.168.1.12 → 10.6.15.156  TCP 66 54766 → 22 [ACK] Seq=2537 Ack=52373 Win=6155 Len=0 TSval=8225460 TSecr=15156960
  311 9.858852889  10.6.15.156 → 192.168.1.12 SSH 270 Server: Encrypted packet (len=204)
  312 9.858870653 192.168.1.12 → 10.6.15.156  TCP 66 54766 → 22 [ACK] Seq=2537 Ack=52577 Win=6155 Len=0 TSval=8225485 TSecr=15156986
  313 10.010488710 192.168.1.12 → 139.59.21.22 NTP 90 NTP Version 4, client
  314 10.080291896  10.6.15.156 → 192.168.1.12 SSH 286 Server: Encrypted packet (len=220)
  315 10.080310079 192.168.1.12 → 10.6.15.156  TCP 66 54766 → 22 [ACK] Seq=2537 Ack=52797 Win=6155 Len=0 TSval=8225540 TSecr=15157041
  316 10.149739562  10.6.15.156 → 192.168.1.12 SSH 358 Server: Encrypted packet (len=292)
  317 10.149756840 192.168.1.12 → 10.6.15.156  TCP 66 54766 → 22 [ACK] Seq=2537 Ack=53089 Win=6155 Len=0 TSval=8225558 TSecr=15157059
  318 10.207286397  10.6.15.156 → 192.168.1.12 SSH 422 Server: Encrypted packet (len=356)
  319 10.207304115 192.168.1.12 → 10.6.15.156  TCP 66 54766 → 22 [ACK] Seq=2537 Ack=53445 Win=6155 Len=0 TSval=8225572 TSecr=15157073
  320 10.258772720  10.6.15.156 → 192.168.1.12 SSH 150 Server: Encrypted packet (len=84)
  321 10.258790207 192.168.1.12 → 10.6.15.156  TCP 66 54766 → 22 [ACK] Seq=2537 Ack=53529 Win=6155 Len=0 TSval=8225585 TSecr=15157086
  322 10.259096721 192.168.1.12 → 10.6.15.156  SSH 150 Client: Encrypted packet (len=84)
  323 10.260663686  10.6.15.156 → 192.168.1.12 TCP 66 22 → 54766 [ACK] Seq=53529 Ack=2621 Win=1452 Len=0 TSval=15157087 TSecr=8225585
  324 10.310082193  10.6.15.156 → 192.168.1.12 SSH 422 Server: Encrypted packet (len=356)
  325 10.352705063 192.168.1.12 → 10.6.15.156  TCP 66 54766 → 22 [ACK] Seq=2621 Ack=53885 Win=6155 Len=0 TSval=8225609 TSecr=15157099
  326 10.501691689  10.6.15.156 → 192.168.1.12 SSH 182 Server: Encrypted packet (len=116)
  327 10.501718271 192.168.1.12 → 10.6.15.156  TCP 66 54766 → 22 [ACK] Seq=2621 Ack=54001 Win=6155 Len=0 TSval=8225646 TSecr=15157147
  328 10.531222610  10.6.15.156 → 192.168.1.12 SSH 374 Server: Encrypted packet (len=308)
  329 10.531240185 192.168.1.12 → 10.6.15.156  TCP 66 54766 → 22 [ACK] Seq=2621 Ack=54309 Win=6155 Len=0 TSval=8225653 TSecr=15157154
  330 10.600543565  10.6.15.156 → 192.168.1.12 SSH 222 Server: Encrypted packet (len=156)
  331 10.600562042 192.168.1.12 → 10.6.15.156  TCP 66 54766 → 22 [ACK] Seq=2621 Ack=54465 Win=6155 Len=0 TSval=8225670 TSecr=15157172
  332 10.808822515  10.6.15.156 → 192.168.1.12 SSH 150 Server: Encrypted packet (len=84)
  333 10.808841025 192.168.1.12 → 10.6.15.156  TCP 66 54766 → 22 [ACK] Seq=2621 Ack=54549 Win=6155 Len=0 TSval=8225723 TSecr=15157224
  334 10.809124233 192.168.1.12 → 10.6.15.156  SSH 150 Client: Encrypted packet (len=84)
  335 10.810923741  10.6.15.156 → 192.168.1.12 TCP 66 22 → 54766 [ACK] Seq=54549 Ack=2705 Win=1452 Len=0 TSval=15157224 TSecr=8225723
  336 10.982091081  10.6.15.156 → 192.168.1.12 SSH 302 Server: Encrypted packet (len=236)
  337 11.024705906 192.168.1.12 → 10.6.15.156  TCP 66 54766 → 22 [ACK] Seq=2705 Ack=54785 Win=6155 Len=0 TSval=8225777 TSecr=15157267
  338 11.052665847  10.6.15.156 → 192.168.1.12 SSH 334 Server: Encrypted packet (len=268)
  339 11.052691222 192.168.1.12 → 10.6.15.156  TCP 66 54766 → 22 [ACK] Seq=2705 Ack=55053 Win=6155 Len=0 TSval=8225784 TSecr=15157284
  340 11.109461975  10.6.15.156 → 192.168.1.12 SSH 374 Server: Encrypted packet (len=308)
  341 11.109481553 192.168.1.12 → 10.6.15.156  TCP 66 54766 → 22 [ACK] Seq=2705 Ack=55361 Win=6155 Len=0 TSval=8225798 TSecr=15157299
  342 11.211836145  10.6.15.156 → 192.168.1.12 SSH 374 Server: Encrypted packet (len=308)
  343 11.211857851 192.168.1.12 → 10.6.15.156  TCP 66 54766 → 22 [ACK] Seq=2705 Ack=55669 Win=6155 Len=0 TSval=8225823 TSecr=15157324
  344 11.409867017 192.168.1.12 → 10.6.15.156  SSH 1514 Client: Encrypted packet (len=1448)
  345 11.412489010  10.6.15.156 → 192.168.1.12 TCP 66 22 → 54766 [ACK] Seq=55669 Ack=4153 Win=1452 Len=0 TSval=15157375 TSecr=8225873
  346 11.412510011 192.168.1.12 → 10.6.15.156  SSH 614 Client: Encrypted packet (len=548)
  347 11.416081592  10.6.15.156 → 192.168.1.12 TCP 66 22 → 54766 [ACK] Seq=55669 Ack=4701 Win=1452 Len=0 TSval=15157375 TSecr=8225873
  348 11.417563545  10.6.15.156 → 192.168.1.12 SSH 142 Server: Encrypted packet (len=76)
  349 11.417649044 192.168.1.12 → 10.6.15.156  TCP 66 54766 → 22 [ACK] Seq=4701 Ack=55745 Win=6155 Len=0 TSval=8225875 TSecr=15157376
  350 11.432904917  10.6.15.156 → 192.168.1.12 SSH 222 Server: Encrypted packet (len=156)
  351 11.432978178 192.168.1.12 → 10.6.15.156  TCP 66 54766 → 22 [ACK] Seq=4701 Ack=55901 Win=6155 Len=0 TSval=8225879 TSecr=15157380
  352 11.502661491  10.6.15.156 → 192.168.1.12 SSH 270 Server: Encrypted packet (len=204)
  353 11.502752978 192.168.1.12 → 10.6.15.156  TCP 66 54766 → 22 [ACK] Seq=4701 Ack=56105 Win=6155 Len=0 TSval=8225896 TSecr=15157397
  354 11.531014380  10.6.15.156 → 192.168.1.12 SSH 910 Server: Encrypted packet (len=844)
  355 11.531100779 192.168.1.12 → 10.6.15.156  TCP 66 54766 → 22 [ACK] Seq=4701 Ack=56949 Win=6155 Len=0 TSval=8225903 TSecr=15157404
  356 11.531866495  10.6.15.156 → 192.168.1.12 SSH 598 Server: Encrypted packet (len=532)
  357 11.531954161 192.168.1.12 → 10.6.15.156  TCP 66 54766 → 22 [ACK] Seq=4701 Ack=57481 Win=6155 Len=0 TSval=8225903 TSecr=15157404
  358 11.534690603 192.168.1.12 → 10.6.15.156  SSH 134 Client: Encrypted packet (len=68)
  359 11.561832317  10.6.15.156 → 192.168.1.12 SSH 238 Server: Encrypted packet (len=172)
  360 11.604700670 192.168.1.12 → 10.6.15.156  TCP 66 54766 → 22 [ACK] Seq=4769 Ack=57653 Win=6155 Len=0 TSval=8225922 TSecr=15157411
  361 11.664222868  10.6.15.156 → 192.168.1.12 SSH 238 Server: Encrypted packet (len=172)
  362 11.664305431 192.168.1.12 → 10.6.15.156  TCP 66 54766 → 22 [ACK] Seq=4769 Ack=57825 Win=6155 Len=0 TSval=8225936 TSecr=15157437
  363 12.335182906  10.6.15.156 → 192.168.1.12 SSH 182 Server: Encrypted packet (len=116)
  364 12.335212251 192.168.1.12 → 10.6.15.156  TCP 66 54766 → 22 [ACK] Seq=4769 Ack=57941 Win=6155 Len=0 TSval=8226104 TSecr=15157605
  365 12.404359397  10.6.15.156 → 192.168.1.12 SSH 182 Server: Encrypted packet (len=116)
  366 12.404373204 192.168.1.12 → 10.6.15.156  TCP 66 54766 → 22 [ACK] Seq=4769 Ack=58057 Win=6155 Len=0 TSval=8226121 TSecr=15157623
  367 12.440615120  10.6.15.156 → 192.168.1.12 SSH 138 Server: Encrypted packet (len=72)
  368 12.440631351 192.168.1.12 → 10.6.15.156  TCP 66 54766 → 22 [ACK] Seq=4769 Ack=58129 Win=6155 Len=0 TSval=8226130 TSecr=15157632
  369 12.440837858 192.168.1.12 → 10.6.15.156  SSH 102 Client: Encrypted packet (len=36)
  370 12.461858991  10.6.15.156 → 192.168.1.12 SSH 182 Server: Encrypted packet (len=116)
  371 12.504702167 192.168.1.12 → 10.6.15.156  TCP 66 54766 → 22 [ACK] Seq=4805 Ack=58245 Win=6155 Len=0 TSval=8226147 TSecr=15157637
  372 12.565132819  10.6.15.156 → 192.168.1.12 SSH 270 Server: Encrypted packet (len=204)
  373 12.565155626 192.168.1.12 → 10.6.15.156  TCP 66 54766 → 22 [ACK] Seq=4805 Ack=58449 Win=6155 Len=0 TSval=8226162 TSecr=15157663
  374 12.786197149  10.6.15.156 → 192.168.1.12 SSH 374 Server: Encrypted packet (len=308)
  375 12.786223288 192.168.1.12 → 10.6.15.156  TCP 66 54766 → 22 [ACK] Seq=4805 Ack=58757 Win=6155 Len=0 TSval=8226217 TSecr=15157718
  376 12.855597719  10.6.15.156 → 192.168.1.12 SSH 334 Server: Encrypted packet (len=268)
  377 12.855615310 192.168.1.12 → 10.6.15.156  TCP 66 54766 → 22 [ACK] Seq=4805 Ack=59025 Win=6155 Len=0 TSval=8226234 TSecr=15157735
  378 12.913088184  10.6.15.156 → 192.168.1.12 SSH 334 Server: Encrypted packet (len=268)
  379 12.913106743 192.168.1.12 → 10.6.15.156  TCP 66 54766 → 22 [ACK] Seq=4805 Ack=59293 Win=6155 Len=0 TSval=8226249 TSecr=15157750
  380 12.933127173 192.168.1.12 → 10.6.15.156  SSH 102 Client: Encrypted packet (len=36)
  381 12.972392385  10.6.15.156 → 192.168.1.12 TCP 66 22 → 54766 [ACK] Seq=59293 Ack=4841 Win=1452 Len=0 TSval=15157765 TSecr=8226254
  382 12.972413107 192.168.1.12 → 10.6.15.156  SSH 434 Client: Encrypted packet (len=368)
  383 12.974190446  10.6.15.156 → 192.168.1.12 TCP 66 22 → 54766 [ACK] Seq=59293 Ack=5209 Win=1452 Len=0 TSval=15157765 TSecr=8226263
  384 13.005080793  10.6.15.156 → 192.168.1.12 SSH 138 Server: Encrypted packet (len=72)
  385 13.005102759  10.6.15.156 → 192.168.1.12 SSH 138 Server: Encrypted packet (len=72)
  386 13.005174716 192.168.1.12 → 10.6.15.156  TCP 66 54766 → 22 [ACK] Seq=5209 Ack=59437 Win=6155 Len=0 TSval=8226272 TSecr=15157773
  387 13.005427622 192.168.1.12 → 10.6.15.156  SSH 102 Client: Encrypted packet (len=36)
  388 13.010529313 192.168.1.12 → 123.108.200.124 NTP 90 NTP Version 4, client
  389 13.015752008  10.6.15.156 → 192.168.1.12 SSH 238 Server: Encrypted packet (len=172)
  390 13.021654368  10.6.15.156 → 192.168.1.12 SSH 138 Server: Encrypted packet (len=72)
  391 13.021677187  10.6.15.156 → 192.168.1.12 SSH 138 Server: Encrypted packet (len=72)
  392 13.021741820 192.168.1.12 → 10.6.15.156  TCP 66 54766 → 22 [ACK] Seq=5245 Ack=59753 Win=6155 Len=0 TSval=8226276 TSecr=15157775
  393 13.021983389 192.168.1.12 → 10.6.15.156  SSH 138 Client: Encrypted packet (len=72)
  394 13.023245580  10.6.15.156 → 192.168.1.12 SSH 282 Server: Encrypted packet (len=216)
  395 13.060393876  10.6.15.156 → 192.168.1.12 TCP 66 22 → 54766 [ACK] Seq=59969 Ack=5317 Win=1452 Len=0 TSval=15157787 TSecr=8226276
  396 13.060414835 192.168.1.12 → 10.6.15.156  SSH 174 Client: Encrypted packet (len=108)
  397 13.062096123  10.6.15.156 → 192.168.1.12 TCP 66 22 → 54766 [ACK] Seq=59969 Ack=5425 Win=1452 Len=0 TSval=15157787 TSecr=8226285
  398 13.216339886  10.6.15.156 → 192.168.1.12 SSH 110 Server: Encrypted packet (len=44)
  399 13.216690544 192.168.1.12 → 10.6.15.156  SSH 150 Client: Encrypted packet (len=84)
  400 13.218311256  10.6.15.156 → 192.168.1.12 TCP 66 22 → 54766 [ACK] Seq=60013 Ack=5509 Win=1452 Len=0 TSval=15157826 TSecr=8226325
  401 13.306586116  10.6.15.156 → 192.168.1.12 SSH 182 Server: Encrypted packet (len=116)
  402 13.348704455 192.168.1.12 → 10.6.15.156  TCP 66 54766 → 22 [ACK] Seq=5509 Ack=60129 Win=6155 Len=0 TSval=8226358 TSecr=15157848
  403 13.364126952  10.6.15.156 → 192.168.1.12 SSH 222 Server: Encrypted packet (len=156)
  404 13.364152425 192.168.1.12 → 10.6.15.156  TCP 66 54766 → 22 [ACK] Seq=5509 Ack=60285 Win=6155 Len=0 TSval=8226361 TSecr=15157862
  405 13.432566435  10.6.15.156 → 192.168.1.12 SSH 150 Server: Encrypted packet (len=84)
  406 13.432585381 192.168.1.12 → 10.6.15.156  TCP 66 54766 → 22 [ACK] Seq=5509 Ack=60369 Win=6155 Len=0 TSval=8226378 TSecr=15157880
  407 13.466858744  10.6.15.156 → 192.168.1.12 SSH 222 Server: Encrypted packet (len=156)
  408 13.466888270 192.168.1.12 → 10.6.15.156  TCP 66 54766 → 22 [ACK] Seq=5509 Ack=60525 Win=6155 Len=0 TSval=8226387 TSecr=15157888
  409 13.688034843  10.6.15.156 → 192.168.1.12 SSH 238 Server: Encrypted packet (len=172)
  410 13.688052467 192.168.1.12 → 10.6.15.156  TCP 66 54766 → 22 [ACK] Seq=5509 Ack=60697 Win=6155 Len=0 TSval=8226442 TSecr=15157943
  411 13.757468820  10.6.15.156 → 192.168.1.12 SSH 182 Server: Encrypted packet (len=116)
  412 13.757486291 192.168.1.12 → 10.6.15.156  TCP 66 54766 → 22 [ACK] Seq=5509 Ack=60813 Win=6155 Len=0 TSval=8226460 TSecr=15157961
  413 13.917658773  10.6.15.156 → 192.168.1.12 SSH 182 Server: Encrypted packet (len=116)
  414 13.917677349 192.168.1.12 → 10.6.15.156  TCP 66 54766 → 22 [ACK] Seq=5509 Ack=60929 Win=6155 Len=0 TSval=8226500 TSecr=15158001
  415 14.139009636  10.6.15.156 → 192.168.1.12 SSH 222 Server: Encrypted packet (len=156)
  416 14.139027734 192.168.1.12 → 10.6.15.156  TCP 66 54766 → 22 [ACK] Seq=5509 Ack=61085 Win=6155 Len=0 TSval=8226555 TSecr=15158056
  417 14.210234690  10.6.15.156 → 192.168.1.12 SSH 270 Server: Encrypted packet (len=204)
  418 14.210251038 192.168.1.12 → 10.6.15.156  TCP 66 54766 → 22 [ACK] Seq=5509 Ack=61289 Win=6155 Len=0 TSval=8226573 TSecr=15158074
  419 14.266413342  10.6.15.156 → 192.168.1.12 SSH 270 Server: Encrypted packet (len=204)
  420 14.266432030 192.168.1.12 → 10.6.15.156  TCP 66 54766 → 22 [ACK] Seq=5509 Ack=61493 Win=6155 Len=0 TSval=8226587 TSecr=15158088
  421 14.368744330  10.6.15.156 → 192.168.1.12 SSH 230 Server: Encrypted packet (len=164)
  422 14.368762109 192.168.1.12 → 10.6.15.156  TCP 66 54766 → 22 [ACK] Seq=5509 Ack=61657 Win=6155 Len=0 TSval=8226613 TSecr=15158114
  423 14.562972864  10.6.15.156 → 192.168.1.12 SSH 190 Server: Encrypted packet (len=124)
  424 14.562991376 192.168.1.12 → 10.6.15.156  TCP 66 54766 → 22 [ACK] Seq=5509 Ack=61781 Win=6155 Len=0 TSval=8226661 TSecr=15158162
  425 14.819963864  10.6.15.156 → 192.168.1.12 SSH 182 Server: Encrypted packet (len=116)
  426 14.819981608 192.168.1.12 → 10.6.15.156  TCP 66 54766 → 22 [ACK] Seq=5509 Ack=61897 Win=6155 Len=0 TSval=8226725 TSecr=15158226
  427 15.043420506  10.6.15.156 → 192.168.1.12 SSH 206 Server: Encrypted packet (len=140)
  428 15.043438212 192.168.1.12 → 10.6.15.156  TCP 66 54766 → 22 [ACK] Seq=5509 Ack=62037 Win=6155 Len=0 TSval=8226781 TSecr=15158282
  429 15.110369905  10.6.15.156 → 192.168.1.12 SSH 206 Server: Encrypted packet (len=140)
  430 15.110386613 192.168.1.12 → 10.6.15.156  TCP 66 54766 → 22 [ACK] Seq=5509 Ack=62177 Win=6155 Len=0 TSval=8226798 TSecr=15158299
  431 15.167947716  10.6.15.156 → 192.168.1.12 SSH 206 Server: Encrypted packet (len=140)
  432 15.167967918 192.168.1.12 → 10.6.15.156  TCP 66 54766 → 22 [ACK] Seq=5509 Ack=62317 Win=6155 Len=0 TSval=8226812 TSecr=15158313
  433 15.270651818  10.6.15.156 → 192.168.1.12 SSH 182 Server: Encrypted packet (len=116)
  434 15.270667100 192.168.1.12 → 10.6.15.156  TCP 66 54766 → 22 [ACK] Seq=5509 Ack=62433 Win=6155 Len=0 TSval=8226838 TSecr=15158339
  435 15.476471267  10.6.15.156 → 192.168.1.12 SSH 150 Server: Encrypted packet (len=84)
  436 15.476488023 192.168.1.12 → 10.6.15.156  TCP 66 54766 → 22 [ACK] Seq=5509 Ack=62517 Win=6155 Len=0 TSval=8226889 TSecr=15158391
  437 15.476817614 192.168.1.12 → 10.6.15.156  SSH 150 Client: Encrypted packet (len=84)
  438 15.478377679  10.6.15.156 → 192.168.1.12 TCP 66 22 → 54766 [ACK] Seq=62517 Ack=5593 Win=1452 Len=0 TSval=15158391 TSecr=8226890
  439 15.478742102  10.6.15.156 → 192.168.1.12 SSH 150 Server: Encrypted packet (len=84)
  440 15.479020220 192.168.1.12 → 10.6.15.156  SSH 150 Client: Encrypted packet (len=84)
  441 15.492239229  10.6.15.156 → 192.168.1.12 SSH 270 Server: Encrypted packet (len=204)
  442 15.532704984 192.168.1.12 → 10.6.15.156  TCP 66 54766 → 22 [ACK] Seq=5677 Ack=62805 Win=6155 Len=0 TSval=8226904 TSecr=15158394
  443 15.561494741  10.6.15.156 → 192.168.1.12 SSH 254 Server: Encrypted packet (len=188)
  444 15.561524942 192.168.1.12 → 10.6.15.156  TCP 66 54766 → 22 [ACK] Seq=5677 Ack=62993 Win=6155 Len=0 TSval=8226911 TSecr=15158412
  445 15.619310184  10.6.15.156 → 192.168.1.12 SSH 302 Server: Encrypted packet (len=236)
  446 15.619326987 192.168.1.12 → 10.6.15.156  TCP 66 54766 → 22 [ACK] Seq=5677 Ack=63229 Win=6155 Len=0 TSval=8226925 TSecr=15158426
  447 15.721858452  10.6.15.156 → 192.168.1.12 SSH 302 Server: Encrypted packet (len=236)
  448 15.721883872 192.168.1.12 → 10.6.15.156  TCP 66 54766 → 22 [ACK] Seq=5677 Ack=63465 Win=6155 Len=0 TSval=8226951 TSecr=15158452
  449 15.943802336  10.6.15.156 → 192.168.1.12 SSH 254 Server: Encrypted packet (len=188)
  450 15.943818473 192.168.1.12 → 10.6.15.156  TCP 66 54766 → 22 [ACK] Seq=5677 Ack=63653 Win=6155 Len=0 TSval=8227006 TSecr=15158507
  451 16.012549944  10.6.15.156 → 192.168.1.12 SSH 254 Server: Encrypted packet (len=188)
  452 16.012566573 192.168.1.12 → 10.6.15.156  TCP 66 54766 → 22 [ACK] Seq=5677 Ack=63841 Win=6155 Len=0 TSval=8227023 TSecr=15158525
  453 16.070086336  10.6.15.156 → 192.168.1.12 SSH 182 Server: Encrypted packet (len=116)
  454 16.070101721 192.168.1.12 → 10.6.15.156  TCP 66 54766 → 22 [ACK] Seq=5677 Ack=63957 Win=6155 Len=0 TSval=8227038 TSecr=15158539
  455 16.172920783  10.6.15.156 → 192.168.1.12 SSH 182 Server: Encrypted packet (len=116)
  456 16.172939252 192.168.1.12 → 10.6.15.156  TCP 66 54766 → 22 [ACK] Seq=5677 Ack=64073 Win=6155 Len=0 TSval=8227064 TSecr=15158565
  457 16.394265911  10.6.15.156 → 192.168.1.12 SSH 302 Server: Encrypted packet (len=236)
  458 16.394283490 192.168.1.12 → 10.6.15.156  TCP 66 54766 → 22 [ACK] Seq=5677 Ack=64309 Win=6155 Len=0 TSval=8227119 TSecr=15158620
  459 16.464398795  10.6.15.156 → 192.168.1.12 SSH 286 Server: Encrypted packet (len=220)
  460 16.464417435 192.168.1.12 → 10.6.15.156  TCP 66 54766 → 22 [ACK] Seq=5677 Ack=64529 Win=6155 Len=0 TSval=8227136 TSecr=15158637
  461 16.521812293  10.6.15.156 → 192.168.1.12 SSH 326 Server: Encrypted packet (len=260)
  462 16.521829913 192.168.1.12 → 10.6.15.156  TCP 66 54766 → 22 [ACK] Seq=5677 Ack=64789 Win=6155 Len=0 TSval=8227151 TSecr=15158652
  463 16.624302890  10.6.15.156 → 192.168.1.12 SSH 326 Server: Encrypted packet (len=260)
  464 16.624320013 192.168.1.12 → 10.6.15.156  TCP 66 54766 → 22 [ACK] Seq=5677 Ack=65049 Win=6155 Len=0 TSval=8227176 TSecr=15158678
  465 16.845269874  10.6.15.156 → 192.168.1.12 SSH 358 Server: Encrypted packet (len=292)
  466 16.845288084 192.168.1.12 → 10.6.15.156  TCP 66 54766 → 22 [ACK] Seq=5677 Ack=65341 Win=6155 Len=0 TSval=8227232 TSecr=15158733
  467 16.914649211  10.6.15.156 → 192.168.1.12 SSH 374 Server: Encrypted packet (len=308)
  468 16.914665203 192.168.1.12 → 10.6.15.156  TCP 66 54766 → 22 [ACK] Seq=5677 Ack=65649 Win=6155 Len=0 TSval=8227249 TSecr=15158750
  469 16.972437935  10.6.15.156 → 192.168.1.12 SSH 406 Server: Encrypted packet (len=340)
  470 16.972456897 192.168.1.12 → 10.6.15.156  TCP 66 54766 → 22 [ACK] Seq=5677 Ack=65989 Win=6155 Len=0 TSval=8227263 TSecr=15158765
  471 17.077531323  10.6.15.156 → 192.168.1.12 SSH 470 Server: Encrypted packet (len=404)
  472 17.077547728 192.168.1.12 → 10.6.15.156  TCP 66 54766 → 22 [ACK] Seq=5677 Ack=66393 Win=6155 Len=0 TSval=8227290 TSecr=15158790
  473 17.296605046  10.6.15.156 → 192.168.1.12 SSH 198 Server: Encrypted packet (len=132)
  474 17.296623479 192.168.1.12 → 10.6.15.156  TCP 66 54766 → 22 [ACK] Seq=5677 Ack=66525 Win=6155 Len=0 TSval=8227344 TSecr=15158845
  475 17.367260269  10.6.15.156 → 192.168.1.12 SSH 406 Server: Encrypted packet (len=340)
  476 17.367287178 192.168.1.12 → 10.6.15.156  TCP 66 54766 → 22 [ACK] Seq=5677 Ack=66865 Win=6155 Len=0 TSval=8227362 TSecr=15158863
  477 17.423143749  10.6.15.156 → 192.168.1.12 SSH 334 Server: Encrypted packet (len=268)
  478 17.423160833 192.168.1.12 → 10.6.15.156  TCP 66 54766 → 22 [ACK] Seq=5677 Ack=67133 Win=6155 Len=0 TSval=8227376 TSecr=15158877
  479 17.525959758  10.6.15.156 → 192.168.1.12 SSH 270 Server: Encrypted packet (len=204)
  480 17.525977784 192.168.1.12 → 10.6.15.156  TCP 66 54766 → 22 [ACK] Seq=5677 Ack=67337 Win=6155 Len=0 TSval=8227402 TSecr=15158903
  481 17.612674563 192.168.1.12 → 216.58.199.131 TCP 66 40290 → 443 [ACK] Seq=1 Ack=1 Win=237 Len=0 TSval=8227424 TSecr=2652191908
  482 17.651116222 216.58.199.131 → 192.168.1.12 TCP 66 [TCP ACKed unseen segment] 443 → 40290 [ACK] Seq=1 Ack=2 Win=175 Len=0 TSval=2652236950 TSecr=8193060
  483 17.747089990  10.6.15.156 → 192.168.1.12 SSH 302 Server: Encrypted packet (len=236)
  484 17.747106407 192.168.1.12 → 10.6.15.156  TCP 66 54766 → 22 [ACK] Seq=5677 Ack=67573 Win=6155 Len=0 TSval=8227457 TSecr=15158958
  485 17.816644622  10.6.15.156 → 192.168.1.12 SSH 238 Server: Encrypted packet (len=172)
  486 17.816664217 192.168.1.12 → 10.6.15.156  TCP 66 54766 → 22 [ACK] Seq=5677 Ack=67745 Win=6155 Len=0 TSval=8227474 TSecr=15158976
  487 17.874183939  10.6.15.156 → 192.168.1.12 SSH 238 Server: Encrypted packet (len=172)
  488 17.874203234 192.168.1.12 → 10.6.15.156  TCP 66 54766 → 22 [ACK] Seq=5677 Ack=67917 Win=6155 Len=0 TSval=8227489 TSecr=15158990
  489 17.976744836  10.6.15.156 → 192.168.1.12 SSH 238 Server: Encrypted packet (len=172)
  490 17.976762222 192.168.1.12 → 10.6.15.156  TCP 66 54766 → 22 [ACK] Seq=5677 Ack=68089 Win=6155 Len=0 TSval=8227515 TSecr=15159016
  491 18.197993214  10.6.15.156 → 192.168.1.12 SSH 270 Server: Encrypted packet (len=204)
  492 18.198010699 192.168.1.12 → 10.6.15.156  TCP 66 54766 → 22 [ACK] Seq=5677 Ack=68293 Win=6155 Len=0 TSval=8227570 TSecr=15159071
  493 18.268759442  10.6.15.156 → 192.168.1.12 SSH 182 Server: Encrypted packet (len=116)
  494 18.268774866 192.168.1.12 → 10.6.15.156  TCP 66 54766 → 22 [ACK] Seq=5677 Ack=68409 Win=6155 Len=0 TSval=8227588 TSecr=15159088
  495 18.324954242  10.6.15.156 → 192.168.1.12 SSH 182 Server: Encrypted packet (len=116)
  496 18.324967942 192.168.1.12 → 10.6.15.156  TCP 66 54766 → 22 [ACK] Seq=5677 Ack=68525 Win=6155 Len=0 TSval=8227602 TSecr=15159103
  497 18.427882754  10.6.15.156 → 192.168.1.12 SSH 270 Server: Encrypted packet (len=204)
  498 18.427900072 192.168.1.12 → 10.6.15.156  TCP 66 54766 → 22 [ACK] Seq=5677 Ack=68729 Win=6155 Len=0 TSval=8227627 TSecr=15159128
  499 18.649202869  10.6.15.156 → 192.168.1.12 SSH 334 Server: Encrypted packet (len=268)
  500 18.649221010 192.168.1.12 → 10.6.15.156  TCP 66 54766 → 22 [ACK] Seq=5677 Ack=68997 Win=6155 Len=0 TSval=8227683 TSecr=15159184
  501 18.718414505  10.6.15.156 → 192.168.1.12 SSH 302 Server: Encrypted packet (len=236)
  502 18.718434024 192.168.1.12 → 10.6.15.156  TCP 66 54766 → 22 [ACK] Seq=5677 Ack=69233 Win=6155 Len=0 TSval=8227700 TSecr=15159201
  503 18.775891688  10.6.15.156 → 192.168.1.12 SSH 334 Server: Encrypted packet (len=268)
  504 18.775909560 192.168.1.12 → 10.6.15.156  TCP 66 54766 → 22 [ACK] Seq=5677 Ack=69501 Win=6155 Len=0 TSval=8227714 TSecr=15159215
  505 18.879446537  10.6.15.156 → 192.168.1.12 SSH 966 Server: Encrypted packet (len=900)
  506 18.879462452 192.168.1.12 → 10.6.15.156  TCP 66 54766 → 22 [ACK] Seq=5677 Ack=70401 Win=6155 Len=0 TSval=8227740 TSecr=15159241
  507 19.100655793  10.6.15.156 → 192.168.1.12 SSH 950 Server: Encrypted packet (len=884)
  508 19.100675488 192.168.1.12 → 10.6.15.156  TCP 66 54766 → 22 [ACK] Seq=5677 Ack=71285 Win=6155 Len=0 TSval=8227796 TSecr=15159297
  509 19.170224604  10.6.15.156 → 192.168.1.12 SSH 950 Server: Encrypted packet (len=884)
  510 19.170242263 192.168.1.12 → 10.6.15.156  TCP 66 54766 → 22 [ACK] Seq=5677 Ack=72169 Win=6155 Len=0 TSval=8227813 TSecr=15159314
  511 19.228135577  10.6.15.156 → 192.168.1.12 SSH 950 Server: Encrypted packet (len=884)
  512 19.228153423 192.168.1.12 → 10.6.15.156  TCP 66 54766 → 22 [ACK] Seq=5677 Ack=73053 Win=6155 Len=0 TSval=8227827 TSecr=15159328
  513 19.330249972  10.6.15.156 → 192.168.1.12 SSH 214 Server: Encrypted packet (len=148)
  514 19.330267365 192.168.1.12 → 10.6.15.156  TCP 66 54766 → 22 [ACK] Seq=5677 Ack=73201 Win=6155 Len=0 TSval=8227853 TSecr=15159354
  515 19.620454224  10.6.15.156 → 192.168.1.12 SSH 222 Server: Encrypted packet (len=156)
  516 19.620468723 192.168.1.12 → 10.6.15.156  TCP 66 54766 → 22 [ACK] Seq=5677 Ack=73357 Win=6155 Len=0 TSval=8227925 TSecr=15159427
  517 19.677957735  10.6.15.156 → 192.168.1.12 SSH 222 Server: Encrypted packet (len=156)
  518 19.677976170 192.168.1.12 → 10.6.15.156  TCP 66 54766 → 22 [ACK] Seq=5677 Ack=73513 Win=6155 Len=0 TSval=8227940 TSecr=15159441
  519 19.780748108  10.6.15.156 → 192.168.1.12 SSH 214 Server: Encrypted packet (len=148)
  520 19.780765681 192.168.1.12 → 10.6.15.156  TCP 66 54766 → 22 [ACK] Seq=5677 Ack=73661 Win=6155 Len=0 TSval=8227966 TSecr=15159467
  521 20.002118448  10.6.15.156 → 192.168.1.12 SSH 222 Server: Encrypted packet (len=156)
  522 20.002135859 192.168.1.12 → 10.6.15.156  TCP 66 54766 → 22 [ACK] Seq=5677 Ack=73817 Win=6155 Len=0 TSval=8228021 TSecr=15159522
  523 20.076268606  10.6.15.156 → 192.168.1.12 SSH 182 Server: Encrypted packet (len=116)
  524 20.076286006 192.168.1.12 → 10.6.15.156  TCP 66 54766 → 22 [ACK] Seq=5677 Ack=73933 Win=6155 Len=0 TSval=8228039 TSecr=15159539
  525 20.136475132  10.6.15.156 → 192.168.1.12 SSH 182 Server: Encrypted packet (len=116)
  526 20.136492734 192.168.1.12 → 10.6.15.156  TCP 66 54766 → 22 [ACK] Seq=5677 Ack=74049 Win=6155 Len=0 TSval=8228054 TSecr=15159554
  527 20.234470354  10.6.15.156 → 192.168.1.12 SSH 182 Server: Encrypted packet (len=116)
  528 20.234488597 192.168.1.12 → 10.6.15.156  TCP 66 54766 → 22 [ACK] Seq=5677 Ack=74165 Win=6155 Len=0 TSval=8228079 TSecr=15159579
  529 20.240286812  10.6.15.156 → 192.168.1.12 SSH 182 Server: [TCP Spurious Retransmission] , Encrypted packet (len=116)
  530 20.240307247 192.168.1.12 → 10.6.15.156  TCP 78 [TCP Dup ACK 528#1] 54766 → 22 [ACK] Seq=5677 Ack=74165 Win=6155 Len=0 TSval=8228080 TSecr=15159582 SLE=74049 SRE=74165
  531 20.452960581  10.6.15.156 → 192.168.1.12 SSH 182 Server: Encrypted packet (len=116)
  532 20.452979017 192.168.1.12 → 10.6.15.156  TCP 66 54766 → 22 [ACK] Seq=5677 Ack=74281 Win=6155 Len=0 TSval=8228134 TSecr=15159635
  533 20.522307532  10.6.15.156 → 192.168.1.12 SSH 222 Server: Encrypted packet (len=156)
  534 20.522325683 192.168.1.12 → 10.6.15.156  TCP 66 54766 → 22 [ACK] Seq=5677 Ack=74437 Win=6155 Len=0 TSval=8228151 TSecr=15159652
  535 20.580063146  10.6.15.156 → 192.168.1.12 SSH 182 Server: Encrypted packet (len=116)
  536 20.580081300 192.168.1.12 → 10.6.15.156  TCP 66 54766 → 22 [ACK] Seq=5677 Ack=74553 Win=6155 Len=0 TSval=8228165 TSecr=15159666
  537 20.682833369  10.6.15.156 → 192.168.1.12 SSH 342 Server: Encrypted packet (len=276)
  538 20.682852642 192.168.1.12 → 10.6.15.156  TCP 66 54766 → 22 [ACK] Seq=5677 Ack=74829 Win=6155 Len=0 TSval=8228191 TSecr=15159692
  539 20.904387015  10.6.15.156 → 192.168.1.12 SSH 422 Server: Encrypted packet (len=356)
  540 20.904405018 192.168.1.12 → 10.6.15.156  TCP 66 54766 → 22 [ACK] Seq=5677 Ack=75185 Win=6155 Len=0 TSval=8228246 TSecr=15159748
  541 20.973632979  10.6.15.156 → 192.168.1.12 SSH 422 Server: Encrypted packet (len=356)
  542 20.973651660 192.168.1.12 → 10.6.15.156  TCP 66 54766 → 22 [ACK] Seq=5677 Ack=75541 Win=6155 Len=0 TSval=8228264 TSecr=15159765
  543 21.031363860  10.6.15.156 → 192.168.1.12 SSH 454 Server: Encrypted packet (len=388)
  544 21.031382536 192.168.1.12 → 10.6.15.156  TCP 66 54766 → 22 [ACK] Seq=5677 Ack=75929 Win=6155 Len=0 TSval=8228278 TSecr=15159779
  545 21.138256184  10.6.15.156 → 192.168.1.12 SSH 302 Server: Encrypted packet (len=236)
  546 21.138275146 192.168.1.12 → 10.6.15.156  TCP 66 54766 → 22 [ACK] Seq=5677 Ack=76165 Win=6155 Len=0 TSval=8228305 TSecr=15159805
  547 21.355106017  10.6.15.156 → 192.168.1.12 SSH 206 Server: Encrypted packet (len=140)
  548 21.355121931 192.168.1.12 → 10.6.15.156  TCP 66 54766 → 22 [ACK] Seq=5677 Ack=76305 Win=6155 Len=0 TSval=8228359 TSecr=15159860
  549 21.424402926  10.6.15.156 → 192.168.1.12 SSH 182 Server: Encrypted packet (len=116)
  550 21.424418767 192.168.1.12 → 10.6.15.156  TCP 66 54766 → 22 [ACK] Seq=5677 Ack=76421 Win=6155 Len=0 TSval=8228376 TSecr=15159878
  551 21.806112156  10.6.15.156 → 192.168.1.12 SSH 182 Server: Encrypted packet (len=116)
  552 21.806128913 192.168.1.12 → 10.6.15.156  TCP 66 54766 → 22 [ACK] Seq=5677 Ack=76537 Win=6155 Len=0 TSval=8228472 TSecr=15159973
  553 22.035581861  10.6.15.156 → 192.168.1.12 SSH 182 Server: Encrypted packet (len=116)
  554 22.035599571 192.168.1.12 → 10.6.15.156  TCP 66 54766 → 22 [ACK] Seq=5677 Ack=76653 Win=6155 Len=0 TSval=8228529 TSecr=15160030
  555 22.257031035  10.6.15.156 → 192.168.1.12 SSH 198 Server: Encrypted packet (len=132)
  556 22.257047991 192.168.1.12 → 10.6.15.156  TCP 66 54766 → 22 [ACK] Seq=5677 Ack=76785 Win=6155 Len=0 TSval=8228585 TSecr=15160086
  557 22.326595816  10.6.15.156 → 192.168.1.12 SSH 238 Server: Encrypted packet (len=172)
  558 22.326614595 192.168.1.12 → 10.6.15.156  TCP 66 54766 → 22 [ACK] Seq=5677 Ack=76957 Win=6155 Len=0 TSval=8228602 TSecr=15160103
  559 22.384857283  10.6.15.156 → 192.168.1.12 SSH 238 Server: Encrypted packet (len=172)
  560 22.384876386 192.168.1.12 → 10.6.15.156  TCP 66 54766 → 22 [ACK] Seq=5677 Ack=77129 Win=6155 Len=0 TSval=8228617 TSecr=15160118
  561 22.487187204  10.6.15.156 → 192.168.1.12 SSH 198 Server: Encrypted packet (len=132)
  562 22.487205119 192.168.1.12 → 10.6.15.156  TCP 66 54766 → 22 [ACK] Seq=5677 Ack=77261 Win=6155 Len=0 TSval=8228642 TSecr=15160143
  563 22.540241760  10.6.15.156 → 192.168.1.12 SSH 102 Server: Encrypted packet (len=36)
  564 22.540259423 192.168.1.12 → 10.6.15.156  TCP 66 54766 → 22 [ACK] Seq=5677 Ack=77297 Win=6155 Len=0 TSval=8228655 TSecr=15160157
  565 22.540535953 192.168.1.12 → 10.6.15.156  SSH 138 Client: Encrypted packet (len=72)
  566 22.542361125  10.6.15.156 → 192.168.1.12 SSH 102 Server: Encrypted packet (len=36)
  567 22.584680706 192.168.1.12 → 10.6.15.156  TCP 66 54766 → 22 [ACK] Seq=5749 Ack=77333 Win=6155 Len=0 TSval=8228667 TSecr=15160157
  568 22.668857503  10.6.15.156 → 192.168.1.12 SSH 150 Server: Encrypted packet (len=84)
  569 22.668882931 192.168.1.12 → 10.6.15.156  TCP 66 54766 → 22 [ACK] Seq=5749 Ack=77417 Win=6155 Len=0 TSval=8228688 TSecr=15160189
  570 22.669171032 192.168.1.12 → 10.6.15.156  SSH 150 Client: Encrypted packet (len=84)
  571 22.709407807  10.6.15.156 → 192.168.1.12 TCP 66 22 → 54766 [ACK] Seq=77417 Ack=5833 Win=1452 Len=0 TSval=15160199 TSecr=8228688
  572 22.709815142  10.6.15.156 → 192.168.1.12 SSH 150 Server: Encrypted packet (len=84)
  573 22.710131725 192.168.1.12 → 10.6.15.156  SSH 150 Client: Encrypted packet (len=84)
  574 22.711722983  10.6.15.156 → 192.168.1.12 TCP 66 22 → 54766 [ACK] Seq=77501 Ack=5917 Win=1452 Len=0 TSval=15160199 TSecr=8228698
  575 22.777575183  10.6.15.156 → 192.168.1.12 SSH 254 Server: Encrypted packet (len=188)
  576 22.820678069 192.168.1.12 → 10.6.15.156  TCP 66 54766 → 22 [ACK] Seq=5917 Ack=77689 Win=6155 Len=0 TSval=8228726 TSecr=15160216
  577 22.835153396  10.6.15.156 → 192.168.1.12 SSH 318 Server: Encrypted packet (len=252)
  578 22.835178495 192.168.1.12 → 10.6.15.156  TCP 66 54766 → 22 [ACK] Seq=5917 Ack=77941 Win=6155 Len=0 TSval=8228729 TSecr=15160230
  579 22.937877140  10.6.15.156 → 192.168.1.12 SSH 390 Server: Encrypted packet (len=324)
  580 22.937902088 192.168.1.12 → 10.6.15.156  TCP 66 54766 → 22 [ACK] Seq=5917 Ack=78265 Win=6155 Len=0 TSval=8228755 TSecr=15160256
  581 23.159446311  10.6.15.156 → 192.168.1.12 SSH 518 Server: Encrypted packet (len=452)
  582 23.159462481 192.168.1.12 → 10.6.15.156  TCP 66 54766 → 22 [ACK] Seq=5917 Ack=78717 Win=6155 Len=0 TSval=8228810 TSecr=15160311
  583 23.228770583  10.6.15.156 → 192.168.1.12 SSH 422 Server: Encrypted packet (len=356)
  584 23.228787774 192.168.1.12 → 10.6.15.156  TCP 66 54766 → 22 [ACK] Seq=5917 Ack=79073 Win=6155 Len=0 TSval=8228828 TSecr=15160329
  585 23.286426709  10.6.15.156 → 192.168.1.12 SSH 358 Server: Encrypted packet (len=292)
  586 23.286444401 192.168.1.12 → 10.6.15.156  TCP 66 54766 → 22 [ACK] Seq=5917 Ack=79365 Win=6155 Len=0 TSval=8228842 TSecr=15160343
  587 23.388870217  10.6.15.156 → 192.168.1.12 SSH 270 Server: Encrypted packet (len=204)
  588 23.388886588 192.168.1.12 → 10.6.15.156  TCP 66 54766 → 22 [ACK] Seq=5917 Ack=79569 Win=6155 Len=0 TSval=8228868 TSecr=15160369
  589 23.609961424  10.6.15.156 → 192.168.1.12 SSH 182 Server: Encrypted packet (len=116)
  590 23.609986777 192.168.1.12 → 10.6.15.156  TCP 66 54766 → 22 [ACK] Seq=5917 Ack=79685 Win=6155 Len=0 TSval=8228923 TSecr=15160424
  591 23.679328374  10.6.15.156 → 192.168.1.12 SSH 182 Server: Encrypted packet (len=116)
  592 23.679348103 192.168.1.12 → 10.6.15.156  TCP 66 54766 → 22 [ACK] Seq=5917 Ack=79801 Win=6155 Len=0 TSval=8228940 TSecr=15160441
  593 23.736928137  10.6.15.156 → 192.168.1.12 SSH 198 Server: Encrypted packet (len=132)
  594 23.736946169 192.168.1.12 → 10.6.15.156  TCP 66 54766 → 22 [ACK] Seq=5917 Ack=79933 Win=6155 Len=0 TSval=8228955 TSecr=15160456
  595 23.839584286  10.6.15.156 → 192.168.1.12 SSH 198 Server: Encrypted packet (len=132)
  596 23.839600997 192.168.1.12 → 10.6.15.156  TCP 66 54766 → 22 [ACK] Seq=5917 Ack=80065 Win=6155 Len=0 TSval=8228980 TSecr=15160481
  597 24.061125224  10.6.15.156 → 192.168.1.12 SSH 222 Server: Encrypted packet (len=156)
  598 24.061144969 192.168.1.12 → 10.6.15.156  TCP 66 54766 → 22 [ACK] Seq=5917 Ack=80221 Win=6155 Len=0 TSval=8229036 TSecr=15160537
  599 24.130468029  10.6.15.156 → 192.168.1.12 SSH 222 Server: Encrypted packet (len=156)
  600 24.130486560 192.168.1.12 → 10.6.15.156  TCP 66 54766 → 22 [ACK] Seq=5917 Ack=80377 Win=6155 Len=0 TSval=8229053 TSecr=15160554
  601 24.188192347  10.6.15.156 → 192.168.1.12 SSH 214 Server: Encrypted packet (len=148)
  602 24.188210312 192.168.1.12 → 10.6.15.156  TCP 66 54766 → 22 [ACK] Seq=5917 Ack=80525 Win=6155 Len=0 TSval=8229067 TSecr=15160569
  603 24.290659165  10.6.15.156 → 192.168.1.12 SSH 222 Server: Encrypted packet (len=156)
  604 24.290687851 192.168.1.12 → 10.6.15.156  TCP 66 54766 → 22 [ACK] Seq=5917 Ack=80681 Win=6155 Len=0 TSval=8229093 TSecr=15160594
  605 24.512351064  10.6.15.156 → 192.168.1.12 SSH 374 Server: Encrypted packet (len=308)
  606 24.512369979 192.168.1.12 → 10.6.15.156  TCP 66 54766 → 22 [ACK] Seq=5917 Ack=80989 Win=6155 Len=0 TSval=8229148 TSecr=15160650
  607 24.581645887  10.6.15.156 → 192.168.1.12 SSH 374 Server: Encrypted packet (len=308)
  608 24.581664904 192.168.1.12 → 10.6.15.156  TCP 66 54766 → 22 [ACK] Seq=5917 Ack=81297 Win=6155 Len=0 TSval=8229166 TSecr=15160667
  609 24.639188479  10.6.15.156 → 192.168.1.12 SSH 374 Server: Encrypted packet (len=308)
  610 24.639205773 192.168.1.12 → 10.6.15.156  TCP 66 54766 → 22 [ACK] Seq=5917 Ack=81605 Win=6155 Len=0 TSval=8229180 TSecr=15160681
  611 24.741876627  10.6.15.156 → 192.168.1.12 SSH 374 Server: Encrypted packet (len=308)
  612 24.741894916 192.168.1.12 → 10.6.15.156  TCP 66 54766 → 22 [ACK] Seq=5917 Ack=81913 Win=6155 Len=0 TSval=8229206 TSecr=15160707
  613 24.963409126  10.6.15.156 → 192.168.1.12 SSH 214 Server: Encrypted packet (len=148)
  614 24.963426166 192.168.1.12 → 10.6.15.156  TCP 66 54766 → 22 [ACK] Seq=5917 Ack=82061 Win=6155 Len=0 TSval=8229261 TSecr=15160762
  615 25.032394845  10.6.15.156 → 192.168.1.12 SSH 214 Server: Encrypted packet (len=148)
  616 25.032412840 192.168.1.12 → 10.6.15.156  TCP 66 54766 → 22 [ACK] Seq=5917 Ack=82209 Win=6155 Len=0 TSval=8229278 TSecr=15160780
  617 25.090123926  10.6.15.156 → 192.168.1.12 SSH 214 Server: Encrypted packet (len=148)
  618 25.090139998 192.168.1.12 → 10.6.15.156  TCP 66 54766 → 22 [ACK] Seq=5917 Ack=82357 Win=6155 Len=0 TSval=8229293 TSecr=15160794
  619 25.192867381  10.6.15.156 → 192.168.1.12 SSH 222 Server: Encrypted packet (len=156)
  620 25.192885335 192.168.1.12 → 10.6.15.156  TCP 66 54766 → 22 [ACK] Seq=5917 Ack=82513 Win=6155 Len=0 TSval=8229319 TSecr=15160820
  621 25.414403058  10.6.15.156 → 192.168.1.12 SSH 182 Server: Encrypted packet (len=116)
  622 25.414420574 192.168.1.12 → 10.6.15.156  TCP 66 54766 → 22 [ACK] Seq=5917 Ack=82629 Win=6155 Len=0 TSval=8229374 TSecr=15160875
  623 25.484194678  10.6.15.156 → 192.168.1.12 SSH 182 Server: Encrypted packet (len=116)
  624 25.484212347 192.168.1.12 → 10.6.15.156  TCP 66 54766 → 22 [ACK] Seq=5917 Ack=82745 Win=6155 Len=0 TSval=8229391 TSecr=15160893
  625 25.540959528  10.6.15.156 → 192.168.1.12 SSH 182 Server: Encrypted packet (len=116)
  626 25.540978386 192.168.1.12 → 10.6.15.156  TCP 66 54766 → 22 [ACK] Seq=5917 Ack=82861 Win=6155 Len=0 TSval=8229406 TSecr=15160907
  627 25.643742508  10.6.15.156 → 192.168.1.12 SSH 182 Server: Encrypted packet (len=116)
  628 25.643769630 192.168.1.12 → 10.6.15.156  TCP 66 54766 → 22 [ACK] Seq=5917 Ack=82977 Win=6155 Len=0 TSval=8229431 TSecr=15160932
  629 25.866347704  10.6.15.156 → 192.168.1.12 SSH 214 Server: Encrypted packet (len=148)
  630 25.866365885 192.168.1.12 → 10.6.15.156  TCP 66 54766 → 22 [ACK] Seq=5917 Ack=83125 Win=6155 Len=0 TSval=8229487 TSecr=15160988
  631 25.934478752  10.6.15.156 → 192.168.1.12 SSH 222 Server: Encrypted packet (len=156)
  632 25.934497084 192.168.1.12 → 10.6.15.156  TCP 66 54766 → 22 [ACK] Seq=5917 Ack=83281 Win=6155 Len=0 TSval=8229504 TSecr=15161005
  633 25.992035218  10.6.15.156 → 192.168.1.12 SSH 222 Server: Encrypted packet (len=156)
  634 25.992053073 192.168.1.12 → 10.6.15.156  TCP 66 54766 → 22 [ACK] Seq=5917 Ack=83437 Win=6155 Len=0 TSval=8229518 TSecr=15161019
  635 26.094763249  10.6.15.156 → 192.168.1.12 SSH 254 Server: Encrypted packet (len=188)
  636 26.094781477 192.168.1.12 → 10.6.15.156  TCP 66 54766 → 22 [ACK] Seq=5917 Ack=83625 Win=6155 Len=0 TSval=8229544 TSecr=15161045
  637 26.315966687  10.6.15.156 → 192.168.1.12 SSH 182 Server: Encrypted packet (len=116)
  638 26.315984690 192.168.1.12 → 10.6.15.156  TCP 66 54766 → 22 [ACK] Seq=5917 Ack=83741 Win=6155 Len=0 TSval=8229599 TSecr=15161100
  639 26.385408845  10.6.15.156 → 192.168.1.12 SSH 182 Server: Encrypted packet (len=116)
  640 26.385427376 192.168.1.12 → 10.6.15.156  TCP 66 54766 → 22 [ACK] Seq=5917 Ack=83857 Win=6155 Len=0 TSval=8229617 TSecr=15161118
  641 26.442908850  10.6.15.156 → 192.168.1.12 SSH 182 Server: Encrypted packet (len=116)
  642 26.442926571 192.168.1.12 → 10.6.15.156  TCP 66 54766 → 22 [ACK] Seq=5917 Ack=83973 Win=6155 Len=0 TSval=8229631 TSecr=15161132
  643 26.945479873 192.168.1.12 → 10.6.15.156  SSH 118 Client: Encrypted packet (len=52)
  644 26.947241169  10.6.15.156 → 192.168.1.12 TCP 66 22 → 54766 [ACK] Seq=83973 Ack=5969 Win=1452 Len=0 TSval=15161258 TSecr=8229757
  645 26.992781282  10.6.15.156 → 192.168.1.12 SSH 110 Server: Encrypted packet (len=44)
  646 26.992798835 192.168.1.12 → 10.6.15.156  TCP 66 54766 → 22 [ACK] Seq=5969 Ack=84017 Win=6155 Len=0 TSval=8229769 TSecr=15161270
  647 26.993221037 192.168.1.12 → 10.6.15.156  SSH 502 Client: Encrypted packet (len=436)
  648 26.994892605  10.6.15.156 → 192.168.1.12 TCP 66 22 → 54766 [ACK] Seq=84017 Ack=6405 Win=1452 Len=0 TSval=15161270 TSecr=8229769
  649 26.998469112  10.6.15.156 → 192.168.1.12 SSH 246 Server: Encrypted packet (len=180)
  650 26.998778845 192.168.1.12 → 10.6.15.156  SSH 142 Client: Encrypted packet (len=76)
  651 27.040206423  10.6.15.156 → 192.168.1.12 TCP 66 22 → 54766 [ACK] Seq=84197 Ack=6481 Win=1452 Len=0 TSval=15161282 TSecr=8229770
  652 27.040226694 192.168.1.12 → 10.6.15.156  SSH 562 Client: Encrypted packet (len=496)
  653 27.042232884  10.6.15.156 → 192.168.1.12 TCP 66 22 → 54766 [ACK] Seq=84197 Ack=6977 Win=1452 Len=0 TSval=15161282 TSecr=8229780
  654 27.044930948  10.6.15.156 → 192.168.1.12 SSH 174 Server: Encrypted packet (len=108)
  655 27.045250963 192.168.1.12 → 10.6.15.156  SSH 134 Client: Encrypted packet (len=68)
  656 27.046240806  10.6.15.156 → 192.168.1.12 SSH 278 Server: Encrypted packet (len=212)
  657 27.084185746  10.6.15.156 → 192.168.1.12 TCP 66 22 → 54766 [ACK] Seq=84517 Ack=7045 Win=1452 Len=0 TSval=15161293 TSecr=8229782
  658 27.084207891 192.168.1.12 → 10.6.15.156  SSH 134 Client: Encrypted packet (len=68)
  659 27.085743248  10.6.15.156 → 192.168.1.12 TCP 66 22 → 54766 [ACK] Seq=84517 Ack=7113 Win=1452 Len=0 TSval=15161293 TSecr=8229791
  660 27.218167851  10.6.15.156 → 192.168.1.12 SSH 302 Server: Encrypted packet (len=236)
  661 27.260650380 192.168.1.12 → 10.6.15.156  TCP 66 54766 → 22 [ACK] Seq=7113 Ack=84753 Win=6155 Len=0 TSval=8229836 TSecr=15161326
  662 27.288202454  10.6.15.156 → 192.168.1.12 SSH 270 Server: Encrypted packet (len=204)
  663 27.288220573 192.168.1.12 → 10.6.15.156  TCP 66 54766 → 22 [ACK] Seq=7113 Ack=84957 Win=6155 Len=0 TSval=8229842 TSecr=15161344
  664 27.345081225  10.6.15.156 → 192.168.1.12 SSH 334 Server: Encrypted packet (len=268)
  665 27.345104567 192.168.1.12 → 10.6.15.156  TCP 66 54766 → 22 [ACK] Seq=7113 Ack=85225 Win=6155 Len=0 TSval=8229857 TSecr=15161358
  666 27.447864610  10.6.15.156 → 192.168.1.12 SSH 334 Server: Encrypted packet (len=268)
  667 27.447883178 192.168.1.12 → 10.6.15.156  TCP 66 54766 → 22 [ACK] Seq=7113 Ack=85493 Win=6155 Len=0 TSval=8229882 TSecr=15161383
  668 27.668916622  10.6.15.156 → 192.168.1.12 SSH 182 Server: Encrypted packet (len=116)
  669 27.668941831 192.168.1.12 → 10.6.15.156  TCP 66 54766 → 22 [ACK] Seq=7113 Ack=85609 Win=6155 Len=0 TSval=8229938 TSecr=15161439
  670 27.738471359  10.6.15.156 → 192.168.1.12 SSH 198 Server: Encrypted packet (len=132)
  671 27.738488785 192.168.1.12 → 10.6.15.156  TCP 66 54766 → 22 [ACK] Seq=7113 Ack=85741 Win=6155 Len=0 TSval=8229955 TSecr=15161456
  672 28.120067509  10.6.15.156 → 192.168.1.12 SSH 198 Server: Encrypted packet (len=132)
  673 28.120086101 192.168.1.12 → 10.6.15.156  TCP 66 54766 → 22 [ACK] Seq=7113 Ack=85873 Win=6155 Len=0 TSval=8230050 TSecr=15161552
  674 28.189442727  10.6.15.156 → 192.168.1.12 SSH 198 Server: Encrypted packet (len=132)
  675 28.189460621 192.168.1.12 → 10.6.15.156  TCP 66 54766 → 22 [ACK] Seq=7113 Ack=86005 Win=6155 Len=0 TSval=8230068 TSecr=15161569
  676 28.247088825  10.6.15.156 → 192.168.1.12 SSH 198 Server: Encrypted packet (len=132)
  677 28.247107212 192.168.1.12 → 10.6.15.156  TCP 66 54766 → 22 [ACK] Seq=7113 Ack=86137 Win=6155 Len=0 TSval=8230082 TSecr=15161583
  678 28.349941784  10.6.15.156 → 192.168.1.12 SSH 334 Server: Encrypted packet (len=268)
  679 28.349959058 192.168.1.12 → 10.6.15.156  TCP 66 54766 → 22 [ACK] Seq=7113 Ack=86405 Win=6155 Len=0 TSval=8230108 TSecr=15161609
  680 28.571063083  10.6.15.156 → 192.168.1.12 SSH 334 Server: Encrypted packet (len=268)
  681 28.571082119 192.168.1.12 → 10.6.15.156  TCP 66 54766 → 22 [ACK] Seq=7113 Ack=86673 Win=6155 Len=0 TSval=8230163 TSecr=15161664
  682 28.640511964  10.6.15.156 → 192.168.1.12 SSH 334 Server: Encrypted packet (len=268)
  683 28.640529297 192.168.1.12 → 10.6.15.156  TCP 66 54766 → 22 [ACK] Seq=7113 Ack=86941 Win=6155 Len=0 TSval=8230180 TSecr=15161682
  684 28.698338956  10.6.15.156 → 192.168.1.12 SSH 406 Server: Encrypted packet (len=340)
  685 28.698357372 192.168.1.12 → 10.6.15.156  TCP 66 54766 → 22 [ACK] Seq=7113 Ack=87281 Win=6155 Len=0 TSval=8230195 TSecr=15161696
  686 28.800816232  10.6.15.156 → 192.168.1.12 SSH 270 Server: Encrypted packet (len=204)
  687 28.800834219 192.168.1.12 → 10.6.15.156  TCP 66 54766 → 22 [ACK] Seq=7113 Ack=87485 Win=6155 Len=0 TSval=8230221 TSecr=15161722
  688 29.010528452 192.168.1.12 → 139.59.21.22 NTP 90 NTP Version 4, client
  689 29.022020196  10.6.15.156 → 192.168.1.12 SSH 182 Server: Encrypted packet (len=116)
  690 29.022037933 192.168.1.12 → 10.6.15.156  TCP 66 54766 → 22 [ACK] Seq=7113 Ack=87601 Win=6155 Len=0 TSval=8230276 TSecr=15161777
  691 29.091177334  10.6.15.156 → 192.168.1.12 SSH 182 Server: Encrypted packet (len=116)
  692 29.091197573 192.168.1.12 → 10.6.15.156  TCP 66 54766 → 22 [ACK] Seq=7113 Ack=87717 Win=6155 Len=0 TSval=8230293 TSecr=15161794
  693 29.251922908  10.6.15.156 → 192.168.1.12 SSH 238 Server: Encrypted packet (len=172)
  694 29.251942576 192.168.1.12 → 10.6.15.156  TCP 66 54766 → 22 [ACK] Seq=7113 Ack=87889 Win=6155 Len=0 TSval=8230333 TSecr=15161834
  695 29.473082669  10.6.15.156 → 192.168.1.12 SSH 334 Server: Encrypted packet (len=268)
  696 29.473100291 192.168.1.12 → 10.6.15.156  TCP 66 54766 → 22 [ACK] Seq=7113 Ack=88157 Win=6155 Len=0 TSval=8230389 TSecr=15161890
  697 29.542778244  10.6.15.156 → 192.168.1.12 SSH 406 Server: Encrypted packet (len=340)
  698 29.542796127 192.168.1.12 → 10.6.15.156  TCP 66 54766 → 22 [ACK] Seq=7113 Ack=88497 Win=6155 Len=0 TSval=8230406 TSecr=15161907
  699 29.600258048  10.6.15.156 → 192.168.1.12 SSH 406 Server: Encrypted packet (len=340)
  700 29.600276739 192.168.1.12 → 10.6.15.156  TCP 66 54766 → 22 [ACK] Seq=7113 Ack=88837 Win=6155 Len=0 TSval=8230420 TSecr=15161922
  701 29.702771413  10.6.15.156 → 192.168.1.12 SSH 302 Server: Encrypted packet (len=236)
  702 29.702789857 192.168.1.12 → 10.6.15.156  TCP 66 54766 → 22 [ACK] Seq=7113 Ack=89073 Win=6155 Len=0 TSval=8230446 TSecr=15161947
  703 29.924190711  10.6.15.156 → 192.168.1.12 SSH 302 Server: Encrypted packet (len=236)
  704 29.924214145 192.168.1.12 → 10.6.15.156  TCP 66 54766 → 22 [ACK] Seq=7113 Ack=89309 Win=6155 Len=0 TSval=8230501 TSecr=15162003
  705 29.993846061  10.6.15.156 → 192.168.1.12 SSH 238 Server: Encrypted packet (len=172)
  706 29.993862714 192.168.1.12 → 10.6.15.156  TCP 66 54766 → 22 [ACK] Seq=7113 Ack=89481 Win=6155 Len=0 TSval=8230519 TSecr=15162020
  707 30.052691911  10.6.15.156 → 192.168.1.12 SSH 238 Server: Encrypted packet (len=172)
  708 30.052709703 192.168.1.12 → 10.6.15.156  TCP 66 54766 → 22 [ACK] Seq=7113 Ack=89653 Win=6155 Len=0 TSval=8230534 TSecr=15162034
  709 30.155719794  10.6.15.156 → 192.168.1.12 SSH 270 Server: Encrypted packet (len=204)
  710 30.155737926 192.168.1.12 → 10.6.15.156  TCP 66 54766 → 22 [ACK] Seq=7113 Ack=89857 Win=6155 Len=0 TSval=8230559 TSecr=15162060
  711 30.374984400  10.6.15.156 → 192.168.1.12 SSH 182 Server: Encrypted packet (len=116)
  712 30.375005348 192.168.1.12 → 10.6.15.156  TCP 66 54766 → 22 [ACK] Seq=7113 Ack=89973 Win=6155 Len=0 TSval=8230614 TSecr=15162115
  713 30.444596055  10.6.15.156 → 192.168.1.12 SSH 206 Server: Encrypted packet (len=140)
  714 30.444609445 192.168.1.12 → 10.6.15.156  TCP 66 54766 → 22 [ACK] Seq=7113 Ack=90113 Win=6155 Len=0 TSval=8230631 TSecr=15162133
  715 30.502287708  10.6.15.156 → 192.168.1.12 SSH 238 Server: Encrypted packet (len=172)
  716 30.502312690 192.168.1.12 → 10.6.15.156  TCP 66 54766 → 22 [ACK] Seq=7113 Ack=90285 Win=6155 Len=0 TSval=8230646 TSecr=15162147
  717 30.604723555  10.6.15.156 → 192.168.1.12 SSH 222 Server: Encrypted packet (len=156)
  718 30.604741731 192.168.1.12 → 10.6.15.156  TCP 66 54766 → 22 [ACK] Seq=7113 Ack=90441 Win=6155 Len=0 TSval=8230672 TSecr=15162173
  719 30.826302732  10.6.15.156 → 192.168.1.12 SSH 470 Server: Encrypted packet (len=404)
  720 30.826325617 192.168.1.12 → 10.6.15.156  TCP 66 54766 → 22 [ACK] Seq=7113 Ack=90845 Win=6155 Len=0 TSval=8230727 TSecr=15162228
  721 30.895647018  10.6.15.156 → 192.168.1.12 SSH 374 Server: Encrypted packet (len=308)
  722 30.895665166 192.168.1.12 → 10.6.15.156  TCP 66 54766 → 22 [ACK] Seq=7113 Ack=91153 Win=6155 Len=0 TSval=8230744 TSecr=15162245
  723 30.953195309  10.6.15.156 → 192.168.1.12 SSH 334 Server: Encrypted packet (len=268)
  724 30.953210614 192.168.1.12 → 10.6.15.156  TCP 66 54766 → 22 [ACK] Seq=7113 Ack=91421 Win=6155 Len=0 TSval=8230759 TSecr=15162260
  725 31.055998970  10.6.15.156 → 192.168.1.12 SSH 374 Server: Encrypted packet (len=308)
  726 31.056017753 192.168.1.12 → 10.6.15.156  TCP 66 54766 → 22 [ACK] Seq=7113 Ack=91729 Win=6155 Len=0 TSval=8230784 TSecr=15162285
  727 31.277097280  10.6.15.156 → 192.168.1.12 SSH 198 Server: Encrypted packet (len=132)
  728 31.277114836 192.168.1.12 → 10.6.15.156  TCP 66 54766 → 22 [ACK] Seq=7113 Ack=91861 Win=6155 Len=0 TSval=8230840 TSecr=15162341
  729 31.346467417  10.6.15.156 → 192.168.1.12 SSH 182 Server: Encrypted packet (len=116)
  730 31.346485484 192.168.1.12 → 10.6.15.156  TCP 66 54766 → 22 [ACK] Seq=7113 Ack=91977 Win=6155 Len=0 TSval=8230857 TSecr=15162358
  731 31.404104679  10.6.15.156 → 192.168.1.12 SSH 182 Server: Encrypted packet (len=116)
  732 31.404127425 192.168.1.12 → 10.6.15.156  TCP 66 54766 → 22 [ACK] Seq=7113 Ack=92093 Win=6155 Len=0 TSval=8230871 TSecr=15162373
  733 31.506889549  10.6.15.156 → 192.168.1.12 SSH 254 Server: Encrypted packet (len=188)
  734 31.506907195 192.168.1.12 → 10.6.15.156  TCP 66 54766 → 22 [ACK] Seq=7113 Ack=92281 Win=6155 Len=0 TSval=8230897 TSecr=15162398
  735 31.728181916  10.6.15.156 → 192.168.1.12 SSH 390 Server: Encrypted packet (len=324)
  736 31.728199380 192.168.1.12 → 10.6.15.156  TCP 66 54766 → 22 [ACK] Seq=7113 Ack=92605 Win=6155 Len=0 TSval=8230952 TSecr=15162454
  737 31.797647575  10.6.15.156 → 192.168.1.12 SSH 486 Server: Encrypted packet (len=420)
  738 31.797666229 192.168.1.12 → 10.6.15.156  TCP 66 54766 → 22 [ACK] Seq=7113 Ack=93025 Win=6155 Len=0 TSval=8230970 TSecr=15162471
  739 31.855408703  10.6.15.156 → 192.168.1.12 SSH 486 Server: Encrypted packet (len=420)
  740 31.855426835 192.168.1.12 → 10.6.15.156  TCP 66 54766 → 22 [ACK] Seq=7113 Ack=93445 Win=6155 Len=0 TSval=8230984 TSecr=15162485
  741 31.957983913  10.6.15.156 → 192.168.1.12 SSH 390 Server: Encrypted packet (len=324)
  742 31.958001220 192.168.1.12 → 10.6.15.156  TCP 66 54766 → 22 [ACK] Seq=7113 Ack=93769 Win=6155 Len=0 TSval=8231010 TSecr=15162511
  743 33.080926858  10.6.15.156 → 192.168.1.12 SSH 358 Server: Encrypted packet (len=292)
  744 33.080945625 192.168.1.12 → 10.6.15.156  TCP 66 54766 → 22 [ACK] Seq=7113 Ack=94061 Win=6155 Len=0 TSval=8231291 TSecr=15162792
  745 33.152098197  10.6.15.156 → 192.168.1.12 SSH 358 Server: Encrypted packet (len=292)
  746 33.152115336 192.168.1.12 → 10.6.15.156  TCP 66 54766 → 22 [ACK] Seq=7113 Ack=94353 Win=6155 Len=0 TSval=8231308 TSecr=15162809
  747 33.210995767  10.6.15.156 → 192.168.1.12 SSH 358 Server: Encrypted packet (len=292)
  748 33.211014610 192.168.1.12 → 10.6.15.156  TCP 66 54766 → 22 [ACK] Seq=7113 Ack=94645 Win=6155 Len=0 TSval=8231323 TSecr=15162824
  749 33.316112711  10.6.15.156 → 192.168.1.12 SSH 374 Server: Encrypted packet (len=308)
  750 33.316127816 192.168.1.12 → 10.6.15.156  TCP 66 54766 → 22 [ACK] Seq=7113 Ack=94953 Win=6155 Len=0 TSval=8231349 TSecr=15162849
  751 33.532141604  10.6.15.156 → 192.168.1.12 SSH 238 Server: Encrypted packet (len=172)
  752 33.532159044 192.168.1.12 → 10.6.15.156  TCP 66 54766 → 22 [ACK] Seq=7113 Ack=95125 Win=6155 Len=0 TSval=8231403 TSecr=15162905
  753 33.602769520  10.6.15.156 → 192.168.1.12 SSH 270 Server: Encrypted packet (len=204)
  754 33.602787115 192.168.1.12 → 10.6.15.156  TCP 66 54766 → 22 [ACK] Seq=7113 Ack=95329 Win=6155 Len=0 TSval=8231421 TSecr=15162922
  755 33.659217283  10.6.15.156 → 192.168.1.12 SSH 270 Server: Encrypted packet (len=204)
  756 33.659236146 192.168.1.12 → 10.6.15.156  TCP 66 54766 → 22 [ACK] Seq=7113 Ack=95533 Win=6155 Len=0 TSval=8231435 TSecr=15162936
  757 33.761801679  10.6.15.156 → 192.168.1.12 SSH 238 Server: Encrypted packet (len=172)
  758 33.761819327 192.168.1.12 → 10.6.15.156  TCP 66 54766 → 22 [ACK] Seq=7113 Ack=95705 Win=6155 Len=0 TSval=8231461 TSecr=15162962
  759 33.982922872  10.6.15.156 → 192.168.1.12 SSH 182 Server: Encrypted packet (len=116)
  760 33.982940343 192.168.1.12 → 10.6.15.156  TCP 66 54766 → 22 [ACK] Seq=7113 Ack=95821 Win=6155 Len=0 TSval=8231516 TSecr=15163017
