    1 0.000000000  10.6.15.156 → 192.168.1.12 SSH 134 Server: Encrypted packet (len=68)
    2 0.000016958 192.168.1.12 → 10.6.15.156  TCP 66 54766 → 22 [ACK] Seq=1 Ack=69 Win=4866 Len=0 TSval=7629455 TSecr=14560947
    3 0.001034888  10.6.15.156 → 192.168.1.12 SSH 1514 Server: Encrypted packet (len=1448)
    4 0.001052412 192.168.1.12 → 10.6.15.156  TCP 66 54766 → 22 [ACK] Seq=1 Ack=1517 Win=4866 Len=0 TSval=7629455 TSecr=14560947
    5 0.001186765  10.6.15.156 → 192.168.1.12 SSH 1514 Server: Encrypted packet (len=1448)
    6 0.001192729 192.168.1.12 → 10.6.15.156  TCP 66 54766 → 22 [ACK] Seq=1 Ack=2965 Win=4866 Len=0 TSval=7629455 TSecr=14560947
    7 0.001734288  10.6.15.156 → 192.168.1.12 SSH 110 Server: Encrypted packet (len=44)
    8 0.001752314 192.168.1.12 → 10.6.15.156  TCP 66 54766 → 22 [ACK] Seq=1 Ack=3009 Win=4866 Len=0 TSval=7629455 TSecr=14560947
    9 0.002930192  10.6.15.156 → 192.168.1.12 SSH 1514 Server: Encrypted packet (len=1448)
   10 0.002948324 192.168.1.12 → 10.6.15.156  TCP 66 54766 → 22 [ACK] Seq=1 Ack=4457 Win=4866 Len=0 TSval=7629455 TSecr=14560948
   11 0.003043216  10.6.15.156 → 192.168.1.12 SSH 1514 Server: Encrypted packet (len=1448)
   12 0.003046903 192.168.1.12 → 10.6.15.156  TCP 66 54766 → 22 [ACK] Seq=1 Ack=5905 Win=4866 Len=0 TSval=7629455 TSecr=14560948
   13 0.003265237  10.6.15.156 → 192.168.1.12 SSH 1514 Server: Encrypted packet (len=1448)
   14 0.003268863 192.168.1.12 → 10.6.15.156  TCP 66 54766 → 22 [ACK] Seq=1 Ack=7353 Win=4866 Len=0 TSval=7629455 TSecr=14560948
   15 0.003427269  10.6.15.156 → 192.168.1.12 SSH 1514 Server: Encrypted packet (len=1448)
   16 0.003433454 192.168.1.12 → 10.6.15.156  TCP 66 54766 → 22 [ACK] Seq=1 Ack=8801 Win=4866 Len=0 TSval=7629456 TSecr=14560948
   17 0.006709467  10.6.15.156 → 192.168.1.12 SSH 110 Server: Encrypted packet (len=44)
   18 0.006725318 192.168.1.12 → 10.6.15.156  TCP 66 54766 → 22 [ACK] Seq=1 Ack=8845 Win=4866 Len=0 TSval=7629456 TSecr=14560948
   19 0.006907887  10.6.15.156 → 192.168.1.12 SSH 1514 Server: Encrypted packet (len=1448)
   20 0.006914030 192.168.1.12 → 10.6.15.156  TCP 66 54766 → 22 [ACK] Seq=1 Ack=10293 Win=4866 Len=0 TSval=7629456 TSecr=14560948
   21 0.008650020  10.6.15.156 → 192.168.1.12 SSH 1514 Server: Encrypted packet (len=1448)
   22 0.008668709 192.168.1.12 → 10.6.15.156  TCP 66 54766 → 22 [ACK] Seq=1 Ack=11741 Win=4866 Len=0 TSval=7629457 TSecr=14560949
   23 0.009265255  10.6.15.156 → 192.168.1.12 SSH 1514 Server: Encrypted packet (len=1448)
   24 0.009284218 192.168.1.12 → 10.6.15.156  TCP 66 54766 → 22 [ACK] Seq=1 Ack=13189 Win=4866 Len=0 TSval=7629457 TSecr=14560949
   25 0.009392104  10.6.15.156 → 192.168.1.12 SSH 1514 Server: Encrypted packet (len=1448)
   26 0.009397940 192.168.1.12 → 10.6.15.156  TCP 66 54766 → 22 [ACK] Seq=1 Ack=14637 Win=4866 Len=0 TSval=7629457 TSecr=14560949
   27 0.010212797  10.6.15.156 → 192.168.1.12 SSH 1514 Server: Encrypted packet (len=1448)
   28 0.010230534 192.168.1.12 → 10.6.15.156  TCP 66 54766 → 22 [ACK] Seq=1 Ack=16085 Win=4866 Len=0 TSval=7629457 TSecr=14560950
   29 0.014294840  10.6.15.156 → 192.168.1.12 SSH 1514 Server: Encrypted packet (len=1448)
   30 0.014307495 192.168.1.12 → 10.6.15.156  TCP 66 54766 → 22 [ACK] Seq=1 Ack=17533 Win=4866 Len=0 TSval=7629458 TSecr=14560951
   31 0.014856748  10.6.15.156 → 192.168.1.12 SSH 1514 Server: Encrypted packet (len=1448)
   32 0.014863093 192.168.1.12 → 10.6.15.156  TCP 66 54766 → 22 [ACK] Seq=1 Ack=18981 Win=4866 Len=0 TSval=7629458 TSecr=14560951
   33 0.015047651  10.6.15.156 → 192.168.1.12 SSH 1514 Server: Encrypted packet (len=1448)
   34 0.015054361  10.6.15.156 → 192.168.1.12 SSH 174 Server: Encrypted packet (len=108)
   35 0.015059731 192.168.1.12 → 10.6.15.156  TCP 66 54766 → 22 [ACK] Seq=1 Ack=20537 Win=4866 Len=0 TSval=7629458 TSecr=14560951
   36 0.096682211  10.6.15.156 → 192.168.1.12 SSH 1514 Server: Encrypted packet (len=1448)
   37 0.096821562  10.6.15.156 → 192.168.1.12 SSH 1514 Server: Encrypted packet (len=1448)
   38 0.096832865 192.168.1.12 → 10.6.15.156  TCP 66 54766 → 22 [ACK] Seq=1 Ack=23433 Win=4866 Len=0 TSval=7629479 TSecr=14560971
   39 0.097028071  10.6.15.156 → 192.168.1.12 SSH 1514 Server: Encrypted packet (len=1448)
   40 0.097234141  10.6.15.156 → 192.168.1.12 SSH 1514 Server: Encrypted packet (len=1448)
   41 0.097253551 192.168.1.12 → 10.6.15.156  TCP 66 54766 → 22 [ACK] Seq=1 Ack=26329 Win=4866 Len=0 TSval=7629479 TSecr=14560971
   42 0.097275323  10.6.15.156 → 192.168.1.12 SSH 110 Server: Encrypted packet (len=44)
   43 0.097345946 192.168.1.12 → 10.6.15.156  TCP 66 54766 → 22 [ACK] Seq=1 Ack=26373 Win=4866 Len=0 TSval=7629479 TSecr=14560971
   44 0.097418175  10.6.15.156 → 192.168.1.12 SSH 1514 Server: Encrypted packet (len=1448)
   45 0.098543115  10.6.15.156 → 192.168.1.12 SSH 1514 Server: Encrypted packet (len=1448)
   46 0.098548770 192.168.1.12 → 10.6.15.156  TCP 66 54766 → 22 [ACK] Seq=1 Ack=29269 Win=4866 Len=0 TSval=7629479 TSecr=14560972
   47 0.098707815  10.6.15.156 → 192.168.1.12 SSH 1514 Server: Encrypted packet (len=1448)
   48 0.098926864  10.6.15.156 → 192.168.1.12 SSH 1514 Server: Encrypted packet (len=1448)
   49 0.098932287 192.168.1.12 → 10.6.15.156  TCP 66 54766 → 22 [ACK] Seq=1 Ack=32165 Win=4866 Len=0 TSval=7629479 TSecr=14560972
   50 0.099075257  10.6.15.156 → 192.168.1.12 SSH 1262 Server: Encrypted packet (len=1196)
   51 0.099137247 192.168.1.12 → 10.6.15.156  TCP 66 54766 → 22 [ACK] Seq=1 Ack=33361 Win=4866 Len=0 TSval=7629479 TSecr=14560972
   52 0.728326042 192.168.1.12 → 10.6.15.156  SSH 1514 Client: Encrypted packet (len=1448)
   53 0.748036789 192.168.1.12 → 10.6.15.156  SSH 1514 Client: Encrypted packet (len=1448)
   54 0.748861828 192.168.1.12 → 10.6.15.156  SSH 82 Client: Encrypted packet (len=16)
   55 0.750586498  10.6.15.156 → 192.168.1.12 TCP 66 22 → 54766 [ACK] Seq=33361 Ack=2913 Win=1452 Len=0 TSval=14561136 TSecr=7629637
   56 0.789699252 192.168.1.12 → 10.6.15.156  SSH 262 Client: Encrypted packet (len=196)
   57 0.831110210  10.6.15.156 → 192.168.1.12 TCP 66 22 → 54766 [ACK] Seq=33361 Ack=3109 Win=1452 Len=0 TSval=14561157 TSecr=7629652
   58 0.935726054  10.6.15.156 → 192.168.1.12 SSH 174 Server: Encrypted packet (len=108)
   59 0.935742172 192.168.1.12 → 10.6.15.156  TCP 66 54766 → 22 [ACK] Seq=3109 Ack=33469 Win=4866 Len=0 TSval=7629689 TSecr=14561183
   60 0.939854454  10.6.15.156 → 192.168.1.12 SSH 302 Server: Encrypted packet (len=236)
   61 0.939861560 192.168.1.12 → 10.6.15.156  TCP 66 54766 → 22 [ACK] Seq=3109 Ack=33705 Win=4866 Len=0 TSval=7629690 TSecr=14561184
   62 0.946779958  10.6.15.156 → 192.168.1.12 SSH 278 Server: Encrypted packet (len=212)
   63 0.946796829 192.168.1.12 → 10.6.15.156  TCP 66 54766 → 22 [ACK] Seq=3109 Ack=33917 Win=4866 Len=0 TSval=7629691 TSecr=14561185
   64 0.948614014  10.6.15.156 → 192.168.1.12 SSH 374 Server: Encrypted packet (len=308)
   65 0.948633986 192.168.1.12 → 10.6.15.156  TCP 66 54766 → 22 [ACK] Seq=3109 Ack=34225 Win=4866 Len=0 TSval=7629692 TSecr=14561186
   66 0.980410473 192.168.1.12 → 10.6.15.156  SSH 382 Client: Encrypted packet (len=316)
   67 0.982108130  10.6.15.156 → 192.168.1.12 TCP 66 22 → 54766 [ACK] Seq=34225 Ack=3425 Win=1452 Len=0 TSval=14561194 TSecr=7629700
   68 0.982133936 192.168.1.12 → 10.6.15.156  SSH 142 Client: Encrypted packet (len=76)
   69 0.983708475  10.6.15.156 → 192.168.1.12 TCP 66 22 → 54766 [ACK] Seq=34225 Ack=3501 Win=1452 Len=0 TSval=14561195 TSecr=7629700
   70 1.010593326  10.6.15.156 → 192.168.1.12 SSH 166 Server: Encrypted packet (len=100)
   71 1.051325490 192.168.1.12 → 10.6.15.156  TCP 66 54766 → 22 [ACK] Seq=3501 Ack=34325 Win=4866 Len=0 TSval=7629718 TSecr=14561201
   72 1.082711996  10.6.15.156 → 192.168.1.12 SSH 294 Server: Encrypted packet (len=228)
   73 1.082738075 192.168.1.12 → 10.6.15.156  TCP 66 54766 → 22 [ACK] Seq=3501 Ack=34553 Win=4866 Len=0 TSval=7629725 TSecr=14561219
   74 1.132266651  10.6.15.156 → 192.168.1.12 SSH 190 Server: Encrypted packet (len=124)
   75 1.132275837 192.168.1.12 → 10.6.15.156  SSH 654 Client: Encrypted packet (len=588)
   76 1.132290575 192.168.1.12 → 10.6.15.156  TCP 66 54766 → 22 [ACK] Seq=4089 Ack=34677 Win=4866 Len=0 TSval=7629738 TSecr=14561231
   77 1.134445517 192.168.1.12 → 10.6.15.156  SSH 486 Client: Encrypted packet (len=420)
   78 1.136284149  10.6.15.156 → 192.168.1.12 TCP 66 22 → 54766 [ACK] Seq=34677 Ack=4509 Win=1452 Len=0 TSval=14561233 TSecr=7629738
   79 1.139325892  10.6.15.156 → 192.168.1.12 SSH 446 Server: Encrypted packet (len=380)
   80 1.183324263 192.168.1.12 → 10.6.15.156  TCP 66 54766 → 22 [ACK] Seq=4509 Ack=35057 Win=4866 Len=0 TSval=7629751 TSecr=14561234
   81 1.199550285 192.168.1.12 → 10.6.15.156  SSH 862 Client: Encrypted packet (len=796)
   82 1.218515158 192.168.1.12 → 10.6.15.156  SSH 1514 Client: Encrypted packet (len=1448)
   83 1.221019559  10.6.15.156 → 192.168.1.12 TCP 66 22 → 54766 [ACK] Seq=35057 Ack=6753 Win=1452 Len=0 TSval=14561254 TSecr=7629755
   84 1.221044080 192.168.1.12 → 10.6.15.156  SSH 1006 Client: Encrypted packet (len=940)
   85 1.263068707  10.6.15.156 → 192.168.1.12 TCP 66 22 → 54766 [ACK] Seq=35057 Ack=7693 Win=1452 Len=0 TSval=14561265 TSecr=7629760
   86 1.294663504 192.168.1.12 → 10.6.15.156  SSH 1514 Client: Encrypted packet (len=1448)
   87 1.295493766 192.168.1.12 → 10.6.15.156  SSH 1430 Client: Encrypted packet (len=1364)
   88 1.297538141  10.6.15.156 → 192.168.1.12 TCP 66 22 → 54766 [ACK] Seq=35057 Ack=9141 Win=1452 Len=0 TSval=14561273 TSecr=7629778
   89 1.297668489  10.6.15.156 → 192.168.1.12 TCP 66 22 → 54766 [ACK] Seq=35057 Ack=10505 Win=1452 Len=0 TSval=14561273 TSecr=7629779
   90 1.332180758  10.6.15.156 → 192.168.1.12 SSH 262 Server: Encrypted packet (len=196)
   91 1.332242108 192.168.1.12 → 10.6.15.156  TCP 66 54766 → 22 [ACK] Seq=10505 Ack=35253 Win=4866 Len=0 TSval=7629788 TSecr=14561282
   92 1.418850631  10.6.15.156 → 192.168.1.12 SSH 454 Server: Encrypted packet (len=388)
   93 1.418926460 192.168.1.12 → 10.6.15.156  TCP 66 54766 → 22 [ACK] Seq=10505 Ack=35641 Win=4866 Len=0 TSval=7629809 TSecr=14561303
   94 1.435893107  10.6.15.156 → 192.168.1.12 SSH 454 Server: Encrypted packet (len=388)
   95 1.435972895 192.168.1.12 → 10.6.15.156  TCP 66 54766 → 22 [ACK] Seq=10505 Ack=36029 Win=4866 Len=0 TSval=7629814 TSecr=14561308
   96 1.439542063  10.6.15.156 → 192.168.1.12 SSH 454 Server: Encrypted packet (len=388)
   97 1.439558830  10.6.15.156 → 192.168.1.12 SSH 454 Server: Encrypted packet (len=388)
   98 1.439620184 192.168.1.12 → 10.6.15.156  TCP 66 54766 → 22 [ACK] Seq=10505 Ack=36805 Win=4866 Len=0 TSval=7629815 TSecr=14561308
   99 1.487350630  10.6.15.156 → 192.168.1.12 SSH 294 Server: Encrypted packet (len=228)
  100 1.487435173 192.168.1.12 → 10.6.15.156  TCP 66 54766 → 22 [ACK] Seq=10505 Ack=37033 Win=4866 Len=0 TSval=7629827 TSecr=14561321
  101 2.133086523 192.168.1.12 → 10.6.15.156  SSH 334 Client: Encrypted packet (len=268)
  102 2.175202080  10.6.15.156 → 192.168.1.12 TCP 66 22 → 54766 [ACK] Seq=37033 Ack=10773 Win=1452 Len=0 TSval=14561493 TSecr=7629988
  103 2.192336617 192.168.1.12 → 10.6.15.156  SSH 862 Client: Encrypted packet (len=796)
  104 2.194384520  10.6.15.156 → 192.168.1.12 TCP 66 22 → 54766 [ACK] Seq=37033 Ack=11569 Win=1452 Len=0 TSval=14561497 TSecr=7630003
  105 2.278375727  10.6.15.156 → 192.168.1.12 SSH 190 Server: Encrypted packet (len=124)
  106 2.278405115 192.168.1.12 → 10.6.15.156  TCP 66 54766 → 22 [ACK] Seq=11569 Ack=37157 Win=4866 Len=0 TSval=7630024 TSecr=14561518
  107 2.412145457  10.6.15.156 → 192.168.1.12 SSH 462 Server: Encrypted packet (len=396)
  108 2.412162353 192.168.1.12 → 10.6.15.156  TCP 66 54766 → 22 [ACK] Seq=11569 Ack=37553 Win=4866 Len=0 TSval=7630058 TSecr=14561551
  109 2.439958051  10.22.18.52 → 224.0.0.252  LLMNR 64 Standard query 0x4f09 A wpad
  110 2.850645534  10.22.18.52 → 224.0.0.252  LLMNR 64 Standard query 0x4f09 A wpad
  111 3.524747395 192.168.1.12 → 10.6.15.156  SSH 614 Client: Encrypted packet (len=548)
  112 3.526966764  10.6.15.156 → 192.168.1.12 TCP 66 22 → 54766 [ACK] Seq=37553 Ack=12117 Win=1452 Len=0 TSval=14561830 TSecr=7630336
  113 3.723200421  10.6.15.156 → 192.168.1.12 SSH 262 Server: Encrypted packet (len=196)
  114 3.723236320 192.168.1.12 → 10.6.15.156  TCP 66 54766 → 22 [ACK] Seq=12117 Ack=37749 Win=4866 Len=0 TSval=7630385 TSecr=14561880
  115 4.966678473  192.168.1.1 → 239.255.255.250 SSDP 304 NOTIFY * HTTP/1.1 
  116 4.969685694  192.168.1.1 → 239.255.255.250 SSDP 313 NOTIFY * HTTP/1.1 
  117 4.973080271  192.168.1.1 → 239.255.255.250 SSDP 368 NOTIFY * HTTP/1.1 
  118 4.976570003  192.168.1.1 → 239.255.255.250 SSDP 378 NOTIFY * HTTP/1.1 
  119 4.979490981  192.168.1.1 → 239.255.255.250 SSDP 304 NOTIFY * HTTP/1.1 
  120 4.982522589  192.168.1.1 → 239.255.255.250 SSDP 313 NOTIFY * HTTP/1.1 
  121 4.985887231  192.168.1.1 → 239.255.255.250 SSDP 368 NOTIFY * HTTP/1.1 
  122 4.989387596  192.168.1.1 → 239.255.255.250 SSDP 378 NOTIFY * HTTP/1.1 
  123 7.197632409 192.168.1.12 → 10.6.15.156  SSH 862 Client: Encrypted packet (len=796)
  124 7.198275765 192.168.1.12 → 10.6.15.156  SSH 1514 Client: Encrypted packet (len=1448)
  125 7.199075410 192.168.1.12 → 10.6.15.156  SSH 1006 Client: Encrypted packet (len=940)
  126 7.200090338  10.6.15.156 → 192.168.1.12 TCP 66 22 → 54766 [ACK] Seq=37749 Ack=12913 Win=1452 Len=0 TSval=14562749 TSecr=7631254
  127 7.200655421  10.6.15.156 → 192.168.1.12 TCP 66 22 → 54766 [ACK] Seq=37749 Ack=14361 Win=1452 Len=0 TSval=14562749 TSecr=7631254
  128 7.201166706  10.6.15.156 → 192.168.1.12 TCP 66 22 → 54766 [ACK] Seq=37749 Ack=15301 Win=1452 Len=0 TSval=14562749 TSecr=7631254
  129 7.415121986  10.6.15.156 → 192.168.1.12 SSH 454 Server: Encrypted packet (len=388)
  130 7.415148117 192.168.1.12 → 10.6.15.156  TCP 66 54766 → 22 [ACK] Seq=15301 Ack=38137 Win=4866 Len=0 TSval=7631308 TSecr=14562802
  131 7.416437545  10.6.15.156 → 192.168.1.12 SSH 454 Server: Encrypted packet (len=388)
  132 7.416456341 192.168.1.12 → 10.6.15.156  TCP 66 54766 → 22 [ACK] Seq=15301 Ack=38525 Win=4866 Len=0 TSval=7631309 TSecr=14562803
  133 7.416909056  10.6.15.156 → 192.168.1.12 SSH 454 Server: Encrypted packet (len=388)
  134 7.416916204 192.168.1.12 → 10.6.15.156  TCP 66 54766 → 22 [ACK] Seq=15301 Ack=38913 Win=4866 Len=0 TSval=7631309 TSecr=14562803
  135 7.418132979  10.6.15.156 → 192.168.1.12 SSH 454 Server: Encrypted packet (len=388)
  136 7.418150476 192.168.1.12 → 10.6.15.156  TCP 66 54766 → 22 [ACK] Seq=15301 Ack=39301 Win=4866 Len=0 TSval=7631309 TSecr=14562803
  137 8.193819338 192.168.1.12 → 10.6.15.156  SSH 862 Client: Encrypted packet (len=796)
  138 8.197887555  10.6.15.156 → 192.168.1.12 TCP 66 22 → 54766 [ACK] Seq=39301 Ack=16097 Win=1452 Len=0 TSval=14562998 TSecr=7631503
  139 8.412979360  10.6.15.156 → 192.168.1.12 SSH 454 Server: Encrypted packet (len=388)
  140 8.413004549 192.168.1.12 → 10.6.15.156  TCP 66 54766 → 22 [ACK] Seq=16097 Ack=39689 Win=4866 Len=0 TSval=7631558 TSecr=14563052
  141 8.739900989 10.22.17.139 → 224.0.0.252  LLMNR 64 Standard query 0xc768 A wpad
  142 8.740252073 10.22.17.139 → 224.0.0.252  LLMNR 64 Standard query 0xec4f A wpad
  143 9.152666637 10.22.17.139 → 224.0.0.252  LLMNR 64 Standard query 0xc768 A wpad
  144 9.152730641 10.22.17.139 → 224.0.0.252  LLMNR 64 Standard query 0xec4f A wpad
  145 10.474010923 10.22.17.139 → 224.0.0.252  LLMNR 72 Standard query 0x02d5 A pyngpmavwizc
  146 10.780420838 192.168.1.12 → 10.6.15.156  SSH 1514 Client: Encrypted packet (len=1448)
  147 10.786439713  10.6.15.156 → 192.168.1.12 TCP 66 22 → 54766 [ACK] Seq=39689 Ack=17545 Win=1452 Len=0 TSval=14563645 TSecr=7632150
  148 10.786458528 192.168.1.12 → 10.6.15.156  SSH 382 Client: Encrypted packet (len=316)
  149 10.788376791  10.6.15.156 → 192.168.1.12 TCP 66 22 → 54766 [ACK] Seq=39689 Ack=17861 Win=1452 Len=0 TSval=14563646 TSecr=7632151
  150 10.791339555  10.6.15.156 → 192.168.1.12 SSH 142 Server: Encrypted packet (len=76)
  151 10.791357321 192.168.1.12 → 10.6.15.156  TCP 66 54766 → 22 [ACK] Seq=17861 Ack=39765 Win=4866 Len=0 TSval=7632153 TSecr=14563647
  152 10.891453353 10.22.17.139 → 224.0.0.252  LLMNR 72 Standard query 0x02d5 A pyngpmavwizc
  153 10.912503209  10.6.15.156 → 192.168.1.12 SSH 926 Server: Encrypted packet (len=860)
  154 10.912521958 192.168.1.12 → 10.6.15.156  TCP 66 54766 → 22 [ACK] Seq=17861 Ack=40625 Win=4866 Len=0 TSval=7632183 TSecr=14563677
  155 10.912964057  10.6.15.156 → 192.168.1.12 SSH 406 Server: Encrypted packet (len=340)
  156 10.912971577 192.168.1.12 → 10.6.15.156  TCP 66 54766 → 22 [ACK] Seq=17861 Ack=40965 Win=4866 Len=0 TSval=7632183 TSecr=14563677
  157 10.913511021 192.168.1.12 → 10.6.15.156  SSH 134 Client: Encrypted packet (len=68)
  158 10.955038996  10.6.15.156 → 192.168.1.12 TCP 66 22 → 54766 [ACK] Seq=40965 Ack=17929 Win=1452 Len=0 TSval=14563688 TSecr=7632183
  159 12.492923767 10.22.17.139 → 224.0.0.252  LLMNR 75 Standard query 0xe757 A wnhxdzynldjpebw
  160 12.493305681 10.22.17.139 → 224.0.0.252  LLMNR 70 Standard query 0x95d9 A lozpexdyug
  161 12.909242104 10.22.17.139 → 224.0.0.252  LLMNR 75 Standard query 0xe757 A wnhxdzynldjpebw
  162 12.909626118 10.22.17.139 → 224.0.0.252  LLMNR 70 Standard query 0x95d9 A lozpexdyug
  163 13.198515112 192.168.1.12 → 10.6.15.156  SSH 102 Client: Encrypted packet (len=36)
  164 13.198749912 192.168.1.12 → 10.6.15.156  SSH 174 Client: Encrypted packet (len=108)
  165 13.200403727 192.168.1.12 → 10.6.15.156  SSH 1514 Client: Encrypted packet (len=1448)
  166 13.201282513 192.168.1.12 → 10.6.15.156  SSH 1514 Client: Encrypted packet (len=1448)
  167 13.202151708 192.168.1.12 → 10.6.15.156  SSH 1514 Client: Encrypted packet (len=1448)
  168 13.203113948  10.6.15.156 → 192.168.1.12 TCP 66 22 → 54766 [ACK] Seq=40965 Ack=17965 Win=1452 Len=0 TSval=14564249 TSecr=7632754
  169 13.203126488 192.168.1.12 → 10.6.15.156  SSH 758 Client: Encrypted packet (len=692)
  170 13.203135467  10.6.15.156 → 192.168.1.12 TCP 66 22 → 54766 [ACK] Seq=40965 Ack=18073 Win=1452 Len=0 TSval=14564249 TSecr=7632754
  171 13.204122716  10.6.15.156 → 192.168.1.12 TCP 66 22 → 54766 [ACK] Seq=40965 Ack=19521 Win=1452 Len=0 TSval=14564249 TSecr=7632755
  172 13.204986555  10.6.15.156 → 192.168.1.12 SSH 194 Server: Encrypted packet (len=128)
  173 13.205009112  10.6.15.156 → 192.168.1.12 SSH 210 Server: Encrypted packet (len=144)
  174 13.205071642 192.168.1.12 → 10.6.15.156  TCP 66 54766 → 22 [ACK] Seq=23109 Ack=41237 Win=4866 Len=0 TSval=7632756 TSecr=14564250
  175 13.205329487 192.168.1.12 → 10.6.15.156  SSH 138 Client: Encrypted packet (len=72)
  176 13.205690690  10.6.15.156 → 192.168.1.12 TCP 66 22 → 54766 [ACK] Seq=41237 Ack=22417 Win=1452 Len=0 TSval=14564250 TSecr=7632755
  177 13.207576706  10.6.15.156 → 192.168.1.12 TCP 66 22 → 54766 [ACK] Seq=41237 Ack=23181 Win=1452 Len=0 TSval=14564250 TSecr=7632755
  178 13.236840292  10.6.15.156 → 192.168.1.12 SSH 138 Server: Encrypted packet (len=72)
  179 13.237044588 192.168.1.12 → 10.6.15.156  SSH 102 Client: Encrypted packet (len=36)
  180 13.239009618  10.6.15.156 → 192.168.1.12 SSH 138 Server: Encrypted packet (len=72)
  181 13.239203326 192.168.1.12 → 10.6.15.156  SSH 102 Client: Encrypted packet (len=36)
  182 13.279835162  10.6.15.156 → 192.168.1.12 TCP 66 22 → 54766 [ACK] Seq=41381 Ack=23253 Win=1452 Len=0 TSval=14564269 TSecr=7632764
  183 13.360408569  10.6.15.156 → 192.168.1.12 SSH 502 Server: Encrypted packet (len=436)
  184 13.403376831 192.168.1.12 → 10.6.15.156  TCP 66 54766 → 22 [ACK] Seq=23253 Ack=41817 Win=4866 Len=0 TSval=7632806 TSecr=14564289
  185 13.420382926  10.6.15.156 → 192.168.1.12 SSH 454 Server: Encrypted packet (len=388)
  186 13.420409279 192.168.1.12 → 10.6.15.156  TCP 66 54766 → 22 [ACK] Seq=23253 Ack=42205 Win=4866 Len=0 TSval=7632810 TSecr=14564304
  187 13.420423089  10.6.15.156 → 192.168.1.12 SSH 454 Server: Encrypted packet (len=388)
  188 13.420428550 192.168.1.12 → 10.6.15.156  TCP 66 54766 → 22 [ACK] Seq=23253 Ack=42593 Win=4866 Len=0 TSval=7632810 TSecr=14564304
  189 13.420435119  10.6.15.156 → 192.168.1.12 SSH 454 Server: Encrypted packet (len=388)
  190 13.420437994 192.168.1.12 → 10.6.15.156  TCP 66 54766 → 22 [ACK] Seq=23253 Ack=42981 Win=4866 Len=0 TSval=7632810 TSecr=14564304
  191 13.422295142  10.6.15.156 → 192.168.1.12 SSH 454 Server: Encrypted packet (len=388)
  192 13.422313131 192.168.1.12 → 10.6.15.156  TCP 66 54766 → 22 [ACK] Seq=23253 Ack=43369 Win=4866 Len=0 TSval=7632810 TSecr=14564304
  193 14.191227356 192.168.1.12 → 10.6.15.156  SSH 862 Client: Encrypted packet (len=796)
  194 14.193403138  10.6.15.156 → 192.168.1.12 TCP 66 22 → 54766 [ACK] Seq=43369 Ack=24049 Win=1452 Len=0 TSval=14564497 TSecr=7633002
  195 14.274992021 192.168.1.12 → 192.168.1.1  DNS 74 Standard query 0x4002 A ntp.ubuntu.com
  196 14.408850678  10.6.15.156 → 192.168.1.12 SSH 454 Server: Encrypted packet (len=388)
  197 14.408876770 192.168.1.12 → 10.6.15.156  TCP 66 54766 → 22 [ACK] Seq=24049 Ack=43757 Win=4866 Len=0 TSval=7633057 TSecr=14564551
  198 16.189935111 192.168.1.12 → 10.6.15.156  SSH 1514 Client: Encrypted packet (len=1448)
  199 16.192610419  10.6.15.156 → 192.168.1.12 TCP 66 22 → 54766 [ACK] Seq=43757 Ack=25497 Win=1452 Len=0 TSval=14564997 TSecr=7633502
  200 16.192630015 192.168.1.12 → 10.6.15.156  SSH 470 Client: Encrypted packet (len=404)
  201 16.194401297  10.6.15.156 → 192.168.1.12 TCP 66 22 → 54766 [ACK] Seq=43757 Ack=25901 Win=1452 Len=0 TSval=14564997 TSecr=7633503
  202 16.348050950  10.6.15.156 → 192.168.1.12 SSH 494 Server: Encrypted packet (len=428)
  203 16.348069644 192.168.1.12 → 10.6.15.156  TCP 66 54766 → 22 [ACK] Seq=25901 Ack=44185 Win=4866 Len=0 TSval=7633542 TSecr=14565036
  204 17.273151366 192.168.1.12 → 139.59.50.38 NTP 90 NTP Version 4, client
  205 18.437883611 10.22.17.139 → 224.0.0.252  LLMNR 64 Standard query 0xda3e A wpad
  206 18.438779212 10.22.17.139 → 224.0.0.252  LLMNR 64 Standard query 0xc1e7 A wpad
  207 18.849917290 10.22.17.139 → 224.0.0.252  LLMNR 64 Standard query 0xc1e7 A wpad
  208 18.850362634 10.22.17.139 → 224.0.0.252  LLMNR 64 Standard query 0xda3e A wpad
  209 19.200972466 192.168.1.12 → 10.6.15.156  SSH 862 Client: Encrypted packet (len=796)
  210 19.201574479 192.168.1.12 → 10.6.15.156  SSH 1514 Client: Encrypted packet (len=1448)
  211 19.202471912 192.168.1.12 → 10.6.15.156  SSH 1006 Client: Encrypted packet (len=940)
  212 19.203201353  10.6.15.156 → 192.168.1.12 TCP 66 22 → 54766 [ACK] Seq=44185 Ack=26697 Win=1452 Len=0 TSval=14565750 TSecr=7634255
  213 19.205691685  10.6.15.156 → 192.168.1.12 TCP 66 22 → 54766 [ACK] Seq=44185 Ack=28145 Win=1452 Len=0 TSval=14565750 TSecr=7634255
  214 19.206071851  10.6.15.156 → 192.168.1.12 TCP 66 22 → 54766 [ACK] Seq=44185 Ack=29085 Win=1452 Len=0 TSval=14565750 TSecr=7634255
  215 19.367452208 192.168.1.12 → 192.168.1.1  DNS 74 Standard query 0x4002 A ntp.ubuntu.com
  216 19.369607649  192.168.1.1 → 192.168.1.12 DNS 138 Standard query response 0x4002 A ntp.ubuntu.com A 91.189.89.199 A 91.189.94.4 A 91.189.89.198 A 91.189.91.157
  217 19.370089744 192.168.1.12 → 91.189.89.199 NTP 90 NTP Version 4, client
  218 19.418135270  10.6.15.156 → 192.168.1.12 SSH 454 Server: Encrypted packet (len=388)
  219 19.418159221 192.168.1.12 → 10.6.15.156  TCP 66 54766 → 22 [ACK] Seq=29085 Ack=44573 Win=4866 Len=0 TSval=7634309 TSecr=14565803
  220 19.419169465  10.6.15.156 → 192.168.1.12 SSH 454 Server: Encrypted packet (len=388)
  221 19.419180797 192.168.1.12 → 10.6.15.156  TCP 66 54766 → 22 [ACK] Seq=29085 Ack=44961 Win=4866 Len=0 TSval=7634309 TSecr=14565804
  222 19.420119750  10.6.15.156 → 192.168.1.12 SSH 454 Server: Encrypted packet (len=388)
  223 19.420137025 192.168.1.12 → 10.6.15.156  TCP 66 54766 → 22 [ACK] Seq=29085 Ack=45349 Win=4866 Len=0 TSval=7634310 TSecr=14565804
  224 19.421561646  10.6.15.156 → 192.168.1.12 SSH 454 Server: Encrypted packet (len=388)
  225 19.421582539 192.168.1.12 → 10.6.15.156  TCP 66 54766 → 22 [ACK] Seq=29085 Ack=45737 Win=4866 Len=0 TSval=7634310 TSecr=14565804
  226 19.471584365 10.22.17.139 → 224.0.0.252  LLMNR 74 Standard query 0xfe16 A lzoixgpltlvfiv
  227 19.472062867 10.22.17.139 → 224.0.0.252  LLMNR 75 Standard query 0x4ba0 A dlnejmidphywzzl
  228 19.881618129 10.22.17.139 → 224.0.0.252  LLMNR 74 Standard query 0xfe16 A lzoixgpltlvfiv
  229 19.881980522 10.22.17.139 → 224.0.0.252  LLMNR 75 Standard query 0x4ba0 A dlnejmidphywzzl
  230 20.192412040 192.168.1.12 → 10.6.15.156  SSH 1514 Client: Encrypted packet (len=1448)
  231 20.195195909  10.6.15.156 → 192.168.1.12 TCP 66 22 → 54766 [ACK] Seq=45737 Ack=30533 Win=1452 Len=0 TSval=14565998 TSecr=7634503
  232 20.195216328 192.168.1.12 → 10.6.15.156  SSH 1266 Client: Encrypted packet (len=1200)
  233 20.197596900  10.6.15.156 → 192.168.1.12 TCP 66 22 → 54766 [ACK] Seq=45737 Ack=31733 Win=1452 Len=0 TSval=14565998 TSecr=7634503
  234 20.398819354  10.6.15.156 → 192.168.1.12 SSH 502 Server: Encrypted packet (len=436)
  235 20.398837297 192.168.1.12 → 10.6.15.156  TCP 66 54766 → 22 [ACK] Seq=31733 Ack=46173 Win=4866 Len=0 TSval=7634554 TSecr=14566048
  236 20.414635760  10.6.15.156 → 192.168.1.12 SSH 454 Server: Encrypted packet (len=388)
  237 20.414660794 192.168.1.12 → 10.6.15.156  TCP 66 54766 → 22 [ACK] Seq=31733 Ack=46561 Win=4866 Len=0 TSval=7634558 TSecr=14566052
  238 21.470562868 10.22.17.139 → 224.0.0.252  LLMNR 74 Standard query 0xb0b7 A cmzlzqquuzjasq
  239 21.471645554 10.22.17.139 → 224.0.0.252  LLMNR 74 Standard query 0x5b70 A cmzlzqquuzjasq
  240 21.883494034 10.22.17.139 → 224.0.0.252  LLMNR 74 Standard query 0x5b70 A cmzlzqquuzjasq
  241 21.883518574 10.22.17.139 → 224.0.0.252  LLMNR 74 Standard query 0xb0b7 A cmzlzqquuzjasq
  242 23.200090040 192.168.1.12 → 10.6.15.156  SSH 1514 Client: Encrypted packet (len=1448)
  243 23.203100785  10.6.15.156 → 192.168.1.12 TCP 66 22 → 54766 [ACK] Seq=46561 Ack=33181 Win=1452 Len=0 TSval=14566750 TSecr=7635255
  244 23.203122419 192.168.1.12 → 10.6.15.156  SSH 470 Client: Encrypted packet (len=404)
  245 23.206942124  10.6.15.156 → 192.168.1.12 TCP 66 22 → 54766 [ACK] Seq=46561 Ack=33585 Win=1452 Len=0 TSval=14566750 TSecr=7635255
  246 23.359901270  10.6.15.156 → 192.168.1.12 SSH 502 Server: Encrypted packet (len=436)
  247 23.359919882 192.168.1.12 → 10.6.15.156  TCP 66 54766 → 22 [ACK] Seq=33585 Ack=46997 Win=4866 Len=0 TSval=7635295 TSecr=14566789
  248 25.198843629 192.168.1.12 → 10.6.15.156  SSH 862 Client: Encrypted packet (len=796)
  249 25.199071071 192.168.1.12 → 10.6.15.156  SSH 1514 Client: Encrypted packet (len=1448)
  250 25.200209967 192.168.1.12 → 10.6.15.156  SSH 1006 Client: Encrypted packet (len=940)
  251 25.201205362  10.6.15.156 → 192.168.1.12 TCP 66 22 → 54766 [ACK] Seq=46997 Ack=34381 Win=1452 Len=0 TSval=14567249 TSecr=7635754
  252 25.202005932  10.6.15.156 → 192.168.1.12 TCP 66 22 → 54766 [ACK] Seq=46997 Ack=35829 Win=1452 Len=0 TSval=14567249 TSecr=7635754
  253 25.202581024  10.6.15.156 → 192.168.1.12 TCP 66 22 → 54766 [ACK] Seq=46997 Ack=36769 Win=1452 Len=0 TSval=14567250 TSecr=7635755
  254 25.416886029  10.6.15.156 → 192.168.1.12 SSH 454 Server: Encrypted packet (len=388)
  255 25.416912837 192.168.1.12 → 10.6.15.156  TCP 66 54766 → 22 [ACK] Seq=36769 Ack=47385 Win=4866 Len=0 TSval=7635809 TSecr=14567303
  256 25.417777677  10.6.15.156 → 192.168.1.12 SSH 842 Server: Encrypted packet (len=776)
  257 25.417791910 192.168.1.12 → 10.6.15.156  TCP 66 54766 → 22 [ACK] Seq=36769 Ack=48161 Win=4866 Len=0 TSval=7635809 TSecr=14567303
  258 25.417829010  10.6.15.156 → 192.168.1.12 SSH 454 Server: Encrypted packet (len=388)
  259 25.417835712 192.168.1.12 → 10.6.15.156  TCP 66 54766 → 22 [ACK] Seq=36769 Ack=48549 Win=4866 Len=0 TSval=7635809 TSecr=14567303
  260 25.460875040 10.22.17.139 → 224.0.0.252  LLMNR 74 Standard query 0x654b A lzoixgpltlvfiv
  261 25.873198032 10.22.17.139 → 224.0.0.252  LLMNR 74 Standard query 0x654b A lzoixgpltlvfiv
  262 26.189278203 192.168.1.12 → 10.6.15.156  SSH 862 Client: Encrypted packet (len=796)
  263 26.191492122  10.6.15.156 → 192.168.1.12 TCP 66 22 → 54766 [ACK] Seq=48549 Ack=37565 Win=1452 Len=0 TSval=14567497 TSecr=7636002
  264 26.406614608  10.6.15.156 → 192.168.1.12 SSH 454 Server: Encrypted packet (len=388)
  265 26.406642219 192.168.1.12 → 10.6.15.156  TCP 66 54766 → 22 [ACK] Seq=37565 Ack=48937 Win=4866 Len=0 TSval=7636056 TSecr=14567550
  266 27.463461991 10.22.17.139 → 224.0.0.252  LLMNR 75 Standard query 0x1aaa A dlnejmidphywzzl
  267 27.879403874 10.22.17.139 → 224.0.0.252  LLMNR 75 Standard query 0x1aaa A dlnejmidphywzzl
  268 29.195029472 192.168.1.12 → 10.6.15.156  SSH 1514 Client: Encrypted packet (len=1448)
  269 29.197759890  10.6.15.156 → 192.168.1.12 TCP 66 22 → 54766 [ACK] Seq=48937 Ack=39013 Win=1452 Len=0 TSval=14568248 TSecr=7636753
  270 29.197780931 192.168.1.12 → 10.6.15.156  SSH 470 Client: Encrypted packet (len=404)
  271 29.199554474  10.6.15.156 → 192.168.1.12 TCP 66 22 → 54766 [ACK] Seq=48937 Ack=39417 Win=1452 Len=0 TSval=14568249 TSecr=7636754
  272 29.367327110  10.6.15.156 → 192.168.1.12 SSH 502 Server: Encrypted packet (len=436)
  273 29.367346721 192.168.1.12 → 10.6.15.156  TCP 66 54766 → 22 [ACK] Seq=39417 Ack=49373 Win=4866 Len=0 TSval=7636796 TSecr=14568290
  274 29.482624765 10.22.17.139 → 224.0.0.252  LLMNR 64 Standard query 0x4030 A wpad
  275 29.483520278 10.22.17.139 → 224.0.0.252  LLMNR 64 Standard query 0x8a2d A wpad
  276 29.897894184 10.22.17.139 → 224.0.0.252  LLMNR 64 Standard query 0x4030 A wpad
  277 29.897918456 10.22.17.139 → 224.0.0.252  LLMNR 64 Standard query 0x8a2d A wpad
  278 31.203608341 192.168.1.12 → 10.6.15.156  SSH 862 Client: Encrypted packet (len=796)
  279 31.204264725 192.168.1.12 → 10.6.15.156  SSH 1514 Client: Encrypted packet (len=1448)
  280 31.211236491 192.168.1.12 → 10.6.15.156  SSH 1006 Client: Encrypted packet (len=940)
  281 31.211260540  10.6.15.156 → 192.168.1.12 TCP 66 22 → 54766 [ACK] Seq=49373 Ack=40213 Win=1452 Len=0 TSval=14568752 TSecr=7637256
  282 31.212734721  10.6.15.156 → 192.168.1.12 TCP 66 22 → 54766 [ACK] Seq=49373 Ack=41661 Win=1452 Len=0 TSval=14568752 TSecr=7637256
  283 31.213308632  10.6.15.156 → 192.168.1.12 TCP 66 22 → 54766 [ACK] Seq=49373 Ack=42601 Win=1452 Len=0 TSval=14568752 TSecr=7637257
  284 31.425947754  10.6.15.156 → 192.168.1.12 SSH 454 Server: Encrypted packet (len=388)
  285 31.425973711 192.168.1.12 → 10.6.15.156  TCP 66 54766 → 22 [ACK] Seq=42601 Ack=49761 Win=4866 Len=0 TSval=7637311 TSecr=14568805
  286 31.427674982  10.6.15.156 → 192.168.1.12 SSH 454 Server: Encrypted packet (len=388)
  287 31.427693602 192.168.1.12 → 10.6.15.156  TCP 66 54766 → 22 [ACK] Seq=42601 Ack=50149 Win=4866 Len=0 TSval=7637312 TSecr=14568806
  288 31.427732966  10.6.15.156 → 192.168.1.12 SSH 454 Server: Encrypted packet (len=388)
  289 31.427739358 192.168.1.12 → 10.6.15.156  TCP 66 54766 → 22 [ACK] Seq=42601 Ack=50537 Win=4866 Len=0 TSval=7637312 TSecr=14568806
  290 31.430401069  10.6.15.156 → 192.168.1.12 SSH 454 Server: Encrypted packet (len=388)
  291 31.430422456 192.168.1.12 → 10.6.15.156  TCP 66 54766 → 22 [ACK] Seq=42601 Ack=50925 Win=4866 Len=0 TSval=7637312 TSecr=14568806
  292 32.188972160 192.168.1.12 → 10.6.15.156  SSH 862 Client: Encrypted packet (len=796)
  293 32.191140590  10.6.15.156 → 192.168.1.12 TCP 66 22 → 54766 [ACK] Seq=50925 Ack=43397 Win=1452 Len=0 TSval=14568997 TSecr=7637502
  294 32.409188797  10.6.15.156 → 192.168.1.12 SSH 454 Server: Encrypted packet (len=388)
  295 32.409217625 192.168.1.12 → 10.6.15.156  TCP 66 54766 → 22 [ACK] Seq=43397 Ack=51313 Win=4866 Len=0 TSval=7637557 TSecr=14569051
